================================================================================
                        FULL GAME - Team_048 vs Team_088                        
================================================================================

================================================================================
                       1ST QUARTER - Team_048 vs Team_088                       
================================================================================

[12:00] Team_048 possession (Score: 0-0)
Kevin Fox attempts a Midrange. Contested by Tyler Hyland (5.4 feet, ZONE). Kevin Fox misses. Rebound secured by Giannis Smith.

[11:48] Team_088 possession (Score: 0-0)
FOUL! Offensive foul on Giannis Smith! Kevin Fox drew the charge! [Team fouls: 1] (Giannis Smith: 1 personal fouls) TURNOVER! (dead ball)

[11:34] Team_048 possession (Score: 0-0)
FOUL! Reach-in foul on Giannis Smith during the drive. [Team fouls: 2] No free throws, side out. (Giannis Smith: 2 personal fouls)

[11:21] Team_048 possession (Score: 0-0)
FOUL! Reach-in foul on Josh Duncan during the drive. [Team fouls: 3] No free throws, side out. (Josh Duncan: 1 personal fouls)

[11:08] Team_048 possession (Score: 0-0)
Dejounte Sexton makes the Dunk and draws the foul on Giannis Smith! And-1! Dejounte Sexton to the line for 1. [Team fouls: 4] (Giannis Smith: 3 personal fouls)   FT 1/1: GOOD Dejounte Sexton makes 1/1 from the line.
Score: 3-0

[10:55] Team_088 possession (Score: 3-0)
Tobias Haliburton attempts a 3Pt. Contested by Karl Johnson (4.4 feet, MAN). Tobias Haliburton misses. Rebound secured by Kevin Fox.

[10:40] Team_048 possession (Score: 3-0)
FOUL! Shooting foul on Tyler Hyland. Dejounte Sexton to the line for 2 free throws. [BONUS: 5 team fouls] (Tyler Hyland: 1 personal fouls)   FT 1/2: MISS   FT 2/2: MISS Dejounte Sexton makes 0/2 from the line. Rebound secured by Tyler Hyland.

[10:24] Team_088 possession (Score: 3-0)
Giannis Smith attempts a Midrange. Contested by Dejounte Sexton (3.2 feet, ZONE). Giannis Smith misses. Rebound secured by Dejounte Sexton.

[10:08] Team_048 possession (Score: 3-0)
FOUL! Shooting foul on Tobias Haliburton. Karl Johnson to the line for 2 free throws. [BONUS: 6 team fouls] (Tobias Haliburton: 1 personal fouls)   FT 1/2: MISS   FT 2/2: GOOD Karl Johnson makes 1/2 from the line.
Score: 4-0

[09:51] Team_088 possession (Score: 4-0)
Allen Ming drives to the basket... Allen Ming loses control! Ball rolls out of bounds! TURNOVER! (dead ball)

[09:38] Team_048 possession (Score: 4-0)
Dejounte Sexton attempts a 3Pt. Contested by Tobias Haliburton (5.8 feet, ZONE). Dejounte Sexton misses. Rebound secured by Allen Ming.

[09:23] Team_088 possession (Score: 4-0)
Tyler Hyland attempts a Layup. Contested by Kevin Fox (3.4 feet, ZONE). Tyler Hyland misses. Rebound secured by Dejounte Sexton.

[09:06] Team_048 possession (Score: 4-0)
FOUL! Reach-in foul on Giannis Smith during the drive. [IN THE BONUS! 7 team fouls] Karl Johnson to the line for 2 free throws. (Giannis Smith: 4 personal fouls)   FT 1/2: MISS   FT 2/2: GOOD Karl Johnson makes 1/2 from the line.
Score: 5-0

[08:49] Team_088 possession (Score: 5-0)
FOUL! Reach-in foul on Kevin Fox during the drive. [Team fouls: 1] No free throws, side out. (Kevin Fox: 1 personal fouls)

[08:35] Team_088 possession (Score: 5-0)
Allen Ming attempts a Layup. Contested by Kevin Fox (3.7 feet, ZONE). ALLEN MING MAKES IT! Assist: Giannis Smith
Score: 5-2

[08:24] Team_048 possession (Score: 5-2)
Paolo Rozier attempts a Layup. Contested by Giannis Smith (4.1 feet, ZONE). Paolo Rozier misses. Offensive rebound by Damian Mobley! Damian Mobley's putback is no good. Rebound secured by Allen Ming.

[08:12] Team_088 possession (Score: 5-2)
Giannis Smith attempts a Midrange. BLOCKED BY KEVIN FOX! Ball deflects out of bounds off Giannis Smith.

[08:02] Team_048 possession (Score: 5-2)
Kevin Fox drives to the basket... Kevin Fox loses the ball! Stripped by Giannis Smith! TURNOVER! (live ball)

[07:46] Team_088 possession (Score: 5-2)
Giannis Smith drives to the basket... Giannis Smith throws a bad pass! Stolen by Kevin Fox! TURNOVER! (live ball)

[07:33] Team_048 possession (Score: 5-2)
Paolo Rozier attempts a Midrange. Contested by Tobias Haliburton (5.2 feet, ZONE). Paolo Rozier misses. FOUL! Loose ball foul on Allen Ming during the rebound battle. [IN THE BONUS! 8 team fouls] Damian Mobley to the line for 2 free throws. (Allen Ming: 1 personal fouls)   FT 1/2: MISS   FT 2/2: GOOD Damian Mobley makes 1/2 from the line.
Score: 6-2

[07:17] Team_088 possession (Score: 6-2)
Tobias Haliburton attempts a 3Pt. Contested by Karl Johnson (4.4 feet, MAN). TOBIAS HALIBURTON MAKES IT! Assist: Tyler Hyland
Score: 6-5

[07:03] Team_048 possession (Score: 6-5)
Paolo Rozier drives, Josh Duncan stays with him. Paolo Rozier attempts a Dunk. Contested by Josh Duncan (5.4 feet, MAN). PAOLO ROZIER MAKES IT! Assist: Dejounte Sexton
Score: 8-5

[06:50] Team_088 possession (Score: 8-5)
Josh Duncan attempts a 3Pt. Contested by Paolo Rozier (5.2 feet, ZONE). Josh Duncan misses. FOUL! Loose ball foul on Kevin Fox during the rebound battle. [Team fouls: 2] No free throws, side out. (Kevin Fox: 2 personal fouls)

[06:38] Team_088 possession (Score: 8-5)
Josh Duncan attempts a 3Pt. Contested by Dejounte Sexton (3.1 feet, ZONE). Josh Duncan misses. FOUL! Loose ball foul on Dejounte Sexton during the rebound battle. [Team fouls: 3] No free throws, side out. (Dejounte Sexton: 1 personal fouls)

[06:22] Team_088 possession (Score: 8-5)
Allen Ming drives to the basket... Allen Ming throws a bad pass! Stolen by Kevin Fox! TURNOVER! (live ball)

[06:04] Team_048 possession (Score: 8-5)
Kevin Fox loses the ball! Stripped by Giannis Smith! TURNOVER! (live ball)

[05:47] Team_088 possession (Score: 8-5)
Josh Duncan attempts a 3Pt. Contested by Dejounte Sexton (3.1 feet, ZONE). JOSH DUNCAN MAKES IT! Assist: Tobias Haliburton
Score: 8-8

[05:34] Team_048 possession (Score: 8-8)
FOUL! Shooting foul on Josh Duncan. Karl Johnson to the line for 3 free throws. [BONUS: 9 team fouls] (Josh Duncan: 2 personal fouls)   FT 1/3: GOOD   FT 2/3: GOOD   FT 3/3: GOOD Karl Johnson makes 3/3 from the line.
Score: 11-8

[05:15] Team_088 possession (Score: 11-8)
Tobias Haliburton attempts a 3Pt. Contested by Paolo Rozier (5.2 feet, ZONE). Tobias Haliburton misses. Offensive rebound by Giannis Smith! Giannis Smith puts it back in!
Score: 11-10

[05:02] Team_048 possession (Score: 11-10)
Kevin Fox makes the Midrange and draws the foul on Tobias Haliburton! And-1! Kevin Fox to the line for 1. [BONUS: 10 team fouls] (Tobias Haliburton: 2 personal fouls)   FT 1/1: GOOD Kevin Fox makes 1/1 from the line.
Score: 14-10

[04:49] Team_088 possession (Score: 14-10)
Josh Duncan attempts a 3Pt. Contested by Dejounte Sexton (3.1 feet, ZONE). Josh Duncan misses. Rebound secured by Dejounte Sexton.

[04:32] Team_048 possession (Score: 14-10)
FOUL! Shooting foul on Tyler Hyland. Dejounte Sexton to the line for 2 free throws. [BONUS: 11 team fouls] (Tyler Hyland: 2 personal fouls)   FT 1/2: GOOD   FT 2/2: GOOD Dejounte Sexton makes 2/2 from the line.
Score: 16-10

[04:21] Team_088 possession (Score: 16-10)
Tyler Hyland drives, picks up Dejounte Sexton. Help arrives from Karl Johnson! Tyler Hyland attempts a Dunk. Contested by Karl Johnson (3.0 feet, MAN). Tyler Hyland misses. Offensive rebound by Giannis Smith! Giannis Smith puts it back in!
Score: 16-12

[04:08] Team_048 possession (Score: 16-12)
Dejounte Sexton throws a bad pass out of bounds! TURNOVER! (dead ball)

[03:54] Team_088 possession (Score: 16-12)
Giannis Smith attempts a 3Pt. Contested by Kevin Fox (3.8 feet, MAN). Giannis Smith misses. Rebound secured by Dejounte Sexton.

[03:39] Team_048 possession (Score: 16-12)
Dejounte Sexton makes the Layup and draws the foul on Giannis Smith! And-1! Dejounte Sexton to the line for 1. [BONUS: 12 team fouls] (Giannis Smith: 5 personal fouls)   FT 1/1: GOOD Dejounte Sexton makes 1/1 from the line.
Score: 19-12

[03:22] Team_088 possession (Score: 19-12)
Giannis Smith drives to the basket... FOUL! Offensive foul on Giannis Smith! Kevin Fox drew the charge! [Team fouls: 13] (Giannis Smith: 6 personal fouls) TURNOVER! (dead ball)

[03:10] Team_048 possession (Score: 19-12)
Dejounte Sexton makes the Layup and draws the foul on Tobias Haliburton! And-1! Dejounte Sexton to the line for 1. [BONUS: 14 team fouls] (Tobias Haliburton: 3 personal fouls)   FT 1/1: GOOD Dejounte Sexton makes 1/1 from the line.
Score: 22-12

[02:59] Team_088 possession (Score: 22-12)
Tobias Haliburton makes the Layup and draws the foul on Kevin Fox! And-1! Tobias Haliburton to the line for 1. [Team fouls: 4] (Kevin Fox: 3 personal fouls)   FT 1/1: GOOD Tobias Haliburton makes 1/1 from the line.
Score: 22-15

[02:44] Team_048 possession (Score: 22-15)
Paolo Rozier attempts a Midrange. Contested by Josh Duncan (5.7 feet, MAN). Paolo Rozier misses. Rebound secured by Giannis Smith.

[02:28] Team_088 possession (Score: 22-15)
Tobias Haliburton drives to the basket... Tobias Haliburton loses the ball! Stripped by Kevin Fox! TURNOVER! (live ball)

[02:14] Team_048 possession (Score: 22-15)
Dejounte Sexton attempts a 3Pt. Wide open! Tobias Haliburton is 6.0 feet away. [ZONE] DEJOUNTE SEXTON MAKES IT! Assist: Damian Mobley
Score: 25-15

[02:01] Team_088 possession (Score: 25-15)
Tyler Hyland attempts a 3Pt. Contested by Dejounte Sexton (3.2 feet, MAN). TYLER HYLAND MAKES IT! Assist: Josh Duncan
Score: 25-18

[01:42] Team_048 possession (Score: 25-18)
Dejounte Sexton attempts a 3Pt. Contested by Tyler Hyland (5.6 feet, MAN). DEJOUNTE SEXTON MAKES IT! Assist: Paolo Rozier
Score: 28-18

[01:24] Team_088 possession (Score: 28-18)
Giannis Smith attempts a 3Pt. Contested by Kevin Fox (4.0 feet, MAN). GIANNIS SMITH MAKES IT! Assist: Josh Duncan
Score: 28-21

[01:07] Team_048 possession (Score: 28-21)
Dejounte Sexton attempts a 3Pt. Wide open! Tobias Haliburton is 6.1 feet away. [ZONE] DEJOUNTE SEXTON MAKES IT! Assist: Damian Mobley
Score: 31-21

[00:50] Team_088 possession (Score: 31-21)
Tobias Haliburton attempts a 3Pt. Contested by Dejounte Sexton (3.4 feet, ZONE). Tobias Haliburton misses. Rebound secured by Dejounte Sexton.

[00:35] Team_048 possession (Score: 31-21)
Karl Johnson attempts a Layup. Contested by Giannis Smith (5.1 feet, ZONE). KARL JOHNSON MAKES IT! Assist: Damian Mobley
Score: 33-21

[00:18] Team_088 possession (Score: 33-21)
Tobias Haliburton attempts a Layup. Contested by Kevin Fox (4.0 feet, ZONE). Tobias Haliburton misses. Offensive rebound by Allen Ming! Allen Ming puts it back in!
Score: 33-23

[00:05] Team_048 possession (Score: 33-23)
Damian Mobley attempts a 3Pt. Contested by Allen Ming (5.5 feet, MAN). Damian Mobley misses. Rebound secured by Giannis Smith.

================================================================================
                              1ST QUARTER COMPLETE                              
================================================================================

1ST QUARTER SCORE: Team_048 33, Team_088 23

BOX SCORE:
================================================================================

Team_048
--------------------------------------------------------------------------------
Player                MIN  PTS  REB  AST  TO      FG   FG%      3P   3P%
--------------------------------------------------------------------------------
Dejounte Sexton        12   20    5    1   0   7/9    77.8     0/0   0.0
Karl Johnson           12    7    0    0   0   4/4   100.0     0/0   0.0
Kevin Fox              12    3    1    0   0   1/2    50.0     0/0   0.0
Paolo Rozier           12    2    0    1   0   1/3    33.3     0/0   0.0
Damian Mobley          12    1    0    3   0   1/2    50.0     0/0   0.0

TEAM: FG: 14/20 (70.0%), 3PT: 4/6 (66.7%), REB: 7 (1 off, 6 def), AST: 5, TO: 3
TEAM FOULS: 4


Team_088
--------------------------------------------------------------------------------
Player                MIN  PTS  REB  AST  TO      FG   FG%      3P   3P%
--------------------------------------------------------------------------------
Giannis Smith          12    7    7    1   0   3/6    50.0     0/0   0.0
Tobias Haliburton      12    6    0    1   0   2/4    50.0     0/0   0.0
Allen Ming             12    4    3    0   0   2/2   100.0     0/0   0.0
Tyler Hyland           12    3    1    1   0   1/2    50.0     0/0   0.0
Josh Duncan            12    3    0    2   0   1/2    50.0     0/0   0.0

TEAM: FG: 9/16 (56.2%), 3PT: 5/9 (55.6%), REB: 10 (5 off, 5 def), AST: 5, TO: 6
TEAM FOULS: 14 [Team_048 in BONUS]

================================================================================

================================================================================
                       2ND QUARTER - Team_048 vs Team_088                       
================================================================================

[12:00] Team_048 possession (Score: 33-23)
Karl Johnson attempts a 3Pt. Contested by Tobias Haliburton (5.8 feet, MAN). Karl Johnson misses. Rebound secured by Giannis Smith.

[11:45] Team_088 possession (Score: 33-23)
FOUL! Reach-in foul on Kevin Fox during the drive. [Team fouls: 1] No free throws, side out. (Kevin Fox: 1 personal fouls)

[11:26] Team_088 possession (Score: 33-23)
FOUL! Offensive foul on Tobias Haliburton! Karl Johnson drew the charge! [Team fouls: 1] (Tobias Haliburton: 1 personal fouls) TURNOVER! (dead ball)

[11:15] Team_048 possession (Score: 33-23)
Damian Mobley attempts a Layup. Contested by Allen Ming (5.3 feet, MAN). Damian Mobley misses. Offensive rebound by Kevin Fox! Kevin Fox kicks it out.

[11:02] Team_048 possession (Score: 33-23)
Damian Mobley loses control! Ball rolls out of bounds! TURNOVER! (dead ball)

[11:02] Substitution (Team_048): Paolo Rozier OUT → Lauri Curry IN (stamina_rule2)

[11:02] Substitution (Team_048): Karl Johnson OUT → Yao Booker IN (stamina_rule2)

[11:02] Substitution (Team_048): Dejounte Sexton OUT → Kyle Irving IN (stamina_rule2)

[11:02] Substitution (Team_048): Kevin Fox OUT → DeMar Hyland IN (stamina_rule2)

[11:02] Substitution (Team_048): Damian Mobley OUT → Gary Giddey IN (stamina_rule2)

[11:02] Substitution (Team_088): Josh Duncan OUT → Klay Quickley IN (stamina_rule2)

[11:02] Substitution (Team_088): Tobias Haliburton OUT → Vince Carter IN (stamina_rule2)

[11:02] Substitution (Team_088): Tyler Hyland OUT → Pau Bird IN (stamina_rule2)

[11:02] Substitution (Team_088): Giannis Smith OUT → Zion Harris IN (stamina_rule2)

[11:02] Substitution (Team_088): Allen Ming OUT → Josh Embiid IN (stamina_rule2)

[10:51] Team_088 possession (Score: 33-23)
Josh Embiid makes the Dunk and draws the foul on DeMar Hyland! And-1! Josh Embiid to the line for 1. [Team fouls: 2] (DeMar Hyland: 1 personal fouls)   FT 1/1: GOOD Josh Embiid makes 1/1 from the line.
Score: 33-26

[10:41] Team_048 possession (Score: 33-26)
FOUL! Reach-in foul on Pau Bird during the drive. [Team fouls: 2] No free throws, side out. (Pau Bird: 1 personal fouls)

[10:25] Team_048 possession (Score: 33-26)
Yao Booker attempts a 3Pt. Contested by Pau Bird (5.0 feet, ZONE). YAO BOOKER MAKES IT! Assist: DeMar Hyland
Score: 36-26

[10:15] Team_088 possession (Score: 36-26)
FOUL! Shooting foul on Lauri Curry. Klay Quickley to the line for 2 free throws. [Team fouls: 3] (Lauri Curry: 1 personal fouls)   FT 1/2: MISS   FT 2/2: MISS Klay Quickley makes 0/2 from the line. Rebound secured by Kyle Irving.

[10:00] Team_048 possession (Score: 36-26)
Kyle Irving attempts a 3Pt. Contested by Pau Bird (5.0 feet, MAN). Kyle Irving misses. Rebound secured by Josh Embiid.

[09:47] Team_088 possession (Score: 36-26)
Josh Embiid attempts a Layup. Contested by DeMar Hyland (3.3 feet, ZONE). Josh Embiid misses. Rebound secured by Gary Giddey.

[09:33] Team_048 possession (Score: 36-26)
Yao Booker attempts a Layup. Contested by Zion Harris (5.8 feet, ZONE). Yao Booker misses. Rebound secured by Zion Harris.

[09:22] Team_088 possession (Score: 36-26)
Pau Bird attempts a Midrange. Contested by Yao Booker (4.9 feet, ZONE). PAU BIRD MAKES IT! Assist: Klay Quickley
Score: 36-28

[09:07] Team_048 possession (Score: 36-28)
DeMar Hyland drives and kicks out. Kyle Irving attempts a 3Pt. Contested by Pau Bird (5.0 feet, ZONE). KYLE IRVING MAKES IT! Assist: DeMar Hyland
Score: 39-28

[08:52] Team_088 possession (Score: 39-28)
FOUL! Reach-in foul on Kyle Irving during the drive. [Team fouls: 4] No free throws, side out. (Kyle Irving: 1 personal fouls)

[08:36] Team_088 possession (Score: 39-28)
Josh Embiid attempts a 3Pt. Contested by DeMar Hyland (3.3 feet, MAN). Josh Embiid misses. Rebound secured by DeMar Hyland.

[08:22] Team_048 possession (Score: 39-28)
FOUL! Holding foul on Vince Carter. [Team fouls: 3] No free throws, side out. (Vince Carter: 1 personal fouls)

[08:07] Team_048 possession (Score: 39-28)
Gary Giddey drives to the basket... FOUL! Offensive foul on Gary Giddey! Zion Harris drew the charge! [Team fouls: 5] (Gary Giddey: 1 personal fouls) TURNOVER! (dead ball)

[07:48] Team_088 possession (Score: 39-28)
FOUL! Shooting foul on DeMar Hyland. Klay Quickley to the line for 3 free throws. [BONUS: 6 team fouls] (DeMar Hyland: 2 personal fouls)   FT 1/3: MISS   FT 2/3: GOOD   FT 3/3: MISS Klay Quickley makes 1/3 from the line. Offensive rebound by Josh Embiid! Josh Embiid kicks it out.
Score: 39-29

[07:31] Team_088 possession (Score: 39-29)
Klay Quickley attempts a 3Pt. Contested by DeMar Hyland (3.5 feet, ZONE). KLAY QUICKLEY MAKES IT! Assist: Pau Bird
Score: 39-32

[07:19] Team_048 possession (Score: 39-32)
Yao Booker attempts a Layup. BLOCKED BY KLAY QUICKLEY! Ball is loose! Offensive rebound by DeMar Hyland! DeMar Hyland kicks it out.

[07:02] Team_048 possession (Score: 39-32)
DeMar Hyland attempts a 3Pt. Contested by Zion Harris (6.0 feet, MAN). DeMar Hyland misses. Rebound secured by Zion Harris.

[06:49] Team_088 possession (Score: 39-32)
Zion Harris attempts a Midrange. BLOCKED BY DEMAR HYLAND! Ball is loose! Offensive rebound by Josh Embiid! Josh Embiid kicks it out.

[06:38] Team_088 possession (Score: 39-32)
Vince Carter attempts a 3Pt. Contested by Kyle Irving (4.2 feet, ZONE). Vince Carter misses. Rebound secured by DeMar Hyland.

[06:24] Team_048 possession (Score: 39-32)
FOUL! Reach-in foul on Zion Harris during the drive. [Team fouls: 4] No free throws, side out. (Zion Harris: 1 personal fouls)

[06:10] Team_048 possession (Score: 39-32)
DeMar Hyland drives, Zion Harris stays with him. DeMar Hyland attempts a Layup. Contested by Zion Harris (6.0 feet, MAN). DEMAR HYLAND MAKES IT! Assist: Yao Booker
Score: 41-32

[05:55] Team_088 possession (Score: 41-32)
Klay Quickley makes the Dunk and draws the foul on Lauri Curry! And-1! Klay Quickley to the line for 1. [BONUS: 8 team fouls] (Lauri Curry: 2 personal fouls)   FT 1/1: GOOD Klay Quickley makes 1/1 from the line.
Score: 41-35

[05:41] Team_048 possession (Score: 41-35)
DeMar Hyland attempts a Midrange. Contested by Zion Harris (6.0 feet, MAN). DEMAR HYLAND MAKES IT! Assist: Kyle Irving
Score: 43-35

[05:28] Team_088 possession (Score: 43-35)
Pau Bird drives to the basket... Pau Bird throws a bad pass out of bounds! TURNOVER! (dead ball)

[05:15] Team_048 possession (Score: 43-35)
Gary Giddey attempts a Midrange. Contested by Josh Embiid (5.5 feet, MAN). Gary Giddey misses. FOUL! Loose ball foul on Josh Embiid during the rebound battle. [IN THE BONUS! 5 team fouls] Kyle Irving to the line for 2 free throws. (Josh Embiid: 1 personal fouls)   FT 1/2: MISS   FT 2/2: GOOD Kyle Irving makes 1/2 from the line.
Score: 44-35

[05:03] Team_088 possession (Score: 44-35)
Zion Harris attempts a Layup. BLOCKED BY DEMAR HYLAND! Ball deflects out of bounds off Zion Harris.

[04:50] Team_048 possession (Score: 44-35)
FOUL! Holding foul on Zion Harris. [IN THE BONUS! 6 team fouls] DeMar Hyland to the line for 2 free throws. (Zion Harris: 2 personal fouls)   FT 1/2: GOOD   FT 2/2: GOOD DeMar Hyland makes 2/2 from the line.
Score: 46-35

[04:35] Team_088 possession (Score: 46-35)
Klay Quickley attempts a 3Pt. Contested by DeMar Hyland (3.6 feet, ZONE). Klay Quickley misses. Rebound secured by Kyle Irving.

[04:20] Team_048 possession (Score: 46-35)
Yao Booker attempts a 3Pt. Contested by Pau Bird (5.1 feet, ZONE). Yao Booker misses. Rebound secured by Josh Embiid.

[04:07] Team_088 possession (Score: 46-35)
Vince Carter attempts a 3Pt. Contested by Yao Booker (4.5 feet, MAN). Vince Carter misses. Rebound secured by Gary Giddey.

[03:50] Team_048 possession (Score: 46-35)
Kyle Irving attempts a 3Pt. Contested by Pau Bird (5.1 feet, MAN). Kyle Irving misses. Rebound secured by Pau Bird.

[03:33] Team_088 possession (Score: 46-35)
Pau Bird attempts a 3Pt. Contested by Yao Booker (5.0 feet, ZONE). Pau Bird misses. Rebound secured by Gary Giddey.

[03:16] Team_048 possession (Score: 46-35)
Gary Giddey attempts a Layup. Contested by Josh Embiid (5.6 feet, MAN). Gary Giddey misses. Rebound secured by Josh Embiid.

[02:59] Team_088 possession (Score: 46-35)
Pau Bird attempts a Layup. Contested by DeMar Hyland (3.8 feet, ZONE). Pau Bird misses. Rebound secured by Gary Giddey.

[02:48] Team_048 possession (Score: 46-35)
Lauri Curry attempts a 3Pt. Wide open! Klay Quickley is 6.1 feet away. [MAN] LAURI CURRY MAKES IT! Assist: Yao Booker
Score: 49-35

[02:33] Team_088 possession (Score: 49-35)
Josh Embiid drives, picks up DeMar Hyland. Help arrives from Lauri Curry! Josh Embiid attempts a Layup. Contested by Lauri Curry (3.5 feet, MAN). JOSH EMBIID MAKES IT!
Score: 49-37

[02:14] Team_048 possession (Score: 49-37)
Kyle Irving attempts a Layup. BLOCKED BY PAU BIRD! Ball goes out off Pau Bird. Kyle Irving's ball!

[01:59] Team_048 possession (Score: 49-37)
Yao Booker attempts a 3Pt. Contested by Vince Carter (5.0 feet, MAN). Yao Booker misses. Offensive rebound by DeMar Hyland! DeMar Hyland kicks it out.

[01:49] Team_048 possession (Score: 49-37)
Kyle Irving attempts a Layup. Contested by Zion Harris (6.0 feet, ZONE). KYLE IRVING MAKES IT! Assist: Gary Giddey
Score: 51-37

[01:35] Team_088 possession (Score: 51-37)
Josh Embiid drives and kicks out. Pau Bird attempts a 3Pt. Contested by Kyle Irving (4.7 feet, MAN). PAU BIRD MAKES IT! Assist: Josh Embiid
Score: 51-40

[01:19] Team_048 possession (Score: 51-40)
Lauri Curry drives, Klay Quickley stays with him. Lauri Curry attempts a Layup. Wide open! Klay Quickley is 6.2 feet away. [MAN] LAURI CURRY MAKES IT! Assist: Gary Giddey
Score: 53-40

[01:06] Team_088 possession (Score: 53-40)
FOUL! Shooting foul on Lauri Curry. Josh Embiid to the line for 2 free throws. [BONUS: 9 team fouls] (Lauri Curry: 3 personal fouls)   FT 1/2: GOOD   FT 2/2: GOOD Josh Embiid makes 2/2 from the line.
Score: 53-42

[00:50] Team_048 possession (Score: 53-42)
DeMar Hyland drives to the basket... DeMar Hyland commits a violation (traveling/carry)! TURNOVER! (dead ball)

[00:35] Team_088 possession (Score: 53-42)
Pau Bird attempts a 3Pt. Contested by DeMar Hyland (4.1 feet, ZONE). Pau Bird misses. Rebound secured by Gary Giddey.

[00:20] Team_048 possession (Score: 53-42)
Lauri Curry attempts a Layup. Wide open! Zion Harris is 6.2 feet away. [ZONE] Lauri Curry misses. Offensive rebound by Kyle Irving! Kyle Irving kicks it out.

[00:05] Team_048 possession (Score: 53-42)
Gary Giddey drives, Zion Harris stays with him. Gary Giddey attempts a Dunk. Wide open! Zion Harris is 6.3 feet away. [ZONE] GARY GIDDEY MAKES IT!
Score: 55-42

================================================================================
                              2ND QUARTER COMPLETE                              
================================================================================

2ND QUARTER SCORE: Team_048 22, Team_088 19

BOX SCORE:
================================================================================

Team_048
--------------------------------------------------------------------------------
Player                MIN  PTS  REB  AST  TO      FG   FG%      3P   3P%
--------------------------------------------------------------------------------
DeMar Hyland           11    6    4    2   0   3/4    75.0     0/0   0.0
Kyle Irving            11    6    3    1   0   3/5    60.0     0/0   0.0
Lauri Curry            11    5    0    0   0   2/2   100.0     0/0   0.0
Yao Booker             11    3    0    2   0   1/3    33.3     0/0   0.0
Gary Giddey            11    2    5    2   0   1/2    50.0     0/0   0.0
Karl Johnson           13    0    0    0   0   0/1     0.0     0/0   0.0
Kevin Fox              13    0    1    0   0   0/0     0.0     0/0   0.0

TEAM: FG: 10/17 (58.8%), 3PT: 2/7 (28.6%), REB: 13 (4 off, 9 def), AST: 7, TO: 3
TEAM FOULS: 9 [Team_088 in BONUS]


Team_088
--------------------------------------------------------------------------------
Player                MIN  PTS  REB  AST  TO      FG   FG%      3P   3P%
--------------------------------------------------------------------------------
Josh Embiid            11    7    5    1   0   3/5    60.0     0/0   0.0
Klay Quickley          11    6    0    1   0   2/4    50.0     0/0   0.0
Pau Bird               11    5    1    1   0   2/5    40.0     0/0   0.0
Giannis Smith          13    0    1    0   0   0/0     0.0     0/0   0.0
Zion Harris            11    0    2    0   0   0/1     0.0     0/0   0.0
Vince Carter           11    0    0    0   0   0/2     0.0     0/0   0.0

TEAM: FG: 7/17 (41.2%), 3PT: 1/7 (14.3%), REB: 9 (2 off, 7 def), AST: 3, TO: 2
TEAM FOULS: 6 [Team_048 in BONUS]

================================================================================

================================================================================
                       3RD QUARTER - Team_048 vs Team_088                       
================================================================================

[12:00] Team_048 possession (Score: 55-42)
Kevin Fox attempts a 3Pt. Contested by Tobias Haliburton (5.9 feet, ZONE). KEVIN FOX MAKES IT! Assist: Damian Mobley
Score: 58-42

[11:42] Team_088 possession (Score: 58-42)
FOUL! Holding foul on Dejounte Sexton. [Team fouls: 1] No free throws, side out. (Dejounte Sexton: 1 personal fouls)

[11:28] Team_088 possession (Score: 58-42)
Tyler Hyland drives to the basket... Tyler Hyland commits a violation (traveling/carry)! TURNOVER! (dead ball)

[11:14] Team_048 possession (Score: 58-42)
Paolo Rozier drives, Josh Duncan stays with him. Paolo Rozier attempts a Dunk. Contested by Josh Duncan (5.4 feet, MAN). PAOLO ROZIER MAKES IT!
Score: 60-42

[11:01] Team_088 possession (Score: 60-42)
Tyler Hyland attempts a 3Pt. Contested by Dejounte Sexton (2.9 feet, ZONE). Tyler Hyland misses. Rebound secured by Damian Mobley.

[10:47] Team_048 possession (Score: 60-42)
FOUL! Holding foul on Giannis Smith. [Team fouls: 1] No free throws, side out. (Giannis Smith: 1 personal fouls)

[10:35] Team_048 possession (Score: 60-42)
Paolo Rozier attempts a Layup. BLOCKED BY GIANNIS SMITH! Ball is loose! Offensive rebound by Kevin Fox! Kevin Fox kicks it out.

[10:19] Team_048 possession (Score: 60-42)
Karl Johnson makes the Layup and draws the foul on Giannis Smith! And-1! Karl Johnson to the line for 1. [Team fouls: 2] (Giannis Smith: 2 personal fouls)   FT 1/1: GOOD Karl Johnson makes 1/1 from the line.
Score: 63-42

[10:00] Team_088 possession (Score: 63-42)
Josh Duncan attempts a 3Pt. Contested by Dejounte Sexton (3.1 feet, ZONE). Josh Duncan misses. Offensive rebound by Giannis Smith! Giannis Smith puts it back in!
Score: 63-44

[09:46] Team_048 possession (Score: 63-44)
Dejounte Sexton attempts a 3Pt. Contested by Tyler Hyland (5.2 feet, MAN). Dejounte Sexton misses. Offensive rebound by Damian Mobley! Damian Mobley's putback is no good. Offensive rebound by Damian Mobley! Damian Mobley kicks it out.

[09:34] Team_048 possession (Score: 63-44)
Paolo Rozier attempts a 3Pt. Contested by Josh Duncan (5.4 feet, MAN). Paolo Rozier misses. Offensive rebound by Damian Mobley! Damian Mobley puts it back in!
Score: 65-44

[09:21] Team_088 possession (Score: 65-44)
Tyler Hyland attempts a 3Pt. Contested by Dejounte Sexton (2.9 feet, MAN). Tyler Hyland misses. Rebound secured by Dejounte Sexton.

[09:05] Team_048 possession (Score: 65-44)
Dejounte Sexton drives to the basket... Dejounte Sexton commits a violation (traveling/carry)! TURNOVER! (dead ball)

[08:54] Team_088 possession (Score: 65-44)
Allen Ming attempts a Midrange. Contested by Dejounte Sexton (3.2 feet, ZONE). Allen Ming misses. Rebound secured by Dejounte Sexton.

[08:40] Team_048 possession (Score: 65-44)
Karl Johnson attempts a 3Pt. Contested by Tobias Haliburton (5.6 feet, ZONE). Karl Johnson misses. Rebound secured by Allen Ming.

[08:26] Team_088 possession (Score: 65-44)
Tobias Haliburton attempts a 3Pt. Contested by Dejounte Sexton (3.0 feet, ZONE). Tobias Haliburton misses. Offensive rebound by Allen Ming! Allen Ming puts it back in!
Score: 65-46

[08:13] Team_048 possession (Score: 65-46)
Karl Johnson attempts a 3Pt. Contested by Tobias Haliburton (5.6 feet, ZONE). Karl Johnson misses. Offensive rebound by Kevin Fox! Kevin Fox kicks it out.

[08:00] Team_048 possession (Score: 65-46)
FOUL! Holding foul on Josh Duncan. [Team fouls: 3] No free throws, side out. (Josh Duncan: 1 personal fouls)

[07:42] Team_048 possession (Score: 65-46)
Dejounte Sexton loses the ball! Stripped by Tyler Hyland! TURNOVER! (live ball)

[07:27] Team_088 possession (Score: 65-46)
Allen Ming attempts a Midrange. Contested by Dejounte Sexton (3.2 feet, ZONE). ALLEN MING MAKES IT! Assist: Tyler Hyland
Score: 65-48

[07:14] Team_048 possession (Score: 65-48)
Kevin Fox attempts a Midrange. Contested by Giannis Smith (4.9 feet, MAN). Kevin Fox misses. Rebound secured by Tyler Hyland.

[06:59] Team_088 possession (Score: 65-48)
Tyler Hyland drives, Dejounte Sexton stays with him. Tyler Hyland attempts a Dunk. Contested by Dejounte Sexton (2.9 feet, MAN). Tyler Hyland misses. Rebound secured by Damian Mobley.

[06:43] Team_048 possession (Score: 65-48)
Dejounte Sexton attempts a Midrange. Contested by Tobias Haliburton (5.8 feet, ZONE). Dejounte Sexton misses. Offensive rebound by Damian Mobley! Damian Mobley's putback is no good. Rebound secured by Giannis Smith.

[06:30] Team_088 possession (Score: 65-48)
Tobias Haliburton attempts a Midrange. Contested by Karl Johnson (4.4 feet, MAN). TOBIAS HALIBURTON MAKES IT! Assist: Giannis Smith
Score: 65-50

[06:15] Team_048 possession (Score: 65-50)
FOUL! Holding foul on Josh Duncan. [Team fouls: 4] No free throws, side out. (Josh Duncan: 2 personal fouls)

[05:59] Team_048 possession (Score: 65-50)
Karl Johnson drives and kicks out. Paolo Rozier attempts a 3Pt. Contested by Tobias Haliburton (5.0 feet, ZONE). PAOLO ROZIER MAKES IT! Assist: Damian Mobley
Score: 68-50

[05:48] Team_088 possession (Score: 68-50)
FOUL! Reach-in foul on Kevin Fox during the drive. [Team fouls: 2] No free throws, side out. (Kevin Fox: 1 personal fouls)

[05:35] Team_088 possession (Score: 68-50)
Giannis Smith drives, picks up Kevin Fox. Help arrives from Karl Johnson! Giannis Smith attempts a Dunk. Contested by Karl Johnson (3.6 feet, MAN). GIANNIS SMITH MAKES IT!
Score: 68-52

[05:21] Team_048 possession (Score: 68-52)
Dejounte Sexton attempts a Layup. Contested by Tyler Hyland (5.3 feet, MAN). DEJOUNTE SEXTON MAKES IT! Assist: Karl Johnson
Score: 70-52

[05:10] Team_088 possession (Score: 70-52)
FOUL! Holding foul on Paolo Rozier. [Team fouls: 3] No free throws, side out. (Paolo Rozier: 1 personal fouls)

[04:57] Team_088 possession (Score: 70-52)
FOUL! Shooting foul on Karl Johnson. Giannis Smith to the line for 2 free throws. [Team fouls: 4] (Karl Johnson: 1 personal fouls)   FT 1/2: MISS   FT 2/2: GOOD Giannis Smith makes 1/2 from the line.
Score: 70-53

[04:39] Team_048 possession (Score: 70-53)
Damian Mobley drives, picks up Giannis Smith. Help arrives from Tobias Haliburton! Damian Mobley attempts a Layup. Contested by Tobias Haliburton (4.8 feet, ZONE). DAMIAN MOBLEY MAKES IT!
Score: 72-53

[04:24] Team_088 possession (Score: 72-53)
Giannis Smith attempts a 3Pt. Contested by Dejounte Sexton (3.2 feet, ZONE). GIANNIS SMITH MAKES IT! Assist: Allen Ming
Score: 72-56

[04:05] Team_048 possession (Score: 72-56)
Karl Johnson attempts a Midrange. Contested by Tobias Haliburton (5.7 feet, MAN). Karl Johnson misses. Rebound secured by Giannis Smith.

[03:46] Team_088 possession (Score: 72-56)
Tobias Haliburton drives, picks up Kevin Fox. Help arrives from Karl Johnson! Tobias Haliburton attempts a Layup. Contested by Karl Johnson (3.6 feet, ZONE). TOBIAS HALIBURTON MAKES IT!
Score: 72-58

[03:29] Team_048 possession (Score: 72-58)
FOUL! Reach-in foul on Josh Duncan during the drive. [IN THE BONUS! 5 team fouls] Paolo Rozier to the line for 2 free throws. (Josh Duncan: 3 personal fouls)   FT 1/2: GOOD   FT 2/2: GOOD Paolo Rozier makes 2/2 from the line.
Score: 74-58

[03:13] Team_088 possession (Score: 74-58)
Josh Duncan attempts a 3Pt. Contested by Paolo Rozier (5.3 feet, MAN). Josh Duncan misses. Rebound secured by Dejounte Sexton.

[03:01] Team_048 possession (Score: 74-58)
Karl Johnson attempts a Midrange. Contested by Tobias Haliburton (5.7 feet, MAN). Karl Johnson misses. Rebound secured by Giannis Smith.

[02:47] Team_088 possession (Score: 74-58)
Giannis Smith attempts a Midrange. Contested by Kevin Fox (3.9 feet, MAN). Giannis Smith misses. Rebound secured by Damian Mobley.

[02:29] Team_048 possession (Score: 74-58)
Karl Johnson drives and kicks out. FOUL! Shooting foul on Tyler Hyland. Dejounte Sexton to the line for 3 free throws. [BONUS: 6 team fouls] (Tyler Hyland: 1 personal fouls)   FT 1/3: GOOD   FT 2/3: GOOD   FT 3/3: MISS Dejounte Sexton makes 2/3 from the line. Offensive rebound by Damian Mobley! Damian Mobley puts it back in!
Score: 78-58

[02:15] Team_088 possession (Score: 78-58)
Allen Ming drives, Damian Mobley stays with him. Allen Ming attempts a Layup. Contested by Damian Mobley (4.0 feet, ZONE). Allen Ming misses. Rebound secured by Kevin Fox.

[02:04] Team_048 possession (Score: 78-58)
FOUL! Reach-in foul on Giannis Smith during the drive. [IN THE BONUS! 7 team fouls] Kevin Fox to the line for 2 free throws. (Giannis Smith: 3 personal fouls)   FT 1/2: GOOD   FT 2/2: GOOD Kevin Fox makes 2/2 from the line.
Score: 80-58

[01:49] Team_088 possession (Score: 80-58)
Josh Duncan attempts a 3Pt. Contested by Paolo Rozier (5.4 feet, MAN). JOSH DUNCAN MAKES IT! Assist: Tobias Haliburton
Score: 80-61

[01:29] Team_048 possession (Score: 80-61)
Paolo Rozier attempts a Midrange. Contested by Josh Duncan (5.8 feet, MAN). Paolo Rozier misses. Offensive rebound by Damian Mobley! Damian Mobley puts it back in!
Score: 82-61

[01:12] Team_088 possession (Score: 82-61)
Tobias Haliburton attempts a Midrange. Contested by Dejounte Sexton (3.4 feet, ZONE). Tobias Haliburton misses. Rebound secured by Dejounte Sexton.

[00:54] Team_048 possession (Score: 82-61)
Karl Johnson attempts a Midrange. Contested by Giannis Smith (5.0 feet, ZONE). KARL JOHNSON MAKES IT!
Score: 84-61

[00:36] Team_088 possession (Score: 84-61)
Tobias Haliburton attempts a 3Pt. Contested by Dejounte Sexton (3.4 feet, ZONE). Tobias Haliburton misses. Rebound secured by Damian Mobley.

[00:24] Team_048 possession (Score: 84-61)
Paolo Rozier drives to the basket... FOUL! Offensive foul on Paolo Rozier! Giannis Smith drew the charge! [Team fouls: 5] (Paolo Rozier: 2 personal fouls) TURNOVER! (dead ball)

[00:11] Team_088 possession (Score: 84-61)
Josh Duncan attempts a 3Pt. Contested by Dejounte Sexton (3.5 feet, ZONE). Josh Duncan misses. Rebound secured by Dejounte Sexton.

================================================================================
                              3RD QUARTER COMPLETE                              
================================================================================

3RD QUARTER SCORE: Team_048 29, Team_088 19

BOX SCORE:
================================================================================

Team_048
--------------------------------------------------------------------------------
Player                MIN  PTS  REB  AST  TO      FG   FG%      3P   3P%
--------------------------------------------------------------------------------
Damian Mobley          25   10    7    2   0   4/4   100.0     0/0   0.0
Paolo Rozier           25    7    0    0   0   3/3   100.0     0/0   0.0
Kevin Fox              25    5    3    0   0   2/3    66.7     0/0   0.0
Karl Johnson           25    5    0    1   0   2/5    40.0     0/0   0.0
Dejounte Sexton        25    2    5    0   0   1/2    50.0     0/0   0.0

TEAM: FG: 12/17 (70.6%), 3PT: 2/3 (66.7%), REB: 16 (6 off, 10 def), AST: 3, TO: 3
TEAM FOULS: 5 [Team_088 in BONUS]


Team_088
--------------------------------------------------------------------------------
Player                MIN  PTS  REB  AST  TO      FG   FG%      3P   3P%
--------------------------------------------------------------------------------
Giannis Smith          25    8    4    1   0   4/5    80.0     0/0   0.0
Allen Ming             25    4    2    1   0   2/4    50.0     0/0   0.0
Tobias Haliburton      25    4    0    1   0   2/4    50.0     0/0   0.0
Josh Duncan            25    3    0    0   0   1/3    33.3     0/0   0.0
Tyler Hyland           25    0    1    1   0   0/3     0.0     0/0   0.0

TEAM: FG: 9/19 (47.4%), 3PT: 4/9 (44.4%), REB: 6 (2 off, 4 def), AST: 4, TO: 1
TEAM FOULS: 7 [Team_048 in BONUS]

================================================================================

================================================================================
                       4TH QUARTER - Team_048 vs Team_088                       
================================================================================

[12:00] Team_048 possession (Score: 84-61)
Paolo Rozier drives and kicks out. Damian Mobley attempts a Midrange. Contested by Tobias Haliburton (5.3 feet, ZONE). DAMIAN MOBLEY MAKES IT!
Score: 86-61

[11:45] Team_088 possession (Score: 86-61)
Josh Duncan attempts a 3Pt. Contested by Paolo Rozier (5.4 feet, MAN). JOSH DUNCAN MAKES IT!
Score: 86-64

[11:27] Team_048 possession (Score: 86-64)
Damian Mobley attempts a Midrange. Contested by Allen Ming (5.3 feet, MAN). Damian Mobley misses. FOUL! Loose ball foul on Allen Ming during the rebound battle. [Team fouls: 1] No free throws, side out. (Allen Ming: 1 personal fouls)

[11:15] Team_048 possession (Score: 86-64)
Damian Mobley commits a violation (traveling/carry)! TURNOVER! (dead ball)

[11:15] Substitution (Team_048): Paolo Rozier OUT → Lauri Curry IN (stamina_rule2)

[11:15] Substitution (Team_048): Karl Johnson OUT → Yao Booker IN (stamina_rule2)

[11:15] Substitution (Team_048): Dejounte Sexton OUT → Kyle Irving IN (stamina_rule2)

[11:15] Substitution (Team_048): Kevin Fox OUT → DeMar Hyland IN (stamina_rule2)

[11:15] Substitution (Team_048): Damian Mobley OUT → Gary Giddey IN (stamina_rule2)

[11:15] Substitution (Team_088): Josh Duncan OUT → Klay Quickley IN (stamina_rule2)

[11:15] Substitution (Team_088): Tobias Haliburton OUT → Vince Carter IN (stamina_rule2)

[11:15] Substitution (Team_088): Tyler Hyland OUT → Pau Bird IN (stamina_rule2)

[11:15] Substitution (Team_088): Giannis Smith OUT → Zion Harris IN (stamina_rule2)

[11:15] Substitution (Team_088): Allen Ming OUT → Josh Embiid IN (stamina_rule2)

[11:03] Team_088 possession (Score: 86-64)
Zion Harris attempts a Midrange. Contested by DeMar Hyland (4.0 feet, MAN). ZION HARRIS MAKES IT! Assist: Klay Quickley
Score: 86-66

[10:53] Team_048 possession (Score: 86-66)
Lauri Curry attempts a Midrange. Contested by Klay Quickley (6.0 feet, MAN). Lauri Curry misses. Rebound secured by Zion Harris.

[10:39] Team_088 possession (Score: 86-66)
Pau Bird attempts a 3Pt. Contested by DeMar Hyland (3.7 feet, ZONE). PAU BIRD MAKES IT! Assist: Zion Harris
Score: 86-69

[10:24] Team_048 possession (Score: 86-69)
Kyle Irving attempts a 3Pt. Contested by Pau Bird (5.0 feet, ZONE). Kyle Irving misses. Rebound secured by Pau Bird.

[10:06] Team_088 possession (Score: 86-69)
Josh Embiid drives to the basket... Josh Embiid throws a bad pass! Stolen by DeMar Hyland! TURNOVER! (live ball)

[09:48] Team_048 possession (Score: 86-69)
Lauri Curry attempts a 3Pt. Contested by Klay Quickley (6.0 feet, MAN). Lauri Curry misses. Rebound secured by Pau Bird.

[09:34] Team_088 possession (Score: 86-69)
Klay Quickley throws a bad pass! Stolen by Lauri Curry! TURNOVER! (live ball)

[09:23] Team_048 possession (Score: 86-69)
DeMar Hyland drives to the basket... DeMar Hyland commits a violation (traveling/carry)! TURNOVER! (dead ball)

[09:08] Team_088 possession (Score: 86-69)
Josh Embiid makes the Layup and draws the foul on DeMar Hyland! And-1! Josh Embiid to the line for 1. [Team fouls: 1] (DeMar Hyland: 1 personal fouls)   FT 1/1: GOOD Josh Embiid makes 1/1 from the line.
Score: 86-72

[08:53] Team_048 possession (Score: 86-72)
DeMar Hyland drives, picks up Zion Harris. Help arrives from Klay Quickley! DeMar Hyland attempts a Layup. Contested by Klay Quickley (6.0 feet, ZONE). DEMAR HYLAND MAKES IT! Assist: Gary Giddey
Score: 88-72

[08:39] Team_088 possession (Score: 88-72)
FOUL! Holding foul on DeMar Hyland. [Team fouls: 2] No free throws, side out. (DeMar Hyland: 2 personal fouls)

[08:26] Team_088 possession (Score: 88-72)
Vince Carter attempts a 3Pt. Contested by Yao Booker (4.4 feet, ZONE). VINCE CARTER MAKES IT! Assist: Josh Embiid
Score: 88-75

[08:12] Team_048 possession (Score: 88-75)
DeMar Hyland attempts a Layup. Contested by Zion Harris (6.0 feet, MAN). DEMAR HYLAND MAKES IT! Assist: Gary Giddey
Score: 90-75

[07:59] Team_088 possession (Score: 90-75)
Vince Carter attempts a Layup. BLOCKED BY KYLE IRVING! Ball is loose! Rebound secured by DeMar Hyland.

[07:46] Team_048 possession (Score: 90-75)
Kyle Irving drives to the basket... Kyle Irving loses control! Ball rolls out of bounds! TURNOVER! (dead ball)

[07:31] Team_088 possession (Score: 90-75)
Zion Harris throws a bad pass! Stolen by DeMar Hyland! TURNOVER! (live ball)

[07:14] Team_048 possession (Score: 90-75)
DeMar Hyland drives to the basket... DeMar Hyland loses control! Ball rolls out of bounds! TURNOVER! (dead ball)

[06:58] Team_088 possession (Score: 90-75)
Klay Quickley attempts a 3Pt. Contested by DeMar Hyland (3.5 feet, ZONE). Klay Quickley misses. FOUL! Loose ball foul on Kyle Irving during the rebound battle. [Team fouls: 3] No free throws, side out. (Kyle Irving: 1 personal fouls)

[06:45] Team_088 possession (Score: 90-75)
Pau Bird attempts a 3Pt. Contested by DeMar Hyland (3.7 feet, ZONE). PAU BIRD MAKES IT! Assist: Klay Quickley
Score: 90-78

[06:29] Team_048 possession (Score: 90-78)
FOUL! Shooting foul on Josh Embiid. Gary Giddey to the line for 2 free throws. [Team fouls: 2] (Josh Embiid: 1 personal fouls)   FT 1/2: GOOD   FT 2/2: GOOD Gary Giddey makes 2/2 from the line.
Score: 92-78

[06:12] Team_088 possession (Score: 92-78)
Pau Bird makes the Layup and draws the foul on Kyle Irving! And-1! Pau Bird to the line for 1. [Team fouls: 4] (Kyle Irving: 2 personal fouls)   FT 1/1: GOOD Pau Bird makes 1/1 from the line.
Score: 92-81

[05:58] Team_048 possession (Score: 92-81)
FOUL! Shooting foul on Klay Quickley. Lauri Curry to the line for 3 free throws. [Team fouls: 3] (Klay Quickley: 1 personal fouls)   FT 1/3: GOOD   FT 2/3: MISS   FT 3/3: GOOD Lauri Curry makes 2/3 from the line.
Score: 94-81

[05:45] Team_088 possession (Score: 94-81)
Zion Harris attempts a 3Pt. Contested by DeMar Hyland (4.0 feet, ZONE). Zion Harris misses. Offensive rebound by Pau Bird! Pau Bird kicks it out.

[05:30] Team_088 possession (Score: 94-81)
Klay Quickley attempts a 3Pt. Contested by Lauri Curry (4.6 feet, MAN). Klay Quickley misses. Offensive rebound by Pau Bird! Pau Bird kicks it out.

[05:14] Team_088 possession (Score: 94-81)
FOUL! Shooting foul on DeMar Hyland. Pau Bird to the line for 3 free throws. [BONUS: 5 team fouls] (DeMar Hyland: 3 personal fouls)   FT 1/3: GOOD   FT 2/3: MISS   FT 3/3: GOOD Pau Bird makes 2/3 from the line.
Score: 94-83

[04:59] Team_048 possession (Score: 94-83)
Kyle Irving drives, Pau Bird stays with him. Kyle Irving attempts a Dunk. Contested by Pau Bird (5.0 feet, MAN). KYLE IRVING MAKES IT! Assist: Gary Giddey
Score: 96-83

[04:42] Team_088 possession (Score: 96-83)
Josh Embiid loses control! Ball rolls out of bounds! TURNOVER! (dead ball)

[04:26] Team_048 possession (Score: 96-83)
Lauri Curry attempts a Midrange. Contested by Klay Quickley (6.0 feet, MAN). LAURI CURRY MAKES IT! Assist: DeMar Hyland
Score: 98-83

[04:09] Team_088 possession (Score: 98-83)
Josh Embiid makes the Dunk and draws the foul on DeMar Hyland! And-1! Josh Embiid to the line for 1. [BONUS: 6 team fouls] (DeMar Hyland: 4 personal fouls)   FT 1/1: MISS Josh Embiid makes 0/1 from the line. Offensive rebound by Josh Embiid! Josh Embiid kicks it out.
Score: 98-85

[03:53] Team_088 possession (Score: 98-85)
Josh Embiid attempts a Midrange. Contested by Gary Giddey (4.5 feet, ZONE). Josh Embiid misses. Rebound secured by DeMar Hyland.

[03:33] Team_048 possession (Score: 98-85)
Yao Booker attempts a Layup. Contested by Vince Carter (4.8 feet, MAN). YAO BOOKER MAKES IT! Assist: Gary Giddey
Score: 100-85

[03:15] Team_088 possession (Score: 100-85)
Zion Harris drives and kicks out. Josh Embiid attempts a 3Pt. Contested by DeMar Hyland (3.6 feet, ZONE). JOSH EMBIID MAKES IT! Assist: Zion Harris
Score: 100-88

[02:58] Team_048 possession (Score: 100-88)
Yao Booker attempts a 3Pt. Contested by Pau Bird (5.1 feet, ZONE). YAO BOOKER MAKES IT! Assist: Lauri Curry
Score: 103-88

[02:47] Team_088 possession (Score: 103-88)
Pau Bird drives and kicks out. Pau Bird attempts a 3Pt. Contested by DeMar Hyland (3.6 feet, ZONE). Pau Bird misses. Rebound secured by Gary Giddey.

[02:34] Team_048 possession (Score: 103-88)
Gary Giddey attempts a Layup. Contested by Josh Embiid (5.6 feet, MAN). Gary Giddey misses. Rebound secured by Pau Bird.

[02:17] Team_088 possession (Score: 103-88)
Klay Quickley drives, Lauri Curry stays with him. Klay Quickley attempts a Dunk. Contested by Lauri Curry (4.8 feet, MAN). Klay Quickley misses. Rebound secured by DeMar Hyland.

[02:05] Team_048 possession (Score: 103-88)
Gary Giddey attempts a 3Pt. Contested by Josh Embiid (5.6 feet, MAN). GARY GIDDEY MAKES IT! Assist: DeMar Hyland
Score: 106-88

[01:52] Team_088 possession (Score: 106-88)
Zion Harris makes the Layup and draws the foul on DeMar Hyland! And-1! Zion Harris to the line for 1. [BONUS: 7 team fouls] (DeMar Hyland: 5 personal fouls)   FT 1/1: GOOD Zion Harris makes 1/1 from the line.
Score: 106-91

[01:37] Team_048 possession (Score: 106-91)
DeMar Hyland attempts a Midrange. Wide open! Zion Harris is 6.1 feet away. [MAN] DeMar Hyland misses. Rebound secured by Zion Harris.

[01:17] Team_088 possession (Score: 106-91)
Klay Quickley attempts a Midrange. Contested by Lauri Curry (4.9 feet, MAN). KLAY QUICKLEY MAKES IT!
Score: 106-93

[01:02] Team_048 possession (Score: 106-93)
Gary Giddey drives to the basket... FOUL! Offensive foul on Gary Giddey! Zion Harris drew the charge! [Team fouls: 8] (Gary Giddey: 1 personal fouls) TURNOVER! (dead ball)

[00:51] Team_088 possession (Score: 106-93)
Josh Embiid attempts a Midrange. Contested by Yao Booker (4.8 feet, ZONE). JOSH EMBIID MAKES IT! Assist: Vince Carter
Score: 106-95

[00:33] Team_048 possession (Score: 106-95)
Lauri Curry makes the Layup and draws the foul on Klay Quickley! And-1! Lauri Curry to the line for 1. [Team fouls: 4] (Klay Quickley: 2 personal fouls)   FT 1/1: GOOD Lauri Curry makes 1/1 from the line.
Score: 109-95

[00:20] Team_088 possession (Score: 109-95)
Josh Embiid makes the Layup and draws the foul on DeMar Hyland! And-1! Josh Embiid to the line for 1. [BONUS: 9 team fouls] (DeMar Hyland: 6 personal fouls) DeMar Hyland FOULS OUT!   FT 1/1: MISS Josh Embiid makes 0/1 from the line. Offensive rebound by Josh Embiid! Josh Embiid kicks it out.
Score: 109-97

[00:20] Substitution (Team_048): DeMar Hyland OUT (stamina: 66) → Paolo Rozier IN (foul_out)

[00:02] Team_088 possession (Score: 109-97)
Klay Quickley attempts a 3Pt. Contested by Paolo Rozier (5.1 feet, MAN). Klay Quickley misses. Rebound secured by Kyle Irving.

================================================================================
                              4TH QUARTER COMPLETE                              
================================================================================

4TH QUARTER SCORE: Team_048 25, Team_088 36

BOX SCORE:
================================================================================

Team_048
--------------------------------------------------------------------------------
Player                MIN  PTS  REB  AST  TO      FG   FG%      3P   3P%
--------------------------------------------------------------------------------
Lauri Curry            22    7    0    1   0   3/5    60.0     0/0   0.0
Gary Giddey            22    5    1    4   0   2/3    66.7     0/0   0.0
Yao Booker             22    5    0    0   0   2/2   100.0     0/0   0.0
DeMar Hyland           22    4    3    2   0   2/3    66.7     0/0   0.0
Damian Mobley          26    2    0    0   0   1/1   100.0     0/0   0.0
Kyle Irving            22    2    1    0   0   1/2    50.0     0/0   0.0
Kevin Fox              26    0    1    0   0   0/0     0.0     0/0   0.0

TEAM: FG: 11/16 (68.8%), 3PT: 3/5 (60.0%), REB: 6 (1 off, 5 def), AST: 7, TO: 5
TEAM FOULS: 9 [Team_088 in BONUS]


Team_088
--------------------------------------------------------------------------------
Player                MIN  PTS  REB  AST  TO      FG   FG%      3P   3P%
--------------------------------------------------------------------------------
Pau Bird               22   11    5    0   0   4/5    80.0     0/0   0.0
Josh Embiid            22    8    3    1   0   3/4    75.0     0/0   0.0
Zion Harris            22    5    2    2   0   2/2   100.0     0/0   0.0
Josh Duncan            26    3    0    0   0   1/1   100.0     0/0   0.0
Vince Carter           22    3    0    1   0   1/2    50.0     0/0   0.0
Klay Quickley          22    2    0    2   0   1/3    33.3     0/0   0.0

TEAM: FG: 12/17 (70.6%), 3PT: 5/6 (83.3%), REB: 10 (5 off, 5 def), AST: 6, TO: 4
TEAM FOULS: 4

================================================================================

================================================================================
                               FULL GAME COMPLETE                               
================================================================================

FINAL SCORE: Team_048 109, Team_088 97

SCORING BY QUARTER:
--------------------------------------------------------------------------------
Team                     Q1     Q2     Q3     Q4    FINAL
--------------------------------------------------------------------------------
Team_048                 33     22     29     25      109
Team_088                 23     19     19     36       97
--------------------------------------------------------------------------------

FULL GAME BOX SCORE:
================================================================================

Team_048
--------------------------------------------------------------------------------
Player                MIN  PTS  REB  AST  TO      FG   FG%      3P   3P%      FT STL BLK
--------------------------------------------------------------------------------
Paolo Rozier           26    9    0    1   0   7/9    77.8   1/1   100.0   2/2     0   0
Karl Johnson           26   12    0    1   0   8/12   66.7   1/3    33.3   6/8     0   0
Dejounte Sexton        26   22   10    1   3   8/11   72.7   3/4    75.0   7/10    0   0
Kevin Fox              26    8    6    0   1   3/5    60.0   1/1   100.0   3/3     3   1
Damian Mobley          26   13    8    5   4   1/2    50.0   0/1     0.0   1/2     0   0
Lauri Curry            22   12    0    1   1   5/7    71.4   2/3    66.7   3/4     1   0
Yao Booker             22    8    0    2   0   3/5    60.0   2/3    66.7   0/0     0   0
Kyle Irving            22    8    4    1   2   2/5    40.0   0/3     0.0   1/2     0   1
Gary Giddey            22    7    6    6   2   4/6    66.7   1/1   100.0   2/2     0   0
DeMar Hyland           22   10    7    4   1   5/7    71.4   0/1     0.0   2/2     2   2

TEAM: FG: 47/70 (67.1%), 3PT: 11/21 (52.4%), REB: 42 (12 off, 30 def), AST: 22, TO: 14


Team_088
--------------------------------------------------------------------------------
Player                MIN  PTS  REB  AST  TO      FG   FG%      3P   3P%      FT STL BLK
--------------------------------------------------------------------------------
Josh Duncan            26    9    0    2   1   4/7    57.1   4/7    57.1   0/0     0   0
Tobias Haliburton      26   10    0    2   2   7/11   63.6   3/6    50.0   1/1     0   0
Tyler Hyland           26    3    2    2   1   2/6    33.3   1/3    33.3   0/0     1   0
Giannis Smith          26   15   12    2   2   4/8    50.0   2/3    66.7   1/2     2   1
Allen Ming             26    8    5    1   2   2/4    50.0   0/0     0.0   0/0     0   0
Klay Quickley          22    8    0    3   1   3/7    42.9   1/3    33.3   2/6     0   1
Vince Carter           22    3    0    1   0   1/4    25.0   1/3    33.3   0/0     0   0
Pau Bird               22   16    6    1   0   5/9    55.6   3/5    60.0   3/4     0   1
Zion Harris            22    5    4    2   2   3/4    75.0   0/0     0.0   1/1     0   0
Josh Embiid            22   15    8    2   2   6/9    66.7   0/1     0.0   4/6     0   0

TEAM: FG: 37/69 (53.6%), 3PT: 15/31 (48.4%), REB: 35 (14 off, 21 def), AST: 18, TO: 13

================================================================================
