================================================================================
                        FULL GAME - Team_093 vs Team_065                        
================================================================================

================================================================================
                       1ST QUARTER - Team_093 vs Team_065                       
================================================================================

[12:00] Team_093 possession (Score: 0-0)
Trae Westbrook throws a bad pass out of bounds! TURNOVER! (dead ball)

[11:41] Team_065 possession (Score: 0-0)
Russell Wade drives, Vince Barnes stays with him. Russell Wade attempts a Dunk. Contested by Vince Barnes (4.1 feet, ZONE). Russell Wade misses. Rebound secured by Ben Cunningham.

[11:25] Team_093 possession (Score: 0-0)
Carmelo Wagner attempts a 3Pt. Contested by RJ Harden (3.6 feet, ZONE). Carmelo Wagner misses. Offensive rebound by Ben Cunningham! Ben Cunningham kicks it out.

[11:12] Team_093 possession (Score: 0-0)
Vince Barnes attempts a 3Pt. Contested by RJ Harden (4.0 feet, ZONE). Vince Barnes misses. Rebound secured by RJ Harden.

[10:59] Team_065 possession (Score: 0-0)
Manu McGrady attempts a 3Pt. Contested by Carmelo Wagner (3.3 feet, MAN). Manu McGrady misses. Rebound secured by Vince Barnes.

[10:45] Team_093 possession (Score: 0-0)
Vince Barnes drives and kicks out. Damian Williamson attempts a 3Pt. Contested by RJ Harden (3.9 feet, MAN). Damian Williamson misses. Rebound secured by Russell Wade.

[10:30] Team_065 possession (Score: 0-0)
Russell Wade attempts a 3Pt. Contested by Trae Westbrook (5.5 feet, ZONE). Russell Wade misses. Rebound secured by Ben Cunningham.

[10:18] Team_093 possession (Score: 0-0)
Vince Barnes drives, Russell Wade stays with him. Vince Barnes attempts a Layup. Contested by Russell Wade (3.2 feet, ZONE). VINCE BARNES MAKES IT! Assist: Damian Williamson
Score: 2-0

[10:05] Team_065 possession (Score: 2-0)
Russell Wade drives, Ben Cunningham stays with him. Russell Wade attempts a Dunk. Contested by Ben Cunningham (5.0 feet, ZONE). RUSSELL WADE MAKES IT! Assist: RJ Harden
Score: 2-2

[09:50] Team_093 possession (Score: 2-2)
FOUL! Shooting foul on RJ Harden. Damian Williamson to the line for 2 free throws. [Team fouls: 1] (RJ Harden: 1 personal fouls)   FT 1/2: MISS   FT 2/2: MISS Damian Williamson makes 0/2 from the line. Rebound secured by Russell Wade.

[09:38] Team_065 possession (Score: 2-2)
Manu McGrady drives to the basket... Manu McGrady loses the ball! Stripped by Ben Cunningham! TURNOVER! (live ball)

[09:23] Team_093 possession (Score: 2-2)
Carmelo Wagner attempts a 3Pt. Contested by RJ Harden (3.6 feet, ZONE). Carmelo Wagner misses. Rebound secured by Russell Wade.

[09:09] Team_065 possession (Score: 2-2)
Manu McGrady attempts a Midrange. Contested by Carmelo Wagner (3.3 feet, MAN). Manu McGrady misses. Rebound secured by Vince Barnes.

[08:54] Team_093 possession (Score: 2-2)
Damian Williamson attempts a Midrange. Contested by RJ Harden (3.8 feet, MAN). Damian Williamson misses. Rebound secured by Russell Wade.

[08:36] Team_065 possession (Score: 2-2)
Manu McGrady attempts a 3Pt. Contested by Carmelo Wagner (3.3 feet, ZONE). Manu McGrady misses. Rebound secured by Vince Barnes.

[08:18] Team_093 possession (Score: 2-2)
Trae Westbrook attempts a 3Pt. Contested by RJ Harden (3.6 feet, ZONE). Trae Westbrook misses. Rebound secured by Russell Wade.

[08:04] Team_065 possession (Score: 2-2)
Russell Wade attempts a Layup. BLOCKED BY BEN CUNNINGHAM! Ball is loose! Offensive rebound by Manu McGrady! Manu McGrady kicks it out.

[07:54] Team_065 possession (Score: 2-2)
Manu McGrady attempts a 3Pt. Contested by Trae Westbrook (5.4 feet, ZONE). Manu McGrady misses. Rebound secured by Ben Cunningham.

[07:41] Team_093 possession (Score: 2-2)
Damian Williamson attempts a Midrange. Contested by Paul Williamson (3.3 feet, ZONE). Damian Williamson misses. Rebound secured by Russell Wade.

[07:25] Team_065 possession (Score: 2-2)
FOUL! Reach-in foul on Ben Cunningham during the drive. [Team fouls: 1] No free throws, side out. (Ben Cunningham: 1 personal fouls)

[07:08] Team_065 possession (Score: 2-2)
Karl Booker drives and kicks out. Karl Booker attempts a Midrange. Contested by Ben Cunningham (4.9 feet, MAN). KARL BOOKER MAKES IT!
Score: 2-4

[06:55] Team_093 possession (Score: 2-4)
Vince Barnes attempts a 3Pt. Contested by RJ Harden (4.0 feet, ZONE). Vince Barnes misses. Offensive rebound by Ben Cunningham! Ben Cunningham kicks it out.

[06:44] Team_093 possession (Score: 2-4)
Vince Barnes attempts a 3Pt. Contested by RJ Harden (4.0 feet, ZONE). Vince Barnes misses. Rebound secured by Russell Wade.

[06:30] Team_065 possession (Score: 2-4)
FOUL! Holding foul on Vince Barnes. [Team fouls: 2] No free throws, side out. (Vince Barnes: 1 personal fouls)

[06:15] Team_065 possession (Score: 2-4)
Karl Booker loses control! Ball rolls out of bounds! TURNOVER! (dead ball)

[06:02] Team_093 possession (Score: 2-4)
Ben Cunningham attempts a Layup. Contested by Russell Wade (3.6 feet, ZONE). BEN CUNNINGHAM MAKES IT! Assist: Damian Williamson
Score: 4-4

[05:48] Team_065 possession (Score: 4-4)
Karl Booker drives and kicks out. Russell Wade attempts a 3Pt. Contested by Carmelo Wagner (3.4 feet, ZONE). Russell Wade misses. Rebound secured by Ben Cunningham.

[05:35] Team_093 possession (Score: 4-4)
Ben Cunningham attempts a Layup. Contested by Russell Wade (3.6 feet, MAN). BEN CUNNINGHAM MAKES IT! Assist: Damian Williamson
Score: 6-4

[05:21] Team_065 possession (Score: 6-4)
RJ Harden attempts a 3Pt. Contested by Carmelo Wagner (3.8 feet, ZONE). RJ Harden misses. Rebound secured by Vince Barnes.

[05:08] Team_093 possession (Score: 6-4)
Vince Barnes drives, Russell Wade stays with him. Vince Barnes attempts a Dunk. Contested by Russell Wade (3.2 feet, MAN). VINCE BARNES MAKES IT! Assist: Trae Westbrook
Score: 8-4

[04:52] Team_065 possession (Score: 8-4)
Paul Williamson drives, picks up Vince Barnes. Help arrives from Trae Westbrook! Paul Williamson attempts a Layup. Contested by Trae Westbrook (4.2 feet, ZONE). PAUL WILLIAMSON MAKES IT!
Score: 8-6

[04:35] Team_093 possession (Score: 8-6)
Vince Barnes attempts a Midrange. Contested by Russell Wade (3.2 feet, ZONE). Vince Barnes misses. Rebound secured by Manu McGrady.

[04:22] Team_065 possession (Score: 8-6)
Manu McGrady attempts a 3Pt. Contested by Carmelo Wagner (3.4 feet, ZONE). MANU MCGRADY MAKES IT! Assist: Paul Williamson
Score: 8-9

[04:10] Team_093 possession (Score: 8-9)
Ben Cunningham drives, Russell Wade stays with him. Ben Cunningham attempts a Dunk. Contested by Russell Wade (3.6 feet, ZONE). BEN CUNNINGHAM MAKES IT! Assist: Vince Barnes
Score: 10-9

[03:58] Team_065 possession (Score: 10-9)
Manu McGrady attempts a 3Pt. Contested by Carmelo Wagner (3.5 feet, ZONE). Manu McGrady misses. Offensive rebound by Manu McGrady! Manu McGrady kicks it out.

[03:44] Team_065 possession (Score: 10-9)
Manu McGrady attempts a Layup. Contested by Ben Cunningham (5.1 feet, ZONE). MANU MCGRADY MAKES IT! Assist: Karl Booker
Score: 10-11

[03:30] Team_093 possession (Score: 10-11)
FOUL! Shooting foul on RJ Harden. Ben Cunningham to the line for 3 free throws. [Team fouls: 2] (RJ Harden: 2 personal fouls)   FT 1/3: GOOD   FT 2/3: GOOD   FT 3/3: GOOD Ben Cunningham makes 3/3 from the line.
Score: 13-11

[03:16] Team_065 possession (Score: 13-11)
Russell Wade drives and kicks out. RJ Harden attempts a 3Pt. Contested by Damian Williamson (5.1 feet, MAN). RJ Harden misses. Rebound secured by Carmelo Wagner.

[02:59] Team_093 possession (Score: 13-11)
Carmelo Wagner attempts a 3Pt. Contested by RJ Harden (3.7 feet, ZONE). Carmelo Wagner misses. Rebound secured by RJ Harden.

[02:47] Team_065 possession (Score: 13-11)
Manu McGrady attempts a 3Pt. Contested by Carmelo Wagner (3.6 feet, ZONE). MANU MCGRADY MAKES IT!
Score: 13-14

[02:35] Team_093 possession (Score: 13-14)
Carmelo Wagner attempts a 3Pt. Contested by Manu McGrady (4.5 feet, MAN). Carmelo Wagner misses. Rebound secured by Manu McGrady.

[02:18] Team_065 possession (Score: 13-14)
FOUL! Shooting foul on Damian Williamson. RJ Harden to the line for 2 free throws. [Team fouls: 3] (Damian Williamson: 1 personal fouls)   FT 1/2: GOOD   FT 2/2: GOOD RJ Harden makes 2/2 from the line.
Score: 13-16

[02:00] Team_093 possession (Score: 13-16)
Vince Barnes drives and kicks out. Damian Williamson attempts a Midrange. Contested by RJ Harden (4.2 feet, MAN). Damian Williamson misses. Rebound secured by Russell Wade.

[01:46] Team_065 possession (Score: 13-16)
Karl Booker drives and kicks out. Russell Wade attempts a 3Pt. Contested by Carmelo Wagner (3.9 feet, ZONE). Russell Wade misses. Offensive rebound by Manu McGrady! Manu McGrady kicks it out.

[01:34] Team_065 possession (Score: 13-16)
Manu McGrady attempts a 3Pt. Contested by Carmelo Wagner (3.8 feet, MAN). MANU MCGRADY MAKES IT! Assist: RJ Harden
Score: 13-19

[01:22] Team_093 possession (Score: 13-19)
Damian Williamson attempts a 3Pt. Contested by RJ Harden (4.1 feet, MAN). Damian Williamson misses. Rebound secured by RJ Harden.

[01:06] Team_065 possession (Score: 13-19)
Manu McGrady attempts a Midrange. Contested by Carmelo Wagner (3.9 feet, MAN). Manu McGrady misses. Rebound secured by Carmelo Wagner.

[00:46] Team_093 possession (Score: 13-19)
Damian Williamson attempts a 3Pt. Contested by Russell Wade (3.4 feet, ZONE). DAMIAN WILLIAMSON MAKES IT! Assist: Vince Barnes
Score: 16-19

[00:31] Team_065 possession (Score: 16-19)
RJ Harden attempts a 3Pt. Contested by Carmelo Wagner (4.4 feet, ZONE). RJ Harden misses. FOUL! Loose ball foul on Carmelo Wagner during the rebound battle. [Team fouls: 4] No free throws, side out. (Carmelo Wagner: 1 personal fouls)

[00:17] Team_065 possession (Score: 16-19)
Manu McGrady attempts a Layup. Contested by Carmelo Wagner (4.0 feet, MAN). Manu McGrady misses. Rebound secured by Carmelo Wagner.

[00:03] Team_093 possession (Score: 16-19)
Carmelo Wagner attempts a Midrange. Contested by Manu McGrady (4.7 feet, MAN). CARMELO WAGNER MAKES IT!
Score: 18-19

================================================================================
                              1ST QUARTER COMPLETE                              
================================================================================

1ST QUARTER SCORE: Team_093 18, Team_065 19

BOX SCORE:
================================================================================

Team_093
--------------------------------------------------------------------------------
Player                MIN  PTS  REB  AST  TO      FG   FG%      3P   3P%
--------------------------------------------------------------------------------
Ben Cunningham         12    9    6    0   0   4/4   100.0     0/0   0.0
Vince Barnes           12    4    4    2   0   2/7    28.6     0/0   0.0
Damian Williamson      12    3    0    3   0   1/5    20.0     0/0   0.0
Carmelo Wagner         12    2    3    0   0   1/4    25.0     0/0   0.0
Trae Westbrook         12    0    0    1   0   0/1     0.0     0/0   0.0

TEAM: FG: 8/21 (38.1%), 3PT: 2/9 (22.2%), REB: 13 (2 off, 11 def), AST: 6, TO: 1
TEAM FOULS: 4


Team_065
--------------------------------------------------------------------------------
Player                MIN  PTS  REB  AST  TO      FG   FG%      3P   3P%
--------------------------------------------------------------------------------
Manu McGrady           12   11    5    0   0   4/10   40.0     0/0   0.0
Russell Wade           12    2    9    0   0   1/4    25.0     0/0   0.0
RJ Harden              12    2    3    2   0   1/2    50.0     0/0   0.0
Karl Booker            12    2    0    1   0   1/2    50.0     0/0   0.0
Paul Williamson        12    2    0    1   0   1/1   100.0     0/0   0.0

TEAM: FG: 8/19 (42.1%), 3PT: 3/8 (37.5%), REB: 17 (4 off, 13 def), AST: 4, TO: 2
TEAM FOULS: 2

================================================================================

================================================================================
                       2ND QUARTER - Team_093 vs Team_065                       
================================================================================

[12:00] Team_093 possession (Score: 18-19)
Vince Barnes attempts a 3Pt. Contested by RJ Harden (4.3 feet, ZONE). Vince Barnes misses. Rebound secured by RJ Harden.

[11:44] Team_065 possession (Score: 18-19)
Karl Booker attempts a Midrange. Contested by Ben Cunningham (5.3 feet, MAN). KARL BOOKER MAKES IT! Assist: Paul Williamson
Score: 18-21

[11:33] Team_093 possession (Score: 18-21)
Damian Williamson drives and kicks out. Vince Barnes attempts a 3Pt. Contested by Russell Wade (3.4 feet, MAN). Vince Barnes misses. Rebound secured by Manu McGrady.

[11:16] Team_065 possession (Score: 18-21)
Manu McGrady attempts a 3Pt. Contested by Carmelo Wagner (3.8 feet, MAN). MANU MCGRADY MAKES IT! Assist: RJ Harden
Score: 18-24

[10:59] Team_093 possession (Score: 18-24)
Ben Cunningham drives, Russell Wade stays with him. Ben Cunningham attempts a Dunk. Contested by Russell Wade (3.9 feet, MAN). BEN CUNNINGHAM MAKES IT! Assist: Carmelo Wagner
Score: 20-24

[10:41] Team_065 possession (Score: 20-24)
Paul Williamson attempts a Midrange. Contested by Trae Westbrook (5.9 feet, ZONE). Paul Williamson misses. Rebound secured by Vince Barnes.

[10:29] Team_093 possession (Score: 20-24)
Trae Westbrook attempts a Midrange. BLOCKED BY PAUL WILLIAMSON! Ball deflects out of bounds off Trae Westbrook.

[10:16] Team_065 possession (Score: 20-24)
Manu McGrady attempts a Layup. Contested by Ben Cunningham (5.5 feet, ZONE). Manu McGrady misses. Rebound secured by Carmelo Wagner.

[09:57] Team_093 possession (Score: 20-24)
Vince Barnes makes the 3Pt and draws the foul on Russell Wade! And-1! Vince Barnes to the line for 1. [Team fouls: 1] (Russell Wade: 1 personal fouls)   FT 1/1: GOOD Vince Barnes makes 1/1 from the line.
Score: 24-24

[09:46] Team_065 possession (Score: 24-24)
RJ Harden drives and kicks out. Paul Williamson attempts a 3Pt. Contested by Trae Westbrook (5.9 feet, MAN). Paul Williamson misses. Offensive rebound by Manu McGrady! Manu McGrady kicks it out.

[09:30] Team_065 possession (Score: 24-24)
Russell Wade drives, Vince Barnes stays with him. Russell Wade attempts a Layup. Contested by Vince Barnes (4.7 feet, MAN). RUSSELL WADE MAKES IT!
Score: 24-26

[09:16] Team_093 possession (Score: 24-26)
Carmelo Wagner throws a bad pass! Stolen by Manu McGrady! TURNOVER! (live ball)

[09:02] Team_065 possession (Score: 24-26)
Russell Wade attempts a Layup. Contested by Ben Cunningham (5.7 feet, ZONE). RUSSELL WADE MAKES IT! Assist: RJ Harden
Score: 24-28

[08:49] Team_093 possession (Score: 24-28)
Vince Barnes attempts a Midrange. Contested by Manu McGrady (5.3 feet, ZONE). Vince Barnes misses. Rebound secured by RJ Harden.

[08:35] Team_065 possession (Score: 24-28)
Russell Wade drives and kicks out. Paul Williamson attempts a 3Pt. Wide open! Trae Westbrook is 6.1 feet away. [MAN] PAUL WILLIAMSON MAKES IT! Assist: Russell Wade
Score: 24-31

[08:17] Team_093 possession (Score: 24-31)
Damian Williamson commits a violation (traveling/carry)! TURNOVER! (dead ball)

[08:17] Substitution (Team_093): Damian Williamson OUT → Shaquille George IN (stamina_rule2)

[08:17] Substitution (Team_093): Trae Westbrook OUT → Immanuel Cunningham IN (stamina_rule2)

[08:17] Substitution (Team_093): Carmelo Wagner OUT → Lauri Parker IN (stamina_rule2)

[08:17] Substitution (Team_093): Vince Barnes OUT → Kobe Murray IN (stamina_rule2)

[08:17] Substitution (Team_093): Ben Cunningham OUT → Cade O'Neal IN (stamina_rule2)

[08:17] Substitution (Team_065): RJ Harden OUT → Paul Curry IN (stamina_rule2)

[08:17] Substitution (Team_065): Paul Williamson OUT → Derrick Poole IN (stamina_rule2)

[08:17] Substitution (Team_065): Manu McGrady OUT → D'Angelo Porzingis IN (stamina_rule2)

[08:17] Substitution (Team_065): Russell Wade OUT → Karl Leonard IN (stamina_rule2)

[08:17] Substitution (Team_065): Karl Booker OUT → Vince Mobley IN (stamina_rule2)

[08:02] Team_065 possession (Score: 24-31)
Karl Leonard attempts a 3Pt. Contested by Shaquille George (4.7 feet, ZONE). Karl Leonard misses. Rebound secured by Cade O'Neal.

[07:45] Team_093 possession (Score: 24-31)
Kobe Murray attempts a 3Pt. Contested by Karl Leonard (4.5 feet, MAN). Kobe Murray misses. Offensive rebound by Cade O'Neal! Cade O'Neal kicks it out.

[07:33] Team_093 possession (Score: 24-31)
Immanuel Cunningham attempts a 3Pt. Contested by Paul Curry (5.1 feet, ZONE). IMMANUEL CUNNINGHAM MAKES IT! Assist: Lauri Parker
Score: 27-31

[07:20] Team_065 possession (Score: 27-31)
Paul Curry attempts a Layup. Contested by Kobe Murray (4.5 feet, ZONE). Paul Curry misses. Rebound secured by Kobe Murray.

[07:05] Team_093 possession (Score: 27-31)
Immanuel Cunningham attempts a Midrange. Contested by Derrick Poole (5.2 feet, MAN). Immanuel Cunningham misses. Rebound secured by D'Angelo Porzingis.

[06:48] Team_065 possession (Score: 27-31)
FOUL! Reach-in foul on Cade O'Neal during the drive. [Team fouls: 1] No free throws, side out. (Cade O'Neal: 1 personal fouls)

[06:32] Team_065 possession (Score: 27-31)
FOUL! Shooting foul on Shaquille George. D'Angelo Porzingis to the line for 2 free throws. [Team fouls: 2] (Shaquille George: 1 personal fouls)   FT 1/2: GOOD   FT 2/2: GOOD D'Angelo Porzingis makes 2/2 from the line.
Score: 27-33

[06:16] Team_093 possession (Score: 27-33)
Kobe Murray attempts a 3Pt. Contested by Paul Curry (4.9 feet, ZONE). Kobe Murray misses. Rebound secured by Vince Mobley.

[05:58] Team_065 possession (Score: 27-33)
D'Angelo Porzingis drives and kicks out. Derrick Poole attempts a 3Pt. Contested by Immanuel Cunningham (5.6 feet, MAN). DERRICK POOLE MAKES IT! Assist: Paul Curry
Score: 27-36

[05:44] Team_093 possession (Score: 27-36)
Immanuel Cunningham throws a bad pass out of bounds! TURNOVER! (dead ball)

[05:29] Team_065 possession (Score: 27-36)
Paul Curry attempts a Midrange. Contested by Lauri Parker (5.0 feet, ZONE). PAUL CURRY MAKES IT! Assist: D'Angelo Porzingis
Score: 27-38

[05:15] Team_093 possession (Score: 27-38)
Immanuel Cunningham attempts a Midrange. Contested by Derrick Poole (5.2 feet, ZONE). Immanuel Cunningham misses. Rebound secured by Karl Leonard.

[05:04] Team_065 possession (Score: 27-38)
FOUL! Reach-in foul on Kobe Murray during the drive. [Team fouls: 3] No free throws, side out. (Kobe Murray: 1 personal fouls)

[04:50] Team_065 possession (Score: 27-38)
D'Angelo Porzingis drives to the basket... D'Angelo Porzingis throws a bad pass out of bounds! TURNOVER! (dead ball)

[04:37] Team_093 possession (Score: 27-38)
Cade O'Neal attempts a 3Pt. Contested by Paul Curry (4.9 feet, ZONE). Cade O'Neal misses. Rebound secured by Vince Mobley.

[04:24] Team_065 possession (Score: 27-38)
D'Angelo Porzingis attempts a Midrange. Contested by Immanuel Cunningham (5.8 feet, ZONE). D'ANGELO PORZINGIS MAKES IT!
Score: 27-40

[04:07] Team_093 possession (Score: 27-40)
Immanuel Cunningham attempts a Midrange. Contested by Derrick Poole (5.2 feet, MAN). Immanuel Cunningham misses. Rebound secured by Vince Mobley.

[03:57] Team_065 possession (Score: 27-40)
FOUL! Shooting foul on Lauri Parker. Paul Curry to the line for 2 free throws. [Team fouls: 4] (Lauri Parker: 1 personal fouls)   FT 1/2: MISS   FT 2/2: GOOD Paul Curry makes 1/2 from the line.
Score: 27-41

[03:43] Team_093 possession (Score: 27-41)
Cade O'Neal attempts a Layup. BLOCKED BY VINCE MOBLEY! Ball deflects out of bounds off Cade O'Neal.

[03:30] Team_065 possession (Score: 27-41)
FOUL! Holding foul on Kobe Murray. [IN THE BONUS! 5 team fouls] Karl Leonard to the line for 2 free throws. (Kobe Murray: 2 personal fouls)   FT 1/2: GOOD   FT 2/2: MISS Karl Leonard makes 1/2 from the line. Rebound secured by Cade O'Neal.
Score: 27-42

[03:16] Team_093 possession (Score: 27-42)
FOUL! Reach-in foul on Vince Mobley during the drive. [Team fouls: 2] No free throws, side out. (Vince Mobley: 1 personal fouls)

[03:03] Team_093 possession (Score: 27-42)
Immanuel Cunningham loses the ball! Stripped by Derrick Poole! TURNOVER! (live ball)

[02:45] Team_065 possession (Score: 27-42)
Paul Curry attempts a 3Pt. Contested by Shaquille George (4.7 feet, MAN). Paul Curry misses. Rebound secured by Kobe Murray.

[02:32] Team_093 possession (Score: 27-42)
Cade O'Neal makes the Layup and draws the foul on Vince Mobley! And-1! Cade O'Neal to the line for 1. [Team fouls: 3] (Vince Mobley: 2 personal fouls)   FT 1/1: GOOD Cade O'Neal makes 1/1 from the line.
Score: 30-42

[02:18] Team_065 possession (Score: 30-42)
D'Angelo Porzingis drives to the basket... D'Angelo Porzingis throws a bad pass out of bounds! TURNOVER! (dead ball)

[02:05] Team_093 possession (Score: 30-42)
Cade O'Neal drives and kicks out. Immanuel Cunningham attempts a Midrange. Contested by Derrick Poole (5.0 feet, ZONE). IMMANUEL CUNNINGHAM MAKES IT!
Score: 32-42

[01:52] Team_065 possession (Score: 32-42)
Karl Leonard drives to the basket... Karl Leonard loses control! Ball rolls out of bounds! TURNOVER! (dead ball)

[01:33] Team_093 possession (Score: 32-42)
Kobe Murray attempts a Layup. Contested by Karl Leonard (4.5 feet, MAN). KOBE MURRAY MAKES IT! Assist: Lauri Parker
Score: 34-42

[01:14] Team_065 possession (Score: 34-42)
Derrick Poole attempts a 3Pt. Contested by Immanuel Cunningham (5.7 feet, MAN). Derrick Poole misses. Rebound secured by Lauri Parker.

[01:00] Team_093 possession (Score: 34-42)
Cade O'Neal makes the Midrange and draws the foul on Derrick Poole! And-1! Cade O'Neal to the line for 1. [Team fouls: 4] (Derrick Poole: 1 personal fouls)   FT 1/1: GOOD Cade O'Neal makes 1/1 from the line.
Score: 37-42

[00:45] Team_065 possession (Score: 37-42)
D'Angelo Porzingis attempts a Layup. BLOCKED BY LAURI PARKER! Ball is loose! Offensive rebound by Vince Mobley! Vince Mobley kicks it out.

[00:27] Team_065 possession (Score: 37-42)
Derrick Poole attempts a Midrange. Contested by Lauri Parker (4.8 feet, ZONE). Derrick Poole misses. Rebound secured by Lauri Parker.

[00:14] Team_093 possession (Score: 37-42)
Shaquille George drives, Karl Leonard stays with him. Shaquille George attempts a Dunk. Contested by Karl Leonard (4.8 feet, ZONE). SHAQUILLE GEORGE MAKES IT!
Score: 39-42

[00:01] Team_065 possession (Score: 39-42)
Paul Curry drives, Shaquille George stays with him. Paul Curry attempts a Layup. Contested by Shaquille George (4.8 feet, MAN). PAUL CURRY MAKES IT! Assist: Vince Mobley
Score: 39-44

================================================================================
                              2ND QUARTER COMPLETE                              
================================================================================

2ND QUARTER SCORE: Team_093 21, Team_065 25

BOX SCORE:
================================================================================

Team_093
--------------------------------------------------------------------------------
Player                MIN  PTS  REB  AST  TO      FG   FG%      3P   3P%
--------------------------------------------------------------------------------
Cade O'Neal             8    6    3    0   0   2/4    50.0     0/0   0.0
Immanuel Cunningham     8    5    0    0   0   2/5    40.0     0/0   0.0
Vince Barnes           16    4    1    0   0   1/3    33.3     0/0   0.0
Ben Cunningham         16    2    0    0   0   1/1   100.0     0/0   0.0
Kobe Murray             8    2    2    0   0   1/2    50.0     0/0   0.0
Shaquille George        8    2    0    0   0   1/1   100.0     0/0   0.0
Damian Williamson      16    0    0    0   0   0/1     0.0     0/0   0.0
Carmelo Wagner         16    0    1    1   0   0/0     0.0     0/0   0.0
Trae Westbrook         16    0    0    0   0   0/1     0.0     0/0   0.0
Lauri Parker            8    0    2    2   0   0/0     0.0     0/0   0.0

TEAM: FG: 8/18 (44.4%), 3PT: 2/5 (40.0%), REB: 9 (1 off, 8 def), AST: 3, TO: 4
TEAM FOULS: 6 [Team_065 in BONUS]


Team_065
--------------------------------------------------------------------------------
Player                MIN  PTS  REB  AST  TO      FG   FG%      3P   3P%
--------------------------------------------------------------------------------
Paul Curry              8    5    0    1   0   3/5    60.0     0/0   0.0
Russell Wade           16    4    0    1   0   2/2   100.0     0/0   0.0
D'Angelo Porzingis      8    4    1    1   0   2/2   100.0     0/0   0.0
Paul Williamson        16    3    0    1   0   1/2    50.0     0/0   0.0
Manu McGrady           16    3    2    0   0   1/2    50.0     0/0   0.0
Derrick Poole           8    3    0    0   0   1/3    33.3     0/0   0.0
Karl Booker            16    2    0    0   0   1/1   100.0     0/0   0.0
RJ Harden              16    0    2    2   0   0/0     0.0     0/0   0.0
Karl Leonard            8    0    1    0   0   0/1     0.0     0/0   0.0
Vince Mobley            8    0    4    1   0   0/0     0.0     0/0   0.0

TEAM: FG: 11/19 (57.9%), 3PT: 1/4 (25.0%), REB: 10 (2 off, 8 def), AST: 7, TO: 3
TEAM FOULS: 4

================================================================================

================================================================================
                       3RD QUARTER - Team_093 vs Team_065                       
================================================================================

[12:00] Team_093 possession (Score: 39-44)
Vince Barnes attempts a Midrange. Contested by Russell Wade (3.2 feet, MAN). VINCE BARNES MAKES IT!
Score: 41-44

[11:49] Team_065 possession (Score: 41-44)
Manu McGrady attempts a Layup. Contested by Ben Cunningham (4.9 feet, ZONE). Manu McGrady misses. Rebound secured by Ben Cunningham.

[11:34] Team_093 possession (Score: 41-44)
Trae Westbrook drives, picks up Russell Wade. Help arrives from Paul Williamson! Trae Westbrook attempts a Layup. Contested by Paul Williamson (2.8 feet, ZONE). TRAE WESTBROOK MAKES IT!
Score: 43-44

[11:22] Team_065 possession (Score: 43-44)
Paul Williamson attempts a 3Pt. Contested by Trae Westbrook (5.5 feet, MAN). Paul Williamson misses. Rebound secured by Ben Cunningham.

[11:09] Team_093 possession (Score: 43-44)
Vince Barnes attempts a Midrange. Contested by Manu McGrady (4.7 feet, ZONE). VINCE BARNES MAKES IT!
Score: 45-44

[10:56] Team_065 possession (Score: 45-44)
FOUL! Reach-in foul on Trae Westbrook during the drive. [Team fouls: 1] No free throws, side out. (Trae Westbrook: 1 personal fouls)

[10:44] Team_065 possession (Score: 45-44)
RJ Harden throws a bad pass! Stolen by Damian Williamson! TURNOVER! (live ball)

[10:26] Team_093 possession (Score: 45-44)
FOUL! Shooting foul on Manu McGrady. Vince Barnes to the line for 2 free throws. [Team fouls: 1] (Manu McGrady: 1 personal fouls)   FT 1/2: GOOD   FT 2/2: GOOD Vince Barnes makes 2/2 from the line.
Score: 47-44

[10:09] Team_065 possession (Score: 47-44)
RJ Harden attempts a 3Pt. Contested by Carmelo Wagner (3.8 feet, ZONE). RJ Harden misses. Rebound secured by Vince Barnes.

[09:50] Team_093 possession (Score: 47-44)
Damian Williamson attempts a Layup. Contested by Russell Wade (3.0 feet, ZONE). DAMIAN WILLIAMSON MAKES IT! Assist: Vince Barnes
Score: 49-44

[09:39] Team_065 possession (Score: 49-44)
Manu McGrady attempts a Midrange. Contested by Carmelo Wagner (3.3 feet, ZONE). Manu McGrady misses. Rebound secured by Vince Barnes.

[09:27] Team_093 possession (Score: 49-44)
Vince Barnes drives to the basket... Vince Barnes throws a bad pass! Stolen by Russell Wade! TURNOVER! (live ball)

[09:13] Team_065 possession (Score: 49-44)
RJ Harden drives and kicks out. Russell Wade attempts a 3Pt. Contested by Vince Barnes (4.1 feet, MAN). RUSSELL WADE MAKES IT! Assist: RJ Harden
Score: 49-47

[09:01] Team_093 possession (Score: 49-47)
Carmelo Wagner attempts a 3Pt. Contested by RJ Harden (3.6 feet, ZONE). Carmelo Wagner misses. Rebound secured by RJ Harden.

[08:43] Team_065 possession (Score: 49-47)
Russell Wade attempts a Layup. Contested by Vince Barnes (4.1 feet, MAN). Russell Wade misses. Rebound secured by Ben Cunningham.

[08:29] Team_093 possession (Score: 49-47)
Vince Barnes attempts a Midrange. Contested by Russell Wade (3.2 feet, MAN). VINCE BARNES MAKES IT!
Score: 51-47

[08:14] Team_065 possession (Score: 51-47)
Russell Wade attempts a Layup. Contested by Ben Cunningham (5.0 feet, ZONE). RUSSELL WADE MAKES IT! Assist: Paul Williamson
Score: 51-49

[07:57] Team_093 possession (Score: 51-49)
Ben Cunningham attempts a Midrange. Contested by Russell Wade (3.6 feet, MAN). Ben Cunningham misses. Rebound secured by Manu McGrady.

[07:42] Team_065 possession (Score: 51-49)
RJ Harden makes the Midrange and draws the foul on Damian Williamson! And-1! RJ Harden to the line for 1. [Team fouls: 2] (Damian Williamson: 1 personal fouls)   FT 1/1: GOOD RJ Harden makes 1/1 from the line.
Score: 51-52

[07:23] Team_093 possession (Score: 51-52)
Ben Cunningham attempts a 3Pt. Contested by RJ Harden (4.4 feet, ZONE). Ben Cunningham misses. Offensive rebound by Carmelo Wagner! Carmelo Wagner kicks it out.

[07:11] Team_093 possession (Score: 51-52)
Ben Cunningham attempts a Midrange. Contested by Russell Wade (3.6 feet, MAN). Ben Cunningham misses. Rebound secured by Russell Wade.

[06:52] Team_065 possession (Score: 51-52)
Manu McGrady drives to the basket... Manu McGrady commits a violation (traveling/carry)! TURNOVER! (dead ball)

[06:42] Team_093 possession (Score: 51-52)
Damian Williamson attempts a 3Pt. Contested by RJ Harden (3.8 feet, ZONE). Damian Williamson misses. Rebound secured by RJ Harden.

[06:28] Team_065 possession (Score: 51-52)
Karl Booker drives, Ben Cunningham stays with him. Karl Booker attempts a Layup. Contested by Ben Cunningham (4.9 feet, MAN). KARL BOOKER MAKES IT! Assist: Manu McGrady
Score: 51-54

[06:13] Team_093 possession (Score: 51-54)
Carmelo Wagner attempts a Midrange. Contested by Manu McGrady (4.3 feet, ZONE). CARMELO WAGNER MAKES IT! Assist: Ben Cunningham
Score: 53-54

[06:00] Team_065 possession (Score: 53-54)
RJ Harden attempts a Midrange. Contested by Damian Williamson (5.2 feet, MAN). RJ HARDEN MAKES IT! Assist: Karl Booker
Score: 53-56

[05:46] Team_093 possession (Score: 53-56)
Carmelo Wagner attempts a Layup. Contested by Manu McGrady (4.3 feet, MAN). CARMELO WAGNER MAKES IT!
Score: 55-56

[05:32] Team_065 possession (Score: 55-56)
Paul Williamson attempts a Midrange. Contested by Carmelo Wagner (3.5 feet, ZONE). Paul Williamson misses. Rebound secured by Ben Cunningham.

[05:16] Team_093 possession (Score: 55-56)
Trae Westbrook attempts a Midrange. Contested by Paul Williamson (3.2 feet, MAN). Trae Westbrook misses. Rebound secured by Russell Wade.

[05:00] Team_065 possession (Score: 55-56)
Russell Wade attempts a 3Pt. Contested by Carmelo Wagner (3.5 feet, ZONE). RUSSELL WADE MAKES IT!
Score: 55-59

[04:47] Team_093 possession (Score: 55-59)
Trae Westbrook drives, Russell Wade stays with him. Trae Westbrook attempts a Dunk. Contested by Russell Wade (2.9 feet, ZONE). Trae Westbrook misses. FOUL! Loose ball foul on RJ Harden during the rebound battle. [Team fouls: 2] No free throws, side out. (RJ Harden: 1 personal fouls)

[04:32] Team_093 possession (Score: 55-59)
Damian Williamson attempts a Layup. BLOCKED BY RJ HARDEN! Ball goes out off RJ Harden. Damian Williamson's ball!

[04:19] Team_093 possession (Score: 55-59)
Carmelo Wagner attempts a 3Pt. Contested by RJ Harden (3.6 feet, ZONE). Carmelo Wagner misses. Rebound secured by Manu McGrady.

[04:00] Team_065 possession (Score: 55-59)
RJ Harden attempts a Midrange. Contested by Damian Williamson (5.4 feet, MAN). RJ Harden misses. Rebound secured by Ben Cunningham.

[03:43] Team_093 possession (Score: 55-59)
Trae Westbrook attempts a Midrange. Contested by Paul Williamson (3.3 feet, MAN). TRAE WESTBROOK MAKES IT! Assist: Ben Cunningham
Score: 57-59

[03:27] Team_065 possession (Score: 57-59)
Karl Booker makes the 3Pt and draws the foul on Carmelo Wagner! And-1! Karl Booker to the line for 1. [Team fouls: 3] (Carmelo Wagner: 1 personal fouls)   FT 1/1: GOOD Karl Booker makes 1/1 from the line.
Score: 57-63

[03:10] Team_093 possession (Score: 57-63)
Trae Westbrook attempts a 3Pt. Contested by RJ Harden (3.8 feet, ZONE). Trae Westbrook misses. Rebound secured by RJ Harden.

[02:54] Team_065 possession (Score: 57-63)
FOUL! Holding foul on Trae Westbrook. [Team fouls: 4] No free throws, side out. (Trae Westbrook: 2 personal fouls)

[02:39] Team_065 possession (Score: 57-63)
Manu McGrady makes the 3Pt and draws the foul on Carmelo Wagner! And-1! Manu McGrady to the line for 1. [BONUS: 5 team fouls] (Carmelo Wagner: 2 personal fouls)   FT 1/1: MISS Manu McGrady makes 0/1 from the line. Rebound secured by Carmelo Wagner.
Score: 57-66

[02:26] Team_093 possession (Score: 57-66)
Ben Cunningham drives and kicks out. Ben Cunningham attempts a Midrange. Contested by Russell Wade (3.3 feet, MAN). BEN CUNNINGHAM MAKES IT! Assist: Carmelo Wagner
Score: 59-66

[02:11] Team_065 possession (Score: 59-66)
RJ Harden attempts a 3Pt. Contested by Damian Williamson (5.6 feet, MAN). RJ Harden misses. Offensive rebound by Manu McGrady! Manu McGrady kicks it out.

[01:57] Team_065 possession (Score: 59-66)
Paul Williamson attempts a Midrange. Contested by Trae Westbrook (5.8 feet, ZONE). Paul Williamson misses. Offensive rebound by Russell Wade! Russell Wade puts it back in!
Score: 59-68

[01:45] Team_093 possession (Score: 59-68)
Ben Cunningham makes the 3Pt and draws the foul on Russell Wade! And-1! Ben Cunningham to the line for 1. [Team fouls: 3] (Russell Wade: 1 personal fouls)   FT 1/1: GOOD Ben Cunningham makes 1/1 from the line.
Score: 63-68

[01:34] Team_065 possession (Score: 63-68)
Russell Wade attempts a 3Pt. Contested by Vince Barnes (4.5 feet, MAN). RUSSELL WADE MAKES IT! Assist: RJ Harden
Score: 63-71

[01:23] Team_093 possession (Score: 63-71)
Damian Williamson makes the Layup and draws the foul on RJ Harden! And-1! Damian Williamson to the line for 1. [Team fouls: 4] (RJ Harden: 2 personal fouls)   FT 1/1: GOOD Damian Williamson makes 1/1 from the line.
Score: 66-71

[01:09] Team_065 possession (Score: 66-71)
Russell Wade attempts a 3Pt. Contested by Vince Barnes (4.5 feet, MAN). Russell Wade misses. Rebound secured by Ben Cunningham.

[00:56] Team_093 possession (Score: 66-71)
Trae Westbrook drives and kicks out. Damian Williamson attempts a Midrange. Contested by RJ Harden (4.3 feet, MAN). Damian Williamson misses. Offensive rebound by Carmelo Wagner! Carmelo Wagner kicks it out.

[00:41] Team_093 possession (Score: 66-71)
FOUL! Shooting foul on Karl Booker. Damian Williamson to the line for 2 free throws. [BONUS: 5 team fouls] (Karl Booker: 1 personal fouls)   FT 1/2: GOOD   FT 2/2: MISS Damian Williamson makes 1/2 from the line. Offensive rebound by Ben Cunningham! Ben Cunningham kicks it out.
Score: 67-71

[00:26] Team_093 possession (Score: 67-71)
Ben Cunningham drives to the basket... FOUL! Offensive foul on Ben Cunningham! Russell Wade drew the charge! [Team fouls: 6] (Ben Cunningham: 1 personal fouls) TURNOVER! (dead ball)

[00:15] Team_065 possession (Score: 67-71)
Manu McGrady attempts a 3Pt. Contested by Carmelo Wagner (4.0 feet, MAN). Manu McGrady misses. Rebound secured by Ben Cunningham.

[00:01] Team_093 possession (Score: 67-71)
Carmelo Wagner drives and kicks out. Ben Cunningham attempts a 3Pt. Contested by RJ Harden (4.4 feet, ZONE). Ben Cunningham misses. Offensive rebound by Carmelo Wagner! Carmelo Wagner kicks it out.

================================================================================
                              3RD QUARTER COMPLETE                              
================================================================================

3RD QUARTER SCORE: Team_093 28, Team_065 27

BOX SCORE:
================================================================================

Team_093
--------------------------------------------------------------------------------
Player                MIN  PTS  REB  AST  TO      FG   FG%      3P   3P%
--------------------------------------------------------------------------------
Vince Barnes           28    8    2    1   0   4/4   100.0     0/0   0.0
Ben Cunningham         28    6    9    2   0   2/4    50.0     0/0   0.0
Damian Williamson      28    5    0    0   0   2/3    66.7     0/0   0.0
Trae Westbrook         28    4    0    0   0   2/4    50.0     0/0   0.0
Carmelo Wagner         28    4    4    1   0   2/4    50.0     0/0   0.0

TEAM: FG: 12/19 (63.2%), 3PT: 1/5 (20.0%), REB: 15 (5 off, 10 def), AST: 4, TO: 2
TEAM FOULS: 6 [Team_065 in BONUS]


Team_065
--------------------------------------------------------------------------------
Player                MIN  PTS  REB  AST  TO      FG   FG%      3P   3P%
--------------------------------------------------------------------------------
Russell Wade           28   13    3    0   0   5/7    71.4     0/0   0.0
Karl Booker            28    6    0    1   0   2/2   100.0     0/0   0.0
RJ Harden              28    5    3    2   0   2/4    50.0     0/0   0.0
Manu McGrady           28    0    3    1   0   0/4     0.0     0/0   0.0
Paul Williamson        28    0    0    1   0   0/2     0.0     0/0   0.0

TEAM: FG: 9/19 (47.4%), 3PT: 3/8 (37.5%), REB: 9 (2 off, 7 def), AST: 5, TO: 2
TEAM FOULS: 5 [Team_093 in BONUS]

================================================================================

================================================================================
                       4TH QUARTER - Team_093 vs Team_065                       
================================================================================

[12:00] Team_093 possession (Score: 67-71)
Carmelo Wagner attempts a 3Pt. Contested by Manu McGrady (4.5 feet, MAN). Carmelo Wagner misses. Rebound secured by RJ Harden.

[11:51] Team_065 possession (Score: 67-71)
FOUL! Shooting foul on Ben Cunningham. Karl Booker to the line for 2 free throws. [Team fouls: 1] (Ben Cunningham: 1 personal fouls)   FT 1/2: GOOD   FT 2/2: MISS Karl Booker makes 1/2 from the line. Rebound secured by Ben Cunningham.
Score: 67-72

[11:35] Team_093 possession (Score: 67-72)
Damian Williamson loses the ball! Stripped by RJ Harden! TURNOVER! (live ball)

[11:19] Team_065 possession (Score: 67-72)
RJ Harden attempts a Midrange. Contested by Vince Barnes (4.9 feet, ZONE). RJ Harden misses. Rebound secured by Ben Cunningham.

[11:04] Team_093 possession (Score: 67-72)
Trae Westbrook attempts a 3Pt. Contested by RJ Harden (4.0 feet, ZONE). Trae Westbrook misses. Rebound secured by RJ Harden.

[10:47] Team_065 possession (Score: 67-72)
Paul Williamson attempts a Midrange. Contested by Trae Westbrook (5.9 feet, MAN). PAUL WILLIAMSON MAKES IT! Assist: Karl Booker
Score: 67-74

[10:34] Team_093 possession (Score: 67-74)
Trae Westbrook drives and kicks out. Ben Cunningham attempts a 3Pt. Contested by RJ Harden (4.3 feet, ZONE). BEN CUNNINGHAM MAKES IT! Assist: Trae Westbrook
Score: 70-74

[10:17] Team_065 possession (Score: 70-74)
Karl Booker drives and kicks out. Russell Wade attempts a 3Pt. Contested by Vince Barnes (4.6 feet, MAN). Russell Wade misses. Rebound secured by Vince Barnes.

[10:06] Team_093 possession (Score: 70-74)
Ben Cunningham attempts a 3Pt. Contested by Russell Wade (4.0 feet, ZONE). Ben Cunningham misses. Rebound secured by Russell Wade.

[09:52] Team_065 possession (Score: 70-74)
RJ Harden attempts a Layup. Contested by Ben Cunningham (6.0 feet, ZONE). RJ HARDEN MAKES IT!
Score: 70-76

[09:38] Team_093 possession (Score: 70-76)
Damian Williamson drives to the basket... Damian Williamson loses control! Ball rolls out of bounds! TURNOVER! (dead ball)

[09:38] Substitution (Team_093): Damian Williamson OUT → Shaquille George IN (stamina_rule2)

[09:38] Substitution (Team_093): Trae Westbrook OUT → Immanuel Cunningham IN (stamina_rule2)

[09:38] Substitution (Team_093): Carmelo Wagner OUT → Lauri Parker IN (stamina_rule2)

[09:38] Substitution (Team_093): Vince Barnes OUT → Kobe Murray IN (stamina_rule2)

[09:38] Substitution (Team_093): Ben Cunningham OUT → Cade O'Neal IN (stamina_rule2)

[09:38] Substitution (Team_065): RJ Harden OUT → Paul Curry IN (stamina_rule2)

[09:38] Substitution (Team_065): Paul Williamson OUT → Derrick Poole IN (stamina_rule2)

[09:38] Substitution (Team_065): Manu McGrady OUT → D'Angelo Porzingis IN (stamina_rule2)

[09:38] Substitution (Team_065): Russell Wade OUT → Karl Leonard IN (stamina_rule2)

[09:38] Substitution (Team_065): Karl Booker OUT → Vince Mobley IN (stamina_rule2)

[09:25] Team_065 possession (Score: 70-76)
Derrick Poole drives and kicks out. D'Angelo Porzingis attempts a 3Pt. Contested by Shaquille George (4.3 feet, ZONE). D'ANGELO PORZINGIS MAKES IT! Assist: Vince Mobley
Score: 70-79

[09:08] Team_093 possession (Score: 70-79)
Kobe Murray attempts a Midrange. Contested by Derrick Poole (5.1 feet, ZONE). Kobe Murray misses. Rebound secured by Karl Leonard.

[08:51] Team_065 possession (Score: 70-79)
Vince Mobley attempts a Midrange. Contested by Kobe Murray (4.1 feet, ZONE). VINCE MOBLEY MAKES IT! Assist: Derrick Poole
Score: 70-81

[08:34] Team_093 possession (Score: 70-81)
Shaquille George throws a bad pass! Stolen by Paul Curry! TURNOVER! (live ball)

[08:22] Team_065 possession (Score: 70-81)
Derrick Poole attempts a 3Pt. Contested by Immanuel Cunningham (5.7 feet, ZONE). DERRICK POOLE MAKES IT! Assist: D'Angelo Porzingis
Score: 70-84

[08:11] Team_093 possession (Score: 70-84)
Shaquille George attempts a 3Pt. Contested by Paul Curry (5.1 feet, ZONE). SHAQUILLE GEORGE MAKES IT! Assist: Kobe Murray
Score: 73-84

[07:54] Team_065 possession (Score: 73-84)
Paul Curry attempts a Layup. Contested by Kobe Murray (4.5 feet, ZONE). Paul Curry misses. Rebound secured by Kobe Murray.

[07:38] Team_093 possession (Score: 73-84)
Kobe Murray drives to the basket... Kobe Murray throws a bad pass! Stolen by Karl Leonard! TURNOVER! (live ball)

[07:22] Team_065 possession (Score: 73-84)
Karl Leonard drives and kicks out. Vince Mobley attempts a Midrange. Contested by Kobe Murray (4.1 feet, MAN). Vince Mobley misses. Rebound secured by Lauri Parker.

[07:06] Team_093 possession (Score: 73-84)
FOUL! Shooting foul on Vince Mobley. Cade O'Neal to the line for 2 free throws. [Team fouls: 1] (Vince Mobley: 1 personal fouls)   FT 1/2: GOOD   FT 2/2: GOOD Cade O'Neal makes 2/2 from the line.
Score: 75-84

[06:53] Team_065 possession (Score: 75-84)
FOUL! Reach-in foul on Shaquille George during the drive. [Team fouls: 2] No free throws, side out. (Shaquille George: 1 personal fouls)

[06:39] Team_065 possession (Score: 75-84)
Derrick Poole attempts a Midrange. Contested by Kobe Murray (4.1 feet, ZONE). Derrick Poole misses. Rebound secured by Kobe Murray.

[06:24] Team_093 possession (Score: 75-84)
Kobe Murray attempts a Midrange. Contested by Karl Leonard (4.5 feet, MAN). Kobe Murray misses. Rebound secured by Vince Mobley.

[06:13] Team_065 possession (Score: 75-84)
Karl Leonard drives, picks up Kobe Murray. Help arrives from Shaquille George! Karl Leonard attempts a Dunk. Contested by Shaquille George (4.4 feet, MAN). KARL LEONARD MAKES IT! Assist: Derrick Poole
Score: 75-86

[05:58] Team_093 possession (Score: 75-86)
Kobe Murray attempts a 3Pt. Contested by Karl Leonard (4.5 feet, MAN). Kobe Murray misses. Rebound secured by Vince Mobley.

[05:44] Team_065 possession (Score: 75-86)
Derrick Poole attempts a 3Pt. Contested by Shaquille George (4.4 feet, ZONE). Derrick Poole misses. Rebound secured by Kobe Murray.

[05:30] Team_093 possession (Score: 75-86)
Cade O'Neal drives, picks up Vince Mobley. Help arrives from Derrick Poole! Cade O'Neal attempts a Layup. Contested by Derrick Poole (4.2 feet, ZONE). CADE O'NEAL MAKES IT!
Score: 77-86

[05:16] Team_065 possession (Score: 77-86)
FOUL! Holding foul on Kobe Murray. [Team fouls: 3] No free throws, side out. (Kobe Murray: 1 personal fouls)

[04:57] Team_065 possession (Score: 77-86)
Vince Mobley attempts a Layup. Contested by Kobe Murray (4.1 feet, ZONE). Vince Mobley misses. Rebound secured by Lauri Parker.

[04:45] Team_093 possession (Score: 77-86)
Shaquille George attempts a 3Pt. Contested by Paul Curry (5.1 feet, MAN). Shaquille George misses. Rebound secured by Vince Mobley.

[04:33] Team_065 possession (Score: 77-86)
Karl Leonard attempts a 3Pt. Contested by Kobe Murray (4.4 feet, MAN). Karl Leonard misses. Rebound secured by Kobe Murray.

[04:22] Team_093 possession (Score: 77-86)
Kobe Murray attempts a 3Pt. Contested by Karl Leonard (4.5 feet, MAN). Kobe Murray misses. Offensive rebound by Kobe Murray! Kobe Murray's putback is no good. Rebound secured by Vince Mobley.

[04:12] Team_065 possession (Score: 77-86)
Derrick Poole attempts a 3Pt. Contested by Immanuel Cunningham (5.7 feet, MAN). Derrick Poole misses. Rebound secured by Cade O'Neal.

[04:00] Team_093 possession (Score: 77-86)
Shaquille George drives, Vince Mobley stays with him. Shaquille George attempts a Layup. Contested by Vince Mobley (4.5 feet, ZONE). SHAQUILLE GEORGE MAKES IT!
Score: 79-86

[03:42] Team_065 possession (Score: 79-86)
Karl Leonard throws a bad pass out of bounds! TURNOVER! (dead ball)

[03:29] Team_093 possession (Score: 79-86)
Lauri Parker drives and kicks out. FOUL! Shooting foul on D'Angelo Porzingis. Lauri Parker to the line for 2 free throws. [Team fouls: 2] (D'Angelo Porzingis: 1 personal fouls)   FT 1/2: MISS   FT 2/2: MISS Lauri Parker makes 0/2 from the line. Rebound secured by Karl Leonard.

[03:13] Team_065 possession (Score: 79-86)
Karl Leonard attempts a 3Pt. Contested by Kobe Murray (4.4 feet, MAN). Karl Leonard misses. Rebound secured by Kobe Murray.

[03:02] Team_093 possession (Score: 79-86)
Immanuel Cunningham drives, picks up Vince Mobley. Help arrives from Derrick Poole! Immanuel Cunningham attempts a Dunk. Contested by Derrick Poole (4.4 feet, ZONE). IMMANUEL CUNNINGHAM MAKES IT!
Score: 81-86

[02:47] Team_065 possession (Score: 81-86)
Vince Mobley drives and kicks out. D'Angelo Porzingis attempts a Midrange. Contested by Lauri Parker (4.7 feet, MAN). D'ANGELO PORZINGIS MAKES IT! Assist: Derrick Poole
Score: 81-88

[02:31] Team_093 possession (Score: 81-88)
Lauri Parker attempts a 3Pt. Contested by D'Angelo Porzingis (4.4 feet, MAN). Lauri Parker misses. FOUL! Loose ball foul on Karl Leonard during the rebound battle. [Team fouls: 3] No free throws, side out. (Karl Leonard: 1 personal fouls)

[02:20] Team_093 possession (Score: 81-88)
Kobe Murray drives to the basket... Kobe Murray loses control! Ball rolls out of bounds! TURNOVER! (dead ball)

[02:05] Team_065 possession (Score: 81-88)
Karl Leonard drives, picks up Kobe Murray. Help arrives from Shaquille George! Karl Leonard attempts a Layup. Contested by Shaquille George (4.5 feet, MAN). KARL LEONARD MAKES IT! Assist: Paul Curry
Score: 81-90

[01:50] Team_093 possession (Score: 81-90)
Lauri Parker attempts a Midrange. Contested by D'Angelo Porzingis (4.4 feet, MAN). Lauri Parker misses. Rebound secured by Vince Mobley.

[01:35] Team_065 possession (Score: 81-90)
D'Angelo Porzingis attempts a 3Pt. Contested by Lauri Parker (4.9 feet, MAN). D'ANGELO PORZINGIS MAKES IT! Assist: Vince Mobley
Score: 81-93

[01:15] Team_093 possession (Score: 81-93)
Shaquille George attempts a Midrange. Contested by Paul Curry (5.2 feet, MAN). Shaquille George misses. Rebound secured by Vince Mobley.

[01:02] Team_065 possession (Score: 81-93)
Paul Curry attempts a 3Pt. Contested by Shaquille George (4.9 feet, MAN). Paul Curry misses. Rebound secured by Lauri Parker.

[00:47] Team_093 possession (Score: 81-93)
Cade O'Neal attempts a Midrange. Contested by Vince Mobley (4.5 feet, MAN). Cade O'Neal misses. Offensive rebound by Cade O'Neal! Cade O'Neal kicks it out.

[00:33] Team_093 possession (Score: 81-93)
Kobe Murray attempts a Midrange. Contested by Derrick Poole (5.2 feet, ZONE). KOBE MURRAY MAKES IT!
Score: 83-93

[00:18] Team_065 possession (Score: 83-93)
Vince Mobley makes the Layup and draws the foul on Kobe Murray! And-1! Vince Mobley to the line for 1. [Team fouls: 4] (Kobe Murray: 2 personal fouls)   FT 1/1: GOOD Vince Mobley makes 1/1 from the line.
Score: 83-96

[00:06] Team_093 possession (Score: 83-96)
Shaquille George attempts a 3Pt. Contested by Paul Curry (5.3 feet, MAN). Shaquille George misses. Rebound secured by Vince Mobley.

================================================================================
                              4TH QUARTER COMPLETE                              
================================================================================

4TH QUARTER SCORE: Team_093 16, Team_065 25

BOX SCORE:
================================================================================

Team_093
--------------------------------------------------------------------------------
Player                MIN  PTS  REB  AST  TO      FG   FG%      3P   3P%
--------------------------------------------------------------------------------
Shaquille George       18    5    0    0   0   2/5    40.0     0/0   0.0
Cade O'Neal            18    4    3    0   0   2/2   100.0     0/0   0.0
Ben Cunningham         31    3    2    0   0   1/2    50.0     0/0   0.0
Kobe Murray            18    2    5    1   0   1/5    20.0     0/0   0.0
Immanuel Cunningham    18    2    0    0   0   1/1   100.0     0/0   0.0
Carmelo Wagner         31    0    0    0   0   0/1     0.0     0/0   0.0
Trae Westbrook         31    0    0    1   0   0/1     0.0     0/0   0.0
Vince Barnes           31    0    1    0   0   0/0     0.0     0/0   0.0
Lauri Parker           18    0    3    0   0   0/2     0.0     0/0   0.0

TEAM: FG: 7/19 (36.8%), 3PT: 1/8 (12.5%), REB: 15 (3 off, 12 def), AST: 2, TO: 5
TEAM FOULS: 4


Team_065
--------------------------------------------------------------------------------
Player                MIN  PTS  REB  AST  TO      FG   FG%      3P   3P%
--------------------------------------------------------------------------------
D'Angelo Porzingis     18    8    0    1   0   3/3   100.0     0/0   0.0
Vince Mobley           18    5    7    2   0   2/3    66.7     0/0   0.0
Karl Leonard           18    4    2    0   0   2/5    40.0     0/0   0.0
Derrick Poole          18    3    0    3   0   1/4    25.0     0/0   0.0
RJ Harden              31    2    2    0   0   1/2    50.0     0/0   0.0
Paul Williamson        31    2    0    0   0   1/1   100.0     0/0   0.0
Karl Booker            31    0    0    1   0   0/2     0.0     0/0   0.0
Russell Wade           31    0    1    0   0   0/0     0.0     0/0   0.0
Paul Curry             18    0    0    1   0   0/2     0.0     0/0   0.0

TEAM: FG: 10/22 (45.5%), 3PT: 2/7 (28.6%), REB: 11 (0 off, 11 def), AST: 8, TO: 1
TEAM FOULS: 3

================================================================================

================================================================================
                               FULL GAME COMPLETE                               
================================================================================

FINAL SCORE: Team_093 83, Team_065 96

SCORING BY QUARTER:
--------------------------------------------------------------------------------
Team                     Q1     Q2     Q3     Q4    FINAL
--------------------------------------------------------------------------------
Team_093                 18     21     28     16       83
Team_065                 19     25     27     25       96
--------------------------------------------------------------------------------

FULL GAME BOX SCORE:
================================================================================

Team_093
--------------------------------------------------------------------------------
Player                MIN  PTS  REB  AST  TO      FG   FG%      3P   3P%      FT STL BLK
--------------------------------------------------------------------------------
Damian Williamson      31    8    0    3   2   3/9    33.3   1/3    33.3   2/5     1   0
Trae Westbrook         31    4    0    2   1   3/8    37.5   0/3     0.0   0/0     0   0
Carmelo Wagner         31    6    8    2   2   3/9    33.3   0/6     0.0   0/0     0   0
Vince Barnes           31   16    8    3   2   7/14   50.0   1/4    25.0   3/3     0   0
Ben Cunningham         31   20   17    2   0   7/10   70.0   2/3    66.7   4/4     1   1
Shaquille George       18    7    0    0   1   3/6    50.0   1/3    33.3   0/0     0   0
Immanuel Cunningham    18    7    0    0   4   2/5    40.0   1/1   100.0   0/0     0   0
Lauri Parker           18    0    5    2   0   0/2     0.0   0/0     0.0   0/2     0   1
Kobe Murray            18    4    7    1   0   2/7    28.6   0/3     0.0   0/0     0   0
Cade O'Neal            18   10    6    0   0   5/7    71.4   0/1     0.0   4/4     0   0

TEAM: FG: 35/77 (45.5%), 3PT: 6/27 (22.2%), REB: 52 (11 off, 41 def), AST: 15, TO: 12


Team_065
--------------------------------------------------------------------------------
Player                MIN  PTS  REB  AST  TO      FG   FG%      3P   3P%      FT STL BLK
--------------------------------------------------------------------------------
RJ Harden              31    9   10    6   1   5/9    55.6   0/2     0.0   3/3     1   1
Paul Williamson        31    7    0    3   0   3/6    50.0   0/1     0.0   0/0     0   1
Manu McGrady           31   14   10    1   1   5/16   31.2   4/9    44.4   0/1     1   0
Russell Wade           31   19   13    1   0   7/12   58.3   2/4    50.0   0/0     1   0
Karl Booker            31   10    0    3   2   4/7    57.1   1/1   100.0   2/3     0   0
Paul Curry             18    5    0    2   1   3/7    42.9   0/2     0.0   1/2     1   0
Derrick Poole          18    6    0    3   1   2/7    28.6   1/4    25.0   0/0     1   0
D'Angelo Porzingis     18   12    1    2   0   4/4   100.0   1/1   100.0   2/2     0   0
Karl Leonard           18    4    3    0   1   2/6    33.3   0/3     0.0   1/2     1   0
Vince Mobley           18    5   11    3   1   3/4    75.0   0/0     0.0   1/1     0   1

TEAM: FG: 38/79 (48.1%), 3PT: 9/27 (33.3%), REB: 47 (8 off, 39 def), AST: 24, TO: 8

================================================================================
