================================================================================
                        FULL GAME - Team_038 vs Team_095                        
================================================================================

================================================================================
                       1ST QUARTER - Team_038 vs Team_095                       
================================================================================

[12:00] Team_038 possession (Score: 0-0)
Rudy Thompson attempts a Layup. Contested by Dejounte Hyland (5.5 feet, MAN). Rudy Thompson misses. Rebound secured by Shaquille Ball.

[11:45] Team_095 possession (Score: 0-0)
Immanuel Middleton drives and kicks out. Shaquille Ball attempts a Midrange. Contested by Malcolm Poole (4.9 feet, MAN). Shaquille Ball misses. Offensive rebound by Dejounte Hyland! Dejounte Hyland kicks it out.

[11:30] Team_095 possession (Score: 0-0)
Immanuel Middleton attempts a 3Pt. Contested by Tracy LaVine (3.8 feet, MAN). Immanuel Middleton misses. Rebound secured by DeMar Harris.

[11:13] Team_038 possession (Score: 0-0)
DeMar Harris attempts a Midrange. Contested by Evan Carter (4.6 feet, MAN). DEMAR HARRIS MAKES IT! Assist: Luka Barnes
Score: 2-0

[10:59] Team_095 possession (Score: 2-0)
Immanuel Middleton drives and kicks out. Shaquille Ball attempts a 3Pt. Contested by DeMar Harris (3.1 feet, ZONE). Shaquille Ball misses. Rebound secured by Tracy LaVine.

[10:43] Team_038 possession (Score: 2-0)
Tracy LaVine makes the Layup and draws the foul on Kyrie Ming! And-1! Tracy LaVine to the line for 1. [Team fouls: 1] (Kyrie Ming: 1 personal fouls)   FT 1/1: GOOD Tracy LaVine makes 1/1 from the line.
Score: 5-0

[10:27] Team_095 possession (Score: 5-0)
Evan Carter makes the Layup and draws the foul on Tracy LaVine! And-1! Evan Carter to the line for 1. [Team fouls: 1] (Tracy LaVine: 1 personal fouls)   FT 1/1: GOOD Evan Carter makes 1/1 from the line.
Score: 5-3

[10:12] Team_038 possession (Score: 5-3)
Luka Barnes attempts a 3Pt. Contested by Evan Carter (4.2 feet, ZONE). Luka Barnes misses. Rebound secured by Evan Carter.

[09:58] Team_095 possession (Score: 5-3)
Shaquille Ball attempts a 3Pt. Contested by Malcolm Poole (4.9 feet, MAN). Shaquille Ball misses. Rebound secured by DeMar Harris.

[09:43] Team_038 possession (Score: 5-3)
Malcolm Poole attempts a Layup. BLOCKED BY IMMANUEL MIDDLETON! Ball is loose! Offensive rebound by Tracy LaVine! Tracy LaVine kicks it out.

[09:26] Team_038 possession (Score: 5-3)
DeMar Harris drives, picks up Evan Carter. Help arrives from Dejounte Hyland! DeMar Harris attempts a Layup. Contested by Dejounte Hyland (4.6 feet, MAN). DEMAR HARRIS MAKES IT!
Score: 7-3

[09:13] Team_095 possession (Score: 7-3)
Dejounte Hyland attempts a Midrange. Contested by DeMar Harris (3.1 feet, ZONE). Dejounte Hyland misses. Offensive rebound by Dejounte Hyland! Dejounte Hyland kicks it out.

[09:01] Team_095 possession (Score: 7-3)
Shaquille Ball attempts a 3Pt. Contested by Tracy LaVine (3.8 feet, ZONE). Shaquille Ball misses. Rebound secured by Tracy LaVine.

[08:42] Team_038 possession (Score: 7-3)
FOUL! Shooting foul on Immanuel Middleton. Rudy Thompson to the line for 2 free throws. [Team fouls: 2] (Immanuel Middleton: 1 personal fouls)   FT 1/2: GOOD   FT 2/2: GOOD Rudy Thompson makes 2/2 from the line.
Score: 9-3

[08:29] Team_095 possession (Score: 9-3)
FOUL! Holding foul on Tracy LaVine. [Team fouls: 2] No free throws, side out. (Tracy LaVine: 2 personal fouls)

[08:18] Team_095 possession (Score: 9-3)
Kyrie Ming attempts a 3Pt. Contested by DeMar Harris (3.3 feet, ZONE). Kyrie Ming misses. Rebound secured by DeMar Harris.

[08:02] Team_038 possession (Score: 9-3)
Luka Barnes attempts a Layup. BLOCKED BY DEJOUNTE HYLAND! Ball deflects out of bounds off Luka Barnes.

[07:47] Team_095 possession (Score: 9-3)
Immanuel Middleton attempts a Midrange. Contested by Tracy LaVine (3.8 feet, MAN). IMMANUEL MIDDLETON MAKES IT!
Score: 9-5

[07:32] Team_038 possession (Score: 9-5)
Luka Barnes makes the Layup and draws the foul on Kyrie Ming! And-1! Luka Barnes to the line for 1. [Team fouls: 3] (Kyrie Ming: 2 personal fouls)   FT 1/1: MISS Luka Barnes makes 0/1 from the line. Rebound secured by Dejounte Hyland.
Score: 11-5

[07:21] Team_095 possession (Score: 11-5)
Immanuel Middleton drives, Tracy LaVine stays with him. Immanuel Middleton attempts a Layup. Contested by Tracy LaVine (3.8 feet, MAN). IMMANUEL MIDDLETON MAKES IT! Assist: Dejounte Hyland
Score: 11-7

[07:03] Team_038 possession (Score: 11-7)
FOUL! Shooting foul on Evan Carter. Tracy LaVine to the line for 3 free throws. [Team fouls: 4] (Evan Carter: 1 personal fouls)   FT 1/3: MISS   FT 2/3: MISS   FT 3/3: MISS Tracy LaVine makes 0/3 from the line. Rebound secured by Dejounte Hyland.

[06:52] Team_095 possession (Score: 11-7)
Evan Carter makes the Midrange and draws the foul on Malcolm Poole! And-1! Evan Carter to the line for 1. [Team fouls: 3] (Malcolm Poole: 1 personal fouls)   FT 1/1: GOOD Evan Carter makes 1/1 from the line.
Score: 11-10

[06:36] Team_038 possession (Score: 11-10)
Luka Barnes attempts a Midrange. Contested by Kyrie Ming (5.4 feet, MAN). LUKA BARNES MAKES IT!
Score: 13-10

[06:23] Team_095 possession (Score: 13-10)
Dejounte Hyland makes the Layup and draws the foul on Tracy LaVine! And-1! Dejounte Hyland to the line for 1. [Team fouls: 4] (Tracy LaVine: 3 personal fouls)   FT 1/1: GOOD Dejounte Hyland makes 1/1 from the line.
Score: 13-13

[06:08] Team_038 possession (Score: 13-13)
Tracy LaVine attempts a Midrange. Contested by Immanuel Middleton (4.7 feet, MAN). Tracy LaVine misses. Rebound secured by Dejounte Hyland.

[05:57] Team_095 possession (Score: 13-13)
Evan Carter attempts a 3Pt. Contested by DeMar Harris (3.3 feet, MAN). Evan Carter misses. Offensive rebound by Dejounte Hyland! Dejounte Hyland kicks it out.

[05:40] Team_095 possession (Score: 13-13)
Evan Carter commits a violation (traveling/carry)! TURNOVER! (dead ball)

[05:24] Team_038 possession (Score: 13-13)
DeMar Harris makes the Dunk and draws the foul on Immanuel Middleton! And-1! DeMar Harris to the line for 1. [BONUS: 5 team fouls] (Immanuel Middleton: 2 personal fouls)   FT 1/1: GOOD DeMar Harris makes 1/1 from the line.
Score: 16-13

[05:10] Team_095 possession (Score: 16-13)
Immanuel Middleton drives to the basket... FOUL! Offensive foul on Immanuel Middleton! Tracy LaVine drew the charge! [Team fouls: 6] (Immanuel Middleton: 3 personal fouls) TURNOVER! (dead ball)

[04:57] Team_038 possession (Score: 16-13)
DeMar Harris attempts a 3Pt. Contested by Evan Carter (4.6 feet, ZONE). DeMar Harris misses. Rebound secured by Shaquille Ball.

[04:46] Team_095 possession (Score: 16-13)
Kyrie Ming drives, picks up Tracy LaVine. Help arrives from Malcolm Poole! Kyrie Ming attempts a Dunk. Contested by Malcolm Poole (4.1 feet, ZONE). Kyrie Ming misses. Rebound secured by DeMar Harris.

[04:32] Team_038 possession (Score: 16-13)
Luka Barnes drives, Immanuel Middleton stays with him. Luka Barnes attempts a Dunk. Contested by Immanuel Middleton (5.3 feet, ZONE). LUKA BARNES MAKES IT!
Score: 18-13

[04:18] Team_095 possession (Score: 18-13)
FOUL! Holding foul on Rudy Thompson. [IN THE BONUS! 5 team fouls] Dejounte Hyland to the line for 2 free throws. (Rudy Thompson: 1 personal fouls)   FT 1/2: GOOD   FT 2/2: GOOD Dejounte Hyland makes 2/2 from the line.
Score: 18-15

[04:03] Team_038 possession (Score: 18-15)
Malcolm Poole attempts a Layup. Contested by Shaquille Ball (4.3 feet, MAN). MALCOLM POOLE MAKES IT! Assist: Rudy Thompson
Score: 20-15

[03:45] Team_095 possession (Score: 20-15)
Dejounte Hyland drives and kicks out. Evan Carter attempts a 3Pt. Contested by DeMar Harris (3.2 feet, MAN). Evan Carter misses. Rebound secured by Tracy LaVine.

[03:30] Team_038 possession (Score: 20-15)
Tracy LaVine makes the Layup and draws the foul on Immanuel Middleton! And-1! Tracy LaVine to the line for 1. [BONUS: 7 team fouls] (Immanuel Middleton: 4 personal fouls)   FT 1/1: GOOD Tracy LaVine makes 1/1 from the line.
Score: 23-15

[03:15] Team_095 possession (Score: 23-15)
FOUL! Reach-in foul on Rudy Thompson during the drive. [IN THE BONUS! 6 team fouls] Dejounte Hyland to the line for 2 free throws. (Rudy Thompson: 2 personal fouls)   FT 1/2: GOOD   FT 2/2: GOOD Dejounte Hyland makes 2/2 from the line.
Score: 23-17

[03:00] Team_038 possession (Score: 23-17)
DeMar Harris drives and kicks out. Tracy LaVine attempts a 3Pt. Contested by Immanuel Middleton (5.1 feet, MAN). Tracy LaVine misses. Rebound secured by Dejounte Hyland.

[02:49] Team_095 possession (Score: 23-17)
Dejounte Hyland attempts a 3Pt. Contested by Rudy Thompson (4.0 feet, MAN). Dejounte Hyland misses. Offensive rebound by Dejounte Hyland! Dejounte Hyland kicks it out.

[02:36] Team_095 possession (Score: 23-17)
Kyrie Ming drives and kicks out. Dejounte Hyland attempts a 3Pt. Contested by Rudy Thompson (4.1 feet, MAN). DEJOUNTE HYLAND MAKES IT! Assist: Evan Carter
Score: 23-20

[02:23] Team_038 possession (Score: 23-20)
Rudy Thompson makes the Dunk and draws the foul on Immanuel Middleton! And-1! Rudy Thompson to the line for 1. [BONUS: 8 team fouls] (Immanuel Middleton: 5 personal fouls)   FT 1/1: GOOD Rudy Thompson makes 1/1 from the line.
Score: 26-20

[02:11] Team_095 possession (Score: 26-20)
Immanuel Middleton attempts a Layup. Contested by Tracy LaVine (4.2 feet, ZONE). Immanuel Middleton misses. Rebound secured by Tracy LaVine.

[01:58] Team_038 possession (Score: 26-20)
FOUL! Reach-in foul on Dejounte Hyland during the drive. [IN THE BONUS! 9 team fouls] Rudy Thompson to the line for 2 free throws. (Dejounte Hyland: 1 personal fouls)   FT 1/2: GOOD   FT 2/2: MISS Rudy Thompson makes 1/2 from the line. Rebound secured by Dejounte Hyland.
Score: 27-20

[01:47] Team_095 possession (Score: 27-20)
FOUL! Shooting foul on DeMar Harris. Immanuel Middleton to the line for 3 free throws. [BONUS: 7 team fouls] (DeMar Harris: 1 personal fouls)   FT 1/3: GOOD   FT 2/3: GOOD   FT 3/3: MISS Immanuel Middleton makes 2/3 from the line. Offensive rebound by Dejounte Hyland! Dejounte Hyland kicks it out.
Score: 27-22

[01:34] Team_095 possession (Score: 27-22)
Evan Carter attempts a 3Pt. Contested by DeMar Harris (3.7 feet, ZONE). Evan Carter misses. Rebound secured by Tracy LaVine.

[01:23] Team_038 possession (Score: 27-22)
DeMar Harris drives and kicks out. Malcolm Poole attempts a Midrange. Contested by Immanuel Middleton (5.3 feet, ZONE). MALCOLM POOLE MAKES IT! Assist: Luka Barnes
Score: 29-22

[01:09] Team_095 possession (Score: 29-22)
Kyrie Ming drives to the basket... FOUL! Offensive foul on Kyrie Ming! Luka Barnes drew the charge! [Team fouls: 10] (Kyrie Ming: 3 personal fouls) TURNOVER! (dead ball)

[00:54] Team_038 possession (Score: 29-22)
Tracy LaVine drives and kicks out. Malcolm Poole attempts a Midrange. Contested by Shaquille Ball (4.8 feet, ZONE). MALCOLM POOLE MAKES IT! Assist: DeMar Harris
Score: 31-22

[00:40] Team_095 possession (Score: 31-22)
FOUL! Offensive foul on Kyrie Ming! Luka Barnes drew the charge! [Team fouls: 11] (Kyrie Ming: 4 personal fouls) TURNOVER! (dead ball)

[00:24] Team_038 possession (Score: 31-22)
DeMar Harris drives, Immanuel Middleton stays with him. DeMar Harris attempts a Dunk. Wide open! Immanuel Middleton is 6.1 feet away. [ZONE] DeMar Harris misses. Offensive rebound by Tracy LaVine! Tracy LaVine kicks it out.

[00:13] Team_038 possession (Score: 31-22)
Tracy LaVine attempts a Midrange. Contested by Immanuel Middleton (5.3 feet, MAN). TRACY LAVINE MAKES IT! Assist: Luka Barnes
Score: 33-22

================================================================================
                              1ST QUARTER COMPLETE                              
================================================================================

1ST QUARTER SCORE: Team_038 33, Team_095 22

BOX SCORE:
================================================================================

Team_038
--------------------------------------------------------------------------------
Player                MIN  PTS  REB  AST  TO      FG   FG%      3P   3P%
--------------------------------------------------------------------------------
Tracy LaVine           12    8    7    0   0   3/5    60.0     0/0   0.0
DeMar Harris           12    7    4    1   0   3/5    60.0     0/0   0.0
Malcolm Poole          12    6    0    0   0   3/3   100.0     0/0   0.0
Rudy Thompson          12    5    0    1   0   2/4    50.0     0/0   0.0
Luka Barnes            12    4    0    3   0   2/5    40.0     0/0   0.0

TEAM: FG: 13/22 (59.1%), 3PT: 0/3 (0.0%), REB: 11 (2 off, 9 def), AST: 5, TO: 0
TEAM FOULS: 7 [Team_095 in BONUS]


Team_095
--------------------------------------------------------------------------------
Player                MIN  PTS  REB  AST  TO      FG   FG%      3P   3P%
--------------------------------------------------------------------------------
Dejounte Hyland        12   10   10    1   0   4/5    80.0     0/0   0.0
Evan Carter            12    6    1    1   0   2/3    66.7     0/0   0.0
Immanuel Middleton     12    4    0    0   0   2/5    40.0     0/0   0.0
Shaquille Ball         12    0    2    0   0   0/2     0.0     0/0   0.0
Kyrie Ming             12    0    0    0   0   0/2     0.0     0/0   0.0

TEAM: FG: 8/17 (47.1%), 3PT: 0/5 (0.0%), REB: 13 (5 off, 8 def), AST: 2, TO: 4
TEAM FOULS: 11 [Team_038 in BONUS]

================================================================================

================================================================================
                       2ND QUARTER - Team_038 vs Team_095                       
================================================================================

[12:00] Team_038 possession (Score: 33-22)
DeMar Harris attempts a 3Pt. Contested by Evan Carter (4.9 feet, MAN). DEMAR HARRIS MAKES IT! Assist: Luka Barnes
Score: 36-22

[11:48] Team_095 possession (Score: 36-22)
Shaquille Ball attempts a 3Pt. Contested by Malcolm Poole (5.1 feet, MAN). SHAQUILLE BALL MAKES IT!
Score: 36-25

[11:34] Team_038 possession (Score: 36-25)
Luka Barnes drives, Kyrie Ming stays with him. Luka Barnes attempts a Dunk. Contested by Kyrie Ming (5.8 feet, MAN). Luka Barnes misses. Offensive rebound by Tracy LaVine! Tracy LaVine kicks it out.

[11:18] Team_038 possession (Score: 36-25)
Luka Barnes drives and kicks out. Rudy Thompson attempts a Midrange. Contested by Dejounte Hyland (5.3 feet, MAN). RUDY THOMPSON MAKES IT!
Score: 38-25

[11:02] Team_095 possession (Score: 38-25)
Dejounte Hyland attempts a Midrange. Contested by Malcolm Poole (5.2 feet, ZONE). Dejounte Hyland misses. Rebound secured by Luka Barnes.

[10:52] Team_038 possession (Score: 38-25)
Luka Barnes attempts a Layup. Contested by Immanuel Middleton (5.7 feet, ZONE). LUKA BARNES MAKES IT! Assist: DeMar Harris
Score: 40-25

[10:42] Team_095 possession (Score: 40-25)
Dejounte Hyland attempts a Midrange. Contested by Tracy LaVine (4.4 feet, ZONE). Dejounte Hyland misses. Rebound secured by DeMar Harris.

[10:23] Team_038 possession (Score: 40-25)
Malcolm Poole attempts a 3Pt. Contested by Shaquille Ball (4.7 feet, MAN). MALCOLM POOLE MAKES IT! Assist: Rudy Thompson
Score: 43-25

[10:09] Team_095 possession (Score: 43-25)
Dejounte Hyland attempts a 3Pt. Contested by DeMar Harris (3.7 feet, ZONE). Dejounte Hyland misses. Rebound secured by DeMar Harris.

[09:53] Team_038 possession (Score: 43-25)
Rudy Thompson drives to the basket... Rudy Thompson throws a bad pass! Stolen by Dejounte Hyland! TURNOVER! (live ball)

[09:36] Team_095 possession (Score: 43-25)
Immanuel Middleton drives, Tracy LaVine stays with him. Immanuel Middleton attempts a Dunk. Contested by Tracy LaVine (4.5 feet, ZONE). Immanuel Middleton misses. Offensive rebound by Shaquille Ball! Shaquille Ball kicks it out.

[09:23] Team_095 possession (Score: 43-25)
FOUL! Shooting foul on DeMar Harris. Evan Carter to the line for 2 free throws. [Team fouls: 1] (DeMar Harris: 1 personal fouls)   FT 1/2: GOOD   FT 2/2: GOOD Evan Carter makes 2/2 from the line.
Score: 43-27

[09:07] Team_038 possession (Score: 43-27)
DeMar Harris makes the Layup and draws the foul on Evan Carter! And-1! DeMar Harris to the line for 1. [Team fouls: 1] (Evan Carter: 1 personal fouls)   FT 1/1: GOOD DeMar Harris makes 1/1 from the line.
Score: 46-27

[08:49] Team_095 possession (Score: 46-27)
Immanuel Middleton attempts a Layup. BLOCKED BY TRACY LAVINE! Ball is loose! Offensive rebound by Shaquille Ball! Shaquille Ball kicks it out.

[08:36] Team_095 possession (Score: 46-27)
Immanuel Middleton attempts a 3Pt. Contested by Tracy LaVine (4.6 feet, MAN). Immanuel Middleton misses. Rebound secured by Tracy LaVine.

[08:25] Team_038 possession (Score: 46-27)
Rudy Thompson attempts a 3Pt. Wide open! Dejounte Hyland is 6.1 feet away. [MAN] Rudy Thompson misses. Rebound secured by Shaquille Ball.

[08:10] Team_095 possession (Score: 46-27)
Evan Carter attempts a 3Pt. Contested by DeMar Harris (4.2 feet, ZONE). Evan Carter misses. Rebound secured by DeMar Harris.

[07:59] Team_038 possession (Score: 46-27)
Malcolm Poole attempts a Midrange. Contested by Shaquille Ball (5.0 feet, MAN). Malcolm Poole misses. Offensive rebound by Tracy LaVine! Tracy LaVine kicks it out.

[07:41] Team_038 possession (Score: 46-27)
Rudy Thompson attempts a 3Pt. Contested by Evan Carter (5.2 feet, ZONE). Rudy Thompson misses. Rebound secured by Evan Carter.

[07:25] Team_095 possession (Score: 46-27)
Kyrie Ming drives and kicks out. Dejounte Hyland attempts a Midrange. Contested by Rudy Thompson (4.9 feet, MAN). Dejounte Hyland misses. Offensive rebound by Shaquille Ball! Shaquille Ball kicks it out.

[07:15] Team_095 possession (Score: 46-27)
Shaquille Ball attempts a Midrange. Contested by DeMar Harris (4.2 feet, ZONE). SHAQUILLE BALL MAKES IT!
Score: 46-29

[07:02] Team_038 possession (Score: 46-29)
DeMar Harris drives to the basket... DeMar Harris loses the ball! Stripped by Evan Carter! TURNOVER! (live ball)

[06:46] Team_095 possession (Score: 46-29)
Evan Carter drives to the basket... Evan Carter throws a bad pass out of bounds! TURNOVER! (dead ball)

[06:46] Substitution (Team_038): Rudy Thompson OUT → Jalen Hyland IN (stamina_rule2)

[06:46] Substitution (Team_038): Malcolm Poole OUT → Jaren Jokic IN (stamina_rule2)

[06:46] Substitution (Team_038): DeMar Harris OUT → Magic Dosunmu IN (stamina_rule2)

[06:46] Substitution (Team_038): Tracy LaVine OUT → Jabari Carter IN (stamina_rule2)

[06:46] Substitution (Team_038): Luka Barnes OUT → Ja Smith IN (stamina_rule2)

[06:46] Substitution (Team_095): Dejounte Hyland OUT → Kyle Poole IN (stamina_rule2)

[06:46] Substitution (Team_095): Shaquille Ball OUT → Cade Beal IN (stamina_rule2)

[06:46] Substitution (Team_095): Evan Carter OUT → Tobias Wagner IN (stamina_rule2)

[06:46] Substitution (Team_095): Immanuel Middleton OUT → Gary Davis IN (stamina_rule2)

[06:46] Substitution (Team_095): Kyrie Ming OUT → DeMar McCollum IN (stamina_rule2)

[06:34] Team_038 possession (Score: 46-29)
Jaren Jokic attempts a 3Pt. Contested by Cade Beal (4.1 feet, MAN). Jaren Jokic misses. Offensive rebound by Jabari Carter! Jabari Carter puts it back in!
Score: 48-29

[06:19] Team_095 possession (Score: 48-29)
Tobias Wagner attempts a Midrange. Contested by Magic Dosunmu (3.5 feet, MAN). Tobias Wagner misses. Rebound secured by Jalen Hyland.

[06:04] Team_038 possession (Score: 48-29)
Jabari Carter attempts a Midrange. Wide open! Gary Davis is 6.0 feet away. [MAN] JABARI CARTER MAKES IT!
Score: 50-29

[05:53] Team_095 possession (Score: 50-29)
FOUL! Shooting foul on Ja Smith. Gary Davis to the line for 2 free throws. [Team fouls: 2] (Ja Smith: 1 personal fouls)   FT 1/2: GOOD   FT 2/2: MISS Gary Davis makes 1/2 from the line. Rebound secured by Jabari Carter.
Score: 50-30

[05:41] Team_038 possession (Score: 50-30)
Magic Dosunmu attempts a 3Pt. Contested by Kyle Poole (4.9 feet, ZONE). Magic Dosunmu misses. Offensive rebound by Ja Smith! Ja Smith's putback is no good. Rebound secured by Gary Davis.

[05:23] Team_095 possession (Score: 50-30)
Tobias Wagner drives to the basket... Tobias Wagner throws a bad pass! Stolen by Magic Dosunmu! TURNOVER! (live ball)

[05:10] Team_038 possession (Score: 50-30)
Ja Smith makes the Dunk and draws the foul on Kyle Poole! And-1! Ja Smith to the line for 1. [Team fouls: 2] (Kyle Poole: 1 personal fouls)   FT 1/1: GOOD Ja Smith makes 1/1 from the line.
Score: 53-30

[04:56] Team_095 possession (Score: 53-30)
Tobias Wagner attempts a 3Pt. Contested by Magic Dosunmu (3.5 feet, MAN). TOBIAS WAGNER MAKES IT!
Score: 53-33

[04:43] Team_038 possession (Score: 53-33)
Jaren Jokic drives and kicks out. Jaren Jokic attempts a 3Pt. Contested by Cade Beal (4.4 feet, MAN). JAREN JOKIC MAKES IT!
Score: 56-33

[04:25] Team_095 possession (Score: 56-33)
Cade Beal makes the Layup and draws the foul on Ja Smith! And-1! Cade Beal to the line for 1. [Team fouls: 3] (Ja Smith: 2 personal fouls)   FT 1/1: GOOD Cade Beal makes 1/1 from the line.
Score: 56-36

[04:07] Team_038 possession (Score: 56-36)
Jalen Hyland attempts a Midrange. Contested by Kyle Poole (4.9 feet, MAN). JALEN HYLAND MAKES IT!
Score: 58-36

[03:55] Team_095 possession (Score: 58-36)
DeMar McCollum attempts a Layup. BLOCKED BY JA SMITH! Ball goes out off Ja Smith. DeMar McCollum's ball!

[03:42] Team_095 possession (Score: 58-36)
FOUL! Shooting foul on Ja Smith. DeMar McCollum to the line for 2 free throws. [Team fouls: 4] (Ja Smith: 3 personal fouls)   FT 1/2: GOOD   FT 2/2: MISS DeMar McCollum makes 1/2 from the line. Rebound secured by Ja Smith.
Score: 58-37

[03:23] Team_038 possession (Score: 58-37)
Jaren Jokic attempts a 3Pt. Contested by Cade Beal (4.1 feet, MAN). Jaren Jokic misses. Rebound secured by Tobias Wagner.

[03:09] Team_095 possession (Score: 58-37)
Cade Beal attempts a 3Pt. Contested by Jaren Jokic (5.1 feet, ZONE). Cade Beal misses. Rebound secured by Jabari Carter.

[02:58] Team_038 possession (Score: 58-37)
Jaren Jokic attempts a 3Pt. Contested by Cade Beal (4.1 feet, MAN). Jaren Jokic misses. Offensive rebound by Jabari Carter! Jabari Carter's putback is no good. Rebound secured by DeMar McCollum.

[02:41] Team_095 possession (Score: 58-37)
Kyle Poole drives to the basket... Kyle Poole loses control! Ball rolls out of bounds! TURNOVER! (dead ball)

[02:26] Team_038 possession (Score: 58-37)
Jabari Carter attempts a Layup. Contested by DeMar McCollum (5.4 feet, ZONE). Jabari Carter misses. Rebound secured by Tobias Wagner.

[02:09] Team_095 possession (Score: 58-37)
Gary Davis attempts a Layup. Contested by Jabari Carter (3.9 feet, MAN). GARY DAVIS MAKES IT! Assist: Kyle Poole
Score: 58-39

[01:51] Team_038 possession (Score: 58-39)
Jabari Carter attempts a Layup. Wide open! Gary Davis is 6.0 feet away. [ZONE] JABARI CARTER MAKES IT!
Score: 60-39

[01:40] Team_095 possession (Score: 60-39)
Gary Davis attempts a 3Pt. Contested by Jalen Hyland (4.1 feet, ZONE). GARY DAVIS MAKES IT! Assist: DeMar McCollum
Score: 60-42

[01:26] Team_038 possession (Score: 60-42)
Jalen Hyland attempts a 3Pt. Contested by Kyle Poole (4.9 feet, MAN). Jalen Hyland misses. Rebound secured by DeMar McCollum.

[01:14] Team_095 possession (Score: 60-42)
DeMar McCollum attempts a Midrange. Contested by Ja Smith (3.9 feet, MAN). DEMAR MCCOLLUM MAKES IT!
Score: 60-44

[01:01] Team_038 possession (Score: 60-44)
Jabari Carter attempts a 3Pt. Contested by Cade Beal (4.9 feet, ZONE). Jabari Carter misses. Rebound secured by Tobias Wagner.

[00:44] Team_095 possession (Score: 60-44)
DeMar McCollum attempts a Layup. Contested by Ja Smith (3.9 feet, ZONE). DEMAR MCCOLLUM MAKES IT! Assist: Tobias Wagner
Score: 60-46

[00:29] Team_038 possession (Score: 60-46)
Jabari Carter attempts a 3Pt. Wide open! Gary Davis is 6.0 feet away. [MAN] JABARI CARTER MAKES IT! Assist: Jalen Hyland
Score: 63-46

[00:13] Team_095 possession (Score: 63-46)
FOUL! Reach-in foul on Jaren Jokic during the drive. [IN THE BONUS! 5 team fouls] Cade Beal to the line for 2 free throws. (Jaren Jokic: 1 personal fouls)   FT 1/2: GOOD   FT 2/2: GOOD Cade Beal makes 2/2 from the line.
Score: 63-48

================================================================================
                              2ND QUARTER COMPLETE                              
================================================================================

2ND QUARTER SCORE: Team_038 30, Team_095 26

BOX SCORE:
================================================================================

Team_038
--------------------------------------------------------------------------------
Player                MIN  PTS  REB  AST  TO      FG   FG%      3P   3P%
--------------------------------------------------------------------------------
Jabari Carter           7    9    3    0   0   4/6    66.7     0/0   0.0
DeMar Harris           17    6    3    1   0   2/2   100.0     0/0   0.0
Malcolm Poole          17    3    0    0   0   1/1   100.0     0/0   0.0
Ja Smith                7    3    1    0   0   1/1   100.0     0/0   0.0
Jaren Jokic             7    3    0    0   0   1/3    33.3     0/0   0.0
Luka Barnes            17    2    1    1   0   1/1   100.0     0/0   0.0
Rudy Thompson          17    2    0    1   0   1/3    33.3     0/0   0.0
Jalen Hyland            7    2    1    1   0   1/2    50.0     0/0   0.0
Tracy LaVine           17    0    3    0   0   0/0     0.0     0/0   0.0
Magic Dosunmu           7    0    0    0   0   0/1     0.0     0/0   0.0

TEAM: FG: 12/20 (60.0%), 3PT: 4/11 (36.4%), REB: 14 (5 off, 9 def), AST: 4, TO: 2
TEAM FOULS: 5 [Team_095 in BONUS]


Team_095
--------------------------------------------------------------------------------
Player                MIN  PTS  REB  AST  TO      FG   FG%      3P   3P%
--------------------------------------------------------------------------------
Shaquille Ball         17    5    4    0   0   2/2   100.0     0/0   0.0
Gary Davis              7    5    1    0   0   2/3    66.7     0/0   0.0
Cade Beal               7    5    0    0   0   2/3    66.7     0/0   0.0
DeMar McCollum          7    4    2    1   0   2/3    66.7     0/0   0.0
Tobias Wagner           7    3    3    1   0   1/2    50.0     0/0   0.0
Evan Carter            17    2    1    0   0   1/2    50.0     0/0   0.0
Dejounte Hyland        17    0    0    0   0   0/3     0.0     0/0   0.0
Immanuel Middleton     17    0    0    0   0   0/1     0.0     0/0   0.0
Kyle Poole              7    0    0    1   0   0/0     0.0     0/0   0.0

TEAM: FG: 10/19 (52.6%), 3PT: 3/7 (42.9%), REB: 9 (3 off, 6 def), AST: 3, TO: 3
TEAM FOULS: 2

================================================================================

================================================================================
                       3RD QUARTER - Team_038 vs Team_095                       
================================================================================

[12:00] Team_038 possession (Score: 63-48)
Tracy LaVine drives, Immanuel Middleton stays with him. Tracy LaVine attempts a Layup. Contested by Immanuel Middleton (4.7 feet, ZONE). TRACY LAVINE MAKES IT!
Score: 65-48

[11:45] Team_095 possession (Score: 65-48)
Shaquille Ball commits a violation (traveling/carry)! TURNOVER! (dead ball)

[11:31] Team_038 possession (Score: 65-48)
Malcolm Poole attempts a 3Pt. Contested by Shaquille Ball (4.3 feet, MAN). MALCOLM POOLE MAKES IT! Assist: DeMar Harris
Score: 68-48

[11:18] Team_095 possession (Score: 68-48)
Shaquille Ball attempts a Midrange. BLOCKED BY MALCOLM POOLE! Ball is loose! Rebound secured by Tracy LaVine.

[10:59] Team_038 possession (Score: 68-48)
Rudy Thompson attempts a 3Pt. Contested by Dejounte Hyland (5.5 feet, MAN). RUDY THOMPSON MAKES IT! Assist: Malcolm Poole
Score: 71-48

[10:46] Team_095 possession (Score: 71-48)
Dejounte Hyland attempts a 3Pt. Contested by DeMar Harris (3.1 feet, ZONE). Dejounte Hyland misses. Rebound secured by Luka Barnes.

[10:33] Team_038 possession (Score: 71-48)
DeMar Harris attempts a Dunk. BLOCKED BY IMMANUEL MIDDLETON! Ball deflects out of bounds off DeMar Harris.

[10:19] Team_095 possession (Score: 71-48)
Kyrie Ming drives, Luka Barnes stays with him. Kyrie Ming attempts a Dunk. Contested by Luka Barnes (4.5 feet, ZONE). Kyrie Ming misses. Rebound secured by DeMar Harris.

[10:02] Team_038 possession (Score: 71-48)
Malcolm Poole attempts a 3Pt. Contested by Shaquille Ball (4.3 feet, MAN). Malcolm Poole misses. Rebound secured by Evan Carter.

[09:45] Team_095 possession (Score: 71-48)
Evan Carter attempts a 3Pt. Contested by DeMar Harris (3.3 feet, ZONE). Evan Carter misses. FOUL! Loose ball foul on Tracy LaVine during the rebound battle. [Team fouls: 1] No free throws, side out. (Tracy LaVine: 1 personal fouls)

[09:33] Team_095 possession (Score: 71-48)
Immanuel Middleton drives and kicks out. Dejounte Hyland attempts a Midrange. Contested by Rudy Thompson (3.8 feet, MAN). Dejounte Hyland misses. Offensive rebound by Evan Carter! Evan Carter puts it back in!
Score: 71-50

[09:19] Team_038 possession (Score: 71-50)
Rudy Thompson makes the Dunk and draws the foul on Dejounte Hyland! And-1! Rudy Thompson to the line for 1. [Team fouls: 1] (Dejounte Hyland: 1 personal fouls)   FT 1/1: MISS Rudy Thompson makes 0/1 from the line. Rebound secured by Dejounte Hyland.
Score: 73-50

[09:08] Team_095 possession (Score: 73-50)
Dejounte Hyland attempts a 3Pt. Contested by DeMar Harris (3.1 feet, ZONE). Dejounte Hyland misses. Rebound secured by DeMar Harris.

[08:54] Team_038 possession (Score: 73-50)
Tracy LaVine drives, Immanuel Middleton stays with him. Tracy LaVine attempts a Dunk. Contested by Immanuel Middleton (4.7 feet, ZONE). Tracy LaVine misses. Rebound secured by Evan Carter.

[08:41] Team_095 possession (Score: 73-50)
Evan Carter attempts a 3Pt. Contested by DeMar Harris (3.3 feet, ZONE). Evan Carter misses. Rebound secured by Luka Barnes.

[08:26] Team_038 possession (Score: 73-50)
FOUL! Shooting foul on Kyrie Ming. Luka Barnes to the line for 2 free throws. [Team fouls: 2] (Kyrie Ming: 1 personal fouls)   FT 1/2: MISS   FT 2/2: GOOD Luka Barnes makes 1/2 from the line.
Score: 74-50

[08:16] Team_095 possession (Score: 74-50)
Evan Carter attempts a 3Pt. Contested by DeMar Harris (3.3 feet, ZONE). EVAN CARTER MAKES IT! Assist: Kyrie Ming
Score: 74-53

[08:01] Team_038 possession (Score: 74-53)
DeMar Harris drives and kicks out. Tracy LaVine attempts a 3Pt. Contested by Evan Carter (3.8 feet, ZONE). Tracy LaVine misses. Rebound secured by Shaquille Ball.

[07:48] Team_095 possession (Score: 74-53)
Immanuel Middleton attempts a Layup. BLOCKED BY TRACY LAVINE! Ball is loose! Offensive rebound by Dejounte Hyland! Dejounte Hyland kicks it out.

[07:34] Team_095 possession (Score: 74-53)
Dejounte Hyland attempts a Midrange. Contested by Rudy Thompson (3.8 feet, MAN). DEJOUNTE HYLAND MAKES IT! Assist: Kyrie Ming
Score: 74-55

[07:22] Team_038 possession (Score: 74-55)
Malcolm Poole attempts a Layup. Contested by Shaquille Ball (4.3 feet, MAN). Malcolm Poole misses. Offensive rebound by Tracy LaVine! Tracy LaVine's putback is no good. Rebound secured by Dejounte Hyland.

[07:12] Team_095 possession (Score: 74-55)
FOUL! Reach-in foul on Luka Barnes during the drive. [Team fouls: 3] No free throws, side out. (Luka Barnes: 2 personal fouls)

[06:56] Team_095 possession (Score: 74-55)
Dejounte Hyland drives, Rudy Thompson stays with him. Dejounte Hyland attempts a Dunk. Contested by Rudy Thompson (3.8 feet, MAN). DEJOUNTE HYLAND MAKES IT!
Score: 74-57

[06:42] Team_038 possession (Score: 74-57)
Tracy LaVine loses control! Ball rolls out of bounds! TURNOVER! (dead ball)

[06:26] Team_095 possession (Score: 74-57)
Immanuel Middleton drives, picks up Tracy LaVine. Help arrives from Malcolm Poole! Immanuel Middleton attempts a Layup. Contested by Malcolm Poole (3.8 feet, MAN). IMMANUEL MIDDLETON MAKES IT! Assist: Shaquille Ball
Score: 74-59

[06:11] Team_038 possession (Score: 74-59)
DeMar Harris drives and kicks out. Luka Barnes attempts a 3Pt. Contested by Kyrie Ming (5.1 feet, MAN). Luka Barnes misses. Rebound secured by Evan Carter.

[06:00] Team_095 possession (Score: 74-59)
Immanuel Middleton attempts a Midrange. Contested by Tracy LaVine (3.8 feet, MAN). Immanuel Middleton misses. Rebound secured by Tracy LaVine.

[05:49] Team_038 possession (Score: 74-59)
Luka Barnes attempts a Midrange. Contested by Immanuel Middleton (5.2 feet, ZONE). Luka Barnes misses. Rebound secured by Shaquille Ball.

[05:37] Team_095 possession (Score: 74-59)
Immanuel Middleton loses the ball! Stripped by Tracy LaVine! TURNOVER! (live ball)

[05:24] Team_038 possession (Score: 74-59)
Malcolm Poole attempts a 3Pt. Contested by Shaquille Ball (4.3 feet, ZONE). Malcolm Poole misses. Offensive rebound by Luka Barnes! Luka Barnes kicks it out.

[05:08] Team_038 possession (Score: 74-59)
FOUL! Holding foul on Immanuel Middleton. [Team fouls: 3] No free throws, side out. (Immanuel Middleton: 1 personal fouls)

[04:51] Team_038 possession (Score: 74-59)
Luka Barnes attempts a 3Pt. Contested by Kyrie Ming (5.5 feet, MAN). LUKA BARNES MAKES IT! Assist: Rudy Thompson
Score: 77-59

[04:38] Team_095 possession (Score: 77-59)
Kyrie Ming attempts a 3Pt. Contested by DeMar Harris (3.4 feet, ZONE). Kyrie Ming misses. Rebound secured by Luka Barnes.

[04:23] Team_038 possession (Score: 77-59)
DeMar Harris attempts a 3Pt. Contested by Evan Carter (4.7 feet, MAN). DeMar Harris misses. Rebound secured by Dejounte Hyland.

[04:06] Team_095 possession (Score: 77-59)
Dejounte Hyland attempts a 3Pt. Contested by Rudy Thompson (3.9 feet, MAN). DEJOUNTE HYLAND MAKES IT! Assist: Shaquille Ball
Score: 77-62

[03:49] Team_038 possession (Score: 77-62)
Malcolm Poole drives, Immanuel Middleton stays with him. Malcolm Poole attempts a Layup. Contested by Immanuel Middleton (5.0 feet, ZONE). MALCOLM POOLE MAKES IT! Assist: Tracy LaVine
Score: 79-62

[03:35] Team_095 possession (Score: 79-62)
Kyrie Ming throws a bad pass! Stolen by Luka Barnes! TURNOVER! (live ball)

[03:21] Team_038 possession (Score: 79-62)
DeMar Harris attempts a 3Pt. Contested by Evan Carter (4.8 feet, MAN). DeMar Harris misses. Rebound secured by Dejounte Hyland.

[03:04] Team_095 possession (Score: 79-62)
FOUL! Reach-in foul on Rudy Thompson during the drive. [Team fouls: 4] No free throws, side out. (Rudy Thompson: 1 personal fouls)

[02:51] Team_095 possession (Score: 79-62)
FOUL! Reach-in foul on Luka Barnes during the drive. [IN THE BONUS! 5 team fouls] Kyrie Ming to the line for 2 free throws. (Luka Barnes: 3 personal fouls)   FT 1/2: GOOD   FT 2/2: GOOD Kyrie Ming makes 2/2 from the line.
Score: 79-64

[02:41] Team_038 possession (Score: 79-64)
Tracy LaVine attempts a 3Pt. Contested by Immanuel Middleton (5.0 feet, MAN). Tracy LaVine misses. Rebound secured by Shaquille Ball.

[02:28] Team_095 possession (Score: 79-64)
Kyrie Ming attempts a 3Pt. Contested by DeMar Harris (3.6 feet, ZONE). Kyrie Ming misses. Rebound secured by DeMar Harris.

[02:16] Team_038 possession (Score: 79-64)
FOUL! Holding foul on Kyrie Ming. [Team fouls: 4] No free throws, side out. (Kyrie Ming: 2 personal fouls)

[01:58] Team_038 possession (Score: 79-64)
Rudy Thompson drives and kicks out. Rudy Thompson attempts a Midrange. Contested by Dejounte Hyland (5.2 feet, MAN). Rudy Thompson misses. FOUL! Loose ball foul on Evan Carter during the rebound battle. [IN THE BONUS! 5 team fouls] Tracy LaVine to the line for 2 free throws. (Evan Carter: 1 personal fouls)   FT 1/2: MISS   FT 2/2: GOOD Tracy LaVine makes 1/2 from the line.
Score: 80-64

[01:42] Team_095 possession (Score: 80-64)
Shaquille Ball makes the Layup and draws the foul on Malcolm Poole! And-1! Shaquille Ball to the line for 1. [BONUS: 6 team fouls] (Malcolm Poole: 1 personal fouls)   FT 1/1: MISS Shaquille Ball makes 0/1 from the line. Rebound secured by Tracy LaVine.
Score: 80-66

[01:30] Team_038 possession (Score: 80-66)
FOUL! Holding foul on Kyrie Ming. [IN THE BONUS! 6 team fouls] Luka Barnes to the line for 2 free throws. (Kyrie Ming: 3 personal fouls)   FT 1/2: GOOD   FT 2/2: MISS Luka Barnes makes 1/2 from the line. Rebound secured by Shaquille Ball.
Score: 81-66

[01:15] Team_095 possession (Score: 81-66)
Immanuel Middleton attempts a Layup. Contested by Tracy LaVine (4.3 feet, MAN). IMMANUEL MIDDLETON MAKES IT! Assist: Kyrie Ming
Score: 81-68

[01:02] Team_038 possession (Score: 81-68)
Malcolm Poole attempts a 3Pt. Contested by Shaquille Ball (4.6 feet, MAN). Malcolm Poole misses. Rebound secured by Evan Carter.

[00:49] Team_095 possession (Score: 81-68)
Shaquille Ball drives to the basket... Shaquille Ball loses the ball! Stripped by Tracy LaVine! TURNOVER! (live ball)

[00:38] Team_038 possession (Score: 81-68)
DeMar Harris makes the Layup and draws the foul on Evan Carter! And-1! DeMar Harris to the line for 1. [BONUS: 7 team fouls] (Evan Carter: 2 personal fouls)   FT 1/1: GOOD DeMar Harris makes 1/1 from the line.
Score: 84-68

[00:23] Team_095 possession (Score: 84-68)
Dejounte Hyland attempts a 3Pt. Contested by Rudy Thompson (4.4 feet, MAN). Dejounte Hyland misses. Offensive rebound by Evan Carter! Evan Carter puts it back in!
Score: 84-70

[00:13] Team_038 possession (Score: 84-70)
FOUL! Reach-in foul on Immanuel Middleton during the drive. [IN THE BONUS! 8 team fouls] Tracy LaVine to the line for 2 free throws. (Immanuel Middleton: 2 personal fouls)   FT 1/2: GOOD   FT 2/2: GOOD Tracy LaVine makes 2/2 from the line.
Score: 86-70

================================================================================
                              3RD QUARTER COMPLETE                              
================================================================================

3RD QUARTER SCORE: Team_038 23, Team_095 22

BOX SCORE:
================================================================================

Team_038
--------------------------------------------------------------------------------
Player                MIN  PTS  REB  AST  TO      FG   FG%      3P   3P%
--------------------------------------------------------------------------------
Tracy LaVine           29    5    3    1   0   3/5    60.0     0/0   0.0
Malcolm Poole          29    5    0    1   0   2/5    40.0     0/0   0.0
Luka Barnes            29    4    4    0   0   2/3    66.7     0/0   0.0
DeMar Harris           29    3    3    1   0   1/6    16.7     0/0   0.0
Rudy Thompson          29    3    0    1   0   1/2    50.0     0/0   0.0

TEAM: FG: 9/22 (40.9%), 3PT: 3/8 (37.5%), REB: 11 (2 off, 9 def), AST: 4, TO: 1
TEAM FOULS: 6 [Team_095 in BONUS]


Team_095
--------------------------------------------------------------------------------
Player                MIN  PTS  REB  AST  TO      FG   FG%      3P   3P%
--------------------------------------------------------------------------------
Dejounte Hyland        29    7    5    0   0   3/5    60.0     0/0   0.0
Evan Carter            29    7    7    0   0   3/4    75.0     0/0   0.0
Immanuel Middleton     29    4    0    0   0   2/3    66.7     0/0   0.0
Kyrie Ming             29    2    0    3   0   1/4    25.0     0/0   0.0
Shaquille Ball         29    0    4    2   0   0/2     0.0     0/0   0.0

TEAM: FG: 9/18 (50.0%), 3PT: 3/8 (37.5%), REB: 15 (4 off, 11 def), AST: 5, TO: 4
TEAM FOULS: 8 [Team_038 in BONUS]

================================================================================

================================================================================
                       4TH QUARTER - Team_038 vs Team_095                       
================================================================================

[12:00] Team_038 possession (Score: 86-70)
Malcolm Poole attempts a 3Pt. Contested by Shaquille Ball (4.5 feet, MAN). Malcolm Poole misses. Rebound secured by Evan Carter.

[11:47] Team_095 possession (Score: 86-70)
FOUL! Shooting foul on Tracy LaVine. Immanuel Middleton to the line for 2 free throws. [Team fouls: 1] (Tracy LaVine: 1 personal fouls)   FT 1/2: GOOD   FT 2/2: GOOD Immanuel Middleton makes 2/2 from the line.
Score: 86-72

[11:30] Team_038 possession (Score: 86-72)
Rudy Thompson drives and kicks out. Rudy Thompson attempts a Midrange. Contested by Dejounte Hyland (5.3 feet, MAN). Rudy Thompson misses. Rebound secured by Dejounte Hyland.

[11:16] Team_095 possession (Score: 86-72)
Dejounte Hyland attempts a 3Pt. Contested by DeMar Harris (3.6 feet, ZONE). Dejounte Hyland misses. Rebound secured by Tracy LaVine.

[11:04] Team_038 possession (Score: 86-72)
DeMar Harris attempts a 3Pt. Contested by Evan Carter (5.0 feet, MAN). DEMAR HARRIS MAKES IT! Assist: Luka Barnes
Score: 89-72

[10:55] Team_095 possession (Score: 89-72)
Dejounte Hyland attempts a 3Pt. Contested by Rudy Thompson (4.3 feet, ZONE). Dejounte Hyland misses. Rebound secured by Luka Barnes.

[10:42] Team_038 possession (Score: 89-72)
Rudy Thompson drives, Dejounte Hyland stays with him. Rudy Thompson attempts a Dunk. Contested by Dejounte Hyland (5.9 feet, MAN). RUDY THOMPSON MAKES IT!
Score: 91-72

[10:30] Team_095 possession (Score: 91-72)
Kyrie Ming attempts a Midrange. Contested by Luka Barnes (4.9 feet, MAN). Kyrie Ming misses. Rebound secured by DeMar Harris.

[10:13] Team_038 possession (Score: 91-72)
FOUL! Reach-in foul on Immanuel Middleton during the drive. [Team fouls: 1] No free throws, side out. (Immanuel Middleton: 1 personal fouls)

[09:59] Team_038 possession (Score: 91-72)
Rudy Thompson attempts a 3Pt. Contested by Evan Carter (5.0 feet, ZONE). Rudy Thompson misses. Rebound secured by Evan Carter.

[09:47] Team_095 possession (Score: 91-72)
Kyrie Ming attempts a 3Pt. Contested by DeMar Harris (4.0 feet, ZONE). Kyrie Ming misses. Rebound secured by Tracy LaVine.

[09:33] Team_038 possession (Score: 91-72)
Rudy Thompson attempts a Midrange. Contested by Shaquille Ball (5.4 feet, ZONE). RUDY THOMPSON MAKES IT!
Score: 93-72

[09:18] Team_095 possession (Score: 93-72)
Kyrie Ming drives to the basket... Kyrie Ming loses control! Ball rolls out of bounds! TURNOVER! (dead ball)

[09:18] Substitution (Team_038): Rudy Thompson OUT → Jalen Hyland IN (stamina_rule2)

[09:18] Substitution (Team_038): Malcolm Poole OUT → Jaren Jokic IN (stamina_rule2)

[09:18] Substitution (Team_038): DeMar Harris OUT → Magic Dosunmu IN (stamina_rule2)

[09:18] Substitution (Team_038): Tracy LaVine OUT → Jabari Carter IN (stamina_rule2)

[09:18] Substitution (Team_038): Luka Barnes OUT → Ja Smith IN (stamina_rule2)

[09:18] Substitution (Team_095): Dejounte Hyland OUT → Kyle Poole IN (stamina_rule2)

[09:18] Substitution (Team_095): Shaquille Ball OUT → Cade Beal IN (stamina_rule2)

[09:18] Substitution (Team_095): Evan Carter OUT → Tobias Wagner IN (stamina_rule2)

[09:18] Substitution (Team_095): Immanuel Middleton OUT → Gary Davis IN (stamina_rule2)

[09:18] Substitution (Team_095): Kyrie Ming OUT → DeMar McCollum IN (stamina_rule2)

[09:02] Team_038 possession (Score: 93-72)
FOUL! Reach-in foul on DeMar McCollum during the drive. [Team fouls: 2] No free throws, side out. (DeMar McCollum: 1 personal fouls)

[08:46] Team_038 possession (Score: 93-72)
Magic Dosunmu attempts a Layup. Contested by Tobias Wagner (4.0 feet, MAN). MAGIC DOSUNMU MAKES IT! Assist: Jalen Hyland
Score: 95-72

[08:35] Team_095 possession (Score: 95-72)
FOUL! Offensive foul on DeMar McCollum! Ja Smith drew the charge! [Team fouls: 3] (DeMar McCollum: 2 personal fouls) TURNOVER! (dead ball)

[08:19] Team_038 possession (Score: 95-72)
Jalen Hyland attempts a Midrange. Contested by Cade Beal (4.5 feet, ZONE). Jalen Hyland misses. Offensive rebound by Ja Smith! Ja Smith puts it back in!
Score: 97-72

[08:08] Team_095 possession (Score: 97-72)
Gary Davis attempts a 3Pt. Contested by Jabari Carter (3.9 feet, MAN). GARY DAVIS MAKES IT! Assist: Kyle Poole
Score: 97-75

[07:52] Team_038 possession (Score: 97-75)
Magic Dosunmu attempts a Layup. Contested by DeMar McCollum (5.1 feet, ZONE). MAGIC DOSUNMU MAKES IT!
Score: 99-75

[07:42] Team_095 possession (Score: 99-75)
Cade Beal attempts a Layup. BLOCKED BY JAREN JOKIC! Ball is loose! Offensive rebound by DeMar McCollum! DeMar McCollum kicks it out.

[07:27] Team_095 possession (Score: 99-75)
Gary Davis makes the Layup and draws the foul on Ja Smith! And-1! Gary Davis to the line for 1. [Team fouls: 3] (Ja Smith: 1 personal fouls)   FT 1/1: GOOD Gary Davis makes 1/1 from the line.
Score: 99-78

[07:11] Team_038 possession (Score: 99-78)
Jabari Carter throws a bad pass out of bounds! TURNOVER! (dead ball)

[06:53] Team_095 possession (Score: 99-78)
FOUL! Shooting foul on Ja Smith. DeMar McCollum to the line for 2 free throws. [Team fouls: 4] (Ja Smith: 2 personal fouls)   FT 1/2: GOOD   FT 2/2: GOOD DeMar McCollum makes 2/2 from the line.
Score: 99-80

[06:43] Team_038 possession (Score: 99-80)
Jalen Hyland attempts a Midrange. Contested by Tobias Wagner (3.9 feet, ZONE). Jalen Hyland misses. Rebound secured by DeMar McCollum.

[06:24] Team_095 possession (Score: 99-80)
Gary Davis drives, Ja Smith stays with him. Gary Davis attempts a Dunk. Contested by Ja Smith (3.1 feet, ZONE). Gary Davis misses. Rebound secured by Ja Smith.

[06:09] Team_038 possession (Score: 99-80)
Jalen Hyland attempts a Midrange. Contested by Kyle Poole (4.9 feet, MAN). Jalen Hyland misses. Offensive rebound by Jabari Carter! Jabari Carter's putback is no good. Offensive rebound by Ja Smith! Ja Smith kicks it out.

[05:59] Team_038 possession (Score: 99-80)
Jaren Jokic attempts a 3Pt. Contested by Cade Beal (4.1 feet, MAN). Jaren Jokic misses. Rebound secured by DeMar McCollum.

[05:45] Team_095 possession (Score: 99-80)
Tobias Wagner attempts a Layup. Contested by Ja Smith (3.7 feet, ZONE). Tobias Wagner misses. FOUL! Loose ball foul on Jabari Carter during the rebound battle. [IN THE BONUS! 5 team fouls] Tobias Wagner to the line for 2 free throws. (Jabari Carter: 1 personal fouls)   FT 1/2: MISS   FT 2/2: GOOD Tobias Wagner makes 1/2 from the line.
Score: 99-81

[05:29] Team_038 possession (Score: 99-81)
Jalen Hyland attempts a 3Pt. Contested by Cade Beal (4.5 feet, ZONE). JALEN HYLAND MAKES IT! Assist: Ja Smith
Score: 102-81

[05:14] Team_095 possession (Score: 102-81)
Kyle Poole drives to the basket... Kyle Poole throws a bad pass! Stolen by Jalen Hyland! TURNOVER! (live ball)

[05:00] Team_038 possession (Score: 102-81)
Jabari Carter throws a bad pass out of bounds! TURNOVER! (dead ball)

[04:49] Team_095 possession (Score: 102-81)
Kyle Poole attempts a 3Pt. Contested by Jalen Hyland (4.7 feet, MAN). Kyle Poole misses. Rebound secured by Jalen Hyland.

[04:34] Team_038 possession (Score: 102-81)
Magic Dosunmu attempts a 3Pt. Contested by Cade Beal (4.6 feet, ZONE). Magic Dosunmu misses. Rebound secured by Tobias Wagner.

[04:24] Team_095 possession (Score: 102-81)
Cade Beal drives, Ja Smith stays with him. Cade Beal attempts a Dunk. Contested by Ja Smith (3.3 feet, ZONE). CADE BEAL MAKES IT! Assist: Tobias Wagner
Score: 102-83

[04:11] Team_038 possession (Score: 102-83)
Jaren Jokic attempts a Layup. Contested by DeMar McCollum (4.5 feet, ZONE). JAREN JOKIC MAKES IT!
Score: 104-83

[03:59] Team_095 possession (Score: 104-83)
Tobias Wagner attempts a Midrange. Contested by Magic Dosunmu (3.5 feet, MAN). Tobias Wagner misses. Rebound secured by Ja Smith.

[03:42] Team_038 possession (Score: 104-83)
FOUL! Reach-in foul on DeMar McCollum during the drive. [Team fouls: 4] No free throws, side out. (DeMar McCollum: 3 personal fouls)

[03:26] Team_038 possession (Score: 104-83)
Magic Dosunmu attempts a 3Pt. Contested by Tobias Wagner (4.0 feet, MAN). Magic Dosunmu misses. FOUL! Loose ball foul on Tobias Wagner during the rebound battle. [IN THE BONUS! 5 team fouls] Jabari Carter to the line for 2 free throws. (Tobias Wagner: 1 personal fouls)   FT 1/2: GOOD   FT 2/2: GOOD Jabari Carter makes 2/2 from the line.
Score: 106-83

[03:15] Team_095 possession (Score: 106-83)
Gary Davis drives to the basket... Gary Davis loses control! Ball rolls out of bounds! TURNOVER! (dead ball)

[03:01] Team_038 possession (Score: 106-83)
Magic Dosunmu attempts a 3Pt. Contested by Tobias Wagner (4.0 feet, MAN). MAGIC DOSUNMU MAKES IT! Assist: Ja Smith
Score: 109-83

[02:47] Team_095 possession (Score: 109-83)
Gary Davis attempts a 3Pt. Contested by Jalen Hyland (4.1 feet, ZONE). GARY DAVIS MAKES IT! Assist: Cade Beal
Score: 109-86

[02:37] Team_038 possession (Score: 109-86)
Magic Dosunmu drives to the basket... Magic Dosunmu loses control! Ball rolls out of bounds! TURNOVER! (dead ball)

[02:26] Team_095 possession (Score: 109-86)
Tobias Wagner loses control! Ball rolls out of bounds! TURNOVER! (dead ball)

[02:12] Team_038 possession (Score: 109-86)
Ja Smith drives and kicks out. Magic Dosunmu attempts a Midrange. Contested by Cade Beal (4.4 feet, ZONE). Magic Dosunmu misses. Rebound secured by Gary Davis.

[01:56] Team_095 possession (Score: 109-86)
Kyle Poole attempts a 3Pt. Contested by Jalen Hyland (4.7 feet, MAN). KYLE POOLE MAKES IT!
Score: 109-89

[01:38] Team_038 possession (Score: 109-89)
Ja Smith attempts a Midrange. Contested by DeMar McCollum (6.0 feet, MAN). JA SMITH MAKES IT!
Score: 111-89

[01:23] Team_095 possession (Score: 111-89)
DeMar McCollum attempts a 3Pt. Contested by Jalen Hyland (5.0 feet, ZONE). DeMar McCollum misses. Rebound secured by Ja Smith.

[01:09] Team_038 possession (Score: 111-89)
Ja Smith attempts a Midrange. Contested by DeMar McCollum (6.0 feet, MAN). JA SMITH MAKES IT! Assist: Magic Dosunmu
Score: 113-89

[00:55] Team_095 possession (Score: 113-89)
Kyle Poole attempts a 3Pt. Contested by Jalen Hyland (4.8 feet, ZONE). Kyle Poole misses. FOUL! Loose ball foul on Jabari Carter during the rebound battle. [IN THE BONUS! 6 team fouls] Tobias Wagner to the line for 2 free throws. (Jabari Carter: 2 personal fouls)   FT 1/2: GOOD   FT 2/2: GOOD Tobias Wagner makes 2/2 from the line.
Score: 113-91

[00:41] Team_038 possession (Score: 113-91)
Magic Dosunmu attempts a Midrange. Contested by Gary Davis (5.9 feet, ZONE). MAGIC DOSUNMU MAKES IT! Assist: Jaren Jokic
Score: 115-91

[00:25] Team_095 possession (Score: 115-91)
Cade Beal makes the 3Pt and draws the foul on Jalen Hyland! And-1! Cade Beal to the line for 1. [BONUS: 7 team fouls] (Jalen Hyland: 2 personal fouls)   FT 1/1: GOOD Cade Beal makes 1/1 from the line.
Score: 115-95

[00:09] Team_038 possession (Score: 115-95)
Jaren Jokic makes the Dunk and draws the foul on Cade Beal! And-1! Jaren Jokic to the line for 1. [BONUS: 6 team fouls] (Cade Beal: 1 personal fouls)   FT 1/1: GOOD Jaren Jokic makes 1/1 from the line.
Score: 118-95

================================================================================
                              4TH QUARTER COMPLETE                              
================================================================================

4TH QUARTER SCORE: Team_038 32, Team_095 25

BOX SCORE:
================================================================================

Team_038
--------------------------------------------------------------------------------
Player                MIN  PTS  REB  AST  TO      FG   FG%      3P   3P%
--------------------------------------------------------------------------------
Magic Dosunmu          16    9    0    1   0   4/5    80.0     0/0   0.0
Ja Smith               16    6    5    2   0   3/4    75.0     0/0   0.0
Jaren Jokic            16    5    0    1   0   2/3    66.7     0/0   0.0
Rudy Thompson          32    4    0    0   0   2/4    50.0     0/0   0.0
DeMar Harris           32    3    1    0   0   1/1   100.0     0/0   0.0
Jalen Hyland           16    3    1    1   0   1/2    50.0     0/0   0.0
Jabari Carter          16    2    0    0   0   1/1   100.0     0/0   0.0
Malcolm Poole          32    0    0    0   0   0/1     0.0     0/0   0.0
Tracy LaVine           32    0    2    0   0   0/0     0.0     0/0   0.0
Luka Barnes            32    0    1    1   0   0/0     0.0     0/0   0.0

TEAM: FG: 14/21 (66.7%), 3PT: 4/8 (50.0%), REB: 10 (2 off, 8 def), AST: 6, TO: 3
TEAM FOULS: 7 [Team_095 in BONUS]


Team_095
--------------------------------------------------------------------------------
Player                MIN  PTS  REB  AST  TO      FG   FG%      3P   3P%
--------------------------------------------------------------------------------
Gary Davis             16    9    1    0   0   3/4    75.0     0/0   0.0
Cade Beal              16    6    0    1   0   2/2   100.0     0/0   0.0
Kyle Poole             16    3    0    1   0   1/2    50.0     0/0   0.0
Tobias Wagner          16    3    1    1   0   2/3    66.7     0/0   0.0
Immanuel Middleton     32    2    0    0   0   1/1   100.0     0/0   0.0
DeMar McCollum         16    2    3    0   0   1/2    50.0     0/0   0.0
Evan Carter            32    0    2    0   0   0/0     0.0     0/0   0.0
Dejounte Hyland        32    0    1    0   0   0/2     0.0     0/0   0.0
Kyrie Ming             32    0    0    0   0   0/2     0.0     0/0   0.0

TEAM: FG: 10/18 (55.6%), 3PT: 5/10 (50.0%), REB: 8 (1 off, 7 def), AST: 3, TO: 5
TEAM FOULS: 6 [Team_038 in BONUS]

================================================================================

================================================================================
                               FULL GAME COMPLETE                               
================================================================================

FINAL SCORE: Team_038 118, Team_095 95

SCORING BY QUARTER:
--------------------------------------------------------------------------------
Team                     Q1     Q2     Q3     Q4    FINAL
--------------------------------------------------------------------------------
Team_038                 33     30     23     32      118
Team_095                 22     26     22     25       95
--------------------------------------------------------------------------------

FULL GAME BOX SCORE:
================================================================================

Team_038
--------------------------------------------------------------------------------
Player                MIN  PTS  REB  AST  TO      FG   FG%      3P   3P%      FT STL BLK
--------------------------------------------------------------------------------
Rudy Thompson          32   14    0    3   1   6/13   46.2   1/4    25.0   4/6     0   0
Malcolm Poole          32   14    0    1   0   4/8    50.0   2/5    40.0   0/0     0   1
DeMar Harris           32   19   11    3   0   8/15   53.3   2/5    40.0   3/3     0   0
Tracy LaVine           32   13   15    1   2   6/10   60.0   0/2     0.0   5/9     2   2
Luka Barnes            32   10    6    5   0   6/10   60.0   1/2    50.0   2/5     1   0
Jalen Hyland           16    5    2    2   0   3/5    60.0   1/2    50.0   0/0     1   0
Jaren Jokic            16    8    0    1   1   4/7    57.1   1/4    25.0   1/1     0   1
Magic Dosunmu          16    9    0    1   0   5/7    71.4   2/4    50.0   0/0     1   0
Jabari Carter          16   11    3    0   2   3/5    60.0   1/2    50.0   2/2     0   0
Ja Smith               16    9    6    2   0   3/4    75.0   0/0     0.0   1/1     0   1

TEAM: FG: 48/85 (56.5%), 3PT: 11/30 (36.7%), REB: 46 (11 off, 35 def), AST: 19, TO: 6


Team_095
--------------------------------------------------------------------------------
Player                MIN  PTS  REB  AST  TO      FG   FG%      3P   3P%      FT STL BLK
--------------------------------------------------------------------------------
Dejounte Hyland        32   17   16    1   1   6/14   42.9   2/7    28.6   5/5     1   1
Shaquille Ball         32    5   10    2   1   2/6    33.3   1/3    33.3   0/1     0   0
Evan Carter            32   15   11    1   2   4/7    57.1   1/4    25.0   4/4     1   0
Immanuel Middleton     32   10    0    0   1   6/11   54.5   0/2     0.0   4/5     0   2
Kyrie Ming             32    2    0    3   5   2/9    22.2   0/4     0.0   2/2     0   0
Kyle Poole             16    3    0    2   1   2/3    66.7   2/3    66.7   0/0     0   0
Cade Beal              16   11    0    1   2   4/5    80.0   1/2    50.0   4/4     0   0
Tobias Wagner          16    6    4    2   2   2/4    50.0   1/1   100.0   3/4     0   0
Gary Davis             16   14    2    0   0   5/7    71.4   3/3   100.0   2/3     0   0
DeMar McCollum         16    6    5    1   1   3/5    60.0   0/1     0.0   3/4     0   0

TEAM: FG: 37/72 (51.4%), 3PT: 11/30 (36.7%), REB: 45 (13 off, 32 def), AST: 13, TO: 16

================================================================================
