================================================================================
                        FULL GAME - Team_048 vs Team_056                        
================================================================================

================================================================================
                       1ST QUARTER - Team_048 vs Team_056                       
================================================================================

[12:00] Team_048 possession (Score: 0-0)
Damian Mobley makes the Layup and draws the foul on Yao Poole! And-1! Damian Mobley to the line for 1. [Team fouls: 1] (Yao Poole: 1 personal fouls)   FT 1/1: GOOD Damian Mobley makes 1/1 from the line.
Score: 3-0

[11:49] Team_056 possession (Score: 3-0)
Giannis Jokic attempts a Midrange. Contested by Paolo Rozier (5.5 feet, MAN). GIANNIS JOKIC MAKES IT! Assist: Tony Carter
Score: 3-2

[11:36] Team_048 possession (Score: 3-2)
Dejounte Sexton attempts a Midrange. Wide open! Magic Russell is 6.2 feet away. [ZONE] Dejounte Sexton misses. Rebound secured by Tony Carter.

[11:20] Team_056 possession (Score: 3-2)
FOUL! Shooting foul on Paolo Rozier. Giannis Jokic to the line for 2 free throws. [Team fouls: 1] (Paolo Rozier: 1 personal fouls)   FT 1/2: GOOD   FT 2/2: GOOD Giannis Jokic makes 2/2 from the line.
Score: 3-4

[11:04] Team_048 possession (Score: 3-4)
Karl Johnson throws a bad pass! Stolen by Magic Russell! TURNOVER! (live ball)

[10:46] Team_056 possession (Score: 3-4)
Magic Russell attempts a 3Pt. Contested by Karl Johnson (4.8 feet, MAN). Magic Russell misses. Rebound secured by Damian Mobley.

[10:28] Team_048 possession (Score: 3-4)
Damian Mobley makes the Layup and draws the foul on Jrue Lillard! And-1! Damian Mobley to the line for 1. [Team fouls: 2] (Jrue Lillard: 1 personal fouls)   FT 1/1: MISS Damian Mobley makes 0/1 from the line. Rebound secured by Yao Poole.
Score: 5-4

[10:13] Team_056 possession (Score: 5-4)
Yao Poole attempts a Midrange. Contested by Kevin Fox (3.2 feet, MAN). Yao Poole misses. Rebound secured by Dejounte Sexton.

[09:59] Team_048 possession (Score: 5-4)
Damian Mobley attempts a Midrange. Contested by Yao Poole (4.7 feet, MAN). Damian Mobley misses. Rebound secured by Yao Poole.

[09:45] Team_056 possession (Score: 5-4)
Jrue Lillard drives, Kevin Fox stays with him. Jrue Lillard attempts a Layup. Contested by Kevin Fox (4.1 feet, MAN). JRUE LILLARD MAKES IT! Assist: Tony Carter
Score: 5-6

[09:30] Team_048 possession (Score: 5-6)
Dejounte Sexton attempts a Layup. Contested by Jrue Lillard (4.5 feet, ZONE). DEJOUNTE SEXTON MAKES IT!
Score: 7-6

[09:19] Team_056 possession (Score: 7-6)
Yao Poole drives, Kevin Fox stays with him. Yao Poole attempts a Layup. Contested by Kevin Fox (3.2 feet, ZONE). YAO POOLE MAKES IT! Assist: Tony Carter
Score: 7-8

[09:03] Team_048 possession (Score: 7-8)
Dejounte Sexton loses the ball! Stripped by Tony Carter! TURNOVER! (live ball)

[08:49] Team_056 possession (Score: 7-8)
FOUL! Shooting foul on Dejounte Sexton. Tony Carter to the line for 3 free throws. [Team fouls: 2] (Dejounte Sexton: 1 personal fouls)   FT 1/3: MISS   FT 2/3: GOOD   FT 3/3: GOOD Tony Carter makes 2/3 from the line.
Score: 7-10

[08:38] Team_048 possession (Score: 7-10)
Damian Mobley makes the Layup and draws the foul on Yao Poole! And-1! Damian Mobley to the line for 1. [Team fouls: 3] (Yao Poole: 2 personal fouls)   FT 1/1: GOOD Damian Mobley makes 1/1 from the line.
Score: 10-10

[08:26] Team_056 possession (Score: 10-10)
FOUL! Reach-in foul on Karl Johnson during the drive. [Team fouls: 3] No free throws, side out. (Karl Johnson: 1 personal fouls)

[08:08] Team_056 possession (Score: 10-10)
Tony Carter drives, Kevin Fox stays with him. Tony Carter attempts a Dunk. Contested by Kevin Fox (4.1 feet, ZONE). Tony Carter misses. Rebound secured by Kevin Fox.

[07:55] Team_048 possession (Score: 10-10)
Dejounte Sexton throws a bad pass out of bounds! TURNOVER! (dead ball)

[07:41] Team_056 possession (Score: 10-10)
FOUL! Shooting foul on Kevin Fox. Giannis Jokic to the line for 2 free throws. [Team fouls: 4] (Kevin Fox: 1 personal fouls)   FT 1/2: GOOD   FT 2/2: GOOD Giannis Jokic makes 2/2 from the line.
Score: 10-12

[07:26] Team_048 possession (Score: 10-12)
Kevin Fox attempts a 3Pt. Contested by Giannis Jokic (5.2 feet, ZONE). KEVIN FOX MAKES IT! Assist: Dejounte Sexton
Score: 13-12

[07:10] Team_056 possession (Score: 13-12)
Jrue Lillard attempts a Midrange. Contested by Kevin Fox (4.1 feet, ZONE). Jrue Lillard misses. Rebound secured by Dejounte Sexton.

[06:53] Team_048 possession (Score: 13-12)
FOUL! Reach-in foul on Magic Russell during the drive. [Team fouls: 4] No free throws, side out. (Magic Russell: 1 personal fouls)

[06:33] Team_048 possession (Score: 13-12)
Dejounte Sexton attempts a 3Pt. Contested by Tony Carter (4.9 feet, ZONE). Dejounte Sexton misses. Rebound secured by Tony Carter.

[06:22] Team_056 possession (Score: 13-12)
Yao Poole drives, Kevin Fox stays with him. Yao Poole attempts a Dunk. Contested by Kevin Fox (3.2 feet, MAN). YAO POOLE MAKES IT!
Score: 13-14

[06:08] Team_048 possession (Score: 13-14)
Dejounte Sexton attempts a 3Pt. BLOCKED BY TONY CARTER! Ball is loose! Offensive rebound by Damian Mobley! Damian Mobley kicks it out.

[05:54] Team_048 possession (Score: 13-14)
Damian Mobley drives to the basket... Damian Mobley loses control! Ball rolls out of bounds! TURNOVER! (dead ball)

[05:36] Team_056 possession (Score: 13-14)
Jrue Lillard attempts a Midrange. Contested by Kevin Fox (4.1 feet, MAN). JRUE LILLARD MAKES IT! Assist: Tony Carter
Score: 13-16

[05:24] Team_048 possession (Score: 13-16)
Kevin Fox drives, Yao Poole stays with him. Kevin Fox attempts a Layup. Contested by Yao Poole (5.0 feet, ZONE). KEVIN FOX MAKES IT! Assist: Damian Mobley
Score: 15-16

[05:08] Team_056 possession (Score: 15-16)
Yao Poole drives and kicks out. Yao Poole attempts a Midrange. Contested by Paolo Rozier (5.1 feet, ZONE). YAO POOLE MAKES IT!
Score: 15-18

[04:55] Team_048 possession (Score: 15-18)
FOUL! Offensive foul on Damian Mobley! Yao Poole drew the charge! [Team fouls: 5] (Damian Mobley: 1 personal fouls) TURNOVER! (dead ball)

[04:38] Team_056 possession (Score: 15-18)
Jrue Lillard attempts a 3Pt. Contested by Kevin Fox (4.1 feet, MAN). Jrue Lillard misses. Rebound secured by Damian Mobley.

[04:19] Team_048 possession (Score: 15-18)
Karl Johnson attempts a 3Pt. Wide open! Magic Russell is 6.1 feet away. [MAN] KARL JOHNSON MAKES IT! Assist: Dejounte Sexton
Score: 18-18

[04:03] Team_056 possession (Score: 18-18)
Tony Carter attempts a 3Pt. Contested by Dejounte Sexton (3.7 feet, ZONE). Tony Carter misses. Rebound secured by Kevin Fox.

[03:44] Team_048 possession (Score: 18-18)
Kevin Fox drives, Jrue Lillard stays with him. Kevin Fox attempts a Dunk. Contested by Jrue Lillard (4.8 feet, ZONE). KEVIN FOX MAKES IT!
Score: 20-18

[03:29] Team_056 possession (Score: 20-18)
Giannis Jokic drives, picks up Kevin Fox. Help arrives from Karl Johnson! Giannis Jokic attempts a Dunk. Contested by Karl Johnson (4.0 feet, ZONE). Giannis Jokic misses. Rebound secured by Damian Mobley.

[03:19] Team_048 possession (Score: 20-18)
FOUL! Reach-in foul on Jrue Lillard during the drive. [IN THE BONUS! 5 team fouls] Kevin Fox to the line for 2 free throws. (Jrue Lillard: 2 personal fouls)   FT 1/2: GOOD   FT 2/2: GOOD Kevin Fox makes 2/2 from the line.
Score: 22-18

[03:07] Team_056 possession (Score: 22-18)
FOUL! Reach-in foul on Kevin Fox during the drive. [IN THE BONUS! 6 team fouls] Giannis Jokic to the line for 2 free throws. (Kevin Fox: 2 personal fouls)   FT 1/2: GOOD   FT 2/2: GOOD Giannis Jokic makes 2/2 from the line.
Score: 22-20

[02:52] Team_048 possession (Score: 22-20)
Dejounte Sexton attempts a 3Pt. Contested by Tony Carter (5.0 feet, MAN). DEJOUNTE SEXTON MAKES IT! Assist: Karl Johnson
Score: 25-20

[02:41] Team_056 possession (Score: 25-20)
Magic Russell drives, picks up Damian Mobley. Help arrives from Karl Johnson! Magic Russell attempts a Layup. Contested by Karl Johnson (4.2 feet, ZONE). MAGIC RUSSELL MAKES IT! Assist: Giannis Jokic
Score: 25-22

[02:27] Team_048 possession (Score: 25-22)
Paolo Rozier drives, Jrue Lillard stays with him. Paolo Rozier attempts a Layup. Contested by Jrue Lillard (4.2 feet, ZONE). Paolo Rozier misses. Rebound secured by Tony Carter.

[02:14] Team_056 possession (Score: 25-22)
Magic Russell attempts a 3Pt. Contested by Karl Johnson (5.0 feet, MAN). Magic Russell misses. Rebound secured by Damian Mobley.

[01:57] Team_048 possession (Score: 25-22)
Paolo Rozier attempts a 3Pt. Contested by Giannis Jokic (4.8 feet, MAN). Paolo Rozier misses. Rebound secured by Jrue Lillard.

[01:44] Team_056 possession (Score: 25-22)
Jrue Lillard attempts a Midrange. Wide open! Paolo Rozier is 6.0 feet away. [ZONE] JRUE LILLARD MAKES IT! Assist: Tony Carter
Score: 25-24

[01:34] Team_048 possession (Score: 25-24)
Dejounte Sexton attempts a 3Pt. Contested by Tony Carter (5.2 feet, MAN). DEJOUNTE SEXTON MAKES IT! Assist: Damian Mobley
Score: 28-24

[01:22] Team_056 possession (Score: 28-24)
Giannis Jokic loses control! Ball rolls out of bounds! TURNOVER! (dead ball)

[01:22] Substitution (Team_048): Paolo Rozier OUT → Lauri Curry IN (stamina_rule2)

[01:22] Substitution (Team_048): Karl Johnson OUT → Yao Booker IN (stamina_rule2)

[01:22] Substitution (Team_048): Dejounte Sexton OUT → Kyle Irving IN (stamina_rule2)

[01:22] Substitution (Team_048): Kevin Fox OUT → DeMar Hyland IN (stamina_rule2)

[01:22] Substitution (Team_048): Damian Mobley OUT → Gary Giddey IN (stamina_rule2)

[01:22] Substitution (Team_056): Giannis Jokic OUT → De'Aaron Murray IN (stamina_rule2)

[01:22] Substitution (Team_056): Magic Russell OUT → Damian Barrett IN (stamina_rule2)

[01:22] Substitution (Team_056): Tony Carter OUT → CJ Anthony IN (stamina_rule2)

[01:22] Substitution (Team_056): Jrue Lillard OUT → RJ Johnson IN (stamina_rule2)

[01:22] Substitution (Team_056): Yao Poole OUT → Derrick Bane IN (stamina_rule2)

[01:10] Team_048 possession (Score: 28-24)
Kyle Irving attempts a Midrange. Contested by RJ Johnson (4.4 feet, ZONE). KYLE IRVING MAKES IT! Assist: Yao Booker
Score: 30-24

[00:58] Team_056 possession (Score: 30-24)
FOUL! Shooting foul on DeMar Hyland. RJ Johnson to the line for 2 free throws. [BONUS: 7 team fouls] (DeMar Hyland: 1 personal fouls)   FT 1/2: GOOD   FT 2/2: MISS RJ Johnson makes 1/2 from the line. Rebound secured by DeMar Hyland.
Score: 30-25

[00:45] Team_048 possession (Score: 30-25)
Gary Giddey attempts a Layup. BLOCKED BY DERRICK BANE! Ball is loose! Offensive rebound by Kyle Irving! Kyle Irving kicks it out.

[00:33] Team_048 possession (Score: 30-25)
Gary Giddey drives and kicks out. Yao Booker attempts a 3Pt. Contested by CJ Anthony (4.2 feet, ZONE). YAO BOOKER MAKES IT! Assist: Lauri Curry
Score: 33-25

[00:22] Team_056 possession (Score: 33-25)
CJ Anthony attempts a 3Pt. Contested by DeMar Hyland (3.4 feet, ZONE). CJ Anthony misses. Offensive rebound by CJ Anthony! CJ Anthony kicks it out.

[00:07] Team_056 possession (Score: 33-25)
FOUL! Reach-in foul on Kyle Irving during the drive. [IN THE BONUS! 8 team fouls] CJ Anthony to the line for 2 free throws. (Kyle Irving: 1 personal fouls)   FT 1/2: GOOD   FT 2/2: GOOD CJ Anthony makes 2/2 from the line.
Score: 33-27

================================================================================
                              1ST QUARTER COMPLETE                              
================================================================================

1ST QUARTER SCORE: Team_048 33, Team_056 27

BOX SCORE:
================================================================================

Team_048
--------------------------------------------------------------------------------
Player                MIN  PTS  REB  AST  TO      FG   FG%      3P   3P%
--------------------------------------------------------------------------------
Kevin Fox              11    9    2    0   0   4/4   100.0     0/0   0.0
Dejounte Sexton        11    8    2    2   0   3/5    60.0     0/0   0.0
Damian Mobley          11    6    5    2   0   2/4    50.0     0/0   0.0
Karl Johnson           11    3    0    1   0   1/1   100.0     0/0   0.0
Yao Booker              1    3    0    1   0   1/1   100.0     0/0   0.0
Kyle Irving             1    2    1    0   0   1/1   100.0     0/0   0.0
Paolo Rozier           11    0    0    0   0   0/2     0.0     0/0   0.0
DeMar Hyland            1    0    1    0   0   0/0     0.0     0/0   0.0
Lauri Curry             1    0    0    1   0   0/0     0.0     0/0   0.0

TEAM: FG: 12/18 (66.7%), 3PT: 4/6 (66.7%), REB: 11 (2 off, 9 def), AST: 7, TO: 5
TEAM FOULS: 8 [Team_056 in BONUS]


Team_056
--------------------------------------------------------------------------------
Player                MIN  PTS  REB  AST  TO      FG   FG%      3P   3P%
--------------------------------------------------------------------------------
Giannis Jokic          11    8    0    1   0   4/5    80.0     0/0   0.0
Yao Poole              11    6    2    0   0   3/4    75.0     0/0   0.0
Jrue Lillard           11    6    1    0   0   3/5    60.0     0/0   0.0
Tony Carter            11    2    3    5   0   1/3    33.3     0/0   0.0
Magic Russell          11    2    0    0   0   1/3    33.3     0/0   0.0
CJ Anthony              1    2    1    0   0   1/1   100.0     0/0   0.0
RJ Johnson              1    0    0    0   0   0/1     0.0     0/0   0.0

TEAM: FG: 13/22 (59.1%), 3PT: 1/5 (20.0%), REB: 7 (1 off, 6 def), AST: 6, TO: 1
TEAM FOULS: 5 [Team_048 in BONUS]

================================================================================

================================================================================
                       2ND QUARTER - Team_048 vs Team_056                       
================================================================================

[12:00] Team_048 possession (Score: 33-27)
Kevin Fox drives and kicks out. Karl Johnson attempts a Midrange. BLOCKED BY MAGIC RUSSELL! Ball goes out off Magic Russell. Karl Johnson's ball!

[11:44] Team_048 possession (Score: 33-27)
Karl Johnson attempts a 3Pt. Wide open! Magic Russell is 6.2 feet away. [MAN] Karl Johnson misses. Rebound secured by Yao Poole.

[11:31] Team_056 possession (Score: 33-27)
Giannis Jokic drives to the basket... Giannis Jokic throws a bad pass! Stolen by Kevin Fox! TURNOVER! (live ball)

[11:16] Team_048 possession (Score: 33-27)
Paolo Rozier makes the Layup and draws the foul on Tony Carter! And-1! Paolo Rozier to the line for 1. [Team fouls: 1] (Tony Carter: 1 personal fouls)   FT 1/1: GOOD Paolo Rozier makes 1/1 from the line.
Score: 36-27

[11:01] Team_056 possession (Score: 36-27)
Giannis Jokic attempts a 3Pt. Contested by Paolo Rozier (5.7 feet, MAN). GIANNIS JOKIC MAKES IT! Assist: Magic Russell
Score: 36-30

[10:43] Team_048 possession (Score: 36-30)
Kevin Fox drives and kicks out. Damian Mobley attempts a 3Pt. Contested by Yao Poole (4.4 feet, MAN). DAMIAN MOBLEY MAKES IT! Assist: Dejounte Sexton
Score: 39-30

[10:28] Team_056 possession (Score: 39-30)
Jrue Lillard attempts a 3Pt. Contested by Dejounte Sexton (3.8 feet, ZONE). Jrue Lillard misses. Rebound secured by Kevin Fox.

[10:11] Team_048 possession (Score: 39-30)
FOUL! Shooting foul on Jrue Lillard. Dejounte Sexton to the line for 2 free throws. [Team fouls: 2] (Jrue Lillard: 1 personal fouls)   FT 1/2: GOOD   FT 2/2: GOOD Dejounte Sexton makes 2/2 from the line.
Score: 41-30

[09:57] Team_056 possession (Score: 41-30)
Giannis Jokic attempts a 3Pt. Contested by Paolo Rozier (5.7 feet, MAN). Giannis Jokic misses. Rebound secured by Damian Mobley.

[09:40] Team_048 possession (Score: 41-30)
Damian Mobley drives and kicks out. Dejounte Sexton attempts a Midrange. Contested by Tony Carter (4.5 feet, MAN). DEJOUNTE SEXTON MAKES IT! Assist: Karl Johnson
Score: 43-30

[09:28] Team_056 possession (Score: 43-30)
Yao Poole attempts a 3Pt. Contested by Kevin Fox (3.6 feet, MAN). Yao Poole misses. Offensive rebound by Jrue Lillard! Jrue Lillard's putback is no good. Offensive rebound by Yao Poole! Yao Poole kicks it out.

[09:09] Team_056 possession (Score: 43-30)
Giannis Jokic attempts a Layup. BLOCKED BY KEVIN FOX! Ball deflects out of bounds off Giannis Jokic.

[09:00] Team_048 possession (Score: 43-30)
FOUL! Reach-in foul on Jrue Lillard during the drive. [Team fouls: 3] No free throws, side out. (Jrue Lillard: 2 personal fouls)

[08:46] Team_048 possession (Score: 43-30)
Damian Mobley drives, Yao Poole stays with him. Damian Mobley attempts a Layup. Contested by Yao Poole (5.3 feet, MAN). DAMIAN MOBLEY MAKES IT!
Score: 45-30

[08:30] Team_056 possession (Score: 45-30)
FOUL! Reach-in foul on Kevin Fox during the drive. [Team fouls: 1] No free throws, side out. (Kevin Fox: 1 personal fouls)

[08:17] Team_056 possession (Score: 45-30)
Giannis Jokic loses the ball! Stripped by Paolo Rozier! TURNOVER! (live ball)

[08:03] Team_048 possession (Score: 45-30)
FOUL! Shooting foul on Yao Poole. Damian Mobley to the line for 2 free throws. [Team fouls: 4] (Yao Poole: 1 personal fouls)   FT 1/2: GOOD   FT 2/2: GOOD Damian Mobley makes 2/2 from the line.
Score: 47-30

[07:47] Team_056 possession (Score: 47-30)
Giannis Jokic attempts a Midrange. Contested by Dejounte Sexton (3.9 feet, ZONE). Giannis Jokic misses. Rebound secured by Damian Mobley.

[07:31] Team_048 possession (Score: 47-30)
Paolo Rozier attempts a 3Pt. Contested by Giannis Jokic (5.1 feet, ZONE). Paolo Rozier misses. Rebound secured by Tony Carter.

[07:21] Team_056 possession (Score: 47-30)
Giannis Jokic attempts a 3Pt. Contested by Paolo Rozier (6.0 feet, MAN). Giannis Jokic misses. Rebound secured by Damian Mobley.

[07:06] Team_048 possession (Score: 47-30)
Damian Mobley drives to the basket... Damian Mobley loses control! Ball rolls out of bounds! TURNOVER! (dead ball)

[07:06] Substitution (Team_048): Paolo Rozier OUT → Lauri Curry IN (stamina_rule2)

[07:06] Substitution (Team_048): Karl Johnson OUT → Yao Booker IN (stamina_rule2)

[07:06] Substitution (Team_048): Dejounte Sexton OUT → Kyle Irving IN (stamina_rule2)

[07:06] Substitution (Team_048): Kevin Fox OUT → DeMar Hyland IN (stamina_rule2)

[07:06] Substitution (Team_048): Damian Mobley OUT → Gary Giddey IN (stamina_rule2)

[07:06] Substitution (Team_056): Giannis Jokic OUT → De'Aaron Murray IN (stamina_rule2)

[07:06] Substitution (Team_056): Magic Russell OUT → Damian Barrett IN (stamina_rule2)

[07:06] Substitution (Team_056): Tony Carter OUT → CJ Anthony IN (stamina_rule2)

[07:06] Substitution (Team_056): Jrue Lillard OUT → RJ Johnson IN (stamina_rule2)

[07:06] Substitution (Team_056): Yao Poole OUT → Derrick Bane IN (stamina_rule2)

[06:54] Team_056 possession (Score: 47-30)
Damian Barrett attempts a 3Pt. Contested by Yao Booker (4.9 feet, MAN). DAMIAN BARRETT MAKES IT! Assist: Derrick Bane
Score: 47-33

[06:38] Team_048 possession (Score: 47-33)
DeMar Hyland attempts a Midrange. Contested by RJ Johnson (4.6 feet, ZONE). DeMar Hyland misses. Rebound secured by RJ Johnson.

[06:20] Team_056 possession (Score: 47-33)
De'Aaron Murray drives, Gary Giddey stays with him. De'Aaron Murray attempts a Layup. Contested by Gary Giddey (4.7 feet, ZONE). DE'AARON MURRAY MAKES IT! Assist: RJ Johnson
Score: 47-35

[06:03] Team_048 possession (Score: 47-35)
Lauri Curry attempts a Midrange. Wide open! De'Aaron Murray is 6.0 feet away. [MAN] LAURI CURRY MAKES IT! Assist: Gary Giddey
Score: 49-35

[05:46] Team_056 possession (Score: 49-35)
Damian Barrett attempts a 3Pt. Contested by Yao Booker (4.9 feet, MAN). Damian Barrett misses. Rebound secured by Gary Giddey.

[05:29] Team_048 possession (Score: 49-35)
DeMar Hyland makes the Layup and draws the foul on Damian Barrett! And-1! DeMar Hyland to the line for 1. [BONUS: 5 team fouls] (Damian Barrett: 1 personal fouls)   FT 1/1: GOOD DeMar Hyland makes 1/1 from the line.
Score: 52-35

[05:18] Team_056 possession (Score: 52-35)
De'Aaron Murray drives, Lauri Curry stays with him. De'Aaron Murray attempts a Dunk. Contested by Lauri Curry (4.7 feet, MAN). De'Aaron Murray misses. Rebound secured by Gary Giddey.

[05:03] Team_048 possession (Score: 52-35)
Gary Giddey attempts a 3Pt. Wide open! De'Aaron Murray is 6.1 feet away. [ZONE] Gary Giddey misses. Rebound secured by CJ Anthony.

[04:47] Team_056 possession (Score: 52-35)
RJ Johnson makes the Midrange and draws the foul on DeMar Hyland! And-1! RJ Johnson to the line for 1. [Team fouls: 2] (DeMar Hyland: 1 personal fouls)   FT 1/1: GOOD RJ Johnson makes 1/1 from the line.
Score: 52-38

[04:36] Team_048 possession (Score: 52-38)
Kyle Irving attempts a 3Pt. Contested by De'Aaron Murray (5.9 feet, ZONE). KYLE IRVING MAKES IT! Assist: Gary Giddey
Score: 55-38

[04:21] Team_056 possession (Score: 55-38)
RJ Johnson drives, DeMar Hyland stays with him. RJ Johnson attempts a Dunk. Contested by DeMar Hyland (3.5 feet, ZONE). RJ JOHNSON MAKES IT! Assist: De'Aaron Murray
Score: 55-40

[04:04] Team_048 possession (Score: 55-40)
Kyle Irving drives and kicks out. Yao Booker attempts a 3Pt. Contested by De'Aaron Murray (5.9 feet, ZONE). YAO BOOKER MAKES IT!
Score: 58-40

[03:50] Team_056 possession (Score: 58-40)
FOUL! Shooting foul on Kyle Irving. CJ Anthony to the line for 2 free throws. [Team fouls: 3] (Kyle Irving: 1 personal fouls)   FT 1/2: GOOD   FT 2/2: GOOD CJ Anthony makes 2/2 from the line.
Score: 58-42

[03:32] Team_048 possession (Score: 58-42)
Lauri Curry attempts a 3Pt. Wide open! De'Aaron Murray is 6.0 feet away. [MAN] Lauri Curry misses. Offensive rebound by Kyle Irving! Kyle Irving puts it back in!
Score: 60-42

[03:17] Team_056 possession (Score: 60-42)
FOUL! Shooting foul on Lauri Curry. Damian Barrett to the line for 2 free throws. [Team fouls: 4] (Lauri Curry: 1 personal fouls)   FT 1/2: GOOD   FT 2/2: MISS Damian Barrett makes 1/2 from the line. FOUL! Loose ball foul on Kyle Irving during the free throw rebound! [IN THE BONUS! 5 team fouls] CJ Anthony to the line for 2 free throws. (Kyle Irving: 2 personal fouls)   FT 1/2: GOOD   FT 2/2: GOOD CJ Anthony makes 2/2 from the line.
Score: 60-45

[03:06] Team_048 possession (Score: 60-45)
FOUL! Shooting foul on De'Aaron Murray. Kyle Irving to the line for 3 free throws. [BONUS: 6 team fouls] (De'Aaron Murray: 1 personal fouls)   FT 1/3: MISS   FT 2/3: GOOD   FT 3/3: GOOD Kyle Irving makes 2/3 from the line.
Score: 62-45

[02:55] Team_056 possession (Score: 62-45)
Derrick Bane attempts a Midrange. Contested by DeMar Hyland (3.8 feet, ZONE). DERRICK BANE MAKES IT!
Score: 62-47

[02:39] Team_048 possession (Score: 62-47)
DeMar Hyland drives, RJ Johnson stays with him. DeMar Hyland attempts a Layup. Contested by RJ Johnson (4.6 feet, ZONE). DEMAR HYLAND MAKES IT!
Score: 64-47

[02:23] Team_056 possession (Score: 64-47)
CJ Anthony drives, picks up DeMar Hyland. Help arrives from Lauri Curry! CJ Anthony attempts a Dunk. Contested by Lauri Curry (3.4 feet, ZONE). CJ ANTHONY MAKES IT!
Score: 64-49

[02:08] Team_048 possession (Score: 64-49)
Yao Booker drives and kicks out. DeMar Hyland attempts a Midrange. Contested by RJ Johnson (4.4 feet, MAN). DEMAR HYLAND MAKES IT!
Score: 66-49

[01:48] Team_056 possession (Score: 66-49)
Damian Barrett attempts a Midrange. Contested by Yao Booker (4.9 feet, MAN). DAMIAN BARRETT MAKES IT! Assist: De'Aaron Murray
Score: 66-51

[01:32] Team_048 possession (Score: 66-51)
FOUL! Shooting foul on RJ Johnson. Yao Booker to the line for 2 free throws. [BONUS: 7 team fouls] (RJ Johnson: 1 personal fouls)   FT 1/2: GOOD   FT 2/2: GOOD Yao Booker makes 2/2 from the line.
Score: 68-51

[01:23] Team_056 possession (Score: 68-51)
Derrick Bane attempts a Midrange. Contested by DeMar Hyland (3.8 feet, MAN). Derrick Bane misses. Rebound secured by Kyle Irving.

[01:12] Team_048 possession (Score: 68-51)
FOUL! Reach-in foul on RJ Johnson during the drive. [IN THE BONUS! 8 team fouls] Yao Booker to the line for 2 free throws. (RJ Johnson: 2 personal fouls)   FT 1/2: GOOD   FT 2/2: GOOD Yao Booker makes 2/2 from the line.
Score: 70-51

[00:59] Team_056 possession (Score: 70-51)
RJ Johnson attempts a 3Pt. Contested by Kyle Irving (4.6 feet, ZONE). RJ JOHNSON MAKES IT! Assist: Derrick Bane
Score: 70-54

[00:40] Team_048 possession (Score: 70-54)
Gary Giddey drives, Derrick Bane stays with him. Gary Giddey attempts a Layup. Contested by Derrick Bane (5.7 feet, MAN). Gary Giddey misses. Rebound secured by CJ Anthony.

[00:26] Team_056 possession (Score: 70-54)
CJ Anthony attempts a 3Pt. Contested by Kyle Irving (4.4 feet, ZONE). CJ Anthony misses. Rebound secured by DeMar Hyland.

[00:15] Team_048 possession (Score: 70-54)
Gary Giddey attempts a Midrange. Contested by Derrick Bane (5.7 feet, MAN). Gary Giddey misses. Offensive rebound by DeMar Hyland! DeMar Hyland kicks it out.

[00:03] Team_048 possession (Score: 70-54)
Yao Booker drives, picks up Damian Barrett. Help arrives from CJ Anthony! Yao Booker attempts a Dunk. Contested by CJ Anthony (5.7 feet, MAN). Yao Booker misses. Rebound secured by RJ Johnson.

================================================================================
                              2ND QUARTER COMPLETE                              
================================================================================

2ND QUARTER SCORE: Team_048 37, Team_056 27

BOX SCORE:
================================================================================

Team_048
--------------------------------------------------------------------------------
Player                MIN  PTS  REB  AST  TO      FG   FG%      3P   3P%
--------------------------------------------------------------------------------
Damian Mobley          16    7    3    0   0   3/3   100.0     0/0   0.0
DeMar Hyland            8    7    2    0   0   3/4    75.0     0/0   0.0
Kyle Irving             8    7    2    0   0   3/3   100.0     0/0   0.0
Yao Booker              8    7    0    0   0   3/4    75.0     0/0   0.0
Dejounte Sexton        16    4    0    1   0   2/2   100.0     0/0   0.0
Paolo Rozier           16    3    0    0   0   1/2    50.0     0/0   0.0
Lauri Curry             8    2    0    0   0   1/1   100.0     0/0   0.0
Karl Johnson           16    0    0    1   0   0/1     0.0     0/0   0.0
Kevin Fox              16    0    1    0   0   0/0     0.0     0/0   0.0
Gary Giddey             8    0    2    2   0   0/2     0.0     0/0   0.0

TEAM: FG: 16/22 (72.7%), 3PT: 3/6 (50.0%), REB: 10 (2 off, 8 def), AST: 4, TO: 1
TEAM FOULS: 5 [Team_056 in BONUS]


Team_056
--------------------------------------------------------------------------------
Player                MIN  PTS  REB  AST  TO      FG   FG%      3P   3P%
--------------------------------------------------------------------------------
RJ Johnson              8    8    2    1   0   3/3   100.0     0/0   0.0
CJ Anthony              8    7    2    0   0   3/4    75.0     0/0   0.0
Damian Barrett          8    5    0    0   0   2/3    66.7     0/0   0.0
Giannis Jokic          16    3    0    0   0   1/5    20.0     0/0   0.0
Derrick Bane            8    2    0    2   0   1/2    50.0     0/0   0.0
De'Aaron Murray         8    2    0    2   0   1/2    50.0     0/0   0.0
Yao Poole              16    0    2    0   0   0/0     0.0     0/0   0.0
Magic Russell          16    0    0    1   0   0/0     0.0     0/0   0.0
Jrue Lillard           16    0    0    0   0   0/1     0.0     0/0   0.0
Tony Carter            16    0    1    0   0   0/0     0.0     0/0   0.0

TEAM: FG: 11/20 (55.0%), 3PT: 3/8 (37.5%), REB: 7 (1 off, 6 def), AST: 6, TO: 2
TEAM FOULS: 8 [Team_048 in BONUS]

================================================================================

================================================================================
                       3RD QUARTER - Team_048 vs Team_056                       
================================================================================

[12:00] Team_048 possession (Score: 70-54)
Karl Johnson attempts a Midrange. Wide open! Magic Russell is 6.1 feet away. [MAN] KARL JOHNSON MAKES IT! Assist: Paolo Rozier
Score: 72-54

[11:43] Team_056 possession (Score: 72-54)
Yao Poole attempts a Midrange. Contested by Kevin Fox (3.2 feet, ZONE). Yao Poole misses. Rebound secured by Damian Mobley.

[11:31] Team_048 possession (Score: 72-54)
Kevin Fox makes the Layup and draws the foul on Jrue Lillard! And-1! Kevin Fox to the line for 1. [Team fouls: 1] (Jrue Lillard: 1 personal fouls)   FT 1/1: GOOD Kevin Fox makes 1/1 from the line.
Score: 75-54

[11:16] Team_056 possession (Score: 75-54)
Magic Russell drives to the basket... Magic Russell loses the ball! Stripped by Karl Johnson! TURNOVER! (live ball)

[11:07] Team_048 possession (Score: 75-54)
Dejounte Sexton drives to the basket... Dejounte Sexton throws a bad pass! Stolen by Tony Carter! TURNOVER! (live ball)

[10:51] Team_056 possession (Score: 75-54)
Tony Carter attempts a 3Pt. Contested by Dejounte Sexton (3.7 feet, MAN). Tony Carter misses. Offensive rebound by Jrue Lillard! Jrue Lillard puts it back in!
Score: 75-56

[10:35] Team_048 possession (Score: 75-56)
Dejounte Sexton attempts a Layup. Contested by Tony Carter (4.9 feet, MAN). Dejounte Sexton misses. Rebound secured by Jrue Lillard.

[10:17] Team_056 possession (Score: 75-56)
Magic Russell commits a violation (traveling/carry)! TURNOVER! (dead ball)

[10:01] Team_048 possession (Score: 75-56)
Damian Mobley drives, Jrue Lillard stays with him. Damian Mobley attempts a Layup. Contested by Jrue Lillard (4.5 feet, ZONE). DAMIAN MOBLEY MAKES IT! Assist: Kevin Fox
Score: 77-56

[09:47] Team_056 possession (Score: 77-56)
FOUL! Reach-in foul on Kevin Fox during the drive. [Team fouls: 1] No free throws, side out. (Kevin Fox: 1 personal fouls)

[09:32] Team_056 possession (Score: 77-56)
Tony Carter attempts a 3Pt. Contested by Dejounte Sexton (3.7 feet, MAN). TONY CARTER MAKES IT!
Score: 77-59

[09:18] Team_048 possession (Score: 77-59)
Karl Johnson attempts a Midrange. Wide open! Magic Russell is 6.1 feet away. [ZONE] Karl Johnson misses. Offensive rebound by Kevin Fox! Kevin Fox kicks it out.

[09:07] Team_048 possession (Score: 77-59)
Kevin Fox attempts a 3Pt. Contested by Giannis Jokic (5.2 feet, ZONE). Kevin Fox misses. Rebound secured by Jrue Lillard.

[08:51] Team_056 possession (Score: 77-59)
Giannis Jokic attempts a 3Pt. Contested by Dejounte Sexton (3.4 feet, ZONE). Giannis Jokic misses. Rebound secured by Kevin Fox.

[08:36] Team_048 possession (Score: 77-59)
FOUL! Reach-in foul on Jrue Lillard during the drive. [Team fouls: 2] No free throws, side out. (Jrue Lillard: 2 personal fouls)

[08:17] Team_048 possession (Score: 77-59)
Damian Mobley attempts a Midrange. Contested by Yao Poole (4.7 feet, MAN). Damian Mobley misses. Rebound secured by Tony Carter.

[08:03] Team_056 possession (Score: 77-59)
FOUL! Shooting foul on Kevin Fox. Yao Poole to the line for 2 free throws. [Team fouls: 2] (Kevin Fox: 2 personal fouls)   FT 1/2: GOOD   FT 2/2: GOOD Yao Poole makes 2/2 from the line.
Score: 77-61

[07:45] Team_048 possession (Score: 77-61)
Paolo Rozier attempts a 3Pt. Contested by Giannis Jokic (4.5 feet, MAN). Paolo Rozier misses. FOUL! Loose ball foul on Jrue Lillard during the rebound battle. [Team fouls: 3] No free throws, side out. (Jrue Lillard: 3 personal fouls)

[07:32] Team_048 possession (Score: 77-61)
Kevin Fox attempts a Midrange. Contested by Tony Carter (5.0 feet, ZONE). KEVIN FOX MAKES IT! Assist: Dejounte Sexton
Score: 79-61

[07:20] Team_056 possession (Score: 79-61)
Giannis Jokic attempts a 3Pt. Contested by Paolo Rozier (5.5 feet, MAN). Giannis Jokic misses. Rebound secured by Dejounte Sexton.

[07:07] Team_048 possession (Score: 79-61)
Kevin Fox attempts a 3Pt. Contested by Tony Carter (5.0 feet, ZONE). Kevin Fox misses. Rebound secured by Jrue Lillard.

[06:50] Team_056 possession (Score: 79-61)
Magic Russell attempts a Midrange. Contested by Dejounte Sexton (3.4 feet, ZONE). MAGIC RUSSELL MAKES IT!
Score: 79-63

[06:33] Team_048 possession (Score: 79-63)
FOUL! Holding foul on Tony Carter. [Team fouls: 4] No free throws, side out. (Tony Carter: 1 personal fouls)

[06:18] Team_048 possession (Score: 79-63)
Kevin Fox attempts a 3Pt. Contested by Giannis Jokic (5.2 feet, ZONE). KEVIN FOX MAKES IT! Assist: Dejounte Sexton
Score: 82-63

[06:03] Team_056 possession (Score: 82-63)
FOUL! Offensive foul on Giannis Jokic! Paolo Rozier drew the charge! [Team fouls: 5] (Giannis Jokic: 1 personal fouls) TURNOVER! (dead ball)

[05:50] Team_048 possession (Score: 82-63)
Kevin Fox attempts a 3Pt. Contested by Jrue Lillard (4.7 feet, MAN). Kevin Fox misses. Rebound secured by Yao Poole.

[05:33] Team_056 possession (Score: 82-63)
FOUL! Offensive foul on Yao Poole! Kevin Fox drew the charge! [Team fouls: 6] (Yao Poole: 1 personal fouls) TURNOVER! (dead ball)

[05:18] Team_048 possession (Score: 82-63)
Damian Mobley attempts a Layup. Contested by Jrue Lillard (4.5 feet, ZONE). DAMIAN MOBLEY MAKES IT!
Score: 84-63

[05:02] Team_056 possession (Score: 84-63)
Giannis Jokic attempts a 3Pt. Contested by Dejounte Sexton (3.4 feet, ZONE). Giannis Jokic misses. Rebound secured by Damian Mobley.

[04:51] Team_048 possession (Score: 84-63)
Dejounte Sexton attempts a 3Pt. Contested by Giannis Jokic (5.1 feet, ZONE). Dejounte Sexton misses. Offensive rebound by Kevin Fox! Kevin Fox kicks it out.

[04:38] Team_048 possession (Score: 84-63)
Paolo Rozier attempts a Layup. Contested by Jrue Lillard (4.0 feet, ZONE). Paolo Rozier misses. FOUL! Loose ball foul on Yao Poole during the rebound battle. [IN THE BONUS! 7 team fouls] Damian Mobley to the line for 2 free throws. (Yao Poole: 2 personal fouls)   FT 1/2: GOOD   FT 2/2: GOOD Damian Mobley makes 2/2 from the line.
Score: 86-63

[04:23] Team_056 possession (Score: 86-63)
Tony Carter attempts a 3Pt. Contested by Dejounte Sexton (3.7 feet, ZONE). Tony Carter misses. Rebound secured by Damian Mobley.

[04:11] Team_048 possession (Score: 86-63)
Dejounte Sexton drives to the basket... Dejounte Sexton commits a violation (traveling/carry)! TURNOVER! (dead ball)

[03:56] Team_056 possession (Score: 86-63)
Tony Carter throws a bad pass out of bounds! TURNOVER! (dead ball)

[03:38] Team_048 possession (Score: 86-63)
FOUL! Offensive foul on Paolo Rozier! Giannis Jokic drew the charge! [Team fouls: 3] (Paolo Rozier: 1 personal fouls) TURNOVER! (dead ball)

[03:25] Team_056 possession (Score: 86-63)
Giannis Jokic attempts a Midrange. Contested by Karl Johnson (4.9 feet, ZONE). Giannis Jokic misses. Rebound secured by Kevin Fox.

[03:11] Team_048 possession (Score: 86-63)
Damian Mobley drives, picks up Yao Poole. Help arrives from Giannis Jokic! Damian Mobley attempts a Dunk. Contested by Giannis Jokic (5.0 feet, MAN). DAMIAN MOBLEY MAKES IT!
Score: 88-63

[02:55] Team_056 possession (Score: 88-63)
FOUL! Shooting foul on Kevin Fox. Jrue Lillard to the line for 2 free throws. [Team fouls: 4] (Kevin Fox: 3 personal fouls)   FT 1/2: GOOD   FT 2/2: GOOD Jrue Lillard makes 2/2 from the line.
Score: 88-65

[02:39] Team_048 possession (Score: 88-65)
Paolo Rozier attempts a 3Pt. Contested by Giannis Jokic (4.7 feet, ZONE). Paolo Rozier misses. Rebound secured by Jrue Lillard.

[02:25] Team_056 possession (Score: 88-65)
Giannis Jokic attempts a Midrange. Contested by Paolo Rozier (5.7 feet, MAN). GIANNIS JOKIC MAKES IT!
Score: 88-67

[02:12] Team_048 possession (Score: 88-67)
Kevin Fox drives, Jrue Lillard stays with him. Kevin Fox attempts a Dunk. Contested by Jrue Lillard (4.9 feet, ZONE). KEVIN FOX MAKES IT!
Score: 90-67

[01:55] Team_056 possession (Score: 90-67)
Tony Carter drives to the basket... Tony Carter throws a bad pass! Stolen by Dejounte Sexton! TURNOVER! (live ball)

[01:41] Team_048 possession (Score: 90-67)
Damian Mobley drives and kicks out. Paolo Rozier makes the Midrange and draws the foul on Magic Russell! And-1! Paolo Rozier to the line for 1. [BONUS: 8 team fouls] (Magic Russell: 1 personal fouls)   FT 1/1: GOOD Paolo Rozier makes 1/1 from the line.
Score: 93-67

[01:27] Team_056 possession (Score: 93-67)
Magic Russell attempts a 3Pt. Contested by Karl Johnson (5.1 feet, MAN). Magic Russell misses. Rebound secured by Kevin Fox.

[01:16] Team_048 possession (Score: 93-67)
Dejounte Sexton drives and kicks out. Damian Mobley attempts a Midrange. Contested by Yao Poole (4.6 feet, MAN). DAMIAN MOBLEY MAKES IT!
Score: 95-67

[01:02] Team_056 possession (Score: 95-67)
Yao Poole attempts a 3Pt. Contested by Dejounte Sexton (3.1 feet, ZONE). Yao Poole misses. Rebound secured by Damian Mobley.

[00:49] Team_048 possession (Score: 95-67)
Dejounte Sexton attempts a 3Pt. Contested by Giannis Jokic (5.4 feet, ZONE). Dejounte Sexton misses. Rebound secured by Tony Carter.

[00:36] Team_056 possession (Score: 95-67)
Tony Carter attempts a 3Pt. Contested by Dejounte Sexton (4.1 feet, ZONE). Tony Carter misses. Rebound secured by Dejounte Sexton.

[00:18] Team_048 possession (Score: 95-67)
Paolo Rozier attempts a Midrange. Contested by Jrue Lillard (4.5 feet, ZONE). PAOLO ROZIER MAKES IT!
Score: 97-67

[00:01] Team_056 possession (Score: 97-67)
Jrue Lillard attempts a 3Pt. Contested by Kevin Fox (4.6 feet, MAN). Jrue Lillard misses. Rebound secured by Dejounte Sexton.

================================================================================
                              3RD QUARTER COMPLETE                              
================================================================================

3RD QUARTER SCORE: Team_048 27, Team_056 13

BOX SCORE:
================================================================================

Team_048
--------------------------------------------------------------------------------
Player                MIN  PTS  REB  AST  TO      FG   FG%      3P   3P%
--------------------------------------------------------------------------------
Damian Mobley          28   10    5    0   0   5/6    83.3     0/0   0.0
Kevin Fox              28   10    5    1   0   4/7    57.1     0/0   0.0
Paolo Rozier           28    5    0    1   0   2/3    66.7     0/0   0.0
Karl Johnson           28    2    0    0   0   1/1   100.0     0/0   0.0
Dejounte Sexton        28    0    3    2   0   0/2     0.0     0/0   0.0

TEAM: FG: 12/19 (63.2%), 3PT: 1/6 (16.7%), REB: 13 (3 off, 10 def), AST: 4, TO: 3
TEAM FOULS: 4


Team_056
--------------------------------------------------------------------------------
Player                MIN  PTS  REB  AST  TO      FG   FG%      3P   3P%
--------------------------------------------------------------------------------
Jrue Lillard           28    4    5    0   0   2/3    66.7     0/0   0.0
Tony Carter            28    3    2    0   0   1/3    33.3     0/0   0.0
Yao Poole              28    2    1    0   0   1/3    33.3     0/0   0.0
Giannis Jokic          28    2    0    0   0   1/5    20.0     0/0   0.0
Magic Russell          28    2    0    0   0   1/2    50.0     0/0   0.0

TEAM: FG: 6/16 (37.5%), 3PT: 2/10 (20.0%), REB: 8 (1 off, 7 def), AST: 0, TO: 6
TEAM FOULS: 8 [Team_048 in BONUS]

================================================================================

================================================================================
                       4TH QUARTER - Team_048 vs Team_056                       
================================================================================

[12:00] Team_048 possession (Score: 97-67)
Paolo Rozier makes the Dunk and draws the foul on Jrue Lillard! And-1! Paolo Rozier to the line for 1. [Team fouls: 1] (Jrue Lillard: 1 personal fouls)   FT 1/1: GOOD Paolo Rozier makes 1/1 from the line.
Score: 100-67

[11:45] Team_056 possession (Score: 100-67)
FOUL! Shooting foul on Dejounte Sexton. Tony Carter to the line for 3 free throws. [Team fouls: 1] (Dejounte Sexton: 1 personal fouls)   FT 1/3: GOOD   FT 2/3: GOOD   FT 3/3: GOOD Tony Carter makes 3/3 from the line.
Score: 100-70

[11:32] Team_048 possession (Score: 100-70)
Damian Mobley attempts a Layup. Contested by Yao Poole (5.2 feet, MAN). DAMIAN MOBLEY MAKES IT! Assist: Dejounte Sexton
Score: 102-70

[11:23] Team_056 possession (Score: 102-70)
Giannis Jokic attempts a Layup. Contested by Kevin Fox (4.2 feet, ZONE). GIANNIS JOKIC MAKES IT!
Score: 102-72

[11:09] Team_048 possession (Score: 102-72)
Damian Mobley attempts a Layup. Contested by Jrue Lillard (4.9 feet, ZONE). DAMIAN MOBLEY MAKES IT! Assist: Kevin Fox
Score: 104-72

[10:54] Team_056 possession (Score: 104-72)
FOUL! Holding foul on Karl Johnson. [Team fouls: 2] No free throws, side out. (Karl Johnson: 1 personal fouls)

[10:39] Team_056 possession (Score: 104-72)
Magic Russell attempts a Midrange. Contested by Karl Johnson (5.2 feet, MAN). MAGIC RUSSELL MAKES IT!
Score: 104-74

[10:24] Team_048 possession (Score: 104-74)
Karl Johnson attempts a 3Pt. Contested by Tony Carter (5.1 feet, ZONE). Karl Johnson misses. Rebound secured by Jrue Lillard.

[10:07] Team_056 possession (Score: 104-74)
Tony Carter attempts a Midrange. Contested by Dejounte Sexton (4.1 feet, ZONE). TONY CARTER MAKES IT!
Score: 104-76

[09:52] Team_048 possession (Score: 104-76)
Karl Johnson drives and kicks out. Dejounte Sexton attempts a 3Pt. Contested by Giannis Jokic (5.0 feet, ZONE). DEJOUNTE SEXTON MAKES IT! Assist: Paolo Rozier
Score: 107-76

[09:40] Team_056 possession (Score: 107-76)
Jrue Lillard drives, Kevin Fox stays with him. Jrue Lillard attempts a Dunk. Contested by Kevin Fox (4.7 feet, ZONE). Jrue Lillard misses. Rebound secured by Damian Mobley.

[09:25] Team_048 possession (Score: 107-76)
Paolo Rozier attempts a Midrange. Contested by Tony Carter (4.9 feet, ZONE). PAOLO ROZIER MAKES IT! Assist: Dejounte Sexton
Score: 109-76

[09:10] Team_056 possession (Score: 109-76)
Giannis Jokic attempts a 3Pt. Contested by Dejounte Sexton (4.0 feet, ZONE). GIANNIS JOKIC MAKES IT! Assist: Yao Poole
Score: 109-79

[08:57] Team_048 possession (Score: 109-79)
Kevin Fox makes the Layup and draws the foul on Jrue Lillard! And-1! Kevin Fox to the line for 1. [Team fouls: 2] (Jrue Lillard: 2 personal fouls)   FT 1/1: MISS Kevin Fox makes 0/1 from the line. Offensive rebound by Damian Mobley! Damian Mobley's putback is no good.
Score: 111-79

[08:44] Team_056 possession (Score: 111-79)
Magic Russell attempts a Layup. Contested by Karl Johnson (5.5 feet, MAN). Magic Russell misses. Rebound secured by Damian Mobley.

[08:28] Team_048 possession (Score: 111-79)
Kevin Fox attempts a Midrange. Contested by Jrue Lillard (5.4 feet, MAN). Kevin Fox misses. Rebound secured by Jrue Lillard.

[08:17] Team_056 possession (Score: 111-79)
Giannis Jokic attempts a 3Pt. Wide open! Paolo Rozier is 6.1 feet away. [MAN] Giannis Jokic misses. Rebound secured by Dejounte Sexton.

[08:07] Team_048 possession (Score: 111-79)
FOUL! Reach-in foul on Tony Carter during the drive. [Team fouls: 3] No free throws, side out. (Tony Carter: 1 personal fouls)

[07:57] Team_048 possession (Score: 111-79)
Karl Johnson drives, Magic Russell stays with him. Karl Johnson attempts a Layup. Wide open! Magic Russell is 6.7 feet away. [MAN] KARL JOHNSON MAKES IT! Assist: Dejounte Sexton
Score: 113-79

[07:42] Team_056 possession (Score: 113-79)
Tony Carter attempts a Midrange. Contested by Dejounte Sexton (4.5 feet, MAN). Tony Carter misses. Rebound secured by Kevin Fox.

[07:27] Team_048 possession (Score: 113-79)
Paolo Rozier drives, Giannis Jokic stays with him. Paolo Rozier attempts a Dunk. Contested by Giannis Jokic (5.4 feet, MAN). Paolo Rozier misses. Rebound secured by Yao Poole.

[07:13] Team_056 possession (Score: 113-79)
Yao Poole loses the ball! Stripped by Damian Mobley! TURNOVER! (live ball)

[07:00] Team_048 possession (Score: 113-79)
Paolo Rozier attempts a Midrange. Contested by Jrue Lillard (5.0 feet, ZONE). Paolo Rozier misses. Rebound secured by Tony Carter.

[06:47] Team_056 possession (Score: 113-79)
Yao Poole makes the Layup and draws the foul on Karl Johnson! And-1! Yao Poole to the line for 1. [Team fouls: 3] (Karl Johnson: 2 personal fouls)   FT 1/1: MISS Yao Poole makes 0/1 from the line. Rebound secured by Dejounte Sexton.
Score: 113-81

[06:33] Team_048 possession (Score: 113-81)
FOUL! Holding foul on Tony Carter. [Team fouls: 4] No free throws, side out. (Tony Carter: 2 personal fouls)

[06:15] Team_048 possession (Score: 113-81)
Karl Johnson drives and kicks out. Kevin Fox attempts a 3Pt. Contested by Giannis Jokic (5.6 feet, ZONE). KEVIN FOX MAKES IT! Assist: Paolo Rozier
Score: 116-81

[06:05] Team_056 possession (Score: 116-81)
Magic Russell drives and kicks out. Yao Poole attempts a 3Pt. Contested by Damian Mobley (4.9 feet, MAN). Yao Poole misses. Rebound secured by Kevin Fox.

[05:49] Team_048 possession (Score: 116-81)
Karl Johnson attempts a Midrange. Wide open! Magic Russell is 6.9 feet away. [MAN] KARL JOHNSON MAKES IT! Assist: Kevin Fox
Score: 118-81

[05:34] Team_056 possession (Score: 118-81)
Tony Carter drives to the basket... Tony Carter loses control! Ball rolls out of bounds! TURNOVER! (dead ball)

[05:34] Substitution (Team_048): Paolo Rozier OUT → Lauri Curry IN (stamina_rule2)

[05:34] Substitution (Team_048): Karl Johnson OUT → Yao Booker IN (stamina_rule2)

[05:34] Substitution (Team_048): Dejounte Sexton OUT → Kyle Irving IN (stamina_rule2)

[05:34] Substitution (Team_048): Kevin Fox OUT → DeMar Hyland IN (stamina_rule2)

[05:34] Substitution (Team_048): Damian Mobley OUT → Gary Giddey IN (stamina_rule2)

[05:34] Substitution (Team_056): Giannis Jokic OUT → De'Aaron Murray IN (stamina_rule2)

[05:34] Substitution (Team_056): Magic Russell OUT → Damian Barrett IN (stamina_rule2)

[05:34] Substitution (Team_056): Tony Carter OUT → CJ Anthony IN (stamina_rule2)

[05:34] Substitution (Team_056): Jrue Lillard OUT → RJ Johnson IN (stamina_rule2)

[05:34] Substitution (Team_056): Yao Poole OUT → Derrick Bane IN (stamina_rule2)

[05:20] Team_048 possession (Score: 118-81)
Kyle Irving drives, picks up CJ Anthony. Help arrives from Damian Barrett! Kyle Irving attempts a Layup. Contested by Damian Barrett (4.2 feet, MAN). KYLE IRVING MAKES IT!
Score: 120-81

[05:03] Team_056 possession (Score: 120-81)
Derrick Bane loses control! Ball rolls out of bounds! TURNOVER! (dead ball)

[04:50] Team_048 possession (Score: 120-81)
Lauri Curry attempts a 3Pt. Wide open! De'Aaron Murray is 6.0 feet away. [ZONE] Lauri Curry misses. Offensive rebound by DeMar Hyland! DeMar Hyland kicks it out.

[04:34] Team_048 possession (Score: 120-81)
DeMar Hyland attempts a 3Pt. Contested by RJ Johnson (4.6 feet, MAN). DeMar Hyland misses. Offensive rebound by Kyle Irving! Kyle Irving puts it back in!
Score: 122-81

[04:16] Team_056 possession (Score: 122-81)
Derrick Bane attempts a 3Pt. Contested by DeMar Hyland (3.8 feet, MAN). Derrick Bane misses. Rebound secured by Gary Giddey.

[03:59] Team_048 possession (Score: 122-81)
Yao Booker attempts a 3Pt. Contested by De'Aaron Murray (5.9 feet, ZONE). YAO BOOKER MAKES IT! Assist: Gary Giddey
Score: 125-81

[03:44] Team_056 possession (Score: 125-81)
FOUL! Shooting foul on DeMar Hyland. RJ Johnson to the line for 2 free throws. [Team fouls: 4] (DeMar Hyland: 1 personal fouls)   FT 1/2: GOOD   FT 2/2: GOOD RJ Johnson makes 2/2 from the line.
Score: 125-83

[03:27] Team_048 possession (Score: 125-83)
Yao Booker drives and kicks out. Yao Booker attempts a Midrange. Contested by CJ Anthony (4.2 feet, ZONE). Yao Booker misses. Rebound secured by CJ Anthony.

[03:12] Team_056 possession (Score: 125-83)
CJ Anthony attempts a 3Pt. Contested by DeMar Hyland (3.4 feet, ZONE). CJ ANTHONY MAKES IT! Assist: RJ Johnson
Score: 125-86

[02:56] Team_048 possession (Score: 125-86)
DeMar Hyland attempts a Midrange. Contested by RJ Johnson (4.6 feet, MAN). DeMar Hyland misses. FOUL! Loose ball foul on Derrick Bane during the rebound battle. [IN THE BONUS! 5 team fouls] Kyle Irving to the line for 2 free throws. (Derrick Bane: 1 personal fouls)   FT 1/2: MISS   FT 2/2: MISS Kyle Irving makes 0/2 from the line. Rebound secured by Derrick Bane.

[02:45] Team_056 possession (Score: 125-86)
CJ Anthony drives, DeMar Hyland stays with him. CJ Anthony attempts a Dunk. Contested by DeMar Hyland (3.4 feet, ZONE). CJ Anthony misses. Rebound secured by Kyle Irving.

[02:29] Team_048 possession (Score: 125-86)
Yao Booker drives, RJ Johnson stays with him. Yao Booker attempts a Layup. Contested by RJ Johnson (4.4 feet, ZONE). YAO BOOKER MAKES IT! Assist: Gary Giddey
Score: 127-86

[02:17] Team_056 possession (Score: 127-86)
RJ Johnson attempts a 3Pt. Contested by DeMar Hyland (3.5 feet, ZONE). RJ Johnson misses. Rebound secured by Kyle Irving.

[02:02] Team_048 possession (Score: 127-86)
DeMar Hyland drives to the basket... FOUL! Offensive foul on DeMar Hyland! RJ Johnson drew the charge! [Team fouls: 5] (DeMar Hyland: 2 personal fouls) TURNOVER! (dead ball)

[01:49] Team_056 possession (Score: 127-86)
FOUL! Shooting foul on DeMar Hyland. CJ Anthony to the line for 3 free throws. [BONUS: 6 team fouls] (DeMar Hyland: 3 personal fouls)   FT 1/3: GOOD   FT 2/3: GOOD   FT 3/3: GOOD CJ Anthony makes 3/3 from the line.
Score: 127-89

[01:37] Team_048 possession (Score: 127-89)
DeMar Hyland attempts a Midrange. Contested by RJ Johnson (4.6 feet, MAN). DeMar Hyland misses. Rebound secured by CJ Anthony.

[01:22] Team_056 possession (Score: 127-89)
Derrick Bane drives to the basket... Derrick Bane throws a bad pass out of bounds! TURNOVER! (dead ball)

[01:09] Team_048 possession (Score: 127-89)
Lauri Curry attempts a 3Pt. Wide open! De'Aaron Murray is 6.0 feet away. [ZONE] Lauri Curry misses. Rebound secured by Derrick Bane.

[00:55] Team_056 possession (Score: 127-89)
FOUL! Holding foul on DeMar Hyland. [IN THE BONUS! 7 team fouls] RJ Johnson to the line for 2 free throws. (DeMar Hyland: 4 personal fouls)   FT 1/2: MISS   FT 2/2: GOOD RJ Johnson makes 1/2 from the line.
Score: 127-90

[00:39] Team_048 possession (Score: 127-90)
Kyle Irving attempts a Layup. Contested by RJ Johnson (4.4 feet, ZONE). Kyle Irving misses. Rebound secured by RJ Johnson.

[00:26] Team_056 possession (Score: 127-90)
Derrick Bane attempts a Layup. Contested by DeMar Hyland (3.8 feet, MAN). DERRICK BANE MAKES IT!
Score: 127-92

[00:13] Team_048 possession (Score: 127-92)
FOUL! Reach-in foul on RJ Johnson during the drive. [IN THE BONUS! 6 team fouls] DeMar Hyland to the line for 2 free throws. (RJ Johnson: 1 personal fouls)   FT 1/2: GOOD   FT 2/2: GOOD DeMar Hyland makes 2/2 from the line.
Score: 129-92

================================================================================
                              4TH QUARTER COMPLETE                              
================================================================================

4TH QUARTER SCORE: Team_048 32, Team_056 25

BOX SCORE:
================================================================================

Team_048
--------------------------------------------------------------------------------
Player                MIN  PTS  REB  AST  TO      FG   FG%      3P   3P%
--------------------------------------------------------------------------------
Paolo Rozier           35    5    0    2   0   2/4    50.0     0/0   0.0
Yao Booker             14    5    0    0   0   2/3    66.7     0/0   0.0
Damian Mobley          35    4    3    0   0   2/2   100.0     0/0   0.0
Karl Johnson           35    4    0    0   0   2/3    66.7     0/0   0.0
Kyle Irving            14    4    3    0   0   2/3    66.7     0/0   0.0
Dejounte Sexton        35    3    2    3   0   1/1   100.0     0/0   0.0
Kevin Fox              35    3    2    2   0   1/3    33.3     0/0   0.0
DeMar Hyland           14    2    1    0   0   1/3    33.3     0/0   0.0
Gary Giddey            14    0    1    2   0   0/0     0.0     0/0   0.0
Lauri Curry            14    0    0    0   0   0/1     0.0     0/0   0.0

TEAM: FG: 13/23 (56.5%), 3PT: 2/4 (50.0%), REB: 12 (3 off, 9 def), AST: 9, TO: 1
TEAM FOULS: 7 [Team_056 in BONUS]


Team_056
--------------------------------------------------------------------------------
Player                MIN  PTS  REB  AST  TO      FG   FG%      3P   3P%
--------------------------------------------------------------------------------
CJ Anthony             14    6    2    0   0   2/3    66.7     0/0   0.0
Tony Carter            35    5    1    0   0   2/3    66.7     0/0   0.0
Giannis Jokic          35    5    0    0   0   2/3    66.7     0/0   0.0
RJ Johnson             14    3    1    1   0   2/3    66.7     0/0   0.0
Magic Russell          35    2    0    0   0   1/3    33.3     0/0   0.0
Derrick Bane           14    2    2    0   0   1/2    50.0     0/0   0.0
Jrue Lillard           35    0    2    0   0   0/1     0.0     0/0   0.0
Yao Poole              35    0    1    1   0   0/1     0.0     0/0   0.0

TEAM: FG: 10/19 (52.6%), 3PT: 4/7 (57.1%), REB: 9 (0 off, 9 def), AST: 2, TO: 4
TEAM FOULS: 6 [Team_048 in BONUS]

================================================================================

================================================================================
                               FULL GAME COMPLETE                               
================================================================================

FINAL SCORE: Team_048 129, Team_056 92

SCORING BY QUARTER:
--------------------------------------------------------------------------------
Team                     Q1     Q2     Q3     Q4    FINAL
--------------------------------------------------------------------------------
Team_048                 33     37     27     32      129
Team_056                 27     27     13     25       92
--------------------------------------------------------------------------------

FULL GAME BOX SCORE:
================================================================================

Team_048
--------------------------------------------------------------------------------
Player                MIN  PTS  REB  AST  TO      FG   FG%      3P   3P%      FT STL BLK
--------------------------------------------------------------------------------
Paolo Rozier           35   13    0    3   2   5/11   45.5   0/3     0.0   3/3     1   0
Karl Johnson           35    9    0    2   3   6/8    75.0   1/3    33.3   0/0     1   0
Dejounte Sexton        35   15    7    8   2   5/9    55.6   2/4    50.0   2/2     1   0
Kevin Fox              35   22   10    3   1   9/14   64.3   2/5    40.0   3/4     1   1
Damian Mobley          35   27   16    2   1  11/14   78.6   0/0     0.0   6/7     1   0
Lauri Curry            14    2    0    1   0   2/3    66.7   1/2    50.0   0/0     0   0
Yao Booker             14   15    0    1   1   5/7    71.4   1/1   100.0   4/4     0   0
Kyle Irving            14   13    6    0   0   5/6    83.3   2/2   100.0   2/5     0   0
DeMar Hyland           14    9    4    0   0   4/7    57.1   1/1   100.0   3/3     0   0
Gary Giddey            14    0    3    4   0   1/3    33.3   0/1     0.0   0/0     0   0

TEAM: FG: 53/82 (64.6%), 3PT: 10/22 (45.5%), REB: 46 (10 off, 36 def), AST: 24, TO: 10


Team_056
--------------------------------------------------------------------------------
Player                MIN  PTS  REB  AST  TO      FG   FG%      3P   3P%      FT STL BLK
--------------------------------------------------------------------------------
Giannis Jokic          35   18    0    1   3   8/18   44.4   2/8    25.0   6/6     0   0
Magic Russell          35    6    0    1   1   3/8    37.5   0/3     0.0   0/0     1   1
Tony Carter            35   10    7    5   3   5/10   50.0   4/7    57.1   5/6     2   1
Jrue Lillard           35   10    8    0   1   4/9    44.4   0/3     0.0   2/2     0   0
Yao Poole              35    8    6    1   3   4/8    50.0   0/1     0.0   2/3     0   0
De'Aaron Murray        14    2    0    2   0   1/2    50.0   0/0     0.0   0/0     0   0
Damian Barrett         14    5    0    0   0   3/4    75.0   1/2    50.0   1/2     0   0
CJ Anthony             14   15    5    0   1   5/7    71.4   2/3    66.7   7/7     0   0
RJ Johnson             14   11    3    2   0   4/6    66.7   1/2    50.0   5/7     0   0
Derrick Bane           14    4    2    2   1   2/4    50.0   0/1     0.0   0/0     0   1

TEAM: FG: 40/77 (51.9%), 3PT: 10/30 (33.3%), REB: 31 (3 off, 28 def), AST: 14, TO: 13

================================================================================
