================================================================================
                        FULL GAME - Team_010 vs Team_055                        
================================================================================

================================================================================
                       1ST QUARTER - Team_010 vs Team_055                       
================================================================================

[12:00] Team_010 possession (Score: 0-0)
RJ Young attempts a 3Pt. Contested by Kevin Bane (3.9 feet, ZONE). RJ YOUNG MAKES IT! Assist: Cade Morant
Score: 3-0

[11:44] Team_055 possession (Score: 3-0)
Devin Siakam attempts a 3Pt. Contested by Cade Morant (4.0 feet, MAN). Devin Siakam misses. FOUL! Loose ball foul on Anthony Durant during the rebound battle. [Team fouls: 1] No free throws, side out. (Anthony Durant: 1 personal fouls)

[11:27] Team_055 possession (Score: 3-0)
Jrue Sabonis drives and kicks out. Chris Turner attempts a Midrange. Contested by Anthony Durant (3.5 feet, MAN). Chris Turner misses. Rebound secured by Anthony Durant.

[11:13] Team_010 possession (Score: 3-0)
FOUL! Offensive foul on Desmond Antetokounmpo! Chris Turner drew the charge! [Team fouls: 2] (Desmond Antetokounmpo: 1 personal fouls) TURNOVER! (dead ball)

[10:55] Team_055 possession (Score: 3-0)
Shaquille Herro attempts a 3Pt. Contested by Michael Turner (4.2 feet, MAN). Shaquille Herro misses. Rebound secured by Cade Morant.

[10:42] Team_010 possession (Score: 3-0)
Desmond Antetokounmpo drives and kicks out. Desmond Antetokounmpo attempts a 3Pt. Contested by Chris Turner (2.9 feet, MAN). Desmond Antetokounmpo misses. Rebound secured by Kevin Bane.

[10:22] Team_055 possession (Score: 3-0)
Jrue Sabonis attempts a Layup. Contested by Desmond Antetokounmpo (4.4 feet, MAN). JRUE SABONIS MAKES IT! Assist: Shaquille Herro
Score: 3-2

[10:07] Team_010 possession (Score: 3-2)
RJ Young drives, Kevin Bane stays with him. RJ Young attempts a Dunk. Contested by Kevin Bane (3.9 feet, MAN). RJ Young misses. Rebound secured by Kevin Bane.

[09:56] Team_055 possession (Score: 3-2)
Shaquille Herro attempts a 3Pt. Contested by Michael Turner (4.2 feet, MAN). Shaquille Herro misses. Offensive rebound by Jrue Sabonis! Jrue Sabonis kicks it out.

[09:45] Team_055 possession (Score: 3-2)
Kevin Bane attempts a 3Pt. Contested by Cade Morant (4.2 feet, ZONE). KEVIN BANE MAKES IT! Assist: Devin Siakam
Score: 3-5

[09:29] Team_010 possession (Score: 3-5)
RJ Young attempts a 3Pt. Contested by Kevin Bane (3.9 feet, ZONE). RJ Young misses. Offensive rebound by Anthony Durant! Anthony Durant kicks it out.

[09:18] Team_010 possession (Score: 3-5)
Desmond Antetokounmpo attempts a 3Pt. Contested by Chris Turner (3.1 feet, MAN). Desmond Antetokounmpo misses. Offensive rebound by Cade Morant! Cade Morant kicks it out.

[09:02] Team_010 possession (Score: 3-5)
RJ Young attempts a Midrange. Contested by Jrue Sabonis (4.0 feet, ZONE). RJ Young misses. Offensive rebound by Cade Morant! Cade Morant kicks it out.

[08:45] Team_010 possession (Score: 3-5)
RJ Young drives, picks up Chris Turner. Help arrives from Shaquille Herro! RJ Young attempts a Layup. Contested by Shaquille Herro (2.7 feet, ZONE). RJ YOUNG MAKES IT! Assist: Anthony Durant
Score: 5-5

[08:30] Team_055 possession (Score: 5-5)
Chris Turner attempts a Midrange. Contested by Anthony Durant (3.7 feet, MAN). Chris Turner misses. Rebound secured by Desmond Antetokounmpo.

[08:18] Team_010 possession (Score: 5-5)
Cade Morant attempts a 3Pt. Contested by Devin Siakam (5.7 feet, MAN). Cade Morant misses. Rebound secured by Kevin Bane.

[08:05] Team_055 possession (Score: 5-5)
Devin Siakam attempts a 3Pt. Contested by Cade Morant (4.0 feet, ZONE). Devin Siakam misses. Rebound secured by Desmond Antetokounmpo.

[07:48] Team_010 possession (Score: 5-5)
Desmond Antetokounmpo attempts a Layup. Contested by Chris Turner (3.1 feet, ZONE). DESMOND ANTETOKOUNMPO MAKES IT!
Score: 7-5

[07:33] Team_055 possession (Score: 7-5)
Devin Siakam attempts a 3Pt. Contested by Cade Morant (4.0 feet, MAN). DEVIN SIAKAM MAKES IT! Assist: Kevin Bane
Score: 7-8

[07:20] Team_010 possession (Score: 7-8)
Michael Turner drives and kicks out. Cade Morant attempts a 3Pt. Contested by Devin Siakam (5.2 feet, MAN). CADE MORANT MAKES IT!
Score: 10-8

[07:03] Team_055 possession (Score: 10-8)
FOUL! Holding foul on RJ Young. [Team fouls: 3] No free throws, side out. (RJ Young: 1 personal fouls)

[06:48] Team_055 possession (Score: 10-8)
Chris Turner attempts a 3Pt. Contested by Cade Morant (4.1 feet, ZONE). Chris Turner misses. FOUL! Loose ball foul on Cade Morant during the rebound battle. [Team fouls: 4] No free throws, side out. (Cade Morant: 1 personal fouls)

[06:31] Team_055 possession (Score: 10-8)
Chris Turner attempts a Dunk. BLOCKED BY ANTHONY DURANT! Ball is loose! Rebound secured by Anthony Durant.

[06:15] Team_010 possession (Score: 10-8)
RJ Young attempts a 3Pt. Contested by Kevin Bane (3.9 feet, MAN). RJ Young misses. Rebound secured by Jrue Sabonis.

[05:58] Team_055 possession (Score: 10-8)
Chris Turner drives, picks up Anthony Durant. Help arrives from Cade Morant! Chris Turner attempts a Dunk. Contested by Cade Morant (3.7 feet, ZONE). CHRIS TURNER MAKES IT! Assist: Devin Siakam
Score: 10-10

[05:45] Team_010 possession (Score: 10-10)
Cade Morant attempts a Midrange. Contested by Kevin Bane (4.6 feet, ZONE). CADE MORANT MAKES IT! Assist: Michael Turner
Score: 12-10

[05:34] Team_055 possession (Score: 12-10)
Chris Turner makes the Layup and draws the foul on Anthony Durant! And-1! Chris Turner to the line for 1. [BONUS: 5 team fouls] (Anthony Durant: 2 personal fouls)   FT 1/1: GOOD Chris Turner makes 1/1 from the line.
Score: 12-13

[05:21] Team_010 possession (Score: 12-13)
RJ Young attempts a Midrange. Contested by Kevin Bane (3.9 feet, MAN). RJ YOUNG MAKES IT!
Score: 14-13

[05:04] Team_055 possession (Score: 14-13)
Kevin Bane attempts a Layup. Contested by RJ Young (5.1 feet, MAN). KEVIN BANE MAKES IT! Assist: Jrue Sabonis
Score: 14-15

[04:45] Team_010 possession (Score: 14-15)
Cade Morant drives, picks up Devin Siakam. Help arrives from Shaquille Herro! Cade Morant attempts a Layup. Contested by Shaquille Herro (5.8 feet, MAN). CADE MORANT MAKES IT! Assist: Desmond Antetokounmpo
Score: 16-15

[04:29] Team_055 possession (Score: 16-15)
FOUL! Shooting foul on Cade Morant. Jrue Sabonis to the line for 3 free throws. [BONUS: 6 team fouls] (Cade Morant: 2 personal fouls)   FT 1/3: MISS   FT 2/3: GOOD   FT 3/3: GOOD Jrue Sabonis makes 2/3 from the line.
Score: 16-17

[04:10] Team_010 possession (Score: 16-17)
FOUL! Holding foul on Kevin Bane. [Team fouls: 1] No free throws, side out. (Kevin Bane: 1 personal fouls)

[03:59] Team_010 possession (Score: 16-17)
RJ Young attempts a 3Pt. Contested by Kevin Bane (3.9 feet, ZONE). RJ Young misses. Rebound secured by Kevin Bane.

[03:42] Team_055 possession (Score: 16-17)
Jrue Sabonis drives, picks up Desmond Antetokounmpo. Help arrives from Cade Morant! Jrue Sabonis attempts a Layup. Contested by Cade Morant (4.5 feet, MAN). JRUE SABONIS MAKES IT!
Score: 16-19

[03:28] Team_010 possession (Score: 16-19)
Michael Turner attempts a 3Pt. Contested by Shaquille Herro (4.0 feet, ZONE). Michael Turner misses. Rebound secured by Jrue Sabonis.

[03:08] Team_055 possession (Score: 16-19)
Chris Turner attempts a Midrange. Contested by Anthony Durant (3.9 feet, MAN). CHRIS TURNER MAKES IT! Assist: Jrue Sabonis
Score: 16-21

[02:55] Team_010 possession (Score: 16-21)
Michael Turner drives and kicks out. Michael Turner attempts a Midrange. Contested by Devin Siakam (5.4 feet, ZONE). Michael Turner misses. FOUL! Loose ball foul on Chris Turner during the rebound battle. [Team fouls: 2] No free throws, side out. (Chris Turner: 1 personal fouls)

[02:41] Team_010 possession (Score: 16-21)
Cade Morant drives and kicks out. Anthony Durant attempts a 3Pt. Contested by Chris Turner (3.2 feet, MAN). Anthony Durant misses. Rebound secured by Jrue Sabonis.

[02:25] Team_055 possession (Score: 16-21)
Kevin Bane attempts a Midrange. Contested by RJ Young (5.3 feet, MAN). KEVIN BANE MAKES IT! Assist: Devin Siakam
Score: 16-23

[02:11] Team_010 possession (Score: 16-23)
Desmond Antetokounmpo attempts a 3Pt. Contested by Chris Turner (3.4 feet, MAN). Desmond Antetokounmpo misses. Rebound secured by Kevin Bane.

[01:53] Team_055 possession (Score: 16-23)
Jrue Sabonis attempts a Midrange. Contested by Desmond Antetokounmpo (4.6 feet, MAN). Jrue Sabonis misses. Rebound secured by Michael Turner.

[01:37] Team_010 possession (Score: 16-23)
RJ Young attempts a 3Pt. Contested by Kevin Bane (4.0 feet, MAN). RJ Young misses. Offensive rebound by Anthony Durant! Anthony Durant kicks it out.

[01:20] Team_010 possession (Score: 16-23)
Michael Turner makes the Dunk and draws the foul on Shaquille Herro! And-1! Michael Turner to the line for 1. [Team fouls: 3] (Shaquille Herro: 1 personal fouls)   FT 1/1: MISS Michael Turner makes 0/1 from the line. Rebound secured by Jrue Sabonis.
Score: 18-23

[01:00] Team_055 possession (Score: 18-23)
Chris Turner drives and kicks out. FOUL! Shooting foul on Anthony Durant. Chris Turner to the line for 2 free throws. [BONUS: 7 team fouls] (Anthony Durant: 3 personal fouls)   FT 1/2: GOOD   FT 2/2: GOOD Chris Turner makes 2/2 from the line.
Score: 18-25

[00:48] Team_010 possession (Score: 18-25)
Anthony Durant drives and kicks out. RJ Young attempts a 3Pt. Contested by Kevin Bane (4.3 feet, ZONE). RJ Young misses. Rebound secured by Kevin Bane.

[00:30] Team_055 possession (Score: 18-25)
Kevin Bane attempts a 3Pt. Contested by Desmond Antetokounmpo (5.0 feet, ZONE). Kevin Bane misses. Offensive rebound by Chris Turner! Chris Turner puts it back in!
Score: 18-27

[00:16] Team_010 possession (Score: 18-27)
Cade Morant makes the Layup and draws the foul on Shaquille Herro! And-1! Cade Morant to the line for 1. [Team fouls: 4] (Shaquille Herro: 2 personal fouls)   FT 1/1: GOOD Cade Morant makes 1/1 from the line.
Score: 21-27

[00:06] Team_055 possession (Score: 21-27)
Chris Turner attempts a Layup. Contested by Anthony Durant (4.3 feet, MAN). CHRIS TURNER MAKES IT!
Score: 21-29

================================================================================
                              1ST QUARTER COMPLETE                              
================================================================================

1ST QUARTER SCORE: Team_010 21, Team_055 29

BOX SCORE:
================================================================================

Team_010
--------------------------------------------------------------------------------
Player                MIN  PTS  REB  AST  TO      FG   FG%      3P   3P%
--------------------------------------------------------------------------------
Cade Morant            12   10    3    1   0   4/6    66.7     0/0   0.0
RJ Young               12    7    0    0   0   3/6    50.0     0/0   0.0
Desmond Antetokounmpo   12    2    2    1   0   1/3    33.3     0/0   0.0
Anthony Durant         12    0    5    1   0   0/1     0.0     0/0   0.0
Michael Turner         12    0    1    1   0   0/2     0.0     0/0   0.0

TEAM: FG: 8/18 (44.4%), 3PT: 1/6 (16.7%), REB: 11 (5 off, 6 def), AST: 4, TO: 1
TEAM FOULS: 7 [Team_055 in BONUS]


Team_055
--------------------------------------------------------------------------------
Player                MIN  PTS  REB  AST  TO      FG   FG%      3P   3P%
--------------------------------------------------------------------------------
Chris Turner           12   13    2    0   0   6/8    75.0     0/0   0.0
Kevin Bane             12    7    6    1   0   3/3   100.0     0/0   0.0
Jrue Sabonis           12    6    6    2   0   3/5    60.0     0/0   0.0
Devin Siakam           12    3    0    3   0   1/2    50.0     0/0   0.0
Shaquille Herro        12    0    0    1   0   0/1     0.0     0/0   0.0

TEAM: FG: 13/19 (68.4%), 3PT: 4/6 (66.7%), REB: 14 (4 off, 10 def), AST: 7, TO: 0
TEAM FOULS: 4

================================================================================

================================================================================
                       2ND QUARTER - Team_010 vs Team_055                       
================================================================================

[12:00] Team_010 possession (Score: 21-29)
RJ Young attempts a 3Pt. Contested by Kevin Bane (4.0 feet, ZONE). RJ Young misses. Rebound secured by Kevin Bane.

[11:47] Team_055 possession (Score: 21-29)
Shaquille Herro attempts a 3Pt. Contested by Cade Morant (4.4 feet, ZONE). Shaquille Herro misses. Rebound secured by Cade Morant.

[11:31] Team_010 possession (Score: 21-29)
RJ Young attempts a Midrange. Contested by Jrue Sabonis (4.4 feet, ZONE). RJ YOUNG MAKES IT! Assist: Michael Turner
Score: 23-29

[11:22] Team_055 possession (Score: 23-29)
Devin Siakam attempts a Layup. Contested by Cade Morant (4.3 feet, MAN). DEVIN SIAKAM MAKES IT!
Score: 23-31

[11:07] Team_010 possession (Score: 23-31)
RJ Young attempts a Midrange. Contested by Kevin Bane (4.1 feet, MAN). RJ YOUNG MAKES IT!
Score: 25-31

[10:53] Team_055 possession (Score: 25-31)
Jrue Sabonis attempts a Midrange. Contested by Desmond Antetokounmpo (4.7 feet, MAN). Jrue Sabonis misses. Rebound secured by Michael Turner.

[10:43] Team_010 possession (Score: 25-31)
Cade Morant drives and kicks out. Cade Morant attempts a 3Pt. Contested by Kevin Bane (4.3 feet, ZONE). Cade Morant misses. Rebound secured by Jrue Sabonis.

[10:31] Team_055 possession (Score: 25-31)
Kevin Bane attempts a 3Pt. Contested by RJ Young (5.5 feet, MAN). Kevin Bane misses. Rebound secured by Anthony Durant.

[10:18] Team_010 possession (Score: 25-31)
Desmond Antetokounmpo attempts a Midrange. Contested by Chris Turner (3.6 feet, MAN). Desmond Antetokounmpo misses. Rebound secured by Chris Turner.

[10:03] Team_055 possession (Score: 25-31)
Kevin Bane drives, Anthony Durant stays with him. Kevin Bane attempts a Dunk. Contested by Anthony Durant (4.4 feet, ZONE). KEVIN BANE MAKES IT! Assist: Shaquille Herro
Score: 25-33

[09:50] Team_010 possession (Score: 25-33)
RJ Young drives, picks up Chris Turner. Help arrives from Shaquille Herro! RJ Young attempts a Dunk. Contested by Shaquille Herro (3.4 feet, ZONE). RJ YOUNG MAKES IT!
Score: 27-33

[09:34] Team_055 possession (Score: 27-33)
Kevin Bane attempts a 3Pt. Contested by RJ Young (5.6 feet, MAN). Kevin Bane misses. Rebound secured by Michael Turner.

[09:22] Team_010 possession (Score: 27-33)
RJ Young attempts a 3Pt. Contested by Kevin Bane (4.3 feet, MAN). RJ Young misses. Rebound secured by Chris Turner.

[09:10] Team_055 possession (Score: 27-33)
FOUL! Reach-in foul on Anthony Durant during the drive. [Team fouls: 1] No free throws, side out. (Anthony Durant: 1 personal fouls)

[08:55] Team_055 possession (Score: 27-33)
FOUL! Reach-in foul on Anthony Durant during the drive. [Team fouls: 2] No free throws, side out. (Anthony Durant: 2 personal fouls)

[08:42] Team_055 possession (Score: 27-33)
FOUL! Reach-in foul on Cade Morant during the drive. [Team fouls: 3] No free throws, side out. (Cade Morant: 1 personal fouls)

[08:26] Team_055 possession (Score: 27-33)
Kevin Bane attempts a 3Pt. Contested by RJ Young (5.7 feet, MAN). KEVIN BANE MAKES IT!
Score: 27-36

[08:12] Team_010 possession (Score: 27-36)
Cade Morant attempts a 3Pt. Contested by Kevin Bane (5.0 feet, ZONE). Cade Morant misses. Rebound secured by Jrue Sabonis.

[08:00] Team_055 possession (Score: 27-36)
Devin Siakam drives and kicks out. Chris Turner attempts a Midrange. Contested by Michael Turner (4.8 feet, ZONE). Chris Turner misses. Rebound secured by Anthony Durant.

[07:45] Team_010 possession (Score: 27-36)
Anthony Durant attempts a Layup. Contested by Chris Turner (4.2 feet, ZONE). Anthony Durant misses. Rebound secured by Jrue Sabonis.

[07:31] Team_055 possession (Score: 27-36)
Shaquille Herro attempts a Layup. BLOCKED BY ANTHONY DURANT! Ball is loose! Rebound secured by Michael Turner.

[07:19] Team_010 possession (Score: 27-36)
Michael Turner attempts a 3Pt. Contested by Kevin Bane (4.9 feet, ZONE). Michael Turner misses. Rebound secured by Chris Turner.

[07:05] Team_055 possession (Score: 27-36)
Devin Siakam attempts a 3Pt. Contested by Cade Morant (4.9 feet, ZONE). Devin Siakam misses. Rebound secured by Cade Morant.

[06:54] Team_010 possession (Score: 27-36)
FOUL! Shooting foul on Kevin Bane. Michael Turner to the line for 3 free throws. [Team fouls: 1] (Kevin Bane: 1 personal fouls)   FT 1/3: GOOD   FT 2/3: GOOD   FT 3/3: GOOD Michael Turner makes 3/3 from the line.
Score: 30-36

[06:35] Team_055 possession (Score: 30-36)
Devin Siakam attempts a 3Pt. Contested by Cade Morant (5.0 feet, MAN). DEVIN SIAKAM MAKES IT! Assist: Chris Turner
Score: 30-39

[06:16] Team_010 possession (Score: 30-39)
Desmond Antetokounmpo attempts a Midrange. Contested by Chris Turner (4.3 feet, MAN). DESMOND ANTETOKOUNMPO MAKES IT!
Score: 32-39

[06:01] Team_055 possession (Score: 32-39)
Chris Turner attempts a Layup. Contested by Anthony Durant (4.9 feet, MAN). Chris Turner misses. Rebound secured by Anthony Durant.

[05:49] Team_010 possession (Score: 32-39)
Desmond Antetokounmpo attempts a Midrange. Wide open! Devin Siakam is 6.5 feet away. [ZONE] DESMOND ANTETOKOUNMPO MAKES IT!
Score: 34-39

[05:33] Team_055 possession (Score: 34-39)
Chris Turner attempts a Midrange. Contested by Anthony Durant (5.0 feet, MAN). Chris Turner misses. Rebound secured by Michael Turner.

[05:16] Team_010 possession (Score: 34-39)
FOUL! Holding foul on Chris Turner. [Team fouls: 2] No free throws, side out. (Chris Turner: 1 personal fouls)

[05:04] Team_010 possession (Score: 34-39)
FOUL! Shooting foul on Shaquille Herro. Cade Morant to the line for 2 free throws. [Team fouls: 3] (Shaquille Herro: 1 personal fouls)   FT 1/2: GOOD   FT 2/2: GOOD Cade Morant makes 2/2 from the line.
Score: 36-39

[04:48] Team_055 possession (Score: 36-39)
Shaquille Herro attempts a 3Pt. Contested by Michael Turner (5.3 feet, MAN). Shaquille Herro misses. Rebound secured by Anthony Durant.

[04:39] Team_010 possession (Score: 36-39)
Michael Turner attempts a Midrange. Contested by Shaquille Herro (5.2 feet, MAN). MICHAEL TURNER MAKES IT!
Score: 38-39

[04:26] Team_055 possession (Score: 38-39)
Chris Turner drives and kicks out. Devin Siakam attempts a Midrange. Contested by Cade Morant (5.5 feet, MAN). DEVIN SIAKAM MAKES IT! Assist: Chris Turner
Score: 38-41

[04:14] Team_010 possession (Score: 38-41)
Cade Morant attempts a Layup. Wide open! Devin Siakam is 6.9 feet away. [MAN] CADE MORANT MAKES IT!
Score: 40-41

[03:59] Team_055 possession (Score: 40-41)
Kevin Bane attempts a 3Pt. Wide open! RJ Young is 6.3 feet away. [MAN] KEVIN BANE MAKES IT! Assist: Devin Siakam
Score: 40-44

[03:47] Team_010 possession (Score: 40-44)
Michael Turner drives, Shaquille Herro stays with him. Michael Turner attempts a Layup. Contested by Shaquille Herro (5.4 feet, MAN). MICHAEL TURNER MAKES IT!
Score: 42-44

[03:28] Team_055 possession (Score: 42-44)
Devin Siakam attempts a 3Pt. Contested by Cade Morant (5.4 feet, ZONE). Devin Siakam misses. Rebound secured by Anthony Durant.

[03:15] Team_010 possession (Score: 42-44)
Cade Morant drives to the basket... Cade Morant throws a bad pass! Stolen by Chris Turner! TURNOVER! (live ball)

[03:01] Team_055 possession (Score: 42-44)
Shaquille Herro drives and kicks out. Shaquille Herro attempts a 3Pt. Contested by Michael Turner (5.7 feet, MAN). SHAQUILLE HERRO MAKES IT! Assist: Devin Siakam
Score: 42-47

[02:45] Team_010 possession (Score: 42-47)
Desmond Antetokounmpo drives to the basket... Desmond Antetokounmpo commits a violation (traveling/carry)! TURNOVER! (dead ball)

[02:45] Substitution (Team_010): Cade Morant OUT → Draymond Leonard IN (stamina_rule2)

[02:45] Substitution (Team_010): Michael Turner OUT → Blake Harden IN (stamina_rule2)

[02:45] Substitution (Team_010): RJ Young OUT → Ben Gilgeous-Alexander IN (stamina_rule2)

[02:45] Substitution (Team_010): Desmond Antetokounmpo OUT → Vince Ingram IN (stamina_rule2)

[02:45] Substitution (Team_010): Anthony Durant OUT → Paolo Wade IN (stamina_rule2)

[02:45] Substitution (Team_055): Devin Siakam OUT → Luka Wall IN (stamina_rule2)

[02:45] Substitution (Team_055): Shaquille Herro OUT → Dirk Duncan IN (stamina_rule2)

[02:45] Substitution (Team_055): Kevin Bane OUT → Kyle Wall IN (stamina_rule2)

[02:45] Substitution (Team_055): Jrue Sabonis OUT → Malcolm Williamson IN (stamina_rule2)

[02:45] Substitution (Team_055): Chris Turner OUT → D'Angelo Antetokounmpo IN (stamina_rule2)

[02:30] Team_055 possession (Score: 42-47)
Dirk Duncan attempts a Layup. Contested by Vince Ingram (5.0 feet, ZONE). Dirk Duncan misses. Offensive rebound by D'Angelo Antetokounmpo! D'Angelo Antetokounmpo puts it back in!
Score: 42-49

[02:15] Team_010 possession (Score: 42-49)
Vince Ingram attempts a Layup. BLOCKED BY MALCOLM WILLIAMSON! Ball deflects out of bounds off Vince Ingram.

[01:59] Team_055 possession (Score: 42-49)
Luka Wall attempts a 3Pt. Contested by Draymond Leonard (4.4 feet, MAN). LUKA WALL MAKES IT! Assist: Dirk Duncan
Score: 42-52

[01:44] Team_010 possession (Score: 42-52)
Draymond Leonard drives, Malcolm Williamson stays with him. Draymond Leonard attempts a Layup. Contested by Malcolm Williamson (4.4 feet, ZONE). DRAYMOND LEONARD MAKES IT!
Score: 44-52

[01:28] Team_055 possession (Score: 44-52)
Dirk Duncan attempts a 3Pt. Contested by Draymond Leonard (4.0 feet, ZONE). Dirk Duncan misses. Rebound secured by Blake Harden.

[01:11] Team_010 possession (Score: 44-52)
Paolo Wade drives to the basket... Paolo Wade throws a bad pass out of bounds! TURNOVER! (dead ball)

[00:56] Team_055 possession (Score: 44-52)
FOUL! Reach-in foul on Paolo Wade during the drive. [Team fouls: 4] No free throws, side out. (Paolo Wade: 1 personal fouls)

[00:38] Team_055 possession (Score: 44-52)
Luka Wall makes the Layup and draws the foul on Paolo Wade! And-1! Luka Wall to the line for 1. [BONUS: 5 team fouls] (Paolo Wade: 2 personal fouls)   FT 1/1: GOOD Luka Wall makes 1/1 from the line.
Score: 44-55

[00:27] Team_010 possession (Score: 44-55)
Ben Gilgeous-Alexander loses the ball! Stripped by Kyle Wall! TURNOVER! (live ball)

[00:15] Team_055 possession (Score: 44-55)
D'Angelo Antetokounmpo throws a bad pass out of bounds! TURNOVER! (dead ball)

================================================================================
                              2ND QUARTER COMPLETE                              
================================================================================

2ND QUARTER SCORE: Team_010 23, Team_055 26

BOX SCORE:
================================================================================

Team_010
--------------------------------------------------------------------------------
Player                MIN  PTS  REB  AST  TO      FG   FG%      3P   3P%
--------------------------------------------------------------------------------
Michael Turner         22    7    4    1   0   3/4    75.0     0/0   0.0
RJ Young               22    6    0    0   0   3/5    60.0     0/0   0.0
Cade Morant            22    4    2    0   0   2/4    50.0     0/0   0.0
Desmond Antetokounmpo   22    4    0    0   0   2/3    66.7     0/0   0.0
Draymond Leonard        2    2    0    0   0   1/1   100.0     0/0   0.0
Anthony Durant         22    0    5    0   0   0/1     0.0     0/0   0.0
Vince Ingram            2    0    0    0   0   0/1     0.0     0/0   0.0
Blake Harden            2    0    1    0   0   0/0     0.0     0/0   0.0

TEAM: FG: 11/19 (57.9%), 3PT: 1/5 (20.0%), REB: 12 (0 off, 12 def), AST: 1, TO: 4
TEAM FOULS: 5 [Team_055 in BONUS]


Team_055
--------------------------------------------------------------------------------
Player                MIN  PTS  REB  AST  TO      FG   FG%      3P   3P%
--------------------------------------------------------------------------------
Kevin Bane             22    8    1    0   0   3/5    60.0     0/0   0.0
Devin Siakam           22    7    0    2   0   3/6    50.0     0/0   0.0
Luka Wall               2    6    0    0   0   2/2   100.0     0/0   0.0
Shaquille Herro        22    3    0    1   0   1/4    25.0     0/0   0.0
D'Angelo Antetokounmpo    2    2    1    0   0   1/1   100.0     0/0   0.0
Jrue Sabonis           22    0    3    0   0   0/1     0.0     0/0   0.0
Chris Turner           22    0    3    2   0   0/2     0.0     0/0   0.0
Dirk Duncan             2    0    0    1   0   0/1     0.0     0/0   0.0

TEAM: FG: 10/22 (45.5%), 3PT: 4/11 (36.4%), REB: 8 (1 off, 7 def), AST: 6, TO: 1
TEAM FOULS: 3

================================================================================

================================================================================
                       3RD QUARTER - Team_010 vs Team_055                       
================================================================================

[12:00] Team_010 possession (Score: 44-55)
Michael Turner attempts a 3Pt. Contested by Kevin Bane (4.3 feet, ZONE). MICHAEL TURNER MAKES IT! Assist: Cade Morant
Score: 47-55

[11:47] Team_055 possession (Score: 47-55)
Chris Turner drives, Anthony Durant stays with him. Chris Turner attempts a Layup. Contested by Anthony Durant (3.7 feet, MAN). CHRIS TURNER MAKES IT!
Score: 47-57

[11:31] Team_010 possession (Score: 47-57)
Desmond Antetokounmpo drives and kicks out. RJ Young attempts a Midrange. Contested by Kevin Bane (4.0 feet, MAN). RJ Young misses. Rebound secured by Kevin Bane.

[11:18] Team_055 possession (Score: 47-57)
Kevin Bane makes the Layup and draws the foul on Anthony Durant! And-1! Kevin Bane to the line for 1. [Team fouls: 1] (Anthony Durant: 1 personal fouls)   FT 1/1: MISS Kevin Bane makes 0/1 from the line. Rebound secured by Cade Morant.
Score: 47-59

[11:03] Team_010 possession (Score: 47-59)
Michael Turner attempts a Midrange. Contested by Shaquille Herro (3.9 feet, MAN). Michael Turner misses. Rebound secured by Chris Turner.

[10:51] Team_055 possession (Score: 47-59)
Devin Siakam attempts a Midrange. Contested by Cade Morant (4.0 feet, MAN). Devin Siakam misses. Rebound secured by Cade Morant.

[10:36] Team_010 possession (Score: 47-59)
Michael Turner makes the Layup and draws the foul on Shaquille Herro! And-1! Michael Turner to the line for 1. [Team fouls: 1] (Shaquille Herro: 1 personal fouls)   FT 1/1: MISS Michael Turner makes 0/1 from the line. Rebound secured by Jrue Sabonis.
Score: 49-59

[10:18] Team_055 possession (Score: 49-59)
Jrue Sabonis attempts a 3Pt. Contested by Desmond Antetokounmpo (4.4 feet, MAN). Jrue Sabonis misses. Rebound secured by Anthony Durant.

[10:07] Team_010 possession (Score: 49-59)
Michael Turner drives, Shaquille Herro stays with him. Michael Turner attempts a Layup. Contested by Shaquille Herro (3.9 feet, MAN). MICHAEL TURNER MAKES IT!
Score: 51-59

[09:50] Team_055 possession (Score: 51-59)
Kevin Bane attempts a Midrange. Contested by Desmond Antetokounmpo (4.6 feet, ZONE). KEVIN BANE MAKES IT!
Score: 51-61

[09:31] Team_010 possession (Score: 51-61)
FOUL! Shooting foul on Chris Turner. Michael Turner to the line for 2 free throws. [Team fouls: 2] (Chris Turner: 1 personal fouls)   FT 1/2: GOOD   FT 2/2: GOOD Michael Turner makes 2/2 from the line.
Score: 53-61

[09:16] Team_055 possession (Score: 53-61)
Chris Turner makes the Layup and draws the foul on Anthony Durant! And-1! Chris Turner to the line for 1. [Team fouls: 2] (Anthony Durant: 2 personal fouls)   FT 1/1: GOOD Chris Turner makes 1/1 from the line.
Score: 53-64

[08:58] Team_010 possession (Score: 53-64)
Michael Turner drives and kicks out. Michael Turner attempts a 3Pt. Contested by Shaquille Herro (3.6 feet, MAN). MICHAEL TURNER MAKES IT! Assist: Cade Morant
Score: 56-64

[08:47] Team_055 possession (Score: 56-64)
Devin Siakam attempts a 3Pt. Contested by Cade Morant (4.0 feet, ZONE). Devin Siakam misses. Rebound secured by Cade Morant.

[08:32] Team_010 possession (Score: 56-64)
Desmond Antetokounmpo attempts a 3Pt. Contested by Chris Turner (3.1 feet, MAN). Desmond Antetokounmpo misses. Offensive rebound by Anthony Durant! Anthony Durant kicks it out.

[08:17] Team_010 possession (Score: 56-64)
Desmond Antetokounmpo attempts a 3Pt. Contested by Chris Turner (3.1 feet, MAN). Desmond Antetokounmpo misses. Rebound secured by Kevin Bane.

[08:07] Team_055 possession (Score: 56-64)
Shaquille Herro attempts a Layup. BLOCKED BY CADE MORANT! Ball is loose! Offensive rebound by Chris Turner! Chris Turner kicks it out.

[07:55] Team_055 possession (Score: 56-64)
Devin Siakam attempts a Midrange. Contested by Michael Turner (4.1 feet, ZONE). Devin Siakam misses. Rebound secured by Anthony Durant.

[07:38] Team_010 possession (Score: 56-64)
Cade Morant makes the Layup and draws the foul on Devin Siakam! And-1! Cade Morant to the line for 1. [Team fouls: 3] (Devin Siakam: 1 personal fouls)   FT 1/1: GOOD Cade Morant makes 1/1 from the line.
Score: 59-64

[07:24] Team_055 possession (Score: 59-64)
FOUL! Holding foul on Cade Morant. [Team fouls: 4] No free throws, side out. (Cade Morant: 2 personal fouls)

[07:09] Team_055 possession (Score: 59-64)
Chris Turner attempts a Midrange. Contested by Michael Turner (4.2 feet, ZONE). Chris Turner misses. Offensive rebound by Chris Turner! Chris Turner's putback is no good. Rebound secured by Anthony Durant.

[06:51] Team_010 possession (Score: 59-64)
Michael Turner attempts a Midrange. Contested by Jrue Sabonis (4.5 feet, ZONE). Michael Turner misses. FOUL! Loose ball foul on Jrue Sabonis during the rebound battle. [Team fouls: 4] No free throws, side out. (Jrue Sabonis: 1 personal fouls)

[06:35] Team_010 possession (Score: 59-64)
Cade Morant attempts a 3Pt. Contested by Devin Siakam (5.7 feet, MAN). CADE MORANT MAKES IT! Assist: Desmond Antetokounmpo
Score: 62-64

[06:22] Team_055 possession (Score: 62-64)
FOUL! Shooting foul on Anthony Durant. Jrue Sabonis to the line for 2 free throws. [BONUS: 5 team fouls] (Anthony Durant: 3 personal fouls)   FT 1/2: GOOD   FT 2/2: GOOD Jrue Sabonis makes 2/2 from the line.
Score: 62-66

[06:09] Team_010 possession (Score: 62-66)
Anthony Durant makes the Layup and draws the foul on Chris Turner! And-1! Anthony Durant to the line for 1. [BONUS: 5 team fouls] (Chris Turner: 2 personal fouls)   FT 1/1: GOOD Anthony Durant makes 1/1 from the line.
Score: 65-66

[05:54] Team_055 possession (Score: 65-66)
FOUL! Offensive foul on Jrue Sabonis! Desmond Antetokounmpo drew the charge! [Team fouls: 6] (Jrue Sabonis: 2 personal fouls) TURNOVER! (dead ball)

[05:38] Team_010 possession (Score: 65-66)
RJ Young drives and kicks out. Desmond Antetokounmpo attempts a Midrange. Contested by Chris Turner (2.9 feet, MAN). Desmond Antetokounmpo misses. Rebound secured by Chris Turner.

[05:25] Team_055 possession (Score: 65-66)
Kevin Bane drives to the basket... Kevin Bane throws a bad pass! Stolen by RJ Young! TURNOVER! (live ball)

[05:13] Team_010 possession (Score: 65-66)
Desmond Antetokounmpo attempts a Midrange. Contested by Shaquille Herro (3.8 feet, ZONE). DESMOND ANTETOKOUNMPO MAKES IT!
Score: 67-66

[05:00] Team_055 possession (Score: 67-66)
Kevin Bane attempts a Midrange. Contested by RJ Young (5.1 feet, MAN). Kevin Bane misses. Offensive rebound by Chris Turner! Chris Turner's putback is no good. Offensive rebound by Jrue Sabonis! Jrue Sabonis kicks it out.

[04:49] Team_055 possession (Score: 67-66)
Devin Siakam attempts a 3Pt. Contested by Cade Morant (4.0 feet, MAN). DEVIN SIAKAM MAKES IT! Assist: Shaquille Herro
Score: 67-69

[04:31] Team_010 possession (Score: 67-69)
Michael Turner attempts a 3Pt. Contested by Shaquille Herro (3.9 feet, ZONE). Michael Turner misses. Rebound secured by Jrue Sabonis.

[04:19] Team_055 possession (Score: 67-69)
Chris Turner makes the Midrange and draws the foul on Anthony Durant! And-1! Chris Turner to the line for 1. [BONUS: 7 team fouls] (Anthony Durant: 4 personal fouls)   FT 1/1: GOOD Chris Turner makes 1/1 from the line.
Score: 67-72

[04:07] Team_010 possession (Score: 67-72)
FOUL! Reach-in foul on Chris Turner during the drive. [IN THE BONUS! 7 team fouls] Desmond Antetokounmpo to the line for 2 free throws. (Chris Turner: 3 personal fouls)   FT 1/2: GOOD   FT 2/2: GOOD Desmond Antetokounmpo makes 2/2 from the line.
Score: 69-72

[03:50] Team_055 possession (Score: 69-72)
Chris Turner drives, picks up Anthony Durant. Help arrives from Cade Morant! Chris Turner attempts a Dunk. Contested by Cade Morant (3.9 feet, ZONE). CHRIS TURNER MAKES IT! Assist: Jrue Sabonis
Score: 69-74

[03:39] Team_010 possession (Score: 69-74)
FOUL! Holding foul on Chris Turner. [IN THE BONUS! 8 team fouls] Desmond Antetokounmpo to the line for 2 free throws. (Chris Turner: 4 personal fouls)   FT 1/2: GOOD   FT 2/2: GOOD Desmond Antetokounmpo makes 2/2 from the line.
Score: 71-74

[03:21] Team_055 possession (Score: 71-74)
Kevin Bane drives to the basket... Kevin Bane loses control! Ball rolls out of bounds! TURNOVER! (dead ball)

[03:21] Substitution (Team_055): Devin Siakam OUT → Luka Wall IN (stamina_rule2)

[03:08] Team_010 possession (Score: 71-74)
RJ Young makes the Midrange and draws the foul on Kevin Bane! And-1! RJ Young to the line for 1. [BONUS: 9 team fouls] (Kevin Bane: 1 personal fouls)   FT 1/1: GOOD RJ Young makes 1/1 from the line.
Score: 74-74

[02:52] Team_055 possession (Score: 74-74)
Chris Turner attempts a Midrange. Contested by Michael Turner (4.4 feet, ZONE). Chris Turner misses. Offensive rebound by Jrue Sabonis! Jrue Sabonis kicks it out.

[02:39] Team_055 possession (Score: 74-74)
Luka Wall attempts a Midrange. Contested by RJ Young (5.0 feet, ZONE). LUKA WALL MAKES IT!
Score: 74-76

[02:23] Team_010 possession (Score: 74-76)
Desmond Antetokounmpo drives and kicks out. Desmond Antetokounmpo attempts a 3Pt. Contested by Chris Turner (3.3 feet, MAN). Desmond Antetokounmpo misses. Rebound secured by Kevin Bane.

[02:07] Team_055 possession (Score: 74-76)
Luka Wall attempts a Layup. BLOCKED BY ANTHONY DURANT! Ball goes out off Anthony Durant. Luka Wall's ball!

[01:55] Team_055 possession (Score: 74-76)
FOUL! Holding foul on RJ Young. [IN THE BONUS! 8 team fouls] Kevin Bane to the line for 2 free throws. (RJ Young: 1 personal fouls)   FT 1/2: GOOD   FT 2/2: GOOD Kevin Bane makes 2/2 from the line.
Score: 74-78

[01:41] Team_010 possession (Score: 74-78)
RJ Young drives, Kevin Bane stays with him. RJ Young attempts a Layup. Contested by Kevin Bane (4.1 feet, MAN). RJ YOUNG MAKES IT!
Score: 76-78

[01:31] Team_055 possession (Score: 76-78)
Shaquille Herro attempts a Midrange. Contested by Michael Turner (4.6 feet, MAN). Shaquille Herro misses. FOUL! Loose ball foul on Michael Turner during the rebound battle. [IN THE BONUS! 9 team fouls] Chris Turner to the line for 2 free throws. (Michael Turner: 1 personal fouls)   FT 1/2: MISS   FT 2/2: MISS Chris Turner makes 0/2 from the line. Rebound secured by Michael Turner.

[01:17] Team_010 possession (Score: 76-78)
Cade Morant attempts a Midrange. Contested by Shaquille Herro (4.5 feet, ZONE). CADE MORANT MAKES IT! Assist: Michael Turner
Score: 78-78

[00:59] Team_055 possession (Score: 78-78)
Kevin Bane attempts a 3Pt. Contested by Michael Turner (4.7 feet, ZONE). Kevin Bane misses. Rebound secured by Anthony Durant.

[00:44] Team_010 possession (Score: 78-78)
Desmond Antetokounmpo drives and kicks out. Michael Turner attempts a Midrange. Contested by Shaquille Herro (4.2 feet, MAN). Michael Turner misses. Offensive rebound by Cade Morant! Cade Morant kicks it out.

[00:30] Team_010 possession (Score: 78-78)
Desmond Antetokounmpo drives and kicks out. Cade Morant attempts a 3Pt. Contested by Kevin Bane (4.4 feet, ZONE). Cade Morant misses. Rebound secured by Jrue Sabonis.

[00:11] Team_055 possession (Score: 78-78)
FOUL! Shooting foul on Cade Morant. Luka Wall to the line for 2 free throws. [BONUS: 10 team fouls] (Cade Morant: 4 personal fouls)   FT 1/2: GOOD   FT 2/2: GOOD Luka Wall makes 2/2 from the line.
Score: 78-80

================================================================================
                              3RD QUARTER COMPLETE                              
================================================================================

3RD QUARTER SCORE: Team_010 34, Team_055 25

BOX SCORE:
================================================================================

Team_010
--------------------------------------------------------------------------------
Player                MIN  PTS  REB  AST  TO      FG   FG%      3P   3P%
--------------------------------------------------------------------------------
Michael Turner         34   10    1    1   0   4/7    57.1     0/0   0.0
Cade Morant            34    8    4    2   0   3/3   100.0     0/0   0.0
Desmond Antetokounmpo   34    6    0    1   0   3/7    42.9     0/0   0.0
RJ Young               34    5    0    0   0   2/3    66.7     0/0   0.0
Anthony Durant         34    3    6    0   0   1/1   100.0     0/0   0.0

TEAM: FG: 13/21 (61.9%), 3PT: 2/4 (50.0%), REB: 9 (3 off, 6 def), AST: 4, TO: 0
TEAM FOULS: 10 [Team_055 in BONUS]


Team_055
--------------------------------------------------------------------------------
Player                MIN  PTS  REB  AST  TO      FG   FG%      3P   3P%
--------------------------------------------------------------------------------
Chris Turner           34   10    3    0   0   4/5    80.0     0/0   0.0
Kevin Bane             34    4    3    0   0   2/4    50.0     0/0   0.0
Luka Wall               6    4    0    0   0   2/2   100.0     0/0   0.0
Devin Siakam           30    3    0    0   0   1/4    25.0     0/0   0.0
Jrue Sabonis           34    2    5    1   0   1/2    50.0     0/0   0.0
Shaquille Herro        34    0    0    1   0   0/1     0.0     0/0   0.0

TEAM: FG: 10/18 (55.6%), 3PT: 1/4 (25.0%), REB: 13 (5 off, 8 def), AST: 2, TO: 3
TEAM FOULS: 9 [Team_010 in BONUS]

================================================================================

================================================================================
                       4TH QUARTER - Team_010 vs Team_055                       
================================================================================

[12:00] Team_010 possession (Score: 78-80)
Anthony Durant drives and kicks out. Desmond Antetokounmpo attempts a Midrange. Contested by Jrue Sabonis (4.6 feet, ZONE). Desmond Antetokounmpo misses. Rebound secured by Chris Turner.

[11:47] Team_055 possession (Score: 78-80)
Jrue Sabonis attempts a Layup. Contested by Anthony Durant (4.0 feet, ZONE). JRUE SABONIS MAKES IT! Assist: Devin Siakam
Score: 78-82

[11:32] Team_010 possession (Score: 78-82)
Michael Turner makes the Layup and draws the foul on Shaquille Herro! And-1! Michael Turner to the line for 1. [Team fouls: 1] (Shaquille Herro: 1 personal fouls)   FT 1/1: GOOD Michael Turner makes 1/1 from the line.
Score: 81-82

[11:20] Team_055 possession (Score: 81-82)
FOUL! Holding foul on RJ Young. [Team fouls: 1] No free throws, side out. (RJ Young: 1 personal fouls)

[11:04] Team_055 possession (Score: 81-82)
Jrue Sabonis attempts a Midrange. Contested by Desmond Antetokounmpo (4.7 feet, ZONE). Jrue Sabonis misses. Rebound secured by Anthony Durant.

[10:49] Team_010 possession (Score: 81-82)
RJ Young drives to the basket... RJ Young loses control! Ball rolls out of bounds! TURNOVER! (dead ball)

[10:49] Substitution (Team_010): Cade Morant OUT → Draymond Leonard IN (stamina_rule2)

[10:49] Substitution (Team_010): Michael Turner OUT → Blake Harden IN (stamina_rule2)

[10:49] Substitution (Team_010): RJ Young OUT → Ben Gilgeous-Alexander IN (stamina_rule2)

[10:49] Substitution (Team_010): Desmond Antetokounmpo OUT → Vince Ingram IN (stamina_rule2)

[10:49] Substitution (Team_010): Anthony Durant OUT → Paolo Wade IN (stamina_rule2)

[10:49] Substitution (Team_055): Shaquille Herro OUT → Dirk Duncan IN (stamina_rule2)

[10:49] Substitution (Team_055): Kevin Bane OUT → Kyle Wall IN (stamina_rule2)

[10:49] Substitution (Team_055): Jrue Sabonis OUT → Malcolm Williamson IN (stamina_rule2)

[10:49] Substitution (Team_055): Chris Turner OUT → D'Angelo Antetokounmpo IN (stamina_rule2)

[10:36] Team_055 possession (Score: 81-82)
Malcolm Williamson attempts a Midrange. Contested by Vince Ingram (5.8 feet, MAN). MALCOLM WILLIAMSON MAKES IT! Assist: Devin Siakam
Score: 81-84

[10:25] Team_010 possession (Score: 81-84)
Draymond Leonard drives, Malcolm Williamson stays with him. Draymond Leonard attempts a Dunk. Contested by Malcolm Williamson (4.4 feet, ZONE). Draymond Leonard misses. Rebound secured by Dirk Duncan.

[10:13] Team_055 possession (Score: 81-84)
D'Angelo Antetokounmpo drives and kicks out. Kyle Wall attempts a 3Pt. Contested by Draymond Leonard (4.4 feet, ZONE). KYLE WALL MAKES IT! Assist: Malcolm Williamson
Score: 81-87

[09:58] Team_010 possession (Score: 81-87)
Vince Ingram attempts a 3Pt. Contested by Malcolm Williamson (4.7 feet, MAN). Vince Ingram misses. Offensive rebound by Blake Harden! Blake Harden kicks it out.

[09:43] Team_010 possession (Score: 81-87)
Vince Ingram makes the Layup and draws the foul on Malcolm Williamson! And-1! Vince Ingram to the line for 1. [Team fouls: 2] (Malcolm Williamson: 1 personal fouls)   FT 1/1: GOOD Vince Ingram makes 1/1 from the line.
Score: 84-87

[09:28] Team_055 possession (Score: 84-87)
D'Angelo Antetokounmpo makes the Layup and draws the foul on Paolo Wade! And-1! D'Angelo Antetokounmpo to the line for 1. [Team fouls: 2] (Paolo Wade: 1 personal fouls)   FT 1/1: GOOD D'Angelo Antetokounmpo makes 1/1 from the line.
Score: 84-90

[09:14] Team_010 possession (Score: 84-90)
Ben Gilgeous-Alexander attempts a Midrange. Contested by Kyle Wall (4.4 feet, MAN). Ben Gilgeous-Alexander misses. Rebound secured by Malcolm Williamson.

[08:55] Team_055 possession (Score: 84-90)
Devin Siakam attempts a 3Pt. Contested by Draymond Leonard (4.4 feet, MAN). Devin Siakam misses. FOUL! Loose ball foul on Blake Harden during the rebound battle. [Team fouls: 3] No free throws, side out. (Blake Harden: 1 personal fouls)

[08:45] Team_055 possession (Score: 84-90)
Dirk Duncan attempts a 3Pt. Contested by Draymond Leonard (4.0 feet, ZONE). Dirk Duncan misses. Rebound secured by Paolo Wade.

[08:28] Team_010 possession (Score: 84-90)
FOUL! Reach-in foul on Malcolm Williamson during the drive. [Team fouls: 3] No free throws, side out. (Malcolm Williamson: 2 personal fouls)

[08:12] Team_010 possession (Score: 84-90)
FOUL! Holding foul on Malcolm Williamson. [Team fouls: 4] No free throws, side out. (Malcolm Williamson: 3 personal fouls)

[08:01] Team_010 possession (Score: 84-90)
Blake Harden attempts a Midrange. Contested by Dirk Duncan (5.4 feet, MAN). Blake Harden misses. Rebound secured by Dirk Duncan.

[07:44] Team_055 possession (Score: 84-90)
FOUL! Reach-in foul on Vince Ingram during the drive. [Team fouls: 4] No free throws, side out. (Vince Ingram: 1 personal fouls)

[07:29] Team_055 possession (Score: 84-90)
D'Angelo Antetokounmpo attempts a 3Pt. Contested by Paolo Wade (5.6 feet, MAN). D'ANGELO ANTETOKOUNMPO MAKES IT! Assist: Kyle Wall
Score: 84-93

[07:12] Team_010 possession (Score: 84-93)
Paolo Wade drives and kicks out. FOUL! Shooting foul on Malcolm Williamson. Vince Ingram to the line for 2 free throws. [BONUS: 5 team fouls] (Malcolm Williamson: 4 personal fouls)   FT 1/2: GOOD   FT 2/2: GOOD Vince Ingram makes 2/2 from the line.
Score: 86-93

[06:58] Team_055 possession (Score: 86-93)
D'Angelo Antetokounmpo drives and kicks out. Devin Siakam attempts a Midrange. Contested by Draymond Leonard (4.4 feet, MAN). Devin Siakam misses. Rebound secured by Paolo Wade.

[06:44] Team_010 possession (Score: 86-93)
Draymond Leonard attempts a 3Pt. Wide open! Devin Siakam is 6.1 feet away. [MAN] Draymond Leonard misses. Offensive rebound by Paolo Wade! Paolo Wade kicks it out.

[06:26] Team_010 possession (Score: 86-93)
Draymond Leonard attempts a Midrange. Wide open! Devin Siakam is 6.1 feet away. [MAN] Draymond Leonard misses. Rebound secured by Dirk Duncan.

[06:11] Team_055 possession (Score: 86-93)
Devin Siakam attempts a 3Pt. Contested by Draymond Leonard (4.4 feet, MAN). Devin Siakam misses. Rebound secured by Ben Gilgeous-Alexander.

[06:01] Team_010 possession (Score: 86-93)
Ben Gilgeous-Alexander attempts a 3Pt. Contested by Kyle Wall (4.4 feet, ZONE). Ben Gilgeous-Alexander misses. Rebound secured by D'Angelo Antetokounmpo.

[05:45] Team_055 possession (Score: 86-93)
Dirk Duncan makes the Dunk and draws the foul on Ben Gilgeous-Alexander! And-1! Dirk Duncan to the line for 1. [BONUS: 5 team fouls] (Ben Gilgeous-Alexander: 1 personal fouls)   FT 1/1: GOOD Dirk Duncan makes 1/1 from the line.
Score: 86-96

[05:28] Team_010 possession (Score: 86-96)
FOUL! Reach-in foul on D'Angelo Antetokounmpo during the drive. [IN THE BONUS! 6 team fouls] Paolo Wade to the line for 2 free throws. (D'Angelo Antetokounmpo: 1 personal fouls)   FT 1/2: MISS   FT 2/2: GOOD Paolo Wade makes 1/2 from the line.
Score: 87-96

[05:09] Team_055 possession (Score: 87-96)
Malcolm Williamson attempts a Midrange. Contested by Vince Ingram (5.8 feet, ZONE). MALCOLM WILLIAMSON MAKES IT! Assist: D'Angelo Antetokounmpo
Score: 87-98

[04:55] Team_010 possession (Score: 87-98)
Paolo Wade attempts a 3Pt. Contested by Kyle Wall (4.4 feet, ZONE). Paolo Wade misses. Offensive rebound by Paolo Wade! Paolo Wade kicks it out.

[04:40] Team_010 possession (Score: 87-98)
Ben Gilgeous-Alexander drives to the basket... Ben Gilgeous-Alexander throws a bad pass out of bounds! TURNOVER! (dead ball)

[04:40] Substitution (Team_055): Devin Siakam OUT → Luka Wall IN (stamina_rule2)

[04:28] Team_055 possession (Score: 87-98)
Dirk Duncan attempts a 3Pt. Contested by Blake Harden (4.2 feet, MAN). Dirk Duncan misses. Rebound secured by Blake Harden.

[04:19] Team_010 possession (Score: 87-98)
Draymond Leonard attempts a 3Pt. Wide open! Luka Wall is 6.1 feet away. [MAN] Draymond Leonard misses. Rebound secured by Dirk Duncan.

[04:01] Team_055 possession (Score: 87-98)
Malcolm Williamson attempts a Midrange. Contested by Vince Ingram (5.8 feet, MAN). Malcolm Williamson misses. Rebound secured by Ben Gilgeous-Alexander.

[03:45] Team_010 possession (Score: 87-98)
Vince Ingram attempts a 3Pt. Contested by Kyle Wall (4.9 feet, ZONE). Vince Ingram misses. Rebound secured by Malcolm Williamson.

[03:28] Team_055 possession (Score: 87-98)
Malcolm Williamson attempts a Midrange. Contested by Vince Ingram (5.8 feet, MAN). MALCOLM WILLIAMSON MAKES IT! Assist: Luka Wall
Score: 87-100

[03:16] Team_010 possession (Score: 87-100)
Vince Ingram attempts a Layup. BLOCKED BY MALCOLM WILLIAMSON! Ball deflects out of bounds off Vince Ingram.

[03:03] Team_055 possession (Score: 87-100)
Kyle Wall attempts a 3Pt. Contested by Draymond Leonard (4.5 feet, ZONE). Kyle Wall misses. Offensive rebound by D'Angelo Antetokounmpo! D'Angelo Antetokounmpo puts it back in!
Score: 87-102

[02:48] Team_010 possession (Score: 87-102)
Draymond Leonard attempts a 3Pt. Contested by Kyle Wall (4.6 feet, ZONE). Draymond Leonard misses. Rebound secured by D'Angelo Antetokounmpo.

[02:35] Team_055 possession (Score: 87-102)
Dirk Duncan attempts a 3Pt. Contested by Draymond Leonard (4.1 feet, ZONE). DIRK DUNCAN MAKES IT! Assist: D'Angelo Antetokounmpo
Score: 87-105

[02:20] Team_010 possession (Score: 87-105)
FOUL! Shooting foul on D'Angelo Antetokounmpo. Paolo Wade to the line for 2 free throws. [BONUS: 7 team fouls] (D'Angelo Antetokounmpo: 2 personal fouls)   FT 1/2: GOOD   FT 2/2: GOOD Paolo Wade makes 2/2 from the line.
Score: 89-105

[02:03] Team_055 possession (Score: 89-105)
D'Angelo Antetokounmpo attempts a Layup. Contested by Paolo Wade (5.8 feet, ZONE). D'Angelo Antetokounmpo misses. Rebound secured by Ben Gilgeous-Alexander.

[01:45] Team_010 possession (Score: 89-105)
Draymond Leonard attempts a 3Pt. Wide open! Luka Wall is 6.1 feet away. [MAN] Draymond Leonard misses. Rebound secured by Malcolm Williamson.

[01:31] Team_055 possession (Score: 89-105)
Kyle Wall attempts a Midrange. Contested by Ben Gilgeous-Alexander (4.8 feet, MAN). Kyle Wall misses. Offensive rebound by D'Angelo Antetokounmpo! D'Angelo Antetokounmpo puts it back in!
Score: 89-107

[01:17] Team_010 possession (Score: 89-107)
Blake Harden attempts a Layup. Contested by Dirk Duncan (5.6 feet, MAN). BLAKE HARDEN MAKES IT! Assist: Ben Gilgeous-Alexander
Score: 91-107

[00:59] Team_055 possession (Score: 91-107)
Dirk Duncan attempts a Midrange. BLOCKED BY VINCE INGRAM! Ball goes out off Vince Ingram. Dirk Duncan's ball!

[00:47] Team_055 possession (Score: 91-107)
Luka Wall attempts a Layup. Contested by Paolo Wade (5.5 feet, ZONE). LUKA WALL MAKES IT! Assist: Kyle Wall
Score: 91-109

[00:36] Team_010 possession (Score: 91-109)
Draymond Leonard attempts a 3Pt. Wide open! Luka Wall is 6.0 feet away. [MAN] DRAYMOND LEONARD MAKES IT!
Score: 94-109

[00:22] Team_055 possession (Score: 94-109)
Dirk Duncan attempts a 3Pt. Contested by Ben Gilgeous-Alexander (4.5 feet, ZONE). Dirk Duncan misses. Offensive rebound by Malcolm Williamson! Malcolm Williamson puts it back in!
Score: 94-111

[00:06] Team_010 possession (Score: 94-111)
Draymond Leonard attempts a 3Pt. Contested by Kyle Wall (4.9 feet, ZONE). Draymond Leonard misses. Rebound secured by Kyle Wall.

================================================================================
                              4TH QUARTER COMPLETE                              
================================================================================

4TH QUARTER SCORE: Team_010 16, Team_055 31

BOX SCORE:
================================================================================

Team_010
--------------------------------------------------------------------------------
Player                MIN  PTS  REB  AST  TO      FG   FG%      3P   3P%
--------------------------------------------------------------------------------
Vince Ingram           13    5    0    0   0   2/4    50.0     0/0   0.0
Michael Turner         35    3    0    0   0   1/1   100.0     0/0   0.0
Draymond Leonard       13    3    0    0   0   1/7    14.3     0/0   0.0
Paolo Wade             13    3    4    0   0   2/2   100.0     0/0   0.0
Blake Harden           13    2    2    0   0   1/2    50.0     0/0   0.0
Anthony Durant         35    0    1    0   0   0/1     0.0     0/0   0.0
Ben Gilgeous-Alexander   13    0    3    1   0   0/2     0.0     0/0   0.0

TEAM: FG: 7/19 (36.8%), 3PT: 1/7 (14.3%), REB: 10 (3 off, 7 def), AST: 1, TO: 2
TEAM FOULS: 5 [Team_055 in BONUS]


Team_055
--------------------------------------------------------------------------------
Player                MIN  PTS  REB  AST  TO      FG   FG%      3P   3P%
--------------------------------------------------------------------------------
D'Angelo Antetokounmpo   13   10    5    2   0   4/6    66.7     0/0   0.0
Malcolm Williamson     13    8    4    1   0   4/5    80.0     0/0   0.0
Dirk Duncan            13    6    4    0   0   2/4    50.0     0/0   0.0
Kyle Wall              13    3    1    2   0   1/1   100.0     0/0   0.0
Jrue Sabonis           35    2    0    0   0   1/2    50.0     0/0   0.0
Luka Wall              10    2    0    1   0   1/1   100.0     0/0   0.0
Chris Turner           35    0    1    0   0   0/0     0.0     0/0   0.0
Devin Siakam           38    0    0    2   0   0/1     0.0     0/0   0.0

TEAM: FG: 13/20 (65.0%), 3PT: 4/7 (57.1%), REB: 15 (4 off, 11 def), AST: 8, TO: 0
TEAM FOULS: 7 [Team_010 in BONUS]

================================================================================

================================================================================
                               FULL GAME COMPLETE                               
================================================================================

FINAL SCORE: Team_010 94, Team_055 111

SCORING BY QUARTER:
--------------------------------------------------------------------------------
Team                     Q1     Q2     Q3     Q4    FINAL
--------------------------------------------------------------------------------
Team_010                 21     23     34     16       94
Team_055                 29     26     25     31      111
--------------------------------------------------------------------------------

FULL GAME BOX SCORE:
================================================================================

Team_010
--------------------------------------------------------------------------------
Player                MIN  PTS  REB  AST  TO      FG   FG%      3P   3P%      FT STL BLK
--------------------------------------------------------------------------------
Cade Morant            35   22    9    3   1   8/12   66.7   1/3    33.3   4/4     0   1
Michael Turner         35   20    6    3   0   9/15   60.0   2/5    40.0   6/8     0   0
RJ Young               35   18    0    0   2   8/14   57.1   1/5    20.0   1/1     1   0
Desmond Antetokounmpo   35   12    2    2   1   5/12   41.7   0/2     0.0   4/4     0   0
Anthony Durant         35    3   17    1   0   1/4    25.0   0/0     0.0   1/1     0   3
Draymond Leonard       13    5    0    0   1   2/8    25.0   1/5    20.0   0/0     0   0
Blake Harden           13    2    3    0   1   1/2    50.0   0/0     0.0   0/0     0   0
Ben Gilgeous-Alexander   13    0    3    1   1   0/2     0.0   0/1     0.0   0/0     0   0
Vince Ingram           13    5    0    0   0   1/4    25.0   0/1     0.0   3/3     0   1
Paolo Wade             13    3    4    0   0   3/3   100.0   0/0     0.0   3/4     0   0

TEAM: FG: 39/77 (50.6%), 3PT: 5/22 (22.7%), REB: 42 (11 off, 31 def), AST: 10, TO: 7


Team_055
--------------------------------------------------------------------------------
Player                MIN  PTS  REB  AST  TO      FG   FG%      3P   3P%      FT STL BLK
--------------------------------------------------------------------------------
Devin Siakam           38   13    0    7   2   4/12   33.3   3/8    37.5   0/0     0   0
Shaquille Herro        35    3    0    3   0   1/6    16.7   0/3     0.0   0/0     0   0
Kevin Bane             35   19   10    1   0   8/12   66.7   4/7    57.1   2/3     0   0
Jrue Sabonis           35   10   14    3   1   5/10   50.0   1/2    50.0   4/5     0   0
Chris Turner           35   23    9    2   0  10/15   66.7   0/0     0.0   5/7     1   0
Dirk Duncan            13    6    4    1   0   4/7    57.1   2/5    40.0   1/1     0   0
Kyle Wall              13    3    1    2   0   2/2   100.0   1/1   100.0   0/0     1   0
Malcolm Williamson     13    8    4    1   0   3/4    75.0   0/0     0.0   0/0     0   2
D'Angelo Antetokounmpo   13   12    6    2   1   3/5    60.0   1/1   100.0   1/1     0   0
Luka Wall              10   12    0    1   0   5/5   100.0   1/1   100.0   3/3     0   0

TEAM: FG: 46/79 (58.2%), 3PT: 13/28 (46.4%), REB: 50 (14 off, 36 def), AST: 23, TO: 4

================================================================================
