================================================================================
                        FULL GAME - Team_066 vs Team_020                        
================================================================================

================================================================================
                       1ST QUARTER - Team_066 vs Team_020                       
================================================================================

[12:00] Team_066 possession (Score: 0-0)
Yao Brogdon attempts a Midrange. Contested by Terry Simons (4.7 feet, ZONE). Yao Brogdon misses. Rebound secured by Terry Simons.

[11:48] Team_020 possession (Score: 0-0)
Terry Simons attempts a 3Pt. Wide open! Pau Curry is 6.1 feet away. [ZONE] Terry Simons misses. Rebound secured by Brandon Reaves.

[11:33] Team_066 possession (Score: 0-0)
FOUL! Holding foul on Jarrett McCollum. [Team fouls: 1] No free throws, side out. (Jarrett McCollum: 1 personal fouls)

[11:17] Team_066 possession (Score: 0-0)
Yao Brogdon makes the Dunk and draws the foul on Trae Curry! And-1! Yao Brogdon to the line for 1. [Team fouls: 2] (Trae Curry: 1 personal fouls)   FT 1/1: GOOD Yao Brogdon makes 1/1 from the line.
Score: 3-0

[11:03] Team_020 possession (Score: 3-0)
Trae Curry drives and kicks out. Bam Leonard attempts a 3Pt. Contested by Brandon Reaves (5.1 feet, ZONE). BAM LEONARD MAKES IT! Assist: Jarrett McCollum
Score: 3-3

[10:45] Team_066 possession (Score: 3-3)
Jimmy Davis attempts a 3Pt. Contested by Jarrett McCollum (4.8 feet, ZONE). Jimmy Davis misses. Rebound secured by Bam Leonard.

[10:29] Team_020 possession (Score: 3-3)
Terry Simons drives, picks up Brandon Reaves. Help arrives from Jimmy Davis! Terry Simons attempts a Layup. Contested by Jimmy Davis (5.7 feet, MAN). TERRY SIMONS MAKES IT! Assist: Jarrett McCollum
Score: 3-5

[10:17] Team_066 possession (Score: 3-5)
Jimmy Davis attempts a 3Pt. Contested by Jarrett McCollum (4.8 feet, MAN). Jimmy Davis misses. Rebound secured by Trae Curry.

[10:04] Team_020 possession (Score: 3-5)
James Cunningham attempts a 3Pt. Contested by Pau Curry (5.8 feet, MAN). JAMES CUNNINGHAM MAKES IT! Assist: Bam Leonard
Score: 3-8

[09:53] Team_066 possession (Score: 3-8)
FOUL! Holding foul on Terry Simons. [Team fouls: 3] No free throws, side out. (Terry Simons: 1 personal fouls)

[09:42] Team_066 possession (Score: 3-8)
Yao Brogdon attempts a Midrange. Contested by Terry Simons (4.7 feet, ZONE). YAO BROGDON MAKES IT! Assist: Pau Curry
Score: 5-8

[09:28] Team_020 possession (Score: 5-8)
Bam Leonard attempts a 3Pt. Contested by Jimmy Davis (4.2 feet, ZONE). Bam Leonard misses. Rebound secured by Yao Brogdon.

[09:10] Team_066 possession (Score: 5-8)
Jimmy Davis makes the Layup and draws the foul on Trae Curry! And-1! Jimmy Davis to the line for 1. [Team fouls: 4] (Trae Curry: 2 personal fouls)   FT 1/1: GOOD Jimmy Davis makes 1/1 from the line.
Score: 8-8

[08:57] Team_020 possession (Score: 8-8)
James Cunningham drives, picks up Kyle Wagner. Help arrives from Jimmy Davis! James Cunningham attempts a Layup. Contested by Jimmy Davis (4.2 feet, ZONE). JAMES CUNNINGHAM MAKES IT! Assist: Trae Curry
Score: 8-10

[08:44] Team_066 possession (Score: 8-10)
Yao Brogdon attempts a Layup. BLOCKED BY BAM LEONARD! Ball is loose! Offensive rebound by Yao Brogdon! Yao Brogdon kicks it out.

[08:29] Team_066 possession (Score: 8-10)
FOUL! Reach-in foul on Trae Curry during the drive. [IN THE BONUS! 5 team fouls] Kyle Wagner to the line for 2 free throws. (Trae Curry: 3 personal fouls)   FT 1/2: MISS   FT 2/2: MISS Kyle Wagner makes 0/2 from the line. Rebound secured by Trae Curry.

[08:13] Team_020 possession (Score: 8-10)
Bam Leonard drives, Kyle Wagner stays with him. Bam Leonard attempts a Layup. Contested by Kyle Wagner (4.2 feet, ZONE). BAM LEONARD MAKES IT! Assist: James Cunningham
Score: 8-12

[07:55] Team_066 possession (Score: 8-12)
Pau Curry attempts a Layup. Contested by Trae Curry (4.9 feet, ZONE). PAU CURRY MAKES IT! Assist: Yao Brogdon
Score: 10-12

[07:41] Team_020 possession (Score: 10-12)
Bam Leonard attempts a Layup. Contested by Kyle Wagner (4.2 feet, ZONE). BAM LEONARD MAKES IT!
Score: 10-14

[07:28] Team_066 possession (Score: 10-14)
Jimmy Davis attempts a Layup. BLOCKED BY TRAE CURRY! Ball deflects out of bounds off Jimmy Davis.

[07:16] Team_020 possession (Score: 10-14)
Jarrett McCollum attempts a 3Pt. Contested by Pau Curry (5.6 feet, ZONE). JARRETT MCCOLLUM MAKES IT!
Score: 10-17

[06:58] Team_066 possession (Score: 10-17)
Yao Brogdon attempts a 3Pt. Contested by Bam Leonard (2.7 feet, ZONE). Yao Brogdon misses. Rebound secured by Trae Curry.

[06:44] Team_020 possession (Score: 10-17)
Bam Leonard drives and kicks out. Terry Simons attempts a 3Pt. Contested by Brandon Reaves (5.1 feet, MAN). Terry Simons misses. Rebound secured by Brandon Reaves.

[06:35] Team_066 possession (Score: 10-17)
Pau Curry drives, picks up James Cunningham. Help arrives from Terry Simons! Pau Curry attempts a Dunk. Contested by Terry Simons (5.2 feet, MAN). Pau Curry misses. Rebound secured by Bam Leonard.

[06:18] Team_020 possession (Score: 10-17)
Jarrett McCollum drives and kicks out. Jarrett McCollum attempts a Midrange. Contested by Kyle Wagner (3.9 feet, ZONE). Jarrett McCollum misses. Rebound secured by Brandon Reaves.

[06:05] Team_066 possession (Score: 10-17)
Pau Curry attempts a 3Pt. Contested by Bam Leonard (2.6 feet, ZONE). Pau Curry misses. Rebound secured by Trae Curry.

[05:52] Team_020 possession (Score: 10-17)
Jarrett McCollum attempts a Midrange. Contested by Jimmy Davis (4.1 feet, MAN). Jarrett McCollum misses. FOUL! Loose ball foul on Yao Brogdon during the rebound battle. [Team fouls: 1] No free throws, side out. (Yao Brogdon: 1 personal fouls)

[05:34] Team_020 possession (Score: 10-17)
Bam Leonard attempts a 3Pt. Contested by Pau Curry (5.8 feet, ZONE). BAM LEONARD MAKES IT! Assist: Trae Curry
Score: 10-20

[05:16] Team_066 possession (Score: 10-20)
FOUL! Reach-in foul on Trae Curry during the drive. [IN THE BONUS! 6 team fouls] Kyle Wagner to the line for 2 free throws. (Trae Curry: 4 personal fouls)   FT 1/2: MISS   FT 2/2: GOOD Kyle Wagner makes 1/2 from the line.
Score: 11-20

[04:59] Team_020 possession (Score: 11-20)
FOUL! Reach-in foul on Jimmy Davis during the drive. [Team fouls: 2] No free throws, side out. (Jimmy Davis: 1 personal fouls)

[04:45] Team_020 possession (Score: 11-20)
Bam Leonard makes the Layup and draws the foul on Kyle Wagner! And-1! Bam Leonard to the line for 1. [Team fouls: 3] (Kyle Wagner: 1 personal fouls)   FT 1/1: GOOD Bam Leonard makes 1/1 from the line.
Score: 11-23

[04:33] Team_066 possession (Score: 11-23)
Yao Brogdon attempts a Midrange. Contested by Trae Curry (5.1 feet, ZONE). Yao Brogdon misses. Rebound secured by Trae Curry.

[04:18] Team_020 possession (Score: 11-23)
James Cunningham attempts a 3Pt. Contested by Pau Curry (5.9 feet, ZONE). James Cunningham misses. Rebound secured by Kyle Wagner.

[04:04] Team_066 possession (Score: 11-23)
Yao Brogdon drives to the basket... Yao Brogdon throws a bad pass! Stolen by Trae Curry! TURNOVER! (live ball)

[03:48] Team_020 possession (Score: 11-23)
James Cunningham attempts a 3Pt. Contested by Pau Curry (5.9 feet, ZONE). James Cunningham misses. Rebound secured by Brandon Reaves.

[03:34] Team_066 possession (Score: 11-23)
Kyle Wagner throws a bad pass! Stolen by Bam Leonard! TURNOVER! (live ball)

[03:22] Team_020 possession (Score: 11-23)
FOUL! Holding foul on Pau Curry. [Team fouls: 4] No free throws, side out. (Pau Curry: 1 personal fouls)

[03:09] Team_020 possession (Score: 11-23)
Trae Curry makes the Dunk and draws the foul on Jimmy Davis! And-1! Trae Curry to the line for 1. [BONUS: 5 team fouls] (Jimmy Davis: 2 personal fouls)   FT 1/1: MISS Trae Curry makes 0/1 from the line. FOUL! Loose ball foul on Brandon Reaves during the free throw rebound! [IN THE BONUS! 6 team fouls] Trae Curry to the line for 2 free throws. (Brandon Reaves: 1 personal fouls)   FT 1/2: GOOD   FT 2/2: GOOD Trae Curry makes 2/2 from the line.
Score: 11-27

[02:59] Team_066 possession (Score: 11-27)
Pau Curry attempts a 3Pt. Contested by James Cunningham (5.4 feet, MAN). Pau Curry misses. Offensive rebound by Yao Brogdon! Yao Brogdon kicks it out.

[02:43] Team_066 possession (Score: 11-27)
Jimmy Davis attempts a Layup. Contested by Jarrett McCollum (5.0 feet, MAN). JIMMY DAVIS MAKES IT!
Score: 13-27

[02:24] Team_020 possession (Score: 13-27)
FOUL! Offensive foul on Trae Curry! Kyle Wagner drew the charge! [Team fouls: 7] (Trae Curry: 5 personal fouls) TURNOVER! (dead ball)

[02:10] Team_066 possession (Score: 13-27)
Yao Brogdon drives, Bam Leonard stays with him. Yao Brogdon attempts a Layup. Contested by Bam Leonard (3.1 feet, MAN). Yao Brogdon misses. Rebound secured by Trae Curry.

[01:55] Team_020 possession (Score: 13-27)
FOUL! Shooting foul on Yao Brogdon. Bam Leonard to the line for 2 free throws. [BONUS: 7 team fouls] (Yao Brogdon: 2 personal fouls)   FT 1/2: GOOD   FT 2/2: MISS Bam Leonard makes 1/2 from the line. Rebound secured by Brandon Reaves.
Score: 13-28

[01:42] Team_066 possession (Score: 13-28)
Jimmy Davis drives and kicks out. Yao Brogdon attempts a 3Pt. Contested by Bam Leonard (2.8 feet, ZONE). Yao Brogdon misses. Rebound secured by Bam Leonard.

[01:27] Team_020 possession (Score: 13-28)
Bam Leonard throws a bad pass out of bounds! TURNOVER! (dead ball)

[01:27] Substitution (Team_066): Jimmy Davis OUT → Pascal Carter IN (stamina_rule2)

[01:27] Substitution (Team_066): Pau Curry OUT → Lauri LaVine IN (stamina_rule2)

[01:27] Substitution (Team_066): Brandon Reaves OUT → Brandon Middleton IN (stamina_rule2)

[01:27] Substitution (Team_066): Yao Brogdon OUT → Cole Morant IN (stamina_rule2)

[01:27] Substitution (Team_066): Kyle Wagner OUT → Donovan Simmons IN (stamina_rule2)

[01:27] Substitution (Team_020): Jarrett McCollum OUT → Franz Doncic IN (stamina_rule2)

[01:27] Substitution (Team_020): James Cunningham OUT → Stephen Parker IN (stamina_rule2)

[01:27] Substitution (Team_020): Terry Simons OUT → Victor Holiday IN (stamina_rule2)

[01:27] Substitution (Team_020): Bam Leonard OUT → Cole Barnes IN (stamina_rule2)

[01:27] Substitution (Team_020): Trae Curry OUT → Miles Siakam IN (stamina_rule2)

[01:14] Team_066 possession (Score: 13-28)
FOUL! Shooting foul on Stephen Parker. Donovan Simmons to the line for 2 free throws. [BONUS: 8 team fouls] (Stephen Parker: 1 personal fouls)   FT 1/2: GOOD   FT 2/2: GOOD Donovan Simmons makes 2/2 from the line.
Score: 15-28

[01:02] Team_020 possession (Score: 15-28)
Cole Barnes attempts a Midrange. Contested by Cole Morant (5.6 feet, MAN). COLE BARNES MAKES IT!
Score: 15-30

[00:50] Team_066 possession (Score: 15-30)
FOUL! Holding foul on Miles Siakam. [IN THE BONUS! 9 team fouls] Donovan Simmons to the line for 2 free throws. (Miles Siakam: 1 personal fouls)   FT 1/2: GOOD   FT 2/2: GOOD Donovan Simmons makes 2/2 from the line.
Score: 17-30

[00:34] Team_020 possession (Score: 17-30)
Victor Holiday attempts a 3Pt. Contested by Lauri LaVine (4.3 feet, ZONE). Victor Holiday misses. Rebound secured by Donovan Simmons.

[00:23] Team_066 possession (Score: 17-30)
Lauri LaVine drives and kicks out. Pascal Carter attempts a 3Pt. Contested by Franz Doncic (3.9 feet, MAN). Pascal Carter misses. FOUL! Loose ball foul on Cole Barnes during the rebound battle. [IN THE BONUS! 10 team fouls] Donovan Simmons to the line for 2 free throws. (Cole Barnes: 1 personal fouls)   FT 1/2: GOOD   FT 2/2: GOOD Donovan Simmons makes 2/2 from the line.
Score: 19-30

[00:11] Team_020 possession (Score: 19-30)
Victor Holiday attempts a 3Pt. Contested by Brandon Middleton (5.5 feet, MAN). Victor Holiday misses. Offensive rebound by Cole Barnes! Cole Barnes kicks it out.

================================================================================
                              1ST QUARTER COMPLETE                              
================================================================================

1ST QUARTER SCORE: Team_066 19, Team_020 30

BOX SCORE:
================================================================================

Team_066
--------------------------------------------------------------------------------
Player                MIN  PTS  REB  AST  TO      FG   FG%      3P   3P%
--------------------------------------------------------------------------------
Donovan Simmons         1    6    1    0   0   3/3   100.0     0/0   0.0
Yao Brogdon            11    5    3    1   0   2/6    33.3     0/0   0.0
Jimmy Davis            11    5    0    0   0   2/6    33.3     0/0   0.0
Pau Curry              11    2    0    1   0   1/3    33.3     0/0   0.0
Kyle Wagner            11    1    1    0   0   1/2    50.0     0/0   0.0
Brandon Reaves         11    0    5    0   0   0/0     0.0     0/0   0.0

TEAM: FG: 9/20 (45.0%), 3PT: 0/4 (0.0%), REB: 10 (2 off, 8 def), AST: 2, TO: 2
TEAM FOULS: 7 [Team_020 in BONUS]


Team_020
--------------------------------------------------------------------------------
Player                MIN  PTS  REB  AST  TO      FG   FG%      3P   3P%
--------------------------------------------------------------------------------
Bam Leonard            11   13    3    1   0   5/8    62.5     0/0   0.0
James Cunningham       11    5    0    1   0   2/4    50.0     0/0   0.0
Trae Curry             11    4    7    2   0   1/1   100.0     0/0   0.0
Jarrett McCollum       11    3    0    2   0   1/2    50.0     0/0   0.0
Terry Simons           11    2    1    0   0   1/2    50.0     0/0   0.0
Cole Barnes             1    2    1    0   0   1/1   100.0     0/0   0.0
Victor Holiday          1    0    0    0   0   0/1     0.0     0/0   0.0

TEAM: FG: 11/19 (57.9%), 3PT: 3/8 (37.5%), REB: 12 (2 off, 10 def), AST: 6, TO: 2
TEAM FOULS: 10 [Team_066 in BONUS]

================================================================================

================================================================================
                       2ND QUARTER - Team_066 vs Team_020                       
================================================================================

[12:00] Team_066 possession (Score: 19-30)
Brandon Reaves attempts a Midrange. Contested by Terry Simons (4.8 feet, MAN). Brandon Reaves misses. Rebound secured by Bam Leonard.

[11:49] Team_020 possession (Score: 19-30)
Trae Curry drives, picks up Kyle Wagner. Help arrives from Jimmy Davis! Trae Curry attempts a Layup. Contested by Jimmy Davis (4.4 feet, MAN). TRAE CURRY MAKES IT! Assist: Bam Leonard
Score: 19-32

[11:35] Team_066 possession (Score: 19-32)
Pau Curry attempts a 3Pt. Contested by Bam Leonard (2.8 feet, ZONE). Pau Curry misses. Rebound secured by Trae Curry.

[11:18] Team_020 possession (Score: 19-32)
Bam Leonard drives, picks up Yao Brogdon. Help arrives from Jimmy Davis! Bam Leonard attempts a Dunk. Contested by Jimmy Davis (5.6 feet, MAN). BAM LEONARD MAKES IT!
Score: 19-34

[11:07] Team_066 possession (Score: 19-34)
Yao Brogdon attempts a Layup. Contested by Bam Leonard (3.0 feet, MAN). Yao Brogdon misses. Rebound secured by Terry Simons.

[10:49] Team_020 possession (Score: 19-34)
Jarrett McCollum attempts a 3Pt. Contested by Pau Curry (5.8 feet, ZONE). Jarrett McCollum misses. Rebound secured by Kyle Wagner.

[10:34] Team_066 possession (Score: 19-34)
Pau Curry attempts a 3Pt. Contested by Bam Leonard (2.9 feet, ZONE). Pau Curry misses. Offensive rebound by Yao Brogdon! Yao Brogdon kicks it out.

[10:19] Team_066 possession (Score: 19-34)
Jimmy Davis makes the Layup and draws the foul on Trae Curry! And-1! Jimmy Davis to the line for 1. [Team fouls: 1] (Trae Curry: 1 personal fouls)   FT 1/1: GOOD Jimmy Davis makes 1/1 from the line.
Score: 22-34

[10:04] Team_020 possession (Score: 22-34)
Terry Simons attempts a 3Pt. Contested by Brandon Reaves (5.9 feet, MAN). Terry Simons misses. Rebound secured by Yao Brogdon.

[09:48] Team_066 possession (Score: 22-34)
Yao Brogdon attempts a Midrange. Contested by Bam Leonard (3.2 feet, MAN). YAO BROGDON MAKES IT!
Score: 24-34

[09:35] Team_020 possession (Score: 24-34)
Jarrett McCollum attempts a 3Pt. Contested by Jimmy Davis (4.5 feet, MAN). Jarrett McCollum misses. Rebound secured by Kyle Wagner.

[09:19] Team_066 possession (Score: 24-34)
FOUL! Reach-in foul on Trae Curry during the drive. [Team fouls: 2] No free throws, side out. (Trae Curry: 2 personal fouls)

[09:06] Team_066 possession (Score: 24-34)
Kyle Wagner attempts a Layup. BLOCKED BY TRAE CURRY! Ball is loose! Rebound secured by Terry Simons.

[08:50] Team_020 possession (Score: 24-34)
James Cunningham attempts a Midrange. Wide open! Pau Curry is 6.2 feet away. [ZONE] James Cunningham misses. Rebound secured by Kyle Wagner.

[08:35] Team_066 possession (Score: 24-34)
FOUL! Shooting foul on James Cunningham. Pau Curry to the line for 2 free throws. [Team fouls: 3] (James Cunningham: 1 personal fouls)   FT 1/2: MISS   FT 2/2: GOOD Pau Curry makes 1/2 from the line.
Score: 25-34

[08:21] Team_020 possession (Score: 25-34)
Jarrett McCollum attempts a 3Pt. Contested by Yao Brogdon (5.7 feet, ZONE). Jarrett McCollum misses. Offensive rebound by Bam Leonard! Bam Leonard's putback is no good. Offensive rebound by Trae Curry! Trae Curry kicks it out.

[08:05] Team_020 possession (Score: 25-34)
Terry Simons drives, Kyle Wagner stays with him. Terry Simons attempts a Dunk. Contested by Kyle Wagner (5.0 feet, ZONE). TERRY SIMONS MAKES IT! Assist: Bam Leonard
Score: 25-36

[07:53] Team_066 possession (Score: 25-36)
Jimmy Davis loses the ball! Stripped by Jarrett McCollum! TURNOVER! (live ball)

[07:34] Team_020 possession (Score: 25-36)
FOUL! Shooting foul on Yao Brogdon. Bam Leonard to the line for 2 free throws. [Team fouls: 1] (Yao Brogdon: 1 personal fouls)   FT 1/2: GOOD   FT 2/2: MISS Bam Leonard makes 1/2 from the line. Rebound secured by Kyle Wagner.
Score: 25-37

[07:16] Team_066 possession (Score: 25-37)
Jimmy Davis attempts a 3Pt. Contested by Jarrett McCollum (5.4 feet, MAN). Jimmy Davis misses. Rebound secured by Bam Leonard.

[07:03] Team_020 possession (Score: 25-37)
Terry Simons attempts a 3Pt. Wide open! Brandon Reaves is 6.2 feet away. [MAN] TERRY SIMONS MAKES IT! Assist: Jarrett McCollum
Score: 25-40

[06:47] Team_066 possession (Score: 25-40)
Yao Brogdon attempts a Midrange. Contested by James Cunningham (5.9 feet, ZONE). Yao Brogdon misses. Rebound secured by Trae Curry.

[06:35] Team_020 possession (Score: 25-40)
James Cunningham drives and kicks out. James Cunningham attempts a 3Pt. Wide open! Pau Curry is 6.2 feet away. [MAN] James Cunningham misses. Rebound secured by Kyle Wagner.

[06:18] Team_066 possession (Score: 25-40)
Brandon Reaves makes the Layup and draws the foul on Trae Curry! And-1! Brandon Reaves to the line for 1. [Team fouls: 4] (Trae Curry: 3 personal fouls)   FT 1/1: GOOD Brandon Reaves makes 1/1 from the line.
Score: 28-40

[06:03] Team_020 possession (Score: 28-40)
Trae Curry drives and kicks out. Bam Leonard attempts a 3Pt. Wide open! Pau Curry is 6.2 feet away. [ZONE] Bam Leonard misses. Offensive rebound by Trae Curry! Trae Curry kicks it out.

[05:43] Team_020 possession (Score: 28-40)
Trae Curry attempts a Midrange. Contested by Kyle Wagner (5.0 feet, MAN). Trae Curry misses. Rebound secured by Kyle Wagner.

[05:29] Team_066 possession (Score: 28-40)
Brandon Reaves attempts a Midrange. Contested by Jarrett McCollum (5.7 feet, ZONE). BRANDON REAVES MAKES IT!
Score: 30-40

[05:15] Team_020 possession (Score: 30-40)
Jarrett McCollum attempts a Midrange. Contested by Brandon Reaves (5.9 feet, ZONE). JARRETT MCCOLLUM MAKES IT! Assist: Bam Leonard
Score: 30-42

[05:03] Team_066 possession (Score: 30-42)
Pau Curry attempts a Midrange. Contested by Bam Leonard (3.8 feet, ZONE). Pau Curry misses. Rebound secured by Bam Leonard.

[04:46] Team_020 possession (Score: 30-42)
Terry Simons attempts a 3Pt. Wide open! Brandon Reaves is 6.4 feet away. [MAN] TERRY SIMONS MAKES IT! Assist: Trae Curry
Score: 30-45

[04:36] Team_066 possession (Score: 30-45)
Kyle Wagner attempts a Layup. Contested by Trae Curry (5.6 feet, ZONE). KYLE WAGNER MAKES IT! Assist: Pau Curry
Score: 32-45

[04:22] Team_020 possession (Score: 32-45)
Jarrett McCollum attempts a Layup. Contested by Jimmy Davis (5.2 feet, MAN). JARRETT MCCOLLUM MAKES IT!
Score: 32-47

[04:07] Team_066 possession (Score: 32-47)
Yao Brogdon attempts a Layup. BLOCKED BY BAM LEONARD! Ball is loose! Rebound secured by Terry Simons.

[03:52] Team_020 possession (Score: 32-47)
Trae Curry drives, Kyle Wagner stays with him. Trae Curry attempts a Dunk. Contested by Kyle Wagner (5.2 feet, MAN). Trae Curry misses. Rebound secured by Kyle Wagner.

[03:38] Team_066 possession (Score: 32-47)
Yao Brogdon drives, Bam Leonard stays with him. Yao Brogdon attempts a Dunk. Contested by Bam Leonard (4.2 feet, MAN). YAO BROGDON MAKES IT!
Score: 34-47

[03:25] Team_020 possession (Score: 34-47)
Bam Leonard drives and kicks out. Jarrett McCollum attempts a Midrange. Contested by Jimmy Davis (5.4 feet, MAN). JARRETT MCCOLLUM MAKES IT! Assist: Bam Leonard
Score: 34-49

[03:09] Team_066 possession (Score: 34-49)
FOUL! Offensive foul on Kyle Wagner! Bam Leonard drew the charge! [Team fouls: 2] (Kyle Wagner: 1 personal fouls) TURNOVER! (dead ball)

[02:53] Team_020 possession (Score: 34-49)
Bam Leonard attempts a Midrange. Wide open! Yao Brogdon is 6.5 feet away. [ZONE] BAM LEONARD MAKES IT!
Score: 34-51

[02:37] Team_066 possession (Score: 34-51)
Jimmy Davis drives, Trae Curry stays with him. Jimmy Davis attempts a Dunk. Wide open! Trae Curry is 6.3 feet away. [ZONE] JIMMY DAVIS MAKES IT! Assist: Pau Curry
Score: 36-51

[02:19] Team_020 possession (Score: 36-51)
Terry Simons loses control! Ball rolls out of bounds! TURNOVER! (dead ball)

[02:19] Substitution (Team_066): Jimmy Davis OUT → Pascal Carter IN (stamina_rule2)

[02:19] Substitution (Team_066): Pau Curry OUT → Lauri LaVine IN (stamina_rule2)

[02:19] Substitution (Team_066): Brandon Reaves OUT → Brandon Middleton IN (stamina_rule2)

[02:19] Substitution (Team_066): Yao Brogdon OUT → Cole Morant IN (stamina_rule2)

[02:19] Substitution (Team_066): Kyle Wagner OUT → Donovan Simmons IN (stamina_rule2)

[02:19] Substitution (Team_020): Jarrett McCollum OUT → Franz Doncic IN (stamina_rule2)

[02:19] Substitution (Team_020): James Cunningham OUT → Stephen Parker IN (stamina_rule2)

[02:19] Substitution (Team_020): Terry Simons OUT → Victor Holiday IN (stamina_rule2)

[02:19] Substitution (Team_020): Bam Leonard OUT → Cole Barnes IN (stamina_rule2)

[02:19] Substitution (Team_020): Trae Curry OUT → Miles Siakam IN (stamina_rule2)

[02:02] Team_066 possession (Score: 36-51)
FOUL! Reach-in foul on Miles Siakam during the drive. [IN THE BONUS! 5 team fouls] Donovan Simmons to the line for 2 free throws. (Miles Siakam: 1 personal fouls)   FT 1/2: GOOD   FT 2/2: MISS Donovan Simmons makes 1/2 from the line. Offensive rebound by Donovan Simmons! Donovan Simmons kicks it out.
Score: 37-51

[01:44] Team_066 possession (Score: 37-51)
Brandon Middleton attempts a Layup. BLOCKED BY FRANZ DONCIC! Ball is loose! Offensive rebound by Donovan Simmons! Donovan Simmons kicks it out.

[01:26] Team_066 possession (Score: 37-51)
Cole Morant attempts a Midrange. Contested by Stephen Parker (5.9 feet, ZONE). Cole Morant misses. Rebound secured by Victor Holiday.

[01:10] Team_020 possession (Score: 37-51)
FOUL! Shooting foul on Lauri LaVine. Victor Holiday to the line for 2 free throws. [Team fouls: 3] (Lauri LaVine: 1 personal fouls)   FT 1/2: GOOD   FT 2/2: GOOD Victor Holiday makes 2/2 from the line.
Score: 37-53

[00:55] Team_066 possession (Score: 37-53)
Lauri LaVine attempts a 3Pt. Contested by Stephen Parker (5.5 feet, MAN). Lauri LaVine misses. Rebound secured by Miles Siakam.

[00:43] Team_020 possession (Score: 37-53)
Franz Doncic attempts a 3Pt. Contested by Lauri LaVine (3.5 feet, ZONE). Franz Doncic misses. Offensive rebound by Miles Siakam! Miles Siakam kicks it out.

[00:29] Team_020 possession (Score: 37-53)
Franz Doncic drives to the basket... Franz Doncic loses the ball! Stripped by Donovan Simmons! TURNOVER! (live ball)

[00:15] Team_066 possession (Score: 37-53)
Cole Morant throws a bad pass! Stolen by Cole Barnes! TURNOVER! (live ball)

[00:02] Team_020 possession (Score: 37-53)
Victor Holiday attempts a 3Pt. Contested by Lauri LaVine (4.3 feet, ZONE). Victor Holiday misses. Rebound secured by Donovan Simmons.

================================================================================
                              2ND QUARTER COMPLETE                              
================================================================================

2ND QUARTER SCORE: Team_066 18, Team_020 23

BOX SCORE:
================================================================================

Team_066
--------------------------------------------------------------------------------
Player                MIN  PTS  REB  AST  TO      FG   FG%      3P   3P%
--------------------------------------------------------------------------------
Brandon Reaves         21    5    0    0   0   2/3    66.7     0/0   0.0
Jimmy Davis            21    5    0    0   0   2/3    66.7     0/0   0.0
Yao Brogdon            21    4    2    0   0   2/5    40.0     0/0   0.0
Kyle Wagner            21    2    7    0   0   1/2    50.0     0/0   0.0
Pau Curry              21    1    0    2   0   1/3    33.3     0/0   0.0
Donovan Simmons         4    0    3    0   0   0/0     0.0     0/0   0.0
Cole Morant             4    0    0    0   0   0/1     0.0     0/0   0.0
Lauri LaVine            4    0    0    0   0   0/1     0.0     0/0   0.0

TEAM: FG: 8/18 (44.4%), 3PT: 0/3 (0.0%), REB: 12 (3 off, 9 def), AST: 2, TO: 3
TEAM FOULS: 3


Team_020
--------------------------------------------------------------------------------
Player                MIN  PTS  REB  AST  TO      FG   FG%      3P   3P%
--------------------------------------------------------------------------------
Terry Simons           21    8    3    0   0   3/4    75.0     0/0   0.0
Jarrett McCollum       21    6    0    1   0   3/5    60.0     0/0   0.0
Bam Leonard            21    4    3    4   0   2/3    66.7     0/0   0.0
Trae Curry             21    2    4    1   0   1/3    33.3     0/0   0.0
Victor Holiday          4    2    1    0   0   1/2    50.0     0/0   0.0
James Cunningham       21    0    0    0   0   0/2     0.0     0/0   0.0
Miles Siakam            4    0    2    0   0   0/0     0.0     0/0   0.0

TEAM: FG: 10/19 (52.6%), 3PT: 2/6 (33.3%), REB: 13 (3 off, 10 def), AST: 6, TO: 2
TEAM FOULS: 5 [Team_066 in BONUS]

================================================================================

================================================================================
                       3RD QUARTER - Team_066 vs Team_020                       
================================================================================

[12:00] Team_066 possession (Score: 37-53)
Yao Brogdon drives and kicks out. Yao Brogdon attempts a Midrange. Contested by Trae Curry (4.6 feet, ZONE). Yao Brogdon misses. Rebound secured by Terry Simons.

[11:48] Team_020 possession (Score: 37-53)
Bam Leonard attempts a Midrange. Contested by Jimmy Davis (4.2 feet, ZONE). Bam Leonard misses. Rebound secured by Kyle Wagner.

[11:36] Team_066 possession (Score: 37-53)
Jimmy Davis attempts a Midrange. Contested by Jarrett McCollum (4.8 feet, MAN). Jimmy Davis misses. Rebound secured by Terry Simons.

[11:21] Team_020 possession (Score: 37-53)
Terry Simons attempts a Layup. BLOCKED BY JIMMY DAVIS! Ball goes out off Jimmy Davis. Terry Simons's ball!

[11:06] Team_020 possession (Score: 37-53)
Bam Leonard attempts a 3Pt. Contested by Pau Curry (5.8 feet, ZONE). Bam Leonard misses. Rebound secured by Brandon Reaves.

[10:49] Team_066 possession (Score: 37-53)
Pau Curry drives and kicks out. Brandon Reaves attempts a 3Pt. Contested by Bam Leonard (2.3 feet, ZONE). Brandon Reaves misses. Offensive rebound by Kyle Wagner! Kyle Wagner kicks it out.

[10:34] Team_066 possession (Score: 37-53)
Jimmy Davis throws a bad pass! Stolen by Jarrett McCollum! TURNOVER! (live ball)

[10:19] Team_020 possession (Score: 37-53)
Jarrett McCollum drives to the basket... Jarrett McCollum commits a violation (traveling/carry)! TURNOVER! (dead ball)

[10:07] Team_066 possession (Score: 37-53)
Jimmy Davis attempts a 3Pt. Contested by Jarrett McCollum (4.8 feet, MAN). Jimmy Davis misses. Rebound secured by Trae Curry.

[09:56] Team_020 possession (Score: 37-53)
Trae Curry drives and kicks out. Terry Simons attempts a 3Pt. Contested by Brandon Reaves (5.1 feet, MAN). Terry Simons misses. Rebound secured by Brandon Reaves.

[09:38] Team_066 possession (Score: 37-53)
Jimmy Davis attempts a 3Pt. Contested by Jarrett McCollum (4.8 feet, MAN). JIMMY DAVIS MAKES IT! Assist: Pau Curry
Score: 40-53

[09:25] Team_020 possession (Score: 40-53)
Jarrett McCollum attempts a 3Pt. Contested by Pau Curry (5.6 feet, ZONE). Jarrett McCollum misses. Rebound secured by Yao Brogdon.

[09:09] Team_066 possession (Score: 40-53)
Yao Brogdon attempts a Midrange. Contested by Bam Leonard (2.7 feet, MAN). Yao Brogdon misses. Rebound secured by Trae Curry.

[08:58] Team_020 possession (Score: 40-53)
FOUL! Reach-in foul on Kyle Wagner during the drive. [Team fouls: 1] No free throws, side out. (Kyle Wagner: 1 personal fouls)

[08:45] Team_020 possession (Score: 40-53)
Trae Curry attempts a Midrange. Contested by Kyle Wagner (4.3 feet, MAN). Trae Curry misses. Rebound secured by Kyle Wagner.

[08:28] Team_066 possession (Score: 40-53)
Brandon Reaves attempts a 3Pt. Contested by Bam Leonard (2.8 feet, ZONE). Brandon Reaves misses. Rebound secured by Trae Curry.

[08:12] Team_020 possession (Score: 40-53)
Bam Leonard attempts a Midrange. Contested by Yao Brogdon (5.4 feet, ZONE). BAM LEONARD MAKES IT! Assist: Jarrett McCollum
Score: 40-55

[08:00] Team_066 possession (Score: 40-55)
Kyle Wagner drives to the basket... Kyle Wagner throws a bad pass! Stolen by Bam Leonard! TURNOVER! (live ball)

[07:43] Team_020 possession (Score: 40-55)
Trae Curry attempts a 3Pt. Contested by Brandon Reaves (5.5 feet, ZONE). Trae Curry misses. Rebound secured by Kyle Wagner.

[07:30] Team_066 possession (Score: 40-55)
Yao Brogdon attempts a 3Pt. Contested by Bam Leonard (2.7 feet, ZONE). Yao Brogdon misses. Rebound secured by Trae Curry.

[07:15] Team_020 possession (Score: 40-55)
Trae Curry drives, Kyle Wagner stays with him. Trae Curry attempts a Layup. Contested by Kyle Wagner (4.3 feet, MAN). TRAE CURRY MAKES IT! Assist: Jarrett McCollum
Score: 40-57

[07:03] Team_066 possession (Score: 40-57)
Brandon Reaves attempts a Midrange. Contested by Terry Simons (4.7 feet, MAN). Brandon Reaves misses. Rebound secured by Terry Simons.

[06:49] Team_020 possession (Score: 40-57)
Trae Curry drives and kicks out. Jarrett McCollum attempts a Midrange. Contested by Pau Curry (5.5 feet, ZONE). Jarrett McCollum misses. Rebound secured by Yao Brogdon.

[06:36] Team_066 possession (Score: 40-57)
Kyle Wagner attempts a Layup. BLOCKED BY BAM LEONARD! Ball is loose! Rebound secured by Terry Simons.

[06:21] Team_020 possession (Score: 40-57)
FOUL! Shooting foul on Jimmy Davis. Bam Leonard to the line for 2 free throws. [Team fouls: 2] (Jimmy Davis: 1 personal fouls)   FT 1/2: GOOD   FT 2/2: GOOD Bam Leonard makes 2/2 from the line.
Score: 40-59

[06:05] Team_066 possession (Score: 40-59)
Pau Curry attempts a 3Pt. Contested by Bam Leonard (2.6 feet, ZONE). PAU CURRY MAKES IT!
Score: 43-59

[05:52] Team_020 possession (Score: 43-59)
James Cunningham drives and kicks out. James Cunningham attempts a 3Pt. Contested by Pau Curry (5.5 feet, ZONE). JAMES CUNNINGHAM MAKES IT! Assist: Terry Simons
Score: 43-62

[05:38] Team_066 possession (Score: 43-62)
Brandon Reaves attempts a Layup. Contested by Trae Curry (5.1 feet, ZONE). Brandon Reaves misses. Rebound secured by Trae Curry.

[05:24] Team_020 possession (Score: 43-62)
James Cunningham drives, Kyle Wagner stays with him. James Cunningham attempts a Dunk. Contested by Kyle Wagner (4.2 feet, ZONE). JAMES CUNNINGHAM MAKES IT! Assist: Jarrett McCollum
Score: 43-64

[05:12] Team_066 possession (Score: 43-64)
Kyle Wagner attempts a Midrange. Contested by Terry Simons (4.1 feet, ZONE). Kyle Wagner misses. Rebound secured by Terry Simons.

[04:57] Team_020 possession (Score: 43-64)
FOUL! Reach-in foul on Yao Brogdon during the drive. [Team fouls: 3] No free throws, side out. (Yao Brogdon: 1 personal fouls)

[04:44] Team_020 possession (Score: 43-64)
Jarrett McCollum attempts a 3Pt. Contested by Pau Curry (5.7 feet, ZONE). Jarrett McCollum misses. Rebound secured by Yao Brogdon.

[04:30] Team_066 possession (Score: 43-64)
Yao Brogdon attempts a Midrange. Contested by Terry Simons (4.8 feet, ZONE). YAO BROGDON MAKES IT! Assist: Jimmy Davis
Score: 45-64

[04:19] Team_020 possession (Score: 45-64)
Bam Leonard attempts a 3Pt. Contested by Pau Curry (5.9 feet, ZONE). Bam Leonard misses. Offensive rebound by Bam Leonard! Bam Leonard puts it back in!
Score: 45-66

[04:04] Team_066 possession (Score: 45-66)
Yao Brogdon commits a violation (traveling/carry)! TURNOVER! (dead ball)

[03:47] Team_020 possession (Score: 45-66)
Jarrett McCollum attempts a Midrange. Contested by Kyle Wagner (4.1 feet, ZONE). Jarrett McCollum misses. Rebound secured by Yao Brogdon.

[03:31] Team_066 possession (Score: 45-66)
Jimmy Davis drives and kicks out. Jimmy Davis attempts a Midrange. Contested by Terry Simons (4.4 feet, ZONE). JIMMY DAVIS MAKES IT! Assist: Pau Curry
Score: 47-66

[03:16] Team_020 possession (Score: 47-66)
Bam Leonard attempts a Layup. Contested by Kyle Wagner (4.4 feet, ZONE). BAM LEONARD MAKES IT!
Score: 47-68

[03:04] Team_066 possession (Score: 47-68)
FOUL! Shooting foul on Trae Curry. Kyle Wagner to the line for 2 free throws. [Team fouls: 1] (Trae Curry: 1 personal fouls)   FT 1/2: GOOD   FT 2/2: MISS Kyle Wagner makes 1/2 from the line. Rebound secured by Trae Curry.
Score: 48-68

[02:51] Team_020 possession (Score: 48-68)
FOUL! Reach-in foul on Kyle Wagner during the drive. [Team fouls: 4] No free throws, side out. (Kyle Wagner: 2 personal fouls)

[02:37] Team_020 possession (Score: 48-68)
James Cunningham attempts a Midrange. Contested by Yao Brogdon (5.7 feet, ZONE). James Cunningham misses. Rebound secured by Brandon Reaves.

[02:22] Team_066 possession (Score: 48-68)
Kyle Wagner attempts a Layup. BLOCKED BY JARRETT MCCOLLUM! Ball is loose! Rebound secured by Terry Simons.

[02:07] Team_020 possession (Score: 48-68)
James Cunningham attempts a 3Pt. Wide open! Pau Curry is 6.1 feet away. [ZONE] JAMES CUNNINGHAM MAKES IT! Assist: Bam Leonard
Score: 48-71

[01:52] Team_066 possession (Score: 48-71)
Jimmy Davis attempts a 3Pt. Contested by Jarrett McCollum (5.1 feet, MAN). Jimmy Davis misses. Offensive rebound by Kyle Wagner! Kyle Wagner kicks it out.

[01:39] Team_066 possession (Score: 48-71)
FOUL! Shooting foul on Bam Leonard. Kyle Wagner to the line for 2 free throws. [Team fouls: 2] (Bam Leonard: 1 personal fouls)   FT 1/2: GOOD   FT 2/2: MISS Kyle Wagner makes 1/2 from the line. Rebound secured by Bam Leonard.
Score: 49-71

[01:21] Team_020 possession (Score: 49-71)
FOUL! Reach-in foul on Kyle Wagner during the drive. [IN THE BONUS! 5 team fouls] Trae Curry to the line for 2 free throws. (Kyle Wagner: 3 personal fouls)   FT 1/2: GOOD   FT 2/2: MISS Trae Curry makes 1/2 from the line. Offensive rebound by Trae Curry! Trae Curry's putback is no good.
Score: 49-72

[01:09] Team_066 possession (Score: 49-72)
Jimmy Davis makes the Layup and draws the foul on Trae Curry! And-1! Jimmy Davis to the line for 1. [Team fouls: 3] (Trae Curry: 2 personal fouls)   FT 1/1: GOOD Jimmy Davis makes 1/1 from the line.
Score: 52-72

[00:54] Team_020 possession (Score: 52-72)
Jarrett McCollum drives, Jimmy Davis stays with him. Jarrett McCollum attempts a Dunk. Contested by Jimmy Davis (4.6 feet, MAN). Jarrett McCollum misses. Offensive rebound by Trae Curry! Trae Curry's putback is no good. Rebound secured by Yao Brogdon.

[00:44] Team_066 possession (Score: 52-72)
Brandon Reaves drives to the basket... Brandon Reaves throws a bad pass out of bounds! TURNOVER! (dead ball)

[00:44] Substitution (Team_066): Jimmy Davis OUT → Pascal Carter IN (stamina_rule2)

[00:44] Substitution (Team_066): Pau Curry OUT → Lauri LaVine IN (stamina_rule2)

[00:44] Substitution (Team_066): Brandon Reaves OUT → Brandon Middleton IN (stamina_rule2)

[00:44] Substitution (Team_066): Yao Brogdon OUT → Cole Morant IN (stamina_rule2)

[00:44] Substitution (Team_066): Kyle Wagner OUT → Donovan Simmons IN (stamina_rule2)

[00:44] Substitution (Team_020): Jarrett McCollum OUT → Franz Doncic IN (stamina_rule2)

[00:44] Substitution (Team_020): James Cunningham OUT → Stephen Parker IN (stamina_rule2)

[00:44] Substitution (Team_020): Terry Simons OUT → Victor Holiday IN (stamina_rule2)

[00:44] Substitution (Team_020): Bam Leonard OUT → Cole Barnes IN (stamina_rule2)

[00:44] Substitution (Team_020): Trae Curry OUT → Miles Siakam IN (stamina_rule2)

[00:29] Team_020 possession (Score: 52-72)
Cole Barnes attempts a Layup. BLOCKED BY COLE MORANT! Ball is loose! Offensive rebound by Miles Siakam! Miles Siakam kicks it out.

[00:09] Team_020 possession (Score: 52-72)
Franz Doncic attempts a 3Pt. Contested by Lauri LaVine (3.5 feet, ZONE). Franz Doncic misses. Rebound secured by Donovan Simmons.

================================================================================
                              3RD QUARTER COMPLETE                              
================================================================================

3RD QUARTER SCORE: Team_066 15, Team_020 19

BOX SCORE:
================================================================================

Team_066
--------------------------------------------------------------------------------
Player                MIN  PTS  REB  AST  TO      FG   FG%      3P   3P%
--------------------------------------------------------------------------------
Jimmy Davis            32    8    0    1   0   3/5    60.0     0/0   0.0
Pau Curry              32    3    0    2   0   1/1   100.0     0/0   0.0
Trae Curry             32    2    7    0   0   1/6    16.7     0/0   0.0
Kyle Wagner            32    0    5    0   0   0/5     0.0     0/0   0.0
Brandon Reaves         32    0    3    0   0   0/3     0.0     0/0   0.0
Donovan Simmons         4    0    1    0   0   0/0     0.0     0/0   0.0

TEAM: FG: 5/18 (27.8%), 3PT: 2/5 (40.0%), REB: 14 (2 off, 12 def), AST: 3, TO: 4
TEAM FOULS: 5 [Team_020 in BONUS]


Team_020
--------------------------------------------------------------------------------
Player                MIN  PTS  REB  AST  TO      FG   FG%      3P   3P%
--------------------------------------------------------------------------------
Bam Leonard            32    8    2    1   0   4/6    66.7     0/0   0.0
James Cunningham       32    8    0    0   0   3/4    75.0     0/0   0.0
Yao Brogdon            32    2    5    0   0   1/4    25.0     0/0   0.0
Terry Simons           32    0    6    1   0   0/0     0.0     0/0   0.0
Jarrett McCollum       32    0    0    3   0   0/4     0.0     0/0   0.0
Miles Siakam            4    0    1    0   0   0/0     0.0     0/0   0.0
Franz Doncic            4    0    0    0   0   0/1     0.0     0/0   0.0

TEAM: FG: 8/21 (38.1%), 3PT: 2/7 (28.6%), REB: 16 (3 off, 13 def), AST: 5, TO: 1
TEAM FOULS: 3

================================================================================

================================================================================
                       4TH QUARTER - Team_066 vs Team_020                       
================================================================================

[12:00] Substitution (Team_066): Jimmy Davis OUT (stamina: 69) → Pascal Carter IN (comeback_detected)

[12:00] Substitution (Team_020): Jarrett McCollum OUT (stamina: 70) → Franz Doncic IN (comeback_detected)

[12:00] Team_066 possession (Score: 52-72)
Yao Brogdon throws a bad pass! Stolen by Bam Leonard! TURNOVER! (live ball)

[11:46] Team_020 possession (Score: 52-72)
James Cunningham attempts a Midrange. Wide open! Pau Curry is 6.0 feet away. [MAN] James Cunningham misses. Offensive rebound by Trae Curry! Trae Curry's putback is no good. Offensive rebound by Bam Leonard! Bam Leonard kicks it out.

[11:32] Team_020 possession (Score: 52-72)
Franz Doncic attempts a Midrange. Wide open! Pascal Carter is 6.3 feet away. [MAN] Franz Doncic misses. Rebound secured by Brandon Reaves.

[11:18] Team_066 possession (Score: 52-72)
Pau Curry attempts a Midrange. Contested by James Cunningham (5.5 feet, MAN). Pau Curry misses. Rebound secured by Terry Simons.

[11:01] Team_020 possession (Score: 52-72)
Terry Simons attempts a 3Pt. Wide open! Pau Curry is 6.4 feet away. [ZONE] TERRY SIMONS MAKES IT! Assist: Franz Doncic
Score: 52-75

[10:44] Team_066 possession (Score: 52-75)
Pau Curry attempts a Midrange. Contested by Trae Curry (5.3 feet, ZONE). Pau Curry misses. Rebound secured by Bam Leonard.

[10:26] Team_020 possession (Score: 52-75)
Franz Doncic attempts a Midrange. Wide open! Pascal Carter is 6.3 feet away. [MAN] FRANZ DONCIC MAKES IT!
Score: 52-77

[10:15] Team_066 possession (Score: 52-77)
Kyle Wagner attempts a 3Pt. Contested by Bam Leonard (2.8 feet, MAN). Kyle Wagner misses. Rebound secured by Terry Simons.

[10:03] Team_020 possession (Score: 52-77)
Terry Simons attempts a 3Pt. Wide open! Brandon Reaves is 6.0 feet away. [MAN] Terry Simons misses. Rebound secured by Kyle Wagner.

[09:51] Team_066 possession (Score: 52-77)
Yao Brogdon drives to the basket... Yao Brogdon loses control! Ball rolls out of bounds! TURNOVER! (dead ball)

[09:51] Substitution (Team_066): Pau Curry OUT → Lauri LaVine IN (stamina_rule2)

[09:51] Substitution (Team_066): Brandon Reaves OUT → Brandon Middleton IN (stamina_rule2)

[09:51] Substitution (Team_066): Yao Brogdon OUT → Cole Morant IN (stamina_rule2)

[09:51] Substitution (Team_066): Kyle Wagner OUT → Donovan Simmons IN (stamina_rule2)

[09:51] Substitution (Team_020): James Cunningham OUT → Stephen Parker IN (stamina_rule2)

[09:51] Substitution (Team_020): Terry Simons OUT → Victor Holiday IN (stamina_rule2)

[09:51] Substitution (Team_020): Bam Leonard OUT → Cole Barnes IN (stamina_rule2)

[09:51] Substitution (Team_020): Trae Curry OUT → Miles Siakam IN (stamina_rule2)

[09:35] Team_020 possession (Score: 52-77)
Miles Siakam attempts a Midrange. Contested by Cole Morant (5.7 feet, ZONE). MILES SIAKAM MAKES IT!
Score: 52-79

[09:23] Team_066 possession (Score: 52-79)
Pascal Carter drives to the basket... Pascal Carter commits a violation (traveling/carry)! TURNOVER! (dead ball)

[09:10] Team_020 possession (Score: 52-79)
Cole Barnes drives and kicks out. Stephen Parker attempts a 3Pt. Contested by Brandon Middleton (5.1 feet, ZONE). Stephen Parker misses. Rebound secured by Lauri LaVine.

[08:58] Team_066 possession (Score: 52-79)
Lauri LaVine attempts a 3Pt. Contested by Stephen Parker (5.5 feet, ZONE). LAURI LAVINE MAKES IT! Assist: Pascal Carter
Score: 55-79

[08:42] Team_020 possession (Score: 55-79)
Stephen Parker attempts a Layup. Contested by Donovan Simmons (5.0 feet, ZONE). STEPHEN PARKER MAKES IT!
Score: 55-81

[08:27] Team_066 possession (Score: 55-81)
Cole Morant attempts a Midrange. Contested by Cole Barnes (5.5 feet, MAN). COLE MORANT MAKES IT! Assist: Brandon Middleton
Score: 57-81

[08:12] Team_020 possession (Score: 57-81)
Stephen Parker attempts a 3Pt. Contested by Lauri LaVine (4.1 feet, ZONE). Stephen Parker misses. Offensive rebound by Miles Siakam! Miles Siakam kicks it out.

[07:53] Team_020 possession (Score: 57-81)
Victor Holiday attempts a Midrange. Contested by Brandon Middleton (5.5 feet, ZONE). VICTOR HOLIDAY MAKES IT! Assist: Franz Doncic
Score: 57-83

[07:35] Team_066 possession (Score: 57-83)
Cole Morant drives, Miles Siakam stays with him. Cole Morant attempts a Dunk. Contested by Miles Siakam (4.5 feet, ZONE). COLE MORANT MAKES IT! Assist: Donovan Simmons
Score: 59-83

[07:18] Team_020 possession (Score: 59-83)
Stephen Parker attempts a Midrange. Contested by Lauri LaVine (4.1 feet, ZONE). Stephen Parker misses. Rebound secured by Brandon Middleton.

[07:04] Team_066 possession (Score: 59-83)
Lauri LaVine attempts a 3Pt. Contested by Stephen Parker (5.5 feet, ZONE). Lauri LaVine misses. FOUL! Loose ball foul on Victor Holiday during the rebound battle. [Team fouls: 1] No free throws, side out. (Victor Holiday: 1 personal fouls)

[06:49] Team_066 possession (Score: 59-83)
Brandon Middleton attempts a 3Pt. Contested by Victor Holiday (4.0 feet, MAN). Brandon Middleton misses. Rebound secured by Victor Holiday.

[06:35] Team_020 possession (Score: 59-83)
Stephen Parker attempts a 3Pt. Contested by Lauri LaVine (4.1 feet, MAN). Stephen Parker misses. Rebound secured by Brandon Middleton.

[06:21] Team_066 possession (Score: 59-83)
Donovan Simmons drives, picks up Miles Siakam. Help arrives from Franz Doncic! Donovan Simmons attempts a Layup. Contested by Franz Doncic (4.0 feet, MAN). DONOVAN SIMMONS MAKES IT! Assist: Pascal Carter
Score: 61-83

[06:11] Team_020 possession (Score: 61-83)
Franz Doncic drives to the basket... Franz Doncic throws a bad pass! Stolen by Pascal Carter! TURNOVER! (live ball)

[06:01] Team_066 possession (Score: 61-83)
Lauri LaVine attempts a 3Pt. Contested by Stephen Parker (5.5 feet, MAN). Lauri LaVine misses. Offensive rebound by Donovan Simmons! Donovan Simmons kicks it out.

[05:50] Team_066 possession (Score: 61-83)
Brandon Middleton attempts a 3Pt. Contested by Victor Holiday (4.0 feet, MAN). Brandon Middleton misses. Offensive rebound by Lauri LaVine! Lauri LaVine kicks it out.

[05:36] Team_066 possession (Score: 61-83)
Brandon Middleton drives and kicks out. Cole Morant attempts a 3Pt. Contested by Victor Holiday (4.2 feet, ZONE). COLE MORANT MAKES IT! Assist: Brandon Middleton
Score: 64-83

[05:19] Team_020 possession (Score: 64-83)
FOUL! Reach-in foul on Donovan Simmons during the drive. [Team fouls: 1] No free throws, side out. (Donovan Simmons: 1 personal fouls)

[05:08] Team_020 possession (Score: 64-83)
FOUL! Reach-in foul on Donovan Simmons during the drive. [Team fouls: 2] No free throws, side out. (Donovan Simmons: 2 personal fouls)

[04:54] Team_020 possession (Score: 64-83)
Franz Doncic drives to the basket... Franz Doncic throws a bad pass out of bounds! TURNOVER! (dead ball)

[04:40] Team_066 possession (Score: 64-83)
FOUL! Reach-in foul on Miles Siakam during the drive. [Team fouls: 2] No free throws, side out. (Miles Siakam: 1 personal fouls)

[04:22] Team_066 possession (Score: 64-83)
Pascal Carter throws a bad pass! Stolen by Franz Doncic! TURNOVER! (live ball)

[04:08] Team_020 possession (Score: 64-83)
Franz Doncic attempts a 3Pt. Wide open! Pascal Carter is 6.4 feet away. [MAN] Franz Doncic misses. FOUL! Loose ball foul on Brandon Middleton during the rebound battle. [Team fouls: 3] No free throws, side out. (Brandon Middleton: 1 personal fouls)

[03:55] Team_020 possession (Score: 64-83)
Franz Doncic attempts a 3Pt. Wide open! Pascal Carter is 6.4 feet away. [MAN] FRANZ DONCIC MAKES IT!
Score: 64-86

[03:41] Team_066 possession (Score: 64-86)
Cole Morant attempts a Midrange. Contested by Franz Doncic (4.6 feet, ZONE). Cole Morant misses. Offensive rebound by Lauri LaVine! Lauri LaVine kicks it out.

[03:29] Team_066 possession (Score: 64-86)
Pascal Carter attempts a 3Pt. Contested by Stephen Parker (5.5 feet, ZONE). Pascal Carter misses. Rebound secured by Cole Barnes.

[03:18] Team_020 possession (Score: 64-86)
Stephen Parker attempts a Midrange. Contested by Lauri LaVine (4.1 feet, ZONE). Stephen Parker misses. Rebound secured by Brandon Middleton.

[03:07] Team_066 possession (Score: 64-86)
Lauri LaVine drives and kicks out. Pascal Carter attempts a 3Pt. Contested by Stephen Parker (5.4 feet, ZONE). Pascal Carter misses. Rebound secured by Victor Holiday.

[02:54] Team_020 possession (Score: 64-86)
Franz Doncic drives, Donovan Simmons stays with him. Franz Doncic attempts a Layup. Contested by Donovan Simmons (4.5 feet, ZONE). Franz Doncic misses. Rebound secured by Donovan Simmons.

[02:41] Team_066 possession (Score: 64-86)
Cole Morant drives, Cole Barnes stays with him. Cole Morant attempts a Dunk. Contested by Cole Barnes (5.5 feet, MAN). COLE MORANT MAKES IT! Assist: Brandon Middleton
Score: 66-86

[02:23] Team_020 possession (Score: 66-86)
Victor Holiday attempts a Layup. Contested by Brandon Middleton (5.6 feet, MAN). Victor Holiday misses. Rebound secured by Lauri LaVine.

[02:08] Team_066 possession (Score: 66-86)
Cole Morant attempts a Midrange. Contested by Cole Barnes (5.6 feet, MAN). Cole Morant misses. Rebound secured by Victor Holiday.

[01:50] Team_020 possession (Score: 66-86)
Victor Holiday makes the Layup and draws the foul on Donovan Simmons! And-1! Victor Holiday to the line for 1. [Team fouls: 4] (Donovan Simmons: 3 personal fouls)   FT 1/1: MISS Victor Holiday makes 0/1 from the line. Rebound secured by Lauri LaVine.
Score: 66-88

[01:39] Team_066 possession (Score: 66-88)
FOUL! Shooting foul on Cole Barnes. Cole Morant to the line for 2 free throws. [Team fouls: 3] (Cole Barnes: 1 personal fouls)   FT 1/2: GOOD   FT 2/2: GOOD Cole Morant makes 2/2 from the line.
Score: 68-88

[01:25] Team_020 possession (Score: 68-88)
FOUL! Shooting foul on Donovan Simmons. Miles Siakam to the line for 2 free throws. [BONUS: 5 team fouls] (Donovan Simmons: 4 personal fouls)   FT 1/2: GOOD   FT 2/2: GOOD Miles Siakam makes 2/2 from the line.
Score: 68-90

[01:08] Team_066 possession (Score: 68-90)
Pascal Carter commits a violation (traveling/carry)! TURNOVER! (dead ball)

[00:52] Team_020 possession (Score: 68-90)
Cole Barnes drives, Donovan Simmons stays with him. Cole Barnes attempts a Layup. Contested by Donovan Simmons (5.2 feet, ZONE). COLE BARNES MAKES IT!
Score: 68-92

[00:38] Team_066 possession (Score: 68-92)
Brandon Middleton attempts a Midrange. BLOCKED BY VICTOR HOLIDAY! Ball is loose! Rebound secured by Miles Siakam.

[00:24] Team_020 possession (Score: 68-92)
Stephen Parker attempts a 3Pt. Contested by Lauri LaVine (4.4 feet, ZONE). STEPHEN PARKER MAKES IT!
Score: 68-95

[00:07] Team_066 possession (Score: 68-95)
Brandon Middleton attempts a Midrange. Contested by Victor Holiday (4.3 feet, ZONE). BRANDON MIDDLETON MAKES IT! Assist: Cole Morant
Score: 70-95

================================================================================
                              4TH QUARTER COMPLETE                              
================================================================================

4TH QUARTER SCORE: Team_066 18, Team_020 23

BOX SCORE:
================================================================================

Team_066
--------------------------------------------------------------------------------
Player                MIN  PTS  REB  AST  TO      FG   FG%      3P   3P%
--------------------------------------------------------------------------------
Cole Morant            14   11    0    1   0   5/6    83.3     0/0   0.0
Lauri LaVine           14    3    6    0   0   1/2    50.0     0/0   0.0
Brandon Middleton      14    2    3    3   0   1/3    33.3     0/0   0.0
Donovan Simmons        14    2    2    1   0   1/1   100.0     0/0   0.0
Brandon Reaves         35    0    1    0   0   0/0     0.0     0/0   0.0
Pau Curry              35    0    0    0   0   0/2     0.0     0/0   0.0
Kyle Wagner            35    0    1    0   0   0/1     0.0     0/0   0.0
Pascal Carter          16    0    0    2   0   0/1     0.0     0/0   0.0

TEAM: FG: 8/16 (50.0%), 3PT: 1/4 (25.0%), REB: 13 (4 off, 9 def), AST: 7, TO: 5
TEAM FOULS: 5 [Team_020 in BONUS]


Team_020
--------------------------------------------------------------------------------
Player                MIN  PTS  REB  AST  TO      FG   FG%      3P   3P%
--------------------------------------------------------------------------------
Franz Doncic           16    5    0    2   0   2/4    50.0     0/0   0.0
Stephen Parker         14    5    0    0   0   2/5    40.0     0/0   0.0
Miles Siakam           14    4    2    0   0   2/2   100.0     0/0   0.0
Terry Simons           35    3    2    0   0   1/2    50.0     0/0   0.0
Cole Barnes            14    2    2    0   0   1/2    50.0     0/0   0.0
Victor Holiday         14    2    3    0   0   1/3    33.3     0/0   0.0
Bam Leonard            35    0    2    0   0   0/0     0.0     0/0   0.0

TEAM: FG: 9/18 (50.0%), 3PT: 3/5 (60.0%), REB: 11 (3 off, 8 def), AST: 2, TO: 2
TEAM FOULS: 3

================================================================================

================================================================================
                               FULL GAME COMPLETE                               
================================================================================

FINAL SCORE: Team_066 70, Team_020 95

SCORING BY QUARTER:
--------------------------------------------------------------------------------
Team                     Q1     Q2     Q3     Q4    FINAL
--------------------------------------------------------------------------------
Team_066                 19     18     15     18       70
Team_020                 30     23     19     23       95
--------------------------------------------------------------------------------

FULL GAME BOX SCORE:
================================================================================

Team_066
--------------------------------------------------------------------------------
Player                MIN  PTS  REB  AST  TO      FG   FG%      3P   3P%      FT STL BLK
--------------------------------------------------------------------------------
Pau Curry              35    6    0    5   1   3/9    33.3   1/3    33.3   1/2     0   0
Brandon Reaves         35    5    9    0   0   2/6    33.3   0/1     0.0   1/1     0   0
Yao Brogdon            35   11   10    1   4   5/15   33.3   0/2     0.0   1/1     0   0
Kyle Wagner            35    3   14    0   3   2/10   20.0   0/1     0.0   3/8     0   0
Jimmy Davis            32   18    0    1   2   7/14   50.0   1/5    20.0   3/3     0   1
Pascal Carter          16    0    0    2   2   0/1     0.0   0/1     0.0   0/0     1   0
Lauri LaVine           14    3    6    0   0   2/4    50.0   1/2    50.0   0/0     0   0
Brandon Middleton      14    2    3    3   0   2/4    50.0   0/1     0.0   0/0     0   0
Cole Morant            14   11    0    1   1   4/6    66.7   0/0     0.0   2/2     0   1
Donovan Simmons        14    8    7    1   1   2/2   100.0   0/0     0.0   7/8     1   0

TEAM: FG: 30/72 (41.7%), 3PT: 3/16 (18.8%), REB: 49 (11 off, 38 def), AST: 14, TO: 14


Team_020
--------------------------------------------------------------------------------
Player                MIN  PTS  REB  AST  TO      FG   FG%      3P   3P%      FT STL BLK
--------------------------------------------------------------------------------
James Cunningham       35   13    0    1   0   5/10   50.0   2/4    50.0   0/0     0   0
Terry Simons           35   13   12    1   1   5/8    62.5   3/6    50.0   0/0     0   0
Bam Leonard            35   25   10    6   1  11/17   64.7   2/4    50.0   5/7     3   3
Trae Curry             35    8   18    3   2   4/11   36.4   0/1     0.0   1/3     1   2
Jarrett McCollum       32    9    0    6   0   3/10   30.0   1/5    20.0   0/0     2   1
Franz Doncic           16    5    0    2   1   2/5    40.0   1/2    50.0   0/0     1   1
Stephen Parker         14    5    0    0   0   2/5    40.0   1/2    50.0   0/0     0   0
Victor Holiday         14    4    4    0   1   2/6    33.3   0/2     0.0   2/3     0   1
Cole Barnes            14    4    3    0   1   2/3    66.7   0/0     0.0   0/0     1   0
Miles Siakam           14    4    5    0   0   2/2   100.0   0/0     0.0   2/2     0   0

TEAM: FG: 38/77 (49.4%), 3PT: 10/26 (38.5%), REB: 52 (11 off, 41 def), AST: 19, TO: 7

================================================================================
