================================================================================
                        FULL GAME - Team_017 vs Team_083                        
================================================================================

================================================================================
                       1ST QUARTER - Team_017 vs Team_083                       
================================================================================

[12:00] Team_017 possession (Score: 0-0)
FOUL! Shooting foul on Yao Oladipo. Tony Smith to the line for 3 free throws. [Team fouls: 1] (Yao Oladipo: 1 personal fouls)   FT 1/3: GOOD   FT 2/3: GOOD   FT 3/3: GOOD Tony Smith makes 3/3 from the line.
Score: 3-0

[11:44] Team_083 possession (Score: 3-0)
Kyrie Griffin drives, picks up Bam Williamson. Help arrives from Vince Banchero! Kyrie Griffin attempts a Layup. Contested by Vince Banchero (4.4 feet, ZONE). KYRIE GRIFFIN MAKES IT!
Score: 3-2

[11:29] Team_017 possession (Score: 3-2)
Kyrie Middleton attempts a 3Pt. Contested by Kyrie Griffin (3.7 feet, MAN). Kyrie Middleton misses. Rebound secured by Kyrie Griffin.

[11:16] Team_083 possession (Score: 3-2)
Kyrie Griffin drives, Kyrie Middleton stays with him. Kyrie Griffin attempts a Dunk. Contested by Kyrie Middleton (5.3 feet, MAN). KYRIE GRIFFIN MAKES IT! Assist: Karl Jokic
Score: 3-4

[11:03] Team_017 possession (Score: 3-4)
Desmond Reaves attempts a 3Pt. Contested by Malcolm Brogdon (5.3 feet, MAN). Desmond Reaves misses. Rebound secured by Yao Oladipo.

[10:47] Team_083 possession (Score: 3-4)
Yao Oladipo drives to the basket... Yao Oladipo throws a bad pass! Stolen by Bam Williamson! TURNOVER! (live ball)

[10:34] Team_017 possession (Score: 3-4)
Bam Williamson drives, Kyrie Griffin stays with him. Bam Williamson attempts a Dunk. Contested by Kyrie Griffin (4.1 feet, ZONE). BAM WILLIAMSON MAKES IT!
Score: 5-4

[10:17] Team_083 possession (Score: 5-4)
Kyrie Griffin attempts a Layup. Contested by Kyrie Middleton (5.3 feet, MAN). Kyrie Griffin misses. Offensive rebound by Bradley Thompson! Bradley Thompson puts it back in!
Score: 5-6

[10:07] Team_017 possession (Score: 5-6)
Kyrie Middleton drives and kicks out. Vince Banchero attempts a 3Pt. Contested by Malcolm Brogdon (4.8 feet, ZONE). Vince Banchero misses. Rebound secured by Yao Oladipo.

[09:52] Team_083 possession (Score: 5-6)
Kyrie Griffin attempts a Midrange. Contested by Kyrie Middleton (5.3 feet, ZONE). Kyrie Griffin misses. Rebound secured by Kyrie Middleton.

[09:39] Team_017 possession (Score: 5-6)
Bam Williamson drives and kicks out. Tony Smith attempts a Midrange. Contested by Bradley Thompson (3.7 feet, ZONE). Tony Smith misses. Rebound secured by Bradley Thompson.

[09:20] Team_083 possession (Score: 5-6)
Bradley Thompson attempts a Layup. Contested by Bam Williamson (4.1 feet, MAN). BRADLEY THOMPSON MAKES IT!
Score: 5-8

[09:07] Team_017 possession (Score: 5-8)
Tony Smith attempts a 3Pt. Contested by Yao Oladipo (3.9 feet, ZONE). Tony Smith misses. Rebound secured by Yao Oladipo.

[08:51] Team_083 possession (Score: 5-8)
Bradley Thompson drives, Bam Williamson stays with him. Bradley Thompson attempts a Dunk. Contested by Bam Williamson (4.1 feet, MAN). BRADLEY THOMPSON MAKES IT!
Score: 5-10

[08:34] Team_017 possession (Score: 5-10)
Kyrie Middleton attempts a 3Pt. Contested by Yao Oladipo (3.7 feet, ZONE). Kyrie Middleton misses. Rebound secured by Yao Oladipo.

[08:15] Team_083 possession (Score: 5-10)
Yao Oladipo attempts a Midrange. Contested by Tony Smith (3.0 feet, MAN). Yao Oladipo misses. Offensive rebound by Bradley Thompson! Bradley Thompson puts it back in!
Score: 5-12

[08:00] Team_017 possession (Score: 5-12)
Vince Banchero drives, Karl Jokic stays with him. Vince Banchero attempts a Dunk. Contested by Karl Jokic (4.5 feet, MAN). VINCE BANCHERO MAKES IT! Assist: Bam Williamson
Score: 7-12

[07:42] Team_083 possession (Score: 7-12)
Kyrie Griffin makes the 3Pt and draws the foul on Desmond Reaves! And-1! Kyrie Griffin to the line for 1. [Team fouls: 1] (Desmond Reaves: 1 personal fouls)   FT 1/1: GOOD Kyrie Griffin makes 1/1 from the line.
Score: 7-16

[07:27] Team_017 possession (Score: 7-16)
Bam Williamson attempts a Midrange. Contested by Kyrie Griffin (4.1 feet, ZONE). Bam Williamson misses. FOUL! Loose ball foul on Bradley Thompson during the rebound battle. [Team fouls: 2] No free throws, side out. (Bradley Thompson: 1 personal fouls)

[07:10] Team_017 possession (Score: 7-16)
Bam Williamson attempts a Layup. Contested by Kyrie Griffin (4.1 feet, ZONE). BAM WILLIAMSON MAKES IT! Assist: Vince Banchero
Score: 9-16

[06:56] Team_083 possession (Score: 9-16)
FOUL! Shooting foul on Kyrie Middleton. Malcolm Brogdon to the line for 2 free throws. [Team fouls: 2] (Kyrie Middleton: 1 personal fouls)   FT 1/2: GOOD   FT 2/2: MISS Malcolm Brogdon makes 1/2 from the line. Rebound secured by Bam Williamson.
Score: 9-17

[06:43] Team_017 possession (Score: 9-17)
Desmond Reaves drives and kicks out. Bam Williamson attempts a Midrange. Contested by Karl Jokic (4.6 feet, ZONE). BAM WILLIAMSON MAKES IT!
Score: 11-17

[06:33] Team_083 possession (Score: 11-17)
Yao Oladipo attempts a Layup. Contested by Tony Smith (3.0 feet, MAN). YAO OLADIPO MAKES IT! Assist: Kyrie Griffin
Score: 11-19

[06:17] Team_017 possession (Score: 11-19)
Kyrie Middleton makes the Layup and draws the foul on Kyrie Griffin! And-1! Kyrie Middleton to the line for 1. [Team fouls: 3] (Kyrie Griffin: 1 personal fouls)   FT 1/1: GOOD Kyrie Middleton makes 1/1 from the line.
Score: 14-19

[06:02] Team_083 possession (Score: 14-19)
Yao Oladipo makes the 3Pt and draws the foul on Desmond Reaves! And-1! Yao Oladipo to the line for 1. [Team fouls: 3] (Desmond Reaves: 2 personal fouls)   FT 1/1: GOOD Yao Oladipo makes 1/1 from the line.
Score: 14-23

[05:45] Team_017 possession (Score: 14-23)
Bam Williamson drives and kicks out. Vince Banchero attempts a 3Pt. Contested by Yao Oladipo (3.4 feet, ZONE). Vince Banchero misses. Rebound secured by Bradley Thompson.

[05:32] Team_083 possession (Score: 14-23)
Malcolm Brogdon attempts a Layup. Contested by Desmond Reaves (3.7 feet, MAN). MALCOLM BROGDON MAKES IT!
Score: 14-25

[05:19] Team_017 possession (Score: 14-25)
Kyrie Middleton attempts a Midrange. Contested by Kyrie Griffin (3.7 feet, ZONE). KYRIE MIDDLETON MAKES IT! Assist: Tony Smith
Score: 16-25

[05:05] Team_083 possession (Score: 16-25)
Yao Oladipo attempts a Midrange. Contested by Tony Smith (3.0 feet, MAN). Yao Oladipo misses. Offensive rebound by Kyrie Griffin! Kyrie Griffin kicks it out.

[04:51] Team_083 possession (Score: 16-25)
Bradley Thompson attempts a Midrange. Contested by Bam Williamson (4.2 feet, MAN). Bradley Thompson misses. Rebound secured by Kyrie Middleton.

[04:34] Team_017 possession (Score: 16-25)
FOUL! Holding foul on Bradley Thompson. [Team fouls: 4] No free throws, side out. (Bradley Thompson: 2 personal fouls)

[04:21] Team_017 possession (Score: 16-25)
Tony Smith drives, picks up Yao Oladipo. Help arrives from Karl Jokic! Tony Smith attempts a Dunk. Contested by Karl Jokic (4.0 feet, MAN). TONY SMITH MAKES IT!
Score: 18-25

[04:07] Team_083 possession (Score: 18-25)
Malcolm Brogdon attempts a 3Pt. Contested by Tony Smith (2.5 feet, ZONE). Malcolm Brogdon misses. Rebound secured by Kyrie Middleton.

[03:50] Team_017 possession (Score: 18-25)
Kyrie Middleton attempts a Layup. Contested by Kyrie Griffin (3.8 feet, MAN). KYRIE MIDDLETON MAKES IT! Assist: Tony Smith
Score: 20-25

[03:40] Team_083 possession (Score: 20-25)
FOUL! Reach-in foul on Bam Williamson during the drive. [Team fouls: 4] No free throws, side out. (Bam Williamson: 1 personal fouls)

[03:23] Team_083 possession (Score: 20-25)
Yao Oladipo attempts a Midrange. Contested by Tony Smith (3.2 feet, MAN). Yao Oladipo misses. Offensive rebound by Bradley Thompson! Bradley Thompson puts it back in!
Score: 20-27

[03:10] Team_017 possession (Score: 20-27)
Kyrie Middleton drives, picks up Kyrie Griffin. Help arrives from Karl Jokic! Kyrie Middleton attempts a Layup. Contested by Karl Jokic (3.9 feet, ZONE). KYRIE MIDDLETON MAKES IT!
Score: 22-27

[02:56] Team_083 possession (Score: 22-27)
Bradley Thompson attempts a 3Pt. Contested by Tony Smith (3.0 feet, ZONE). Bradley Thompson misses. Rebound secured by Tony Smith.

[02:41] Team_017 possession (Score: 22-27)
Tony Smith attempts a Layup. BLOCKED BY KYRIE GRIFFIN! Ball is loose! Rebound secured by Yao Oladipo.

[02:25] Team_083 possession (Score: 22-27)
Karl Jokic drives, picks up Bam Williamson. Help arrives from Vince Banchero! Karl Jokic attempts a Dunk. Contested by Vince Banchero (4.8 feet, ZONE). KARL JOKIC MAKES IT! Assist: Yao Oladipo
Score: 22-29

[02:06] Team_017 possession (Score: 22-29)
Tony Smith drives and kicks out. Vince Banchero attempts a 3Pt. Contested by Karl Jokic (4.8 feet, MAN). VINCE BANCHERO MAKES IT!
Score: 25-29

[01:54] Team_083 possession (Score: 25-29)
FOUL! Holding foul on Tony Smith. [IN THE BONUS! 5 team fouls] Yao Oladipo to the line for 2 free throws. (Tony Smith: 1 personal fouls)   FT 1/2: GOOD   FT 2/2: GOOD Yao Oladipo makes 2/2 from the line.
Score: 25-31

[01:42] Team_017 possession (Score: 25-31)
FOUL! Holding foul on Malcolm Brogdon. [IN THE BONUS! 5 team fouls] Desmond Reaves to the line for 2 free throws. (Malcolm Brogdon: 1 personal fouls)   FT 1/2: GOOD   FT 2/2: GOOD Desmond Reaves makes 2/2 from the line.
Score: 27-31

[01:27] Team_083 possession (Score: 27-31)
Bradley Thompson attempts a Midrange. Contested by Kyrie Middleton (5.4 feet, ZONE). BRADLEY THOMPSON MAKES IT! Assist: Yao Oladipo
Score: 27-33

[01:12] Team_017 possession (Score: 27-33)
Kyrie Middleton attempts a 3Pt. Contested by Yao Oladipo (4.0 feet, ZONE). Kyrie Middleton misses. Rebound secured by Bradley Thompson.

[01:03] Team_083 possession (Score: 27-33)
FOUL! Reach-in foul on Bam Williamson during the drive. [IN THE BONUS! 6 team fouls] Karl Jokic to the line for 2 free throws. (Bam Williamson: 2 personal fouls)   FT 1/2: GOOD   FT 2/2: GOOD Karl Jokic makes 2/2 from the line.
Score: 27-35

[00:48] Team_017 possession (Score: 27-35)
Desmond Reaves throws a bad pass out of bounds! TURNOVER! (dead ball)

[00:48] Substitution (Team_017): Desmond Reaves OUT → Blake Reaves IN (stamina_rule2)

[00:48] Substitution (Team_017): Vince Banchero OUT → Tobias Bridges IN (stamina_rule2)

[00:48] Substitution (Team_017): Tony Smith OUT → Shaquille Stewart IN (stamina_rule2)

[00:48] Substitution (Team_017): Kyrie Middleton OUT → Ja Stewart IN (stamina_rule2)

[00:48] Substitution (Team_017): Bam Williamson OUT → Klay Holiday IN (stamina_rule2)

[00:48] Substitution (Team_083): Malcolm Brogdon OUT → Zion Markkanen IN (stamina_rule2)

[00:48] Substitution (Team_083): Karl Jokic OUT → Damian Towns IN (stamina_rule2)

[00:48] Substitution (Team_083): Yao Oladipo OUT → Domantas Doncic IN (stamina_rule2)

[00:48] Substitution (Team_083): Kyrie Griffin OUT → Cole Simmons IN (stamina_rule2)

[00:48] Substitution (Team_083): Bradley Thompson OUT → Victor McCollum IN (stamina_rule2)

[00:36] Team_083 possession (Score: 27-35)
Damian Towns attempts a 3Pt. Contested by Tobias Bridges (4.5 feet, MAN). DAMIAN TOWNS MAKES IT! Assist: Victor McCollum
Score: 27-38

[00:22] Team_017 possession (Score: 27-38)
Tobias Bridges attempts a 3Pt. Contested by Damian Towns (5.0 feet, MAN). Tobias Bridges misses. Rebound secured by Cole Simmons.

[00:04] Team_083 possession (Score: 27-38)
FOUL! Reach-in foul on Ja Stewart during the drive. [IN THE BONUS! 7 team fouls] Damian Towns to the line for 2 free throws. (Ja Stewart: 1 personal fouls)   FT 1/2: GOOD   FT 2/2: GOOD Damian Towns makes 2/2 from the line.
Score: 27-40

================================================================================
                              1ST QUARTER COMPLETE                              
================================================================================

1ST QUARTER SCORE: Team_017 27, Team_083 40

BOX SCORE:
================================================================================

Team_017
--------------------------------------------------------------------------------
Player                MIN  PTS  REB  AST  TO      FG   FG%      3P   3P%
--------------------------------------------------------------------------------
Kyrie Middleton        11    9    3    0   0   4/8    50.0     0/0   0.0
Bam Williamson         11    6    2    1   0   3/5    60.0     0/0   0.0
Tony Smith             11    5    1    2   0   2/4    50.0     0/0   0.0
Vince Banchero         11    5    0    1   0   2/2   100.0     0/0   0.0
Desmond Reaves         11    2    0    0   0   1/2    50.0     0/0   0.0
Tobias Bridges          1    0    0    0   0   0/1     0.0     0/0   0.0

TEAM: FG: 12/22 (54.5%), 3PT: 1/7 (14.3%), REB: 6 (1 off, 5 def), AST: 4, TO: 1
TEAM FOULS: 7 [Team_083 in BONUS]


Team_083
--------------------------------------------------------------------------------
Player                MIN  PTS  REB  AST  TO      FG   FG%      3P   3P%
--------------------------------------------------------------------------------
Bradley Thompson       11   12    6    0   0   6/8    75.0     0/0   0.0
Kyrie Griffin          11    8    2    1   0   3/4    75.0     0/0   0.0
Yao Oladipo            11    8    5    2   0   3/3   100.0     0/0   0.0
Damian Towns            1    5    0    0   0   2/2   100.0     0/0   0.0
Karl Jokic             11    4    0    1   0   2/2   100.0     0/0   0.0
Malcolm Brogdon        11    2    0    0   0   1/3    33.3     0/0   0.0
Victor McCollum         1    0    0    1   0   0/0     0.0     0/0   0.0
Cole Simmons            1    0    1    0   0   0/0     0.0     0/0   0.0

TEAM: FG: 17/22 (77.3%), 3PT: 3/5 (60.0%), REB: 14 (4 off, 10 def), AST: 5, TO: 1
TEAM FOULS: 5 [Team_017 in BONUS]

================================================================================

================================================================================
                       2ND QUARTER - Team_017 vs Team_083                       
================================================================================

[12:00] Team_017 possession (Score: 27-40)
Vince Banchero drives, Bradley Thompson stays with him. Vince Banchero attempts a Layup. Contested by Bradley Thompson (3.8 feet, ZONE). Vince Banchero misses. Rebound secured by Kyrie Griffin.

[11:45] Team_083 possession (Score: 27-40)
FOUL! Shooting foul on Bam Williamson. Malcolm Brogdon to the line for 2 free throws. [Team fouls: 1] (Bam Williamson: 1 personal fouls)   FT 1/2: GOOD   FT 2/2: GOOD Malcolm Brogdon makes 2/2 from the line.
Score: 27-42

[11:28] Team_017 possession (Score: 27-42)
Kyrie Middleton drives to the basket... Kyrie Middleton loses control! Ball rolls out of bounds! TURNOVER! (dead ball)

[11:28] Substitution (Team_017): Desmond Reaves OUT → Blake Reaves IN (stamina_rule2)

[11:28] Substitution (Team_017): Bam Williamson OUT → Klay Holiday IN (stamina_rule2)

[11:28] Substitution (Team_083): Kyrie Griffin OUT → Cole Simmons IN (stamina_rule2)

[11:13] Team_083 possession (Score: 27-42)
Yao Oladipo attempts a 3Pt. Contested by Tony Smith (3.3 feet, MAN). Yao Oladipo misses. Rebound secured by Tony Smith.

[11:01] Team_017 possession (Score: 27-42)
Vince Banchero attempts a Midrange. Contested by Karl Jokic (4.7 feet, MAN). Vince Banchero misses. Rebound secured by Bradley Thompson.

[10:50] Team_083 possession (Score: 27-42)
Cole Simmons drives to the basket... Cole Simmons commits a violation (traveling/carry)! TURNOVER! (dead ball)

[10:50] Substitution (Team_017): Vince Banchero OUT → Tobias Bridges IN (stamina_rule2)

[10:50] Substitution (Team_017): Tony Smith OUT → Shaquille Stewart IN (stamina_rule2)

[10:50] Substitution (Team_017): Kyrie Middleton OUT → Ja Stewart IN (stamina_rule2)

[10:50] Substitution (Team_083): Malcolm Brogdon OUT → Zion Markkanen IN (stamina_rule2)

[10:50] Substitution (Team_083): Yao Oladipo OUT → Domantas Doncic IN (stamina_rule2)

[10:50] Substitution (Team_083): Bradley Thompson OUT → Victor McCollum IN (stamina_rule2)

[10:40] Team_017 possession (Score: 27-42)
Ja Stewart attempts a 3Pt. Contested by Cole Simmons (4.4 feet, ZONE). Ja Stewart misses. Offensive rebound by Shaquille Stewart! Shaquille Stewart kicks it out.

[10:24] Team_017 possession (Score: 27-42)
FOUL! Reach-in foul on Victor McCollum during the drive. [Team fouls: 1] No free throws, side out. (Victor McCollum: 1 personal fouls)

[10:11] Team_017 possession (Score: 27-42)
FOUL! Offensive foul on Shaquille Stewart! Domantas Doncic drew the charge! [Team fouls: 2] (Shaquille Stewart: 1 personal fouls) TURNOVER! (dead ball)

[09:55] Team_083 possession (Score: 27-42)
Cole Simmons drives to the basket... Cole Simmons commits a violation (traveling/carry)! TURNOVER! (dead ball)

[09:55] Substitution (Team_083): Karl Jokic OUT → Damian Towns IN (stamina_rule2)

[09:39] Team_017 possession (Score: 27-42)
Ja Stewart drives and kicks out. Shaquille Stewart attempts a Midrange. Contested by Domantas Doncic (4.5 feet, MAN). Shaquille Stewart misses. Rebound secured by Victor McCollum.

[09:21] Team_083 possession (Score: 27-42)
FOUL! Reach-in foul on Klay Holiday during the drive. [Team fouls: 3] No free throws, side out. (Klay Holiday: 1 personal fouls)

[09:07] Team_083 possession (Score: 27-42)
Damian Towns attempts a 3Pt. Contested by Shaquille Stewart (4.9 feet, ZONE). Damian Towns misses. Rebound secured by Ja Stewart.

[08:53] Team_017 possession (Score: 27-42)
FOUL! Shooting foul on Victor McCollum. Klay Holiday to the line for 2 free throws. [Team fouls: 2] (Victor McCollum: 2 personal fouls)   FT 1/2: MISS   FT 2/2: GOOD Klay Holiday makes 1/2 from the line.
Score: 28-42

[08:38] Team_083 possession (Score: 28-42)
Victor McCollum attempts a Midrange. Contested by Ja Stewart (5.3 feet, ZONE). VICTOR MCCOLLUM MAKES IT!
Score: 28-44

[08:19] Team_017 possession (Score: 28-44)
Blake Reaves attempts a Midrange. Contested by Zion Markkanen (5.3 feet, MAN). Blake Reaves misses. Rebound secured by Cole Simmons.

[08:05] Team_083 possession (Score: 28-44)
Domantas Doncic attempts a Midrange. Contested by Shaquille Stewart (4.5 feet, MAN). Domantas Doncic misses. Offensive rebound by Damian Towns! Damian Towns kicks it out.

[07:53] Team_083 possession (Score: 28-44)
FOUL! Shooting foul on Ja Stewart. Cole Simmons to the line for 2 free throws. [Team fouls: 4] (Ja Stewart: 1 personal fouls)   FT 1/2: GOOD   FT 2/2: GOOD Cole Simmons makes 2/2 from the line.
Score: 28-46

[07:36] Team_017 possession (Score: 28-46)
Blake Reaves makes the Midrange and draws the foul on Zion Markkanen! And-1! Blake Reaves to the line for 1. [Team fouls: 3] (Zion Markkanen: 1 personal fouls)   FT 1/1: GOOD Blake Reaves makes 1/1 from the line.
Score: 31-46

[07:18] Team_083 possession (Score: 31-46)
FOUL! Shooting foul on Ja Stewart. Cole Simmons to the line for 2 free throws. [BONUS: 5 team fouls] (Ja Stewart: 2 personal fouls)   FT 1/2: GOOD   FT 2/2: GOOD Cole Simmons makes 2/2 from the line.
Score: 31-48

[07:04] Team_017 possession (Score: 31-48)
Tobias Bridges attempts a 3Pt. Contested by Zion Markkanen (5.5 feet, ZONE). Tobias Bridges misses. Rebound secured by Damian Towns.

[06:53] Team_083 possession (Score: 31-48)
Damian Towns loses control! Ball rolls out of bounds! TURNOVER! (dead ball)

[06:39] Team_017 possession (Score: 31-48)
Blake Reaves attempts a 3Pt. Contested by Zion Markkanen (5.3 feet, MAN). BLAKE REAVES MAKES IT! Assist: Klay Holiday
Score: 34-48

[06:23] Team_083 possession (Score: 34-48)
Damian Towns attempts a Layup. Contested by Ja Stewart (5.2 feet, ZONE). DAMIAN TOWNS MAKES IT!
Score: 34-50

[06:07] Team_017 possession (Score: 34-50)
Shaquille Stewart attempts a 3Pt. Contested by Zion Markkanen (5.8 feet, ZONE). Shaquille Stewart misses. Rebound secured by Damian Towns.

[05:56] Team_083 possession (Score: 34-50)
Zion Markkanen attempts a 3Pt. Contested by Blake Reaves (5.4 feet, MAN). ZION MARKKANEN MAKES IT! Assist: Victor McCollum
Score: 34-53

[05:42] Team_017 possession (Score: 34-53)
Ja Stewart attempts a 3Pt. Contested by Damian Towns (4.6 feet, ZONE). JA STEWART MAKES IT! Assist: Tobias Bridges
Score: 37-53

[05:32] Team_083 possession (Score: 37-53)
Zion Markkanen attempts a 3Pt. Contested by Tobias Bridges (4.2 feet, ZONE). Zion Markkanen misses. Offensive rebound by Damian Towns! Damian Towns kicks it out.

[05:16] Team_083 possession (Score: 37-53)
Domantas Doncic attempts a 3Pt. Contested by Shaquille Stewart (4.5 feet, MAN). Domantas Doncic misses. Rebound secured by Ja Stewart.

[05:04] Team_017 possession (Score: 37-53)
Tobias Bridges drives, picks up Damian Towns. Help arrives from Domantas Doncic! Tobias Bridges attempts a Dunk. Contested by Domantas Doncic (5.0 feet, MAN). TOBIAS BRIDGES MAKES IT!
Score: 39-53

[04:52] Team_083 possession (Score: 39-53)
Zion Markkanen drives to the basket... Zion Markkanen throws a bad pass out of bounds! TURNOVER! (dead ball)

[04:37] Team_017 possession (Score: 39-53)
Ja Stewart attempts a Midrange. Contested by Cole Simmons (4.5 feet, MAN). Ja Stewart misses. Rebound secured by Damian Towns.

[04:24] Team_083 possession (Score: 39-53)
Zion Markkanen attempts a 3Pt. Contested by Tobias Bridges (4.2 feet, ZONE). Zion Markkanen misses. Rebound secured by Tobias Bridges.

[04:14] Team_017 possession (Score: 39-53)
Tobias Bridges makes the Layup and draws the foul on Domantas Doncic! And-1! Tobias Bridges to the line for 1. [Team fouls: 4] (Domantas Doncic: 1 personal fouls)   FT 1/1: MISS Tobias Bridges makes 0/1 from the line. Rebound secured by Damian Towns.
Score: 41-53

[03:57] Team_083 possession (Score: 41-53)
Victor McCollum drives and kicks out. Domantas Doncic attempts a 3Pt. Contested by Shaquille Stewart (4.4 feet, MAN). Domantas Doncic misses. Rebound secured by Ja Stewart.

[03:39] Team_017 possession (Score: 41-53)
Klay Holiday drives and kicks out. Blake Reaves attempts a 3Pt. Contested by Zion Markkanen (5.4 feet, ZONE). BLAKE REAVES MAKES IT!
Score: 44-53

[03:29] Team_083 possession (Score: 44-53)
Victor McCollum drives and kicks out. Damian Towns attempts a 3Pt. Contested by Tobias Bridges (4.1 feet, ZONE). DAMIAN TOWNS MAKES IT! Assist: Zion Markkanen
Score: 44-56

[03:16] Team_017 possession (Score: 44-56)
Ja Stewart attempts a 3Pt. Contested by Zion Markkanen (5.1 feet, ZONE). Ja Stewart misses. Rebound secured by Damian Towns.

[03:02] Team_083 possession (Score: 44-56)
Domantas Doncic attempts a 3Pt. Contested by Tobias Bridges (4.3 feet, ZONE). Domantas Doncic misses. Rebound secured by Shaquille Stewart.

[02:51] Team_017 possession (Score: 44-56)
Blake Reaves attempts a 3Pt. Contested by Zion Markkanen (5.4 feet, MAN). Blake Reaves misses. Rebound secured by Damian Towns.

[02:37] Team_083 possession (Score: 44-56)
Zion Markkanen attempts a 3Pt. Contested by Tobias Bridges (4.4 feet, ZONE). Zion Markkanen misses. Rebound secured by Shaquille Stewart.

[02:26] Team_017 possession (Score: 44-56)
Klay Holiday attempts a 3Pt. Contested by Zion Markkanen (5.7 feet, ZONE). Klay Holiday misses. Rebound secured by Victor McCollum.

[02:10] Team_083 possession (Score: 44-56)
FOUL! Holding foul on Tobias Bridges. [IN THE BONUS! 6 team fouls] Damian Towns to the line for 2 free throws. (Tobias Bridges: 1 personal fouls)   FT 1/2: GOOD   FT 2/2: GOOD Damian Towns makes 2/2 from the line.
Score: 44-58

[01:58] Team_017 possession (Score: 44-58)
Blake Reaves attempts a Midrange. Contested by Zion Markkanen (5.5 feet, MAN). BLAKE REAVES MAKES IT!
Score: 46-58

[01:42] Team_083 possession (Score: 46-58)
Domantas Doncic drives to the basket... Domantas Doncic throws a bad pass out of bounds! TURNOVER! (dead ball)

[01:30] Team_017 possession (Score: 46-58)
Ja Stewart attempts a 3Pt. Contested by Cole Simmons (4.8 feet, MAN). Ja Stewart misses. Rebound secured by Damian Towns.

[01:14] Team_083 possession (Score: 46-58)
FOUL! Shooting foul on Ja Stewart. Zion Markkanen to the line for 2 free throws. [BONUS: 7 team fouls] (Ja Stewart: 3 personal fouls)   FT 1/2: GOOD   FT 2/2: GOOD Zion Markkanen makes 2/2 from the line.
Score: 46-60

[01:01] Team_017 possession (Score: 46-60)
Ja Stewart throws a bad pass out of bounds! TURNOVER! (dead ball)

[00:45] Team_083 possession (Score: 46-60)
Zion Markkanen attempts a 3Pt. Contested by Blake Reaves (5.8 feet, MAN). Zion Markkanen misses. Offensive rebound by Damian Towns! Damian Towns kicks it out.

[00:36] Team_083 possession (Score: 46-60)
Victor McCollum attempts a 3Pt. Contested by Tobias Bridges (5.0 feet, ZONE). Victor McCollum misses. Rebound secured by Shaquille Stewart.

[00:19] Team_017 possession (Score: 46-60)
Ja Stewart attempts a 3Pt. Contested by Cole Simmons (4.9 feet, MAN). Ja Stewart misses. Rebound secured by Cole Simmons.

[00:04] Team_083 possession (Score: 46-60)
Domantas Doncic makes the Dunk and draws the foul on Tobias Bridges! And-1! Domantas Doncic to the line for 1. [BONUS: 8 team fouls] (Tobias Bridges: 2 personal fouls)   FT 1/1: GOOD Domantas Doncic makes 1/1 from the line.
Score: 46-63

================================================================================
                              2ND QUARTER COMPLETE                              
================================================================================

2ND QUARTER SCORE: Team_017 19, Team_083 23

BOX SCORE:
================================================================================

Team_017
--------------------------------------------------------------------------------
Player                MIN  PTS  REB  AST  TO      FG   FG%      3P   3P%
--------------------------------------------------------------------------------
Blake Reaves           12   11    0    0   0   4/6    66.7     0/0   0.0
Ja Stewart             12    3    3    0   0   1/6    16.7     0/0   0.0
Tobias Bridges         12    2    1    1   0   1/3    33.3     0/0   0.0
Klay Holiday           12    1    0    1   0   1/2    50.0     0/0   0.0
Vince Banchero         13    0    0    0   0   0/2     0.0     0/0   0.0
Tony Smith             13    0    1    0   0   0/0     0.0     0/0   0.0
Shaquille Stewart      12    0    4    0   0   0/1     0.0     0/0   0.0

TEAM: FG: 7/20 (35.0%), 3PT: 2/9 (22.2%), REB: 9 (1 off, 8 def), AST: 2, TO: 3
TEAM FOULS: 8 [Team_083 in BONUS]


Team_083
--------------------------------------------------------------------------------
Player                MIN  PTS  REB  AST  TO      FG   FG%      3P   3P%
--------------------------------------------------------------------------------
Damian Towns           11    7   10    0   0   3/4    75.0     0/0   0.0
Zion Markkanen         12    5    0    1   0   2/4    50.0     0/0   0.0
Cole Simmons           12    4    2    0   0   2/2   100.0     0/0   0.0
Domantas Doncic        12    3    0    0   0   1/3    33.3     0/0   0.0
Malcolm Brogdon        13    2    0    0   0   1/1   100.0     0/0   0.0
Victor McCollum        12    2    2    1   0   1/3    33.3     0/0   0.0
Kyrie Griffin          12    0    1    0   0   0/0     0.0     0/0   0.0
Yao Oladipo            13    0    0    0   0   0/1     0.0     0/0   0.0
Bradley Thompson       13    0    1    0   0   0/0     0.0     0/0   0.0

TEAM: FG: 10/18 (55.6%), 3PT: 1/8 (12.5%), REB: 16 (3 off, 13 def), AST: 2, TO: 5
TEAM FOULS: 4

================================================================================

================================================================================
                       3RD QUARTER - Team_017 vs Team_083                       
================================================================================

[12:00] Team_017 possession (Score: 46-63)
FOUL! Shooting foul on Karl Jokic. Tony Smith to the line for 2 free throws. [Team fouls: 1] (Karl Jokic: 1 personal fouls)   FT 1/2: GOOD   FT 2/2: GOOD Tony Smith makes 2/2 from the line.
Score: 48-63

[11:46] Team_083 possession (Score: 48-63)
Yao Oladipo attempts a 3Pt. Contested by Tony Smith (3.0 feet, MAN). YAO OLADIPO MAKES IT! Assist: Malcolm Brogdon
Score: 48-66

[11:30] Team_017 possession (Score: 48-66)
Tony Smith attempts a 3Pt. Contested by Yao Oladipo (3.9 feet, MAN). TONY SMITH MAKES IT! Assist: Desmond Reaves
Score: 51-66

[11:14] Team_083 possession (Score: 51-66)
FOUL! Holding foul on Desmond Reaves. [Team fouls: 1] No free throws, side out. (Desmond Reaves: 1 personal fouls)

[10:58] Team_083 possession (Score: 51-66)
Kyrie Griffin drives, picks up Kyrie Middleton. Help arrives from Vince Banchero! Kyrie Griffin attempts a Layup. Contested by Vince Banchero (5.3 feet, MAN). Kyrie Griffin misses. Rebound secured by Kyrie Middleton.

[10:48] Team_017 possession (Score: 51-66)
Tony Smith attempts a 3Pt. Contested by Yao Oladipo (3.9 feet, MAN). TONY SMITH MAKES IT! Assist: Desmond Reaves
Score: 54-66

[10:32] Team_083 possession (Score: 54-66)
Bradley Thompson attempts a Midrange. Contested by Kyrie Middleton (5.1 feet, ZONE). Bradley Thompson misses. Offensive rebound by Kyrie Griffin! Kyrie Griffin kicks it out.

[10:18] Team_083 possession (Score: 54-66)
Bradley Thompson attempts a Layup. Contested by Bam Williamson (4.1 feet, MAN). Bradley Thompson misses. Rebound secured by Bam Williamson.

[10:03] Team_017 possession (Score: 54-66)
Vince Banchero drives to the basket... Vince Banchero commits a violation (traveling/carry)! TURNOVER! (dead ball)

[09:52] Team_083 possession (Score: 54-66)
Kyrie Griffin drives and kicks out. Bradley Thompson attempts a 3Pt. Contested by Desmond Reaves (4.0 feet, ZONE). BRADLEY THOMPSON MAKES IT! Assist: Kyrie Griffin
Score: 54-69

[09:35] Team_017 possession (Score: 54-69)
Desmond Reaves attempts a Midrange. Contested by Malcolm Brogdon (5.3 feet, MAN). Desmond Reaves misses. Offensive rebound by Bam Williamson! Bam Williamson puts it back in!
Score: 56-69

[09:19] Team_083 possession (Score: 56-69)
Yao Oladipo attempts a 3Pt. Contested by Tony Smith (3.0 feet, MAN). Yao Oladipo misses. Rebound secured by Kyrie Middleton.

[09:01] Team_017 possession (Score: 56-69)
Bam Williamson attempts a Dunk. BLOCKED BY KARL JOKIC! Ball deflects out of bounds off Bam Williamson.

[08:45] Team_083 possession (Score: 56-69)
Kyrie Griffin attempts a Layup. Contested by Bam Williamson (4.4 feet, ZONE). KYRIE GRIFFIN MAKES IT!
Score: 56-71

[08:32] Team_017 possession (Score: 56-71)
Kyrie Middleton attempts a 3Pt. Contested by Yao Oladipo (3.7 feet, ZONE). Kyrie Middleton misses. Offensive rebound by Bam Williamson! Bam Williamson's putback is no good. Offensive rebound by Kyrie Middleton! Kyrie Middleton kicks it out.

[08:20] Team_017 possession (Score: 56-71)
Desmond Reaves attempts a 3Pt. Contested by Malcolm Brogdon (5.3 feet, MAN). Desmond Reaves misses. Offensive rebound by Kyrie Middleton! Kyrie Middleton kicks it out.

[08:05] Team_017 possession (Score: 56-71)
Tony Smith attempts a 3Pt. Contested by Yao Oladipo (3.9 feet, ZONE). Tony Smith misses. Rebound secured by Kyrie Griffin.

[07:54] Team_083 possession (Score: 56-71)
FOUL! Holding foul on Kyrie Middleton. [Team fouls: 2] No free throws, side out. (Kyrie Middleton: 1 personal fouls)

[07:36] Team_083 possession (Score: 56-71)
Bradley Thompson attempts a 3Pt. Contested by Bam Williamson (4.1 feet, MAN). Bradley Thompson misses. Rebound secured by Kyrie Middleton.

[07:25] Team_017 possession (Score: 56-71)
Kyrie Middleton drives and kicks out. Desmond Reaves attempts a 3Pt. Contested by Yao Oladipo (3.4 feet, ZONE). DESMOND REAVES MAKES IT! Assist: Tony Smith
Score: 59-71

[07:12] Team_083 possession (Score: 59-71)
Malcolm Brogdon attempts a 3Pt. Contested by Desmond Reaves (3.7 feet, MAN). Malcolm Brogdon misses. Rebound secured by Kyrie Middleton.

[06:57] Team_017 possession (Score: 59-71)
Desmond Reaves attempts a 3Pt. Contested by Yao Oladipo (3.8 feet, ZONE). DESMOND REAVES MAKES IT! Assist: Kyrie Middleton
Score: 62-71

[06:46] Team_083 possession (Score: 62-71)
Kyrie Griffin attempts a Layup. Contested by Bam Williamson (4.4 feet, ZONE). KYRIE GRIFFIN MAKES IT!
Score: 62-73

[06:33] Team_017 possession (Score: 62-73)
FOUL! Holding foul on Malcolm Brogdon. [Team fouls: 2] No free throws, side out. (Malcolm Brogdon: 1 personal fouls)

[06:21] Team_017 possession (Score: 62-73)
FOUL! Reach-in foul on Karl Jokic during the drive. [Team fouls: 3] No free throws, side out. (Karl Jokic: 2 personal fouls)

[06:04] Team_017 possession (Score: 62-73)
Bam Williamson attempts a Midrange. Contested by Malcolm Brogdon (5.6 feet, ZONE). BAM WILLIAMSON MAKES IT! Assist: Vince Banchero
Score: 64-73

[05:49] Team_083 possession (Score: 64-73)
Karl Jokic attempts a Layup. Contested by Vince Banchero (4.6 feet, MAN). KARL JOKIC MAKES IT!
Score: 64-75

[05:34] Team_017 possession (Score: 64-75)
Tony Smith attempts a 3Pt. Contested by Yao Oladipo (3.9 feet, MAN). Tony Smith misses. Rebound secured by Bradley Thompson.

[05:18] Team_083 possession (Score: 64-75)
Bradley Thompson makes the Layup and draws the foul on Bam Williamson! And-1! Bradley Thompson to the line for 1. [Team fouls: 3] (Bam Williamson: 1 personal fouls)   FT 1/1: GOOD Bradley Thompson makes 1/1 from the line.
Score: 64-78

[05:03] Team_017 possession (Score: 64-78)
Kyrie Middleton makes the Layup and draws the foul on Kyrie Griffin! And-1! Kyrie Middleton to the line for 1. [Team fouls: 4] (Kyrie Griffin: 1 personal fouls)   FT 1/1: GOOD Kyrie Middleton makes 1/1 from the line.
Score: 67-78

[04:45] Team_083 possession (Score: 67-78)
Karl Jokic drives and kicks out. Malcolm Brogdon attempts a Midrange. Contested by Vince Banchero (4.1 feet, ZONE). MALCOLM BROGDON MAKES IT! Assist: Yao Oladipo
Score: 67-80

[04:31] Team_017 possession (Score: 67-80)
FOUL! Reach-in foul on Kyrie Griffin during the drive. [IN THE BONUS! 5 team fouls] Bam Williamson to the line for 2 free throws. (Kyrie Griffin: 2 personal fouls)   FT 1/2: GOOD   FT 2/2: GOOD Bam Williamson makes 2/2 from the line.
Score: 69-80

[04:16] Team_083 possession (Score: 69-80)
Malcolm Brogdon attempts a 3Pt. Contested by Tony Smith (2.5 feet, ZONE). Malcolm Brogdon misses. Rebound secured by Kyrie Middleton.

[03:59] Team_017 possession (Score: 69-80)
FOUL! Reach-in foul on Yao Oladipo during the drive. [IN THE BONUS! 6 team fouls] Tony Smith to the line for 2 free throws. (Yao Oladipo: 1 personal fouls)   FT 1/2: GOOD   FT 2/2: MISS Tony Smith makes 1/2 from the line. Rebound secured by Bradley Thompson.
Score: 70-80

[03:44] Team_083 possession (Score: 70-80)
Malcolm Brogdon attempts a Midrange. Contested by Desmond Reaves (3.8 feet, MAN). MALCOLM BROGDON MAKES IT! Assist: Yao Oladipo
Score: 70-82

[03:31] Team_017 possession (Score: 70-82)
Kyrie Middleton makes the Midrange and draws the foul on Kyrie Griffin! And-1! Kyrie Middleton to the line for 1. [BONUS: 7 team fouls] (Kyrie Griffin: 3 personal fouls)   FT 1/1: GOOD Kyrie Middleton makes 1/1 from the line.
Score: 73-82

[03:13] Team_083 possession (Score: 73-82)
Malcolm Brogdon drives and kicks out. Kyrie Griffin attempts a 3Pt. Contested by Kyrie Middleton (5.2 feet, MAN). KYRIE GRIFFIN MAKES IT! Assist: Yao Oladipo
Score: 73-85

[02:57] Team_017 possession (Score: 73-85)
Desmond Reaves attempts a 3Pt. Contested by Malcolm Brogdon (5.4 feet, MAN). Desmond Reaves misses. Rebound secured by Yao Oladipo.

[02:42] Team_083 possession (Score: 73-85)
Bradley Thompson drives to the basket... Bradley Thompson loses control! Ball rolls out of bounds! TURNOVER! (dead ball)

[02:42] Substitution (Team_017): Bam Williamson OUT → Klay Holiday IN (stamina_rule2)

[02:25] Team_017 possession (Score: 73-85)
Tony Smith drives, Yao Oladipo stays with him. Tony Smith attempts a Layup. Contested by Yao Oladipo (4.1 feet, MAN). Tony Smith misses. Rebound secured by Kyrie Griffin.

[02:12] Team_083 possession (Score: 73-85)
Bradley Thompson attempts a Layup. Contested by Klay Holiday (5.2 feet, MAN). BRADLEY THOMPSON MAKES IT!
Score: 73-87

[01:59] Team_017 possession (Score: 73-87)
Tony Smith attempts a 3Pt. Contested by Yao Oladipo (4.2 feet, ZONE). Tony Smith misses. Offensive rebound by Tony Smith! Tony Smith kicks it out.

[01:45] Team_017 possession (Score: 73-87)
Kyrie Middleton attempts a 3Pt. Contested by Kyrie Griffin (4.1 feet, MAN). Kyrie Middleton misses. Offensive rebound by Tony Smith! Tony Smith kicks it out.

[01:31] Team_017 possession (Score: 73-87)
FOUL! Reach-in foul on Kyrie Griffin during the drive. [IN THE BONUS! 8 team fouls] Vince Banchero to the line for 2 free throws. (Kyrie Griffin: 4 personal fouls)   FT 1/2: GOOD   FT 2/2: GOOD Vince Banchero makes 2/2 from the line.
Score: 75-87

[01:18] Team_083 possession (Score: 75-87)
Kyrie Griffin drives to the basket... Kyrie Griffin loses control! Ball rolls out of bounds! TURNOVER! (dead ball)

[01:18] Substitution (Team_017): Desmond Reaves OUT → Blake Reaves IN (stamina_rule2)

[01:18] Substitution (Team_017): Vince Banchero OUT → Tobias Bridges IN (stamina_rule2)

[01:18] Substitution (Team_017): Tony Smith OUT → Shaquille Stewart IN (stamina_rule2)

[01:18] Substitution (Team_017): Kyrie Middleton OUT → Ja Stewart IN (stamina_rule2)

[01:18] Substitution (Team_083): Malcolm Brogdon OUT → Zion Markkanen IN (stamina_rule2)

[01:18] Substitution (Team_083): Karl Jokic OUT → Damian Towns IN (stamina_rule2)

[01:18] Substitution (Team_083): Yao Oladipo OUT → Domantas Doncic IN (stamina_rule2)

[01:18] Substitution (Team_083): Kyrie Griffin OUT → Cole Simmons IN (stamina_rule2)

[01:18] Substitution (Team_083): Bradley Thompson OUT → Victor McCollum IN (stamina_rule2)

[01:02] Team_017 possession (Score: 75-87)
Blake Reaves attempts a Layup. BLOCKED BY DAMIAN TOWNS! Ball is loose! Offensive rebound by Ja Stewart! Ja Stewart kicks it out.

[00:47] Team_017 possession (Score: 75-87)
Tobias Bridges attempts a Midrange. Contested by Damian Towns (5.0 feet, ZONE). Tobias Bridges misses. Offensive rebound by Shaquille Stewart! Shaquille Stewart kicks it out.

[00:31] Team_017 possession (Score: 75-87)
Shaquille Stewart attempts a 3Pt. Contested by Zion Markkanen (5.8 feet, ZONE). Shaquille Stewart misses. Rebound secured by Damian Towns.

[00:17] Team_083 possession (Score: 75-87)
Damian Towns attempts a 3Pt. Contested by Tobias Bridges (4.5 feet, MAN). Damian Towns misses. Rebound secured by Shaquille Stewart.

[00:05] Team_017 possession (Score: 75-87)
Blake Reaves attempts a Midrange. Contested by Domantas Doncic (4.4 feet, ZONE). Blake Reaves misses. Offensive rebound by Ja Stewart! Ja Stewart kicks it out.

================================================================================
                              3RD QUARTER COMPLETE                              
================================================================================

3RD QUARTER SCORE: Team_017 29, Team_083 24

BOX SCORE:
================================================================================

Team_017
--------------------------------------------------------------------------------
Player                MIN  PTS  REB  AST  TO      FG   FG%      3P   3P%
--------------------------------------------------------------------------------
Tony Smith             24    8    2    1   0   3/7    42.9     0/0   0.0
Desmond Reaves         23    6    0    2   0   2/3    66.7     0/0   0.0
Kyrie Middleton        24    6    7    1   0   2/2   100.0     0/0   0.0
Bam Williamson         22    6    2    0   0   3/4    75.0     0/0   0.0
Vince Banchero         24    2    0    1   0   1/1   100.0     0/0   0.0
Ja Stewart             13    0    2    0   0   0/0     0.0     0/0   0.0
Shaquille Stewart      13    0    2    0   0   0/1     0.0     0/0   0.0

TEAM: FG: 11/18 (61.1%), 3PT: 3/7 (42.9%), REB: 15 (8 off, 7 def), AST: 5, TO: 1
TEAM FOULS: 3


Team_083
--------------------------------------------------------------------------------
Player                MIN  PTS  REB  AST  TO      FG   FG%      3P   3P%
--------------------------------------------------------------------------------
Bradley Thompson       24    8    2    0   0   3/5    60.0     0/0   0.0
Kyrie Griffin          23    7    3    1   0   3/4    75.0     0/0   0.0
Malcolm Brogdon        24    4    0    1   0   2/4    50.0     0/0   0.0
Yao Oladipo            24    3    1    3   0   1/2    50.0     0/0   0.0
Karl Jokic             25    2    0    0   0   1/1   100.0     0/0   0.0
Damian Towns           12    0    1    0   0   0/1     0.0     0/0   0.0

TEAM: FG: 10/17 (58.8%), 3PT: 1/6 (16.7%), REB: 7 (1 off, 6 def), AST: 5, TO: 2
TEAM FOULS: 9 [Team_017 in BONUS]

================================================================================

================================================================================
                       4TH QUARTER - Team_017 vs Team_083                       
================================================================================

[12:00] Substitution (Team_017): Desmond Reaves OUT (stamina: 74) → Blake Reaves IN (comeback_detected)

[12:00] Substitution (Team_083): Malcolm Brogdon OUT (stamina: 75) → Zion Markkanen IN (comeback_detected)

[12:00] Team_017 possession (Score: 75-87)
Vince Banchero drives to the basket... Vince Banchero throws a bad pass! Stolen by Kyrie Griffin! TURNOVER! (live ball)

[11:49] Team_083 possession (Score: 75-87)
Karl Jokic attempts a 3Pt. Contested by Vince Banchero (4.7 feet, MAN). Karl Jokic misses. Rebound secured by Bam Williamson.

[11:35] Team_017 possession (Score: 75-87)
Vince Banchero drives to the basket... Vince Banchero throws a bad pass out of bounds! TURNOVER! (dead ball)

[11:17] Team_083 possession (Score: 75-87)
Kyrie Griffin attempts a 3Pt. Contested by Tony Smith (3.2 feet, ZONE). Kyrie Griffin misses. FOUL! Loose ball foul on Kyrie Middleton during the rebound battle. [Team fouls: 1] No free throws, side out. (Kyrie Middleton: 1 personal fouls)

[11:05] Team_083 possession (Score: 75-87)
Kyrie Griffin attempts a 3Pt. Contested by Kyrie Middleton (5.5 feet, MAN). Kyrie Griffin misses. Rebound secured by Kyrie Middleton.

[10:50] Team_017 possession (Score: 75-87)
Kyrie Middleton makes the Dunk and draws the foul on Karl Jokic! And-1! Kyrie Middleton to the line for 1. [Team fouls: 1] (Karl Jokic: 1 personal fouls)   FT 1/1: GOOD Kyrie Middleton makes 1/1 from the line.
Score: 78-87

[10:35] Team_083 possession (Score: 78-87)
Bradley Thompson drives to the basket... FOUL! Offensive foul on Bradley Thompson! Kyrie Middleton drew the charge! [Team fouls: 2] (Bradley Thompson: 1 personal fouls) TURNOVER! (dead ball)

[10:23] Team_017 possession (Score: 78-87)
Bam Williamson drives to the basket... FOUL! Offensive foul on Bam Williamson! Bradley Thompson drew the charge! [Team fouls: 2] (Bam Williamson: 1 personal fouls) TURNOVER! (dead ball)

[10:14] Team_083 possession (Score: 78-87)
Kyrie Griffin attempts a Layup. Contested by Kyrie Middleton (5.6 feet, MAN). KYRIE GRIFFIN MAKES IT! Assist: Karl Jokic
Score: 78-89

[09:57] Team_017 possession (Score: 78-89)
Kyrie Middleton attempts a Midrange. Contested by Kyrie Griffin (4.1 feet, MAN). Kyrie Middleton misses. Rebound secured by Kyrie Griffin.

[09:41] Team_083 possession (Score: 78-89)
Kyrie Griffin makes the Midrange and draws the foul on Kyrie Middleton! And-1! Kyrie Griffin to the line for 1. [Team fouls: 3] (Kyrie Middleton: 2 personal fouls)   FT 1/1: GOOD Kyrie Griffin makes 1/1 from the line.
Score: 78-92

[09:24] Team_017 possession (Score: 78-92)
Vince Banchero attempts a Midrange. Contested by Karl Jokic (4.8 feet, MAN). Vince Banchero misses. Rebound secured by Bradley Thompson.

[09:06] Team_083 possession (Score: 78-92)
Kyrie Griffin makes the Dunk and draws the foul on Kyrie Middleton! And-1! Kyrie Griffin to the line for 1. [Team fouls: 4] (Kyrie Middleton: 3 personal fouls)   FT 1/1: MISS Kyrie Griffin makes 0/1 from the line. Rebound secured by Bam Williamson.
Score: 78-94

[08:48] Team_017 possession (Score: 78-94)
Bam Williamson attempts a 3Pt. Contested by Yao Oladipo (4.5 feet, ZONE). BAM WILLIAMSON MAKES IT! Assist: Blake Reaves
Score: 81-94

[08:28] Team_083 possession (Score: 81-94)
Kyrie Griffin makes the Layup and draws the foul on Vince Banchero! And-1! Kyrie Griffin to the line for 1. [BONUS: 5 team fouls] (Vince Banchero: 1 personal fouls)   FT 1/1: GOOD Kyrie Griffin makes 1/1 from the line.
Score: 81-97

[08:14] Team_017 possession (Score: 81-97)
Vince Banchero attempts a 3Pt. Contested by Yao Oladipo (3.8 feet, ZONE). Vince Banchero misses. FOUL! Loose ball foul on Bradley Thompson during the rebound battle. [Team fouls: 3] No free throws, side out. (Bradley Thompson: 2 personal fouls)

[08:00] Team_017 possession (Score: 81-97)
Kyrie Middleton loses control! Ball rolls out of bounds! TURNOVER! (dead ball)

[08:00] Substitution (Team_017): Vince Banchero OUT → Tobias Bridges IN (stamina_rule2)

[08:00] Substitution (Team_017): Tony Smith OUT → Shaquille Stewart IN (stamina_rule2)

[08:00] Substitution (Team_017): Kyrie Middleton OUT → Ja Stewart IN (stamina_rule2)

[08:00] Substitution (Team_017): Bam Williamson OUT → Klay Holiday IN (stamina_rule2)

[08:00] Substitution (Team_083): Karl Jokic OUT → Damian Towns IN (stamina_rule2)

[08:00] Substitution (Team_083): Yao Oladipo OUT → Domantas Doncic IN (stamina_rule2)

[08:00] Substitution (Team_083): Kyrie Griffin OUT → Cole Simmons IN (stamina_rule2)

[08:00] Substitution (Team_083): Bradley Thompson OUT → Victor McCollum IN (stamina_rule2)

[07:48] Team_083 possession (Score: 81-97)
Victor McCollum commits a violation (traveling/carry)! TURNOVER! (dead ball)

[07:35] Team_017 possession (Score: 81-97)
Ja Stewart attempts a 3Pt. Contested by Cole Simmons (4.4 feet, MAN). JA STEWART MAKES IT! Assist: Klay Holiday
Score: 84-97

[07:17] Team_083 possession (Score: 84-97)
Domantas Doncic drives, Ja Stewart stays with him. Domantas Doncic attempts a Dunk. Contested by Ja Stewart (4.8 feet, ZONE). Domantas Doncic misses. Rebound secured by Klay Holiday.

[07:03] Team_017 possession (Score: 84-97)
Tobias Bridges attempts a Layup. Contested by Victor McCollum (4.1 feet, ZONE). TOBIAS BRIDGES MAKES IT! Assist: Blake Reaves
Score: 86-97

[06:49] Team_083 possession (Score: 86-97)
Zion Markkanen loses the ball! Stripped by Blake Reaves! TURNOVER! (live ball)

[06:38] Team_017 possession (Score: 86-97)
FOUL! Shooting foul on Zion Markkanen. Blake Reaves to the line for 2 free throws. [Team fouls: 4] (Zion Markkanen: 1 personal fouls)   FT 1/2: GOOD   FT 2/2: MISS Blake Reaves makes 1/2 from the line. Rebound secured by Damian Towns.
Score: 87-97

[06:27] Team_083 possession (Score: 87-97)
Zion Markkanen drives to the basket... Zion Markkanen loses the ball! Stripped by Ja Stewart! TURNOVER! (live ball)

[06:12] Team_017 possession (Score: 87-97)
Shaquille Stewart attempts a 3Pt. Contested by Zion Markkanen (5.8 feet, ZONE). Shaquille Stewart misses. Rebound secured by Victor McCollum.

[05:59] Team_083 possession (Score: 87-97)
Cole Simmons attempts a 3Pt. Contested by Tobias Bridges (4.0 feet, ZONE). Cole Simmons misses. Offensive rebound by Damian Towns! Damian Towns kicks it out.

[05:44] Team_083 possession (Score: 87-97)
Zion Markkanen drives, Blake Reaves stays with him. Zion Markkanen attempts a Dunk. Contested by Blake Reaves (5.4 feet, MAN). Zion Markkanen misses. Offensive rebound by Damian Towns! Damian Towns kicks it out.

[05:29] Team_083 possession (Score: 87-97)
Victor McCollum attempts a 3Pt. Contested by Tobias Bridges (4.6 feet, ZONE). Victor McCollum misses. Rebound secured by Shaquille Stewart.

[05:16] Team_017 possession (Score: 87-97)
Blake Reaves attempts a 3Pt. Contested by Zion Markkanen (5.4 feet, ZONE). BLAKE REAVES MAKES IT! Assist: Tobias Bridges
Score: 90-97

[05:01] Team_083 possession (Score: 90-97)
Victor McCollum drives, picks up Klay Holiday. Help arrives from Tobias Bridges! Victor McCollum attempts a Dunk. Contested by Tobias Bridges (5.7 feet, MAN). VICTOR MCCOLLUM MAKES IT! Assist: Damian Towns
Score: 90-99

[04:48] Team_017 possession (Score: 90-99)
Tobias Bridges attempts a 3Pt. Contested by Damian Towns (5.0 feet, MAN). Tobias Bridges misses. Rebound secured by Cole Simmons.

[04:34] Team_083 possession (Score: 90-99)
Victor McCollum attempts a Layup. BLOCKED BY KLAY HOLIDAY! Ball is loose! Rebound secured by Shaquille Stewart.

[04:15] Team_017 possession (Score: 90-99)
Ja Stewart attempts a 3Pt. Contested by Zion Markkanen (5.2 feet, ZONE). Ja Stewart misses. Rebound secured by Victor McCollum.

[04:02] Team_083 possession (Score: 90-99)
Victor McCollum attempts a Layup. Contested by Ja Stewart (5.3 feet, ZONE). VICTOR MCCOLLUM MAKES IT! Assist: Domantas Doncic
Score: 90-101

[03:49] Team_017 possession (Score: 90-101)
Tobias Bridges attempts a 3Pt. Contested by Domantas Doncic (4.6 feet, ZONE). TOBIAS BRIDGES MAKES IT! Assist: Klay Holiday
Score: 93-101

[03:33] Team_083 possession (Score: 93-101)
Zion Markkanen attempts a Midrange. Contested by Tobias Bridges (4.2 feet, ZONE). Zion Markkanen misses. Offensive rebound by Damian Towns! Damian Towns kicks it out.

[03:22] Team_083 possession (Score: 93-101)
Domantas Doncic makes the Layup and draws the foul on Ja Stewart! And-1! Domantas Doncic to the line for 1. [BONUS: 6 team fouls] (Ja Stewart: 1 personal fouls)   FT 1/1: GOOD Domantas Doncic makes 1/1 from the line.
Score: 93-104

[03:04] Team_017 possession (Score: 93-104)
Tobias Bridges loses control! Ball rolls out of bounds! TURNOVER! (dead ball)

[02:51] Team_083 possession (Score: 93-104)
Zion Markkanen makes the Midrange and draws the foul on Blake Reaves! And-1! Zion Markkanen to the line for 1. [BONUS: 7 team fouls] (Blake Reaves: 1 personal fouls)   FT 1/1: GOOD Zion Markkanen makes 1/1 from the line.
Score: 93-107

[02:37] Team_017 possession (Score: 93-107)
Tobias Bridges attempts a Layup. Contested by Damian Towns (5.0 feet, MAN). TOBIAS BRIDGES MAKES IT!
Score: 95-107

[02:27] Team_083 possession (Score: 95-107)
Zion Markkanen attempts a 3Pt. Contested by Blake Reaves (5.7 feet, MAN). Zion Markkanen misses. Rebound secured by Tobias Bridges.

[02:12] Team_017 possession (Score: 95-107)
Shaquille Stewart attempts a Midrange. Contested by Domantas Doncic (4.9 feet, MAN). Shaquille Stewart misses. Rebound secured by Damian Towns.

[01:56] Team_083 possession (Score: 95-107)
Cole Simmons drives, picks up Ja Stewart. Help arrives from Tobias Bridges! Cole Simmons attempts a Dunk. Contested by Tobias Bridges (4.7 feet, MAN). Cole Simmons misses. Offensive rebound by Victor McCollum! Victor McCollum's putback is no good. Rebound secured by Tobias Bridges.

[01:39] Team_017 possession (Score: 95-107)
Klay Holiday attempts a Layup. Contested by Victor McCollum (4.2 feet, ZONE). KLAY HOLIDAY MAKES IT! Assist: Blake Reaves
Score: 97-107

[01:26] Team_083 possession (Score: 97-107)
FOUL! Shooting foul on Ja Stewart. Damian Towns to the line for 2 free throws. [BONUS: 8 team fouls] (Ja Stewart: 2 personal fouls)   FT 1/2: GOOD   FT 2/2: GOOD Damian Towns makes 2/2 from the line.
Score: 97-109

[01:10] Team_017 possession (Score: 97-109)
Tobias Bridges attempts a Midrange. Contested by Domantas Doncic (4.6 feet, ZONE). Tobias Bridges misses. Rebound secured by Cole Simmons.

[00:53] Team_083 possession (Score: 97-109)
Domantas Doncic attempts a Midrange. Contested by Shaquille Stewart (4.6 feet, MAN). DOMANTAS DONCIC MAKES IT!
Score: 97-111

[00:36] Team_017 possession (Score: 97-111)
Shaquille Stewart attempts a Layup. Contested by Victor McCollum (4.5 feet, ZONE). SHAQUILLE STEWART MAKES IT! Assist: Tobias Bridges
Score: 99-111

[00:20] Team_083 possession (Score: 99-111)
Zion Markkanen makes the Layup and draws the foul on Ja Stewart! And-1! Zion Markkanen to the line for 1. [BONUS: 9 team fouls] (Ja Stewart: 3 personal fouls)   FT 1/1: MISS Zion Markkanen makes 0/1 from the line. Rebound secured by Tobias Bridges.
Score: 99-113

[00:08] Team_017 possession (Score: 99-113)
Tobias Bridges attempts a 3Pt. Contested by Zion Markkanen (6.0 feet, ZONE). Tobias Bridges misses. Rebound secured by Damian Towns.

================================================================================
                              4TH QUARTER COMPLETE                              
================================================================================

4TH QUARTER SCORE: Team_017 24, Team_083 26

BOX SCORE:
================================================================================

Team_017
--------------------------------------------------------------------------------
Player                MIN  PTS  REB  AST  TO      FG   FG%      3P   3P%
--------------------------------------------------------------------------------
Tobias Bridges         21    7    3    2   0   3/6    50.0     0/0   0.0
Bam Williamson         26    3    2    0   0   1/1   100.0     0/0   0.0
Kyrie Middleton        28    3    2    0   0   1/2    50.0     0/0   0.0
Blake Reaves           25    3    0    3   0   1/2    50.0     0/0   0.0
Ja Stewart             21    3    0    0   0   1/2    50.0     0/0   0.0
Klay Holiday           23    2    1    2   0   1/1   100.0     0/0   0.0
Shaquille Stewart      21    2    2    0   0   1/3    33.3     0/0   0.0
Vince Banchero         28    0    0    0   0   0/1     0.0     0/0   0.0

TEAM: FG: 9/18 (50.0%), 3PT: 4/8 (50.0%), REB: 9 (1 off, 8 def), AST: 7, TO: 5
TEAM FOULS: 9 [Team_083 in BONUS]


Team_083
--------------------------------------------------------------------------------
Player                MIN  PTS  REB  AST  TO      FG   FG%      3P   3P%
--------------------------------------------------------------------------------
Kyrie Griffin          27    8    1    0   0   3/5    60.0     0/0   0.0
Domantas Doncic        21    5    0    1   0   2/3    66.7     0/0   0.0
Victor McCollum        21    4    2    0   0   2/4    50.0     0/0   0.0
Zion Markkanen         25    3    0    0   0   1/3    33.3     0/0   0.0
Damian Towns           20    2    6    1   0   1/1   100.0     0/0   0.0
Karl Jokic             29    0    0    1   0   0/1     0.0     0/0   0.0
Bradley Thompson       28    0    2    0   0   0/0     0.0     0/0   0.0
Cole Simmons           21    0    2    0   0   0/1     0.0     0/0   0.0

TEAM: FG: 9/18 (50.0%), 3PT: 0/4 (0.0%), REB: 14 (5 off, 9 def), AST: 3, TO: 4
TEAM FOULS: 4

================================================================================

================================================================================
                               FULL GAME COMPLETE                               
================================================================================

FINAL SCORE: Team_017 99, Team_083 113

SCORING BY QUARTER:
--------------------------------------------------------------------------------
Team                     Q1     Q2     Q3     Q4    FINAL
--------------------------------------------------------------------------------
Team_017                 27     19     29     24       99
Team_083                 40     23     24     26      113
--------------------------------------------------------------------------------

FULL GAME BOX SCORE:
================================================================================

Team_017
--------------------------------------------------------------------------------
Player                MIN  PTS  REB  AST  TO      FG   FG%      3P   3P%      FT STL BLK
--------------------------------------------------------------------------------
Vince Banchero         28    7    0    2   1   2/5    40.0   0/0     0.0   2/2     0   0
Tony Smith             28   13    4    3   0   6/12   50.0   3/6    50.0   6/7     0   0
Kyrie Middleton        28   18   12    1   4   8/13   61.5   0/3     0.0   4/4     0   0
Bam Williamson         26   15    6    1   0   5/8    62.5   1/1   100.0   2/2     1   0
Blake Reaves           25   14    0    3   1   4/7    57.1   2/3    66.7   2/3     1   0
Desmond Reaves         23    8    0    2   1   3/5    60.0   1/3    33.3   2/2     0   0
Klay Holiday           23    3    1    3   0   3/4    75.0   0/1     0.0   1/2     0   1
Tobias Bridges         21    9    4    3   1   4/10   40.0   1/5    20.0   0/1     0   0
Shaquille Stewart      21    2    8    0   1   1/5    20.0   0/3     0.0   0/0     0   0
Ja Stewart             21    6    5    0   1   2/8    25.0   2/6    33.3   0/0     1   0

TEAM: FG: 39/78 (50.0%), 3PT: 10/31 (32.3%), REB: 39 (11 off, 28 def), AST: 18, TO: 10


Team_083
--------------------------------------------------------------------------------
Player                MIN  PTS  REB  AST  TO      FG   FG%      3P   3P%      FT STL BLK
--------------------------------------------------------------------------------
Karl Jokic             29    6    0    2   2   4/5    80.0   0/1     0.0   2/2     0   1
Yao Oladipo            28   11    6    5   1   5/7    71.4   2/4    50.0   3/3     0   0
Bradley Thompson       28   20   11    0   0   5/9    55.6   0/2     0.0   1/1     0   0
Kyrie Griffin          27   23    7    2   1  10/14   71.4   1/2    50.0   3/4     1   1
Zion Markkanen         25    8    0    1   3   3/7    42.9   1/4    25.0   3/4     0   0
Malcolm Brogdon        24    8    0    1   1   4/8    50.0   0/3     0.0   3/4     0   0
Cole Simmons           21    4    5    0   0   2/3    66.7   0/0     0.0   4/4     0   0
Domantas Doncic        21    8    0    1   1   3/6    50.0   0/2     0.0   2/2     0   0
Victor McCollum        21    6    4    2   2   4/8    50.0   0/2     0.0   0/0     0   0
Damian Towns           20   14   17    1   1   4/6    66.7   1/3    33.3   6/6     0   1

TEAM: FG: 46/75 (61.3%), 3PT: 5/23 (21.7%), REB: 51 (13 off, 38 def), AST: 15, TO: 12

================================================================================
