================================================================================
                        FULL GAME - Team_005 vs Team_011                        
================================================================================

================================================================================
                       1ST QUARTER - Team_005 vs Team_011                       
================================================================================

[12:00] Team_005 possession (Score: 0-0)
Brandon George attempts a 3Pt. Contested by Magic Tatum (3.6 feet, MAN). Brandon George misses. Rebound secured by Michael Carter.

[11:46] Team_011 possession (Score: 0-0)
Magic Tatum attempts a 3Pt. Contested by Brandon George (5.3 feet, MAN). MAGIC TATUM MAKES IT!
Score: 0-3

[11:32] Team_005 possession (Score: 0-3)
Anthony Rozier attempts a Midrange. Contested by Trae Tatum (4.7 feet, MAN). ANTHONY ROZIER MAKES IT! Assist: Derrick Allen
Score: 2-3

[11:21] Team_011 possession (Score: 2-3)
Evan George attempts a Midrange. Contested by Anthony Rozier (4.9 feet, ZONE). Evan George misses. Rebound secured by Cade Markkanen.

[11:06] Team_005 possession (Score: 2-3)
Cade Markkanen attempts a Midrange. Contested by Pau Barnes (2.8 feet, MAN). Cade Markkanen misses. Rebound secured by Evan George.

[10:51] Team_011 possession (Score: 2-3)
Magic Tatum drives, Brandon George stays with him. Magic Tatum attempts a Dunk. Contested by Brandon George (5.3 feet, MAN). MAGIC TATUM MAKES IT!
Score: 2-5

[10:38] Team_005 possession (Score: 2-5)
Derrick Allen attempts a 3Pt. Contested by Michael Carter (4.5 feet, MAN). Derrick Allen misses. Rebound secured by Evan George.

[10:23] Team_011 possession (Score: 2-5)
Pau Barnes makes the Dunk and draws the foul on Anthony Rozier! And-1! Pau Barnes to the line for 1. [Team fouls: 1] (Anthony Rozier: 1 personal fouls)   FT 1/1: GOOD Pau Barnes makes 1/1 from the line.
Score: 2-8

[10:12] Team_005 possession (Score: 2-8)
Derrick Allen attempts a 3Pt. Contested by Michael Carter (4.5 feet, ZONE). Derrick Allen misses. Rebound secured by Evan George.

[09:57] Team_011 possession (Score: 2-8)
Trae Tatum attempts a 3Pt. Contested by Derrick Allen (4.2 feet, ZONE). Trae Tatum misses. Rebound secured by Jalen Rozier.

[09:40] Team_005 possession (Score: 2-8)
Brandon George throws a bad pass out of bounds! TURNOVER! (dead ball)

[09:23] Team_011 possession (Score: 2-8)
Magic Tatum makes the Dunk and draws the foul on Brandon George! And-1! Magic Tatum to the line for 1. [Team fouls: 2] (Brandon George: 1 personal fouls)   FT 1/1: GOOD Magic Tatum makes 1/1 from the line.
Score: 2-11

[09:07] Team_005 possession (Score: 2-11)
Anthony Rozier drives to the basket... Anthony Rozier commits a violation (traveling/carry)! TURNOVER! (dead ball)

[08:50] Team_011 possession (Score: 2-11)
Trae Tatum attempts a 3Pt. Contested by Derrick Allen (4.2 feet, ZONE). Trae Tatum misses. Rebound secured by Derrick Allen.

[08:39] Team_005 possession (Score: 2-11)
FOUL! Shooting foul on Magic Tatum. Brandon George to the line for 2 free throws. [Team fouls: 1] (Magic Tatum: 1 personal fouls)   FT 1/2: GOOD   FT 2/2: GOOD Brandon George makes 2/2 from the line.
Score: 4-11

[08:22] Team_011 possession (Score: 4-11)
Trae Tatum makes the Midrange and draws the foul on Jalen Rozier! And-1! Trae Tatum to the line for 1. [Team fouls: 3] (Jalen Rozier: 1 personal fouls)   FT 1/1: GOOD Trae Tatum makes 1/1 from the line.
Score: 4-14

[08:07] Team_005 possession (Score: 4-14)
Jalen Rozier makes the Layup and draws the foul on Pau Barnes! And-1! Jalen Rozier to the line for 1. [Team fouls: 2] (Pau Barnes: 1 personal fouls)   FT 1/1: GOOD Jalen Rozier makes 1/1 from the line.
Score: 7-14

[07:53] Team_011 possession (Score: 7-14)
Magic Tatum attempts a 3Pt. Contested by Brandon George (5.3 feet, MAN). MAGIC TATUM MAKES IT! Assist: Evan George
Score: 7-17

[07:36] Team_005 possession (Score: 7-17)
Cade Markkanen attempts a Layup. Contested by Pau Barnes (2.8 feet, ZONE). CADE MARKKANEN MAKES IT! Assist: Anthony Rozier
Score: 9-17

[07:22] Team_011 possession (Score: 9-17)
Pau Barnes attempts a Layup. Contested by Jalen Rozier (5.6 feet, ZONE). PAU BARNES MAKES IT! Assist: Michael Carter
Score: 9-19

[07:12] Team_005 possession (Score: 9-19)
FOUL! Shooting foul on Michael Carter. Brandon George to the line for 2 free throws. [Team fouls: 3] (Michael Carter: 1 personal fouls)   FT 1/2: GOOD   FT 2/2: MISS Brandon George makes 1/2 from the line. Rebound secured by Michael Carter.
Score: 10-19

[06:57] Team_011 possession (Score: 10-19)
Magic Tatum drives and kicks out. Magic Tatum attempts a 3Pt. Contested by Derrick Allen (4.2 feet, ZONE). MAGIC TATUM MAKES IT! Assist: Evan George
Score: 10-22

[06:43] Team_005 possession (Score: 10-22)
FOUL! Reach-in foul on Trae Tatum during the drive. [Team fouls: 4] No free throws, side out. (Trae Tatum: 1 personal fouls)

[06:33] Team_005 possession (Score: 10-22)
Brandon George attempts a Layup. Contested by Pau Barnes (3.1 feet, ZONE). BRANDON GEORGE MAKES IT!
Score: 12-22

[06:16] Team_011 possession (Score: 12-22)
Pau Barnes attempts a 3Pt. Contested by Derrick Allen (4.9 feet, ZONE). Pau Barnes misses. Offensive rebound by Pau Barnes! Pau Barnes puts it back in!
Score: 12-24

[06:01] Team_005 possession (Score: 12-24)
Jalen Rozier drives, Pau Barnes stays with him. Jalen Rozier attempts a Dunk. Contested by Pau Barnes (3.3 feet, MAN). JALEN ROZIER MAKES IT! Assist: Anthony Rozier
Score: 14-24

[05:50] Team_011 possession (Score: 14-24)
FOUL! Reach-in foul on Brandon George during the drive. [Team fouls: 4] No free throws, side out. (Brandon George: 2 personal fouls)

[05:38] Team_011 possession (Score: 14-24)
Pau Barnes attempts a 3Pt. Contested by Derrick Allen (4.9 feet, ZONE). PAU BARNES MAKES IT! Assist: Evan George
Score: 14-27

[05:25] Team_005 possession (Score: 14-27)
Derrick Allen drives, Pau Barnes stays with him. Derrick Allen attempts a Dunk. Contested by Pau Barnes (3.4 feet, ZONE). Derrick Allen misses. Rebound secured by Pau Barnes.

[05:11] Team_011 possession (Score: 14-27)
FOUL! Holding foul on Cade Markkanen. [IN THE BONUS! 5 team fouls] Evan George to the line for 2 free throws. (Cade Markkanen: 1 personal fouls)   FT 1/2: GOOD   FT 2/2: GOOD Evan George makes 2/2 from the line.
Score: 14-29

[04:55] Team_005 possession (Score: 14-29)
Jalen Rozier makes the Layup and draws the foul on Pau Barnes! And-1! Jalen Rozier to the line for 1. [BONUS: 5 team fouls] (Pau Barnes: 2 personal fouls)   FT 1/1: GOOD Jalen Rozier makes 1/1 from the line.
Score: 17-29

[04:40] Team_011 possession (Score: 17-29)
Pau Barnes attempts a 3Pt. Contested by Derrick Allen (4.9 feet, ZONE). PAU BARNES MAKES IT! Assist: Michael Carter
Score: 17-32

[04:21] Team_005 possession (Score: 17-32)
Derrick Allen attempts a 3Pt. Contested by Magic Tatum (3.9 feet, ZONE). Derrick Allen misses. Rebound secured by Michael Carter.

[04:05] Team_011 possession (Score: 17-32)
Magic Tatum attempts a 3Pt. Contested by Derrick Allen (4.5 feet, ZONE). Magic Tatum misses. Rebound secured by Derrick Allen.

[03:52] Team_005 possession (Score: 17-32)
FOUL! Holding foul on Michael Carter. [IN THE BONUS! 6 team fouls] Derrick Allen to the line for 2 free throws. (Michael Carter: 2 personal fouls)   FT 1/2: GOOD   FT 2/2: MISS Derrick Allen makes 1/2 from the line. Rebound secured by Evan George.
Score: 18-32

[03:35] Team_011 possession (Score: 18-32)
Trae Tatum drives and kicks out. Michael Carter attempts a 3Pt. Contested by Derrick Allen (4.4 feet, ZONE). Michael Carter misses. Rebound secured by Derrick Allen.

[03:16] Team_005 possession (Score: 18-32)
Cade Markkanen attempts a Layup. Contested by Pau Barnes (3.0 feet, ZONE). CADE MARKKANEN MAKES IT!
Score: 20-32

[02:59] Team_011 possession (Score: 20-32)
Evan George attempts a Layup. Contested by Cade Markkanen (3.8 feet, MAN). EVAN GEORGE MAKES IT! Assist: Trae Tatum
Score: 20-34

[02:50] Team_005 possession (Score: 20-34)
Derrick Allen attempts a Midrange. Contested by Pau Barnes (3.6 feet, ZONE). Derrick Allen misses. Offensive rebound by Jalen Rozier! Jalen Rozier kicks it out.

[02:35] Team_005 possession (Score: 20-34)
FOUL! Shooting foul on Pau Barnes. Jalen Rozier to the line for 2 free throws. [BONUS: 7 team fouls] (Pau Barnes: 3 personal fouls)   FT 1/2: GOOD   FT 2/2: GOOD Jalen Rozier makes 2/2 from the line.
Score: 22-34

[02:22] Team_011 possession (Score: 22-34)
Pau Barnes attempts a Midrange. Contested by Jalen Rozier (5.8 feet, MAN). Pau Barnes misses. Rebound secured by Derrick Allen.

[02:13] Team_005 possession (Score: 22-34)
Cade Markkanen makes the Layup and draws the foul on Pau Barnes! And-1! Cade Markkanen to the line for 1. [BONUS: 8 team fouls] (Pau Barnes: 4 personal fouls)   FT 1/1: GOOD Cade Markkanen makes 1/1 from the line.
Score: 25-34

[01:58] Team_011 possession (Score: 25-34)
Trae Tatum attempts a 3Pt. Contested by Anthony Rozier (4.9 feet, MAN). Trae Tatum misses. Rebound secured by Jalen Rozier.

[01:44] Team_005 possession (Score: 25-34)
Jalen Rozier attempts a Midrange. Contested by Pau Barnes (3.7 feet, MAN). Jalen Rozier misses. Rebound secured by Evan George.

[01:25] Team_011 possession (Score: 25-34)
Trae Tatum attempts a 3Pt. Contested by Anthony Rozier (5.0 feet, ZONE). Trae Tatum misses. Rebound secured by Derrick Allen.

[01:10] Team_005 possession (Score: 25-34)
Anthony Rozier drives and kicks out. Anthony Rozier attempts a 3Pt. Contested by Trae Tatum (5.0 feet, MAN). Anthony Rozier misses. Rebound secured by Michael Carter.

[00:58] Team_011 possession (Score: 25-34)
Magic Tatum attempts a Midrange. Contested by Brandon George (5.8 feet, MAN). MAGIC TATUM MAKES IT! Assist: Pau Barnes
Score: 25-36

[00:48] Team_005 possession (Score: 25-36)
Jalen Rozier attempts a Midrange. Contested by Trae Tatum (5.3 feet, ZONE). Jalen Rozier misses. FOUL! Loose ball foul on Pau Barnes during the rebound battle. [IN THE BONUS! 9 team fouls] Cade Markkanen to the line for 2 free throws. (Pau Barnes: 5 personal fouls)   FT 1/2: GOOD   FT 2/2: MISS Cade Markkanen makes 1/2 from the line. Rebound secured by Evan George.
Score: 26-36

[00:34] Team_011 possession (Score: 26-36)
Evan George attempts a Midrange. Contested by Anthony Rozier (5.4 feet, ZONE). EVAN GEORGE MAKES IT! Assist: Magic Tatum
Score: 26-38

[00:15] Team_005 possession (Score: 26-38)
FOUL! Reach-in foul on Michael Carter during the drive. [IN THE BONUS! 10 team fouls] Derrick Allen to the line for 2 free throws. (Michael Carter: 3 personal fouls)   FT 1/2: GOOD   FT 2/2: GOOD Derrick Allen makes 2/2 from the line.
Score: 28-38

[00:02] Team_011 possession (Score: 28-38)
Michael Carter attempts a Midrange. Contested by Derrick Allen (4.6 feet, ZONE). Michael Carter misses. Offensive rebound by Pau Barnes! Pau Barnes kicks it out.

================================================================================
                              1ST QUARTER COMPLETE                              
================================================================================

1ST QUARTER SCORE: Team_005 28, Team_011 38

BOX SCORE:
================================================================================

Team_005
--------------------------------------------------------------------------------
Player                MIN  PTS  REB  AST  TO      FG   FG%      3P   3P%
--------------------------------------------------------------------------------
Jalen Rozier           12   10    3    0   0   4/6    66.7     0/0   0.0
Cade Markkanen         12    7    1    0   0   3/4    75.0     0/0   0.0
Brandon George         12    4    0    0   0   2/4    50.0     0/0   0.0
Anthony Rozier         12    2    0    2   0   1/2    50.0     0/0   0.0
Derrick Allen          12    2    5    1   0   1/5    20.0     0/0   0.0

TEAM: FG: 11/22 (50.0%), 3PT: 0/4 (0.0%), REB: 10 (2 off, 8 def), AST: 3, TO: 2
TEAM FOULS: 5 [Team_011 in BONUS]


Team_011
--------------------------------------------------------------------------------
Player                MIN  PTS  REB  AST  TO      FG   FG%      3P   3P%
--------------------------------------------------------------------------------
Magic Tatum            12   16    0    1   0   6/7    85.7     0/0   0.0
Pau Barnes             12   13    3    1   0   5/6    83.3     0/0   0.0
Evan George            12    6    6    3   0   3/4    75.0     0/0   0.0
Trae Tatum             12    3    0    1   0   1/6    16.7     0/0   0.0
Michael Carter         12    0    4    2   0   0/0     0.0     0/0   0.0

TEAM: FG: 15/23 (65.2%), 3PT: 5/10 (50.0%), REB: 12 (2 off, 10 def), AST: 8, TO: 0
TEAM FOULS: 10 [Team_005 in BONUS]

================================================================================

================================================================================
                       2ND QUARTER - Team_005 vs Team_011                       
================================================================================

[12:00] Team_005 possession (Score: 28-38)
Cade Markkanen attempts a Layup. Contested by Pau Barnes (3.2 feet, MAN). CADE MARKKANEN MAKES IT! Assist: Brandon George
Score: 30-38

[11:46] Team_011 possession (Score: 30-38)
Michael Carter drives, picks up Derrick Allen. Help arrives from Anthony Rozier! Michael Carter attempts a Dunk. Contested by Anthony Rozier (4.4 feet, MAN). MICHAEL CARTER MAKES IT! Assist: Pau Barnes
Score: 30-40

[11:32] Team_005 possession (Score: 30-40)
Derrick Allen attempts a 3Pt. Contested by Michael Carter (4.9 feet, MAN). DERRICK ALLEN MAKES IT! Assist: Brandon George
Score: 33-40

[11:17] Team_011 possession (Score: 33-40)
Michael Carter throws a bad pass! Stolen by Derrick Allen! TURNOVER! (live ball)

[11:05] Team_005 possession (Score: 33-40)
Anthony Rozier attempts a Midrange. Contested by Trae Tatum (5.1 feet, MAN). ANTHONY ROZIER MAKES IT! Assist: Jalen Rozier
Score: 35-40

[10:50] Team_011 possession (Score: 35-40)
Magic Tatum drives to the basket... Magic Tatum commits a violation (traveling/carry)! TURNOVER! (dead ball)

[10:50] Substitution (Team_005): Brandon George OUT → Blake O'Neal IN (stamina_rule2)

[10:50] Substitution (Team_005): Anthony Rozier OUT → Draymond Smith IN (stamina_rule2)

[10:50] Substitution (Team_005): Derrick Allen OUT → Lauri Wade IN (stamina_rule2)

[10:50] Substitution (Team_005): Jalen Rozier OUT → Isaiah Durant IN (stamina_rule2)

[10:50] Substitution (Team_005): Cade Markkanen OUT → Zion Parker IN (stamina_rule2)

[10:50] Substitution (Team_011): Magic Tatum OUT → Shai Leonard IN (stamina_rule2)

[10:50] Substitution (Team_011): Trae Tatum OUT → De'Aaron George IN (stamina_rule2)

[10:50] Substitution (Team_011): Michael Carter OUT → Tyrese Nowitzki IN (stamina_rule2)

[10:50] Substitution (Team_011): Pau Barnes OUT → Russell Davis IN (stamina_rule2)

[10:50] Substitution (Team_011): Evan George OUT → Pau Towns IN (stamina_rule2)

[10:38] Team_005 possession (Score: 35-40)
Draymond Smith attempts a Midrange. Contested by De'Aaron George (4.5 feet, MAN). DRAYMOND SMITH MAKES IT!
Score: 37-40

[10:21] Team_011 possession (Score: 37-40)
De'Aaron George drives, Draymond Smith stays with him. De'Aaron George attempts a Dunk. Contested by Draymond Smith (4.6 feet, MAN). DE'AARON GEORGE MAKES IT! Assist: Shai Leonard
Score: 37-42

[10:05] Team_005 possession (Score: 37-42)
Zion Parker attempts a 3Pt. Contested by Russell Davis (3.8 feet, ZONE). Zion Parker misses. Offensive rebound by Zion Parker! Zion Parker's putback is no good. Rebound secured by Pau Towns.

[09:52] Team_011 possession (Score: 37-42)
Russell Davis attempts a Midrange. Contested by Draymond Smith (3.9 feet, ZONE). Russell Davis misses. Rebound secured by Draymond Smith.

[09:37] Team_005 possession (Score: 37-42)
FOUL! Shooting foul on Russell Davis. Isaiah Durant to the line for 2 free throws. [Team fouls: 1] (Russell Davis: 1 personal fouls)   FT 1/2: GOOD   FT 2/2: GOOD Isaiah Durant makes 2/2 from the line.
Score: 39-42

[09:22] Team_011 possession (Score: 39-42)
Russell Davis makes the Layup and draws the foul on Zion Parker! And-1! Russell Davis to the line for 1. [Team fouls: 1] (Zion Parker: 1 personal fouls)   FT 1/1: GOOD Russell Davis makes 1/1 from the line.
Score: 39-45

[09:09] Team_005 possession (Score: 39-45)
Lauri Wade attempts a 3Pt. Contested by Shai Leonard (4.3 feet, ZONE). Lauri Wade misses. Offensive rebound by Zion Parker! Zion Parker's putback is no good. Rebound secured by Pau Towns.

[08:59] Team_011 possession (Score: 39-45)
De'Aaron George drives, Zion Parker stays with him. De'Aaron George attempts a Dunk. Contested by Zion Parker (4.3 feet, ZONE). De'Aaron George misses. Rebound secured by Draymond Smith.

[08:46] Team_005 possession (Score: 39-45)
Draymond Smith attempts a 3Pt. Contested by De'Aaron George (4.5 feet, MAN). Draymond Smith misses. Offensive rebound by Zion Parker! Zion Parker puts it back in!
Score: 41-45

[08:33] Team_011 possession (Score: 41-45)
Shai Leonard attempts a Midrange. Contested by Blake O'Neal (4.1 feet, MAN). Shai Leonard misses. Rebound secured by Lauri Wade.

[08:15] Team_005 possession (Score: 41-45)
Zion Parker drives, Russell Davis stays with him. Zion Parker attempts a Layup. Contested by Russell Davis (3.8 feet, ZONE). ZION PARKER MAKES IT! Assist: Blake O'Neal
Score: 43-45

[07:58] Team_011 possession (Score: 43-45)
De'Aaron George attempts a 3Pt. Contested by Blake O'Neal (4.4 feet, ZONE). DE'AARON GEORGE MAKES IT! Assist: Shai Leonard
Score: 43-48

[07:44] Team_005 possession (Score: 43-48)
Isaiah Durant attempts a Midrange. Contested by De'Aaron George (5.0 feet, ZONE). Isaiah Durant misses. Rebound secured by Pau Towns.

[07:31] Team_011 possession (Score: 43-48)
FOUL! Shooting foul on Zion Parker. Tyrese Nowitzki to the line for 2 free throws. [Team fouls: 2] (Zion Parker: 2 personal fouls)   FT 1/2: MISS   FT 2/2: MISS Tyrese Nowitzki makes 0/2 from the line. Offensive rebound by Pau Towns! Pau Towns kicks it out.

[07:16] Team_011 possession (Score: 43-48)
Russell Davis attempts a Layup. Contested by Isaiah Durant (4.0 feet, MAN). Russell Davis misses. Rebound secured by Zion Parker.

[07:01] Team_005 possession (Score: 43-48)
Lauri Wade drives, picks up Tyrese Nowitzki. Help arrives from Shai Leonard! Lauri Wade attempts a Dunk. Contested by Shai Leonard (4.7 feet, MAN). LAURI WADE MAKES IT! Assist: Zion Parker
Score: 45-48

[06:47] Team_011 possession (Score: 45-48)
Tyrese Nowitzki drives, picks up Lauri Wade. Help arrives from Blake O'Neal! Tyrese Nowitzki attempts a Layup. Contested by Blake O'Neal (5.0 feet, MAN). Tyrese Nowitzki misses. Rebound secured by Lauri Wade.

[06:35] Team_005 possession (Score: 45-48)
Blake O'Neal attempts a 3Pt. Contested by Shai Leonard (4.7 feet, MAN). Blake O'Neal misses. Offensive rebound by Zion Parker! Zion Parker puts it back in!
Score: 47-48

[06:18] Team_011 possession (Score: 47-48)
Russell Davis drives, Isaiah Durant stays with him. Russell Davis attempts a Dunk. Contested by Isaiah Durant (4.0 feet, MAN). Russell Davis misses. FOUL! Loose ball foul on Draymond Smith during the rebound battle. [Team fouls: 3] No free throws, side out. (Draymond Smith: 1 personal fouls)

[06:04] Team_011 possession (Score: 47-48)
Shai Leonard drives, picks up Blake O'Neal. Help arrives from Draymond Smith! Shai Leonard attempts a Dunk. Contested by Draymond Smith (4.1 feet, MAN). SHAI LEONARD MAKES IT!
Score: 47-50

[05:48] Team_005 possession (Score: 47-50)
FOUL! Reach-in foul on Pau Towns during the drive. [Team fouls: 2] No free throws, side out. (Pau Towns: 1 personal fouls)

[05:31] Team_005 possession (Score: 47-50)
Blake O'Neal attempts a Layup. Contested by Russell Davis (4.1 feet, ZONE). BLAKE O'NEAL MAKES IT! Assist: Zion Parker
Score: 49-50

[05:18] Team_011 possession (Score: 49-50)
Tyrese Nowitzki attempts a 3Pt. Contested by Blake O'Neal (4.0 feet, ZONE). Tyrese Nowitzki misses. Offensive rebound by Tyrese Nowitzki! Tyrese Nowitzki kicks it out.

[05:05] Team_011 possession (Score: 49-50)
De'Aaron George attempts a Midrange. Contested by Zion Parker (4.3 feet, ZONE). DE'AARON GEORGE MAKES IT!
Score: 49-52

[04:48] Team_005 possession (Score: 49-52)
FOUL! Shooting foul on Russell Davis. Isaiah Durant to the line for 2 free throws. [Team fouls: 3] (Russell Davis: 2 personal fouls)   FT 1/2: MISS   FT 2/2: GOOD Isaiah Durant makes 1/2 from the line.
Score: 50-52

[04:34] Team_011 possession (Score: 50-52)
Russell Davis drives, Isaiah Durant stays with him. Russell Davis attempts a Layup. Contested by Isaiah Durant (4.0 feet, MAN). RUSSELL DAVIS MAKES IT!
Score: 50-54

[04:25] Team_005 possession (Score: 50-54)
Zion Parker attempts a Layup. Contested by Pau Towns (5.0 feet, MAN). ZION PARKER MAKES IT! Assist: Isaiah Durant
Score: 52-54

[04:13] Team_011 possession (Score: 52-54)
Pau Towns throws a bad pass! Stolen by Zion Parker! TURNOVER! (live ball)

[03:57] Team_005 possession (Score: 52-54)
FOUL! Shooting foul on Shai Leonard. Isaiah Durant to the line for 3 free throws. [Team fouls: 4] (Shai Leonard: 1 personal fouls)   FT 1/3: GOOD   FT 2/3: GOOD   FT 3/3: GOOD Isaiah Durant makes 3/3 from the line.
Score: 55-54

[03:44] Team_011 possession (Score: 55-54)
Russell Davis attempts a Layup. Contested by Isaiah Durant (4.0 feet, MAN). RUSSELL DAVIS MAKES IT! Assist: Pau Towns
Score: 55-56

[03:33] Team_005 possession (Score: 55-56)
Lauri Wade attempts a Midrange. Contested by Tyrese Nowitzki (4.7 feet, ZONE). LAURI WADE MAKES IT!
Score: 57-56

[03:17] Team_011 possession (Score: 57-56)
Shai Leonard drives, Blake O'Neal stays with him. Shai Leonard attempts a Layup. Contested by Blake O'Neal (4.2 feet, MAN). Shai Leonard misses. Offensive rebound by Tyrese Nowitzki! Tyrese Nowitzki kicks it out.

[03:00] Team_011 possession (Score: 57-56)
FOUL! Holding foul on Zion Parker. [Team fouls: 4] No free throws, side out. (Zion Parker: 3 personal fouls)

[02:46] Team_011 possession (Score: 57-56)
Shai Leonard drives and kicks out. De'Aaron George attempts a Midrange. Contested by Draymond Smith (4.4 feet, MAN). De'Aaron George misses. Rebound secured by Draymond Smith.

[02:26] Team_005 possession (Score: 57-56)
FOUL! Shooting foul on Tyrese Nowitzki. Lauri Wade to the line for 2 free throws. [BONUS: 5 team fouls] (Tyrese Nowitzki: 1 personal fouls)   FT 1/2: GOOD   FT 2/2: GOOD Lauri Wade makes 2/2 from the line.
Score: 59-56

[02:12] Team_011 possession (Score: 59-56)
Tyrese Nowitzki drives to the basket... Tyrese Nowitzki throws a bad pass out of bounds! TURNOVER! (dead ball)

[01:58] Team_005 possession (Score: 59-56)
Zion Parker attempts a Layup. Contested by Pau Towns (5.2 feet, MAN). Zion Parker misses. Offensive rebound by Zion Parker! Zion Parker's putback is no good. Rebound secured by Pau Towns.

[01:41] Team_011 possession (Score: 59-56)
De'Aaron George attempts a 3Pt. Contested by Draymond Smith (4.8 feet, MAN). DE'AARON GEORGE MAKES IT! Assist: Russell Davis
Score: 59-59

[01:25] Team_005 possession (Score: 59-59)
FOUL! Holding foul on Pau Towns. [IN THE BONUS! 6 team fouls] Zion Parker to the line for 2 free throws. (Pau Towns: 2 personal fouls)   FT 1/2: GOOD   FT 2/2: GOOD Zion Parker makes 2/2 from the line.
Score: 61-59

[01:08] Team_011 possession (Score: 61-59)
Russell Davis attempts a Midrange. Contested by Isaiah Durant (4.3 feet, MAN). Russell Davis misses. Rebound secured by Lauri Wade.

[00:53] Team_005 possession (Score: 61-59)
FOUL! Offensive foul on Blake O'Neal! Shai Leonard drew the charge! [Team fouls: 5] (Blake O'Neal: 1 personal fouls) TURNOVER! (dead ball)

[00:38] Team_011 possession (Score: 61-59)
De'Aaron George commits a violation (traveling/carry)! TURNOVER! (dead ball)

[00:24] Team_005 possession (Score: 61-59)
Draymond Smith attempts a 3Pt. Contested by Shai Leonard (4.4 feet, ZONE). Draymond Smith misses. Rebound secured by Tyrese Nowitzki.

[00:10] Team_011 possession (Score: 61-59)
Tyrese Nowitzki attempts a Midrange. Contested by Lauri Wade (5.3 feet, MAN). TYRESE NOWITZKI MAKES IT! Assist: Pau Towns
Score: 61-61

================================================================================
                              2ND QUARTER COMPLETE                              
================================================================================

2ND QUARTER SCORE: Team_005 33, Team_011 23

BOX SCORE:
================================================================================

Team_005
--------------------------------------------------------------------------------
Player                MIN  PTS  REB  AST  TO      FG   FG%      3P   3P%
--------------------------------------------------------------------------------
Zion Parker            11   10    3    2   0   5/7    71.4     0/0   0.0
Isaiah Durant          11    6    0    1   0   3/4    75.0     0/0   0.0
Lauri Wade             11    6    3    0   0   3/4    75.0     0/0   0.0
Derrick Allen          13    3    0    0   0   1/1   100.0     0/0   0.0
Cade Markkanen         13    2    0    0   0   1/1   100.0     0/0   0.0
Anthony Rozier         13    2    0    0   0   1/1   100.0     0/0   0.0
Draymond Smith         11    2    3    0   0   1/2    50.0     0/0   0.0
Blake O'Neal           11    2    0    1   0   1/1   100.0     0/0   0.0
Brandon George         13    0    0    2   0   0/0     0.0     0/0   0.0
Jalen Rozier           13    0    0    1   0   0/0     0.0     0/0   0.0

TEAM: FG: 16/21 (76.2%), 3PT: 4/7 (57.1%), REB: 12 (5 off, 7 def), AST: 7, TO: 1
TEAM FOULS: 5 [Team_011 in BONUS]


Team_011
--------------------------------------------------------------------------------
Player                MIN  PTS  REB  AST  TO      FG   FG%      3P   3P%
--------------------------------------------------------------------------------
De'Aaron George        11   10    0    0   0   4/5    80.0     0/0   0.0
Russell Davis          11    7    0    1   0   3/6    50.0     0/0   0.0
Michael Carter         13    2    0    0   0   1/1   100.0     0/0   0.0
Shai Leonard           11    2    0    2   0   1/3    33.3     0/0   0.0
Tyrese Nowitzki        11    2    3    0   0   1/2    50.0     0/0   0.0
Pau Barnes             13    0    0    1   0   0/0     0.0     0/0   0.0
Pau Towns              11    0    6    2   0   0/0     0.0     0/0   0.0

TEAM: FG: 10/17 (58.8%), 3PT: 2/2 (100.0%), REB: 6 (4 off, 2 def), AST: 6, TO: 5
TEAM FOULS: 6 [Team_005 in BONUS]

================================================================================

================================================================================
                       3RD QUARTER - Team_005 vs Team_011                       
================================================================================

[12:00] Team_005 possession (Score: 61-61)
Cade Markkanen throws a bad pass! Stolen by Pau Barnes! TURNOVER! (live ball)

[11:48] Team_011 possession (Score: 61-61)
Michael Carter drives, Derrick Allen stays with him. Michael Carter attempts a Dunk. Contested by Derrick Allen (4.1 feet, MAN). MICHAEL CARTER MAKES IT! Assist: Magic Tatum
Score: 61-63

[11:35] Team_005 possession (Score: 61-63)
Anthony Rozier attempts a Midrange. Contested by Trae Tatum (4.7 feet, MAN). ANTHONY ROZIER MAKES IT!
Score: 63-63

[11:16] Team_011 possession (Score: 63-63)
Michael Carter drives to the basket... Michael Carter throws a bad pass out of bounds! TURNOVER! (dead ball)

[11:06] Team_005 possession (Score: 63-63)
Brandon George attempts a Midrange. Contested by Pau Barnes (3.1 feet, ZONE). Brandon George misses. Rebound secured by Evan George.

[10:54] Team_011 possession (Score: 63-63)
Magic Tatum throws a bad pass out of bounds! TURNOVER! (dead ball)

[10:38] Team_005 possession (Score: 63-63)
FOUL! Offensive foul on Brandon George! Magic Tatum drew the charge! [Team fouls: 1] (Brandon George: 1 personal fouls) TURNOVER! (dead ball)

[10:22] Team_011 possession (Score: 63-63)
FOUL! Holding foul on Derrick Allen. [Team fouls: 2] No free throws, side out. (Derrick Allen: 1 personal fouls)

[10:10] Team_011 possession (Score: 63-63)
Evan George attempts a 3Pt. Contested by Cade Markkanen (3.5 feet, MAN). Evan George misses. Rebound secured by Cade Markkanen.

[09:54] Team_005 possession (Score: 63-63)
Jalen Rozier attempts a Midrange. Contested by Magic Tatum (3.8 feet, ZONE). Jalen Rozier misses. Offensive rebound by Jalen Rozier! Jalen Rozier kicks it out.

[09:37] Team_005 possession (Score: 63-63)
Derrick Allen attempts a Midrange. Contested by Michael Carter (4.5 feet, MAN). Derrick Allen misses. Offensive rebound by Jalen Rozier! Jalen Rozier kicks it out.

[09:24] Team_005 possession (Score: 63-63)
Anthony Rozier attempts a 3Pt. Contested by Trae Tatum (4.7 feet, MAN). Anthony Rozier misses. Rebound secured by Evan George.

[09:12] Team_011 possession (Score: 63-63)
Michael Carter makes the 3Pt and draws the foul on Derrick Allen! And-1! Michael Carter to the line for 1. [Team fouls: 3] (Derrick Allen: 2 personal fouls)   FT 1/1: GOOD Michael Carter makes 1/1 from the line.
Score: 63-67

[08:59] Team_005 possession (Score: 63-67)
Jalen Rozier makes the Dunk and draws the foul on Magic Tatum! And-1! Jalen Rozier to the line for 1. [Team fouls: 1] (Magic Tatum: 1 personal fouls)   FT 1/1: GOOD Jalen Rozier makes 1/1 from the line.
Score: 66-67

[08:48] Team_011 possession (Score: 66-67)
Trae Tatum attempts a 3Pt. Contested by Derrick Allen (4.2 feet, ZONE). Trae Tatum misses. Rebound secured by Cade Markkanen.

[08:35] Team_005 possession (Score: 66-67)
Brandon George drives, Magic Tatum stays with him. Brandon George attempts a Layup. Contested by Magic Tatum (3.6 feet, MAN). BRANDON GEORGE MAKES IT! Assist: Anthony Rozier
Score: 68-67

[08:21] Team_011 possession (Score: 68-67)
Michael Carter attempts a Layup. Contested by Derrick Allen (4.1 feet, MAN). Michael Carter misses. Rebound secured by Jalen Rozier.

[08:07] Team_005 possession (Score: 68-67)
Jalen Rozier attempts a 3Pt. Contested by Pau Barnes (3.3 feet, MAN). Jalen Rozier misses. Rebound secured by Evan George.

[07:52] Team_011 possession (Score: 68-67)
Michael Carter attempts a Midrange. Contested by Derrick Allen (4.1 feet, MAN). MICHAEL CARTER MAKES IT! Assist: Evan George
Score: 68-69

[07:37] Team_005 possession (Score: 68-69)
Cade Markkanen attempts a 3Pt. Contested by Pau Barnes (2.8 feet, MAN). Cade Markkanen misses. Rebound secured by Evan George.

[07:24] Team_011 possession (Score: 68-69)
Trae Tatum loses the ball! Stripped by Anthony Rozier! TURNOVER! (live ball)

[07:09] Team_005 possession (Score: 68-69)
Derrick Allen attempts a 3Pt. Contested by Michael Carter (4.5 feet, MAN). Derrick Allen misses. Offensive rebound by Cade Markkanen! Cade Markkanen's putback is no good. Rebound secured by Evan George.

[06:50] Team_011 possession (Score: 68-69)
FOUL! Shooting foul on Cade Markkanen. Evan George to the line for 2 free throws. [Team fouls: 4] (Cade Markkanen: 1 personal fouls)   FT 1/2: MISS   FT 2/2: GOOD Evan George makes 1/2 from the line.
Score: 68-70

[06:33] Team_005 possession (Score: 68-70)
Cade Markkanen drives, Pau Barnes stays with him. Cade Markkanen attempts a Layup. Contested by Pau Barnes (2.8 feet, MAN). CADE MARKKANEN MAKES IT! Assist: Anthony Rozier
Score: 70-70

[06:22] Team_011 possession (Score: 70-70)
Michael Carter attempts a Midrange. Contested by Derrick Allen (4.1 feet, ZONE). Michael Carter misses. Rebound secured by Cade Markkanen.

[06:10] Team_005 possession (Score: 70-70)
Cade Markkanen attempts a Midrange. Contested by Trae Tatum (4.4 feet, ZONE). Cade Markkanen misses. Offensive rebound by Cade Markkanen! Cade Markkanen's putback is no good. Rebound secured by Evan George.

[05:55] Team_011 possession (Score: 70-70)
FOUL! Holding foul on Brandon George. [IN THE BONUS! 5 team fouls] Magic Tatum to the line for 2 free throws. (Brandon George: 2 personal fouls)   FT 1/2: GOOD   FT 2/2: GOOD Magic Tatum makes 2/2 from the line.
Score: 70-72

[05:42] Team_005 possession (Score: 70-72)
Derrick Allen attempts a Midrange. Contested by Pau Barnes (3.4 feet, ZONE). Derrick Allen misses. Rebound secured by Evan George.

[05:26] Team_011 possession (Score: 70-72)
Magic Tatum attempts a Midrange. Contested by Anthony Rozier (4.8 feet, ZONE). Magic Tatum misses. Rebound secured by Derrick Allen.

[05:12] Team_005 possession (Score: 70-72)
Brandon George attempts a Midrange. Contested by Magic Tatum (3.6 feet, MAN). Brandon George misses. Rebound secured by Pau Barnes.

[04:56] Team_011 possession (Score: 70-72)
Magic Tatum makes the Layup and draws the foul on Cade Markkanen! And-1! Magic Tatum to the line for 1. [BONUS: 6 team fouls] (Cade Markkanen: 2 personal fouls)   FT 1/1: GOOD Magic Tatum makes 1/1 from the line.
Score: 70-75

[04:45] Team_005 possession (Score: 70-75)
FOUL! Reach-in foul on Pau Barnes during the drive. [Team fouls: 2] No free throws, side out. (Pau Barnes: 1 personal fouls)

[04:28] Team_005 possession (Score: 70-75)
Anthony Rozier attempts a 3Pt. Contested by Trae Tatum (4.8 feet, MAN). Anthony Rozier misses. Rebound secured by Evan George.

[04:17] Team_011 possession (Score: 70-75)
Michael Carter attempts a 3Pt. Contested by Derrick Allen (4.2 feet, ZONE). Michael Carter misses. Offensive rebound by Pau Barnes! Pau Barnes's putback is no good. Offensive rebound by Pau Barnes! Pau Barnes kicks it out.

[04:02] Team_011 possession (Score: 70-75)
Evan George attempts a Layup. Contested by Cade Markkanen (3.8 feet, ZONE). Evan George misses. Rebound secured by Cade Markkanen.

[03:48] Team_005 possession (Score: 70-75)
Anthony Rozier attempts a Midrange. Contested by Michael Carter (4.3 feet, ZONE). Anthony Rozier misses. Offensive rebound by Jalen Rozier! Jalen Rozier kicks it out.

[03:34] Team_005 possession (Score: 70-75)
Brandon George attempts a Midrange. Contested by Michael Carter (4.5 feet, ZONE). Brandon George misses. Rebound secured by Pau Barnes.

[03:18] Team_011 possession (Score: 70-75)
Pau Barnes makes the Dunk and draws the foul on Anthony Rozier! And-1! Pau Barnes to the line for 1. [BONUS: 7 team fouls] (Anthony Rozier: 1 personal fouls)   FT 1/1: GOOD Pau Barnes makes 1/1 from the line.
Score: 70-78

[03:02] Team_005 possession (Score: 70-78)
Anthony Rozier attempts a Midrange. Contested by Trae Tatum (4.9 feet, MAN). Anthony Rozier misses. Rebound secured by Pau Barnes.

[02:47] Team_011 possession (Score: 70-78)
FOUL! Reach-in foul on Cade Markkanen during the drive. [IN THE BONUS! 8 team fouls] Evan George to the line for 2 free throws. (Cade Markkanen: 3 personal fouls)   FT 1/2: GOOD   FT 2/2: MISS Evan George makes 1/2 from the line. Rebound secured by Cade Markkanen.
Score: 70-79

[02:33] Team_005 possession (Score: 70-79)
Anthony Rozier attempts a 3Pt. Contested by Trae Tatum (4.9 feet, MAN). Anthony Rozier misses. Rebound secured by Evan George.

[02:20] Team_011 possession (Score: 70-79)
Trae Tatum attempts a Midrange. Contested by Anthony Rozier (4.9 feet, MAN). Trae Tatum misses. Rebound secured by Cade Markkanen.

[02:09] Team_005 possession (Score: 70-79)
Anthony Rozier attempts a 3Pt. Contested by Trae Tatum (5.0 feet, MAN). Anthony Rozier misses. Rebound secured by Pau Barnes.

[01:54] Team_011 possession (Score: 70-79)
Michael Carter drives and kicks out. Magic Tatum makes the Midrange and draws the foul on Derrick Allen! And-1! Magic Tatum to the line for 1. [BONUS: 9 team fouls] (Derrick Allen: 3 personal fouls)   FT 1/1: GOOD Magic Tatum makes 1/1 from the line.
Score: 70-82

[01:41] Team_005 possession (Score: 70-82)
Jalen Rozier drives, Evan George stays with him. Jalen Rozier attempts a Layup. Contested by Evan George (5.8 feet, ZONE). Jalen Rozier misses. Offensive rebound by Cade Markkanen! Cade Markkanen kicks it out.

[01:31] Team_005 possession (Score: 70-82)
FOUL! Shooting foul on Pau Barnes. Cade Markkanen to the line for 2 free throws. [Team fouls: 3] (Pau Barnes: 2 personal fouls)   FT 1/2: GOOD   FT 2/2: GOOD Cade Markkanen makes 2/2 from the line.
Score: 72-82

[01:16] Team_011 possession (Score: 72-82)
Magic Tatum drives to the basket... Magic Tatum throws a bad pass out of bounds! TURNOVER! (dead ball)

[01:16] Substitution (Team_005): Brandon George OUT → Blake O'Neal IN (stamina_rule2)

[01:16] Substitution (Team_005): Anthony Rozier OUT → Draymond Smith IN (stamina_rule2)

[01:16] Substitution (Team_005): Derrick Allen OUT → Lauri Wade IN (stamina_rule2)

[01:16] Substitution (Team_005): Jalen Rozier OUT → Isaiah Durant IN (stamina_rule2)

[01:16] Substitution (Team_005): Cade Markkanen OUT → Zion Parker IN (stamina_rule2)

[01:16] Substitution (Team_011): Magic Tatum OUT → Shai Leonard IN (stamina_rule2)

[01:16] Substitution (Team_011): Trae Tatum OUT → De'Aaron George IN (stamina_rule2)

[01:16] Substitution (Team_011): Michael Carter OUT → Tyrese Nowitzki IN (stamina_rule2)

[01:16] Substitution (Team_011): Pau Barnes OUT → Russell Davis IN (stamina_rule2)

[01:16] Substitution (Team_011): Evan George OUT → Pau Towns IN (stamina_rule2)

[01:00] Team_005 possession (Score: 72-82)
Lauri Wade drives and kicks out. Draymond Smith attempts a 3Pt. Contested by Shai Leonard (4.3 feet, ZONE). Draymond Smith misses. Rebound secured by Russell Davis.

[00:45] Team_011 possession (Score: 72-82)
Pau Towns drives to the basket... Pau Towns throws a bad pass! Stolen by Zion Parker! TURNOVER! (live ball)

[00:26] Team_005 possession (Score: 72-82)
Zion Parker attempts a Layup. BLOCKED BY RUSSELL DAVIS! Ball is loose! Rebound secured by Tyrese Nowitzki.

[00:08] Team_011 possession (Score: 72-82)
De'Aaron George attempts a 3Pt. Contested by Blake O'Neal (4.4 feet, ZONE). De'Aaron George misses. Rebound secured by Zion Parker.

================================================================================
                              3RD QUARTER COMPLETE                              
================================================================================

3RD QUARTER SCORE: Team_005 11, Team_011 21

BOX SCORE:
================================================================================

Team_005
--------------------------------------------------------------------------------
Player                MIN  PTS  REB  AST  TO      FG   FG%      3P   3P%
--------------------------------------------------------------------------------
Cade Markkanen         24    4    7    0   0   2/4    50.0     0/0   0.0
Jalen Rozier           24    3    4    0   0   1/2    50.0     0/0   0.0
Anthony Rozier         24    2    0    2   0   1/6    16.7     0/0   0.0
Brandon George         24    2    0    0   0   1/4    25.0     0/0   0.0
Derrick Allen          24    0    1    0   0   0/2     0.0     0/0   0.0
Lauri Wade             12    0    0    0   0   0/1     0.0     0/0   0.0
Zion Parker            12    0    1    0   0   0/1     0.0     0/0   0.0

TEAM: FG: 5/20 (25.0%), 3PT: 0/7 (0.0%), REB: 15 (6 off, 9 def), AST: 2, TO: 2
TEAM FOULS: 9 [Team_011 in BONUS]


Team_011
--------------------------------------------------------------------------------
Player                MIN  PTS  REB  AST  TO      FG   FG%      3P   3P%
--------------------------------------------------------------------------------
Michael Carter         24    8    0    0   0   3/5    60.0     0/0   0.0
Magic Tatum            24    8    0    1   0   3/4    75.0     0/0   0.0
Pau Barnes             24    3    5    0   0   1/1   100.0     0/0   0.0
Evan George            24    1    9    1   0   1/4    25.0     0/0   0.0
Trae Tatum             24    0    0    0   0   0/2     0.0     0/0   0.0
Russell Davis          12    0    1    0   0   0/0     0.0     0/0   0.0
Tyrese Nowitzki        12    0    1    0   0   0/0     0.0     0/0   0.0
De'Aaron George        12    0    0    0   0   0/1     0.0     0/0   0.0

TEAM: FG: 8/17 (47.1%), 3PT: 1/4 (25.0%), REB: 14 (1 off, 13 def), AST: 2, TO: 5
TEAM FOULS: 3

================================================================================

================================================================================
                       4TH QUARTER - Team_005 vs Team_011                       
================================================================================

[12:00] Substitution (Team_005): Brandon George OUT (stamina: 71) → Blake O'Neal IN (comeback_detected)

[12:00] Substitution (Team_011): Magic Tatum OUT (stamina: 75) → Shai Leonard IN (comeback_detected)

[12:00] Team_005 possession (Score: 72-82)
Anthony Rozier drives, Trae Tatum stays with him. Anthony Rozier attempts a Dunk. Contested by Trae Tatum (4.8 feet, MAN). ANTHONY ROZIER MAKES IT!
Score: 74-82

[11:48] Team_011 possession (Score: 74-82)
FOUL! Holding foul on Blake O'Neal. [Team fouls: 1] No free throws, side out. (Blake O'Neal: 1 personal fouls)

[11:35] Team_011 possession (Score: 74-82)
Michael Carter attempts a 3Pt. Contested by Blake O'Neal (3.9 feet, ZONE). MICHAEL CARTER MAKES IT! Assist: Trae Tatum
Score: 74-85

[11:21] Team_005 possession (Score: 74-85)
Blake O'Neal attempts a Layup. Contested by Pau Barnes (3.7 feet, ZONE). BLAKE O'NEAL MAKES IT! Assist: Cade Markkanen
Score: 76-85

[11:05] Team_011 possession (Score: 76-85)
FOUL! Offensive foul on Pau Barnes! Jalen Rozier drew the charge! [Team fouls: 1] (Pau Barnes: 1 personal fouls) TURNOVER! (dead ball)

[10:52] Team_005 possession (Score: 76-85)
FOUL! Reach-in foul on Michael Carter during the drive. [Team fouls: 2] No free throws, side out. (Michael Carter: 1 personal fouls)

[10:40] Team_005 possession (Score: 76-85)
FOUL! Shooting foul on Pau Barnes. Jalen Rozier to the line for 2 free throws. [Team fouls: 3] (Pau Barnes: 2 personal fouls)   FT 1/2: MISS   FT 2/2: GOOD Jalen Rozier makes 1/2 from the line.
Score: 77-85

[10:25] Team_011 possession (Score: 77-85)
Michael Carter attempts a Layup. Contested by Derrick Allen (4.4 feet, MAN). MICHAEL CARTER MAKES IT! Assist: Trae Tatum
Score: 77-87

[10:14] Team_005 possession (Score: 77-87)
Derrick Allen attempts a Midrange. Contested by Michael Carter (4.9 feet, MAN). Derrick Allen misses. Rebound secured by Michael Carter.

[09:58] Team_011 possession (Score: 77-87)
Evan George attempts a 3Pt. Contested by Cade Markkanen (4.1 feet, MAN). Evan George misses. Rebound secured by Cade Markkanen.

[09:46] Team_005 possession (Score: 77-87)
Jalen Rozier attempts a 3Pt. Contested by Shai Leonard (4.5 feet, ZONE). Jalen Rozier misses. Rebound secured by Evan George.

[09:32] Team_011 possession (Score: 77-87)
FOUL! Holding foul on Jalen Rozier. [Team fouls: 2] No free throws, side out. (Jalen Rozier: 1 personal fouls)

[09:18] Team_011 possession (Score: 77-87)
Evan George attempts a Midrange. Contested by Cade Markkanen (4.2 feet, MAN). Evan George misses. Rebound secured by Derrick Allen.

[09:06] Team_005 possession (Score: 77-87)
Blake O'Neal makes the Layup and draws the foul on Pau Barnes! And-1! Blake O'Neal to the line for 1. [Team fouls: 4] (Pau Barnes: 3 personal fouls)   FT 1/1: GOOD Blake O'Neal makes 1/1 from the line.
Score: 80-87

[08:50] Team_011 possession (Score: 80-87)
Trae Tatum attempts a Layup. Contested by Anthony Rozier (5.1 feet, MAN). Trae Tatum misses. Rebound secured by Jalen Rozier.

[08:35] Team_005 possession (Score: 80-87)
Anthony Rozier attempts a 3Pt. Contested by Shai Leonard (4.3 feet, ZONE). Anthony Rozier misses. Rebound secured by Michael Carter.

[08:19] Team_011 possession (Score: 80-87)
FOUL! Reach-in foul on Jalen Rozier during the drive. [Team fouls: 3] No free throws, side out. (Jalen Rozier: 2 personal fouls)

[08:09] Team_011 possession (Score: 80-87)
Michael Carter attempts a 3Pt. Contested by Derrick Allen (4.7 feet, MAN). Michael Carter misses. Rebound secured by Jalen Rozier.

[07:55] Team_005 possession (Score: 80-87)
Cade Markkanen drives to the basket... Cade Markkanen throws a bad pass out of bounds! TURNOVER! (dead ball)

[07:55] Substitution (Team_005): Anthony Rozier OUT → Draymond Smith IN (stamina_rule2)

[07:55] Substitution (Team_005): Derrick Allen OUT → Lauri Wade IN (stamina_rule2)

[07:55] Substitution (Team_005): Jalen Rozier OUT → Isaiah Durant IN (stamina_rule2)

[07:55] Substitution (Team_005): Cade Markkanen OUT → Zion Parker IN (stamina_rule2)

[07:55] Substitution (Team_011): Trae Tatum OUT → De'Aaron George IN (stamina_rule2)

[07:55] Substitution (Team_011): Michael Carter OUT → Tyrese Nowitzki IN (stamina_rule2)

[07:55] Substitution (Team_011): Pau Barnes OUT → Russell Davis IN (stamina_rule2)

[07:55] Substitution (Team_011): Evan George OUT → Pau Towns IN (stamina_rule2)

[07:45] Team_011 possession (Score: 80-87)
Shai Leonard makes the Layup and draws the foul on Zion Parker! And-1! Shai Leonard to the line for 1. [Team fouls: 4] (Zion Parker: 1 personal fouls)   FT 1/1: MISS Shai Leonard makes 0/1 from the line. Rebound secured by Draymond Smith.
Score: 80-89

[07:31] Team_005 possession (Score: 80-89)
Blake O'Neal drives and kicks out. Zion Parker attempts a 3Pt. Contested by Pau Towns (5.0 feet, MAN). Zion Parker misses. Rebound secured by Pau Towns.

[07:14] Team_011 possession (Score: 80-89)
Tyrese Nowitzki attempts a 3Pt. Contested by Lauri Wade (5.0 feet, MAN). Tyrese Nowitzki misses. Rebound secured by Lauri Wade.

[06:57] Team_005 possession (Score: 80-89)
Draymond Smith drives to the basket... Draymond Smith throws a bad pass out of bounds! TURNOVER! (dead ball)

[06:40] Team_011 possession (Score: 80-89)
Pau Towns drives to the basket... Pau Towns throws a bad pass! Stolen by Zion Parker! TURNOVER! (live ball)

[06:29] Team_005 possession (Score: 80-89)
FOUL! Holding foul on De'Aaron George. [IN THE BONUS! 5 team fouls] Draymond Smith to the line for 2 free throws. (De'Aaron George: 1 personal fouls)   FT 1/2: MISS   FT 2/2: GOOD Draymond Smith makes 1/2 from the line.
Score: 81-89

[06:16] Team_011 possession (Score: 81-89)
Pau Towns attempts a Layup. Contested by Zion Parker (4.0 feet, MAN). PAU TOWNS MAKES IT!
Score: 81-91

[06:01] Team_005 possession (Score: 81-91)
Lauri Wade attempts a 3Pt. Contested by Tyrese Nowitzki (4.7 feet, MAN). Lauri Wade misses. Rebound secured by Pau Towns.

[05:44] Team_011 possession (Score: 81-91)
De'Aaron George attempts a 3Pt. Contested by Blake O'Neal (4.5 feet, ZONE). De'Aaron George misses. Offensive rebound by Tyrese Nowitzki! Tyrese Nowitzki kicks it out.

[05:32] Team_011 possession (Score: 81-91)
Russell Davis attempts a Midrange. Contested by Isaiah Durant (4.0 feet, MAN). Russell Davis misses. Rebound secured by Lauri Wade.

[05:19] Team_005 possession (Score: 81-91)
Isaiah Durant makes the Midrange and draws the foul on Russell Davis! And-1! Isaiah Durant to the line for 1. [BONUS: 6 team fouls] (Russell Davis: 1 personal fouls)   FT 1/1: MISS Isaiah Durant makes 0/1 from the line. FOUL! Loose ball foul on Russell Davis during the free throw rebound! [IN THE BONUS! 7 team fouls] Zion Parker to the line for 2 free throws. (Russell Davis: 2 personal fouls)   FT 1/2: GOOD   FT 2/2: GOOD Zion Parker makes 2/2 from the line.
Score: 85-91

[05:03] Team_011 possession (Score: 85-91)
Tyrese Nowitzki attempts a Midrange. Contested by Lauri Wade (5.0 feet, MAN). Tyrese Nowitzki misses. Rebound secured by Zion Parker.

[04:48] Team_005 possession (Score: 85-91)
Lauri Wade attempts a Midrange. Contested by Russell Davis (3.8 feet, ZONE). LAURI WADE MAKES IT!
Score: 87-91

[04:30] Team_011 possession (Score: 87-91)
Pau Towns attempts a Midrange. Contested by Zion Parker (4.0 feet, MAN). Pau Towns misses. Rebound secured by Zion Parker.

[04:19] Team_005 possession (Score: 87-91)
Draymond Smith attempts a Layup. Contested by De'Aaron George (4.5 feet, MAN). DRAYMOND SMITH MAKES IT! Assist: Blake O'Neal
Score: 89-91

[04:09] Team_011 possession (Score: 89-91)
Tyrese Nowitzki attempts a 3Pt. Contested by Blake O'Neal (4.3 feet, ZONE). Tyrese Nowitzki misses. Rebound secured by Zion Parker.

[03:53] Team_005 possession (Score: 89-91)
Isaiah Durant attempts a 3Pt. Contested by Russell Davis (4.0 feet, MAN). Isaiah Durant misses. Rebound secured by Pau Towns.

[03:41] Team_011 possession (Score: 89-91)
De'Aaron George attempts a 3Pt. Contested by Blake O'Neal (4.7 feet, ZONE). De'Aaron George misses. Rebound secured by Draymond Smith.

[03:25] Team_005 possession (Score: 89-91)
FOUL! Holding foul on Tyrese Nowitzki. [IN THE BONUS! 8 team fouls] Lauri Wade to the line for 2 free throws. (Tyrese Nowitzki: 1 personal fouls)   FT 1/2: GOOD   FT 2/2: GOOD Lauri Wade makes 2/2 from the line.
Score: 91-91

[03:11] Team_011 possession (Score: 91-91)
Pau Towns drives to the basket... Pau Towns loses control! Ball rolls out of bounds! TURNOVER! (dead ball)

[02:53] Team_005 possession (Score: 91-91)
Isaiah Durant drives and kicks out. Lauri Wade attempts a 3Pt. Contested by Tyrese Nowitzki (4.7 feet, MAN). Lauri Wade misses. Rebound secured by Russell Davis.

[02:35] Team_011 possession (Score: 91-91)
FOUL! Holding foul on Lauri Wade. [IN THE BONUS! 5 team fouls] Tyrese Nowitzki to the line for 2 free throws. (Lauri Wade: 1 personal fouls)   FT 1/2: GOOD   FT 2/2: GOOD Tyrese Nowitzki makes 2/2 from the line.
Score: 91-93

[02:22] Team_005 possession (Score: 91-93)
Zion Parker drives to the basket... Zion Parker loses control! Ball rolls out of bounds! TURNOVER! (dead ball)

[02:10] Team_011 possession (Score: 91-93)
Russell Davis attempts a 3Pt. Contested by Blake O'Neal (4.2 feet, ZONE). Russell Davis misses. Rebound secured by Zion Parker.

[01:57] Team_005 possession (Score: 91-93)
Zion Parker attempts a Midrange. Contested by Pau Towns (5.0 feet, MAN). Zion Parker misses. Rebound secured by Tyrese Nowitzki.

[01:45] Team_011 possession (Score: 91-93)
De'Aaron George attempts a Midrange. Contested by Lauri Wade (5.4 feet, ZONE). De'Aaron George misses. Rebound secured by Lauri Wade.

[01:33] Team_005 possession (Score: 91-93)
FOUL! Offensive foul on Isaiah Durant! Russell Davis drew the charge! [Team fouls: 6] (Isaiah Durant: 1 personal fouls) TURNOVER! (dead ball)

[01:16] Team_011 possession (Score: 91-93)
Shai Leonard attempts a 3Pt. Contested by Blake O'Neal (4.7 feet, MAN). SHAI LEONARD MAKES IT!
Score: 91-96

[01:02] Team_005 possession (Score: 91-96)
Zion Parker attempts a Layup. Contested by Russell Davis (3.8 feet, ZONE). Zion Parker misses. Rebound secured by Russell Davis.

[00:47] Team_011 possession (Score: 91-96)
Pau Towns makes the Dunk and draws the foul on Zion Parker! And-1! Pau Towns to the line for 1. [BONUS: 7 team fouls] (Zion Parker: 2 personal fouls)   FT 1/1: GOOD Pau Towns makes 1/1 from the line.
Score: 91-99

[00:35] Team_005 possession (Score: 91-99)
Lauri Wade attempts a Layup. Contested by Tyrese Nowitzki (4.8 feet, MAN). LAURI WADE MAKES IT!
Score: 93-99

[00:21] Team_011 possession (Score: 93-99)
Shai Leonard attempts a 3Pt. Contested by Isaiah Durant (4.5 feet, ZONE). Shai Leonard misses. Rebound secured by Draymond Smith.

[00:04] Team_005 possession (Score: 93-99)
Isaiah Durant attempts a Layup. BLOCKED BY RUSSELL DAVIS! Ball deflects out of bounds off Isaiah Durant.

================================================================================
                              4TH QUARTER COMPLETE                              
================================================================================

4TH QUARTER SCORE: Team_005 21, Team_011 17

BOX SCORE:
================================================================================

Team_005
--------------------------------------------------------------------------------
Player                MIN  PTS  REB  AST  TO      FG   FG%      3P   3P%
--------------------------------------------------------------------------------
Lauri Wade             20    6    3    0   0   3/4    75.0     0/0   0.0
Blake O'Neal           24    5    0    1   0   2/3    66.7     0/0   0.0
Zion Parker            20    4    4    0   0   1/3    33.3     0/0   0.0
Draymond Smith         20    3    3    0   0   2/2   100.0     0/0   0.0
Anthony Rozier         29    2    0    0   0   1/2    50.0     0/0   0.0
Jalen Rozier           29    1    2    0   0   1/2    50.0     0/0   0.0
Cade Markkanen         29    0    1    1   0   0/0     0.0     0/0   0.0
Derrick Allen          29    0    1    0   0   0/1     0.0     0/0   0.0
Isaiah Durant          20    0    0    0   0   0/3     0.0     0/0   0.0

TEAM: FG: 10/20 (50.0%), 3PT: 0/4 (0.0%), REB: 14 (0 off, 14 def), AST: 2, TO: 4
TEAM FOULS: 7 [Team_011 in BONUS]


Team_011
--------------------------------------------------------------------------------
Player                MIN  PTS  REB  AST  TO      FG   FG%      3P   3P%
--------------------------------------------------------------------------------
Michael Carter         29    5    2    0   0   2/3    66.7     0/0   0.0
Pau Towns              20    5    3    0   0   2/3    66.7     0/0   0.0
Shai Leonard           24    3    0    0   0   1/3    33.3     0/0   0.0
Tyrese Nowitzki        20    2    2    0   0   1/4    25.0     0/0   0.0
Trae Tatum             29    0    0    2   0   0/1     0.0     0/0   0.0
Evan George            29    0    1    0   0   0/2     0.0     0/0   0.0
Russell Davis          20    0    2    0   0   0/2     0.0     0/0   0.0
De'Aaron George        20    0    0    0   0   0/2     0.0     0/0   0.0

TEAM: FG: 6/20 (30.0%), 3PT: 2/9 (22.2%), REB: 10 (1 off, 9 def), AST: 2, TO: 3
TEAM FOULS: 8 [Team_005 in BONUS]

================================================================================

================================================================================
                               FULL GAME COMPLETE                               
================================================================================

FINAL SCORE: Team_005 93, Team_011 99

SCORING BY QUARTER:
--------------------------------------------------------------------------------
Team                     Q1     Q2     Q3     Q4    FINAL
--------------------------------------------------------------------------------
Team_005                 28     33     11     21       93
Team_011                 38     23     21     17       99
--------------------------------------------------------------------------------

FULL GAME BOX SCORE:
================================================================================

Team_005
--------------------------------------------------------------------------------
Player                MIN  PTS  REB  AST  TO      FG   FG%      3P   3P%      FT STL BLK
--------------------------------------------------------------------------------
Anthony Rozier         29    8    0    4   1   4/11   36.4   0/5     0.0   0/0     1   0
Derrick Allen          29    5    7    1   1   2/9    22.2   1/5    20.0   3/4     1   0
Jalen Rozier           29   14    9    1   0   6/10   60.0   0/2     0.0   6/7     0   0
Cade Markkanen         29   13    9    1   1   6/9    66.7   0/1     0.0   4/5     0   0
Brandon George         24    6    0    2   2   3/8    37.5   0/1     0.0   3/4     0   0
Blake O'Neal           24    7    0    2   1   4/5    80.0   1/1   100.0   1/1     0   0
Draymond Smith         20    5    6    0   0   3/4    75.0   1/2    50.0   1/2     0   0
Lauri Wade             20   12    6    0   1   5/8    62.5   0/2     0.0   4/4     0   0
Isaiah Durant          20    6    0    1   1   4/8    50.0   1/2    50.0   6/8     0   0
Zion Parker            20   14    8    2   1   2/7    28.6   0/1     0.0   2/2     3   0

TEAM: FG: 42/83 (50.6%), 3PT: 4/22 (18.2%), REB: 51 (13 off, 38 def), AST: 14, TO: 9


Team_011
--------------------------------------------------------------------------------
Player                MIN  PTS  REB  AST  TO      FG   FG%      3P   3P%      FT STL BLK
--------------------------------------------------------------------------------
Trae Tatum             29    3    0    3   1   1/9    11.1   0/5     0.0   1/1     0   0
Michael Carter         29   15    6    2   3   7/10   70.0   2/3    66.7   1/1     0   0
Pau Barnes             29   16    8    2   1   6/7    85.7   3/3   100.0   2/2     1   0
Evan George            29    7   16    4   1   3/9    33.3   0/2     0.0   4/6     0   0
Magic Tatum            24   24    0    2   1   7/9    77.8   2/3    66.7   5/5     0   0
Shai Leonard           24    5    0    2   1   2/6    33.3   1/2    50.0   0/1     0   0
De'Aaron George        20   10    0    0   3   4/8    50.0   2/4    50.0   0/0     0   0
Tyrese Nowitzki        20    4    6    0   0   1/5    20.0   0/2     0.0   2/4     0   0
Russell Davis          20    7    3    1   1   3/8    37.5   0/1     0.0   1/1     0   2
Pau Towns              20    5    9    2   1   2/3    66.7   0/0     0.0   1/1     0   0

TEAM: FG: 39/77 (50.6%), 3PT: 10/25 (40.0%), REB: 42 (8 off, 34 def), AST: 18, TO: 13

================================================================================
