================================================================================
                        FULL GAME - Team_062 vs Team_094                        
================================================================================

================================================================================
                       1ST QUARTER - Team_062 vs Team_094                       
================================================================================

[12:00] Team_062 possession (Score: 0-0)
Michael Hyland makes the Dunk and draws the foul on Kobe Wagner! And-1! Michael Hyland to the line for 1. [Team fouls: 1] (Kobe Wagner: 1 personal fouls)   FT 1/1: GOOD Michael Hyland makes 1/1 from the line.
Score: 3-0

[11:45] Team_094 possession (Score: 3-0)
Tim Russell attempts a 3Pt. Contested by RJ Williamson (4.5 feet, ZONE). TIM RUSSELL MAKES IT!
Score: 3-3

[11:34] Team_062 possession (Score: 3-3)
Jalen Reaves throws a bad pass! Stolen by Kobe Bryant! TURNOVER! (live ball)

[11:23] Team_094 possession (Score: 3-3)
Kobe Bryant drives, Jalen Reaves stays with him. Kobe Bryant attempts a Dunk. Contested by Jalen Reaves (5.2 feet, MAN). Kobe Bryant misses. Rebound secured by Michael Hyland.

[11:05] Team_062 possession (Score: 3-3)
FOUL! Reach-in foul on Kobe Bryant during the drive. [Team fouls: 2] No free throws, side out. (Kobe Bryant: 1 personal fouls)

[10:56] Team_062 possession (Score: 3-3)
RJ Williamson attempts a 3Pt. Contested by Lauri Thompson (4.5 feet, MAN). RJ Williamson misses. Rebound secured by Kobe Wagner.

[10:44] Team_094 possession (Score: 3-3)
Tim Russell attempts a 3Pt. Contested by Kawhi Thompson (5.0 feet, MAN). Tim Russell misses. Rebound secured by Michael Hyland.

[10:27] Team_062 possession (Score: 3-3)
Jalen Reaves makes the Layup and draws the foul on Kobe Bryant! And-1! Jalen Reaves to the line for 1. [Team fouls: 3] (Kobe Bryant: 2 personal fouls)   FT 1/1: MISS Jalen Reaves makes 0/1 from the line. Offensive rebound by Jalen Reaves! Jalen Reaves puts it back in!
Score: 7-3

[10:16] Team_094 possession (Score: 7-3)
Terry Ingram attempts a 3Pt. Contested by Kawhi Thompson (5.2 feet, ZONE). Terry Ingram misses. Rebound secured by Michael Hyland.

[10:02] Team_062 possession (Score: 7-3)
Chris Bird attempts a Midrange. Contested by Terry Ingram (4.9 feet, MAN). Chris Bird misses. Offensive rebound by Kawhi Thompson! Kawhi Thompson kicks it out.

[09:50] Team_062 possession (Score: 7-3)
Michael Hyland attempts a 3Pt. Contested by Kobe Wagner (4.1 feet, MAN). Michael Hyland misses. Rebound secured by Kobe Bryant.

[09:34] Team_094 possession (Score: 7-3)
Tim Russell drives, Kawhi Thompson stays with him. Tim Russell attempts a Layup. Contested by Kawhi Thompson (5.0 feet, MAN). TIM RUSSELL MAKES IT! Assist: Kobe Wagner
Score: 7-5

[09:23] Team_062 possession (Score: 7-5)
FOUL! Reach-in foul on Tim Russell during the drive. [Team fouls: 4] No free throws, side out. (Tim Russell: 1 personal fouls)

[09:07] Team_062 possession (Score: 7-5)
RJ Williamson drives, picks up Tim Russell. Help arrives from Lauri Thompson! RJ Williamson attempts a Dunk. Contested by Lauri Thompson (4.5 feet, ZONE). RJ Williamson misses. FOUL! Loose ball foul on Kobe Bryant during the rebound battle. [IN THE BONUS! 5 team fouls] Jalen Reaves to the line for 2 free throws. (Kobe Bryant: 3 personal fouls)   FT 1/2: GOOD   FT 2/2: MISS Jalen Reaves makes 1/2 from the line. Offensive rebound by Kawhi Thompson! Kawhi Thompson kicks it out.
Score: 8-5

[08:52] Team_062 possession (Score: 8-5)
Michael Hyland makes the Layup and draws the foul on Kobe Wagner! And-1! Michael Hyland to the line for 1. [BONUS: 6 team fouls] (Kobe Wagner: 2 personal fouls)   FT 1/1: GOOD Michael Hyland makes 1/1 from the line.
Score: 11-5

[08:35] Team_094 possession (Score: 11-5)
Kobe Wagner drives, picks up Michael Hyland. Help arrives from Chris Bird! Kobe Wagner attempts a Dunk. Contested by Chris Bird (5.1 feet, MAN). KOBE WAGNER MAKES IT! Assist: Kobe Bryant
Score: 11-7

[08:16] Team_062 possession (Score: 11-7)
RJ Williamson attempts a Midrange. Contested by Lauri Thompson (4.5 feet, MAN). RJ Williamson misses. Offensive rebound by Jalen Reaves! Jalen Reaves's putback is no good. Rebound secured by Tim Russell.

[07:58] Team_094 possession (Score: 11-7)
FOUL! Holding foul on RJ Williamson. [Team fouls: 1] No free throws, side out. (RJ Williamson: 1 personal fouls)

[07:44] Team_094 possession (Score: 11-7)
Kobe Wagner attempts a Midrange. Contested by Michael Hyland (5.1 feet, MAN). KOBE WAGNER MAKES IT! Assist: Terry Ingram
Score: 11-9

[07:28] Team_062 possession (Score: 11-9)
Jalen Reaves attempts a Layup. Contested by Kobe Bryant (5.2 feet, ZONE). JALEN REAVES MAKES IT!
Score: 13-9

[07:19] Team_094 possession (Score: 13-9)
Terry Ingram attempts a 3Pt. Contested by Chris Bird (4.5 feet, MAN). Terry Ingram misses. Rebound secured by Jalen Reaves.

[07:06] Team_062 possession (Score: 13-9)
Chris Bird drives and kicks out. Michael Hyland attempts a Midrange. Contested by Kobe Wagner (4.1 feet, MAN). Michael Hyland misses. Rebound secured by Kobe Bryant.

[06:48] Team_094 possession (Score: 13-9)
Terry Ingram throws a bad pass out of bounds! TURNOVER! (dead ball)

[06:31] Team_062 possession (Score: 13-9)
Chris Bird attempts a Midrange. BLOCKED BY TERRY INGRAM! Ball is loose! Offensive rebound by Kawhi Thompson! Kawhi Thompson kicks it out.

[06:16] Team_062 possession (Score: 13-9)
RJ Williamson drives to the basket... RJ Williamson throws a bad pass out of bounds! TURNOVER! (dead ball)

[06:01] Team_094 possession (Score: 13-9)
Lauri Thompson throws a bad pass! Stolen by RJ Williamson! TURNOVER! (live ball)

[05:49] Team_062 possession (Score: 13-9)
Jalen Reaves makes the Layup and draws the foul on Tim Russell! And-1! Jalen Reaves to the line for 1. [BONUS: 7 team fouls] (Tim Russell: 2 personal fouls)   FT 1/1: GOOD Jalen Reaves makes 1/1 from the line.
Score: 16-9

[05:32] Team_094 possession (Score: 16-9)
Lauri Thompson makes the Midrange and draws the foul on Michael Hyland! And-1! Lauri Thompson to the line for 1. [Team fouls: 2] (Michael Hyland: 1 personal fouls)   FT 1/1: GOOD Lauri Thompson makes 1/1 from the line.
Score: 16-12

[05:16] Team_062 possession (Score: 16-12)
Chris Bird attempts a 3Pt. Contested by Terry Ingram (4.9 feet, MAN). Chris Bird misses. Offensive rebound by Jalen Reaves! Jalen Reaves puts it back in!
Score: 18-12

[05:04] Team_094 possession (Score: 18-12)
Tim Russell drives, picks up Kawhi Thompson. Help arrives from Chris Bird! Tim Russell attempts a Layup. Contested by Chris Bird (5.0 feet, MAN). TIM RUSSELL MAKES IT!
Score: 18-14

[04:49] Team_062 possession (Score: 18-14)
Jalen Reaves attempts a Layup. Contested by Kobe Bryant (5.2 feet, MAN). JALEN REAVES MAKES IT! Assist: Kawhi Thompson
Score: 20-14

[04:39] Team_094 possession (Score: 20-14)
Lauri Thompson loses control! Ball rolls out of bounds! TURNOVER! (dead ball)

[04:26] Team_062 possession (Score: 20-14)
Kawhi Thompson attempts a 3Pt. Contested by Tim Russell (4.9 feet, MAN). Kawhi Thompson misses. Rebound secured by Tim Russell.

[04:12] Team_094 possession (Score: 20-14)
Kobe Bryant throws a bad pass! Stolen by Jalen Reaves! TURNOVER! (live ball)

[04:00] Team_062 possession (Score: 20-14)
Michael Hyland attempts a Midrange. Contested by Kobe Wagner (4.2 feet, MAN). Michael Hyland misses. Offensive rebound by Kawhi Thompson! Kawhi Thompson kicks it out.

[03:45] Team_062 possession (Score: 20-14)
Michael Hyland drives and kicks out. FOUL! Shooting foul on Lauri Thompson. RJ Williamson to the line for 2 free throws. [BONUS: 8 team fouls] (Lauri Thompson: 1 personal fouls)   FT 1/2: MISS   FT 2/2: GOOD RJ Williamson makes 1/2 from the line.
Score: 21-14

[03:34] Team_094 possession (Score: 21-14)
Tim Russell attempts a 3Pt. Contested by Kawhi Thompson (5.2 feet, MAN). Tim Russell misses. Rebound secured by Jalen Reaves.

[03:20] Team_062 possession (Score: 21-14)
Jalen Reaves attempts a Layup. BLOCKED BY LAURI THOMPSON! Ball deflects out of bounds off Jalen Reaves.

[03:07] Team_094 possession (Score: 21-14)
Lauri Thompson attempts a Midrange. Contested by Michael Hyland (5.2 feet, ZONE). Lauri Thompson misses. Rebound secured by Kawhi Thompson.

[02:54] Team_062 possession (Score: 21-14)
Chris Bird commits a violation (traveling/carry)! TURNOVER! (dead ball)

[02:54] Substitution (Team_062): RJ Williamson OUT → Tony LaVine IN (stamina_rule2)

[02:54] Substitution (Team_062): Michael Hyland OUT → Paul Poole IN (stamina_rule2)

[02:54] Substitution (Team_062): Kawhi Thompson OUT → RJ Wall IN (stamina_rule2)

[02:54] Substitution (Team_062): Jalen Reaves OUT → Devin Young IN (stamina_rule2)

[02:54] Substitution (Team_094): Terry Ingram OUT → Shaquille Bryant IN (stamina_rule2)

[02:39] Team_094 possession (Score: 21-14)
Kobe Wagner attempts a Layup. Contested by RJ Wall (5.6 feet, ZONE). KOBE WAGNER MAKES IT! Assist: Kobe Bryant
Score: 21-16

[02:24] Team_062 possession (Score: 21-16)
Devin Young drives, Tim Russell stays with him. Devin Young attempts a Layup. Contested by Tim Russell (5.5 feet, ZONE). DEVIN YOUNG MAKES IT! Assist: RJ Wall
Score: 23-16

[02:12] Team_094 possession (Score: 23-16)
Kobe Wagner attempts a 3Pt. Contested by Chris Bird (4.9 feet, ZONE). KOBE WAGNER MAKES IT! Assist: Lauri Thompson
Score: 23-19

[01:55] Team_062 possession (Score: 23-19)
RJ Wall attempts a 3Pt. Contested by Kobe Wagner (4.4 feet, ZONE). RJ WALL MAKES IT! Assist: Paul Poole
Score: 26-19

[01:44] Team_094 possession (Score: 26-19)
Lauri Thompson drives and kicks out. Lauri Thompson attempts a Midrange. Wide open! Paul Poole is 6.3 feet away. [ZONE] LAURI THOMPSON MAKES IT! Assist: Shaquille Bryant
Score: 26-21

[01:29] Team_062 possession (Score: 26-21)
Paul Poole attempts a 3Pt. Contested by Kobe Wagner (4.6 feet, MAN). Paul Poole misses. Rebound secured by Tim Russell.

[01:15] Team_094 possession (Score: 26-21)
Lauri Thompson attempts a 3Pt. Wide open! Tony LaVine is 6.2 feet away. [MAN] Lauri Thompson misses. Rebound secured by RJ Wall.

[00:58] Team_062 possession (Score: 26-21)
RJ Wall drives and kicks out. Paul Poole attempts a Midrange. Contested by Kobe Wagner (4.6 feet, MAN). Paul Poole misses. Rebound secured by Kobe Bryant.

[00:42] Team_094 possession (Score: 26-21)
Kobe Wagner attempts a Layup. Contested by RJ Wall (5.5 feet, ZONE). Kobe Wagner misses. Rebound secured by Paul Poole.

[00:29] Team_062 possession (Score: 26-21)
FOUL! Shooting foul on Kobe Wagner. RJ Wall to the line for 3 free throws. [BONUS: 9 team fouls] (Kobe Wagner: 3 personal fouls)   FT 1/3: GOOD   FT 2/3: GOOD   FT 3/3: GOOD RJ Wall makes 3/3 from the line.
Score: 29-21

[00:17] Team_094 possession (Score: 29-21)
Kobe Wagner attempts a 3Pt. Wide open! Paul Poole is 6.6 feet away. [MAN] Kobe Wagner misses. Rebound secured by Devin Young.

================================================================================
                              1ST QUARTER COMPLETE                              
================================================================================

1ST QUARTER SCORE: Team_062 29, Team_094 21

BOX SCORE:
================================================================================

Team_062
--------------------------------------------------------------------------------
Player                MIN  PTS  REB  AST  TO      FG   FG%      3P   3P%
--------------------------------------------------------------------------------
Jalen Reaves            9   13    3    0   0   5/6    83.3     0/0   0.0
Michael Hyland          9    6    3    0   0   2/3    66.7     0/0   0.0
RJ Wall                 3    6    1    1   0   2/3    66.7     0/0   0.0
Devin Young             3    2    1    0   0   1/1   100.0     0/0   0.0
RJ Williamson           9    1    0    0   0   1/3    33.3     0/0   0.0
Kawhi Thompson          9    0    5    1   0   0/1     0.0     0/0   0.0
Chris Bird             12    0    0    0   0   0/1     0.0     0/0   0.0
Paul Poole              3    0    1    1   0   0/1     0.0     0/0   0.0

TEAM: FG: 11/19 (57.9%), 3PT: 3/7 (42.9%), REB: 15 (6 off, 9 def), AST: 3, TO: 3
TEAM FOULS: 2


Team_094
--------------------------------------------------------------------------------
Player                MIN  PTS  REB  AST  TO      FG   FG%      3P   3P%
--------------------------------------------------------------------------------
Kobe Wagner            12    9    1    1   0   4/6    66.7     0/0   0.0
Tim Russell            12    7    3    0   0   3/5    60.0     0/0   0.0
Lauri Thompson         12    5    0    1   0   2/4    50.0     0/0   0.0
Kobe Bryant            12    0    3    2   0   0/1     0.0     0/0   0.0
Terry Ingram            9    0    0    1   0   0/2     0.0     0/0   0.0
Shaquille Bryant        3    0    0    1   0   0/0     0.0     0/0   0.0

TEAM: FG: 9/18 (50.0%), 3PT: 2/8 (25.0%), REB: 6 (0 off, 6 def), AST: 6, TO: 4
TEAM FOULS: 9 [Team_062 in BONUS]

================================================================================

================================================================================
                       2ND QUARTER - Team_062 vs Team_094                       
================================================================================

[12:00] Team_062 possession (Score: 29-21)
Kawhi Thompson drives, Tim Russell stays with him. Kawhi Thompson attempts a Layup. Contested by Tim Russell (5.1 feet, ZONE). KAWHI THOMPSON MAKES IT! Assist: RJ Williamson
Score: 31-21

[11:47] Team_094 possession (Score: 31-21)
Kobe Wagner attempts a 3Pt. Contested by Michael Hyland (5.0 feet, MAN). Kobe Wagner misses. Offensive rebound by Tim Russell! Tim Russell kicks it out.

[11:32] Team_094 possession (Score: 31-21)
FOUL! Holding foul on Michael Hyland. [Team fouls: 1] No free throws, side out. (Michael Hyland: 1 personal fouls)

[11:21] Team_094 possession (Score: 31-21)
Tim Russell drives, Jalen Reaves stays with him. Tim Russell attempts a Layup. Contested by Jalen Reaves (5.1 feet, ZONE). TIM RUSSELL MAKES IT! Assist: Lauri Thompson
Score: 31-23

[11:04] Team_062 possession (Score: 31-23)
Chris Bird throws a bad pass out of bounds! TURNOVER! (dead ball)

[11:04] Substitution (Team_062): Chris Bird OUT → Paolo McCollum IN (stamina_rule2)

[11:04] Substitution (Team_094): Lauri Thompson OUT → Kevin Rozier IN (stamina_rule2)

[11:04] Substitution (Team_094): Kobe Wagner OUT → Ayo Gasol IN (stamina_rule2)

[11:04] Substitution (Team_094): Tim Russell OUT → Domantas Haliburton IN (stamina_rule2)

[11:04] Substitution (Team_094): Kobe Bryant OUT → Isaiah Quickley IN (stamina_rule2)

[10:51] Team_094 possession (Score: 31-23)
Isaiah Quickley loses the ball! Stripped by Jalen Reaves! TURNOVER! (live ball)

[10:36] Team_062 possession (Score: 31-23)
Jalen Reaves makes the Midrange and draws the foul on Ayo Gasol! And-1! Jalen Reaves to the line for 1. [Team fouls: 1] (Ayo Gasol: 1 personal fouls)   FT 1/1: GOOD Jalen Reaves makes 1/1 from the line.
Score: 34-23

[10:21] Team_094 possession (Score: 34-23)
Isaiah Quickley drives to the basket... Isaiah Quickley loses the ball! Stripped by Jalen Reaves! TURNOVER! (live ball)

[10:05] Team_062 possession (Score: 34-23)
Michael Hyland attempts a 3Pt. Contested by Terry Ingram (4.8 feet, ZONE). Michael Hyland misses. Rebound secured by Ayo Gasol.

[09:50] Team_094 possession (Score: 34-23)
Ayo Gasol attempts a 3Pt. Contested by RJ Williamson (4.8 feet, ZONE). Ayo Gasol misses. Offensive rebound by Isaiah Quickley! Isaiah Quickley kicks it out.

[09:34] Team_094 possession (Score: 34-23)
Terry Ingram attempts a 3Pt. Contested by RJ Williamson (4.9 feet, ZONE). TERRY INGRAM MAKES IT! Assist: Kevin Rozier
Score: 34-26

[09:18] Team_062 possession (Score: 34-26)
Kawhi Thompson attempts a 3Pt. Contested by Domantas Haliburton (5.8 feet, MAN). Kawhi Thompson misses. Rebound secured by Domantas Haliburton.

[09:07] Team_094 possession (Score: 34-26)
Isaiah Quickley drives to the basket... Isaiah Quickley throws a bad pass! Stolen by Jalen Reaves! TURNOVER! (live ball)

[08:52] Team_062 possession (Score: 34-26)
FOUL! Shooting foul on Ayo Gasol. Michael Hyland to the line for 3 free throws. [Team fouls: 2] (Ayo Gasol: 2 personal fouls)   FT 1/3: GOOD   FT 2/3: MISS   FT 3/3: MISS Michael Hyland makes 1/3 from the line. Rebound secured by Isaiah Quickley.
Score: 35-26

[08:35] Team_094 possession (Score: 35-26)
FOUL! Reach-in foul on Jalen Reaves during the drive. [Team fouls: 2] No free throws, side out. (Jalen Reaves: 1 personal fouls)

[08:16] Team_094 possession (Score: 35-26)
Ayo Gasol attempts a Layup. Contested by Michael Hyland (5.3 feet, MAN). AYO GASOL MAKES IT! Assist: Domantas Haliburton
Score: 35-28

[08:02] Team_062 possession (Score: 35-28)
Michael Hyland attempts a 3Pt. Contested by Ayo Gasol (4.8 feet, MAN). Michael Hyland misses. Offensive rebound by Jalen Reaves! Jalen Reaves kicks it out.

[07:48] Team_062 possession (Score: 35-28)
Michael Hyland attempts a Layup. Contested by Ayo Gasol (4.8 feet, MAN). MICHAEL HYLAND MAKES IT! Assist: Jalen Reaves
Score: 37-28

[07:35] Team_094 possession (Score: 37-28)
Ayo Gasol attempts a Midrange. Contested by Michael Hyland (5.3 feet, MAN). Ayo Gasol misses. Rebound secured by Jalen Reaves.

[07:18] Team_062 possession (Score: 37-28)
Jalen Reaves attempts a Midrange. Wide open! Isaiah Quickley is 6.2 feet away. [ZONE] Jalen Reaves misses. Offensive rebound by Jalen Reaves! Jalen Reaves kicks it out.

[07:01] Team_062 possession (Score: 37-28)
Jalen Reaves drives, picks up Isaiah Quickley. Help arrives from Kevin Rozier! Jalen Reaves attempts a Dunk. Wide open! Kevin Rozier is 6.2 feet away. [MAN] JALEN REAVES MAKES IT! Assist: RJ Williamson
Score: 39-28

[06:45] Team_094 possession (Score: 39-28)
Domantas Haliburton attempts a Midrange. Contested by Kawhi Thompson (5.4 feet, MAN). Domantas Haliburton misses. Offensive rebound by Domantas Haliburton! Domantas Haliburton kicks it out.

[06:30] Team_094 possession (Score: 39-28)
FOUL! Shooting foul on Paolo McCollum. Terry Ingram to the line for 3 free throws. [Team fouls: 3] (Paolo McCollum: 1 personal fouls)   FT 1/3: MISS   FT 2/3: GOOD   FT 3/3: MISS Terry Ingram makes 1/3 from the line. Rebound secured by Kawhi Thompson.
Score: 39-29

[06:16] Team_062 possession (Score: 39-29)
Jalen Reaves attempts a Layup. Wide open! Isaiah Quickley is 6.2 feet away. [MAN] Jalen Reaves misses. Rebound secured by Isaiah Quickley.

[06:05] Team_094 possession (Score: 39-29)
FOUL! Reach-in foul on Jalen Reaves during the drive. [Team fouls: 4] No free throws, side out. (Jalen Reaves: 2 personal fouls)

[05:53] Team_094 possession (Score: 39-29)
Isaiah Quickley attempts a 3Pt. Contested by RJ Williamson (5.3 feet, ZONE). Isaiah Quickley misses. FOUL! Loose ball foul on Jalen Reaves during the rebound battle. [IN THE BONUS! 5 team fouls] Isaiah Quickley to the line for 2 free throws. (Jalen Reaves: 3 personal fouls)   FT 1/2: GOOD   FT 2/2: MISS Isaiah Quickley makes 1/2 from the line. Rebound secured by Kawhi Thompson.
Score: 39-30

[05:35] Team_062 possession (Score: 39-30)
FOUL! Reach-in foul on Isaiah Quickley during the drive. [Team fouls: 3] No free throws, side out. (Isaiah Quickley: 1 personal fouls)

[05:21] Team_062 possession (Score: 39-30)
RJ Williamson attempts a 3Pt. Contested by Kevin Rozier (4.7 feet, MAN). RJ Williamson misses. Rebound secured by Domantas Haliburton.

[05:07] Team_094 possession (Score: 39-30)
Isaiah Quickley attempts a 3Pt. Contested by Paolo McCollum (5.9 feet, ZONE). Isaiah Quickley misses. Rebound secured by Kawhi Thompson.

[04:51] Team_062 possession (Score: 39-30)
Michael Hyland attempts a 3Pt. Contested by Ayo Gasol (4.8 feet, MAN). Michael Hyland misses. Rebound secured by Domantas Haliburton.

[04:36] Team_094 possession (Score: 39-30)
Domantas Haliburton drives, Kawhi Thompson stays with him. Domantas Haliburton attempts a Layup. Contested by Kawhi Thompson (5.7 feet, MAN). DOMANTAS HALIBURTON MAKES IT! Assist: Terry Ingram
Score: 39-32

[04:24] Team_062 possession (Score: 39-32)
RJ Williamson attempts a 3Pt. Contested by Terry Ingram (5.3 feet, ZONE). RJ WILLIAMSON MAKES IT!
Score: 42-32

[04:09] Team_094 possession (Score: 42-32)
Isaiah Quickley attempts a Layup. Wide open! Jalen Reaves is 6.1 feet away. [MAN] ISAIAH QUICKLEY MAKES IT!
Score: 42-34

[03:53] Team_062 possession (Score: 42-34)
Jalen Reaves attempts a Layup. Wide open! Isaiah Quickley is 6.1 feet away. [ZONE] JALEN REAVES MAKES IT!
Score: 44-34

[03:40] Team_094 possession (Score: 44-34)
Terry Ingram attempts a Layup. Contested by Paolo McCollum (5.8 feet, MAN). Terry Ingram misses. Rebound secured by Michael Hyland.

[03:26] Team_062 possession (Score: 44-34)
RJ Williamson drives and kicks out. Paolo McCollum attempts a Midrange. Wide open! Isaiah Quickley is 6.1 feet away. [ZONE] Paolo McCollum misses. Offensive rebound by Kawhi Thompson! Kawhi Thompson kicks it out.

[03:14] Team_062 possession (Score: 44-34)
RJ Williamson attempts a Layup. Contested by Kevin Rozier (4.7 feet, MAN). RJ Williamson misses. Rebound secured by Domantas Haliburton.

[03:02] Team_094 possession (Score: 44-34)
Ayo Gasol attempts a 3Pt. Contested by Michael Hyland (5.9 feet, MAN). AYO GASOL MAKES IT! Assist: Isaiah Quickley
Score: 44-37

[02:51] Team_062 possession (Score: 44-37)
Kawhi Thompson attempts a Midrange. Contested by Kevin Rozier (5.0 feet, ZONE). Kawhi Thompson misses. Rebound secured by Domantas Haliburton.

[02:34] Team_094 possession (Score: 44-37)
Kevin Rozier drives, Jalen Reaves stays with him. Kevin Rozier attempts a Dunk. Wide open! Jalen Reaves is 6.6 feet away. [ZONE] KEVIN ROZIER MAKES IT!
Score: 44-39

[02:21] Team_062 possession (Score: 44-39)
Jalen Reaves attempts a Midrange. Wide open! Isaiah Quickley is 6.2 feet away. [MAN] Jalen Reaves misses. Rebound secured by Domantas Haliburton.

[02:08] Team_094 possession (Score: 44-39)
Ayo Gasol attempts a 3Pt. Wide open! Michael Hyland is 6.1 feet away. [MAN] Ayo Gasol misses. Rebound secured by Michael Hyland.

[01:56] Team_062 possession (Score: 44-39)
FOUL! Holding foul on Isaiah Quickley. [Team fouls: 4] No free throws, side out. (Isaiah Quickley: 2 personal fouls)

[01:42] Team_062 possession (Score: 44-39)
Michael Hyland attempts a Midrange. Contested by Ayo Gasol (5.0 feet, MAN). Michael Hyland misses. Rebound secured by Domantas Haliburton.

[01:30] Team_094 possession (Score: 44-39)
Isaiah Quickley drives and kicks out. Terry Ingram attempts a Midrange. Contested by Paolo McCollum (5.8 feet, MAN). Terry Ingram misses. Rebound secured by Kawhi Thompson.

[01:17] Team_062 possession (Score: 44-39)
Kawhi Thompson drives, picks up Domantas Haliburton. Help arrives from Kevin Rozier! Kawhi Thompson attempts a Dunk. Contested by Kevin Rozier (5.9 feet, ZONE). Kawhi Thompson misses. FOUL! Loose ball foul on Ayo Gasol during the rebound battle. [IN THE BONUS! 5 team fouls] Jalen Reaves to the line for 2 free throws. (Ayo Gasol: 3 personal fouls)   FT 1/2: MISS   FT 2/2: GOOD Jalen Reaves makes 1/2 from the line.
Score: 45-39

[01:05] Team_094 possession (Score: 45-39)
Domantas Haliburton attempts a 3Pt. Wide open! Kawhi Thompson is 6.2 feet away. [MAN] Domantas Haliburton misses. Rebound secured by Michael Hyland.

[00:48] Team_062 possession (Score: 45-39)
Paolo McCollum attempts a 3Pt. Wide open! Terry Ingram is 6.5 feet away. [MAN] PAOLO MCCOLLUM MAKES IT! Assist: Kawhi Thompson
Score: 48-39

[00:32] Team_094 possession (Score: 48-39)
Domantas Haliburton drives to the basket... FOUL! Offensive foul on Domantas Haliburton! Kawhi Thompson drew the charge! [Team fouls: 6] (Domantas Haliburton: 1 personal fouls) TURNOVER! (dead ball)

[00:19] Team_062 possession (Score: 48-39)
Jalen Reaves attempts a Layup. Wide open! Isaiah Quickley is 6.3 feet away. [ZONE] JALEN REAVES MAKES IT! Assist: Kawhi Thompson
Score: 50-39

[00:03] Team_094 possession (Score: 50-39)
Kevin Rozier attempts a 3Pt. Wide open! RJ Williamson is 6.4 feet away. [ZONE] KEVIN ROZIER MAKES IT! Assist: Isaiah Quickley
Score: 50-42

================================================================================
                              2ND QUARTER COMPLETE                              
================================================================================

2ND QUARTER SCORE: Team_062 21, Team_094 21

BOX SCORE:
================================================================================

Team_062
--------------------------------------------------------------------------------
Player                MIN  PTS  REB  AST  TO      FG   FG%      3P   3P%
--------------------------------------------------------------------------------
Jalen Reaves           21   10    3    1   0   5/7    71.4     0/0   0.0
RJ Williamson          21    3    0    2   0   1/3    33.3     0/0   0.0
Paolo McCollum         11    3    0    0   0   1/1   100.0     0/0   0.0
Kawhi Thompson         21    2    5    2   0   1/3    33.3     0/0   0.0
Michael Hyland         21    2    3    0   0   1/5    20.0     0/0   0.0

TEAM: FG: 9/19 (47.4%), 3PT: 2/7 (28.6%), REB: 10 (3 off, 7 def), AST: 5, TO: 1
TEAM FOULS: 5 [Team_094 in BONUS]


Team_094
--------------------------------------------------------------------------------
Player                MIN  PTS  REB  AST  TO      FG   FG%      3P   3P%
--------------------------------------------------------------------------------
Ayo Gasol              11    5    1    0   0   2/4    50.0     0/0   0.0
Kevin Rozier           11    5    0    1   0   2/2   100.0     0/0   0.0
Terry Ingram           21    3    0    1   0   1/3    33.3     0/0   0.0
Tim Russell            13    2    1    0   0   1/1   100.0     0/0   0.0
Isaiah Quickley        11    2    3    2   0   1/4    25.0     0/0   0.0
Domantas Haliburton    11    2    8    1   0   1/2    50.0     0/0   0.0
Lauri Thompson         13    0    0    1   0   0/0     0.0     0/0   0.0

TEAM: FG: 8/16 (50.0%), 3PT: 3/8 (37.5%), REB: 14 (4 off, 10 def), AST: 6, TO: 4
TEAM FOULS: 6 [Team_062 in BONUS]

================================================================================

================================================================================
                       3RD QUARTER - Team_062 vs Team_094                       
================================================================================

[12:00] Team_062 possession (Score: 50-42)
FOUL! Shooting foul on Kobe Wagner. RJ Williamson to the line for 2 free throws. [Team fouls: 1] (Kobe Wagner: 1 personal fouls)   FT 1/2: GOOD   FT 2/2: GOOD RJ Williamson makes 2/2 from the line.
Score: 52-42

[11:47] Team_094 possession (Score: 52-42)
Kobe Wagner drives, Michael Hyland stays with him. Kobe Wagner attempts a Dunk. Contested by Michael Hyland (5.1 feet, MAN). KOBE WAGNER MAKES IT! Assist: Lauri Thompson
Score: 52-44

[11:29] Team_062 possession (Score: 52-44)
FOUL! Holding foul on Kobe Bryant. [Team fouls: 2] No free throws, side out. (Kobe Bryant: 1 personal fouls)

[11:12] Team_062 possession (Score: 52-44)
Kawhi Thompson attempts a 3Pt. Contested by Kobe Wagner (4.1 feet, ZONE). KAWHI THOMPSON MAKES IT! Assist: RJ Williamson
Score: 55-44

[10:53] Team_094 possession (Score: 55-44)
Terry Ingram attempts a Midrange. Contested by Chris Bird (4.5 feet, MAN). Terry Ingram misses. Rebound secured by Kawhi Thompson.

[10:43] Team_062 possession (Score: 55-44)
RJ Williamson attempts a 3Pt. Contested by Kobe Wagner (3.8 feet, ZONE). RJ Williamson misses. FOUL! Loose ball foul on Kobe Wagner during the rebound battle. [Team fouls: 3] No free throws, side out. (Kobe Wagner: 2 personal fouls)

[10:27] Team_062 possession (Score: 55-44)
Michael Hyland drives and kicks out. Chris Bird attempts a Midrange. Contested by Kobe Wagner (4.1 feet, ZONE). CHRIS BIRD MAKES IT! Assist: Jalen Reaves
Score: 57-44

[10:14] Team_094 possession (Score: 57-44)
Terry Ingram loses the ball! Stripped by Chris Bird! TURNOVER! (live ball)

[09:58] Team_062 possession (Score: 57-44)
Michael Hyland attempts a Midrange. Contested by Kobe Wagner (4.1 feet, MAN). MICHAEL HYLAND MAKES IT! Assist: Jalen Reaves
Score: 59-44

[09:43] Team_094 possession (Score: 59-44)
FOUL! Reach-in foul on Chris Bird during the drive. [Team fouls: 1] No free throws, side out. (Chris Bird: 1 personal fouls)

[09:28] Team_094 possession (Score: 59-44)
Terry Ingram attempts a Layup. Contested by Kawhi Thompson (5.2 feet, ZONE). TERRY INGRAM MAKES IT! Assist: Lauri Thompson
Score: 59-46

[09:10] Team_062 possession (Score: 59-46)
RJ Williamson attempts a 3Pt. Contested by Lauri Thompson (4.5 feet, MAN). RJ Williamson misses. Offensive rebound by Jalen Reaves! Jalen Reaves puts it back in!
Score: 61-46

[08:58] Team_094 possession (Score: 61-46)
Terry Ingram attempts a Layup. Contested by Chris Bird (4.5 feet, MAN). TERRY INGRAM MAKES IT!
Score: 61-48

[08:44] Team_062 possession (Score: 61-48)
RJ Williamson attempts a 3Pt. Contested by Lauri Thompson (4.5 feet, MAN). RJ Williamson misses. Rebound secured by Kobe Wagner.

[08:27] Team_094 possession (Score: 61-48)
Tim Russell attempts a 3Pt. Contested by Kawhi Thompson (5.0 feet, MAN). TIM RUSSELL MAKES IT! Assist: Kobe Wagner
Score: 61-51

[08:17] Team_062 possession (Score: 61-51)
Michael Hyland attempts a Layup. Contested by Kobe Wagner (4.1 feet, MAN). Michael Hyland misses. Offensive rebound by Kawhi Thompson! Kawhi Thompson kicks it out.

[08:06] Team_062 possession (Score: 61-51)
RJ Williamson attempts a 3Pt. Contested by Terry Ingram (4.4 feet, ZONE). RJ Williamson misses. Rebound secured by Tim Russell.

[07:53] Team_094 possession (Score: 61-51)
Tim Russell drives and kicks out. Lauri Thompson attempts a Midrange. Contested by RJ Williamson (4.4 feet, MAN). Lauri Thompson misses. Rebound secured by Michael Hyland.

[07:39] Team_062 possession (Score: 61-51)
FOUL! Holding foul on Terry Ingram. [Team fouls: 4] No free throws, side out. (Terry Ingram: 1 personal fouls)

[07:28] Team_062 possession (Score: 61-51)
RJ Williamson attempts a 3Pt. Contested by Kobe Wagner (3.8 feet, ZONE). RJ Williamson misses. Rebound secured by Tim Russell.

[07:16] Team_094 possession (Score: 61-51)
Terry Ingram attempts a Midrange. Contested by Chris Bird (4.5 feet, MAN). TERRY INGRAM MAKES IT! Assist: Lauri Thompson
Score: 61-53

[07:03] Team_062 possession (Score: 61-53)
Jalen Reaves attempts a Midrange. Contested by Kobe Bryant (5.2 feet, MAN). JALEN REAVES MAKES IT! Assist: Michael Hyland
Score: 63-53

[06:54] Team_094 possession (Score: 63-53)
FOUL! Reach-in foul on RJ Williamson during the drive. [Team fouls: 2] No free throws, side out. (RJ Williamson: 1 personal fouls)

[06:38] Team_094 possession (Score: 63-53)
Tim Russell attempts a 3Pt. Contested by Kawhi Thompson (5.0 feet, MAN). Tim Russell misses. Rebound secured by Jalen Reaves.

[06:26] Team_062 possession (Score: 63-53)
Michael Hyland attempts a Midrange. Contested by Terry Ingram (4.6 feet, ZONE). MICHAEL HYLAND MAKES IT! Assist: Kawhi Thompson
Score: 65-53

[06:15] Team_094 possession (Score: 65-53)
Tim Russell makes the Layup and draws the foul on Jalen Reaves! And-1! Tim Russell to the line for 1. [Team fouls: 3] (Jalen Reaves: 1 personal fouls)   FT 1/1: GOOD Tim Russell makes 1/1 from the line.
Score: 65-56

[06:03] Team_062 possession (Score: 65-56)
FOUL! Reach-in foul on Kobe Wagner during the drive. [IN THE BONUS! 5 team fouls] Michael Hyland to the line for 2 free throws. (Kobe Wagner: 3 personal fouls)   FT 1/2: GOOD   FT 2/2: MISS Michael Hyland makes 1/2 from the line. Rebound secured by Kobe Bryant.
Score: 66-56

[05:48] Team_094 possession (Score: 66-56)
FOUL! Holding foul on Jalen Reaves. [Team fouls: 4] No free throws, side out. (Jalen Reaves: 2 personal fouls)

[05:37] Team_094 possession (Score: 66-56)
FOUL! Shooting foul on Jalen Reaves. Kobe Bryant to the line for 2 free throws. [BONUS: 5 team fouls] (Jalen Reaves: 3 personal fouls)   FT 1/2: GOOD   FT 2/2: GOOD Kobe Bryant makes 2/2 from the line.
Score: 66-58

[05:22] Team_062 possession (Score: 66-58)
FOUL! Shooting foul on Terry Ingram. Chris Bird to the line for 2 free throws. [BONUS: 6 team fouls] (Terry Ingram: 2 personal fouls)   FT 1/2: GOOD   FT 2/2: GOOD Chris Bird makes 2/2 from the line.
Score: 68-58

[05:10] Team_094 possession (Score: 68-58)
Kobe Bryant attempts a Midrange. Contested by Jalen Reaves (5.3 feet, MAN). Kobe Bryant misses. Rebound secured by Michael Hyland.

[04:57] Team_062 possession (Score: 68-58)
Michael Hyland attempts a 3Pt. Contested by Kobe Wagner (4.1 feet, MAN). Michael Hyland misses. Rebound secured by Kobe Wagner.

[04:43] Team_094 possession (Score: 68-58)
Lauri Thompson attempts a Midrange. Contested by Michael Hyland (5.1 feet, ZONE). LAURI THOMPSON MAKES IT!
Score: 68-60

[04:29] Team_062 possession (Score: 68-60)
FOUL! Shooting foul on Kobe Bryant. Jalen Reaves to the line for 2 free throws. [BONUS: 7 team fouls] (Kobe Bryant: 2 personal fouls)   FT 1/2: GOOD   FT 2/2: GOOD Jalen Reaves makes 2/2 from the line.
Score: 70-60

[04:15] Team_094 possession (Score: 70-60)
Kobe Wagner attempts a Layup. Contested by Michael Hyland (5.2 feet, MAN). KOBE WAGNER MAKES IT! Assist: Tim Russell
Score: 70-62

[04:00] Team_062 possession (Score: 70-62)
Chris Bird attempts a 3Pt. Contested by Terry Ingram (5.1 feet, MAN). Chris Bird misses. Offensive rebound by Jalen Reaves! Jalen Reaves kicks it out.

[03:41] Team_062 possession (Score: 70-62)
Kawhi Thompson attempts a Midrange. Contested by Kobe Wagner (4.3 feet, ZONE). KAWHI THOMPSON MAKES IT! Assist: RJ Williamson
Score: 72-62

[03:32] Team_094 possession (Score: 72-62)
Lauri Thompson attempts a Midrange. Contested by RJ Williamson (4.9 feet, MAN). LAURI THOMPSON MAKES IT! Assist: Tim Russell
Score: 72-64

[03:20] Team_062 possession (Score: 72-64)
Kawhi Thompson attempts a Midrange. Contested by Tim Russell (5.0 feet, MAN). KAWHI THOMPSON MAKES IT! Assist: Chris Bird
Score: 74-64

[03:06] Team_094 possession (Score: 74-64)
Kobe Wagner attempts a 3Pt. Contested by Michael Hyland (5.3 feet, MAN). Kobe Wagner misses. Rebound secured by Jalen Reaves.

[02:49] Team_062 possession (Score: 74-64)
Michael Hyland attempts a 3Pt. Contested by Kobe Wagner (4.3 feet, MAN). Michael Hyland misses. Rebound secured by Kobe Bryant.

[02:36] Team_094 possession (Score: 74-64)
Kobe Wagner attempts a Layup. BLOCKED BY MICHAEL HYLAND! Ball deflects out of bounds off Kobe Wagner.

[02:19] Team_062 possession (Score: 74-64)
FOUL! Reach-in foul on Kobe Bryant during the drive. [IN THE BONUS! 8 team fouls] Kawhi Thompson to the line for 2 free throws. (Kobe Bryant: 3 personal fouls)   FT 1/2: GOOD   FT 2/2: GOOD Kawhi Thompson makes 2/2 from the line.
Score: 76-64

[02:04] Team_094 possession (Score: 76-64)
Lauri Thompson attempts a Midrange. Contested by RJ Williamson (5.1 feet, MAN). Lauri Thompson misses. Offensive rebound by Tim Russell! Tim Russell kicks it out.

[01:46] Team_094 possession (Score: 76-64)
Kobe Wagner attempts a Midrange. Contested by Michael Hyland (5.4 feet, MAN). Kobe Wagner misses. Rebound secured by Kawhi Thompson.

[01:33] Team_062 possession (Score: 76-64)
Jalen Reaves attempts a Layup. Contested by Kobe Bryant (5.5 feet, ZONE). JALEN REAVES MAKES IT! Assist: Michael Hyland
Score: 78-64

[01:17] Team_094 possession (Score: 78-64)
Terry Ingram drives, picks up Jalen Reaves. Help arrives from Chris Bird! Terry Ingram attempts a Layup. Contested by Chris Bird (5.7 feet, ZONE). TERRY INGRAM MAKES IT! Assist: Kobe Bryant
Score: 78-66

[01:01] Team_062 possession (Score: 78-66)
Michael Hyland attempts a 3Pt. Contested by Kobe Wagner (4.5 feet, ZONE). Michael Hyland misses. Rebound secured by Tim Russell.

[00:43] Team_094 possession (Score: 78-66)
Tim Russell attempts a Layup. Contested by Kawhi Thompson (5.4 feet, ZONE). TIM RUSSELL MAKES IT!
Score: 78-68

[00:29] Team_062 possession (Score: 78-68)
Michael Hyland drives, Tim Russell stays with him. Michael Hyland attempts a Dunk. Contested by Tim Russell (5.2 feet, ZONE). MICHAEL HYLAND MAKES IT! Assist: Jalen Reaves
Score: 80-68

[00:18] Team_094 possession (Score: 80-68)
Tim Russell drives, Jalen Reaves stays with him. Tim Russell attempts a Dunk. Contested by Jalen Reaves (5.6 feet, ZONE). TIM RUSSELL MAKES IT! Assist: Lauri Thompson
Score: 80-70

[00:02] Team_062 possession (Score: 80-70)
FOUL! Holding foul on Terry Ingram. [IN THE BONUS! 9 team fouls] Chris Bird to the line for 2 free throws. (Terry Ingram: 3 personal fouls)   FT 1/2: GOOD   FT 2/2: GOOD Chris Bird makes 2/2 from the line.
Score: 82-70

================================================================================
                              3RD QUARTER COMPLETE                              
================================================================================

3RD QUARTER SCORE: Team_062 32, Team_094 28

BOX SCORE:
================================================================================

Team_062
--------------------------------------------------------------------------------
Player                MIN  PTS  REB  AST  TO      FG   FG%      3P   3P%
--------------------------------------------------------------------------------
Kawhi Thompson         34    9    4    1   0   4/4   100.0     0/0   0.0
Jalen Reaves           34    8    4    3   0   4/4   100.0     0/0   0.0
Chris Bird             25    6    0    1   0   3/3   100.0     0/0   0.0
Michael Hyland         34    6    2    2   0   3/7    42.9     0/0   0.0
RJ Williamson          34    2    0    2   0   1/4    25.0     0/0   0.0

TEAM: FG: 15/22 (68.2%), 3PT: 2/8 (25.0%), REB: 10 (4 off, 6 def), AST: 9, TO: 0
TEAM FOULS: 5 [Team_094 in BONUS]


Team_094
--------------------------------------------------------------------------------
Player                MIN  PTS  REB  AST  TO      FG   FG%      3P   3P%
--------------------------------------------------------------------------------
Tim Russell            25   10    4    2   0   4/6    66.7     0/0   0.0
Terry Ingram           34    8    0    0   0   4/5    80.0     0/0   0.0
Kobe Wagner            25    4    2    1   0   2/5    40.0     0/0   0.0
Lauri Thompson         25    4    0    4   0   2/2   100.0     0/0   0.0
Kobe Bryant            25    2    2    1   0   1/2    50.0     0/0   0.0

TEAM: FG: 13/20 (65.0%), 3PT: 1/3 (33.3%), REB: 8 (1 off, 7 def), AST: 8, TO: 1
TEAM FOULS: 9 [Team_062 in BONUS]

================================================================================

================================================================================
                       4TH QUARTER - Team_062 vs Team_094                       
================================================================================

[12:00] Team_062 possession (Score: 82-70)
Michael Hyland attempts a 3Pt. Contested by Kobe Wagner (4.4 feet, MAN). Michael Hyland misses. Offensive rebound by Jalen Reaves! Jalen Reaves kicks it out.

[11:45] Team_062 possession (Score: 82-70)
Kawhi Thompson attempts a 3Pt. Contested by Kobe Wagner (4.5 feet, ZONE). Kawhi Thompson misses. Rebound secured by Kobe Bryant.

[11:29] Team_094 possession (Score: 82-70)
Lauri Thompson makes the Layup and draws the foul on Jalen Reaves! And-1! Lauri Thompson to the line for 1. [Team fouls: 1] (Jalen Reaves: 1 personal fouls)   FT 1/1: MISS Lauri Thompson makes 0/1 from the line. Offensive rebound by Tim Russell! Tim Russell kicks it out.
Score: 82-72

[11:16] Team_094 possession (Score: 82-72)
Kobe Bryant attempts a Layup. Contested by Jalen Reaves (5.6 feet, ZONE). Kobe Bryant misses. Rebound secured by Kawhi Thompson.

[11:01] Team_062 possession (Score: 82-72)
FOUL! Offensive foul on Jalen Reaves! Kobe Bryant drew the charge! [Team fouls: 2] (Jalen Reaves: 2 personal fouls) TURNOVER! (dead ball)

[10:46] Team_094 possession (Score: 82-72)
Kobe Bryant drives, Jalen Reaves stays with him. Kobe Bryant attempts a Layup. Contested by Jalen Reaves (5.7 feet, MAN). Kobe Bryant misses. Offensive rebound by Kobe Bryant! Kobe Bryant puts it back in!
Score: 82-74

[10:37] Team_062 possession (Score: 82-74)
RJ Williamson drives, Tim Russell stays with him. RJ Williamson attempts a Layup. Contested by Tim Russell (5.0 feet, ZONE). RJ WILLIAMSON MAKES IT! Assist: Jalen Reaves
Score: 84-74

[10:23] Team_094 possession (Score: 84-74)
Kobe Bryant attempts a Midrange. Contested by Jalen Reaves (5.7 feet, MAN). Kobe Bryant misses. Rebound secured by Jalen Reaves.

[10:04] Team_062 possession (Score: 84-74)
Chris Bird drives and kicks out. FOUL! Shooting foul on Kobe Bryant. Kawhi Thompson to the line for 2 free throws. [Team fouls: 1] (Kobe Bryant: 1 personal fouls)   FT 1/2: GOOD   FT 2/2: GOOD Kawhi Thompson makes 2/2 from the line.
Score: 86-74

[09:47] Team_094 possession (Score: 86-74)
Terry Ingram attempts a 3Pt. Contested by RJ Williamson (5.2 feet, ZONE). Terry Ingram misses. Rebound secured by Kawhi Thompson.

[09:33] Team_062 possession (Score: 86-74)
Jalen Reaves attempts a Midrange. Contested by Kobe Bryant (5.6 feet, MAN). Jalen Reaves misses. Rebound secured by Kobe Wagner.

[09:17] Team_094 possession (Score: 86-74)
Tim Russell drives to the basket... Tim Russell loses the ball! Stripped by Kawhi Thompson! TURNOVER! (live ball)

[08:58] Team_062 possession (Score: 86-74)
Kawhi Thompson throws a bad pass out of bounds! TURNOVER! (dead ball)

[08:58] Substitution (Team_062): Chris Bird OUT → Paolo McCollum IN (stamina_rule2)

[08:58] Substitution (Team_062): RJ Williamson OUT → Tony LaVine IN (stamina_rule2)

[08:58] Substitution (Team_062): Michael Hyland OUT → Paul Poole IN (stamina_rule2)

[08:58] Substitution (Team_062): Kawhi Thompson OUT → RJ Wall IN (stamina_rule2)

[08:58] Substitution (Team_062): Jalen Reaves OUT → Devin Young IN (stamina_rule2)

[08:58] Substitution (Team_094): Terry Ingram OUT → Shaquille Bryant IN (stamina_rule2)

[08:58] Substitution (Team_094): Lauri Thompson OUT → Kevin Rozier IN (stamina_rule2)

[08:58] Substitution (Team_094): Kobe Wagner OUT → Ayo Gasol IN (stamina_rule2)

[08:58] Substitution (Team_094): Tim Russell OUT → Domantas Haliburton IN (stamina_rule2)

[08:58] Substitution (Team_094): Kobe Bryant OUT → Isaiah Quickley IN (stamina_rule2)

[08:38] Team_094 possession (Score: 86-74)
FOUL! Reach-in foul on Devin Young during the drive. [Team fouls: 3] No free throws, side out. (Devin Young: 1 personal fouls)

[08:23] Team_094 possession (Score: 86-74)
Kevin Rozier attempts a 3Pt. Wide open! Tony LaVine is 6.4 feet away. [MAN] Kevin Rozier misses. Rebound secured by Devin Young.

[08:10] Team_062 possession (Score: 86-74)
Paul Poole attempts a Layup. Contested by Ayo Gasol (5.0 feet, MAN). Paul Poole misses. Offensive rebound by RJ Wall! RJ Wall kicks it out.

[07:52] Team_062 possession (Score: 86-74)
Paul Poole drives, picks up Ayo Gasol. Help arrives from Kevin Rozier! Paul Poole attempts a Dunk. Contested by Kevin Rozier (5.0 feet, MAN). PAUL POOLE MAKES IT! Assist: Paolo McCollum
Score: 88-74

[07:38] Team_094 possession (Score: 88-74)
Kevin Rozier attempts a 3Pt. Wide open! Paolo McCollum is 6.1 feet away. [ZONE] Kevin Rozier misses. Rebound secured by Paul Poole.

[07:21] Team_062 possession (Score: 88-74)
Devin Young attempts a 3Pt. Wide open! Domantas Haliburton is 6.2 feet away. [ZONE] Devin Young misses. Rebound secured by Ayo Gasol.

[07:06] Team_094 possession (Score: 88-74)
Ayo Gasol drives and kicks out. Ayo Gasol attempts a 3Pt. Contested by RJ Wall (5.2 feet, ZONE). Ayo Gasol misses. Rebound secured by Paul Poole.

[06:51] Team_062 possession (Score: 88-74)
Paolo McCollum drives, Isaiah Quickley stays with him. Paolo McCollum attempts a Dunk. Wide open! Isaiah Quickley is 6.3 feet away. [ZONE] PAOLO MCCOLLUM MAKES IT!
Score: 90-74

[06:34] Team_094 possession (Score: 90-74)
Ayo Gasol attempts a 3Pt. Contested by Paolo McCollum (5.9 feet, ZONE). Ayo Gasol misses. Rebound secured by RJ Wall.

[06:19] Team_062 possession (Score: 90-74)
Paolo McCollum attempts a 3Pt. Contested by Shaquille Bryant (5.6 feet, MAN). Paolo McCollum misses. Rebound secured by Domantas Haliburton.

[06:08] Team_094 possession (Score: 90-74)
Ayo Gasol attempts a 3Pt. Contested by Paolo McCollum (5.9 feet, ZONE). Ayo Gasol misses. Rebound secured by Devin Young.

[05:51] Team_062 possession (Score: 90-74)
RJ Wall throws a bad pass out of bounds! TURNOVER! (dead ball)

[05:35] Team_094 possession (Score: 90-74)
Kevin Rozier loses the ball! Stripped by Tony LaVine! TURNOVER! (live ball)

[05:22] Team_062 possession (Score: 90-74)
Tony LaVine drives to the basket... Tony LaVine throws a bad pass! Stolen by Kevin Rozier! TURNOVER! (live ball)

[05:10] Team_094 possession (Score: 90-74)
Kevin Rozier attempts a 3Pt. Wide open! Paolo McCollum is 6.1 feet away. [ZONE] Kevin Rozier misses. Offensive rebound by Isaiah Quickley! Isaiah Quickley kicks it out.

[04:55] Team_094 possession (Score: 90-74)
Kevin Rozier makes the Midrange and draws the foul on Tony LaVine! And-1! Kevin Rozier to the line for 1. [Team fouls: 4] (Tony LaVine: 1 personal fouls)   FT 1/1: GOOD Kevin Rozier makes 1/1 from the line.
Score: 90-77

[04:42] Team_062 possession (Score: 90-77)
Paul Poole attempts a 3Pt. Contested by Ayo Gasol (5.0 feet, MAN). PAUL POOLE MAKES IT! Assist: Tony LaVine
Score: 93-77

[04:25] Team_094 possession (Score: 93-77)
Isaiah Quickley attempts a Midrange. Wide open! Devin Young is 6.3 feet away. [MAN] ISAIAH QUICKLEY MAKES IT!
Score: 93-79

[04:08] Team_062 possession (Score: 93-79)
Paolo McCollum attempts a Midrange. Wide open! Domantas Haliburton is 6.0 feet away. [ZONE] Paolo McCollum misses. Rebound secured by Isaiah Quickley.

[03:57] Team_094 possession (Score: 93-79)
Kevin Rozier drives and kicks out. Domantas Haliburton attempts a Midrange. Contested by RJ Wall (5.2 feet, MAN). DOMANTAS HALIBURTON MAKES IT! Assist: Isaiah Quickley
Score: 93-81

[03:44] Team_062 possession (Score: 93-81)
Paul Poole attempts a Midrange. Contested by Domantas Haliburton (5.9 feet, ZONE). Paul Poole misses. Rebound secured by Domantas Haliburton.

[03:31] Team_094 possession (Score: 93-81)
Kevin Rozier throws a bad pass! Stolen by Tony LaVine! TURNOVER! (live ball)

[03:16] Team_062 possession (Score: 93-81)
Paul Poole attempts a 3Pt. Contested by Ayo Gasol (5.0 feet, MAN). Paul Poole misses. Rebound secured by Domantas Haliburton.

[02:58] Team_094 possession (Score: 93-81)
Kevin Rozier attempts a 3Pt. Wide open! Paolo McCollum is 6.1 feet away. [ZONE] KEVIN ROZIER MAKES IT! Assist: Shaquille Bryant
Score: 93-84

[02:41] Team_062 possession (Score: 93-84)
Tony LaVine attempts a 3Pt. Contested by Kevin Rozier (5.3 feet, MAN). Tony LaVine misses. Offensive rebound by RJ Wall! RJ Wall kicks it out.

[02:25] Team_062 possession (Score: 93-84)
Devin Young drives, picks up Isaiah Quickley. Help arrives from Kevin Rozier! Devin Young attempts a Dunk. Wide open! Kevin Rozier is 6.5 feet away. [MAN] Devin Young misses. Rebound secured by Ayo Gasol.

[02:08] Team_094 possession (Score: 93-84)
Isaiah Quickley drives, picks up RJ Wall. Help arrives from Paolo McCollum! Isaiah Quickley attempts a Layup. Contested by Paolo McCollum (5.5 feet, ZONE). Isaiah Quickley misses. Rebound secured by Paul Poole.

[01:54] Team_062 possession (Score: 93-84)
Paul Poole drives and kicks out. Devin Young attempts a Midrange. Wide open! Isaiah Quickley is 6.1 feet away. [MAN] DEVIN YOUNG MAKES IT! Assist: Paul Poole
Score: 95-84

[01:43] Team_094 possession (Score: 95-84)
Ayo Gasol attempts a Midrange. Wide open! Paul Poole is 6.6 feet away. [ZONE] AYO GASOL MAKES IT! Assist: Shaquille Bryant
Score: 95-86

[01:29] Team_062 possession (Score: 95-86)
Devin Young attempts a 3Pt. Wide open! Isaiah Quickley is 6.5 feet away. [MAN] Devin Young misses. Rebound secured by Domantas Haliburton.

[01:17] Team_094 possession (Score: 95-86)
Kevin Rozier attempts a 3Pt. Wide open! Paolo McCollum is 6.1 feet away. [ZONE] Kevin Rozier misses. Offensive rebound by Isaiah Quickley! Isaiah Quickley kicks it out.

[01:02] Team_094 possession (Score: 95-86)
Shaquille Bryant drives, RJ Wall stays with him. Shaquille Bryant attempts a Layup. Contested by RJ Wall (4.9 feet, ZONE). Shaquille Bryant misses. Offensive rebound by Isaiah Quickley! Isaiah Quickley kicks it out.

[00:50] Team_094 possession (Score: 95-86)
Kevin Rozier drives, RJ Wall stays with him. Kevin Rozier attempts a Dunk. Contested by RJ Wall (5.7 feet, ZONE). KEVIN ROZIER MAKES IT! Assist: Domantas Haliburton
Score: 95-88

[00:35] Team_062 possession (Score: 95-88)
Paolo McCollum attempts a Midrange. Wide open! Domantas Haliburton is 6.1 feet away. [ZONE] PAOLO MCCOLLUM MAKES IT! Assist: Tony LaVine
Score: 97-88

[00:22] Team_094 possession (Score: 97-88)
Domantas Haliburton attempts a 3Pt. Contested by RJ Wall (5.4 feet, MAN). DOMANTAS HALIBURTON MAKES IT! Assist: Shaquille Bryant
Score: 97-91

[00:07] Team_062 possession (Score: 97-91)
Paolo McCollum attempts a Midrange. Contested by Shaquille Bryant (5.7 feet, MAN). Paolo McCollum misses. Offensive rebound by Devin Young! Devin Young kicks it out.

================================================================================
                              4TH QUARTER COMPLETE                              
================================================================================

4TH QUARTER SCORE: Team_062 15, Team_094 21

BOX SCORE:
================================================================================

Team_062
--------------------------------------------------------------------------------
Player                MIN  PTS  REB  AST  TO      FG   FG%      3P   3P%
--------------------------------------------------------------------------------
Paul Poole             11    5    3    1   0   2/4    50.0     0/0   0.0
Paolo McCollum         20    4    0    1   0   2/4    50.0     0/0   0.0
Kawhi Thompson         37    2    2    0   0   1/2    50.0     0/0   0.0
RJ Williamson          37    2    0    0   0   1/1   100.0     0/0   0.0
Devin Young            11    2    3    0   0   1/4    25.0     0/0   0.0
Jalen Reaves           37    0    2    1   0   0/1     0.0     0/0   0.0
RJ Wall                11    0    3    0   0   0/0     0.0     0/0   0.0
Tony LaVine            11    0    0    2   0   0/0     0.0     0/0   0.0

TEAM: FG: 7/16 (43.8%), 3PT: 1/6 (16.7%), REB: 13 (4 off, 9 def), AST: 5, TO: 4
TEAM FOULS: 4


Team_094
--------------------------------------------------------------------------------
Player                MIN  PTS  REB  AST  TO      FG   FG%      3P   3P%
--------------------------------------------------------------------------------
Kevin Rozier           20    8    0    0   0   3/5    60.0     0/0   0.0
Domantas Haliburton    20    5    4    1   0   2/2   100.0     0/0   0.0
Kobe Bryant            29    2    2    0   0   1/3    33.3     0/0   0.0
Ayo Gasol              20    2    2    0   0   1/4    25.0     0/0   0.0
Isaiah Quickley        20    2    4    1   0   1/2    50.0     0/0   0.0
Tim Russell            29    0    1    0   0   0/0     0.0     0/0   0.0
Terry Ingram           37    0    0    0   0   0/1     0.0     0/0   0.0
Kobe Wagner            29    0    1    0   0   0/0     0.0     0/0   0.0
Shaquille Bryant       11    0    0    3   0   0/0     0.0     0/0   0.0

TEAM: FG: 8/17 (47.1%), 3PT: 2/7 (28.6%), REB: 14 (5 off, 9 def), AST: 5, TO: 3
TEAM FOULS: 1

================================================================================

================================================================================
                               FULL GAME COMPLETE                               
================================================================================

FINAL SCORE: Team_062 97, Team_094 91

SCORING BY QUARTER:
--------------------------------------------------------------------------------
Team                     Q1     Q2     Q3     Q4    FINAL
--------------------------------------------------------------------------------
Team_062                 29     21     32     15       97
Team_094                 21     21     28     21       91
--------------------------------------------------------------------------------

FULL GAME BOX SCORE:
================================================================================

Team_062
--------------------------------------------------------------------------------
Player                MIN  PTS  REB  AST  TO      FG   FG%      3P   3P%      FT STL BLK
--------------------------------------------------------------------------------
RJ Williamson          37    8    0    4   0   4/11   36.4   2/7    28.6   3/4     1   0
Michael Hyland         37   14    8    2   0   8/17   47.1   0/7     0.0   4/7     0   1
Kawhi Thompson         37   13   16    4   1   6/10   60.0   1/4    25.0   4/4     1   0
Jalen Reaves           37   31   13    5   2  11/15   73.3   0/0     0.0   6/9     4   0
Chris Bird             29    6    0    1   3   3/4    75.0   1/1   100.0   4/4     1   0
Paolo McCollum         20    7    0    1   0   3/5    60.0   1/2    50.0   0/0     0   0
Tony LaVine            11    0    0    2   0   0/0     0.0   0/0     0.0   0/0     2   0
Paul Poole             11    5    4    2   0   3/6    50.0   1/3    33.3   0/0     0   0
RJ Wall                11    6    4    1   1   2/3    66.7   2/2   100.0   3/3     0   0
Devin Young            11    4    4    0   1   1/4    25.0   0/2     0.0   0/0     0   0

TEAM: FG: 42/76 (55.3%), 3PT: 8/28 (28.6%), REB: 48 (17 off, 31 def), AST: 22, TO: 8


Team_094
--------------------------------------------------------------------------------
Player                MIN  PTS  REB  AST  TO      FG   FG%      3P   3P%      FT STL BLK
--------------------------------------------------------------------------------
Terry Ingram           37   11    0    2   3   5/11   45.5   1/5    20.0   1/3     0   1
Lauri Thompson         29    9    0    6   2   4/6    66.7   0/1     0.0   1/2     0   1
Kobe Wagner            29   13    4    2   0   6/11   54.5   1/3    33.3   0/0     0   0
Tim Russell            29   19    9    2   0   8/12   66.7   2/5    40.0   1/1     0   0
Kobe Bryant            29    4    7    3   1   2/6    33.3   0/0     0.0   2/2     1   0
Kevin Rozier           20   13    0    1   3   6/8    75.0   2/4    50.0   1/1     1   0
Ayo Gasol              20    7    3    0   0   3/8    37.5   1/4    25.0   0/0     0   0
Domantas Haliburton    20    7   12    2   2   2/3    66.7   1/2    50.0   0/0     0   0
Isaiah Quickley        20    4    7    3   1   2/6    33.3   0/2     0.0   1/2     0   0
Shaquille Bryant       11    0    0    4   0   0/0     0.0   0/0     0.0   0/0     0   0

TEAM: FG: 38/71 (53.5%), 3PT: 8/26 (30.8%), REB: 42 (10 off, 32 def), AST: 25, TO: 12

================================================================================
