================================================================================
                        FULL GAME - Team_068 vs Team_049                        
================================================================================

================================================================================
                       1ST QUARTER - Team_068 vs Team_049                       
================================================================================

[12:00] Team_068 possession (Score: 0-0)
Gary Simons attempts a 3Pt. Contested by De'Aaron Allen (5.1 feet, MAN). GARY SIMONS MAKES IT! Assist: Jaren Johnson
Score: 3-0

[11:44] Team_049 possession (Score: 3-0)
FOUL! Reach-in foul on Gary Simons during the drive. [Team fouls: 1] No free throws, side out. (Gary Simons: 1 personal fouls)

[11:30] Team_049 possession (Score: 3-0)
Jimmy Griffin drives, Gary Simons stays with him. Jimmy Griffin attempts a Layup. Contested by Gary Simons (3.2 feet, ZONE). JIMMY GRIFFIN MAKES IT! Assist: Shai Bird
Score: 3-2

[11:18] Team_068 possession (Score: 3-2)
Nikola Ginobili drives, picks up De'Aaron Allen. Help arrives from Ja Oladipo! Nikola Ginobili attempts a Layup. Contested by Ja Oladipo (4.3 feet, ZONE). NIKOLA GINOBILI MAKES IT!
Score: 5-2

[11:04] Team_049 possession (Score: 5-2)
Shai Bird attempts a 3Pt. Contested by Zion Anunoby (4.8 feet, MAN). Shai Bird misses. Rebound secured by Jaren Johnson.

[10:47] Team_068 possession (Score: 5-2)
FOUL! Reach-in foul on De'Aaron Allen during the drive. [Team fouls: 1] No free throws, side out. (De'Aaron Allen: 1 personal fouls)

[10:31] Team_068 possession (Score: 5-2)
Malcolm Herro attempts a Midrange. Contested by Ja Oladipo (4.2 feet, MAN). Malcolm Herro misses. FOUL! Loose ball foul on De'Aaron Allen during the rebound battle. [Team fouls: 2] No free throws, side out. (De'Aaron Allen: 2 personal fouls)

[10:17] Team_068 possession (Score: 5-2)
Jaren Johnson loses the ball! Stripped by Jimmy Griffin! TURNOVER! (live ball)

[10:03] Team_049 possession (Score: 5-2)
Jimmy Griffin drives, Gary Simons stays with him. Jimmy Griffin attempts a Layup. Contested by Gary Simons (3.2 feet, ZONE). Jimmy Griffin misses. Rebound secured by Nikola Ginobili.

[09:53] Team_068 possession (Score: 5-2)
FOUL! Reach-in foul on De'Aaron Allen during the drive. [Team fouls: 3] No free throws, side out. (De'Aaron Allen: 3 personal fouls)

[09:36] Team_068 possession (Score: 5-2)
Jaren Johnson attempts a Layup. Contested by De'Aaron Allen (4.8 feet, ZONE). Jaren Johnson misses. Rebound secured by De'Aaron Allen.

[09:23] Team_049 possession (Score: 5-2)
Shai Bird makes the Midrange and draws the foul on Zion Anunoby! And-1! Shai Bird to the line for 1. [Team fouls: 2] (Zion Anunoby: 1 personal fouls)   FT 1/1: GOOD Shai Bird makes 1/1 from the line.
Score: 5-5

[09:06] Team_068 possession (Score: 5-5)
Jaren Johnson attempts a Layup. BLOCKED BY JA OLADIPO! Ball is loose! Rebound secured by Shai Mobley.

[08:52] Team_049 possession (Score: 5-5)
Jimmy Griffin attempts a 3Pt. Contested by Zion Anunoby (4.4 feet, ZONE). JIMMY GRIFFIN MAKES IT! Assist: De'Aaron Allen
Score: 5-8

[08:40] Team_068 possession (Score: 5-8)
Zion Anunoby throws a bad pass! Stolen by Shai Bird! TURNOVER! (live ball)

[08:24] Team_049 possession (Score: 5-8)
Shai Mobley makes the Layup and draws the foul on Gary Simons! And-1! Shai Mobley to the line for 1. [Team fouls: 3] (Gary Simons: 2 personal fouls)   FT 1/1: GOOD Shai Mobley makes 1/1 from the line.
Score: 5-11

[08:06] Team_068 possession (Score: 5-11)
Gary Simons attempts a 3Pt. Contested by De'Aaron Allen (5.1 feet, MAN). Gary Simons misses. Rebound secured by Shai Mobley.

[07:52] Team_049 possession (Score: 5-11)
Shai Bird attempts a Midrange. Contested by Zion Anunoby (4.8 feet, MAN). Shai Bird misses. Rebound secured by Gary Simons.

[07:38] Team_068 possession (Score: 5-11)
Malcolm Herro attempts a Layup. Contested by De'Aaron Allen (4.3 feet, ZONE). Malcolm Herro misses. Rebound secured by Jimmy Griffin.

[07:20] Team_049 possession (Score: 5-11)
FOUL! Shooting foul on Jaren Johnson. Jimmy Griffin to the line for 2 free throws. [Team fouls: 4] (Jaren Johnson: 1 personal fouls)   FT 1/2: GOOD   FT 2/2: GOOD Jimmy Griffin makes 2/2 from the line.
Score: 5-13

[07:08] Team_068 possession (Score: 5-13)
Malcolm Herro attempts a Midrange. Contested by Ja Oladipo (4.2 feet, ZONE). Malcolm Herro misses. Rebound secured by De'Aaron Allen.

[06:50] Team_049 possession (Score: 5-13)
FOUL! Holding foul on Malcolm Herro. [IN THE BONUS! 5 team fouls] Ja Oladipo to the line for 2 free throws. (Malcolm Herro: 1 personal fouls)   FT 1/2: GOOD   FT 2/2: GOOD Ja Oladipo makes 2/2 from the line.
Score: 5-15

[06:33] Team_068 possession (Score: 5-15)
Jaren Johnson attempts a Midrange. Contested by De'Aaron Allen (4.8 feet, ZONE). Jaren Johnson misses. Rebound secured by De'Aaron Allen.

[06:19] Team_049 possession (Score: 5-15)
De'Aaron Allen makes the Midrange and draws the foul on Zion Anunoby! And-1! De'Aaron Allen to the line for 1. [BONUS: 6 team fouls] (Zion Anunoby: 2 personal fouls)   FT 1/1: GOOD De'Aaron Allen makes 1/1 from the line.
Score: 5-18

[06:06] Team_068 possession (Score: 5-18)
Malcolm Herro drives to the basket... Malcolm Herro loses the ball! Stripped by Ja Oladipo! TURNOVER! (live ball)

[05:50] Team_049 possession (Score: 5-18)
Ja Oladipo attempts a 3Pt. Contested by Zion Anunoby (4.6 feet, ZONE). Ja Oladipo misses. Rebound secured by Gary Simons.

[05:34] Team_068 possession (Score: 5-18)
FOUL! Holding foul on Shai Mobley. [Team fouls: 4] No free throws, side out. (Shai Mobley: 1 personal fouls)

[05:19] Team_068 possession (Score: 5-18)
Nikola Ginobili attempts a Layup. Contested by Shai Mobley (4.3 feet, MAN). NIKOLA GINOBILI MAKES IT! Assist: Zion Anunoby
Score: 7-18

[05:08] Team_049 possession (Score: 7-18)
Shai Mobley drives to the basket... Shai Mobley commits a violation (traveling/carry)! TURNOVER! (dead ball)

[04:56] Team_068 possession (Score: 7-18)
Zion Anunoby throws a bad pass! Stolen by Shai Bird! TURNOVER! (live ball)

[04:39] Team_049 possession (Score: 7-18)
De'Aaron Allen attempts a Layup. Contested by Gary Simons (3.1 feet, ZONE). DE'AARON ALLEN MAKES IT!
Score: 7-20

[04:22] Team_068 possession (Score: 7-20)
Malcolm Herro drives and kicks out. Malcolm Herro attempts a 3Pt. Contested by Ja Oladipo (4.3 feet, ZONE). MALCOLM HERRO MAKES IT! Assist: Zion Anunoby
Score: 10-20

[04:10] Team_049 possession (Score: 10-20)
FOUL! Holding foul on Nikola Ginobili. [IN THE BONUS! 7 team fouls] Shai Mobley to the line for 2 free throws. (Nikola Ginobili: 1 personal fouls)   FT 1/2: GOOD   FT 2/2: GOOD Shai Mobley makes 2/2 from the line.
Score: 10-22

[03:56] Team_068 possession (Score: 10-22)
FOUL! Shooting foul on Ja Oladipo. Gary Simons to the line for 2 free throws. [BONUS: 5 team fouls] (Ja Oladipo: 1 personal fouls)   FT 1/2: GOOD   FT 2/2: GOOD Gary Simons makes 2/2 from the line.
Score: 12-22

[03:43] Team_049 possession (Score: 12-22)
FOUL! Holding foul on Malcolm Herro. [IN THE BONUS! 8 team fouls] Ja Oladipo to the line for 2 free throws. (Malcolm Herro: 2 personal fouls)   FT 1/2: MISS   FT 2/2: GOOD Ja Oladipo makes 1/2 from the line.
Score: 12-23

[03:28] Team_068 possession (Score: 12-23)
Malcolm Herro drives, Ja Oladipo stays with him. Malcolm Herro attempts a Dunk. Contested by Ja Oladipo (4.4 feet, MAN). MALCOLM HERRO MAKES IT!
Score: 14-23

[03:14] Team_049 possession (Score: 14-23)
Ja Oladipo attempts a Midrange. Contested by Malcolm Herro (4.6 feet, MAN). Ja Oladipo misses. Rebound secured by Nikola Ginobili.

[02:58] Team_068 possession (Score: 14-23)
Jaren Johnson attempts a 3Pt. Contested by Jimmy Griffin (5.3 feet, MAN). Jaren Johnson misses. Offensive rebound by Jaren Johnson! Jaren Johnson kicks it out.

[02:47] Team_068 possession (Score: 14-23)
Jaren Johnson throws a bad pass out of bounds! TURNOVER! (dead ball)

[02:47] Substitution (Team_068): Gary Simons OUT → Jarrett Oladipo IN (stamina_rule2)

[02:47] Substitution (Team_068): Nikola Ginobili OUT → Franz Curry IN (stamina_rule2)

[02:47] Substitution (Team_049): Shai Bird OUT → Shaquille Lillard IN (stamina_rule2)

[02:33] Team_049 possession (Score: 14-23)
Jimmy Griffin attempts a 3Pt. Contested by Jaren Johnson (3.9 feet, MAN). Jimmy Griffin misses. Rebound secured by Jaren Johnson.

[02:15] Team_068 possession (Score: 14-23)
Jarrett Oladipo attempts a Midrange. Contested by Jimmy Griffin (5.3 feet, ZONE). Jarrett Oladipo misses. Offensive rebound by Jaren Johnson! Jaren Johnson kicks it out.

[01:59] Team_068 possession (Score: 14-23)
Jarrett Oladipo drives and kicks out. Jaren Johnson attempts a Midrange. Contested by Jimmy Griffin (5.0 feet, MAN). JAREN JOHNSON MAKES IT!
Score: 16-23

[01:48] Team_049 possession (Score: 16-23)
FOUL! Shooting foul on Franz Curry. De'Aaron Allen to the line for 2 free throws. [BONUS: 9 team fouls] (Franz Curry: 1 personal fouls)   FT 1/2: GOOD   FT 2/2: GOOD De'Aaron Allen makes 2/2 from the line.
Score: 16-25

[01:36] Team_068 possession (Score: 16-25)
Jarrett Oladipo attempts a 3Pt. Contested by Ja Oladipo (5.0 feet, ZONE). Jarrett Oladipo misses. Rebound secured by Shai Mobley.

[01:23] Team_049 possession (Score: 16-25)
Shaquille Lillard attempts a Midrange. Contested by Jarrett Oladipo (4.1 feet, ZONE). Shaquille Lillard misses. Rebound secured by Franz Curry.

[01:08] Team_068 possession (Score: 16-25)
Franz Curry makes the Layup and draws the foul on Shai Mobley! And-1! Franz Curry to the line for 1. [BONUS: 6 team fouls] (Shai Mobley: 2 personal fouls)   FT 1/1: GOOD Franz Curry makes 1/1 from the line.
Score: 19-25

[00:50] Team_049 possession (Score: 19-25)
Shaquille Lillard attempts a 3Pt. Contested by Zion Anunoby (5.0 feet, ZONE). SHAQUILLE LILLARD MAKES IT! Assist: Shai Mobley
Score: 19-28

[00:38] Team_068 possession (Score: 19-28)
Jaren Johnson makes the Layup and draws the foul on Jimmy Griffin! And-1! Jaren Johnson to the line for 1. [BONUS: 7 team fouls] (Jimmy Griffin: 1 personal fouls)   FT 1/1: MISS Jaren Johnson makes 0/1 from the line. Rebound secured by De'Aaron Allen.
Score: 21-28

[00:21] Team_049 possession (Score: 21-28)
Shaquille Lillard attempts a 3Pt. Contested by Zion Anunoby (5.1 feet, MAN). Shaquille Lillard misses. Offensive rebound by De'Aaron Allen! De'Aaron Allen kicks it out.

[00:09] Team_049 possession (Score: 21-28)
Jimmy Griffin attempts a 3Pt. Contested by Zion Anunoby (4.8 feet, ZONE). JIMMY GRIFFIN MAKES IT! Assist: Shai Mobley
Score: 21-31

================================================================================
                              1ST QUARTER COMPLETE                              
================================================================================

1ST QUARTER SCORE: Team_068 21, Team_049 31

BOX SCORE:
================================================================================

Team_068
--------------------------------------------------------------------------------
Player                MIN  PTS  REB  AST  TO      FG   FG%      3P   3P%
--------------------------------------------------------------------------------
Gary Simons             9    5    2    0   0   2/3    66.7     0/0   0.0
Malcolm Herro          12    5    0    0   0   2/4    50.0     0/0   0.0
Nikola Ginobili         9    4    3    0   0   2/2   100.0     0/0   0.0
Franz Curry             3    3    1    0   0   1/1   100.0     0/0   0.0
Jaren Johnson          12    2    4    1   0   1/5    20.0     0/0   0.0
Zion Anunoby           12    0    0    2   0   0/0     0.0     0/0   0.0
Jarrett Oladipo         3    0    0    0   0   0/1     0.0     0/0   0.0

TEAM: FG: 8/16 (50.0%), 3PT: 1/3 (33.3%), REB: 10 (3 off, 7 def), AST: 3, TO: 5
TEAM FOULS: 9 [Team_049 in BONUS]


Team_049
--------------------------------------------------------------------------------
Player                MIN  PTS  REB  AST  TO      FG   FG%      3P   3P%
--------------------------------------------------------------------------------
Jimmy Griffin          12   10    1    0   0   4/6    66.7     0/0   0.0
De'Aaron Allen         12    7    5    1   0   3/3   100.0     0/0   0.0
Shai Mobley            12    5    3    2   0   2/2   100.0     0/0   0.0
Shai Bird               9    3    0    1   0   1/3    33.3     0/0   0.0
Ja Oladipo             12    3    0    0   0   2/4    50.0     0/0   0.0
Shaquille Lillard       3    3    0    0   0   1/2    50.0     0/0   0.0

TEAM: FG: 13/20 (65.0%), 3PT: 3/6 (50.0%), REB: 9 (1 off, 8 def), AST: 4, TO: 1
TEAM FOULS: 7 [Team_068 in BONUS]

================================================================================

================================================================================
                       2ND QUARTER - Team_068 vs Team_049                       
================================================================================

[12:00] Team_068 possession (Score: 21-31)
Malcolm Herro makes the Dunk and draws the foul on Jimmy Griffin! And-1! Malcolm Herro to the line for 1. [Team fouls: 1] (Jimmy Griffin: 1 personal fouls)   FT 1/1: GOOD Malcolm Herro makes 1/1 from the line.
Score: 24-31

[11:45] Team_049 possession (Score: 24-31)
Shai Bird attempts a 3Pt. Contested by Jaren Johnson (4.4 feet, ZONE). Shai Bird misses. Rebound secured by Gary Simons.

[11:30] Team_068 possession (Score: 24-31)
Jaren Johnson attempts a 3Pt. Contested by Ja Oladipo (5.0 feet, ZONE). Jaren Johnson misses. Rebound secured by De'Aaron Allen.

[11:16] Team_049 possession (Score: 24-31)
Jimmy Griffin attempts a Midrange. Contested by Gary Simons (3.2 feet, ZONE). JIMMY GRIFFIN MAKES IT!
Score: 24-33

[11:02] Team_068 possession (Score: 24-33)
Nikola Ginobili drives, picks up De'Aaron Allen. Help arrives from Ja Oladipo! Nikola Ginobili attempts a Dunk. Contested by Ja Oladipo (4.7 feet, ZONE). NIKOLA GINOBILI MAKES IT!
Score: 26-33

[10:46] Team_049 possession (Score: 26-33)
Shai Mobley attempts a 3Pt. Contested by Nikola Ginobili (4.4 feet, MAN). Shai Mobley misses. Offensive rebound by De'Aaron Allen! De'Aaron Allen kicks it out.

[10:30] Team_049 possession (Score: 26-33)
Ja Oladipo attempts a 3Pt. Contested by Zion Anunoby (5.0 feet, ZONE). JA OLADIPO MAKES IT! Assist: Jimmy Griffin
Score: 26-36

[10:15] Team_068 possession (Score: 26-36)
Zion Anunoby attempts a Layup. BLOCKED BY SHAI BIRD! Ball is loose! Rebound secured by Jimmy Griffin.

[09:59] Team_049 possession (Score: 26-36)
Shai Bird makes the Dunk and draws the foul on Gary Simons! And-1! Shai Bird to the line for 1. [Team fouls: 1] (Gary Simons: 1 personal fouls)   FT 1/1: GOOD Shai Bird makes 1/1 from the line.
Score: 26-39

[09:46] Team_068 possession (Score: 26-39)
Zion Anunoby attempts a 3Pt. Contested by Shai Bird (4.4 feet, MAN). ZION ANUNOBY MAKES IT! Assist: Malcolm Herro
Score: 29-39

[09:33] Team_049 possession (Score: 29-39)
De'Aaron Allen makes the Layup and draws the foul on Gary Simons! And-1! De'Aaron Allen to the line for 1. [Team fouls: 2] (Gary Simons: 2 personal fouls)   FT 1/1: GOOD De'Aaron Allen makes 1/1 from the line.
Score: 29-42

[09:18] Team_068 possession (Score: 29-42)
Gary Simons drives and kicks out. Zion Anunoby attempts a 3Pt. Contested by Shai Bird (4.2 feet, ZONE). Zion Anunoby misses. Offensive rebound by Gary Simons! Gary Simons puts it back in!
Score: 31-42

[09:03] Team_049 possession (Score: 31-42)
De'Aaron Allen drives and kicks out. Shai Bird attempts a Midrange. Contested by Gary Simons (3.5 feet, ZONE). Shai Bird misses. Rebound secured by Jaren Johnson.

[08:48] Team_068 possession (Score: 31-42)
Jaren Johnson attempts a 3Pt. Contested by Shai Bird (4.5 feet, ZONE). JAREN JOHNSON MAKES IT! Assist: Malcolm Herro
Score: 34-42

[08:32] Team_049 possession (Score: 34-42)
FOUL! Shooting foul on Jaren Johnson. Jimmy Griffin to the line for 2 free throws. [Team fouls: 3] (Jaren Johnson: 1 personal fouls)   FT 1/2: GOOD   FT 2/2: MISS Jimmy Griffin makes 1/2 from the line. Rebound secured by Gary Simons.
Score: 34-43

[08:22] Team_068 possession (Score: 34-43)
Jaren Johnson attempts a 3Pt. Contested by Shai Bird (4.6 feet, ZONE). Jaren Johnson misses. Rebound secured by De'Aaron Allen.

[08:11] Team_049 possession (Score: 34-43)
FOUL! Holding foul on Malcolm Herro. [Team fouls: 4] No free throws, side out. (Malcolm Herro: 1 personal fouls)

[07:51] Team_049 possession (Score: 34-43)
De'Aaron Allen attempts a 3Pt. Contested by Zion Anunoby (4.9 feet, ZONE). De'Aaron Allen misses. Rebound secured by Nikola Ginobili.

[07:38] Team_068 possession (Score: 34-43)
Malcolm Herro attempts a Midrange. Contested by De'Aaron Allen (5.0 feet, ZONE). MALCOLM HERRO MAKES IT!
Score: 36-43

[07:28] Team_049 possession (Score: 36-43)
Shai Mobley drives, picks up Nikola Ginobili. Help arrives from Malcolm Herro! Shai Mobley attempts a Dunk. Contested by Malcolm Herro (4.8 feet, MAN). Shai Mobley misses. Rebound secured by Jaren Johnson.

[07:12] Team_068 possession (Score: 36-43)
Nikola Ginobili attempts a Layup. Contested by De'Aaron Allen (5.1 feet, ZONE). Nikola Ginobili misses. Rebound secured by De'Aaron Allen.

[06:57] Team_049 possession (Score: 36-43)
FOUL! Shooting foul on Zion Anunoby. Jimmy Griffin to the line for 3 free throws. [BONUS: 5 team fouls] (Zion Anunoby: 1 personal fouls)   FT 1/3: GOOD   FT 2/3: GOOD   FT 3/3: GOOD Jimmy Griffin makes 3/3 from the line.
Score: 36-46

[06:45] Team_068 possession (Score: 36-46)
Nikola Ginobili loses the ball! Stripped by Shai Mobley! TURNOVER! (live ball)

[06:28] Team_049 possession (Score: 36-46)
Jimmy Griffin attempts a 3Pt. Contested by Jaren Johnson (4.7 feet, MAN). JIMMY GRIFFIN MAKES IT! Assist: Shai Bird
Score: 36-49

[06:13] Team_068 possession (Score: 36-49)
Zion Anunoby drives to the basket... Zion Anunoby loses control! Ball rolls out of bounds! TURNOVER! (dead ball)

[06:13] Substitution (Team_068): Zion Anunoby OUT → Cole Anthony IN (stamina_rule2)

[06:13] Substitution (Team_068): Malcolm Herro OUT → Ja Banchero IN (stamina_rule2)

[06:13] Substitution (Team_068): Jaren Johnson OUT → Miles Murray IN (stamina_rule2)

[06:13] Substitution (Team_068): Gary Simons OUT → Jarrett Oladipo IN (stamina_rule2)

[06:13] Substitution (Team_068): Nikola Ginobili OUT → Franz Curry IN (stamina_rule2)

[06:13] Substitution (Team_049): Shai Bird OUT → Shaquille Lillard IN (stamina_rule2)

[06:13] Substitution (Team_049): Ja Oladipo OUT → Shai Jordan IN (stamina_rule2)

[06:13] Substitution (Team_049): Jimmy Griffin OUT → Desmond Towns IN (stamina_rule2)

[06:13] Substitution (Team_049): De'Aaron Allen OUT → Giannis Anunoby IN (stamina_rule2)

[06:13] Substitution (Team_049): Shai Mobley OUT → Miles Jackson IN (stamina_rule2)

[05:56] Team_049 possession (Score: 36-49)
FOUL! Holding foul on Ja Banchero. [IN THE BONUS! 6 team fouls] Shai Jordan to the line for 2 free throws. (Ja Banchero: 1 personal fouls)   FT 1/2: GOOD   FT 2/2: GOOD Shai Jordan makes 2/2 from the line.
Score: 36-51

[05:42] Team_068 possession (Score: 36-51)
Ja Banchero attempts a Midrange. Wide open! Shai Jordan is 6.3 feet away. [MAN] Ja Banchero misses. Offensive rebound by Jarrett Oladipo! Jarrett Oladipo kicks it out.

[05:25] Team_068 possession (Score: 36-51)
Franz Curry attempts a Layup. Contested by Miles Jackson (3.9 feet, ZONE). FRANZ CURRY MAKES IT! Assist: Cole Anthony
Score: 38-51

[05:05] Team_049 possession (Score: 38-51)
Desmond Towns attempts a 3Pt. Contested by Ja Banchero (5.3 feet, ZONE). Desmond Towns misses. Rebound secured by Ja Banchero.

[04:54] Team_068 possession (Score: 38-51)
FOUL! Reach-in foul on Shaquille Lillard during the drive. [Team fouls: 2] No free throws, side out. (Shaquille Lillard: 1 personal fouls)

[04:39] Team_068 possession (Score: 38-51)
Jarrett Oladipo attempts a Layup. Contested by Giannis Anunoby (5.0 feet, MAN). Jarrett Oladipo misses. Rebound secured by Shai Jordan.

[04:28] Team_049 possession (Score: 38-51)
Desmond Towns attempts a 3Pt. Contested by Ja Banchero (5.3 feet, ZONE). Desmond Towns misses. Rebound secured by Franz Curry.

[04:16] Team_068 possession (Score: 38-51)
Franz Curry attempts a Midrange. Wide open! Shai Jordan is 6.6 feet away. [ZONE] Franz Curry misses. Rebound secured by Shai Jordan.

[04:05] Team_049 possession (Score: 38-51)
Miles Jackson attempts a Layup. Contested by Franz Curry (4.4 feet, MAN). MILES JACKSON MAKES IT! Assist: Shaquille Lillard
Score: 38-53

[03:50] Team_068 possession (Score: 38-53)
FOUL! Reach-in foul on Miles Jackson during the drive. [Team fouls: 3] No free throws, side out. (Miles Jackson: 1 personal fouls)

[03:40] Team_068 possession (Score: 38-53)
FOUL! Offensive foul on Franz Curry! Miles Jackson drew the charge! [Team fouls: 7] (Franz Curry: 1 personal fouls) TURNOVER! (dead ball)

[03:28] Team_049 possession (Score: 38-53)
Miles Jackson drives, Franz Curry stays with him. Miles Jackson attempts a Layup. Contested by Franz Curry (4.4 feet, ZONE). Miles Jackson misses. Rebound secured by Franz Curry.

[03:12] Team_068 possession (Score: 38-53)
FOUL! Offensive foul on Cole Anthony! Shaquille Lillard drew the charge! [Team fouls: 8] (Cole Anthony: 1 personal fouls) TURNOVER! (dead ball)

[02:58] Team_049 possession (Score: 38-53)
Shai Jordan attempts a Layup. Contested by Ja Banchero (5.2 feet, MAN). SHAI JORDAN MAKES IT!
Score: 38-55

[02:46] Team_068 possession (Score: 38-55)
Jarrett Oladipo makes the Dunk and draws the foul on Giannis Anunoby! And-1! Jarrett Oladipo to the line for 1. [Team fouls: 4] (Giannis Anunoby: 1 personal fouls)   FT 1/1: GOOD Jarrett Oladipo makes 1/1 from the line.
Score: 41-55

[02:30] Team_049 possession (Score: 41-55)
Shai Jordan attempts a 3Pt. Contested by Ja Banchero (5.2 feet, MAN). Shai Jordan misses. Rebound secured by Franz Curry.

[02:19] Team_068 possession (Score: 41-55)
Jarrett Oladipo attempts a Midrange. Contested by Giannis Anunoby (5.0 feet, ZONE). Jarrett Oladipo misses. Rebound secured by Giannis Anunoby.

[02:06] Team_049 possession (Score: 41-55)
Desmond Towns attempts a 3Pt. Contested by Miles Murray (4.0 feet, MAN). Desmond Towns misses. Rebound secured by Franz Curry.

[01:48] Team_068 possession (Score: 41-55)
FOUL! Holding foul on Miles Jackson. [IN THE BONUS! 5 team fouls] Franz Curry to the line for 2 free throws. (Miles Jackson: 2 personal fouls)   FT 1/2: GOOD   FT 2/2: GOOD Franz Curry makes 2/2 from the line.
Score: 43-55

[01:34] Team_049 possession (Score: 43-55)
Miles Jackson attempts a 3Pt. Contested by Ja Banchero (5.2 feet, ZONE). Miles Jackson misses. Rebound secured by Franz Curry.

[01:16] Team_068 possession (Score: 43-55)
Ja Banchero attempts a 3Pt. Contested by Shaquille Lillard (4.7 feet, ZONE). Ja Banchero misses. Offensive rebound by Jarrett Oladipo! Jarrett Oladipo kicks it out.

[01:04] Team_068 possession (Score: 43-55)
Franz Curry attempts a Midrange. Contested by Miles Jackson (3.9 feet, MAN). Franz Curry misses. Rebound secured by Shai Jordan.

[00:49] Team_049 possession (Score: 43-55)
Shai Jordan makes the Midrange and draws the foul on Miles Murray! And-1! Shai Jordan to the line for 1. [BONUS: 9 team fouls] (Miles Murray: 1 personal fouls)   FT 1/1: GOOD Shai Jordan makes 1/1 from the line.
Score: 43-58

[00:34] Team_068 possession (Score: 43-58)
Franz Curry drives and kicks out. Cole Anthony attempts a 3Pt. Contested by Shaquille Lillard (4.6 feet, ZONE). COLE ANTHONY MAKES IT!
Score: 46-58

[00:17] Team_049 possession (Score: 46-58)
FOUL! Offensive foul on Miles Jackson! Franz Curry drew the charge! [Team fouls: 6] (Miles Jackson: 3 personal fouls) TURNOVER! (dead ball)

================================================================================
                              2ND QUARTER COMPLETE                              
================================================================================

2ND QUARTER SCORE: Team_068 25, Team_049 27

BOX SCORE:
================================================================================

Team_068
--------------------------------------------------------------------------------
Player                MIN  PTS  REB  AST  TO      FG   FG%      3P   3P%
--------------------------------------------------------------------------------
Malcolm Herro          18    5    0    2   0   2/2   100.0     0/0   0.0
Franz Curry             9    4    5    0   0   2/4    50.0     0/0   0.0
Jaren Johnson          18    3    2    0   0   1/3    33.3     0/0   0.0
Zion Anunoby           18    3    0    0   0   1/2    50.0     0/0   0.0
Jarrett Oladipo         9    3    2    0   0   1/3    33.3     0/0   0.0
Cole Anthony            6    3    0    1   0   1/1   100.0     0/0   0.0
Gary Simons            16    2    3    0   0   1/1   100.0     0/0   0.0
Nikola Ginobili        16    2    1    0   0   1/2    50.0     0/0   0.0
Ja Banchero             6    0    1    0   0   0/0     0.0     0/0   0.0

TEAM: FG: 10/18 (55.6%), 3PT: 2/4 (50.0%), REB: 14 (3 off, 11 def), AST: 3, TO: 4
TEAM FOULS: 9 [Team_049 in BONUS]


Team_049
--------------------------------------------------------------------------------
Player                MIN  PTS  REB  AST  TO      FG   FG%      3P   3P%
--------------------------------------------------------------------------------
Jimmy Griffin          18    8    1    1   0   3/4    75.0     0/0   0.0
Shai Jordan             6    7    3    0   0   3/4    75.0     0/0   0.0
Shai Bird              16    3    0    1   0   1/2    50.0     0/0   0.0
De'Aaron Allen         18    3    4    0   0   1/3    33.3     0/0   0.0
Ja Oladipo             18    3    0    0   0   1/1   100.0     0/0   0.0
Miles Jackson           6    2    0    0   0   1/3    33.3     0/0   0.0
Shai Mobley            18    0    0    0   0   0/1     0.0     0/0   0.0
Desmond Towns           6    0    0    0   0   0/3     0.0     0/0   0.0
Shaquille Lillard       9    0    0    1   0   0/0     0.0     0/0   0.0
Giannis Anunoby         6    0    1    0   0   0/0     0.0     0/0   0.0

TEAM: FG: 10/21 (47.6%), 3PT: 3/10 (30.0%), REB: 9 (1 off, 8 def), AST: 3, TO: 1
TEAM FOULS: 6 [Team_068 in BONUS]

================================================================================

================================================================================
                       3RD QUARTER - Team_068 vs Team_049                       
================================================================================

[12:00] Team_068 possession (Score: 46-58)
Gary Simons attempts a Midrange. Contested by De'Aaron Allen (5.1 feet, MAN). Gary Simons misses. Rebound secured by Shai Mobley.

[11:45] Team_049 possession (Score: 46-58)
Shai Bird attempts a 3Pt. Contested by Zion Anunoby (4.8 feet, MAN). SHAI BIRD MAKES IT! Assist: Shai Mobley
Score: 46-61

[11:31] Team_068 possession (Score: 46-61)
Malcolm Herro attempts a 3Pt. Contested by Ja Oladipo (4.2 feet, ZONE). Malcolm Herro misses. Offensive rebound by Jaren Johnson! Jaren Johnson kicks it out.

[11:17] Team_068 possession (Score: 46-61)
Malcolm Herro drives and kicks out. Nikola Ginobili attempts a Midrange. Contested by Shai Mobley (4.2 feet, MAN). Nikola Ginobili misses. Rebound secured by Jimmy Griffin.

[11:05] Team_049 possession (Score: 46-61)
Jimmy Griffin attempts a 3Pt. Contested by Malcolm Herro (4.2 feet, ZONE). Jimmy Griffin misses. Rebound secured by Jaren Johnson.

[10:54] Team_068 possession (Score: 46-61)
Jaren Johnson attempts a 3Pt. Contested by Jimmy Griffin (5.2 feet, MAN). Jaren Johnson misses. Rebound secured by De'Aaron Allen.

[10:38] Team_049 possession (Score: 46-61)
Jimmy Griffin loses the ball! Stripped by Jaren Johnson! TURNOVER! (live ball)

[10:26] Team_068 possession (Score: 46-61)
Zion Anunoby drives to the basket... Zion Anunoby loses the ball! Stripped by Shai Bird! TURNOVER! (live ball)

[10:08] Team_049 possession (Score: 46-61)
Ja Oladipo attempts a 3Pt. Contested by Malcolm Herro (4.4 feet, MAN). Ja Oladipo misses. Offensive rebound by Jimmy Griffin! Jimmy Griffin kicks it out.

[09:53] Team_049 possession (Score: 46-61)
Ja Oladipo loses control! Ball rolls out of bounds! TURNOVER! (dead ball)

[09:39] Team_068 possession (Score: 46-61)
Jaren Johnson drives to the basket... Jaren Johnson throws a bad pass out of bounds! TURNOVER! (dead ball)

[09:24] Team_049 possession (Score: 46-61)
Jimmy Griffin attempts a 3Pt. Contested by Jaren Johnson (3.6 feet, MAN). Jimmy Griffin misses. Rebound secured by Nikola Ginobili.

[09:04] Team_068 possession (Score: 46-61)
Nikola Ginobili attempts a Layup. Contested by Shai Mobley (4.3 feet, MAN). NIKOLA GINOBILI MAKES IT! Assist: Malcolm Herro
Score: 48-61

[08:50] Team_049 possession (Score: 48-61)
Ja Oladipo attempts a 3Pt. Contested by Malcolm Herro (4.4 feet, MAN). JA OLADIPO MAKES IT! Assist: Jimmy Griffin
Score: 48-64

[08:33] Team_068 possession (Score: 48-64)
Jaren Johnson makes the Midrange and draws the foul on Jimmy Griffin! And-1! Jaren Johnson to the line for 1. [Team fouls: 1] (Jimmy Griffin: 1 personal fouls)   FT 1/1: GOOD Jaren Johnson makes 1/1 from the line.
Score: 51-64

[08:21] Team_049 possession (Score: 51-64)
FOUL! Reach-in foul on Jaren Johnson during the drive. [Team fouls: 1] No free throws, side out. (Jaren Johnson: 1 personal fouls)

[08:10] Team_049 possession (Score: 51-64)
De'Aaron Allen attempts a 3Pt. Contested by Gary Simons (3.0 feet, MAN). De'Aaron Allen misses. Rebound secured by Jaren Johnson.

[07:58] Team_068 possession (Score: 51-64)
Gary Simons drives and kicks out. Jaren Johnson attempts a Midrange. Contested by Jimmy Griffin (4.7 feet, ZONE). JAREN JOHNSON MAKES IT! Assist: Malcolm Herro
Score: 53-64

[07:40] Team_049 possession (Score: 53-64)
Ja Oladipo attempts a Midrange. Contested by Malcolm Herro (4.4 feet, MAN). Ja Oladipo misses. Rebound secured by Gary Simons.

[07:25] Team_068 possession (Score: 53-64)
Nikola Ginobili attempts a Midrange. Contested by Jimmy Griffin (4.7 feet, ZONE). Nikola Ginobili misses. Rebound secured by Jimmy Griffin.

[07:05] Team_049 possession (Score: 53-64)
FOUL! Shooting foul on Jaren Johnson. Ja Oladipo to the line for 2 free throws. [Team fouls: 2] (Jaren Johnson: 2 personal fouls)   FT 1/2: GOOD   FT 2/2: MISS Ja Oladipo makes 1/2 from the line. Rebound secured by Nikola Ginobili.
Score: 53-65

[06:52] Team_068 possession (Score: 53-65)
Zion Anunoby drives and kicks out. Zion Anunoby attempts a Midrange. Contested by Shai Bird (3.9 feet, MAN). Zion Anunoby misses. Rebound secured by De'Aaron Allen.

[06:37] Team_049 possession (Score: 53-65)
FOUL! Reach-in foul on Gary Simons during the drive. [Team fouls: 3] No free throws, side out. (Gary Simons: 1 personal fouls)

[06:22] Team_049 possession (Score: 53-65)
Shai Mobley drives, picks up Nikola Ginobili. Help arrives from Malcolm Herro! Shai Mobley attempts a Dunk. Contested by Malcolm Herro (4.3 feet, MAN). Shai Mobley misses. Offensive rebound by Jimmy Griffin! Jimmy Griffin kicks it out.

[06:11] Team_049 possession (Score: 53-65)
Shai Mobley attempts a Midrange. Contested by Nikola Ginobili (4.3 feet, MAN). Shai Mobley misses. Rebound secured by Jaren Johnson.

[06:00] Team_068 possession (Score: 53-65)
Nikola Ginobili attempts a Midrange. Contested by De'Aaron Allen (4.3 feet, ZONE). NIKOLA GINOBILI MAKES IT!
Score: 55-65

[05:43] Team_049 possession (Score: 55-65)
Shai Mobley attempts a Layup. Contested by Nikola Ginobili (4.4 feet, ZONE). SHAI MOBLEY MAKES IT!
Score: 55-67

[05:29] Team_068 possession (Score: 55-67)
Jaren Johnson drives and kicks out. Gary Simons attempts a Midrange. Contested by De'Aaron Allen (4.3 feet, ZONE). GARY SIMONS MAKES IT! Assist: Malcolm Herro
Score: 57-67

[05:15] Team_049 possession (Score: 57-67)
Jimmy Griffin attempts a Midrange. Contested by Gary Simons (3.3 feet, ZONE). JIMMY GRIFFIN MAKES IT! Assist: Ja Oladipo
Score: 57-69

[04:59] Team_068 possession (Score: 57-69)
Jaren Johnson drives and kicks out. Gary Simons attempts a 3Pt. Contested by Ja Oladipo (4.3 feet, ZONE). Gary Simons misses. Offensive rebound by Nikola Ginobili! Nikola Ginobili puts it back in!
Score: 59-69

[04:44] Team_049 possession (Score: 59-69)
Jimmy Griffin attempts a Layup. Contested by Gary Simons (3.3 feet, ZONE). JIMMY GRIFFIN MAKES IT!
Score: 59-71

[04:34] Team_068 possession (Score: 59-71)
Nikola Ginobili drives and kicks out. Nikola Ginobili attempts a 3Pt. Contested by Ja Oladipo (4.3 feet, ZONE). Nikola Ginobili misses. Rebound secured by De'Aaron Allen.

[04:19] Team_049 possession (Score: 59-71)
Ja Oladipo attempts a Layup. Contested by Malcolm Herro (4.5 feet, MAN). JA OLADIPO MAKES IT! Assist: Jimmy Griffin
Score: 59-73

[04:08] Team_068 possession (Score: 59-73)
Gary Simons drives, De'Aaron Allen stays with him. Gary Simons attempts a Dunk. Contested by De'Aaron Allen (5.1 feet, MAN). GARY SIMONS MAKES IT! Assist: Zion Anunoby
Score: 61-73

[03:50] Team_049 possession (Score: 61-73)
FOUL! Shooting foul on Gary Simons. De'Aaron Allen to the line for 2 free throws. [Team fouls: 4] (Gary Simons: 2 personal fouls)   FT 1/2: GOOD   FT 2/2: MISS De'Aaron Allen makes 1/2 from the line. Rebound secured by Jaren Johnson.
Score: 61-74

[03:38] Team_068 possession (Score: 61-74)
Nikola Ginobili drives, Shai Mobley stays with him. Nikola Ginobili attempts a Dunk. Contested by Shai Mobley (4.4 feet, MAN). NIKOLA GINOBILI MAKES IT!
Score: 63-74

[03:23] Team_049 possession (Score: 63-74)
Jimmy Griffin attempts a Layup. Contested by Jaren Johnson (3.8 feet, MAN). JIMMY GRIFFIN MAKES IT! Assist: De'Aaron Allen
Score: 63-76

[03:09] Team_068 possession (Score: 63-76)
Malcolm Herro attempts a 3Pt. Contested by Ja Oladipo (4.4 feet, ZONE). Malcolm Herro misses. Rebound secured by Jimmy Griffin.

[02:53] Team_049 possession (Score: 63-76)
Shai Bird attempts a Layup. Contested by Gary Simons (3.9 feet, ZONE). Shai Bird misses. Offensive rebound by De'Aaron Allen! De'Aaron Allen kicks it out.

[02:34] Team_049 possession (Score: 63-76)
Ja Oladipo attempts a Layup. Contested by Gary Simons (3.7 feet, ZONE). JA OLADIPO MAKES IT! Assist: Shai Bird
Score: 63-78

[02:20] Team_068 possession (Score: 63-78)
Gary Simons attempts a Midrange. Contested by De'Aaron Allen (5.2 feet, MAN). Gary Simons misses. Rebound secured by Jimmy Griffin.

[02:05] Team_049 possession (Score: 63-78)
De'Aaron Allen attempts a Midrange. Contested by Gary Simons (3.4 feet, MAN). De'Aaron Allen misses. Rebound secured by Gary Simons.

[01:56] Team_068 possession (Score: 63-78)
Nikola Ginobili loses the ball! Stripped by Shai Mobley! TURNOVER! (live ball)

[01:37] Team_049 possession (Score: 63-78)
Jimmy Griffin attempts a 3Pt. Contested by Jaren Johnson (4.0 feet, MAN). Jimmy Griffin misses. Offensive rebound by Shai Mobley! Shai Mobley puts it back in!
Score: 63-80

[01:25] Team_068 possession (Score: 63-80)
Gary Simons makes the Layup and draws the foul on Ja Oladipo! And-1! Gary Simons to the line for 1. [Team fouls: 2] (Ja Oladipo: 1 personal fouls)   FT 1/1: GOOD Gary Simons makes 1/1 from the line.
Score: 66-80

[01:09] Team_049 possession (Score: 66-80)
Ja Oladipo attempts a Midrange. Contested by Malcolm Herro (4.8 feet, MAN). Ja Oladipo misses. Rebound secured by Gary Simons.

[00:52] Team_068 possession (Score: 66-80)
Gary Simons drives and kicks out. Jaren Johnson attempts a Midrange. Contested by Ja Oladipo (4.7 feet, ZONE). Jaren Johnson misses. Rebound secured by Shai Mobley.

[00:40] Team_049 possession (Score: 66-80)
De'Aaron Allen attempts a 3Pt. Contested by Zion Anunoby (4.6 feet, ZONE). De'Aaron Allen misses. Rebound secured by Gary Simons.

[00:27] Team_068 possession (Score: 66-80)
Zion Anunoby attempts a 3Pt. Contested by Ja Oladipo (5.1 feet, ZONE). Zion Anunoby misses. Offensive rebound by Nikola Ginobili! Nikola Ginobili's putback is no good. Rebound secured by De'Aaron Allen.

[00:12] Team_049 possession (Score: 66-80)
Ja Oladipo attempts a Midrange. Contested by Malcolm Herro (4.9 feet, MAN). Ja Oladipo misses. Rebound secured by Gary Simons.

================================================================================
                              3RD QUARTER COMPLETE                              
================================================================================

3RD QUARTER SCORE: Team_068 20, Team_049 22

BOX SCORE:
================================================================================

Team_068
--------------------------------------------------------------------------------
Player                MIN  PTS  REB  AST  TO      FG   FG%      3P   3P%
--------------------------------------------------------------------------------
Nikola Ginobili        28    8    3    0   0   4/6    66.7     0/0   0.0
Gary Simons            28    7    5    0   0   3/6    50.0     0/0   0.0
Jaren Johnson          30    5    5    0   0   2/3    66.7     0/0   0.0
Malcolm Herro          30    0    0    3   0   0/2     0.0     0/0   0.0
De'Aaron Allen         30    0    5    1   0   0/4     0.0     0/0   0.0
Zion Anunoby           30    0    0    1   0   0/2     0.0     0/0   0.0

TEAM: FG: 9/19 (47.4%), 3PT: 0/3 (0.0%), REB: 14 (3 off, 11 def), AST: 4, TO: 3
TEAM FOULS: 4


Team_049
--------------------------------------------------------------------------------
Player                MIN  PTS  REB  AST  TO      FG   FG%      3P   3P%
--------------------------------------------------------------------------------
Ja Oladipo             30    7    0    1   0   3/7    42.9     0/0   0.0
Jimmy Griffin          30    6    6    2   0   3/5    60.0     0/0   0.0
Shai Mobley            30    4    3    1   0   2/3    66.7     0/0   0.0
Shai Bird              28    3    0    1   0   1/1   100.0     0/0   0.0

TEAM: FG: 9/20 (45.0%), 3PT: 3/7 (42.9%), REB: 13 (4 off, 9 def), AST: 6, TO: 2
TEAM FOULS: 2

================================================================================

================================================================================
                       4TH QUARTER - Team_068 vs Team_049                       
================================================================================

[12:00] Substitution (Team_068): Zion Anunoby OUT (stamina: 71) → Cole Anthony IN (comeback_detected)

[12:00] Substitution (Team_049): Shai Bird OUT (stamina: 67) → Shaquille Lillard IN (comeback_detected)

[12:00] Team_068 possession (Score: 66-80)
Nikola Ginobili attempts a Layup. Contested by Shai Mobley (4.5 feet, MAN). NIKOLA GINOBILI MAKES IT! Assist: Malcolm Herro
Score: 68-80

[11:46] Team_049 possession (Score: 68-80)
De'Aaron Allen attempts a 3Pt. Contested by Gary Simons (3.5 feet, MAN). De'Aaron Allen misses. Rebound secured by Gary Simons.

[11:33] Team_068 possession (Score: 68-80)
Gary Simons attempts a Layup. Contested by De'Aaron Allen (5.3 feet, MAN). GARY SIMONS MAKES IT! Assist: Nikola Ginobili
Score: 70-80

[11:17] Team_049 possession (Score: 70-80)
Jimmy Griffin attempts a 3Pt. Contested by Malcolm Herro (4.6 feet, ZONE). Jimmy Griffin misses. Rebound secured by Nikola Ginobili.

[11:08] Team_068 possession (Score: 70-80)
Cole Anthony drives and kicks out. Jaren Johnson attempts a Midrange. Contested by Jimmy Griffin (5.1 feet, MAN). JAREN JOHNSON MAKES IT! Assist: Malcolm Herro
Score: 72-80

[10:53] Team_049 possession (Score: 72-80)
Shaquille Lillard attempts a Layup. Contested by Gary Simons (4.0 feet, ZONE). SHAQUILLE LILLARD MAKES IT!
Score: 72-82

[10:40] Team_068 possession (Score: 72-82)
Malcolm Herro attempts a 3Pt. Contested by Ja Oladipo (4.7 feet, MAN). MALCOLM HERRO MAKES IT!
Score: 75-82

[10:22] Team_049 possession (Score: 75-82)
Jimmy Griffin attempts a 3Pt. Contested by Malcolm Herro (4.7 feet, ZONE). Jimmy Griffin misses. Offensive rebound by De'Aaron Allen! De'Aaron Allen kicks it out.

[10:09] Team_049 possession (Score: 75-82)
Jimmy Griffin drives, picks up Gary Simons. Help arrives from Malcolm Herro! Jimmy Griffin attempts a Layup. Contested by Malcolm Herro (3.9 feet, ZONE). JIMMY GRIFFIN MAKES IT!
Score: 75-84

[09:58] Team_068 possession (Score: 75-84)
Malcolm Herro attempts a 3Pt. Contested by Ja Oladipo (4.7 feet, ZONE). Malcolm Herro misses. Rebound secured by De'Aaron Allen.

[09:48] Team_049 possession (Score: 75-84)
Jimmy Griffin attempts a 3Pt. Contested by Malcolm Herro (4.8 feet, ZONE). JIMMY GRIFFIN MAKES IT!
Score: 75-87

[09:32] Team_068 possession (Score: 75-87)
Malcolm Herro attempts a Midrange. Contested by Jimmy Griffin (5.2 feet, ZONE). MALCOLM HERRO MAKES IT! Assist: Jaren Johnson
Score: 77-87

[09:16] Team_049 possession (Score: 77-87)
Shai Mobley attempts a 3Pt. Contested by Nikola Ginobili (5.2 feet, MAN). SHAI MOBLEY MAKES IT!
Score: 77-90

[08:58] Team_068 possession (Score: 77-90)
Gary Simons makes the Dunk and draws the foul on De'Aaron Allen! And-1! Gary Simons to the line for 1. [Team fouls: 1] (De'Aaron Allen: 1 personal fouls)   FT 1/1: GOOD Gary Simons makes 1/1 from the line.
Score: 80-90

[08:42] Team_049 possession (Score: 80-90)
Jimmy Griffin attempts a 3Pt. Contested by Jaren Johnson (4.4 feet, MAN). JIMMY GRIFFIN MAKES IT! Assist: De'Aaron Allen
Score: 80-93

[08:28] Team_068 possession (Score: 80-93)
Gary Simons attempts a Midrange. Contested by De'Aaron Allen (5.6 feet, MAN). GARY SIMONS MAKES IT!
Score: 82-93

[08:16] Team_049 possession (Score: 82-93)
Jimmy Griffin attempts a Midrange. Contested by Jaren Johnson (4.4 feet, MAN). JIMMY GRIFFIN MAKES IT!
Score: 82-95

[08:07] Team_068 possession (Score: 82-95)
Jaren Johnson attempts a 3Pt. Contested by Jimmy Griffin (5.8 feet, MAN). Jaren Johnson misses. Rebound secured by Shai Mobley.

[07:53] Team_049 possession (Score: 82-95)
FOUL! Holding foul on Jaren Johnson. [Team fouls: 1] No free throws, side out. (Jaren Johnson: 1 personal fouls)

[07:36] Team_049 possession (Score: 82-95)
FOUL! Shooting foul on Malcolm Herro. Shaquille Lillard to the line for 2 free throws. [Team fouls: 2] (Malcolm Herro: 1 personal fouls)   FT 1/2: MISS   FT 2/2: MISS Shaquille Lillard makes 0/2 from the line. Rebound secured by Gary Simons.

[07:24] Team_068 possession (Score: 82-95)
Cole Anthony attempts a Midrange. Contested by Shaquille Lillard (4.4 feet, MAN). COLE ANTHONY MAKES IT!
Score: 84-95

[07:06] Team_049 possession (Score: 84-95)
Shai Mobley attempts a Midrange. Contested by Malcolm Herro (5.4 feet, ZONE). SHAI MOBLEY MAKES IT! Assist: Shaquille Lillard
Score: 84-97

[06:52] Team_068 possession (Score: 84-97)
Cole Anthony attempts a 3Pt. Contested by Shaquille Lillard (4.4 feet, ZONE). Cole Anthony misses. Rebound secured by De'Aaron Allen.

[06:35] Team_049 possession (Score: 84-97)
Ja Oladipo attempts a Layup. Contested by Gary Simons (4.6 feet, ZONE). Ja Oladipo misses. Rebound secured by Jaren Johnson.

[06:18] Team_068 possession (Score: 84-97)
Malcolm Herro drives, De'Aaron Allen stays with him. Malcolm Herro attempts a Dunk. Contested by De'Aaron Allen (5.1 feet, ZONE). MALCOLM HERRO MAKES IT!
Score: 86-97

[06:01] Team_049 possession (Score: 86-97)
Shaquille Lillard attempts a Layup. BLOCKED BY GARY SIMONS! Ball is loose! Rebound secured by Gary Simons.

[05:50] Team_068 possession (Score: 86-97)
Jaren Johnson attempts a Midrange. Contested by Ja Oladipo (5.7 feet, ZONE). JAREN JOHNSON MAKES IT!
Score: 88-97

[05:37] Team_049 possession (Score: 88-97)
Shaquille Lillard drives and kicks out. Jimmy Griffin attempts a 3Pt. Contested by Jaren Johnson (4.9 feet, MAN). JIMMY GRIFFIN MAKES IT! Assist: De'Aaron Allen
Score: 88-100

[05:20] Team_068 possession (Score: 88-100)
Malcolm Herro attempts a Midrange. Contested by Ja Oladipo (5.3 feet, MAN). Malcolm Herro misses. Rebound secured by De'Aaron Allen.

[05:03] Team_049 possession (Score: 88-100)
Shai Mobley loses the ball! Stripped by Nikola Ginobili! TURNOVER! (live ball)

[04:51] Team_068 possession (Score: 88-100)
Cole Anthony attempts a 3Pt. Contested by Shaquille Lillard (4.5 feet, MAN). Cole Anthony misses. Rebound secured by Shai Mobley.

[04:37] Team_049 possession (Score: 88-100)
De'Aaron Allen drives to the basket... De'Aaron Allen throws a bad pass out of bounds! TURNOVER! (dead ball)

[04:37] Substitution (Team_068): Malcolm Herro OUT → Ja Banchero IN (stamina_rule2)

[04:37] Substitution (Team_068): Jaren Johnson OUT → Miles Murray IN (stamina_rule2)

[04:37] Substitution (Team_068): Gary Simons OUT → Jarrett Oladipo IN (stamina_rule2)

[04:37] Substitution (Team_068): Nikola Ginobili OUT → Franz Curry IN (stamina_rule2)

[04:37] Substitution (Team_049): Ja Oladipo OUT → Shai Jordan IN (stamina_rule2)

[04:37] Substitution (Team_049): Jimmy Griffin OUT → Desmond Towns IN (stamina_rule2)

[04:37] Substitution (Team_049): De'Aaron Allen OUT → Giannis Anunoby IN (stamina_rule2)

[04:37] Substitution (Team_049): Shai Mobley OUT → Miles Jackson IN (stamina_rule2)

[04:19] Team_068 possession (Score: 88-100)
Franz Curry drives, picks up Miles Jackson. Help arrives from Shai Jordan! Franz Curry attempts a Dunk. Contested by Shai Jordan (3.9 feet, ZONE). FRANZ CURRY MAKES IT! Assist: Cole Anthony
Score: 90-100

[04:03] Team_049 possession (Score: 90-100)
FOUL! Reach-in foul on Franz Curry during the drive. [Team fouls: 3] No free throws, side out. (Franz Curry: 1 personal fouls)

[03:48] Team_049 possession (Score: 90-100)
Shai Jordan drives to the basket... Shai Jordan loses the ball! Stripped by Ja Banchero! TURNOVER! (live ball)

[03:34] Team_068 possession (Score: 90-100)
Miles Murray attempts a 3Pt. Contested by Desmond Towns (4.6 feet, MAN). Miles Murray misses. Rebound secured by Miles Jackson.

[03:22] Team_049 possession (Score: 90-100)
Shaquille Lillard makes the Midrange and draws the foul on Miles Murray! And-1! Shaquille Lillard to the line for 1. [Team fouls: 4] (Miles Murray: 1 personal fouls)   FT 1/1: GOOD Shaquille Lillard makes 1/1 from the line.
Score: 90-103

[03:09] Team_068 possession (Score: 90-103)
Miles Murray attempts a Midrange. Wide open! Shai Jordan is 6.3 feet away. [ZONE] Miles Murray misses. Rebound secured by Giannis Anunoby.

[02:54] Team_049 possession (Score: 90-103)
Giannis Anunoby attempts a Midrange. Contested by Jarrett Oladipo (3.8 feet, MAN). Giannis Anunoby misses. Rebound secured by Franz Curry.

[02:38] Team_068 possession (Score: 90-103)
Miles Murray attempts a Midrange. Contested by Desmond Towns (4.6 feet, MAN). MILES MURRAY MAKES IT!
Score: 92-103

[02:23] Team_049 possession (Score: 92-103)
Desmond Towns attempts a 3Pt. Contested by Ja Banchero (5.3 feet, ZONE). Desmond Towns misses. Rebound secured by Franz Curry.

[02:05] Team_068 possession (Score: 92-103)
Jarrett Oladipo attempts a Midrange. Contested by Giannis Anunoby (5.0 feet, MAN). JARRETT OLADIPO MAKES IT!
Score: 94-103

[01:51] Team_049 possession (Score: 94-103)
FOUL! Holding foul on Cole Anthony. [IN THE BONUS! 5 team fouls] Shaquille Lillard to the line for 2 free throws. (Cole Anthony: 1 personal fouls)   FT 1/2: GOOD   FT 2/2: GOOD Shaquille Lillard makes 2/2 from the line.
Score: 94-105

[01:40] Team_068 possession (Score: 94-105)
Ja Banchero drives to the basket... Ja Banchero loses the ball! Stripped by Miles Jackson! TURNOVER! (live ball)

[01:27] Team_049 possession (Score: 94-105)
Shaquille Lillard drives, picks up Franz Curry. Help arrives from Ja Banchero! Shaquille Lillard attempts a Dunk. Contested by Ja Banchero (4.5 feet, ZONE). SHAQUILLE LILLARD MAKES IT!
Score: 94-107

[01:11] Team_068 possession (Score: 94-107)
Cole Anthony attempts a Layup. Contested by Shaquille Lillard (4.8 feet, MAN). COLE ANTHONY MAKES IT! Assist: Miles Murray
Score: 96-107

[00:55] Team_049 possession (Score: 96-107)
Miles Jackson drives, Franz Curry stays with him. Miles Jackson attempts a Dunk. Contested by Franz Curry (4.4 feet, ZONE). MILES JACKSON MAKES IT! Assist: Shaquille Lillard
Score: 96-109

[00:44] Team_068 possession (Score: 96-109)
Ja Banchero attempts a 3Pt. Wide open! Shai Jordan is 6.3 feet away. [MAN] JA BANCHERO MAKES IT!
Score: 99-109

[00:32] Team_049 possession (Score: 99-109)
Shai Jordan attempts a 3Pt. Contested by Ja Banchero (5.2 feet, ZONE). Shai Jordan misses. Rebound secured by Jarrett Oladipo.

[00:17] Team_068 possession (Score: 99-109)
Miles Murray attempts a 3Pt. Wide open! Shai Jordan is 6.3 feet away. [ZONE] Miles Murray misses. Rebound secured by Shai Jordan.

================================================================================
                              4TH QUARTER COMPLETE                              
================================================================================

4TH QUARTER SCORE: Team_068 33, Team_049 29

BOX SCORE:
================================================================================

Team_068
--------------------------------------------------------------------------------
Player                MIN  PTS  REB  AST  TO      FG   FG%      3P   3P%
--------------------------------------------------------------------------------
Malcolm Herro          38    7    0    2   0   3/5    60.0     0/0   0.0
Gary Simons            35    7    3    0   0   3/3   100.0     0/0   0.0
Jaren Johnson          38    4    1    1   0   2/3    66.7     0/0   0.0
Cole Anthony           18    4    0    1   0   2/4    50.0     0/0   0.0
Ja Banchero            10    3    0    0   0   1/1   100.0     0/0   0.0
Nikola Ginobili        35    2    1    1   0   1/1   100.0     0/0   0.0
Franz Curry            13    2    2    0   0   1/1   100.0     0/0   0.0
Miles Murray           10    2    0    1   0   1/4    25.0     0/0   0.0
Jarrett Oladipo        13    2    1    0   0   1/1   100.0     0/0   0.0

TEAM: FG: 15/23 (65.2%), 3PT: 2/8 (25.0%), REB: 8 (0 off, 8 def), AST: 6, TO: 1
TEAM FOULS: 5 [Team_049 in BONUS]


Team_049
--------------------------------------------------------------------------------
Player                MIN  PTS  REB  AST  TO      FG   FG%      3P   3P%
--------------------------------------------------------------------------------
Jimmy Griffin          38   13    0    0   0   5/6    83.3     0/0   0.0
Shaquille Lillard      21    9    0    2   0   4/6    66.7     0/0   0.0
Shai Mobley            38    5    2    0   0   2/2   100.0     0/0   0.0
Miles Jackson          10    2    1    0   0   1/1   100.0     0/0   0.0
De'Aaron Allen         38    0    4    2   0   0/1     0.0     0/0   0.0
Ja Oladipo             38    0    0    0   0   0/1     0.0     0/0   0.0
Giannis Anunoby        10    0    1    0   0   0/1     0.0     0/0   0.0
Desmond Towns          10    0    0    0   0   0/1     0.0     0/0   0.0
Shai Jordan            10    0    1    0   0   0/1     0.0     0/0   0.0

TEAM: FG: 12/20 (60.0%), 3PT: 3/7 (42.9%), REB: 9 (1 off, 8 def), AST: 4, TO: 3
TEAM FOULS: 1

================================================================================

================================================================================
                               FULL GAME COMPLETE                               
================================================================================

FINAL SCORE: Team_068 99, Team_049 109

SCORING BY QUARTER:
--------------------------------------------------------------------------------
Team                     Q1     Q2     Q3     Q4    FINAL
--------------------------------------------------------------------------------
Team_068                 21     25     20     33       99
Team_049                 31     27     22     29      109
--------------------------------------------------------------------------------

FULL GAME BOX SCORE:
================================================================================

Team_068
--------------------------------------------------------------------------------
Player                MIN  PTS  REB  AST  TO      FG   FG%      3P   3P%      FT STL BLK
--------------------------------------------------------------------------------
Malcolm Herro          38   17    0    7   1   7/13   53.8   1/3    33.3   1/1     0   0
Jaren Johnson          38   14   12    2   2   5/13   38.5   1/5    20.0   1/2     1   0
Gary Simons            35   21   13    0   0   9/13   69.2   1/2    50.0   4/4     0   1
Nikola Ginobili        35   16    8    1   4   7/10   70.0   0/0     0.0   0/0     1   0
Zion Anunoby           30    3    0    3   3   1/4    25.0   1/2    50.0   0/0     0   0
Cole Anthony           18    7    0    2   1   3/5    60.0   0/2     0.0   0/0     0   0
Jarrett Oladipo        13    5    3    0   1   3/6    50.0   0/1     0.0   1/1     0   0
Franz Curry            13    9    8    0   1   4/6    66.7   0/0     0.0   3/3     0   0
Ja Banchero            10    3    1    0   0   1/1   100.0   1/1   100.0   0/0     1   0
Miles Murray           10    2    0    1   0   1/4    25.0   0/2     0.0   0/0     0   0

TEAM: FG: 42/76 (55.3%), 3PT: 5/18 (27.8%), REB: 46 (9 off, 37 def), AST: 16, TO: 13


Team_049
--------------------------------------------------------------------------------
Player                MIN  PTS  REB  AST  TO      FG   FG%      3P   3P%      FT STL BLK
--------------------------------------------------------------------------------
Ja Oladipo             38   13    0    1   2   4/11   36.4   2/3    66.7   4/6     1   1
Jimmy Griffin          38   37    8    3   1  15/21   71.4   7/11   63.6   6/7     1   0
De'Aaron Allen         38   10   18    4   1   4/11   36.4   0/4     0.0   5/6     0   0
Shai Mobley            38   14    8    3   1   4/6    66.7   1/1   100.0   3/3     2   0
Shai Bird              28    9    0    3   0   3/6    50.0   1/3    33.3   2/2     3   1
Shaquille Lillard      21   12    0    3   0   5/8    62.5   1/1   100.0   3/5     0   0
Shai Jordan            10    7    4    0   0   2/4    50.0   0/2     0.0   3/3     0   0
Desmond Towns          10    0    0    0   1   0/4     0.0   0/4     0.0   0/0     0   0
Giannis Anunoby        10    0    2    0   0   0/1     0.0   0/0     0.0   0/0     0   0
Miles Jackson          10    4    1    0   1   2/4    50.0   0/1     0.0   0/0     1   0

TEAM: FG: 44/81 (54.3%), 3PT: 12/30 (40.0%), REB: 40 (7 off, 33 def), AST: 17, TO: 7

================================================================================
