================================================================================
                        FULL GAME - Team_049 vs Team_046                        
================================================================================

================================================================================
                       1ST QUARTER - Team_049 vs Team_046                       
================================================================================

[12:00] Team_049 possession (Score: 0-0)
De'Aaron Allen attempts a 3Pt. Contested by Cade Wall (3.6 feet, MAN). DE'AARON ALLEN MAKES IT! Assist: Ja Oladipo
Score: 3-0

[11:45] Team_046 possession (Score: 3-0)
Lauri Carter loses the ball! Stripped by Jimmy Griffin! TURNOVER! (live ball)

[11:30] Team_049 possession (Score: 3-0)
Shai Bird attempts a 3Pt. Contested by D'Angelo O'Neal (4.5 feet, MAN). Shai Bird misses. Rebound secured by Lauri Carter.

[11:13] Team_046 possession (Score: 3-0)
Victor Nowitzki attempts a 3Pt. Contested by Ja Oladipo (4.4 feet, ZONE). Victor Nowitzki misses. Rebound secured by De'Aaron Allen.

[10:58] Team_049 possession (Score: 3-0)
Shai Bird drives, D'Angelo O'Neal stays with him. Shai Bird attempts a Dunk. Contested by D'Angelo O'Neal (4.5 feet, MAN). Shai Bird misses. Rebound secured by Lauri Carter.

[10:47] Team_046 possession (Score: 3-0)
FOUL! Holding foul on Jimmy Griffin. [Team fouls: 1] No free throws, side out. (Jimmy Griffin: 1 personal fouls)

[10:32] Team_046 possession (Score: 3-0)
FOUL! Shooting foul on De'Aaron Allen. Kevin Allen to the line for 2 free throws. [Team fouls: 2] (De'Aaron Allen: 1 personal fouls)   FT 1/2: GOOD   FT 2/2: GOOD Kevin Allen makes 2/2 from the line.
Score: 3-2

[10:16] Team_049 possession (Score: 3-2)
FOUL! Holding foul on Kevin Allen. [Team fouls: 1] No free throws, side out. (Kevin Allen: 1 personal fouls)

[10:05] Team_049 possession (Score: 3-2)
De'Aaron Allen drives to the basket... De'Aaron Allen loses control! Ball rolls out of bounds! TURNOVER! (dead ball)

[09:53] Team_046 possession (Score: 3-2)
Lauri Carter drives to the basket... Lauri Carter loses the ball! Stripped by Jimmy Griffin! TURNOVER! (live ball)

[09:39] Team_049 possession (Score: 3-2)
Shai Bird drives and kicks out. Shai Mobley attempts a Midrange. Contested by Victor Nowitzki (5.5 feet, ZONE). Shai Mobley misses. Rebound secured by Kevin Allen.

[09:26] Team_046 possession (Score: 3-2)
Victor Nowitzki attempts a 3Pt. Contested by Ja Oladipo (4.4 feet, MAN). Victor Nowitzki misses. Rebound secured by Jimmy Griffin.

[09:11] Team_049 possession (Score: 3-2)
Ja Oladipo makes the Dunk and draws the foul on Kevin Allen! And-1! Ja Oladipo to the line for 1. [Team fouls: 2] (Kevin Allen: 2 personal fouls)   FT 1/1: MISS Ja Oladipo makes 0/1 from the line. Rebound secured by Cade Wall.
Score: 5-2

[08:54] Team_046 possession (Score: 5-2)
Victor Nowitzki drives and kicks out. Victor Nowitzki attempts a 3Pt. Contested by Ja Oladipo (4.2 feet, ZONE). Victor Nowitzki misses. Rebound secured by Jimmy Griffin.

[08:40] Team_049 possession (Score: 5-2)
De'Aaron Allen attempts a Layup. Contested by Cade Wall (3.6 feet, MAN). DE'AARON ALLEN MAKES IT!
Score: 7-2

[08:28] Team_046 possession (Score: 7-2)
D'Angelo O'Neal makes the Dunk and draws the foul on De'Aaron Allen! And-1! D'Angelo O'Neal to the line for 1. [Team fouls: 3] (De'Aaron Allen: 2 personal fouls)   FT 1/1: GOOD D'Angelo O'Neal makes 1/1 from the line.
Score: 7-5

[08:08] Team_049 possession (Score: 7-5)
De'Aaron Allen attempts a Midrange. Contested by Cade Wall (3.6 feet, ZONE). De'Aaron Allen misses. Rebound secured by Cade Wall.

[07:58] Team_046 possession (Score: 7-5)
FOUL! Reach-in foul on Ja Oladipo during the drive. [Team fouls: 4] No free throws, side out. (Ja Oladipo: 1 personal fouls)

[07:45] Team_046 possession (Score: 7-5)
Kevin Allen makes the Layup and draws the foul on Shai Mobley! And-1! Kevin Allen to the line for 1. [BONUS: 5 team fouls] (Shai Mobley: 1 personal fouls)   FT 1/1: GOOD Kevin Allen makes 1/1 from the line.
Score: 7-8

[07:27] Team_049 possession (Score: 7-8)
Shai Mobley drives and kicks out. De'Aaron Allen attempts a 3Pt. Contested by Cade Wall (3.7 feet, MAN). De'Aaron Allen misses. Offensive rebound by Jimmy Griffin! Jimmy Griffin kicks it out.

[07:12] Team_049 possession (Score: 7-8)
Shai Bird drives to the basket... Shai Bird commits a violation (traveling/carry)! TURNOVER! (dead ball)

[06:55] Team_046 possession (Score: 7-8)
Lauri Carter attempts a 3Pt. Contested by Jimmy Griffin (4.9 feet, MAN). Lauri Carter misses. Rebound secured by Jimmy Griffin.

[06:44] Team_049 possession (Score: 7-8)
Shai Mobley drives and kicks out. Shai Bird attempts a 3Pt. Contested by Lauri Carter (3.2 feet, ZONE). Shai Bird misses. Rebound secured by Cade Wall.

[06:27] Team_046 possession (Score: 7-8)
Kevin Allen attempts a Midrange. Contested by Jimmy Griffin (5.0 feet, ZONE). KEVIN ALLEN MAKES IT!
Score: 7-10

[06:16] Team_049 possession (Score: 7-10)
Shai Mobley attempts a 3Pt. Contested by Kevin Allen (4.9 feet, MAN). Shai Mobley misses. Rebound secured by Lauri Carter.

[06:05] Team_046 possession (Score: 7-10)
Kevin Allen attempts a Midrange. Contested by Shai Mobley (4.5 feet, ZONE). KEVIN ALLEN MAKES IT! Assist: D'Angelo O'Neal
Score: 7-12

[05:50] Team_049 possession (Score: 7-12)
Ja Oladipo attempts a Midrange. Contested by Lauri Carter (3.5 feet, ZONE). Ja Oladipo misses. Rebound secured by Kevin Allen.

[05:38] Team_046 possession (Score: 7-12)
Lauri Carter drives and kicks out. Lauri Carter attempts a Midrange. Contested by Jimmy Griffin (4.7 feet, MAN). Lauri Carter misses. Rebound secured by Shai Mobley.

[05:23] Team_049 possession (Score: 7-12)
De'Aaron Allen throws a bad pass! Stolen by Cade Wall! TURNOVER! (live ball)

[05:09] Team_046 possession (Score: 7-12)
D'Angelo O'Neal attempts a 3Pt. Contested by Shai Bird (4.2 feet, MAN). D'Angelo O'Neal misses. Rebound secured by Jimmy Griffin.

[04:55] Team_049 possession (Score: 7-12)
Ja Oladipo attempts a Midrange. Contested by Lauri Carter (3.5 feet, ZONE). JA OLADIPO MAKES IT! Assist: Shai Mobley
Score: 9-12

[04:41] Team_046 possession (Score: 9-12)
FOUL! Reach-in foul on Jimmy Griffin during the drive. [IN THE BONUS! 6 team fouls] Lauri Carter to the line for 2 free throws. (Jimmy Griffin: 2 personal fouls)   FT 1/2: GOOD   FT 2/2: GOOD Lauri Carter makes 2/2 from the line.
Score: 9-14

[04:30] Team_049 possession (Score: 9-14)
Ja Oladipo throws a bad pass out of bounds! TURNOVER! (dead ball)

[04:19] Team_046 possession (Score: 9-14)
Lauri Carter throws a bad pass! Stolen by Jimmy Griffin! TURNOVER! (live ball)

[04:08] Team_049 possession (Score: 9-14)
FOUL! Shooting foul on D'Angelo O'Neal. Shai Mobley to the line for 2 free throws. [Team fouls: 3] (D'Angelo O'Neal: 1 personal fouls)   FT 1/2: MISS   FT 2/2: MISS Shai Mobley makes 0/2 from the line. Offensive rebound by Shai Mobley! Shai Mobley puts it back in!
Score: 11-14

[03:52] Team_046 possession (Score: 11-14)
Victor Nowitzki attempts a Midrange. Contested by De'Aaron Allen (4.5 feet, ZONE). Victor Nowitzki misses. Rebound secured by De'Aaron Allen.

[03:41] Team_049 possession (Score: 11-14)
Jimmy Griffin attempts a Midrange. Contested by Lauri Carter (3.5 feet, MAN). Jimmy Griffin misses. Rebound secured by Kevin Allen.

[03:28] Team_046 possession (Score: 11-14)
Victor Nowitzki attempts a 3Pt. Contested by Ja Oladipo (4.5 feet, MAN). Victor Nowitzki misses. Rebound secured by Jimmy Griffin.

[03:15] Team_049 possession (Score: 11-14)
Shai Bird drives, D'Angelo O'Neal stays with him. Shai Bird attempts a Layup. Contested by D'Angelo O'Neal (4.7 feet, MAN). SHAI BIRD MAKES IT! Assist: De'Aaron Allen
Score: 13-14

[02:59] Team_046 possession (Score: 13-14)
Kevin Allen attempts a Layup. Contested by Shai Mobley (4.7 feet, MAN). KEVIN ALLEN MAKES IT! Assist: Lauri Carter
Score: 13-16

[02:45] Team_049 possession (Score: 13-16)
Shai Bird attempts a Midrange. Contested by D'Angelo O'Neal (4.8 feet, MAN). Shai Bird misses. Rebound secured by Kevin Allen.

[02:32] Team_046 possession (Score: 13-16)
FOUL! Shooting foul on Ja Oladipo. Cade Wall to the line for 3 free throws. [BONUS: 7 team fouls] (Ja Oladipo: 2 personal fouls)   FT 1/3: GOOD   FT 2/3: MISS   FT 3/3: MISS Cade Wall makes 1/3 from the line. Offensive rebound by Lauri Carter! Lauri Carter kicks it out.
Score: 13-17

[02:18] Team_046 possession (Score: 13-17)
Victor Nowitzki throws a bad pass! Stolen by Ja Oladipo! TURNOVER! (live ball)

[02:05] Team_049 possession (Score: 13-17)
Jimmy Griffin attempts a 3Pt. Contested by Lauri Carter (3.6 feet, ZONE). JIMMY GRIFFIN MAKES IT! Assist: Ja Oladipo
Score: 16-17

[01:49] Team_046 possession (Score: 16-17)
Victor Nowitzki drives and kicks out. Lauri Carter attempts a 3Pt. Contested by Ja Oladipo (4.6 feet, ZONE). Lauri Carter misses. Rebound secured by Jimmy Griffin.

[01:32] Team_049 possession (Score: 16-17)
Shai Mobley drives, picks up Kevin Allen. Help arrives from D'Angelo O'Neal! Shai Mobley attempts a Dunk. Contested by D'Angelo O'Neal (5.4 feet, ZONE). SHAI MOBLEY MAKES IT! Assist: Jimmy Griffin
Score: 18-17

[01:19] Team_046 possession (Score: 18-17)
Kevin Allen makes the Layup and draws the foul on De'Aaron Allen! And-1! Kevin Allen to the line for 1. [BONUS: 8 team fouls] (De'Aaron Allen: 3 personal fouls)   FT 1/1: GOOD Kevin Allen makes 1/1 from the line.
Score: 18-20

[01:08] Team_049 possession (Score: 18-20)
De'Aaron Allen throws a bad pass out of bounds! TURNOVER! (dead ball)

[01:08] Substitution (Team_049): Shai Bird OUT → Shaquille Lillard IN (stamina_rule2)

[01:08] Substitution (Team_049): Ja Oladipo OUT → Shai Jordan IN (stamina_rule2)

[01:08] Substitution (Team_049): Jimmy Griffin OUT → Desmond Towns IN (stamina_rule2)

[01:08] Substitution (Team_049): De'Aaron Allen OUT → Giannis Anunoby IN (stamina_rule2)

[01:08] Substitution (Team_049): Shai Mobley OUT → Miles Jackson IN (stamina_rule2)

[01:08] Substitution (Team_046): D'Angelo O'Neal OUT → Collin Butler IN (stamina_rule2)

[01:08] Substitution (Team_046): Victor Nowitzki OUT → Manu Dosunmu IN (stamina_rule2)

[01:08] Substitution (Team_046): Lauri Carter OUT → Josh Barrett IN (stamina_rule2)

[01:08] Substitution (Team_046): Cade Wall OUT → Chris LaVine IN (stamina_rule2)

[01:08] Substitution (Team_046): Kevin Allen OUT → Paul DeRozan IN (stamina_rule2)

[00:55] Team_046 possession (Score: 18-20)
Paul DeRozan attempts a Midrange. Wide open! Shai Jordan is 6.1 feet away. [ZONE] Paul DeRozan misses. Offensive rebound by Paul DeRozan! Paul DeRozan's putback is no good. Offensive rebound by Paul DeRozan! Paul DeRozan kicks it out.

[00:42] Team_046 possession (Score: 18-20)
Paul DeRozan drives, picks up Miles Jackson. Help arrives from Shai Jordan! Paul DeRozan attempts a Dunk. Contested by Shai Jordan (3.4 feet, MAN). Paul DeRozan misses. Offensive rebound by Chris LaVine! Chris LaVine kicks it out.

[00:28] Team_046 possession (Score: 18-20)
Paul DeRozan drives and kicks out. Manu Dosunmu attempts a 3Pt. Wide open! Shai Jordan is 6.1 feet away. [MAN] Manu Dosunmu misses. Rebound secured by Giannis Anunoby.

[00:13] Team_049 possession (Score: 18-20)
Miles Jackson attempts a 3Pt. Contested by Chris LaVine (3.9 feet, MAN). Miles Jackson misses. Rebound secured by Paul DeRozan.

================================================================================
                              1ST QUARTER COMPLETE                              
================================================================================

1ST QUARTER SCORE: Team_049 18, Team_046 20

BOX SCORE:
================================================================================

Team_049
--------------------------------------------------------------------------------
Player                MIN  PTS  REB  AST  TO      FG   FG%      3P   3P%
--------------------------------------------------------------------------------
De'Aaron Allen         11    5    2    1   0   2/3    66.7     0/0   0.0
Shai Mobley            11    4    1    1   0   2/4    50.0     0/0   0.0
Jimmy Griffin          11    3    7    1   0   1/2    50.0     0/0   0.0
Ja Oladipo             11    2    0    2   0   1/3    33.3     0/0   0.0
Shai Bird              11    2    0    0   0   1/5    20.0     0/0   0.0
Giannis Anunoby         1    0    1    0   0   0/0     0.0     0/0   0.0
Miles Jackson           1    0    0    0   0   0/1     0.0     0/0   0.0

TEAM: FG: 7/18 (38.9%), 3PT: 2/5 (40.0%), REB: 11 (1 off, 10 def), AST: 5, TO: 5
TEAM FOULS: 8 [Team_046 in BONUS]


Team_046
--------------------------------------------------------------------------------
Player                MIN  PTS  REB  AST  TO      FG   FG%      3P   3P%
--------------------------------------------------------------------------------
Kevin Allen            11   14    4    0   0   6/6   100.0     0/0   0.0
D'Angelo O'Neal        11    3    0    1   0   1/2    50.0     0/0   0.0
Lauri Carter           11    2    4    1   0   1/3    33.3     0/0   0.0
Victor Nowitzki        11    0    0    0   0   0/6     0.0     0/0   0.0
Cade Wall              11    0    3    0   0   0/0     0.0     0/0   0.0
Paul DeRozan            1    0    2    0   0   0/1     0.0     0/0   0.0
Chris LaVine            1    0    1    0   0   0/0     0.0     0/0   0.0

TEAM: FG: 8/18 (44.4%), 3PT: 0/5 (0.0%), REB: 14 (3 off, 11 def), AST: 2, TO: 4
TEAM FOULS: 3

================================================================================

================================================================================
                       2ND QUARTER - Team_049 vs Team_046                       
================================================================================

[12:00] Team_049 possession (Score: 18-20)
Shai Mobley makes the Layup and draws the foul on Kevin Allen! And-1! Shai Mobley to the line for 1. [Team fouls: 1] (Kevin Allen: 1 personal fouls)   FT 1/1: GOOD Shai Mobley makes 1/1 from the line.
Score: 21-20

[11:43] Team_046 possession (Score: 21-20)
Lauri Carter attempts a 3Pt. Contested by Ja Oladipo (4.6 feet, ZONE). Lauri Carter misses. Rebound secured by Shai Mobley.

[11:27] Team_049 possession (Score: 21-20)
Shai Mobley makes the Dunk and draws the foul on Kevin Allen! And-1! Shai Mobley to the line for 1. [Team fouls: 2] (Kevin Allen: 2 personal fouls)   FT 1/1: GOOD Shai Mobley makes 1/1 from the line.
Score: 24-20

[11:13] Team_046 possession (Score: 24-20)
D'Angelo O'Neal attempts a 3Pt. Contested by Ja Oladipo (4.7 feet, ZONE). D'ANGELO O'NEAL MAKES IT! Assist: Victor Nowitzki
Score: 24-23

[11:02] Team_049 possession (Score: 24-23)
Shai Mobley makes the Layup and draws the foul on Kevin Allen! And-1! Shai Mobley to the line for 1. [Team fouls: 3] (Kevin Allen: 3 personal fouls)   FT 1/1: GOOD Shai Mobley makes 1/1 from the line.
Score: 27-23

[10:51] Team_046 possession (Score: 27-23)
Cade Wall attempts a Layup. Contested by De'Aaron Allen (5.1 feet, MAN). CADE WALL MAKES IT! Assist: D'Angelo O'Neal
Score: 27-25

[10:38] Team_049 possession (Score: 27-25)
Ja Oladipo drives, Kevin Allen stays with him. Ja Oladipo attempts a Dunk. Contested by Kevin Allen (5.3 feet, ZONE). JA OLADIPO MAKES IT!
Score: 29-25

[10:23] Team_046 possession (Score: 29-25)
D'Angelo O'Neal makes the Layup and draws the foul on Shai Bird! And-1! D'Angelo O'Neal to the line for 1. [Team fouls: 1] (Shai Bird: 1 personal fouls)   FT 1/1: GOOD D'Angelo O'Neal makes 1/1 from the line.
Score: 29-28

[10:09] Team_049 possession (Score: 29-28)
Shai Mobley drives and kicks out. Ja Oladipo attempts a 3Pt. Contested by Lauri Carter (3.7 feet, ZONE). JA OLADIPO MAKES IT! Assist: Shai Bird
Score: 32-28

[09:56] Team_046 possession (Score: 32-28)
Victor Nowitzki attempts a 3Pt. Contested by Ja Oladipo (4.7 feet, ZONE). VICTOR NOWITZKI MAKES IT! Assist: Cade Wall
Score: 32-31

[09:40] Team_049 possession (Score: 32-31)
Ja Oladipo attempts a Midrange. Wide open! Victor Nowitzki is 6.1 feet away. [ZONE] JA OLADIPO MAKES IT!
Score: 34-31

[09:28] Team_046 possession (Score: 34-31)
FOUL! Offensive foul on Cade Wall! De'Aaron Allen drew the charge! [Team fouls: 4] (Cade Wall: 1 personal fouls) TURNOVER! (dead ball)

[09:16] Team_049 possession (Score: 34-31)
Ja Oladipo drives, Kevin Allen stays with him. Ja Oladipo attempts a Dunk. Contested by Kevin Allen (5.4 feet, ZONE). Ja Oladipo misses. Rebound secured by Cade Wall.

[09:02] Team_046 possession (Score: 34-31)
Kevin Allen drives to the basket... Kevin Allen throws a bad pass! Stolen by Shai Mobley! TURNOVER! (live ball)

[08:49] Team_049 possession (Score: 34-31)
De'Aaron Allen drives to the basket... De'Aaron Allen throws a bad pass! Stolen by Kevin Allen! TURNOVER! (live ball)

[08:33] Team_046 possession (Score: 34-31)
Lauri Carter drives, picks up Jimmy Griffin. Help arrives from Ja Oladipo! Lauri Carter attempts a Dunk. Contested by Ja Oladipo (5.4 feet, MAN). Lauri Carter misses. Offensive rebound by Lauri Carter! Lauri Carter kicks it out.

[08:17] Team_046 possession (Score: 34-31)
Lauri Carter attempts a 3Pt. Contested by Ja Oladipo (5.0 feet, ZONE). LAURI CARTER MAKES IT! Assist: Victor Nowitzki
Score: 34-34

[08:01] Team_049 possession (Score: 34-34)
Shai Mobley drives, picks up Kevin Allen. Help arrives from D'Angelo O'Neal! Shai Mobley attempts a Layup. Contested by D'Angelo O'Neal (5.7 feet, ZONE). Shai Mobley misses. Rebound secured by Cade Wall.

[07:48] Team_046 possession (Score: 34-34)
FOUL! Shooting foul on De'Aaron Allen. Cade Wall to the line for 2 free throws. [Team fouls: 2] (De'Aaron Allen: 1 personal fouls)   FT 1/2: GOOD   FT 2/2: GOOD Cade Wall makes 2/2 from the line.
Score: 34-36

[07:37] Team_049 possession (Score: 34-36)
Shai Bird drives, D'Angelo O'Neal stays with him. Shai Bird attempts a Layup. Contested by D'Angelo O'Neal (5.2 feet, MAN). SHAI BIRD MAKES IT!
Score: 36-36

[07:23] Team_046 possession (Score: 36-36)
Cade Wall attempts a 3Pt. Contested by De'Aaron Allen (5.4 feet, MAN). Cade Wall misses. Rebound secured by Shai Mobley.

[07:09] Team_049 possession (Score: 36-36)
Shai Bird attempts a 3Pt. Contested by Lauri Carter (4.4 feet, ZONE). Shai Bird misses. Rebound secured by Kevin Allen.

[06:59] Team_046 possession (Score: 36-36)
FOUL! Holding foul on Shai Bird. [Team fouls: 3] No free throws, side out. (Shai Bird: 2 personal fouls)

[06:41] Team_046 possession (Score: 36-36)
Kevin Allen makes the 3Pt and draws the foul on Ja Oladipo! And-1! Kevin Allen to the line for 1. [Team fouls: 4] (Ja Oladipo: 1 personal fouls)   FT 1/1: GOOD Kevin Allen makes 1/1 from the line.
Score: 36-40

[06:29] Team_049 possession (Score: 36-40)
Shai Mobley drives, picks up Kevin Allen. Help arrives from D'Angelo O'Neal! Shai Mobley attempts a Dunk. Contested by D'Angelo O'Neal (5.9 feet, MAN). Shai Mobley misses. Rebound secured by Cade Wall.

[06:14] Team_046 possession (Score: 36-40)
Lauri Carter attempts a Layup. Contested by Jimmy Griffin (5.7 feet, MAN). LAURI CARTER MAKES IT!
Score: 36-42

[06:02] Team_049 possession (Score: 36-42)
Shai Mobley attempts a Layup. Contested by Kevin Allen (6.0 feet, MAN). Shai Mobley misses. Offensive rebound by De'Aaron Allen! De'Aaron Allen kicks it out.

[05:50] Team_049 possession (Score: 36-42)
Shai Bird attempts a 3Pt. Contested by D'Angelo O'Neal (5.5 feet, MAN). Shai Bird misses. Offensive rebound by Shai Mobley! Shai Mobley puts it back in!
Score: 38-42

[05:36] Team_046 possession (Score: 38-42)
D'Angelo O'Neal attempts a Midrange. Contested by Shai Bird (5.2 feet, MAN). D'Angelo O'Neal misses. Offensive rebound by Cade Wall! Cade Wall kicks it out.

[05:19] Team_046 possession (Score: 38-42)
Lauri Carter drives and kicks out. Cade Wall attempts a Midrange. Contested by De'Aaron Allen (5.3 feet, MAN). CADE WALL MAKES IT!
Score: 38-44

[05:08] Team_049 possession (Score: 38-44)
FOUL! Reach-in foul on Cade Wall during the drive. [IN THE BONUS! 5 team fouls] Shai Mobley to the line for 2 free throws. (Cade Wall: 2 personal fouls)   FT 1/2: GOOD   FT 2/2: GOOD Shai Mobley makes 2/2 from the line.
Score: 40-44

[04:51] Team_046 possession (Score: 40-44)
D'Angelo O'Neal attempts a Layup. BLOCKED BY JA OLADIPO! Ball deflects out of bounds off D'Angelo O'Neal.

[04:37] Team_049 possession (Score: 40-44)
Jimmy Griffin attempts a 3Pt. Contested by Lauri Carter (4.5 feet, ZONE). Jimmy Griffin misses. Rebound secured by Lauri Carter.

[04:23] Team_046 possession (Score: 40-44)
D'Angelo O'Neal attempts a Layup. Contested by Shai Bird (5.4 feet, MAN). D'Angelo O'Neal misses. Rebound secured by Jimmy Griffin.

[04:07] Team_049 possession (Score: 40-44)
De'Aaron Allen attempts a Layup. Contested by Kevin Allen (5.9 feet, ZONE). DE'AARON ALLEN MAKES IT! Assist: Ja Oladipo
Score: 42-44

[03:51] Team_046 possession (Score: 42-44)
Lauri Carter attempts a 3Pt. Contested by Ja Oladipo (5.6 feet, ZONE). Lauri Carter misses. Offensive rebound by Cade Wall! Cade Wall kicks it out.

[03:34] Team_046 possession (Score: 42-44)
D'Angelo O'Neal attempts a Midrange. Contested by Shai Bird (5.5 feet, MAN). D'ANGELO O'NEAL MAKES IT! Assist: Lauri Carter
Score: 42-46

[03:18] Team_049 possession (Score: 42-46)
Shai Mobley attempts a Layup. Contested by Cade Wall (5.5 feet, ZONE). SHAI MOBLEY MAKES IT!
Score: 44-46

[03:00] Team_046 possession (Score: 44-46)
D'Angelo O'Neal attempts a 3Pt. Contested by Shai Bird (5.6 feet, MAN). D'ANGELO O'NEAL MAKES IT! Assist: Kevin Allen
Score: 44-49

[02:45] Team_049 possession (Score: 44-49)
FOUL! Shooting foul on D'Angelo O'Neal. Shai Bird to the line for 2 free throws. [BONUS: 6 team fouls] (D'Angelo O'Neal: 1 personal fouls)   FT 1/2: GOOD   FT 2/2: GOOD Shai Bird makes 2/2 from the line.
Score: 46-49

[02:32] Team_046 possession (Score: 46-49)
D'Angelo O'Neal attempts a Layup. Contested by De'Aaron Allen (5.7 feet, ZONE). D'ANGELO O'NEAL MAKES IT! Assist: Kevin Allen
Score: 46-51

[02:17] Team_049 possession (Score: 46-51)
FOUL! Reach-in foul on D'Angelo O'Neal during the drive. [IN THE BONUS! 7 team fouls] Shai Bird to the line for 2 free throws. (D'Angelo O'Neal: 2 personal fouls)   FT 1/2: GOOD   FT 2/2: GOOD Shai Bird makes 2/2 from the line.
Score: 48-51

[01:58] Team_046 possession (Score: 48-51)
Kevin Allen drives to the basket... Kevin Allen throws a bad pass out of bounds! TURNOVER! (dead ball)

[01:58] Substitution (Team_049): Shai Bird OUT → Shaquille Lillard IN (stamina_rule2)

[01:58] Substitution (Team_049): Ja Oladipo OUT → Shai Jordan IN (stamina_rule2)

[01:58] Substitution (Team_049): Jimmy Griffin OUT → Desmond Towns IN (stamina_rule2)

[01:58] Substitution (Team_049): De'Aaron Allen OUT → Giannis Anunoby IN (stamina_rule2)

[01:58] Substitution (Team_049): Shai Mobley OUT → Miles Jackson IN (stamina_rule2)

[01:58] Substitution (Team_046): D'Angelo O'Neal OUT → Collin Butler IN (stamina_rule2)

[01:58] Substitution (Team_046): Victor Nowitzki OUT → Manu Dosunmu IN (stamina_rule2)

[01:58] Substitution (Team_046): Lauri Carter OUT → Josh Barrett IN (stamina_rule2)

[01:58] Substitution (Team_046): Cade Wall OUT → Chris LaVine IN (stamina_rule2)

[01:58] Substitution (Team_046): Kevin Allen OUT → Paul DeRozan IN (stamina_rule2)

[01:40] Team_049 possession (Score: 48-51)
FOUL! Offensive foul on Desmond Towns! Josh Barrett drew the charge! [Team fouls: 5] (Desmond Towns: 1 personal fouls) TURNOVER! (dead ball)

[01:25] Team_046 possession (Score: 48-51)
Josh Barrett drives to the basket... Josh Barrett loses control! Ball rolls out of bounds! TURNOVER! (dead ball)

[01:12] Team_049 possession (Score: 48-51)
Desmond Towns attempts a 3Pt. Contested by Manu Dosunmu (4.9 feet, ZONE). DESMOND TOWNS MAKES IT! Assist: Giannis Anunoby
Score: 51-51

[00:57] Team_046 possession (Score: 51-51)
Josh Barrett attempts a Midrange. Contested by Desmond Towns (4.6 feet, MAN). Josh Barrett misses. Offensive rebound by Paul DeRozan! Paul DeRozan's putback is no good. Rebound secured by Miles Jackson.

[00:42] Team_049 possession (Score: 51-51)
Shaquille Lillard attempts a 3Pt. Contested by Collin Butler (4.1 feet, ZONE). Shaquille Lillard misses. Offensive rebound by Giannis Anunoby! Giannis Anunoby kicks it out.

[00:27] Team_049 possession (Score: 51-51)
Miles Jackson drives to the basket... Miles Jackson loses control! Ball rolls out of bounds! TURNOVER! (dead ball)

[00:11] Team_046 possession (Score: 51-51)
Chris LaVine attempts a Layup. Contested by Giannis Anunoby (5.1 feet, MAN). CHRIS LAVINE MAKES IT! Assist: Collin Butler
Score: 51-53

[00:01] Team_049 possession (Score: 51-53)
Miles Jackson attempts a 3Pt. Contested by Collin Butler (3.9 feet, ZONE). Miles Jackson misses. Rebound secured by Chris LaVine.

================================================================================
                              2ND QUARTER COMPLETE                              
================================================================================

2ND QUARTER SCORE: Team_049 33, Team_046 33

BOX SCORE:
================================================================================

Team_049
--------------------------------------------------------------------------------
Player                MIN  PTS  REB  AST  TO      FG   FG%      3P   3P%
--------------------------------------------------------------------------------
Shai Mobley            21   15    3    0   0   6/8    75.0     0/0   0.0
Ja Oladipo             21    7    0    1   0   3/4    75.0     0/0   0.0
Shai Bird              21    6    0    1   0   3/4    75.0     0/0   0.0
Desmond Towns           3    3    0    0   0   1/1   100.0     0/0   0.0
De'Aaron Allen         21    2    1    0   0   1/1   100.0     0/0   0.0
Jimmy Griffin          21    0    1    0   0   0/1     0.0     0/0   0.0
Giannis Anunoby         3    0    1    1   0   0/0     0.0     0/0   0.0
Miles Jackson           3    0    1    0   0   0/1     0.0     0/0   0.0

TEAM: FG: 14/20 (70.0%), 3PT: 2/5 (40.0%), REB: 6 (3 off, 3 def), AST: 3, TO: 3
TEAM FOULS: 5 [Team_046 in BONUS]


Team_046
--------------------------------------------------------------------------------
Player                MIN  PTS  REB  AST  TO      FG   FG%      3P   3P%
--------------------------------------------------------------------------------
D'Angelo O'Neal        21   13    0    1   0   5/7    71.4     0/0   0.0
Cade Wall              21    6    5    1   0   3/4    75.0     0/0   0.0
Lauri Carter           21    5    2    1   0   2/3    66.7     0/0   0.0
Kevin Allen            21    4    1    2   0   1/1   100.0     0/0   0.0
Victor Nowitzki        21    3    0    2   0   1/1   100.0     0/0   0.0
Chris LaVine            3    2    1    0   0   1/1   100.0     0/0   0.0
Josh Barrett            3    0    0    0   0   0/1     0.0     0/0   0.0
Collin Butler           3    0    0    1   0   0/0     0.0     0/0   0.0

TEAM: FG: 13/18 (72.2%), 3PT: 5/7 (71.4%), REB: 10 (4 off, 6 def), AST: 8, TO: 4
TEAM FOULS: 7 [Team_049 in BONUS]

================================================================================

================================================================================
                       3RD QUARTER - Team_049 vs Team_046                       
================================================================================

[12:00] Team_049 possession (Score: 51-53)
Shai Bird attempts a 3Pt. Contested by Cade Wall (4.2 feet, ZONE). Shai Bird misses. Rebound secured by Cade Wall.

[11:47] Team_046 possession (Score: 51-53)
Victor Nowitzki attempts a Layup. Contested by De'Aaron Allen (4.4 feet, ZONE). Victor Nowitzki misses. Rebound secured by De'Aaron Allen.

[11:33] Team_049 possession (Score: 51-53)
Shai Bird attempts a 3Pt. Contested by Lauri Carter (3.7 feet, ZONE). Shai Bird misses. FOUL! Loose ball foul on Lauri Carter during the rebound battle. [Team fouls: 1] No free throws, side out. (Lauri Carter: 1 personal fouls)

[11:18] Team_049 possession (Score: 51-53)
Shai Bird drives and kicks out. De'Aaron Allen attempts a Midrange. Contested by Cade Wall (3.7 feet, ZONE). De'Aaron Allen misses. Rebound secured by Kevin Allen.

[11:02] Team_046 possession (Score: 51-53)
D'Angelo O'Neal attempts a Layup. Contested by Shai Bird (4.1 feet, MAN). D'ANGELO O'NEAL MAKES IT! Assist: Kevin Allen
Score: 51-55

[10:43] Team_049 possession (Score: 51-55)
De'Aaron Allen drives, Cade Wall stays with him. De'Aaron Allen attempts a Layup. Contested by Cade Wall (3.6 feet, MAN). DE'AARON ALLEN MAKES IT! Assist: Jimmy Griffin
Score: 53-55

[10:28] Team_046 possession (Score: 53-55)
Cade Wall attempts a 3Pt. Contested by De'Aaron Allen (4.9 feet, MAN). CADE WALL MAKES IT! Assist: D'Angelo O'Neal
Score: 53-58

[10:13] Team_049 possession (Score: 53-58)
Shai Bird attempts a 3Pt. Contested by D'Angelo O'Neal (4.5 feet, MAN). Shai Bird misses. Rebound secured by Lauri Carter.

[09:59] Team_046 possession (Score: 53-58)
Lauri Carter attempts a Layup. Contested by Jimmy Griffin (4.9 feet, MAN). Lauri Carter misses. Rebound secured by De'Aaron Allen.

[09:45] Team_049 possession (Score: 53-58)
Shai Bird attempts a 3Pt. Contested by D'Angelo O'Neal (4.5 feet, MAN). Shai Bird misses. Rebound secured by Kevin Allen.

[09:30] Team_046 possession (Score: 53-58)
Kevin Allen attempts a Layup. BLOCKED BY DE'AARON ALLEN! Ball is loose! Rebound secured by Shai Mobley.

[09:15] Team_049 possession (Score: 53-58)
Jimmy Griffin attempts a 3Pt. Contested by Lauri Carter (3.3 feet, ZONE). Jimmy Griffin misses. Rebound secured by Kevin Allen.

[09:00] Team_046 possession (Score: 53-58)
Victor Nowitzki throws a bad pass! Stolen by Ja Oladipo! TURNOVER! (live ball)

[08:48] Team_049 possession (Score: 53-58)
De'Aaron Allen makes the Layup and draws the foul on Cade Wall! And-1! De'Aaron Allen to the line for 1. [Team fouls: 2] (Cade Wall: 1 personal fouls)   FT 1/1: GOOD De'Aaron Allen makes 1/1 from the line.
Score: 56-58

[08:33] Team_046 possession (Score: 56-58)
Kevin Allen drives to the basket... Kevin Allen loses control! Ball rolls out of bounds! TURNOVER! (dead ball)

[08:16] Team_049 possession (Score: 56-58)
Jimmy Griffin drives, picks up Kevin Allen. Help arrives from D'Angelo O'Neal! Jimmy Griffin attempts a Dunk. Contested by D'Angelo O'Neal (4.7 feet, ZONE). JIMMY GRIFFIN MAKES IT!
Score: 58-58

[07:58] Team_046 possession (Score: 58-58)
Kevin Allen attempts a Midrange. Contested by Shai Mobley (4.5 feet, MAN). Kevin Allen misses. Rebound secured by De'Aaron Allen.

[07:44] Team_049 possession (Score: 58-58)
Shai Mobley drives to the basket... Shai Mobley throws a bad pass! Stolen by Kevin Allen! TURNOVER! (live ball)

[07:32] Team_046 possession (Score: 58-58)
Kevin Allen drives to the basket... Kevin Allen commits a violation (traveling/carry)! TURNOVER! (dead ball)

[07:18] Team_049 possession (Score: 58-58)
FOUL! Shooting foul on Cade Wall. De'Aaron Allen to the line for 2 free throws. [Team fouls: 3] (Cade Wall: 2 personal fouls)   FT 1/2: MISS   FT 2/2: GOOD De'Aaron Allen makes 1/2 from the line.
Score: 59-58

[06:59] Team_046 possession (Score: 59-58)
Cade Wall attempts a 3Pt. Contested by De'Aaron Allen (4.9 feet, MAN). Cade Wall misses. Rebound secured by Shai Mobley.

[06:45] Team_049 possession (Score: 59-58)
FOUL! Shooting foul on Kevin Allen. Ja Oladipo to the line for 2 free throws. [Team fouls: 4] (Kevin Allen: 1 personal fouls)   FT 1/2: GOOD   FT 2/2: GOOD Ja Oladipo makes 2/2 from the line.
Score: 61-58

[06:31] Team_046 possession (Score: 61-58)
Cade Wall attempts a Midrange. Contested by Jimmy Griffin (5.3 feet, ZONE). Cade Wall misses. Rebound secured by Jimmy Griffin.

[06:14] Team_049 possession (Score: 61-58)
Jimmy Griffin attempts a 3Pt. Contested by Lauri Carter (3.3 feet, MAN). Jimmy Griffin misses. Offensive rebound by Jimmy Griffin! Jimmy Griffin kicks it out.

[05:59] Team_049 possession (Score: 61-58)
De'Aaron Allen attempts a 3Pt. Contested by Cade Wall (3.6 feet, MAN). De'Aaron Allen misses. Rebound secured by Cade Wall.

[05:43] Team_046 possession (Score: 61-58)
FOUL! Reach-in foul on Jimmy Griffin during the drive. [Team fouls: 1] No free throws, side out. (Jimmy Griffin: 1 personal fouls)

[05:27] Team_046 possession (Score: 61-58)
D'Angelo O'Neal attempts a 3Pt. Contested by Ja Oladipo (4.5 feet, ZONE). D'Angelo O'Neal misses. Rebound secured by Jimmy Griffin.

[05:09] Team_049 possession (Score: 61-58)
FOUL! Reach-in foul on Kevin Allen during the drive. [IN THE BONUS! 5 team fouls] Shai Bird to the line for 2 free throws. (Kevin Allen: 2 personal fouls)   FT 1/2: MISS   FT 2/2: GOOD Shai Bird makes 1/2 from the line.
Score: 62-58

[04:52] Team_046 possession (Score: 62-58)
Lauri Carter attempts a 3Pt. Contested by Jimmy Griffin (4.9 feet, MAN). Lauri Carter misses. Rebound secured by De'Aaron Allen.

[04:35] Team_049 possession (Score: 62-58)
De'Aaron Allen drives and kicks out. Shai Bird attempts a Midrange. Contested by D'Angelo O'Neal (4.1 feet, MAN). Shai Bird misses. Offensive rebound by Shai Mobley! Shai Mobley puts it back in!
Score: 64-58

[04:22] Team_046 possession (Score: 64-58)
Cade Wall drives and kicks out. Lauri Carter attempts a 3Pt. Contested by Jimmy Griffin (4.7 feet, MAN). Lauri Carter misses. Rebound secured by Jimmy Griffin.

[04:09] Team_049 possession (Score: 64-58)
Shai Mobley attempts a 3Pt. Contested by Lauri Carter (3.6 feet, ZONE). SHAI MOBLEY MAKES IT! Assist: Ja Oladipo
Score: 67-58

[03:50] Team_046 possession (Score: 67-58)
Kevin Allen drives, De'Aaron Allen stays with him. Kevin Allen attempts a Dunk. Contested by De'Aaron Allen (4.6 feet, ZONE). KEVIN ALLEN MAKES IT!
Score: 67-60

[03:35] Team_049 possession (Score: 67-60)
FOUL! Shooting foul on Kevin Allen. De'Aaron Allen to the line for 2 free throws. [BONUS: 6 team fouls] (Kevin Allen: 3 personal fouls)   FT 1/2: GOOD   FT 2/2: GOOD De'Aaron Allen makes 2/2 from the line.
Score: 69-60

[03:26] Team_046 possession (Score: 69-60)
Kevin Allen loses the ball! Stripped by Shai Mobley! TURNOVER! (live ball)

[03:14] Team_049 possession (Score: 69-60)
Shai Bird attempts a 3Pt. Contested by D'Angelo O'Neal (4.7 feet, MAN). Shai Bird misses. Rebound secured by Kevin Allen.

[03:04] Team_046 possession (Score: 69-60)
FOUL! Shooting foul on Ja Oladipo. Victor Nowitzki to the line for 3 free throws. [Team fouls: 2] (Ja Oladipo: 1 personal fouls)   FT 1/3: GOOD   FT 2/3: GOOD   FT 3/3: GOOD Victor Nowitzki makes 3/3 from the line.
Score: 69-63

[02:52] Team_049 possession (Score: 69-63)
De'Aaron Allen attempts a 3Pt. Contested by Cade Wall (3.8 feet, MAN). DE'AARON ALLEN MAKES IT! Assist: Shai Mobley
Score: 72-63

[02:38] Team_046 possession (Score: 72-63)
Cade Wall throws a bad pass! Stolen by De'Aaron Allen! TURNOVER! (live ball)

[02:20] Team_049 possession (Score: 72-63)
Shai Mobley throws a bad pass out of bounds! TURNOVER! (dead ball)

[02:20] Substitution (Team_049): Shai Bird OUT → Shaquille Lillard IN (stamina_rule2)

[02:20] Substitution (Team_049): Jimmy Griffin OUT → Desmond Towns IN (stamina_rule2)

[02:20] Substitution (Team_046): D'Angelo O'Neal OUT → Collin Butler IN (stamina_rule2)

[02:20] Substitution (Team_046): Victor Nowitzki OUT → Manu Dosunmu IN (stamina_rule2)

[02:20] Substitution (Team_046): Cade Wall OUT → Chris LaVine IN (stamina_rule2)

[02:20] Substitution (Team_046): Kevin Allen OUT → Paul DeRozan IN (stamina_rule2)

[02:02] Team_046 possession (Score: 72-63)
Chris LaVine attempts a Layup. Contested by De'Aaron Allen (5.0 feet, MAN). Chris LaVine misses. Rebound secured by De'Aaron Allen.

[01:45] Team_049 possession (Score: 72-63)
De'Aaron Allen attempts a Layup. Contested by Chris LaVine (3.7 feet, ZONE). De'Aaron Allen misses. Rebound secured by Manu Dosunmu.

[01:28] Team_046 possession (Score: 72-63)
Collin Butler drives, picks up De'Aaron Allen. Help arrives from Ja Oladipo! Collin Butler attempts a Dunk. Contested by Ja Oladipo (4.9 feet, ZONE). COLLIN BUTLER MAKES IT!
Score: 72-65

[01:15] Team_049 possession (Score: 72-65)
Desmond Towns attempts a Midrange. Contested by Manu Dosunmu (4.9 feet, ZONE). Desmond Towns misses. Offensive rebound by Shai Mobley! Shai Mobley's putback is no good. Rebound secured by Paul DeRozan.

[01:05] Team_046 possession (Score: 72-65)
FOUL! Holding foul on Shaquille Lillard. [Team fouls: 3] No free throws, side out. (Shaquille Lillard: 1 personal fouls)

[00:49] Team_046 possession (Score: 72-65)
Paul DeRozan attempts a Midrange. Contested by Ja Oladipo (4.7 feet, ZONE). Paul DeRozan misses. Rebound secured by De'Aaron Allen.

[00:35] Team_049 possession (Score: 72-65)
FOUL! Holding foul on Collin Butler. [IN THE BONUS! 7 team fouls] Shaquille Lillard to the line for 2 free throws. (Collin Butler: 1 personal fouls)   FT 1/2: GOOD   FT 2/2: GOOD Shaquille Lillard makes 2/2 from the line.
Score: 74-65

[00:20] Team_046 possession (Score: 74-65)
Manu Dosunmu attempts a 3Pt. Contested by Ja Oladipo (5.3 feet, MAN). Manu Dosunmu misses. Rebound secured by Ja Oladipo.

[00:06] Team_049 possession (Score: 74-65)
Ja Oladipo attempts a 3Pt. Contested by Collin Butler (4.0 feet, ZONE). JA OLADIPO MAKES IT!
Score: 77-65

================================================================================
                              3RD QUARTER COMPLETE                              
================================================================================

3RD QUARTER SCORE: Team_049 26, Team_046 12

BOX SCORE:
================================================================================

Team_049
--------------------------------------------------------------------------------
Player                MIN  PTS  REB  AST  TO      FG   FG%      3P   3P%
--------------------------------------------------------------------------------
De'Aaron Allen         34   11    6    0   0   5/7    71.4     0/0   0.0
Shai Mobley            34    5    4    1   0   2/2   100.0     0/0   0.0
Ja Oladipo             34    5    1    1   0   2/2   100.0     0/0   0.0
Jimmy Griffin          31    2    4    1   0   1/2    50.0     0/0   0.0
Shaquille Lillard       5    2    0    0   0   1/1   100.0     0/0   0.0
Shai Bird              31    1    0    0   0   1/6    16.7     0/0   0.0
Desmond Towns           5    0    0    0   0   0/1     0.0     0/0   0.0

TEAM: FG: 12/21 (57.1%), 3PT: 3/9 (33.3%), REB: 16 (4 off, 12 def), AST: 3, TO: 2
TEAM FOULS: 3


Team_046
--------------------------------------------------------------------------------
Player                MIN  PTS  REB  AST  TO      FG   FG%      3P   3P%
--------------------------------------------------------------------------------
Cade Wall              31    3    2    0   0   1/4    25.0     0/0   0.0
Victor Nowitzki        31    3    0    0   0   1/2    50.0     0/0   0.0
Kevin Allen            31    2    4    1   0   1/3    33.3     0/0   0.0
D'Angelo O'Neal        31    2    0    1   0   1/2    50.0     0/0   0.0
Collin Butler           5    2    0    0   0   1/1   100.0     0/0   0.0
Lauri Carter           34    0    1    0   0   0/2     0.0     0/0   0.0
Chris LaVine            5    0    0    0   0   0/1     0.0     0/0   0.0
Manu Dosunmu            5    0    1    0   0   0/1     0.0     0/0   0.0
Paul DeRozan            5    0    1    0   0   0/1     0.0     0/0   0.0

TEAM: FG: 5/17 (29.4%), 3PT: 2/6 (33.3%), REB: 8 (0 off, 8 def), AST: 2, TO: 5
TEAM FOULS: 7 [Team_049 in BONUS]

================================================================================

================================================================================
                       4TH QUARTER - Team_049 vs Team_046                       
================================================================================

[12:00] Team_049 possession (Score: 77-65)
FOUL! Reach-in foul on Kevin Allen during the drive. [Team fouls: 1] No free throws, side out. (Kevin Allen: 1 personal fouls)

[11:44] Team_049 possession (Score: 77-65)
Jimmy Griffin attempts a 3Pt. Contested by D'Angelo O'Neal (4.2 feet, ZONE). Jimmy Griffin misses. Rebound secured by Cade Wall.

[11:26] Team_046 possession (Score: 77-65)
Victor Nowitzki drives, Ja Oladipo stays with him. Victor Nowitzki attempts a Layup. Contested by Ja Oladipo (4.7 feet, MAN). VICTOR NOWITZKI MAKES IT! Assist: Cade Wall
Score: 77-67

[11:10] Team_049 possession (Score: 77-67)
Shai Bird attempts a 3Pt. Contested by D'Angelo O'Neal (4.6 feet, MAN). SHAI BIRD MAKES IT! Assist: Shai Mobley
Score: 80-67

[10:56] Team_046 possession (Score: 80-67)
Cade Wall attempts a 3Pt. Contested by Jimmy Griffin (5.4 feet, ZONE). Cade Wall misses. Offensive rebound by Cade Wall! Cade Wall kicks it out.

[10:41] Team_046 possession (Score: 80-67)
Lauri Carter attempts a 3Pt. Contested by Jimmy Griffin (4.9 feet, MAN). Lauri Carter misses. Rebound secured by Shai Mobley.

[10:26] Team_049 possession (Score: 80-67)
Jimmy Griffin attempts a 3Pt. Contested by Lauri Carter (3.8 feet, MAN). Jimmy Griffin misses. Rebound secured by Cade Wall.

[10:14] Team_046 possession (Score: 80-67)
FOUL! Shooting foul on De'Aaron Allen. Cade Wall to the line for 2 free throws. [Team fouls: 1] (De'Aaron Allen: 1 personal fouls)   FT 1/2: GOOD   FT 2/2: GOOD Cade Wall makes 2/2 from the line.
Score: 80-69

[09:58] Team_049 possession (Score: 80-69)
Ja Oladipo makes the Layup and draws the foul on Victor Nowitzki! And-1! Ja Oladipo to the line for 1. [Team fouls: 2] (Victor Nowitzki: 1 personal fouls)   FT 1/1: MISS Ja Oladipo makes 0/1 from the line. Rebound secured by Kevin Allen.
Score: 82-69

[09:46] Team_046 possession (Score: 82-69)
Cade Wall attempts a Layup. BLOCKED BY DE'AARON ALLEN! Ball is loose! Rebound secured by Shai Mobley.

[09:34] Team_049 possession (Score: 82-69)
Shai Bird attempts a Layup. BLOCKED BY D'ANGELO O'NEAL! Ball goes out off D'Angelo O'Neal. Shai Bird's ball!

[09:18] Team_049 possession (Score: 82-69)
FOUL! Offensive foul on Shai Mobley! Kevin Allen drew the charge! [Team fouls: 2] (Shai Mobley: 1 personal fouls) TURNOVER! (dead ball)

[09:08] Team_046 possession (Score: 82-69)
Cade Wall attempts a 3Pt. Contested by Jimmy Griffin (5.5 feet, ZONE). Cade Wall misses. Rebound secured by Shai Mobley.

[08:58] Team_049 possession (Score: 82-69)
De'Aaron Allen attempts a 3Pt. Contested by Cade Wall (3.9 feet, MAN). De'Aaron Allen misses. Rebound secured by Cade Wall.

[08:44] Team_046 possession (Score: 82-69)
Victor Nowitzki drives and kicks out. D'Angelo O'Neal attempts a Midrange. Contested by Jimmy Griffin (5.0 feet, ZONE). D'Angelo O'Neal misses. Rebound secured by Jimmy Griffin.

[08:28] Team_049 possession (Score: 82-69)
Ja Oladipo attempts a 3Pt. Contested by D'Angelo O'Neal (4.6 feet, ZONE). Ja Oladipo misses. Rebound secured by Cade Wall.

[08:15] Team_046 possession (Score: 82-69)
FOUL! Reach-in foul on De'Aaron Allen during the drive. [Team fouls: 3] No free throws, side out. (De'Aaron Allen: 2 personal fouls)

[07:59] Team_046 possession (Score: 82-69)
Victor Nowitzki attempts a 3Pt. Contested by Jimmy Griffin (5.2 feet, ZONE). VICTOR NOWITZKI MAKES IT! Assist: Lauri Carter
Score: 82-72

[07:45] Team_049 possession (Score: 82-72)
Shai Bird attempts a Midrange. Contested by D'Angelo O'Neal (4.9 feet, MAN). SHAI BIRD MAKES IT!
Score: 84-72

[07:28] Team_046 possession (Score: 84-72)
Lauri Carter attempts a 3Pt. Contested by Jimmy Griffin (5.2 feet, ZONE). LAURI CARTER MAKES IT! Assist: Victor Nowitzki
Score: 84-75

[07:14] Team_049 possession (Score: 84-75)
Jimmy Griffin attempts a Midrange. Contested by Lauri Carter (4.3 feet, ZONE). JIMMY GRIFFIN MAKES IT!
Score: 86-75

[06:56] Team_046 possession (Score: 86-75)
FOUL! Reach-in foul on De'Aaron Allen during the drive. [Team fouls: 4] No free throws, side out. (De'Aaron Allen: 3 personal fouls)

[06:40] Team_046 possession (Score: 86-75)
FOUL! Holding foul on Jimmy Griffin. [IN THE BONUS! 5 team fouls] Lauri Carter to the line for 2 free throws. (Jimmy Griffin: 1 personal fouls)   FT 1/2: GOOD   FT 2/2: MISS Lauri Carter makes 1/2 from the line. Rebound secured by De'Aaron Allen.
Score: 86-76

[06:27] Team_049 possession (Score: 86-76)
Shai Bird attempts a Midrange. Contested by Kevin Allen (5.7 feet, ZONE). SHAI BIRD MAKES IT! Assist: Shai Mobley
Score: 88-76

[06:09] Team_046 possession (Score: 88-76)
Lauri Carter attempts a Midrange. Contested by De'Aaron Allen (5.3 feet, ZONE). Lauri Carter misses. Rebound secured by Jimmy Griffin.

[05:50] Team_049 possession (Score: 88-76)
Shai Bird attempts a Layup. BLOCKED BY D'ANGELO O'NEAL! Ball deflects out of bounds off Shai Bird.

[05:36] Team_046 possession (Score: 88-76)
Kevin Allen drives to the basket... Kevin Allen loses the ball! Stripped by Shai Mobley! TURNOVER! (live ball)

[05:24] Team_049 possession (Score: 88-76)
Shai Bird attempts a Midrange. Contested by Cade Wall (4.9 feet, ZONE). Shai Bird misses. Rebound secured by D'Angelo O'Neal.

[05:14] Team_046 possession (Score: 88-76)
Victor Nowitzki attempts a 3Pt. Contested by Jimmy Griffin (5.4 feet, ZONE). Victor Nowitzki misses. Rebound secured by Jimmy Griffin.

[05:01] Team_049 possession (Score: 88-76)
Jimmy Griffin attempts a Layup. Contested by Kevin Allen (5.5 feet, ZONE). JIMMY GRIFFIN MAKES IT! Assist: Ja Oladipo
Score: 90-76

[04:50] Team_046 possession (Score: 90-76)
Victor Nowitzki attempts a 3Pt. Contested by Jimmy Griffin (5.5 feet, ZONE). VICTOR NOWITZKI MAKES IT! Assist: Cade Wall
Score: 90-79

[04:37] Team_049 possession (Score: 90-79)
Shai Bird attempts a 3Pt. Contested by D'Angelo O'Neal (5.3 feet, MAN). Shai Bird misses. FOUL! Loose ball foul on Cade Wall during the rebound battle. [Team fouls: 3] No free throws, side out. (Cade Wall: 1 personal fouls)

[04:22] Team_049 possession (Score: 90-79)
Ja Oladipo drives and kicks out. FOUL! Shooting foul on Kevin Allen. Shai Mobley to the line for 2 free throws. [Team fouls: 4] (Kevin Allen: 2 personal fouls)   FT 1/2: GOOD   FT 2/2: MISS Shai Mobley makes 1/2 from the line. Rebound secured by Cade Wall.
Score: 91-79

[04:05] Team_046 possession (Score: 91-79)
Victor Nowitzki drives to the basket... FOUL! Offensive foul on Victor Nowitzki! Ja Oladipo drew the charge! [Team fouls: 5] (Victor Nowitzki: 2 personal fouls) TURNOVER! (dead ball)

[03:56] Team_049 possession (Score: 91-79)
Jimmy Griffin drives, picks up Kevin Allen. Help arrives from D'Angelo O'Neal! Jimmy Griffin attempts a Layup. Contested by D'Angelo O'Neal (5.7 feet, ZONE). JIMMY GRIFFIN MAKES IT! Assist: Ja Oladipo
Score: 93-79

[03:41] Team_046 possession (Score: 93-79)
Cade Wall makes the Midrange and draws the foul on De'Aaron Allen! And-1! Cade Wall to the line for 1. [BONUS: 6 team fouls] (De'Aaron Allen: 4 personal fouls)   FT 1/1: GOOD Cade Wall makes 1/1 from the line.
Score: 93-82

[03:31] Team_049 possession (Score: 93-82)
Ja Oladipo attempts a 3Pt. Wide open! Victor Nowitzki is 6.4 feet away. [MAN] JA OLADIPO MAKES IT! Assist: Shai Bird
Score: 96-82

[03:16] Team_046 possession (Score: 96-82)
Kevin Allen attempts a Layup. Contested by Shai Mobley (5.9 feet, MAN). Kevin Allen misses. Rebound secured by Jimmy Griffin.

[03:00] Team_049 possession (Score: 96-82)
FOUL! Shooting foul on Lauri Carter. Shai Mobley to the line for 2 free throws. [BONUS: 6 team fouls] (Lauri Carter: 1 personal fouls)   FT 1/2: GOOD   FT 2/2: GOOD Shai Mobley makes 2/2 from the line.
Score: 98-82

[02:43] Team_046 possession (Score: 98-82)
Cade Wall attempts a Layup. Wide open! De'Aaron Allen is 6.2 feet away. [ZONE] CADE WALL MAKES IT! Assist: Lauri Carter
Score: 98-84

[02:31] Team_049 possession (Score: 98-84)
Shai Bird attempts a Layup. Wide open! Kevin Allen is 6.2 feet away. [ZONE] SHAI BIRD MAKES IT! Assist: Jimmy Griffin
Score: 100-84

[02:17] Team_046 possession (Score: 100-84)
Lauri Carter attempts a Midrange. Contested by Ja Oladipo (5.9 feet, ZONE). LAURI CARTER MAKES IT!
Score: 100-86

[02:04] Team_049 possession (Score: 100-86)
Jimmy Griffin attempts a 3Pt. Contested by D'Angelo O'Neal (5.4 feet, ZONE). JIMMY GRIFFIN MAKES IT! Assist: De'Aaron Allen
Score: 103-86

[01:52] Team_046 possession (Score: 103-86)
D'Angelo O'Neal attempts a Layup. Contested by Shai Bird (5.5 feet, MAN). D'ANGELO O'NEAL MAKES IT! Assist: Kevin Allen
Score: 103-88

[01:37] Team_049 possession (Score: 103-88)
Shai Mobley drives to the basket... Shai Mobley loses control! Ball rolls out of bounds! TURNOVER! (dead ball)

[01:37] Substitution (Team_049): Shai Bird OUT → Shaquille Lillard IN (stamina_rule2)

[01:37] Substitution (Team_049): Ja Oladipo OUT → Shai Jordan IN (stamina_rule2)

[01:37] Substitution (Team_049): Jimmy Griffin OUT → Desmond Towns IN (stamina_rule2)

[01:37] Substitution (Team_049): De'Aaron Allen OUT → Giannis Anunoby IN (stamina_rule2)

[01:37] Substitution (Team_049): Shai Mobley OUT → Miles Jackson IN (stamina_rule2)

[01:37] Substitution (Team_046): D'Angelo O'Neal OUT → Collin Butler IN (stamina_rule2)

[01:37] Substitution (Team_046): Victor Nowitzki OUT → Manu Dosunmu IN (stamina_rule2)

[01:37] Substitution (Team_046): Lauri Carter OUT → Josh Barrett IN (stamina_rule2)

[01:37] Substitution (Team_046): Cade Wall OUT → Chris LaVine IN (stamina_rule2)

[01:37] Substitution (Team_046): Kevin Allen OUT → Paul DeRozan IN (stamina_rule2)

[01:27] Team_046 possession (Score: 103-88)
Manu Dosunmu attempts a 3Pt. Wide open! Shai Jordan is 6.7 feet away. [MAN] Manu Dosunmu misses. Rebound secured by Giannis Anunoby.

[01:13] Team_049 possession (Score: 103-88)
Miles Jackson drives and kicks out. Shaquille Lillard attempts a 3Pt. Contested by Collin Butler (3.9 feet, MAN). SHAQUILLE LILLARD MAKES IT!
Score: 106-88

[00:57] Team_046 possession (Score: 106-88)
FOUL! Shooting foul on Miles Jackson. Paul DeRozan to the line for 2 free throws. [BONUS: 7 team fouls] (Miles Jackson: 1 personal fouls)   FT 1/2: GOOD   FT 2/2: GOOD Paul DeRozan makes 2/2 from the line.
Score: 106-90

[00:48] Team_049 possession (Score: 106-90)
Shai Jordan attempts a 3Pt. Contested by Manu Dosunmu (4.8 feet, MAN). SHAI JORDAN MAKES IT! Assist: Giannis Anunoby
Score: 109-90

[00:31] Team_046 possession (Score: 109-90)
Josh Barrett attempts a Midrange. Wide open! Shai Jordan is 6.2 feet away. [ZONE] JOSH BARRETT MAKES IT!
Score: 109-92

[00:22] Team_049 possession (Score: 109-92)
FOUL! Shooting foul on Manu Dosunmu. Shai Jordan to the line for 3 free throws. [BONUS: 7 team fouls] (Manu Dosunmu: 1 personal fouls)   FT 1/3: GOOD   FT 2/3: GOOD   FT 3/3: GOOD Shai Jordan makes 3/3 from the line.
Score: 112-92

[00:08] Team_046 possession (Score: 112-92)
Josh Barrett attempts a 3Pt. Contested by Shaquille Lillard (4.6 feet, ZONE). Josh Barrett misses. Rebound secured by Shai Jordan.

================================================================================
                              4TH QUARTER COMPLETE                              
================================================================================

4TH QUARTER SCORE: Team_049 35, Team_046 27

BOX SCORE:
================================================================================

Team_049
--------------------------------------------------------------------------------
Player                MIN  PTS  REB  AST  TO      FG   FG%      3P   3P%
--------------------------------------------------------------------------------
Jimmy Griffin          42    9    4    1   0   4/6    66.7     0/0   0.0
Shai Bird              42    9    0    1   0   4/6    66.7     0/0   0.0
Shai Jordan             4    6    1    0   0   2/2   100.0     0/0   0.0
Ja Oladipo             44    3    0    2   0   1/4    25.0     0/0   0.0
Shaquille Lillard       7    3    0    0   0   1/1   100.0     0/0   0.0
Shai Mobley            44    2    4    2   0   1/1   100.0     0/0   0.0
De'Aaron Allen         44    0    1    1   0   0/1     0.0     0/0   0.0
Giannis Anunoby         4    0    1    1   0   0/0     0.0     0/0   0.0

TEAM: FG: 13/21 (61.9%), 3PT: 5/9 (55.6%), REB: 11 (1 off, 10 def), AST: 8, TO: 2
TEAM FOULS: 7 [Team_046 in BONUS]


Team_046
--------------------------------------------------------------------------------
Player                MIN  PTS  REB  AST  TO      FG   FG%      3P   3P%
--------------------------------------------------------------------------------
Victor Nowitzki        42    8    0    1   0   3/5    60.0     0/0   0.0
Cade Wall              42    7    6    2   0   3/5    60.0     0/0   0.0
Lauri Carter           44    5    0    2   0   2/4    50.0     0/0   0.0
D'Angelo O'Neal        42    2    1    0   0   1/1   100.0     0/0   0.0
Paul DeRozan            7    2    0    0   0   1/1   100.0     0/0   0.0
Josh Barrett            4    2    0    0   0   1/2    50.0     0/0   0.0
Kevin Allen            42    0    1    1   0   0/1     0.0     0/0   0.0
Manu Dosunmu            7    0    0    0   0   0/1     0.0     0/0   0.0

TEAM: FG: 11/21 (52.4%), 3PT: 3/8 (37.5%), REB: 8 (1 off, 7 def), AST: 6, TO: 2
TEAM FOULS: 7 [Team_049 in BONUS]

================================================================================

================================================================================
                               FULL GAME COMPLETE                               
================================================================================

FINAL SCORE: Team_049 112, Team_046 92

SCORING BY QUARTER:
--------------------------------------------------------------------------------
Team                     Q1     Q2     Q3     Q4    FINAL
--------------------------------------------------------------------------------
Team_049                 18     33     26     35      112
Team_046                 20     33     12     27       92
--------------------------------------------------------------------------------

FULL GAME BOX SCORE:
================================================================================

Team_049
--------------------------------------------------------------------------------
Player                MIN  PTS  REB  AST  TO      FG   FG%      3P   3P%      FT STL BLK
--------------------------------------------------------------------------------
Ja Oladipo             44   17    1    6   1   6/12   50.0   2/3    66.7   2/4     2   1
De'Aaron Allen         44   18   10    2   3   9/13   69.2   2/4    50.0   4/5     1   2
Shai Mobley            44   26   13    4   2  10/14   71.4   1/2    50.0   8/11    3   0
Shai Bird              42   18    0    2   1  10/22   45.5   2/8    25.0   5/6     0   0
Jimmy Griffin          42   14   16    3   3   6/11   54.5   2/6    33.3   0/0     3   0
Shaquille Lillard       7    5    0    0   0   0/0     0.0   0/0     0.0   2/2     0   0
Desmond Towns           7    3    0    0   1   1/2    50.0   1/1   100.0   0/0     0   0
Shai Jordan             4    6    1    0   0   2/2   100.0   2/2   100.0   3/3     0   0
Giannis Anunoby         4    0    3    2   0   0/0     0.0   0/0     0.0   0/0     0   0
Miles Jackson           4    0    1    0   1   1/3    33.3   0/2     0.0   0/0     0   0

TEAM: FG: 46/80 (57.5%), 3PT: 12/28 (42.9%), REB: 44 (9 off, 35 def), AST: 19, TO: 12


Team_046
--------------------------------------------------------------------------------
Player                MIN  PTS  REB  AST  TO      FG   FG%      3P   3P%      FT STL BLK
--------------------------------------------------------------------------------
Lauri Carter           44   12    7    4   3   6/13   46.2   2/6    33.3   3/4     0   0
D'Angelo O'Neal        42   20    1    3   1   8/12   66.7   2/4    50.0   2/2     0   2
Victor Nowitzki        42   14    0    3   4   5/14   35.7   4/8    50.0   3/3     0   0
Cade Wall              42   16   16    3   2   6/12   50.0   1/4    25.0   6/8     1   0
Kevin Allen            42   20   10    4   4   8/11   72.7   1/1   100.0   5/5     2   0
Collin Butler           7    2    0    1   0   1/1   100.0   0/0     0.0   0/0     0   0
Manu Dosunmu            7    0    1    0   0   0/2     0.0   0/2     0.0   0/0     0   0
Chris LaVine            7    2    2    0   1   1/2    50.0   0/0     0.0   0/0     0   0
Paul DeRozan            7    2    3    0   0   1/3    33.3   0/0     0.0   2/2     0   0
Josh Barrett            4    2    0    0   0   1/3    33.3   0/1     0.0   0/0     0   0

TEAM: FG: 37/74 (50.0%), 3PT: 10/26 (38.5%), REB: 40 (8 off, 32 def), AST: 18, TO: 15

================================================================================
