================================================================================
                        FULL GAME - Team_061 vs Team_090                        
================================================================================

================================================================================
                       1ST QUARTER - Team_061 vs Team_090                       
================================================================================

[12:00] Team_061 possession (Score: 0-0)
Bam Sexton attempts a Midrange. Contested by Gary Brogdon (4.1 feet, MAN). BAM SEXTON MAKES IT! Assist: Brandon Russell
Score: 2-0

[11:49] Team_090 possession (Score: 2-0)
Gary Brogdon makes the Midrange and draws the foul on Michael Russell! And-1! Gary Brogdon to the line for 1. [Team fouls: 1] (Michael Russell: 1 personal fouls)   FT 1/1: GOOD Gary Brogdon makes 1/1 from the line.
Score: 2-3

[11:34] Team_061 possession (Score: 2-3)
Draymond Banchero drives, picks up Tracy Adebayo. Help arrives from Larry Bridges! Draymond Banchero attempts a Dunk. Contested by Larry Bridges (5.4 feet, MAN). Draymond Banchero misses. Rebound secured by Zach Wall.

[11:17] Team_090 possession (Score: 2-3)
Tracy Adebayo attempts a Midrange. Contested by Michael Russell (3.5 feet, ZONE). Tracy Adebayo misses. Rebound secured by Bam Sexton.

[11:06] Team_061 possession (Score: 2-3)
FOUL! Shooting foul on Larry Bridges. Michael Russell to the line for 2 free throws. [Team fouls: 1] (Larry Bridges: 1 personal fouls)   FT 1/2: GOOD   FT 2/2: GOOD Michael Russell makes 2/2 from the line.
Score: 4-3

[10:53] Team_090 possession (Score: 4-3)
Zach Wall drives, Michael Russell stays with him. Zach Wall attempts a Layup. Contested by Michael Russell (4.0 feet, MAN). ZACH WALL MAKES IT!
Score: 4-5

[10:39] Team_061 possession (Score: 4-5)
Brandon Russell makes the Layup and draws the foul on Derrick Mitchell! And-1! Brandon Russell to the line for 1. [Team fouls: 2] (Derrick Mitchell: 1 personal fouls)   FT 1/1: GOOD Brandon Russell makes 1/1 from the line.
Score: 7-5

[10:27] Team_090 possession (Score: 7-5)
Zach Wall drives and kicks out. Derrick Mitchell attempts a 3Pt. BLOCKED BY BRANDON RUSSELL! Ball is loose! Rebound secured by Michael Russell.

[10:13] Team_061 possession (Score: 7-5)
Bam Sexton drives, picks up Gary Brogdon. Help arrives from Larry Bridges! Bam Sexton attempts a Layup. Contested by Larry Bridges (4.1 feet, MAN). BAM SEXTON MAKES IT!
Score: 9-5

[09:58] Team_090 possession (Score: 9-5)
Gary Brogdon attempts a Midrange. Contested by Jayson Holiday (4.2 feet, ZONE). Gary Brogdon misses. FOUL! Loose ball foul on Michael Russell during the rebound battle. [Team fouls: 2] No free throws, side out. (Michael Russell: 2 personal fouls)

[09:43] Team_090 possession (Score: 9-5)
Zach Wall attempts a Layup. Contested by Draymond Banchero (2.9 feet, ZONE). Zach Wall misses. Rebound secured by Bam Sexton.

[09:31] Team_061 possession (Score: 9-5)
Draymond Banchero attempts a Layup. Contested by Tracy Adebayo (5.4 feet, MAN). Draymond Banchero misses. Offensive rebound by Michael Russell! Michael Russell's putback is no good. Rebound secured by Zach Wall.

[09:15] Team_090 possession (Score: 9-5)
Zach Wall attempts a Layup. Contested by Draymond Banchero (2.9 feet, ZONE). Zach Wall misses. Rebound secured by Michael Russell.

[09:05] Team_061 possession (Score: 9-5)
Jayson Holiday attempts a 3Pt. Contested by Larry Bridges (5.2 feet, MAN). Jayson Holiday misses. Offensive rebound by Michael Russell! Michael Russell puts it back in!
Score: 11-5

[08:50] Team_090 possession (Score: 11-5)
Derrick Mitchell attempts a 3Pt. Contested by Brandon Russell (4.2 feet, MAN). Derrick Mitchell misses. Offensive rebound by Gary Brogdon! Gary Brogdon kicks it out.

[08:33] Team_090 possession (Score: 11-5)
Zach Wall attempts a Layup. Contested by Michael Russell (4.0 feet, MAN). ZACH WALL MAKES IT! Assist: Derrick Mitchell
Score: 11-7

[08:19] Team_061 possession (Score: 11-7)
FOUL! Shooting foul on Derrick Mitchell. Jayson Holiday to the line for 3 free throws. [Team fouls: 3] (Derrick Mitchell: 2 personal fouls)   FT 1/3: GOOD   FT 2/3: GOOD   FT 3/3: GOOD Jayson Holiday makes 3/3 from the line.
Score: 14-7

[08:03] Team_090 possession (Score: 14-7)
Zach Wall attempts a Midrange. Contested by Jayson Holiday (4.2 feet, ZONE). ZACH WALL MAKES IT!
Score: 14-9

[07:49] Team_061 possession (Score: 14-9)
Jayson Holiday attempts a Layup. Contested by Larry Bridges (5.2 feet, MAN). Jayson Holiday misses. Rebound secured by Zach Wall.

[07:39] Team_090 possession (Score: 14-9)
FOUL! Reach-in foul on Jayson Holiday during the drive. [Team fouls: 3] No free throws, side out. (Jayson Holiday: 1 personal fouls)

[07:28] Team_090 possession (Score: 14-9)
Gary Brogdon attempts a 3Pt. Contested by Bam Sexton (5.1 feet, MAN). GARY BROGDON MAKES IT! Assist: Zach Wall
Score: 14-12

[07:14] Team_061 possession (Score: 14-12)
Brandon Russell attempts a 3Pt. Contested by Derrick Mitchell (3.4 feet, ZONE). Brandon Russell misses. Rebound secured by Tracy Adebayo.

[07:00] Team_090 possession (Score: 14-12)
Derrick Mitchell drives and kicks out. Gary Brogdon attempts a 3Pt. Contested by Bam Sexton (4.9 feet, ZONE). Gary Brogdon misses. Offensive rebound by Gary Brogdon! Gary Brogdon kicks it out.

[06:47] Team_090 possession (Score: 14-12)
FOUL! Reach-in foul on Brandon Russell during the drive. [Team fouls: 4] No free throws, side out. (Brandon Russell: 1 personal fouls)

[06:32] Team_090 possession (Score: 14-12)
Gary Brogdon attempts a 3Pt. Contested by Bam Sexton (5.1 feet, MAN). GARY BROGDON MAKES IT! Assist: Derrick Mitchell
Score: 14-15

[06:21] Team_061 possession (Score: 14-15)
Michael Russell drives, picks up Zach Wall. Help arrives from Larry Bridges! Michael Russell attempts a Dunk. Contested by Larry Bridges (5.3 feet, MAN). MICHAEL RUSSELL MAKES IT! Assist: Jayson Holiday
Score: 16-15

[06:10] Team_090 possession (Score: 16-15)
Derrick Mitchell attempts a Midrange. Contested by Bam Sexton (5.2 feet, ZONE). Derrick Mitchell misses. Rebound secured by Draymond Banchero.

[05:56] Team_061 possession (Score: 16-15)
Brandon Russell attempts a 3Pt. Contested by Derrick Mitchell (3.4 feet, MAN). BRANDON RUSSELL MAKES IT! Assist: Draymond Banchero
Score: 19-15

[05:38] Team_090 possession (Score: 19-15)
Larry Bridges attempts a 3Pt. Contested by Jayson Holiday (4.0 feet, MAN). Larry Bridges misses. Offensive rebound by Gary Brogdon! Gary Brogdon kicks it out.

[05:21] Team_090 possession (Score: 19-15)
Derrick Mitchell throws a bad pass out of bounds! TURNOVER! (dead ball)

[05:05] Team_061 possession (Score: 19-15)
Draymond Banchero attempts a Midrange. Contested by Zach Wall (5.6 feet, ZONE). DRAYMOND BANCHERO MAKES IT!
Score: 21-15

[04:50] Team_090 possession (Score: 21-15)
Gary Brogdon loses control! Ball rolls out of bounds! TURNOVER! (dead ball)

[04:35] Team_061 possession (Score: 21-15)
Jayson Holiday attempts a Layup. BLOCKED BY LARRY BRIDGES! Ball is loose! Rebound secured by Gary Brogdon.

[04:22] Team_090 possession (Score: 21-15)
FOUL! Holding foul on Bam Sexton. [IN THE BONUS! 5 team fouls] Gary Brogdon to the line for 2 free throws. (Bam Sexton: 1 personal fouls)   FT 1/2: GOOD   FT 2/2: GOOD Gary Brogdon makes 2/2 from the line.
Score: 21-17

[04:09] Team_061 possession (Score: 21-17)
Michael Russell attempts a 3Pt. Contested by Derrick Mitchell (3.6 feet, ZONE). Michael Russell misses. Rebound secured by Zach Wall.

[03:57] Team_090 possession (Score: 21-17)
Zach Wall attempts a Midrange. Contested by Michael Russell (4.2 feet, MAN). Zach Wall misses. Rebound secured by Michael Russell.

[03:43] Team_061 possession (Score: 21-17)
Bam Sexton drives and kicks out. Brandon Russell attempts a 3Pt. Contested by Derrick Mitchell (3.3 feet, ZONE). Brandon Russell misses. Rebound secured by Zach Wall.

[03:33] Team_090 possession (Score: 21-17)
Gary Brogdon attempts a Layup. Contested by Bam Sexton (5.1 feet, MAN). GARY BROGDON MAKES IT! Assist: Zach Wall
Score: 21-19

[03:20] Team_061 possession (Score: 21-19)
Bam Sexton drives, picks up Gary Brogdon. Help arrives from Larry Bridges! Bam Sexton attempts a Layup. Contested by Larry Bridges (4.4 feet, MAN). Bam Sexton misses. Offensive rebound by Michael Russell! Michael Russell puts it back in!
Score: 23-19

[03:03] Team_090 possession (Score: 23-19)
Zach Wall attempts a Midrange. Contested by Bam Sexton (5.3 feet, ZONE). Zach Wall misses. Rebound secured by Michael Russell.

[02:47] Team_061 possession (Score: 23-19)
Bam Sexton drives and kicks out. Bam Sexton attempts a Midrange. Contested by Zach Wall (5.1 feet, ZONE). BAM SEXTON MAKES IT! Assist: Brandon Russell
Score: 25-19

[02:35] Team_090 possession (Score: 25-19)
Zach Wall makes the Layup and draws the foul on Draymond Banchero! And-1! Zach Wall to the line for 1. [BONUS: 6 team fouls] (Draymond Banchero: 1 personal fouls)   FT 1/1: GOOD Zach Wall makes 1/1 from the line.
Score: 25-22

[02:22] Team_061 possession (Score: 25-22)
Brandon Russell attempts a 3Pt. BLOCKED BY DERRICK MITCHELL! Ball is loose! Rebound secured by Zach Wall.

[02:10] Team_090 possession (Score: 25-22)
Zach Wall makes the Dunk and draws the foul on Michael Russell! And-1! Zach Wall to the line for 1. [BONUS: 7 team fouls] (Michael Russell: 3 personal fouls)   FT 1/1: GOOD Zach Wall makes 1/1 from the line.
Score: 25-25

[01:56] Team_061 possession (Score: 25-25)
Bam Sexton attempts a 3Pt. Contested by Derrick Mitchell (4.0 feet, ZONE). Bam Sexton misses. Rebound secured by Zach Wall.

[01:43] Team_090 possession (Score: 25-25)
Zach Wall attempts a 3Pt. Contested by Michael Russell (4.4 feet, MAN). ZACH WALL MAKES IT! Assist: Tracy Adebayo
Score: 25-28

[01:30] Team_061 possession (Score: 25-28)
Brandon Russell drives and kicks out. Draymond Banchero attempts a 3Pt. Contested by Derrick Mitchell (3.6 feet, ZONE). DRAYMOND BANCHERO MAKES IT!
Score: 28-28

[01:14] Team_090 possession (Score: 28-28)
Gary Brogdon loses the ball! Stripped by Bam Sexton! TURNOVER! (live ball)

[00:55] Team_061 possession (Score: 28-28)
Jayson Holiday attempts a 3Pt. Contested by Larry Bridges (5.5 feet, MAN). Jayson Holiday misses. Rebound secured by Gary Brogdon.

[00:41] Team_090 possession (Score: 28-28)
Larry Bridges attempts a 3Pt. Contested by Jayson Holiday (4.6 feet, MAN). LARRY BRIDGES MAKES IT! Assist: Tracy Adebayo
Score: 28-31

[00:28] Team_061 possession (Score: 28-31)
Michael Russell attempts a Midrange. Contested by Gary Brogdon (4.7 feet, ZONE). Michael Russell misses. Rebound secured by Gary Brogdon.

[00:14] Team_090 possession (Score: 28-31)
Zach Wall attempts a 3Pt. Contested by Brandon Russell (4.6 feet, ZONE). ZACH WALL MAKES IT! Assist: Derrick Mitchell
Score: 28-34

[00:01] Team_061 possession (Score: 28-34)
Michael Russell drives and kicks out. Bam Sexton attempts a 3Pt. Contested by Derrick Mitchell (3.8 feet, ZONE). Bam Sexton misses. Rebound secured by Tracy Adebayo.

================================================================================
                              1ST QUARTER COMPLETE                              
================================================================================

1ST QUARTER SCORE: Team_061 28, Team_090 34

BOX SCORE:
================================================================================

Team_061
--------------------------------------------------------------------------------
Player                MIN  PTS  REB  AST  TO      FG   FG%      3P   3P%
--------------------------------------------------------------------------------
Michael Russell        12    8    6    0   0   4/7    57.1     0/0   0.0
Bam Sexton             12    6    2    0   0   3/5    60.0     0/0   0.0
Brandon Russell        12    6    0    2   0   2/4    50.0     0/0   0.0
Draymond Banchero      12    5    1    1   0   2/4    50.0     0/0   0.0
Jayson Holiday         12    3    0    1   0   1/4    25.0     0/0   0.0

TEAM: FG: 12/24 (50.0%), 3PT: 3/8 (37.5%), REB: 10 (3 off, 7 def), AST: 4, TO: 0
TEAM FOULS: 7 [Team_090 in BONUS]


Team_090
--------------------------------------------------------------------------------
Player                MIN  PTS  REB  AST  TO      FG   FG%      3P   3P%
--------------------------------------------------------------------------------
Zach Wall              12   18    7    2   0   7/12   58.3     0/0   0.0
Gary Brogdon           12   13    6    0   0   5/5   100.0     0/0   0.0
Larry Bridges          12    3    0    0   0   1/1   100.0     0/0   0.0
Tracy Adebayo          12    0    3    2   0   0/1     0.0     0/0   0.0
Derrick Mitchell       12    0    0    3   0   0/1     0.0     0/0   0.0

TEAM: FG: 13/20 (65.0%), 3PT: 5/5 (100.0%), REB: 15 (4 off, 11 def), AST: 7, TO: 3
TEAM FOULS: 3

================================================================================

================================================================================
                       2ND QUARTER - Team_061 vs Team_090                       
================================================================================

[12:00] Team_061 possession (Score: 28-34)
Michael Russell drives, picks up Gary Brogdon. Help arrives from Larry Bridges! Michael Russell attempts a Layup. Contested by Larry Bridges (4.4 feet, ZONE). MICHAEL RUSSELL MAKES IT!
Score: 30-34

[11:46] Team_090 possession (Score: 30-34)
FOUL! Offensive foul on Zach Wall! Michael Russell drew the charge! [Team fouls: 1] (Zach Wall: 1 personal fouls) TURNOVER! (dead ball)

[11:31] Team_061 possession (Score: 30-34)
FOUL! Reach-in foul on Derrick Mitchell during the drive. [Team fouls: 2] No free throws, side out. (Derrick Mitchell: 1 personal fouls)

[11:17] Team_061 possession (Score: 30-34)
Draymond Banchero makes the Midrange and draws the foul on Zach Wall! And-1! Draymond Banchero to the line for 1. [Team fouls: 3] (Zach Wall: 2 personal fouls)   FT 1/1: MISS Draymond Banchero makes 0/1 from the line. Rebound secured by Zach Wall.
Score: 32-34

[11:05] Team_090 possession (Score: 32-34)
Tracy Adebayo drives to the basket... Tracy Adebayo loses the ball! Stripped by Draymond Banchero! TURNOVER! (live ball)

[10:52] Team_061 possession (Score: 32-34)
FOUL! Holding foul on Zach Wall. [Team fouls: 4] No free throws, side out. (Zach Wall: 3 personal fouls)

[10:37] Team_061 possession (Score: 32-34)
Michael Russell attempts a Layup. Contested by Gary Brogdon (4.7 feet, ZONE). Michael Russell misses. Offensive rebound by Michael Russell! Michael Russell kicks it out.

[10:22] Team_061 possession (Score: 32-34)
Bam Sexton makes the Layup and draws the foul on Larry Bridges! And-1! Bam Sexton to the line for 1. [BONUS: 5 team fouls] (Larry Bridges: 1 personal fouls)   FT 1/1: GOOD Bam Sexton makes 1/1 from the line.
Score: 35-34

[10:06] Team_090 possession (Score: 35-34)
Zach Wall commits a violation (traveling/carry)! TURNOVER! (dead ball)

[10:06] Substitution (Team_061): Brandon Russell OUT → Evan Rose IN (stamina_rule2)

[10:06] Substitution (Team_061): Jayson Holiday OUT → Gary Fox IN (stamina_rule2)

[10:06] Substitution (Team_061): Michael Russell OUT → Desmond Morant IN (stamina_rule2)

[10:06] Substitution (Team_061): Bam Sexton OUT → Stephen Towns IN (stamina_rule2)

[10:06] Substitution (Team_061): Draymond Banchero OUT → Tim Durant IN (stamina_rule2)

[10:06] Substitution (Team_090): Derrick Mitchell OUT → OG Anunoby IN (stamina_rule2)

[10:06] Substitution (Team_090): Larry Bridges OUT → Josh Wall IN (stamina_rule2)

[10:06] Substitution (Team_090): Zach Wall OUT → Russell Smith IN (stamina_rule2)

[10:06] Substitution (Team_090): Gary Brogdon OUT → Derrick Nowitzki IN (stamina_rule2)

[10:06] Substitution (Team_090): Tracy Adebayo OUT → Tobias Tatum IN (stamina_rule2)

[09:53] Team_061 possession (Score: 35-34)
FOUL! Holding foul on OG Anunoby. [IN THE BONUS! 6 team fouls] Evan Rose to the line for 2 free throws. (OG Anunoby: 1 personal fouls)   FT 1/2: GOOD   FT 2/2: GOOD Evan Rose makes 2/2 from the line.
Score: 37-34

[09:37] Team_090 possession (Score: 37-34)
Derrick Nowitzki attempts a 3Pt. Contested by Desmond Morant (4.1 feet, ZONE). DERRICK NOWITZKI MAKES IT! Assist: Josh Wall
Score: 37-37

[09:27] Team_061 possession (Score: 37-37)
Tim Durant attempts a Midrange. Contested by Tobias Tatum (5.2 feet, MAN). TIM DURANT MAKES IT!
Score: 39-37

[09:09] Team_090 possession (Score: 39-37)
Russell Smith attempts a 3Pt. Contested by Desmond Morant (4.7 feet, MAN). Russell Smith misses. FOUL! Loose ball foul on Stephen Towns during the rebound battle. [Team fouls: 1] No free throws, side out. (Stephen Towns: 1 personal fouls)

[08:53] Team_090 possession (Score: 39-37)
Derrick Nowitzki attempts a Layup. Contested by Tim Durant (3.7 feet, ZONE). Derrick Nowitzki misses. Rebound secured by Tim Durant.

[08:38] Team_061 possession (Score: 39-37)
Gary Fox drives and kicks out. Gary Fox attempts a 3Pt. Contested by Russell Smith (4.3 feet, ZONE). Gary Fox misses. Rebound secured by Derrick Nowitzki.

[08:23] Team_090 possession (Score: 39-37)
Russell Smith attempts a Midrange. Contested by Tim Durant (4.4 feet, ZONE). Russell Smith misses. Rebound secured by Desmond Morant.

[08:11] Team_061 possession (Score: 39-37)
Gary Fox attempts a 3Pt. Contested by Josh Wall (4.2 feet, MAN). Gary Fox misses. Offensive rebound by Tim Durant! Tim Durant puts it back in!
Score: 41-37

[07:57] Team_090 possession (Score: 41-37)
OG Anunoby drives to the basket... OG Anunoby loses the ball! Stripped by Evan Rose! TURNOVER! (live ball)

[07:41] Team_061 possession (Score: 41-37)
Desmond Morant attempts a Layup. BLOCKED BY RUSSELL SMITH! Ball is loose! Rebound secured by Tobias Tatum.

[07:29] Team_090 possession (Score: 41-37)
Derrick Nowitzki drives and kicks out. Russell Smith attempts a 3Pt. Contested by Desmond Morant (4.5 feet, MAN). Russell Smith misses. Rebound secured by Stephen Towns.

[07:09] Team_061 possession (Score: 41-37)
Gary Fox attempts a Midrange. Contested by Derrick Nowitzki (4.4 feet, ZONE). Gary Fox misses. FOUL! Loose ball foul on Derrick Nowitzki during the rebound battle. [IN THE BONUS! 7 team fouls] Stephen Towns to the line for 2 free throws. (Derrick Nowitzki: 1 personal fouls)   FT 1/2: MISS   FT 2/2: MISS Stephen Towns makes 0/2 from the line. Offensive rebound by Stephen Towns! Stephen Towns kicks it out.

[06:52] Team_061 possession (Score: 41-37)
Desmond Morant attempts a 3Pt. Contested by Russell Smith (4.7 feet, MAN). DESMOND MORANT MAKES IT! Assist: Stephen Towns
Score: 44-37

[06:37] Team_090 possession (Score: 44-37)
Tobias Tatum drives, Tim Durant stays with him. Tobias Tatum attempts a Dunk. Contested by Tim Durant (4.9 feet, ZONE). Tobias Tatum misses. Rebound secured by Tim Durant.

[06:21] Team_061 possession (Score: 44-37)
Evan Rose attempts a Midrange. Contested by OG Anunoby (5.3 feet, MAN). Evan Rose misses. Rebound secured by Tobias Tatum.

[06:10] Team_090 possession (Score: 44-37)
Derrick Nowitzki drives, Stephen Towns stays with him. Derrick Nowitzki attempts a Layup. Contested by Stephen Towns (4.4 feet, MAN). DERRICK NOWITZKI MAKES IT! Assist: Russell Smith
Score: 44-39

[05:50] Team_061 possession (Score: 44-39)
Desmond Morant attempts a 3Pt. Contested by Russell Smith (4.7 feet, ZONE). Desmond Morant misses. Rebound secured by Derrick Nowitzki.

[05:36] Team_090 possession (Score: 44-39)
Derrick Nowitzki drives to the basket... FOUL! Offensive foul on Derrick Nowitzki! Tim Durant drew the charge! [Team fouls: 8] (Derrick Nowitzki: 2 personal fouls) TURNOVER! (dead ball)

[05:19] Team_061 possession (Score: 44-39)
Evan Rose throws a bad pass! Stolen by OG Anunoby! TURNOVER! (live ball)

[05:04] Team_090 possession (Score: 44-39)
OG Anunoby attempts a Midrange. Contested by Gary Fox (6.0 feet, ZONE). OG Anunoby misses. Rebound secured by Tim Durant.

[04:47] Team_061 possession (Score: 44-39)
FOUL! Holding foul on Derrick Nowitzki. [IN THE BONUS! 9 team fouls] Stephen Towns to the line for 2 free throws. (Derrick Nowitzki: 3 personal fouls)   FT 1/2: GOOD   FT 2/2: GOOD Stephen Towns makes 2/2 from the line.
Score: 46-39

[04:28] Team_090 possession (Score: 46-39)
Russell Smith attempts a Midrange. Contested by Evan Rose (5.3 feet, ZONE). Russell Smith misses. Offensive rebound by Russell Smith! Russell Smith kicks it out.

[04:09] Team_090 possession (Score: 46-39)
Tobias Tatum attempts a 3Pt. Contested by Tim Durant (4.9 feet, MAN). TOBIAS TATUM MAKES IT! Assist: OG Anunoby
Score: 46-42

[03:55] Team_061 possession (Score: 46-42)
Evan Rose makes the Layup and draws the foul on OG Anunoby! And-1! Evan Rose to the line for 1. [BONUS: 10 team fouls] (OG Anunoby: 2 personal fouls)   FT 1/1: GOOD Evan Rose makes 1/1 from the line.
Score: 49-42

[03:38] Team_090 possession (Score: 49-42)
Tobias Tatum attempts a Midrange. Contested by Tim Durant (4.9 feet, MAN). Tobias Tatum misses. Offensive rebound by Tobias Tatum! Tobias Tatum kicks it out.

[03:21] Team_090 possession (Score: 49-42)
Tobias Tatum attempts a Midrange. Contested by Evan Rose (5.7 feet, ZONE). Tobias Tatum misses. Rebound secured by Tim Durant.

[03:05] Team_061 possession (Score: 49-42)
Tim Durant attempts a Layup. BLOCKED BY TOBIAS TATUM! Ball is loose! Rebound secured by Derrick Nowitzki.

[02:46] Team_090 possession (Score: 49-42)
Russell Smith attempts a 3Pt. Contested by Desmond Morant (4.7 feet, ZONE). Russell Smith misses. Rebound secured by Stephen Towns.

[02:29] Team_061 possession (Score: 49-42)
Tim Durant throws a bad pass out of bounds! TURNOVER! (dead ball)

[02:17] Team_090 possession (Score: 49-42)
Josh Wall drives, Gary Fox stays with him. Josh Wall attempts a Layup. Wide open! Gary Fox is 6.3 feet away. [MAN] JOSH WALL MAKES IT! Assist: Tobias Tatum
Score: 49-44

[02:02] Team_061 possession (Score: 49-44)
FOUL! Holding foul on Josh Wall. [IN THE BONUS! 11 team fouls] Gary Fox to the line for 2 free throws. (Josh Wall: 1 personal fouls)   FT 1/2: MISS   FT 2/2: MISS Gary Fox makes 0/2 from the line. Offensive rebound by Stephen Towns! Stephen Towns kicks it out.

[01:50] Team_061 possession (Score: 49-44)
Stephen Towns drives and kicks out. Tim Durant attempts a 3Pt. Contested by Russell Smith (4.4 feet, ZONE). TIM DURANT MAKES IT! Assist: Evan Rose
Score: 52-44

[01:34] Team_090 possession (Score: 52-44)
Derrick Nowitzki attempts a Midrange. Contested by Stephen Towns (4.5 feet, MAN). DERRICK NOWITZKI MAKES IT! Assist: Russell Smith
Score: 52-46

[01:20] Team_061 possession (Score: 52-46)
Stephen Towns drives and kicks out. Evan Rose attempts a Midrange. Contested by Derrick Nowitzki (4.5 feet, ZONE). Evan Rose misses. Rebound secured by Tobias Tatum.

[01:10] Team_090 possession (Score: 52-46)
Tobias Tatum attempts a 3Pt. Contested by Desmond Morant (5.3 feet, ZONE). Tobias Tatum misses. Rebound secured by Stephen Towns.

[00:51] Team_061 possession (Score: 52-46)
Stephen Towns attempts a Midrange. Contested by Russell Smith (4.8 feet, ZONE). STEPHEN TOWNS MAKES IT!
Score: 54-46

[00:36] Team_090 possession (Score: 54-46)
OG Anunoby attempts a 3Pt. Contested by Desmond Morant (4.7 feet, ZONE). OG Anunoby misses. Rebound secured by Stephen Towns.

[00:27] Team_061 possession (Score: 54-46)
FOUL! Shooting foul on Russell Smith. Gary Fox to the line for 3 free throws. [BONUS: 12 team fouls] (Russell Smith: 1 personal fouls)   FT 1/3: GOOD   FT 2/3: GOOD   FT 3/3: GOOD Gary Fox makes 3/3 from the line.
Score: 57-46

[00:12] Team_090 possession (Score: 57-46)
Derrick Nowitzki attempts a Midrange. Contested by Stephen Towns (4.7 feet, MAN). Derrick Nowitzki misses. Rebound secured by Desmond Morant.

================================================================================
                              2ND QUARTER COMPLETE                              
================================================================================

2ND QUARTER SCORE: Team_061 29, Team_090 12

BOX SCORE:
================================================================================

Team_061
--------------------------------------------------------------------------------
Player                MIN  PTS  REB  AST  TO      FG   FG%      3P   3P%
--------------------------------------------------------------------------------
Tim Durant             10    7    5    0   0   3/4    75.0     0/0   0.0
Evan Rose              10    5    0    1   0   2/3    66.7     0/0   0.0
Stephen Towns          10    4    6    1   0   2/3    66.7     0/0   0.0
Bam Sexton             14    3    0    0   0   1/1   100.0     0/0   0.0
Gary Fox               10    3    0    0   0   1/2    50.0     0/0   0.0
Desmond Morant         10    3    2    0   0   1/3    33.3     0/0   0.0
Michael Russell        14    2    1    0   0   1/1   100.0     0/0   0.0
Draymond Banchero      14    0    0    0   0   0/1     0.0     0/0   0.0

TEAM: FG: 11/18 (61.1%), 3PT: 3/4 (75.0%), REB: 14 (4 off, 10 def), AST: 2, TO: 2
TEAM FOULS: 1


Team_090
--------------------------------------------------------------------------------
Player                MIN  PTS  REB  AST  TO      FG   FG%      3P   3P%
--------------------------------------------------------------------------------
Derrick Nowitzki       10    7    3    0   0   3/6    50.0     0/0   0.0
Tobias Tatum           10    3    5    1   0   1/4    25.0     0/0   0.0
Josh Wall              10    2    0    1   0   1/1   100.0     0/0   0.0
Zach Wall              14    0    1    0   0   0/0     0.0     0/0   0.0
Russell Smith          10    0    1    2   0   0/2     0.0     0/0   0.0
OG Anunoby             10    0    0    1   0   0/2     0.0     0/0   0.0

TEAM: FG: 5/15 (33.3%), 3PT: 2/5 (40.0%), REB: 10 (3 off, 7 def), AST: 5, TO: 5
TEAM FOULS: 12 [Team_061 in BONUS]

================================================================================

================================================================================
                       3RD QUARTER - Team_061 vs Team_090                       
================================================================================

[12:00] Team_061 possession (Score: 57-46)
Bam Sexton drives and kicks out. Draymond Banchero attempts a Midrange. Contested by Tracy Adebayo (4.7 feet, MAN). Draymond Banchero misses. Rebound secured by Tracy Adebayo.

[11:49] Team_090 possession (Score: 57-46)
Gary Brogdon loses the ball! Stripped by Bam Sexton! TURNOVER! (live ball)

[11:31] Team_061 possession (Score: 57-46)
Draymond Banchero drives and kicks out. Michael Russell attempts a Midrange. Contested by Zach Wall (5.0 feet, MAN). Michael Russell misses. Offensive rebound by Michael Russell! Michael Russell puts it back in!
Score: 59-46

[11:15] Team_090 possession (Score: 59-46)
FOUL! Reach-in foul on Draymond Banchero during the drive. [Team fouls: 1] No free throws, side out. (Draymond Banchero: 1 personal fouls)

[10:56] Team_090 possession (Score: 59-46)
Tracy Adebayo drives to the basket... Tracy Adebayo loses the ball! Stripped by Draymond Banchero! TURNOVER! (live ball)

[10:38] Team_061 possession (Score: 59-46)
Draymond Banchero drives, picks up Gary Brogdon. Help arrives from Larry Bridges! Draymond Banchero attempts a Layup. Contested by Larry Bridges (4.3 feet, ZONE). DRAYMOND BANCHERO MAKES IT!
Score: 61-46

[10:23] Team_090 possession (Score: 61-46)
Gary Brogdon drives, Bam Sexton stays with him. Gary Brogdon attempts a Dunk. Contested by Bam Sexton (5.1 feet, MAN). GARY BROGDON MAKES IT! Assist: Tracy Adebayo
Score: 61-48

[10:10] Team_061 possession (Score: 61-48)
Jayson Holiday attempts a 3Pt. Contested by Derrick Mitchell (3.6 feet, ZONE). Jayson Holiday misses. Rebound secured by Gary Brogdon.

[09:56] Team_090 possession (Score: 61-48)
Tracy Adebayo makes the Layup and draws the foul on Draymond Banchero! And-1! Tracy Adebayo to the line for 1. [Team fouls: 2] (Draymond Banchero: 2 personal fouls)   FT 1/1: GOOD Tracy Adebayo makes 1/1 from the line.
Score: 61-51

[09:38] Team_061 possession (Score: 61-51)
Draymond Banchero attempts a Midrange. Contested by Derrick Mitchell (3.9 feet, ZONE). Draymond Banchero misses. Rebound secured by Tracy Adebayo.

[09:23] Team_090 possession (Score: 61-51)
Larry Bridges drives to the basket... Larry Bridges throws a bad pass out of bounds! TURNOVER! (dead ball)

[09:05] Team_061 possession (Score: 61-51)
Bam Sexton attempts a Layup. Contested by Gary Brogdon (4.1 feet, MAN). Bam Sexton misses. Offensive rebound by Michael Russell! Michael Russell's putback is no good. Rebound secured by Gary Brogdon.

[08:50] Team_090 possession (Score: 61-51)
Tracy Adebayo attempts a Midrange. Contested by Jayson Holiday (3.8 feet, ZONE). Tracy Adebayo misses. Rebound secured by Bam Sexton.

[08:33] Team_061 possession (Score: 61-51)
Michael Russell makes the Layup and draws the foul on Larry Bridges! And-1! Michael Russell to the line for 1. [Team fouls: 1] (Larry Bridges: 1 personal fouls)   FT 1/1: GOOD Michael Russell makes 1/1 from the line.
Score: 64-51

[08:23] Team_090 possession (Score: 64-51)
Derrick Mitchell attempts a Layup. Contested by Draymond Banchero (2.9 feet, ZONE). Derrick Mitchell misses. Rebound secured by Michael Russell.

[08:08] Team_061 possession (Score: 64-51)
Michael Russell attempts a 3Pt. Contested by Zach Wall (5.3 feet, MAN). Michael Russell misses. Rebound secured by Zach Wall.

[07:53] Team_090 possession (Score: 64-51)
FOUL! Shooting foul on Michael Russell. Zach Wall to the line for 2 free throws. [Team fouls: 3] (Michael Russell: 1 personal fouls)   FT 1/2: GOOD   FT 2/2: GOOD Zach Wall makes 2/2 from the line.
Score: 64-53

[07:38] Team_061 possession (Score: 64-53)
Bam Sexton attempts a Midrange. Contested by Gary Brogdon (4.1 feet, MAN). Bam Sexton misses. Rebound secured by Gary Brogdon.

[07:24] Team_090 possession (Score: 64-53)
Derrick Mitchell attempts a 3Pt. Contested by Brandon Russell (4.2 feet, MAN). Derrick Mitchell misses. Rebound secured by Michael Russell.

[07:11] Team_061 possession (Score: 64-53)
Jayson Holiday attempts a Midrange. Contested by Derrick Mitchell (3.6 feet, ZONE). Jayson Holiday misses. Rebound secured by Tracy Adebayo.

[06:56] Team_090 possession (Score: 64-53)
Derrick Mitchell attempts a 3Pt. Contested by Brandon Russell (4.2 feet, MAN). Derrick Mitchell misses. Rebound secured by Draymond Banchero.

[06:42] Team_061 possession (Score: 64-53)
Draymond Banchero attempts a Layup. Contested by Gary Brogdon (4.3 feet, ZONE). DRAYMOND BANCHERO MAKES IT! Assist: Michael Russell
Score: 66-53

[06:24] Team_090 possession (Score: 66-53)
Zach Wall makes the Layup and draws the foul on Michael Russell! And-1! Zach Wall to the line for 1. [Team fouls: 4] (Michael Russell: 2 personal fouls)   FT 1/1: GOOD Zach Wall makes 1/1 from the line.
Score: 66-56

[06:10] Team_061 possession (Score: 66-56)
Michael Russell drives, Gary Brogdon stays with him. Michael Russell attempts a Dunk. Contested by Gary Brogdon (3.9 feet, ZONE). Michael Russell misses. Offensive rebound by Draymond Banchero! Draymond Banchero's putback is no good. Offensive rebound by Draymond Banchero! Draymond Banchero kicks it out.

[05:55] Team_061 possession (Score: 66-56)
FOUL! Reach-in foul on Gary Brogdon during the drive. [Team fouls: 2] No free throws, side out. (Gary Brogdon: 1 personal fouls)

[05:37] Team_061 possession (Score: 66-56)
Bam Sexton attempts a Midrange. Contested by Gary Brogdon (4.1 feet, ZONE). BAM SEXTON MAKES IT!
Score: 68-56

[05:22] Team_090 possession (Score: 68-56)
Tracy Adebayo drives and kicks out. Derrick Mitchell attempts a 3Pt. Contested by Brandon Russell (3.9 feet, ZONE). DERRICK MITCHELL MAKES IT! Assist: Zach Wall
Score: 68-59

[05:05] Team_061 possession (Score: 68-59)
Brandon Russell attempts a 3Pt. Contested by Derrick Mitchell (3.4 feet, MAN). Brandon Russell misses. Rebound secured by Zach Wall.

[04:55] Team_090 possession (Score: 68-59)
FOUL! Offensive foul on Derrick Mitchell! Brandon Russell drew the charge! [Team fouls: 3] (Derrick Mitchell: 1 personal fouls) TURNOVER! (dead ball)

[04:43] Team_061 possession (Score: 68-59)
Brandon Russell drives and kicks out. FOUL! Shooting foul on Gary Brogdon. Jayson Holiday to the line for 2 free throws. [Team fouls: 4] (Gary Brogdon: 2 personal fouls)   FT 1/2: GOOD   FT 2/2: GOOD Jayson Holiday makes 2/2 from the line.
Score: 70-59

[04:30] Team_090 possession (Score: 70-59)
Zach Wall drives and kicks out. Gary Brogdon attempts a 3Pt. Contested by Brandon Russell (3.9 feet, ZONE). GARY BROGDON MAKES IT! Assist: Larry Bridges
Score: 70-62

[04:13] Team_061 possession (Score: 70-62)
FOUL! Reach-in foul on Zach Wall during the drive. [IN THE BONUS! 5 team fouls] Michael Russell to the line for 2 free throws. (Zach Wall: 1 personal fouls)   FT 1/2: GOOD   FT 2/2: GOOD Michael Russell makes 2/2 from the line.
Score: 72-62

[03:57] Team_090 possession (Score: 72-62)
Derrick Mitchell attempts a 3Pt. Contested by Brandon Russell (4.2 feet, ZONE). Derrick Mitchell misses. Rebound secured by Bam Sexton.

[03:38] Team_061 possession (Score: 72-62)
Jayson Holiday attempts a 3Pt. Contested by Derrick Mitchell (3.7 feet, ZONE). JAYSON HOLIDAY MAKES IT!
Score: 75-62

[03:26] Team_090 possession (Score: 75-62)
Zach Wall attempts a 3Pt. Contested by Brandon Russell (4.2 feet, ZONE). Zach Wall misses. Offensive rebound by Tracy Adebayo! Tracy Adebayo kicks it out.

[03:12] Team_090 possession (Score: 75-62)
Larry Bridges attempts a 3Pt. Contested by Jayson Holiday (4.2 feet, MAN). Larry Bridges misses. Offensive rebound by Zach Wall! Zach Wall kicks it out.

[02:58] Team_090 possession (Score: 75-62)
Gary Brogdon attempts a Layup. Contested by Draymond Banchero (2.9 feet, ZONE). Gary Brogdon misses. Rebound secured by Bam Sexton.

[02:42] Team_061 possession (Score: 75-62)
Brandon Russell attempts a Midrange. Contested by Larry Bridges (5.1 feet, ZONE). BRANDON RUSSELL MAKES IT! Assist: Draymond Banchero
Score: 77-62

[02:25] Team_090 possession (Score: 77-62)
Tracy Adebayo attempts a Midrange. Contested by Bam Sexton (4.8 feet, ZONE). TRACY ADEBAYO MAKES IT!
Score: 77-64

[02:10] Team_061 possession (Score: 77-64)
Draymond Banchero drives, Gary Brogdon stays with him. Draymond Banchero attempts a Layup. Contested by Gary Brogdon (4.7 feet, ZONE). Draymond Banchero misses. Rebound secured by Gary Brogdon.

[01:54] Team_090 possession (Score: 77-64)
Larry Bridges drives and kicks out. Derrick Mitchell attempts a Midrange. Contested by Brandon Russell (4.1 feet, MAN). DERRICK MITCHELL MAKES IT!
Score: 77-66

[01:39] Team_061 possession (Score: 77-66)
Jayson Holiday drives, Gary Brogdon stays with him. Jayson Holiday attempts a Layup. Contested by Gary Brogdon (4.5 feet, ZONE). Jayson Holiday misses. Rebound secured by Gary Brogdon.

[01:21] Team_090 possession (Score: 77-66)
Larry Bridges drives and kicks out. Zach Wall attempts a Midrange. Contested by Michael Russell (4.1 feet, MAN). Zach Wall misses. Offensive rebound by Zach Wall! Zach Wall kicks it out.

[01:08] Team_090 possession (Score: 77-66)
Zach Wall attempts a 3Pt. Contested by Michael Russell (4.4 feet, MAN). Zach Wall misses. Rebound secured by Draymond Banchero.

[00:52] Team_061 possession (Score: 77-66)
Brandon Russell attempts a 3Pt. Contested by Derrick Mitchell (3.7 feet, ZONE). Brandon Russell misses. Rebound secured by Tracy Adebayo.

[00:39] Team_090 possession (Score: 77-66)
Derrick Mitchell throws a bad pass! Stolen by Brandon Russell! TURNOVER! (live ball)

[00:24] Team_061 possession (Score: 77-66)
Brandon Russell attempts a Midrange. Contested by Larry Bridges (5.3 feet, ZONE). Brandon Russell misses. Rebound secured by Gary Brogdon.

[00:11] Team_090 possession (Score: 77-66)
Derrick Mitchell drives and kicks out. Derrick Mitchell attempts a 3Pt. Contested by Brandon Russell (4.3 feet, ZONE). DERRICK MITCHELL MAKES IT! Assist: Tracy Adebayo
Score: 77-69

================================================================================
                              3RD QUARTER COMPLETE                              
================================================================================

3RD QUARTER SCORE: Team_061 20, Team_090 23

BOX SCORE:
================================================================================

Team_061
--------------------------------------------------------------------------------
Player                MIN  PTS  REB  AST  TO      FG   FG%      3P   3P%
--------------------------------------------------------------------------------
Michael Russell        26    7    3    1   0   3/4    75.0     0/0   0.0
Jayson Holiday         26    5    0    0   0   2/5    40.0     0/0   0.0
Draymond Banchero      26    4    3    1   0   2/4    50.0     0/0   0.0
Bam Sexton             26    2    3    0   0   1/4    25.0     0/0   0.0
Brandon Russell        26    2    0    0   0   1/4    25.0     0/0   0.0

TEAM: FG: 9/21 (42.9%), 3PT: 1/5 (20.0%), REB: 10 (3 off, 7 def), AST: 2, TO: 0
TEAM FOULS: 4


Team_090
--------------------------------------------------------------------------------
Player                MIN  PTS  REB  AST  TO      FG   FG%      3P   3P%
--------------------------------------------------------------------------------
Derrick Mitchell       26    8    0    0   0   3/7    42.9     0/0   0.0
Tracy Adebayo          26    5    5    2   0   2/3    66.7     0/0   0.0
Gary Brogdon           26    5    6    0   0   2/3    66.7     0/0   0.0
Zach Wall              26    5    4    1   0   2/3    66.7     0/0   0.0
Larry Bridges          26    0    0    1   0   0/0     0.0     0/0   0.0

TEAM: FG: 9/16 (56.2%), 3PT: 0/4 (0.0%), REB: 14 (3 off, 11 def), AST: 4, TO: 5
TEAM FOULS: 5 [Team_061 in BONUS]

================================================================================

================================================================================
                       4TH QUARTER - Team_061 vs Team_090                       
================================================================================

[12:00] Team_061 possession (Score: 77-69)
Bam Sexton attempts a Midrange. Contested by Gary Brogdon (4.5 feet, ZONE). BAM SEXTON MAKES IT!
Score: 79-69

[11:49] Team_090 possession (Score: 79-69)
Tracy Adebayo attempts a Layup. BLOCKED BY DRAYMOND BANCHERO! Ball is loose! Offensive rebound by Zach Wall! Zach Wall kicks it out.

[11:30] Team_090 possession (Score: 79-69)
Tracy Adebayo drives and kicks out. Derrick Mitchell attempts a 3Pt. Contested by Brandon Russell (4.1 feet, MAN). DERRICK MITCHELL MAKES IT! Assist: Zach Wall
Score: 79-72

[11:15] Team_061 possession (Score: 79-72)
FOUL! Holding foul on Zach Wall. [Team fouls: 1] No free throws, side out. (Zach Wall: 1 personal fouls)

[11:02] Team_061 possession (Score: 79-72)
Michael Russell attempts a Midrange. Contested by Zach Wall (5.4 feet, MAN). MICHAEL RUSSELL MAKES IT! Assist: Draymond Banchero
Score: 81-72

[10:47] Team_090 possession (Score: 81-72)
Derrick Mitchell attempts a Midrange. Contested by Brandon Russell (4.5 feet, MAN). DERRICK MITCHELL MAKES IT!
Score: 81-74

[10:35] Team_061 possession (Score: 81-74)
Jayson Holiday attempts a Midrange. Contested by Tracy Adebayo (5.6 feet, ZONE). Jayson Holiday misses. Rebound secured by Tracy Adebayo.

[10:19] Team_090 possession (Score: 81-74)
Larry Bridges drives, picks up Jayson Holiday. Help arrives from Michael Russell! Larry Bridges attempts a Dunk. Contested by Michael Russell (4.5 feet, MAN). Larry Bridges misses. Rebound secured by Draymond Banchero.

[10:02] Team_061 possession (Score: 81-74)
Draymond Banchero makes the Dunk and draws the foul on Gary Brogdon! And-1! Draymond Banchero to the line for 1. [Team fouls: 2] (Gary Brogdon: 1 personal fouls)   FT 1/1: GOOD Draymond Banchero makes 1/1 from the line.
Score: 84-74

[09:51] Team_090 possession (Score: 84-74)
Derrick Mitchell attempts a 3Pt. Contested by Brandon Russell (4.6 feet, MAN). DERRICK MITCHELL MAKES IT! Assist: Larry Bridges
Score: 84-77

[09:36] Team_061 possession (Score: 84-77)
Brandon Russell attempts a 3Pt. Contested by Derrick Mitchell (3.8 feet, MAN). Brandon Russell misses. Rebound secured by Zach Wall.

[09:22] Team_090 possession (Score: 84-77)
Tracy Adebayo attempts a Midrange. Contested by Draymond Banchero (2.9 feet, MAN). Tracy Adebayo misses. Rebound secured by Draymond Banchero.

[09:06] Team_061 possession (Score: 84-77)
FOUL! Shooting foul on Zach Wall. Michael Russell to the line for 2 free throws. [Team fouls: 3] (Zach Wall: 2 personal fouls)   FT 1/2: GOOD   FT 2/2: GOOD Michael Russell makes 2/2 from the line.
Score: 86-77

[08:50] Team_090 possession (Score: 86-77)
Tracy Adebayo attempts a Layup. Contested by Draymond Banchero (3.0 feet, ZONE). Tracy Adebayo misses. Rebound secured by Michael Russell.

[08:35] Team_061 possession (Score: 86-77)
FOUL! Shooting foul on Larry Bridges. Jayson Holiday to the line for 2 free throws. [Team fouls: 4] (Larry Bridges: 1 personal fouls)   FT 1/2: GOOD   FT 2/2: GOOD Jayson Holiday makes 2/2 from the line.
Score: 88-77

[08:20] Team_090 possession (Score: 88-77)
Larry Bridges drives and kicks out. Derrick Mitchell attempts a 3Pt. Contested by Brandon Russell (4.5 feet, ZONE). Derrick Mitchell misses. Rebound secured by Draymond Banchero.

[08:09] Team_061 possession (Score: 88-77)
Michael Russell attempts a 3Pt. Contested by Zach Wall (5.7 feet, MAN). Michael Russell misses. Offensive rebound by Draymond Banchero! Draymond Banchero puts it back in!
Score: 90-77

[07:59] Team_090 possession (Score: 90-77)
FOUL! Reach-in foul on Brandon Russell during the drive. [Team fouls: 1] No free throws, side out. (Brandon Russell: 1 personal fouls)

[07:43] Team_090 possession (Score: 90-77)
Zach Wall attempts a Midrange. Contested by Michael Russell (4.9 feet, MAN). ZACH WALL MAKES IT! Assist: Derrick Mitchell
Score: 90-79

[07:33] Team_061 possession (Score: 90-79)
Jayson Holiday attempts a 3Pt. Contested by Derrick Mitchell (4.2 feet, ZONE). Jayson Holiday misses. Rebound secured by Zach Wall.

[07:20] Team_090 possession (Score: 90-79)
Tracy Adebayo makes the Midrange and draws the foul on Bam Sexton! And-1! Tracy Adebayo to the line for 1. [Team fouls: 2] (Bam Sexton: 1 personal fouls)   FT 1/1: GOOD Tracy Adebayo makes 1/1 from the line.
Score: 90-82

[07:08] Team_061 possession (Score: 90-82)
Draymond Banchero attempts a Midrange. Wide open! Tracy Adebayo is 6.3 feet away. [MAN] DRAYMOND BANCHERO MAKES IT! Assist: Jayson Holiday
Score: 92-82

[06:55] Team_090 possession (Score: 92-82)
Zach Wall drives, Michael Russell stays with him. Zach Wall attempts a Layup. Contested by Michael Russell (5.0 feet, MAN). Zach Wall misses. Rebound secured by Draymond Banchero.

[06:41] Team_061 possession (Score: 92-82)
Brandon Russell attempts a Midrange. Contested by Derrick Mitchell (4.2 feet, MAN). BRANDON RUSSELL MAKES IT!
Score: 94-82

[06:24] Team_090 possession (Score: 94-82)
Zach Wall attempts a 3Pt. Contested by Michael Russell (5.1 feet, MAN). Zach Wall misses. Rebound secured by Bam Sexton.

[06:07] Team_061 possession (Score: 94-82)
Brandon Russell attempts a 3Pt. Contested by Gary Brogdon (5.2 feet, ZONE). Brandon Russell misses. FOUL! Loose ball foul on Zach Wall during the rebound battle. [IN THE BONUS! 5 team fouls] Bam Sexton to the line for 2 free throws. (Zach Wall: 3 personal fouls)   FT 1/2: GOOD   FT 2/2: GOOD Bam Sexton makes 2/2 from the line.
Score: 96-82

[05:57] Team_090 possession (Score: 96-82)
Larry Bridges attempts a 3Pt. Contested by Jayson Holiday (5.1 feet, MAN). Larry Bridges misses. Rebound secured by Michael Russell.

[05:39] Team_061 possession (Score: 96-82)
Draymond Banchero attempts a Midrange. Wide open! Tracy Adebayo is 6.5 feet away. [MAN] DRAYMOND BANCHERO MAKES IT! Assist: Bam Sexton
Score: 98-82

[05:26] Team_090 possession (Score: 98-82)
Larry Bridges drives, Draymond Banchero stays with him. Larry Bridges attempts a Layup. Contested by Draymond Banchero (3.8 feet, ZONE). Larry Bridges misses. FOUL! Loose ball foul on Bam Sexton during the rebound battle. [Team fouls: 3] No free throws, side out. (Bam Sexton: 2 personal fouls)

[05:07] Team_090 possession (Score: 98-82)
Gary Brogdon attempts a 3Pt. Contested by Bam Sexton (5.7 feet, MAN). Gary Brogdon misses. Rebound secured by Michael Russell.

[04:53] Team_061 possession (Score: 98-82)
Draymond Banchero attempts a Midrange. Wide open! Larry Bridges is 6.3 feet away. [ZONE] Draymond Banchero misses. Rebound secured by Gary Brogdon.

[04:35] Team_090 possession (Score: 98-82)
Tracy Adebayo drives and kicks out. Tracy Adebayo attempts a Midrange. Contested by Jayson Holiday (5.4 feet, ZONE). Tracy Adebayo misses. Offensive rebound by Tracy Adebayo! Tracy Adebayo kicks it out.

[04:24] Team_090 possession (Score: 98-82)
Zach Wall attempts a Midrange. Contested by Michael Russell (5.4 feet, MAN). ZACH WALL MAKES IT!
Score: 98-84

[04:11] Team_061 possession (Score: 98-84)
Draymond Banchero drives and kicks out. Jayson Holiday attempts a 3Pt. Contested by Derrick Mitchell (4.5 feet, ZONE). JAYSON HOLIDAY MAKES IT! Assist: Brandon Russell
Score: 101-84

[03:52] Team_090 possession (Score: 101-84)
FOUL! Holding foul on Brandon Russell. [Team fouls: 4] No free throws, side out. (Brandon Russell: 2 personal fouls)

[03:37] Team_090 possession (Score: 101-84)
Larry Bridges attempts a Layup. Contested by Jayson Holiday (5.4 feet, MAN). LARRY BRIDGES MAKES IT! Assist: Derrick Mitchell
Score: 101-86

[03:20] Team_061 possession (Score: 101-86)
Bam Sexton commits a violation (traveling/carry)! TURNOVER! (dead ball)

[03:20] Substitution (Team_061): Brandon Russell OUT → Evan Rose IN (stamina_rule2)

[03:20] Substitution (Team_061): Jayson Holiday OUT → Gary Fox IN (stamina_rule2)

[03:20] Substitution (Team_061): Michael Russell OUT → Desmond Morant IN (stamina_rule2)

[03:20] Substitution (Team_061): Bam Sexton OUT → Stephen Towns IN (stamina_rule2)

[03:20] Substitution (Team_061): Draymond Banchero OUT → Tim Durant IN (stamina_rule2)

[03:20] Substitution (Team_090): Derrick Mitchell OUT → OG Anunoby IN (stamina_rule2)

[03:20] Substitution (Team_090): Larry Bridges OUT → Josh Wall IN (stamina_rule2)

[03:20] Substitution (Team_090): Zach Wall OUT → Russell Smith IN (stamina_rule2)

[03:20] Substitution (Team_090): Gary Brogdon OUT → Derrick Nowitzki IN (stamina_rule2)

[03:20] Substitution (Team_090): Tracy Adebayo OUT → Tobias Tatum IN (stamina_rule2)

[03:07] Team_090 possession (Score: 101-86)
Russell Smith drives and kicks out. Derrick Nowitzki attempts a 3Pt. Contested by Desmond Morant (4.5 feet, ZONE). Derrick Nowitzki misses. Rebound secured by Stephen Towns.

[02:54] Team_061 possession (Score: 101-86)
Gary Fox makes the Midrange and draws the foul on Derrick Nowitzki! And-1! Gary Fox to the line for 1. [BONUS: 6 team fouls] (Derrick Nowitzki: 1 personal fouls)   FT 1/1: GOOD Gary Fox makes 1/1 from the line.
Score: 104-86

[02:37] Team_090 possession (Score: 104-86)
Derrick Nowitzki drives to the basket... Derrick Nowitzki throws a bad pass out of bounds! TURNOVER! (dead ball)

[02:25] Team_061 possession (Score: 104-86)
Gary Fox attempts a 3Pt. Contested by Josh Wall (4.2 feet, MAN). Gary Fox misses. Rebound secured by Derrick Nowitzki.

[02:11] Team_090 possession (Score: 104-86)
Tobias Tatum attempts a Midrange. Contested by Tim Durant (4.9 feet, MAN). Tobias Tatum misses. Rebound secured by Tim Durant.

[01:53] Team_061 possession (Score: 104-86)
FOUL! Shooting foul on Russell Smith. Tim Durant to the line for 3 free throws. [BONUS: 7 team fouls] (Russell Smith: 1 personal fouls)   FT 1/3: GOOD   FT 2/3: GOOD   FT 3/3: GOOD Tim Durant makes 3/3 from the line.
Score: 107-86

[01:40] Team_090 possession (Score: 107-86)
Tobias Tatum drives to the basket... Tobias Tatum throws a bad pass out of bounds! TURNOVER! (dead ball)

[01:25] Team_061 possession (Score: 107-86)
Gary Fox attempts a 3Pt. Contested by Russell Smith (4.4 feet, ZONE). Gary Fox misses. Offensive rebound by Stephen Towns! Stephen Towns kicks it out.

[01:07] Team_061 possession (Score: 107-86)
Evan Rose attempts a Midrange. Contested by OG Anunoby (5.3 feet, MAN). EVAN ROSE MAKES IT! Assist: Desmond Morant
Score: 109-86

[00:52] Team_090 possession (Score: 109-86)
Derrick Nowitzki attempts a Layup. BLOCKED BY STEPHEN TOWNS! Ball deflects out of bounds off Derrick Nowitzki.

[00:39] Team_061 possession (Score: 109-86)
Desmond Morant attempts a Midrange. Contested by Russell Smith (4.7 feet, MAN). Desmond Morant misses. Rebound secured by Russell Smith.

[00:25] Team_090 possession (Score: 109-86)
OG Anunoby drives, Evan Rose stays with him. OG Anunoby attempts a Layup. Contested by Evan Rose (5.1 feet, MAN). OG Anunoby misses. Offensive rebound by Tobias Tatum! Tobias Tatum kicks it out.

[00:08] Team_090 possession (Score: 109-86)
FOUL! Holding foul on Evan Rose. [IN THE BONUS! 5 team fouls] OG Anunoby to the line for 2 free throws. (Evan Rose: 1 personal fouls)   FT 1/2: GOOD   FT 2/2: GOOD OG Anunoby makes 2/2 from the line.
Score: 109-88

================================================================================
                              4TH QUARTER COMPLETE                              
================================================================================

4TH QUARTER SCORE: Team_061 32, Team_090 19

BOX SCORE:
================================================================================

Team_061
--------------------------------------------------------------------------------
Player                MIN  PTS  REB  AST  TO      FG   FG%      3P   3P%
--------------------------------------------------------------------------------
Draymond Banchero      35    9    5    1   0   4/5    80.0     0/0   0.0
Jayson Holiday         35    5    0    1   0   2/4    50.0     0/0   0.0
Bam Sexton             35    4    1    1   0   2/2   100.0     0/0   0.0
Michael Russell        35    4    3    0   0   2/2   100.0     0/0   0.0
Gary Fox               13    3    0    0   0   1/2    50.0     0/0   0.0
Tim Durant             13    3    1    0   0   1/1   100.0     0/0   0.0
Brandon Russell        35    2    0    1   0   1/2    50.0     0/0   0.0
Evan Rose              13    2    0    0   0   1/1   100.0     0/0   0.0
Stephen Towns          13    0    2    0   0   0/0     0.0     0/0   0.0
Desmond Morant         13    0    0    1   0   0/1     0.0     0/0   0.0

TEAM: FG: 14/20 (70.0%), 3PT: 3/6 (50.0%), REB: 12 (2 off, 10 def), AST: 5, TO: 1
TEAM FOULS: 5 [Team_090 in BONUS]


Team_090
--------------------------------------------------------------------------------
Player                MIN  PTS  REB  AST  TO      FG   FG%      3P   3P%
--------------------------------------------------------------------------------
Derrick Mitchell       35    8    0    2   0   3/3   100.0     0/0   0.0
Zach Wall              35    4    3    1   0   2/4    50.0     0/0   0.0
Tracy Adebayo          35    3    3    0   0   1/3    33.3     0/0   0.0
Larry Bridges          35    2    0    1   0   1/4    25.0     0/0   0.0
OG Anunoby             13    2    0    0   0   1/1   100.0     0/0   0.0
Gary Brogdon           35    0    1    0   0   0/1     0.0     0/0   0.0
Russell Smith          13    0    1    0   0   0/1     0.0     0/0   0.0
Derrick Nowitzki       13    0    1    0   0   0/1     0.0     0/0   0.0
Tobias Tatum           13    0    1    0   0   0/1     0.0     0/0   0.0

TEAM: FG: 8/19 (42.1%), 3PT: 1/4 (25.0%), REB: 10 (4 off, 6 def), AST: 4, TO: 2
TEAM FOULS: 7 [Team_061 in BONUS]

================================================================================

================================================================================
                               FULL GAME COMPLETE                               
================================================================================

FINAL SCORE: Team_061 109, Team_090 88

SCORING BY QUARTER:
--------------------------------------------------------------------------------
Team                     Q1     Q2     Q3     Q4    FINAL
--------------------------------------------------------------------------------
Team_061                 28     29     20     32      109
Team_090                 34     12     23     19       88
--------------------------------------------------------------------------------

FULL GAME BOX SCORE:
================================================================================

Team_061
--------------------------------------------------------------------------------
Player                MIN  PTS  REB  AST  TO      FG   FG%      3P   3P%      FT STL BLK
--------------------------------------------------------------------------------
Brandon Russell        35   10    0    3   0   7/13   53.8   2/7    28.6   1/1     1   1
Jayson Holiday         35   13    0    2   0   4/12   33.3   3/6    50.0   7/7     0   0
Michael Russell        35   21   13    1   0   8/12   66.7   1/3    33.3   7/7     0   0
Bam Sexton             35   15    6    1   1   7/12   58.3   0/1     0.0   3/3     2   0
Draymond Banchero      35   18    9    3   0   8/14   57.1   0/0     0.0   1/2     2   1
Evan Rose              13    7    0    1   1   2/3    66.7   0/0     0.0   3/3     1   0
Gary Fox               13    6    0    0   0   3/5    60.0   2/3    66.7   4/6     0   0
Desmond Morant         13    3    2    1   0   1/4    25.0   1/2    50.0   0/0     0   0
Stephen Towns          13    4    8    1   0   2/3    66.7   0/0     0.0   2/4     0   1
Tim Durant             13   10    6    0   1   2/3    66.7   1/1   100.0   3/3     0   0

TEAM: FG: 46/83 (55.4%), 3PT: 10/23 (43.5%), REB: 46 (12 off, 34 def), AST: 13, TO: 3


Team_090
--------------------------------------------------------------------------------
Player                MIN  PTS  REB  AST  TO      FG   FG%      3P   3P%      FT STL BLK
--------------------------------------------------------------------------------
Derrick Mitchell       35   16    0    5   3   3/8    37.5   1/4    25.0   0/0     0   1
Larry Bridges          35    5    0    2   0   3/6    50.0   1/2    50.0   0/0     0   1
Zach Wall              35   27   15    4   3  12/20   60.0   2/4    50.0   5/5     0   0
Gary Brogdon           35   18   13    0   4   5/7    71.4   2/3    66.7   3/3     0   0
Tracy Adebayo          35    8   11    4   1   5/9    55.6   0/0     0.0   2/2     0   0
OG Anunoby             13    2    0    1   2   0/2     0.0   0/1     0.0   2/2     1   0
Josh Wall              13    2    0    1   0   1/1   100.0   0/0     0.0   0/0     0   0
Russell Smith          13    0    2    2   0   0/3     0.0   0/1     0.0   0/0     0   1
Derrick Nowitzki       13    7    4    0   1   3/7    42.9   1/1   100.0   0/0     0   0
Tobias Tatum           13    3    6    1   1   1/5    20.0   1/2    50.0   0/0     0   1

TEAM: FG: 35/70 (50.0%), 3PT: 8/18 (44.4%), REB: 49 (14 off, 35 def), AST: 20, TO: 15

================================================================================
