================================================================================
                        FULL GAME - Team_057 vs Team_039                        
================================================================================

================================================================================
                       1ST QUARTER - Team_057 vs Team_039                       
================================================================================

[12:00] Team_057 possession (Score: 0-0)
Klay Rozier attempts a Midrange. Contested by Austin O'Neal (4.1 feet, ZONE). Klay Rozier misses. Rebound secured by Donovan Markkanen.

[11:49] Team_039 possession (Score: 0-0)
Austin O'Neal attempts a Midrange. Contested by Anfernee Adebayo (4.9 feet, ZONE). Austin O'Neal misses. Rebound secured by Anfernee Adebayo.

[11:39] Team_057 possession (Score: 0-0)
Kobe Ming attempts a Layup. BLOCKED BY DONOVAN MARKKANEN! Ball is loose! Rebound secured by Austin O'Neal.

[11:25] Team_039 possession (Score: 0-0)
Jrue Bridges drives, picks up Kobe Ming. Help arrives from Klay Rozier! Jrue Bridges attempts a Dunk. Contested by Klay Rozier (4.6 feet, MAN). Jrue Bridges misses. Rebound secured by Ben Adebayo.

[11:11] Team_057 possession (Score: 0-0)
Klay Rozier attempts a Layup. Contested by Donovan Markkanen (3.9 feet, MAN). Klay Rozier misses. Offensive rebound by Miles Middleton! Miles Middleton kicks it out.

[10:55] Team_057 possession (Score: 0-0)
Kobe Ming attempts a 3Pt. Contested by Jrue Bridges (3.4 feet, ZONE). Kobe Ming misses. Rebound secured by Austin O'Neal.

[10:44] Team_039 possession (Score: 0-0)
Klay Wade drives and kicks out. Austin O'Neal attempts a Midrange. Contested by Anfernee Adebayo (4.8 feet, MAN). AUSTIN O'NEAL MAKES IT! Assist: Klay Wade
Score: 0-2

[10:26] Team_057 possession (Score: 0-2)
Kobe Ming drives to the basket... Kobe Ming loses the ball! Stripped by Jrue Bridges! TURNOVER! (live ball)

[10:15] Team_039 possession (Score: 0-2)
Klay Wade drives to the basket... Klay Wade commits a violation (traveling/carry)! TURNOVER! (dead ball)

[09:57] Team_057 possession (Score: 0-2)
Kobe Ming drives to the basket... FOUL! Offensive foul on Kobe Ming! Jrue Bridges drew the charge! [Team fouls: 1] (Kobe Ming: 1 personal fouls) TURNOVER! (dead ball)

[09:43] Team_039 possession (Score: 0-2)
FOUL! Shooting foul on Kobe Ming. Jrue Bridges to the line for 2 free throws. [Team fouls: 2] (Kobe Ming: 2 personal fouls)   FT 1/2: GOOD   FT 2/2: GOOD Jrue Bridges makes 2/2 from the line.
Score: 0-4

[09:26] Team_057 possession (Score: 0-4)
Anfernee Adebayo attempts a 3Pt. Contested by Jrue Bridges (3.5 feet, ZONE). Anfernee Adebayo misses. Offensive rebound by Miles Middleton! Miles Middleton kicks it out.

[09:12] Team_057 possession (Score: 0-4)
Klay Rozier attempts a Layup. Contested by Klay Wade (4.1 feet, ZONE). KLAY ROZIER MAKES IT! Assist: Miles Middleton
Score: 2-4

[08:57] Team_039 possession (Score: 2-4)
Austin O'Neal attempts a 3Pt. Contested by Kobe Ming (4.5 feet, ZONE). AUSTIN O'NEAL MAKES IT! Assist: Jrue Bridges
Score: 2-7

[08:46] Team_057 possession (Score: 2-7)
Miles Middleton attempts a Midrange. Wide open! Anfernee Carter is 6.5 feet away. [ZONE] Miles Middleton misses. FOUL! Loose ball foul on Donovan Markkanen during the rebound battle. [Team fouls: 1] No free throws, side out. (Donovan Markkanen: 1 personal fouls)

[08:33] Team_057 possession (Score: 2-7)
Ben Adebayo makes the Midrange and draws the foul on Klay Wade! And-1! Ben Adebayo to the line for 1. [Team fouls: 2] (Klay Wade: 1 personal fouls)   FT 1/1: GOOD Ben Adebayo makes 1/1 from the line.
Score: 5-7

[08:19] Team_039 possession (Score: 5-7)
Donovan Markkanen attempts a 3Pt. Contested by Klay Rozier (3.9 feet, MAN). Donovan Markkanen misses. Offensive rebound by Klay Wade! Klay Wade kicks it out.

[08:03] Team_039 possession (Score: 5-7)
Donovan Markkanen attempts a 3Pt. Contested by Kobe Ming (4.7 feet, ZONE). Donovan Markkanen misses. Rebound secured by Anfernee Adebayo.

[07:51] Team_057 possession (Score: 5-7)
Klay Rozier makes the Layup and draws the foul on Klay Wade! And-1! Klay Rozier to the line for 1. [Team fouls: 3] (Klay Wade: 2 personal fouls)   FT 1/1: GOOD Klay Rozier makes 1/1 from the line.
Score: 8-7

[07:37] Team_039 possession (Score: 8-7)
FOUL! Reach-in foul on Miles Middleton during the drive. [Team fouls: 3] No free throws, side out. (Miles Middleton: 1 personal fouls)

[07:19] Team_039 possession (Score: 8-7)
Klay Wade drives and kicks out. FOUL! Shooting foul on Anfernee Adebayo. Austin O'Neal to the line for 3 free throws. [Team fouls: 4] (Anfernee Adebayo: 1 personal fouls)   FT 1/3: GOOD   FT 2/3: GOOD   FT 3/3: GOOD Austin O'Neal makes 3/3 from the line.
Score: 8-10

[07:07] Team_057 possession (Score: 8-10)
Kobe Ming attempts a 3Pt. Contested by Jrue Bridges (3.4 feet, ZONE). KOBE MING MAKES IT! Assist: Anfernee Adebayo
Score: 11-10

[06:54] Team_039 possession (Score: 11-10)
Austin O'Neal attempts a 3Pt. Contested by Kobe Ming (4.5 feet, ZONE). Austin O'Neal misses. Offensive rebound by Klay Wade! Klay Wade kicks it out.

[06:37] Team_039 possession (Score: 11-10)
Austin O'Neal drives, picks up Ben Adebayo. Help arrives from Klay Rozier! Austin O'Neal attempts a Layup. Contested by Klay Rozier (4.6 feet, ZONE). AUSTIN O'NEAL MAKES IT!
Score: 11-12

[06:24] Team_057 possession (Score: 11-12)
Ben Adebayo attempts a Midrange. Wide open! Anfernee Carter is 7.2 feet away. [ZONE] BEN ADEBAYO MAKES IT! Assist: Anfernee Adebayo
Score: 13-12

[06:07] Team_039 possession (Score: 13-12)
Anfernee Carter makes the Midrange and draws the foul on Ben Adebayo! And-1! Anfernee Carter to the line for 1. [BONUS: 5 team fouls] (Ben Adebayo: 1 personal fouls)   FT 1/1: GOOD Anfernee Carter makes 1/1 from the line.
Score: 13-15

[05:52] Team_057 possession (Score: 13-15)
Anfernee Adebayo attempts a 3Pt. Contested by Austin O'Neal (4.4 feet, MAN). Anfernee Adebayo misses. Rebound secured by Austin O'Neal.

[05:38] Team_039 possession (Score: 13-15)
Donovan Markkanen attempts a 3Pt. Contested by Klay Rozier (3.9 feet, MAN). Donovan Markkanen misses. Rebound secured by Miles Middleton.

[05:20] Team_057 possession (Score: 13-15)
Klay Rozier attempts a 3Pt. Contested by Jrue Bridges (3.3 feet, ZONE). Klay Rozier misses. Rebound secured by Donovan Markkanen.

[05:05] Team_039 possession (Score: 13-15)
Austin O'Neal loses the ball! Stripped by Anfernee Adebayo! TURNOVER! (live ball)

[04:46] Team_057 possession (Score: 13-15)
Kobe Ming loses control! Ball rolls out of bounds! TURNOVER! (dead ball)

[04:32] Team_039 possession (Score: 13-15)
Jrue Bridges attempts a Layup. Contested by Kobe Ming (4.7 feet, MAN). JRUE BRIDGES MAKES IT! Assist: Klay Wade
Score: 13-17

[04:19] Team_057 possession (Score: 13-17)
Kobe Ming attempts a 3Pt. Contested by Jrue Bridges (3.5 feet, ZONE). Kobe Ming misses. Offensive rebound by Miles Middleton! Miles Middleton kicks it out.

[04:07] Team_057 possession (Score: 13-17)
Miles Middleton makes the Layup and draws the foul on Klay Wade! And-1! Miles Middleton to the line for 1. [Team fouls: 4] (Klay Wade: 3 personal fouls)   FT 1/1: GOOD Miles Middleton makes 1/1 from the line.
Score: 16-17

[03:55] Team_039 possession (Score: 16-17)
Jrue Bridges drives and kicks out. FOUL! Shooting foul on Kobe Ming. Jrue Bridges to the line for 2 free throws. [BONUS: 6 team fouls] (Kobe Ming: 3 personal fouls)   FT 1/2: MISS   FT 2/2: GOOD Jrue Bridges makes 1/2 from the line.
Score: 16-18

[03:39] Team_057 possession (Score: 16-18)
Anfernee Adebayo attempts a Midrange. Contested by Austin O'Neal (4.6 feet, MAN). Anfernee Adebayo misses. Offensive rebound by Miles Middleton! Miles Middleton kicks it out.

[03:21] Team_057 possession (Score: 16-18)
FOUL! Holding foul on Klay Wade. [IN THE BONUS! 5 team fouls] Ben Adebayo to the line for 2 free throws. (Klay Wade: 4 personal fouls)   FT 1/2: MISS   FT 2/2: GOOD Ben Adebayo makes 1/2 from the line.
Score: 17-18

[03:04] Team_039 possession (Score: 17-18)
FOUL! Holding foul on Miles Middleton. [IN THE BONUS! 7 team fouls] Klay Wade to the line for 2 free throws. (Miles Middleton: 2 personal fouls)   FT 1/2: GOOD   FT 2/2: GOOD Klay Wade makes 2/2 from the line.
Score: 17-20

[02:52] Team_057 possession (Score: 17-20)
FOUL! Holding foul on Klay Wade. [IN THE BONUS! 6 team fouls] Miles Middleton to the line for 2 free throws. (Klay Wade: 5 personal fouls)   FT 1/2: MISS   FT 2/2: GOOD Miles Middleton makes 1/2 from the line.
Score: 18-20

[02:33] Team_039 possession (Score: 18-20)
Anfernee Carter attempts a Midrange. Contested by Ben Adebayo (4.9 feet, MAN). Anfernee Carter misses. Rebound secured by Miles Middleton.

[02:16] Team_057 possession (Score: 18-20)
Ben Adebayo attempts a 3Pt. Contested by Jrue Bridges (3.9 feet, ZONE). Ben Adebayo misses. Rebound secured by Donovan Markkanen.

[02:03] Team_039 possession (Score: 18-20)
Austin O'Neal makes the Dunk and draws the foul on Anfernee Adebayo! And-1! Austin O'Neal to the line for 1. [BONUS: 8 team fouls] (Anfernee Adebayo: 2 personal fouls)   FT 1/1: GOOD Austin O'Neal makes 1/1 from the line.
Score: 18-23

[01:48] Team_057 possession (Score: 18-23)
FOUL! Holding foul on Austin O'Neal. [IN THE BONUS! 7 team fouls] Anfernee Adebayo to the line for 2 free throws. (Austin O'Neal: 1 personal fouls)   FT 1/2: GOOD   FT 2/2: GOOD Anfernee Adebayo makes 2/2 from the line.
Score: 20-23

[01:36] Team_039 possession (Score: 20-23)
Donovan Markkanen commits a violation (traveling/carry)! TURNOVER! (dead ball)

[01:36] Substitution (Team_057): Kobe Ming OUT → Scottie Johnson IN (stamina_rule2)

[01:36] Substitution (Team_057): Klay Rozier OUT → Bradley Ginobili IN (stamina_rule2)

[01:36] Substitution (Team_057): Anfernee Adebayo OUT → Joel Wade IN (stamina_rule2)

[01:36] Substitution (Team_057): Ben Adebayo OUT → Lamelo Irving IN (stamina_rule2)

[01:36] Substitution (Team_057): Miles Middleton OUT → Zion Lillard IN (stamina_rule2)

[01:36] Substitution (Team_039): Jrue Bridges OUT → Tracy Mitchell IN (stamina_rule2)

[01:36] Substitution (Team_039): Donovan Markkanen OUT → Jayson Cunningham IN (stamina_rule2)

[01:36] Substitution (Team_039): Austin O'Neal OUT → Yao Carter IN (stamina_rule2)

[01:36] Substitution (Team_039): Anfernee Carter OUT → Victor Gasol IN (stamina_rule2)

[01:36] Substitution (Team_039): Klay Wade OUT → Bam Booker IN (stamina_rule2)

[01:24] Team_057 possession (Score: 20-23)
Zion Lillard makes the Midrange and draws the foul on Bam Booker! And-1! Zion Lillard to the line for 1. [BONUS: 8 team fouls] (Bam Booker: 1 personal fouls)   FT 1/1: GOOD Zion Lillard makes 1/1 from the line.
Score: 23-23

[01:11] Team_039 possession (Score: 23-23)
FOUL! Shooting foul on Scottie Johnson. Tracy Mitchell to the line for 2 free throws. [BONUS: 9 team fouls] (Scottie Johnson: 1 personal fouls)   FT 1/2: GOOD   FT 2/2: MISS Tracy Mitchell makes 1/2 from the line. Offensive rebound by Victor Gasol! Victor Gasol kicks it out.
Score: 23-24

[00:58] Team_039 possession (Score: 23-24)
FOUL! Reach-in foul on Lamelo Irving during the drive. [IN THE BONUS! 10 team fouls] Tracy Mitchell to the line for 2 free throws. (Lamelo Irving: 1 personal fouls)   FT 1/2: MISS   FT 2/2: GOOD Tracy Mitchell makes 1/2 from the line.
Score: 23-25

[00:46] Team_057 possession (Score: 23-25)
Zion Lillard attempts a Midrange. Contested by Bam Booker (4.9 feet, MAN). Zion Lillard misses. Rebound secured by Yao Carter.

[00:33] Team_039 possession (Score: 23-25)
FOUL! Offensive foul on Victor Gasol! Lamelo Irving drew the charge! [Team fouls: 9] (Victor Gasol: 1 personal fouls) TURNOVER! (dead ball)

[00:17] Team_057 possession (Score: 23-25)
FOUL! Reach-in foul on Victor Gasol during the drive. [IN THE BONUS! 10 team fouls] Lamelo Irving to the line for 2 free throws. (Victor Gasol: 2 personal fouls)   FT 1/2: GOOD   FT 2/2: GOOD Lamelo Irving makes 2/2 from the line.
Score: 25-25

[00:02] Team_039 possession (Score: 25-25)
Victor Gasol attempts a 3Pt. Contested by Lamelo Irving (5.0 feet, MAN). VICTOR GASOL MAKES IT! Assist: Bam Booker
Score: 25-28

================================================================================
                              1ST QUARTER COMPLETE                              
================================================================================

1ST QUARTER SCORE: Team_057 25, Team_039 28

BOX SCORE:
================================================================================

Team_057
--------------------------------------------------------------------------------
Player                MIN  PTS  REB  AST  TO      FG   FG%      3P   3P%
--------------------------------------------------------------------------------
Ben Adebayo            11    6    2    0   0   3/4    75.0     0/0   0.0
Klay Rozier            11    5    0    0   0   2/4    50.0     0/0   0.0
Miles Middleton        11    4    6    1   0   2/2   100.0     0/0   0.0
Kobe Ming              11    3    0    0   0   1/3    33.3     0/0   0.0
Zion Lillard            2    3    0    0   0   1/2    50.0     0/0   0.0
Anfernee Adebayo       11    2    2    2   0   1/2    50.0     0/0   0.0
Lamelo Irving           2    2    0    0   0   1/1   100.0     0/0   0.0

TEAM: FG: 11/18 (61.1%), 3PT: 1/5 (20.0%), REB: 10 (5 off, 5 def), AST: 3, TO: 3
TEAM FOULS: 10 [Team_039 in BONUS]


Team_039
--------------------------------------------------------------------------------
Player                MIN  PTS  REB  AST  TO      FG   FG%      3P   3P%
--------------------------------------------------------------------------------
Austin O'Neal          11   13    3    0   0   5/6    83.3     0/0   0.0
Jrue Bridges           11    5    0    1   0   3/4    75.0     0/0   0.0
Anfernee Carter        11    3    0    0   0   1/2    50.0     0/0   0.0
Victor Gasol            2    3    1    0   0   1/1   100.0     0/0   0.0
Klay Wade              11    2    2    2   0   1/1   100.0     0/0   0.0
Tracy Mitchell          2    1    0    0   0   1/1   100.0     0/0   0.0
Donovan Markkanen      11    0    3    0   0   0/2     0.0     0/0   0.0
Yao Carter              2    0    1    0   0   0/0     0.0     0/0   0.0
Bam Booker              2    0    0    1   0   0/0     0.0     0/0   0.0

TEAM: FG: 12/17 (70.6%), 3PT: 2/4 (50.0%), REB: 10 (3 off, 7 def), AST: 4, TO: 4
TEAM FOULS: 10 [Team_057 in BONUS]

================================================================================

================================================================================
                       2ND QUARTER - Team_057 vs Team_039                       
================================================================================

[12:00] Team_057 possession (Score: 25-28)
Ben Adebayo drives and kicks out. Kobe Ming attempts a 3Pt. Contested by Jrue Bridges (3.2 feet, MAN). Kobe Ming misses. Rebound secured by Klay Wade.

[11:47] Team_039 possession (Score: 25-28)
Klay Wade attempts a Layup. Contested by Miles Middleton (5.1 feet, MAN). KLAY WADE MAKES IT!
Score: 25-30

[11:30] Team_057 possession (Score: 25-30)
Ben Adebayo attempts a 3Pt. Contested by Jrue Bridges (3.7 feet, ZONE). Ben Adebayo misses. Rebound secured by Donovan Markkanen.

[11:14] Team_039 possession (Score: 25-30)
FOUL! Holding foul on Miles Middleton. [Team fouls: 1] No free throws, side out. (Miles Middleton: 1 personal fouls)

[10:59] Team_039 possession (Score: 25-30)
Anfernee Carter attempts a 3Pt. Contested by Ben Adebayo (4.8 feet, MAN). ANFERNEE CARTER MAKES IT! Assist: Klay Wade
Score: 25-33

[10:45] Team_057 possession (Score: 25-33)
Miles Middleton attempts a 3Pt. Contested by Jrue Bridges (3.2 feet, ZONE). Miles Middleton misses. Rebound secured by Donovan Markkanen.

[10:31] Team_039 possession (Score: 25-33)
Donovan Markkanen drives to the basket... Donovan Markkanen loses control! Ball rolls out of bounds! TURNOVER! (dead ball)

[10:31] Substitution (Team_057): Anfernee Adebayo OUT → Joel Wade IN (stamina_rule2)

[10:31] Substitution (Team_039): Austin O'Neal OUT → Yao Carter IN (stamina_rule2)

[10:31] Substitution (Team_039): Anfernee Carter OUT → Victor Gasol IN (stamina_rule2)

[10:22] Team_057 possession (Score: 25-33)
Miles Middleton attempts a Midrange. Contested by Yao Carter (4.0 feet, ZONE). Miles Middleton misses. Offensive rebound by Ben Adebayo! Ben Adebayo kicks it out.

[10:13] Team_057 possession (Score: 25-33)
Klay Rozier drives, picks up Klay Wade. Help arrives from Donovan Markkanen! Klay Rozier attempts a Layup. Contested by Donovan Markkanen (4.4 feet, ZONE). KLAY ROZIER MAKES IT!
Score: 27-33

[09:54] Team_039 possession (Score: 27-33)
Jrue Bridges attempts a 3Pt. Contested by Kobe Ming (4.9 feet, ZONE). Jrue Bridges misses. FOUL! Loose ball foul on Ben Adebayo during the rebound battle. [Team fouls: 2] No free throws, side out. (Ben Adebayo: 1 personal fouls)

[09:37] Team_039 possession (Score: 27-33)
Jrue Bridges drives and kicks out. Victor Gasol attempts a 3Pt. Contested by Joel Wade (5.4 feet, ZONE). VICTOR GASOL MAKES IT! Assist: Donovan Markkanen
Score: 27-36

[09:23] Team_057 possession (Score: 27-36)
Ben Adebayo attempts a Midrange. Contested by Donovan Markkanen (4.5 feet, ZONE). BEN ADEBAYO MAKES IT!
Score: 29-36

[09:10] Team_039 possession (Score: 29-36)
Victor Gasol makes the Layup and draws the foul on Ben Adebayo! And-1! Victor Gasol to the line for 1. [Team fouls: 3] (Ben Adebayo: 2 personal fouls)   FT 1/1: GOOD Victor Gasol makes 1/1 from the line.
Score: 29-39

[08:53] Team_057 possession (Score: 29-39)
FOUL! Reach-in foul on Donovan Markkanen during the drive. [Team fouls: 1] No free throws, side out. (Donovan Markkanen: 1 personal fouls)

[08:38] Team_057 possession (Score: 29-39)
FOUL! Shooting foul on Klay Wade. Miles Middleton to the line for 2 free throws. [Team fouls: 2] (Klay Wade: 1 personal fouls)   FT 1/2: GOOD   FT 2/2: MISS Miles Middleton makes 1/2 from the line. Rebound secured by Klay Wade.
Score: 30-39

[08:28] Team_039 possession (Score: 30-39)
Donovan Markkanen attempts a 3Pt. Contested by Kobe Ming (5.1 feet, ZONE). Donovan Markkanen misses. Offensive rebound by Victor Gasol! Victor Gasol kicks it out.

[08:12] Team_039 possession (Score: 30-39)
FOUL! Reach-in foul on Miles Middleton during the drive. [Team fouls: 4] No free throws, side out. (Miles Middleton: 2 personal fouls)

[07:53] Team_039 possession (Score: 30-39)
Victor Gasol makes the 3Pt and draws the foul on Kobe Ming! And-1! Victor Gasol to the line for 1. [BONUS: 5 team fouls] (Kobe Ming: 1 personal fouls)   FT 1/1: GOOD Victor Gasol makes 1/1 from the line.
Score: 30-43

[07:43] Team_057 possession (Score: 30-43)
Miles Middleton attempts a Midrange. Contested by Klay Wade (4.4 feet, MAN). Miles Middleton misses. Rebound secured by Klay Wade.

[07:32] Team_039 possession (Score: 30-43)
Klay Wade makes the Layup and draws the foul on Miles Middleton! And-1! Klay Wade to the line for 1. [BONUS: 6 team fouls] (Miles Middleton: 3 personal fouls)   FT 1/1: GOOD Klay Wade makes 1/1 from the line.
Score: 30-46

[07:21] Team_057 possession (Score: 30-46)
Kobe Ming drives and kicks out. Klay Rozier attempts a 3Pt. Contested by Donovan Markkanen (4.3 feet, MAN). Klay Rozier misses. FOUL! Loose ball foul on Klay Wade during the rebound battle. [Team fouls: 3] No free throws, side out. (Klay Wade: 2 personal fouls)

[07:06] Team_057 possession (Score: 30-46)
Kobe Ming drives and kicks out. Klay Rozier attempts a 3Pt. Contested by Donovan Markkanen (4.4 feet, MAN). Klay Rozier misses. Offensive rebound by Ben Adebayo! Ben Adebayo kicks it out.

[06:53] Team_057 possession (Score: 30-46)
Kobe Ming attempts a 3Pt. Contested by Jrue Bridges (4.1 feet, MAN). Kobe Ming misses. Rebound secured by Victor Gasol.

[06:39] Team_039 possession (Score: 30-46)
Donovan Markkanen attempts a 3Pt. Contested by Klay Rozier (4.6 feet, ZONE). Donovan Markkanen misses. Rebound secured by Ben Adebayo.

[06:24] Team_057 possession (Score: 30-46)
Joel Wade makes the Midrange and draws the foul on Yao Carter! And-1! Joel Wade to the line for 1. [Team fouls: 4] (Yao Carter: 1 personal fouls)   FT 1/1: MISS Joel Wade makes 0/1 from the line. Rebound secured by Victor Gasol.
Score: 32-46

[06:14] Team_039 possession (Score: 32-46)
Jrue Bridges drives, Ben Adebayo stays with him. Jrue Bridges attempts a Dunk. Contested by Ben Adebayo (5.3 feet, ZONE). JRUE BRIDGES MAKES IT!
Score: 32-48

[06:00] Team_057 possession (Score: 32-48)
FOUL! Shooting foul on Victor Gasol. Ben Adebayo to the line for 2 free throws. [BONUS: 5 team fouls] (Victor Gasol: 1 personal fouls)   FT 1/2: GOOD   FT 2/2: GOOD Ben Adebayo makes 2/2 from the line.
Score: 34-48

[05:51] Team_039 possession (Score: 34-48)
Klay Wade throws a bad pass! Stolen by Miles Middleton! TURNOVER! (live ball)

[05:39] Team_057 possession (Score: 34-48)
Kobe Ming attempts a 3Pt. Contested by Jrue Bridges (4.4 feet, ZONE). Kobe Ming misses. Offensive rebound by Miles Middleton! Miles Middleton kicks it out.

[05:25] Team_057 possession (Score: 34-48)
Joel Wade attempts a 3Pt. Contested by Yao Carter (4.0 feet, MAN). Joel Wade misses. Offensive rebound by Miles Middleton! Miles Middleton kicks it out.

[05:07] Team_057 possession (Score: 34-48)
Joel Wade drives and kicks out. Miles Middleton attempts a 3Pt. Contested by Victor Gasol (3.3 feet, MAN). Miles Middleton misses. Rebound secured by Victor Gasol.

[04:52] Team_039 possession (Score: 34-48)
Jrue Bridges attempts a 3Pt. Contested by Kobe Ming (5.5 feet, MAN). Jrue Bridges misses. Rebound secured by Miles Middleton.

[04:37] Team_057 possession (Score: 34-48)
FOUL! Reach-in foul on Yao Carter during the drive. [IN THE BONUS! 6 team fouls] Joel Wade to the line for 2 free throws. (Yao Carter: 2 personal fouls)   FT 1/2: GOOD   FT 2/2: GOOD Joel Wade makes 2/2 from the line.
Score: 36-48

[04:23] Team_039 possession (Score: 36-48)
Jrue Bridges drives, Ben Adebayo stays with him. Jrue Bridges attempts a Dunk. Contested by Ben Adebayo (5.6 feet, ZONE). JRUE BRIDGES MAKES IT! Assist: Klay Wade
Score: 36-50

[04:08] Team_057 possession (Score: 36-50)
Joel Wade attempts a Midrange. Contested by Klay Wade (5.0 feet, ZONE). JOEL WADE MAKES IT!
Score: 38-50

[03:51] Team_039 possession (Score: 38-50)
Klay Wade attempts a Midrange. Contested by Ben Adebayo (6.0 feet, ZONE). Klay Wade misses. Offensive rebound by Victor Gasol! Victor Gasol kicks it out.

[03:39] Team_039 possession (Score: 38-50)
Jrue Bridges drives to the basket... Jrue Bridges loses the ball! Stripped by Kobe Ming! TURNOVER! (live ball)

[03:29] Team_057 possession (Score: 38-50)
Miles Middleton attempts a Midrange. BLOCKED BY VICTOR GASOL! Ball deflects out of bounds off Miles Middleton.

[03:17] Team_039 possession (Score: 38-50)
Klay Wade commits a violation (traveling/carry)! TURNOVER! (dead ball)

[03:17] Substitution (Team_057): Kobe Ming OUT → Scottie Johnson IN (stamina_rule2)

[03:17] Substitution (Team_057): Klay Rozier OUT → Bradley Ginobili IN (stamina_rule2)

[03:17] Substitution (Team_057): Ben Adebayo OUT → Lamelo Irving IN (stamina_rule2)

[03:17] Substitution (Team_057): Miles Middleton OUT → Zion Lillard IN (stamina_rule2)

[03:17] Substitution (Team_039): Jrue Bridges OUT → Tracy Mitchell IN (stamina_rule2)

[03:17] Substitution (Team_039): Donovan Markkanen OUT → Jayson Cunningham IN (stamina_rule2)

[03:17] Substitution (Team_039): Klay Wade OUT → Bam Booker IN (stamina_rule2)

[03:06] Team_057 possession (Score: 38-50)
Zion Lillard drives, picks up Bam Booker. Help arrives from Tracy Mitchell! Zion Lillard attempts a Layup. Contested by Tracy Mitchell (4.9 feet, MAN). Zion Lillard misses. Offensive rebound by Lamelo Irving! Lamelo Irving kicks it out.

[02:50] Team_057 possession (Score: 38-50)
Joel Wade attempts a Midrange. Contested by Bam Booker (4.5 feet, ZONE). JOEL WADE MAKES IT!
Score: 40-50

[02:40] Team_039 possession (Score: 40-50)
Bam Booker attempts a Midrange. Contested by Joel Wade (5.9 feet, ZONE). Bam Booker misses. Offensive rebound by Yao Carter! Yao Carter kicks it out.

[02:23] Team_039 possession (Score: 40-50)
Bam Booker throws a bad pass! Stolen by Zion Lillard! TURNOVER! (live ball)

[02:09] Team_057 possession (Score: 40-50)
FOUL! Shooting foul on Tracy Mitchell. Scottie Johnson to the line for 3 free throws. [BONUS: 7 team fouls] (Tracy Mitchell: 1 personal fouls)   FT 1/3: GOOD   FT 2/3: GOOD   FT 3/3: GOOD Scottie Johnson makes 3/3 from the line.
Score: 43-50

[01:58] Team_039 possession (Score: 43-50)
FOUL! Holding foul on Scottie Johnson. [IN THE BONUS! 7 team fouls] Tracy Mitchell to the line for 2 free throws. (Scottie Johnson: 1 personal fouls)   FT 1/2: MISS   FT 2/2: MISS Tracy Mitchell makes 0/2 from the line. Rebound secured by Zion Lillard.

[01:46] Team_057 possession (Score: 43-50)
Joel Wade attempts a Midrange. Contested by Yao Carter (4.4 feet, MAN). JOEL WADE MAKES IT!
Score: 45-50

[01:36] Team_039 possession (Score: 45-50)
Tracy Mitchell attempts a 3Pt. Contested by Scottie Johnson (5.3 feet, ZONE). Tracy Mitchell misses. Rebound secured by Lamelo Irving.

[01:24] Team_057 possession (Score: 45-50)
Bradley Ginobili makes the Midrange and draws the foul on Jayson Cunningham! And-1! Bradley Ginobili to the line for 1. [BONUS: 8 team fouls] (Jayson Cunningham: 1 personal fouls)   FT 1/1: GOOD Bradley Ginobili makes 1/1 from the line.
Score: 48-50

[01:08] Team_039 possession (Score: 48-50)
Jayson Cunningham attempts a 3Pt. Contested by Bradley Ginobili (5.1 feet, MAN). Jayson Cunningham misses. Rebound secured by Zion Lillard.

[00:58] Team_057 possession (Score: 48-50)
FOUL! Shooting foul on Jayson Cunningham. Bradley Ginobili to the line for 2 free throws. [BONUS: 9 team fouls] (Jayson Cunningham: 2 personal fouls)   FT 1/2: GOOD   FT 2/2: GOOD Bradley Ginobili makes 2/2 from the line.
Score: 50-50

[00:44] Team_039 possession (Score: 50-50)
Jayson Cunningham attempts a 3Pt. Contested by Lamelo Irving (5.0 feet, ZONE). Jayson Cunningham misses. Rebound secured by Lamelo Irving.

[00:31] Team_057 possession (Score: 50-50)
Bradley Ginobili drives, Victor Gasol stays with him. Bradley Ginobili attempts a Layup. Contested by Victor Gasol (4.2 feet, ZONE). BRADLEY GINOBILI MAKES IT! Assist: Scottie Johnson
Score: 52-50

[00:19] Team_039 possession (Score: 52-50)
Tracy Mitchell attempts a 3Pt. Contested by Scottie Johnson (5.3 feet, MAN). Tracy Mitchell misses. Rebound secured by Joel Wade.

[00:02] Team_057 possession (Score: 52-50)
Zion Lillard drives to the basket... FOUL! Offensive foul on Zion Lillard! Bam Booker drew the charge! [Team fouls: 8] (Zion Lillard: 1 personal fouls) TURNOVER! (dead ball)

================================================================================
                              2ND QUARTER COMPLETE                              
================================================================================

2ND QUARTER SCORE: Team_057 27, Team_039 22

BOX SCORE:
================================================================================

Team_057
--------------------------------------------------------------------------------
Player                MIN  PTS  REB  AST  TO      FG   FG%      3P   3P%
--------------------------------------------------------------------------------
Joel Wade              12    8    1    0   0   4/6    66.7     0/0   0.0
Bradley Ginobili        5    7    0    0   0   3/3   100.0     0/0   0.0
Ben Adebayo            20    4    3    0   0   2/4    50.0     0/0   0.0
Scottie Johnson         5    3    0    1   0   1/1   100.0     0/0   0.0
Klay Rozier            20    2    0    0   0   1/1   100.0     0/0   0.0
Miles Middleton        20    0    4    0   0   0/4     0.0     0/0   0.0
Kobe Ming              20    0    0    0   0   0/1     0.0     0/0   0.0
Lamelo Irving           5    0    3    0   0   0/0     0.0     0/0   0.0
Zion Lillard            5    0    2    0   0   0/0     0.0     0/0   0.0

TEAM: FG: 11/20 (55.0%), 3PT: 1/4 (25.0%), REB: 13 (6 off, 7 def), AST: 1, TO: 1
TEAM FOULS: 8 [Team_039 in BONUS]


Team_039
--------------------------------------------------------------------------------
Player                MIN  PTS  REB  AST  TO      FG   FG%      3P   3P%
--------------------------------------------------------------------------------
Victor Gasol           12   10    6    0   0   3/3   100.0     0/0   0.0
Klay Wade              20    5    3    2   0   2/2   100.0     0/0   0.0
Jrue Bridges           20    4    0    0   0   2/3    66.7     0/0   0.0
Anfernee Carter        12    3    0    0   0   1/1   100.0     0/0   0.0
Donovan Markkanen      20    0    2    1   0   0/1     0.0     0/0   0.0
Yao Carter             12    0    1    0   0   0/0     0.0     0/0   0.0
Tracy Mitchell          5    0    0    0   0   0/2     0.0     0/0   0.0
Jayson Cunningham       5    0    0    0   0   0/2     0.0     0/0   0.0

TEAM: FG: 8/15 (53.3%), 3PT: 2/8 (25.0%), REB: 12 (4 off, 8 def), AST: 3, TO: 5
TEAM FOULS: 9 [Team_057 in BONUS]

================================================================================

================================================================================
                       3RD QUARTER - Team_057 vs Team_039                       
================================================================================

[12:00] Team_057 possession (Score: 52-50)
Klay Rozier attempts a Layup. Wide open! Anfernee Carter is 6.8 feet away. [ZONE] KLAY ROZIER MAKES IT!
Score: 54-50

[11:45] Team_039 possession (Score: 54-50)
Austin O'Neal attempts a 3Pt. Contested by Anfernee Adebayo (4.9 feet, MAN). AUSTIN O'NEAL MAKES IT! Assist: Jrue Bridges
Score: 54-53

[11:29] Team_057 possession (Score: 54-53)
Kobe Ming throws a bad pass out of bounds! TURNOVER! (dead ball)

[11:13] Team_039 possession (Score: 54-53)
Jrue Bridges drives and kicks out. Anfernee Carter attempts a 3Pt. Contested by Kobe Ming (4.4 feet, ZONE). Anfernee Carter misses. Offensive rebound by Klay Wade! Klay Wade kicks it out.

[11:03] Team_039 possession (Score: 54-53)
Austin O'Neal attempts a 3Pt. Contested by Kobe Ming (4.5 feet, ZONE). AUSTIN O'NEAL MAKES IT! Assist: Klay Wade
Score: 54-56

[10:49] Team_057 possession (Score: 54-56)
Kobe Ming drives, picks up Klay Wade. Help arrives from Donovan Markkanen! Kobe Ming attempts a Layup. Contested by Donovan Markkanen (4.3 feet, ZONE). Kobe Ming misses. Rebound secured by Austin O'Neal.

[10:32] Team_039 possession (Score: 54-56)
Klay Wade drives, Ben Adebayo stays with him. Klay Wade attempts a Layup. Contested by Ben Adebayo (5.0 feet, ZONE). KLAY WADE MAKES IT! Assist: Anfernee Carter
Score: 54-58

[10:14] Team_057 possession (Score: 54-58)
Ben Adebayo attempts a 3Pt. Contested by Klay Wade (4.5 feet, MAN). Ben Adebayo misses. FOUL! Loose ball foul on Austin O'Neal during the rebound battle. [Team fouls: 1] No free throws, side out. (Austin O'Neal: 1 personal fouls)

[09:59] Team_057 possession (Score: 54-58)
FOUL! Shooting foul on Jrue Bridges. Kobe Ming to the line for 2 free throws. [Team fouls: 2] (Jrue Bridges: 1 personal fouls)   FT 1/2: GOOD   FT 2/2: GOOD Kobe Ming makes 2/2 from the line.
Score: 56-58

[09:46] Team_039 possession (Score: 56-58)
Klay Wade drives to the basket... Klay Wade throws a bad pass! Stolen by Ben Adebayo! TURNOVER! (live ball)

[09:27] Team_057 possession (Score: 56-58)
Miles Middleton attempts a Layup. Contested by Klay Wade (3.9 feet, MAN). Miles Middleton misses. Rebound secured by Klay Wade.

[09:14] Team_039 possession (Score: 56-58)
Donovan Markkanen makes the Dunk and draws the foul on Klay Rozier! And-1! Donovan Markkanen to the line for 1. [Team fouls: 1] (Klay Rozier: 1 personal fouls)   FT 1/1: GOOD Donovan Markkanen makes 1/1 from the line.
Score: 56-61

[09:02] Team_057 possession (Score: 56-61)
Miles Middleton attempts a Midrange. Contested by Klay Wade (3.9 feet, MAN). Miles Middleton misses. Rebound secured by Donovan Markkanen.

[08:51] Team_039 possession (Score: 56-61)
Anfernee Carter attempts a 3Pt. Contested by Klay Rozier (3.9 feet, ZONE). ANFERNEE CARTER MAKES IT! Assist: Donovan Markkanen
Score: 56-64

[08:36] Team_057 possession (Score: 56-64)
FOUL! Holding foul on Klay Wade. [Team fouls: 3] No free throws, side out. (Klay Wade: 1 personal fouls)

[08:22] Team_057 possession (Score: 56-64)
Ben Adebayo throws a bad pass out of bounds! TURNOVER! (dead ball)

[08:07] Team_039 possession (Score: 56-64)
Donovan Markkanen attempts a 3Pt. Contested by Klay Rozier (3.9 feet, ZONE). Donovan Markkanen misses. Offensive rebound by Klay Wade! Klay Wade kicks it out.

[07:55] Team_039 possession (Score: 56-64)
FOUL! Shooting foul on Klay Rozier. Donovan Markkanen to the line for 2 free throws. [Team fouls: 2] (Klay Rozier: 2 personal fouls)   FT 1/2: GOOD   FT 2/2: GOOD Donovan Markkanen makes 2/2 from the line.
Score: 56-66

[07:42] Team_057 possession (Score: 56-66)
Anfernee Adebayo drives and kicks out. Miles Middleton attempts a 3Pt. Contested by Klay Wade (4.0 feet, MAN). Miles Middleton misses. FOUL! Loose ball foul on Klay Wade during the rebound battle. [Team fouls: 4] No free throws, side out. (Klay Wade: 2 personal fouls)

[07:28] Team_057 possession (Score: 56-66)
Anfernee Adebayo drives and kicks out. Kobe Ming attempts a Midrange. Contested by Jrue Bridges (3.1 feet, MAN). Kobe Ming misses. Rebound secured by Austin O'Neal.

[07:15] Team_039 possession (Score: 56-66)
Jrue Bridges attempts a 3Pt. Contested by Kobe Ming (4.6 feet, MAN). Jrue Bridges misses. Offensive rebound by Austin O'Neal! Austin O'Neal kicks it out.

[06:58] Team_039 possession (Score: 56-66)
Austin O'Neal attempts a 3Pt. Contested by Anfernee Adebayo (4.9 feet, MAN). Austin O'Neal misses. Rebound secured by Anfernee Adebayo.

[06:43] Team_057 possession (Score: 56-66)
Klay Rozier attempts a Midrange. Wide open! Anfernee Carter is 6.8 feet away. [ZONE] KLAY ROZIER MAKES IT!
Score: 58-66

[06:27] Team_039 possession (Score: 58-66)
Jrue Bridges attempts a Midrange. Contested by Anfernee Adebayo (5.0 feet, ZONE). Jrue Bridges misses. Rebound secured by Ben Adebayo.

[06:13] Team_057 possession (Score: 58-66)
Ben Adebayo makes the Layup and draws the foul on Klay Wade! And-1! Ben Adebayo to the line for 1. [BONUS: 5 team fouls] (Klay Wade: 3 personal fouls)   FT 1/1: GOOD Ben Adebayo makes 1/1 from the line.
Score: 61-66

[05:58] Team_039 possession (Score: 61-66)
FOUL! Shooting foul on Miles Middleton. Klay Wade to the line for 2 free throws. [Team fouls: 3] (Miles Middleton: 1 personal fouls)   FT 1/2: GOOD   FT 2/2: GOOD Klay Wade makes 2/2 from the line.
Score: 61-68

[05:46] Team_057 possession (Score: 61-68)
FOUL! Shooting foul on Jrue Bridges. Kobe Ming to the line for 2 free throws. [BONUS: 6 team fouls] (Jrue Bridges: 2 personal fouls)   FT 1/2: MISS   FT 2/2: GOOD Kobe Ming makes 1/2 from the line.
Score: 62-68

[05:29] Team_039 possession (Score: 62-68)
Jrue Bridges attempts a 3Pt. Contested by Kobe Ming (4.6 feet, MAN). JRUE BRIDGES MAKES IT! Assist: Anfernee Carter
Score: 62-71

[05:12] Team_057 possession (Score: 62-71)
Klay Rozier drives, Klay Wade stays with him. Klay Rozier attempts a Dunk. Contested by Klay Wade (4.1 feet, ZONE). Klay Rozier misses. Rebound secured by Donovan Markkanen.

[04:56] Team_039 possession (Score: 62-71)
FOUL! Shooting foul on Ben Adebayo. Austin O'Neal to the line for 3 free throws. [Team fouls: 4] (Ben Adebayo: 1 personal fouls)   FT 1/3: GOOD   FT 2/3: GOOD   FT 3/3: MISS Austin O'Neal makes 2/3 from the line. Offensive rebound by Klay Wade! Klay Wade kicks it out.
Score: 62-73

[04:44] Team_039 possession (Score: 62-73)
FOUL! Shooting foul on Klay Rozier. Donovan Markkanen to the line for 2 free throws. [BONUS: 5 team fouls] (Klay Rozier: 3 personal fouls)   FT 1/2: GOOD   FT 2/2: GOOD Donovan Markkanen makes 2/2 from the line.
Score: 62-75

[04:25] Team_057 possession (Score: 62-75)
Miles Middleton drives and kicks out. Miles Middleton attempts a Midrange. Contested by Klay Wade (4.0 feet, MAN). Miles Middleton misses. Rebound secured by Austin O'Neal.

[04:07] Team_039 possession (Score: 62-75)
Donovan Markkanen drives and kicks out. Donovan Markkanen attempts a 3Pt. Contested by Kobe Ming (4.5 feet, ZONE). DONOVAN MARKKANEN MAKES IT! Assist: Jrue Bridges
Score: 62-78

[03:49] Team_057 possession (Score: 62-78)
Miles Middleton attempts a Layup. Contested by Klay Wade (3.9 feet, MAN). MILES MIDDLETON MAKES IT! Assist: Anfernee Adebayo
Score: 64-78

[03:37] Team_039 possession (Score: 64-78)
Jrue Bridges attempts a Layup. BLOCKED BY KOBE MING! Ball is loose! Offensive rebound by Austin O'Neal! Austin O'Neal kicks it out.

[03:24] Team_039 possession (Score: 64-78)
Anfernee Carter drives to the basket... Anfernee Carter loses the ball! Stripped by Ben Adebayo! TURNOVER! (live ball)

[03:14] Team_057 possession (Score: 64-78)
FOUL! Shooting foul on Klay Wade. Klay Rozier to the line for 2 free throws. [BONUS: 7 team fouls] (Klay Wade: 4 personal fouls)   FT 1/2: GOOD   FT 2/2: GOOD Klay Rozier makes 2/2 from the line.
Score: 66-78

[03:03] Team_039 possession (Score: 66-78)
FOUL! Reach-in foul on Anfernee Adebayo during the drive. [IN THE BONUS! 6 team fouls] Austin O'Neal to the line for 2 free throws. (Anfernee Adebayo: 1 personal fouls)   FT 1/2: MISS   FT 2/2: GOOD Austin O'Neal makes 1/2 from the line.
Score: 66-79

[02:48] Team_057 possession (Score: 66-79)
Kobe Ming attempts a Layup. Contested by Klay Wade (4.4 feet, ZONE). KOBE MING MAKES IT! Assist: Klay Rozier
Score: 68-79

[02:36] Team_039 possession (Score: 68-79)
Klay Wade drives to the basket... Klay Wade throws a bad pass out of bounds! TURNOVER! (dead ball)

[02:36] Substitution (Team_057): Klay Rozier OUT → Bradley Ginobili IN (stamina_rule2)

[02:36] Substitution (Team_057): Anfernee Adebayo OUT → Joel Wade IN (stamina_rule2)

[02:36] Substitution (Team_057): Ben Adebayo OUT → Lamelo Irving IN (stamina_rule2)

[02:36] Substitution (Team_057): Miles Middleton OUT → Zion Lillard IN (stamina_rule2)

[02:36] Substitution (Team_039): Jrue Bridges OUT → Tracy Mitchell IN (stamina_rule2)

[02:36] Substitution (Team_039): Austin O'Neal OUT → Yao Carter IN (stamina_rule2)

[02:36] Substitution (Team_039): Anfernee Carter OUT → Victor Gasol IN (stamina_rule2)

[02:20] Team_057 possession (Score: 68-79)
Zion Lillard attempts a Layup. BLOCKED BY KLAY WADE! Ball is loose! Rebound secured by Donovan Markkanen.

[02:06] Team_039 possession (Score: 68-79)
Klay Wade drives to the basket... FOUL! Offensive foul on Klay Wade! Zion Lillard drew the charge! [Team fouls: 8] (Klay Wade: 5 personal fouls) TURNOVER! (dead ball)

[01:48] Team_057 possession (Score: 68-79)
Joel Wade attempts a Midrange. Contested by Yao Carter (4.0 feet, MAN). JOEL WADE MAKES IT!
Score: 70-79

[01:33] Team_039 possession (Score: 70-79)
Tracy Mitchell attempts a 3Pt. Contested by Kobe Ming (5.3 feet, MAN). Tracy Mitchell misses. Rebound secured by Zion Lillard.

[01:17] Team_057 possession (Score: 70-79)
Bradley Ginobili throws a bad pass out of bounds! TURNOVER! (dead ball)

[01:17] Substitution (Team_057): Kobe Ming OUT → Scottie Johnson IN (stamina_rule2)

[01:17] Substitution (Team_039): Donovan Markkanen OUT → Jayson Cunningham IN (stamina_rule2)

[01:17] Substitution (Team_039): Klay Wade OUT → Bam Booker IN (stamina_rule2)

[01:02] Team_039 possession (Score: 70-79)
Victor Gasol attempts a 3Pt. Contested by Lamelo Irving (5.0 feet, MAN). Victor Gasol misses. Rebound secured by Zion Lillard.

[00:47] Team_057 possession (Score: 70-79)
Zion Lillard attempts a Midrange. Contested by Bam Booker (4.9 feet, MAN). Zion Lillard misses. Rebound secured by Yao Carter.

[00:33] Team_039 possession (Score: 70-79)
Jayson Cunningham attempts a 3Pt. Contested by Lamelo Irving (5.0 feet, ZONE). Jayson Cunningham misses. Rebound secured by Zion Lillard.

[00:23] Team_057 possession (Score: 70-79)
Bradley Ginobili attempts a 3Pt. Contested by Tracy Mitchell (5.9 feet, ZONE). Bradley Ginobili misses. Rebound secured by Victor Gasol.

[00:13] Team_039 possession (Score: 70-79)
Victor Gasol makes the Midrange and draws the foul on Lamelo Irving! And-1! Victor Gasol to the line for 1. [BONUS: 7 team fouls] (Lamelo Irving: 1 personal fouls)   FT 1/1: GOOD Victor Gasol makes 1/1 from the line.
Score: 70-82

[00:01] Team_057 possession (Score: 70-82)
Zion Lillard drives and kicks out. Joel Wade attempts a 3Pt. Contested by Tracy Mitchell (5.6 feet, ZONE). JOEL WADE MAKES IT! Assist: Bradley Ginobili
Score: 73-82

================================================================================
                              3RD QUARTER COMPLETE                              
================================================================================

3RD QUARTER SCORE: Team_057 21, Team_039 32

BOX SCORE:
================================================================================

Team_057
--------------------------------------------------------------------------------
Player                MIN  PTS  REB  AST  TO      FG   FG%      3P   3P%
--------------------------------------------------------------------------------
Klay Rozier            29    6    0    1   0   3/4    75.0     0/0   0.0
Kobe Ming              30    5    0    0   0   3/4    75.0     0/0   0.0
Joel Wade              15    5    0    0   0   2/2   100.0     0/0   0.0
Ben Adebayo            29    3    2    0   0   1/1   100.0     0/0   0.0
Miles Middleton        29    2    1    0   0   1/4    25.0     0/0   0.0
Anfernee Adebayo       22    0    1    1   0   0/1     0.0     0/0   0.0
Zion Lillard            7    0    3    0   0   0/2     0.0     0/0   0.0
Bradley Ginobili        7    0    0    1   0   0/1     0.0     0/0   0.0

TEAM: FG: 10/19 (52.6%), 3PT: 0/1 (0.0%), REB: 7 (2 off, 5 def), AST: 3, TO: 3
TEAM FOULS: 7 [Team_039 in BONUS]


Team_039
--------------------------------------------------------------------------------
Player                MIN  PTS  REB  AST  TO      FG   FG%      3P   3P%
--------------------------------------------------------------------------------
Donovan Markkanen      30   10    3    1   0   4/4   100.0     0/0   0.0
Austin O'Neal          22    7    5    0   0   3/4    75.0     0/0   0.0
Klay Wade              30    4    4    1   0   2/2   100.0     0/0   0.0
Jrue Bridges           29    3    0    2   0   1/2    50.0     0/0   0.0
Anfernee Carter        22    3    0    2   0   1/1   100.0     0/0   0.0
Victor Gasol           15    3    1    0   0   1/2    50.0     0/0   0.0
Tracy Mitchell          7    0    0    0   0   0/1     0.0     0/0   0.0
Yao Carter             15    0    1    0   0   0/0     0.0     0/0   0.0
Jayson Cunningham       6    0    0    0   0   0/1     0.0     0/0   0.0

TEAM: FG: 12/17 (70.6%), 3PT: 4/8 (50.0%), REB: 14 (5 off, 9 def), AST: 6, TO: 4
TEAM FOULS: 8 [Team_057 in BONUS]

================================================================================

================================================================================
                       4TH QUARTER - Team_057 vs Team_039                       
================================================================================

[12:00] Team_057 possession (Score: 73-82)
Miles Middleton attempts a Layup. Contested by Klay Wade (4.0 feet, MAN). Miles Middleton misses. Offensive rebound by Ben Adebayo! Ben Adebayo kicks it out.

[11:46] Team_057 possession (Score: 73-82)
Ben Adebayo attempts a 3Pt. Contested by Jrue Bridges (3.6 feet, ZONE). Ben Adebayo misses. Rebound secured by Jrue Bridges.

[11:31] Team_039 possession (Score: 73-82)
Austin O'Neal attempts a Midrange. Contested by Klay Rozier (3.7 feet, ZONE). AUSTIN O'NEAL MAKES IT!
Score: 73-84

[11:12] Team_057 possession (Score: 73-84)
FOUL! Offensive foul on Anfernee Adebayo! Austin O'Neal drew the charge! [Team fouls: 1] (Anfernee Adebayo: 1 personal fouls) TURNOVER! (dead ball)

[11:01] Team_039 possession (Score: 73-84)
Anfernee Carter attempts a 3Pt. Contested by Ben Adebayo (4.7 feet, MAN). Anfernee Carter misses. Rebound secured by Ben Adebayo.

[10:48] Team_057 possession (Score: 73-84)
FOUL! Reach-in foul on Klay Wade during the drive. [Team fouls: 1] No free throws, side out. (Klay Wade: 1 personal fouls)

[10:31] Team_057 possession (Score: 73-84)
Klay Rozier makes the Layup and draws the foul on Donovan Markkanen! And-1! Klay Rozier to the line for 1. [Team fouls: 2] (Donovan Markkanen: 1 personal fouls)   FT 1/1: GOOD Klay Rozier makes 1/1 from the line.
Score: 76-84

[10:16] Team_039 possession (Score: 76-84)
Anfernee Carter attempts a Layup. Contested by Ben Adebayo (4.8 feet, ZONE). ANFERNEE CARTER MAKES IT! Assist: Klay Wade
Score: 76-86

[10:00] Team_057 possession (Score: 76-86)
FOUL! Holding foul on Klay Wade. [Team fouls: 3] No free throws, side out. (Klay Wade: 2 personal fouls)

[09:42] Team_057 possession (Score: 76-86)
Miles Middleton attempts a Layup. Contested by Klay Wade (4.2 feet, MAN). MILES MIDDLETON MAKES IT! Assist: Klay Rozier
Score: 78-86

[09:29] Team_039 possession (Score: 78-86)
Austin O'Neal attempts a Layup. Contested by Ben Adebayo (4.7 feet, ZONE). Austin O'Neal misses. Offensive rebound by Klay Wade! Klay Wade kicks it out.

[09:15] Team_039 possession (Score: 78-86)
FOUL! Shooting foul on Anfernee Adebayo. Austin O'Neal to the line for 2 free throws. [Team fouls: 2] (Anfernee Adebayo: 2 personal fouls)   FT 1/2: GOOD   FT 2/2: MISS Austin O'Neal makes 1/2 from the line. Rebound secured by Anfernee Adebayo.
Score: 78-87

[09:03] Team_057 possession (Score: 78-87)
Anfernee Adebayo attempts a Midrange. Contested by Austin O'Neal (4.7 feet, MAN). Anfernee Adebayo misses. Rebound secured by Jrue Bridges.

[08:47] Team_039 possession (Score: 78-87)
Donovan Markkanen attempts a 3Pt. Contested by Klay Rozier (4.1 feet, MAN). Donovan Markkanen misses. Rebound secured by Ben Adebayo.

[08:32] Team_057 possession (Score: 78-87)
Kobe Ming drives, picks up Klay Wade. Help arrives from Donovan Markkanen! Kobe Ming attempts a Dunk. Contested by Donovan Markkanen (4.7 feet, ZONE). KOBE MING MAKES IT! Assist: Anfernee Adebayo
Score: 80-87

[08:17] Team_039 possession (Score: 80-87)
Anfernee Carter drives, Ben Adebayo stays with him. Anfernee Carter attempts a Dunk. Contested by Ben Adebayo (5.0 feet, ZONE). ANFERNEE CARTER MAKES IT!
Score: 80-89

[08:03] Team_057 possession (Score: 80-89)
Ben Adebayo attempts a 3Pt. Contested by Jrue Bridges (4.0 feet, ZONE). Ben Adebayo misses. Rebound secured by Austin O'Neal.

[07:45] Team_039 possession (Score: 80-89)
Donovan Markkanen attempts a Midrange. Contested by Klay Rozier (4.2 feet, MAN). DONOVAN MARKKANEN MAKES IT!
Score: 80-91

[07:30] Team_057 possession (Score: 80-91)
Klay Rozier attempts a 3Pt. Contested by Donovan Markkanen (4.4 feet, MAN). Klay Rozier misses. Rebound secured by Klay Wade.

[07:15] Team_039 possession (Score: 80-91)
Austin O'Neal attempts a Layup. Contested by Ben Adebayo (4.9 feet, ZONE). AUSTIN O'NEAL MAKES IT! Assist: Klay Wade
Score: 80-93

[06:59] Team_057 possession (Score: 80-93)
Miles Middleton attempts a Midrange. Contested by Klay Wade (4.5 feet, MAN). Miles Middleton misses. Rebound secured by Klay Wade.

[06:46] Team_039 possession (Score: 80-93)
Austin O'Neal attempts a Layup. Contested by Ben Adebayo (5.0 feet, ZONE). AUSTIN O'NEAL MAKES IT!
Score: 80-95

[06:32] Team_057 possession (Score: 80-95)
Anfernee Adebayo throws a bad pass out of bounds! TURNOVER! (dead ball)

[06:32] Substitution (Team_057): Kobe Ming OUT → Scottie Johnson IN (stamina_rule2)

[06:32] Substitution (Team_057): Klay Rozier OUT → Bradley Ginobili IN (stamina_rule2)

[06:32] Substitution (Team_057): Anfernee Adebayo OUT → Joel Wade IN (stamina_rule2)

[06:32] Substitution (Team_057): Ben Adebayo OUT → Lamelo Irving IN (stamina_rule2)

[06:32] Substitution (Team_057): Miles Middleton OUT → Zion Lillard IN (stamina_rule2)

[06:32] Substitution (Team_039): Jrue Bridges OUT → Tracy Mitchell IN (stamina_rule2)

[06:32] Substitution (Team_039): Donovan Markkanen OUT → Jayson Cunningham IN (stamina_rule2)

[06:32] Substitution (Team_039): Austin O'Neal OUT → Yao Carter IN (stamina_rule2)

[06:32] Substitution (Team_039): Anfernee Carter OUT → Victor Gasol IN (stamina_rule2)

[06:32] Substitution (Team_039): Klay Wade OUT → Bam Booker IN (stamina_rule2)

[06:17] Team_039 possession (Score: 80-95)
FOUL! Holding foul on Bradley Ginobili. [Team fouls: 3] No free throws, side out. (Bradley Ginobili: 1 personal fouls)

[06:00] Team_039 possession (Score: 80-95)
Yao Carter attempts a 3Pt. Contested by Lamelo Irving (4.9 feet, ZONE). YAO CARTER MAKES IT! Assist: Jayson Cunningham
Score: 80-98

[05:42] Team_057 possession (Score: 80-98)
FOUL! Reach-in foul on Tracy Mitchell during the drive. [Team fouls: 4] No free throws, side out. (Tracy Mitchell: 1 personal fouls)

[05:28] Team_057 possession (Score: 80-98)
FOUL! Shooting foul on Victor Gasol. Lamelo Irving to the line for 2 free throws. [BONUS: 5 team fouls] (Victor Gasol: 1 personal fouls)   FT 1/2: GOOD   FT 2/2: GOOD Lamelo Irving makes 2/2 from the line.
Score: 82-98

[05:10] Team_039 possession (Score: 82-98)
Tracy Mitchell attempts a 3Pt. Contested by Scottie Johnson (5.3 feet, ZONE). TRACY MITCHELL MAKES IT! Assist: Jayson Cunningham
Score: 82-101

[04:56] Team_057 possession (Score: 82-101)
FOUL! Holding foul on Yao Carter. [IN THE BONUS! 6 team fouls] Joel Wade to the line for 2 free throws. (Yao Carter: 1 personal fouls)   FT 1/2: GOOD   FT 2/2: GOOD Joel Wade makes 2/2 from the line.
Score: 84-101

[04:43] Team_039 possession (Score: 84-101)
Yao Carter attempts a Midrange. Contested by Joel Wade (5.5 feet, ZONE). Yao Carter misses. Rebound secured by Lamelo Irving.

[04:27] Team_057 possession (Score: 84-101)
Scottie Johnson attempts a 3Pt. Contested by Tracy Mitchell (5.8 feet, MAN). Scottie Johnson misses. Offensive rebound by Lamelo Irving! Lamelo Irving kicks it out.

[04:16] Team_057 possession (Score: 84-101)
Lamelo Irving drives and kicks out. Bradley Ginobili attempts a 3Pt. Contested by Jayson Cunningham (5.6 feet, MAN). BRADLEY GINOBILI MAKES IT! Assist: Scottie Johnson
Score: 87-101

[04:03] Team_039 possession (Score: 87-101)
Jayson Cunningham drives to the basket... Jayson Cunningham commits a violation (traveling/carry)! TURNOVER! (dead ball)

[03:53] Team_057 possession (Score: 87-101)
Lamelo Irving attempts a 3Pt. Contested by Yao Carter (4.8 feet, ZONE). Lamelo Irving misses. Rebound secured by Victor Gasol.

[03:37] Team_039 possession (Score: 87-101)
Tracy Mitchell loses control! Ball rolls out of bounds! TURNOVER! (dead ball)

[03:24] Team_057 possession (Score: 87-101)
Joel Wade drives, picks up Victor Gasol. Help arrives from Tracy Mitchell! Joel Wade attempts a Layup. Contested by Tracy Mitchell (3.2 feet, ZONE). JOEL WADE MAKES IT! Assist: Zion Lillard
Score: 89-101

[03:07] Team_039 possession (Score: 89-101)
Jayson Cunningham attempts a 3Pt. Contested by Scottie Johnson (5.0 feet, ZONE). Jayson Cunningham misses. Rebound secured by Zion Lillard.

[02:54] Team_057 possession (Score: 89-101)
Zion Lillard attempts a Layup. BLOCKED BY TRACY MITCHELL! Ball is loose! Rebound secured by Victor Gasol.

[02:38] Team_039 possession (Score: 89-101)
Bam Booker drives, Lamelo Irving stays with him. Bam Booker attempts a Layup. Contested by Lamelo Irving (5.1 feet, ZONE). BAM BOOKER MAKES IT! Assist: Victor Gasol
Score: 89-103

[02:24] Team_057 possession (Score: 89-103)
FOUL! Holding foul on Bam Booker. [IN THE BONUS! 7 team fouls] Zion Lillard to the line for 2 free throws. (Bam Booker: 1 personal fouls)   FT 1/2: MISS   FT 2/2: MISS Zion Lillard makes 0/2 from the line. Rebound secured by Bam Booker.

[02:08] Team_039 possession (Score: 89-103)
FOUL! Shooting foul on Lamelo Irving. Yao Carter to the line for 2 free throws. [Team fouls: 4] (Lamelo Irving: 1 personal fouls)   FT 1/2: MISS   FT 2/2: GOOD Yao Carter makes 1/2 from the line.
Score: 89-104

[01:54] Team_057 possession (Score: 89-104)
Scottie Johnson attempts a 3Pt. Contested by Tracy Mitchell (5.8 feet, ZONE). SCOTTIE JOHNSON MAKES IT! Assist: Bradley Ginobili
Score: 92-104

[01:41] Team_039 possession (Score: 92-104)
FOUL! Shooting foul on Lamelo Irving. Yao Carter to the line for 2 free throws. [BONUS: 5 team fouls] (Lamelo Irving: 2 personal fouls)   FT 1/2: GOOD   FT 2/2: GOOD Yao Carter makes 2/2 from the line.
Score: 92-106

[01:26] Team_057 possession (Score: 92-106)
FOUL! Reach-in foul on Yao Carter during the drive. [IN THE BONUS! 8 team fouls] Joel Wade to the line for 2 free throws. (Yao Carter: 2 personal fouls)   FT 1/2: GOOD   FT 2/2: GOOD Joel Wade makes 2/2 from the line.
Score: 94-106

[01:08] Team_039 possession (Score: 94-106)
Tracy Mitchell attempts a Layup. Contested by Lamelo Irving (5.4 feet, ZONE). TRACY MITCHELL MAKES IT! Assist: Jayson Cunningham
Score: 94-108

[00:54] Team_057 possession (Score: 94-108)
Scottie Johnson attempts a Midrange. Contested by Tracy Mitchell (5.9 feet, MAN). SCOTTIE JOHNSON MAKES IT! Assist: Lamelo Irving
Score: 96-108

[00:40] Team_039 possession (Score: 96-108)
Bam Booker drives to the basket... Bam Booker throws a bad pass! Stolen by Zion Lillard! TURNOVER! (live ball)

[00:23] Team_057 possession (Score: 96-108)
FOUL! Holding foul on Tracy Mitchell. [IN THE BONUS! 9 team fouls] Scottie Johnson to the line for 2 free throws. (Tracy Mitchell: 2 personal fouls)   FT 1/2: GOOD   FT 2/2: GOOD Scottie Johnson makes 2/2 from the line.
Score: 98-108

[00:13] Team_039 possession (Score: 98-108)
Tracy Mitchell attempts a Layup. BLOCKED BY LAMELO IRVING! Ball is loose! Rebound secured by Zion Lillard.

================================================================================
                              4TH QUARTER COMPLETE                              
================================================================================

4TH QUARTER SCORE: Team_057 25, Team_039 26

BOX SCORE:
================================================================================

Team_057
--------------------------------------------------------------------------------
Player                MIN  PTS  REB  AST  TO      FG   FG%      3P   3P%
--------------------------------------------------------------------------------
Scottie Johnson        12    7    0    1   0   3/3   100.0     0/0   0.0
Joel Wade              21    6    0    0   0   3/3   100.0     0/0   0.0
Klay Rozier            35    3    0    1   0   1/2    50.0     0/0   0.0
Bradley Ginobili       14    3    0    1   0   1/1   100.0     0/0   0.0
Miles Middleton        35    2    0    0   0   1/2    50.0     0/0   0.0
Kobe Ming              36    2    0    0   0   1/1   100.0     0/0   0.0
Lamelo Irving          14    2    2    1   0   1/2    50.0     0/0   0.0
Ben Adebayo            35    0    3    0   0   0/2     0.0     0/0   0.0
Anfernee Adebayo       28    0    1    1   0   0/1     0.0     0/0   0.0
Zion Lillard           14    0    2    1   0   0/1     0.0     0/0   0.0

TEAM: FG: 11/19 (57.9%), 3PT: 1/5 (20.0%), REB: 8 (2 off, 6 def), AST: 6, TO: 2
TEAM FOULS: 5 [Team_039 in BONUS]


Team_039
--------------------------------------------------------------------------------
Player                MIN  PTS  REB  AST  TO      FG   FG%      3P   3P%
--------------------------------------------------------------------------------
Austin O'Neal          28    6    1    0   0   3/4    75.0     0/0   0.0
Yao Carter             21    6    0    0   0   3/4    75.0     0/0   0.0
Tracy Mitchell         14    5    0    0   0   2/3    66.7     0/0   0.0
Anfernee Carter        28    4    0    0   0   2/3    66.7     0/0   0.0
Donovan Markkanen      36    2    0    0   0   1/2    50.0     0/0   0.0
Bam Booker             12    2    1    0   0   1/1   100.0     0/0   0.0
Jrue Bridges           35    0    2    0   0   0/0     0.0     0/0   0.0
Klay Wade              36    0    3    2   0   0/0     0.0     0/0   0.0
Jayson Cunningham      12    0    0    3   0   0/1     0.0     0/0   0.0
Victor Gasol           21    0    2    1   0   0/0     0.0     0/0   0.0

TEAM: FG: 12/18 (66.7%), 3PT: 2/5 (40.0%), REB: 9 (1 off, 8 def), AST: 6, TO: 3
TEAM FOULS: 9 [Team_057 in BONUS]

================================================================================

================================================================================
                               FULL GAME COMPLETE                               
================================================================================

FINAL SCORE: Team_057 98, Team_039 108

SCORING BY QUARTER:
--------------------------------------------------------------------------------
Team                     Q1     Q2     Q3     Q4    FINAL
--------------------------------------------------------------------------------
Team_057                 25     27     21     25       98
Team_039                 28     22     32     26      108
--------------------------------------------------------------------------------

FULL GAME BOX SCORE:
================================================================================

Team_057
--------------------------------------------------------------------------------
Player                MIN  PTS  REB  AST  TO      FG   FG%      3P   3P%      FT STL BLK
--------------------------------------------------------------------------------
Kobe Ming              36   10    0    0   4   5/9    55.6   1/3    33.3   3/4     1   1
Klay Rozier            35   16    0    2   0   7/11   63.6   0/2     0.0   4/4     0   0
Ben Adebayo            35   13   10    0   1   5/10   50.0   0/4     0.0   5/6     2   0
Miles Middleton        35    8   11    1   0   3/11   27.3   0/1     0.0   3/5     1   0
Anfernee Adebayo       28    2    4    4   2   0/3     0.0   0/1     0.0   2/2     1   0
Joel Wade              21   19    1    0   0   7/9    77.8   0/0     0.0   6/7     0   0
Bradley Ginobili       14   10    0    2   1   3/4    75.0   0/1     0.0   3/3     0   0
Lamelo Irving          14    4    5    1   0   3/4    75.0   0/1     0.0   4/4     0   1
Zion Lillard           14    3    7    1   1   2/6    33.3   0/0     0.0   1/3     2   0
Scottie Johnson        12   10    0    2   0   3/3   100.0   2/2   100.0   5/5     0   0

TEAM: FG: 43/76 (56.6%), 3PT: 3/15 (20.0%), REB: 38 (15 off, 23 def), AST: 13, TO: 9


Team_039
--------------------------------------------------------------------------------
Player                MIN  PTS  REB  AST  TO      FG   FG%      3P   3P%      FT STL BLK
--------------------------------------------------------------------------------
Donovan Markkanen      36   12    8    2   4   5/9    55.6   0/4     0.0   5/5     0   1
Klay Wade              36   11   12    7   4   6/6   100.0   0/0     0.0   5/5     0   1
Jrue Bridges           35   12    2    3   1   7/10   70.0   1/2    50.0   3/4     1   0
Austin O'Neal          28   26    9    0   1   9/12   75.0   3/4    75.0   8/11    0   0
Anfernee Carter        28   13    0    2   1   5/7    71.4   2/3    66.7   1/1     0   0
Yao Carter             21    6    3    0   0   3/4    75.0   1/1   100.0   3/4     0   0
Victor Gasol           21   16   10    1   2   4/5    80.0   2/3    66.7   3/3     0   1
Tracy Mitchell         14    6    0    0   1   3/7    42.9   1/4    25.0   2/6     0   1
Jayson Cunningham      12    0    0    3   1   0/4     0.0   0/4     0.0   0/0     0   0
Bam Booker             12    2    1    1   1   1/1   100.0   0/0     0.0   0/0     0   0

TEAM: FG: 44/67 (65.7%), 3PT: 10/25 (40.0%), REB: 45 (13 off, 32 def), AST: 19, TO: 16

================================================================================
