================================================================================
                        FULL GAME - Team_074 vs Team_034                        
================================================================================

================================================================================
                       1ST QUARTER - Team_074 vs Team_034                       
================================================================================

[12:00] Team_074 possession (Score: 0-0)
Donovan Doncic attempts a Layup. BLOCKED BY TERRY DONCIC! Ball deflects out of bounds off Donovan Doncic.

[11:44] Team_034 possession (Score: 0-0)
Devin Poole drives to the basket... Devin Poole throws a bad pass! Stolen by Donovan Doncic! TURNOVER! (live ball)

[11:27] Team_074 possession (Score: 0-0)
Shai Green attempts a Layup. Contested by Cole Antetokounmpo (5.0 feet, MAN). SHAI GREEN MAKES IT! Assist: Donovan Doncic
Score: 2-0

[11:09] Team_034 possession (Score: 2-0)
Terry Doncic drives and kicks out. Devin Poole attempts a 3Pt. Contested by Donovan Doncic (3.7 feet, ZONE). Devin Poole misses. Offensive rebound by Anthony Bane! Anthony Bane kicks it out.

[10:53] Team_034 possession (Score: 2-0)
Anthony Bane attempts a 3Pt. Contested by Dwyane Quickley (5.5 feet, ZONE). Anthony Bane misses. Rebound secured by Donovan Doncic.

[10:37] Team_074 possession (Score: 2-0)
Chris Carter attempts a Midrange. BLOCKED BY COLE ANTETOKOUNMPO! Ball deflects out of bounds off Chris Carter.

[10:20] Team_034 possession (Score: 2-0)
FOUL! Shooting foul on Donovan Doncic. Terry Doncic to the line for 2 free throws. [Team fouls: 1] (Donovan Doncic: 1 personal fouls)   FT 1/2: MISS   FT 2/2: MISS Terry Doncic makes 0/2 from the line. FOUL! Loose ball foul on James Turner during the free throw rebound! [Team fouls: 2] No free throws, side out. (James Turner: 1 personal fouls)

[10:05] Team_034 possession (Score: 2-0)
FOUL! Shooting foul on Donovan Doncic. Cole Antetokounmpo to the line for 2 free throws. [Team fouls: 3] (Donovan Doncic: 2 personal fouls)   FT 1/2: GOOD   FT 2/2: GOOD Cole Antetokounmpo makes 2/2 from the line.
Score: 2-2

[09:52] Team_074 possession (Score: 2-2)
Chris Carter drives and kicks out. Donovan Doncic makes the 3Pt and draws the foul on Devin Poole! And-1! Donovan Doncic to the line for 1. [Team fouls: 1] (Devin Poole: 1 personal fouls)   FT 1/1: GOOD Donovan Doncic makes 1/1 from the line.
Score: 6-2

[09:40] Team_034 possession (Score: 6-2)
Anthony Bane drives, James Turner stays with him. Anthony Bane attempts a Dunk. Contested by James Turner (3.5 feet, MAN). ANTHONY BANE MAKES IT! Assist: Cole Antetokounmpo
Score: 6-4

[09:23] Team_074 possession (Score: 6-4)
FOUL! Holding foul on Anthony Bane. [Team fouls: 2] No free throws, side out. (Anthony Bane: 1 personal fouls)

[09:11] Team_074 possession (Score: 6-4)
Dwyane Quickley drives and kicks out. Donovan Doncic attempts a 3Pt. Contested by Terry Doncic (4.0 feet, MAN). Donovan Doncic misses. Offensive rebound by James Turner! James Turner puts it back in!
Score: 8-4

[08:59] Team_034 possession (Score: 8-4)
Terry Doncic attempts a 3Pt. Contested by Donovan Doncic (3.8 feet, MAN). TERRY DONCIC MAKES IT! Assist: Devin Poole
Score: 8-7

[08:45] Team_074 possession (Score: 8-7)
Donovan Doncic drives to the basket... Donovan Doncic loses control! Ball rolls out of bounds! TURNOVER! (dead ball)

[08:31] Team_034 possession (Score: 8-7)
Terry Doncic attempts a 3Pt. Contested by Dwyane Quickley (5.5 feet, ZONE). Terry Doncic misses. Rebound secured by Shai Green.

[08:17] Team_074 possession (Score: 8-7)
Donovan Doncic drives to the basket... FOUL! Offensive foul on Donovan Doncic! Terry Doncic drew the charge! [Team fouls: 4] (Donovan Doncic: 3 personal fouls) TURNOVER! (dead ball)

[08:04] Team_034 possession (Score: 8-7)
Anthony Bane drives and kicks out. Ben Hyland attempts a 3Pt. Contested by Chris Carter (4.2 feet, MAN). Ben Hyland misses. Offensive rebound by Terry Doncic! Terry Doncic puts it back in!
Score: 8-9

[07:47] Team_074 possession (Score: 8-9)
Dwyane Quickley drives, Devin Poole stays with him. Dwyane Quickley attempts a Dunk. Contested by Devin Poole (4.2 feet, MAN). DWYANE QUICKLEY MAKES IT! Assist: Shai Green
Score: 10-9

[07:33] Team_034 possession (Score: 10-9)
Terry Doncic makes the 3Pt and draws the foul on Dwyane Quickley! And-1! Terry Doncic to the line for 1. [BONUS: 5 team fouls] (Dwyane Quickley: 1 personal fouls)   FT 1/1: GOOD Terry Doncic makes 1/1 from the line.
Score: 10-13

[07:19] Team_074 possession (Score: 10-13)
James Turner drives, Terry Doncic stays with him. James Turner attempts a Dunk. Contested by Terry Doncic (4.7 feet, ZONE). James Turner misses. Rebound secured by Cole Antetokounmpo.

[07:02] Team_034 possession (Score: 10-13)
Ben Hyland attempts a Midrange. Contested by Chris Carter (4.3 feet, ZONE). Ben Hyland misses. Rebound secured by Shai Green.

[06:47] Team_074 possession (Score: 10-13)
Dwyane Quickley attempts a 3Pt. Contested by Devin Poole (4.2 feet, MAN). Dwyane Quickley misses. Rebound secured by Terry Doncic.

[06:33] Team_034 possession (Score: 10-13)
Terry Doncic attempts a 3Pt. Contested by Dwyane Quickley (5.5 feet, ZONE). Terry Doncic misses. FOUL! Loose ball foul on Donovan Doncic during the rebound battle. [IN THE BONUS! 6 team fouls] Anthony Bane to the line for 2 free throws. (Donovan Doncic: 4 personal fouls)   FT 1/2: GOOD   FT 2/2: GOOD Anthony Bane makes 2/2 from the line.
Score: 10-15

[06:17] Team_074 possession (Score: 10-15)
Dwyane Quickley attempts a 3Pt. Contested by Devin Poole (4.2 feet, ZONE). Dwyane Quickley misses. Rebound secured by Anthony Bane.

[06:00] Team_034 possession (Score: 10-15)
Cole Antetokounmpo attempts a 3Pt. Contested by Dwyane Quickley (5.9 feet, ZONE). Cole Antetokounmpo misses. Rebound secured by Shai Green.

[05:49] Team_074 possession (Score: 10-15)
James Turner drives, picks up Terry Doncic. Help arrives from Ben Hyland! James Turner attempts a Layup. Contested by Ben Hyland (4.7 feet, ZONE). James Turner misses. Rebound secured by Anthony Bane.

[05:31] Team_034 possession (Score: 10-15)
Anthony Bane attempts a 3Pt. Contested by James Turner (3.5 feet, MAN). Anthony Bane misses. Rebound secured by James Turner.

[05:19] Team_074 possession (Score: 10-15)
James Turner drives, Terry Doncic stays with him. James Turner attempts a Layup. Contested by Terry Doncic (4.7 feet, ZONE). James Turner misses. Offensive rebound by James Turner! James Turner puts it back in!
Score: 12-15

[05:03] Team_034 possession (Score: 12-15)
Ben Hyland attempts a 3Pt. Contested by Dwyane Quickley (5.5 feet, ZONE). Ben Hyland misses. Rebound secured by Donovan Doncic.

[04:51] Team_074 possession (Score: 12-15)
Donovan Doncic attempts a 3Pt. Contested by Terry Doncic (4.4 feet, MAN). Donovan Doncic misses. Rebound secured by Anthony Bane.

[04:38] Team_034 possession (Score: 12-15)
Devin Poole attempts a 3Pt. Contested by Dwyane Quickley (5.4 feet, ZONE). Devin Poole misses. Rebound secured by James Turner.

[04:26] Team_074 possession (Score: 12-15)
Donovan Doncic attempts a Midrange. Contested by Ben Hyland (4.0 feet, ZONE). Donovan Doncic misses. Rebound secured by Terry Doncic.

[04:11] Team_034 possession (Score: 12-15)
Ben Hyland drives to the basket... Ben Hyland throws a bad pass out of bounds! TURNOVER! (dead ball)

[03:56] Team_074 possession (Score: 12-15)
Dwyane Quickley attempts a 3Pt. Contested by Devin Poole (4.3 feet, MAN). DWYANE QUICKLEY MAKES IT! Assist: Chris Carter
Score: 15-15

[03:37] Team_034 possession (Score: 15-15)
Cole Antetokounmpo attempts a Layup. Contested by Shai Green (4.1 feet, MAN). Cole Antetokounmpo misses. Rebound secured by Shai Green.

[03:24] Team_074 possession (Score: 15-15)
FOUL! Shooting foul on Terry Doncic. Donovan Doncic to the line for 2 free throws. [Team fouls: 3] (Terry Doncic: 1 personal fouls)   FT 1/2: MISS   FT 2/2: MISS Donovan Doncic makes 0/2 from the line. Rebound secured by Cole Antetokounmpo.

[03:09] Team_034 possession (Score: 15-15)
Anthony Bane attempts a Layup. BLOCKED BY JAMES TURNER! Ball is loose! Rebound secured by James Turner.

[02:56] Team_074 possession (Score: 15-15)
Chris Carter drives, Ben Hyland stays with him. Chris Carter attempts a Layup. Contested by Ben Hyland (4.4 feet, MAN). CHRIS CARTER MAKES IT! Assist: Dwyane Quickley
Score: 17-15

[02:45] Team_034 possession (Score: 17-15)
Terry Doncic drives, Donovan Doncic stays with him. Terry Doncic attempts a Layup. Contested by Donovan Doncic (3.9 feet, MAN). TERRY DONCIC MAKES IT!
Score: 17-17

[02:30] Team_074 possession (Score: 17-17)
James Turner drives, Terry Doncic stays with him. James Turner attempts a Layup. Contested by Terry Doncic (4.9 feet, ZONE). JAMES TURNER MAKES IT! Assist: Chris Carter
Score: 19-17

[02:16] Team_034 possession (Score: 19-17)
Anthony Bane attempts a 3Pt. Contested by James Turner (3.7 feet, MAN). Anthony Bane misses. Rebound secured by James Turner.

[02:02] Team_074 possession (Score: 19-17)
Dwyane Quickley attempts a 3Pt. Contested by Devin Poole (4.5 feet, MAN). Dwyane Quickley misses. Offensive rebound by James Turner! James Turner puts it back in!
Score: 21-17

[01:48] Team_034 possession (Score: 21-17)
FOUL! Offensive foul on Anthony Bane! James Turner drew the charge! [Team fouls: 4] (Anthony Bane: 2 personal fouls) TURNOVER! (dead ball)

[01:31] Team_074 possession (Score: 21-17)
Donovan Doncic attempts a 3Pt. Contested by Devin Poole (4.7 feet, ZONE). Donovan Doncic misses. Rebound secured by Cole Antetokounmpo.

[01:21] Team_034 possession (Score: 21-17)
Ben Hyland attempts a 3Pt. Contested by Chris Carter (4.7 feet, MAN). Ben Hyland misses. Rebound secured by Shai Green.

[01:08] Team_074 possession (Score: 21-17)
James Turner attempts a Midrange. Contested by Devin Poole (5.0 feet, ZONE). James Turner misses. Rebound secured by Anthony Bane.

[00:53] Team_034 possession (Score: 21-17)
FOUL! Shooting foul on Donovan Doncic. Terry Doncic to the line for 2 free throws. [BONUS: 7 team fouls] (Donovan Doncic: 5 personal fouls)   FT 1/2: GOOD   FT 2/2: GOOD Terry Doncic makes 2/2 from the line.
Score: 21-19

[00:41] Team_074 possession (Score: 21-19)
FOUL! Offensive foul on Donovan Doncic! Terry Doncic drew the charge! [Team fouls: 8] (Donovan Doncic: 6 personal fouls) TURNOVER! (dead ball)

[00:41] Substitution (Team_074): Donovan Doncic OUT (stamina: 67) → James Barnes IN (foul_out)

[00:23] Team_034 possession (Score: 21-19)
Devin Poole attempts a Layup. Contested by James Barnes (4.1 feet, MAN). DEVIN POOLE MAKES IT! Assist: Terry Doncic
Score: 21-21

[00:10] Team_074 possession (Score: 21-21)
Shai Green attempts a 3Pt. Contested by Devin Poole (5.0 feet, ZONE). Shai Green misses. Rebound secured by Anthony Bane.

================================================================================
                              1ST QUARTER COMPLETE                              
================================================================================

1ST QUARTER SCORE: Team_074 21, Team_034 21

BOX SCORE:
================================================================================

Team_074
--------------------------------------------------------------------------------
Player                MIN  PTS  REB  AST  TO      FG   FG%      3P   3P%
--------------------------------------------------------------------------------
James Turner           12    8    7    0   0   4/7    57.1     0/0   0.0
Dwyane Quickley        12    5    0    1   0   2/4    50.0     0/0   0.0
Donovan Doncic         12    4    2    1   0   1/6    16.7     0/0   0.0
Shai Green             12    2    5    1   0   1/2    50.0     0/0   0.0
Chris Carter           12    2    0    2   0   1/2    50.0     0/0   0.0

TEAM: FG: 9/21 (42.9%), 3PT: 2/7 (28.6%), REB: 14 (3 off, 11 def), AST: 5, TO: 3
TEAM FOULS: 8 [Team_034 in BONUS]


Team_034
--------------------------------------------------------------------------------
Player                MIN  PTS  REB  AST  TO      FG   FG%      3P   3P%
--------------------------------------------------------------------------------
Terry Doncic           12   13    3    1   0   5/6    83.3     0/0   0.0
Anthony Bane           12    4    7    0   0   2/6    33.3     0/0   0.0
Cole Antetokounmpo     12    2    3    1   0   1/3    33.3     0/0   0.0
Devin Poole            12    2    0    1   0   1/2    50.0     0/0   0.0
Ben Hyland             12    0    0    0   0   0/3     0.0     0/0   0.0

TEAM: FG: 9/20 (45.0%), 3PT: 3/11 (27.3%), REB: 13 (3 off, 10 def), AST: 3, TO: 3
TEAM FOULS: 4

================================================================================

================================================================================
                       2ND QUARTER - Team_074 vs Team_034                       
================================================================================

[12:00] Team_074 possession (Score: 21-21)
Dwyane Quickley attempts a Midrange. Contested by Devin Poole (4.6 feet, MAN). DWYANE QUICKLEY MAKES IT! Assist: Chris Carter
Score: 23-21

[11:45] Team_034 possession (Score: 23-21)
Ben Hyland attempts a Midrange. Contested by Chris Carter (4.6 feet, MAN). Ben Hyland misses. Rebound secured by Donovan Doncic.

[11:28] Team_074 possession (Score: 23-21)
James Turner attempts a Midrange. Wide open! Anthony Bane is 6.1 feet away. [MAN] JAMES TURNER MAKES IT! Assist: Dwyane Quickley
Score: 25-21

[11:16] Team_034 possession (Score: 25-21)
Cole Antetokounmpo drives, picks up Shai Green. Help arrives from Chris Carter! Cole Antetokounmpo attempts a Dunk. Contested by Chris Carter (4.3 feet, MAN). COLE ANTETOKOUNMPO MAKES IT! Assist: Devin Poole
Score: 25-23

[11:00] Team_074 possession (Score: 25-23)
FOUL! Shooting foul on Ben Hyland. Chris Carter to the line for 2 free throws. [Team fouls: 1] (Ben Hyland: 1 personal fouls)   FT 1/2: GOOD   FT 2/2: GOOD Chris Carter makes 2/2 from the line.
Score: 27-23

[10:47] Team_034 possession (Score: 27-23)
Devin Poole drives to the basket... Devin Poole loses control! Ball rolls out of bounds! TURNOVER! (dead ball)

[10:47] Substitution (Team_074): Dwyane Quickley OUT → James Barnes IN (stamina_rule2)

[10:47] Substitution (Team_074): Chris Carter OUT → Giannis Westbrook IN (stamina_rule2)

[10:47] Substitution (Team_074): Shai Green OUT → Ayo Smith IN (stamina_rule2)

[10:47] Substitution (Team_074): James Turner OUT → Jaren Rozier IN (stamina_rule2)

[10:47] Substitution (Team_034): Devin Poole OUT → Manu Jokic IN (stamina_rule2)

[10:47] Substitution (Team_034): Ben Hyland OUT → Damian Turner IN (stamina_rule2)

[10:47] Substitution (Team_034): Cole Antetokounmpo OUT → Vince Paul IN (stamina_rule2)

[10:47] Substitution (Team_034): Terry Doncic OUT → Nikola Wagner IN (stamina_rule2)

[10:47] Substitution (Team_034): Anthony Bane OUT → Carmelo Anunoby IN (stamina_rule2)

[10:32] Team_074 possession (Score: 27-23)
Giannis Westbrook attempts a 3Pt. Contested by Vince Paul (4.3 feet, ZONE). Giannis Westbrook misses. Rebound secured by Carmelo Anunoby.

[10:20] Team_034 possession (Score: 27-23)
Nikola Wagner drives and kicks out. Damian Turner attempts a 3Pt. Contested by Giannis Westbrook (4.4 feet, MAN). Damian Turner misses. Rebound secured by Jaren Rozier.

[10:08] Team_074 possession (Score: 27-23)
FOUL! Shooting foul on Damian Turner. James Barnes to the line for 2 free throws. [Team fouls: 2] (Damian Turner: 1 personal fouls)   FT 1/2: GOOD   FT 2/2: GOOD James Barnes makes 2/2 from the line.
Score: 29-23

[09:53] Team_034 possession (Score: 29-23)
Carmelo Anunoby drives to the basket... Carmelo Anunoby throws a bad pass out of bounds! TURNOVER! (dead ball)

[09:53] Substitution (Team_074): Donovan Doncic OUT → Yao Randle IN (stamina_rule2)

[09:40] Team_074 possession (Score: 29-23)
James Barnes attempts a 3Pt. Contested by Vince Paul (4.1 feet, ZONE). JAMES BARNES MAKES IT! Assist: Yao Randle
Score: 32-23

[09:21] Team_034 possession (Score: 32-23)
Damian Turner attempts a Midrange. Contested by Giannis Westbrook (4.8 feet, MAN). Damian Turner misses. Rebound secured by Yao Randle.

[09:06] Team_074 possession (Score: 32-23)
James Barnes makes the Dunk and draws the foul on Vince Paul! And-1! James Barnes to the line for 1. [Team fouls: 3] (Vince Paul: 1 personal fouls)   FT 1/1: MISS James Barnes makes 0/1 from the line. Rebound secured by Vince Paul.
Score: 34-23

[08:51] Team_034 possession (Score: 34-23)
Nikola Wagner drives, picks up Yao Randle. Help arrives from Giannis Westbrook! Nikola Wagner attempts a Dunk. Contested by Giannis Westbrook (4.6 feet, MAN). Nikola Wagner misses. Offensive rebound by Vince Paul! Vince Paul's putback is no good. Rebound secured by Ayo Smith.

[08:36] Team_074 possession (Score: 34-23)
FOUL! Holding foul on Nikola Wagner. [Team fouls: 4] No free throws, side out. (Nikola Wagner: 1 personal fouls)

[08:21] Team_074 possession (Score: 34-23)
James Barnes drives, picks up Manu Jokic. Help arrives from Vince Paul! James Barnes attempts a Dunk. Contested by Vince Paul (4.6 feet, MAN). JAMES BARNES MAKES IT! Assist: Ayo Smith
Score: 36-23

[08:11] Team_034 possession (Score: 36-23)
Damian Turner attempts a 3Pt. Contested by James Barnes (4.6 feet, ZONE). DAMIAN TURNER MAKES IT! Assist: Nikola Wagner
Score: 36-26

[07:57] Team_074 possession (Score: 36-26)
James Barnes drives, picks up Manu Jokic. Help arrives from Vince Paul! James Barnes attempts a Dunk. Contested by Vince Paul (4.6 feet, MAN). JAMES BARNES MAKES IT!
Score: 38-26

[07:45] Team_034 possession (Score: 38-26)
Vince Paul attempts a 3Pt. Contested by James Barnes (4.6 feet, ZONE). Vince Paul misses. Rebound secured by Ayo Smith.

[07:26] Team_074 possession (Score: 38-26)
Yao Randle drives and kicks out. Jaren Rozier attempts a Midrange. Contested by Carmelo Anunoby (5.4 feet, MAN). Jaren Rozier misses. Rebound secured by Carmelo Anunoby.

[07:13] Team_034 possession (Score: 38-26)
Carmelo Anunoby loses control! Ball rolls out of bounds! TURNOVER! (dead ball)

[07:01] Team_074 possession (Score: 38-26)
Yao Randle drives and kicks out. Yao Randle attempts a Midrange. Wide open! Nikola Wagner is 6.0 feet away. [MAN] YAO RANDLE MAKES IT! Assist: Jaren Rozier
Score: 40-26

[06:49] Team_034 possession (Score: 40-26)
Vince Paul attempts a Midrange. Contested by Jaren Rozier (4.8 feet, ZONE). Vince Paul misses. Rebound secured by Yao Randle.

[06:32] Team_074 possession (Score: 40-26)
Jaren Rozier attempts a Midrange. Contested by Damian Turner (5.2 feet, ZONE). Jaren Rozier misses. Rebound secured by Vince Paul.

[06:16] Team_034 possession (Score: 40-26)
Vince Paul attempts a Layup. Contested by Yao Randle (4.9 feet, ZONE). Vince Paul misses. Offensive rebound by Vince Paul! Vince Paul's putback is no good. Rebound secured by Yao Randle.

[05:57] Team_074 possession (Score: 40-26)
Yao Randle throws a bad pass! Stolen by Nikola Wagner! TURNOVER! (live ball)

[05:44] Team_034 possession (Score: 40-26)
FOUL! Reach-in foul on Yao Randle during the drive. [Team fouls: 1] No free throws, side out. (Yao Randle: 1 personal fouls)

[05:30] Team_034 possession (Score: 40-26)
Carmelo Anunoby drives, Yao Randle stays with him. Carmelo Anunoby attempts a Layup. Contested by Yao Randle (4.6 feet, ZONE). CARMELO ANUNOBY MAKES IT! Assist: Manu Jokic
Score: 40-28

[05:11] Team_074 possession (Score: 40-28)
Yao Randle attempts a Midrange. Contested by Damian Turner (5.5 feet, ZONE). Yao Randle misses. Offensive rebound by Yao Randle! Yao Randle kicks it out.

[04:56] Team_074 possession (Score: 40-28)
Ayo Smith loses the ball! Stripped by Vince Paul! TURNOVER! (live ball)

[04:47] Team_034 possession (Score: 40-28)
Carmelo Anunoby makes the Dunk and draws the foul on Jaren Rozier! And-1! Carmelo Anunoby to the line for 1. [Team fouls: 2] (Jaren Rozier: 1 personal fouls)   FT 1/1: GOOD Carmelo Anunoby makes 1/1 from the line.
Score: 40-31

[04:33] Team_074 possession (Score: 40-31)
Yao Randle drives and kicks out. Giannis Westbrook attempts a 3Pt. Contested by Damian Turner (5.4 feet, MAN). Giannis Westbrook misses. Rebound secured by Carmelo Anunoby.

[04:16] Team_034 possession (Score: 40-31)
Damian Turner attempts a Layup. BLOCKED BY YAO RANDLE! Ball is loose! Rebound secured by Jaren Rozier.

[04:01] Team_074 possession (Score: 40-31)
Ayo Smith makes the Midrange and draws the foul on Damian Turner! And-1! Ayo Smith to the line for 1. [BONUS: 5 team fouls] (Damian Turner: 2 personal fouls)   FT 1/1: GOOD Ayo Smith makes 1/1 from the line.
Score: 43-31

[03:52] Team_034 possession (Score: 43-31)
Damian Turner drives to the basket... FOUL! Offensive foul on Damian Turner! Giannis Westbrook drew the charge! [Team fouls: 6] (Damian Turner: 3 personal fouls) TURNOVER! (dead ball)

[03:38] Team_074 possession (Score: 43-31)
FOUL! Reach-in foul on Carmelo Anunoby during the drive. [IN THE BONUS! 7 team fouls] Jaren Rozier to the line for 2 free throws. (Carmelo Anunoby: 1 personal fouls)   FT 1/2: GOOD   FT 2/2: GOOD Jaren Rozier makes 2/2 from the line.
Score: 45-31

[03:25] Team_034 possession (Score: 45-31)
Nikola Wagner attempts a Layup. Contested by Yao Randle (4.6 feet, MAN). Nikola Wagner misses. Rebound secured by Ayo Smith.

[03:11] Team_074 possession (Score: 45-31)
James Barnes makes the Layup and draws the foul on Manu Jokic! And-1! James Barnes to the line for 1. [BONUS: 8 team fouls] (Manu Jokic: 1 personal fouls)   FT 1/1: GOOD James Barnes makes 1/1 from the line.
Score: 48-31

[02:59] Team_034 possession (Score: 48-31)
Damian Turner attempts a Layup. Contested by Yao Randle (4.9 feet, ZONE). Damian Turner misses. Rebound secured by Yao Randle.

[02:40] Team_074 possession (Score: 48-31)
FOUL! Holding foul on Carmelo Anunoby. [IN THE BONUS! 9 team fouls] Jaren Rozier to the line for 2 free throws. (Carmelo Anunoby: 2 personal fouls)   FT 1/2: MISS   FT 2/2: GOOD Jaren Rozier makes 1/2 from the line.
Score: 49-31

[02:25] Team_034 possession (Score: 49-31)
FOUL! Reach-in foul on James Barnes during the drive. [Team fouls: 3] No free throws, side out. (James Barnes: 1 personal fouls)

[02:11] Team_034 possession (Score: 49-31)
Nikola Wagner attempts a 3Pt. Contested by Yao Randle (4.7 feet, MAN). Nikola Wagner misses. Rebound secured by Ayo Smith.

[01:57] Team_074 possession (Score: 49-31)
Jaren Rozier attempts a Layup. BLOCKED BY CARMELO ANUNOBY! Ball is loose! Rebound secured by Carmelo Anunoby.

[01:44] Team_034 possession (Score: 49-31)
FOUL! Shooting foul on Yao Randle. Carmelo Anunoby to the line for 2 free throws. [Team fouls: 4] (Yao Randle: 2 personal fouls)   FT 1/2: GOOD   FT 2/2: GOOD Carmelo Anunoby makes 2/2 from the line.
Score: 49-33

[01:31] Team_074 possession (Score: 49-33)
Yao Randle drives, picks up Nikola Wagner. Help arrives from Damian Turner! Yao Randle attempts a Layup. Wide open! Damian Turner is 6.3 feet away. [MAN] YAO RANDLE MAKES IT! Assist: Ayo Smith
Score: 51-33

[01:21] Team_034 possession (Score: 51-33)
Vince Paul attempts a 3Pt. Contested by Ayo Smith (5.4 feet, ZONE). Vince Paul misses. Offensive rebound by Carmelo Anunoby! Carmelo Anunoby kicks it out.

[01:05] Team_034 possession (Score: 51-33)
Vince Paul drives and kicks out. FOUL! Shooting foul on James Barnes. Carmelo Anunoby to the line for 2 free throws. [BONUS: 5 team fouls] (James Barnes: 2 personal fouls)   FT 1/2: MISS   FT 2/2: GOOD Carmelo Anunoby makes 1/2 from the line.
Score: 51-34

[00:50] Team_074 possession (Score: 51-34)
FOUL! Reach-in foul on Nikola Wagner during the drive. [IN THE BONUS! 10 team fouls] Yao Randle to the line for 2 free throws. (Nikola Wagner: 2 personal fouls)   FT 1/2: GOOD   FT 2/2: GOOD Yao Randle makes 2/2 from the line.
Score: 53-34

[00:35] Team_034 possession (Score: 53-34)
Carmelo Anunoby attempts a Midrange. Contested by Ayo Smith (5.1 feet, ZONE). Carmelo Anunoby misses. Rebound secured by Jaren Rozier.

[00:21] Team_074 possession (Score: 53-34)
Ayo Smith attempts a Layup. Wide open! Carmelo Anunoby is 6.0 feet away. [ZONE] AYO SMITH MAKES IT!
Score: 55-34

[00:05] Team_034 possession (Score: 55-34)
Nikola Wagner attempts a Layup. Contested by Yao Randle (4.9 feet, MAN). NIKOLA WAGNER MAKES IT! Assist: Vince Paul
Score: 55-36

================================================================================
                              2ND QUARTER COMPLETE                              
================================================================================

2ND QUARTER SCORE: Team_074 34, Team_034 15

BOX SCORE:
================================================================================

Team_074
--------------------------------------------------------------------------------
Player                MIN  PTS  REB  AST  TO      FG   FG%      3P   3P%
--------------------------------------------------------------------------------
James Barnes           11   12    0    0   0   5/6    83.3     0/0   0.0
Yao Randle             10    6    5    1   0   3/5    60.0     0/0   0.0
Ayo Smith              11    5    4    2   0   2/2   100.0     0/0   0.0
Jaren Rozier           11    3    3    1   0   2/4    50.0     0/0   0.0
Dwyane Quickley        13    2    0    1   0   1/1   100.0     0/0   0.0
Chris Carter           13    2    0    1   0   1/1   100.0     0/0   0.0
James Turner           13    2    0    0   0   1/1   100.0     0/0   0.0
Donovan Doncic         14    0    1    0   0   0/0     0.0     0/0   0.0
Giannis Westbrook      11    0    0    0   0   0/1     0.0     0/0   0.0

TEAM: FG: 15/21 (71.4%), 3PT: 1/2 (50.0%), REB: 11 (1 off, 10 def), AST: 6, TO: 2
TEAM FOULS: 5 [Team_034 in BONUS]


Team_034
--------------------------------------------------------------------------------
Player                MIN  PTS  REB  AST  TO      FG   FG%      3P   3P%
--------------------------------------------------------------------------------
Carmelo Anunoby        11    8    5    0   0   4/5    80.0     0/0   0.0
Damian Turner          11    3    0    0   0   1/4    25.0     0/0   0.0
Cole Antetokounmpo     13    2    0    0   0   1/1   100.0     0/0   0.0
Nikola Wagner          11    2    0    1   0   1/5    20.0     0/0   0.0
Ben Hyland             13    0    0    0   0   0/1     0.0     0/0   0.0
Devin Poole            13    0    0    1   0   0/0     0.0     0/0   0.0
Vince Paul             11    0    2    1   0   0/3     0.0     0/0   0.0
Manu Jokic             11    0    0    1   0   0/0     0.0     0/0   0.0

TEAM: FG: 7/19 (36.8%), 3PT: 1/3 (33.3%), REB: 9 (3 off, 6 def), AST: 4, TO: 4
TEAM FOULS: 10 [Team_074 in BONUS]

================================================================================

================================================================================
                       3RD QUARTER - Team_074 vs Team_034                       
================================================================================

[12:00] Team_074 possession (Score: 55-36)
James Turner drives to the basket... FOUL! Offensive foul on James Turner! Terry Doncic drew the charge! [Team fouls: 1] (James Turner: 1 personal fouls) TURNOVER! (dead ball)

[11:45] Team_034 possession (Score: 55-36)
FOUL! Shooting foul on Dwyane Quickley. Terry Doncic to the line for 3 free throws. [Team fouls: 2] (Dwyane Quickley: 1 personal fouls)   FT 1/3: GOOD   FT 2/3: GOOD   FT 3/3: GOOD Terry Doncic makes 3/3 from the line.
Score: 55-39

[11:27] Team_074 possession (Score: 55-39)
Donovan Doncic attempts a 3Pt. Contested by Devin Poole (4.2 feet, ZONE). Donovan Doncic misses. FOUL! Loose ball foul on Cole Antetokounmpo during the rebound battle. [Team fouls: 1] No free throws, side out. (Cole Antetokounmpo: 1 personal fouls)

[11:11] Team_074 possession (Score: 55-39)
Dwyane Quickley attempts a 3Pt. Contested by Devin Poole (4.2 feet, ZONE). DWYANE QUICKLEY MAKES IT! Assist: Shai Green
Score: 58-39

[10:57] Team_034 possession (Score: 58-39)
Ben Hyland attempts a Midrange. Contested by Donovan Doncic (3.8 feet, ZONE). Ben Hyland misses. FOUL! Loose ball foul on James Turner during the rebound battle. [Team fouls: 3] No free throws, side out. (James Turner: 2 personal fouls)

[10:43] Team_034 possession (Score: 58-39)
Ben Hyland attempts a 3Pt. Contested by Dwyane Quickley (5.5 feet, ZONE). BEN HYLAND MAKES IT! Assist: Terry Doncic
Score: 58-42

[10:32] Team_074 possession (Score: 58-42)
Shai Green attempts a 3Pt. Contested by Cole Antetokounmpo (5.0 feet, MAN). Shai Green misses. Rebound secured by Anthony Bane.

[10:19] Team_034 possession (Score: 58-42)
Cole Antetokounmpo throws a bad pass out of bounds! TURNOVER! (dead ball)

[10:03] Team_074 possession (Score: 58-42)
Chris Carter drives and kicks out. Shai Green attempts a 3Pt. Contested by Devin Poole (3.9 feet, ZONE). SHAI GREEN MAKES IT! Assist: Donovan Doncic
Score: 61-42

[09:47] Team_034 possession (Score: 61-42)
Anthony Bane attempts a Midrange. Contested by James Turner (3.5 feet, MAN). Anthony Bane misses. Rebound secured by James Turner.

[09:33] Team_074 possession (Score: 61-42)
James Turner drives, Anthony Bane stays with him. James Turner attempts a Dunk. Contested by Anthony Bane (5.8 feet, MAN). JAMES TURNER MAKES IT!
Score: 63-42

[09:20] Team_034 possession (Score: 63-42)
Anthony Bane attempts a Layup. Contested by Donovan Doncic (3.8 feet, ZONE). ANTHONY BANE MAKES IT! Assist: Devin Poole
Score: 63-44

[09:10] Team_074 possession (Score: 63-44)
Dwyane Quickley attempts a 3Pt. Contested by Devin Poole (4.2 feet, ZONE). Dwyane Quickley misses. Rebound secured by Terry Doncic.

[08:56] Team_034 possession (Score: 63-44)
Ben Hyland attempts a Midrange. Contested by Donovan Doncic (3.8 feet, ZONE). Ben Hyland misses. Offensive rebound by Terry Doncic! Terry Doncic puts it back in!
Score: 63-46

[08:42] Team_074 possession (Score: 63-46)
Chris Carter attempts a Midrange. Contested by Terry Doncic (4.7 feet, ZONE). CHRIS CARTER MAKES IT!
Score: 65-46

[08:26] Team_034 possession (Score: 65-46)
Ben Hyland attempts a 3Pt. Contested by Chris Carter (4.3 feet, MAN). Ben Hyland misses. Rebound secured by Shai Green.

[08:12] Team_074 possession (Score: 65-46)
Donovan Doncic drives and kicks out. James Turner attempts a Midrange. Contested by Anthony Bane (5.2 feet, MAN). JAMES TURNER MAKES IT!
Score: 67-46

[07:58] Team_034 possession (Score: 67-46)
Anthony Bane attempts a Midrange. Contested by James Turner (3.5 feet, MAN). Anthony Bane misses. Rebound secured by Shai Green.

[07:41] Team_074 possession (Score: 67-46)
FOUL! Holding foul on Anthony Bane. [Team fouls: 2] No free throws, side out. (Anthony Bane: 1 personal fouls)

[07:24] Team_074 possession (Score: 67-46)
Donovan Doncic drives and kicks out. Donovan Doncic attempts a 3Pt. Contested by Cole Antetokounmpo (4.5 feet, ZONE). DONOVAN DONCIC MAKES IT! Assist: Shai Green
Score: 70-46

[07:06] Team_034 possession (Score: 70-46)
Anthony Bane drives, Donovan Doncic stays with him. Anthony Bane attempts a Dunk. Contested by Donovan Doncic (3.8 feet, ZONE). Anthony Bane misses. Rebound secured by Donovan Doncic.

[06:52] Team_074 possession (Score: 70-46)
Dwyane Quickley attempts a Layup. Contested by Devin Poole (4.2 feet, MAN). DWYANE QUICKLEY MAKES IT!
Score: 72-46

[06:39] Team_034 possession (Score: 72-46)
Terry Doncic attempts a 3Pt. Contested by Dwyane Quickley (5.5 feet, ZONE). Terry Doncic misses. FOUL! Loose ball foul on Donovan Doncic during the rebound battle. [Team fouls: 4] No free throws, side out. (Donovan Doncic: 1 personal fouls)

[06:24] Team_034 possession (Score: 72-46)
Terry Doncic attempts a 3Pt. Contested by Dwyane Quickley (5.5 feet, ZONE). Terry Doncic misses. Rebound secured by Donovan Doncic.

[06:12] Team_074 possession (Score: 72-46)
Chris Carter drives, picks up Ben Hyland. Help arrives from Cole Antetokounmpo! Chris Carter attempts a Layup. Contested by Cole Antetokounmpo (4.2 feet, MAN). Chris Carter misses. Rebound secured by Anthony Bane.

[06:00] Team_034 possession (Score: 72-46)
Cole Antetokounmpo attempts a 3Pt. Contested by Dwyane Quickley (5.9 feet, ZONE). Cole Antetokounmpo misses. Rebound secured by Shai Green.

[05:46] Team_074 possession (Score: 72-46)
James Turner attempts a Midrange. Contested by Terry Doncic (4.7 feet, ZONE). JAMES TURNER MAKES IT! Assist: Shai Green
Score: 74-46

[05:33] Team_034 possession (Score: 74-46)
FOUL! Reach-in foul on Chris Carter during the drive. [IN THE BONUS! 5 team fouls] Ben Hyland to the line for 2 free throws. (Chris Carter: 1 personal fouls)   FT 1/2: MISS   FT 2/2: GOOD Ben Hyland makes 1/2 from the line.
Score: 74-47

[05:22] Team_074 possession (Score: 74-47)
Chris Carter attempts a Midrange. Contested by Terry Doncic (4.7 feet, ZONE). CHRIS CARTER MAKES IT! Assist: Donovan Doncic
Score: 76-47

[05:07] Team_034 possession (Score: 76-47)
Anthony Bane attempts a Midrange. Contested by James Turner (3.5 feet, MAN). Anthony Bane misses. Rebound secured by James Turner.

[04:55] Team_074 possession (Score: 76-47)
Donovan Doncic attempts a Midrange. Contested by Devin Poole (4.3 feet, ZONE). DONOVAN DONCIC MAKES IT!
Score: 78-47

[04:43] Team_034 possession (Score: 78-47)
Cole Antetokounmpo drives and kicks out. Anthony Bane attempts a Midrange. Contested by James Turner (3.5 feet, MAN). Anthony Bane misses. FOUL! Loose ball foul on Shai Green during the rebound battle. [IN THE BONUS! 6 team fouls] Anthony Bane to the line for 2 free throws. (Shai Green: 1 personal fouls)   FT 1/2: MISS   FT 2/2: GOOD Anthony Bane makes 1/2 from the line.
Score: 78-48

[04:30] Team_074 possession (Score: 78-48)
James Turner attempts a Layup. Contested by Anthony Bane (5.9 feet, MAN). JAMES TURNER MAKES IT! Assist: Donovan Doncic
Score: 80-48

[04:19] Team_034 possession (Score: 80-48)
Devin Poole drives and kicks out. Ben Hyland attempts a Midrange. Contested by Chris Carter (4.4 feet, MAN). Ben Hyland misses. Rebound secured by James Turner.

[04:04] Team_074 possession (Score: 80-48)
Shai Green makes the Layup and draws the foul on Cole Antetokounmpo! And-1! Shai Green to the line for 1. [Team fouls: 3] (Cole Antetokounmpo: 2 personal fouls)   FT 1/1: MISS Shai Green makes 0/1 from the line. Offensive rebound by James Turner! James Turner's putback is no good.
Score: 82-48

[03:49] Team_034 possession (Score: 82-48)
Devin Poole drives and kicks out. Ben Hyland attempts a 3Pt. Contested by Dwyane Quickley (5.5 feet, ZONE). Ben Hyland misses. Rebound secured by Donovan Doncic.

[03:38] Team_074 possession (Score: 82-48)
Donovan Doncic drives and kicks out. Dwyane Quickley attempts a 3Pt. Contested by Devin Poole (4.1 feet, ZONE). Dwyane Quickley misses. Rebound secured by Cole Antetokounmpo.

[03:22] Team_034 possession (Score: 82-48)
FOUL! Shooting foul on James Turner. Anthony Bane to the line for 2 free throws. [BONUS: 7 team fouls] (James Turner: 3 personal fouls)   FT 1/2: MISS   FT 2/2: MISS Anthony Bane makes 0/2 from the line. Rebound secured by Donovan Doncic.

[03:11] Team_074 possession (Score: 82-48)
James Turner attempts a Midrange. Contested by Ben Hyland (4.4 feet, ZONE). JAMES TURNER MAKES IT! Assist: Donovan Doncic
Score: 84-48

[02:57] Team_034 possession (Score: 84-48)
Terry Doncic drives, Donovan Doncic stays with him. Terry Doncic attempts a Layup. Contested by Donovan Doncic (3.9 feet, ZONE). TERRY DONCIC MAKES IT! Assist: Devin Poole
Score: 84-50

[02:40] Team_074 possession (Score: 84-50)
James Turner attempts a Layup. Wide open! Anthony Bane is 6.0 feet away. [MAN] James Turner misses. Rebound secured by Anthony Bane.

[02:26] Team_034 possession (Score: 84-50)
Ben Hyland attempts a Layup. Contested by Chris Carter (4.6 feet, MAN). BEN HYLAND MAKES IT! Assist: Devin Poole
Score: 84-52

[02:13] Team_074 possession (Score: 84-52)
Donovan Doncic attempts a 3Pt. Contested by Devin Poole (4.6 feet, ZONE). Donovan Doncic misses. Offensive rebound by Donovan Doncic! Donovan Doncic kicks it out.

[02:01] Team_074 possession (Score: 84-52)
Chris Carter attempts a 3Pt. Contested by Ben Hyland (4.5 feet, MAN). Chris Carter misses. Rebound secured by Anthony Bane.

[01:47] Team_034 possession (Score: 84-52)
Ben Hyland attempts a Layup. Contested by Chris Carter (4.7 feet, MAN). BEN HYLAND MAKES IT! Assist: Terry Doncic
Score: 84-54

[01:35] Team_074 possession (Score: 84-54)
Dwyane Quickley attempts a 3Pt. Contested by Devin Poole (4.7 feet, ZONE). DWYANE QUICKLEY MAKES IT! Assist: Donovan Doncic
Score: 87-54

[01:23] Team_034 possession (Score: 87-54)
Devin Poole attempts a Midrange. Contested by Dwyane Quickley (5.6 feet, MAN). DEVIN POOLE MAKES IT!
Score: 87-56

[01:08] Team_074 possession (Score: 87-56)
James Turner makes the 3Pt and draws the foul on Anthony Bane! And-1! James Turner to the line for 1. [Team fouls: 4] (Anthony Bane: 2 personal fouls)   FT 1/1: MISS James Turner makes 0/1 from the line. Rebound secured by Anthony Bane.
Score: 90-56

[00:51] Team_034 possession (Score: 90-56)
Terry Doncic attempts a Midrange. Contested by Donovan Doncic (4.2 feet, MAN). Terry Doncic misses. Rebound secured by Shai Green.

[00:36] Team_074 possession (Score: 90-56)
James Turner attempts a Midrange. Wide open! Anthony Bane is 6.2 feet away. [MAN] JAMES TURNER MAKES IT! Assist: Donovan Doncic
Score: 92-56

[00:19] Team_034 possession (Score: 92-56)
Terry Doncic attempts a Midrange. Contested by Shai Green (4.2 feet, ZONE). Terry Doncic misses. Rebound secured by Donovan Doncic.

[00:05] Team_074 possession (Score: 92-56)
FOUL! Shooting foul on Terry Doncic. Donovan Doncic to the line for 2 free throws. [BONUS: 5 team fouls] (Terry Doncic: 1 personal fouls)   FT 1/2: GOOD   FT 2/2: MISS Donovan Doncic makes 1/2 from the line. Offensive rebound by Donovan Doncic! Donovan Doncic kicks it out.
Score: 93-56

================================================================================
                              3RD QUARTER COMPLETE                              
================================================================================

3RD QUARTER SCORE: Team_074 38, Team_034 20

BOX SCORE:
================================================================================

Team_074
--------------------------------------------------------------------------------
Player                MIN  PTS  REB  AST  TO      FG   FG%      3P   3P%
--------------------------------------------------------------------------------
James Turner           26   12    5    0   0   6/8    75.0     0/0   0.0
Dwyane Quickley        26    8    0    0   0   3/4    75.0     0/0   0.0
Donovan Doncic         26    5    7    6   0   2/3    66.7     0/0   0.0
Chris Carter           26    4    0    0   0   2/4    50.0     0/0   0.0
Shai Green             26    3    4    3   0   1/3    33.3     0/0   0.0

TEAM: FG: 14/22 (63.6%), 3PT: 2/6 (33.3%), REB: 15 (3 off, 12 def), AST: 9, TO: 1
TEAM FOULS: 7 [Team_034 in BONUS]


Team_034
--------------------------------------------------------------------------------
Player                MIN  PTS  REB  AST  TO      FG   FG%      3P   3P%
--------------------------------------------------------------------------------
Ben Hyland             26    8    0    0   0   4/5    80.0     0/0   0.0
Terry Doncic           26    7    3    2   0   3/6    50.0     0/0   0.0
Anthony Bane           26    3    6    0   0   2/7    28.6     0/0   0.0
Devin Poole            26    2    0    3   0   1/3    33.3     0/0   0.0
Cole Antetokounmpo     26    0    1    0   0   0/1     0.0     0/0   0.0

TEAM: FG: 10/22 (45.5%), 3PT: 2/5 (40.0%), REB: 11 (3 off, 8 def), AST: 5, TO: 1
TEAM FOULS: 5 [Team_074 in BONUS]

================================================================================

================================================================================
                       4TH QUARTER - Team_074 vs Team_034                       
================================================================================

[12:00] Team_074 possession (Score: 93-56)
Dwyane Quickley makes the Dunk and draws the foul on Ben Hyland! And-1! Dwyane Quickley to the line for 1. [Team fouls: 1] (Ben Hyland: 1 personal fouls)   FT 1/1: MISS Dwyane Quickley makes 0/1 from the line. Rebound secured by Terry Doncic.
Score: 95-56

[11:44] Team_034 possession (Score: 95-56)
Devin Poole throws a bad pass out of bounds! TURNOVER! (dead ball)

[11:44] Substitution (Team_074): Dwyane Quickley OUT → James Barnes IN (stamina_rule2)

[11:44] Substitution (Team_074): Chris Carter OUT → Giannis Westbrook IN (stamina_rule2)

[11:44] Substitution (Team_074): Shai Green OUT → Ayo Smith IN (stamina_rule2)

[11:44] Substitution (Team_074): Donovan Doncic OUT → Yao Randle IN (stamina_rule2)

[11:44] Substitution (Team_074): James Turner OUT → Jaren Rozier IN (stamina_rule2)

[11:44] Substitution (Team_034): Devin Poole OUT → Manu Jokic IN (stamina_rule2)

[11:44] Substitution (Team_034): Ben Hyland OUT → Damian Turner IN (stamina_rule2)

[11:44] Substitution (Team_034): Cole Antetokounmpo OUT → Vince Paul IN (stamina_rule2)

[11:44] Substitution (Team_034): Terry Doncic OUT → Nikola Wagner IN (stamina_rule2)

[11:44] Substitution (Team_034): Anthony Bane OUT → Carmelo Anunoby IN (stamina_rule2)

[11:30] Team_074 possession (Score: 95-56)
Yao Randle drives to the basket... FOUL! Offensive foul on Yao Randle! Nikola Wagner drew the charge! [Team fouls: 1] (Yao Randle: 1 personal fouls) TURNOVER! (dead ball)

[11:16] Team_034 possession (Score: 95-56)
Vince Paul attempts a Midrange. Contested by Ayo Smith (5.2 feet, MAN). VINCE PAUL MAKES IT! Assist: Damian Turner
Score: 95-58

[11:00] Team_074 possession (Score: 95-58)
Jaren Rozier drives, Carmelo Anunoby stays with him. Jaren Rozier attempts a Dunk. Contested by Carmelo Anunoby (5.2 feet, MAN). Jaren Rozier misses. Rebound secured by Carmelo Anunoby.

[10:49] Team_034 possession (Score: 95-58)
Nikola Wagner attempts a Midrange. Contested by Jaren Rozier (4.5 feet, ZONE). Nikola Wagner misses. Rebound secured by Yao Randle.

[10:33] Team_074 possession (Score: 95-58)
Ayo Smith attempts a Midrange. Contested by Vince Paul (4.4 feet, MAN). AYO SMITH MAKES IT! Assist: Jaren Rozier
Score: 97-58

[10:17] Team_034 possession (Score: 97-58)
Vince Paul makes the Layup and draws the foul on Giannis Westbrook! And-1! Vince Paul to the line for 1. [Team fouls: 2] (Giannis Westbrook: 1 personal fouls)   FT 1/1: GOOD Vince Paul makes 1/1 from the line.
Score: 97-61

[10:06] Team_074 possession (Score: 97-61)
Giannis Westbrook attempts a 3Pt. Contested by Vince Paul (4.3 feet, ZONE). GIANNIS WESTBROOK MAKES IT! Assist: Yao Randle
Score: 100-61

[09:56] Team_034 possession (Score: 100-61)
FOUL! Holding foul on James Barnes. [Team fouls: 3] No free throws, side out. (James Barnes: 1 personal fouls)

[09:41] Team_034 possession (Score: 100-61)
Nikola Wagner makes the Layup and draws the foul on Giannis Westbrook! And-1! Nikola Wagner to the line for 1. [Team fouls: 4] (Giannis Westbrook: 2 personal fouls)   FT 1/1: GOOD Nikola Wagner makes 1/1 from the line.
Score: 100-64

[09:30] Team_074 possession (Score: 100-64)
James Barnes attempts a Midrange. Contested by Nikola Wagner (5.9 feet, ZONE). JAMES BARNES MAKES IT! Assist: Yao Randle
Score: 102-64

[09:17] Team_034 possession (Score: 102-64)
Nikola Wagner attempts a 3Pt. Contested by James Barnes (4.4 feet, ZONE). Nikola Wagner misses. Rebound secured by Yao Randle.

[09:07] Team_074 possession (Score: 102-64)
Yao Randle attempts a Midrange. Wide open! Nikola Wagner is 6.1 feet away. [MAN] YAO RANDLE MAKES IT!
Score: 104-64

[08:52] Team_034 possession (Score: 104-64)
Damian Turner drives, picks up Giannis Westbrook. Help arrives from James Barnes! Damian Turner attempts a Dunk. Contested by James Barnes (4.8 feet, MAN). DAMIAN TURNER MAKES IT! Assist: Manu Jokic
Score: 104-66

[08:39] Team_074 possession (Score: 104-66)
FOUL! Reach-in foul on Damian Turner during the drive. [Team fouls: 2] No free throws, side out. (Damian Turner: 1 personal fouls)

[08:25] Team_074 possession (Score: 104-66)
Giannis Westbrook attempts a Midrange. Wide open! Nikola Wagner is 6.1 feet away. [ZONE] GIANNIS WESTBROOK MAKES IT! Assist: Ayo Smith
Score: 106-66

[08:10] Team_034 possession (Score: 106-66)
Damian Turner attempts a 3Pt. Contested by Giannis Westbrook (4.8 feet, MAN). Damian Turner misses. Rebound secured by Jaren Rozier.

[07:57] Team_074 possession (Score: 106-66)
James Barnes attempts a 3Pt. Contested by Manu Jokic (4.6 feet, MAN). James Barnes misses. FOUL! Loose ball foul on Vince Paul during the rebound battle. [Team fouls: 3] No free throws, side out. (Vince Paul: 1 personal fouls)

[07:40] Team_074 possession (Score: 106-66)
James Barnes drives to the basket... James Barnes loses control! Ball rolls out of bounds! TURNOVER! (dead ball)

[07:23] Team_034 possession (Score: 106-66)
Nikola Wagner drives and kicks out. Carmelo Anunoby attempts a Midrange. Contested by Ayo Smith (4.8 feet, ZONE). Carmelo Anunoby misses. Rebound secured by Ayo Smith.

[07:04] Team_074 possession (Score: 106-66)
Giannis Westbrook attempts a Midrange. Contested by Damian Turner (5.5 feet, MAN). Giannis Westbrook misses. Rebound secured by Vince Paul.

[06:48] Team_034 possession (Score: 106-66)
FOUL! Offensive foul on Nikola Wagner! Yao Randle drew the charge! [Team fouls: 4] (Nikola Wagner: 1 personal fouls) TURNOVER! (dead ball)

[06:34] Team_074 possession (Score: 106-66)
FOUL! Shooting foul on Damian Turner. James Barnes to the line for 2 free throws. [BONUS: 5 team fouls] (Damian Turner: 2 personal fouls)   FT 1/2: GOOD   FT 2/2: MISS James Barnes makes 1/2 from the line. Rebound secured by Carmelo Anunoby.
Score: 107-66

[06:18] Team_034 possession (Score: 107-66)
FOUL! Reach-in foul on Yao Randle during the drive. [IN THE BONUS! 5 team fouls] Nikola Wagner to the line for 2 free throws. (Yao Randle: 2 personal fouls)   FT 1/2: MISS   FT 2/2: GOOD Nikola Wagner makes 1/2 from the line.
Score: 107-67

[06:03] Team_074 possession (Score: 107-67)
Yao Randle drives, picks up Nikola Wagner. Help arrives from Damian Turner! Yao Randle attempts a Dunk. Wide open! Damian Turner is 6.1 feet away. [MAN] Yao Randle misses. Offensive rebound by Jaren Rozier! Jaren Rozier kicks it out.

[05:51] Team_074 possession (Score: 107-67)
Giannis Westbrook drives to the basket... Giannis Westbrook throws a bad pass! Stolen by Carmelo Anunoby! TURNOVER! (live ball)

[05:37] Team_034 possession (Score: 107-67)
FOUL! Holding foul on Jaren Rozier. [IN THE BONUS! 6 team fouls] Carmelo Anunoby to the line for 2 free throws. (Jaren Rozier: 1 personal fouls)   FT 1/2: GOOD   FT 2/2: GOOD Carmelo Anunoby makes 2/2 from the line.
Score: 107-69

[05:23] Team_074 possession (Score: 107-69)
Giannis Westbrook drives to the basket... Giannis Westbrook commits a violation (traveling/carry)! TURNOVER! (dead ball)

[05:08] Team_034 possession (Score: 107-69)
Damian Turner attempts a 3Pt. Contested by Ayo Smith (5.2 feet, ZONE). Damian Turner misses. Rebound secured by Ayo Smith.

[04:56] Team_074 possession (Score: 107-69)
Ayo Smith attempts a 3Pt. Contested by Manu Jokic (4.9 feet, ZONE). Ayo Smith misses. Rebound secured by Carmelo Anunoby.

[04:43] Team_034 possession (Score: 107-69)
Damian Turner attempts a 3Pt. Contested by James Barnes (4.7 feet, ZONE). DAMIAN TURNER MAKES IT! Assist: Manu Jokic
Score: 107-72

[04:25] Team_074 possession (Score: 107-72)
Ayo Smith attempts a Layup. Contested by Carmelo Anunoby (5.7 feet, ZONE). AYO SMITH MAKES IT!
Score: 109-72

[04:13] Team_034 possession (Score: 109-72)
Damian Turner attempts a 3Pt. Contested by James Barnes (4.7 feet, ZONE). Damian Turner misses. Rebound secured by Ayo Smith.

[03:58] Team_074 possession (Score: 109-72)
Jaren Rozier attempts a Midrange. BLOCKED BY CARMELO ANUNOBY! Ball is loose! Rebound secured by Carmelo Anunoby.

[03:44] Team_034 possession (Score: 109-72)
Vince Paul attempts a Layup. Contested by Yao Randle (5.0 feet, ZONE). Vince Paul misses. Rebound secured by Jaren Rozier.

[03:30] Team_074 possession (Score: 109-72)
James Barnes attempts a Layup. Contested by Carmelo Anunoby (5.5 feet, ZONE). James Barnes misses. Rebound secured by Nikola Wagner.

[03:16] Team_034 possession (Score: 109-72)
Manu Jokic attempts a Midrange. Contested by James Barnes (4.5 feet, MAN). Manu Jokic misses. Rebound secured by Jaren Rozier.

[03:04] Team_074 possession (Score: 109-72)
Ayo Smith attempts a 3Pt. Contested by Vince Paul (4.5 feet, ZONE). Ayo Smith misses. Offensive rebound by Yao Randle! Yao Randle kicks it out.

[02:47] Team_074 possession (Score: 109-72)
Yao Randle attempts a 3Pt. Wide open! Nikola Wagner is 6.3 feet away. [MAN] Yao Randle misses. Rebound secured by Nikola Wagner.

[02:31] Team_034 possession (Score: 109-72)
FOUL! Holding foul on James Barnes. [IN THE BONUS! 7 team fouls] Manu Jokic to the line for 2 free throws. (James Barnes: 2 personal fouls)   FT 1/2: GOOD   FT 2/2: GOOD Manu Jokic makes 2/2 from the line.
Score: 109-74

[02:15] Team_074 possession (Score: 109-74)
Giannis Westbrook attempts a 3Pt. Contested by Vince Paul (4.5 feet, ZONE). Giannis Westbrook misses. Rebound secured by Nikola Wagner.

[01:59] Team_034 possession (Score: 109-74)
Manu Jokic attempts a Layup. Contested by Yao Randle (4.8 feet, ZONE). Manu Jokic misses. Rebound secured by Yao Randle.

[01:47] Team_074 possession (Score: 109-74)
Jaren Rozier loses control! Ball rolls out of bounds! TURNOVER! (dead ball)

[01:32] Team_034 possession (Score: 109-74)
Vince Paul drives to the basket... FOUL! Offensive foul on Vince Paul! Ayo Smith drew the charge! [Team fouls: 6] (Vince Paul: 2 personal fouls) TURNOVER! (dead ball)

[01:17] Team_074 possession (Score: 109-74)
Ayo Smith makes the Dunk and draws the foul on Damian Turner! And-1! Ayo Smith to the line for 1. [BONUS: 7 team fouls] (Damian Turner: 3 personal fouls)   FT 1/1: GOOD Ayo Smith makes 1/1 from the line.
Score: 112-74

[01:00] Team_034 possession (Score: 112-74)
Manu Jokic attempts a Midrange. Contested by Giannis Westbrook (4.9 feet, ZONE). Manu Jokic misses. Rebound secured by Yao Randle.

[00:45] Team_074 possession (Score: 112-74)
James Barnes attempts a 3Pt. Contested by Vince Paul (4.5 feet, ZONE). James Barnes misses. Rebound secured by Carmelo Anunoby.

[00:30] Team_034 possession (Score: 112-74)
FOUL! Offensive foul on Damian Turner! Giannis Westbrook drew the charge! [Team fouls: 8] (Damian Turner: 4 personal fouls) TURNOVER! (dead ball)

[00:16] Team_074 possession (Score: 112-74)
Giannis Westbrook attempts a 3Pt. Contested by Vince Paul (4.7 feet, ZONE). GIANNIS WESTBROOK MAKES IT! Assist: James Barnes
Score: 115-74

[00:01] Team_034 possession (Score: 115-74)
Manu Jokic attempts a Layup. Contested by James Barnes (4.9 feet, MAN). Manu Jokic misses. Rebound secured by Yao Randle.

================================================================================
                              4TH QUARTER COMPLETE                              
================================================================================

4TH QUARTER SCORE: Team_074 22, Team_034 18

BOX SCORE:
================================================================================

Team_074
--------------------------------------------------------------------------------
Player                MIN  PTS  REB  AST  TO      FG   FG%      3P   3P%
--------------------------------------------------------------------------------
Giannis Westbrook      23    8    0    0   0   3/5    60.0     0/0   0.0
Ayo Smith              23    7    3    1   0   3/4    75.0     0/0   0.0
Yao Randle             22    2    7    2   0   1/2    50.0     0/0   0.0
James Barnes           23    2    0    1   0   1/4    25.0     0/0   0.0
Dwyane Quickley        26    0    0    0   0   0/1     0.0     0/0   0.0
Jaren Rozier           23    0    4    1   0   0/2     0.0     0/0   0.0

TEAM: FG: 8/18 (44.4%), 3PT: 2/6 (33.3%), REB: 14 (3 off, 11 def), AST: 5, TO: 5
TEAM FOULS: 7 [Team_034 in BONUS]


Team_034
--------------------------------------------------------------------------------
Player                MIN  PTS  REB  AST  TO      FG   FG%      3P   3P%
--------------------------------------------------------------------------------
Vince Paul             23    5    1    0   0   2/3    66.7     0/0   0.0
Damian Turner          23    5    0    1   0   2/5    40.0     0/0   0.0
Nikola Wagner          23    4    3    0   0   2/5    40.0     0/0   0.0
Carmelo Anunoby        23    2    5    0   0   1/1   100.0     0/0   0.0
Manu Jokic             23    2    0    2   0   1/5    20.0     0/0   0.0
Terry Doncic           26    0    1    0   0   0/0     0.0     0/0   0.0

TEAM: FG: 8/19 (42.1%), 3PT: 1/5 (20.0%), REB: 10 (0 off, 10 def), AST: 3, TO: 4
TEAM FOULS: 8 [Team_074 in BONUS]

================================================================================

================================================================================
                               FULL GAME COMPLETE                               
================================================================================

FINAL SCORE: Team_074 115, Team_034 74

SCORING BY QUARTER:
--------------------------------------------------------------------------------
Team                     Q1     Q2     Q3     Q4    FINAL
--------------------------------------------------------------------------------
Team_074                 21     34     38     22      115
Team_034                 21     15     20     18       74
--------------------------------------------------------------------------------

FULL GAME BOX SCORE:
================================================================================

Team_074
--------------------------------------------------------------------------------
Player                MIN  PTS  REB  AST  TO      FG   FG%      3P   3P%      FT STL BLK
--------------------------------------------------------------------------------
Donovan Doncic         27    9   10    7   2   3/9    33.3   0/2     0.0   2/5     1   0
Dwyane Quickley        26   15    0    2   1   8/12   66.7   4/7    57.1   0/1     0   0
Chris Carter           26    8    0    3   0   6/9    66.7   0/1     0.0   2/2     0   0
Shai Green             26    5    9    4   1   1/4    25.0   0/2     0.0   0/1     0   0
James Turner           26   22   12    0   0   8/13   61.5   0/1     0.0   0/1     0   1
James Barnes           23   14    0    1   2   6/10   60.0   1/2    50.0   4/6     0   0
Giannis Westbrook      23    8    0    0   0   3/6    50.0   2/4    50.0   0/0     0   0
Ayo Smith              23   12    7    3   2   5/6    83.3   0/1     0.0   2/2     0   0
Jaren Rozier           23    3    7    2   2   1/5    20.0   0/0     0.0   3/4     0   0
Yao Randle             22    8   12    3   1   4/7    57.1   0/1     0.0   2/2     0   1

TEAM: FG: 46/82 (56.1%), 3PT: 7/21 (33.3%), REB: 54 (10 off, 44 def), AST: 25, TO: 11


Team_034
--------------------------------------------------------------------------------
Player                MIN  PTS  REB  AST  TO      FG   FG%      3P   3P%      FT STL BLK
--------------------------------------------------------------------------------
Devin Poole            26    4    0    5   2   2/5    40.0   0/1     0.0   0/0     0   0
Ben Hyland             26    8    0    0   1   5/10   50.0   1/4    25.0   1/2     0   0
Cole Antetokounmpo     26    4    4    1   1   3/6    50.0   0/2     0.0   2/2     0   1
Terry Doncic           26   20    7    3   0   7/11   63.6   4/6    66.7   6/8     0   1
Anthony Bane           26    7   13    0   2   3/12   25.0   0/3     0.0   3/6     0   0
Manu Jokic             23    2    0    3   0   0/4     0.0   0/0     0.0   2/2     0   0
Damian Turner          23    8    0    1   1   3/9    33.3   2/5    40.0   0/0     0   0
Vince Paul             23    5    3    1   0   3/7    42.9   0/1     0.0   1/1     1   0
Nikola Wagner          23    6    3    1   2   3/10   30.0   0/2     0.0   2/3     1   0
Carmelo Anunoby        23   10   10    0   3   3/4    75.0   0/0     0.0   6/7     1   2

TEAM: FG: 34/80 (42.5%), 3PT: 7/24 (29.2%), REB: 43 (9 off, 34 def), AST: 15, TO: 12

================================================================================
