================================================================================
                        FULL GAME - Team_093 vs Team_057                        
================================================================================

================================================================================
                       1ST QUARTER - Team_093 vs Team_057                       
================================================================================

[12:00] Team_093 possession (Score: 0-0)
Vince Barnes attempts a Layup. Contested by Ben Adebayo (4.6 feet, ZONE). Vince Barnes misses. Rebound secured by Miles Middleton.

[11:46] Team_057 possession (Score: 0-0)
Klay Rozier throws a bad pass! Stolen by Trae Westbrook! TURNOVER! (live ball)

[11:31] Team_093 possession (Score: 0-0)
FOUL! Holding foul on Miles Middleton. [Team fouls: 1] No free throws, side out. (Miles Middleton: 1 personal fouls)

[11:17] Team_093 possession (Score: 0-0)
Damian Williamson attempts a 3Pt. Contested by Kobe Ming (4.4 feet, MAN). Damian Williamson misses. Rebound secured by Ben Adebayo.

[10:59] Team_057 possession (Score: 0-0)
Klay Rozier makes the Midrange and draws the foul on Trae Westbrook! And-1! Klay Rozier to the line for 1. [Team fouls: 1] (Trae Westbrook: 1 personal fouls)   FT 1/1: GOOD Klay Rozier makes 1/1 from the line.
Score: 0-3

[10:44] Team_093 possession (Score: 0-3)
Vince Barnes attempts a 3Pt. Contested by Ben Adebayo (4.6 feet, MAN). Vince Barnes misses. Offensive rebound by Ben Cunningham! Ben Cunningham kicks it out.

[10:29] Team_093 possession (Score: 0-3)
Trae Westbrook attempts a 3Pt. Contested by Klay Rozier (3.4 feet, MAN). Trae Westbrook misses. Rebound secured by Ben Adebayo.

[10:20] Team_057 possession (Score: 0-3)
Miles Middleton drives, Ben Cunningham stays with him. Miles Middleton attempts a Dunk. Contested by Ben Cunningham (4.8 feet, ZONE). Miles Middleton misses. Rebound secured by Vince Barnes.

[10:05] Team_093 possession (Score: 0-3)
Carmelo Wagner attempts a Layup. BLOCKED BY ANFERNEE ADEBAYO! Ball is loose! Rebound secured by Ben Adebayo.

[09:51] Team_057 possession (Score: 0-3)
Kobe Ming attempts a 3Pt. Contested by Damian Williamson (5.1 feet, MAN). Kobe Ming misses. Rebound secured by Ben Cunningham.

[09:37] Team_093 possession (Score: 0-3)
Carmelo Wagner drives and kicks out. Carmelo Wagner makes the Midrange and draws the foul on Ben Adebayo! And-1! Carmelo Wagner to the line for 1. [Team fouls: 2] (Ben Adebayo: 1 personal fouls)   FT 1/1: GOOD Carmelo Wagner makes 1/1 from the line.
Score: 3-3

[09:23] Team_057 possession (Score: 3-3)
Klay Rozier attempts a 3Pt. Contested by Carmelo Wagner (3.5 feet, ZONE). Klay Rozier misses. Rebound secured by Carmelo Wagner.

[09:07] Team_093 possession (Score: 3-3)
Trae Westbrook attempts a 3Pt. Contested by Kobe Ming (4.2 feet, ZONE). TRAE WESTBROOK MAKES IT! Assist: Damian Williamson
Score: 6-3

[08:52] Team_057 possession (Score: 6-3)
Miles Middleton attempts a Layup. Contested by Ben Cunningham (4.8 feet, ZONE). Miles Middleton misses. Rebound secured by Vince Barnes.

[08:37] Team_093 possession (Score: 6-3)
Trae Westbrook drives, Ben Adebayo stays with him. Trae Westbrook attempts a Layup. Contested by Ben Adebayo (4.2 feet, ZONE). Trae Westbrook misses. Rebound secured by Miles Middleton.

[08:21] Team_057 possession (Score: 6-3)
Klay Rozier attempts a 3Pt. Contested by Trae Westbrook (5.6 feet, ZONE). KLAY ROZIER MAKES IT! Assist: Kobe Ming
Score: 6-6

[08:10] Team_093 possession (Score: 6-6)
Carmelo Wagner drives and kicks out. Trae Westbrook attempts a 3Pt. Contested by Kobe Ming (4.4 feet, ZONE). Trae Westbrook misses. Rebound secured by Miles Middleton.

[07:57] Team_057 possession (Score: 6-6)
Anfernee Adebayo drives, Carmelo Wagner stays with him. Anfernee Adebayo attempts a Layup. Contested by Carmelo Wagner (3.8 feet, MAN). Anfernee Adebayo misses. Rebound secured by Vince Barnes.

[07:42] Team_093 possession (Score: 6-6)
Ben Cunningham attempts a Midrange. Contested by Ben Adebayo (5.0 feet, ZONE). Ben Cunningham misses. Offensive rebound by Ben Cunningham! Ben Cunningham kicks it out.

[07:29] Team_093 possession (Score: 6-6)
Damian Williamson attempts a Midrange. Contested by Klay Rozier (3.6 feet, ZONE). DAMIAN WILLIAMSON MAKES IT! Assist: Carmelo Wagner
Score: 8-6

[07:10] Team_057 possession (Score: 8-6)
Kobe Ming attempts a 3Pt. Contested by Damian Williamson (5.1 feet, MAN). Kobe Ming misses. Rebound secured by Ben Cunningham.

[06:55] Team_093 possession (Score: 8-6)
Damian Williamson throws a bad pass! Stolen by Kobe Ming! TURNOVER! (live ball)

[06:39] Team_057 possession (Score: 8-6)
Miles Middleton drives, Ben Cunningham stays with him. Miles Middleton attempts a Layup. Contested by Ben Cunningham (4.8 feet, MAN). Miles Middleton misses. Offensive rebound by Ben Adebayo! Ben Adebayo kicks it out.

[06:27] Team_057 possession (Score: 8-6)
Ben Adebayo drives, Ben Cunningham stays with him. Ben Adebayo attempts a Dunk. Contested by Ben Cunningham (5.5 feet, ZONE). BEN ADEBAYO MAKES IT! Assist: Anfernee Adebayo
Score: 8-8

[06:12] Team_093 possession (Score: 8-8)
Ben Cunningham attempts a 3Pt. Contested by Kobe Ming (4.9 feet, ZONE). Ben Cunningham misses. Offensive rebound by Carmelo Wagner! Carmelo Wagner kicks it out.

[05:54] Team_093 possession (Score: 8-8)
Ben Cunningham attempts a Midrange. Contested by Klay Rozier (4.1 feet, ZONE). Ben Cunningham misses. Rebound secured by Ben Adebayo.

[05:39] Team_057 possession (Score: 8-8)
FOUL! Shooting foul on Ben Cunningham. Klay Rozier to the line for 2 free throws. [Team fouls: 2] (Ben Cunningham: 1 personal fouls)   FT 1/2: GOOD   FT 2/2: GOOD Klay Rozier makes 2/2 from the line.
Score: 8-10

[05:26] Team_093 possession (Score: 8-10)
FOUL! Holding foul on Miles Middleton. [Team fouls: 3] No free throws, side out. (Miles Middleton: 2 personal fouls)

[05:16] Team_093 possession (Score: 8-10)
Damian Williamson attempts a 3Pt. Contested by Kobe Ming (4.4 feet, ZONE). Damian Williamson misses. Rebound secured by Miles Middleton.

[05:02] Team_057 possession (Score: 8-10)
Kobe Ming attempts a Midrange. Contested by Ben Cunningham (5.3 feet, ZONE). Kobe Ming misses. Rebound secured by Vince Barnes.

[04:46] Team_093 possession (Score: 8-10)
FOUL! Holding foul on Anfernee Adebayo. [Team fouls: 4] No free throws, side out. (Anfernee Adebayo: 1 personal fouls)

[04:31] Team_093 possession (Score: 8-10)
Trae Westbrook drives, Miles Middleton stays with him. Trae Westbrook attempts a Dunk. Contested by Miles Middleton (4.3 feet, ZONE). Trae Westbrook misses. Offensive rebound by Carmelo Wagner! Carmelo Wagner kicks it out.

[04:19] Team_093 possession (Score: 8-10)
Vince Barnes drives and kicks out. Trae Westbrook attempts a 3Pt. Contested by Ben Adebayo (4.5 feet, ZONE). Trae Westbrook misses. FOUL! Loose ball foul on Anfernee Adebayo during the rebound battle. [IN THE BONUS! 5 team fouls] Ben Cunningham to the line for 2 free throws. (Anfernee Adebayo: 2 personal fouls)   FT 1/2: MISS   FT 2/2: GOOD Ben Cunningham makes 1/2 from the line.
Score: 9-10

[04:02] Team_057 possession (Score: 9-10)
Kobe Ming attempts a 3Pt. Contested by Damian Williamson (5.3 feet, ZONE). Kobe Ming misses. Offensive rebound by Miles Middleton! Miles Middleton kicks it out.

[03:47] Team_057 possession (Score: 9-10)
Kobe Ming attempts a 3Pt. Contested by Carmelo Wagner (3.8 feet, ZONE). Kobe Ming misses. Rebound secured by Ben Cunningham.

[03:35] Team_093 possession (Score: 9-10)
Ben Cunningham throws a bad pass out of bounds! TURNOVER! (dead ball)

[03:23] Team_057 possession (Score: 9-10)
FOUL! Holding foul on Vince Barnes. [Team fouls: 3] No free throws, side out. (Vince Barnes: 1 personal fouls)

[03:11] Team_057 possession (Score: 9-10)
Kobe Ming attempts a 3Pt. Contested by Damian Williamson (5.3 feet, MAN). Kobe Ming misses. Rebound secured by Ben Cunningham.

[02:58] Team_093 possession (Score: 9-10)
FOUL! Reach-in foul on Ben Adebayo during the drive. [IN THE BONUS! 6 team fouls] Vince Barnes to the line for 2 free throws. (Ben Adebayo: 2 personal fouls)   FT 1/2: MISS   FT 2/2: GOOD Vince Barnes makes 1/2 from the line.
Score: 10-10

[02:42] Team_057 possession (Score: 10-10)
Kobe Ming makes the Midrange and draws the foul on Carmelo Wagner! And-1! Kobe Ming to the line for 1. [Team fouls: 4] (Carmelo Wagner: 1 personal fouls)   FT 1/1: GOOD Kobe Ming makes 1/1 from the line.
Score: 10-13

[02:28] Team_093 possession (Score: 10-13)
Trae Westbrook drives and kicks out. Vince Barnes attempts a Midrange. Contested by Klay Rozier (3.9 feet, ZONE). Vince Barnes misses. Rebound secured by Anfernee Adebayo.

[02:11] Team_057 possession (Score: 10-13)
FOUL! Offensive foul on Miles Middleton! Ben Cunningham drew the charge! [Team fouls: 7] (Miles Middleton: 3 personal fouls) TURNOVER! (dead ball)

[02:00] Team_093 possession (Score: 10-13)
Vince Barnes drives, Ben Adebayo stays with him. Vince Barnes attempts a Layup. Contested by Ben Adebayo (4.9 feet, ZONE). VINCE BARNES MAKES IT!
Score: 12-13

[01:48] Team_057 possession (Score: 12-13)
Anfernee Adebayo attempts a 3Pt. Contested by Carmelo Wagner (4.2 feet, ZONE). ANFERNEE ADEBAYO MAKES IT! Assist: Kobe Ming
Score: 12-16

[01:32] Team_093 possession (Score: 12-16)
FOUL! Holding foul on Klay Rozier. [IN THE BONUS! 8 team fouls] Trae Westbrook to the line for 2 free throws. (Klay Rozier: 1 personal fouls)   FT 1/2: GOOD   FT 2/2: GOOD Trae Westbrook makes 2/2 from the line.
Score: 14-16

[01:14] Team_057 possession (Score: 14-16)
Anfernee Adebayo loses the ball! Stripped by Carmelo Wagner! TURNOVER! (live ball)

[00:59] Team_093 possession (Score: 14-16)
Ben Cunningham makes the Layup and draws the foul on Miles Middleton! And-1! Ben Cunningham to the line for 1. [BONUS: 9 team fouls] (Miles Middleton: 4 personal fouls)   FT 1/1: GOOD Ben Cunningham makes 1/1 from the line.
Score: 17-16

[00:45] Team_057 possession (Score: 17-16)
Ben Adebayo attempts a Layup. Contested by Vince Barnes (5.0 feet, MAN). Ben Adebayo misses. Offensive rebound by Miles Middleton! Miles Middleton kicks it out.

[00:29] Team_057 possession (Score: 17-16)
Ben Adebayo attempts a 3Pt. Contested by Carmelo Wagner (4.5 feet, ZONE). Ben Adebayo misses. Rebound secured by Ben Cunningham.

[00:15] Team_093 possession (Score: 17-16)
Trae Westbrook drives to the basket... Trae Westbrook loses control! Ball rolls out of bounds! TURNOVER! (dead ball)

[00:15] Substitution (Team_093): Damian Williamson OUT → Shaquille George IN (stamina_rule2)

[00:15] Substitution (Team_093): Trae Westbrook OUT → Immanuel Cunningham IN (stamina_rule2)

[00:15] Substitution (Team_093): Carmelo Wagner OUT → Lauri Parker IN (stamina_rule2)

[00:15] Substitution (Team_093): Vince Barnes OUT → Kobe Murray IN (stamina_rule2)

[00:15] Substitution (Team_093): Ben Cunningham OUT → Cade O'Neal IN (stamina_rule2)

[00:15] Substitution (Team_057): Kobe Ming OUT → Scottie Johnson IN (stamina_rule2)

[00:15] Substitution (Team_057): Klay Rozier OUT → Bradley Ginobili IN (stamina_rule2)

[00:15] Substitution (Team_057): Anfernee Adebayo OUT → Joel Wade IN (stamina_rule2)

[00:15] Substitution (Team_057): Ben Adebayo OUT → Lamelo Irving IN (stamina_rule2)

[00:15] Substitution (Team_057): Miles Middleton OUT → Zion Lillard IN (stamina_rule2)

================================================================================
                              1ST QUARTER COMPLETE                              
================================================================================

1ST QUARTER SCORE: Team_093 17, Team_057 16

BOX SCORE:
================================================================================

Team_093
--------------------------------------------------------------------------------
Player                MIN  PTS  REB  AST  TO      FG   FG%      3P   3P%
--------------------------------------------------------------------------------
Trae Westbrook         12    5    0    0   0   2/5    40.0     0/0   0.0
Ben Cunningham         12    4    7    0   0   2/3    66.7     0/0   0.0
Vince Barnes           12    3    4    0   0   2/3    66.7     0/0   0.0
Carmelo Wagner         12    3    3    1   0   1/3    33.3     0/0   0.0
Damian Williamson      12    2    0    1   0   1/3    33.3     0/0   0.0

TEAM: FG: 8/17 (47.1%), 3PT: 1/4 (25.0%), REB: 14 (4 off, 10 def), AST: 2, TO: 3
TEAM FOULS: 4


Team_057
--------------------------------------------------------------------------------
Player                MIN  PTS  REB  AST  TO      FG   FG%      3P   3P%
--------------------------------------------------------------------------------
Klay Rozier            12    8    0    0   0   3/4    75.0     0/0   0.0
Kobe Ming              12    3    0    2   0   1/6    16.7     0/0   0.0
Anfernee Adebayo       12    3    1    1   0   1/2    50.0     0/0   0.0
Ben Adebayo            12    2    5    0   0   1/2    50.0     0/0   0.0
Miles Middleton        12    0    6    0   0   0/2     0.0     0/0   0.0

TEAM: FG: 6/16 (37.5%), 3PT: 2/8 (25.0%), REB: 12 (3 off, 9 def), AST: 3, TO: 3
TEAM FOULS: 9 [Team_093 in BONUS]

================================================================================

================================================================================
                       2ND QUARTER - Team_093 vs Team_057                       
================================================================================

[12:00] Team_093 possession (Score: 17-16)
Trae Westbrook makes the 3Pt and draws the foul on Klay Rozier! And-1! Trae Westbrook to the line for 1. [Team fouls: 1] (Klay Rozier: 1 personal fouls)   FT 1/1: GOOD Trae Westbrook makes 1/1 from the line.
Score: 21-16

[11:46] Team_057 possession (Score: 21-16)
Miles Middleton drives, picks up Ben Cunningham. Help arrives from Trae Westbrook! Miles Middleton attempts a Layup. Contested by Trae Westbrook (5.2 feet, MAN). Miles Middleton misses. Rebound secured by Ben Cunningham.

[11:32] Team_093 possession (Score: 21-16)
Damian Williamson attempts a 3Pt. Contested by Kobe Ming (4.7 feet, MAN). Damian Williamson misses. Rebound secured by Ben Adebayo.

[11:16] Team_057 possession (Score: 21-16)
Miles Middleton attempts a 3Pt. Contested by Ben Cunningham (5.3 feet, MAN). Miles Middleton misses. Offensive rebound by Miles Middleton! Miles Middleton kicks it out.

[11:02] Team_057 possession (Score: 21-16)
Anfernee Adebayo attempts a Midrange. Wide open! Trae Westbrook is 6.2 feet away. [ZONE] ANFERNEE ADEBAYO MAKES IT! Assist: Kobe Ming
Score: 21-18

[10:48] Team_093 possession (Score: 21-18)
Ben Cunningham drives, Miles Middleton stays with him. Ben Cunningham attempts a Dunk. Contested by Miles Middleton (5.3 feet, MAN). BEN CUNNINGHAM MAKES IT!
Score: 23-18

[10:32] Team_057 possession (Score: 23-18)
Ben Adebayo attempts a Midrange. Contested by Vince Barnes (5.0 feet, MAN). Ben Adebayo misses. Rebound secured by Carmelo Wagner.

[10:22] Team_093 possession (Score: 23-18)
FOUL! Holding foul on Kobe Ming. [Team fouls: 2] No free throws, side out. (Kobe Ming: 1 personal fouls)

[10:08] Team_093 possession (Score: 23-18)
FOUL! Holding foul on Ben Adebayo. [Team fouls: 3] No free throws, side out. (Ben Adebayo: 1 personal fouls)

[09:51] Team_093 possession (Score: 23-18)
Carmelo Wagner attempts a 3Pt. Contested by Kobe Ming (4.6 feet, ZONE). Carmelo Wagner misses. Rebound secured by Ben Adebayo.

[09:37] Team_057 possession (Score: 23-18)
Klay Rozier attempts a 3Pt. Wide open! Trae Westbrook is 6.0 feet away. [MAN] KLAY ROZIER MAKES IT! Assist: Anfernee Adebayo
Score: 23-21

[09:23] Team_093 possession (Score: 23-21)
Trae Westbrook drives, Ben Adebayo stays with him. Trae Westbrook attempts a Layup. Contested by Ben Adebayo (4.8 feet, ZONE). TRAE WESTBROOK MAKES IT! Assist: Carmelo Wagner
Score: 25-21

[09:06] Team_057 possession (Score: 25-21)
Klay Rozier attempts a 3Pt. Contested by Damian Williamson (5.7 feet, ZONE). Klay Rozier misses. Offensive rebound by Miles Middleton! Miles Middleton kicks it out.

[08:53] Team_057 possession (Score: 25-21)
Miles Middleton drives, picks up Ben Cunningham. Help arrives from Trae Westbrook! Miles Middleton attempts a Dunk. Contested by Trae Westbrook (5.6 feet, ZONE). Miles Middleton misses. Rebound secured by Ben Cunningham.

[08:39] Team_093 possession (Score: 25-21)
FOUL! Holding foul on Ben Adebayo. [Team fouls: 4] No free throws, side out. (Ben Adebayo: 2 personal fouls)

[08:28] Team_093 possession (Score: 25-21)
Ben Cunningham attempts a Midrange. Contested by Klay Rozier (4.8 feet, ZONE). BEN CUNNINGHAM MAKES IT! Assist: Trae Westbrook
Score: 27-21

[08:15] Team_057 possession (Score: 27-21)
Klay Rozier attempts a Layup. Contested by Ben Cunningham (5.9 feet, ZONE). Klay Rozier misses. Rebound secured by Vince Barnes.

[08:02] Team_093 possession (Score: 27-21)
Trae Westbrook drives to the basket... Trae Westbrook throws a bad pass out of bounds! TURNOVER! (dead ball)

[08:02] Substitution (Team_093): Damian Williamson OUT → Shaquille George IN (stamina_rule2)

[08:02] Substitution (Team_093): Trae Westbrook OUT → Immanuel Cunningham IN (stamina_rule2)

[08:02] Substitution (Team_093): Carmelo Wagner OUT → Lauri Parker IN (stamina_rule2)

[08:02] Substitution (Team_093): Vince Barnes OUT → Kobe Murray IN (stamina_rule2)

[08:02] Substitution (Team_093): Ben Cunningham OUT → Cade O'Neal IN (stamina_rule2)

[08:02] Substitution (Team_057): Kobe Ming OUT → Scottie Johnson IN (stamina_rule2)

[08:02] Substitution (Team_057): Klay Rozier OUT → Bradley Ginobili IN (stamina_rule2)

[08:02] Substitution (Team_057): Anfernee Adebayo OUT → Joel Wade IN (stamina_rule2)

[08:02] Substitution (Team_057): Ben Adebayo OUT → Lamelo Irving IN (stamina_rule2)

[08:02] Substitution (Team_057): Miles Middleton OUT → Zion Lillard IN (stamina_rule2)

[07:52] Team_057 possession (Score: 27-21)
Bradley Ginobili makes the Layup and draws the foul on Cade O'Neal! And-1! Bradley Ginobili to the line for 1. [Team fouls: 1] (Cade O'Neal: 1 personal fouls)   FT 1/1: GOOD Bradley Ginobili makes 1/1 from the line.
Score: 27-24

[07:36] Team_093 possession (Score: 27-24)
Kobe Murray makes the Layup and draws the foul on Lamelo Irving! And-1! Kobe Murray to the line for 1. [BONUS: 5 team fouls] (Lamelo Irving: 1 personal fouls)   FT 1/1: GOOD Kobe Murray makes 1/1 from the line.
Score: 30-24

[07:22] Team_057 possession (Score: 30-24)
FOUL! Shooting foul on Kobe Murray. Scottie Johnson to the line for 2 free throws. [Team fouls: 2] (Kobe Murray: 1 personal fouls)   FT 1/2: MISS   FT 2/2: GOOD Scottie Johnson makes 1/2 from the line.
Score: 30-25

[07:09] Team_093 possession (Score: 30-25)
Shaquille George attempts a 3Pt. Contested by Scottie Johnson (5.1 feet, MAN). Shaquille George misses. Rebound secured by Zion Lillard.

[06:52] Team_057 possession (Score: 30-25)
FOUL! Holding foul on Kobe Murray. [Team fouls: 3] No free throws, side out. (Kobe Murray: 2 personal fouls)

[06:35] Team_057 possession (Score: 30-25)
Scottie Johnson attempts a 3Pt. Contested by Shaquille George (4.6 feet, MAN). Scottie Johnson misses. Rebound secured by Lauri Parker.

[06:25] Team_093 possession (Score: 30-25)
Cade O'Neal attempts a 3Pt. Contested by Scottie Johnson (4.9 feet, ZONE). Cade O'Neal misses. Offensive rebound by Cade O'Neal! Cade O'Neal kicks it out.

[06:11] Team_093 possession (Score: 30-25)
FOUL! Reach-in foul on Lamelo Irving during the drive. [IN THE BONUS! 6 team fouls] Kobe Murray to the line for 2 free throws. (Lamelo Irving: 2 personal fouls)   FT 1/2: GOOD   FT 2/2: GOOD Kobe Murray makes 2/2 from the line.
Score: 32-25

[05:53] Team_057 possession (Score: 32-25)
Lamelo Irving attempts a 3Pt. Contested by Shaquille George (5.0 feet, ZONE). Lamelo Irving misses. Rebound secured by Lauri Parker.

[05:38] Team_093 possession (Score: 32-25)
Immanuel Cunningham attempts a Midrange. Contested by Bradley Ginobili (5.1 feet, MAN). Immanuel Cunningham misses. Rebound secured by Zion Lillard.

[05:24] Team_057 possession (Score: 32-25)
Joel Wade attempts a Midrange. Contested by Lauri Parker (4.5 feet, MAN). Joel Wade misses. Rebound secured by Lauri Parker.

[05:12] Team_093 possession (Score: 32-25)
FOUL! Shooting foul on Lamelo Irving. Lauri Parker to the line for 2 free throws. [BONUS: 7 team fouls] (Lamelo Irving: 3 personal fouls)   FT 1/2: GOOD   FT 2/2: GOOD Lauri Parker makes 2/2 from the line.
Score: 34-25

[04:58] Team_057 possession (Score: 34-25)
Joel Wade attempts a 3Pt. Contested by Shaquille George (4.2 feet, ZONE). JOEL WADE MAKES IT! Assist: Bradley Ginobili
Score: 34-28

[04:43] Team_093 possession (Score: 34-28)
Kobe Murray attempts a Midrange. Contested by Bradley Ginobili (5.0 feet, ZONE). Kobe Murray misses. Offensive rebound by Cade O'Neal! Cade O'Neal kicks it out.

[04:34] Team_093 possession (Score: 34-28)
Kobe Murray attempts a Midrange. Contested by Lamelo Irving (4.8 feet, MAN). Kobe Murray misses. Rebound secured by Lamelo Irving.

[04:23] Team_057 possession (Score: 34-28)
Zion Lillard attempts a Midrange. Contested by Kobe Murray (4.3 feet, MAN). Zion Lillard misses. Rebound secured by Cade O'Neal.

[04:11] Team_093 possession (Score: 34-28)
Immanuel Cunningham attempts a 3Pt. Contested by Bradley Ginobili (5.1 feet, MAN). Immanuel Cunningham misses. FOUL! Loose ball foul on Zion Lillard during the rebound battle. [IN THE BONUS! 8 team fouls] Cade O'Neal to the line for 2 free throws. (Zion Lillard: 1 personal fouls)   FT 1/2: GOOD   FT 2/2: GOOD Cade O'Neal makes 2/2 from the line.
Score: 36-28

[03:56] Team_057 possession (Score: 36-28)
Scottie Johnson attempts a Midrange. Contested by Immanuel Cunningham (5.8 feet, ZONE). SCOTTIE JOHNSON MAKES IT! Assist: Bradley Ginobili
Score: 36-30

[03:38] Team_093 possession (Score: 36-30)
Shaquille George attempts a Layup. Contested by Lamelo Irving (5.1 feet, ZONE). Shaquille George misses. Rebound secured by Joel Wade.

[03:27] Team_057 possession (Score: 36-30)
Bradley Ginobili attempts a 3Pt. Contested by Shaquille George (4.7 feet, ZONE). BRADLEY GINOBILI MAKES IT! Assist: Zion Lillard
Score: 36-33

[03:11] Team_093 possession (Score: 36-33)
Lauri Parker attempts a 3Pt. Contested by Joel Wade (5.4 feet, MAN). Lauri Parker misses. Rebound secured by Zion Lillard.

[02:52] Team_057 possession (Score: 36-33)
FOUL! Shooting foul on Immanuel Cunningham. Bradley Ginobili to the line for 2 free throws. [Team fouls: 4] (Immanuel Cunningham: 1 personal fouls)   FT 1/2: GOOD   FT 2/2: GOOD Bradley Ginobili makes 2/2 from the line.
Score: 36-35

[02:41] Team_093 possession (Score: 36-35)
Shaquille George attempts a 3Pt. Contested by Joel Wade (5.7 feet, ZONE). SHAQUILLE GEORGE MAKES IT! Assist: Kobe Murray
Score: 39-35

[02:23] Team_057 possession (Score: 39-35)
Lamelo Irving attempts a Layup. Contested by Kobe Murray (4.8 feet, MAN). LAMELO IRVING MAKES IT!
Score: 39-37

[02:08] Team_093 possession (Score: 39-37)
Shaquille George attempts a Midrange. Contested by Lamelo Irving (5.1 feet, ZONE). Shaquille George misses. Rebound secured by Joel Wade.

[01:56] Team_057 possession (Score: 39-37)
Joel Wade attempts a 3Pt. Contested by Shaquille George (4.2 feet, ZONE). JOEL WADE MAKES IT! Assist: Bradley Ginobili
Score: 39-40

[01:38] Team_093 possession (Score: 39-40)
Cade O'Neal loses control! Ball rolls out of bounds! TURNOVER! (dead ball)

[01:23] Team_057 possession (Score: 39-40)
Joel Wade makes the Midrange and draws the foul on Lauri Parker! And-1! Joel Wade to the line for 1. [BONUS: 5 team fouls] (Lauri Parker: 1 personal fouls)   FT 1/1: GOOD Joel Wade makes 1/1 from the line.
Score: 39-43

[01:09] Team_093 possession (Score: 39-43)
Kobe Murray attempts a Layup. Contested by Lamelo Irving (4.9 feet, MAN). KOBE MURRAY MAKES IT! Assist: Lauri Parker
Score: 41-43

[00:53] Team_057 possession (Score: 41-43)
Joel Wade drives, picks up Lauri Parker. Help arrives from Shaquille George! Joel Wade attempts a Dunk. Contested by Shaquille George (4.6 feet, MAN). Joel Wade misses. Offensive rebound by Zion Lillard! Zion Lillard puts it back in!
Score: 41-45

[00:34] Team_093 possession (Score: 41-45)
Immanuel Cunningham attempts a Layup. Contested by Bradley Ginobili (5.2 feet, MAN). IMMANUEL CUNNINGHAM MAKES IT! Assist: Shaquille George
Score: 43-45

[00:19] Team_057 possession (Score: 43-45)
Zion Lillard attempts a Layup. Contested by Kobe Murray (4.4 feet, ZONE). Zion Lillard misses. Offensive rebound by Lamelo Irving! Lamelo Irving kicks it out.

[00:08] Team_057 possession (Score: 43-45)
Zion Lillard attempts a Layup. Contested by Kobe Murray (4.5 feet, ZONE). ZION LILLARD MAKES IT! Assist: Joel Wade
Score: 43-47

================================================================================
                              2ND QUARTER COMPLETE                              
================================================================================

2ND QUARTER SCORE: Team_093 26, Team_057 31

BOX SCORE:
================================================================================

Team_093
--------------------------------------------------------------------------------
Player                MIN  PTS  REB  AST  TO      FG   FG%      3P   3P%
--------------------------------------------------------------------------------
Kobe Murray             8    7    0    1   0   3/4    75.0     0/0   0.0
Trae Westbrook         16    6    0    1   0   2/2   100.0     0/0   0.0
Ben Cunningham         16    4    2    0   0   2/2   100.0     0/0   0.0
Shaquille George        8    3    0    1   0   1/4    25.0     0/0   0.0
Lauri Parker            8    2    3    1   0   1/2    50.0     0/0   0.0
Cade O'Neal             8    2    3    0   0   1/1   100.0     0/0   0.0
Immanuel Cunningham     8    2    0    0   0   1/2    50.0     0/0   0.0
Damian Williamson      16    0    0    0   0   0/1     0.0     0/0   0.0
Carmelo Wagner         16    0    1    1   0   0/1     0.0     0/0   0.0
Vince Barnes           16    0    1    0   0   0/0     0.0     0/0   0.0

TEAM: FG: 11/19 (57.9%), 3PT: 3/7 (42.9%), REB: 10 (2 off, 8 def), AST: 5, TO: 2
TEAM FOULS: 5 [Team_057 in BONUS]


Team_057
--------------------------------------------------------------------------------
Player                MIN  PTS  REB  AST  TO      FG   FG%      3P   3P%
--------------------------------------------------------------------------------
Joel Wade               8    9    2    1   0   3/4    75.0     0/0   0.0
Bradley Ginobili        8    8    0    3   0   3/3   100.0     0/0   0.0
Zion Lillard            8    4    4    1   0   2/3    66.7     0/0   0.0
Klay Rozier            16    3    0    0   0   1/2    50.0     0/0   0.0
Scottie Johnson         8    3    0    0   0   2/3    66.7     0/0   0.0
Anfernee Adebayo       16    2    0    1   0   1/1   100.0     0/0   0.0
Lamelo Irving           8    2    2    0   0   1/2    50.0     0/0   0.0
Miles Middleton        16    0    2    0   0   0/2     0.0     0/0   0.0
Ben Adebayo            16    0    2    0   0   0/1     0.0     0/0   0.0
Kobe Ming              16    0    0    1   0   0/0     0.0     0/0   0.0

TEAM: FG: 13/21 (61.9%), 3PT: 4/6 (66.7%), REB: 12 (4 off, 8 def), AST: 7, TO: 0
TEAM FOULS: 8 [Team_093 in BONUS]

================================================================================

================================================================================
                       3RD QUARTER - Team_093 vs Team_057                       
================================================================================

[12:00] Team_093 possession (Score: 43-47)
Damian Williamson attempts a Layup. Contested by Kobe Ming (4.4 feet, MAN). DAMIAN WILLIAMSON MAKES IT!
Score: 45-47

[11:47] Team_057 possession (Score: 45-47)
Ben Adebayo attempts a 3Pt. Contested by Carmelo Wagner (3.9 feet, ZONE). Ben Adebayo misses. Rebound secured by Carmelo Wagner.

[11:33] Team_093 possession (Score: 45-47)
Vince Barnes attempts a Midrange. Contested by Ben Adebayo (4.6 feet, ZONE). VINCE BARNES MAKES IT! Assist: Trae Westbrook
Score: 47-47

[11:22] Team_057 possession (Score: 47-47)
FOUL! Shooting foul on Damian Williamson. Kobe Ming to the line for 3 free throws. [Team fouls: 1] (Damian Williamson: 1 personal fouls)   FT 1/3: MISS   FT 2/3: GOOD   FT 3/3: GOOD Kobe Ming makes 2/3 from the line.
Score: 47-49

[11:09] Team_093 possession (Score: 47-49)
Ben Cunningham attempts a Midrange. Contested by Miles Middleton (4.9 feet, MAN). Ben Cunningham misses. Rebound secured by Anfernee Adebayo.

[10:56] Team_057 possession (Score: 47-49)
Klay Rozier drives, Trae Westbrook stays with him. Klay Rozier attempts a Dunk. Contested by Trae Westbrook (5.6 feet, MAN). Klay Rozier misses. Rebound secured by Carmelo Wagner.

[10:43] Team_093 possession (Score: 47-49)
Damian Williamson attempts a Midrange. BLOCKED BY ANFERNEE ADEBAYO! Ball is loose! Rebound secured by Anfernee Adebayo.

[10:29] Team_057 possession (Score: 47-49)
Miles Middleton attempts a Layup. BLOCKED BY BEN CUNNINGHAM! Ball deflects out of bounds off Miles Middleton.

[10:19] Team_093 possession (Score: 47-49)
Ben Cunningham attempts a Layup. Contested by Ben Adebayo (5.0 feet, ZONE). BEN CUNNINGHAM MAKES IT! Assist: Damian Williamson
Score: 49-49

[10:04] Team_057 possession (Score: 49-49)
Kobe Ming attempts a 3Pt. Contested by Damian Williamson (5.1 feet, MAN). KOBE MING MAKES IT!
Score: 49-52

[09:51] Team_093 possession (Score: 49-52)
Trae Westbrook attempts a Layup. Contested by Ben Adebayo (4.2 feet, ZONE). Trae Westbrook misses. Rebound secured by Ben Adebayo.

[09:37] Team_057 possession (Score: 49-52)
Anfernee Adebayo attempts a 3Pt. Contested by Carmelo Wagner (3.8 feet, MAN). Anfernee Adebayo misses. Rebound secured by Carmelo Wagner.

[09:25] Team_093 possession (Score: 49-52)
Ben Cunningham drives, Miles Middleton stays with him. Ben Cunningham attempts a Layup. Contested by Miles Middleton (4.9 feet, MAN). Ben Cunningham misses. Rebound secured by Anfernee Adebayo.

[09:12] Team_057 possession (Score: 49-52)
Ben Adebayo attempts a Midrange. Contested by Vince Barnes (4.6 feet, ZONE). Ben Adebayo misses. Offensive rebound by Miles Middleton! Miles Middleton kicks it out.

[08:54] Team_057 possession (Score: 49-52)
FOUL! Shooting foul on Trae Westbrook. Kobe Ming to the line for 2 free throws. [Team fouls: 2] (Trae Westbrook: 1 personal fouls)   FT 1/2: MISS   FT 2/2: GOOD Kobe Ming makes 1/2 from the line.
Score: 49-53

[08:42] Team_093 possession (Score: 49-53)
Ben Cunningham attempts a 3Pt. Contested by Kobe Ming (4.9 feet, ZONE). Ben Cunningham misses. Rebound secured by Anfernee Adebayo.

[08:26] Team_057 possession (Score: 49-53)
FOUL! Shooting foul on Trae Westbrook. Miles Middleton to the line for 2 free throws. [Team fouls: 3] (Trae Westbrook: 2 personal fouls)   FT 1/2: GOOD   FT 2/2: MISS Miles Middleton makes 1/2 from the line. Rebound secured by Ben Cunningham.
Score: 49-54

[08:11] Team_093 possession (Score: 49-54)
Carmelo Wagner attempts a 3Pt. Contested by Anfernee Adebayo (4.5 feet, MAN). Carmelo Wagner misses. Rebound secured by Anfernee Adebayo.

[07:56] Team_057 possession (Score: 49-54)
Kobe Ming attempts a 3Pt. Contested by Damian Williamson (5.1 feet, MAN). Kobe Ming misses. Offensive rebound by Miles Middleton! Miles Middleton kicks it out.

[07:45] Team_057 possession (Score: 49-54)
Anfernee Adebayo attempts a 3Pt. Contested by Carmelo Wagner (3.8 feet, MAN). Anfernee Adebayo misses. Rebound secured by Vince Barnes.

[07:32] Team_093 possession (Score: 49-54)
Damian Williamson makes the Layup and draws the foul on Kobe Ming! And-1! Damian Williamson to the line for 1. [Team fouls: 1] (Kobe Ming: 1 personal fouls)   FT 1/1: GOOD Damian Williamson makes 1/1 from the line.
Score: 52-54

[07:15] Team_057 possession (Score: 52-54)
FOUL! Shooting foul on Trae Westbrook. Klay Rozier to the line for 2 free throws. [Team fouls: 4] (Trae Westbrook: 3 personal fouls)   FT 1/2: GOOD   FT 2/2: MISS Klay Rozier makes 1/2 from the line. Rebound secured by Carmelo Wagner.
Score: 52-55

[07:00] Team_093 possession (Score: 52-55)
FOUL! Shooting foul on Ben Adebayo. Damian Williamson to the line for 2 free throws. [Team fouls: 2] (Ben Adebayo: 1 personal fouls)   FT 1/2: GOOD   FT 2/2: GOOD Damian Williamson makes 2/2 from the line.
Score: 54-55

[06:43] Team_057 possession (Score: 54-55)
Miles Middleton attempts a Midrange. Contested by Damian Williamson (4.7 feet, ZONE). Miles Middleton misses. Rebound secured by Ben Cunningham.

[06:32] Team_093 possession (Score: 54-55)
Damian Williamson drives and kicks out. Damian Williamson attempts a 3Pt. Contested by Kobe Ming (4.4 feet, MAN). Damian Williamson misses. Rebound secured by Anfernee Adebayo.

[06:15] Team_057 possession (Score: 54-55)
Klay Rozier makes the Layup and draws the foul on Trae Westbrook! And-1! Klay Rozier to the line for 1. [BONUS: 5 team fouls] (Trae Westbrook: 4 personal fouls)   FT 1/1: GOOD Klay Rozier makes 1/1 from the line.
Score: 54-58

[06:01] Team_093 possession (Score: 54-58)
Ben Cunningham drives and kicks out. Carmelo Wagner attempts a 3Pt. Contested by Anfernee Adebayo (4.8 feet, MAN). Carmelo Wagner misses. Rebound secured by Ben Adebayo.

[05:46] Team_057 possession (Score: 54-58)
Ben Adebayo attempts a 3Pt. Contested by Carmelo Wagner (3.9 feet, ZONE). Ben Adebayo misses. Offensive rebound by Miles Middleton! Miles Middleton kicks it out.

[05:32] Team_057 possession (Score: 54-58)
Ben Adebayo drives to the basket... Ben Adebayo loses control! Ball rolls out of bounds! TURNOVER! (dead ball)

[05:22] Team_093 possession (Score: 54-58)
Trae Westbrook attempts a 3Pt. Contested by Klay Rozier (3.4 feet, MAN). TRAE WESTBROOK MAKES IT! Assist: Carmelo Wagner
Score: 57-58

[05:05] Team_057 possession (Score: 57-58)
Anfernee Adebayo attempts a 3Pt. Contested by Carmelo Wagner (3.9 feet, ZONE). Anfernee Adebayo misses. Rebound secured by Ben Cunningham.

[04:47] Team_093 possession (Score: 57-58)
Ben Cunningham attempts a Midrange. Contested by Miles Middleton (5.0 feet, MAN). BEN CUNNINGHAM MAKES IT! Assist: Trae Westbrook
Score: 59-58

[04:35] Team_057 possession (Score: 59-58)
Miles Middleton drives to the basket... Miles Middleton loses the ball! Stripped by Ben Cunningham! TURNOVER! (live ball)

[04:22] Team_093 possession (Score: 59-58)
FOUL! Shooting foul on Ben Adebayo. Damian Williamson to the line for 2 free throws. [Team fouls: 3] (Ben Adebayo: 2 personal fouls)   FT 1/2: GOOD   FT 2/2: GOOD Damian Williamson makes 2/2 from the line.
Score: 61-58

[04:07] Team_057 possession (Score: 61-58)
Klay Rozier attempts a 3Pt. Contested by Carmelo Wagner (3.7 feet, ZONE). Klay Rozier misses. Rebound secured by Vince Barnes.

[03:53] Team_093 possession (Score: 61-58)
Ben Cunningham makes the Layup and draws the foul on Ben Adebayo! And-1! Ben Cunningham to the line for 1. [Team fouls: 4] (Ben Adebayo: 3 personal fouls)   FT 1/1: GOOD Ben Cunningham makes 1/1 from the line.
Score: 64-58

[03:40] Team_057 possession (Score: 64-58)
Kobe Ming attempts a Layup. Contested by Ben Cunningham (5.4 feet, ZONE). KOBE MING MAKES IT! Assist: Anfernee Adebayo
Score: 64-60

[03:24] Team_093 possession (Score: 64-60)
Vince Barnes throws a bad pass out of bounds! TURNOVER! (dead ball)

[03:24] Substitution (Team_093): Damian Williamson OUT → Shaquille George IN (stamina_rule2)

[03:24] Substitution (Team_093): Carmelo Wagner OUT → Lauri Parker IN (stamina_rule2)

[03:24] Substitution (Team_093): Ben Cunningham OUT → Cade O'Neal IN (stamina_rule2)

[03:08] Team_057 possession (Score: 64-60)
Klay Rozier attempts a 3Pt. Contested by Trae Westbrook (5.7 feet, MAN). KLAY ROZIER MAKES IT! Assist: Kobe Ming
Score: 64-63

[02:53] Team_093 possession (Score: 64-63)
Vince Barnes attempts a Layup. Contested by Ben Adebayo (4.8 feet, ZONE). Vince Barnes misses. Rebound secured by Ben Adebayo.

[02:39] Team_057 possession (Score: 64-63)
Miles Middleton attempts a Layup. BLOCKED BY CADE O'NEAL! Ball is loose! Rebound secured by Vince Barnes.

[02:24] Team_093 possession (Score: 64-63)
FOUL! Shooting foul on Miles Middleton. Cade O'Neal to the line for 2 free throws. [BONUS: 5 team fouls] (Miles Middleton: 1 personal fouls)   FT 1/2: GOOD   FT 2/2: GOOD Cade O'Neal makes 2/2 from the line.
Score: 66-63

[02:08] Team_057 possession (Score: 66-63)
Miles Middleton drives, Cade O'Neal stays with him. Miles Middleton attempts a Layup. Contested by Cade O'Neal (5.1 feet, MAN). Miles Middleton misses. Rebound secured by Lauri Parker.

[01:57] Team_093 possession (Score: 66-63)
Shaquille George attempts a 3Pt. Contested by Kobe Ming (5.1 feet, MAN). Shaquille George misses. Rebound secured by Anfernee Adebayo.

[01:43] Team_057 possession (Score: 66-63)
Klay Rozier attempts a Layup. Contested by Vince Barnes (4.6 feet, ZONE). Klay Rozier misses. Offensive rebound by Ben Adebayo! Ben Adebayo kicks it out.

[01:29] Team_057 possession (Score: 66-63)
Klay Rozier attempts a 3Pt. Contested by Trae Westbrook (5.9 feet, MAN). Klay Rozier misses. Rebound secured by Cade O'Neal.

[01:15] Team_093 possession (Score: 66-63)
Cade O'Neal attempts a Layup. Contested by Ben Adebayo (5.0 feet, ZONE). Cade O'Neal misses. Rebound secured by Miles Middleton.

[01:02] Team_057 possession (Score: 66-63)
Ben Adebayo attempts a Midrange. Contested by Vince Barnes (5.0 feet, MAN). BEN ADEBAYO MAKES IT! Assist: Anfernee Adebayo
Score: 66-65

[00:49] Team_093 possession (Score: 66-65)
Trae Westbrook attempts a 3Pt. Contested by Klay Rozier (3.9 feet, MAN). Trae Westbrook misses. Rebound secured by Anfernee Adebayo.

[00:34] Team_057 possession (Score: 66-65)
Anfernee Adebayo attempts a 3Pt. Contested by Shaquille George (4.7 feet, ZONE). Anfernee Adebayo misses. Rebound secured by Cade O'Neal.

[00:16] Team_093 possession (Score: 66-65)
Trae Westbrook attempts a 3Pt. Contested by Kobe Ming (4.7 feet, ZONE). TRAE WESTBROOK MAKES IT! Assist: Vince Barnes
Score: 69-65

[00:03] Team_057 possession (Score: 69-65)
Anfernee Adebayo attempts a 3Pt. Contested by Lauri Parker (4.9 feet, MAN). Anfernee Adebayo misses. Rebound secured by Cade O'Neal.

================================================================================
                              3RD QUARTER COMPLETE                              
================================================================================

3RD QUARTER SCORE: Team_093 26, Team_057 18

BOX SCORE:
================================================================================

Team_093
--------------------------------------------------------------------------------
Player                MIN  PTS  REB  AST  TO      FG   FG%      3P   3P%
--------------------------------------------------------------------------------
Damian Williamson      25    9    0    1   0   4/6    66.7     0/0   0.0
Ben Cunningham         25    7    3    0   0   3/7    42.9     0/0   0.0
Trae Westbrook         28    6    0    2   0   2/4    50.0     0/0   0.0
Vince Barnes           28    2    3    1   0   1/2    50.0     0/0   0.0
Cade O'Neal            11    2    3    0   0   1/2    50.0     0/0   0.0
Carmelo Wagner         25    0    4    1   0   0/1     0.0     0/0   0.0
Lauri Parker           11    0    1    0   0   0/0     0.0     0/0   0.0
Shaquille George       11    0    0    0   0   0/1     0.0     0/0   0.0

TEAM: FG: 11/23 (47.8%), 3PT: 2/6 (33.3%), REB: 14 (0 off, 14 def), AST: 5, TO: 1
TEAM FOULS: 5 [Team_057 in BONUS]


Team_057
--------------------------------------------------------------------------------
Player                MIN  PTS  REB  AST  TO      FG   FG%      3P   3P%
--------------------------------------------------------------------------------
Kobe Ming              28    8    0    1   0   4/4   100.0     0/0   0.0
Klay Rozier            28    6    0    0   0   2/6    33.3     0/0   0.0
Ben Adebayo            28    2    4    0   0   1/2    50.0     0/0   0.0
Anfernee Adebayo       28    0    8    2   0   0/5     0.0     0/0   0.0
Miles Middleton        28    0    4    0   0   0/5     0.0     0/0   0.0

TEAM: FG: 7/22 (31.8%), 3PT: 3/11 (27.3%), REB: 16 (4 off, 12 def), AST: 3, TO: 2
TEAM FOULS: 5 [Team_093 in BONUS]

================================================================================

================================================================================
                       4TH QUARTER - Team_093 vs Team_057                       
================================================================================

[12:00] Team_093 possession (Score: 69-65)
Trae Westbrook attempts a Midrange. Contested by Klay Rozier (3.8 feet, MAN). TRAE WESTBROOK MAKES IT! Assist: Ben Cunningham
Score: 71-65

[11:47] Team_057 possession (Score: 71-65)
Anfernee Adebayo attempts a Midrange. Contested by Carmelo Wagner (3.7 feet, MAN). ANFERNEE ADEBAYO MAKES IT! Assist: Kobe Ming
Score: 71-67

[11:31] Team_093 possession (Score: 71-67)
Trae Westbrook attempts a Midrange. Contested by Klay Rozier (3.8 feet, MAN). Trae Westbrook misses. Rebound secured by Miles Middleton.

[11:14] Team_057 possession (Score: 71-67)
FOUL! Shooting foul on Ben Cunningham. Miles Middleton to the line for 2 free throws. [Team fouls: 1] (Ben Cunningham: 1 personal fouls)   FT 1/2: GOOD   FT 2/2: GOOD Miles Middleton makes 2/2 from the line.
Score: 71-69

[11:00] Team_093 possession (Score: 71-69)
Carmelo Wagner attempts a Midrange. Contested by Ben Adebayo (4.6 feet, ZONE). CARMELO WAGNER MAKES IT!
Score: 73-69

[10:48] Team_057 possession (Score: 73-69)
FOUL! Holding foul on Ben Cunningham. [Team fouls: 2] No free throws, side out. (Ben Cunningham: 2 personal fouls)

[10:36] Team_057 possession (Score: 73-69)
Klay Rozier drives to the basket... Klay Rozier loses the ball! Stripped by Trae Westbrook! TURNOVER! (live ball)

[10:23] Team_093 possession (Score: 73-69)
Trae Westbrook attempts a Midrange. Contested by Ben Adebayo (4.8 feet, ZONE). Trae Westbrook misses. Rebound secured by Ben Adebayo.

[10:09] Team_057 possession (Score: 73-69)
Ben Adebayo drives, Ben Cunningham stays with him. Ben Adebayo attempts a Dunk. Contested by Ben Cunningham (5.5 feet, ZONE). BEN ADEBAYO MAKES IT!
Score: 73-71

[09:57] Team_093 possession (Score: 73-71)
Trae Westbrook loses the ball! Stripped by Klay Rozier! TURNOVER! (live ball)

[09:40] Team_057 possession (Score: 73-71)
Kobe Ming attempts a 3Pt. Contested by Damian Williamson (5.2 feet, MAN). Kobe Ming misses. Rebound secured by Ben Cunningham.

[09:24] Team_093 possession (Score: 73-71)
Vince Barnes attempts a 3Pt. Contested by Kobe Ming (5.2 feet, ZONE). Vince Barnes misses. Rebound secured by Ben Adebayo.

[09:06] Team_057 possession (Score: 73-71)
Miles Middleton attempts a Midrange. Contested by Trae Westbrook (5.9 feet, ZONE). Miles Middleton misses. FOUL! Loose ball foul on Vince Barnes during the rebound battle. [Team fouls: 3] No free throws, side out. (Vince Barnes: 1 personal fouls)

[08:54] Team_057 possession (Score: 73-71)
Klay Rozier commits a violation (traveling/carry)! TURNOVER! (dead ball)

[08:54] Substitution (Team_093): Damian Williamson OUT → Shaquille George IN (stamina_rule2)

[08:54] Substitution (Team_093): Trae Westbrook OUT → Immanuel Cunningham IN (stamina_rule2)

[08:54] Substitution (Team_093): Carmelo Wagner OUT → Lauri Parker IN (stamina_rule2)

[08:54] Substitution (Team_093): Vince Barnes OUT → Kobe Murray IN (stamina_rule2)

[08:54] Substitution (Team_093): Ben Cunningham OUT → Cade O'Neal IN (stamina_rule2)

[08:54] Substitution (Team_057): Kobe Ming OUT → Scottie Johnson IN (stamina_rule2)

[08:54] Substitution (Team_057): Klay Rozier OUT → Bradley Ginobili IN (stamina_rule2)

[08:54] Substitution (Team_057): Anfernee Adebayo OUT → Joel Wade IN (stamina_rule2)

[08:54] Substitution (Team_057): Ben Adebayo OUT → Lamelo Irving IN (stamina_rule2)

[08:54] Substitution (Team_057): Miles Middleton OUT → Zion Lillard IN (stamina_rule2)

[08:42] Team_093 possession (Score: 73-71)
Cade O'Neal attempts a Midrange. Contested by Bradley Ginobili (5.0 feet, ZONE). CADE O'NEAL MAKES IT! Assist: Lauri Parker
Score: 75-71

[08:25] Team_057 possession (Score: 75-71)
Bradley Ginobili makes the Midrange and draws the foul on Lauri Parker! And-1! Bradley Ginobili to the line for 1. [Team fouls: 4] (Lauri Parker: 1 personal fouls)   FT 1/1: GOOD Bradley Ginobili makes 1/1 from the line.
Score: 75-74

[08:06] Team_093 possession (Score: 75-74)
Lauri Parker attempts a Midrange. Contested by Joel Wade (5.4 feet, MAN). LAURI PARKER MAKES IT! Assist: Cade O'Neal
Score: 77-74

[07:51] Team_057 possession (Score: 77-74)
Lamelo Irving loses control! Ball rolls out of bounds! TURNOVER! (dead ball)

[07:36] Team_093 possession (Score: 77-74)
Kobe Murray attempts a Layup. Contested by Lamelo Irving (4.8 feet, ZONE). KOBE MURRAY MAKES IT! Assist: Lauri Parker
Score: 79-74

[07:22] Team_057 possession (Score: 79-74)
Zion Lillard drives and kicks out. Bradley Ginobili attempts a Midrange. Contested by Immanuel Cunningham (5.6 feet, MAN). BRADLEY GINOBILI MAKES IT! Assist: Scottie Johnson
Score: 79-76

[07:10] Team_093 possession (Score: 79-76)
Lauri Parker drives to the basket... Lauri Parker commits a violation (traveling/carry)! TURNOVER! (dead ball)

[06:59] Team_057 possession (Score: 79-76)
Bradley Ginobili attempts a Midrange. Contested by Immanuel Cunningham (6.0 feet, MAN). BRADLEY GINOBILI MAKES IT!
Score: 79-78

[06:42] Team_093 possession (Score: 79-78)
Cade O'Neal attempts a Layup. Contested by Lamelo Irving (4.9 feet, ZONE). Cade O'Neal misses. Rebound secured by Zion Lillard.

[06:24] Team_057 possession (Score: 79-78)
Lamelo Irving attempts a 3Pt. Contested by Kobe Murray (4.8 feet, MAN). LAMELO IRVING MAKES IT!
Score: 79-81

[06:11] Team_093 possession (Score: 79-81)
Lauri Parker attempts a Midrange. Contested by Joel Wade (5.4 feet, MAN). Lauri Parker misses. Rebound secured by Joel Wade.

[05:59] Team_057 possession (Score: 79-81)
Zion Lillard attempts a 3Pt. Contested by Shaquille George (4.6 feet, ZONE). Zion Lillard misses. Rebound secured by Cade O'Neal.

[05:44] Team_093 possession (Score: 79-81)
Shaquille George commits a violation (traveling/carry)! TURNOVER! (dead ball)

[05:31] Team_057 possession (Score: 79-81)
Bradley Ginobili drives to the basket... FOUL! Offensive foul on Bradley Ginobili! Immanuel Cunningham drew the charge! [Team fouls: 1] (Bradley Ginobili: 1 personal fouls) TURNOVER! (dead ball)

[05:19] Team_093 possession (Score: 79-81)
Immanuel Cunningham attempts a Midrange. Contested by Joel Wade (5.6 feet, ZONE). Immanuel Cunningham misses. Rebound secured by Zion Lillard.

[05:07] Team_057 possession (Score: 79-81)
FOUL! Shooting foul on Kobe Murray. Lamelo Irving to the line for 2 free throws. [BONUS: 5 team fouls] (Kobe Murray: 1 personal fouls)   FT 1/2: GOOD   FT 2/2: GOOD Lamelo Irving makes 2/2 from the line.
Score: 79-83

[04:50] Team_093 possession (Score: 79-83)
FOUL! Shooting foul on Bradley Ginobili. Shaquille George to the line for 2 free throws. [Team fouls: 2] (Bradley Ginobili: 2 personal fouls)   FT 1/2: GOOD   FT 2/2: MISS Shaquille George makes 1/2 from the line. Rebound secured by Joel Wade.
Score: 80-83

[04:37] Team_057 possession (Score: 80-83)
Zion Lillard attempts a Midrange. Contested by Immanuel Cunningham (5.9 feet, ZONE). Zion Lillard misses. Rebound secured by Kobe Murray.

[04:21] Team_093 possession (Score: 80-83)
FOUL! Reach-in foul on Lamelo Irving during the drive. [Team fouls: 3] No free throws, side out. (Lamelo Irving: 1 personal fouls)

[04:08] Team_093 possession (Score: 80-83)
Immanuel Cunningham drives, picks up Bradley Ginobili. Help arrives from Joel Wade! Immanuel Cunningham attempts a Dunk. Contested by Joel Wade (5.1 feet, MAN). Immanuel Cunningham misses. Rebound secured by Lamelo Irving.

[03:55] Team_057 possession (Score: 80-83)
Scottie Johnson attempts a 3Pt. Contested by Shaquille George (4.6 feet, MAN). SCOTTIE JOHNSON MAKES IT! Assist: Lamelo Irving
Score: 80-86

[03:38] Team_093 possession (Score: 80-86)
Kobe Murray attempts a 3Pt. Contested by Lamelo Irving (4.8 feet, MAN). Kobe Murray misses. FOUL! Loose ball foul on Joel Wade during the rebound battle. [Team fouls: 4] No free throws, side out. (Joel Wade: 1 personal fouls)

[03:26] Team_093 possession (Score: 80-86)
Shaquille George makes the Layup and draws the foul on Lamelo Irving! And-1! Shaquille George to the line for 1. [BONUS: 5 team fouls] (Lamelo Irving: 2 personal fouls)   FT 1/1: GOOD Shaquille George makes 1/1 from the line.
Score: 83-86

[03:16] Team_057 possession (Score: 83-86)
Scottie Johnson attempts a Midrange. Contested by Lauri Parker (5.0 feet, ZONE). SCOTTIE JOHNSON MAKES IT! Assist: Zion Lillard
Score: 83-88

[03:04] Team_093 possession (Score: 83-88)
Kobe Murray attempts a 3Pt. Contested by Scottie Johnson (4.8 feet, ZONE). Kobe Murray misses. Rebound secured by Lamelo Irving.

[02:48] Team_057 possession (Score: 83-88)
FOUL! Shooting foul on Kobe Murray. Lamelo Irving to the line for 2 free throws. [BONUS: 6 team fouls] (Kobe Murray: 2 personal fouls)   FT 1/2: GOOD   FT 2/2: GOOD Lamelo Irving makes 2/2 from the line.
Score: 83-90

[02:34] Team_093 possession (Score: 83-90)
Cade O'Neal attempts a Layup. Contested by Zion Lillard (3.6 feet, ZONE). CADE O'NEAL MAKES IT! Assist: Immanuel Cunningham
Score: 85-90

[02:19] Team_057 possession (Score: 85-90)
Zion Lillard attempts a 3Pt. Contested by Kobe Murray (4.3 feet, MAN). Zion Lillard misses. Rebound secured by Cade O'Neal.

[02:06] Team_093 possession (Score: 85-90)
Shaquille George drives and kicks out. Immanuel Cunningham attempts a Midrange. Contested by Joel Wade (5.4 feet, ZONE). IMMANUEL CUNNINGHAM MAKES IT!
Score: 87-90

[01:52] Team_057 possession (Score: 87-90)
Bradley Ginobili loses the ball! Stripped by Immanuel Cunningham! TURNOVER! (live ball)

[01:38] Team_093 possession (Score: 87-90)
Shaquille George drives to the basket... Shaquille George throws a bad pass! Stolen by Lamelo Irving! TURNOVER! (live ball)

[01:27] Team_057 possession (Score: 87-90)
FOUL! Reach-in foul on Kobe Murray during the drive. [IN THE BONUS! 7 team fouls] Bradley Ginobili to the line for 2 free throws. (Kobe Murray: 3 personal fouls)   FT 1/2: MISS   FT 2/2: MISS Bradley Ginobili makes 0/2 from the line. Rebound secured by Kobe Murray.

[01:13] Team_093 possession (Score: 87-90)
Cade O'Neal attempts a Midrange. Contested by Joel Wade (5.5 feet, ZONE). CADE O'NEAL MAKES IT!
Score: 89-90

[01:00] Team_057 possession (Score: 89-90)
Lamelo Irving throws a bad pass out of bounds! TURNOVER! (dead ball)

[00:47] Team_093 possession (Score: 89-90)
Kobe Murray drives and kicks out. Shaquille George attempts a Midrange. Contested by Bradley Ginobili (5.0 feet, ZONE). Shaquille George misses. Rebound secured by Zion Lillard.

[00:29] Team_057 possession (Score: 89-90)
Joel Wade attempts a Layup. Contested by Lauri Parker (5.0 feet, MAN). Joel Wade misses. Offensive rebound by Lamelo Irving! Lamelo Irving kicks it out.

[00:10] Team_057 possession (Score: 89-90)
Zion Lillard makes the Layup and draws the foul on Kobe Murray! And-1! Zion Lillard to the line for 1. [BONUS: 8 team fouls] (Kobe Murray: 4 personal fouls)   FT 1/1: GOOD Zion Lillard makes 1/1 from the line.
Score: 89-93

================================================================================
                              4TH QUARTER COMPLETE                              
================================================================================

4TH QUARTER SCORE: Team_093 20, Team_057 28

BOX SCORE:
================================================================================

Team_093
--------------------------------------------------------------------------------
Player                MIN  PTS  REB  AST  TO      FG   FG%      3P   3P%
--------------------------------------------------------------------------------
Cade O'Neal            20    6    3    1   0   3/4    75.0     0/0   0.0
Shaquille George       20    3    0    0   0   1/2    50.0     0/0   0.0
Trae Westbrook         32    2    0    0   0   1/3    33.3     0/0   0.0
Carmelo Wagner         28    2    0    0   0   1/1   100.0     0/0   0.0
Lauri Parker           20    2    0    2   0   1/2    50.0     0/0   0.0
Kobe Murray            17    2    2    0   0   1/3    33.3     0/0   0.0
Immanuel Cunningham    17    2    0    1   0   1/3    33.3     0/0   0.0
Ben Cunningham         28    0    1    1   0   0/0     0.0     0/0   0.0
Vince Barnes           32    0    0    0   0   0/1     0.0     0/0   0.0

TEAM: FG: 9/19 (47.4%), 3PT: 0/2 (0.0%), REB: 6 (1 off, 5 def), AST: 5, TO: 4
TEAM FOULS: 8 [Team_057 in BONUS]


Team_057
--------------------------------------------------------------------------------
Player                MIN  PTS  REB  AST  TO      FG   FG%      3P   3P%
--------------------------------------------------------------------------------
Bradley Ginobili       17    7    0    0   0   3/4    75.0     0/0   0.0
Lamelo Irving          17    7    3    1   0   3/3   100.0     0/0   0.0
Scottie Johnson        17    5    0    1   0   2/2   100.0     0/0   0.0
Zion Lillard           17    3    3    1   0   1/4    25.0     0/0   0.0
Anfernee Adebayo       32    2    0    0   0   1/1   100.0     0/0   0.0
Miles Middleton        32    2    2    0   0   1/1   100.0     0/0   0.0
Ben Adebayo            32    2    2    0   0   1/1   100.0     0/0   0.0
Kobe Ming              32    0    0    1   0   0/1     0.0     0/0   0.0
Joel Wade              17    0    2    0   0   0/0     0.0     0/0   0.0

TEAM: FG: 12/17 (70.6%), 3PT: 2/5 (40.0%), REB: 12 (2 off, 10 def), AST: 4, TO: 6
TEAM FOULS: 5 [Team_093 in BONUS]

================================================================================

================================================================================
                               FULL GAME COMPLETE                               
================================================================================

FINAL SCORE: Team_093 89, Team_057 93

SCORING BY QUARTER:
--------------------------------------------------------------------------------
Team                     Q1     Q2     Q3     Q4    FINAL
--------------------------------------------------------------------------------
Team_093                 17     26     26     20       89
Team_057                 16     31     18     28       93
--------------------------------------------------------------------------------

FULL GAME BOX SCORE:
================================================================================

Team_093
--------------------------------------------------------------------------------
Player                MIN  PTS  REB  AST  TO      FG   FG%      3P   3P%      FT STL BLK
--------------------------------------------------------------------------------
Trae Westbrook         32   19    0    3   3   6/13   46.2   4/6    66.7   3/3     2   0
Vince Barnes           32    5    8    1   1   4/7    57.1   0/1     0.0   1/2     0   0
Damian Williamson      28   11    0    2   1   5/10   50.0   0/3     0.0   5/5     0   0
Carmelo Wagner         28    5    8    3   0   2/6    33.3   0/2     0.0   1/1     1   0
Ben Cunningham         28   15   13    1   1   6/11   54.5   0/1     0.0   3/4     1   1
Shaquille George       20    6    0    1   1   3/8    37.5   1/3    33.3   2/3     0   0
Lauri Parker           20    4    4    3   1   2/4    50.0   0/1     0.0   2/2     0   0
Cade O'Neal            20   10    9    1   2   4/6    66.7   0/0     0.0   4/4     0   1
Immanuel Cunningham    17    4    0    1   0   2/5    40.0   1/1   100.0   0/0     1   0
Kobe Murray            17    9    2    1   0   4/7    57.1   0/1     0.0   3/3     0   0

TEAM: FG: 39/78 (50.0%), 3PT: 6/19 (31.6%), REB: 44 (7 off, 37 def), AST: 17, TO: 10


Team_057
--------------------------------------------------------------------------------
Player                MIN  PTS  REB  AST  TO      FG   FG%      3P   3P%      FT STL BLK
--------------------------------------------------------------------------------
Kobe Ming              32   11    0    5   0   5/11   45.5   2/7    28.6   4/6     1   0
Klay Rozier            32   17    0    0   2   6/12   50.0   3/6    50.0   5/6     1   0
Anfernee Adebayo       32    7    9    4   1   3/9    33.3   1/6    16.7   0/0     0   2
Ben Adebayo            32    6   13    0   1   3/6    50.0   0/2     0.0   0/0     0   0
Miles Middleton        32    2   14    0   3   1/10   10.0   0/0     0.0   3/4     0   0
Scottie Johnson        17    8    0    1   0   4/5    80.0   1/2    50.0   1/2     0   0
Bradley Ginobili       17   15    0    3   1   5/6    83.3   1/1   100.0   4/6     0   0
Joel Wade              17    9    4    1   1   4/5    80.0   2/2   100.0   1/1     0   0
Lamelo Irving          17    9    5    1   2   4/5    80.0   1/2    50.0   4/4     1   0
Zion Lillard           17    7    7    2   0   3/7    42.9   0/2     0.0   1/1     0   0

TEAM: FG: 38/76 (50.0%), 3PT: 11/30 (36.7%), REB: 52 (13 off, 39 def), AST: 17, TO: 11

================================================================================
