================================================================================
                        FULL GAME - Team_077 vs Team_097                        
================================================================================

================================================================================
                       1ST QUARTER - Team_077 vs Team_097                       
================================================================================

[12:00] Team_077 possession (Score: 0-0)
FOUL! Reach-in foul on Anthony Haliburton during the drive. [Team fouls: 1] No free throws, side out. (Anthony Haliburton: 1 personal fouls)

[11:44] Team_077 possession (Score: 0-0)
Ja Ball attempts a 3Pt. Contested by Evan Brogdon (5.1 feet, MAN). Ja Ball misses. Rebound secured by Shai Poole.

[11:28] Team_097 possession (Score: 0-0)
Tyrese Stewart attempts a Midrange. Contested by Draymond Dosunmu (5.2 feet, MAN). Tyrese Stewart misses. Offensive rebound by Tyrese Stewart! Tyrese Stewart kicks it out.

[11:13] Team_097 possession (Score: 0-0)
FOUL! Shooting foul on Dejounte Allen. Evan Brogdon to the line for 3 free throws. [Team fouls: 1] (Dejounte Allen: 1 personal fouls)   FT 1/3: GOOD   FT 2/3: GOOD   FT 3/3: GOOD Evan Brogdon makes 3/3 from the line.
Score: 0-3

[10:59] Team_077 possession (Score: 0-3)
Draymond Dosunmu drives, Anthony Haliburton stays with him. Draymond Dosunmu attempts a Dunk. Contested by Anthony Haliburton (2.9 feet, ZONE). DRAYMOND DOSUNMU MAKES IT! Assist: Ja Ball
Score: 2-3

[10:45] Team_097 possession (Score: 2-3)
Evan Brogdon drives to the basket... Evan Brogdon throws a bad pass out of bounds! TURNOVER! (dead ball)

[10:29] Team_077 possession (Score: 2-3)
FOUL! Holding foul on Anthony Haliburton. [Team fouls: 2] No free throws, side out. (Anthony Haliburton: 2 personal fouls)

[10:16] Team_077 possession (Score: 2-3)
Russell Harden attempts a Midrange. Contested by Anthony Haliburton (3.9 feet, MAN). Russell Harden misses. Rebound secured by Shai Poole.

[10:06] Team_097 possession (Score: 2-3)
Shai Poole drives, picks up Draymond Dosunmu. Help arrives from Ja Ball! Shai Poole attempts a Dunk. Contested by Ja Ball (4.9 feet, ZONE). Shai Poole misses. Rebound secured by Draymond Dosunmu.

[09:55] Team_077 possession (Score: 2-3)
Ja Ball drives and kicks out. FOUL! Shooting foul on Evan Brogdon. Ja Ball to the line for 2 free throws. [Team fouls: 3] (Evan Brogdon: 1 personal fouls)   FT 1/2: GOOD   FT 2/2: GOOD Ja Ball makes 2/2 from the line.
Score: 4-3

[09:44] Team_097 possession (Score: 4-3)
Tyrese Stewart attempts a 3Pt. Contested by Dejounte Allen (4.6 feet, ZONE). Tyrese Stewart misses. Rebound secured by Draymond Dosunmu.

[09:29] Team_077 possession (Score: 4-3)
FOUL! Holding foul on Anthony Haliburton. [Team fouls: 4] No free throws, side out. (Anthony Haliburton: 3 personal fouls)

[09:17] Team_077 possession (Score: 4-3)
Draymond Dosunmu attempts a Layup. Contested by Anthony Haliburton (2.9 feet, MAN). DRAYMOND DOSUNMU MAKES IT! Assist: Dejounte Allen
Score: 6-3

[08:59] Team_097 possession (Score: 6-3)
FOUL! Holding foul on Russell Harden. [Team fouls: 2] No free throws, side out. (Russell Harden: 1 personal fouls)

[08:42] Team_097 possession (Score: 6-3)
Jrue Haliburton drives and kicks out. Tyrese Stewart attempts a 3Pt. Contested by Draymond Dosunmu (4.3 feet, MAN). Tyrese Stewart misses. Rebound secured by Draymond Dosunmu.

[08:31] Team_077 possession (Score: 6-3)
Dejounte Allen drives, picks up Anthony Haliburton. Help arrives from Jrue Haliburton! Dejounte Allen attempts a Dunk. Contested by Jrue Haliburton (3.8 feet, ZONE). Dejounte Allen misses. Rebound secured by Tyrese Stewart.

[08:17] Team_097 possession (Score: 6-3)
FOUL! Reach-in foul on Draymond Dosunmu during the drive. [Team fouls: 3] No free throws, side out. (Draymond Dosunmu: 1 personal fouls)

[08:03] Team_097 possession (Score: 6-3)
Anthony Haliburton attempts a 3Pt. Contested by Chris Ginobili (4.2 feet, ZONE). Anthony Haliburton misses. FOUL! Loose ball foul on Russell Harden during the rebound battle. [Team fouls: 4] No free throws, side out. (Russell Harden: 2 personal fouls)

[07:47] Team_097 possession (Score: 6-3)
Shai Poole attempts a Midrange. Contested by Chris Ginobili (4.3 feet, MAN). SHAI POOLE MAKES IT!
Score: 6-5

[07:32] Team_077 possession (Score: 6-5)
FOUL! Shooting foul on Anthony Haliburton. Draymond Dosunmu to the line for 2 free throws. [BONUS: 5 team fouls] (Anthony Haliburton: 4 personal fouls)   FT 1/2: GOOD   FT 2/2: GOOD Draymond Dosunmu makes 2/2 from the line.
Score: 8-5

[07:16] Team_097 possession (Score: 8-5)
Tyrese Stewart attempts a Midrange. Contested by Draymond Dosunmu (5.2 feet, MAN). Tyrese Stewart misses. Rebound secured by Russell Harden.

[06:59] Team_077 possession (Score: 8-5)
Dejounte Allen attempts a 3Pt. Contested by Shai Poole (3.9 feet, ZONE). Dejounte Allen misses. Rebound secured by Tyrese Stewart.

[06:41] Team_097 possession (Score: 8-5)
Shai Poole attempts a Midrange. Contested by Chris Ginobili (4.3 feet, ZONE). Shai Poole misses. Rebound secured by Draymond Dosunmu.

[06:27] Team_077 possession (Score: 8-5)
Russell Harden drives to the basket... Russell Harden loses the ball! Stripped by Tyrese Stewart! TURNOVER! (live ball)

[06:13] Team_097 possession (Score: 8-5)
Tyrese Stewart attempts a Layup. Contested by Draymond Dosunmu (5.2 feet, ZONE). TYRESE STEWART MAKES IT! Assist: Evan Brogdon
Score: 8-7

[06:02] Team_077 possession (Score: 8-7)
Ja Ball attempts a Midrange. Contested by Evan Brogdon (5.1 feet, MAN). Ja Ball misses. Rebound secured by Tyrese Stewart.

[05:51] Team_097 possession (Score: 8-7)
FOUL! Shooting foul on Draymond Dosunmu. Tyrese Stewart to the line for 2 free throws. [BONUS: 5 team fouls] (Draymond Dosunmu: 2 personal fouls)   FT 1/2: GOOD   FT 2/2: GOOD Tyrese Stewart makes 2/2 from the line.
Score: 8-9

[05:35] Team_077 possession (Score: 8-9)
Ja Ball attempts a 3Pt. Contested by Evan Brogdon (5.1 feet, MAN). Ja Ball misses. Rebound secured by Anthony Haliburton.

[05:19] Team_097 possession (Score: 8-9)
Shai Poole drives, picks up Draymond Dosunmu. Help arrives from Ja Ball! Shai Poole attempts a Dunk. Contested by Ja Ball (4.9 feet, ZONE). SHAI POOLE MAKES IT! Assist: Evan Brogdon
Score: 8-11

[05:02] Team_077 possession (Score: 8-11)
Ja Ball drives and kicks out. Dejounte Allen attempts a 3Pt. Contested by Jrue Haliburton (5.2 feet, MAN). Dejounte Allen misses. Offensive rebound by Draymond Dosunmu! Draymond Dosunmu kicks it out.

[04:50] Team_077 possession (Score: 8-11)
Chris Ginobili attempts a 3Pt. Contested by Shai Poole (4.0 feet, ZONE). Chris Ginobili misses. Offensive rebound by Draymond Dosunmu! Draymond Dosunmu kicks it out.

[04:34] Team_077 possession (Score: 8-11)
FOUL! Shooting foul on Anthony Haliburton. Ja Ball to the line for 2 free throws. [BONUS: 6 team fouls] (Anthony Haliburton: 5 personal fouls)   FT 1/2: GOOD   FT 2/2: GOOD Ja Ball makes 2/2 from the line.
Score: 10-11

[04:22] Team_097 possession (Score: 10-11)
Evan Brogdon attempts a 3Pt. Contested by Ja Ball (4.8 feet, MAN). Evan Brogdon misses. Rebound secured by Draymond Dosunmu.

[04:07] Team_077 possession (Score: 10-11)
Russell Harden attempts a Midrange. Contested by Anthony Haliburton (4.0 feet, ZONE). Russell Harden misses. Offensive rebound by Russell Harden! Russell Harden kicks it out.

[03:53] Team_077 possession (Score: 10-11)
Ja Ball attempts a Midrange. Contested by Evan Brogdon (5.2 feet, MAN). Ja Ball misses. Rebound secured by Shai Poole.

[03:37] Team_097 possession (Score: 10-11)
Shai Poole attempts a Midrange. BLOCKED BY CHRIS GINOBILI! Ball is loose! Rebound secured by Russell Harden.

[03:24] Team_077 possession (Score: 10-11)
Chris Ginobili makes the Midrange and draws the foul on Jrue Haliburton! And-1! Chris Ginobili to the line for 1. [BONUS: 7 team fouls] (Jrue Haliburton: 1 personal fouls)   FT 1/1: GOOD Chris Ginobili makes 1/1 from the line.
Score: 13-11

[03:13] Team_097 possession (Score: 13-11)
Shai Poole makes the Dunk and draws the foul on Chris Ginobili! And-1! Shai Poole to the line for 1. [BONUS: 6 team fouls] (Chris Ginobili: 1 personal fouls)   FT 1/1: GOOD Shai Poole makes 1/1 from the line.
Score: 13-14

[02:59] Team_077 possession (Score: 13-14)
Dejounte Allen attempts a 3Pt. Contested by Shai Poole (4.1 feet, ZONE). Dejounte Allen misses. Rebound secured by Anthony Haliburton.

[02:46] Team_097 possession (Score: 13-14)
Shai Poole drives, picks up Chris Ginobili. Help arrives from Ja Ball! Shai Poole attempts a Layup. Contested by Ja Ball (4.5 feet, MAN). Shai Poole misses. Offensive rebound by Tyrese Stewart! Tyrese Stewart kicks it out.

[02:30] Team_097 possession (Score: 13-14)
Jrue Haliburton attempts a Midrange. BLOCKED BY DEJOUNTE ALLEN! Ball goes out off Dejounte Allen. Jrue Haliburton's ball!

[02:19] Team_097 possession (Score: 13-14)
Evan Brogdon attempts a 3Pt. Contested by Dejounte Allen (4.6 feet, ZONE). Evan Brogdon misses. Rebound secured by Chris Ginobili.

[02:05] Team_077 possession (Score: 13-14)
Ja Ball attempts a 3Pt. Contested by Evan Brogdon (5.4 feet, MAN). JA BALL MAKES IT! Assist: Russell Harden
Score: 16-14

[01:47] Team_097 possession (Score: 16-14)
Tyrese Stewart drives to the basket... Tyrese Stewart loses the ball! Stripped by Draymond Dosunmu! TURNOVER! (live ball)

[01:29] Team_077 possession (Score: 16-14)
FOUL! Reach-in foul on Jrue Haliburton during the drive. [IN THE BONUS! 8 team fouls] Dejounte Allen to the line for 2 free throws. (Jrue Haliburton: 2 personal fouls)   FT 1/2: GOOD   FT 2/2: GOOD Dejounte Allen makes 2/2 from the line.
Score: 18-14

[01:18] Team_097 possession (Score: 18-14)
Tyrese Stewart drives, Draymond Dosunmu stays with him. Tyrese Stewart attempts a Layup. Contested by Draymond Dosunmu (5.5 feet, ZONE). TYRESE STEWART MAKES IT!
Score: 18-16

[01:03] Team_077 possession (Score: 18-16)
Chris Ginobili attempts a 3Pt. Contested by Shai Poole (4.4 feet, MAN). Chris Ginobili misses. Rebound secured by Tyrese Stewart.

[00:43] Team_097 possession (Score: 18-16)
FOUL! Shooting foul on Draymond Dosunmu. Tyrese Stewart to the line for 2 free throws. [BONUS: 7 team fouls] (Draymond Dosunmu: 3 personal fouls)   FT 1/2: MISS   FT 2/2: GOOD Tyrese Stewart makes 1/2 from the line.
Score: 18-17

[00:31] Team_077 possession (Score: 18-17)
Chris Ginobili attempts a Midrange. Contested by Anthony Haliburton (4.4 feet, ZONE). Chris Ginobili misses. Rebound secured by Shai Poole.

[00:15] Team_097 possession (Score: 18-17)
Shai Poole attempts a 3Pt. Contested by Dejounte Allen (4.7 feet, ZONE). Shai Poole misses. Rebound secured by Russell Harden.

================================================================================
                              1ST QUARTER COMPLETE                              
================================================================================

1ST QUARTER SCORE: Team_077 18, Team_097 17

BOX SCORE:
================================================================================

Team_077
--------------------------------------------------------------------------------
Player                MIN  PTS  REB  AST  TO      FG   FG%      3P   3P%
--------------------------------------------------------------------------------
Ja Ball                12    7    0    1   0   3/7    42.9     0/0   0.0
Draymond Dosunmu       12    6    7    0   0   3/3   100.0     0/0   0.0
Chris Ginobili         12    3    1    0   0   1/3    33.3     0/0   0.0
Dejounte Allen         12    2    0    1   0   1/4    25.0     0/0   0.0
Russell Harden         12    0    4    1   0   0/1     0.0     0/0   0.0

TEAM: FG: 8/18 (44.4%), 3PT: 1/6 (16.7%), REB: 12 (3 off, 9 def), AST: 3, TO: 1
TEAM FOULS: 7 [Team_097 in BONUS]


Team_097
--------------------------------------------------------------------------------
Player                MIN  PTS  REB  AST  TO      FG   FG%      3P   3P%
--------------------------------------------------------------------------------
Shai Poole             12    7    4    0   0   3/7    42.9     0/0   0.0
Tyrese Stewart         12    7    6    0   0   4/6    66.7     0/0   0.0
Evan Brogdon           12    3    0    2   0   1/3    33.3     0/0   0.0
Jrue Haliburton        12    0    0    0   0   0/1     0.0     0/0   0.0
Anthony Haliburton     12    0    3    0   0   0/0     0.0     0/0   0.0

TEAM: FG: 8/17 (47.1%), 3PT: 1/5 (20.0%), REB: 13 (3 off, 10 def), AST: 2, TO: 2
TEAM FOULS: 8 [Team_077 in BONUS]

================================================================================

================================================================================
                       2ND QUARTER - Team_077 vs Team_097                       
================================================================================

[12:00] Team_077 possession (Score: 18-17)
Ja Ball attempts a 3Pt. Contested by Shai Poole (4.1 feet, ZONE). Ja Ball misses. Rebound secured by Shai Poole.

[11:45] Team_097 possession (Score: 18-17)
Anthony Haliburton attempts a 3Pt. Contested by Dejounte Allen (4.4 feet, ZONE). Anthony Haliburton misses. Rebound secured by Chris Ginobili.

[11:30] Team_077 possession (Score: 18-17)
Draymond Dosunmu makes the Dunk and draws the foul on Jrue Haliburton! And-1! Draymond Dosunmu to the line for 1. [Team fouls: 1] (Jrue Haliburton: 1 personal fouls)   FT 1/1: GOOD Draymond Dosunmu makes 1/1 from the line.
Score: 21-17

[11:19] Team_097 possession (Score: 21-17)
Jrue Haliburton attempts a 3Pt. Contested by Dejounte Allen (4.5 feet, MAN). Jrue Haliburton misses. FOUL! Loose ball foul on Chris Ginobili during the rebound battle. [Team fouls: 1] No free throws, side out. (Chris Ginobili: 1 personal fouls)

[11:04] Team_097 possession (Score: 21-17)
Anthony Haliburton attempts a Layup. Contested by Draymond Dosunmu (5.1 feet, ZONE). Anthony Haliburton misses. Rebound secured by Chris Ginobili.

[10:53] Team_077 possession (Score: 21-17)
Ja Ball attempts a 3Pt. Contested by Shai Poole (4.3 feet, ZONE). Ja Ball misses. Rebound secured by Anthony Haliburton.

[10:41] Team_097 possession (Score: 21-17)
Anthony Haliburton drives and kicks out. Shai Poole attempts a 3Pt. Contested by Dejounte Allen (4.2 feet, ZONE). Shai Poole misses. Offensive rebound by Tyrese Stewart! Tyrese Stewart kicks it out.

[10:29] Team_097 possession (Score: 21-17)
Shai Poole attempts a 3Pt. Contested by Chris Ginobili (4.8 feet, MAN). Shai Poole misses. Rebound secured by Draymond Dosunmu.

[10:12] Team_077 possession (Score: 21-17)
Ja Ball attempts a 3Pt. Contested by Shai Poole (4.3 feet, ZONE). Ja Ball misses. Offensive rebound by Draymond Dosunmu! Draymond Dosunmu kicks it out.

[09:55] Team_077 possession (Score: 21-17)
Dejounte Allen attempts a 3Pt. Wide open! Jrue Haliburton is 6.0 feet away. [MAN] Dejounte Allen misses. Rebound secured by Shai Poole.

[09:41] Team_097 possession (Score: 21-17)
Jrue Haliburton drives to the basket... Jrue Haliburton loses control! Ball rolls out of bounds! TURNOVER! (dead ball)

[09:41] Substitution (Team_077): Ja Ball OUT → Bam Bryant IN (stamina_rule2)

[09:41] Substitution (Team_077): Dejounte Allen OUT → Dejounte Quickley IN (stamina_rule2)

[09:41] Substitution (Team_077): Chris Ginobili OUT → Tyler Poole IN (stamina_rule2)

[09:41] Substitution (Team_077): Russell Harden OUT → Jordan Simmons IN (stamina_rule2)

[09:41] Substitution (Team_077): Draymond Dosunmu OUT → Ayo Griffin IN (stamina_rule2)

[09:41] Substitution (Team_097): Evan Brogdon OUT → Gary Carter IN (stamina_rule2)

[09:41] Substitution (Team_097): Jrue Haliburton OUT → Dwyane Ginobili IN (stamina_rule2)

[09:41] Substitution (Team_097): Shai Poole OUT → Miles Dosunmu IN (stamina_rule2)

[09:41] Substitution (Team_097): Anthony Haliburton OUT → Joel Simons IN (stamina_rule2)

[09:41] Substitution (Team_097): Tyrese Stewart OUT → Miles Banchero IN (stamina_rule2)

[09:26] Team_077 possession (Score: 21-17)
Jordan Simmons drives and kicks out. Tyler Poole attempts a 3Pt. Contested by Miles Dosunmu (3.8 feet, MAN). Tyler Poole misses. Rebound secured by Miles Dosunmu.

[09:08] Team_097 possession (Score: 21-17)
Joel Simons loses control! Ball rolls out of bounds! TURNOVER! (dead ball)

[08:56] Team_077 possession (Score: 21-17)
Dejounte Quickley attempts a 3Pt. Contested by Dwyane Ginobili (4.7 feet, MAN). Dejounte Quickley misses. Rebound secured by Miles Banchero.

[08:42] Team_097 possession (Score: 21-17)
Miles Banchero attempts a Midrange. Contested by Jordan Simmons (4.1 feet, ZONE). MILES BANCHERO MAKES IT!
Score: 21-19

[08:27] Team_077 possession (Score: 21-19)
Tyler Poole attempts a Midrange. Contested by Miles Dosunmu (4.2 feet, MAN). Tyler Poole misses. Rebound secured by Miles Dosunmu.

[08:12] Team_097 possession (Score: 21-19)
Gary Carter attempts a Layup. BLOCKED BY DEJOUNTE QUICKLEY! Ball deflects out of bounds off Gary Carter.

[07:55] Team_077 possession (Score: 21-19)
Dejounte Quickley drives, picks up Dwyane Ginobili. Help arrives from Miles Dosunmu! Dejounte Quickley attempts a Dunk. Contested by Miles Dosunmu (4.7 feet, MAN). Dejounte Quickley misses. Rebound secured by Miles Banchero.

[07:43] Team_097 possession (Score: 21-19)
Miles Dosunmu attempts a Midrange. Contested by Tyler Poole (4.7 feet, ZONE). Miles Dosunmu misses. Rebound secured by Jordan Simmons.

[07:26] Team_077 possession (Score: 21-19)
Ayo Griffin drives, picks up Joel Simons. Help arrives from Dwyane Ginobili! Ayo Griffin attempts a Layup. Contested by Dwyane Ginobili (3.4 feet, ZONE). Ayo Griffin misses. Rebound secured by Miles Banchero.

[07:09] Team_097 possession (Score: 21-19)
Miles Dosunmu attempts a 3Pt. Contested by Tyler Poole (4.7 feet, MAN). Miles Dosunmu misses. Rebound secured by Jordan Simmons.

[06:53] Team_077 possession (Score: 21-19)
Dejounte Quickley attempts a 3Pt. Contested by Dwyane Ginobili (4.7 feet, MAN). DEJOUNTE QUICKLEY MAKES IT! Assist: Tyler Poole
Score: 24-19

[06:39] Team_097 possession (Score: 24-19)
FOUL! Shooting foul on Dejounte Quickley. Miles Dosunmu to the line for 2 free throws. [Team fouls: 2] (Dejounte Quickley: 1 personal fouls)   FT 1/2: GOOD   FT 2/2: GOOD Miles Dosunmu makes 2/2 from the line.
Score: 24-21

[06:23] Team_077 possession (Score: 24-21)
Dejounte Quickley drives, Joel Simons stays with him. Dejounte Quickley attempts a Dunk. Contested by Joel Simons (3.7 feet, ZONE). DEJOUNTE QUICKLEY MAKES IT! Assist: Ayo Griffin
Score: 26-21

[06:11] Team_097 possession (Score: 26-21)
Joel Simons attempts a Layup. Contested by Ayo Griffin (4.9 feet, ZONE). Joel Simons misses. Rebound secured by Jordan Simmons.

[05:57] Team_077 possession (Score: 26-21)
Dejounte Quickley drives, Dwyane Ginobili stays with him. Dejounte Quickley attempts a Dunk. Contested by Dwyane Ginobili (4.7 feet, MAN). DEJOUNTE QUICKLEY MAKES IT! Assist: Ayo Griffin
Score: 28-21

[05:43] Team_097 possession (Score: 28-21)
FOUL! Shooting foul on Dejounte Quickley. Dwyane Ginobili to the line for 2 free throws. [Team fouls: 3] (Dejounte Quickley: 2 personal fouls)   FT 1/2: GOOD   FT 2/2: GOOD Dwyane Ginobili makes 2/2 from the line.
Score: 28-23

[05:29] Team_077 possession (Score: 28-23)
Ayo Griffin drives to the basket... Ayo Griffin commits a violation (traveling/carry)! TURNOVER! (dead ball)

[05:12] Team_097 possession (Score: 28-23)
Joel Simons attempts a 3Pt. Contested by Tyler Poole (4.4 feet, ZONE). Joel Simons misses. Offensive rebound by Miles Dosunmu! Miles Dosunmu kicks it out.

[04:58] Team_097 possession (Score: 28-23)
Joel Simons drives, picks up Jordan Simmons. Help arrives from Dejounte Quickley! Joel Simons attempts a Layup. Contested by Dejounte Quickley (4.2 feet, ZONE). JOEL SIMONS MAKES IT! Assist: Gary Carter
Score: 28-25

[04:44] Team_077 possession (Score: 28-25)
Bam Bryant drives and kicks out. Ayo Griffin attempts a Midrange. Contested by Joel Simons (3.6 feet, MAN). Ayo Griffin misses. Rebound secured by Joel Simons.

[04:29] Team_097 possession (Score: 28-25)
Gary Carter throws a bad pass out of bounds! TURNOVER! (dead ball)

[04:11] Team_077 possession (Score: 28-25)
FOUL! Reach-in foul on Joel Simons during the drive. [Team fouls: 2] No free throws, side out. (Joel Simons: 1 personal fouls)

[03:54] Team_077 possession (Score: 28-25)
Dejounte Quickley attempts a Midrange. Contested by Miles Dosunmu (3.9 feet, ZONE). Dejounte Quickley misses. Rebound secured by Joel Simons.

[03:43] Team_097 possession (Score: 28-25)
Miles Dosunmu attempts a Layup. Contested by Tyler Poole (4.7 feet, MAN). Miles Dosunmu misses. Rebound secured by Tyler Poole.

[03:29] Team_077 possession (Score: 28-25)
Bam Bryant attempts a 3Pt. Contested by Joel Simons (3.7 feet, ZONE). Bam Bryant misses. Rebound secured by Miles Dosunmu.

[03:14] Team_097 possession (Score: 28-25)
Dwyane Ginobili drives, Dejounte Quickley stays with him. Dwyane Ginobili attempts a Layup. Contested by Dejounte Quickley (4.1 feet, MAN). Dwyane Ginobili misses. Rebound secured by Ayo Griffin.

[02:57] Team_077 possession (Score: 28-25)
Dejounte Quickley drives and kicks out. Tyler Poole attempts a Midrange. Contested by Dwyane Ginobili (4.6 feet, ZONE). TYLER POOLE MAKES IT! Assist: Jordan Simmons
Score: 30-25

[02:38] Team_097 possession (Score: 30-25)
FOUL! Shooting foul on Tyler Poole. Miles Dosunmu to the line for 2 free throws. [Team fouls: 4] (Tyler Poole: 1 personal fouls)   FT 1/2: GOOD   FT 2/2: GOOD Miles Dosunmu makes 2/2 from the line.
Score: 30-27

[02:27] Team_077 possession (Score: 30-27)
Jordan Simmons makes the Midrange and draws the foul on Joel Simons! And-1! Jordan Simmons to the line for 1. [Team fouls: 3] (Joel Simons: 2 personal fouls)   FT 1/1: GOOD Jordan Simmons makes 1/1 from the line.
Score: 33-27

[02:13] Team_097 possession (Score: 33-27)
Miles Dosunmu drives, Tyler Poole stays with him. Miles Dosunmu attempts a Layup. Contested by Tyler Poole (4.7 feet, MAN). Miles Dosunmu misses. Rebound secured by Tyler Poole.

[02:01] Team_077 possession (Score: 33-27)
Dejounte Quickley attempts a 3Pt. Contested by Joel Simons (3.7 feet, ZONE). Dejounte Quickley misses. Rebound secured by Miles Banchero.

[01:47] Team_097 possession (Score: 33-27)
Joel Simons drives, Jordan Simmons stays with him. Joel Simons attempts a Dunk. Contested by Jordan Simmons (4.2 feet, ZONE). JOEL SIMONS MAKES IT! Assist: Dwyane Ginobili
Score: 33-29

[01:29] Team_077 possession (Score: 33-29)
Ayo Griffin attempts a 3Pt. Contested by Joel Simons (3.5 feet, MAN). Ayo Griffin misses. Offensive rebound by Jordan Simmons! Jordan Simmons kicks it out.

[01:14] Team_077 possession (Score: 33-29)
Bam Bryant drives, picks up Gary Carter. Help arrives from Miles Dosunmu! Bam Bryant attempts a Dunk. Contested by Miles Dosunmu (4.9 feet, MAN). Bam Bryant misses. Rebound secured by Miles Dosunmu.

[00:56] Team_097 possession (Score: 33-29)
Gary Carter attempts a Layup. Contested by Jordan Simmons (3.9 feet, ZONE). GARY CARTER MAKES IT! Assist: Dwyane Ginobili
Score: 33-31

[00:42] Team_077 possession (Score: 33-31)
Tyler Poole attempts a 3Pt. Contested by Joel Simons (4.1 feet, ZONE). Tyler Poole misses. Rebound secured by Joel Simons.

[00:25] Team_097 possession (Score: 33-31)
Joel Simons attempts a 3Pt. Contested by Jordan Simmons (4.3 feet, MAN). Joel Simons misses. Rebound secured by Ayo Griffin.

[00:07] Team_077 possession (Score: 33-31)
Jordan Simmons drives to the basket... Jordan Simmons loses control! Ball rolls out of bounds! TURNOVER! (dead ball)

================================================================================
                              2ND QUARTER COMPLETE                              
================================================================================

2ND QUARTER SCORE: Team_077 15, Team_097 14

BOX SCORE:
================================================================================

Team_077
--------------------------------------------------------------------------------
Player                MIN  PTS  REB  AST  TO      FG   FG%      3P   3P%
--------------------------------------------------------------------------------
Dejounte Quickley      10    7    0    0   0   3/7    42.9     0/0   0.0
Draymond Dosunmu       15    3    2    0   0   1/1   100.0     0/0   0.0
Jordan Simmons         10    3    4    1   0   1/2    50.0     0/0   0.0
Tyler Poole            10    2    2    1   0   1/3    33.3     0/0   0.0
Ja Ball                15    0    0    0   0   0/2     0.0     0/0   0.0
Chris Ginobili         15    0    2    0   0   0/0     0.0     0/0   0.0
Dejounte Allen         15    0    0    0   0   0/1     0.0     0/0   0.0
Ayo Griffin            10    0    2    2   0   0/1     0.0     0/0   0.0
Bam Bryant             10    0    0    0   0   0/3     0.0     0/0   0.0

TEAM: FG: 6/20 (30.0%), 3PT: 1/8 (12.5%), REB: 12 (2 off, 10 def), AST: 4, TO: 2
TEAM FOULS: 4


Team_097
--------------------------------------------------------------------------------
Player                MIN  PTS  REB  AST  TO      FG   FG%      3P   3P%
--------------------------------------------------------------------------------
Miles Dosunmu          10    4    5    0   0   2/6    33.3     0/0   0.0
Joel Simons            10    4    3    0   0   2/4    50.0     0/0   0.0
Miles Banchero         10    2    4    0   0   1/1   100.0     0/0   0.0
Gary Carter            10    2    0    1   0   1/2    50.0     0/0   0.0
Dwyane Ginobili        10    2    0    2   0   1/2    50.0     0/0   0.0
Shai Poole             15    0    2    0   0   0/1     0.0     0/0   0.0
Anthony Haliburton     15    0    1    0   0   0/2     0.0     0/0   0.0
Tyrese Stewart         15    0    2    0   0   0/0     0.0     0/0   0.0

TEAM: FG: 7/18 (38.9%), 3PT: 0/4 (0.0%), REB: 17 (3 off, 14 def), AST: 3, TO: 3
TEAM FOULS: 3

================================================================================

================================================================================
                       3RD QUARTER - Team_077 vs Team_097                       
================================================================================

[12:00] Team_077 possession (Score: 33-31)
Dejounte Allen makes the Layup and draws the foul on Anthony Haliburton! And-1! Dejounte Allen to the line for 1. [Team fouls: 1] (Anthony Haliburton: 1 personal fouls)   FT 1/1: GOOD Dejounte Allen makes 1/1 from the line.
Score: 36-31

[11:44] Team_097 possession (Score: 36-31)
Shai Poole drives and kicks out. Anthony Haliburton attempts a 3Pt. Contested by Russell Harden (4.4 feet, MAN). Anthony Haliburton misses. Rebound secured by Draymond Dosunmu.

[11:28] Team_077 possession (Score: 36-31)
Russell Harden attempts a Midrange. BLOCKED BY ANTHONY HALIBURTON! Ball is loose! Rebound secured by Shai Poole.

[11:11] Team_097 possession (Score: 36-31)
Anthony Haliburton makes the Dunk and draws the foul on Russell Harden! And-1! Anthony Haliburton to the line for 1. [Team fouls: 1] (Russell Harden: 1 personal fouls)   FT 1/1: GOOD Anthony Haliburton makes 1/1 from the line.
Score: 36-34

[10:59] Team_077 possession (Score: 36-34)
Draymond Dosunmu attempts a Layup. Contested by Anthony Haliburton (2.9 feet, MAN). Draymond Dosunmu misses. Rebound secured by Shai Poole.

[10:44] Team_097 possession (Score: 36-34)
Evan Brogdon attempts a Midrange. Contested by Chris Ginobili (4.4 feet, ZONE). Evan Brogdon misses. Rebound secured by Draymond Dosunmu.

[10:29] Team_077 possession (Score: 36-34)
Dejounte Allen attempts a 3Pt. Contested by Shai Poole (3.9 feet, ZONE). Dejounte Allen misses. Rebound secured by Anthony Haliburton.

[10:15] Team_097 possession (Score: 36-34)
Shai Poole attempts a Layup. Contested by Draymond Dosunmu (4.9 feet, ZONE). Shai Poole misses. Offensive rebound by Tyrese Stewart! Tyrese Stewart kicks it out.

[10:04] Team_097 possession (Score: 36-34)
Evan Brogdon attempts a Midrange. Contested by Ja Ball (4.8 feet, MAN). Evan Brogdon misses. FOUL! Loose ball foul on Chris Ginobili during the rebound battle. [Team fouls: 2] No free throws, side out. (Chris Ginobili: 1 personal fouls)

[09:49] Team_097 possession (Score: 36-34)
Tyrese Stewart attempts a Layup. Contested by Draymond Dosunmu (5.2 feet, ZONE). TYRESE STEWART MAKES IT! Assist: Evan Brogdon
Score: 36-36

[09:33] Team_077 possession (Score: 36-36)
Draymond Dosunmu attempts a Midrange. Contested by Anthony Haliburton (2.9 feet, MAN). Draymond Dosunmu misses. Offensive rebound by Russell Harden! Russell Harden kicks it out.

[09:16] Team_077 possession (Score: 36-36)
Dejounte Allen attempts a Layup. Contested by Jrue Haliburton (5.7 feet, MAN). DEJOUNTE ALLEN MAKES IT!
Score: 38-36

[08:59] Team_097 possession (Score: 38-36)
Jrue Haliburton attempts a 3Pt. Contested by Chris Ginobili (4.2 feet, ZONE). Jrue Haliburton misses. Rebound secured by Russell Harden.

[08:42] Team_077 possession (Score: 38-36)
Draymond Dosunmu drives, Anthony Haliburton stays with him. Draymond Dosunmu attempts a Layup. Contested by Anthony Haliburton (2.9 feet, ZONE). Draymond Dosunmu misses. Offensive rebound by Draymond Dosunmu! Draymond Dosunmu kicks it out.

[08:28] Team_077 possession (Score: 38-36)
Russell Harden attempts a 3Pt. Contested by Anthony Haliburton (3.9 feet, MAN). Russell Harden misses. Offensive rebound by Draymond Dosunmu! Draymond Dosunmu kicks it out.

[08:13] Team_077 possession (Score: 38-36)
Ja Ball attempts a 3Pt. Contested by Shai Poole (3.8 feet, ZONE). Ja Ball misses. Rebound secured by Tyrese Stewart.

[08:02] Team_097 possession (Score: 38-36)
Tyrese Stewart loses control! Ball rolls out of bounds! TURNOVER! (dead ball)

[07:51] Team_077 possession (Score: 38-36)
Dejounte Allen attempts a Midrange. Contested by Jrue Haliburton (5.7 feet, MAN). DEJOUNTE ALLEN MAKES IT! Assist: Chris Ginobili
Score: 40-36

[07:38] Team_097 possession (Score: 40-36)
Jrue Haliburton makes the Layup and draws the foul on Dejounte Allen! And-1! Jrue Haliburton to the line for 1. [Team fouls: 3] (Dejounte Allen: 1 personal fouls)   FT 1/1: GOOD Jrue Haliburton makes 1/1 from the line.
Score: 40-39

[07:25] Team_077 possession (Score: 40-39)
Dejounte Allen attempts a 3Pt. Contested by Shai Poole (3.9 feet, ZONE). Dejounte Allen misses. Rebound secured by Anthony Haliburton.

[07:11] Team_097 possession (Score: 40-39)
Tyrese Stewart drives, picks up Draymond Dosunmu. Help arrives from Ja Ball! Tyrese Stewart attempts a Layup. Contested by Ja Ball (5.2 feet, ZONE). Tyrese Stewart misses. Offensive rebound by Anthony Haliburton! Anthony Haliburton's putback is no good. Rebound secured by Russell Harden.

[06:56] Team_077 possession (Score: 40-39)
Dejounte Allen attempts a 3Pt. Contested by Jrue Haliburton (5.7 feet, MAN). Dejounte Allen misses. Rebound secured by Anthony Haliburton.

[06:41] Team_097 possession (Score: 40-39)
FOUL! Offensive foul on Jrue Haliburton! Dejounte Allen drew the charge! [Team fouls: 2] (Jrue Haliburton: 1 personal fouls) TURNOVER! (dead ball)

[06:25] Team_077 possession (Score: 40-39)
Chris Ginobili attempts a Midrange. Contested by Anthony Haliburton (3.9 feet, ZONE). CHRIS GINOBILI MAKES IT! Assist: Draymond Dosunmu
Score: 42-39

[06:11] Team_097 possession (Score: 42-39)
Shai Poole drives to the basket... Shai Poole throws a bad pass! Stolen by Draymond Dosunmu! TURNOVER! (live ball)

[05:56] Team_077 possession (Score: 42-39)
Dejounte Allen attempts a 3Pt. Contested by Shai Poole (3.9 feet, ZONE). Dejounte Allen misses. Offensive rebound by Russell Harden! Russell Harden kicks it out.

[05:43] Team_077 possession (Score: 42-39)
Draymond Dosunmu attempts a Midrange. Contested by Tyrese Stewart (4.9 feet, ZONE). Draymond Dosunmu misses. Rebound secured by Shai Poole.

[05:28] Team_097 possession (Score: 42-39)
Anthony Haliburton drives to the basket... Anthony Haliburton loses the ball! Stripped by Russell Harden! TURNOVER! (live ball)

[05:10] Team_077 possession (Score: 42-39)
Russell Harden drives, Anthony Haliburton stays with him. Russell Harden attempts a Layup. Contested by Anthony Haliburton (3.9 feet, ZONE). Russell Harden misses. Rebound secured by Tyrese Stewart.

[04:57] Team_097 possession (Score: 42-39)
Shai Poole drives, Draymond Dosunmu stays with him. Shai Poole attempts a Layup. Contested by Draymond Dosunmu (4.9 feet, ZONE). SHAI POOLE MAKES IT! Assist: Jrue Haliburton
Score: 42-41

[04:45] Team_077 possession (Score: 42-41)
Ja Ball drives to the basket... Ja Ball throws a bad pass out of bounds! TURNOVER! (dead ball)

[04:33] Team_097 possession (Score: 42-41)
Anthony Haliburton attempts a 3Pt. Contested by Russell Harden (4.9 feet, MAN). Anthony Haliburton misses. Rebound secured by Draymond Dosunmu.

[04:19] Team_077 possession (Score: 42-41)
Russell Harden attempts a 3Pt. Contested by Shai Poole (4.0 feet, ZONE). RUSSELL HARDEN MAKES IT! Assist: Ja Ball
Score: 45-41

[04:05] Team_097 possession (Score: 45-41)
Tyrese Stewart attempts a 3Pt. Contested by Draymond Dosunmu (5.3 feet, MAN). Tyrese Stewart misses. Offensive rebound by Tyrese Stewart! Tyrese Stewart kicks it out.

[03:51] Team_097 possession (Score: 45-41)
Tyrese Stewart drives to the basket... Tyrese Stewart throws a bad pass! Stolen by Draymond Dosunmu! TURNOVER! (live ball)

[03:37] Team_077 possession (Score: 45-41)
Draymond Dosunmu attempts a Layup. BLOCKED BY ANTHONY HALIBURTON! Ball is loose! Rebound secured by Tyrese Stewart.

[03:19] Team_097 possession (Score: 45-41)
Anthony Haliburton attempts a 3Pt. Contested by Russell Harden (5.0 feet, MAN). Anthony Haliburton misses. Rebound secured by Chris Ginobili.

[03:05] Team_077 possession (Score: 45-41)
Draymond Dosunmu attempts a Layup. Contested by Anthony Haliburton (3.2 feet, ZONE). DRAYMOND DOSUNMU MAKES IT!
Score: 47-41

[02:49] Team_097 possession (Score: 47-41)
Shai Poole drives and kicks out. Shai Poole attempts a 3Pt. Contested by Dejounte Allen (3.9 feet, ZONE). Shai Poole misses. Rebound secured by Russell Harden.

[02:40] Team_077 possession (Score: 47-41)
Dejounte Allen attempts a 3Pt. Contested by Shai Poole (4.1 feet, ZONE). DEJOUNTE ALLEN MAKES IT! Assist: Chris Ginobili
Score: 50-41

[02:22] Team_097 possession (Score: 50-41)
Jrue Haliburton drives to the basket... Jrue Haliburton throws a bad pass out of bounds! TURNOVER! (dead ball)

[02:22] Substitution (Team_077): Chris Ginobili OUT → Tyler Poole IN (stamina_rule2)

[02:22] Substitution (Team_077): Russell Harden OUT → Jordan Simmons IN (stamina_rule2)

[02:22] Substitution (Team_097): Evan Brogdon OUT → Gary Carter IN (stamina_rule2)

[02:22] Substitution (Team_097): Shai Poole OUT → Miles Dosunmu IN (stamina_rule2)

[02:22] Substitution (Team_097): Anthony Haliburton OUT → Joel Simons IN (stamina_rule2)

[02:22] Substitution (Team_097): Tyrese Stewart OUT → Miles Banchero IN (stamina_rule2)

[02:11] Team_077 possession (Score: 50-41)
Draymond Dosunmu loses the ball! Stripped by Joel Simons! TURNOVER! (live ball)

[01:56] Team_097 possession (Score: 50-41)
FOUL! Shooting foul on Draymond Dosunmu. Miles Banchero to the line for 2 free throws. [Team fouls: 4] (Draymond Dosunmu: 1 personal fouls)   FT 1/2: GOOD   FT 2/2: GOOD Miles Banchero makes 2/2 from the line.
Score: 50-43

[01:41] Team_077 possession (Score: 50-43)
Jordan Simmons drives and kicks out. Dejounte Allen attempts a 3Pt. Contested by Joel Simons (3.6 feet, ZONE). Dejounte Allen misses. Rebound secured by Miles Banchero.

[01:23] Team_097 possession (Score: 50-43)
Miles Banchero drives to the basket... FOUL! Offensive foul on Miles Banchero! Draymond Dosunmu drew the charge! [Team fouls: 3] (Miles Banchero: 1 personal fouls) TURNOVER! (dead ball)

[01:11] Team_077 possession (Score: 50-43)
Dejounte Allen attempts a Midrange. Contested by Joel Simons (4.0 feet, ZONE). Dejounte Allen misses. Rebound secured by Miles Dosunmu.

[00:51] Team_097 possession (Score: 50-43)
Miles Dosunmu attempts a Midrange. Contested by Tyler Poole (4.7 feet, ZONE). MILES DOSUNMU MAKES IT!
Score: 50-45

[00:35] Team_077 possession (Score: 50-45)
Tyler Poole attempts a 3Pt. Contested by Miles Dosunmu (4.2 feet, MAN). Tyler Poole misses. Rebound secured by Joel Simons.

[00:21] Team_097 possession (Score: 50-45)
Miles Dosunmu attempts a Midrange. Contested by Jordan Simmons (4.5 feet, ZONE). MILES DOSUNMU MAKES IT! Assist: Gary Carter
Score: 50-47

[00:05] Team_077 possession (Score: 50-47)
Jordan Simmons makes the Dunk and draws the foul on Joel Simons! And-1! Jordan Simmons to the line for 1. [Team fouls: 4] (Joel Simons: 1 personal fouls)   FT 1/1: GOOD Jordan Simmons makes 1/1 from the line.
Score: 53-47

================================================================================
                              3RD QUARTER COMPLETE                              
================================================================================

3RD QUARTER SCORE: Team_077 20, Team_097 16

BOX SCORE:
================================================================================

Team_077
--------------------------------------------------------------------------------
Player                MIN  PTS  REB  AST  TO      FG   FG%      3P   3P%
--------------------------------------------------------------------------------
Dejounte Allen         27   10    0    0   0   4/8    50.0     0/0   0.0
Russell Harden         24    3    5    0   0   1/3    33.3     0/0   0.0
Jordan Simmons         12    3    0    0   0   1/2    50.0     0/0   0.0
Draymond Dosunmu       27    2    5    1   0   1/4    25.0     0/0   0.0
Chris Ginobili         24    2    1    2   0   1/1   100.0     0/0   0.0
Ja Ball                27    0    0    1   0   0/1     0.0     0/0   0.0
Tyler Poole            12    0    0    0   0   0/1     0.0     0/0   0.0

TEAM: FG: 8/20 (40.0%), 3PT: 2/7 (28.6%), REB: 10 (4 off, 6 def), AST: 4, TO: 2
TEAM FOULS: 4


Team_097
--------------------------------------------------------------------------------
Player                MIN  PTS  REB  AST  TO      FG   FG%      3P   3P%
--------------------------------------------------------------------------------
Miles Dosunmu          12    4    1    0   0   2/2   100.0     0/0   0.0
Anthony Haliburton     24    3    3    0   0   1/3    33.3     0/0   0.0
Jrue Haliburton        27    3    0    1   0   1/2    50.0     0/0   0.0
Shai Poole             24    2    3    0   0   1/3    33.3     0/0   0.0
Tyrese Stewart         24    2    6    0   0   1/2    50.0     0/0   0.0
Miles Banchero         12    2    1    0   0   1/1   100.0     0/0   0.0
Evan Brogdon           24    0    0    1   0   0/1     0.0     0/0   0.0
Joel Simons            12    0    1    0   0   0/0     0.0     0/0   0.0
Gary Carter            12    0    0    1   0   0/0     0.0     0/0   0.0

TEAM: FG: 7/14 (50.0%), 3PT: 0/3 (0.0%), REB: 16 (4 off, 12 def), AST: 3, TO: 7
TEAM FOULS: 4

================================================================================

================================================================================
                       4TH QUARTER - Team_077 vs Team_097                       
================================================================================

[12:00] Team_077 possession (Score: 53-47)
Dejounte Allen attempts a 3Pt. Contested by Shai Poole (3.8 feet, ZONE). Dejounte Allen misses. Rebound secured by Shai Poole.

[11:46] Team_097 possession (Score: 53-47)
Anthony Haliburton drives and kicks out. Evan Brogdon attempts a Midrange. Contested by Chris Ginobili (3.8 feet, ZONE). EVAN BROGDON MAKES IT!
Score: 53-49

[11:33] Team_077 possession (Score: 53-49)
FOUL! Shooting foul on Jrue Haliburton. Dejounte Allen to the line for 3 free throws. [Team fouls: 1] (Jrue Haliburton: 1 personal fouls)   FT 1/3: GOOD   FT 2/3: GOOD   FT 3/3: GOOD Dejounte Allen makes 3/3 from the line.
Score: 56-49

[11:23] Team_097 possession (Score: 56-49)
Shai Poole attempts a 3Pt. Contested by Chris Ginobili (4.4 feet, MAN). Shai Poole misses. FOUL! Loose ball foul on Draymond Dosunmu during the rebound battle. [Team fouls: 1] No free throws, side out. (Draymond Dosunmu: 1 personal fouls)

[11:05] Team_097 possession (Score: 56-49)
Jrue Haliburton drives to the basket... Jrue Haliburton loses the ball! Stripped by Dejounte Allen! TURNOVER! (live ball)

[10:48] Team_077 possession (Score: 56-49)
Dejounte Allen attempts a 3Pt. Contested by Jrue Haliburton (5.9 feet, MAN). DEJOUNTE ALLEN MAKES IT! Assist: Chris Ginobili
Score: 59-49

[10:37] Team_097 possession (Score: 59-49)
Evan Brogdon throws a bad pass out of bounds! TURNOVER! (dead ball)

[10:37] Substitution (Team_077): Ja Ball OUT → Bam Bryant IN (stamina_rule2)

[10:37] Substitution (Team_077): Dejounte Allen OUT → Dejounte Quickley IN (stamina_rule2)

[10:37] Substitution (Team_077): Draymond Dosunmu OUT → Ayo Griffin IN (stamina_rule2)

[10:37] Substitution (Team_097): Jrue Haliburton OUT → Dwyane Ginobili IN (stamina_rule2)

[10:25] Team_077 possession (Score: 59-49)
Bam Bryant drives, Anthony Haliburton stays with him. Bam Bryant attempts a Layup. Contested by Anthony Haliburton (3.6 feet, ZONE). BAM BRYANT MAKES IT!
Score: 61-49

[10:09] Team_097 possession (Score: 61-49)
Anthony Haliburton attempts a 3Pt. Contested by Russell Harden (5.0 feet, MAN). Anthony Haliburton misses. Rebound secured by Chris Ginobili.

[09:58] Team_077 possession (Score: 61-49)
Bam Bryant attempts a 3Pt. Contested by Evan Brogdon (5.0 feet, MAN). Bam Bryant misses. Rebound secured by Tyrese Stewart.

[09:44] Team_097 possession (Score: 61-49)
Evan Brogdon attempts a Midrange. Wide open! Bam Bryant is 6.7 feet away. [MAN] EVAN BROGDON MAKES IT!
Score: 61-51

[09:30] Team_077 possession (Score: 61-51)
Ayo Griffin drives and kicks out. Bam Bryant attempts a Midrange. Contested by Anthony Haliburton (3.6 feet, ZONE). BAM BRYANT MAKES IT!
Score: 63-51

[09:13] Team_097 possession (Score: 63-51)
Shai Poole attempts a 3Pt. Contested by Chris Ginobili (4.6 feet, MAN). Shai Poole misses. Rebound secured by Chris Ginobili.

[08:58] Team_077 possession (Score: 63-51)
Ayo Griffin makes the Layup and draws the foul on Anthony Haliburton! And-1! Ayo Griffin to the line for 1. [Team fouls: 2] (Anthony Haliburton: 1 personal fouls)   FT 1/1: GOOD Ayo Griffin makes 1/1 from the line.
Score: 66-51

[08:45] Team_097 possession (Score: 66-51)
Dwyane Ginobili attempts a 3Pt. Contested by Dejounte Quickley (4.1 feet, ZONE). Dwyane Ginobili misses. Rebound secured by Russell Harden.

[08:28] Team_077 possession (Score: 66-51)
Dejounte Quickley drives, Anthony Haliburton stays with him. Dejounte Quickley attempts a Layup. Contested by Anthony Haliburton (3.8 feet, ZONE). Dejounte Quickley misses. Rebound secured by Tyrese Stewart.

[08:12] Team_097 possession (Score: 66-51)
Shai Poole makes the Layup and draws the foul on Chris Ginobili! And-1! Shai Poole to the line for 1. [Team fouls: 2] (Chris Ginobili: 1 personal fouls)   FT 1/1: GOOD Shai Poole makes 1/1 from the line.
Score: 66-54

[07:58] Team_077 possession (Score: 66-54)
Ayo Griffin drives, Anthony Haliburton stays with him. Ayo Griffin attempts a Dunk. Contested by Anthony Haliburton (3.6 feet, ZONE). Ayo Griffin misses. Rebound secured by Anthony Haliburton.

[07:45] Team_097 possession (Score: 66-54)
Tyrese Stewart makes the Midrange and draws the foul on Chris Ginobili! And-1! Tyrese Stewart to the line for 1. [Team fouls: 3] (Chris Ginobili: 2 personal fouls)   FT 1/1: MISS Tyrese Stewart makes 0/1 from the line. Rebound secured by Chris Ginobili.
Score: 66-56

[07:32] Team_077 possession (Score: 66-56)
Ayo Griffin drives and kicks out. Russell Harden attempts a Midrange. Contested by Shai Poole (3.9 feet, ZONE). RUSSELL HARDEN MAKES IT! Assist: Bam Bryant
Score: 68-56

[07:16] Team_097 possession (Score: 68-56)
Evan Brogdon attempts a 3Pt. Wide open! Bam Bryant is 6.6 feet away. [ZONE] Evan Brogdon misses. Rebound secured by Russell Harden.

[07:03] Team_077 possession (Score: 68-56)
Dejounte Quickley drives and kicks out. Russell Harden attempts a Midrange. Contested by Shai Poole (4.0 feet, ZONE). Russell Harden misses. FOUL! Loose ball foul on Dwyane Ginobili during the rebound battle. [Team fouls: 3] No free throws, side out. (Dwyane Ginobili: 1 personal fouls)

[06:50] Team_077 possession (Score: 68-56)
Dejounte Quickley attempts a Midrange. Contested by Dwyane Ginobili (4.7 feet, MAN). DEJOUNTE QUICKLEY MAKES IT!
Score: 70-56

[06:32] Team_097 possession (Score: 70-56)
Tyrese Stewart attempts a Midrange. Contested by Ayo Griffin (5.5 feet, MAN). Tyrese Stewart misses. Rebound secured by Russell Harden.

[06:20] Team_077 possession (Score: 70-56)
Bam Bryant attempts a 3Pt. Contested by Dwyane Ginobili (4.7 feet, ZONE). BAM BRYANT MAKES IT! Assist: Chris Ginobili
Score: 73-56

[06:05] Team_097 possession (Score: 73-56)
Evan Brogdon attempts a 3Pt. Wide open! Bam Bryant is 6.6 feet away. [MAN] Evan Brogdon misses. Rebound secured by Russell Harden.

[05:53] Team_077 possession (Score: 73-56)
Bam Bryant attempts a Midrange. Contested by Evan Brogdon (5.5 feet, MAN). Bam Bryant misses. Rebound secured by Anthony Haliburton.

[05:37] Team_097 possession (Score: 73-56)
Shai Poole attempts a 3Pt. Contested by Dejounte Quickley (4.7 feet, ZONE). Shai Poole misses. Rebound secured by Russell Harden.

[05:25] Team_077 possession (Score: 73-56)
FOUL! Shooting foul on Anthony Haliburton. Bam Bryant to the line for 2 free throws. [Team fouls: 4] (Anthony Haliburton: 2 personal fouls)   FT 1/2: MISS   FT 2/2: GOOD Bam Bryant makes 1/2 from the line.
Score: 74-56

[05:14] Team_097 possession (Score: 74-56)
Tyrese Stewart drives, Ayo Griffin stays with him. Tyrese Stewart attempts a Layup. Contested by Ayo Griffin (5.4 feet, ZONE). Tyrese Stewart misses. FOUL! Loose ball foul on Ayo Griffin during the rebound battle. [Team fouls: 4] No free throws, side out. (Ayo Griffin: 1 personal fouls)

[04:56] Team_097 possession (Score: 74-56)
Evan Brogdon drives, picks up Ayo Griffin. Help arrives from Dejounte Quickley! Evan Brogdon attempts a Dunk. Contested by Dejounte Quickley (5.2 feet, ZONE). EVAN BROGDON MAKES IT! Assist: Dwyane Ginobili
Score: 74-58

[04:37] Team_077 possession (Score: 74-58)
Ayo Griffin drives, Tyrese Stewart stays with him. Ayo Griffin attempts a Dunk. Contested by Tyrese Stewart (5.9 feet, MAN). AYO GRIFFIN MAKES IT! Assist: Bam Bryant
Score: 76-58

[04:27] Team_097 possession (Score: 76-58)
Tyrese Stewart attempts a 3Pt. Contested by Dejounte Quickley (4.9 feet, ZONE). Tyrese Stewart misses. Rebound secured by Ayo Griffin.

[04:11] Team_077 possession (Score: 76-58)
Ayo Griffin drives and kicks out. Bam Bryant attempts a 3Pt. Contested by Evan Brogdon (5.6 feet, MAN). BAM BRYANT MAKES IT! Assist: Chris Ginobili
Score: 79-58

[03:58] Team_097 possession (Score: 79-58)
Evan Brogdon attempts a Midrange. Wide open! Bam Bryant is 6.5 feet away. [ZONE] EVAN BROGDON MAKES IT!
Score: 79-60

[03:44] Team_077 possession (Score: 79-60)
Ayo Griffin drives, picks up Tyrese Stewart. Help arrives from Dwyane Ginobili! Ayo Griffin attempts a Dunk. Wide open! Dwyane Ginobili is 6.0 feet away. [MAN] Ayo Griffin misses. Rebound secured by Dwyane Ginobili.

[03:30] Team_097 possession (Score: 79-60)
Evan Brogdon attempts a Layup. Wide open! Bam Bryant is 6.5 feet away. [MAN] EVAN BROGDON MAKES IT! Assist: Tyrese Stewart
Score: 79-62

[03:18] Team_077 possession (Score: 79-62)
Bam Bryant attempts a 3Pt. Contested by Dwyane Ginobili (4.8 feet, ZONE). Bam Bryant misses. Rebound secured by Tyrese Stewart.

[03:04] Team_097 possession (Score: 79-62)
Dwyane Ginobili attempts a Layup. BLOCKED BY DEJOUNTE QUICKLEY! Ball is loose! Offensive rebound by Tyrese Stewart! Tyrese Stewart kicks it out.

[02:50] Team_097 possession (Score: 79-62)
Shai Poole makes the Layup and draws the foul on Dejounte Quickley! And-1! Shai Poole to the line for 1. [BONUS: 5 team fouls] (Dejounte Quickley: 1 personal fouls)   FT 1/1: GOOD Shai Poole makes 1/1 from the line.
Score: 79-65

[02:35] Team_077 possession (Score: 79-65)
Dejounte Quickley attempts a 3Pt. Contested by Dwyane Ginobili (4.8 feet, ZONE). Dejounte Quickley misses. Offensive rebound by Ayo Griffin! Ayo Griffin kicks it out.

[02:22] Team_077 possession (Score: 79-65)
Bam Bryant attempts a 3Pt. Wide open! Evan Brogdon is 6.0 feet away. [MAN] BAM BRYANT MAKES IT! Assist: Dejounte Quickley
Score: 82-65

[02:07] Team_097 possession (Score: 82-65)
Shai Poole attempts a 3Pt. Contested by Chris Ginobili (5.5 feet, MAN). SHAI POOLE MAKES IT! Assist: Dwyane Ginobili
Score: 82-68

[01:50] Team_077 possession (Score: 82-68)
Dejounte Quickley attempts a Midrange. Contested by Anthony Haliburton (5.0 feet, ZONE). Dejounte Quickley misses. Offensive rebound by Ayo Griffin! Ayo Griffin kicks it out.

[01:33] Team_077 possession (Score: 82-68)
Chris Ginobili attempts a 3Pt. Contested by Shai Poole (5.2 feet, MAN). Chris Ginobili misses. FOUL! Loose ball foul on Anthony Haliburton during the rebound battle. [IN THE BONUS! 5 team fouls] Russell Harden to the line for 2 free throws. (Anthony Haliburton: 3 personal fouls)   FT 1/2: GOOD   FT 2/2: GOOD Russell Harden makes 2/2 from the line.
Score: 84-68

[01:16] Team_097 possession (Score: 84-68)
Dwyane Ginobili attempts a Layup. Contested by Russell Harden (5.7 feet, ZONE). DWYANE GINOBILI MAKES IT! Assist: Tyrese Stewart
Score: 84-70

[01:04] Team_077 possession (Score: 84-70)
Ayo Griffin drives, picks up Anthony Haliburton. Help arrives from Dwyane Ginobili! Ayo Griffin attempts a Layup. Contested by Dwyane Ginobili (4.8 feet, ZONE). Ayo Griffin misses. Rebound secured by Dwyane Ginobili.

[00:50] Team_097 possession (Score: 84-70)
Shai Poole makes the 3Pt and draws the foul on Chris Ginobili! And-1! Shai Poole to the line for 1. [BONUS: 6 team fouls] (Chris Ginobili: 3 personal fouls)   FT 1/1: GOOD Shai Poole makes 1/1 from the line.
Score: 84-74

[00:37] Team_077 possession (Score: 84-74)
Dejounte Quickley attempts a Layup. Contested by Anthony Haliburton (5.2 feet, ZONE). DEJOUNTE QUICKLEY MAKES IT!
Score: 86-74

[00:24] Team_097 possession (Score: 86-74)
Anthony Haliburton commits a violation (traveling/carry)! TURNOVER! (dead ball)

[00:24] Substitution (Team_077): Chris Ginobili OUT → Tyler Poole IN (stamina_rule2)

[00:24] Substitution (Team_077): Russell Harden OUT → Jordan Simmons IN (stamina_rule2)

[00:24] Substitution (Team_097): Evan Brogdon OUT → Gary Carter IN (stamina_rule2)

[00:24] Substitution (Team_097): Shai Poole OUT → Miles Dosunmu IN (stamina_rule2)

[00:24] Substitution (Team_097): Anthony Haliburton OUT → Joel Simons IN (stamina_rule2)

[00:24] Substitution (Team_097): Tyrese Stewart OUT → Miles Banchero IN (stamina_rule2)

[00:11] Team_077 possession (Score: 86-74)
Bam Bryant drives, Joel Simons stays with him. Bam Bryant attempts a Dunk. Contested by Joel Simons (3.6 feet, ZONE). Bam Bryant misses. Rebound secured by Miles Dosunmu.

================================================================================
                              4TH QUARTER COMPLETE                              
================================================================================

4TH QUARTER SCORE: Team_077 33, Team_097 27

BOX SCORE:
================================================================================

Team_077
--------------------------------------------------------------------------------
Player                MIN  PTS  REB  AST  TO      FG   FG%      3P   3P%
--------------------------------------------------------------------------------
Bam Bryant             20   14    0    2   0   6/10   60.0     0/0   0.0
Dejounte Allen         28    6    0    0   0   2/3    66.7     0/0   0.0
Ayo Griffin            20    5    3    0   0   2/5    40.0     0/0   0.0
Russell Harden         36    4    6    0   0   2/2   100.0     0/0   0.0
Dejounte Quickley      20    4    0    1   0   2/3    66.7     0/0   0.0
Chris Ginobili         36    0    3    3   0   0/0     0.0     0/0   0.0

TEAM: FG: 14/23 (60.9%), 3PT: 5/8 (62.5%), REB: 12 (3 off, 9 def), AST: 6, TO: 0
TEAM FOULS: 6 [Team_097 in BONUS]


Team_097
--------------------------------------------------------------------------------
Player                MIN  PTS  REB  AST  TO      FG   FG%      3P   3P%
--------------------------------------------------------------------------------
Shai Poole             36   13    1    0   0   4/6    66.7     0/0   0.0
Evan Brogdon           36   10    0    0   0   5/7    71.4     0/0   0.0
Dwyane Ginobili        20    2    2    2   0   1/2    50.0     0/0   0.0
Anthony Haliburton     36    0    4    0   0   0/1     0.0     0/0   0.0
Tyrese Stewart         36    0    4    2   0   0/3     0.0     0/0   0.0
Miles Dosunmu          12    0    1    0   0   0/0     0.0     0/0   0.0

TEAM: FG: 10/19 (52.6%), 3PT: 2/9 (22.2%), REB: 12 (3 off, 9 def), AST: 4, TO: 3
TEAM FOULS: 5 [Team_077 in BONUS]

================================================================================

================================================================================
                               FULL GAME COMPLETE                               
================================================================================

FINAL SCORE: Team_077 86, Team_097 74

SCORING BY QUARTER:
--------------------------------------------------------------------------------
Team                     Q1     Q2     Q3     Q4    FINAL
--------------------------------------------------------------------------------
Team_077                 18     15     20     33       86
Team_097                 17     14     16     27       74
--------------------------------------------------------------------------------

FULL GAME BOX SCORE:
================================================================================

Team_077
--------------------------------------------------------------------------------
Player                MIN  PTS  REB  AST  TO      FG   FG%      3P   3P%      FT STL BLK
--------------------------------------------------------------------------------
Chris Ginobili         36    5    7    5   0   3/5    60.0   1/2    50.0   1/1     0   1
Russell Harden         36    7   15    1   0   1/4    25.0   1/1   100.0   2/2     1   0
Ja Ball                28    7    0    2   0   3/10   30.0   1/6    16.7   4/4     0   0
Dejounte Allen         28   18    0    1   1   7/16   43.8   3/10   30.0   6/6     1   1
Draymond Dosunmu       28   11   14    1   2   5/8    62.5   0/0     0.0   3/3     3   0
Bam Bryant             20   14    0    2   0   4/11   36.4   2/5    40.0   1/2     0   0
Dejounte Quickley      20   11    0    1   0   6/11   54.5   1/3    33.3   0/0     0   2
Ayo Griffin            20    5    5    2   0   5/9    55.6   0/0     0.0   1/1     0   0
Tyler Poole            12    2    2    1   2   0/3     0.0   0/2     0.0   0/0     0   0
Jordan Simmons         12    6    4    1   0   2/4    50.0   0/0     0.0   2/2     0   0

TEAM: FG: 36/81 (44.4%), 3PT: 9/29 (31.0%), REB: 46 (12 off, 34 def), AST: 17, TO: 5


Team_097
--------------------------------------------------------------------------------
Player                MIN  PTS  REB  AST  TO      FG   FG%      3P   3P%      FT STL BLK
--------------------------------------------------------------------------------
Evan Brogdon           36   13    0    3   1   5/10   50.0   1/5    20.0   3/3     0   0
Shai Poole             36   22   10    0   2   8/17   47.1   2/6    33.3   4/4     0   0
Anthony Haliburton     36    3   11    0   5   2/7    28.6   0/4     0.0   1/1     0   2
Tyrese Stewart         36    9   18    2   2   5/11   45.5   0/2     0.0   3/5     1   0
Jrue Haliburton        28    3    0    1   3   1/3    33.3   0/1     0.0   1/1     0   0
Dwyane Ginobili        20    4    2    4   0   2/4    50.0   0/1     0.0   2/2     0   0
Gary Carter            12    2    0    2   1   1/2    50.0   0/0     0.0   0/0     0   0
Miles Dosunmu          12    8    7    0   0   4/8    50.0   0/1     0.0   4/4     0   0
Joel Simons            12    4    4    0   1   2/4    50.0   0/1     0.0   0/0     1   0
Miles Banchero         12    4    5    0   0   2/2   100.0   0/0     0.0   2/2     0   0

TEAM: FG: 32/68 (47.1%), 3PT: 3/21 (14.3%), REB: 58 (13 off, 45 def), AST: 12, TO: 15

================================================================================
