================================================================================
                        FULL GAME - Team_008 vs Team_018                        
================================================================================

================================================================================
                       1ST QUARTER - Team_008 vs Team_018                       
================================================================================

[12:00] Team_008 possession (Score: 0-0)
Jrue Harris attempts a 3Pt. Contested by Tracy Bryant (3.5 feet, MAN). Jrue Harris misses. Rebound secured by Bones Anunoby.

[11:45] Team_018 possession (Score: 0-0)
Tracy Bryant throws a bad pass! Stolen by Jrue Harris! TURNOVER! (live ball)

[11:30] Team_008 possession (Score: 0-0)
Victor Leonard attempts a 3Pt. Contested by Klay Stewart (4.4 feet, ZONE). Victor Leonard misses. Rebound secured by Allen Markkanen.

[11:13] Team_018 possession (Score: 0-0)
FOUL! Holding foul on Khris Hyland. [Team fouls: 1] No free throws, side out. (Khris Hyland: 1 personal fouls)

[10:59] Team_018 possession (Score: 0-0)
Bones Anunoby attempts a 3Pt. Contested by Victor Leonard (5.3 feet, ZONE). Bones Anunoby misses. Offensive rebound by Domantas Wall! Domantas Wall's putback is no good. Rebound secured by Magic Young.

[10:43] Team_008 possession (Score: 0-0)
Khris Hyland attempts a 3Pt. Contested by Allen Markkanen (3.9 feet, MAN). Khris Hyland misses. Rebound secured by Bones Anunoby.

[10:27] Team_018 possession (Score: 0-0)
Domantas Wall attempts a Midrange. Contested by Magic Young (5.2 feet, MAN). Domantas Wall misses. Offensive rebound by Bones Anunoby! Bones Anunoby kicks it out.

[10:16] Team_018 possession (Score: 0-0)
Bones Anunoby loses control! Ball rolls out of bounds! TURNOVER! (dead ball)

[10:02] Team_008 possession (Score: 0-0)
Tyrese Thompson attempts a 3Pt. Contested by Klay Stewart (4.3 feet, ZONE). Tyrese Thompson misses. Rebound secured by Allen Markkanen.

[09:46] Team_018 possession (Score: 0-0)
Bones Anunoby makes the Dunk and draws the foul on Tyrese Thompson! And-1! Bones Anunoby to the line for 1. [Team fouls: 2] (Tyrese Thompson: 1 personal fouls)   FT 1/1: GOOD Bones Anunoby makes 1/1 from the line.
Score: 0-3

[09:32] Team_008 possession (Score: 0-3)
Khris Hyland makes the Layup and draws the foul on Domantas Wall! And-1! Khris Hyland to the line for 1. [Team fouls: 1] (Domantas Wall: 1 personal fouls)   FT 1/1: GOOD Khris Hyland makes 1/1 from the line.
Score: 3-3

[09:16] Team_018 possession (Score: 3-3)
Klay Stewart attempts a Midrange. Contested by Tyrese Thompson (4.6 feet, ZONE). Klay Stewart misses. Offensive rebound by Domantas Wall! Domantas Wall's putback is no good. Offensive rebound by Bones Anunoby! Bones Anunoby kicks it out.

[09:02] Team_018 possession (Score: 3-3)
Bones Anunoby attempts a 3Pt. Contested by Victor Leonard (5.3 feet, ZONE). Bones Anunoby misses. Rebound secured by Tyrese Thompson.

[08:46] Team_008 possession (Score: 3-3)
Magic Young drives and kicks out. Jrue Harris attempts a 3Pt. Contested by Tracy Bryant (3.4 feet, ZONE). JRUE HARRIS MAKES IT! Assist: Khris Hyland
Score: 6-3

[08:33] Team_018 possession (Score: 6-3)
Allen Markkanen drives, Khris Hyland stays with him. Allen Markkanen attempts a Layup. Contested by Khris Hyland (4.4 feet, MAN). ALLEN MARKKANEN MAKES IT! Assist: Klay Stewart
Score: 6-5

[08:20] Team_008 possession (Score: 6-5)
Jrue Harris drives, picks up Domantas Wall. Help arrives from Klay Stewart! Jrue Harris attempts a Layup. Contested by Klay Stewart (3.5 feet, ZONE). JRUE HARRIS MAKES IT! Assist: Victor Leonard
Score: 8-5

[08:01] Team_018 possession (Score: 8-5)
Allen Markkanen attempts a Midrange. Contested by Jrue Harris (4.6 feet, ZONE). Allen Markkanen misses. Rebound secured by Tyrese Thompson.

[07:49] Team_008 possession (Score: 8-5)
Tyrese Thompson attempts a Midrange. Contested by Bones Anunoby (3.5 feet, MAN). TYRESE THOMPSON MAKES IT!
Score: 10-5

[07:35] Team_018 possession (Score: 10-5)
Bones Anunoby attempts a Midrange. Contested by Tyrese Thompson (4.7 feet, ZONE). Bones Anunoby misses. Rebound secured by Khris Hyland.

[07:20] Team_008 possession (Score: 10-5)
Khris Hyland attempts a 3Pt. Contested by Klay Stewart (4.2 feet, ZONE). Khris Hyland misses. Rebound secured by Domantas Wall.

[07:07] Team_018 possession (Score: 10-5)
Bones Anunoby makes the Dunk and draws the foul on Tyrese Thompson! And-1! Bones Anunoby to the line for 1. [Team fouls: 3] (Tyrese Thompson: 2 personal fouls)   FT 1/1: GOOD Bones Anunoby makes 1/1 from the line.
Score: 10-8

[06:50] Team_008 possession (Score: 10-8)
Tyrese Thompson attempts a Layup. Contested by Domantas Wall (3.6 feet, ZONE). TYRESE THOMPSON MAKES IT! Assist: Jrue Harris
Score: 12-8

[06:40] Team_018 possession (Score: 12-8)
Bones Anunoby makes the Layup and draws the foul on Tyrese Thompson! And-1! Bones Anunoby to the line for 1. [Team fouls: 4] (Tyrese Thompson: 3 personal fouls)   FT 1/1: GOOD Bones Anunoby makes 1/1 from the line.
Score: 12-11

[06:29] Team_008 possession (Score: 12-11)
Victor Leonard attempts a 3Pt. Contested by Klay Stewart (4.4 feet, ZONE). Victor Leonard misses. Offensive rebound by Magic Young! Magic Young's putback is no good. Rebound secured by Bones Anunoby.

[06:13] Team_018 possession (Score: 12-11)
Klay Stewart attempts a 3Pt. Contested by Victor Leonard (5.2 feet, MAN). Klay Stewart misses. Rebound secured by Magic Young.

[06:02] Team_008 possession (Score: 12-11)
Jrue Harris attempts a Layup. Contested by Domantas Wall (3.5 feet, ZONE). JRUE HARRIS MAKES IT! Assist: Victor Leonard
Score: 14-11

[05:51] Team_018 possession (Score: 14-11)
Tracy Bryant attempts a 3Pt. Contested by Jrue Harris (4.6 feet, MAN). Tracy Bryant misses. Rebound secured by Khris Hyland.

[05:38] Team_008 possession (Score: 14-11)
Tyrese Thompson attempts a 3Pt. Contested by Klay Stewart (4.3 feet, ZONE). Tyrese Thompson misses. Rebound secured by Bones Anunoby.

[05:25] Team_018 possession (Score: 14-11)
Domantas Wall makes the Layup and draws the foul on Magic Young! And-1! Domantas Wall to the line for 1. [BONUS: 5 team fouls] (Magic Young: 1 personal fouls)   FT 1/1: GOOD Domantas Wall makes 1/1 from the line.
Score: 14-14

[05:10] Team_008 possession (Score: 14-14)
Tyrese Thompson attempts a Midrange. Contested by Allen Markkanen (4.0 feet, ZONE). Tyrese Thompson misses. Rebound secured by Bones Anunoby.

[04:57] Team_018 possession (Score: 14-14)
Bones Anunoby loses the ball! Stripped by Tyrese Thompson! TURNOVER! (live ball)

[04:42] Team_008 possession (Score: 14-14)
Jrue Harris drives to the basket... FOUL! Offensive foul on Jrue Harris! Domantas Wall drew the charge! [Team fouls: 6] (Jrue Harris: 1 personal fouls) TURNOVER! (dead ball)

[04:23] Team_018 possession (Score: 14-14)
Bones Anunoby attempts a Layup. Contested by Tyrese Thompson (4.8 feet, MAN). BONES ANUNOBY MAKES IT! Assist: Klay Stewart
Score: 14-16

[04:04] Team_008 possession (Score: 14-16)
Magic Young makes the Dunk and draws the foul on Klay Stewart! And-1! Magic Young to the line for 1. [Team fouls: 2] (Klay Stewart: 1 personal fouls)   FT 1/1: GOOD Magic Young makes 1/1 from the line.
Score: 17-16

[03:50] Team_018 possession (Score: 17-16)
Domantas Wall attempts a Layup. Contested by Magic Young (5.3 feet, MAN). Domantas Wall misses. Rebound secured by Tyrese Thompson.

[03:34] Team_008 possession (Score: 17-16)
FOUL! Shooting foul on Bones Anunoby. Tyrese Thompson to the line for 2 free throws. [Team fouls: 3] (Bones Anunoby: 1 personal fouls)   FT 1/2: GOOD   FT 2/2: GOOD Tyrese Thompson makes 2/2 from the line.
Score: 19-16

[03:18] Team_018 possession (Score: 19-16)
Klay Stewart makes the Dunk and draws the foul on Tyrese Thompson! And-1! Klay Stewart to the line for 1. [BONUS: 7 team fouls] (Tyrese Thompson: 4 personal fouls)   FT 1/1: GOOD Klay Stewart makes 1/1 from the line.
Score: 19-19

[03:03] Team_008 possession (Score: 19-19)
Jrue Harris throws a bad pass! Stolen by Tracy Bryant! TURNOVER! (live ball)

[02:52] Team_018 possession (Score: 19-19)
Allen Markkanen attempts a Layup. BLOCKED BY TYRESE THOMPSON! Ball is loose! Rebound secured by Khris Hyland.

[02:38] Team_008 possession (Score: 19-19)
FOUL! Reach-in foul on Domantas Wall during the drive. [Team fouls: 4] No free throws, side out. (Domantas Wall: 2 personal fouls)

[02:22] Team_008 possession (Score: 19-19)
Jrue Harris drives and kicks out. Tyrese Thompson attempts a 3Pt. Contested by Klay Stewart (4.3 feet, ZONE). TYRESE THOMPSON MAKES IT! Assist: Magic Young
Score: 22-19

[02:03] Team_018 possession (Score: 22-19)
Domantas Wall drives, Tyrese Thompson stays with him. Domantas Wall attempts a Dunk. Contested by Tyrese Thompson (5.0 feet, ZONE). DOMANTAS WALL MAKES IT!
Score: 22-21

[01:52] Team_008 possession (Score: 22-21)
Tyrese Thompson throws a bad pass out of bounds! TURNOVER! (dead ball)

[01:52] Substitution (Team_008): Victor Leonard OUT → Blake Holiday IN (stamina_rule2)

[01:52] Substitution (Team_008): Jrue Harris OUT → Chris Griffin IN (stamina_rule2)

[01:52] Substitution (Team_008): Khris Hyland OUT → Immanuel Young IN (stamina_rule2)

[01:52] Substitution (Team_008): Tyrese Thompson OUT → Khris Giddey IN (stamina_rule2)

[01:52] Substitution (Team_008): Magic Young OUT → Lamelo Middleton IN (stamina_rule2)

[01:52] Substitution (Team_018): Klay Stewart OUT → Michael Simons IN (stamina_rule2)

[01:52] Substitution (Team_018): Tracy Bryant OUT → Miles Herro IN (stamina_rule2)

[01:52] Substitution (Team_018): Bones Anunoby OUT → Shai Wade IN (stamina_rule2)

[01:52] Substitution (Team_018): Domantas Wall OUT → Julius Jackson IN (stamina_rule2)

[01:43] Team_018 possession (Score: 22-21)
Miles Herro drives, Chris Griffin stays with him. Miles Herro attempts a Dunk. Contested by Chris Griffin (5.5 feet, MAN). MILES HERRO MAKES IT!
Score: 22-23

[01:26] Team_008 possession (Score: 22-23)
Lamelo Middleton drives, picks up Julius Jackson. Help arrives from Miles Herro! Lamelo Middleton attempts a Layup. Contested by Miles Herro (5.1 feet, ZONE). Lamelo Middleton misses. Offensive rebound by Khris Giddey! Khris Giddey kicks it out.

[01:10] Team_008 possession (Score: 22-23)
Lamelo Middleton drives and kicks out. Lamelo Middleton attempts a Midrange. Contested by Miles Herro (5.5 feet, ZONE). LAMELO MIDDLETON MAKES IT! Assist: Blake Holiday
Score: 24-23

[00:54] Team_018 possession (Score: 24-23)
Miles Herro attempts a 3Pt. Contested by Khris Giddey (4.5 feet, ZONE). MILES HERRO MAKES IT! Assist: Allen Markkanen
Score: 24-26

[00:37] Team_008 possession (Score: 24-26)
Chris Griffin attempts a Layup. Contested by Miles Herro (5.8 feet, MAN). Chris Griffin misses. Rebound secured by Shai Wade.

[00:19] Team_018 possession (Score: 24-26)
Michael Simons drives, picks up Blake Holiday. Help arrives from Chris Griffin! Michael Simons attempts a Dunk. Contested by Chris Griffin (5.7 feet, MAN). MICHAEL SIMONS MAKES IT!
Score: 24-28

[00:07] Team_008 possession (Score: 24-28)
Chris Griffin attempts a 3Pt. Contested by Miles Herro (5.8 feet, MAN). Chris Griffin misses. Rebound secured by Shai Wade.

================================================================================
                              1ST QUARTER COMPLETE                              
================================================================================

1ST QUARTER SCORE: Team_008 24, Team_018 28

BOX SCORE:
================================================================================

Team_008
--------------------------------------------------------------------------------
Player                MIN  PTS  REB  AST  TO      FG   FG%      3P   3P%
--------------------------------------------------------------------------------
Tyrese Thompson        10    9    3    0   0   4/7    57.1     0/0   0.0
Jrue Harris            10    7    0    1   0   3/4    75.0     0/0   0.0
Magic Young            10    3    2    1   0   1/1   100.0     0/0   0.0
Khris Hyland           10    3    3    1   0   1/3    33.3     0/0   0.0
Lamelo Middleton        2    2    0    0   0   1/1   100.0     0/0   0.0
Victor Leonard         10    0    0    2   0   0/2     0.0     0/0   0.0
Khris Giddey            2    0    1    0   0   0/0     0.0     0/0   0.0
Blake Holiday           2    0    0    1   0   0/0     0.0     0/0   0.0
Chris Griffin           2    0    0    0   0   0/2     0.0     0/0   0.0

TEAM: FG: 10/20 (50.0%), 3PT: 0/8 (0.0%), REB: 9 (2 off, 7 def), AST: 6, TO: 3
TEAM FOULS: 7 [Team_018 in BONUS]


Team_018
--------------------------------------------------------------------------------
Player                MIN  PTS  REB  AST  TO      FG   FG%      3P   3P%
--------------------------------------------------------------------------------
Bones Anunoby          10   11    7    0   0   4/7    57.1     0/0   0.0
Domantas Wall          10    5    1    0   0   2/3    66.7     0/0   0.0
Miles Herro             2    5    0    0   0   2/2   100.0     0/0   0.0
Klay Stewart           10    3    0    2   0   1/2    50.0     0/0   0.0
Allen Markkanen        12    2    2    1   0   1/3    33.3     0/0   0.0
Michael Simons          2    2    0    0   0   1/1   100.0     0/0   0.0
Tracy Bryant           10    0    0    0   0   0/1     0.0     0/0   0.0
Shai Wade               2    0    2    0   0   0/0     0.0     0/0   0.0

TEAM: FG: 11/19 (57.9%), 3PT: 1/5 (20.0%), REB: 12 (3 off, 9 def), AST: 3, TO: 3
TEAM FOULS: 4

================================================================================

================================================================================
                       2ND QUARTER - Team_008 vs Team_018                       
================================================================================

[12:00] Team_008 possession (Score: 24-28)
FOUL! Shooting foul on Bones Anunoby. Magic Young to the line for 2 free throws. [Team fouls: 1] (Bones Anunoby: 1 personal fouls)   FT 1/2: MISS   FT 2/2: GOOD Magic Young makes 1/2 from the line.
Score: 25-28

[11:40] Team_018 possession (Score: 25-28)
Allen Markkanen attempts a 3Pt. Contested by Tyrese Thompson (4.8 feet, ZONE). Allen Markkanen misses. Rebound secured by Tyrese Thompson.

[11:27] Team_008 possession (Score: 25-28)
Magic Young attempts a 3Pt. Contested by Klay Stewart (4.5 feet, ZONE). Magic Young misses. Rebound secured by Domantas Wall.

[11:13] Team_018 possession (Score: 25-28)
FOUL! Shooting foul on Jrue Harris. Allen Markkanen to the line for 2 free throws. [Team fouls: 1] (Jrue Harris: 1 personal fouls)   FT 1/2: GOOD   FT 2/2: GOOD Allen Markkanen makes 2/2 from the line.
Score: 25-30

[10:59] Team_008 possession (Score: 25-30)
Tyrese Thompson drives, picks up Domantas Wall. Help arrives from Klay Stewart! Tyrese Thompson attempts a Layup. Contested by Klay Stewart (3.8 feet, ZONE). Tyrese Thompson misses. FOUL! Loose ball foul on Domantas Wall during the rebound battle. [Team fouls: 2] No free throws, side out. (Domantas Wall: 1 personal fouls)

[10:47] Team_008 possession (Score: 25-30)
Jrue Harris attempts a 3Pt. Contested by Tracy Bryant (3.6 feet, MAN). Jrue Harris misses. Offensive rebound by Tyrese Thompson! Tyrese Thompson kicks it out.

[10:28] Team_008 possession (Score: 25-30)
Victor Leonard drives and kicks out. Khris Hyland attempts a Midrange. Contested by Allen Markkanen (4.2 feet, MAN). Khris Hyland misses. Offensive rebound by Magic Young! Magic Young kicks it out.

[10:15] Team_008 possession (Score: 25-30)
Tyrese Thompson attempts a Midrange. Contested by Domantas Wall (3.9 feet, ZONE). Tyrese Thompson misses. Rebound secured by Domantas Wall.

[10:01] Team_018 possession (Score: 25-30)
Tracy Bryant attempts a 3Pt. Contested by Jrue Harris (4.8 feet, MAN). TRACY BRYANT MAKES IT! Assist: Klay Stewart
Score: 25-33

[09:49] Team_008 possession (Score: 25-33)
Victor Leonard drives, Domantas Wall stays with him. Victor Leonard attempts a Layup. Contested by Domantas Wall (4.1 feet, ZONE). Victor Leonard misses. Offensive rebound by Tyrese Thompson! Tyrese Thompson kicks it out.

[09:34] Team_008 possession (Score: 25-33)
Jrue Harris attempts a Midrange. Contested by Bones Anunoby (3.8 feet, ZONE). Jrue Harris misses. Offensive rebound by Tyrese Thompson! Tyrese Thompson kicks it out.

[09:18] Team_008 possession (Score: 25-33)
Tyrese Thompson attempts a 3Pt. Contested by Bones Anunoby (3.9 feet, MAN). Tyrese Thompson misses. FOUL! Loose ball foul on Bones Anunoby during the rebound battle. [Team fouls: 3] No free throws, side out. (Bones Anunoby: 2 personal fouls)

[09:04] Team_008 possession (Score: 25-33)
Jrue Harris drives to the basket... Jrue Harris loses control! Ball rolls out of bounds! TURNOVER! (dead ball)

[09:04] Substitution (Team_008): Victor Leonard OUT → Blake Holiday IN (stamina_rule2)

[09:04] Substitution (Team_008): Jrue Harris OUT → Chris Griffin IN (stamina_rule2)

[09:04] Substitution (Team_008): Khris Hyland OUT → Immanuel Young IN (stamina_rule2)

[09:04] Substitution (Team_008): Tyrese Thompson OUT → Khris Giddey IN (stamina_rule2)

[09:04] Substitution (Team_008): Magic Young OUT → Lamelo Middleton IN (stamina_rule2)

[09:04] Substitution (Team_018): Klay Stewart OUT → Michael Simons IN (stamina_rule2)

[09:04] Substitution (Team_018): Tracy Bryant OUT → Miles Herro IN (stamina_rule2)

[09:04] Substitution (Team_018): Allen Markkanen OUT → Austin Antetokounmpo IN (stamina_rule2)

[09:04] Substitution (Team_018): Bones Anunoby OUT → Shai Wade IN (stamina_rule2)

[09:04] Substitution (Team_018): Domantas Wall OUT → Julius Jackson IN (stamina_rule2)

[08:49] Team_018 possession (Score: 25-33)
Michael Simons attempts a 3Pt. Contested by Khris Giddey (4.6 feet, ZONE). Michael Simons misses. Rebound secured by Khris Giddey.

[08:30] Team_008 possession (Score: 25-33)
FOUL! Shooting foul on Julius Jackson. Lamelo Middleton to the line for 2 free throws. [Team fouls: 4] (Julius Jackson: 1 personal fouls)   FT 1/2: MISS   FT 2/2: GOOD Lamelo Middleton makes 1/2 from the line.
Score: 26-33

[08:21] Team_018 possession (Score: 26-33)
Michael Simons attempts a Midrange. BLOCKED BY BLAKE HOLIDAY! Ball is loose! Rebound secured by Lamelo Middleton.

[08:07] Team_008 possession (Score: 26-33)
Blake Holiday attempts a 3Pt. Contested by Shai Wade (5.1 feet, ZONE). Blake Holiday misses. Rebound secured by Shai Wade.

[07:50] Team_018 possession (Score: 26-33)
Austin Antetokounmpo attempts a Layup. Contested by Immanuel Young (3.8 feet, MAN). Austin Antetokounmpo misses. Rebound secured by Chris Griffin.

[07:36] Team_008 possession (Score: 26-33)
Chris Griffin attempts a 3Pt. Contested by Miles Herro (5.8 feet, MAN). Chris Griffin misses. Rebound secured by Julius Jackson.

[07:22] Team_018 possession (Score: 26-33)
Julius Jackson drives, Lamelo Middleton stays with him. Julius Jackson attempts a Layup. Contested by Lamelo Middleton (4.7 feet, MAN). JULIUS JACKSON MAKES IT! Assist: Miles Herro
Score: 26-35

[07:11] Team_008 possession (Score: 26-35)
Chris Griffin attempts a Layup. Contested by Julius Jackson (5.1 feet, ZONE). CHRIS GRIFFIN MAKES IT! Assist: Khris Giddey
Score: 28-35

[06:56] Team_018 possession (Score: 28-35)
Shai Wade attempts a Midrange. Contested by Chris Griffin (4.8 feet, ZONE). Shai Wade misses. Offensive rebound by Julius Jackson! Julius Jackson kicks it out.

[06:43] Team_018 possession (Score: 28-35)
Julius Jackson attempts a Midrange. Contested by Khris Giddey (4.7 feet, ZONE). Julius Jackson misses. Rebound secured by Chris Griffin.

[06:33] Team_008 possession (Score: 28-35)
Lamelo Middleton attempts a Midrange. Contested by Julius Jackson (5.1 feet, MAN). LAMELO MIDDLETON MAKES IT! Assist: Blake Holiday
Score: 30-35

[06:21] Team_018 possession (Score: 30-35)
Julius Jackson attempts a Midrange. Contested by Khris Giddey (4.7 feet, ZONE). Julius Jackson misses. Rebound secured by Khris Giddey.

[06:03] Team_008 possession (Score: 30-35)
Immanuel Young attempts a Midrange. Contested by Michael Simons (5.9 feet, ZONE). IMMANUEL YOUNG MAKES IT!
Score: 32-35

[05:49] Team_018 possession (Score: 32-35)
Shai Wade makes the Layup and draws the foul on Khris Giddey! And-1! Shai Wade to the line for 1. [Team fouls: 2] (Khris Giddey: 1 personal fouls)   FT 1/1: GOOD Shai Wade makes 1/1 from the line.
Score: 32-38

[05:30] Team_008 possession (Score: 32-38)
Khris Giddey drives, Julius Jackson stays with him. Khris Giddey attempts a Dunk. Contested by Julius Jackson (4.6 feet, ZONE). KHRIS GIDDEY MAKES IT!
Score: 34-38

[05:14] Team_018 possession (Score: 34-38)
FOUL! Shooting foul on Chris Griffin. Julius Jackson to the line for 2 free throws. [Team fouls: 3] (Chris Griffin: 1 personal fouls)   FT 1/2: GOOD   FT 2/2: GOOD Julius Jackson makes 2/2 from the line.
Score: 34-40

[05:03] Team_008 possession (Score: 34-40)
FOUL! Reach-in foul on Julius Jackson during the drive. [IN THE BONUS! 5 team fouls] Lamelo Middleton to the line for 2 free throws. (Julius Jackson: 2 personal fouls)   FT 1/2: GOOD   FT 2/2: GOOD Lamelo Middleton makes 2/2 from the line.
Score: 36-40

[04:51] Team_018 possession (Score: 36-40)
Michael Simons attempts a Midrange. Contested by Chris Griffin (5.6 feet, ZONE). Michael Simons misses. Rebound secured by Chris Griffin.

[04:37] Team_008 possession (Score: 36-40)
Immanuel Young drives, Austin Antetokounmpo stays with him. Immanuel Young attempts a Layup. Contested by Austin Antetokounmpo (5.8 feet, MAN). Immanuel Young misses. Rebound secured by Julius Jackson.

[04:23] Team_018 possession (Score: 36-40)
Austin Antetokounmpo attempts a 3Pt. Contested by Khris Giddey (3.7 feet, ZONE). Austin Antetokounmpo misses. Offensive rebound by Shai Wade! Shai Wade kicks it out.

[04:12] Team_018 possession (Score: 36-40)
Miles Herro attempts a 3Pt. Contested by Khris Giddey (4.5 feet, ZONE). Miles Herro misses. Rebound secured by Chris Griffin.

[03:59] Team_008 possession (Score: 36-40)
Chris Griffin attempts a 3Pt. Contested by Michael Simons (5.7 feet, ZONE). CHRIS GRIFFIN MAKES IT! Assist: Immanuel Young
Score: 39-40

[03:47] Team_018 possession (Score: 39-40)
Michael Simons makes the Dunk and draws the foul on Lamelo Middleton! And-1! Michael Simons to the line for 1. [Team fouls: 4] (Lamelo Middleton: 1 personal fouls)   FT 1/1: MISS Michael Simons makes 0/1 from the line. Rebound secured by Chris Griffin.
Score: 39-42

[03:34] Team_008 possession (Score: 39-42)
Lamelo Middleton drives, Julius Jackson stays with him. Lamelo Middleton attempts a Layup. Contested by Julius Jackson (5.1 feet, MAN). LAMELO MIDDLETON MAKES IT! Assist: Chris Griffin
Score: 41-42

[03:21] Team_018 possession (Score: 41-42)
Austin Antetokounmpo attempts a 3Pt. Contested by Khris Giddey (3.7 feet, ZONE). Austin Antetokounmpo misses. Offensive rebound by Shai Wade! Shai Wade kicks it out.

[03:09] Team_018 possession (Score: 41-42)
FOUL! Holding foul on Blake Holiday. [IN THE BONUS! 5 team fouls] Michael Simons to the line for 2 free throws. (Blake Holiday: 1 personal fouls)   FT 1/2: MISS   FT 2/2: GOOD Michael Simons makes 1/2 from the line.
Score: 41-43

[02:56] Team_008 possession (Score: 41-43)
Lamelo Middleton drives, Julius Jackson stays with him. Lamelo Middleton attempts a Layup. Contested by Julius Jackson (5.2 feet, MAN). Lamelo Middleton misses. Offensive rebound by Khris Giddey! Khris Giddey kicks it out.

[02:43] Team_008 possession (Score: 41-43)
Chris Griffin attempts a 3Pt. Contested by Miles Herro (5.8 feet, ZONE). Chris Griffin misses. Offensive rebound by Khris Giddey! Khris Giddey kicks it out.

[02:25] Team_008 possession (Score: 41-43)
Immanuel Young drives and kicks out. Lamelo Middleton attempts a 3Pt. Contested by Julius Jackson (4.9 feet, MAN). Lamelo Middleton misses. Rebound secured by Austin Antetokounmpo.

[02:06] Team_018 possession (Score: 41-43)
Austin Antetokounmpo attempts a Midrange. Contested by Khris Giddey (3.8 feet, ZONE). AUSTIN ANTETOKOUNMPO MAKES IT! Assist: Miles Herro
Score: 41-45

[01:52] Team_008 possession (Score: 41-45)
Chris Griffin attempts a Midrange. Contested by Shai Wade (5.4 feet, ZONE). CHRIS GRIFFIN MAKES IT! Assist: Lamelo Middleton
Score: 43-45

[01:36] Team_018 possession (Score: 43-45)
Austin Antetokounmpo attempts a 3Pt. Contested by Immanuel Young (3.9 feet, MAN). AUSTIN ANTETOKOUNMPO MAKES IT! Assist: Shai Wade
Score: 43-48

[01:20] Team_008 possession (Score: 43-48)
Chris Griffin makes the Layup and draws the foul on Miles Herro! And-1! Chris Griffin to the line for 1. [BONUS: 6 team fouls] (Miles Herro: 1 personal fouls)   FT 1/1: GOOD Chris Griffin makes 1/1 from the line.
Score: 46-48

[01:02] Team_018 possession (Score: 46-48)
Austin Antetokounmpo attempts a Layup. Contested by Immanuel Young (4.0 feet, MAN). AUSTIN ANTETOKOUNMPO MAKES IT!
Score: 46-50

[00:45] Team_008 possession (Score: 46-50)
Khris Giddey makes the Midrange and draws the foul on Shai Wade! And-1! Khris Giddey to the line for 1. [BONUS: 7 team fouls] (Shai Wade: 1 personal fouls)   FT 1/1: GOOD Khris Giddey makes 1/1 from the line.
Score: 49-50

[00:29] Team_018 possession (Score: 49-50)
FOUL! Offensive foul on Shai Wade! Khris Giddey drew the charge! [Team fouls: 8] (Shai Wade: 2 personal fouls) TURNOVER! (dead ball)

[00:18] Team_008 possession (Score: 49-50)
Immanuel Young attempts a Midrange. Contested by Austin Antetokounmpo (5.9 feet, MAN). Immanuel Young misses. Offensive rebound by Khris Giddey! Khris Giddey kicks it out.

================================================================================
                              2ND QUARTER COMPLETE                              
================================================================================

2ND QUARTER SCORE: Team_008 25, Team_018 22

BOX SCORE:
================================================================================

Team_008
--------------------------------------------------------------------------------
Player                MIN  PTS  REB  AST  TO      FG   FG%      3P   3P%
--------------------------------------------------------------------------------
Chris Griffin          11   10    5    1   0   4/5    80.0     0/0   0.0
Lamelo Middleton       11    7    1    1   0   4/4   100.0     0/0   0.0
Khris Giddey           11    5    5    1   0   2/2   100.0     0/0   0.0
Immanuel Young         11    2    0    1   0   1/3    33.3     0/0   0.0
Magic Young            13    1    2    0   0   1/2    50.0     0/0   0.0
Tyrese Thompson        13    0    5    0   0   0/1     0.0     0/0   0.0
Blake Holiday          11    0    0    1   0   0/1     0.0     0/0   0.0

TEAM: FG: 12/18 (66.7%), 3PT: 1/4 (25.0%), REB: 18 (9 off, 9 def), AST: 5, TO: 1
TEAM FOULS: 5 [Team_018 in BONUS]


Team_018
--------------------------------------------------------------------------------
Player                MIN  PTS  REB  AST  TO      FG   FG%      3P   3P%
--------------------------------------------------------------------------------
Austin Antetokounmpo    9    7    1    0   0   3/4    75.0     0/0   0.0
Julius Jackson         11    4    3    0   0   2/4    50.0     0/0   0.0
Tracy Bryant           13    3    0    0   0   1/1   100.0     0/0   0.0
Shai Wade              11    3    3    1   0   1/1   100.0     0/0   0.0
Allen Markkanen        15    2    0    0   0   1/2    50.0     0/0   0.0
Michael Simons         11    1    0    0   0   1/5    20.0     0/0   0.0
Domantas Wall          13    0    2    0   0   0/0     0.0     0/0   0.0
Klay Stewart           13    0    0    1   0   0/0     0.0     0/0   0.0
Miles Herro            11    0    0    2   0   0/1     0.0     0/0   0.0

TEAM: FG: 9/18 (50.0%), 3PT: 2/5 (40.0%), REB: 9 (3 off, 6 def), AST: 4, TO: 1
TEAM FOULS: 8 [Team_008 in BONUS]

================================================================================

================================================================================
                       3RD QUARTER - Team_008 vs Team_018                       
================================================================================

[12:00] Team_008 possession (Score: 49-50)
Magic Young attempts a Midrange. Contested by Allen Markkanen (4.2 feet, ZONE). MAGIC YOUNG MAKES IT! Assist: Khris Hyland
Score: 51-50

[11:47] Team_018 possession (Score: 51-50)
Tracy Bryant attempts a Midrange. Contested by Jrue Harris (4.6 feet, MAN). TRACY BRYANT MAKES IT! Assist: Domantas Wall
Score: 51-52

[11:33] Team_008 possession (Score: 51-52)
Khris Hyland attempts a 3Pt. Contested by Allen Markkanen (3.9 feet, MAN). KHRIS HYLAND MAKES IT! Assist: Jrue Harris
Score: 54-52

[11:16] Team_018 possession (Score: 54-52)
Domantas Wall drives and kicks out. Klay Stewart attempts a Midrange. Contested by Victor Leonard (5.0 feet, MAN). Klay Stewart misses. Offensive rebound by Domantas Wall! Domantas Wall puts it back in!
Score: 54-54

[10:58] Team_008 possession (Score: 54-54)
FOUL! Shooting foul on Klay Stewart. Victor Leonard to the line for 3 free throws. [Team fouls: 1] (Klay Stewart: 1 personal fouls)   FT 1/3: GOOD   FT 2/3: GOOD   FT 3/3: GOOD Victor Leonard makes 3/3 from the line.
Score: 57-54

[10:49] Team_018 possession (Score: 57-54)
Allen Markkanen drives and kicks out. Domantas Wall attempts a 3Pt. Contested by Magic Young (4.9 feet, MAN). Domantas Wall misses. Offensive rebound by Domantas Wall! Domantas Wall puts it back in!
Score: 57-56

[10:34] Team_008 possession (Score: 57-56)
Tyrese Thompson attempts a Layup. Contested by Domantas Wall (3.6 feet, ZONE). TYRESE THOMPSON MAKES IT! Assist: Victor Leonard
Score: 59-56

[10:15] Team_018 possession (Score: 59-56)
Allen Markkanen attempts a Midrange. Contested by Tyrese Thompson (4.7 feet, ZONE). ALLEN MARKKANEN MAKES IT! Assist: Klay Stewart
Score: 59-58

[10:01] Team_008 possession (Score: 59-58)
Tyrese Thompson attempts a 3Pt. Contested by Klay Stewart (4.3 feet, ZONE). Tyrese Thompson misses. Offensive rebound by Magic Young! Magic Young puts it back in!
Score: 61-58

[09:47] Team_018 possession (Score: 61-58)
Allen Markkanen attempts a 3Pt. Contested by Victor Leonard (5.3 feet, ZONE). Allen Markkanen misses. Offensive rebound by Domantas Wall! Domantas Wall puts it back in!
Score: 61-60

[09:31] Team_008 possession (Score: 61-60)
Tyrese Thompson drives and kicks out. Victor Leonard attempts a 3Pt. Contested by Klay Stewart (4.1 feet, ZONE). Victor Leonard misses. Offensive rebound by Magic Young! Magic Young puts it back in!
Score: 63-60

[09:18] Team_018 possession (Score: 63-60)
Bones Anunoby attempts a Midrange. Contested by Tyrese Thompson (4.7 feet, MAN). BONES ANUNOBY MAKES IT! Assist: Klay Stewart
Score: 63-62

[09:03] Team_008 possession (Score: 63-62)
Magic Young commits a violation (traveling/carry)! TURNOVER! (dead ball)

[08:51] Team_018 possession (Score: 63-62)
Bones Anunoby throws a bad pass! Stolen by Tyrese Thompson! TURNOVER! (live ball)

[08:36] Team_008 possession (Score: 63-62)
Victor Leonard attempts a Midrange. Contested by Allen Markkanen (4.2 feet, ZONE). Victor Leonard misses. Rebound secured by Domantas Wall.

[08:21] Team_018 possession (Score: 63-62)
Domantas Wall attempts a Layup. Contested by Tyrese Thompson (4.6 feet, ZONE). DOMANTAS WALL MAKES IT! Assist: Bones Anunoby
Score: 63-64

[08:08] Team_008 possession (Score: 63-64)
Tyrese Thompson attempts a 3Pt. Contested by Klay Stewart (4.3 feet, ZONE). Tyrese Thompson misses. Rebound secured by Allen Markkanen.

[07:53] Team_018 possession (Score: 63-64)
Domantas Wall attempts a Midrange. Contested by Magic Young (5.2 feet, MAN). DOMANTAS WALL MAKES IT! Assist: Klay Stewart
Score: 63-66

[07:35] Team_008 possession (Score: 63-66)
Jrue Harris attempts a 3Pt. Contested by Tracy Bryant (3.5 feet, MAN). Jrue Harris misses. Rebound secured by Allen Markkanen.

[07:21] Team_018 possession (Score: 63-66)
Tracy Bryant drives and kicks out. Klay Stewart attempts a 3Pt. Contested by Victor Leonard (5.0 feet, ZONE). Klay Stewart misses. Rebound secured by Tyrese Thompson.

[07:08] Team_008 possession (Score: 63-66)
Magic Young makes the Dunk and draws the foul on Domantas Wall! And-1! Magic Young to the line for 1. [Team fouls: 2] (Domantas Wall: 1 personal fouls)   FT 1/1: GOOD Magic Young makes 1/1 from the line.
Score: 66-66

[06:54] Team_018 possession (Score: 66-66)
Allen Markkanen makes the Dunk and draws the foul on Tyrese Thompson! And-1! Allen Markkanen to the line for 1. [Team fouls: 1] (Tyrese Thompson: 1 personal fouls)   FT 1/1: GOOD Allen Markkanen makes 1/1 from the line.
Score: 66-69

[06:40] Team_008 possession (Score: 66-69)
Magic Young drives, Domantas Wall stays with him. Magic Young attempts a Dunk. Contested by Domantas Wall (3.8 feet, ZONE). MAGIC YOUNG MAKES IT! Assist: Victor Leonard
Score: 68-69

[06:24] Team_018 possession (Score: 68-69)
Tracy Bryant attempts a Layup. Contested by Tyrese Thompson (4.7 feet, ZONE). Tracy Bryant misses. Rebound secured by Magic Young.

[06:13] Team_008 possession (Score: 68-69)
Khris Hyland attempts a Midrange. Contested by Allen Markkanen (3.9 feet, MAN). KHRIS HYLAND MAKES IT!
Score: 70-69

[06:00] Team_018 possession (Score: 70-69)
Allen Markkanen attempts a 3Pt. Contested by Victor Leonard (5.3 feet, ZONE). ALLEN MARKKANEN MAKES IT! Assist: Domantas Wall
Score: 70-72

[05:46] Team_008 possession (Score: 70-72)
Khris Hyland drives, picks up Allen Markkanen. Help arrives from Klay Stewart! Khris Hyland attempts a Dunk. Contested by Klay Stewart (3.9 feet, MAN). KHRIS HYLAND MAKES IT! Assist: Victor Leonard
Score: 72-72

[05:33] Team_018 possession (Score: 72-72)
Klay Stewart attempts a Midrange. Contested by Victor Leonard (5.2 feet, MAN). KLAY STEWART MAKES IT!
Score: 72-74

[05:21] Team_008 possession (Score: 72-74)
Victor Leonard attempts a 3Pt. Contested by Klay Stewart (4.4 feet, MAN). VICTOR LEONARD MAKES IT! Assist: Khris Hyland
Score: 75-74

[05:08] Team_018 possession (Score: 75-74)
FOUL! Holding foul on Jrue Harris. [Team fouls: 2] No free throws, side out. (Jrue Harris: 1 personal fouls)

[04:51] Team_018 possession (Score: 75-74)
Bones Anunoby attempts a 3Pt. Contested by Victor Leonard (5.4 feet, ZONE). BONES ANUNOBY MAKES IT! Assist: Allen Markkanen
Score: 75-77

[04:39] Team_008 possession (Score: 75-77)
Jrue Harris drives to the basket... Jrue Harris commits a violation (traveling/carry)! TURNOVER! (dead ball)

[04:22] Team_018 possession (Score: 75-77)
FOUL! Reach-in foul on Victor Leonard during the drive. [Team fouls: 3] No free throws, side out. (Victor Leonard: 1 personal fouls)

[04:08] Team_018 possession (Score: 75-77)
Bones Anunoby makes the Layup and draws the foul on Tyrese Thompson! And-1! Bones Anunoby to the line for 1. [Team fouls: 4] (Tyrese Thompson: 2 personal fouls)   FT 1/1: GOOD Bones Anunoby makes 1/1 from the line.
Score: 75-80

[03:55] Team_008 possession (Score: 75-80)
FOUL! Reach-in foul on Domantas Wall during the drive. [Team fouls: 3] No free throws, side out. (Domantas Wall: 2 personal fouls)

[03:44] Team_008 possession (Score: 75-80)
Victor Leonard attempts a Layup. BLOCKED BY KLAY STEWART! Ball deflects out of bounds off Victor Leonard.

[03:28] Team_018 possession (Score: 75-80)
Allen Markkanen attempts a Layup. Contested by Khris Hyland (4.6 feet, MAN). Allen Markkanen misses. Rebound secured by Khris Hyland.

[03:17] Team_008 possession (Score: 75-80)
Magic Young drives and kicks out. Tyrese Thompson attempts a 3Pt. Contested by Klay Stewart (4.3 feet, ZONE). TYRESE THOMPSON MAKES IT! Assist: Khris Hyland
Score: 78-80

[03:06] Team_018 possession (Score: 78-80)
Bones Anunoby attempts a Midrange. Contested by Tyrese Thompson (5.0 feet, MAN). BONES ANUNOBY MAKES IT!
Score: 78-82

[02:54] Team_008 possession (Score: 78-82)
FOUL! Shooting foul on Domantas Wall. Tyrese Thompson to the line for 2 free throws. [Team fouls: 4] (Domantas Wall: 3 personal fouls)   FT 1/2: GOOD   FT 2/2: MISS Tyrese Thompson makes 1/2 from the line. Offensive rebound by Magic Young! Magic Young kicks it out.
Score: 79-82

[02:38] Team_008 possession (Score: 79-82)
Khris Hyland attempts a Layup. Contested by Allen Markkanen (4.1 feet, MAN). KHRIS HYLAND MAKES IT! Assist: Magic Young
Score: 81-82

[02:26] Team_018 possession (Score: 81-82)
Domantas Wall drives, Tyrese Thompson stays with him. Domantas Wall attempts a Layup. Contested by Tyrese Thompson (5.0 feet, ZONE). DOMANTAS WALL MAKES IT! Assist: Bones Anunoby
Score: 81-84

[02:14] Team_008 possession (Score: 81-84)
Magic Young attempts a Layup. BLOCKED BY DOMANTAS WALL! Ball goes out off Domantas Wall. Magic Young's ball!

[02:02] Team_008 possession (Score: 81-84)
Khris Hyland attempts a 3Pt. Contested by Allen Markkanen (4.1 feet, MAN). Khris Hyland misses. Rebound secured by Allen Markkanen.

[01:47] Team_018 possession (Score: 81-84)
FOUL! Holding foul on Khris Hyland. [IN THE BONUS! 5 team fouls] Allen Markkanen to the line for 2 free throws. (Khris Hyland: 1 personal fouls)   FT 1/2: GOOD   FT 2/2: GOOD Allen Markkanen makes 2/2 from the line.
Score: 81-86

[01:35] Team_008 possession (Score: 81-86)
Jrue Harris attempts a 3Pt. Contested by Tracy Bryant (3.8 feet, MAN). JRUE HARRIS MAKES IT!
Score: 84-86

[01:18] Team_018 possession (Score: 84-86)
Domantas Wall drives and kicks out. Bones Anunoby attempts a 3Pt. Contested by Tyrese Thompson (5.0 feet, MAN). Bones Anunoby misses. Rebound secured by Khris Hyland.

[01:01] Team_008 possession (Score: 84-86)
Magic Young drives and kicks out. Magic Young attempts a 3Pt. Contested by Domantas Wall (4.1 feet, MAN). MAGIC YOUNG MAKES IT! Assist: Khris Hyland
Score: 87-86

[00:45] Team_018 possession (Score: 87-86)
Allen Markkanen drives, picks up Khris Hyland. Help arrives from Jrue Harris! Allen Markkanen attempts a Layup. Contested by Jrue Harris (4.9 feet, MAN). ALLEN MARKKANEN MAKES IT! Assist: Tracy Bryant
Score: 87-88

[00:34] Team_008 possession (Score: 87-88)
FOUL! Holding foul on Klay Stewart. [IN THE BONUS! 5 team fouls] Victor Leonard to the line for 2 free throws. (Klay Stewart: 2 personal fouls)   FT 1/2: MISS   FT 2/2: GOOD Victor Leonard makes 1/2 from the line.
Score: 88-88

[00:24] Team_018 possession (Score: 88-88)
Bones Anunoby attempts a 3Pt. Contested by Tyrese Thompson (5.3 feet, MAN). Bones Anunoby misses. Rebound secured by Magic Young.

[00:11] Team_008 possession (Score: 88-88)
Jrue Harris attempts a 3Pt. Contested by Tracy Bryant (4.0 feet, MAN). JRUE HARRIS MAKES IT! Assist: Victor Leonard
Score: 91-88

================================================================================
                              3RD QUARTER COMPLETE                              
================================================================================

3RD QUARTER SCORE: Team_008 42, Team_018 38

BOX SCORE:
================================================================================

Team_008
--------------------------------------------------------------------------------
Player                MIN  PTS  REB  AST  TO      FG   FG%      3P   3P%
--------------------------------------------------------------------------------
Magic Young            26   14    5    1   0   6/6   100.0     0/0   0.0
Khris Hyland           26    9    2    4   0   4/5    80.0     0/0   0.0
Victor Leonard         26    7    0    4   0   3/5    60.0     0/0   0.0
Jrue Harris            26    6    0    1   0   2/3    66.7     0/0   0.0
Tyrese Thompson        26    5    1    0   0   2/3    66.7     0/0   0.0

TEAM: FG: 17/22 (77.3%), 3PT: 6/9 (66.7%), REB: 8 (3 off, 5 def), AST: 10, TO: 2
TEAM FOULS: 5 [Team_018 in BONUS]


Team_018
--------------------------------------------------------------------------------
Player                MIN  PTS  REB  AST  TO      FG   FG%      3P   3P%
--------------------------------------------------------------------------------
Domantas Wall          26   12    4    2   0   6/7    85.7     0/0   0.0
Allen Markkanen        27   12    3    1   0   5/6    83.3     0/0   0.0
Bones Anunoby          26   10    0    2   0   4/5    80.0     0/0   0.0
Tracy Bryant           26    2    0    1   0   1/3    33.3     0/0   0.0
Klay Stewart           26    2    0    3   0   1/1   100.0     0/0   0.0

TEAM: FG: 17/22 (77.3%), 3PT: 3/4 (75.0%), REB: 7 (3 off, 4 def), AST: 9, TO: 1
TEAM FOULS: 5 [Team_008 in BONUS]

================================================================================

================================================================================
                       4TH QUARTER - Team_008 vs Team_018                       
================================================================================

[12:00] Team_008 possession (Score: 91-88)
Victor Leonard attempts a 3Pt. Contested by Klay Stewart (4.7 feet, ZONE). VICTOR LEONARD MAKES IT! Assist: Tyrese Thompson
Score: 94-88

[11:45] Team_018 possession (Score: 94-88)
FOUL! Reach-in foul on Tyrese Thompson during the drive. [Team fouls: 1] No free throws, side out. (Tyrese Thompson: 1 personal fouls)

[11:31] Team_018 possession (Score: 94-88)
Allen Markkanen drives, Khris Hyland stays with him. Allen Markkanen attempts a Layup. Contested by Khris Hyland (4.8 feet, MAN). Allen Markkanen misses. Rebound secured by Magic Young.

[11:18] Team_008 possession (Score: 94-88)
Magic Young attempts a Layup. Contested by Domantas Wall (4.4 feet, MAN). MAGIC YOUNG MAKES IT!
Score: 96-88

[11:04] Team_018 possession (Score: 96-88)
Domantas Wall makes the Midrange and draws the foul on Tyrese Thompson! And-1! Domantas Wall to the line for 1. [Team fouls: 2] (Tyrese Thompson: 2 personal fouls)   FT 1/1: GOOD Domantas Wall makes 1/1 from the line.
Score: 96-91

[10:47] Team_008 possession (Score: 96-91)
Khris Hyland attempts a 3Pt. Contested by Klay Stewart (4.6 feet, ZONE). Khris Hyland misses. Rebound secured by Domantas Wall.

[10:29] Team_018 possession (Score: 96-91)
Bones Anunoby attempts a Midrange. Contested by Tyrese Thompson (5.3 feet, ZONE). Bones Anunoby misses. Offensive rebound by Domantas Wall! Domantas Wall puts it back in!
Score: 96-93

[10:10] Team_008 possession (Score: 96-93)
Jrue Harris loses the ball! Stripped by Tracy Bryant! TURNOVER! (live ball)

[09:56] Team_018 possession (Score: 96-93)
Bones Anunoby drives to the basket... FOUL! Offensive foul on Bones Anunoby! Tyrese Thompson drew the charge! [Team fouls: 1] (Bones Anunoby: 1 personal fouls) TURNOVER! (dead ball)

[09:41] Team_008 possession (Score: 96-93)
Tyrese Thompson attempts a Layup. Contested by Domantas Wall (4.4 feet, ZONE). TYRESE THOMPSON MAKES IT!
Score: 98-93

[09:27] Team_018 possession (Score: 98-93)
Bones Anunoby attempts a Layup. Contested by Tyrese Thompson (5.4 feet, ZONE). BONES ANUNOBY MAKES IT! Assist: Tracy Bryant
Score: 98-95

[09:09] Team_008 possession (Score: 98-95)
Magic Young attempts a Layup. BLOCKED BY DOMANTAS WALL! Ball deflects out of bounds off Magic Young.

[08:59] Team_018 possession (Score: 98-95)
Bones Anunoby attempts a Midrange. Contested by Tyrese Thompson (5.5 feet, MAN). BONES ANUNOBY MAKES IT! Assist: Allen Markkanen
Score: 98-97

[08:42] Team_008 possession (Score: 98-97)
Magic Young attempts a Midrange. Contested by Tracy Bryant (4.3 feet, ZONE). MAGIC YOUNG MAKES IT! Assist: Victor Leonard
Score: 100-97

[08:29] Team_018 possession (Score: 100-97)
Allen Markkanen attempts a Midrange. Contested by Khris Hyland (5.1 feet, MAN). Allen Markkanen misses. Rebound secured by Khris Hyland.

[08:17] Team_008 possession (Score: 100-97)
Victor Leonard attempts a Layup. Contested by Domantas Wall (4.8 feet, ZONE). Victor Leonard misses. Rebound secured by Bones Anunoby.

[08:03] Team_018 possession (Score: 100-97)
Klay Stewart drives, picks up Tyrese Thompson. Help arrives from Jrue Harris! Klay Stewart attempts a Layup. Contested by Jrue Harris (5.6 feet, ZONE). KLAY STEWART MAKES IT! Assist: Allen Markkanen
Score: 100-99

[07:51] Team_008 possession (Score: 100-99)
Magic Young attempts a Layup. Contested by Domantas Wall (4.9 feet, MAN). MAGIC YOUNG MAKES IT! Assist: Khris Hyland
Score: 102-99

[07:37] Team_018 possession (Score: 102-99)
Bones Anunoby attempts a Midrange. Contested by Tyrese Thompson (5.7 feet, MAN). BONES ANUNOBY MAKES IT!
Score: 102-101

[07:22] Team_008 possession (Score: 102-101)
Victor Leonard attempts a 3Pt. Contested by Klay Stewart (5.2 feet, MAN). Victor Leonard misses. Offensive rebound by Magic Young! Magic Young kicks it out.

[07:13] Team_008 possession (Score: 102-101)
Magic Young drives to the basket... Magic Young loses the ball! Stripped by Domantas Wall! TURNOVER! (live ball)

[06:54] Team_018 possession (Score: 102-101)
FOUL! Offensive foul on Tracy Bryant! Jrue Harris drew the charge! [Team fouls: 2] (Tracy Bryant: 1 personal fouls) TURNOVER! (dead ball)

[06:45] Team_008 possession (Score: 102-101)
Khris Hyland attempts a Midrange. Contested by Allen Markkanen (4.7 feet, MAN). Khris Hyland misses. Rebound secured by Bones Anunoby.

[06:31] Team_018 possession (Score: 102-101)
Allen Markkanen attempts a Midrange. Contested by Jrue Harris (5.6 feet, ZONE). Allen Markkanen misses. Rebound secured by Magic Young.

[06:19] Team_008 possession (Score: 102-101)
Tyrese Thompson attempts a Midrange. Contested by Domantas Wall (5.0 feet, ZONE). TYRESE THOMPSON MAKES IT!
Score: 104-101

[06:02] Team_018 possession (Score: 104-101)
Bones Anunoby throws a bad pass out of bounds! TURNOVER! (dead ball)

[06:02] Substitution (Team_008): Victor Leonard OUT → Blake Holiday IN (stamina_rule2)

[06:02] Substitution (Team_008): Jrue Harris OUT → Chris Griffin IN (stamina_rule2)

[06:02] Substitution (Team_008): Khris Hyland OUT → Immanuel Young IN (stamina_rule2)

[06:02] Substitution (Team_008): Tyrese Thompson OUT → Khris Giddey IN (stamina_rule2)

[06:02] Substitution (Team_008): Magic Young OUT → Lamelo Middleton IN (stamina_rule2)

[06:02] Substitution (Team_018): Klay Stewart OUT → Michael Simons IN (stamina_rule2)

[06:02] Substitution (Team_018): Tracy Bryant OUT → Miles Herro IN (stamina_rule2)

[06:02] Substitution (Team_018): Allen Markkanen OUT → Austin Antetokounmpo IN (stamina_rule2)

[06:02] Substitution (Team_018): Bones Anunoby OUT → Shai Wade IN (stamina_rule2)

[06:02] Substitution (Team_018): Domantas Wall OUT → Julius Jackson IN (stamina_rule2)

[05:46] Team_008 possession (Score: 104-101)
Immanuel Young drives, Austin Antetokounmpo stays with him. Immanuel Young attempts a Dunk. Contested by Austin Antetokounmpo (5.8 feet, MAN). IMMANUEL YOUNG MAKES IT!
Score: 106-101

[05:31] Team_018 possession (Score: 106-101)
Julius Jackson attempts a Midrange. Contested by Lamelo Middleton (4.7 feet, MAN). JULIUS JACKSON MAKES IT!
Score: 106-103

[05:13] Team_008 possession (Score: 106-103)
FOUL! Holding foul on Julius Jackson. [Team fouls: 3] No free throws, side out. (Julius Jackson: 1 personal fouls)

[04:58] Team_008 possession (Score: 106-103)
Khris Giddey drives, Shai Wade stays with him. Khris Giddey attempts a Layup. Contested by Shai Wade (4.8 feet, MAN). Khris Giddey misses. Offensive rebound by Lamelo Middleton! Lamelo Middleton puts it back in!
Score: 108-103

[04:44] Team_018 possession (Score: 108-103)
Michael Simons attempts a Midrange. Contested by Khris Giddey (4.6 feet, ZONE). Michael Simons misses. Rebound secured by Chris Griffin.

[04:33] Team_008 possession (Score: 108-103)
Blake Holiday attempts a 3Pt. Contested by Michael Simons (5.6 feet, MAN). BLAKE HOLIDAY MAKES IT! Assist: Immanuel Young
Score: 111-103

[04:14] Team_018 possession (Score: 111-103)
Austin Antetokounmpo attempts a Layup. Contested by Immanuel Young (3.8 feet, MAN). AUSTIN ANTETOKOUNMPO MAKES IT! Assist: Miles Herro
Score: 111-105

[04:00] Team_008 possession (Score: 111-105)
Immanuel Young attempts a 3Pt. Contested by Austin Antetokounmpo (5.8 feet, MAN). Immanuel Young misses. Rebound secured by Julius Jackson.

[03:45] Team_018 possession (Score: 111-105)
Michael Simons drives to the basket... Michael Simons commits a violation (traveling/carry)! TURNOVER! (dead ball)

[03:28] Team_008 possession (Score: 111-105)
Immanuel Young drives to the basket... Immanuel Young throws a bad pass! Stolen by Julius Jackson! TURNOVER! (live ball)

[03:15] Team_018 possession (Score: 111-105)
FOUL! Holding foul on Chris Griffin. [Team fouls: 3] No free throws, side out. (Chris Griffin: 1 personal fouls)

[03:01] Team_018 possession (Score: 111-105)
FOUL! Reach-in foul on Blake Holiday during the drive. [Team fouls: 4] No free throws, side out. (Blake Holiday: 1 personal fouls)

[02:49] Team_018 possession (Score: 111-105)
Miles Herro attempts a 3Pt. Contested by Blake Holiday (5.6 feet, ZONE). Miles Herro misses. Rebound secured by Lamelo Middleton.

[02:34] Team_008 possession (Score: 111-105)
Khris Giddey attempts a 3Pt. Contested by Michael Simons (5.3 feet, ZONE). KHRIS GIDDEY MAKES IT! Assist: Immanuel Young
Score: 114-105

[02:21] Team_018 possession (Score: 114-105)
Julius Jackson drives to the basket... Julius Jackson loses control! Ball rolls out of bounds! TURNOVER! (dead ball)

[02:05] Team_008 possession (Score: 114-105)
Blake Holiday attempts a 3Pt. Contested by Michael Simons (5.6 feet, ZONE). Blake Holiday misses. Offensive rebound by Khris Giddey! Khris Giddey kicks it out.

[01:53] Team_008 possession (Score: 114-105)
FOUL! Holding foul on Shai Wade. [Team fouls: 4] No free throws, side out. (Shai Wade: 1 personal fouls)

[01:38] Team_008 possession (Score: 114-105)
Blake Holiday attempts a Midrange. Contested by Shai Wade (5.1 feet, ZONE). BLAKE HOLIDAY MAKES IT!
Score: 116-105

[01:27] Team_018 possession (Score: 116-105)
Shai Wade throws a bad pass! Stolen by Khris Giddey! TURNOVER! (live ball)

[01:13] Team_008 possession (Score: 116-105)
Blake Holiday attempts a Layup. BLOCKED BY JULIUS JACKSON! Ball deflects out of bounds off Blake Holiday.

[01:00] Team_018 possession (Score: 116-105)
Miles Herro drives, picks up Chris Griffin. Help arrives from Immanuel Young! Miles Herro attempts a Dunk. Contested by Immanuel Young (5.5 feet, MAN). MILES HERRO MAKES IT! Assist: Austin Antetokounmpo
Score: 116-107

[00:41] Team_008 possession (Score: 116-107)
Immanuel Young makes the Layup and draws the foul on Julius Jackson! And-1! Immanuel Young to the line for 1. [BONUS: 5 team fouls] (Julius Jackson: 2 personal fouls)   FT 1/1: GOOD Immanuel Young makes 1/1 from the line.
Score: 119-107

[00:28] Team_018 possession (Score: 119-107)
Julius Jackson drives to the basket... FOUL! Offensive foul on Julius Jackson! Lamelo Middleton drew the charge! [Team fouls: 6] (Julius Jackson: 3 personal fouls) TURNOVER! (dead ball)

[00:14] Team_008 possession (Score: 119-107)
Lamelo Middleton attempts a Layup. BLOCKED BY JULIUS JACKSON! Ball is loose! Rebound secured by Julius Jackson.

================================================================================
                              4TH QUARTER COMPLETE                              
================================================================================

4TH QUARTER SCORE: Team_008 28, Team_018 19

BOX SCORE:
================================================================================

Team_008
--------------------------------------------------------------------------------
Player                MIN  PTS  REB  AST  TO      FG   FG%      3P   3P%
--------------------------------------------------------------------------------
Magic Young            32    6    3    0   0   3/4    75.0     0/0   0.0
Immanuel Young         16    5    0    2   0   2/3    66.7     0/0   0.0
Blake Holiday          16    5    0    0   0   2/3    66.7     0/0   0.0
Tyrese Thompson        32    4    0    1   0   2/2   100.0     0/0   0.0
Victor Leonard         32    3    0    1   0   1/2    50.0     0/0   0.0
Khris Giddey           16    3    1    0   0   1/1   100.0     0/0   0.0
Lamelo Middleton       16    2    2    0   0   1/2    50.0     0/0   0.0
Khris Hyland           32    0    1    1   0   0/2     0.0     0/0   0.0
Chris Griffin          16    0    1    0   0   0/0     0.0     0/0   0.0

TEAM: FG: 12/19 (63.2%), 3PT: 3/5 (60.0%), REB: 8 (3 off, 5 def), AST: 5, TO: 3
TEAM FOULS: 4


Team_018
--------------------------------------------------------------------------------
Player                MIN  PTS  REB  AST  TO      FG   FG%      3P   3P%
--------------------------------------------------------------------------------
Bones Anunoby          32    6    2    0   0   3/3   100.0     0/0   0.0
Domantas Wall          32    5    2    0   0   2/2   100.0     0/0   0.0
Klay Stewart           32    2    0    0   0   1/1   100.0     0/0   0.0
Julius Jackson         16    2    2    0   0   1/1   100.0     0/0   0.0
Austin Antetokounmpo   15    2    0    1   0   1/1   100.0     0/0   0.0
Miles Herro            16    2    0    1   0   1/2    50.0     0/0   0.0
Allen Markkanen        34    0    0    2   0   0/3     0.0     0/0   0.0
Tracy Bryant           32    0    0    1   0   0/0     0.0     0/0   0.0
Michael Simons         16    0    0    0   0   0/1     0.0     0/0   0.0

TEAM: FG: 9/14 (64.3%), 3PT: 0/1 (0.0%), REB: 6 (1 off, 5 def), AST: 5, TO: 7
TEAM FOULS: 6 [Team_008 in BONUS]

================================================================================

================================================================================
                               FULL GAME COMPLETE                               
================================================================================

FINAL SCORE: Team_008 119, Team_018 107

SCORING BY QUARTER:
--------------------------------------------------------------------------------
Team                     Q1     Q2     Q3     Q4    FINAL
--------------------------------------------------------------------------------
Team_008                 24     25     42     28      119
Team_018                 28     22     38     19      107
--------------------------------------------------------------------------------

FULL GAME BOX SCORE:
================================================================================

Team_008
--------------------------------------------------------------------------------
Player                MIN  PTS  REB  AST  TO      FG   FG%      3P   3P%      FT STL BLK
--------------------------------------------------------------------------------
Victor Leonard         32   10    0    7   1   3/8    37.5   3/5    60.0   4/5     0   0
Jrue Harris            32   13    0    2   3   5/7    71.4   2/4    50.0   0/0     1   0
Khris Hyland           32   12    6    6   1   5/10   50.0   1/5    20.0   1/1     0   0
Tyrese Thompson        32   18    9    1   1   8/13   61.5   1/4    25.0   3/4     2   1
Magic Young            32   24   12    2   2  11/13   84.6   0/1     0.0   3/4     0   0
Blake Holiday          16    5    0    2   0   2/4    50.0   1/2    50.0   0/0     0   1
Chris Griffin          16   10    6    1   0   4/7    57.1   1/3    33.3   1/1     0   0
Immanuel Young         16    7    0    3   0   3/6    50.0   0/1     0.0   1/1     0   0
Khris Giddey           16    8    7    1   0   4/4   100.0   1/1   100.0   1/1     1   0
Lamelo Middleton       16   11    3    1   1   5/6    83.3   0/0     0.0   3/4     0   0

TEAM: FG: 51/79 (64.6%), 3PT: 10/26 (38.5%), REB: 43 (17 off, 26 def), AST: 26, TO: 9


Team_018
--------------------------------------------------------------------------------
Player                MIN  PTS  REB  AST  TO      FG   FG%      3P   3P%      FT STL BLK
--------------------------------------------------------------------------------
Allen Markkanen        34   16    5    4   0   8/15   53.3   2/3    66.7   5/5     0   0
Klay Stewart           32    7    0    6   0   3/4    75.0   0/1     0.0   1/1     0   1
Tracy Bryant           32    5    0    2   3   2/5    40.0   1/2    50.0   0/0     2   0
Bones Anunoby          32   27    9    2   4  12/16   75.0   1/4    25.0   4/4     0   0
Domantas Wall          32   22    9    2   0   7/9    77.8   0/0     0.0   2/2     1   2
Michael Simons         16    3    0    0   1   1/6    16.7   0/1     0.0   1/3     0   0
Miles Herro            16    7    0    3   0   3/5    60.0   1/3    33.3   0/0     0   0
Shai Wade              16    3    5    1   3   1/1   100.0   0/0     0.0   1/1     0   0
Julius Jackson         16    6    5    0   1   3/5    60.0   0/0     0.0   2/2     1   2
Austin Antetokounmpo   15    9    1    1   0   4/5    80.0   1/1   100.0   0/0     0   0

TEAM: FG: 46/73 (63.0%), 3PT: 6/15 (40.0%), REB: 34 (10 off, 24 def), AST: 21, TO: 12

================================================================================
