================================================================================
                        FULL GAME - Team_015 vs Team_053                        
================================================================================

================================================================================
                       1ST QUARTER - Team_015 vs Team_053                       
================================================================================

[12:00] Team_015 possession (Score: 0-0)
FOUL! Shooting foul on Kobe Ginobili. Manu Anthony to the line for 2 free throws. [Team fouls: 1] (Kobe Ginobili: 1 personal fouls)   FT 1/2: GOOD   FT 2/2: GOOD Manu Anthony makes 2/2 from the line.
Score: 2-0

[11:49] Team_053 possession (Score: 2-0)
Immanuel Curry attempts a Midrange. Contested by CJ Banchero (4.4 feet, ZONE). Immanuel Curry misses. Rebound secured by Trae Turner.

[11:33] Team_015 possession (Score: 2-0)
Michael Simmons attempts a 3Pt. Contested by Kobe Ginobili (4.1 feet, ZONE). Michael Simmons misses. Rebound secured by James Murray.

[11:21] Team_053 possession (Score: 2-0)
Immanuel Curry attempts a 3Pt. Contested by Manu Anthony (3.8 feet, ZONE). Immanuel Curry misses. Rebound secured by Michael Simmons.

[11:05] Team_015 possession (Score: 2-0)
Scottie Gasol attempts a 3Pt. Contested by Kobe Ginobili (4.1 feet, ZONE). Scottie Gasol misses. Rebound secured by Michael Gasol.

[10:51] Team_053 possession (Score: 2-0)
FOUL! Reach-in foul on Scottie Gasol during the drive. [Team fouls: 1] No free throws, side out. (Scottie Gasol: 1 personal fouls)

[10:40] Team_053 possession (Score: 2-0)
FOUL! Holding foul on Scottie Gasol. [Team fouls: 2] No free throws, side out. (Scottie Gasol: 2 personal fouls)

[10:23] Team_053 possession (Score: 2-0)
Draymond LaVine drives, Trae Turner stays with him. Draymond LaVine attempts a Dunk. Contested by Trae Turner (3.6 feet, MAN). Draymond LaVine misses. Offensive rebound by Draymond LaVine! Draymond LaVine kicks it out.

[10:08] Team_053 possession (Score: 2-0)
James Murray attempts a 3Pt. Contested by Michael Simmons (4.0 feet, MAN). James Murray misses. Rebound secured by Trae Turner.

[09:57] Team_015 possession (Score: 2-0)
FOUL! Shooting foul on Michael Gasol. Scottie Gasol to the line for 2 free throws. [Team fouls: 2] (Michael Gasol: 1 personal fouls)   FT 1/2: GOOD   FT 2/2: MISS Scottie Gasol makes 1/2 from the line. Offensive rebound by Trae Turner! Trae Turner's putback is no good.
Score: 3-0

[09:41] Team_053 possession (Score: 3-0)
Michael Gasol drives to the basket... Michael Gasol throws a bad pass out of bounds! TURNOVER! (dead ball)

[09:31] Team_015 possession (Score: 3-0)
Manu Anthony attempts a 3Pt. Contested by Kobe Ginobili (4.4 feet, MAN). Manu Anthony misses. Offensive rebound by Trae Turner! Trae Turner's putback is no good. Offensive rebound by Trae Turner! Trae Turner kicks it out.

[09:18] Team_015 possession (Score: 3-0)
FOUL! Reach-in foul on Draymond LaVine during the drive. [Team fouls: 3] No free throws, side out. (Draymond LaVine: 1 personal fouls)

[09:02] Team_015 possession (Score: 3-0)
Michael Simmons attempts a Midrange. Contested by James Murray (4.3 feet, MAN). Michael Simmons misses. Rebound secured by Michael Gasol.

[08:47] Team_053 possession (Score: 3-0)
Michael Gasol drives, picks up Scottie Gasol. Help arrives from Michael Simmons! Michael Gasol attempts a Layup. Contested by Michael Simmons (3.3 feet, MAN). MICHAEL GASOL MAKES IT! Assist: Immanuel Curry
Score: 3-2

[08:36] Team_015 possession (Score: 3-2)
Scottie Gasol attempts a 3Pt. Contested by Immanuel Curry (4.6 feet, ZONE). Scottie Gasol misses. Rebound secured by Draymond LaVine.

[08:23] Team_053 possession (Score: 3-2)
Kobe Ginobili attempts a 3Pt. Contested by Manu Anthony (3.6 feet, MAN). KOBE GINOBILI MAKES IT! Assist: James Murray
Score: 3-5

[08:09] Team_015 possession (Score: 3-5)
Scottie Gasol drives to the basket... Scottie Gasol loses the ball! Stripped by Michael Gasol! TURNOVER! (live ball)

[08:00] Team_053 possession (Score: 3-5)
James Murray attempts a Midrange. Contested by Michael Simmons (4.0 feet, MAN). JAMES MURRAY MAKES IT! Assist: Draymond LaVine
Score: 3-7

[07:43] Team_015 possession (Score: 3-7)
FOUL! Holding foul on Immanuel Curry. [Team fouls: 4] No free throws, side out. (Immanuel Curry: 1 personal fouls)

[07:24] Team_015 possession (Score: 3-7)
FOUL! Offensive foul on Manu Anthony! Kobe Ginobili drew the charge! [Team fouls: 3] (Manu Anthony: 1 personal fouls) TURNOVER! (dead ball)

[07:10] Team_053 possession (Score: 3-7)
FOUL! Shooting foul on Scottie Gasol. Michael Gasol to the line for 2 free throws. [Team fouls: 4] (Scottie Gasol: 3 personal fouls)   FT 1/2: GOOD   FT 2/2: GOOD Michael Gasol makes 2/2 from the line.
Score: 3-9

[06:56] Team_015 possession (Score: 3-9)
Michael Simmons drives, James Murray stays with him. Michael Simmons attempts a Dunk. Contested by James Murray (4.3 feet, MAN). Michael Simmons misses. Rebound secured by James Murray.

[06:37] Team_053 possession (Score: 3-9)
Kobe Ginobili drives, Scottie Gasol stays with him. Kobe Ginobili attempts a Layup. Contested by Scottie Gasol (3.4 feet, ZONE). Kobe Ginobili misses. Rebound secured by Michael Simmons.

[06:20] Team_015 possession (Score: 3-9)
Michael Simmons attempts a 3Pt. Contested by Kobe Ginobili (4.1 feet, ZONE). MICHAEL SIMMONS MAKES IT! Assist: CJ Banchero
Score: 6-9

[06:02] Team_053 possession (Score: 6-9)
James Murray attempts a 3Pt. Contested by Michael Simmons (4.0 feet, MAN). James Murray misses. Rebound secured by CJ Banchero.

[05:43] Team_015 possession (Score: 6-9)
Scottie Gasol attempts a 3Pt. Contested by Michael Gasol (4.0 feet, MAN). Scottie Gasol misses. Offensive rebound by Trae Turner! Trae Turner puts it back in!
Score: 8-9

[05:26] Team_053 possession (Score: 8-9)
Michael Gasol drives, Scottie Gasol stays with him. Michael Gasol attempts a Dunk. Contested by Scottie Gasol (3.4 feet, ZONE). MICHAEL GASOL MAKES IT!
Score: 8-11

[05:11] Team_015 possession (Score: 8-11)
Trae Turner attempts a Layup. Contested by Draymond LaVine (4.3 feet, ZONE). Trae Turner misses. Rebound secured by Draymond LaVine.

[04:54] Team_053 possession (Score: 8-11)
Michael Gasol attempts a Layup. Contested by Scottie Gasol (3.4 feet, ZONE). Michael Gasol misses. Rebound secured by CJ Banchero.

[04:37] Team_015 possession (Score: 8-11)
CJ Banchero attempts a 3Pt. Contested by Kobe Ginobili (3.9 feet, ZONE). CJ BANCHERO MAKES IT! Assist: Trae Turner
Score: 11-11

[04:23] Team_053 possession (Score: 11-11)
Immanuel Curry attempts a Midrange. Contested by CJ Banchero (4.5 feet, MAN). IMMANUEL CURRY MAKES IT! Assist: Draymond LaVine
Score: 11-13

[04:06] Team_015 possession (Score: 11-13)
CJ Banchero attempts a 3Pt. Contested by Kobe Ginobili (4.0 feet, ZONE). CJ BANCHERO MAKES IT! Assist: Scottie Gasol
Score: 14-13

[03:51] Team_053 possession (Score: 14-13)
Kobe Ginobili makes the Layup and draws the foul on Manu Anthony! And-1! Kobe Ginobili to the line for 1. [BONUS: 5 team fouls] (Manu Anthony: 2 personal fouls)   FT 1/1: GOOD Kobe Ginobili makes 1/1 from the line.
Score: 14-16

[03:41] Team_015 possession (Score: 14-16)
Trae Turner attempts a Layup. Contested by Draymond LaVine (4.4 feet, MAN). TRAE TURNER MAKES IT! Assist: Manu Anthony
Score: 16-16

[03:26] Team_053 possession (Score: 16-16)
Kobe Ginobili drives and kicks out. Kobe Ginobili makes the Midrange and draws the foul on Manu Anthony! And-1! Kobe Ginobili to the line for 1. [BONUS: 6 team fouls] (Manu Anthony: 3 personal fouls)   FT 1/1: GOOD Kobe Ginobili makes 1/1 from the line.
Score: 16-19

[03:10] Team_015 possession (Score: 16-19)
Michael Simmons attempts a Midrange. Contested by James Murray (4.4 feet, MAN). Michael Simmons misses. Rebound secured by James Murray.

[02:54] Team_053 possession (Score: 16-19)
Draymond LaVine drives, Trae Turner stays with him. Draymond LaVine attempts a Layup. Contested by Trae Turner (3.9 feet, MAN). Draymond LaVine misses. Rebound secured by CJ Banchero.

[02:44] Team_015 possession (Score: 16-19)
FOUL! Shooting foul on Kobe Ginobili. Manu Anthony to the line for 3 free throws. [BONUS: 5 team fouls] (Kobe Ginobili: 2 personal fouls)   FT 1/3: GOOD   FT 2/3: GOOD   FT 3/3: MISS Manu Anthony makes 2/3 from the line. Rebound secured by Draymond LaVine.
Score: 18-19

[02:27] Team_053 possession (Score: 18-19)
Kobe Ginobili drives and kicks out. Kobe Ginobili attempts a Midrange. Contested by Manu Anthony (3.9 feet, MAN). Kobe Ginobili misses. Rebound secured by CJ Banchero.

[02:09] Team_015 possession (Score: 18-19)
Michael Simmons attempts a 3Pt. Contested by Kobe Ginobili (4.4 feet, ZONE). Michael Simmons misses. Rebound secured by Michael Gasol.

[01:53] Team_053 possession (Score: 18-19)
Draymond LaVine throws a bad pass out of bounds! TURNOVER! (dead ball)

[01:53] Substitution (Team_015): Manu Anthony OUT → Dwyane Sabonis IN (stamina_rule2)

[01:53] Substitution (Team_015): Michael Simmons OUT → Paolo Jokic IN (stamina_rule2)

[01:53] Substitution (Team_015): CJ Banchero OUT → Magic Wagner IN (stamina_rule2)

[01:53] Substitution (Team_015): Scottie Gasol OUT → Rudy Paul IN (stamina_rule2)

[01:53] Substitution (Team_015): Trae Turner OUT → Allen Curry IN (stamina_rule2)

[01:53] Substitution (Team_053): Kobe Ginobili OUT → Michael DeRozan IN (stamina_rule2)

[01:53] Substitution (Team_053): James Murray OUT → Tyrese Mitchell IN (stamina_rule2)

[01:53] Substitution (Team_053): Immanuel Curry OUT → Brandon Bryant IN (stamina_rule2)

[01:53] Substitution (Team_053): Michael Gasol OUT → Klay Anunoby IN (stamina_rule2)

[01:53] Substitution (Team_053): Draymond LaVine OUT → Devin Green IN (stamina_rule2)

[01:37] Team_015 possession (Score: 18-19)
Rudy Paul drives, picks up Klay Anunoby. Help arrives from Tyrese Mitchell! Rudy Paul attempts a Layup. Contested by Tyrese Mitchell (4.1 feet, MAN). RUDY PAUL MAKES IT!
Score: 20-19

[01:26] Team_053 possession (Score: 20-19)
Tyrese Mitchell attempts a 3Pt. Contested by Rudy Paul (3.1 feet, ZONE). Tyrese Mitchell misses. Rebound secured by Rudy Paul.

[01:14] Team_015 possession (Score: 20-19)
Magic Wagner drives, Devin Green stays with him. Magic Wagner attempts a Layup. Contested by Devin Green (4.9 feet, ZONE). Magic Wagner misses. Offensive rebound by Allen Curry! Allen Curry's putback is no good. Rebound secured by Devin Green.

[01:02] Team_053 possession (Score: 20-19)
Devin Green makes the Layup and draws the foul on Rudy Paul! And-1! Devin Green to the line for 1. [BONUS: 7 team fouls] (Rudy Paul: 1 personal fouls)   FT 1/1: GOOD Devin Green makes 1/1 from the line.
Score: 20-22

[00:45] Team_015 possession (Score: 20-22)
Dwyane Sabonis attempts a 3Pt. Contested by Tyrese Mitchell (5.2 feet, ZONE). DWYANE SABONIS MAKES IT! Assist: Allen Curry
Score: 23-22

[00:28] Team_053 possession (Score: 23-22)
Devin Green attempts a 3Pt. Contested by Rudy Paul (3.6 feet, MAN). DEVIN GREEN MAKES IT! Assist: Michael DeRozan
Score: 23-25

[00:12] Team_015 possession (Score: 23-25)
Dwyane Sabonis attempts a 3Pt. Contested by Brandon Bryant (3.6 feet, ZONE). Dwyane Sabonis misses. Rebound secured by Devin Green.

[00:01] Team_053 possession (Score: 23-25)
Michael DeRozan attempts a 3Pt. Contested by Dwyane Sabonis (4.5 feet, MAN). MICHAEL DEROZAN MAKES IT! Assist: Klay Anunoby
Score: 23-28

================================================================================
                              1ST QUARTER COMPLETE                              
================================================================================

1ST QUARTER SCORE: Team_015 23, Team_053 28

BOX SCORE:
================================================================================

Team_015
--------------------------------------------------------------------------------
Player                MIN  PTS  REB  AST  TO      FG   FG%      3P   3P%
--------------------------------------------------------------------------------
CJ Banchero            10    6    4    1   0   2/2   100.0     0/0   0.0
Trae Turner            10    4    5    1   0   2/3    66.7     0/0   0.0
Michael Simmons        10    3    2    0   0   1/6    16.7     0/0   0.0
Dwyane Sabonis          2    3    0    0   0   1/2    50.0     0/0   0.0
Manu Anthony           10    2    0    1   0   1/2    50.0     0/0   0.0
Rudy Paul               2    2    1    0   0   1/1   100.0     0/0   0.0
Scottie Gasol          10    0    0    1   0   0/3     0.0     0/0   0.0
Magic Wagner            2    0    0    0   0   0/1     0.0     0/0   0.0
Allen Curry             2    0    0    1   0   0/0     0.0     0/0   0.0

TEAM: FG: 8/20 (40.0%), 3PT: 5/11 (45.5%), REB: 12 (3 off, 9 def), AST: 5, TO: 2
TEAM FOULS: 7 [Team_053 in BONUS]


Team_053
--------------------------------------------------------------------------------
Player                MIN  PTS  REB  AST  TO      FG   FG%      3P   3P%
--------------------------------------------------------------------------------
Kobe Ginobili          10    9    0    0   0   3/5    60.0     0/0   0.0
Michael Gasol          10    6    3    0   0   3/4    75.0     0/0   0.0
Devin Green             2    6    2    0   0   2/2   100.0     0/0   0.0
Michael DeRozan         2    3    0    1   0   1/1   100.0     0/0   0.0
Immanuel Curry         10    2    0    1   0   1/3    33.3     0/0   0.0
James Murray           10    2    3    1   0   1/3    33.3     0/0   0.0
Draymond LaVine        10    0    4    2   0   0/1     0.0     0/0   0.0
Tyrese Mitchell         2    0    0    0   0   0/1     0.0     0/0   0.0
Klay Anunoby            2    0    0    1   0   0/0     0.0     0/0   0.0

TEAM: FG: 11/20 (55.0%), 3PT: 3/7 (42.9%), REB: 12 (1 off, 11 def), AST: 6, TO: 2
TEAM FOULS: 5 [Team_015 in BONUS]

================================================================================

================================================================================
                       2ND QUARTER - Team_015 vs Team_053                       
================================================================================

[12:00] Team_015 possession (Score: 23-28)
FOUL! Shooting foul on Kobe Ginobili. Manu Anthony to the line for 3 free throws. [Team fouls: 1] (Kobe Ginobili: 1 personal fouls)   FT 1/3: GOOD   FT 2/3: GOOD   FT 3/3: GOOD Manu Anthony makes 3/3 from the line.
Score: 26-28

[11:45] Team_053 possession (Score: 26-28)
Immanuel Curry attempts a 3Pt. Contested by Manu Anthony (3.9 feet, ZONE). Immanuel Curry misses. Rebound secured by Michael Simmons.

[11:28] Team_015 possession (Score: 26-28)
CJ Banchero makes the Layup and draws the foul on Immanuel Curry! And-1! CJ Banchero to the line for 1. [Team fouls: 2] (Immanuel Curry: 1 personal fouls)   FT 1/1: GOOD CJ Banchero makes 1/1 from the line.
Score: 29-28

[11:12] Team_053 possession (Score: 29-28)
Michael Gasol attempts a 3Pt. Contested by Manu Anthony (3.6 feet, ZONE). MICHAEL GASOL MAKES IT! Assist: Immanuel Curry
Score: 29-31

[10:56] Team_015 possession (Score: 29-31)
Trae Turner attempts a Layup. BLOCKED BY MICHAEL GASOL! Ball is loose! Rebound secured by Michael Gasol.

[10:42] Team_053 possession (Score: 29-31)
Kobe Ginobili drives, Manu Anthony stays with him. Kobe Ginobili attempts a Layup. Contested by Manu Anthony (3.7 feet, MAN). Kobe Ginobili misses. FOUL! Loose ball foul on Michael Simmons during the rebound battle. [Team fouls: 1] No free throws, side out. (Michael Simmons: 1 personal fouls)

[10:24] Team_053 possession (Score: 29-31)
Michael Gasol attempts a Midrange. Contested by Scottie Gasol (3.5 feet, MAN). Michael Gasol misses. Rebound secured by Trae Turner.

[10:07] Team_015 possession (Score: 29-31)
Manu Anthony attempts a Layup. Contested by Kobe Ginobili (4.5 feet, MAN). MANU ANTHONY MAKES IT! Assist: Scottie Gasol
Score: 31-31

[09:57] Team_053 possession (Score: 31-31)
Draymond LaVine attempts a Midrange. Contested by Scottie Gasol (3.7 feet, ZONE). Draymond LaVine misses. Rebound secured by Michael Simmons.

[09:42] Team_015 possession (Score: 31-31)
Scottie Gasol drives to the basket... Scottie Gasol throws a bad pass out of bounds! TURNOVER! (dead ball)

[09:42] Substitution (Team_015): Scottie Gasol OUT → Rudy Paul IN (stamina_rule2)

[09:42] Substitution (Team_015): Trae Turner OUT → Allen Curry IN (stamina_rule2)

[09:42] Substitution (Team_053): Immanuel Curry OUT → Brandon Bryant IN (stamina_rule2)

[09:31] Team_053 possession (Score: 31-31)
Kobe Ginobili attempts a Midrange. Contested by CJ Banchero (4.4 feet, ZONE). Kobe Ginobili misses. FOUL! Loose ball foul on Allen Curry during the rebound battle. [Team fouls: 2] No free throws, side out. (Allen Curry: 1 personal fouls)

[09:16] Team_053 possession (Score: 31-31)
Brandon Bryant commits a violation (traveling/carry)! TURNOVER! (dead ball)

[09:16] Substitution (Team_015): Manu Anthony OUT → Dwyane Sabonis IN (stamina_rule2)

[09:16] Substitution (Team_015): Michael Simmons OUT → Paolo Jokic IN (stamina_rule2)

[09:16] Substitution (Team_015): CJ Banchero OUT → Magic Wagner IN (stamina_rule2)

[09:16] Substitution (Team_053): Kobe Ginobili OUT → Michael DeRozan IN (stamina_rule2)

[09:16] Substitution (Team_053): James Murray OUT → Tyrese Mitchell IN (stamina_rule2)

[09:16] Substitution (Team_053): Michael Gasol OUT → Klay Anunoby IN (stamina_rule2)

[09:16] Substitution (Team_053): Draymond LaVine OUT → Devin Green IN (stamina_rule2)

[09:02] Team_015 possession (Score: 31-31)
Rudy Paul attempts a Midrange. Contested by Devin Green (5.4 feet, ZONE). Rudy Paul misses. Offensive rebound by Rudy Paul! Rudy Paul puts it back in!
Score: 33-31

[08:49] Team_053 possession (Score: 33-31)
FOUL! Reach-in foul on Dwyane Sabonis during the drive. [Team fouls: 3] No free throws, side out. (Dwyane Sabonis: 1 personal fouls)

[08:36] Team_053 possession (Score: 33-31)
Michael DeRozan attempts a Midrange. Contested by Dwyane Sabonis (4.5 feet, MAN). Michael DeRozan misses. Offensive rebound by Devin Green! Devin Green puts it back in!
Score: 33-33

[08:18] Team_015 possession (Score: 33-33)
Rudy Paul attempts a Midrange. Contested by Klay Anunoby (4.1 feet, MAN). RUDY PAUL MAKES IT! Assist: Allen Curry
Score: 35-33

[08:03] Team_053 possession (Score: 35-33)
Brandon Bryant attempts a 3Pt. Contested by Magic Wagner (5.3 feet, MAN). BRANDON BRYANT MAKES IT! Assist: Devin Green
Score: 35-36

[07:51] Team_015 possession (Score: 35-36)
Paolo Jokic drives and kicks out. Magic Wagner attempts a 3Pt. Contested by Brandon Bryant (3.4 feet, MAN). Magic Wagner misses. Rebound secured by Klay Anunoby.

[07:37] Team_053 possession (Score: 35-36)
Michael DeRozan attempts a 3Pt. Contested by Rudy Paul (2.9 feet, ZONE). Michael DeRozan misses. Rebound secured by Allen Curry.

[07:27] Team_015 possession (Score: 35-36)
Rudy Paul attempts a Layup. Contested by Devin Green (5.4 feet, ZONE). RUDY PAUL MAKES IT!
Score: 37-36

[07:12] Team_053 possession (Score: 37-36)
Devin Green attempts a Midrange. Contested by Rudy Paul (3.6 feet, MAN). Devin Green misses. Rebound secured by Magic Wagner.

[07:01] Team_015 possession (Score: 37-36)
FOUL! Offensive foul on Allen Curry! Devin Green drew the charge! [Team fouls: 4] (Allen Curry: 2 personal fouls) TURNOVER! (dead ball)

[06:46] Team_053 possession (Score: 37-36)
Klay Anunoby attempts a Midrange. Contested by Rudy Paul (3.2 feet, MAN). Klay Anunoby misses. Rebound secured by Magic Wagner.

[06:33] Team_015 possession (Score: 37-36)
Rudy Paul drives and kicks out. Dwyane Sabonis attempts a 3Pt. Wide open! Michael DeRozan is 6.4 feet away. [MAN] Dwyane Sabonis misses. Offensive rebound by Rudy Paul! Rudy Paul's putback is no good. Rebound secured by Devin Green.

[06:21] Team_053 possession (Score: 37-36)
Devin Green drives and kicks out. Brandon Bryant attempts a 3Pt. Contested by Magic Wagner (5.3 feet, MAN). BRANDON BRYANT MAKES IT! Assist: Devin Green
Score: 37-39

[06:10] Team_015 possession (Score: 37-39)
Magic Wagner attempts a 3Pt. Contested by Tyrese Mitchell (5.0 feet, ZONE). Magic Wagner misses. Offensive rebound by Allen Curry! Allen Curry's putback is no good. Rebound secured by Brandon Bryant.

[05:57] Team_053 possession (Score: 37-39)
FOUL! Shooting foul on Rudy Paul. Klay Anunoby to the line for 2 free throws. [BONUS: 5 team fouls] (Rudy Paul: 1 personal fouls)   FT 1/2: GOOD   FT 2/2: MISS Klay Anunoby makes 1/2 from the line. Rebound secured by Rudy Paul.
Score: 37-40

[05:40] Team_015 possession (Score: 37-40)
Paolo Jokic attempts a 3Pt. Contested by Tyrese Mitchell (5.6 feet, MAN). Paolo Jokic misses. Offensive rebound by Allen Curry! Allen Curry puts it back in!
Score: 39-40

[05:28] Team_053 possession (Score: 39-40)
FOUL! Holding foul on Rudy Paul. [IN THE BONUS! 6 team fouls] Devin Green to the line for 2 free throws. (Rudy Paul: 2 personal fouls)   FT 1/2: GOOD   FT 2/2: GOOD Devin Green makes 2/2 from the line.
Score: 39-42

[05:15] Team_015 possession (Score: 39-42)
Allen Curry drives to the basket... Allen Curry throws a bad pass out of bounds! TURNOVER! (dead ball)

[05:00] Team_053 possession (Score: 39-42)
Michael DeRozan attempts a 3Pt. Contested by Rudy Paul (2.9 feet, ZONE). Michael DeRozan misses. Rebound secured by Allen Curry.

[04:42] Team_015 possession (Score: 39-42)
FOUL! Offensive foul on Paolo Jokic! Tyrese Mitchell drew the charge! [Team fouls: 7] (Paolo Jokic: 1 personal fouls) TURNOVER! (dead ball)

[04:26] Team_053 possession (Score: 39-42)
Brandon Bryant attempts a Layup. BLOCKED BY RUDY PAUL! Ball is loose! Rebound secured by Rudy Paul.

[04:14] Team_015 possession (Score: 39-42)
Allen Curry drives, picks up Devin Green. Help arrives from Tyrese Mitchell! Allen Curry attempts a Dunk. Contested by Tyrese Mitchell (5.3 feet, ZONE). Allen Curry misses. Offensive rebound by Allen Curry! Allen Curry puts it back in!
Score: 41-42

[04:01] Team_053 possession (Score: 41-42)
Klay Anunoby attempts a 3Pt. Contested by Rudy Paul (3.3 feet, ZONE). Klay Anunoby misses. Rebound secured by Rudy Paul.

[03:47] Team_015 possession (Score: 41-42)
FOUL! Shooting foul on Devin Green. Allen Curry to the line for 2 free throws. [Team fouls: 3] (Devin Green: 1 personal fouls)   FT 1/2: MISS   FT 2/2: GOOD Allen Curry makes 1/2 from the line.
Score: 42-42

[03:32] Team_053 possession (Score: 42-42)
Michael DeRozan attempts a 3Pt. Contested by Dwyane Sabonis (4.5 feet, MAN). MICHAEL DEROZAN MAKES IT! Assist: Brandon Bryant
Score: 42-45

[03:16] Team_015 possession (Score: 42-45)
Allen Curry drives, Devin Green stays with him. Allen Curry attempts a Layup. Contested by Devin Green (5.4 feet, ZONE). ALLEN CURRY MAKES IT!
Score: 44-45

[03:02] Team_053 possession (Score: 44-45)
Michael DeRozan attempts a 3Pt. Contested by Dwyane Sabonis (4.6 feet, MAN). Michael DeRozan misses. Rebound secured by Allen Curry.

[02:44] Team_015 possession (Score: 44-45)
Magic Wagner drives, picks up Brandon Bryant. Help arrives from Tyrese Mitchell! Magic Wagner attempts a Dunk. Contested by Tyrese Mitchell (3.5 feet, MAN). Magic Wagner misses. Rebound secured by Klay Anunoby.

[02:29] Team_053 possession (Score: 44-45)
Michael DeRozan attempts a 3Pt. Contested by Rudy Paul (3.1 feet, ZONE). Michael DeRozan misses. Rebound secured by Rudy Paul.

[02:14] Team_015 possession (Score: 44-45)
Allen Curry drives to the basket... Allen Curry loses the ball! Stripped by Devin Green! TURNOVER! (live ball)

[02:00] Team_053 possession (Score: 44-45)
Michael DeRozan attempts a 3Pt. Contested by Rudy Paul (3.2 feet, ZONE). Michael DeRozan misses. Rebound secured by Rudy Paul.

[01:47] Team_015 possession (Score: 44-45)
Dwyane Sabonis attempts a Midrange. Contested by Tyrese Mitchell (5.3 feet, ZONE). Dwyane Sabonis misses. Rebound secured by Brandon Bryant.

[01:36] Team_053 possession (Score: 44-45)
Michael DeRozan drives, Dwyane Sabonis stays with him. Michael DeRozan attempts a Dunk. Contested by Dwyane Sabonis (4.7 feet, MAN). MICHAEL DEROZAN MAKES IT! Assist: Klay Anunoby
Score: 44-47

[01:21] Team_015 possession (Score: 44-47)
Magic Wagner attempts a 3Pt. Contested by Brandon Bryant (3.7 feet, MAN). Magic Wagner misses. Offensive rebound by Rudy Paul! Rudy Paul puts it back in!
Score: 46-47

[01:04] Team_053 possession (Score: 46-47)
Brandon Bryant attempts a 3Pt. Contested by Rudy Paul (3.6 feet, ZONE). Brandon Bryant misses. Offensive rebound by Devin Green! Devin Green puts it back in!
Score: 46-49

[00:52] Team_015 possession (Score: 46-49)
Rudy Paul attempts a Midrange. Contested by Klay Anunoby (4.4 feet, MAN). Rudy Paul misses. Rebound secured by Devin Green.

[00:40] Team_053 possession (Score: 46-49)
Tyrese Mitchell attempts a 3Pt. Contested by Rudy Paul (3.6 feet, ZONE). Tyrese Mitchell misses. Offensive rebound by Klay Anunoby! Klay Anunoby kicks it out.

[00:25] Team_053 possession (Score: 46-49)
Tyrese Mitchell makes the Layup and draws the foul on Rudy Paul! And-1! Tyrese Mitchell to the line for 1. [BONUS: 8 team fouls] (Rudy Paul: 3 personal fouls)   FT 1/1: GOOD Tyrese Mitchell makes 1/1 from the line.
Score: 46-52

[00:13] Team_015 possession (Score: 46-52)
Dwyane Sabonis attempts a 3Pt. Contested by Brandon Bryant (4.1 feet, ZONE). Dwyane Sabonis misses. Rebound secured by Devin Green.

================================================================================
                              2ND QUARTER COMPLETE                              
================================================================================

2ND QUARTER SCORE: Team_015 23, Team_053 24

BOX SCORE:
================================================================================

Team_015
--------------------------------------------------------------------------------
Player                MIN  PTS  REB  AST  TO      FG   FG%      3P   3P%
--------------------------------------------------------------------------------
Rudy Paul              11    8    7    0   0   4/6    66.7     0/0   0.0
Allen Curry            11    7    5    1   0   4/4   100.0     0/0   0.0
Manu Anthony           13    5    0    0   0   2/2   100.0     0/0   0.0
CJ Banchero            13    3    0    0   0   1/1   100.0     0/0   0.0
Michael Simmons        13    0    2    0   0   0/0     0.0     0/0   0.0
Trae Turner            13    0    1    0   0   0/1     0.0     0/0   0.0
Scottie Gasol          13    0    0    1   0   0/0     0.0     0/0   0.0
Paolo Jokic            11    0    0    0   0   0/1     0.0     0/0   0.0
Magic Wagner           11    0    2    0   0   0/2     0.0     0/0   0.0
Dwyane Sabonis         11    0    0    0   0   0/2     0.0     0/0   0.0

TEAM: FG: 11/19 (57.9%), 3PT: 3/5 (60.0%), REB: 19 (6 off, 13 def), AST: 2, TO: 5
TEAM FOULS: 8 [Team_053 in BONUS]


Team_053
--------------------------------------------------------------------------------
Player                MIN  PTS  REB  AST  TO      FG   FG%      3P   3P%
--------------------------------------------------------------------------------
Devin Green            11    6    5    2   0   3/4    75.0     0/0   0.0
Brandon Bryant         11    6    2    1   0   2/3    66.7     0/0   0.0
Michael DeRozan        11    5    0    0   0   2/7    28.6     0/0   0.0
Michael Gasol          13    3    2    0   0   1/2    50.0     0/0   0.0
Tyrese Mitchell        11    3    0    0   0   1/1   100.0     0/0   0.0
Immanuel Curry         13    0    0    1   0   0/1     0.0     0/0   0.0
Draymond LaVine        13    0    1    0   0   0/1     0.0     0/0   0.0
Klay Anunoby           11    0    3    1   0   0/3     0.0     0/0   0.0

TEAM: FG: 9/22 (40.9%), 3PT: 4/11 (36.4%), REB: 11 (5 off, 6 def), AST: 5, TO: 1
TEAM FOULS: 3

================================================================================

================================================================================
                       3RD QUARTER - Team_015 vs Team_053                       
================================================================================

[12:00] Team_015 possession (Score: 46-52)
Scottie Gasol attempts a 3Pt. Contested by Michael Gasol (4.0 feet, MAN). Scottie Gasol misses. Rebound secured by Draymond LaVine.

[11:47] Team_053 possession (Score: 46-52)
Draymond LaVine attempts a Layup. BLOCKED BY TRAE TURNER! Ball deflects out of bounds off Draymond LaVine.

[11:33] Team_015 possession (Score: 46-52)
Michael Simmons drives, James Murray stays with him. Michael Simmons attempts a Dunk. Contested by James Murray (4.3 feet, MAN). Michael Simmons misses. Rebound secured by Michael Gasol.

[11:19] Team_053 possession (Score: 46-52)
Kobe Ginobili attempts a Midrange. Contested by Manu Anthony (3.6 feet, MAN). Kobe Ginobili misses. Rebound secured by Michael Simmons.

[11:05] Team_015 possession (Score: 46-52)
Michael Simmons makes the Layup and draws the foul on James Murray! And-1! Michael Simmons to the line for 1. [Team fouls: 1] (James Murray: 1 personal fouls)   FT 1/1: GOOD Michael Simmons makes 1/1 from the line.
Score: 49-52

[10:50] Team_053 possession (Score: 49-52)
Michael Gasol attempts a Midrange. Contested by Scottie Gasol (3.3 feet, MAN). MICHAEL GASOL MAKES IT!
Score: 49-54

[10:36] Team_015 possession (Score: 49-54)
Manu Anthony attempts a Midrange. Contested by James Murray (4.6 feet, ZONE). MANU ANTHONY MAKES IT!
Score: 51-54

[10:22] Team_053 possession (Score: 51-54)
James Murray attempts a Layup. Contested by Scottie Gasol (4.1 feet, ZONE). James Murray misses. Offensive rebound by Draymond LaVine! Draymond LaVine kicks it out.

[10:10] Team_053 possession (Score: 51-54)
FOUL! Shooting foul on Scottie Gasol. Michael Gasol to the line for 2 free throws. [Team fouls: 1] (Scottie Gasol: 1 personal fouls)   FT 1/2: GOOD   FT 2/2: GOOD Michael Gasol makes 2/2 from the line.
Score: 51-56

[09:57] Team_015 possession (Score: 51-56)
CJ Banchero makes the Layup and draws the foul on Draymond LaVine! And-1! CJ Banchero to the line for 1. [Team fouls: 2] (Draymond LaVine: 1 personal fouls)   FT 1/1: GOOD CJ Banchero makes 1/1 from the line.
Score: 54-56

[09:41] Team_053 possession (Score: 54-56)
Immanuel Curry attempts a Midrange. Contested by CJ Banchero (4.4 feet, ZONE). Immanuel Curry misses. Offensive rebound by Michael Gasol! Michael Gasol puts it back in!
Score: 54-58

[09:26] Team_015 possession (Score: 54-58)
Manu Anthony attempts a Midrange. Contested by Michael Gasol (4.3 feet, ZONE). MANU ANTHONY MAKES IT!
Score: 56-58

[09:12] Team_053 possession (Score: 56-58)
FOUL! Shooting foul on CJ Banchero. Immanuel Curry to the line for 2 free throws. [Team fouls: 2] (CJ Banchero: 1 personal fouls)   FT 1/2: MISS   FT 2/2: GOOD Immanuel Curry makes 1/2 from the line.
Score: 56-59

[09:00] Team_015 possession (Score: 56-59)
Michael Simmons attempts a 3Pt. Contested by Kobe Ginobili (4.1 feet, ZONE). Michael Simmons misses. Rebound secured by James Murray.

[08:44] Team_053 possession (Score: 56-59)
Draymond LaVine drives, Trae Turner stays with him. Draymond LaVine attempts a Layup. Contested by Trae Turner (3.6 feet, MAN). DRAYMOND LAVINE MAKES IT! Assist: Kobe Ginobili
Score: 56-61

[08:31] Team_015 possession (Score: 56-61)
Trae Turner attempts a Layup. Contested by Draymond LaVine (4.3 feet, MAN). TRAE TURNER MAKES IT! Assist: Scottie Gasol
Score: 58-61

[08:19] Team_053 possession (Score: 58-61)
James Murray attempts a 3Pt. Contested by Michael Simmons (4.0 feet, MAN). James Murray misses. Offensive rebound by Draymond LaVine! Draymond LaVine kicks it out.

[08:05] Team_053 possession (Score: 58-61)
Immanuel Curry attempts a Midrange. Contested by CJ Banchero (4.4 feet, MAN). Immanuel Curry misses. Rebound secured by Trae Turner.

[07:50] Team_015 possession (Score: 58-61)
Manu Anthony drives to the basket... FOUL! Offensive foul on Manu Anthony! Michael Gasol drew the charge! [Team fouls: 3] (Manu Anthony: 1 personal fouls) TURNOVER! (dead ball)

[07:35] Team_053 possession (Score: 58-61)
Michael Gasol attempts a Midrange. Contested by CJ Banchero (4.1 feet, ZONE). Michael Gasol misses. Rebound secured by Michael Simmons.

[07:19] Team_015 possession (Score: 58-61)
Manu Anthony attempts a 3Pt. Contested by Kobe Ginobili (4.4 feet, MAN). MANU ANTHONY MAKES IT! Assist: CJ Banchero
Score: 61-61

[07:04] Team_053 possession (Score: 61-61)
Immanuel Curry attempts a 3Pt. Contested by Manu Anthony (3.8 feet, ZONE). Immanuel Curry misses. Rebound secured by Trae Turner.

[06:50] Team_015 possession (Score: 61-61)
FOUL! Shooting foul on Kobe Ginobili. Manu Anthony to the line for 3 free throws. [Team fouls: 3] (Kobe Ginobili: 1 personal fouls)   FT 1/3: GOOD   FT 2/3: GOOD   FT 3/3: GOOD Manu Anthony makes 3/3 from the line.
Score: 64-61

[06:37] Team_053 possession (Score: 64-61)
FOUL! Holding foul on Manu Anthony. [Team fouls: 4] No free throws, side out. (Manu Anthony: 2 personal fouls)

[06:23] Team_053 possession (Score: 64-61)
James Murray attempts a Layup. Contested by Scottie Gasol (4.1 feet, ZONE). James Murray misses. Rebound secured by CJ Banchero.

[06:11] Team_015 possession (Score: 64-61)
Trae Turner attempts a Layup. Contested by Draymond LaVine (4.3 feet, MAN). TRAE TURNER MAKES IT!
Score: 66-61

[05:56] Team_053 possession (Score: 66-61)
Draymond LaVine attempts a Midrange. Contested by Trae Turner (3.7 feet, ZONE). DRAYMOND LAVINE MAKES IT!
Score: 66-63

[05:40] Team_015 possession (Score: 66-63)
Scottie Gasol attempts a 3Pt. Contested by Michael Gasol (4.0 feet, MAN). Scottie Gasol misses. Offensive rebound by Trae Turner! Trae Turner puts it back in!
Score: 68-63

[05:25] Team_053 possession (Score: 68-63)
James Murray attempts a 3Pt. Contested by Manu Anthony (4.3 feet, ZONE). JAMES MURRAY MAKES IT! Assist: Kobe Ginobili
Score: 68-66

[05:11] Team_015 possession (Score: 68-66)
Michael Simmons attempts a 3Pt. Contested by Kobe Ginobili (4.1 feet, ZONE). Michael Simmons misses. Rebound secured by James Murray.

[04:56] Team_053 possession (Score: 68-66)
James Murray attempts a 3Pt. Contested by Manu Anthony (4.3 feet, ZONE). JAMES MURRAY MAKES IT! Assist: Immanuel Curry
Score: 68-69

[04:41] Team_015 possession (Score: 68-69)
Scottie Gasol drives, Michael Gasol stays with him. Scottie Gasol attempts a Dunk. Contested by Michael Gasol (4.1 feet, ZONE). SCOTTIE GASOL MAKES IT! Assist: Michael Simmons
Score: 70-69

[04:23] Team_053 possession (Score: 70-69)
FOUL! Shooting foul on Scottie Gasol. Immanuel Curry to the line for 2 free throws. [BONUS: 5 team fouls] (Scottie Gasol: 2 personal fouls)   FT 1/2: GOOD   FT 2/2: MISS Immanuel Curry makes 1/2 from the line. Rebound secured by CJ Banchero.
Score: 70-70

[04:07] Team_015 possession (Score: 70-70)
Scottie Gasol attempts a 3Pt. Contested by Michael Gasol (4.1 feet, MAN). SCOTTIE GASOL MAKES IT! Assist: Manu Anthony
Score: 73-70

[03:51] Team_053 possession (Score: 73-70)
James Murray attempts a Layup. Contested by Michael Simmons (4.1 feet, MAN). James Murray misses. Rebound secured by Trae Turner.

[03:38] Team_015 possession (Score: 73-70)
Trae Turner drives to the basket... Trae Turner throws a bad pass out of bounds! TURNOVER! (dead ball)

[03:23] Team_053 possession (Score: 73-70)
Draymond LaVine drives to the basket... Draymond LaVine commits a violation (traveling/carry)! TURNOVER! (dead ball)

[03:10] Team_015 possession (Score: 73-70)
CJ Banchero attempts a 3Pt. Contested by Immanuel Curry (4.6 feet, MAN). CJ BANCHERO MAKES IT!
Score: 76-70

[02:55] Team_053 possession (Score: 76-70)
Kobe Ginobili attempts a Midrange. Contested by Manu Anthony (3.8 feet, MAN). Kobe Ginobili misses. Rebound secured by Michael Simmons.

[02:41] Team_015 possession (Score: 76-70)
CJ Banchero attempts a Layup. Contested by Michael Gasol (4.0 feet, ZONE). CJ BANCHERO MAKES IT! Assist: Manu Anthony
Score: 78-70

[02:26] Team_053 possession (Score: 78-70)
James Murray attempts a 3Pt. Contested by Michael Simmons (4.2 feet, MAN). James Murray misses. Rebound secured by Michael Simmons.

[02:15] Team_015 possession (Score: 78-70)
Trae Turner attempts a Layup. Contested by Draymond LaVine (4.6 feet, MAN). TRAE TURNER MAKES IT!
Score: 80-70

[02:02] Team_053 possession (Score: 80-70)
Michael Gasol attempts a Layup. Contested by Trae Turner (3.9 feet, ZONE). MICHAEL GASOL MAKES IT! Assist: James Murray
Score: 80-72

[01:50] Team_015 possession (Score: 80-72)
Manu Anthony attempts a 3Pt. Contested by Kobe Ginobili (4.7 feet, ZONE). MANU ANTHONY MAKES IT!
Score: 83-72

[01:35] Team_053 possession (Score: 83-72)
James Murray attempts a 3Pt. Contested by Michael Simmons (4.3 feet, MAN). James Murray misses. Rebound secured by Trae Turner.

[01:19] Team_015 possession (Score: 83-72)
Michael Simmons attempts a Midrange. Contested by James Murray (4.7 feet, MAN). Michael Simmons misses. Rebound secured by James Murray.

[01:01] Team_053 possession (Score: 83-72)
FOUL! Reach-in foul on Manu Anthony during the drive. [IN THE BONUS! 6 team fouls] Kobe Ginobili to the line for 2 free throws. (Manu Anthony: 3 personal fouls)   FT 1/2: GOOD   FT 2/2: GOOD Kobe Ginobili makes 2/2 from the line.
Score: 83-74

[00:43] Team_015 possession (Score: 83-74)
Manu Anthony loses control! Ball rolls out of bounds! TURNOVER! (dead ball)

[00:43] Substitution (Team_015): Manu Anthony OUT → Dwyane Sabonis IN (stamina_rule2)

[00:43] Substitution (Team_015): Michael Simmons OUT → Paolo Jokic IN (stamina_rule2)

[00:43] Substitution (Team_015): CJ Banchero OUT → Magic Wagner IN (stamina_rule2)

[00:43] Substitution (Team_015): Scottie Gasol OUT → Rudy Paul IN (stamina_rule2)

[00:43] Substitution (Team_015): Trae Turner OUT → Allen Curry IN (stamina_rule2)

[00:43] Substitution (Team_053): Kobe Ginobili OUT → Michael DeRozan IN (stamina_rule2)

[00:43] Substitution (Team_053): James Murray OUT → Tyrese Mitchell IN (stamina_rule2)

[00:43] Substitution (Team_053): Immanuel Curry OUT → Brandon Bryant IN (stamina_rule2)

[00:43] Substitution (Team_053): Michael Gasol OUT → Klay Anunoby IN (stamina_rule2)

[00:43] Substitution (Team_053): Draymond LaVine OUT → Devin Green IN (stamina_rule2)

[00:28] Team_053 possession (Score: 83-74)
Tyrese Mitchell drives to the basket... FOUL! Offensive foul on Tyrese Mitchell! Rudy Paul drew the charge! [Team fouls: 4] (Tyrese Mitchell: 1 personal fouls) TURNOVER! (dead ball)

[00:14] Team_015 possession (Score: 83-74)
Dwyane Sabonis attempts a 3Pt. Contested by Brandon Bryant (3.6 feet, ZONE). DWYANE SABONIS MAKES IT! Assist: Magic Wagner
Score: 86-74

================================================================================
                              3RD QUARTER COMPLETE                              
================================================================================

3RD QUARTER SCORE: Team_015 40, Team_053 22

BOX SCORE:
================================================================================

Team_015
--------------------------------------------------------------------------------
Player                MIN  PTS  REB  AST  TO      FG   FG%      3P   3P%
--------------------------------------------------------------------------------
Manu Anthony           25   13    0    2   0   5/5   100.0     0/0   0.0
CJ Banchero            25    8    2    1   0   3/3   100.0     0/0   0.0
Trae Turner            24    8    5    0   0   4/4   100.0     0/0   0.0
Scottie Gasol          24    5    0    1   0   2/3    66.7     0/0   0.0
Michael Simmons        25    3    4    1   0   1/5    20.0     0/0   0.0
Dwyane Sabonis         11    3    0    0   0   1/1   100.0     0/0   0.0
Magic Wagner           11    0    0    1   0   0/0     0.0     0/0   0.0

TEAM: FG: 16/21 (76.2%), 3PT: 7/10 (70.0%), REB: 11 (1 off, 10 def), AST: 6, TO: 3
TEAM FOULS: 6 [Team_053 in BONUS]


Team_053
--------------------------------------------------------------------------------
Player                MIN  PTS  REB  AST  TO      FG   FG%      3P   3P%
--------------------------------------------------------------------------------
Michael Gasol          25    8    2    0   0   4/5    80.0     0/0   0.0
James Murray           25    6    3    1   0   2/6    33.3     0/0   0.0
Draymond LaVine        25    4    3    0   0   2/3    66.7     0/0   0.0
Kobe Ginobili          25    2    0    2   0   1/3    33.3     0/0   0.0
Immanuel Curry         24    1    0    1   0   1/4    25.0     0/0   0.0

TEAM: FG: 10/21 (47.6%), 3PT: 2/5 (40.0%), REB: 8 (3 off, 5 def), AST: 4, TO: 2
TEAM FOULS: 4

================================================================================

================================================================================
                       4TH QUARTER - Team_015 vs Team_053                       
================================================================================

[12:00] Team_015 possession (Score: 86-74)
FOUL! Shooting foul on James Murray. Michael Simmons to the line for 3 free throws. [Team fouls: 1] (James Murray: 1 personal fouls)   FT 1/3: MISS   FT 2/3: GOOD   FT 3/3: GOOD Michael Simmons makes 2/3 from the line.
Score: 88-74

[11:47] Team_053 possession (Score: 88-74)
Draymond LaVine attempts a Midrange. Contested by Scottie Gasol (3.7 feet, ZONE). DRAYMOND LAVINE MAKES IT!
Score: 88-76

[11:35] Team_015 possession (Score: 88-76)
Scottie Gasol drives and kicks out. CJ Banchero attempts a 3Pt. Contested by Immanuel Curry (4.9 feet, MAN). CJ BANCHERO MAKES IT! Assist: Trae Turner
Score: 91-76

[11:16] Team_053 possession (Score: 91-76)
FOUL! Holding foul on Manu Anthony. [Team fouls: 1] No free throws, side out. (Manu Anthony: 1 personal fouls)

[10:58] Team_053 possession (Score: 91-76)
Immanuel Curry attempts a 3Pt. Contested by Manu Anthony (4.1 feet, ZONE). IMMANUEL CURRY MAKES IT! Assist: Michael Gasol
Score: 91-79

[10:42] Team_015 possession (Score: 91-79)
Manu Anthony drives and kicks out. Manu Anthony attempts a 3Pt. Contested by Kobe Ginobili (4.4 feet, MAN). MANU ANTHONY MAKES IT! Assist: Trae Turner
Score: 94-79

[10:31] Team_053 possession (Score: 94-79)
Kobe Ginobili attempts a 3Pt. Contested by Manu Anthony (3.9 feet, ZONE). Kobe Ginobili misses. Rebound secured by CJ Banchero.

[10:13] Team_015 possession (Score: 94-79)
FOUL! Shooting foul on Immanuel Curry. CJ Banchero to the line for 2 free throws. [Team fouls: 2] (Immanuel Curry: 1 personal fouls)   FT 1/2: GOOD   FT 2/2: GOOD CJ Banchero makes 2/2 from the line.
Score: 96-79

[09:58] Team_053 possession (Score: 96-79)
James Murray commits a violation (traveling/carry)! TURNOVER! (dead ball)

[09:58] Substitution (Team_015): Manu Anthony OUT → Dwyane Sabonis IN (stamina_rule2)

[09:58] Substitution (Team_015): Michael Simmons OUT → Paolo Jokic IN (stamina_rule2)

[09:58] Substitution (Team_015): CJ Banchero OUT → Magic Wagner IN (stamina_rule2)

[09:58] Substitution (Team_015): Scottie Gasol OUT → Rudy Paul IN (stamina_rule2)

[09:58] Substitution (Team_015): Trae Turner OUT → Allen Curry IN (stamina_rule2)

[09:58] Substitution (Team_053): Kobe Ginobili OUT → Michael DeRozan IN (stamina_rule2)

[09:58] Substitution (Team_053): James Murray OUT → Tyrese Mitchell IN (stamina_rule2)

[09:58] Substitution (Team_053): Immanuel Curry OUT → Brandon Bryant IN (stamina_rule2)

[09:58] Substitution (Team_053): Michael Gasol OUT → Klay Anunoby IN (stamina_rule2)

[09:58] Substitution (Team_053): Draymond LaVine OUT → Devin Green IN (stamina_rule2)

[09:47] Team_015 possession (Score: 96-79)
Magic Wagner drives, Devin Green stays with him. Magic Wagner attempts a Dunk. Contested by Devin Green (4.9 feet, ZONE). MAGIC WAGNER MAKES IT! Assist: Paolo Jokic
Score: 98-79

[09:30] Team_053 possession (Score: 98-79)
Tyrese Mitchell drives to the basket... Tyrese Mitchell throws a bad pass out of bounds! TURNOVER! (dead ball)

[09:16] Team_015 possession (Score: 98-79)
Rudy Paul drives, Devin Green stays with him. Rudy Paul attempts a Layup. Contested by Devin Green (5.4 feet, ZONE). RUDY PAUL MAKES IT!
Score: 100-79

[09:02] Team_053 possession (Score: 100-79)
Brandon Bryant loses control! Ball rolls out of bounds! TURNOVER! (dead ball)

[08:43] Team_015 possession (Score: 100-79)
Paolo Jokic attempts a 3Pt. Contested by Brandon Bryant (3.9 feet, ZONE). PAOLO JOKIC MAKES IT!
Score: 103-79

[08:28] Team_053 possession (Score: 103-79)
Michael DeRozan attempts a 3Pt. Contested by Rudy Paul (2.9 feet, ZONE). Michael DeRozan misses. Rebound secured by Allen Curry.

[08:12] Team_015 possession (Score: 103-79)
Allen Curry attempts a Midrange. Contested by Klay Anunoby (3.9 feet, ZONE). Allen Curry misses. Offensive rebound by Allen Curry! Allen Curry's putback is no good. Offensive rebound by Rudy Paul! Rudy Paul kicks it out.

[08:00] Team_015 possession (Score: 103-79)
Paolo Jokic attempts a Midrange. Wide open! Michael DeRozan is 7.0 feet away. [ZONE] PAOLO JOKIC MAKES IT!
Score: 105-79

[07:45] Team_053 possession (Score: 105-79)
FOUL! Shooting foul on Magic Wagner. Tyrese Mitchell to the line for 2 free throws. [Team fouls: 2] (Magic Wagner: 1 personal fouls)   FT 1/2: GOOD   FT 2/2: GOOD Tyrese Mitchell makes 2/2 from the line.
Score: 105-81

[07:30] Team_015 possession (Score: 105-81)
Magic Wagner attempts a 3Pt. Contested by Brandon Bryant (3.4 feet, MAN). MAGIC WAGNER MAKES IT! Assist: Rudy Paul
Score: 108-81

[07:17] Team_053 possession (Score: 108-81)
Klay Anunoby drives and kicks out. Tyrese Mitchell attempts a 3Pt. Contested by Rudy Paul (3.2 feet, ZONE). Tyrese Mitchell misses. Offensive rebound by Devin Green! Devin Green's putback is no good. Rebound secured by Magic Wagner.

[07:04] Team_015 possession (Score: 108-81)
Dwyane Sabonis drives and kicks out. Dwyane Sabonis attempts a Midrange. Contested by Klay Anunoby (3.6 feet, ZONE). DWYANE SABONIS MAKES IT!
Score: 110-81

[06:53] Team_053 possession (Score: 110-81)
Devin Green drives, Rudy Paul stays with him. Devin Green attempts a Layup. Contested by Rudy Paul (3.6 feet, ZONE). Devin Green misses. Offensive rebound by Klay Anunoby! Klay Anunoby kicks it out.

[06:36] Team_053 possession (Score: 110-81)
Tyrese Mitchell attempts a Layup. Contested by Rudy Paul (3.1 feet, ZONE). Tyrese Mitchell misses. Rebound secured by Allen Curry.

[06:21] Team_015 possession (Score: 110-81)
Dwyane Sabonis attempts a 3Pt. Wide open! Michael DeRozan is 6.6 feet away. [MAN] Dwyane Sabonis misses. Rebound secured by Devin Green.

[06:07] Team_053 possession (Score: 110-81)
Devin Green makes the Dunk and draws the foul on Rudy Paul! And-1! Devin Green to the line for 1. [Team fouls: 3] (Rudy Paul: 1 personal fouls)   FT 1/1: MISS Devin Green makes 0/1 from the line. Rebound secured by Allen Curry.
Score: 110-83

[05:50] Team_015 possession (Score: 110-83)
Dwyane Sabonis attempts a 3Pt. Contested by Brandon Bryant (3.6 feet, ZONE). Dwyane Sabonis misses. Rebound secured by Devin Green.

[05:35] Team_053 possession (Score: 110-83)
Tyrese Mitchell attempts a Midrange. Contested by Paolo Jokic (5.5 feet, ZONE). TYRESE MITCHELL MAKES IT! Assist: Devin Green
Score: 110-85

[05:24] Team_015 possession (Score: 110-85)
Rudy Paul attempts a Dunk. BLOCKED BY KLAY ANUNOBY! Ball deflects out of bounds off Rudy Paul.

[05:09] Team_053 possession (Score: 110-85)
Brandon Bryant attempts a 3Pt. Contested by Magic Wagner (5.3 feet, ZONE). BRANDON BRYANT MAKES IT! Assist: Devin Green
Score: 110-88

[04:53] Team_015 possession (Score: 110-88)
Allen Curry throws a bad pass! Stolen by Devin Green! TURNOVER! (live ball)

[04:36] Team_053 possession (Score: 110-88)
Tyrese Mitchell drives, Allen Curry stays with him. Tyrese Mitchell attempts a Layup. Contested by Allen Curry (4.4 feet, ZONE). TYRESE MITCHELL MAKES IT!
Score: 110-90

[04:26] Team_015 possession (Score: 110-90)
Rudy Paul attempts a 3Pt. Contested by Brandon Bryant (3.9 feet, ZONE). Rudy Paul misses. Rebound secured by Devin Green.

[04:15] Team_053 possession (Score: 110-90)
Tyrese Mitchell drives and kicks out. Tyrese Mitchell attempts a Midrange. Contested by Magic Wagner (5.4 feet, ZONE). TYRESE MITCHELL MAKES IT!
Score: 110-92

[03:56] Team_015 possession (Score: 110-92)
FOUL! Shooting foul on Devin Green. Allen Curry to the line for 2 free throws. [Team fouls: 3] (Devin Green: 1 personal fouls)   FT 1/2: GOOD   FT 2/2: GOOD Allen Curry makes 2/2 from the line.
Score: 112-92

[03:45] Team_053 possession (Score: 112-92)
Klay Anunoby attempts a 3Pt. Contested by Rudy Paul (3.2 feet, MAN). Klay Anunoby misses. Rebound secured by Allen Curry.

[03:31] Team_015 possession (Score: 112-92)
Dwyane Sabonis drives, Devin Green stays with him. Dwyane Sabonis attempts a Dunk. Contested by Devin Green (5.2 feet, ZONE). DWYANE SABONIS MAKES IT!
Score: 114-92

[03:16] Team_053 possession (Score: 114-92)
FOUL! Reach-in foul on Dwyane Sabonis during the drive. [Team fouls: 4] No free throws, side out. (Dwyane Sabonis: 1 personal fouls)

[02:59] Team_053 possession (Score: 114-92)
Klay Anunoby drives, picks up Allen Curry. Help arrives from Dwyane Sabonis! Klay Anunoby attempts a Layup. Contested by Dwyane Sabonis (4.5 feet, ZONE). Klay Anunoby misses. Offensive rebound by Klay Anunoby! Klay Anunoby kicks it out.

[02:42] Team_053 possession (Score: 114-92)
Michael DeRozan commits a violation (traveling/carry)! TURNOVER! (dead ball)

[02:22] Team_015 possession (Score: 114-92)
Rudy Paul makes the Midrange and draws the foul on Brandon Bryant! And-1! Rudy Paul to the line for 1. [Team fouls: 4] (Brandon Bryant: 1 personal fouls)   FT 1/1: MISS Rudy Paul makes 0/1 from the line. Rebound secured by Klay Anunoby.
Score: 116-92

[02:07] Team_053 possession (Score: 116-92)
Tyrese Mitchell attempts a Midrange. Contested by Dwyane Sabonis (4.8 feet, ZONE). Tyrese Mitchell misses. Rebound secured by Rudy Paul.

[01:56] Team_015 possession (Score: 116-92)
Rudy Paul drives and kicks out. Rudy Paul attempts a 3Pt. Contested by Brandon Bryant (3.5 feet, ZONE). Rudy Paul misses. Rebound secured by Devin Green.

[01:39] Team_053 possession (Score: 116-92)
Devin Green drives to the basket... FOUL! Offensive foul on Devin Green! Allen Curry drew the charge! [Team fouls: 5] (Devin Green: 2 personal fouls) TURNOVER! (dead ball)

[01:24] Team_015 possession (Score: 116-92)
FOUL! Shooting foul on Devin Green. Magic Wagner to the line for 2 free throws. [BONUS: 6 team fouls] (Devin Green: 3 personal fouls)   FT 1/2: GOOD   FT 2/2: MISS Magic Wagner makes 1/2 from the line. Rebound secured by Klay Anunoby.
Score: 117-92

[01:07] Team_053 possession (Score: 117-92)
Michael DeRozan attempts a 3Pt. Contested by Magic Wagner (5.2 feet, ZONE). MICHAEL DEROZAN MAKES IT!
Score: 117-95

[00:52] Team_015 possession (Score: 117-95)
Rudy Paul drives, Devin Green stays with him. Rudy Paul attempts a Layup. Contested by Devin Green (5.6 feet, ZONE). Rudy Paul misses. Rebound secured by Brandon Bryant.

[00:39] Team_053 possession (Score: 117-95)
FOUL! Shooting foul on Rudy Paul. Klay Anunoby to the line for 2 free throws. [BONUS: 5 team fouls] (Rudy Paul: 2 personal fouls)   FT 1/2: GOOD   FT 2/2: GOOD Klay Anunoby makes 2/2 from the line.
Score: 117-97

[00:22] Team_015 possession (Score: 117-97)
Paolo Jokic attempts a Layup. Contested by Devin Green (5.7 feet, ZONE). Paolo Jokic misses. Rebound secured by Klay Anunoby.

[00:08] Team_053 possession (Score: 117-97)
Tyrese Mitchell attempts a Midrange. Contested by Paolo Jokic (5.7 feet, MAN). TYRESE MITCHELL MAKES IT!
Score: 117-99

================================================================================
                              4TH QUARTER COMPLETE                              
================================================================================

4TH QUARTER SCORE: Team_015 31, Team_053 25

BOX SCORE:
================================================================================

Team_015
--------------------------------------------------------------------------------
Player                MIN  PTS  REB  AST  TO      FG   FG%      3P   3P%
--------------------------------------------------------------------------------
CJ Banchero            27    5    1    0   0   2/2   100.0     0/0   0.0
Magic Wagner           21    5    1    0   0   2/3    66.7     0/0   0.0
Paolo Jokic            21    5    0    1   0   2/3    66.7     0/0   0.0
Dwyane Sabonis         21    4    0    0   0   2/4    50.0     0/0   0.0
Manu Anthony           27    3    0    0   0   1/1   100.0     0/0   0.0
Michael Simmons        27    2    0    0   0   1/1   100.0     0/0   0.0
Rudy Paul              22    2    2    1   0   1/6    16.7     0/0   0.0
Allen Curry            22    2    4    0   0   1/1   100.0     0/0   0.0
Trae Turner            27    0    0    2   0   0/0     0.0     0/0   0.0

TEAM: FG: 12/21 (57.1%), 3PT: 3/6 (50.0%), REB: 7 (1 off, 6 def), AST: 4, TO: 1
TEAM FOULS: 5 [Team_053 in BONUS]


Team_053
--------------------------------------------------------------------------------
Player                MIN  PTS  REB  AST  TO      FG   FG%      3P   3P%
--------------------------------------------------------------------------------
Tyrese Mitchell        21   10    0    0   0   5/7    71.4     0/0   0.0
Immanuel Curry         27    3    0    0   0   1/1   100.0     0/0   0.0
Michael DeRozan        21    3    0    0   0   1/2    50.0     0/0   0.0
Brandon Bryant         22    3    1    0   0   1/1   100.0     0/0   0.0
Draymond LaVine        27    2    0    0   0   1/1   100.0     0/0   0.0
Klay Anunoby           21    2    5    0   0   1/3    33.3     0/0   0.0
Michael Gasol          27    0    0    1   0   0/0     0.0     0/0   0.0
Kobe Ginobili          27    0    0    0   0   0/1     0.0     0/0   0.0
Devin Green            21    0    4    2   0   0/1     0.0     0/0   0.0

TEAM: FG: 10/17 (58.8%), 3PT: 3/6 (50.0%), REB: 11 (3 off, 8 def), AST: 3, TO: 5
TEAM FOULS: 6 [Team_015 in BONUS]

================================================================================

================================================================================
                               FULL GAME COMPLETE                               
================================================================================

FINAL SCORE: Team_015 117, Team_053 99

SCORING BY QUARTER:
--------------------------------------------------------------------------------
Team                     Q1     Q2     Q3     Q4    FINAL
--------------------------------------------------------------------------------
Team_015                 23     23     40     31      117
Team_053                 28     24     22     25       99
--------------------------------------------------------------------------------

FULL GAME BOX SCORE:
================================================================================

Team_015
--------------------------------------------------------------------------------
Player                MIN  PTS  REB  AST  TO      FG   FG%      3P   3P%      FT STL BLK
--------------------------------------------------------------------------------
Manu Anthony           27   23    0    3   4   9/10   90.0   4/5    80.0  10/11    0   0
Michael Simmons        27    8    8    1   0   3/12   25.0   2/6    33.3   3/4     0   0
CJ Banchero            27   22    7    2   1   7/7   100.0   3/3   100.0   4/4     0   0
Scottie Gasol          27    5    0    3   0   5/9    55.6   3/6    50.0   1/2     0   0
Trae Turner            27   12   11    3   1   4/6    66.7   0/0     0.0   0/0     0   1
Rudy Paul              22   12   10    1   0   5/12   41.7   0/1     0.0   0/1     0   1
Allen Curry            22    9    9    2   2   4/4   100.0   0/0     0.0   3/4     0   0
Dwyane Sabonis         21   10    0    0   0   4/9    44.4   2/6    33.3   0/0     0   0
Paolo Jokic            21    5    0    1   1   3/5    60.0   2/2   100.0   0/0     0   0
Magic Wagner           21    5    3    1   2   3/7    42.9   2/3    66.7   1/2     0   0

TEAM: FG: 47/81 (58.0%), 3PT: 18/32 (56.2%), REB: 49 (11 off, 38 def), AST: 17, TO: 11


Team_053
--------------------------------------------------------------------------------
Player                MIN  PTS  REB  AST  TO      FG   FG%      3P   3P%      FT STL BLK
--------------------------------------------------------------------------------
Kobe Ginobili          27   11    0    2   0   4/9    44.4   1/2    50.0   4/4     0   0
James Murray           27    8    6    2   2   3/9    33.3   2/6    33.3   0/0     0   0
Michael Gasol          27   17    7    1   1   7/10   70.0   1/1   100.0   4/4     1   1
Draymond LaVine        27    6    8    2   1   3/6    50.0   0/0     0.0   0/0     0   0
Immanuel Curry         27    6    0    3   0   4/10   40.0   1/4    25.0   2/4     0   0
Brandon Bryant         22    9    3    1   3   3/4    75.0   3/3   100.0   0/0     0   0
Michael DeRozan        21   11    0    1   2   5/11   45.5   3/9    33.3   0/0     0   0
Tyrese Mitchell        21   13    0    0   0   6/9    66.7   0/1     0.0   3/3     0   0
Klay Anunoby           21    2    8    2   1   1/6    16.7   0/2     0.0   3/4     0   1
Devin Green            21   12   11    4   0   3/5    60.0   1/1   100.0   3/4     2   0

TEAM: FG: 40/80 (50.0%), 3PT: 12/29 (41.4%), REB: 42 (12 off, 30 def), AST: 18, TO: 10

================================================================================
