================================================================================
                        FULL GAME - Team_063 vs Team_068                        
================================================================================

================================================================================
                       1ST QUARTER - Team_063 vs Team_068                       
================================================================================

[12:00] Team_063 possession (Score: 0-0)
FOUL! Holding foul on Zion Anunoby. [Team fouls: 1] No free throws, side out. (Zion Anunoby: 1 personal fouls)

[11:48] Team_063 possession (Score: 0-0)
Tyler Harris drives, picks up Gary Simons. Help arrives from Malcolm Herro! Tyler Harris attempts a Dunk. Contested by Malcolm Herro (3.1 feet, ZONE). TYLER HARRIS MAKES IT! Assist: Dirk Reaves
Score: 2-0

[11:37] Team_068 possession (Score: 2-0)
Zion Anunoby attempts a Midrange. Contested by Terry Reaves (5.0 feet, ZONE). ZION ANUNOBY MAKES IT! Assist: Malcolm Herro
Score: 2-2

[11:23] Team_063 possession (Score: 2-2)
Bradley Davis attempts a Midrange. Contested by Jaren Johnson (3.8 feet, ZONE). BRADLEY DAVIS MAKES IT!
Score: 4-2

[11:09] Team_068 possession (Score: 4-2)
FOUL! Offensive foul on Nikola Ginobili! Tyler Harris drew the charge! [Team fouls: 2] (Nikola Ginobili: 1 personal fouls) TURNOVER! (dead ball)

[10:51] Team_063 possession (Score: 4-2)
Malcolm Quickley attempts a 3Pt. Contested by Malcolm Herro (4.0 feet, MAN). Malcolm Quickley misses. FOUL! Loose ball foul on Nikola Ginobili during the rebound battle. [Team fouls: 3] No free throws, side out. (Nikola Ginobili: 2 personal fouls)

[10:34] Team_063 possession (Score: 4-2)
FOUL! Shooting foul on Zion Anunoby. Malcolm Quickley to the line for 3 free throws. [Team fouls: 4] (Zion Anunoby: 2 personal fouls)   FT 1/3: GOOD   FT 2/3: MISS   FT 3/3: MISS Malcolm Quickley makes 1/3 from the line. Offensive rebound by Dirk Reaves! Dirk Reaves puts it back in!
Score: 7-2

[10:18] Team_068 possession (Score: 7-2)
Gary Simons drives, picks up Tyler Harris. Help arrives from Malcolm Quickley! Gary Simons attempts a Dunk. Contested by Malcolm Quickley (5.2 feet, ZONE). GARY SIMONS MAKES IT! Assist: Zion Anunoby
Score: 7-4

[10:04] Team_063 possession (Score: 7-4)
Malcolm Quickley attempts a 3Pt. Contested by Zion Anunoby (4.2 feet, ZONE). Malcolm Quickley misses. Rebound secured by Gary Simons.

[09:46] Team_068 possession (Score: 7-4)
Gary Simons drives, Dirk Reaves stays with him. Gary Simons attempts a Dunk. Contested by Dirk Reaves (4.5 feet, MAN). GARY SIMONS MAKES IT! Assist: Zion Anunoby
Score: 7-6

[09:31] Team_063 possession (Score: 7-6)
Tyler Harris drives, Nikola Ginobili stays with him. Tyler Harris attempts a Layup. Contested by Nikola Ginobili (4.0 feet, MAN). TYLER HARRIS MAKES IT! Assist: Bradley Davis
Score: 9-6

[09:16] Team_068 possession (Score: 9-6)
Malcolm Herro attempts a Midrange. Contested by Malcolm Quickley (3.5 feet, MAN). Malcolm Herro misses. Offensive rebound by Jaren Johnson! Jaren Johnson kicks it out.

[09:01] Team_068 possession (Score: 9-6)
Malcolm Herro attempts a Midrange. Contested by Malcolm Quickley (3.5 feet, MAN). MALCOLM HERRO MAKES IT!
Score: 9-8

[08:47] Team_063 possession (Score: 9-8)
FOUL! Reach-in foul on Nikola Ginobili during the drive. [IN THE BONUS! 5 team fouls] Tyler Harris to the line for 2 free throws. (Nikola Ginobili: 3 personal fouls)   FT 1/2: GOOD   FT 2/2: GOOD Tyler Harris makes 2/2 from the line.
Score: 11-8

[08:37] Team_068 possession (Score: 11-8)
Nikola Ginobili attempts a Midrange. Contested by Tyler Harris (4.4 feet, MAN). NIKOLA GINOBILI MAKES IT! Assist: Gary Simons
Score: 11-10

[08:27] Team_063 possession (Score: 11-10)
Dirk Reaves makes the Dunk and draws the foul on Malcolm Herro! And-1! Dirk Reaves to the line for 1. [BONUS: 6 team fouls] (Malcolm Herro: 1 personal fouls)   FT 1/1: GOOD Dirk Reaves makes 1/1 from the line.
Score: 14-10

[08:09] Team_068 possession (Score: 14-10)
FOUL! Reach-in foul on Tyler Harris during the drive. [Team fouls: 1] No free throws, side out. (Tyler Harris: 1 personal fouls)

[07:55] Team_068 possession (Score: 14-10)
Malcolm Herro attempts a Midrange. Contested by Dirk Reaves (3.7 feet, ZONE). Malcolm Herro misses. Rebound secured by Malcolm Quickley.

[07:38] Team_063 possession (Score: 14-10)
Tyler Harris attempts a Midrange. Contested by Nikola Ginobili (4.0 feet, MAN). Tyler Harris misses. Rebound secured by Jaren Johnson.

[07:25] Team_068 possession (Score: 14-10)
Gary Simons attempts a Layup. Contested by Dirk Reaves (4.5 feet, MAN). Gary Simons misses. Rebound secured by Tyler Harris.

[07:10] Team_063 possession (Score: 14-10)
Malcolm Quickley drives to the basket... Malcolm Quickley throws a bad pass! Stolen by Malcolm Herro! TURNOVER! (live ball)

[06:58] Team_068 possession (Score: 14-10)
Zion Anunoby drives and kicks out. Jaren Johnson attempts a Midrange. Contested by Terry Reaves (4.6 feet, MAN). Jaren Johnson misses. FOUL! Loose ball foul on Tyler Harris during the rebound battle. [Team fouls: 2] No free throws, side out. (Tyler Harris: 2 personal fouls)

[06:44] Team_068 possession (Score: 14-10)
Jaren Johnson attempts a Midrange. Contested by Dirk Reaves (4.2 feet, ZONE). Jaren Johnson misses. FOUL! Loose ball foul on Malcolm Quickley during the rebound battle. [Team fouls: 3] No free throws, side out. (Malcolm Quickley: 1 personal fouls)

[06:34] Team_068 possession (Score: 14-10)
Malcolm Herro attempts a Layup. Contested by Tyler Harris (4.4 feet, ZONE). MALCOLM HERRO MAKES IT! Assist: Jaren Johnson
Score: 14-12

[06:20] Team_063 possession (Score: 14-12)
Dirk Reaves drives and kicks out. Terry Reaves attempts a 3Pt. Contested by Zion Anunoby (4.4 feet, ZONE). TERRY REAVES MAKES IT! Assist: Tyler Harris
Score: 17-12

[06:02] Team_068 possession (Score: 17-12)
Gary Simons attempts a 3Pt. Contested by Malcolm Quickley (4.3 feet, ZONE). Gary Simons misses. Rebound secured by Malcolm Quickley.

[05:48] Team_063 possession (Score: 17-12)
Tyler Harris attempts a Dunk. BLOCKED BY GARY SIMONS! Ball is loose! Rebound secured by Gary Simons.

[05:36] Team_068 possession (Score: 17-12)
FOUL! Reach-in foul on Dirk Reaves during the drive. [Team fouls: 4] No free throws, side out. (Dirk Reaves: 1 personal fouls)

[05:17] Team_068 possession (Score: 17-12)
Jaren Johnson attempts a 3Pt. Contested by Malcolm Quickley (4.0 feet, ZONE). JAREN JOHNSON MAKES IT! Assist: Malcolm Herro
Score: 17-15

[04:59] Team_063 possession (Score: 17-15)
Malcolm Quickley attempts a 3Pt. Contested by Zion Anunoby (4.2 feet, ZONE). Malcolm Quickley misses. Rebound secured by Nikola Ginobili.

[04:45] Team_068 possession (Score: 17-15)
FOUL! Shooting foul on Bradley Davis. Zion Anunoby to the line for 2 free throws. [BONUS: 5 team fouls] (Bradley Davis: 1 personal fouls)   FT 1/2: GOOD   FT 2/2: GOOD Zion Anunoby makes 2/2 from the line.
Score: 17-17

[04:28] Team_063 possession (Score: 17-17)
FOUL! Holding foul on Jaren Johnson. [IN THE BONUS! 7 team fouls] Terry Reaves to the line for 2 free throws. (Jaren Johnson: 1 personal fouls)   FT 1/2: GOOD   FT 2/2: MISS Terry Reaves makes 1/2 from the line. Rebound secured by Nikola Ginobili.
Score: 18-17

[04:14] Team_068 possession (Score: 18-17)
Malcolm Herro attempts a 3Pt. Contested by Malcolm Quickley (3.6 feet, MAN). Malcolm Herro misses. Rebound secured by Tyler Harris.

[04:03] Team_063 possession (Score: 18-17)
Terry Reaves drives to the basket... Terry Reaves loses the ball! Stripped by Gary Simons! TURNOVER! (live ball)

[03:48] Team_068 possession (Score: 18-17)
Jaren Johnson attempts a Midrange. Contested by Tyler Harris (5.0 feet, ZONE). Jaren Johnson misses. Rebound secured by Malcolm Quickley.

[03:33] Team_063 possession (Score: 18-17)
Dirk Reaves drives, Gary Simons stays with him. Dirk Reaves attempts a Layup. Contested by Gary Simons (3.6 feet, ZONE). DIRK REAVES MAKES IT! Assist: Malcolm Quickley
Score: 20-17

[03:19] Team_068 possession (Score: 20-17)
Nikola Ginobili drives, Tyler Harris stays with him. Nikola Ginobili attempts a Dunk. Contested by Tyler Harris (4.6 feet, ZONE). NIKOLA GINOBILI MAKES IT! Assist: Jaren Johnson
Score: 20-19

[03:07] Team_063 possession (Score: 20-19)
Bradley Davis attempts a Midrange. Contested by Malcolm Herro (4.6 feet, ZONE). BRADLEY DAVIS MAKES IT! Assist: Terry Reaves
Score: 22-19

[02:50] Team_068 possession (Score: 22-19)
Zion Anunoby attempts a 3Pt. Contested by Bradley Davis (5.4 feet, MAN). ZION ANUNOBY MAKES IT! Assist: Nikola Ginobili
Score: 22-22

[02:34] Team_063 possession (Score: 22-22)
Terry Reaves attempts a 3Pt. Contested by Jaren Johnson (4.1 feet, MAN). Terry Reaves misses. Rebound secured by Gary Simons.

[02:21] Team_068 possession (Score: 22-22)
Malcolm Herro attempts a Midrange. Contested by Malcolm Quickley (3.8 feet, MAN). Malcolm Herro misses. Rebound secured by Malcolm Quickley.

[02:04] Team_063 possession (Score: 22-22)
FOUL! Reach-in foul on Gary Simons during the drive. [IN THE BONUS! 8 team fouls] Dirk Reaves to the line for 2 free throws. (Gary Simons: 1 personal fouls)   FT 1/2: GOOD   FT 2/2: GOOD Dirk Reaves makes 2/2 from the line.
Score: 24-22

[01:50] Team_068 possession (Score: 24-22)
Nikola Ginobili attempts a Layup. Contested by Dirk Reaves (4.1 feet, ZONE). NIKOLA GINOBILI MAKES IT!
Score: 24-24

[01:36] Team_063 possession (Score: 24-24)
Malcolm Quickley attempts a 3Pt. Contested by Zion Anunoby (4.5 feet, ZONE). Malcolm Quickley misses. Rebound secured by Jaren Johnson.

[01:21] Team_068 possession (Score: 24-24)
Malcolm Herro attempts a 3Pt. Contested by Malcolm Quickley (3.9 feet, MAN). Malcolm Herro misses. Offensive rebound by Nikola Ginobili! Nikola Ginobili puts it back in!
Score: 24-26

[01:03] Team_063 possession (Score: 24-26)
FOUL! Reach-in foul on Jaren Johnson during the drive. [IN THE BONUS! 9 team fouls] Terry Reaves to the line for 2 free throws. (Jaren Johnson: 2 personal fouls)   FT 1/2: GOOD   FT 2/2: MISS Terry Reaves makes 1/2 from the line. Rebound secured by Nikola Ginobili.
Score: 25-26

[00:48] Team_068 possession (Score: 25-26)
Zion Anunoby attempts a Midrange. Contested by Bradley Davis (5.6 feet, MAN). ZION ANUNOBY MAKES IT!
Score: 25-28

[00:31] Team_063 possession (Score: 25-28)
Dirk Reaves attempts a 3Pt. Contested by Zion Anunoby (5.0 feet, ZONE). DIRK REAVES MAKES IT! Assist: Tyler Harris
Score: 28-28

[00:17] Team_068 possession (Score: 28-28)
Jaren Johnson drives and kicks out. Gary Simons attempts a 3Pt. Contested by Terry Reaves (5.1 feet, ZONE). Gary Simons misses. FOUL! Loose ball foul on Tyler Harris during the rebound battle. [IN THE BONUS! 6 team fouls] Jaren Johnson to the line for 2 free throws. (Tyler Harris: 3 personal fouls)   FT 1/2: GOOD   FT 2/2: MISS Jaren Johnson makes 1/2 from the line. Rebound secured by Dirk Reaves.
Score: 28-29

[00:05] Team_063 possession (Score: 28-29)
FOUL! Holding foul on Zion Anunoby. [IN THE BONUS! 10 team fouls] Bradley Davis to the line for 2 free throws. (Zion Anunoby: 3 personal fouls)   FT 1/2: GOOD   FT 2/2: GOOD Bradley Davis makes 2/2 from the line.
Score: 30-29

================================================================================
                              1ST QUARTER COMPLETE                              
================================================================================

1ST QUARTER SCORE: Team_063 30, Team_068 29

BOX SCORE:
================================================================================

Team_063
--------------------------------------------------------------------------------
Player                MIN  PTS  REB  AST  TO      FG   FG%      3P   3P%
--------------------------------------------------------------------------------
Tyler Harris           12    6    2    2   0   3/5    60.0     0/0   0.0
Bradley Davis          12    6    0    1   0   3/3   100.0     0/0   0.0
Terry Reaves           12    3    0    1   0   1/3    33.3     0/0   0.0
Malcolm Quickley       12    0    4    1   0   0/3     0.0     0/0   0.0

TEAM: FG: 12/20 (60.0%), 3PT: 2/6 (33.3%), REB: 7 (1 off, 6 def), AST: 6, TO: 2
TEAM FOULS: 6 [Team_068 in BONUS]


Team_068
--------------------------------------------------------------------------------
Player                MIN  PTS  REB  AST  TO      FG   FG%      3P   3P%
--------------------------------------------------------------------------------
Dirk Reaves            12   13    2    1   0   5/5   100.0     0/0   0.0
Zion Anunoby           12    9    0    2   0   4/4   100.0     0/0   0.0
Nikola Ginobili        12    8    5    1   0   4/4   100.0     0/0   0.0
Malcolm Herro          12    4    0    2   0   2/5    40.0     0/0   0.0
Gary Simons            12    4    3    1   0   2/4    50.0     0/0   0.0
Jaren Johnson          12    3    4    2   0   1/3    33.3     0/0   0.0

TEAM: FG: 13/20 (65.0%), 3PT: 3/5 (60.0%), REB: 13 (5 off, 8 def), AST: 8, TO: 1
TEAM FOULS: 10 [Team_063 in BONUS]

================================================================================

================================================================================
                       2ND QUARTER - Team_063 vs Team_068                       
================================================================================

[12:00] Team_063 possession (Score: 30-29)
Tyler Harris drives, Nikola Ginobili stays with him. Tyler Harris attempts a Layup. Contested by Nikola Ginobili (4.4 feet, MAN). TYLER HARRIS MAKES IT! Assist: Dirk Reaves
Score: 32-29

[11:46] Team_068 possession (Score: 32-29)
Gary Simons drives and kicks out. Gary Simons makes the Midrange and draws the foul on Bradley Davis! And-1! Gary Simons to the line for 1. [Team fouls: 1] (Bradley Davis: 1 personal fouls)   FT 1/1: GOOD Gary Simons makes 1/1 from the line.
Score: 32-32

[11:27] Team_063 possession (Score: 32-32)
FOUL! Shooting foul on Malcolm Herro. Malcolm Quickley to the line for 2 free throws. [Team fouls: 1] (Malcolm Herro: 1 personal fouls)   FT 1/2: GOOD   FT 2/2: GOOD Malcolm Quickley makes 2/2 from the line.
Score: 34-32

[11:11] Team_068 possession (Score: 34-32)
Malcolm Herro drives and kicks out. Jaren Johnson attempts a Midrange. Contested by Terry Reaves (5.0 feet, MAN). Jaren Johnson misses. Rebound secured by Tyler Harris.

[10:57] Team_063 possession (Score: 34-32)
FOUL! Reach-in foul on Malcolm Herro during the drive. [Team fouls: 2] No free throws, side out. (Malcolm Herro: 2 personal fouls)

[10:43] Team_063 possession (Score: 34-32)
Dirk Reaves attempts a Layup. Contested by Gary Simons (4.0 feet, MAN). Dirk Reaves misses. Offensive rebound by Tyler Harris! Tyler Harris puts it back in!
Score: 36-32

[10:32] Team_068 possession (Score: 36-32)
Zion Anunoby throws a bad pass out of bounds! TURNOVER! (dead ball)

[10:32] Substitution (Team_063): Bradley Davis OUT → DeMar Banchero IN (stamina_rule2)

[10:32] Substitution (Team_063): Malcolm Quickley OUT → Cole Durant IN (stamina_rule2)

[10:32] Substitution (Team_063): Terry Reaves OUT → Jaren James IN (stamina_rule2)

[10:32] Substitution (Team_063): Dirk Reaves OUT → Lamelo Ball IN (stamina_rule2)

[10:32] Substitution (Team_063): Tyler Harris OUT → Kyle Green IN (stamina_rule2)

[10:32] Substitution (Team_068): Zion Anunoby OUT → Cole Anthony IN (stamina_rule2)

[10:32] Substitution (Team_068): Malcolm Herro OUT → Ja Banchero IN (stamina_rule2)

[10:32] Substitution (Team_068): Jaren Johnson OUT → Miles Murray IN (stamina_rule2)

[10:32] Substitution (Team_068): Gary Simons OUT → Jarrett Oladipo IN (stamina_rule2)

[10:32] Substitution (Team_068): Nikola Ginobili OUT → Franz Curry IN (stamina_rule2)

[10:19] Team_063 possession (Score: 36-32)
Jaren James attempts a Midrange. Contested by Miles Murray (4.0 feet, MAN). Jaren James misses. Rebound secured by Jarrett Oladipo.

[10:05] Team_068 possession (Score: 36-32)
Jarrett Oladipo attempts a Midrange. Contested by Lamelo Ball (5.1 feet, MAN). Jarrett Oladipo misses. Rebound secured by Lamelo Ball.

[09:51] Team_063 possession (Score: 36-32)
DeMar Banchero makes the 3Pt and draws the foul on Ja Banchero! And-1! DeMar Banchero to the line for 1. [Team fouls: 3] (Ja Banchero: 1 personal fouls)   FT 1/1: GOOD DeMar Banchero makes 1/1 from the line.
Score: 40-32

[09:36] Team_068 possession (Score: 40-32)
Cole Anthony attempts a Midrange. Contested by DeMar Banchero (3.8 feet, MAN). Cole Anthony misses. Offensive rebound by Franz Curry! Franz Curry puts it back in!
Score: 40-34

[09:19] Team_063 possession (Score: 40-34)
Kyle Green drives, Franz Curry stays with him. Kyle Green attempts a Layup. Contested by Franz Curry (4.4 feet, ZONE). Kyle Green misses. Rebound secured by Ja Banchero.

[09:03] Team_068 possession (Score: 40-34)
Franz Curry drives and kicks out. Ja Banchero attempts a 3Pt. Contested by DeMar Banchero (3.9 feet, ZONE). Ja Banchero misses. FOUL! Loose ball foul on Lamelo Ball during the rebound battle. [Team fouls: 2] No free throws, side out. (Lamelo Ball: 1 personal fouls)

[08:50] Team_068 possession (Score: 40-34)
Ja Banchero throws a bad pass! Stolen by Cole Durant! TURNOVER! (live ball)

[08:32] Team_063 possession (Score: 40-34)
DeMar Banchero attempts a Midrange. Contested by Jarrett Oladipo (4.2 feet, ZONE). DeMar Banchero misses. FOUL! Loose ball foul on Ja Banchero during the rebound battle. [Team fouls: 4] No free throws, side out. (Ja Banchero: 2 personal fouls)

[08:22] Team_063 possession (Score: 40-34)
FOUL! Holding foul on Jarrett Oladipo. [IN THE BONUS! 5 team fouls] Lamelo Ball to the line for 2 free throws. (Jarrett Oladipo: 1 personal fouls)   FT 1/2: GOOD   FT 2/2: GOOD Lamelo Ball makes 2/2 from the line.
Score: 42-34

[08:08] Team_068 possession (Score: 42-34)
FOUL! Shooting foul on Jaren James. Franz Curry to the line for 2 free throws. [Team fouls: 3] (Jaren James: 1 personal fouls)   FT 1/2: GOOD   FT 2/2: GOOD Franz Curry makes 2/2 from the line.
Score: 42-36

[07:51] Team_063 possession (Score: 42-36)
Jaren James drives and kicks out. DeMar Banchero attempts a 3Pt. Contested by Cole Anthony (4.7 feet, MAN). DeMar Banchero misses. Rebound secured by Franz Curry.

[07:38] Team_068 possession (Score: 42-36)
Cole Anthony attempts a Midrange. Contested by Jaren James (3.8 feet, ZONE). COLE ANTHONY MAKES IT! Assist: Jarrett Oladipo
Score: 42-38

[07:21] Team_063 possession (Score: 42-38)
Cole Durant drives, Franz Curry stays with him. Cole Durant attempts a Layup. Contested by Franz Curry (4.7 feet, ZONE). COLE DURANT MAKES IT! Assist: Lamelo Ball
Score: 44-38

[07:07] Team_068 possession (Score: 44-38)
Franz Curry attempts a Layup. Contested by Kyle Green (4.9 feet, ZONE). Franz Curry misses. Rebound secured by Lamelo Ball.

[06:50] Team_063 possession (Score: 44-38)
Lamelo Ball attempts a Midrange. Contested by Jarrett Oladipo (4.1 feet, MAN). Lamelo Ball misses. Rebound secured by Franz Curry.

[06:39] Team_068 possession (Score: 44-38)
Miles Murray drives to the basket... Miles Murray loses the ball! Stripped by Kyle Green! TURNOVER! (live ball)

[06:21] Team_063 possession (Score: 44-38)
DeMar Banchero drives and kicks out. Lamelo Ball attempts a 3Pt. Contested by Ja Banchero (5.1 feet, ZONE). LAMELO BALL MAKES IT! Assist: Cole Durant
Score: 47-38

[06:08] Team_068 possession (Score: 47-38)
Cole Anthony attempts a 3Pt. Contested by DeMar Banchero (3.8 feet, MAN). Cole Anthony misses. Rebound secured by Cole Durant.

[05:58] Team_063 possession (Score: 47-38)
FOUL! Holding foul on Miles Murray. [IN THE BONUS! 6 team fouls] Jaren James to the line for 2 free throws. (Miles Murray: 1 personal fouls)   FT 1/2: GOOD   FT 2/2: MISS Jaren James makes 1/2 from the line. Rebound secured by Jarrett Oladipo.
Score: 48-38

[05:40] Team_068 possession (Score: 48-38)
Ja Banchero attempts a Layup. Contested by Kyle Green (4.5 feet, ZONE). JA BANCHERO MAKES IT! Assist: Miles Murray
Score: 48-40

[05:23] Team_063 possession (Score: 48-40)
Jaren James attempts a Midrange. Contested by Ja Banchero (5.3 feet, ZONE). Jaren James misses. Rebound secured by Ja Banchero.

[05:07] Team_068 possession (Score: 48-40)
Jarrett Oladipo attempts a Layup. BLOCKED BY LAMELO BALL! Ball is loose! Rebound secured by Cole Durant.

[04:51] Team_063 possession (Score: 48-40)
Lamelo Ball attempts a Midrange. Contested by Jarrett Oladipo (4.1 feet, MAN). Lamelo Ball misses. Rebound secured by Jarrett Oladipo.

[04:36] Team_068 possession (Score: 48-40)
Franz Curry drives to the basket... Franz Curry commits a violation (traveling/carry)! TURNOVER! (dead ball)

[04:26] Team_063 possession (Score: 48-40)
Cole Durant attempts a 3Pt. Contested by Ja Banchero (5.5 feet, MAN). Cole Durant misses. Rebound secured by Jarrett Oladipo.

[04:13] Team_068 possession (Score: 48-40)
Miles Murray attempts a Layup. BLOCKED BY KYLE GREEN! Ball is loose! Offensive rebound by Franz Curry! Franz Curry kicks it out.

[03:57] Team_068 possession (Score: 48-40)
Jarrett Oladipo drives, Lamelo Ball stays with him. Jarrett Oladipo attempts a Layup. Contested by Lamelo Ball (5.1 feet, MAN). JARRETT OLADIPO MAKES IT! Assist: Cole Anthony
Score: 48-42

[03:41] Team_063 possession (Score: 48-42)
DeMar Banchero drives and kicks out. DeMar Banchero attempts a 3Pt. Contested by Cole Anthony (4.7 feet, ZONE). DEMAR BANCHERO MAKES IT! Assist: Jaren James
Score: 51-42

[03:25] Team_068 possession (Score: 51-42)
Franz Curry attempts a Midrange. Contested by Cole Durant (4.7 feet, ZONE). Franz Curry misses. Rebound secured by Cole Durant.

[03:14] Team_063 possession (Score: 51-42)
Lamelo Ball attempts a 3Pt. Contested by Jarrett Oladipo (4.2 feet, MAN). LAMELO BALL MAKES IT! Assist: Cole Durant
Score: 54-42

[03:01] Team_068 possession (Score: 54-42)
Cole Anthony attempts a 3Pt. Contested by DeMar Banchero (3.8 feet, MAN). Cole Anthony misses. Rebound secured by Lamelo Ball.

[02:47] Team_063 possession (Score: 54-42)
Kyle Green attempts a Midrange. Contested by Franz Curry (4.5 feet, MAN). Kyle Green misses. Offensive rebound by Lamelo Ball! Lamelo Ball kicks it out.

[02:32] Team_063 possession (Score: 54-42)
Kyle Green attempts a Midrange. Contested by Franz Curry (4.5 feet, MAN). KYLE GREEN MAKES IT! Assist: DeMar Banchero
Score: 56-42

[02:19] Team_068 possession (Score: 56-42)
Franz Curry throws a bad pass! Stolen by Kyle Green! TURNOVER! (live ball)

[02:06] Team_063 possession (Score: 56-42)
Lamelo Ball attempts a 3Pt. Contested by Ja Banchero (5.5 feet, ZONE). LAMELO BALL MAKES IT! Assist: Kyle Green
Score: 59-42

[01:54] Team_068 possession (Score: 59-42)
Cole Anthony attempts a 3Pt. Contested by DeMar Banchero (3.9 feet, MAN). COLE ANTHONY MAKES IT! Assist: Franz Curry
Score: 59-45

[01:36] Team_063 possession (Score: 59-45)
FOUL! Offensive foul on Jaren James! Miles Murray drew the charge! [Team fouls: 4] (Jaren James: 2 personal fouls) TURNOVER! (dead ball)

[01:22] Team_068 possession (Score: 59-45)
Ja Banchero makes the Layup and draws the foul on Cole Durant! And-1! Ja Banchero to the line for 1. [BONUS: 5 team fouls] (Cole Durant: 1 personal fouls)   FT 1/1: GOOD Ja Banchero makes 1/1 from the line.
Score: 59-48

[01:11] Team_063 possession (Score: 59-48)
Kyle Green attempts a Layup. Contested by Franz Curry (4.6 feet, MAN). KYLE GREEN MAKES IT! Assist: Lamelo Ball
Score: 61-48

[00:57] Team_068 possession (Score: 61-48)
FOUL! Holding foul on DeMar Banchero. [IN THE BONUS! 6 team fouls] Cole Anthony to the line for 2 free throws. (DeMar Banchero: 1 personal fouls)   FT 1/2: GOOD   FT 2/2: GOOD Cole Anthony makes 2/2 from the line.
Score: 61-50

[00:38] Team_063 possession (Score: 61-50)
Kyle Green drives to the basket... Kyle Green throws a bad pass! Stolen by Franz Curry! TURNOVER! (live ball)

[00:24] Team_068 possession (Score: 61-50)
Ja Banchero drives to the basket... Ja Banchero throws a bad pass out of bounds! TURNOVER! (dead ball)

[00:09] Team_063 possession (Score: 61-50)
FOUL! Holding foul on Jarrett Oladipo. [IN THE BONUS! 7 team fouls] Lamelo Ball to the line for 2 free throws. (Jarrett Oladipo: 2 personal fouls)   FT 1/2: GOOD   FT 2/2: GOOD Lamelo Ball makes 2/2 from the line.
Score: 63-50

================================================================================
                              2ND QUARTER COMPLETE                              
================================================================================

2ND QUARTER SCORE: Team_063 33, Team_068 21

BOX SCORE:
================================================================================

Team_063
--------------------------------------------------------------------------------
Player                MIN  PTS  REB  AST  TO      FG   FG%      3P   3P%
--------------------------------------------------------------------------------
Lamelo Ball            10   13    4    2   0   5/7    71.4     0/0   0.0
DeMar Banchero         10    7    0    1   0   2/2   100.0     0/0   0.0
Tyler Harris           14    4    2    0   0   2/2   100.0     0/0   0.0
Kyle Green             10    4    1    1   0   2/3    66.7     0/0   0.0
Malcolm Quickley       14    2    0    0   0   1/1   100.0     0/0   0.0
Cole Durant            10    2    3    2   0   1/2    50.0     0/0   0.0
Dirk Reaves            14    0    0    1   0   0/0     0.0     0/0   0.0
Jaren James            10    0    0    1   0   0/3     0.0     0/0   0.0

TEAM: FG: 13/21 (61.9%), 3PT: 3/4 (75.0%), REB: 10 (3 off, 7 def), AST: 8, TO: 2
TEAM FOULS: 6 [Team_068 in BONUS]


Team_068
--------------------------------------------------------------------------------
Player                MIN  PTS  REB  AST  TO      FG   FG%      3P   3P%
--------------------------------------------------------------------------------
Cole Anthony           10    7    0    1   0   3/5    60.0     0/0   0.0
Ja Banchero            10    5    2    0   0   2/2   100.0     0/0   0.0
Franz Curry            10    4    4    1   0   2/4    50.0     0/0   0.0
Gary Simons            14    3    0    0   0   1/1   100.0     0/0   0.0
Jarrett Oladipo        10    2    5    1   0   1/3    33.3     0/0   0.0
Malcolm Herro          14    0    0    0   0   0/1     0.0     0/0   0.0
Miles Murray           10    0    0    1   0   0/0     0.0     0/0   0.0

TEAM: FG: 9/16 (56.2%), 3PT: 1/3 (33.3%), REB: 11 (3 off, 8 def), AST: 4, TO: 6
TEAM FOULS: 7 [Team_063 in BONUS]

================================================================================

================================================================================
                       3RD QUARTER - Team_063 vs Team_068                       
================================================================================

[12:00] Team_063 possession (Score: 63-50)
FOUL! Reach-in foul on Gary Simons during the drive. [Team fouls: 1] No free throws, side out. (Gary Simons: 1 personal fouls)

[11:47] Team_063 possession (Score: 63-50)
Malcolm Quickley drives and kicks out. Malcolm Quickley attempts a Midrange. Contested by Jaren Johnson (3.6 feet, ZONE). Malcolm Quickley misses. Rebound secured by Gary Simons.

[11:33] Team_068 possession (Score: 63-50)
Nikola Ginobili attempts a 3Pt. Contested by Tyler Harris (4.4 feet, MAN). Nikola Ginobili misses. Rebound secured by Dirk Reaves.

[11:19] Team_063 possession (Score: 63-50)
Dirk Reaves attempts a Layup. Contested by Gary Simons (3.4 feet, MAN). DIRK REAVES MAKES IT! Assist: Malcolm Quickley
Score: 65-50

[11:05] Team_068 possession (Score: 65-50)
Malcolm Herro attempts a 3Pt. Contested by Malcolm Quickley (3.5 feet, MAN). Malcolm Herro misses. Rebound secured by Malcolm Quickley.

[10:53] Team_063 possession (Score: 65-50)
Terry Reaves attempts a 3Pt. Contested by Zion Anunoby (4.7 feet, ZONE). Terry Reaves misses. Offensive rebound by Tyler Harris! Tyler Harris's putback is no good. Rebound secured by Nikola Ginobili.

[10:36] Team_068 possession (Score: 65-50)
Jaren Johnson attempts a Layup. Contested by Terry Reaves (5.1 feet, MAN). JAREN JOHNSON MAKES IT! Assist: Gary Simons
Score: 65-52

[10:22] Team_063 possession (Score: 65-52)
Dirk Reaves drives and kicks out. Tyler Harris attempts a 3Pt. Contested by Zion Anunoby (4.4 feet, ZONE). Tyler Harris misses. Rebound secured by Jaren Johnson.

[10:07] Team_068 possession (Score: 65-52)
Jaren Johnson makes the Layup and draws the foul on Terry Reaves! And-1! Jaren Johnson to the line for 1. [Team fouls: 1] (Terry Reaves: 1 personal fouls)   FT 1/1: GOOD Jaren Johnson makes 1/1 from the line.
Score: 65-55

[09:52] Team_063 possession (Score: 65-55)
FOUL! Shooting foul on Malcolm Herro. Malcolm Quickley to the line for 2 free throws. [Team fouls: 2] (Malcolm Herro: 1 personal fouls)   FT 1/2: GOOD   FT 2/2: GOOD Malcolm Quickley makes 2/2 from the line.
Score: 67-55

[09:39] Team_068 possession (Score: 67-55)
Gary Simons drives to the basket... Gary Simons throws a bad pass! Stolen by Dirk Reaves! TURNOVER! (live ball)

[09:21] Team_063 possession (Score: 67-55)
Tyler Harris attempts a Dunk. BLOCKED BY NIKOLA GINOBILI! Ball is loose! Rebound secured by Gary Simons.

[09:08] Team_068 possession (Score: 67-55)
FOUL! Reach-in foul on Tyler Harris during the drive. [Team fouls: 2] No free throws, side out. (Tyler Harris: 1 personal fouls)

[08:54] Team_068 possession (Score: 67-55)
Zion Anunoby drives, Bradley Davis stays with him. Zion Anunoby attempts a Layup. Contested by Bradley Davis (5.3 feet, MAN). Zion Anunoby misses. Rebound secured by Tyler Harris.

[08:42] Team_063 possession (Score: 67-55)
Dirk Reaves attempts a 3Pt. Contested by Gary Simons (3.4 feet, MAN). DIRK REAVES MAKES IT! Assist: Malcolm Quickley
Score: 70-55

[08:30] Team_068 possession (Score: 70-55)
FOUL! Shooting foul on Bradley Davis. Zion Anunoby to the line for 2 free throws. [Team fouls: 3] (Bradley Davis: 1 personal fouls)   FT 1/2: MISS   FT 2/2: MISS Zion Anunoby makes 0/2 from the line. Rebound secured by Malcolm Quickley.

[08:16] Team_063 possession (Score: 70-55)
Tyler Harris attempts a 3Pt. Contested by Zion Anunoby (4.3 feet, ZONE). Tyler Harris misses. Offensive rebound by Dirk Reaves! Dirk Reaves puts it back in!
Score: 72-55

[07:59] Team_068 possession (Score: 72-55)
Malcolm Herro attempts a 3Pt. Contested by Malcolm Quickley (3.5 feet, MAN). Malcolm Herro misses. Rebound secured by Dirk Reaves.

[07:46] Team_063 possession (Score: 72-55)
Malcolm Quickley drives to the basket... FOUL! Offensive foul on Malcolm Quickley! Malcolm Herro drew the charge! [Team fouls: 4] (Malcolm Quickley: 1 personal fouls) TURNOVER! (dead ball)

[07:31] Team_068 possession (Score: 72-55)
Jaren Johnson drives to the basket... Jaren Johnson loses control! Ball rolls out of bounds! TURNOVER! (dead ball)

[07:19] Team_063 possession (Score: 72-55)
FOUL! Offensive foul on Terry Reaves! Jaren Johnson drew the charge! [Team fouls: 5] (Terry Reaves: 2 personal fouls) TURNOVER! (dead ball)

[07:03] Team_068 possession (Score: 72-55)
Gary Simons drives to the basket... Gary Simons loses the ball! Stripped by Dirk Reaves! TURNOVER! (live ball)

[06:50] Team_063 possession (Score: 72-55)
Bradley Davis makes the Layup and draws the foul on Jaren Johnson! And-1! Bradley Davis to the line for 1. [Team fouls: 3] (Jaren Johnson: 1 personal fouls)   FT 1/1: GOOD Bradley Davis makes 1/1 from the line.
Score: 75-55

[06:35] Team_068 possession (Score: 75-55)
FOUL! Offensive foul on Gary Simons! Dirk Reaves drew the charge! [Team fouls: 4] (Gary Simons: 2 personal fouls) TURNOVER! (dead ball)

[06:20] Team_063 possession (Score: 75-55)
Tyler Harris attempts a Midrange. Contested by Nikola Ginobili (4.0 feet, MAN). Tyler Harris misses. Rebound secured by Gary Simons.

[06:08] Team_068 possession (Score: 75-55)
Jaren Johnson drives and kicks out. Zion Anunoby attempts a 3Pt. Contested by Bradley Davis (4.9 feet, MAN). ZION ANUNOBY MAKES IT! Assist: Jaren Johnson
Score: 75-58

[05:56] Team_063 possession (Score: 75-58)
Dirk Reaves throws a bad pass! Stolen by Gary Simons! TURNOVER! (live ball)

[05:40] Team_068 possession (Score: 75-58)
Jaren Johnson drives and kicks out. Nikola Ginobili attempts a Midrange. Contested by Tyler Harris (4.4 feet, MAN). NIKOLA GINOBILI MAKES IT! Assist: Jaren Johnson
Score: 75-60

[05:28] Team_063 possession (Score: 75-60)
Dirk Reaves attempts a 3Pt. Contested by Gary Simons (3.4 feet, MAN). Dirk Reaves misses. FOUL! Loose ball foul on Gary Simons during the rebound battle. [IN THE BONUS! 5 team fouls] Tyler Harris to the line for 2 free throws. (Gary Simons: 3 personal fouls)   FT 1/2: GOOD   FT 2/2: GOOD Tyler Harris makes 2/2 from the line.
Score: 77-60

[05:16] Team_068 possession (Score: 77-60)
Nikola Ginobili attempts a Layup. Contested by Tyler Harris (4.5 feet, MAN). Nikola Ginobili misses. Rebound secured by Tyler Harris.

[05:03] Team_063 possession (Score: 77-60)
Terry Reaves commits a violation (traveling/carry)! TURNOVER! (dead ball)

[04:47] Team_068 possession (Score: 77-60)
FOUL! Reach-in foul on Tyler Harris during the drive. [IN THE BONUS! 6 team fouls] Nikola Ginobili to the line for 2 free throws. (Tyler Harris: 2 personal fouls)   FT 1/2: GOOD   FT 2/2: GOOD Nikola Ginobili makes 2/2 from the line.
Score: 77-62

[04:34] Team_063 possession (Score: 77-62)
FOUL! Shooting foul on Gary Simons. Dirk Reaves to the line for 2 free throws. [BONUS: 6 team fouls] (Gary Simons: 4 personal fouls)   FT 1/2: GOOD   FT 2/2: GOOD Dirk Reaves makes 2/2 from the line.
Score: 79-62

[04:23] Team_068 possession (Score: 79-62)
Jaren Johnson drives, Tyler Harris stays with him. Jaren Johnson attempts a Dunk. Contested by Tyler Harris (5.0 feet, ZONE). JAREN JOHNSON MAKES IT! Assist: Zion Anunoby
Score: 79-64

[04:08] Team_063 possession (Score: 79-64)
Tyler Harris drives, Nikola Ginobili stays with him. Tyler Harris attempts a Layup. Contested by Nikola Ginobili (4.2 feet, MAN). TYLER HARRIS MAKES IT! Assist: Terry Reaves
Score: 81-64

[03:55] Team_068 possession (Score: 81-64)
Malcolm Herro attempts a 3Pt. Contested by Malcolm Quickley (3.6 feet, ZONE). Malcolm Herro misses. Rebound secured by Tyler Harris.

[03:40] Team_063 possession (Score: 81-64)
Tyler Harris attempts a Layup. Contested by Nikola Ginobili (4.2 feet, MAN). Tyler Harris misses. Rebound secured by Jaren Johnson.

[03:30] Team_068 possession (Score: 81-64)
Zion Anunoby attempts a 3Pt. Contested by Bradley Davis (5.4 feet, MAN). ZION ANUNOBY MAKES IT! Assist: Gary Simons
Score: 81-67

[03:17] Team_063 possession (Score: 81-67)
Malcolm Quickley attempts a Midrange. Contested by Malcolm Herro (4.2 feet, ZONE). Malcolm Quickley misses. Offensive rebound by Tyler Harris! Tyler Harris puts it back in!
Score: 83-67

[03:01] Team_068 possession (Score: 83-67)
Jaren Johnson drives to the basket... Jaren Johnson throws a bad pass! Stolen by Terry Reaves! TURNOVER! (live ball)

[02:49] Team_063 possession (Score: 83-67)
Terry Reaves attempts a Midrange. Contested by Malcolm Herro (4.7 feet, ZONE). Terry Reaves misses. Rebound secured by Nikola Ginobili.

[02:35] Team_068 possession (Score: 83-67)
Malcolm Herro drives to the basket... FOUL! Offensive foul on Malcolm Herro! Malcolm Quickley drew the charge! [Team fouls: 7] (Malcolm Herro: 2 personal fouls) TURNOVER! (dead ball)

[02:16] Team_063 possession (Score: 83-67)
Bradley Davis drives to the basket... Bradley Davis throws a bad pass out of bounds! TURNOVER! (dead ball)

[02:16] Substitution (Team_063): Bradley Davis OUT → DeMar Banchero IN (stamina_rule2)

[02:16] Substitution (Team_063): Malcolm Quickley OUT → Cole Durant IN (stamina_rule2)

[02:16] Substitution (Team_063): Terry Reaves OUT → Jaren James IN (stamina_rule2)

[02:16] Substitution (Team_063): Dirk Reaves OUT → Lamelo Ball IN (stamina_rule2)

[02:16] Substitution (Team_063): Tyler Harris OUT → Kyle Green IN (stamina_rule2)

[02:16] Substitution (Team_068): Zion Anunoby OUT → Cole Anthony IN (stamina_rule2)

[02:16] Substitution (Team_068): Malcolm Herro OUT → Ja Banchero IN (stamina_rule2)

[02:16] Substitution (Team_068): Jaren Johnson OUT → Miles Murray IN (stamina_rule2)

[02:16] Substitution (Team_068): Gary Simons OUT → Jarrett Oladipo IN (stamina_rule2)

[02:16] Substitution (Team_068): Nikola Ginobili OUT → Franz Curry IN (stamina_rule2)

[01:59] Team_068 possession (Score: 83-67)
FOUL! Shooting foul on DeMar Banchero. Cole Anthony to the line for 3 free throws. [BONUS: 7 team fouls] (DeMar Banchero: 1 personal fouls)   FT 1/3: GOOD   FT 2/3: GOOD   FT 3/3: GOOD Cole Anthony makes 3/3 from the line.
Score: 83-70

[01:43] Team_063 possession (Score: 83-70)
DeMar Banchero attempts a 3Pt. Contested by Cole Anthony (5.1 feet, MAN). DeMar Banchero misses. Rebound secured by Ja Banchero.

[01:28] Team_068 possession (Score: 83-70)
Franz Curry attempts a Midrange. Contested by Lamelo Ball (5.2 feet, ZONE). Franz Curry misses. Rebound secured by Kyle Green.

[01:15] Team_063 possession (Score: 83-70)
FOUL! Shooting foul on Ja Banchero. Cole Durant to the line for 2 free throws. [BONUS: 8 team fouls] (Ja Banchero: 1 personal fouls)   FT 1/2: GOOD   FT 2/2: GOOD Cole Durant makes 2/2 from the line.
Score: 85-70

[00:58] Team_068 possession (Score: 85-70)
Miles Murray attempts a Midrange. Contested by Jaren James (4.1 feet, MAN). Miles Murray misses. FOUL! Loose ball foul on Lamelo Ball during the rebound battle. [IN THE BONUS! 8 team fouls] Jarrett Oladipo to the line for 2 free throws. (Lamelo Ball: 1 personal fouls)   FT 1/2: MISS   FT 2/2: GOOD Jarrett Oladipo makes 1/2 from the line.
Score: 85-71

[00:43] Team_063 possession (Score: 85-71)
Cole Durant attempts a Midrange. Contested by Ja Banchero (5.5 feet, MAN). COLE DURANT MAKES IT! Assist: DeMar Banchero
Score: 87-71

[00:33] Team_068 possession (Score: 87-71)
Franz Curry attempts a Layup. Contested by Kyle Green (4.9 feet, MAN). FRANZ CURRY MAKES IT! Assist: Miles Murray
Score: 87-73

[00:16] Team_063 possession (Score: 87-73)
Jaren James attempts a 3Pt. Contested by Miles Murray (4.0 feet, MAN). Jaren James misses. FOUL! Loose ball foul on Jarrett Oladipo during the rebound battle. [IN THE BONUS! 9 team fouls] Kyle Green to the line for 2 free throws. (Jarrett Oladipo: 1 personal fouls)   FT 1/2: GOOD   FT 2/2: GOOD Kyle Green makes 2/2 from the line.
Score: 89-73

[00:04] Team_068 possession (Score: 89-73)
Cole Anthony makes the Layup and draws the foul on Kyle Green! And-1! Cole Anthony to the line for 1. [BONUS: 9 team fouls] (Kyle Green: 1 personal fouls)   FT 1/1: GOOD Cole Anthony makes 1/1 from the line.
Score: 89-76

================================================================================
                              3RD QUARTER COMPLETE                              
================================================================================

3RD QUARTER SCORE: Team_063 26, Team_068 26

BOX SCORE:
================================================================================

Team_063
--------------------------------------------------------------------------------
Player                MIN  PTS  REB  AST  TO      FG   FG%      3P   3P%
--------------------------------------------------------------------------------
Dirk Reaves            24    9    3    0   0   4/5    80.0     0/0   0.0
Tyler Harris           24    6    4    0   0   3/6    50.0     0/0   0.0
Cole Durant            13    4    0    0   0   2/2   100.0     0/0   0.0
Bradley Davis          24    3    0    0   0   1/1   100.0     0/0   0.0
Malcolm Quickley       24    2    2    2   0   1/2    50.0     0/0   0.0
Kyle Green             13    2    1    0   0   1/1   100.0     0/0   0.0
Terry Reaves           24    0    0    1   0   0/2     0.0     0/0   0.0
DeMar Banchero         13    0    0    1   0   0/1     0.0     0/0   0.0

TEAM: FG: 12/20 (60.0%), 3PT: 4/6 (66.7%), REB: 11 (3 off, 8 def), AST: 4, TO: 5
TEAM FOULS: 9 [Team_068 in BONUS]


Team_068
--------------------------------------------------------------------------------
Player                MIN  PTS  REB  AST  TO      FG   FG%      3P   3P%
--------------------------------------------------------------------------------
Jaren Johnson          24    7    2    2   0   3/3   100.0     0/0   0.0
Zion Anunoby           24    6    0    1   0   2/4    50.0     0/0   0.0
Cole Anthony           13    6    0    0   0   2/2   100.0     0/0   0.0
Nikola Ginobili        24    4    2    0   0   2/4    50.0     0/0   0.0
Franz Curry            13    2    0    0   0   1/2    50.0     0/0   0.0
Jarrett Oladipo        13    1    0    0   0   1/1   100.0     0/0   0.0
Gary Simons            24    0    3    2   0   0/0     0.0     0/0   0.0
Malcolm Herro          24    0    0    0   0   0/3     0.0     0/0   0.0
Ja Banchero            13    0    1    0   0   0/0     0.0     0/0   0.0
Miles Murray           13    0    0    1   0   0/0     0.0     0/0   0.0

TEAM: FG: 11/19 (57.9%), 3PT: 2/6 (33.3%), REB: 7 (0 off, 7 def), AST: 6, TO: 6
TEAM FOULS: 9 [Team_063 in BONUS]

================================================================================

================================================================================
                       4TH QUARTER - Team_063 vs Team_068                       
================================================================================

[12:00] Team_063 possession (Score: 89-76)
Tyler Harris attempts a Midrange. Contested by Nikola Ginobili (4.1 feet, MAN). Tyler Harris misses. Rebound secured by Jaren Johnson.

[11:49] Team_068 possession (Score: 89-76)
Jaren Johnson attempts a 3Pt. Contested by Terry Reaves (5.1 feet, MAN). JAREN JOHNSON MAKES IT! Assist: Zion Anunoby
Score: 89-79

[11:38] Team_063 possession (Score: 89-79)
Tyler Harris drives and kicks out. Terry Reaves attempts a 3Pt. Contested by Jaren Johnson (3.7 feet, MAN). Terry Reaves misses. Rebound secured by Jaren Johnson.

[11:23] Team_068 possession (Score: 89-79)
Jaren Johnson drives to the basket... FOUL! Offensive foul on Jaren Johnson! Terry Reaves drew the charge! [Team fouls: 1] (Jaren Johnson: 1 personal fouls) TURNOVER! (dead ball)

[11:11] Team_063 possession (Score: 89-79)
Bradley Davis attempts a 3Pt. Contested by Gary Simons (3.6 feet, ZONE). Bradley Davis misses. Rebound secured by Gary Simons.

[10:58] Team_068 possession (Score: 89-79)
Nikola Ginobili drives and kicks out. Jaren Johnson attempts a 3Pt. Contested by Terry Reaves (4.8 feet, ZONE). JAREN JOHNSON MAKES IT! Assist: Zion Anunoby
Score: 89-82

[10:40] Team_063 possession (Score: 89-82)
Dirk Reaves drives and kicks out. Terry Reaves attempts a Midrange. Contested by Gary Simons (3.4 feet, ZONE). Terry Reaves misses. Rebound secured by Jaren Johnson.

[10:21] Team_068 possession (Score: 89-82)
Zion Anunoby attempts a 3Pt. BLOCKED BY BRADLEY DAVIS! Ball is loose! Rebound secured by Dirk Reaves.

[10:08] Team_063 possession (Score: 89-82)
FOUL! Shooting foul on Zion Anunoby. Dirk Reaves to the line for 3 free throws. [Team fouls: 2] (Zion Anunoby: 1 personal fouls)   FT 1/3: GOOD   FT 2/3: MISS   FT 3/3: MISS Dirk Reaves makes 1/3 from the line. Rebound secured by Gary Simons.
Score: 90-82

[09:52] Team_068 possession (Score: 90-82)
Gary Simons drives, Dirk Reaves stays with him. Gary Simons attempts a Layup. Contested by Dirk Reaves (4.7 feet, MAN). GARY SIMONS MAKES IT! Assist: Malcolm Herro
Score: 90-84

[09:37] Team_063 possession (Score: 90-84)
Bradley Davis throws a bad pass! Stolen by Zion Anunoby! TURNOVER! (live ball)

[09:24] Team_068 possession (Score: 90-84)
Zion Anunoby drives and kicks out. Zion Anunoby attempts a 3Pt. Contested by Malcolm Quickley (3.8 feet, ZONE). ZION ANUNOBY MAKES IT! Assist: Gary Simons
Score: 90-87

[09:07] Team_063 possession (Score: 90-87)
Bradley Davis attempts a Midrange. Contested by Jaren Johnson (4.1 feet, ZONE). Bradley Davis misses. Rebound secured by Nikola Ginobili.

[08:53] Team_068 possession (Score: 90-87)
Jaren Johnson attempts a Midrange. Contested by Terry Reaves (5.4 feet, MAN). JAREN JOHNSON MAKES IT!
Score: 90-89

[08:40] Team_063 possession (Score: 90-89)
FOUL! Holding foul on Jaren Johnson. [Team fouls: 3] No free throws, side out. (Jaren Johnson: 2 personal fouls)

[08:25] Team_063 possession (Score: 90-89)
Tyler Harris makes the Midrange and draws the foul on Nikola Ginobili! And-1! Tyler Harris to the line for 1. [Team fouls: 4] (Nikola Ginobili: 1 personal fouls)   FT 1/1: GOOD Tyler Harris makes 1/1 from the line.
Score: 93-89

[08:12] Team_068 possession (Score: 93-89)
FOUL! Shooting foul on Tyler Harris. Gary Simons to the line for 2 free throws. [Team fouls: 1] (Tyler Harris: 1 personal fouls)   FT 1/2: GOOD   FT 2/2: GOOD Gary Simons makes 2/2 from the line.
Score: 93-91

[07:55] Team_063 possession (Score: 93-91)
Tyler Harris attempts a 3Pt. Contested by Jaren Johnson (4.0 feet, ZONE). Tyler Harris misses. Rebound secured by Nikola Ginobili.

[07:41] Team_068 possession (Score: 93-91)
Malcolm Herro attempts a 3Pt. Contested by Malcolm Quickley (4.0 feet, ZONE). Malcolm Herro misses. Rebound secured by Tyler Harris.

[07:27] Team_063 possession (Score: 93-91)
Tyler Harris drives, picks up Gary Simons. Help arrives from Malcolm Herro! Tyler Harris attempts a Dunk. Contested by Malcolm Herro (3.8 feet, ZONE). TYLER HARRIS MAKES IT! Assist: Dirk Reaves
Score: 95-91

[07:10] Team_068 possession (Score: 95-91)
Zion Anunoby throws a bad pass! Stolen by Bradley Davis! TURNOVER! (live ball)

[07:01] Team_063 possession (Score: 95-91)
Dirk Reaves attempts a 3Pt. Contested by Gary Simons (4.1 feet, MAN). Dirk Reaves misses. Rebound secured by Nikola Ginobili.

[06:43] Team_068 possession (Score: 95-91)
Gary Simons drives to the basket... Gary Simons commits a violation (traveling/carry)! TURNOVER! (dead ball)

[06:43] Substitution (Team_063): Bradley Davis OUT → DeMar Banchero IN (stamina_rule2)

[06:43] Substitution (Team_063): Malcolm Quickley OUT → Cole Durant IN (stamina_rule2)

[06:43] Substitution (Team_063): Terry Reaves OUT → Jaren James IN (stamina_rule2)

[06:43] Substitution (Team_063): Dirk Reaves OUT → Lamelo Ball IN (stamina_rule2)

[06:43] Substitution (Team_063): Tyler Harris OUT → Kyle Green IN (stamina_rule2)

[06:43] Substitution (Team_068): Zion Anunoby OUT → Cole Anthony IN (stamina_rule2)

[06:43] Substitution (Team_068): Malcolm Herro OUT → Ja Banchero IN (stamina_rule2)

[06:43] Substitution (Team_068): Jaren Johnson OUT → Miles Murray IN (stamina_rule2)

[06:43] Substitution (Team_068): Gary Simons OUT → Jarrett Oladipo IN (stamina_rule2)

[06:43] Substitution (Team_068): Nikola Ginobili OUT → Franz Curry IN (stamina_rule2)

[06:27] Team_063 possession (Score: 95-91)
DeMar Banchero attempts a Layup. Contested by Franz Curry (4.7 feet, ZONE). DEMAR BANCHERO MAKES IT!
Score: 97-91

[06:15] Team_068 possession (Score: 97-91)
Franz Curry attempts a Midrange. Contested by Kyle Green (4.9 feet, MAN). FRANZ CURRY MAKES IT! Assist: Ja Banchero
Score: 97-93

[06:02] Team_063 possession (Score: 97-93)
Cole Durant attempts a 3Pt. Contested by Ja Banchero (5.5 feet, ZONE). Cole Durant misses. Offensive rebound by Kyle Green! Kyle Green puts it back in!
Score: 99-93

[05:48] Team_068 possession (Score: 99-93)
Cole Anthony attempts a Midrange. Contested by DeMar Banchero (3.8 feet, MAN). COLE ANTHONY MAKES IT! Assist: Miles Murray
Score: 99-95

[05:32] Team_063 possession (Score: 99-95)
Jaren James attempts a 3Pt. Contested by Ja Banchero (5.3 feet, ZONE). JAREN JAMES MAKES IT! Assist: DeMar Banchero
Score: 102-95

[05:18] Team_068 possession (Score: 102-95)
Cole Anthony attempts a Layup. Contested by Lamelo Ball (4.6 feet, ZONE). Cole Anthony misses. Offensive rebound by Franz Curry! Franz Curry puts it back in!
Score: 102-97

[05:03] Team_063 possession (Score: 102-97)
Lamelo Ball attempts a 3Pt. Contested by Jarrett Oladipo (4.1 feet, MAN). Lamelo Ball misses. Rebound secured by Jarrett Oladipo.

[04:48] Team_068 possession (Score: 102-97)
Cole Anthony attempts a 3Pt. Contested by DeMar Banchero (3.8 feet, ZONE). COLE ANTHONY MAKES IT! Assist: Miles Murray
Score: 102-100

[04:32] Team_063 possession (Score: 102-100)
FOUL! Reach-in foul on Franz Curry during the drive. [IN THE BONUS! 5 team fouls] Kyle Green to the line for 2 free throws. (Franz Curry: 1 personal fouls)   FT 1/2: GOOD   FT 2/2: GOOD Kyle Green makes 2/2 from the line.
Score: 104-100

[04:20] Team_068 possession (Score: 104-100)
FOUL! Holding foul on DeMar Banchero. [Team fouls: 2] No free throws, side out. (DeMar Banchero: 1 personal fouls)

[04:08] Team_068 possession (Score: 104-100)
Miles Murray drives to the basket... Miles Murray loses the ball! Stripped by Jaren James! TURNOVER! (live ball)

[03:53] Team_063 possession (Score: 104-100)
FOUL! Shooting foul on Franz Curry. Jaren James to the line for 2 free throws. [BONUS: 6 team fouls] (Franz Curry: 2 personal fouls)   FT 1/2: GOOD   FT 2/2: GOOD Jaren James makes 2/2 from the line.
Score: 106-100

[03:42] Team_068 possession (Score: 106-100)
Jarrett Oladipo attempts a 3Pt. Contested by DeMar Banchero (4.3 feet, ZONE). Jarrett Oladipo misses. Offensive rebound by Franz Curry! Franz Curry's putback is no good. Rebound secured by Kyle Green.

[03:31] Team_063 possession (Score: 106-100)
Jaren James attempts a 3Pt. Contested by Ja Banchero (5.3 feet, ZONE). Jaren James misses. Rebound secured by Ja Banchero.

[03:20] Team_068 possession (Score: 106-100)
Ja Banchero attempts a 3Pt. Contested by DeMar Banchero (4.1 feet, ZONE). JA BANCHERO MAKES IT! Assist: Miles Murray
Score: 106-103

[03:03] Team_063 possession (Score: 106-103)
Cole Durant attempts a 3Pt. Contested by Ja Banchero (5.5 feet, MAN). COLE DURANT MAKES IT! Assist: Lamelo Ball
Score: 109-103

[02:46] Team_068 possession (Score: 109-103)
FOUL! Reach-in foul on Kyle Green during the drive. [Team fouls: 3] No free throws, side out. (Kyle Green: 1 personal fouls)

[02:33] Team_068 possession (Score: 109-103)
FOUL! Offensive foul on Jarrett Oladipo! Lamelo Ball drew the charge! [Team fouls: 7] (Jarrett Oladipo: 1 personal fouls) TURNOVER! (dead ball)

[02:18] Team_063 possession (Score: 109-103)
DeMar Banchero attempts a Midrange. Contested by Cole Anthony (5.1 feet, MAN). DeMar Banchero misses. Rebound secured by Jarrett Oladipo.

[02:05] Team_068 possession (Score: 109-103)
Ja Banchero attempts a Midrange. Contested by Cole Durant (4.3 feet, MAN). JA BANCHERO MAKES IT! Assist: Jarrett Oladipo
Score: 109-105

[01:51] Team_063 possession (Score: 109-105)
Jaren James attempts a Midrange. Contested by Miles Murray (4.0 feet, MAN). Jaren James misses. Offensive rebound by Lamelo Ball! Lamelo Ball kicks it out.

[01:41] Team_063 possession (Score: 109-105)
Cole Durant drives and kicks out. Cole Durant attempts a Midrange. Contested by Ja Banchero (5.1 feet, MAN). COLE DURANT MAKES IT! Assist: Jaren James
Score: 111-105

[01:26] Team_068 possession (Score: 111-105)
Franz Curry attempts a Layup. Contested by Kyle Green (4.9 feet, ZONE). FRANZ CURRY MAKES IT!
Score: 111-107

[01:14] Team_063 possession (Score: 111-107)
Lamelo Ball drives, Franz Curry stays with him. Lamelo Ball attempts a Layup. Contested by Franz Curry (4.7 feet, ZONE). LAMELO BALL MAKES IT! Assist: Jaren James
Score: 113-107

[00:59] Team_068 possession (Score: 113-107)
Jarrett Oladipo drives, picks up Lamelo Ball. Help arrives from Cole Durant! Jarrett Oladipo attempts a Dunk. Contested by Cole Durant (5.1 feet, ZONE). JARRETT OLADIPO MAKES IT! Assist: Franz Curry
Score: 113-109

[00:44] Team_063 possession (Score: 113-109)
DeMar Banchero attempts a 3Pt. Contested by Cole Anthony (5.1 feet, MAN). DEMAR BANCHERO MAKES IT!
Score: 116-109

[00:31] Team_068 possession (Score: 116-109)
Ja Banchero attempts a 3Pt. Contested by DeMar Banchero (4.1 feet, ZONE). Ja Banchero misses. Rebound secured by Kyle Green.

[00:14] Team_063 possession (Score: 116-109)
Kyle Green attempts a 3Pt. Contested by Franz Curry (4.5 feet, MAN). Kyle Green misses. FOUL! Loose ball foul on Franz Curry during the rebound battle. [IN THE BONUS! 8 team fouls] Lamelo Ball to the line for 2 free throws. (Franz Curry: 3 personal fouls)   FT 1/2: MISS   FT 2/2: MISS Lamelo Ball makes 0/2 from the line. Rebound secured by Franz Curry.

================================================================================
                              4TH QUARTER COMPLETE                              
================================================================================

4TH QUARTER SCORE: Team_063 27, Team_068 33

BOX SCORE:
================================================================================

Team_063
--------------------------------------------------------------------------------
Player                MIN  PTS  REB  AST  TO      FG   FG%      3P   3P%
--------------------------------------------------------------------------------
Franz Curry            19    6    2    1   0   3/3   100.0     0/0   0.0
Tyler Harris           29    5    1    0   0   2/5    40.0     0/0   0.0
DeMar Banchero         19    5    0    1   0   2/3    66.7     0/0   0.0
Jaren James            19    5    0    2   0   2/3    66.7     0/0   0.0
Cole Durant            19    5    0    0   0   2/2   100.0     0/0   0.0
Kyle Green             19    4    3    0   0   2/3    66.7     0/0   0.0
Lamelo Ball            19    2    1    1   0   1/2    50.0     0/0   0.0
Bradley Davis          29    0    0    0   0   0/2     0.0     0/0   0.0
Dirk Reaves            29    0    1    1   0   0/3     0.0     0/0   0.0

TEAM: FG: 11/23 (47.8%), 3PT: 4/11 (36.4%), REB: 6 (3 off, 3 def), AST: 5, TO: 1
TEAM FOULS: 3


Team_068
--------------------------------------------------------------------------------
Player                MIN  PTS  REB  AST  TO      FG   FG%      3P   3P%
--------------------------------------------------------------------------------
Jaren Johnson          29    8    3    0   0   3/3   100.0     0/0   0.0
Ja Banchero            19    5    1    1   0   2/3    66.7     0/0   0.0
Cole Anthony           19    5    0    0   0   2/2   100.0     0/0   0.0
Gary Simons            29    4    2    1   0   2/2   100.0     0/0   0.0
Zion Anunoby           29    3    0    2   0   1/2    50.0     0/0   0.0
Jarrett Oladipo        19    2    2    1   0   1/2    50.0     0/0   0.0
Malcolm Herro          29    0    0    1   0   0/1     0.0     0/0   0.0
Nikola Ginobili        29    0    3    0   0   0/0     0.0     0/0   0.0
Miles Murray           19    0    0    3   0   0/0     0.0     0/0   0.0

TEAM: FG: 14/18 (77.8%), 3PT: 3/7 (42.9%), REB: 13 (2 off, 11 def), AST: 10, TO: 5
TEAM FOULS: 8 [Team_063 in BONUS]

================================================================================

================================================================================
                               FULL GAME COMPLETE                               
================================================================================

FINAL SCORE: Team_063 116, Team_068 109

SCORING BY QUARTER:
--------------------------------------------------------------------------------
Team                     Q1     Q2     Q3     Q4    FINAL
--------------------------------------------------------------------------------
Team_063                 30     33     26     27      116
Team_068                 29     21     26     33      109
--------------------------------------------------------------------------------

FULL GAME BOX SCORE:
================================================================================

Team_063
--------------------------------------------------------------------------------
Player                MIN  PTS  REB  AST  TO      FG   FG%      3P   3P%      FT STL BLK
--------------------------------------------------------------------------------
Bradley Davis          29    9    0    1   3   3/5    60.0   0/1     0.0   3/3     1   1
Malcolm Quickley       29    4    6    3   1   4/8    50.0   1/4    25.0   5/7     0   0
Terry Reaves           29    3    0    2   2   0/4     0.0   0/2     0.0   2/4     1   0
Dirk Reaves            29   22    7    3   1  10/14   71.4   3/5    60.0   6/8     2   0
Tyler Harris           29   21    9    2   1   8/16   50.0   1/2    50.0   5/5     0   0
DeMar Banchero         19   12    0    3   0   5/7    71.4   2/3    66.7   1/1     0   0
Cole Durant            19   11    3    2   0   6/7    85.7   2/3    66.7   2/2     1   0
Jaren James            19    5    0    3   1   3/7    42.9   2/3    66.7   3/4     1   0
Lamelo Ball            19   15    5    3   0   3/6    50.0   2/3    66.7   4/6     0   1
Kyle Green             19   10    5    1   1   3/5    60.0   0/1     0.0   4/4     2   1

TEAM: FG: 48/84 (57.1%), 3PT: 13/27 (48.1%), REB: 34 (10 off, 24 def), AST: 23, TO: 10


Team_068
--------------------------------------------------------------------------------
Player                MIN  PTS  REB  AST  TO      FG   FG%      3P   3P%      FT STL BLK
--------------------------------------------------------------------------------
Zion Anunoby           29   18    0    5   2   6/9    66.7   2/3    66.7   2/4     1   0
Malcolm Herro          29    4    0    3   2   3/11   27.3   1/6    16.7   0/0     1   0
Jaren Johnson          29   18    9    4   0   8/10   80.0   2/2   100.0   2/3     0   0
Gary Simons            29   11    8    4   4   5/7    71.4   0/1     0.0   3/3     2   1
Nikola Ginobili        29   12   10    1   3   5/7    71.4   0/1     0.0   2/2     0   1
Cole Anthony           19   18    0    1   0   8/10   80.0   3/5    60.0   6/6     0   0
Ja Banchero            19   10    4    1   1   4/5    80.0   1/2    50.0   1/1     0   0
Miles Murray           19    0    0    5   2   1/1   100.0   0/0     0.0   0/0     0   0
Jarrett Oladipo        19    5    7    2   3   2/5    40.0   0/1     0.0   1/2     0   0
Franz Curry            19   12    6    2   1   4/7    57.1   0/0     0.0   2/2     1   0

TEAM: FG: 47/73 (64.4%), 3PT: 9/21 (42.9%), REB: 44 (10 off, 34 def), AST: 28, TO: 18

================================================================================
