================================================================================
                        FULL GAME - Team_034 vs Team_097                        
================================================================================

================================================================================
                       1ST QUARTER - Team_034 vs Team_097                       
================================================================================

[12:00] Team_034 possession (Score: 0-0)
Anthony Bane attempts a Midrange. Contested by Tyrese Stewart (5.4 feet, ZONE). Anthony Bane misses. Offensive rebound by Terry Doncic! Terry Doncic puts it back in!
Score: 2-0

[11:43] Team_097 possession (Score: 2-0)
Jrue Haliburton drives, picks up Ben Hyland. Help arrives from Cole Antetokounmpo! Jrue Haliburton attempts a Dunk. Contested by Cole Antetokounmpo (4.0 feet, MAN). Jrue Haliburton misses. Rebound secured by Terry Doncic.

[11:29] Team_034 possession (Score: 2-0)
Anthony Bane throws a bad pass out of bounds! TURNOVER! (dead ball)

[11:15] Team_097 possession (Score: 2-0)
Evan Brogdon attempts a 3Pt. Contested by Devin Poole (4.6 feet, ZONE). EVAN BROGDON MAKES IT! Assist: Shai Poole
Score: 2-3

[11:00] Team_034 possession (Score: 2-3)
Terry Doncic attempts a Midrange. Contested by Shai Poole (3.5 feet, ZONE). TERRY DONCIC MAKES IT! Assist: Cole Antetokounmpo
Score: 4-3

[10:42] Team_097 possession (Score: 4-3)
Evan Brogdon attempts a 3Pt. Contested by Devin Poole (4.6 feet, ZONE). Evan Brogdon misses. Rebound secured by Anthony Bane.

[10:28] Team_034 possession (Score: 4-3)
Cole Antetokounmpo drives to the basket... Cole Antetokounmpo throws a bad pass! Stolen by Shai Poole! TURNOVER! (live ball)

[10:12] Team_097 possession (Score: 4-3)
FOUL! Reach-in foul on Terry Doncic during the drive. [Team fouls: 1] No free throws, side out. (Terry Doncic: 1 personal fouls)

[10:00] Team_097 possession (Score: 4-3)
Jrue Haliburton attempts a Layup. BLOCKED BY TERRY DONCIC! Ball deflects out of bounds off Jrue Haliburton.

[09:43] Team_034 possession (Score: 4-3)
FOUL! Offensive foul on Cole Antetokounmpo! Shai Poole drew the charge! [Team fouls: 2] (Cole Antetokounmpo: 1 personal fouls) TURNOVER! (dead ball)

[09:27] Team_097 possession (Score: 4-3)
Jrue Haliburton attempts a 3Pt. Contested by Ben Hyland (4.0 feet, ZONE). Jrue Haliburton misses. Rebound secured by Terry Doncic.

[09:14] Team_034 possession (Score: 4-3)
Anthony Bane drives and kicks out. Devin Poole attempts a 3Pt. Contested by Shai Poole (3.4 feet, ZONE). Devin Poole misses. Rebound secured by Anthony Haliburton.

[09:03] Team_097 possession (Score: 4-3)
Anthony Haliburton attempts a Midrange. Contested by Terry Doncic (4.5 feet, MAN). Anthony Haliburton misses. Rebound secured by Terry Doncic.

[08:54] Team_034 possession (Score: 4-3)
Cole Antetokounmpo attempts a 3Pt. Contested by Shai Poole (3.9 feet, ZONE). Cole Antetokounmpo misses. Offensive rebound by Terry Doncic! Terry Doncic's putback is no good. Rebound secured by Tyrese Stewart.

[08:38] Team_097 possession (Score: 4-3)
FOUL! Offensive foul on Jrue Haliburton! Ben Hyland drew the charge! [Team fouls: 1] (Jrue Haliburton: 1 personal fouls) TURNOVER! (dead ball)

[08:20] Team_034 possession (Score: 4-3)
Anthony Bane drives, picks up Anthony Haliburton. Help arrives from Jrue Haliburton! Anthony Bane attempts a Dunk. Contested by Jrue Haliburton (3.4 feet, MAN). ANTHONY BANE MAKES IT! Assist: Devin Poole
Score: 6-3

[08:07] Team_097 possession (Score: 6-3)
Evan Brogdon attempts a 3Pt. Contested by Devin Poole (4.6 feet, ZONE). EVAN BROGDON MAKES IT! Assist: Jrue Haliburton
Score: 6-6

[07:58] Team_034 possession (Score: 6-6)
Terry Doncic attempts a 3Pt. Contested by Jrue Haliburton (5.3 feet, ZONE). Terry Doncic misses. Rebound secured by Anthony Haliburton.

[07:45] Team_097 possession (Score: 6-6)
Tyrese Stewart drives, picks up Anthony Bane. Help arrives from Ben Hyland! Tyrese Stewart attempts a Layup. Wide open! Ben Hyland is 6.0 feet away. [MAN] Tyrese Stewart misses. Rebound secured by Terry Doncic.

[07:32] Team_034 possession (Score: 6-6)
Anthony Bane makes the Layup and draws the foul on Anthony Haliburton! And-1! Anthony Bane to the line for 1. [Team fouls: 2] (Anthony Haliburton: 1 personal fouls)   FT 1/1: GOOD Anthony Bane makes 1/1 from the line.
Score: 9-6

[07:14] Team_097 possession (Score: 9-6)
Evan Brogdon drives, Terry Doncic stays with him. Evan Brogdon attempts a Dunk. Contested by Terry Doncic (4.7 feet, ZONE). Evan Brogdon misses. Rebound secured by Cole Antetokounmpo.

[06:56] Team_034 possession (Score: 9-6)
Anthony Bane attempts a Layup. Contested by Anthony Haliburton (3.4 feet, MAN). ANTHONY BANE MAKES IT! Assist: Devin Poole
Score: 11-6

[06:37] Team_097 possession (Score: 11-6)
FOUL! Shooting foul on Ben Hyland. Tyrese Stewart to the line for 2 free throws. [Team fouls: 3] (Ben Hyland: 1 personal fouls)   FT 1/2: GOOD   FT 2/2: MISS Tyrese Stewart makes 1/2 from the line. Rebound secured by Cole Antetokounmpo.
Score: 11-7

[06:25] Team_034 possession (Score: 11-7)
Devin Poole throws a bad pass! Stolen by Evan Brogdon! TURNOVER! (live ball)

[06:09] Team_097 possession (Score: 11-7)
Anthony Haliburton makes the Layup and draws the foul on Terry Doncic! And-1! Anthony Haliburton to the line for 1. [Team fouls: 4] (Terry Doncic: 2 personal fouls)   FT 1/1: GOOD Anthony Haliburton makes 1/1 from the line.
Score: 11-10

[05:52] Team_034 possession (Score: 11-10)
Cole Antetokounmpo attempts a Layup. Contested by Shai Poole (3.9 feet, MAN). Cole Antetokounmpo misses. Rebound secured by Anthony Haliburton.

[05:35] Team_097 possession (Score: 11-10)
FOUL! Shooting foul on Ben Hyland. Evan Brogdon to the line for 2 free throws. [BONUS: 5 team fouls] (Ben Hyland: 2 personal fouls)   FT 1/2: GOOD   FT 2/2: GOOD Evan Brogdon makes 2/2 from the line.
Score: 11-12

[05:23] Team_034 possession (Score: 11-12)
Devin Poole drives, Anthony Haliburton stays with him. Devin Poole attempts a Dunk. Contested by Anthony Haliburton (3.2 feet, ZONE). DEVIN POOLE MAKES IT!
Score: 13-12

[05:13] Team_097 possession (Score: 13-12)
Tyrese Stewart loses control! Ball rolls out of bounds! TURNOVER! (dead ball)

[04:58] Team_034 possession (Score: 13-12)
Anthony Bane makes the Midrange and draws the foul on Anthony Haliburton! And-1! Anthony Bane to the line for 1. [Team fouls: 3] (Anthony Haliburton: 2 personal fouls)   FT 1/1: GOOD Anthony Bane makes 1/1 from the line.
Score: 16-12

[04:40] Team_097 possession (Score: 16-12)
Shai Poole drives, Cole Antetokounmpo stays with him. Shai Poole attempts a Dunk. Contested by Cole Antetokounmpo (5.1 feet, MAN). Shai Poole misses. Rebound secured by Anthony Bane.

[04:23] Team_034 possession (Score: 16-12)
Cole Antetokounmpo attempts a 3Pt. Contested by Shai Poole (3.9 feet, ZONE). COLE ANTETOKOUNMPO MAKES IT! Assist: Terry Doncic
Score: 19-12

[04:04] Team_097 possession (Score: 19-12)
Jrue Haliburton drives to the basket... Jrue Haliburton loses control! Ball rolls out of bounds! TURNOVER! (dead ball)

[03:48] Team_034 possession (Score: 19-12)
Cole Antetokounmpo attempts a 3Pt. Contested by Shai Poole (3.9 feet, ZONE). Cole Antetokounmpo misses. Rebound secured by Tyrese Stewart.

[03:31] Team_097 possession (Score: 19-12)
Shai Poole attempts a 3Pt. Contested by Cole Antetokounmpo (5.2 feet, MAN). SHAI POOLE MAKES IT! Assist: Anthony Haliburton
Score: 19-15

[03:18] Team_034 possession (Score: 19-15)
Devin Poole attempts a Midrange. Contested by Jrue Haliburton (5.2 feet, ZONE). Devin Poole misses. Rebound secured by Anthony Haliburton.

[03:00] Team_097 possession (Score: 19-15)
Tyrese Stewart drives, Terry Doncic stays with him. Tyrese Stewart attempts a Layup. Contested by Terry Doncic (5.1 feet, ZONE). TYRESE STEWART MAKES IT!
Score: 19-17

[02:45] Team_034 possession (Score: 19-17)
Cole Antetokounmpo attempts a Layup. Contested by Anthony Haliburton (4.0 feet, ZONE). Cole Antetokounmpo misses. Offensive rebound by Terry Doncic! Terry Doncic puts it back in!
Score: 21-17

[02:32] Team_097 possession (Score: 21-17)
Shai Poole drives, picks up Cole Antetokounmpo. Help arrives from Ben Hyland! Shai Poole attempts a Dunk. Contested by Ben Hyland (5.3 feet, MAN). Shai Poole misses. Rebound secured by Terry Doncic.

[02:15] Team_034 possession (Score: 21-17)
Anthony Bane drives, picks up Tyrese Stewart. Help arrives from Jrue Haliburton! Anthony Bane attempts a Layup. Contested by Jrue Haliburton (5.6 feet, ZONE). Anthony Bane misses. Rebound secured by Shai Poole.

[02:00] Team_097 possession (Score: 21-17)
Jrue Haliburton attempts a 3Pt. Contested by Devin Poole (4.7 feet, ZONE). JRUE HALIBURTON MAKES IT! Assist: Tyrese Stewart
Score: 21-20

[01:46] Team_034 possession (Score: 21-20)
Terry Doncic attempts a Midrange. Contested by Anthony Haliburton (3.7 feet, MAN). Terry Doncic misses. Rebound secured by Tyrese Stewart.

[01:32] Team_097 possession (Score: 21-20)
FOUL! Shooting foul on Terry Doncic. Anthony Haliburton to the line for 2 free throws. [BONUS: 6 team fouls] (Terry Doncic: 3 personal fouls)   FT 1/2: GOOD   FT 2/2: GOOD Anthony Haliburton makes 2/2 from the line.
Score: 21-22

[01:16] Team_034 possession (Score: 21-22)
Ben Hyland commits a violation (traveling/carry)! TURNOVER! (dead ball)

[01:16] Substitution (Team_034): Devin Poole OUT → Manu Jokic IN (stamina_rule2)

[01:16] Substitution (Team_034): Ben Hyland OUT → Damian Turner IN (stamina_rule2)

[01:16] Substitution (Team_034): Cole Antetokounmpo OUT → Vince Paul IN (stamina_rule2)

[01:16] Substitution (Team_034): Terry Doncic OUT → Nikola Wagner IN (stamina_rule2)

[01:16] Substitution (Team_034): Anthony Bane OUT → Carmelo Anunoby IN (stamina_rule2)

[01:16] Substitution (Team_097): Evan Brogdon OUT → Gary Carter IN (stamina_rule2)

[01:16] Substitution (Team_097): Jrue Haliburton OUT → Dwyane Ginobili IN (stamina_rule2)

[01:16] Substitution (Team_097): Shai Poole OUT → Miles Dosunmu IN (stamina_rule2)

[01:16] Substitution (Team_097): Anthony Haliburton OUT → Joel Simons IN (stamina_rule2)

[01:16] Substitution (Team_097): Tyrese Stewart OUT → Miles Banchero IN (stamina_rule2)

[01:06] Team_097 possession (Score: 21-22)
Miles Banchero attempts a Layup. Contested by Carmelo Anunoby (5.6 feet, MAN). Miles Banchero misses. Rebound secured by Nikola Wagner.

[00:51] Team_034 possession (Score: 21-22)
Damian Turner attempts a 3Pt. Contested by Joel Simons (4.0 feet, ZONE). Damian Turner misses. Rebound secured by Joel Simons.

[00:38] Team_097 possession (Score: 21-22)
Joel Simons attempts a 3Pt. Contested by Vince Paul (4.4 feet, ZONE). JOEL SIMONS MAKES IT! Assist: Gary Carter
Score: 21-25

[00:21] Team_034 possession (Score: 21-25)
Carmelo Anunoby attempts a Midrange. Contested by Joel Simons (3.7 feet, ZONE). CARMELO ANUNOBY MAKES IT!
Score: 23-25

[00:04] Team_097 possession (Score: 23-25)
Miles Dosunmu drives and kicks out. Miles Dosunmu attempts a 3Pt. Contested by Vince Paul (4.2 feet, MAN). Miles Dosunmu misses. Offensive rebound by Miles Dosunmu! Miles Dosunmu kicks it out.

================================================================================
                              1ST QUARTER COMPLETE                              
================================================================================

1ST QUARTER SCORE: Team_034 23, Team_097 25

BOX SCORE:
================================================================================

Team_034
--------------------------------------------------------------------------------
Player                MIN  PTS  REB  AST  TO      FG   FG%      3P   3P%
--------------------------------------------------------------------------------
Anthony Bane           11   10    2    0   0   4/6    66.7     0/0   0.0
Terry Doncic           11    6    7    1   0   3/5    60.0     0/0   0.0
Cole Antetokounmpo     11    3    2    1   0   1/4    25.0     0/0   0.0
Devin Poole            11    2    0    2   0   1/2    50.0     0/0   0.0
Carmelo Anunoby         1    2    0    0   0   1/1   100.0     0/0   0.0
Nikola Wagner           1    0    1    0   0   0/0     0.0     0/0   0.0
Damian Turner           1    0    0    0   0   0/1     0.0     0/0   0.0

TEAM: FG: 10/19 (52.6%), 3PT: 1/5 (20.0%), REB: 13 (3 off, 10 def), AST: 4, TO: 5
TEAM FOULS: 6 [Team_097 in BONUS]


Team_097
--------------------------------------------------------------------------------
Player                MIN  PTS  REB  AST  TO      FG   FG%      3P   3P%
--------------------------------------------------------------------------------
Evan Brogdon           11    8    0    0   0   3/5    60.0     0/0   0.0
Anthony Haliburton     11    5    4    1   0   2/3    66.7     0/0   0.0
Jrue Haliburton        11    3    0    1   0   1/4    25.0     0/0   0.0
Shai Poole             11    3    1    1   0   1/3    33.3     0/0   0.0
Joel Simons             1    3    1    0   0   1/1   100.0     0/0   0.0
Tyrese Stewart         11    2    3    1   0   1/3    33.3     0/0   0.0
Miles Banchero          1    0    0    0   0   0/1     0.0     0/0   0.0
Gary Carter             1    0    0    1   0   0/0     0.0     0/0   0.0
Miles Dosunmu           1    0    1    0   0   0/0     0.0     0/0   0.0

TEAM: FG: 9/20 (45.0%), 3PT: 5/7 (71.4%), REB: 9 (1 off, 8 def), AST: 5, TO: 3
TEAM FOULS: 3

================================================================================

================================================================================
                       2ND QUARTER - Team_034 vs Team_097                       
================================================================================

[12:00] Team_034 possession (Score: 23-25)
Terry Doncic makes the Layup and draws the foul on Anthony Haliburton! And-1! Terry Doncic to the line for 1. [Team fouls: 1] (Anthony Haliburton: 1 personal fouls)   FT 1/1: GOOD Terry Doncic makes 1/1 from the line.
Score: 26-25

[11:46] Team_097 possession (Score: 26-25)
FOUL! Shooting foul on Cole Antetokounmpo. Anthony Haliburton to the line for 2 free throws. [Team fouls: 1] (Cole Antetokounmpo: 1 personal fouls)   FT 1/2: GOOD   FT 2/2: GOOD Anthony Haliburton makes 2/2 from the line.
Score: 26-27

[11:27] Team_034 possession (Score: 26-27)
FOUL! Offensive foul on Ben Hyland! Jrue Haliburton drew the charge! [Team fouls: 2] (Ben Hyland: 1 personal fouls) TURNOVER! (dead ball)

[11:11] Team_097 possession (Score: 26-27)
Anthony Haliburton attempts a 3Pt. Contested by Terry Doncic (4.6 feet, MAN). ANTHONY HALIBURTON MAKES IT! Assist: Tyrese Stewart
Score: 26-30

[10:54] Team_034 possession (Score: 26-30)
Anthony Bane attempts a Midrange. Contested by Anthony Haliburton (3.6 feet, MAN). Anthony Bane misses. Rebound secured by Shai Poole.

[10:38] Team_097 possession (Score: 26-30)
Anthony Haliburton throws a bad pass! Stolen by Terry Doncic! TURNOVER! (live ball)

[10:25] Team_034 possession (Score: 26-30)
Anthony Bane makes the Layup and draws the foul on Anthony Haliburton! And-1! Anthony Bane to the line for 1. [Team fouls: 2] (Anthony Haliburton: 2 personal fouls)   FT 1/1: MISS Anthony Bane makes 0/1 from the line. Rebound secured by Tyrese Stewart.
Score: 28-30

[10:13] Team_097 possession (Score: 28-30)
Anthony Haliburton drives and kicks out. Jrue Haliburton attempts a Midrange. Contested by Ben Hyland (3.8 feet, MAN). Jrue Haliburton misses. Rebound secured by Terry Doncic.

[09:56] Team_034 possession (Score: 28-30)
Devin Poole attempts a 3Pt. Contested by Shai Poole (3.6 feet, ZONE). Devin Poole misses. Rebound secured by Tyrese Stewart.

[09:41] Team_097 possession (Score: 28-30)
Anthony Haliburton attempts a Layup. BLOCKED BY BEN HYLAND! Ball is loose! Rebound secured by Anthony Bane.

[09:24] Team_034 possession (Score: 28-30)
Cole Antetokounmpo attempts a Midrange. Contested by Anthony Haliburton (4.1 feet, ZONE). Cole Antetokounmpo misses. FOUL! Loose ball foul on Anthony Haliburton during the rebound battle. [Team fouls: 3] No free throws, side out. (Anthony Haliburton: 3 personal fouls)

[09:08] Team_034 possession (Score: 28-30)
Anthony Bane attempts a Midrange. Contested by Anthony Haliburton (3.8 feet, ZONE). Anthony Bane misses. Rebound secured by Tyrese Stewart.

[08:56] Team_097 possession (Score: 28-30)
Jrue Haliburton drives to the basket... Jrue Haliburton commits a violation (traveling/carry)! TURNOVER! (dead ball)

[08:56] Substitution (Team_034): Devin Poole OUT → Manu Jokic IN (stamina_rule2)

[08:56] Substitution (Team_034): Ben Hyland OUT → Damian Turner IN (stamina_rule2)

[08:56] Substitution (Team_034): Cole Antetokounmpo OUT → Vince Paul IN (stamina_rule2)

[08:56] Substitution (Team_034): Terry Doncic OUT → Nikola Wagner IN (stamina_rule2)

[08:56] Substitution (Team_034): Anthony Bane OUT → Carmelo Anunoby IN (stamina_rule2)

[08:56] Substitution (Team_097): Evan Brogdon OUT → Gary Carter IN (stamina_rule2)

[08:56] Substitution (Team_097): Jrue Haliburton OUT → Dwyane Ginobili IN (stamina_rule2)

[08:56] Substitution (Team_097): Shai Poole OUT → Miles Dosunmu IN (stamina_rule2)

[08:56] Substitution (Team_097): Anthony Haliburton OUT → Joel Simons IN (stamina_rule2)

[08:56] Substitution (Team_097): Tyrese Stewart OUT → Miles Banchero IN (stamina_rule2)

[08:44] Team_034 possession (Score: 28-30)
Nikola Wagner attempts a Midrange. Contested by Joel Simons (3.7 feet, MAN). Nikola Wagner misses. Offensive rebound by Carmelo Anunoby! Carmelo Anunoby kicks it out.

[08:32] Team_034 possession (Score: 28-30)
FOUL! Reach-in foul on Joel Simons during the drive. [Team fouls: 4] No free throws, side out. (Joel Simons: 1 personal fouls)

[08:19] Team_034 possession (Score: 28-30)
Carmelo Anunoby attempts a 3Pt. Contested by Miles Dosunmu (4.0 feet, ZONE). Carmelo Anunoby misses. FOUL! Loose ball foul on Miles Banchero during the rebound battle. [IN THE BONUS! 5 team fouls] Carmelo Anunoby to the line for 2 free throws. (Miles Banchero: 1 personal fouls)   FT 1/2: GOOD   FT 2/2: GOOD Carmelo Anunoby makes 2/2 from the line.
Score: 30-30

[08:03] Team_097 possession (Score: 30-30)
Miles Banchero attempts a Midrange. Contested by Carmelo Anunoby (5.6 feet, MAN). MILES BANCHERO MAKES IT! Assist: Dwyane Ginobili
Score: 30-32

[07:50] Team_034 possession (Score: 30-32)
Manu Jokic drives, Joel Simons stays with him. Manu Jokic attempts a Dunk. Contested by Joel Simons (3.6 feet, ZONE). MANU JOKIC MAKES IT!
Score: 32-32

[07:35] Team_097 possession (Score: 32-32)
Joel Simons attempts a Midrange. Wide open! Nikola Wagner is 6.2 feet away. [MAN] JOEL SIMONS MAKES IT!
Score: 32-34

[07:20] Team_034 possession (Score: 32-34)
Carmelo Anunoby attempts a 3Pt. Contested by Joel Simons (3.7 feet, MAN). Carmelo Anunoby misses. Rebound secured by Miles Dosunmu.

[07:09] Team_097 possession (Score: 32-34)
Joel Simons attempts a 3Pt. Wide open! Nikola Wagner is 6.2 feet away. [MAN] JOEL SIMONS MAKES IT! Assist: Miles Dosunmu
Score: 32-37

[06:55] Team_034 possession (Score: 32-37)
Nikola Wagner drives to the basket... Nikola Wagner loses the ball! Stripped by Miles Banchero! TURNOVER! (live ball)

[06:37] Team_097 possession (Score: 32-37)
Miles Banchero drives and kicks out. Dwyane Ginobili attempts a Midrange. Contested by Damian Turner (5.4 feet, ZONE). DWYANE GINOBILI MAKES IT!
Score: 32-39

[06:22] Team_034 possession (Score: 32-39)
Manu Jokic attempts a 3Pt. Contested by Gary Carter (4.8 feet, MAN). Manu Jokic misses. Rebound secured by Joel Simons.

[06:05] Team_097 possession (Score: 32-39)
Dwyane Ginobili makes the Dunk and draws the foul on Damian Turner! And-1! Dwyane Ginobili to the line for 1. [Team fouls: 3] (Damian Turner: 1 personal fouls)   FT 1/1: GOOD Dwyane Ginobili makes 1/1 from the line.
Score: 32-42

[05:49] Team_034 possession (Score: 32-42)
FOUL! Offensive foul on Nikola Wagner! Joel Simons drew the charge! [Team fouls: 4] (Nikola Wagner: 1 personal fouls) TURNOVER! (dead ball)

[05:37] Team_097 possession (Score: 32-42)
Miles Dosunmu attempts a Midrange. Wide open! Nikola Wagner is 6.5 feet away. [ZONE] MILES DOSUNMU MAKES IT! Assist: Gary Carter
Score: 32-44

[05:22] Team_034 possession (Score: 32-44)
Damian Turner attempts a Midrange. Contested by Dwyane Ginobili (5.0 feet, MAN). Damian Turner misses. Rebound secured by Miles Dosunmu.

[05:04] Team_097 possession (Score: 32-44)
Joel Simons drives, Nikola Wagner stays with him. Joel Simons attempts a Layup. Wide open! Nikola Wagner is 6.2 feet away. [MAN] JOEL SIMONS MAKES IT!
Score: 32-46

[04:52] Team_034 possession (Score: 32-46)
Nikola Wagner drives to the basket... Nikola Wagner commits a violation (traveling/carry)! TURNOVER! (dead ball)

[04:37] Team_097 possession (Score: 32-46)
Dwyane Ginobili attempts a Layup. BLOCKED BY CARMELO ANUNOBY! Ball is loose! Rebound secured by Nikola Wagner.

[04:17] Team_034 possession (Score: 32-46)
Damian Turner attempts a 3Pt. Contested by Joel Simons (4.0 feet, ZONE). DAMIAN TURNER MAKES IT! Assist: Vince Paul
Score: 35-46

[04:02] Team_097 possession (Score: 35-46)
Miles Banchero drives, Carmelo Anunoby stays with him. Miles Banchero attempts a Layup. Contested by Carmelo Anunoby (5.6 feet, MAN). MILES BANCHERO MAKES IT! Assist: Gary Carter
Score: 35-48

[03:49] Team_034 possession (Score: 35-48)
Vince Paul attempts a Midrange. Contested by Miles Dosunmu (4.2 feet, MAN). Vince Paul misses. Rebound secured by Joel Simons.

[03:31] Team_097 possession (Score: 35-48)
FOUL! Reach-in foul on Carmelo Anunoby during the drive. [IN THE BONUS! 5 team fouls] Joel Simons to the line for 2 free throws. (Carmelo Anunoby: 1 personal fouls)   FT 1/2: GOOD   FT 2/2: GOOD Joel Simons makes 2/2 from the line.
Score: 35-50

[03:14] Team_034 possession (Score: 35-50)
Manu Jokic attempts a 3Pt. Contested by Gary Carter (4.8 feet, MAN). Manu Jokic misses. Rebound secured by Joel Simons.

[02:58] Team_097 possession (Score: 35-50)
Gary Carter drives and kicks out. Miles Dosunmu attempts a 3Pt. Contested by Vince Paul (4.2 feet, MAN). Miles Dosunmu misses. Rebound secured by Carmelo Anunoby.

[02:45] Team_034 possession (Score: 35-50)
Nikola Wagner drives, picks up Joel Simons. Help arrives from Dwyane Ginobili! Nikola Wagner attempts a Dunk. Contested by Dwyane Ginobili (3.7 feet, MAN). Nikola Wagner misses. Rebound secured by Joel Simons.

[02:31] Team_097 possession (Score: 35-50)
Dwyane Ginobili attempts a 3Pt. Contested by Vince Paul (4.1 feet, ZONE). Dwyane Ginobili misses. FOUL! Loose ball foul on Nikola Wagner during the rebound battle. [IN THE BONUS! 6 team fouls] Joel Simons to the line for 2 free throws. (Nikola Wagner: 2 personal fouls)   FT 1/2: GOOD   FT 2/2: MISS Joel Simons makes 1/2 from the line. Rebound secured by Carmelo Anunoby.
Score: 35-51

[02:13] Team_034 possession (Score: 35-51)
Vince Paul attempts a 3Pt. Contested by Joel Simons (4.0 feet, ZONE). Vince Paul misses. Rebound secured by Miles Banchero.

[02:02] Team_097 possession (Score: 35-51)
Gary Carter drives to the basket... Gary Carter commits a violation (traveling/carry)! TURNOVER! (dead ball)

[01:48] Team_034 possession (Score: 35-51)
Vince Paul attempts a 3Pt. Contested by Joel Simons (4.0 feet, ZONE). Vince Paul misses. Rebound secured by Joel Simons.

[01:33] Team_097 possession (Score: 35-51)
Miles Dosunmu drives to the basket... Miles Dosunmu throws a bad pass out of bounds! TURNOVER! (dead ball)

[01:19] Team_034 possession (Score: 35-51)
FOUL! Shooting foul on Joel Simons. Carmelo Anunoby to the line for 2 free throws. [BONUS: 6 team fouls] (Joel Simons: 2 personal fouls)   FT 1/2: GOOD   FT 2/2: GOOD Carmelo Anunoby makes 2/2 from the line.
Score: 37-51

[01:03] Team_097 possession (Score: 37-51)
Dwyane Ginobili attempts a Midrange. Contested by Damian Turner (5.5 feet, MAN). Dwyane Ginobili misses. Rebound secured by Carmelo Anunoby.

[00:47] Team_034 possession (Score: 37-51)
Carmelo Anunoby attempts a Layup. Contested by Joel Simons (3.8 feet, MAN). Carmelo Anunoby misses. FOUL! Loose ball foul on Miles Banchero during the rebound battle. [IN THE BONUS! 7 team fouls] Carmelo Anunoby to the line for 2 free throws. (Miles Banchero: 2 personal fouls)   FT 1/2: GOOD   FT 2/2: GOOD Carmelo Anunoby makes 2/2 from the line.
Score: 39-51

[00:37] Team_097 possession (Score: 39-51)
Joel Simons attempts a Layup. Wide open! Nikola Wagner is 6.3 feet away. [MAN] JOEL SIMONS MAKES IT! Assist: Miles Dosunmu
Score: 39-53

[00:20] Team_034 possession (Score: 39-53)
FOUL! Holding foul on Gary Carter. [IN THE BONUS! 8 team fouls] Manu Jokic to the line for 2 free throws. (Gary Carter: 1 personal fouls)   FT 1/2: GOOD   FT 2/2: GOOD Manu Jokic makes 2/2 from the line.
Score: 41-53

[00:06] Team_097 possession (Score: 41-53)
Joel Simons drives and kicks out. Dwyane Ginobili attempts a 3Pt. Contested by Manu Jokic (4.9 feet, ZONE). DWYANE GINOBILI MAKES IT! Assist: Miles Banchero
Score: 41-56

================================================================================
                              2ND QUARTER COMPLETE                              
================================================================================

2ND QUARTER SCORE: Team_034 18, Team_097 31

BOX SCORE:
================================================================================

Team_034
--------------------------------------------------------------------------------
Player                MIN  PTS  REB  AST  TO      FG   FG%      3P   3P%
--------------------------------------------------------------------------------
Carmelo Anunoby        10    6    4    0   0   3/4    75.0     0/0   0.0
Manu Jokic             10    4    0    0   0   2/4    50.0     0/0   0.0
Terry Doncic           14    3    2    0   0   1/1   100.0     0/0   0.0
Damian Turner          10    3    0    0   0   1/2    50.0     0/0   0.0
Anthony Bane           14    0    1    0   0   0/3     0.0     0/0   0.0
Devin Poole            14    0    0    0   0   0/1     0.0     0/0   0.0
Nikola Wagner          10    0    1    0   0   0/1     0.0     0/0   0.0
Vince Paul             10    0    0    1   0   0/3     0.0     0/0   0.0

TEAM: FG: 7/19 (36.8%), 3PT: 2/8 (25.0%), REB: 7 (2 off, 5 def), AST: 1, TO: 4
TEAM FOULS: 6 [Team_097 in BONUS]


Team_097
--------------------------------------------------------------------------------
Player                MIN  PTS  REB  AST  TO      FG   FG%      3P   3P%
--------------------------------------------------------------------------------
Joel Simons            10   11    5    0   0   5/5   100.0     0/0   0.0
Dwyane Ginobili        10    8    0    1   0   3/6    50.0     0/0   0.0
Anthony Haliburton     14    5    0    0   0   2/4    50.0     0/0   0.0
Miles Banchero         10    4    1    1   0   2/2   100.0     0/0   0.0
Miles Dosunmu          10    2    2    2   0   1/1   100.0     0/0   0.0
Tyrese Stewart         14    0    3    1   0   0/0     0.0     0/0   0.0
Shai Poole             14    0    1    0   0   0/0     0.0     0/0   0.0
Gary Carter            10    0    0    2   0   0/1     0.0     0/0   0.0

TEAM: FG: 13/19 (68.4%), 3PT: 2/3 (66.7%), REB: 13 (1 off, 12 def), AST: 7, TO: 4
TEAM FOULS: 8 [Team_034 in BONUS]

================================================================================

================================================================================
                       3RD QUARTER - Team_034 vs Team_097                       
================================================================================

[12:00] Team_034 possession (Score: 41-56)
Devin Poole drives, picks up Evan Brogdon. Help arrives from Shai Poole! Devin Poole attempts a Layup. Contested by Shai Poole (4.6 feet, MAN). DEVIN POOLE MAKES IT!
Score: 43-56

[11:43] Team_097 possession (Score: 43-56)
Anthony Haliburton attempts a 3Pt. Contested by Devin Poole (4.4 feet, ZONE). Anthony Haliburton misses. Rebound secured by Anthony Bane.

[11:24] Team_034 possession (Score: 43-56)
Terry Doncic drives to the basket... Terry Doncic loses control! Ball rolls out of bounds! TURNOVER! (dead ball)

[11:08] Team_097 possession (Score: 43-56)
Shai Poole attempts a 3Pt. Contested by Cole Antetokounmpo (5.1 feet, MAN). Shai Poole misses. Rebound secured by Cole Antetokounmpo.

[10:55] Team_034 possession (Score: 43-56)
FOUL! Reach-in foul on Anthony Haliburton during the drive. [Team fouls: 1] No free throws, side out. (Anthony Haliburton: 1 personal fouls)

[10:38] Team_034 possession (Score: 43-56)
Terry Doncic attempts a Midrange. Contested by Anthony Haliburton (3.4 feet, MAN). TERRY DONCIC MAKES IT!
Score: 45-56

[10:22] Team_097 possession (Score: 45-56)
Anthony Haliburton attempts a Midrange. Contested by Terry Doncic (4.5 feet, MAN). Anthony Haliburton misses. Rebound secured by Terry Doncic.

[10:08] Team_034 possession (Score: 45-56)
Terry Doncic drives, Anthony Haliburton stays with him. Terry Doncic attempts a Dunk. Contested by Anthony Haliburton (3.4 feet, ZONE). TERRY DONCIC MAKES IT!
Score: 47-56

[09:55] Team_097 possession (Score: 47-56)
Tyrese Stewart drives and kicks out. Shai Poole attempts a 3Pt. Contested by Devin Poole (3.9 feet, ZONE). Shai Poole misses. Rebound secured by Anthony Bane.

[09:36] Team_034 possession (Score: 47-56)
Anthony Bane drives, Anthony Haliburton stays with him. Anthony Bane attempts a Dunk. Contested by Anthony Haliburton (3.4 feet, MAN). ANTHONY BANE MAKES IT! Assist: Terry Doncic
Score: 49-56

[09:21] Team_097 possession (Score: 49-56)
Shai Poole attempts a Layup. Contested by Cole Antetokounmpo (5.1 feet, MAN). Shai Poole misses. Offensive rebound by Anthony Haliburton! Anthony Haliburton's putback is no good. Rebound secured by Cole Antetokounmpo.

[09:08] Team_034 possession (Score: 49-56)
Terry Doncic attempts a 3Pt. Contested by Shai Poole (3.5 feet, ZONE). Terry Doncic misses. Rebound secured by Anthony Haliburton.

[08:53] Team_097 possession (Score: 49-56)
Jrue Haliburton drives, picks up Terry Doncic. Help arrives from Ben Hyland! Jrue Haliburton attempts a Layup. Contested by Ben Hyland (4.5 feet, ZONE). Jrue Haliburton misses. Offensive rebound by Tyrese Stewart! Tyrese Stewart kicks it out.

[08:38] Team_097 possession (Score: 49-56)
Shai Poole drives, Terry Doncic stays with him. Shai Poole attempts a Dunk. Contested by Terry Doncic (4.6 feet, ZONE). SHAI POOLE MAKES IT! Assist: Anthony Haliburton
Score: 49-58

[08:28] Team_034 possession (Score: 49-58)
Devin Poole attempts a 3Pt. Contested by Evan Brogdon (4.6 feet, MAN). DEVIN POOLE MAKES IT! Assist: Anthony Bane
Score: 52-58

[08:15] Team_097 possession (Score: 52-58)
Anthony Haliburton drives to the basket... Anthony Haliburton loses control! Ball rolls out of bounds! TURNOVER! (dead ball)

[07:59] Team_034 possession (Score: 52-58)
Ben Hyland drives and kicks out. Cole Antetokounmpo attempts a Midrange. Contested by Shai Poole (3.4 feet, MAN). Cole Antetokounmpo misses. Rebound secured by Shai Poole.

[07:48] Team_097 possession (Score: 52-58)
Jrue Haliburton attempts a Midrange. Contested by Ben Hyland (4.0 feet, MAN). Jrue Haliburton misses. Offensive rebound by Anthony Haliburton! Anthony Haliburton puts it back in!
Score: 52-60

[07:34] Team_034 possession (Score: 52-60)
Terry Doncic drives to the basket... Terry Doncic loses control! Ball rolls out of bounds! TURNOVER! (dead ball)

[07:21] Team_097 possession (Score: 52-60)
FOUL! Holding foul on Devin Poole. [Team fouls: 1] No free throws, side out. (Devin Poole: 1 personal fouls)

[07:10] Team_097 possession (Score: 52-60)
Tyrese Stewart attempts a Layup. Contested by Terry Doncic (4.9 feet, ZONE). Tyrese Stewart misses. Rebound secured by Cole Antetokounmpo.

[07:01] Team_034 possession (Score: 52-60)
FOUL! Shooting foul on Tyrese Stewart. Cole Antetokounmpo to the line for 2 free throws. [Team fouls: 2] (Tyrese Stewart: 1 personal fouls)   FT 1/2: GOOD   FT 2/2: MISS Cole Antetokounmpo makes 1/2 from the line. Rebound secured by Shai Poole.
Score: 53-60

[06:48] Team_097 possession (Score: 53-60)
Evan Brogdon drives to the basket... Evan Brogdon commits a violation (traveling/carry)! TURNOVER! (dead ball)

[06:30] Team_034 possession (Score: 53-60)
FOUL! Shooting foul on Jrue Haliburton. Cole Antetokounmpo to the line for 3 free throws. [Team fouls: 3] (Jrue Haliburton: 1 personal fouls)   FT 1/3: MISS   FT 2/3: GOOD   FT 3/3: GOOD Cole Antetokounmpo makes 2/3 from the line.
Score: 55-60

[06:12] Team_097 possession (Score: 55-60)
Evan Brogdon commits a violation (traveling/carry)! TURNOVER! (dead ball)

[06:02] Team_034 possession (Score: 55-60)
Anthony Bane attempts a Midrange. Contested by Evan Brogdon (4.8 feet, ZONE). ANTHONY BANE MAKES IT!
Score: 57-60

[05:52] Team_097 possession (Score: 57-60)
Evan Brogdon attempts a Midrange. Contested by Cole Antetokounmpo (5.2 feet, ZONE). EVAN BROGDON MAKES IT! Assist: Jrue Haliburton
Score: 57-62

[05:37] Team_034 possession (Score: 57-62)
Anthony Bane drives and kicks out. Anthony Bane attempts a 3Pt. Contested by Anthony Haliburton (3.3 feet, MAN). Anthony Bane misses. Rebound secured by Shai Poole.

[05:21] Team_097 possession (Score: 57-62)
Jrue Haliburton attempts a Layup. Contested by Ben Hyland (4.0 feet, MAN). JRUE HALIBURTON MAKES IT! Assist: Shai Poole
Score: 57-64

[05:03] Team_034 possession (Score: 57-64)
Anthony Bane throws a bad pass! Stolen by Anthony Haliburton! TURNOVER! (live ball)

[04:48] Team_097 possession (Score: 57-64)
Evan Brogdon throws a bad pass! Stolen by Devin Poole! TURNOVER! (live ball)

[04:32] Team_034 possession (Score: 57-64)
Terry Doncic attempts a 3Pt. Contested by Shai Poole (3.5 feet, ZONE). TERRY DONCIC MAKES IT! Assist: Devin Poole
Score: 60-64

[04:20] Team_097 possession (Score: 60-64)
Tyrese Stewart attempts a Layup. Wide open! Anthony Bane is 6.1 feet away. [MAN] TYRESE STEWART MAKES IT! Assist: Shai Poole
Score: 60-66

[04:07] Team_034 possession (Score: 60-66)
Terry Doncic attempts a 3Pt. Contested by Anthony Haliburton (3.5 feet, MAN). Terry Doncic misses. Rebound secured by Anthony Haliburton.

[03:50] Team_097 possession (Score: 60-66)
Evan Brogdon attempts a 3Pt. Contested by Devin Poole (4.8 feet, ZONE). EVAN BROGDON MAKES IT! Assist: Tyrese Stewart
Score: 60-69

[03:36] Team_034 possession (Score: 60-69)
Devin Poole attempts a Layup. Contested by Evan Brogdon (4.7 feet, MAN). DEVIN POOLE MAKES IT! Assist: Anthony Bane
Score: 62-69

[03:18] Team_097 possession (Score: 62-69)
Anthony Haliburton attempts a 3Pt. Contested by Devin Poole (4.6 feet, ZONE). Anthony Haliburton misses. Rebound secured by Cole Antetokounmpo.

[03:07] Team_034 possession (Score: 62-69)
Ben Hyland attempts a Midrange. Contested by Shai Poole (3.6 feet, ZONE). Ben Hyland misses. Rebound secured by Tyrese Stewart.

[02:54] Team_097 possession (Score: 62-69)
Jrue Haliburton attempts a 3Pt. Contested by Devin Poole (4.6 feet, ZONE). Jrue Haliburton misses. Rebound secured by Cole Antetokounmpo.

[02:41] Team_034 possession (Score: 62-69)
Terry Doncic drives, picks up Anthony Haliburton. Help arrives from Jrue Haliburton! Terry Doncic attempts a Dunk. Contested by Jrue Haliburton (3.6 feet, MAN). TERRY DONCIC MAKES IT! Assist: Cole Antetokounmpo
Score: 64-69

[02:26] Team_097 possession (Score: 64-69)
Evan Brogdon attempts a Midrange. Contested by Cole Antetokounmpo (5.4 feet, ZONE). Evan Brogdon misses. Rebound secured by Terry Doncic.

[02:14] Team_034 possession (Score: 64-69)
Ben Hyland drives and kicks out. Anthony Bane attempts a Midrange. Contested by Anthony Haliburton (3.7 feet, MAN). Anthony Bane misses. Rebound secured by Shai Poole.

[02:04] Team_097 possession (Score: 64-69)
Shai Poole drives, Terry Doncic stays with him. Shai Poole attempts a Dunk. Contested by Terry Doncic (4.9 feet, ZONE). Shai Poole misses. Offensive rebound by Tyrese Stewart! Tyrese Stewart kicks it out.

[01:53] Team_097 possession (Score: 64-69)
Shai Poole attempts a Layup. Contested by Terry Doncic (4.9 feet, ZONE). Shai Poole misses. Rebound secured by Terry Doncic.

[01:36] Team_034 possession (Score: 64-69)
Anthony Bane loses control! Ball rolls out of bounds! TURNOVER! (dead ball)

[01:36] Substitution (Team_034): Devin Poole OUT → Manu Jokic IN (stamina_rule2)

[01:36] Substitution (Team_034): Ben Hyland OUT → Damian Turner IN (stamina_rule2)

[01:36] Substitution (Team_034): Cole Antetokounmpo OUT → Vince Paul IN (stamina_rule2)

[01:36] Substitution (Team_034): Terry Doncic OUT → Nikola Wagner IN (stamina_rule2)

[01:36] Substitution (Team_034): Anthony Bane OUT → Carmelo Anunoby IN (stamina_rule2)

[01:36] Substitution (Team_097): Evan Brogdon OUT → Gary Carter IN (stamina_rule2)

[01:36] Substitution (Team_097): Jrue Haliburton OUT → Dwyane Ginobili IN (stamina_rule2)

[01:36] Substitution (Team_097): Shai Poole OUT → Miles Dosunmu IN (stamina_rule2)

[01:36] Substitution (Team_097): Anthony Haliburton OUT → Joel Simons IN (stamina_rule2)

[01:36] Substitution (Team_097): Tyrese Stewart OUT → Miles Banchero IN (stamina_rule2)

[01:18] Team_097 possession (Score: 64-69)
Dwyane Ginobili drives, picks up Carmelo Anunoby. Help arrives from Damian Turner! Dwyane Ginobili attempts a Dunk. Contested by Damian Turner (5.3 feet, ZONE). Dwyane Ginobili misses. Offensive rebound by Miles Dosunmu! Miles Dosunmu kicks it out.

[01:05] Team_097 possession (Score: 64-69)
Gary Carter makes the Midrange and draws the foul on Manu Jokic! And-1! Gary Carter to the line for 1. [Team fouls: 2] (Manu Jokic: 1 personal fouls)   FT 1/1: GOOD Gary Carter makes 1/1 from the line.
Score: 64-72

[00:49] Team_034 possession (Score: 64-72)
FOUL! Shooting foul on Joel Simons. Damian Turner to the line for 3 free throws. [Team fouls: 4] (Joel Simons: 1 personal fouls)   FT 1/3: GOOD   FT 2/3: GOOD   FT 3/3: MISS Damian Turner makes 2/3 from the line. Offensive rebound by Carmelo Anunoby! Carmelo Anunoby kicks it out.
Score: 66-72

[00:34] Team_034 possession (Score: 66-72)
Vince Paul attempts a 3Pt. Contested by Joel Simons (4.0 feet, ZONE). Vince Paul misses. Rebound secured by Miles Dosunmu.

[00:18] Team_097 possession (Score: 66-72)
Miles Banchero attempts a Layup. Contested by Carmelo Anunoby (5.6 feet, ZONE). Miles Banchero misses. Rebound secured by Nikola Wagner.

[00:02] Team_034 possession (Score: 66-72)
FOUL! Offensive foul on Manu Jokic! Gary Carter drew the charge! [Team fouls: 3] (Manu Jokic: 2 personal fouls) TURNOVER! (dead ball)

================================================================================
                              3RD QUARTER COMPLETE                              
================================================================================

3RD QUARTER SCORE: Team_034 25, Team_097 16

BOX SCORE:
================================================================================

Team_034
--------------------------------------------------------------------------------
Player                MIN  PTS  REB  AST  TO      FG   FG%      3P   3P%
--------------------------------------------------------------------------------
Terry Doncic           25    9    3    1   0   4/6    66.7     0/0   0.0
Devin Poole            25    7    0    1   0   3/3   100.0     0/0   0.0
Anthony Bane           25    4    2    2   0   2/3    66.7     0/0   0.0
Cole Antetokounmpo     25    2    5    1   0   1/2    50.0     0/0   0.0
Ben Hyland             25    0    0    0   0   0/3     0.0     0/0   0.0
Carmelo Anunoby        12    0    1    0   0   0/0     0.0     0/0   0.0
Vince Paul             12    0    0    0   0   0/1     0.0     0/0   0.0
Nikola Wagner          12    0    1    0   0   0/0     0.0     0/0   0.0

TEAM: FG: 10/18 (55.6%), 3PT: 3/6 (50.0%), REB: 11 (1 off, 10 def), AST: 5, TO: 5
TEAM FOULS: 3


Team_097
--------------------------------------------------------------------------------
Player                MIN  PTS  REB  AST  TO      FG   FG%      3P   3P%
--------------------------------------------------------------------------------
Evan Brogdon           25    5    0    0   0   2/3    66.7     0/0   0.0
Gary Carter            12    3    0    0   0   1/1   100.0     0/0   0.0
Anthony Haliburton     25    2    3    1   0   1/4    25.0     0/0   0.0
Shai Poole             25    2    4    2   0   1/4    25.0     0/0   0.0
Tyrese Stewart         25    2    3    1   0   1/3    33.3     0/0   0.0
Jrue Haliburton        25    2    0    1   0   1/2    50.0     0/0   0.0
Miles Dosunmu          12    0    2    0   0   0/0     0.0     0/0   0.0
Miles Banchero         12    0    0    0   0   0/1     0.0     0/0   0.0

TEAM: FG: 7/18 (38.9%), 3PT: 1/5 (20.0%), REB: 13 (5 off, 8 def), AST: 5, TO: 4
TEAM FOULS: 4

================================================================================

================================================================================
                       4TH QUARTER - Team_034 vs Team_097                       
================================================================================

[12:00] Team_034 possession (Score: 66-72)
Terry Doncic attempts a Midrange. Contested by Anthony Haliburton (3.5 feet, MAN). Terry Doncic misses. Rebound secured by Shai Poole.

[11:50] Team_097 possession (Score: 66-72)
Shai Poole drives and kicks out. Tyrese Stewart attempts a Midrange. Contested by Anthony Bane (5.3 feet, MAN). Tyrese Stewart misses. Offensive rebound by Anthony Haliburton! Anthony Haliburton's putback is no good. Offensive rebound by Anthony Haliburton! Anthony Haliburton kicks it out.

[11:36] Team_097 possession (Score: 66-72)
Anthony Haliburton drives and kicks out. Shai Poole attempts a Midrange. Contested by Cole Antetokounmpo (4.6 feet, MAN). Shai Poole misses. Rebound secured by Terry Doncic.

[11:25] Team_034 possession (Score: 66-72)
Ben Hyland drives and kicks out. FOUL! Shooting foul on Anthony Haliburton. Terry Doncic to the line for 2 free throws. [Team fouls: 1] (Anthony Haliburton: 1 personal fouls)   FT 1/2: GOOD   FT 2/2: MISS Terry Doncic makes 1/2 from the line. Offensive rebound by Anthony Bane! Anthony Bane kicks it out.
Score: 67-72

[11:11] Team_034 possession (Score: 67-72)
Devin Poole attempts a Midrange. Contested by Evan Brogdon (4.7 feet, MAN). Devin Poole misses. Rebound secured by Tyrese Stewart.

[10:59] Team_097 possession (Score: 67-72)
Jrue Haliburton attempts a 3Pt. Contested by Ben Hyland (4.2 feet, MAN). JRUE HALIBURTON MAKES IT! Assist: Anthony Haliburton
Score: 67-75

[10:42] Team_034 possession (Score: 67-75)
FOUL! Holding foul on Anthony Haliburton. [Team fouls: 2] No free throws, side out. (Anthony Haliburton: 2 personal fouls)

[10:27] Team_034 possession (Score: 67-75)
Ben Hyland attempts a 3Pt. Contested by Jrue Haliburton (5.4 feet, MAN). BEN HYLAND MAKES IT!
Score: 70-75

[10:15] Team_097 possession (Score: 70-75)
Shai Poole drives and kicks out. Evan Brogdon attempts a 3Pt. Contested by Ben Hyland (3.9 feet, ZONE). Evan Brogdon misses. FOUL! Loose ball foul on Cole Antetokounmpo during the rebound battle. [Team fouls: 1] No free throws, side out. (Cole Antetokounmpo: 1 personal fouls)

[09:58] Team_097 possession (Score: 70-75)
Tyrese Stewart loses the ball! Stripped by Anthony Bane! TURNOVER! (live ball)

[09:43] Team_034 possession (Score: 70-75)
Terry Doncic drives, Anthony Haliburton stays with him. Terry Doncic attempts a Layup. Contested by Anthony Haliburton (3.8 feet, MAN). TERRY DONCIC MAKES IT! Assist: Ben Hyland
Score: 72-75

[09:26] Team_097 possession (Score: 72-75)
Anthony Haliburton attempts a 3Pt. Contested by Devin Poole (4.8 feet, ZONE). Anthony Haliburton misses. Rebound secured by Anthony Bane.

[09:10] Team_034 possession (Score: 72-75)
Anthony Bane attempts a Layup. Contested by Anthony Haliburton (3.8 feet, ZONE). ANTHONY BANE MAKES IT! Assist: Ben Hyland
Score: 74-75

[08:59] Team_097 possession (Score: 74-75)
Anthony Haliburton drives to the basket... Anthony Haliburton throws a bad pass! Stolen by Terry Doncic! TURNOVER! (live ball)

[08:44] Team_034 possession (Score: 74-75)
Terry Doncic drives, picks up Anthony Haliburton. Help arrives from Jrue Haliburton! Terry Doncic attempts a Dunk. Contested by Jrue Haliburton (3.9 feet, MAN). Terry Doncic misses. Rebound secured by Anthony Haliburton.

[08:29] Team_097 possession (Score: 74-75)
Jrue Haliburton drives and kicks out. Anthony Haliburton attempts a Midrange. BLOCKED BY COLE ANTETOKOUNMPO! Ball is loose! Rebound secured by Cole Antetokounmpo.

[08:15] Team_034 possession (Score: 74-75)
FOUL! Reach-in foul on Anthony Haliburton during the drive. [Team fouls: 3] No free throws, side out. (Anthony Haliburton: 3 personal fouls)

[08:01] Team_034 possession (Score: 74-75)
Cole Antetokounmpo attempts a 3Pt. Contested by Shai Poole (4.4 feet, ZONE). Cole Antetokounmpo misses. Rebound secured by Tyrese Stewart.

[07:46] Team_097 possession (Score: 74-75)
Jrue Haliburton attempts a 3Pt. Contested by Ben Hyland (4.6 feet, MAN). JRUE HALIBURTON MAKES IT! Assist: Shai Poole
Score: 74-78

[07:27] Team_034 possession (Score: 74-78)
Ben Hyland attempts a Layup. Contested by Anthony Haliburton (4.0 feet, ZONE). BEN HYLAND MAKES IT! Assist: Cole Antetokounmpo
Score: 76-78

[07:12] Team_097 possession (Score: 76-78)
Anthony Haliburton attempts a Layup. Contested by Terry Doncic (5.1 feet, ZONE). ANTHONY HALIBURTON MAKES IT!
Score: 76-80

[07:01] Team_034 possession (Score: 76-80)
Cole Antetokounmpo attempts a 3Pt. Contested by Shai Poole (4.5 feet, MAN). Cole Antetokounmpo misses. FOUL! Loose ball foul on Tyrese Stewart during the rebound battle. [Team fouls: 4] No free throws, side out. (Tyrese Stewart: 1 personal fouls)

[06:45] Team_034 possession (Score: 76-80)
FOUL! Shooting foul on Anthony Haliburton. Cole Antetokounmpo to the line for 2 free throws. [BONUS: 5 team fouls] (Anthony Haliburton: 4 personal fouls)   FT 1/2: GOOD   FT 2/2: MISS Cole Antetokounmpo makes 1/2 from the line. Rebound secured by Anthony Haliburton.
Score: 77-80

[06:30] Team_097 possession (Score: 77-80)
Evan Brogdon attempts a Midrange. Contested by Terry Doncic (5.4 feet, ZONE). Evan Brogdon misses. Rebound secured by Terry Doncic.

[06:17] Team_034 possession (Score: 77-80)
Cole Antetokounmpo attempts a 3Pt. Contested by Shai Poole (4.6 feet, ZONE). Cole Antetokounmpo misses. Rebound secured by Anthony Haliburton.

[06:04] Team_097 possession (Score: 77-80)
Tyrese Stewart attempts a Layup. Contested by Terry Doncic (5.6 feet, ZONE). TYRESE STEWART MAKES IT!
Score: 77-82

[05:48] Team_034 possession (Score: 77-82)
Ben Hyland attempts a 3Pt. Contested by Shai Poole (4.3 feet, ZONE). BEN HYLAND MAKES IT! Assist: Devin Poole
Score: 80-82

[05:34] Team_097 possession (Score: 80-82)
Tyrese Stewart attempts a Layup. Contested by Terry Doncic (5.7 feet, ZONE). TYRESE STEWART MAKES IT!
Score: 80-84

[05:20] Team_034 possession (Score: 80-84)
Ben Hyland loses the ball! Stripped by Jrue Haliburton! TURNOVER! (live ball)

[05:07] Team_097 possession (Score: 80-84)
Shai Poole attempts a Midrange. Contested by Cole Antetokounmpo (5.9 feet, MAN). Shai Poole misses. Rebound secured by Terry Doncic.

[04:53] Team_034 possession (Score: 80-84)
Ben Hyland drives, Jrue Haliburton stays with him. Ben Hyland attempts a Dunk. Contested by Jrue Haliburton (5.9 feet, MAN). BEN HYLAND MAKES IT!
Score: 82-84

[04:40] Team_097 possession (Score: 82-84)
Tyrese Stewart attempts a 3Pt. Contested by Devin Poole (5.8 feet, ZONE). TYRESE STEWART MAKES IT! Assist: Anthony Haliburton
Score: 82-87

[04:25] Team_034 possession (Score: 82-87)
FOUL! Holding foul on Jrue Haliburton. [IN THE BONUS! 6 team fouls] Ben Hyland to the line for 2 free throws. (Jrue Haliburton: 1 personal fouls)   FT 1/2: GOOD   FT 2/2: MISS Ben Hyland makes 1/2 from the line. Offensive rebound by Terry Doncic! Terry Doncic kicks it out.
Score: 83-87

[04:09] Team_034 possession (Score: 83-87)
Terry Doncic attempts a Midrange. Contested by Anthony Haliburton (4.6 feet, MAN). Terry Doncic misses. Rebound secured by Tyrese Stewart.

[03:52] Team_097 possession (Score: 83-87)
Shai Poole drives to the basket... Shai Poole loses the ball! Stripped by Cole Antetokounmpo! TURNOVER! (live ball)

[03:35] Team_034 possession (Score: 83-87)
Anthony Bane attempts a Layup. Wide open! Tyrese Stewart is 6.3 feet away. [ZONE] ANTHONY BANE MAKES IT!
Score: 85-87

[03:22] Team_097 possession (Score: 85-87)
Anthony Haliburton throws a bad pass out of bounds! TURNOVER! (dead ball)

[03:22] Substitution (Team_034): Devin Poole OUT → Manu Jokic IN (stamina_rule2)

[03:22] Substitution (Team_034): Ben Hyland OUT → Damian Turner IN (stamina_rule2)

[03:22] Substitution (Team_034): Cole Antetokounmpo OUT → Vince Paul IN (stamina_rule2)

[03:22] Substitution (Team_034): Terry Doncic OUT → Nikola Wagner IN (stamina_rule2)

[03:22] Substitution (Team_034): Anthony Bane OUT → Carmelo Anunoby IN (stamina_rule2)

[03:22] Substitution (Team_097): Evan Brogdon OUT → Gary Carter IN (stamina_rule2)

[03:22] Substitution (Team_097): Jrue Haliburton OUT → Dwyane Ginobili IN (stamina_rule2)

[03:22] Substitution (Team_097): Shai Poole OUT → Miles Dosunmu IN (stamina_rule2)

[03:22] Substitution (Team_097): Anthony Haliburton OUT → Joel Simons IN (stamina_rule2)

[03:22] Substitution (Team_097): Tyrese Stewart OUT → Miles Banchero IN (stamina_rule2)

[03:05] Team_034 possession (Score: 85-87)
Nikola Wagner drives, Joel Simons stays with him. Nikola Wagner attempts a Dunk. Contested by Joel Simons (3.7 feet, ZONE). Nikola Wagner misses. Rebound secured by Miles Banchero.

[02:53] Team_097 possession (Score: 85-87)
Miles Banchero attempts a Midrange. Contested by Carmelo Anunoby (5.6 feet, MAN). Miles Banchero misses. Rebound secured by Vince Paul.

[02:40] Team_034 possession (Score: 85-87)
FOUL! Reach-in foul on Joel Simons during the drive. [IN THE BONUS! 7 team fouls] Carmelo Anunoby to the line for 2 free throws. (Joel Simons: 1 personal fouls)   FT 1/2: MISS   FT 2/2: GOOD Carmelo Anunoby makes 1/2 from the line.
Score: 86-87

[02:26] Team_097 possession (Score: 86-87)
Miles Dosunmu attempts a Layup. Contested by Carmelo Anunoby (5.9 feet, ZONE). MILES DOSUNMU MAKES IT!
Score: 86-89

[02:14] Team_034 possession (Score: 86-89)
Carmelo Anunoby attempts a Midrange. Contested by Joel Simons (3.7 feet, MAN). Carmelo Anunoby misses. Rebound secured by Miles Banchero.

[02:02] Team_097 possession (Score: 86-89)
Gary Carter attempts a 3Pt. Contested by Manu Jokic (4.5 feet, MAN). Gary Carter misses. Rebound secured by Nikola Wagner.

[01:45] Team_034 possession (Score: 86-89)
Nikola Wagner drives, Joel Simons stays with him. Nikola Wagner attempts a Layup. Contested by Joel Simons (3.7 feet, ZONE). NIKOLA WAGNER MAKES IT! Assist: Vince Paul
Score: 88-89

[01:29] Team_097 possession (Score: 88-89)
Miles Dosunmu drives to the basket... FOUL! Offensive foul on Miles Dosunmu! Carmelo Anunoby drew the charge! [Team fouls: 8] (Miles Dosunmu: 1 personal fouls) TURNOVER! (dead ball)

[01:15] Team_034 possession (Score: 88-89)
Manu Jokic drives, Gary Carter stays with him. Manu Jokic attempts a Layup. Contested by Gary Carter (4.8 feet, MAN). Manu Jokic misses. Offensive rebound by Carmelo Anunoby! Carmelo Anunoby kicks it out.

[00:59] Team_034 possession (Score: 88-89)
Nikola Wagner loses the ball! Stripped by Joel Simons! TURNOVER! (live ball)

[00:44] Team_097 possession (Score: 88-89)
Miles Dosunmu attempts a 3Pt. Contested by Vince Paul (4.7 feet, MAN). Miles Dosunmu misses. Rebound secured by Vince Paul.

[00:32] Team_034 possession (Score: 88-89)
Nikola Wagner attempts a 3Pt. Contested by Joel Simons (3.7 feet, ZONE). Nikola Wagner misses. Offensive rebound by Vince Paul! Vince Paul's putback is no good. Rebound secured by Miles Dosunmu.

[00:18] Team_097 possession (Score: 88-89)
Miles Dosunmu attempts a 3Pt. Contested by Vince Paul (4.7 feet, MAN). Miles Dosunmu misses. Rebound secured by Nikola Wagner.

[00:01] Team_034 possession (Score: 88-89)
Vince Paul attempts a 3Pt. Contested by Miles Dosunmu (4.2 feet, MAN). Vince Paul misses. Rebound secured by Miles Banchero.

================================================================================
                              4TH QUARTER COMPLETE                              
================================================================================

4TH QUARTER SCORE: Team_034 22, Team_097 17

BOX SCORE:
================================================================================

Team_034
--------------------------------------------------------------------------------
Player                MIN  PTS  REB  AST  TO      FG   FG%      3P   3P%
--------------------------------------------------------------------------------
Ben Hyland             34   10    0    2   0   4/4   100.0     0/0   0.0
Anthony Bane           34    4    2    0   0   2/2   100.0     0/0   0.0
Terry Doncic           34    2    5    0   0   1/4    25.0     0/0   0.0
Nikola Wagner          15    2    2    0   0   1/3    33.3     0/0   0.0
Carmelo Anunoby        15    1    1    0   0   1/2    50.0     0/0   0.0
Devin Poole            34    0    0    1   0   0/1     0.0     0/0   0.0
Cole Antetokounmpo     34    0    1    1   0   0/3     0.0     0/0   0.0
Vince Paul             15    0    2    1   0   0/1     0.0     0/0   0.0

TEAM: FG: 9/20 (45.0%), 3PT: 2/6 (33.3%), REB: 14 (5 off, 9 def), AST: 5, TO: 2
TEAM FOULS: 1


Team_097
--------------------------------------------------------------------------------
Player                MIN  PTS  REB  AST  TO      FG   FG%      3P   3P%
--------------------------------------------------------------------------------
Tyrese Stewart         34    7    3    0   0   3/3   100.0     0/0   0.0
Jrue Haliburton        34    6    0    0   0   2/3    66.7     0/0   0.0
Anthony Haliburton     34    2    5    2   0   1/3    33.3     0/0   0.0
Miles Dosunmu          15    2    1    0   0   1/3    33.3     0/0   0.0
Shai Poole             34    0    1    1   0   0/1     0.0     0/0   0.0
Evan Brogdon           34    0    0    0   0   0/1     0.0     0/0   0.0
Miles Banchero         15    0    3    0   0   0/1     0.0     0/0   0.0
Gary Carter            15    0    0    0   0   0/1     0.0     0/0   0.0

TEAM: FG: 7/16 (43.8%), 3PT: 3/7 (42.9%), REB: 12 (2 off, 10 def), AST: 3, TO: 5
TEAM FOULS: 8 [Team_034 in BONUS]

================================================================================

================================================================================
                               FULL GAME COMPLETE                               
================================================================================

FINAL SCORE: Team_034 88, Team_097 89

SCORING BY QUARTER:
--------------------------------------------------------------------------------
Team                     Q1     Q2     Q3     Q4    FINAL
--------------------------------------------------------------------------------
Team_034                 23     18     25     22       88
Team_097                 25     31     16     17       89
--------------------------------------------------------------------------------

FULL GAME BOX SCORE:
================================================================================

Team_034
--------------------------------------------------------------------------------
Player                MIN  PTS  REB  AST  TO      FG   FG%      3P   3P%      FT STL BLK
--------------------------------------------------------------------------------
Devin Poole            34    9    0    4   1   4/7    57.1   1/2    50.0   0/0     1   0
Ben Hyland             34   10    0    2   4   4/7    57.1   2/2   100.0   1/2     0   1
Cole Antetokounmpo     34    5    8    3   1   3/10   30.0   2/6    33.3   4/7     1   1
Terry Doncic           34   20   17    2   1   7/14   50.0   1/4    25.0   2/3     2   1
Anthony Bane           34   18    7    2   4   9/15   60.0   0/0     0.0   2/3     1   0
Manu Jokic             15    4    0    0   1   1/3    33.3   0/2     0.0   2/2     0   0
Damian Turner          15    3    0    0   0   1/3    33.3   1/2    50.0   2/3     0   0
Vince Paul             15    0    2    2   0   0/5     0.0   0/4     0.0   0/0     0   0
Nikola Wagner          15    2    5    0   3   1/4    25.0   0/1     0.0   0/0     0   0
Carmelo Anunoby        15    9    6    0   1   5/7    71.4   1/2    50.0   7/8     0   1

TEAM: FG: 36/76 (47.4%), 3PT: 8/25 (32.0%), REB: 45 (11 off, 34 def), AST: 15, TO: 16


Team_097
--------------------------------------------------------------------------------
Player                MIN  PTS  REB  AST  TO      FG   FG%      3P   3P%      FT STL BLK
--------------------------------------------------------------------------------
Evan Brogdon           34   13    0    0   3   5/9    55.6   3/4    75.0   2/2     1   0
Jrue Haliburton        34   11    0    2   3   5/10   50.0   3/5    60.0   0/0     1   0
Shai Poole             34    5    7    4   2   2/8    25.0   1/2    50.0   0/0     1   0
Anthony Haliburton     34   14   12    4   2   5/13   38.5   1/4    25.0   5/5     1   0
Tyrese Stewart         34   11   12    3   3   5/9    55.6   1/1   100.0   1/2     0   0
Gary Carter            15    3    0    3   1   1/3    33.3   0/1     0.0   1/1     0   0
Dwyane Ginobili        15    8    0    1   0   1/4    25.0   0/1     0.0   1/1     0   0
Miles Dosunmu          15    4    6    2   0   2/4    50.0   0/2     0.0   0/0     0   0
Joel Simons            15   14    6    0   1   7/7   100.0   2/2   100.0   3/4     1   0
Miles Banchero         15    4    4    1   1   3/6    50.0   0/0     0.0   0/0     1   0

TEAM: FG: 36/73 (49.3%), 3PT: 11/22 (50.0%), REB: 47 (9 off, 38 def), AST: 20, TO: 16

================================================================================
