================================================================================
                        FULL GAME - Team_028 vs Team_052                        
================================================================================

================================================================================
                       1ST QUARTER - Team_028 vs Team_052                       
================================================================================

[12:00] Team_028 possession (Score: 0-0)
Carmelo Carter attempts a 3Pt. Contested by Bones Morant (3.9 feet, ZONE). Carmelo Carter misses. Rebound secured by James Paul.

[11:45] Team_052 possession (Score: 0-0)
Bones Morant attempts a 3Pt. Contested by Austin Russell (4.9 feet, ZONE). BONES MORANT MAKES IT! Assist: Josh Durant
Score: 0-3

[11:32] Team_028 possession (Score: 0-3)
Jimmy Brogdon attempts a Midrange. Contested by Carmelo Middleton (4.8 feet, MAN). Jimmy Brogdon misses. Rebound secured by Bones Morant.

[11:18] Team_052 possession (Score: 0-3)
Bones Morant attempts a Midrange. Contested by Kawhi Ball (4.6 feet, ZONE). BONES MORANT MAKES IT!
Score: 0-5

[11:01] Team_028 possession (Score: 0-5)
FOUL! Shooting foul on James Paul. Myles Haliburton to the line for 2 free throws. [Team fouls: 1] (James Paul: 1 personal fouls)   FT 1/2: GOOD   FT 2/2: MISS Myles Haliburton makes 1/2 from the line. Offensive rebound by Jimmy Brogdon! Jimmy Brogdon kicks it out.
Score: 1-5

[10:47] Team_028 possession (Score: 1-5)
Myles Haliburton drives and kicks out. Kawhi Ball attempts a 3Pt. Contested by James Paul (3.4 feet, MAN). Kawhi Ball misses. Rebound secured by James Paul.

[10:32] Team_052 possession (Score: 1-5)
FOUL! Holding foul on Jimmy Brogdon. [Team fouls: 1] No free throws, side out. (Jimmy Brogdon: 1 personal fouls)

[10:17] Team_052 possession (Score: 1-5)
Carmelo Middleton attempts a Midrange. Contested by Myles Haliburton (4.0 feet, ZONE). CARMELO MIDDLETON MAKES IT!
Score: 1-7

[10:03] Team_028 possession (Score: 1-7)
Carmelo Carter drives, Josh Durant stays with him. Carmelo Carter attempts a Dunk. Contested by Josh Durant (3.6 feet, MAN). CARMELO CARTER MAKES IT! Assist: Jimmy Brogdon
Score: 3-7

[09:50] Team_052 possession (Score: 3-7)
Bones Morant drives, Myles Haliburton stays with him. Bones Morant attempts a Layup. Contested by Myles Haliburton (4.0 feet, MAN). Bones Morant misses. Rebound secured by Carmelo Carter.

[09:37] Team_028 possession (Score: 3-7)
Jimmy Brogdon attempts a Layup. Contested by James Paul (3.9 feet, ZONE). Jimmy Brogdon misses. Rebound secured by Carmelo Middleton.

[09:22] Team_052 possession (Score: 3-7)
Gary Gasol loses control! Ball rolls out of bounds! TURNOVER! (dead ball)

[09:10] Team_028 possession (Score: 3-7)
Jimmy Brogdon attempts a Midrange. Contested by Carmelo Middleton (4.8 feet, MAN). JIMMY BROGDON MAKES IT! Assist: Carmelo Carter
Score: 5-7

[08:53] Team_052 possession (Score: 5-7)
Bones Morant attempts a Layup. BLOCKED BY MYLES HALIBURTON! Ball is loose! Rebound secured by Jimmy Brogdon.

[08:38] Team_028 possession (Score: 5-7)
Jimmy Brogdon attempts a Midrange. Contested by James Paul (3.9 feet, ZONE). JIMMY BROGDON MAKES IT!
Score: 7-7

[08:26] Team_052 possession (Score: 7-7)
Josh Durant attempts a Midrange. Contested by Carmelo Carter (4.3 feet, MAN). Josh Durant misses. Rebound secured by Jimmy Brogdon.

[08:12] Team_028 possession (Score: 7-7)
Kawhi Ball attempts a Midrange. Contested by James Paul (3.6 feet, MAN). Kawhi Ball misses. Rebound secured by Carmelo Middleton.

[08:00] Team_052 possession (Score: 7-7)
Carmelo Middleton attempts a 3Pt. Contested by Jimmy Brogdon (4.6 feet, MAN). CARMELO MIDDLETON MAKES IT!
Score: 7-10

[07:44] Team_028 possession (Score: 7-10)
Jimmy Brogdon attempts a Layup. Contested by Carmelo Middleton (4.8 feet, MAN). JIMMY BROGDON MAKES IT! Assist: Carmelo Carter
Score: 9-10

[07:30] Team_052 possession (Score: 9-10)
James Paul attempts a Layup. BLOCKED BY KAWHI BALL! Ball is loose! Rebound secured by Carmelo Carter.

[07:10] Team_028 possession (Score: 9-10)
Jimmy Brogdon attempts a Midrange. Contested by Carmelo Middleton (4.8 feet, ZONE). Jimmy Brogdon misses. Rebound secured by Bones Morant.

[06:53] Team_052 possession (Score: 9-10)
Josh Durant attempts a Midrange. Contested by Carmelo Carter (4.3 feet, MAN). Josh Durant misses. Rebound secured by Jimmy Brogdon.

[06:39] Team_028 possession (Score: 9-10)
FOUL! Shooting foul on James Paul. Kawhi Ball to the line for 2 free throws. [Team fouls: 2] (James Paul: 2 personal fouls)   FT 1/2: GOOD   FT 2/2: GOOD Kawhi Ball makes 2/2 from the line.
Score: 11-10

[06:25] Team_052 possession (Score: 11-10)
Josh Durant drives, Carmelo Carter stays with him. Josh Durant attempts a Layup. Contested by Carmelo Carter (4.3 feet, MAN). Josh Durant misses. Rebound secured by Jimmy Brogdon.

[06:13] Team_028 possession (Score: 11-10)
Kawhi Ball attempts a Midrange. Contested by James Paul (3.6 feet, MAN). Kawhi Ball misses. Rebound secured by Carmelo Middleton.

[06:00] Team_052 possession (Score: 11-10)
Carmelo Middleton makes the Dunk and draws the foul on Jimmy Brogdon! And-1! Carmelo Middleton to the line for 1. [Team fouls: 2] (Jimmy Brogdon: 2 personal fouls)   FT 1/1: MISS Carmelo Middleton makes 0/1 from the line. FOUL! Loose ball foul on Carmelo Carter during the free throw rebound! [Team fouls: 3] No free throws, side out. (Carmelo Carter: 1 personal fouls)
Score: 11-12

[05:46] Team_052 possession (Score: 11-12)
FOUL! Reach-in foul on Carmelo Carter during the drive. [Team fouls: 4] No free throws, side out. (Carmelo Carter: 2 personal fouls)

[05:28] Team_052 possession (Score: 11-12)
Carmelo Middleton throws a bad pass! Stolen by Jimmy Brogdon! TURNOVER! (live ball)

[05:18] Team_028 possession (Score: 11-12)
Jimmy Brogdon attempts a Midrange. Contested by Bones Morant (4.1 feet, ZONE). Jimmy Brogdon misses. Rebound secured by Carmelo Middleton.

[05:02] Team_052 possession (Score: 11-12)
James Paul attempts a 3Pt. Contested by Austin Russell (4.8 feet, ZONE). James Paul misses. FOUL! Loose ball foul on Kawhi Ball during the rebound battle. [IN THE BONUS! 5 team fouls] James Paul to the line for 2 free throws. (Kawhi Ball: 1 personal fouls)   FT 1/2: GOOD   FT 2/2: GOOD James Paul makes 2/2 from the line.
Score: 11-14

[04:50] Team_028 possession (Score: 11-14)
Myles Haliburton attempts a 3Pt. Contested by Bones Morant (3.7 feet, ZONE). Myles Haliburton misses. Rebound secured by James Paul.

[04:33] Team_052 possession (Score: 11-14)
Gary Gasol drives, Kawhi Ball stays with him. Gary Gasol attempts a Layup. Contested by Kawhi Ball (4.8 feet, ZONE). Gary Gasol misses. Rebound secured by Kawhi Ball.

[04:17] Team_028 possession (Score: 11-14)
Kawhi Ball drives, James Paul stays with him. Kawhi Ball attempts a Layup. Contested by James Paul (3.7 feet, MAN). KAWHI BALL MAKES IT! Assist: Myles Haliburton
Score: 13-14

[04:00] Team_052 possession (Score: 13-14)
Gary Gasol attempts a 3Pt. Contested by Austin Russell (5.0 feet, ZONE). Gary Gasol misses. Rebound secured by Kawhi Ball.

[03:50] Team_028 possession (Score: 13-14)
Myles Haliburton drives and kicks out. Jimmy Brogdon attempts a 3Pt. Contested by Carmelo Middleton (4.5 feet, MAN). JIMMY BROGDON MAKES IT! Assist: Kawhi Ball
Score: 16-14

[03:35] Team_052 possession (Score: 16-14)
James Paul drives and kicks out. Gary Gasol attempts a 3Pt. Contested by Austin Russell (4.6 feet, MAN). Gary Gasol misses. Rebound secured by Jimmy Brogdon.

[03:20] Team_028 possession (Score: 16-14)
Myles Haliburton attempts a Midrange. Contested by Bones Morant (3.8 feet, MAN). MYLES HALIBURTON MAKES IT!
Score: 18-14

[03:01] Team_052 possession (Score: 18-14)
Josh Durant attempts a 3Pt. Contested by Austin Russell (4.4 feet, ZONE). Josh Durant misses. Rebound secured by Carmelo Carter.

[02:51] Team_028 possession (Score: 18-14)
Jimmy Brogdon drives, James Paul stays with him. Jimmy Brogdon attempts a Layup. Contested by James Paul (4.1 feet, ZONE). Jimmy Brogdon misses. Rebound secured by Carmelo Middleton.

[02:41] Team_052 possession (Score: 18-14)
Bones Morant drives, Myles Haliburton stays with him. Bones Morant attempts a Layup. Contested by Myles Haliburton (4.2 feet, MAN). BONES MORANT MAKES IT! Assist: Josh Durant
Score: 18-16

[02:26] Team_028 possession (Score: 18-16)
Austin Russell attempts a Layup. Contested by Gary Gasol (3.9 feet, MAN). AUSTIN RUSSELL MAKES IT!
Score: 20-16

[02:08] Team_052 possession (Score: 20-16)
Josh Durant makes the 3Pt and draws the foul on Kawhi Ball! And-1! Josh Durant to the line for 1. [BONUS: 6 team fouls] (Kawhi Ball: 2 personal fouls)   FT 1/1: GOOD Josh Durant makes 1/1 from the line.
Score: 20-20

[01:58] Team_028 possession (Score: 20-20)
Kawhi Ball drives to the basket... Kawhi Ball loses the ball! Stripped by James Paul! TURNOVER! (live ball)

[01:39] Team_052 possession (Score: 20-20)
Josh Durant throws a bad pass out of bounds! TURNOVER! (dead ball)

[01:39] Substitution (Team_028): Austin Russell OUT → Scottie Ingram IN (stamina_rule2)

[01:39] Substitution (Team_028): Carmelo Carter OUT → Tyrese Quickley IN (stamina_rule2)

[01:39] Substitution (Team_028): Myles Haliburton OUT → Miles Booker IN (stamina_rule2)

[01:39] Substitution (Team_028): Kawhi Ball OUT → Bam Towns IN (stamina_rule2)

[01:39] Substitution (Team_028): Jimmy Brogdon OUT → Collin Bridges IN (stamina_rule2)

[01:39] Substitution (Team_052): Gary Gasol OUT → Jimmy Doncic IN (stamina_rule2)

[01:39] Substitution (Team_052): Josh Durant OUT → Carmelo Giddey IN (stamina_rule2)

[01:39] Substitution (Team_052): Bones Morant OUT → Donovan Stewart IN (stamina_rule2)

[01:39] Substitution (Team_052): James Paul OUT → Jalen Haliburton IN (stamina_rule2)

[01:39] Substitution (Team_052): Carmelo Middleton OUT → Carmelo Beal IN (stamina_rule2)

[01:23] Team_028 possession (Score: 20-20)
Miles Booker attempts a 3Pt. Contested by Donovan Stewart (4.7 feet, MAN). Miles Booker misses. Offensive rebound by Collin Bridges! Collin Bridges kicks it out.

[01:03] Team_028 possession (Score: 20-20)
Scottie Ingram loses control! Ball rolls out of bounds! TURNOVER! (dead ball)

[00:49] Team_052 possession (Score: 20-20)
Jimmy Doncic attempts a 3Pt. Contested by Scottie Ingram (5.4 feet, MAN). Jimmy Doncic misses. Rebound secured by Tyrese Quickley.

[00:36] Team_028 possession (Score: 20-20)
Bam Towns drives, Jalen Haliburton stays with him. Bam Towns attempts a Dunk. Contested by Jalen Haliburton (4.6 feet, MAN). BAM TOWNS MAKES IT!
Score: 22-20

[00:23] Team_052 possession (Score: 22-20)
Jimmy Doncic loses control! Ball rolls out of bounds! TURNOVER! (dead ball)

[00:10] Team_028 possession (Score: 22-20)
Scottie Ingram throws a bad pass! Stolen by Jimmy Doncic! TURNOVER! (live ball)

================================================================================
                              1ST QUARTER COMPLETE                              
================================================================================

1ST QUARTER SCORE: Team_028 22, Team_052 20

BOX SCORE:
================================================================================

Team_028
--------------------------------------------------------------------------------
Player                MIN  PTS  REB  AST  TO      FG   FG%      3P   3P%
--------------------------------------------------------------------------------
Jimmy Brogdon          11    9    6    1   0   4/9    44.4     0/0   0.0
Kawhi Ball             11    4    2    1   0   2/4    50.0     0/0   0.0
Carmelo Carter         11    2    3    2   0   1/2    50.0     0/0   0.0
Myles Haliburton       11    2    0    1   0   1/3    33.3     0/0   0.0
Austin Russell         11    2    0    0   0   1/1   100.0     0/0   0.0
Bam Towns               1    2    0    0   0   1/1   100.0     0/0   0.0
Collin Bridges          1    0    1    0   0   0/0     0.0     0/0   0.0
Tyrese Quickley         1    0    1    0   0   0/0     0.0     0/0   0.0

TEAM: FG: 10/20 (50.0%), 3PT: 0/2 (0.0%), REB: 13 (2 off, 11 def), AST: 5, TO: 3
TEAM FOULS: 6 [Team_052 in BONUS]


Team_052
--------------------------------------------------------------------------------
Player                MIN  PTS  REB  AST  TO      FG   FG%      3P   3P%
--------------------------------------------------------------------------------
Bones Morant           11    7    3    0   0   3/5    60.0     0/0   0.0
Carmelo Middleton      11    5    5    0   0   2/2   100.0     0/0   0.0
Josh Durant            11    4    0    2   0   1/5    20.0     0/0   0.0
James Paul             11    2    3    0   0   1/3    33.3     0/0   0.0
Gary Gasol             11    0    0    0   0   0/2     0.0     0/0   0.0
Jimmy Doncic            1    0    0    0   0   0/1     0.0     0/0   0.0

TEAM: FG: 7/18 (38.9%), 3PT: 4/7 (57.1%), REB: 11 (1 off, 10 def), AST: 2, TO: 4
TEAM FOULS: 2

================================================================================

================================================================================
                       2ND QUARTER - Team_028 vs Team_052                       
================================================================================

[12:00] Team_028 possession (Score: 22-20)
Austin Russell attempts a 3Pt. Contested by Gary Gasol (3.7 feet, MAN). Austin Russell misses. Offensive rebound by Kawhi Ball! Kawhi Ball kicks it out.

[11:48] Team_028 possession (Score: 22-20)
Kawhi Ball attempts a 3Pt. Contested by James Paul (3.7 feet, ZONE). Kawhi Ball misses. Rebound secured by Bones Morant.

[11:33] Team_052 possession (Score: 22-20)
Carmelo Middleton loses the ball! Stripped by Jimmy Brogdon! TURNOVER! (live ball)

[11:18] Team_028 possession (Score: 22-20)
Jimmy Brogdon drives, picks up James Paul. Help arrives from Josh Durant! Jimmy Brogdon attempts a Dunk. Contested by Josh Durant (4.0 feet, ZONE). JIMMY BROGDON MAKES IT! Assist: Myles Haliburton
Score: 24-20

[11:01] Team_052 possession (Score: 24-20)
Josh Durant attempts a 3Pt. Contested by Austin Russell (4.4 feet, ZONE). Josh Durant misses. Rebound secured by Kawhi Ball.

[10:51] Team_028 possession (Score: 24-20)
Carmelo Carter attempts a 3Pt. Contested by Josh Durant (3.8 feet, MAN). Carmelo Carter misses. Rebound secured by Bones Morant.

[10:38] Team_052 possession (Score: 24-20)
Bones Morant makes the Dunk and draws the foul on Carmelo Carter! And-1! Bones Morant to the line for 1. [Team fouls: 1] (Carmelo Carter: 1 personal fouls)   FT 1/1: GOOD Bones Morant makes 1/1 from the line.
Score: 24-23

[10:29] Team_028 possession (Score: 24-23)
Myles Haliburton drives to the basket... Myles Haliburton loses control! Ball rolls out of bounds! TURNOVER! (dead ball)

[10:29] Substitution (Team_028): Kawhi Ball OUT → Bam Towns IN (stamina_rule2)

[10:29] Substitution (Team_028): Jimmy Brogdon OUT → Collin Bridges IN (stamina_rule2)

[10:29] Substitution (Team_052): Carmelo Middleton OUT → Carmelo Beal IN (stamina_rule2)

[10:11] Team_052 possession (Score: 24-23)
Carmelo Beal attempts a 3Pt. Contested by Austin Russell (4.5 feet, ZONE). Carmelo Beal misses. Offensive rebound by Carmelo Beal! Carmelo Beal kicks it out.

[09:56] Team_052 possession (Score: 24-23)
Bones Morant drives, Collin Bridges stays with him. Bones Morant attempts a Layup. Contested by Collin Bridges (4.2 feet, ZONE). BONES MORANT MAKES IT! Assist: James Paul
Score: 24-25

[09:41] Team_028 possession (Score: 24-25)
Collin Bridges attempts a Midrange. Contested by Bones Morant (4.1 feet, ZONE). Collin Bridges misses. Rebound secured by Bones Morant.

[09:29] Team_052 possession (Score: 24-25)
FOUL! Holding foul on Myles Haliburton. [Team fouls: 2] No free throws, side out. (Myles Haliburton: 1 personal fouls)

[09:18] Team_052 possession (Score: 24-25)
FOUL! Shooting foul on Collin Bridges. James Paul to the line for 2 free throws. [Team fouls: 3] (Collin Bridges: 1 personal fouls)   FT 1/2: GOOD   FT 2/2: MISS James Paul makes 1/2 from the line. FOUL! Loose ball foul on Bam Towns during the free throw rebound! [Team fouls: 4] No free throws, side out. (Bam Towns: 1 personal fouls)
Score: 24-26

[09:01] Team_052 possession (Score: 24-26)
Gary Gasol attempts a 3Pt. Contested by Austin Russell (5.2 feet, ZONE). Gary Gasol misses. Rebound secured by Carmelo Carter.

[08:48] Team_028 possession (Score: 24-26)
Myles Haliburton attempts a 3Pt. Contested by Josh Durant (3.8 feet, ZONE). Myles Haliburton misses. Offensive rebound by Collin Bridges! Collin Bridges kicks it out.

[08:30] Team_028 possession (Score: 24-26)
Myles Haliburton attempts a Layup. Contested by James Paul (3.9 feet, ZONE). MYLES HALIBURTON MAKES IT!
Score: 26-26

[08:16] Team_052 possession (Score: 26-26)
Bones Morant attempts a Midrange. Contested by Myles Haliburton (4.4 feet, MAN). BONES MORANT MAKES IT! Assist: Carmelo Beal
Score: 26-28

[08:01] Team_028 possession (Score: 26-28)
Myles Haliburton attempts a 3Pt. Contested by Bones Morant (4.2 feet, ZONE). MYLES HALIBURTON MAKES IT! Assist: Austin Russell
Score: 29-28

[07:47] Team_052 possession (Score: 29-28)
Carmelo Beal commits a violation (traveling/carry)! TURNOVER! (dead ball)

[07:47] Substitution (Team_028): Austin Russell OUT → Scottie Ingram IN (stamina_rule2)

[07:47] Substitution (Team_028): Carmelo Carter OUT → Tyrese Quickley IN (stamina_rule2)

[07:47] Substitution (Team_028): Myles Haliburton OUT → Miles Booker IN (stamina_rule2)

[07:47] Substitution (Team_052): Gary Gasol OUT → Jimmy Doncic IN (stamina_rule2)

[07:47] Substitution (Team_052): Josh Durant OUT → Carmelo Giddey IN (stamina_rule2)

[07:47] Substitution (Team_052): Bones Morant OUT → Donovan Stewart IN (stamina_rule2)

[07:47] Substitution (Team_052): James Paul OUT → Jalen Haliburton IN (stamina_rule2)

[07:30] Team_028 possession (Score: 29-28)
Collin Bridges attempts a Midrange. Contested by Carmelo Beal (3.7 feet, MAN). Collin Bridges misses. Rebound secured by Jalen Haliburton.

[07:15] Team_052 possession (Score: 29-28)
Carmelo Giddey attempts a Layup. Contested by Tyrese Quickley (5.0 feet, MAN). CARMELO GIDDEY MAKES IT! Assist: Donovan Stewart
Score: 29-30

[07:02] Team_028 possession (Score: 29-30)
Bam Towns makes the Layup and draws the foul on Jalen Haliburton! And-1! Bam Towns to the line for 1. [Team fouls: 1] (Jalen Haliburton: 1 personal fouls)   FT 1/1: MISS Bam Towns makes 0/1 from the line. Rebound secured by Jalen Haliburton.
Score: 31-30

[06:49] Team_052 possession (Score: 31-30)
Jimmy Doncic attempts a 3Pt. Contested by Scottie Ingram (5.4 feet, MAN). JIMMY DONCIC MAKES IT! Assist: Carmelo Giddey
Score: 31-33

[06:32] Team_028 possession (Score: 31-33)
Tyrese Quickley makes the 3Pt and draws the foul on Jalen Haliburton! And-1! Tyrese Quickley to the line for 1. [Team fouls: 2] (Jalen Haliburton: 2 personal fouls)   FT 1/1: GOOD Tyrese Quickley makes 1/1 from the line.
Score: 35-33

[06:14] Team_052 possession (Score: 35-33)
Carmelo Giddey attempts a 3Pt. Contested by Tyrese Quickley (5.0 feet, MAN). CARMELO GIDDEY MAKES IT! Assist: Jimmy Doncic
Score: 35-36

[05:56] Team_028 possession (Score: 35-36)
Scottie Ingram attempts a 3Pt. Contested by Jalen Haliburton (4.5 feet, ZONE). Scottie Ingram misses. Rebound secured by Jalen Haliburton.

[05:46] Team_052 possession (Score: 35-36)
Donovan Stewart attempts a 3Pt. Wide open! Miles Booker is 6.0 feet away. [MAN] Donovan Stewart misses. Rebound secured by Collin Bridges.

[05:31] Team_028 possession (Score: 35-36)
Tyrese Quickley attempts a 3Pt. Contested by Jalen Haliburton (4.7 feet, ZONE). Tyrese Quickley misses. Rebound secured by Jalen Haliburton.

[05:19] Team_052 possession (Score: 35-36)
FOUL! Shooting foul on Collin Bridges. Jalen Haliburton to the line for 2 free throws. [BONUS: 5 team fouls] (Collin Bridges: 2 personal fouls)   FT 1/2: GOOD   FT 2/2: GOOD Jalen Haliburton makes 2/2 from the line.
Score: 35-38

[05:07] Team_028 possession (Score: 35-38)
Miles Booker attempts a 3Pt. Contested by Jalen Haliburton (4.5 feet, ZONE). MILES BOOKER MAKES IT! Assist: Collin Bridges
Score: 38-38

[04:52] Team_052 possession (Score: 38-38)
Donovan Stewart makes the Dunk and draws the foul on Collin Bridges! And-1! Donovan Stewart to the line for 1. [BONUS: 6 team fouls] (Collin Bridges: 3 personal fouls)   FT 1/1: GOOD Donovan Stewart makes 1/1 from the line.
Score: 38-41

[04:38] Team_028 possession (Score: 38-41)
Miles Booker attempts a Midrange. Contested by Donovan Stewart (4.7 feet, MAN). Miles Booker misses. Rebound secured by Jalen Haliburton.

[04:23] Team_052 possession (Score: 38-41)
Jalen Haliburton drives and kicks out. Carmelo Giddey attempts a 3Pt. Contested by Tyrese Quickley (4.4 feet, MAN). Carmelo Giddey misses. Rebound secured by Bam Towns.

[04:11] Team_028 possession (Score: 38-41)
Collin Bridges drives, Carmelo Beal stays with him. Collin Bridges attempts a Dunk. Contested by Carmelo Beal (3.8 feet, ZONE). COLLIN BRIDGES MAKES IT!
Score: 40-41

[03:54] Team_052 possession (Score: 40-41)
Carmelo Beal drives, Bam Towns stays with him. Carmelo Beal attempts a Layup. Contested by Bam Towns (5.0 feet, ZONE). CARMELO BEAL MAKES IT! Assist: Carmelo Giddey
Score: 40-43

[03:39] Team_028 possession (Score: 40-43)
Collin Bridges drives and kicks out. Miles Booker attempts a 3Pt. Contested by Donovan Stewart (4.8 feet, MAN). Miles Booker misses. Offensive rebound by Bam Towns! Bam Towns kicks it out.

[03:29] Team_028 possession (Score: 40-43)
Miles Booker attempts a Midrange. Contested by Donovan Stewart (4.7 feet, MAN). Miles Booker misses. Rebound secured by Jalen Haliburton.

[03:14] Team_052 possession (Score: 40-43)
Carmelo Giddey attempts a 3Pt. Wide open! Scottie Ingram is 6.1 feet away. [ZONE] Carmelo Giddey misses. Rebound secured by Tyrese Quickley.

[03:00] Team_028 possession (Score: 40-43)
Tyrese Quickley drives and kicks out. FOUL! Shooting foul on Carmelo Giddey. Tyrese Quickley to the line for 2 free throws. [Team fouls: 3] (Carmelo Giddey: 1 personal fouls)   FT 1/2: GOOD   FT 2/2: GOOD Tyrese Quickley makes 2/2 from the line.
Score: 42-43

[02:41] Team_052 possession (Score: 42-43)
Carmelo Giddey attempts a 3Pt. Contested by Tyrese Quickley (5.0 feet, MAN). CARMELO GIDDEY MAKES IT!
Score: 42-46

[02:27] Team_028 possession (Score: 42-46)
Bam Towns attempts a 3Pt. Contested by Jalen Haliburton (4.5 feet, MAN). Bam Towns misses. Offensive rebound by Bam Towns! Bam Towns kicks it out.

[02:13] Team_028 possession (Score: 42-46)
Scottie Ingram drives and kicks out. Tyrese Quickley attempts a Midrange. Contested by Carmelo Giddey (4.6 feet, MAN). Tyrese Quickley misses. Rebound secured by Carmelo Beal.

[01:59] Team_052 possession (Score: 42-46)
FOUL! Reach-in foul on Collin Bridges during the drive. [IN THE BONUS! 7 team fouls] Carmelo Giddey to the line for 2 free throws. (Collin Bridges: 4 personal fouls)   FT 1/2: GOOD   FT 2/2: GOOD Carmelo Giddey makes 2/2 from the line.
Score: 42-48

[01:46] Team_028 possession (Score: 42-48)
Collin Bridges makes the Layup and draws the foul on Carmelo Beal! And-1! Collin Bridges to the line for 1. [Team fouls: 4] (Carmelo Beal: 1 personal fouls)   FT 1/1: GOOD Collin Bridges makes 1/1 from the line.
Score: 45-48

[01:28] Team_052 possession (Score: 45-48)
Carmelo Giddey attempts a 3Pt. Contested by Tyrese Quickley (5.1 feet, MAN). Carmelo Giddey misses. Offensive rebound by Jalen Haliburton! Jalen Haliburton kicks it out.

[01:14] Team_052 possession (Score: 45-48)
Jalen Haliburton attempts a 3Pt. BLOCKED BY COLLIN BRIDGES! Ball goes out off Collin Bridges. Jalen Haliburton's ball!

[00:58] Team_052 possession (Score: 45-48)
FOUL! Reach-in foul on Scottie Ingram during the drive. [IN THE BONUS! 8 team fouls] Jimmy Doncic to the line for 2 free throws. (Scottie Ingram: 1 personal fouls)   FT 1/2: GOOD   FT 2/2: GOOD Jimmy Doncic makes 2/2 from the line.
Score: 45-50

[00:45] Team_028 possession (Score: 45-50)
FOUL! Reach-in foul on Jalen Haliburton during the drive. [IN THE BONUS! 5 team fouls] Scottie Ingram to the line for 2 free throws. (Jalen Haliburton: 3 personal fouls)   FT 1/2: MISS   FT 2/2: GOOD Scottie Ingram makes 1/2 from the line.
Score: 46-50

[00:33] Team_052 possession (Score: 46-50)
FOUL! Holding foul on Miles Booker. [IN THE BONUS! 9 team fouls] Donovan Stewart to the line for 2 free throws. (Miles Booker: 1 personal fouls)   FT 1/2: GOOD   FT 2/2: GOOD Donovan Stewart makes 2/2 from the line.
Score: 46-52

[00:19] Team_028 possession (Score: 46-52)
FOUL! Holding foul on Donovan Stewart. [IN THE BONUS! 6 team fouls] Miles Booker to the line for 2 free throws. (Donovan Stewart: 1 personal fouls)   FT 1/2: GOOD   FT 2/2: GOOD Miles Booker makes 2/2 from the line.
Score: 48-52

[00:04] Team_052 possession (Score: 48-52)
Carmelo Beal drives and kicks out. Donovan Stewart attempts a Midrange. Wide open! Miles Booker is 6.0 feet away. [MAN] Donovan Stewart misses. Rebound secured by Collin Bridges.

================================================================================
                              2ND QUARTER COMPLETE                              
================================================================================

2ND QUARTER SCORE: Team_028 26, Team_052 32

BOX SCORE:
================================================================================

Team_028
--------------------------------------------------------------------------------
Player                MIN  PTS  REB  AST  TO      FG   FG%      3P   3P%
--------------------------------------------------------------------------------
Tyrese Quickley         9    6    1    0   0   2/3    66.7     0/0   0.0
Myles Haliburton       15    5    0    1   0   2/2   100.0     0/0   0.0
Collin Bridges         12    5    3    1   0   2/4    50.0     0/0   0.0
Miles Booker            9    5    0    0   0   2/4    50.0     0/0   0.0
Jimmy Brogdon          12    2    0    0   0   1/1   100.0     0/0   0.0
Scottie Ingram          9    1    0    0   0   1/3    33.3     0/0   0.0
Kawhi Ball             12    0    2    0   0   0/1     0.0     0/0   0.0
Carmelo Carter         15    0    1    0   0   0/1     0.0     0/0   0.0
Austin Russell         15    0    0    1   0   0/0     0.0     0/0   0.0
Bam Towns              12    0    3    0   0   0/1     0.0     0/0   0.0

TEAM: FG: 10/20 (50.0%), 3PT: 3/7 (42.9%), REB: 10 (4 off, 6 def), AST: 3, TO: 1
TEAM FOULS: 9 [Team_052 in BONUS]


Team_052
--------------------------------------------------------------------------------
Player                MIN  PTS  REB  AST  TO      FG   FG%      3P   3P%
--------------------------------------------------------------------------------
Carmelo Giddey          9   10    0    2   0   4/5    80.0     0/0   0.0
Bones Morant           15    7    3    0   0   3/3   100.0     0/0   0.0
Donovan Stewart         9    5    0    1   0   2/3    66.7     0/0   0.0
Jimmy Doncic            9    5    0    1   0   2/2   100.0     0/0   0.0
Carmelo Beal           12    2    2    1   0   1/2    50.0     0/0   0.0
Jalen Haliburton        9    2    7    0   0   1/2    50.0     0/0   0.0
Josh Durant            15    0    0    0   0   0/1     0.0     0/0   0.0
James Paul             15    0    1    1   0   0/0     0.0     0/0   0.0
Gary Gasol             15    0    0    0   0   0/1     0.0     0/0   0.0

TEAM: FG: 13/19 (68.4%), 3PT: 3/7 (42.9%), REB: 13 (3 off, 10 def), AST: 6, TO: 2
TEAM FOULS: 6 [Team_028 in BONUS]

================================================================================

================================================================================
                       3RD QUARTER - Team_028 vs Team_052                       
================================================================================

[12:00] Team_028 possession (Score: 48-52)
Myles Haliburton attempts a 3Pt. Contested by Bones Morant (3.7 feet, ZONE). Myles Haliburton misses. Rebound secured by James Paul.

[11:47] Team_052 possession (Score: 48-52)
James Paul loses control! Ball rolls out of bounds! TURNOVER! (dead ball)

[11:31] Team_028 possession (Score: 48-52)
Carmelo Carter drives, James Paul stays with him. Carmelo Carter attempts a Layup. Contested by James Paul (3.8 feet, ZONE). Carmelo Carter misses. Rebound secured by James Paul.

[11:15] Team_052 possession (Score: 48-52)
Gary Gasol attempts a 3Pt. Contested by Myles Haliburton (4.1 feet, ZONE). GARY GASOL MAKES IT! Assist: Carmelo Middleton
Score: 48-55

[11:00] Team_028 possession (Score: 48-55)
Myles Haliburton attempts a 3Pt. Contested by Bones Morant (3.7 feet, MAN). Myles Haliburton misses. FOUL! Loose ball foul on James Paul during the rebound battle. [Team fouls: 1] No free throws, side out. (James Paul: 1 personal fouls)

[10:48] Team_028 possession (Score: 48-55)
FOUL! Shooting foul on Bones Morant. Myles Haliburton to the line for 3 free throws. [Team fouls: 2] (Bones Morant: 1 personal fouls)   FT 1/3: GOOD   FT 2/3: GOOD   FT 3/3: MISS Myles Haliburton makes 2/3 from the line. FOUL! Loose ball foul on James Paul during the free throw rebound! [Team fouls: 3] No free throws, side out. (James Paul: 2 personal fouls)
Score: 50-55

[10:38] Team_028 possession (Score: 50-55)
Myles Haliburton commits a violation (traveling/carry)! TURNOVER! (dead ball)

[10:21] Team_052 possession (Score: 50-55)
Bones Morant drives, Kawhi Ball stays with him. Bones Morant attempts a Layup. Contested by Kawhi Ball (4.6 feet, ZONE). BONES MORANT MAKES IT!
Score: 50-57

[10:04] Team_028 possession (Score: 50-57)
Kawhi Ball attempts a Midrange. Contested by Carmelo Middleton (4.5 feet, ZONE). KAWHI BALL MAKES IT! Assist: Jimmy Brogdon
Score: 52-57

[09:46] Team_052 possession (Score: 52-57)
Bones Morant attempts a Midrange. Contested by Kawhi Ball (4.6 feet, ZONE). Bones Morant misses. Rebound secured by Jimmy Brogdon.

[09:35] Team_028 possession (Score: 52-57)
Jimmy Brogdon attempts a 3Pt. Contested by Carmelo Middleton (4.8 feet, MAN). Jimmy Brogdon misses. Offensive rebound by Jimmy Brogdon! Jimmy Brogdon kicks it out.

[09:19] Team_028 possession (Score: 52-57)
Kawhi Ball throws a bad pass out of bounds! TURNOVER! (dead ball)

[09:04] Team_052 possession (Score: 52-57)
Gary Gasol attempts a 3Pt. Contested by Austin Russell (4.9 feet, ZONE). Gary Gasol misses. Rebound secured by Kawhi Ball.

[08:52] Team_028 possession (Score: 52-57)
Jimmy Brogdon attempts a Layup. BLOCKED BY CARMELO MIDDLETON! Ball is loose! Rebound secured by Carmelo Middleton.

[08:35] Team_052 possession (Score: 52-57)
Bones Morant attempts a 3Pt. Contested by Myles Haliburton (4.0 feet, MAN). Bones Morant misses. Offensive rebound by Bones Morant! Bones Morant kicks it out.

[08:20] Team_052 possession (Score: 52-57)
Bones Morant attempts a Midrange. Contested by Myles Haliburton (4.0 feet, ZONE). BONES MORANT MAKES IT! Assist: James Paul
Score: 52-59

[08:07] Team_028 possession (Score: 52-59)
Kawhi Ball attempts a Layup. Contested by James Paul (3.6 feet, MAN). KAWHI BALL MAKES IT! Assist: Austin Russell
Score: 54-59

[07:49] Team_052 possession (Score: 54-59)
Carmelo Middleton attempts a Layup. Contested by Kawhi Ball (4.6 feet, ZONE). CARMELO MIDDLETON MAKES IT!
Score: 54-61

[07:37] Team_028 possession (Score: 54-61)
Jimmy Brogdon attempts a Layup. Contested by Carmelo Middleton (4.8 feet, MAN). Jimmy Brogdon misses. Rebound secured by James Paul.

[07:17] Team_052 possession (Score: 54-61)
Josh Durant attempts a Layup. BLOCKED BY CARMELO CARTER! Ball deflects out of bounds off Josh Durant.

[07:06] Team_028 possession (Score: 54-61)
Jimmy Brogdon attempts a 3Pt. Contested by Bones Morant (4.1 feet, ZONE). Jimmy Brogdon misses. Rebound secured by Bones Morant.

[06:52] Team_052 possession (Score: 54-61)
Josh Durant attempts a 3Pt. Contested by Kawhi Ball (4.0 feet, ZONE). JOSH DURANT MAKES IT!
Score: 54-64

[06:36] Team_028 possession (Score: 54-64)
Jimmy Brogdon drives, Carmelo Middleton stays with him. Jimmy Brogdon attempts a Layup. Contested by Carmelo Middleton (4.8 feet, MAN). JIMMY BROGDON MAKES IT!
Score: 56-64

[06:18] Team_052 possession (Score: 56-64)
Carmelo Middleton drives, Kawhi Ball stays with him. Carmelo Middleton attempts a Dunk. Contested by Kawhi Ball (4.6 feet, ZONE). CARMELO MIDDLETON MAKES IT! Assist: James Paul
Score: 56-66

[06:07] Team_028 possession (Score: 56-66)
Carmelo Carter attempts a 3Pt. Contested by James Paul (3.8 feet, ZONE). Carmelo Carter misses. Rebound secured by Bones Morant.

[05:51] Team_052 possession (Score: 56-66)
James Paul attempts a Midrange. Contested by Kawhi Ball (4.6 feet, MAN). James Paul misses. Rebound secured by Carmelo Carter.

[05:39] Team_028 possession (Score: 56-66)
Austin Russell attempts a 3Pt. Contested by Gary Gasol (3.7 feet, MAN). Austin Russell misses. Rebound secured by James Paul.

[05:29] Team_052 possession (Score: 56-66)
Carmelo Middleton drives and kicks out. Bones Morant attempts a Midrange. Contested by Kawhi Ball (4.2 feet, ZONE). BONES MORANT MAKES IT!
Score: 56-68

[05:15] Team_028 possession (Score: 56-68)
Jimmy Brogdon attempts a 3Pt. Contested by Bones Morant (4.1 feet, ZONE). Jimmy Brogdon misses. Rebound secured by James Paul.

[04:57] Team_052 possession (Score: 56-68)
Josh Durant attempts a Midrange. Contested by Carmelo Carter (4.3 feet, ZONE). Josh Durant misses. Rebound secured by Kawhi Ball.

[04:42] Team_028 possession (Score: 56-68)
FOUL! Reach-in foul on Carmelo Middleton during the drive. [Team fouls: 4] No free throws, side out. (Carmelo Middleton: 1 personal fouls)

[04:30] Team_028 possession (Score: 56-68)
Myles Haliburton attempts a 3Pt. Contested by Bones Morant (3.7 feet, ZONE). Myles Haliburton misses. Rebound secured by James Paul.

[04:12] Team_052 possession (Score: 56-68)
Bones Morant attempts a 3Pt. Contested by Myles Haliburton (4.1 feet, MAN). Bones Morant misses. FOUL! Loose ball foul on Carmelo Carter during the rebound battle. [Team fouls: 1] No free throws, side out. (Carmelo Carter: 1 personal fouls)

[03:57] Team_052 possession (Score: 56-68)
Carmelo Middleton makes the Layup and draws the foul on Jimmy Brogdon! And-1! Carmelo Middleton to the line for 1. [Team fouls: 2] (Jimmy Brogdon: 1 personal fouls)   FT 1/1: MISS Carmelo Middleton makes 0/1 from the line. Offensive rebound by James Paul! James Paul puts it back in!
Score: 56-72

[03:40] Team_028 possession (Score: 56-72)
Austin Russell attempts a Layup. BLOCKED BY GARY GASOL! Ball is loose! Offensive rebound by Jimmy Brogdon! Jimmy Brogdon kicks it out.

[03:23] Team_028 possession (Score: 56-72)
Carmelo Carter attempts a Layup. BLOCKED BY JOSH DURANT! Ball is loose! Rebound secured by James Paul.

[03:11] Team_052 possession (Score: 56-72)
Carmelo Middleton drives and kicks out. Carmelo Middleton attempts a Midrange. Contested by Kawhi Ball (4.5 feet, ZONE). Carmelo Middleton misses. Rebound secured by Jimmy Brogdon.

[02:56] Team_028 possession (Score: 56-72)
FOUL! Shooting foul on James Paul. Kawhi Ball to the line for 2 free throws. [BONUS: 5 team fouls] (James Paul: 3 personal fouls)   FT 1/2: MISS   FT 2/2: GOOD Kawhi Ball makes 1/2 from the line.
Score: 57-72

[02:44] Team_052 possession (Score: 57-72)
FOUL! Reach-in foul on Austin Russell during the drive. [Team fouls: 3] No free throws, side out. (Austin Russell: 1 personal fouls)

[02:32] Team_052 possession (Score: 57-72)
Josh Durant drives, Kawhi Ball stays with him. Josh Durant attempts a Layup. Contested by Kawhi Ball (4.3 feet, ZONE). JOSH DURANT MAKES IT! Assist: Gary Gasol
Score: 57-74

[02:19] Team_028 possession (Score: 57-74)
Myles Haliburton makes the Layup and draws the foul on Bones Morant! And-1! Myles Haliburton to the line for 1. [BONUS: 6 team fouls] (Bones Morant: 2 personal fouls)   FT 1/1: GOOD Myles Haliburton makes 1/1 from the line.
Score: 60-74

[02:04] Team_052 possession (Score: 60-74)
Josh Durant attempts a 3Pt. Contested by Carmelo Carter (4.5 feet, MAN). JOSH DURANT MAKES IT! Assist: Carmelo Middleton
Score: 60-77

[01:50] Team_028 possession (Score: 60-77)
Myles Haliburton attempts a 3Pt. Contested by Bones Morant (4.0 feet, MAN). Myles Haliburton misses. Rebound secured by James Paul.

[01:40] Team_052 possession (Score: 60-77)
Bones Morant makes the Layup and draws the foul on Myles Haliburton! And-1! Bones Morant to the line for 1. [Team fouls: 4] (Myles Haliburton: 1 personal fouls)   FT 1/1: GOOD Bones Morant makes 1/1 from the line.
Score: 60-80

[01:27] Team_028 possession (Score: 60-80)
Myles Haliburton attempts a 3Pt. Contested by Bones Morant (4.0 feet, MAN). MYLES HALIBURTON MAKES IT! Assist: Jimmy Brogdon
Score: 63-80

[01:12] Team_052 possession (Score: 63-80)
Bones Morant attempts a 3Pt. Contested by Myles Haliburton (4.4 feet, MAN). BONES MORANT MAKES IT! Assist: Carmelo Middleton
Score: 63-83

[00:58] Team_028 possession (Score: 63-83)
FOUL! Holding foul on Josh Durant. [IN THE BONUS! 7 team fouls] Carmelo Carter to the line for 2 free throws. (Josh Durant: 1 personal fouls)   FT 1/2: MISS   FT 2/2: GOOD Carmelo Carter makes 1/2 from the line.
Score: 64-83

[00:43] Team_052 possession (Score: 64-83)
Bones Morant attempts a Layup. Contested by Kawhi Ball (5.2 feet, ZONE). Bones Morant misses. Rebound secured by Carmelo Carter.

[00:32] Team_028 possession (Score: 64-83)
Jimmy Brogdon drives to the basket... Jimmy Brogdon loses control! Ball rolls out of bounds! TURNOVER! (dead ball)

[00:32] Substitution (Team_028): Austin Russell OUT → Scottie Ingram IN (stamina_rule2)

[00:32] Substitution (Team_028): Carmelo Carter OUT → Tyrese Quickley IN (stamina_rule2)

[00:32] Substitution (Team_028): Myles Haliburton OUT → Miles Booker IN (stamina_rule2)

[00:32] Substitution (Team_028): Kawhi Ball OUT → Bam Towns IN (stamina_rule2)

[00:32] Substitution (Team_028): Jimmy Brogdon OUT → Collin Bridges IN (stamina_rule2)

[00:32] Substitution (Team_052): Gary Gasol OUT → Jimmy Doncic IN (stamina_rule2)

[00:32] Substitution (Team_052): Josh Durant OUT → Carmelo Giddey IN (stamina_rule2)

[00:32] Substitution (Team_052): Bones Morant OUT → Donovan Stewart IN (stamina_rule2)

[00:32] Substitution (Team_052): James Paul OUT → Jalen Haliburton IN (stamina_rule2)

[00:32] Substitution (Team_052): Carmelo Middleton OUT → Carmelo Beal IN (stamina_rule2)

[00:20] Team_052 possession (Score: 64-83)
Carmelo Giddey attempts a 3Pt. Wide open! Scottie Ingram is 6.1 feet away. [ZONE] Carmelo Giddey misses. Rebound secured by Collin Bridges.

[00:10] Team_028 possession (Score: 64-83)
Bam Towns attempts a Midrange. Contested by Carmelo Giddey (4.6 feet, ZONE). Bam Towns misses. Offensive rebound by Bam Towns! Bam Towns kicks it out.

================================================================================
                              3RD QUARTER COMPLETE                              
================================================================================

3RD QUARTER SCORE: Team_028 16, Team_052 31

BOX SCORE:
================================================================================

Team_028
--------------------------------------------------------------------------------
Player                MIN  PTS  REB  AST  TO      FG   FG%      3P   3P%
--------------------------------------------------------------------------------
Myles Haliburton       27    6    0    0   0   2/5    40.0     0/0   0.0
Kawhi Ball             24    5    4    0   0   3/3   100.0     0/0   0.0
Jimmy Brogdon          24    2    4    2   0   1/5    20.0     0/0   0.0
Carmelo Carter         27    1    2    0   0   1/4    25.0     0/0   0.0
Austin Russell         27    0    0    1   0   0/1     0.0     0/0   0.0
Collin Bridges         12    0    1    0   0   0/0     0.0     0/0   0.0
Bam Towns              12    0    1    0   0   0/0     0.0     0/0   0.0

TEAM: FG: 7/18 (38.9%), 3PT: 1/8 (12.5%), REB: 12 (5 off, 7 def), AST: 3, TO: 3
TEAM FOULS: 4


Team_052
--------------------------------------------------------------------------------
Player                MIN  PTS  REB  AST  TO      FG   FG%      3P   3P%
--------------------------------------------------------------------------------
Bones Morant           27   12    3    0   0   5/7    71.4     0/0   0.0
Josh Durant            27    8    0    0   0   3/5    60.0     0/0   0.0
James Paul             27    4    9    2   0   1/2    50.0     0/0   0.0
Carmelo Middleton      24    4    1    3   0   2/3    66.7     0/0   0.0
Gary Gasol             27    3    0    1   0   1/2    50.0     0/0   0.0
Carmelo Giddey         10    0    0    0   0   0/1     0.0     0/0   0.0

TEAM: FG: 12/20 (60.0%), 3PT: 4/6 (66.7%), REB: 13 (2 off, 11 def), AST: 6, TO: 1
TEAM FOULS: 7 [Team_028 in BONUS]

================================================================================

================================================================================
                       4TH QUARTER - Team_028 vs Team_052                       
================================================================================

[12:00] Substitution (Team_028): Austin Russell OUT (stamina: 72) → Scottie Ingram IN (comeback_detected)

[12:00] Substitution (Team_052): Gary Gasol OUT (stamina: 71) → Jimmy Doncic IN (comeback_detected)

[12:00] Team_028 possession (Score: 64-83)
Jimmy Brogdon makes the Dunk and draws the foul on Josh Durant! And-1! Jimmy Brogdon to the line for 1. [Team fouls: 1] (Josh Durant: 1 personal fouls)   FT 1/1: GOOD Jimmy Brogdon makes 1/1 from the line.
Score: 67-83

[11:47] Team_052 possession (Score: 67-83)
James Paul attempts a 3Pt. Contested by Kawhi Ball (4.9 feet, MAN). James Paul misses. Rebound secured by Kawhi Ball.

[11:35] Team_028 possession (Score: 67-83)
Kawhi Ball drives and kicks out. Kawhi Ball attempts a 3Pt. Contested by Bones Morant (3.9 feet, ZONE). Kawhi Ball misses. Rebound secured by Carmelo Middleton.

[11:19] Team_052 possession (Score: 67-83)
Josh Durant attempts a 3Pt. Contested by Carmelo Carter (4.6 feet, MAN). Josh Durant misses. Offensive rebound by James Paul! James Paul's putback is no good. Offensive rebound by James Paul! James Paul kicks it out.

[11:08] Team_052 possession (Score: 67-83)
Bones Morant attempts a 3Pt. Contested by Scottie Ingram (5.9 feet, ZONE). Bones Morant misses. Offensive rebound by James Paul! James Paul puts it back in!
Score: 67-85

[10:55] Team_028 possession (Score: 67-85)
FOUL! Reach-in foul on James Paul during the drive. [Team fouls: 2] No free throws, side out. (James Paul: 1 personal fouls)

[10:40] Team_028 possession (Score: 67-85)
Jimmy Brogdon attempts a Layup. Contested by Carmelo Middleton (5.2 feet, MAN). JIMMY BROGDON MAKES IT! Assist: Scottie Ingram
Score: 69-85

[10:27] Team_052 possession (Score: 69-85)
Jimmy Doncic attempts a 3Pt. Contested by Scottie Ingram (5.4 feet, MAN). Jimmy Doncic misses. Rebound secured by Carmelo Carter.

[10:12] Team_028 possession (Score: 69-85)
Scottie Ingram attempts a Midrange. Contested by Jimmy Doncic (4.7 feet, MAN). Scottie Ingram misses. Rebound secured by Carmelo Middleton.

[09:53] Team_052 possession (Score: 69-85)
Bones Morant attempts a Midrange. Contested by Myles Haliburton (4.4 feet, MAN). BONES MORANT MAKES IT!
Score: 69-87

[09:37] Team_028 possession (Score: 69-87)
Kawhi Ball drives, James Paul stays with him. Kawhi Ball attempts a Layup. Contested by James Paul (4.1 feet, MAN). Kawhi Ball misses. Rebound secured by James Paul.

[09:21] Team_052 possession (Score: 69-87)
Jimmy Doncic attempts a Midrange. Contested by Carmelo Carter (4.9 feet, ZONE). Jimmy Doncic misses. Rebound secured by Jimmy Brogdon.

[09:08] Team_028 possession (Score: 69-87)
FOUL! Offensive foul on Myles Haliburton! Bones Morant drew the charge! [Team fouls: 1] (Myles Haliburton: 1 personal fouls) TURNOVER! (dead ball)

[08:57] Team_052 possession (Score: 69-87)
Josh Durant attempts a Layup. BLOCKED BY KAWHI BALL! Ball is loose! Offensive rebound by James Paul! James Paul kicks it out.

[08:43] Team_052 possession (Score: 69-87)
Jimmy Doncic drives, picks up Kawhi Ball. Help arrives from Carmelo Carter! Jimmy Doncic attempts a Layup. Contested by Carmelo Carter (4.9 feet, ZONE). Jimmy Doncic misses. Rebound secured by Jimmy Brogdon.

[08:27] Team_028 possession (Score: 69-87)
Kawhi Ball attempts a Layup. BLOCKED BY JOSH DURANT! Ball goes out off Josh Durant. Kawhi Ball's ball!

[08:13] Team_028 possession (Score: 69-87)
FOUL! Shooting foul on James Paul. Carmelo Carter to the line for 2 free throws. [Team fouls: 3] (James Paul: 2 personal fouls)   FT 1/2: GOOD   FT 2/2: MISS Carmelo Carter makes 1/2 from the line. Rebound secured by James Paul.
Score: 70-87

[07:57] Team_052 possession (Score: 70-87)
Josh Durant attempts a 3Pt. Contested by Carmelo Carter (5.0 feet, MAN). Josh Durant misses. Rebound secured by Kawhi Ball.

[07:46] Team_028 possession (Score: 70-87)
Jimmy Brogdon attempts a Layup. Contested by James Paul (4.6 feet, ZONE). JIMMY BROGDON MAKES IT! Assist: Myles Haliburton
Score: 72-87

[07:30] Team_052 possession (Score: 72-87)
Bones Morant drives to the basket... Bones Morant throws a bad pass! Stolen by Kawhi Ball! TURNOVER! (live ball)

[07:14] Team_028 possession (Score: 72-87)
Scottie Ingram attempts a Midrange. Contested by Josh Durant (4.2 feet, ZONE). SCOTTIE INGRAM MAKES IT!
Score: 74-87

[06:58] Team_052 possession (Score: 74-87)
Josh Durant attempts a 3Pt. Contested by Scottie Ingram (5.2 feet, ZONE). Josh Durant misses. Rebound secured by Jimmy Brogdon.

[06:43] Team_028 possession (Score: 74-87)
Jimmy Brogdon drives, James Paul stays with him. Jimmy Brogdon attempts a Dunk. Contested by James Paul (4.7 feet, ZONE). Jimmy Brogdon misses. Rebound secured by Bones Morant.

[06:32] Team_052 possession (Score: 74-87)
Carmelo Middleton drives, picks up Jimmy Brogdon. Help arrives from Carmelo Carter! Carmelo Middleton attempts a Dunk. Contested by Carmelo Carter (5.6 feet, MAN). CARMELO MIDDLETON MAKES IT!
Score: 74-89

[06:19] Team_028 possession (Score: 74-89)
Kawhi Ball attempts a 3Pt. Contested by Bones Morant (4.6 feet, ZONE). Kawhi Ball misses. Rebound secured by Jimmy Doncic.

[06:05] Team_052 possession (Score: 74-89)
FOUL! Shooting foul on Jimmy Brogdon. Carmelo Middleton to the line for 2 free throws. [Team fouls: 2] (Jimmy Brogdon: 1 personal fouls)   FT 1/2: GOOD   FT 2/2: GOOD Carmelo Middleton makes 2/2 from the line.
Score: 74-91

[05:50] Team_028 possession (Score: 74-91)
Carmelo Carter drives to the basket... FOUL! Offensive foul on Carmelo Carter! James Paul drew the charge! [Team fouls: 3] (Carmelo Carter: 1 personal fouls) TURNOVER! (dead ball)

[05:37] Team_052 possession (Score: 74-91)
FOUL! Holding foul on Kawhi Ball. [Team fouls: 4] No free throws, side out. (Kawhi Ball: 1 personal fouls)

[05:26] Team_052 possession (Score: 74-91)
James Paul makes the Layup and draws the foul on Kawhi Ball! And-1! James Paul to the line for 1. [BONUS: 5 team fouls] (Kawhi Ball: 2 personal fouls)   FT 1/1: GOOD James Paul makes 1/1 from the line.
Score: 74-94

[05:13] Team_028 possession (Score: 74-94)
Carmelo Carter attempts a 3Pt. Contested by Josh Durant (4.7 feet, MAN). CARMELO CARTER MAKES IT! Assist: Scottie Ingram
Score: 77-94

[05:04] Team_052 possession (Score: 77-94)
Josh Durant attempts a 3Pt. Contested by Carmelo Carter (5.4 feet, MAN). Josh Durant misses. Rebound secured by Jimmy Brogdon.

[04:50] Team_028 possession (Score: 77-94)
Kawhi Ball attempts a 3Pt. Contested by Bones Morant (4.9 feet, ZONE). Kawhi Ball misses. Rebound secured by Jimmy Doncic.

[04:38] Team_052 possession (Score: 77-94)
Jimmy Doncic attempts a 3Pt. Contested by Scottie Ingram (5.5 feet, ZONE). Jimmy Doncic misses. Offensive rebound by Jimmy Doncic! Jimmy Doncic kicks it out.

[04:28] Team_052 possession (Score: 77-94)
Josh Durant attempts a 3Pt. Contested by Scottie Ingram (5.4 feet, ZONE). Josh Durant misses. Rebound secured by Kawhi Ball.

[04:14] Team_028 possession (Score: 77-94)
FOUL! Reach-in foul on Jimmy Doncic during the drive. [Team fouls: 4] No free throws, side out. (Jimmy Doncic: 1 personal fouls)

[04:02] Team_028 possession (Score: 77-94)
Scottie Ingram drives, Jimmy Doncic stays with him. Scottie Ingram attempts a Layup. Contested by Jimmy Doncic (4.9 feet, MAN). Scottie Ingram misses. Rebound secured by Bones Morant.

[03:52] Team_052 possession (Score: 77-94)
Carmelo Middleton attempts a Midrange. Wide open! Jimmy Brogdon is 6.1 feet away. [MAN] Carmelo Middleton misses. FOUL! Loose ball foul on Kawhi Ball during the rebound battle. [IN THE BONUS! 6 team fouls] Jimmy Doncic to the line for 2 free throws. (Kawhi Ball: 3 personal fouls)   FT 1/2: MISS   FT 2/2: GOOD Jimmy Doncic makes 1/2 from the line.
Score: 77-95

[03:36] Team_028 possession (Score: 77-95)
Scottie Ingram attempts a 3Pt. Contested by Jimmy Doncic (4.9 feet, MAN). Scottie Ingram misses. FOUL! Loose ball foul on Bones Morant during the rebound battle. [IN THE BONUS! 5 team fouls] Jimmy Brogdon to the line for 2 free throws. (Bones Morant: 1 personal fouls)   FT 1/2: GOOD   FT 2/2: MISS Jimmy Brogdon makes 1/2 from the line. Rebound secured by Bones Morant.
Score: 78-95

[03:25] Team_052 possession (Score: 78-95)
Josh Durant drives to the basket... Josh Durant commits a violation (traveling/carry)! TURNOVER! (dead ball)

[03:25] Substitution (Team_028): Carmelo Carter OUT → Tyrese Quickley IN (stamina_rule2)

[03:25] Substitution (Team_028): Myles Haliburton OUT → Miles Booker IN (stamina_rule2)

[03:25] Substitution (Team_028): Kawhi Ball OUT → Bam Towns IN (stamina_rule2)

[03:25] Substitution (Team_028): Jimmy Brogdon OUT → Collin Bridges IN (stamina_rule2)

[03:25] Substitution (Team_052): Josh Durant OUT → Carmelo Giddey IN (stamina_rule2)

[03:25] Substitution (Team_052): Bones Morant OUT → Donovan Stewart IN (stamina_rule2)

[03:25] Substitution (Team_052): James Paul OUT → Jalen Haliburton IN (stamina_rule2)

[03:25] Substitution (Team_052): Carmelo Middleton OUT → Carmelo Beal IN (stamina_rule2)

[03:13] Team_028 possession (Score: 78-95)
FOUL! Holding foul on Carmelo Giddey. [IN THE BONUS! 6 team fouls] Tyrese Quickley to the line for 2 free throws. (Carmelo Giddey: 1 personal fouls)   FT 1/2: MISS   FT 2/2: GOOD Tyrese Quickley makes 1/2 from the line.
Score: 79-95

[02:54] Team_052 possession (Score: 79-95)
Carmelo Beal attempts a Midrange. Contested by Collin Bridges (3.6 feet, MAN). Carmelo Beal misses. Offensive rebound by Jalen Haliburton! Jalen Haliburton kicks it out.

[02:41] Team_052 possession (Score: 79-95)
Jalen Haliburton makes the Layup and draws the foul on Collin Bridges! And-1! Jalen Haliburton to the line for 1. [BONUS: 7 team fouls] (Collin Bridges: 1 personal fouls)   FT 1/1: MISS Jalen Haliburton makes 0/1 from the line. Offensive rebound by Carmelo Beal! Carmelo Beal kicks it out.
Score: 79-97

[02:24] Team_052 possession (Score: 79-97)
FOUL! Reach-in foul on Collin Bridges during the drive. [IN THE BONUS! 8 team fouls] Jalen Haliburton to the line for 2 free throws. (Collin Bridges: 2 personal fouls)   FT 1/2: GOOD   FT 2/2: MISS Jalen Haliburton makes 1/2 from the line. Rebound secured by Bam Towns.
Score: 79-98

[02:13] Team_028 possession (Score: 79-98)
Tyrese Quickley attempts a Layup. BLOCKED BY CARMELO GIDDEY! Ball deflects out of bounds off Tyrese Quickley.

[01:57] Team_052 possession (Score: 79-98)
Donovan Stewart attempts a 3Pt. Wide open! Miles Booker is 6.0 feet away. [ZONE] Donovan Stewart misses. Rebound secured by Bam Towns.

[01:48] Team_028 possession (Score: 79-98)
Bam Towns attempts a Midrange. Contested by Jimmy Doncic (5.2 feet, ZONE). Bam Towns misses. Offensive rebound by Bam Towns! Bam Towns kicks it out.

[01:33] Team_028 possession (Score: 79-98)
Miles Booker attempts a Midrange. Contested by Donovan Stewart (4.7 feet, MAN). Miles Booker misses. Rebound secured by Carmelo Beal.

[01:22] Team_052 possession (Score: 79-98)
Carmelo Giddey makes the Midrange and draws the foul on Tyrese Quickley! And-1! Carmelo Giddey to the line for 1. [BONUS: 9 team fouls] (Tyrese Quickley: 1 personal fouls)   FT 1/1: MISS Carmelo Giddey makes 0/1 from the line. Offensive rebound by Jalen Haliburton! Jalen Haliburton kicks it out.
Score: 79-100

[01:11] Team_052 possession (Score: 79-100)
FOUL! Shooting foul on Collin Bridges. Carmelo Beal to the line for 2 free throws. [BONUS: 10 team fouls] (Collin Bridges: 3 personal fouls)   FT 1/2: GOOD   FT 2/2: GOOD Carmelo Beal makes 2/2 from the line.
Score: 79-102

[01:01] Team_028 possession (Score: 79-102)
Bam Towns attempts a Midrange. Contested by Jalen Haliburton (4.6 feet, MAN). BAM TOWNS MAKES IT!
Score: 81-102

[00:48] Team_052 possession (Score: 81-102)
Carmelo Beal drives, Collin Bridges stays with him. Carmelo Beal attempts a Layup. Contested by Collin Bridges (3.6 feet, ZONE). Carmelo Beal misses. Rebound secured by Tyrese Quickley.

[00:34] Team_028 possession (Score: 81-102)
Bam Towns makes the Layup and draws the foul on Carmelo Giddey! And-1! Bam Towns to the line for 1. [BONUS: 7 team fouls] (Carmelo Giddey: 2 personal fouls)   FT 1/1: GOOD Bam Towns makes 1/1 from the line.
Score: 84-102

[00:22] Team_052 possession (Score: 84-102)
Carmelo Giddey drives, picks up Collin Bridges. Help arrives from Tyrese Quickley! Carmelo Giddey attempts a Layup. Contested by Tyrese Quickley (4.4 feet, ZONE). CARMELO GIDDEY MAKES IT! Assist: Carmelo Beal
Score: 84-104

[00:05] Team_028 possession (Score: 84-104)
Collin Bridges attempts a Midrange. Contested by Carmelo Giddey (4.8 feet, ZONE). COLLIN BRIDGES MAKES IT! Assist: Scottie Ingram
Score: 86-104

================================================================================
                              4TH QUARTER COMPLETE                              
================================================================================

4TH QUARTER SCORE: Team_028 22, Team_052 21

BOX SCORE:
================================================================================

Team_028
--------------------------------------------------------------------------------
Player                MIN  PTS  REB  AST  TO      FG   FG%      3P   3P%
--------------------------------------------------------------------------------
Jimmy Brogdon          33    7    4    0   0   3/4    75.0     0/0   0.0
Bam Towns              16    5    3    0   0   2/2   100.0     0/0   0.0
Carmelo Carter         36    3    1    0   0   1/2    50.0     0/0   0.0
Scottie Ingram         22    2    0    3   0   1/4    25.0     0/0   0.0
Bones Morant           36    2    3    0   0   1/1   100.0     0/0   0.0
Collin Bridges         16    2    0    0   0   1/1   100.0     0/0   0.0
Tyrese Quickley        13    1    1    0   0   1/2    50.0     0/0   0.0
Kawhi Ball             33    0    3    0   0   0/4     0.0     0/0   0.0
Myles Haliburton       36    0    0    1   0   0/0     0.0     0/0   0.0
Miles Booker           13    0    0    0   0   0/1     0.0     0/0   0.0

TEAM: FG: 9/20 (45.0%), 3PT: 1/4 (25.0%), REB: 13 (2 off, 11 def), AST: 4, TO: 2
TEAM FOULS: 10 [Team_052 in BONUS]


Team_052
--------------------------------------------------------------------------------
Player                MIN  PTS  REB  AST  TO      FG   FG%      3P   3P%
--------------------------------------------------------------------------------
James Paul             36    5    5    0   0   2/3    66.7     0/0   0.0
Carmelo Middleton      33    4    2    0   0   2/2   100.0     0/0   0.0
Carmelo Beal           16    2    2    1   0   1/2    50.0     0/0   0.0
Carmelo Giddey         13    2    0    0   0   1/1   100.0     0/0   0.0
Jimmy Doncic           22    1    3    0   0   1/4    25.0     0/0   0.0
Josh Durant            36    0    0    0   0   0/4     0.0     0/0   0.0
Jalen Haliburton       13    0    2    0   0   0/1     0.0     0/0   0.0
Donovan Stewart        13    0    0    0   0   0/1     0.0     0/0   0.0

TEAM: FG: 8/19 (42.1%), 3PT: 1/8 (12.5%), REB: 16 (7 off, 9 def), AST: 1, TO: 2
TEAM FOULS: 7 [Team_028 in BONUS]

================================================================================

================================================================================
                               FULL GAME COMPLETE                               
================================================================================

FINAL SCORE: Team_028 86, Team_052 104

SCORING BY QUARTER:
--------------------------------------------------------------------------------
Team                     Q1     Q2     Q3     Q4    FINAL
--------------------------------------------------------------------------------
Team_028                 22     26     16     22       86
Team_052                 20     32     31     21      104
--------------------------------------------------------------------------------

FULL GAME BOX SCORE:
================================================================================

Team_028
--------------------------------------------------------------------------------
Player                MIN  PTS  REB  AST  TO      FG   FG%      3P   3P%      FT STL BLK
--------------------------------------------------------------------------------
Carmelo Carter         36    6    7    2   1   2/8    25.0   1/4    25.0   2/4     0   1
Myles Haliburton       36   13    0    3   4   6/11   54.5   2/6    33.3   4/6     0   1
Kawhi Ball             33    9   11    1   2   5/12   41.7   0/3     0.0   3/4     1   2
Jimmy Brogdon          33   20   14    3   0   8/18   44.4   0/2     0.0   2/3     2   0
Austin Russell         27    2    0    2   0   1/2    50.0   0/1     0.0   0/0     0   0
Scottie Ingram         22    3    0    3   2   2/7    28.6   0/2     0.0   1/2     0   0
Bam Towns              16    7    7    0   0   3/4    75.0   0/0     0.0   1/2     0   0
Collin Bridges         16    7    5    1   0   3/5    60.0   0/0     0.0   1/1     0   1
Tyrese Quickley        13    7    3    0   0   2/4    50.0   1/2    50.0   4/5     0   0
Miles Booker           13    5    0    0   0   1/4    25.0   1/1   100.0   2/2     0   0

TEAM: FG: 36/78 (46.2%), 3PT: 5/21 (23.8%), REB: 48 (13 off, 35 def), AST: 15, TO: 9


Team_052
--------------------------------------------------------------------------------
Player                MIN  PTS  REB  AST  TO      FG   FG%      3P   3P%      FT STL BLK
--------------------------------------------------------------------------------
Josh Durant            36   12    0    2   2   4/15   26.7   3/9    33.3   1/1     0   2
Bones Morant           36   28   12    0   0  12/16   75.0   3/3   100.0   2/2     0   0
James Paul             36   11   19    3   1   2/6    33.3   1/2    50.0   4/5     1   0
Carmelo Middleton      33   13    8    3   3   9/10   90.0   1/1   100.0   2/4     0   1
Gary Gasol             27    3    0    1   1   1/5    20.0   1/4    25.0   0/0     0   1
Jimmy Doncic           22    6    3    1   1   2/6    33.3   1/3    33.3   3/4     1   0
Carmelo Beal           16    4    4    2   1   2/4    50.0   0/0     0.0   2/2     0   0
Carmelo Giddey         13   12    0    2   0   5/7    71.4   2/4    50.0   2/3     0   1
Donovan Stewart        13    5    0    1   0   1/3    33.3   0/2     0.0   3/3     0   0
Jalen Haliburton       13    2    9    0   0   1/3    33.3   0/0     0.0   3/5     0   0

TEAM: FG: 40/76 (52.6%), 3PT: 12/28 (42.9%), REB: 53 (13 off, 40 def), AST: 15, TO: 9

================================================================================
