================================================================================
                        FULL GAME - Team_063 vs Team_018                        
================================================================================

================================================================================
                       1ST QUARTER - Team_063 vs Team_018                       
================================================================================

[12:00] Team_063 possession (Score: 0-0)
Tyler Harris attempts a Midrange. Contested by Domantas Wall (3.4 feet, MAN). Tyler Harris misses. Rebound secured by Allen Markkanen.

[11:45] Team_018 possession (Score: 0-0)
Domantas Wall attempts a Midrange. Contested by Tyler Harris (4.6 feet, ZONE). Domantas Wall misses. Rebound secured by Tyler Harris.

[11:30] Team_063 possession (Score: 0-0)
Malcolm Quickley attempts a 3Pt. Contested by Tracy Bryant (3.2 feet, MAN). MALCOLM QUICKLEY MAKES IT! Assist: Tyler Harris
Score: 3-0

[11:14] Team_018 possession (Score: 3-0)
Klay Stewart drives, picks up Bradley Davis. Help arrives from Malcolm Quickley! Klay Stewart attempts a Layup. Contested by Malcolm Quickley (5.1 feet, MAN). Klay Stewart misses. Rebound secured by Tyler Harris.

[11:00] Team_063 possession (Score: 3-0)
Terry Reaves attempts a Layup. Contested by Allen Markkanen (4.1 feet, MAN). Terry Reaves misses. Rebound secured by Allen Markkanen.

[10:44] Team_018 possession (Score: 3-0)
Allen Markkanen drives and kicks out. Klay Stewart attempts a Midrange. Contested by Bradley Davis (4.9 feet, ZONE). Klay Stewart misses. Rebound secured by Dirk Reaves.

[10:28] Team_063 possession (Score: 3-0)
Dirk Reaves attempts a 3Pt. Contested by Klay Stewart (4.3 feet, ZONE). Dirk Reaves misses. Rebound secured by Bones Anunoby.

[10:10] Team_018 possession (Score: 3-0)
Allen Markkanen drives to the basket... FOUL! Offensive foul on Allen Markkanen! Terry Reaves drew the charge! [Team fouls: 1] (Allen Markkanen: 1 personal fouls) TURNOVER! (dead ball)

[09:55] Team_063 possession (Score: 3-0)
Dirk Reaves attempts a Midrange. Contested by Bones Anunoby (3.5 feet, MAN). DIRK REAVES MAKES IT! Assist: Tyler Harris
Score: 5-0

[09:40] Team_018 possession (Score: 5-0)
FOUL! Offensive foul on Allen Markkanen! Terry Reaves drew the charge! [Team fouls: 2] (Allen Markkanen: 2 personal fouls) TURNOVER! (dead ball)

[09:29] Team_063 possession (Score: 5-0)
Tyler Harris throws a bad pass out of bounds! TURNOVER! (dead ball)

[09:12] Team_018 possession (Score: 5-0)
FOUL! Reach-in foul on Tyler Harris during the drive. [Team fouls: 1] No free throws, side out. (Tyler Harris: 1 personal fouls)

[08:58] Team_018 possession (Score: 5-0)
FOUL! Shooting foul on Dirk Reaves. Bones Anunoby to the line for 2 free throws. [Team fouls: 2] (Dirk Reaves: 1 personal fouls)   FT 1/2: MISS   FT 2/2: MISS Bones Anunoby makes 0/2 from the line. Offensive rebound by Domantas Wall! Domantas Wall puts it back in!
Score: 5-2

[08:41] Team_063 possession (Score: 5-2)
Malcolm Quickley attempts a 3Pt. Contested by Klay Stewart (3.9 feet, ZONE). Malcolm Quickley misses. Offensive rebound by Dirk Reaves! Dirk Reaves's putback is no good. Rebound secured by Bones Anunoby.

[08:25] Team_018 possession (Score: 5-2)
Allen Markkanen makes the Layup and draws the foul on Tyler Harris! And-1! Allen Markkanen to the line for 1. [Team fouls: 3] (Tyler Harris: 2 personal fouls)   FT 1/1: GOOD Allen Markkanen makes 1/1 from the line.
Score: 5-5

[08:13] Team_063 possession (Score: 5-5)
Malcolm Quickley drives and kicks out. FOUL! Shooting foul on Klay Stewart. Malcolm Quickley to the line for 3 free throws. [Team fouls: 3] (Klay Stewart: 1 personal fouls)   FT 1/3: GOOD   FT 2/3: GOOD   FT 3/3: GOOD Malcolm Quickley makes 3/3 from the line.
Score: 8-5

[07:55] Team_018 possession (Score: 8-5)
FOUL! Holding foul on Malcolm Quickley. [Team fouls: 4] No free throws, side out. (Malcolm Quickley: 1 personal fouls)

[07:40] Team_018 possession (Score: 8-5)
Bones Anunoby attempts a Layup. Contested by Tyler Harris (4.7 feet, ZONE). BONES ANUNOBY MAKES IT!
Score: 8-7

[07:27] Team_063 possession (Score: 8-7)
Tyler Harris drives, Domantas Wall stays with him. Tyler Harris attempts a Dunk. Contested by Domantas Wall (3.4 feet, MAN). TYLER HARRIS MAKES IT! Assist: Malcolm Quickley
Score: 10-7

[07:10] Team_018 possession (Score: 10-7)
FOUL! Reach-in foul on Tyler Harris during the drive. [IN THE BONUS! 5 team fouls] Domantas Wall to the line for 2 free throws. (Tyler Harris: 3 personal fouls)   FT 1/2: GOOD   FT 2/2: GOOD Domantas Wall makes 2/2 from the line.
Score: 10-9

[06:57] Team_063 possession (Score: 10-9)
Terry Reaves attempts a 3Pt. BLOCKED BY ALLEN MARKKANEN! Ball is loose! Rebound secured by Bones Anunoby.

[06:39] Team_018 possession (Score: 10-9)
FOUL! Holding foul on Terry Reaves. [IN THE BONUS! 6 team fouls] Allen Markkanen to the line for 2 free throws. (Terry Reaves: 1 personal fouls)   FT 1/2: GOOD   FT 2/2: GOOD Allen Markkanen makes 2/2 from the line.
Score: 10-11

[06:27] Team_063 possession (Score: 10-11)
Bradley Davis attempts a 3Pt. Contested by Klay Stewart (4.3 feet, MAN). Bradley Davis misses. Rebound secured by Allen Markkanen.

[06:15] Team_018 possession (Score: 10-11)
Bones Anunoby makes the Layup and draws the foul on Dirk Reaves! And-1! Bones Anunoby to the line for 1. [BONUS: 7 team fouls] (Dirk Reaves: 2 personal fouls)   FT 1/1: MISS Bones Anunoby makes 0/1 from the line. Rebound secured by Malcolm Quickley.
Score: 10-13

[06:02] Team_063 possession (Score: 10-13)
Tyler Harris attempts a Layup. Contested by Domantas Wall (3.4 feet, MAN). Tyler Harris misses. Rebound secured by Domantas Wall.

[05:47] Team_018 possession (Score: 10-13)
Klay Stewart attempts a Midrange. Contested by Bradley Davis (5.1 feet, MAN). Klay Stewart misses. Rebound secured by Tyler Harris.

[05:30] Team_063 possession (Score: 10-13)
FOUL! Holding foul on Tracy Bryant. [Team fouls: 4] No free throws, side out. (Tracy Bryant: 1 personal fouls)

[05:16] Team_063 possession (Score: 10-13)
Tyler Harris attempts a 3Pt. Contested by Klay Stewart (4.0 feet, ZONE). Tyler Harris misses. Rebound secured by Bones Anunoby.

[04:56] Team_018 possession (Score: 10-13)
Domantas Wall attempts a Midrange. Contested by Tyler Harris (4.7 feet, MAN). Domantas Wall misses. Rebound secured by Dirk Reaves.

[04:41] Team_063 possession (Score: 10-13)
Dirk Reaves drives, Bones Anunoby stays with him. Dirk Reaves attempts a Layup. Contested by Bones Anunoby (3.6 feet, MAN). DIRK REAVES MAKES IT! Assist: Tyler Harris
Score: 12-13

[04:30] Team_018 possession (Score: 12-13)
Tracy Bryant drives to the basket... FOUL! Offensive foul on Tracy Bryant! Tyler Harris drew the charge! [Team fouls: 5] (Tracy Bryant: 2 personal fouls) TURNOVER! (dead ball)

[04:11] Team_063 possession (Score: 12-13)
Terry Reaves attempts a 3Pt. Contested by Klay Stewart (4.4 feet, ZONE). Terry Reaves misses. Rebound secured by Domantas Wall.

[03:57] Team_018 possession (Score: 12-13)
Bones Anunoby drives, Tyler Harris stays with him. Bones Anunoby attempts a Layup. Contested by Tyler Harris (4.8 feet, ZONE). BONES ANUNOBY MAKES IT! Assist: Tracy Bryant
Score: 12-15

[03:45] Team_063 possession (Score: 12-15)
Dirk Reaves attempts a Midrange. Contested by Allen Markkanen (4.1 feet, ZONE). Dirk Reaves misses. Offensive rebound by Dirk Reaves! Dirk Reaves puts it back in!
Score: 14-15

[03:27] Team_018 possession (Score: 14-15)
Allen Markkanen drives, picks up Terry Reaves. Help arrives from Malcolm Quickley! Allen Markkanen attempts a Layup. Contested by Malcolm Quickley (5.1 feet, MAN). ALLEN MARKKANEN MAKES IT!
Score: 14-17

[03:12] Team_063 possession (Score: 14-17)
Bradley Davis attempts a Midrange. Contested by Klay Stewart (4.4 feet, MAN). Bradley Davis misses. Rebound secured by Allen Markkanen.

[02:58] Team_018 possession (Score: 14-17)
Tracy Bryant attempts a 3Pt. Contested by Malcolm Quickley (4.0 feet, ZONE). Tracy Bryant misses. Rebound secured by Tyler Harris.

[02:47] Team_063 possession (Score: 14-17)
Bradley Davis attempts a Midrange. Contested by Klay Stewart (4.5 feet, MAN). BRADLEY DAVIS MAKES IT!
Score: 16-17

[02:29] Team_018 possession (Score: 16-17)
Domantas Wall makes the Layup and draws the foul on Tyler Harris! And-1! Domantas Wall to the line for 1. [BONUS: 8 team fouls] (Tyler Harris: 4 personal fouls)   FT 1/1: GOOD Domantas Wall makes 1/1 from the line.
Score: 16-20

[02:18] Team_063 possession (Score: 16-20)
Tyler Harris attempts a Midrange. Contested by Domantas Wall (3.7 feet, MAN). TYLER HARRIS MAKES IT! Assist: Dirk Reaves
Score: 18-20

[02:06] Team_018 possession (Score: 18-20)
Allen Markkanen attempts a 3Pt. Contested by Malcolm Quickley (4.1 feet, ZONE). Allen Markkanen misses. Rebound secured by Malcolm Quickley.

[01:53] Team_063 possession (Score: 18-20)
Tyler Harris drives and kicks out. Bradley Davis attempts a Midrange. Contested by Tracy Bryant (3.7 feet, ZONE). Bradley Davis misses. Rebound secured by Bones Anunoby.

[01:34] Team_018 possession (Score: 18-20)
Allen Markkanen makes the 3Pt and draws the foul on Terry Reaves! And-1! Allen Markkanen to the line for 1. [BONUS: 9 team fouls] (Terry Reaves: 2 personal fouls)   FT 1/1: GOOD Allen Markkanen makes 1/1 from the line.
Score: 18-24

[01:15] Team_063 possession (Score: 18-24)
FOUL! Reach-in foul on Bones Anunoby during the drive. [IN THE BONUS! 6 team fouls] Dirk Reaves to the line for 2 free throws. (Bones Anunoby: 1 personal fouls)   FT 1/2: GOOD   FT 2/2: GOOD Dirk Reaves makes 2/2 from the line.
Score: 20-24

[01:02] Team_018 possession (Score: 20-24)
Tracy Bryant drives, Malcolm Quickley stays with him. Tracy Bryant attempts a Dunk. Contested by Malcolm Quickley (4.2 feet, MAN). TRACY BRYANT MAKES IT! Assist: Allen Markkanen
Score: 20-26

[00:49] Team_063 possession (Score: 20-26)
Dirk Reaves makes the Midrange and draws the foul on Bones Anunoby! And-1! Dirk Reaves to the line for 1. [BONUS: 7 team fouls] (Bones Anunoby: 2 personal fouls)   FT 1/1: GOOD Dirk Reaves makes 1/1 from the line.
Score: 23-26

[00:39] Team_018 possession (Score: 23-26)
Klay Stewart makes the 3Pt and draws the foul on Malcolm Quickley! And-1! Klay Stewart to the line for 1. [BONUS: 10 team fouls] (Malcolm Quickley: 2 personal fouls)   FT 1/1: GOOD Klay Stewart makes 1/1 from the line.
Score: 23-30

[00:25] Team_063 possession (Score: 23-30)
Tyler Harris drives, picks up Domantas Wall. Help arrives from Klay Stewart! Tyler Harris attempts a Dunk. Contested by Klay Stewart (4.0 feet, ZONE). TYLER HARRIS MAKES IT!
Score: 25-30

[00:11] Team_018 possession (Score: 25-30)
Klay Stewart attempts a 3Pt. Contested by Bradley Davis (5.5 feet, MAN). Klay Stewart misses. Rebound secured by Dirk Reaves.

================================================================================
                              1ST QUARTER COMPLETE                              
================================================================================

1ST QUARTER SCORE: Team_063 25, Team_018 30

BOX SCORE:
================================================================================

Team_063
--------------------------------------------------------------------------------
Player                MIN  PTS  REB  AST  TO      FG   FG%      3P   3P%
--------------------------------------------------------------------------------
Dirk Reaves            12   11    4    1   0   5/6    83.3     0/0   0.0
Tyler Harris           12    6    4    3   0   3/7    42.9     0/0   0.0
Malcolm Quickley       12    6    2    1   0   2/3    66.7     0/0   0.0
Bradley Davis          12    2    0    0   0   1/3    33.3     0/0   0.0
Terry Reaves           12    0    0    0   0   0/3     0.0     0/0   0.0

TEAM: FG: 11/22 (50.0%), 3PT: 1/7 (14.3%), REB: 11 (2 off, 9 def), AST: 5, TO: 1
TEAM FOULS: 10 [Team_018 in BONUS]


Team_018
--------------------------------------------------------------------------------
Player                MIN  PTS  REB  AST  TO      FG   FG%      3P   3P%
--------------------------------------------------------------------------------
Allen Markkanen        12   11    4    1   0   4/6    66.7     0/0   0.0
Domantas Wall          12    7    2    0   0   3/5    60.0     0/0   0.0
Klay Stewart           12    4    0    0   0   1/4    25.0     0/0   0.0
Bones Anunoby          12    4    5    0   0   2/3    66.7     0/0   0.0
Tracy Bryant           12    2    0    1   0   1/2    50.0     0/0   0.0

TEAM: FG: 11/20 (55.0%), 3PT: 2/5 (40.0%), REB: 10 (0 off, 10 def), AST: 2, TO: 3
TEAM FOULS: 7 [Team_063 in BONUS]

================================================================================

================================================================================
                       2ND QUARTER - Team_063 vs Team_018                       
================================================================================

[12:00] Team_063 possession (Score: 25-30)
Dirk Reaves drives, Bones Anunoby stays with him. Dirk Reaves attempts a Dunk. Contested by Bones Anunoby (3.9 feet, MAN). Dirk Reaves misses. Offensive rebound by Tyler Harris! Tyler Harris puts it back in!
Score: 27-30

[11:43] Team_018 possession (Score: 27-30)
Tracy Bryant drives, Tyler Harris stays with him. Tracy Bryant attempts a Dunk. Contested by Tyler Harris (5.1 feet, ZONE). TRACY BRYANT MAKES IT!
Score: 27-32

[11:32] Team_063 possession (Score: 27-32)
Malcolm Quickley attempts a 3Pt. Contested by Bones Anunoby (3.5 feet, ZONE). Malcolm Quickley misses. Rebound secured by Bones Anunoby.

[11:16] Team_018 possession (Score: 27-32)
Domantas Wall drives and kicks out. Klay Stewart attempts a Midrange. Contested by Bradley Davis (5.2 feet, MAN). KLAY STEWART MAKES IT! Assist: Bones Anunoby
Score: 27-34

[11:02] Team_063 possession (Score: 27-34)
Malcolm Quickley drives, Tracy Bryant stays with him. Malcolm Quickley attempts a Layup. Contested by Tracy Bryant (3.5 feet, MAN). MALCOLM QUICKLEY MAKES IT! Assist: Terry Reaves
Score: 29-34

[10:50] Team_018 possession (Score: 29-34)
Domantas Wall attempts a 3Pt. Contested by Tyler Harris (5.1 feet, MAN). Domantas Wall misses. FOUL! Loose ball foul on Tyler Harris during the rebound battle. [Team fouls: 1] No free throws, side out. (Tyler Harris: 1 personal fouls)

[10:35] Team_018 possession (Score: 29-34)
FOUL! Shooting foul on Terry Reaves. Tracy Bryant to the line for 2 free throws. [Team fouls: 2] (Terry Reaves: 1 personal fouls)   FT 1/2: MISS   FT 2/2: GOOD Tracy Bryant makes 1/2 from the line.
Score: 29-35

[10:18] Team_063 possession (Score: 29-35)
Dirk Reaves loses the ball! Stripped by Bones Anunoby! TURNOVER! (live ball)

[10:04] Team_018 possession (Score: 29-35)
Klay Stewart attempts a Midrange. Contested by Bradley Davis (5.5 feet, MAN). Klay Stewart misses. Rebound secured by Dirk Reaves.

[09:48] Team_063 possession (Score: 29-35)
Bradley Davis attempts a 3Pt. Contested by Klay Stewart (4.7 feet, MAN). Bradley Davis misses. Rebound secured by Allen Markkanen.

[09:34] Team_018 possession (Score: 29-35)
FOUL! Holding foul on Bradley Davis. [Team fouls: 3] No free throws, side out. (Bradley Davis: 1 personal fouls)

[09:18] Team_018 possession (Score: 29-35)
Domantas Wall drives and kicks out. Klay Stewart attempts a 3Pt. Contested by Bradley Davis (5.4 feet, MAN). Klay Stewart misses. Rebound secured by Dirk Reaves.

[09:08] Team_063 possession (Score: 29-35)
Bradley Davis attempts a 3Pt. Contested by Klay Stewart (4.8 feet, MAN). Bradley Davis misses. Rebound secured by Bones Anunoby.

[08:55] Team_018 possession (Score: 29-35)
Tracy Bryant attempts a Midrange. Contested by Malcolm Quickley (4.5 feet, MAN). Tracy Bryant misses. Rebound secured by Tyler Harris.

[08:39] Team_063 possession (Score: 29-35)
Bradley Davis commits a violation (traveling/carry)! TURNOVER! (dead ball)

[08:39] Substitution (Team_063): Bradley Davis OUT → DeMar Banchero IN (stamina_rule2)

[08:39] Substitution (Team_063): Malcolm Quickley OUT → Cole Durant IN (stamina_rule2)

[08:39] Substitution (Team_063): Terry Reaves OUT → Jaren James IN (stamina_rule2)

[08:39] Substitution (Team_063): Dirk Reaves OUT → Lamelo Ball IN (stamina_rule2)

[08:39] Substitution (Team_063): Tyler Harris OUT → Kyle Green IN (stamina_rule2)

[08:39] Substitution (Team_018): Klay Stewart OUT → Michael Simons IN (stamina_rule2)

[08:39] Substitution (Team_018): Tracy Bryant OUT → Miles Herro IN (stamina_rule2)

[08:39] Substitution (Team_018): Allen Markkanen OUT → Austin Antetokounmpo IN (stamina_rule2)

[08:39] Substitution (Team_018): Bones Anunoby OUT → Shai Wade IN (stamina_rule2)

[08:39] Substitution (Team_018): Domantas Wall OUT → Julius Jackson IN (stamina_rule2)

[08:21] Team_018 possession (Score: 29-35)
Shai Wade attempts a Midrange. Contested by Lamelo Ball (4.2 feet, ZONE). SHAI WADE MAKES IT!
Score: 29-37

[08:07] Team_063 possession (Score: 29-37)
Jaren James attempts a 3Pt. Contested by Michael Simons (5.5 feet, ZONE). Jaren James misses. Rebound secured by Julius Jackson.

[07:51] Team_018 possession (Score: 29-37)
Shai Wade attempts a 3Pt. Contested by Lamelo Ball (4.2 feet, MAN). Shai Wade misses. Rebound secured by Kyle Green.

[07:37] Team_063 possession (Score: 29-37)
Cole Durant makes the Layup and draws the foul on Miles Herro! And-1! Cole Durant to the line for 1. [Team fouls: 1] (Miles Herro: 1 personal fouls)   FT 1/1: GOOD Cole Durant makes 1/1 from the line.
Score: 32-37

[07:21] Team_018 possession (Score: 32-37)
FOUL! Shooting foul on Kyle Green. Julius Jackson to the line for 2 free throws. [Team fouls: 4] (Kyle Green: 1 personal fouls)   FT 1/2: GOOD   FT 2/2: GOOD Julius Jackson makes 2/2 from the line.
Score: 32-39

[07:03] Team_063 possession (Score: 32-39)
Cole Durant attempts a 3Pt. Contested by Miles Herro (5.8 feet, MAN). COLE DURANT MAKES IT! Assist: Jaren James
Score: 35-39

[06:49] Team_018 possession (Score: 35-39)
Julius Jackson attempts a Midrange. Contested by Kyle Green (4.9 feet, MAN). Julius Jackson misses. Offensive rebound by Julius Jackson! Julius Jackson kicks it out.

[06:33] Team_018 possession (Score: 35-39)
Julius Jackson attempts a Midrange. Contested by Jaren James (4.4 feet, ZONE). JULIUS JACKSON MAKES IT!
Score: 35-41

[06:20] Team_063 possession (Score: 35-41)
Jaren James attempts a Midrange. Contested by Shai Wade (5.0 feet, ZONE). Jaren James misses. Rebound secured by Austin Antetokounmpo.

[06:06] Team_018 possession (Score: 35-41)
Miles Herro attempts a 3Pt. Contested by DeMar Banchero (4.2 feet, ZONE). MILES HERRO MAKES IT! Assist: Austin Antetokounmpo
Score: 35-44

[05:54] Team_063 possession (Score: 35-44)
Jaren James drives to the basket... Jaren James throws a bad pass! Stolen by Julius Jackson! TURNOVER! (live ball)

[05:39] Team_018 possession (Score: 35-44)
Michael Simons attempts a 3Pt. Contested by DeMar Banchero (4.2 feet, ZONE). Michael Simons misses. Offensive rebound by Julius Jackson! Julius Jackson kicks it out.

[05:23] Team_018 possession (Score: 35-44)
Julius Jackson attempts a Layup. Contested by Kyle Green (4.9 feet, ZONE). JULIUS JACKSON MAKES IT!
Score: 35-46

[05:09] Team_063 possession (Score: 35-46)
Lamelo Ball attempts a Midrange. BLOCKED BY SHAI WADE! Ball is loose! Rebound secured by Julius Jackson.

[04:55] Team_018 possession (Score: 35-46)
Michael Simons attempts a Midrange. Contested by DeMar Banchero (4.2 feet, MAN). Michael Simons misses. Offensive rebound by Julius Jackson! Julius Jackson kicks it out.

[04:41] Team_018 possession (Score: 35-46)
Michael Simons attempts a 3Pt. Contested by DeMar Banchero (4.2 feet, MAN). Michael Simons misses. Rebound secured by Kyle Green.

[04:24] Team_063 possession (Score: 35-46)
Kyle Green makes the Layup and draws the foul on Julius Jackson! And-1! Kyle Green to the line for 1. [Team fouls: 2] (Julius Jackson: 1 personal fouls)   FT 1/1: GOOD Kyle Green makes 1/1 from the line.
Score: 38-46

[04:08] Team_018 possession (Score: 38-46)
Austin Antetokounmpo drives, Kyle Green stays with him. Austin Antetokounmpo attempts a Dunk. Contested by Kyle Green (3.9 feet, ZONE). AUSTIN ANTETOKOUNMPO MAKES IT! Assist: Miles Herro
Score: 38-48

[03:52] Team_063 possession (Score: 38-48)
Kyle Green attempts a 3Pt. Contested by Michael Simons (5.5 feet, ZONE). Kyle Green misses. Rebound secured by Julius Jackson.

[03:36] Team_018 possession (Score: 38-48)
FOUL! Shooting foul on Cole Durant. Shai Wade to the line for 3 free throws. [BONUS: 5 team fouls] (Cole Durant: 1 personal fouls)   FT 1/3: GOOD   FT 2/3: GOOD   FT 3/3: GOOD Shai Wade makes 3/3 from the line.
Score: 38-51

[03:21] Team_063 possession (Score: 38-51)
Kyle Green throws a bad pass! Stolen by Julius Jackson! TURNOVER! (live ball)

[03:06] Team_018 possession (Score: 38-51)
FOUL! Reach-in foul on Kyle Green during the drive. [IN THE BONUS! 6 team fouls] Julius Jackson to the line for 2 free throws. (Kyle Green: 2 personal fouls)   FT 1/2: GOOD   FT 2/2: MISS Julius Jackson makes 1/2 from the line. Rebound secured by Kyle Green.
Score: 38-52

[02:57] Team_063 possession (Score: 38-52)
Lamelo Ball drives, Julius Jackson stays with him. Lamelo Ball attempts a Layup. Contested by Julius Jackson (5.1 feet, ZONE). LAMELO BALL MAKES IT! Assist: DeMar Banchero
Score: 40-52

[02:44] Team_018 possession (Score: 40-52)
Michael Simons throws a bad pass! Stolen by DeMar Banchero! TURNOVER! (live ball)

[02:31] Team_063 possession (Score: 40-52)
FOUL! Reach-in foul on Shai Wade during the drive. [Team fouls: 3] No free throws, side out. (Shai Wade: 1 personal fouls)

[02:14] Team_063 possession (Score: 40-52)
Cole Durant attempts a Layup. Contested by Miles Herro (5.8 feet, MAN). Cole Durant misses. Offensive rebound by Kyle Green! Kyle Green puts it back in!
Score: 42-52

[01:58] Team_018 possession (Score: 42-52)
FOUL! Offensive foul on Shai Wade! Lamelo Ball drew the charge! [Team fouls: 4] (Shai Wade: 2 personal fouls) TURNOVER! (dead ball)

[01:48] Team_063 possession (Score: 42-52)
Kyle Green drives, Julius Jackson stays with him. Kyle Green attempts a Dunk. Contested by Julius Jackson (4.9 feet, MAN). Kyle Green misses. Rebound secured by Julius Jackson.

[01:33] Team_018 possession (Score: 42-52)
Julius Jackson throws a bad pass out of bounds! TURNOVER! (dead ball)

[01:16] Team_063 possession (Score: 42-52)
Kyle Green drives, Shai Wade stays with him. Kyle Green attempts a Dunk. Contested by Shai Wade (5.0 feet, ZONE). Kyle Green misses. Rebound secured by Austin Antetokounmpo.

[01:03] Team_018 possession (Score: 42-52)
Shai Wade makes the Dunk and draws the foul on Kyle Green! And-1! Shai Wade to the line for 1. [BONUS: 7 team fouls] (Kyle Green: 3 personal fouls)   FT 1/1: GOOD Shai Wade makes 1/1 from the line.
Score: 42-55

[00:52] Team_063 possession (Score: 42-55)
DeMar Banchero attempts a 3Pt. Contested by Shai Wade (5.4 feet, ZONE). DEMAR BANCHERO MAKES IT! Assist: Cole Durant
Score: 45-55

[00:34] Team_018 possession (Score: 45-55)
Julius Jackson makes the Layup and draws the foul on Kyle Green! And-1! Julius Jackson to the line for 1. [BONUS: 8 team fouls] (Kyle Green: 4 personal fouls)   FT 1/1: MISS Julius Jackson makes 0/1 from the line. Rebound secured by Kyle Green.
Score: 45-57

[00:18] Team_063 possession (Score: 45-57)
Kyle Green attempts a Midrange. Contested by Miles Herro (5.6 feet, ZONE). Kyle Green misses. Rebound secured by Austin Antetokounmpo.

[00:05] Team_018 possession (Score: 45-57)
Miles Herro drives to the basket... Miles Herro throws a bad pass out of bounds! TURNOVER! (dead ball)

================================================================================
                              2ND QUARTER COMPLETE                              
================================================================================

2ND QUARTER SCORE: Team_063 20, Team_018 27

BOX SCORE:
================================================================================

Team_063
--------------------------------------------------------------------------------
Player                MIN  PTS  REB  AST  TO      FG   FG%      3P   3P%
--------------------------------------------------------------------------------
Cole Durant             8    6    0    1   0   2/2   100.0     0/0   0.0
Kyle Green              8    5    5    0   0   2/6    33.3     0/0   0.0
DeMar Banchero          8    3    0    1   0   1/1   100.0     0/0   0.0
Tyler Harris           16    2    2    0   0   1/1   100.0     0/0   0.0
Malcolm Quickley       16    2    0    0   0   1/2    50.0     0/0   0.0
Lamelo Ball             8    2    0    0   0   1/2    50.0     0/0   0.0
Terry Reaves           16    0    0    1   0   0/0     0.0     0/0   0.0
Dirk Reaves            16    0    2    0   0   0/0     0.0     0/0   0.0
Bradley Davis          16    0    0    0   0   0/2     0.0     0/0   0.0
Jaren James             8    0    0    1   0   0/2     0.0     0/0   0.0

TEAM: FG: 8/18 (44.4%), 3PT: 2/7 (28.6%), REB: 9 (2 off, 7 def), AST: 4, TO: 4
TEAM FOULS: 8 [Team_018 in BONUS]


Team_018
--------------------------------------------------------------------------------
Player                MIN  PTS  REB  AST  TO      FG   FG%      3P   3P%
--------------------------------------------------------------------------------
Shai Wade               8    8    0    0   0   3/4    75.0     0/0   0.0
Julius Jackson          8    6    7    0   0   3/5    60.0     0/0   0.0
Tracy Bryant           16    3    0    0   0   2/3    66.7     0/0   0.0
Miles Herro             8    3    0    1   0   1/1   100.0     0/0   0.0
Klay Stewart           16    2    0    0   0   1/2    50.0     0/0   0.0
Austin Antetokounmpo    8    2    3    1   0   1/1   100.0     0/0   0.0
Bones Anunoby          16    0    3    1   0   0/0     0.0     0/0   0.0
Allen Markkanen        16    0    1    0   0   0/0     0.0     0/0   0.0
Domantas Wall          16    0    0    0   0   0/1     0.0     0/0   0.0
Michael Simons          8    0    0    0   0   0/1     0.0     0/0   0.0

TEAM: FG: 11/18 (61.1%), 3PT: 2/4 (50.0%), REB: 14 (4 off, 10 def), AST: 3, TO: 4
TEAM FOULS: 4

================================================================================

================================================================================
                       3RD QUARTER - Team_063 vs Team_018                       
================================================================================

[12:00] Team_063 possession (Score: 45-57)
Dirk Reaves drives to the basket... Dirk Reaves throws a bad pass out of bounds! TURNOVER! (dead ball)

[11:41] Team_018 possession (Score: 45-57)
Allen Markkanen attempts a 3Pt. Contested by Malcolm Quickley (3.9 feet, ZONE). ALLEN MARKKANEN MAKES IT! Assist: Bones Anunoby
Score: 45-60

[11:26] Team_063 possession (Score: 45-60)
Terry Reaves drives to the basket... Terry Reaves loses control! Ball rolls out of bounds! TURNOVER! (dead ball)

[11:08] Team_018 possession (Score: 45-60)
FOUL! Reach-in foul on Bradley Davis during the drive. [Team fouls: 1] No free throws, side out. (Bradley Davis: 1 personal fouls)

[10:52] Team_018 possession (Score: 45-60)
Tracy Bryant attempts a Midrange. Contested by Terry Reaves (4.9 feet, ZONE). Tracy Bryant misses. FOUL! Loose ball foul on Malcolm Quickley during the rebound battle. [Team fouls: 2] No free throws, side out. (Malcolm Quickley: 1 personal fouls)

[10:38] Team_018 possession (Score: 45-60)
Bones Anunoby attempts a Midrange. Contested by Malcolm Quickley (3.8 feet, ZONE). Bones Anunoby misses. Offensive rebound by Domantas Wall! Domantas Wall's putback is no good. Rebound secured by Tyler Harris.

[10:23] Team_063 possession (Score: 45-60)
Bradley Davis drives to the basket... Bradley Davis throws a bad pass out of bounds! TURNOVER! (dead ball)

[10:05] Team_018 possession (Score: 45-60)
Allen Markkanen attempts a 3Pt. Contested by Malcolm Quickley (3.9 feet, ZONE). Allen Markkanen misses. Rebound secured by Tyler Harris.

[09:48] Team_063 possession (Score: 45-60)
Tyler Harris attempts a Midrange. Contested by Allen Markkanen (3.8 feet, ZONE). Tyler Harris misses. Rebound secured by Allen Markkanen.

[09:31] Team_018 possession (Score: 45-60)
Tracy Bryant drives and kicks out. Tracy Bryant attempts a 3Pt. Contested by Malcolm Quickley (3.5 feet, MAN). Tracy Bryant misses. Rebound secured by Tyler Harris.

[09:18] Team_063 possession (Score: 45-60)
FOUL! Reach-in foul on Domantas Wall during the drive. [Team fouls: 1] No free throws, side out. (Domantas Wall: 1 personal fouls)

[09:04] Team_063 possession (Score: 45-60)
Dirk Reaves drives, Domantas Wall stays with him. Dirk Reaves attempts a Dunk. Contested by Domantas Wall (3.7 feet, ZONE). DIRK REAVES MAKES IT!
Score: 47-60

[08:54] Team_018 possession (Score: 47-60)
Bones Anunoby attempts a 3Pt. Contested by Dirk Reaves (4.0 feet, MAN). Bones Anunoby misses. Rebound secured by Malcolm Quickley.

[08:36] Team_063 possession (Score: 47-60)
Bradley Davis attempts a 3Pt. Contested by Klay Stewart (4.3 feet, ZONE). Bradley Davis misses. Rebound secured by Domantas Wall.

[08:24] Team_018 possession (Score: 47-60)
Tracy Bryant attempts a Midrange. Contested by Malcolm Quickley (3.8 feet, MAN). Tracy Bryant misses. Rebound secured by Malcolm Quickley.

[08:12] Team_063 possession (Score: 47-60)
FOUL! Offensive foul on Bradley Davis! Klay Stewart drew the charge! [Team fouls: 3] (Bradley Davis: 2 personal fouls) TURNOVER! (dead ball)

[07:57] Team_018 possession (Score: 47-60)
Allen Markkanen attempts a 3Pt. Contested by Malcolm Quickley (3.9 feet, ZONE). ALLEN MARKKANEN MAKES IT! Assist: Domantas Wall
Score: 47-63

[07:43] Team_063 possession (Score: 47-63)
Dirk Reaves attempts a Layup. Contested by Domantas Wall (3.7 feet, ZONE). DIRK REAVES MAKES IT! Assist: Tyler Harris
Score: 49-63

[07:30] Team_018 possession (Score: 49-63)
Allen Markkanen attempts a Layup. Contested by Terry Reaves (5.0 feet, MAN). ALLEN MARKKANEN MAKES IT! Assist: Tracy Bryant
Score: 49-65

[07:15] Team_063 possession (Score: 49-65)
Malcolm Quickley makes the Layup and draws the foul on Tracy Bryant! And-1! Malcolm Quickley to the line for 1. [Team fouls: 2] (Tracy Bryant: 1 personal fouls)   FT 1/1: GOOD Malcolm Quickley makes 1/1 from the line.
Score: 52-65

[07:01] Team_018 possession (Score: 52-65)
Tracy Bryant attempts a 3Pt. Contested by Malcolm Quickley (3.8 feet, ZONE). Tracy Bryant misses. Rebound secured by Tyler Harris.

[06:46] Team_063 possession (Score: 52-65)
Bradley Davis attempts a 3Pt. Contested by Klay Stewart (4.3 feet, MAN). Bradley Davis misses. Rebound secured by Domantas Wall.

[06:30] Team_018 possession (Score: 52-65)
Klay Stewart drives to the basket... FOUL! Offensive foul on Klay Stewart! Bradley Davis drew the charge! [Team fouls: 3] (Klay Stewart: 1 personal fouls) TURNOVER! (dead ball)

[06:14] Team_063 possession (Score: 52-65)
Dirk Reaves attempts a 3Pt. Contested by Tracy Bryant (3.6 feet, ZONE). Dirk Reaves misses. Rebound secured by Bones Anunoby.

[06:00] Team_018 possession (Score: 52-65)
Tracy Bryant attempts a 3Pt. Contested by Malcolm Quickley (3.8 feet, ZONE). TRACY BRYANT MAKES IT! Assist: Klay Stewart
Score: 52-68

[05:47] Team_063 possession (Score: 52-68)
Tyler Harris attempts a 3Pt. Contested by Klay Stewart (4.0 feet, ZONE). Tyler Harris misses. Rebound secured by Domantas Wall.

[05:34] Team_018 possession (Score: 52-68)
FOUL! Shooting foul on Tyler Harris. Klay Stewart to the line for 2 free throws. [Team fouls: 4] (Tyler Harris: 1 personal fouls)   FT 1/2: GOOD   FT 2/2: GOOD Klay Stewart makes 2/2 from the line.
Score: 52-70

[05:18] Team_063 possession (Score: 52-70)
Tyler Harris attempts a 3Pt. Contested by Klay Stewart (4.0 feet, ZONE). Tyler Harris misses. Rebound secured by Allen Markkanen.

[05:03] Team_018 possession (Score: 52-70)
Bones Anunoby attempts a 3Pt. Contested by Malcolm Quickley (3.8 feet, ZONE). Bones Anunoby misses. Rebound secured by Tyler Harris.

[04:44] Team_063 possession (Score: 52-70)
Terry Reaves attempts a 3Pt. Contested by Klay Stewart (4.4 feet, ZONE). Terry Reaves misses. Rebound secured by Allen Markkanen.

[04:31] Team_018 possession (Score: 52-70)
FOUL! Holding foul on Malcolm Quickley. [IN THE BONUS! 5 team fouls] Tracy Bryant to the line for 2 free throws. (Malcolm Quickley: 2 personal fouls)   FT 1/2: GOOD   FT 2/2: GOOD Tracy Bryant makes 2/2 from the line.
Score: 52-72

[04:16] Team_063 possession (Score: 52-72)
Terry Reaves attempts a 3Pt. Contested by Allen Markkanen (4.1 feet, MAN). Terry Reaves misses. Offensive rebound by Tyler Harris! Tyler Harris puts it back in!
Score: 54-72

[04:06] Team_018 possession (Score: 54-72)
Bones Anunoby attempts a Layup. Contested by Dirk Reaves (4.1 feet, ZONE). BONES ANUNOBY MAKES IT! Assist: Klay Stewart
Score: 54-74

[03:54] Team_063 possession (Score: 54-74)
Malcolm Quickley attempts a Midrange. Contested by Bones Anunoby (3.3 feet, ZONE). Malcolm Quickley misses. Offensive rebound by Tyler Harris! Tyler Harris puts it back in!
Score: 56-74

[03:35] Team_018 possession (Score: 56-74)
Klay Stewart attempts a 3Pt. Contested by Malcolm Quickley (3.8 feet, ZONE). Klay Stewart misses. Rebound secured by Malcolm Quickley.

[03:21] Team_063 possession (Score: 56-74)
Bradley Davis attempts a 3Pt. Contested by Klay Stewart (4.4 feet, MAN). Bradley Davis misses. Rebound secured by Bones Anunoby.

[03:04] Team_018 possession (Score: 56-74)
Domantas Wall attempts a Layup. Contested by Tyler Harris (4.8 feet, ZONE). DOMANTAS WALL MAKES IT!
Score: 56-76

[02:49] Team_063 possession (Score: 56-76)
Malcolm Quickley attempts a Midrange. Contested by Tracy Bryant (3.3 feet, MAN). MALCOLM QUICKLEY MAKES IT!
Score: 58-76

[02:39] Team_018 possession (Score: 58-76)
Domantas Wall attempts a 3Pt. Contested by Tyler Harris (4.9 feet, MAN). Domantas Wall misses. Rebound secured by Tyler Harris.

[02:24] Team_063 possession (Score: 58-76)
Terry Reaves drives and kicks out. FOUL! Shooting foul on Allen Markkanen. Terry Reaves to the line for 2 free throws. [Team fouls: 4] (Allen Markkanen: 1 personal fouls)   FT 1/2: MISS   FT 2/2: GOOD Terry Reaves makes 1/2 from the line.
Score: 59-76

[02:12] Team_018 possession (Score: 59-76)
Klay Stewart drives, picks up Tyler Harris. Help arrives from Malcolm Quickley! Klay Stewart attempts a Dunk. Contested by Malcolm Quickley (4.9 feet, ZONE). KLAY STEWART MAKES IT! Assist: Domantas Wall
Score: 59-78

[02:00] Team_063 possession (Score: 59-78)
Dirk Reaves drives and kicks out. Malcolm Quickley attempts a 3Pt. Contested by Klay Stewart (4.4 feet, ZONE). Malcolm Quickley misses. Rebound secured by Domantas Wall.

[01:42] Team_018 possession (Score: 59-78)
FOUL! Shooting foul on Bradley Davis. Klay Stewart to the line for 3 free throws. [BONUS: 6 team fouls] (Bradley Davis: 3 personal fouls)   FT 1/3: GOOD   FT 2/3: MISS   FT 3/3: GOOD Klay Stewart makes 2/3 from the line.
Score: 59-80

[01:23] Team_063 possession (Score: 59-80)
Bradley Davis drives and kicks out. Bradley Davis makes the Midrange and draws the foul on Klay Stewart! And-1! Bradley Davis to the line for 1. [BONUS: 5 team fouls] (Klay Stewart: 2 personal fouls)   FT 1/1: GOOD Bradley Davis makes 1/1 from the line.
Score: 62-80

[01:08] Team_018 possession (Score: 62-80)
Tracy Bryant attempts a Midrange. Contested by Malcolm Quickley (4.2 feet, MAN). Tracy Bryant misses. Offensive rebound by Bones Anunoby! Bones Anunoby kicks it out.

[00:55] Team_018 possession (Score: 62-80)
Domantas Wall attempts a Layup. Contested by Tyler Harris (5.0 feet, MAN). DOMANTAS WALL MAKES IT! Assist: Tracy Bryant
Score: 62-82

[00:43] Team_063 possession (Score: 62-82)
Tyler Harris drives to the basket... FOUL! Offensive foul on Tyler Harris! Domantas Wall drew the charge! [Team fouls: 7] (Tyler Harris: 2 personal fouls) TURNOVER! (dead ball)

[00:31] Team_018 possession (Score: 62-82)
Allen Markkanen attempts a 3Pt. Contested by Terry Reaves (5.4 feet, MAN). Allen Markkanen misses. Offensive rebound by Domantas Wall! Domantas Wall puts it back in!
Score: 62-84

[00:19] Team_063 possession (Score: 62-84)
Malcolm Quickley attempts a 3Pt. Contested by Tracy Bryant (3.6 feet, MAN). Malcolm Quickley misses. Rebound secured by Allen Markkanen.

[00:03] Team_018 possession (Score: 62-84)
Domantas Wall attempts a Midrange. Contested by Tyler Harris (5.2 feet, MAN). DOMANTAS WALL MAKES IT! Assist: Allen Markkanen
Score: 62-86

================================================================================
                              3RD QUARTER COMPLETE                              
================================================================================

3RD QUARTER SCORE: Team_063 17, Team_018 29

BOX SCORE:
================================================================================

Team_063
--------------------------------------------------------------------------------
Player                MIN  PTS  REB  AST  TO      FG   FG%      3P   3P%
--------------------------------------------------------------------------------
Malcolm Quickley       28    5    3    0   0   2/3    66.7     0/0   0.0
Tyler Harris           28    4    8    1   0   2/5    40.0     0/0   0.0
Dirk Reaves            28    4    0    0   0   2/4    50.0     0/0   0.0
Bradley Davis          28    3    0    0   0   1/4    25.0     0/0   0.0
Terry Reaves           28    1    0    0   0   1/2    50.0     0/0   0.0

TEAM: FG: 8/18 (44.4%), 3PT: 1/9 (11.1%), REB: 10 (2 off, 8 def), AST: 1, TO: 5
TEAM FOULS: 7 [Team_018 in BONUS]


Team_018
--------------------------------------------------------------------------------
Player                MIN  PTS  REB  AST  TO      FG   FG%      3P   3P%
--------------------------------------------------------------------------------
Allen Markkanen        28    8    4    1   0   3/4    75.0     0/0   0.0
Domantas Wall          28    8    6    2   0   4/5    80.0     0/0   0.0
Klay Stewart           28    6    0    2   0   3/4    75.0     0/0   0.0
Tracy Bryant           28    5    0    2   0   2/5    40.0     0/0   0.0
Bones Anunoby          28    2    3    1   0   1/4    25.0     0/0   0.0

TEAM: FG: 13/22 (59.1%), 3PT: 5/11 (45.5%), REB: 14 (4 off, 10 def), AST: 8, TO: 1
TEAM FOULS: 5 [Team_063 in BONUS]

================================================================================

================================================================================
                       4TH QUARTER - Team_063 vs Team_018                       
================================================================================

[12:00] Substitution (Team_063): Bradley Davis OUT (stamina: 70) → DeMar Banchero IN (comeback_detected)

[12:00] Substitution (Team_018): Klay Stewart OUT (stamina: 71) → Michael Simons IN (comeback_detected)

[12:00] Team_063 possession (Score: 62-86)
Dirk Reaves drives, Domantas Wall stays with him. Dirk Reaves attempts a Dunk. Contested by Domantas Wall (4.1 feet, ZONE). DIRK REAVES MAKES IT!
Score: 64-86

[11:45] Team_018 possession (Score: 64-86)
Allen Markkanen drives and kicks out. Bones Anunoby attempts a Midrange. Contested by Malcolm Quickley (3.9 feet, ZONE). BONES ANUNOBY MAKES IT! Assist: Domantas Wall
Score: 64-88

[11:29] Team_063 possession (Score: 64-88)
FOUL! Holding foul on Michael Simons. [Team fouls: 1] No free throws, side out. (Michael Simons: 1 personal fouls)

[11:16] Team_063 possession (Score: 64-88)
Terry Reaves attempts a Midrange. Contested by Allen Markkanen (4.3 feet, MAN). Terry Reaves misses. Offensive rebound by Tyler Harris! Tyler Harris puts it back in!
Score: 66-88

[10:59] Team_018 possession (Score: 66-88)
Allen Markkanen attempts a 3Pt. Contested by Terry Reaves (5.4 feet, MAN). ALLEN MARKKANEN MAKES IT! Assist: Tracy Bryant
Score: 66-91

[10:46] Team_063 possession (Score: 66-91)
Malcolm Quickley attempts a 3Pt. Contested by Tracy Bryant (3.6 feet, MAN). Malcolm Quickley misses. Rebound secured by Domantas Wall.

[10:34] Team_018 possession (Score: 66-91)
Allen Markkanen attempts a 3Pt. Contested by Terry Reaves (5.4 feet, MAN). Allen Markkanen misses. Offensive rebound by Domantas Wall! Domantas Wall puts it back in!
Score: 66-93

[10:16] Team_063 possession (Score: 66-93)
DeMar Banchero attempts a 3Pt. Contested by Michael Simons (5.8 feet, MAN). DEMAR BANCHERO MAKES IT! Assist: Dirk Reaves
Score: 69-93

[10:01] Team_018 possession (Score: 69-93)
FOUL! Shooting foul on Terry Reaves. Allen Markkanen to the line for 2 free throws. [Team fouls: 1] (Terry Reaves: 1 personal fouls)   FT 1/2: GOOD   FT 2/2: GOOD Allen Markkanen makes 2/2 from the line.
Score: 69-95

[09:51] Team_063 possession (Score: 69-95)
Malcolm Quickley throws a bad pass out of bounds! TURNOVER! (dead ball)

[09:51] Substitution (Team_063): Malcolm Quickley OUT → Cole Durant IN (stamina_rule2)

[09:51] Substitution (Team_063): Terry Reaves OUT → Jaren James IN (stamina_rule2)

[09:51] Substitution (Team_063): Dirk Reaves OUT → Lamelo Ball IN (stamina_rule2)

[09:51] Substitution (Team_063): Tyler Harris OUT → Kyle Green IN (stamina_rule2)

[09:51] Substitution (Team_018): Tracy Bryant OUT → Miles Herro IN (stamina_rule2)

[09:51] Substitution (Team_018): Allen Markkanen OUT → Austin Antetokounmpo IN (stamina_rule2)

[09:51] Substitution (Team_018): Bones Anunoby OUT → Shai Wade IN (stamina_rule2)

[09:51] Substitution (Team_018): Domantas Wall OUT → Julius Jackson IN (stamina_rule2)

[09:36] Team_018 possession (Score: 69-95)
Shai Wade makes the Layup and draws the foul on Lamelo Ball! And-1! Shai Wade to the line for 1. [Team fouls: 2] (Lamelo Ball: 1 personal fouls)   FT 1/1: GOOD Shai Wade makes 1/1 from the line.
Score: 69-98

[09:22] Team_063 possession (Score: 69-98)
DeMar Banchero makes the Midrange and draws the foul on Austin Antetokounmpo! And-1! DeMar Banchero to the line for 1. [Team fouls: 2] (Austin Antetokounmpo: 1 personal fouls)   FT 1/1: GOOD DeMar Banchero makes 1/1 from the line.
Score: 72-98

[09:04] Team_018 possession (Score: 72-98)
Miles Herro attempts a 3Pt. Contested by DeMar Banchero (4.2 feet, ZONE). MILES HERRO MAKES IT! Assist: Austin Antetokounmpo
Score: 72-101

[08:49] Team_063 possession (Score: 72-101)
Jaren James attempts a 3Pt. Contested by Michael Simons (5.5 feet, ZONE). JAREN JAMES MAKES IT! Assist: DeMar Banchero
Score: 75-101

[08:32] Team_018 possession (Score: 75-101)
Julius Jackson attempts a Layup. Contested by Kyle Green (4.9 feet, ZONE). Julius Jackson misses. Rebound secured by Cole Durant.

[08:22] Team_063 possession (Score: 75-101)
Lamelo Ball drives to the basket... Lamelo Ball throws a bad pass out of bounds! TURNOVER! (dead ball)

[08:05] Team_018 possession (Score: 75-101)
Shai Wade attempts a 3Pt. Contested by Lamelo Ball (4.2 feet, MAN). SHAI WADE MAKES IT! Assist: Michael Simons
Score: 75-104

[07:52] Team_063 possession (Score: 75-104)
Cole Durant attempts a 3Pt. Contested by Miles Herro (5.8 feet, MAN). COLE DURANT MAKES IT! Assist: Kyle Green
Score: 78-104

[07:39] Team_018 possession (Score: 78-104)
Michael Simons attempts a 3Pt. Contested by DeMar Banchero (4.2 feet, MAN). Michael Simons misses. Rebound secured by Cole Durant.

[07:21] Team_063 possession (Score: 78-104)
Cole Durant drives to the basket... Cole Durant throws a bad pass! Stolen by Miles Herro! TURNOVER! (live ball)

[07:03] Team_018 possession (Score: 78-104)
Shai Wade drives and kicks out. Miles Herro attempts a 3Pt. Contested by DeMar Banchero (3.9 feet, ZONE). Miles Herro misses. FOUL! Loose ball foul on Cole Durant during the rebound battle. [Team fouls: 3] No free throws, side out. (Cole Durant: 1 personal fouls)

[06:53] Team_018 possession (Score: 78-104)
Austin Antetokounmpo attempts a Layup. Contested by Jaren James (3.4 feet, MAN). AUSTIN ANTETOKOUNMPO MAKES IT! Assist: Shai Wade
Score: 78-106

[06:39] Team_063 possession (Score: 78-106)
Cole Durant attempts a Layup. BLOCKED BY JULIUS JACKSON! Ball is loose! Rebound secured by Shai Wade.

[06:24] Team_018 possession (Score: 78-106)
FOUL! Shooting foul on Lamelo Ball. Shai Wade to the line for 2 free throws. [Team fouls: 4] (Lamelo Ball: 2 personal fouls)   FT 1/2: GOOD   FT 2/2: GOOD Shai Wade makes 2/2 from the line.
Score: 78-108

[06:07] Team_063 possession (Score: 78-108)
DeMar Banchero attempts a Midrange. Contested by Miles Herro (5.8 feet, ZONE). DeMar Banchero misses. FOUL! Loose ball foul on Julius Jackson during the rebound battle. [Team fouls: 3] No free throws, side out. (Julius Jackson: 1 personal fouls)

[05:54] Team_063 possession (Score: 78-108)
Cole Durant throws a bad pass! Stolen by Miles Herro! TURNOVER! (live ball)

[05:39] Team_018 possession (Score: 78-108)
Miles Herro attempts a 3Pt. Contested by DeMar Banchero (4.2 feet, ZONE). Miles Herro misses. Offensive rebound by Julius Jackson! Julius Jackson kicks it out.

[05:28] Team_018 possession (Score: 78-108)
Julius Jackson attempts a Midrange. Contested by Cole Durant (4.6 feet, ZONE). JULIUS JACKSON MAKES IT!
Score: 78-110

[05:15] Team_063 possession (Score: 78-110)
Cole Durant attempts a 3Pt. Contested by Miles Herro (5.8 feet, ZONE). Cole Durant misses. Rebound secured by Shai Wade.

[05:04] Team_018 possession (Score: 78-110)
Julius Jackson attempts a 3Pt. Contested by DeMar Banchero (4.4 feet, ZONE). Julius Jackson misses. Rebound secured by Kyle Green.

[04:51] Team_063 possession (Score: 78-110)
Lamelo Ball attempts a Midrange. Contested by Shai Wade (5.2 feet, MAN). LAMELO BALL MAKES IT! Assist: Kyle Green
Score: 80-110

[04:36] Team_018 possession (Score: 80-110)
Miles Herro makes the Dunk and draws the foul on Cole Durant! And-1! Miles Herro to the line for 1. [BONUS: 5 team fouls] (Cole Durant: 2 personal fouls)   FT 1/1: GOOD Miles Herro makes 1/1 from the line.
Score: 80-113

[04:23] Team_063 possession (Score: 80-113)
Jaren James attempts a 3Pt. Contested by Michael Simons (5.6 feet, ZONE). Jaren James misses. Rebound secured by Shai Wade.

[04:08] Team_018 possession (Score: 80-113)
Austin Antetokounmpo attempts a Midrange. Contested by Jaren James (3.4 feet, MAN). AUSTIN ANTETOKOUNMPO MAKES IT!
Score: 80-115

[03:52] Team_063 possession (Score: 80-115)
Jaren James attempts a 3Pt. Contested by Michael Simons (5.6 feet, ZONE). JAREN JAMES MAKES IT! Assist: Lamelo Ball
Score: 83-115

[03:43] Team_018 possession (Score: 83-115)
FOUL! Shooting foul on Lamelo Ball. Shai Wade to the line for 2 free throws. [BONUS: 6 team fouls] (Lamelo Ball: 3 personal fouls)   FT 1/2: GOOD   FT 2/2: GOOD Shai Wade makes 2/2 from the line.
Score: 83-117

[03:31] Team_063 possession (Score: 83-117)
FOUL! Holding foul on Julius Jackson. [Team fouls: 4] No free throws, side out. (Julius Jackson: 2 personal fouls)

[03:17] Team_063 possession (Score: 83-117)
Jaren James drives to the basket... Jaren James loses the ball! Stripped by Austin Antetokounmpo! TURNOVER! (live ball)

[03:03] Team_018 possession (Score: 83-117)
Michael Simons drives to the basket... FOUL! Offensive foul on Michael Simons! Kyle Green drew the charge! [Team fouls: 5] (Michael Simons: 2 personal fouls) TURNOVER! (dead ball)

[02:48] Team_063 possession (Score: 83-117)
Cole Durant drives and kicks out. Lamelo Ball attempts a 3Pt. Contested by Michael Simons (5.6 feet, ZONE). Lamelo Ball misses. Rebound secured by Shai Wade.

[02:34] Team_018 possession (Score: 83-117)
Miles Herro attempts a 3Pt. Contested by Cole Durant (4.5 feet, MAN). MILES HERRO MAKES IT! Assist: Julius Jackson
Score: 83-120

[02:16] Team_063 possession (Score: 83-120)
Jaren James attempts a Layup. BLOCKED BY AUSTIN ANTETOKOUNMPO! Ball goes out off Austin Antetokounmpo. Jaren James's ball!

[01:58] Team_063 possession (Score: 83-120)
FOUL! Shooting foul on Michael Simons. Jaren James to the line for 3 free throws. [BONUS: 6 team fouls] (Michael Simons: 3 personal fouls)   FT 1/3: MISS   FT 2/3: GOOD   FT 3/3: GOOD Jaren James makes 2/3 from the line.
Score: 85-120

[01:43] Team_018 possession (Score: 85-120)
Miles Herro attempts a 3Pt. Contested by DeMar Banchero (4.5 feet, ZONE). Miles Herro misses. Rebound secured by Lamelo Ball.

[01:28] Team_063 possession (Score: 85-120)
Lamelo Ball attempts a Layup. Contested by Shai Wade (5.4 feet, ZONE). Lamelo Ball misses. Rebound secured by Shai Wade.

[01:14] Team_018 possession (Score: 85-120)
FOUL! Holding foul on DeMar Banchero. [IN THE BONUS! 7 team fouls] Michael Simons to the line for 2 free throws. (DeMar Banchero: 1 personal fouls)   FT 1/2: GOOD   FT 2/2: MISS Michael Simons makes 1/2 from the line. Offensive rebound by Shai Wade! Shai Wade kicks it out.
Score: 85-121

[00:58] Team_018 possession (Score: 85-121)
FOUL! Shooting foul on Jaren James. Austin Antetokounmpo to the line for 2 free throws. [BONUS: 8 team fouls] (Jaren James: 1 personal fouls)   FT 1/2: GOOD   FT 2/2: GOOD Austin Antetokounmpo makes 2/2 from the line.
Score: 85-123

[00:44] Team_063 possession (Score: 85-123)
FOUL! Shooting foul on Julius Jackson. Kyle Green to the line for 2 free throws. [BONUS: 7 team fouls] (Julius Jackson: 3 personal fouls)   FT 1/2: GOOD   FT 2/2: GOOD Kyle Green makes 2/2 from the line.
Score: 87-123

[00:31] Team_018 possession (Score: 87-123)
Julius Jackson drives to the basket... Julius Jackson commits a violation (traveling/carry)! TURNOVER! (dead ball)

[00:21] Team_063 possession (Score: 87-123)
Cole Durant attempts a Midrange. Contested by Austin Antetokounmpo (5.8 feet, ZONE). COLE DURANT MAKES IT!
Score: 89-123

[00:04] Team_018 possession (Score: 89-123)
Julius Jackson drives to the basket... Julius Jackson loses control! Ball rolls out of bounds! TURNOVER! (dead ball)

================================================================================
                              4TH QUARTER COMPLETE                              
================================================================================

4TH QUARTER SCORE: Team_063 27, Team_018 37

BOX SCORE:
================================================================================

Team_063
--------------------------------------------------------------------------------
Player                MIN  PTS  REB  AST  TO      FG   FG%      3P   3P%
--------------------------------------------------------------------------------
Jaren James            18    8    0    0   0   3/4    75.0     0/0   0.0
DeMar Banchero         21    6    0    1   0   2/2   100.0     0/0   0.0
Cole Durant            18    5    2    0   0   2/5    40.0     0/0   0.0
Dirk Reaves            30    2    0    1   0   1/1   100.0     0/0   0.0
Tyler Harris           30    2    1    0   0   1/1   100.0     0/0   0.0
Kyle Green             18    2    1    2   0   1/1   100.0     0/0   0.0
Lamelo Ball            18    2    2    1   0   1/2    50.0     0/0   0.0
Malcolm Quickley       30    0    0    0   0   0/1     0.0     0/0   0.0

TEAM: FG: 11/17 (64.7%), 3PT: 5/8 (62.5%), REB: 6 (2 off, 4 def), AST: 5, TO: 5
TEAM FOULS: 8 [Team_018 in BONUS]


Team_018
--------------------------------------------------------------------------------
Player                MIN  PTS  REB  AST  TO      FG   FG%      3P   3P%
--------------------------------------------------------------------------------
Shai Wade              18   10    6    1   0   4/4   100.0     0/0   0.0
Miles Herro            18    9    0    0   0   3/4    75.0     0/0   0.0
Austin Antetokounmpo   18    6    0    1   0   3/3   100.0     0/0   0.0
Allen Markkanen        30    5    0    0   0   2/2   100.0     0/0   0.0
Bones Anunoby          30    2    0    0   0   1/1   100.0     0/0   0.0
Domantas Wall          30    2    2    1   0   1/1   100.0     0/0   0.0
Julius Jackson         18    2    2    1   0   1/3    33.3     0/0   0.0
Tracy Bryant           30    0    0    1   0   0/0     0.0     0/0   0.0
Michael Simons         21    0    0    1   0   0/1     0.0     0/0   0.0

TEAM: FG: 15/19 (78.9%), 3PT: 5/8 (62.5%), REB: 10 (4 off, 6 def), AST: 6, TO: 3
TEAM FOULS: 7 [Team_063 in BONUS]

================================================================================

================================================================================
                               FULL GAME COMPLETE                               
================================================================================

FINAL SCORE: Team_063 89, Team_018 123

SCORING BY QUARTER:
--------------------------------------------------------------------------------
Team                     Q1     Q2     Q3     Q4    FINAL
--------------------------------------------------------------------------------
Team_063                 25     20     17     27       89
Team_018                 30     27     29     37      123
--------------------------------------------------------------------------------

FULL GAME BOX SCORE:
================================================================================

Team_063
--------------------------------------------------------------------------------
Player                MIN  PTS  REB  AST  TO      FG   FG%      3P   3P%      FT STL BLK
--------------------------------------------------------------------------------
Malcolm Quickley       30   13    5    1   1   6/10   60.0   1/5    20.0   4/4     0   0
Terry Reaves           30    1    0    1   2   3/7    42.9   1/4    25.0   1/2     0   0
Dirk Reaves            30   17    6    2   1   9/12   75.0   0/2     0.0   3/3     0   0
Tyler Harris           30   14   15    4   2   3/10   30.0   0/3     0.0   0/0     0   0
Bradley Davis          28    5    0    0   3   2/9    22.2   0/6     0.0   1/1     0   0
DeMar Banchero         21    9    0    2   0   3/3   100.0   2/2   100.0   1/1     1   0
Cole Durant            18   11    2    1   3   5/8    62.5   2/3    66.7   1/1     0   0
Jaren James            18    8    0    1   1   3/6    50.0   3/5    60.0   2/3     0   0
Lamelo Ball            18    4    2    1   1   2/4    50.0   0/0     0.0   0/0     0   0
Kyle Green             18    7    6    2   1   2/6    33.3   0/1     0.0   3/3     0   0

TEAM: FG: 38/75 (50.7%), 3PT: 9/31 (29.0%), REB: 36 (8 off, 28 def), AST: 15, TO: 15


Team_018
--------------------------------------------------------------------------------
Player                MIN  PTS  REB  AST  TO      FG   FG%      3P   3P%      FT STL BLK
--------------------------------------------------------------------------------
Tracy Bryant           30   10    0    4   0   4/9    44.4   1/3    33.3   3/4     0   0
Allen Markkanen        30   24    9    2   3  11/14   78.6   6/8    75.0   6/6     0   1
Bones Anunoby          30    8   11    2   0   4/8    50.0   0/2     0.0   0/3     1   0
Domantas Wall          30   17   11    3   1   6/10   60.0   0/1     0.0   3/3     0   0
Klay Stewart           28   12    0    2   0   4/9    44.4   2/4    50.0   5/6     0   0
Michael Simons         21    0    0    1   1   0/2     0.0   0/2     0.0   1/2     0   0
Miles Herro            18   12    0    1   0   4/5    80.0   3/4    75.0   1/1     2   0
Austin Antetokounmpo   18    8    3    2   1   4/4   100.0   0/0     0.0   2/2     1   1
Shai Wade              18   18    6    1   2   7/8    87.5   2/3    66.7   9/9     0   1
Julius Jackson         18    8    9    1   3   4/8    50.0   0/1     0.0   3/5     2   1

TEAM: FG: 50/79 (63.3%), 3PT: 14/28 (50.0%), REB: 48 (12 off, 36 def), AST: 19, TO: 11

================================================================================
