================================================================================
                        FULL GAME - Team_070 vs Team_071                        
================================================================================

================================================================================
                       1ST QUARTER - Team_070 vs Team_071                       
================================================================================

[12:00] Team_070 possession (Score: 0-0)
Jabari Paul drives to the basket... Jabari Paul throws a bad pass! Stolen by Dejounte Paul! TURNOVER! (live ball)

[11:47] Team_071 possession (Score: 0-0)
Jimmy Simons attempts a 3Pt. BLOCKED BY KHRIS BRYANT! Ball is loose! Rebound secured by LeBron Barnes.

[11:30] Team_070 possession (Score: 0-0)
John Hyland attempts a 3Pt. Contested by Victor Anunoby (4.1 feet, ZONE). JOHN HYLAND MAKES IT!
Score: 3-0

[11:20] Team_071 possession (Score: 3-0)
Jimmy Simons attempts a Midrange. Contested by Khris Bryant (2.5 feet, ZONE). Jimmy Simons misses. Rebound secured by LeBron Barnes.

[11:07] Team_070 possession (Score: 3-0)
FOUL! Shooting foul on Victor Anunoby. LeBron Barnes to the line for 2 free throws. [Team fouls: 1] (Victor Anunoby: 1 personal fouls)   FT 1/2: MISS   FT 2/2: GOOD LeBron Barnes makes 1/2 from the line.
Score: 4-0

[10:56] Team_071 possession (Score: 4-0)
Victor Anunoby attempts a 3Pt. Contested by Khris Bryant (2.5 feet, ZONE). Victor Anunoby misses. Rebound secured by LeBron Barnes.

[10:44] Team_070 possession (Score: 4-0)
LeBron Barnes makes the Layup and draws the foul on Bam Iverson! And-1! LeBron Barnes to the line for 1. [Team fouls: 2] (Bam Iverson: 1 personal fouls)   FT 1/1: GOOD LeBron Barnes makes 1/1 from the line.
Score: 7-0

[10:27] Team_071 possession (Score: 7-0)
Victor Anunoby drives, Jabari Paul stays with him. Victor Anunoby attempts a Dunk. Contested by Jabari Paul (4.5 feet, ZONE). VICTOR ANUNOBY MAKES IT! Assist: Bam Iverson
Score: 7-2

[10:13] Team_070 possession (Score: 7-2)
LeBron Barnes attempts a Midrange. Contested by Victor Anunoby (4.6 feet, MAN). LeBron Barnes misses. Rebound secured by Dejounte Paul.

[09:57] Team_071 possession (Score: 7-2)
Allen Williamson throws a bad pass! Stolen by Cole Gasol! TURNOVER! (live ball)

[09:44] Team_070 possession (Score: 7-2)
John Hyland attempts a 3Pt. Contested by Victor Anunoby (4.1 feet, ZONE). John Hyland misses. Rebound secured by Bam Iverson.

[09:26] Team_071 possession (Score: 7-2)
FOUL! Shooting foul on Cole Gasol. Allen Williamson to the line for 2 free throws. [Team fouls: 1] (Cole Gasol: 1 personal fouls)   FT 1/2: MISS   FT 2/2: GOOD Allen Williamson makes 1/2 from the line.
Score: 7-3

[09:16] Team_070 possession (Score: 7-3)
Cole Gasol drives, picks up Dejounte Paul. Help arrives from Allen Williamson! Cole Gasol attempts a Layup. Contested by Allen Williamson (4.3 feet, ZONE). Cole Gasol misses. FOUL! Loose ball foul on Jimmy Simons during the rebound battle. [Team fouls: 3] No free throws, side out. (Jimmy Simons: 1 personal fouls)

[09:02] Team_070 possession (Score: 7-3)
John Hyland attempts a Layup. Contested by Bam Iverson (3.4 feet, MAN). John Hyland misses. Rebound secured by Dejounte Paul.

[08:45] Team_071 possession (Score: 7-3)
Bam Iverson attempts a Midrange. Contested by John Hyland (4.6 feet, MAN). BAM IVERSON MAKES IT!
Score: 7-5

[08:33] Team_070 possession (Score: 7-5)
LeBron Barnes attempts a 3Pt. Contested by Victor Anunoby (4.6 feet, MAN). LeBron Barnes misses. Rebound secured by Bam Iverson.

[08:20] Team_071 possession (Score: 7-5)
Dejounte Paul attempts a Dunk. BLOCKED BY KHRIS BRYANT! Ball is loose! Rebound secured by Jabari Paul.

[08:06] Team_070 possession (Score: 7-5)
Cole Gasol drives, picks up Dejounte Paul. Help arrives from Allen Williamson! Cole Gasol attempts a Layup. Contested by Allen Williamson (4.3 feet, ZONE). COLE GASOL MAKES IT! Assist: LeBron Barnes
Score: 9-5

[07:52] Team_071 possession (Score: 9-5)
FOUL! Offensive foul on Allen Williamson! Cole Gasol drew the charge! [Team fouls: 4] (Allen Williamson: 1 personal fouls) TURNOVER! (dead ball)

[07:36] Team_070 possession (Score: 9-5)
Khris Bryant attempts a Midrange. Contested by Bam Iverson (3.4 feet, ZONE). Khris Bryant misses. FOUL! Loose ball foul on Dejounte Paul during the rebound battle. [IN THE BONUS! 5 team fouls] Khris Bryant to the line for 2 free throws. (Dejounte Paul: 1 personal fouls)   FT 1/2: GOOD   FT 2/2: MISS Khris Bryant makes 1/2 from the line. Rebound secured by Bam Iverson.
Score: 10-5

[07:24] Team_071 possession (Score: 10-5)
Victor Anunoby drives and kicks out. Dejounte Paul attempts a 3Pt. Contested by Khris Bryant (2.4 feet, ZONE). Dejounte Paul misses. Rebound secured by LeBron Barnes.

[07:09] Team_070 possession (Score: 10-5)
LeBron Barnes drives to the basket... LeBron Barnes throws a bad pass out of bounds! TURNOVER! (dead ball)

[06:59] Team_071 possession (Score: 10-5)
Dejounte Paul attempts a Midrange. Contested by Khris Bryant (2.8 feet, MAN). DEJOUNTE PAUL MAKES IT! Assist: Bam Iverson
Score: 10-7

[06:45] Team_070 possession (Score: 10-7)
Cole Gasol attempts a 3Pt. Contested by Jimmy Simons (4.3 feet, ZONE). Cole Gasol misses. Rebound secured by Dejounte Paul.

[06:25] Team_071 possession (Score: 10-7)
Victor Anunoby drives to the basket... Victor Anunoby throws a bad pass out of bounds! TURNOVER! (dead ball)

[06:13] Team_070 possession (Score: 10-7)
Cole Gasol attempts a 3Pt. Contested by Allen Williamson (4.1 feet, MAN). Cole Gasol misses. Rebound secured by Jimmy Simons.

[05:55] Team_071 possession (Score: 10-7)
Dejounte Paul attempts a Midrange. Contested by John Hyland (4.9 feet, ZONE). DEJOUNTE PAUL MAKES IT! Assist: Bam Iverson
Score: 10-9

[05:43] Team_070 possession (Score: 10-9)
John Hyland attempts a 3Pt. Contested by Bam Iverson (3.4 feet, MAN). John Hyland misses. Rebound secured by Jimmy Simons.

[05:28] Team_071 possession (Score: 10-9)
Jimmy Simons attempts a 3Pt. Contested by Khris Bryant (2.5 feet, ZONE). JIMMY SIMONS MAKES IT! Assist: Dejounte Paul
Score: 10-12

[05:16] Team_070 possession (Score: 10-12)
FOUL! Shooting foul on Bam Iverson. John Hyland to the line for 3 free throws. [BONUS: 6 team fouls] (Bam Iverson: 2 personal fouls)   FT 1/3: GOOD   FT 2/3: GOOD   FT 3/3: GOOD John Hyland makes 3/3 from the line.
Score: 13-12

[05:04] Team_071 possession (Score: 13-12)
Allen Williamson attempts a 3Pt. Contested by Cole Gasol (5.7 feet, MAN). ALLEN WILLIAMSON MAKES IT! Assist: Jimmy Simons
Score: 13-15

[04:55] Team_070 possession (Score: 13-15)
Cole Gasol drives to the basket... Cole Gasol commits a violation (traveling/carry)! TURNOVER! (dead ball)

[04:39] Team_071 possession (Score: 13-15)
Victor Anunoby attempts a 3Pt. Contested by LeBron Barnes (3.7 feet, MAN). Victor Anunoby misses. Rebound secured by LeBron Barnes.

[04:24] Team_070 possession (Score: 13-15)
Jabari Paul commits a violation (traveling/carry)! TURNOVER! (dead ball)

[04:09] Team_071 possession (Score: 13-15)
Victor Anunoby loses the ball! Stripped by LeBron Barnes! TURNOVER! (live ball)

[03:52] Team_070 possession (Score: 13-15)
Jabari Paul attempts a Midrange. Contested by Jimmy Simons (5.0 feet, ZONE). Jabari Paul misses. Offensive rebound by LeBron Barnes! LeBron Barnes kicks it out.

[03:39] Team_070 possession (Score: 13-15)
Jabari Paul attempts a Layup. Contested by Dejounte Paul (5.0 feet, ZONE). Jabari Paul misses. Rebound secured by Dejounte Paul.

[03:26] Team_071 possession (Score: 13-15)
FOUL! Shooting foul on Khris Bryant. Bam Iverson to the line for 3 free throws. [Team fouls: 2] (Khris Bryant: 1 personal fouls)   FT 1/3: GOOD   FT 2/3: GOOD   FT 3/3: GOOD Bam Iverson makes 3/3 from the line.
Score: 13-18

[03:08] Team_070 possession (Score: 13-18)
John Hyland attempts a Midrange. Contested by Victor Anunoby (4.3 feet, ZONE). JOHN HYLAND MAKES IT!
Score: 15-18

[02:50] Team_071 possession (Score: 15-18)
Jimmy Simons attempts a Midrange. Contested by Khris Bryant (2.7 feet, ZONE). JIMMY SIMONS MAKES IT!
Score: 15-20

[02:35] Team_070 possession (Score: 15-20)
Cole Gasol attempts a 3Pt. Contested by Victor Anunoby (4.6 feet, ZONE). Cole Gasol misses. Rebound secured by Dejounte Paul.

[02:19] Team_071 possession (Score: 15-20)
Jimmy Simons attempts a Layup. BLOCKED BY KHRIS BRYANT! Ball goes out off Khris Bryant. Jimmy Simons's ball!

[02:06] Team_071 possession (Score: 15-20)
Jimmy Simons attempts a 3Pt. Contested by Khris Bryant (2.8 feet, MAN). JIMMY SIMONS MAKES IT!
Score: 15-23

[01:48] Team_070 possession (Score: 15-23)
Cole Gasol drives, Dejounte Paul stays with him. Cole Gasol attempts a Dunk. Contested by Dejounte Paul (4.7 feet, ZONE). COLE GASOL MAKES IT! Assist: Jabari Paul
Score: 17-23

[01:35] Team_071 possession (Score: 17-23)
Victor Anunoby throws a bad pass! Stolen by LeBron Barnes! TURNOVER! (live ball)

[01:22] Team_070 possession (Score: 17-23)
John Hyland attempts a 3Pt. Contested by Victor Anunoby (4.5 feet, ZONE). John Hyland misses. Rebound secured by Bam Iverson.

[01:08] Team_071 possession (Score: 17-23)
Victor Anunoby drives and kicks out. Bam Iverson attempts a Midrange. Contested by Jabari Paul (4.9 feet, ZONE). Bam Iverson misses. Offensive rebound by Dejounte Paul! Dejounte Paul kicks it out.

[00:57] Team_071 possession (Score: 17-23)
FOUL! Shooting foul on LeBron Barnes. Allen Williamson to the line for 2 free throws. [Team fouls: 3] (LeBron Barnes: 1 personal fouls)   FT 1/2: GOOD   FT 2/2: GOOD Allen Williamson makes 2/2 from the line.
Score: 17-25

[00:46] Team_070 possession (Score: 17-25)
Jabari Paul drives to the basket... Jabari Paul loses control! Ball rolls out of bounds! TURNOVER! (dead ball)

[00:46] Substitution (Team_070): Cole Gasol OUT → Paul Quickley IN (stamina_rule2)

[00:46] Substitution (Team_070): LeBron Barnes OUT → Allen Quickley IN (stamina_rule2)

[00:46] Substitution (Team_070): John Hyland OUT → D'Angelo McGrady IN (stamina_rule2)

[00:46] Substitution (Team_070): Khris Bryant OUT → Luka Gobert IN (stamina_rule2)

[00:46] Substitution (Team_070): Jabari Paul OUT → Russell Morant IN (stamina_rule2)

[00:46] Substitution (Team_071): Allen Williamson OUT → Evan Sexton IN (stamina_rule2)

[00:46] Substitution (Team_071): Victor Anunoby OUT → Paul Ball IN (stamina_rule2)

[00:46] Substitution (Team_071): Bam Iverson OUT → Immanuel Ginobili IN (stamina_rule2)

[00:46] Substitution (Team_071): Jimmy Simons OUT → Jordan Durant IN (stamina_rule2)

[00:46] Substitution (Team_071): Dejounte Paul OUT → Tyrese Brogdon IN (stamina_rule2)

[00:32] Team_071 possession (Score: 17-25)
Paul Ball attempts a 3Pt. Contested by Luka Gobert (4.8 feet, ZONE). Paul Ball misses. Offensive rebound by Jordan Durant! Jordan Durant kicks it out.

[00:13] Team_071 possession (Score: 17-25)
Jordan Durant attempts a 3Pt. Contested by Paul Quickley (4.3 feet, ZONE). Jordan Durant misses. Rebound secured by Russell Morant.

[00:02] Team_070 possession (Score: 17-25)
Allen Quickley attempts a Midrange. Contested by Jordan Durant (4.8 feet, ZONE). Allen Quickley misses. Rebound secured by Immanuel Ginobili.

================================================================================
                              1ST QUARTER COMPLETE                              
================================================================================

1ST QUARTER SCORE: Team_070 17, Team_071 25

BOX SCORE:
================================================================================

Team_070
--------------------------------------------------------------------------------
Player                MIN  PTS  REB  AST  TO      FG   FG%      3P   3P%
--------------------------------------------------------------------------------
John Hyland            11    8    0    0   0   3/7    42.9     0/0   0.0
LeBron Barnes          11    4    7    1   0   2/4    50.0     0/0   0.0
Cole Gasol             11    4    0    0   0   2/5    40.0     0/0   0.0
Jabari Paul            11    0    1    1   0   0/1     0.0     0/0   0.0
Khris Bryant           11    0    0    0   0   0/1     0.0     0/0   0.0
Russell Morant          1    0    1    0   0   0/0     0.0     0/0   0.0
Allen Quickley          1    0    0    0   0   0/1     0.0     0/0   0.0

TEAM: FG: 7/19 (36.8%), 3PT: 2/9 (22.2%), REB: 10 (3 off, 7 def), AST: 2, TO: 5
TEAM FOULS: 3


Team_071
--------------------------------------------------------------------------------
Player                MIN  PTS  REB  AST  TO      FG   FG%      3P   3P%
--------------------------------------------------------------------------------
Jimmy Simons           11    8    2    1   0   3/5    60.0     0/0   0.0
Allen Williamson       11    6    0    0   0   3/3   100.0     0/0   0.0
Bam Iverson            11    5    4    3   0   2/2   100.0     0/0   0.0
Dejounte Paul          11    4    6    1   0   2/3    66.7     0/0   0.0
Victor Anunoby         11    2    0    0   0   1/4    25.0     0/0   0.0
Jordan Durant           1    0    1    0   0   0/1     0.0     0/0   0.0
Immanuel Ginobili       1    0    1    0   0   0/0     0.0     0/0   0.0

TEAM: FG: 11/18 (61.1%), 3PT: 4/8 (50.0%), REB: 13 (2 off, 11 def), AST: 5, TO: 5
TEAM FOULS: 6 [Team_070 in BONUS]

================================================================================

================================================================================
                       2ND QUARTER - Team_070 vs Team_071                       
================================================================================

[12:00] Team_070 possession (Score: 17-25)
Jabari Paul makes the Dunk and draws the foul on Dejounte Paul! And-1! Jabari Paul to the line for 1. [Team fouls: 1] (Dejounte Paul: 1 personal fouls)   FT 1/1: GOOD Jabari Paul makes 1/1 from the line.
Score: 20-25

[11:47] Team_071 possession (Score: 20-25)
Bam Iverson attempts a 3Pt. Contested by John Hyland (4.8 feet, MAN). Bam Iverson misses. Rebound secured by LeBron Barnes.

[11:35] Team_070 possession (Score: 20-25)
Khris Bryant attempts a 3Pt. Contested by Jimmy Simons (4.3 feet, MAN). Khris Bryant misses. Rebound secured by Jimmy Simons.

[11:16] Team_071 possession (Score: 20-25)
Dejounte Paul drives to the basket... Dejounte Paul loses the ball! Stripped by Khris Bryant! TURNOVER! (live ball)

[10:57] Team_070 possession (Score: 20-25)
LeBron Barnes throws a bad pass! Stolen by Victor Anunoby! TURNOVER! (live ball)

[10:41] Team_071 possession (Score: 20-25)
Dejounte Paul drives and kicks out. Dejounte Paul attempts a 3Pt. Contested by Khris Bryant (2.9 feet, MAN). Dejounte Paul misses. FOUL! Loose ball foul on Jabari Paul during the rebound battle. [Team fouls: 1] No free throws, side out. (Jabari Paul: 1 personal fouls)

[10:30] Team_071 possession (Score: 20-25)
Bam Iverson makes the Layup and draws the foul on Khris Bryant! And-1! Bam Iverson to the line for 1. [Team fouls: 2] (Khris Bryant: 1 personal fouls)   FT 1/1: GOOD Bam Iverson makes 1/1 from the line.
Score: 20-28

[10:21] Team_070 possession (Score: 20-28)
LeBron Barnes attempts a 3Pt. Contested by Victor Anunoby (5.0 feet, ZONE). LeBron Barnes misses. Rebound secured by Jimmy Simons.

[10:09] Team_071 possession (Score: 20-28)
Jimmy Simons attempts a Layup. BLOCKED BY KHRIS BRYANT! Ball deflects out of bounds off Jimmy Simons.

[09:51] Team_070 possession (Score: 20-28)
John Hyland makes the Dunk and draws the foul on Allen Williamson! And-1! John Hyland to the line for 1. [Team fouls: 2] (Allen Williamson: 1 personal fouls)   FT 1/1: GOOD John Hyland makes 1/1 from the line.
Score: 23-28

[09:36] Team_071 possession (Score: 23-28)
Jimmy Simons drives to the basket... Jimmy Simons throws a bad pass! Stolen by Khris Bryant! TURNOVER! (live ball)

[09:26] Team_070 possession (Score: 23-28)
Cole Gasol attempts a Midrange. Contested by Allen Williamson (4.6 feet, MAN). Cole Gasol misses. Rebound secured by Bam Iverson.

[09:11] Team_071 possession (Score: 23-28)
FOUL! Shooting foul on LeBron Barnes. Victor Anunoby to the line for 3 free throws. [Team fouls: 3] (LeBron Barnes: 1 personal fouls)   FT 1/3: GOOD   FT 2/3: MISS   FT 3/3: GOOD Victor Anunoby makes 2/3 from the line.
Score: 23-30

[08:55] Team_070 possession (Score: 23-30)
John Hyland makes the Layup and draws the foul on Dejounte Paul! And-1! John Hyland to the line for 1. [Team fouls: 3] (Dejounte Paul: 2 personal fouls)   FT 1/1: MISS John Hyland makes 0/1 from the line. Rebound secured by Jimmy Simons.
Score: 25-30

[08:40] Team_071 possession (Score: 25-30)
Allen Williamson loses the ball! Stripped by Cole Gasol! TURNOVER! (live ball)

[08:24] Team_070 possession (Score: 25-30)
Khris Bryant attempts a 3Pt. Contested by Victor Anunoby (4.7 feet, ZONE). Khris Bryant misses. Offensive rebound by LeBron Barnes! LeBron Barnes kicks it out.

[08:07] Team_070 possession (Score: 25-30)
FOUL! Shooting foul on Dejounte Paul. Cole Gasol to the line for 2 free throws. [Team fouls: 4] (Dejounte Paul: 3 personal fouls)   FT 1/2: MISS   FT 2/2: GOOD Cole Gasol makes 1/2 from the line.
Score: 26-30

[07:54] Team_071 possession (Score: 26-30)
Victor Anunoby attempts a 3Pt. Contested by Khris Bryant (3.3 feet, ZONE). Victor Anunoby misses. Rebound secured by Khris Bryant.

[07:40] Team_070 possession (Score: 26-30)
FOUL! Holding foul on Allen Williamson. [IN THE BONUS! 5 team fouls] Cole Gasol to the line for 2 free throws. (Allen Williamson: 2 personal fouls)   FT 1/2: GOOD   FT 2/2: GOOD Cole Gasol makes 2/2 from the line.
Score: 28-30

[07:27] Team_071 possession (Score: 28-30)
Bam Iverson attempts a 3Pt. Contested by Khris Bryant (3.5 feet, ZONE). Bam Iverson misses. Rebound secured by Khris Bryant.

[07:11] Team_070 possession (Score: 28-30)
John Hyland attempts a Midrange. Contested by Allen Williamson (4.7 feet, ZONE). John Hyland misses. Offensive rebound by LeBron Barnes! LeBron Barnes kicks it out.

[06:54] Team_070 possession (Score: 28-30)
LeBron Barnes attempts a Layup. Contested by Victor Anunoby (5.4 feet, MAN). LEBRON BARNES MAKES IT! Assist: Cole Gasol
Score: 30-30

[06:38] Team_071 possession (Score: 30-30)
Allen Williamson attempts a 3Pt. Wide open! Cole Gasol is 6.2 feet away. [MAN] Allen Williamson misses. Rebound secured by Khris Bryant.

[06:21] Team_070 possession (Score: 30-30)
FOUL! Reach-in foul on Dejounte Paul during the drive. [IN THE BONUS! 6 team fouls] Cole Gasol to the line for 2 free throws. (Dejounte Paul: 4 personal fouls)   FT 1/2: MISS   FT 2/2: GOOD Cole Gasol makes 1/2 from the line.
Score: 31-30

[06:03] Team_071 possession (Score: 31-30)
Jimmy Simons makes the Midrange and draws the foul on LeBron Barnes! And-1! Jimmy Simons to the line for 1. [Team fouls: 4] (LeBron Barnes: 2 personal fouls)   FT 1/1: GOOD Jimmy Simons makes 1/1 from the line.
Score: 31-33

[05:50] Team_070 possession (Score: 31-33)
Khris Bryant drives, picks up Jimmy Simons. Help arrives from Allen Williamson! Khris Bryant attempts a Layup. Contested by Allen Williamson (5.1 feet, MAN). Khris Bryant misses. Rebound secured by Jimmy Simons.

[05:34] Team_071 possession (Score: 31-33)
Jimmy Simons attempts a Midrange. Contested by Khris Bryant (3.7 feet, MAN). Jimmy Simons misses. Rebound secured by Jabari Paul.

[05:20] Team_070 possession (Score: 31-33)
LeBron Barnes attempts a 3Pt. Contested by Victor Anunoby (5.6 feet, MAN). LEBRON BARNES MAKES IT!
Score: 34-33

[05:10] Team_071 possession (Score: 34-33)
Jimmy Simons attempts a Midrange. Contested by Khris Bryant (3.8 feet, ZONE). Jimmy Simons misses. Rebound secured by Khris Bryant.

[05:00] Team_070 possession (Score: 34-33)
Jabari Paul drives, Dejounte Paul stays with him. Jabari Paul attempts a Layup. Contested by Dejounte Paul (5.9 feet, MAN). Jabari Paul misses. Rebound secured by Bam Iverson.

[04:46] Team_071 possession (Score: 34-33)
FOUL! Reach-in foul on Khris Bryant during the drive. [IN THE BONUS! 5 team fouls] Dejounte Paul to the line for 2 free throws. (Khris Bryant: 2 personal fouls)   FT 1/2: GOOD   FT 2/2: GOOD Dejounte Paul makes 2/2 from the line.
Score: 34-35

[04:36] Team_070 possession (Score: 34-35)
LeBron Barnes attempts a Layup. BLOCKED BY BAM IVERSON! Ball is loose! Offensive rebound by Khris Bryant! Khris Bryant kicks it out.

[04:20] Team_070 possession (Score: 34-35)
LeBron Barnes makes the Midrange and draws the foul on Victor Anunoby! And-1! LeBron Barnes to the line for 1. [BONUS: 7 team fouls] (Victor Anunoby: 1 personal fouls)   FT 1/1: GOOD LeBron Barnes makes 1/1 from the line.
Score: 37-35

[04:10] Team_071 possession (Score: 37-35)
Dejounte Paul attempts a 3Pt. Contested by Khris Bryant (4.3 feet, MAN). DEJOUNTE PAUL MAKES IT! Assist: Bam Iverson
Score: 37-38

[03:59] Team_070 possession (Score: 37-38)
John Hyland attempts a 3Pt. Contested by Victor Anunoby (5.4 feet, ZONE). John Hyland misses. Rebound secured by Bam Iverson.

[03:40] Team_071 possession (Score: 37-38)
Jimmy Simons attempts a Midrange. Contested by Khris Bryant (4.1 feet, ZONE). Jimmy Simons misses. Rebound secured by LeBron Barnes.

[03:24] Team_070 possession (Score: 37-38)
Cole Gasol attempts a 3Pt. Contested by Allen Williamson (5.4 feet, MAN). Cole Gasol misses. Rebound secured by Jimmy Simons.

[03:09] Team_071 possession (Score: 37-38)
Victor Anunoby attempts a Midrange. Contested by LeBron Barnes (5.0 feet, MAN). Victor Anunoby misses. Rebound secured by LeBron Barnes.

[02:55] Team_070 possession (Score: 37-38)
Jabari Paul loses control! Ball rolls out of bounds! TURNOVER! (dead ball)

[02:55] Substitution (Team_070): Cole Gasol OUT → Paul Quickley IN (stamina_rule2)

[02:55] Substitution (Team_070): LeBron Barnes OUT → Allen Quickley IN (stamina_rule2)

[02:55] Substitution (Team_070): John Hyland OUT → D'Angelo McGrady IN (stamina_rule2)

[02:55] Substitution (Team_070): Khris Bryant OUT → Luka Gobert IN (stamina_rule2)

[02:55] Substitution (Team_070): Jabari Paul OUT → Russell Morant IN (stamina_rule2)

[02:55] Substitution (Team_071): Allen Williamson OUT → Evan Sexton IN (stamina_rule2)

[02:55] Substitution (Team_071): Victor Anunoby OUT → Paul Ball IN (stamina_rule2)

[02:55] Substitution (Team_071): Bam Iverson OUT → Immanuel Ginobili IN (stamina_rule2)

[02:55] Substitution (Team_071): Jimmy Simons OUT → Jordan Durant IN (stamina_rule2)

[02:55] Substitution (Team_071): Dejounte Paul OUT → Tyrese Brogdon IN (stamina_rule2)

[02:36] Team_071 possession (Score: 37-38)
Tyrese Brogdon attempts a Midrange. Wide open! D'Angelo McGrady is 6.0 feet away. [ZONE] Tyrese Brogdon misses. Rebound secured by Russell Morant.

[02:20] Team_070 possession (Score: 37-38)
Russell Morant drives and kicks out. Allen Quickley attempts a 3Pt. Contested by Paul Ball (4.3 feet, ZONE). ALLEN QUICKLEY MAKES IT! Assist: Paul Quickley
Score: 40-38

[02:07] Team_071 possession (Score: 40-38)
Immanuel Ginobili attempts a 3Pt. Contested by D'Angelo McGrady (5.6 feet, MAN). Immanuel Ginobili misses. Rebound secured by Russell Morant.

[01:52] Team_070 possession (Score: 40-38)
D'Angelo McGrady attempts a Layup. Contested by Tyrese Brogdon (5.7 feet, ZONE). D'Angelo McGrady misses. Rebound secured by Evan Sexton.

[01:38] Team_071 possession (Score: 40-38)
Tyrese Brogdon attempts a Layup. Contested by Russell Morant (4.1 feet, MAN). TYRESE BROGDON MAKES IT! Assist: Immanuel Ginobili
Score: 40-40

[01:20] Team_070 possession (Score: 40-40)
Allen Quickley attempts a 3Pt. Contested by Paul Ball (4.4 feet, MAN). Allen Quickley misses. Offensive rebound by Luka Gobert! Luka Gobert kicks it out.

[01:07] Team_070 possession (Score: 40-40)
Luka Gobert drives to the basket... Luka Gobert loses the ball! Stripped by Jordan Durant! TURNOVER! (live ball)

[00:53] Team_071 possession (Score: 40-40)
Paul Ball attempts a 3Pt. Contested by Allen Quickley (5.2 feet, ZONE). Paul Ball misses. Offensive rebound by Immanuel Ginobili! Immanuel Ginobili kicks it out.

[00:39] Team_071 possession (Score: 40-40)
Jordan Durant drives and kicks out. Immanuel Ginobili attempts a 3Pt. Contested by Paul Quickley (4.3 feet, ZONE). Immanuel Ginobili misses. Rebound secured by D'Angelo McGrady.

[00:28] Team_070 possession (Score: 40-40)
FOUL! Holding foul on Immanuel Ginobili. [IN THE BONUS! 8 team fouls] D'Angelo McGrady to the line for 2 free throws. (Immanuel Ginobili: 1 personal fouls)   FT 1/2: MISS   FT 2/2: GOOD D'Angelo McGrady makes 1/2 from the line.
Score: 41-40

[00:13] Team_071 possession (Score: 41-40)
Jordan Durant attempts a 3Pt. Contested by Paul Quickley (4.3 feet, ZONE). JORDAN DURANT MAKES IT! Assist: Immanuel Ginobili
Score: 41-43

================================================================================
                              2ND QUARTER COMPLETE                              
================================================================================

2ND QUARTER SCORE: Team_070 24, Team_071 18

BOX SCORE:
================================================================================

Team_070
--------------------------------------------------------------------------------
Player                MIN  PTS  REB  AST  TO      FG   FG%      3P   3P%
--------------------------------------------------------------------------------
LeBron Barnes          21    8    5    0   0   3/4    75.0     0/0   0.0
Cole Gasol             21    4    0    1   0   3/5    60.0     0/0   0.0
Jabari Paul            21    3    1    0   0   1/2    50.0     0/0   0.0
John Hyland            21    3    0    0   0   1/3    33.3     0/0   0.0
Allen Quickley          3    3    0    0   0   1/1   100.0     0/0   0.0
D'Angelo McGrady        3    1    1    0   0   1/2    50.0     0/0   0.0
Khris Bryant           21    0    5    0   0   0/2     0.0     0/0   0.0
Russell Morant          3    0    2    0   0   0/0     0.0     0/0   0.0
Paul Quickley           3    0    0    1   0   0/0     0.0     0/0   0.0
Luka Gobert             3    0    1    0   0   0/0     0.0     0/0   0.0

TEAM: FG: 10/19 (52.6%), 3PT: 1/5 (20.0%), REB: 15 (4 off, 11 def), AST: 2, TO: 3
TEAM FOULS: 5 [Team_071 in BONUS]


Team_071
--------------------------------------------------------------------------------
Player                MIN  PTS  REB  AST  TO      FG   FG%      3P   3P%
--------------------------------------------------------------------------------
Dejounte Paul          21    5    1    0   0   2/2   100.0     0/0   0.0
Bam Iverson            21    3    3    1   0   1/3    33.3     0/0   0.0
Jimmy Simons           21    3    5    0   0   1/5    20.0     0/0   0.0
Jordan Durant           3    3    0    0   0   1/2    50.0     0/0   0.0
Victor Anunoby         21    2    0    0   0   1/3    33.3     0/0   0.0
Tyrese Brogdon          3    2    0    0   0   1/2    50.0     0/0   0.0
Allen Williamson       21    0    0    0   0   0/1     0.0     0/0   0.0
Immanuel Ginobili       3    0    1    2   0   0/1     0.0     0/0   0.0
Evan Sexton             3    0    1    0   0   0/0     0.0     0/0   0.0

TEAM: FG: 7/19 (36.8%), 3PT: 3/8 (37.5%), REB: 11 (2 off, 9 def), AST: 3, TO: 3
TEAM FOULS: 8 [Team_070 in BONUS]

================================================================================

================================================================================
                       3RD QUARTER - Team_070 vs Team_071                       
================================================================================

[12:00] Team_070 possession (Score: 41-43)
Cole Gasol attempts a 3Pt. Contested by Victor Anunoby (4.4 feet, ZONE). Cole Gasol misses. Rebound secured by Jimmy Simons.

[11:46] Team_071 possession (Score: 41-43)
Allen Williamson attempts a 3Pt. Contested by Khris Bryant (2.8 feet, ZONE). Allen Williamson misses. Rebound secured by Khris Bryant.

[11:28] Team_070 possession (Score: 41-43)
Khris Bryant attempts a Midrange. Contested by Jimmy Simons (4.0 feet, MAN). Khris Bryant misses. Offensive rebound by Khris Bryant! Khris Bryant puts it back in!
Score: 43-43

[11:12] Team_071 possession (Score: 43-43)
FOUL! Reach-in foul on Jabari Paul during the drive. [Team fouls: 1] No free throws, side out. (Jabari Paul: 1 personal fouls)

[10:55] Team_071 possession (Score: 43-43)
Allen Williamson drives and kicks out. Allen Williamson attempts a 3Pt. Contested by Cole Gasol (5.3 feet, MAN). ALLEN WILLIAMSON MAKES IT! Assist: Bam Iverson
Score: 43-46

[10:39] Team_070 possession (Score: 43-46)
Khris Bryant drives, Dejounte Paul stays with him. Khris Bryant attempts a Dunk. Contested by Dejounte Paul (4.0 feet, ZONE). Khris Bryant misses. Rebound secured by Dejounte Paul.

[10:26] Team_071 possession (Score: 43-46)
Bam Iverson throws a bad pass out of bounds! TURNOVER! (dead ball)

[10:10] Team_070 possession (Score: 43-46)
John Hyland attempts a 3Pt. Contested by Bam Iverson (3.4 feet, MAN). John Hyland misses. Rebound secured by Dejounte Paul.

[09:55] Team_071 possession (Score: 43-46)
Allen Williamson drives, picks up Cole Gasol. Help arrives from LeBron Barnes! Allen Williamson attempts a Layup. Contested by LeBron Barnes (5.7 feet, MAN). ALLEN WILLIAMSON MAKES IT! Assist: Bam Iverson
Score: 43-48

[09:44] Team_070 possession (Score: 43-48)
John Hyland attempts a Midrange. Contested by Bam Iverson (3.4 feet, MAN). John Hyland misses. Rebound secured by Jimmy Simons.

[09:24] Team_071 possession (Score: 43-48)
FOUL! Reach-in foul on Cole Gasol during the drive. [Team fouls: 2] No free throws, side out. (Cole Gasol: 1 personal fouls)

[09:11] Team_071 possession (Score: 43-48)
FOUL! Reach-in foul on Khris Bryant during the drive. [Team fouls: 3] No free throws, side out. (Khris Bryant: 1 personal fouls)

[09:00] Team_071 possession (Score: 43-48)
Victor Anunoby drives, LeBron Barnes stays with him. Victor Anunoby attempts a Dunk. Contested by LeBron Barnes (3.6 feet, MAN). Victor Anunoby misses. Offensive rebound by Jimmy Simons! Jimmy Simons kicks it out.

[08:42] Team_071 possession (Score: 43-48)
Victor Anunoby attempts a Layup. Contested by LeBron Barnes (3.6 feet, MAN). Victor Anunoby misses. Offensive rebound by Dejounte Paul! Dejounte Paul kicks it out.

[08:28] Team_071 possession (Score: 43-48)
Victor Anunoby attempts a 3Pt. Contested by LeBron Barnes (3.6 feet, MAN). Victor Anunoby misses. Rebound secured by LeBron Barnes.

[08:11] Team_070 possession (Score: 43-48)
LeBron Barnes attempts a 3Pt. Contested by Victor Anunoby (4.6 feet, MAN). LeBron Barnes misses. Rebound secured by Dejounte Paul.

[07:59] Team_071 possession (Score: 43-48)
Allen Williamson attempts a 3Pt. Contested by Cole Gasol (5.7 feet, MAN). ALLEN WILLIAMSON MAKES IT! Assist: Victor Anunoby
Score: 43-51

[07:47] Team_070 possession (Score: 43-51)
Jabari Paul attempts a Midrange. Contested by Dejounte Paul (4.9 feet, MAN). JABARI PAUL MAKES IT!
Score: 45-51

[07:35] Team_071 possession (Score: 45-51)
Jimmy Simons attempts a 3Pt. Contested by Khris Bryant (2.5 feet, MAN). Jimmy Simons misses. Rebound secured by Khris Bryant.

[07:21] Team_070 possession (Score: 45-51)
LeBron Barnes attempts a 3Pt. Contested by Victor Anunoby (4.6 feet, ZONE). LeBron Barnes misses. Offensive rebound by LeBron Barnes! LeBron Barnes kicks it out.

[07:07] Team_070 possession (Score: 45-51)
LeBron Barnes drives and kicks out. Jabari Paul attempts a Midrange. Contested by Jimmy Simons (4.1 feet, ZONE). JABARI PAUL MAKES IT! Assist: Cole Gasol
Score: 47-51

[06:51] Team_071 possession (Score: 47-51)
Dejounte Paul throws a bad pass out of bounds! TURNOVER! (dead ball)

[06:36] Team_070 possession (Score: 47-51)
Jabari Paul attempts a 3Pt. Contested by Victor Anunoby (4.9 feet, ZONE). Jabari Paul misses. Rebound secured by Bam Iverson.

[06:23] Team_071 possession (Score: 47-51)
Jimmy Simons attempts a 3Pt. Contested by Khris Bryant (2.5 feet, MAN). Jimmy Simons misses. Rebound secured by LeBron Barnes.

[06:11] Team_070 possession (Score: 47-51)
LeBron Barnes attempts a 3Pt. Contested by Victor Anunoby (4.6 feet, ZONE). LeBron Barnes misses. Rebound secured by Dejounte Paul.

[05:54] Team_071 possession (Score: 47-51)
Dejounte Paul drives, Khris Bryant stays with him. Dejounte Paul attempts a Dunk. Contested by Khris Bryant (2.8 feet, MAN). Dejounte Paul misses. Rebound secured by Jabari Paul.

[05:40] Team_070 possession (Score: 47-51)
LeBron Barnes attempts a Layup. Contested by Victor Anunoby (4.6 feet, MAN). LEBRON BARNES MAKES IT!
Score: 49-51

[05:26] Team_071 possession (Score: 49-51)
Allen Williamson attempts a Midrange. Contested by Cole Gasol (5.7 feet, MAN). Allen Williamson misses. Rebound secured by Jabari Paul.

[05:08] Team_070 possession (Score: 49-51)
Khris Bryant drives and kicks out. John Hyland attempts a Midrange. Contested by Jimmy Simons (4.1 feet, ZONE). John Hyland misses. Rebound secured by Jimmy Simons.

[04:54] Team_071 possession (Score: 49-51)
Dejounte Paul attempts a Midrange. Contested by Khris Bryant (2.9 feet, MAN). Dejounte Paul misses. Rebound secured by LeBron Barnes.

[04:37] Team_070 possession (Score: 49-51)
LeBron Barnes attempts a Layup. Contested by Dejounte Paul (4.6 feet, ZONE). LEBRON BARNES MAKES IT!
Score: 51-51

[04:25] Team_071 possession (Score: 51-51)
Dejounte Paul loses the ball! Stripped by Khris Bryant! TURNOVER! (live ball)

[04:11] Team_070 possession (Score: 51-51)
Khris Bryant throws a bad pass! Stolen by Jimmy Simons! TURNOVER! (live ball)

[03:54] Team_071 possession (Score: 51-51)
Jimmy Simons attempts a Layup. Contested by Khris Bryant (2.6 feet, ZONE). JIMMY SIMONS MAKES IT!
Score: 51-53

[03:37] Team_070 possession (Score: 51-53)
Jabari Paul commits a violation (traveling/carry)! TURNOVER! (dead ball)

[03:24] Team_071 possession (Score: 51-53)
Bam Iverson attempts a 3Pt. Contested by LeBron Barnes (3.8 feet, ZONE). Bam Iverson misses. Rebound secured by Jabari Paul.

[03:09] Team_070 possession (Score: 51-53)
Cole Gasol attempts a Layup. Contested by Dejounte Paul (4.5 feet, ZONE). COLE GASOL MAKES IT! Assist: John Hyland
Score: 53-53

[02:54] Team_071 possession (Score: 53-53)
Dejounte Paul drives and kicks out. Jimmy Simons attempts a 3Pt. Contested by Khris Bryant (2.7 feet, ZONE). JIMMY SIMONS MAKES IT! Assist: Allen Williamson
Score: 53-56

[02:41] Team_070 possession (Score: 53-56)
Khris Bryant attempts a 3Pt. Contested by Jimmy Simons (4.2 feet, MAN). Khris Bryant misses. Offensive rebound by LeBron Barnes! LeBron Barnes kicks it out.

[02:28] Team_070 possession (Score: 53-56)
Cole Gasol attempts a Midrange. Contested by Jimmy Simons (4.6 feet, ZONE). Cole Gasol misses. Offensive rebound by LeBron Barnes! LeBron Barnes kicks it out.

[02:13] Team_070 possession (Score: 53-56)
Cole Gasol makes the Layup and draws the foul on Dejounte Paul! And-1! Cole Gasol to the line for 1. [Team fouls: 1] (Dejounte Paul: 1 personal fouls)   FT 1/1: GOOD Cole Gasol makes 1/1 from the line.
Score: 56-56

[02:03] Team_071 possession (Score: 56-56)
Victor Anunoby attempts a 3Pt. Contested by LeBron Barnes (3.9 feet, MAN). Victor Anunoby misses. Offensive rebound by Jimmy Simons! Jimmy Simons kicks it out.

[01:44] Team_071 possession (Score: 56-56)
Bam Iverson attempts a 3Pt. Contested by Khris Bryant (2.9 feet, ZONE). Bam Iverson misses. Rebound secured by Khris Bryant.

[01:31] Team_070 possession (Score: 56-56)
Jabari Paul drives and kicks out. LeBron Barnes attempts a 3Pt. Contested by Victor Anunoby (4.6 feet, MAN). LeBron Barnes misses. Rebound secured by Bam Iverson.

[01:16] Team_071 possession (Score: 56-56)
Dejounte Paul makes the Dunk and draws the foul on Khris Bryant! And-1! Dejounte Paul to the line for 1. [Team fouls: 4] (Khris Bryant: 2 personal fouls)   FT 1/1: GOOD Dejounte Paul makes 1/1 from the line.
Score: 56-59

[01:05] Team_070 possession (Score: 56-59)
FOUL! Shooting foul on Bam Iverson. John Hyland to the line for 3 free throws. [Team fouls: 2] (Bam Iverson: 1 personal fouls)   FT 1/3: GOOD   FT 2/3: GOOD   FT 3/3: GOOD John Hyland makes 3/3 from the line.
Score: 59-59

[00:48] Team_071 possession (Score: 59-59)
Bam Iverson attempts a 3Pt. Contested by Khris Bryant (3.1 feet, ZONE). Bam Iverson misses. Rebound secured by Jabari Paul.

[00:36] Team_070 possession (Score: 59-59)
John Hyland attempts a 3Pt. Contested by Victor Anunoby (4.6 feet, ZONE). JOHN HYLAND MAKES IT! Assist: Cole Gasol
Score: 62-59

[00:21] Team_071 possession (Score: 62-59)
Bam Iverson attempts a 3Pt. Contested by Khris Bryant (3.1 feet, ZONE). BAM IVERSON MAKES IT! Assist: Dejounte Paul
Score: 62-62

[00:05] Team_070 possession (Score: 62-62)
LeBron Barnes attempts a 3Pt. Contested by Victor Anunoby (5.1 feet, ZONE). LEBRON BARNES MAKES IT! Assist: Cole Gasol
Score: 65-62

================================================================================
                              3RD QUARTER COMPLETE                              
================================================================================

3RD QUARTER SCORE: Team_070 24, Team_071 19

BOX SCORE:
================================================================================

Team_070
--------------------------------------------------------------------------------
Player                MIN  PTS  REB  AST  TO      FG   FG%      3P   3P%
--------------------------------------------------------------------------------
LeBron Barnes          33    7    6    0   0   3/5    60.0     0/0   0.0
John Hyland            33    6    0    1   0   2/4    50.0     0/0   0.0
Cole Gasol             33    5    0    3   0   2/3    66.7     0/0   0.0
Jabari Paul            33    4    4    0   0   2/4    50.0     0/0   0.0
Khris Bryant           33    2    4    0   0   1/3    33.3     0/0   0.0

TEAM: FG: 10/19 (52.6%), 3PT: 3/8 (37.5%), REB: 14 (4 off, 10 def), AST: 4, TO: 2
TEAM FOULS: 4


Team_071
--------------------------------------------------------------------------------
Player                MIN  PTS  REB  AST  TO      FG   FG%      3P   3P%
--------------------------------------------------------------------------------
Allen Williamson       33    8    0    1   0   3/5    60.0     0/0   0.0
Jimmy Simons           33    5    5    0   0   2/4    50.0     0/0   0.0
Bam Iverson            33    3    2    2   0   1/4    25.0     0/0   0.0
Dejounte Paul          33    3    5    1   0   1/3    33.3     0/0   0.0
Victor Anunoby         33    0    0    1   0   0/1     0.0     0/0   0.0

TEAM: FG: 7/17 (41.2%), 3PT: 2/9 (22.2%), REB: 12 (3 off, 9 def), AST: 5, TO: 3
TEAM FOULS: 2

================================================================================

================================================================================
                       4TH QUARTER - Team_070 vs Team_071                       
================================================================================

[12:00] Team_070 possession (Score: 65-62)
Cole Gasol makes the Layup and draws the foul on Allen Williamson! And-1! Cole Gasol to the line for 1. [Team fouls: 1] (Allen Williamson: 1 personal fouls)   FT 1/1: MISS Cole Gasol makes 0/1 from the line. Offensive rebound by LeBron Barnes! LeBron Barnes kicks it out.
Score: 67-62

[11:50] Team_070 possession (Score: 67-62)
Khris Bryant drives, Jimmy Simons stays with him. Khris Bryant attempts a Dunk. Contested by Jimmy Simons (4.4 feet, MAN). KHRIS BRYANT MAKES IT!
Score: 69-62

[11:39] Team_071 possession (Score: 69-62)
Bam Iverson drives and kicks out. Bam Iverson attempts a 3Pt. Contested by John Hyland (4.8 feet, MAN). Bam Iverson misses. Rebound secured by Khris Bryant.

[11:23] Team_070 possession (Score: 69-62)
Cole Gasol attempts a Midrange. Contested by Jimmy Simons (4.7 feet, ZONE). Cole Gasol misses. Rebound secured by Bam Iverson.

[11:08] Team_071 possession (Score: 69-62)
Bam Iverson attempts a Midrange. Contested by Jabari Paul (4.9 feet, ZONE). Bam Iverson misses. Rebound secured by Jabari Paul.

[10:51] Team_070 possession (Score: 69-62)
Khris Bryant attempts a Midrange. Contested by Jimmy Simons (4.5 feet, MAN). Khris Bryant misses. Rebound secured by Dejounte Paul.

[10:40] Team_071 possession (Score: 69-62)
Dejounte Paul attempts a Midrange. Contested by Khris Bryant (3.4 feet, MAN). Dejounte Paul misses. Rebound secured by LeBron Barnes.

[10:25] Team_070 possession (Score: 69-62)
FOUL! Shooting foul on Jimmy Simons. Khris Bryant to the line for 2 free throws. [Team fouls: 2] (Jimmy Simons: 1 personal fouls)   FT 1/2: GOOD   FT 2/2: GOOD Khris Bryant makes 2/2 from the line.
Score: 71-62

[10:09] Team_071 possession (Score: 71-62)
Jimmy Simons attempts a 3Pt. Contested by Khris Bryant (3.1 feet, ZONE). Jimmy Simons misses. Rebound secured by Jabari Paul.

[09:54] Team_070 possession (Score: 71-62)
Khris Bryant attempts a 3Pt. Contested by Victor Anunoby (4.6 feet, ZONE). Khris Bryant misses. Offensive rebound by Khris Bryant! Khris Bryant puts it back in!
Score: 73-62

[09:43] Team_071 possession (Score: 73-62)
Bam Iverson attempts a Midrange. Contested by John Hyland (5.1 feet, MAN). Bam Iverson misses. FOUL! Loose ball foul on Jabari Paul during the rebound battle. [Team fouls: 1] No free throws, side out. (Jabari Paul: 1 personal fouls)

[09:29] Team_071 possession (Score: 73-62)
Jimmy Simons attempts a 3Pt. Contested by Khris Bryant (3.2 feet, ZONE). JIMMY SIMONS MAKES IT! Assist: Dejounte Paul
Score: 73-65

[09:09] Team_070 possession (Score: 73-65)
FOUL! Shooting foul on Dejounte Paul. Jabari Paul to the line for 2 free throws. [Team fouls: 3] (Dejounte Paul: 1 personal fouls)   FT 1/2: GOOD   FT 2/2: GOOD Jabari Paul makes 2/2 from the line.
Score: 75-65

[08:55] Team_071 possession (Score: 75-65)
Dejounte Paul drives and kicks out. Bam Iverson attempts a Midrange. Contested by John Hyland (5.1 feet, MAN). Bam Iverson misses. Rebound secured by Jabari Paul.

[08:39] Team_070 possession (Score: 75-65)
Khris Bryant makes the Layup and draws the foul on Jimmy Simons! And-1! Khris Bryant to the line for 1. [Team fouls: 4] (Jimmy Simons: 2 personal fouls)   FT 1/1: GOOD Khris Bryant makes 1/1 from the line.
Score: 78-65

[08:19] Team_071 possession (Score: 78-65)
Dejounte Paul drives to the basket... Dejounte Paul throws a bad pass! Stolen by Khris Bryant! TURNOVER! (live ball)

[08:04] Team_070 possession (Score: 78-65)
Cole Gasol attempts a 3Pt. Contested by Allen Williamson (4.8 feet, MAN). Cole Gasol misses. Rebound secured by Bam Iverson.

[07:44] Team_071 possession (Score: 78-65)
Bam Iverson attempts a Midrange. Contested by John Hyland (5.2 feet, MAN). Bam Iverson misses. Rebound secured by Jabari Paul.

[07:29] Team_070 possession (Score: 78-65)
Cole Gasol attempts a 3Pt. Contested by Allen Williamson (4.9 feet, MAN). Cole Gasol misses. FOUL! Loose ball foul on Jimmy Simons during the rebound battle. [IN THE BONUS! 5 team fouls] LeBron Barnes to the line for 2 free throws. (Jimmy Simons: 3 personal fouls)   FT 1/2: MISS   FT 2/2: GOOD LeBron Barnes makes 1/2 from the line.
Score: 79-65

[07:11] Team_071 possession (Score: 79-65)
Bam Iverson attempts a 3Pt. Contested by John Hyland (5.3 feet, MAN). BAM IVERSON MAKES IT! Assist: Victor Anunoby
Score: 79-68

[06:56] Team_070 possession (Score: 79-68)
Cole Gasol attempts a Midrange. Contested by Bam Iverson (4.6 feet, ZONE). Cole Gasol misses. Rebound secured by Jimmy Simons.

[06:45] Team_071 possession (Score: 79-68)
Jimmy Simons commits a violation (traveling/carry)! TURNOVER! (dead ball)

[06:45] Substitution (Team_070): Cole Gasol OUT → Paul Quickley IN (stamina_rule2)

[06:45] Substitution (Team_070): LeBron Barnes OUT → Allen Quickley IN (stamina_rule2)

[06:45] Substitution (Team_070): John Hyland OUT → D'Angelo McGrady IN (stamina_rule2)

[06:45] Substitution (Team_070): Khris Bryant OUT → Luka Gobert IN (stamina_rule2)

[06:45] Substitution (Team_070): Jabari Paul OUT → Russell Morant IN (stamina_rule2)

[06:45] Substitution (Team_071): Allen Williamson OUT → Evan Sexton IN (stamina_rule2)

[06:45] Substitution (Team_071): Victor Anunoby OUT → Paul Ball IN (stamina_rule2)

[06:45] Substitution (Team_071): Bam Iverson OUT → Immanuel Ginobili IN (stamina_rule2)

[06:45] Substitution (Team_071): Jimmy Simons OUT → Jordan Durant IN (stamina_rule2)

[06:45] Substitution (Team_071): Dejounte Paul OUT → Tyrese Brogdon IN (stamina_rule2)

[06:31] Team_070 possession (Score: 79-68)
D'Angelo McGrady attempts a Layup. BLOCKED BY EVAN SEXTON! Ball is loose! Offensive rebound by Russell Morant! Russell Morant kicks it out.

[06:14] Team_070 possession (Score: 79-68)
Allen Quickley commits a violation (traveling/carry)! TURNOVER! (dead ball)

[05:59] Team_071 possession (Score: 79-68)
Immanuel Ginobili attempts a 3Pt. Contested by D'Angelo McGrady (5.6 feet, MAN). Immanuel Ginobili misses. Rebound secured by D'Angelo McGrady.

[05:45] Team_070 possession (Score: 79-68)
Russell Morant attempts a 3Pt. Contested by Paul Ball (4.5 feet, ZONE). Russell Morant misses. FOUL! Loose ball foul on Evan Sexton during the rebound battle. [IN THE BONUS! 6 team fouls] Luka Gobert to the line for 2 free throws. (Evan Sexton: 1 personal fouls)   FT 1/2: MISS   FT 2/2: GOOD Luka Gobert makes 1/2 from the line.
Score: 80-68

[05:32] Team_071 possession (Score: 80-68)
Immanuel Ginobili attempts a Layup. Contested by Russell Morant (3.7 feet, ZONE). Immanuel Ginobili misses. Rebound secured by Russell Morant.

[05:20] Team_070 possession (Score: 80-68)
Luka Gobert attempts a Midrange. Contested by Jordan Durant (4.8 feet, MAN). Luka Gobert misses. Rebound secured by Evan Sexton.

[05:04] Team_071 possession (Score: 80-68)
Evan Sexton drives, Russell Morant stays with him. Evan Sexton attempts a Dunk. Contested by Russell Morant (4.2 feet, ZONE). EVAN SEXTON MAKES IT! Assist: Immanuel Ginobili
Score: 80-70

[04:51] Team_070 possession (Score: 80-70)
Luka Gobert attempts a 3Pt. Contested by Paul Ball (4.4 feet, ZONE). Luka Gobert misses. FOUL! Loose ball foul on Jordan Durant during the rebound battle. [IN THE BONUS! 7 team fouls] Luka Gobert to the line for 2 free throws. (Jordan Durant: 1 personal fouls)   FT 1/2: GOOD   FT 2/2: GOOD Luka Gobert makes 2/2 from the line.
Score: 82-70

[04:40] Team_071 possession (Score: 82-70)
Immanuel Ginobili attempts a Layup. BLOCKED BY PAUL QUICKLEY! Ball is loose! Rebound secured by Luka Gobert.

[04:28] Team_070 possession (Score: 82-70)
FOUL! Holding foul on Jordan Durant. [IN THE BONUS! 8 team fouls] Luka Gobert to the line for 2 free throws. (Jordan Durant: 2 personal fouls)   FT 1/2: GOOD   FT 2/2: GOOD Luka Gobert makes 2/2 from the line.
Score: 84-70

[04:15] Team_071 possession (Score: 84-70)
Tyrese Brogdon drives and kicks out. Immanuel Ginobili attempts a 3Pt. Contested by Paul Quickley (4.3 feet, ZONE). Immanuel Ginobili misses. Rebound secured by Luka Gobert.

[04:02] Team_070 possession (Score: 84-70)
Russell Morant makes the Dunk and draws the foul on Tyrese Brogdon! And-1! Russell Morant to the line for 1. [BONUS: 9 team fouls] (Tyrese Brogdon: 1 personal fouls)   FT 1/1: GOOD Russell Morant makes 1/1 from the line.
Score: 87-70

[03:51] Team_071 possession (Score: 87-70)
FOUL! Holding foul on Luka Gobert. [Team fouls: 2] No free throws, side out. (Luka Gobert: 1 personal fouls)

[03:33] Team_071 possession (Score: 87-70)
Tyrese Brogdon makes the Dunk and draws the foul on Paul Quickley! And-1! Tyrese Brogdon to the line for 1. [Team fouls: 3] (Paul Quickley: 1 personal fouls)   FT 1/1: GOOD Tyrese Brogdon makes 1/1 from the line.
Score: 87-73

[03:19] Team_070 possession (Score: 87-73)
FOUL! Holding foul on Paul Ball. [IN THE BONUS! 10 team fouls] Allen Quickley to the line for 2 free throws. (Paul Ball: 1 personal fouls)   FT 1/2: GOOD   FT 2/2: MISS Allen Quickley makes 1/2 from the line. FOUL! Loose ball foul on Jordan Durant during the free throw rebound! [IN THE BONUS! 11 team fouls] Luka Gobert to the line for 2 free throws. (Jordan Durant: 3 personal fouls)   FT 1/2: GOOD   FT 2/2: MISS Luka Gobert makes 1/2 from the line. Rebound secured by Jordan Durant.
Score: 89-73

[03:06] Team_071 possession (Score: 89-73)
FOUL! Shooting foul on Luka Gobert. Jordan Durant to the line for 2 free throws. [Team fouls: 4] (Luka Gobert: 2 personal fouls)   FT 1/2: GOOD   FT 2/2: GOOD Jordan Durant makes 2/2 from the line.
Score: 89-75

[02:50] Team_070 possession (Score: 89-75)
Luka Gobert attempts a Midrange. Contested by Immanuel Ginobili (4.3 feet, ZONE). Luka Gobert misses. FOUL! Loose ball foul on Jordan Durant during the rebound battle. [IN THE BONUS! 12 team fouls] Russell Morant to the line for 2 free throws. (Jordan Durant: 4 personal fouls)   FT 1/2: MISS   FT 2/2: GOOD Russell Morant makes 1/2 from the line.
Score: 90-75

[02:39] Team_071 possession (Score: 90-75)
Immanuel Ginobili attempts a 3Pt. Contested by D'Angelo McGrady (5.6 feet, MAN). Immanuel Ginobili misses. Rebound secured by D'Angelo McGrady.

[02:25] Team_070 possession (Score: 90-75)
Luka Gobert attempts a 3Pt. Contested by Paul Ball (4.4 feet, ZONE). Luka Gobert misses. Rebound secured by Evan Sexton.

[02:10] Team_071 possession (Score: 90-75)
FOUL! Holding foul on Luka Gobert. [IN THE BONUS! 5 team fouls] Jordan Durant to the line for 2 free throws. (Luka Gobert: 3 personal fouls)   FT 1/2: GOOD   FT 2/2: MISS Jordan Durant makes 1/2 from the line. Rebound secured by Russell Morant.
Score: 90-76

[02:00] Team_070 possession (Score: 90-76)
Russell Morant attempts a Layup. Contested by Tyrese Brogdon (5.8 feet, ZONE). RUSSELL MORANT MAKES IT!
Score: 92-76

[01:41] Team_071 possession (Score: 92-76)
Immanuel Ginobili makes the Layup and draws the foul on Paul Quickley! And-1! Immanuel Ginobili to the line for 1. [BONUS: 6 team fouls] (Paul Quickley: 2 personal fouls)   FT 1/1: GOOD Immanuel Ginobili makes 1/1 from the line.
Score: 92-79

[01:24] Team_070 possession (Score: 92-79)
Paul Quickley attempts a 3Pt. Contested by Paul Ball (4.2 feet, ZONE). Paul Quickley misses. Offensive rebound by Russell Morant! Russell Morant's putback is no good. Rebound secured by Evan Sexton.

[01:11] Team_071 possession (Score: 92-79)
Paul Ball drives, Russell Morant stays with him. Paul Ball attempts a Dunk. Contested by Russell Morant (3.7 feet, ZONE). PAUL BALL MAKES IT! Assist: Evan Sexton
Score: 92-81

[00:59] Team_070 possession (Score: 92-81)
FOUL! Reach-in foul on Tyrese Brogdon during the drive. [IN THE BONUS! 13 team fouls] Allen Quickley to the line for 2 free throws. (Tyrese Brogdon: 2 personal fouls)   FT 1/2: MISS   FT 2/2: GOOD Allen Quickley makes 1/2 from the line.
Score: 93-81

[00:43] Team_071 possession (Score: 93-81)
FOUL! Shooting foul on Russell Morant. Tyrese Brogdon to the line for 2 free throws. [BONUS: 7 team fouls] (Russell Morant: 1 personal fouls)   FT 1/2: MISS   FT 2/2: MISS Tyrese Brogdon makes 0/2 from the line. Rebound secured by Russell Morant.

[00:32] Team_070 possession (Score: 93-81)
Paul Quickley attempts a Midrange. Contested by Evan Sexton (5.1 feet, MAN). PAUL QUICKLEY MAKES IT! Assist: Russell Morant
Score: 95-81

[00:19] Team_071 possession (Score: 95-81)
Immanuel Ginobili attempts a 3Pt. Contested by D'Angelo McGrady (5.6 feet, MAN). IMMANUEL GINOBILI MAKES IT! Assist: Jordan Durant
Score: 95-84

[00:04] Team_070 possession (Score: 95-84)
Luka Gobert attempts a Midrange. Contested by Tyrese Brogdon (5.8 feet, ZONE). Luka Gobert misses. Rebound secured by Evan Sexton.

================================================================================
                              4TH QUARTER COMPLETE                              
================================================================================

4TH QUARTER SCORE: Team_070 30, Team_071 22

BOX SCORE:
================================================================================

Team_070
--------------------------------------------------------------------------------
Player                MIN  PTS  REB  AST  TO      FG   FG%      3P   3P%
--------------------------------------------------------------------------------
Khris Bryant           38    9    2    0   0   4/5    80.0     0/0   0.0
Russell Morant         10    6    4    1   0   3/3   100.0     0/0   0.0
Luka Gobert            10    5    2    0   0   3/6    50.0     0/0   0.0
Jabari Paul            38    2    4    0   0   1/1   100.0     0/0   0.0
Paul Quickley          10    2    0    0   0   1/2    50.0     0/0   0.0
LeBron Barnes          38    1    2    0   0   1/1   100.0     0/0   0.0
Allen Quickley         10    1    0    0   0   1/1   100.0     0/0   0.0
Cole Gasol             38    0    0    0   0   0/3     0.0     0/0   0.0
D'Angelo McGrady       10    0    2    0   0   0/0     0.0     0/0   0.0

TEAM: FG: 14/23 (60.9%), 3PT: 4/7 (57.1%), REB: 17 (4 off, 13 def), AST: 1, TO: 1
TEAM FOULS: 7 [Team_071 in BONUS]


Team_071
--------------------------------------------------------------------------------
Player                MIN  PTS  REB  AST  TO      FG   FG%      3P   3P%
--------------------------------------------------------------------------------
Immanuel Ginobili      10    6    0    1   0   2/6    33.3     0/0   0.0
Bam Iverson            38    3    2    0   0   1/4    25.0     0/0   0.0
Jimmy Simons           38    3    2    0   0   1/2    50.0     0/0   0.0
Tyrese Brogdon         10    3    0    0   0   1/3    33.3     0/0   0.0
Evan Sexton            10    2    4    1   0   1/1   100.0     0/0   0.0
Jordan Durant          10    2    1    1   0   1/1   100.0     0/0   0.0
Paul Ball              10    2    0    0   0   1/1   100.0     0/0   0.0
Dejounte Paul          38    0    1    1   0   0/2     0.0     0/0   0.0
Victor Anunoby         38    0    0    1   0   0/0     0.0     0/0   0.0

TEAM: FG: 8/21 (38.1%), 3PT: 3/6 (50.0%), REB: 9 (1 off, 8 def), AST: 5, TO: 2
TEAM FOULS: 13 [Team_070 in BONUS]

================================================================================

================================================================================
                               FULL GAME COMPLETE                               
================================================================================

FINAL SCORE: Team_070 95, Team_071 84

SCORING BY QUARTER:
--------------------------------------------------------------------------------
Team                     Q1     Q2     Q3     Q4    FINAL
--------------------------------------------------------------------------------
Team_070                 17     24     24     30       95
Team_071                 25     18     19     22       84
--------------------------------------------------------------------------------

FULL GAME BOX SCORE:
================================================================================

Team_070
--------------------------------------------------------------------------------
Player                MIN  PTS  REB  AST  TO      FG   FG%      3P   3P%      FT STL BLK
--------------------------------------------------------------------------------
Cole Gasol             38   13    0    4   0   7/16   43.8   1/7    14.3   5/8     2   0
LeBron Barnes          38   20   20    1   2   9/14   64.3   2/6    33.3   4/6     2   0
John Hyland            38   17    0    1   0   6/14   42.9   4/9    44.4   7/8     0   0
Khris Bryant           38   11   11    0   2   5/11   45.5   1/2    50.0   4/5     4   4
Jabari Paul            38    9   10    1   5   3/7    42.9   0/1     0.0   3/3     0   0
Paul Quickley          10    2    0    1   0   1/2    50.0   0/1     0.0   0/0     0   1
Allen Quickley         10    4    0    0   2   1/2    50.0   0/0     0.0   2/4     0   0
D'Angelo McGrady       10    1    3    0   0   0/1     0.0   0/0     0.0   1/2     0   0
Luka Gobert            10    5    3    0   0   2/5    40.0   1/2    50.0   5/6     0   0
Russell Morant         10    6    7    1   0   4/4   100.0   1/1   100.0   2/3     0   0

TEAM: FG: 41/80 (51.2%), 3PT: 10/29 (34.5%), REB: 56 (15 off, 41 def), AST: 9, TO: 11


Team_071
--------------------------------------------------------------------------------
Player                MIN  PTS  REB  AST  TO      FG   FG%      3P   3P%      FT STL BLK
--------------------------------------------------------------------------------
Allen Williamson       38   14    0    1   5   6/9    66.7   2/4    50.0   3/4     0   0
Victor Anunoby         38    4    0    2   2   2/8    25.0   1/5    20.0   2/3     1   0
Bam Iverson            38   14   11    6   1   5/13   38.5   3/8    37.5   4/4     0   1
Jimmy Simons           38   19   14    1   2   6/15   40.0   3/7    42.9   1/1     1   0
Dejounte Paul          38   12   13    3   3   6/11   54.5   1/1   100.0   3/3     1   0
Evan Sexton            10    2    5    1   0   1/1   100.0   0/0     0.0   0/0     0   1
Paul Ball              10    2    0    0   0   1/1   100.0   0/0     0.0   0/0     0   0
Immanuel Ginobili      10    6    2    3   0   2/7    28.6   1/4    25.0   1/1     0   0
Jordan Durant          10    5    2    1   0   2/4    50.0   1/2    50.0   3/4     1   0
Tyrese Brogdon         10    5    0    0   0   2/5    40.0   0/0     0.0   1/3     0   0

TEAM: FG: 33/75 (44.0%), 3PT: 12/31 (38.7%), REB: 45 (8 off, 37 def), AST: 18, TO: 13

================================================================================
