================================================================================
                        FULL GAME - Team_079 vs Team_062                        
================================================================================

================================================================================
                       1ST QUARTER - Team_079 vs Team_062                       
================================================================================

[12:00] Team_079 possession (Score: 0-0)
Miles Ming attempts a 3Pt. Contested by RJ Williamson (4.6 feet, ZONE). Miles Ming misses. Rebound secured by Kawhi Thompson.

[11:48] Team_062 possession (Score: 0-0)
Kawhi Thompson makes the Dunk and draws the foul on Trae Durant! And-1! Kawhi Thompson to the line for 1. [Team fouls: 1] (Trae Durant: 1 personal fouls)   FT 1/1: GOOD Kawhi Thompson makes 1/1 from the line.
Score: 0-3

[11:33] Team_079 possession (Score: 0-3)
Donovan Randle attempts a Midrange. Contested by Michael Hyland (4.8 feet, ZONE). Donovan Randle misses. Offensive rebound by Donovan Randle! Donovan Randle kicks it out.

[11:17] Team_079 possession (Score: 0-3)
Donovan Randle drives, picks up Jalen Reaves. Help arrives from Chris Bird! Donovan Randle attempts a Layup. Contested by Chris Bird (5.1 feet, MAN). DONOVAN RANDLE MAKES IT! Assist: Khris Embiid
Score: 2-3

[11:06] Team_062 possession (Score: 2-3)
FOUL! Shooting foul on Miles Ming. Michael Hyland to the line for 2 free throws. [Team fouls: 2] (Miles Ming: 1 personal fouls)   FT 1/2: GOOD   FT 2/2: GOOD Michael Hyland makes 2/2 from the line.
Score: 2-5

[10:55] Team_079 possession (Score: 2-5)
Bam Randle drives, Michael Hyland stays with him. Bam Randle attempts a Dunk. Contested by Michael Hyland (4.5 feet, MAN). BAM RANDLE MAKES IT! Assist: Khris Embiid
Score: 4-5

[10:40] Team_062 possession (Score: 4-5)
Chris Bird attempts a 3Pt. Contested by Trae Durant (3.2 feet, ZONE). Chris Bird misses. Offensive rebound by Kawhi Thompson! Kawhi Thompson kicks it out.

[10:22] Team_062 possession (Score: 4-5)
FOUL! Shooting foul on Trae Durant. Chris Bird to the line for 2 free throws. [Team fouls: 3] (Trae Durant: 2 personal fouls)   FT 1/2: GOOD   FT 2/2: GOOD Chris Bird makes 2/2 from the line.
Score: 4-7

[10:09] Team_079 possession (Score: 4-7)
Khris Embiid attempts a 3Pt. Contested by RJ Williamson (4.6 feet, ZONE). Khris Embiid misses. Rebound secured by Jalen Reaves.

[09:59] Team_062 possession (Score: 4-7)
Chris Bird attempts a Midrange. Contested by Khris Embiid (4.7 feet, ZONE). CHRIS BIRD MAKES IT! Assist: RJ Williamson
Score: 4-9

[09:48] Team_079 possession (Score: 4-9)
Khris Embiid makes the 3Pt and draws the foul on RJ Williamson! And-1! Khris Embiid to the line for 1. [Team fouls: 1] (RJ Williamson: 1 personal fouls)   FT 1/1: GOOD Khris Embiid makes 1/1 from the line.
Score: 8-9

[09:37] Team_062 possession (Score: 8-9)
FOUL! Reach-in foul on Trae Durant during the drive. [Team fouls: 4] No free throws, side out. (Trae Durant: 3 personal fouls)

[09:23] Team_062 possession (Score: 8-9)
Chris Bird attempts a 3Pt. Contested by Trae Durant (3.2 feet, ZONE). Chris Bird misses. FOUL! Loose ball foul on Bam Randle during the rebound battle. [IN THE BONUS! 5 team fouls] Kawhi Thompson to the line for 2 free throws. (Bam Randle: 1 personal fouls)   FT 1/2: GOOD   FT 2/2: MISS Kawhi Thompson makes 1/2 from the line. Rebound secured by Trae Durant.
Score: 8-10

[09:07] Team_079 possession (Score: 8-10)
FOUL! Holding foul on Jalen Reaves. [Team fouls: 2] No free throws, side out. (Jalen Reaves: 1 personal fouls)

[08:52] Team_079 possession (Score: 8-10)
FOUL! Reach-in foul on Jalen Reaves during the drive. [Team fouls: 3] No free throws, side out. (Jalen Reaves: 2 personal fouls)

[08:35] Team_079 possession (Score: 8-10)
Trae Durant attempts a Midrange. Contested by RJ Williamson (4.2 feet, ZONE). TRAE DURANT MAKES IT! Assist: Khris Embiid
Score: 10-10

[08:24] Team_062 possession (Score: 10-10)
Jalen Reaves attempts a Midrange. Contested by Trae Durant (3.3 feet, ZONE). Jalen Reaves misses. Rebound secured by Donovan Randle.

[08:10] Team_079 possession (Score: 10-10)
Bam Randle attempts a 3Pt. Contested by RJ Williamson (4.2 feet, ZONE). Bam Randle misses. Rebound secured by Kawhi Thompson.

[07:56] Team_062 possession (Score: 10-10)
Michael Hyland makes the Midrange and draws the foul on Bam Randle! And-1! Michael Hyland to the line for 1. [BONUS: 6 team fouls] (Bam Randle: 2 personal fouls)   FT 1/1: GOOD Michael Hyland makes 1/1 from the line.
Score: 10-13

[07:41] Team_079 possession (Score: 10-13)
Donovan Randle makes the Layup and draws the foul on Jalen Reaves! And-1! Donovan Randle to the line for 1. [Team fouls: 4] (Jalen Reaves: 3 personal fouls)   FT 1/1: GOOD Donovan Randle makes 1/1 from the line.
Score: 13-13

[07:27] Team_062 possession (Score: 13-13)
Chris Bird attempts a Midrange. Contested by Bam Randle (4.4 feet, ZONE). Chris Bird misses. Rebound secured by Trae Durant.

[07:12] Team_079 possession (Score: 13-13)
FOUL! Holding foul on Kawhi Thompson. [IN THE BONUS! 5 team fouls] Trae Durant to the line for 2 free throws. (Kawhi Thompson: 1 personal fouls)   FT 1/2: GOOD   FT 2/2: GOOD Trae Durant makes 2/2 from the line.
Score: 15-13

[06:57] Team_062 possession (Score: 15-13)
Kawhi Thompson drives to the basket... FOUL! Offensive foul on Kawhi Thompson! Donovan Randle drew the charge! [Team fouls: 6] (Kawhi Thompson: 2 personal fouls) TURNOVER! (dead ball)

[06:42] Team_079 possession (Score: 15-13)
Khris Embiid drives and kicks out. Bam Randle attempts a 3Pt. Contested by RJ Williamson (4.4 feet, ZONE). Bam Randle misses. Rebound secured by Kawhi Thompson.

[06:29] Team_062 possession (Score: 15-13)
Michael Hyland attempts a 3Pt. Contested by Trae Durant (3.0 feet, ZONE). Michael Hyland misses. Rebound secured by Bam Randle.

[06:15] Team_079 possession (Score: 15-13)
Trae Durant loses control! Ball rolls out of bounds! TURNOVER! (dead ball)

[06:04] Team_062 possession (Score: 15-13)
Kawhi Thompson drives, picks up Trae Durant. Help arrives from Miles Ming! Kawhi Thompson attempts a Layup. Contested by Miles Ming (3.1 feet, ZONE). KAWHI THOMPSON MAKES IT!
Score: 15-15

[05:51] Team_079 possession (Score: 15-15)
Miles Ming attempts a Layup. Contested by RJ Williamson (4.6 feet, MAN). MILES MING MAKES IT!
Score: 17-15

[05:40] Team_062 possession (Score: 17-15)
Chris Bird attempts a Midrange. Contested by Miles Ming (4.3 feet, ZONE). Chris Bird misses. Rebound secured by Bam Randle.

[05:22] Team_079 possession (Score: 17-15)
Miles Ming drives, picks up RJ Williamson. Help arrives from Michael Hyland! Miles Ming attempts a Dunk. Contested by Michael Hyland (4.6 feet, MAN). MILES MING MAKES IT! Assist: Donovan Randle
Score: 19-15

[05:08] Team_062 possession (Score: 19-15)
Jalen Reaves attempts a 3Pt. Contested by Donovan Randle (4.5 feet, MAN). JALEN REAVES MAKES IT! Assist: Chris Bird
Score: 19-18

[04:54] Team_079 possession (Score: 19-18)
Trae Durant attempts a 3Pt. Contested by RJ Williamson (4.3 feet, ZONE). Trae Durant misses. Rebound secured by Jalen Reaves.

[04:42] Team_062 possession (Score: 19-18)
Kawhi Thompson drives to the basket... Kawhi Thompson loses the ball! Stripped by Trae Durant! TURNOVER! (live ball)

[04:30] Team_079 possession (Score: 19-18)
Bam Randle drives, Kawhi Thompson stays with him. Bam Randle attempts a Dunk. Contested by Kawhi Thompson (4.8 feet, ZONE). Bam Randle misses. Rebound secured by Kawhi Thompson.

[04:15] Team_062 possession (Score: 19-18)
RJ Williamson attempts a 3Pt. Contested by Trae Durant (2.8 feet, ZONE). RJ Williamson misses. Offensive rebound by Kawhi Thompson! Kawhi Thompson kicks it out.

[04:00] Team_062 possession (Score: 19-18)
Kawhi Thompson attempts a Layup. Contested by Trae Durant (3.1 feet, ZONE). Kawhi Thompson misses. Rebound secured by Bam Randle.

[03:47] Team_079 possession (Score: 19-18)
Trae Durant drives and kicks out. Miles Ming attempts a Midrange. Contested by Michael Hyland (4.8 feet, ZONE). MILES MING MAKES IT! Assist: Donovan Randle
Score: 21-18

[03:30] Team_062 possession (Score: 21-18)
Chris Bird attempts a 3Pt. Contested by Khris Embiid (4.8 feet, MAN). Chris Bird misses. Rebound secured by Donovan Randle.

[03:14] Team_079 possession (Score: 21-18)
FOUL! Reach-in foul on Jalen Reaves during the drive. [IN THE BONUS! 7 team fouls] Donovan Randle to the line for 2 free throws. (Jalen Reaves: 4 personal fouls)   FT 1/2: GOOD   FT 2/2: MISS Donovan Randle makes 1/2 from the line. Rebound secured by Kawhi Thompson.
Score: 22-18

[03:01] Team_062 possession (Score: 22-18)
Kawhi Thompson attempts a 3Pt. Contested by Trae Durant (3.2 feet, MAN). Kawhi Thompson misses. Offensive rebound by Kawhi Thompson! Kawhi Thompson kicks it out.

[02:46] Team_062 possession (Score: 22-18)
RJ Williamson attempts a 3Pt. Contested by Trae Durant (3.0 feet, ZONE). RJ Williamson misses. Offensive rebound by Kawhi Thompson! Kawhi Thompson kicks it out.

[02:34] Team_062 possession (Score: 22-18)
Chris Bird drives, picks up Khris Embiid. Help arrives from Miles Ming! Chris Bird attempts a Layup. Contested by Miles Ming (4.9 feet, MAN). CHRIS BIRD MAKES IT!
Score: 22-20

[02:23] Team_079 possession (Score: 22-20)
Donovan Randle attempts a Layup. Contested by Jalen Reaves (5.4 feet, ZONE). Donovan Randle misses. Rebound secured by Michael Hyland.

[02:05] Team_062 possession (Score: 22-20)
Chris Bird drives, picks up Trae Durant. Help arrives from Miles Ming! Chris Bird attempts a Dunk. Contested by Miles Ming (3.5 feet, ZONE). Chris Bird misses. Rebound secured by Donovan Randle.

[01:50] Team_079 possession (Score: 22-20)
Trae Durant attempts a Midrange. Contested by Kawhi Thompson (5.0 feet, MAN). TRAE DURANT MAKES IT! Assist: Donovan Randle
Score: 24-20

[01:36] Team_062 possession (Score: 24-20)
Michael Hyland attempts a 3Pt. Contested by Bam Randle (4.5 feet, MAN). Michael Hyland misses. Rebound secured by Bam Randle.

[01:24] Team_079 possession (Score: 24-20)
Khris Embiid drives, picks up Jalen Reaves. Help arrives from Chris Bird! Khris Embiid attempts a Layup. Contested by Chris Bird (5.6 feet, ZONE). Khris Embiid misses. Rebound secured by Kawhi Thompson.

[01:10] Team_062 possession (Score: 24-20)
Michael Hyland attempts a Layup. Contested by Trae Durant (3.4 feet, ZONE). MICHAEL HYLAND MAKES IT! Assist: RJ Williamson
Score: 24-22

[00:56] Team_079 possession (Score: 24-22)
Miles Ming attempts a Midrange. Contested by Kawhi Thompson (5.5 feet, ZONE). MILES MING MAKES IT!
Score: 26-22

[00:41] Team_062 possession (Score: 26-22)
RJ Williamson attempts a Midrange. Contested by Trae Durant (3.2 feet, ZONE). RJ Williamson misses. Rebound secured by Donovan Randle.

[00:28] Team_079 possession (Score: 26-22)
Miles Ming attempts a 3Pt. Contested by Michael Hyland (5.3 feet, ZONE). Miles Ming misses. Rebound secured by Jalen Reaves.

[00:11] Team_062 possession (Score: 26-22)
Chris Bird attempts a Midrange. Contested by Khris Embiid (5.1 feet, MAN). CHRIS BIRD MAKES IT! Assist: Kawhi Thompson
Score: 26-24

================================================================================
                              1ST QUARTER COMPLETE                              
================================================================================

1ST QUARTER SCORE: Team_079 26, Team_062 24

BOX SCORE:
================================================================================

Team_079
--------------------------------------------------------------------------------
Player                MIN  PTS  REB  AST  TO      FG   FG%      3P   3P%
--------------------------------------------------------------------------------
Miles Ming             12    8    0    0   0   4/6    66.7     0/0   0.0
Trae Durant            12    6    2    0   0   3/4    75.0     0/0   0.0
Donovan Randle         12    5    5    3   0   2/4    50.0     0/0   0.0
Khris Embiid           12    4    0    3   0   1/4    25.0     0/0   0.0
Bam Randle             12    2    4    0   0   1/3    33.3     0/0   0.0

TEAM: FG: 11/21 (52.4%), 3PT: 1/6 (16.7%), REB: 10 (1 off, 9 def), AST: 6, TO: 1
TEAM FOULS: 6 [Team_062 in BONUS]


Team_062
--------------------------------------------------------------------------------
Player                MIN  PTS  REB  AST  TO      FG   FG%      3P   3P%
--------------------------------------------------------------------------------
Chris Bird             12    8    0    1   0   4/9    44.4     0/0   0.0
Michael Hyland         12    7    1    0   0   3/5    60.0     0/0   0.0
Kawhi Thompson         12    5   10    1   0   2/3    66.7     0/0   0.0
Jalen Reaves           12    3    3    0   0   1/2    50.0     0/0   0.0
RJ Williamson          12    0    0    2   0   0/1     0.0     0/0   0.0

TEAM: FG: 10/20 (50.0%), 3PT: 1/5 (20.0%), REB: 15 (5 off, 10 def), AST: 4, TO: 2
TEAM FOULS: 7 [Team_079 in BONUS]

================================================================================

================================================================================
                       2ND QUARTER - Team_079 vs Team_062                       
================================================================================

[12:00] Team_079 possession (Score: 26-24)
Donovan Randle drives and kicks out. Trae Durant attempts a Midrange. Contested by Jalen Reaves (5.3 feet, ZONE). TRAE DURANT MAKES IT! Assist: Bam Randle
Score: 28-24

[11:46] Team_062 possession (Score: 28-24)
RJ Williamson attempts a Layup. Contested by Trae Durant (3.0 feet, ZONE). RJ Williamson misses. Rebound secured by Trae Durant.

[11:30] Team_079 possession (Score: 28-24)
Trae Durant drives and kicks out. Donovan Randle attempts a 3Pt. Contested by Jalen Reaves (5.4 feet, MAN). Donovan Randle misses. Rebound secured by Michael Hyland.

[11:10] Team_062 possession (Score: 28-24)
Chris Bird drives and kicks out. Chris Bird attempts a Midrange. Contested by Khris Embiid (4.9 feet, MAN). CHRIS BIRD MAKES IT!
Score: 28-26

[11:01] Team_079 possession (Score: 28-26)
Bam Randle makes the Layup and draws the foul on Jalen Reaves! And-1! Bam Randle to the line for 1. [Team fouls: 1] (Jalen Reaves: 1 personal fouls)   FT 1/1: GOOD Bam Randle makes 1/1 from the line.
Score: 31-26

[10:48] Team_062 possession (Score: 31-26)
Chris Bird makes the Dunk and draws the foul on Trae Durant! And-1! Chris Bird to the line for 1. [Team fouls: 1] (Trae Durant: 1 personal fouls)   FT 1/1: GOOD Chris Bird makes 1/1 from the line.
Score: 31-29

[10:38] Team_079 possession (Score: 31-29)
Trae Durant attempts a 3Pt. Contested by Kawhi Thompson (5.1 feet, ZONE). Trae Durant misses. Rebound secured by Kawhi Thompson.

[10:27] Team_062 possession (Score: 31-29)
Jalen Reaves attempts a Layup. Contested by Donovan Randle (5.0 feet, MAN). Jalen Reaves misses. Offensive rebound by Jalen Reaves! Jalen Reaves kicks it out.

[10:12] Team_062 possession (Score: 31-29)
Kawhi Thompson attempts a Midrange. Contested by Trae Durant (3.5 feet, MAN). Kawhi Thompson misses. Rebound secured by Bam Randle.

[09:58] Team_079 possession (Score: 31-29)
Khris Embiid attempts a 3Pt. Contested by RJ Williamson (5.2 feet, ZONE). Khris Embiid misses. Rebound secured by Jalen Reaves.

[09:47] Team_062 possession (Score: 31-29)
Chris Bird loses the ball! Stripped by Khris Embiid! TURNOVER! (live ball)

[09:30] Team_079 possession (Score: 31-29)
Trae Durant attempts a Midrange. Contested by Chris Bird (4.7 feet, ZONE). Trae Durant misses. Rebound secured by Michael Hyland.

[09:15] Team_062 possession (Score: 31-29)
Jalen Reaves attempts a Layup. BLOCKED BY TRAE DURANT! Ball deflects out of bounds off Jalen Reaves.

[09:02] Team_079 possession (Score: 31-29)
Khris Embiid attempts a 3Pt. Contested by RJ Williamson (5.3 feet, ZONE). Khris Embiid misses. Rebound secured by Jalen Reaves.

[08:47] Team_062 possession (Score: 31-29)
FOUL! Reach-in foul on Donovan Randle during the drive. [Team fouls: 2] No free throws, side out. (Donovan Randle: 1 personal fouls)

[08:34] Team_062 possession (Score: 31-29)
Chris Bird makes the Midrange and draws the foul on Khris Embiid! And-1! Chris Bird to the line for 1. [Team fouls: 3] (Khris Embiid: 1 personal fouls)   FT 1/1: GOOD Chris Bird makes 1/1 from the line.
Score: 31-32

[08:21] Team_079 possession (Score: 31-32)
Trae Durant attempts a 3Pt. Contested by Kawhi Thompson (5.4 feet, MAN). Trae Durant misses. FOUL! Loose ball foul on Jalen Reaves during the rebound battle. [Team fouls: 2] No free throws, side out. (Jalen Reaves: 2 personal fouls)

[08:09] Team_079 possession (Score: 31-32)
Bam Randle drives to the basket... Bam Randle throws a bad pass! Stolen by Jalen Reaves! TURNOVER! (live ball)

[07:56] Team_062 possession (Score: 31-32)
Michael Hyland makes the Midrange and draws the foul on Miles Ming! And-1! Michael Hyland to the line for 1. [Team fouls: 4] (Miles Ming: 1 personal fouls)   FT 1/1: GOOD Michael Hyland makes 1/1 from the line.
Score: 31-35

[07:42] Team_079 possession (Score: 31-35)
Khris Embiid attempts a 3Pt. Contested by Chris Bird (5.3 feet, MAN). Khris Embiid misses. Offensive rebound by Trae Durant! Trae Durant kicks it out.

[07:33] Team_079 possession (Score: 31-35)
Miles Ming attempts a Midrange. Contested by RJ Williamson (5.4 feet, MAN). Miles Ming misses. Rebound secured by Jalen Reaves.

[07:19] Team_062 possession (Score: 31-35)
Jalen Reaves loses the ball! Stripped by Donovan Randle! TURNOVER! (live ball)

[07:06] Team_079 possession (Score: 31-35)
Donovan Randle throws a bad pass out of bounds! TURNOVER! (dead ball)

[07:06] Substitution (Team_079): Khris Embiid OUT → Evan Mobley IN (stamina_rule2)

[07:06] Substitution (Team_079): Miles Ming OUT → Karl Ingram IN (stamina_rule2)

[07:06] Substitution (Team_079): Bam Randle OUT → Anthony Wade IN (stamina_rule2)

[07:06] Substitution (Team_079): Trae Durant OUT → Kobe Curry IN (stamina_rule2)

[07:06] Substitution (Team_079): Donovan Randle OUT → James LaVine IN (stamina_rule2)

[07:06] Substitution (Team_062): Chris Bird OUT → Paolo McCollum IN (stamina_rule2)

[07:06] Substitution (Team_062): RJ Williamson OUT → Tony LaVine IN (stamina_rule2)

[07:06] Substitution (Team_062): Michael Hyland OUT → Paul Poole IN (stamina_rule2)

[07:06] Substitution (Team_062): Kawhi Thompson OUT → RJ Wall IN (stamina_rule2)

[07:06] Substitution (Team_062): Jalen Reaves OUT → Devin Young IN (stamina_rule2)

[06:53] Team_062 possession (Score: 31-35)
Devin Young drives, James LaVine stays with him. Devin Young attempts a Layup. Contested by James LaVine (4.6 feet, MAN). DEVIN YOUNG MAKES IT! Assist: Tony LaVine
Score: 31-37

[06:39] Team_079 possession (Score: 31-37)
James LaVine attempts a Layup. Wide open! Devin Young is 6.1 feet away. [MAN] JAMES LAVINE MAKES IT!
Score: 33-37

[06:25] Team_062 possession (Score: 33-37)
Paolo McCollum attempts a 3Pt. Contested by Evan Mobley (4.7 feet, MAN). Paolo McCollum misses. Rebound secured by James LaVine.

[06:13] Team_079 possession (Score: 33-37)
Kobe Curry attempts a Midrange. Contested by RJ Wall (5.3 feet, MAN). Kobe Curry misses. Rebound secured by RJ Wall.

[06:00] Team_062 possession (Score: 33-37)
FOUL! Shooting foul on James LaVine. Devin Young to the line for 2 free throws. [BONUS: 5 team fouls] (James LaVine: 1 personal fouls)   FT 1/2: MISS   FT 2/2: GOOD Devin Young makes 1/2 from the line.
Score: 33-38

[05:44] Team_079 possession (Score: 33-38)
Anthony Wade attempts a Layup. Wide open! Paul Poole is 6.4 feet away. [MAN] ANTHONY WADE MAKES IT!
Score: 35-38

[05:30] Team_062 possession (Score: 35-38)
Paul Poole attempts a Midrange. Contested by Kobe Curry (4.6 feet, ZONE). Paul Poole misses. FOUL! Loose ball foul on Kobe Curry during the rebound battle. [IN THE BONUS! 6 team fouls] Devin Young to the line for 2 free throws. (Kobe Curry: 1 personal fouls)   FT 1/2: GOOD   FT 2/2: GOOD Devin Young makes 2/2 from the line.
Score: 35-40

[05:19] Team_079 possession (Score: 35-40)
Karl Ingram attempts a Layup. Contested by RJ Wall (5.3 feet, ZONE). Karl Ingram misses. Rebound secured by Paul Poole.

[05:06] Team_062 possession (Score: 35-40)
RJ Wall makes the Layup and draws the foul on Kobe Curry! And-1! RJ Wall to the line for 1. [BONUS: 7 team fouls] (Kobe Curry: 2 personal fouls)   FT 1/1: MISS RJ Wall makes 0/1 from the line. Rebound secured by Kobe Curry.
Score: 35-42

[04:56] Team_079 possession (Score: 35-42)
Karl Ingram attempts a Layup. Contested by Tony LaVine (6.0 feet, MAN). KARL INGRAM MAKES IT!
Score: 37-42

[04:37] Team_062 possession (Score: 37-42)
Paolo McCollum loses control! Ball rolls out of bounds! TURNOVER! (dead ball)

[04:22] Team_079 possession (Score: 37-42)
James LaVine attempts a Midrange. Wide open! Paul Poole is 6.4 feet away. [ZONE] James LaVine misses. Offensive rebound by Kobe Curry! Kobe Curry kicks it out.

[04:05] Team_079 possession (Score: 37-42)
Anthony Wade makes the Layup and draws the foul on RJ Wall! And-1! Anthony Wade to the line for 1. [Team fouls: 3] (RJ Wall: 1 personal fouls)   FT 1/1: GOOD Anthony Wade makes 1/1 from the line.
Score: 40-42

[03:50] Team_062 possession (Score: 40-42)
RJ Wall makes the Midrange and draws the foul on Kobe Curry! And-1! RJ Wall to the line for 1. [BONUS: 8 team fouls] (Kobe Curry: 3 personal fouls)   FT 1/1: GOOD RJ Wall makes 1/1 from the line.
Score: 40-45

[03:37] Team_079 possession (Score: 40-45)
Anthony Wade drives, RJ Wall stays with him. Anthony Wade attempts a Dunk. Contested by RJ Wall (5.3 feet, ZONE). ANTHONY WADE MAKES IT!
Score: 42-45

[03:22] Team_062 possession (Score: 42-45)
FOUL! Shooting foul on James LaVine. RJ Wall to the line for 2 free throws. [BONUS: 9 team fouls] (James LaVine: 2 personal fouls)   FT 1/2: GOOD   FT 2/2: GOOD RJ Wall makes 2/2 from the line.
Score: 42-47

[03:07] Team_079 possession (Score: 42-47)
Evan Mobley drives to the basket... Evan Mobley throws a bad pass out of bounds! TURNOVER! (dead ball)

[02:54] Team_062 possession (Score: 42-47)
Paolo McCollum attempts a 3Pt. Contested by Evan Mobley (4.7 feet, ZONE). Paolo McCollum misses. Rebound secured by James LaVine.

[02:39] Team_079 possession (Score: 42-47)
Anthony Wade attempts a Midrange. Wide open! Paul Poole is 6.4 feet away. [ZONE] Anthony Wade misses. FOUL! Loose ball foul on Paul Poole during the rebound battle. [Team fouls: 4] No free throws, side out. (Paul Poole: 1 personal fouls)

[02:19] Team_079 possession (Score: 42-47)
Karl Ingram attempts a 3Pt. Contested by Tony LaVine (6.0 feet, MAN). Karl Ingram misses. Offensive rebound by James LaVine! James LaVine's putback is no good. Rebound secured by RJ Wall.

[02:07] Team_062 possession (Score: 42-47)
FOUL! Shooting foul on Evan Mobley. Paolo McCollum to the line for 2 free throws. [BONUS: 10 team fouls] (Evan Mobley: 1 personal fouls)   FT 1/2: GOOD   FT 2/2: GOOD Paolo McCollum makes 2/2 from the line.
Score: 42-49

[01:52] Team_079 possession (Score: 42-49)
Anthony Wade attempts a Layup. Wide open! Paul Poole is 6.4 feet away. [MAN] ANTHONY WADE MAKES IT! Assist: James LaVine
Score: 44-49

[01:41] Team_062 possession (Score: 44-49)
Tony LaVine attempts a Layup. Contested by Kobe Curry (4.9 feet, ZONE). Tony LaVine misses. Offensive rebound by Devin Young! Devin Young kicks it out.

[01:27] Team_062 possession (Score: 44-49)
RJ Wall makes the Midrange and draws the foul on Kobe Curry! And-1! RJ Wall to the line for 1. [BONUS: 11 team fouls] (Kobe Curry: 4 personal fouls)   FT 1/1: GOOD RJ Wall makes 1/1 from the line.
Score: 44-52

[01:13] Team_079 possession (Score: 44-52)
Kobe Curry attempts a 3Pt. Contested by RJ Wall (5.3 feet, MAN). Kobe Curry misses. Rebound secured by RJ Wall.

[01:01] Team_062 possession (Score: 44-52)
Devin Young attempts a Midrange. Contested by James LaVine (4.6 feet, MAN). Devin Young misses. Rebound secured by James LaVine.

[00:46] Team_079 possession (Score: 44-52)
Karl Ingram drives, RJ Wall stays with him. Karl Ingram attempts a Layup. Contested by RJ Wall (5.3 feet, ZONE). KARL INGRAM MAKES IT! Assist: Evan Mobley
Score: 46-52

[00:33] Team_062 possession (Score: 46-52)
RJ Wall drives to the basket... RJ Wall throws a bad pass! Stolen by Kobe Curry! TURNOVER! (live ball)

[00:21] Team_079 possession (Score: 46-52)
Kobe Curry attempts a Midrange. Contested by RJ Wall (5.3 feet, MAN). KOBE CURRY MAKES IT! Assist: Anthony Wade
Score: 48-52

[00:06] Team_062 possession (Score: 48-52)
RJ Wall drives to the basket... RJ Wall throws a bad pass! Stolen by James LaVine! TURNOVER! (live ball)

================================================================================
                              2ND QUARTER COMPLETE                              
================================================================================

2ND QUARTER SCORE: Team_079 22, Team_062 28

BOX SCORE:
================================================================================

Team_079
--------------------------------------------------------------------------------
Player                MIN  PTS  REB  AST  TO      FG   FG%      3P   3P%
--------------------------------------------------------------------------------
Anthony Wade            7    9    0    1   0   4/4   100.0     0/0   0.0
Karl Ingram             7    4    0    0   0   2/4    50.0     0/0   0.0
Bam Randle             17    3    1    1   0   1/1   100.0     0/0   0.0
Trae Durant            17    2    3    0   0   1/4    25.0     0/0   0.0
James LaVine            7    2    3    1   0   1/1   100.0     0/0   0.0
Kobe Curry              7    2    3    0   0   1/3    33.3     0/0   0.0
Khris Embiid           17    0    0    0   0   0/2     0.0     0/0   0.0
Miles Ming             17    0    0    0   0   0/1     0.0     0/0   0.0
Evan Mobley             7    0    0    1   0   0/0     0.0     0/0   0.0

TEAM: FG: 10/20 (50.0%), 3PT: 0/5 (0.0%), REB: 11 (5 off, 6 def), AST: 4, TO: 3
TEAM FOULS: 11 [Team_062 in BONUS]


Team_062
--------------------------------------------------------------------------------
Player                MIN  PTS  REB  AST  TO      FG   FG%      3P   3P%
--------------------------------------------------------------------------------
Chris Bird             17    8    0    0   0   3/3   100.0     0/0   0.0
RJ Wall                 7    8    3    0   0   3/4    75.0     0/0   0.0
Devin Young             7    5    1    0   0   3/4    75.0     0/0   0.0
Michael Hyland         17    3    2    0   0   1/1   100.0     0/0   0.0
Paolo McCollum          7    2    0    0   0   1/3    33.3     0/0   0.0
RJ Williamson          17    0    0    0   0   0/1     0.0     0/0   0.0
Kawhi Thompson         17    0    1    0   0   0/1     0.0     0/0   0.0
Jalen Reaves           17    0    4    0   0   0/1     0.0     0/0   0.0
Tony LaVine             7    0    0    1   0   0/0     0.0     0/0   0.0
Paul Poole              7    0    1    0   0   0/0     0.0     0/0   0.0

TEAM: FG: 11/18 (61.1%), 3PT: 0/2 (0.0%), REB: 11 (2 off, 9 def), AST: 1, TO: 5
TEAM FOULS: 4

================================================================================

================================================================================
                       3RD QUARTER - Team_079 vs Team_062                       
================================================================================

[12:00] Team_079 possession (Score: 48-52)
Trae Durant drives to the basket... FOUL! Offensive foul on Trae Durant! Kawhi Thompson drew the charge! [Team fouls: 1] (Trae Durant: 1 personal fouls) TURNOVER! (dead ball)

[11:43] Team_062 possession (Score: 48-52)
Chris Bird drives to the basket... Chris Bird loses the ball! Stripped by Khris Embiid! TURNOVER! (live ball)

[11:31] Team_079 possession (Score: 48-52)
Trae Durant attempts a 3Pt. Contested by RJ Williamson (4.2 feet, ZONE). Trae Durant misses. Rebound secured by Jalen Reaves.

[11:13] Team_062 possession (Score: 48-52)
Michael Hyland attempts a Midrange. Contested by Bam Randle (4.1 feet, MAN). MICHAEL HYLAND MAKES IT! Assist: Chris Bird
Score: 48-54

[11:01] Team_079 possession (Score: 48-54)
Miles Ming drives to the basket... Miles Ming loses control! Ball rolls out of bounds! TURNOVER! (dead ball)

[10:47] Team_062 possession (Score: 48-54)
Chris Bird drives and kicks out. Chris Bird attempts a 3Pt. BLOCKED BY KHRIS EMBIID! Ball is loose! Rebound secured by Donovan Randle.

[10:32] Team_079 possession (Score: 48-54)
FOUL! Shooting foul on Jalen Reaves. Donovan Randle to the line for 2 free throws. [Team fouls: 1] (Jalen Reaves: 1 personal fouls)   FT 1/2: GOOD   FT 2/2: MISS Donovan Randle makes 1/2 from the line. Rebound secured by Michael Hyland.
Score: 49-54

[10:18] Team_062 possession (Score: 49-54)
RJ Williamson attempts a 3Pt. Contested by Trae Durant (2.8 feet, ZONE). RJ Williamson misses. Rebound secured by Donovan Randle.

[10:02] Team_079 possession (Score: 49-54)
Miles Ming attempts a Midrange. Contested by Michael Hyland (4.8 feet, ZONE). Miles Ming misses. Rebound secured by Kawhi Thompson.

[09:49] Team_062 possession (Score: 49-54)
Chris Bird attempts a Midrange. Contested by Khris Embiid (4.7 feet, MAN). Chris Bird misses. Rebound secured by Bam Randle.

[09:32] Team_079 possession (Score: 49-54)
Bam Randle attempts a 3Pt. Contested by RJ Williamson (4.2 feet, ZONE). BAM RANDLE MAKES IT!
Score: 52-54

[09:18] Team_062 possession (Score: 52-54)
Jalen Reaves drives, picks up Donovan Randle. Help arrives from Miles Ming! Jalen Reaves attempts a Layup. Contested by Miles Ming (4.4 feet, MAN). Jalen Reaves misses. Rebound secured by Trae Durant.

[09:00] Team_079 possession (Score: 52-54)
Bam Randle attempts a 3Pt. Contested by RJ Williamson (4.2 feet, ZONE). Bam Randle misses. Rebound secured by Kawhi Thompson.

[08:47] Team_062 possession (Score: 52-54)
Michael Hyland attempts a Layup. Contested by Bam Randle (4.1 feet, MAN). MICHAEL HYLAND MAKES IT! Assist: Kawhi Thompson
Score: 52-56

[08:32] Team_079 possession (Score: 52-56)
Miles Ming attempts a 3Pt. Contested by RJ Williamson (4.6 feet, MAN). Miles Ming misses. Rebound secured by Kawhi Thompson.

[08:16] Team_062 possession (Score: 52-56)
RJ Williamson attempts a Layup. BLOCKED BY MILES MING! Ball goes out off Miles Ming. RJ Williamson's ball!

[08:01] Team_062 possession (Score: 52-56)
Chris Bird drives and kicks out. Jalen Reaves attempts a 3Pt. Contested by Trae Durant (3.0 feet, ZONE). Jalen Reaves misses. Rebound secured by Donovan Randle.

[07:48] Team_079 possession (Score: 52-56)
FOUL! Shooting foul on RJ Williamson. Miles Ming to the line for 2 free throws. [Team fouls: 2] (RJ Williamson: 1 personal fouls)   FT 1/2: GOOD   FT 2/2: GOOD Miles Ming makes 2/2 from the line.
Score: 54-56

[07:34] Team_062 possession (Score: 54-56)
FOUL! Holding foul on Miles Ming. [Team fouls: 2] No free throws, side out. (Miles Ming: 1 personal fouls)

[07:19] Team_062 possession (Score: 54-56)
Michael Hyland attempts a 3Pt. Contested by Bam Randle (4.1 feet, MAN). MICHAEL HYLAND MAKES IT! Assist: Chris Bird
Score: 54-59

[07:03] Team_079 possession (Score: 54-59)
Trae Durant attempts a Midrange. Contested by RJ Williamson (4.2 feet, ZONE). Trae Durant misses. Offensive rebound by Trae Durant! Trae Durant puts it back in!
Score: 56-59

[06:43] Team_062 possession (Score: 56-59)
RJ Williamson throws a bad pass! Stolen by Miles Ming! TURNOVER! (live ball)

[06:27] Team_079 possession (Score: 56-59)
Miles Ming attempts a Midrange. Contested by RJ Williamson (4.6 feet, MAN). MILES MING MAKES IT!
Score: 58-59

[06:08] Team_062 possession (Score: 58-59)
RJ Williamson attempts a Midrange. Contested by Khris Embiid (4.2 feet, ZONE). RJ Williamson misses. Offensive rebound by Kawhi Thompson! Kawhi Thompson kicks it out.

[05:54] Team_062 possession (Score: 58-59)
Kawhi Thompson makes the Layup and draws the foul on Trae Durant! And-1! Kawhi Thompson to the line for 1. [Team fouls: 3] (Trae Durant: 2 personal fouls)   FT 1/1: GOOD Kawhi Thompson makes 1/1 from the line.
Score: 58-62

[05:43] Team_079 possession (Score: 58-62)
Bam Randle drives, Michael Hyland stays with him. Bam Randle attempts a Layup. Contested by Michael Hyland (4.5 feet, MAN). BAM RANDLE MAKES IT! Assist: Miles Ming
Score: 60-62

[05:26] Team_062 possession (Score: 60-62)
Chris Bird drives and kicks out. Jalen Reaves attempts a 3Pt. Contested by Trae Durant (3.0 feet, ZONE). Jalen Reaves misses. Rebound secured by Donovan Randle.

[05:14] Team_079 possession (Score: 60-62)
Donovan Randle attempts a Layup. Contested by Jalen Reaves (5.1 feet, ZONE). Donovan Randle misses. Offensive rebound by Donovan Randle! Donovan Randle kicks it out.

[04:58] Team_079 possession (Score: 60-62)
Trae Durant attempts a 3Pt. Contested by Kawhi Thompson (4.7 feet, MAN). Trae Durant misses. Rebound secured by Kawhi Thompson.

[04:42] Team_062 possession (Score: 60-62)
Chris Bird attempts a 3Pt. Contested by Trae Durant (3.2 feet, ZONE). Chris Bird misses. Offensive rebound by Kawhi Thompson! Kawhi Thompson kicks it out.

[04:27] Team_062 possession (Score: 60-62)
Michael Hyland attempts a 3Pt. Contested by Bam Randle (4.2 feet, MAN). MICHAEL HYLAND MAKES IT! Assist: Kawhi Thompson
Score: 60-65

[04:10] Team_079 possession (Score: 60-65)
Bam Randle drives to the basket... Bam Randle commits a violation (traveling/carry)! TURNOVER! (dead ball)

[03:58] Team_062 possession (Score: 60-65)
RJ Williamson attempts a 3Pt. Contested by Trae Durant (2.8 feet, ZONE). RJ WILLIAMSON MAKES IT! Assist: Chris Bird
Score: 60-68

[03:43] Team_079 possession (Score: 60-68)
FOUL! Shooting foul on Michael Hyland. Bam Randle to the line for 3 free throws. [Team fouls: 3] (Michael Hyland: 1 personal fouls)   FT 1/3: GOOD   FT 2/3: MISS   FT 3/3: MISS Bam Randle makes 1/3 from the line. Offensive rebound by Donovan Randle! Donovan Randle kicks it out.
Score: 61-68

[03:31] Team_079 possession (Score: 61-68)
Trae Durant drives, Jalen Reaves stays with him. Trae Durant attempts a Dunk. Contested by Jalen Reaves (4.9 feet, ZONE). TRAE DURANT MAKES IT! Assist: Bam Randle
Score: 63-68

[03:16] Team_062 possession (Score: 63-68)
Michael Hyland attempts a 3Pt. Contested by Bam Randle (4.3 feet, MAN). MICHAEL HYLAND MAKES IT! Assist: Chris Bird
Score: 63-71

[03:03] Team_079 possession (Score: 63-71)
Miles Ming loses the ball! Stripped by RJ Williamson! TURNOVER! (live ball)

[02:48] Team_062 possession (Score: 63-71)
Chris Bird attempts a Midrange. Contested by Khris Embiid (4.8 feet, MAN). CHRIS BIRD MAKES IT! Assist: Jalen Reaves
Score: 63-73

[02:37] Team_079 possession (Score: 63-73)
Trae Durant attempts a 3Pt. Contested by RJ Williamson (4.4 feet, ZONE). TRAE DURANT MAKES IT!
Score: 66-73

[02:22] Team_062 possession (Score: 66-73)
Jalen Reaves makes the Midrange and draws the foul on Donovan Randle! And-1! Jalen Reaves to the line for 1. [Team fouls: 4] (Donovan Randle: 1 personal fouls)   FT 1/1: GOOD Jalen Reaves makes 1/1 from the line.
Score: 66-76

[02:07] Team_079 possession (Score: 66-76)
Khris Embiid drives, Jalen Reaves stays with him. Khris Embiid attempts a Dunk. Contested by Jalen Reaves (5.5 feet, ZONE). Khris Embiid misses. Rebound secured by Kawhi Thompson.

[01:52] Team_062 possession (Score: 66-76)
Michael Hyland attempts a 3Pt. Contested by Trae Durant (3.2 feet, ZONE). Michael Hyland misses. Rebound secured by Trae Durant.

[01:33] Team_079 possession (Score: 66-76)
Khris Embiid attempts a Midrange. Contested by Chris Bird (4.7 feet, MAN). KHRIS EMBIID MAKES IT! Assist: Donovan Randle
Score: 68-76

[01:19] Team_062 possession (Score: 68-76)
Michael Hyland drives to the basket... Michael Hyland loses control! Ball rolls out of bounds! TURNOVER! (dead ball)

[01:19] Substitution (Team_079): Khris Embiid OUT → Evan Mobley IN (stamina_rule2)

[01:19] Substitution (Team_079): Miles Ming OUT → Karl Ingram IN (stamina_rule2)

[01:19] Substitution (Team_079): Bam Randle OUT → Anthony Wade IN (stamina_rule2)

[01:19] Substitution (Team_079): Trae Durant OUT → Kobe Curry IN (stamina_rule2)

[01:19] Substitution (Team_079): Donovan Randle OUT → James LaVine IN (stamina_rule2)

[01:19] Substitution (Team_062): Chris Bird OUT → Paolo McCollum IN (stamina_rule2)

[01:19] Substitution (Team_062): RJ Williamson OUT → Tony LaVine IN (stamina_rule2)

[01:19] Substitution (Team_062): Michael Hyland OUT → Paul Poole IN (stamina_rule2)

[01:19] Substitution (Team_062): Kawhi Thompson OUT → RJ Wall IN (stamina_rule2)

[01:19] Substitution (Team_062): Jalen Reaves OUT → Devin Young IN (stamina_rule2)

[01:05] Team_079 possession (Score: 68-76)
Kobe Curry attempts a 3Pt. Contested by Paolo McCollum (5.7 feet, ZONE). KOBE CURRY MAKES IT!
Score: 71-76

[00:51] Team_062 possession (Score: 71-76)
RJ Wall attempts a Midrange. Contested by Karl Ingram (5.2 feet, ZONE). RJ WALL MAKES IT!
Score: 71-78

[00:36] Team_079 possession (Score: 71-78)
Karl Ingram loses the ball! Stripped by Tony LaVine! TURNOVER! (live ball)

[00:25] Team_062 possession (Score: 71-78)
Paolo McCollum attempts a Layup. Contested by Evan Mobley (4.7 feet, MAN). Paolo McCollum misses. Offensive rebound by Devin Young! Devin Young kicks it out.

[00:10] Team_062 possession (Score: 71-78)
Paolo McCollum attempts a Layup. Contested by Evan Mobley (4.7 feet, MAN). PAOLO MCCOLLUM MAKES IT!
Score: 71-80

================================================================================
                              3RD QUARTER COMPLETE                              
================================================================================

3RD QUARTER SCORE: Team_079 23, Team_062 28

BOX SCORE:
================================================================================

Team_079
--------------------------------------------------------------------------------
Player                MIN  PTS  REB  AST  TO      FG   FG%      3P   3P%
--------------------------------------------------------------------------------
Trae Durant            28    7    3    0   0   3/5    60.0     0/0   0.0
Bam Randle             28    5    1    1   0   2/3    66.7     0/0   0.0
Miles Ming             28    4    0    1   0   2/4    50.0     0/0   0.0
Kobe Curry              8    3    0    0   0   1/1   100.0     0/0   0.0
Khris Embiid           28    2    0    0   0   1/2    50.0     0/0   0.0
Donovan Randle         28    0    6    1   0   0/1     0.0     0/0   0.0

TEAM: FG: 9/16 (56.2%), 3PT: 3/7 (42.9%), REB: 10 (3 off, 7 def), AST: 3, TO: 5
TEAM FOULS: 4


Team_062
--------------------------------------------------------------------------------
Player                MIN  PTS  REB  AST  TO      FG   FG%      3P   3P%
--------------------------------------------------------------------------------
Michael Hyland         28   13    1    0   0   5/6    83.3     0/0   0.0
Jalen Reaves           28    3    1    1   0   1/2    50.0     0/0   0.0
RJ Williamson          28    3    0    0   0   1/2    50.0     0/0   0.0
Kawhi Thompson         28    3    7    2   0   1/1   100.0     0/0   0.0
Chris Bird             28    2    0    4   0   1/5    20.0     0/0   0.0
RJ Wall                 8    2    0    0   0   1/1   100.0     0/0   0.0
Paolo McCollum          8    2    0    0   0   1/1   100.0     0/0   0.0
Devin Young             8    0    1    0   0   0/0     0.0     0/0   0.0

TEAM: FG: 11/18 (61.1%), 3PT: 4/6 (66.7%), REB: 10 (3 off, 7 def), AST: 7, TO: 3
TEAM FOULS: 3

================================================================================

================================================================================
                       4TH QUARTER - Team_079 vs Team_062                       
================================================================================

[12:00] Team_079 possession (Score: 71-80)
Khris Embiid attempts a 3Pt. Contested by Chris Bird (4.5 feet, MAN). KHRIS EMBIID MAKES IT! Assist: Miles Ming
Score: 74-80

[11:47] Team_062 possession (Score: 74-80)
Michael Hyland attempts a 3Pt. Contested by Trae Durant (3.0 feet, ZONE). Michael Hyland misses. Rebound secured by Trae Durant.

[11:34] Team_079 possession (Score: 74-80)
FOUL! Reach-in foul on Chris Bird during the drive. [Team fouls: 1] No free throws, side out. (Chris Bird: 1 personal fouls)

[11:19] Team_079 possession (Score: 74-80)
Donovan Randle attempts a Midrange. Contested by Kawhi Thompson (5.1 feet, ZONE). DONOVAN RANDLE MAKES IT! Assist: Khris Embiid
Score: 76-80

[11:01] Team_062 possession (Score: 76-80)
Chris Bird attempts a 3Pt. Contested by Trae Durant (3.3 feet, ZONE). Chris Bird misses. Rebound secured by Trae Durant.

[10:48] Team_079 possession (Score: 76-80)
Khris Embiid drives, picks up Jalen Reaves. Help arrives from Chris Bird! Khris Embiid attempts a Layup. Contested by Chris Bird (5.4 feet, ZONE). Khris Embiid misses. Rebound secured by Kawhi Thompson.

[10:36] Team_062 possession (Score: 76-80)
Michael Hyland attempts a 3Pt. Contested by Trae Durant (3.1 feet, ZONE). Michael Hyland misses. Rebound secured by Trae Durant.

[10:17] Team_079 possession (Score: 76-80)
Trae Durant drives, Kawhi Thompson stays with him. Trae Durant attempts a Dunk. Contested by Kawhi Thompson (4.9 feet, MAN). TRAE DURANT MAKES IT! Assist: Donovan Randle
Score: 78-80

[10:07] Team_062 possession (Score: 78-80)
Chris Bird attempts a 3Pt. Contested by Trae Durant (3.4 feet, ZONE). Chris Bird misses. Rebound secured by Trae Durant.

[09:53] Team_079 possession (Score: 78-80)
Bam Randle drives, picks up Michael Hyland. Help arrives from Chris Bird! Bam Randle attempts a Layup. Contested by Chris Bird (4.8 feet, MAN). BAM RANDLE MAKES IT!
Score: 80-80

[09:41] Team_062 possession (Score: 80-80)
RJ Williamson attempts a Layup. Contested by Trae Durant (3.0 feet, ZONE). RJ WILLIAMSON MAKES IT! Assist: Kawhi Thompson
Score: 80-82

[09:29] Team_079 possession (Score: 80-82)
Miles Ming attempts a 3Pt. Contested by RJ Williamson (4.9 feet, ZONE). MILES MING MAKES IT! Assist: Donovan Randle
Score: 83-82

[09:13] Team_062 possession (Score: 83-82)
Michael Hyland attempts a 3Pt. Contested by Bam Randle (4.5 feet, MAN). Michael Hyland misses. Rebound secured by Bam Randle.

[08:58] Team_079 possession (Score: 83-82)
Khris Embiid attempts a 3Pt. Contested by RJ Williamson (5.0 feet, ZONE). Khris Embiid misses. Rebound secured by Kawhi Thompson.

[08:46] Team_062 possession (Score: 83-82)
Michael Hyland attempts a 3Pt. Contested by Bam Randle (4.6 feet, MAN). Michael Hyland misses. Offensive rebound by Kawhi Thompson! Kawhi Thompson kicks it out.

[08:35] Team_062 possession (Score: 83-82)
Kawhi Thompson drives, Trae Durant stays with him. Kawhi Thompson attempts a Dunk. Contested by Trae Durant (3.4 feet, MAN). KAWHI THOMPSON MAKES IT! Assist: RJ Williamson
Score: 83-84

[08:16] Team_079 possession (Score: 83-84)
Khris Embiid attempts a Midrange. Contested by Kawhi Thompson (5.6 feet, ZONE). KHRIS EMBIID MAKES IT!
Score: 85-84

[07:59] Team_062 possession (Score: 85-84)
Kawhi Thompson attempts a 3Pt. Contested by Trae Durant (3.5 feet, MAN). Kawhi Thompson misses. Rebound secured by Trae Durant.

[07:44] Team_079 possession (Score: 85-84)
FOUL! Holding foul on Michael Hyland. [Team fouls: 2] No free throws, side out. (Michael Hyland: 1 personal fouls)

[07:30] Team_079 possession (Score: 85-84)
Donovan Randle attempts a 3Pt. Contested by RJ Williamson (5.0 feet, ZONE). Donovan Randle misses. Rebound secured by Michael Hyland.

[07:16] Team_062 possession (Score: 85-84)
Kawhi Thompson makes the Layup and draws the foul on Miles Ming! And-1! Kawhi Thompson to the line for 1. [Team fouls: 1] (Miles Ming: 1 personal fouls)   FT 1/1: GOOD Kawhi Thompson makes 1/1 from the line.
Score: 85-87

[07:06] Team_079 possession (Score: 85-87)
Khris Embiid attempts a Midrange. Contested by Chris Bird (5.1 feet, MAN). KHRIS EMBIID MAKES IT! Assist: Miles Ming
Score: 87-87

[06:52] Team_062 possession (Score: 87-87)
RJ Williamson attempts a 3Pt. Contested by Miles Ming (4.5 feet, MAN). RJ Williamson misses. Rebound secured by Trae Durant.

[06:40] Team_079 possession (Score: 87-87)
Khris Embiid attempts a 3Pt. Contested by RJ Williamson (5.3 feet, ZONE). KHRIS EMBIID MAKES IT!
Score: 90-87

[06:25] Team_062 possession (Score: 90-87)
Chris Bird attempts a Midrange. Contested by Trae Durant (3.8 feet, ZONE). CHRIS BIRD MAKES IT! Assist: Jalen Reaves
Score: 90-89

[06:13] Team_079 possession (Score: 90-89)
Bam Randle attempts a 3Pt. Contested by RJ Williamson (5.0 feet, ZONE). Bam Randle misses. Offensive rebound by Trae Durant! Trae Durant kicks it out.

[05:57] Team_079 possession (Score: 90-89)
Donovan Randle attempts a Layup. BLOCKED BY JALEN REAVES! Ball is loose! Rebound secured by Jalen Reaves.

[05:42] Team_062 possession (Score: 90-89)
RJ Williamson drives, Miles Ming stays with him. RJ Williamson attempts a Layup. Contested by Miles Ming (4.7 feet, MAN). RJ Williamson misses. Rebound secured by Donovan Randle.

[05:27] Team_079 possession (Score: 90-89)
Miles Ming attempts a 3Pt. Contested by RJ Williamson (5.4 feet, ZONE). Miles Ming misses. Rebound secured by Jalen Reaves.

[05:09] Team_062 possession (Score: 90-89)
Jalen Reaves drives and kicks out. Kawhi Thompson attempts a Midrange. Contested by Bam Randle (5.3 feet, ZONE). Kawhi Thompson misses. Rebound secured by Donovan Randle.

[04:56] Team_079 possession (Score: 90-89)
Miles Ming drives to the basket... Miles Ming loses the ball! Stripped by Jalen Reaves! TURNOVER! (live ball)

[04:42] Team_062 possession (Score: 90-89)
Chris Bird drives and kicks out. RJ Williamson attempts a Midrange. Contested by Trae Durant (4.1 feet, ZONE). RJ Williamson misses. Rebound secured by Trae Durant.

[04:31] Team_079 possession (Score: 90-89)
Miles Ming attempts a Midrange. Contested by Michael Hyland (5.7 feet, ZONE). Miles Ming misses. Rebound secured by Michael Hyland.

[04:18] Team_062 possession (Score: 90-89)
FOUL! Shooting foul on Bam Randle. Michael Hyland to the line for 2 free throws. [Team fouls: 2] (Bam Randle: 1 personal fouls)   FT 1/2: GOOD   FT 2/2: GOOD Michael Hyland makes 2/2 from the line.
Score: 90-91

[04:07] Team_079 possession (Score: 90-91)
Donovan Randle attempts a Midrange. Contested by Kawhi Thompson (5.9 feet, ZONE). Donovan Randle misses. Rebound secured by Michael Hyland.

[03:52] Team_062 possession (Score: 90-91)
Kawhi Thompson attempts a Midrange. Contested by Trae Durant (4.1 feet, MAN). Kawhi Thompson misses. Rebound secured by Trae Durant.

[03:37] Team_079 possession (Score: 90-91)
Trae Durant attempts a Layup. Contested by Kawhi Thompson (5.8 feet, MAN). TRAE DURANT MAKES IT!
Score: 92-91

[03:22] Team_062 possession (Score: 92-91)
FOUL! Reach-in foul on Trae Durant during the drive. [Team fouls: 3] No free throws, side out. (Trae Durant: 1 personal fouls)

[03:09] Team_062 possession (Score: 92-91)
Michael Hyland drives to the basket... Michael Hyland throws a bad pass out of bounds! TURNOVER! (dead ball)

[03:09] Substitution (Team_079): Khris Embiid OUT → Evan Mobley IN (stamina_rule2)

[03:09] Substitution (Team_079): Miles Ming OUT → Karl Ingram IN (stamina_rule2)

[03:09] Substitution (Team_079): Bam Randle OUT → Anthony Wade IN (stamina_rule2)

[03:09] Substitution (Team_079): Trae Durant OUT → Kobe Curry IN (stamina_rule2)

[03:09] Substitution (Team_079): Donovan Randle OUT → James LaVine IN (stamina_rule2)

[03:09] Substitution (Team_062): Chris Bird OUT → Paolo McCollum IN (stamina_rule2)

[03:09] Substitution (Team_062): RJ Williamson OUT → Tony LaVine IN (stamina_rule2)

[03:09] Substitution (Team_062): Michael Hyland OUT → Paul Poole IN (stamina_rule2)

[03:09] Substitution (Team_062): Kawhi Thompson OUT → RJ Wall IN (stamina_rule2)

[03:09] Substitution (Team_062): Jalen Reaves OUT → Devin Young IN (stamina_rule2)

[02:57] Team_079 possession (Score: 92-91)
Karl Ingram attempts a Layup. Contested by RJ Wall (5.3 feet, ZONE). KARL INGRAM MAKES IT!
Score: 94-91

[02:39] Team_062 possession (Score: 94-91)
Paolo McCollum attempts a 3Pt. Contested by Evan Mobley (4.7 feet, MAN). PAOLO MCCOLLUM MAKES IT! Assist: Devin Young
Score: 94-94

[02:23] Team_079 possession (Score: 94-94)
Kobe Curry attempts a 3Pt. Contested by RJ Wall (5.3 feet, MAN). Kobe Curry misses. Rebound secured by Paul Poole.

[02:13] Team_062 possession (Score: 94-94)
Paul Poole attempts a 3Pt. Contested by Karl Ingram (5.4 feet, ZONE). PAUL POOLE MAKES IT! Assist: Devin Young
Score: 94-97

[02:00] Team_079 possession (Score: 94-97)
Evan Mobley attempts a 3Pt. Wide open! Paolo McCollum is 6.1 feet away. [MAN] Evan Mobley misses. Rebound secured by Paul Poole.

[01:42] Team_062 possession (Score: 94-97)
RJ Wall drives and kicks out. FOUL! Shooting foul on Evan Mobley. Paolo McCollum to the line for 3 free throws. [Team fouls: 4] (Evan Mobley: 1 personal fouls)   FT 1/3: GOOD   FT 2/3: GOOD   FT 3/3: MISS Paolo McCollum makes 2/3 from the line. Offensive rebound by Devin Young! Devin Young kicks it out.
Score: 94-99

[01:29] Team_062 possession (Score: 94-99)
Paul Poole attempts a 3Pt. Contested by Kobe Curry (4.6 feet, ZONE). Paul Poole misses. Rebound secured by Kobe Curry.

[01:12] Team_079 possession (Score: 94-99)
Anthony Wade drives to the basket... FOUL! Offensive foul on Anthony Wade! RJ Wall drew the charge! [Team fouls: 5] (Anthony Wade: 1 personal fouls) TURNOVER! (dead ball)

[01:01] Team_062 possession (Score: 94-99)
Paolo McCollum drives and kicks out. Paul Poole attempts a Midrange. Contested by Kobe Curry (4.6 feet, ZONE). PAUL POOLE MAKES IT!
Score: 94-101

[00:49] Team_079 possession (Score: 94-101)
Karl Ingram loses the ball! Stripped by Tony LaVine! TURNOVER! (live ball)

[00:36] Team_062 possession (Score: 94-101)
Paolo McCollum attempts a 3Pt. Contested by Evan Mobley (4.7 feet, MAN). Paolo McCollum misses. Rebound secured by Kobe Curry.

[00:21] Team_079 possession (Score: 94-101)
Evan Mobley drives, Paolo McCollum stays with him. Evan Mobley attempts a Layup. Wide open! Paolo McCollum is 6.1 feet away. [MAN] EVAN MOBLEY MAKES IT! Assist: James LaVine
Score: 96-101

[00:09] Team_062 possession (Score: 96-101)
Paolo McCollum attempts a 3Pt. Contested by Evan Mobley (4.7 feet, ZONE). PAOLO MCCOLLUM MAKES IT! Assist: Tony LaVine
Score: 96-104

================================================================================
                              4TH QUARTER COMPLETE                              
================================================================================

4TH QUARTER SCORE: Team_079 25, Team_062 24

BOX SCORE:
================================================================================

Team_079
--------------------------------------------------------------------------------
Player                MIN  PTS  REB  AST  TO      FG   FG%      3P   3P%
--------------------------------------------------------------------------------
Khris Embiid           37   10    0    1   0   4/6    66.7     0/0   0.0
Trae Durant            37    4    9    0   0   2/2   100.0     0/0   0.0
Miles Ming             37    3    0    2   0   1/3    33.3     0/0   0.0
Donovan Randle         37    2    2    2   0   1/4    25.0     0/0   0.0
Bam Randle             37    2    1    0   0   1/1   100.0     0/0   0.0
Karl Ingram            11    2    0    0   0   1/1   100.0     0/0   0.0
Evan Mobley            11    2    0    0   0   1/2    50.0     0/0   0.0
Kobe Curry             11    0    2    0   0   0/1     0.0     0/0   0.0
James LaVine           11    0    0    1   0   0/0     0.0     0/0   0.0

TEAM: FG: 11/20 (55.0%), 3PT: 3/8 (37.5%), REB: 14 (1 off, 13 def), AST: 6, TO: 3
TEAM FOULS: 5 [Team_062 in BONUS]


Team_062
--------------------------------------------------------------------------------
Player                MIN  PTS  REB  AST  TO      FG   FG%      3P   3P%
--------------------------------------------------------------------------------
Paolo McCollum         11    6    0    0   0   2/3    66.7     0/0   0.0
Kawhi Thompson         37    5    3    1   0   2/4    50.0     0/0   0.0
Paul Poole             11    5    2    0   0   2/3    66.7     0/0   0.0
Michael Hyland         37    2    3    0   0   1/4    25.0     0/0   0.0
Chris Bird             37    2    0    0   0   1/4    25.0     0/0   0.0
RJ Williamson          37    2    0    1   0   1/3    33.3     0/0   0.0
Jalen Reaves           37    0    2    1   0   0/1     0.0     0/0   0.0
Devin Young            11    0    1    2   0   0/0     0.0     0/0   0.0
Tony LaVine            11    0    0    1   0   0/0     0.0     0/0   0.0

TEAM: FG: 9/22 (40.9%), 3PT: 3/12 (25.0%), REB: 11 (2 off, 9 def), AST: 6, TO: 1
TEAM FOULS: 2

================================================================================

================================================================================
                               FULL GAME COMPLETE                               
================================================================================

FINAL SCORE: Team_079 96, Team_062 104

SCORING BY QUARTER:
--------------------------------------------------------------------------------
Team                     Q1     Q2     Q3     Q4    FINAL
--------------------------------------------------------------------------------
Team_079                 26     22     23     25       96
Team_062                 24     28     28     24      104
--------------------------------------------------------------------------------

FULL GAME BOX SCORE:
================================================================================

Team_079
--------------------------------------------------------------------------------
Player                MIN  PTS  REB  AST  TO      FG   FG%      3P   3P%      FT STL BLK
--------------------------------------------------------------------------------
Khris Embiid           37   16    0    4   3   6/14   42.9   3/7    42.9   1/1     2   1
Miles Ming             37   15    0    3   1   6/13   46.2   1/5    20.0   2/2     1   1
Bam Randle             37   12    7    2   2   5/8    62.5   1/3    33.3   2/4     0   0
Trae Durant            37   19   17    0   1   8/14   57.1   1/5    20.0   2/2     1   1
Donovan Randle         37    7   13    6   1   4/10   40.0   0/1     0.0   3/5     1   0
Evan Mobley            11    2    0    1   0   1/2    50.0   0/1     0.0   0/0     0   0
Karl Ingram            11    6    0    0   2   3/5    60.0   0/1     0.0   0/0     0   0
Anthony Wade           11    9    0    1   0   4/4   100.0   0/0     0.0   1/1     0   0
Kobe Curry             11    5    5    0   1   2/5    40.0   1/3    33.3   0/0     1   0
James LaVine           11    2    3    2   1   1/1   100.0   0/0     0.0   0/0     1   0

TEAM: FG: 41/77 (53.2%), 3PT: 7/26 (26.9%), REB: 45 (10 off, 35 def), AST: 19, TO: 12


Team_062
--------------------------------------------------------------------------------
Player                MIN  PTS  REB  AST  TO      FG   FG%      3P   3P%      FT STL BLK
--------------------------------------------------------------------------------
Chris Bird             37   20    0    5   1   9/21   42.9   0/4     0.0   4/4     0   0
RJ Williamson          37    5    0    3   1   2/7    28.6   1/3    33.3   0/0     1   0
Michael Hyland         37   25    7    0   2  10/16   62.5   3/9    33.3   6/6     0   0
Kawhi Thompson         37   13   21    4   0   5/9    55.6   0/1     0.0   4/5     0   0
Jalen Reaves           37    6   10    2   4   2/6    33.3   1/1   100.0   1/1     2   1
Paolo McCollum         11   10    0    0   1   5/8    62.5   2/5    40.0   4/5     0   0
Tony LaVine            11    0    0    2   0   0/0     0.0   0/0     0.0   0/0     2   0
Paul Poole             11    5    3    0   1   2/3    66.7   1/2    50.0   0/0     0   0
RJ Wall                11   10    3    0   0   4/5    80.0   0/0     0.0   4/5     0   0
Devin Young            11    5    3    2   1   2/3    66.7   0/0     0.0   3/4     0   0

TEAM: FG: 41/78 (52.6%), 3PT: 8/25 (32.0%), REB: 47 (12 off, 35 def), AST: 18, TO: 11

================================================================================
