================================================================================
                        FULL GAME - Team_021 vs Team_046                        
================================================================================

================================================================================
                       1ST QUARTER - Team_021 vs Team_046                       
================================================================================

[12:00] Team_021 possession (Score: 0-0)
Kyrie Leonard attempts a 3Pt. Contested by Lauri Carter (3.1 feet, ZONE). Kyrie Leonard misses. Rebound secured by Lauri Carter.

[11:48] Team_046 possession (Score: 0-0)
Kevin Allen attempts a Midrange. Contested by Zach Carter (4.3 feet, MAN). Kevin Allen misses. Rebound secured by Zach Carter.

[11:36] Team_021 possession (Score: 0-0)
Kyrie Wagner attempts a 3Pt. Contested by Lauri Carter (3.3 feet, ZONE). Kyrie Wagner misses. Offensive rebound by Zach Carter! Zach Carter kicks it out.

[11:21] Team_021 possession (Score: 0-0)
FOUL! Shooting foul on D'Angelo O'Neal. Karl Bridges to the line for 2 free throws. [Team fouls: 1] (D'Angelo O'Neal: 1 personal fouls)   FT 1/2: GOOD   FT 2/2: GOOD Karl Bridges makes 2/2 from the line.
Score: 2-0

[11:02] Team_046 possession (Score: 2-0)
D'Angelo O'Neal drives to the basket... D'Angelo O'Neal throws a bad pass! Stolen by Kyrie Leonard! TURNOVER! (live ball)

[10:50] Team_021 possession (Score: 2-0)
FOUL! Shooting foul on Kevin Allen. Kyrie Wagner to the line for 2 free throws. [Team fouls: 2] (Kevin Allen: 1 personal fouls)   FT 1/2: GOOD   FT 2/2: GOOD Kyrie Wagner makes 2/2 from the line.
Score: 4-0

[10:35] Team_046 possession (Score: 4-0)
D'Angelo O'Neal drives, Zach Carter stays with him. D'Angelo O'Neal attempts a Layup. Contested by Zach Carter (4.2 feet, ZONE). D'ANGELO O'NEAL MAKES IT!
Score: 4-2

[10:24] Team_021 possession (Score: 4-2)
FOUL! Shooting foul on Kevin Allen. Zach Carter to the line for 3 free throws. [Team fouls: 3] (Kevin Allen: 2 personal fouls)   FT 1/3: MISS   FT 2/3: GOOD   FT 3/3: GOOD Zach Carter makes 2/3 from the line.
Score: 6-2

[10:09] Team_046 possession (Score: 6-2)
Kevin Allen loses control! Ball rolls out of bounds! TURNOVER! (dead ball)

[09:56] Team_021 possession (Score: 6-2)
Anthony Oladipo drives and kicks out. Karl Bridges attempts a Midrange. Contested by Lauri Carter (3.2 feet, MAN). KARL BRIDGES MAKES IT! Assist: Kyrie Wagner
Score: 8-2

[09:43] Team_046 possession (Score: 8-2)
D'Angelo O'Neal attempts a Midrange. Contested by Anthony Oladipo (4.8 feet, ZONE). D'ANGELO O'NEAL MAKES IT!
Score: 8-4

[09:25] Team_021 possession (Score: 8-4)
Kyrie Leonard attempts a 3Pt. Contested by Lauri Carter (3.1 feet, ZONE). KYRIE LEONARD MAKES IT! Assist: Anthony Oladipo
Score: 11-4

[09:09] Team_046 possession (Score: 11-4)
Victor Nowitzki drives and kicks out. Cade Wall attempts a 3Pt. Contested by Kyrie Wagner (4.0 feet, MAN). Cade Wall misses. Rebound secured by Kyrie Leonard.

[08:53] Team_021 possession (Score: 11-4)
Karl Bridges attempts a 3Pt. Contested by Lauri Carter (3.1 feet, MAN). Karl Bridges misses. Rebound secured by Lauri Carter.

[08:35] Team_046 possession (Score: 11-4)
Victor Nowitzki attempts a 3Pt. Contested by Kyrie Wagner (4.1 feet, ZONE). Victor Nowitzki misses. Rebound secured by Zach Carter.

[08:18] Team_021 possession (Score: 11-4)
Kyrie Wagner drives to the basket... Kyrie Wagner loses the ball! Stripped by Cade Wall! TURNOVER! (live ball)

[08:06] Team_046 possession (Score: 11-4)
Cade Wall throws a bad pass! Stolen by Kyrie Wagner! TURNOVER! (live ball)

[07:56] Team_021 possession (Score: 11-4)
Zach Carter makes the Dunk and draws the foul on D'Angelo O'Neal! And-1! Zach Carter to the line for 1. [Team fouls: 4] (D'Angelo O'Neal: 2 personal fouls)   FT 1/1: GOOD Zach Carter makes 1/1 from the line.
Score: 14-4

[07:40] Team_046 possession (Score: 14-4)
FOUL! Reach-in foul on Zach Carter during the drive. [Team fouls: 1] No free throws, side out. (Zach Carter: 1 personal fouls)

[07:22] Team_046 possession (Score: 14-4)
Lauri Carter drives, Zach Carter stays with him. Lauri Carter attempts a Dunk. Contested by Zach Carter (4.2 feet, ZONE). LAURI CARTER MAKES IT! Assist: Kevin Allen
Score: 14-6

[07:06] Team_021 possession (Score: 14-6)
Karl Bridges attempts a 3Pt. Contested by Victor Nowitzki (5.4 feet, ZONE). Karl Bridges misses. Offensive rebound by Kyrie Leonard! Kyrie Leonard kicks it out.

[06:53] Team_021 possession (Score: 14-6)
Kyrie Leonard drives and kicks out. Kyrie Leonard attempts a 3Pt. Contested by D'Angelo O'Neal (4.0 feet, MAN). Kyrie Leonard misses. FOUL! Loose ball foul on Cade Wall during the rebound battle. [IN THE BONUS! 5 team fouls] Kyrie Leonard to the line for 2 free throws. (Cade Wall: 1 personal fouls)   FT 1/2: GOOD   FT 2/2: GOOD Kyrie Leonard makes 2/2 from the line.
Score: 16-6

[06:41] Team_046 possession (Score: 16-6)
D'Angelo O'Neal drives, Zach Carter stays with him. D'Angelo O'Neal attempts a Layup. Contested by Zach Carter (4.2 feet, ZONE). D'ANGELO O'NEAL MAKES IT! Assist: Cade Wall
Score: 16-8

[06:26] Team_021 possession (Score: 16-8)
Zach Carter drives to the basket... Zach Carter loses the ball! Stripped by Cade Wall! TURNOVER! (live ball)

[06:10] Team_046 possession (Score: 16-8)
D'Angelo O'Neal attempts a 3Pt. Contested by Kyrie Leonard (4.8 feet, MAN). D'Angelo O'Neal misses. Rebound secured by Anthony Oladipo.

[05:54] Team_021 possession (Score: 16-8)
Kyrie Leonard drives, picks up D'Angelo O'Neal. Help arrives from Lauri Carter! Kyrie Leonard attempts a Dunk. Contested by Lauri Carter (3.9 feet, MAN). KYRIE LEONARD MAKES IT!
Score: 18-8

[05:44] Team_046 possession (Score: 18-8)
D'Angelo O'Neal drives, picks up Kyrie Leonard. Help arrives from Anthony Oladipo! D'Angelo O'Neal attempts a Layup. Contested by Anthony Oladipo (4.8 feet, MAN). D'ANGELO O'NEAL MAKES IT! Assist: Kevin Allen
Score: 18-10

[05:31] Team_021 possession (Score: 18-10)
Zach Carter attempts a Layup. Contested by Kevin Allen (5.1 feet, ZONE). Zach Carter misses. Rebound secured by Cade Wall.

[05:18] Team_046 possession (Score: 18-10)
FOUL! Shooting foul on Karl Bridges. Lauri Carter to the line for 3 free throws. [Team fouls: 2] (Karl Bridges: 1 personal fouls)   FT 1/3: GOOD   FT 2/3: MISS   FT 3/3: MISS Lauri Carter makes 1/3 from the line. Rebound secured by Anthony Oladipo.
Score: 18-11

[05:05] Team_021 possession (Score: 18-11)
Kyrie Leonard attempts a 3Pt. Contested by Lauri Carter (3.1 feet, ZONE). Kyrie Leonard misses. Rebound secured by Kevin Allen.

[04:51] Team_046 possession (Score: 18-11)
Kevin Allen attempts a Layup. Contested by Zach Carter (4.3 feet, MAN). Kevin Allen misses. Rebound secured by Anthony Oladipo.

[04:38] Team_021 possession (Score: 18-11)
Kyrie Leonard throws a bad pass out of bounds! TURNOVER! (dead ball)

[04:28] Team_046 possession (Score: 18-11)
Cade Wall attempts a Layup. Contested by Zach Carter (4.7 feet, ZONE). CADE WALL MAKES IT! Assist: Kevin Allen
Score: 18-13

[04:13] Team_021 possession (Score: 18-13)
Kyrie Wagner loses the ball! Stripped by Cade Wall! TURNOVER! (live ball)

[04:03] Team_046 possession (Score: 18-13)
Lauri Carter attempts a Layup. Contested by Karl Bridges (5.8 feet, MAN). LAURI CARTER MAKES IT! Assist: D'Angelo O'Neal
Score: 18-15

[03:48] Team_021 possession (Score: 18-15)
FOUL! Reach-in foul on D'Angelo O'Neal during the drive. [IN THE BONUS! 6 team fouls] Kyrie Leonard to the line for 2 free throws. (D'Angelo O'Neal: 3 personal fouls)   FT 1/2: GOOD   FT 2/2: GOOD Kyrie Leonard makes 2/2 from the line.
Score: 20-15

[03:34] Team_046 possession (Score: 20-15)
Lauri Carter drives, Zach Carter stays with him. Lauri Carter attempts a Layup. Contested by Zach Carter (4.4 feet, ZONE). LAURI CARTER MAKES IT! Assist: Cade Wall
Score: 20-17

[03:21] Team_021 possession (Score: 20-17)
Kyrie Leonard drives and kicks out. FOUL! Shooting foul on Lauri Carter. Zach Carter to the line for 2 free throws. [BONUS: 7 team fouls] (Lauri Carter: 1 personal fouls)   FT 1/2: GOOD   FT 2/2: GOOD Zach Carter makes 2/2 from the line.
Score: 22-17

[03:06] Team_046 possession (Score: 22-17)
Lauri Carter attempts a 3Pt. Contested by Anthony Oladipo (5.0 feet, ZONE). Lauri Carter misses. Offensive rebound by Cade Wall! Cade Wall kicks it out.

[02:53] Team_046 possession (Score: 22-17)
Cade Wall drives, picks up Zach Carter. Help arrives from Kyrie Leonard! Cade Wall attempts a Dunk. Contested by Kyrie Leonard (4.8 feet, ZONE). CADE WALL MAKES IT!
Score: 22-19

[02:41] Team_021 possession (Score: 22-19)
Karl Bridges attempts a 3Pt. Contested by Lauri Carter (3.4 feet, MAN). KARL BRIDGES MAKES IT! Assist: Zach Carter
Score: 25-19

[02:30] Team_046 possession (Score: 25-19)
Cade Wall attempts a Midrange. Contested by Kyrie Wagner (4.9 feet, ZONE). Cade Wall misses. Rebound secured by Zach Carter.

[02:17] Team_021 possession (Score: 25-19)
Anthony Oladipo attempts a 3Pt. Contested by Victor Nowitzki (5.7 feet, MAN). Anthony Oladipo misses. FOUL! Loose ball foul on Cade Wall during the rebound battle. [IN THE BONUS! 8 team fouls] Zach Carter to the line for 2 free throws. (Cade Wall: 2 personal fouls)   FT 1/2: GOOD   FT 2/2: GOOD Zach Carter makes 2/2 from the line.
Score: 27-19

[02:05] Team_046 possession (Score: 27-19)
Lauri Carter attempts a 3Pt. Contested by Kyrie Wagner (4.5 feet, ZONE). Lauri Carter misses. Offensive rebound by Cade Wall! Cade Wall kicks it out.

[01:49] Team_046 possession (Score: 27-19)
Lauri Carter drives and kicks out. Kevin Allen attempts a Midrange. Contested by Kyrie Leonard (4.9 feet, ZONE). Kevin Allen misses. Rebound secured by Kyrie Leonard.

[01:32] Team_021 possession (Score: 27-19)
Zach Carter drives to the basket... Zach Carter commits a violation (traveling/carry)! TURNOVER! (dead ball)

[01:32] Substitution (Team_021): Kyrie Leonard OUT → Joel LaVine IN (stamina_rule2)

[01:32] Substitution (Team_021): Anthony Oladipo OUT → Victor Mitchell IN (stamina_rule2)

[01:32] Substitution (Team_021): Karl Bridges OUT → Paul Allen IN (stamina_rule2)

[01:32] Substitution (Team_021): Kyrie Wagner OUT → Vince George IN (stamina_rule2)

[01:32] Substitution (Team_021): Zach Carter OUT → Magic Ingram IN (stamina_rule2)

[01:32] Substitution (Team_046): D'Angelo O'Neal OUT → Collin Butler IN (stamina_rule2)

[01:32] Substitution (Team_046): Victor Nowitzki OUT → Manu Dosunmu IN (stamina_rule2)

[01:32] Substitution (Team_046): Lauri Carter OUT → Josh Barrett IN (stamina_rule2)

[01:32] Substitution (Team_046): Cade Wall OUT → Chris LaVine IN (stamina_rule2)

[01:32] Substitution (Team_046): Kevin Allen OUT → Paul DeRozan IN (stamina_rule2)

[01:16] Team_046 possession (Score: 27-19)
Chris LaVine attempts a Midrange. Contested by Vince George (5.4 feet, MAN). CHRIS LAVINE MAKES IT!
Score: 27-21

[01:06] Team_021 possession (Score: 27-21)
Joel LaVine attempts a 3Pt. Contested by Collin Butler (3.7 feet, ZONE). JOEL LAVINE MAKES IT!
Score: 30-21

[00:52] Team_046 possession (Score: 30-21)
Manu Dosunmu attempts a Midrange. Contested by Victor Mitchell (4.7 feet, ZONE). Manu Dosunmu misses. Rebound secured by Victor Mitchell.

[00:42] Team_021 possession (Score: 30-21)
Joel LaVine throws a bad pass! Stolen by Collin Butler! TURNOVER! (live ball)

[00:27] Team_046 possession (Score: 30-21)
Chris LaVine attempts a 3Pt. Contested by Victor Mitchell (4.6 feet, ZONE). Chris LaVine misses. Rebound secured by Vince George.

[00:12] Team_021 possession (Score: 30-21)
Vince George drives, Chris LaVine stays with him. Vince George attempts a Dunk. Contested by Chris LaVine (3.8 feet, MAN). VINCE GEORGE MAKES IT!
Score: 32-21

================================================================================
                              1ST QUARTER COMPLETE                              
================================================================================

1ST QUARTER SCORE: Team_021 32, Team_046 21

BOX SCORE:
================================================================================

Team_021
--------------------------------------------------------------------------------
Player                MIN  PTS  REB  AST  TO      FG   FG%      3P   3P%
--------------------------------------------------------------------------------
Kyrie Leonard          11    9    3    0   0   4/6    66.7     0/0   0.0
Zach Carter            11    9    4    1   0   4/5    80.0     0/0   0.0
Karl Bridges           11    7    0    0   0   3/4    75.0     0/0   0.0
Joel LaVine             1    3    0    0   0   1/1   100.0     0/0   0.0
Kyrie Wagner           11    2    0    1   0   1/1   100.0     0/0   0.0
Vince George            1    2    1    0   0   1/1   100.0     0/0   0.0
Anthony Oladipo        11    0    3    1   0   0/0     0.0     0/0   0.0
Victor Mitchell         1    0    1    0   0   0/0     0.0     0/0   0.0

TEAM: FG: 14/18 (77.8%), 3PT: 5/8 (62.5%), REB: 12 (2 off, 10 def), AST: 3, TO: 6
TEAM FOULS: 2


Team_046
--------------------------------------------------------------------------------
Player                MIN  PTS  REB  AST  TO      FG   FG%      3P   3P%
--------------------------------------------------------------------------------
D'Angelo O'Neal        11    8    0    1   0   4/5    80.0     0/0   0.0
Lauri Carter           11    6    2    0   0   3/5    60.0     0/0   0.0
Cade Wall              11    4    3    2   0   2/3    66.7     0/0   0.0
Chris LaVine            1    2    0    0   0   1/2    50.0     0/0   0.0
Kevin Allen            11    0    1    3   0   0/2     0.0     0/0   0.0
Victor Nowitzki        11    0    0    0   0   0/2     0.0     0/0   0.0
Manu Dosunmu            1    0    0    0   0   0/1     0.0     0/0   0.0

TEAM: FG: 10/20 (50.0%), 3PT: 0/4 (0.0%), REB: 6 (2 off, 4 def), AST: 6, TO: 3
TEAM FOULS: 8 [Team_021 in BONUS]

================================================================================

================================================================================
                       2ND QUARTER - Team_021 vs Team_046                       
================================================================================

[12:00] Team_021 possession (Score: 32-21)
Anthony Oladipo drives, Kevin Allen stays with him. Anthony Oladipo attempts a Layup. Contested by Kevin Allen (4.8 feet, ZONE). ANTHONY OLADIPO MAKES IT! Assist: Kyrie Leonard
Score: 34-21

[11:49] Team_046 possession (Score: 34-21)
Kevin Allen drives and kicks out. D'Angelo O'Neal attempts a 3Pt. Contested by Kyrie Wagner (4.1 feet, ZONE). D'Angelo O'Neal misses. Rebound secured by Kyrie Leonard.

[11:32] Team_021 possession (Score: 34-21)
Kyrie Leonard makes the Layup and draws the foul on D'Angelo O'Neal! And-1! Kyrie Leonard to the line for 1. [Team fouls: 1] (D'Angelo O'Neal: 1 personal fouls)   FT 1/1: GOOD Kyrie Leonard makes 1/1 from the line.
Score: 37-21

[11:15] Team_046 possession (Score: 37-21)
Victor Nowitzki throws a bad pass out of bounds! TURNOVER! (dead ball)

[11:15] Substitution (Team_046): D'Angelo O'Neal OUT → Collin Butler IN (stamina_rule2)

[11:15] Substitution (Team_046): Kevin Allen OUT → Paul DeRozan IN (stamina_rule2)

[11:01] Team_021 possession (Score: 37-21)
Kyrie Wagner attempts a Layup. Contested by Paul DeRozan (5.0 feet, ZONE). Kyrie Wagner misses. Rebound secured by Cade Wall.

[10:47] Team_046 possession (Score: 37-21)
Victor Nowitzki drives and kicks out. Paul DeRozan attempts a 3Pt. Contested by Zach Carter (4.2 feet, MAN). Paul DeRozan misses. Offensive rebound by Paul DeRozan! Paul DeRozan puts it back in!
Score: 37-23

[10:33] Team_021 possession (Score: 37-23)
Anthony Oladipo attempts a Midrange. Contested by Victor Nowitzki (5.7 feet, ZONE). Anthony Oladipo misses. Rebound secured by Cade Wall.

[10:17] Team_046 possession (Score: 37-23)
Collin Butler attempts a Layup. Contested by Zach Carter (4.6 feet, ZONE). Collin Butler misses. Offensive rebound by Paul DeRozan! Paul DeRozan's putback is no good. Rebound secured by Kyrie Leonard.

[10:03] Team_021 possession (Score: 37-23)
Karl Bridges attempts a Midrange. Contested by Victor Nowitzki (5.7 feet, ZONE). KARL BRIDGES MAKES IT! Assist: Anthony Oladipo
Score: 39-23

[09:51] Team_046 possession (Score: 39-23)
Cade Wall makes the Layup and draws the foul on Zach Carter! And-1! Cade Wall to the line for 1. [Team fouls: 1] (Zach Carter: 1 personal fouls)   FT 1/1: GOOD Cade Wall makes 1/1 from the line.
Score: 39-26

[09:36] Team_021 possession (Score: 39-26)
Kyrie Leonard drives, picks up Paul DeRozan. Help arrives from Collin Butler! Kyrie Leonard attempts a Layup. Contested by Collin Butler (4.8 feet, ZONE). Kyrie Leonard misses. Rebound secured by Lauri Carter.

[09:20] Team_046 possession (Score: 39-26)
Collin Butler attempts a 3Pt. Contested by Kyrie Leonard (5.3 feet, MAN). Collin Butler misses. Offensive rebound by Paul DeRozan! Paul DeRozan puts it back in!
Score: 39-28

[09:03] Team_021 possession (Score: 39-28)
Kyrie Leonard attempts a 3Pt. Contested by Collin Butler (3.7 feet, ZONE). Kyrie Leonard misses. Offensive rebound by Zach Carter! Zach Carter kicks it out.

[08:47] Team_021 possession (Score: 39-28)
FOUL! Shooting foul on Paul DeRozan. Kyrie Leonard to the line for 2 free throws. [Team fouls: 2] (Paul DeRozan: 1 personal fouls)   FT 1/2: GOOD   FT 2/2: GOOD Kyrie Leonard makes 2/2 from the line.
Score: 41-28

[08:36] Team_046 possession (Score: 41-28)
Paul DeRozan drives, Zach Carter stays with him. Paul DeRozan attempts a Layup. Contested by Zach Carter (4.5 feet, ZONE). PAUL DEROZAN MAKES IT! Assist: Victor Nowitzki
Score: 41-30

[08:22] Team_021 possession (Score: 41-30)
Karl Bridges loses control! Ball rolls out of bounds! TURNOVER! (dead ball)

[08:22] Substitution (Team_021): Kyrie Leonard OUT → Joel LaVine IN (stamina_rule2)

[08:22] Substitution (Team_021): Anthony Oladipo OUT → Victor Mitchell IN (stamina_rule2)

[08:22] Substitution (Team_021): Karl Bridges OUT → Paul Allen IN (stamina_rule2)

[08:22] Substitution (Team_021): Kyrie Wagner OUT → Vince George IN (stamina_rule2)

[08:22] Substitution (Team_021): Zach Carter OUT → Magic Ingram IN (stamina_rule2)

[08:22] Substitution (Team_046): Victor Nowitzki OUT → Manu Dosunmu IN (stamina_rule2)

[08:22] Substitution (Team_046): Lauri Carter OUT → Josh Barrett IN (stamina_rule2)

[08:22] Substitution (Team_046): Cade Wall OUT → Chris LaVine IN (stamina_rule2)

[08:05] Team_046 possession (Score: 41-30)
Paul DeRozan attempts a 3Pt. Contested by Victor Mitchell (4.2 feet, ZONE). Paul DeRozan misses. Rebound secured by Magic Ingram.

[07:54] Team_021 possession (Score: 41-30)
Joel LaVine attempts a 3Pt. Contested by Collin Butler (3.7 feet, ZONE). JOEL LAVINE MAKES IT!
Score: 44-30

[07:37] Team_046 possession (Score: 44-30)
Paul DeRozan attempts a Midrange. Contested by Magic Ingram (5.0 feet, ZONE). PAUL DEROZAN MAKES IT! Assist: Josh Barrett
Score: 44-32

[07:22] Team_021 possession (Score: 44-32)
Paul Allen attempts a Layup. BLOCKED BY JOSH BARRETT! Ball is loose! Rebound secured by Chris LaVine.

[07:05] Team_046 possession (Score: 44-32)
FOUL! Shooting foul on Vince George. Chris LaVine to the line for 2 free throws. [Team fouls: 2] (Vince George: 1 personal fouls)   FT 1/2: MISS   FT 2/2: GOOD Chris LaVine makes 1/2 from the line.
Score: 44-33

[06:50] Team_021 possession (Score: 44-33)
Joel LaVine attempts a Midrange. Contested by Manu Dosunmu (4.6 feet, ZONE). Joel LaVine misses. Rebound secured by Chris LaVine.

[06:33] Team_046 possession (Score: 44-33)
FOUL! Shooting foul on Vince George. Manu Dosunmu to the line for 2 free throws. [Team fouls: 3] (Vince George: 2 personal fouls)   FT 1/2: GOOD   FT 2/2: GOOD Manu Dosunmu makes 2/2 from the line.
Score: 44-35

[06:23] Team_021 possession (Score: 44-35)
Vince George attempts a Midrange. Contested by Chris LaVine (3.8 feet, MAN). Vince George misses. Offensive rebound by Vince George! Vince George kicks it out.

[06:06] Team_021 possession (Score: 44-35)
Paul Allen throws a bad pass! Stolen by Josh Barrett! TURNOVER! (live ball)

[05:52] Team_046 possession (Score: 44-35)
Collin Butler attempts a 3Pt. Wide open! Joel LaVine is 6.2 feet away. [MAN] Collin Butler misses. Rebound secured by Victor Mitchell.

[05:40] Team_021 possession (Score: 44-35)
Vince George attempts a Midrange. Contested by Josh Barrett (4.7 feet, ZONE). VINCE GEORGE MAKES IT! Assist: Victor Mitchell
Score: 46-35

[05:24] Team_046 possession (Score: 46-35)
Josh Barrett attempts a 3Pt. Contested by Victor Mitchell (4.3 feet, ZONE). Josh Barrett misses. FOUL! Loose ball foul on Victor Mitchell during the rebound battle. [Team fouls: 4] No free throws, side out. (Victor Mitchell: 1 personal fouls)

[05:09] Team_046 possession (Score: 46-35)
Collin Butler attempts a 3Pt. Wide open! Joel LaVine is 6.2 feet away. [MAN] Collin Butler misses. Rebound secured by Magic Ingram.

[04:54] Team_021 possession (Score: 46-35)
Victor Mitchell drives and kicks out. Magic Ingram attempts a 3Pt. Contested by Collin Butler (3.9 feet, ZONE). Magic Ingram misses. Rebound secured by Manu Dosunmu.

[04:43] Team_046 possession (Score: 46-35)
FOUL! Shooting foul on Magic Ingram. Josh Barrett to the line for 2 free throws. [BONUS: 5 team fouls] (Magic Ingram: 1 personal fouls)   FT 1/2: GOOD   FT 2/2: GOOD Josh Barrett makes 2/2 from the line.
Score: 46-37

[04:25] Team_021 possession (Score: 46-37)
Joel LaVine attempts a Midrange. Contested by Collin Butler (3.8 feet, MAN). Joel LaVine misses. Rebound secured by Chris LaVine.

[04:09] Team_046 possession (Score: 46-37)
Josh Barrett throws a bad pass out of bounds! TURNOVER! (dead ball)

[03:58] Team_021 possession (Score: 46-37)
Joel LaVine attempts a Midrange. Contested by Manu Dosunmu (4.6 feet, ZONE). JOEL LAVINE MAKES IT! Assist: Vince George
Score: 48-37

[03:40] Team_046 possession (Score: 48-37)
Collin Butler drives, Joel LaVine stays with him. Collin Butler attempts a Layup. Wide open! Joel LaVine is 6.2 feet away. [MAN] COLLIN BUTLER MAKES IT! Assist: Paul DeRozan
Score: 48-39

[03:30] Team_021 possession (Score: 48-39)
Joel LaVine drives, Chris LaVine stays with him. Joel LaVine attempts a Layup. Contested by Chris LaVine (3.7 feet, ZONE). JOEL LAVINE MAKES IT!
Score: 50-39

[03:15] Team_046 possession (Score: 50-39)
Chris LaVine attempts a Midrange. Contested by Vince George (5.4 feet, ZONE). CHRIS LAVINE MAKES IT! Assist: Manu Dosunmu
Score: 50-41

[02:59] Team_021 possession (Score: 50-41)
Magic Ingram throws a bad pass! Stolen by Chris LaVine! TURNOVER! (live ball)

[02:43] Team_046 possession (Score: 50-41)
FOUL! Reach-in foul on Vince George during the drive. [IN THE BONUS! 6 team fouls] Chris LaVine to the line for 2 free throws. (Vince George: 3 personal fouls)   FT 1/2: GOOD   FT 2/2: GOOD Chris LaVine makes 2/2 from the line.
Score: 50-43

[02:28] Team_021 possession (Score: 50-43)
Magic Ingram attempts a Midrange. Contested by Chris LaVine (4.0 feet, MAN). Magic Ingram misses. Rebound secured by Paul DeRozan.

[02:14] Team_046 possession (Score: 50-43)
Chris LaVine attempts a Midrange. Contested by Victor Mitchell (4.7 feet, ZONE). CHRIS LAVINE MAKES IT!
Score: 50-45

[01:57] Team_021 possession (Score: 50-45)
Vince George drives to the basket... Vince George commits a violation (traveling/carry)! TURNOVER! (dead ball)

[01:40] Team_046 possession (Score: 50-45)
Paul DeRozan drives, picks up Magic Ingram. Help arrives from Victor Mitchell! Paul DeRozan attempts a Layup. Contested by Victor Mitchell (5.0 feet, MAN). Paul DeRozan misses. Rebound secured by Magic Ingram.

[01:26] Team_021 possession (Score: 50-45)
Joel LaVine attempts a Midrange. Contested by Collin Butler (4.1 feet, MAN). JOEL LAVINE MAKES IT! Assist: Vince George
Score: 52-45

[01:14] Team_046 possession (Score: 52-45)
Collin Butler drives to the basket... Collin Butler loses control! Ball rolls out of bounds! TURNOVER! (dead ball)

[01:01] Team_021 possession (Score: 52-45)
Victor Mitchell attempts a Midrange. Contested by Manu Dosunmu (4.8 feet, MAN). Victor Mitchell misses. Rebound secured by Chris LaVine.

[00:45] Team_046 possession (Score: 52-45)
Collin Butler attempts a 3Pt. Wide open! Joel LaVine is 6.2 feet away. [MAN] COLLIN BUTLER MAKES IT!
Score: 52-48

[00:28] Team_021 possession (Score: 52-48)
Victor Mitchell makes the Dunk and draws the foul on Collin Butler! And-1! Victor Mitchell to the line for 1. [Team fouls: 3] (Collin Butler: 1 personal fouls)   FT 1/1: GOOD Victor Mitchell makes 1/1 from the line.
Score: 55-48

[00:12] Team_046 possession (Score: 55-48)
Chris LaVine attempts a Midrange. Contested by Vince George (5.6 feet, ZONE). CHRIS LAVINE MAKES IT! Assist: Manu Dosunmu
Score: 55-50

================================================================================
                              2ND QUARTER COMPLETE                              
================================================================================

2ND QUARTER SCORE: Team_021 23, Team_046 29

BOX SCORE:
================================================================================

Team_021
--------------------------------------------------------------------------------
Player                MIN  PTS  REB  AST  TO      FG   FG%      3P   3P%
--------------------------------------------------------------------------------
Joel LaVine             9    9    0    0   0   4/6    66.7     0/0   0.0
Kyrie Leonard          15    5    2    1   0   2/3    66.7     0/0   0.0
Victor Mitchell         9    3    1    1   0   1/3    33.3     0/0   0.0
Anthony Oladipo        15    2    0    1   0   1/2    50.0     0/0   0.0
Karl Bridges           15    2    0    0   0   1/1   100.0     0/0   0.0
Vince George            9    2    1    2   0   1/1   100.0     0/0   0.0
Kyrie Wagner           15    0    0    0   0   0/1     0.0     0/0   0.0
Zach Carter            15    0    1    0   0   0/0     0.0     0/0   0.0
Magic Ingram            9    0    3    0   0   0/1     0.0     0/0   0.0
Paul Allen              9    0    0    0   0   0/1     0.0     0/0   0.0

TEAM: FG: 10/19 (52.6%), 3PT: 1/1 (100.0%), REB: 7 (2 off, 5 def), AST: 5, TO: 4
TEAM FOULS: 6 [Team_046 in BONUS]


Team_046
--------------------------------------------------------------------------------
Player                MIN  PTS  REB  AST  TO      FG   FG%      3P   3P%
--------------------------------------------------------------------------------
Chris LaVine            9    9    5    0   0   5/5   100.0     0/0   0.0
Paul DeRozan           12    8    3    1   0   4/6    66.7     0/0   0.0
Collin Butler          12    5    0    0   0   2/5    40.0     0/0   0.0
Cade Wall              15    3    2    0   0   1/1   100.0     0/0   0.0
Josh Barrett            9    2    0    1   0   1/1   100.0     0/0   0.0
Manu Dosunmu            9    2    1    2   0   1/1   100.0     0/0   0.0
Kevin Allen            12    0    0    0   0   0/1     0.0     0/0   0.0
Lauri Carter           15    0    1    0   0   0/0     0.0     0/0   0.0
Victor Nowitzki        15    0    0    1   0   0/0     0.0     0/0   0.0

TEAM: FG: 14/20 (70.0%), 3PT: 2/5 (40.0%), REB: 13 (4 off, 9 def), AST: 5, TO: 3
TEAM FOULS: 3

================================================================================

================================================================================
                       3RD QUARTER - Team_021 vs Team_046                       
================================================================================

[12:00] Team_021 possession (Score: 55-50)
Kyrie Wagner attempts a Layup. Contested by Cade Wall (3.8 feet, MAN). Kyrie Wagner misses. Rebound secured by Lauri Carter.

[11:46] Team_046 possession (Score: 55-50)
Lauri Carter attempts a 3Pt. Contested by Karl Bridges (5.8 feet, MAN). Lauri Carter misses. Rebound secured by Kyrie Leonard.

[11:32] Team_021 possession (Score: 55-50)
Kyrie Leonard attempts a 3Pt. Contested by Lauri Carter (3.1 feet, ZONE). Kyrie Leonard misses. Rebound secured by Kevin Allen.

[11:19] Team_046 possession (Score: 55-50)
Cade Wall attempts a Midrange. Contested by Kyrie Wagner (4.6 feet, MAN). Cade Wall misses. Offensive rebound by Cade Wall! Cade Wall kicks it out.

[11:06] Team_046 possession (Score: 55-50)
FOUL! Reach-in foul on Zach Carter during the drive. [Team fouls: 1] No free throws, side out. (Zach Carter: 1 personal fouls)

[10:50] Team_046 possession (Score: 55-50)
D'Angelo O'Neal makes the Layup and draws the foul on Zach Carter! And-1! D'Angelo O'Neal to the line for 1. [Team fouls: 2] (Zach Carter: 2 personal fouls)   FT 1/1: GOOD D'Angelo O'Neal makes 1/1 from the line.
Score: 55-53

[10:32] Team_021 possession (Score: 55-53)
Karl Bridges drives and kicks out. Kyrie Leonard attempts a Midrange. Contested by D'Angelo O'Neal (4.0 feet, MAN). Kyrie Leonard misses. Rebound secured by Cade Wall.

[10:14] Team_046 possession (Score: 55-53)
Cade Wall drives, Zach Carter stays with him. Cade Wall attempts a Dunk. Contested by Zach Carter (4.6 feet, ZONE). CADE WALL MAKES IT!
Score: 55-55

[10:00] Team_021 possession (Score: 55-55)
Kyrie Wagner attempts a 3Pt. Contested by Lauri Carter (3.3 feet, ZONE). Kyrie Wagner misses. Rebound secured by Lauri Carter.

[09:48] Team_046 possession (Score: 55-55)
Victor Nowitzki drives to the basket... Victor Nowitzki commits a violation (traveling/carry)! TURNOVER! (dead ball)

[09:36] Team_021 possession (Score: 55-55)
Kyrie Wagner loses the ball! Stripped by Cade Wall! TURNOVER! (live ball)

[09:20] Team_046 possession (Score: 55-55)
Victor Nowitzki attempts a 3Pt. Contested by Anthony Oladipo (4.7 feet, MAN). Victor Nowitzki misses. Rebound secured by Anthony Oladipo.

[09:09] Team_021 possession (Score: 55-55)
Anthony Oladipo attempts a 3Pt. Contested by Lauri Carter (3.2 feet, ZONE). Anthony Oladipo misses. Rebound secured by Cade Wall.

[08:54] Team_046 possession (Score: 55-55)
D'Angelo O'Neal attempts a 3Pt. Contested by Kyrie Leonard (4.8 feet, MAN). D'Angelo O'Neal misses. Offensive rebound by Kevin Allen! Kevin Allen kicks it out.

[08:38] Team_046 possession (Score: 55-55)
Victor Nowitzki attempts a 3Pt. Contested by Anthony Oladipo (4.7 feet, ZONE). Victor Nowitzki misses. Rebound secured by Kyrie Leonard.

[08:29] Team_021 possession (Score: 55-55)
Kyrie Wagner makes the Dunk and draws the foul on Cade Wall! And-1! Kyrie Wagner to the line for 1. [Team fouls: 1] (Cade Wall: 1 personal fouls)   FT 1/1: GOOD Kyrie Wagner makes 1/1 from the line.
Score: 58-55

[08:17] Team_046 possession (Score: 58-55)
Kevin Allen attempts a Midrange. Contested by Zach Carter (4.3 feet, MAN). Kevin Allen misses. Rebound secured by Kyrie Leonard.

[08:04] Team_021 possession (Score: 58-55)
Karl Bridges drives to the basket... Karl Bridges loses the ball! Stripped by Lauri Carter! TURNOVER! (live ball)

[07:47] Team_046 possession (Score: 58-55)
FOUL! Shooting foul on Zach Carter. Victor Nowitzki to the line for 2 free throws. [Team fouls: 3] (Zach Carter: 3 personal fouls)   FT 1/2: GOOD   FT 2/2: MISS Victor Nowitzki makes 1/2 from the line. Rebound secured by Zach Carter.
Score: 58-56

[07:33] Team_021 possession (Score: 58-56)
Kyrie Wagner drives, picks up Kevin Allen. Help arrives from D'Angelo O'Neal! Kyrie Wagner attempts a Dunk. Contested by D'Angelo O'Neal (4.7 feet, ZONE). KYRIE WAGNER MAKES IT! Assist: Anthony Oladipo
Score: 60-56

[07:17] Team_046 possession (Score: 60-56)
Lauri Carter attempts a 3Pt. Contested by Kyrie Wagner (4.2 feet, ZONE). Lauri Carter misses. Offensive rebound by Kevin Allen! Kevin Allen kicks it out.

[07:01] Team_046 possession (Score: 60-56)
Cade Wall drives and kicks out. D'Angelo O'Neal attempts a 3Pt. Contested by Kyrie Wagner (4.0 feet, ZONE). D'Angelo O'Neal misses. Rebound secured by Kyrie Leonard.

[06:45] Team_021 possession (Score: 60-56)
Zach Carter attempts a 3Pt. Contested by Kevin Allen (5.0 feet, MAN). Zach Carter misses. Offensive rebound by Zach Carter! Zach Carter kicks it out.

[06:30] Team_021 possession (Score: 60-56)
Karl Bridges attempts a 3Pt. Contested by Lauri Carter (3.1 feet, MAN). Karl Bridges misses. Rebound secured by Kevin Allen.

[06:14] Team_046 possession (Score: 60-56)
Cade Wall drives, Kyrie Wagner stays with him. Cade Wall attempts a Dunk. Contested by Kyrie Wagner (4.6 feet, MAN). Cade Wall misses. Rebound secured by Anthony Oladipo.

[05:56] Team_021 possession (Score: 60-56)
Kyrie Leonard makes the Layup and draws the foul on Kevin Allen! And-1! Kyrie Leonard to the line for 1. [Team fouls: 2] (Kevin Allen: 1 personal fouls)   FT 1/1: GOOD Kyrie Leonard makes 1/1 from the line.
Score: 63-56

[05:42] Team_046 possession (Score: 63-56)
Lauri Carter drives and kicks out. Kevin Allen attempts a 3Pt. Contested by Zach Carter (4.0 feet, MAN). KEVIN ALLEN MAKES IT! Assist: Lauri Carter
Score: 63-59

[05:27] Team_021 possession (Score: 63-59)
Kyrie Wagner drives, picks up Cade Wall. Help arrives from D'Angelo O'Neal! Kyrie Wagner attempts a Layup. Contested by D'Angelo O'Neal (3.8 feet, MAN). Kyrie Wagner misses. Rebound secured by Cade Wall.

[05:09] Team_046 possession (Score: 63-59)
Kevin Allen attempts a Midrange. Contested by Kyrie Leonard (4.9 feet, ZONE). Kevin Allen misses. Rebound secured by Anthony Oladipo.

[04:58] Team_021 possession (Score: 63-59)
Kyrie Wagner drives and kicks out. Zach Carter attempts a 3Pt. Contested by Kevin Allen (4.7 feet, MAN). ZACH CARTER MAKES IT! Assist: Anthony Oladipo
Score: 66-59

[04:41] Team_046 possession (Score: 66-59)
Lauri Carter attempts a Midrange. Contested by Karl Bridges (5.8 feet, ZONE). LAURI CARTER MAKES IT! Assist: Cade Wall
Score: 66-61

[04:27] Team_021 possession (Score: 66-61)
Karl Bridges drives and kicks out. Kyrie Wagner attempts a 3Pt. Contested by Cade Wall (3.8 feet, MAN). Kyrie Wagner misses. Rebound secured by Cade Wall.

[04:10] Team_046 possession (Score: 66-61)
Cade Wall throws a bad pass out of bounds! TURNOVER! (dead ball)

[03:57] Team_021 possession (Score: 66-61)
Karl Bridges attempts a Layup. Contested by Lauri Carter (3.2 feet, MAN). KARL BRIDGES MAKES IT! Assist: Kyrie Leonard
Score: 68-61

[03:42] Team_046 possession (Score: 68-61)
Victor Nowitzki drives to the basket... FOUL! Offensive foul on Victor Nowitzki! Kyrie Wagner drew the charge! [Team fouls: 3] (Victor Nowitzki: 1 personal fouls) TURNOVER! (dead ball)

[03:26] Team_021 possession (Score: 68-61)
FOUL! Reach-in foul on Kevin Allen during the drive. [Team fouls: 4] No free throws, side out. (Kevin Allen: 2 personal fouls)

[03:12] Team_021 possession (Score: 68-61)
Anthony Oladipo attempts a 3Pt. Contested by Lauri Carter (3.4 feet, ZONE). Anthony Oladipo misses. Rebound secured by Lauri Carter.

[03:02] Team_046 possession (Score: 68-61)
Lauri Carter commits a violation (traveling/carry)! TURNOVER! (dead ball)

[03:02] Substitution (Team_046): Kevin Allen OUT → Paul DeRozan IN (stamina_rule2)

[02:49] Team_021 possession (Score: 68-61)
Kyrie Wagner attempts a 3Pt. Contested by Cade Wall (4.1 feet, MAN). Kyrie Wagner misses. Rebound secured by Cade Wall.

[02:36] Team_046 possession (Score: 68-61)
Paul DeRozan drives, Zach Carter stays with him. Paul DeRozan attempts a Layup. Contested by Zach Carter (4.2 feet, MAN). Paul DeRozan misses. Rebound secured by Anthony Oladipo.

[02:23] Team_021 possession (Score: 68-61)
Kyrie Wagner attempts a Layup. Contested by Cade Wall (4.1 feet, MAN). Kyrie Wagner misses. Rebound secured by Cade Wall.

[02:08] Team_046 possession (Score: 68-61)
Victor Nowitzki attempts a 3Pt. Contested by Kyrie Wagner (4.4 feet, ZONE). VICTOR NOWITZKI MAKES IT! Assist: Paul DeRozan
Score: 68-64

[01:56] Team_021 possession (Score: 68-64)
Anthony Oladipo attempts a Midrange. Contested by Victor Nowitzki (5.7 feet, ZONE). Anthony Oladipo misses. Rebound secured by Lauri Carter.

[01:40] Team_046 possession (Score: 68-64)
Cade Wall attempts a Layup. Contested by Kyrie Wagner (4.9 feet, MAN). CADE WALL MAKES IT! Assist: Lauri Carter
Score: 68-66

[01:25] Team_021 possession (Score: 68-66)
Zach Carter makes the Layup and draws the foul on Paul DeRozan! And-1! Zach Carter to the line for 1. [BONUS: 5 team fouls] (Paul DeRozan: 1 personal fouls)   FT 1/1: GOOD Zach Carter makes 1/1 from the line.
Score: 71-66

[01:11] Team_046 possession (Score: 71-66)
Cade Wall drives, picks up Zach Carter. Help arrives from Kyrie Leonard! Cade Wall attempts a Dunk. Contested by Kyrie Leonard (5.0 feet, ZONE). CADE WALL MAKES IT! Assist: Lauri Carter
Score: 71-68

[00:54] Team_021 possession (Score: 71-68)
Zach Carter drives, picks up Paul DeRozan. Help arrives from D'Angelo O'Neal! Zach Carter attempts a Layup. Contested by D'Angelo O'Neal (5.3 feet, ZONE). ZACH CARTER MAKES IT!
Score: 73-68

[00:38] Team_046 possession (Score: 73-68)
D'Angelo O'Neal makes the Layup and draws the foul on Zach Carter! And-1! D'Angelo O'Neal to the line for 1. [Team fouls: 4] (Zach Carter: 4 personal fouls)   FT 1/1: MISS D'Angelo O'Neal makes 0/1 from the line. Offensive rebound by Cade Wall! Cade Wall kicks it out.
Score: 73-70

[00:25] Team_046 possession (Score: 73-70)
Lauri Carter throws a bad pass out of bounds! TURNOVER! (dead ball)

[00:25] Substitution (Team_021): Kyrie Leonard OUT → Joel LaVine IN (stamina_rule2)

[00:25] Substitution (Team_021): Anthony Oladipo OUT → Victor Mitchell IN (stamina_rule2)

[00:25] Substitution (Team_021): Karl Bridges OUT → Paul Allen IN (stamina_rule2)

[00:25] Substitution (Team_021): Kyrie Wagner OUT → Vince George IN (stamina_rule2)

[00:25] Substitution (Team_021): Zach Carter OUT → Magic Ingram IN (stamina_rule2)

[00:25] Substitution (Team_046): D'Angelo O'Neal OUT → Collin Butler IN (stamina_rule2)

[00:25] Substitution (Team_046): Victor Nowitzki OUT → Manu Dosunmu IN (stamina_rule2)

[00:25] Substitution (Team_046): Lauri Carter OUT → Josh Barrett IN (stamina_rule2)

[00:25] Substitution (Team_046): Cade Wall OUT → Chris LaVine IN (stamina_rule2)

[00:15] Team_021 possession (Score: 73-70)
Paul Allen makes the Dunk and draws the foul on Josh Barrett! And-1! Paul Allen to the line for 1. [BONUS: 6 team fouls] (Josh Barrett: 1 personal fouls)   FT 1/1: GOOD Paul Allen makes 1/1 from the line.
Score: 76-70

[00:05] Team_046 possession (Score: 76-70)
FOUL! Offensive foul on Josh Barrett! Paul Allen drew the charge! [Team fouls: 7] (Josh Barrett: 2 personal fouls) TURNOVER! (dead ball)

================================================================================
                              3RD QUARTER COMPLETE                              
================================================================================

3RD QUARTER SCORE: Team_021 21, Team_046 20

BOX SCORE:
================================================================================

Team_021
--------------------------------------------------------------------------------
Player                MIN  PTS  REB  AST  TO      FG   FG%      3P   3P%
--------------------------------------------------------------------------------
Zach Carter            26    8    2    0   0   3/3   100.0     0/0   0.0
Kyrie Wagner           26    5    0    0   0   2/7    28.6     0/0   0.0
Kyrie Leonard          26    3    4    1   0   1/2    50.0     0/0   0.0
Paul Allen             10    3    0    0   0   1/1   100.0     0/0   0.0
Karl Bridges           26    2    0    0   0   1/4    25.0     0/0   0.0
Anthony Oladipo        26    0    4    2   0   0/3     0.0     0/0   0.0

TEAM: FG: 8/20 (40.0%), 3PT: 0/6 (0.0%), REB: 10 (1 off, 9 def), AST: 3, TO: 2
TEAM FOULS: 4


Team_046
--------------------------------------------------------------------------------
Player                MIN  PTS  REB  AST  TO      FG   FG%      3P   3P%
--------------------------------------------------------------------------------
Cade Wall              26    6    8    1   0   3/5    60.0     0/0   0.0
Kevin Allen            21    3    4    0   0   1/3    33.3     0/0   0.0
D'Angelo O'Neal        23    3    0    0   0   1/1   100.0     0/0   0.0
Victor Nowitzki        26    3    0    0   0   1/4    25.0     0/0   0.0
Lauri Carter           26    2    4    3   0   1/2    50.0     0/0   0.0
Paul DeRozan           15    0    0    1   0   0/1     0.0     0/0   0.0

TEAM: FG: 7/16 (43.8%), 3PT: 1/4 (25.0%), REB: 16 (4 off, 12 def), AST: 5, TO: 6
TEAM FOULS: 7 [Team_021 in BONUS]

================================================================================

================================================================================
                       4TH QUARTER - Team_021 vs Team_046                       
================================================================================

[12:00] Team_021 possession (Score: 76-70)
Karl Bridges drives, picks up Kevin Allen. Help arrives from D'Angelo O'Neal! Karl Bridges attempts a Layup. Contested by D'Angelo O'Neal (4.5 feet, ZONE). Karl Bridges misses. Offensive rebound by Kyrie Leonard! Kyrie Leonard kicks it out.

[11:42] Team_021 possession (Score: 76-70)
Kyrie Leonard attempts a 3Pt. Contested by Lauri Carter (3.4 feet, ZONE). Kyrie Leonard misses. Offensive rebound by Kyrie Leonard! Kyrie Leonard kicks it out.

[11:26] Team_021 possession (Score: 76-70)
Kyrie Leonard attempts a Layup. BLOCKED BY KEVIN ALLEN! Ball is loose! Rebound secured by Cade Wall.

[11:13] Team_046 possession (Score: 76-70)
D'Angelo O'Neal drives, Kyrie Leonard stays with him. D'Angelo O'Neal attempts a Layup. Contested by Kyrie Leonard (5.0 feet, MAN). D'Angelo O'Neal misses. Offensive rebound by Kevin Allen! Kevin Allen kicks it out.

[11:01] Team_046 possession (Score: 76-70)
D'Angelo O'Neal drives, Kyrie Leonard stays with him. D'Angelo O'Neal attempts a Dunk. Contested by Kyrie Leonard (5.1 feet, MAN). D'ANGELO O'NEAL MAKES IT!
Score: 76-72

[10:46] Team_021 possession (Score: 76-72)
Zach Carter throws a bad pass out of bounds! TURNOVER! (dead ball)

[10:46] Substitution (Team_021): Kyrie Leonard OUT → Joel LaVine IN (stamina_rule2)

[10:46] Substitution (Team_021): Anthony Oladipo OUT → Victor Mitchell IN (stamina_rule2)

[10:46] Substitution (Team_021): Karl Bridges OUT → Paul Allen IN (stamina_rule2)

[10:46] Substitution (Team_021): Kyrie Wagner OUT → Vince George IN (stamina_rule2)

[10:46] Substitution (Team_021): Zach Carter OUT → Magic Ingram IN (stamina_rule2)

[10:46] Substitution (Team_046): D'Angelo O'Neal OUT → Collin Butler IN (stamina_rule2)

[10:46] Substitution (Team_046): Victor Nowitzki OUT → Manu Dosunmu IN (stamina_rule2)

[10:46] Substitution (Team_046): Lauri Carter OUT → Josh Barrett IN (stamina_rule2)

[10:46] Substitution (Team_046): Cade Wall OUT → Chris LaVine IN (stamina_rule2)

[10:34] Team_046 possession (Score: 76-72)
FOUL! Reach-in foul on Joel LaVine during the drive. [Team fouls: 1] No free throws, side out. (Joel LaVine: 1 personal fouls)

[10:18] Team_046 possession (Score: 76-72)
Collin Butler attempts a 3Pt. Wide open! Joel LaVine is 6.2 feet away. [MAN] COLLIN BUTLER MAKES IT! Assist: Manu Dosunmu
Score: 76-75

[10:06] Team_021 possession (Score: 76-75)
Paul Allen commits a violation (traveling/carry)! TURNOVER! (dead ball)

[09:54] Team_046 possession (Score: 76-75)
Manu Dosunmu drives and kicks out. Chris LaVine attempts a 3Pt. Contested by Vince George (5.0 feet, MAN). Chris LaVine misses. Rebound secured by Vince George.

[09:40] Team_021 possession (Score: 76-75)
Joel LaVine attempts a 3Pt. Contested by Collin Butler (3.7 feet, ZONE). JOEL LAVINE MAKES IT! Assist: Vince George
Score: 79-75

[09:28] Team_046 possession (Score: 79-75)
Chris LaVine attempts a Midrange. Wide open! Joel LaVine is 6.4 feet away. [ZONE] Chris LaVine misses. Rebound secured by Victor Mitchell.

[09:14] Team_021 possession (Score: 79-75)
Joel LaVine attempts a Midrange. Contested by Collin Butler (3.7 feet, MAN). Joel LaVine misses. Rebound secured by Manu Dosunmu.

[08:55] Team_046 possession (Score: 79-75)
Manu Dosunmu makes the Layup and draws the foul on Paul Allen! And-1! Manu Dosunmu to the line for 1. [Team fouls: 2] (Paul Allen: 1 personal fouls)   FT 1/1: GOOD Manu Dosunmu makes 1/1 from the line.
Score: 79-78

[08:40] Team_021 possession (Score: 79-78)
FOUL! Shooting foul on Chris LaVine. Vince George to the line for 2 free throws. [Team fouls: 1] (Chris LaVine: 1 personal fouls)   FT 1/2: GOOD   FT 2/2: GOOD Vince George makes 2/2 from the line.
Score: 81-78

[08:23] Team_046 possession (Score: 81-78)
Collin Butler attempts a Midrange. Wide open! Joel LaVine is 6.2 feet away. [MAN] COLLIN BUTLER MAKES IT! Assist: Manu Dosunmu
Score: 81-80

[08:09] Team_021 possession (Score: 81-80)
FOUL! Reach-in foul on Chris LaVine during the drive. [Team fouls: 2] No free throws, side out. (Chris LaVine: 2 personal fouls)

[07:52] Team_021 possession (Score: 81-80)
FOUL! Reach-in foul on Chris LaVine during the drive. [Team fouls: 3] No free throws, side out. (Chris LaVine: 3 personal fouls)

[07:34] Team_021 possession (Score: 81-80)
Magic Ingram drives, Chris LaVine stays with him. Magic Ingram attempts a Dunk. Contested by Chris LaVine (4.0 feet, ZONE). Magic Ingram misses. FOUL! Loose ball foul on Chris LaVine during the rebound battle. [Team fouls: 4] No free throws, side out. (Chris LaVine: 4 personal fouls)

[07:15] Team_021 possession (Score: 81-80)
Victor Mitchell attempts a Midrange. Contested by Josh Barrett (4.8 feet, ZONE). VICTOR MITCHELL MAKES IT! Assist: Magic Ingram
Score: 83-80

[07:00] Team_046 possession (Score: 83-80)
Collin Butler attempts a 3Pt. Wide open! Joel LaVine is 6.2 feet away. [MAN] Collin Butler misses. FOUL! Loose ball foul on Vince George during the rebound battle. [Team fouls: 3] No free throws, side out. (Vince George: 1 personal fouls)

[06:44] Team_046 possession (Score: 83-80)
Collin Butler attempts a 3Pt. Contested by Victor Mitchell (4.5 feet, ZONE). Collin Butler misses. Rebound secured by Vince George.

[06:31] Team_021 possession (Score: 83-80)
Joel LaVine drives to the basket... Joel LaVine commits a violation (traveling/carry)! TURNOVER! (dead ball)

[06:31] Substitution (Team_046): Kevin Allen OUT → Paul DeRozan IN (stamina_rule2)

[06:20] Team_046 possession (Score: 83-80)
Manu Dosunmu attempts a 3Pt. Contested by Victor Mitchell (4.7 feet, MAN). Manu Dosunmu misses. Rebound secured by Magic Ingram.

[06:06] Team_021 possession (Score: 83-80)
Vince George attempts a 3Pt. Contested by Chris LaVine (3.8 feet, MAN). Vince George misses. Rebound secured by Paul DeRozan.

[05:52] Team_046 possession (Score: 83-80)
Chris LaVine attempts a Layup. Contested by Magic Ingram (5.5 feet, ZONE). CHRIS LAVINE MAKES IT!
Score: 83-82

[05:35] Team_021 possession (Score: 83-82)
Joel LaVine attempts a Midrange. Contested by Collin Butler (3.7 feet, MAN). Joel LaVine misses. Rebound secured by Manu Dosunmu.

[05:21] Team_046 possession (Score: 83-82)
FOUL! Holding foul on Paul Allen. [Team fouls: 4] No free throws, side out. (Paul Allen: 2 personal fouls)

[05:07] Team_046 possession (Score: 83-82)
Collin Butler attempts a 3Pt. Wide open! Joel LaVine is 6.2 feet away. [MAN] COLLIN BUTLER MAKES IT!
Score: 83-85

[04:54] Team_021 possession (Score: 83-85)
FOUL! Offensive foul on Magic Ingram! Chris LaVine drew the charge! [Team fouls: 5] (Magic Ingram: 1 personal fouls) TURNOVER! (dead ball)

[04:43] Team_046 possession (Score: 83-85)
Manu Dosunmu makes the Dunk and draws the foul on Magic Ingram! And-1! Manu Dosunmu to the line for 1. [BONUS: 6 team fouls] (Magic Ingram: 2 personal fouls)   FT 1/1: GOOD Manu Dosunmu makes 1/1 from the line.
Score: 83-88

[04:32] Team_021 possession (Score: 83-88)
Vince George drives, Chris LaVine stays with him. Vince George attempts a Layup. Contested by Chris LaVine (3.8 feet, ZONE). Vince George misses. Rebound secured by Chris LaVine.

[04:15] Team_046 possession (Score: 83-88)
Collin Butler attempts a 3Pt. Contested by Victor Mitchell (4.5 feet, ZONE). Collin Butler misses. Rebound secured by Vince George.

[04:02] Team_021 possession (Score: 83-88)
Paul Allen makes the Midrange and draws the foul on Josh Barrett! And-1! Paul Allen to the line for 1. [BONUS: 5 team fouls] (Josh Barrett: 1 personal fouls)   FT 1/1: MISS Paul Allen makes 0/1 from the line. Rebound secured by Paul DeRozan.
Score: 85-88

[03:51] Team_046 possession (Score: 85-88)
Collin Butler attempts a 3Pt. Contested by Victor Mitchell (4.5 feet, ZONE). COLLIN BUTLER MAKES IT! Assist: Josh Barrett
Score: 85-91

[03:38] Team_021 possession (Score: 85-91)
Joel LaVine attempts a Midrange. Contested by Manu Dosunmu (4.7 feet, ZONE). JOEL LAVINE MAKES IT! Assist: Paul Allen
Score: 87-91

[03:24] Team_046 possession (Score: 87-91)
Josh Barrett throws a bad pass out of bounds! TURNOVER! (dead ball)

[03:06] Team_021 possession (Score: 87-91)
FOUL! Holding foul on Josh Barrett. [IN THE BONUS! 6 team fouls] Paul Allen to the line for 2 free throws. (Josh Barrett: 2 personal fouls)   FT 1/2: GOOD   FT 2/2: MISS Paul Allen makes 1/2 from the line. Rebound secured by Chris LaVine.
Score: 88-91

[02:54] Team_046 possession (Score: 88-91)
Collin Butler attempts a 3Pt. Wide open! Joel LaVine is 6.2 feet away. [MAN] Collin Butler misses. Rebound secured by Victor Mitchell.

[02:38] Team_021 possession (Score: 88-91)
Victor Mitchell throws a bad pass out of bounds! TURNOVER! (dead ball)

[02:19] Team_046 possession (Score: 88-91)
Manu Dosunmu attempts a Layup. Contested by Magic Ingram (5.7 feet, ZONE). MANU DOSUNMU MAKES IT!
Score: 88-93

[02:06] Team_021 possession (Score: 88-93)
Paul Allen drives to the basket... Paul Allen throws a bad pass out of bounds! TURNOVER! (dead ball)

[01:49] Team_046 possession (Score: 88-93)
Chris LaVine attempts a 3Pt. Contested by Victor Mitchell (4.9 feet, ZONE). Chris LaVine misses. Offensive rebound by Paul DeRozan! Paul DeRozan puts it back in!
Score: 88-95

[01:35] Team_021 possession (Score: 88-95)
Magic Ingram attempts a Layup. Contested by Paul DeRozan (5.0 feet, ZONE). Magic Ingram misses. Rebound secured by Manu Dosunmu.

[01:21] Team_046 possession (Score: 88-95)
FOUL! Holding foul on Vince George. [IN THE BONUS! 7 team fouls] Chris LaVine to the line for 2 free throws. (Vince George: 2 personal fouls)   FT 1/2: GOOD   FT 2/2: MISS Chris LaVine makes 1/2 from the line. Rebound secured by Magic Ingram.
Score: 88-96

[01:03] Team_021 possession (Score: 88-96)
Vince George attempts a 3Pt. Contested by Chris LaVine (4.1 feet, MAN). Vince George misses. Rebound secured by Chris LaVine.

[00:53] Team_046 possession (Score: 88-96)
Chris LaVine drives to the basket... FOUL! Offensive foul on Chris LaVine! Vince George drew the charge! [Team fouls: 7] (Chris LaVine: 5 personal fouls) TURNOVER! (dead ball)

[00:38] Team_021 possession (Score: 88-96)
Victor Mitchell attempts a 3Pt. Contested by Collin Butler (4.2 feet, ZONE). VICTOR MITCHELL MAKES IT! Assist: Vince George
Score: 91-96

[00:23] Team_046 possession (Score: 91-96)
Manu Dosunmu makes the Layup and draws the foul on Victor Mitchell! And-1! Manu Dosunmu to the line for 1. [BONUS: 8 team fouls] (Victor Mitchell: 1 personal fouls)   FT 1/1: GOOD Manu Dosunmu makes 1/1 from the line.
Score: 91-99

[00:10] Team_021 possession (Score: 91-99)
Victor Mitchell attempts a 3Pt. Contested by Manu Dosunmu (5.2 feet, MAN). Victor Mitchell misses. Offensive rebound by Vince George! Vince George kicks it out.

================================================================================
                              4TH QUARTER COMPLETE                              
================================================================================

4TH QUARTER SCORE: Team_021 15, Team_046 29

BOX SCORE:
================================================================================

Team_021
--------------------------------------------------------------------------------
Player                MIN  PTS  REB  AST  TO      FG   FG%      3P   3P%
--------------------------------------------------------------------------------
Joel LaVine            20    5    0    0   0   2/4    50.0     0/0   0.0
Victor Mitchell        20    5    2    0   0   2/2   100.0     0/0   0.0
Vince George           20    2    5    2   0   1/4    25.0     0/0   0.0
Kyrie Leonard          28    0    2    0   0   0/1     0.0     0/0   0.0
Magic Ingram           20    0    2    1   0   0/1     0.0     0/0   0.0
Paul Allen             20    0    0    1   0   0/1     0.0     0/0   0.0

TEAM: FG: 5/14 (35.7%), 3PT: 2/4 (50.0%), REB: 11 (4 off, 7 def), AST: 4, TO: 6
TEAM FOULS: 8 [Team_046 in BONUS]


Team_046
--------------------------------------------------------------------------------
Player                MIN  PTS  REB  AST  TO      FG   FG%      3P   3P%
--------------------------------------------------------------------------------
Collin Butler          23   11    0    0   0   4/7    57.1     0/0   0.0
Manu Dosunmu           20   11    3    2   0   4/6    66.7     0/0   0.0
D'Angelo O'Neal        25    2    0    0   0   1/1   100.0     0/0   0.0
Chris LaVine           20    2    4    0   0   1/2    50.0     0/0   0.0
Paul DeRozan           22    2    3    0   0   1/1   100.0     0/0   0.0
Cade Wall              28    0    1    0   0   0/0     0.0     0/0   0.0
Kevin Allen            27    0    1    0   0   0/0     0.0     0/0   0.0
Josh Barrett           20    0    0    1   0   0/0     0.0     0/0   0.0

TEAM: FG: 11/18 (61.1%), 3PT: 4/8 (50.0%), REB: 12 (3 off, 9 def), AST: 3, TO: 2
TEAM FOULS: 7 [Team_021 in BONUS]

================================================================================

================================================================================
                               FULL GAME COMPLETE                               
================================================================================

FINAL SCORE: Team_021 91, Team_046 99

SCORING BY QUARTER:
--------------------------------------------------------------------------------
Team                     Q1     Q2     Q3     Q4    FINAL
--------------------------------------------------------------------------------
Team_021                 32     23     21     15       91
Team_046                 21     29     20     29       99
--------------------------------------------------------------------------------

FULL GAME BOX SCORE:
================================================================================

Team_021
--------------------------------------------------------------------------------
Player                MIN  PTS  REB  AST  TO      FG   FG%      3P   3P%      FT STL BLK
--------------------------------------------------------------------------------
Kyrie Leonard          28   17   11    2   2   8/13   61.5   1/4    25.0   8/8     1   0
Anthony Oladipo        28    2    7    4   0   3/7    42.9   1/3    33.3   0/0     0   0
Karl Bridges           28   11    0    0   3   4/8    50.0   1/3    33.3   2/2     0   0
Kyrie Wagner           28    7    0    1   3   4/10   40.0   0/2     0.0   3/3     1   0
Zach Carter            28   17    7    1   1   4/5    80.0   1/1   100.0   8/9     0   0
Joel LaVine            20   17    0    0   1   7/11   63.6   3/3   100.0   0/0     0   0
Victor Mitchell        20    8    4    1   2   3/5    60.0   1/1   100.0   1/1     0   0
Paul Allen             20    3    0    1   2   1/3    33.3   0/0     0.0   2/4     0   0
Vince George           20    6    7    4   1   3/6    50.0   0/2     0.0   2/2     0   0
Magic Ingram           20    0    5    1   3   0/2     0.0   0/0     0.0   0/0     0   0

TEAM: FG: 37/71 (52.1%), 3PT: 8/19 (42.1%), REB: 40 (9 off, 31 def), AST: 15, TO: 18


Team_046
--------------------------------------------------------------------------------
Player                MIN  PTS  REB  AST  TO      FG   FG%      3P   3P%      FT STL BLK
--------------------------------------------------------------------------------
Victor Nowitzki        28    3    0    1   1   2/7    28.6   1/4    25.0   1/2     0   0
Lauri Carter           28    8    7    3   2   5/8    62.5   0/2     0.0   1/3     1   0
Cade Wall              28   13   14    3   5   6/9    66.7   0/0     0.0   1/1     4   0
Kevin Allen            27    3    6    3   1   0/5     0.0   0/0     0.0   0/0     0   1
D'Angelo O'Neal        25   13    0    1   0   6/7    85.7   0/1     0.0   1/2     0   0
Collin Butler          23   16    0    0   1   7/13   53.8   5/10   50.0   0/0     1   0
Paul DeRozan           22   10    6    2   0   2/5    40.0   0/1     0.0   0/0     0   0
Manu Dosunmu           20   13    4    4   0   5/8    62.5   0/1     0.0   5/5     0   0
Josh Barrett           20    2    0    2   4   1/1   100.0   0/0     0.0   2/2     1   1
Chris LaVine           20   13    9    0   0   8/10   80.0   1/2    50.0   4/6     1   0

TEAM: FG: 42/74 (56.8%), 3PT: 7/21 (33.3%), REB: 47 (13 off, 34 def), AST: 19, TO: 14

================================================================================
