================================================================================
                        FULL GAME - Team_004 vs Team_014                        
================================================================================

================================================================================
                       1ST QUARTER - Team_004 vs Team_014                       
================================================================================

[12:00] Team_004 possession (Score: 0-0)
Jabari Wade attempts a 3Pt. Contested by Jordan Anunoby (5.4 feet, MAN). JABARI WADE MAKES IT!
Score: 3-0

[11:48] Team_014 possession (Score: 3-0)
Jordan Anunoby drives, picks up Anthony Lillard. Help arrives from Jabari Wade! Jordan Anunoby attempts a Layup. Contested by Jabari Wade (4.4 feet, ZONE). JORDAN ANUNOBY MAKES IT! Assist: Michael Cunningham
Score: 3-2

[11:32] Team_004 possession (Score: 3-2)
Michael Curry attempts a Midrange. Contested by Michael Cunningham (4.2 feet, MAN). Michael Curry misses. Rebound secured by DeMar Adebayo.

[11:16] Team_014 possession (Score: 3-2)
Michael Cunningham drives to the basket... Michael Cunningham throws a bad pass out of bounds! TURNOVER! (dead ball)

[10:57] Team_004 possession (Score: 3-2)
Jabari Wade attempts a 3Pt. Contested by Jordan Anunoby (5.4 feet, MAN). Jabari Wade misses. Rebound secured by Ayo Murray.

[10:41] Team_014 possession (Score: 3-2)
FOUL! Reach-in foul on Anthony Lillard during the drive. [Team fouls: 1] No free throws, side out. (Anthony Lillard: 1 personal fouls)

[10:23] Team_014 possession (Score: 3-2)
Ayo Murray drives, Anthony Lillard stays with him. Ayo Murray attempts a Layup. Contested by Anthony Lillard (4.5 feet, MAN). AYO MURRAY MAKES IT! Assist: Jordan Anunoby
Score: 3-4

[10:14] Team_004 possession (Score: 3-4)
Dwyane Irving attempts a 3Pt. Contested by Lamelo Simmons (4.3 feet, MAN). Dwyane Irving misses. Rebound secured by Michael Cunningham.

[10:02] Team_014 possession (Score: 3-4)
Jordan Anunoby drives to the basket... FOUL! Offensive foul on Jordan Anunoby! Anthony Lillard drew the charge! [Team fouls: 1] (Jordan Anunoby: 1 personal fouls) TURNOVER! (dead ball)

[09:51] Team_004 possession (Score: 3-4)
Michael Curry attempts a Midrange. Contested by Michael Cunningham (4.2 feet, MAN). MICHAEL CURRY MAKES IT! Assist: Jabari Wade
Score: 5-4

[09:36] Team_014 possession (Score: 5-4)
Jordan Anunoby attempts a 3Pt. Contested by Draymond Fox (4.4 feet, ZONE). JORDAN ANUNOBY MAKES IT! Assist: Lamelo Simmons
Score: 5-7

[09:19] Team_004 possession (Score: 5-7)
Jabari Wade attempts a Midrange. Contested by Ayo Murray (5.5 feet, ZONE). Jabari Wade misses. Rebound secured by Ayo Murray.

[09:01] Team_014 possession (Score: 5-7)
Jordan Anunoby makes the Layup and draws the foul on Jabari Wade! And-1! Jordan Anunoby to the line for 1. [Team fouls: 2] (Jabari Wade: 1 personal fouls)   FT 1/1: GOOD Jordan Anunoby makes 1/1 from the line.
Score: 5-10

[08:45] Team_004 possession (Score: 5-10)
Draymond Fox attempts a Midrange. Contested by DeMar Adebayo (3.5 feet, MAN). Draymond Fox misses. Rebound secured by Michael Cunningham.

[08:29] Team_014 possession (Score: 5-10)
Michael Cunningham attempts a Midrange. Contested by Michael Curry (4.8 feet, MAN). Michael Cunningham misses. Rebound secured by Anthony Lillard.

[08:15] Team_004 possession (Score: 5-10)
Anthony Lillard attempts a Midrange. Contested by Ayo Murray (5.2 feet, MAN). ANTHONY LILLARD MAKES IT!
Score: 7-10

[08:00] Team_014 possession (Score: 7-10)
Michael Cunningham attempts a Layup. Contested by Anthony Lillard (3.9 feet, ZONE). MICHAEL CUNNINGHAM MAKES IT! Assist: DeMar Adebayo
Score: 7-12

[07:43] Team_004 possession (Score: 7-12)
Anthony Lillard attempts a Layup. Contested by DeMar Adebayo (3.5 feet, ZONE). Anthony Lillard misses. Rebound secured by Michael Cunningham.

[07:29] Team_014 possession (Score: 7-12)
Lamelo Simmons drives and kicks out. Ayo Murray attempts a Midrange. Contested by Anthony Lillard (4.1 feet, MAN). AYO MURRAY MAKES IT! Assist: Lamelo Simmons
Score: 7-14

[07:17] Team_004 possession (Score: 7-14)
Michael Curry attempts a Midrange. Contested by Michael Cunningham (4.2 feet, MAN). MICHAEL CURRY MAKES IT!
Score: 9-14

[07:05] Team_014 possession (Score: 9-14)
Lamelo Simmons attempts a Layup. Contested by Dwyane Irving (4.0 feet, MAN). Lamelo Simmons misses. Rebound secured by Dwyane Irving.

[06:53] Team_004 possession (Score: 9-14)
Dwyane Irving attempts a Midrange. Contested by Jordan Anunoby (5.0 feet, ZONE). Dwyane Irving misses. Rebound secured by DeMar Adebayo.

[06:37] Team_014 possession (Score: 9-14)
Michael Cunningham attempts a 3Pt. Contested by Michael Curry (4.8 feet, MAN). Michael Cunningham misses. Rebound secured by Anthony Lillard.

[06:23] Team_004 possession (Score: 9-14)
FOUL! Reach-in foul on Lamelo Simmons during the drive. [Team fouls: 2] No free throws, side out. (Lamelo Simmons: 1 personal fouls)

[06:09] Team_004 possession (Score: 9-14)
Dwyane Irving drives to the basket... Dwyane Irving commits a violation (traveling/carry)! TURNOVER! (dead ball)

[05:54] Team_014 possession (Score: 9-14)
Jordan Anunoby attempts a 3Pt. Contested by Jabari Wade (5.0 feet, MAN). JORDAN ANUNOBY MAKES IT! Assist: DeMar Adebayo
Score: 9-17

[05:39] Team_004 possession (Score: 9-17)
Anthony Lillard drives and kicks out. Anthony Lillard attempts a Midrange. Contested by Lamelo Simmons (4.0 feet, ZONE). Anthony Lillard misses. Offensive rebound by Anthony Lillard! Anthony Lillard kicks it out.

[05:21] Team_004 possession (Score: 9-17)
Dwyane Irving attempts a 3Pt. Contested by DeMar Adebayo (3.4 feet, ZONE). Dwyane Irving misses. Rebound secured by Ayo Murray.

[05:05] Team_014 possession (Score: 9-17)
DeMar Adebayo makes the Dunk and draws the foul on Draymond Fox! And-1! DeMar Adebayo to the line for 1. [Team fouls: 3] (Draymond Fox: 1 personal fouls)   FT 1/1: MISS DeMar Adebayo makes 0/1 from the line. Rebound secured by Anthony Lillard.
Score: 9-19

[04:50] Team_004 possession (Score: 9-19)
Jabari Wade attempts a 3Pt. Contested by Jordan Anunoby (5.4 feet, MAN). JABARI WADE MAKES IT! Assist: Draymond Fox
Score: 12-19

[04:34] Team_014 possession (Score: 12-19)
DeMar Adebayo attempts a Layup. Contested by Anthony Lillard (4.1 feet, ZONE). DEMAR ADEBAYO MAKES IT! Assist: Jordan Anunoby
Score: 12-21

[04:16] Team_004 possession (Score: 12-21)
Jabari Wade attempts a Layup. BLOCKED BY JORDAN ANUNOBY! Ball is loose! Rebound secured by Ayo Murray.

[04:02] Team_014 possession (Score: 12-21)
DeMar Adebayo attempts a Midrange. Contested by Jabari Wade (4.7 feet, ZONE). DEMAR ADEBAYO MAKES IT!
Score: 12-23

[03:52] Team_004 possession (Score: 12-23)
Dwyane Irving attempts a 3Pt. Contested by Jordan Anunoby (5.1 feet, ZONE). Dwyane Irving misses. Rebound secured by Ayo Murray.

[03:34] Team_014 possession (Score: 12-23)
Ayo Murray attempts a Midrange. Contested by Draymond Fox (4.6 feet, ZONE). Ayo Murray misses. Rebound secured by Dwyane Irving.

[03:20] Team_004 possession (Score: 12-23)
Anthony Lillard drives, Ayo Murray stays with him. Anthony Lillard attempts a Layup. Contested by Ayo Murray (5.3 feet, MAN). Anthony Lillard misses. Rebound secured by Ayo Murray.

[03:04] Team_014 possession (Score: 12-23)
FOUL! Shooting foul on Jabari Wade. Lamelo Simmons to the line for 2 free throws. [Team fouls: 4] (Jabari Wade: 2 personal fouls)   FT 1/2: GOOD   FT 2/2: GOOD Lamelo Simmons makes 2/2 from the line.
Score: 12-25

[02:51] Team_004 possession (Score: 12-25)
Jabari Wade attempts a 3Pt. Contested by Jordan Anunoby (5.5 feet, ZONE). Jabari Wade misses. FOUL! Loose ball foul on DeMar Adebayo during the rebound battle. [Team fouls: 3] No free throws, side out. (DeMar Adebayo: 1 personal fouls)

[02:36] Team_004 possession (Score: 12-25)
Jabari Wade attempts a 3Pt. Contested by Jordan Anunoby (5.6 feet, MAN). Jabari Wade misses. Rebound secured by Ayo Murray.

[02:24] Team_014 possession (Score: 12-25)
Ayo Murray drives, Anthony Lillard stays with him. Ayo Murray attempts a Dunk. Contested by Anthony Lillard (4.8 feet, ZONE). AYO MURRAY MAKES IT! Assist: DeMar Adebayo
Score: 12-27

[02:12] Team_004 possession (Score: 12-27)
Dwyane Irving attempts a 3Pt. Contested by Lamelo Simmons (4.7 feet, MAN). Dwyane Irving misses. Rebound secured by Ayo Murray.

[02:01] Team_014 possession (Score: 12-27)
Ayo Murray attempts a Layup. Contested by Anthony Lillard (4.8 feet, MAN). AYO MURRAY MAKES IT! Assist: Jordan Anunoby
Score: 12-29

[01:52] Team_004 possession (Score: 12-29)
Draymond Fox attempts a Layup. BLOCKED BY MICHAEL CUNNINGHAM! Ball deflects out of bounds off Draymond Fox.

[01:39] Team_014 possession (Score: 12-29)
Ayo Murray drives to the basket... Ayo Murray loses the ball! Stripped by Anthony Lillard! TURNOVER! (live ball)

[01:26] Team_004 possession (Score: 12-29)
Jabari Wade throws a bad pass! Stolen by Jordan Anunoby! TURNOVER! (live ball)

[01:15] Team_014 possession (Score: 12-29)
DeMar Adebayo attempts a 3Pt. Contested by Michael Curry (5.3 feet, ZONE). DeMar Adebayo misses. Rebound secured by Anthony Lillard.

[01:04] Team_004 possession (Score: 12-29)
Jabari Wade attempts a Midrange. Contested by Ayo Murray (5.8 feet, ZONE). Jabari Wade misses. Rebound secured by Ayo Murray.

[00:46] Team_014 possession (Score: 12-29)
Jordan Anunoby attempts a 3Pt. Contested by Jabari Wade (5.4 feet, MAN). Jordan Anunoby misses. Offensive rebound by DeMar Adebayo! DeMar Adebayo kicks it out.

[00:30] Team_014 possession (Score: 12-29)
Jordan Anunoby makes the Layup and draws the foul on Jabari Wade! And-1! Jordan Anunoby to the line for 1. [BONUS: 5 team fouls] (Jabari Wade: 3 personal fouls)   FT 1/1: GOOD Jordan Anunoby makes 1/1 from the line.
Score: 12-32

[00:15] Team_004 possession (Score: 12-32)
Anthony Lillard attempts a Layup. Contested by DeMar Adebayo (4.1 feet, ZONE). ANTHONY LILLARD MAKES IT!
Score: 14-32

================================================================================
                              1ST QUARTER COMPLETE                              
================================================================================

1ST QUARTER SCORE: Team_004 14, Team_014 32

BOX SCORE:
================================================================================

Team_004
--------------------------------------------------------------------------------
Player                MIN  PTS  REB  AST  TO      FG   FG%      3P   3P%
--------------------------------------------------------------------------------
Jabari Wade            12    6    0    1   0   2/7    28.6     0/0   0.0
Michael Curry          12    4    0    0   0   2/3    66.7     0/0   0.0
Anthony Lillard        12    4    6    0   0   2/4    50.0     0/0   0.0
Dwyane Irving          12    0    2    0   0   0/5     0.0     0/0   0.0
Draymond Fox           12    0    0    1   0   0/2     0.0     0/0   0.0

TEAM: FG: 6/21 (28.6%), 3PT: 2/8 (25.0%), REB: 8 (2 off, 6 def), AST: 2, TO: 2
TEAM FOULS: 5 [Team_014 in BONUS]


Team_014
--------------------------------------------------------------------------------
Player                MIN  PTS  REB  AST  TO      FG   FG%      3P   3P%
--------------------------------------------------------------------------------
Jordan Anunoby         12   14    0    3   0   5/5   100.0     0/0   0.0
Ayo Murray             12    8    9    0   0   4/5    80.0     0/0   0.0
DeMar Adebayo          12    4    3    3   0   2/4    50.0     0/0   0.0
Michael Cunningham     12    2    3    1   0   1/3    33.3     0/0   0.0
Lamelo Simmons         12    2    0    2   0   1/2    50.0     0/0   0.0

TEAM: FG: 13/19 (68.4%), 3PT: 2/4 (50.0%), REB: 15 (1 off, 14 def), AST: 9, TO: 3
TEAM FOULS: 3

================================================================================

================================================================================
                       2ND QUARTER - Team_004 vs Team_014                       
================================================================================

[12:00] Team_004 possession (Score: 14-32)
Michael Curry drives and kicks out. Anthony Lillard attempts a Midrange. Contested by Ayo Murray (5.1 feet, MAN). ANTHONY LILLARD MAKES IT! Assist: Michael Curry
Score: 16-32

[11:45] Team_014 possession (Score: 16-32)
Ayo Murray drives to the basket... FOUL! Offensive foul on Ayo Murray! Anthony Lillard drew the charge! [Team fouls: 1] (Ayo Murray: 1 personal fouls) TURNOVER! (dead ball)

[11:32] Team_004 possession (Score: 16-32)
Jabari Wade drives and kicks out. Draymond Fox attempts a 3Pt. Contested by Jordan Anunoby (5.0 feet, ZONE). Draymond Fox misses. Rebound secured by DeMar Adebayo.

[11:17] Team_014 possession (Score: 16-32)
Lamelo Simmons attempts a 3Pt. Contested by Dwyane Irving (4.2 feet, MAN). Lamelo Simmons misses. Rebound secured by Dwyane Irving.

[10:59] Team_004 possession (Score: 16-32)
Jabari Wade attempts a 3Pt. Contested by Jordan Anunoby (5.7 feet, MAN). Jabari Wade misses. Rebound secured by Michael Cunningham.

[10:40] Team_014 possession (Score: 16-32)
FOUL! Holding foul on Jabari Wade. [Team fouls: 1] No free throws, side out. (Jabari Wade: 1 personal fouls)

[10:24] Team_014 possession (Score: 16-32)
Jordan Anunoby drives to the basket... FOUL! Offensive foul on Jordan Anunoby! Draymond Fox drew the charge! [Team fouls: 2] (Jordan Anunoby: 1 personal fouls) TURNOVER! (dead ball)

[10:11] Team_004 possession (Score: 16-32)
Michael Curry attempts a 3Pt. Contested by Michael Cunningham (4.6 feet, MAN). Michael Curry misses. Rebound secured by Michael Cunningham.

[10:01] Team_014 possession (Score: 16-32)
DeMar Adebayo drives to the basket... DeMar Adebayo throws a bad pass! Stolen by Anthony Lillard! TURNOVER! (live ball)

[09:44] Team_004 possession (Score: 16-32)
Jabari Wade attempts a 3Pt. Contested by Jordan Anunoby (5.8 feet, ZONE). Jabari Wade misses. Offensive rebound by Dwyane Irving! Dwyane Irving kicks it out.

[09:32] Team_004 possession (Score: 16-32)
Draymond Fox attempts a 3Pt. Contested by DeMar Adebayo (4.1 feet, MAN). Draymond Fox misses. Rebound secured by Ayo Murray.

[09:23] Team_014 possession (Score: 16-32)
Lamelo Simmons attempts a Midrange. Contested by Dwyane Irving (4.4 feet, MAN). Lamelo Simmons misses. Rebound secured by Draymond Fox.

[09:04] Team_004 possession (Score: 16-32)
Jabari Wade attempts a 3Pt. Contested by Jordan Anunoby (5.9 feet, ZONE). JABARI WADE MAKES IT! Assist: Anthony Lillard
Score: 19-32

[08:51] Team_014 possession (Score: 19-32)
FOUL! Holding foul on Michael Curry. [Team fouls: 2] No free throws, side out. (Michael Curry: 1 personal fouls)

[08:37] Team_014 possession (Score: 19-32)
Jordan Anunoby attempts a 3Pt. Contested by Dwyane Irving (4.4 feet, ZONE). Jordan Anunoby misses. Rebound secured by Anthony Lillard.

[08:25] Team_004 possession (Score: 19-32)
Draymond Fox attempts a 3Pt. Contested by Jordan Anunoby (5.7 feet, ZONE). Draymond Fox misses. Rebound secured by Ayo Murray.

[08:14] Team_014 possession (Score: 19-32)
Michael Cunningham attempts a 3Pt. Contested by Michael Curry (5.5 feet, MAN). MICHAEL CUNNINGHAM MAKES IT! Assist: Lamelo Simmons
Score: 19-35

[07:58] Team_004 possession (Score: 19-35)
Draymond Fox attempts a Layup. BLOCKED BY DEMAR ADEBAYO! Ball goes out off DeMar Adebayo. Draymond Fox's ball!

[07:47] Team_004 possession (Score: 19-35)
Draymond Fox drives to the basket... Draymond Fox throws a bad pass out of bounds! TURNOVER! (dead ball)

[07:47] Substitution (Team_004): Michael Curry OUT → Karl Reaves IN (stamina_rule2)

[07:47] Substitution (Team_004): Jabari Wade OUT → Russell Barnes IN (stamina_rule2)

[07:47] Substitution (Team_004): Dwyane Irving OUT → Kristaps Green IN (stamina_rule2)

[07:47] Substitution (Team_004): Draymond Fox OUT → Michael Sabonis IN (stamina_rule2)

[07:47] Substitution (Team_004): Anthony Lillard OUT → Shai Beal IN (stamina_rule2)

[07:47] Substitution (Team_014): Michael Cunningham OUT → Jalen Booker IN (stamina_rule2)

[07:47] Substitution (Team_014): Jordan Anunoby OUT → Bones Quickley IN (stamina_rule2)

[07:47] Substitution (Team_014): Lamelo Simmons OUT → Tracy Westbrook IN (stamina_rule2)

[07:47] Substitution (Team_014): DeMar Adebayo OUT → Nikola James IN (stamina_rule2)

[07:47] Substitution (Team_014): Ayo Murray OUT → Collin Gasol IN (stamina_rule2)

[07:29] Team_014 possession (Score: 19-35)
Tracy Westbrook attempts a Midrange. Contested by Kristaps Green (4.0 feet, MAN). Tracy Westbrook misses. Rebound secured by Michael Sabonis.

[07:17] Team_004 possession (Score: 19-35)
Karl Reaves attempts a 3Pt. Contested by Jalen Booker (3.8 feet, MAN). Karl Reaves misses. Rebound secured by Nikola James.

[07:05] Team_014 possession (Score: 19-35)
Collin Gasol attempts a Midrange. Contested by Russell Barnes (5.1 feet, ZONE). Collin Gasol misses. Rebound secured by Russell Barnes.

[06:55] Team_004 possession (Score: 19-35)
Kristaps Green attempts a Layup. BLOCKED BY TRACY WESTBROOK! Ball is loose! Rebound secured by Tracy Westbrook.

[06:43] Team_014 possession (Score: 19-35)
Jalen Booker attempts a Layup. Contested by Shai Beal (5.2 feet, ZONE). Jalen Booker misses. Rebound secured by Shai Beal.

[06:27] Team_004 possession (Score: 19-35)
Shai Beal attempts a Layup. BLOCKED BY COLLIN GASOL! Ball is loose! Rebound secured by Nikola James.

[06:11] Team_014 possession (Score: 19-35)
Tracy Westbrook loses the ball! Stripped by Kristaps Green! TURNOVER! (live ball)

[05:58] Team_004 possession (Score: 19-35)
FOUL! Holding foul on Jalen Booker. [Team fouls: 3] No free throws, side out. (Jalen Booker: 1 personal fouls)

[05:45] Team_004 possession (Score: 19-35)
Shai Beal attempts a Midrange. Contested by Collin Gasol (5.2 feet, ZONE). SHAI BEAL MAKES IT! Assist: Karl Reaves
Score: 21-35

[05:32] Team_014 possession (Score: 21-35)
Jalen Booker drives, Shai Beal stays with him. Jalen Booker attempts a Dunk. Contested by Shai Beal (5.2 feet, ZONE). JALEN BOOKER MAKES IT!
Score: 21-37

[05:16] Team_004 possession (Score: 21-37)
Kristaps Green drives, Tracy Westbrook stays with him. Kristaps Green attempts a Dunk. Contested by Tracy Westbrook (5.3 feet, MAN). Kristaps Green misses. Rebound secured by Tracy Westbrook.

[05:02] Team_014 possession (Score: 21-37)
Tracy Westbrook attempts a 3Pt. Contested by Karl Reaves (4.7 feet, ZONE). Tracy Westbrook misses. Rebound secured by Russell Barnes.

[04:47] Team_004 possession (Score: 21-37)
Russell Barnes attempts a Midrange. Wide open! Bones Quickley is 6.1 feet away. [MAN] RUSSELL BARNES MAKES IT! Assist: Kristaps Green
Score: 23-37

[04:29] Team_014 possession (Score: 23-37)
Bones Quickley drives and kicks out. Bones Quickley attempts a 3Pt. Contested by Russell Barnes (4.6 feet, ZONE). BONES QUICKLEY MAKES IT! Assist: Nikola James
Score: 23-40

[04:12] Team_004 possession (Score: 23-40)
Michael Sabonis drives, Nikola James stays with him. Michael Sabonis attempts a Layup. Contested by Nikola James (5.2 feet, ZONE). MICHAEL SABONIS MAKES IT!
Score: 25-40

[03:57] Team_014 possession (Score: 25-40)
Collin Gasol drives to the basket... Collin Gasol commits a violation (traveling/carry)! TURNOVER! (dead ball)

[03:39] Team_004 possession (Score: 25-40)
FOUL! Shooting foul on Nikola James. Michael Sabonis to the line for 3 free throws. [Team fouls: 4] (Nikola James: 1 personal fouls)   FT 1/3: GOOD   FT 2/3: GOOD   FT 3/3: GOOD Michael Sabonis makes 3/3 from the line.
Score: 28-40

[03:25] Team_014 possession (Score: 28-40)
FOUL! Holding foul on Karl Reaves. [Team fouls: 3] No free throws, side out. (Karl Reaves: 1 personal fouls)

[03:10] Team_014 possession (Score: 28-40)
Nikola James attempts a 3Pt. Contested by Michael Sabonis (5.0 feet, MAN). Nikola James misses. Rebound secured by Michael Sabonis.

[02:58] Team_004 possession (Score: 28-40)
Karl Reaves attempts a 3Pt. Contested by Jalen Booker (3.8 feet, MAN). Karl Reaves misses. Rebound secured by Nikola James.

[02:42] Team_014 possession (Score: 28-40)
Collin Gasol drives and kicks out. Collin Gasol attempts a 3Pt. Contested by Karl Reaves (5.1 feet, ZONE). Collin Gasol misses. Rebound secured by Shai Beal.

[02:27] Team_004 possession (Score: 28-40)
Michael Sabonis drives and kicks out. Shai Beal attempts a 3Pt. Contested by Collin Gasol (5.1 feet, MAN). Shai Beal misses. Rebound secured by Nikola James.

[02:14] Team_014 possession (Score: 28-40)
Nikola James attempts a Midrange. Contested by Michael Sabonis (5.0 feet, ZONE). Nikola James misses. Rebound secured by Shai Beal.

[01:59] Team_004 possession (Score: 28-40)
Karl Reaves attempts a Midrange. Contested by Tracy Westbrook (4.8 feet, ZONE). KARL REAVES MAKES IT! Assist: Russell Barnes
Score: 30-40

[01:42] Team_014 possession (Score: 30-40)
Jalen Booker attempts a 3Pt. Contested by Karl Reaves (5.1 feet, MAN). Jalen Booker misses. Rebound secured by Michael Sabonis.

[01:26] Team_004 possession (Score: 30-40)
Russell Barnes drives, picks up Bones Quickley. Help arrives from Tracy Westbrook! Russell Barnes attempts a Layup. Wide open! Tracy Westbrook is 6.1 feet away. [MAN] Russell Barnes misses. Offensive rebound by Shai Beal! Shai Beal kicks it out.

[01:08] Team_004 possession (Score: 30-40)
Michael Sabonis attempts a 3Pt. Contested by Jalen Booker (4.3 feet, ZONE). Michael Sabonis misses. Rebound secured by Nikola James.

[00:55] Team_014 possession (Score: 30-40)
Jalen Booker drives to the basket... Jalen Booker commits a violation (traveling/carry)! TURNOVER! (dead ball)

[00:41] Team_004 possession (Score: 30-40)
Shai Beal attempts a Midrange. Contested by Nikola James (5.3 feet, ZONE). SHAI BEAL MAKES IT!
Score: 32-40

[00:27] Team_014 possession (Score: 32-40)
Tracy Westbrook attempts a Layup. BLOCKED BY SHAI BEAL! Ball deflects out of bounds off Tracy Westbrook.

[00:16] Team_004 possession (Score: 32-40)
Kristaps Green attempts a 3Pt. Contested by Bones Quickley (5.6 feet, ZONE). Kristaps Green misses. Offensive rebound by Shai Beal! Shai Beal kicks it out.

================================================================================
                              2ND QUARTER COMPLETE                              
================================================================================

2ND QUARTER SCORE: Team_004 18, Team_014 8

BOX SCORE:
================================================================================

Team_004
--------------------------------------------------------------------------------
Player                MIN  PTS  REB  AST  TO      FG   FG%      3P   3P%
--------------------------------------------------------------------------------
Michael Sabonis         8    5    3    0   0   2/4    50.0     0/0   0.0
Shai Beal               8    4    5    0   0   2/3    66.7     0/0   0.0
Jabari Wade            17    3    0    0   0   1/3    33.3     0/0   0.0
Anthony Lillard        17    2    1    1   0   1/1   100.0     0/0   0.0
Karl Reaves             8    2    0    1   0   1/3    33.3     0/0   0.0
Russell Barnes          8    2    2    1   0   1/1   100.0     0/0   0.0
Michael Curry          17    0    0    1   0   0/1     0.0     0/0   0.0
Dwyane Irving          17    0    2    0   0   0/0     0.0     0/0   0.0
Draymond Fox           17    0    1    0   0   0/2     0.0     0/0   0.0
Kristaps Green          8    0    0    1   0   0/2     0.0     0/0   0.0

TEAM: FG: 8/20 (40.0%), 3PT: 2/9 (22.2%), REB: 14 (3 off, 11 def), AST: 5, TO: 1
TEAM FOULS: 3


Team_014
--------------------------------------------------------------------------------
Player                MIN  PTS  REB  AST  TO      FG   FG%      3P   3P%
--------------------------------------------------------------------------------
Michael Cunningham     17    3    2    0   0   1/1   100.0     0/0   0.0
Bones Quickley          8    3    0    0   0   1/1   100.0     0/0   0.0
Jalen Booker            8    2    0    0   0   1/3    33.3     0/0   0.0
DeMar Adebayo          17    0    1    0   0   0/0     0.0     0/0   0.0
Lamelo Simmons         17    0    0    1   0   0/2     0.0     0/0   0.0
Ayo Murray             17    0    2    0   0   0/0     0.0     0/0   0.0
Jordan Anunoby         17    0    0    0   0   0/1     0.0     0/0   0.0
Tracy Westbrook         8    0    2    0   0   0/3     0.0     0/0   0.0
Nikola James            8    0    5    1   0   0/2     0.0     0/0   0.0
Collin Gasol            8    0    0    0   0   0/2     0.0     0/0   0.0

TEAM: FG: 3/15 (20.0%), 3PT: 1/6 (16.7%), REB: 12 (0 off, 12 def), AST: 2, TO: 6
TEAM FOULS: 4

================================================================================

================================================================================
                       3RD QUARTER - Team_004 vs Team_014                       
================================================================================

[12:00] Team_004 possession (Score: 32-40)
Michael Curry attempts a Layup. Contested by Michael Cunningham (4.2 feet, MAN). Michael Curry misses. Rebound secured by DeMar Adebayo.

[11:44] Team_014 possession (Score: 32-40)
Ayo Murray attempts a Midrange. Contested by Anthony Lillard (4.5 feet, MAN). AYO MURRAY MAKES IT!
Score: 32-42

[11:31] Team_004 possession (Score: 32-42)
FOUL! Shooting foul on Ayo Murray. Anthony Lillard to the line for 2 free throws. [Team fouls: 1] (Ayo Murray: 1 personal fouls)   FT 1/2: GOOD   FT 2/2: MISS Anthony Lillard makes 1/2 from the line. Rebound secured by DeMar Adebayo.
Score: 33-42

[11:15] Team_014 possession (Score: 33-42)
FOUL! Holding foul on Draymond Fox. [Team fouls: 1] No free throws, side out. (Draymond Fox: 1 personal fouls)

[11:05] Team_014 possession (Score: 33-42)
Lamelo Simmons attempts a 3Pt. Contested by Michael Curry (5.5 feet, ZONE). Lamelo Simmons misses. Rebound secured by Draymond Fox.

[10:50] Team_004 possession (Score: 33-42)
Jabari Wade drives, DeMar Adebayo stays with him. Jabari Wade attempts a Layup. Contested by DeMar Adebayo (3.8 feet, ZONE). Jabari Wade misses. Rebound secured by Ayo Murray.

[10:35] Team_014 possession (Score: 33-42)
Michael Cunningham attempts a 3Pt. Contested by Michael Curry (4.8 feet, MAN). MICHAEL CUNNINGHAM MAKES IT! Assist: DeMar Adebayo
Score: 33-45

[10:19] Team_004 possession (Score: 33-45)
Michael Curry drives and kicks out. Jabari Wade attempts a Midrange. BLOCKED BY DEMAR ADEBAYO! Ball deflects out of bounds off Jabari Wade.

[10:06] Team_014 possession (Score: 33-45)
Jordan Anunoby attempts a Layup. Contested by Anthony Lillard (4.4 feet, ZONE). JORDAN ANUNOBY MAKES IT!
Score: 33-47

[09:54] Team_004 possession (Score: 33-47)
Michael Curry attempts a 3Pt. Contested by Michael Cunningham (4.2 feet, ZONE). Michael Curry misses. FOUL! Loose ball foul on DeMar Adebayo during the rebound battle. [Team fouls: 2] No free throws, side out. (DeMar Adebayo: 1 personal fouls)

[09:40] Team_004 possession (Score: 33-47)
Draymond Fox drives and kicks out. Michael Curry attempts a 3Pt. Contested by Michael Cunningham (4.0 feet, MAN). Michael Curry misses. Offensive rebound by Draymond Fox! Draymond Fox kicks it out.

[09:26] Team_004 possession (Score: 33-47)
Dwyane Irving throws a bad pass! Stolen by Lamelo Simmons! TURNOVER! (live ball)

[09:09] Team_014 possession (Score: 33-47)
Jordan Anunoby attempts a 3Pt. Contested by Jabari Wade (5.0 feet, MAN). JORDAN ANUNOBY MAKES IT! Assist: Ayo Murray
Score: 33-50

[08:54] Team_004 possession (Score: 33-50)
Michael Curry attempts a 3Pt. Contested by Michael Cunningham (4.2 feet, MAN). MICHAEL CURRY MAKES IT! Assist: Draymond Fox
Score: 36-50

[08:37] Team_014 possession (Score: 36-50)
Jordan Anunoby attempts a Layup. BLOCKED BY ANTHONY LILLARD! Ball deflects out of bounds off Jordan Anunoby.

[08:23] Team_004 possession (Score: 36-50)
Dwyane Irving attempts a 3Pt. Contested by Lamelo Simmons (4.3 feet, MAN). DWYANE IRVING MAKES IT! Assist: Michael Curry
Score: 39-50

[08:09] Team_014 possession (Score: 39-50)
Michael Cunningham attempts a 3Pt. Contested by Michael Curry (4.8 feet, ZONE). Michael Cunningham misses. Offensive rebound by Ayo Murray! Ayo Murray kicks it out.

[07:53] Team_014 possession (Score: 39-50)
FOUL! Reach-in foul on Draymond Fox during the drive. [Team fouls: 2] No free throws, side out. (Draymond Fox: 2 personal fouls)

[07:36] Team_014 possession (Score: 39-50)
Jordan Anunoby attempts a 3Pt. Contested by Michael Curry (5.3 feet, ZONE). JORDAN ANUNOBY MAKES IT! Assist: DeMar Adebayo
Score: 39-53

[07:19] Team_004 possession (Score: 39-53)
Dwyane Irving attempts a Midrange. Contested by DeMar Adebayo (3.4 feet, ZONE). DWYANE IRVING MAKES IT! Assist: Michael Curry
Score: 41-53

[07:04] Team_014 possession (Score: 41-53)
Ayo Murray attempts a 3Pt. Contested by Michael Curry (5.3 feet, ZONE). Ayo Murray misses. Rebound secured by Anthony Lillard.

[06:47] Team_004 possession (Score: 41-53)
Michael Curry attempts a Midrange. Contested by Lamelo Simmons (4.1 feet, ZONE). MICHAEL CURRY MAKES IT! Assist: Draymond Fox
Score: 43-53

[06:30] Team_014 possession (Score: 43-53)
Lamelo Simmons attempts a 3Pt. Contested by Jabari Wade (5.1 feet, ZONE). Lamelo Simmons misses. Offensive rebound by Ayo Murray! Ayo Murray kicks it out.

[06:16] Team_014 possession (Score: 43-53)
Lamelo Simmons attempts a 3Pt. Contested by Dwyane Irving (4.0 feet, MAN). Lamelo Simmons misses. Rebound secured by Anthony Lillard.

[06:01] Team_004 possession (Score: 43-53)
FOUL! Holding foul on Jordan Anunoby. [Team fouls: 3] No free throws, side out. (Jordan Anunoby: 1 personal fouls)

[05:48] Team_004 possession (Score: 43-53)
Dwyane Irving makes the Layup and draws the foul on DeMar Adebayo! And-1! Dwyane Irving to the line for 1. [Team fouls: 4] (DeMar Adebayo: 2 personal fouls)   FT 1/1: GOOD Dwyane Irving makes 1/1 from the line.
Score: 46-53

[05:34] Team_014 possession (Score: 46-53)
Michael Cunningham attempts a Midrange. Contested by Michael Curry (4.8 feet, ZONE). Michael Cunningham misses. Rebound secured by Draymond Fox.

[05:18] Team_004 possession (Score: 46-53)
Jabari Wade attempts a Layup. Contested by DeMar Adebayo (3.8 feet, ZONE). JABARI WADE MAKES IT! Assist: Dwyane Irving
Score: 48-53

[05:01] Team_014 possession (Score: 48-53)
Michael Cunningham drives and kicks out. Ayo Murray attempts a Midrange. Contested by Anthony Lillard (4.2 feet, MAN). Ayo Murray misses. Rebound secured by Anthony Lillard.

[04:46] Team_004 possession (Score: 48-53)
Draymond Fox drives to the basket... Draymond Fox loses the ball! Stripped by DeMar Adebayo! TURNOVER! (live ball)

[04:31] Team_014 possession (Score: 48-53)
DeMar Adebayo drives, Anthony Lillard stays with him. DeMar Adebayo attempts a Dunk. Contested by Anthony Lillard (4.1 feet, ZONE). DEMAR ADEBAYO MAKES IT! Assist: Lamelo Simmons
Score: 48-55

[04:13] Team_004 possession (Score: 48-55)
FOUL! Reach-in foul on Jordan Anunoby during the drive. [IN THE BONUS! 5 team fouls] Jabari Wade to the line for 2 free throws. (Jordan Anunoby: 2 personal fouls)   FT 1/2: GOOD   FT 2/2: GOOD Jabari Wade makes 2/2 from the line.
Score: 50-55

[03:59] Team_014 possession (Score: 50-55)
Lamelo Simmons attempts a 3Pt. Contested by Michael Curry (5.5 feet, ZONE). Lamelo Simmons misses. Offensive rebound by DeMar Adebayo! DeMar Adebayo kicks it out.

[03:44] Team_014 possession (Score: 50-55)
FOUL! Holding foul on Dwyane Irving. [Team fouls: 3] No free throws, side out. (Dwyane Irving: 1 personal fouls)

[03:30] Team_014 possession (Score: 50-55)
FOUL! Reach-in foul on Draymond Fox during the drive. [Team fouls: 4] No free throws, side out. (Draymond Fox: 3 personal fouls)

[03:16] Team_014 possession (Score: 50-55)
DeMar Adebayo attempts a Layup. Contested by Draymond Fox (4.2 feet, MAN). DEMAR ADEBAYO MAKES IT! Assist: Michael Cunningham
Score: 50-57

[03:01] Team_004 possession (Score: 50-57)
FOUL! Shooting foul on DeMar Adebayo. Michael Curry to the line for 2 free throws. [BONUS: 6 team fouls] (DeMar Adebayo: 3 personal fouls)   FT 1/2: GOOD   FT 2/2: MISS Michael Curry makes 1/2 from the line. Rebound secured by Ayo Murray.
Score: 51-57

[02:50] Team_014 possession (Score: 51-57)
Ayo Murray attempts a Layup. BLOCKED BY JABARI WADE! Ball deflects out of bounds off Ayo Murray.

[02:34] Team_004 possession (Score: 51-57)
Michael Curry loses control! Ball rolls out of bounds! TURNOVER! (dead ball)

[02:34] Substitution (Team_004): Jabari Wade OUT → Russell Barnes IN (stamina_rule2)

[02:34] Substitution (Team_004): Anthony Lillard OUT → Shai Beal IN (stamina_rule2)

[02:34] Substitution (Team_014): Lamelo Simmons OUT → Tracy Westbrook IN (stamina_rule2)

[02:17] Team_014 possession (Score: 51-57)
Tracy Westbrook attempts a 3Pt. Contested by Dwyane Irving (3.4 feet, MAN). Tracy Westbrook misses. Rebound secured by Shai Beal.

[02:07] Team_004 possession (Score: 51-57)
FOUL! Reach-in foul on DeMar Adebayo during the drive. [IN THE BONUS! 7 team fouls] Shai Beal to the line for 2 free throws. (DeMar Adebayo: 4 personal fouls)   FT 1/2: GOOD   FT 2/2: GOOD Shai Beal makes 2/2 from the line.
Score: 53-57

[01:50] Team_014 possession (Score: 53-57)
DeMar Adebayo attempts a 3Pt. Contested by Michael Curry (5.2 feet, ZONE). DeMar Adebayo misses. Rebound secured by Dwyane Irving.

[01:37] Team_004 possession (Score: 53-57)
Russell Barnes attempts a Layup. Contested by DeMar Adebayo (4.1 feet, ZONE). RUSSELL BARNES MAKES IT! Assist: Draymond Fox
Score: 55-57

[01:17] Team_014 possession (Score: 55-57)
Jordan Anunoby attempts a 3Pt. Contested by Michael Curry (5.6 feet, ZONE). Jordan Anunoby misses. Rebound secured by Russell Barnes.

[01:06] Team_004 possession (Score: 55-57)
Draymond Fox attempts a Midrange. Contested by DeMar Adebayo (3.9 feet, MAN). Draymond Fox misses. Offensive rebound by Shai Beal! Shai Beal kicks it out.

[00:53] Team_004 possession (Score: 55-57)
Michael Curry attempts a 3Pt. Contested by DeMar Adebayo (3.7 feet, ZONE). Michael Curry misses. Offensive rebound by Russell Barnes! Russell Barnes kicks it out.

[00:40] Team_004 possession (Score: 55-57)
Draymond Fox attempts a Layup. BLOCKED BY MICHAEL CUNNINGHAM! Ball is loose! Offensive rebound by Shai Beal! Shai Beal kicks it out.

[00:25] Team_004 possession (Score: 55-57)
Shai Beal attempts a Midrange. Contested by Ayo Murray (5.3 feet, MAN). SHAI BEAL MAKES IT!
Score: 57-57

[00:08] Team_014 possession (Score: 57-57)
DeMar Adebayo attempts a 3Pt. Contested by Draymond Fox (4.6 feet, MAN). DEMAR ADEBAYO MAKES IT! Assist: Tracy Westbrook
Score: 57-60

================================================================================
                              3RD QUARTER COMPLETE                              
================================================================================

3RD QUARTER SCORE: Team_004 25, Team_014 20

BOX SCORE:
================================================================================

Team_004
--------------------------------------------------------------------------------
Player                MIN  PTS  REB  AST  TO      FG   FG%      3P   3P%
--------------------------------------------------------------------------------
Dwyane Irving          29    8    1    1   0   3/3   100.0     0/0   0.0
Michael Curry          29    5    0    2   0   2/5    40.0     0/0   0.0
Jabari Wade            26    4    0    0   0   2/3    66.7     0/0   0.0
Shai Beal              10    4    3    0   0   2/2   100.0     0/0   0.0
Russell Barnes         10    2    2    0   0   1/1   100.0     0/0   0.0
Anthony Lillard        26    0    3    0   0   0/1     0.0     0/0   0.0
Draymond Fox           29    0    4    3   0   0/0     0.0     0/0   0.0

TEAM: FG: 10/15 (66.7%), 3PT: 2/2 (100.0%), REB: 13 (5 off, 8 def), AST: 6, TO: 3
TEAM FOULS: 4


Team_014
--------------------------------------------------------------------------------
Player                MIN  PTS  REB  AST  TO      FG   FG%      3P   3P%
--------------------------------------------------------------------------------
Jordan Anunoby         29    8    0    0   0   3/5    60.0     0/0   0.0
DeMar Adebayo          29    7    3    2   0   3/4    75.0     0/0   0.0
Michael Cunningham     29    3    0    1   0   1/3    33.3     0/0   0.0
Ayo Murray             29    2    4    1   0   1/3    33.3     0/0   0.0
Lamelo Simmons         26    0    0    1   0   0/2     0.0     0/0   0.0
Tracy Westbrook        10    0    0    1   0   0/1     0.0     0/0   0.0

TEAM: FG: 8/18 (44.4%), 3PT: 4/10 (40.0%), REB: 7 (3 off, 4 def), AST: 6, TO: 0
TEAM FOULS: 7 [Team_004 in BONUS]

================================================================================

================================================================================
                       4TH QUARTER - Team_004 vs Team_014                       
================================================================================

[12:00] Team_004 possession (Score: 57-60)
FOUL! Shooting foul on Michael Cunningham. Dwyane Irving to the line for 2 free throws. [Team fouls: 1] (Michael Cunningham: 1 personal fouls)   FT 1/2: MISS   FT 2/2: MISS Dwyane Irving makes 0/2 from the line. FOUL! Loose ball foul on Ayo Murray during the free throw rebound! [Team fouls: 2] No free throws, side out. (Ayo Murray: 1 personal fouls)

[11:42] Team_004 possession (Score: 57-60)
Draymond Fox throws a bad pass! Stolen by DeMar Adebayo! TURNOVER! (live ball)

[11:29] Team_014 possession (Score: 57-60)
Jordan Anunoby attempts a 3Pt. Contested by Michael Curry (5.6 feet, ZONE). JORDAN ANUNOBY MAKES IT! Assist: Michael Cunningham
Score: 57-63

[11:15] Team_004 possession (Score: 57-63)
Michael Curry attempts a 3Pt. Contested by Jordan Anunoby (5.1 feet, ZONE). Michael Curry misses. Rebound secured by DeMar Adebayo.

[10:57] Team_014 possession (Score: 57-63)
DeMar Adebayo attempts a Layup. BLOCKED BY ANTHONY LILLARD! Ball deflects out of bounds off DeMar Adebayo.

[10:38] Team_004 possession (Score: 57-63)
Jabari Wade attempts a 3Pt. Contested by Jordan Anunoby (5.8 feet, ZONE). Jabari Wade misses. Offensive rebound by Anthony Lillard! Anthony Lillard kicks it out.

[10:21] Team_004 possession (Score: 57-63)
Dwyane Irving attempts a 3Pt. Contested by Lamelo Simmons (4.4 feet, MAN). DWYANE IRVING MAKES IT! Assist: Draymond Fox
Score: 60-63

[10:07] Team_014 possession (Score: 60-63)
Lamelo Simmons attempts a Midrange. Contested by Dwyane Irving (4.4 feet, MAN). Lamelo Simmons misses. Rebound secured by Anthony Lillard.

[09:50] Team_004 possession (Score: 60-63)
Dwyane Irving drives, picks up Lamelo Simmons. Help arrives from Michael Cunningham! Dwyane Irving attempts a Dunk. Contested by Michael Cunningham (4.5 feet, MAN). Dwyane Irving misses. Offensive rebound by Dwyane Irving! Dwyane Irving kicks it out.

[09:38] Team_004 possession (Score: 60-63)
Michael Curry makes the Dunk and draws the foul on Jordan Anunoby! And-1! Michael Curry to the line for 1. [Team fouls: 3] (Jordan Anunoby: 1 personal fouls)   FT 1/1: MISS Michael Curry makes 0/1 from the line. Rebound secured by Michael Cunningham.
Score: 62-63

[09:19] Team_014 possession (Score: 62-63)
Jordan Anunoby drives, Anthony Lillard stays with him. Jordan Anunoby attempts a Layup. Contested by Anthony Lillard (4.6 feet, ZONE). Jordan Anunoby misses. Rebound secured by Dwyane Irving.

[09:04] Team_004 possession (Score: 62-63)
Anthony Lillard drives and kicks out. Michael Curry attempts a 3Pt. Contested by Jordan Anunoby (5.3 feet, ZONE). MICHAEL CURRY MAKES IT! Assist: Draymond Fox
Score: 65-63

[08:53] Team_014 possession (Score: 65-63)
FOUL! Holding foul on Dwyane Irving. [Team fouls: 1] No free throws, side out. (Dwyane Irving: 1 personal fouls)

[08:41] Team_014 possession (Score: 65-63)
FOUL! Shooting foul on Dwyane Irving. Michael Cunningham to the line for 2 free throws. [Team fouls: 2] (Dwyane Irving: 2 personal fouls)   FT 1/2: MISS   FT 2/2: GOOD Michael Cunningham makes 1/2 from the line.
Score: 65-64

[08:27] Team_004 possession (Score: 65-64)
Jabari Wade attempts a Midrange. Wide open! Jordan Anunoby is 6.0 feet away. [MAN] Jabari Wade misses. Offensive rebound by Anthony Lillard! Anthony Lillard kicks it out.

[08:15] Team_004 possession (Score: 65-64)
Michael Curry makes the Midrange and draws the foul on Michael Cunningham! And-1! Michael Curry to the line for 1. [Team fouls: 4] (Michael Cunningham: 2 personal fouls)   FT 1/1: GOOD Michael Curry makes 1/1 from the line.
Score: 68-64

[07:59] Team_014 possession (Score: 68-64)
Jordan Anunoby drives and kicks out. Michael Cunningham attempts a 3Pt. Contested by Michael Curry (5.7 feet, ZONE). Michael Cunningham misses. Rebound secured by Dwyane Irving.

[07:47] Team_004 possession (Score: 68-64)
Jabari Wade attempts a Layup. Wide open! Jordan Anunoby is 6.1 feet away. [MAN] JABARI WADE MAKES IT! Assist: Anthony Lillard
Score: 70-64

[07:28] Team_014 possession (Score: 70-64)
Ayo Murray attempts a Midrange. Contested by Anthony Lillard (4.8 feet, MAN). Ayo Murray misses. Rebound secured by Anthony Lillard.

[07:14] Team_004 possession (Score: 70-64)
Jabari Wade drives, picks up DeMar Adebayo. Help arrives from Michael Cunningham! Jabari Wade attempts a Layup. Contested by Michael Cunningham (4.8 feet, ZONE). JABARI WADE MAKES IT! Assist: Dwyane Irving
Score: 72-64

[06:57] Team_014 possession (Score: 72-64)
DeMar Adebayo attempts a Midrange. Contested by Draymond Fox (5.0 feet, ZONE). DeMar Adebayo misses. Rebound secured by Anthony Lillard.

[06:46] Team_004 possession (Score: 72-64)
Jabari Wade makes the Layup and draws the foul on Ayo Murray! And-1! Jabari Wade to the line for 1. [BONUS: 5 team fouls] (Ayo Murray: 2 personal fouls)   FT 1/1: GOOD Jabari Wade makes 1/1 from the line.
Score: 75-64

[06:32] Team_014 possession (Score: 75-64)
Michael Cunningham attempts a Layup. Contested by Anthony Lillard (4.5 feet, ZONE). Michael Cunningham misses. Rebound secured by Dwyane Irving.

[06:16] Team_004 possession (Score: 75-64)
Jabari Wade attempts a 3Pt. Wide open! Jordan Anunoby is 6.3 feet away. [MAN] Jabari Wade misses. Rebound secured by DeMar Adebayo.

[06:00] Team_014 possession (Score: 75-64)
Michael Cunningham attempts a 3Pt. Contested by Michael Curry (5.7 feet, ZONE). MICHAEL CUNNINGHAM MAKES IT! Assist: Jordan Anunoby
Score: 75-67

[05:47] Team_004 possession (Score: 75-67)
Michael Curry attempts a 3Pt. Contested by DeMar Adebayo (4.5 feet, ZONE). Michael Curry misses. Rebound secured by Ayo Murray.

[05:34] Team_014 possession (Score: 75-67)
Michael Cunningham attempts a 3Pt. Contested by Michael Curry (5.8 feet, ZONE). Michael Cunningham misses. Rebound secured by Dwyane Irving.

[05:24] Team_004 possession (Score: 75-67)
Dwyane Irving attempts a 3Pt. Contested by Lamelo Simmons (5.1 feet, MAN). Dwyane Irving misses. Rebound secured by Michael Cunningham.

[05:11] Team_014 possession (Score: 75-67)
DeMar Adebayo drives and kicks out. Ayo Murray attempts a 3Pt. Wide open! Michael Curry is 6.2 feet away. [ZONE] AYO MURRAY MAKES IT! Assist: DeMar Adebayo
Score: 75-70

[04:58] Team_004 possession (Score: 75-70)
Michael Curry attempts a 3Pt. Contested by Michael Cunningham (5.3 feet, MAN). MICHAEL CURRY MAKES IT! Assist: Dwyane Irving
Score: 78-70

[04:45] Team_014 possession (Score: 78-70)
DeMar Adebayo attempts a 3Pt. Contested by Michael Curry (6.0 feet, ZONE). DEMAR ADEBAYO MAKES IT! Assist: Jordan Anunoby
Score: 78-73

[04:31] Team_004 possession (Score: 78-73)
Draymond Fox attempts a Midrange. Contested by DeMar Adebayo (4.9 feet, MAN). Draymond Fox misses. FOUL! Loose ball foul on Ayo Murray during the rebound battle. [IN THE BONUS! 6 team fouls] Dwyane Irving to the line for 2 free throws. (Ayo Murray: 3 personal fouls)   FT 1/2: GOOD   FT 2/2: GOOD Dwyane Irving makes 2/2 from the line.
Score: 80-73

[04:16] Team_014 possession (Score: 80-73)
Jordan Anunoby attempts a 3Pt. Contested by Jabari Wade (5.7 feet, MAN). Jordan Anunoby misses. Rebound secured by Dwyane Irving.

[04:04] Team_004 possession (Score: 80-73)
Dwyane Irving attempts a 3Pt. Wide open! Jordan Anunoby is 6.2 feet away. [ZONE] DWYANE IRVING MAKES IT! Assist: Jabari Wade
Score: 83-73

[03:47] Team_014 possession (Score: 83-73)
Michael Cunningham attempts a Midrange. Wide open! Michael Curry is 6.0 feet away. [MAN] MICHAEL CUNNINGHAM MAKES IT! Assist: Ayo Murray
Score: 83-75

[03:30] Team_004 possession (Score: 83-75)
Anthony Lillard attempts a 3Pt. Wide open! Ayo Murray is 6.4 feet away. [MAN] Anthony Lillard misses. Rebound secured by Michael Cunningham.

[03:16] Team_014 possession (Score: 83-75)
DeMar Adebayo drives and kicks out. Jordan Anunoby attempts a 3Pt. Wide open! Michael Curry is 6.4 feet away. [ZONE] JORDAN ANUNOBY MAKES IT! Assist: Lamelo Simmons
Score: 83-78

[03:06] Team_004 possession (Score: 83-78)
Michael Curry attempts a 3Pt. Wide open! Jordan Anunoby is 6.1 feet away. [ZONE] Michael Curry misses. FOUL! Loose ball foul on DeMar Adebayo during the rebound battle. [IN THE BONUS! 7 team fouls] Anthony Lillard to the line for 2 free throws. (DeMar Adebayo: 1 personal fouls)   FT 1/2: MISS   FT 2/2: GOOD Anthony Lillard makes 1/2 from the line.
Score: 84-78

[02:53] Team_014 possession (Score: 84-78)
DeMar Adebayo attempts a 3Pt. Contested by Draymond Fox (5.6 feet, MAN). DeMar Adebayo misses. FOUL! Loose ball foul on Dwyane Irving during the rebound battle. [Team fouls: 3] No free throws, side out. (Dwyane Irving: 3 personal fouls)

[02:38] Team_014 possession (Score: 84-78)
Michael Cunningham attempts a Layup. Contested by Anthony Lillard (5.1 feet, ZONE). Michael Cunningham misses. Rebound secured by Dwyane Irving.

[02:20] Team_004 possession (Score: 84-78)
Michael Curry drives and kicks out. Anthony Lillard attempts a Midrange. Contested by DeMar Adebayo (5.2 feet, ZONE). Anthony Lillard misses. Rebound secured by Michael Cunningham.

[02:07] Team_014 possession (Score: 84-78)
Michael Cunningham attempts a Midrange. Wide open! Michael Curry is 6.3 feet away. [MAN] MICHAEL CUNNINGHAM MAKES IT! Assist: Ayo Murray
Score: 84-80

[01:48] Team_004 possession (Score: 84-80)
Dwyane Irving attempts a Midrange. Wide open! Jordan Anunoby is 6.5 feet away. [ZONE] DWYANE IRVING MAKES IT!
Score: 86-80

[01:32] Team_014 possession (Score: 86-80)
DeMar Adebayo throws a bad pass! Stolen by Draymond Fox! TURNOVER! (live ball)

[01:19] Team_004 possession (Score: 86-80)
Anthony Lillard attempts a Layup. Wide open! Ayo Murray is 6.6 feet away. [MAN] ANTHONY LILLARD MAKES IT! Assist: Draymond Fox
Score: 88-80

[01:02] Team_014 possession (Score: 88-80)
Ayo Murray attempts a Midrange. Contested by Dwyane Irving (5.5 feet, ZONE). Ayo Murray misses. Rebound secured by Draymond Fox.

[00:44] Team_004 possession (Score: 88-80)
Draymond Fox attempts a Midrange. Contested by DeMar Adebayo (5.5 feet, ZONE). Draymond Fox misses. Rebound secured by Michael Cunningham.

[00:31] Team_014 possession (Score: 88-80)
DeMar Adebayo drives and kicks out. Lamelo Simmons attempts a Midrange. Wide open! Jabari Wade is 6.2 feet away. [ZONE] LAMELO SIMMONS MAKES IT!
Score: 88-82

[00:18] Team_004 possession (Score: 88-82)
Anthony Lillard makes the Layup and draws the foul on Ayo Murray! And-1! Anthony Lillard to the line for 1. [BONUS: 8 team fouls] (Ayo Murray: 4 personal fouls)   FT 1/1: GOOD Anthony Lillard makes 1/1 from the line.
Score: 91-82

[00:04] Team_014 possession (Score: 91-82)
Ayo Murray drives, picks up Anthony Lillard. Help arrives from Jabari Wade! Ayo Murray attempts a Dunk. Contested by Jabari Wade (5.9 feet, ZONE). Ayo Murray misses. Offensive rebound by Ayo Murray! Ayo Murray kicks it out.

================================================================================
                              4TH QUARTER COMPLETE                              
================================================================================

4TH QUARTER SCORE: Team_004 34, Team_014 22

BOX SCORE:
================================================================================

Team_004
--------------------------------------------------------------------------------
Player                MIN  PTS  REB  AST  TO      FG   FG%      3P   3P%
--------------------------------------------------------------------------------
Dwyane Irving          41   10    8    2   0   4/5    80.0     0/0   0.0
Michael Curry          41    9    0    0   0   3/7    42.9     0/0   0.0
Jabari Wade            38    7    0    1   0   3/4    75.0     0/0   0.0
Anthony Lillard        38    6    5    1   0   3/4    75.0     0/0   0.0
Draymond Fox           41    0    1    3   0   0/1     0.0     0/0   0.0

TEAM: FG: 13/21 (61.9%), 3PT: 4/9 (44.4%), REB: 14 (4 off, 10 def), AST: 7, TO: 1
TEAM FOULS: 3


Team_014
--------------------------------------------------------------------------------
Player                MIN  PTS  REB  AST  TO      FG   FG%      3P   3P%
--------------------------------------------------------------------------------
Michael Cunningham     41    8    5    1   0   4/7    57.1     0/0   0.0
Jordan Anunoby         41    6    0    2   0   2/5    40.0     0/0   0.0
DeMar Adebayo          41    3    2    1   0   1/3    33.3     0/0   0.0
Ayo Murray             41    3    3    2   0   1/3    33.3     0/0   0.0
Lamelo Simmons         38    2    0    1   0   1/2    50.0     0/0   0.0

TEAM: FG: 9/20 (45.0%), 3PT: 3/5 (60.0%), REB: 10 (2 off, 8 def), AST: 7, TO: 1
TEAM FOULS: 8 [Team_004 in BONUS]

================================================================================

================================================================================
                               FULL GAME COMPLETE                               
================================================================================

FINAL SCORE: Team_004 91, Team_014 82

SCORING BY QUARTER:
--------------------------------------------------------------------------------
Team                     Q1     Q2     Q3     Q4    FINAL
--------------------------------------------------------------------------------
Team_004                 14     18     25     34       91
Team_014                 32      8     20     22       82
--------------------------------------------------------------------------------

FULL GAME BOX SCORE:
================================================================================

Team_004
--------------------------------------------------------------------------------
Player                MIN  PTS  REB  AST  TO      FG   FG%      3P   3P%      FT STL BLK
--------------------------------------------------------------------------------
Michael Curry          41   18    0    3   3   8/17   47.1   3/6    50.0   2/4     0   0
Dwyane Irving          41   18   13    3   2   6/12   50.0   3/8    37.5   3/5     0   0
Draymond Fox           41    0    6    7   1   1/6    16.7   0/2     0.0   0/0     1   0
Jabari Wade            38   20    0    2   1   8/17   47.1   3/7    42.9   3/3     0   1
Anthony Lillard        38   12   15    2   0   5/9    55.6   0/1     0.0   3/5     2   2
Russell Barnes         10    4    4    1   0   2/2   100.0   0/0     0.0   0/0     0   0
Shai Beal              10    8    8    0   0   4/5    80.0   0/0     0.0   2/2     0   1
Karl Reaves             8    2    0    1   0   1/3    33.3   0/2     0.0   0/0     0   0
Kristaps Green          8    0    0    1   0   0/2     0.0   0/0     0.0   0/0     1   0
Michael Sabonis         8    5    3    0   0   2/4    50.0   1/2    50.0   3/3     0   0

TEAM: FG: 37/77 (48.1%), 3PT: 10/28 (35.7%), REB: 49 (14 off, 35 def), AST: 20, TO: 7


Team_014
--------------------------------------------------------------------------------
Player                MIN  PTS  REB  AST  TO      FG   FG%      3P   3P%      FT STL BLK
--------------------------------------------------------------------------------
Michael Cunningham     41   16   10    3   4   7/14   50.0   3/5    60.0   1/2     0   2
Jordan Anunoby         41   28    0    5   2   9/15   60.0   5/8    62.5   2/2     1   1
DeMar Adebayo          41   14    9    6   1   9/14   64.3   2/4    50.0   0/1     2   2
Ayo Murray             41   13   18    3   0   4/9    44.4   0/1     0.0   0/0     0   0
Lamelo Simmons         38    4    0    5   0   2/8    25.0   0/3     0.0   2/2     1   0
Tracy Westbrook        10    0    2    1   1   0/4     0.0   0/2     0.0   0/0     0   1
Jalen Booker            8    2    0    0   0   1/3    33.3   0/1     0.0   0/0     0   0
Bones Quickley          8    3    0    0   1   1/1   100.0   0/0     0.0   0/0     0   0
Nikola James            8    0    5    1   1   0/2     0.0   0/1     0.0   0/0     0   0
Collin Gasol            8    0    0    0   0   0/2     0.0   0/0     0.0   0/0     0   1

TEAM: FG: 33/72 (45.8%), 3PT: 10/25 (40.0%), REB: 44 (6 off, 38 def), AST: 24, TO: 10

================================================================================
