================================================================================
                        FULL GAME - Team_075 vs Team_078                        
================================================================================

================================================================================
                       1ST QUARTER - Team_075 vs Team_078                       
================================================================================

[12:00] Team_075 possession (Score: 0-0)
Klay Jokic drives and kicks out. Larry McCollum attempts a Midrange. Contested by Isaiah Simmons (3.0 feet, ZONE). Larry McCollum misses. Rebound secured by Ben Ginobili.

[11:50] Team_078 possession (Score: 0-0)
Kyrie Carter attempts a 3Pt. Contested by Larry McCollum (4.1 feet, ZONE). Kyrie Carter misses. Offensive rebound by Jabari Barrett! Jabari Barrett kicks it out.

[11:35] Team_078 possession (Score: 0-0)
Ben Ginobili drives, Derrick Stewart stays with him. Ben Ginobili attempts a Layup. Contested by Derrick Stewart (4.8 feet, ZONE). BEN GINOBILI MAKES IT! Assist: Jabari Barrett
Score: 0-2

[11:17] Team_075 possession (Score: 0-2)
Larry McCollum attempts a 3Pt. Contested by Jabari Barnes (4.0 feet, MAN). Larry McCollum misses. Rebound secured by Ben Ginobili.

[11:03] Team_078 possession (Score: 0-2)
Jabari Barrett drives and kicks out. Isaiah Simmons attempts a Midrange. Contested by Myles Barrett (5.9 feet, MAN). Isaiah Simmons misses. Rebound secured by Klay Jokic.

[10:46] Team_075 possession (Score: 0-2)
Klay Jokic drives to the basket... Klay Jokic loses control! Ball rolls out of bounds! TURNOVER! (dead ball)

[10:30] Team_078 possession (Score: 0-2)
Kyrie Carter throws a bad pass! Stolen by Kawhi Ingram! TURNOVER! (live ball)

[10:19] Team_075 possession (Score: 0-2)
Derrick Stewart attempts a Midrange. Contested by Isaiah Simmons (3.0 feet, ZONE). DERRICK STEWART MAKES IT! Assist: Myles Barrett
Score: 2-2

[10:08] Team_078 possession (Score: 2-2)
Isaiah Simmons attempts a 3Pt. Wide open! Myles Barrett is 6.1 feet away. [MAN] Isaiah Simmons misses. Rebound secured by Derrick Stewart.

[09:52] Team_075 possession (Score: 2-2)
Kawhi Ingram drives and kicks out. Larry McCollum attempts a Midrange. Contested by Ben Ginobili (4.6 feet, ZONE). Larry McCollum misses. Rebound secured by Isaiah Simmons.

[09:42] Team_078 possession (Score: 2-2)
Kyrie Carter attempts a 3Pt. Contested by Larry McCollum (4.1 feet, ZONE). KYRIE CARTER MAKES IT! Assist: Isaiah Simmons
Score: 2-5

[09:31] Team_075 possession (Score: 2-5)
Derrick Stewart attempts a 3Pt. Contested by Ben Ginobili (4.6 feet, MAN). Derrick Stewart misses. Rebound secured by Ben Ginobili.

[09:18] Team_078 possession (Score: 2-5)
Ben Ginobili attempts a 3Pt. Contested by Derrick Stewart (4.8 feet, MAN). Ben Ginobili misses. Rebound secured by Derrick Stewart.

[09:04] Team_075 possession (Score: 2-5)
Derrick Stewart attempts a Midrange. Contested by Kyrie Carter (3.8 feet, ZONE). Derrick Stewart misses. Rebound secured by Isaiah Simmons.

[08:50] Team_078 possession (Score: 2-5)
Ben Ginobili drives and kicks out. FOUL! Shooting foul on Klay Jokic. Jabari Barrett to the line for 3 free throws. [Team fouls: 1] (Klay Jokic: 1 personal fouls)   FT 1/3: GOOD   FT 2/3: GOOD   FT 3/3: GOOD Jabari Barrett makes 3/3 from the line.
Score: 2-8

[08:36] Team_075 possession (Score: 2-8)
Larry McCollum drives and kicks out. Larry McCollum attempts a Midrange. Contested by Isaiah Simmons (3.0 feet, ZONE). Larry McCollum misses. Offensive rebound by Derrick Stewart! Derrick Stewart kicks it out.

[08:25] Team_075 possession (Score: 2-8)
FOUL! Shooting foul on Kyrie Carter. Kawhi Ingram to the line for 2 free throws. [Team fouls: 1] (Kyrie Carter: 1 personal fouls)   FT 1/2: MISS   FT 2/2: GOOD Kawhi Ingram makes 1/2 from the line.
Score: 3-8

[08:13] Team_078 possession (Score: 3-8)
Jabari Barnes attempts a Midrange. Contested by Larry McCollum (4.7 feet, MAN). JABARI BARNES MAKES IT! Assist: Jabari Barrett
Score: 3-10

[07:56] Team_075 possession (Score: 3-10)
Derrick Stewart attempts a Midrange. Contested by Ben Ginobili (4.6 feet, MAN). DERRICK STEWART MAKES IT!
Score: 5-10

[07:38] Team_078 possession (Score: 5-10)
FOUL! Holding foul on Larry McCollum. [Team fouls: 2] No free throws, side out. (Larry McCollum: 1 personal fouls)

[07:28] Team_078 possession (Score: 5-10)
FOUL! Shooting foul on Larry McCollum. Kyrie Carter to the line for 2 free throws. [Team fouls: 3] (Larry McCollum: 2 personal fouls)   FT 1/2: GOOD   FT 2/2: GOOD Kyrie Carter makes 2/2 from the line.
Score: 5-12

[07:15] Team_075 possession (Score: 5-12)
Derrick Stewart attempts a Midrange. Contested by Jabari Barnes (3.8 feet, ZONE). Derrick Stewart misses. Rebound secured by Jabari Barrett.

[07:01] Team_078 possession (Score: 5-12)
FOUL! Holding foul on Myles Barrett. [Team fouls: 4] No free throws, side out. (Myles Barrett: 1 personal fouls)

[06:45] Team_078 possession (Score: 5-12)
Isaiah Simmons attempts a 3Pt. Wide open! Myles Barrett is 6.1 feet away. [MAN] Isaiah Simmons misses. Rebound secured by Kawhi Ingram.

[06:31] Team_075 possession (Score: 5-12)
Kawhi Ingram attempts a 3Pt. Contested by Kyrie Carter (3.7 feet, MAN). Kawhi Ingram misses. Offensive rebound by Kawhi Ingram! Kawhi Ingram kicks it out.

[06:16] Team_075 possession (Score: 5-12)
Myles Barrett attempts a Layup. BLOCKED BY KYRIE CARTER! Ball is loose! Rebound secured by Jabari Barrett.

[06:03] Team_078 possession (Score: 5-12)
Kyrie Carter attempts a 3Pt. Contested by Kawhi Ingram (3.9 feet, MAN). Kyrie Carter misses. Rebound secured by Derrick Stewart.

[05:48] Team_075 possession (Score: 5-12)
Larry McCollum attempts a 3Pt. Contested by Isaiah Simmons (3.2 feet, ZONE). Larry McCollum misses. Rebound secured by Ben Ginobili.

[05:34] Team_078 possession (Score: 5-12)
Jabari Barnes attempts a 3Pt. Contested by Larry McCollum (4.7 feet, MAN). JABARI BARNES MAKES IT! Assist: Ben Ginobili
Score: 5-15

[05:20] Team_075 possession (Score: 5-15)
Klay Jokic attempts a Layup. BLOCKED BY JABARI BARRETT! Ball is loose! Rebound secured by Jabari Barrett.

[05:04] Team_078 possession (Score: 5-15)
FOUL! Reach-in foul on Myles Barrett during the drive. [IN THE BONUS! 5 team fouls] Isaiah Simmons to the line for 2 free throws. (Myles Barrett: 2 personal fouls)   FT 1/2: GOOD   FT 2/2: MISS Isaiah Simmons makes 1/2 from the line. Rebound secured by Derrick Stewart.
Score: 5-16

[04:50] Team_075 possession (Score: 5-16)
Kawhi Ingram attempts a 3Pt. Contested by Kyrie Carter (3.7 feet, ZONE). Kawhi Ingram misses. Offensive rebound by Kawhi Ingram! Kawhi Ingram kicks it out.

[04:32] Team_075 possession (Score: 5-16)
Myles Barrett attempts a 3Pt. Contested by Isaiah Simmons (3.4 feet, MAN). Myles Barrett misses. Rebound secured by Ben Ginobili.

[04:20] Team_078 possession (Score: 5-16)
Isaiah Simmons drives to the basket... FOUL! Offensive foul on Isaiah Simmons! Derrick Stewart drew the charge! [Team fouls: 2] (Isaiah Simmons: 1 personal fouls) TURNOVER! (dead ball)

[04:07] Team_075 possession (Score: 5-16)
Derrick Stewart drives, picks up Jabari Barrett. Help arrives from Kyrie Carter! Derrick Stewart attempts a Layup. Contested by Kyrie Carter (4.7 feet, ZONE). Derrick Stewart misses. Rebound secured by Ben Ginobili.

[03:52] Team_078 possession (Score: 5-16)
Ben Ginobili attempts a 3Pt. Contested by Derrick Stewart (4.9 feet, ZONE). BEN GINOBILI MAKES IT! Assist: Kyrie Carter
Score: 5-19

[03:38] Team_075 possession (Score: 5-19)
Derrick Stewart attempts a 3Pt. Contested by Isaiah Simmons (3.2 feet, ZONE). DERRICK STEWART MAKES IT! Assist: Klay Jokic
Score: 8-19

[03:26] Team_078 possession (Score: 8-19)
Jabari Barrett drives and kicks out. Jabari Barrett attempts a 3Pt. Contested by Klay Jokic (5.6 feet, MAN). JABARI BARRETT MAKES IT! Assist: Kyrie Carter
Score: 8-22

[03:13] Team_075 possession (Score: 8-22)
Klay Jokic drives and kicks out. Derrick Stewart attempts a Midrange. Contested by Jabari Barnes (4.2 feet, ZONE). DERRICK STEWART MAKES IT!
Score: 10-22

[02:56] Team_078 possession (Score: 10-22)
Kyrie Carter attempts a 3Pt. Contested by Kawhi Ingram (4.2 feet, MAN). KYRIE CARTER MAKES IT! Assist: Ben Ginobili
Score: 10-25

[02:45] Team_075 possession (Score: 10-25)
Kawhi Ingram attempts a Layup. Contested by Kyrie Carter (3.9 feet, MAN). Kawhi Ingram misses. Offensive rebound by Derrick Stewart! Derrick Stewart kicks it out.

[02:30] Team_075 possession (Score: 10-25)
FOUL! Holding foul on Ben Ginobili. [Team fouls: 3] No free throws, side out. (Ben Ginobili: 1 personal fouls)

[02:18] Team_075 possession (Score: 10-25)
Kawhi Ingram attempts a Layup. Contested by Jabari Barrett (4.8 feet, ZONE). Kawhi Ingram misses. Rebound secured by Isaiah Simmons.

[02:07] Team_078 possession (Score: 10-25)
FOUL! Reach-in foul on Klay Jokic during the drive. [IN THE BONUS! 6 team fouls] Jabari Barrett to the line for 2 free throws. (Klay Jokic: 2 personal fouls)   FT 1/2: GOOD   FT 2/2: MISS Jabari Barrett makes 1/2 from the line. Rebound secured by Derrick Stewart.
Score: 10-26

[01:53] Team_075 possession (Score: 10-26)
Derrick Stewart attempts a Midrange. Contested by Ben Ginobili (5.0 feet, ZONE). Derrick Stewart misses. Rebound secured by Ben Ginobili.

[01:34] Team_078 possession (Score: 10-26)
Ben Ginobili attempts a 3Pt. Contested by Larry McCollum (4.9 feet, ZONE). Ben Ginobili misses. Rebound secured by Klay Jokic.

[01:21] Team_075 possession (Score: 10-26)
Derrick Stewart loses control! Ball rolls out of bounds! TURNOVER! (dead ball)

[01:21] Substitution (Team_075): Larry McCollum OUT → D'Angelo Anunoby IN (stamina_rule2)

[01:21] Substitution (Team_075): Kawhi Ingram OUT → LeBron Ginobili IN (stamina_rule2)

[01:21] Substitution (Team_075): Myles Barrett OUT → Donovan Paul IN (stamina_rule2)

[01:21] Substitution (Team_075): Derrick Stewart OUT → Collin Duncan IN (stamina_rule2)

[01:21] Substitution (Team_075): Klay Jokic OUT → Kevin Towns IN (stamina_rule2)

[01:21] Substitution (Team_078): Jabari Barnes OUT → Magic Barrett IN (stamina_rule2)

[01:21] Substitution (Team_078): Kyrie Carter OUT → Damian Allen IN (stamina_rule2)

[01:21] Substitution (Team_078): Isaiah Simmons OUT → Malcolm Randle IN (stamina_rule2)

[01:21] Substitution (Team_078): Ben Ginobili OUT → Paul Ming IN (stamina_rule2)

[01:21] Substitution (Team_078): Jabari Barrett OUT → Draymond Irving IN (stamina_rule2)

[01:08] Team_078 possession (Score: 10-26)
FOUL! Reach-in foul on D'Angelo Anunoby during the drive. [IN THE BONUS! 7 team fouls] Magic Barrett to the line for 2 free throws. (D'Angelo Anunoby: 1 personal fouls)   FT 1/2: GOOD   FT 2/2: MISS Magic Barrett makes 1/2 from the line. Rebound secured by Collin Duncan.
Score: 10-27

[00:50] Team_075 possession (Score: 10-27)
FOUL! Reach-in foul on Malcolm Randle during the drive. [Team fouls: 4] No free throws, side out. (Malcolm Randle: 1 personal fouls)

[00:37] Team_075 possession (Score: 10-27)
Donovan Paul attempts a 3Pt. Contested by Damian Allen (5.4 feet, ZONE). Donovan Paul misses. Rebound secured by Paul Ming.

[00:21] Team_078 possession (Score: 10-27)
Malcolm Randle attempts a Layup. Contested by Kevin Towns (5.6 feet, ZONE). Malcolm Randle misses. Rebound secured by Collin Duncan.

[00:04] Team_075 possession (Score: 10-27)
Kevin Towns attempts a Midrange. Contested by Draymond Irving (5.8 feet, MAN). KEVIN TOWNS MAKES IT!
Score: 12-27

================================================================================
                              1ST QUARTER COMPLETE                              
================================================================================

1ST QUARTER SCORE: Team_075 12, Team_078 27

BOX SCORE:
================================================================================

Team_075
--------------------------------------------------------------------------------
Player                MIN  PTS  REB  AST  TO      FG   FG%      3P   3P%
--------------------------------------------------------------------------------
Derrick Stewart        11    9    7    0   0   4/9    44.4     0/0   0.0
Kevin Towns             1    2    0    0   0   1/1   100.0     0/0   0.0
Kawhi Ingram           11    1    3    0   0   1/3    33.3     0/0   0.0
Klay Jokic             11    0    2    1   0   0/2     0.0     0/0   0.0
Larry McCollum         11    0    0    0   0   0/2     0.0     0/0   0.0
Myles Barrett          11    0    0    1   0   0/2     0.0     0/0   0.0
Collin Duncan           1    0    2    0   0   0/0     0.0     0/0   0.0
Donovan Paul            1    0    0    0   0   0/1     0.0     0/0   0.0

TEAM: FG: 6/20 (30.0%), 3PT: 1/6 (16.7%), REB: 14 (4 off, 10 def), AST: 2, TO: 2
TEAM FOULS: 7 [Team_078 in BONUS]


Team_078
--------------------------------------------------------------------------------
Player                MIN  PTS  REB  AST  TO      FG   FG%      3P   3P%
--------------------------------------------------------------------------------
Kyrie Carter           11    8    0    2   0   3/4    75.0     0/0   0.0
Jabari Barrett         11    6    4    2   0   2/4    50.0     0/0   0.0
Ben Ginobili           11    5    7    2   0   2/4    50.0     0/0   0.0
Jabari Barnes          11    5    0    0   0   2/2   100.0     0/0   0.0
Isaiah Simmons         11    0    3    1   0   0/3     0.0     0/0   0.0
Magic Barrett           1    0    0    0   0   0/1     0.0     0/0   0.0
Paul Ming               1    0    1    0   0   0/0     0.0     0/0   0.0
Malcolm Randle          1    0    0    0   0   0/1     0.0     0/0   0.0

TEAM: FG: 9/19 (47.4%), 3PT: 4/9 (44.4%), REB: 15 (1 off, 14 def), AST: 7, TO: 2
TEAM FOULS: 4

================================================================================

================================================================================
                       2ND QUARTER - Team_075 vs Team_078                       
================================================================================

[12:00] Team_075 possession (Score: 12-27)
Larry McCollum attempts a 3Pt. Contested by Jabari Barnes (4.2 feet, MAN). Larry McCollum misses. Rebound secured by Ben Ginobili.

[11:44] Team_078 possession (Score: 12-27)
Ben Ginobili attempts a Layup. Contested by Derrick Stewart (5.0 feet, MAN). BEN GINOBILI MAKES IT! Assist: Isaiah Simmons
Score: 12-29

[11:27] Team_075 possession (Score: 12-29)
FOUL! Shooting foul on Jabari Barrett. Kawhi Ingram to the line for 2 free throws. [Team fouls: 1] (Jabari Barrett: 1 personal fouls)   FT 1/2: MISS   FT 2/2: GOOD Kawhi Ingram makes 1/2 from the line.
Score: 13-29

[11:09] Team_078 possession (Score: 13-29)
Ben Ginobili attempts a Layup. BLOCKED BY LARRY MCCOLLUM! Ball is loose! Rebound secured by Kawhi Ingram.

[10:54] Team_075 possession (Score: 13-29)
Myles Barrett attempts a 3Pt. Contested by Isaiah Simmons (3.5 feet, MAN). Myles Barrett misses. FOUL! Loose ball foul on Jabari Barrett during the rebound battle. [Team fouls: 2] No free throws, side out. (Jabari Barrett: 2 personal fouls)

[10:38] Team_075 possession (Score: 13-29)
Larry McCollum makes the Layup and draws the foul on Jabari Barrett! And-1! Larry McCollum to the line for 1. [Team fouls: 3] (Jabari Barrett: 3 personal fouls)   FT 1/1: MISS Larry McCollum makes 0/1 from the line. Offensive rebound by Kawhi Ingram! Kawhi Ingram kicks it out.
Score: 15-29

[10:22] Team_075 possession (Score: 15-29)
Derrick Stewart drives to the basket... Derrick Stewart throws a bad pass out of bounds! TURNOVER! (dead ball)

[10:22] Substitution (Team_075): Larry McCollum OUT → D'Angelo Anunoby IN (stamina_rule2)

[10:22] Substitution (Team_075): Kawhi Ingram OUT → LeBron Ginobili IN (stamina_rule2)

[10:22] Substitution (Team_075): Myles Barrett OUT → Donovan Paul IN (stamina_rule2)

[10:22] Substitution (Team_075): Derrick Stewart OUT → Collin Duncan IN (stamina_rule2)

[10:22] Substitution (Team_075): Klay Jokic OUT → Kevin Towns IN (stamina_rule2)

[10:22] Substitution (Team_078): Jabari Barnes OUT → Magic Barrett IN (stamina_rule2)

[10:22] Substitution (Team_078): Kyrie Carter OUT → Damian Allen IN (stamina_rule2)

[10:22] Substitution (Team_078): Isaiah Simmons OUT → Malcolm Randle IN (stamina_rule2)

[10:22] Substitution (Team_078): Ben Ginobili OUT → Paul Ming IN (stamina_rule2)

[10:22] Substitution (Team_078): Jabari Barrett OUT → Draymond Irving IN (stamina_rule2)

[10:12] Team_078 possession (Score: 15-29)
Malcolm Randle attempts a 3Pt. Contested by D'Angelo Anunoby (5.5 feet, ZONE). MALCOLM RANDLE MAKES IT! Assist: Draymond Irving
Score: 15-32

[09:59] Team_075 possession (Score: 15-32)
Kevin Towns throws a bad pass! Stolen by Draymond Irving! TURNOVER! (live ball)

[09:40] Team_078 possession (Score: 15-32)
Malcolm Randle attempts a 3Pt. Wide open! Donovan Paul is 6.1 feet away. [MAN] Malcolm Randle misses. Offensive rebound by Draymond Irving! Draymond Irving kicks it out.

[09:25] Team_078 possession (Score: 15-32)
Malcolm Randle drives, Donovan Paul stays with him. Malcolm Randle attempts a Layup. Wide open! Donovan Paul is 6.1 feet away. [MAN] Malcolm Randle misses. Rebound secured by Kevin Towns.

[09:09] Team_075 possession (Score: 15-32)
Donovan Paul attempts a Layup. BLOCKED BY PAUL MING! Ball goes out off Paul Ming. Donovan Paul's ball!

[08:51] Team_075 possession (Score: 15-32)
D'Angelo Anunoby attempts a 3Pt. Contested by Damian Allen (4.9 feet, ZONE). D'Angelo Anunoby misses. Rebound secured by Paul Ming.

[08:38] Team_078 possession (Score: 15-32)
FOUL! Offensive foul on Malcolm Randle! Donovan Paul drew the charge! [Team fouls: 4] (Malcolm Randle: 1 personal fouls) TURNOVER! (dead ball)

[08:24] Team_075 possession (Score: 15-32)
FOUL! Shooting foul on Draymond Irving. Kevin Towns to the line for 2 free throws. [BONUS: 5 team fouls] (Draymond Irving: 1 personal fouls)   FT 1/2: GOOD   FT 2/2: GOOD Kevin Towns makes 2/2 from the line.
Score: 17-32

[08:10] Team_078 possession (Score: 17-32)
Magic Barrett attempts a Midrange. Contested by D'Angelo Anunoby (5.8 feet, MAN). Magic Barrett misses. Rebound secured by D'Angelo Anunoby.

[07:58] Team_075 possession (Score: 17-32)
Collin Duncan attempts a Layup. Contested by Paul Ming (4.3 feet, ZONE). Collin Duncan misses. Rebound secured by Malcolm Randle.

[07:42] Team_078 possession (Score: 17-32)
Malcolm Randle drives, Donovan Paul stays with him. Malcolm Randle attempts a Layup. Wide open! Donovan Paul is 6.1 feet away. [MAN] MALCOLM RANDLE MAKES IT! Assist: Magic Barrett
Score: 17-34

[07:28] Team_075 possession (Score: 17-34)
Donovan Paul drives and kicks out. D'Angelo Anunoby attempts a Midrange. Contested by Magic Barrett (4.9 feet, MAN). D'ANGELO ANUNOBY MAKES IT! Assist: Kevin Towns
Score: 19-34

[07:12] Team_078 possession (Score: 19-34)
Paul Ming drives, Kevin Towns stays with him. Paul Ming attempts a Layup. Contested by Kevin Towns (5.4 feet, ZONE). Paul Ming misses. Rebound secured by Collin Duncan.

[06:58] Team_075 possession (Score: 19-34)
Donovan Paul attempts a 3Pt. Contested by Damian Allen (5.4 feet, ZONE). Donovan Paul misses. Rebound secured by Malcolm Randle.

[06:42] Team_078 possession (Score: 19-34)
Magic Barrett attempts a Midrange. Wide open! Collin Duncan is 6.1 feet away. [ZONE] Magic Barrett misses. Rebound secured by Kevin Towns.

[06:28] Team_075 possession (Score: 19-34)
D'Angelo Anunoby attempts a Midrange. Contested by Magic Barrett (4.9 feet, MAN). D'ANGELO ANUNOBY MAKES IT! Assist: LeBron Ginobili
Score: 21-34

[06:12] Team_078 possession (Score: 21-34)
Draymond Irving attempts a Midrange. Contested by Kevin Towns (5.8 feet, MAN). Draymond Irving misses. Offensive rebound by Paul Ming! Paul Ming kicks it out.

[06:00] Team_078 possession (Score: 21-34)
Paul Ming drives, picks up Collin Duncan. Help arrives from D'Angelo Anunoby! Paul Ming attempts a Layup. Contested by D'Angelo Anunoby (5.6 feet, ZONE). Paul Ming misses. Offensive rebound by Draymond Irving! Draymond Irving kicks it out.

[05:49] Team_078 possession (Score: 21-34)
Paul Ming attempts a Midrange. Contested by Donovan Paul (5.9 feet, ZONE). Paul Ming misses. Rebound secured by D'Angelo Anunoby.

[05:36] Team_075 possession (Score: 21-34)
LeBron Ginobili attempts a 3Pt. Contested by Damian Allen (4.9 feet, MAN). LeBron Ginobili misses. Rebound secured by Draymond Irving.

[05:18] Team_078 possession (Score: 21-34)
Magic Barrett attempts a 3Pt. Contested by D'Angelo Anunoby (5.8 feet, ZONE). Magic Barrett misses. Offensive rebound by Draymond Irving! Draymond Irving kicks it out.

[05:07] Team_078 possession (Score: 21-34)
Draymond Irving attempts a Midrange. Wide open! Donovan Paul is 6.2 feet away. [ZONE] Draymond Irving misses. Rebound secured by Collin Duncan.

[04:55] Team_075 possession (Score: 21-34)
FOUL! Shooting foul on Magic Barrett. D'Angelo Anunoby to the line for 2 free throws. [BONUS: 6 team fouls] (Magic Barrett: 1 personal fouls)   FT 1/2: GOOD   FT 2/2: GOOD D'Angelo Anunoby makes 2/2 from the line.
Score: 23-34

[04:41] Team_078 possession (Score: 23-34)
Damian Allen drives, picks up Kevin Towns. Help arrives from D'Angelo Anunoby! Damian Allen attempts a Dunk. Contested by D'Angelo Anunoby (5.6 feet, ZONE). Damian Allen misses. Rebound secured by D'Angelo Anunoby.

[04:25] Team_075 possession (Score: 23-34)
LeBron Ginobili attempts a 3Pt. Contested by Damian Allen (5.0 feet, ZONE). LeBron Ginobili misses. Rebound secured by Draymond Irving.

[04:11] Team_078 possession (Score: 23-34)
Draymond Irving attempts a Layup. Contested by Kevin Towns (5.8 feet, ZONE). Draymond Irving misses. Rebound secured by D'Angelo Anunoby.

[03:57] Team_075 possession (Score: 23-34)
Collin Duncan attempts a 3Pt. Contested by Damian Allen (5.0 feet, ZONE). Collin Duncan misses. Rebound secured by Draymond Irving.

[03:44] Team_078 possession (Score: 23-34)
Draymond Irving attempts a Layup. BLOCKED BY KEVIN TOWNS! Ball deflects out of bounds off Draymond Irving.

[03:30] Team_075 possession (Score: 23-34)
FOUL! Offensive foul on Donovan Paul! Malcolm Randle drew the charge! [Team fouls: 1] (Donovan Paul: 1 personal fouls) TURNOVER! (dead ball)

[03:16] Team_078 possession (Score: 23-34)
Magic Barrett loses control! Ball rolls out of bounds! TURNOVER! (dead ball)

[03:00] Team_075 possession (Score: 23-34)
Kevin Towns drives, Paul Ming stays with him. Kevin Towns attempts a Dunk. Contested by Paul Ming (4.8 feet, ZONE). Kevin Towns misses. Rebound secured by Draymond Irving.

[02:43] Team_078 possession (Score: 23-34)
Damian Allen drives, Kevin Towns stays with him. Damian Allen attempts a Dunk. Contested by Kevin Towns (5.7 feet, ZONE). DAMIAN ALLEN MAKES IT! Assist: Malcolm Randle
Score: 23-36

[02:32] Team_075 possession (Score: 23-36)
Donovan Paul attempts a 3Pt. Contested by Malcolm Randle (4.8 feet, MAN). Donovan Paul misses. Offensive rebound by Kevin Towns! Kevin Towns kicks it out.

[02:19] Team_075 possession (Score: 23-36)
D'Angelo Anunoby attempts a 3Pt. Contested by Damian Allen (5.0 feet, ZONE). D'Angelo Anunoby misses. Rebound secured by Malcolm Randle.

[02:04] Team_078 possession (Score: 23-36)
Magic Barrett attempts a 3Pt. Wide open! D'Angelo Anunoby is 6.0 feet away. [MAN] Magic Barrett misses. FOUL! Loose ball foul on D'Angelo Anunoby during the rebound battle. [Team fouls: 2] No free throws, side out. (D'Angelo Anunoby: 1 personal fouls)

[01:49] Team_078 possession (Score: 23-36)
Magic Barrett attempts a 3Pt. Contested by LeBron Ginobili (5.5 feet, ZONE). Magic Barrett misses. Rebound secured by Kevin Towns.

[01:37] Team_075 possession (Score: 23-36)
FOUL! Shooting foul on Damian Allen. Donovan Paul to the line for 3 free throws. [BONUS: 7 team fouls] (Damian Allen: 1 personal fouls)   FT 1/3: MISS   FT 2/3: MISS   FT 3/3: GOOD Donovan Paul makes 1/3 from the line.
Score: 24-36

[01:20] Team_078 possession (Score: 24-36)
Draymond Irving drives, picks up Kevin Towns. Help arrives from D'Angelo Anunoby! Draymond Irving attempts a Dunk. Wide open! D'Angelo Anunoby is 6.1 feet away. [ZONE] Draymond Irving misses. Rebound secured by Kevin Towns.

[01:02] Team_075 possession (Score: 24-36)
Collin Duncan attempts a Midrange. Contested by Damian Allen (5.2 feet, ZONE). Collin Duncan misses. Offensive rebound by Collin Duncan! Collin Duncan kicks it out.

[00:47] Team_075 possession (Score: 24-36)
Donovan Paul attempts a Midrange. Contested by Malcolm Randle (5.0 feet, MAN). Donovan Paul misses. Rebound secured by Draymond Irving.

[00:30] Team_078 possession (Score: 24-36)
Damian Allen makes the Dunk and draws the foul on Kevin Towns! And-1! Damian Allen to the line for 1. [Team fouls: 3] (Kevin Towns: 1 personal fouls)   FT 1/1: GOOD Damian Allen makes 1/1 from the line.
Score: 24-39

[00:11] Team_075 possession (Score: 24-39)
LeBron Ginobili attempts a 3Pt. Contested by Damian Allen (5.3 feet, ZONE). LEBRON GINOBILI MAKES IT! Assist: Donovan Paul
Score: 27-39

================================================================================
                              2ND QUARTER COMPLETE                              
================================================================================

2ND QUARTER SCORE: Team_075 15, Team_078 12

BOX SCORE:
================================================================================

Team_075
--------------------------------------------------------------------------------
Player                MIN  PTS  REB  AST  TO      FG   FG%      3P   3P%
--------------------------------------------------------------------------------
D'Angelo Anunoby       12    6    4    0   0   3/5    60.0     0/0   0.0
LeBron Ginobili        12    3    0    1   0   1/3    33.3     0/0   0.0
Kevin Towns            12    2    5    1   0   1/2    50.0     0/0   0.0
Kawhi Ingram           13    1    2    0   0   1/1   100.0     0/0   0.0
Donovan Paul           12    1    0    1   0   1/3    33.3     0/0   0.0
Larry McCollum         13    0    0    0   0   0/1     0.0     0/0   0.0
Derrick Stewart        13    0    1    0   0   0/0     0.0     0/0   0.0
Collin Duncan          12    0    3    0   0   0/2     0.0     0/0   0.0

TEAM: FG: 7/17 (41.2%), 3PT: 2/9 (22.2%), REB: 15 (4 off, 11 def), AST: 3, TO: 3
TEAM FOULS: 3


Team_078
--------------------------------------------------------------------------------
Player                MIN  PTS  REB  AST  TO      FG   FG%      3P   3P%
--------------------------------------------------------------------------------
Malcolm Randle         12    5    3    1   0   2/3    66.7     0/0   0.0
Damian Allen           12    5    0    0   0   2/3    66.7     0/0   0.0
Ben Ginobili           13    2    1    0   0   1/2    50.0     0/0   0.0
Isaiah Simmons         13    0    0    1   0   0/0     0.0     0/0   0.0
Draymond Irving        12    0    8    1   0   0/4     0.0     0/0   0.0
Paul Ming              12    0    3    0   0   0/2     0.0     0/0   0.0
Magic Barrett          12    0    0    1   0   0/3     0.0     0/0   0.0

TEAM: FG: 5/17 (29.4%), 3PT: 1/2 (50.0%), REB: 15 (5 off, 10 def), AST: 4, TO: 2
TEAM FOULS: 7 [Team_075 in BONUS]

================================================================================

================================================================================
                       3RD QUARTER - Team_075 vs Team_078                       
================================================================================

[12:00] Team_075 possession (Score: 27-39)
FOUL! Reach-in foul on Ben Ginobili during the drive. [Team fouls: 1] No free throws, side out. (Ben Ginobili: 1 personal fouls)

[11:45] Team_075 possession (Score: 27-39)
Derrick Stewart drives and kicks out. Klay Jokic attempts a Midrange. Contested by Jabari Barrett (4.7 feet, MAN). KLAY JOKIC MAKES IT!
Score: 29-39

[11:31] Team_078 possession (Score: 29-39)
Kyrie Carter attempts a 3Pt. Contested by Kawhi Ingram (3.9 feet, MAN). Kyrie Carter misses. Rebound secured by Derrick Stewart.

[11:14] Team_075 possession (Score: 29-39)
Klay Jokic attempts a 3Pt. Contested by Isaiah Simmons (3.5 feet, ZONE). Klay Jokic misses. Offensive rebound by Derrick Stewart! Derrick Stewart kicks it out.

[11:04] Team_075 possession (Score: 29-39)
Myles Barrett drives, picks up Jabari Barrett. Help arrives from Kyrie Carter! Myles Barrett attempts a Layup. Contested by Kyrie Carter (4.9 feet, ZONE). MYLES BARRETT MAKES IT! Assist: Kawhi Ingram
Score: 31-39

[10:52] Team_078 possession (Score: 31-39)
FOUL! Shooting foul on Larry McCollum. Jabari Barnes to the line for 3 free throws. [Team fouls: 1] (Larry McCollum: 1 personal fouls)   FT 1/3: GOOD   FT 2/3: MISS   FT 3/3: GOOD Jabari Barnes makes 2/3 from the line.
Score: 31-41

[10:38] Team_075 possession (Score: 31-41)
Larry McCollum drives to the basket... Larry McCollum commits a violation (traveling/carry)! TURNOVER! (dead ball)

[10:29] Team_078 possession (Score: 31-41)
Kyrie Carter attempts a 3Pt. Contested by Kawhi Ingram (3.9 feet, MAN). Kyrie Carter misses. Rebound secured by Kawhi Ingram.

[10:10] Team_075 possession (Score: 31-41)
Myles Barrett attempts a Midrange. Contested by Isaiah Simmons (3.3 feet, MAN). MYLES BARRETT MAKES IT! Assist: Larry McCollum
Score: 33-41

[09:57] Team_078 possession (Score: 33-41)
Jabari Barrett attempts a Midrange. Contested by Klay Jokic (5.4 feet, MAN). JABARI BARRETT MAKES IT! Assist: Kyrie Carter
Score: 33-43

[09:40] Team_075 possession (Score: 33-43)
Derrick Stewart drives and kicks out. Derrick Stewart attempts a Midrange. Contested by Kyrie Carter (3.8 feet, ZONE). Derrick Stewart misses. Offensive rebound by Derrick Stewart! Derrick Stewart kicks it out.

[09:26] Team_075 possession (Score: 33-43)
FOUL! Shooting foul on Kyrie Carter. Klay Jokic to the line for 2 free throws. [Team fouls: 2] (Kyrie Carter: 1 personal fouls)   FT 1/2: GOOD   FT 2/2: GOOD Klay Jokic makes 2/2 from the line.
Score: 35-43

[09:12] Team_078 possession (Score: 35-43)
FOUL! Holding foul on Larry McCollum. [Team fouls: 2] No free throws, side out. (Larry McCollum: 2 personal fouls)

[08:56] Team_078 possession (Score: 35-43)
Jabari Barnes attempts a 3Pt. Contested by Larry McCollum (4.7 feet, MAN). Jabari Barnes misses. Rebound secured by Derrick Stewart.

[08:45] Team_075 possession (Score: 35-43)
FOUL! Shooting foul on Ben Ginobili. Derrick Stewart to the line for 2 free throws. [Team fouls: 3] (Ben Ginobili: 2 personal fouls)   FT 1/2: GOOD   FT 2/2: GOOD Derrick Stewart makes 2/2 from the line.
Score: 37-43

[08:30] Team_078 possession (Score: 37-43)
FOUL! Holding foul on Larry McCollum. [Team fouls: 3] No free throws, side out. (Larry McCollum: 3 personal fouls)

[08:16] Team_078 possession (Score: 37-43)
Kyrie Carter attempts a Midrange. Contested by Derrick Stewart (4.4 feet, ZONE). Kyrie Carter misses. Offensive rebound by Isaiah Simmons! Isaiah Simmons puts it back in!
Score: 37-45

[08:03] Team_075 possession (Score: 37-45)
FOUL! Reach-in foul on Jabari Barrett during the drive. [Team fouls: 4] No free throws, side out. (Jabari Barrett: 1 personal fouls)

[07:51] Team_075 possession (Score: 37-45)
Kawhi Ingram attempts a 3Pt. Contested by Kyrie Carter (3.7 feet, MAN). KAWHI INGRAM MAKES IT! Assist: Myles Barrett
Score: 40-45

[07:35] Team_078 possession (Score: 40-45)
Ben Ginobili drives, Derrick Stewart stays with him. Ben Ginobili attempts a Dunk. Contested by Derrick Stewart (4.8 feet, MAN). Ben Ginobili misses. Offensive rebound by Jabari Barrett! Jabari Barrett kicks it out.

[07:21] Team_078 possession (Score: 40-45)
Jabari Barnes attempts a 3Pt. Contested by Larry McCollum (4.7 feet, MAN). Jabari Barnes misses. Offensive rebound by Isaiah Simmons! Isaiah Simmons's putback is no good. Rebound secured by Klay Jokic.

[07:05] Team_075 possession (Score: 40-45)
Derrick Stewart drives, picks up Ben Ginobili. Help arrives from Kyrie Carter! Derrick Stewart attempts a Layup. Contested by Kyrie Carter (4.6 feet, MAN). Derrick Stewart misses. Offensive rebound by Kawhi Ingram! Kawhi Ingram kicks it out.

[06:54] Team_075 possession (Score: 40-45)
Larry McCollum attempts a 3Pt. Contested by Isaiah Simmons (3.2 feet, ZONE). Larry McCollum misses. Rebound secured by Ben Ginobili.

[06:40] Team_078 possession (Score: 40-45)
Jabari Barrett drives and kicks out. Isaiah Simmons attempts a 3Pt. Contested by Larry McCollum (4.2 feet, ZONE). Isaiah Simmons misses. Offensive rebound by Jabari Barrett! Jabari Barrett kicks it out.

[06:22] Team_078 possession (Score: 40-45)
Jabari Barnes attempts a Layup. Contested by Derrick Stewart (4.9 feet, ZONE). JABARI BARNES MAKES IT! Assist: Kyrie Carter
Score: 40-47

[06:04] Team_075 possession (Score: 40-47)
Larry McCollum attempts a 3Pt. Contested by Jabari Barnes (4.0 feet, MAN). Larry McCollum misses. Rebound secured by Jabari Barrett.

[05:49] Team_078 possession (Score: 40-47)
Kyrie Carter drives, picks up Derrick Stewart. Help arrives from Larry McCollum! Kyrie Carter attempts a Dunk. Contested by Larry McCollum (4.4 feet, ZONE). Kyrie Carter misses. Rebound secured by Klay Jokic.

[05:38] Team_075 possession (Score: 40-47)
FOUL! Shooting foul on Isaiah Simmons. Larry McCollum to the line for 2 free throws. [BONUS: 5 team fouls] (Isaiah Simmons: 1 personal fouls)   FT 1/2: GOOD   FT 2/2: GOOD Larry McCollum makes 2/2 from the line.
Score: 42-47

[05:23] Team_078 possession (Score: 42-47)
Ben Ginobili commits a violation (traveling/carry)! TURNOVER! (dead ball)

[05:10] Team_075 possession (Score: 42-47)
Derrick Stewart attempts a Midrange. Contested by Isaiah Simmons (3.0 feet, ZONE). Derrick Stewart misses. Rebound secured by Jabari Barrett.

[04:54] Team_078 possession (Score: 42-47)
Isaiah Simmons attempts a 3Pt. Contested by Larry McCollum (4.5 feet, ZONE). ISAIAH SIMMONS MAKES IT! Assist: Jabari Barnes
Score: 42-50

[04:36] Team_075 possession (Score: 42-50)
Klay Jokic attempts a Midrange. Contested by Jabari Barrett (5.2 feet, MAN). Klay Jokic misses. Rebound secured by Ben Ginobili.

[04:22] Team_078 possession (Score: 42-50)
FOUL! Shooting foul on Klay Jokic. Jabari Barrett to the line for 2 free throws. [Team fouls: 4] (Klay Jokic: 1 personal fouls)   FT 1/2: MISS   FT 2/2: GOOD Jabari Barrett makes 1/2 from the line.
Score: 42-51

[04:02] Team_075 possession (Score: 42-51)
Myles Barrett attempts a 3Pt. Contested by Isaiah Simmons (3.4 feet, ZONE). Myles Barrett misses. Rebound secured by Ben Ginobili.

[03:46] Team_078 possession (Score: 42-51)
Jabari Barrett drives and kicks out. Isaiah Simmons attempts a 3Pt. Contested by Larry McCollum (4.4 feet, ZONE). ISAIAH SIMMONS MAKES IT! Assist: Jabari Barnes
Score: 42-54

[03:34] Team_075 possession (Score: 42-54)
Kawhi Ingram attempts a Midrange. Contested by Kyrie Carter (3.8 feet, ZONE). KAWHI INGRAM MAKES IT!
Score: 44-54

[03:17] Team_078 possession (Score: 44-54)
Ben Ginobili attempts a Midrange. Contested by Derrick Stewart (5.0 feet, MAN). Ben Ginobili misses. Rebound secured by Kawhi Ingram.

[03:06] Team_075 possession (Score: 44-54)
Myles Barrett attempts a 3Pt. Contested by Isaiah Simmons (3.5 feet, ZONE). MYLES BARRETT MAKES IT! Assist: Derrick Stewart
Score: 47-54

[02:50] Team_078 possession (Score: 47-54)
Kyrie Carter attempts a 3Pt. Contested by Larry McCollum (4.4 feet, ZONE). Kyrie Carter misses. Rebound secured by Derrick Stewart.

[02:33] Team_075 possession (Score: 47-54)
Myles Barrett drives and kicks out. Kawhi Ingram attempts a Midrange. Contested by Kyrie Carter (4.1 feet, MAN). Kawhi Ingram misses. Rebound secured by Ben Ginobili.

[02:22] Team_078 possession (Score: 47-54)
Jabari Barnes attempts a 3Pt. Contested by Larry McCollum (4.9 feet, ZONE). JABARI BARNES MAKES IT! Assist: Isaiah Simmons
Score: 47-57

[02:12] Team_075 possession (Score: 47-57)
Larry McCollum drives, picks up Jabari Barrett. Help arrives from Kyrie Carter! Larry McCollum attempts a Dunk. Contested by Kyrie Carter (5.1 feet, ZONE). Larry McCollum misses. Offensive rebound by Derrick Stewart! Derrick Stewart kicks it out.

[01:58] Team_075 possession (Score: 47-57)
FOUL! Shooting foul on Jabari Barrett. Derrick Stewart to the line for 2 free throws. [BONUS: 6 team fouls] (Jabari Barrett: 2 personal fouls)   FT 1/2: GOOD   FT 2/2: GOOD Derrick Stewart makes 2/2 from the line.
Score: 49-57

[01:45] Team_078 possession (Score: 49-57)
Isaiah Simmons attempts a 3Pt. Wide open! Myles Barrett is 6.3 feet away. [MAN] ISAIAH SIMMONS MAKES IT! Assist: Ben Ginobili
Score: 49-60

[01:27] Team_075 possession (Score: 49-60)
Myles Barrett attempts a 3Pt. Contested by Isaiah Simmons (3.7 feet, ZONE). Myles Barrett misses. Offensive rebound by Derrick Stewart! Derrick Stewart kicks it out.

[01:14] Team_075 possession (Score: 49-60)
Kawhi Ingram drives to the basket... Kawhi Ingram loses control! Ball rolls out of bounds! TURNOVER! (dead ball)

[01:14] Substitution (Team_075): Larry McCollum OUT → D'Angelo Anunoby IN (stamina_rule2)

[01:14] Substitution (Team_075): Kawhi Ingram OUT → LeBron Ginobili IN (stamina_rule2)

[01:14] Substitution (Team_075): Myles Barrett OUT → Donovan Paul IN (stamina_rule2)

[01:14] Substitution (Team_075): Derrick Stewart OUT → Collin Duncan IN (stamina_rule2)

[01:14] Substitution (Team_075): Klay Jokic OUT → Kevin Towns IN (stamina_rule2)

[01:14] Substitution (Team_078): Jabari Barnes OUT → Magic Barrett IN (stamina_rule2)

[01:14] Substitution (Team_078): Kyrie Carter OUT → Damian Allen IN (stamina_rule2)

[01:14] Substitution (Team_078): Isaiah Simmons OUT → Malcolm Randle IN (stamina_rule2)

[01:14] Substitution (Team_078): Ben Ginobili OUT → Paul Ming IN (stamina_rule2)

[01:14] Substitution (Team_078): Jabari Barrett OUT → Draymond Irving IN (stamina_rule2)

[01:02] Team_078 possession (Score: 49-60)
Magic Barrett attempts a Layup. Contested by Kevin Towns (5.9 feet, ZONE). Magic Barrett misses. Rebound secured by Collin Duncan.

[00:48] Team_075 possession (Score: 49-60)
Collin Duncan attempts a 3Pt. Contested by Paul Ming (4.3 feet, MAN). COLLIN DUNCAN MAKES IT! Assist: Donovan Paul
Score: 52-60

[00:34] Team_078 possession (Score: 52-60)
Paul Ming throws a bad pass out of bounds! TURNOVER! (dead ball)

[00:20] Team_075 possession (Score: 52-60)
Donovan Paul drives, picks up Malcolm Randle. Help arrives from Damian Allen! Donovan Paul attempts a Layup. Contested by Damian Allen (4.7 feet, MAN). DONOVAN PAUL MAKES IT! Assist: Collin Duncan
Score: 54-60

[00:02] Team_078 possession (Score: 54-60)
Draymond Irving attempts a Midrange. Contested by Kevin Towns (5.8 feet, MAN). Draymond Irving misses. FOUL! Loose ball foul on Kevin Towns during the rebound battle. [IN THE BONUS! 5 team fouls] Paul Ming to the line for 2 free throws. (Kevin Towns: 1 personal fouls)   FT 1/2: GOOD   FT 2/2: GOOD Paul Ming makes 2/2 from the line.
Score: 54-62

================================================================================
                              3RD QUARTER COMPLETE                              
================================================================================

3RD QUARTER SCORE: Team_075 27, Team_078 23

BOX SCORE:
================================================================================

Team_075
--------------------------------------------------------------------------------
Player                MIN  PTS  REB  AST  TO      FG   FG%      3P   3P%
--------------------------------------------------------------------------------
Myles Barrett          24    7    0    1   0   3/5    60.0     0/0   0.0
Kawhi Ingram           24    5    3    1   0   2/2   100.0     0/0   0.0
Klay Jokic             24    4    2    0   0   2/3    66.7     0/0   0.0
Derrick Stewart        24    4    7    1   0   2/3    66.7     0/0   0.0
Collin Duncan          13    3    1    1   0   1/1   100.0     0/0   0.0
Larry McCollum         24    2    0    1   0   1/3    33.3     0/0   0.0
Donovan Paul           13    2    0    1   0   1/1   100.0     0/0   0.0

TEAM: FG: 12/18 (66.7%), 3PT: 3/6 (50.0%), REB: 12 (5 off, 7 def), AST: 6, TO: 2
TEAM FOULS: 5 [Team_078 in BONUS]


Team_078
--------------------------------------------------------------------------------
Player                MIN  PTS  REB  AST  TO      FG   FG%      3P   3P%
--------------------------------------------------------------------------------
Isaiah Simmons         24   11    1    1   0   4/4   100.0     0/0   0.0
Jabari Barnes          24    7    0    2   0   3/5    60.0     0/0   0.0
Jabari Barrett         24    3    4    0   0   2/2   100.0     0/0   0.0
Paul Ming              13    2    0    0   0   1/1   100.0     0/0   0.0
Kyrie Carter           24    0    0    2   0   0/4     0.0     0/0   0.0
Ben Ginobili           24    0    4    1   0   0/1     0.0     0/0   0.0
Magic Barrett          13    0    0    0   0   0/1     0.0     0/0   0.0

TEAM: FG: 10/18 (55.6%), 3PT: 4/9 (44.4%), REB: 10 (4 off, 6 def), AST: 6, TO: 2
TEAM FOULS: 6 [Team_075 in BONUS]

================================================================================

================================================================================
                       4TH QUARTER - Team_075 vs Team_078                       
================================================================================

[12:00] Team_075 possession (Score: 54-62)
Kawhi Ingram loses control! Ball rolls out of bounds! TURNOVER! (dead ball)

[11:45] Team_078 possession (Score: 54-62)
Jabari Barnes attempts a 3Pt. Contested by Larry McCollum (4.8 feet, ZONE). Jabari Barnes misses. Offensive rebound by Isaiah Simmons! Isaiah Simmons puts it back in!
Score: 54-64

[11:31] Team_075 possession (Score: 54-64)
Kawhi Ingram attempts a 3Pt. Contested by Kyrie Carter (3.8 feet, MAN). KAWHI INGRAM MAKES IT! Assist: Derrick Stewart
Score: 57-64

[11:15] Team_078 possession (Score: 57-64)
Kyrie Carter drives to the basket... Kyrie Carter throws a bad pass! Stolen by Kawhi Ingram! TURNOVER! (live ball)

[10:59] Team_075 possession (Score: 57-64)
Myles Barrett attempts a 3Pt. Contested by Isaiah Simmons (3.5 feet, ZONE). Myles Barrett misses. Rebound secured by Jabari Barrett.

[10:46] Team_078 possession (Score: 57-64)
Jabari Barrett loses control! Ball rolls out of bounds! TURNOVER! (dead ball)

[10:46] Substitution (Team_075): Larry McCollum OUT → D'Angelo Anunoby IN (stamina_rule2)

[10:46] Substitution (Team_075): Kawhi Ingram OUT → LeBron Ginobili IN (stamina_rule2)

[10:46] Substitution (Team_075): Myles Barrett OUT → Donovan Paul IN (stamina_rule2)

[10:46] Substitution (Team_075): Derrick Stewart OUT → Collin Duncan IN (stamina_rule2)

[10:46] Substitution (Team_075): Klay Jokic OUT → Kevin Towns IN (stamina_rule2)

[10:46] Substitution (Team_078): Jabari Barnes OUT → Magic Barrett IN (stamina_rule2)

[10:46] Substitution (Team_078): Ben Ginobili OUT → Paul Ming IN (stamina_rule2)

[10:46] Substitution (Team_078): Jabari Barrett OUT → Draymond Irving IN (stamina_rule2)

[10:34] Team_075 possession (Score: 57-64)
Donovan Paul attempts a Midrange. Contested by Isaiah Simmons (3.9 feet, MAN). Donovan Paul misses. Rebound secured by Paul Ming.

[10:20] Team_078 possession (Score: 57-64)
Draymond Irving attempts a Midrange. Contested by LeBron Ginobili (5.2 feet, ZONE). DRAYMOND IRVING MAKES IT! Assist: Isaiah Simmons
Score: 57-66

[10:09] Team_075 possession (Score: 57-66)
FOUL! Holding foul on Paul Ming. [Team fouls: 1] No free throws, side out. (Paul Ming: 1 personal fouls)

[09:55] Team_075 possession (Score: 57-66)
Kevin Towns attempts a Midrange. Contested by Draymond Irving (5.8 feet, MAN). Kevin Towns misses. Rebound secured by Draymond Irving.

[09:38] Team_078 possession (Score: 57-66)
Paul Ming drives to the basket... Paul Ming throws a bad pass! Stolen by Collin Duncan! TURNOVER! (live ball)

[09:20] Team_075 possession (Score: 57-66)
Collin Duncan attempts a Layup. BLOCKED BY KYRIE CARTER! Ball is loose! Rebound secured by Paul Ming.

[09:06] Team_078 possession (Score: 57-66)
Draymond Irving drives, Kevin Towns stays with him. Draymond Irving attempts a Dunk. Contested by Kevin Towns (5.8 feet, MAN). Draymond Irving misses. Rebound secured by Kevin Towns.

[08:52] Team_075 possession (Score: 57-66)
D'Angelo Anunoby attempts a Midrange. Contested by Kyrie Carter (4.3 feet, ZONE). D'Angelo Anunoby misses. Rebound secured by Draymond Irving.

[08:38] Team_078 possession (Score: 57-66)
Isaiah Simmons attempts a Midrange. Contested by LeBron Ginobili (4.9 feet, ZONE). ISAIAH SIMMONS MAKES IT! Assist: Paul Ming
Score: 57-68

[08:26] Team_075 possession (Score: 57-68)
LeBron Ginobili throws a bad pass! Stolen by Kyrie Carter! TURNOVER! (live ball)

[08:13] Team_078 possession (Score: 57-68)
Kyrie Carter attempts a 3Pt. Contested by D'Angelo Anunoby (5.1 feet, ZONE). Kyrie Carter misses. Rebound secured by Kevin Towns.

[07:58] Team_075 possession (Score: 57-68)
Donovan Paul attempts a 3Pt. Contested by Isaiah Simmons (4.2 feet, MAN). Donovan Paul misses. Rebound secured by Isaiah Simmons.

[07:45] Team_078 possession (Score: 57-68)
Draymond Irving attempts a Midrange. Contested by Kevin Towns (5.8 feet, MAN). Draymond Irving misses. Rebound secured by D'Angelo Anunoby.

[07:31] Team_075 possession (Score: 57-68)
Kevin Towns drives and kicks out. D'Angelo Anunoby attempts a 3Pt. Contested by Isaiah Simmons (3.8 feet, ZONE). D'Angelo Anunoby misses. Rebound secured by Paul Ming.

[07:15] Team_078 possession (Score: 57-68)
Kyrie Carter attempts a 3Pt. Contested by Collin Duncan (5.4 feet, ZONE). Kyrie Carter misses. Rebound secured by Kevin Towns.

[07:01] Team_075 possession (Score: 57-68)
Donovan Paul attempts a 3Pt. Contested by Isaiah Simmons (4.4 feet, ZONE). Donovan Paul misses. Rebound secured by Draymond Irving.

[06:46] Team_078 possession (Score: 57-68)
Kyrie Carter attempts a Midrange. Contested by D'Angelo Anunoby (5.1 feet, ZONE). Kyrie Carter misses. Offensive rebound by Isaiah Simmons! Isaiah Simmons puts it back in!
Score: 57-70

[06:35] Team_075 possession (Score: 57-70)
Collin Duncan attempts a Layup. Contested by Paul Ming (4.3 feet, ZONE). Collin Duncan misses. Offensive rebound by Collin Duncan! Collin Duncan kicks it out.

[06:17] Team_075 possession (Score: 57-70)
Donovan Paul attempts a Layup. Contested by Paul Ming (4.8 feet, ZONE). DONOVAN PAUL MAKES IT! Assist: LeBron Ginobili
Score: 59-70

[06:05] Team_078 possession (Score: 59-70)
Draymond Irving makes the Dunk and draws the foul on Kevin Towns! And-1! Draymond Irving to the line for 1. [Team fouls: 1] (Kevin Towns: 1 personal fouls)   FT 1/1: GOOD Draymond Irving makes 1/1 from the line.
Score: 59-73

[05:53] Team_075 possession (Score: 59-73)
D'Angelo Anunoby attempts a Midrange. Contested by Magic Barrett (4.9 feet, MAN). D'ANGELO ANUNOBY MAKES IT!
Score: 61-73

[05:40] Team_078 possession (Score: 61-73)
Magic Barrett attempts a 3Pt. Contested by D'Angelo Anunoby (5.8 feet, ZONE). Magic Barrett misses. Offensive rebound by Paul Ming! Paul Ming kicks it out.

[05:31] Team_078 possession (Score: 61-73)
Magic Barrett attempts a 3Pt. Contested by D'Angelo Anunoby (5.8 feet, ZONE). Magic Barrett misses. Rebound secured by Kevin Towns.

[05:13] Team_075 possession (Score: 61-73)
FOUL! Holding foul on Isaiah Simmons. [Team fouls: 2] No free throws, side out. (Isaiah Simmons: 1 personal fouls)

[05:03] Team_075 possession (Score: 61-73)
Kevin Towns attempts a Layup. Contested by Draymond Irving (5.8 feet, MAN). KEVIN TOWNS MAKES IT!
Score: 63-73

[04:52] Team_078 possession (Score: 63-73)
Kyrie Carter attempts a 3Pt. Contested by D'Angelo Anunoby (5.1 feet, ZONE). Kyrie Carter misses. Rebound secured by Kevin Towns.

[04:37] Team_075 possession (Score: 63-73)
D'Angelo Anunoby drives to the basket... D'Angelo Anunoby loses the ball! Stripped by Paul Ming! TURNOVER! (live ball)

[04:25] Team_078 possession (Score: 63-73)
Magic Barrett attempts a Midrange. Contested by D'Angelo Anunoby (5.9 feet, MAN). Magic Barrett misses. Offensive rebound by Draymond Irving! Draymond Irving kicks it out.

[04:07] Team_078 possession (Score: 63-73)
Kyrie Carter drives, LeBron Ginobili stays with him. Kyrie Carter attempts a Dunk. Contested by LeBron Ginobili (4.6 feet, MAN). Kyrie Carter misses. Offensive rebound by Paul Ming! Paul Ming kicks it out.

[03:53] Team_078 possession (Score: 63-73)
Draymond Irving attempts a 3Pt. Contested by D'Angelo Anunoby (5.7 feet, ZONE). Draymond Irving misses. Rebound secured by Collin Duncan.

[03:38] Team_075 possession (Score: 63-73)
D'Angelo Anunoby attempts a Layup. Contested by Magic Barrett (5.0 feet, MAN). D'ANGELO ANUNOBY MAKES IT!
Score: 65-73

[03:22] Team_078 possession (Score: 65-73)
Isaiah Simmons attempts a 3Pt. Contested by Donovan Paul (6.0 feet, MAN). Isaiah Simmons misses. Rebound secured by Collin Duncan.

[03:07] Team_075 possession (Score: 65-73)
D'Angelo Anunoby attempts a 3Pt. Contested by Isaiah Simmons (4.6 feet, ZONE). D'ANGELO ANUNOBY MAKES IT! Assist: Donovan Paul
Score: 68-73

[02:55] Team_078 possession (Score: 68-73)
FOUL! Reach-in foul on Kevin Towns during the drive. [Team fouls: 2] No free throws, side out. (Kevin Towns: 2 personal fouls)

[02:42] Team_078 possession (Score: 68-73)
Paul Ming attempts a Midrange. Contested by Collin Duncan (5.8 feet, ZONE). Paul Ming misses. Offensive rebound by Paul Ming! Paul Ming kicks it out.

[02:24] Team_078 possession (Score: 68-73)
FOUL! Reach-in foul on Collin Duncan during the drive. [Team fouls: 3] No free throws, side out. (Collin Duncan: 1 personal fouls)

[02:09] Team_078 possession (Score: 68-73)
Paul Ming drives to the basket... Paul Ming throws a bad pass out of bounds! TURNOVER! (dead ball)

[02:09] Substitution (Team_078): Kyrie Carter OUT → Damian Allen IN (stamina_rule2)

[02:09] Substitution (Team_078): Isaiah Simmons OUT → Malcolm Randle IN (stamina_rule2)

[01:55] Team_075 possession (Score: 68-73)
Kevin Towns attempts a Layup. Wide open! Draymond Irving is 6.0 feet away. [MAN] KEVIN TOWNS MAKES IT! Assist: LeBron Ginobili
Score: 70-73

[01:37] Team_078 possession (Score: 70-73)
Malcolm Randle attempts a 3Pt. Wide open! Donovan Paul is 6.4 feet away. [MAN] Malcolm Randle misses. Rebound secured by Kevin Towns.

[01:27] Team_075 possession (Score: 70-73)
LeBron Ginobili attempts a 3Pt. Contested by Damian Allen (4.9 feet, MAN). LEBRON GINOBILI MAKES IT!
Score: 73-73

[01:17] Team_078 possession (Score: 73-73)
Paul Ming attempts a Layup. BLOCKED BY COLLIN DUNCAN! Ball is loose! Rebound secured by Collin Duncan.

[01:01] Team_075 possession (Score: 73-73)
Donovan Paul throws a bad pass! Stolen by Malcolm Randle! TURNOVER! (live ball)

[00:47] Team_078 possession (Score: 73-73)
Paul Ming attempts a Midrange. Contested by Collin Duncan (6.0 feet, MAN). Paul Ming misses. Rebound secured by Collin Duncan.

[00:32] Team_075 possession (Score: 73-73)
LeBron Ginobili drives to the basket... LeBron Ginobili loses control! Ball rolls out of bounds! TURNOVER! (dead ball)

[00:21] Team_078 possession (Score: 73-73)
Draymond Irving drives and kicks out. Damian Allen attempts a 3Pt. Contested by D'Angelo Anunoby (5.9 feet, ZONE). Damian Allen misses. Rebound secured by Kevin Towns.

[00:09] Team_075 possession (Score: 73-73)
Kevin Towns drives, Paul Ming stays with him. Kevin Towns attempts a Layup. Contested by Paul Ming (5.2 feet, ZONE). KEVIN TOWNS MAKES IT! Assist: Collin Duncan
Score: 75-73

================================================================================
                              4TH QUARTER COMPLETE                              
================================================================================

4TH QUARTER SCORE: Team_075 21, Team_078 11

BOX SCORE:
================================================================================

Team_075
--------------------------------------------------------------------------------
Player                MIN  PTS  REB  AST  TO      FG   FG%      3P   3P%
--------------------------------------------------------------------------------
D'Angelo Anunoby       23    7    1    0   0   3/4    75.0     0/0   0.0
Kevin Towns            23    6    7    0   0   3/5    60.0     0/0   0.0
Kawhi Ingram           25    3    0    0   0   1/1   100.0     0/0   0.0
LeBron Ginobili        23    3    0    2   0   1/1   100.0     0/0   0.0
Donovan Paul           23    2    0    1   0   1/4    25.0     0/0   0.0
Derrick Stewart        25    0    0    1   0   0/0     0.0     0/0   0.0
Myles Barrett          25    0    0    0   0   0/1     0.0     0/0   0.0
Collin Duncan          23    0    5    1   0   0/1     0.0     0/0   0.0

TEAM: FG: 9/17 (52.9%), 3PT: 3/6 (50.0%), REB: 13 (1 off, 12 def), AST: 5, TO: 5
TEAM FOULS: 3


Team_078
--------------------------------------------------------------------------------
Player                MIN  PTS  REB  AST  TO      FG   FG%      3P   3P%
--------------------------------------------------------------------------------
Isaiah Simmons         34    6    3    1   0   3/4    75.0     0/0   0.0
Draymond Irving        23    5    4    0   0   2/6    33.3     0/0   0.0
Jabari Barrett         25    0    1    0   0   0/0     0.0     0/0   0.0
Paul Ming              23    0    6    1   0   0/2     0.0     0/0   0.0
Kyrie Carter           34    0    0    0   0   0/3     0.0     0/0   0.0
Magic Barrett          23    0    0    0   0   0/1     0.0     0/0   0.0
Malcolm Randle         15    0    0    0   0   0/1     0.0     0/0   0.0

TEAM: FG: 5/17 (29.4%), 3PT: 1/8 (12.5%), REB: 14 (6 off, 8 def), AST: 2, TO: 4
TEAM FOULS: 2

================================================================================

================================================================================
                               FULL GAME COMPLETE                               
================================================================================

FINAL SCORE: Team_075 75, Team_078 73

SCORING BY QUARTER:
--------------------------------------------------------------------------------
Team                     Q1     Q2     Q3     Q4    FINAL
--------------------------------------------------------------------------------
Team_075                 12     15     27     21       75
Team_078                 27     12     23     11       73
--------------------------------------------------------------------------------

FULL GAME BOX SCORE:
================================================================================

Team_075
--------------------------------------------------------------------------------
Player                MIN  PTS  REB  AST  TO      FG   FG%      3P   3P%      FT STL BLK
--------------------------------------------------------------------------------
Larry McCollum         25    2    0    1   0   1/6    16.7   0/5     0.0   2/3     0   1
Kawhi Ingram           25   10    8    1   3   5/7    71.4   2/2   100.0   2/4     2   0
Myles Barrett          25    7    0    2   1   3/8    37.5   1/4    25.0   0/0     0   0
Derrick Stewart        25   13   15    2   2   6/12   50.0   1/2    50.0   4/4     0   0
Klay Jokic             25    4    4    1   0   2/5    40.0   0/0     0.0   2/2     0   0
D'Angelo Anunoby       23   13    5    0   0   5/8    62.5   1/3    33.3   2/2     0   0
LeBron Ginobili        23    6    0    3   1   2/4    50.0   2/4    50.0   0/0     0   0
Donovan Paul           23    5    0    3   2   4/10   40.0   1/5    20.0   1/3     0   0
Collin Duncan          23    3   11    2   2   1/4    25.0   1/2    50.0   0/0     1   1
Kevin Towns            23   10   12    1   1   5/8    62.5   0/0     0.0   2/2     0   1

TEAM: FG: 34/72 (47.2%), 3PT: 9/27 (33.3%), REB: 54 (14 off, 40 def), AST: 16, TO: 12


Team_078
--------------------------------------------------------------------------------
Player                MIN  PTS  REB  AST  TO      FG   FG%      3P   3P%      FT STL BLK
--------------------------------------------------------------------------------
Kyrie Carter           34    8    0    4   2   5/13   38.5   2/9    22.2   2/2     1   2
Isaiah Simmons         34   17    7    4   0   3/7    42.9   2/5    40.0   1/2     0   0
Jabari Barnes          25   12    0    2   0   6/8    75.0   4/6    66.7   2/3     0   0
Ben Ginobili           25    7   12    3   3   4/8    50.0   1/3    33.3   0/0     0   0
Jabari Barrett         25    9    9    2   1   4/6    66.7   0/0     0.0   5/7     0   1
Magic Barrett          23    0    0    1   1   0/6     0.0   0/2     0.0   1/2     0   0
Paul Ming              23    2   10    1   2   0/4     0.0   0/0     0.0   2/2     1   1
Draymond Irving        23    5   12    1   0   3/11   27.3   0/1     0.0   1/1     1   0
Damian Allen           15    5    0    0   0   2/3    66.7   0/0     0.0   1/1     0   0
Malcolm Randle         15    5    3    1   1   2/5    40.0   1/2    50.0   0/0     1   0

TEAM: FG: 29/71 (40.8%), 3PT: 10/28 (35.7%), REB: 54 (16 off, 38 def), AST: 19, TO: 10

================================================================================
