================================================================================
                        FULL GAME - Team_024 vs Team_074                        
================================================================================

================================================================================
                       1ST QUARTER - Team_024 vs Team_074                       
================================================================================

[12:00] Team_024 possession (Score: 0-0)
Zach Fox attempts a Layup. Contested by Chris Carter (4.6 feet, MAN). ZACH FOX MAKES IT! Assist: Draymond Towns
Score: 2-0

[11:44] Team_074 possession (Score: 2-0)
FOUL! Shooting foul on Anfernee Williamson. James Turner to the line for 2 free throws. [Team fouls: 1] (Anfernee Williamson: 1 personal fouls)   FT 1/2: MISS   FT 2/2: GOOD James Turner makes 1/2 from the line.
Score: 2-1

[11:29] Team_024 possession (Score: 2-1)
Zach Fox drives, Donovan Doncic stays with him. Zach Fox attempts a Dunk. Contested by Donovan Doncic (4.0 feet, ZONE). Zach Fox misses. Rebound secured by Donovan Doncic.

[11:19] Team_074 possession (Score: 2-1)
FOUL! Reach-in foul on Bradley Allen during the drive. [Team fouls: 2] No free throws, side out. (Bradley Allen: 1 personal fouls)

[11:05] Team_074 possession (Score: 2-1)
James Turner attempts a 3Pt. Contested by Anfernee Williamson (4.3 feet, MAN). James Turner misses. Rebound secured by Draymond Towns.

[10:49] Team_024 possession (Score: 2-1)
FOUL! Reach-in foul on Donovan Doncic during the drive. [Team fouls: 1] No free throws, side out. (Donovan Doncic: 1 personal fouls)

[10:36] Team_024 possession (Score: 2-1)
Anfernee Williamson attempts a Midrange. Contested by Donovan Doncic (3.5 feet, ZONE). Anfernee Williamson misses. Rebound secured by Donovan Doncic.

[10:24] Team_074 possession (Score: 2-1)
James Turner drives to the basket... James Turner throws a bad pass! Stolen by Anfernee Williamson! TURNOVER! (live ball)

[10:07] Team_024 possession (Score: 2-1)
Draymond Towns loses the ball! Stripped by James Turner! TURNOVER! (live ball)

[09:51] Team_074 possession (Score: 2-1)
Shai Green attempts a Midrange. Contested by Anfernee Williamson (4.2 feet, ZONE). SHAI GREEN MAKES IT! Assist: Dwyane Quickley
Score: 2-3

[09:33] Team_024 possession (Score: 2-3)
FOUL! Holding foul on Shai Green. [Team fouls: 2] No free throws, side out. (Shai Green: 1 personal fouls)

[09:17] Team_024 possession (Score: 2-3)
Ja Reaves makes the Layup and draws the foul on Dwyane Quickley! And-1! Ja Reaves to the line for 1. [Team fouls: 3] (Dwyane Quickley: 1 personal fouls)   FT 1/1: GOOD Ja Reaves makes 1/1 from the line.
Score: 5-3

[08:57] Team_074 possession (Score: 5-3)
Shai Green attempts a Midrange. Contested by Bradley Allen (4.4 feet, MAN). SHAI GREEN MAKES IT!
Score: 5-5

[08:48] Team_024 possession (Score: 5-5)
Draymond Towns drives, James Turner stays with him. Draymond Towns attempts a Layup. Contested by James Turner (3.0 feet, MAN). Draymond Towns misses. Rebound secured by Donovan Doncic.

[08:37] Team_074 possession (Score: 5-5)
Donovan Doncic attempts a Midrange. Contested by Bradley Allen (4.2 feet, ZONE). DONOVAN DONCIC MAKES IT! Assist: Shai Green
Score: 5-7

[08:25] Team_024 possession (Score: 5-7)
FOUL! Shooting foul on Donovan Doncic. Anfernee Williamson to the line for 2 free throws. [Team fouls: 4] (Donovan Doncic: 2 personal fouls)   FT 1/2: GOOD   FT 2/2: MISS Anfernee Williamson makes 1/2 from the line. Rebound secured by James Turner.
Score: 6-7

[08:10] Team_074 possession (Score: 6-7)
Donovan Doncic attempts a 3Pt. Contested by Zach Fox (3.8 feet, ZONE). Donovan Doncic misses. Rebound secured by Zach Fox.

[07:58] Team_024 possession (Score: 6-7)
Anfernee Williamson attempts a Midrange. Contested by Donovan Doncic (3.5 feet, MAN). Anfernee Williamson misses. Rebound secured by Shai Green.

[07:48] Team_074 possession (Score: 6-7)
Shai Green attempts a Midrange. Contested by Zach Fox (4.0 feet, ZONE). Shai Green misses. Rebound secured by Draymond Towns.

[07:36] Team_024 possession (Score: 6-7)
Zach Fox attempts a 3Pt. Contested by Chris Carter (4.6 feet, MAN). Zach Fox misses. Rebound secured by Shai Green.

[07:21] Team_074 possession (Score: 6-7)
James Turner loses the ball! Stripped by Anfernee Williamson! TURNOVER! (live ball)

[07:05] Team_024 possession (Score: 6-7)
FOUL! Shooting foul on James Turner. Draymond Towns to the line for 2 free throws. [BONUS: 5 team fouls] (James Turner: 1 personal fouls)   FT 1/2: GOOD   FT 2/2: GOOD Draymond Towns makes 2/2 from the line.
Score: 8-7

[06:51] Team_074 possession (Score: 8-7)
Donovan Doncic drives and kicks out. Chris Carter attempts a 3Pt. Contested by Zach Fox (3.5 feet, ZONE). Chris Carter misses. Rebound secured by Zach Fox.

[06:36] Team_024 possession (Score: 8-7)
Zach Fox attempts a 3Pt. Contested by Dwyane Quickley (5.8 feet, ZONE). ZACH FOX MAKES IT! Assist: Anfernee Williamson
Score: 11-7

[06:19] Team_074 possession (Score: 11-7)
Chris Carter makes the Layup and draws the foul on Zach Fox! And-1! Chris Carter to the line for 1. [Team fouls: 3] (Zach Fox: 1 personal fouls)   FT 1/1: GOOD Chris Carter makes 1/1 from the line.
Score: 11-10

[06:03] Team_024 possession (Score: 11-10)
Ja Reaves throws a bad pass out of bounds! TURNOVER! (dead ball)

[05:47] Team_074 possession (Score: 11-10)
Chris Carter attempts a Midrange. Contested by Anfernee Williamson (4.3 feet, ZONE). CHRIS CARTER MAKES IT! Assist: Dwyane Quickley
Score: 11-12

[05:33] Team_024 possession (Score: 11-12)
Bradley Allen attempts a 3Pt. Contested by Dwyane Quickley (5.4 feet, ZONE). BRADLEY ALLEN MAKES IT! Assist: Draymond Towns
Score: 14-12

[05:22] Team_074 possession (Score: 14-12)
Shai Green makes the Layup and draws the foul on Anfernee Williamson! And-1! Shai Green to the line for 1. [Team fouls: 4] (Anfernee Williamson: 2 personal fouls)   FT 1/1: GOOD Shai Green makes 1/1 from the line.
Score: 14-15

[05:06] Team_024 possession (Score: 14-15)
Zach Fox drives, Donovan Doncic stays with him. Zach Fox attempts a Dunk. Contested by Donovan Doncic (4.0 feet, ZONE). ZACH FOX MAKES IT! Assist: Bradley Allen
Score: 16-15

[04:54] Team_074 possession (Score: 16-15)
FOUL! Reach-in foul on Anfernee Williamson during the drive. [IN THE BONUS! 5 team fouls] James Turner to the line for 2 free throws. (Anfernee Williamson: 3 personal fouls)   FT 1/2: GOOD   FT 2/2: GOOD James Turner makes 2/2 from the line.
Score: 16-17

[04:40] Team_024 possession (Score: 16-17)
Bradley Allen attempts a 3Pt. Contested by Dwyane Quickley (5.5 feet, ZONE). Bradley Allen misses. Rebound secured by Shai Green.

[04:25] Team_074 possession (Score: 16-17)
Donovan Doncic loses control! Ball rolls out of bounds! TURNOVER! (dead ball)

[04:10] Team_024 possession (Score: 16-17)
FOUL! Holding foul on Shai Green. [IN THE BONUS! 6 team fouls] Bradley Allen to the line for 2 free throws. (Shai Green: 2 personal fouls)   FT 1/2: GOOD   FT 2/2: GOOD Bradley Allen makes 2/2 from the line.
Score: 18-17

[03:56] Team_074 possession (Score: 18-17)
Donovan Doncic drives and kicks out. Dwyane Quickley attempts a 3Pt. Contested by Zach Fox (3.6 feet, ZONE). Dwyane Quickley misses. FOUL! Loose ball foul on Anfernee Williamson during the rebound battle. [IN THE BONUS! 6 team fouls] James Turner to the line for 2 free throws. (Anfernee Williamson: 4 personal fouls)   FT 1/2: GOOD   FT 2/2: MISS James Turner makes 1/2 from the line. FOUL! Loose ball foul on Anfernee Williamson during the free throw rebound! [IN THE BONUS! 7 team fouls] Donovan Doncic to the line for 2 free throws. (Anfernee Williamson: 5 personal fouls)   FT 1/2: GOOD   FT 2/2: MISS Donovan Doncic makes 1/2 from the line. Offensive rebound by Donovan Doncic! Donovan Doncic kicks it out.
Score: 18-19

[03:46] Team_074 possession (Score: 18-19)
Donovan Doncic drives, picks up Anfernee Williamson. Help arrives from Zach Fox! Donovan Doncic attempts a Layup. Contested by Zach Fox (4.1 feet, MAN). DONOVAN DONCIC MAKES IT!
Score: 18-21

[03:37] Team_024 possession (Score: 18-21)
Draymond Towns drives to the basket... Draymond Towns throws a bad pass out of bounds! TURNOVER! (dead ball)

[03:22] Team_074 possession (Score: 18-21)
James Turner attempts a Layup. Contested by Anfernee Williamson (4.5 feet, ZONE). James Turner misses. FOUL! Loose ball foul on Anfernee Williamson during the rebound battle. [IN THE BONUS! 8 team fouls] James Turner to the line for 2 free throws. (Anfernee Williamson: 6 personal fouls) Anfernee Williamson FOULS OUT!   FT 1/2: GOOD   FT 2/2: GOOD James Turner makes 2/2 from the line.
Score: 18-23

[03:22] Substitution (Team_024): Anfernee Williamson OUT (stamina: 72) → Victor Simons IN (foul_out)

[03:09] Team_024 possession (Score: 18-23)
Victor Simons makes the Midrange and draws the foul on Dwyane Quickley! And-1! Victor Simons to the line for 1. [BONUS: 7 team fouls] (Dwyane Quickley: 2 personal fouls)   FT 1/1: GOOD Victor Simons makes 1/1 from the line.
Score: 21-23

[02:57] Team_074 possession (Score: 21-23)
Shai Green drives, picks up Bradley Allen. Help arrives from Zach Fox! Shai Green attempts a Dunk. Contested by Zach Fox (4.6 feet, MAN). Shai Green misses. Rebound secured by Draymond Towns.

[02:44] Team_024 possession (Score: 21-23)
Victor Simons attempts a 3Pt. Contested by Dwyane Quickley (5.7 feet, ZONE). Victor Simons misses. Offensive rebound by Draymond Towns! Draymond Towns's putback is no good. Offensive rebound by Zach Fox! Zach Fox kicks it out.

[02:31] Team_024 possession (Score: 21-23)
Ja Reaves throws a bad pass out of bounds! TURNOVER! (dead ball)

[02:31] Substitution (Team_024): Ja Reaves OUT → Vince Irving IN (stamina_rule2)

[02:31] Substitution (Team_024): Zach Fox OUT → Ja Reaves IN (stamina_rule2)

[02:31] Substitution (Team_024): Bradley Allen OUT → Zach Durant IN (stamina_rule2)

[02:31] Substitution (Team_024): Draymond Towns OUT → Terry Rozier IN (stamina_rule2)

[02:31] Substitution (Team_074): Dwyane Quickley OUT → James Barnes IN (stamina_rule2)

[02:31] Substitution (Team_074): Chris Carter OUT → Giannis Westbrook IN (stamina_rule2)

[02:31] Substitution (Team_074): Shai Green OUT → Ayo Smith IN (stamina_rule2)

[02:31] Substitution (Team_074): James Turner OUT → Jaren Rozier IN (stamina_rule2)

[02:16] Team_074 possession (Score: 21-23)
Donovan Doncic drives and kicks out. Giannis Westbrook attempts a 3Pt. Contested by Vince Irving (4.9 feet, MAN). Giannis Westbrook misses. Rebound secured by Zach Durant.

[02:01] Team_024 possession (Score: 21-23)
Zach Durant attempts a Layup. Contested by Ayo Smith (5.0 feet, MAN). Zach Durant misses. Rebound secured by Ayo Smith.

[01:47] Team_074 possession (Score: 21-23)
Jaren Rozier drives to the basket... FOUL! Offensive foul on Jaren Rozier! Terry Rozier drew the charge! [Team fouls: 9] (Jaren Rozier: 1 personal fouls) TURNOVER! (dead ball)

[01:32] Team_024 possession (Score: 21-23)
Terry Rozier drives to the basket... Terry Rozier throws a bad pass! Stolen by Donovan Doncic! TURNOVER! (live ball)

[01:22] Team_074 possession (Score: 21-23)
James Barnes attempts a 3Pt. Contested by Victor Simons (3.8 feet, ZONE). James Barnes misses. Rebound secured by Zach Durant.

[01:09] Team_024 possession (Score: 21-23)
Zach Durant drives to the basket... Zach Durant commits a violation (traveling/carry)! TURNOVER! (dead ball)

[01:09] Substitution (Team_024): Ja Reaves OUT → Zach Fox IN (stamina_rule2)

[01:09] Substitution (Team_074): Donovan Doncic OUT → Yao Randle IN (stamina_rule2)

[00:52] Team_074 possession (Score: 21-23)
Jaren Rozier attempts a 3Pt. Contested by Terry Rozier (3.8 feet, MAN). Jaren Rozier misses. Rebound secured by Terry Rozier.

[00:37] Team_024 possession (Score: 21-23)
Vince Irving attempts a Midrange. BLOCKED BY GIANNIS WESTBROOK! Ball is loose! Offensive rebound by Zach Fox! Zach Fox kicks it out.

[00:19] Team_024 possession (Score: 21-23)
Victor Simons attempts a Layup. Contested by James Barnes (4.3 feet, MAN). Victor Simons misses. FOUL! Loose ball foul on Jaren Rozier during the rebound battle. [IN THE BONUS! 10 team fouls] Zach Fox to the line for 2 free throws. (Jaren Rozier: 2 personal fouls)   FT 1/2: GOOD   FT 2/2: GOOD Zach Fox makes 2/2 from the line.
Score: 23-23

[00:05] Team_074 possession (Score: 23-23)
FOUL! Shooting foul on Zach Durant. James Barnes to the line for 2 free throws. [BONUS: 9 team fouls] (Zach Durant: 1 personal fouls)   FT 1/2: GOOD   FT 2/2: GOOD James Barnes makes 2/2 from the line.
Score: 23-25

================================================================================
                              1ST QUARTER COMPLETE                              
================================================================================

1ST QUARTER SCORE: Team_024 23, Team_074 25

BOX SCORE:
================================================================================

Team_024
--------------------------------------------------------------------------------
Player                MIN  PTS  REB  AST  TO      FG   FG%      3P   3P%
--------------------------------------------------------------------------------
Zach Fox               11    9    4    0   0   4/6    66.7     0/0   0.0
Bradley Allen          10    5    0    1   0   2/3    66.7     0/0   0.0
Ja Reaves              11    3    0    0   0   1/1   100.0     0/0   0.0
Victor Simons           3    3    0    0   0   1/1   100.0     0/0   0.0
Draymond Towns         10    2    3    2   0   1/2    50.0     0/0   0.0
Anfernee Williamson     9    0    0    1   0   0/3     0.0     0/0   0.0
Zach Durant             2    0    2    0   0   0/1     0.0     0/0   0.0
Terry Rozier            2    0    1    0   0   0/0     0.0     0/0   0.0

TEAM: FG: 9/17 (52.9%), 3PT: 2/4 (50.0%), REB: 10 (2 off, 8 def), AST: 4, TO: 6
TEAM FOULS: 9 [Team_074 in BONUS]


Team_074
--------------------------------------------------------------------------------
Player                MIN  PTS  REB  AST  TO      FG   FG%      3P   3P%
--------------------------------------------------------------------------------
Shai Green             10    7    3    1   0   3/5    60.0     0/0   0.0
James Turner           10    5    1    0   0   3/4    75.0     0/0   0.0
Chris Carter           10    5    0    0   0   2/2   100.0     0/0   0.0
Donovan Doncic         11    4    4    0   0   2/5    40.0     0/0   0.0
James Barnes            2    2    0    0   0   1/2    50.0     0/0   0.0
Dwyane Quickley        10    0    0    2   0   0/0     0.0     0/0   0.0
Ayo Smith               2    0    1    0   0   0/0     0.0     0/0   0.0
Jaren Rozier            2    0    0    0   0   0/1     0.0     0/0   0.0

TEAM: FG: 11/19 (57.9%), 3PT: 0/4 (0.0%), REB: 9 (1 off, 8 def), AST: 3, TO: 4
TEAM FOULS: 10 [Team_024 in BONUS]

================================================================================

================================================================================
                       2ND QUARTER - Team_024 vs Team_074                       
================================================================================

[12:00] Team_024 possession (Score: 23-25)
Zach Fox drives and kicks out. Draymond Towns attempts a 3Pt. Contested by James Turner (3.4 feet, MAN). DRAYMOND TOWNS MAKES IT! Assist: Anfernee Williamson
Score: 26-25

[11:45] Team_074 possession (Score: 26-25)
Shai Green attempts a 3Pt. Contested by Bradley Allen (4.4 feet, MAN). Shai Green misses. Rebound secured by Zach Fox.

[11:30] Team_024 possession (Score: 26-25)
FOUL! Shooting foul on Chris Carter. Zach Fox to the line for 2 free throws. [Team fouls: 1] (Chris Carter: 1 personal fouls)   FT 1/2: GOOD   FT 2/2: MISS Zach Fox makes 1/2 from the line. Rebound secured by James Turner.
Score: 27-25

[11:14] Team_074 possession (Score: 27-25)
James Turner drives and kicks out. Shai Green attempts a 3Pt. Contested by Zach Fox (3.7 feet, ZONE). Shai Green misses. FOUL! Loose ball foul on Draymond Towns during the rebound battle. [Team fouls: 1] No free throws, side out. (Draymond Towns: 1 personal fouls)

[11:00] Team_074 possession (Score: 27-25)
FOUL! Shooting foul on Bradley Allen. James Turner to the line for 2 free throws. [Team fouls: 2] (Bradley Allen: 1 personal fouls)   FT 1/2: GOOD   FT 2/2: GOOD James Turner makes 2/2 from the line.
Score: 27-27

[10:46] Team_024 possession (Score: 27-27)
Ja Reaves attempts a 3Pt. BLOCKED BY DWYANE QUICKLEY! Ball is loose! Rebound secured by Donovan Doncic.

[10:32] Team_074 possession (Score: 27-27)
Chris Carter makes the Layup and draws the foul on Anfernee Williamson! And-1! Chris Carter to the line for 1. [Team fouls: 3] (Anfernee Williamson: 1 personal fouls)   FT 1/1: GOOD Chris Carter makes 1/1 from the line.
Score: 27-30

[10:18] Team_024 possession (Score: 27-30)
Anfernee Williamson drives, James Turner stays with him. Anfernee Williamson attempts a Dunk. Contested by James Turner (3.4 feet, ZONE). ANFERNEE WILLIAMSON MAKES IT! Assist: Draymond Towns
Score: 29-30

[09:59] Team_074 possession (Score: 29-30)
Chris Carter attempts a 3Pt. Contested by Zach Fox (4.4 feet, ZONE). Chris Carter misses. Offensive rebound by Donovan Doncic! Donovan Doncic kicks it out.

[09:45] Team_074 possession (Score: 29-30)
James Turner drives and kicks out. Donovan Doncic attempts a Midrange. Contested by Zach Fox (3.8 feet, ZONE). Donovan Doncic misses. FOUL! Loose ball foul on Draymond Towns during the rebound battle. [Team fouls: 4] No free throws, side out. (Draymond Towns: 2 personal fouls)

[09:32] Team_074 possession (Score: 29-30)
Donovan Doncic attempts a Layup. Contested by Anfernee Williamson (4.0 feet, MAN). DONOVAN DONCIC MAKES IT! Assist: Shai Green
Score: 29-32

[09:20] Team_024 possession (Score: 29-32)
Zach Fox drives and kicks out. Draymond Towns attempts a Midrange. Contested by Shai Green (3.8 feet, ZONE). Draymond Towns misses. Rebound secured by James Turner.

[09:06] Team_074 possession (Score: 29-32)
Shai Green attempts a 3Pt. Contested by Bradley Allen (4.6 feet, MAN). SHAI GREEN MAKES IT! Assist: Donovan Doncic
Score: 29-35

[08:54] Team_024 possession (Score: 29-35)
Draymond Towns drives, Donovan Doncic stays with him. Draymond Towns attempts a Dunk. Contested by Donovan Doncic (3.7 feet, ZONE). DRAYMOND TOWNS MAKES IT!
Score: 31-35

[08:41] Team_074 possession (Score: 31-35)
Donovan Doncic attempts a Midrange. Contested by Anfernee Williamson (4.1 feet, MAN). Donovan Doncic misses. Rebound secured by Zach Fox.

[08:30] Team_024 possession (Score: 31-35)
Ja Reaves attempts a Layup. Contested by Dwyane Quickley (5.8 feet, MAN). Ja Reaves misses. Rebound secured by James Turner.

[08:17] Team_074 possession (Score: 31-35)
Chris Carter attempts a 3Pt. Contested by Zach Fox (4.6 feet, MAN). CHRIS CARTER MAKES IT!
Score: 31-38

[08:01] Team_024 possession (Score: 31-38)
Anfernee Williamson drives and kicks out. Draymond Towns attempts a 3Pt. Contested by James Turner (3.8 feet, MAN). Draymond Towns misses. Rebound secured by James Turner.

[07:47] Team_074 possession (Score: 31-38)
Donovan Doncic attempts a Midrange. Contested by Anfernee Williamson (4.2 feet, ZONE). Donovan Doncic misses. Rebound secured by Draymond Towns.

[07:34] Team_024 possession (Score: 31-38)
Ja Reaves attempts a Midrange. Contested by Dwyane Quickley (5.9 feet, MAN). Ja Reaves misses. Rebound secured by Shai Green.

[07:18] Team_074 possession (Score: 31-38)
Dwyane Quickley attempts a 3Pt. Contested by Zach Fox (4.4 feet, ZONE). DWYANE QUICKLEY MAKES IT! Assist: Donovan Doncic
Score: 31-41

[07:07] Team_024 possession (Score: 31-41)
Ja Reaves attempts a Midrange. Contested by Donovan Doncic (4.4 feet, ZONE). Ja Reaves misses. Rebound secured by Shai Green.

[06:52] Team_074 possession (Score: 31-41)
Shai Green attempts a 3Pt. Contested by Bradley Allen (4.8 feet, ZONE). Shai Green misses. Rebound secured by Draymond Towns.

[06:41] Team_024 possession (Score: 31-41)
Ja Reaves attempts a 3Pt. Contested by Dwyane Quickley (5.9 feet, ZONE). Ja Reaves misses. Rebound secured by Donovan Doncic.

[06:28] Team_074 possession (Score: 31-41)
FOUL! Holding foul on Anfernee Williamson. [IN THE BONUS! 5 team fouls] James Turner to the line for 2 free throws. (Anfernee Williamson: 2 personal fouls)   FT 1/2: GOOD   FT 2/2: MISS James Turner makes 1/2 from the line. Rebound secured by Draymond Towns.
Score: 31-42

[06:08] Team_024 possession (Score: 31-42)
Bradley Allen attempts a 3Pt. Contested by Chris Carter (4.9 feet, ZONE). BRADLEY ALLEN MAKES IT! Assist: Zach Fox
Score: 34-42

[05:53] Team_074 possession (Score: 34-42)
Dwyane Quickley drives and kicks out. FOUL! Shooting foul on Bradley Allen. Shai Green to the line for 3 free throws. [BONUS: 6 team fouls] (Bradley Allen: 2 personal fouls)   FT 1/3: GOOD   FT 2/3: GOOD   FT 3/3: GOOD Shai Green makes 3/3 from the line.
Score: 34-45

[05:42] Team_024 possession (Score: 34-45)
Bradley Allen attempts a 3Pt. Contested by Shai Green (4.3 feet, MAN). BRADLEY ALLEN MAKES IT! Assist: Draymond Towns
Score: 37-45

[05:27] Team_074 possession (Score: 37-45)
James Turner attempts a Layup. BLOCKED BY ZACH FOX! Ball is loose! Rebound secured by Zach Fox.

[05:12] Team_024 possession (Score: 37-45)
Ja Reaves drives and kicks out. Bradley Allen attempts a Midrange. Contested by Shai Green (4.4 feet, ZONE). BRADLEY ALLEN MAKES IT!
Score: 39-45

[04:58] Team_074 possession (Score: 39-45)
Donovan Doncic attempts a 3Pt. Contested by Zach Fox (4.8 feet, ZONE). DONOVAN DONCIC MAKES IT! Assist: Dwyane Quickley
Score: 39-48

[04:44] Team_024 possession (Score: 39-48)
Ja Reaves drives to the basket... Ja Reaves loses the ball! Stripped by James Turner! TURNOVER! (live ball)

[04:34] Team_074 possession (Score: 39-48)
Dwyane Quickley drives and kicks out. Shai Green attempts a 3Pt. Contested by Bradley Allen (4.8 feet, MAN). Shai Green misses. Rebound secured by Zach Fox.

[04:14] Team_024 possession (Score: 39-48)
Zach Fox drives, picks up Chris Carter. Help arrives from Shai Green! Zach Fox attempts a Dunk. Contested by Shai Green (5.4 feet, MAN). ZACH FOX MAKES IT! Assist: Bradley Allen
Score: 41-48

[04:01] Team_074 possession (Score: 41-48)
Shai Green attempts a Layup. Contested by Anfernee Williamson (4.9 feet, ZONE). Shai Green misses. Rebound secured by Anfernee Williamson.

[03:48] Team_024 possession (Score: 41-48)
FOUL! Shooting foul on James Turner. Draymond Towns to the line for 2 free throws. [Team fouls: 2] (James Turner: 1 personal fouls)   FT 1/2: GOOD   FT 2/2: GOOD Draymond Towns makes 2/2 from the line.
Score: 43-48

[03:35] Team_074 possession (Score: 43-48)
Dwyane Quickley attempts a 3Pt. Contested by Ja Reaves (5.9 feet, MAN). Dwyane Quickley misses. Rebound secured by Draymond Towns.

[03:22] Team_024 possession (Score: 43-48)
Draymond Towns attempts a Layup. Contested by James Turner (4.0 feet, ZONE). Draymond Towns misses. Offensive rebound by Zach Fox! Zach Fox kicks it out.

[03:05] Team_024 possession (Score: 43-48)
Ja Reaves attempts a 3Pt. Wide open! Dwyane Quickley is 6.3 feet away. [MAN] JA REAVES MAKES IT! Assist: Bradley Allen
Score: 46-48

[02:53] Team_074 possession (Score: 46-48)
James Turner attempts a 3Pt. Contested by Zach Fox (5.4 feet, ZONE). JAMES TURNER MAKES IT! Assist: Dwyane Quickley
Score: 46-51

[02:38] Team_024 possession (Score: 46-51)
Draymond Towns attempts a Midrange. Contested by Chris Carter (5.0 feet, ZONE). Draymond Towns misses. Rebound secured by James Turner.

[02:26] Team_074 possession (Score: 46-51)
James Turner drives, picks up Draymond Towns. Help arrives from Zach Fox! James Turner attempts a Layup. Contested by Zach Fox (5.6 feet, MAN). James Turner misses. Rebound secured by Draymond Towns.

[02:14] Team_024 possession (Score: 46-51)
Bradley Allen makes the Dunk and draws the foul on Chris Carter! And-1! Bradley Allen to the line for 1. [Team fouls: 3] (Chris Carter: 2 personal fouls)   FT 1/1: GOOD Bradley Allen makes 1/1 from the line.
Score: 49-51

[01:57] Team_074 possession (Score: 49-51)
James Turner attempts a Layup. Contested by Draymond Towns (5.7 feet, MAN). James Turner misses. Offensive rebound by James Turner! James Turner kicks it out.

[01:41] Team_074 possession (Score: 49-51)
FOUL! Reach-in foul on Anfernee Williamson during the drive. [IN THE BONUS! 7 team fouls] Donovan Doncic to the line for 2 free throws. (Anfernee Williamson: 3 personal fouls)   FT 1/2: GOOD   FT 2/2: MISS Donovan Doncic makes 1/2 from the line. Rebound secured by Draymond Towns.
Score: 49-52

[01:27] Team_024 possession (Score: 49-52)
Ja Reaves drives, picks up Dwyane Quickley. Help arrives from Shai Green! Ja Reaves attempts a Dunk. Wide open! Shai Green is 6.5 feet away. [MAN] Ja Reaves misses. Rebound secured by James Turner.

[01:09] Team_074 possession (Score: 49-52)
FOUL! Holding foul on Anfernee Williamson. [IN THE BONUS! 8 team fouls] Donovan Doncic to the line for 2 free throws. (Anfernee Williamson: 4 personal fouls)   FT 1/2: MISS   FT 2/2: GOOD Donovan Doncic makes 1/2 from the line.
Score: 49-53

[00:54] Team_024 possession (Score: 49-53)
FOUL! Reach-in foul on James Turner during the drive. [Team fouls: 4] No free throws, side out. (James Turner: 2 personal fouls)

[00:36] Team_024 possession (Score: 49-53)
Draymond Towns attempts a Midrange. Contested by Donovan Doncic (4.9 feet, ZONE). Draymond Towns misses. Rebound secured by Shai Green.

[00:26] Team_074 possession (Score: 49-53)
Shai Green attempts a 3Pt. Contested by Bradley Allen (5.7 feet, MAN). Shai Green misses. Rebound secured by Zach Fox.

[00:09] Team_024 possession (Score: 49-53)
Bradley Allen drives and kicks out. Zach Fox makes the Midrange and draws the foul on Chris Carter! And-1! Zach Fox to the line for 1. [BONUS: 5 team fouls] (Chris Carter: 3 personal fouls)   FT 1/1: MISS Zach Fox makes 0/1 from the line. Rebound secured by Donovan Doncic.
Score: 51-53

================================================================================
                              2ND QUARTER COMPLETE                              
================================================================================

2ND QUARTER SCORE: Team_024 28, Team_074 28

BOX SCORE:
================================================================================

Team_024
--------------------------------------------------------------------------------
Player                MIN  PTS  REB  AST  TO      FG   FG%      3P   3P%
--------------------------------------------------------------------------------
Bradley Allen          22   11    0    2   0   4/5    80.0     0/0   0.0
Draymond Towns         22    7    6    2   0   3/5    60.0     0/0   0.0
Ja Reaves              23    3    0    0   0   1/7    14.3     0/0   0.0
Anfernee Williamson    21    2    1    1   0   1/2    50.0     0/0   0.0
Zach Fox               23    2    6    1   0   1/3    33.3     0/0   0.0

TEAM: FG: 10/22 (45.5%), 3PT: 3/5 (60.0%), REB: 13 (1 off, 12 def), AST: 6, TO: 1
TEAM FOULS: 8 [Team_074 in BONUS]


Team_074
--------------------------------------------------------------------------------
Player                MIN  PTS  REB  AST  TO      FG   FG%      3P   3P%
--------------------------------------------------------------------------------
Shai Green             22    6    3    1   0   2/6    33.3     0/0   0.0
Donovan Doncic         23    6    5    2   0   3/6    50.0     0/0   0.0
Chris Carter           22    6    0    0   0   2/2   100.0     0/0   0.0
James Turner           22    5    8    0   0   2/4    50.0     0/0   0.0
Dwyane Quickley        22    3    0    2   0   1/3    33.3     0/0   0.0

TEAM: FG: 10/22 (45.5%), 3PT: 5/9 (55.6%), REB: 16 (4 off, 12 def), AST: 5, TO: 0
TEAM FOULS: 5 [Team_024 in BONUS]

================================================================================

================================================================================
                       3RD QUARTER - Team_024 vs Team_074                       
================================================================================

[12:00] Team_024 possession (Score: 51-53)
FOUL! Reach-in foul on Dwyane Quickley during the drive. [Team fouls: 1] No free throws, side out. (Dwyane Quickley: 1 personal fouls)

[11:48] Team_024 possession (Score: 51-53)
Bradley Allen attempts a 3Pt. Contested by Dwyane Quickley (5.4 feet, ZONE). Bradley Allen misses. Rebound secured by Shai Green.

[11:35] Team_074 possession (Score: 51-53)
Shai Green attempts a 3Pt. Contested by Zach Fox (4.0 feet, ZONE). Shai Green misses. Rebound secured by Anfernee Williamson.

[11:20] Team_024 possession (Score: 51-53)
Zach Fox attempts a Layup. Contested by Donovan Doncic (4.0 feet, ZONE). ZACH FOX MAKES IT! Assist: Ja Reaves
Score: 53-53

[11:07] Team_074 possession (Score: 53-53)
Donovan Doncic attempts a Midrange. Contested by Anfernee Williamson (4.0 feet, ZONE). Donovan Doncic misses. Rebound secured by Zach Fox.

[10:53] Team_024 possession (Score: 53-53)
Zach Fox attempts a 3Pt. Contested by Chris Carter (4.6 feet, MAN). Zach Fox misses. Rebound secured by Shai Green.

[10:43] Team_074 possession (Score: 53-53)
FOUL! Holding foul on Anfernee Williamson. [Team fouls: 1] No free throws, side out. (Anfernee Williamson: 1 personal fouls)

[10:28] Team_074 possession (Score: 53-53)
Donovan Doncic makes the Layup and draws the foul on Anfernee Williamson! And-1! Donovan Doncic to the line for 1. [Team fouls: 2] (Anfernee Williamson: 2 personal fouls)   FT 1/1: GOOD Donovan Doncic makes 1/1 from the line.
Score: 53-56

[10:16] Team_024 possession (Score: 53-56)
Zach Fox attempts a 3Pt. Contested by Dwyane Quickley (5.8 feet, ZONE). Zach Fox misses. Rebound secured by James Turner.

[09:56] Team_074 possession (Score: 53-56)
James Turner attempts a Layup. BLOCKED BY ANFERNEE WILLIAMSON! Ball is loose! Offensive rebound by James Turner! James Turner kicks it out.

[09:42] Team_074 possession (Score: 53-56)
Dwyane Quickley attempts a 3Pt. Contested by Ja Reaves (4.8 feet, MAN). Dwyane Quickley misses. Rebound secured by Zach Fox.

[09:30] Team_024 possession (Score: 53-56)
Bradley Allen attempts a Midrange. Contested by Donovan Doncic (3.7 feet, ZONE). BRADLEY ALLEN MAKES IT! Assist: Anfernee Williamson
Score: 55-56

[09:12] Team_074 possession (Score: 55-56)
Chris Carter attempts a 3Pt. Contested by Zach Fox (4.2 feet, ZONE). Chris Carter misses. Rebound secured by Zach Fox.

[09:00] Team_024 possession (Score: 55-56)
Bradley Allen attempts a 3Pt. Contested by Shai Green (3.5 feet, MAN). BRADLEY ALLEN MAKES IT! Assist: Zach Fox
Score: 58-56

[08:43] Team_074 possession (Score: 58-56)
James Turner drives, Anfernee Williamson stays with him. James Turner attempts a Dunk. Contested by Anfernee Williamson (4.3 feet, ZONE). James Turner misses. Rebound secured by Draymond Towns.

[08:25] Team_024 possession (Score: 58-56)
Zach Fox drives, picks up Chris Carter. Help arrives from Shai Green! Zach Fox attempts a Layup. Contested by Shai Green (4.6 feet, MAN). ZACH FOX MAKES IT! Assist: Anfernee Williamson
Score: 60-56

[08:11] Team_074 possession (Score: 60-56)
Shai Green attempts a 3Pt. Contested by Zach Fox (4.0 feet, ZONE). Shai Green misses. Rebound secured by Zach Fox.

[07:56] Team_024 possession (Score: 60-56)
Anfernee Williamson attempts a 3Pt. Contested by Dwyane Quickley (5.3 feet, ZONE). Anfernee Williamson misses. Rebound secured by Shai Green.

[07:43] Team_074 possession (Score: 60-56)
Dwyane Quickley attempts a Midrange. Contested by Ja Reaves (4.8 feet, ZONE). Dwyane Quickley misses. Rebound secured by Anfernee Williamson.

[07:29] Team_024 possession (Score: 60-56)
Zach Fox attempts a 3Pt. Contested by Dwyane Quickley (5.8 feet, ZONE). Zach Fox misses. Rebound secured by Shai Green.

[07:11] Team_074 possession (Score: 60-56)
FOUL! Reach-in foul on Anfernee Williamson during the drive. [Team fouls: 3] No free throws, side out. (Anfernee Williamson: 3 personal fouls)

[06:55] Team_074 possession (Score: 60-56)
Donovan Doncic loses control! Ball rolls out of bounds! TURNOVER! (dead ball)

[06:37] Team_024 possession (Score: 60-56)
Zach Fox drives and kicks out. Anfernee Williamson attempts a 3Pt. Contested by Dwyane Quickley (5.4 feet, ZONE). Anfernee Williamson misses. Rebound secured by Donovan Doncic.

[06:22] Team_074 possession (Score: 60-56)
James Turner drives and kicks out. Donovan Doncic attempts a 3Pt. Contested by Zach Fox (3.5 feet, ZONE). Donovan Doncic misses. Rebound secured by Zach Fox.

[06:07] Team_024 possession (Score: 60-56)
Zach Fox attempts a Midrange. Contested by Chris Carter (4.6 feet, ZONE). Zach Fox misses. Rebound secured by James Turner.

[05:52] Team_074 possession (Score: 60-56)
Chris Carter attempts a 3Pt. Contested by Zach Fox (4.2 feet, ZONE). Chris Carter misses. Rebound secured by Anfernee Williamson.

[05:39] Team_024 possession (Score: 60-56)
Anfernee Williamson attempts a 3Pt. Contested by Donovan Doncic (3.5 feet, MAN). Anfernee Williamson misses. Rebound secured by James Turner.

[05:25] Team_074 possession (Score: 60-56)
James Turner attempts a Layup. Contested by Anfernee Williamson (4.3 feet, MAN). JAMES TURNER MAKES IT! Assist: Shai Green
Score: 60-58

[05:09] Team_024 possession (Score: 60-58)
Bradley Allen commits a violation (traveling/carry)! TURNOVER! (dead ball)

[04:51] Team_074 possession (Score: 60-58)
FOUL! Offensive foul on Donovan Doncic! Anfernee Williamson drew the charge! [Team fouls: 2] (Donovan Doncic: 1 personal fouls) TURNOVER! (dead ball)

[04:37] Team_024 possession (Score: 60-58)
Draymond Towns attempts a 3Pt. Contested by Shai Green (3.1 feet, ZONE). DRAYMOND TOWNS MAKES IT! Assist: Anfernee Williamson
Score: 63-58

[04:21] Team_074 possession (Score: 63-58)
Dwyane Quickley makes the Layup and draws the foul on Ja Reaves! And-1! Dwyane Quickley to the line for 1. [Team fouls: 4] (Ja Reaves: 1 personal fouls)   FT 1/1: GOOD Dwyane Quickley makes 1/1 from the line.
Score: 63-61

[04:11] Team_024 possession (Score: 63-61)
Ja Reaves attempts a 3Pt. Contested by Dwyane Quickley (5.6 feet, ZONE). JA REAVES MAKES IT! Assist: Anfernee Williamson
Score: 66-61

[03:56] Team_074 possession (Score: 66-61)
Dwyane Quickley attempts a 3Pt. Contested by Zach Fox (3.9 feet, ZONE). Dwyane Quickley misses. Offensive rebound by Donovan Doncic! Donovan Doncic kicks it out.

[03:42] Team_074 possession (Score: 66-61)
James Turner attempts a Midrange. Contested by Anfernee Williamson (4.4 feet, MAN). James Turner misses. FOUL! Loose ball foul on Anfernee Williamson during the rebound battle. [IN THE BONUS! 5 team fouls] James Turner to the line for 2 free throws. (Anfernee Williamson: 4 personal fouls)   FT 1/2: GOOD   FT 2/2: GOOD James Turner makes 2/2 from the line.
Score: 66-63

[03:29] Team_024 possession (Score: 66-63)
Draymond Towns throws a bad pass! Stolen by James Turner! TURNOVER! (live ball)

[03:10] Team_074 possession (Score: 66-63)
Donovan Doncic makes the Layup and draws the foul on Anfernee Williamson! And-1! Donovan Doncic to the line for 1. [BONUS: 6 team fouls] (Anfernee Williamson: 5 personal fouls)   FT 1/1: GOOD Donovan Doncic makes 1/1 from the line.
Score: 66-66

[02:55] Team_024 possession (Score: 66-66)
Bradley Allen attempts a Layup. Contested by Shai Green (3.7 feet, MAN). BRADLEY ALLEN MAKES IT! Assist: Anfernee Williamson
Score: 68-66

[02:41] Team_074 possession (Score: 68-66)
Chris Carter attempts a Midrange. Contested by Anfernee Williamson (4.5 feet, ZONE). CHRIS CARTER MAKES IT!
Score: 68-68

[02:24] Team_024 possession (Score: 68-68)
Draymond Towns drives and kicks out. Zach Fox attempts a 3Pt. Contested by Chris Carter (4.5 feet, MAN). Zach Fox misses. FOUL! Loose ball foul on James Turner during the rebound battle. [Team fouls: 3] No free throws, side out. (James Turner: 1 personal fouls)

[02:08] Team_024 possession (Score: 68-68)
Anfernee Williamson drives to the basket... Anfernee Williamson loses the ball! Stripped by Donovan Doncic! TURNOVER! (live ball)

[01:55] Team_074 possession (Score: 68-68)
James Turner throws a bad pass out of bounds! TURNOVER! (dead ball)

[01:55] Substitution (Team_024): Ja Reaves OUT → Victor Simons IN (stamina_rule2)

[01:55] Substitution (Team_024): Zach Fox OUT → Vince Irving IN (stamina_rule2)

[01:55] Substitution (Team_024): Bradley Allen OUT → Zach Durant IN (stamina_rule2)

[01:55] Substitution (Team_024): Anfernee Williamson OUT → Julius Harris IN (stamina_rule2)

[01:55] Substitution (Team_024): Draymond Towns OUT → Terry Rozier IN (stamina_rule2)

[01:55] Substitution (Team_074): Dwyane Quickley OUT → James Barnes IN (stamina_rule2)

[01:55] Substitution (Team_074): Chris Carter OUT → Giannis Westbrook IN (stamina_rule2)

[01:55] Substitution (Team_074): Shai Green OUT → Ayo Smith IN (stamina_rule2)

[01:55] Substitution (Team_074): James Turner OUT → Jaren Rozier IN (stamina_rule2)

[01:42] Team_024 possession (Score: 68-68)
Zach Durant drives and kicks out. Victor Simons attempts a 3Pt. Contested by James Barnes (4.2 feet, MAN). Victor Simons misses. Offensive rebound by Terry Rozier! Terry Rozier puts it back in!
Score: 70-68

[01:26] Team_074 possession (Score: 70-68)
Jaren Rozier makes the Layup and draws the foul on Terry Rozier! And-1! Jaren Rozier to the line for 1. [BONUS: 7 team fouls] (Terry Rozier: 1 personal fouls)   FT 1/1: GOOD Jaren Rozier makes 1/1 from the line.
Score: 70-71

[01:10] Team_024 possession (Score: 70-71)
Julius Harris drives and kicks out. Terry Rozier attempts a Midrange. Contested by Donovan Doncic (4.0 feet, MAN). TERRY ROZIER MAKES IT!
Score: 72-71

[00:55] Team_074 possession (Score: 72-71)
FOUL! Holding foul on Zach Durant. [IN THE BONUS! 8 team fouls] Ayo Smith to the line for 2 free throws. (Zach Durant: 1 personal fouls)   FT 1/2: GOOD   FT 2/2: GOOD Ayo Smith makes 2/2 from the line.
Score: 72-73

[00:41] Team_024 possession (Score: 72-73)
Zach Durant drives, picks up Ayo Smith. Help arrives from Giannis Westbrook! Zach Durant attempts a Layup. Contested by Giannis Westbrook (5.0 feet, MAN). ZACH DURANT MAKES IT! Assist: Vince Irving
Score: 74-73

[00:27] Team_074 possession (Score: 74-73)
James Barnes drives, Victor Simons stays with him. James Barnes attempts a Dunk. Contested by Victor Simons (3.8 feet, MAN). James Barnes misses. Rebound secured by Julius Harris.

[00:14] Team_024 possession (Score: 74-73)
Vince Irving attempts a 3Pt. Contested by Giannis Westbrook (4.5 feet, MAN). Vince Irving misses. Rebound secured by Jaren Rozier.

[00:01] Team_074 possession (Score: 74-73)
Jaren Rozier attempts a Midrange. BLOCKED BY ZACH DURANT! Ball is loose! Offensive rebound by Jaren Rozier! Jaren Rozier kicks it out.

================================================================================
                              3RD QUARTER COMPLETE                              
================================================================================

3RD QUARTER SCORE: Team_024 23, Team_074 20

BOX SCORE:
================================================================================

Team_024
--------------------------------------------------------------------------------
Player                MIN  PTS  REB  AST  TO      FG   FG%      3P   3P%
--------------------------------------------------------------------------------
Bradley Allen          32    7    0    0   0   3/4    75.0     0/0   0.0
Zach Fox               33    4    5    1   0   2/7    28.6     0/0   0.0
Terry Rozier            4    4    1    0   0   2/2   100.0     0/0   0.0
Ja Reaves              33    3    0    1   0   1/1   100.0     0/0   0.0
Draymond Towns         32    3    2    0   0   1/1   100.0     0/0   0.0
Zach Durant             4    2    0    0   0   1/1   100.0     0/0   0.0
Anfernee Williamson    31    0    3    5   0   0/2     0.0     0/0   0.0
Vince Irving            4    0    0    1   0   0/1     0.0     0/0   0.0
Julius Harris           2    0    1    0   0   0/0     0.0     0/0   0.0

TEAM: FG: 10/19 (52.6%), 3PT: 3/10 (30.0%), REB: 12 (2 off, 10 def), AST: 8, TO: 3
TEAM FOULS: 8 [Team_074 in BONUS]


Team_074
--------------------------------------------------------------------------------
Player                MIN  PTS  REB  AST  TO      FG   FG%      3P   3P%
--------------------------------------------------------------------------------
Donovan Doncic         35    6    2    0   0   2/3    66.7     0/0   0.0
James Turner           32    4    4    0   0   2/4    50.0     0/0   0.0
Dwyane Quickley        32    3    0    0   0   1/3    33.3     0/0   0.0
Jaren Rozier            4    3    2    0   0   1/1   100.0     0/0   0.0
Chris Carter           32    2    0    0   0   1/3    33.3     0/0   0.0
Ayo Smith               4    2    0    0   0   1/1   100.0     0/0   0.0
Shai Green             32    0    4    1   0   0/2     0.0     0/0   0.0
James Barnes            4    0    0    0   0   0/1     0.0     0/0   0.0

TEAM: FG: 8/18 (44.4%), 3PT: 0/5 (0.0%), REB: 12 (3 off, 9 def), AST: 1, TO: 3
TEAM FOULS: 3

================================================================================

================================================================================
                       4TH QUARTER - Team_024 vs Team_074                       
================================================================================

[12:00] Team_024 possession (Score: 74-73)
Anfernee Williamson drives, picks up James Turner. Help arrives from Chris Carter! Anfernee Williamson attempts a Layup. Contested by Chris Carter (3.3 feet, ZONE). ANFERNEE WILLIAMSON MAKES IT! Assist: Bradley Allen
Score: 76-73

[11:46] Team_074 possession (Score: 76-73)
Donovan Doncic attempts a Midrange. Contested by Zach Fox (3.8 feet, ZONE). Donovan Doncic misses. Offensive rebound by James Turner! James Turner's putback is no good. Rebound secured by Anfernee Williamson.

[11:34] Team_024 possession (Score: 76-73)
Ja Reaves drives and kicks out. Anfernee Williamson attempts a 3Pt. Contested by Dwyane Quickley (5.5 feet, ZONE). Anfernee Williamson misses. Rebound secured by James Turner.

[11:23] Team_074 possession (Score: 76-73)
Shai Green attempts a 3Pt. BLOCKED BY ZACH FOX! Ball is loose! Rebound secured by Anfernee Williamson.

[11:12] Team_024 possession (Score: 76-73)
FOUL! Shooting foul on Shai Green. Draymond Towns to the line for 2 free throws. [Team fouls: 1] (Shai Green: 1 personal fouls)   FT 1/2: GOOD   FT 2/2: GOOD Draymond Towns makes 2/2 from the line.
Score: 78-73

[11:02] Team_074 possession (Score: 78-73)
Dwyane Quickley drives and kicks out. Donovan Doncic attempts a Midrange. Contested by Anfernee Williamson (3.8 feet, MAN). Donovan Doncic misses. Rebound secured by Anfernee Williamson.

[10:50] Team_024 possession (Score: 78-73)
FOUL! Reach-in foul on Shai Green during the drive. [Team fouls: 2] No free throws, side out. (Shai Green: 2 personal fouls)

[10:35] Team_024 possession (Score: 78-73)
Ja Reaves drives, picks up James Turner. Help arrives from Chris Carter! Ja Reaves attempts a Layup. Contested by Chris Carter (3.7 feet, ZONE). Ja Reaves misses. Offensive rebound by Zach Fox! Zach Fox kicks it out.

[10:24] Team_024 possession (Score: 78-73)
Bradley Allen attempts a 3Pt. Contested by Dwyane Quickley (5.6 feet, ZONE). Bradley Allen misses. Rebound secured by Donovan Doncic.

[10:13] Team_074 possession (Score: 78-73)
Dwyane Quickley attempts a 3Pt. Contested by Ja Reaves (5.0 feet, MAN). Dwyane Quickley misses. Rebound secured by Anfernee Williamson.

[09:59] Team_024 possession (Score: 78-73)
Bradley Allen attempts a 3Pt. Contested by Dwyane Quickley (5.6 feet, ZONE). Bradley Allen misses. Rebound secured by Donovan Doncic.

[09:46] Team_074 possession (Score: 78-73)
James Turner drives and kicks out. Chris Carter attempts a 3Pt. Contested by Zach Fox (3.8 feet, MAN). Chris Carter misses. Rebound secured by Anfernee Williamson.

[09:36] Team_024 possession (Score: 78-73)
Anfernee Williamson attempts a Midrange. Contested by Donovan Doncic (4.1 feet, ZONE). Anfernee Williamson misses. Offensive rebound by Zach Fox! Zach Fox kicks it out.

[09:18] Team_024 possession (Score: 78-73)
Ja Reaves attempts a 3Pt. Contested by Dwyane Quickley (5.8 feet, MAN). Ja Reaves misses. Offensive rebound by Draymond Towns! Draymond Towns puts it back in!
Score: 80-73

[09:04] Team_074 possession (Score: 80-73)
Dwyane Quickley attempts a 3Pt. Contested by Zach Fox (4.1 feet, ZONE). Dwyane Quickley misses. Rebound secured by Zach Fox.

[08:54] Team_024 possession (Score: 80-73)
Anfernee Williamson attempts a Midrange. Contested by Chris Carter (4.5 feet, ZONE). Anfernee Williamson misses. Offensive rebound by Zach Fox! Zach Fox kicks it out.

[08:42] Team_024 possession (Score: 80-73)
Draymond Towns attempts a 3Pt. Contested by Dwyane Quickley (5.3 feet, ZONE). Draymond Towns misses. Offensive rebound by Zach Fox! Zach Fox kicks it out.

[08:27] Team_024 possession (Score: 80-73)
Zach Fox drives and kicks out. Anfernee Williamson attempts a 3Pt. Contested by Dwyane Quickley (5.8 feet, ZONE). Anfernee Williamson misses. Offensive rebound by Draymond Towns! Draymond Towns puts it back in!
Score: 82-73

[08:15] Team_074 possession (Score: 82-73)
Dwyane Quickley attempts a 3Pt. Contested by Ja Reaves (5.2 feet, MAN). Dwyane Quickley misses. Rebound secured by Anfernee Williamson.

[08:02] Team_024 possession (Score: 82-73)
Ja Reaves attempts a 3Pt. Contested by Dwyane Quickley (5.9 feet, ZONE). JA REAVES MAKES IT! Assist: Draymond Towns
Score: 85-73

[07:46] Team_074 possession (Score: 85-73)
Dwyane Quickley drives and kicks out. James Turner attempts a Midrange. Contested by Draymond Towns (4.4 feet, MAN). James Turner misses. Rebound secured by Zach Fox.

[07:30] Team_024 possession (Score: 85-73)
Draymond Towns makes the Midrange and draws the foul on Chris Carter! And-1! Draymond Towns to the line for 1. [Team fouls: 3] (Chris Carter: 1 personal fouls)   FT 1/1: GOOD Draymond Towns makes 1/1 from the line.
Score: 88-73

[07:16] Team_074 possession (Score: 88-73)
Shai Green makes the Dunk and draws the foul on Zach Fox! And-1! Shai Green to the line for 1. [Team fouls: 1] (Zach Fox: 1 personal fouls)   FT 1/1: MISS Shai Green makes 0/1 from the line. Rebound secured by Zach Fox.
Score: 88-75

[07:03] Team_024 possession (Score: 88-75)
Anfernee Williamson attempts a 3Pt. Contested by Dwyane Quickley (5.7 feet, ZONE). Anfernee Williamson misses. Offensive rebound by Zach Fox! Zach Fox kicks it out.

[06:49] Team_024 possession (Score: 88-75)
Ja Reaves drives to the basket... FOUL! Offensive foul on Ja Reaves! James Turner drew the charge! [Team fouls: 2] (Ja Reaves: 1 personal fouls) TURNOVER! (dead ball)

[06:35] Team_074 possession (Score: 88-75)
FOUL! Reach-in foul on Anfernee Williamson during the drive. [Team fouls: 3] No free throws, side out. (Anfernee Williamson: 1 personal fouls)

[06:20] Team_074 possession (Score: 88-75)
Dwyane Quickley attempts a 3Pt. Contested by Zach Fox (4.4 feet, ZONE). Dwyane Quickley misses. Offensive rebound by Donovan Doncic! Donovan Doncic kicks it out.

[06:07] Team_074 possession (Score: 88-75)
Shai Green commits a violation (traveling/carry)! TURNOVER! (dead ball)

[06:07] Substitution (Team_024): Ja Reaves OUT → Victor Simons IN (stamina_rule2)

[06:07] Substitution (Team_024): Zach Fox OUT → Vince Irving IN (stamina_rule2)

[06:07] Substitution (Team_024): Bradley Allen OUT → Zach Durant IN (stamina_rule2)

[06:07] Substitution (Team_024): Anfernee Williamson OUT → Julius Harris IN (stamina_rule2)

[06:07] Substitution (Team_024): Draymond Towns OUT → Terry Rozier IN (stamina_rule2)

[06:07] Substitution (Team_074): Dwyane Quickley OUT → James Barnes IN (stamina_rule2)

[06:07] Substitution (Team_074): Chris Carter OUT → Giannis Westbrook IN (stamina_rule2)

[06:07] Substitution (Team_074): Shai Green OUT → Ayo Smith IN (stamina_rule2)

[06:07] Substitution (Team_074): Donovan Doncic OUT → Yao Randle IN (stamina_rule2)

[06:07] Substitution (Team_074): James Turner OUT → Jaren Rozier IN (stamina_rule2)

[05:54] Team_024 possession (Score: 88-75)
Zach Durant attempts a Layup. Contested by Ayo Smith (5.0 feet, MAN). ZACH DURANT MAKES IT! Assist: Victor Simons
Score: 90-75

[05:36] Team_074 possession (Score: 90-75)
FOUL! Offensive foul on Yao Randle! Julius Harris drew the charge! [Team fouls: 4] (Yao Randle: 1 personal fouls) TURNOVER! (dead ball)

[05:22] Team_024 possession (Score: 90-75)
Julius Harris attempts a 3Pt. Contested by James Barnes (4.4 feet, ZONE). Julius Harris misses. Rebound secured by Ayo Smith.

[05:10] Team_074 possession (Score: 90-75)
Yao Randle attempts a Midrange. Contested by Zach Durant (3.4 feet, ZONE). Yao Randle misses. FOUL! Loose ball foul on Zach Durant during the rebound battle. [Team fouls: 4] No free throws, side out. (Zach Durant: 1 personal fouls)

[04:55] Team_074 possession (Score: 90-75)
Ayo Smith attempts a 3Pt. Contested by Victor Simons (4.1 feet, ZONE). Ayo Smith misses. Rebound secured by Terry Rozier.

[04:43] Team_024 possession (Score: 90-75)
Julius Harris throws a bad pass! Stolen by Yao Randle! TURNOVER! (live ball)

[04:29] Team_074 possession (Score: 90-75)
FOUL! Reach-in foul on Terry Rozier during the drive. [IN THE BONUS! 5 team fouls] Yao Randle to the line for 2 free throws. (Terry Rozier: 1 personal fouls)   FT 1/2: GOOD   FT 2/2: GOOD Yao Randle makes 2/2 from the line.
Score: 90-77

[04:11] Team_024 possession (Score: 90-77)
FOUL! Shooting foul on Jaren Rozier. Julius Harris to the line for 2 free throws. [BONUS: 5 team fouls] (Jaren Rozier: 1 personal fouls)   FT 1/2: GOOD   FT 2/2: GOOD Julius Harris makes 2/2 from the line.
Score: 92-77

[03:55] Team_074 possession (Score: 92-77)
James Barnes attempts a 3Pt. Contested by Victor Simons (3.8 feet, ZONE). James Barnes misses. Rebound secured by Zach Durant.

[03:40] Team_024 possession (Score: 92-77)
Julius Harris drives and kicks out. Terry Rozier attempts a Midrange. Contested by Yao Randle (4.5 feet, ZONE). TERRY ROZIER MAKES IT! Assist: Victor Simons
Score: 94-77

[03:23] Team_074 possession (Score: 94-77)
James Barnes attempts a 3Pt. Contested by Victor Simons (3.8 feet, MAN). James Barnes misses. Rebound secured by Zach Durant.

[03:13] Team_024 possession (Score: 94-77)
Vince Irving makes the Midrange and draws the foul on Giannis Westbrook! And-1! Vince Irving to the line for 1. [BONUS: 6 team fouls] (Giannis Westbrook: 1 personal fouls)   FT 1/1: MISS Vince Irving makes 0/1 from the line. Offensive rebound by Julius Harris! Julius Harris kicks it out.
Score: 96-77

[02:59] Team_024 possession (Score: 96-77)
Victor Simons attempts a Layup. Contested by James Barnes (4.3 feet, MAN). VICTOR SIMONS MAKES IT! Assist: Vince Irving
Score: 98-77

[02:43] Team_074 possession (Score: 98-77)
Jaren Rozier attempts a Midrange. Contested by Terry Rozier (3.8 feet, MAN). Jaren Rozier misses. Offensive rebound by Jaren Rozier! Jaren Rozier kicks it out.

[02:24] Team_074 possession (Score: 98-77)
Yao Randle drives, picks up Terry Rozier. Help arrives from Vince Irving! Yao Randle attempts a Dunk. Contested by Vince Irving (4.1 feet, ZONE). YAO RANDLE MAKES IT! Assist: Ayo Smith
Score: 98-79

[02:12] Team_024 possession (Score: 98-79)
Victor Simons attempts a 3Pt. Contested by James Barnes (4.3 feet, ZONE). Victor Simons misses. Rebound secured by Yao Randle.

[02:01] Team_074 possession (Score: 98-79)
Giannis Westbrook attempts a 3Pt. Contested by Vince Irving (5.0 feet, MAN). Giannis Westbrook misses. Rebound secured by Julius Harris.

[01:48] Team_024 possession (Score: 98-79)
Victor Simons drives, James Barnes stays with him. Victor Simons attempts a Dunk. Contested by James Barnes (4.3 feet, MAN). VICTOR SIMONS MAKES IT! Assist: Zach Durant
Score: 100-79

[01:33] Team_074 possession (Score: 100-79)
FOUL! Shooting foul on Terry Rozier. Jaren Rozier to the line for 2 free throws. [BONUS: 6 team fouls] (Terry Rozier: 2 personal fouls)   FT 1/2: MISS   FT 2/2: GOOD Jaren Rozier makes 1/2 from the line.
Score: 100-80

[01:18] Team_024 possession (Score: 100-80)
Terry Rozier attempts a 3Pt. Contested by Jaren Rozier (4.7 feet, MAN). Terry Rozier misses. Rebound secured by Yao Randle.

[01:01] Team_074 possession (Score: 100-80)
Ayo Smith attempts a 3Pt. Contested by Victor Simons (4.1 feet, ZONE). Ayo Smith misses. Rebound secured by Terry Rozier.

[00:43] Team_024 possession (Score: 100-80)
Zach Durant attempts a Layup. BLOCKED BY YAO RANDLE! Ball deflects out of bounds off Zach Durant.

[00:26] Team_074 possession (Score: 100-80)
Yao Randle drives, Julius Harris stays with him. Yao Randle attempts a Dunk. Contested by Julius Harris (5.1 feet, MAN). Yao Randle misses. Rebound secured by Julius Harris.

[00:11] Team_024 possession (Score: 100-80)
Vince Irving attempts a 3Pt. Contested by Ayo Smith (4.8 feet, ZONE). VINCE IRVING MAKES IT! Assist: Terry Rozier
Score: 103-80

================================================================================
                              4TH QUARTER COMPLETE                              
================================================================================

4TH QUARTER SCORE: Team_024 29, Team_074 7

BOX SCORE:
================================================================================

Team_024
--------------------------------------------------------------------------------
Player                MIN  PTS  REB  AST  TO      FG   FG%      3P   3P%
--------------------------------------------------------------------------------
Draymond Towns         38    9    2    1   0   4/4   100.0     0/0   0.0
Victor Simons          11    4    0    2   0   2/3    66.7     0/0   0.0
Ja Reaves              40    3    0    0   0   1/2    50.0     0/0   0.0
Vince Irving           10    3    0    1   0   1/1   100.0     0/0   0.0
Anfernee Williamson    37    2    6    0   0   1/1   100.0     0/0   0.0
Zach Durant            10    2    2    1   0   1/2    50.0     0/0   0.0
Julius Harris           8    2    3    0   0   1/2    50.0     0/0   0.0
Terry Rozier           10    2    2    1   0   1/2    50.0     0/0   0.0
Bradley Allen          38    0    0    1   0   0/2     0.0     0/0   0.0
Zach Fox               39    0    8    0   0   0/0     0.0     0/0   0.0

TEAM: FG: 12/19 (63.2%), 3PT: 3/8 (37.5%), REB: 22 (8 off, 14 def), AST: 7, TO: 2
TEAM FOULS: 6 [Team_074 in BONUS]


Team_074
--------------------------------------------------------------------------------
Player                MIN  PTS  REB  AST  TO      FG   FG%      3P   3P%
--------------------------------------------------------------------------------
Yao Randle              7    4    3    0   0   2/3    66.7     0/0   0.0
Jaren Rozier           10    1    1    0   0   1/1   100.0     0/0   0.0
Donovan Doncic         42    0    3    0   0   0/1     0.0     0/0   0.0
James Turner           38    0    1    0   0   0/1     0.0     0/0   0.0
Shai Green             38    0    0    0   0   0/2     0.0     0/0   0.0
Dwyane Quickley        38    0    0    0   0   0/5     0.0     0/0   0.0
Ayo Smith              10    0    1    1   0   0/2     0.0     0/0   0.0
James Barnes           10    0    0    0   0   0/2     0.0     0/0   0.0
Giannis Westbrook      10    0    0    0   0   0/1     0.0     0/0   0.0

TEAM: FG: 3/18 (16.7%), 3PT: 0/9 (0.0%), REB: 10 (4 off, 6 def), AST: 1, TO: 2
TEAM FOULS: 6 [Team_024 in BONUS]

================================================================================

================================================================================
                               FULL GAME COMPLETE                               
================================================================================

FINAL SCORE: Team_024 103, Team_074 80

SCORING BY QUARTER:
--------------------------------------------------------------------------------
Team                     Q1     Q2     Q3     Q4    FINAL
--------------------------------------------------------------------------------
Team_024                 23     28     23     29      103
Team_074                 25     28     20      7       80
--------------------------------------------------------------------------------

FULL GAME BOX SCORE:
================================================================================

Team_024
--------------------------------------------------------------------------------
Player                MIN  PTS  REB  AST  TO      FG   FG%      3P   3P%      FT STL BLK
--------------------------------------------------------------------------------
Ja Reaves              40   12    0    1   2   6/13   46.2   4/6    66.7   1/1     0   0
Zach Fox               39   15   23    2   1   8/17   47.1   1/5    20.0   3/5     0   2
Bradley Allen          38   23    0    4   1   7/12   58.3   4/8    50.0   3/3     0   0
Draymond Towns         38   21   13    5   3   6/9    66.7   1/1   100.0   7/7     0   0
Anfernee Williamson    37    4   10    7   2   2/8    25.0   0/2     0.0   1/2     2   1
Victor Simons          11    7    0    2   1   4/5    80.0   0/1     0.0   1/1     0   0
Vince Irving           10    3    0    2   0   1/2    50.0   1/2    50.0   0/1     0   0
Zach Durant            10    4    4    1   0   3/5    60.0   0/0     0.0   0/0     0   1
Terry Rozier           10    6    4    1   1   0/1     0.0   0/1     0.0   0/0     0   0
Julius Harris           8    2    4    0   1   3/4    75.0   0/1     0.0   2/2     0   0

TEAM: FG: 41/77 (53.2%), 3PT: 11/27 (40.7%), REB: 57 (13 off, 44 def), AST: 25, TO: 12


Team_074
--------------------------------------------------------------------------------
Player                MIN  PTS  REB  AST  TO      FG   FG%      3P   3P%      FT STL BLK
--------------------------------------------------------------------------------
Donovan Doncic         42   16   14    2   3   6/14   42.9   1/2    50.0   4/6     2   0
Dwyane Quickley        38    6    0    4   0   3/12   25.0   1/6    16.7   1/1     0   1
Chris Carter           38   13    0    0   0   5/7    71.4   1/3    33.3   2/2     0   0
Shai Green             38   13   10    3   2   4/14   28.6   1/7    14.3   4/5     0   0
James Turner           38   14   14    0   2   7/13   53.8   1/2    50.0  11/14    3   0
James Barnes           10    2    0    0   0   1/5    20.0   0/3     0.0   2/2     0   0
Giannis Westbrook      10    0    0    0   0   0/1     0.0   0/1     0.0   0/0     0   1
Ayo Smith              10    2    2    1   0   0/2     0.0   0/2     0.0   2/2     0   0
Jaren Rozier           10    4    3    0   1   2/3    66.7   0/1     0.0   2/3     0   0
Yao Randle              7    4    3    0   1   2/3    66.7   0/0     0.0   2/2     1   1

TEAM: FG: 32/77 (41.6%), 3PT: 5/27 (18.5%), REB: 47 (12 off, 35 def), AST: 10, TO: 9

================================================================================
