================================================================================
                        FULL GAME - Team_056 vs Team_050                        
================================================================================

================================================================================
                       1ST QUARTER - Team_056 vs Team_050                       
================================================================================

[12:00] Team_056 possession (Score: 0-0)
Yao Poole drives, Donovan Trent stays with him. Yao Poole attempts a Dunk. Contested by Donovan Trent (4.6 feet, MAN). YAO POOLE MAKES IT! Assist: Tony Carter
Score: 2-0

[11:45] Team_050 possession (Score: 2-0)
Collin Bane drives, picks up Tony Carter. Help arrives from Giannis Jokic! Collin Bane attempts a Dunk. Contested by Giannis Jokic (4.3 feet, MAN). Collin Bane misses. Rebound secured by Jrue Lillard.

[11:31] Team_056 possession (Score: 2-0)
Magic Russell drives to the basket... Magic Russell loses control! Ball rolls out of bounds! TURNOVER! (dead ball)

[11:14] Team_050 possession (Score: 2-0)
FOUL! Reach-in foul on Yao Poole during the drive. [Team fouls: 1] No free throws, side out. (Yao Poole: 1 personal fouls)

[10:54] Team_050 possession (Score: 2-0)
Giannis LaVine attempts a 3Pt. Contested by Tony Carter (4.6 feet, ZONE). Giannis LaVine misses. Rebound secured by Tony Carter.

[10:39] Team_056 possession (Score: 2-0)
Tony Carter attempts a 3Pt. Contested by Giannis LaVine (4.6 feet, ZONE). Tony Carter misses. Rebound secured by Joel Banchero.

[10:29] Team_050 possession (Score: 2-0)
FOUL! Shooting foul on Jrue Lillard. LeBron Bridges to the line for 3 free throws. [Team fouls: 2] (Jrue Lillard: 1 personal fouls)   FT 1/3: GOOD   FT 2/3: MISS   FT 3/3: GOOD LeBron Bridges makes 2/3 from the line.
Score: 2-2

[10:13] Team_056 possession (Score: 2-2)
Giannis Jokic attempts a Midrange. Contested by Giannis LaVine (4.3 feet, MAN). GIANNIS JOKIC MAKES IT! Assist: Yao Poole
Score: 4-2

[09:59] Team_050 possession (Score: 4-2)
Joel Banchero attempts a Midrange. Contested by Magic Russell (5.3 feet, MAN). JOEL BANCHERO MAKES IT!
Score: 4-4

[09:44] Team_056 possession (Score: 4-4)
Yao Poole attempts a Midrange. Contested by Collin Bane (3.8 feet, ZONE). YAO POOLE MAKES IT!
Score: 6-4

[09:32] Team_050 possession (Score: 6-4)
Joel Banchero attempts a 3Pt. Contested by Giannis Jokic (4.1 feet, ZONE). Joel Banchero misses. Rebound secured by Tony Carter.

[09:17] Team_056 possession (Score: 6-4)
Jrue Lillard attempts a 3Pt. Contested by LeBron Bridges (4.8 feet, MAN). Jrue Lillard misses. Offensive rebound by Yao Poole! Yao Poole kicks it out.

[09:01] Team_056 possession (Score: 6-4)
Yao Poole throws a bad pass out of bounds! TURNOVER! (dead ball)

[08:45] Team_050 possession (Score: 6-4)
LeBron Bridges drives and kicks out. Joel Banchero attempts a Midrange. Contested by Magic Russell (5.5 feet, MAN). Joel Banchero misses. Rebound secured by Jrue Lillard.

[08:28] Team_056 possession (Score: 6-4)
Yao Poole makes the Layup and draws the foul on Donovan Trent! And-1! Yao Poole to the line for 1. [Team fouls: 1] (Donovan Trent: 1 personal fouls)   FT 1/1: GOOD Yao Poole makes 1/1 from the line.
Score: 9-4

[08:13] Team_050 possession (Score: 9-4)
LeBron Bridges drives to the basket... LeBron Bridges commits a violation (traveling/carry)! TURNOVER! (dead ball)

[07:57] Team_056 possession (Score: 9-4)
Jrue Lillard attempts a Midrange. Contested by LeBron Bridges (4.8 feet, MAN). JRUE LILLARD MAKES IT!
Score: 11-4

[07:37] Team_050 possession (Score: 11-4)
Donovan Trent attempts a 3Pt. Contested by Yao Poole (3.8 feet, MAN). Donovan Trent misses. Rebound secured by Yao Poole.

[07:23] Team_056 possession (Score: 11-4)
Jrue Lillard attempts a Layup. Contested by Donovan Trent (5.5 feet, ZONE). JRUE LILLARD MAKES IT! Assist: Yao Poole
Score: 13-4

[07:09] Team_050 possession (Score: 13-4)
Collin Bane attempts a Midrange. Contested by Tony Carter (4.3 feet, MAN). Collin Bane misses. Rebound secured by Yao Poole.

[06:55] Team_056 possession (Score: 13-4)
Tony Carter attempts a Midrange. Contested by LeBron Bridges (4.9 feet, ZONE). TONY CARTER MAKES IT!
Score: 15-4

[06:43] Team_050 possession (Score: 15-4)
Collin Bane attempts a 3Pt. Contested by Tony Carter (4.3 feet, MAN). Collin Bane misses. Rebound secured by Jrue Lillard.

[06:30] Team_056 possession (Score: 15-4)
Tony Carter drives to the basket... Tony Carter throws a bad pass! Stolen by Collin Bane! TURNOVER! (live ball)

[06:16] Team_050 possession (Score: 15-4)
Donovan Trent drives to the basket... Donovan Trent loses the ball! Stripped by Yao Poole! TURNOVER! (live ball)

[06:06] Team_056 possession (Score: 15-4)
Tony Carter drives, picks up Collin Bane. Help arrives from Joel Banchero! Tony Carter attempts a Layup. Contested by Joel Banchero (4.8 feet, MAN). TONY CARTER MAKES IT! Assist: Jrue Lillard
Score: 17-4

[05:46] Team_050 possession (Score: 17-4)
FOUL! Reach-in foul on Jrue Lillard during the drive. [Team fouls: 3] No free throws, side out. (Jrue Lillard: 2 personal fouls)

[05:29] Team_050 possession (Score: 17-4)
Donovan Trent drives, Jrue Lillard stays with him. Donovan Trent attempts a Layup. Contested by Jrue Lillard (3.6 feet, ZONE). DONOVAN TRENT MAKES IT! Assist: LeBron Bridges
Score: 17-6

[05:16] Team_056 possession (Score: 17-6)
Yao Poole drives, picks up Donovan Trent. Help arrives from Joel Banchero! Yao Poole attempts a Layup. Contested by Joel Banchero (4.6 feet, MAN). Yao Poole misses. Rebound secured by Collin Bane.

[05:05] Team_050 possession (Score: 17-6)
Collin Bane attempts a Midrange. Contested by Giannis Jokic (4.5 feet, ZONE). Collin Bane misses. FOUL! Loose ball foul on Yao Poole during the rebound battle. [Team fouls: 4] No free throws, side out. (Yao Poole: 2 personal fouls)

[04:52] Team_050 possession (Score: 17-6)
Donovan Trent attempts a Midrange. Contested by Magic Russell (5.3 feet, ZONE). Donovan Trent misses. Rebound secured by Jrue Lillard.

[04:38] Team_056 possession (Score: 17-6)
Magic Russell attempts a 3Pt. Contested by Giannis LaVine (4.3 feet, ZONE). Magic Russell misses. Rebound secured by Collin Bane.

[04:25] Team_050 possession (Score: 17-6)
Giannis LaVine attempts a 3Pt. Contested by Giannis Jokic (4.8 feet, ZONE). Giannis LaVine misses. Rebound secured by Tony Carter.

[04:12] Team_056 possession (Score: 17-6)
Magic Russell commits a violation (traveling/carry)! TURNOVER! (dead ball)

[03:57] Team_050 possession (Score: 17-6)
FOUL! Shooting foul on Magic Russell. Joel Banchero to the line for 3 free throws. [BONUS: 5 team fouls] (Magic Russell: 1 personal fouls)   FT 1/3: MISS   FT 2/3: GOOD   FT 3/3: GOOD Joel Banchero makes 2/3 from the line.
Score: 17-8

[03:44] Team_056 possession (Score: 17-8)
FOUL! Shooting foul on Giannis LaVine. Tony Carter to the line for 3 free throws. [Team fouls: 2] (Giannis LaVine: 1 personal fouls)   FT 1/3: GOOD   FT 2/3: GOOD   FT 3/3: GOOD Tony Carter makes 3/3 from the line.
Score: 20-8

[03:31] Team_050 possession (Score: 20-8)
LeBron Bridges attempts a 3Pt. Contested by Jrue Lillard (4.1 feet, MAN). LEBRON BRIDGES MAKES IT! Assist: Giannis LaVine
Score: 20-11

[03:16] Team_056 possession (Score: 20-11)
Tony Carter attempts a 3Pt. Contested by Collin Bane (4.9 feet, MAN). Tony Carter misses. Rebound secured by Joel Banchero.

[02:58] Team_050 possession (Score: 20-11)
Giannis LaVine drives, Jrue Lillard stays with him. Giannis LaVine attempts a Layup. Contested by Jrue Lillard (4.4 feet, ZONE). GIANNIS LAVINE MAKES IT! Assist: Donovan Trent
Score: 20-13

[02:46] Team_056 possession (Score: 20-13)
Tony Carter attempts a 3Pt. Contested by Collin Bane (4.9 feet, MAN). Tony Carter misses. Rebound secured by Joel Banchero.

[02:35] Team_050 possession (Score: 20-13)
Giannis LaVine attempts a 3Pt. Wide open! Magic Russell is 6.2 feet away. [ZONE] Giannis LaVine misses. Rebound secured by Yao Poole.

[02:23] Team_056 possession (Score: 20-13)
Giannis Jokic attempts a 3Pt. Contested by Giannis LaVine (4.5 feet, ZONE). Giannis Jokic misses. Offensive rebound by Yao Poole! Yao Poole kicks it out.

[02:06] Team_056 possession (Score: 20-13)
Yao Poole attempts a Layup. BLOCKED BY DONOVAN TRENT! Ball deflects out of bounds off Yao Poole.

[01:52] Team_050 possession (Score: 20-13)
Collin Bane attempts a Midrange. Contested by Tony Carter (4.6 feet, MAN). COLLIN BANE MAKES IT!
Score: 20-15

[01:39] Team_056 possession (Score: 20-15)
Tony Carter attempts a 3Pt. Contested by LeBron Bridges (5.3 feet, ZONE). TONY CARTER MAKES IT! Assist: Yao Poole
Score: 23-15

[01:25] Team_050 possession (Score: 23-15)
LeBron Bridges attempts a Midrange. Contested by Jrue Lillard (4.3 feet, MAN). LeBron Bridges misses. Offensive rebound by LeBron Bridges! LeBron Bridges kicks it out.

[01:13] Team_050 possession (Score: 23-15)
Joel Banchero attempts a 3Pt. Contested by Magic Russell (5.7 feet, MAN). Joel Banchero misses. Offensive rebound by Collin Bane! Collin Bane kicks it out.

[00:58] Team_050 possession (Score: 23-15)
Joel Banchero attempts a 3Pt. Contested by Giannis Jokic (4.6 feet, ZONE). Joel Banchero misses. Rebound secured by Jrue Lillard.

[00:42] Team_056 possession (Score: 23-15)
Magic Russell attempts a Midrange. Contested by Joel Banchero (5.0 feet, MAN). Magic Russell misses. Rebound secured by LeBron Bridges.

[00:30] Team_050 possession (Score: 23-15)
Donovan Trent attempts a Midrange. Contested by Giannis Jokic (4.6 feet, ZONE). DONOVAN TRENT MAKES IT!
Score: 23-17

[00:15] Team_056 possession (Score: 23-17)
Tony Carter attempts a 3Pt. Contested by Giannis LaVine (5.0 feet, ZONE). Tony Carter misses. Offensive rebound by Jrue Lillard! Jrue Lillard's putback is no good. Offensive rebound by Yao Poole! Yao Poole kicks it out.

[00:02] Team_056 possession (Score: 23-17)
Jrue Lillard drives, Donovan Trent stays with him. Jrue Lillard attempts a Dunk. Contested by Donovan Trent (6.0 feet, ZONE). Jrue Lillard misses. Rebound secured by LeBron Bridges.

================================================================================
                              1ST QUARTER COMPLETE                              
================================================================================

1ST QUARTER SCORE: Team_056 23, Team_050 17

BOX SCORE:
================================================================================

Team_056
--------------------------------------------------------------------------------
Player                MIN  PTS  REB  AST  TO      FG   FG%      3P   3P%
--------------------------------------------------------------------------------
Tony Carter            12   10    3    1   0   4/7    57.1     0/0   0.0
Yao Poole              12    7    6    3   0   3/5    60.0     0/0   0.0
Jrue Lillard           12    4    5    1   0   2/3    66.7     0/0   0.0
Giannis Jokic          12    2    0    0   0   1/1   100.0     0/0   0.0
Magic Russell          12    0    0    0   0   0/2     0.0     0/0   0.0

TEAM: FG: 10/18 (55.6%), 3PT: 2/6 (33.3%), REB: 14 (3 off, 11 def), AST: 5, TO: 4
TEAM FOULS: 5 [Team_050 in BONUS]


Team_050
--------------------------------------------------------------------------------
Player                MIN  PTS  REB  AST  TO      FG   FG%      3P   3P%
--------------------------------------------------------------------------------
LeBron Bridges         12    5    4    1   0   2/3    66.7     0/0   0.0
Joel Banchero          12    4    3    0   0   2/4    50.0     0/0   0.0
Donovan Trent          12    4    0    1   0   2/4    50.0     0/0   0.0
Collin Bane            12    2    3    0   0   1/4    25.0     0/0   0.0
Giannis LaVine         12    2    0    1   0   1/4    25.0     0/0   0.0

TEAM: FG: 8/19 (42.1%), 3PT: 3/10 (30.0%), REB: 10 (3 off, 7 def), AST: 3, TO: 2
TEAM FOULS: 3

================================================================================

================================================================================
                       2ND QUARTER - Team_056 vs Team_050                       
================================================================================

[12:00] Team_056 possession (Score: 23-17)
Magic Russell attempts a 3Pt. Contested by Joel Banchero (4.9 feet, MAN). Magic Russell misses. Offensive rebound by Yao Poole! Yao Poole kicks it out.

[11:45] Team_056 possession (Score: 23-17)
Jrue Lillard attempts a Midrange. Contested by LeBron Bridges (5.3 feet, ZONE). Jrue Lillard misses. Offensive rebound by Jrue Lillard! Jrue Lillard's putback is no good. Rebound secured by Collin Bane.

[11:29] Team_050 possession (Score: 23-17)
FOUL! Shooting foul on Giannis Jokic. Collin Bane to the line for 3 free throws. [Team fouls: 1] (Giannis Jokic: 1 personal fouls)   FT 1/3: GOOD   FT 2/3: GOOD   FT 3/3: GOOD Collin Bane makes 3/3 from the line.
Score: 23-20

[11:14] Team_056 possession (Score: 23-20)
Jrue Lillard attempts a Midrange. Contested by LeBron Bridges (5.3 feet, ZONE). JRUE LILLARD MAKES IT!
Score: 25-20

[11:00] Team_050 possession (Score: 25-20)
Collin Bane attempts a 3Pt. Wide open! Magic Russell is 6.1 feet away. [ZONE] COLLIN BANE MAKES IT! Assist: Donovan Trent
Score: 25-23

[10:48] Team_056 possession (Score: 25-23)
FOUL! Reach-in foul on Donovan Trent during the drive. [Team fouls: 1] No free throws, side out. (Donovan Trent: 1 personal fouls)

[10:32] Team_056 possession (Score: 25-23)
FOUL! Shooting foul on Joel Banchero. Magic Russell to the line for 2 free throws. [Team fouls: 2] (Joel Banchero: 1 personal fouls)   FT 1/2: GOOD   FT 2/2: GOOD Magic Russell makes 2/2 from the line.
Score: 27-23

[10:17] Team_050 possession (Score: 27-23)
LeBron Bridges attempts a Midrange. Contested by Giannis Jokic (5.0 feet, ZONE). LeBron Bridges misses. Offensive rebound by Collin Bane! Collin Bane kicks it out.

[10:02] Team_050 possession (Score: 27-23)
Joel Banchero attempts a 3Pt. Contested by Giannis Jokic (4.7 feet, ZONE). Joel Banchero misses. Rebound secured by Jrue Lillard.

[09:44] Team_056 possession (Score: 27-23)
Jrue Lillard drives, LeBron Bridges stays with him. Jrue Lillard attempts a Layup. Contested by LeBron Bridges (5.5 feet, MAN). JRUE LILLARD MAKES IT!
Score: 29-23

[09:28] Team_050 possession (Score: 29-23)
Donovan Trent attempts a Layup. Contested by Jrue Lillard (4.3 feet, ZONE). DONOVAN TRENT MAKES IT!
Score: 29-25

[09:15] Team_056 possession (Score: 29-25)
FOUL! Shooting foul on Giannis LaVine. Giannis Jokic to the line for 2 free throws. [Team fouls: 3] (Giannis LaVine: 1 personal fouls)   FT 1/2: GOOD   FT 2/2: GOOD Giannis Jokic makes 2/2 from the line.
Score: 31-25

[08:59] Team_050 possession (Score: 31-25)
Joel Banchero drives and kicks out. Joel Banchero attempts a Midrange. Contested by Jrue Lillard (4.6 feet, ZONE). JOEL BANCHERO MAKES IT!
Score: 31-27

[08:44] Team_056 possession (Score: 31-27)
Yao Poole attempts a Midrange. Contested by LeBron Bridges (4.8 feet, ZONE). YAO POOLE MAKES IT! Assist: Magic Russell
Score: 33-27

[08:26] Team_050 possession (Score: 33-27)
Donovan Trent attempts a 3Pt. Contested by Yao Poole (4.8 feet, MAN). Donovan Trent misses. Rebound secured by Jrue Lillard.

[08:11] Team_056 possession (Score: 33-27)
Jrue Lillard drives, LeBron Bridges stays with him. Jrue Lillard attempts a Layup. Contested by LeBron Bridges (5.7 feet, MAN). JRUE LILLARD MAKES IT! Assist: Magic Russell
Score: 35-27

[07:54] Team_050 possession (Score: 35-27)
Giannis LaVine attempts a Layup. Contested by Jrue Lillard (5.0 feet, ZONE). GIANNIS LAVINE MAKES IT! Assist: LeBron Bridges
Score: 35-29

[07:37] Team_056 possession (Score: 35-29)
Magic Russell attempts a Layup. Contested by Donovan Trent (6.0 feet, ZONE). MAGIC RUSSELL MAKES IT!
Score: 37-29

[07:23] Team_050 possession (Score: 37-29)
Collin Bane attempts a 3Pt. Contested by Tony Carter (5.1 feet, MAN). Collin Bane misses. Rebound secured by Jrue Lillard.

[07:08] Team_056 possession (Score: 37-29)
Giannis Jokic attempts a 3Pt. Contested by Giannis LaVine (5.1 feet, ZONE). GIANNIS JOKIC MAKES IT! Assist: Jrue Lillard
Score: 40-29

[06:54] Team_050 possession (Score: 40-29)
Giannis LaVine attempts a Layup. Contested by Jrue Lillard (5.2 feet, ZONE). Giannis LaVine misses. Offensive rebound by Collin Bane! Collin Bane kicks it out.

[06:41] Team_050 possession (Score: 40-29)
Giannis LaVine attempts a 3Pt. Contested by Giannis Jokic (5.7 feet, MAN). Giannis LaVine misses. Rebound secured by Jrue Lillard.

[06:28] Team_056 possession (Score: 40-29)
Tony Carter attempts a 3Pt. Contested by Giannis LaVine (5.5 feet, ZONE). Tony Carter misses. Rebound secured by Collin Bane.

[06:14] Team_050 possession (Score: 40-29)
LeBron Bridges attempts a Layup. Contested by Jrue Lillard (5.0 feet, MAN). LEBRON BRIDGES MAKES IT!
Score: 40-31

[06:04] Team_056 possession (Score: 40-31)
Giannis Jokic attempts a 3Pt. Contested by Giannis LaVine (5.3 feet, MAN). Giannis Jokic misses. Rebound secured by LeBron Bridges.

[05:48] Team_050 possession (Score: 40-31)
Donovan Trent attempts a Layup. Contested by Jrue Lillard (4.8 feet, ZONE). Donovan Trent misses. Offensive rebound by Joel Banchero! Joel Banchero kicks it out.

[05:35] Team_050 possession (Score: 40-31)
LeBron Bridges throws a bad pass! Stolen by Jrue Lillard! TURNOVER! (live ball)

[05:16] Team_056 possession (Score: 40-31)
Magic Russell commits a violation (traveling/carry)! TURNOVER! (dead ball)

[05:16] Substitution (Team_056): Giannis Jokic OUT → De'Aaron Murray IN (stamina_rule2)

[05:16] Substitution (Team_056): Magic Russell OUT → Damian Barrett IN (stamina_rule2)

[05:16] Substitution (Team_056): Tony Carter OUT → CJ Anthony IN (stamina_rule2)

[05:16] Substitution (Team_056): Jrue Lillard OUT → RJ Johnson IN (stamina_rule2)

[05:16] Substitution (Team_056): Yao Poole OUT → Derrick Bane IN (stamina_rule2)

[05:16] Substitution (Team_050): Giannis LaVine OUT → Damian O'Neal IN (stamina_rule2)

[05:16] Substitution (Team_050): Joel Banchero OUT → Dwyane Towns IN (stamina_rule2)

[05:16] Substitution (Team_050): Collin Bane OUT → Larry Curry IN (stamina_rule2)

[05:16] Substitution (Team_050): LeBron Bridges OUT → Luka Gasol IN (stamina_rule2)

[05:16] Substitution (Team_050): Donovan Trent OUT → Tyler Smith IN (stamina_rule2)

[05:03] Team_050 possession (Score: 40-31)
FOUL! Offensive foul on Dwyane Towns! Damian Barrett drew the charge! [Team fouls: 4] (Dwyane Towns: 1 personal fouls) TURNOVER! (dead ball)

[04:48] Team_056 possession (Score: 40-31)
CJ Anthony attempts a 3Pt. Contested by Luka Gasol (4.8 feet, ZONE). CJ Anthony misses. Rebound secured by Larry Curry.

[04:34] Team_050 possession (Score: 40-31)
Damian O'Neal commits a violation (traveling/carry)! TURNOVER! (dead ball)

[04:18] Team_056 possession (Score: 40-31)
FOUL! Shooting foul on Luka Gasol. CJ Anthony to the line for 3 free throws. [BONUS: 5 team fouls] (Luka Gasol: 1 personal fouls)   FT 1/3: GOOD   FT 2/3: GOOD   FT 3/3: GOOD CJ Anthony makes 3/3 from the line.
Score: 43-31

[04:09] Team_050 possession (Score: 43-31)
Damian O'Neal attempts a 3Pt. Contested by De'Aaron Murray (6.0 feet, ZONE). Damian O'Neal misses. Rebound secured by RJ Johnson.

[03:57] Team_056 possession (Score: 43-31)
FOUL! Holding foul on Larry Curry. [IN THE BONUS! 6 team fouls] CJ Anthony to the line for 2 free throws. (Larry Curry: 1 personal fouls)   FT 1/2: MISS   FT 2/2: MISS CJ Anthony makes 0/2 from the line. Rebound secured by Dwyane Towns.

[03:40] Team_050 possession (Score: 43-31)
Dwyane Towns attempts a Layup. Contested by Damian Barrett (5.8 feet, MAN). DWYANE TOWNS MAKES IT! Assist: Damian O'Neal
Score: 43-33

[03:25] Team_056 possession (Score: 43-33)
CJ Anthony attempts a Layup. Contested by Tyler Smith (5.1 feet, ZONE). CJ ANTHONY MAKES IT! Assist: RJ Johnson
Score: 45-33

[03:11] Team_050 possession (Score: 45-33)
Damian O'Neal makes the Layup and draws the foul on RJ Johnson! And-1! Damian O'Neal to the line for 1. [Team fouls: 2] (RJ Johnson: 1 personal fouls)   FT 1/1: MISS Damian O'Neal makes 0/1 from the line. Rebound secured by RJ Johnson.
Score: 45-35

[02:55] Team_056 possession (Score: 45-35)
Damian Barrett attempts a Midrange. Contested by Luka Gasol (5.1 feet, ZONE). DAMIAN BARRETT MAKES IT! Assist: Derrick Bane
Score: 47-35

[02:40] Team_050 possession (Score: 47-35)
Tyler Smith attempts a 3Pt. Wide open! De'Aaron Murray is 6.3 feet away. [ZONE] Tyler Smith misses. Rebound secured by RJ Johnson.

[02:24] Team_056 possession (Score: 47-35)
RJ Johnson attempts a 3Pt. Contested by Luka Gasol (5.0 feet, MAN). RJ JOHNSON MAKES IT! Assist: Derrick Bane
Score: 50-35

[02:12] Team_050 possession (Score: 50-35)
FOUL! Holding foul on Derrick Bane. [Team fouls: 3] No free throws, side out. (Derrick Bane: 1 personal fouls)

[01:53] Team_050 possession (Score: 50-35)
Tyler Smith attempts a Layup. Contested by Derrick Bane (5.8 feet, MAN). TYLER SMITH MAKES IT! Assist: Larry Curry
Score: 50-37

[01:40] Team_056 possession (Score: 50-37)
RJ Johnson attempts a 3Pt. Contested by Luka Gasol (5.0 feet, MAN). RJ Johnson misses. Rebound secured by Tyler Smith.

[01:23] Team_050 possession (Score: 50-37)
FOUL! Shooting foul on Damian Barrett. Dwyane Towns to the line for 2 free throws. [Team fouls: 4] (Damian Barrett: 1 personal fouls)   FT 1/2: GOOD   FT 2/2: GOOD Dwyane Towns makes 2/2 from the line.
Score: 50-39

[01:09] Team_056 possession (Score: 50-39)
RJ Johnson drives to the basket... FOUL! Offensive foul on RJ Johnson! Tyler Smith drew the charge! [Team fouls: 5] (RJ Johnson: 2 personal fouls) TURNOVER! (dead ball)

[00:59] Team_050 possession (Score: 50-39)
FOUL! Holding foul on Derrick Bane. [IN THE BONUS! 6 team fouls] Tyler Smith to the line for 2 free throws. (Derrick Bane: 2 personal fouls)   FT 1/2: MISS   FT 2/2: MISS Tyler Smith makes 0/2 from the line. Rebound secured by Derrick Bane.

[00:43] Team_056 possession (Score: 50-39)
Derrick Bane attempts a 3Pt. Contested by Larry Curry (5.3 feet, ZONE). DERRICK BANE MAKES IT! Assist: De'Aaron Murray
Score: 53-39

[00:29] Team_050 possession (Score: 53-39)
Dwyane Towns drives, RJ Johnson stays with him. Dwyane Towns attempts a Layup. Contested by RJ Johnson (4.6 feet, ZONE). DWYANE TOWNS MAKES IT!
Score: 53-41

[00:14] Team_056 possession (Score: 53-41)
Damian Barrett drives and kicks out. Derrick Bane attempts a 3Pt. Contested by Luka Gasol (4.9 feet, ZONE). Derrick Bane misses. Rebound secured by Dwyane Towns.

[00:04] Team_050 possession (Score: 53-41)
Luka Gasol attempts a 3Pt. Contested by RJ Johnson (4.4 feet, MAN). LUKA GASOL MAKES IT! Assist: Tyler Smith
Score: 53-44

================================================================================
                              2ND QUARTER COMPLETE                              
================================================================================

2ND QUARTER SCORE: Team_056 30, Team_050 27

BOX SCORE:
================================================================================

Team_056
--------------------------------------------------------------------------------
Player                MIN  PTS  REB  AST  TO      FG   FG%      3P   3P%
--------------------------------------------------------------------------------
Jrue Lillard           19    6    4    1   0   3/4    75.0     0/0   0.0
Giannis Jokic          19    5    0    0   0   2/3    66.7     0/0   0.0
CJ Anthony              5    5    0    0   0   2/3    66.7     0/0   0.0
Magic Russell          19    4    0    2   0   2/2   100.0     0/0   0.0
RJ Johnson              5    3    3    1   0   1/2    50.0     0/0   0.0
Derrick Bane            5    3    1    2   0   1/1   100.0     0/0   0.0
Yao Poole              19    2    1    0   0   1/1   100.0     0/0   0.0
Damian Barrett          5    2    0    0   0   1/2    50.0     0/0   0.0
Tony Carter            19    0    0    0   0   0/1     0.0     0/0   0.0
De'Aaron Murray         5    0    0    1   0   0/0     0.0     0/0   0.0

TEAM: FG: 13/20 (65.0%), 3PT: 4/8 (50.0%), REB: 10 (2 off, 8 def), AST: 7, TO: 2
TEAM FOULS: 6 [Team_050 in BONUS]


Team_050
--------------------------------------------------------------------------------
Player                MIN  PTS  REB  AST  TO      FG   FG%      3P   3P%
--------------------------------------------------------------------------------
Collin Bane            19    6    4    0   0   2/3    66.7     0/0   0.0
Dwyane Towns            5    6    2    0   0   3/3   100.0     0/0   0.0
Luka Gasol              5    3    0    0   0   1/1   100.0     0/0   0.0
Donovan Trent          19    2    0    1   0   1/2    50.0     0/0   0.0
Joel Banchero          19    2    1    0   0   1/2    50.0     0/0   0.0
Giannis LaVine         19    2    0    0   0   1/2    50.0     0/0   0.0
LeBron Bridges         19    2    1    1   0   1/1   100.0     0/0   0.0
Tyler Smith             5    2    1    1   0   1/2    50.0     0/0   0.0
Larry Curry             5    0    1    1   0   0/0     0.0     0/0   0.0
Damian O'Neal           5    0    0    1   0   0/2     0.0     0/0   0.0

TEAM: FG: 11/19 (57.9%), 3PT: 3/9 (33.3%), REB: 9 (3 off, 6 def), AST: 5, TO: 3
TEAM FOULS: 6 [Team_056 in BONUS]

================================================================================

================================================================================
                       3RD QUARTER - Team_056 vs Team_050                       
================================================================================

[12:00] Team_056 possession (Score: 53-44)
FOUL! Reach-in foul on LeBron Bridges during the drive. [Team fouls: 1] No free throws, side out. (LeBron Bridges: 1 personal fouls)

[11:46] Team_056 possession (Score: 53-44)
FOUL! Reach-in foul on Giannis LaVine during the drive. [Team fouls: 2] No free throws, side out. (Giannis LaVine: 1 personal fouls)

[11:31] Team_056 possession (Score: 53-44)
Magic Russell attempts a 3Pt. Contested by Giannis LaVine (4.3 feet, ZONE). MAGIC RUSSELL MAKES IT! Assist: Yao Poole
Score: 56-44

[11:17] Team_050 possession (Score: 56-44)
Donovan Trent attempts a Layup. Contested by Yao Poole (3.8 feet, MAN). DONOVAN TRENT MAKES IT!
Score: 56-46

[11:04] Team_056 possession (Score: 56-46)
Magic Russell attempts a 3Pt. Contested by Giannis LaVine (4.3 feet, ZONE). Magic Russell misses. Rebound secured by LeBron Bridges.

[10:49] Team_050 possession (Score: 56-46)
Donovan Trent attempts a 3Pt. Contested by Giannis Jokic (4.1 feet, ZONE). Donovan Trent misses. Rebound secured by Yao Poole.

[10:35] Team_056 possession (Score: 56-46)
Tony Carter attempts a Midrange. Contested by Collin Bane (4.8 feet, MAN). TONY CARTER MAKES IT! Assist: Jrue Lillard
Score: 58-46

[10:21] Team_050 possession (Score: 58-46)
Collin Bane drives, picks up Tony Carter. Help arrives from Giannis Jokic! Collin Bane attempts a Layup. Contested by Giannis Jokic (4.3 feet, MAN). COLLIN BANE MAKES IT!
Score: 58-48

[10:03] Team_056 possession (Score: 58-48)
Magic Russell attempts a 3Pt. Contested by Joel Banchero (4.7 feet, MAN). MAGIC RUSSELL MAKES IT! Assist: Tony Carter
Score: 61-48

[09:51] Team_050 possession (Score: 61-48)
LeBron Bridges attempts a 3Pt. Contested by Giannis Jokic (4.5 feet, ZONE). LeBron Bridges misses. Rebound secured by Yao Poole.

[09:39] Team_056 possession (Score: 61-48)
FOUL! Shooting foul on Joel Banchero. Tony Carter to the line for 2 free throws. [Team fouls: 3] (Joel Banchero: 1 personal fouls)   FT 1/2: GOOD   FT 2/2: GOOD Tony Carter makes 2/2 from the line.
Score: 63-48

[09:25] Team_050 possession (Score: 63-48)
LeBron Bridges drives and kicks out. Giannis LaVine attempts a 3Pt. Contested by Giannis Jokic (4.3 feet, MAN). Giannis LaVine misses. Rebound secured by Jrue Lillard.

[09:10] Team_056 possession (Score: 63-48)
FOUL! Shooting foul on Donovan Trent. Yao Poole to the line for 2 free throws. [Team fouls: 4] (Donovan Trent: 1 personal fouls)   FT 1/2: GOOD   FT 2/2: GOOD Yao Poole makes 2/2 from the line.
Score: 65-48

[08:53] Team_050 possession (Score: 65-48)
Collin Bane drives, Jrue Lillard stays with him. Collin Bane attempts a Layup. Contested by Jrue Lillard (4.0 feet, ZONE). COLLIN BANE MAKES IT!
Score: 65-50

[08:39] Team_056 possession (Score: 65-50)
FOUL! Reach-in foul on Giannis LaVine during the drive. [IN THE BONUS! 5 team fouls] Giannis Jokic to the line for 2 free throws. (Giannis LaVine: 2 personal fouls)   FT 1/2: GOOD   FT 2/2: GOOD Giannis Jokic makes 2/2 from the line.
Score: 67-50

[08:24] Team_050 possession (Score: 67-50)
Donovan Trent drives, Yao Poole stays with him. Donovan Trent attempts a Layup. Contested by Yao Poole (3.8 feet, MAN). DONOVAN TRENT MAKES IT!
Score: 67-52

[08:11] Team_056 possession (Score: 67-52)
Tony Carter drives and kicks out. Giannis Jokic attempts a Midrange. Contested by Giannis LaVine (3.9 feet, MAN). Giannis Jokic misses. Offensive rebound by Yao Poole! Yao Poole kicks it out.

[07:59] Team_056 possession (Score: 67-52)
Tony Carter attempts a 3Pt. Contested by Giannis LaVine (4.6 feet, ZONE). Tony Carter misses. Rebound secured by Joel Banchero.

[07:42] Team_050 possession (Score: 67-52)
Giannis LaVine makes the Dunk and draws the foul on Giannis Jokic! And-1! Giannis LaVine to the line for 1. [Team fouls: 1] (Giannis Jokic: 1 personal fouls)   FT 1/1: GOOD Giannis LaVine makes 1/1 from the line.
Score: 67-55

[07:26] Team_056 possession (Score: 67-55)
Jrue Lillard throws a bad pass out of bounds! TURNOVER! (dead ball)

[07:12] Team_050 possession (Score: 67-55)
LeBron Bridges attempts a Midrange. Contested by Jrue Lillard (4.0 feet, MAN). LeBron Bridges misses. Rebound secured by Tony Carter.

[06:54] Team_056 possession (Score: 67-55)
Giannis Jokic attempts a Midrange. Contested by Donovan Trent (5.2 feet, ZONE). Giannis Jokic misses. FOUL! Loose ball foul on Collin Bane during the rebound battle. [IN THE BONUS! 6 team fouls] Yao Poole to the line for 2 free throws. (Collin Bane: 1 personal fouls)   FT 1/2: MISS   FT 2/2: MISS Yao Poole makes 0/2 from the line. Rebound secured by LeBron Bridges.

[06:40] Team_050 possession (Score: 67-55)
Joel Banchero attempts a 3Pt. Contested by Magic Russell (5.3 feet, MAN). JOEL BANCHERO MAKES IT! Assist: Collin Bane
Score: 67-58

[06:30] Team_056 possession (Score: 67-58)
Magic Russell attempts a 3Pt. Contested by Collin Bane (4.5 feet, ZONE). Magic Russell misses. Offensive rebound by Jrue Lillard! Jrue Lillard's putback is no good. Rebound secured by LeBron Bridges.

[06:15] Team_050 possession (Score: 67-58)
LeBron Bridges makes the Layup and draws the foul on Jrue Lillard! And-1! LeBron Bridges to the line for 1. [Team fouls: 2] (Jrue Lillard: 1 personal fouls)   FT 1/1: MISS LeBron Bridges makes 0/1 from the line. Rebound secured by Yao Poole.
Score: 67-60

[06:01] Team_056 possession (Score: 67-60)
Giannis Jokic attempts a 3Pt. Contested by Giannis LaVine (4.3 feet, ZONE). GIANNIS JOKIC MAKES IT! Assist: Yao Poole
Score: 70-60

[05:43] Team_050 possession (Score: 70-60)
LeBron Bridges attempts a Midrange. Contested by Magic Russell (5.7 feet, ZONE). LEBRON BRIDGES MAKES IT! Assist: Collin Bane
Score: 70-62

[05:27] Team_056 possession (Score: 70-62)
Tony Carter attempts a 3Pt. Contested by Collin Bane (4.8 feet, MAN). Tony Carter misses. Rebound secured by LeBron Bridges.

[05:17] Team_050 possession (Score: 70-62)
FOUL! Shooting foul on Magic Russell. Joel Banchero to the line for 2 free throws. [Team fouls: 3] (Magic Russell: 1 personal fouls)   FT 1/2: GOOD   FT 2/2: GOOD Joel Banchero makes 2/2 from the line.
Score: 70-64

[05:00] Team_056 possession (Score: 70-64)
Giannis Jokic attempts a 3Pt. Contested by Giannis LaVine (4.3 feet, ZONE). Giannis Jokic misses. Rebound secured by LeBron Bridges.

[04:43] Team_050 possession (Score: 70-64)
LeBron Bridges attempts a Midrange. Contested by Magic Russell (5.7 feet, ZONE). LEBRON BRIDGES MAKES IT!
Score: 70-66

[04:28] Team_056 possession (Score: 70-66)
Jrue Lillard attempts a Midrange. Contested by Collin Bane (4.8 feet, ZONE). JRUE LILLARD MAKES IT! Assist: Yao Poole
Score: 72-66

[04:14] Team_050 possession (Score: 72-66)
LeBron Bridges drives, Jrue Lillard stays with him. LeBron Bridges attempts a Layup. Contested by Jrue Lillard (4.1 feet, MAN). LEBRON BRIDGES MAKES IT! Assist: Collin Bane
Score: 72-68

[03:58] Team_056 possession (Score: 72-68)
Giannis Jokic attempts a 3Pt. Contested by Giannis LaVine (4.4 feet, ZONE). Giannis Jokic misses. FOUL! Loose ball foul on Joel Banchero during the rebound battle. [IN THE BONUS! 7 team fouls] Yao Poole to the line for 2 free throws. (Joel Banchero: 2 personal fouls)   FT 1/2: GOOD   FT 2/2: GOOD Yao Poole makes 2/2 from the line.
Score: 74-68

[03:44] Team_050 possession (Score: 74-68)
FOUL! Reach-in foul on Jrue Lillard during the drive. [Team fouls: 4] No free throws, side out. (Jrue Lillard: 2 personal fouls)

[03:27] Team_050 possession (Score: 74-68)
Giannis LaVine attempts a 3Pt. Contested by Giannis Jokic (4.9 feet, MAN). GIANNIS LAVINE MAKES IT! Assist: Collin Bane
Score: 74-71

[03:13] Team_056 possession (Score: 74-71)
Yao Poole attempts a Midrange. Contested by Donovan Trent (4.8 feet, MAN). Yao Poole misses. Rebound secured by Collin Bane.

[02:54] Team_050 possession (Score: 74-71)
LeBron Bridges drives, Jrue Lillard stays with him. LeBron Bridges attempts a Layup. Contested by Jrue Lillard (4.2 feet, MAN). LEBRON BRIDGES MAKES IT! Assist: Joel Banchero
Score: 74-73

[02:40] Team_056 possession (Score: 74-73)
Jrue Lillard attempts a 3Pt. Contested by LeBron Bridges (5.1 feet, MAN). JRUE LILLARD MAKES IT! Assist: Magic Russell
Score: 77-73

[02:24] Team_050 possession (Score: 77-73)
LeBron Bridges drives, Jrue Lillard stays with him. LeBron Bridges attempts a Layup. Contested by Jrue Lillard (4.2 feet, MAN). LEBRON BRIDGES MAKES IT! Assist: Collin Bane
Score: 77-75

[02:05] Team_056 possession (Score: 77-75)
Yao Poole attempts a 3Pt. Contested by Donovan Trent (4.9 feet, MAN). Yao Poole misses. Rebound secured by LeBron Bridges.

[01:55] Team_050 possession (Score: 77-75)
Collin Bane drives and kicks out. Donovan Trent attempts a 3Pt. Contested by Giannis Jokic (4.6 feet, ZONE). Donovan Trent misses. Rebound secured by Jrue Lillard.

[01:44] Team_056 possession (Score: 77-75)
Jrue Lillard attempts a 3Pt. Contested by Giannis LaVine (4.8 feet, ZONE). Jrue Lillard misses. Rebound secured by LeBron Bridges.

[01:27] Team_050 possession (Score: 77-75)
Giannis LaVine attempts a 3Pt. Contested by Giannis Jokic (5.1 feet, ZONE). GIANNIS LAVINE MAKES IT! Assist: LeBron Bridges
Score: 77-78

[01:16] Team_056 possession (Score: 77-78)
Giannis Jokic attempts a 3Pt. Contested by Giannis LaVine (4.6 feet, MAN). Giannis Jokic misses. Rebound secured by Collin Bane.

[01:01] Team_050 possession (Score: 77-78)
Joel Banchero loses the ball! Stripped by Magic Russell! TURNOVER! (live ball)

[00:47] Team_056 possession (Score: 77-78)
Giannis Jokic drives and kicks out. Yao Poole attempts a 3Pt. Contested by Donovan Trent (5.3 feet, MAN). Yao Poole misses. Rebound secured by LeBron Bridges.

[00:33] Team_050 possession (Score: 77-78)
Giannis LaVine attempts a Midrange. Contested by Tony Carter (5.0 feet, ZONE). Giannis LaVine misses. Rebound secured by Jrue Lillard.

[00:19] Team_056 possession (Score: 77-78)
Magic Russell makes the Layup and draws the foul on Donovan Trent! And-1! Magic Russell to the line for 1. [BONUS: 8 team fouls] (Donovan Trent: 2 personal fouls)   FT 1/1: GOOD Magic Russell makes 1/1 from the line.
Score: 80-78

[00:05] Team_050 possession (Score: 80-78)
LeBron Bridges attempts a Midrange. Contested by Jrue Lillard (4.5 feet, MAN). LEBRON BRIDGES MAKES IT!
Score: 80-80

================================================================================
                              3RD QUARTER COMPLETE                              
================================================================================

3RD QUARTER SCORE: Team_056 27, Team_050 36

BOX SCORE:
================================================================================

Team_056
--------------------------------------------------------------------------------
Player                MIN  PTS  REB  AST  TO      FG   FG%      3P   3P%
--------------------------------------------------------------------------------
Magic Russell          31    9    0    1   0   3/5    60.0     0/0   0.0
Jrue Lillard           31    5    3    1   0   2/3    66.7     0/0   0.0
Giannis Jokic          31    5    0    0   0   2/6    33.3     0/0   0.0
Yao Poole              31    4    4    3   0   2/4    50.0     0/0   0.0
Tony Carter            31    4    1    1   0   2/4    50.0     0/0   0.0

TEAM: FG: 11/22 (50.0%), 3PT: 5/13 (38.5%), REB: 10 (3 off, 7 def), AST: 6, TO: 1
TEAM FOULS: 4


Team_050
--------------------------------------------------------------------------------
Player                MIN  PTS  REB  AST  TO      FG   FG%      3P   3P%
--------------------------------------------------------------------------------
LeBron Bridges         31   12    8    1   0   6/10   60.0     0/0   0.0
Giannis LaVine         31    9    0    0   0   3/4    75.0     0/0   0.0
Joel Banchero          31    5    1    1   0   2/2   100.0     0/0   0.0
Donovan Trent          31    4    0    0   0   2/3    66.7     0/0   0.0
Collin Bane            31    4    2    5   0   2/3    66.7     0/0   0.0

TEAM: FG: 15/22 (68.2%), 3PT: 3/5 (60.0%), REB: 9 (0 off, 9 def), AST: 7, TO: 1
TEAM FOULS: 8 [Team_056 in BONUS]

================================================================================

================================================================================
                       4TH QUARTER - Team_056 vs Team_050                       
================================================================================

[12:00] Team_056 possession (Score: 80-80)
Tony Carter attempts a Midrange. Contested by Collin Bane (5.0 feet, MAN). Tony Carter misses. Rebound secured by LeBron Bridges.

[11:46] Team_050 possession (Score: 80-80)
Joel Banchero makes the 3Pt and draws the foul on Magic Russell! And-1! Joel Banchero to the line for 1. [Team fouls: 1] (Magic Russell: 1 personal fouls)   FT 1/1: GOOD Joel Banchero makes 1/1 from the line.
Score: 80-84

[11:30] Team_056 possession (Score: 80-84)
Tony Carter attempts a 3Pt. Contested by Giannis LaVine (4.9 feet, ZONE). Tony Carter misses. Offensive rebound by Jrue Lillard! Jrue Lillard puts it back in!
Score: 82-84

[11:15] Team_050 possession (Score: 82-84)
Collin Bane attempts a Layup. Contested by Tony Carter (4.7 feet, MAN). COLLIN BANE MAKES IT!
Score: 82-86

[11:04] Team_056 possession (Score: 82-86)
Yao Poole makes the Dunk and draws the foul on Joel Banchero! And-1! Yao Poole to the line for 1. [Team fouls: 1] (Joel Banchero: 1 personal fouls)   FT 1/1: GOOD Yao Poole makes 1/1 from the line.
Score: 85-86

[10:52] Team_050 possession (Score: 85-86)
FOUL! Shooting foul on Giannis Jokic. Giannis LaVine to the line for 2 free throws. [Team fouls: 2] (Giannis Jokic: 1 personal fouls)   FT 1/2: GOOD   FT 2/2: MISS Giannis LaVine makes 1/2 from the line. Offensive rebound by LeBron Bridges! LeBron Bridges kicks it out.
Score: 85-87

[10:42] Team_050 possession (Score: 85-87)
FOUL! Holding foul on Tony Carter. [Team fouls: 3] No free throws, side out. (Tony Carter: 1 personal fouls)

[10:26] Team_050 possession (Score: 85-87)
Collin Bane attempts a Midrange. Contested by Tony Carter (4.8 feet, MAN). COLLIN BANE MAKES IT!
Score: 85-89

[10:11] Team_056 possession (Score: 85-89)
Tony Carter attempts a 3Pt. Contested by Giannis LaVine (5.0 feet, ZONE). Tony Carter misses. Rebound secured by LeBron Bridges.

[10:01] Team_050 possession (Score: 85-89)
LeBron Bridges attempts a 3Pt. Contested by Jrue Lillard (4.5 feet, MAN). LeBron Bridges misses. Rebound secured by Tony Carter.

[09:49] Team_056 possession (Score: 85-89)
Jrue Lillard drives and kicks out. Yao Poole attempts a 3Pt. Contested by Giannis LaVine (4.5 feet, ZONE). Yao Poole misses. Rebound secured by LeBron Bridges.

[09:35] Team_050 possession (Score: 85-89)
Joel Banchero drives, Jrue Lillard stays with him. Joel Banchero attempts a Layup. Contested by Jrue Lillard (4.3 feet, ZONE). JOEL BANCHERO MAKES IT! Assist: Giannis LaVine
Score: 85-91

[09:24] Team_056 possession (Score: 85-91)
Giannis Jokic attempts a Layup. Contested by Giannis LaVine (4.9 feet, MAN). GIANNIS JOKIC MAKES IT!
Score: 87-91

[09:10] Team_050 possession (Score: 87-91)
Collin Bane drives and kicks out. Donovan Trent attempts a Midrange. Contested by Yao Poole (5.0 feet, MAN). Donovan Trent misses. Offensive rebound by Collin Bane! Collin Bane kicks it out.

[08:58] Team_050 possession (Score: 87-91)
Joel Banchero attempts a Midrange. Wide open! Magic Russell is 6.0 feet away. [MAN] Joel Banchero misses. Rebound secured by Tony Carter.

[08:44] Team_056 possession (Score: 87-91)
Tony Carter attempts a 3Pt. Contested by Giannis LaVine (5.2 feet, ZONE). Tony Carter misses. Offensive rebound by Yao Poole! Yao Poole kicks it out.

[08:31] Team_056 possession (Score: 87-91)
Yao Poole throws a bad pass! Stolen by Donovan Trent! TURNOVER! (live ball)

[08:13] Team_050 possession (Score: 87-91)
Collin Bane drives to the basket... Collin Bane loses control! Ball rolls out of bounds! TURNOVER! (dead ball)

[08:13] Substitution (Team_056): Giannis Jokic OUT → De'Aaron Murray IN (stamina_rule2)

[08:13] Substitution (Team_056): Magic Russell OUT → Damian Barrett IN (stamina_rule2)

[08:13] Substitution (Team_056): Tony Carter OUT → CJ Anthony IN (stamina_rule2)

[08:13] Substitution (Team_056): Jrue Lillard OUT → RJ Johnson IN (stamina_rule2)

[08:13] Substitution (Team_056): Yao Poole OUT → Derrick Bane IN (stamina_rule2)

[08:13] Substitution (Team_050): Giannis LaVine OUT → Damian O'Neal IN (stamina_rule2)

[08:13] Substitution (Team_050): Joel Banchero OUT → Dwyane Towns IN (stamina_rule2)

[08:13] Substitution (Team_050): Collin Bane OUT → Larry Curry IN (stamina_rule2)

[08:13] Substitution (Team_050): LeBron Bridges OUT → Luka Gasol IN (stamina_rule2)

[08:13] Substitution (Team_050): Donovan Trent OUT → Tyler Smith IN (stamina_rule2)

[07:56] Team_056 possession (Score: 87-91)
De'Aaron Murray throws a bad pass out of bounds! TURNOVER! (dead ball)

[07:41] Team_050 possession (Score: 87-91)
Luka Gasol attempts a Layup. Contested by RJ Johnson (4.4 feet, ZONE). Luka Gasol misses. Rebound secured by CJ Anthony.

[07:29] Team_056 possession (Score: 87-91)
RJ Johnson attempts a Midrange. Contested by Luka Gasol (5.0 feet, MAN). RJ Johnson misses. Rebound secured by Larry Curry.

[07:15] Team_050 possession (Score: 87-91)
Tyler Smith attempts a Midrange. Contested by Derrick Bane (5.8 feet, MAN). TYLER SMITH MAKES IT!
Score: 87-93

[07:00] Team_056 possession (Score: 87-93)
De'Aaron Murray throws a bad pass out of bounds! TURNOVER! (dead ball)

[06:46] Team_050 possession (Score: 87-93)
Tyler Smith attempts a Layup. Contested by Derrick Bane (5.8 feet, MAN). Tyler Smith misses. Offensive rebound by Tyler Smith! Tyler Smith kicks it out.

[06:30] Team_050 possession (Score: 87-93)
Dwyane Towns attempts a Midrange. Wide open! De'Aaron Murray is 6.1 feet away. [ZONE] DWYANE TOWNS MAKES IT! Assist: Luka Gasol
Score: 87-95

[06:15] Team_056 possession (Score: 87-95)
Damian Barrett attempts a 3Pt. Contested by Luka Gasol (5.1 feet, ZONE). Damian Barrett misses. Offensive rebound by CJ Anthony! CJ Anthony kicks it out.

[05:56] Team_056 possession (Score: 87-95)
Derrick Bane throws a bad pass! Stolen by Tyler Smith! TURNOVER! (live ball)

[05:42] Team_050 possession (Score: 87-95)
Damian O'Neal loses the ball! Stripped by De'Aaron Murray! TURNOVER! (live ball)

[05:26] Team_056 possession (Score: 87-95)
Derrick Bane drives and kicks out. Derrick Bane attempts a 3Pt. Contested by Tyler Smith (5.2 feet, MAN). DERRICK BANE MAKES IT! Assist: Damian Barrett
Score: 90-95

[05:13] Team_050 possession (Score: 90-95)
Damian O'Neal attempts a Midrange. Contested by De'Aaron Murray (6.0 feet, MAN). Damian O'Neal misses. Offensive rebound by Larry Curry! Larry Curry kicks it out.

[05:00] Team_050 possession (Score: 90-95)
Larry Curry makes the Layup and draws the foul on CJ Anthony! And-1! Larry Curry to the line for 1. [Team fouls: 4] (CJ Anthony: 1 personal fouls)   FT 1/1: GOOD Larry Curry makes 1/1 from the line.
Score: 90-98

[04:41] Team_056 possession (Score: 90-98)
CJ Anthony attempts a 3Pt. Contested by Larry Curry (4.8 feet, MAN). CJ Anthony misses. Rebound secured by Larry Curry.

[04:27] Team_050 possession (Score: 90-98)
Damian O'Neal throws a bad pass! Stolen by De'Aaron Murray! TURNOVER! (live ball)

[04:14] Team_056 possession (Score: 90-98)
De'Aaron Murray attempts a Midrange. Wide open! Damian O'Neal is 6.4 feet away. [MAN] De'Aaron Murray misses. Rebound secured by Larry Curry.

[03:56] Team_050 possession (Score: 90-98)
Luka Gasol attempts a 3Pt. Contested by De'Aaron Murray (5.9 feet, ZONE). Luka Gasol misses. Rebound secured by CJ Anthony.

[03:40] Team_056 possession (Score: 90-98)
CJ Anthony loses the ball! Stripped by Larry Curry! TURNOVER! (live ball)

[03:25] Team_050 possession (Score: 90-98)
Larry Curry attempts a 3Pt. Wide open! De'Aaron Murray is 6.0 feet away. [ZONE] Larry Curry misses. Rebound secured by CJ Anthony.

[03:14] Team_056 possession (Score: 90-98)
CJ Anthony attempts a 3Pt. Contested by Larry Curry (4.8 feet, MAN). CJ ANTHONY MAKES IT! Assist: Damian Barrett
Score: 93-98

[02:56] Team_050 possession (Score: 93-98)
Dwyane Towns attempts a Midrange. Contested by RJ Johnson (4.6 feet, ZONE). Dwyane Towns misses. Rebound secured by RJ Johnson.

[02:45] Team_056 possession (Score: 93-98)
RJ Johnson attempts a 3Pt. Contested by Luka Gasol (5.0 feet, MAN). RJ Johnson misses. Rebound secured by Tyler Smith.

[02:31] Team_050 possession (Score: 93-98)
Dwyane Towns attempts a Midrange. Contested by RJ Johnson (4.6 feet, ZONE). Dwyane Towns misses. Offensive rebound by Tyler Smith! Tyler Smith kicks it out.

[02:15] Team_050 possession (Score: 93-98)
Damian O'Neal attempts a 3Pt. Contested by De'Aaron Murray (6.0 feet, MAN). Damian O'Neal misses. FOUL! Loose ball foul on CJ Anthony during the rebound battle. [IN THE BONUS! 5 team fouls] Tyler Smith to the line for 2 free throws. (CJ Anthony: 2 personal fouls)   FT 1/2: MISS   FT 2/2: GOOD Tyler Smith makes 1/2 from the line.
Score: 93-99

[01:57] Team_056 possession (Score: 93-99)
De'Aaron Murray attempts a 3Pt. Wide open! Damian O'Neal is 6.4 feet away. [MAN] De'Aaron Murray misses. Rebound secured by Larry Curry.

[01:43] Team_050 possession (Score: 93-99)
FOUL! Reach-in foul on RJ Johnson during the drive. [IN THE BONUS! 6 team fouls] Damian O'Neal to the line for 2 free throws. (RJ Johnson: 1 personal fouls)   FT 1/2: MISS   FT 2/2: GOOD Damian O'Neal makes 1/2 from the line.
Score: 93-100

[01:29] Team_056 possession (Score: 93-100)
CJ Anthony attempts a 3Pt. Contested by Luka Gasol (4.8 feet, ZONE). CJ Anthony misses. Rebound secured by Dwyane Towns.

[01:13] Team_050 possession (Score: 93-100)
FOUL! Shooting foul on CJ Anthony. Dwyane Towns to the line for 3 free throws. [BONUS: 7 team fouls] (CJ Anthony: 3 personal fouls)   FT 1/3: GOOD   FT 2/3: GOOD   FT 3/3: MISS Dwyane Towns makes 2/3 from the line. Rebound secured by CJ Anthony.
Score: 93-102

[00:53] Team_056 possession (Score: 93-102)
Damian Barrett drives and kicks out. RJ Johnson attempts a 3Pt. Contested by Luka Gasol (5.0 feet, MAN). RJ Johnson misses. Rebound secured by Larry Curry.

[00:38] Team_050 possession (Score: 93-102)
Luka Gasol attempts a 3Pt. Contested by RJ Johnson (4.5 feet, ZONE). Luka Gasol misses. Rebound secured by Derrick Bane.

[00:20] Team_056 possession (Score: 93-102)
Derrick Bane drives and kicks out. Derrick Bane attempts a 3Pt. Contested by Tyler Smith (5.2 feet, MAN). Derrick Bane misses. Rebound secured by Dwyane Towns.

[00:08] Team_050 possession (Score: 93-102)
Damian O'Neal drives, picks up De'Aaron Murray. Help arrives from CJ Anthony! Damian O'Neal attempts a Dunk. Wide open! CJ Anthony is 6.1 feet away. [MAN] Damian O'Neal misses. Offensive rebound by Tyler Smith! Tyler Smith kicks it out.

================================================================================
                              4TH QUARTER COMPLETE                              
================================================================================

4TH QUARTER SCORE: Team_056 13, Team_050 22

BOX SCORE:
================================================================================

Team_056
--------------------------------------------------------------------------------
Player                MIN  PTS  REB  AST  TO      FG   FG%      3P   3P%
--------------------------------------------------------------------------------
Yao Poole              35    3    1    0   0   1/1   100.0     0/0   0.0
CJ Anthony             13    3    5    0   0   1/3    33.3     0/0   0.0
Derrick Bane           13    3    1    0   0   1/2    50.0     0/0   0.0
Jrue Lillard           35    2    1    0   0   1/2    50.0     0/0   0.0
Giannis Jokic          35    2    0    0   0   1/1   100.0     0/0   0.0
Tony Carter            35    0    2    0   0   0/2     0.0     0/0   0.0
RJ Johnson             13    0    1    0   0   0/2     0.0     0/0   0.0
Damian Barrett         13    0    0    2   0   0/1     0.0     0/0   0.0
De'Aaron Murray        13    0    0    0   0   0/2     0.0     0/0   0.0

TEAM: FG: 5/16 (31.2%), 3PT: 2/7 (28.6%), REB: 11 (3 off, 8 def), AST: 2, TO: 5
TEAM FOULS: 7 [Team_050 in BONUS]


Team_050
--------------------------------------------------------------------------------
Player                MIN  PTS  REB  AST  TO      FG   FG%      3P   3P%
--------------------------------------------------------------------------------
Joel Banchero          35    6    0    0   0   2/3    66.7     0/0   0.0
Collin Bane            35    4    1    0   0   2/2   100.0     0/0   0.0
Larry Curry            13    3    6    0   0   1/2    50.0     0/0   0.0
Tyler Smith            13    3    4    0   0   2/2   100.0     0/0   0.0
Dwyane Towns           13    2    2    0   0   1/3    33.3     0/0   0.0
Damian O'Neal          13    1    0    0   0   1/1   100.0     0/0   0.0
LeBron Bridges         35    0    4    0   0   0/1     0.0     0/0   0.0
Giannis LaVine         35    0    0    1   0   0/0     0.0     0/0   0.0
Luka Gasol             13    0    0    1   0   0/3     0.0     0/0   0.0

TEAM: FG: 9/17 (52.9%), 3PT: 2/7 (28.6%), REB: 17 (6 off, 11 def), AST: 2, TO: 3
TEAM FOULS: 1

================================================================================

================================================================================
                               FULL GAME COMPLETE                               
================================================================================

FINAL SCORE: Team_056 93, Team_050 102

SCORING BY QUARTER:
--------------------------------------------------------------------------------
Team                     Q1     Q2     Q3     Q4    FINAL
--------------------------------------------------------------------------------
Team_056                 23     30     27     13       93
Team_050                 17     27     36     22      102
--------------------------------------------------------------------------------

FULL GAME BOX SCORE:
================================================================================

Team_056
--------------------------------------------------------------------------------
Player                MIN  PTS  REB  AST  TO      FG   FG%      3P   3P%      FT STL BLK
--------------------------------------------------------------------------------
Giannis Jokic          35   14    0    0   0   7/12   58.3   3/6    50.0   4/4     0   0
Magic Russell          35   13    0    3   2   5/9    55.6   2/5    40.0   3/3     1   0
Tony Carter            35   14    6    2   2   7/15   46.7   3/10   30.0   5/5     0   0
Jrue Lillard           35   17   13    3   1   7/11   63.6   1/2    50.0   0/0     1   0
Yao Poole              35   16   12    6   2   6/10   60.0   0/1     0.0   6/8     1   0
De'Aaron Murray        13    0    0    1   3   0/2     0.0   0/1     0.0   0/0     2   0
Damian Barrett         13    2    0    2   0   1/3    33.3   0/0     0.0   0/0     0   0
CJ Anthony             13    8    5    0   1   3/6    50.0   2/5    40.0   3/5     0   0
RJ Johnson             13    3    4    1   0   1/4    25.0   1/3    33.3   0/0     0   0
Derrick Bane           13    6    2    2   1   2/3    66.7   1/1   100.0   0/0     0   0

TEAM: FG: 39/76 (51.3%), 3PT: 13/34 (38.2%), REB: 45 (11 off, 34 def), AST: 20, TO: 12


Team_050
--------------------------------------------------------------------------------
Player                MIN  PTS  REB  AST  TO      FG   FG%      3P   3P%      FT STL BLK
--------------------------------------------------------------------------------
Giannis LaVine         35   13    0    2   2   5/10   50.0   2/6    33.3   2/3     0   0
Joel Banchero          35   17    5    1   2   7/11   63.6   3/6    50.0   5/6     0   0
Collin Bane            35   16   10    5   0   7/12   58.3   2/4    50.0   3/3     1   0
LeBron Bridges         35   19   17    3   1   9/15   60.0   2/4    50.0   2/4     0   0
Donovan Trent          35   10    0    2   0   5/9    55.6   0/3     0.0   0/0     1   1
Damian O'Neal          13    1    0    1   3   2/4    50.0   1/2    50.0   1/3     0   0
Dwyane Towns           13    8    4    0   1   4/6    66.7   0/1     0.0   4/5     0   0
Larry Curry            13    3    7    1   0   1/2    50.0   0/1     0.0   1/1     1   0
Luka Gasol             13    3    0    1   0   1/4    25.0   1/3    33.3   0/0     0   0
Tyler Smith            13    5    5    1   0   2/3    66.7   0/1     0.0   1/4     1   0

TEAM: FG: 43/77 (55.8%), 3PT: 11/31 (35.5%), REB: 45 (12 off, 33 def), AST: 17, TO: 9

================================================================================
