================================================================================
                        FULL GAME - Team_057 vs Team_047                        
================================================================================

================================================================================
                       1ST QUARTER - Team_057 vs Team_047                       
================================================================================

[12:00] Team_057 possession (Score: 0-0)
Kobe Ming attempts a Midrange. Contested by De'Aaron Rose (4.3 feet, MAN). KOBE MING MAKES IT!
Score: 2-0

[11:44] Team_047 possession (Score: 2-0)
De'Aaron Rose attempts a 3Pt. Contested by Kobe Ming (4.7 feet, MAN). De'Aaron Rose misses. Offensive rebound by Myles LaVine! Myles LaVine kicks it out.

[11:27] Team_047 possession (Score: 2-0)
Myles LaVine attempts a Layup. BLOCKED BY KLAY ROZIER! Ball is loose! Offensive rebound by Myles LaVine! Myles LaVine kicks it out.

[11:15] Team_047 possession (Score: 2-0)
Josh Harris attempts a Midrange. Contested by Ben Adebayo (4.7 feet, ZONE). Josh Harris misses. Rebound secured by Anfernee Adebayo.

[11:03] Team_057 possession (Score: 2-0)
Kobe Ming attempts a 3Pt. Contested by De'Aaron Rose (4.3 feet, MAN). Kobe Ming misses. Rebound secured by Myles LaVine.

[10:48] Team_047 possession (Score: 2-0)
Josh Harris makes the 3Pt and draws the foul on Kobe Ming! And-1! Josh Harris to the line for 1. [Team fouls: 2] (Kobe Ming: 1 personal fouls)   FT 1/1: GOOD Josh Harris makes 1/1 from the line.
Score: 2-4

[10:33] Team_057 possession (Score: 2-4)
Ben Adebayo attempts a 3Pt. Contested by Josh Harris (4.7 feet, MAN). Ben Adebayo misses. FOUL! Loose ball foul on Josh Harris during the rebound battle. [Team fouls: 1] No free throws, side out. (Josh Harris: 1 personal fouls)

[10:21] Team_057 possession (Score: 2-4)
Anfernee Adebayo attempts a 3Pt. Contested by Blake Jokic (5.3 feet, ZONE). Anfernee Adebayo misses. Rebound secured by Josh Harris.

[10:06] Team_047 possession (Score: 2-4)
Myles LaVine attempts a Layup. Contested by Miles Middleton (4.5 feet, ZONE). MYLES LAVINE MAKES IT! Assist: De'Aaron Rose
Score: 2-6

[09:47] Team_057 possession (Score: 2-6)
FOUL! Shooting foul on Josh Harris. Anfernee Adebayo to the line for 2 free throws. [Team fouls: 2] (Josh Harris: 2 personal fouls)   FT 1/2: GOOD   FT 2/2: GOOD Anfernee Adebayo makes 2/2 from the line.
Score: 4-6

[09:31] Team_047 possession (Score: 4-6)
Blake Jokic attempts a 3Pt. Contested by Klay Rozier (3.5 feet, ZONE). BLAKE JOKIC MAKES IT! Assist: Josh Harris
Score: 4-9

[09:16] Team_057 possession (Score: 4-9)
Miles Middleton drives, picks up Myles LaVine. Help arrives from Derrick Irving! Miles Middleton attempts a Dunk. Contested by Derrick Irving (5.1 feet, MAN). MILES MIDDLETON MAKES IT! Assist: Ben Adebayo
Score: 6-9

[08:59] Team_047 possession (Score: 6-9)
Derrick Irving attempts a 3Pt. Contested by Klay Rozier (4.0 feet, MAN). Derrick Irving misses. Rebound secured by Anfernee Adebayo.

[08:48] Team_057 possession (Score: 6-9)
Klay Rozier attempts a Midrange. Contested by Derrick Irving (4.9 feet, MAN). Klay Rozier misses. Rebound secured by Myles LaVine.

[08:34] Team_047 possession (Score: 6-9)
Josh Harris attempts a 3Pt. Contested by Kobe Ming (4.7 feet, ZONE). Josh Harris misses. Rebound secured by Anfernee Adebayo.

[08:23] Team_057 possession (Score: 6-9)
Klay Rozier drives and kicks out. Klay Rozier attempts a Midrange. Contested by Derrick Irving (4.8 feet, MAN). Klay Rozier misses. Offensive rebound by Miles Middleton! Miles Middleton kicks it out.

[08:09] Team_057 possession (Score: 6-9)
FOUL! Shooting foul on Josh Harris. Ben Adebayo to the line for 2 free throws. [Team fouls: 3] (Josh Harris: 3 personal fouls)   FT 1/2: GOOD   FT 2/2: GOOD Ben Adebayo makes 2/2 from the line.
Score: 8-9

[07:51] Team_047 possession (Score: 8-9)
De'Aaron Rose drives and kicks out. Josh Harris attempts a Midrange. Contested by Ben Adebayo (4.4 feet, ZONE). Josh Harris misses. Rebound secured by Ben Adebayo.

[07:41] Team_057 possession (Score: 8-9)
Ben Adebayo attempts a Midrange. Contested by Josh Harris (4.7 feet, MAN). BEN ADEBAYO MAKES IT!
Score: 10-9

[07:26] Team_047 possession (Score: 10-9)
Blake Jokic drives, picks up Anfernee Adebayo. Help arrives from Klay Rozier! Blake Jokic attempts a Layup. Contested by Klay Rozier (4.7 feet, MAN). Blake Jokic misses. Offensive rebound by Myles LaVine! Myles LaVine kicks it out.

[07:16] Team_047 possession (Score: 10-9)
FOUL! Shooting foul on Klay Rozier. Blake Jokic to the line for 2 free throws. [Team fouls: 3] (Klay Rozier: 1 personal fouls)   FT 1/2: GOOD   FT 2/2: MISS Blake Jokic makes 1/2 from the line. Rebound secured by Anfernee Adebayo.
Score: 10-10

[07:00] Team_057 possession (Score: 10-10)
Ben Adebayo attempts a 3Pt. Contested by De'Aaron Rose (4.5 feet, ZONE). Ben Adebayo misses. Rebound secured by Myles LaVine.

[06:46] Team_047 possession (Score: 10-10)
FOUL! Shooting foul on Ben Adebayo. De'Aaron Rose to the line for 2 free throws. [Team fouls: 4] (Ben Adebayo: 1 personal fouls)   FT 1/2: GOOD   FT 2/2: MISS De'Aaron Rose makes 1/2 from the line. Rebound secured by Anfernee Adebayo.
Score: 10-11

[06:35] Team_057 possession (Score: 10-11)
Klay Rozier attempts a 3Pt. Contested by De'Aaron Rose (4.1 feet, ZONE). KLAY ROZIER MAKES IT! Assist: Anfernee Adebayo
Score: 13-11

[06:25] Team_047 possession (Score: 13-11)
Myles LaVine throws a bad pass! Stolen by Miles Middleton! TURNOVER! (live ball)

[06:13] Team_057 possession (Score: 13-11)
Kobe Ming attempts a Layup. Contested by De'Aaron Rose (4.3 feet, MAN). KOBE MING MAKES IT! Assist: Ben Adebayo
Score: 15-11

[05:57] Team_047 possession (Score: 15-11)
Blake Jokic attempts a 3Pt. Contested by Anfernee Adebayo (4.7 feet, MAN). BLAKE JOKIC MAKES IT! Assist: Myles LaVine
Score: 15-14

[05:38] Team_057 possession (Score: 15-14)
FOUL! Offensive foul on Ben Adebayo! Josh Harris drew the charge! [Team fouls: 5] (Ben Adebayo: 2 personal fouls) TURNOVER! (dead ball)

[05:26] Team_047 possession (Score: 15-14)
Derrick Irving attempts a 3Pt. Contested by Klay Rozier (4.0 feet, MAN). DERRICK IRVING MAKES IT! Assist: Myles LaVine
Score: 15-17

[05:11] Team_057 possession (Score: 15-17)
Miles Middleton attempts a 3Pt. Contested by Myles LaVine (5.1 feet, MAN). Miles Middleton misses. Rebound secured by Josh Harris.

[05:00] Team_047 possession (Score: 15-17)
FOUL! Holding foul on Klay Rozier. [IN THE BONUS! 6 team fouls] Derrick Irving to the line for 2 free throws. (Klay Rozier: 2 personal fouls)   FT 1/2: MISS   FT 2/2: GOOD Derrick Irving makes 1/2 from the line.
Score: 15-18

[04:44] Team_057 possession (Score: 15-18)
Ben Adebayo attempts a Layup. Contested by Josh Harris (4.7 feet, MAN). BEN ADEBAYO MAKES IT! Assist: Anfernee Adebayo
Score: 17-18

[04:32] Team_047 possession (Score: 17-18)
De'Aaron Rose attempts a Midrange. Contested by Ben Adebayo (4.8 feet, ZONE). DE'AARON ROSE MAKES IT!
Score: 17-20

[04:17] Team_057 possession (Score: 17-20)
Anfernee Adebayo attempts a 3Pt. Contested by Blake Jokic (5.3 feet, MAN). Anfernee Adebayo misses. FOUL! Loose ball foul on Josh Harris during the rebound battle. [Team fouls: 4] No free throws, side out. (Josh Harris: 4 personal fouls)

[04:07] Team_057 possession (Score: 17-20)
Klay Rozier attempts a Midrange. Contested by Josh Harris (4.4 feet, ZONE). Klay Rozier misses. FOUL! Loose ball foul on Myles LaVine during the rebound battle. [IN THE BONUS! 5 team fouls] Miles Middleton to the line for 2 free throws. (Myles LaVine: 1 personal fouls)   FT 1/2: GOOD   FT 2/2: MISS Miles Middleton makes 1/2 from the line. Rebound secured by Josh Harris.
Score: 18-20

[03:53] Team_047 possession (Score: 18-20)
Josh Harris attempts a 3Pt. Contested by Ben Adebayo (4.9 feet, MAN). Josh Harris misses. Rebound secured by Ben Adebayo.

[03:43] Team_057 possession (Score: 18-20)
Anfernee Adebayo attempts a Layup. Contested by Josh Harris (4.8 feet, ZONE). Anfernee Adebayo misses. Offensive rebound by Miles Middleton! Miles Middleton kicks it out.

[03:31] Team_057 possession (Score: 18-20)
Anfernee Adebayo attempts a 3Pt. Contested by De'Aaron Rose (4.6 feet, ZONE). Anfernee Adebayo misses. Offensive rebound by Ben Adebayo! Ben Adebayo kicks it out.

[03:16] Team_057 possession (Score: 18-20)
Kobe Ming makes the Dunk and draws the foul on Derrick Irving! And-1! Kobe Ming to the line for 1. [BONUS: 6 team fouls] (Derrick Irving: 1 personal fouls)   FT 1/1: GOOD Kobe Ming makes 1/1 from the line.
Score: 21-20

[03:02] Team_047 possession (Score: 21-20)
Josh Harris attempts a 3Pt. Contested by Kobe Ming (4.9 feet, ZONE). Josh Harris misses. FOUL! Loose ball foul on Miles Middleton during the rebound battle. [IN THE BONUS! 7 team fouls] Myles LaVine to the line for 2 free throws. (Miles Middleton: 1 personal fouls)   FT 1/2: GOOD   FT 2/2: GOOD Myles LaVine makes 2/2 from the line.
Score: 21-22

[02:47] Team_057 possession (Score: 21-22)
FOUL! Shooting foul on Blake Jokic. Anfernee Adebayo to the line for 2 free throws. [BONUS: 7 team fouls] (Blake Jokic: 1 personal fouls)   FT 1/2: GOOD   FT 2/2: GOOD Anfernee Adebayo makes 2/2 from the line.
Score: 23-22

[02:34] Team_047 possession (Score: 23-22)
Derrick Irving attempts a 3Pt. Contested by Kobe Ming (5.0 feet, ZONE). Derrick Irving misses. Rebound secured by Ben Adebayo.

[02:19] Team_057 possession (Score: 23-22)
Klay Rozier drives, picks up Derrick Irving. Help arrives from Blake Jokic! Klay Rozier attempts a Layup. Contested by Blake Jokic (5.2 feet, MAN). KLAY ROZIER MAKES IT! Assist: Ben Adebayo
Score: 25-22

[02:02] Team_047 possession (Score: 25-22)
Josh Harris drives and kicks out. Derrick Irving attempts a 3Pt. Contested by Kobe Ming (4.8 feet, ZONE). Derrick Irving misses. Rebound secured by Ben Adebayo.

[01:45] Team_057 possession (Score: 25-22)
Klay Rozier attempts a Midrange. Contested by Blake Jokic (5.2 feet, ZONE). KLAY ROZIER MAKES IT!
Score: 27-22

[01:31] Team_047 possession (Score: 27-22)
FOUL! Holding foul on Ben Adebayo. [IN THE BONUS! 8 team fouls] Josh Harris to the line for 2 free throws. (Ben Adebayo: 3 personal fouls)   FT 1/2: MISS   FT 2/2: GOOD Josh Harris makes 1/2 from the line.
Score: 27-23

[01:15] Team_057 possession (Score: 27-23)
Klay Rozier attempts a 3Pt. Contested by Derrick Irving (5.3 feet, MAN). KLAY ROZIER MAKES IT! Assist: Anfernee Adebayo
Score: 30-23

[00:57] Team_047 possession (Score: 30-23)
FOUL! Reach-in foul on Ben Adebayo during the drive. [IN THE BONUS! 9 team fouls] Derrick Irving to the line for 2 free throws. (Ben Adebayo: 4 personal fouls)   FT 1/2: GOOD   FT 2/2: GOOD Derrick Irving makes 2/2 from the line.
Score: 30-25

[00:42] Team_057 possession (Score: 30-25)
Miles Middleton drives and kicks out. Miles Middleton attempts a Midrange. Contested by Blake Jokic (5.2 feet, ZONE). MILES MIDDLETON MAKES IT! Assist: Ben Adebayo
Score: 32-25

[00:27] Team_047 possession (Score: 32-25)
Myles LaVine attempts a 3Pt. Contested by Kobe Ming (5.0 feet, ZONE). Myles LaVine misses. Rebound secured by Anfernee Adebayo.

[00:12] Team_057 possession (Score: 32-25)
Klay Rozier attempts a 3Pt. Contested by De'Aaron Rose (4.6 feet, ZONE). Klay Rozier misses. Offensive rebound by Ben Adebayo! Ben Adebayo kicks it out.

================================================================================
                              1ST QUARTER COMPLETE                              
================================================================================

1ST QUARTER SCORE: Team_057 32, Team_047 25

BOX SCORE:
================================================================================

Team_057
--------------------------------------------------------------------------------
Player                MIN  PTS  REB  AST  TO      FG   FG%      3P   3P%
--------------------------------------------------------------------------------
Klay Rozier            12   10    0    0   0   4/6    66.7     0/0   0.0
Kobe Ming              12    7    0    0   0   3/4    75.0     0/0   0.0
Ben Adebayo            12    6    7    4   0   3/4    75.0     0/0   0.0
Anfernee Adebayo       12    4    6    3   0   2/3    66.7     0/0   0.0
Miles Middleton        12    4    3    0   0   2/3    66.7     0/0   0.0

TEAM: FG: 14/20 (70.0%), 3PT: 2/6 (33.3%), REB: 17 (7 off, 10 def), AST: 7, TO: 1
TEAM FOULS: 9 [Team_047 in BONUS]


Team_047
--------------------------------------------------------------------------------
Player                MIN  PTS  REB  AST  TO      FG   FG%      3P   3P%
--------------------------------------------------------------------------------
Blake Jokic            12    6    0    0   0   2/3    66.7     0/0   0.0
Derrick Irving         12    6    0    0   0   3/5    60.0     0/0   0.0
Josh Harris            12    5    3    1   0   2/6    33.3     0/0   0.0
Myles LaVine           12    4    6    2   0   2/3    66.7     0/0   0.0
De'Aaron Rose          12    2    0    1   0   1/3    33.3     0/0   0.0

TEAM: FG: 10/20 (50.0%), 3PT: 5/10 (50.0%), REB: 8 (3 off, 5 def), AST: 4, TO: 1
TEAM FOULS: 7 [Team_057 in BONUS]

================================================================================

================================================================================
                       2ND QUARTER - Team_057 vs Team_047                       
================================================================================

[12:00] Team_057 possession (Score: 32-25)
Ben Adebayo attempts a Midrange. Contested by Josh Harris (5.0 feet, MAN). Ben Adebayo misses. Rebound secured by Myles LaVine.

[11:42] Team_047 possession (Score: 32-25)
Blake Jokic attempts a 3Pt. Contested by Kobe Ming (4.6 feet, ZONE). BLAKE JOKIC MAKES IT! Assist: Myles LaVine
Score: 32-28

[11:25] Team_057 possession (Score: 32-28)
Miles Middleton makes the Dunk and draws the foul on Josh Harris! And-1! Miles Middleton to the line for 1. [Team fouls: 1] (Josh Harris: 1 personal fouls)   FT 1/1: GOOD Miles Middleton makes 1/1 from the line.
Score: 35-28

[11:06] Team_047 possession (Score: 35-28)
Myles LaVine drives to the basket... Myles LaVine throws a bad pass out of bounds! TURNOVER! (dead ball)

[11:06] Substitution (Team_057): Kobe Ming OUT → Scottie Johnson IN (stamina_rule2)

[11:06] Substitution (Team_057): Klay Rozier OUT → Bradley Ginobili IN (stamina_rule2)

[11:06] Substitution (Team_057): Anfernee Adebayo OUT → Joel Wade IN (stamina_rule2)

[11:06] Substitution (Team_057): Ben Adebayo OUT → Lamelo Irving IN (stamina_rule2)

[11:06] Substitution (Team_057): Miles Middleton OUT → Zion Lillard IN (stamina_rule2)

[11:06] Substitution (Team_047): De'Aaron Rose OUT → Austin Giddey IN (stamina_rule2)

[11:06] Substitution (Team_047): Derrick Irving OUT → Donovan Iverson IN (stamina_rule2)

[11:06] Substitution (Team_047): Blake Jokic OUT → Blake Jackson IN (stamina_rule2)

[11:06] Substitution (Team_047): Josh Harris OUT → Tony Poole IN (stamina_rule2)

[11:06] Substitution (Team_047): Myles LaVine OUT → Zion Thompson IN (stamina_rule2)

[10:54] Team_057 possession (Score: 35-28)
Zion Lillard drives and kicks out. Lamelo Irving attempts a 3Pt. Contested by Tony Poole (5.0 feet, MAN). LAMELO IRVING MAKES IT! Assist: Scottie Johnson
Score: 38-28

[10:39] Team_047 possession (Score: 38-28)
Donovan Iverson attempts a 3Pt. Contested by Bradley Ginobili (5.1 feet, MAN). Donovan Iverson misses. Rebound secured by Zion Lillard.

[10:26] Team_057 possession (Score: 38-28)
Lamelo Irving attempts a 3Pt. Contested by Donovan Iverson (5.0 feet, ZONE). Lamelo Irving misses. Rebound secured by Donovan Iverson.

[10:11] Team_047 possession (Score: 38-28)
Zion Thompson drives, Lamelo Irving stays with him. Zion Thompson attempts a Dunk. Contested by Lamelo Irving (4.7 feet, ZONE). Zion Thompson misses. Rebound secured by Lamelo Irving.

[09:56] Team_057 possession (Score: 38-28)
Joel Wade attempts a 3Pt. Contested by Donovan Iverson (4.1 feet, ZONE). Joel Wade misses. Rebound secured by Donovan Iverson.

[09:43] Team_047 possession (Score: 38-28)
Tony Poole attempts a Midrange. Contested by Joel Wade (6.0 feet, ZONE). Tony Poole misses. Rebound secured by Lamelo Irving.

[09:28] Team_057 possession (Score: 38-28)
Zion Lillard attempts a Midrange. Contested by Zion Thompson (5.6 feet, MAN). Zion Lillard misses. Rebound secured by Donovan Iverson.

[09:19] Team_047 possession (Score: 38-28)
Zion Thompson attempts a Layup. BLOCKED BY ZION LILLARD! Ball is loose! Rebound secured by Lamelo Irving.

[09:03] Team_057 possession (Score: 38-28)
Bradley Ginobili attempts a 3Pt. Contested by Donovan Iverson (4.6 feet, MAN). Bradley Ginobili misses. Rebound secured by Zion Thompson.

[08:45] Team_047 possession (Score: 38-28)
Tony Poole attempts a 3Pt. Contested by Scottie Johnson (5.4 feet, ZONE). Tony Poole misses. Offensive rebound by Zion Thompson! Zion Thompson kicks it out.

[08:35] Team_047 possession (Score: 38-28)
Donovan Iverson attempts a Midrange. Contested by Bradley Ginobili (5.1 feet, ZONE). Donovan Iverson misses. Rebound secured by Zion Lillard.

[08:20] Team_057 possession (Score: 38-28)
Scottie Johnson attempts a Layup. Contested by Zion Thompson (5.5 feet, ZONE). SCOTTIE JOHNSON MAKES IT! Assist: Joel Wade
Score: 40-28

[08:08] Team_047 possession (Score: 40-28)
Donovan Iverson drives, Lamelo Irving stays with him. Donovan Iverson attempts a Dunk. Contested by Lamelo Irving (5.0 feet, ZONE). DONOVAN IVERSON MAKES IT! Assist: Zion Thompson
Score: 40-30

[07:52] Team_057 possession (Score: 40-30)
Lamelo Irving attempts a Layup. Contested by Tony Poole (5.7 feet, MAN). LAMELO IRVING MAKES IT! Assist: Scottie Johnson
Score: 42-30

[07:38] Team_047 possession (Score: 42-30)
Donovan Iverson attempts a 3Pt. Contested by Bradley Ginobili (5.1 feet, MAN). Donovan Iverson misses. Rebound secured by Joel Wade.

[07:25] Team_057 possession (Score: 42-30)
Scottie Johnson makes the Dunk and draws the foul on Donovan Iverson! And-1! Scottie Johnson to the line for 1. [Team fouls: 2] (Donovan Iverson: 1 personal fouls)   FT 1/1: MISS Scottie Johnson makes 0/1 from the line. Rebound secured by Donovan Iverson.
Score: 44-30

[07:11] Team_047 possession (Score: 44-30)
Tony Poole drives and kicks out. Austin Giddey attempts a 3Pt. Contested by Scottie Johnson (4.8 feet, MAN). Austin Giddey misses. Rebound secured by Zion Lillard.

[06:56] Team_057 possession (Score: 44-30)
FOUL! Shooting foul on Blake Jackson. Bradley Ginobili to the line for 2 free throws. [Team fouls: 3] (Blake Jackson: 1 personal fouls)   FT 1/2: MISS   FT 2/2: GOOD Bradley Ginobili makes 1/2 from the line.
Score: 45-30

[06:44] Team_047 possession (Score: 45-30)
Zion Thompson attempts a Midrange. Contested by Zion Lillard (3.5 feet, MAN). Zion Thompson misses. Rebound secured by Joel Wade.

[06:35] Team_057 possession (Score: 45-30)
Bradley Ginobili attempts a Midrange. Contested by Donovan Iverson (4.6 feet, ZONE). Bradley Ginobili misses. Rebound secured by Zion Thompson.

[06:19] Team_047 possession (Score: 45-30)
Tony Poole makes the Dunk and draws the foul on Lamelo Irving! And-1! Tony Poole to the line for 1. [Team fouls: 1] (Lamelo Irving: 1 personal fouls)   FT 1/1: GOOD Tony Poole makes 1/1 from the line.
Score: 45-33

[06:09] Team_057 possession (Score: 45-33)
Joel Wade attempts a 3Pt. Contested by Blake Jackson (4.2 feet, MAN). Joel Wade misses. Rebound secured by Blake Jackson.

[05:56] Team_047 possession (Score: 45-33)
Blake Jackson attempts a Layup. Contested by Lamelo Irving (4.5 feet, ZONE). BLAKE JACKSON MAKES IT!
Score: 45-35

[05:41] Team_057 possession (Score: 45-35)
Joel Wade attempts a 3Pt. Contested by Donovan Iverson (4.1 feet, ZONE). Joel Wade misses. Rebound secured by Donovan Iverson.

[05:28] Team_047 possession (Score: 45-35)
Austin Giddey drives and kicks out. Austin Giddey attempts a Midrange. Contested by Joel Wade (5.4 feet, ZONE). AUSTIN GIDDEY MAKES IT!
Score: 45-37

[05:15] Team_057 possession (Score: 45-37)
Scottie Johnson drives to the basket... Scottie Johnson loses the ball! Stripped by Zion Thompson! TURNOVER! (live ball)

[05:05] Team_047 possession (Score: 45-37)
Austin Giddey attempts a 3Pt. Contested by Scottie Johnson (5.4 feet, MAN). Austin Giddey misses. Rebound secured by Zion Lillard.

[04:48] Team_057 possession (Score: 45-37)
Bradley Ginobili attempts a 3Pt. Contested by Donovan Iverson (4.6 feet, ZONE). Bradley Ginobili misses. Rebound secured by Zion Thompson.

[04:37] Team_047 possession (Score: 45-37)
Blake Jackson attempts a 3Pt. Contested by Joel Wade (5.1 feet, MAN). Blake Jackson misses. Rebound secured by Zion Lillard.

[04:22] Team_057 possession (Score: 45-37)
Bradley Ginobili attempts a Layup. Contested by Zion Thompson (5.7 feet, ZONE). BRADLEY GINOBILI MAKES IT!
Score: 47-37

[04:11] Team_047 possession (Score: 47-37)
Donovan Iverson throws a bad pass! Stolen by Bradley Ginobili! TURNOVER! (live ball)

[04:01] Team_057 possession (Score: 47-37)
Bradley Ginobili attempts a 3Pt. Contested by Donovan Iverson (4.6 feet, ZONE). BRADLEY GINOBILI MAKES IT! Assist: Joel Wade
Score: 50-37

[03:46] Team_047 possession (Score: 50-37)
FOUL! Reach-in foul on Joel Wade during the drive. [Team fouls: 2] No free throws, side out. (Joel Wade: 1 personal fouls)

[03:29] Team_047 possession (Score: 50-37)
Tony Poole attempts a 3Pt. Contested by Lamelo Irving (5.6 feet, MAN). Tony Poole misses. Offensive rebound by Zion Thompson! Zion Thompson kicks it out.

[03:14] Team_047 possession (Score: 50-37)
Zion Thompson attempts a Layup. Contested by Lamelo Irving (4.9 feet, ZONE). ZION THOMPSON MAKES IT! Assist: Austin Giddey
Score: 50-39

[03:01] Team_057 possession (Score: 50-39)
Joel Wade throws a bad pass! Stolen by Blake Jackson! TURNOVER! (live ball)

[02:49] Team_047 possession (Score: 50-39)
FOUL! Reach-in foul on Zion Lillard during the drive. [Team fouls: 3] No free throws, side out. (Zion Lillard: 1 personal fouls)

[02:37] Team_047 possession (Score: 50-39)
FOUL! Reach-in foul on Zion Lillard during the drive. [Team fouls: 4] No free throws, side out. (Zion Lillard: 2 personal fouls)

[02:23] Team_047 possession (Score: 50-39)
Blake Jackson attempts a 3Pt. Contested by Scottie Johnson (4.8 feet, ZONE). Blake Jackson misses. Rebound secured by Lamelo Irving.

[02:11] Team_057 possession (Score: 50-39)
Zion Lillard drives, Zion Thompson stays with him. Zion Lillard attempts a Layup. Contested by Zion Thompson (5.8 feet, ZONE). Zion Lillard misses. Rebound secured by Zion Thompson.

[01:53] Team_047 possession (Score: 50-39)
Donovan Iverson attempts a 3Pt. Contested by Bradley Ginobili (5.3 feet, MAN). Donovan Iverson misses. Rebound secured by Joel Wade.

[01:39] Team_057 possession (Score: 50-39)
Scottie Johnson drives, Austin Giddey stays with him. Scottie Johnson attempts a Dunk. Contested by Austin Giddey (5.3 feet, MAN). Scottie Johnson misses. Rebound secured by Blake Jackson.

[01:27] Team_047 possession (Score: 50-39)
Tony Poole makes the Layup and draws the foul on Lamelo Irving! And-1! Tony Poole to the line for 1. [BONUS: 5 team fouls] (Lamelo Irving: 2 personal fouls)   FT 1/1: GOOD Tony Poole makes 1/1 from the line.
Score: 50-42

[01:11] Team_057 possession (Score: 50-42)
FOUL! Shooting foul on Zion Thompson. Zion Lillard to the line for 2 free throws. [Team fouls: 4] (Zion Thompson: 1 personal fouls)   FT 1/2: GOOD   FT 2/2: GOOD Zion Lillard makes 2/2 from the line.
Score: 52-42

[00:57] Team_047 possession (Score: 52-42)
FOUL! Offensive foul on Donovan Iverson! Bradley Ginobili drew the charge! [Team fouls: 5] (Donovan Iverson: 2 personal fouls) TURNOVER! (dead ball)

[00:44] Team_057 possession (Score: 52-42)
Bradley Ginobili attempts a Midrange. Contested by Donovan Iverson (4.9 feet, ZONE). Bradley Ginobili misses. Rebound secured by Zion Thompson.

[00:29] Team_047 possession (Score: 52-42)
Austin Giddey attempts a Layup. Contested by Scottie Johnson (5.8 feet, MAN). AUSTIN GIDDEY MAKES IT!
Score: 52-44

[00:14] Team_057 possession (Score: 52-44)
Bradley Ginobili attempts a 3Pt. Contested by Tony Poole (5.7 feet, ZONE). Bradley Ginobili misses. Rebound secured by Blake Jackson.

[00:03] Team_047 possession (Score: 52-44)
Tony Poole attempts a Midrange. Contested by Lamelo Irving (5.9 feet, MAN). Tony Poole misses. Rebound secured by Lamelo Irving.

================================================================================
                              2ND QUARTER COMPLETE                              
================================================================================

2ND QUARTER SCORE: Team_057 20, Team_047 19

BOX SCORE:
================================================================================

Team_057
--------------------------------------------------------------------------------
Player                MIN  PTS  REB  AST  TO      FG   FG%      3P   3P%
--------------------------------------------------------------------------------
Bradley Ginobili       11    6    0    0   0   3/8    37.5     0/0   0.0
Lamelo Irving          11    5    5    0   0   2/3    66.7     0/0   0.0
Miles Middleton        13    3    0    0   0   1/1   100.0     0/0   0.0
Scottie Johnson        11    2    0    2   0   1/3    33.3     0/0   0.0
Zion Lillard           11    2    5    0   0   1/3    33.3     0/0   0.0
Ben Adebayo            13    0    0    0   0   0/1     0.0     0/0   0.0
Joel Wade              11    0    3    2   0   0/3     0.0     0/0   0.0

TEAM: FG: 8/22 (36.4%), 3PT: 1/8 (12.5%), REB: 13 (0 off, 13 def), AST: 4, TO: 2
TEAM FOULS: 5 [Team_047 in BONUS]


Team_047
--------------------------------------------------------------------------------
Player                MIN  PTS  REB  AST  TO      FG   FG%      3P   3P%
--------------------------------------------------------------------------------
Tony Poole             11    6    0    0   0   2/5    40.0     0/0   0.0
Austin Giddey          11    4    0    1   0   2/3    66.7     0/0   0.0
Blake Jokic            13    3    0    0   0   1/1   100.0     0/0   0.0
Donovan Iverson        11    2    5    0   0   1/5    20.0     0/0   0.0
Zion Thompson          11    2    7    1   0   1/4    25.0     0/0   0.0
Blake Jackson          11    2    3    0   0   1/3    33.3     0/0   0.0
Myles LaVine           13    0    1    1   0   0/0     0.0     0/0   0.0

TEAM: FG: 8/21 (38.1%), 3PT: 1/7 (14.3%), REB: 16 (2 off, 14 def), AST: 3, TO: 3
TEAM FOULS: 5 [Team_057 in BONUS]

================================================================================

================================================================================
                       3RD QUARTER - Team_057 vs Team_047                       
================================================================================

[12:00] Team_057 possession (Score: 52-44)
Kobe Ming attempts a Midrange. Contested by De'Aaron Rose (4.3 feet, MAN). Kobe Ming misses. Rebound secured by Myles LaVine.

[11:47] Team_047 possession (Score: 52-44)
Derrick Irving drives to the basket... Derrick Irving throws a bad pass out of bounds! TURNOVER! (dead ball)

[11:31] Team_057 possession (Score: 52-44)
Miles Middleton drives to the basket... Miles Middleton loses the ball! Stripped by Myles LaVine! TURNOVER! (live ball)

[11:15] Team_047 possession (Score: 52-44)
FOUL! Offensive foul on De'Aaron Rose! Kobe Ming drew the charge! [Team fouls: 1] (De'Aaron Rose: 1 personal fouls) TURNOVER! (dead ball)

[11:04] Team_057 possession (Score: 52-44)
Klay Rozier attempts a 3Pt. Contested by De'Aaron Rose (4.1 feet, ZONE). Klay Rozier misses. FOUL! Loose ball foul on Derrick Irving during the rebound battle. [Team fouls: 2] No free throws, side out. (Derrick Irving: 1 personal fouls)

[10:47] Team_057 possession (Score: 52-44)
Kobe Ming attempts a 3Pt. Contested by De'Aaron Rose (4.3 feet, ZONE). KOBE MING MAKES IT! Assist: Miles Middleton
Score: 55-44

[10:28] Team_047 possession (Score: 55-44)
Derrick Irving attempts a 3Pt. Contested by Klay Rozier (4.0 feet, MAN). DERRICK IRVING MAKES IT! Assist: Blake Jokic
Score: 55-47

[10:12] Team_057 possession (Score: 55-47)
Miles Middleton attempts a Layup. Contested by Myles LaVine (5.1 feet, MAN). MILES MIDDLETON MAKES IT! Assist: Ben Adebayo
Score: 57-47

[09:59] Team_047 possession (Score: 57-47)
Derrick Irving drives, Klay Rozier stays with him. Derrick Irving attempts a Layup. Contested by Klay Rozier (4.0 feet, MAN). Derrick Irving misses. Rebound secured by Ben Adebayo.

[09:44] Team_057 possession (Score: 57-47)
Klay Rozier attempts a 3Pt. Contested by De'Aaron Rose (4.1 feet, ZONE). Klay Rozier misses. Offensive rebound by Ben Adebayo! Ben Adebayo kicks it out.

[09:27] Team_057 possession (Score: 57-47)
FOUL! Shooting foul on Josh Harris. Ben Adebayo to the line for 3 free throws. [Team fouls: 3] (Josh Harris: 1 personal fouls)   FT 1/3: MISS   FT 2/3: GOOD   FT 3/3: GOOD Ben Adebayo makes 2/3 from the line.
Score: 59-47

[09:13] Team_047 possession (Score: 59-47)
Derrick Irving attempts a 3Pt. Contested by Kobe Ming (4.8 feet, ZONE). DERRICK IRVING MAKES IT! Assist: Blake Jokic
Score: 59-50

[09:04] Team_057 possession (Score: 59-50)
Ben Adebayo attempts a 3Pt. Contested by De'Aaron Rose (4.5 feet, ZONE). Ben Adebayo misses. Rebound secured by Myles LaVine.

[08:47] Team_047 possession (Score: 59-50)
Blake Jokic attempts a 3Pt. Contested by Anfernee Adebayo (4.7 feet, MAN). BLAKE JOKIC MAKES IT!
Score: 59-53

[08:28] Team_057 possession (Score: 59-53)
Miles Middleton drives to the basket... Miles Middleton throws a bad pass out of bounds! TURNOVER! (dead ball)

[08:14] Team_047 possession (Score: 59-53)
De'Aaron Rose drives to the basket... De'Aaron Rose throws a bad pass! Stolen by Kobe Ming! TURNOVER! (live ball)

[07:59] Team_057 possession (Score: 59-53)
Miles Middleton drives to the basket... Miles Middleton loses control! Ball rolls out of bounds! TURNOVER! (dead ball)

[07:41] Team_047 possession (Score: 59-53)
FOUL! Reach-in foul on Miles Middleton during the drive. [Team fouls: 1] No free throws, side out. (Miles Middleton: 1 personal fouls)

[07:23] Team_047 possession (Score: 59-53)
Josh Harris attempts a Layup. Contested by Ben Adebayo (4.7 feet, ZONE). JOSH HARRIS MAKES IT! Assist: De'Aaron Rose
Score: 59-55

[07:06] Team_057 possession (Score: 59-55)
FOUL! Reach-in foul on De'Aaron Rose during the drive. [Team fouls: 4] No free throws, side out. (De'Aaron Rose: 2 personal fouls)

[06:52] Team_057 possession (Score: 59-55)
Klay Rozier attempts a Midrange. Contested by Blake Jokic (5.0 feet, ZONE). Klay Rozier misses. Offensive rebound by Miles Middleton! Miles Middleton kicks it out.

[06:34] Team_057 possession (Score: 59-55)
FOUL! Holding foul on Josh Harris. [IN THE BONUS! 5 team fouls] Ben Adebayo to the line for 2 free throws. (Josh Harris: 2 personal fouls)   FT 1/2: GOOD   FT 2/2: GOOD Ben Adebayo makes 2/2 from the line.
Score: 61-55

[06:15] Team_047 possession (Score: 61-55)
Josh Harris attempts a Midrange. Contested by Ben Adebayo (4.7 feet, MAN). Josh Harris misses. FOUL! Loose ball foul on Ben Adebayo during the rebound battle. [Team fouls: 2] No free throws, side out. (Ben Adebayo: 1 personal fouls)

[06:03] Team_047 possession (Score: 61-55)
Josh Harris attempts a 3Pt. Contested by Ben Adebayo (4.7 feet, MAN). Josh Harris misses. Offensive rebound by Josh Harris! Josh Harris kicks it out.

[05:46] Team_047 possession (Score: 61-55)
Myles LaVine drives and kicks out. FOUL! Shooting foul on Anfernee Adebayo. Myles LaVine to the line for 2 free throws. [Team fouls: 3] (Anfernee Adebayo: 1 personal fouls)   FT 1/2: GOOD   FT 2/2: GOOD Myles LaVine makes 2/2 from the line.
Score: 61-57

[05:33] Team_057 possession (Score: 61-57)
Miles Middleton attempts a Layup. Contested by Josh Harris (4.0 feet, ZONE). MILES MIDDLETON MAKES IT!
Score: 63-57

[05:17] Team_047 possession (Score: 63-57)
Blake Jokic makes the Layup and draws the foul on Ben Adebayo! And-1! Blake Jokic to the line for 1. [Team fouls: 4] (Ben Adebayo: 2 personal fouls)   FT 1/1: GOOD Blake Jokic makes 1/1 from the line.
Score: 63-60

[04:59] Team_057 possession (Score: 63-60)
Ben Adebayo drives and kicks out. Kobe Ming attempts a Midrange. Contested by De'Aaron Rose (4.0 feet, MAN). Kobe Ming misses. Rebound secured by Josh Harris.

[04:44] Team_047 possession (Score: 63-60)
Myles LaVine attempts a Midrange. Contested by Miles Middleton (4.6 feet, MAN). Myles LaVine misses. Offensive rebound by Myles LaVine! Myles LaVine kicks it out.

[04:30] Team_047 possession (Score: 63-60)
De'Aaron Rose makes the Layup and draws the foul on Ben Adebayo! And-1! De'Aaron Rose to the line for 1. [BONUS: 5 team fouls] (Ben Adebayo: 3 personal fouls)   FT 1/1: GOOD De'Aaron Rose makes 1/1 from the line.
Score: 63-63

[04:19] Team_057 possession (Score: 63-63)
Kobe Ming attempts a Layup. Contested by Josh Harris (4.5 feet, ZONE). KOBE MING MAKES IT! Assist: Ben Adebayo
Score: 65-63

[04:05] Team_047 possession (Score: 65-63)
Josh Harris makes the Layup and draws the foul on Ben Adebayo! And-1! Josh Harris to the line for 1. [BONUS: 6 team fouls] (Ben Adebayo: 4 personal fouls)   FT 1/1: GOOD Josh Harris makes 1/1 from the line.
Score: 65-66

[03:46] Team_057 possession (Score: 65-66)
Ben Adebayo attempts a Layup. Contested by Josh Harris (4.8 feet, ZONE). Ben Adebayo misses. Rebound secured by Derrick Irving.

[03:37] Team_047 possession (Score: 65-66)
Blake Jokic attempts a 3Pt. Contested by Anfernee Adebayo (4.8 feet, MAN). Blake Jokic misses. Rebound secured by Anfernee Adebayo.

[03:23] Team_057 possession (Score: 65-66)
Klay Rozier drives, picks up Derrick Irving. Help arrives from Blake Jokic! Klay Rozier attempts a Dunk. Contested by Blake Jokic (5.1 feet, MAN). KLAY ROZIER MAKES IT!
Score: 67-66

[03:07] Team_047 possession (Score: 67-66)
De'Aaron Rose drives to the basket... De'Aaron Rose throws a bad pass! Stolen by Ben Adebayo! TURNOVER! (live ball)

[02:52] Team_057 possession (Score: 67-66)
FOUL! Offensive foul on Miles Middleton! Myles LaVine drew the charge! [Team fouls: 7] (Miles Middleton: 2 personal fouls) TURNOVER! (dead ball)

[02:38] Team_047 possession (Score: 67-66)
Derrick Irving drives, Klay Rozier stays with him. Derrick Irving attempts a Dunk. Contested by Klay Rozier (4.2 feet, MAN). DERRICK IRVING MAKES IT! Assist: Blake Jokic
Score: 67-68

[02:27] Team_057 possession (Score: 67-68)
Kobe Ming attempts a Layup. Contested by De'Aaron Rose (4.5 feet, MAN). Kobe Ming misses. Rebound secured by Derrick Irving.

[02:11] Team_047 possession (Score: 67-68)
Derrick Irving attempts a 3Pt. Contested by Klay Rozier (4.2 feet, MAN). Derrick Irving misses. Rebound secured by Ben Adebayo.

[01:54] Team_057 possession (Score: 67-68)
Anfernee Adebayo attempts a Midrange. Contested by Blake Jokic (5.4 feet, MAN). Anfernee Adebayo misses. Rebound secured by Derrick Irving.

[01:39] Team_047 possession (Score: 67-68)
Myles LaVine drives and kicks out. Josh Harris attempts a 3Pt. Contested by Kobe Ming (4.7 feet, ZONE). Josh Harris misses. Rebound secured by Miles Middleton.

[01:22] Team_057 possession (Score: 67-68)
FOUL! Reach-in foul on Josh Harris during the drive. [IN THE BONUS! 6 team fouls] Ben Adebayo to the line for 2 free throws. (Josh Harris: 3 personal fouls)   FT 1/2: MISS   FT 2/2: GOOD Ben Adebayo makes 1/2 from the line.
Score: 68-68

[01:08] Team_047 possession (Score: 68-68)
Derrick Irving attempts a 3Pt. Contested by Klay Rozier (4.3 feet, MAN). Derrick Irving misses. Offensive rebound by Myles LaVine! Myles LaVine kicks it out.

[00:52] Team_047 possession (Score: 68-68)
FOUL! Reach-in foul on Kobe Ming during the drive. [IN THE BONUS! 8 team fouls] De'Aaron Rose to the line for 2 free throws. (Kobe Ming: 1 personal fouls)   FT 1/2: GOOD   FT 2/2: MISS De'Aaron Rose makes 1/2 from the line. Rebound secured by Anfernee Adebayo.
Score: 68-69

[00:37] Team_057 possession (Score: 68-69)
Klay Rozier attempts a Layup. BLOCKED BY DERRICK IRVING! Ball deflects out of bounds off Klay Rozier.

[00:23] Team_047 possession (Score: 68-69)
Josh Harris drives and kicks out. Myles LaVine attempts a Midrange. Contested by Anfernee Adebayo (5.3 feet, ZONE). Myles LaVine misses. Rebound secured by Anfernee Adebayo.

[00:07] Team_057 possession (Score: 68-69)
Ben Adebayo makes the Layup and draws the foul on Josh Harris! And-1! Ben Adebayo to the line for 1. [BONUS: 7 team fouls] (Josh Harris: 4 personal fouls)   FT 1/1: GOOD Ben Adebayo makes 1/1 from the line.
Score: 71-69

================================================================================
                              3RD QUARTER COMPLETE                              
================================================================================

3RD QUARTER SCORE: Team_057 19, Team_047 25

BOX SCORE:
================================================================================

Team_057
--------------------------------------------------------------------------------
Player                MIN  PTS  REB  AST  TO      FG   FG%      3P   3P%
--------------------------------------------------------------------------------
Ben Adebayo            25    8    3    2   0   4/7    57.1     0/0   0.0
Kobe Ming              25    5    0    0   0   2/4    50.0     0/0   0.0
Miles Middleton        25    4    3    1   0   2/2   100.0     0/0   0.0
Klay Rozier            25    2    0    0   0   1/2    50.0     0/0   0.0
Anfernee Adebayo       25    0    3    0   0   0/1     0.0     0/0   0.0

TEAM: FG: 9/16 (56.2%), 3PT: 2/3 (66.7%), REB: 9 (3 off, 6 def), AST: 3, TO: 4
TEAM FOULS: 8 [Team_047 in BONUS]


Team_047
--------------------------------------------------------------------------------
Player                MIN  PTS  REB  AST  TO      FG   FG%      3P   3P%
--------------------------------------------------------------------------------
Derrick Irving         25    8    3    0   0   3/5    60.0     0/0   0.0
Blake Jokic            25    6    0    3   0   2/3    66.7     0/0   0.0
Josh Harris            25    5    2    0   0   2/3    66.7     0/0   0.0
De'Aaron Rose          25    3    0    1   0   1/2    50.0     0/0   0.0
Myles LaVine           25    2    5    0   0   1/2    50.0     0/0   0.0

TEAM: FG: 9/15 (60.0%), 3PT: 3/5 (60.0%), REB: 10 (4 off, 6 def), AST: 4, TO: 4
TEAM FOULS: 7 [Team_057 in BONUS]

================================================================================

================================================================================
                       4TH QUARTER - Team_057 vs Team_047                       
================================================================================

[12:00] Team_057 possession (Score: 71-69)
Miles Middleton drives and kicks out. Anfernee Adebayo attempts a 3Pt. Contested by De'Aaron Rose (4.2 feet, ZONE). ANFERNEE ADEBAYO MAKES IT! Assist: Kobe Ming
Score: 74-69

[11:42] Team_047 possession (Score: 74-69)
De'Aaron Rose attempts a Layup. Contested by Ben Adebayo (5.0 feet, ZONE). DE'AARON ROSE MAKES IT! Assist: Myles LaVine
Score: 74-71

[11:32] Team_057 possession (Score: 74-71)
Ben Adebayo makes the Dunk and draws the foul on Myles LaVine! And-1! Ben Adebayo to the line for 1. [Team fouls: 1] (Myles LaVine: 1 personal fouls)   FT 1/1: GOOD Ben Adebayo makes 1/1 from the line.
Score: 77-71

[11:18] Team_047 possession (Score: 77-71)
Myles LaVine makes the Dunk and draws the foul on Ben Adebayo! And-1! Myles LaVine to the line for 1. [Team fouls: 1] (Ben Adebayo: 1 personal fouls)   FT 1/1: GOOD Myles LaVine makes 1/1 from the line.
Score: 77-74

[11:03] Team_057 possession (Score: 77-74)
Klay Rozier attempts a 3Pt. Contested by Derrick Irving (5.3 feet, MAN). Klay Rozier misses. Rebound secured by Myles LaVine.

[10:50] Team_047 possession (Score: 77-74)
Blake Jokic drives, picks up Anfernee Adebayo. Help arrives from Klay Rozier! Blake Jokic attempts a Layup. Contested by Klay Rozier (5.1 feet, MAN). BLAKE JOKIC MAKES IT!
Score: 77-76

[10:38] Team_057 possession (Score: 77-76)
Ben Adebayo attempts a Layup. Contested by Josh Harris (5.1 feet, ZONE). Ben Adebayo misses. Offensive rebound by Ben Adebayo! Ben Adebayo kicks it out.

[10:21] Team_057 possession (Score: 77-76)
Klay Rozier throws a bad pass! Stolen by Derrick Irving! TURNOVER! (live ball)

[10:04] Team_047 possession (Score: 77-76)
Blake Jokic drives and kicks out. De'Aaron Rose attempts a Midrange. Contested by Kobe Ming (4.9 feet, MAN). De'Aaron Rose misses. Rebound secured by Miles Middleton.

[09:48] Team_057 possession (Score: 77-76)
Anfernee Adebayo attempts a 3Pt. Contested by De'Aaron Rose (4.9 feet, ZONE). Anfernee Adebayo misses. Rebound secured by Derrick Irving.

[09:34] Team_047 possession (Score: 77-76)
Derrick Irving drives, Ben Adebayo stays with him. Derrick Irving attempts a Layup. Contested by Ben Adebayo (5.3 feet, ZONE). DERRICK IRVING MAKES IT!
Score: 77-78

[09:17] Team_057 possession (Score: 77-78)
Klay Rozier attempts a 3Pt. Contested by De'Aaron Rose (4.6 feet, ZONE). Klay Rozier misses. Rebound secured by Myles LaVine.

[09:04] Team_047 possession (Score: 77-78)
Derrick Irving drives, picks up Klay Rozier. Help arrives from Anfernee Adebayo! Derrick Irving attempts a Layup. Contested by Anfernee Adebayo (4.6 feet, MAN). Derrick Irving misses. Offensive rebound by Josh Harris! Josh Harris kicks it out.

[08:52] Team_047 possession (Score: 77-78)
Derrick Irving drives and kicks out. Blake Jokic attempts a 3Pt. Contested by Kobe Ming (5.1 feet, ZONE). Blake Jokic misses. Rebound secured by Ben Adebayo.

[08:37] Team_057 possession (Score: 77-78)
FOUL! Shooting foul on Josh Harris. Ben Adebayo to the line for 2 free throws. [Team fouls: 2] (Josh Harris: 1 personal fouls)   FT 1/2: GOOD   FT 2/2: MISS Ben Adebayo makes 1/2 from the line. Rebound secured by Josh Harris.
Score: 78-78

[08:27] Team_047 possession (Score: 78-78)
Myles LaVine attempts a 3Pt. Contested by Kobe Ming (5.2 feet, ZONE). MYLES LAVINE MAKES IT! Assist: De'Aaron Rose
Score: 78-81

[08:13] Team_057 possession (Score: 78-81)
Anfernee Adebayo attempts a Layup. Contested by Blake Jokic (5.7 feet, MAN). ANFERNEE ADEBAYO MAKES IT! Assist: Kobe Ming
Score: 80-81

[08:00] Team_047 possession (Score: 80-81)
Myles LaVine drives, Miles Middleton stays with him. Myles LaVine attempts a Dunk. Contested by Miles Middleton (5.3 feet, MAN). MYLES LAVINE MAKES IT! Assist: De'Aaron Rose
Score: 80-83

[07:48] Team_057 possession (Score: 80-83)
Anfernee Adebayo attempts a Midrange. Contested by Blake Jokic (5.7 feet, MAN). ANFERNEE ADEBAYO MAKES IT!
Score: 82-83

[07:32] Team_047 possession (Score: 82-83)
Derrick Irving attempts a Layup. BLOCKED BY KLAY ROZIER! Ball is loose! Rebound secured by Miles Middleton.

[07:20] Team_057 possession (Score: 82-83)
Anfernee Adebayo attempts a Layup. Contested by Blake Jokic (5.8 feet, MAN). Anfernee Adebayo misses. Offensive rebound by Miles Middleton! Miles Middleton kicks it out.

[07:06] Team_057 possession (Score: 82-83)
Miles Middleton attempts a Midrange. Contested by Blake Jokic (5.3 feet, ZONE). MILES MIDDLETON MAKES IT! Assist: Kobe Ming
Score: 84-83

[06:48] Team_047 possession (Score: 84-83)
De'Aaron Rose drives, Kobe Ming stays with him. De'Aaron Rose attempts a Layup. Contested by Kobe Ming (5.5 feet, MAN). De'Aaron Rose misses. Rebound secured by Ben Adebayo.

[06:38] Team_057 possession (Score: 84-83)
Kobe Ming attempts a 3Pt. Contested by De'Aaron Rose (5.1 feet, MAN). Kobe Ming misses. Offensive rebound by Ben Adebayo! Ben Adebayo kicks it out.

[06:20] Team_057 possession (Score: 84-83)
FOUL! Holding foul on Josh Harris. [Team fouls: 3] No free throws, side out. (Josh Harris: 2 personal fouls)

[06:02] Team_057 possession (Score: 84-83)
Anfernee Adebayo attempts a 3Pt. Contested by De'Aaron Rose (5.3 feet, ZONE). Anfernee Adebayo misses. Rebound secured by Josh Harris.

[05:48] Team_047 possession (Score: 84-83)
FOUL! Shooting foul on Ben Adebayo. Josh Harris to the line for 2 free throws. [Team fouls: 2] (Ben Adebayo: 2 personal fouls)   FT 1/2: GOOD   FT 2/2: MISS Josh Harris makes 1/2 from the line. Rebound secured by Miles Middleton.
Score: 84-84

[05:32] Team_057 possession (Score: 84-84)
FOUL! Reach-in foul on Josh Harris during the drive. [Team fouls: 4] No free throws, side out. (Josh Harris: 3 personal fouls)

[05:17] Team_057 possession (Score: 84-84)
Miles Middleton attempts a 3Pt. Contested by De'Aaron Rose (4.9 feet, ZONE). Miles Middleton misses. Offensive rebound by Ben Adebayo! Ben Adebayo kicks it out.

[05:03] Team_057 possession (Score: 84-84)
Kobe Ming drives, picks up Josh Harris. Help arrives from Derrick Irving! Kobe Ming attempts a Layup. Contested by Derrick Irving (5.5 feet, ZONE). Kobe Ming misses. Rebound secured by Josh Harris.

[04:48] Team_047 possession (Score: 84-84)
Derrick Irving attempts a 3Pt. Contested by Klay Rozier (5.2 feet, MAN). Derrick Irving misses. Offensive rebound by Josh Harris! Josh Harris kicks it out.

[04:36] Team_047 possession (Score: 84-84)
Derrick Irving attempts a Layup. Contested by Klay Rozier (5.2 feet, MAN). Derrick Irving misses. Offensive rebound by Myles LaVine! Myles LaVine kicks it out.

[04:20] Team_047 possession (Score: 84-84)
Derrick Irving attempts a 3Pt. Contested by Kobe Ming (5.9 feet, ZONE). DERRICK IRVING MAKES IT!
Score: 84-87

[04:05] Team_057 possession (Score: 84-87)
Ben Adebayo attempts a 3Pt. Contested by Josh Harris (5.9 feet, MAN). Ben Adebayo misses. Rebound secured by Blake Jokic.

[03:52] Team_047 possession (Score: 84-87)
Derrick Irving loses control! Ball rolls out of bounds! TURNOVER! (dead ball)

[03:52] Substitution (Team_057): Kobe Ming OUT → Scottie Johnson IN (stamina_rule2)

[03:52] Substitution (Team_057): Klay Rozier OUT → Bradley Ginobili IN (stamina_rule2)

[03:52] Substitution (Team_057): Anfernee Adebayo OUT → Joel Wade IN (stamina_rule2)

[03:52] Substitution (Team_057): Ben Adebayo OUT → Lamelo Irving IN (stamina_rule2)

[03:52] Substitution (Team_057): Miles Middleton OUT → Zion Lillard IN (stamina_rule2)

[03:52] Substitution (Team_047): De'Aaron Rose OUT → Austin Giddey IN (stamina_rule2)

[03:52] Substitution (Team_047): Derrick Irving OUT → Donovan Iverson IN (stamina_rule2)

[03:52] Substitution (Team_047): Blake Jokic OUT → Blake Jackson IN (stamina_rule2)

[03:52] Substitution (Team_047): Josh Harris OUT → Tony Poole IN (stamina_rule2)

[03:52] Substitution (Team_047): Myles LaVine OUT → Zion Thompson IN (stamina_rule2)

[03:38] Team_057 possession (Score: 84-87)
Bradley Ginobili attempts a 3Pt. Contested by Donovan Iverson (4.6 feet, ZONE). Bradley Ginobili misses. Rebound secured by Zion Thompson.

[03:23] Team_047 possession (Score: 84-87)
Blake Jackson attempts a Layup. Contested by Joel Wade (5.1 feet, MAN). BLAKE JACKSON MAKES IT!
Score: 84-89

[03:08] Team_057 possession (Score: 84-89)
Joel Wade drives, Zion Thompson stays with him. Joel Wade attempts a Layup. Contested by Zion Thompson (5.2 feet, ZONE). Joel Wade misses. Rebound secured by Donovan Iverson.

[02:51] Team_047 possession (Score: 84-89)
Zion Thompson attempts a Layup. Contested by Lamelo Irving (4.7 feet, ZONE). Zion Thompson misses. Rebound secured by Lamelo Irving.

[02:36] Team_057 possession (Score: 84-89)
Scottie Johnson attempts a 3Pt. Contested by Donovan Iverson (4.5 feet, ZONE). Scottie Johnson misses. Rebound secured by Blake Jackson.

[02:22] Team_047 possession (Score: 84-89)
Tony Poole commits a violation (traveling/carry)! TURNOVER! (dead ball)

[02:10] Team_057 possession (Score: 84-89)
Joel Wade drives, picks up Blake Jackson. Help arrives from Donovan Iverson! Joel Wade attempts a Layup. Contested by Donovan Iverson (4.2 feet, MAN). JOEL WADE MAKES IT! Assist: Bradley Ginobili
Score: 86-89

[01:56] Team_047 possession (Score: 86-89)
Blake Jackson attempts a Midrange. Contested by Joel Wade (5.1 feet, ZONE). Blake Jackson misses. Rebound secured by Zion Lillard.

[01:40] Team_057 possession (Score: 86-89)
Zion Lillard attempts a 3Pt. Contested by Donovan Iverson (4.5 feet, ZONE). Zion Lillard misses. FOUL! Loose ball foul on Donovan Iverson during the rebound battle. [IN THE BONUS! 5 team fouls] Lamelo Irving to the line for 2 free throws. (Donovan Iverson: 1 personal fouls)   FT 1/2: GOOD   FT 2/2: MISS Lamelo Irving makes 1/2 from the line. Rebound secured by Blake Jackson.
Score: 87-89

[01:31] Team_047 possession (Score: 87-89)
Blake Jackson attempts a Midrange. Contested by Joel Wade (5.1 feet, MAN). Blake Jackson misses. Rebound secured by Joel Wade.

[01:13] Team_057 possession (Score: 87-89)
Scottie Johnson attempts a 3Pt. Contested by Austin Giddey (5.1 feet, MAN). Scottie Johnson misses. Offensive rebound by Zion Lillard! Zion Lillard's putback is no good. Rebound secured by Donovan Iverson.

[01:01] Team_047 possession (Score: 87-89)
Zion Thompson attempts a Midrange. Contested by Zion Lillard (3.5 feet, MAN). Zion Thompson misses. Rebound secured by Lamelo Irving.

[00:46] Team_057 possession (Score: 87-89)
Bradley Ginobili attempts a Layup. BLOCKED BY DONOVAN IVERSON! Ball deflects out of bounds off Bradley Ginobili.

[00:29] Team_047 possession (Score: 87-89)
Tony Poole attempts a Layup. Contested by Lamelo Irving (5.4 feet, ZONE). TONY POOLE MAKES IT! Assist: Zion Thompson
Score: 87-91

[00:16] Team_057 possession (Score: 87-91)
Scottie Johnson attempts a 3Pt. Contested by Austin Giddey (5.1 feet, MAN). Scottie Johnson misses. Rebound secured by Donovan Iverson.

================================================================================
                              4TH QUARTER COMPLETE                              
================================================================================

4TH QUARTER SCORE: Team_057 16, Team_047 22

BOX SCORE:
================================================================================

Team_057
--------------------------------------------------------------------------------
Player                MIN  PTS  REB  AST  TO      FG   FG%      3P   3P%
--------------------------------------------------------------------------------
Anfernee Adebayo       34    7    0    0   0   3/5    60.0     0/0   0.0
Ben Adebayo            34    3    5    0   0   1/3    33.3     0/0   0.0
Miles Middleton        34    2    4    0   0   1/1   100.0     0/0   0.0
Joel Wade              15    2    1    0   0   1/2    50.0     0/0   0.0
Kobe Ming              34    0    0    3   0   0/1     0.0     0/0   0.0
Klay Rozier            34    0    0    0   0   0/2     0.0     0/0   0.0
Bradley Ginobili       15    0    0    1   0   0/2     0.0     0/0   0.0
Lamelo Irving          15    0    2    0   0   0/0     0.0     0/0   0.0
Scottie Johnson        15    0    0    0   0   0/3     0.0     0/0   0.0
Zion Lillard           15    0    1    0   0   0/1     0.0     0/0   0.0

TEAM: FG: 6/20 (30.0%), 3PT: 0/10 (0.0%), REB: 15 (6 off, 9 def), AST: 4, TO: 1
TEAM FOULS: 2


Team_047
--------------------------------------------------------------------------------
Player                MIN  PTS  REB  AST  TO      FG   FG%      3P   3P%
--------------------------------------------------------------------------------
Myles LaVine           34    8    3    1   0   3/3   100.0     0/0   0.0
Derrick Irving         34    5    1    0   0   2/4    50.0     0/0   0.0
De'Aaron Rose          34    2    0    2   0   1/2    50.0     0/0   0.0
Blake Jokic            34    2    1    0   0   1/2    50.0     0/0   0.0
Blake Jackson          15    2    2    0   0   1/3    33.3     0/0   0.0
Tony Poole             15    2    0    0   0   1/1   100.0     0/0   0.0
Josh Harris            34    0    5    0   0   0/1     0.0     0/0   0.0
Zion Thompson          15    0    1    1   0   0/2     0.0     0/0   0.0
Donovan Iverson        15    0    3    0   0   0/0     0.0     0/0   0.0

TEAM: FG: 9/18 (50.0%), 3PT: 2/2 (100.0%), REB: 14 (3 off, 11 def), AST: 4, TO: 2
TEAM FOULS: 5 [Team_057 in BONUS]

================================================================================

================================================================================
                               FULL GAME COMPLETE                               
================================================================================

FINAL SCORE: Team_057 87, Team_047 91

SCORING BY QUARTER:
--------------------------------------------------------------------------------
Team                     Q1     Q2     Q3     Q4    FINAL
--------------------------------------------------------------------------------
Team_057                 32     20     19     16       87
Team_047                 25     19     25     22       91
--------------------------------------------------------------------------------

FULL GAME BOX SCORE:
================================================================================

Team_057
--------------------------------------------------------------------------------
Player                MIN  PTS  REB  AST  TO      FG   FG%      3P   3P%      FT STL BLK
--------------------------------------------------------------------------------
Kobe Ming              34   12    0    3   1   5/9    55.6   1/2    50.0   1/1     1   0
Klay Rozier            34   12    0    0   2   5/10   50.0   2/4    50.0   0/0     0   2
Anfernee Adebayo       34   11    9    3   0   4/8    50.0   0/3     0.0   4/4     0   0
Ben Adebayo            34   17   15    6   2   7/14   50.0   1/4    25.0  10/13    1   0
Miles Middleton        34   13   10    1   1   7/8    87.5   0/1     0.0   2/3     1   0
Scottie Johnson        15    2    0    2   0   1/6    16.7   0/3     0.0   0/1     0   0
Bradley Ginobili       15    6    0    1   1   3/10   30.0   1/5    20.0   1/2     1   0
Joel Wade              15    2    4    2   1   1/5    20.0   0/3     0.0   0/0     0   0
Lamelo Irving          15    5    7    0   0   1/2    50.0   0/1     0.0   1/2     0   0
Zion Lillard           15    2    6    0   0   2/5    40.0   0/1     0.0   2/2     0   1

TEAM: FG: 37/78 (47.4%), 3PT: 5/27 (18.5%), REB: 54 (16 off, 38 def), AST: 18, TO: 8


Team_047
--------------------------------------------------------------------------------
Player                MIN  PTS  REB  AST  TO      FG   FG%      3P   3P%      FT STL BLK
--------------------------------------------------------------------------------
De'Aaron Rose          34    7    0    4   3   3/7    42.9   0/0     0.0   3/5     0   0
Derrick Irving         34   19    4    0   2   7/13   53.8   4/7    57.1   3/4     1   1
Blake Jokic            34   17    1    3   0   6/9    66.7   4/5    80.0   2/3     0   0
Josh Harris            34   10   10    1   0   4/10   40.0   2/4    50.0   4/6     0   0
Myles LaVine           34   14   15    4   2   5/7    71.4   1/2    50.0   5/5     1   0
Austin Giddey          15    4    0    1   0   2/3    66.7   0/1     0.0   0/0     0   0
Donovan Iverson        15    2    8    0   2   1/5    20.0   0/3     0.0   0/0     0   1
Blake Jackson          15    4    5    0   0   2/6    33.3   0/2     0.0   0/0     1   0
Tony Poole             15    8    0    0   1   3/6    50.0   0/0     0.0   2/2     0   0
Zion Thompson          15    2    8    2   0   1/6    16.7   0/0     0.0   0/0     1   0

TEAM: FG: 36/74 (48.6%), 3PT: 11/24 (45.8%), REB: 48 (12 off, 36 def), AST: 15, TO: 10

================================================================================
