================================================================================
                        FULL GAME - Team_081 vs Team_012                        
================================================================================

================================================================================
                       1ST QUARTER - Team_081 vs Team_012                       
================================================================================

[12:00] Team_081 possession (Score: 0-0)
FOUL! Holding foul on Paolo Durant. [Team fouls: 1] No free throws, side out. (Paolo Durant: 1 personal fouls)

[11:46] Team_081 possession (Score: 0-0)
Bradley Sabonis drives, Paolo Durant stays with him. Bradley Sabonis attempts a Dunk. Contested by Paolo Durant (3.4 feet, MAN). BRADLEY SABONIS MAKES IT!
Score: 2-0

[11:34] Team_012 possession (Score: 2-0)
Ayo McGrady attempts a Layup. Contested by Franz Antetokounmpo (4.2 feet, MAN). AYO MCGRADY MAKES IT! Assist: Paolo Durant
Score: 2-2

[11:20] Team_081 possession (Score: 2-2)
Bradley Leonard attempts a 3Pt. Contested by RJ Nowitzki (3.6 feet, ZONE). Bradley Leonard misses. FOUL! Loose ball foul on RJ Nowitzki during the rebound battle. [Team fouls: 2] No free throws, side out. (RJ Nowitzki: 1 personal fouls)

[11:04] Team_081 possession (Score: 2-2)
Bradley Leonard drives to the basket... Bradley Leonard throws a bad pass! Stolen by Ayo McGrady! TURNOVER! (live ball)

[10:50] Team_012 possession (Score: 2-2)
Shaquille Booker drives, Franz Antetokounmpo stays with him. Shaquille Booker attempts a Dunk. Contested by Franz Antetokounmpo (4.2 feet, ZONE). Shaquille Booker misses. Rebound secured by Franz Antetokounmpo.

[10:31] Team_081 possession (Score: 2-2)
Vince Adebayo attempts a 3Pt. Contested by Shaquille Booker (4.0 feet, MAN). Vince Adebayo misses. Rebound secured by Ayo McGrady.

[10:20] Team_012 possession (Score: 2-2)
RJ Nowitzki attempts a Midrange. Contested by Bradley Leonard (4.0 feet, MAN). RJ NOWITZKI MAKES IT!
Score: 2-4

[10:06] Team_081 possession (Score: 2-4)
Franz Antetokounmpo drives to the basket... FOUL! Offensive foul on Franz Antetokounmpo! Paolo Durant drew the charge! [Team fouls: 1] (Franz Antetokounmpo: 1 personal fouls) TURNOVER! (dead ball)

[09:51] Team_012 possession (Score: 2-4)
Paolo Durant attempts a 3Pt. Contested by Vince Adebayo (3.5 feet, ZONE). PAOLO DURANT MAKES IT! Assist: Shaquille Booker
Score: 2-7

[09:37] Team_081 possession (Score: 2-7)
Franz Antetokounmpo attempts a Midrange. Contested by Ayo McGrady (4.4 feet, ZONE). FRANZ ANTETOKOUNMPO MAKES IT! Assist: Bradley Leonard
Score: 4-7

[09:22] Team_012 possession (Score: 4-7)
FOUL! Shooting foul on Julius Durant. Pascal Herro to the line for 2 free throws. [Team fouls: 2] (Julius Durant: 1 personal fouls)   FT 1/2: GOOD   FT 2/2: GOOD Pascal Herro makes 2/2 from the line.
Score: 4-9

[09:09] Team_081 possession (Score: 4-9)
Julius Durant attempts a 3Pt. Contested by RJ Nowitzki (3.5 feet, ZONE). JULIUS DURANT MAKES IT!
Score: 7-9

[08:52] Team_012 possession (Score: 7-9)
RJ Nowitzki drives, Bradley Leonard stays with him. RJ Nowitzki attempts a Dunk. Contested by Bradley Leonard (4.0 feet, MAN). RJ NOWITZKI MAKES IT! Assist: Shaquille Booker
Score: 7-11

[08:40] Team_081 possession (Score: 7-11)
Bradley Leonard drives, picks up RJ Nowitzki. Help arrives from Pascal Herro! Bradley Leonard attempts a Dunk. Contested by Pascal Herro (3.6 feet, MAN). Bradley Leonard misses. Rebound secured by Ayo McGrady.

[08:26] Team_012 possession (Score: 7-11)
RJ Nowitzki attempts a 3Pt. Contested by Vince Adebayo (3.7 feet, ZONE). RJ Nowitzki misses. Rebound secured by Franz Antetokounmpo.

[08:11] Team_081 possession (Score: 7-11)
Julius Durant attempts a 3Pt. Contested by Paolo Durant (3.6 feet, ZONE). Julius Durant misses. Rebound secured by RJ Nowitzki.

[07:58] Team_012 possession (Score: 7-11)
RJ Nowitzki attempts a 3Pt. Contested by Vince Adebayo (3.7 feet, ZONE). RJ Nowitzki misses. Offensive rebound by RJ Nowitzki! RJ Nowitzki kicks it out.

[07:39] Team_012 possession (Score: 7-11)
Ayo McGrady attempts a Layup. Contested by Bradley Sabonis (4.0 feet, ZONE). Ayo McGrady misses. Rebound secured by Bradley Sabonis.

[07:23] Team_081 possession (Score: 7-11)
Franz Antetokounmpo drives to the basket... Franz Antetokounmpo loses control! Ball rolls out of bounds! TURNOVER! (dead ball)

[07:11] Team_012 possession (Score: 7-11)
Ayo McGrady throws a bad pass! Stolen by Franz Antetokounmpo! TURNOVER! (live ball)

[06:59] Team_081 possession (Score: 7-11)
Julius Durant attempts a 3Pt. Contested by Pascal Herro (5.0 feet, MAN). Julius Durant misses. Rebound secured by RJ Nowitzki.

[06:45] Team_012 possession (Score: 7-11)
Shaquille Booker drives, Vince Adebayo stays with him. Shaquille Booker attempts a Layup. Contested by Vince Adebayo (3.4 feet, MAN). SHAQUILLE BOOKER MAKES IT! Assist: Ayo McGrady
Score: 7-13

[06:35] Team_081 possession (Score: 7-13)
Bradley Sabonis drives to the basket... Bradley Sabonis loses the ball! Stripped by Paolo Durant! TURNOVER! (live ball)

[06:17] Team_012 possession (Score: 7-13)
Pascal Herro makes the Midrange and draws the foul on Julius Durant! And-1! Pascal Herro to the line for 1. [Team fouls: 3] (Julius Durant: 2 personal fouls)   FT 1/1: GOOD Pascal Herro makes 1/1 from the line.
Score: 7-16

[06:04] Team_081 possession (Score: 7-16)
Bradley Sabonis drives and kicks out. Bradley Sabonis attempts a 3Pt. Contested by Paolo Durant (3.5 feet, MAN). Bradley Sabonis misses. Rebound secured by Ayo McGrady.

[05:47] Team_012 possession (Score: 7-16)
Shaquille Booker attempts a 3Pt. Contested by Julius Durant (4.0 feet, ZONE). Shaquille Booker misses. Offensive rebound by RJ Nowitzki! RJ Nowitzki kicks it out.

[05:37] Team_012 possession (Score: 7-16)
Pascal Herro attempts a 3Pt. Contested by Bradley Sabonis (4.6 feet, ZONE). Pascal Herro misses. FOUL! Loose ball foul on Franz Antetokounmpo during the rebound battle. [Team fouls: 4] No free throws, side out. (Franz Antetokounmpo: 2 personal fouls)

[05:21] Team_012 possession (Score: 7-16)
RJ Nowitzki attempts a 3Pt. Contested by Vince Adebayo (3.8 feet, ZONE). RJ NOWITZKI MAKES IT! Assist: Shaquille Booker
Score: 7-19

[05:07] Team_081 possession (Score: 7-19)
FOUL! Offensive foul on Julius Durant! Pascal Herro drew the charge! [Team fouls: 5] (Julius Durant: 3 personal fouls) TURNOVER! (dead ball)

[04:53] Team_012 possession (Score: 7-19)
RJ Nowitzki attempts a 3Pt. Contested by Bradley Leonard (4.0 feet, MAN). RJ Nowitzki misses. Rebound secured by Franz Antetokounmpo.

[04:40] Team_081 possession (Score: 7-19)
Bradley Leonard attempts a 3Pt. Contested by RJ Nowitzki (3.6 feet, ZONE). Bradley Leonard misses. Rebound secured by Ayo McGrady.

[04:24] Team_012 possession (Score: 7-19)
Paolo Durant makes the Layup and draws the foul on Bradley Sabonis! And-1! Paolo Durant to the line for 1. [BONUS: 6 team fouls] (Bradley Sabonis: 1 personal fouls)   FT 1/1: MISS Paolo Durant makes 0/1 from the line. Rebound secured by Vince Adebayo.
Score: 7-21

[04:10] Team_081 possession (Score: 7-21)
Vince Adebayo attempts a 3Pt. Contested by Shaquille Booker (4.1 feet, MAN). Vince Adebayo misses. Rebound secured by Ayo McGrady.

[03:56] Team_012 possession (Score: 7-21)
Shaquille Booker attempts a Midrange. Contested by Vince Adebayo (3.6 feet, MAN). SHAQUILLE BOOKER MAKES IT!
Score: 7-23

[03:40] Team_081 possession (Score: 7-23)
Julius Durant attempts a Layup. Contested by Paolo Durant (3.8 feet, ZONE). JULIUS DURANT MAKES IT! Assist: Bradley Leonard
Score: 9-23

[03:27] Team_012 possession (Score: 9-23)
Shaquille Booker drives, picks up Vince Adebayo. Help arrives from Bradley Leonard! Shaquille Booker attempts a Dunk. Contested by Bradley Leonard (3.6 feet, MAN). SHAQUILLE BOOKER MAKES IT! Assist: Pascal Herro
Score: 9-25

[03:18] Team_081 possession (Score: 9-25)
Bradley Sabonis attempts a 3Pt. Contested by Paolo Durant (3.6 feet, MAN). Bradley Sabonis misses. Rebound secured by Paolo Durant.

[03:04] Team_012 possession (Score: 9-25)
Pascal Herro drives and kicks out. RJ Nowitzki attempts a 3Pt. Contested by Bradley Leonard (3.9 feet, MAN). RJ NOWITZKI MAKES IT! Assist: Pascal Herro
Score: 9-28

[02:51] Team_081 possession (Score: 9-28)
FOUL! Holding foul on Shaquille Booker. [Team fouls: 3] No free throws, side out. (Shaquille Booker: 1 personal fouls)

[02:34] Team_081 possession (Score: 9-28)
Bradley Sabonis attempts a 3Pt. Contested by RJ Nowitzki (3.6 feet, ZONE). BRADLEY SABONIS MAKES IT! Assist: Vince Adebayo
Score: 12-28

[02:16] Team_012 possession (Score: 12-28)
Shaquille Booker attempts a 3Pt. Contested by Vince Adebayo (3.8 feet, MAN). SHAQUILLE BOOKER MAKES IT! Assist: Ayo McGrady
Score: 12-31

[01:58] Team_081 possession (Score: 12-31)
Franz Antetokounmpo attempts a Layup. Contested by Paolo Durant (3.9 feet, ZONE). FRANZ ANTETOKOUNMPO MAKES IT!
Score: 14-31

[01:41] Team_012 possession (Score: 14-31)
Pascal Herro makes the Layup and draws the foul on Bradley Leonard! And-1! Pascal Herro to the line for 1. [BONUS: 7 team fouls] (Bradley Leonard: 1 personal fouls)   FT 1/1: GOOD Pascal Herro makes 1/1 from the line.
Score: 14-34

[01:29] Team_081 possession (Score: 14-34)
Julius Durant attempts a Midrange. Contested by Pascal Herro (5.4 feet, MAN). JULIUS DURANT MAKES IT! Assist: Vince Adebayo
Score: 16-34

[01:12] Team_012 possession (Score: 16-34)
Shaquille Booker drives to the basket... FOUL! Offensive foul on Shaquille Booker! Vince Adebayo drew the charge! [Team fouls: 4] (Shaquille Booker: 2 personal fouls) TURNOVER! (dead ball)

[01:00] Team_081 possession (Score: 16-34)
Vince Adebayo attempts a Midrange. Contested by Shaquille Booker (4.4 feet, MAN). VINCE ADEBAYO MAKES IT! Assist: Franz Antetokounmpo
Score: 18-34

[00:43] Team_012 possession (Score: 18-34)
Shaquille Booker makes the Layup and draws the foul on Vince Adebayo! And-1! Shaquille Booker to the line for 1. [BONUS: 8 team fouls] (Vince Adebayo: 1 personal fouls)   FT 1/1: GOOD Shaquille Booker makes 1/1 from the line.
Score: 18-37

[00:34] Team_081 possession (Score: 18-37)
Bradley Sabonis drives, picks up Paolo Durant. Help arrives from RJ Nowitzki! Bradley Sabonis attempts a Dunk. Contested by RJ Nowitzki (3.9 feet, ZONE). BRADLEY SABONIS MAKES IT! Assist: Vince Adebayo
Score: 20-37

[00:20] Team_012 possession (Score: 20-37)
Paolo Durant attempts a 3Pt. Contested by Bradley Sabonis (4.6 feet, MAN). Paolo Durant misses. Rebound secured by Bradley Sabonis.

[00:04] Team_081 possession (Score: 20-37)
Vince Adebayo attempts a Midrange. Contested by Shaquille Booker (4.5 feet, MAN). Vince Adebayo misses. Offensive rebound by Bradley Sabonis! Bradley Sabonis kicks it out.

================================================================================
                              1ST QUARTER COMPLETE                              
================================================================================

1ST QUARTER SCORE: Team_081 20, Team_012 37

BOX SCORE:
================================================================================

Team_081
--------------------------------------------------------------------------------
Player                MIN  PTS  REB  AST  TO      FG   FG%      3P   3P%
--------------------------------------------------------------------------------
Bradley Sabonis        12    7    4    0   0   3/5    60.0     0/0   0.0
Julius Durant          12    7    0    0   0   3/5    60.0     0/0   0.0
Franz Antetokounmpo    12    4    3    1   0   2/2   100.0     0/0   0.0
Vince Adebayo          12    2    1    3   0   1/3    33.3     0/0   0.0
Bradley Leonard        12    0    0    2   0   0/2     0.0     0/0   0.0

TEAM: FG: 9/17 (52.9%), 3PT: 2/8 (25.0%), REB: 8 (2 off, 6 def), AST: 6, TO: 5
TEAM FOULS: 8 [Team_012 in BONUS]


Team_012
--------------------------------------------------------------------------------
Player                MIN  PTS  REB  AST  TO      FG   FG%      3P   3P%
--------------------------------------------------------------------------------
Shaquille Booker       12   12    0    3   0   5/6    83.3     0/0   0.0
RJ Nowitzki            12   10    4    0   0   4/6    66.7     0/0   0.0
Pascal Herro           12    8    0    2   0   3/3   100.0     0/0   0.0
Paolo Durant           12    3    2    1   0   1/3    33.3     0/0   0.0
Ayo McGrady            12    2    5    2   0   1/2    50.0     0/0   0.0

TEAM: FG: 14/20 (70.0%), 3PT: 3/6 (50.0%), REB: 11 (3 off, 8 def), AST: 8, TO: 2
TEAM FOULS: 4

================================================================================

================================================================================
                       2ND QUARTER - Team_081 vs Team_012                       
================================================================================

[12:00] Team_081 possession (Score: 20-37)
Franz Antetokounmpo attempts a Midrange. Contested by Paolo Durant (3.9 feet, ZONE). Franz Antetokounmpo misses. Rebound secured by RJ Nowitzki.

[11:43] Team_012 possession (Score: 20-37)
Shaquille Booker attempts a 3Pt. Contested by Vince Adebayo (3.8 feet, MAN). Shaquille Booker misses. Offensive rebound by Paolo Durant! Paolo Durant puts it back in!
Score: 20-39

[11:27] Team_081 possession (Score: 20-39)
Julius Durant drives to the basket... Julius Durant loses control! Ball rolls out of bounds! TURNOVER! (dead ball)

[11:27] Substitution (Team_081): Julius Durant OUT → Dejounte Bane IN (stamina_rule2)

[11:27] Substitution (Team_081): Bradley Leonard OUT → Lamelo Wade IN (stamina_rule2)

[11:27] Substitution (Team_081): Vince Adebayo OUT → Larry Adebayo IN (stamina_rule2)

[11:27] Substitution (Team_081): Bradley Sabonis OUT → Chris Holiday IN (stamina_rule2)

[11:27] Substitution (Team_081): Franz Antetokounmpo OUT → D'Angelo Markkanen IN (stamina_rule2)

[11:27] Substitution (Team_012): Pascal Herro OUT → Desmond Irving IN (stamina_rule2)

[11:27] Substitution (Team_012): RJ Nowitzki OUT → Jalen Barnes IN (stamina_rule2)

[11:27] Substitution (Team_012): Shaquille Booker OUT → Domantas Bird IN (stamina_rule2)

[11:27] Substitution (Team_012): Paolo Durant OUT → Jimmy Quickley IN (stamina_rule2)

[11:27] Substitution (Team_012): Ayo McGrady OUT → Karl Young IN (stamina_rule2)

[11:13] Team_012 possession (Score: 20-39)
Jalen Barnes attempts a 3Pt. Contested by Lamelo Wade (4.7 feet, MAN). Jalen Barnes misses. Offensive rebound by Jimmy Quickley! Jimmy Quickley kicks it out.

[10:54] Team_012 possession (Score: 20-39)
Domantas Bird drives to the basket... Domantas Bird commits a violation (traveling/carry)! TURNOVER! (dead ball)

[10:41] Team_081 possession (Score: 20-39)
Chris Holiday attempts a 3Pt. Contested by Desmond Irving (4.5 feet, ZONE). CHRIS HOLIDAY MAKES IT!
Score: 23-39

[10:24] Team_012 possession (Score: 23-39)
Domantas Bird attempts a Midrange. Contested by Larry Adebayo (5.2 feet, ZONE). DOMANTAS BIRD MAKES IT!
Score: 23-41

[10:09] Team_081 possession (Score: 23-41)
Dejounte Bane attempts a 3Pt. Contested by Desmond Irving (4.7 feet, MAN). DEJOUNTE BANE MAKES IT! Assist: Larry Adebayo
Score: 26-41

[09:53] Team_012 possession (Score: 26-41)
FOUL! Holding foul on Lamelo Wade. [Team fouls: 1] No free throws, side out. (Lamelo Wade: 1 personal fouls)

[09:35] Team_012 possession (Score: 26-41)
Domantas Bird attempts a Midrange. Contested by Larry Adebayo (5.2 feet, MAN). DOMANTAS BIRD MAKES IT! Assist: Karl Young
Score: 26-43

[09:16] Team_081 possession (Score: 26-43)
Dejounte Bane attempts a 3Pt. Contested by Desmond Irving (4.7 feet, MAN). DEJOUNTE BANE MAKES IT! Assist: D'Angelo Markkanen
Score: 29-43

[09:03] Team_012 possession (Score: 29-43)
Domantas Bird attempts a 3Pt. Contested by Larry Adebayo (5.2 feet, MAN). Domantas Bird misses. Offensive rebound by Karl Young! Karl Young puts it back in!
Score: 29-45

[08:46] Team_081 possession (Score: 29-45)
Chris Holiday attempts a Layup. Contested by Jimmy Quickley (4.9 feet, MAN). CHRIS HOLIDAY MAKES IT!
Score: 31-45

[08:31] Team_012 possession (Score: 31-45)
FOUL! Holding foul on Dejounte Bane. [Team fouls: 2] No free throws, side out. (Dejounte Bane: 1 personal fouls)

[08:17] Team_012 possession (Score: 31-45)
Jalen Barnes attempts a 3Pt. Contested by Lamelo Wade (4.7 feet, MAN). Jalen Barnes misses. FOUL! Loose ball foul on Lamelo Wade during the rebound battle. [Team fouls: 3] No free throws, side out. (Lamelo Wade: 2 personal fouls)

[08:02] Team_012 possession (Score: 31-45)
FOUL! Offensive foul on Jalen Barnes! Lamelo Wade drew the charge! [Team fouls: 1] (Jalen Barnes: 1 personal fouls) TURNOVER! (dead ball)

[07:47] Team_081 possession (Score: 31-45)
Dejounte Bane loses control! Ball rolls out of bounds! TURNOVER! (dead ball)

[07:31] Team_012 possession (Score: 31-45)
Karl Young attempts a 3Pt. Contested by Chris Holiday (4.3 feet, ZONE). Karl Young misses. Rebound secured by Larry Adebayo.

[07:20] Team_081 possession (Score: 31-45)
Chris Holiday attempts a 3Pt. Contested by Jalen Barnes (5.3 feet, ZONE). CHRIS HOLIDAY MAKES IT! Assist: Larry Adebayo
Score: 34-45

[07:06] Team_012 possession (Score: 34-45)
Desmond Irving attempts a 3Pt. Contested by Chris Holiday (4.4 feet, ZONE). DESMOND IRVING MAKES IT! Assist: Jalen Barnes
Score: 34-48

[06:49] Team_081 possession (Score: 34-48)
Chris Holiday attempts a Midrange. Contested by Jimmy Quickley (4.9 feet, MAN). CHRIS HOLIDAY MAKES IT! Assist: Lamelo Wade
Score: 36-48

[06:34] Team_012 possession (Score: 36-48)
FOUL! Holding foul on Dejounte Bane. [Team fouls: 4] No free throws, side out. (Dejounte Bane: 2 personal fouls)

[06:19] Team_012 possession (Score: 36-48)
Domantas Bird drives and kicks out. Jimmy Quickley makes the Midrange and draws the foul on Chris Holiday! And-1! Jimmy Quickley to the line for 1. [BONUS: 5 team fouls] (Chris Holiday: 1 personal fouls)   FT 1/1: MISS Jimmy Quickley makes 0/1 from the line. Rebound secured by Lamelo Wade.
Score: 36-50

[06:08] Team_081 possession (Score: 36-50)
Lamelo Wade attempts a 3Pt. Contested by Desmond Irving (4.4 feet, ZONE). Lamelo Wade misses. Rebound secured by Karl Young.

[05:52] Team_012 possession (Score: 36-50)
FOUL! Holding foul on Dejounte Bane. [IN THE BONUS! 6 team fouls] Desmond Irving to the line for 2 free throws. (Dejounte Bane: 3 personal fouls)   FT 1/2: GOOD   FT 2/2: GOOD Desmond Irving makes 2/2 from the line.
Score: 36-52

[05:34] Team_081 possession (Score: 36-52)
FOUL! Shooting foul on Karl Young. D'Angelo Markkanen to the line for 2 free throws. [Team fouls: 2] (Karl Young: 1 personal fouls)   FT 1/2: MISS   FT 2/2: GOOD D'Angelo Markkanen makes 1/2 from the line.
Score: 37-52

[05:21] Team_012 possession (Score: 37-52)
Desmond Irving attempts a Midrange. Contested by Lamelo Wade (4.8 feet, ZONE). Desmond Irving misses. Offensive rebound by Karl Young! Karl Young puts it back in!
Score: 37-54

[05:02] Team_081 possession (Score: 37-54)
D'Angelo Markkanen drives to the basket... D'Angelo Markkanen throws a bad pass! Stolen by Karl Young! TURNOVER! (live ball)

[04:46] Team_012 possession (Score: 37-54)
Jalen Barnes drives and kicks out. Desmond Irving attempts a Midrange. Contested by Dejounte Bane (5.5 feet, MAN). Desmond Irving misses. Rebound secured by Lamelo Wade.

[04:35] Team_081 possession (Score: 37-54)
Dejounte Bane attempts a Midrange. Contested by Desmond Irving (4.7 feet, MAN). Dejounte Bane misses. Offensive rebound by Lamelo Wade! Lamelo Wade kicks it out.

[04:21] Team_081 possession (Score: 37-54)
Larry Adebayo attempts a 3Pt. Contested by Domantas Bird (5.1 feet, MAN). Larry Adebayo misses. Rebound secured by Jimmy Quickley.

[04:03] Team_012 possession (Score: 37-54)
FOUL! Shooting foul on Chris Holiday. Jimmy Quickley to the line for 2 free throws. [BONUS: 7 team fouls] (Chris Holiday: 2 personal fouls)   FT 1/2: GOOD   FT 2/2: GOOD Jimmy Quickley makes 2/2 from the line.
Score: 37-56

[03:48] Team_081 possession (Score: 37-56)
Chris Holiday attempts a Layup. BLOCKED BY JIMMY QUICKLEY! Ball is loose! Rebound secured by Karl Young.

[03:28] Team_012 possession (Score: 37-56)
Domantas Bird attempts a 3Pt. Contested by Larry Adebayo (5.2 feet, MAN). Domantas Bird misses. Rebound secured by Lamelo Wade.

[03:15] Team_081 possession (Score: 37-56)
Larry Adebayo attempts a 3Pt. Contested by Desmond Irving (4.5 feet, ZONE). LARRY ADEBAYO MAKES IT! Assist: Lamelo Wade
Score: 40-56

[03:04] Team_012 possession (Score: 40-56)
Desmond Irving attempts a Midrange. Contested by Dejounte Bane (5.7 feet, MAN). Desmond Irving misses. Offensive rebound by Karl Young! Karl Young's putback is no good. Offensive rebound by Jimmy Quickley! Jimmy Quickley kicks it out.

[02:54] Team_012 possession (Score: 40-56)
Domantas Bird throws a bad pass out of bounds! TURNOVER! (dead ball)

[02:42] Team_081 possession (Score: 40-56)
Chris Holiday attempts a 3Pt. Contested by Jimmy Quickley (5.1 feet, ZONE). Chris Holiday misses. Rebound secured by Karl Young.

[02:27] Team_012 possession (Score: 40-56)
Karl Young drives, picks up Chris Holiday. Help arrives from Lamelo Wade! Karl Young attempts a Layup. Contested by Lamelo Wade (4.5 feet, ZONE). KARL YOUNG MAKES IT! Assist: Desmond Irving
Score: 40-58

[02:13] Team_081 possession (Score: 40-58)
D'Angelo Markkanen attempts a Layup. Contested by Jimmy Quickley (5.2 feet, ZONE). D'Angelo Markkanen misses. Rebound secured by Jalen Barnes.

[02:04] Team_012 possession (Score: 40-58)
FOUL! Shooting foul on Dejounte Bane. Desmond Irving to the line for 3 free throws. [BONUS: 8 team fouls] (Dejounte Bane: 4 personal fouls)   FT 1/3: GOOD   FT 2/3: GOOD   FT 3/3: GOOD Desmond Irving makes 3/3 from the line.
Score: 40-61

[01:50] Team_081 possession (Score: 40-61)
Lamelo Wade attempts a 3Pt. Contested by Jalen Barnes (5.3 feet, MAN). Lamelo Wade misses. Rebound secured by Jalen Barnes.

[01:31] Team_012 possession (Score: 40-61)
Jalen Barnes loses the ball! Stripped by Lamelo Wade! TURNOVER! (live ball)

[01:17] Team_081 possession (Score: 40-61)
D'Angelo Markkanen commits a violation (traveling/carry)! TURNOVER! (dead ball)

[01:03] Team_012 possession (Score: 40-61)
Jimmy Quickley attempts a 3Pt. Contested by Chris Holiday (4.7 feet, ZONE). Jimmy Quickley misses. Rebound secured by Larry Adebayo.

[00:47] Team_081 possession (Score: 40-61)
Chris Holiday drives to the basket... Chris Holiday throws a bad pass! Stolen by Jimmy Quickley! TURNOVER! (live ball)

[00:30] Team_012 possession (Score: 40-61)
Jalen Barnes attempts a 3Pt. Contested by Lamelo Wade (5.1 feet, MAN). JALEN BARNES MAKES IT! Assist: Domantas Bird
Score: 40-64

[00:16] Team_081 possession (Score: 40-64)
Lamelo Wade makes the Midrange and draws the foul on Jimmy Quickley! And-1! Lamelo Wade to the line for 1. [Team fouls: 3] (Jimmy Quickley: 1 personal fouls)   FT 1/1: MISS Lamelo Wade makes 0/1 from the line. Rebound secured by Jimmy Quickley.
Score: 42-64

[00:04] Team_012 possession (Score: 42-64)
Desmond Irving attempts a 3Pt. Contested by Chris Holiday (4.8 feet, ZONE). Desmond Irving misses. Rebound secured by Lamelo Wade.

================================================================================
                              2ND QUARTER COMPLETE                              
================================================================================

2ND QUARTER SCORE: Team_081 22, Team_012 27

BOX SCORE:
================================================================================

Team_081
--------------------------------------------------------------------------------
Player                MIN  PTS  REB  AST  TO      FG   FG%      3P   3P%
--------------------------------------------------------------------------------
Chris Holiday          11   10    0    0   0   4/6    66.7     0/0   0.0
Dejounte Bane          11    6    0    0   0   2/2   100.0     0/0   0.0
Larry Adebayo          11    3    2    2   0   1/2    50.0     0/0   0.0
D'Angelo Markkanen     11    1    0    1   0   1/2    50.0     0/0   0.0
Franz Antetokounmpo    13    0    0    0   0   0/1     0.0     0/0   0.0
Lamelo Wade            11    0    5    2   0   0/3     0.0     0/0   0.0

TEAM: FG: 8/16 (50.0%), 3PT: 5/9 (55.6%), REB: 7 (1 off, 6 def), AST: 5, TO: 5
TEAM FOULS: 8 [Team_012 in BONUS]


Team_012
--------------------------------------------------------------------------------
Player                MIN  PTS  REB  AST  TO      FG   FG%      3P   3P%
--------------------------------------------------------------------------------
Desmond Irving         11    8    0    1   0   3/4    75.0     0/0   0.0
Karl Young             11    6    5    1   0   3/4    75.0     0/0   0.0
Domantas Bird          11    4    0    1   0   2/4    50.0     0/0   0.0
Jalen Barnes           11    3    2    1   0   1/2    50.0     0/0   0.0
Paolo Durant           13    2    1    0   0   1/1   100.0     0/0   0.0
Jimmy Quickley         11    2    5    0   0   1/2    50.0     0/0   0.0
RJ Nowitzki            13    0    1    0   0   0/0     0.0     0/0   0.0

TEAM: FG: 11/17 (64.7%), 3PT: 5/9 (55.6%), REB: 14 (6 off, 8 def), AST: 4, TO: 4
TEAM FOULS: 3

================================================================================

================================================================================
                       3RD QUARTER - Team_081 vs Team_012                       
================================================================================

[12:00] Team_081 possession (Score: 42-64)
FOUL! Reach-in foul on Ayo McGrady during the drive. [Team fouls: 1] No free throws, side out. (Ayo McGrady: 1 personal fouls)

[11:50] Team_081 possession (Score: 42-64)
Bradley Leonard attempts a Midrange. Contested by RJ Nowitzki (3.6 feet, MAN). Bradley Leonard misses. Offensive rebound by Bradley Sabonis! Bradley Sabonis kicks it out.

[11:35] Team_081 possession (Score: 42-64)
Bradley Sabonis attempts a Layup. BLOCKED BY PAOLO DURANT! Ball is loose! Rebound secured by Ayo McGrady.

[11:21] Team_012 possession (Score: 42-64)
FOUL! Holding foul on Julius Durant. [Team fouls: 1] No free throws, side out. (Julius Durant: 1 personal fouls)

[11:03] Team_012 possession (Score: 42-64)
Paolo Durant attempts a Layup. Contested by Bradley Sabonis (4.1 feet, MAN). PAOLO DURANT MAKES IT!
Score: 42-66

[10:45] Team_081 possession (Score: 42-66)
Bradley Sabonis attempts a Layup. Contested by Paolo Durant (3.4 feet, MAN). BRADLEY SABONIS MAKES IT! Assist: Vince Adebayo
Score: 44-66

[10:26] Team_012 possession (Score: 44-66)
Pascal Herro drives to the basket... Pascal Herro throws a bad pass! Stolen by Julius Durant! TURNOVER! (live ball)

[10:12] Team_081 possession (Score: 44-66)
FOUL! Shooting foul on Pascal Herro. Franz Antetokounmpo to the line for 2 free throws. [Team fouls: 2] (Pascal Herro: 1 personal fouls)   FT 1/2: GOOD   FT 2/2: GOOD Franz Antetokounmpo makes 2/2 from the line.
Score: 46-66

[09:57] Team_012 possession (Score: 46-66)
Pascal Herro throws a bad pass out of bounds! TURNOVER! (dead ball)

[09:45] Team_081 possession (Score: 46-66)
Franz Antetokounmpo drives and kicks out. Bradley Leonard attempts a 3Pt. Contested by RJ Nowitzki (3.4 feet, ZONE). Bradley Leonard misses. Offensive rebound by Franz Antetokounmpo! Franz Antetokounmpo puts it back in!
Score: 48-66

[09:30] Team_012 possession (Score: 48-66)
RJ Nowitzki drives and kicks out. RJ Nowitzki attempts a 3Pt. Contested by Vince Adebayo (3.4 feet, ZONE). RJ Nowitzki misses. Rebound secured by Vince Adebayo.

[09:13] Team_081 possession (Score: 48-66)
Vince Adebayo attempts a 3Pt. Contested by Shaquille Booker (4.0 feet, ZONE). Vince Adebayo misses. Rebound secured by RJ Nowitzki.

[09:00] Team_012 possession (Score: 48-66)
RJ Nowitzki attempts a 3Pt. Contested by Vince Adebayo (3.7 feet, ZONE). RJ NOWITZKI MAKES IT! Assist: Paolo Durant
Score: 48-69

[08:44] Team_081 possession (Score: 48-69)
FOUL! Shooting foul on RJ Nowitzki. Franz Antetokounmpo to the line for 2 free throws. [Team fouls: 3] (RJ Nowitzki: 1 personal fouls)   FT 1/2: GOOD   FT 2/2: MISS Franz Antetokounmpo makes 1/2 from the line. Offensive rebound by Bradley Sabonis! Bradley Sabonis kicks it out.
Score: 49-69

[08:29] Team_081 possession (Score: 49-69)
Vince Adebayo attempts a 3Pt. Contested by RJ Nowitzki (3.4 feet, ZONE). Vince Adebayo misses. Rebound secured by Ayo McGrady.

[08:18] Team_012 possession (Score: 49-69)
Pascal Herro attempts a 3Pt. Contested by Julius Durant (4.6 feet, MAN). Pascal Herro misses. Rebound secured by Franz Antetokounmpo.

[08:02] Team_081 possession (Score: 49-69)
Franz Antetokounmpo makes the Midrange and draws the foul on RJ Nowitzki! And-1! Franz Antetokounmpo to the line for 1. [Team fouls: 4] (RJ Nowitzki: 2 personal fouls)   FT 1/1: GOOD Franz Antetokounmpo makes 1/1 from the line.
Score: 52-69

[07:49] Team_012 possession (Score: 52-69)
Paolo Durant throws a bad pass! Stolen by Bradley Sabonis! TURNOVER! (live ball)

[07:34] Team_081 possession (Score: 52-69)
Bradley Sabonis drives, Paolo Durant stays with him. Bradley Sabonis attempts a Layup. Contested by Paolo Durant (3.4 feet, MAN). Bradley Sabonis misses. Rebound secured by Ayo McGrady.

[07:16] Team_012 possession (Score: 52-69)
Paolo Durant attempts a Layup. BLOCKED BY BRADLEY SABONIS! Ball is loose! Offensive rebound by RJ Nowitzki! RJ Nowitzki kicks it out.

[07:05] Team_012 possession (Score: 52-69)
Shaquille Booker attempts a Layup. Contested by Vince Adebayo (3.4 feet, MAN). Shaquille Booker misses. Offensive rebound by Paolo Durant! Paolo Durant puts it back in!
Score: 52-71

[06:48] Team_081 possession (Score: 52-71)
FOUL! Offensive foul on Julius Durant! Pascal Herro drew the charge! [Team fouls: 2] (Julius Durant: 2 personal fouls) TURNOVER! (dead ball)

[06:31] Team_012 possession (Score: 52-71)
RJ Nowitzki throws a bad pass! Stolen by Bradley Leonard! TURNOVER! (live ball)

[06:21] Team_081 possession (Score: 52-71)
Bradley Sabonis attempts a Layup. Contested by Paolo Durant (3.4 feet, MAN). BRADLEY SABONIS MAKES IT! Assist: Franz Antetokounmpo
Score: 54-71

[06:07] Team_012 possession (Score: 54-71)
RJ Nowitzki attempts a 3Pt. Contested by Vince Adebayo (3.7 feet, ZONE). RJ Nowitzki misses. FOUL! Loose ball foul on Bradley Sabonis during the rebound battle. [Team fouls: 3] No free throws, side out. (Bradley Sabonis: 1 personal fouls)

[05:53] Team_012 possession (Score: 54-71)
RJ Nowitzki makes the Layup and draws the foul on Vince Adebayo! And-1! RJ Nowitzki to the line for 1. [Team fouls: 4] (Vince Adebayo: 1 personal fouls)   FT 1/1: GOOD RJ Nowitzki makes 1/1 from the line.
Score: 54-74

[05:43] Team_081 possession (Score: 54-74)
Vince Adebayo drives to the basket... Vince Adebayo throws a bad pass out of bounds! TURNOVER! (dead ball)

[05:27] Team_012 possession (Score: 54-74)
Ayo McGrady attempts a 3Pt. Contested by Vince Adebayo (3.4 feet, ZONE). AYO MCGRADY MAKES IT! Assist: RJ Nowitzki
Score: 54-77

[05:11] Team_081 possession (Score: 54-77)
Julius Durant drives, Ayo McGrady stays with him. Julius Durant attempts a Dunk. Contested by Ayo McGrady (4.4 feet, ZONE). Julius Durant misses. Rebound secured by Paolo Durant.

[04:56] Team_012 possession (Score: 54-77)
Shaquille Booker attempts a Midrange. Contested by Vince Adebayo (3.4 feet, MAN). SHAQUILLE BOOKER MAKES IT!
Score: 54-79

[04:45] Team_081 possession (Score: 54-79)
Franz Antetokounmpo makes the Layup and draws the foul on Ayo McGrady! And-1! Franz Antetokounmpo to the line for 1. [BONUS: 5 team fouls] (Ayo McGrady: 2 personal fouls)   FT 1/1: GOOD Franz Antetokounmpo makes 1/1 from the line.
Score: 57-79

[04:26] Team_012 possession (Score: 57-79)
Paolo Durant attempts a Midrange. Contested by Vince Adebayo (3.7 feet, ZONE). Paolo Durant misses. Rebound secured by Bradley Sabonis.

[04:12] Team_081 possession (Score: 57-79)
FOUL! Reach-in foul on Paolo Durant during the drive. [IN THE BONUS! 6 team fouls] Bradley Sabonis to the line for 2 free throws. (Paolo Durant: 1 personal fouls)   FT 1/2: GOOD   FT 2/2: GOOD Bradley Sabonis makes 2/2 from the line.
Score: 59-79

[03:58] Team_012 possession (Score: 59-79)
Paolo Durant drives and kicks out. Pascal Herro attempts a 3Pt. Contested by Julius Durant (4.1 feet, MAN). Pascal Herro misses. Rebound secured by Bradley Sabonis.

[03:45] Team_081 possession (Score: 59-79)
Bradley Sabonis makes the Layup and draws the foul on Paolo Durant! And-1! Bradley Sabonis to the line for 1. [BONUS: 7 team fouls] (Paolo Durant: 2 personal fouls)   FT 1/1: GOOD Bradley Sabonis makes 1/1 from the line.
Score: 62-79

[03:32] Team_012 possession (Score: 62-79)
Paolo Durant makes the Layup and draws the foul on Franz Antetokounmpo! And-1! Paolo Durant to the line for 1. [BONUS: 5 team fouls] (Franz Antetokounmpo: 1 personal fouls)   FT 1/1: GOOD Paolo Durant makes 1/1 from the line.
Score: 62-82

[03:16] Team_081 possession (Score: 62-82)
Bradley Leonard makes the Layup and draws the foul on RJ Nowitzki! And-1! Bradley Leonard to the line for 1. [BONUS: 8 team fouls] (RJ Nowitzki: 3 personal fouls)   FT 1/1: GOOD Bradley Leonard makes 1/1 from the line.
Score: 65-82

[03:03] Team_012 possession (Score: 65-82)
Pascal Herro attempts a Layup. Contested by Julius Durant (4.7 feet, MAN). Pascal Herro misses. Rebound secured by Vince Adebayo.

[02:52] Team_081 possession (Score: 65-82)
Vince Adebayo drives and kicks out. Julius Durant attempts a Midrange. Contested by RJ Nowitzki (3.6 feet, ZONE). Julius Durant misses. Offensive rebound by Franz Antetokounmpo! Franz Antetokounmpo puts it back in!
Score: 67-82

[02:35] Team_012 possession (Score: 67-82)
Paolo Durant attempts a 3Pt. Contested by Bradley Leonard (4.0 feet, ZONE). Paolo Durant misses. Rebound secured by Vince Adebayo.

[02:23] Team_081 possession (Score: 67-82)
Vince Adebayo makes the Midrange and draws the foul on Shaquille Booker! And-1! Vince Adebayo to the line for 1. [BONUS: 9 team fouls] (Shaquille Booker: 1 personal fouls)   FT 1/1: GOOD Vince Adebayo makes 1/1 from the line.
Score: 70-82

[02:11] Team_012 possession (Score: 70-82)
Paolo Durant drives to the basket... FOUL! Offensive foul on Paolo Durant! Bradley Sabonis drew the charge! [Team fouls: 10] (Paolo Durant: 3 personal fouls) TURNOVER! (dead ball)

[01:58] Team_081 possession (Score: 70-82)
Julius Durant attempts a Layup. Contested by Paolo Durant (3.9 feet, ZONE). Julius Durant misses. Rebound secured by Ayo McGrady.

[01:47] Team_012 possession (Score: 70-82)
Pascal Herro attempts a 3Pt. Contested by Julius Durant (4.8 feet, MAN). PASCAL HERRO MAKES IT! Assist: Paolo Durant
Score: 70-85

[01:34] Team_081 possession (Score: 70-85)
Julius Durant attempts a Layup. Contested by Paolo Durant (4.0 feet, ZONE). JULIUS DURANT MAKES IT!
Score: 72-85

[01:16] Team_012 possession (Score: 72-85)
Paolo Durant throws a bad pass out of bounds! TURNOVER! (dead ball)

[01:16] Substitution (Team_081): Julius Durant OUT → Dejounte Bane IN (stamina_rule2)

[01:16] Substitution (Team_081): Bradley Leonard OUT → Lamelo Wade IN (stamina_rule2)

[01:16] Substitution (Team_081): Vince Adebayo OUT → Larry Adebayo IN (stamina_rule2)

[01:16] Substitution (Team_081): Bradley Sabonis OUT → Chris Holiday IN (stamina_rule2)

[01:16] Substitution (Team_081): Franz Antetokounmpo OUT → D'Angelo Markkanen IN (stamina_rule2)

[01:16] Substitution (Team_012): Pascal Herro OUT → Desmond Irving IN (stamina_rule2)

[01:16] Substitution (Team_012): RJ Nowitzki OUT → Jalen Barnes IN (stamina_rule2)

[01:16] Substitution (Team_012): Shaquille Booker OUT → Domantas Bird IN (stamina_rule2)

[01:16] Substitution (Team_012): Paolo Durant OUT → Jimmy Quickley IN (stamina_rule2)

[01:16] Substitution (Team_012): Ayo McGrady OUT → Karl Young IN (stamina_rule2)

[01:00] Team_081 possession (Score: 72-85)
D'Angelo Markkanen drives, Jimmy Quickley stays with him. D'Angelo Markkanen attempts a Layup. Contested by Jimmy Quickley (5.1 feet, ZONE). D'ANGELO MARKKANEN MAKES IT! Assist: Larry Adebayo
Score: 74-85

[00:47] Team_012 possession (Score: 74-85)
Karl Young drives, picks up Chris Holiday. Help arrives from Lamelo Wade! Karl Young attempts a Dunk. Contested by Lamelo Wade (4.3 feet, MAN). KARL YOUNG MAKES IT! Assist: Domantas Bird
Score: 74-87

[00:28] Team_081 possession (Score: 74-87)
D'Angelo Markkanen attempts a 3Pt. Contested by Desmond Irving (4.6 feet, ZONE). D'Angelo Markkanen misses. Rebound secured by Karl Young.

[00:14] Team_012 possession (Score: 74-87)
Domantas Bird drives and kicks out. Jalen Barnes makes the Midrange and draws the foul on Lamelo Wade! And-1! Jalen Barnes to the line for 1. [BONUS: 6 team fouls] (Lamelo Wade: 1 personal fouls)   FT 1/1: GOOD Jalen Barnes makes 1/1 from the line.
Score: 74-90

================================================================================
                              3RD QUARTER COMPLETE                              
================================================================================

3RD QUARTER SCORE: Team_081 32, Team_012 26

BOX SCORE:
================================================================================

Team_081
--------------------------------------------------------------------------------
Player                MIN  PTS  REB  AST  TO      FG   FG%      3P   3P%
--------------------------------------------------------------------------------
Franz Antetokounmpo    24   12    3    1   0   5/5   100.0     0/0   0.0
Bradley Sabonis        24    9    4    0   0   4/6    66.7     0/0   0.0
Vince Adebayo          24    3    3    1   0   1/3    33.3     0/0   0.0
Bradley Leonard        24    3    0    0   0   1/1   100.0     0/0   0.0
Julius Durant          24    2    0    0   0   1/3    33.3     0/0   0.0
D'Angelo Markkanen     12    2    0    0   0   1/2    50.0     0/0   0.0
Larry Adebayo          12    0    0    1   0   0/0     0.0     0/0   0.0

TEAM: FG: 13/20 (65.0%), 3PT: 0/3 (0.0%), REB: 10 (4 off, 6 def), AST: 3, TO: 2
TEAM FOULS: 6 [Team_012 in BONUS]


Team_012
--------------------------------------------------------------------------------
Player                MIN  PTS  REB  AST  TO      FG   FG%      3P   3P%
--------------------------------------------------------------------------------
Paolo Durant           24    7    2    2   0   3/6    50.0     0/0   0.0
RJ Nowitzki            24    6    3    1   0   2/3    66.7     0/0   0.0
Ayo McGrady            24    3    4    0   0   1/1   100.0     0/0   0.0
Pascal Herro           24    3    0    0   0   1/3    33.3     0/0   0.0
Jalen Barnes           12    3    0    0   0   1/1   100.0     0/0   0.0
Shaquille Booker       24    2    0    0   0   1/1   100.0     0/0   0.0
Karl Young             12    2    1    0   0   1/1   100.0     0/0   0.0
Domantas Bird          12    0    0    1   0   0/0     0.0     0/0   0.0

TEAM: FG: 10/16 (62.5%), 3PT: 3/5 (60.0%), REB: 10 (3 off, 7 def), AST: 4, TO: 6
TEAM FOULS: 10 [Team_081 in BONUS]

================================================================================

================================================================================
                       4TH QUARTER - Team_081 vs Team_012                       
================================================================================

[12:00] Substitution (Team_081): Julius Durant OUT (stamina: 75) → Dejounte Bane IN (comeback_detected)

[12:00] Substitution (Team_012): Pascal Herro OUT (stamina: 72) → Desmond Irving IN (comeback_detected)

[12:00] Team_081 possession (Score: 74-90)
Franz Antetokounmpo attempts a Midrange. Contested by Ayo McGrady (4.5 feet, MAN). FRANZ ANTETOKOUNMPO MAKES IT!
Score: 76-90

[11:46] Team_012 possession (Score: 76-90)
Paolo Durant attempts a Layup. Contested by Franz Antetokounmpo (4.5 feet, ZONE). PAOLO DURANT MAKES IT! Assist: RJ Nowitzki
Score: 76-92

[11:33] Team_081 possession (Score: 76-92)
Bradley Sabonis attempts a 3Pt. Contested by Paolo Durant (3.6 feet, MAN). BRADLEY SABONIS MAKES IT! Assist: Vince Adebayo
Score: 79-92

[11:20] Team_012 possession (Score: 79-92)
FOUL! Shooting foul on Franz Antetokounmpo. RJ Nowitzki to the line for 2 free throws. [Team fouls: 1] (Franz Antetokounmpo: 1 personal fouls)   FT 1/2: GOOD   FT 2/2: GOOD RJ Nowitzki makes 2/2 from the line.
Score: 79-94

[11:08] Team_081 possession (Score: 79-94)
Dejounte Bane makes the Layup and draws the foul on Desmond Irving! And-1! Dejounte Bane to the line for 1. [Team fouls: 1] (Desmond Irving: 1 personal fouls)   FT 1/1: GOOD Dejounte Bane makes 1/1 from the line.
Score: 82-94

[10:51] Team_012 possession (Score: 82-94)
Ayo McGrady makes the Layup and draws the foul on Franz Antetokounmpo! And-1! Ayo McGrady to the line for 1. [Team fouls: 2] (Franz Antetokounmpo: 2 personal fouls)   FT 1/1: GOOD Ayo McGrady makes 1/1 from the line.
Score: 82-97

[10:37] Team_081 possession (Score: 82-97)
Vince Adebayo attempts a 3Pt. Contested by RJ Nowitzki (3.7 feet, ZONE). Vince Adebayo misses. Rebound secured by Paolo Durant.

[10:25] Team_012 possession (Score: 82-97)
RJ Nowitzki attempts a 3Pt. Contested by Bradley Leonard (4.3 feet, MAN). RJ Nowitzki misses. Rebound secured by Franz Antetokounmpo.

[10:08] Team_081 possession (Score: 82-97)
Vince Adebayo attempts a 3Pt. Contested by Shaquille Booker (4.3 feet, ZONE). Vince Adebayo misses. Offensive rebound by Franz Antetokounmpo! Franz Antetokounmpo puts it back in!
Score: 84-97

[09:55] Team_012 possession (Score: 84-97)
Shaquille Booker attempts a 3Pt. Contested by Vince Adebayo (3.9 feet, MAN). Shaquille Booker misses. Rebound secured by Franz Antetokounmpo.

[09:44] Team_081 possession (Score: 84-97)
Vince Adebayo attempts a Layup. BLOCKED BY PAOLO DURANT! Ball is loose! Rebound secured by RJ Nowitzki.

[09:29] Team_012 possession (Score: 84-97)
FOUL! Shooting foul on Bradley Leonard. RJ Nowitzki to the line for 2 free throws. [Team fouls: 3] (Bradley Leonard: 1 personal fouls)   FT 1/2: GOOD   FT 2/2: MISS RJ Nowitzki makes 1/2 from the line. Rebound secured by Vince Adebayo.
Score: 84-98

[09:14] Team_081 possession (Score: 84-98)
Vince Adebayo drives, Shaquille Booker stays with him. Vince Adebayo attempts a Dunk. Contested by Shaquille Booker (4.4 feet, MAN). VINCE ADEBAYO MAKES IT! Assist: Dejounte Bane
Score: 86-98

[08:57] Team_012 possession (Score: 86-98)
Shaquille Booker makes the Layup and draws the foul on Vince Adebayo! And-1! Shaquille Booker to the line for 1. [Team fouls: 4] (Vince Adebayo: 1 personal fouls)   FT 1/1: GOOD Shaquille Booker makes 1/1 from the line.
Score: 86-101

[08:41] Team_081 possession (Score: 86-101)
Dejounte Bane attempts a Midrange. Contested by Ayo McGrady (5.0 feet, ZONE). DEJOUNTE BANE MAKES IT!
Score: 88-101

[08:26] Team_012 possession (Score: 88-101)
RJ Nowitzki attempts a Midrange. Contested by Bradley Leonard (4.5 feet, MAN). RJ NOWITZKI MAKES IT!
Score: 88-103

[08:12] Team_081 possession (Score: 88-103)
Vince Adebayo attempts a 3Pt. Contested by RJ Nowitzki (4.0 feet, ZONE). Vince Adebayo misses. Offensive rebound by Franz Antetokounmpo! Franz Antetokounmpo's putback is no good. Offensive rebound by Bradley Sabonis! Bradley Sabonis kicks it out.

[07:59] Team_081 possession (Score: 88-103)
Franz Antetokounmpo drives and kicks out. Franz Antetokounmpo attempts a 3Pt. Contested by Shaquille Booker (4.6 feet, ZONE). Franz Antetokounmpo misses. Rebound secured by Ayo McGrady.

[07:48] Team_012 possession (Score: 88-103)
Ayo McGrady attempts a Layup. Contested by Franz Antetokounmpo (4.8 feet, MAN). AYO MCGRADY MAKES IT! Assist: RJ Nowitzki
Score: 88-105

[07:30] Team_081 possession (Score: 88-105)
Bradley Sabonis drives and kicks out. Bradley Leonard attempts a 3Pt. Contested by RJ Nowitzki (4.2 feet, MAN). BRADLEY LEONARD MAKES IT! Assist: Dejounte Bane
Score: 91-105

[07:17] Team_012 possession (Score: 91-105)
Paolo Durant drives, picks up Bradley Sabonis. Help arrives from Bradley Leonard! Paolo Durant attempts a Layup. Contested by Bradley Leonard (4.7 feet, MAN). Paolo Durant misses. Rebound secured by Franz Antetokounmpo.

[07:06] Team_081 possession (Score: 91-105)
Franz Antetokounmpo attempts a 3Pt. Contested by RJ Nowitzki (4.3 feet, ZONE). FRANZ ANTETOKOUNMPO MAKES IT! Assist: Dejounte Bane
Score: 94-105

[06:52] Team_012 possession (Score: 94-105)
Ayo McGrady attempts a Midrange. Contested by Bradley Sabonis (4.7 feet, ZONE). AYO MCGRADY MAKES IT! Assist: Desmond Irving
Score: 94-107

[06:39] Team_081 possession (Score: 94-107)
Dejounte Bane makes the Layup and draws the foul on Desmond Irving! And-1! Dejounte Bane to the line for 1. [Team fouls: 2] (Desmond Irving: 2 personal fouls)   FT 1/1: GOOD Dejounte Bane makes 1/1 from the line.
Score: 97-107

[06:28] Team_012 possession (Score: 97-107)
Desmond Irving attempts a 3Pt. Contested by Dejounte Bane (5.6 feet, MAN). Desmond Irving misses. Rebound secured by Franz Antetokounmpo.

[06:15] Team_081 possession (Score: 97-107)
Bradley Sabonis attempts a Midrange. Contested by Paolo Durant (4.3 feet, MAN). BRADLEY SABONIS MAKES IT!
Score: 99-107

[05:58] Team_012 possession (Score: 99-107)
Ayo McGrady attempts a 3Pt. Contested by Bradley Leonard (4.5 feet, ZONE). Ayo McGrady misses. FOUL! Loose ball foul on Franz Antetokounmpo during the rebound battle. [IN THE BONUS! 5 team fouls] Paolo Durant to the line for 2 free throws. (Franz Antetokounmpo: 3 personal fouls)   FT 1/2: MISS   FT 2/2: MISS Paolo Durant makes 0/2 from the line. Offensive rebound by Paolo Durant! Paolo Durant kicks it out.

[05:42] Team_012 possession (Score: 99-107)
FOUL! Shooting foul on Bradley Leonard. RJ Nowitzki to the line for 2 free throws. [BONUS: 6 team fouls] (Bradley Leonard: 2 personal fouls)   FT 1/2: GOOD   FT 2/2: GOOD RJ Nowitzki makes 2/2 from the line.
Score: 99-109

[05:27] Team_081 possession (Score: 99-109)
Dejounte Bane attempts a 3Pt. Contested by Desmond Irving (4.8 feet, ZONE). DEJOUNTE BANE MAKES IT!
Score: 102-109

[05:12] Team_012 possession (Score: 102-109)
Paolo Durant drives to the basket... Paolo Durant throws a bad pass! Stolen by Bradley Sabonis! TURNOVER! (live ball)

[05:00] Team_081 possession (Score: 102-109)
Bradley Sabonis attempts a Layup. Contested by Paolo Durant (4.5 feet, ZONE). Bradley Sabonis misses. FOUL! Loose ball foul on Ayo McGrady during the rebound battle. [Team fouls: 3] No free throws, side out. (Ayo McGrady: 1 personal fouls)

[04:42] Team_081 possession (Score: 102-109)
Bradley Leonard drives, RJ Nowitzki stays with him. Bradley Leonard attempts a Layup. Contested by RJ Nowitzki (4.7 feet, MAN). Bradley Leonard misses. Rebound secured by RJ Nowitzki.

[04:23] Team_012 possession (Score: 102-109)
Paolo Durant attempts a Layup. Contested by Bradley Sabonis (5.1 feet, MAN). Paolo Durant misses. Rebound secured by Bradley Sabonis.

[04:08] Team_081 possession (Score: 102-109)
Franz Antetokounmpo attempts a Layup. BLOCKED BY PAOLO DURANT! Ball is loose! Offensive rebound by Bradley Sabonis! Bradley Sabonis kicks it out.

[03:52] Team_081 possession (Score: 102-109)
Franz Antetokounmpo attempts a 3Pt. Contested by Desmond Irving (4.6 feet, ZONE). Franz Antetokounmpo misses. Rebound secured by Paolo Durant.

[03:37] Team_012 possession (Score: 102-109)
Desmond Irving attempts a 3Pt. Contested by Bradley Leonard (5.1 feet, ZONE). Desmond Irving misses. FOUL! Loose ball foul on Franz Antetokounmpo during the rebound battle. [IN THE BONUS! 7 team fouls] RJ Nowitzki to the line for 2 free throws. (Franz Antetokounmpo: 4 personal fouls)   FT 1/2: GOOD   FT 2/2: GOOD RJ Nowitzki makes 2/2 from the line.
Score: 102-111

[03:26] Team_081 possession (Score: 102-111)
Bradley Leonard attempts a 3Pt. Contested by Desmond Irving (4.7 feet, ZONE). Bradley Leonard misses. Rebound secured by RJ Nowitzki.

[03:08] Team_012 possession (Score: 102-111)
RJ Nowitzki attempts a 3Pt. Contested by Vince Adebayo (5.2 feet, ZONE). RJ NOWITZKI MAKES IT! Assist: Desmond Irving
Score: 102-114

[02:53] Team_081 possession (Score: 102-114)
FOUL! Shooting foul on Paolo Durant. Dejounte Bane to the line for 2 free throws. [BONUS: 5 team fouls] (Paolo Durant: 1 personal fouls)   FT 1/2: GOOD   FT 2/2: GOOD Dejounte Bane makes 2/2 from the line.
Score: 104-114

[02:40] Team_012 possession (Score: 104-114)
Desmond Irving attempts a 3Pt. Contested by Bradley Leonard (5.2 feet, ZONE). Desmond Irving misses. Offensive rebound by Paolo Durant! Paolo Durant kicks it out.

[02:24] Team_012 possession (Score: 104-114)
FOUL! Shooting foul on Franz Antetokounmpo. Desmond Irving to the line for 2 free throws. [BONUS: 8 team fouls] (Franz Antetokounmpo: 5 personal fouls)   FT 1/2: GOOD   FT 2/2: GOOD Desmond Irving makes 2/2 from the line.
Score: 104-116

[02:05] Team_081 possession (Score: 104-116)
Dejounte Bane attempts a 3Pt. Contested by Desmond Irving (5.0 feet, ZONE). Dejounte Bane misses. Rebound secured by Paolo Durant.

[01:51] Team_012 possession (Score: 104-116)
Desmond Irving attempts a 3Pt. Wide open! Dejounte Bane is 6.0 feet away. [MAN] Desmond Irving misses. Rebound secured by Franz Antetokounmpo.

[01:36] Team_081 possession (Score: 104-116)
Bradley Leonard attempts a 3Pt. Contested by Desmond Irving (4.9 feet, ZONE). BRADLEY LEONARD MAKES IT! Assist: Bradley Sabonis
Score: 107-116

[01:23] Team_012 possession (Score: 107-116)
Ayo McGrady makes the Layup and draws the foul on Franz Antetokounmpo! And-1! Ayo McGrady to the line for 1. [BONUS: 9 team fouls] (Franz Antetokounmpo: 6 personal fouls) Franz Antetokounmpo FOULS OUT!   FT 1/1: GOOD Ayo McGrady makes 1/1 from the line.
Score: 107-119

[01:23] Substitution (Team_081): Franz Antetokounmpo OUT (stamina: 41) → Lamelo Wade IN (foul_out)

[01:12] Team_081 possession (Score: 107-119)
Bradley Leonard attempts a 3Pt. Contested by Desmond Irving (4.9 feet, ZONE). BRADLEY LEONARD MAKES IT! Assist: Lamelo Wade
Score: 110-119

[00:53] Team_012 possession (Score: 110-119)
Shaquille Booker attempts a 3Pt. Contested by Bradley Leonard (5.2 feet, ZONE). Shaquille Booker misses. Rebound secured by Lamelo Wade.

[00:39] Team_081 possession (Score: 110-119)
Vince Adebayo attempts a 3Pt. Contested by Shaquille Booker (5.6 feet, MAN). Vince Adebayo misses. Rebound secured by Paolo Durant.

[00:25] Team_012 possession (Score: 110-119)
Desmond Irving throws a bad pass out of bounds! TURNOVER! (dead ball)

[00:25] Substitution (Team_081): Bradley Leonard OUT → Julius Durant IN (stamina_rule2)

[00:25] Substitution (Team_081): Vince Adebayo OUT → Larry Adebayo IN (stamina_rule2)

[00:25] Substitution (Team_081): Bradley Sabonis OUT → Chris Holiday IN (stamina_rule2)

[00:25] Substitution (Team_012): RJ Nowitzki OUT → Jalen Barnes IN (stamina_rule2)

[00:25] Substitution (Team_012): Shaquille Booker OUT → Domantas Bird IN (stamina_rule2)

[00:25] Substitution (Team_012): Paolo Durant OUT → Jimmy Quickley IN (stamina_rule2)

[00:25] Substitution (Team_012): Ayo McGrady OUT → Karl Young IN (stamina_rule2)

[00:10] Team_081 possession (Score: 110-119)
Julius Durant drives and kicks out. Larry Adebayo attempts a 3Pt. Contested by Domantas Bird (5.1 feet, MAN). LARRY ADEBAYO MAKES IT! Assist: Chris Holiday
Score: 113-119

================================================================================
                              4TH QUARTER COMPLETE                              
================================================================================

4TH QUARTER SCORE: Team_081 39, Team_012 29

BOX SCORE:
================================================================================

Team_081
--------------------------------------------------------------------------------
Player                MIN  PTS  REB  AST  TO      FG   FG%      3P   3P%
--------------------------------------------------------------------------------
Dejounte Bane          25   13    0    3   0   5/6    83.3     0/0   0.0
Bradley Leonard        36    9    0    0   0   3/5    60.0     0/0   0.0
Franz Antetokounmpo    35    7    6    0   0   3/5    60.0     0/0   0.0
Bradley Sabonis        36    5    4    1   0   2/2   100.0     0/0   0.0
Larry Adebayo          13    3    0    0   0   1/1   100.0     0/0   0.0
Vince Adebayo          36    2    1    1   0   1/4    25.0     0/0   0.0
Lamelo Wade            14    0    1    1   0   0/0     0.0     0/0   0.0
Chris Holiday          13    0    0    1   0   0/0     0.0     0/0   0.0

TEAM: FG: 15/23 (65.2%), 3PT: 6/11 (54.5%), REB: 12 (4 off, 8 def), AST: 7, TO: 0
TEAM FOULS: 9 [Team_012 in BONUS]


Team_012
--------------------------------------------------------------------------------
Player                MIN  PTS  REB  AST  TO      FG   FG%      3P   3P%
--------------------------------------------------------------------------------
RJ Nowitzki            36   11    3    2   0   5/7    71.4     0/0   0.0
Ayo McGrady            36   10    1    0   0   4/4   100.0     0/0   0.0
Shaquille Booker       36    3    0    0   0   1/3    33.3     0/0   0.0
Paolo Durant           36    2    6    0   0   1/3    33.3     0/0   0.0
Desmond Irving         25    2    0    2   0   1/3    33.3     0/0   0.0

TEAM: FG: 12/20 (60.0%), 3PT: 2/7 (28.6%), REB: 10 (2 off, 8 def), AST: 4, TO: 2
TEAM FOULS: 5 [Team_081 in BONUS]

================================================================================

================================================================================
                               FULL GAME COMPLETE                               
================================================================================

FINAL SCORE: Team_081 113, Team_012 119

SCORING BY QUARTER:
--------------------------------------------------------------------------------
Team                     Q1     Q2     Q3     Q4    FINAL
--------------------------------------------------------------------------------
Team_081                 20     22     32     39      113
Team_012                 37     27     26     29      119
--------------------------------------------------------------------------------

FULL GAME BOX SCORE:
================================================================================

Team_081
--------------------------------------------------------------------------------
Player                MIN  PTS  REB  AST  TO      FG   FG%      3P   3P%      FT STL BLK
--------------------------------------------------------------------------------
Bradley Leonard        36   12    0    2   1   3/7    42.9   2/4    50.0   1/1     1   0
Vince Adebayo          36    7    5    5   0   5/12   41.7   1/7    14.3   1/1     0   0
Bradley Sabonis        36   21   12    1   3  10/14   71.4   2/3    66.7   3/3     2   1
Franz Antetokounmpo    35   23   12    2   1   8/11   72.7   1/2    50.0   5/6     1   0
Dejounte Bane          25   19    0    3   1   7/8    87.5   3/4    75.0   4/4     0   0
Julius Durant          24    9    0    0   3   5/9    55.6   1/3    33.3   0/0     1   0
Lamelo Wade            14    0    6    3   1   0/3     0.0   0/2     0.0   0/1     1   0
Larry Adebayo          13    6    2    3   0   1/2    50.0   1/2    50.0   0/0     0   0
Chris Holiday          13   10    0    1   0   4/6    66.7   2/3    66.7   0/0     0   0
D'Angelo Markkanen     12    3    0    1   2   2/4    50.0   0/1     0.0   1/2     0   0

TEAM: FG: 45/76 (59.2%), 3PT: 13/31 (41.9%), REB: 37 (11 off, 26 def), AST: 21, TO: 12


Team_012
--------------------------------------------------------------------------------
Player                MIN  PTS  REB  AST  TO      FG   FG%      3P   3P%      FT STL BLK
--------------------------------------------------------------------------------
RJ Nowitzki            36   27   11    3   3   9/14   64.3   3/6    50.0   8/9     0   0
Shaquille Booker       36   17    0    3   1   9/12   75.0   2/4    50.0   2/2     0   0
Paolo Durant           36   14   11    3   2   4/11   36.4   1/3    33.3   1/4     1   3
Ayo McGrady            36   15   10    2   1   6/7    85.7   1/1   100.0   2/2     1   0
Desmond Irving         25   10    0    3   3   5/8    62.5   3/6    50.0   7/7     0   0
Pascal Herro           24   11    0    2   1   5/7    71.4   1/2    50.0   4/4     0   0
Jalen Barnes           13    6    2    1   2   1/2    50.0   1/1   100.0   1/1     0   0
Domantas Bird          13    4    0    2   1   4/6    66.7   1/2    50.0   0/0     0   0
Jimmy Quickley         13    2    5    0   0   1/2    50.0   0/1     0.0   2/3     1   1
Karl Young             13    8    6    1   0   2/3    66.7   0/1     0.0   0/0     1   0

TEAM: FG: 47/73 (64.4%), 3PT: 13/27 (48.1%), REB: 45 (14 off, 31 def), AST: 20, TO: 14

================================================================================
