================================================================================
                        FULL GAME - Team_029 vs Team_040                        
================================================================================

================================================================================
                       1ST QUARTER - Team_029 vs Team_040                       
================================================================================

[12:00] Team_029 possession (Score: 0-0)
Giannis Banchero attempts a Midrange. Contested by Bam Gobert (4.5 feet, ZONE). Giannis Banchero misses. Rebound secured by Shaquille Bane.

[11:45] Team_040 possession (Score: 0-0)
Ayo Rose attempts a 3Pt. Contested by Giannis Banchero (4.2 feet, ZONE). Ayo Rose misses. Offensive rebound by Bam Gobert! Bam Gobert kicks it out.

[11:31] Team_040 possession (Score: 0-0)
Shaquille Bane attempts a 3Pt. Contested by Giannis Banchero (4.0 feet, ZONE). SHAQUILLE BANE MAKES IT! Assist: Bam Gobert
Score: 0-3

[11:16] Team_029 possession (Score: 0-3)
Paul Iverson attempts a 3Pt. Contested by Ayo Rose (4.8 feet, MAN). PAUL IVERSON MAKES IT! Assist: Scottie Bird
Score: 3-3

[11:02] Team_040 possession (Score: 3-3)
Ayo Rose drives to the basket... Ayo Rose throws a bad pass! Stolen by Paul Iverson! TURNOVER! (live ball)

[10:52] Team_029 possession (Score: 3-3)
Devin Butler attempts a Midrange. Contested by Bam Gobert (4.4 feet, MAN). Devin Butler misses. Rebound secured by Bam Gobert.

[10:42] Team_040 possession (Score: 3-3)
Carmelo Murray drives to the basket... FOUL! Offensive foul on Carmelo Murray! James Wall drew the charge! [Team fouls: 1] (Carmelo Murray: 1 personal fouls) TURNOVER! (dead ball)

[10:26] Team_029 possession (Score: 3-3)
Scottie Bird drives and kicks out. James Wall attempts a 3Pt. Contested by Ayo Rose (4.6 feet, ZONE). JAMES WALL MAKES IT! Assist: Giannis Banchero
Score: 6-3

[10:16] Team_040 possession (Score: 6-3)
Bam Gobert attempts a Midrange. Contested by Devin Butler (4.4 feet, MAN). Bam Gobert misses. Rebound secured by Giannis Banchero.

[09:59] Team_029 possession (Score: 6-3)
Scottie Bird makes the Layup and draws the foul on Shaquille Bane! And-1! Scottie Bird to the line for 1. [Team fouls: 2] (Shaquille Bane: 1 personal fouls)   FT 1/1: GOOD Scottie Bird makes 1/1 from the line.
Score: 9-3

[09:45] Team_040 possession (Score: 9-3)
Dirk Johnson attempts a Midrange. Contested by James Wall (2.9 feet, MAN). Dirk Johnson misses. Rebound secured by James Wall.

[09:31] Team_029 possession (Score: 9-3)
Paul Iverson attempts a 3Pt. Contested by Ayo Rose (4.8 feet, MAN). Paul Iverson misses. Offensive rebound by Devin Butler! Devin Butler kicks it out.

[09:19] Team_029 possession (Score: 9-3)
FOUL! Reach-in foul on Bam Gobert during the drive. [Team fouls: 3] No free throws, side out. (Bam Gobert: 1 personal fouls)

[09:05] Team_029 possession (Score: 9-3)
James Wall drives, Dirk Johnson stays with him. James Wall attempts a Dunk. Wide open! Dirk Johnson is 6.4 feet away. [MAN] James Wall misses. Rebound secured by Dirk Johnson.

[08:53] Team_040 possession (Score: 9-3)
Carmelo Murray drives, James Wall stays with him. Carmelo Murray attempts a Layup. Contested by James Wall (2.9 feet, ZONE). CARMELO MURRAY MAKES IT!
Score: 9-5

[08:36] Team_029 possession (Score: 9-5)
Giannis Banchero makes the Layup and draws the foul on Shaquille Bane! And-1! Giannis Banchero to the line for 1. [Team fouls: 4] (Shaquille Bane: 2 personal fouls)   FT 1/1: MISS Giannis Banchero makes 0/1 from the line. Rebound secured by Dirk Johnson.
Score: 11-5

[08:21] Team_040 possession (Score: 11-5)
Ayo Rose attempts a 3Pt. Contested by Paul Iverson (4.9 feet, MAN). Ayo Rose misses. Rebound secured by Devin Butler.

[08:08] Team_029 possession (Score: 11-5)
Devin Butler drives, Bam Gobert stays with him. Devin Butler attempts a Dunk. Contested by Bam Gobert (4.4 feet, MAN). Devin Butler misses. Rebound secured by Bam Gobert.

[07:50] Team_040 possession (Score: 11-5)
Ayo Rose attempts a 3Pt. Contested by Giannis Banchero (4.2 feet, ZONE). Ayo Rose misses. Offensive rebound by Dirk Johnson! Dirk Johnson kicks it out.

[07:31] Team_040 possession (Score: 11-5)
Shaquille Bane attempts a Midrange. Contested by Scottie Bird (3.5 feet, MAN). Shaquille Bane misses. Rebound secured by Devin Butler.

[07:19] Team_029 possession (Score: 11-5)
Devin Butler drives, picks up Bam Gobert. Help arrives from Shaquille Bane! Devin Butler attempts a Dunk. Contested by Shaquille Bane (4.4 feet, ZONE). DEVIN BUTLER MAKES IT! Assist: James Wall
Score: 13-5

[07:04] Team_040 possession (Score: 13-5)
Shaquille Bane attempts a 3Pt. Contested by Giannis Banchero (4.0 feet, ZONE). Shaquille Bane misses. Rebound secured by James Wall.

[06:51] Team_029 possession (Score: 13-5)
Giannis Banchero attempts a Layup. Contested by Carmelo Murray (5.0 feet, MAN). Giannis Banchero misses. Rebound secured by Bam Gobert.

[06:36] Team_040 possession (Score: 13-5)
Dirk Johnson attempts a 3Pt. Contested by Giannis Banchero (3.8 feet, ZONE). Dirk Johnson misses. Rebound secured by James Wall.

[06:19] Team_029 possession (Score: 13-5)
Giannis Banchero attempts a 3Pt. Contested by Ayo Rose (5.2 feet, ZONE). GIANNIS BANCHERO MAKES IT! Assist: Devin Butler
Score: 16-5

[06:02] Team_040 possession (Score: 16-5)
Dirk Johnson attempts a Midrange. Contested by James Wall (2.9 feet, MAN). Dirk Johnson misses. Rebound secured by Devin Butler.

[05:49] Team_029 possession (Score: 16-5)
James Wall attempts a 3Pt. Contested by Ayo Rose (5.1 feet, ZONE). JAMES WALL MAKES IT! Assist: Scottie Bird
Score: 19-5

[05:40] Team_040 possession (Score: 19-5)
Ayo Rose attempts a 3Pt. Contested by Paul Iverson (4.9 feet, MAN). AYO ROSE MAKES IT! Assist: Shaquille Bane
Score: 19-8

[05:22] Team_029 possession (Score: 19-8)
Giannis Banchero attempts a 3Pt. Contested by Carmelo Murray (5.0 feet, MAN). Giannis Banchero misses. Rebound secured by Shaquille Bane.

[05:07] Team_040 possession (Score: 19-8)
Ayo Rose drives, James Wall stays with him. Ayo Rose attempts a Dunk. Contested by James Wall (3.3 feet, ZONE). AYO ROSE MAKES IT! Assist: Bam Gobert
Score: 19-10

[04:52] Team_029 possession (Score: 19-10)
Giannis Banchero attempts a 3Pt. Contested by Ayo Rose (5.2 feet, ZONE). Giannis Banchero misses. Rebound secured by Shaquille Bane.

[04:34] Team_040 possession (Score: 19-10)
Shaquille Bane attempts a Midrange. Contested by Scottie Bird (3.6 feet, MAN). SHAQUILLE BANE MAKES IT! Assist: Carmelo Murray
Score: 19-12

[04:19] Team_029 possession (Score: 19-12)
Giannis Banchero attempts a Layup. Contested by Carmelo Murray (5.1 feet, MAN). Giannis Banchero misses. Offensive rebound by James Wall! James Wall puts it back in!
Score: 21-12

[04:06] Team_040 possession (Score: 21-12)
Ayo Rose attempts a 3Pt. Contested by Giannis Banchero (4.3 feet, ZONE). AYO ROSE MAKES IT! Assist: Shaquille Bane
Score: 21-15

[03:47] Team_029 possession (Score: 21-15)
James Wall attempts a Layup. Contested by Bam Gobert (4.6 feet, ZONE). JAMES WALL MAKES IT!
Score: 23-15

[03:34] Team_040 possession (Score: 23-15)
Bam Gobert attempts a 3Pt. Contested by Devin Butler (4.5 feet, MAN). Bam Gobert misses. Rebound secured by Giannis Banchero.

[03:20] Team_029 possession (Score: 23-15)
James Wall attempts a Layup. Contested by Bam Gobert (4.6 feet, ZONE). James Wall misses. Rebound secured by Shaquille Bane.

[03:06] Team_040 possession (Score: 23-15)
Ayo Rose attempts a 3Pt. BLOCKED BY PAUL IVERSON! Ball deflects out of bounds off Ayo Rose.

[02:54] Team_029 possession (Score: 23-15)
James Wall attempts a Midrange. Wide open! Dirk Johnson is 6.6 feet away. [MAN] JAMES WALL MAKES IT!
Score: 25-15

[02:43] Team_040 possession (Score: 25-15)
Carmelo Murray attempts a 3Pt. Contested by Giannis Banchero (4.1 feet, MAN). Carmelo Murray misses. Offensive rebound by Dirk Johnson! Dirk Johnson kicks it out.

[02:30] Team_040 possession (Score: 25-15)
Carmelo Murray attempts a 3Pt. Contested by Giannis Banchero (4.2 feet, MAN). Carmelo Murray misses. Rebound secured by Devin Butler.

[02:14] Team_029 possession (Score: 25-15)
Giannis Banchero loses the ball! Stripped by Carmelo Murray! TURNOVER! (live ball)

[01:57] Team_040 possession (Score: 25-15)
Carmelo Murray drives to the basket... Carmelo Murray commits a violation (traveling/carry)! TURNOVER! (dead ball)

[01:57] Substitution (Team_029): Paul Iverson OUT → Immanuel Irving IN (stamina_rule2)

[01:57] Substitution (Team_029): Scottie Bird OUT → Bones Carter IN (stamina_rule2)

[01:57] Substitution (Team_029): Giannis Banchero OUT → Pau Anthony IN (stamina_rule2)

[01:57] Substitution (Team_029): James Wall OUT → Derrick Rozier IN (stamina_rule2)

[01:57] Substitution (Team_029): Devin Butler OUT → Shai Ball IN (stamina_rule2)

[01:57] Substitution (Team_040): Ayo Rose OUT → Cole O'Neal IN (stamina_rule2)

[01:57] Substitution (Team_040): Shaquille Bane OUT → Tracy Middleton IN (stamina_rule2)

[01:57] Substitution (Team_040): Carmelo Murray OUT → Klay Leonard IN (stamina_rule2)

[01:57] Substitution (Team_040): Dirk Johnson OUT → RJ Curry IN (stamina_rule2)

[01:57] Substitution (Team_040): Bam Gobert OUT → Josh Banchero IN (stamina_rule2)

[01:41] Team_029 possession (Score: 25-15)
Immanuel Irving makes the 3Pt and draws the foul on Cole O'Neal! And-1! Immanuel Irving to the line for 1. [BONUS: 5 team fouls] (Cole O'Neal: 1 personal fouls)   FT 1/1: GOOD Immanuel Irving makes 1/1 from the line.
Score: 29-15

[01:26] Team_040 possession (Score: 29-15)
Cole O'Neal attempts a 3Pt. Contested by Pau Anthony (3.7 feet, ZONE). Cole O'Neal misses. Rebound secured by Pau Anthony.

[01:17] Team_029 possession (Score: 29-15)
Pau Anthony attempts a Midrange. Contested by Klay Leonard (5.3 feet, MAN). PAU ANTHONY MAKES IT!
Score: 31-15

[01:05] Team_040 possession (Score: 31-15)
Klay Leonard drives, Pau Anthony stays with him. Klay Leonard attempts a Layup. Contested by Pau Anthony (3.5 feet, MAN). KLAY LEONARD MAKES IT! Assist: Cole O'Neal
Score: 31-17

[00:50] Team_029 possession (Score: 31-17)
Shai Ball attempts a Midrange. Wide open! Josh Banchero is 6.2 feet away. [MAN] Shai Ball misses. FOUL! Loose ball foul on Josh Banchero during the rebound battle. [IN THE BONUS! 6 team fouls] Pau Anthony to the line for 2 free throws. (Josh Banchero: 1 personal fouls)   FT 1/2: GOOD   FT 2/2: MISS Pau Anthony makes 1/2 from the line. Rebound secured by Klay Leonard.
Score: 32-17

[00:35] Team_040 possession (Score: 32-17)
Josh Banchero drives, picks up Shai Ball. Help arrives from Bones Carter! Josh Banchero attempts a Dunk. Contested by Bones Carter (4.2 feet, MAN). JOSH BANCHERO MAKES IT!
Score: 32-19

[00:21] Team_029 possession (Score: 32-19)
Pau Anthony attempts a 3Pt. Contested by RJ Curry (5.2 feet, ZONE). Pau Anthony misses. Rebound secured by Klay Leonard.

[00:05] Team_040 possession (Score: 32-19)
FOUL! Shooting foul on Immanuel Irving. Cole O'Neal to the line for 2 free throws. [Team fouls: 1] (Immanuel Irving: 1 personal fouls)   FT 1/2: GOOD   FT 2/2: GOOD Cole O'Neal makes 2/2 from the line.
Score: 32-21

================================================================================
                              1ST QUARTER COMPLETE                              
================================================================================

1ST QUARTER SCORE: Team_029 32, Team_040 21

BOX SCORE:
================================================================================

Team_029
--------------------------------------------------------------------------------
Player                MIN  PTS  REB  AST  TO      FG   FG%      3P   3P%
--------------------------------------------------------------------------------
James Wall             10   12    4    1   0   5/7    71.4     0/0   0.0
Immanuel Irving         2    4    0    0   0   1/1   100.0     0/0   0.0
Giannis Banchero       10    3    2    1   0   1/6    16.7     0/0   0.0
Paul Iverson           10    3    0    0   0   1/1   100.0     0/0   0.0
Scottie Bird           10    3    0    2   0   1/1   100.0     0/0   0.0
Devin Butler           10    2    5    1   0   1/3    33.3     0/0   0.0
Pau Anthony             2    2    1    0   0   1/2    50.0     0/0   0.0
Shai Ball               2    0    0    0   0   0/1     0.0     0/0   0.0

TEAM: FG: 11/22 (50.0%), 3PT: 4/7 (57.1%), REB: 13 (3 off, 10 def), AST: 5, TO: 1
TEAM FOULS: 1


Team_040
--------------------------------------------------------------------------------
Player                MIN  PTS  REB  AST  TO      FG   FG%      3P   3P%
--------------------------------------------------------------------------------
Ayo Rose               10    8    0    0   0   3/5    60.0     0/0   0.0
Shaquille Bane         10    5    4    2   0   2/4    50.0     0/0   0.0
Carmelo Murray         10    2    0    1   0   1/2    50.0     0/0   0.0
Cole O'Neal             2    2    0    1   0   1/2    50.0     0/0   0.0
Klay Leonard            2    2    2    0   0   1/1   100.0     0/0   0.0
Josh Banchero           2    2    0    0   0   1/1   100.0     0/0   0.0
Bam Gobert             10    0    4    2   0   0/2     0.0     0/0   0.0
Dirk Johnson           10    0    4    0   0   0/3     0.0     0/0   0.0

TEAM: FG: 9/20 (45.0%), 3PT: 3/10 (30.0%), REB: 13 (3 off, 10 def), AST: 6, TO: 3
TEAM FOULS: 6 [Team_029 in BONUS]

================================================================================

================================================================================
                       2ND QUARTER - Team_029 vs Team_040                       
================================================================================

[12:00] Team_029 possession (Score: 32-21)
James Wall drives and kicks out. Devin Butler attempts a 3Pt. Contested by Ayo Rose (4.7 feet, ZONE). DEVIN BUTLER MAKES IT! Assist: James Wall
Score: 35-21

[11:45] Team_040 possession (Score: 35-21)
Bam Gobert attempts a Layup. Contested by James Wall (2.9 feet, ZONE). Bam Gobert misses. Offensive rebound by Bam Gobert! Bam Gobert kicks it out.

[11:27] Team_040 possession (Score: 35-21)
Ayo Rose attempts a Midrange. BLOCKED BY PAUL IVERSON! Ball is loose! Rebound secured by James Wall.

[11:13] Team_029 possession (Score: 35-21)
James Wall attempts a 3Pt. Wide open! Dirk Johnson is 6.5 feet away. [MAN] James Wall misses. Offensive rebound by James Wall! James Wall puts it back in!
Score: 37-21

[11:00] Team_040 possession (Score: 37-21)
Bam Gobert drives to the basket... Bam Gobert throws a bad pass! Stolen by Devin Butler! TURNOVER! (live ball)

[10:47] Team_029 possession (Score: 37-21)
Giannis Banchero commits a violation (traveling/carry)! TURNOVER! (dead ball)

[10:33] Team_040 possession (Score: 37-21)
Carmelo Murray attempts a 3Pt. Contested by Giannis Banchero (4.1 feet, ZONE). Carmelo Murray misses. Rebound secured by Devin Butler.

[10:16] Team_029 possession (Score: 37-21)
FOUL! Shooting foul on Ayo Rose. Paul Iverson to the line for 2 free throws. [Team fouls: 1] (Ayo Rose: 1 personal fouls)   FT 1/2: GOOD   FT 2/2: GOOD Paul Iverson makes 2/2 from the line.
Score: 39-21

[10:05] Team_040 possession (Score: 39-21)
Shaquille Bane attempts a Layup. Contested by James Wall (3.3 feet, ZONE). SHAQUILLE BANE MAKES IT! Assist: Bam Gobert
Score: 39-23

[09:52] Team_029 possession (Score: 39-23)
James Wall drives, picks up Bam Gobert. Help arrives from Shaquille Bane! James Wall attempts a Layup. Contested by Shaquille Bane (4.7 feet, ZONE). JAMES WALL MAKES IT! Assist: Giannis Banchero
Score: 41-23

[09:38] Team_040 possession (Score: 41-23)
FOUL! Reach-in foul on James Wall during the drive. [Team fouls: 1] No free throws, side out. (James Wall: 1 personal fouls)

[09:24] Team_040 possession (Score: 41-23)
Shaquille Bane attempts a 3Pt. Contested by Giannis Banchero (4.4 feet, ZONE). Shaquille Bane misses. Rebound secured by Giannis Banchero.

[09:08] Team_029 possession (Score: 41-23)
Scottie Bird attempts a 3Pt. Wide open! Dirk Johnson is 6.4 feet away. [ZONE] Scottie Bird misses. Rebound secured by Dirk Johnson.

[08:56] Team_040 possession (Score: 41-23)
Shaquille Bane attempts a 3Pt. Contested by Giannis Banchero (4.5 feet, ZONE). Shaquille Bane misses. Rebound secured by Giannis Banchero.

[08:40] Team_029 possession (Score: 41-23)
Paul Iverson attempts a 3Pt. Contested by Ayo Rose (5.2 feet, MAN). Paul Iverson misses. Rebound secured by Dirk Johnson.

[08:25] Team_040 possession (Score: 41-23)
Shaquille Bane attempts a Layup. Contested by Scottie Bird (4.0 feet, MAN). SHAQUILLE BANE MAKES IT! Assist: Dirk Johnson
Score: 41-25

[08:08] Team_029 possession (Score: 41-25)
Scottie Bird attempts a Midrange. Contested by Shaquille Bane (5.3 feet, MAN). Scottie Bird misses. Offensive rebound by Devin Butler! Devin Butler kicks it out.

[07:55] Team_029 possession (Score: 41-25)
Paul Iverson attempts a 3Pt. Wide open! Dirk Johnson is 6.4 feet away. [ZONE] PAUL IVERSON MAKES IT! Assist: Giannis Banchero
Score: 44-25

[07:44] Team_040 possession (Score: 44-25)
Bam Gobert attempts a Midrange. Contested by Devin Butler (4.9 feet, MAN). Bam Gobert misses. Rebound secured by Devin Butler.

[07:28] Team_029 possession (Score: 44-25)
Devin Butler makes the Dunk and draws the foul on Shaquille Bane! And-1! Devin Butler to the line for 1. [Team fouls: 2] (Shaquille Bane: 1 personal fouls)   FT 1/1: MISS Devin Butler makes 0/1 from the line. Rebound secured by Bam Gobert.
Score: 46-25

[07:15] Team_040 possession (Score: 46-25)
FOUL! Holding foul on Scottie Bird. [Team fouls: 2] No free throws, side out. (Scottie Bird: 1 personal fouls)

[07:02] Team_040 possession (Score: 46-25)
Dirk Johnson attempts a 3Pt. Contested by James Wall (3.4 feet, MAN). Dirk Johnson misses. Rebound secured by James Wall.

[06:47] Team_029 possession (Score: 46-25)
FOUL! Shooting foul on Bam Gobert. Paul Iverson to the line for 2 free throws. [Team fouls: 3] (Bam Gobert: 1 personal fouls)   FT 1/2: GOOD   FT 2/2: GOOD Paul Iverson makes 2/2 from the line.
Score: 48-25

[06:35] Team_040 possession (Score: 48-25)
FOUL! Shooting foul on Devin Butler. Bam Gobert to the line for 2 free throws. [Team fouls: 3] (Devin Butler: 1 personal fouls)   FT 1/2: MISS   FT 2/2: GOOD Bam Gobert makes 1/2 from the line.
Score: 48-26

[06:22] Team_029 possession (Score: 48-26)
James Wall attempts a Midrange. Wide open! Dirk Johnson is 6.9 feet away. [MAN] James Wall misses. Rebound secured by Shaquille Bane.

[06:06] Team_040 possession (Score: 48-26)
FOUL! Shooting foul on James Wall. Dirk Johnson to the line for 2 free throws. [Team fouls: 4] (James Wall: 2 personal fouls)   FT 1/2: GOOD   FT 2/2: GOOD Dirk Johnson makes 2/2 from the line.
Score: 48-28

[05:49] Team_029 possession (Score: 48-28)
Scottie Bird attempts a 3Pt. Contested by Shaquille Bane (5.6 feet, MAN). Scottie Bird misses. Rebound secured by Dirk Johnson.

[05:34] Team_040 possession (Score: 48-28)
Ayo Rose attempts a Midrange. Contested by Paul Iverson (5.5 feet, MAN). AYO ROSE MAKES IT! Assist: Shaquille Bane
Score: 48-30

[05:22] Team_029 possession (Score: 48-30)
James Wall attempts a Midrange. Wide open! Dirk Johnson is 7.0 feet away. [MAN] James Wall misses. Rebound secured by Shaquille Bane.

[05:08] Team_040 possession (Score: 48-30)
FOUL! Shooting foul on Scottie Bird. Shaquille Bane to the line for 3 free throws. [BONUS: 5 team fouls] (Scottie Bird: 2 personal fouls)   FT 1/3: MISS   FT 2/3: GOOD   FT 3/3: GOOD Shaquille Bane makes 2/3 from the line.
Score: 48-32

[04:56] Team_029 possession (Score: 48-32)
Giannis Banchero attempts a 3Pt. Contested by Carmelo Murray (5.7 feet, MAN). Giannis Banchero misses. Rebound secured by Shaquille Bane.

[04:40] Team_040 possession (Score: 48-32)
Bam Gobert attempts a Midrange. Contested by Devin Butler (5.3 feet, MAN). Bam Gobert misses. Rebound secured by Giannis Banchero.

[04:27] Team_029 possession (Score: 48-32)
Scottie Bird attempts a 3Pt. Contested by Ayo Rose (5.8 feet, ZONE). SCOTTIE BIRD MAKES IT! Assist: Paul Iverson
Score: 51-32

[04:13] Team_040 possession (Score: 51-32)
Shaquille Bane attempts a Layup. Contested by Scottie Bird (4.7 feet, MAN). SHAQUILLE BANE MAKES IT! Assist: Ayo Rose
Score: 51-34

[04:01] Team_029 possession (Score: 51-34)
Scottie Bird attempts a 3Pt. Contested by Ayo Rose (5.9 feet, ZONE). SCOTTIE BIRD MAKES IT! Assist: James Wall
Score: 54-34

[03:45] Team_040 possession (Score: 54-34)
Bam Gobert attempts a Layup. Contested by James Wall (3.9 feet, ZONE). BAM GOBERT MAKES IT! Assist: Shaquille Bane
Score: 54-36

[03:33] Team_029 possession (Score: 54-36)
James Wall attempts a Midrange. Wide open! Dirk Johnson is 7.1 feet away. [MAN] James Wall misses. Offensive rebound by James Wall! James Wall puts it back in!
Score: 56-36

[03:17] Team_040 possession (Score: 56-36)
FOUL! Reach-in foul on James Wall during the drive. [IN THE BONUS! 6 team fouls] Bam Gobert to the line for 2 free throws. (James Wall: 3 personal fouls)   FT 1/2: GOOD   FT 2/2: MISS Bam Gobert makes 1/2 from the line. Rebound secured by James Wall.
Score: 56-37

[03:03] Team_029 possession (Score: 56-37)
James Wall attempts a Midrange. Wide open! Dirk Johnson is 7.2 feet away. [MAN] James Wall misses. Offensive rebound by James Wall! James Wall's putback is no good. Offensive rebound by James Wall! James Wall kicks it out.

[02:45] Team_029 possession (Score: 56-37)
Paul Iverson attempts a 3Pt. Contested by Ayo Rose (6.0 feet, MAN). Paul Iverson misses. Offensive rebound by Devin Butler! Devin Butler kicks it out.

[02:27] Team_029 possession (Score: 56-37)
James Wall drives, picks up Dirk Johnson. Help arrives from Shaquille Bane! James Wall attempts a Dunk. Wide open! Shaquille Bane is 7.2 feet away. [MAN] James Wall misses. Rebound secured by Bam Gobert.

[02:13] Team_040 possession (Score: 56-37)
Ayo Rose attempts a 3Pt. Contested by James Wall (4.4 feet, ZONE). Ayo Rose misses. Rebound secured by James Wall.

[02:01] Team_029 possession (Score: 56-37)
Devin Butler drives and kicks out. Devin Butler attempts a Midrange. Contested by Shaquille Bane (6.0 feet, ZONE). Devin Butler misses. Rebound secured by Shaquille Bane.

[01:46] Team_040 possession (Score: 56-37)
Shaquille Bane attempts a Layup. Contested by James Wall (4.3 feet, ZONE). Shaquille Bane misses. Rebound secured by James Wall.

[01:32] Team_029 possession (Score: 56-37)
James Wall drives, Dirk Johnson stays with him. James Wall attempts a Dunk. Wide open! Dirk Johnson is 7.3 feet away. [MAN] JAMES WALL MAKES IT! Assist: Devin Butler
Score: 58-37

[01:16] Team_040 possession (Score: 58-37)
Ayo Rose drives, picks up Paul Iverson. Help arrives from Scottie Bird! Ayo Rose attempts a Layup. Contested by Scottie Bird (6.0 feet, MAN). Ayo Rose misses. Offensive rebound by Dirk Johnson! Dirk Johnson kicks it out.

[01:05] Team_040 possession (Score: 58-37)
Ayo Rose attempts a 3Pt. Wide open! Paul Iverson is 6.0 feet away. [ZONE] Ayo Rose misses. Rebound secured by James Wall.

[00:49] Team_029 possession (Score: 58-37)
James Wall attempts a 3Pt. Wide open! Ayo Rose is 6.5 feet away. [ZONE] James Wall misses. Rebound secured by Bam Gobert.

[00:32] Team_040 possession (Score: 58-37)
FOUL! Shooting foul on Scottie Bird. Shaquille Bane to the line for 2 free throws. [BONUS: 7 team fouls] (Scottie Bird: 3 personal fouls)   FT 1/2: GOOD   FT 2/2: GOOD Shaquille Bane makes 2/2 from the line.
Score: 58-39

[00:19] Team_029 possession (Score: 58-39)
Paul Iverson attempts a 3Pt. Wide open! Ayo Rose is 6.3 feet away. [ZONE] PAUL IVERSON MAKES IT! Assist: Devin Butler
Score: 61-39

[00:05] Team_040 possession (Score: 61-39)
Shaquille Bane attempts a Layup. Contested by Scottie Bird (5.3 feet, MAN). SHAQUILLE BANE MAKES IT! Assist: Bam Gobert
Score: 61-41

================================================================================
                              2ND QUARTER COMPLETE                              
================================================================================

2ND QUARTER SCORE: Team_029 29, Team_040 20

BOX SCORE:
================================================================================

Team_029
--------------------------------------------------------------------------------
Player                MIN  PTS  REB  AST  TO      FG   FG%      3P   3P%
--------------------------------------------------------------------------------
Paul Iverson           22   10    0    1   0   4/5    80.0     0/0   0.0
James Wall             22    8    9    2   0   4/8    50.0     0/0   0.0
Scottie Bird           22    6    0    0   0   2/4    50.0     0/0   0.0
Devin Butler           22    3    4    2   0   1/3    33.3     0/0   0.0
Giannis Banchero       22    0    3    2   0   0/1     0.0     0/0   0.0

TEAM: FG: 11/21 (52.4%), 3PT: 5/10 (50.0%), REB: 16 (5 off, 11 def), AST: 7, TO: 1
TEAM FOULS: 7 [Team_040 in BONUS]


Team_040
--------------------------------------------------------------------------------
Player                MIN  PTS  REB  AST  TO      FG   FG%      3P   3P%
--------------------------------------------------------------------------------
Shaquille Bane         22   12    4    2   0   6/9    66.7     0/0   0.0
Bam Gobert             22    3    4    2   0   2/5    40.0     0/0   0.0
Ayo Rose               22    2    0    1   0   1/4    25.0     0/0   0.0
Dirk Johnson           22    2    4    1   0   1/2    50.0     0/0   0.0
Carmelo Murray         22    0    0    0   0   0/1     0.0     0/0   0.0

TEAM: FG: 10/21 (47.6%), 3PT: 1/7 (14.3%), REB: 12 (2 off, 10 def), AST: 6, TO: 1
TEAM FOULS: 4

================================================================================

================================================================================
                       3RD QUARTER - Team_029 vs Team_040                       
================================================================================

[12:00] Team_029 possession (Score: 61-41)
Paul Iverson loses control! Ball rolls out of bounds! TURNOVER! (dead ball)

[11:44] Team_040 possession (Score: 61-41)
Dirk Johnson drives, James Wall stays with him. Dirk Johnson attempts a Layup. Contested by James Wall (2.9 feet, ZONE). DIRK JOHNSON MAKES IT! Assist: Shaquille Bane
Score: 61-43

[11:31] Team_029 possession (Score: 61-43)
Devin Butler drives, Bam Gobert stays with him. Devin Butler attempts a Dunk. Contested by Bam Gobert (4.4 feet, MAN). DEVIN BUTLER MAKES IT!
Score: 63-43

[11:21] Team_040 possession (Score: 63-43)
Bam Gobert makes the Layup and draws the foul on Devin Butler! And-1! Bam Gobert to the line for 1. [Team fouls: 1] (Devin Butler: 1 personal fouls)   FT 1/1: GOOD Bam Gobert makes 1/1 from the line.
Score: 63-46

[11:04] Team_029 possession (Score: 63-46)
Paul Iverson attempts a Midrange. Wide open! Dirk Johnson is 6.0 feet away. [ZONE] PAUL IVERSON MAKES IT! Assist: Devin Butler
Score: 65-46

[10:51] Team_040 possession (Score: 65-46)
Dirk Johnson loses the ball! Stripped by James Wall! TURNOVER! (live ball)

[10:39] Team_029 possession (Score: 65-46)
Paul Iverson drives and kicks out. James Wall attempts a 3Pt. Contested by Ayo Rose (4.6 feet, ZONE). James Wall misses. Rebound secured by Shaquille Bane.

[10:26] Team_040 possession (Score: 65-46)
FOUL! Offensive foul on Dirk Johnson! James Wall drew the charge! [Team fouls: 1] (Dirk Johnson: 1 personal fouls) TURNOVER! (dead ball)

[10:15] Team_029 possession (Score: 65-46)
FOUL! Shooting foul on Dirk Johnson. James Wall to the line for 2 free throws. [Team fouls: 2] (Dirk Johnson: 2 personal fouls)   FT 1/2: GOOD   FT 2/2: GOOD James Wall makes 2/2 from the line.
Score: 67-46

[10:02] Team_040 possession (Score: 67-46)
Carmelo Murray attempts a Layup. Contested by Giannis Banchero (3.8 feet, MAN). Carmelo Murray misses. Rebound secured by Giannis Banchero.

[09:45] Team_029 possession (Score: 67-46)
James Wall attempts a 3Pt. Contested by Ayo Rose (5.1 feet, ZONE). James Wall misses. Offensive rebound by Devin Butler! Devin Butler kicks it out.

[09:29] Team_029 possession (Score: 67-46)
Devin Butler drives, picks up Bam Gobert. Help arrives from Shaquille Bane! Devin Butler attempts a Dunk. Contested by Shaquille Bane (4.4 feet, MAN). DEVIN BUTLER MAKES IT!
Score: 69-46

[09:14] Team_040 possession (Score: 69-46)
Dirk Johnson attempts a 3Pt. Contested by James Wall (2.9 feet, MAN). Dirk Johnson misses. Offensive rebound by Dirk Johnson! Dirk Johnson kicks it out.

[09:03] Team_040 possession (Score: 69-46)
Ayo Rose attempts a Layup. Contested by Paul Iverson (4.9 feet, MAN). AYO ROSE MAKES IT! Assist: Dirk Johnson
Score: 69-48

[08:50] Team_029 possession (Score: 69-48)
Scottie Bird makes the Dunk and draws the foul on Shaquille Bane! And-1! Scottie Bird to the line for 1. [Team fouls: 3] (Shaquille Bane: 1 personal fouls)   FT 1/1: MISS Scottie Bird makes 0/1 from the line. Rebound secured by Bam Gobert.
Score: 71-48

[08:40] Team_040 possession (Score: 71-48)
Bam Gobert attempts a 3Pt. Contested by Giannis Banchero (3.8 feet, ZONE). Bam Gobert misses. Rebound secured by Devin Butler.

[08:26] Team_029 possession (Score: 71-48)
Paul Iverson drives, Ayo Rose stays with him. Paul Iverson attempts a Dunk. Contested by Ayo Rose (4.8 feet, MAN). Paul Iverson misses. Rebound secured by Dirk Johnson.

[08:13] Team_040 possession (Score: 71-48)
Carmelo Murray attempts a 3Pt. Contested by Giannis Banchero (3.8 feet, ZONE). Carmelo Murray misses. Rebound secured by James Wall.

[07:55] Team_029 possession (Score: 71-48)
James Wall attempts a Midrange. Wide open! Dirk Johnson is 6.4 feet away. [MAN] JAMES WALL MAKES IT! Assist: Scottie Bird
Score: 73-48

[07:44] Team_040 possession (Score: 73-48)
Ayo Rose attempts a Midrange. Contested by Paul Iverson (4.9 feet, MAN). Ayo Rose misses. Rebound secured by James Wall.

[07:28] Team_029 possession (Score: 73-48)
Giannis Banchero drives and kicks out. Devin Butler attempts a 3Pt. Contested by Ayo Rose (4.6 feet, ZONE). Devin Butler misses. Rebound secured by Bam Gobert.

[07:12] Team_040 possession (Score: 73-48)
Carmelo Murray attempts a 3Pt. Contested by Giannis Banchero (3.8 feet, ZONE). CARMELO MURRAY MAKES IT! Assist: Dirk Johnson
Score: 73-51

[06:57] Team_029 possession (Score: 73-51)
Devin Butler attempts a Midrange. Contested by Bam Gobert (4.4 feet, MAN). Devin Butler misses. Rebound secured by Shaquille Bane.

[06:44] Team_040 possession (Score: 73-51)
Carmelo Murray attempts a Midrange. Contested by James Wall (2.9 feet, ZONE). Carmelo Murray misses. Rebound secured by James Wall.

[06:33] Team_029 possession (Score: 73-51)
FOUL! Holding foul on Carmelo Murray. [Team fouls: 4] No free throws, side out. (Carmelo Murray: 1 personal fouls)

[06:20] Team_029 possession (Score: 73-51)
Devin Butler drives, picks up Bam Gobert. Help arrives from Shaquille Bane! Devin Butler attempts a Layup. Contested by Shaquille Bane (4.4 feet, ZONE). DEVIN BUTLER MAKES IT! Assist: Giannis Banchero
Score: 75-51

[06:07] Team_040 possession (Score: 75-51)
Shaquille Bane attempts a Midrange. Contested by Scottie Bird (3.5 feet, ZONE). SHAQUILLE BANE MAKES IT! Assist: Bam Gobert
Score: 75-53

[05:50] Team_029 possession (Score: 75-53)
Paul Iverson drives to the basket... Paul Iverson throws a bad pass! Stolen by Ayo Rose! TURNOVER! (live ball)

[05:34] Team_040 possession (Score: 75-53)
Ayo Rose attempts a 3Pt. Contested by Paul Iverson (4.9 feet, MAN). Ayo Rose misses. Rebound secured by Devin Butler.

[05:22] Team_029 possession (Score: 75-53)
Devin Butler attempts a Midrange. Contested by Bam Gobert (4.4 feet, MAN). Devin Butler misses. Rebound secured by Bam Gobert.

[05:10] Team_040 possession (Score: 75-53)
Shaquille Bane attempts a 3Pt. Contested by Paul Iverson (4.8 feet, ZONE). Shaquille Bane misses. Rebound secured by James Wall.

[04:58] Team_029 possession (Score: 75-53)
James Wall attempts a Midrange. Contested by Shaquille Bane (5.3 feet, ZONE). JAMES WALL MAKES IT! Assist: Giannis Banchero
Score: 77-53

[04:44] Team_040 possession (Score: 77-53)
Carmelo Murray attempts a 3Pt. Contested by Paul Iverson (4.6 feet, ZONE). Carmelo Murray misses. Rebound secured by Devin Butler.

[04:29] Team_029 possession (Score: 77-53)
Giannis Banchero attempts a 3Pt. Contested by Carmelo Murray (5.1 feet, MAN). GIANNIS BANCHERO MAKES IT! Assist: Scottie Bird
Score: 80-53

[04:13] Team_040 possession (Score: 80-53)
FOUL! Shooting foul on Giannis Banchero. Shaquille Bane to the line for 2 free throws. [Team fouls: 2] (Giannis Banchero: 1 personal fouls)   FT 1/2: GOOD   FT 2/2: MISS Shaquille Bane makes 1/2 from the line. Rebound secured by Devin Butler.
Score: 80-54

[04:02] Team_029 possession (Score: 80-54)
FOUL! Offensive foul on James Wall! Dirk Johnson drew the charge! [Team fouls: 3] (James Wall: 1 personal fouls) TURNOVER! (dead ball)

[03:46] Team_040 possession (Score: 80-54)
Ayo Rose attempts a 3Pt. Contested by Giannis Banchero (4.4 feet, ZONE). Ayo Rose misses. Rebound secured by Devin Butler.

[03:30] Team_029 possession (Score: 80-54)
James Wall drives, picks up Bam Gobert. Help arrives from Shaquille Bane! James Wall attempts a Layup. Contested by Shaquille Bane (4.6 feet, ZONE). JAMES WALL MAKES IT!
Score: 82-54

[03:19] Team_040 possession (Score: 82-54)
Ayo Rose makes the Layup and draws the foul on Paul Iverson! And-1! Ayo Rose to the line for 1. [Team fouls: 4] (Paul Iverson: 1 personal fouls)   FT 1/1: GOOD Ayo Rose makes 1/1 from the line.
Score: 82-57

[03:07] Team_029 possession (Score: 82-57)
James Wall commits a violation (traveling/carry)! TURNOVER! (dead ball)

[03:07] Substitution (Team_029): Scottie Bird OUT → Bones Carter IN (stamina_rule2)

[03:07] Substitution (Team_029): Giannis Banchero OUT → Pau Anthony IN (stamina_rule2)

[03:07] Substitution (Team_029): Devin Butler OUT → Shai Ball IN (stamina_rule2)

[03:07] Substitution (Team_040): Ayo Rose OUT → Cole O'Neal IN (stamina_rule2)

[03:07] Substitution (Team_040): Shaquille Bane OUT → Tracy Middleton IN (stamina_rule2)

[03:07] Substitution (Team_040): Carmelo Murray OUT → Klay Leonard IN (stamina_rule2)

[03:07] Substitution (Team_040): Dirk Johnson OUT → RJ Curry IN (stamina_rule2)

[03:07] Substitution (Team_040): Bam Gobert OUT → Josh Banchero IN (stamina_rule2)

[02:51] Team_040 possession (Score: 82-57)
RJ Curry attempts a 3Pt. Contested by Pau Anthony (3.5 feet, ZONE). RJ Curry misses. Rebound secured by Shai Ball.

[02:36] Team_029 possession (Score: 82-57)
Shai Ball attempts a Midrange. Contested by Klay Leonard (5.2 feet, ZONE). SHAI BALL MAKES IT!
Score: 84-57

[02:21] Team_040 possession (Score: 84-57)
RJ Curry makes the Layup and draws the foul on James Wall! And-1! RJ Curry to the line for 1. [BONUS: 5 team fouls] (James Wall: 2 personal fouls)   FT 1/1: GOOD RJ Curry makes 1/1 from the line.
Score: 84-60

[02:08] Team_029 possession (Score: 84-60)
Bones Carter throws a bad pass out of bounds! TURNOVER! (dead ball)

[02:08] Substitution (Team_029): Paul Iverson OUT → Immanuel Irving IN (stamina_rule2)

[02:08] Substitution (Team_029): James Wall OUT → Derrick Rozier IN (stamina_rule2)

[01:52] Team_040 possession (Score: 84-60)
FOUL! Shooting foul on Pau Anthony. Klay Leonard to the line for 2 free throws. [BONUS: 6 team fouls] (Pau Anthony: 1 personal fouls)   FT 1/2: GOOD   FT 2/2: GOOD Klay Leonard makes 2/2 from the line.
Score: 84-62

[01:39] Team_029 possession (Score: 84-62)
Immanuel Irving drives, Josh Banchero stays with him. Immanuel Irving attempts a Layup. Wide open! Josh Banchero is 6.4 feet away. [ZONE] IMMANUEL IRVING MAKES IT!
Score: 86-62

[01:20] Team_040 possession (Score: 86-62)
FOUL! Reach-in foul on Shai Ball during the drive. [IN THE BONUS! 7 team fouls] Josh Banchero to the line for 2 free throws. (Shai Ball: 1 personal fouls)   FT 1/2: GOOD   FT 2/2: GOOD Josh Banchero makes 2/2 from the line.
Score: 86-64

[01:04] Team_029 possession (Score: 86-64)
Derrick Rozier drives, RJ Curry stays with him. Derrick Rozier attempts a Layup. Contested by RJ Curry (5.2 feet, MAN). DERRICK ROZIER MAKES IT! Assist: Bones Carter
Score: 88-64

[00:51] Team_040 possession (Score: 88-64)
Josh Banchero attempts a Midrange. Contested by Derrick Rozier (4.4 feet, ZONE). Josh Banchero misses. Rebound secured by Pau Anthony.

[00:35] Team_029 possession (Score: 88-64)
Immanuel Irving attempts a Layup. Wide open! Cole O'Neal is 7.0 feet away. [MAN] IMMANUEL IRVING MAKES IT! Assist: Derrick Rozier
Score: 90-64

[00:24] Team_040 possession (Score: 90-64)
Klay Leonard drives to the basket... Klay Leonard throws a bad pass out of bounds! TURNOVER! (dead ball)

[00:09] Team_029 possession (Score: 90-64)
Bones Carter attempts a 3Pt. Contested by RJ Curry (5.0 feet, ZONE). Bones Carter misses. Rebound secured by Josh Banchero.

================================================================================
                              3RD QUARTER COMPLETE                              
================================================================================

3RD QUARTER SCORE: Team_029 29, Team_040 23

BOX SCORE:
================================================================================

Team_029
--------------------------------------------------------------------------------
Player                MIN  PTS  REB  AST  TO      FG   FG%      3P   3P%
--------------------------------------------------------------------------------
James Wall             33    8    4    0   0   4/4   100.0     0/0   0.0
Devin Butler           32    6    6    1   0   3/5    60.0     0/0   0.0
Immanuel Irving         4    4    0    0   0   2/2   100.0     0/0   0.0
Giannis Banchero       32    3    1    2   0   1/2    50.0     0/0   0.0
Paul Iverson           33    2    0    0   0   1/3    33.3     0/0   0.0
Shai Ball               5    2    1    0   0   1/1   100.0     0/0   0.0
Derrick Rozier          4    2    0    1   0   1/1   100.0     0/0   0.0
Scottie Bird           32    0    0    2   0   0/1     0.0     0/0   0.0
Bones Carter            5    0    0    1   0   0/1     0.0     0/0   0.0
Pau Anthony             5    0    1    0   0   0/0     0.0     0/0   0.0

TEAM: FG: 13/20 (65.0%), 3PT: 1/2 (50.0%), REB: 13 (1 off, 12 def), AST: 7, TO: 5
TEAM FOULS: 7 [Team_040 in BONUS]


Team_040
--------------------------------------------------------------------------------
Player                MIN  PTS  REB  AST  TO      FG   FG%      3P   3P%
--------------------------------------------------------------------------------
Ayo Rose               32    5    0    0   0   2/5    40.0     0/0   0.0
Bam Gobert             32    3    3    1   0   1/2    50.0     0/0   0.0
Carmelo Murray         32    3    0    0   0   1/5    20.0     0/0   0.0
RJ Curry                5    3    0    0   0   1/2    50.0     0/0   0.0
Dirk Johnson           32    2    2    2   0   1/1   100.0     0/0   0.0
Shaquille Bane         32    2    2    1   0   1/3    33.3     0/0   0.0
Klay Leonard            5    2    0    0   0   1/1   100.0     0/0   0.0
Josh Banchero           5    2    1    0   0   1/2    50.0     0/0   0.0

TEAM: FG: 9/21 (42.9%), 3PT: 1/8 (12.5%), REB: 8 (1 off, 7 def), AST: 4, TO: 3
TEAM FOULS: 4

================================================================================

================================================================================
                       4TH QUARTER - Team_029 vs Team_040                       
================================================================================

[12:00] Team_029 possession (Score: 90-64)
Scottie Bird attempts a 3Pt. Contested by Ayo Rose (4.9 feet, ZONE). SCOTTIE BIRD MAKES IT! Assist: Paul Iverson
Score: 93-64

[11:48] Team_040 possession (Score: 93-64)
Carmelo Murray attempts a Midrange. Contested by Giannis Banchero (3.9 feet, MAN). CARMELO MURRAY MAKES IT!
Score: 93-66

[11:33] Team_029 possession (Score: 93-66)
Giannis Banchero attempts a 3Pt. Contested by Ayo Rose (5.2 feet, ZONE). GIANNIS BANCHERO MAKES IT!
Score: 96-66

[11:22] Team_040 possession (Score: 96-66)
Ayo Rose attempts a Layup. Contested by James Wall (3.4 feet, ZONE). AYO ROSE MAKES IT! Assist: Carmelo Murray
Score: 96-68

[11:04] Team_029 possession (Score: 96-68)
James Wall drives, Dirk Johnson stays with him. James Wall attempts a Layup. Wide open! Dirk Johnson is 6.4 feet away. [MAN] JAMES WALL MAKES IT! Assist: Giannis Banchero
Score: 98-68

[10:52] Team_040 possession (Score: 98-68)
Dirk Johnson attempts a Midrange. Contested by Giannis Banchero (3.9 feet, ZONE). DIRK JOHNSON MAKES IT! Assist: Ayo Rose
Score: 98-70

[10:40] Team_029 possession (Score: 98-70)
Giannis Banchero drives, picks up Carmelo Murray. Help arrives from Shaquille Bane! Giannis Banchero attempts a Layup. Contested by Shaquille Bane (5.1 feet, MAN). Giannis Banchero misses. Rebound secured by Shaquille Bane.

[10:29] Team_040 possession (Score: 98-70)
Ayo Rose attempts a 3Pt. Contested by Paul Iverson (5.1 feet, MAN). Ayo Rose misses. Rebound secured by Giannis Banchero.

[10:12] Team_029 possession (Score: 98-70)
Devin Butler commits a violation (traveling/carry)! TURNOVER! (dead ball)

[09:59] Team_040 possession (Score: 98-70)
Bam Gobert attempts a Midrange. Contested by Scottie Bird (3.5 feet, ZONE). Bam Gobert misses. Rebound secured by Giannis Banchero.

[09:41] Team_029 possession (Score: 98-70)
Scottie Bird makes the Midrange and draws the foul on Shaquille Bane! And-1! Scottie Bird to the line for 1. [Team fouls: 1] (Shaquille Bane: 1 personal fouls)   FT 1/1: GOOD Scottie Bird makes 1/1 from the line.
Score: 101-70

[09:24] Team_040 possession (Score: 101-70)
Shaquille Bane attempts a 3Pt. Contested by Giannis Banchero (4.3 feet, ZONE). Shaquille Bane misses. Offensive rebound by Bam Gobert! Bam Gobert kicks it out.

[09:09] Team_040 possession (Score: 101-70)
Ayo Rose attempts a Layup. Contested by Devin Butler (4.9 feet, ZONE). AYO ROSE MAKES IT!
Score: 101-72

[08:57] Team_029 possession (Score: 101-72)
Devin Butler makes the Layup and draws the foul on Shaquille Bane! And-1! Devin Butler to the line for 1. [Team fouls: 2] (Shaquille Bane: 2 personal fouls)   FT 1/1: GOOD Devin Butler makes 1/1 from the line.
Score: 104-72

[08:38] Team_040 possession (Score: 104-72)
Bam Gobert attempts a Midrange. Contested by Devin Butler (4.6 feet, MAN). BAM GOBERT MAKES IT! Assist: Ayo Rose
Score: 104-74

[08:24] Team_029 possession (Score: 104-74)
Paul Iverson drives, Ayo Rose stays with him. Paul Iverson attempts a Layup. Contested by Ayo Rose (5.1 feet, MAN). PAUL IVERSON MAKES IT! Assist: Scottie Bird
Score: 106-74

[08:11] Team_040 possession (Score: 106-74)
Bam Gobert attempts a Midrange. Contested by Devin Butler (4.7 feet, MAN). Bam Gobert misses. Rebound secured by Giannis Banchero.

[07:57] Team_029 possession (Score: 106-74)
James Wall attempts a 3Pt. Contested by Ayo Rose (5.5 feet, ZONE). James Wall misses. Offensive rebound by Devin Butler! Devin Butler kicks it out.

[07:40] Team_029 possession (Score: 106-74)
James Wall attempts a Layup. Wide open! Dirk Johnson is 6.6 feet away. [MAN] JAMES WALL MAKES IT!
Score: 108-74

[07:29] Team_040 possession (Score: 108-74)
Ayo Rose drives, picks up James Wall. Help arrives from Scottie Bird! Ayo Rose attempts a Dunk. Contested by Scottie Bird (3.7 feet, ZONE). Ayo Rose misses. Rebound secured by James Wall.

[07:13] Team_029 possession (Score: 108-74)
Scottie Bird drives and kicks out. Scottie Bird attempts a Midrange. Contested by Shaquille Bane (5.1 feet, MAN). Scottie Bird misses. Offensive rebound by Devin Butler! Devin Butler kicks it out.

[07:01] Team_029 possession (Score: 108-74)
Giannis Banchero attempts a 3Pt. Contested by Ayo Rose (5.6 feet, ZONE). Giannis Banchero misses. Rebound secured by Bam Gobert.

[06:50] Team_040 possession (Score: 108-74)
FOUL! Holding foul on Paul Iverson. [Team fouls: 1] No free throws, side out. (Paul Iverson: 1 personal fouls)

[06:32] Team_040 possession (Score: 108-74)
Bam Gobert attempts a 3Pt. Contested by Giannis Banchero (4.5 feet, ZONE). BAM GOBERT MAKES IT! Assist: Ayo Rose
Score: 108-77

[06:19] Team_029 possession (Score: 108-77)
Devin Butler attempts a 3Pt. Contested by Bam Gobert (4.9 feet, MAN). DEVIN BUTLER MAKES IT! Assist: Giannis Banchero
Score: 111-77

[06:05] Team_040 possession (Score: 111-77)
FOUL! Reach-in foul on Giannis Banchero during the drive. [Team fouls: 2] No free throws, side out. (Giannis Banchero: 1 personal fouls)

[05:49] Team_040 possession (Score: 111-77)
Dirk Johnson attempts a Layup. Contested by James Wall (3.6 feet, MAN). Dirk Johnson misses. Rebound secured by James Wall.

[05:34] Team_029 possession (Score: 111-77)
Devin Butler drives and kicks out. Paul Iverson attempts a Midrange. Contested by Shaquille Bane (5.3 feet, ZONE). Paul Iverson misses. Offensive rebound by Devin Butler! Devin Butler kicks it out.

[05:20] Team_029 possession (Score: 111-77)
Devin Butler drives to the basket... Devin Butler throws a bad pass out of bounds! TURNOVER! (dead ball)

[05:20] Substitution (Team_029): Paul Iverson OUT → Immanuel Irving IN (stamina_rule2)

[05:20] Substitution (Team_029): Scottie Bird OUT → Bones Carter IN (stamina_rule2)

[05:20] Substitution (Team_029): Giannis Banchero OUT → Pau Anthony IN (stamina_rule2)

[05:20] Substitution (Team_029): James Wall OUT → Derrick Rozier IN (stamina_rule2)

[05:20] Substitution (Team_029): Devin Butler OUT → Shai Ball IN (stamina_rule2)

[05:20] Substitution (Team_040): Ayo Rose OUT → Cole O'Neal IN (stamina_rule2)

[05:20] Substitution (Team_040): Shaquille Bane OUT → Tracy Middleton IN (stamina_rule2)

[05:20] Substitution (Team_040): Carmelo Murray OUT → Klay Leonard IN (stamina_rule2)

[05:20] Substitution (Team_040): Dirk Johnson OUT → RJ Curry IN (stamina_rule2)

[05:20] Substitution (Team_040): Bam Gobert OUT → Josh Banchero IN (stamina_rule2)

[05:05] Team_040 possession (Score: 111-77)
Tracy Middleton attempts a 3Pt. Contested by Bones Carter (5.7 feet, MAN). Tracy Middleton misses. Rebound secured by Derrick Rozier.

[04:53] Team_029 possession (Score: 111-77)
Immanuel Irving attempts a 3Pt. Wide open! Cole O'Neal is 7.0 feet away. [MAN] IMMANUEL IRVING MAKES IT! Assist: Pau Anthony
Score: 114-77

[04:40] Team_040 possession (Score: 114-77)
Cole O'Neal attempts a 3Pt. Contested by Immanuel Irving (5.1 feet, MAN). Cole O'Neal misses. Offensive rebound by RJ Curry! RJ Curry kicks it out.

[04:24] Team_040 possession (Score: 114-77)
Klay Leonard attempts a 3Pt. Contested by Pau Anthony (3.5 feet, ZONE). Klay Leonard misses. Rebound secured by Pau Anthony.

[04:11] Team_029 possession (Score: 114-77)
Pau Anthony attempts a Midrange. Contested by Klay Leonard (5.3 feet, MAN). Pau Anthony misses. Offensive rebound by Pau Anthony! Pau Anthony kicks it out.

[03:54] Team_029 possession (Score: 114-77)
FOUL! Reach-in foul on Josh Banchero during the drive. [Team fouls: 3] No free throws, side out. (Josh Banchero: 1 personal fouls)

[03:40] Team_029 possession (Score: 114-77)
Derrick Rozier drives to the basket... Derrick Rozier throws a bad pass! Stolen by RJ Curry! TURNOVER! (live ball)

[03:24] Team_040 possession (Score: 114-77)
Tracy Middleton drives and kicks out. RJ Curry attempts a Midrange. Contested by Derrick Rozier (3.9 feet, MAN). RJ Curry misses. Rebound secured by Derrick Rozier.

[03:09] Team_029 possession (Score: 114-77)
Derrick Rozier attempts a 3Pt. Contested by RJ Curry (5.2 feet, ZONE). DERRICK ROZIER MAKES IT! Assist: Bones Carter
Score: 117-77

[02:55] Team_040 possession (Score: 117-77)
Klay Leonard makes the Layup and draws the foul on Bones Carter! And-1! Klay Leonard to the line for 1. [Team fouls: 3] (Bones Carter: 1 personal fouls)   FT 1/1: GOOD Klay Leonard makes 1/1 from the line.
Score: 117-80

[02:41] Team_029 possession (Score: 117-80)
Immanuel Irving attempts a Midrange. Wide open! Cole O'Neal is 7.0 feet away. [MAN] IMMANUEL IRVING MAKES IT!
Score: 119-80

[02:28] Team_040 possession (Score: 119-80)
Cole O'Neal drives, picks up Derrick Rozier. Help arrives from Bones Carter! Cole O'Neal attempts a Layup. Contested by Bones Carter (3.9 feet, ZONE). COLE O'NEAL MAKES IT!
Score: 119-82

[02:15] Team_029 possession (Score: 119-82)
FOUL! Reach-in foul on RJ Curry during the drive. [Team fouls: 4] No free throws, side out. (RJ Curry: 1 personal fouls)

[02:01] Team_029 possession (Score: 119-82)
Immanuel Irving attempts a 3Pt. Wide open! Cole O'Neal is 7.0 feet away. [MAN] IMMANUEL IRVING MAKES IT! Assist: Derrick Rozier
Score: 122-82

[01:47] Team_040 possession (Score: 122-82)
FOUL! Offensive foul on Josh Banchero! Shai Ball drew the charge! [Team fouls: 5] (Josh Banchero: 2 personal fouls) TURNOVER! (dead ball)

[01:38] Team_029 possession (Score: 122-82)
Derrick Rozier drives and kicks out. Immanuel Irving attempts a 3Pt. Contested by Klay Leonard (4.9 feet, ZONE). IMMANUEL IRVING MAKES IT! Assist: Pau Anthony
Score: 125-82

[01:27] Team_040 possession (Score: 125-82)
Josh Banchero drives and kicks out. Cole O'Neal attempts a 3Pt. Contested by Immanuel Irving (5.1 feet, MAN). Cole O'Neal misses. Offensive rebound by RJ Curry! RJ Curry kicks it out.

[01:10] Team_040 possession (Score: 125-82)
Klay Leonard makes the Layup and draws the foul on Derrick Rozier! And-1! Klay Leonard to the line for 1. [Team fouls: 4] (Derrick Rozier: 1 personal fouls)   FT 1/1: GOOD Klay Leonard makes 1/1 from the line.
Score: 125-85

[00:52] Team_029 possession (Score: 125-85)
Shai Ball attempts a Midrange. Wide open! Josh Banchero is 6.2 feet away. [MAN] Shai Ball misses. Offensive rebound by Derrick Rozier! Derrick Rozier kicks it out.

[00:41] Team_029 possession (Score: 125-85)
Shai Ball drives to the basket... FOUL! Offensive foul on Shai Ball! Josh Banchero drew the charge! [Team fouls: 5] (Shai Ball: 1 personal fouls) TURNOVER! (dead ball)

[00:25] Team_040 possession (Score: 125-85)
Cole O'Neal attempts a 3Pt. Contested by Immanuel Irving (5.1 feet, MAN). Cole O'Neal misses. Rebound secured by Derrick Rozier.

[00:07] Team_029 possession (Score: 125-85)
Immanuel Irving throws a bad pass out of bounds! TURNOVER! (dead ball)

================================================================================
                              4TH QUARTER COMPLETE                              
================================================================================

4TH QUARTER SCORE: Team_029 35, Team_040 21

BOX SCORE:
================================================================================

Team_029
--------------------------------------------------------------------------------
Player                MIN  PTS  REB  AST  TO      FG   FG%      3P   3P%
--------------------------------------------------------------------------------
Immanuel Irving         9   11    0    0   0   4/4   100.0     0/0   0.0
Scottie Bird           39    6    0    1   0   2/2   100.0     0/0   0.0
Devin Butler           39    6    3    0   0   2/2   100.0     0/0   0.0
James Wall             39    4    2    0   0   2/2   100.0     0/0   0.0
Giannis Banchero       39    3    3    2   0   1/3    33.3     0/0   0.0
Derrick Rozier          9    3    4    1   0   1/1   100.0     0/0   0.0
Paul Iverson           39    2    0    1   0   1/1   100.0     0/0   0.0
Pau Anthony            10    0    2    2   0   0/0     0.0     0/0   0.0
Bones Carter           10    0    0    1   0   0/0     0.0     0/0   0.0

TEAM: FG: 13/15 (86.7%), 3PT: 6/7 (85.7%), REB: 14 (5 off, 9 def), AST: 8, TO: 5
TEAM FOULS: 5 [Team_040 in BONUS]


Team_040
--------------------------------------------------------------------------------
Player                MIN  PTS  REB  AST  TO      FG   FG%      3P   3P%
--------------------------------------------------------------------------------
Klay Leonard           10    6    0    0   0   2/3    66.7     0/0   0.0
Bam Gobert             39    5    2    0   0   2/4    50.0     0/0   0.0
Ayo Rose               39    4    0    3   0   2/4    50.0     0/0   0.0
Carmelo Murray         39    2    0    1   0   1/1   100.0     0/0   0.0
Dirk Johnson           39    2    0    0   0   1/2    50.0     0/0   0.0
Cole O'Neal            10    2    0    0   0   1/2    50.0     0/0   0.0
Shaquille Bane         39    0    1    0   0   0/0     0.0     0/0   0.0
Tracy Middleton        10    0    0    0   0   0/2     0.0     0/0   0.0
RJ Curry               10    0    2    0   0   0/0     0.0     0/0   0.0

TEAM: FG: 9/18 (50.0%), 3PT: 1/5 (20.0%), REB: 5 (3 off, 2 def), AST: 4, TO: 1
TEAM FOULS: 5 [Team_029 in BONUS]

================================================================================

================================================================================
                               FULL GAME COMPLETE                               
================================================================================

FINAL SCORE: Team_029 125, Team_040 85

SCORING BY QUARTER:
--------------------------------------------------------------------------------
Team                     Q1     Q2     Q3     Q4    FINAL
--------------------------------------------------------------------------------
Team_029                 32     29     29     35      125
Team_040                 21     20     23     21       85
--------------------------------------------------------------------------------

FULL GAME BOX SCORE:
================================================================================

Team_029
--------------------------------------------------------------------------------
Player                MIN  PTS  REB  AST  TO      FG   FG%      3P   3P%      FT STL BLK
--------------------------------------------------------------------------------
Paul Iverson           39   17    0    2   1   7/10   70.0   3/4    75.0   4/4     1   2
James Wall             39   32   19    3   2  14/20   70.0   2/3    66.7   2/2     1   0
Scottie Bird           39   15    0    5   1   6/9    66.7   3/5    60.0   2/3     0   0
Giannis Banchero       39    9    9    7   2   4/13   30.8   3/7    42.9   0/1     0   0
Devin Butler           39   17   18    4   2   6/12   50.0   1/1   100.0   1/2     1   0
Bones Carter           10    0    0    2   1   0/1     0.0   0/1     0.0   0/0     0   0
Pau Anthony            10    2    4    2   1   1/2    50.0   0/1     0.0   1/2     0   0
Shai Ball              10    2    1    0   1   1/2    50.0   0/0     0.0   0/0     0   0
Immanuel Irving         9   19    0    0   1   6/6   100.0   3/3   100.0   1/1     0   0
Derrick Rozier          9    5    4    2   0   3/3   100.0   1/1   100.0   0/0     0   0

TEAM: FG: 48/78 (61.5%), 3PT: 16/26 (61.5%), REB: 56 (14 off, 42 def), AST: 27, TO: 12


Team_040
--------------------------------------------------------------------------------
Player                MIN  PTS  REB  AST  TO      FG   FG%      3P   3P%      FT STL BLK
--------------------------------------------------------------------------------
Ayo Rose               39   19    0    4   2   8/18   44.4   2/9    22.2   1/1     1   0
Shaquille Bane         39   19   11    5   0   9/16   56.2   2/6    33.3   5/7     0   0
Carmelo Murray         39    7    0    2   2   3/9    33.3   1/5    20.0   0/0     1   0
Dirk Johnson           39    6   10    3   2   3/8    37.5   0/2     0.0   2/2     0   0
Bam Gobert             39   11   13    5   0   5/13   38.5   1/3    33.3   3/5     0   0
Cole O'Neal            10    4    0    1   0   2/4    50.0   0/2     0.0   2/2     0   0
Tracy Middleton        10    0    0    0   0   0/2     0.0   0/1     0.0   0/0     0   0
Klay Leonard           10   10    2    0   1   4/5    80.0   0/1     0.0   4/4     0   0
RJ Curry               10    3    2    0   0   1/2    50.0   0/1     0.0   1/1     1   0
Josh Banchero          10    4    1    0   1   2/3    66.7   0/0     0.0   2/2     0   0

TEAM: FG: 37/80 (46.2%), 3PT: 6/30 (20.0%), REB: 38 (9 off, 29 def), AST: 20, TO: 8

================================================================================
