================================================================================
                        FULL GAME - Team_084 vs Team_026                        
================================================================================

================================================================================
                       1ST QUARTER - Team_084 vs Team_026                       
================================================================================

[12:00] Team_084 possession (Score: 0-0)
Luka Sexton attempts a Midrange. Contested by Immanuel Hyland (4.3 feet, ZONE). LUKA SEXTON MAKES IT!
Score: 2-0

[11:45] Team_026 possession (Score: 2-0)
Immanuel Hyland attempts a 3Pt. Contested by Klay Thompson (4.9 feet, ZONE). Immanuel Hyland misses. Rebound secured by Klay Thompson.

[11:31] Team_084 possession (Score: 2-0)
Klay Thompson attempts a 3Pt. Contested by Immanuel Hyland (4.5 feet, ZONE). Klay Thompson misses. Rebound secured by Kobe Booker.

[11:13] Team_026 possession (Score: 2-0)
Kobe Booker attempts a Midrange. Contested by Jarrett Booker (4.8 feet, ZONE). KOBE BOOKER MAKES IT!
Score: 2-2

[10:59] Team_084 possession (Score: 2-2)
Klay Thompson makes the Midrange and draws the foul on Klay Giddey! And-1! Klay Thompson to the line for 1. [Team fouls: 1] (Klay Giddey: 1 personal fouls)   FT 1/1: GOOD Klay Thompson makes 1/1 from the line.
Score: 5-2

[10:46] Team_026 possession (Score: 5-2)
Shaquille Trent attempts a 3Pt. BLOCKED BY LUKA SEXTON! Ball is loose! Rebound secured by Dejounte Ginobili.

[10:32] Team_084 possession (Score: 5-2)
Klay Thompson attempts a 3Pt. Contested by Immanuel Hyland (4.5 feet, ZONE). Klay Thompson misses. Offensive rebound by Giannis Quickley! Giannis Quickley puts it back in!
Score: 7-2

[10:21] Team_026 possession (Score: 7-2)
FOUL! Reach-in foul on Jarrett Booker during the drive. [Team fouls: 1] No free throws, side out. (Jarrett Booker: 1 personal fouls)

[10:06] Team_026 possession (Score: 7-2)
Immanuel Hyland drives to the basket... Immanuel Hyland throws a bad pass! Stolen by Dejounte Ginobili! TURNOVER! (live ball)

[09:51] Team_084 possession (Score: 7-2)
Dejounte Ginobili attempts a 3Pt. Contested by Wendell Gasol (4.8 feet, ZONE). Dejounte Ginobili misses. Rebound secured by Immanuel Hyland.

[09:35] Team_026 possession (Score: 7-2)
Shaquille Trent attempts a Midrange. Contested by Jarrett Booker (4.4 feet, ZONE). SHAQUILLE TRENT MAKES IT!
Score: 7-4

[09:19] Team_084 possession (Score: 7-4)
Jarrett Booker attempts a 3Pt. Contested by Shaquille Trent (5.8 feet, MAN). Jarrett Booker misses. Rebound secured by Shaquille Trent.

[09:08] Team_026 possession (Score: 7-4)
Immanuel Hyland attempts a Midrange. Contested by Dejounte Ginobili (4.7 feet, MAN). Immanuel Hyland misses. Rebound secured by Klay Thompson.

[08:59] Team_084 possession (Score: 7-4)
Giannis Quickley attempts a Midrange. Contested by Kobe Booker (4.5 feet, MAN). Giannis Quickley misses. Rebound secured by Immanuel Hyland.

[08:43] Team_026 possession (Score: 7-4)
Wendell Gasol attempts a Layup. BLOCKED BY GIANNIS QUICKLEY! Ball is loose! Rebound secured by Klay Thompson.

[08:26] Team_084 possession (Score: 7-4)
FOUL! Holding foul on Shaquille Trent. [Team fouls: 2] No free throws, side out. (Shaquille Trent: 1 personal fouls)

[08:14] Team_084 possession (Score: 7-4)
Luka Sexton attempts a 3Pt. Contested by Wendell Gasol (4.9 feet, MAN). Luka Sexton misses. FOUL! Loose ball foul on Kobe Booker during the rebound battle. [Team fouls: 3] No free throws, side out. (Kobe Booker: 1 personal fouls)

[08:00] Team_084 possession (Score: 7-4)
Klay Thompson attempts a Midrange. Contested by Immanuel Hyland (4.5 feet, ZONE). KLAY THOMPSON MAKES IT! Assist: Luka Sexton
Score: 9-4

[07:46] Team_026 possession (Score: 9-4)
Shaquille Trent throws a bad pass out of bounds! TURNOVER! (dead ball)

[07:32] Team_084 possession (Score: 9-4)
Jarrett Booker attempts a 3Pt. Contested by Shaquille Trent (5.8 feet, MAN). Jarrett Booker misses. Offensive rebound by Giannis Quickley! Giannis Quickley's putback is no good. Rebound secured by Immanuel Hyland.

[07:22] Team_026 possession (Score: 9-4)
Kobe Booker attempts a Midrange. Contested by Klay Thompson (5.1 feet, ZONE). Kobe Booker misses. Rebound secured by Klay Thompson.

[07:08] Team_084 possession (Score: 9-4)
Jarrett Booker attempts a Layup. Contested by Kobe Booker (4.4 feet, ZONE). Jarrett Booker misses. Rebound secured by Shaquille Trent.

[06:56] Team_026 possession (Score: 9-4)
Shaquille Trent drives, Jarrett Booker stays with him. Shaquille Trent attempts a Dunk. Contested by Jarrett Booker (4.4 feet, MAN). SHAQUILLE TRENT MAKES IT! Assist: Wendell Gasol
Score: 9-6

[06:40] Team_084 possession (Score: 9-6)
FOUL! Shooting foul on Kobe Booker. Klay Thompson to the line for 2 free throws. [Team fouls: 4] (Kobe Booker: 2 personal fouls)   FT 1/2: GOOD   FT 2/2: GOOD Klay Thompson makes 2/2 from the line.
Score: 11-6

[06:29] Team_026 possession (Score: 11-6)
Klay Giddey attempts a 3Pt. Contested by Luka Sexton (3.6 feet, ZONE). Klay Giddey misses. Rebound secured by Giannis Quickley.

[06:15] Team_084 possession (Score: 11-6)
Giannis Quickley drives to the basket... Giannis Quickley commits a violation (traveling/carry)! TURNOVER! (dead ball)

[05:59] Team_026 possession (Score: 11-6)
FOUL! Reach-in foul on Klay Thompson during the drive. [Team fouls: 2] No free throws, side out. (Klay Thompson: 1 personal fouls)

[05:44] Team_026 possession (Score: 11-6)
FOUL! Reach-in foul on Giannis Quickley during the drive. [Team fouls: 3] No free throws, side out. (Giannis Quickley: 1 personal fouls)

[05:26] Team_026 possession (Score: 11-6)
Kobe Booker attempts a Midrange. Contested by Jarrett Booker (4.9 feet, ZONE). KOBE BOOKER MAKES IT!
Score: 11-8

[05:12] Team_084 possession (Score: 11-8)
Dejounte Ginobili attempts a 3Pt. Contested by Immanuel Hyland (4.3 feet, ZONE). Dejounte Ginobili misses. Rebound secured by Immanuel Hyland.

[04:59] Team_026 possession (Score: 11-8)
Shaquille Trent attempts a Midrange. Contested by Jarrett Booker (4.5 feet, MAN). Shaquille Trent misses. Rebound secured by Dejounte Ginobili.

[04:43] Team_084 possession (Score: 11-8)
FOUL! Shooting foul on Immanuel Hyland. Dejounte Ginobili to the line for 3 free throws. [BONUS: 5 team fouls] (Immanuel Hyland: 1 personal fouls)   FT 1/3: GOOD   FT 2/3: GOOD   FT 3/3: GOOD Dejounte Ginobili makes 3/3 from the line.
Score: 14-8

[04:29] Team_026 possession (Score: 14-8)
Klay Giddey attempts a Midrange. Contested by Klay Thompson (4.9 feet, ZONE). Klay Giddey misses. Rebound secured by Dejounte Ginobili.

[04:15] Team_084 possession (Score: 14-8)
Jarrett Booker attempts a Midrange. Contested by Immanuel Hyland (4.4 feet, ZONE). JARRETT BOOKER MAKES IT!
Score: 16-8

[03:59] Team_026 possession (Score: 16-8)
Wendell Gasol attempts a 3Pt. Contested by Luka Sexton (4.1 feet, MAN). Wendell Gasol misses. Rebound secured by Giannis Quickley.

[03:45] Team_084 possession (Score: 16-8)
Giannis Quickley attempts a Layup. Contested by Kobe Booker (4.6 feet, MAN). GIANNIS QUICKLEY MAKES IT!
Score: 18-8

[03:34] Team_026 possession (Score: 18-8)
Immanuel Hyland drives, picks up Dejounte Ginobili. Help arrives from Luka Sexton! Immanuel Hyland attempts a Dunk. Contested by Luka Sexton (4.8 feet, MAN). IMMANUEL HYLAND MAKES IT! Assist: Kobe Booker
Score: 18-10

[03:22] Team_084 possession (Score: 18-10)
Jarrett Booker attempts a Layup. Wide open! Shaquille Trent is 6.0 feet away. [ZONE] JARRETT BOOKER MAKES IT! Assist: Luka Sexton
Score: 20-10

[03:11] Team_026 possession (Score: 20-10)
Wendell Gasol attempts a Layup. Contested by Giannis Quickley (5.0 feet, ZONE). WENDELL GASOL MAKES IT! Assist: Kobe Booker
Score: 20-12

[02:57] Team_084 possession (Score: 20-12)
Giannis Quickley attempts a Midrange. Contested by Kobe Booker (4.7 feet, MAN). GIANNIS QUICKLEY MAKES IT! Assist: Dejounte Ginobili
Score: 22-12

[02:46] Team_026 possession (Score: 22-12)
Kobe Booker drives, picks up Giannis Quickley. Help arrives from Dejounte Ginobili! Kobe Booker attempts a Dunk. Contested by Dejounte Ginobili (4.9 feet, MAN). KOBE BOOKER MAKES IT!
Score: 22-14

[02:30] Team_084 possession (Score: 22-14)
Jarrett Booker attempts a Midrange. Wide open! Shaquille Trent is 6.1 feet away. [MAN] Jarrett Booker misses. Rebound secured by Kobe Booker.

[02:15] Team_026 possession (Score: 22-14)
Shaquille Trent drives to the basket... Shaquille Trent loses control! Ball rolls out of bounds! TURNOVER! (dead ball)

[02:15] Substitution (Team_084): Luka Sexton OUT → Magic Bryant IN (stamina_rule2)

[02:15] Substitution (Team_084): Dejounte Ginobili OUT → Chris Parker IN (stamina_rule2)

[02:15] Substitution (Team_084): Klay Thompson OUT → Evan Quickley IN (stamina_rule2)

[02:15] Substitution (Team_084): Jarrett Booker OUT → Pascal Jackson IN (stamina_rule2)

[02:15] Substitution (Team_084): Giannis Quickley OUT → Dejounte Porzingis IN (stamina_rule2)

[02:15] Substitution (Team_026): Wendell Gasol OUT → Myles Tatum IN (stamina_rule2)

[02:15] Substitution (Team_026): Immanuel Hyland OUT → Karl Barrett IN (stamina_rule2)

[02:15] Substitution (Team_026): Klay Giddey OUT → Josh Simons IN (stamina_rule2)

[02:15] Substitution (Team_026): Shaquille Trent OUT → Damian Doncic IN (stamina_rule2)

[02:15] Substitution (Team_026): Kobe Booker OUT → Dirk Randle IN (stamina_rule2)

[02:03] Team_084 possession (Score: 22-14)
Dejounte Porzingis attempts a 3Pt. Wide open! Dirk Randle is 6.3 feet away. [MAN] Dejounte Porzingis misses. Rebound secured by Damian Doncic.

[01:48] Team_026 possession (Score: 22-14)
Damian Doncic attempts a Midrange. Contested by Pascal Jackson (4.4 feet, MAN). Damian Doncic misses. Rebound secured by Evan Quickley.

[01:31] Team_084 possession (Score: 22-14)
Chris Parker drives and kicks out. FOUL! Shooting foul on Karl Barrett. Dejounte Porzingis to the line for 3 free throws. [BONUS: 6 team fouls] (Karl Barrett: 1 personal fouls)   FT 1/3: GOOD   FT 2/3: GOOD   FT 3/3: GOOD Dejounte Porzingis makes 3/3 from the line.
Score: 25-14

[01:15] Team_026 possession (Score: 25-14)
Myles Tatum loses control! Ball rolls out of bounds! TURNOVER! (dead ball)

[00:57] Team_084 possession (Score: 25-14)
Magic Bryant commits a violation (traveling/carry)! TURNOVER! (dead ball)

[00:40] Team_026 possession (Score: 25-14)
Myles Tatum attempts a 3Pt. Contested by Magic Bryant (3.5 feet, MAN). Myles Tatum misses. Rebound secured by Evan Quickley.

[00:24] Team_084 possession (Score: 25-14)
FOUL! Holding foul on Myles Tatum. [IN THE BONUS! 7 team fouls] Magic Bryant to the line for 2 free throws. (Myles Tatum: 1 personal fouls)   FT 1/2: MISS   FT 2/2: GOOD Magic Bryant makes 1/2 from the line.
Score: 26-14

[00:10] Team_026 possession (Score: 26-14)
Damian Doncic drives to the basket... FOUL! Offensive foul on Damian Doncic! Dejounte Porzingis drew the charge! [Team fouls: 8] (Damian Doncic: 1 personal fouls) TURNOVER! (dead ball)

================================================================================
                              1ST QUARTER COMPLETE                              
================================================================================

1ST QUARTER SCORE: Team_084 26, Team_026 14

BOX SCORE:
================================================================================

Team_084
--------------------------------------------------------------------------------
Player                MIN  PTS  REB  AST  TO      FG   FG%      3P   3P%
--------------------------------------------------------------------------------
Klay Thompson          10    7    4    0   0   3/4    75.0     0/0   0.0
Giannis Quickley       10    6    3    0   0   3/4    75.0     0/0   0.0
Jarrett Booker         10    4    0    0   0   2/6    33.3     0/0   0.0
Dejounte Ginobili      10    3    4    1   0   1/3    33.3     0/0   0.0
Dejounte Porzingis      2    3    0    0   0   1/2    50.0     0/0   0.0
Luka Sexton            10    2    0    2   0   1/1   100.0     0/0   0.0
Magic Bryant            2    1    0    0   0   1/1   100.0     0/0   0.0
Evan Quickley           2    0    2    0   0   0/0     0.0     0/0   0.0

TEAM: FG: 12/21 (57.1%), 3PT: 2/8 (25.0%), REB: 14 (3 off, 11 def), AST: 3, TO: 2
TEAM FOULS: 3


Team_026
--------------------------------------------------------------------------------
Player                MIN  PTS  REB  AST  TO      FG   FG%      3P   3P%
--------------------------------------------------------------------------------
Kobe Booker            10    6    2    2   0   3/4    75.0     0/0   0.0
Shaquille Trent        10    4    2    0   0   2/4    50.0     0/0   0.0
Immanuel Hyland        10    2    4    0   0   1/3    33.3     0/0   0.0
Wendell Gasol          10    2    0    1   0   1/3    33.3     0/0   0.0
Klay Giddey            10    0    0    0   0   0/2     0.0     0/0   0.0
Damian Doncic           2    0    1    0   0   0/1     0.0     0/0   0.0
Myles Tatum             2    0    0    0   0   0/1     0.0     0/0   0.0

TEAM: FG: 7/18 (38.9%), 3PT: 0/5 (0.0%), REB: 8 (0 off, 8 def), AST: 3, TO: 5
TEAM FOULS: 8 [Team_084 in BONUS]

================================================================================

================================================================================
                       2ND QUARTER - Team_084 vs Team_026                       
================================================================================

[12:00] Team_084 possession (Score: 26-14)
FOUL! Shooting foul on Shaquille Trent. Jarrett Booker to the line for 2 free throws. [Team fouls: 1] (Shaquille Trent: 1 personal fouls)   FT 1/2: MISS   FT 2/2: GOOD Jarrett Booker makes 1/2 from the line.
Score: 27-14

[11:47] Team_026 possession (Score: 27-14)
Klay Giddey attempts a Midrange. Contested by Klay Thompson (4.8 feet, MAN). Klay Giddey misses. Rebound secured by Klay Thompson.

[11:33] Team_084 possession (Score: 27-14)
Giannis Quickley attempts a 3Pt. Contested by Kobe Booker (4.6 feet, MAN). GIANNIS QUICKLEY MAKES IT! Assist: Dejounte Ginobili
Score: 30-14

[11:19] Team_026 possession (Score: 30-14)
Wendell Gasol attempts a Midrange. Contested by Luka Sexton (4.1 feet, MAN). Wendell Gasol misses. Rebound secured by Dejounte Ginobili.

[11:06] Team_084 possession (Score: 30-14)
Dejounte Ginobili attempts a 3Pt. Contested by Immanuel Hyland (4.4 feet, MAN). Dejounte Ginobili misses. Rebound secured by Kobe Booker.

[10:52] Team_026 possession (Score: 30-14)
Shaquille Trent attempts a 3Pt. Contested by Jarrett Booker (4.6 feet, MAN). SHAQUILLE TRENT MAKES IT! Assist: Wendell Gasol
Score: 30-17

[10:43] Team_084 possession (Score: 30-17)
Luka Sexton drives, Wendell Gasol stays with him. Luka Sexton attempts a Layup. Contested by Wendell Gasol (5.0 feet, MAN). Luka Sexton misses. Rebound secured by Kobe Booker.

[10:27] Team_026 possession (Score: 30-17)
Shaquille Trent attempts a 3Pt. Contested by Luka Sexton (3.6 feet, ZONE). Shaquille Trent misses. Offensive rebound by Shaquille Trent! Shaquille Trent kicks it out.

[10:09] Team_026 possession (Score: 30-17)
Wendell Gasol makes the Layup and draws the foul on Giannis Quickley! And-1! Wendell Gasol to the line for 1. [Team fouls: 1] (Giannis Quickley: 1 personal fouls)   FT 1/1: GOOD Wendell Gasol makes 1/1 from the line.
Score: 30-20

[09:57] Team_084 possession (Score: 30-20)
Giannis Quickley attempts a Midrange. Contested by Kobe Booker (4.7 feet, MAN). Giannis Quickley misses. Rebound secured by Shaquille Trent.

[09:42] Team_026 possession (Score: 30-20)
Shaquille Trent attempts a 3Pt. Contested by Jarrett Booker (4.7 feet, MAN). Shaquille Trent misses. Offensive rebound by Shaquille Trent! Shaquille Trent kicks it out.

[09:31] Team_026 possession (Score: 30-20)
Klay Giddey attempts a 3Pt. Contested by Klay Thompson (5.1 feet, MAN). KLAY GIDDEY MAKES IT! Assist: Kobe Booker
Score: 30-23

[09:19] Team_084 possession (Score: 30-23)
Giannis Quickley attempts a Midrange. Contested by Kobe Booker (4.8 feet, MAN). Giannis Quickley misses. Rebound secured by Shaquille Trent.

[09:02] Team_026 possession (Score: 30-23)
Immanuel Hyland attempts a Midrange. Contested by Jarrett Booker (5.0 feet, ZONE). Immanuel Hyland misses. Rebound secured by Dejounte Ginobili.

[08:48] Team_084 possession (Score: 30-23)
Giannis Quickley attempts a 3Pt. Contested by Immanuel Hyland (4.7 feet, ZONE). Giannis Quickley misses. Offensive rebound by Giannis Quickley! Giannis Quickley's putback is no good. Rebound secured by Immanuel Hyland.

[08:31] Team_026 possession (Score: 30-23)
Wendell Gasol attempts a 3Pt. Contested by Luka Sexton (4.3 feet, MAN). WENDELL GASOL MAKES IT! Assist: Shaquille Trent
Score: 30-26

[08:18] Team_084 possession (Score: 30-26)
Luka Sexton drives and kicks out. Jarrett Booker attempts a 3Pt. Wide open! Shaquille Trent is 6.0 feet away. [MAN] Jarrett Booker misses. Rebound secured by Kobe Booker.

[08:03] Team_026 possession (Score: 30-26)
Shaquille Trent attempts a 3Pt. Contested by Jarrett Booker (4.9 feet, MAN). SHAQUILLE TRENT MAKES IT! Assist: Immanuel Hyland
Score: 30-29

[07:50] Team_084 possession (Score: 30-29)
Luka Sexton attempts a Midrange. Wide open! Klay Giddey is 6.2 feet away. [ZONE] Luka Sexton misses. Rebound secured by Immanuel Hyland.

[07:38] Team_026 possession (Score: 30-29)
Kobe Booker drives and kicks out. Shaquille Trent attempts a Midrange. Contested by Dejounte Ginobili (5.1 feet, ZONE). Shaquille Trent misses. Offensive rebound by Kobe Booker! Kobe Booker kicks it out.

[07:23] Team_026 possession (Score: 30-29)
FOUL! Shooting foul on Luka Sexton. Wendell Gasol to the line for 3 free throws. [Team fouls: 2] (Luka Sexton: 1 personal fouls)   FT 1/3: GOOD   FT 2/3: GOOD   FT 3/3: GOOD Wendell Gasol makes 3/3 from the line.
Score: 30-32

[07:08] Team_084 possession (Score: 30-32)
Giannis Quickley attempts a 3Pt. Contested by Kobe Booker (5.1 feet, MAN). Giannis Quickley misses. Rebound secured by Shaquille Trent.

[06:53] Team_026 possession (Score: 30-32)
Kobe Booker throws a bad pass! Stolen by Giannis Quickley! TURNOVER! (live ball)

[06:41] Team_084 possession (Score: 30-32)
FOUL! Offensive foul on Dejounte Ginobili! Immanuel Hyland drew the charge! [Team fouls: 3] (Dejounte Ginobili: 1 personal fouls) TURNOVER! (dead ball)

[06:28] Team_026 possession (Score: 30-32)
Kobe Booker loses control! Ball rolls out of bounds! TURNOVER! (dead ball)

[06:28] Substitution (Team_084): Luka Sexton OUT → Magic Bryant IN (stamina_rule2)

[06:28] Substitution (Team_084): Dejounte Ginobili OUT → Chris Parker IN (stamina_rule2)

[06:28] Substitution (Team_084): Klay Thompson OUT → Evan Quickley IN (stamina_rule2)

[06:28] Substitution (Team_084): Jarrett Booker OUT → Pascal Jackson IN (stamina_rule2)

[06:28] Substitution (Team_084): Giannis Quickley OUT → Dejounte Porzingis IN (stamina_rule2)

[06:28] Substitution (Team_026): Wendell Gasol OUT → Myles Tatum IN (stamina_rule2)

[06:28] Substitution (Team_026): Immanuel Hyland OUT → Karl Barrett IN (stamina_rule2)

[06:28] Substitution (Team_026): Klay Giddey OUT → Josh Simons IN (stamina_rule2)

[06:28] Substitution (Team_026): Shaquille Trent OUT → Damian Doncic IN (stamina_rule2)

[06:28] Substitution (Team_026): Kobe Booker OUT → Dirk Randle IN (stamina_rule2)

[06:14] Team_084 possession (Score: 30-32)
Magic Bryant drives, picks up Myles Tatum. Help arrives from Josh Simons! Magic Bryant attempts a Dunk. Contested by Josh Simons (5.3 feet, MAN). MAGIC BRYANT MAKES IT! Assist: Pascal Jackson
Score: 32-32

[06:00] Team_026 possession (Score: 32-32)
Myles Tatum throws a bad pass! Stolen by Magic Bryant! TURNOVER! (live ball)

[05:47] Team_084 possession (Score: 32-32)
Evan Quickley attempts a 3Pt. Contested by Karl Barrett (4.6 feet, ZONE). Evan Quickley misses. Rebound secured by Damian Doncic.

[05:31] Team_026 possession (Score: 32-32)
Damian Doncic attempts a Layup. BLOCKED BY DEJOUNTE PORZINGIS! Ball goes out off Dejounte Porzingis. Damian Doncic's ball!

[05:20] Team_026 possession (Score: 32-32)
Damian Doncic attempts a Layup. Contested by Pascal Jackson (4.4 feet, MAN). Damian Doncic misses. Rebound secured by Evan Quickley.

[05:06] Team_084 possession (Score: 32-32)
Dejounte Porzingis attempts a Layup. Wide open! Dirk Randle is 6.3 feet away. [MAN] DEJOUNTE PORZINGIS MAKES IT! Assist: Pascal Jackson
Score: 34-32

[04:51] Team_026 possession (Score: 34-32)
Myles Tatum drives to the basket... Myles Tatum throws a bad pass out of bounds! TURNOVER! (dead ball)

[04:38] Team_084 possession (Score: 34-32)
Evan Quickley attempts a 3Pt. Contested by Josh Simons (5.0 feet, MAN). Evan Quickley misses. Offensive rebound by Dejounte Porzingis! Dejounte Porzingis kicks it out.

[04:26] Team_084 possession (Score: 34-32)
FOUL! Reach-in foul on Damian Doncic during the drive. [Team fouls: 2] No free throws, side out. (Damian Doncic: 1 personal fouls)

[04:11] Team_084 possession (Score: 34-32)
Magic Bryant drives, Myles Tatum stays with him. Magic Bryant attempts a Layup. Contested by Myles Tatum (5.3 feet, MAN). MAGIC BRYANT MAKES IT! Assist: Pascal Jackson
Score: 36-32

[04:00] Team_026 possession (Score: 36-32)
Josh Simons attempts a 3Pt. Contested by Magic Bryant (3.5 feet, ZONE). Josh Simons misses. Rebound secured by Evan Quickley.

[03:48] Team_084 possession (Score: 36-32)
Pascal Jackson drives, picks up Damian Doncic. Help arrives from Karl Barrett! Pascal Jackson attempts a Dunk. Contested by Karl Barrett (5.8 feet, MAN). Pascal Jackson misses. Rebound secured by Karl Barrett.

[03:33] Team_026 possession (Score: 36-32)
Josh Simons drives, picks up Dejounte Porzingis. Help arrives from Magic Bryant! Josh Simons attempts a Layup. Contested by Magic Bryant (4.8 feet, ZONE). JOSH SIMONS MAKES IT!
Score: 36-34

[03:20] Team_084 possession (Score: 36-34)
Magic Bryant attempts a 3Pt. Contested by Myles Tatum (5.3 feet, MAN). Magic Bryant misses. Rebound secured by Damian Doncic.

[03:09] Team_026 possession (Score: 36-34)
Karl Barrett attempts a 3Pt. Contested by Magic Bryant (3.7 feet, ZONE). Karl Barrett misses. Rebound secured by Evan Quickley.

[02:55] Team_084 possession (Score: 36-34)
Pascal Jackson attempts a 3Pt. Contested by Karl Barrett (4.9 feet, ZONE). Pascal Jackson misses. Rebound secured by Josh Simons.

[02:38] Team_026 possession (Score: 36-34)
Dirk Randle attempts a Layup. BLOCKED BY MAGIC BRYANT! Ball deflects out of bounds off Dirk Randle.

[02:23] Team_084 possession (Score: 36-34)
Dejounte Porzingis attempts a Layup. Wide open! Dirk Randle is 6.3 feet away. [MAN] DEJOUNTE PORZINGIS MAKES IT! Assist: Evan Quickley
Score: 38-34

[02:05] Team_026 possession (Score: 38-34)
Josh Simons attempts a 3Pt. Contested by Evan Quickley (4.7 feet, MAN). Josh Simons misses. Rebound secured by Pascal Jackson.

[01:50] Team_084 possession (Score: 38-34)
Magic Bryant attempts a 3Pt. Contested by Karl Barrett (4.7 feet, ZONE). Magic Bryant misses. Rebound secured by Karl Barrett.

[01:36] Team_026 possession (Score: 38-34)
Josh Simons attempts a 3Pt. Contested by Magic Bryant (3.5 feet, ZONE). Josh Simons misses. Rebound secured by Evan Quickley.

[01:24] Team_084 possession (Score: 38-34)
Pascal Jackson attempts a Layup. Contested by Damian Doncic (5.8 feet, ZONE). PASCAL JACKSON MAKES IT! Assist: Magic Bryant
Score: 40-34

[01:09] Team_026 possession (Score: 40-34)
Dirk Randle makes the Layup and draws the foul on Dejounte Porzingis! And-1! Dirk Randle to the line for 1. [Team fouls: 4] (Dejounte Porzingis: 1 personal fouls)   FT 1/1: GOOD Dirk Randle makes 1/1 from the line.
Score: 40-37

[00:55] Team_084 possession (Score: 40-37)
Dejounte Porzingis attempts a 3Pt. Wide open! Dirk Randle is 6.3 feet away. [MAN] DEJOUNTE PORZINGIS MAKES IT!
Score: 43-37

[00:40] Team_026 possession (Score: 43-37)
Myles Tatum attempts a 3Pt. Contested by Magic Bryant (3.6 feet, ZONE). MYLES TATUM MAKES IT! Assist: Dirk Randle
Score: 43-40

[00:27] Team_084 possession (Score: 43-40)
Magic Bryant attempts a 3Pt. Contested by Myles Tatum (5.4 feet, MAN). MAGIC BRYANT MAKES IT! Assist: Chris Parker
Score: 46-40

[00:15] Team_026 possession (Score: 46-40)
Josh Simons attempts a 3Pt. Contested by Chris Parker (4.4 feet, ZONE). Josh Simons misses. Offensive rebound by Damian Doncic! Damian Doncic kicks it out.

================================================================================
                              2ND QUARTER COMPLETE                              
================================================================================

2ND QUARTER SCORE: Team_084 20, Team_026 26

BOX SCORE:
================================================================================

Team_084
--------------------------------------------------------------------------------
Player                MIN  PTS  REB  AST  TO      FG   FG%      3P   3P%
--------------------------------------------------------------------------------
Magic Bryant            8    7    0    1   0   3/5    60.0     0/0   0.0
Dejounte Porzingis      8    7    1    0   0   3/3   100.0     0/0   0.0
Giannis Quickley       16    3    0    0   0   1/5    20.0     0/0   0.0
Pascal Jackson          8    2    1    3   0   1/3    33.3     0/0   0.0
Jarrett Booker         16    1    0    0   0   1/1   100.0     0/0   0.0
Klay Thompson          16    0    1    0   0   0/0     0.0     0/0   0.0
Dejounte Ginobili      16    0    2    1   0   0/1     0.0     0/0   0.0
Luka Sexton            16    0    0    0   0   0/3     0.0     0/0   0.0
Evan Quickley           8    0    4    1   0   0/1     0.0     0/0   0.0
Chris Parker            8    0    0    1   0   0/0     0.0     0/0   0.0

TEAM: FG: 9/22 (40.9%), 3PT: 3/10 (30.0%), REB: 10 (2 off, 8 def), AST: 7, TO: 1
TEAM FOULS: 4


Team_026
--------------------------------------------------------------------------------
Player                MIN  PTS  REB  AST  TO      FG   FG%      3P   3P%
--------------------------------------------------------------------------------
Wendell Gasol          16    9    0    1   0   3/4    75.0     0/0   0.0
Shaquille Trent        16    6    5    1   0   2/2   100.0     0/0   0.0
Klay Giddey            16    3    0    0   0   1/2    50.0     0/0   0.0
Dirk Randle             8    3    0    1   0   1/2    50.0     0/0   0.0
Myles Tatum             8    3    0    0   0   1/1   100.0     0/0   0.0
Josh Simons             8    2    1    0   0   1/4    25.0     0/0   0.0
Kobe Booker            16    0    4    1   0   0/0     0.0     0/0   0.0
Immanuel Hyland        16    0    2    1   0   0/1     0.0     0/0   0.0
Damian Doncic           8    0    3    0   0   0/1     0.0     0/0   0.0
Karl Barrett            8    0    2    0   0   0/1     0.0     0/0   0.0

TEAM: FG: 9/18 (50.0%), 3PT: 6/10 (60.0%), REB: 16 (4 off, 12 def), AST: 5, TO: 4
TEAM FOULS: 2

================================================================================

================================================================================
                       3RD QUARTER - Team_084 vs Team_026                       
================================================================================

[12:00] Team_084 possession (Score: 46-40)
Klay Thompson drives, picks up Klay Giddey. Help arrives from Immanuel Hyland! Klay Thompson attempts a Dunk. Contested by Immanuel Hyland (6.0 feet, MAN). KLAY THOMPSON MAKES IT! Assist: Jarrett Booker
Score: 48-40

[11:49] Team_026 possession (Score: 48-40)
Wendell Gasol throws a bad pass out of bounds! TURNOVER! (dead ball)

[11:36] Team_084 possession (Score: 48-40)
Jarrett Booker attempts a Midrange. Contested by Shaquille Trent (5.8 feet, MAN). JARRETT BOOKER MAKES IT! Assist: Luka Sexton
Score: 50-40

[11:22] Team_026 possession (Score: 50-40)
Kobe Booker makes the Layup and draws the foul on Dejounte Ginobili! And-1! Kobe Booker to the line for 1. [Team fouls: 1] (Dejounte Ginobili: 1 personal fouls)   FT 1/1: GOOD Kobe Booker makes 1/1 from the line.
Score: 50-43

[11:07] Team_084 possession (Score: 50-43)
Klay Thompson attempts a 3Pt. Contested by Immanuel Hyland (4.5 feet, ZONE). KLAY THOMPSON MAKES IT! Assist: Luka Sexton
Score: 53-43

[10:51] Team_026 possession (Score: 53-43)
Immanuel Hyland attempts a 3Pt. Contested by Dejounte Ginobili (4.7 feet, MAN). Immanuel Hyland misses. Rebound secured by Giannis Quickley.

[10:40] Team_084 possession (Score: 53-43)
Klay Thompson attempts a 3Pt. Contested by Immanuel Hyland (4.5 feet, ZONE). Klay Thompson misses. Rebound secured by Shaquille Trent.

[10:29] Team_026 possession (Score: 53-43)
Kobe Booker makes the Layup and draws the foul on Giannis Quickley! And-1! Kobe Booker to the line for 1. [Team fouls: 2] (Giannis Quickley: 1 personal fouls)   FT 1/1: GOOD Kobe Booker makes 1/1 from the line.
Score: 53-46

[10:14] Team_084 possession (Score: 53-46)
Jarrett Booker attempts a 3Pt. Contested by Immanuel Hyland (4.2 feet, ZONE). Jarrett Booker misses. Rebound secured by Shaquille Trent.

[09:57] Team_026 possession (Score: 53-46)
Wendell Gasol attempts a 3Pt. Contested by Luka Sexton (4.0 feet, MAN). WENDELL GASOL MAKES IT! Assist: Immanuel Hyland
Score: 53-49

[09:43] Team_084 possession (Score: 53-49)
Klay Thompson attempts a Midrange. BLOCKED BY KLAY GIDDEY! Ball is loose! Rebound secured by Kobe Booker.

[09:29] Team_026 possession (Score: 53-49)
FOUL! Shooting foul on Dejounte Ginobili. Shaquille Trent to the line for 2 free throws. [Team fouls: 3] (Dejounte Ginobili: 2 personal fouls)   FT 1/2: GOOD   FT 2/2: GOOD Shaquille Trent makes 2/2 from the line.
Score: 53-51

[09:14] Team_084 possession (Score: 53-51)
Giannis Quickley attempts a Layup. Contested by Kobe Booker (4.5 feet, MAN). GIANNIS QUICKLEY MAKES IT! Assist: Luka Sexton
Score: 55-51

[08:59] Team_026 possession (Score: 55-51)
Kobe Booker attempts a 3Pt. Contested by Jarrett Booker (4.8 feet, ZONE). Kobe Booker misses. Rebound secured by Giannis Quickley.

[08:44] Team_084 possession (Score: 55-51)
Giannis Quickley makes the Layup and draws the foul on Kobe Booker! And-1! Giannis Quickley to the line for 1. [Team fouls: 1] (Kobe Booker: 1 personal fouls)   FT 1/1: GOOD Giannis Quickley makes 1/1 from the line.
Score: 58-51

[08:27] Team_026 possession (Score: 58-51)
Klay Giddey makes the Dunk and draws the foul on Klay Thompson! And-1! Klay Giddey to the line for 1. [Team fouls: 4] (Klay Thompson: 1 personal fouls)   FT 1/1: GOOD Klay Giddey makes 1/1 from the line.
Score: 58-54

[08:14] Team_084 possession (Score: 58-54)
FOUL! Reach-in foul on Shaquille Trent during the drive. [Team fouls: 2] No free throws, side out. (Shaquille Trent: 1 personal fouls)

[08:01] Team_084 possession (Score: 58-54)
Giannis Quickley attempts a Midrange. Contested by Klay Giddey (5.7 feet, ZONE). Giannis Quickley misses. Rebound secured by Shaquille Trent.

[07:45] Team_026 possession (Score: 58-54)
FOUL! Reach-in foul on Luka Sexton during the drive. [IN THE BONUS! 5 team fouls] Wendell Gasol to the line for 2 free throws. (Luka Sexton: 1 personal fouls)   FT 1/2: GOOD   FT 2/2: GOOD Wendell Gasol makes 2/2 from the line.
Score: 58-56

[07:29] Team_084 possession (Score: 58-56)
Luka Sexton drives, picks up Wendell Gasol. Help arrives from Immanuel Hyland! Luka Sexton attempts a Dunk. Contested by Immanuel Hyland (4.9 feet, MAN). LUKA SEXTON MAKES IT!
Score: 60-56

[07:16] Team_026 possession (Score: 60-56)
Immanuel Hyland attempts a Layup. Contested by Giannis Quickley (4.5 feet, ZONE). IMMANUEL HYLAND MAKES IT!
Score: 60-58

[07:06] Team_084 possession (Score: 60-58)
Giannis Quickley drives to the basket... Giannis Quickley loses control! Ball rolls out of bounds! TURNOVER! (dead ball)

[06:55] Team_026 possession (Score: 60-58)
Kobe Booker attempts a Midrange. Contested by Giannis Quickley (4.7 feet, MAN). Kobe Booker misses. Rebound secured by Klay Thompson.

[06:40] Team_084 possession (Score: 60-58)
Luka Sexton attempts a 3Pt. Contested by Immanuel Hyland (4.3 feet, ZONE). Luka Sexton misses. Rebound secured by Kobe Booker.

[06:25] Team_026 possession (Score: 60-58)
Shaquille Trent drives, Jarrett Booker stays with him. Shaquille Trent attempts a Dunk. Contested by Jarrett Booker (4.4 feet, MAN). SHAQUILLE TRENT MAKES IT!
Score: 60-60

[06:08] Team_084 possession (Score: 60-60)
Jarrett Booker drives, picks up Shaquille Trent. Help arrives from Immanuel Hyland! Jarrett Booker attempts a Layup. Contested by Immanuel Hyland (5.8 feet, MAN). JARRETT BOOKER MAKES IT! Assist: Luka Sexton
Score: 62-60

[05:54] Team_026 possession (Score: 62-60)
Wendell Gasol attempts a 3Pt. Contested by Luka Sexton (4.0 feet, MAN). WENDELL GASOL MAKES IT! Assist: Shaquille Trent
Score: 62-63

[05:44] Team_084 possession (Score: 62-63)
FOUL! Shooting foul on Klay Giddey. Klay Thompson to the line for 3 free throws. [Team fouls: 3] (Klay Giddey: 1 personal fouls)   FT 1/3: MISS   FT 2/3: GOOD   FT 3/3: GOOD Klay Thompson makes 2/3 from the line.
Score: 64-63

[05:29] Team_026 possession (Score: 64-63)
Kobe Booker attempts a Midrange. Contested by Giannis Quickley (4.7 feet, MAN). KOBE BOOKER MAKES IT!
Score: 64-65

[05:14] Team_084 possession (Score: 64-65)
Dejounte Ginobili attempts a 3Pt. Contested by Immanuel Hyland (4.3 feet, MAN). Dejounte Ginobili misses. Rebound secured by Kobe Booker.

[05:01] Team_026 possession (Score: 64-65)
Wendell Gasol attempts a Midrange. Contested by Klay Thompson (5.2 feet, ZONE). Wendell Gasol misses. Rebound secured by Dejounte Ginobili.

[04:46] Team_084 possession (Score: 64-65)
Giannis Quickley makes the Dunk and draws the foul on Immanuel Hyland! And-1! Giannis Quickley to the line for 1. [Team fouls: 4] (Immanuel Hyland: 1 personal fouls)   FT 1/1: GOOD Giannis Quickley makes 1/1 from the line.
Score: 67-65

[04:36] Team_026 possession (Score: 67-65)
Shaquille Trent attempts a 3Pt. Contested by Luka Sexton (3.6 feet, ZONE). Shaquille Trent misses. Offensive rebound by Shaquille Trent! Shaquille Trent kicks it out.

[04:22] Team_026 possession (Score: 67-65)
Shaquille Trent attempts a 3Pt. Contested by Jarrett Booker (4.5 feet, MAN). SHAQUILLE TRENT MAKES IT! Assist: Kobe Booker
Score: 67-68

[04:09] Team_084 possession (Score: 67-68)
Luka Sexton attempts a Midrange. Contested by Immanuel Hyland (4.4 feet, ZONE). Luka Sexton misses. Rebound secured by Shaquille Trent.

[03:51] Team_026 possession (Score: 67-68)
Shaquille Trent attempts a 3Pt. Contested by Jarrett Booker (4.6 feet, MAN). Shaquille Trent misses. Rebound secured by Klay Thompson.

[03:36] Team_084 possession (Score: 67-68)
Luka Sexton attempts a Midrange. Contested by Wendell Gasol (5.0 feet, MAN). Luka Sexton misses. Rebound secured by Shaquille Trent.

[03:23] Team_026 possession (Score: 67-68)
FOUL! Shooting foul on Klay Thompson. Immanuel Hyland to the line for 2 free throws. [BONUS: 6 team fouls] (Klay Thompson: 2 personal fouls)   FT 1/2: MISS   FT 2/2: GOOD Immanuel Hyland makes 1/2 from the line.
Score: 67-69

[03:08] Team_084 possession (Score: 67-69)
Luka Sexton attempts a 3Pt. Contested by Immanuel Hyland (4.5 feet, ZONE). LUKA SEXTON MAKES IT! Assist: Giannis Quickley
Score: 70-69

[02:49] Team_026 possession (Score: 70-69)
Immanuel Hyland attempts a Midrange. Contested by Dejounte Ginobili (4.9 feet, MAN). IMMANUEL HYLAND MAKES IT!
Score: 70-71

[02:38] Team_084 possession (Score: 70-71)
Giannis Quickley attempts a Midrange. Contested by Kobe Booker (4.8 feet, MAN). Giannis Quickley misses. Rebound secured by Kobe Booker.

[02:27] Team_026 possession (Score: 70-71)
Klay Giddey attempts a 3Pt. Contested by Luka Sexton (3.8 feet, ZONE). Klay Giddey misses. Offensive rebound by Shaquille Trent! Shaquille Trent kicks it out.

[02:14] Team_026 possession (Score: 70-71)
Shaquille Trent drives, Jarrett Booker stays with him. Shaquille Trent attempts a Dunk. Contested by Jarrett Booker (4.7 feet, MAN). Shaquille Trent misses. Rebound secured by Dejounte Ginobili.

[01:57] Team_084 possession (Score: 70-71)
Luka Sexton makes the Layup and draws the foul on Kobe Booker! And-1! Luka Sexton to the line for 1. [BONUS: 5 team fouls] (Kobe Booker: 2 personal fouls)   FT 1/1: GOOD Luka Sexton makes 1/1 from the line.
Score: 73-71

[01:40] Team_026 possession (Score: 73-71)
Wendell Gasol attempts a Midrange. Contested by Luka Sexton (4.3 feet, MAN). WENDELL GASOL MAKES IT! Assist: Shaquille Trent
Score: 73-73

[01:28] Team_084 possession (Score: 73-73)
FOUL! Shooting foul on Immanuel Hyland. Luka Sexton to the line for 3 free throws. [BONUS: 6 team fouls] (Immanuel Hyland: 2 personal fouls)   FT 1/3: MISS   FT 2/3: MISS   FT 3/3: MISS Luka Sexton makes 0/3 from the line. Rebound secured by Shaquille Trent.

[01:15] Team_026 possession (Score: 73-73)
Kobe Booker makes the Layup and draws the foul on Giannis Quickley! And-1! Kobe Booker to the line for 1. [BONUS: 7 team fouls] (Giannis Quickley: 2 personal fouls)   FT 1/1: GOOD Kobe Booker makes 1/1 from the line.
Score: 73-76

[01:05] Team_084 possession (Score: 73-76)
Klay Thompson drives to the basket... Klay Thompson loses the ball! Stripped by Kobe Booker! TURNOVER! (live ball)

[00:52] Team_026 possession (Score: 73-76)
Wendell Gasol drives, Giannis Quickley stays with him. Wendell Gasol attempts a Dunk. Contested by Giannis Quickley (5.3 feet, ZONE). WENDELL GASOL MAKES IT!
Score: 73-78

[00:40] Team_084 possession (Score: 73-78)
Jarrett Booker drives, Kobe Booker stays with him. Jarrett Booker attempts a Dunk. Contested by Kobe Booker (5.0 feet, ZONE). JARRETT BOOKER MAKES IT! Assist: Dejounte Ginobili
Score: 75-78

[00:27] Team_026 possession (Score: 75-78)
Klay Giddey attempts a 3Pt. Contested by Luka Sexton (4.1 feet, ZONE). Klay Giddey misses. Rebound secured by Dejounte Ginobili.

[00:11] Team_084 possession (Score: 75-78)
Klay Thompson attempts a 3Pt. Contested by Immanuel Hyland (5.1 feet, ZONE). Klay Thompson misses. Rebound secured by Kobe Booker.

================================================================================
                              3RD QUARTER COMPLETE                              
================================================================================

3RD QUARTER SCORE: Team_084 29, Team_026 38

BOX SCORE:
================================================================================

Team_084
--------------------------------------------------------------------------------
Player                MIN  PTS  REB  AST  TO      FG   FG%      3P   3P%
--------------------------------------------------------------------------------
Luka Sexton            28    8    0    4   0   3/7    42.9     0/0   0.0
Giannis Quickley       28    8    2    1   0   3/5    60.0     0/0   0.0
Klay Thompson          28    7    2    0   0   3/6    50.0     0/0   0.0
Jarrett Booker         28    6    0    1   0   3/4    75.0     0/0   0.0
Dejounte Ginobili      28    0    3    1   0   0/1     0.0     0/0   0.0

TEAM: FG: 12/23 (52.2%), 3PT: 3/9 (33.3%), REB: 7 (0 off, 7 def), AST: 7, TO: 2
TEAM FOULS: 7 [Team_026 in BONUS]


Team_026
--------------------------------------------------------------------------------
Player                MIN  PTS  REB  AST  TO      FG   FG%      3P   3P%
--------------------------------------------------------------------------------
Wendell Gasol          28   12    0    0   0   5/6    83.3     0/0   0.0
Kobe Booker            28   11    5    1   0   4/6    66.7     0/0   0.0
Shaquille Trent        28    7    8    2   0   3/5    60.0     0/0   0.0
Immanuel Hyland        28    5    0    1   0   3/4    75.0     0/0   0.0
Klay Giddey            28    3    0    0   0   1/2    50.0     0/0   0.0

TEAM: FG: 16/23 (69.6%), 3PT: 3/7 (42.9%), REB: 13 (2 off, 11 def), AST: 4, TO: 1
TEAM FOULS: 6 [Team_084 in BONUS]

================================================================================

================================================================================
                       4TH QUARTER - Team_084 vs Team_026                       
================================================================================

[12:00] Team_084 possession (Score: 75-78)
Dejounte Ginobili drives and kicks out. Jarrett Booker attempts a 3Pt. Contested by Immanuel Hyland (4.4 feet, ZONE). Jarrett Booker misses. Rebound secured by Shaquille Trent.

[11:46] Team_026 possession (Score: 75-78)
Shaquille Trent attempts a Midrange. Contested by Dejounte Ginobili (4.7 feet, ZONE). Shaquille Trent misses. Offensive rebound by Shaquille Trent! Shaquille Trent kicks it out.

[11:33] Team_026 possession (Score: 75-78)
Immanuel Hyland drives and kicks out. Shaquille Trent attempts a Midrange. Contested by Jarrett Booker (5.0 feet, ZONE). Shaquille Trent misses. Rebound secured by Giannis Quickley.

[11:18] Team_084 possession (Score: 75-78)
Jarrett Booker attempts a 3Pt. Contested by Immanuel Hyland (4.7 feet, ZONE). Jarrett Booker misses. Rebound secured by Kobe Booker.

[11:06] Team_026 possession (Score: 75-78)
Kobe Booker attempts a Midrange. Contested by Dejounte Ginobili (5.2 feet, ZONE). KOBE BOOKER MAKES IT! Assist: Immanuel Hyland
Score: 75-80

[10:51] Team_084 possession (Score: 75-80)
Giannis Quickley drives, Shaquille Trent stays with him. Giannis Quickley attempts a Dunk. Wide open! Shaquille Trent is 6.2 feet away. [ZONE] GIANNIS QUICKLEY MAKES IT! Assist: Klay Thompson
Score: 77-80

[10:34] Team_026 possession (Score: 77-80)
Shaquille Trent makes the Layup and draws the foul on Jarrett Booker! And-1! Shaquille Trent to the line for 1. [Team fouls: 1] (Jarrett Booker: 1 personal fouls)   FT 1/1: MISS Shaquille Trent makes 0/1 from the line. Rebound secured by Dejounte Ginobili.
Score: 77-82

[10:16] Team_084 possession (Score: 77-82)
FOUL! Shooting foul on Wendell Gasol. Jarrett Booker to the line for 2 free throws. [Team fouls: 1] (Wendell Gasol: 1 personal fouls)   FT 1/2: GOOD   FT 2/2: GOOD Jarrett Booker makes 2/2 from the line.
Score: 79-82

[09:57] Team_026 possession (Score: 79-82)
Kobe Booker drives and kicks out. Immanuel Hyland attempts a 3Pt. Contested by Luka Sexton (4.2 feet, ZONE). Immanuel Hyland misses. Rebound secured by Dejounte Ginobili.

[09:44] Team_084 possession (Score: 79-82)
Giannis Quickley attempts a Layup. Contested by Kobe Booker (5.1 feet, ZONE). GIANNIS QUICKLEY MAKES IT! Assist: Jarrett Booker
Score: 81-82

[09:28] Team_026 possession (Score: 81-82)
Klay Giddey drives, Klay Thompson stays with him. Klay Giddey attempts a Dunk. Contested by Klay Thompson (5.4 feet, MAN). Klay Giddey misses. Offensive rebound by Kobe Booker! Kobe Booker kicks it out.

[09:10] Team_026 possession (Score: 81-82)
Klay Giddey attempts a 3Pt. Contested by Jarrett Booker (5.2 feet, ZONE). Klay Giddey misses. Rebound secured by Dejounte Ginobili.

[08:56] Team_084 possession (Score: 81-82)
Luka Sexton drives, Kobe Booker stays with him. Luka Sexton attempts a Layup. Contested by Kobe Booker (5.3 feet, ZONE). LUKA SEXTON MAKES IT! Assist: Dejounte Ginobili
Score: 83-82

[08:41] Team_026 possession (Score: 83-82)
Wendell Gasol drives, Giannis Quickley stays with him. Wendell Gasol attempts a Layup. Contested by Giannis Quickley (5.5 feet, ZONE). Wendell Gasol misses. Rebound secured by Giannis Quickley.

[08:23] Team_084 possession (Score: 83-82)
Jarrett Booker drives, picks up Shaquille Trent. Help arrives from Immanuel Hyland! Jarrett Booker attempts a Layup. Wide open! Immanuel Hyland is 6.4 feet away. [MAN] JARRETT BOOKER MAKES IT!
Score: 85-82

[08:06] Team_026 possession (Score: 85-82)
Klay Giddey drives, picks up Klay Thompson. Help arrives from Dejounte Ginobili! Klay Giddey attempts a Layup. Contested by Dejounte Ginobili (5.5 feet, MAN). KLAY GIDDEY MAKES IT! Assist: Kobe Booker
Score: 85-84

[07:48] Team_084 possession (Score: 85-84)
Klay Thompson attempts a 3Pt. Wide open! Klay Giddey is 6.6 feet away. [ZONE] Klay Thompson misses. Rebound secured by Shaquille Trent.

[07:35] Team_026 possession (Score: 85-84)
Shaquille Trent attempts a Midrange. Contested by Dejounte Ginobili (5.2 feet, ZONE). Shaquille Trent misses. Rebound secured by Giannis Quickley.

[07:18] Team_084 possession (Score: 85-84)
Klay Thompson attempts a 3Pt. Contested by Immanuel Hyland (5.4 feet, ZONE). Klay Thompson misses. Offensive rebound by Giannis Quickley! Giannis Quickley puts it back in!
Score: 87-84

[07:05] Team_026 possession (Score: 87-84)
Klay Giddey attempts a Midrange. Contested by Klay Thompson (5.7 feet, MAN). KLAY GIDDEY MAKES IT! Assist: Immanuel Hyland
Score: 87-86

[06:49] Team_084 possession (Score: 87-86)
Jarrett Booker drives, Shaquille Trent stays with him. Jarrett Booker attempts a Dunk. Wide open! Shaquille Trent is 6.6 feet away. [MAN] Jarrett Booker misses. Rebound secured by Shaquille Trent.

[06:40] Team_026 possession (Score: 87-86)
Wendell Gasol drives, Luka Sexton stays with him. Wendell Gasol attempts a Dunk. Contested by Luka Sexton (4.9 feet, MAN). Wendell Gasol misses. Offensive rebound by Shaquille Trent! Shaquille Trent kicks it out.

[06:26] Team_026 possession (Score: 87-86)
FOUL! Reach-in foul on Giannis Quickley during the drive. [Team fouls: 2] No free throws, side out. (Giannis Quickley: 1 personal fouls)

[06:10] Team_026 possession (Score: 87-86)
Kobe Booker attempts a Layup. Contested by Giannis Quickley (5.7 feet, ZONE). KOBE BOOKER MAKES IT! Assist: Klay Giddey
Score: 87-88

[05:56] Team_084 possession (Score: 87-88)
FOUL! Shooting foul on Immanuel Hyland. Dejounte Ginobili to the line for 2 free throws. [Team fouls: 2] (Immanuel Hyland: 1 personal fouls)   FT 1/2: GOOD   FT 2/2: GOOD Dejounte Ginobili makes 2/2 from the line.
Score: 89-88

[05:41] Team_026 possession (Score: 89-88)
FOUL! Shooting foul on Luka Sexton. Immanuel Hyland to the line for 2 free throws. [Team fouls: 3] (Luka Sexton: 1 personal fouls)   FT 1/2: MISS   FT 2/2: GOOD Immanuel Hyland makes 1/2 from the line.
Score: 89-89

[05:29] Team_084 possession (Score: 89-89)
Klay Thompson attempts a Midrange. Wide open! Klay Giddey is 6.8 feet away. [MAN] Klay Thompson misses. Rebound secured by Kobe Booker.

[05:11] Team_026 possession (Score: 89-89)
Klay Giddey makes the Layup and draws the foul on Klay Thompson! And-1! Klay Giddey to the line for 1. [Team fouls: 4] (Klay Thompson: 1 personal fouls)   FT 1/1: GOOD Klay Giddey makes 1/1 from the line.
Score: 89-92

[05:01] Team_084 possession (Score: 89-92)
Luka Sexton attempts a 3Pt. Contested by Immanuel Hyland (5.6 feet, ZONE). Luka Sexton misses. Rebound secured by Shaquille Trent.

[04:47] Team_026 possession (Score: 89-92)
FOUL! Holding foul on Giannis Quickley. [IN THE BONUS! 5 team fouls] Kobe Booker to the line for 2 free throws. (Giannis Quickley: 2 personal fouls)   FT 1/2: GOOD   FT 2/2: GOOD Kobe Booker makes 2/2 from the line.
Score: 89-94

[04:33] Team_084 possession (Score: 89-94)
Luka Sexton attempts a Layup. BLOCKED BY KOBE BOOKER! Ball is loose! Offensive rebound by Dejounte Ginobili! Dejounte Ginobili kicks it out.

[04:18] Team_084 possession (Score: 89-94)
Jarrett Booker attempts a 3Pt. Wide open! Shaquille Trent is 6.9 feet away. [ZONE] JARRETT BOOKER MAKES IT! Assist: Dejounte Ginobili
Score: 92-94

[04:05] Team_026 possession (Score: 92-94)
Wendell Gasol attempts a Midrange. Contested by Luka Sexton (5.2 feet, MAN). WENDELL GASOL MAKES IT! Assist: Klay Giddey
Score: 92-96

[03:55] Team_084 possession (Score: 92-96)
Luka Sexton attempts a 3Pt. Wide open! Wendell Gasol is 6.1 feet away. [MAN] Luka Sexton misses. Rebound secured by Immanuel Hyland.

[03:40] Team_026 possession (Score: 92-96)
Immanuel Hyland drives, Giannis Quickley stays with him. Immanuel Hyland attempts a Layup. Contested by Giannis Quickley (6.0 feet, ZONE). IMMANUEL HYLAND MAKES IT! Assist: Klay Giddey
Score: 92-98

[03:25] Team_084 possession (Score: 92-98)
Dejounte Ginobili attempts a 3Pt. Contested by Immanuel Hyland (5.8 feet, MAN). Dejounte Ginobili misses. Rebound secured by Kobe Booker.

[03:11] Team_026 possession (Score: 92-98)
Wendell Gasol attempts a 3Pt. Contested by Luka Sexton (5.4 feet, ZONE). WENDELL GASOL MAKES IT! Assist: Kobe Booker
Score: 92-101

[02:59] Team_084 possession (Score: 92-101)
Klay Thompson attempts a Layup. Wide open! Kobe Booker is 6.2 feet away. [ZONE] KLAY THOMPSON MAKES IT! Assist: Jarrett Booker
Score: 94-101

[02:48] Team_026 possession (Score: 94-101)
Wendell Gasol drives to the basket... Wendell Gasol throws a bad pass out of bounds! TURNOVER! (dead ball)

[02:48] Substitution (Team_084): Luka Sexton OUT → Magic Bryant IN (stamina_rule2)

[02:48] Substitution (Team_084): Dejounte Ginobili OUT → Chris Parker IN (stamina_rule2)

[02:48] Substitution (Team_084): Klay Thompson OUT → Evan Quickley IN (stamina_rule2)

[02:48] Substitution (Team_084): Jarrett Booker OUT → Pascal Jackson IN (stamina_rule2)

[02:48] Substitution (Team_084): Giannis Quickley OUT → Dejounte Porzingis IN (stamina_rule2)

[02:48] Substitution (Team_026): Wendell Gasol OUT → Myles Tatum IN (stamina_rule2)

[02:48] Substitution (Team_026): Immanuel Hyland OUT → Karl Barrett IN (stamina_rule2)

[02:48] Substitution (Team_026): Klay Giddey OUT → Josh Simons IN (stamina_rule2)

[02:48] Substitution (Team_026): Shaquille Trent OUT → Damian Doncic IN (stamina_rule2)

[02:48] Substitution (Team_026): Kobe Booker OUT → Dirk Randle IN (stamina_rule2)

[02:28] Team_084 possession (Score: 94-101)
Chris Parker attempts a 3Pt. Contested by Myles Tatum (5.4 feet, ZONE). CHRIS PARKER MAKES IT! Assist: Dejounte Porzingis
Score: 97-101

[02:11] Team_026 possession (Score: 97-101)
Josh Simons attempts a 3Pt. Contested by Evan Quickley (4.7 feet, ZONE). Josh Simons misses. Rebound secured by Dejounte Porzingis.

[01:53] Team_084 possession (Score: 97-101)
FOUL! Shooting foul on Karl Barrett. Pascal Jackson to the line for 3 free throws. [Team fouls: 3] (Karl Barrett: 1 personal fouls)   FT 1/3: MISS   FT 2/3: MISS   FT 3/3: GOOD Pascal Jackson makes 1/3 from the line.
Score: 98-101

[01:38] Team_026 possession (Score: 98-101)
Damian Doncic attempts a 3Pt. Contested by Magic Bryant (3.4 feet, ZONE). DAMIAN DONCIC MAKES IT! Assist: Dirk Randle
Score: 98-104

[01:19] Team_084 possession (Score: 98-104)
Chris Parker attempts a 3Pt. Contested by Karl Barrett (4.8 feet, ZONE). Chris Parker misses. Rebound secured by Damian Doncic.

[01:02] Team_026 possession (Score: 98-104)
Myles Tatum attempts a 3Pt. Contested by Magic Bryant (3.5 feet, ZONE). MYLES TATUM MAKES IT! Assist: Dirk Randle
Score: 98-107

[00:47] Team_084 possession (Score: 98-107)
Pascal Jackson attempts a Midrange. Contested by Damian Doncic (5.8 feet, ZONE). Pascal Jackson misses. FOUL! Loose ball foul on Karl Barrett during the rebound battle. [Team fouls: 4] No free throws, side out. (Karl Barrett: 2 personal fouls)

[00:31] Team_084 possession (Score: 98-107)
Dejounte Porzingis attempts a Midrange. Contested by Myles Tatum (5.4 feet, ZONE). Dejounte Porzingis misses. Rebound secured by Karl Barrett.

[00:16] Team_026 possession (Score: 98-107)
Josh Simons attempts a 3Pt. Contested by Evan Quickley (4.7 feet, MAN). Josh Simons misses. Rebound secured by Evan Quickley.

================================================================================
                              4TH QUARTER COMPLETE                              
================================================================================

4TH QUARTER SCORE: Team_084 23, Team_026 29

BOX SCORE:
================================================================================

Team_084
--------------------------------------------------------------------------------
Player                MIN  PTS  REB  AST  TO      FG   FG%      3P   3P%
--------------------------------------------------------------------------------
Jarrett Booker         37    7    0    2   0   3/5    60.0     0/0   0.0
Giannis Quickley       37    6    4    0   0   3/3   100.0     0/0   0.0
Chris Parker           11    3    0    0   0   1/2    50.0     0/0   0.0
Dejounte Ginobili      37    2    4    2   0   1/3    33.3     0/0   0.0
Klay Thompson          37    2    0    1   0   1/3    33.3     0/0   0.0
Luka Sexton            37    2    0    0   0   1/3    33.3     0/0   0.0
Pascal Jackson         11    1    0    0   0   1/1   100.0     0/0   0.0
Dejounte Porzingis     11    0    2    1   0   0/1     0.0     0/0   0.0
Evan Quickley          11    0    1    0   0   0/0     0.0     0/0   0.0

TEAM: FG: 11/21 (52.4%), 3PT: 4/10 (40.0%), REB: 11 (3 off, 8 def), AST: 6, TO: 0
TEAM FOULS: 5 [Team_026 in BONUS]


Team_026
--------------------------------------------------------------------------------
Player                MIN  PTS  REB  AST  TO      FG   FG%      3P   3P%
--------------------------------------------------------------------------------
Klay Giddey            37    7    0    3   0   3/4    75.0     0/0   0.0
Kobe Booker            37    6    4    2   0   3/4    75.0     0/0   0.0
Wendell Gasol          37    5    0    0   0   2/3    66.7     0/0   0.0
Immanuel Hyland        37    3    1    2   0   2/3    66.7     0/0   0.0
Damian Doncic          11    3    1    0   0   1/1   100.0     0/0   0.0
Myles Tatum            11    3    0    0   0   1/1   100.0     0/0   0.0
Shaquille Trent        37    0    6    0   0   0/2     0.0     0/0   0.0
Josh Simons            11    0    0    0   0   0/2     0.0     0/0   0.0
Dirk Randle            11    0    0    2   0   0/0     0.0     0/0   0.0
Karl Barrett           11    0    1    0   0   0/0     0.0     0/0   0.0

TEAM: FG: 12/20 (60.0%), 3PT: 3/6 (50.0%), REB: 13 (3 off, 10 def), AST: 9, TO: 1
TEAM FOULS: 4

================================================================================

================================================================================
                               FULL GAME COMPLETE                               
================================================================================

FINAL SCORE: Team_084 98, Team_026 107

SCORING BY QUARTER:
--------------------------------------------------------------------------------
Team                     Q1     Q2     Q3     Q4    FINAL
--------------------------------------------------------------------------------
Team_084                 26     20     29     23       98
Team_026                 14     26     38     29      107
--------------------------------------------------------------------------------

FULL GAME BOX SCORE:
================================================================================

Team_084
--------------------------------------------------------------------------------
Player                MIN  PTS  REB  AST  TO      FG   FG%      3P   3P%      FT STL BLK
--------------------------------------------------------------------------------
Luka Sexton            37   12    0    6   1   5/14   35.7   1/5    20.0   1/4     0   1
Dejounte Ginobili      37    5   13    5   2   2/8    25.0   1/6    16.7   5/5     1   0
Klay Thompson          37   16    7    1   1   9/15   60.0   4/8    50.0   5/6     0   0
Jarrett Booker         37   18    0    3   0   9/16   56.2   1/5    20.0   3/4     0   0
Giannis Quickley       37   23    9    1   0   8/15   53.3   1/3    33.3   2/2     1   1
Magic Bryant           11    8    0    1   1   3/5    60.0   1/3    33.3   1/2     1   1
Chris Parker           11    3    0    1   0   2/3    66.7   1/2    50.0   0/0     0   0
Evan Quickley          11    0    7    1   0   0/1     0.0   0/1     0.0   0/0     0   0
Pascal Jackson         11    3    1    3   0   2/4    50.0   1/2    50.0   1/3     0   0
Dejounte Porzingis     11   10    3    1   0   3/5    60.0   1/2    50.0   3/3     0   1

TEAM: FG: 44/87 (50.6%), 3PT: 12/37 (32.4%), REB: 42 (8 off, 34 def), AST: 23, TO: 5


Team_026
--------------------------------------------------------------------------------
Player                MIN  PTS  REB  AST  TO      FG   FG%      3P   3P%      FT STL BLK
--------------------------------------------------------------------------------
Wendell Gasol          37   28    0    2   1  11/16   68.8   5/6    83.3   6/6     0   0
Immanuel Hyland        37   10    7    4   0   6/11   54.5   0/2     0.0   2/4     0   0
Klay Giddey            37   13    0    3   2   5/10   50.0   1/4    25.0   2/2     0   1
Shaquille Trent        37   17   21    3   1   7/13   53.8   3/5    60.0   2/3     0   0
Kobe Booker            37   23   15    6   3   9/13   69.2   0/1     0.0   5/5     1   1
Myles Tatum            11    6    0    0   2   2/3    66.7   2/3    66.7   0/0     0   0
Karl Barrett           11    0    3    0   1   0/1     0.0   0/1     0.0   0/0     0   0
Josh Simons            11    2    1    0   1   1/6    16.7   0/5     0.0   0/0     0   0
Damian Doncic          11    3    5    0   0   1/3    33.3   1/1   100.0   0/0     0   0
Dirk Randle            11    3    0    3   0   1/2    50.0   0/0     0.0   1/1     0   0

TEAM: FG: 44/79 (55.7%), 3PT: 12/28 (42.9%), REB: 50 (9 off, 41 def), AST: 21, TO: 11

================================================================================
