================================================================================
                        FULL GAME - Team_011 vs Team_058                        
================================================================================

================================================================================
                       1ST QUARTER - Team_011 vs Team_058                       
================================================================================

[12:00] Team_011 possession (Score: 0-0)
Michael Carter attempts a 3Pt. Contested by Vince Hyland (4.4 feet, MAN). Michael Carter misses. FOUL! Loose ball foul on Stephen Haliburton during the rebound battle. [Team fouls: 1] No free throws, side out. (Stephen Haliburton: 1 personal fouls)

[11:46] Team_011 possession (Score: 0-0)
Trae Tatum drives and kicks out. Pau Barnes attempts a 3Pt. Contested by Stephen Haliburton (3.4 feet, MAN). Pau Barnes misses. Rebound secured by Tyrese Doncic.

[11:29] Team_058 possession (Score: 0-0)
Vince Hyland attempts a 3Pt. Contested by Magic Tatum (3.7 feet, ZONE). Vince Hyland misses. Rebound secured by Pau Barnes.

[11:13] Team_011 possession (Score: 0-0)
Trae Tatum attempts a Midrange. Contested by Tyrese Doncic (4.3 feet, ZONE). TRAE TATUM MAKES IT!
Score: 2-0

[10:56] Team_058 possession (Score: 2-0)
FOUL! Holding foul on Magic Tatum. [Team fouls: 1] No free throws, side out. (Magic Tatum: 1 personal fouls)

[10:41] Team_058 possession (Score: 2-0)
Vince Hyland attempts a Midrange. Contested by Michael Carter (4.5 feet, MAN). Vince Hyland misses. Rebound secured by Evan George.

[10:25] Team_011 possession (Score: 2-0)
FOUL! Offensive foul on Evan George! Tyrese Doncic drew the charge! [Team fouls: 2] (Evan George: 1 personal fouls) TURNOVER! (dead ball)

[10:16] Team_058 possession (Score: 2-0)
FOUL! Reach-in foul on Pau Barnes during the drive. [Team fouls: 3] No free throws, side out. (Pau Barnes: 1 personal fouls)

[10:02] Team_058 possession (Score: 2-0)
Kyle Westbrook attempts a 3Pt. Contested by Trae Tatum (4.8 feet, MAN). KYLE WESTBROOK MAKES IT! Assist: Tyrese Doncic
Score: 2-3

[09:47] Team_011 possession (Score: 2-3)
Evan George drives to the basket... Evan George loses the ball! Stripped by Stephen Haliburton! TURNOVER! (live ball)

[09:29] Team_058 possession (Score: 2-3)
FOUL! Shooting foul on Trae Tatum. Stephen Haliburton to the line for 2 free throws. [Team fouls: 4] (Trae Tatum: 1 personal fouls)   FT 1/2: GOOD   FT 2/2: GOOD Stephen Haliburton makes 2/2 from the line.
Score: 2-5

[09:18] Team_011 possession (Score: 2-5)
Pau Barnes attempts a Midrange. Contested by Stephen Haliburton (4.1 feet, MAN). PAU BARNES MAKES IT!
Score: 4-5

[09:01] Team_058 possession (Score: 4-5)
Vince Hyland attempts a 3Pt. Contested by Magic Tatum (3.7 feet, ZONE). VINCE HYLAND MAKES IT! Assist: Bradley Sexton
Score: 4-8

[08:49] Team_011 possession (Score: 4-8)
Evan George attempts a 3Pt. Contested by Bradley Sexton (3.3 feet, ZONE). EVAN GEORGE MAKES IT! Assist: Pau Barnes
Score: 7-8

[08:34] Team_058 possession (Score: 7-8)
Bradley Sexton attempts a Layup. BLOCKED BY MAGIC TATUM! Ball is loose! Rebound secured by Pau Barnes.

[08:20] Team_011 possession (Score: 7-8)
Trae Tatum drives to the basket... Trae Tatum loses the ball! Stripped by Stephen Haliburton! TURNOVER! (live ball)

[08:03] Team_058 possession (Score: 7-8)
Tyrese Doncic drives, Pau Barnes stays with him. Tyrese Doncic attempts a Layup. Contested by Pau Barnes (3.0 feet, ZONE). TYRESE DONCIC MAKES IT!
Score: 7-10

[07:49] Team_011 possession (Score: 7-10)
Evan George drives and kicks out. Magic Tatum attempts a 3Pt. Contested by Bradley Sexton (3.0 feet, MAN). Magic Tatum misses. Offensive rebound by Evan George! Evan George's putback is no good. Rebound secured by Stephen Haliburton.

[07:34] Team_058 possession (Score: 7-10)
Kyle Westbrook attempts a 3Pt. Contested by Magic Tatum (3.6 feet, ZONE). Kyle Westbrook misses. Rebound secured by Evan George.

[07:19] Team_011 possession (Score: 7-10)
Michael Carter attempts a Midrange. Contested by Bradley Sexton (2.9 feet, ZONE). MICHAEL CARTER MAKES IT! Assist: Evan George
Score: 9-10

[07:03] Team_058 possession (Score: 9-10)
Stephen Haliburton makes the Layup and draws the foul on Pau Barnes! And-1! Stephen Haliburton to the line for 1. [BONUS: 5 team fouls] (Pau Barnes: 2 personal fouls)   FT 1/1: GOOD Stephen Haliburton makes 1/1 from the line.
Score: 9-13

[06:49] Team_011 possession (Score: 9-13)
Evan George drives, Tyrese Doncic stays with him. Evan George attempts a Dunk. Contested by Tyrese Doncic (4.7 feet, MAN). EVAN GEORGE MAKES IT!
Score: 11-13

[06:30] Team_058 possession (Score: 11-13)
Vince Hyland drives, Evan George stays with him. Vince Hyland attempts a Layup. Contested by Evan George (5.4 feet, ZONE). Vince Hyland misses. Offensive rebound by Stephen Haliburton! Stephen Haliburton puts it back in!
Score: 11-15

[06:12] Team_011 possession (Score: 11-15)
Pau Barnes attempts a Layup. Contested by Stephen Haliburton (4.1 feet, MAN). Pau Barnes misses. Rebound secured by Tyrese Doncic.

[06:01] Team_058 possession (Score: 11-15)
FOUL! Reach-in foul on Pau Barnes during the drive. [IN THE BONUS! 6 team fouls] Kyle Westbrook to the line for 2 free throws. (Pau Barnes: 3 personal fouls)   FT 1/2: GOOD   FT 2/2: GOOD Kyle Westbrook makes 2/2 from the line.
Score: 11-17

[05:48] Team_011 possession (Score: 11-17)
Pau Barnes drives, picks up Stephen Haliburton. Help arrives from Bradley Sexton! Pau Barnes attempts a Dunk. Contested by Bradley Sexton (4.1 feet, ZONE). Pau Barnes misses. FOUL! Loose ball foul on Stephen Haliburton during the rebound battle. [Team fouls: 2] No free throws, side out. (Stephen Haliburton: 2 personal fouls)

[05:33] Team_011 possession (Score: 11-17)
Pau Barnes attempts a Layup. Contested by Stephen Haliburton (4.1 feet, ZONE). PAU BARNES MAKES IT! Assist: Evan George
Score: 13-17

[05:19] Team_058 possession (Score: 13-17)
Bradley Sexton drives, Magic Tatum stays with him. Bradley Sexton attempts a Dunk. Contested by Magic Tatum (3.7 feet, MAN). Bradley Sexton misses. Offensive rebound by Stephen Haliburton! Stephen Haliburton's putback is no good. Offensive rebound by Stephen Haliburton! Stephen Haliburton kicks it out.

[05:04] Team_058 possession (Score: 13-17)
Bradley Sexton drives, Magic Tatum stays with him. Bradley Sexton attempts a Layup. Contested by Magic Tatum (3.7 feet, MAN). BRADLEY SEXTON MAKES IT! Assist: Kyle Westbrook
Score: 13-19

[04:50] Team_011 possession (Score: 13-19)
Evan George drives to the basket... Evan George throws a bad pass out of bounds! TURNOVER! (dead ball)

[04:38] Team_058 possession (Score: 13-19)
Kyle Westbrook attempts a 3Pt. Contested by Magic Tatum (3.6 feet, ZONE). Kyle Westbrook misses. Rebound secured by Michael Carter.

[04:20] Team_011 possession (Score: 13-19)
Trae Tatum attempts a 3Pt. Contested by Kyle Westbrook (4.0 feet, MAN). Trae Tatum misses. Rebound secured by Bradley Sexton.

[04:03] Team_058 possession (Score: 13-19)
Stephen Haliburton drives to the basket... Stephen Haliburton loses the ball! Stripped by Pau Barnes! TURNOVER! (live ball)

[03:46] Team_011 possession (Score: 13-19)
Michael Carter attempts a Midrange. Contested by Stephen Haliburton (3.5 feet, ZONE). Michael Carter misses. Rebound secured by Bradley Sexton.

[03:31] Team_058 possession (Score: 13-19)
Stephen Haliburton loses the ball! Stripped by Pau Barnes! TURNOVER! (live ball)

[03:15] Team_011 possession (Score: 13-19)
Evan George drives, picks up Stephen Haliburton. Help arrives from Bradley Sexton! Evan George attempts a Dunk. Contested by Bradley Sexton (3.9 feet, ZONE). Evan George misses. Offensive rebound by Pau Barnes! Pau Barnes's putback is no good. Rebound secured by Tyrese Doncic.

[03:01] Team_058 possession (Score: 13-19)
FOUL! Holding foul on Trae Tatum. [IN THE BONUS! 7 team fouls] Kyle Westbrook to the line for 2 free throws. (Trae Tatum: 2 personal fouls)   FT 1/2: MISS   FT 2/2: GOOD Kyle Westbrook makes 1/2 from the line.
Score: 13-20

[02:50] Team_011 possession (Score: 13-20)
Evan George drives and kicks out. Michael Carter attempts a 3Pt. Contested by Vince Hyland (4.6 feet, MAN). Michael Carter misses. Offensive rebound by Evan George! Evan George's putback is no good. Rebound secured by Bradley Sexton.

[02:38] Team_058 possession (Score: 13-20)
Vince Hyland drives, picks up Michael Carter. Help arrives from Magic Tatum! Vince Hyland attempts a Layup. Contested by Magic Tatum (4.7 feet, MAN). Vince Hyland misses. Rebound secured by Evan George.

[02:28] Team_011 possession (Score: 13-20)
Trae Tatum attempts a 3Pt. Contested by Kyle Westbrook (4.3 feet, MAN). Trae Tatum misses. FOUL! Loose ball foul on Tyrese Doncic during the rebound battle. [Team fouls: 3] No free throws, side out. (Tyrese Doncic: 1 personal fouls)

[02:13] Team_011 possession (Score: 13-20)
FOUL! Shooting foul on Kyle Westbrook. Trae Tatum to the line for 2 free throws. [Team fouls: 4] (Kyle Westbrook: 1 personal fouls)   FT 1/2: MISS   FT 2/2: GOOD Trae Tatum makes 1/2 from the line.
Score: 14-20

[01:59] Team_058 possession (Score: 14-20)
Kyle Westbrook attempts a Midrange. Contested by Pau Barnes (3.5 feet, ZONE). KYLE WESTBROOK MAKES IT!
Score: 14-22

[01:44] Team_011 possession (Score: 14-22)
Michael Carter attempts a 3Pt. Contested by Vince Hyland (4.6 feet, MAN). Michael Carter misses. Rebound secured by Stephen Haliburton.

[01:32] Team_058 possession (Score: 14-22)
Vince Hyland attempts a 3Pt. Contested by Michael Carter (4.8 feet, MAN). VINCE HYLAND MAKES IT! Assist: Tyrese Doncic
Score: 14-25

[01:14] Team_011 possession (Score: 14-25)
Trae Tatum drives, picks up Stephen Haliburton. Help arrives from Bradley Sexton! Trae Tatum attempts a Layup. Contested by Bradley Sexton (3.8 feet, ZONE). Trae Tatum misses. Rebound secured by Tyrese Doncic.

[00:58] Team_058 possession (Score: 14-25)
Bradley Sexton attempts a 3Pt. Contested by Magic Tatum (4.1 feet, MAN). BRADLEY SEXTON MAKES IT!
Score: 14-28

[00:47] Team_011 possession (Score: 14-28)
Evan George attempts a 3Pt. Contested by Bradley Sexton (3.7 feet, ZONE). Evan George misses. Rebound secured by Bradley Sexton.

[00:32] Team_058 possession (Score: 14-28)
Bradley Sexton drives, Magic Tatum stays with him. Bradley Sexton attempts a Layup. Contested by Magic Tatum (4.1 feet, MAN). Bradley Sexton misses. Offensive rebound by Stephen Haliburton! Stephen Haliburton's putback is no good. Offensive rebound by Tyrese Doncic! Tyrese Doncic kicks it out.

[00:18] Team_058 possession (Score: 14-28)
Kyle Westbrook attempts a 3Pt. Contested by Trae Tatum (5.2 feet, MAN). KYLE WESTBROOK MAKES IT! Assist: Bradley Sexton
Score: 14-31

[00:03] Team_011 possession (Score: 14-31)
Michael Carter attempts a Midrange. Contested by Stephen Haliburton (3.9 feet, ZONE). Michael Carter misses. Rebound secured by Tyrese Doncic.

================================================================================
                              1ST QUARTER COMPLETE                              
================================================================================

1ST QUARTER SCORE: Team_011 14, Team_058 31

BOX SCORE:
================================================================================

Team_011
--------------------------------------------------------------------------------
Player                MIN  PTS  REB  AST  TO      FG   FG%      3P   3P%
--------------------------------------------------------------------------------
Evan George            12    5    5    2   0   2/6    33.3     0/0   0.0
Pau Barnes             12    4    3    1   0   2/3    66.7     0/0   0.0
Trae Tatum             12    3    0    0   0   2/5    40.0     0/0   0.0
Michael Carter         12    2    1    0   0   1/4    25.0     0/0   0.0

TEAM: FG: 7/18 (38.9%), 3PT: 1/4 (25.0%), REB: 12 (6 off, 6 def), AST: 3, TO: 4
TEAM FOULS: 7 [Team_058 in BONUS]


Team_058
--------------------------------------------------------------------------------
Player                MIN  PTS  REB  AST  TO      FG   FG%      3P   3P%
--------------------------------------------------------------------------------
Kyle Westbrook         12   11    0    1   0   5/7    71.4     0/0   0.0
Stephen Haliburton     12    7    4    0   0   3/3   100.0     0/0   0.0
Vince Hyland           12    6    0    0   0   2/5    40.0     0/0   0.0
Bradley Sexton         12    5    4    2   0   2/3    66.7     0/0   0.0
Tyrese Doncic          12    2    6    2   0   1/1   100.0     0/0   0.0

TEAM: FG: 13/19 (68.4%), 3PT: 5/8 (62.5%), REB: 11 (3 off, 8 def), AST: 5, TO: 2
TEAM FOULS: 4

================================================================================

================================================================================
                       2ND QUARTER - Team_011 vs Team_058                       
================================================================================

[12:00] Team_011 possession (Score: 14-31)
Evan George attempts a Midrange. Contested by Tyrese Doncic (4.9 feet, MAN). Evan George misses. Rebound secured by Bradley Sexton.

[11:43] Team_058 possession (Score: 14-31)
Vince Hyland attempts a Midrange. Contested by Michael Carter (4.8 feet, MAN). VINCE HYLAND MAKES IT!
Score: 14-33

[11:30] Team_011 possession (Score: 14-33)
Evan George attempts a Layup. Contested by Tyrese Doncic (5.0 feet, MAN). EVAN GEORGE MAKES IT! Assist: Michael Carter
Score: 16-33

[11:16] Team_058 possession (Score: 16-33)
Vince Hyland makes the Layup and draws the foul on Pau Barnes! And-1! Vince Hyland to the line for 1. [Team fouls: 1] (Pau Barnes: 1 personal fouls)   FT 1/1: GOOD Vince Hyland makes 1/1 from the line.
Score: 16-36

[11:00] Team_011 possession (Score: 16-36)
FOUL! Shooting foul on Stephen Haliburton. Pau Barnes to the line for 2 free throws. [Team fouls: 1] (Stephen Haliburton: 1 personal fouls)   FT 1/2: GOOD   FT 2/2: GOOD Pau Barnes makes 2/2 from the line.
Score: 18-36

[10:47] Team_058 possession (Score: 18-36)
Stephen Haliburton attempts a 3Pt. Contested by Pau Barnes (3.7 feet, MAN). Stephen Haliburton misses. Rebound secured by Evan George.

[10:32] Team_011 possession (Score: 18-36)
Evan George attempts a Midrange. Contested by Kyle Westbrook (4.8 feet, ZONE). Evan George misses. Rebound secured by Stephen Haliburton.

[10:19] Team_058 possession (Score: 18-36)
Bradley Sexton attempts a 3Pt. Contested by Magic Tatum (4.2 feet, MAN). Bradley Sexton misses. Rebound secured by Pau Barnes.

[10:05] Team_011 possession (Score: 18-36)
Magic Tatum drives, Stephen Haliburton stays with him. Magic Tatum attempts a Layup. Contested by Stephen Haliburton (4.2 feet, ZONE). MAGIC TATUM MAKES IT! Assist: Evan George
Score: 20-36

[09:55] Team_058 possession (Score: 20-36)
Tyrese Doncic makes the Layup and draws the foul on Pau Barnes! And-1! Tyrese Doncic to the line for 1. [Team fouls: 2] (Pau Barnes: 2 personal fouls)   FT 1/1: GOOD Tyrese Doncic makes 1/1 from the line.
Score: 20-39

[09:44] Team_011 possession (Score: 20-39)
Trae Tatum attempts a Midrange. Contested by Stephen Haliburton (4.0 feet, ZONE). TRAE TATUM MAKES IT! Assist: Michael Carter
Score: 22-39

[09:30] Team_058 possession (Score: 22-39)
Bradley Sexton drives and kicks out. Tyrese Doncic attempts a 3Pt. Contested by Pau Barnes (3.9 feet, MAN). Tyrese Doncic misses. Rebound secured by Pau Barnes.

[09:17] Team_011 possession (Score: 22-39)
Michael Carter attempts a 3Pt. Contested by Bradley Sexton (3.6 feet, ZONE). Michael Carter misses. Rebound secured by Tyrese Doncic.

[09:03] Team_058 possession (Score: 22-39)
Vince Hyland attempts a Layup. Contested by Michael Carter (5.1 feet, MAN). Vince Hyland misses. Rebound secured by Evan George.

[08:49] Team_011 possession (Score: 22-39)
Magic Tatum drives to the basket... Magic Tatum loses control! Ball rolls out of bounds! TURNOVER! (dead ball)

[08:49] Substitution (Team_011): Magic Tatum OUT → Shai Leonard IN (stamina_rule2)

[08:49] Substitution (Team_011): Trae Tatum OUT → De'Aaron George IN (stamina_rule2)

[08:49] Substitution (Team_011): Michael Carter OUT → Tyrese Nowitzki IN (stamina_rule2)

[08:49] Substitution (Team_011): Pau Barnes OUT → Russell Davis IN (stamina_rule2)

[08:49] Substitution (Team_011): Evan George OUT → Pau Towns IN (stamina_rule2)

[08:49] Substitution (Team_058): Bradley Sexton OUT → Draymond Williamson IN (stamina_rule2)

[08:49] Substitution (Team_058): Kyle Westbrook OUT → Jordan Ingram IN (stamina_rule2)

[08:49] Substitution (Team_058): Vince Hyland OUT → Pascal Holiday IN (stamina_rule2)

[08:49] Substitution (Team_058): Stephen Haliburton OUT → Shai Lowry IN (stamina_rule2)

[08:49] Substitution (Team_058): Tyrese Doncic OUT → Jarrett Gilgeous-Alexander IN (stamina_rule2)

[08:37] Team_058 possession (Score: 22-39)
FOUL! Shooting foul on Tyrese Nowitzki. Pascal Holiday to the line for 3 free throws. [Team fouls: 3] (Tyrese Nowitzki: 1 personal fouls)   FT 1/3: MISS   FT 2/3: GOOD   FT 3/3: GOOD Pascal Holiday makes 2/3 from the line.
Score: 22-41

[08:18] Team_011 possession (Score: 22-41)
Tyrese Nowitzki attempts a Layup. Contested by Shai Lowry (4.0 feet, ZONE). TYRESE NOWITZKI MAKES IT!
Score: 24-41

[08:03] Team_058 possession (Score: 24-41)
Jordan Ingram attempts a 3Pt. Contested by De'Aaron George (4.8 feet, MAN). Jordan Ingram misses. Rebound secured by Tyrese Nowitzki.

[07:49] Team_011 possession (Score: 24-41)
Pau Towns drives and kicks out. Pau Towns attempts a 3Pt. Contested by Jarrett Gilgeous-Alexander (5.3 feet, MAN). Pau Towns misses. Rebound secured by Jarrett Gilgeous-Alexander.

[07:39] Team_058 possession (Score: 24-41)
Draymond Williamson attempts a 3Pt. Contested by Shai Leonard (4.7 feet, MAN). Draymond Williamson misses. Rebound secured by Pau Towns.

[07:24] Team_011 possession (Score: 24-41)
FOUL! Holding foul on Shai Lowry. [Team fouls: 2] No free throws, side out. (Shai Lowry: 1 personal fouls)

[07:11] Team_011 possession (Score: 24-41)
De'Aaron George attempts a 3Pt. Wide open! Jordan Ingram is 6.2 feet away. [MAN] DE'AARON GEORGE MAKES IT! Assist: Pau Towns
Score: 27-41

[06:58] Team_058 possession (Score: 27-41)
Shai Lowry attempts a Midrange. Contested by Russell Davis (3.7 feet, MAN). Shai Lowry misses. Rebound secured by Pau Towns.

[06:38] Team_011 possession (Score: 27-41)
De'Aaron George drives and kicks out. Tyrese Nowitzki attempts a 3Pt. Contested by Pascal Holiday (4.6 feet, MAN). Tyrese Nowitzki misses. Offensive rebound by Tyrese Nowitzki! Tyrese Nowitzki kicks it out.

[06:25] Team_011 possession (Score: 27-41)
De'Aaron George attempts a 3Pt. Contested by Draymond Williamson (5.5 feet, ZONE). De'Aaron George misses. Rebound secured by Pascal Holiday.

[06:10] Team_058 possession (Score: 27-41)
Draymond Williamson attempts a 3Pt. Contested by Shai Leonard (4.7 feet, MAN). Draymond Williamson misses. Rebound secured by Pau Towns.

[05:57] Team_011 possession (Score: 27-41)
Pau Towns drives to the basket... Pau Towns throws a bad pass! Stolen by Jarrett Gilgeous-Alexander! TURNOVER! (live ball)

[05:42] Team_058 possession (Score: 27-41)
Pascal Holiday attempts a Midrange. Contested by Tyrese Nowitzki (4.7 feet, MAN). Pascal Holiday misses. Offensive rebound by Pascal Holiday! Pascal Holiday's putback is no good. Offensive rebound by Pascal Holiday! Pascal Holiday kicks it out.

[05:26] Team_058 possession (Score: 27-41)
Pascal Holiday attempts a 3Pt. Contested by Shai Leonard (4.3 feet, ZONE). PASCAL HOLIDAY MAKES IT! Assist: Shai Lowry
Score: 27-44

[05:10] Team_011 possession (Score: 27-44)
Russell Davis attempts a Layup. Contested by Shai Lowry (3.6 feet, ZONE). RUSSELL DAVIS MAKES IT! Assist: Tyrese Nowitzki
Score: 29-44

[04:55] Team_058 possession (Score: 29-44)
Jordan Ingram attempts a 3Pt. Contested by Shai Leonard (4.3 feet, ZONE). Jordan Ingram misses. Rebound secured by Russell Davis.

[04:39] Team_011 possession (Score: 29-44)
De'Aaron George drives, picks up Jordan Ingram. Help arrives from Pascal Holiday! De'Aaron George attempts a Dunk. Wide open! Pascal Holiday is 6.2 feet away. [MAN] DE'AARON GEORGE MAKES IT!
Score: 31-44

[04:28] Team_058 possession (Score: 31-44)
Shai Lowry drives and kicks out. Draymond Williamson attempts a 3Pt. Contested by Shai Leonard (4.3 feet, MAN). Draymond Williamson misses. Offensive rebound by Shai Lowry! Shai Lowry kicks it out.

[04:14] Team_058 possession (Score: 31-44)
FOUL! Shooting foul on Russell Davis. Shai Lowry to the line for 2 free throws. [Team fouls: 4] (Russell Davis: 1 personal fouls)   FT 1/2: GOOD   FT 2/2: MISS Shai Lowry makes 1/2 from the line. Rebound secured by Tyrese Nowitzki.
Score: 31-45

[04:02] Team_011 possession (Score: 31-45)
De'Aaron George attempts a Layup. BLOCKED BY SHAI LOWRY! Ball deflects out of bounds off De'Aaron George.

[03:44] Team_058 possession (Score: 31-45)
Shai Lowry attempts a 3Pt. Contested by Russell Davis (3.7 feet, MAN). Shai Lowry misses. Offensive rebound by Shai Lowry! Shai Lowry kicks it out.

[03:29] Team_058 possession (Score: 31-45)
Shai Lowry attempts a Layup. Contested by Russell Davis (3.7 feet, MAN). Shai Lowry misses. Rebound secured by Russell Davis.

[03:15] Team_011 possession (Score: 31-45)
Shai Leonard attempts a 3Pt. Contested by Draymond Williamson (5.3 feet, MAN). SHAI LEONARD MAKES IT! Assist: Russell Davis
Score: 34-45

[03:00] Team_058 possession (Score: 34-45)
Shai Lowry drives and kicks out. Shai Lowry attempts a 3Pt. Contested by Russell Davis (3.8 feet, MAN). Shai Lowry misses. Offensive rebound by Shai Lowry! Shai Lowry kicks it out.

[02:47] Team_058 possession (Score: 34-45)
Draymond Williamson drives and kicks out. Jarrett Gilgeous-Alexander attempts a Midrange. Contested by Russell Davis (3.8 feet, ZONE). Jarrett Gilgeous-Alexander misses. Rebound secured by Pau Towns.

[02:31] Team_011 possession (Score: 34-45)
FOUL! Shooting foul on Shai Lowry. De'Aaron George to the line for 2 free throws. [Team fouls: 3] (Shai Lowry: 2 personal fouls)   FT 1/2: GOOD   FT 2/2: GOOD De'Aaron George makes 2/2 from the line.
Score: 36-45

[02:17] Team_058 possession (Score: 36-45)
Draymond Williamson drives, picks up Shai Leonard. Help arrives from Tyrese Nowitzki! Draymond Williamson attempts a Layup. Contested by Tyrese Nowitzki (4.7 feet, MAN). Draymond Williamson misses. Rebound secured by Russell Davis.

[02:05] Team_011 possession (Score: 36-45)
Russell Davis attempts a 3Pt. Contested by Draymond Williamson (4.9 feet, ZONE). Russell Davis misses. Rebound secured by Pascal Holiday.

[01:48] Team_058 possession (Score: 36-45)
Jordan Ingram attempts a Layup. BLOCKED BY PAU TOWNS! Ball is loose! Rebound secured by Tyrese Nowitzki.

[01:34] Team_011 possession (Score: 36-45)
FOUL! Holding foul on Draymond Williamson. [Team fouls: 4] No free throws, side out. (Draymond Williamson: 1 personal fouls)

[01:20] Team_011 possession (Score: 36-45)
Pau Towns drives, Jarrett Gilgeous-Alexander stays with him. Pau Towns attempts a Dunk. Contested by Jarrett Gilgeous-Alexander (5.3 feet, MAN). PAU TOWNS MAKES IT! Assist: Shai Leonard
Score: 38-45

[01:06] Team_058 possession (Score: 38-45)
Draymond Williamson attempts a 3Pt. Contested by Shai Leonard (4.8 feet, MAN). Draymond Williamson misses. Rebound secured by Russell Davis.

[00:51] Team_011 possession (Score: 38-45)
De'Aaron George attempts a 3Pt. Contested by Draymond Williamson (5.6 feet, ZONE). De'Aaron George misses. Offensive rebound by Tyrese Nowitzki! Tyrese Nowitzki kicks it out.

[00:39] Team_011 possession (Score: 38-45)
FOUL! Shooting foul on Shai Lowry. De'Aaron George to the line for 2 free throws. [BONUS: 5 team fouls] (Shai Lowry: 3 personal fouls)   FT 1/2: GOOD   FT 2/2: GOOD De'Aaron George makes 2/2 from the line.
Score: 40-45

[00:28] Team_058 possession (Score: 40-45)
Jordan Ingram drives to the basket... Jordan Ingram throws a bad pass! Stolen by De'Aaron George! TURNOVER! (live ball)

[00:12] Team_011 possession (Score: 40-45)
De'Aaron George attempts a 3Pt. Contested by Draymond Williamson (5.7 feet, ZONE). De'Aaron George misses. Rebound secured by Jarrett Gilgeous-Alexander.

================================================================================
                              2ND QUARTER COMPLETE                              
================================================================================

2ND QUARTER SCORE: Team_011 26, Team_058 14

BOX SCORE:
================================================================================

Team_011
--------------------------------------------------------------------------------
Player                MIN  PTS  REB  AST  TO      FG   FG%      3P   3P%
--------------------------------------------------------------------------------
De'Aaron George         9    9    0    0   0   4/7    57.1     0/0   0.0
Shai Leonard            9    3    0    1   0   1/1   100.0     0/0   0.0
Evan George            16    2    2    1   0   1/3    33.3     0/0   0.0
Pau Barnes             16    2    2    0   0   1/1   100.0     0/0   0.0
Magic Tatum            16    2    0    0   0   1/1   100.0     0/0   0.0
Trae Tatum             16    2    0    0   0   1/1   100.0     0/0   0.0
Tyrese Nowitzki         9    2    5    1   0   1/1   100.0     0/0   0.0
Pau Towns               9    2    4    1   0   1/2    50.0     0/0   0.0
Russell Davis           9    2    4    1   0   1/2    50.0     0/0   0.0
Michael Carter         16    0    0    2   0   0/1     0.0     0/0   0.0

TEAM: FG: 12/20 (60.0%), 3PT: 2/6 (33.3%), REB: 17 (2 off, 15 def), AST: 7, TO: 2
TEAM FOULS: 4


Team_058
--------------------------------------------------------------------------------
Player                MIN  PTS  REB  AST  TO      FG   FG%      3P   3P%
--------------------------------------------------------------------------------
Vince Hyland           16    5    0    0   0   2/3    66.7     0/0   0.0
Pascal Holiday          9    5    3    0   0   2/2   100.0     0/0   0.0
Tyrese Doncic          16    3    1    0   0   1/1   100.0     0/0   0.0
Bradley Sexton         16    0    1    0   0   0/2     0.0     0/0   0.0
Stephen Haliburton     16    0    1    0   0   0/1     0.0     0/0   0.0
Jordan Ingram           9    0    0    0   0   0/3     0.0     0/0   0.0
Jarrett Gilgeous-Alexander    9    0    2    0   0   0/0     0.0     0/0   0.0
Draymond Williamson     9    0    0    0   0   0/5     0.0     0/0   0.0
Shai Lowry              9    0    3    1   0   0/3     0.0     0/0   0.0

TEAM: FG: 5/20 (25.0%), 3PT: 2/9 (22.2%), REB: 11 (4 off, 7 def), AST: 1, TO: 1
TEAM FOULS: 5 [Team_011 in BONUS]

================================================================================

================================================================================
                       3RD QUARTER - Team_011 vs Team_058                       
================================================================================

[12:00] Team_011 possession (Score: 40-45)
Trae Tatum attempts a 3Pt. Contested by Kyle Westbrook (3.9 feet, ZONE). Trae Tatum misses. Rebound secured by Bradley Sexton.

[11:45] Team_058 possession (Score: 40-45)
Tyrese Doncic attempts a Midrange. Contested by Michael Carter (4.2 feet, ZONE). TYRESE DONCIC MAKES IT! Assist: Stephen Haliburton
Score: 40-47

[11:35] Team_011 possession (Score: 40-47)
Magic Tatum attempts a 3Pt. Contested by Bradley Sexton (3.2 feet, ZONE). MAGIC TATUM MAKES IT! Assist: Michael Carter
Score: 43-47

[11:19] Team_058 possession (Score: 43-47)
Bradley Sexton attempts a Layup. Contested by Magic Tatum (3.7 feet, MAN). BRADLEY SEXTON MAKES IT!
Score: 43-49

[11:04] Team_011 possession (Score: 43-49)
Michael Carter drives, Vince Hyland stays with him. Michael Carter attempts a Layup. Contested by Vince Hyland (4.4 feet, MAN). MICHAEL CARTER MAKES IT!
Score: 45-49

[10:45] Team_058 possession (Score: 45-49)
Stephen Haliburton drives and kicks out. Stephen Haliburton attempts a 3Pt. Contested by Pau Barnes (2.9 feet, MAN). Stephen Haliburton misses. Offensive rebound by Tyrese Doncic! Tyrese Doncic kicks it out.

[10:33] Team_058 possession (Score: 45-49)
Bradley Sexton attempts a Midrange. Contested by Magic Tatum (3.7 feet, MAN). Bradley Sexton misses. Rebound secured by Michael Carter.

[10:20] Team_011 possession (Score: 45-49)
Michael Carter attempts a Midrange. Contested by Kyle Westbrook (3.9 feet, ZONE). Michael Carter misses. Offensive rebound by Evan George! Evan George puts it back in!
Score: 47-49

[10:03] Team_058 possession (Score: 47-49)
Bradley Sexton attempts a Midrange. Contested by Magic Tatum (3.7 feet, MAN). BRADLEY SEXTON MAKES IT! Assist: Stephen Haliburton
Score: 47-51

[09:47] Team_011 possession (Score: 47-51)
Michael Carter drives to the basket... Michael Carter throws a bad pass! Stolen by Stephen Haliburton! TURNOVER! (live ball)

[09:32] Team_058 possession (Score: 47-51)
Vince Hyland attempts a 3Pt. Contested by Magic Tatum (3.7 feet, ZONE). VINCE HYLAND MAKES IT! Assist: Tyrese Doncic
Score: 47-54

[09:15] Team_011 possession (Score: 47-54)
Pau Barnes attempts a Layup. Contested by Stephen Haliburton (4.1 feet, MAN). PAU BARNES MAKES IT!
Score: 49-54

[09:04] Team_058 possession (Score: 49-54)
Vince Hyland throws a bad pass out of bounds! TURNOVER! (dead ball)

[08:49] Team_011 possession (Score: 49-54)
Trae Tatum attempts a 3Pt. Contested by Bradley Sexton (2.9 feet, ZONE). Trae Tatum misses. Offensive rebound by Pau Barnes! Pau Barnes's putback is no good. Rebound secured by Tyrese Doncic.

[08:33] Team_058 possession (Score: 49-54)
Vince Hyland attempts a 3Pt. Contested by Pau Barnes (3.3 feet, ZONE). Vince Hyland misses. Rebound secured by Evan George.

[08:18] Team_011 possession (Score: 49-54)
Michael Carter attempts a Midrange. BLOCKED BY VINCE HYLAND! Ball is loose! Rebound secured by Tyrese Doncic.

[07:58] Team_058 possession (Score: 49-54)
Kyle Westbrook drives and kicks out. Tyrese Doncic attempts a 3Pt. Contested by Pau Barnes (2.9 feet, MAN). TYRESE DONCIC MAKES IT! Assist: Bradley Sexton
Score: 49-57

[07:43] Team_011 possession (Score: 49-57)
FOUL! Reach-in foul on Stephen Haliburton during the drive. [Team fouls: 1] No free throws, side out. (Stephen Haliburton: 1 personal fouls)

[07:26] Team_011 possession (Score: 49-57)
Trae Tatum attempts a 3Pt. Contested by Kyle Westbrook (3.9 feet, MAN). Trae Tatum misses. Rebound secured by Tyrese Doncic.

[07:12] Team_058 possession (Score: 49-57)
Tyrese Doncic attempts a 3Pt. Contested by Pau Barnes (3.0 feet, MAN). TYRESE DONCIC MAKES IT!
Score: 49-60

[06:59] Team_011 possession (Score: 49-60)
Evan George drives and kicks out. FOUL! Shooting foul on Stephen Haliburton. Michael Carter to the line for 2 free throws. [Team fouls: 2] (Stephen Haliburton: 2 personal fouls)   FT 1/2: GOOD   FT 2/2: MISS Michael Carter makes 1/2 from the line. Rebound secured by Stephen Haliburton.
Score: 50-60

[06:48] Team_058 possession (Score: 50-60)
Stephen Haliburton attempts a 3Pt. Contested by Pau Barnes (3.1 feet, MAN). Stephen Haliburton misses. Rebound secured by Pau Barnes.

[06:33] Team_011 possession (Score: 50-60)
Evan George drives, picks up Stephen Haliburton. Help arrives from Bradley Sexton! Evan George attempts a Dunk. Contested by Bradley Sexton (3.7 feet, ZONE). EVAN GEORGE MAKES IT! Assist: Trae Tatum
Score: 52-60

[06:21] Team_058 possession (Score: 52-60)
FOUL! Shooting foul on Michael Carter. Bradley Sexton to the line for 2 free throws. [Team fouls: 1] (Michael Carter: 1 personal fouls)   FT 1/2: GOOD   FT 2/2: GOOD Bradley Sexton makes 2/2 from the line.
Score: 52-62

[06:09] Team_011 possession (Score: 52-62)
Evan George makes the Midrange and draws the foul on Tyrese Doncic! And-1! Evan George to the line for 1. [Team fouls: 3] (Tyrese Doncic: 1 personal fouls)   FT 1/1: MISS Evan George makes 0/1 from the line. Offensive rebound by Pau Barnes! Pau Barnes puts it back in!
Score: 56-62

[05:52] Team_058 possession (Score: 56-62)
Kyle Westbrook attempts a 3Pt. BLOCKED BY TRAE TATUM! Ball is loose! Offensive rebound by Stephen Haliburton! Stephen Haliburton kicks it out.

[05:38] Team_058 possession (Score: 56-62)
Tyrese Doncic attempts a Midrange. Contested by Trae Tatum (4.6 feet, ZONE). TYRESE DONCIC MAKES IT!
Score: 56-64

[05:24] Team_011 possession (Score: 56-64)
Pau Barnes attempts a Midrange. Contested by Stephen Haliburton (4.1 feet, MAN). PAU BARNES MAKES IT! Assist: Trae Tatum
Score: 58-64

[05:11] Team_058 possession (Score: 58-64)
Tyrese Doncic drives, Pau Barnes stays with him. Tyrese Doncic attempts a Dunk. Contested by Pau Barnes (3.0 feet, MAN). Tyrese Doncic misses. Rebound secured by Pau Barnes.

[04:51] Team_011 possession (Score: 58-64)
Pau Barnes drives, Stephen Haliburton stays with him. Pau Barnes attempts a Dunk. Contested by Stephen Haliburton (4.1 feet, MAN). PAU BARNES MAKES IT!
Score: 60-64

[04:40] Team_058 possession (Score: 60-64)
Kyle Westbrook throws a bad pass out of bounds! TURNOVER! (dead ball)

[04:22] Team_011 possession (Score: 60-64)
Michael Carter drives, Vince Hyland stays with him. Michael Carter attempts a Layup. Contested by Vince Hyland (4.4 feet, MAN). Michael Carter misses. Rebound secured by Bradley Sexton.

[04:06] Team_058 possession (Score: 60-64)
Bradley Sexton attempts a 3Pt. Contested by Magic Tatum (3.8 feet, MAN). Bradley Sexton misses. Rebound secured by Michael Carter.

[03:50] Team_011 possession (Score: 60-64)
FOUL! Shooting foul on Vince Hyland. Michael Carter to the line for 2 free throws. [Team fouls: 4] (Vince Hyland: 1 personal fouls)   FT 1/2: MISS   FT 2/2: GOOD Michael Carter makes 1/2 from the line.
Score: 61-64

[03:34] Team_058 possession (Score: 61-64)
FOUL! Reach-in foul on Pau Barnes during the drive. [Team fouls: 2] No free throws, side out. (Pau Barnes: 1 personal fouls)

[03:19] Team_058 possession (Score: 61-64)
Kyle Westbrook drives, picks up Trae Tatum. Help arrives from Magic Tatum! Kyle Westbrook attempts a Dunk. Contested by Magic Tatum (4.9 feet, MAN). KYLE WESTBROOK MAKES IT! Assist: Stephen Haliburton
Score: 61-66

[03:03] Team_011 possession (Score: 61-66)
Magic Tatum attempts a Midrange. Contested by Bradley Sexton (3.4 feet, MAN). MAGIC TATUM MAKES IT! Assist: Trae Tatum
Score: 63-66

[02:48] Team_058 possession (Score: 63-66)
Kyle Westbrook attempts a 3Pt. Contested by Magic Tatum (3.7 feet, ZONE). Kyle Westbrook misses. Rebound secured by Evan George.

[02:32] Team_011 possession (Score: 63-66)
Trae Tatum attempts a 3Pt. Contested by Kyle Westbrook (4.2 feet, MAN). Trae Tatum misses. Rebound secured by Bradley Sexton.

[02:16] Team_058 possession (Score: 63-66)
Stephen Haliburton attempts a 3Pt. Contested by Pau Barnes (3.4 feet, MAN). Stephen Haliburton misses. Rebound secured by Pau Barnes.

[02:00] Team_011 possession (Score: 63-66)
FOUL! Reach-in foul on Stephen Haliburton during the drive. [IN THE BONUS! 5 team fouls] Trae Tatum to the line for 2 free throws. (Stephen Haliburton: 3 personal fouls)   FT 1/2: GOOD   FT 2/2: GOOD Trae Tatum makes 2/2 from the line.
Score: 65-66

[01:42] Team_058 possession (Score: 65-66)
Bradley Sexton drives and kicks out. Stephen Haliburton attempts a 3Pt. Contested by Magic Tatum (3.7 feet, ZONE). Stephen Haliburton misses. Rebound secured by Pau Barnes.

[01:26] Team_011 possession (Score: 65-66)
FOUL! Shooting foul on Stephen Haliburton. Pau Barnes to the line for 2 free throws. [BONUS: 6 team fouls] (Stephen Haliburton: 4 personal fouls)   FT 1/2: GOOD   FT 2/2: GOOD Pau Barnes makes 2/2 from the line.
Score: 67-66

[01:10] Team_058 possession (Score: 67-66)
Vince Hyland attempts a Layup. BLOCKED BY MICHAEL CARTER! Ball deflects out of bounds off Vince Hyland.

[00:57] Team_011 possession (Score: 67-66)
Michael Carter attempts a Midrange. Contested by Vince Hyland (4.7 feet, MAN). MICHAEL CARTER MAKES IT! Assist: Magic Tatum
Score: 69-66

[00:43] Team_058 possession (Score: 69-66)
Tyrese Doncic attempts a Midrange. Contested by Pau Barnes (3.5 feet, ZONE). Tyrese Doncic misses. Rebound secured by Pau Barnes.

[00:29] Team_011 possession (Score: 69-66)
Magic Tatum attempts a Midrange. Contested by Bradley Sexton (3.6 feet, MAN). Magic Tatum misses. FOUL! Loose ball foul on Tyrese Doncic during the rebound battle. [IN THE BONUS! 7 team fouls] Pau Barnes to the line for 2 free throws. (Tyrese Doncic: 2 personal fouls)   FT 1/2: MISS   FT 2/2: GOOD Pau Barnes makes 1/2 from the line.
Score: 70-66

[00:13] Team_058 possession (Score: 70-66)
Vince Hyland drives and kicks out. Stephen Haliburton attempts a Midrange. Contested by Pau Barnes (3.6 feet, MAN). STEPHEN HALIBURTON MAKES IT! Assist: Bradley Sexton
Score: 70-68

================================================================================
                              3RD QUARTER COMPLETE                              
================================================================================

3RD QUARTER SCORE: Team_011 30, Team_058 23

BOX SCORE:
================================================================================

Team_011
--------------------------------------------------------------------------------
Player                MIN  PTS  REB  AST  TO      FG   FG%      3P   3P%
--------------------------------------------------------------------------------
Pau Barnes             28   13    5    0   0   6/6   100.0     0/0   0.0
Magic Tatum            28    5    0    1   0   2/2   100.0     0/0   0.0
Michael Carter         28    5    2    1   0   3/5    60.0     0/0   0.0
Evan George            28    4    3    0   0   2/3    66.7     0/0   0.0
Trae Tatum             28    2    0    3   0   1/5    20.0     0/0   0.0

TEAM: FG: 14/21 (66.7%), 3PT: 1/5 (20.0%), REB: 11 (2 off, 9 def), AST: 5, TO: 1
TEAM FOULS: 2


Team_058
--------------------------------------------------------------------------------
Player                MIN  PTS  REB  AST  TO      FG   FG%      3P   3P%
--------------------------------------------------------------------------------
Tyrese Doncic          28   10    4    1   0   4/6    66.7     0/0   0.0
Bradley Sexton         28    6    3    2   0   3/6    50.0     0/0   0.0
Vince Hyland           28    3    0    0   0   1/3    33.3     0/0   0.0
Stephen Haliburton     28    2    2    3   0   1/3    33.3     0/0   0.0
Kyle Westbrook         28    2    0    0   0   1/2    50.0     0/0   0.0

TEAM: FG: 10/20 (50.0%), 3PT: 2/7 (28.6%), REB: 8 (2 off, 6 def), AST: 6, TO: 2
TEAM FOULS: 7 [Team_011 in BONUS]

================================================================================

================================================================================
                       4TH QUARTER - Team_011 vs Team_058                       
================================================================================

[12:00] Team_011 possession (Score: 70-68)
Pau Barnes attempts a 3Pt. Contested by Bradley Sexton (3.9 feet, ZONE). Pau Barnes misses. Offensive rebound by Pau Barnes! Pau Barnes's putback is no good. Offensive rebound by Pau Barnes! Pau Barnes kicks it out.

[11:41] Team_011 possession (Score: 70-68)
Trae Tatum attempts a Midrange. Contested by Kyle Westbrook (4.3 feet, MAN). TRAE TATUM MAKES IT!
Score: 72-68

[11:30] Team_058 possession (Score: 72-68)
Tyrese Doncic drives, Pau Barnes stays with him. Tyrese Doncic attempts a Dunk. Contested by Pau Barnes (3.4 feet, MAN). Tyrese Doncic misses. FOUL! Loose ball foul on Evan George during the rebound battle. [Team fouls: 1] No free throws, side out. (Evan George: 1 personal fouls)

[11:14] Team_058 possession (Score: 72-68)
Bradley Sexton attempts a Midrange. Contested by Evan George (5.8 feet, ZONE). BRADLEY SEXTON MAKES IT! Assist: Stephen Haliburton
Score: 72-70

[11:03] Team_011 possession (Score: 72-70)
Magic Tatum drives, Stephen Haliburton stays with him. Magic Tatum attempts a Layup. Contested by Stephen Haliburton (4.0 feet, ZONE). MAGIC TATUM MAKES IT! Assist: Michael Carter
Score: 74-70

[10:49] Team_058 possession (Score: 74-70)
Kyle Westbrook drives and kicks out. Kyle Westbrook attempts a Midrange. Contested by Pau Barnes (3.5 feet, ZONE). Kyle Westbrook misses. Rebound secured by Michael Carter.

[10:34] Team_011 possession (Score: 74-70)
Pau Barnes throws a bad pass out of bounds! TURNOVER! (dead ball)

[10:34] Substitution (Team_011): Magic Tatum OUT → Shai Leonard IN (stamina_rule2)

[10:34] Substitution (Team_011): Trae Tatum OUT → De'Aaron George IN (stamina_rule2)

[10:34] Substitution (Team_011): Michael Carter OUT → Tyrese Nowitzki IN (stamina_rule2)

[10:34] Substitution (Team_011): Pau Barnes OUT → Russell Davis IN (stamina_rule2)

[10:34] Substitution (Team_011): Evan George OUT → Pau Towns IN (stamina_rule2)

[10:34] Substitution (Team_058): Bradley Sexton OUT → Draymond Williamson IN (stamina_rule2)

[10:34] Substitution (Team_058): Kyle Westbrook OUT → Jordan Ingram IN (stamina_rule2)

[10:34] Substitution (Team_058): Vince Hyland OUT → Pascal Holiday IN (stamina_rule2)

[10:34] Substitution (Team_058): Stephen Haliburton OUT → Shai Lowry IN (stamina_rule2)

[10:34] Substitution (Team_058): Tyrese Doncic OUT → Jarrett Gilgeous-Alexander IN (stamina_rule2)

[10:18] Team_058 possession (Score: 74-70)
FOUL! Reach-in foul on Russell Davis during the drive. [Team fouls: 2] No free throws, side out. (Russell Davis: 1 personal fouls)

[10:04] Team_058 possession (Score: 74-70)
FOUL! Shooting foul on De'Aaron George. Shai Lowry to the line for 2 free throws. [Team fouls: 3] (De'Aaron George: 1 personal fouls)   FT 1/2: MISS   FT 2/2: GOOD Shai Lowry makes 1/2 from the line.
Score: 74-71

[09:49] Team_011 possession (Score: 74-71)
De'Aaron George makes the Dunk and draws the foul on Jordan Ingram! And-1! De'Aaron George to the line for 1. [Team fouls: 1] (Jordan Ingram: 1 personal fouls)   FT 1/1: MISS De'Aaron George makes 0/1 from the line. FOUL! Loose ball foul on Pascal Holiday during the free throw rebound! [Team fouls: 2] No free throws, side out. (Pascal Holiday: 1 personal fouls)
Score: 76-71

[09:36] Team_011 possession (Score: 76-71)
De'Aaron George attempts a Midrange. Contested by Shai Lowry (4.3 feet, ZONE). DE'AARON GEORGE MAKES IT! Assist: Shai Leonard
Score: 78-71

[09:21] Team_058 possession (Score: 78-71)
Pascal Holiday attempts a Midrange. Contested by Tyrese Nowitzki (4.7 feet, MAN). Pascal Holiday misses. Rebound secured by Tyrese Nowitzki.

[09:08] Team_011 possession (Score: 78-71)
FOUL! Shooting foul on Shai Lowry. Pau Towns to the line for 2 free throws. [Team fouls: 3] (Shai Lowry: 1 personal fouls)   FT 1/2: GOOD   FT 2/2: GOOD Pau Towns makes 2/2 from the line.
Score: 80-71

[08:54] Team_058 possession (Score: 80-71)
Jordan Ingram attempts a 3Pt. Contested by De'Aaron George (4.8 feet, MAN). Jordan Ingram misses. Rebound secured by Pau Towns.

[08:39] Team_011 possession (Score: 80-71)
De'Aaron George drives, picks up Jordan Ingram. Help arrives from Pascal Holiday! De'Aaron George attempts a Dunk. Wide open! Pascal Holiday is 6.2 feet away. [MAN] DE'AARON GEORGE MAKES IT!
Score: 82-71

[08:28] Team_058 possession (Score: 82-71)
Shai Lowry attempts a 3Pt. Contested by Russell Davis (3.7 feet, MAN). Shai Lowry misses. Rebound secured by Pau Towns.

[08:16] Team_011 possession (Score: 82-71)
Pau Towns throws a bad pass! Stolen by Jarrett Gilgeous-Alexander! TURNOVER! (live ball)

[08:00] Team_058 possession (Score: 82-71)
FOUL! Shooting foul on De'Aaron George. Jordan Ingram to the line for 3 free throws. [Team fouls: 4] (De'Aaron George: 2 personal fouls)   FT 1/3: GOOD   FT 2/3: GOOD   FT 3/3: GOOD Jordan Ingram makes 3/3 from the line.
Score: 82-74

[07:48] Team_011 possession (Score: 82-74)
Shai Leonard attempts a Midrange. Contested by Draymond Williamson (5.3 feet, ZONE). SHAI LEONARD MAKES IT! Assist: Tyrese Nowitzki
Score: 84-74

[07:35] Team_058 possession (Score: 84-74)
Draymond Williamson drives, Russell Davis stays with him. Draymond Williamson attempts a Dunk. Contested by Russell Davis (4.2 feet, ZONE). Draymond Williamson misses. Rebound secured by Tyrese Nowitzki.

[07:21] Team_011 possession (Score: 84-74)
De'Aaron George makes the Layup and draws the foul on Shai Lowry! And-1! De'Aaron George to the line for 1. [Team fouls: 4] (Shai Lowry: 2 personal fouls)   FT 1/1: GOOD De'Aaron George makes 1/1 from the line.
Score: 87-74

[07:11] Team_058 possession (Score: 87-74)
Draymond Williamson drives, Russell Davis stays with him. Draymond Williamson attempts a Layup. Contested by Russell Davis (4.2 feet, ZONE). DRAYMOND WILLIAMSON MAKES IT! Assist: Pascal Holiday
Score: 87-76

[06:56] Team_011 possession (Score: 87-76)
Russell Davis attempts a Layup. Contested by Shai Lowry (3.6 feet, MAN). Russell Davis misses. Offensive rebound by Pau Towns! Pau Towns kicks it out.

[06:39] Team_011 possession (Score: 87-76)
Russell Davis attempts a Midrange. Contested by Jordan Ingram (5.6 feet, ZONE). Russell Davis misses. Rebound secured by Jarrett Gilgeous-Alexander.

[06:25] Team_058 possession (Score: 87-76)
FOUL! Holding foul on Shai Leonard. [IN THE BONUS! 5 team fouls] Draymond Williamson to the line for 2 free throws. (Shai Leonard: 1 personal fouls)   FT 1/2: GOOD   FT 2/2: GOOD Draymond Williamson makes 2/2 from the line.
Score: 87-78

[06:13] Team_011 possession (Score: 87-78)
De'Aaron George attempts a Layup. Contested by Shai Lowry (4.3 feet, ZONE). DE'AARON GEORGE MAKES IT!
Score: 89-78

[06:02] Team_058 possession (Score: 89-78)
Draymond Williamson attempts a 3Pt. Contested by Shai Leonard (4.7 feet, ZONE). Draymond Williamson misses. Rebound secured by Russell Davis.

[05:50] Team_011 possession (Score: 89-78)
FOUL! Holding foul on Jarrett Gilgeous-Alexander. [IN THE BONUS! 5 team fouls] Pau Towns to the line for 2 free throws. (Jarrett Gilgeous-Alexander: 1 personal fouls)   FT 1/2: GOOD   FT 2/2: GOOD Pau Towns makes 2/2 from the line.
Score: 91-78

[05:36] Team_058 possession (Score: 91-78)
Pascal Holiday makes the Layup and draws the foul on Shai Leonard! And-1! Pascal Holiday to the line for 1. [BONUS: 6 team fouls] (Shai Leonard: 2 personal fouls)   FT 1/1: GOOD Pascal Holiday makes 1/1 from the line.
Score: 91-81

[05:21] Team_011 possession (Score: 91-81)
Shai Leonard attempts a 3Pt. Contested by Draymond Williamson (5.3 feet, MAN). Shai Leonard misses. Rebound secured by Pascal Holiday.

[05:04] Team_058 possession (Score: 91-81)
Jordan Ingram attempts a 3Pt. Contested by De'Aaron George (4.8 feet, MAN). Jordan Ingram misses. Rebound secured by Tyrese Nowitzki.

[04:46] Team_011 possession (Score: 91-81)
Pau Towns attempts a Layup. Contested by Jarrett Gilgeous-Alexander (5.2 feet, MAN). Pau Towns misses. Rebound secured by Pascal Holiday.

[04:32] Team_058 possession (Score: 91-81)
Jordan Ingram attempts a Midrange. Contested by Tyrese Nowitzki (4.7 feet, ZONE). Jordan Ingram misses. Offensive rebound by Pascal Holiday! Pascal Holiday puts it back in!
Score: 91-83

[04:21] Team_011 possession (Score: 91-83)
FOUL! Holding foul on Pascal Holiday. [IN THE BONUS! 6 team fouls] Tyrese Nowitzki to the line for 2 free throws. (Pascal Holiday: 2 personal fouls)   FT 1/2: GOOD   FT 2/2: GOOD Tyrese Nowitzki makes 2/2 from the line.
Score: 93-83

[04:01] Team_058 possession (Score: 93-83)
Jordan Ingram attempts a 3Pt. Contested by De'Aaron George (4.8 feet, MAN). Jordan Ingram misses. Rebound secured by Russell Davis.

[03:47] Team_011 possession (Score: 93-83)
Russell Davis attempts a 3Pt. Contested by Draymond Williamson (4.9 feet, ZONE). Russell Davis misses. Rebound secured by Shai Lowry.

[03:31] Team_058 possession (Score: 93-83)
Draymond Williamson drives, Shai Leonard stays with him. Draymond Williamson attempts a Dunk. Contested by Shai Leonard (4.7 feet, MAN). Draymond Williamson misses. Rebound secured by Russell Davis.

[03:21] Team_011 possession (Score: 93-83)
De'Aaron George attempts a Midrange. Wide open! Jordan Ingram is 6.3 feet away. [MAN] De'Aaron George misses. Rebound secured by Jarrett Gilgeous-Alexander.

[03:06] Team_058 possession (Score: 93-83)
FOUL! Holding foul on Pau Towns. [IN THE BONUS! 7 team fouls] Jarrett Gilgeous-Alexander to the line for 2 free throws. (Pau Towns: 1 personal fouls)   FT 1/2: MISS   FT 2/2: GOOD Jarrett Gilgeous-Alexander makes 1/2 from the line.
Score: 93-84

[02:50] Team_011 possession (Score: 93-84)
De'Aaron George makes the Layup and draws the foul on Shai Lowry! And-1! De'Aaron George to the line for 1. [BONUS: 7 team fouls] (Shai Lowry: 3 personal fouls)   FT 1/1: GOOD De'Aaron George makes 1/1 from the line.
Score: 96-84

[02:36] Team_058 possession (Score: 96-84)
Jarrett Gilgeous-Alexander makes the Dunk and draws the foul on Pau Towns! And-1! Jarrett Gilgeous-Alexander to the line for 1. [BONUS: 8 team fouls] (Pau Towns: 2 personal fouls)   FT 1/1: GOOD Jarrett Gilgeous-Alexander makes 1/1 from the line.
Score: 96-87

[02:20] Team_011 possession (Score: 96-87)
Tyrese Nowitzki attempts a 3Pt. Contested by Pascal Holiday (4.6 feet, MAN). TYRESE NOWITZKI MAKES IT! Assist: Shai Leonard
Score: 99-87

[02:06] Team_058 possession (Score: 99-87)
Jarrett Gilgeous-Alexander attempts a Layup. Contested by Russell Davis (3.8 feet, ZONE). JARRETT GILGEOUS-ALEXANDER MAKES IT! Assist: Draymond Williamson
Score: 99-89

[01:53] Team_011 possession (Score: 99-89)
De'Aaron George throws a bad pass out of bounds! TURNOVER! (dead ball)

[01:38] Team_058 possession (Score: 99-89)
Pascal Holiday drives, Russell Davis stays with him. Pascal Holiday attempts a Dunk. Contested by Russell Davis (4.0 feet, ZONE). PASCAL HOLIDAY MAKES IT!
Score: 99-91

[01:26] Team_011 possession (Score: 99-91)
Russell Davis attempts a Layup. Contested by Shai Lowry (4.0 feet, MAN). RUSSELL DAVIS MAKES IT! Assist: Pau Towns
Score: 101-91

[01:12] Team_058 possession (Score: 101-91)
Jordan Ingram attempts a 3Pt. Contested by De'Aaron George (5.0 feet, MAN). Jordan Ingram misses. Rebound secured by Tyrese Nowitzki.

[00:55] Team_011 possession (Score: 101-91)
Shai Leonard attempts a 3Pt. Contested by Draymond Williamson (5.5 feet, MAN). SHAI LEONARD MAKES IT!
Score: 104-91

[00:36] Team_058 possession (Score: 104-91)
Shai Lowry drives to the basket... Shai Lowry loses the ball! Stripped by Russell Davis! TURNOVER! (live ball)

[00:18] Team_011 possession (Score: 104-91)
Shai Leonard attempts a Midrange. Contested by Draymond Williamson (5.6 feet, MAN). Shai Leonard misses. Rebound secured by Shai Lowry.

[00:07] Team_058 possession (Score: 104-91)
Pascal Holiday attempts a Layup. BLOCKED BY TYRESE NOWITZKI! Ball deflects out of bounds off Pascal Holiday.

================================================================================
                              4TH QUARTER COMPLETE                              
================================================================================

4TH QUARTER SCORE: Team_011 34, Team_058 23

BOX SCORE:
================================================================================

Team_011
--------------------------------------------------------------------------------
Player                MIN  PTS  REB  AST  TO      FG   FG%      3P   3P%
--------------------------------------------------------------------------------
De'Aaron George        19   12    0    0   0   5/6    83.3     0/0   0.0
Tyrese Nowitzki        19    5    5    1   0   2/2   100.0     0/0   0.0
Shai Leonard           19    5    0    2   0   2/4    50.0     0/0   0.0
Pau Towns              19    4    3    1   0   2/3    66.7     0/0   0.0
Trae Tatum             29    2    0    0   0   1/1   100.0     0/0   0.0
Magic Tatum            29    2    0    0   0   1/1   100.0     0/0   0.0
Russell Davis          19    2    3    0   0   1/3    33.3     0/0   0.0
Pau Barnes             29    0    1    0   0   0/0     0.0     0/0   0.0
Michael Carter         29    0    1    1   0   0/0     0.0     0/0   0.0

TEAM: FG: 14/20 (70.0%), 3PT: 2/4 (50.0%), REB: 13 (3 off, 10 def), AST: 5, TO: 3
TEAM FOULS: 8 [Team_058 in BONUS]


Team_058
--------------------------------------------------------------------------------
Player                MIN  PTS  REB  AST  TO      FG   FG%      3P   3P%
--------------------------------------------------------------------------------
Pascal Holiday         19    7    3    1   0   3/5    60.0     0/0   0.0
Jarrett Gilgeous-Alexander   19    6    2    0   0   3/3   100.0     0/0   0.0
Draymond Williamson    19    4    0    1   0   2/5    40.0     0/0   0.0
Jordan Ingram          19    3    0    0   0   1/5    20.0     0/0   0.0
Bradley Sexton         29    2    0    0   0   1/1   100.0     0/0   0.0
Shai Lowry             19    1    2    0   0   1/2    50.0     0/0   0.0
Stephen Haliburton     29    0    1    1   0   0/0     0.0     0/0   0.0
Kyle Westbrook         29    0    0    0   0   0/1     0.0     0/0   0.0

TEAM: FG: 11/22 (50.0%), 3PT: 1/7 (14.3%), REB: 8 (2 off, 6 def), AST: 3, TO: 1
TEAM FOULS: 7 [Team_011 in BONUS]

================================================================================

================================================================================
                               FULL GAME COMPLETE                               
================================================================================

FINAL SCORE: Team_011 104, Team_058 91

SCORING BY QUARTER:
--------------------------------------------------------------------------------
Team                     Q1     Q2     Q3     Q4    FINAL
--------------------------------------------------------------------------------
Team_011                 14     26     30     34      104
Team_058                 31     14     23     23       91
--------------------------------------------------------------------------------

FULL GAME BOX SCORE:
================================================================================

Team_011
--------------------------------------------------------------------------------
Player                MIN  PTS  REB  AST  TO      FG   FG%      3P   3P%      FT STL BLK
--------------------------------------------------------------------------------
Magic Tatum            29    9    0    1   2   5/5   100.0   1/1   100.0   0/0     0   1
Trae Tatum             29    9    0    3   0   5/12   41.7   0/5     0.0   3/4     0   1
Michael Carter         29    7    4    4   0   5/11   45.5   0/2     0.0   2/4     0   1
Pau Barnes             29   19   12    1   4   7/8    87.5   0/0     0.0   5/6     2   0
Evan George            29   11   10    3   1   5/12   41.7   1/2    50.0   0/1     0   0
Shai Leonard           19    8    0    3   0   3/5    60.0   2/3    66.7   0/0     0   0
De'Aaron George        19   21    0    0   1   9/13   69.2   1/3    33.3   6/7     1   0
Tyrese Nowitzki        19    7   10    2   0   2/2   100.0   1/1   100.0   2/2     0   1
Russell Davis          19    4    7    1   0   2/5    40.0   0/2     0.0   0/0     1   0
Pau Towns              19    6    7    2   2   2/4    50.0   0/0     0.0   4/4     0   1

TEAM: FG: 47/79 (59.5%), 3PT: 6/19 (31.6%), REB: 53 (13 off, 40 def), AST: 20, TO: 10


Team_058
--------------------------------------------------------------------------------
Player                MIN  PTS  REB  AST  TO      FG   FG%      3P   3P%      FT STL BLK
--------------------------------------------------------------------------------
Bradley Sexton         29   13    8    4   0   6/12   50.0   1/3    33.3   2/2     0   0
Kyle Westbrook         29   13    0    1   1   6/10   60.0   2/5    40.0   3/4     0   0
Vince Hyland           29   14    0    0   2   7/13   53.8   3/5    60.0   1/1     0   1
Stephen Haliburton     29    9    8    4   1   2/5    40.0   0/3     0.0   3/3     3   0
Tyrese Doncic          29   15   11    3   0   5/7    71.4   1/1   100.0   1/1     0   0
Draymond Williamson    19    4    0    1   0   1/9    11.1   0/4     0.0   2/2     0   0
Jordan Ingram          19    3    0    0   0   2/9    22.2   1/7    14.3   3/3     0   0
Pascal Holiday         19   12    6    1   0   4/6    66.7   2/2   100.0   3/4     0   0
Shai Lowry             19    1    5    1   0   1/5    20.0   0/1     0.0   2/4     0   1
Jarrett Gilgeous-Alexander   19    6    4    0   2   2/2   100.0   0/0     0.0   2/3     2   0

TEAM: FG: 39/81 (48.1%), 3PT: 10/31 (32.3%), REB: 38 (11 off, 27 def), AST: 15, TO: 6

================================================================================
