================================================================================
                        FULL GAME - Team_047 vs Team_017                        
================================================================================

================================================================================
                       1ST QUARTER - Team_047 vs Team_017                       
================================================================================

[12:00] Team_047 possession (Score: 0-0)
Blake Jokic attempts a Layup. Contested by Tony Smith (2.6 feet, MAN). BLAKE JOKIC MAKES IT! Assist: Josh Harris
Score: 2-0

[11:44] Team_017 possession (Score: 2-0)
Vince Banchero attempts a 3Pt. Contested by De'Aaron Rose (3.9 feet, ZONE). VINCE BANCHERO MAKES IT! Assist: Tony Smith
Score: 2-3

[11:30] Team_047 possession (Score: 2-3)
Blake Jokic drives and kicks out. FOUL! Shooting foul on Desmond Reaves. Myles LaVine to the line for 3 free throws. [Team fouls: 1] (Desmond Reaves: 1 personal fouls)   FT 1/3: GOOD   FT 2/3: GOOD   FT 3/3: GOOD Myles LaVine makes 3/3 from the line.
Score: 5-3

[11:14] Team_017 possession (Score: 5-3)
Bam Williamson throws a bad pass! Stolen by Myles LaVine! TURNOVER! (live ball)

[11:00] Team_047 possession (Score: 5-3)
Josh Harris drives to the basket... FOUL! Offensive foul on Josh Harris! Kyrie Middleton drew the charge! [Team fouls: 1] (Josh Harris: 1 personal fouls) TURNOVER! (dead ball)

[10:46] Team_017 possession (Score: 5-3)
FOUL! Shooting foul on Josh Harris. Kyrie Middleton to the line for 2 free throws. [Team fouls: 2] (Josh Harris: 2 personal fouls)   FT 1/2: GOOD   FT 2/2: MISS Kyrie Middleton makes 1/2 from the line. Rebound secured by Derrick Irving.
Score: 5-4

[10:32] Team_047 possession (Score: 5-4)
Myles LaVine attempts a Midrange. Contested by Desmond Reaves (4.2 feet, ZONE). Myles LaVine misses. FOUL! Loose ball foul on Kyrie Middleton during the rebound battle. [Team fouls: 2] No free throws, side out. (Kyrie Middleton: 1 personal fouls)

[10:22] Team_047 possession (Score: 5-4)
Josh Harris drives and kicks out. Myles LaVine attempts a 3Pt. Contested by Bam Williamson (4.0 feet, MAN). Myles LaVine misses. Offensive rebound by Myles LaVine! Myles LaVine kicks it out.

[10:07] Team_047 possession (Score: 5-4)
Derrick Irving attempts a Midrange. Contested by Vince Banchero (4.4 feet, ZONE). Derrick Irving misses. FOUL! Loose ball foul on Bam Williamson during the rebound battle. [Team fouls: 3] No free throws, side out. (Bam Williamson: 1 personal fouls)

[09:52] Team_047 possession (Score: 5-4)
Myles LaVine drives, picks up Bam Williamson. Help arrives from Vince Banchero! Myles LaVine attempts a Dunk. Contested by Vince Banchero (4.2 feet, MAN). Myles LaVine misses. Rebound secured by Tony Smith.

[09:42] Team_017 possession (Score: 5-4)
Tony Smith attempts a 3Pt. Contested by De'Aaron Rose (4.5 feet, ZONE). Tony Smith misses. Rebound secured by Derrick Irving.

[09:28] Team_047 possession (Score: 5-4)
Josh Harris attempts a 3Pt. Contested by Kyrie Middleton (5.3 feet, MAN). Josh Harris misses. Rebound secured by Kyrie Middleton.

[09:15] Team_017 possession (Score: 5-4)
Bam Williamson drives and kicks out. Bam Williamson attempts a Midrange. Contested by Myles LaVine (5.2 feet, MAN). Bam Williamson misses. Rebound secured by Josh Harris.

[09:02] Team_047 possession (Score: 5-4)
FOUL! Reach-in foul on Desmond Reaves during the drive. [Team fouls: 4] No free throws, side out. (Desmond Reaves: 2 personal fouls)

[08:46] Team_047 possession (Score: 5-4)
Myles LaVine attempts a Layup. Contested by Bam Williamson (4.2 feet, ZONE). Myles LaVine misses. FOUL! Loose ball foul on Tony Smith during the rebound battle. [IN THE BONUS! 5 team fouls] Myles LaVine to the line for 2 free throws. (Tony Smith: 1 personal fouls)   FT 1/2: GOOD   FT 2/2: GOOD Myles LaVine makes 2/2 from the line.
Score: 7-4

[08:33] Team_017 possession (Score: 7-4)
Vince Banchero attempts a Midrange. Contested by Derrick Irving (4.7 feet, ZONE). Vince Banchero misses. Rebound secured by Josh Harris.

[08:22] Team_047 possession (Score: 7-4)
Myles LaVine drives and kicks out. Blake Jokic attempts a Midrange. Contested by Tony Smith (2.7 feet, MAN). BLAKE JOKIC MAKES IT! Assist: Derrick Irving
Score: 9-4

[08:07] Team_017 possession (Score: 9-4)
Tony Smith attempts a 3Pt. Contested by Blake Jokic (5.4 feet, MAN). TONY SMITH MAKES IT! Assist: Kyrie Middleton
Score: 9-7

[07:52] Team_047 possession (Score: 9-7)
FOUL! Holding foul on Kyrie Middleton. [IN THE BONUS! 6 team fouls] Josh Harris to the line for 2 free throws. (Kyrie Middleton: 2 personal fouls)   FT 1/2: GOOD   FT 2/2: GOOD Josh Harris makes 2/2 from the line.
Score: 11-7

[07:36] Team_017 possession (Score: 11-7)
Bam Williamson drives, Myles LaVine stays with him. Bam Williamson attempts a Dunk. Contested by Myles LaVine (5.9 feet, MAN). BAM WILLIAMSON MAKES IT! Assist: Kyrie Middleton
Score: 11-9

[07:20] Team_047 possession (Score: 11-9)
FOUL! Shooting foul on Bam Williamson. Myles LaVine to the line for 2 free throws. [BONUS: 7 team fouls] (Bam Williamson: 2 personal fouls)   FT 1/2: GOOD   FT 2/2: GOOD Myles LaVine makes 2/2 from the line.
Score: 13-9

[07:07] Team_017 possession (Score: 13-9)
Kyrie Middleton attempts a 3Pt. Contested by De'Aaron Rose (4.3 feet, ZONE). Kyrie Middleton misses. Rebound secured by Myles LaVine.

[06:53] Team_047 possession (Score: 13-9)
Myles LaVine attempts a Midrange. Contested by Bam Williamson (4.2 feet, MAN). Myles LaVine misses. Rebound secured by Tony Smith.

[06:35] Team_017 possession (Score: 13-9)
Tony Smith attempts a 3Pt. Contested by De'Aaron Rose (4.5 feet, ZONE). Tony Smith misses. Rebound secured by Derrick Irving.

[06:21] Team_047 possession (Score: 13-9)
Myles LaVine makes the Layup and draws the foul on Bam Williamson! And-1! Myles LaVine to the line for 1. [BONUS: 8 team fouls] (Bam Williamson: 3 personal fouls)   FT 1/1: MISS Myles LaVine makes 0/1 from the line. Rebound secured by Kyrie Middleton.
Score: 15-9

[06:06] Team_017 possession (Score: 15-9)
Kyrie Middleton drives and kicks out. FOUL! Shooting foul on De'Aaron Rose. Desmond Reaves to the line for 2 free throws. [Team fouls: 3] (De'Aaron Rose: 1 personal fouls)   FT 1/2: MISS   FT 2/2: GOOD Desmond Reaves makes 1/2 from the line.
Score: 15-10

[05:48] Team_047 possession (Score: 15-10)
Derrick Irving attempts a 3Pt. Contested by Desmond Reaves (4.4 feet, ZONE). DERRICK IRVING MAKES IT! Assist: De'Aaron Rose
Score: 18-10

[05:34] Team_017 possession (Score: 18-10)
Tony Smith drives and kicks out. Kyrie Middleton attempts a 3Pt. Contested by Josh Harris (4.1 feet, MAN). Kyrie Middleton misses. Rebound secured by Myles LaVine.

[05:20] Team_047 possession (Score: 18-10)
De'Aaron Rose attempts a 3Pt. Contested by Desmond Reaves (4.3 feet, MAN). De'Aaron Rose misses. Rebound secured by Kyrie Middleton.

[05:07] Team_017 possession (Score: 18-10)
Vince Banchero attempts a 3Pt. Contested by Derrick Irving (4.8 feet, MAN). Vince Banchero misses. Rebound secured by Josh Harris.

[04:51] Team_047 possession (Score: 18-10)
De'Aaron Rose attempts a Layup. Contested by Bam Williamson (4.4 feet, ZONE). De'Aaron Rose misses. FOUL! Loose ball foul on Bam Williamson during the rebound battle. [IN THE BONUS! 9 team fouls] Myles LaVine to the line for 2 free throws. (Bam Williamson: 4 personal fouls)   FT 1/2: GOOD   FT 2/2: GOOD Myles LaVine makes 2/2 from the line.
Score: 20-10

[04:38] Team_017 possession (Score: 20-10)
Tony Smith drives and kicks out. Vince Banchero attempts a 3Pt. Contested by Derrick Irving (4.8 feet, MAN). Vince Banchero misses. Offensive rebound by Bam Williamson! Bam Williamson puts it back in!
Score: 20-12

[04:23] Team_047 possession (Score: 20-12)
Josh Harris attempts a 3Pt. Contested by Kyrie Middleton (5.4 feet, MAN). JOSH HARRIS MAKES IT! Assist: Blake Jokic
Score: 23-12

[04:07] Team_017 possession (Score: 23-12)
Kyrie Middleton drives to the basket... Kyrie Middleton throws a bad pass! Stolen by Josh Harris! TURNOVER! (live ball)

[03:48] Team_047 possession (Score: 23-12)
Blake Jokic makes the Layup and draws the foul on Tony Smith! And-1! Blake Jokic to the line for 1. [BONUS: 10 team fouls] (Tony Smith: 2 personal fouls)   FT 1/1: GOOD Blake Jokic makes 1/1 from the line.
Score: 26-12

[03:34] Team_017 possession (Score: 26-12)
Kyrie Middleton attempts a 3Pt. Contested by De'Aaron Rose (4.4 feet, ZONE). Kyrie Middleton misses. Rebound secured by Derrick Irving.

[03:16] Team_047 possession (Score: 26-12)
De'Aaron Rose loses control! Ball rolls out of bounds! TURNOVER! (dead ball)

[03:07] Team_017 possession (Score: 26-12)
Vince Banchero attempts a Midrange. Contested by Derrick Irving (4.9 feet, MAN). Vince Banchero misses. Rebound secured by Myles LaVine.

[02:56] Team_047 possession (Score: 26-12)
Myles LaVine drives and kicks out. De'Aaron Rose attempts a Midrange. Contested by Desmond Reaves (4.3 feet, MAN). De'Aaron Rose misses. Rebound secured by Tony Smith.

[02:40] Team_017 possession (Score: 26-12)
Tony Smith drives and kicks out. Desmond Reaves attempts a 3Pt. Contested by De'Aaron Rose (4.2 feet, ZONE). DESMOND REAVES MAKES IT! Assist: Kyrie Middleton
Score: 26-15

[02:26] Team_047 possession (Score: 26-15)
Blake Jokic attempts a Layup. Contested by Bam Williamson (4.2 feet, ZONE). Blake Jokic misses. Rebound secured by Bam Williamson.

[02:14] Team_017 possession (Score: 26-15)
Desmond Reaves makes the Layup and draws the foul on De'Aaron Rose! And-1! Desmond Reaves to the line for 1. [Team fouls: 4] (De'Aaron Rose: 2 personal fouls)   FT 1/1: GOOD Desmond Reaves makes 1/1 from the line.
Score: 26-18

[02:00] Team_047 possession (Score: 26-18)
FOUL! Shooting foul on Bam Williamson. Myles LaVine to the line for 2 free throws. [BONUS: 11 team fouls] (Bam Williamson: 5 personal fouls)   FT 1/2: GOOD   FT 2/2: GOOD Myles LaVine makes 2/2 from the line.
Score: 28-18

[01:44] Team_017 possession (Score: 28-18)
Tony Smith attempts a Midrange. Contested by Josh Harris (5.0 feet, ZONE). Tony Smith misses. Rebound secured by Derrick Irving.

[01:27] Team_047 possession (Score: 28-18)
Derrick Irving makes the Midrange and draws the foul on Vince Banchero! And-1! Derrick Irving to the line for 1. [BONUS: 12 team fouls] (Vince Banchero: 1 personal fouls)   FT 1/1: GOOD Derrick Irving makes 1/1 from the line.
Score: 31-18

[01:10] Team_017 possession (Score: 31-18)
FOUL! Offensive foul on Desmond Reaves! De'Aaron Rose drew the charge! [Team fouls: 13] (Desmond Reaves: 3 personal fouls) TURNOVER! (dead ball)

[00:54] Team_047 possession (Score: 31-18)
De'Aaron Rose attempts a 3Pt. Contested by Tony Smith (3.5 feet, ZONE). De'Aaron Rose misses. Rebound secured by Bam Williamson.

[00:41] Team_017 possession (Score: 31-18)
Kyrie Middleton drives and kicks out. FOUL! Shooting foul on De'Aaron Rose. Desmond Reaves to the line for 2 free throws. [BONUS: 5 team fouls] (De'Aaron Rose: 3 personal fouls)   FT 1/2: GOOD   FT 2/2: GOOD Desmond Reaves makes 2/2 from the line.
Score: 31-20

[00:26] Team_047 possession (Score: 31-20)
FOUL! Reach-in foul on Kyrie Middleton during the drive. [IN THE BONUS! 14 team fouls] Josh Harris to the line for 2 free throws. (Kyrie Middleton: 3 personal fouls)   FT 1/2: GOOD   FT 2/2: MISS Josh Harris makes 1/2 from the line. Rebound secured by Tony Smith.
Score: 32-20

[00:08] Team_017 possession (Score: 32-20)
Tony Smith attempts a 3Pt. Contested by Blake Jokic (5.7 feet, MAN). Tony Smith misses. Rebound secured by Derrick Irving.

================================================================================
                              1ST QUARTER COMPLETE                              
================================================================================

1ST QUARTER SCORE: Team_047 32, Team_017 20

BOX SCORE:
================================================================================

Team_047
--------------------------------------------------------------------------------
Player                MIN  PTS  REB  AST  TO      FG   FG%      3P   3P%
--------------------------------------------------------------------------------
Myles LaVine           12   11    6    0   0   5/9    55.6     0/0   0.0
Blake Jokic            12    7    0    1   0   3/4    75.0     0/0   0.0
Derrick Irving         12    6    6    1   0   2/2   100.0     0/0   0.0
Josh Harris            12    5    3    1   0   2/4    50.0     0/0   0.0
De'Aaron Rose          12    0    0    1   0   0/2     0.0     0/0   0.0

TEAM: FG: 12/21 (57.1%), 3PT: 2/5 (40.0%), REB: 15 (3 off, 12 def), AST: 4, TO: 2
TEAM FOULS: 5 [Team_017 in BONUS]


Team_017
--------------------------------------------------------------------------------
Player                MIN  PTS  REB  AST  TO      FG   FG%      3P   3P%
--------------------------------------------------------------------------------
Desmond Reaves         12    9    0    0   0   4/4   100.0     0/0   0.0
Bam Williamson         12    4    3    0   0   2/3    66.7     0/0   0.0
Vince Banchero         12    3    0    0   0   1/4    25.0     0/0   0.0
Tony Smith             12    3    4    1   0   1/6    16.7     0/0   0.0
Kyrie Middleton        12    0    3    3   0   0/3     0.0     0/0   0.0

TEAM: FG: 8/20 (40.0%), 3PT: 2/8 (25.0%), REB: 10 (1 off, 9 def), AST: 4, TO: 3
TEAM FOULS: 14 [Team_047 in BONUS]

================================================================================

================================================================================
                       2ND QUARTER - Team_047 vs Team_017                       
================================================================================

[12:00] Team_047 possession (Score: 32-20)
Myles LaVine attempts a 3Pt. Contested by Tony Smith (3.2 feet, ZONE). MYLES LAVINE MAKES IT! Assist: De'Aaron Rose
Score: 35-20

[11:44] Team_017 possession (Score: 35-20)
Bam Williamson attempts a 3Pt. Contested by Derrick Irving (5.8 feet, ZONE). Bam Williamson misses. Rebound secured by Myles LaVine.

[11:29] Team_047 possession (Score: 35-20)
Myles LaVine drives and kicks out. Derrick Irving attempts a Midrange. Contested by Vince Banchero (4.4 feet, MAN). DERRICK IRVING MAKES IT!
Score: 37-20

[11:14] Team_017 possession (Score: 37-20)
Kyrie Middleton drives, Josh Harris stays with him. Kyrie Middleton attempts a Layup. Contested by Josh Harris (4.8 feet, MAN). KYRIE MIDDLETON MAKES IT! Assist: Bam Williamson
Score: 37-22

[10:58] Team_047 possession (Score: 37-22)
Blake Jokic attempts a Layup. Contested by Bam Williamson (4.4 feet, ZONE). BLAKE JOKIC MAKES IT! Assist: Myles LaVine
Score: 39-22

[10:41] Team_017 possession (Score: 39-22)
Kyrie Middleton makes the Layup and draws the foul on Josh Harris! And-1! Kyrie Middleton to the line for 1. [Team fouls: 1] (Josh Harris: 1 personal fouls)   FT 1/1: GOOD Kyrie Middleton makes 1/1 from the line.
Score: 39-25

[10:25] Team_047 possession (Score: 39-25)
Myles LaVine makes the Layup and draws the foul on Bam Williamson! And-1! Myles LaVine to the line for 1. [Team fouls: 1] (Bam Williamson: 1 personal fouls)   FT 1/1: MISS Myles LaVine makes 0/1 from the line. Offensive rebound by Josh Harris! Josh Harris kicks it out.
Score: 41-25

[10:15] Team_047 possession (Score: 41-25)
De'Aaron Rose attempts a Layup. Contested by Desmond Reaves (4.8 feet, MAN). DE'AARON ROSE MAKES IT! Assist: Blake Jokic
Score: 43-25

[10:01] Team_017 possession (Score: 43-25)
Kyrie Middleton throws a bad pass out of bounds! TURNOVER! (dead ball)

[10:01] Substitution (Team_047): De'Aaron Rose OUT → Austin Giddey IN (stamina_rule2)

[10:01] Substitution (Team_047): Derrick Irving OUT → Donovan Iverson IN (stamina_rule2)

[10:01] Substitution (Team_047): Blake Jokic OUT → Blake Jackson IN (stamina_rule2)

[10:01] Substitution (Team_047): Josh Harris OUT → Tony Poole IN (stamina_rule2)

[10:01] Substitution (Team_047): Myles LaVine OUT → Zion Thompson IN (stamina_rule2)

[10:01] Substitution (Team_017): Desmond Reaves OUT → Blake Reaves IN (stamina_rule2)

[10:01] Substitution (Team_017): Vince Banchero OUT → Tobias Bridges IN (stamina_rule2)

[10:01] Substitution (Team_017): Tony Smith OUT → Shaquille Stewart IN (stamina_rule2)

[10:01] Substitution (Team_017): Kyrie Middleton OUT → Ja Stewart IN (stamina_rule2)

[10:01] Substitution (Team_017): Bam Williamson OUT → Klay Holiday IN (stamina_rule2)

[09:41] Team_047 possession (Score: 43-25)
Tony Poole attempts a Midrange. Contested by Ja Stewart (5.3 feet, MAN). Tony Poole misses. Rebound secured by Shaquille Stewart.

[09:21] Team_017 possession (Score: 43-25)
Shaquille Stewart attempts a Midrange. Contested by Zion Thompson (5.7 feet, ZONE). SHAQUILLE STEWART MAKES IT!
Score: 43-27

[09:03] Team_047 possession (Score: 43-27)
Blake Jackson attempts a Midrange. Contested by Shaquille Stewart (4.1 feet, ZONE). Blake Jackson misses. Rebound secured by Klay Holiday.

[08:52] Team_017 possession (Score: 43-27)
Tobias Bridges attempts a 3Pt. Contested by Donovan Iverson (4.3 feet, ZONE). Tobias Bridges misses. Rebound secured by Blake Jackson.

[08:36] Team_047 possession (Score: 43-27)
Donovan Iverson attempts a Midrange. Contested by Tobias Bridges (4.2 feet, MAN). Donovan Iverson misses. Offensive rebound by Zion Thompson! Zion Thompson kicks it out.

[08:18] Team_047 possession (Score: 43-27)
Zion Thompson drives to the basket... Zion Thompson throws a bad pass out of bounds! TURNOVER! (dead ball)

[08:00] Team_017 possession (Score: 43-27)
Tobias Bridges drives and kicks out. Ja Stewart attempts a Midrange. Contested by Tony Poole (5.0 feet, MAN). JA STEWART MAKES IT! Assist: Blake Reaves
Score: 43-29

[07:43] Team_047 possession (Score: 43-29)
Austin Giddey attempts a 3Pt. Contested by Blake Reaves (5.8 feet, ZONE). Austin Giddey misses. Rebound secured by Klay Holiday.

[07:26] Team_017 possession (Score: 43-29)
Ja Stewart attempts a Midrange. Contested by Tony Poole (4.7 feet, MAN). JA STEWART MAKES IT! Assist: Tobias Bridges
Score: 43-31

[07:12] Team_047 possession (Score: 43-31)
Zion Thompson drives to the basket... Zion Thompson commits a violation (traveling/carry)! TURNOVER! (dead ball)

[06:59] Team_017 possession (Score: 43-31)
Ja Stewart attempts a 3Pt. Contested by Donovan Iverson (3.9 feet, ZONE). Ja Stewart misses. Offensive rebound by Shaquille Stewart! Shaquille Stewart kicks it out.

[06:42] Team_017 possession (Score: 43-31)
Shaquille Stewart attempts a Layup. BLOCKED BY ZION THOMPSON! Ball deflects out of bounds off Shaquille Stewart.

[06:28] Team_047 possession (Score: 43-31)
Donovan Iverson attempts a 3Pt. Contested by Tobias Bridges (4.2 feet, MAN). Donovan Iverson misses. Rebound secured by Ja Stewart.

[06:13] Team_017 possession (Score: 43-31)
Shaquille Stewart attempts a 3Pt. Contested by Blake Jackson (4.7 feet, MAN). Shaquille Stewart misses. Rebound secured by Blake Jackson.

[05:59] Team_047 possession (Score: 43-31)
Blake Jackson attempts a Midrange. Contested by Ja Stewart (4.5 feet, ZONE). Blake Jackson misses. Rebound secured by Klay Holiday.

[05:47] Team_017 possession (Score: 43-31)
Klay Holiday drives and kicks out. FOUL! Shooting foul on Donovan Iverson. Tobias Bridges to the line for 2 free throws. [Team fouls: 2] (Donovan Iverson: 1 personal fouls)   FT 1/2: GOOD   FT 2/2: GOOD Tobias Bridges makes 2/2 from the line.
Score: 43-33

[05:30] Team_047 possession (Score: 43-33)
Donovan Iverson attempts a 3Pt. Contested by Tobias Bridges (4.2 feet, ZONE). Donovan Iverson misses. Rebound secured by Shaquille Stewart.

[05:12] Team_017 possession (Score: 43-33)
Klay Holiday loses the ball! Stripped by Zion Thompson! TURNOVER! (live ball)

[04:58] Team_047 possession (Score: 43-33)
Austin Giddey makes the Layup and draws the foul on Klay Holiday! And-1! Austin Giddey to the line for 1. [Team fouls: 2] (Klay Holiday: 1 personal fouls)   FT 1/1: GOOD Austin Giddey makes 1/1 from the line.
Score: 46-33

[04:42] Team_017 possession (Score: 46-33)
Ja Stewart throws a bad pass! Stolen by Tony Poole! TURNOVER! (live ball)

[04:22] Team_047 possession (Score: 46-33)
Zion Thompson drives, Klay Holiday stays with him. Zion Thompson attempts a Layup. Contested by Klay Holiday (5.0 feet, MAN). Zion Thompson misses. Rebound secured by Klay Holiday.

[04:06] Team_017 possession (Score: 46-33)
Ja Stewart attempts a Midrange. Contested by Tony Poole (4.7 feet, ZONE). JA STEWART MAKES IT!
Score: 46-35

[03:51] Team_047 possession (Score: 46-35)
Austin Giddey attempts a 3Pt. Contested by Tobias Bridges (4.6 feet, ZONE). AUSTIN GIDDEY MAKES IT! Assist: Blake Jackson
Score: 49-35

[03:41] Team_017 possession (Score: 49-35)
Tobias Bridges attempts a 3Pt. Contested by Donovan Iverson (4.3 feet, MAN). Tobias Bridges misses. Rebound secured by Zion Thompson.

[03:27] Team_047 possession (Score: 49-35)
FOUL! Holding foul on Shaquille Stewart. [Team fouls: 3] No free throws, side out. (Shaquille Stewart: 1 personal fouls)

[03:15] Team_047 possession (Score: 49-35)
Donovan Iverson makes the Dunk and draws the foul on Ja Stewart! And-1! Donovan Iverson to the line for 1. [Team fouls: 4] (Ja Stewart: 1 personal fouls)   FT 1/1: MISS Donovan Iverson makes 0/1 from the line. Offensive rebound by Zion Thompson! Zion Thompson kicks it out.
Score: 51-35

[03:02] Team_047 possession (Score: 51-35)
Tony Poole drives and kicks out. Blake Jackson attempts a Midrange. Contested by Shaquille Stewart (4.4 feet, ZONE). Blake Jackson misses. Offensive rebound by Zion Thompson! Zion Thompson kicks it out.

[02:51] Team_047 possession (Score: 51-35)
FOUL! Reach-in foul on Ja Stewart during the drive. [IN THE BONUS! 5 team fouls] Blake Jackson to the line for 2 free throws. (Ja Stewart: 2 personal fouls)   FT 1/2: GOOD   FT 2/2: GOOD Blake Jackson makes 2/2 from the line.
Score: 53-35

[02:35] Team_017 possession (Score: 53-35)
Shaquille Stewart attempts a Midrange. Contested by Donovan Iverson (4.6 feet, ZONE). SHAQUILLE STEWART MAKES IT! Assist: Tobias Bridges
Score: 53-37

[02:17] Team_047 possession (Score: 53-37)
Austin Giddey attempts a Layup. Contested by Blake Reaves (5.8 feet, MAN). Austin Giddey misses. Rebound secured by Klay Holiday.

[02:02] Team_017 possession (Score: 53-37)
Blake Reaves drives, Austin Giddey stays with him. Blake Reaves attempts a Layup. Contested by Austin Giddey (4.8 feet, MAN). Blake Reaves misses. Rebound secured by Blake Jackson.

[01:48] Team_047 possession (Score: 53-37)
Donovan Iverson attempts a 3Pt. Contested by Tobias Bridges (4.3 feet, ZONE). Donovan Iverson misses. Offensive rebound by Zion Thompson! Zion Thompson kicks it out.

[01:36] Team_047 possession (Score: 53-37)
Donovan Iverson attempts a Midrange. Contested by Tobias Bridges (4.3 feet, MAN). Donovan Iverson misses. Rebound secured by Shaquille Stewart.

[01:22] Team_017 possession (Score: 53-37)
Ja Stewart attempts a 3Pt. Contested by Donovan Iverson (4.0 feet, ZONE). JA STEWART MAKES IT! Assist: Shaquille Stewart
Score: 53-40

[01:09] Team_047 possession (Score: 53-40)
FOUL! Offensive foul on Blake Jackson! Shaquille Stewart drew the charge! [Team fouls: 3] (Blake Jackson: 1 personal fouls) TURNOVER! (dead ball)

[00:55] Team_017 possession (Score: 53-40)
Shaquille Stewart attempts a 3Pt. Contested by Donovan Iverson (4.7 feet, ZONE). Shaquille Stewart misses. Offensive rebound by Ja Stewart! Ja Stewart kicks it out.

[00:40] Team_017 possession (Score: 53-40)
Blake Reaves drives and kicks out. Tobias Bridges attempts a 3Pt. Contested by Donovan Iverson (4.4 feet, ZONE). TOBIAS BRIDGES MAKES IT! Assist: Ja Stewart
Score: 53-43

[00:26] Team_047 possession (Score: 53-43)
Donovan Iverson attempts a Midrange. Contested by Tobias Bridges (4.5 feet, ZONE). DONOVAN IVERSON MAKES IT!
Score: 55-43

[00:13] Team_017 possession (Score: 55-43)
Tobias Bridges attempts a 3Pt. Contested by Donovan Iverson (4.5 feet, ZONE). Tobias Bridges misses. Rebound secured by Blake Jackson.

================================================================================
                              2ND QUARTER COMPLETE                              
================================================================================

2ND QUARTER SCORE: Team_047 23, Team_017 23

BOX SCORE:
================================================================================

Team_047
--------------------------------------------------------------------------------
Player                MIN  PTS  REB  AST  TO      FG   FG%      3P   3P%
--------------------------------------------------------------------------------
Austin Giddey          10    6    0    0   0   2/4    50.0     0/0   0.0
Myles LaVine           14    3    1    1   0   1/1   100.0     0/0   0.0
De'Aaron Rose          14    2    0    1   0   1/1   100.0     0/0   0.0
Derrick Irving         14    2    0    0   0   1/1   100.0     0/0   0.0
Blake Jokic            14    2    0    1   0   1/1   100.0     0/0   0.0
Blake Jackson          10    2    4    1   0   1/3    33.3     0/0   0.0
Donovan Iverson        10    2    0    0   0   1/4    25.0     0/0   0.0
Josh Harris            14    0    1    0   0   0/0     0.0     0/0   0.0
Tony Poole             10    0    0    0   0   0/1     0.0     0/0   0.0
Zion Thompson          10    0    5    0   0   0/1     0.0     0/0   0.0

TEAM: FG: 8/17 (47.1%), 3PT: 2/5 (40.0%), REB: 11 (5 off, 6 def), AST: 4, TO: 3
TEAM FOULS: 3


Team_017
--------------------------------------------------------------------------------
Player                MIN  PTS  REB  AST  TO      FG   FG%      3P   3P%
--------------------------------------------------------------------------------
Ja Stewart             10    9    2    1   0   4/4   100.0     0/0   0.0
Kyrie Middleton        14    5    0    0   0   2/2   100.0     0/0   0.0
Tobias Bridges         10    5    0    2   0   2/5    40.0     0/0   0.0
Shaquille Stewart      10    4    4    1   0   2/4    50.0     0/0   0.0
Bam Williamson         14    0    0    1   0   0/1     0.0     0/0   0.0
Klay Holiday           10    0    5    0   0   0/0     0.0     0/0   0.0
Blake Reaves           10    0    0    1   0   0/1     0.0     0/0   0.0

TEAM: FG: 10/17 (58.8%), 3PT: 1/6 (16.7%), REB: 11 (2 off, 9 def), AST: 6, TO: 3
TEAM FOULS: 5 [Team_047 in BONUS]

================================================================================

================================================================================
                       3RD QUARTER - Team_047 vs Team_017                       
================================================================================

[12:00] Team_047 possession (Score: 55-43)
De'Aaron Rose attempts a 3Pt. Contested by Desmond Reaves (4.3 feet, MAN). De'Aaron Rose misses. Rebound secured by Bam Williamson.

[11:45] Team_017 possession (Score: 55-43)
Tony Smith throws a bad pass! Stolen by Blake Jokic! TURNOVER! (live ball)

[11:32] Team_047 possession (Score: 55-43)
Blake Jokic attempts a 3Pt. Contested by Desmond Reaves (3.9 feet, ZONE). Blake Jokic misses. Rebound secured by Tony Smith.

[11:18] Team_017 possession (Score: 55-43)
Tony Smith drives, Blake Jokic stays with him. Tony Smith attempts a Dunk. Contested by Blake Jokic (5.4 feet, MAN). Tony Smith misses. Rebound secured by Derrick Irving.

[10:59] Team_047 possession (Score: 55-43)
Derrick Irving attempts a 3Pt. Contested by Vince Banchero (4.4 feet, MAN). DERRICK IRVING MAKES IT! Assist: Myles LaVine
Score: 58-43

[10:44] Team_017 possession (Score: 58-43)
Kyrie Middleton loses the ball! Stripped by Josh Harris! TURNOVER! (live ball)

[10:29] Team_047 possession (Score: 58-43)
Josh Harris attempts a Layup. Contested by Bam Williamson (4.3 feet, ZONE). JOSH HARRIS MAKES IT!
Score: 60-43

[10:18] Team_017 possession (Score: 60-43)
Kyrie Middleton attempts a 3Pt. Contested by De'Aaron Rose (4.3 feet, ZONE). Kyrie Middleton misses. Rebound secured by Derrick Irving.

[10:02] Team_047 possession (Score: 60-43)
FOUL! Shooting foul on Vince Banchero. Myles LaVine to the line for 2 free throws. [Team fouls: 1] (Vince Banchero: 1 personal fouls)   FT 1/2: GOOD   FT 2/2: GOOD Myles LaVine makes 2/2 from the line.
Score: 62-43

[09:49] Team_017 possession (Score: 62-43)
Desmond Reaves drives to the basket... Desmond Reaves commits a violation (traveling/carry)! TURNOVER! (dead ball)

[09:37] Team_047 possession (Score: 62-43)
Myles LaVine drives to the basket... Myles LaVine throws a bad pass out of bounds! TURNOVER! (dead ball)

[09:21] Team_017 possession (Score: 62-43)
Bam Williamson throws a bad pass! Stolen by Myles LaVine! TURNOVER! (live ball)

[09:08] Team_047 possession (Score: 62-43)
De'Aaron Rose drives and kicks out. Myles LaVine attempts a Midrange. Contested by Vince Banchero (4.0 feet, ZONE). MYLES LAVINE MAKES IT! Assist: Blake Jokic
Score: 64-43

[08:55] Team_017 possession (Score: 64-43)
Bam Williamson attempts a 3Pt. Contested by Myles LaVine (5.9 feet, MAN). Bam Williamson misses. Offensive rebound by Bam Williamson! Bam Williamson puts it back in!
Score: 64-45

[08:40] Team_047 possession (Score: 64-45)
Derrick Irving attempts a 3Pt. Contested by Desmond Reaves (4.4 feet, ZONE). Derrick Irving misses. Rebound secured by Tony Smith.

[08:25] Team_017 possession (Score: 64-45)
Desmond Reaves attempts a 3Pt. Contested by De'Aaron Rose (4.4 feet, MAN). Desmond Reaves misses. Rebound secured by Josh Harris.

[08:07] Team_047 possession (Score: 64-45)
Blake Jokic attempts a 3Pt. Contested by Desmond Reaves (3.9 feet, ZONE). Blake Jokic misses. Offensive rebound by Josh Harris! Josh Harris kicks it out.

[07:50] Team_047 possession (Score: 64-45)
Myles LaVine attempts a 3Pt. Contested by Desmond Reaves (4.2 feet, ZONE). Myles LaVine misses. FOUL! Loose ball foul on Kyrie Middleton during the rebound battle. [Team fouls: 2] No free throws, side out. (Kyrie Middleton: 1 personal fouls)

[07:38] Team_047 possession (Score: 64-45)
Blake Jokic attempts a 3Pt. Contested by Tony Smith (2.6 feet, MAN). Blake Jokic misses. Rebound secured by Tony Smith.

[07:26] Team_017 possession (Score: 64-45)
Kyrie Middleton commits a violation (traveling/carry)! TURNOVER! (dead ball)

[07:15] Team_047 possession (Score: 64-45)
Myles LaVine attempts a Layup. BLOCKED BY BAM WILLIAMSON! Ball deflects out of bounds off Myles LaVine.

[06:56] Team_017 possession (Score: 64-45)
Bam Williamson makes the Dunk and draws the foul on Derrick Irving! And-1! Bam Williamson to the line for 1. [Team fouls: 1] (Derrick Irving: 1 personal fouls)   FT 1/1: GOOD Bam Williamson makes 1/1 from the line.
Score: 64-48

[06:42] Team_047 possession (Score: 64-48)
Blake Jokic drives, picks up Tony Smith. Help arrives from Vince Banchero! Blake Jokic attempts a Dunk. Contested by Vince Banchero (2.6 feet, MAN). Blake Jokic misses. Rebound secured by Kyrie Middleton.

[06:29] Team_017 possession (Score: 64-48)
FOUL! Shooting foul on Josh Harris. Kyrie Middleton to the line for 2 free throws. [Team fouls: 2] (Josh Harris: 1 personal fouls)   FT 1/2: MISS   FT 2/2: GOOD Kyrie Middleton makes 1/2 from the line.
Score: 64-49

[06:11] Team_047 possession (Score: 64-49)
FOUL! Reach-in foul on Tony Smith during the drive. [Team fouls: 3] No free throws, side out. (Tony Smith: 1 personal fouls)

[05:58] Team_047 possession (Score: 64-49)
Derrick Irving makes the 3Pt and draws the foul on Vince Banchero! And-1! Derrick Irving to the line for 1. [Team fouls: 4] (Vince Banchero: 2 personal fouls)   FT 1/1: GOOD Derrick Irving makes 1/1 from the line.
Score: 68-49

[05:39] Team_017 possession (Score: 68-49)
Desmond Reaves drives and kicks out. Tony Smith attempts a 3Pt. Contested by Blake Jokic (4.8 feet, MAN). Tony Smith misses. Rebound secured by Myles LaVine.

[05:28] Team_047 possession (Score: 68-49)
Myles LaVine drives to the basket... Myles LaVine throws a bad pass out of bounds! TURNOVER! (dead ball)

[05:14] Team_017 possession (Score: 68-49)
Vince Banchero drives, Josh Harris stays with him. Vince Banchero attempts a Dunk. Contested by Josh Harris (4.1 feet, ZONE). Vince Banchero misses. Rebound secured by Josh Harris.

[04:56] Team_047 possession (Score: 68-49)
Blake Jokic attempts a Layup. BLOCKED BY KYRIE MIDDLETON! Ball deflects out of bounds off Blake Jokic.

[04:37] Team_017 possession (Score: 68-49)
Vince Banchero attempts a 3Pt. BLOCKED BY DERRICK IRVING! Ball is loose! Rebound secured by Myles LaVine.

[04:23] Team_047 possession (Score: 68-49)
De'Aaron Rose attempts a 3Pt. Contested by Desmond Reaves (4.4 feet, ZONE). DE'AARON ROSE MAKES IT!
Score: 71-49

[04:06] Team_017 possession (Score: 71-49)
Tony Smith attempts a Midrange. Contested by De'Aaron Rose (4.6 feet, ZONE). TONY SMITH MAKES IT! Assist: Kyrie Middleton
Score: 71-51

[03:55] Team_047 possession (Score: 71-51)
Myles LaVine drives and kicks out. De'Aaron Rose attempts a 3Pt. Contested by Desmond Reaves (4.2 feet, MAN). De'Aaron Rose misses. Rebound secured by Kyrie Middleton.

[03:42] Team_017 possession (Score: 71-51)
Bam Williamson makes the Layup and draws the foul on Derrick Irving! And-1! Bam Williamson to the line for 1. [Team fouls: 3] (Derrick Irving: 2 personal fouls)   FT 1/1: GOOD Bam Williamson makes 1/1 from the line.
Score: 71-54

[03:25] Team_047 possession (Score: 71-54)
FOUL! Offensive foul on De'Aaron Rose! Desmond Reaves drew the charge! [Team fouls: 4] (De'Aaron Rose: 1 personal fouls) TURNOVER! (dead ball)

[03:09] Team_017 possession (Score: 71-54)
Desmond Reaves attempts a 3Pt. Contested by De'Aaron Rose (4.6 feet, MAN). Desmond Reaves misses. Rebound secured by Josh Harris.

[02:50] Team_047 possession (Score: 71-54)
Josh Harris attempts a Midrange. Contested by Kyrie Middleton (5.4 feet, MAN). Josh Harris misses. Offensive rebound by Josh Harris! Josh Harris kicks it out.

[02:32] Team_047 possession (Score: 71-54)
Josh Harris attempts a Midrange. Contested by Tony Smith (3.2 feet, ZONE). JOSH HARRIS MAKES IT!
Score: 73-54

[02:16] Team_017 possession (Score: 73-54)
Desmond Reaves attempts a 3Pt. Contested by De'Aaron Rose (4.6 feet, ZONE). Desmond Reaves misses. Rebound secured by Derrick Irving.

[02:04] Team_047 possession (Score: 73-54)
Blake Jokic attempts a 3Pt. Contested by Tony Smith (2.9 feet, MAN). Blake Jokic misses. Rebound secured by Bam Williamson.

[01:50] Team_017 possession (Score: 73-54)
Vince Banchero attempts a Midrange. Contested by Derrick Irving (5.0 feet, MAN). Vince Banchero misses. Rebound secured by Derrick Irving.

[01:36] Team_047 possession (Score: 73-54)
Derrick Irving makes the Midrange and draws the foul on Bam Williamson! And-1! Derrick Irving to the line for 1. [BONUS: 5 team fouls] (Bam Williamson: 1 personal fouls)   FT 1/1: GOOD Derrick Irving makes 1/1 from the line.
Score: 76-54

[01:16] Team_017 possession (Score: 76-54)
Desmond Reaves attempts a 3Pt. Contested by De'Aaron Rose (4.7 feet, ZONE). Desmond Reaves misses. FOUL! Loose ball foul on Myles LaVine during the rebound battle. [IN THE BONUS! 5 team fouls] Kyrie Middleton to the line for 2 free throws. (Myles LaVine: 1 personal fouls)   FT 1/2: GOOD   FT 2/2: GOOD Kyrie Middleton makes 2/2 from the line.
Score: 76-56

[01:00] Team_047 possession (Score: 76-56)
FOUL! Holding foul on Desmond Reaves. [IN THE BONUS! 6 team fouls] De'Aaron Rose to the line for 2 free throws. (Desmond Reaves: 1 personal fouls)   FT 1/2: GOOD   FT 2/2: GOOD De'Aaron Rose makes 2/2 from the line.
Score: 78-56

[00:41] Team_017 possession (Score: 78-56)
Bam Williamson drives, Myles LaVine stays with him. Bam Williamson attempts a Layup. Wide open! Myles LaVine is 6.2 feet away. [MAN] BAM WILLIAMSON MAKES IT! Assist: Tony Smith
Score: 78-58

[00:26] Team_047 possession (Score: 78-58)
Blake Jokic drives and kicks out. De'Aaron Rose attempts a 3Pt. Contested by Tony Smith (3.3 feet, ZONE). De'Aaron Rose misses. Rebound secured by Bam Williamson.

[00:11] Team_017 possession (Score: 78-58)
Tony Smith attempts a Midrange. Contested by Blake Jokic (5.7 feet, MAN). TONY SMITH MAKES IT!
Score: 78-60

================================================================================
                              3RD QUARTER COMPLETE                              
================================================================================

3RD QUARTER SCORE: Team_047 23, Team_017 17

BOX SCORE:
================================================================================

Team_047
--------------------------------------------------------------------------------
Player                MIN  PTS  REB  AST  TO      FG   FG%      3P   3P%
--------------------------------------------------------------------------------
Derrick Irving         26   10    4    0   0   3/4    75.0     0/0   0.0
De'Aaron Rose          26    5    0    0   0   2/3    66.7     0/0   0.0
Myles LaVine           26    4    2    1   0   2/4    50.0     0/0   0.0
Josh Harris            26    4    6    0   0   2/2   100.0     0/0   0.0
Blake Jokic            26    0    0    1   0   0/6     0.0     0/0   0.0

TEAM: FG: 9/19 (47.4%), 3PT: 3/8 (37.5%), REB: 12 (3 off, 9 def), AST: 2, TO: 3
TEAM FOULS: 5 [Team_017 in BONUS]


Team_017
--------------------------------------------------------------------------------
Player                MIN  PTS  REB  AST  TO      FG   FG%      3P   3P%
--------------------------------------------------------------------------------
Bam Williamson         26   10    4    0   0   4/4   100.0     0/0   0.0
Tony Smith             26    4    3    1   0   2/3    66.7     0/0   0.0
Kyrie Middleton        26    3    2    1   0   2/3    66.7     0/0   0.0
Desmond Reaves         26    0    0    0   0   0/4     0.0     0/0   0.0
Vince Banchero         26    0    0    0   0   0/3     0.0     0/0   0.0

TEAM: FG: 8/17 (47.1%), 3PT: 2/7 (28.6%), REB: 9 (1 off, 8 def), AST: 2, TO: 5
TEAM FOULS: 6 [Team_047 in BONUS]

================================================================================

================================================================================
                       4TH QUARTER - Team_047 vs Team_017                       
================================================================================

[12:00] Team_047 possession (Score: 78-60)
Derrick Irving attempts a Midrange. Contested by Vince Banchero (4.6 feet, MAN). Derrick Irving misses. Offensive rebound by Josh Harris! Josh Harris kicks it out.

[11:41] Team_047 possession (Score: 78-60)
Blake Jokic drives, picks up Bam Williamson. Help arrives from Vince Banchero! Blake Jokic attempts a Layup. Contested by Vince Banchero (4.2 feet, ZONE). BLAKE JOKIC MAKES IT! Assist: De'Aaron Rose
Score: 80-60

[11:27] Team_017 possession (Score: 80-60)
Bam Williamson attempts a Layup. Wide open! Myles LaVine is 6.1 feet away. [MAN] BAM WILLIAMSON MAKES IT!
Score: 80-62

[11:12] Team_047 possession (Score: 80-62)
FOUL! Shooting foul on Kyrie Middleton. Myles LaVine to the line for 2 free throws. [Team fouls: 1] (Kyrie Middleton: 1 personal fouls)   FT 1/2: MISS   FT 2/2: GOOD Myles LaVine makes 1/2 from the line.
Score: 81-62

[10:58] Team_017 possession (Score: 81-62)
Kyrie Middleton attempts a Midrange. BLOCKED BY JOSH HARRIS! Ball is loose! Rebound secured by Myles LaVine.

[10:45] Team_047 possession (Score: 81-62)
FOUL! Holding foul on Desmond Reaves. [Team fouls: 2] No free throws, side out. (Desmond Reaves: 1 personal fouls)

[10:32] Team_047 possession (Score: 81-62)
Josh Harris attempts a 3Pt. Contested by Vince Banchero (4.7 feet, ZONE). Josh Harris misses. Offensive rebound by Myles LaVine! Myles LaVine kicks it out.

[10:16] Team_047 possession (Score: 81-62)
Blake Jokic attempts a Layup. Contested by Bam Williamson (4.4 feet, ZONE). BLAKE JOKIC MAKES IT!
Score: 83-62

[10:02] Team_017 possession (Score: 83-62)
Vince Banchero attempts a Layup. Contested by Myles LaVine (5.5 feet, ZONE). VINCE BANCHERO MAKES IT! Assist: Kyrie Middleton
Score: 83-64

[09:51] Team_047 possession (Score: 83-64)
Blake Jokic loses control! Ball rolls out of bounds! TURNOVER! (dead ball)

[09:51] Substitution (Team_047): De'Aaron Rose OUT → Austin Giddey IN (stamina_rule2)

[09:51] Substitution (Team_047): Derrick Irving OUT → Donovan Iverson IN (stamina_rule2)

[09:51] Substitution (Team_047): Blake Jokic OUT → Blake Jackson IN (stamina_rule2)

[09:51] Substitution (Team_047): Josh Harris OUT → Tony Poole IN (stamina_rule2)

[09:51] Substitution (Team_047): Myles LaVine OUT → Zion Thompson IN (stamina_rule2)

[09:51] Substitution (Team_017): Desmond Reaves OUT → Blake Reaves IN (stamina_rule2)

[09:51] Substitution (Team_017): Vince Banchero OUT → Tobias Bridges IN (stamina_rule2)

[09:51] Substitution (Team_017): Tony Smith OUT → Shaquille Stewart IN (stamina_rule2)

[09:51] Substitution (Team_017): Kyrie Middleton OUT → Ja Stewart IN (stamina_rule2)

[09:51] Substitution (Team_017): Bam Williamson OUT → Klay Holiday IN (stamina_rule2)

[09:41] Team_017 possession (Score: 83-64)
Shaquille Stewart attempts a Midrange. Contested by Blake Jackson (4.7 feet, MAN). Shaquille Stewart misses. Rebound secured by Donovan Iverson.

[09:28] Team_047 possession (Score: 83-64)
Donovan Iverson loses the ball! Stripped by Tobias Bridges! TURNOVER! (live ball)

[09:14] Team_017 possession (Score: 83-64)
Tobias Bridges attempts a 3Pt. Contested by Donovan Iverson (4.3 feet, ZONE). Tobias Bridges misses. FOUL! Loose ball foul on Zion Thompson during the rebound battle. [Team fouls: 1] No free throws, side out. (Zion Thompson: 1 personal fouls)

[08:59] Team_017 possession (Score: 83-64)
Tobias Bridges throws a bad pass! Stolen by Donovan Iverson! TURNOVER! (live ball)

[08:44] Team_047 possession (Score: 83-64)
Tony Poole drives, picks up Ja Stewart. Help arrives from Tobias Bridges! Tony Poole attempts a Dunk. Contested by Tobias Bridges (5.3 feet, ZONE). Tony Poole misses. Offensive rebound by Zion Thompson! Zion Thompson kicks it out.

[08:29] Team_047 possession (Score: 83-64)
Tony Poole attempts a Midrange. Contested by Tobias Bridges (4.6 feet, ZONE). TONY POOLE MAKES IT! Assist: Donovan Iverson
Score: 85-64

[08:12] Team_017 possession (Score: 85-64)
Shaquille Stewart attempts a 3Pt. Contested by Donovan Iverson (4.6 feet, ZONE). Shaquille Stewart misses. Rebound secured by Donovan Iverson.

[08:01] Team_047 possession (Score: 85-64)
Tony Poole attempts a 3Pt. Contested by Ja Stewart (5.3 feet, MAN). Tony Poole misses. Offensive rebound by Zion Thompson! Zion Thompson kicks it out.

[07:51] Team_047 possession (Score: 85-64)
Zion Thompson attempts a Layup. Contested by Klay Holiday (5.0 feet, MAN). ZION THOMPSON MAKES IT! Assist: Tony Poole
Score: 87-64

[07:37] Team_017 possession (Score: 87-64)
Blake Reaves throws a bad pass! Stolen by Austin Giddey! TURNOVER! (live ball)

[07:23] Team_047 possession (Score: 87-64)
Blake Jackson attempts a 3Pt. Contested by Tobias Bridges (3.8 feet, ZONE). BLAKE JACKSON MAKES IT! Assist: Tony Poole
Score: 90-64

[07:08] Team_017 possession (Score: 90-64)
Klay Holiday attempts a Midrange. Contested by Blake Jackson (4.6 feet, ZONE). Klay Holiday misses. Rebound secured by Donovan Iverson.

[06:53] Team_047 possession (Score: 90-64)
FOUL! Shooting foul on Ja Stewart. Tony Poole to the line for 2 free throws. [Team fouls: 3] (Ja Stewart: 1 personal fouls)   FT 1/2: GOOD   FT 2/2: GOOD Tony Poole makes 2/2 from the line.
Score: 92-64

[06:38] Team_017 possession (Score: 92-64)
Tobias Bridges attempts a Layup. Contested by Zion Thompson (5.4 feet, ZONE). TOBIAS BRIDGES MAKES IT! Assist: Klay Holiday
Score: 92-66

[06:27] Team_047 possession (Score: 92-66)
Tony Poole drives, picks up Ja Stewart. Help arrives from Tobias Bridges! Tony Poole attempts a Layup. Contested by Tobias Bridges (5.3 feet, MAN). TONY POOLE MAKES IT! Assist: Blake Jackson
Score: 94-66

[06:13] Team_017 possession (Score: 94-66)
FOUL! Holding foul on Blake Jackson. [Team fouls: 2] No free throws, side out. (Blake Jackson: 1 personal fouls)

[06:00] Team_017 possession (Score: 94-66)
Shaquille Stewart drives to the basket... Shaquille Stewart loses control! Ball rolls out of bounds! TURNOVER! (dead ball)

[05:43] Team_047 possession (Score: 94-66)
Austin Giddey attempts a 3Pt. Contested by Tobias Bridges (4.6 feet, ZONE). Austin Giddey misses. Rebound secured by Shaquille Stewart.

[05:31] Team_017 possession (Score: 94-66)
FOUL! Offensive foul on Ja Stewart! Tony Poole drew the charge! [Team fouls: 4] (Ja Stewart: 2 personal fouls) TURNOVER! (dead ball)

[05:18] Team_047 possession (Score: 94-66)
FOUL! Shooting foul on Klay Holiday. Zion Thompson to the line for 2 free throws. [BONUS: 5 team fouls] (Klay Holiday: 1 personal fouls)   FT 1/2: MISS   FT 2/2: GOOD Zion Thompson makes 1/2 from the line.
Score: 95-66

[05:04] Team_017 possession (Score: 95-66)
Blake Reaves attempts a Layup. BLOCKED BY AUSTIN GIDDEY! Ball goes out off Austin Giddey. Blake Reaves's ball!

[04:50] Team_017 possession (Score: 95-66)
Blake Reaves attempts a Midrange. Contested by Blake Jackson (4.3 feet, ZONE). BLAKE REAVES MAKES IT! Assist: Shaquille Stewart
Score: 95-68

[04:37] Team_047 possession (Score: 95-68)
Zion Thompson drives and kicks out. Donovan Iverson attempts a 3Pt. Contested by Tobias Bridges (4.0 feet, MAN). DONOVAN IVERSON MAKES IT! Assist: Austin Giddey
Score: 98-68

[04:23] Team_017 possession (Score: 98-68)
FOUL! Shooting foul on Austin Giddey. Blake Reaves to the line for 2 free throws. [Team fouls: 3] (Austin Giddey: 1 personal fouls)   FT 1/2: GOOD   FT 2/2: MISS Blake Reaves makes 1/2 from the line. Rebound secured by Donovan Iverson.
Score: 98-69

[04:09] Team_047 possession (Score: 98-69)
Tony Poole drives to the basket... FOUL! Offensive foul on Tony Poole! Ja Stewart drew the charge! [Team fouls: 4] (Tony Poole: 1 personal fouls) TURNOVER! (dead ball)

[03:55] Team_017 possession (Score: 98-69)
Shaquille Stewart attempts a 3Pt. Contested by Blake Jackson (4.7 feet, MAN). Shaquille Stewart misses. Rebound secured by Blake Jackson.

[03:41] Team_047 possession (Score: 98-69)
Zion Thompson makes the Dunk and draws the foul on Klay Holiday! And-1! Zion Thompson to the line for 1. [BONUS: 6 team fouls] (Klay Holiday: 2 personal fouls)   FT 1/1: GOOD Zion Thompson makes 1/1 from the line.
Score: 101-69

[03:26] Team_017 possession (Score: 101-69)
Tobias Bridges attempts a 3Pt. Contested by Donovan Iverson (4.3 feet, MAN). TOBIAS BRIDGES MAKES IT! Assist: Klay Holiday
Score: 101-72

[03:13] Team_047 possession (Score: 101-72)
Zion Thompson drives and kicks out. Zion Thompson attempts a 3Pt. Contested by Tobias Bridges (4.0 feet, ZONE). Zion Thompson misses. Rebound secured by Shaquille Stewart.

[02:59] Team_017 possession (Score: 101-72)
Ja Stewart attempts a 3Pt. Contested by Tony Poole (4.7 feet, MAN). JA STEWART MAKES IT! Assist: Blake Reaves
Score: 101-75

[02:45] Team_047 possession (Score: 101-75)
Donovan Iverson loses control! Ball rolls out of bounds! TURNOVER! (dead ball)

[02:27] Team_017 possession (Score: 101-75)
Shaquille Stewart drives to the basket... Shaquille Stewart throws a bad pass out of bounds! TURNOVER! (dead ball)

[02:12] Team_047 possession (Score: 101-75)
Zion Thompson attempts a Midrange. Contested by Tobias Bridges (4.0 feet, ZONE). Zion Thompson misses. Rebound secured by Shaquille Stewart.

[02:02] Team_017 possession (Score: 101-75)
Klay Holiday attempts a Midrange. Contested by Zion Thompson (5.7 feet, MAN). KLAY HOLIDAY MAKES IT!
Score: 101-77

[01:48] Team_047 possession (Score: 101-77)
Donovan Iverson drives, Ja Stewart stays with him. Donovan Iverson attempts a Dunk. Contested by Ja Stewart (5.1 feet, ZONE). Donovan Iverson misses. Rebound secured by Ja Stewart.

[01:33] Team_017 possession (Score: 101-77)
Blake Reaves drives, picks up Austin Giddey. Help arrives from Donovan Iverson! Blake Reaves attempts a Dunk. Contested by Donovan Iverson (4.9 feet, MAN). BLAKE REAVES MAKES IT!
Score: 101-79

[01:22] Team_047 possession (Score: 101-79)
Blake Jackson attempts a Layup. Contested by Shaquille Stewart (4.3 feet, MAN). BLAKE JACKSON MAKES IT! Assist: Zion Thompson
Score: 103-79

[01:11] Team_017 possession (Score: 103-79)
FOUL! Shooting foul on Tony Poole. Ja Stewart to the line for 2 free throws. [BONUS: 5 team fouls] (Tony Poole: 2 personal fouls)   FT 1/2: GOOD   FT 2/2: GOOD Ja Stewart makes 2/2 from the line.
Score: 103-81

[00:58] Team_047 possession (Score: 103-81)
Donovan Iverson attempts a 3Pt. Contested by Tobias Bridges (4.5 feet, ZONE). DONOVAN IVERSON MAKES IT! Assist: Blake Jackson
Score: 106-81

[00:44] Team_017 possession (Score: 106-81)
Blake Reaves commits a violation (traveling/carry)! TURNOVER! (dead ball)

[00:29] Team_047 possession (Score: 106-81)
Austin Giddey drives, picks up Ja Stewart. Help arrives from Tobias Bridges! Austin Giddey attempts a Dunk. Contested by Tobias Bridges (5.5 feet, ZONE). AUSTIN GIDDEY MAKES IT!
Score: 108-81

[00:16] Team_017 possession (Score: 108-81)
Blake Reaves commits a violation (traveling/carry)! TURNOVER! (dead ball)

================================================================================
                              4TH QUARTER COMPLETE                              
================================================================================

4TH QUARTER SCORE: Team_047 30, Team_017 21

BOX SCORE:
================================================================================

Team_047
--------------------------------------------------------------------------------
Player                MIN  PTS  REB  AST  TO      FG   FG%      3P   3P%
--------------------------------------------------------------------------------
Donovan Iverson        19    6    4    1   0   2/3    66.7     0/0   0.0
Zion Thompson          19    6    2    1   0   3/5    60.0     0/0   0.0
Tony Poole             19    6    0    2   0   3/3   100.0     0/0   0.0
Blake Jackson          19    5    1    2   0   2/2   100.0     0/0   0.0
Blake Jokic            29    4    0    0   0   2/2   100.0     0/0   0.0
Austin Giddey          19    2    0    1   0   1/2    50.0     0/0   0.0
Myles LaVine           29    1    2    0   0   1/1   100.0     0/0   0.0
Josh Harris            29    0    1    0   0   0/0     0.0     0/0   0.0
De'Aaron Rose          29    0    0    1   0   0/0     0.0     0/0   0.0

TEAM: FG: 14/18 (77.8%), 3PT: 2/3 (66.7%), REB: 10 (4 off, 6 def), AST: 8, TO: 4
TEAM FOULS: 5 [Team_017 in BONUS]


Team_017
--------------------------------------------------------------------------------
Player                MIN  PTS  REB  AST  TO      FG   FG%      3P   3P%
--------------------------------------------------------------------------------
Ja Stewart             19    5    2    0   0   2/2   100.0     0/0   0.0
Tobias Bridges         19    5    0    0   0   2/2   100.0     0/0   0.0
Blake Reaves           19    4    0    1   0   2/3    66.7     0/0   0.0
Bam Williamson         29    2    0    0   0   1/1   100.0     0/0   0.0
Vince Banchero         29    2    0    0   0   1/1   100.0     0/0   0.0
Klay Holiday           19    2    0    2   0   1/2    50.0     0/0   0.0
Kyrie Middleton        29    0    0    1   0   0/1     0.0     0/0   0.0
Shaquille Stewart      19    0    3    1   0   0/3     0.0     0/0   0.0

TEAM: FG: 9/15 (60.0%), 3PT: 2/4 (50.0%), REB: 5 (1 off, 4 def), AST: 5, TO: 7
TEAM FOULS: 6 [Team_047 in BONUS]

================================================================================

================================================================================
                               FULL GAME COMPLETE                               
================================================================================

FINAL SCORE: Team_047 108, Team_017 81

SCORING BY QUARTER:
--------------------------------------------------------------------------------
Team                     Q1     Q2     Q3     Q4    FINAL
--------------------------------------------------------------------------------
Team_047                 32     23     23     30      108
Team_017                 20     23     17     21       81
--------------------------------------------------------------------------------

FULL GAME BOX SCORE:
================================================================================

Team_047
--------------------------------------------------------------------------------
Player                MIN  PTS  REB  AST  TO      FG   FG%      3P   3P%      FT STL BLK
--------------------------------------------------------------------------------
De'Aaron Rose          29    7    0    3   2   4/7    57.1   1/4    25.0   2/2     0   0
Derrick Irving         29   18   10    1   1   5/6    83.3   3/4    75.0   3/3     0   1
Blake Jokic            29   13    0    3   2   6/13   46.2   0/3     0.0   1/1     1   0
Josh Harris            29    9   11    1   1   3/5    60.0   1/2    50.0   3/4     2   1
Myles LaVine           29   19   11    2   0   8/14   57.1   1/1   100.0  14/17    2   0
Austin Giddey          19    8    0    1   0   3/6    50.0   1/3    33.3   1/1     1   1
Donovan Iverson        19    8    4    1   3   2/6    33.3   1/3    33.3   0/1     1   0
Blake Jackson          19    7    5    3   2   3/5    60.0   1/1   100.0   2/2     0   0
Tony Poole             19    6    0    2   1   3/4    75.0   0/0     0.0   2/2     1   0
Zion Thompson          19    6    7    1   0   4/7    57.1   0/0     0.0   2/3     1   1

TEAM: FG: 43/75 (57.3%), 3PT: 9/21 (42.9%), REB: 48 (15 off, 33 def), AST: 18, TO: 12


Team_017
--------------------------------------------------------------------------------
Player                MIN  PTS  REB  AST  TO      FG   FG%      3P   3P%      FT STL BLK
--------------------------------------------------------------------------------
Desmond Reaves         29    9    0    0   2   2/6    33.3   1/4    25.0   4/5     0   0
Vince Banchero         29    5    0    0   0   2/8    25.0   1/3    33.3   0/0     0   0
Tony Smith             29    7    7    2   2   5/11   45.5   1/4    25.0   0/0     0   0
Kyrie Middleton        29    8    5    5   3   5/10   50.0   0/3     0.0   5/7     0   1
Bam Williamson         29   16    7    1   2   6/8    75.0   1/2    50.0   2/2     0   1
Blake Reaves           19    4    0    2   3   3/5    60.0   0/0     0.0   1/2     0   0
Tobias Bridges         19   10    0    2   2   3/6    50.0   1/4    25.0   2/2     1   0
Shaquille Stewart      19    4    7    2   0   2/7    28.6   0/3     0.0   0/0     0   0
Ja Stewart             19   14    4    1   2   5/5   100.0   2/2   100.0   2/2     0   0
Klay Holiday           19    2    5    2   2   2/3    66.7   0/0     0.0   0/0     0   0

TEAM: FG: 35/69 (50.7%), 3PT: 7/25 (28.0%), REB: 35 (5 off, 30 def), AST: 17, TO: 18

================================================================================
