================================================================================
                        FULL GAME - Team_072 vs Team_009                        
================================================================================

================================================================================
                       1ST QUARTER - Team_072 vs Team_009                       
================================================================================

[12:00] Team_072 possession (Score: 0-0)
Wendell Anthony attempts a Midrange. Contested by Anfernee Anunoby (5.2 feet, MAN). Wendell Anthony misses. Rebound secured by Kyle Brogdon.

[11:44] Team_009 possession (Score: 0-0)
Desmond Harden attempts a Layup. Contested by Cade Poole (4.2 feet, MAN). DESMOND HARDEN MAKES IT! Assist: Anfernee Anunoby
Score: 0-2

[11:30] Team_072 possession (Score: 0-2)
Collin Griffin attempts a 3Pt. Contested by Miles Sabonis (5.6 feet, MAN). Collin Griffin misses. Rebound secured by Kyle Brogdon.

[11:14] Team_009 possession (Score: 0-2)
Anfernee Anunoby attempts a Midrange. Contested by Tyrese Williamson (4.3 feet, ZONE). ANFERNEE ANUNOBY MAKES IT! Assist: Miles Sabonis
Score: 0-4

[10:59] Team_072 possession (Score: 0-4)
Collin Griffin drives, Miles Sabonis stays with him. Collin Griffin attempts a Layup. Contested by Miles Sabonis (5.6 feet, MAN). Collin Griffin misses. Rebound secured by Anfernee Anunoby.

[10:46] Team_009 possession (Score: 0-4)
FOUL! Offensive foul on Anfernee Anunoby! Wendell Anthony drew the charge! [Team fouls: 1] (Anfernee Anunoby: 1 personal fouls) TURNOVER! (dead ball)

[10:33] Team_072 possession (Score: 0-4)
Cade Poole attempts a 3Pt. Contested by Desmond Harden (5.5 feet, MAN). Cade Poole misses. Rebound secured by Kyle Brogdon.

[10:20] Team_009 possession (Score: 0-4)
Cole Mitchell attempts a Midrange. Contested by Tracy Giddey (4.2 feet, ZONE). COLE MITCHELL MAKES IT!
Score: 0-6

[10:06] Team_072 possession (Score: 0-6)
Tyrese Williamson drives and kicks out. Wendell Anthony attempts a 3Pt. Contested by Anfernee Anunoby (5.1 feet, MAN). WENDELL ANTHONY MAKES IT! Assist: Tyrese Williamson
Score: 3-6

[09:52] Team_009 possession (Score: 3-6)
Desmond Harden attempts a Midrange. Contested by Cade Poole (4.2 feet, MAN). Desmond Harden misses. Rebound secured by Tracy Giddey.

[09:37] Team_072 possession (Score: 3-6)
Tyrese Williamson drives, Kyle Brogdon stays with him. Tyrese Williamson attempts a Layup. Contested by Kyle Brogdon (5.2 feet, ZONE). Tyrese Williamson misses. Offensive rebound by Tracy Giddey! Tracy Giddey kicks it out.

[09:20] Team_072 possession (Score: 3-6)
Cade Poole attempts a 3Pt. Contested by Miles Sabonis (5.9 feet, ZONE). Cade Poole misses. Rebound secured by Kyle Brogdon.

[09:06] Team_009 possession (Score: 3-6)
FOUL! Reach-in foul on Tracy Giddey during the drive. [Team fouls: 1] No free throws, side out. (Tracy Giddey: 1 personal fouls)

[08:49] Team_009 possession (Score: 3-6)
Kyle Brogdon attempts a Midrange. Contested by Wendell Anthony (3.8 feet, ZONE). Kyle Brogdon misses. Rebound secured by Tyrese Williamson.

[08:34] Team_072 possession (Score: 3-6)
FOUL! Holding foul on Miles Sabonis. [Team fouls: 2] No free throws, side out. (Miles Sabonis: 1 personal fouls)

[08:18] Team_072 possession (Score: 3-6)
Wendell Anthony attempts a Midrange. Contested by Cole Mitchell (4.6 feet, ZONE). WENDELL ANTHONY MAKES IT!
Score: 5-6

[08:01] Team_009 possession (Score: 5-6)
Kyle Brogdon makes the Dunk and draws the foul on Tyrese Williamson! And-1! Kyle Brogdon to the line for 1. [Team fouls: 2] (Tyrese Williamson: 1 personal fouls)   FT 1/1: GOOD Kyle Brogdon makes 1/1 from the line.
Score: 5-9

[07:47] Team_072 possession (Score: 5-9)
FOUL! Holding foul on Anfernee Anunoby. [Team fouls: 3] No free throws, side out. (Anfernee Anunoby: 2 personal fouls)

[07:34] Team_072 possession (Score: 5-9)
Wendell Anthony attempts a Midrange. Contested by Desmond Harden (5.0 feet, ZONE). Wendell Anthony misses. Offensive rebound by Tyrese Williamson! Tyrese Williamson kicks it out.

[07:23] Team_072 possession (Score: 5-9)
Tracy Giddey makes the Layup and draws the foul on Miles Sabonis! And-1! Tracy Giddey to the line for 1. [Team fouls: 4] (Miles Sabonis: 2 personal fouls)   FT 1/1: GOOD Tracy Giddey makes 1/1 from the line.
Score: 8-9

[07:09] Team_009 possession (Score: 8-9)
FOUL! Reach-in foul on Tyrese Williamson during the drive. [Team fouls: 3] No free throws, side out. (Tyrese Williamson: 2 personal fouls)

[06:58] Team_009 possession (Score: 8-9)
Miles Sabonis attempts a 3Pt. Contested by Collin Griffin (4.2 feet, MAN). Miles Sabonis misses. Rebound secured by Tyrese Williamson.

[06:42] Team_072 possession (Score: 8-9)
Tyrese Williamson makes the Layup and draws the foul on Cole Mitchell! And-1! Tyrese Williamson to the line for 1. [BONUS: 5 team fouls] (Cole Mitchell: 1 personal fouls)   FT 1/1: GOOD Tyrese Williamson makes 1/1 from the line.
Score: 11-9

[06:28] Team_009 possession (Score: 11-9)
Desmond Harden throws a bad pass! Stolen by Cade Poole! TURNOVER! (live ball)

[06:09] Team_072 possession (Score: 11-9)
Wendell Anthony attempts a 3Pt. Contested by Anfernee Anunoby (5.2 feet, MAN). WENDELL ANTHONY MAKES IT! Assist: Collin Griffin
Score: 14-9

[05:56] Team_009 possession (Score: 14-9)
Kyle Brogdon attempts a Midrange. Contested by Tracy Giddey (3.9 feet, ZONE). Kyle Brogdon misses. Rebound secured by Tracy Giddey.

[05:41] Team_072 possession (Score: 14-9)
FOUL! Shooting foul on Anfernee Anunoby. Cade Poole to the line for 2 free throws. [BONUS: 6 team fouls] (Anfernee Anunoby: 3 personal fouls)   FT 1/2: MISS   FT 2/2: GOOD Cade Poole makes 1/2 from the line.
Score: 15-9

[05:29] Team_009 possession (Score: 15-9)
Cole Mitchell loses the ball! Stripped by Tracy Giddey! TURNOVER! (live ball)

[05:12] Team_072 possession (Score: 15-9)
Wendell Anthony attempts a 3Pt. Contested by Desmond Harden (5.0 feet, ZONE). WENDELL ANTHONY MAKES IT! Assist: Tracy Giddey
Score: 18-9

[04:59] Team_009 possession (Score: 18-9)
Anfernee Anunoby attempts a 3Pt. Contested by Tracy Giddey (4.2 feet, ZONE). Anfernee Anunoby misses. Rebound secured by Tracy Giddey.

[04:45] Team_072 possession (Score: 18-9)
Collin Griffin loses the ball! Stripped by Miles Sabonis! TURNOVER! (live ball)

[04:31] Team_009 possession (Score: 18-9)
Miles Sabonis drives, picks up Collin Griffin. Help arrives from Wendell Anthony! Miles Sabonis attempts a Dunk. Contested by Wendell Anthony (4.3 feet, MAN). Miles Sabonis misses. Rebound secured by Wendell Anthony.

[04:17] Team_072 possession (Score: 18-9)
Tyrese Williamson drives, Kyle Brogdon stays with him. Tyrese Williamson attempts a Layup. Contested by Kyle Brogdon (5.3 feet, MAN). TYRESE WILLIAMSON MAKES IT! Assist: Cade Poole
Score: 20-9

[04:02] Team_009 possession (Score: 20-9)
Kyle Brogdon attempts a Midrange. Contested by Wendell Anthony (3.9 feet, ZONE). KYLE BROGDON MAKES IT!
Score: 20-11

[03:49] Team_072 possession (Score: 20-11)
FOUL! Reach-in foul on Kyle Brogdon during the drive. [IN THE BONUS! 7 team fouls] Collin Griffin to the line for 2 free throws. (Kyle Brogdon: 1 personal fouls)   FT 1/2: GOOD   FT 2/2: GOOD Collin Griffin makes 2/2 from the line.
Score: 22-11

[03:36] Team_009 possession (Score: 22-11)
Anfernee Anunoby attempts a Midrange. Contested by Wendell Anthony (4.3 feet, ZONE). Anfernee Anunoby misses. Rebound secured by Tyrese Williamson.

[03:19] Team_072 possession (Score: 22-11)
Tracy Giddey attempts a 3Pt. Contested by Cole Mitchell (5.2 feet, MAN). Tracy Giddey misses. FOUL! Loose ball foul on Cole Mitchell during the rebound battle. [IN THE BONUS! 8 team fouls] Tracy Giddey to the line for 2 free throws. (Cole Mitchell: 2 personal fouls)   FT 1/2: GOOD   FT 2/2: MISS Tracy Giddey makes 1/2 from the line. Rebound secured by Anfernee Anunoby.
Score: 23-11

[03:07] Team_009 possession (Score: 23-11)
Miles Sabonis drives, Collin Griffin stays with him. Miles Sabonis attempts a Dunk. Contested by Collin Griffin (4.4 feet, MAN). MILES SABONIS MAKES IT!
Score: 23-13

[02:50] Team_072 possession (Score: 23-13)
Tracy Giddey attempts a Layup. Contested by Kyle Brogdon (5.7 feet, ZONE). TRACY GIDDEY MAKES IT!
Score: 25-13

[02:40] Team_009 possession (Score: 25-13)
FOUL! Shooting foul on Cade Poole. Desmond Harden to the line for 2 free throws. [Team fouls: 4] (Cade Poole: 1 personal fouls)   FT 1/2: GOOD   FT 2/2: MISS Desmond Harden makes 1/2 from the line. Rebound secured by Wendell Anthony.
Score: 25-14

[02:22] Team_072 possession (Score: 25-14)
Tracy Giddey attempts a Layup. Contested by Cole Mitchell (5.3 feet, MAN). Tracy Giddey misses. Rebound secured by Anfernee Anunoby.

[02:07] Team_009 possession (Score: 25-14)
Kyle Brogdon attempts a Layup. BLOCKED BY TYRESE WILLIAMSON! Ball deflects out of bounds off Kyle Brogdon.

[01:53] Team_072 possession (Score: 25-14)
Tracy Giddey makes the Layup and draws the foul on Cole Mitchell! And-1! Tracy Giddey to the line for 1. [BONUS: 9 team fouls] (Cole Mitchell: 3 personal fouls)   FT 1/1: GOOD Tracy Giddey makes 1/1 from the line.
Score: 28-14

[01:42] Team_009 possession (Score: 28-14)
FOUL! Shooting foul on Cade Poole. Desmond Harden to the line for 3 free throws. [BONUS: 5 team fouls] (Cade Poole: 2 personal fouls)   FT 1/3: GOOD   FT 2/3: MISS   FT 3/3: GOOD Desmond Harden makes 2/3 from the line.
Score: 28-16

[01:25] Team_072 possession (Score: 28-16)
Tyrese Williamson loses control! Ball rolls out of bounds! TURNOVER! (dead ball)

[01:25] Substitution (Team_072): Collin Griffin OUT → Giannis Gobert IN (stamina_rule2)

[01:25] Substitution (Team_072): Cade Poole OUT → CJ Jokic IN (stamina_rule2)

[01:25] Substitution (Team_072): Wendell Anthony OUT → CJ Bane IN (stamina_rule2)

[01:25] Substitution (Team_072): Tracy Giddey OUT → Brandon Durant IN (stamina_rule2)

[01:25] Substitution (Team_072): Tyrese Williamson OUT → Stephen Holiday IN (stamina_rule2)

[01:25] Substitution (Team_009): Miles Sabonis OUT → Paul Trent IN (stamina_rule2)

[01:25] Substitution (Team_009): Desmond Harden OUT → Evan Curry IN (stamina_rule2)

[01:25] Substitution (Team_009): Anfernee Anunoby OUT → RJ Jokic IN (stamina_rule2)

[01:25] Substitution (Team_009): Cole Mitchell OUT → Kawhi Herro IN (stamina_rule2)

[01:25] Substitution (Team_009): Kyle Brogdon OUT → Shaquille Green IN (stamina_rule2)

[01:08] Team_009 possession (Score: 28-16)
Paul Trent attempts a Midrange. Contested by Giannis Gobert (4.2 feet, MAN). PAUL TRENT MAKES IT!
Score: 28-18

[00:56] Team_072 possession (Score: 28-18)
CJ Jokic drives to the basket... CJ Jokic throws a bad pass out of bounds! TURNOVER! (dead ball)

[00:43] Team_009 possession (Score: 28-18)
Shaquille Green attempts a Layup. Contested by Stephen Holiday (5.2 feet, ZONE). Shaquille Green misses. Rebound secured by Stephen Holiday.

[00:29] Team_072 possession (Score: 28-18)
Brandon Durant drives to the basket... FOUL! Offensive foul on Brandon Durant! Kawhi Herro drew the charge! [Team fouls: 6] (Brandon Durant: 1 personal fouls) TURNOVER! (dead ball)

[00:12] Team_009 possession (Score: 28-18)
Paul Trent attempts a 3Pt. Contested by Giannis Gobert (4.2 feet, ZONE). Paul Trent misses. Rebound secured by Stephen Holiday.

================================================================================
                              1ST QUARTER COMPLETE                              
================================================================================

1ST QUARTER SCORE: Team_072 28, Team_009 18

BOX SCORE:
================================================================================

Team_072
--------------------------------------------------------------------------------
Player                MIN  PTS  REB  AST  TO      FG   FG%      3P   3P%
--------------------------------------------------------------------------------
Wendell Anthony        11   11    2    0   0   4/5    80.0     0/0   0.0
Tracy Giddey           11    8    4    1   0   3/5    60.0     0/0   0.0
Tyrese Williamson      11    5    4    1   0   2/2   100.0     0/0   0.0
Collin Griffin         11    2    0    1   0   1/3    33.3     0/0   0.0
Cade Poole             11    1    0    1   0   1/3    33.3     0/0   0.0
Stephen Holiday         1    0    2    0   0   0/0     0.0     0/0   0.0

TEAM: FG: 11/18 (61.1%), 3PT: 2/6 (33.3%), REB: 13 (3 off, 10 def), AST: 4, TO: 4
TEAM FOULS: 6 [Team_009 in BONUS]


Team_009
--------------------------------------------------------------------------------
Player                MIN  PTS  REB  AST  TO      FG   FG%      3P   3P%
--------------------------------------------------------------------------------
Kyle Brogdon           11    5    4    0   0   2/5    40.0     0/0   0.0
Desmond Harden         11    4    0    0   0   2/4    50.0     0/0   0.0
Anfernee Anunoby       11    2    3    1   0   1/3    33.3     0/0   0.0
Miles Sabonis          11    2    0    1   0   1/3    33.3     0/0   0.0
Cole Mitchell          11    2    0    0   0   1/1   100.0     0/0   0.0
Paul Trent              1    2    0    0   0   1/2    50.0     0/0   0.0
Shaquille Green         1    0    0    0   0   0/1     0.0     0/0   0.0

TEAM: FG: 8/19 (42.1%), 3PT: 1/4 (25.0%), REB: 6 (0 off, 6 def), AST: 2, TO: 3
TEAM FOULS: 9 [Team_072 in BONUS]

================================================================================

================================================================================
                       2ND QUARTER - Team_072 vs Team_009                       
================================================================================

[12:00] Team_072 possession (Score: 28-18)
Wendell Anthony attempts a Midrange. Contested by Anfernee Anunoby (5.3 feet, MAN). Wendell Anthony misses. Rebound secured by Kyle Brogdon.

[11:46] Team_009 possession (Score: 28-18)
Anfernee Anunoby throws a bad pass! Stolen by Wendell Anthony! TURNOVER! (live ball)

[11:32] Team_072 possession (Score: 28-18)
Cade Poole attempts a 3Pt. Wide open! Miles Sabonis is 6.0 feet away. [ZONE] Cade Poole misses. Rebound secured by Cole Mitchell.

[11:21] Team_009 possession (Score: 28-18)
Anfernee Anunoby drives and kicks out. Anfernee Anunoby attempts a 3Pt. Contested by Cade Poole (4.4 feet, ZONE). ANFERNEE ANUNOBY MAKES IT!
Score: 28-21

[11:05] Team_072 possession (Score: 28-21)
FOUL! Shooting foul on Desmond Harden. Wendell Anthony to the line for 2 free throws. [Team fouls: 1] (Desmond Harden: 1 personal fouls)   FT 1/2: GOOD   FT 2/2: GOOD Wendell Anthony makes 2/2 from the line.
Score: 30-21

[10:49] Team_009 possession (Score: 30-21)
Desmond Harden drives, picks up Cade Poole. Help arrives from Wendell Anthony! Desmond Harden attempts a Dunk. Contested by Wendell Anthony (4.5 feet, MAN). DESMOND HARDEN MAKES IT! Assist: Cole Mitchell
Score: 30-23

[10:37] Team_072 possession (Score: 30-23)
Tyrese Williamson attempts a 3Pt. Contested by Miles Sabonis (5.8 feet, ZONE). Tyrese Williamson misses. Offensive rebound by Tracy Giddey! Tracy Giddey kicks it out.

[10:26] Team_072 possession (Score: 30-23)
Tyrese Williamson makes the Layup and draws the foul on Kyle Brogdon! And-1! Tyrese Williamson to the line for 1. [Team fouls: 2] (Kyle Brogdon: 1 personal fouls)   FT 1/1: MISS Tyrese Williamson makes 0/1 from the line. Rebound secured by Cole Mitchell.
Score: 32-23

[10:09] Team_009 possession (Score: 32-23)
Desmond Harden attempts a 3Pt. Contested by Cade Poole (4.5 feet, MAN). DESMOND HARDEN MAKES IT! Assist: Kyle Brogdon
Score: 32-26

[09:53] Team_072 possession (Score: 32-26)
Collin Griffin attempts a 3Pt. Contested by Cole Mitchell (5.2 feet, ZONE). COLLIN GRIFFIN MAKES IT! Assist: Cade Poole
Score: 35-26

[09:39] Team_009 possession (Score: 35-26)
Anfernee Anunoby attempts a 3Pt. Contested by Cade Poole (4.5 feet, ZONE). Anfernee Anunoby misses. Rebound secured by Wendell Anthony.

[09:25] Team_072 possession (Score: 35-26)
Tyrese Williamson drives and kicks out. Tracy Giddey attempts a 3Pt. Contested by Miles Sabonis (5.6 feet, ZONE). Tracy Giddey misses. FOUL! Loose ball foul on Anfernee Anunoby during the rebound battle. [Team fouls: 3] No free throws, side out. (Anfernee Anunoby: 1 personal fouls)

[09:13] Team_072 possession (Score: 35-26)
Tracy Giddey attempts a Midrange. Contested by Cole Mitchell (5.5 feet, ZONE). Tracy Giddey misses. Offensive rebound by Tyrese Williamson! Tyrese Williamson kicks it out.

[08:58] Team_072 possession (Score: 35-26)
Cade Poole attempts a 3Pt. Contested by Desmond Harden (5.9 feet, ZONE). Cade Poole misses. Rebound secured by Kyle Brogdon.

[08:44] Team_009 possession (Score: 35-26)
Miles Sabonis attempts a 3Pt. Contested by Cade Poole (4.6 feet, ZONE). Miles Sabonis misses. Offensive rebound by Kyle Brogdon! Kyle Brogdon kicks it out.

[08:31] Team_009 possession (Score: 35-26)
FOUL! Shooting foul on Cade Poole. Miles Sabonis to the line for 3 free throws. [Team fouls: 1] (Cade Poole: 1 personal fouls)   FT 1/3: MISS   FT 2/3: GOOD   FT 3/3: GOOD Miles Sabonis makes 2/3 from the line.
Score: 35-28

[08:20] Team_072 possession (Score: 35-28)
Collin Griffin attempts a Layup. Contested by Kyle Brogdon (5.7 feet, ZONE). Collin Griffin misses. Rebound secured by Kyle Brogdon.

[08:07] Team_009 possession (Score: 35-28)
Cole Mitchell attempts a 3Pt. Contested by Cade Poole (4.7 feet, ZONE). Cole Mitchell misses. Rebound secured by Wendell Anthony.

[07:51] Team_072 possession (Score: 35-28)
Tracy Giddey attempts a 3Pt. Wide open! Miles Sabonis is 6.3 feet away. [ZONE] Tracy Giddey misses. Rebound secured by Anfernee Anunoby.

[07:36] Team_009 possession (Score: 35-28)
Desmond Harden drives and kicks out. Desmond Harden attempts a 3Pt. Contested by Cade Poole (4.9 feet, ZONE). DESMOND HARDEN MAKES IT! Assist: Anfernee Anunoby
Score: 35-31

[07:19] Team_072 possession (Score: 35-31)
Tyrese Williamson attempts a Midrange. Contested by Desmond Harden (5.8 feet, ZONE). TYRESE WILLIAMSON MAKES IT!
Score: 37-31

[07:01] Team_009 possession (Score: 37-31)
Kyle Brogdon drives, Tyrese Williamson stays with him. Kyle Brogdon attempts a Layup. Contested by Tyrese Williamson (4.5 feet, ZONE). KYLE BROGDON MAKES IT! Assist: Cole Mitchell
Score: 37-33

[06:47] Team_072 possession (Score: 37-33)
FOUL! Shooting foul on Anfernee Anunoby. Collin Griffin to the line for 2 free throws. [Team fouls: 4] (Anfernee Anunoby: 2 personal fouls)   FT 1/2: GOOD   FT 2/2: GOOD Collin Griffin makes 2/2 from the line.
Score: 39-33

[06:32] Team_009 possession (Score: 39-33)
Desmond Harden attempts a 3Pt. Contested by Cade Poole (5.0 feet, MAN). Desmond Harden misses. Rebound secured by Wendell Anthony.

[06:20] Team_072 possession (Score: 39-33)
Collin Griffin attempts a Layup. Contested by Kyle Brogdon (6.0 feet, ZONE). Collin Griffin misses. Rebound secured by Kyle Brogdon.

[06:01] Team_009 possession (Score: 39-33)
Cole Mitchell drives to the basket... FOUL! Offensive foul on Cole Mitchell! Tracy Giddey drew the charge! [Team fouls: 5] (Cole Mitchell: 1 personal fouls) TURNOVER! (dead ball)

[05:45] Team_072 possession (Score: 39-33)
Cade Poole attempts a Midrange. Wide open! Kyle Brogdon is 6.3 feet away. [ZONE] Cade Poole misses. Offensive rebound by Tyrese Williamson! Tyrese Williamson kicks it out.

[05:33] Team_072 possession (Score: 39-33)
Tyrese Williamson attempts a Midrange. Wide open! Kyle Brogdon is 6.0 feet away. [MAN] Tyrese Williamson misses. Rebound secured by Kyle Brogdon.

[05:21] Team_009 possession (Score: 39-33)
Anfernee Anunoby attempts a 3Pt. Contested by Wendell Anthony (5.1 feet, MAN). ANFERNEE ANUNOBY MAKES IT! Assist: Miles Sabonis
Score: 39-36

[05:06] Team_072 possession (Score: 39-36)
Wendell Anthony attempts a 3Pt. Wide open! Anfernee Anunoby is 6.0 feet away. [MAN] Wendell Anthony misses. Rebound secured by Kyle Brogdon.

[04:49] Team_009 possession (Score: 39-36)
Cole Mitchell attempts a 3Pt. Contested by Cade Poole (5.1 feet, ZONE). Cole Mitchell misses. Rebound secured by Tyrese Williamson.

[04:32] Team_072 possession (Score: 39-36)
Tyrese Williamson attempts a Layup. Wide open! Kyle Brogdon is 6.1 feet away. [MAN] Tyrese Williamson misses. Rebound secured by Kyle Brogdon.

[04:15] Team_009 possession (Score: 39-36)
FOUL! Shooting foul on Tyrese Williamson. Desmond Harden to the line for 2 free throws. [Team fouls: 2] (Tyrese Williamson: 1 personal fouls)   FT 1/2: GOOD   FT 2/2: GOOD Desmond Harden makes 2/2 from the line.
Score: 39-38

[03:56] Team_072 possession (Score: 39-38)
Collin Griffin drives to the basket... Collin Griffin loses the ball! Stripped by Kyle Brogdon! TURNOVER! (live ball)

[03:38] Team_009 possession (Score: 39-38)
Miles Sabonis attempts a 3Pt. Contested by Cade Poole (5.2 feet, ZONE). Miles Sabonis misses. Rebound secured by Wendell Anthony.

[03:26] Team_072 possession (Score: 39-38)
Tyrese Williamson attempts a 3Pt. Wide open! Kyle Brogdon is 6.3 feet away. [MAN] Tyrese Williamson misses. Rebound secured by Cole Mitchell.

[03:14] Team_009 possession (Score: 39-38)
Cole Mitchell drives and kicks out. Anfernee Anunoby attempts a 3Pt. Contested by Wendell Anthony (5.6 feet, MAN). ANFERNEE ANUNOBY MAKES IT! Assist: Cole Mitchell
Score: 39-41

[03:00] Team_072 possession (Score: 39-41)
Tyrese Williamson attempts a Midrange. Wide open! Anfernee Anunoby is 6.4 feet away. [ZONE] TYRESE WILLIAMSON MAKES IT! Assist: Collin Griffin
Score: 41-41

[02:46] Team_009 possession (Score: 41-41)
Cole Mitchell drives, Tracy Giddey stays with him. Cole Mitchell attempts a Layup. Contested by Tracy Giddey (5.2 feet, MAN). Cole Mitchell misses. Rebound secured by Tyrese Williamson.

[02:31] Team_072 possession (Score: 41-41)
Cade Poole drives to the basket... Cade Poole throws a bad pass! Stolen by Desmond Harden! TURNOVER! (live ball)

[02:20] Team_009 possession (Score: 41-41)
Miles Sabonis drives, Tyrese Williamson stays with him. Miles Sabonis attempts a Dunk. Contested by Tyrese Williamson (5.4 feet, ZONE). MILES SABONIS MAKES IT! Assist: Anfernee Anunoby
Score: 41-43

[02:06] Team_072 possession (Score: 41-43)
Collin Griffin attempts a 3Pt. Wide open! Miles Sabonis is 6.6 feet away. [ZONE] COLLIN GRIFFIN MAKES IT! Assist: Tracy Giddey
Score: 44-43

[01:50] Team_009 possession (Score: 44-43)
Kyle Brogdon attempts a Layup. Contested by Tyrese Williamson (5.2 feet, MAN). KYLE BROGDON MAKES IT!
Score: 44-45

[01:34] Team_072 possession (Score: 44-45)
Tyrese Williamson attempts a Midrange. Wide open! Cole Mitchell is 6.3 feet away. [ZONE] Tyrese Williamson misses. Rebound secured by Kyle Brogdon.

[01:20] Team_009 possession (Score: 44-45)
FOUL! Holding foul on Wendell Anthony. [Team fouls: 3] No free throws, side out. (Wendell Anthony: 1 personal fouls)

[01:09] Team_009 possession (Score: 44-45)
FOUL! Reach-in foul on Cade Poole during the drive. [Team fouls: 4] No free throws, side out. (Cade Poole: 2 personal fouls)

[00:57] Team_009 possession (Score: 44-45)
Anfernee Anunoby drives and kicks out. Anfernee Anunoby attempts a Midrange. Wide open! Wendell Anthony is 6.1 feet away. [MAN] ANFERNEE ANUNOBY MAKES IT! Assist: Kyle Brogdon
Score: 44-47

[00:42] Team_072 possession (Score: 44-47)
Wendell Anthony attempts a 3Pt. Wide open! Anfernee Anunoby is 6.6 feet away. [ZONE] Wendell Anthony misses. Rebound secured by Anfernee Anunoby.

[00:28] Team_009 possession (Score: 44-47)
Miles Sabonis attempts a 3Pt. Contested by Collin Griffin (5.7 feet, MAN). Miles Sabonis misses. Offensive rebound by Kyle Brogdon! Kyle Brogdon kicks it out.

[00:11] Team_009 possession (Score: 44-47)
Cole Mitchell attempts a 3Pt. Contested by Tracy Giddey (5.6 feet, MAN). Cole Mitchell misses. Rebound secured by Tracy Giddey.

================================================================================
                              2ND QUARTER COMPLETE                              
================================================================================

2ND QUARTER SCORE: Team_072 16, Team_009 29

BOX SCORE:
================================================================================

Team_072
--------------------------------------------------------------------------------
Player                MIN  PTS  REB  AST  TO      FG   FG%      3P   3P%
--------------------------------------------------------------------------------
Collin Griffin         23    8    0    1   0   3/5    60.0     0/0   0.0
Tyrese Williamson      23    4    4    0   0   2/7    28.6     0/0   0.0
Wendell Anthony        23    2    4    0   0   1/4    25.0     0/0   0.0
Cade Poole             23    0    0    1   0   0/2     0.0     0/0   0.0
Tracy Giddey           23    0    3    1   0   0/1     0.0     0/0   0.0

TEAM: FG: 6/19 (31.6%), 3PT: 2/8 (25.0%), REB: 11 (4 off, 7 def), AST: 3, TO: 2
TEAM FOULS: 4


Team_009
--------------------------------------------------------------------------------
Player                MIN  PTS  REB  AST  TO      FG   FG%      3P   3P%
--------------------------------------------------------------------------------
Anfernee Anunoby       23   11    2    2   0   4/5    80.0     0/0   0.0
Desmond Harden         23   10    0    0   0   4/5    80.0     0/0   0.0
Kyle Brogdon           23    4   10    2   0   2/2   100.0     0/0   0.0
Miles Sabonis          23    4    0    1   0   2/3    66.7     0/0   0.0
Cole Mitchell          23    0    3    3   0   0/4     0.0     0/0   0.0

TEAM: FG: 12/19 (63.2%), 3PT: 3/9 (33.3%), REB: 15 (2 off, 13 def), AST: 8, TO: 2
TEAM FOULS: 5 [Team_072 in BONUS]

================================================================================

================================================================================
                       3RD QUARTER - Team_072 vs Team_009                       
================================================================================

[12:00] Team_072 possession (Score: 44-47)
Cade Poole attempts a Midrange. Contested by Desmond Harden (5.5 feet, MAN). Cade Poole misses. Rebound secured by Anfernee Anunoby.

[11:42] Team_009 possession (Score: 44-47)
Anfernee Anunoby attempts a Layup. BLOCKED BY TYRESE WILLIAMSON! Ball is loose! Offensive rebound by Cole Mitchell! Cole Mitchell kicks it out.

[11:27] Team_009 possession (Score: 44-47)
Cole Mitchell attempts a 3Pt. Contested by Tracy Giddey (4.2 feet, MAN). COLE MITCHELL MAKES IT! Assist: Anfernee Anunoby
Score: 44-50

[11:12] Team_072 possession (Score: 44-50)
Tyrese Williamson attempts a Layup. Contested by Kyle Brogdon (5.2 feet, MAN). Tyrese Williamson misses. Rebound secured by Anfernee Anunoby.

[10:57] Team_009 possession (Score: 44-50)
Desmond Harden attempts a Layup. Contested by Tyrese Williamson (4.4 feet, ZONE). DESMOND HARDEN MAKES IT!
Score: 44-52

[10:44] Team_072 possession (Score: 44-52)
Wendell Anthony attempts a 3Pt. Contested by Anfernee Anunoby (5.2 feet, MAN). Wendell Anthony misses. Rebound secured by Cole Mitchell.

[10:29] Team_009 possession (Score: 44-52)
FOUL! Reach-in foul on Tracy Giddey during the drive. [Team fouls: 2] No free throws, side out. (Tracy Giddey: 2 personal fouls)

[10:14] Team_009 possession (Score: 44-52)
FOUL! Shooting foul on Cade Poole. Miles Sabonis to the line for 3 free throws. [Team fouls: 3] (Cade Poole: 1 personal fouls)   FT 1/3: GOOD   FT 2/3: GOOD   FT 3/3: GOOD Miles Sabonis makes 3/3 from the line.
Score: 44-55

[10:00] Team_072 possession (Score: 44-55)
Collin Griffin attempts a 3Pt. Contested by Miles Sabonis (5.6 feet, ZONE). Collin Griffin misses. Rebound secured by Kyle Brogdon.

[09:43] Team_009 possession (Score: 44-55)
Cole Mitchell drives and kicks out. Cole Mitchell attempts a Midrange. Contested by Tracy Giddey (4.3 feet, MAN). Cole Mitchell misses. Rebound secured by Tracy Giddey.

[09:26] Team_072 possession (Score: 44-55)
Wendell Anthony attempts a 3Pt. Contested by Anfernee Anunoby (5.2 feet, MAN). Wendell Anthony misses. Rebound secured by Cole Mitchell.

[09:09] Team_009 possession (Score: 44-55)
FOUL! Offensive foul on Miles Sabonis! Collin Griffin drew the charge! [Team fouls: 1] (Miles Sabonis: 1 personal fouls) TURNOVER! (dead ball)

[08:54] Team_072 possession (Score: 44-55)
FOUL! Shooting foul on Kyle Brogdon. Tyrese Williamson to the line for 2 free throws. [Team fouls: 2] (Kyle Brogdon: 1 personal fouls)   FT 1/2: GOOD   FT 2/2: MISS Tyrese Williamson makes 1/2 from the line. Offensive rebound by Tyrese Williamson! Tyrese Williamson kicks it out.
Score: 45-55

[08:40] Team_072 possession (Score: 45-55)
Wendell Anthony attempts a 3Pt. Contested by Anfernee Anunoby (5.2 feet, ZONE). WENDELL ANTHONY MAKES IT! Assist: Collin Griffin
Score: 48-55

[08:27] Team_009 possession (Score: 48-55)
Anfernee Anunoby attempts a Layup. BLOCKED BY COLLIN GRIFFIN! Ball goes out off Collin Griffin. Anfernee Anunoby's ball!

[08:13] Team_009 possession (Score: 48-55)
FOUL! Shooting foul on Tyrese Williamson. Miles Sabonis to the line for 2 free throws. [Team fouls: 4] (Tyrese Williamson: 1 personal fouls)   FT 1/2: GOOD   FT 2/2: GOOD Miles Sabonis makes 2/2 from the line.
Score: 48-57

[07:58] Team_072 possession (Score: 48-57)
Tyrese Williamson drives, picks up Kyle Brogdon. Help arrives from Miles Sabonis! Tyrese Williamson attempts a Layup. Contested by Miles Sabonis (5.2 feet, ZONE). Tyrese Williamson misses. Rebound secured by Cole Mitchell.

[07:47] Team_009 possession (Score: 48-57)
FOUL! Shooting foul on Cade Poole. Anfernee Anunoby to the line for 2 free throws. [BONUS: 5 team fouls] (Cade Poole: 2 personal fouls)   FT 1/2: GOOD   FT 2/2: GOOD Anfernee Anunoby makes 2/2 from the line.
Score: 48-59

[07:34] Team_072 possession (Score: 48-59)
Cade Poole drives and kicks out. Tyrese Williamson attempts a 3Pt. Contested by Anfernee Anunoby (5.1 feet, ZONE). Tyrese Williamson misses. Rebound secured by Cole Mitchell.

[07:17] Team_009 possession (Score: 48-59)
Cole Mitchell makes the Dunk and draws the foul on Tracy Giddey! And-1! Cole Mitchell to the line for 1. [BONUS: 6 team fouls] (Tracy Giddey: 3 personal fouls)   FT 1/1: GOOD Cole Mitchell makes 1/1 from the line.
Score: 48-62

[07:05] Team_072 possession (Score: 48-62)
Tyrese Williamson attempts a Midrange. Contested by Anfernee Anunoby (5.4 feet, ZONE). Tyrese Williamson misses. Rebound secured by Cole Mitchell.

[06:56] Team_009 possession (Score: 48-62)
Miles Sabonis attempts a 3Pt. Contested by Collin Griffin (4.2 feet, MAN). Miles Sabonis misses. Rebound secured by Tracy Giddey.

[06:46] Team_072 possession (Score: 48-62)
Tyrese Williamson attempts a Midrange. Contested by Kyle Brogdon (5.2 feet, MAN). TYRESE WILLIAMSON MAKES IT!
Score: 50-62

[06:28] Team_009 possession (Score: 50-62)
Miles Sabonis attempts a 3Pt. Contested by Collin Griffin (4.2 feet, MAN). Miles Sabonis misses. Rebound secured by Tracy Giddey.

[06:15] Team_072 possession (Score: 50-62)
Collin Griffin attempts a Midrange. Contested by Miles Sabonis (5.6 feet, MAN). COLLIN GRIFFIN MAKES IT! Assist: Cade Poole
Score: 52-62

[05:58] Team_009 possession (Score: 52-62)
FOUL! Reach-in foul on Tracy Giddey during the drive. [IN THE BONUS! 7 team fouls] Desmond Harden to the line for 2 free throws. (Tracy Giddey: 4 personal fouls)   FT 1/2: GOOD   FT 2/2: GOOD Desmond Harden makes 2/2 from the line.
Score: 52-64

[05:43] Team_072 possession (Score: 52-64)
Collin Griffin drives and kicks out. Tracy Giddey attempts a 3Pt. Contested by Cole Mitchell (4.4 feet, MAN). TRACY GIDDEY MAKES IT! Assist: Wendell Anthony
Score: 55-64

[05:30] Team_009 possession (Score: 55-64)
FOUL! Offensive foul on Miles Sabonis! Collin Griffin drew the charge! [Team fouls: 3] (Miles Sabonis: 2 personal fouls) TURNOVER! (dead ball)

[05:16] Team_072 possession (Score: 55-64)
Tyrese Williamson attempts a Midrange. Contested by Kyle Brogdon (5.2 feet, MAN). TYRESE WILLIAMSON MAKES IT! Assist: Tracy Giddey
Score: 57-64

[05:00] Team_009 possession (Score: 57-64)
FOUL! Shooting foul on Tyrese Williamson. Desmond Harden to the line for 2 free throws. [BONUS: 8 team fouls] (Tyrese Williamson: 2 personal fouls)   FT 1/2: MISS   FT 2/2: MISS Desmond Harden makes 0/2 from the line. Offensive rebound by Cole Mitchell! Cole Mitchell kicks it out.

[04:45] Team_009 possession (Score: 57-64)
Kyle Brogdon drives, picks up Tyrese Williamson. Help arrives from Collin Griffin! Kyle Brogdon attempts a Dunk. Contested by Collin Griffin (4.0 feet, MAN). KYLE BROGDON MAKES IT! Assist: Desmond Harden
Score: 57-66

[04:25] Team_072 possession (Score: 57-66)
Tracy Giddey attempts a Midrange. Contested by Desmond Harden (5.5 feet, ZONE). Tracy Giddey misses. Rebound secured by Cole Mitchell.

[04:08] Team_009 possession (Score: 57-66)
Miles Sabonis attempts a 3Pt. Contested by Cade Poole (4.1 feet, ZONE). Miles Sabonis misses. Rebound secured by Tyrese Williamson.

[03:49] Team_072 possession (Score: 57-66)
Tyrese Williamson drives, Kyle Brogdon stays with him. Tyrese Williamson attempts a Dunk. Contested by Kyle Brogdon (5.3 feet, MAN). TYRESE WILLIAMSON MAKES IT! Assist: Wendell Anthony
Score: 59-66

[03:36] Team_009 possession (Score: 59-66)
FOUL! Reach-in foul on Tracy Giddey during the drive. [IN THE BONUS! 9 team fouls] Cole Mitchell to the line for 2 free throws. (Tracy Giddey: 5 personal fouls)   FT 1/2: MISS   FT 2/2: MISS Cole Mitchell makes 0/2 from the line. Rebound secured by Tyrese Williamson.

[03:20] Team_072 possession (Score: 59-66)
Tracy Giddey attempts a Midrange. Contested by Cole Mitchell (5.2 feet, MAN). TRACY GIDDEY MAKES IT! Assist: Collin Griffin
Score: 61-66

[03:04] Team_009 possession (Score: 61-66)
Desmond Harden drives and kicks out. Kyle Brogdon attempts a 3Pt. Contested by Tyrese Williamson (4.5 feet, MAN). Kyle Brogdon misses. Rebound secured by Tracy Giddey.

[02:47] Team_072 possession (Score: 61-66)
Tracy Giddey attempts a 3Pt. Wide open! Miles Sabonis is 6.0 feet away. [ZONE] TRACY GIDDEY MAKES IT! Assist: Cade Poole
Score: 64-66

[02:36] Team_009 possession (Score: 64-66)
Desmond Harden makes the Layup and draws the foul on Wendell Anthony! And-1! Desmond Harden to the line for 1. [BONUS: 10 team fouls] (Wendell Anthony: 1 personal fouls)   FT 1/1: GOOD Desmond Harden makes 1/1 from the line.
Score: 64-69

[02:22] Team_072 possession (Score: 64-69)
FOUL! Holding foul on Desmond Harden. [Team fouls: 4] No free throws, side out. (Desmond Harden: 1 personal fouls)

[02:06] Team_072 possession (Score: 64-69)
Tracy Giddey drives, Cole Mitchell stays with him. Tracy Giddey attempts a Layup. Contested by Cole Mitchell (5.3 feet, MAN). TRACY GIDDEY MAKES IT! Assist: Wendell Anthony
Score: 66-69

[01:54] Team_009 possession (Score: 66-69)
FOUL! Offensive foul on Kyle Brogdon! Tyrese Williamson drew the charge! [Team fouls: 5] (Kyle Brogdon: 2 personal fouls) TURNOVER! (dead ball)

[01:39] Team_072 possession (Score: 66-69)
Tracy Giddey drives, Kyle Brogdon stays with him. Tracy Giddey attempts a Layup. Contested by Kyle Brogdon (5.8 feet, ZONE). TRACY GIDDEY MAKES IT!
Score: 68-69

[01:25] Team_009 possession (Score: 68-69)
Kyle Brogdon attempts a 3Pt. Contested by Tracy Giddey (4.1 feet, ZONE). Kyle Brogdon misses. Offensive rebound by Cole Mitchell! Cole Mitchell kicks it out.

[01:10] Team_009 possession (Score: 68-69)
Miles Sabonis attempts a 3Pt. Contested by Collin Griffin (4.6 feet, MAN). Miles Sabonis misses. Rebound secured by Tracy Giddey.

[00:56] Team_072 possession (Score: 68-69)
Tracy Giddey drives to the basket... Tracy Giddey throws a bad pass out of bounds! TURNOVER! (dead ball)

[00:56] Substitution (Team_072): Collin Griffin OUT → Giannis Gobert IN (stamina_rule2)

[00:56] Substitution (Team_072): Cade Poole OUT → CJ Jokic IN (stamina_rule2)

[00:56] Substitution (Team_072): Wendell Anthony OUT → CJ Bane IN (stamina_rule2)

[00:56] Substitution (Team_072): Tracy Giddey OUT → Brandon Durant IN (stamina_rule2)

[00:56] Substitution (Team_072): Tyrese Williamson OUT → Stephen Holiday IN (stamina_rule2)

[00:56] Substitution (Team_009): Miles Sabonis OUT → Paul Trent IN (stamina_rule2)

[00:56] Substitution (Team_009): Desmond Harden OUT → Evan Curry IN (stamina_rule2)

[00:56] Substitution (Team_009): Anfernee Anunoby OUT → RJ Jokic IN (stamina_rule2)

[00:56] Substitution (Team_009): Cole Mitchell OUT → Kawhi Herro IN (stamina_rule2)

[00:56] Substitution (Team_009): Kyle Brogdon OUT → Shaquille Green IN (stamina_rule2)

[00:41] Team_009 possession (Score: 68-69)
RJ Jokic drives and kicks out. Paul Trent attempts a 3Pt. Contested by Giannis Gobert (4.9 feet, MAN). Paul Trent misses. Offensive rebound by Kawhi Herro! Kawhi Herro puts it back in!
Score: 68-71

[00:26] Team_072 possession (Score: 68-71)
CJ Jokic attempts a 3Pt. Contested by Evan Curry (5.2 feet, MAN). CJ Jokic misses. Rebound secured by Shaquille Green.

[00:12] Team_009 possession (Score: 68-71)
FOUL! Holding foul on CJ Bane. [IN THE BONUS! 11 team fouls] RJ Jokic to the line for 2 free throws. (CJ Bane: 1 personal fouls)   FT 1/2: GOOD   FT 2/2: GOOD RJ Jokic makes 2/2 from the line.
Score: 68-73

================================================================================
                              3RD QUARTER COMPLETE                              
================================================================================

3RD QUARTER SCORE: Team_072 24, Team_009 26

BOX SCORE:
================================================================================

Team_072
--------------------------------------------------------------------------------
Player                MIN  PTS  REB  AST  TO      FG   FG%      3P   3P%
--------------------------------------------------------------------------------
Tracy Giddey           34   12    5    1   0   5/6    83.3     0/0   0.0
Tyrese Williamson      34    6    3    0   0   3/6    50.0     0/0   0.0
Wendell Anthony        34    3    0    3   0   1/3    33.3     0/0   0.0
Collin Griffin         34    2    0    2   0   1/2    50.0     0/0   0.0
Cade Poole             34    0    0    2   0   0/2     0.0     0/0   0.0
CJ Jokic                2    0    0    0   0   0/1     0.0     0/0   0.0

TEAM: FG: 10/20 (50.0%), 3PT: 2/6 (33.3%), REB: 8 (1 off, 7 def), AST: 8, TO: 1
TEAM FOULS: 11 [Team_009 in BONUS]


Team_009
--------------------------------------------------------------------------------
Player                MIN  PTS  REB  AST  TO      FG   FG%      3P   3P%
--------------------------------------------------------------------------------
Desmond Harden         34    7    0    1   0   3/4    75.0     0/0   0.0
Cole Mitchell          34    6    9    0   0   2/4    50.0     0/0   0.0
Miles Sabonis          34    5    0    0   0   2/6    33.3     0/0   0.0
Anfernee Anunoby       34    2    2    1   0   1/1   100.0     0/0   0.0
Kyle Brogdon           34    2    1    0   0   1/1   100.0     0/0   0.0
Kawhi Herro             2    2    1    0   0   1/1   100.0     0/0   0.0
RJ Jokic                2    2    0    0   0   1/1   100.0     0/0   0.0
Shaquille Green         2    0    1    0   0   0/0     0.0     0/0   0.0

TEAM: FG: 11/18 (61.1%), 3PT: 2/6 (33.3%), REB: 14 (4 off, 10 def), AST: 2, TO: 3
TEAM FOULS: 5 [Team_072 in BONUS]

================================================================================

================================================================================
                       4TH QUARTER - Team_072 vs Team_009                       
================================================================================

[12:00] Team_072 possession (Score: 68-73)
Wendell Anthony attempts a 3Pt. Contested by Miles Sabonis (5.6 feet, ZONE). Wendell Anthony misses. Rebound secured by Anfernee Anunoby.

[11:47] Team_009 possession (Score: 68-73)
Kyle Brogdon drives, Tyrese Williamson stays with him. Kyle Brogdon attempts a Layup. Contested by Tyrese Williamson (4.1 feet, MAN). KYLE BROGDON MAKES IT!
Score: 68-75

[11:32] Team_072 possession (Score: 68-75)
FOUL! Holding foul on Cole Mitchell. [Team fouls: 1] No free throws, side out. (Cole Mitchell: 1 personal fouls)

[11:17] Team_072 possession (Score: 68-75)
Collin Griffin attempts a Midrange. Contested by Miles Sabonis (5.8 feet, MAN). Collin Griffin misses. Rebound secured by Kyle Brogdon.

[11:03] Team_009 possession (Score: 68-75)
Desmond Harden drives, picks up Cade Poole. Help arrives from Wendell Anthony! Desmond Harden attempts a Layup. Contested by Wendell Anthony (4.5 feet, MAN). DESMOND HARDEN MAKES IT! Assist: Miles Sabonis
Score: 68-77

[10:48] Team_072 possession (Score: 68-77)
FOUL! Reach-in foul on Miles Sabonis during the drive. [Team fouls: 2] No free throws, side out. (Miles Sabonis: 1 personal fouls)

[10:32] Team_072 possession (Score: 68-77)
FOUL! Shooting foul on Cole Mitchell. Tracy Giddey to the line for 2 free throws. [Team fouls: 3] (Cole Mitchell: 2 personal fouls)   FT 1/2: GOOD   FT 2/2: GOOD Tracy Giddey makes 2/2 from the line.
Score: 70-77

[10:14] Team_009 possession (Score: 70-77)
Miles Sabonis drives to the basket... Miles Sabonis loses control! Ball rolls out of bounds! TURNOVER! (dead ball)

[10:14] Substitution (Team_072): Collin Griffin OUT → Giannis Gobert IN (stamina_rule2)

[10:14] Substitution (Team_072): Cade Poole OUT → CJ Jokic IN (stamina_rule2)

[10:14] Substitution (Team_072): Wendell Anthony OUT → CJ Bane IN (stamina_rule2)

[10:14] Substitution (Team_072): Tracy Giddey OUT → Brandon Durant IN (stamina_rule2)

[10:14] Substitution (Team_072): Tyrese Williamson OUT → Stephen Holiday IN (stamina_rule2)

[10:14] Substitution (Team_009): Miles Sabonis OUT → Paul Trent IN (stamina_rule2)

[10:14] Substitution (Team_009): Desmond Harden OUT → Evan Curry IN (stamina_rule2)

[10:14] Substitution (Team_009): Anfernee Anunoby OUT → RJ Jokic IN (stamina_rule2)

[10:14] Substitution (Team_009): Cole Mitchell OUT → Kawhi Herro IN (stamina_rule2)

[10:14] Substitution (Team_009): Kyle Brogdon OUT → Shaquille Green IN (stamina_rule2)

[10:04] Team_072 possession (Score: 70-77)
Stephen Holiday attempts a Midrange. Contested by Shaquille Green (5.3 feet, MAN). Stephen Holiday misses. Rebound secured by RJ Jokic.

[09:49] Team_009 possession (Score: 70-77)
Evan Curry attempts a 3Pt. Contested by CJ Jokic (5.4 feet, MAN). Evan Curry misses. Offensive rebound by Kawhi Herro! Kawhi Herro puts it back in!
Score: 70-79

[09:31] Team_072 possession (Score: 70-79)
CJ Bane makes the Midrange and draws the foul on Kawhi Herro! And-1! CJ Bane to the line for 1. [Team fouls: 4] (Kawhi Herro: 1 personal fouls)   FT 1/1: GOOD CJ Bane makes 1/1 from the line.
Score: 73-79

[09:13] Team_009 possession (Score: 73-79)
Paul Trent drives and kicks out. RJ Jokic attempts a Midrange. Contested by Stephen Holiday (5.1 feet, ZONE). RJ Jokic misses. Rebound secured by CJ Jokic.

[09:02] Team_072 possession (Score: 73-79)
Stephen Holiday drives to the basket... Stephen Holiday throws a bad pass! Stolen by Kawhi Herro! TURNOVER! (live ball)

[08:49] Team_009 possession (Score: 73-79)
Kawhi Herro attempts a 3Pt. Contested by Giannis Gobert (5.1 feet, ZONE). KAWHI HERRO MAKES IT! Assist: Shaquille Green
Score: 73-82

[08:36] Team_072 possession (Score: 73-82)
CJ Bane attempts a 3Pt. Contested by Paul Trent (5.4 feet, ZONE). CJ Bane misses. FOUL! Loose ball foul on RJ Jokic during the rebound battle. [IN THE BONUS! 5 team fouls] Stephen Holiday to the line for 2 free throws. (RJ Jokic: 1 personal fouls)   FT 1/2: GOOD   FT 2/2: MISS Stephen Holiday makes 1/2 from the line. Offensive rebound by Brandon Durant! Brandon Durant kicks it out.
Score: 74-82

[08:24] Team_072 possession (Score: 74-82)
FOUL! Shooting foul on Evan Curry. CJ Jokic to the line for 2 free throws. [BONUS: 6 team fouls] (Evan Curry: 1 personal fouls)   FT 1/2: MISS   FT 2/2: GOOD CJ Jokic makes 1/2 from the line.
Score: 75-82

[08:08] Team_009 possession (Score: 75-82)
Kawhi Herro attempts a 3Pt. Contested by CJ Bane (4.6 feet, ZONE). KAWHI HERRO MAKES IT! Assist: RJ Jokic
Score: 75-85

[07:56] Team_072 possession (Score: 75-85)
Stephen Holiday attempts a Layup. Contested by Shaquille Green (5.3 feet, MAN). Stephen Holiday misses. Rebound secured by Kawhi Herro.

[07:42] Team_009 possession (Score: 75-85)
Shaquille Green drives to the basket... Shaquille Green throws a bad pass! Stolen by Stephen Holiday! TURNOVER! (live ball)

[07:30] Team_072 possession (Score: 75-85)
CJ Bane attempts a Layup. BLOCKED BY PAUL TRENT! Ball is loose! Rebound secured by RJ Jokic.

[07:12] Team_009 possession (Score: 75-85)
Paul Trent attempts a 3Pt. Contested by CJ Bane (3.8 feet, ZONE). Paul Trent misses. Rebound secured by Stephen Holiday.

[06:58] Team_072 possession (Score: 75-85)
CJ Bane attempts a 3Pt. Contested by RJ Jokic (4.2 feet, MAN). CJ Bane misses. Offensive rebound by Brandon Durant! Brandon Durant kicks it out.

[06:43] Team_072 possession (Score: 75-85)
CJ Jokic attempts a 3Pt. Contested by Paul Trent (5.5 feet, ZONE). CJ Jokic misses. Offensive rebound by Brandon Durant! Brandon Durant kicks it out.

[06:32] Team_072 possession (Score: 75-85)
CJ Bane drives and kicks out. CJ Bane makes the Midrange and draws the foul on Evan Curry! And-1! CJ Bane to the line for 1. [BONUS: 7 team fouls] (Evan Curry: 2 personal fouls)   FT 1/1: MISS CJ Bane makes 0/1 from the line. Rebound secured by Kawhi Herro.
Score: 77-85

[06:19] Team_009 possession (Score: 77-85)
Evan Curry attempts a Midrange. Contested by CJ Jokic (5.4 feet, MAN). EVAN CURRY MAKES IT! Assist: Kawhi Herro
Score: 77-87

[06:07] Team_072 possession (Score: 77-87)
CJ Bane attempts a 3Pt. Contested by Paul Trent (5.4 feet, ZONE). CJ Bane misses. Offensive rebound by Brandon Durant! Brandon Durant kicks it out.

[05:53] Team_072 possession (Score: 77-87)
CJ Jokic drives, Kawhi Herro stays with him. CJ Jokic attempts a Dunk. Contested by Kawhi Herro (3.4 feet, ZONE). CJ JOKIC MAKES IT! Assist: Giannis Gobert
Score: 79-87

[05:34] Team_009 possession (Score: 79-87)
FOUL! Shooting foul on Stephen Holiday. Shaquille Green to the line for 2 free throws. [Team fouls: 1] (Stephen Holiday: 1 personal fouls)   FT 1/2: GOOD   FT 2/2: GOOD Shaquille Green makes 2/2 from the line.
Score: 79-89

[05:24] Team_072 possession (Score: 79-89)
CJ Bane attempts a Midrange. Contested by RJ Jokic (4.2 feet, MAN). CJ BANE MAKES IT! Assist: Brandon Durant
Score: 81-89

[05:10] Team_009 possession (Score: 81-89)
Evan Curry drives to the basket... Evan Curry loses the ball! Stripped by Brandon Durant! TURNOVER! (live ball)

[04:56] Team_072 possession (Score: 81-89)
CJ Jokic attempts a 3Pt. Contested by Paul Trent (5.5 feet, ZONE). CJ Jokic misses. Offensive rebound by Stephen Holiday! Stephen Holiday kicks it out.

[04:43] Team_072 possession (Score: 81-89)
Brandon Durant attempts a Midrange. Contested by Kawhi Herro (3.4 feet, MAN). BRANDON DURANT MAKES IT! Assist: CJ Bane
Score: 83-89

[04:29] Team_009 possession (Score: 83-89)
Shaquille Green attempts a Midrange. Contested by CJ Jokic (5.4 feet, ZONE). SHAQUILLE GREEN MAKES IT!
Score: 83-91

[04:14] Team_072 possession (Score: 83-91)
Giannis Gobert attempts a Midrange. Contested by Kawhi Herro (3.9 feet, ZONE). Giannis Gobert misses. Rebound secured by Shaquille Green.

[04:03] Team_009 possession (Score: 83-91)
Shaquille Green attempts a Midrange. Contested by CJ Bane (4.6 feet, ZONE). Shaquille Green misses. Rebound secured by Brandon Durant.

[03:48] Team_072 possession (Score: 83-91)
CJ Bane attempts a 3Pt. Contested by Paul Trent (5.4 feet, ZONE). CJ BANE MAKES IT! Assist: Stephen Holiday
Score: 86-91

[03:35] Team_009 possession (Score: 86-91)
Evan Curry commits a violation (traveling/carry)! TURNOVER! (dead ball)

[03:16] Team_072 possession (Score: 86-91)
FOUL! Reach-in foul on Kawhi Herro during the drive. [IN THE BONUS! 8 team fouls] Giannis Gobert to the line for 2 free throws. (Kawhi Herro: 2 personal fouls)   FT 1/2: GOOD   FT 2/2: MISS Giannis Gobert makes 1/2 from the line. Rebound secured by Shaquille Green.
Score: 87-91

[03:02] Team_009 possession (Score: 87-91)
Shaquille Green drives and kicks out. Evan Curry attempts a Midrange. Contested by CJ Jokic (5.3 feet, MAN). Evan Curry misses. Offensive rebound by Kawhi Herro! Kawhi Herro's putback is no good. Rebound secured by CJ Jokic.

[02:46] Team_072 possession (Score: 87-91)
FOUL! Reach-in foul on Kawhi Herro during the drive. [IN THE BONUS! 9 team fouls] Stephen Holiday to the line for 2 free throws. (Kawhi Herro: 3 personal fouls)   FT 1/2: GOOD   FT 2/2: GOOD Stephen Holiday makes 2/2 from the line.
Score: 89-91

[02:31] Team_009 possession (Score: 89-91)
Kawhi Herro attempts a 3Pt. Contested by Brandon Durant (4.1 feet, MAN). Kawhi Herro misses. Rebound secured by Stephen Holiday.

[02:13] Team_072 possession (Score: 89-91)
Giannis Gobert attempts a 3Pt. Wide open! Paul Trent is 6.1 feet away. [ZONE] Giannis Gobert misses. Rebound secured by Kawhi Herro.

[02:00] Team_009 possession (Score: 89-91)
Kawhi Herro drives, Stephen Holiday stays with him. Kawhi Herro attempts a Dunk. Contested by Stephen Holiday (5.3 feet, ZONE). KAWHI HERRO MAKES IT! Assist: Shaquille Green
Score: 89-93

[01:44] Team_072 possession (Score: 89-93)
Brandon Durant attempts a 3Pt. Contested by Kawhi Herro (3.6 feet, MAN). Brandon Durant misses. Offensive rebound by Brandon Durant! Brandon Durant kicks it out.

[01:31] Team_072 possession (Score: 89-93)
Brandon Durant attempts a 3Pt. Contested by Kawhi Herro (3.6 feet, MAN). Brandon Durant misses. Offensive rebound by Stephen Holiday! Stephen Holiday kicks it out.

[01:14] Team_072 possession (Score: 89-93)
CJ Jokic attempts a Layup. BLOCKED BY EVAN CURRY! Ball is loose! Rebound secured by Shaquille Green.

[00:59] Team_009 possession (Score: 89-93)
FOUL! Shooting foul on Giannis Gobert. Paul Trent to the line for 2 free throws. [Team fouls: 2] (Giannis Gobert: 1 personal fouls)   FT 1/2: GOOD   FT 2/2: MISS Paul Trent makes 1/2 from the line. Rebound secured by Brandon Durant.
Score: 89-94

[00:46] Team_072 possession (Score: 89-94)
FOUL! Offensive foul on Giannis Gobert! Paul Trent drew the charge! [Team fouls: 3] (Giannis Gobert: 2 personal fouls) TURNOVER! (dead ball)

[00:30] Team_009 possession (Score: 89-94)
Paul Trent attempts a Midrange. Contested by Giannis Gobert (4.5 feet, MAN). Paul Trent misses. Offensive rebound by Shaquille Green! Shaquille Green kicks it out.

[00:18] Team_009 possession (Score: 89-94)
RJ Jokic drives, Stephen Holiday stays with him. RJ Jokic attempts a Layup. Contested by Stephen Holiday (5.1 feet, ZONE). RJ JOKIC MAKES IT! Assist: Evan Curry
Score: 89-96

[00:08] Team_072 possession (Score: 89-96)
Giannis Gobert attempts a 3Pt. Wide open! Paul Trent is 6.2 feet away. [ZONE] Giannis Gobert misses. Offensive rebound by Brandon Durant! Brandon Durant kicks it out.

================================================================================
                              4TH QUARTER COMPLETE                              
================================================================================

4TH QUARTER SCORE: Team_072 21, Team_009 23

BOX SCORE:
================================================================================

Team_072
--------------------------------------------------------------------------------
Player                MIN  PTS  REB  AST  TO      FG   FG%      3P   3P%
--------------------------------------------------------------------------------
CJ Bane                12    8    0    1   0   3/5    60.0     0/0   0.0
CJ Jokic               12    3    2    0   0   2/3    66.7     0/0   0.0
Tracy Giddey           36    2    0    0   0   1/1   100.0     0/0   0.0
Stephen Holiday        12    2    4    1   0   1/3    33.3     0/0   0.0
Brandon Durant         12    2    8    1   0   1/1   100.0     0/0   0.0
Wendell Anthony        36    0    0    0   0   0/1     0.0     0/0   0.0
Collin Griffin         36    0    0    0   0   0/1     0.0     0/0   0.0
Giannis Gobert         12    0    0    1   0   0/3     0.0     0/0   0.0

TEAM: FG: 8/18 (44.4%), 3PT: 1/3 (33.3%), REB: 13 (8 off, 5 def), AST: 4, TO: 2
TEAM FOULS: 3


Team_009
--------------------------------------------------------------------------------
Player                MIN  PTS  REB  AST  TO      FG   FG%      3P   3P%
--------------------------------------------------------------------------------
Kawhi Herro            12   10    4    1   0   4/5    80.0     0/0   0.0
Shaquille Green        12    4    4    2   0   2/4    50.0     0/0   0.0
Kyle Brogdon           36    2    1    0   0   1/1   100.0     0/0   0.0
Desmond Harden         36    2    0    0   0   1/1   100.0     0/0   0.0
RJ Jokic               12    2    2    1   0   1/1   100.0     0/0   0.0
Evan Curry             12    2    0    1   0   1/1   100.0     0/0   0.0
Anfernee Anunoby       36    0    1    0   0   0/0     0.0     0/0   0.0
Miles Sabonis          36    0    0    1   0   0/0     0.0     0/0   0.0
Paul Trent             12    0    0    0   0   0/3     0.0     0/0   0.0

TEAM: FG: 10/16 (62.5%), 3PT: 3/5 (60.0%), REB: 13 (3 off, 10 def), AST: 6, TO: 4
TEAM FOULS: 9 [Team_072 in BONUS]

================================================================================

================================================================================
                               FULL GAME COMPLETE                               
================================================================================

FINAL SCORE: Team_072 89, Team_009 96

SCORING BY QUARTER:
--------------------------------------------------------------------------------
Team                     Q1     Q2     Q3     Q4    FINAL
--------------------------------------------------------------------------------
Team_072                 28     16     24     21       89
Team_009                 18     29     26     23       96
--------------------------------------------------------------------------------

FULL GAME BOX SCORE:
================================================================================

Team_072
--------------------------------------------------------------------------------
Player                MIN  PTS  REB  AST  TO      FG   FG%      3P   3P%      FT STL BLK
--------------------------------------------------------------------------------
Collin Griffin         36   12    0    4   3   6/12   50.0   2/4    50.0   4/4     0   1
Cade Poole             36    1    0    4   1   1/7    14.3   0/4     0.0   1/2     1   0
Wendell Anthony        36   16    6    3   0   5/12   41.7   3/8    37.5   2/2     1   0
Tracy Giddey           36   22   12    3   0   8/12   66.7   1/3    33.3   5/6     1   0
Tyrese Williamson      36   15   11    1   1   8/16   50.0   0/1     0.0   2/4     0   2
Giannis Gobert         12    0    0    1   4   0/3     0.0   0/1     0.0   1/2     0   0
CJ Jokic               12    3    2    0   0   2/4    50.0   0/1     0.0   1/2     0   0
CJ Bane                12    8    0    1   0   3/5    60.0   1/1   100.0   1/2     0   0
Brandon Durant         12    2    8    1   0   1/1   100.0   0/0     0.0   0/0     1   0
Stephen Holiday        12    2    6    1   0   1/3    33.3   0/0     0.0   3/4     1   0

TEAM: FG: 35/75 (46.7%), 3PT: 7/23 (30.4%), REB: 45 (16 off, 29 def), AST: 19, TO: 9


Team_009
--------------------------------------------------------------------------------
Player                MIN  PTS  REB  AST  TO      FG   FG%      3P   3P%      FT STL BLK
--------------------------------------------------------------------------------
Miles Sabonis          36   11    0    3   3   5/12   41.7   2/8    25.0   7/8     1   0
Desmond Harden         36   23    0    1   1  10/14   71.4   2/3    66.7   8/12    1   0
Anfernee Anunoby       36   15    8    4   2   5/8    62.5   1/3    33.3   2/2     0   0
Cole Mitchell          36    8   12    3   1   4/10   40.0   1/4    25.0   1/3     0   0
Kyle Brogdon           36   13   16    2   2   6/9    66.7   0/0     0.0   1/1     1   0
Paul Trent             12    2    0    0   1   1/5    20.0   0/2     0.0   1/2     0   1
Evan Curry             12    2    0    1   1   2/2   100.0   1/1   100.0   0/0     0   1
RJ Jokic               12    4    2    1   0   2/2   100.0   0/0     0.0   2/2     0   0
Kawhi Herro            12   12    5    1   0   3/4    75.0   2/3    66.7   0/0     1   0
Shaquille Green        12    4    5    2   1   2/5    40.0   0/0     0.0   2/2     0   0

TEAM: FG: 41/72 (56.9%), 3PT: 9/24 (37.5%), REB: 48 (9 off, 39 def), AST: 18, TO: 12

================================================================================
