================================================================================
                        FULL GAME - Team_058 vs Team_076                        
================================================================================

================================================================================
                       1ST QUARTER - Team_058 vs Team_076                       
================================================================================

[12:00] Team_058 possession (Score: 0-0)
Tyrese Doncic attempts a Midrange. Contested by D'Angelo Tatum (3.7 feet, MAN). TYRESE DONCIC MAKES IT!
Score: 2-0

[11:47] Team_076 possession (Score: 2-0)
D'Angelo Tatum attempts a Midrange. Contested by Tyrese Doncic (4.7 feet, MAN). D'Angelo Tatum misses. Offensive rebound by D'Angelo Tatum! D'Angelo Tatum kicks it out.

[11:29] Team_076 possession (Score: 2-0)
D'Angelo Tatum attempts a Midrange. Contested by Tyrese Doncic (4.7 feet, MAN). D'Angelo Tatum misses. Offensive rebound by D'Angelo Tatum! D'Angelo Tatum kicks it out.

[11:16] Team_076 possession (Score: 2-0)
Paul Leonard attempts a 3Pt. Contested by Bradley Sexton (3.3 feet, ZONE). Paul Leonard misses. Rebound secured by Stephen Haliburton.

[10:59] Team_058 possession (Score: 2-0)
Bradley Sexton drives and kicks out. Kyle Westbrook attempts a Midrange. Contested by Tobias Mitchell (4.1 feet, MAN). Kyle Westbrook misses. Rebound secured by D'Angelo Tatum.

[10:45] Team_076 possession (Score: 2-0)
D'Angelo Tatum drives to the basket... D'Angelo Tatum loses control! Ball rolls out of bounds! TURNOVER! (dead ball)

[10:30] Team_058 possession (Score: 2-0)
FOUL! Shooting foul on Cade Barnes. Bradley Sexton to the line for 2 free throws. [Team fouls: 1] (Cade Barnes: 1 personal fouls)   FT 1/2: GOOD   FT 2/2: GOOD Bradley Sexton makes 2/2 from the line.
Score: 4-0

[10:17] Team_076 possession (Score: 4-0)
Tobias Mitchell attempts a 3Pt. Contested by Kyle Westbrook (4.4 feet, MAN). TOBIAS MITCHELL MAKES IT! Assist: D'Angelo Tatum
Score: 4-3

[10:03] Team_058 possession (Score: 4-3)
Vince Hyland makes the Layup and draws the foul on Paul Leonard! And-1! Vince Hyland to the line for 1. [Team fouls: 2] (Paul Leonard: 1 personal fouls)   FT 1/1: GOOD Vince Hyland makes 1/1 from the line.
Score: 7-3

[09:44] Team_076 possession (Score: 7-3)
Dejounte LaVine drives to the basket... Dejounte LaVine throws a bad pass! Stolen by Bradley Sexton! TURNOVER! (live ball)

[09:33] Team_058 possession (Score: 7-3)
Vince Hyland attempts a Midrange. Contested by Tobias Mitchell (4.4 feet, ZONE). Vince Hyland misses. Rebound secured by Tobias Mitchell.

[09:16] Team_076 possession (Score: 7-3)
Tobias Mitchell attempts a Layup. Contested by Stephen Haliburton (3.8 feet, ZONE). Tobias Mitchell misses. Rebound secured by Tyrese Doncic.

[09:04] Team_058 possession (Score: 7-3)
Stephen Haliburton drives and kicks out. Tyrese Doncic attempts a Midrange. Contested by Cade Barnes (3.5 feet, ZONE). Tyrese Doncic misses. Rebound secured by Cade Barnes.

[08:47] Team_076 possession (Score: 7-3)
Paul Leonard attempts a Midrange. Contested by Stephen Haliburton (3.8 feet, ZONE). PAUL LEONARD MAKES IT!
Score: 7-5

[08:31] Team_058 possession (Score: 7-5)
Vince Hyland throws a bad pass! Stolen by Paul Leonard! TURNOVER! (live ball)

[08:20] Team_076 possession (Score: 7-5)
D'Angelo Tatum attempts a 3Pt. Contested by Bradley Sexton (3.2 feet, ZONE). D'ANGELO TATUM MAKES IT! Assist: Tobias Mitchell
Score: 7-8

[08:06] Team_058 possession (Score: 7-8)
Tyrese Doncic drives, Cade Barnes stays with him. Tyrese Doncic attempts a Dunk. Contested by Cade Barnes (3.5 feet, ZONE). Tyrese Doncic misses. Rebound secured by Cade Barnes.

[07:53] Team_076 possession (Score: 7-8)
Paul Leonard attempts a 3Pt. Contested by Bradley Sexton (3.3 feet, ZONE). Paul Leonard misses. FOUL! Loose ball foul on Stephen Haliburton during the rebound battle. [Team fouls: 1] No free throws, side out. (Stephen Haliburton: 1 personal fouls)

[07:36] Team_076 possession (Score: 7-8)
Tobias Mitchell attempts a Midrange. Contested by Vince Hyland (4.9 feet, ZONE). TOBIAS MITCHELL MAKES IT! Assist: Dejounte LaVine
Score: 7-10

[07:21] Team_058 possession (Score: 7-10)
Stephen Haliburton attempts a 3Pt. Contested by Dejounte LaVine (5.0 feet, ZONE). Stephen Haliburton misses. Rebound secured by Tobias Mitchell.

[07:03] Team_076 possession (Score: 7-10)
Tobias Mitchell drives, picks up Stephen Haliburton. Help arrives from Bradley Sexton! Tobias Mitchell attempts a Layup. Contested by Bradley Sexton (3.8 feet, ZONE). TOBIAS MITCHELL MAKES IT! Assist: D'Angelo Tatum
Score: 7-12

[06:52] Team_058 possession (Score: 7-12)
Bradley Sexton attempts a Midrange. Contested by Dejounte LaVine (5.1 feet, MAN). Bradley Sexton misses. Rebound secured by D'Angelo Tatum.

[06:35] Team_076 possession (Score: 7-12)
Paul Leonard attempts a Layup. Contested by Stephen Haliburton (3.8 feet, ZONE). PAUL LEONARD MAKES IT!
Score: 7-14

[06:17] Team_058 possession (Score: 7-14)
FOUL! Holding foul on Tobias Mitchell. [Team fouls: 3] No free throws, side out. (Tobias Mitchell: 1 personal fouls)

[06:03] Team_058 possession (Score: 7-14)
Stephen Haliburton drives, picks up Cade Barnes. Help arrives from Tobias Mitchell! Stephen Haliburton attempts a Dunk. Contested by Tobias Mitchell (3.6 feet, ZONE). STEPHEN HALIBURTON MAKES IT! Assist: Kyle Westbrook
Score: 9-14

[05:45] Team_076 possession (Score: 9-14)
FOUL! Offensive foul on D'Angelo Tatum! Tyrese Doncic drew the charge! [Team fouls: 4] (D'Angelo Tatum: 1 personal fouls) TURNOVER! (dead ball)

[05:31] Team_058 possession (Score: 9-14)
Stephen Haliburton attempts a Layup. Contested by Cade Barnes (3.6 feet, ZONE). STEPHEN HALIBURTON MAKES IT! Assist: Vince Hyland
Score: 11-14

[05:18] Team_076 possession (Score: 11-14)
FOUL! Reach-in foul on Stephen Haliburton during the drive. [Team fouls: 2] No free throws, side out. (Stephen Haliburton: 2 personal fouls)

[05:05] Team_076 possession (Score: 11-14)
Dejounte LaVine attempts a Midrange. Contested by Bradley Sexton (2.9 feet, MAN). Dejounte LaVine misses. Rebound secured by Bradley Sexton.

[04:49] Team_058 possession (Score: 11-14)
Stephen Haliburton attempts a 3Pt. Contested by Cade Barnes (3.7 feet, MAN). Stephen Haliburton misses. Offensive rebound by Tyrese Doncic! Tyrese Doncic kicks it out.

[04:37] Team_058 possession (Score: 11-14)
Stephen Haliburton attempts a Midrange. Contested by Tobias Mitchell (4.3 feet, ZONE). STEPHEN HALIBURTON MAKES IT! Assist: Bradley Sexton
Score: 13-14

[04:23] Team_076 possession (Score: 13-14)
Cade Barnes attempts a Midrange. Contested by Stephen Haliburton (3.7 feet, MAN). CADE BARNES MAKES IT!
Score: 13-16

[04:06] Team_058 possession (Score: 13-16)
Stephen Haliburton drives, Cade Barnes stays with him. Stephen Haliburton attempts a Dunk. Contested by Cade Barnes (3.7 feet, ZONE). STEPHEN HALIBURTON MAKES IT! Assist: Tyrese Doncic
Score: 15-16

[03:48] Team_076 possession (Score: 15-16)
Cade Barnes attempts a 3Pt. Contested by Stephen Haliburton (3.8 feet, MAN). CADE BARNES MAKES IT! Assist: Dejounte LaVine
Score: 15-19

[03:34] Team_058 possession (Score: 15-19)
Stephen Haliburton attempts a Midrange. Contested by Cade Barnes (3.8 feet, MAN). Stephen Haliburton misses. FOUL! Loose ball foul on Tobias Mitchell during the rebound battle. [IN THE BONUS! 5 team fouls] Tyrese Doncic to the line for 2 free throws. (Tobias Mitchell: 2 personal fouls)   FT 1/2: MISS   FT 2/2: MISS Tyrese Doncic makes 0/2 from the line. Offensive rebound by Tyrese Doncic! Tyrese Doncic kicks it out.

[03:22] Team_058 possession (Score: 15-19)
Tyrese Doncic attempts a Midrange. Contested by D'Angelo Tatum (3.8 feet, MAN). TYRESE DONCIC MAKES IT!
Score: 17-19

[03:12] Team_076 possession (Score: 17-19)
Paul Leonard attempts a 3Pt. Contested by Vince Hyland (5.0 feet, MAN). Paul Leonard misses. Rebound secured by Bradley Sexton.

[02:57] Team_058 possession (Score: 17-19)
Tyrese Doncic attempts a Midrange. Contested by D'Angelo Tatum (3.9 feet, MAN). Tyrese Doncic misses. Offensive rebound by Tyrese Doncic! Tyrese Doncic kicks it out.

[02:46] Team_058 possession (Score: 17-19)
Vince Hyland attempts a 3Pt. Contested by Cade Barnes (4.0 feet, ZONE). Vince Hyland misses. Rebound secured by D'Angelo Tatum.

[02:32] Team_076 possession (Score: 17-19)
Cade Barnes attempts a Midrange. Contested by Stephen Haliburton (3.9 feet, MAN). Cade Barnes misses. Rebound secured by Stephen Haliburton.

[02:16] Team_058 possession (Score: 17-19)
Bradley Sexton attempts a 3Pt. Contested by Cade Barnes (4.1 feet, ZONE). Bradley Sexton misses. Rebound secured by D'Angelo Tatum.

[02:00] Team_076 possession (Score: 17-19)
FOUL! Offensive foul on Cade Barnes! Stephen Haliburton drew the charge! [Team fouls: 6] (Cade Barnes: 2 personal fouls) TURNOVER! (dead ball)

[01:41] Team_058 possession (Score: 17-19)
Stephen Haliburton makes the Midrange and draws the foul on Cade Barnes! And-1! Stephen Haliburton to the line for 1. [BONUS: 7 team fouls] (Cade Barnes: 3 personal fouls)   FT 1/1: GOOD Stephen Haliburton makes 1/1 from the line.
Score: 20-19

[01:29] Team_076 possession (Score: 20-19)
D'Angelo Tatum drives, picks up Stephen Haliburton. Help arrives from Bradley Sexton! D'Angelo Tatum attempts a Dunk. Contested by Bradley Sexton (4.1 feet, ZONE). D'Angelo Tatum misses. Rebound secured by Stephen Haliburton.

[01:13] Team_058 possession (Score: 20-19)
Vince Hyland attempts a 3Pt. Contested by Paul Leonard (5.7 feet, MAN). Vince Hyland misses. Offensive rebound by Stephen Haliburton! Stephen Haliburton puts it back in!
Score: 22-19

[00:56] Team_076 possession (Score: 22-19)
FOUL! Reach-in foul on Stephen Haliburton during the drive. [Team fouls: 3] No free throws, side out. (Stephen Haliburton: 3 personal fouls)

[00:43] Team_076 possession (Score: 22-19)
Cade Barnes drives, Stephen Haliburton stays with him. Cade Barnes attempts a Dunk. Contested by Stephen Haliburton (4.1 feet, MAN). CADE BARNES MAKES IT! Assist: D'Angelo Tatum
Score: 22-21

[00:26] Team_058 possession (Score: 22-21)
Vince Hyland attempts a 3Pt. Contested by Paul Leonard (5.7 feet, MAN). VINCE HYLAND MAKES IT! Assist: Kyle Westbrook
Score: 25-21

[00:11] Team_076 possession (Score: 25-21)
D'Angelo Tatum drives and kicks out. Paul Leonard attempts a 3Pt. Contested by Bradley Sexton (3.6 feet, ZONE). Paul Leonard misses. Rebound secured by Bradley Sexton.

================================================================================
                              1ST QUARTER COMPLETE                              
================================================================================

1ST QUARTER SCORE: Team_058 25, Team_076 21

BOX SCORE:
================================================================================

Team_058
--------------------------------------------------------------------------------
Player                MIN  PTS  REB  AST  TO      FG   FG%      3P   3P%
--------------------------------------------------------------------------------
Stephen Haliburton     12   13    4    0   0   6/8    75.0     0/0   0.0
Vince Hyland           12    6    0    1   0   2/4    50.0     0/0   0.0
Tyrese Doncic          12    4    4    1   0   2/3    66.7     0/0   0.0
Bradley Sexton         12    2    3    1   0   1/4    25.0     0/0   0.0
Kyle Westbrook         12    0    0    2   0   0/0     0.0     0/0   0.0

TEAM: FG: 11/19 (57.9%), 3PT: 2/5 (40.0%), REB: 11 (4 off, 7 def), AST: 5, TO: 1
TEAM FOULS: 3


Team_076
--------------------------------------------------------------------------------
Player                MIN  PTS  REB  AST  TO      FG   FG%      3P   3P%
--------------------------------------------------------------------------------
Tobias Mitchell        12    7    2    1   0   3/4    75.0     0/0   0.0
Cade Barnes            12    7    3    0   0   3/4    75.0     0/0   0.0
Paul Leonard           12    4    0    0   0   2/4    50.0     0/0   0.0
D'Angelo Tatum         12    3    6    3   0   1/3    33.3     0/0   0.0
Dejounte LaVine        12    0    0    2   0   0/1     0.0     0/0   0.0

TEAM: FG: 9/16 (56.2%), 3PT: 3/5 (60.0%), REB: 11 (3 off, 8 def), AST: 6, TO: 4
TEAM FOULS: 7 [Team_058 in BONUS]

================================================================================

================================================================================
                       2ND QUARTER - Team_058 vs Team_076                       
================================================================================

[12:00] Team_058 possession (Score: 25-21)
Vince Hyland drives to the basket... FOUL! Offensive foul on Vince Hyland! Cade Barnes drew the charge! [Team fouls: 1] (Vince Hyland: 1 personal fouls) TURNOVER! (dead ball)

[11:47] Team_076 possession (Score: 25-21)
Paul Leonard attempts a Layup. BLOCKED BY VINCE HYLAND! Ball is loose! Offensive rebound by D'Angelo Tatum! D'Angelo Tatum kicks it out.

[11:38] Team_076 possession (Score: 25-21)
Cade Barnes attempts a 3Pt. Contested by Stephen Haliburton (4.0 feet, MAN). Cade Barnes misses. Rebound secured by Bradley Sexton.

[11:26] Team_058 possession (Score: 25-21)
Kyle Westbrook drives, Cade Barnes stays with him. Kyle Westbrook attempts a Layup. Contested by Cade Barnes (4.0 feet, ZONE). Kyle Westbrook misses. Offensive rebound by Tyrese Doncic! Tyrese Doncic kicks it out.

[11:09] Team_058 possession (Score: 25-21)
Tyrese Doncic makes the Midrange and draws the foul on Paul Leonard! And-1! Tyrese Doncic to the line for 1. [Team fouls: 1] (Paul Leonard: 1 personal fouls)   FT 1/1: GOOD Tyrese Doncic makes 1/1 from the line.
Score: 28-21

[10:56] Team_076 possession (Score: 28-21)
Tobias Mitchell attempts a 3Pt. Contested by Bradley Sexton (3.8 feet, ZONE). Tobias Mitchell misses. Rebound secured by Bradley Sexton.

[10:42] Team_058 possession (Score: 28-21)
Vince Hyland drives and kicks out. Stephen Haliburton attempts a 3Pt. Contested by Cade Barnes (4.0 feet, ZONE). STEPHEN HALIBURTON MAKES IT! Assist: Vince Hyland
Score: 31-21

[10:25] Team_076 possession (Score: 31-21)
Dejounte LaVine attempts a Midrange. Contested by Bradley Sexton (3.4 feet, ZONE). Dejounte LaVine misses. Rebound secured by Stephen Haliburton.

[10:10] Team_058 possession (Score: 31-21)
Stephen Haliburton commits a violation (traveling/carry)! TURNOVER! (dead ball)

[10:10] Substitution (Team_058): Bradley Sexton OUT → Draymond Williamson IN (stamina_rule2)

[10:10] Substitution (Team_058): Kyle Westbrook OUT → Jordan Ingram IN (stamina_rule2)

[10:10] Substitution (Team_058): Vince Hyland OUT → Pascal Holiday IN (stamina_rule2)

[10:10] Substitution (Team_058): Stephen Haliburton OUT → Shai Lowry IN (stamina_rule2)

[10:10] Substitution (Team_058): Tyrese Doncic OUT → Jarrett Gilgeous-Alexander IN (stamina_rule2)

[10:10] Substitution (Team_076): Dejounte LaVine OUT → Pascal Lowry IN (stamina_rule2)

[10:10] Substitution (Team_076): Tobias Mitchell OUT → Jalen Poole IN (stamina_rule2)

[10:10] Substitution (Team_076): Paul Leonard OUT → Vince Lowry IN (stamina_rule2)

[10:10] Substitution (Team_076): Cade Barnes OUT → Kevin Nowitzki IN (stamina_rule2)

[10:10] Substitution (Team_076): D'Angelo Tatum OUT → Jordan Doncic IN (stamina_rule2)

[09:56] Team_076 possession (Score: 31-21)
Jordan Doncic attempts a Midrange. Contested by Draymond Williamson (4.7 feet, ZONE). Jordan Doncic misses. Rebound secured by Shai Lowry.

[09:42] Team_058 possession (Score: 31-21)
Jordan Ingram attempts a 3Pt. Contested by Jalen Poole (5.5 feet, MAN). Jordan Ingram misses. Rebound secured by Kevin Nowitzki.

[09:28] Team_076 possession (Score: 31-21)
Vince Lowry attempts a 3Pt. Contested by Pascal Holiday (4.5 feet, MAN). Vince Lowry misses. Rebound secured by Pascal Holiday.

[09:13] Team_058 possession (Score: 31-21)
Shai Lowry attempts a Midrange. Contested by Jordan Doncic (3.2 feet, ZONE). Shai Lowry misses. Offensive rebound by Shai Lowry! Shai Lowry kicks it out.

[09:03] Team_058 possession (Score: 31-21)
Shai Lowry drives and kicks out. FOUL! Shooting foul on Jalen Poole. Jordan Ingram to the line for 2 free throws. [Team fouls: 2] (Jalen Poole: 1 personal fouls)   FT 1/2: GOOD   FT 2/2: GOOD Jordan Ingram makes 2/2 from the line.
Score: 33-21

[08:44] Team_076 possession (Score: 33-21)
Jordan Doncic attempts a Layup. Contested by Jarrett Gilgeous-Alexander (4.7 feet, ZONE). Jordan Doncic misses. Rebound secured by Pascal Holiday.

[08:28] Team_058 possession (Score: 33-21)
Shai Lowry drives, Kevin Nowitzki stays with him. Shai Lowry attempts a Layup. Contested by Kevin Nowitzki (4.1 feet, MAN). SHAI LOWRY MAKES IT!
Score: 35-21

[08:13] Team_076 possession (Score: 35-21)
Jordan Doncic attempts a Midrange. Contested by Draymond Williamson (4.7 feet, ZONE). JORDAN DONCIC MAKES IT!
Score: 35-23

[07:57] Team_058 possession (Score: 35-23)
Pascal Holiday attempts a 3Pt. Contested by Vince Lowry (4.2 feet, ZONE). Pascal Holiday misses. Rebound secured by Vince Lowry.

[07:42] Team_076 possession (Score: 35-23)
Pascal Lowry attempts a 3Pt. Contested by Draymond Williamson (4.9 feet, MAN). Pascal Lowry misses. Rebound secured by Shai Lowry.

[07:31] Team_058 possession (Score: 35-23)
Pascal Holiday attempts a 3Pt. Contested by Vince Lowry (4.2 feet, ZONE). PASCAL HOLIDAY MAKES IT! Assist: Shai Lowry
Score: 38-23

[07:16] Team_076 possession (Score: 38-23)
Jordan Doncic attempts a Midrange. Contested by Pascal Holiday (4.0 feet, ZONE). JORDAN DONCIC MAKES IT!
Score: 38-25

[06:59] Team_058 possession (Score: 38-25)
Jordan Ingram attempts a Midrange. Contested by Jalen Poole (5.5 feet, MAN). JORDAN INGRAM MAKES IT! Assist: Shai Lowry
Score: 40-25

[06:40] Team_076 possession (Score: 40-25)
Jalen Poole drives and kicks out. Kevin Nowitzki attempts a Midrange. Contested by Shai Lowry (4.0 feet, MAN). Kevin Nowitzki misses. Rebound secured by Shai Lowry.

[06:27] Team_058 possession (Score: 40-25)
Pascal Holiday attempts a Midrange. Contested by Vince Lowry (4.2 feet, MAN). Pascal Holiday misses. Rebound secured by Jordan Doncic.

[06:16] Team_076 possession (Score: 40-25)
Jalen Poole drives and kicks out. Kevin Nowitzki attempts a 3Pt. Contested by Pascal Holiday (4.6 feet, ZONE). Kevin Nowitzki misses. Offensive rebound by Jordan Doncic! Jordan Doncic kicks it out.

[06:01] Team_076 possession (Score: 40-25)
Jordan Doncic drives, Shai Lowry stays with him. Jordan Doncic attempts a Dunk. Contested by Shai Lowry (3.4 feet, ZONE). JORDAN DONCIC MAKES IT! Assist: Jalen Poole
Score: 40-27

[05:41] Team_058 possession (Score: 40-27)
Jarrett Gilgeous-Alexander attempts a Layup. BLOCKED BY JORDAN DONCIC! Ball deflects out of bounds off Jarrett Gilgeous-Alexander.

[05:31] Team_076 possession (Score: 40-27)
Jalen Poole attempts a 3Pt. Contested by Draymond Williamson (5.6 feet, ZONE). Jalen Poole misses. Rebound secured by Shai Lowry.

[05:17] Team_058 possession (Score: 40-27)
Jarrett Gilgeous-Alexander drives, picks up Jordan Doncic. Help arrives from Jalen Poole! Jarrett Gilgeous-Alexander attempts a Dunk. Contested by Jalen Poole (3.2 feet, MAN). Jarrett Gilgeous-Alexander misses. Rebound secured by Vince Lowry.

[05:04] Team_076 possession (Score: 40-27)
Vince Lowry drives to the basket... Vince Lowry loses control! Ball rolls out of bounds! TURNOVER! (dead ball)

[04:49] Team_058 possession (Score: 40-27)
Pascal Holiday drives to the basket... Pascal Holiday throws a bad pass out of bounds! TURNOVER! (dead ball)

[04:34] Team_076 possession (Score: 40-27)
Kevin Nowitzki attempts a Midrange. Contested by Shai Lowry (4.2 feet, ZONE). Kevin Nowitzki misses. Rebound secured by Pascal Holiday.

[04:17] Team_058 possession (Score: 40-27)
Shai Lowry attempts a 3Pt. Contested by Vince Lowry (4.1 feet, ZONE). Shai Lowry misses. Rebound secured by Jordan Doncic.

[04:00] Team_076 possession (Score: 40-27)
Pascal Lowry makes the Dunk and draws the foul on Pascal Holiday! And-1! Pascal Lowry to the line for 1. [Team fouls: 2] (Pascal Holiday: 1 personal fouls)   FT 1/1: GOOD Pascal Lowry makes 1/1 from the line.
Score: 40-30

[03:48] Team_058 possession (Score: 40-30)
Shai Lowry attempts a Midrange. Contested by Kevin Nowitzki (4.1 feet, MAN). SHAI LOWRY MAKES IT! Assist: Draymond Williamson
Score: 42-30

[03:32] Team_076 possession (Score: 42-30)
Vince Lowry attempts a 3Pt. Contested by Pascal Holiday (4.5 feet, MAN). Vince Lowry misses. Rebound secured by Pascal Holiday.

[03:20] Team_058 possession (Score: 42-30)
Draymond Williamson attempts a 3Pt. Contested by Vince Lowry (4.6 feet, ZONE). Draymond Williamson misses. Rebound secured by Kevin Nowitzki.

[03:09] Team_076 possession (Score: 42-30)
Kevin Nowitzki attempts a Midrange. Contested by Shai Lowry (4.3 feet, MAN). KEVIN NOWITZKI MAKES IT! Assist: Pascal Lowry
Score: 42-32

[02:52] Team_058 possession (Score: 42-32)
Draymond Williamson attempts a 3Pt. Wide open! Pascal Lowry is 6.7 feet away. [MAN] Draymond Williamson misses. Rebound secured by Kevin Nowitzki.

[02:37] Team_076 possession (Score: 42-32)
Pascal Lowry attempts a 3Pt. Contested by Draymond Williamson (4.9 feet, ZONE). Pascal Lowry misses. Rebound secured by Pascal Holiday.

[02:22] Team_058 possession (Score: 42-32)
FOUL! Shooting foul on Kevin Nowitzki. Shai Lowry to the line for 3 free throws. [Team fouls: 3] (Kevin Nowitzki: 1 personal fouls)   FT 1/3: MISS   FT 2/3: MISS   FT 3/3: MISS Shai Lowry makes 0/3 from the line. Rebound secured by Vince Lowry.

[02:07] Team_076 possession (Score: 42-32)
Pascal Lowry attempts a Layup. Contested by Shai Lowry (3.8 feet, ZONE). Pascal Lowry misses. Rebound secured by Shai Lowry.

[01:51] Team_058 possession (Score: 42-32)
FOUL! Shooting foul on Vince Lowry. Draymond Williamson to the line for 3 free throws. [Team fouls: 4] (Vince Lowry: 1 personal fouls)   FT 1/3: GOOD   FT 2/3: GOOD   FT 3/3: GOOD Draymond Williamson makes 3/3 from the line.
Score: 45-32

[01:36] Team_076 possession (Score: 45-32)
Kevin Nowitzki throws a bad pass out of bounds! TURNOVER! (dead ball)

[01:20] Team_058 possession (Score: 45-32)
Shai Lowry attempts a Midrange. Contested by Jalen Poole (5.4 feet, ZONE). Shai Lowry misses. Rebound secured by Kevin Nowitzki.

[01:06] Team_076 possession (Score: 45-32)
Kevin Nowitzki attempts a Layup. Contested by Shai Lowry (4.5 feet, ZONE). KEVIN NOWITZKI MAKES IT! Assist: Jalen Poole
Score: 45-34

[00:49] Team_058 possession (Score: 45-34)
Draymond Williamson drives and kicks out. Jordan Ingram attempts a 3Pt. Contested by Vince Lowry (4.4 feet, ZONE). Jordan Ingram misses. Rebound secured by Vince Lowry.

[00:36] Team_076 possession (Score: 45-34)
Kevin Nowitzki attempts a Layup. Contested by Shai Lowry (4.5 feet, MAN). Kevin Nowitzki misses. Offensive rebound by Kevin Nowitzki! Kevin Nowitzki kicks it out.

[00:17] Team_076 possession (Score: 45-34)
Vince Lowry makes the Layup and draws the foul on Pascal Holiday! And-1! Vince Lowry to the line for 1. [Team fouls: 3] (Pascal Holiday: 2 personal fouls)   FT 1/1: GOOD Vince Lowry makes 1/1 from the line.
Score: 45-37

[00:01] Team_058 possession (Score: 45-37)
Jarrett Gilgeous-Alexander attempts a 3Pt. Contested by Vince Lowry (4.4 feet, ZONE). Jarrett Gilgeous-Alexander misses. Rebound secured by Jordan Doncic.

================================================================================
                              2ND QUARTER COMPLETE                              
================================================================================

2ND QUARTER SCORE: Team_058 20, Team_076 16

BOX SCORE:
================================================================================

Team_058
--------------------------------------------------------------------------------
Player                MIN  PTS  REB  AST  TO      FG   FG%      3P   3P%
--------------------------------------------------------------------------------
Shai Lowry             10    4    6    2   0   2/5    40.0     0/0   0.0
Jordan Ingram          10    4    0    0   0   2/3    66.7     0/0   0.0
Tyrese Doncic          14    3    1    0   0   1/1   100.0     0/0   0.0
Stephen Haliburton     14    3    1    0   0   1/1   100.0     0/0   0.0
Pascal Holiday         10    3    5    0   0   1/3    33.3     0/0   0.0
Draymond Williamson    10    3    0    1   0   1/4    25.0     0/0   0.0
Bradley Sexton         14    0    2    0   0   0/0     0.0     0/0   0.0
Vince Hyland           14    0    0    1   0   0/0     0.0     0/0   0.0
Jarrett Gilgeous-Alexander   10    0    0    0   0   0/3     0.0     0/0   0.0

TEAM: FG: 8/20 (40.0%), 3PT: 2/9 (22.2%), REB: 15 (2 off, 13 def), AST: 4, TO: 3
TEAM FOULS: 3


Team_076
--------------------------------------------------------------------------------
Player                MIN  PTS  REB  AST  TO      FG   FG%      3P   3P%
--------------------------------------------------------------------------------
Jordan Doncic          10    6    4    0   0   3/5    60.0     0/0   0.0
Kevin Nowitzki         10    4    5    0   0   2/3    66.7     0/0   0.0
Vince Lowry            10    3    4    0   0   1/3    33.3     0/0   0.0
Pascal Lowry           10    3    0    1   0   1/4    25.0     0/0   0.0
D'Angelo Tatum         14    0    1    0   0   0/0     0.0     0/0   0.0
Cade Barnes            14    0    0    0   0   0/1     0.0     0/0   0.0
Tobias Mitchell        14    0    0    0   0   0/1     0.0     0/0   0.0
Dejounte LaVine        14    0    0    0   0   0/1     0.0     0/0   0.0
Jalen Poole            10    0    0    2   0   0/2     0.0     0/0   0.0

TEAM: FG: 7/20 (35.0%), 3PT: 0/7 (0.0%), REB: 14 (3 off, 11 def), AST: 3, TO: 2
TEAM FOULS: 4

================================================================================

================================================================================
                       3RD QUARTER - Team_058 vs Team_076                       
================================================================================

[12:00] Team_058 possession (Score: 45-37)
Tyrese Doncic drives, Cade Barnes stays with him. Tyrese Doncic attempts a Layup. Contested by Cade Barnes (3.5 feet, ZONE). TYRESE DONCIC MAKES IT! Assist: Bradley Sexton
Score: 47-37

[11:46] Team_076 possession (Score: 47-37)
D'Angelo Tatum attempts a 3Pt. Contested by Bradley Sexton (3.2 feet, ZONE). D'Angelo Tatum misses. Offensive rebound by Cade Barnes! Cade Barnes kicks it out.

[11:28] Team_076 possession (Score: 47-37)
D'Angelo Tatum throws a bad pass! Stolen by Tyrese Doncic! TURNOVER! (live ball)

[11:13] Team_058 possession (Score: 47-37)
Kyle Westbrook attempts a 3Pt. BLOCKED BY CADE BARNES! Ball is loose! Offensive rebound by Tyrese Doncic! Tyrese Doncic kicks it out.

[10:56] Team_058 possession (Score: 47-37)
Vince Hyland throws a bad pass! Stolen by Paul Leonard! TURNOVER! (live ball)

[10:47] Team_076 possession (Score: 47-37)
Paul Leonard attempts a 3Pt. Contested by Vince Hyland (4.8 feet, MAN). Paul Leonard misses. Rebound secured by Stephen Haliburton.

[10:29] Team_058 possession (Score: 47-37)
Kyle Westbrook attempts a Midrange. Contested by Cade Barnes (3.7 feet, ZONE). KYLE WESTBROOK MAKES IT! Assist: Stephen Haliburton
Score: 49-37

[10:13] Team_076 possession (Score: 49-37)
Cade Barnes attempts a 3Pt. Contested by Bradley Sexton (3.2 feet, ZONE). Cade Barnes misses. Offensive rebound by Cade Barnes! Cade Barnes kicks it out.

[09:59] Team_076 possession (Score: 49-37)
FOUL! Offensive foul on Paul Leonard! Vince Hyland drew the charge! [Team fouls: 1] (Paul Leonard: 1 personal fouls) TURNOVER! (dead ball)

[09:41] Team_058 possession (Score: 49-37)
Tyrese Doncic attempts a Midrange. Contested by D'Angelo Tatum (3.7 feet, MAN). Tyrese Doncic misses. Rebound secured by D'Angelo Tatum.

[09:31] Team_076 possession (Score: 49-37)
Dejounte LaVine makes the Layup and draws the foul on Bradley Sexton! And-1! Dejounte LaVine to the line for 1. [Team fouls: 1] (Bradley Sexton: 1 personal fouls)   FT 1/1: MISS Dejounte LaVine makes 0/1 from the line. Rebound secured by Bradley Sexton.
Score: 49-39

[09:17] Team_058 possession (Score: 49-39)
Vince Hyland attempts a 3Pt. Contested by Paul Leonard (5.4 feet, MAN). Vince Hyland misses. Rebound secured by Cade Barnes.

[09:06] Team_076 possession (Score: 49-39)
D'Angelo Tatum attempts a Midrange. Contested by Tyrese Doncic (4.7 feet, MAN). D'Angelo Tatum misses. FOUL! Loose ball foul on Bradley Sexton during the rebound battle. [Team fouls: 2] No free throws, side out. (Bradley Sexton: 2 personal fouls)

[08:50] Team_076 possession (Score: 49-39)
Paul Leonard attempts a 3Pt. Contested by Vince Hyland (4.8 feet, MAN). Paul Leonard misses. Rebound secured by Bradley Sexton.

[08:33] Team_058 possession (Score: 49-39)
Vince Hyland drives, Paul Leonard stays with him. Vince Hyland attempts a Layup. Contested by Paul Leonard (5.4 feet, MAN). VINCE HYLAND MAKES IT!
Score: 51-39

[08:18] Team_076 possession (Score: 51-39)
Dejounte LaVine attempts a 3Pt. Contested by Bradley Sexton (2.9 feet, ZONE). DEJOUNTE LAVINE MAKES IT! Assist: Tobias Mitchell
Score: 51-42

[08:03] Team_058 possession (Score: 51-42)
Tyrese Doncic attempts a 3Pt. Contested by Tobias Mitchell (4.1 feet, ZONE). TYRESE DONCIC MAKES IT! Assist: Bradley Sexton
Score: 54-42

[07:48] Team_076 possession (Score: 54-42)
FOUL! Shooting foul on Stephen Haliburton. Tobias Mitchell to the line for 2 free throws. [Team fouls: 3] (Stephen Haliburton: 1 personal fouls)   FT 1/2: GOOD   FT 2/2: GOOD Tobias Mitchell makes 2/2 from the line.
Score: 54-44

[07:34] Team_058 possession (Score: 54-44)
FOUL! Holding foul on D'Angelo Tatum. [Team fouls: 2] No free throws, side out. (D'Angelo Tatum: 1 personal fouls)

[07:22] Team_058 possession (Score: 54-44)
Kyle Westbrook attempts a Layup. Contested by Tobias Mitchell (4.2 feet, MAN). KYLE WESTBROOK MAKES IT!
Score: 56-44

[07:08] Team_076 possession (Score: 56-44)
Cade Barnes drives and kicks out. Dejounte LaVine attempts a Midrange. Contested by Bradley Sexton (3.0 feet, MAN). DEJOUNTE LAVINE MAKES IT!
Score: 56-46

[06:54] Team_058 possession (Score: 56-46)
Bradley Sexton attempts a 3Pt. Contested by Cade Barnes (3.8 feet, ZONE). Bradley Sexton misses. Rebound secured by Cade Barnes.

[06:37] Team_076 possession (Score: 56-46)
FOUL! Shooting foul on Tyrese Doncic. D'Angelo Tatum to the line for 2 free throws. [Team fouls: 4] (Tyrese Doncic: 1 personal fouls)   FT 1/2: GOOD   FT 2/2: GOOD D'Angelo Tatum makes 2/2 from the line.
Score: 56-48

[06:26] Team_058 possession (Score: 56-48)
Tyrese Doncic drives and kicks out. Vince Hyland attempts a 3Pt. Contested by Cade Barnes (3.5 feet, ZONE). VINCE HYLAND MAKES IT! Assist: Bradley Sexton
Score: 59-48

[06:13] Team_076 possession (Score: 59-48)
D'Angelo Tatum drives, picks up Stephen Haliburton. Help arrives from Bradley Sexton! D'Angelo Tatum attempts a Dunk. Contested by Bradley Sexton (3.7 feet, ZONE). D'ANGELO TATUM MAKES IT! Assist: Cade Barnes
Score: 59-50

[06:02] Team_058 possession (Score: 59-50)
Tyrese Doncic makes the Layup and draws the foul on D'Angelo Tatum! And-1! Tyrese Doncic to the line for 1. [Team fouls: 3] (D'Angelo Tatum: 2 personal fouls)   FT 1/1: GOOD Tyrese Doncic makes 1/1 from the line.
Score: 62-50

[05:50] Team_076 possession (Score: 62-50)
D'Angelo Tatum attempts a Layup. BLOCKED BY TYRESE DONCIC! Ball is loose! Offensive rebound by Cade Barnes! Cade Barnes kicks it out.

[05:33] Team_076 possession (Score: 62-50)
Paul Leonard drives to the basket... Paul Leonard throws a bad pass! Stolen by Stephen Haliburton! TURNOVER! (live ball)

[05:20] Team_058 possession (Score: 62-50)
Vince Hyland attempts a 3Pt. Contested by Cade Barnes (3.8 feet, ZONE). VINCE HYLAND MAKES IT! Assist: Kyle Westbrook
Score: 65-50

[05:02] Team_076 possession (Score: 65-50)
Cade Barnes drives and kicks out. FOUL! Shooting foul on Tyrese Doncic. D'Angelo Tatum to the line for 3 free throws. [BONUS: 5 team fouls] (Tyrese Doncic: 2 personal fouls)   FT 1/3: MISS   FT 2/3: GOOD   FT 3/3: GOOD D'Angelo Tatum makes 2/3 from the line.
Score: 65-52

[04:47] Team_058 possession (Score: 65-52)
Vince Hyland attempts a 3Pt. Contested by Paul Leonard (5.4 feet, MAN). VINCE HYLAND MAKES IT! Assist: Bradley Sexton
Score: 68-52

[04:37] Team_076 possession (Score: 68-52)
Dejounte LaVine attempts a Layup. BLOCKED BY BRADLEY SEXTON! Ball is loose! Rebound secured by Stephen Haliburton.

[04:24] Team_058 possession (Score: 68-52)
Vince Hyland attempts a 3Pt. Contested by Paul Leonard (5.5 feet, MAN). VINCE HYLAND MAKES IT! Assist: Kyle Westbrook
Score: 71-52

[04:10] Team_076 possession (Score: 71-52)
Paul Leonard attempts a 3Pt. Contested by Vince Hyland (4.9 feet, MAN). Paul Leonard misses. Rebound secured by Bradley Sexton.

[03:56] Team_058 possession (Score: 71-52)
Bradley Sexton attempts a 3Pt. Contested by Dejounte LaVine (5.2 feet, MAN). Bradley Sexton misses. Rebound secured by Cade Barnes.

[03:43] Team_076 possession (Score: 71-52)
D'Angelo Tatum drives, Tyrese Doncic stays with him. D'Angelo Tatum attempts a Layup. Contested by Tyrese Doncic (4.8 feet, MAN). D'Angelo Tatum misses. Rebound secured by Stephen Haliburton.

[03:24] Team_058 possession (Score: 71-52)
Bradley Sexton makes the Layup and draws the foul on Tobias Mitchell! And-1! Bradley Sexton to the line for 1. [Team fouls: 4] (Tobias Mitchell: 1 personal fouls)   FT 1/1: GOOD Bradley Sexton makes 1/1 from the line.
Score: 74-52

[03:09] Team_076 possession (Score: 74-52)
Paul Leonard drives and kicks out. D'Angelo Tatum attempts a Midrange. Contested by Tyrese Doncic (4.6 feet, MAN). D'ANGELO TATUM MAKES IT!
Score: 74-54

[02:56] Team_058 possession (Score: 74-54)
Vince Hyland attempts a 3Pt. Contested by Paul Leonard (5.6 feet, MAN). VINCE HYLAND MAKES IT! Assist: Bradley Sexton
Score: 77-54

[02:46] Team_076 possession (Score: 77-54)
Dejounte LaVine attempts a 3Pt. Contested by Bradley Sexton (3.2 feet, ZONE). Dejounte LaVine misses. Rebound secured by Tyrese Doncic.

[02:31] Team_058 possession (Score: 77-54)
Stephen Haliburton attempts a Midrange. Contested by Cade Barnes (3.9 feet, MAN). STEPHEN HALIBURTON MAKES IT! Assist: Bradley Sexton
Score: 79-54

[02:19] Team_076 possession (Score: 79-54)
Paul Leonard attempts a Layup. Contested by Stephen Haliburton (4.1 feet, ZONE). PAUL LEONARD MAKES IT!
Score: 79-56

[02:03] Team_058 possession (Score: 79-56)
Bradley Sexton attempts a 3Pt. Contested by Dejounte LaVine (5.4 feet, MAN). Bradley Sexton misses. Rebound secured by D'Angelo Tatum.

[01:52] Team_076 possession (Score: 79-56)
Paul Leonard attempts a 3Pt. Contested by Bradley Sexton (3.7 feet, ZONE). PAUL LEONARD MAKES IT! Assist: D'Angelo Tatum
Score: 79-59

[01:37] Team_058 possession (Score: 79-59)
Vince Hyland drives and kicks out. Vince Hyland attempts a 3Pt. Contested by Paul Leonard (5.4 feet, MAN). Vince Hyland misses. Rebound secured by D'Angelo Tatum.

[01:22] Team_076 possession (Score: 79-59)
D'Angelo Tatum attempts a Layup. Contested by Stephen Haliburton (4.1 feet, ZONE). D'ANGELO TATUM MAKES IT!
Score: 79-61

[01:04] Team_058 possession (Score: 79-61)
Vince Hyland attempts a Midrange. Contested by Paul Leonard (5.7 feet, MAN). Vince Hyland misses. Offensive rebound by Tyrese Doncic! Tyrese Doncic kicks it out.

[00:44] Team_058 possession (Score: 79-61)
FOUL! Offensive foul on Vince Hyland! Paul Leonard drew the charge! [Team fouls: 6] (Vince Hyland: 1 personal fouls) TURNOVER! (dead ball)

[00:30] Team_076 possession (Score: 79-61)
Dejounte LaVine drives, Stephen Haliburton stays with him. Dejounte LaVine attempts a Dunk. Contested by Stephen Haliburton (3.9 feet, ZONE). Dejounte LaVine misses. Rebound secured by Bradley Sexton.

[00:21] Team_058 possession (Score: 79-61)
Tyrese Doncic drives, Cade Barnes stays with him. Tyrese Doncic attempts a Dunk. Contested by Cade Barnes (4.1 feet, ZONE). TYRESE DONCIC MAKES IT!
Score: 81-61

[00:11] Team_076 possession (Score: 81-61)
FOUL! Shooting foul on Stephen Haliburton. Cade Barnes to the line for 2 free throws. [BONUS: 7 team fouls] (Stephen Haliburton: 2 personal fouls)   FT 1/2: GOOD   FT 2/2: GOOD Cade Barnes makes 2/2 from the line.
Score: 81-63

================================================================================
                              3RD QUARTER COMPLETE                              
================================================================================

3RD QUARTER SCORE: Team_058 36, Team_076 26

BOX SCORE:
================================================================================

Team_058
--------------------------------------------------------------------------------
Player                MIN  PTS  REB  AST  TO      FG   FG%      3P   3P%
--------------------------------------------------------------------------------
Vince Hyland           26   17    0    0   0   6/8    75.0     0/0   0.0
Tyrese Doncic          26   10    3    0   0   4/5    80.0     0/0   0.0
Kyle Westbrook         26    4    0    2   0   2/2   100.0     0/0   0.0
Bradley Sexton         26    3    4    6   0   1/4    25.0     0/0   0.0
Stephen Haliburton     26    2    3    1   0   1/1   100.0     0/0   0.0

TEAM: FG: 14/20 (70.0%), 3PT: 5/9 (55.6%), REB: 10 (2 off, 8 def), AST: 9, TO: 2
TEAM FOULS: 7 [Team_076 in BONUS]


Team_076
--------------------------------------------------------------------------------
Player                MIN  PTS  REB  AST  TO      FG   FG%      3P   3P%
--------------------------------------------------------------------------------
D'Angelo Tatum         26   10    4    1   0   5/6    83.3     0/0   0.0
Paul Leonard           26    5    0    0   0   2/5    40.0     0/0   0.0
Dejounte LaVine        26    5    0    0   0   2/6    33.3     0/0   0.0
Cade Barnes            26    2    6    1   0   1/1   100.0     0/0   0.0
Tobias Mitchell        26    2    0    1   0   1/1   100.0     0/0   0.0

TEAM: FG: 11/19 (57.9%), 3PT: 2/6 (33.3%), REB: 10 (4 off, 6 def), AST: 3, TO: 3
TEAM FOULS: 4

================================================================================

================================================================================
                       4TH QUARTER - Team_058 vs Team_076                       
================================================================================

[12:00] Team_058 possession (Score: 81-63)
Tyrese Doncic attempts a Layup. Contested by D'Angelo Tatum (4.0 feet, ZONE). TYRESE DONCIC MAKES IT! Assist: Vince Hyland
Score: 83-63

[11:43] Team_076 possession (Score: 83-63)
Tobias Mitchell makes the Layup and draws the foul on Kyle Westbrook! And-1! Tobias Mitchell to the line for 1. [Team fouls: 1] (Kyle Westbrook: 1 personal fouls)   FT 1/1: GOOD Tobias Mitchell makes 1/1 from the line.
Score: 83-66

[11:29] Team_058 possession (Score: 83-66)
Vince Hyland attempts a Midrange. Contested by Paul Leonard (5.7 feet, MAN). Vince Hyland misses. FOUL! Loose ball foul on D'Angelo Tatum during the rebound battle. [Team fouls: 1] No free throws, side out. (D'Angelo Tatum: 1 personal fouls)

[11:17] Team_058 possession (Score: 83-66)
Vince Hyland attempts a Midrange. Contested by Paul Leonard (5.7 feet, MAN). VINCE HYLAND MAKES IT! Assist: Tyrese Doncic
Score: 85-66

[11:01] Team_076 possession (Score: 85-66)
Tobias Mitchell drives and kicks out. Dejounte LaVine attempts a Midrange. Contested by Stephen Haliburton (4.0 feet, ZONE). Dejounte LaVine misses. Offensive rebound by D'Angelo Tatum! D'Angelo Tatum kicks it out.

[10:47] Team_076 possession (Score: 85-66)
FOUL! Shooting foul on Vince Hyland. Paul Leonard to the line for 2 free throws. [Team fouls: 2] (Vince Hyland: 1 personal fouls)   FT 1/2: MISS   FT 2/2: GOOD Paul Leonard makes 1/2 from the line.
Score: 85-67

[10:35] Team_058 possession (Score: 85-67)
Bradley Sexton loses control! Ball rolls out of bounds! TURNOVER! (dead ball)

[10:35] Substitution (Team_058): Bradley Sexton OUT → Draymond Williamson IN (stamina_rule2)

[10:35] Substitution (Team_058): Kyle Westbrook OUT → Jordan Ingram IN (stamina_rule2)

[10:35] Substitution (Team_058): Vince Hyland OUT → Pascal Holiday IN (stamina_rule2)

[10:35] Substitution (Team_058): Stephen Haliburton OUT → Shai Lowry IN (stamina_rule2)

[10:35] Substitution (Team_058): Tyrese Doncic OUT → Jarrett Gilgeous-Alexander IN (stamina_rule2)

[10:35] Substitution (Team_076): Dejounte LaVine OUT → Pascal Lowry IN (stamina_rule2)

[10:35] Substitution (Team_076): Tobias Mitchell OUT → Jalen Poole IN (stamina_rule2)

[10:35] Substitution (Team_076): Paul Leonard OUT → Vince Lowry IN (stamina_rule2)

[10:35] Substitution (Team_076): Cade Barnes OUT → Kevin Nowitzki IN (stamina_rule2)

[10:35] Substitution (Team_076): D'Angelo Tatum OUT → Jordan Doncic IN (stamina_rule2)

[10:23] Team_076 possession (Score: 85-67)
FOUL! Offensive foul on Vince Lowry! Pascal Holiday drew the charge! [Team fouls: 2] (Vince Lowry: 1 personal fouls) TURNOVER! (dead ball)

[10:12] Team_058 possession (Score: 85-67)
Shai Lowry attempts a Midrange. Contested by Vince Lowry (4.1 feet, ZONE). Shai Lowry misses. Rebound secured by Vince Lowry.

[10:01] Team_076 possession (Score: 85-67)
Kevin Nowitzki drives, Shai Lowry stays with him. Kevin Nowitzki attempts a Dunk. Contested by Shai Lowry (4.2 feet, MAN). Kevin Nowitzki misses. Offensive rebound by Kevin Nowitzki! Kevin Nowitzki kicks it out.

[09:44] Team_076 possession (Score: 85-67)
Vince Lowry drives, Shai Lowry stays with him. Vince Lowry attempts a Layup. Contested by Shai Lowry (3.9 feet, ZONE). Vince Lowry misses. Rebound secured by Jarrett Gilgeous-Alexander.

[09:26] Team_058 possession (Score: 85-67)
Draymond Williamson attempts a 3Pt. Wide open! Pascal Lowry is 6.7 feet away. [MAN] DRAYMOND WILLIAMSON MAKES IT! Assist: Jarrett Gilgeous-Alexander
Score: 88-67

[09:15] Team_076 possession (Score: 88-67)
Pascal Lowry attempts a 3Pt. Contested by Pascal Holiday (4.2 feet, ZONE). Pascal Lowry misses. Rebound secured by Pascal Holiday.

[09:02] Team_058 possession (Score: 88-67)
Shai Lowry drives and kicks out. Draymond Williamson attempts a 3Pt. Contested by Vince Lowry (4.2 feet, ZONE). Draymond Williamson misses. Rebound secured by Kevin Nowitzki.

[08:52] Team_076 possession (Score: 88-67)
Pascal Lowry attempts a Midrange. Contested by Shai Lowry (3.6 feet, ZONE). PASCAL LOWRY MAKES IT!
Score: 88-69

[08:39] Team_058 possession (Score: 88-69)
FOUL! Reach-in foul on Jordan Doncic during the drive. [Team fouls: 3] No free throws, side out. (Jordan Doncic: 1 personal fouls)

[08:25] Team_058 possession (Score: 88-69)
Pascal Holiday attempts a Midrange. Contested by Vince Lowry (4.2 feet, ZONE). Pascal Holiday misses. Rebound secured by Vince Lowry.

[08:11] Team_076 possession (Score: 88-69)
Kevin Nowitzki attempts a 3Pt. Contested by Draymond Williamson (5.5 feet, ZONE). KEVIN NOWITZKI MAKES IT! Assist: Pascal Lowry
Score: 88-72

[07:53] Team_058 possession (Score: 88-72)
Jordan Ingram attempts a 3Pt. BLOCKED BY VINCE LOWRY! Ball is loose! Rebound secured by Jordan Doncic.

[07:36] Team_076 possession (Score: 88-72)
FOUL! Shooting foul on Pascal Holiday. Vince Lowry to the line for 2 free throws. [Team fouls: 3] (Pascal Holiday: 1 personal fouls)   FT 1/2: GOOD   FT 2/2: GOOD Vince Lowry makes 2/2 from the line.
Score: 88-74

[07:21] Team_058 possession (Score: 88-74)
Jordan Ingram attempts a 3Pt. Contested by Vince Lowry (4.2 feet, ZONE). Jordan Ingram misses. FOUL! Loose ball foul on Vince Lowry during the rebound battle. [Team fouls: 4] No free throws, side out. (Vince Lowry: 2 personal fouls)

[07:03] Team_058 possession (Score: 88-74)
Shai Lowry attempts a Layup. Contested by Kevin Nowitzki (4.1 feet, MAN). Shai Lowry misses. Rebound secured by Vince Lowry.

[06:47] Team_076 possession (Score: 88-74)
Pascal Lowry attempts a Layup. Contested by Shai Lowry (3.6 feet, ZONE). PASCAL LOWRY MAKES IT! Assist: Jalen Poole
Score: 88-76

[06:33] Team_058 possession (Score: 88-76)
Shai Lowry attempts a Layup. BLOCKED BY JORDAN DONCIC! Ball goes out off Jordan Doncic. Shai Lowry's ball!

[06:21] Team_058 possession (Score: 88-76)
Pascal Holiday attempts a Midrange. Contested by Jalen Poole (5.5 feet, ZONE). Pascal Holiday misses. Rebound secured by Vince Lowry.

[06:05] Team_076 possession (Score: 88-76)
FOUL! Reach-in foul on Pascal Holiday during the drive. [Team fouls: 4] No free throws, side out. (Pascal Holiday: 2 personal fouls)

[05:49] Team_076 possession (Score: 88-76)
Jalen Poole attempts a 3Pt. Contested by Draymond Williamson (5.6 feet, ZONE). Jalen Poole misses. Rebound secured by Pascal Holiday.

[05:30] Team_058 possession (Score: 88-76)
Draymond Williamson attempts a 3Pt. Contested by Vince Lowry (4.6 feet, ZONE). Draymond Williamson misses. Offensive rebound by Pascal Holiday! Pascal Holiday's putback is no good. Rebound secured by Jordan Doncic.

[05:20] Team_076 possession (Score: 88-76)
Jordan Doncic attempts a 3Pt. Contested by Draymond Williamson (4.7 feet, ZONE). Jordan Doncic misses. Rebound secured by Jarrett Gilgeous-Alexander.

[05:04] Team_058 possession (Score: 88-76)
Pascal Holiday attempts a 3Pt. Contested by Vince Lowry (4.2 feet, ZONE). PASCAL HOLIDAY MAKES IT! Assist: Jordan Ingram
Score: 91-76

[04:49] Team_076 possession (Score: 91-76)
Jalen Poole attempts a 3Pt. Wide open! Jordan Ingram is 6.3 feet away. [MAN] Jalen Poole misses. Rebound secured by Pascal Holiday.

[04:38] Team_058 possession (Score: 91-76)
Jarrett Gilgeous-Alexander drives to the basket... Jarrett Gilgeous-Alexander commits a violation (traveling/carry)! TURNOVER! (dead ball)

[04:23] Team_076 possession (Score: 91-76)
FOUL! Shooting foul on Shai Lowry. Kevin Nowitzki to the line for 2 free throws. [BONUS: 5 team fouls] (Shai Lowry: 1 personal fouls)   FT 1/2: GOOD   FT 2/2: GOOD Kevin Nowitzki makes 2/2 from the line.
Score: 91-78

[04:12] Team_058 possession (Score: 91-78)
FOUL! Shooting foul on Vince Lowry. Pascal Holiday to the line for 2 free throws. [BONUS: 5 team fouls] (Vince Lowry: 3 personal fouls)   FT 1/2: GOOD   FT 2/2: GOOD Pascal Holiday makes 2/2 from the line.
Score: 93-78

[03:58] Team_076 possession (Score: 93-78)
Kevin Nowitzki drives, Shai Lowry stays with him. Kevin Nowitzki attempts a Layup. Contested by Shai Lowry (4.3 feet, ZONE). Kevin Nowitzki misses. Rebound secured by Jarrett Gilgeous-Alexander.

[03:44] Team_058 possession (Score: 93-78)
Pascal Holiday attempts a 3Pt. Contested by Vince Lowry (4.2 feet, MAN). Pascal Holiday misses. Rebound secured by Kevin Nowitzki.

[03:29] Team_076 possession (Score: 93-78)
Vince Lowry drives to the basket... Vince Lowry throws a bad pass! Stolen by Shai Lowry! TURNOVER! (live ball)

[03:16] Team_058 possession (Score: 93-78)
Jarrett Gilgeous-Alexander attempts a Layup. BLOCKED BY JORDAN DONCIC! Ball is loose! Rebound secured by Vince Lowry.

[03:04] Team_076 possession (Score: 93-78)
Jordan Doncic drives and kicks out. Vince Lowry attempts a 3Pt. Contested by Draymond Williamson (5.3 feet, ZONE). Vince Lowry misses. Rebound secured by Jarrett Gilgeous-Alexander.

[02:53] Team_058 possession (Score: 93-78)
Jarrett Gilgeous-Alexander attempts a Midrange. Contested by Jordan Doncic (3.4 feet, MAN). JARRETT GILGEOUS-ALEXANDER MAKES IT! Assist: Pascal Holiday
Score: 95-78

[02:40] Team_076 possession (Score: 95-78)
Vince Lowry attempts a 3Pt. Contested by Draymond Williamson (5.2 feet, ZONE). Vince Lowry misses. Rebound secured by Shai Lowry.

[02:24] Team_058 possession (Score: 95-78)
Jarrett Gilgeous-Alexander attempts a Layup. Contested by Jordan Doncic (3.4 feet, ZONE). Jarrett Gilgeous-Alexander misses. Rebound secured by Vince Lowry.

[02:09] Team_076 possession (Score: 95-78)
Vince Lowry attempts a Layup. BLOCKED BY JARRETT GILGEOUS-ALEXANDER! Ball goes out off Jarrett Gilgeous-Alexander. Vince Lowry's ball!

[01:58] Team_076 possession (Score: 95-78)
FOUL! Shooting foul on Draymond Williamson. Kevin Nowitzki to the line for 3 free throws. [BONUS: 6 team fouls] (Draymond Williamson: 1 personal fouls)   FT 1/3: MISS   FT 2/3: MISS   FT 3/3: GOOD Kevin Nowitzki makes 1/3 from the line.
Score: 95-79

[01:47] Team_058 possession (Score: 95-79)
Jordan Ingram attempts a Midrange. Contested by Jalen Poole (5.6 feet, ZONE). Jordan Ingram misses. Rebound secured by Vince Lowry.

[01:37] Team_076 possession (Score: 95-79)
Vince Lowry attempts a 3Pt. Contested by Draymond Williamson (5.3 feet, ZONE). Vince Lowry misses. Rebound secured by Shai Lowry.

[01:25] Team_058 possession (Score: 95-79)
Pascal Holiday drives to the basket... Pascal Holiday throws a bad pass out of bounds! TURNOVER! (dead ball)

[01:07] Team_076 possession (Score: 95-79)
Jalen Poole attempts a 3Pt. Contested by Draymond Williamson (5.8 feet, ZONE). Jalen Poole misses. Offensive rebound by Jordan Doncic! Jordan Doncic kicks it out.

[00:49] Team_076 possession (Score: 95-79)
Pascal Lowry attempts a 3Pt. Contested by Draymond Williamson (5.1 feet, ZONE). PASCAL LOWRY MAKES IT! Assist: Kevin Nowitzki
Score: 95-82

[00:35] Team_058 possession (Score: 95-82)
Draymond Williamson attempts a 3Pt. Wide open! Pascal Lowry is 6.9 feet away. [MAN] Draymond Williamson misses. Rebound secured by Jordan Doncic.

[00:18] Team_076 possession (Score: 95-82)
Vince Lowry drives, Shai Lowry stays with him. Vince Lowry attempts a Dunk. Contested by Shai Lowry (4.4 feet, ZONE). VINCE LOWRY MAKES IT! Assist: Kevin Nowitzki
Score: 95-84

[00:04] Team_058 possession (Score: 95-84)
Shai Lowry attempts a Midrange. Contested by Kevin Nowitzki (4.5 feet, ZONE). Shai Lowry misses. Rebound secured by Kevin Nowitzki.

================================================================================
                              4TH QUARTER COMPLETE                              
================================================================================

4TH QUARTER SCORE: Team_058 14, Team_076 21

BOX SCORE:
================================================================================

Team_058
--------------------------------------------------------------------------------
Player                MIN  PTS  REB  AST  TO      FG   FG%      3P   3P%
--------------------------------------------------------------------------------
Pascal Holiday         21    5    4    1   0   2/5    40.0     0/0   0.0
Draymond Williamson    21    3    0    0   0   1/3    33.3     0/0   0.0
Tyrese Doncic          28    2    1    1   0   1/1   100.0     0/0   0.0
Vince Hyland           28    2    0    1   0   1/1   100.0     0/0   0.0
Jarrett Gilgeous-Alexander   21    2    4    1   0   1/3    33.3     0/0   0.0
Shai Lowry             21    0    2    0   0   0/4     0.0     0/0   0.0
Jordan Ingram          21    0    0    1   0   0/2     0.0     0/0   0.0

TEAM: FG: 6/19 (31.6%), 3PT: 2/6 (33.3%), REB: 12 (3 off, 9 def), AST: 5, TO: 3
TEAM FOULS: 6 [Team_076 in BONUS]


Team_076
--------------------------------------------------------------------------------
Player                MIN  PTS  REB  AST  TO      FG   FG%      3P   3P%
--------------------------------------------------------------------------------
Pascal Lowry           21    7    0    1   0   3/4    75.0     0/0   0.0
Kevin Nowitzki         21    6    4    2   0   3/4    75.0     0/0   0.0
Vince Lowry            21    4    7    0   0   2/5    40.0     0/0   0.0
Tobias Mitchell        28    3    0    0   0   1/1   100.0     0/0   0.0
Paul Leonard           28    1    0    0   0   1/1   100.0     0/0   0.0
D'Angelo Tatum         28    0    1    0   0   0/0     0.0     0/0   0.0
Jordan Doncic          21    0    4    0   0   0/2     0.0     0/0   0.0
Jalen Poole            21    0    0    1   0   0/2     0.0     0/0   0.0

TEAM: FG: 10/19 (52.6%), 3PT: 3/9 (33.3%), REB: 15 (3 off, 12 def), AST: 4, TO: 2
TEAM FOULS: 5 [Team_058 in BONUS]

================================================================================

================================================================================
                               FULL GAME COMPLETE                               
================================================================================

FINAL SCORE: Team_058 95, Team_076 84

SCORING BY QUARTER:
--------------------------------------------------------------------------------
Team                     Q1     Q2     Q3     Q4    FINAL
--------------------------------------------------------------------------------
Team_058                 25     20     36     14       95
Team_076                 21     16     26     21       84
--------------------------------------------------------------------------------

FULL GAME BOX SCORE:
================================================================================

Team_058
--------------------------------------------------------------------------------
Player                MIN  PTS  REB  AST  TO      FG   FG%      3P   3P%      FT STL BLK
--------------------------------------------------------------------------------
Bradley Sexton         28    5    9    7   1   2/8    25.0   0/4     0.0   3/3     1   1
Kyle Westbrook         28    4    0    4   0   2/2   100.0   0/0     0.0   0/0     0   0
Vince Hyland           28   25    0    3   3  10/14   71.4   6/8    75.0   1/1     0   1
Stephen Haliburton     28   18    8    1   1   6/8    75.0   0/1     0.0   1/1     1   0
Tyrese Doncic          28   19    9    2   1   9/11   81.8   1/1   100.0   2/4     1   1
Draymond Williamson    21    6    0    1   0   2/7    28.6   2/6    33.3   3/3     0   0
Jordan Ingram          21    4    0    1   2   1/4    25.0   0/2     0.0   2/2     0   0
Pascal Holiday         21    8    9    1   0   3/8    37.5   2/4    50.0   2/2     0   0
Shai Lowry             21    4    8    2   0   3/10   30.0   0/2     0.0   0/3     1   0
Jarrett Gilgeous-Alexander   21    2    4    1   1   1/6    16.7   0/1     0.0   0/0     0   1

TEAM: FG: 39/78 (50.0%), 3PT: 11/29 (37.9%), REB: 48 (11 off, 37 def), AST: 23, TO: 9


Team_076
--------------------------------------------------------------------------------
Player                MIN  PTS  REB  AST  TO      FG   FG%      3P   3P%      FT STL BLK
--------------------------------------------------------------------------------
Dejounte LaVine        28    5    0    2   1   1/7    14.3   1/2    50.0   0/1     0   0
Tobias Mitchell        28   12    2    2   1   5/7    71.4   1/2    50.0   3/3     0   0
Paul Leonard           28   10    0    0   1   6/11   54.5   1/6    16.7   1/2     2   0
Cade Barnes            28    9    9    1   1   6/8    75.0   1/2    50.0   2/2     0   1
D'Angelo Tatum         28   13   12    4   3   4/7    57.1   1/1   100.0   4/5     0   0
Pascal Lowry           21   10    0    2   1   4/8    50.0   1/4    25.0   1/1     0   0
Jalen Poole            21    0    0    3   0   0/4     0.0   0/3     0.0   0/0     0   0
Vince Lowry            21    7   11    0   1   3/8    37.5   0/4     0.0   3/3     0   1
Kevin Nowitzki         21   10    9    2   1   5/7    71.4   2/2   100.0   3/5     0   0
Jordan Doncic          21    6    8    0   1   3/7    42.9   0/1     0.0   0/0     0   3

TEAM: FG: 37/74 (50.0%), 3PT: 8/27 (29.6%), REB: 50 (13 off, 37 def), AST: 16, TO: 11

================================================================================
