================================================================================
                        FULL GAME - Team_095 vs Team_012                        
================================================================================

================================================================================
                       1ST QUARTER - Team_095 vs Team_012                       
================================================================================

[12:00] Team_095 possession (Score: 0-0)
Shaquille Ball drives, RJ Nowitzki stays with him. Shaquille Ball attempts a Layup. Contested by RJ Nowitzki (3.4 feet, MAN). SHAQUILLE BALL MAKES IT! Assist: Dejounte Hyland
Score: 2-0

[11:48] Team_012 possession (Score: 2-0)
FOUL! Offensive foul on Pascal Herro! Dejounte Hyland drew the charge! [Team fouls: 1] (Pascal Herro: 1 personal fouls) TURNOVER! (dead ball)

[11:37] Team_095 possession (Score: 2-0)
Dejounte Hyland attempts a Layup. Contested by Paolo Durant (3.5 feet, ZONE). Dejounte Hyland misses. Rebound secured by Paolo Durant.

[11:25] Team_012 possession (Score: 2-0)
Pascal Herro attempts a 3Pt. Contested by Dejounte Hyland (5.4 feet, MAN). Pascal Herro misses. Rebound secured by Evan Carter.

[11:10] Team_095 possession (Score: 2-0)
Dejounte Hyland attempts a 3Pt. Contested by Pascal Herro (4.9 feet, MAN). Dejounte Hyland misses. Rebound secured by Ayo McGrady.

[10:57] Team_012 possession (Score: 2-0)
Shaquille Booker makes the Layup and draws the foul on Evan Carter! And-1! Shaquille Booker to the line for 1. [Team fouls: 1] (Evan Carter: 1 personal fouls)   FT 1/1: GOOD Shaquille Booker makes 1/1 from the line.
Score: 2-3

[10:43] Team_095 possession (Score: 2-3)
Evan Carter attempts a Midrange. Contested by Ayo McGrady (4.5 feet, ZONE). Evan Carter misses. Rebound secured by Paolo Durant.

[10:27] Team_012 possession (Score: 2-3)
Pascal Herro attempts a 3Pt. Contested by Dejounte Hyland (5.4 feet, MAN). Pascal Herro misses. Rebound secured by Evan Carter.

[10:12] Team_095 possession (Score: 2-3)
FOUL! Shooting foul on Shaquille Booker. Immanuel Middleton to the line for 2 free throws. [Team fouls: 2] (Shaquille Booker: 1 personal fouls)   FT 1/2: GOOD   FT 2/2: GOOD Immanuel Middleton makes 2/2 from the line.
Score: 4-3

[10:00] Team_012 possession (Score: 4-3)
Ayo McGrady drives to the basket... Ayo McGrady loses control! Ball rolls out of bounds! TURNOVER! (dead ball)

[09:42] Team_095 possession (Score: 4-3)
Kyrie Ming attempts a Midrange. Contested by Ayo McGrady (4.5 feet, MAN). Kyrie Ming misses. Offensive rebound by Dejounte Hyland! Dejounte Hyland kicks it out.

[09:28] Team_095 possession (Score: 4-3)
Immanuel Middleton attempts a 3Pt. Contested by Shaquille Booker (4.0 feet, ZONE). IMMANUEL MIDDLETON MAKES IT! Assist: Shaquille Ball
Score: 7-3

[09:13] Team_012 possession (Score: 7-3)
FOUL! Reach-in foul on Kyrie Ming during the drive. [Team fouls: 2] No free throws, side out. (Kyrie Ming: 1 personal fouls)

[08:58] Team_012 possession (Score: 7-3)
RJ Nowitzki drives, Immanuel Middleton stays with him. RJ Nowitzki attempts a Dunk. Contested by Immanuel Middleton (5.2 feet, ZONE). RJ NOWITZKI MAKES IT! Assist: Ayo McGrady
Score: 7-5

[08:45] Team_095 possession (Score: 7-5)
Shaquille Ball drives and kicks out. Kyrie Ming attempts a 3Pt. Contested by RJ Nowitzki (3.4 feet, ZONE). KYRIE MING MAKES IT! Assist: Shaquille Ball
Score: 10-5

[08:35] Team_012 possession (Score: 10-5)
FOUL! Holding foul on Dejounte Hyland. [Team fouls: 3] No free throws, side out. (Dejounte Hyland: 1 personal fouls)

[08:17] Team_012 possession (Score: 10-5)
Pascal Herro attempts a Midrange. Contested by Shaquille Ball (4.9 feet, ZONE). Pascal Herro misses. Rebound secured by Evan Carter.

[08:01] Team_095 possession (Score: 10-5)
Kyrie Ming drives and kicks out. Shaquille Ball attempts a Midrange. Contested by RJ Nowitzki (3.4 feet, ZONE). Shaquille Ball misses. Rebound secured by Paolo Durant.

[07:52] Team_012 possession (Score: 10-5)
Paolo Durant makes the Layup and draws the foul on Dejounte Hyland! And-1! Paolo Durant to the line for 1. [Team fouls: 4] (Dejounte Hyland: 2 personal fouls)   FT 1/1: GOOD Paolo Durant makes 1/1 from the line.
Score: 10-8

[07:40] Team_095 possession (Score: 10-8)
Immanuel Middleton attempts a 3Pt. Contested by Paolo Durant (3.5 feet, MAN). Immanuel Middleton misses. Rebound secured by RJ Nowitzki.

[07:25] Team_012 possession (Score: 10-8)
Shaquille Booker attempts a Midrange. Contested by Evan Carter (3.8 feet, MAN). Shaquille Booker misses. Rebound secured by Shaquille Ball.

[07:12] Team_095 possession (Score: 10-8)
Dejounte Hyland attempts a 3Pt. Contested by Pascal Herro (4.9 feet, MAN). DEJOUNTE HYLAND MAKES IT! Assist: Shaquille Ball
Score: 13-8

[06:58] Team_012 possession (Score: 13-8)
Pascal Herro attempts a Midrange. Contested by Evan Carter (4.4 feet, ZONE). PASCAL HERRO MAKES IT! Assist: Paolo Durant
Score: 13-10

[06:42] Team_095 possession (Score: 13-10)
Dejounte Hyland attempts a Midrange. Contested by Pascal Herro (4.9 feet, MAN). Dejounte Hyland misses. Rebound secured by Ayo McGrady.

[06:27] Team_012 possession (Score: 13-10)
RJ Nowitzki makes the Midrange and draws the foul on Shaquille Ball! And-1! RJ Nowitzki to the line for 1. [BONUS: 5 team fouls] (Shaquille Ball: 1 personal fouls)   FT 1/1: GOOD RJ Nowitzki makes 1/1 from the line.
Score: 13-13

[06:09] Team_095 possession (Score: 13-13)
Immanuel Middleton attempts a 3Pt. Contested by RJ Nowitzki (3.4 feet, ZONE). Immanuel Middleton misses. Rebound secured by Ayo McGrady.

[05:56] Team_012 possession (Score: 13-13)
Ayo McGrady makes the Dunk and draws the foul on Immanuel Middleton! And-1! Ayo McGrady to the line for 1. [BONUS: 6 team fouls] (Immanuel Middleton: 1 personal fouls)   FT 1/1: GOOD Ayo McGrady makes 1/1 from the line.
Score: 13-16

[05:40] Team_095 possession (Score: 13-16)
Shaquille Ball attempts a 3Pt. Contested by RJ Nowitzki (3.4 feet, ZONE). SHAQUILLE BALL MAKES IT! Assist: Immanuel Middleton
Score: 16-16

[05:28] Team_012 possession (Score: 16-16)
Pascal Herro attempts a 3Pt. Contested by Evan Carter (4.4 feet, ZONE). Pascal Herro misses. Rebound secured by Dejounte Hyland.

[05:12] Team_095 possession (Score: 16-16)
Kyrie Ming makes the Layup and draws the foul on Ayo McGrady! And-1! Kyrie Ming to the line for 1. [Team fouls: 3] (Ayo McGrady: 1 personal fouls)   FT 1/1: GOOD Kyrie Ming makes 1/1 from the line.
Score: 19-16

[04:59] Team_012 possession (Score: 19-16)
RJ Nowitzki attempts a 3Pt. Contested by Shaquille Ball (4.7 feet, MAN). RJ Nowitzki misses. Rebound secured by Evan Carter.

[04:41] Team_095 possession (Score: 19-16)
Evan Carter drives and kicks out. Immanuel Middleton attempts a 3Pt. Contested by Paolo Durant (3.6 feet, MAN). Immanuel Middleton misses. Rebound secured by Paolo Durant.

[04:25] Team_012 possession (Score: 19-16)
Pascal Herro attempts a 3Pt. Contested by Dejounte Hyland (5.5 feet, MAN). Pascal Herro misses. Rebound secured by Shaquille Ball.

[04:14] Team_095 possession (Score: 19-16)
Immanuel Middleton attempts a Layup. Contested by Paolo Durant (3.6 feet, MAN). IMMANUEL MIDDLETON MAKES IT!
Score: 21-16

[04:01] Team_012 possession (Score: 21-16)
Shaquille Booker attempts a Midrange. Contested by Immanuel Middleton (5.0 feet, ZONE). Shaquille Booker misses. Rebound secured by Shaquille Ball.

[03:44] Team_095 possession (Score: 21-16)
Immanuel Middleton attempts a Midrange. Contested by Paolo Durant (3.6 feet, ZONE). Immanuel Middleton misses. Rebound secured by Ayo McGrady.

[03:27] Team_012 possession (Score: 21-16)
RJ Nowitzki drives and kicks out. Ayo McGrady attempts a 3Pt. Contested by Evan Carter (4.0 feet, ZONE). Ayo McGrady misses. Offensive rebound by RJ Nowitzki! RJ Nowitzki kicks it out.

[03:15] Team_012 possession (Score: 21-16)
Pascal Herro attempts a 3Pt. Contested by Evan Carter (4.5 feet, ZONE). Pascal Herro misses. Rebound secured by Evan Carter.

[03:01] Team_095 possession (Score: 21-16)
Dejounte Hyland attempts a 3Pt. Contested by RJ Nowitzki (3.6 feet, ZONE). Dejounte Hyland misses. Rebound secured by RJ Nowitzki.

[02:49] Team_012 possession (Score: 21-16)
Ayo McGrady attempts a Layup. Contested by Kyrie Ming (5.3 feet, MAN). Ayo McGrady misses. Rebound secured by Dejounte Hyland.

[02:36] Team_095 possession (Score: 21-16)
Kyrie Ming attempts a Midrange. Contested by Ayo McGrady (4.7 feet, MAN). KYRIE MING MAKES IT! Assist: Shaquille Ball
Score: 23-16

[02:25] Team_012 possession (Score: 23-16)
RJ Nowitzki drives and kicks out. Paolo Durant attempts a Midrange. Contested by Immanuel Middleton (5.2 feet, MAN). Paolo Durant misses. Rebound secured by Shaquille Ball.

[02:10] Team_095 possession (Score: 23-16)
Immanuel Middleton attempts a 3Pt. Contested by Paolo Durant (3.8 feet, MAN). Immanuel Middleton misses. Rebound secured by Ayo McGrady.

[01:54] Team_012 possession (Score: 23-16)
Ayo McGrady attempts a Midrange. Contested by Evan Carter (4.1 feet, ZONE). AYO MCGRADY MAKES IT! Assist: Pascal Herro
Score: 23-18

[01:35] Team_095 possession (Score: 23-18)
Immanuel Middleton attempts a Midrange. Contested by Paolo Durant (3.9 feet, MAN). Immanuel Middleton misses. Rebound secured by RJ Nowitzki.

[01:23] Team_012 possession (Score: 23-18)
Ayo McGrady attempts a 3Pt. Contested by Evan Carter (4.2 feet, ZONE). Ayo McGrady misses. Rebound secured by Evan Carter.

[01:08] Team_095 possession (Score: 23-18)
Evan Carter drives, Shaquille Booker stays with him. Evan Carter attempts a Layup. Contested by Shaquille Booker (4.6 feet, MAN). Evan Carter misses. Offensive rebound by Dejounte Hyland! Dejounte Hyland kicks it out.

[00:59] Team_095 possession (Score: 23-18)
Kyrie Ming drives and kicks out. Immanuel Middleton attempts a 3Pt. Contested by Paolo Durant (4.0 feet, ZONE). Immanuel Middleton misses. Rebound secured by RJ Nowitzki.

[00:47] Team_012 possession (Score: 23-18)
Shaquille Booker attempts a Midrange. Contested by Evan Carter (4.3 feet, MAN). Shaquille Booker misses. Offensive rebound by Paolo Durant! Paolo Durant's putback is no good. Rebound secured by Shaquille Ball.

[00:33] Team_095 possession (Score: 23-18)
Immanuel Middleton attempts a Layup. Contested by Paolo Durant (4.0 feet, MAN). Immanuel Middleton misses. Rebound secured by RJ Nowitzki.

[00:13] Team_012 possession (Score: 23-18)
Pascal Herro attempts a Midrange. Contested by Dejounte Hyland (5.8 feet, MAN). Pascal Herro misses. Rebound secured by Shaquille Ball.

================================================================================
                              1ST QUARTER COMPLETE                              
================================================================================

1ST QUARTER SCORE: Team_095 23, Team_012 18

BOX SCORE:
================================================================================

Team_095
--------------------------------------------------------------------------------
Player                MIN  PTS  REB  AST  TO      FG   FG%      3P   3P%
--------------------------------------------------------------------------------
Kyrie Ming             12    8    0    0   0   3/5    60.0     0/0   0.0
Immanuel Middleton     12    7    0    1   0   3/9    33.3     0/0   0.0
Shaquille Ball         12    5    6    4   0   2/2   100.0     0/0   0.0
Dejounte Hyland        12    3    4    1   0   1/5    20.0     0/0   0.0
Evan Carter            12    0    6    0   0   0/2     0.0     0/0   0.0

TEAM: FG: 9/23 (39.1%), 3PT: 3/8 (37.5%), REB: 15 (2 off, 13 def), AST: 6, TO: 0
TEAM FOULS: 6 [Team_012 in BONUS]


Team_012
--------------------------------------------------------------------------------
Player                MIN  PTS  REB  AST  TO      FG   FG%      3P   3P%
--------------------------------------------------------------------------------
Ayo McGrady            12    5    5    1   0   2/4    50.0     0/0   0.0
RJ Nowitzki            12    5    6    0   0   2/4    50.0     0/0   0.0
Paolo Durant           12    3    4    1   0   1/1   100.0     0/0   0.0
Shaquille Booker       12    3    0    0   0   1/4    25.0     0/0   0.0
Pascal Herro           12    2    0    1   0   1/8    12.5     0/0   0.0

TEAM: FG: 7/21 (33.3%), 3PT: 0/7 (0.0%), REB: 16 (2 off, 14 def), AST: 3, TO: 2
TEAM FOULS: 3

================================================================================

================================================================================
                       2ND QUARTER - Team_095 vs Team_012                       
================================================================================

[12:00] Team_095 possession (Score: 23-18)
Evan Carter attempts a 3Pt. Contested by RJ Nowitzki (3.9 feet, ZONE). Evan Carter misses. Rebound secured by Paolo Durant.

[11:49] Team_012 possession (Score: 23-18)
Ayo McGrady makes the Midrange and draws the foul on Evan Carter! And-1! Ayo McGrady to the line for 1. [Team fouls: 1] (Evan Carter: 1 personal fouls)   FT 1/1: GOOD Ayo McGrady makes 1/1 from the line.
Score: 23-21

[11:37] Team_095 possession (Score: 23-21)
Evan Carter attempts a Midrange. Contested by Shaquille Booker (4.6 feet, ZONE). EVAN CARTER MAKES IT! Assist: Shaquille Ball
Score: 25-21

[11:24] Team_012 possession (Score: 25-21)
Shaquille Booker attempts a Midrange. Contested by Immanuel Middleton (5.3 feet, ZONE). SHAQUILLE BOOKER MAKES IT! Assist: Ayo McGrady
Score: 25-23

[11:12] Team_095 possession (Score: 25-23)
FOUL! Shooting foul on RJ Nowitzki. Shaquille Ball to the line for 3 free throws. [Team fouls: 1] (RJ Nowitzki: 1 personal fouls)   FT 1/3: GOOD   FT 2/3: GOOD   FT 3/3: GOOD Shaquille Ball makes 3/3 from the line.
Score: 28-23

[11:00] Team_012 possession (Score: 28-23)
Shaquille Booker drives to the basket... Shaquille Booker commits a violation (traveling/carry)! TURNOVER! (dead ball)

[11:00] Substitution (Team_095): Dejounte Hyland OUT → Kyle Poole IN (stamina_rule2)

[11:00] Substitution (Team_095): Shaquille Ball OUT → Cade Beal IN (stamina_rule2)

[11:00] Substitution (Team_095): Evan Carter OUT → Tobias Wagner IN (stamina_rule2)

[11:00] Substitution (Team_095): Immanuel Middleton OUT → Gary Davis IN (stamina_rule2)

[11:00] Substitution (Team_095): Kyrie Ming OUT → DeMar McCollum IN (stamina_rule2)

[11:00] Substitution (Team_012): Pascal Herro OUT → Desmond Irving IN (stamina_rule2)

[11:00] Substitution (Team_012): RJ Nowitzki OUT → Jalen Barnes IN (stamina_rule2)

[11:00] Substitution (Team_012): Shaquille Booker OUT → Domantas Bird IN (stamina_rule2)

[11:00] Substitution (Team_012): Paolo Durant OUT → Jimmy Quickley IN (stamina_rule2)

[11:00] Substitution (Team_012): Ayo McGrady OUT → Karl Young IN (stamina_rule2)

[10:43] Team_095 possession (Score: 28-23)
Gary Davis attempts a Layup. Contested by Jimmy Quickley (4.7 feet, MAN). GARY DAVIS MAKES IT! Assist: Cade Beal
Score: 30-23

[10:29] Team_012 possession (Score: 30-23)
FOUL! Reach-in foul on DeMar McCollum during the drive. [Team fouls: 2] No free throws, side out. (DeMar McCollum: 1 personal fouls)

[10:15] Team_012 possession (Score: 30-23)
Jalen Barnes drives, picks up Cade Beal. Help arrives from Tobias Wagner! Jalen Barnes attempts a Dunk. Contested by Tobias Wagner (4.4 feet, MAN). Jalen Barnes misses. Offensive rebound by Jimmy Quickley! Jimmy Quickley kicks it out.

[09:58] Team_012 possession (Score: 30-23)
Domantas Bird attempts a Layup. Contested by Tobias Wagner (3.7 feet, MAN). Domantas Bird misses. Rebound secured by DeMar McCollum.

[09:44] Team_095 possession (Score: 30-23)
Tobias Wagner makes the Midrange and draws the foul on Domantas Bird! And-1! Tobias Wagner to the line for 1. [Team fouls: 2] (Domantas Bird: 1 personal fouls)   FT 1/1: GOOD Tobias Wagner makes 1/1 from the line.
Score: 33-23

[09:29] Team_012 possession (Score: 33-23)
Jalen Barnes drives, picks up DeMar McCollum. Help arrives from Kyle Poole! Jalen Barnes attempts a Dunk. Contested by Kyle Poole (4.9 feet, ZONE). Jalen Barnes misses. Rebound secured by Gary Davis.

[09:13] Team_095 possession (Score: 33-23)
Cade Beal attempts a Layup. Contested by Jimmy Quickley (4.9 feet, ZONE). Cade Beal misses. Offensive rebound by Tobias Wagner! Tobias Wagner kicks it out.

[08:59] Team_095 possession (Score: 33-23)
DeMar McCollum attempts a Layup. BLOCKED BY JALEN BARNES! Ball goes out off Jalen Barnes. DeMar McCollum's ball!

[08:47] Team_095 possession (Score: 33-23)
Cade Beal drives, Jalen Barnes stays with him. Cade Beal attempts a Layup. Contested by Jalen Barnes (5.2 feet, MAN). Cade Beal misses. Rebound secured by Jalen Barnes.

[08:34] Team_012 possession (Score: 33-23)
Domantas Bird attempts a 3Pt. Contested by Cade Beal (4.3 feet, ZONE). Domantas Bird misses. Rebound secured by Gary Davis.

[08:19] Team_095 possession (Score: 33-23)
Cade Beal attempts a Midrange. Contested by Jimmy Quickley (4.9 feet, ZONE). Cade Beal misses. Rebound secured by Karl Young.

[08:09] Team_012 possession (Score: 33-23)
Desmond Irving attempts a Midrange. Contested by Kyle Poole (4.8 feet, MAN). DESMOND IRVING MAKES IT!
Score: 33-25

[07:55] Team_095 possession (Score: 33-25)
Gary Davis attempts a Midrange. Contested by Jimmy Quickley (4.7 feet, ZONE). Gary Davis misses. Rebound secured by Karl Young.

[07:37] Team_012 possession (Score: 33-25)
Jimmy Quickley drives and kicks out. Domantas Bird attempts a 3Pt. Contested by Tobias Wagner (3.8 feet, MAN). DOMANTAS BIRD MAKES IT! Assist: Jimmy Quickley
Score: 33-28

[07:21] Team_095 possession (Score: 33-28)
Gary Davis attempts a Midrange. Contested by Domantas Bird (4.9 feet, ZONE). Gary Davis misses. Rebound secured by Jalen Barnes.

[07:09] Team_012 possession (Score: 33-28)
FOUL! Reach-in foul on DeMar McCollum during the drive. [Team fouls: 3] No free throws, side out. (DeMar McCollum: 2 personal fouls)

[06:53] Team_012 possession (Score: 33-28)
Desmond Irving drives and kicks out. Karl Young attempts a 3Pt. Contested by Cade Beal (4.4 feet, ZONE). Karl Young misses. Rebound secured by Tobias Wagner.

[06:35] Team_095 possession (Score: 33-28)
Gary Davis drives and kicks out. Kyle Poole attempts a 3Pt. Contested by Desmond Irving (4.5 feet, MAN). Kyle Poole misses. Rebound secured by Jalen Barnes.

[06:24] Team_012 possession (Score: 33-28)
Jimmy Quickley attempts a 3Pt. Contested by Gary Davis (5.7 feet, MAN). JIMMY QUICKLEY MAKES IT! Assist: Jalen Barnes
Score: 33-31

[06:09] Team_095 possession (Score: 33-31)
Tobias Wagner drives, Jimmy Quickley stays with him. Tobias Wagner attempts a Dunk. Contested by Jimmy Quickley (5.3 feet, ZONE). Tobias Wagner misses. Offensive rebound by DeMar McCollum! DeMar McCollum kicks it out.

[05:53] Team_095 possession (Score: 33-31)
DeMar McCollum drives and kicks out. Cade Beal attempts a 3Pt. Contested by Jimmy Quickley (4.9 feet, ZONE). CADE BEAL MAKES IT! Assist: DeMar McCollum
Score: 36-31

[05:41] Team_012 possession (Score: 36-31)
Domantas Bird attempts a Midrange. Contested by Tobias Wagner (3.7 feet, MAN). Domantas Bird misses. Rebound secured by DeMar McCollum.

[05:23] Team_095 possession (Score: 36-31)
Tobias Wagner attempts a Layup. Contested by Domantas Bird (5.5 feet, MAN). TOBIAS WAGNER MAKES IT! Assist: Kyle Poole
Score: 38-31

[05:10] Team_012 possession (Score: 38-31)
Jimmy Quickley drives, DeMar McCollum stays with him. Jimmy Quickley attempts a Layup. Contested by DeMar McCollum (5.1 feet, ZONE). Jimmy Quickley misses. Rebound secured by Gary Davis.

[04:59] Team_095 possession (Score: 38-31)
Kyle Poole attempts a Midrange. Contested by Desmond Irving (4.8 feet, MAN). KYLE POOLE MAKES IT!
Score: 40-31

[04:45] Team_012 possession (Score: 40-31)
Jimmy Quickley drives, picks up DeMar McCollum. Help arrives from Kyle Poole! Jimmy Quickley attempts a Dunk. Contested by Kyle Poole (5.1 feet, ZONE). JIMMY QUICKLEY MAKES IT! Assist: Domantas Bird
Score: 40-33

[04:29] Team_095 possession (Score: 40-33)
Kyle Poole attempts a 3Pt. Contested by Desmond Irving (4.8 feet, ZONE). KYLE POOLE MAKES IT! Assist: DeMar McCollum
Score: 43-33

[04:13] Team_012 possession (Score: 43-33)
Karl Young attempts a Midrange. Contested by DeMar McCollum (5.0 feet, MAN). KARL YOUNG MAKES IT!
Score: 43-35

[03:55] Team_095 possession (Score: 43-35)
Cade Beal attempts a 3Pt. Contested by Jalen Barnes (5.2 feet, MAN). Cade Beal misses. FOUL! Loose ball foul on Jalen Barnes during the rebound battle. [Team fouls: 3] No free throws, side out. (Jalen Barnes: 1 personal fouls)

[03:40] Team_095 possession (Score: 43-35)
Cade Beal attempts a 3Pt. Contested by Jalen Barnes (5.2 feet, MAN). Cade Beal misses. Offensive rebound by Tobias Wagner! Tobias Wagner kicks it out.

[03:25] Team_095 possession (Score: 43-35)
Cade Beal attempts a Midrange. Contested by Jalen Barnes (5.2 feet, MAN). CADE BEAL MAKES IT! Assist: Gary Davis
Score: 45-35

[03:12] Team_012 possession (Score: 45-35)
Jalen Barnes makes the Dunk and draws the foul on Cade Beal! And-1! Jalen Barnes to the line for 1. [Team fouls: 4] (Cade Beal: 1 personal fouls)   FT 1/1: GOOD Jalen Barnes makes 1/1 from the line.
Score: 45-38

[02:59] Team_095 possession (Score: 45-38)
FOUL! Shooting foul on Jimmy Quickley. Tobias Wagner to the line for 2 free throws. [Team fouls: 4] (Jimmy Quickley: 1 personal fouls)   FT 1/2: GOOD   FT 2/2: GOOD Tobias Wagner makes 2/2 from the line.
Score: 47-38

[02:42] Team_012 possession (Score: 47-38)
Jalen Barnes attempts a Midrange. Contested by Cade Beal (4.5 feet, MAN). Jalen Barnes misses. Rebound secured by DeMar McCollum.

[02:25] Team_095 possession (Score: 47-38)
Gary Davis drives to the basket... FOUL! Offensive foul on Gary Davis! Jimmy Quickley drew the charge! [Team fouls: 5] (Gary Davis: 1 personal fouls) TURNOVER! (dead ball)

[02:15] Team_012 possession (Score: 47-38)
Karl Young drives, picks up DeMar McCollum. Help arrives from Cade Beal! Karl Young attempts a Layup. Contested by Cade Beal (5.1 feet, MAN). KARL YOUNG MAKES IT! Assist: Domantas Bird
Score: 47-40

[01:58] Team_095 possession (Score: 47-40)
FOUL! Holding foul on Jalen Barnes. [IN THE BONUS! 5 team fouls] Cade Beal to the line for 2 free throws. (Jalen Barnes: 2 personal fouls)   FT 1/2: GOOD   FT 2/2: GOOD Cade Beal makes 2/2 from the line.
Score: 49-40

[01:46] Team_012 possession (Score: 49-40)
Karl Young drives, DeMar McCollum stays with him. Karl Young attempts a Dunk. Contested by DeMar McCollum (5.2 feet, ZONE). KARL YOUNG MAKES IT! Assist: Domantas Bird
Score: 49-42

[01:29] Team_095 possession (Score: 49-42)
DeMar McCollum attempts a Midrange. Contested by Karl Young (4.6 feet, MAN). DeMar McCollum misses. Rebound secured by Jalen Barnes.

[01:13] Team_012 possession (Score: 49-42)
Jimmy Quickley throws a bad pass! Stolen by Gary Davis! TURNOVER! (live ball)

[00:58] Team_095 possession (Score: 49-42)
Kyle Poole attempts a Midrange. Contested by Desmond Irving (5.1 feet, MAN). Kyle Poole misses. Rebound secured by Jimmy Quickley.

[00:40] Team_012 possession (Score: 49-42)
Domantas Bird attempts a Midrange. Contested by Tobias Wagner (4.0 feet, MAN). Domantas Bird misses. Rebound secured by Gary Davis.

[00:21] Team_095 possession (Score: 49-42)
Gary Davis attempts a 3Pt. Contested by Jimmy Quickley (5.0 feet, MAN). Gary Davis misses. Offensive rebound by Tobias Wagner! Tobias Wagner kicks it out.

[00:07] Team_095 possession (Score: 49-42)
Cade Beal makes the Layup and draws the foul on Jimmy Quickley! And-1! Cade Beal to the line for 1. [BONUS: 6 team fouls] (Jimmy Quickley: 2 personal fouls)   FT 1/1: GOOD Cade Beal makes 1/1 from the line.
Score: 52-42

================================================================================
                              2ND QUARTER COMPLETE                              
================================================================================

2ND QUARTER SCORE: Team_095 29, Team_012 24

BOX SCORE:
================================================================================

Team_095
--------------------------------------------------------------------------------
Player                MIN  PTS  REB  AST  TO      FG   FG%      3P   3P%
--------------------------------------------------------------------------------
Cade Beal              11   10    0    1   0   4/6    66.7     0/0   0.0
Tobias Wagner          11    7    5    0   0   3/3   100.0     0/0   0.0
Kyle Poole             11    5    0    1   0   2/3    66.7     0/0   0.0
Shaquille Ball         13    3    0    1   0   1/1   100.0     0/0   0.0
Evan Carter            13    2    0    0   0   1/2    50.0     0/0   0.0
Gary Davis             11    2    4    1   0   1/4    25.0     0/0   0.0
DeMar McCollum         11    0    4    2   0   0/1     0.0     0/0   0.0

TEAM: FG: 12/20 (60.0%), 3PT: 2/3 (66.7%), REB: 13 (5 off, 8 def), AST: 6, TO: 1
TEAM FOULS: 5 [Team_012 in BONUS]


Team_012
--------------------------------------------------------------------------------
Player                MIN  PTS  REB  AST  TO      FG   FG%      3P   3P%
--------------------------------------------------------------------------------
Karl Young             11    6    2    0   0   3/3   100.0     0/0   0.0
Jimmy Quickley         11    5    2    1   0   2/3    66.7     0/0   0.0
Ayo McGrady            13    3    0    1   0   1/1   100.0     0/0   0.0
Domantas Bird          11    3    0    3   0   1/5    20.0     0/0   0.0
Jalen Barnes           11    3    4    1   0   1/3    33.3     0/0   0.0
Shaquille Booker       13    2    0    0   0   1/1   100.0     0/0   0.0
Desmond Irving         11    2    0    0   0   1/2    50.0     0/0   0.0
Paolo Durant           13    0    1    0   0   0/0     0.0     0/0   0.0

TEAM: FG: 10/18 (55.6%), 3PT: 1/2 (50.0%), REB: 9 (1 off, 8 def), AST: 6, TO: 2
TEAM FOULS: 6 [Team_095 in BONUS]

================================================================================

================================================================================
                       3RD QUARTER - Team_095 vs Team_012                       
================================================================================

[12:00] Team_095 possession (Score: 52-42)
Shaquille Ball attempts a 3Pt. Contested by RJ Nowitzki (3.4 feet, MAN). Shaquille Ball misses. Rebound secured by Paolo Durant.

[11:47] Team_012 possession (Score: 52-42)
Pascal Herro makes the Dunk and draws the foul on Immanuel Middleton! And-1! Pascal Herro to the line for 1. [Team fouls: 1] (Immanuel Middleton: 1 personal fouls)   FT 1/1: GOOD Pascal Herro makes 1/1 from the line.
Score: 52-45

[11:34] Team_095 possession (Score: 52-45)
Evan Carter attempts a 3Pt. Contested by Shaquille Booker (4.2 feet, ZONE). Evan Carter misses. Rebound secured by Paolo Durant.

[11:18] Team_012 possession (Score: 52-45)
RJ Nowitzki attempts a Midrange. Contested by Shaquille Ball (4.7 feet, MAN). RJ Nowitzki misses. Offensive rebound by Paolo Durant! Paolo Durant puts it back in!
Score: 52-47

[11:03] Team_095 possession (Score: 52-47)
FOUL! Reach-in foul on Ayo McGrady during the drive. [Team fouls: 1] No free throws, side out. (Ayo McGrady: 1 personal fouls)

[10:52] Team_095 possession (Score: 52-47)
FOUL! Reach-in foul on Paolo Durant during the drive. [Team fouls: 2] No free throws, side out. (Paolo Durant: 1 personal fouls)

[10:39] Team_095 possession (Score: 52-47)
Immanuel Middleton attempts a Midrange. Contested by Paolo Durant (3.5 feet, ZONE). IMMANUEL MIDDLETON MAKES IT!
Score: 54-47

[10:26] Team_012 possession (Score: 54-47)
Shaquille Booker attempts a 3Pt. Contested by Evan Carter (3.8 feet, ZONE). Shaquille Booker misses. Rebound secured by Shaquille Ball.

[10:12] Team_095 possession (Score: 54-47)
Immanuel Middleton attempts a Midrange. Contested by Paolo Durant (3.5 feet, MAN). IMMANUEL MIDDLETON MAKES IT! Assist: Evan Carter
Score: 56-47

[09:57] Team_012 possession (Score: 56-47)
Shaquille Booker attempts a Midrange. Contested by Evan Carter (3.8 feet, MAN). Shaquille Booker misses. Rebound secured by Dejounte Hyland.

[09:46] Team_095 possession (Score: 56-47)
Immanuel Middleton attempts a Midrange. Contested by Paolo Durant (3.5 feet, MAN). Immanuel Middleton misses. Offensive rebound by Evan Carter! Evan Carter puts it back in!
Score: 58-47

[09:34] Team_012 possession (Score: 58-47)
Pascal Herro attempts a Layup. BLOCKED BY DEJOUNTE HYLAND! Ball is loose! Rebound secured by Dejounte Hyland.

[09:16] Team_095 possession (Score: 58-47)
Shaquille Ball drives, Paolo Durant stays with him. Shaquille Ball attempts a Layup. Contested by Paolo Durant (3.5 feet, ZONE). Shaquille Ball misses. Rebound secured by Paolo Durant.

[09:05] Team_012 possession (Score: 58-47)
FOUL! Offensive foul on Pascal Herro! Dejounte Hyland drew the charge! [Team fouls: 3] (Pascal Herro: 1 personal fouls) TURNOVER! (dead ball)

[08:51] Team_095 possession (Score: 58-47)
Immanuel Middleton drives and kicks out. Shaquille Ball attempts a 3Pt. Contested by Shaquille Booker (4.0 feet, ZONE). Shaquille Ball misses. Rebound secured by Paolo Durant.

[08:35] Team_012 possession (Score: 58-47)
RJ Nowitzki makes the Layup and draws the foul on Evan Carter! And-1! RJ Nowitzki to the line for 1. [Team fouls: 2] (Evan Carter: 1 personal fouls)   FT 1/1: GOOD RJ Nowitzki makes 1/1 from the line.
Score: 58-50

[08:22] Team_095 possession (Score: 58-50)
Immanuel Middleton attempts a Layup. Contested by Paolo Durant (3.5 feet, MAN). IMMANUEL MIDDLETON MAKES IT!
Score: 60-50

[08:10] Team_012 possession (Score: 60-50)
FOUL! Shooting foul on Dejounte Hyland. Paolo Durant to the line for 2 free throws. [Team fouls: 3] (Dejounte Hyland: 1 personal fouls)   FT 1/2: GOOD   FT 2/2: GOOD Paolo Durant makes 2/2 from the line.
Score: 60-52

[07:56] Team_095 possession (Score: 60-52)
Shaquille Ball attempts a Midrange. Contested by Pascal Herro (4.9 feet, ZONE). Shaquille Ball misses. Rebound secured by RJ Nowitzki.

[07:38] Team_012 possession (Score: 60-52)
Pascal Herro drives and kicks out. Paolo Durant makes the Midrange and draws the foul on Immanuel Middleton! And-1! Paolo Durant to the line for 1. [Team fouls: 4] (Immanuel Middleton: 2 personal fouls)   FT 1/1: GOOD Paolo Durant makes 1/1 from the line.
Score: 60-55

[07:23] Team_095 possession (Score: 60-55)
FOUL! Offensive foul on Evan Carter! Shaquille Booker drew the charge! [Team fouls: 5] (Evan Carter: 2 personal fouls) TURNOVER! (dead ball)

[07:09] Team_012 possession (Score: 60-55)
Ayo McGrady throws a bad pass out of bounds! TURNOVER! (dead ball)

[06:54] Team_095 possession (Score: 60-55)
Shaquille Ball attempts a 3Pt. Contested by RJ Nowitzki (3.4 feet, ZONE). Shaquille Ball misses. Rebound secured by Paolo Durant.

[06:41] Team_012 possession (Score: 60-55)
Paolo Durant drives and kicks out. Pascal Herro attempts a Midrange. Contested by Dejounte Hyland (4.9 feet, MAN). Pascal Herro misses. Rebound secured by Evan Carter.

[06:24] Team_095 possession (Score: 60-55)
Immanuel Middleton attempts a 3Pt. Contested by RJ Nowitzki (3.4 feet, ZONE). Immanuel Middleton misses. Offensive rebound by Dejounte Hyland! Dejounte Hyland kicks it out.

[06:13] Team_095 possession (Score: 60-55)
Shaquille Ball attempts a 3Pt. BLOCKED BY RJ NOWITZKI! Ball is loose! Rebound secured by Ayo McGrady.

[05:57] Team_012 possession (Score: 60-55)
RJ Nowitzki attempts a Midrange. Contested by Shaquille Ball (4.7 feet, MAN). RJ Nowitzki misses. Rebound secured by Dejounte Hyland.

[05:44] Team_095 possession (Score: 60-55)
Dejounte Hyland attempts a 3Pt. Contested by Pascal Herro (4.9 feet, MAN). Dejounte Hyland misses. Rebound secured by Paolo Durant.

[05:30] Team_012 possession (Score: 60-55)
RJ Nowitzki attempts a 3Pt. Contested by Evan Carter (4.2 feet, ZONE). RJ NOWITZKI MAKES IT!
Score: 60-58

[05:14] Team_095 possession (Score: 60-58)
Evan Carter drives to the basket... Evan Carter throws a bad pass! Stolen by Shaquille Booker! TURNOVER! (live ball)

[05:01] Team_012 possession (Score: 60-58)
Shaquille Booker attempts a Layup. BLOCKED BY IMMANUEL MIDDLETON! Ball is loose! Rebound secured by Dejounte Hyland.

[04:46] Team_095 possession (Score: 60-58)
Kyrie Ming drives, picks up Ayo McGrady. Help arrives from RJ Nowitzki! Kyrie Ming attempts a Dunk. Contested by RJ Nowitzki (4.5 feet, MAN). KYRIE MING MAKES IT!
Score: 62-58

[04:32] Team_012 possession (Score: 62-58)
RJ Nowitzki drives to the basket... FOUL! Offensive foul on RJ Nowitzki! Shaquille Ball drew the charge! [Team fouls: 4] (RJ Nowitzki: 1 personal fouls) TURNOVER! (dead ball)

[04:17] Team_095 possession (Score: 62-58)
Dejounte Hyland drives to the basket... Dejounte Hyland throws a bad pass! Stolen by Pascal Herro! TURNOVER! (live ball)

[04:00] Team_012 possession (Score: 62-58)
FOUL! Reach-in foul on Dejounte Hyland during the drive. [IN THE BONUS! 6 team fouls] Pascal Herro to the line for 2 free throws. (Dejounte Hyland: 2 personal fouls)   FT 1/2: GOOD   FT 2/2: GOOD Pascal Herro makes 2/2 from the line.
Score: 62-60

[03:43] Team_095 possession (Score: 62-60)
Shaquille Ball attempts a 3Pt. Contested by RJ Nowitzki (3.5 feet, ZONE). Shaquille Ball misses. Offensive rebound by Evan Carter! Evan Carter's putback is no good. Rebound secured by Paolo Durant.

[03:26] Team_012 possession (Score: 62-60)
Ayo McGrady drives, picks up Kyrie Ming. Help arrives from Dejounte Hyland! Ayo McGrady attempts a Layup. Contested by Dejounte Hyland (5.3 feet, MAN). AYO MCGRADY MAKES IT! Assist: RJ Nowitzki
Score: 62-62

[03:14] Team_095 possession (Score: 62-62)
FOUL! Shooting foul on Paolo Durant. Immanuel Middleton to the line for 2 free throws. [BONUS: 5 team fouls] (Paolo Durant: 2 personal fouls)   FT 1/2: GOOD   FT 2/2: GOOD Immanuel Middleton makes 2/2 from the line.
Score: 64-62

[03:05] Team_012 possession (Score: 64-62)
Ayo McGrady drives, Immanuel Middleton stays with him. Ayo McGrady attempts a Layup. Contested by Immanuel Middleton (5.1 feet, ZONE). AYO MCGRADY MAKES IT! Assist: Paolo Durant
Score: 64-64

[02:47] Team_095 possession (Score: 64-64)
Immanuel Middleton attempts a 3Pt. Contested by Paolo Durant (3.7 feet, MAN). Immanuel Middleton misses. Rebound secured by Ayo McGrady.

[02:34] Team_012 possession (Score: 64-64)
Paolo Durant drives and kicks out. Pascal Herro attempts a Midrange. Contested by Immanuel Middleton (5.2 feet, ZONE). Pascal Herro misses. Offensive rebound by RJ Nowitzki! RJ Nowitzki kicks it out.

[02:21] Team_012 possession (Score: 64-64)
Pascal Herro makes the Dunk and draws the foul on Evan Carter! And-1! Pascal Herro to the line for 1. [BONUS: 7 team fouls] (Evan Carter: 3 personal fouls)   FT 1/1: GOOD Pascal Herro makes 1/1 from the line.
Score: 64-67

[02:11] Team_095 possession (Score: 64-67)
Shaquille Ball attempts a Midrange. Contested by RJ Nowitzki (3.7 feet, MAN). SHAQUILLE BALL MAKES IT! Assist: Immanuel Middleton
Score: 66-67

[01:52] Team_012 possession (Score: 66-67)
RJ Nowitzki drives, Shaquille Ball stays with him. RJ Nowitzki attempts a Dunk. Contested by Shaquille Ball (4.9 feet, MAN). RJ Nowitzki misses. Rebound secured by Dejounte Hyland.

[01:38] Team_095 possession (Score: 66-67)
FOUL! Reach-in foul on Paolo Durant during the drive. [IN THE BONUS! 6 team fouls] Kyrie Ming to the line for 2 free throws. (Paolo Durant: 3 personal fouls)   FT 1/2: GOOD   FT 2/2: GOOD Kyrie Ming makes 2/2 from the line.
Score: 68-67

[01:25] Team_012 possession (Score: 68-67)
Shaquille Booker attempts a 3Pt. Contested by Evan Carter (4.2 feet, ZONE). Shaquille Booker misses. Offensive rebound by RJ Nowitzki! RJ Nowitzki kicks it out.

[01:15] Team_012 possession (Score: 68-67)
Paolo Durant drives to the basket... Paolo Durant throws a bad pass out of bounds! TURNOVER! (dead ball)

[01:15] Substitution (Team_095): Dejounte Hyland OUT → Kyle Poole IN (stamina_rule2)

[01:15] Substitution (Team_095): Shaquille Ball OUT → Cade Beal IN (stamina_rule2)

[01:15] Substitution (Team_095): Evan Carter OUT → Tobias Wagner IN (stamina_rule2)

[01:15] Substitution (Team_095): Immanuel Middleton OUT → Gary Davis IN (stamina_rule2)

[01:15] Substitution (Team_095): Kyrie Ming OUT → DeMar McCollum IN (stamina_rule2)

[01:15] Substitution (Team_012): Pascal Herro OUT → Desmond Irving IN (stamina_rule2)

[01:15] Substitution (Team_012): RJ Nowitzki OUT → Jalen Barnes IN (stamina_rule2)

[01:15] Substitution (Team_012): Shaquille Booker OUT → Domantas Bird IN (stamina_rule2)

[01:15] Substitution (Team_012): Paolo Durant OUT → Jimmy Quickley IN (stamina_rule2)

[01:15] Substitution (Team_012): Ayo McGrady OUT → Karl Young IN (stamina_rule2)

[01:01] Team_095 possession (Score: 68-67)
Gary Davis attempts a 3Pt. Contested by Jimmy Quickley (4.7 feet, MAN). Gary Davis misses. Rebound secured by Karl Young.

[00:44] Team_012 possession (Score: 68-67)
Jimmy Quickley makes the Layup and draws the foul on Gary Davis! And-1! Jimmy Quickley to the line for 1. [BONUS: 8 team fouls] (Gary Davis: 1 personal fouls)   FT 1/1: MISS Jimmy Quickley makes 0/1 from the line. Rebound secured by DeMar McCollum.
Score: 68-69

[00:30] Team_095 possession (Score: 68-69)
Gary Davis attempts a Layup. BLOCKED BY JIMMY QUICKLEY! Ball is loose! Rebound secured by Jalen Barnes.

[00:13] Team_012 possession (Score: 68-69)
Karl Young attempts a Midrange. Contested by Kyle Poole (4.8 feet, ZONE). Karl Young misses. Rebound secured by Gary Davis.

================================================================================
                              3RD QUARTER COMPLETE                              
================================================================================

3RD QUARTER SCORE: Team_095 16, Team_012 27

BOX SCORE:
================================================================================

Team_095
--------------------------------------------------------------------------------
Player                MIN  PTS  REB  AST  TO      FG   FG%      3P   3P%
--------------------------------------------------------------------------------
Immanuel Middleton     24    8    0    1   0   4/6    66.7     0/0   0.0
Kyrie Ming             24    4    0    0   0   2/2   100.0     0/0   0.0
Shaquille Ball         24    2    1    0   0   1/7    14.3     0/0   0.0
Evan Carter            24    2    2    1   0   1/2    50.0     0/0   0.0
Dejounte Hyland        24    0    6    0   0   0/1     0.0     0/0   0.0
Gary Davis             12    0    1    0   0   0/2     0.0     0/0   0.0
DeMar McCollum         12    0    1    0   0   0/0     0.0     0/0   0.0

TEAM: FG: 8/20 (40.0%), 3PT: 0/8 (0.0%), REB: 12 (3 off, 9 def), AST: 2, TO: 3
TEAM FOULS: 8 [Team_012 in BONUS]


Team_012
--------------------------------------------------------------------------------
Player                MIN  PTS  REB  AST  TO      FG   FG%      3P   3P%
--------------------------------------------------------------------------------
Pascal Herro           24    8    0    0   0   3/4    75.0     0/0   0.0
Paolo Durant           24    7    8    1   0   3/4    75.0     0/0   0.0
RJ Nowitzki            24    6    3    1   0   2/4    50.0     0/0   0.0
Ayo McGrady            24    4    2    0   0   2/2   100.0     0/0   0.0
Shaquille Booker       24    0    0    0   0   0/3     0.0     0/0   0.0
Karl Young             12    0    1    0   0   0/1     0.0     0/0   0.0
Jimmy Quickley         12    0    0    0   0   0/1     0.0     0/0   0.0
Jalen Barnes           12    0    1    0   0   0/0     0.0     0/0   0.0

TEAM: FG: 10/19 (52.6%), 3PT: 1/2 (50.0%), REB: 14 (3 off, 11 def), AST: 2, TO: 4
TEAM FOULS: 6 [Team_095 in BONUS]

================================================================================

================================================================================
                       4TH QUARTER - Team_095 vs Team_012                       
================================================================================

[12:00] Team_095 possession (Score: 68-69)
Dejounte Hyland attempts a Layup. Contested by Pascal Herro (5.1 feet, MAN). DEJOUNTE HYLAND MAKES IT! Assist: Shaquille Ball
Score: 70-69

[11:45] Team_012 possession (Score: 70-69)
Paolo Durant drives, picks up Immanuel Middleton. Help arrives from Dejounte Hyland! Paolo Durant attempts a Dunk. Contested by Dejounte Hyland (5.2 feet, ZONE). PAOLO DURANT MAKES IT!
Score: 70-71

[11:31] Team_095 possession (Score: 70-71)
Shaquille Ball attempts a 3Pt. Contested by RJ Nowitzki (3.6 feet, ZONE). SHAQUILLE BALL MAKES IT! Assist: Dejounte Hyland
Score: 73-71

[11:14] Team_012 possession (Score: 73-71)
Shaquille Booker attempts a 3Pt. Contested by Immanuel Middleton (5.1 feet, ZONE). SHAQUILLE BOOKER MAKES IT! Assist: Ayo McGrady
Score: 73-74

[10:58] Team_095 possession (Score: 73-74)
Kyrie Ming attempts a Midrange. Contested by Ayo McGrady (4.7 feet, MAN). Kyrie Ming misses. Rebound secured by RJ Nowitzki.

[10:44] Team_012 possession (Score: 73-74)
RJ Nowitzki drives and kicks out. Shaquille Booker attempts a 3Pt. Contested by Evan Carter (4.1 feet, MAN). Shaquille Booker misses. Rebound secured by Evan Carter.

[10:30] Team_095 possession (Score: 73-74)
Evan Carter attempts a Midrange. Contested by Paolo Durant (4.0 feet, ZONE). EVAN CARTER MAKES IT!
Score: 75-74

[10:12] Team_012 possession (Score: 75-74)
Shaquille Booker drives and kicks out. FOUL! Shooting foul on Shaquille Ball. RJ Nowitzki to the line for 2 free throws. [Team fouls: 1] (Shaquille Ball: 1 personal fouls)   FT 1/2: GOOD   FT 2/2: GOOD RJ Nowitzki makes 2/2 from the line.
Score: 75-76

[10:00] Team_095 possession (Score: 75-76)
Evan Carter makes the Layup and draws the foul on Paolo Durant! And-1! Evan Carter to the line for 1. [Team fouls: 1] (Paolo Durant: 1 personal fouls)   FT 1/1: GOOD Evan Carter makes 1/1 from the line.
Score: 78-76

[09:45] Team_012 possession (Score: 78-76)
RJ Nowitzki makes the Dunk and draws the foul on Shaquille Ball! And-1! RJ Nowitzki to the line for 1. [Team fouls: 2] (Shaquille Ball: 2 personal fouls)   FT 1/1: GOOD RJ Nowitzki makes 1/1 from the line.
Score: 78-79

[09:26] Team_095 possession (Score: 78-79)
Shaquille Ball attempts a Midrange. Contested by RJ Nowitzki (3.8 feet, MAN). Shaquille Ball misses. Rebound secured by Paolo Durant.

[09:16] Team_012 possession (Score: 78-79)
RJ Nowitzki attempts a Midrange. Contested by Evan Carter (4.6 feet, ZONE). RJ Nowitzki misses. Rebound secured by Shaquille Ball.

[09:05] Team_095 possession (Score: 78-79)
Kyrie Ming attempts a Midrange. Contested by Ayo McGrady (4.9 feet, MAN). KYRIE MING MAKES IT!
Score: 80-79

[08:50] Team_012 possession (Score: 80-79)
Ayo McGrady attempts a Midrange. Contested by Evan Carter (4.3 feet, ZONE). Ayo McGrady misses. Rebound secured by Shaquille Ball.

[08:39] Team_095 possession (Score: 80-79)
Immanuel Middleton attempts a 3Pt. Contested by RJ Nowitzki (3.9 feet, ZONE). IMMANUEL MIDDLETON MAKES IT! Assist: Dejounte Hyland
Score: 83-79

[08:21] Team_012 possession (Score: 83-79)
Ayo McGrady drives and kicks out. Shaquille Booker attempts a 3Pt. Contested by Evan Carter (4.4 feet, ZONE). Shaquille Booker misses. Rebound secured by Evan Carter.

[08:05] Team_095 possession (Score: 83-79)
Shaquille Ball attempts a Midrange. BLOCKED BY RJ NOWITZKI! Ball is loose! Rebound secured by RJ Nowitzki.

[07:52] Team_012 possession (Score: 83-79)
Paolo Durant drives to the basket... Paolo Durant throws a bad pass! Stolen by Immanuel Middleton! TURNOVER! (live ball)

[07:36] Team_095 possession (Score: 83-79)
Shaquille Ball attempts a Midrange. Contested by Ayo McGrady (4.9 feet, ZONE). Shaquille Ball misses. Rebound secured by Paolo Durant.

[07:24] Team_012 possession (Score: 83-79)
Ayo McGrady drives and kicks out. Pascal Herro attempts a 3Pt. Contested by Evan Carter (4.6 feet, ZONE). Pascal Herro misses. Rebound secured by Evan Carter.

[07:11] Team_095 possession (Score: 83-79)
Immanuel Middleton drives, Paolo Durant stays with him. Immanuel Middleton attempts a Dunk. Contested by Paolo Durant (4.2 feet, ZONE). Immanuel Middleton misses. Offensive rebound by Shaquille Ball! Shaquille Ball kicks it out.

[06:58] Team_095 possession (Score: 83-79)
Dejounte Hyland attempts a Midrange. Contested by Shaquille Booker (4.7 feet, ZONE). DEJOUNTE HYLAND MAKES IT! Assist: Immanuel Middleton
Score: 85-79

[06:42] Team_012 possession (Score: 85-79)
Paolo Durant attempts a Layup. Contested by Immanuel Middleton (5.8 feet, MAN). Paolo Durant misses. Rebound secured by Dejounte Hyland.

[06:25] Team_095 possession (Score: 85-79)
Kyrie Ming drives and kicks out. Kyrie Ming attempts a 3Pt. Contested by Ayo McGrady (5.1 feet, MAN). KYRIE MING MAKES IT! Assist: Evan Carter
Score: 88-79

[06:11] Team_012 possession (Score: 88-79)
Pascal Herro attempts a 3Pt. Wide open! Dejounte Hyland is 6.1 feet away. [MAN] Pascal Herro misses. Rebound secured by Shaquille Ball.

[05:54] Team_095 possession (Score: 88-79)
Immanuel Middleton attempts a 3Pt. Contested by RJ Nowitzki (4.3 feet, ZONE). IMMANUEL MIDDLETON MAKES IT! Assist: Kyrie Ming
Score: 91-79

[05:39] Team_012 possession (Score: 91-79)
Paolo Durant attempts a 3Pt. Contested by Immanuel Middleton (5.9 feet, MAN). PAOLO DURANT MAKES IT! Assist: Shaquille Booker
Score: 91-82

[05:25] Team_095 possession (Score: 91-82)
Shaquille Ball drives, Paolo Durant stays with him. Shaquille Ball attempts a Layup. Contested by Paolo Durant (4.5 feet, ZONE). Shaquille Ball misses. Rebound secured by RJ Nowitzki.

[05:10] Team_012 possession (Score: 91-82)
Ayo McGrady attempts a Layup. Contested by Immanuel Middleton (5.9 feet, ZONE). AYO MCGRADY MAKES IT! Assist: Paolo Durant
Score: 91-84

[04:56] Team_095 possession (Score: 91-84)
Immanuel Middleton attempts a 3Pt. Contested by RJ Nowitzki (4.4 feet, ZONE). Immanuel Middleton misses. Offensive rebound by Shaquille Ball! Shaquille Ball kicks it out.

[04:42] Team_095 possession (Score: 91-84)
Dejounte Hyland attempts a Midrange. Contested by RJ Nowitzki (4.5 feet, ZONE). Dejounte Hyland misses. Offensive rebound by Evan Carter! Evan Carter kicks it out.

[04:27] Team_095 possession (Score: 91-84)
Dejounte Hyland attempts a 3Pt. Contested by RJ Nowitzki (4.5 feet, ZONE). Dejounte Hyland misses. Rebound secured by Ayo McGrady.

[04:13] Team_012 possession (Score: 91-84)
Ayo McGrady drives, Kyrie Ming stays with him. Ayo McGrady attempts a Layup. Wide open! Kyrie Ming is 6.1 feet away. [MAN] AYO MCGRADY MAKES IT! Assist: Pascal Herro
Score: 91-86

[04:01] Team_095 possession (Score: 91-86)
Dejounte Hyland attempts a Layup. Wide open! Pascal Herro is 6.1 feet away. [MAN] Dejounte Hyland misses. Rebound secured by Paolo Durant.

[03:48] Team_012 possession (Score: 91-86)
Paolo Durant attempts a 3Pt. Wide open! Dejounte Hyland is 6.0 feet away. [ZONE] PAOLO DURANT MAKES IT! Assist: Shaquille Booker
Score: 91-89

[03:31] Team_095 possession (Score: 91-89)
Immanuel Middleton drives, Paolo Durant stays with him. Immanuel Middleton attempts a Dunk. Contested by Paolo Durant (4.7 feet, MAN). IMMANUEL MIDDLETON MAKES IT!
Score: 93-89

[03:15] Team_012 possession (Score: 93-89)
Pascal Herro attempts a 3Pt. Wide open! Immanuel Middleton is 6.6 feet away. [ZONE] Pascal Herro misses. Rebound secured by Evan Carter.

[03:02] Team_095 possession (Score: 93-89)
Immanuel Middleton attempts a Midrange. Contested by Shaquille Booker (5.2 feet, ZONE). IMMANUEL MIDDLETON MAKES IT! Assist: Evan Carter
Score: 95-89

[02:47] Team_012 possession (Score: 95-89)
Paolo Durant drives, Immanuel Middleton stays with him. Paolo Durant attempts a Layup. Wide open! Immanuel Middleton is 6.3 feet away. [MAN] PAOLO DURANT MAKES IT! Assist: Shaquille Booker
Score: 95-91

[02:31] Team_095 possession (Score: 95-91)
Dejounte Hyland attempts a 3Pt. Wide open! Pascal Herro is 6.3 feet away. [MAN] Dejounte Hyland misses. Rebound secured by RJ Nowitzki.

[02:17] Team_012 possession (Score: 95-91)
Ayo McGrady attempts a Midrange. Contested by Evan Carter (5.2 feet, ZONE). AYO MCGRADY MAKES IT! Assist: Pascal Herro
Score: 95-93

[02:05] Team_095 possession (Score: 95-93)
FOUL! Holding foul on Paolo Durant. [Team fouls: 2] No free throws, side out. (Paolo Durant: 2 personal fouls)

[01:51] Team_095 possession (Score: 95-93)
Shaquille Ball attempts a Layup. Contested by RJ Nowitzki (5.0 feet, MAN). SHAQUILLE BALL MAKES IT! Assist: Evan Carter
Score: 97-93

[01:36] Team_012 possession (Score: 97-93)
Paolo Durant drives and kicks out. Paolo Durant attempts a Midrange. Contested by Shaquille Ball (5.8 feet, ZONE). PAOLO DURANT MAKES IT! Assist: Pascal Herro
Score: 97-95

[01:23] Team_095 possession (Score: 97-95)
Evan Carter attempts a Midrange. Contested by Shaquille Booker (5.7 feet, MAN). Evan Carter misses. Rebound secured by Paolo Durant.

[01:12] Team_012 possession (Score: 97-95)
RJ Nowitzki drives and kicks out. Shaquille Booker attempts a Midrange. Contested by Evan Carter (5.6 feet, ZONE). SHAQUILLE BOOKER MAKES IT! Assist: Paolo Durant
Score: 97-97

[00:59] Team_095 possession (Score: 97-97)
FOUL! Holding foul on Pascal Herro. [Team fouls: 3] No free throws, side out. (Pascal Herro: 1 personal fouls)

[00:43] Team_095 possession (Score: 97-97)
Evan Carter attempts a Midrange. Contested by Paolo Durant (5.4 feet, ZONE). EVAN CARTER MAKES IT! Assist: Kyrie Ming
Score: 99-97

[00:28] Team_012 possession (Score: 99-97)
RJ Nowitzki drives, Immanuel Middleton stays with him. RJ Nowitzki attempts a Dunk. Wide open! Immanuel Middleton is 6.8 feet away. [ZONE] RJ Nowitzki misses. Rebound secured by Evan Carter.

[00:16] Team_095 possession (Score: 99-97)
Shaquille Ball attempts a Midrange. Contested by Paolo Durant (5.4 feet, ZONE). Shaquille Ball misses. Rebound secured by Paolo Durant.

================================================================================
                              4TH QUARTER COMPLETE                              
================================================================================

4TH QUARTER SCORE: Team_095 31, Team_012 28

BOX SCORE:
================================================================================

Team_095
--------------------------------------------------------------------------------
Player                MIN  PTS  REB  AST  TO      FG   FG%      3P   3P%
--------------------------------------------------------------------------------
Immanuel Middleton     36   10    0    1   0   4/4   100.0     0/0   0.0
Evan Carter            36    7    6    3   0   3/4    75.0     0/0   0.0
Shaquille Ball         36    5    5    1   0   2/7    28.6     0/0   0.0
Kyrie Ming             36    5    0    2   0   2/3    66.7     0/0   0.0
Dejounte Hyland        36    4    1    2   0   2/5    40.0     0/0   0.0

TEAM: FG: 13/23 (56.5%), 3PT: 3/5 (60.0%), REB: 12 (3 off, 9 def), AST: 9, TO: 0
TEAM FOULS: 2


Team_012
--------------------------------------------------------------------------------
Player                MIN  PTS  REB  AST  TO      FG   FG%      3P   3P%
--------------------------------------------------------------------------------
Paolo Durant           36   12    5    2   0   5/6    83.3     0/0   0.0
Ayo McGrady            36    6    1    1   0   3/6    50.0     0/0   0.0
Shaquille Booker       36    5    0    3   0   2/2   100.0     0/0   0.0
RJ Nowitzki            36    5    4    0   0   2/5    40.0     0/0   0.0
Pascal Herro           36    0    0    3   0   0/2     0.0     0/0   0.0

TEAM: FG: 12/21 (57.1%), 3PT: 3/5 (60.0%), REB: 10 (0 off, 10 def), AST: 9, TO: 1
TEAM FOULS: 3

================================================================================

================================================================================
                               FULL GAME COMPLETE                               
================================================================================

FINAL SCORE: Team_095 99, Team_012 97

SCORING BY QUARTER:
--------------------------------------------------------------------------------
Team                     Q1     Q2     Q3     Q4    FINAL
--------------------------------------------------------------------------------
Team_095                 23     29     16     31       99
Team_012                 18     24     27     28       97
--------------------------------------------------------------------------------

FULL GAME BOX SCORE:
================================================================================

Team_095
--------------------------------------------------------------------------------
Player                MIN  PTS  REB  AST  TO      FG   FG%      3P   3P%      FT STL BLK
--------------------------------------------------------------------------------
Dejounte Hyland        36    7   11    3   1   3/11   27.3   1/6    16.7   0/0     0   1
Shaquille Ball         36   15   12    6   0   7/18   38.9   3/7    42.9   3/3     0   0
Evan Carter            36   11   14    4   1   4/9    44.4   0/2     0.0   1/1     0   0
Immanuel Middleton     36   25    0    3   0  12/20   60.0   3/7    42.9   4/4     1   1
Kyrie Ming             36   17    0    2   1   6/9    66.7   0/0     0.0   3/3     0   0
Kyle Poole             12    5    0    1   0   2/3    66.7   1/1   100.0   0/0     0   0
Cade Beal              12   10    0    1   1   2/4    50.0   0/0     0.0   3/3     0   0
Tobias Wagner          12    7    5    0   0   3/3   100.0   0/0     0.0   3/3     0   0
Gary Davis             12    2    5    1   0   1/6    16.7   0/1     0.0   0/0     1   0
DeMar McCollum         12    0    5    2   0   1/2    50.0   0/0     0.0   0/0     0   0

TEAM: FG: 42/86 (48.8%), 3PT: 8/24 (33.3%), REB: 52 (13 off, 39 def), AST: 23, TO: 4


Team_012
--------------------------------------------------------------------------------
Player                MIN  PTS  REB  AST  TO      FG   FG%      3P   3P%      FT STL BLK
--------------------------------------------------------------------------------
Pascal Herro           36   10    0    4   4   5/15   33.3   0/7     0.0   4/4     1   0
RJ Nowitzki            36   16   13    1   1   7/14   50.0   1/2    50.0   5/5     0   2
Shaquille Booker       36   10    0    3   0   4/10   40.0   1/2    50.0   1/1     1   0
Paolo Durant           36   22   18    4   2   7/9    77.8   2/2   100.0   4/4     0   0
Ayo McGrady            36   18    8    3   1   8/13   61.5   0/1     0.0   2/2     0   0
Desmond Irving         12    2    0    0   0   1/2    50.0   0/0     0.0   0/0     0   0
Jalen Barnes           12    3    5    1   0   1/3    33.3   0/0     0.0   1/1     0   1
Domantas Bird          12    3    0    3   0   0/4     0.0   0/1     0.0   0/0     0   0
Jimmy Quickley         12    5    2    1   1   3/5    60.0   1/1   100.0   0/1     0   1
Karl Young             12    6    3    0   0   3/4    75.0   0/0     0.0   0/0     0   0

TEAM: FG: 39/79 (49.4%), 3PT: 5/16 (31.2%), REB: 49 (6 off, 43 def), AST: 20, TO: 9

================================================================================
