================================================================================
                        FULL GAME - Team_075 vs Team_041                        
================================================================================

================================================================================
                       1ST QUARTER - Team_075 vs Team_041                       
================================================================================

[12:00] Team_075 possession (Score: 0-0)
Klay Jokic drives, Terry Barrett stays with him. Klay Jokic attempts a Layup. Contested by Terry Barrett (3.7 feet, ZONE). KLAY JOKIC MAKES IT! Assist: Myles Barrett
Score: 2-0

[11:44] Team_041 possession (Score: 2-0)
Jarrett Anunoby attempts a 3Pt. Contested by Larry McCollum (4.8 feet, ZONE). Jarrett Anunoby misses. Rebound secured by Kawhi Ingram.

[11:28] Team_075 possession (Score: 2-0)
Klay Jokic attempts a 3Pt. Contested by Scottie Turner (4.6 feet, ZONE). Klay Jokic misses. Rebound secured by Terry Barrett.

[11:12] Team_041 possession (Score: 2-0)
Scottie Turner attempts a 3Pt. Contested by Larry McCollum (4.1 feet, MAN). Scottie Turner misses. Rebound secured by Klay Jokic.

[10:56] Team_075 possession (Score: 2-0)
Myles Barrett attempts a Midrange. Contested by Dejounte Griffin (4.1 feet, ZONE). Myles Barrett misses. FOUL! Loose ball foul on Stephen Ingram during the rebound battle. [Team fouls: 1] No free throws, side out. (Stephen Ingram: 1 personal fouls)

[10:42] Team_075 possession (Score: 2-0)
Larry McCollum drives, picks up Stephen Ingram. Help arrives from Jarrett Anunoby! Larry McCollum attempts a Dunk. Contested by Jarrett Anunoby (4.4 feet, ZONE). LARRY MCCOLLUM MAKES IT! Assist: Klay Jokic
Score: 4-0

[10:29] Team_041 possession (Score: 4-0)
Jarrett Anunoby drives and kicks out. Jarrett Anunoby attempts a Midrange. Contested by Kawhi Ingram (4.0 feet, MAN). Jarrett Anunoby misses. Rebound secured by Klay Jokic.

[10:16] Team_075 possession (Score: 4-0)
Klay Jokic drives, picks up Terry Barrett. Help arrives from Jarrett Anunoby! Klay Jokic attempts a Layup. Contested by Jarrett Anunoby (3.7 feet, MAN). Klay Jokic misses. Offensive rebound by Kawhi Ingram! Kawhi Ingram kicks it out.

[09:58] Team_075 possession (Score: 4-0)
Derrick Stewart drives to the basket... Derrick Stewart throws a bad pass out of bounds! TURNOVER! (dead ball)

[09:40] Team_041 possession (Score: 4-0)
Dejounte Griffin loses the ball! Stripped by Myles Barrett! TURNOVER! (live ball)

[09:26] Team_075 possession (Score: 4-0)
Kawhi Ingram drives, Stephen Ingram stays with him. Kawhi Ingram attempts a Dunk. Contested by Stephen Ingram (4.1 feet, ZONE). KAWHI INGRAM MAKES IT!
Score: 6-0

[09:10] Team_041 possession (Score: 6-0)
Jarrett Anunoby throws a bad pass out of bounds! TURNOVER! (dead ball)

[08:55] Team_075 possession (Score: 6-0)
Derrick Stewart attempts a Midrange. Contested by Stephen Ingram (4.2 feet, MAN). Derrick Stewart misses. Offensive rebound by Derrick Stewart! Derrick Stewart kicks it out.

[08:44] Team_075 possession (Score: 6-0)
Myles Barrett attempts a Layup. Contested by Terry Barrett (3.5 feet, ZONE). MYLES BARRETT MAKES IT!
Score: 8-0

[08:34] Team_041 possession (Score: 8-0)
Jarrett Anunoby attempts a Midrange. Contested by Kawhi Ingram (4.5 feet, MAN). Jarrett Anunoby misses. Rebound secured by Kawhi Ingram.

[08:21] Team_075 possession (Score: 8-0)
Myles Barrett drives, Dejounte Griffin stays with him. Myles Barrett attempts a Layup. Contested by Dejounte Griffin (4.1 feet, MAN). MYLES BARRETT MAKES IT! Assist: Klay Jokic
Score: 10-0

[08:07] Team_041 possession (Score: 10-0)
Stephen Ingram drives and kicks out. Scottie Turner attempts a 3Pt. Contested by Larry McCollum (4.2 feet, MAN). Scottie Turner misses. Rebound secured by Kawhi Ingram.

[07:55] Team_075 possession (Score: 10-0)
Klay Jokic attempts a Midrange. Contested by Terry Barrett (3.7 feet, MAN). Klay Jokic misses. Rebound secured by Stephen Ingram.

[07:43] Team_041 possession (Score: 10-0)
Stephen Ingram drives and kicks out. Dejounte Griffin attempts a 3Pt. Contested by Larry McCollum (4.2 feet, ZONE). Dejounte Griffin misses. Rebound secured by Kawhi Ingram.

[07:24] Team_075 possession (Score: 10-0)
Larry McCollum attempts a Layup. Contested by Scottie Turner (4.2 feet, MAN). LARRY MCCOLLUM MAKES IT! Assist: Klay Jokic
Score: 12-0

[07:10] Team_041 possession (Score: 12-0)
Stephen Ingram attempts a Midrange. Contested by Derrick Stewart (4.6 feet, ZONE). STEPHEN INGRAM MAKES IT! Assist: Terry Barrett
Score: 12-2

[06:54] Team_075 possession (Score: 12-2)
FOUL! Reach-in foul on Terry Barrett during the drive. [Team fouls: 2] No free throws, side out. (Terry Barrett: 1 personal fouls)

[06:40] Team_075 possession (Score: 12-2)
Kawhi Ingram attempts a 3Pt. Contested by Scottie Turner (3.9 feet, ZONE). Kawhi Ingram misses. Offensive rebound by Kawhi Ingram! Kawhi Ingram kicks it out.

[06:25] Team_075 possession (Score: 12-2)
Klay Jokic drives and kicks out. Kawhi Ingram attempts a Midrange. Contested by Jarrett Anunoby (4.2 feet, MAN). Kawhi Ingram misses. Rebound secured by Dejounte Griffin.

[06:10] Team_041 possession (Score: 12-2)
Dejounte Griffin attempts a 3Pt. Contested by Myles Barrett (5.9 feet, MAN). Dejounte Griffin misses. Rebound secured by Kawhi Ingram.

[05:56] Team_075 possession (Score: 12-2)
Kawhi Ingram attempts a Midrange. Contested by Dejounte Griffin (3.7 feet, ZONE). Kawhi Ingram misses. Rebound secured by Stephen Ingram.

[05:45] Team_041 possession (Score: 12-2)
Dejounte Griffin attempts a 3Pt. Contested by Myles Barrett (5.9 feet, MAN). Dejounte Griffin misses. Offensive rebound by Terry Barrett! Terry Barrett puts it back in!
Score: 12-4

[05:33] Team_075 possession (Score: 12-4)
Klay Jokic attempts a 3Pt. Contested by Scottie Turner (4.6 feet, ZONE). Klay Jokic misses. Rebound secured by Stephen Ingram.

[05:23] Team_041 possession (Score: 12-4)
FOUL! Holding foul on Klay Jokic. [Team fouls: 1] No free throws, side out. (Klay Jokic: 1 personal fouls)

[05:10] Team_041 possession (Score: 12-4)
Scottie Turner attempts a 3Pt. Contested by Larry McCollum (4.1 feet, ZONE). Scottie Turner misses. Rebound secured by Klay Jokic.

[04:56] Team_075 possession (Score: 12-4)
Derrick Stewart attempts a Layup. Contested by Terry Barrett (3.2 feet, ZONE). DERRICK STEWART MAKES IT! Assist: Myles Barrett
Score: 14-4

[04:39] Team_041 possession (Score: 14-4)
Stephen Ingram attempts a 3Pt. Contested by Derrick Stewart (4.7 feet, MAN). Stephen Ingram misses. Offensive rebound by Stephen Ingram! Stephen Ingram kicks it out.

[04:25] Team_041 possession (Score: 14-4)
Dejounte Griffin attempts a Layup. Wide open! Myles Barrett is 6.0 feet away. [MAN] DEJOUNTE GRIFFIN MAKES IT! Assist: Stephen Ingram
Score: 14-6

[04:11] Team_075 possession (Score: 14-6)
Kawhi Ingram attempts a 3Pt. Contested by Jarrett Anunoby (4.2 feet, MAN). KAWHI INGRAM MAKES IT! Assist: Klay Jokic
Score: 17-6

[03:56] Team_041 possession (Score: 17-6)
Stephen Ingram attempts a 3Pt. Contested by Larry McCollum (4.5 feet, ZONE). Stephen Ingram misses. Offensive rebound by Terry Barrett! Terry Barrett puts it back in!
Score: 17-8

[03:42] Team_075 possession (Score: 17-8)
Klay Jokic attempts a Midrange. Contested by Jarrett Anunoby (4.9 feet, ZONE). KLAY JOKIC MAKES IT! Assist: Larry McCollum
Score: 19-8

[03:30] Team_041 possession (Score: 19-8)
Terry Barrett attempts a Layup. Contested by Klay Jokic (5.7 feet, MAN). TERRY BARRETT MAKES IT! Assist: Jarrett Anunoby
Score: 19-10

[03:19] Team_075 possession (Score: 19-10)
Larry McCollum attempts a Layup. BLOCKED BY SCOTTIE TURNER! Ball deflects out of bounds off Larry McCollum.

[03:06] Team_041 possession (Score: 19-10)
Stephen Ingram attempts a 3Pt. Contested by Larry McCollum (4.6 feet, ZONE). STEPHEN INGRAM MAKES IT! Assist: Terry Barrett
Score: 19-13

[02:54] Team_075 possession (Score: 19-13)
Kawhi Ingram attempts a Layup. Contested by Terry Barrett (3.3 feet, ZONE). KAWHI INGRAM MAKES IT! Assist: Klay Jokic
Score: 21-13

[02:38] Team_041 possession (Score: 21-13)
Stephen Ingram attempts a Midrange. Contested by Derrick Stewart (4.9 feet, MAN). STEPHEN INGRAM MAKES IT!
Score: 21-15

[02:20] Team_075 possession (Score: 21-15)
Derrick Stewart throws a bad pass! Stolen by Stephen Ingram! TURNOVER! (live ball)

[02:07] Team_041 possession (Score: 21-15)
FOUL! Shooting foul on Larry McCollum. Dejounte Griffin to the line for 3 free throws. [Team fouls: 2] (Larry McCollum: 1 personal fouls)   FT 1/3: MISS   FT 2/3: MISS   FT 3/3: GOOD Dejounte Griffin makes 1/3 from the line.
Score: 21-16

[01:50] Team_075 possession (Score: 21-16)
Derrick Stewart drives to the basket... Derrick Stewart loses control! Ball rolls out of bounds! TURNOVER! (dead ball)

[01:50] Substitution (Team_075): Larry McCollum OUT → D'Angelo Anunoby IN (stamina_rule2)

[01:50] Substitution (Team_075): Kawhi Ingram OUT → LeBron Ginobili IN (stamina_rule2)

[01:50] Substitution (Team_075): Myles Barrett OUT → Donovan Paul IN (stamina_rule2)

[01:50] Substitution (Team_075): Derrick Stewart OUT → Collin Duncan IN (stamina_rule2)

[01:50] Substitution (Team_075): Klay Jokic OUT → Kevin Towns IN (stamina_rule2)

[01:50] Substitution (Team_041): Scottie Turner OUT → Franz Rose IN (stamina_rule2)

[01:50] Substitution (Team_041): Jarrett Anunoby OUT → Kyrie Booker IN (stamina_rule2)

[01:50] Substitution (Team_041): Dejounte Griffin OUT → Bam McCollum IN (stamina_rule2)

[01:50] Substitution (Team_041): Stephen Ingram OUT → Tobias McCollum IN (stamina_rule2)

[01:50] Substitution (Team_041): Terry Barrett OUT → De'Aaron Poole IN (stamina_rule2)

[01:35] Team_041 possession (Score: 21-16)
FOUL! Shooting foul on LeBron Ginobili. Kyrie Booker to the line for 3 free throws. [Team fouls: 3] (LeBron Ginobili: 1 personal fouls)   FT 1/3: GOOD   FT 2/3: MISS   FT 3/3: GOOD Kyrie Booker makes 2/3 from the line.
Score: 21-18

[01:23] Team_075 possession (Score: 21-18)
Kevin Towns drives to the basket... Kevin Towns throws a bad pass! Stolen by De'Aaron Poole! TURNOVER! (live ball)

[01:09] Team_041 possession (Score: 21-18)
FOUL! Shooting foul on D'Angelo Anunoby. Franz Rose to the line for 2 free throws. [Team fouls: 4] (D'Angelo Anunoby: 1 personal fouls)   FT 1/2: GOOD   FT 2/2: GOOD Franz Rose makes 2/2 from the line.
Score: 21-20

[00:55] Team_075 possession (Score: 21-20)
LeBron Ginobili attempts a 3Pt. Contested by Kyrie Booker (4.4 feet, MAN). LEBRON GINOBILI MAKES IT! Assist: Donovan Paul
Score: 24-20

[00:45] Team_041 possession (Score: 24-20)
De'Aaron Poole attempts a Layup. Contested by Kevin Towns (5.4 feet, MAN). De'Aaron Poole misses. Rebound secured by Collin Duncan.

[00:29] Team_075 possession (Score: 24-20)
LeBron Ginobili attempts a 3Pt. Contested by Kyrie Booker (4.4 feet, ZONE). LeBron Ginobili misses. Rebound secured by Kyrie Booker.

[00:13] Team_041 possession (Score: 24-20)
Kyrie Booker drives and kicks out. De'Aaron Poole attempts a Midrange. Contested by Kevin Towns (5.4 feet, MAN). DE'AARON POOLE MAKES IT!
Score: 24-22

================================================================================
                              1ST QUARTER COMPLETE                              
================================================================================

1ST QUARTER SCORE: Team_075 24, Team_041 22

BOX SCORE:
================================================================================

Team_075
--------------------------------------------------------------------------------
Player                MIN  PTS  REB  AST  TO      FG   FG%      3P   3P%
--------------------------------------------------------------------------------
Kawhi Ingram           10    7    8    0   0   3/4    75.0     0/0   0.0
Klay Jokic             10    4    3    5   0   2/6    33.3     0/0   0.0
Myles Barrett          10    4    0    2   0   2/2   100.0     0/0   0.0
Larry McCollum         10    4    0    1   0   2/3    66.7     0/0   0.0
LeBron Ginobili         2    3    0    0   0   1/2    50.0     0/0   0.0
Derrick Stewart        10    2    1    0   0   1/1   100.0     0/0   0.0
Donovan Paul            2    0    0    1   0   0/0     0.0     0/0   0.0
Collin Duncan           2    0    1    0   0   0/0     0.0     0/0   0.0

TEAM: FG: 11/18 (61.1%), 3PT: 2/5 (40.0%), REB: 13 (4 off, 9 def), AST: 9, TO: 4
TEAM FOULS: 4


Team_041
--------------------------------------------------------------------------------
Player                MIN  PTS  REB  AST  TO      FG   FG%      3P   3P%
--------------------------------------------------------------------------------
Stephen Ingram         10    7    4    1   0   3/5    60.0     0/0   0.0
Terry Barrett          10    6    3    2   0   3/3   100.0     0/0   0.0
Dejounte Griffin       10    3    1    0   0   2/3    66.7     0/0   0.0
Kyrie Booker            2    2    1    0   0   1/1   100.0     0/0   0.0
Franz Rose              2    2    0    0   0   1/1   100.0     0/0   0.0
De'Aaron Poole          2    2    0    0   0   1/2    50.0     0/0   0.0
Jarrett Anunoby        10    0    0    1   0   0/3     0.0     0/0   0.0
Scottie Turner         10    0    0    0   0   0/2     0.0     0/0   0.0

TEAM: FG: 11/20 (55.0%), 3PT: 5/9 (55.6%), REB: 9 (3 off, 6 def), AST: 4, TO: 2
TEAM FOULS: 2

================================================================================

================================================================================
                       2ND QUARTER - Team_075 vs Team_041                       
================================================================================

[12:00] Team_075 possession (Score: 24-22)
Kawhi Ingram attempts a Layup. Contested by Terry Barrett (3.2 feet, ZONE). KAWHI INGRAM MAKES IT!
Score: 26-22

[11:44] Team_041 possession (Score: 26-22)
Jarrett Anunoby makes the Dunk and draws the foul on Kawhi Ingram! And-1! Jarrett Anunoby to the line for 1. [Team fouls: 1] (Kawhi Ingram: 1 personal fouls)   FT 1/1: GOOD Jarrett Anunoby makes 1/1 from the line.
Score: 26-25

[11:29] Team_075 possession (Score: 26-25)
Derrick Stewart drives, Terry Barrett stays with him. Derrick Stewart attempts a Dunk. Contested by Terry Barrett (3.3 feet, ZONE). Derrick Stewart misses. Rebound secured by Terry Barrett.

[11:17] Team_041 possession (Score: 26-25)
Jarrett Anunoby attempts a 3Pt. Contested by Kawhi Ingram (4.7 feet, MAN). Jarrett Anunoby misses. Offensive rebound by Stephen Ingram! Stephen Ingram kicks it out.

[11:03] Team_041 possession (Score: 26-25)
Jarrett Anunoby attempts a 3Pt. Contested by Kawhi Ingram (4.7 feet, MAN). Jarrett Anunoby misses. Rebound secured by Derrick Stewart.

[10:50] Team_075 possession (Score: 26-25)
Derrick Stewart attempts a Midrange. Contested by Stephen Ingram (4.3 feet, MAN). Derrick Stewart misses. FOUL! Loose ball foul on Terry Barrett during the rebound battle. [Team fouls: 1] No free throws, side out. (Terry Barrett: 1 personal fouls)

[10:34] Team_075 possession (Score: 26-25)
Klay Jokic attempts a Midrange. Contested by Terry Barrett (3.9 feet, MAN). Klay Jokic misses. FOUL! Loose ball foul on Terry Barrett during the rebound battle. [Team fouls: 2] No free throws, side out. (Terry Barrett: 2 personal fouls)

[10:19] Team_075 possession (Score: 26-25)
Derrick Stewart makes the Dunk and draws the foul on Jarrett Anunoby! And-1! Derrick Stewart to the line for 1. [Team fouls: 3] (Jarrett Anunoby: 1 personal fouls)   FT 1/1: GOOD Derrick Stewart makes 1/1 from the line.
Score: 29-25

[10:01] Team_041 possession (Score: 29-25)
Jarrett Anunoby attempts a 3Pt. Contested by Kawhi Ingram (4.8 feet, MAN). Jarrett Anunoby misses. Rebound secured by Kawhi Ingram.

[09:49] Team_075 possession (Score: 29-25)
FOUL! Shooting foul on Terry Barrett. Derrick Stewart to the line for 2 free throws. [Team fouls: 4] (Terry Barrett: 3 personal fouls)   FT 1/2: GOOD   FT 2/2: MISS Derrick Stewart makes 1/2 from the line. Rebound secured by Stephen Ingram.
Score: 30-25

[09:36] Team_041 possession (Score: 30-25)
Dejounte Griffin drives to the basket... Dejounte Griffin throws a bad pass! Stolen by Derrick Stewart! TURNOVER! (live ball)

[09:23] Team_075 possession (Score: 30-25)
Klay Jokic drives, picks up Terry Barrett. Help arrives from Jarrett Anunoby! Klay Jokic attempts a Dunk. Contested by Jarrett Anunoby (4.0 feet, MAN). KLAY JOKIC MAKES IT! Assist: Kawhi Ingram
Score: 32-25

[09:08] Team_041 possession (Score: 32-25)
Scottie Turner attempts a Midrange. Contested by Larry McCollum (4.5 feet, ZONE). Scottie Turner misses. Rebound secured by Klay Jokic.

[08:54] Team_075 possession (Score: 32-25)
FOUL! Reach-in foul on Dejounte Griffin during the drive. [IN THE BONUS! 5 team fouls] Myles Barrett to the line for 2 free throws. (Dejounte Griffin: 1 personal fouls)   FT 1/2: GOOD   FT 2/2: GOOD Myles Barrett makes 2/2 from the line.
Score: 34-25

[08:42] Team_041 possession (Score: 34-25)
Terry Barrett attempts a Layup. Contested by Derrick Stewart (5.1 feet, ZONE). TERRY BARRETT MAKES IT! Assist: Scottie Turner
Score: 34-27

[08:31] Team_075 possession (Score: 34-27)
FOUL! Reach-in foul on Terry Barrett during the drive. [IN THE BONUS! 6 team fouls] Klay Jokic to the line for 2 free throws. (Terry Barrett: 4 personal fouls)   FT 1/2: GOOD   FT 2/2: GOOD Klay Jokic makes 2/2 from the line.
Score: 36-27

[08:16] Team_041 possession (Score: 36-27)
Dejounte Griffin throws a bad pass! Stolen by Myles Barrett! TURNOVER! (live ball)

[08:04] Team_075 possession (Score: 36-27)
Klay Jokic attempts a Layup. Contested by Terry Barrett (4.2 feet, MAN). KLAY JOKIC MAKES IT! Assist: Derrick Stewart
Score: 38-27

[07:46] Team_041 possession (Score: 38-27)
Terry Barrett drives, picks up Klay Jokic. Help arrives from Larry McCollum! Terry Barrett attempts a Dunk. Contested by Larry McCollum (6.0 feet, MAN). Terry Barrett misses. Rebound secured by Klay Jokic.

[07:35] Team_075 possession (Score: 38-27)
Larry McCollum attempts a Layup. Contested by Scottie Turner (4.7 feet, MAN). Larry McCollum misses. Rebound secured by Stephen Ingram.

[07:24] Team_041 possession (Score: 38-27)
Jarrett Anunoby attempts a Midrange. Contested by Kawhi Ingram (5.2 feet, ZONE). JARRETT ANUNOBY MAKES IT! Assist: Stephen Ingram
Score: 38-29

[07:10] Team_075 possession (Score: 38-29)
Larry McCollum attempts a 3Pt. Contested by Scottie Turner (4.8 feet, MAN). Larry McCollum misses. Rebound secured by Terry Barrett.

[06:55] Team_041 possession (Score: 38-29)
Scottie Turner attempts a Midrange. Contested by Larry McCollum (4.8 feet, MAN). Scottie Turner misses. Rebound secured by Kawhi Ingram.

[06:36] Team_075 possession (Score: 38-29)
Derrick Stewart attempts a Layup. Contested by Stephen Ingram (4.7 feet, MAN). DERRICK STEWART MAKES IT! Assist: Myles Barrett
Score: 40-29

[06:23] Team_041 possession (Score: 40-29)
Jarrett Anunoby attempts a 3Pt. Contested by Larry McCollum (5.4 feet, ZONE). Jarrett Anunoby misses. Rebound secured by Derrick Stewart.

[06:10] Team_075 possession (Score: 40-29)
Derrick Stewart attempts a 3Pt. Contested by Scottie Turner (4.7 feet, ZONE). Derrick Stewart misses. Rebound secured by Dejounte Griffin.

[05:54] Team_041 possession (Score: 40-29)
Stephen Ingram attempts a 3Pt. Contested by Derrick Stewart (5.4 feet, MAN). Stephen Ingram misses. Rebound secured by Klay Jokic.

[05:37] Team_075 possession (Score: 40-29)
Klay Jokic drives, Terry Barrett stays with him. Klay Jokic attempts a Layup. Contested by Terry Barrett (4.5 feet, ZONE). KLAY JOKIC MAKES IT!
Score: 42-29

[05:23] Team_041 possession (Score: 42-29)
FOUL! Shooting foul on Derrick Stewart. Terry Barrett to the line for 2 free throws. [Team fouls: 2] (Derrick Stewart: 1 personal fouls)   FT 1/2: GOOD   FT 2/2: GOOD Terry Barrett makes 2/2 from the line.
Score: 42-31

[05:12] Team_075 possession (Score: 42-31)
Larry McCollum attempts a 3Pt. Contested by Scottie Turner (5.0 feet, ZONE). Larry McCollum misses. Rebound secured by Stephen Ingram.

[04:57] Team_041 possession (Score: 42-31)
Dejounte Griffin attempts a 3Pt. Contested by Larry McCollum (5.2 feet, ZONE). Dejounte Griffin misses. Rebound secured by Kawhi Ingram.

[04:48] Team_075 possession (Score: 42-31)
Larry McCollum attempts a 3Pt. Contested by Jarrett Anunoby (5.3 feet, ZONE). Larry McCollum misses. Rebound secured by Dejounte Griffin.

[04:32] Team_041 possession (Score: 42-31)
Stephen Ingram drives and kicks out. Dejounte Griffin attempts a 3Pt. Wide open! Myles Barrett is 6.8 feet away. [MAN] DEJOUNTE GRIFFIN MAKES IT! Assist: Terry Barrett
Score: 42-34

[04:14] Team_075 possession (Score: 42-34)
Myles Barrett attempts a 3Pt. Contested by Dejounte Griffin (5.3 feet, MAN). Myles Barrett misses. Rebound secured by Dejounte Griffin.

[04:01] Team_041 possession (Score: 42-34)
Stephen Ingram drives, Derrick Stewart stays with him. Stephen Ingram attempts a Dunk. Contested by Derrick Stewart (5.7 feet, ZONE). STEPHEN INGRAM MAKES IT!
Score: 42-36

[03:45] Team_075 possession (Score: 42-36)
Larry McCollum attempts a 3Pt. Contested by Scottie Turner (5.2 feet, ZONE). Larry McCollum misses. Offensive rebound by Kawhi Ingram! Kawhi Ingram kicks it out.

[03:34] Team_075 possession (Score: 42-36)
FOUL! Shooting foul on Jarrett Anunoby. Kawhi Ingram to the line for 2 free throws. [BONUS: 7 team fouls] (Jarrett Anunoby: 2 personal fouls)   FT 1/2: GOOD   FT 2/2: GOOD Kawhi Ingram makes 2/2 from the line.
Score: 44-36

[03:20] Team_041 possession (Score: 44-36)
Stephen Ingram attempts a 3Pt. Contested by Derrick Stewart (5.8 feet, MAN). Stephen Ingram misses. Offensive rebound by Terry Barrett! Terry Barrett kicks it out.

[03:04] Team_041 possession (Score: 44-36)
Dejounte Griffin attempts a 3Pt. Contested by Larry McCollum (5.5 feet, ZONE). Dejounte Griffin misses. Rebound secured by Klay Jokic.

[02:50] Team_075 possession (Score: 44-36)
Kawhi Ingram attempts a 3Pt. Contested by Scottie Turner (5.0 feet, ZONE). Kawhi Ingram misses. Rebound secured by Dejounte Griffin.

[02:31] Team_041 possession (Score: 44-36)
Jarrett Anunoby attempts a Layup. Wide open! Derrick Stewart is 6.2 feet away. [ZONE] Jarrett Anunoby misses. Offensive rebound by Stephen Ingram! Stephen Ingram kicks it out.

[02:17] Team_041 possession (Score: 44-36)
Jarrett Anunoby attempts a 3Pt. Contested by Larry McCollum (6.0 feet, ZONE). Jarrett Anunoby misses. Rebound secured by Kawhi Ingram.

[02:02] Team_075 possession (Score: 44-36)
Derrick Stewart throws a bad pass! Stolen by Stephen Ingram! TURNOVER! (live ball)

[01:51] Team_041 possession (Score: 44-36)
Jarrett Anunoby attempts a Midrange. Wide open! Myles Barrett is 7.4 feet away. [ZONE] Jarrett Anunoby misses. Rebound secured by Kawhi Ingram.

[01:39] Team_075 possession (Score: 44-36)
Larry McCollum attempts a Midrange. Contested by Scottie Turner (5.5 feet, MAN). LARRY MCCOLLUM MAKES IT! Assist: Klay Jokic
Score: 46-36

[01:29] Team_041 possession (Score: 46-36)
Stephen Ingram attempts a Layup. Wide open! Derrick Stewart is 6.1 feet away. [MAN] STEPHEN INGRAM MAKES IT! Assist: Terry Barrett
Score: 46-38

[01:17] Team_075 possession (Score: 46-38)
Derrick Stewart attempts a Layup. Contested by Stephen Ingram (5.3 feet, MAN). Derrick Stewart misses. Rebound secured by Dejounte Griffin.

[01:06] Team_041 possession (Score: 46-38)
Dejounte Griffin attempts a 3Pt. Contested by Larry McCollum (5.8 feet, ZONE). Dejounte Griffin misses. Rebound secured by Kawhi Ingram.

[00:49] Team_075 possession (Score: 46-38)
Myles Barrett attempts a 3Pt. Contested by Scottie Turner (5.7 feet, ZONE). Myles Barrett misses. Rebound secured by Dejounte Griffin.

[00:33] Team_041 possession (Score: 46-38)
Scottie Turner drives to the basket... Scottie Turner loses control! Ball rolls out of bounds! TURNOVER! (dead ball)

[00:33] Substitution (Team_075): Larry McCollum OUT → D'Angelo Anunoby IN (stamina_rule2)

[00:33] Substitution (Team_075): Kawhi Ingram OUT → LeBron Ginobili IN (stamina_rule2)

[00:33] Substitution (Team_075): Myles Barrett OUT → Donovan Paul IN (stamina_rule2)

[00:33] Substitution (Team_075): Derrick Stewart OUT → Collin Duncan IN (stamina_rule2)

[00:33] Substitution (Team_075): Klay Jokic OUT → Kevin Towns IN (stamina_rule2)

[00:33] Substitution (Team_041): Scottie Turner OUT → Franz Rose IN (stamina_rule2)

[00:33] Substitution (Team_041): Jarrett Anunoby OUT → Kyrie Booker IN (stamina_rule2)

[00:33] Substitution (Team_041): Dejounte Griffin OUT → Bam McCollum IN (stamina_rule2)

[00:33] Substitution (Team_041): Stephen Ingram OUT → Tobias McCollum IN (stamina_rule2)

[00:33] Substitution (Team_041): Terry Barrett OUT → De'Aaron Poole IN (stamina_rule2)

[00:17] Team_075 possession (Score: 46-38)
Kevin Towns attempts a Midrange. Wide open! Bam McCollum is 6.3 feet away. [ZONE] KEVIN TOWNS MAKES IT!
Score: 48-38

================================================================================
                              2ND QUARTER COMPLETE                              
================================================================================

2ND QUARTER SCORE: Team_075 24, Team_041 16

BOX SCORE:
================================================================================

Team_075
--------------------------------------------------------------------------------
Player                MIN  PTS  REB  AST  TO      FG   FG%      3P   3P%
--------------------------------------------------------------------------------
Klay Jokic             22    8    4    1   0   4/4   100.0     0/0   0.0
Derrick Stewart        22    5    4    1   0   2/6    33.3     0/0   0.0
Kawhi Ingram           22    4    7    1   0   2/3    66.7     0/0   0.0
Myles Barrett          22    2    0    1   0   1/3    33.3     0/0   0.0
Larry McCollum         22    2    0    0   0   1/5    20.0     0/0   0.0
Kevin Towns             2    2    0    0   0   1/1   100.0     0/0   0.0

TEAM: FG: 11/22 (50.0%), 3PT: 0/7 (0.0%), REB: 15 (3 off, 12 def), AST: 4, TO: 1
TEAM FOULS: 2


Team_041
--------------------------------------------------------------------------------
Player                MIN  PTS  REB  AST  TO      FG   FG%      3P   3P%
--------------------------------------------------------------------------------
Jarrett Anunoby        22    5    0    0   0   2/7    28.6     0/0   0.0
Terry Barrett          22    4    3    2   0   2/3    66.7     0/0   0.0
Stephen Ingram         22    4    5    1   0   2/3    66.7     0/0   0.0
Dejounte Griffin       22    3    6    0   0   1/4    25.0     0/0   0.0
Scottie Turner         22    0    0    1   0   0/2     0.0     0/0   0.0

TEAM: FG: 7/19 (36.8%), 3PT: 0/8 (0.0%), REB: 14 (3 off, 11 def), AST: 4, TO: 3
TEAM FOULS: 7 [Team_075 in BONUS]

================================================================================

================================================================================
                       3RD QUARTER - Team_075 vs Team_041                       
================================================================================

[12:00] Team_075 possession (Score: 48-38)
Klay Jokic attempts a Layup. BLOCKED BY TERRY BARRETT! Ball is loose! Rebound secured by Terry Barrett.

[11:44] Team_041 possession (Score: 48-38)
Scottie Turner loses the ball! Stripped by Larry McCollum! TURNOVER! (live ball)

[11:30] Team_075 possession (Score: 48-38)
Larry McCollum attempts a 3Pt. Contested by Scottie Turner (4.2 feet, MAN). LARRY MCCOLLUM MAKES IT! Assist: Klay Jokic
Score: 51-38

[11:19] Team_041 possession (Score: 51-38)
Terry Barrett drives, Klay Jokic stays with him. Terry Barrett attempts a Dunk. Contested by Klay Jokic (5.5 feet, MAN). TERRY BARRETT MAKES IT! Assist: Dejounte Griffin
Score: 51-40

[11:10] Team_075 possession (Score: 51-40)
Myles Barrett attempts a Midrange. Contested by Dejounte Griffin (4.1 feet, MAN). MYLES BARRETT MAKES IT!
Score: 53-40

[10:53] Team_041 possession (Score: 53-40)
Dejounte Griffin attempts a 3Pt. Contested by Larry McCollum (4.3 feet, ZONE). Dejounte Griffin misses. Rebound secured by Kawhi Ingram.

[10:40] Team_075 possession (Score: 53-40)
Kawhi Ingram attempts a 3Pt. Contested by Scottie Turner (3.9 feet, ZONE). Kawhi Ingram misses. Rebound secured by Dejounte Griffin.

[10:26] Team_041 possession (Score: 53-40)
Stephen Ingram drives to the basket... Stephen Ingram throws a bad pass! Stolen by Derrick Stewart! TURNOVER! (live ball)

[10:13] Team_075 possession (Score: 53-40)
FOUL! Reach-in foul on Dejounte Griffin during the drive. [Team fouls: 1] No free throws, side out. (Dejounte Griffin: 1 personal fouls)

[09:59] Team_075 possession (Score: 53-40)
Larry McCollum throws a bad pass out of bounds! TURNOVER! (dead ball)

[09:47] Team_041 possession (Score: 53-40)
Dejounte Griffin drives and kicks out. Stephen Ingram attempts a 3Pt. Contested by Myles Barrett (5.9 feet, ZONE). STEPHEN INGRAM MAKES IT! Assist: Terry Barrett
Score: 53-43

[09:31] Team_075 possession (Score: 53-43)
Derrick Stewart drives to the basket... Derrick Stewart loses the ball! Stripped by Terry Barrett! TURNOVER! (live ball)

[09:14] Team_041 possession (Score: 53-43)
Terry Barrett drives, picks up Derrick Stewart. Help arrives from Larry McCollum! Terry Barrett attempts a Dunk. Contested by Larry McCollum (4.7 feet, ZONE). TERRY BARRETT MAKES IT!
Score: 53-45

[08:56] Team_075 possession (Score: 53-45)
Kawhi Ingram drives, picks up Jarrett Anunoby. Help arrives from Dejounte Griffin! Kawhi Ingram attempts a Layup. Contested by Dejounte Griffin (4.1 feet, MAN). Kawhi Ingram misses. Rebound secured by Terry Barrett.

[08:43] Team_041 possession (Score: 53-45)
FOUL! Holding foul on Myles Barrett. [Team fouls: 1] No free throws, side out. (Myles Barrett: 1 personal fouls)

[08:25] Team_041 possession (Score: 53-45)
Dejounte Griffin drives, picks up Derrick Stewart. Help arrives from Larry McCollum! Dejounte Griffin attempts a Layup. Contested by Larry McCollum (4.5 feet, ZONE). DEJOUNTE GRIFFIN MAKES IT! Assist: Jarrett Anunoby
Score: 53-47

[08:09] Team_075 possession (Score: 53-47)
Derrick Stewart attempts a Layup. Contested by Terry Barrett (3.2 feet, ZONE). DERRICK STEWART MAKES IT!
Score: 55-47

[07:54] Team_041 possession (Score: 55-47)
FOUL! Shooting foul on Kawhi Ingram. Dejounte Griffin to the line for 2 free throws. [Team fouls: 2] (Kawhi Ingram: 1 personal fouls)   FT 1/2: GOOD   FT 2/2: GOOD Dejounte Griffin makes 2/2 from the line.
Score: 55-49

[07:38] Team_075 possession (Score: 55-49)
FOUL! Shooting foul on Jarrett Anunoby. Kawhi Ingram to the line for 3 free throws. [Team fouls: 2] (Jarrett Anunoby: 1 personal fouls)   FT 1/3: GOOD   FT 2/3: GOOD   FT 3/3: GOOD Kawhi Ingram makes 3/3 from the line.
Score: 58-49

[07:23] Team_041 possession (Score: 58-49)
Scottie Turner makes the Layup and draws the foul on Larry McCollum! And-1! Scottie Turner to the line for 1. [Team fouls: 3] (Larry McCollum: 1 personal fouls)   FT 1/1: GOOD Scottie Turner makes 1/1 from the line.
Score: 58-52

[07:10] Team_075 possession (Score: 58-52)
Kawhi Ingram drives, picks up Jarrett Anunoby. Help arrives from Dejounte Griffin! Kawhi Ingram attempts a Layup. Contested by Dejounte Griffin (4.1 feet, MAN). Kawhi Ingram misses. Rebound secured by Dejounte Griffin.

[06:54] Team_041 possession (Score: 58-52)
Scottie Turner loses control! Ball rolls out of bounds! TURNOVER! (dead ball)

[06:41] Team_075 possession (Score: 58-52)
Larry McCollum drives, Scottie Turner stays with him. Larry McCollum attempts a Dunk. Contested by Scottie Turner (4.2 feet, MAN). LARRY MCCOLLUM MAKES IT! Assist: Klay Jokic
Score: 60-52

[06:23] Team_041 possession (Score: 60-52)
Dejounte Griffin attempts a 3Pt. Contested by Myles Barrett (5.9 feet, MAN). DEJOUNTE GRIFFIN MAKES IT! Assist: Jarrett Anunoby
Score: 60-55

[06:10] Team_075 possession (Score: 60-55)
FOUL! Shooting foul on Terry Barrett. Klay Jokic to the line for 2 free throws. [Team fouls: 3] (Terry Barrett: 1 personal fouls)   FT 1/2: GOOD   FT 2/2: GOOD Klay Jokic makes 2/2 from the line.
Score: 62-55

[05:53] Team_041 possession (Score: 62-55)
Dejounte Griffin attempts a 3Pt. Contested by Myles Barrett (5.9 feet, MAN). Dejounte Griffin misses. Rebound secured by Kawhi Ingram.

[05:40] Team_075 possession (Score: 62-55)
Larry McCollum attempts a 3Pt. Contested by Scottie Turner (4.2 feet, MAN). Larry McCollum misses. Rebound secured by Terry Barrett.

[05:27] Team_041 possession (Score: 62-55)
Dejounte Griffin attempts a 3Pt. Contested by Myles Barrett (5.9 feet, MAN). Dejounte Griffin misses. Offensive rebound by Terry Barrett! Terry Barrett's putback is no good. Rebound secured by Derrick Stewart.

[05:12] Team_075 possession (Score: 62-55)
Derrick Stewart attempts a 3Pt. Contested by Scottie Turner (4.0 feet, ZONE). Derrick Stewart misses. Rebound secured by Dejounte Griffin.

[04:56] Team_041 possession (Score: 62-55)
Scottie Turner loses control! Ball rolls out of bounds! TURNOVER! (dead ball)

[04:43] Team_075 possession (Score: 62-55)
FOUL! Holding foul on Jarrett Anunoby. [Team fouls: 4] No free throws, side out. (Jarrett Anunoby: 2 personal fouls)

[04:28] Team_075 possession (Score: 62-55)
Kawhi Ingram attempts a 3Pt. Contested by Jarrett Anunoby (4.2 feet, MAN). Kawhi Ingram misses. Rebound secured by Terry Barrett.

[04:14] Team_041 possession (Score: 62-55)
Jarrett Anunoby attempts a 3Pt. Contested by Kawhi Ingram (4.6 feet, MAN). Jarrett Anunoby misses. Rebound secured by Kawhi Ingram.

[03:59] Team_075 possession (Score: 62-55)
Klay Jokic drives to the basket... Klay Jokic throws a bad pass! Stolen by Terry Barrett! TURNOVER! (live ball)

[03:42] Team_041 possession (Score: 62-55)
Dejounte Griffin drives to the basket... Dejounte Griffin loses the ball! Stripped by Myles Barrett! TURNOVER! (live ball)

[03:32] Team_075 possession (Score: 62-55)
Kawhi Ingram drives, Jarrett Anunoby stays with him. Kawhi Ingram attempts a Layup. Contested by Jarrett Anunoby (4.2 feet, MAN). KAWHI INGRAM MAKES IT! Assist: Klay Jokic
Score: 64-55

[03:18] Team_041 possession (Score: 64-55)
Dejounte Griffin drives and kicks out. Dejounte Griffin attempts a 3Pt. Contested by Larry McCollum (4.4 feet, ZONE). DEJOUNTE GRIFFIN MAKES IT! Assist: Scottie Turner
Score: 64-58

[03:04] Team_075 possession (Score: 64-58)
Kawhi Ingram attempts a 3Pt. Contested by Jarrett Anunoby (4.3 feet, MAN). KAWHI INGRAM MAKES IT! Assist: Klay Jokic
Score: 67-58

[02:47] Team_041 possession (Score: 67-58)
Dejounte Griffin attempts a 3Pt. Contested by Larry McCollum (4.5 feet, ZONE). Dejounte Griffin misses. Rebound secured by Derrick Stewart.

[02:34] Team_075 possession (Score: 67-58)
Larry McCollum attempts a 3Pt. Contested by Scottie Turner (4.4 feet, ZONE). LARRY MCCOLLUM MAKES IT! Assist: Derrick Stewart
Score: 70-58

[02:22] Team_041 possession (Score: 70-58)
Terry Barrett attempts a Layup. Contested by Klay Jokic (5.8 feet, MAN). TERRY BARRETT MAKES IT! Assist: Scottie Turner
Score: 70-60

[02:08] Team_075 possession (Score: 70-60)
Kawhi Ingram drives and kicks out. Kawhi Ingram attempts a 3Pt. Contested by Jarrett Anunoby (4.6 feet, MAN). KAWHI INGRAM MAKES IT! Assist: Myles Barrett
Score: 73-60

[01:54] Team_041 possession (Score: 73-60)
Jarrett Anunoby drives, Derrick Stewart stays with him. Jarrett Anunoby attempts a Dunk. Contested by Derrick Stewart (5.3 feet, ZONE). Jarrett Anunoby misses. Rebound secured by Derrick Stewart.

[01:36] Team_075 possession (Score: 73-60)
Klay Jokic attempts a Layup. Contested by Terry Barrett (4.1 feet, ZONE). Klay Jokic misses. Rebound secured by Dejounte Griffin.

[01:21] Team_041 possession (Score: 73-60)
Stephen Ingram drives and kicks out. Terry Barrett attempts a 3Pt. Contested by Klay Jokic (5.7 feet, MAN). TERRY BARRETT MAKES IT! Assist: Jarrett Anunoby
Score: 73-63

[01:07] Team_075 possession (Score: 73-63)
FOUL! Holding foul on Jarrett Anunoby. [IN THE BONUS! 5 team fouls] Kawhi Ingram to the line for 2 free throws. (Jarrett Anunoby: 3 personal fouls)   FT 1/2: GOOD   FT 2/2: GOOD Kawhi Ingram makes 2/2 from the line.
Score: 75-63

[00:56] Team_041 possession (Score: 75-63)
Terry Barrett attempts a Midrange. Contested by Klay Jokic (5.9 feet, MAN). Terry Barrett misses. Rebound secured by Kawhi Ingram.

[00:44] Team_075 possession (Score: 75-63)
Kawhi Ingram attempts a Layup. Contested by Terry Barrett (3.6 feet, ZONE). KAWHI INGRAM MAKES IT!
Score: 77-63

[00:32] Team_041 possession (Score: 77-63)
Scottie Turner attempts a 3Pt. Contested by Larry McCollum (4.6 feet, ZONE). Scottie Turner misses. Rebound secured by Klay Jokic.

[00:18] Team_075 possession (Score: 77-63)
Derrick Stewart attempts a Midrange. Contested by Stephen Ingram (4.5 feet, MAN). Derrick Stewart misses. Rebound secured by Stephen Ingram.

[00:02] Team_041 possession (Score: 77-63)
Scottie Turner attempts a 3Pt. Contested by Larry McCollum (4.7 feet, ZONE). SCOTTIE TURNER MAKES IT!
Score: 77-66

================================================================================
                              3RD QUARTER COMPLETE                              
================================================================================

3RD QUARTER SCORE: Team_075 29, Team_041 28

BOX SCORE:
================================================================================

Team_075
--------------------------------------------------------------------------------
Player                MIN  PTS  REB  AST  TO      FG   FG%      3P   3P%
--------------------------------------------------------------------------------
Kawhi Ingram           34   15    4    0   0   6/10   60.0     0/0   0.0
Larry McCollum         34    8    0    0   0   3/4    75.0     0/0   0.0
Klay Jokic             34    2    1    4   0   1/3    33.3     0/0   0.0
Myles Barrett          34    2    0    1   0   1/1   100.0     0/0   0.0
Derrick Stewart        34    2    3    1   0   1/3    33.3     0/0   0.0

TEAM: FG: 12/21 (57.1%), 3PT: 4/8 (50.0%), REB: 7 (0 off, 7 def), AST: 6, TO: 3
TEAM FOULS: 3


Team_041
--------------------------------------------------------------------------------
Player                MIN  PTS  REB  AST  TO      FG   FG%      3P   3P%
--------------------------------------------------------------------------------
Dejounte Griffin       34   10    4    1   0   4/8    50.0     0/0   0.0
Terry Barrett          34    9    4    1   0   4/5    80.0     0/0   0.0
Scottie Turner         34    6    0    2   0   2/3    66.7     0/0   0.0
Stephen Ingram         34    3    1    0   0   1/1   100.0     0/0   0.0
Jarrett Anunoby        34    0    0    3   0   0/2     0.0     0/0   0.0

TEAM: FG: 11/19 (57.9%), 3PT: 2/8 (25.0%), REB: 10 (1 off, 9 def), AST: 7, TO: 5
TEAM FOULS: 5 [Team_075 in BONUS]

================================================================================

================================================================================
                       4TH QUARTER - Team_075 vs Team_041                       
================================================================================

[12:00] Team_075 possession (Score: 77-66)
Kawhi Ingram attempts a 3Pt. Contested by Scottie Turner (4.2 feet, ZONE). Kawhi Ingram misses. Rebound secured by Dejounte Griffin.

[11:45] Team_041 possession (Score: 77-66)
Dejounte Griffin attempts a 3Pt. Wide open! Myles Barrett is 6.2 feet away. [MAN] Dejounte Griffin misses. Rebound secured by Klay Jokic.

[11:34] Team_075 possession (Score: 77-66)
FOUL! Reach-in foul on Stephen Ingram during the drive. [Team fouls: 1] No free throws, side out. (Stephen Ingram: 1 personal fouls)

[11:17] Team_075 possession (Score: 77-66)
Kawhi Ingram attempts a 3Pt. Contested by Scottie Turner (4.3 feet, ZONE). Kawhi Ingram misses. Offensive rebound by Kawhi Ingram! Kawhi Ingram kicks it out.

[11:02] Team_075 possession (Score: 77-66)
Klay Jokic attempts a Midrange. Contested by Terry Barrett (4.1 feet, MAN). KLAY JOKIC MAKES IT! Assist: Derrick Stewart
Score: 79-66

[10:46] Team_041 possession (Score: 79-66)
Scottie Turner drives, Larry McCollum stays with him. Scottie Turner attempts a Layup. Contested by Larry McCollum (4.6 feet, MAN). Scottie Turner misses. Rebound secured by Kawhi Ingram.

[10:31] Team_075 possession (Score: 79-66)
Larry McCollum attempts a Layup. Contested by Scottie Turner (4.6 feet, MAN). LARRY MCCOLLUM MAKES IT! Assist: Derrick Stewart
Score: 81-66

[10:16] Team_041 possession (Score: 81-66)
Terry Barrett drives, Klay Jokic stays with him. Terry Barrett attempts a Dunk. Contested by Klay Jokic (6.0 feet, ZONE). Terry Barrett misses. Offensive rebound by Terry Barrett! Terry Barrett's putback is no good. Rebound secured by Kawhi Ingram.

[10:02] Team_075 possession (Score: 81-66)
Kawhi Ingram attempts a 3Pt. Contested by Jarrett Anunoby (4.6 feet, MAN). Kawhi Ingram misses. Rebound secured by Dejounte Griffin.

[09:53] Team_041 possession (Score: 81-66)
Stephen Ingram drives to the basket... Stephen Ingram loses control! Ball rolls out of bounds! TURNOVER! (dead ball)

[09:53] Substitution (Team_075): Larry McCollum OUT → D'Angelo Anunoby IN (stamina_rule2)

[09:53] Substitution (Team_075): Kawhi Ingram OUT → LeBron Ginobili IN (stamina_rule2)

[09:53] Substitution (Team_075): Myles Barrett OUT → Donovan Paul IN (stamina_rule2)

[09:53] Substitution (Team_075): Derrick Stewart OUT → Collin Duncan IN (stamina_rule2)

[09:53] Substitution (Team_075): Klay Jokic OUT → Kevin Towns IN (stamina_rule2)

[09:53] Substitution (Team_041): Scottie Turner OUT → Franz Rose IN (stamina_rule2)

[09:53] Substitution (Team_041): Jarrett Anunoby OUT → Kyrie Booker IN (stamina_rule2)

[09:53] Substitution (Team_041): Dejounte Griffin OUT → Bam McCollum IN (stamina_rule2)

[09:53] Substitution (Team_041): Stephen Ingram OUT → Tobias McCollum IN (stamina_rule2)

[09:53] Substitution (Team_041): Terry Barrett OUT → De'Aaron Poole IN (stamina_rule2)

[09:38] Team_075 possession (Score: 81-66)
LeBron Ginobili drives and kicks out. Collin Duncan attempts a Midrange. Contested by Tobias McCollum (5.1 feet, MAN). COLLIN DUNCAN MAKES IT! Assist: Kevin Towns
Score: 83-66

[09:24] Team_041 possession (Score: 83-66)
De'Aaron Poole attempts a Midrange. Contested by LeBron Ginobili (4.8 feet, ZONE). DE'AARON POOLE MAKES IT!
Score: 83-68

[09:13] Team_075 possession (Score: 83-68)
FOUL! Holding foul on Tobias McCollum. [Team fouls: 2] No free throws, side out. (Tobias McCollum: 1 personal fouls)

[08:59] Team_075 possession (Score: 83-68)
D'Angelo Anunoby attempts a 3Pt. Contested by Kyrie Booker (4.4 feet, ZONE). D'Angelo Anunoby misses. Rebound secured by Kyrie Booker.

[08:45] Team_041 possession (Score: 83-68)
De'Aaron Poole drives, picks up Kevin Towns. Help arrives from D'Angelo Anunoby! De'Aaron Poole attempts a Dunk. Contested by D'Angelo Anunoby (5.4 feet, MAN). De'Aaron Poole misses. Rebound secured by Collin Duncan.

[08:31] Team_075 possession (Score: 83-68)
LeBron Ginobili attempts a 3Pt. Contested by Kyrie Booker (4.4 feet, MAN). LeBron Ginobili misses. Rebound secured by Kyrie Booker.

[08:17] Team_041 possession (Score: 83-68)
Tobias McCollum attempts a Midrange. Contested by Collin Duncan (5.8 feet, MAN). TOBIAS MCCOLLUM MAKES IT!
Score: 83-70

[08:01] Team_075 possession (Score: 83-70)
LeBron Ginobili drives to the basket... LeBron Ginobili loses the ball! Stripped by Tobias McCollum! TURNOVER! (live ball)

[07:44] Team_041 possession (Score: 83-70)
Bam McCollum attempts a Layup. Contested by Donovan Paul (5.6 feet, MAN). Bam McCollum misses. Rebound secured by Kevin Towns.

[07:35] Team_075 possession (Score: 83-70)
Kevin Towns drives to the basket... Kevin Towns loses control! Ball rolls out of bounds! TURNOVER! (dead ball)

[07:23] Team_041 possession (Score: 83-70)
Franz Rose attempts a Layup. Contested by D'Angelo Anunoby (5.3 feet, MAN). Franz Rose misses. FOUL! Loose ball foul on Kevin Towns during the rebound battle. [Team fouls: 1] No free throws, side out. (Kevin Towns: 1 personal fouls)

[07:11] Team_041 possession (Score: 83-70)
Bam McCollum attempts a 3Pt. Contested by D'Angelo Anunoby (5.0 feet, ZONE). Bam McCollum misses. Rebound secured by D'Angelo Anunoby.

[06:57] Team_075 possession (Score: 83-70)
Collin Duncan drives, Tobias McCollum stays with him. Collin Duncan attempts a Layup. Contested by Tobias McCollum (5.2 feet, ZONE). Collin Duncan misses. Rebound secured by Kyrie Booker.

[06:42] Team_041 possession (Score: 83-70)
De'Aaron Poole drives and kicks out. FOUL! Shooting foul on D'Angelo Anunoby. Franz Rose to the line for 3 free throws. [Team fouls: 2] (D'Angelo Anunoby: 1 personal fouls)   FT 1/3: GOOD   FT 2/3: GOOD   FT 3/3: GOOD Franz Rose makes 3/3 from the line.
Score: 83-73

[06:29] Team_075 possession (Score: 83-73)
D'Angelo Anunoby attempts a 3Pt. Contested by Kyrie Booker (4.4 feet, ZONE). D'ANGELO ANUNOBY MAKES IT! Assist: Collin Duncan
Score: 86-73

[06:18] Team_041 possession (Score: 86-73)
FOUL! Reach-in foul on LeBron Ginobili during the drive. [Team fouls: 3] No free throws, side out. (LeBron Ginobili: 1 personal fouls)

[06:00] Team_041 possession (Score: 86-73)
Tobias McCollum attempts a Layup. Contested by Kevin Towns (5.6 feet, ZONE). Tobias McCollum misses. Rebound secured by D'Angelo Anunoby.

[05:49] Team_075 possession (Score: 86-73)
Kevin Towns attempts a Layup. Contested by De'Aaron Poole (5.4 feet, MAN). KEVIN TOWNS MAKES IT! Assist: Donovan Paul
Score: 88-73

[05:37] Team_041 possession (Score: 88-73)
De'Aaron Poole attempts a 3Pt. Contested by Kevin Towns (5.4 feet, MAN). De'Aaron Poole misses. Rebound secured by Kevin Towns.

[05:20] Team_075 possession (Score: 88-73)
Kevin Towns drives and kicks out. Donovan Paul attempts a 3Pt. Contested by Bam McCollum (5.9 feet, MAN). Donovan Paul misses. Rebound secured by Tobias McCollum.

[05:07] Team_041 possession (Score: 88-73)
Kyrie Booker drives to the basket... FOUL! Offensive foul on Kyrie Booker! Kevin Towns drew the charge! [Team fouls: 3] (Kyrie Booker: 1 personal fouls) TURNOVER! (dead ball)

[04:52] Team_075 possession (Score: 88-73)
D'Angelo Anunoby attempts a 3Pt. Contested by Franz Rose (5.3 feet, MAN). D'ANGELO ANUNOBY MAKES IT! Assist: Kevin Towns
Score: 91-73

[04:36] Team_041 possession (Score: 91-73)
Franz Rose attempts a 3Pt. Contested by D'Angelo Anunoby (5.3 feet, MAN). Franz Rose misses. FOUL! Loose ball foul on Collin Duncan during the rebound battle. [Team fouls: 4] No free throws, side out. (Collin Duncan: 1 personal fouls)

[04:23] Team_041 possession (Score: 91-73)
Tobias McCollum throws a bad pass! Stolen by Collin Duncan! TURNOVER! (live ball)

[04:11] Team_075 possession (Score: 91-73)
Kevin Towns attempts a 3Pt. Contested by Kyrie Booker (4.8 feet, ZONE). Kevin Towns misses. Rebound secured by Kyrie Booker.

[03:58] Team_041 possession (Score: 91-73)
Franz Rose drives to the basket... Franz Rose throws a bad pass out of bounds! TURNOVER! (dead ball)

[03:48] Team_075 possession (Score: 91-73)
Kevin Towns drives, De'Aaron Poole stays with him. Kevin Towns attempts a Layup. Contested by De'Aaron Poole (5.4 feet, MAN). KEVIN TOWNS MAKES IT!
Score: 93-73

[03:33] Team_041 possession (Score: 93-73)
FOUL! Holding foul on Donovan Paul. [IN THE BONUS! 5 team fouls] Bam McCollum to the line for 2 free throws. (Donovan Paul: 1 personal fouls)   FT 1/2: GOOD   FT 2/2: GOOD Bam McCollum makes 2/2 from the line.
Score: 93-75

[03:20] Team_075 possession (Score: 93-75)
D'Angelo Anunoby makes the Layup and draws the foul on Franz Rose! And-1! D'Angelo Anunoby to the line for 1. [Team fouls: 4] (Franz Rose: 1 personal fouls)   FT 1/1: MISS D'Angelo Anunoby makes 0/1 from the line. Rebound secured by Tobias McCollum.
Score: 95-75

[03:05] Team_041 possession (Score: 95-75)
Bam McCollum attempts a Midrange. Contested by D'Angelo Anunoby (5.0 feet, ZONE). BAM MCCOLLUM MAKES IT! Assist: De'Aaron Poole
Score: 95-77

[02:48] Team_075 possession (Score: 95-77)
D'Angelo Anunoby drives and kicks out. Donovan Paul attempts a Midrange. Contested by Bam McCollum (5.9 feet, MAN). DONOVAN PAUL MAKES IT! Assist: LeBron Ginobili
Score: 97-77

[02:32] Team_041 possession (Score: 97-77)
De'Aaron Poole drives to the basket... De'Aaron Poole loses control! Ball rolls out of bounds! TURNOVER! (dead ball)

[02:13] Team_075 possession (Score: 97-77)
LeBron Ginobili attempts a 3Pt. Contested by Kyrie Booker (4.5 feet, MAN). LEBRON GINOBILI MAKES IT! Assist: D'Angelo Anunoby
Score: 100-77

[02:00] Team_041 possession (Score: 100-77)
Kyrie Booker attempts a 3Pt. Contested by D'Angelo Anunoby (5.4 feet, ZONE). Kyrie Booker misses. Rebound secured by Collin Duncan.

[01:45] Team_075 possession (Score: 100-77)
FOUL! Reach-in foul on Tobias McCollum during the drive. [IN THE BONUS! 5 team fouls] Donovan Paul to the line for 2 free throws. (Tobias McCollum: 2 personal fouls)   FT 1/2: MISS   FT 2/2: GOOD Donovan Paul makes 1/2 from the line.
Score: 101-77

[01:33] Team_041 possession (Score: 101-77)
Tobias McCollum drives, Collin Duncan stays with him. Tobias McCollum attempts a Layup. Contested by Collin Duncan (6.0 feet, MAN). Tobias McCollum misses. Rebound secured by Kevin Towns.

[01:18] Team_075 possession (Score: 101-77)
FOUL! Reach-in foul on De'Aaron Poole during the drive. [IN THE BONUS! 6 team fouls] Kevin Towns to the line for 2 free throws. (De'Aaron Poole: 1 personal fouls)   FT 1/2: MISS   FT 2/2: GOOD Kevin Towns makes 1/2 from the line.
Score: 102-77

[01:06] Team_041 possession (Score: 102-77)
FOUL! Shooting foul on Kevin Towns. De'Aaron Poole to the line for 2 free throws. [BONUS: 6 team fouls] (Kevin Towns: 2 personal fouls)   FT 1/2: MISS   FT 2/2: GOOD De'Aaron Poole makes 1/2 from the line.
Score: 102-78

[00:48] Team_075 possession (Score: 102-78)
FOUL! Holding foul on Bam McCollum. [IN THE BONUS! 7 team fouls] Donovan Paul to the line for 2 free throws. (Bam McCollum: 1 personal fouls)   FT 1/2: GOOD   FT 2/2: GOOD Donovan Paul makes 2/2 from the line.
Score: 104-78

[00:30] Team_041 possession (Score: 104-78)
Tobias McCollum attempts a Midrange. Wide open! Collin Duncan is 6.0 feet away. [MAN] Tobias McCollum misses. Rebound secured by Collin Duncan.

[00:16] Team_075 possession (Score: 104-78)
Donovan Paul attempts a Layup. Wide open! Bam McCollum is 6.5 feet away. [MAN] DONOVAN PAUL MAKES IT!
Score: 106-78

[00:01] Team_041 possession (Score: 106-78)
Kyrie Booker attempts a 3Pt. Contested by D'Angelo Anunoby (5.6 feet, ZONE). KYRIE BOOKER MAKES IT! Assist: Bam McCollum
Score: 106-81

================================================================================
                              4TH QUARTER COMPLETE                              
================================================================================

4TH QUARTER SCORE: Team_075 29, Team_041 15

BOX SCORE:
================================================================================

Team_075
--------------------------------------------------------------------------------
Player                MIN  PTS  REB  AST  TO      FG   FG%      3P   3P%
--------------------------------------------------------------------------------
Donovan Paul           12    7    0    1   0   4/4   100.0     0/0   0.0
D'Angelo Anunoby       12    6    2    1   0   2/4    50.0     0/0   0.0
Kevin Towns            12    5    3    2   0   3/5    60.0     0/0   0.0
LeBron Ginobili        12    3    0    1   0   1/2    50.0     0/0   0.0
Klay Jokic             37    2    1    0   0   1/1   100.0     0/0   0.0
Larry McCollum         37    2    0    0   0   1/1   100.0     0/0   0.0
Collin Duncan          12    2    3    1   0   1/2    50.0     0/0   0.0
Kawhi Ingram           37    0    3    0   0   0/2     0.0     0/0   0.0
Derrick Stewart        37    0    0    2   0   0/0     0.0     0/0   0.0

TEAM: FG: 13/21 (61.9%), 3PT: 3/8 (37.5%), REB: 11 (1 off, 10 def), AST: 8, TO: 2
TEAM FOULS: 6 [Team_041 in BONUS]


Team_041
--------------------------------------------------------------------------------
Player                MIN  PTS  REB  AST  TO      FG   FG%      3P   3P%
--------------------------------------------------------------------------------
Bam McCollum           12    4    0    1   0   2/4    50.0     0/0   0.0
De'Aaron Poole         12    3    2    1   0   2/4    50.0     0/0   0.0
Kyrie Booker           12    3    4    0   0   1/2    50.0     0/0   0.0
Franz Rose             12    3    0    0   0   1/1   100.0     0/0   0.0
Tobias McCollum        12    2    2    0   0   1/4    25.0     0/0   0.0
Dejounte Griffin       37    0    2    0   0   0/1     0.0     0/0   0.0
Scottie Turner         37    0    0    0   0   0/1     0.0     0/0   0.0
Terry Barrett          37    0    0    0   0   0/1     0.0     0/0   0.0

TEAM: FG: 7/18 (38.9%), 3PT: 1/5 (20.0%), REB: 11 (3 off, 8 def), AST: 2, TO: 5
TEAM FOULS: 7 [Team_075 in BONUS]

================================================================================

================================================================================
                               FULL GAME COMPLETE                               
================================================================================

FINAL SCORE: Team_075 106, Team_041 81

SCORING BY QUARTER:
--------------------------------------------------------------------------------
Team                     Q1     Q2     Q3     Q4    FINAL
--------------------------------------------------------------------------------
Team_075                 24     24     29     29      106
Team_041                 22     16     28     15       81
--------------------------------------------------------------------------------

FULL GAME BOX SCORE:
================================================================================

Team_075
--------------------------------------------------------------------------------
Player                MIN  PTS  REB  AST  TO      FG   FG%      3P   3P%      FT STL BLK
--------------------------------------------------------------------------------
Larry McCollum         37   16    0    1   3   7/13   53.8   2/6    33.3   0/0     1   0
Kawhi Ingram           37   26   22    1   0  10/18   55.6   3/8    37.5   7/7     0   0
Myles Barrett          37    8    0    4   1   4/6    66.7   0/2     0.0   2/2     3   0
Derrick Stewart        37    9    8    4   2   4/10   40.0   0/2     0.0   2/3     2   0
Klay Jokic             37   16    9   10   1   8/14   57.1   0/2     0.0   4/4     0   0
D'Angelo Anunoby       12    6    2    1   1   3/5    60.0   2/3    66.7   0/1     0   0
LeBron Ginobili        12    6    0    1   0   3/5    60.0   2/4    50.0   0/0     0   0
Donovan Paul           12    7    0    2   0   2/2   100.0   0/0     0.0   3/4     0   0
Collin Duncan          12    2    4    1   0   0/1     0.0   0/0     0.0   0/0     1   0
Kevin Towns            12    7    3    2   2   4/6    66.7   0/1     0.0   1/2     0   0

TEAM: FG: 47/82 (57.3%), 3PT: 9/28 (32.1%), REB: 46 (8 off, 38 def), AST: 27, TO: 10


Team_041
--------------------------------------------------------------------------------
Player                MIN  PTS  REB  AST  TO      FG   FG%      3P   3P%      FT STL BLK
--------------------------------------------------------------------------------
Scottie Turner         37    6    0    3   3   2/8    25.0   1/4    25.0   1/1     0   1
Jarrett Anunoby        37    5    0    4   2   2/12   16.7   0/6     0.0   1/1     0   0
Dejounte Griffin       37   16   13    1   3   8/17   47.1   3/12   25.0   3/5     0   0
Stephen Ingram         37   14   10    2   2   8/11   72.7   2/3    66.7   0/0     2   0
Terry Barrett          37   19   10    5   1   6/9    66.7   0/0     0.0   2/2     2   1
Franz Rose             12    5    0    0   1   1/1   100.0   0/0     0.0   5/5     0   0
Kyrie Booker           12    5    5    0   0   3/4    75.0   2/3    66.7   2/3     0   0
Bam McCollum           12    4    0    1   1   1/3    33.3   0/1     0.0   2/2     0   0
Tobias McCollum        12    2    2    0   1   1/4    25.0   0/0     0.0   0/0     1   0
De'Aaron Poole         12    5    2    1   1   3/6    50.0   0/1     0.0   1/2     1   0

TEAM: FG: 36/76 (47.4%), 3PT: 8/30 (26.7%), REB: 44 (10 off, 34 def), AST: 17, TO: 15

================================================================================
