================================================================================
                        FULL GAME - Team_035 vs Team_014                        
================================================================================

================================================================================
                       1ST QUARTER - Team_035 vs Team_014                       
================================================================================

[12:00] Team_035 possession (Score: 0-0)
FOUL! Holding foul on Michael Cunningham. [Team fouls: 1] No free throws, side out. (Michael Cunningham: 1 personal fouls)

[11:48] Team_035 possession (Score: 0-0)
Gary Johnson drives, DeMar Adebayo stays with him. Gary Johnson attempts a Dunk. Contested by DeMar Adebayo (3.6 feet, ZONE). GARY JOHNSON MAKES IT!
Score: 2-0

[11:35] Team_014 possession (Score: 2-0)
Michael Cunningham attempts a 3Pt. Contested by Domantas Green (4.4 feet, MAN). Michael Cunningham misses. Rebound secured by Gary Johnson.

[11:21] Team_035 possession (Score: 2-0)
Gary Johnson attempts a Midrange. Contested by Lamelo Simmons (4.5 feet, MAN). Gary Johnson misses. Rebound secured by Michael Cunningham.

[11:03] Team_014 possession (Score: 2-0)
Michael Cunningham attempts a 3Pt. Contested by Domantas Green (4.4 feet, MAN). MICHAEL CUNNINGHAM MAKES IT! Assist: Jordan Anunoby
Score: 2-3

[10:47] Team_035 possession (Score: 2-3)
Magic Westbrook drives and kicks out. Magic Westbrook attempts a 3Pt. Contested by Jordan Anunoby (4.7 feet, ZONE). Magic Westbrook misses. FOUL! Loose ball foul on DeMar Adebayo during the rebound battle. [Team fouls: 2] No free throws, side out. (DeMar Adebayo: 1 personal fouls)

[10:31] Team_035 possession (Score: 2-3)
Domantas Green drives, DeMar Adebayo stays with him. Domantas Green attempts a Layup. Contested by DeMar Adebayo (3.5 feet, ZONE). DOMANTAS GREEN MAKES IT!
Score: 4-3

[10:20] Team_014 possession (Score: 4-3)
FOUL! Shooting foul on Shaquille Ginobili. Jordan Anunoby to the line for 2 free throws. [Team fouls: 1] (Shaquille Ginobili: 1 personal fouls)   FT 1/2: GOOD   FT 2/2: GOOD Jordan Anunoby makes 2/2 from the line.
Score: 4-5

[10:05] Team_035 possession (Score: 4-5)
Gary Johnson attempts a Layup. Contested by DeMar Adebayo (3.6 feet, ZONE). GARY JOHNSON MAKES IT! Assist: Shaquille Ginobili
Score: 6-5

[09:49] Team_014 possession (Score: 6-5)
Jordan Anunoby attempts a Midrange. BLOCKED BY SHAQUILLE GINOBILI! Ball goes out off Shaquille Ginobili. Jordan Anunoby's ball!

[09:36] Team_014 possession (Score: 6-5)
Jordan Anunoby drives, picks up Dwyane Johnson. Help arrives from Domantas Green! Jordan Anunoby attempts a Dunk. Contested by Domantas Green (4.2 feet, ZONE). JORDAN ANUNOBY MAKES IT! Assist: Lamelo Simmons
Score: 6-7

[09:24] Team_035 possession (Score: 6-7)
Magic Westbrook attempts a Midrange. Contested by Lamelo Simmons (4.4 feet, ZONE). Magic Westbrook misses. Rebound secured by Ayo Murray.

[09:08] Team_014 possession (Score: 6-7)
Michael Cunningham attempts a 3Pt. Contested by Domantas Green (4.4 feet, MAN). Michael Cunningham misses. Rebound secured by Magic Westbrook.

[08:49] Team_035 possession (Score: 6-7)
FOUL! Holding foul on Lamelo Simmons. [Team fouls: 3] No free throws, side out. (Lamelo Simmons: 1 personal fouls)

[08:37] Team_035 possession (Score: 6-7)
Domantas Green drives and kicks out. Domantas Green attempts a 3Pt. Contested by Jordan Anunoby (4.7 feet, ZONE). Domantas Green misses. Rebound secured by Ayo Murray.

[08:26] Team_014 possession (Score: 6-7)
Michael Cunningham attempts a 3Pt. Contested by Shaquille Ginobili (3.7 feet, ZONE). MICHAEL CUNNINGHAM MAKES IT! Assist: Lamelo Simmons
Score: 6-10

[08:12] Team_035 possession (Score: 6-10)
Gary Johnson drives and kicks out. Shaquille Ginobili attempts a 3Pt. Contested by Jordan Anunoby (4.7 feet, MAN). Shaquille Ginobili misses. Rebound secured by DeMar Adebayo.

[07:59] Team_014 possession (Score: 6-10)
Lamelo Simmons attempts a 3Pt. Contested by Dwyane Johnson (4.3 feet, ZONE). Lamelo Simmons misses. Rebound secured by Magic Westbrook.

[07:44] Team_035 possession (Score: 6-10)
Shaquille Ginobili drives, DeMar Adebayo stays with him. Shaquille Ginobili attempts a Layup. Contested by DeMar Adebayo (3.0 feet, ZONE). Shaquille Ginobili misses. Rebound secured by Ayo Murray.

[07:27] Team_014 possession (Score: 6-10)
DeMar Adebayo attempts a Layup. BLOCKED BY DWYANE JOHNSON! Ball is loose! Rebound secured by Gary Johnson.

[07:15] Team_035 possession (Score: 6-10)
Magic Westbrook drives to the basket... Magic Westbrook loses the ball! Stripped by DeMar Adebayo! TURNOVER! (live ball)

[07:01] Team_014 possession (Score: 6-10)
Lamelo Simmons drives to the basket... Lamelo Simmons throws a bad pass! Stolen by Gary Johnson! TURNOVER! (live ball)

[06:47] Team_035 possession (Score: 6-10)
Gary Johnson attempts a 3Pt. Contested by Lamelo Simmons (4.5 feet, MAN). GARY JOHNSON MAKES IT!
Score: 9-10

[06:31] Team_014 possession (Score: 9-10)
Michael Cunningham attempts a Layup. Contested by Domantas Green (4.4 feet, MAN). MICHAEL CUNNINGHAM MAKES IT! Assist: Jordan Anunoby
Score: 9-12

[06:17] Team_035 possession (Score: 9-12)
FOUL! Holding foul on Lamelo Simmons. [Team fouls: 4] No free throws, side out. (Lamelo Simmons: 2 personal fouls)

[06:01] Team_035 possession (Score: 9-12)
Gary Johnson attempts a 3Pt. Contested by Lamelo Simmons (4.5 feet, MAN). GARY JOHNSON MAKES IT! Assist: Shaquille Ginobili
Score: 12-12

[05:44] Team_014 possession (Score: 12-12)
Michael Cunningham drives and kicks out. Michael Cunningham attempts a 3Pt. Contested by Domantas Green (4.6 feet, ZONE). Michael Cunningham misses. Rebound secured by Magic Westbrook.

[05:31] Team_035 possession (Score: 12-12)
Shaquille Ginobili attempts a 3Pt. Contested by Jordan Anunoby (4.5 feet, ZONE). Shaquille Ginobili misses. Rebound secured by DeMar Adebayo.

[05:16] Team_014 possession (Score: 12-12)
Ayo Murray attempts a Midrange. Contested by Magic Westbrook (4.6 feet, MAN). Ayo Murray misses. Rebound secured by Magic Westbrook.

[05:00] Team_035 possession (Score: 12-12)
Dwyane Johnson attempts a Layup. Contested by Ayo Murray (4.7 feet, ZONE). Dwyane Johnson misses. Rebound secured by Michael Cunningham.

[04:47] Team_014 possession (Score: 12-12)
FOUL! Holding foul on Magic Westbrook. [Team fouls: 2] No free throws, side out. (Magic Westbrook: 1 personal fouls)

[04:28] Team_014 possession (Score: 12-12)
Lamelo Simmons drives to the basket... Lamelo Simmons throws a bad pass! Stolen by Gary Johnson! TURNOVER! (live ball)

[04:15] Team_035 possession (Score: 12-12)
Domantas Green attempts a 3Pt. Contested by Jordan Anunoby (5.1 feet, ZONE). Domantas Green misses. Rebound secured by Ayo Murray.

[04:04] Team_014 possession (Score: 12-12)
Michael Cunningham attempts a 3Pt. Contested by Shaquille Ginobili (3.8 feet, ZONE). Michael Cunningham misses. Rebound secured by Magic Westbrook.

[03:52] Team_035 possession (Score: 12-12)
Shaquille Ginobili drives to the basket... Shaquille Ginobili throws a bad pass out of bounds! TURNOVER! (dead ball)

[03:42] Team_014 possession (Score: 12-12)
Ayo Murray drives to the basket... Ayo Murray throws a bad pass! Stolen by Dwyane Johnson! TURNOVER! (live ball)

[03:26] Team_035 possession (Score: 12-12)
Dwyane Johnson drives to the basket... FOUL! Offensive foul on Dwyane Johnson! DeMar Adebayo drew the charge! [Team fouls: 3] (Dwyane Johnson: 1 personal fouls) TURNOVER! (dead ball)

[03:11] Team_014 possession (Score: 12-12)
Lamelo Simmons attempts a 3Pt. Contested by Shaquille Ginobili (4.5 feet, ZONE). Lamelo Simmons misses. Rebound secured by Dwyane Johnson.

[02:59] Team_035 possession (Score: 12-12)
Domantas Green makes the Layup and draws the foul on DeMar Adebayo! And-1! Domantas Green to the line for 1. [BONUS: 5 team fouls] (DeMar Adebayo: 2 personal fouls)   FT 1/1: GOOD Domantas Green makes 1/1 from the line.
Score: 15-12

[02:40] Team_014 possession (Score: 15-12)
Michael Cunningham attempts a 3Pt. Contested by Shaquille Ginobili (4.0 feet, ZONE). MICHAEL CUNNINGHAM MAKES IT! Assist: DeMar Adebayo
Score: 15-15

[02:25] Team_035 possession (Score: 15-15)
Gary Johnson attempts a 3Pt. Contested by Jordan Anunoby (5.4 feet, ZONE). Gary Johnson misses. Rebound secured by Michael Cunningham.

[02:07] Team_014 possession (Score: 15-15)
Ayo Murray makes the Layup and draws the foul on Dwyane Johnson! And-1! Ayo Murray to the line for 1. [Team fouls: 4] (Dwyane Johnson: 2 personal fouls)   FT 1/1: GOOD Ayo Murray makes 1/1 from the line.
Score: 15-18

[01:53] Team_035 possession (Score: 15-18)
Gary Johnson attempts a 3Pt. Contested by Jordan Anunoby (5.5 feet, ZONE). Gary Johnson misses. Rebound secured by Michael Cunningham.

[01:36] Team_014 possession (Score: 15-18)
Michael Cunningham makes the 3Pt and draws the foul on Domantas Green! And-1! Michael Cunningham to the line for 1. [BONUS: 5 team fouls] (Domantas Green: 1 personal fouls)   FT 1/1: MISS Michael Cunningham makes 0/1 from the line. Offensive rebound by DeMar Adebayo! DeMar Adebayo kicks it out.
Score: 15-21

[01:22] Team_014 possession (Score: 15-21)
Lamelo Simmons makes the Midrange and draws the foul on Gary Johnson! And-1! Lamelo Simmons to the line for 1. [BONUS: 6 team fouls] (Gary Johnson: 1 personal fouls)   FT 1/1: GOOD Lamelo Simmons makes 1/1 from the line.
Score: 15-24

[01:08] Team_035 possession (Score: 15-24)
Gary Johnson drives, Lamelo Simmons stays with him. Gary Johnson attempts a Dunk. Contested by Lamelo Simmons (5.0 feet, MAN). GARY JOHNSON MAKES IT! Assist: Magic Westbrook
Score: 17-24

[00:55] Team_014 possession (Score: 17-24)
Jordan Anunoby attempts a 3Pt. Contested by Shaquille Ginobili (4.6 feet, ZONE). Jordan Anunoby misses. Rebound secured by Magic Westbrook.

[00:42] Team_035 possession (Score: 17-24)
Domantas Green attempts a 3Pt. Contested by Michael Cunningham (4.8 feet, MAN). DOMANTAS GREEN MAKES IT! Assist: Dwyane Johnson
Score: 20-24

[00:30] Team_014 possession (Score: 20-24)
FOUL! Shooting foul on Dwyane Johnson. DeMar Adebayo to the line for 2 free throws. [BONUS: 7 team fouls] (Dwyane Johnson: 3 personal fouls)   FT 1/2: GOOD   FT 2/2: GOOD DeMar Adebayo makes 2/2 from the line.
Score: 20-26

[00:18] Team_035 possession (Score: 20-26)
FOUL! Reach-in foul on DeMar Adebayo during the drive. [IN THE BONUS! 6 team fouls] Dwyane Johnson to the line for 2 free throws. (DeMar Adebayo: 3 personal fouls)   FT 1/2: MISS   FT 2/2: GOOD Dwyane Johnson makes 1/2 from the line.
Score: 21-26

[00:06] Team_014 possession (Score: 21-26)
Jordan Anunoby attempts a 3Pt. Contested by Shaquille Ginobili (4.7 feet, ZONE). JORDAN ANUNOBY MAKES IT! Assist: Ayo Murray
Score: 21-29

================================================================================
                              1ST QUARTER COMPLETE                              
================================================================================

1ST QUARTER SCORE: Team_035 21, Team_014 29

BOX SCORE:
================================================================================

Team_035
--------------------------------------------------------------------------------
Player                MIN  PTS  REB  AST  TO      FG   FG%      3P   3P%
--------------------------------------------------------------------------------
Gary Johnson           12   12    2    0   0   5/9    55.6     0/0   0.0
Domantas Green         12    8    0    0   0   3/5    60.0     0/0   0.0
Dwyane Johnson         12    1    1    1   0   1/2    50.0     0/0   0.0
Magic Westbrook        12    0    7    1   0   0/1     0.0     0/0   0.0
Shaquille Ginobili     12    0    0    2   0   0/2     0.0     0/0   0.0

TEAM: FG: 9/19 (47.4%), 3PT: 3/7 (42.9%), REB: 10 (1 off, 9 def), AST: 4, TO: 3
TEAM FOULS: 7 [Team_014 in BONUS]


Team_014
--------------------------------------------------------------------------------
Player                MIN  PTS  REB  AST  TO      FG   FG%      3P   3P%
--------------------------------------------------------------------------------
Michael Cunningham     12   11    4    0   0   4/8    50.0     0/0   0.0
Jordan Anunoby         12    7    0    2   0   3/4    75.0     0/0   0.0
Lamelo Simmons         12    3    0    2   0   1/3    33.3     0/0   0.0
Ayo Murray             12    3    4    1   0   1/2    50.0     0/0   0.0
DeMar Adebayo          12    2    3    1   0   1/2    50.0     0/0   0.0

TEAM: FG: 10/19 (52.6%), 3PT: 4/10 (40.0%), REB: 11 (1 off, 10 def), AST: 6, TO: 3
TEAM FOULS: 6 [Team_035 in BONUS]

================================================================================

================================================================================
                       2ND QUARTER - Team_035 vs Team_014                       
================================================================================

[12:00] Team_035 possession (Score: 21-29)
Magic Westbrook attempts a Layup. Contested by DeMar Adebayo (3.9 feet, ZONE). MAGIC WESTBROOK MAKES IT! Assist: Shaquille Ginobili
Score: 23-29

[11:43] Team_014 possession (Score: 23-29)
Jordan Anunoby attempts a 3Pt. Contested by Shaquille Ginobili (4.5 feet, MAN). Jordan Anunoby misses. Offensive rebound by Ayo Murray! Ayo Murray kicks it out.

[11:29] Team_014 possession (Score: 23-29)
Jordan Anunoby drives to the basket... Jordan Anunoby loses the ball! Stripped by Magic Westbrook! TURNOVER! (live ball)

[11:14] Team_035 possession (Score: 23-29)
Gary Johnson attempts a 3Pt. Contested by Lamelo Simmons (5.0 feet, MAN). Gary Johnson misses. Rebound secured by Ayo Murray.

[11:02] Team_014 possession (Score: 23-29)
DeMar Adebayo drives and kicks out. Lamelo Simmons attempts a 3Pt. Contested by Shaquille Ginobili (4.4 feet, ZONE). Lamelo Simmons misses. Rebound secured by Magic Westbrook.

[10:53] Team_035 possession (Score: 23-29)
Gary Johnson attempts a Layup. Contested by DeMar Adebayo (4.1 feet, ZONE). GARY JOHNSON MAKES IT! Assist: Dwyane Johnson
Score: 25-29

[10:36] Team_014 possession (Score: 25-29)
Ayo Murray attempts a Layup. Contested by Magic Westbrook (5.1 feet, MAN). Ayo Murray misses. FOUL! Loose ball foul on Dwyane Johnson during the rebound battle. [Team fouls: 1] No free throws, side out. (Dwyane Johnson: 1 personal fouls)

[10:23] Team_014 possession (Score: 25-29)
FOUL! Holding foul on Shaquille Ginobili. [Team fouls: 2] No free throws, side out. (Shaquille Ginobili: 1 personal fouls)

[10:06] Team_014 possession (Score: 25-29)
Lamelo Simmons attempts a Layup. Contested by Gary Johnson (4.6 feet, MAN). Lamelo Simmons misses. Rebound secured by Magic Westbrook.

[09:53] Team_035 possession (Score: 25-29)
Domantas Green attempts a 3Pt. Contested by Jordan Anunoby (5.6 feet, ZONE). DOMANTAS GREEN MAKES IT!
Score: 28-29

[09:38] Team_014 possession (Score: 28-29)
Michael Cunningham throws a bad pass! Stolen by Domantas Green! TURNOVER! (live ball)

[09:23] Team_035 possession (Score: 28-29)
Magic Westbrook drives and kicks out. Dwyane Johnson attempts a 3Pt. Contested by Jordan Anunoby (5.3 feet, ZONE). Dwyane Johnson misses. FOUL! Loose ball foul on DeMar Adebayo during the rebound battle. [Team fouls: 1] No free throws, side out. (DeMar Adebayo: 1 personal fouls)

[09:14] Team_035 possession (Score: 28-29)
Magic Westbrook attempts a Midrange. Contested by DeMar Adebayo (4.3 feet, ZONE). Magic Westbrook misses. Rebound secured by DeMar Adebayo.

[09:04] Team_014 possession (Score: 28-29)
DeMar Adebayo loses the ball! Stripped by Dwyane Johnson! TURNOVER! (live ball)

[08:51] Team_035 possession (Score: 28-29)
Dwyane Johnson attempts a Layup. Contested by DeMar Adebayo (3.9 feet, MAN). Dwyane Johnson misses. Rebound secured by Michael Cunningham.

[08:34] Team_014 possession (Score: 28-29)
Michael Cunningham attempts a 3Pt. Contested by Domantas Green (5.1 feet, MAN). MICHAEL CUNNINGHAM MAKES IT! Assist: Lamelo Simmons
Score: 28-32

[08:19] Team_035 possession (Score: 28-32)
Shaquille Ginobili drives, Jordan Anunoby stays with him. Shaquille Ginobili attempts a Layup. Contested by Jordan Anunoby (5.3 feet, MAN). SHAQUILLE GINOBILI MAKES IT! Assist: Magic Westbrook
Score: 30-32

[08:09] Team_014 possession (Score: 30-32)
Ayo Murray drives and kicks out. Michael Cunningham attempts a Midrange. Contested by Domantas Green (5.4 feet, MAN). MICHAEL CUNNINGHAM MAKES IT!
Score: 30-34

[07:56] Team_035 possession (Score: 30-34)
Magic Westbrook attempts a Layup. BLOCKED BY AYO MURRAY! Ball deflects out of bounds off Magic Westbrook.

[07:41] Team_014 possession (Score: 30-34)
Lamelo Simmons makes the Layup and draws the foul on Gary Johnson! And-1! Lamelo Simmons to the line for 1. [Team fouls: 3] (Gary Johnson: 1 personal fouls)   FT 1/1: GOOD Lamelo Simmons makes 1/1 from the line.
Score: 30-37

[07:27] Team_035 possession (Score: 30-37)
FOUL! Reach-in foul on DeMar Adebayo during the drive. [Team fouls: 2] No free throws, side out. (DeMar Adebayo: 2 personal fouls)

[07:10] Team_035 possession (Score: 30-37)
FOUL! Shooting foul on Jordan Anunoby. Domantas Green to the line for 2 free throws. [Team fouls: 3] (Jordan Anunoby: 1 personal fouls)   FT 1/2: GOOD   FT 2/2: GOOD Domantas Green makes 2/2 from the line.
Score: 32-37

[06:53] Team_014 possession (Score: 32-37)
FOUL! Shooting foul on Gary Johnson. Lamelo Simmons to the line for 2 free throws. [Team fouls: 4] (Gary Johnson: 2 personal fouls)   FT 1/2: GOOD   FT 2/2: GOOD Lamelo Simmons makes 2/2 from the line.
Score: 32-39

[06:40] Team_035 possession (Score: 32-39)
Domantas Green attempts a 3Pt. Contested by Jordan Anunoby (5.9 feet, ZONE). Domantas Green misses. Offensive rebound by Gary Johnson! Gary Johnson kicks it out.

[06:25] Team_035 possession (Score: 32-39)
Magic Westbrook attempts a Midrange. Contested by Jordan Anunoby (6.0 feet, ZONE). MAGIC WESTBROOK MAKES IT! Assist: Gary Johnson
Score: 34-39

[06:11] Team_014 possession (Score: 34-39)
Jordan Anunoby attempts a Layup. Contested by Shaquille Ginobili (5.2 feet, MAN). JORDAN ANUNOBY MAKES IT! Assist: Ayo Murray
Score: 34-41

[05:56] Team_035 possession (Score: 34-41)
Dwyane Johnson attempts a Layup. BLOCKED BY DEMAR ADEBAYO! Ball is loose! Offensive rebound by Gary Johnson! Gary Johnson kicks it out.

[05:45] Team_035 possession (Score: 34-41)
Gary Johnson drives and kicks out. FOUL! Shooting foul on DeMar Adebayo. Dwyane Johnson to the line for 2 free throws. [Team fouls: 4] (DeMar Adebayo: 3 personal fouls)   FT 1/2: GOOD   FT 2/2: MISS Dwyane Johnson makes 1/2 from the line. Offensive rebound by Dwyane Johnson! Dwyane Johnson kicks it out.
Score: 35-41

[05:34] Team_035 possession (Score: 35-41)
Dwyane Johnson attempts a Midrange. Contested by Lamelo Simmons (5.4 feet, ZONE). Dwyane Johnson misses. Rebound secured by Ayo Murray.

[05:24] Team_014 possession (Score: 35-41)
Michael Cunningham drives, picks up Domantas Green. Help arrives from Shaquille Ginobili! Michael Cunningham attempts a Dunk. Contested by Shaquille Ginobili (5.5 feet, MAN). Michael Cunningham misses. Offensive rebound by DeMar Adebayo! DeMar Adebayo kicks it out.

[05:08] Team_014 possession (Score: 35-41)
Lamelo Simmons attempts a 3Pt. Contested by Gary Johnson (5.2 feet, MAN). Lamelo Simmons misses. Rebound secured by Dwyane Johnson.

[04:56] Team_035 possession (Score: 35-41)
Dwyane Johnson attempts a Layup. Contested by DeMar Adebayo (4.6 feet, MAN). DWYANE JOHNSON MAKES IT! Assist: Domantas Green
Score: 37-41

[04:43] Team_014 possession (Score: 37-41)
Jordan Anunoby attempts a 3Pt. Contested by Shaquille Ginobili (5.4 feet, MAN). Jordan Anunoby misses. Rebound secured by Gary Johnson.

[04:30] Team_035 possession (Score: 37-41)
Dwyane Johnson attempts a Midrange. Contested by DeMar Adebayo (4.7 feet, ZONE). Dwyane Johnson misses. Rebound secured by Ayo Murray.

[04:14] Team_014 possession (Score: 37-41)
FOUL! Shooting foul on Magic Westbrook. Michael Cunningham to the line for 2 free throws. [BONUS: 5 team fouls] (Magic Westbrook: 1 personal fouls)   FT 1/2: MISS   FT 2/2: GOOD Michael Cunningham makes 1/2 from the line.
Score: 37-42

[03:57] Team_035 possession (Score: 37-42)
Shaquille Ginobili attempts a Layup. BLOCKED BY JORDAN ANUNOBY! Ball is loose! Rebound secured by Ayo Murray.

[03:43] Team_014 possession (Score: 37-42)
Michael Cunningham attempts a Midrange. Contested by Domantas Green (5.8 feet, MAN). MICHAEL CUNNINGHAM MAKES IT! Assist: DeMar Adebayo
Score: 37-44

[03:24] Team_035 possession (Score: 37-44)
Magic Westbrook drives and kicks out. Magic Westbrook attempts a Midrange. Wide open! Jordan Anunoby is 6.3 feet away. [ZONE] MAGIC WESTBROOK MAKES IT! Assist: Gary Johnson
Score: 39-44

[03:08] Team_014 possession (Score: 39-44)
DeMar Adebayo drives, Magic Westbrook stays with him. DeMar Adebayo attempts a Layup. Contested by Magic Westbrook (5.9 feet, ZONE). DeMar Adebayo misses. Rebound secured by Dwyane Johnson.

[02:54] Team_035 possession (Score: 39-44)
FOUL! Reach-in foul on Michael Cunningham during the drive. [IN THE BONUS! 5 team fouls] Domantas Green to the line for 2 free throws. (Michael Cunningham: 1 personal fouls)   FT 1/2: GOOD   FT 2/2: GOOD Domantas Green makes 2/2 from the line.
Score: 41-44

[02:39] Team_014 possession (Score: 41-44)
Ayo Murray makes the Dunk and draws the foul on Domantas Green! And-1! Ayo Murray to the line for 1. [BONUS: 6 team fouls] (Domantas Green: 1 personal fouls)   FT 1/1: MISS Ayo Murray makes 0/1 from the line. Rebound secured by Gary Johnson.
Score: 41-46

[02:28] Team_035 possession (Score: 41-46)
Domantas Green drives, Michael Cunningham stays with him. Domantas Green attempts a Layup. Contested by Michael Cunningham (6.0 feet, MAN). Domantas Green misses. Rebound secured by Michael Cunningham.

[02:16] Team_014 possession (Score: 41-46)
Ayo Murray throws a bad pass out of bounds! TURNOVER! (dead ball)

[02:16] Substitution (Team_035): Domantas Green OUT → CJ LaVine IN (stamina_rule2)

[02:16] Substitution (Team_035): Shaquille Ginobili OUT → Cole George IN (stamina_rule2)

[02:16] Substitution (Team_035): Gary Johnson OUT → Malcolm Turner IN (stamina_rule2)

[02:16] Substitution (Team_035): Dwyane Johnson OUT → Tobias Jordan IN (stamina_rule2)

[02:16] Substitution (Team_035): Magic Westbrook OUT → John Durant IN (stamina_rule2)

[02:16] Substitution (Team_014): Michael Cunningham OUT → Jalen Booker IN (stamina_rule2)

[02:16] Substitution (Team_014): Jordan Anunoby OUT → Bones Quickley IN (stamina_rule2)

[02:16] Substitution (Team_014): Lamelo Simmons OUT → Tracy Westbrook IN (stamina_rule2)

[02:16] Substitution (Team_014): DeMar Adebayo OUT → Nikola James IN (stamina_rule2)

[02:16] Substitution (Team_014): Ayo Murray OUT → Collin Gasol IN (stamina_rule2)

[02:01] Team_035 possession (Score: 41-46)
CJ LaVine attempts a Midrange. Contested by Tracy Westbrook (5.4 feet, ZONE). CJ LaVine misses. Offensive rebound by Tobias Jordan! Tobias Jordan kicks it out.

[01:43] Team_035 possession (Score: 41-46)
Malcolm Turner attempts a 3Pt. Contested by Tracy Westbrook (5.8 feet, MAN). Malcolm Turner misses. Rebound secured by Tracy Westbrook.

[01:31] Team_014 possession (Score: 41-46)
FOUL! Shooting foul on Tobias Jordan. Nikola James to the line for 2 free throws. [BONUS: 7 team fouls] (Tobias Jordan: 1 personal fouls)   FT 1/2: GOOD   FT 2/2: GOOD Nikola James makes 2/2 from the line.
Score: 41-48

[01:17] Team_035 possession (Score: 41-48)
Malcolm Turner attempts a 3Pt. Contested by Tracy Westbrook (5.8 feet, MAN). Malcolm Turner misses. Rebound secured by Collin Gasol.

[01:04] Team_014 possession (Score: 41-48)
Nikola James drives to the basket... Nikola James loses the ball! Stripped by John Durant! TURNOVER! (live ball)

[00:46] Team_035 possession (Score: 41-48)
Tobias Jordan attempts a 3Pt. Contested by Nikola James (4.9 feet, MAN). Tobias Jordan misses. Rebound secured by Tracy Westbrook.

[00:31] Team_014 possession (Score: 41-48)
Nikola James attempts a Layup. BLOCKED BY JOHN DURANT! Ball is loose! Offensive rebound by Collin Gasol! Collin Gasol kicks it out.

[00:13] Team_014 possession (Score: 41-48)
Collin Gasol attempts a 3Pt. Contested by John Durant (4.8 feet, MAN). COLLIN GASOL MAKES IT! Assist: Tracy Westbrook
Score: 41-51

================================================================================
                              2ND QUARTER COMPLETE                              
================================================================================

2ND QUARTER SCORE: Team_035 20, Team_014 22

BOX SCORE:
================================================================================

Team_035
--------------------------------------------------------------------------------
Player                MIN  PTS  REB  AST  TO      FG   FG%      3P   3P%
--------------------------------------------------------------------------------
Domantas Green         22    7    0    1   0   3/4    75.0     0/0   0.0
Magic Westbrook        22    6    2    1   0   3/5    60.0     0/0   0.0
Shaquille Ginobili     22    2    0    1   0   1/2    50.0     0/0   0.0
Gary Johnson           22    2    4    2   0   1/2    50.0     0/0   0.0
Dwyane Johnson         22    2    4    1   0   1/4    25.0     0/0   0.0
Tobias Jordan           2    0    1    0   0   0/1     0.0     0/0   0.0
Malcolm Turner          2    0    0    0   0   0/2     0.0     0/0   0.0

TEAM: FG: 9/20 (45.0%), 3PT: 1/5 (20.0%), REB: 11 (5 off, 6 def), AST: 6, TO: 0
TEAM FOULS: 7 [Team_014 in BONUS]


Team_014
--------------------------------------------------------------------------------
Player                MIN  PTS  REB  AST  TO      FG   FG%      3P   3P%
--------------------------------------------------------------------------------
Michael Cunningham     22    8    2    0   0   4/4   100.0     0/0   0.0
Lamelo Simmons         22    5    0    1   0   2/4    50.0     0/0   0.0
Collin Gasol            2    3    2    0   0   1/1   100.0     0/0   0.0
Jordan Anunoby         22    2    0    0   0   1/2    50.0     0/0   0.0
Nikola James            2    2    0    0   0   1/1   100.0     0/0   0.0
Ayo Murray             22    0    5    1   0   0/1     0.0     0/0   0.0
DeMar Adebayo          22    0    3    1   0   0/2     0.0     0/0   0.0
Tracy Westbrook         2    0    2    1   0   0/0     0.0     0/0   0.0

TEAM: FG: 9/15 (60.0%), 3PT: 2/4 (50.0%), REB: 14 (4 off, 10 def), AST: 4, TO: 5
TEAM FOULS: 5 [Team_035 in BONUS]

================================================================================

================================================================================
                       3RD QUARTER - Team_035 vs Team_014                       
================================================================================

[12:00] Team_035 possession (Score: 41-51)
Dwyane Johnson drives and kicks out. Shaquille Ginobili attempts a 3Pt. Contested by Jordan Anunoby (4.7 feet, MAN). Shaquille Ginobili misses. Rebound secured by Ayo Murray.

[11:48] Team_014 possession (Score: 41-51)
Ayo Murray attempts a Layup. Contested by Dwyane Johnson (4.2 feet, ZONE). AYO MURRAY MAKES IT!
Score: 41-53

[11:34] Team_035 possession (Score: 41-53)
Shaquille Ginobili drives and kicks out. Shaquille Ginobili attempts a Midrange. Contested by Jordan Anunoby (4.7 feet, MAN). Shaquille Ginobili misses. Rebound secured by Michael Cunningham.

[11:23] Team_014 possession (Score: 41-53)
FOUL! Holding foul on Magic Westbrook. [Team fouls: 1] No free throws, side out. (Magic Westbrook: 1 personal fouls)

[11:10] Team_014 possession (Score: 41-53)
DeMar Adebayo drives, Magic Westbrook stays with him. DeMar Adebayo attempts a Layup. Contested by Magic Westbrook (4.2 feet, ZONE). DeMar Adebayo misses. Offensive rebound by Ayo Murray! Ayo Murray kicks it out.

[10:55] Team_014 possession (Score: 41-53)
DeMar Adebayo attempts a 3Pt. Contested by Domantas Green (4.5 feet, ZONE). DeMar Adebayo misses. Rebound secured by Magic Westbrook.

[10:38] Team_035 possession (Score: 41-53)
Dwyane Johnson attempts a 3Pt. Contested by DeMar Adebayo (3.0 feet, MAN). Dwyane Johnson misses. Rebound secured by Michael Cunningham.

[10:23] Team_014 possession (Score: 41-53)
FOUL! Offensive foul on Ayo Murray! Magic Westbrook drew the charge! [Team fouls: 1] (Ayo Murray: 1 personal fouls) TURNOVER! (dead ball)

[10:10] Team_035 possession (Score: 41-53)
Dwyane Johnson throws a bad pass! Stolen by DeMar Adebayo! TURNOVER! (live ball)

[09:53] Team_014 possession (Score: 41-53)
Michael Cunningham attempts a Midrange. Contested by Domantas Green (4.4 feet, MAN). Michael Cunningham misses. Rebound secured by Gary Johnson.

[09:36] Team_035 possession (Score: 41-53)
Shaquille Ginobili drives, DeMar Adebayo stays with him. Shaquille Ginobili attempts a Layup. Contested by DeMar Adebayo (3.0 feet, ZONE). SHAQUILLE GINOBILI MAKES IT! Assist: Magic Westbrook
Score: 43-53

[09:19] Team_014 possession (Score: 43-53)
DeMar Adebayo attempts a Midrange. Contested by Dwyane Johnson (3.8 feet, MAN). DeMar Adebayo misses. Offensive rebound by DeMar Adebayo! DeMar Adebayo kicks it out.

[09:05] Team_014 possession (Score: 43-53)
DeMar Adebayo attempts a 3Pt. Contested by Dwyane Johnson (3.8 feet, MAN). DEMAR ADEBAYO MAKES IT!
Score: 43-56

[08:53] Team_035 possession (Score: 43-56)
Gary Johnson attempts a Layup. Contested by Lamelo Simmons (4.5 feet, MAN). GARY JOHNSON MAKES IT! Assist: Domantas Green
Score: 45-56

[08:39] Team_014 possession (Score: 45-56)
Ayo Murray attempts a Layup. Contested by Dwyane Johnson (4.2 feet, ZONE). AYO MURRAY MAKES IT!
Score: 45-58

[08:28] Team_035 possession (Score: 45-58)
Gary Johnson attempts a Midrange. Contested by Lamelo Simmons (4.5 feet, MAN). GARY JOHNSON MAKES IT!
Score: 47-58

[08:18] Team_014 possession (Score: 47-58)
FOUL! Shooting foul on Magic Westbrook. Ayo Murray to the line for 2 free throws. [Team fouls: 2] (Magic Westbrook: 2 personal fouls)   FT 1/2: GOOD   FT 2/2: GOOD Ayo Murray makes 2/2 from the line.
Score: 47-60

[08:05] Team_035 possession (Score: 47-60)
FOUL! Reach-in foul on DeMar Adebayo during the drive. [Team fouls: 2] No free throws, side out. (DeMar Adebayo: 1 personal fouls)

[07:51] Team_035 possession (Score: 47-60)
Gary Johnson drives, picks up Lamelo Simmons. Help arrives from Michael Cunningham! Gary Johnson attempts a Dunk. Contested by Michael Cunningham (4.5 feet, MAN). Gary Johnson misses. Rebound secured by Michael Cunningham.

[07:34] Team_014 possession (Score: 47-60)
Lamelo Simmons attempts a 3Pt. Contested by Shaquille Ginobili (4.4 feet, ZONE). LAMELO SIMMONS MAKES IT!
Score: 47-63

[07:19] Team_035 possession (Score: 47-63)
Magic Westbrook attempts a Midrange. Contested by Ayo Murray (5.2 feet, MAN). Magic Westbrook misses. Offensive rebound by Dwyane Johnson! Dwyane Johnson puts it back in!
Score: 49-63

[07:07] Team_014 possession (Score: 49-63)
Lamelo Simmons drives to the basket... Lamelo Simmons loses the ball! Stripped by Magic Westbrook! TURNOVER! (live ball)

[06:55] Team_035 possession (Score: 49-63)
Gary Johnson attempts a Midrange. Contested by Lamelo Simmons (4.5 feet, MAN). Gary Johnson misses. Rebound secured by Michael Cunningham.

[06:38] Team_014 possession (Score: 49-63)
Ayo Murray drives, Magic Westbrook stays with him. Ayo Murray attempts a Layup. Contested by Magic Westbrook (4.6 feet, MAN). Ayo Murray misses. Rebound secured by Gary Johnson.

[06:23] Team_035 possession (Score: 49-63)
Dwyane Johnson attempts a 3Pt. Contested by DeMar Adebayo (3.0 feet, MAN). Dwyane Johnson misses. Rebound secured by Michael Cunningham.

[06:03] Team_014 possession (Score: 49-63)
DeMar Adebayo attempts a Midrange. Contested by Dwyane Johnson (3.8 feet, MAN). DeMar Adebayo misses. Rebound secured by Magic Westbrook.

[05:46] Team_035 possession (Score: 49-63)
Magic Westbrook drives to the basket... Magic Westbrook loses control! Ball rolls out of bounds! TURNOVER! (dead ball)

[05:34] Team_014 possession (Score: 49-63)
Ayo Murray drives to the basket... Ayo Murray throws a bad pass! Stolen by Magic Westbrook! TURNOVER! (live ball)

[05:19] Team_035 possession (Score: 49-63)
Gary Johnson attempts a Midrange. Contested by Lamelo Simmons (4.6 feet, MAN). Gary Johnson misses. Rebound secured by Michael Cunningham.

[05:05] Team_014 possession (Score: 49-63)
Michael Cunningham drives, picks up Domantas Green. Help arrives from Shaquille Ginobili! Michael Cunningham attempts a Dunk. Contested by Shaquille Ginobili (4.4 feet, MAN). MICHAEL CUNNINGHAM MAKES IT! Assist: Ayo Murray
Score: 49-65

[04:55] Team_035 possession (Score: 49-65)
Domantas Green drives, picks up DeMar Adebayo. Help arrives from Michael Cunningham! Domantas Green attempts a Dunk. Contested by Michael Cunningham (3.6 feet, ZONE). Domantas Green misses. Rebound secured by DeMar Adebayo.

[04:39] Team_014 possession (Score: 49-65)
Lamelo Simmons attempts a Midrange. Contested by Shaquille Ginobili (4.4 feet, ZONE). Lamelo Simmons misses. Rebound secured by Magic Westbrook.

[04:25] Team_035 possession (Score: 49-65)
Domantas Green attempts a Midrange. Contested by Michael Cunningham (4.5 feet, MAN). Domantas Green misses. Offensive rebound by Magic Westbrook! Magic Westbrook kicks it out.

[04:08] Team_035 possession (Score: 49-65)
Shaquille Ginobili attempts a 3Pt. Contested by Jordan Anunoby (4.6 feet, MAN). Shaquille Ginobili misses. Rebound secured by Ayo Murray.

[03:59] Team_014 possession (Score: 49-65)
FOUL! Holding foul on Dwyane Johnson. [Team fouls: 3] No free throws, side out. (Dwyane Johnson: 1 personal fouls)

[03:45] Team_014 possession (Score: 49-65)
Lamelo Simmons makes the Layup and draws the foul on Gary Johnson! And-1! Lamelo Simmons to the line for 1. [Team fouls: 4] (Gary Johnson: 1 personal fouls)   FT 1/1: GOOD Lamelo Simmons makes 1/1 from the line.
Score: 49-68

[03:27] Team_035 possession (Score: 49-68)
Magic Westbrook attempts a Midrange. Contested by DeMar Adebayo (3.7 feet, ZONE). Magic Westbrook misses. Rebound secured by DeMar Adebayo.

[03:14] Team_014 possession (Score: 49-68)
FOUL! Reach-in foul on Shaquille Ginobili during the drive. [IN THE BONUS! 5 team fouls] Jordan Anunoby to the line for 2 free throws. (Shaquille Ginobili: 1 personal fouls)   FT 1/2: GOOD   FT 2/2: GOOD Jordan Anunoby makes 2/2 from the line.
Score: 49-70

[02:59] Team_035 possession (Score: 49-70)
Magic Westbrook drives, Ayo Murray stays with him. Magic Westbrook attempts a Dunk. Contested by Ayo Murray (5.4 feet, MAN). MAGIC WESTBROOK MAKES IT! Assist: Gary Johnson
Score: 51-70

[02:48] Team_014 possession (Score: 51-70)
Jordan Anunoby attempts a 3Pt. Contested by Shaquille Ginobili (4.4 feet, ZONE). JORDAN ANUNOBY MAKES IT!
Score: 51-73

[02:35] Team_035 possession (Score: 51-73)
Dwyane Johnson throws a bad pass! Stolen by DeMar Adebayo! TURNOVER! (live ball)

[02:21] Team_014 possession (Score: 51-73)
Lamelo Simmons attempts a 3Pt. Contested by Dwyane Johnson (4.5 feet, ZONE). Lamelo Simmons misses. Rebound secured by Magic Westbrook.

[02:06] Team_035 possession (Score: 51-73)
Gary Johnson attempts a 3Pt. Contested by Jordan Anunoby (5.5 feet, ZONE). GARY JOHNSON MAKES IT! Assist: Shaquille Ginobili
Score: 54-73

[01:52] Team_014 possession (Score: 54-73)
Ayo Murray makes the Dunk and draws the foul on Magic Westbrook! And-1! Ayo Murray to the line for 1. [BONUS: 6 team fouls] (Magic Westbrook: 3 personal fouls)   FT 1/1: GOOD Ayo Murray makes 1/1 from the line.
Score: 54-76

[01:38] Team_035 possession (Score: 54-76)
Magic Westbrook drives and kicks out. FOUL! Shooting foul on Jordan Anunoby. Magic Westbrook to the line for 3 free throws. [Team fouls: 3] (Jordan Anunoby: 1 personal fouls)   FT 1/3: GOOD   FT 2/3: GOOD   FT 3/3: MISS Magic Westbrook makes 2/3 from the line. Rebound secured by DeMar Adebayo.
Score: 56-76

[01:20] Team_014 possession (Score: 56-76)
DeMar Adebayo attempts a Layup. Contested by Dwyane Johnson (4.2 feet, ZONE). DEMAR ADEBAYO MAKES IT!
Score: 56-78

[01:06] Team_035 possession (Score: 56-78)
Domantas Green makes the Layup and draws the foul on Michael Cunningham! And-1! Domantas Green to the line for 1. [Team fouls: 4] (Michael Cunningham: 1 personal fouls)   FT 1/1: GOOD Domantas Green makes 1/1 from the line.
Score: 59-78

[00:52] Team_014 possession (Score: 59-78)
Michael Cunningham drives and kicks out. Jordan Anunoby attempts a 3Pt. Contested by Shaquille Ginobili (4.4 feet, MAN). Jordan Anunoby misses. Rebound secured by Dwyane Johnson.

[00:36] Team_035 possession (Score: 59-78)
Domantas Green attempts a 3Pt. Contested by Jordan Anunoby (5.5 feet, ZONE). Domantas Green misses. Rebound secured by Ayo Murray.

[00:17] Team_014 possession (Score: 59-78)
Ayo Murray loses control! Ball rolls out of bounds! TURNOVER! (dead ball)

[00:17] Substitution (Team_035): Domantas Green OUT → CJ LaVine IN (stamina_rule2)

[00:17] Substitution (Team_035): Shaquille Ginobili OUT → Cole George IN (stamina_rule2)

[00:17] Substitution (Team_035): Gary Johnson OUT → Malcolm Turner IN (stamina_rule2)

[00:17] Substitution (Team_035): Dwyane Johnson OUT → Tobias Jordan IN (stamina_rule2)

[00:17] Substitution (Team_035): Magic Westbrook OUT → John Durant IN (stamina_rule2)

[00:17] Substitution (Team_014): Michael Cunningham OUT → Jalen Booker IN (stamina_rule2)

[00:17] Substitution (Team_014): Jordan Anunoby OUT → Bones Quickley IN (stamina_rule2)

[00:17] Substitution (Team_014): Lamelo Simmons OUT → Tracy Westbrook IN (stamina_rule2)

[00:17] Substitution (Team_014): DeMar Adebayo OUT → Nikola James IN (stamina_rule2)

[00:17] Substitution (Team_014): Ayo Murray OUT → Collin Gasol IN (stamina_rule2)

[00:05] Team_035 possession (Score: 59-78)
John Durant attempts a Layup. Contested by Nikola James (5.1 feet, ZONE). JOHN DURANT MAKES IT! Assist: Tobias Jordan
Score: 61-78

================================================================================
                              3RD QUARTER COMPLETE                              
================================================================================

3RD QUARTER SCORE: Team_035 20, Team_014 27

BOX SCORE:
================================================================================

Team_035
--------------------------------------------------------------------------------
Player                MIN  PTS  REB  AST  TO      FG   FG%      3P   3P%
--------------------------------------------------------------------------------
Gary Johnson           34    7    2    1   0   3/6    50.0     0/0   0.0
Domantas Green         34    3    0    1   0   1/3    33.3     0/0   0.0
Dwyane Johnson         34    2    2    0   0   1/4    25.0     0/0   0.0
Shaquille Ginobili     34    2    0    1   0   1/3    33.3     0/0   0.0
Magic Westbrook        34    2    5    1   0   1/3    33.3     0/0   0.0
John Durant             2    2    0    0   0   1/1   100.0     0/0   0.0
Tobias Jordan           2    0    0    1   0   0/0     0.0     0/0   0.0

TEAM: FG: 8/20 (40.0%), 3PT: 1/5 (20.0%), REB: 9 (2 off, 7 def), AST: 5, TO: 3
TEAM FOULS: 6 [Team_014 in BONUS]


Team_014
--------------------------------------------------------------------------------
Player                MIN  PTS  REB  AST  TO      FG   FG%      3P   3P%
--------------------------------------------------------------------------------
Ayo Murray             34    9    4    1   0   4/5    80.0     0/0   0.0
Lamelo Simmons         34    6    0    0   0   2/4    50.0     0/0   0.0
DeMar Adebayo          34    5    4    0   0   2/4    50.0     0/0   0.0
Jordan Anunoby         34    5    0    0   0   2/2   100.0     0/0   0.0
Michael Cunningham     34    2    6    0   0   1/3    33.3     0/0   0.0

TEAM: FG: 11/18 (61.1%), 3PT: 3/5 (60.0%), REB: 14 (2 off, 12 def), AST: 1, TO: 4
TEAM FOULS: 4

================================================================================

================================================================================
                       4TH QUARTER - Team_035 vs Team_014                       
================================================================================

[12:00] Substitution (Team_035): Domantas Green OUT (stamina: 70) → CJ LaVine IN (comeback_detected)

[12:00] Substitution (Team_014): Michael Cunningham OUT (stamina: 70) → Jalen Booker IN (comeback_detected)

[12:00] Team_035 possession (Score: 61-78)
Gary Johnson attempts a 3Pt. Contested by Lamelo Simmons (4.9 feet, MAN). Gary Johnson misses. Offensive rebound by Magic Westbrook! Magic Westbrook kicks it out.

[11:49] Team_035 possession (Score: 61-78)
Gary Johnson attempts a Layup. Contested by DeMar Adebayo (4.0 feet, ZONE). GARY JOHNSON MAKES IT! Assist: CJ LaVine
Score: 63-78

[11:34] Team_014 possession (Score: 63-78)
FOUL! Reach-in foul on CJ LaVine during the drive. [Team fouls: 1] No free throws, side out. (CJ LaVine: 1 personal fouls)

[11:18] Team_014 possession (Score: 63-78)
DeMar Adebayo drives to the basket... DeMar Adebayo throws a bad pass out of bounds! TURNOVER! (dead ball)

[11:18] Substitution (Team_035): Shaquille Ginobili OUT → Cole George IN (stamina_rule2)

[11:18] Substitution (Team_035): Gary Johnson OUT → Malcolm Turner IN (stamina_rule2)

[11:18] Substitution (Team_035): Dwyane Johnson OUT → Tobias Jordan IN (stamina_rule2)

[11:18] Substitution (Team_035): Magic Westbrook OUT → John Durant IN (stamina_rule2)

[11:18] Substitution (Team_014): Jordan Anunoby OUT → Bones Quickley IN (stamina_rule2)

[11:18] Substitution (Team_014): Lamelo Simmons OUT → Tracy Westbrook IN (stamina_rule2)

[11:18] Substitution (Team_014): DeMar Adebayo OUT → Nikola James IN (stamina_rule2)

[11:18] Substitution (Team_014): Ayo Murray OUT → Collin Gasol IN (stamina_rule2)

[11:07] Team_035 possession (Score: 63-78)
FOUL! Reach-in foul on Collin Gasol during the drive. [Team fouls: 1] No free throws, side out. (Collin Gasol: 1 personal fouls)

[10:48] Team_035 possession (Score: 63-78)
Malcolm Turner drives and kicks out. Cole George attempts a 3Pt. Contested by Jalen Booker (4.3 feet, ZONE). Cole George misses. Offensive rebound by John Durant! John Durant kicks it out.

[10:34] Team_035 possession (Score: 63-78)
John Durant attempts a Midrange. Contested by Collin Gasol (5.1 feet, ZONE). John Durant misses. Rebound secured by Tracy Westbrook.

[10:21] Team_014 possession (Score: 63-78)
FOUL! Holding foul on Malcolm Turner. [Team fouls: 2] No free throws, side out. (Malcolm Turner: 1 personal fouls)

[10:04] Team_014 possession (Score: 63-78)
FOUL! Shooting foul on Malcolm Turner. Nikola James to the line for 2 free throws. [Team fouls: 3] (Malcolm Turner: 2 personal fouls)   FT 1/2: MISS   FT 2/2: GOOD Nikola James makes 1/2 from the line.
Score: 63-79

[09:50] Team_035 possession (Score: 63-79)
CJ LaVine attempts a 3Pt. Contested by Jalen Booker (4.4 feet, MAN). CJ LAVINE MAKES IT! Assist: Cole George
Score: 66-79

[09:38] Team_014 possession (Score: 66-79)
Nikola James attempts a Layup. BLOCKED BY JOHN DURANT! Ball is loose! Rebound secured by Tobias Jordan.

[09:22] Team_035 possession (Score: 66-79)
Tobias Jordan attempts a Midrange. Contested by Bones Quickley (5.3 feet, ZONE). TOBIAS JORDAN MAKES IT!
Score: 68-79

[09:10] Team_014 possession (Score: 68-79)
Jalen Booker drives, John Durant stays with him. Jalen Booker attempts a Dunk. Contested by John Durant (4.4 feet, ZONE). JALEN BOOKER MAKES IT!
Score: 68-81

[08:57] Team_035 possession (Score: 68-81)
CJ LaVine attempts a Midrange. Contested by Bones Quickley (5.7 feet, ZONE). CJ LAVINE MAKES IT!
Score: 70-81

[08:44] Team_014 possession (Score: 70-81)
Tracy Westbrook attempts a Midrange. Contested by Malcolm Turner (4.5 feet, MAN). Tracy Westbrook misses. Rebound secured by John Durant.

[08:33] Team_035 possession (Score: 70-81)
CJ LaVine makes the Midrange and draws the foul on Nikola James! And-1! CJ LaVine to the line for 1. [Team fouls: 2] (Nikola James: 1 personal fouls)   FT 1/1: MISS CJ LaVine makes 0/1 from the line. Offensive rebound by Tobias Jordan! Tobias Jordan kicks it out.
Score: 72-81

[08:17] Team_035 possession (Score: 72-81)
Tobias Jordan makes the Layup and draws the foul on Nikola James! And-1! Tobias Jordan to the line for 1. [Team fouls: 3] (Nikola James: 2 personal fouls)   FT 1/1: GOOD Tobias Jordan makes 1/1 from the line.
Score: 75-81

[08:02] Team_014 possession (Score: 75-81)
Collin Gasol drives to the basket... Collin Gasol throws a bad pass! Stolen by John Durant! TURNOVER! (live ball)

[07:46] Team_035 possession (Score: 75-81)
Malcolm Turner drives to the basket... Malcolm Turner loses control! Ball rolls out of bounds! TURNOVER! (dead ball)

[07:29] Team_014 possession (Score: 75-81)
Collin Gasol attempts a Midrange. Contested by John Durant (4.8 feet, MAN). Collin Gasol misses. Rebound secured by John Durant.

[07:15] Team_035 possession (Score: 75-81)
FOUL! Holding foul on Nikola James. [Team fouls: 4] No free throws, side out. (Nikola James: 3 personal fouls)

[07:02] Team_035 possession (Score: 75-81)
John Durant drives, Collin Gasol stays with him. John Durant attempts a Layup. Contested by Collin Gasol (5.1 feet, ZONE). JOHN DURANT MAKES IT! Assist: CJ LaVine
Score: 77-81

[06:46] Team_014 possession (Score: 77-81)
Collin Gasol drives and kicks out. FOUL! Shooting foul on Cole George. Jalen Booker to the line for 2 free throws. [Team fouls: 4] (Cole George: 1 personal fouls)   FT 1/2: MISS   FT 2/2: GOOD Jalen Booker makes 1/2 from the line.
Score: 77-82

[06:35] Team_035 possession (Score: 77-82)
FOUL! Holding foul on Jalen Booker. [IN THE BONUS! 5 team fouls] CJ LaVine to the line for 2 free throws. (Jalen Booker: 1 personal fouls)   FT 1/2: MISS   FT 2/2: GOOD CJ LaVine makes 1/2 from the line.
Score: 78-82

[06:18] Team_014 possession (Score: 78-82)
Collin Gasol attempts a Midrange. Contested by Cole George (4.0 feet, ZONE). Collin Gasol misses. Rebound secured by John Durant.

[05:59] Team_035 possession (Score: 78-82)
Tobias Jordan drives, Nikola James stays with him. Tobias Jordan attempts a Dunk. Contested by Nikola James (4.9 feet, MAN). TOBIAS JORDAN MAKES IT!
Score: 80-82

[05:45] Team_014 possession (Score: 80-82)
Nikola James attempts a 3Pt. Contested by CJ LaVine (4.3 feet, ZONE). Nikola James misses. Rebound secured by Tobias Jordan.

[05:27] Team_035 possession (Score: 80-82)
John Durant loses the ball! Stripped by Collin Gasol! TURNOVER! (live ball)

[05:17] Team_014 possession (Score: 80-82)
Bones Quickley attempts a Midrange. Contested by Cole George (3.4 feet, MAN). BONES QUICKLEY MAKES IT! Assist: Nikola James
Score: 80-84

[05:04] Team_035 possession (Score: 80-84)
CJ LaVine drives and kicks out. Tobias Jordan attempts a Midrange. Contested by Nikola James (5.2 feet, MAN). Tobias Jordan misses. Rebound secured by Tracy Westbrook.

[04:48] Team_014 possession (Score: 80-84)
Tracy Westbrook drives, Malcolm Turner stays with him. Tracy Westbrook attempts a Dunk. Contested by Malcolm Turner (4.5 feet, MAN). Tracy Westbrook misses. Rebound secured by Cole George.

[04:32] Team_035 possession (Score: 80-84)
CJ LaVine attempts a 3Pt. Contested by Jalen Booker (4.5 feet, MAN). CJ LaVine misses. Rebound secured by Collin Gasol.

[04:19] Team_014 possession (Score: 80-84)
Bones Quickley attempts a Midrange. Contested by Cole George (3.5 feet, ZONE). Bones Quickley misses. FOUL! Loose ball foul on Cole George during the rebound battle. [IN THE BONUS! 5 team fouls] Collin Gasol to the line for 2 free throws. (Cole George: 2 personal fouls)   FT 1/2: GOOD   FT 2/2: MISS Collin Gasol makes 1/2 from the line. Rebound secured by Cole George.
Score: 80-85

[04:07] Team_035 possession (Score: 80-85)
Cole George drives to the basket... Cole George throws a bad pass! Stolen by Collin Gasol! TURNOVER! (live ball)

[03:51] Team_014 possession (Score: 80-85)
Bones Quickley attempts a 3Pt. Contested by Cole George (3.5 feet, MAN). Bones Quickley misses. Rebound secured by John Durant.

[03:39] Team_035 possession (Score: 80-85)
Malcolm Turner drives, Tracy Westbrook stays with him. Malcolm Turner attempts a Layup. Contested by Tracy Westbrook (5.9 feet, MAN). MALCOLM TURNER MAKES IT! Assist: Tobias Jordan
Score: 82-85

[03:24] Team_014 possession (Score: 82-85)
Collin Gasol loses control! Ball rolls out of bounds! TURNOVER! (dead ball)

[03:06] Team_035 possession (Score: 82-85)
CJ LaVine attempts a 3Pt. Contested by Jalen Booker (4.7 feet, MAN). CJ LAVINE MAKES IT! Assist: Tobias Jordan
Score: 85-85

[02:52] Team_014 possession (Score: 85-85)
Nikola James attempts a 3Pt. Contested by Tobias Jordan (4.6 feet, MAN). Nikola James misses. Rebound secured by John Durant.

[02:37] Team_035 possession (Score: 85-85)
CJ LaVine attempts a Midrange. Contested by Jalen Booker (4.7 feet, MAN). CJ LaVine misses. Rebound secured by Nikola James.

[02:26] Team_014 possession (Score: 85-85)
Bones Quickley attempts a 3Pt. Contested by CJ LaVine (4.4 feet, ZONE). BONES QUICKLEY MAKES IT! Assist: Tracy Westbrook
Score: 85-88

[02:11] Team_035 possession (Score: 85-88)
Tobias Jordan attempts a Layup. Contested by Collin Gasol (5.1 feet, ZONE). TOBIAS JORDAN MAKES IT! Assist: CJ LaVine
Score: 87-88

[01:57] Team_014 possession (Score: 87-88)
FOUL! Offensive foul on Nikola James! Tobias Jordan drew the charge! [Team fouls: 6] (Nikola James: 4 personal fouls) TURNOVER! (dead ball)

[01:43] Team_035 possession (Score: 87-88)
Tobias Jordan attempts a Midrange. Contested by Nikola James (5.1 feet, ZONE). Tobias Jordan misses. Rebound secured by Collin Gasol.

[01:31] Team_014 possession (Score: 87-88)
Bones Quickley attempts a 3Pt. Contested by CJ LaVine (4.5 feet, ZONE). BONES QUICKLEY MAKES IT! Assist: Collin Gasol
Score: 87-91

[01:17] Team_035 possession (Score: 87-91)
FOUL! Holding foul on Nikola James. [IN THE BONUS! 7 team fouls] Tobias Jordan to the line for 2 free throws. (Nikola James: 5 personal fouls)   FT 1/2: GOOD   FT 2/2: GOOD Tobias Jordan makes 2/2 from the line.
Score: 89-91

[01:02] Team_014 possession (Score: 89-91)
Bones Quickley drives and kicks out. Jalen Booker attempts a 3Pt. Contested by CJ LaVine (4.7 feet, ZONE). Jalen Booker misses. Rebound secured by John Durant.

[00:52] Team_035 possession (Score: 89-91)
Malcolm Turner attempts a 3Pt. Wide open! Tracy Westbrook is 6.1 feet away. [MAN] MALCOLM TURNER MAKES IT! Assist: Tobias Jordan
Score: 92-91

[00:40] Team_014 possession (Score: 92-91)
Jalen Booker attempts a 3Pt. Contested by CJ LaVine (4.7 feet, MAN). Jalen Booker misses. Rebound secured by Cole George.

[00:27] Team_035 possession (Score: 92-91)
Tobias Jordan attempts a Layup. BLOCKED BY COLLIN GASOL! Ball deflects out of bounds off Tobias Jordan.

[00:16] Team_014 possession (Score: 92-91)
Collin Gasol attempts a Midrange. Contested by John Durant (5.2 feet, MAN). COLLIN GASOL MAKES IT! Assist: Nikola James
Score: 92-93

[00:03] Team_035 possession (Score: 92-93)
John Durant drives and kicks out. Cole George attempts a 3Pt. Contested by Bones Quickley (5.9 feet, MAN). COLE GEORGE MAKES IT! Assist: CJ LaVine
Score: 95-93

================================================================================
                              4TH QUARTER COMPLETE                              
================================================================================

4TH QUARTER SCORE: Team_035 34, Team_014 15

BOX SCORE:
================================================================================

Team_035
--------------------------------------------------------------------------------
Player                MIN  PTS  REB  AST  TO      FG   FG%      3P   3P%
--------------------------------------------------------------------------------
Tobias Jordan          14   11    3    3   0   5/7    71.4     0/0   0.0
CJ LaVine              14    9    0    4   0   4/7    57.1     0/0   0.0
Malcolm Turner         14    5    0    0   0   2/2   100.0     0/0   0.0
Cole George            14    3    3    1   0   1/1   100.0     0/0   0.0
Gary Johnson           35    2    0    0   0   1/1   100.0     0/0   0.0
John Durant            14    2    7    0   0   1/2    50.0     0/0   0.0
Magic Westbrook        35    0    1    0   0   0/0     0.0     0/0   0.0

TEAM: FG: 14/20 (70.0%), 3PT: 3/4 (75.0%), REB: 13 (3 off, 10 def), AST: 8, TO: 3
TEAM FOULS: 5 [Team_014 in BONUS]


Team_014
--------------------------------------------------------------------------------
Player                MIN  PTS  REB  AST  TO      FG   FG%      3P   3P%
--------------------------------------------------------------------------------
Bones Quickley         14    8    0    0   0   3/6    50.0     0/0   0.0
Jalen Booker           14    3    0    0   0   2/3    66.7     0/0   0.0
Collin Gasol           14    2    2    1   0   1/3    33.3     0/0   0.0
Nikola James           14    1    1    2   0   1/4    25.0     0/0   0.0
Tracy Westbrook        14    0    2    1   0   0/2     0.0     0/0   0.0

TEAM: FG: 7/18 (38.9%), 3PT: 2/6 (33.3%), REB: 6 (1 off, 5 def), AST: 4, TO: 4
TEAM FOULS: 7 [Team_035 in BONUS]

================================================================================

================================================================================
                               FULL GAME COMPLETE                               
================================================================================

FINAL SCORE: Team_035 95, Team_014 93

SCORING BY QUARTER:
--------------------------------------------------------------------------------
Team                     Q1     Q2     Q3     Q4    FINAL
--------------------------------------------------------------------------------
Team_035                 21     20     20     34       95
Team_014                 29     22     27     15       93
--------------------------------------------------------------------------------

FULL GAME BOX SCORE:
================================================================================

Team_035
--------------------------------------------------------------------------------
Player                MIN  PTS  REB  AST  TO      FG   FG%      3P   3P%      FT STL BLK
--------------------------------------------------------------------------------
Shaquille Ginobili     35    4    0    4   2   2/7    28.6   0/2     0.0   0/0     0   1
Gary Johnson           35   23    8    3   0  10/18   55.6   3/6    50.0   0/0     2   0
Dwyane Johnson         35    5    7    2   2   2/9    22.2   0/2     0.0   2/4     2   1
Magic Westbrook        35    8   15    3   1   5/10   50.0   0/0     0.0   2/3     3   0
Domantas Green         34   18    0    2   1   7/12   58.3   2/4    50.0   6/6     1   0
CJ LaVine              14    9    0    4   0   3/6    50.0   2/3    66.7   1/3     0   0
Cole George            14    3    3    1   0   0/0     0.0   0/0     0.0   0/0     0   0
Malcolm Turner         14    5    0    0   2   2/4    50.0   1/3    33.3   0/0     0   0
Tobias Jordan          14   11    4    4   0   4/7    57.1   0/1     0.0   3/3     0   0
John Durant            14    4    7    0   1   3/4    75.0   0/0     0.0   0/0     2   2

TEAM: FG: 40/79 (50.6%), 3PT: 8/21 (38.1%), REB: 43 (11 off, 32 def), AST: 23, TO: 9


Team_014
--------------------------------------------------------------------------------
Player                MIN  PTS  REB  AST  TO      FG   FG%      3P   3P%      FT STL BLK
--------------------------------------------------------------------------------
Jordan Anunoby         35   14    0    2   1   6/8    75.0   2/4    50.0   4/4     0   1
Lamelo Simmons         35   14    0    3   1   5/11   45.5   1/5    20.0   5/5     0   0
DeMar Adebayo          35    7   10    2   2   3/8    37.5   1/2    50.0   2/2     3   1
Ayo Murray             35   12   13    3   5   6/9    66.7   0/0     0.0   4/5     0   1
Michael Cunningham     34   21   12    0   3   8/14   57.1   4/7    57.1   1/3     0   0
Jalen Booker           14    3    0    0   0   1/2    50.0   0/1     0.0   1/2     0   0
Bones Quickley         14    8    0    0   1   3/6    50.0   2/3    66.7   0/0     0   0
Tracy Westbrook        14    0    4    2   1   0/2     0.0   0/0     0.0   0/0     0   0
Nikola James           14    3    1    2   1   2/5    40.0   0/2     0.0   3/4     0   0
Collin Gasol           14    5    4    1   1   3/5    60.0   1/1   100.0   1/2     2   1

TEAM: FG: 37/70 (52.9%), 3PT: 11/25 (44.0%), REB: 45 (8 off, 37 def), AST: 15, TO: 16

================================================================================
