================================================================================
                        FULL GAME - Team_096 vs Team_078                        
================================================================================

================================================================================
                       1ST QUARTER - Team_096 vs Team_078                       
================================================================================

[12:00] Team_096 possession (Score: 0-0)
Kyrie Adebayo drives, Jabari Barrett stays with him. Kyrie Adebayo attempts a Dunk. Contested by Jabari Barrett (5.3 feet, ZONE). KYRIE ADEBAYO MAKES IT! Assist: Terry Mobley
Score: 2-0

[11:43] Team_078 possession (Score: 2-0)
Isaiah Simmons attempts a 3Pt. Contested by Cole Griffin (3.5 feet, MAN). Isaiah Simmons misses. Offensive rebound by Jabari Barrett! Jabari Barrett kicks it out.

[11:26] Team_078 possession (Score: 2-0)
Isaiah Simmons attempts a Midrange. Contested by Scottie Herro (5.2 feet, ZONE). Isaiah Simmons misses. Rebound secured by Scottie Herro.

[11:12] Team_096 possession (Score: 2-0)
FOUL! Reach-in foul on Jabari Barrett during the drive. [Team fouls: 1] No free throws, side out. (Jabari Barrett: 1 personal fouls)

[10:59] Team_096 possession (Score: 2-0)
Lamelo Quickley drives, Jabari Barrett stays with him. Lamelo Quickley attempts a Layup. Contested by Jabari Barrett (4.2 feet, ZONE). Lamelo Quickley misses. Rebound secured by Ben Ginobili.

[10:48] Team_078 possession (Score: 2-0)
Jabari Barrett drives, picks up Kyrie Adebayo. Help arrives from Lamelo Quickley! Jabari Barrett attempts a Layup. Contested by Lamelo Quickley (4.0 feet, ZONE). Jabari Barrett misses. Rebound secured by Kyrie Adebayo.

[10:33] Team_096 possession (Score: 2-0)
Cole Griffin makes the Layup and draws the foul on Isaiah Simmons! And-1! Cole Griffin to the line for 1. [Team fouls: 2] (Isaiah Simmons: 1 personal fouls)   FT 1/1: GOOD Cole Griffin makes 1/1 from the line.
Score: 5-0

[10:14] Team_078 possession (Score: 5-0)
Jabari Barnes attempts a Midrange. Contested by Terry Mobley (5.0 feet, MAN). JABARI BARNES MAKES IT!
Score: 5-2

[09:58] Team_096 possession (Score: 5-2)
Kyrie Adebayo attempts a 3Pt. Contested by Isaiah Simmons (3.7 feet, ZONE). KYRIE ADEBAYO MAKES IT! Assist: Terry Mobley
Score: 8-2

[09:46] Team_078 possession (Score: 8-2)
Ben Ginobili attempts a Layup. Contested by Scottie Herro (5.3 feet, MAN). Ben Ginobili misses. Rebound secured by Cole Griffin.

[09:30] Team_096 possession (Score: 8-2)
Cole Griffin attempts a 3Pt. Contested by Isaiah Simmons (3.3 feet, ZONE). Cole Griffin misses. Rebound secured by Isaiah Simmons.

[09:15] Team_078 possession (Score: 8-2)
Isaiah Simmons drives, Cole Griffin stays with him. Isaiah Simmons attempts a Dunk. Contested by Cole Griffin (3.5 feet, MAN). ISAIAH SIMMONS MAKES IT!
Score: 8-4

[09:01] Team_096 possession (Score: 8-4)
Scottie Herro attempts a 3Pt. Contested by Isaiah Simmons (3.2 feet, ZONE). Scottie Herro misses. Rebound secured by Isaiah Simmons.

[08:48] Team_078 possession (Score: 8-4)
Jabari Barrett attempts a Midrange. Contested by Lamelo Quickley (3.9 feet, ZONE). Jabari Barrett misses. Rebound secured by Scottie Herro.

[08:30] Team_096 possession (Score: 8-4)
Scottie Herro drives, picks up Ben Ginobili. Help arrives from Kyrie Carter! Scottie Herro attempts a Layup. Contested by Kyrie Carter (4.8 feet, MAN). Scottie Herro misses. Offensive rebound by Kyrie Adebayo! Kyrie Adebayo puts it back in!
Score: 10-4

[08:16] Team_078 possession (Score: 10-4)
Kyrie Carter attempts a Midrange. Contested by Lamelo Quickley (3.8 feet, MAN). Kyrie Carter misses. Rebound secured by Cole Griffin.

[08:04] Team_096 possession (Score: 10-4)
Scottie Herro drives and kicks out. Cole Griffin attempts a 3Pt. Contested by Isaiah Simmons (3.0 feet, MAN). COLE GRIFFIN MAKES IT!
Score: 13-4

[07:51] Team_078 possession (Score: 13-4)
FOUL! Offensive foul on Isaiah Simmons! Cole Griffin drew the charge! [Team fouls: 3] (Isaiah Simmons: 2 personal fouls) TURNOVER! (dead ball)

[07:34] Team_096 possession (Score: 13-4)
Kyrie Adebayo drives to the basket... FOUL! Offensive foul on Kyrie Adebayo! Jabari Barrett drew the charge! [Team fouls: 1] (Kyrie Adebayo: 1 personal fouls) TURNOVER! (dead ball)

[07:20] Team_078 possession (Score: 13-4)
Isaiah Simmons attempts a Midrange. Contested by Cole Griffin (3.5 feet, MAN). Isaiah Simmons misses. Rebound secured by Cole Griffin.

[07:03] Team_096 possession (Score: 13-4)
Scottie Herro drives and kicks out. Terry Mobley attempts a Midrange. Contested by Jabari Barnes (3.9 feet, MAN). TERRY MOBLEY MAKES IT!
Score: 15-4

[06:52] Team_078 possession (Score: 15-4)
FOUL! Holding foul on Kyrie Adebayo. [Team fouls: 2] No free throws, side out. (Kyrie Adebayo: 2 personal fouls)

[06:36] Team_078 possession (Score: 15-4)
Ben Ginobili attempts a Midrange. Contested by Scottie Herro (5.3 feet, MAN). Ben Ginobili misses. Rebound secured by Kyrie Adebayo.

[06:25] Team_096 possession (Score: 15-4)
Cole Griffin attempts a 3Pt. Contested by Isaiah Simmons (3.3 feet, ZONE). COLE GRIFFIN MAKES IT! Assist: Lamelo Quickley
Score: 18-4

[06:12] Team_078 possession (Score: 18-4)
Isaiah Simmons attempts a Midrange. Contested by Cole Griffin (3.5 feet, MAN). ISAIAH SIMMONS MAKES IT! Assist: Kyrie Carter
Score: 18-6

[05:58] Team_096 possession (Score: 18-6)
Lamelo Quickley attempts a Layup. Contested by Kyrie Carter (3.3 feet, MAN). LAMELO QUICKLEY MAKES IT! Assist: Kyrie Adebayo
Score: 20-6

[05:44] Team_078 possession (Score: 20-6)
Isaiah Simmons attempts a 3Pt. Contested by Cole Griffin (3.5 feet, MAN). Isaiah Simmons misses. Offensive rebound by Isaiah Simmons! Isaiah Simmons puts it back in!
Score: 20-8

[05:29] Team_096 possession (Score: 20-8)
Lamelo Quickley attempts a Midrange. Contested by Kyrie Carter (3.3 feet, MAN). LAMELO QUICKLEY MAKES IT!
Score: 22-8

[05:10] Team_078 possession (Score: 22-8)
Isaiah Simmons attempts a 3Pt. Contested by Cole Griffin (3.5 feet, MAN). Isaiah Simmons misses. Offensive rebound by Isaiah Simmons! Isaiah Simmons puts it back in!
Score: 22-10

[04:58] Team_096 possession (Score: 22-10)
Kyrie Adebayo drives to the basket... Kyrie Adebayo loses control! Ball rolls out of bounds! TURNOVER! (dead ball)

[04:44] Team_078 possession (Score: 22-10)
Jabari Barnes attempts a 3Pt. Contested by Cole Griffin (3.7 feet, ZONE). Jabari Barnes misses. Rebound secured by Scottie Herro.

[04:27] Team_096 possession (Score: 22-10)
Scottie Herro drives and kicks out. Terry Mobley attempts a 3Pt. Contested by Jabari Barnes (4.0 feet, MAN). TERRY MOBLEY MAKES IT! Assist: Scottie Herro
Score: 25-10

[04:15] Team_078 possession (Score: 25-10)
Jabari Barrett drives, Kyrie Adebayo stays with him. Jabari Barrett attempts a Dunk. Contested by Kyrie Adebayo (4.0 feet, MAN). Jabari Barrett misses. Offensive rebound by Isaiah Simmons! Isaiah Simmons puts it back in!
Score: 25-12

[03:58] Team_096 possession (Score: 25-12)
Terry Mobley attempts a Layup. Contested by Jabari Barrett (4.9 feet, ZONE). TERRY MOBLEY MAKES IT!
Score: 27-12

[03:41] Team_078 possession (Score: 27-12)
FOUL! Shooting foul on Cole Griffin. Jabari Barnes to the line for 3 free throws. [Team fouls: 3] (Cole Griffin: 1 personal fouls)   FT 1/3: MISS   FT 2/3: GOOD   FT 3/3: MISS Jabari Barnes makes 1/3 from the line. Rebound secured by Cole Griffin.
Score: 27-13

[03:25] Team_096 possession (Score: 27-13)
Terry Mobley attempts a 3Pt. Contested by Jabari Barnes (4.2 feet, MAN). TERRY MOBLEY MAKES IT!
Score: 30-13

[03:11] Team_078 possession (Score: 30-13)
Kyrie Carter attempts a 3Pt. Contested by Lamelo Quickley (4.0 feet, MAN). KYRIE CARTER MAKES IT! Assist: Jabari Barnes
Score: 30-16

[02:57] Team_096 possession (Score: 30-16)
FOUL! Shooting foul on Ben Ginobili. Scottie Herro to the line for 2 free throws. [Team fouls: 4] (Ben Ginobili: 1 personal fouls)   FT 1/2: GOOD   FT 2/2: GOOD Scottie Herro makes 2/2 from the line.
Score: 32-16

[02:44] Team_078 possession (Score: 32-16)
Jabari Barnes attempts a 3Pt. Contested by Terry Mobley (5.1 feet, MAN). Jabari Barnes misses. Rebound secured by Scottie Herro.

[02:31] Team_096 possession (Score: 32-16)
Kyrie Adebayo drives to the basket... Kyrie Adebayo loses the ball! Stripped by Jabari Barrett! TURNOVER! (live ball)

[02:19] Team_078 possession (Score: 32-16)
Isaiah Simmons attempts a 3Pt. Contested by Cole Griffin (3.7 feet, MAN). ISAIAH SIMMONS MAKES IT!
Score: 32-19

[02:05] Team_096 possession (Score: 32-19)
Cole Griffin attempts a Layup. Contested by Isaiah Simmons (3.7 feet, MAN). COLE GRIFFIN MAKES IT! Assist: Terry Mobley
Score: 34-19

[01:51] Team_078 possession (Score: 34-19)
Kyrie Carter makes the Layup and draws the foul on Lamelo Quickley! And-1! Kyrie Carter to the line for 1. [Team fouls: 4] (Lamelo Quickley: 1 personal fouls)   FT 1/1: GOOD Kyrie Carter makes 1/1 from the line.
Score: 34-22

[01:34] Team_096 possession (Score: 34-22)
Cole Griffin attempts a 3Pt. Contested by Isaiah Simmons (3.7 feet, MAN). Cole Griffin misses. Rebound secured by Jabari Barrett.

[01:16] Team_078 possession (Score: 34-22)
Jabari Barrett attempts a Midrange. Contested by Scottie Herro (5.3 feet, ZONE). JABARI BARRETT MAKES IT!
Score: 34-24

[01:03] Team_096 possession (Score: 34-24)
Scottie Herro makes the Layup and draws the foul on Ben Ginobili! And-1! Scottie Herro to the line for 1. [BONUS: 5 team fouls] (Ben Ginobili: 2 personal fouls)   FT 1/1: GOOD Scottie Herro makes 1/1 from the line.
Score: 37-24

[00:49] Team_078 possession (Score: 37-24)
Ben Ginobili attempts a 3Pt. Contested by Scottie Herro (5.6 feet, ZONE). Ben Ginobili misses. Rebound secured by Kyrie Adebayo.

[00:38] Team_096 possession (Score: 37-24)
Cole Griffin attempts a Midrange. Contested by Isaiah Simmons (3.8 feet, ZONE). COLE GRIFFIN MAKES IT! Assist: Terry Mobley
Score: 39-24

[00:21] Team_078 possession (Score: 39-24)
Jabari Barnes attempts a 3Pt. Contested by Terry Mobley (5.4 feet, MAN). Jabari Barnes misses. Rebound secured by Cole Griffin.

[00:01] Team_096 possession (Score: 39-24)
Kyrie Adebayo drives and kicks out. Scottie Herro attempts a 3Pt. Contested by Ben Ginobili (5.2 feet, MAN). SCOTTIE HERRO MAKES IT! Assist: Cole Griffin
Score: 42-24

================================================================================
                              1ST QUARTER COMPLETE                              
================================================================================

1ST QUARTER SCORE: Team_096 42, Team_078 24

BOX SCORE:
================================================================================

Team_096
--------------------------------------------------------------------------------
Player                MIN  PTS  REB  AST  TO      FG   FG%      3P   3P%
--------------------------------------------------------------------------------
Cole Griffin           12   13    5    1   0   5/7    71.4     0/0   0.0
Terry Mobley           12   10    0    4   0   4/4   100.0     0/0   0.0
Scottie Herro          12    8    4    1   0   3/4    75.0     0/0   0.0
Kyrie Adebayo          12    7    4    1   0   3/3   100.0     0/0   0.0
Lamelo Quickley        12    4    0    1   0   2/3    66.7     0/0   0.0

TEAM: FG: 17/21 (81.0%), 3PT: 3/6 (50.0%), REB: 13 (1 off, 12 def), AST: 8, TO: 3
TEAM FOULS: 4


Team_078
--------------------------------------------------------------------------------
Player                MIN  PTS  REB  AST  TO      FG   FG%      3P   3P%
--------------------------------------------------------------------------------
Isaiah Simmons         12   13    5    0   0   6/8    75.0     0/0   0.0
Kyrie Carter           12    6    0    1   0   2/3    66.7     0/0   0.0
Jabari Barrett         12    2    2    0   0   1/3    33.3     0/0   0.0
Jabari Barnes          12    2    0    1   0   1/5    20.0     0/0   0.0
Ben Ginobili           12    0    1    0   0   0/3     0.0     0/0   0.0

TEAM: FG: 10/22 (45.5%), 3PT: 4/9 (44.4%), REB: 8 (4 off, 4 def), AST: 2, TO: 1
TEAM FOULS: 5 [Team_096 in BONUS]

================================================================================

================================================================================
                       2ND QUARTER - Team_096 vs Team_078                       
================================================================================

[12:00] Team_096 possession (Score: 42-24)
Scottie Herro attempts a Midrange. Contested by Ben Ginobili (5.1 feet, MAN). SCOTTIE HERRO MAKES IT!
Score: 44-24

[11:46] Team_078 possession (Score: 44-24)
Jabari Barrett attempts a Midrange. Contested by Scottie Herro (5.2 feet, ZONE). JABARI BARRETT MAKES IT!
Score: 44-26

[11:36] Team_096 possession (Score: 44-26)
Kyrie Adebayo drives to the basket... Kyrie Adebayo throws a bad pass! Stolen by Jabari Barrett! TURNOVER! (live ball)

[11:23] Team_078 possession (Score: 44-26)
FOUL! Reach-in foul on Terry Mobley during the drive. [Team fouls: 1] No free throws, side out. (Terry Mobley: 1 personal fouls)

[11:11] Team_078 possession (Score: 44-26)
Isaiah Simmons attempts a 3Pt. Contested by Cole Griffin (3.8 feet, ZONE). Isaiah Simmons misses. Offensive rebound by Jabari Barrett! Jabari Barrett kicks it out.

[10:53] Team_078 possession (Score: 44-26)
Jabari Barnes attempts a Midrange. Contested by Terry Mobley (5.3 feet, MAN). Jabari Barnes misses. Rebound secured by Scottie Herro.

[10:40] Team_096 possession (Score: 44-26)
Lamelo Quickley throws a bad pass out of bounds! TURNOVER! (dead ball)

[10:40] Substitution (Team_096): Terry Mobley OUT → Cade Jokic IN (stamina_rule2)

[10:40] Substitution (Team_096): Lamelo Quickley OUT → Jarrett Markkanen IN (stamina_rule2)

[10:40] Substitution (Team_096): Cole Griffin OUT → Cole Holiday IN (stamina_rule2)

[10:40] Substitution (Team_096): Scottie Herro OUT → Tyler Haliburton IN (stamina_rule2)

[10:40] Substitution (Team_096): Kyrie Adebayo OUT → Devin Griffin IN (stamina_rule2)

[10:40] Substitution (Team_078): Jabari Barnes OUT → Magic Barrett IN (stamina_rule2)

[10:40] Substitution (Team_078): Kyrie Carter OUT → Damian Allen IN (stamina_rule2)

[10:40] Substitution (Team_078): Isaiah Simmons OUT → Malcolm Randle IN (stamina_rule2)

[10:40] Substitution (Team_078): Ben Ginobili OUT → Paul Ming IN (stamina_rule2)

[10:40] Substitution (Team_078): Jabari Barrett OUT → Draymond Irving IN (stamina_rule2)

[10:27] Team_078 possession (Score: 44-26)
Malcolm Randle attempts a 3Pt. Contested by Cole Holiday (4.7 feet, MAN). Malcolm Randle misses. Rebound secured by Devin Griffin.

[10:10] Team_096 possession (Score: 44-26)
Tyler Haliburton attempts a Layup. Contested by Paul Ming (4.2 feet, MAN). TYLER HALIBURTON MAKES IT!
Score: 46-26

[09:56] Team_078 possession (Score: 46-26)
FOUL! Shooting foul on Cole Holiday. Magic Barrett to the line for 2 free throws. [Team fouls: 2] (Cole Holiday: 1 personal fouls)   FT 1/2: MISS   FT 2/2: GOOD Magic Barrett makes 1/2 from the line.
Score: 46-27

[09:42] Team_096 possession (Score: 46-27)
FOUL! Reach-in foul on Draymond Irving during the drive. [Team fouls: 1] No free throws, side out. (Draymond Irving: 1 personal fouls)

[09:31] Team_096 possession (Score: 46-27)
Tyler Haliburton attempts a 3Pt. Contested by Paul Ming (4.2 feet, MAN). TYLER HALIBURTON MAKES IT! Assist: Cole Holiday
Score: 49-27

[09:14] Team_078 possession (Score: 49-27)
Damian Allen attempts a 3Pt. BLOCKED BY JARRETT MARKKANEN! Ball deflects out of bounds off Damian Allen.

[08:58] Team_096 possession (Score: 49-27)
Devin Griffin attempts a Midrange. Contested by Paul Ming (4.3 feet, ZONE). Devin Griffin misses. Rebound secured by Malcolm Randle.

[08:45] Team_078 possession (Score: 49-27)
FOUL! Shooting foul on Jarrett Markkanen. Damian Allen to the line for 3 free throws. [Team fouls: 3] (Jarrett Markkanen: 1 personal fouls)   FT 1/3: GOOD   FT 2/3: GOOD   FT 3/3: GOOD Damian Allen makes 3/3 from the line.
Score: 49-30

[08:28] Team_096 possession (Score: 49-30)
Tyler Haliburton drives, picks up Paul Ming. Help arrives from Damian Allen! Tyler Haliburton attempts a Dunk. Contested by Damian Allen (4.2 feet, MAN). Tyler Haliburton misses. Offensive rebound by Tyler Haliburton! Tyler Haliburton kicks it out.

[08:09] Team_096 possession (Score: 49-30)
FOUL! Holding foul on Paul Ming. [Team fouls: 2] No free throws, side out. (Paul Ming: 1 personal fouls)

[07:51] Team_096 possession (Score: 49-30)
Cade Jokic attempts a 3Pt. Contested by Magic Barrett (5.0 feet, MAN). CADE JOKIC MAKES IT! Assist: Jarrett Markkanen
Score: 52-30

[07:39] Team_078 possession (Score: 52-30)
FOUL! Shooting foul on Devin Griffin. Paul Ming to the line for 2 free throws. [Team fouls: 4] (Devin Griffin: 1 personal fouls)   FT 1/2: GOOD   FT 2/2: GOOD Paul Ming makes 2/2 from the line.
Score: 52-32

[07:26] Team_096 possession (Score: 52-32)
Devin Griffin drives, picks up Paul Ming. Help arrives from Damian Allen! Devin Griffin attempts a Layup. Contested by Damian Allen (4.3 feet, ZONE). DEVIN GRIFFIN MAKES IT! Assist: Tyler Haliburton
Score: 54-32

[07:08] Team_078 possession (Score: 54-32)
Malcolm Randle attempts a 3Pt. Contested by Cade Jokic (5.5 feet, ZONE). Malcolm Randle misses. Rebound secured by Jarrett Markkanen.

[06:54] Team_096 possession (Score: 54-32)
Tyler Haliburton attempts a Midrange. Contested by Malcolm Randle (4.2 feet, ZONE). Tyler Haliburton misses. Rebound secured by Paul Ming.

[06:40] Team_078 possession (Score: 54-32)
Malcolm Randle attempts a 3Pt. Contested by Cade Jokic (5.5 feet, ZONE). Malcolm Randle misses. Rebound secured by Tyler Haliburton.

[06:25] Team_096 possession (Score: 54-32)
Cole Holiday attempts a 3Pt. Contested by Damian Allen (5.2 feet, ZONE). Cole Holiday misses. Rebound secured by Draymond Irving.

[06:11] Team_078 possession (Score: 54-32)
Magic Barrett makes the Dunk and draws the foul on Jarrett Markkanen! And-1! Magic Barrett to the line for 1. [BONUS: 5 team fouls] (Jarrett Markkanen: 2 personal fouls)   FT 1/1: GOOD Magic Barrett makes 1/1 from the line.
Score: 54-35

[05:57] Team_096 possession (Score: 54-35)
Cade Jokic attempts a Midrange. Contested by Magic Barrett (5.0 feet, MAN). Cade Jokic misses. Rebound secured by Malcolm Randle.

[05:44] Team_078 possession (Score: 54-35)
FOUL! Reach-in foul on Devin Griffin during the drive. [IN THE BONUS! 6 team fouls] Draymond Irving to the line for 2 free throws. (Devin Griffin: 2 personal fouls)   FT 1/2: GOOD   FT 2/2: GOOD Draymond Irving makes 2/2 from the line.
Score: 54-37

[05:32] Team_096 possession (Score: 54-37)
FOUL! Reach-in foul on Malcolm Randle during the drive. [Team fouls: 3] No free throws, side out. (Malcolm Randle: 1 personal fouls)

[05:20] Team_096 possession (Score: 54-37)
FOUL! Shooting foul on Damian Allen. Tyler Haliburton to the line for 2 free throws. [Team fouls: 4] (Damian Allen: 1 personal fouls)   FT 1/2: GOOD   FT 2/2: GOOD Tyler Haliburton makes 2/2 from the line.
Score: 56-37

[05:01] Team_078 possession (Score: 56-37)
FOUL! Holding foul on Cade Jokic. [IN THE BONUS! 7 team fouls] Magic Barrett to the line for 2 free throws. (Cade Jokic: 1 personal fouls)   FT 1/2: MISS   FT 2/2: MISS Magic Barrett makes 0/2 from the line. Rebound secured by Tyler Haliburton.

[04:44] Team_096 possession (Score: 56-37)
Cade Jokic attempts a 3Pt. Contested by Magic Barrett (5.0 feet, MAN). Cade Jokic misses. Rebound secured by Malcolm Randle.

[04:31] Team_078 possession (Score: 56-37)
FOUL! Shooting foul on Cole Holiday. Malcolm Randle to the line for 2 free throws. [BONUS: 8 team fouls] (Cole Holiday: 2 personal fouls)   FT 1/2: GOOD   FT 2/2: GOOD Malcolm Randle makes 2/2 from the line.
Score: 56-39

[04:17] Team_096 possession (Score: 56-39)
Devin Griffin attempts a Layup. Contested by Paul Ming (4.3 feet, ZONE). DEVIN GRIFFIN MAKES IT! Assist: Tyler Haliburton
Score: 58-39

[04:03] Team_078 possession (Score: 58-39)
Draymond Irving attempts a Midrange. Contested by Devin Griffin (5.0 feet, MAN). DRAYMOND IRVING MAKES IT!
Score: 58-41

[03:48] Team_096 possession (Score: 58-41)
Devin Griffin drives to the basket... Devin Griffin throws a bad pass out of bounds! TURNOVER! (dead ball)

[03:32] Team_078 possession (Score: 58-41)
Paul Ming drives and kicks out. Damian Allen makes the Midrange and draws the foul on Jarrett Markkanen! And-1! Damian Allen to the line for 1. [BONUS: 9 team fouls] (Jarrett Markkanen: 3 personal fouls)   FT 1/1: GOOD Damian Allen makes 1/1 from the line.
Score: 58-44

[03:16] Team_096 possession (Score: 58-44)
FOUL! Reach-in foul on Draymond Irving during the drive. [IN THE BONUS! 5 team fouls] Devin Griffin to the line for 2 free throws. (Draymond Irving: 2 personal fouls)   FT 1/2: MISS   FT 2/2: GOOD Devin Griffin makes 1/2 from the line.
Score: 59-44

[03:02] Team_078 possession (Score: 59-44)
Damian Allen attempts a Midrange. Contested by Jarrett Markkanen (4.4 feet, MAN). Damian Allen misses. Rebound secured by Jarrett Markkanen.

[02:45] Team_096 possession (Score: 59-44)
Devin Griffin drives to the basket... Devin Griffin throws a bad pass! Stolen by Paul Ming! TURNOVER! (live ball)

[02:29] Team_078 possession (Score: 59-44)
FOUL! Shooting foul on Tyler Haliburton. Paul Ming to the line for 2 free throws. [BONUS: 10 team fouls] (Tyler Haliburton: 1 personal fouls)   FT 1/2: GOOD   FT 2/2: GOOD Paul Ming makes 2/2 from the line.
Score: 59-46

[02:16] Team_096 possession (Score: 59-46)
Tyler Haliburton drives to the basket... Tyler Haliburton throws a bad pass! Stolen by Paul Ming! TURNOVER! (live ball)

[02:01] Team_078 possession (Score: 59-46)
Draymond Irving attempts a Midrange. Contested by Cole Holiday (5.0 feet, ZONE). Draymond Irving misses. Rebound secured by Jarrett Markkanen.

[01:50] Team_096 possession (Score: 59-46)
FOUL! Reach-in foul on Paul Ming during the drive. [IN THE BONUS! 6 team fouls] Cole Holiday to the line for 2 free throws. (Paul Ming: 2 personal fouls)   FT 1/2: GOOD   FT 2/2: MISS Cole Holiday makes 1/2 from the line. Rebound secured by Draymond Irving.
Score: 60-46

[01:39] Team_078 possession (Score: 60-46)
Magic Barrett attempts a 3Pt. Contested by Cade Jokic (6.0 feet, MAN). Magic Barrett misses. Rebound secured by Devin Griffin.

[01:24] Team_096 possession (Score: 60-46)
Jarrett Markkanen attempts a Layup. Contested by Damian Allen (4.7 feet, MAN). Jarrett Markkanen misses. Rebound secured by Draymond Irving.

[01:08] Team_078 possession (Score: 60-46)
Magic Barrett attempts a Midrange. Contested by Tyler Haliburton (5.7 feet, ZONE). Magic Barrett misses. Offensive rebound by Paul Ming! Paul Ming kicks it out.

[00:55] Team_078 possession (Score: 60-46)
Magic Barrett drives and kicks out. Paul Ming attempts a 3Pt. Contested by Cole Holiday (4.9 feet, ZONE). Paul Ming misses. Offensive rebound by Draymond Irving! Draymond Irving kicks it out.

[00:43] Team_078 possession (Score: 60-46)
Malcolm Randle attempts a Midrange. Contested by Cole Holiday (5.0 feet, MAN). Malcolm Randle misses. Rebound secured by Tyler Haliburton.

[00:30] Team_096 possession (Score: 60-46)
Cole Holiday attempts a 3Pt. Contested by Malcolm Randle (4.7 feet, MAN). Cole Holiday misses. Rebound secured by Draymond Irving.

[00:14] Team_078 possession (Score: 60-46)
Magic Barrett drives, Devin Griffin stays with him. Magic Barrett attempts a Dunk. Contested by Devin Griffin (5.5 feet, ZONE). MAGIC BARRETT MAKES IT! Assist: Draymond Irving
Score: 60-48

[00:03] Team_096 possession (Score: 60-48)
Cade Jokic attempts a 3Pt. Contested by Magic Barrett (5.3 feet, MAN). Cade Jokic misses. Rebound secured by Paul Ming.

================================================================================
                              2ND QUARTER COMPLETE                              
================================================================================

2ND QUARTER SCORE: Team_096 18, Team_078 24

BOX SCORE:
================================================================================

Team_096
--------------------------------------------------------------------------------
Player                MIN  PTS  REB  AST  TO      FG   FG%      3P   3P%
--------------------------------------------------------------------------------
Tyler Haliburton       11    7    4    2   0   3/4    75.0     0/0   0.0
Devin Griffin          11    5    2    0   0   3/4    75.0     0/0   0.0
Cade Jokic             11    3    0    0   0   1/4    25.0     0/0   0.0
Scottie Herro          14    2    1    0   0   1/1   100.0     0/0   0.0
Cole Holiday           11    0    0    1   0   0/3     0.0     0/0   0.0
Jarrett Markkanen      11    0    3    1   0   0/1     0.0     0/0   0.0

TEAM: FG: 8/17 (47.1%), 3PT: 2/6 (33.3%), REB: 10 (1 off, 9 def), AST: 4, TO: 5
TEAM FOULS: 10 [Team_078 in BONUS]


Team_078
--------------------------------------------------------------------------------
Player                MIN  PTS  REB  AST  TO      FG   FG%      3P   3P%
--------------------------------------------------------------------------------
Magic Barrett          11    6    0    0   0   3/4    75.0     0/0   0.0
Damian Allen           11    6    0    0   0   2/4    50.0     0/0   0.0
Paul Ming              11    4    3    0   0   2/2   100.0     0/0   0.0
Draymond Irving        11    4    5    1   0   2/3    66.7     0/0   0.0
Jabari Barrett         14    2    1    0   0   1/1   100.0     0/0   0.0
Malcolm Randle         11    2    3    0   0   1/5    20.0     0/0   0.0
Jabari Barnes          14    0    0    0   0   0/1     0.0     0/0   0.0

TEAM: FG: 11/21 (52.4%), 3PT: 1/6 (16.7%), REB: 12 (3 off, 9 def), AST: 1, TO: 0
TEAM FOULS: 6 [Team_096 in BONUS]

================================================================================

================================================================================
                       3RD QUARTER - Team_096 vs Team_078                       
================================================================================

[12:00] Team_096 possession (Score: 60-48)
Kyrie Adebayo drives and kicks out. Cole Griffin attempts a 3Pt. Contested by Isaiah Simmons (3.0 feet, MAN). Cole Griffin misses. Rebound secured by Jabari Barrett.

[11:47] Team_078 possession (Score: 60-48)
FOUL! Shooting foul on Terry Mobley. Jabari Barnes to the line for 2 free throws. [Team fouls: 1] (Terry Mobley: 1 personal fouls)   FT 1/2: GOOD   FT 2/2: GOOD Jabari Barnes makes 2/2 from the line.
Score: 60-50

[11:33] Team_096 possession (Score: 60-50)
Scottie Herro throws a bad pass! Stolen by Ben Ginobili! TURNOVER! (live ball)

[11:19] Team_078 possession (Score: 60-50)
Jabari Barrett drives, Kyrie Adebayo stays with him. Jabari Barrett attempts a Dunk. Contested by Kyrie Adebayo (4.0 feet, ZONE). JABARI BARRETT MAKES IT! Assist: Kyrie Carter
Score: 60-52

[11:09] Team_096 possession (Score: 60-52)
Kyrie Adebayo drives, Jabari Barrett stays with him. Kyrie Adebayo attempts a Dunk. Contested by Jabari Barrett (5.3 feet, ZONE). KYRIE ADEBAYO MAKES IT! Assist: Scottie Herro
Score: 62-52

[10:59] Team_078 possession (Score: 62-52)
Kyrie Carter attempts a 3Pt. Contested by Lamelo Quickley (3.8 feet, MAN). KYRIE CARTER MAKES IT! Assist: Isaiah Simmons
Score: 62-55

[10:48] Team_096 possession (Score: 62-55)
Scottie Herro attempts a 3Pt. Contested by Isaiah Simmons (3.2 feet, ZONE). SCOTTIE HERRO MAKES IT! Assist: Lamelo Quickley
Score: 65-55

[10:31] Team_078 possession (Score: 65-55)
Jabari Barnes attempts a 3Pt. Contested by Cole Griffin (3.7 feet, ZONE). Jabari Barnes misses. Offensive rebound by Jabari Barrett! Jabari Barrett kicks it out.

[10:17] Team_078 possession (Score: 65-55)
Kyrie Carter makes the Dunk and draws the foul on Lamelo Quickley! And-1! Kyrie Carter to the line for 1. [Team fouls: 2] (Lamelo Quickley: 1 personal fouls)   FT 1/1: GOOD Kyrie Carter makes 1/1 from the line.
Score: 65-58

[10:00] Team_096 possession (Score: 65-58)
FOUL! Holding foul on Isaiah Simmons. [Team fouls: 1] No free throws, side out. (Isaiah Simmons: 1 personal fouls)

[09:46] Team_096 possession (Score: 65-58)
Terry Mobley attempts a 3Pt. Contested by Isaiah Simmons (3.2 feet, ZONE). Terry Mobley misses. Rebound secured by Isaiah Simmons.

[09:34] Team_078 possession (Score: 65-58)
Kyrie Carter attempts a 3Pt. Contested by Lamelo Quickley (3.8 feet, MAN). KYRIE CARTER MAKES IT! Assist: Ben Ginobili
Score: 65-61

[09:18] Team_096 possession (Score: 65-61)
Terry Mobley attempts a 3Pt. Contested by Isaiah Simmons (3.2 feet, ZONE). Terry Mobley misses. Offensive rebound by Kyrie Adebayo! Kyrie Adebayo puts it back in!
Score: 67-61

[09:03] Team_078 possession (Score: 67-61)
Ben Ginobili drives to the basket... FOUL! Offensive foul on Ben Ginobili! Kyrie Adebayo drew the charge! [Team fouls: 2] (Ben Ginobili: 1 personal fouls) TURNOVER! (dead ball)

[08:48] Team_096 possession (Score: 67-61)
Terry Mobley drives to the basket... FOUL! Offensive foul on Terry Mobley! Jabari Barrett drew the charge! [Team fouls: 3] (Terry Mobley: 2 personal fouls) TURNOVER! (dead ball)

[08:36] Team_078 possession (Score: 67-61)
Isaiah Simmons drives, Kyrie Adebayo stays with him. Isaiah Simmons attempts a Layup. Contested by Kyrie Adebayo (4.2 feet, ZONE). Isaiah Simmons misses. Rebound secured by Kyrie Adebayo.

[08:22] Team_096 possession (Score: 67-61)
Lamelo Quickley drives, Kyrie Carter stays with him. Lamelo Quickley attempts a Dunk. Contested by Kyrie Carter (3.3 feet, MAN). LAMELO QUICKLEY MAKES IT! Assist: Terry Mobley
Score: 69-61

[08:08] Team_078 possession (Score: 69-61)
Jabari Barnes attempts a Midrange. Contested by Terry Mobley (5.0 feet, MAN). Jabari Barnes misses. Rebound secured by Kyrie Adebayo.

[07:55] Team_096 possession (Score: 69-61)
FOUL! Shooting foul on Kyrie Carter. Kyrie Adebayo to the line for 2 free throws. [Team fouls: 3] (Kyrie Carter: 1 personal fouls)   FT 1/2: GOOD   FT 2/2: GOOD Kyrie Adebayo makes 2/2 from the line.
Score: 71-61

[07:39] Team_078 possession (Score: 71-61)
Jabari Barnes attempts a Layup. Contested by Terry Mobley (5.0 feet, MAN). JABARI BARNES MAKES IT! Assist: Jabari Barrett
Score: 71-63

[07:23] Team_096 possession (Score: 71-63)
Kyrie Adebayo attempts a Layup. Contested by Jabari Barrett (5.3 feet, ZONE). KYRIE ADEBAYO MAKES IT!
Score: 73-63

[07:11] Team_078 possession (Score: 73-63)
Jabari Barnes attempts a 3Pt. Contested by Terry Mobley (5.0 feet, MAN). Jabari Barnes misses. Rebound secured by Kyrie Adebayo.

[06:57] Team_096 possession (Score: 73-63)
Kyrie Adebayo attempts a 3Pt. Contested by Isaiah Simmons (3.7 feet, ZONE). Kyrie Adebayo misses. Offensive rebound by Kyrie Adebayo! Kyrie Adebayo puts it back in!
Score: 75-63

[06:39] Team_078 possession (Score: 75-63)
FOUL! Holding foul on Cole Griffin. [Team fouls: 4] No free throws, side out. (Cole Griffin: 1 personal fouls)

[06:23] Team_078 possession (Score: 75-63)
Ben Ginobili attempts a Layup. Contested by Scottie Herro (5.3 feet, MAN). BEN GINOBILI MAKES IT! Assist: Isaiah Simmons
Score: 75-65

[06:13] Team_096 possession (Score: 75-65)
Terry Mobley attempts a 3Pt. Contested by Jabari Barnes (4.0 feet, MAN). Terry Mobley misses. Rebound secured by Ben Ginobili.

[06:02] Team_078 possession (Score: 75-65)
Ben Ginobili attempts a 3Pt. Contested by Terry Mobley (4.9 feet, ZONE). BEN GINOBILI MAKES IT! Assist: Isaiah Simmons
Score: 75-68

[05:50] Team_096 possession (Score: 75-68)
Kyrie Adebayo makes the Layup and draws the foul on Ben Ginobili! And-1! Kyrie Adebayo to the line for 1. [Team fouls: 4] (Ben Ginobili: 2 personal fouls)   FT 1/1: GOOD Kyrie Adebayo makes 1/1 from the line.
Score: 78-68

[05:33] Team_078 possession (Score: 78-68)
Jabari Barnes attempts a 3Pt. Contested by Terry Mobley (5.0 feet, MAN). Jabari Barnes misses. Rebound secured by Kyrie Adebayo.

[05:16] Team_096 possession (Score: 78-68)
Cole Griffin drives and kicks out. Scottie Herro attempts a Midrange. Contested by Kyrie Carter (3.8 feet, ZONE). SCOTTIE HERRO MAKES IT! Assist: Terry Mobley
Score: 80-68

[04:58] Team_078 possession (Score: 80-68)
Jabari Barrett attempts a Layup. Contested by Kyrie Adebayo (4.0 feet, MAN). JABARI BARRETT MAKES IT! Assist: Isaiah Simmons
Score: 80-70

[04:46] Team_096 possession (Score: 80-70)
Cole Griffin attempts a Midrange. Contested by Isaiah Simmons (3.4 feet, MAN). COLE GRIFFIN MAKES IT! Assist: Scottie Herro
Score: 82-70

[04:32] Team_078 possession (Score: 82-70)
FOUL! Reach-in foul on Kyrie Adebayo during the drive. [IN THE BONUS! 5 team fouls] Isaiah Simmons to the line for 2 free throws. (Kyrie Adebayo: 1 personal fouls)   FT 1/2: GOOD   FT 2/2: GOOD Isaiah Simmons makes 2/2 from the line.
Score: 82-72

[04:20] Team_096 possession (Score: 82-72)
Scottie Herro attempts a 3Pt. Contested by Isaiah Simmons (3.3 feet, ZONE). Scottie Herro misses. Offensive rebound by Kyrie Adebayo! Kyrie Adebayo puts it back in!
Score: 84-72

[04:03] Team_078 possession (Score: 84-72)
Ben Ginobili attempts a Midrange. Contested by Scottie Herro (5.4 feet, MAN). Ben Ginobili misses. Offensive rebound by Jabari Barrett! Jabari Barrett kicks it out.

[03:50] Team_078 possession (Score: 84-72)
Jabari Barnes attempts a 3Pt. Contested by Lamelo Quickley (4.5 feet, ZONE). Jabari Barnes misses. Rebound secured by Cole Griffin.

[03:41] Team_096 possession (Score: 84-72)
Scottie Herro drives and kicks out. Terry Mobley attempts a Midrange. Contested by Ben Ginobili (4.8 feet, ZONE). TERRY MOBLEY MAKES IT!
Score: 86-72

[03:30] Team_078 possession (Score: 86-72)
Jabari Barnes attempts a Layup. Contested by Terry Mobley (5.1 feet, MAN). JABARI BARNES MAKES IT!
Score: 86-74

[03:16] Team_096 possession (Score: 86-74)
FOUL! Offensive foul on Terry Mobley! Jabari Barnes drew the charge! [Team fouls: 6] (Terry Mobley: 3 personal fouls) TURNOVER! (dead ball)

[03:00] Team_078 possession (Score: 86-74)
Jabari Barrett attempts a Midrange. BLOCKED BY KYRIE ADEBAYO! Ball deflects out of bounds off Jabari Barrett.

[02:47] Team_096 possession (Score: 86-74)
Terry Mobley attempts a 3Pt. Contested by Jabari Barnes (4.4 feet, MAN). Terry Mobley misses. Rebound secured by Ben Ginobili.

[02:31] Team_078 possession (Score: 86-74)
Kyrie Carter attempts a 3Pt. Contested by Lamelo Quickley (4.1 feet, MAN). Kyrie Carter misses. Rebound secured by Scottie Herro.

[02:17] Team_096 possession (Score: 86-74)
FOUL! Offensive foul on Kyrie Adebayo! Jabari Barrett drew the charge! [Team fouls: 7] (Kyrie Adebayo: 2 personal fouls) TURNOVER! (dead ball)

[02:01] Team_078 possession (Score: 86-74)
FOUL! Shooting foul on Terry Mobley. Jabari Barrett to the line for 2 free throws. [BONUS: 8 team fouls] (Terry Mobley: 4 personal fouls)   FT 1/2: GOOD   FT 2/2: GOOD Jabari Barrett makes 2/2 from the line.
Score: 86-76

[01:47] Team_096 possession (Score: 86-76)
Scottie Herro attempts a 3Pt. Contested by Isaiah Simmons (3.6 feet, ZONE). SCOTTIE HERRO MAKES IT! Assist: Kyrie Adebayo
Score: 89-76

[01:31] Team_078 possession (Score: 89-76)
Kyrie Carter attempts a 3Pt. Contested by Lamelo Quickley (4.2 feet, MAN). KYRIE CARTER MAKES IT! Assist: Isaiah Simmons
Score: 89-79

[01:20] Team_096 possession (Score: 89-79)
Terry Mobley attempts a 3Pt. Contested by Ben Ginobili (5.2 feet, ZONE). TERRY MOBLEY MAKES IT! Assist: Cole Griffin
Score: 92-79

[01:04] Team_078 possession (Score: 92-79)
FOUL! Reach-in foul on Terry Mobley during the drive. [IN THE BONUS! 9 team fouls] Jabari Barnes to the line for 2 free throws. (Terry Mobley: 5 personal fouls)   FT 1/2: GOOD   FT 2/2: MISS Jabari Barnes makes 1/2 from the line. Rebound secured by Scottie Herro.
Score: 92-80

[00:52] Team_096 possession (Score: 92-80)
Terry Mobley attempts a Midrange. Contested by Kyrie Carter (4.4 feet, ZONE). TERRY MOBLEY MAKES IT! Assist: Scottie Herro
Score: 94-80

[00:36] Team_078 possession (Score: 94-80)
Jabari Barrett drives to the basket... Jabari Barrett throws a bad pass out of bounds! TURNOVER! (dead ball)

[00:36] Substitution (Team_096): Terry Mobley OUT → Cade Jokic IN (stamina_rule2)

[00:36] Substitution (Team_096): Lamelo Quickley OUT → Jarrett Markkanen IN (stamina_rule2)

[00:36] Substitution (Team_096): Cole Griffin OUT → Cole Holiday IN (stamina_rule2)

[00:36] Substitution (Team_096): Scottie Herro OUT → Tyler Haliburton IN (stamina_rule2)

[00:36] Substitution (Team_096): Kyrie Adebayo OUT → Devin Griffin IN (stamina_rule2)

[00:36] Substitution (Team_078): Jabari Barnes OUT → Magic Barrett IN (stamina_rule2)

[00:36] Substitution (Team_078): Kyrie Carter OUT → Damian Allen IN (stamina_rule2)

[00:36] Substitution (Team_078): Isaiah Simmons OUT → Malcolm Randle IN (stamina_rule2)

[00:36] Substitution (Team_078): Ben Ginobili OUT → Paul Ming IN (stamina_rule2)

[00:36] Substitution (Team_078): Jabari Barrett OUT → Draymond Irving IN (stamina_rule2)

[00:22] Team_096 possession (Score: 94-80)
Devin Griffin drives, Draymond Irving stays with him. Devin Griffin attempts a Dunk. Contested by Draymond Irving (5.4 feet, MAN). Devin Griffin misses. Rebound secured by Paul Ming.

[00:07] Team_078 possession (Score: 94-80)
Magic Barrett attempts a 3Pt. Contested by Cade Jokic (5.8 feet, ZONE). Magic Barrett misses. Rebound secured by Tyler Haliburton.

================================================================================
                              3RD QUARTER COMPLETE                              
================================================================================

3RD QUARTER SCORE: Team_096 34, Team_078 32

BOX SCORE:
================================================================================

Team_096
--------------------------------------------------------------------------------
Player                MIN  PTS  REB  AST  TO      FG   FG%      3P   3P%
--------------------------------------------------------------------------------
Kyrie Adebayo          25   15    7    1   0   7/8    87.5     0/0   0.0
Scottie Herro          25    8    2    3   0   3/3   100.0     0/0   0.0
Terry Mobley           25    7    0    2   0   3/6    50.0     0/0   0.0
Lamelo Quickley        25    2    0    1   0   1/1   100.0     0/0   0.0
Cole Griffin           25    2    1    1   0   1/1   100.0     0/0   0.0
Devin Griffin          11    0    0    0   0   0/1     0.0     0/0   0.0
Tyler Haliburton       11    0    1    0   0   0/0     0.0     0/0   0.0

TEAM: FG: 15/20 (75.0%), 3PT: 6/9 (66.7%), REB: 11 (3 off, 8 def), AST: 8, TO: 4
TEAM FOULS: 9 [Team_078 in BONUS]


Team_078
--------------------------------------------------------------------------------
Player                MIN  PTS  REB  AST  TO      FG   FG%      3P   3P%
--------------------------------------------------------------------------------
Kyrie Carter           25   12    0    1   0   4/5    80.0     0/0   0.0
Jabari Barrett         25    6    3    1   0   3/4    75.0     0/0   0.0
Jabari Barnes          25    6    0    0   0   3/8    37.5     0/0   0.0
Ben Ginobili           25    5    2    1   0   2/2   100.0     0/0   0.0
Isaiah Simmons         25    2    1    5   0   1/2    50.0     0/0   0.0
Paul Ming              11    0    1    0   0   0/0     0.0     0/0   0.0
Magic Barrett          11    0    0    0   0   0/1     0.0     0/0   0.0

TEAM: FG: 13/22 (59.1%), 3PT: 4/9 (44.4%), REB: 7 (2 off, 5 def), AST: 8, TO: 2
TEAM FOULS: 4

================================================================================

================================================================================
                       4TH QUARTER - Team_096 vs Team_078                       
================================================================================

[12:00] Team_096 possession (Score: 94-80)
Scottie Herro attempts a 3Pt. Contested by Ben Ginobili (5.0 feet, MAN). Scottie Herro misses. Rebound secured by Ben Ginobili.

[11:46] Team_078 possession (Score: 94-80)
Isaiah Simmons attempts a 3Pt. Contested by Scottie Herro (5.4 feet, ZONE). ISAIAH SIMMONS MAKES IT! Assist: Jabari Barrett
Score: 94-83

[11:31] Team_096 possession (Score: 94-83)
Cole Griffin attempts a Midrange. Contested by Isaiah Simmons (3.7 feet, MAN). Cole Griffin misses. Rebound secured by Jabari Barrett.

[11:20] Team_078 possession (Score: 94-83)
Isaiah Simmons drives to the basket... Isaiah Simmons loses the ball! Stripped by Kyrie Adebayo! TURNOVER! (live ball)

[11:05] Team_096 possession (Score: 94-83)
Lamelo Quickley attempts a 3Pt. Contested by Isaiah Simmons (3.0 feet, ZONE). LAMELO QUICKLEY MAKES IT! Assist: Terry Mobley
Score: 97-83

[10:47] Team_078 possession (Score: 97-83)
Jabari Barrett drives, Kyrie Adebayo stays with him. Jabari Barrett attempts a Layup. Contested by Kyrie Adebayo (4.2 feet, ZONE). JABARI BARRETT MAKES IT! Assist: Kyrie Carter
Score: 97-85

[10:35] Team_096 possession (Score: 97-85)
FOUL! Shooting foul on Jabari Barnes. Terry Mobley to the line for 3 free throws. [Team fouls: 1] (Jabari Barnes: 1 personal fouls)   FT 1/3: GOOD   FT 2/3: GOOD   FT 3/3: GOOD Terry Mobley makes 3/3 from the line.
Score: 100-85

[10:19] Team_078 possession (Score: 100-85)
Jabari Barnes drives, Kyrie Adebayo stays with him. Jabari Barnes attempts a Dunk. Contested by Kyrie Adebayo (4.7 feet, ZONE). Jabari Barnes misses. Rebound secured by Scottie Herro.

[10:02] Team_096 possession (Score: 100-85)
Scottie Herro attempts a Layup. Contested by Jabari Barrett (5.3 feet, ZONE). Scottie Herro misses. Rebound secured by Isaiah Simmons.

[09:47] Team_078 possession (Score: 100-85)
Kyrie Carter attempts a Layup. Contested by Kyrie Adebayo (4.2 feet, ZONE). KYRIE CARTER MAKES IT!
Score: 100-87

[09:33] Team_096 possession (Score: 100-87)
Lamelo Quickley attempts a 3Pt. Contested by Kyrie Carter (3.9 feet, MAN). Lamelo Quickley misses. Rebound secured by Isaiah Simmons.

[09:22] Team_078 possession (Score: 100-87)
Jabari Barrett attempts a Layup. Contested by Kyrie Adebayo (4.4 feet, MAN). JABARI BARRETT MAKES IT! Assist: Ben Ginobili
Score: 100-89

[09:08] Team_096 possession (Score: 100-89)
Lamelo Quickley attempts a Layup. Contested by Ben Ginobili (4.8 feet, ZONE). LAMELO QUICKLEY MAKES IT!
Score: 102-89

[08:58] Team_078 possession (Score: 102-89)
Kyrie Carter drives and kicks out. FOUL! Shooting foul on Scottie Herro. Kyrie Carter to the line for 2 free throws. [Team fouls: 1] (Scottie Herro: 1 personal fouls)   FT 1/2: GOOD   FT 2/2: GOOD Kyrie Carter makes 2/2 from the line.
Score: 102-91

[08:42] Team_096 possession (Score: 102-91)
Kyrie Adebayo drives, Ben Ginobili stays with him. Kyrie Adebayo attempts a Dunk. Contested by Ben Ginobili (5.9 feet, ZONE). KYRIE ADEBAYO MAKES IT! Assist: Terry Mobley
Score: 104-91

[08:30] Team_078 possession (Score: 104-91)
Jabari Barrett drives and kicks out. Ben Ginobili attempts a Midrange. Contested by Scottie Herro (5.7 feet, ZONE). Ben Ginobili misses. Rebound secured by Cole Griffin.

[08:14] Team_096 possession (Score: 104-91)
Lamelo Quickley attempts a Midrange. Contested by Ben Ginobili (4.9 feet, ZONE). Lamelo Quickley misses. Rebound secured by Isaiah Simmons.

[07:55] Team_078 possession (Score: 104-91)
Jabari Barnes attempts a 3Pt. Contested by Terry Mobley (5.6 feet, MAN). JABARI BARNES MAKES IT! Assist: Kyrie Carter
Score: 104-94

[07:37] Team_096 possession (Score: 104-94)
FOUL! Shooting foul on Isaiah Simmons. Kyrie Adebayo to the line for 3 free throws. [Team fouls: 2] (Isaiah Simmons: 1 personal fouls)   FT 1/3: GOOD   FT 2/3: GOOD   FT 3/3: GOOD Kyrie Adebayo makes 3/3 from the line.
Score: 107-94

[07:23] Team_078 possession (Score: 107-94)
FOUL! Reach-in foul on Scottie Herro during the drive. [Team fouls: 2] No free throws, side out. (Scottie Herro: 2 personal fouls)

[07:13] Team_078 possession (Score: 107-94)
Ben Ginobili attempts a Midrange. Contested by Scottie Herro (6.0 feet, ZONE). BEN GINOBILI MAKES IT!
Score: 107-96

[06:57] Team_096 possession (Score: 107-96)
Scottie Herro drives, picks up Jabari Barrett. Help arrives from Kyrie Carter! Scottie Herro attempts a Dunk. Contested by Kyrie Carter (5.6 feet, ZONE). Scottie Herro misses. Offensive rebound by Scottie Herro! Scottie Herro kicks it out.

[06:48] Team_096 possession (Score: 107-96)
FOUL! Holding foul on Kyrie Carter. [Team fouls: 3] No free throws, side out. (Kyrie Carter: 1 personal fouls)

[06:31] Team_096 possession (Score: 107-96)
FOUL! Holding foul on Isaiah Simmons. [Team fouls: 4] No free throws, side out. (Isaiah Simmons: 2 personal fouls)

[06:15] Team_096 possession (Score: 107-96)
Terry Mobley drives and kicks out. Scottie Herro attempts a 3Pt. Contested by Isaiah Simmons (4.3 feet, ZONE). Scottie Herro misses. Rebound secured by Isaiah Simmons.

[06:00] Team_078 possession (Score: 107-96)
Jabari Barnes attempts a Midrange. Contested by Cole Griffin (4.6 feet, ZONE). Jabari Barnes misses. Rebound secured by Cole Griffin.

[05:47] Team_096 possession (Score: 107-96)
Cole Griffin attempts a Layup. Contested by Isaiah Simmons (4.5 feet, MAN). Cole Griffin misses. Rebound secured by Isaiah Simmons.

[05:33] Team_078 possession (Score: 107-96)
FOUL! Reach-in foul on Lamelo Quickley during the drive. [Team fouls: 3] No free throws, side out. (Lamelo Quickley: 1 personal fouls)

[05:20] Team_078 possession (Score: 107-96)
Jabari Barnes attempts a 3Pt. Contested by Cole Griffin (4.7 feet, ZONE). Jabari Barnes misses. Offensive rebound by Isaiah Simmons! Isaiah Simmons kicks it out.

[05:08] Team_078 possession (Score: 107-96)
Jabari Barrett attempts a Layup. Contested by Kyrie Adebayo (4.9 feet, ZONE). JABARI BARRETT MAKES IT! Assist: Isaiah Simmons
Score: 107-98

[04:55] Team_096 possession (Score: 107-98)
Lamelo Quickley attempts a 3Pt. Contested by Kyrie Carter (4.6 feet, MAN). Lamelo Quickley misses. Rebound secured by Isaiah Simmons.

[04:42] Team_078 possession (Score: 107-98)
Isaiah Simmons attempts a 3Pt. Contested by Cole Griffin (4.6 feet, MAN). Isaiah Simmons misses. Rebound secured by Scottie Herro.

[04:27] Team_096 possession (Score: 107-98)
Scottie Herro attempts a Midrange. Contested by Ben Ginobili (6.0 feet, MAN). SCOTTIE HERRO MAKES IT!
Score: 109-98

[04:16] Team_078 possession (Score: 109-98)
Jabari Barnes attempts a Midrange. Wide open! Terry Mobley is 6.0 feet away. [MAN] Jabari Barnes misses. Rebound secured by Scottie Herro.

[03:59] Team_096 possession (Score: 109-98)
Scottie Herro attempts a 3Pt. Contested by Isaiah Simmons (4.6 feet, ZONE). SCOTTIE HERRO MAKES IT! Assist: Cole Griffin
Score: 112-98

[03:45] Team_078 possession (Score: 112-98)
Jabari Barrett attempts a Layup. Contested by Kyrie Adebayo (5.1 feet, ZONE). JABARI BARRETT MAKES IT! Assist: Ben Ginobili
Score: 112-100

[03:30] Team_096 possession (Score: 112-100)
Scottie Herro drives, Ben Ginobili stays with him. Scottie Herro attempts a Layup. Wide open! Ben Ginobili is 6.1 feet away. [MAN] SCOTTIE HERRO MAKES IT! Assist: Lamelo Quickley
Score: 114-100

[03:15] Team_078 possession (Score: 114-100)
Jabari Barnes attempts a Layup. Contested by Kyrie Adebayo (5.5 feet, ZONE). JABARI BARNES MAKES IT!
Score: 114-102

[03:03] Team_096 possession (Score: 114-102)
Scottie Herro drives, Ben Ginobili stays with him. Scottie Herro attempts a Dunk. Wide open! Ben Ginobili is 6.2 feet away. [MAN] Scottie Herro misses. Rebound secured by Isaiah Simmons.

[02:51] Team_078 possession (Score: 114-102)
Isaiah Simmons attempts a Midrange. Contested by Cole Griffin (4.9 feet, MAN). ISAIAH SIMMONS MAKES IT! Assist: Ben Ginobili
Score: 114-104

[02:37] Team_096 possession (Score: 114-104)
Scottie Herro attempts a 3Pt. Wide open! Ben Ginobili is 6.3 feet away. [ZONE] Scottie Herro misses. Rebound secured by Jabari Barrett.

[02:21] Team_078 possession (Score: 114-104)
Kyrie Carter drives, Lamelo Quickley stays with him. Kyrie Carter attempts a Dunk. Contested by Lamelo Quickley (5.4 feet, MAN). KYRIE CARTER MAKES IT!
Score: 114-106

[02:09] Team_096 possession (Score: 114-106)
Kyrie Adebayo drives, picks up Jabari Barrett. Help arrives from Kyrie Carter! Kyrie Adebayo attempts a Dunk. Wide open! Kyrie Carter is 6.8 feet away. [MAN] Kyrie Adebayo misses. Rebound secured by Isaiah Simmons.

[01:56] Team_078 possession (Score: 114-106)
Jabari Barrett attempts a Layup. BLOCKED BY KYRIE ADEBAYO! Ball is loose! Offensive rebound by Jabari Barrett! Jabari Barrett kicks it out.

[01:39] Team_078 possession (Score: 114-106)
Ben Ginobili attempts a 3Pt. Contested by Cole Griffin (5.1 feet, ZONE). Ben Ginobili misses. Rebound secured by Kyrie Adebayo.

[01:26] Team_096 possession (Score: 114-106)
Scottie Herro drives to the basket... FOUL! Offensive foul on Scottie Herro! Jabari Barrett drew the charge! [Team fouls: 4] (Scottie Herro: 3 personal fouls) TURNOVER! (dead ball)

[01:10] Team_078 possession (Score: 114-106)
Jabari Barnes attempts a Midrange. Wide open! Terry Mobley is 6.4 feet away. [MAN] JABARI BARNES MAKES IT!
Score: 114-108

[00:55] Team_096 possession (Score: 114-108)
Cole Griffin throws a bad pass out of bounds! TURNOVER! (dead ball)

[00:55] Substitution (Team_096): Terry Mobley OUT → Cade Jokic IN (stamina_rule2)

[00:55] Substitution (Team_096): Lamelo Quickley OUT → Jarrett Markkanen IN (stamina_rule2)

[00:55] Substitution (Team_096): Cole Griffin OUT → Cole Holiday IN (stamina_rule2)

[00:55] Substitution (Team_096): Scottie Herro OUT → Tyler Haliburton IN (stamina_rule2)

[00:55] Substitution (Team_096): Kyrie Adebayo OUT → Devin Griffin IN (stamina_rule2)

[00:55] Substitution (Team_078): Jabari Barnes OUT → Magic Barrett IN (stamina_rule2)

[00:55] Substitution (Team_078): Kyrie Carter OUT → Damian Allen IN (stamina_rule2)

[00:55] Substitution (Team_078): Isaiah Simmons OUT → Malcolm Randle IN (stamina_rule2)

[00:55] Substitution (Team_078): Ben Ginobili OUT → Paul Ming IN (stamina_rule2)

[00:55] Substitution (Team_078): Jabari Barrett OUT → Draymond Irving IN (stamina_rule2)

[00:40] Team_078 possession (Score: 114-108)
Paul Ming makes the Dunk and draws the foul on Tyler Haliburton! And-1! Paul Ming to the line for 1. [BONUS: 5 team fouls] (Tyler Haliburton: 1 personal fouls)   FT 1/1: GOOD Paul Ming makes 1/1 from the line.
Score: 114-111

[00:27] Team_096 possession (Score: 114-111)
Cole Holiday makes the Layup and draws the foul on Paul Ming! And-1! Cole Holiday to the line for 1. [BONUS: 5 team fouls] (Paul Ming: 1 personal fouls)   FT 1/1: GOOD Cole Holiday makes 1/1 from the line.
Score: 117-111

[00:12] Team_078 possession (Score: 117-111)
Magic Barrett attempts a 3Pt. Contested by Cade Jokic (5.8 feet, ZONE). Magic Barrett misses. Rebound secured by Devin Griffin.

================================================================================
                              4TH QUARTER COMPLETE                              
================================================================================

4TH QUARTER SCORE: Team_096 23, Team_078 31

BOX SCORE:
================================================================================

Team_096
--------------------------------------------------------------------------------
Player                MIN  PTS  REB  AST  TO      FG   FG%      3P   3P%
--------------------------------------------------------------------------------
Scottie Herro          37    7    4    0   0   3/7    42.9     0/0   0.0
Lamelo Quickley        37    5    0    1   0   2/5    40.0     0/0   0.0
Kyrie Adebayo          37    5    1    0   0   2/3    66.7     0/0   0.0
Terry Mobley           37    3    0    2   0   1/2    50.0     0/0   0.0
Cole Holiday           12    3    0    0   0   1/1   100.0     0/0   0.0
Cole Griffin           37    0    2    1   0   0/2     0.0     0/0   0.0
Devin Griffin          12    0    1    0   0   0/0     0.0     0/0   0.0

TEAM: FG: 9/20 (45.0%), 3PT: 4/8 (50.0%), REB: 8 (1 off, 7 def), AST: 4, TO: 2
TEAM FOULS: 5 [Team_078 in BONUS]


Team_078
--------------------------------------------------------------------------------
Player                MIN  PTS  REB  AST  TO      FG   FG%      3P   3P%
--------------------------------------------------------------------------------
Jabari Barrett         37    8    3    1   0   4/5    80.0     0/0   0.0
Jabari Barnes          37    7    0    0   0   3/6    50.0     0/0   0.0
Kyrie Carter           37    6    0    2   0   3/3   100.0     0/0   0.0
Isaiah Simmons         37    5    9    1   0   2/3    66.7     0/0   0.0
Paul Ming              12    3    0    0   0   1/1   100.0     0/0   0.0
Ben Ginobili           37    2    1    3   0   1/2    50.0     0/0   0.0
Magic Barrett          12    0    0    0   0   0/1     0.0     0/0   0.0

TEAM: FG: 14/21 (66.7%), 3PT: 2/5 (40.0%), REB: 13 (2 off, 11 def), AST: 7, TO: 1
TEAM FOULS: 5 [Team_096 in BONUS]

================================================================================

================================================================================
                               FULL GAME COMPLETE                               
================================================================================

FINAL SCORE: Team_096 117, Team_078 111

SCORING BY QUARTER:
--------------------------------------------------------------------------------
Team                     Q1     Q2     Q3     Q4    FINAL
--------------------------------------------------------------------------------
Team_096                 42     18     34     23      117
Team_078                 24     24     32     31      111
--------------------------------------------------------------------------------

FULL GAME BOX SCORE:
================================================================================

Team_096
--------------------------------------------------------------------------------
Player                MIN  PTS  REB  AST  TO      FG   FG%      3P   3P%      FT STL BLK
--------------------------------------------------------------------------------
Terry Mobley           37   20    0    8   2   6/10   60.0   4/7    57.1   3/3     0   0
Lamelo Quickley        37   11    0    3   2   5/9    55.6   1/3    33.3   0/0     0   0
Cole Griffin           37   15    8    3   2   6/10   60.0   1/3    33.3   1/1     0   0
Scottie Herro          37   25   11    4   3  14/19   73.7   4/7    57.1   3/3     0   0
Kyrie Adebayo          37   27   12    2   2  10/12   83.3   3/3   100.0   6/6     1   2
Cade Jokic             12    3    0    0   2   1/4    25.0   1/3    33.3   0/0     0   0
Jarrett Markkanen      12    0    3    1   1   0/1     0.0   0/0     0.0   0/0     0   1
Cole Holiday           12    3    0    1   0   1/4    25.0   0/2     0.0   2/3     0   0
Tyler Haliburton       12    7    5    2   0   3/4    75.0   1/1   100.0   2/2     0   0
Devin Griffin          12    5    3    0   0   3/5    60.0   0/0     0.0   1/2     0   0

TEAM: FG: 49/78 (62.8%), 3PT: 15/29 (51.7%), REB: 42 (6 off, 36 def), AST: 24, TO: 14


Team_078
--------------------------------------------------------------------------------
Player                MIN  PTS  REB  AST  TO      FG   FG%      3P   3P%      FT STL BLK
--------------------------------------------------------------------------------
Jabari Barnes          37   15    0    1   1   7/20   35.0   1/8    12.5   4/7     0   0
Kyrie Carter           37   24    0    4   0   9/11   81.8   4/5    80.0   4/4     0   0
Isaiah Simmons         37   20   15    6   2   8/12   66.7   4/5    80.0   2/2     0   0
Ben Ginobili           37    7    4    4   1   3/7    42.9   1/3    33.3   0/0     1   0
Jabari Barrett         37   18    9    2   0  10/14   71.4   0/0     0.0   2/2     2   0
Magic Barrett          12    6    0    0   0   3/6    50.0   0/3     0.0   2/5     0   0
Damian Allen           12    6    0    0   0   1/3    33.3   1/2    50.0   4/4     0   0
Malcolm Randle         12    2    3    0   0   1/5    20.0   0/3     0.0   2/2     0   0
Paul Ming              12    7    4    0   0   4/4   100.0   0/0     0.0   5/5     2   0
Draymond Irving        12    4    5    1   0   2/3    66.7   0/0     0.0   2/2     0   0

TEAM: FG: 48/86 (55.8%), 3PT: 11/29 (37.9%), REB: 40 (11 off, 29 def), AST: 18, TO: 4

================================================================================
