================================================================================
                        FULL GAME - Team_059 vs Team_073                        
================================================================================

================================================================================
                       1ST QUARTER - Team_059 vs Team_073                       
================================================================================

[12:00] Team_059 possession (Score: 0-0)
Jarrett Smith attempts a Dunk. BLOCKED BY CARMELO PORZINGIS! Ball is loose! Rebound secured by Isaiah Smith.

[11:46] Team_073 possession (Score: 0-0)
Carmelo Young drives to the basket... Carmelo Young loses the ball! Stripped by Jarrett Smith! TURNOVER! (live ball)

[11:34] Team_059 possession (Score: 0-0)
Bam Wade attempts a 3Pt. Contested by Karl Williamson (3.5 feet, ZONE). Bam Wade misses. Rebound secured by Carmelo Porzingis.

[11:18] Team_073 possession (Score: 0-0)
Karl Williamson drives, picks up Jarrett Smith. Help arrives from Bam Wade! Karl Williamson attempts a Dunk. Contested by Bam Wade (4.7 feet, ZONE). KARL WILLIAMSON MAKES IT! Assist: Bradley Morant
Score: 0-2

[11:03] Team_059 possession (Score: 0-2)
Jarrett Smith drives and kicks out. Jarrett Smith attempts a 3Pt. Contested by Bradley Morant (3.9 feet, MAN). Jarrett Smith misses. Rebound secured by Bradley Morant.

[10:48] Team_073 possession (Score: 0-2)
Isaiah Smith drives, picks up Nikola Jokic. Help arrives from Bam Wade! Isaiah Smith attempts a Layup. Contested by Bam Wade (5.6 feet, ZONE). ISAIAH SMITH MAKES IT!
Score: 0-4

[10:32] Team_059 possession (Score: 0-4)
Blake Tatum makes the Midrange and draws the foul on Isaiah Smith! And-1! Blake Tatum to the line for 1. [Team fouls: 1] (Isaiah Smith: 1 personal fouls)   FT 1/1: GOOD Blake Tatum makes 1/1 from the line.
Score: 3-4

[10:19] Team_073 possession (Score: 3-4)
Bradley Morant drives to the basket... Bradley Morant throws a bad pass out of bounds! TURNOVER! (dead ball)

[10:02] Team_059 possession (Score: 3-4)
Bam Wade attempts a 3Pt. Contested by Carmelo Young (5.0 feet, MAN). Bam Wade misses. FOUL! Loose ball foul on Isaiah Smith during the rebound battle. [Team fouls: 2] No free throws, side out. (Isaiah Smith: 2 personal fouls)

[09:47] Team_059 possession (Score: 3-4)
Bam Wade attempts a Midrange. Contested by Carmelo Young (5.0 feet, MAN). Bam Wade misses. Rebound secured by Bradley Morant.

[09:33] Team_073 possession (Score: 3-4)
FOUL! Holding foul on Bam Wade. [Team fouls: 1] No free throws, side out. (Bam Wade: 1 personal fouls)

[09:20] Team_073 possession (Score: 3-4)
Karl Williamson attempts a Layup. Contested by John Iverson (5.6 feet, MAN). KARL WILLIAMSON MAKES IT!
Score: 3-6

[09:07] Team_059 possession (Score: 3-6)
Blake Tatum makes the Layup and draws the foul on Bradley Morant! And-1! Blake Tatum to the line for 1. [Team fouls: 3] (Bradley Morant: 1 personal fouls)   FT 1/1: GOOD Blake Tatum makes 1/1 from the line.
Score: 6-6

[08:47] Team_073 possession (Score: 6-6)
Karl Williamson drives and kicks out. Bradley Morant attempts a Midrange. Contested by Jarrett Smith (4.5 feet, MAN). Bradley Morant misses. Rebound secured by Jarrett Smith.

[08:35] Team_059 possession (Score: 6-6)
Bam Wade attempts a 3Pt. Contested by Carmelo Young (5.0 feet, MAN). Bam Wade misses. Rebound secured by Bradley Morant.

[08:21] Team_073 possession (Score: 6-6)
Carmelo Young attempts a Midrange. Contested by John Iverson (5.5 feet, ZONE). CARMELO YOUNG MAKES IT!
Score: 6-8

[08:08] Team_059 possession (Score: 6-8)
Jarrett Smith attempts a 3Pt. Contested by Karl Williamson (3.4 feet, ZONE). JARRETT SMITH MAKES IT! Assist: John Iverson
Score: 9-8

[07:53] Team_073 possession (Score: 9-8)
FOUL! Holding foul on Blake Tatum. [Team fouls: 2] No free throws, side out. (Blake Tatum: 1 personal fouls)

[07:42] Team_073 possession (Score: 9-8)
Carmelo Young attempts a Midrange. Contested by Nikola Jokic (5.6 feet, ZONE). CARMELO YOUNG MAKES IT! Assist: Karl Williamson
Score: 9-10

[07:27] Team_059 possession (Score: 9-10)
Bam Wade attempts a Midrange. Contested by Carmelo Young (5.0 feet, MAN). Bam Wade misses. Rebound secured by Bradley Morant.

[07:08] Team_073 possession (Score: 9-10)
Carmelo Porzingis attempts a 3Pt. Contested by Nikola Jokic (5.5 feet, MAN). CARMELO PORZINGIS MAKES IT! Assist: Isaiah Smith
Score: 9-13

[06:55] Team_059 possession (Score: 9-13)
Nikola Jokic attempts a 3Pt. Contested by Karl Williamson (3.2 feet, ZONE). Nikola Jokic misses. Rebound secured by Carmelo Porzingis.

[06:36] Team_073 possession (Score: 9-13)
FOUL! Reach-in foul on Jarrett Smith during the drive. [Team fouls: 3] No free throws, side out. (Jarrett Smith: 1 personal fouls)

[06:25] Team_073 possession (Score: 9-13)
Carmelo Porzingis attempts a 3Pt. Contested by Bam Wade (3.8 feet, ZONE). Carmelo Porzingis misses. Rebound secured by Bam Wade.

[06:14] Team_059 possession (Score: 9-13)
FOUL! Holding foul on Karl Williamson. [Team fouls: 4] No free throws, side out. (Karl Williamson: 1 personal fouls)

[05:55] Team_059 possession (Score: 9-13)
John Iverson attempts a 3Pt. Contested by Karl Williamson (3.2 feet, MAN). John Iverson misses. Rebound secured by Bradley Morant.

[05:37] Team_073 possession (Score: 9-13)
Carmelo Porzingis drives, picks up Jarrett Smith. Help arrives from Bam Wade! Carmelo Porzingis attempts a Dunk. Contested by Bam Wade (4.6 feet, ZONE). CARMELO PORZINGIS MAKES IT! Assist: Karl Williamson
Score: 9-15

[05:22] Team_059 possession (Score: 9-15)
Nikola Jokic attempts a 3Pt. Contested by Carmelo Porzingis (3.8 feet, MAN). NIKOLA JOKIC MAKES IT! Assist: Blake Tatum
Score: 12-15

[05:05] Team_073 possession (Score: 12-15)
Carmelo Young attempts a 3Pt. Contested by Bam Wade (4.0 feet, ZONE). CARMELO YOUNG MAKES IT! Assist: Bradley Morant
Score: 12-18

[04:49] Team_059 possession (Score: 12-18)
Bam Wade throws a bad pass! Stolen by Carmelo Young! TURNOVER! (live ball)

[04:37] Team_073 possession (Score: 12-18)
Carmelo Young throws a bad pass! Stolen by Bam Wade! TURNOVER! (live ball)

[04:24] Team_059 possession (Score: 12-18)
FOUL! Shooting foul on Bradley Morant. Jarrett Smith to the line for 2 free throws. [BONUS: 5 team fouls] (Bradley Morant: 2 personal fouls)   FT 1/2: GOOD   FT 2/2: GOOD Jarrett Smith makes 2/2 from the line.
Score: 14-18

[04:07] Team_073 possession (Score: 14-18)
Carmelo Young drives, Bam Wade stays with him. Carmelo Young attempts a Layup. Contested by Bam Wade (4.0 feet, MAN). Carmelo Young misses. Rebound secured by Bam Wade.

[03:53] Team_059 possession (Score: 14-18)
Jarrett Smith drives, picks up Bradley Morant. Help arrives from Isaiah Smith! Jarrett Smith attempts a Layup. Contested by Isaiah Smith (4.3 feet, ZONE). JARRETT SMITH MAKES IT!
Score: 16-18

[03:41] Team_073 possession (Score: 16-18)
Bradley Morant attempts a Layup. Contested by Jarrett Smith (4.9 feet, MAN). BRADLEY MORANT MAKES IT! Assist: Isaiah Smith
Score: 16-20

[03:24] Team_059 possession (Score: 16-20)
FOUL! Shooting foul on Bradley Morant. John Iverson to the line for 2 free throws. [BONUS: 6 team fouls] (Bradley Morant: 3 personal fouls)   FT 1/2: GOOD   FT 2/2: GOOD John Iverson makes 2/2 from the line.
Score: 18-20

[03:09] Team_073 possession (Score: 18-20)
Carmelo Young makes the Layup and draws the foul on Jarrett Smith! And-1! Carmelo Young to the line for 1. [Team fouls: 4] (Jarrett Smith: 2 personal fouls)   FT 1/1: GOOD Carmelo Young makes 1/1 from the line.
Score: 18-23

[02:51] Team_059 possession (Score: 18-23)
Nikola Jokic drives, picks up Bradley Morant. Help arrives from Isaiah Smith! Nikola Jokic attempts a Layup. Contested by Isaiah Smith (4.2 feet, ZONE). Nikola Jokic misses. Rebound secured by Carmelo Porzingis.

[02:39] Team_073 possession (Score: 18-23)
Carmelo Young drives, Jarrett Smith stays with him. Carmelo Young attempts a Layup. Contested by Jarrett Smith (4.9 feet, ZONE). CARMELO YOUNG MAKES IT!
Score: 18-25

[02:24] Team_059 possession (Score: 18-25)
Bam Wade attempts a 3Pt. Contested by Karl Williamson (3.8 feet, ZONE). Bam Wade misses. Rebound secured by Bradley Morant.

[02:11] Team_073 possession (Score: 18-25)
FOUL! Reach-in foul on Jarrett Smith during the drive. [IN THE BONUS! 5 team fouls] Carmelo Porzingis to the line for 2 free throws. (Jarrett Smith: 3 personal fouls)   FT 1/2: GOOD   FT 2/2: GOOD Carmelo Porzingis makes 2/2 from the line.
Score: 18-27

[01:52] Team_059 possession (Score: 18-27)
John Iverson throws a bad pass out of bounds! TURNOVER! (dead ball)

[01:52] Substitution (Team_059): Bam Wade OUT → Russell Quickley IN (stamina_rule2)

[01:52] Substitution (Team_059): Blake Tatum OUT → Scottie Ginobili IN (stamina_rule2)

[01:52] Substitution (Team_059): John Iverson OUT → Allen Giddey IN (stamina_rule2)

[01:52] Substitution (Team_059): Nikola Jokic OUT → Bones Middleton IN (stamina_rule2)

[01:52] Substitution (Team_059): Jarrett Smith OUT → LeBron Lowry IN (stamina_rule2)

[01:52] Substitution (Team_073): Carmelo Young OUT → Zach Quickley IN (stamina_rule2)

[01:52] Substitution (Team_073): Isaiah Smith OUT → Luka Butler IN (stamina_rule2)

[01:52] Substitution (Team_073): Karl Williamson OUT → Dwyane McCollum IN (stamina_rule2)

[01:52] Substitution (Team_073): Carmelo Porzingis OUT → Shai Thompson IN (stamina_rule2)

[01:52] Substitution (Team_073): Bradley Morant OUT → Ja Rose IN (stamina_rule2)

[01:43] Team_073 possession (Score: 18-27)
Shai Thompson attempts a Midrange. Contested by Bones Middleton (4.7 feet, MAN). Shai Thompson misses. Rebound secured by Bones Middleton.

[01:27] Team_059 possession (Score: 18-27)
Bones Middleton loses the ball! Stripped by Shai Thompson! TURNOVER! (live ball)

[01:11] Team_073 possession (Score: 18-27)
Ja Rose attempts a Midrange. Contested by LeBron Lowry (4.8 feet, MAN). JA ROSE MAKES IT! Assist: Luka Butler
Score: 18-29

[00:57] Team_059 possession (Score: 18-29)
Scottie Ginobili attempts a 3Pt. Contested by Luka Butler (4.9 feet, ZONE). SCOTTIE GINOBILI MAKES IT! Assist: Russell Quickley
Score: 21-29

[00:46] Team_073 possession (Score: 21-29)
Dwyane McCollum attempts a 3Pt. Contested by Russell Quickley (4.5 feet, ZONE). Dwyane McCollum misses. Rebound secured by Scottie Ginobili.

[00:31] Team_059 possession (Score: 21-29)
Russell Quickley drives and kicks out. Bones Middleton attempts a 3Pt. Contested by Luka Butler (4.4 feet, ZONE). Bones Middleton misses. Rebound secured by Ja Rose.

[00:22] Team_073 possession (Score: 21-29)
Zach Quickley drives, picks up Bones Middleton. Help arrives from Scottie Ginobili! Zach Quickley attempts a Dunk. Contested by Scottie Ginobili (4.9 feet, ZONE). ZACH QUICKLEY MAKES IT! Assist: Ja Rose
Score: 21-31

[00:11] Team_059 possession (Score: 21-31)
Russell Quickley attempts a 3Pt. Contested by Zach Quickley (4.8 feet, MAN). Russell Quickley misses. Rebound secured by Dwyane McCollum.

================================================================================
                              1ST QUARTER COMPLETE                              
================================================================================

1ST QUARTER SCORE: Team_059 21, Team_073 31

BOX SCORE:
================================================================================

Team_059
--------------------------------------------------------------------------------
Player                MIN  PTS  REB  AST  TO      FG   FG%      3P   3P%
--------------------------------------------------------------------------------
Jarrett Smith          10    7    2    0   0   3/5    60.0     0/0   0.0
Blake Tatum            10    6    0    1   0   2/2   100.0     0/0   0.0
Nikola Jokic           10    3    0    0   0   1/3    33.3     0/0   0.0
Scottie Ginobili        2    3    1    0   0   1/1   100.0     0/0   0.0
John Iverson           10    2    0    1   0   1/2    50.0     0/0   0.0
Bam Wade               10    0    2    0   0   0/5     0.0     0/0   0.0
Bones Middleton         2    0    1    0   0   0/0     0.0     0/0   0.0
Russell Quickley        2    0    0    1   0   0/2     0.0     0/0   0.0

TEAM: FG: 8/20 (40.0%), 3PT: 3/9 (33.3%), REB: 6 (1 off, 5 def), AST: 3, TO: 3
TEAM FOULS: 5 [Team_073 in BONUS]


Team_073
--------------------------------------------------------------------------------
Player                MIN  PTS  REB  AST  TO      FG   FG%      3P   3P%
--------------------------------------------------------------------------------
Carmelo Young          10   12    0    0   0   5/6    83.3     0/0   0.0
Carmelo Porzingis      10    7    3    0   0   3/4    75.0     0/0   0.0
Karl Williamson        10    4    0    2   0   2/3    66.7     0/0   0.0
Isaiah Smith           10    2    1    2   0   1/1   100.0     0/0   0.0
Bradley Morant         10    2    6    2   0   1/1   100.0     0/0   0.0
Ja Rose                 2    2    1    1   0   1/1   100.0     0/0   0.0
Zach Quickley           2    2    0    0   0   1/1   100.0     0/0   0.0
Shai Thompson           2    0    0    0   0   0/1     0.0     0/0   0.0
Luka Butler             2    0    0    1   0   0/0     0.0     0/0   0.0
Dwyane McCollum         2    0    1    0   0   0/1     0.0     0/0   0.0

TEAM: FG: 14/19 (73.7%), 3PT: 2/4 (50.0%), REB: 12 (0 off, 12 def), AST: 8, TO: 3
TEAM FOULS: 6 [Team_059 in BONUS]

================================================================================

================================================================================
                       2ND QUARTER - Team_059 vs Team_073                       
================================================================================

[12:00] Team_059 possession (Score: 21-31)
Blake Tatum attempts a Layup. BLOCKED BY ISAIAH SMITH! Ball goes out off Isaiah Smith. Blake Tatum's ball!

[11:49] Team_059 possession (Score: 21-31)
Blake Tatum drives, Isaiah Smith stays with him. Blake Tatum attempts a Layup. Contested by Isaiah Smith (4.2 feet, MAN). Blake Tatum misses. Rebound secured by Isaiah Smith.

[11:38] Team_073 possession (Score: 21-31)
Carmelo Porzingis makes the Layup and draws the foul on Bam Wade! And-1! Carmelo Porzingis to the line for 1. [Team fouls: 1] (Bam Wade: 1 personal fouls)   FT 1/1: GOOD Carmelo Porzingis makes 1/1 from the line.
Score: 21-34

[11:20] Team_059 possession (Score: 21-34)
John Iverson commits a violation (traveling/carry)! TURNOVER! (dead ball)

[11:07] Team_073 possession (Score: 21-34)
Carmelo Porzingis attempts a 3Pt. Contested by Bam Wade (4.0 feet, ZONE). CARMELO PORZINGIS MAKES IT! Assist: Karl Williamson
Score: 21-37

[10:54] Team_059 possession (Score: 21-37)
Blake Tatum throws a bad pass out of bounds! TURNOVER! (dead ball)

[10:35] Team_073 possession (Score: 21-37)
FOUL! Shooting foul on Jarrett Smith. Carmelo Young to the line for 2 free throws. [Team fouls: 2] (Jarrett Smith: 1 personal fouls)   FT 1/2: GOOD   FT 2/2: GOOD Carmelo Young makes 2/2 from the line.
Score: 21-39

[10:21] Team_059 possession (Score: 21-39)
Nikola Jokic drives to the basket... Nikola Jokic throws a bad pass out of bounds! TURNOVER! (dead ball)

[10:21] Substitution (Team_059): John Iverson OUT → Allen Giddey IN (stamina_rule2)

[10:04] Team_073 possession (Score: 21-39)
Bradley Morant attempts a Midrange. BLOCKED BY JARRETT SMITH! Ball is loose! Offensive rebound by Bradley Morant! Bradley Morant kicks it out.

[09:48] Team_073 possession (Score: 21-39)
Isaiah Smith attempts a Midrange. Contested by Jarrett Smith (4.8 feet, ZONE). ISAIAH SMITH MAKES IT! Assist: Carmelo Young
Score: 21-41

[09:37] Team_059 possession (Score: 21-41)
FOUL! Shooting foul on Bradley Morant. Jarrett Smith to the line for 2 free throws. [Team fouls: 1] (Bradley Morant: 1 personal fouls)   FT 1/2: GOOD   FT 2/2: MISS Jarrett Smith makes 1/2 from the line. Rebound secured by Bradley Morant.
Score: 22-41

[09:20] Team_073 possession (Score: 22-41)
Bradley Morant attempts a Midrange. Contested by Bam Wade (4.4 feet, ZONE). BRADLEY MORANT MAKES IT! Assist: Carmelo Young
Score: 22-43

[09:02] Team_059 possession (Score: 22-43)
Bam Wade makes the Layup and draws the foul on Carmelo Young! And-1! Bam Wade to the line for 1. [Team fouls: 2] (Carmelo Young: 1 personal fouls)   FT 1/1: GOOD Bam Wade makes 1/1 from the line.
Score: 25-43

[08:49] Team_073 possession (Score: 25-43)
Bradley Morant drives, Jarrett Smith stays with him. Bradley Morant attempts a Dunk. Contested by Jarrett Smith (5.1 feet, ZONE). BRADLEY MORANT MAKES IT! Assist: Carmelo Young
Score: 25-45

[08:32] Team_059 possession (Score: 25-45)
Allen Giddey makes the Layup and draws the foul on Karl Williamson! And-1! Allen Giddey to the line for 1. [Team fouls: 3] (Karl Williamson: 1 personal fouls)   FT 1/1: GOOD Allen Giddey makes 1/1 from the line.
Score: 28-45

[08:15] Team_073 possession (Score: 28-45)
Carmelo Young attempts a Midrange. Wide open! Allen Giddey is 6.8 feet away. [ZONE] CARMELO YOUNG MAKES IT!
Score: 28-47

[07:58] Team_059 possession (Score: 28-47)
Allen Giddey attempts a Midrange. Contested by Isaiah Smith (4.5 feet, ZONE). Allen Giddey misses. Offensive rebound by Jarrett Smith! Jarrett Smith kicks it out.

[07:44] Team_059 possession (Score: 28-47)
Nikola Jokic drives, Bradley Morant stays with him. Nikola Jokic attempts a Dunk. Contested by Bradley Morant (4.4 feet, ZONE). Nikola Jokic misses. Offensive rebound by Nikola Jokic! Nikola Jokic kicks it out.

[07:29] Team_059 possession (Score: 28-47)
Jarrett Smith drives and kicks out. Blake Tatum attempts a 3Pt. Contested by Isaiah Smith (4.7 feet, MAN). Blake Tatum misses. Offensive rebound by Jarrett Smith! Jarrett Smith kicks it out.

[07:15] Team_059 possession (Score: 28-47)
Nikola Jokic attempts a Layup. BLOCKED BY BRADLEY MORANT! Ball is loose! Rebound secured by Carmelo Porzingis.

[07:03] Team_073 possession (Score: 28-47)
Carmelo Porzingis attempts a 3Pt. Contested by Bam Wade (4.4 feet, ZONE). Carmelo Porzingis misses. Rebound secured by Bam Wade.

[06:47] Team_059 possession (Score: 28-47)
Bam Wade attempts a 3Pt. Contested by Karl Williamson (4.1 feet, ZONE). BAM WADE MAKES IT! Assist: Jarrett Smith
Score: 31-47

[06:34] Team_073 possession (Score: 31-47)
Bradley Morant attempts a 3Pt. Contested by Jarrett Smith (5.3 feet, MAN). Bradley Morant misses. Rebound secured by Jarrett Smith.

[06:17] Team_059 possession (Score: 31-47)
Bam Wade drives, Carmelo Young stays with him. Bam Wade attempts a Layup. Contested by Carmelo Young (5.6 feet, MAN). Bam Wade misses. Rebound secured by Carmelo Porzingis.

[06:05] Team_073 possession (Score: 31-47)
Bradley Morant attempts a Layup. BLOCKED BY BAM WADE! Ball is loose! Rebound secured by Bam Wade.

[05:50] Team_059 possession (Score: 31-47)
Jarrett Smith loses control! Ball rolls out of bounds! TURNOVER! (dead ball)

[05:50] Substitution (Team_059): Bam Wade OUT → Russell Quickley IN (stamina_rule2)

[05:50] Substitution (Team_059): Blake Tatum OUT → Scottie Ginobili IN (stamina_rule2)

[05:50] Substitution (Team_059): Nikola Jokic OUT → Bones Middleton IN (stamina_rule2)

[05:50] Substitution (Team_059): Jarrett Smith OUT → LeBron Lowry IN (stamina_rule2)

[05:50] Substitution (Team_073): Carmelo Young OUT → Zach Quickley IN (stamina_rule2)

[05:50] Substitution (Team_073): Isaiah Smith OUT → Luka Butler IN (stamina_rule2)

[05:50] Substitution (Team_073): Karl Williamson OUT → Dwyane McCollum IN (stamina_rule2)

[05:50] Substitution (Team_073): Carmelo Porzingis OUT → Shai Thompson IN (stamina_rule2)

[05:50] Substitution (Team_073): Bradley Morant OUT → Ja Rose IN (stamina_rule2)

[05:37] Team_073 possession (Score: 31-47)
Dwyane McCollum makes the Dunk and draws the foul on Bones Middleton! And-1! Dwyane McCollum to the line for 1. [Team fouls: 3] (Bones Middleton: 1 personal fouls)   FT 1/1: GOOD Dwyane McCollum makes 1/1 from the line.
Score: 31-50

[05:21] Team_059 possession (Score: 31-50)
FOUL! Reach-in foul on Shai Thompson during the drive. [Team fouls: 4] No free throws, side out. (Shai Thompson: 1 personal fouls)

[05:06] Team_059 possession (Score: 31-50)
Russell Quickley attempts a 3Pt. Contested by Luka Butler (4.8 feet, ZONE). RUSSELL QUICKLEY MAKES IT! Assist: LeBron Lowry
Score: 34-50

[04:51] Team_073 possession (Score: 34-50)
Luka Butler loses the ball! Stripped by Scottie Ginobili! TURNOVER! (live ball)

[04:37] Team_059 possession (Score: 34-50)
Scottie Ginobili attempts a Layup. Contested by Luka Butler (4.9 feet, MAN). SCOTTIE GINOBILI MAKES IT! Assist: Bones Middleton
Score: 36-50

[04:20] Team_073 possession (Score: 36-50)
Luka Butler attempts a 3Pt. Contested by Russell Quickley (5.0 feet, ZONE). LUKA BUTLER MAKES IT! Assist: Zach Quickley
Score: 36-53

[04:08] Team_059 possession (Score: 36-53)
Bones Middleton attempts a 3Pt. Contested by Luka Butler (4.8 feet, ZONE). Bones Middleton misses. Rebound secured by Shai Thompson.

[03:58] Team_073 possession (Score: 36-53)
Dwyane McCollum attempts a 3Pt. Contested by Russell Quickley (4.5 feet, ZONE). Dwyane McCollum misses. Rebound secured by LeBron Lowry.

[03:45] Team_059 possession (Score: 36-53)
FOUL! Shooting foul on Luka Butler. LeBron Lowry to the line for 2 free throws. [BONUS: 5 team fouls] (Luka Butler: 1 personal fouls)   FT 1/2: GOOD   FT 2/2: MISS LeBron Lowry makes 1/2 from the line. Rebound secured by Dwyane McCollum.
Score: 37-53

[03:28] Team_073 possession (Score: 37-53)
Dwyane McCollum attempts a 3Pt. Wide open! Allen Giddey is 6.7 feet away. [MAN] Dwyane McCollum misses. Rebound secured by Scottie Ginobili.

[03:15] Team_059 possession (Score: 37-53)
Allen Giddey attempts a 3Pt. Contested by Luka Butler (4.2 feet, ZONE). Allen Giddey misses. FOUL! Loose ball foul on Dwyane McCollum during the rebound battle. [IN THE BONUS! 6 team fouls] Scottie Ginobili to the line for 2 free throws. (Dwyane McCollum: 1 personal fouls)   FT 1/2: MISS   FT 2/2: GOOD Scottie Ginobili makes 1/2 from the line.
Score: 38-53

[02:57] Team_073 possession (Score: 38-53)
Dwyane McCollum attempts a 3Pt. Contested by Russell Quickley (4.5 feet, ZONE). Dwyane McCollum misses. FOUL! Loose ball foul on Bones Middleton during the rebound battle. [Team fouls: 4] No free throws, side out. (Bones Middleton: 2 personal fouls)

[02:42] Team_073 possession (Score: 38-53)
Shai Thompson attempts a Layup. Contested by Bones Middleton (4.7 feet, ZONE). SHAI THOMPSON MAKES IT! Assist: Luka Butler
Score: 38-55

[02:25] Team_059 possession (Score: 38-55)
Allen Giddey attempts a 3Pt. Contested by Luka Butler (4.2 feet, ZONE). Allen Giddey misses. Rebound secured by Shai Thompson.

[02:10] Team_073 possession (Score: 38-55)
Zach Quickley attempts a 3Pt. Contested by Russell Quickley (4.7 feet, MAN). Zach Quickley misses. Rebound secured by Scottie Ginobili.

[01:58] Team_059 possession (Score: 38-55)
Allen Giddey attempts a 3Pt. Contested by Shai Thompson (3.6 feet, ZONE). Allen Giddey misses. Rebound secured by Ja Rose.

[01:47] Team_073 possession (Score: 38-55)
Luka Butler attempts a Layup. Contested by Scottie Ginobili (5.0 feet, MAN). LUKA BUTLER MAKES IT!
Score: 38-57

[01:33] Team_059 possession (Score: 38-57)
Scottie Ginobili attempts a Layup. Contested by Shai Thompson (4.3 feet, ZONE). SCOTTIE GINOBILI MAKES IT! Assist: Bones Middleton
Score: 40-57

[01:18] Team_073 possession (Score: 40-57)
Ja Rose drives to the basket... Ja Rose commits a violation (traveling/carry)! TURNOVER! (dead ball)

[01:02] Team_059 possession (Score: 40-57)
Bones Middleton attempts a Midrange. Contested by Shai Thompson (4.2 feet, MAN). BONES MIDDLETON MAKES IT! Assist: Russell Quickley
Score: 42-57

[00:49] Team_073 possession (Score: 42-57)
Shai Thompson makes the Layup and draws the foul on Bones Middleton! And-1! Shai Thompson to the line for 1. [BONUS: 5 team fouls] (Bones Middleton: 3 personal fouls)   FT 1/1: GOOD Shai Thompson makes 1/1 from the line.
Score: 42-60

[00:34] Team_059 possession (Score: 42-60)
Scottie Ginobili attempts a 3Pt. Contested by Luka Butler (4.9 feet, ZONE). Scottie Ginobili misses. Rebound secured by Dwyane McCollum.

[00:21] Team_073 possession (Score: 42-60)
Dwyane McCollum attempts a Layup. Contested by Bones Middleton (4.6 feet, ZONE). DWYANE MCCOLLUM MAKES IT! Assist: Shai Thompson
Score: 42-62

[00:08] Team_059 possession (Score: 42-62)
Scottie Ginobili makes the Layup and draws the foul on Luka Butler! And-1! Scottie Ginobili to the line for 1. [BONUS: 7 team fouls] (Luka Butler: 2 personal fouls)   FT 1/1: GOOD Scottie Ginobili makes 1/1 from the line.
Score: 45-62

================================================================================
                              2ND QUARTER COMPLETE                              
================================================================================

2ND QUARTER SCORE: Team_059 24, Team_073 31

BOX SCORE:
================================================================================

Team_059
--------------------------------------------------------------------------------
Player                MIN  PTS  REB  AST  TO      FG   FG%      3P   3P%
--------------------------------------------------------------------------------
Scottie Ginobili        7    8    2    0   0   4/5    80.0     0/0   0.0
Bam Wade               17    6    2    0   0   2/3    66.7     0/0   0.0
Allen Giddey           12    3    0    0   0   1/3    33.3     0/0   0.0
Russell Quickley        7    3    0    1   0   1/1   100.0     0/0   0.0
Bones Middleton         7    2    0    2   0   1/2    50.0     0/0   0.0
Blake Tatum            17    0    0    0   0   0/1     0.0     0/0   0.0
Jarrett Smith          17    0    3    1   0   0/1     0.0     0/0   0.0
Nikola Jokic           17    0    1    0   0   0/1     0.0     0/0   0.0
LeBron Lowry            7    0    1    1   0   0/1     0.0     0/0   0.0

TEAM: FG: 9/18 (50.0%), 3PT: 3/7 (42.9%), REB: 9 (3 off, 6 def), AST: 5, TO: 4
TEAM FOULS: 5 [Team_073 in BONUS]


Team_073
--------------------------------------------------------------------------------
Player                MIN  PTS  REB  AST  TO      FG   FG%      3P   3P%
--------------------------------------------------------------------------------
Carmelo Porzingis      17    6    2    0   0   2/3    66.7     0/0   0.0
Dwyane McCollum         7    5    3    0   0   2/4    50.0     0/0   0.0
Luka Butler             7    5    0    1   0   2/2   100.0     0/0   0.0
Shai Thompson           7    5    2    1   0   2/2   100.0     0/0   0.0
Carmelo Young          17    4    0    3   0   2/2   100.0     0/0   0.0
Bradley Morant         17    4    2    0   0   2/4    50.0     0/0   0.0
Isaiah Smith           17    2    1    0   0   1/1   100.0     0/0   0.0
Karl Williamson        17    0    0    1   0   0/0     0.0     0/0   0.0
Zach Quickley           7    0    0    1   0   0/1     0.0     0/0   0.0
Ja Rose                 7    0    1    0   0   0/0     0.0     0/0   0.0

TEAM: FG: 13/19 (68.4%), 3PT: 2/7 (28.6%), REB: 11 (2 off, 9 def), AST: 7, TO: 2
TEAM FOULS: 7 [Team_059 in BONUS]

================================================================================

================================================================================
                       3RD QUARTER - Team_059 vs Team_073                       
================================================================================

[12:00] Team_059 possession (Score: 45-62)
Blake Tatum drives and kicks out. John Iverson attempts a 3Pt. Contested by Karl Williamson (3.1 feet, MAN). John Iverson misses. Rebound secured by Carmelo Porzingis.

[11:45] Team_073 possession (Score: 45-62)
Karl Williamson attempts a Midrange. Contested by John Iverson (5.6 feet, MAN). Karl Williamson misses. Rebound secured by Bam Wade.

[11:26] Team_059 possession (Score: 45-62)
FOUL! Reach-in foul on Bradley Morant during the drive. [Team fouls: 1] No free throws, side out. (Bradley Morant: 1 personal fouls)

[11:13] Team_059 possession (Score: 45-62)
Bam Wade attempts a 3Pt. Contested by Karl Williamson (3.5 feet, ZONE). Bam Wade misses. Offensive rebound by Jarrett Smith! Jarrett Smith kicks it out.

[10:58] Team_059 possession (Score: 45-62)
John Iverson drives to the basket... John Iverson throws a bad pass! Stolen by Bradley Morant! TURNOVER! (live ball)

[10:47] Team_073 possession (Score: 45-62)
Carmelo Porzingis attempts a Midrange. Contested by Nikola Jokic (5.5 feet, MAN). Carmelo Porzingis misses. Offensive rebound by Bradley Morant! Bradley Morant kicks it out.

[10:30] Team_073 possession (Score: 45-62)
FOUL! Shooting foul on Bam Wade. Carmelo Young to the line for 2 free throws. [Team fouls: 1] (Bam Wade: 1 personal fouls)   FT 1/2: GOOD   FT 2/2: GOOD Carmelo Young makes 2/2 from the line.
Score: 45-64

[10:18] Team_059 possession (Score: 45-64)
Nikola Jokic makes the Layup and draws the foul on Carmelo Porzingis! And-1! Nikola Jokic to the line for 1. [Team fouls: 2] (Carmelo Porzingis: 1 personal fouls)   FT 1/1: GOOD Nikola Jokic makes 1/1 from the line.
Score: 48-64

[10:08] Team_073 possession (Score: 48-64)
Carmelo Young attempts a 3Pt. Contested by Bam Wade (3.9 feet, MAN). Carmelo Young misses. Rebound secured by Bam Wade.

[09:55] Team_059 possession (Score: 48-64)
Bam Wade attempts a 3Pt. Contested by Karl Williamson (3.5 feet, ZONE). Bam Wade misses. Rebound secured by Isaiah Smith.

[09:45] Team_073 possession (Score: 48-64)
Carmelo Porzingis drives and kicks out. Carmelo Porzingis attempts a Midrange. Contested by Nikola Jokic (5.4 feet, MAN). Carmelo Porzingis misses. Rebound secured by Jarrett Smith.

[09:32] Team_059 possession (Score: 48-64)
Bam Wade attempts a 3Pt. Contested by Karl Williamson (3.5 feet, ZONE). Bam Wade misses. Rebound secured by Isaiah Smith.

[09:18] Team_073 possession (Score: 48-64)
Karl Williamson attempts a Midrange. Contested by John Iverson (5.6 feet, MAN). Karl Williamson misses. Offensive rebound by Bradley Morant! Bradley Morant kicks it out.

[09:06] Team_073 possession (Score: 48-64)
Karl Williamson drives, John Iverson stays with him. Karl Williamson attempts a Layup. Contested by John Iverson (5.6 feet, MAN). KARL WILLIAMSON MAKES IT!
Score: 48-66

[08:53] Team_059 possession (Score: 48-66)
John Iverson attempts a 3Pt. Contested by Karl Williamson (3.2 feet, ZONE). JOHN IVERSON MAKES IT! Assist: Bam Wade
Score: 51-66

[08:39] Team_073 possession (Score: 51-66)
Isaiah Smith attempts a 3Pt. Contested by Nikola Jokic (5.6 feet, ZONE). Isaiah Smith misses. Rebound secured by Jarrett Smith.

[08:22] Team_059 possession (Score: 51-66)
FOUL! Holding foul on Bradley Morant. [Team fouls: 3] No free throws, side out. (Bradley Morant: 2 personal fouls)

[08:04] Team_059 possession (Score: 51-66)
Nikola Jokic attempts a 3Pt. Contested by Karl Williamson (3.2 feet, ZONE). Nikola Jokic misses. Rebound secured by Carmelo Porzingis.

[07:50] Team_073 possession (Score: 51-66)
Carmelo Young attempts a 3Pt. Contested by Bam Wade (3.9 feet, ZONE). CARMELO YOUNG MAKES IT! Assist: Carmelo Porzingis
Score: 51-69

[07:40] Team_059 possession (Score: 51-69)
John Iverson throws a bad pass out of bounds! TURNOVER! (dead ball)

[07:20] Team_073 possession (Score: 51-69)
Bradley Morant drives, picks up Jarrett Smith. Help arrives from Bam Wade! Bradley Morant attempts a Dunk. Contested by Bam Wade (4.9 feet, MAN). BRADLEY MORANT MAKES IT! Assist: Carmelo Young
Score: 51-71

[07:03] Team_059 possession (Score: 51-71)
Jarrett Smith throws a bad pass! Stolen by Bradley Morant! TURNOVER! (live ball)

[06:52] Team_073 possession (Score: 51-71)
Bradley Morant attempts a 3Pt. Contested by Bam Wade (4.1 feet, ZONE). Bradley Morant misses. FOUL! Loose ball foul on Jarrett Smith during the rebound battle. [Team fouls: 2] No free throws, side out. (Jarrett Smith: 1 personal fouls)

[06:35] Team_073 possession (Score: 51-71)
Bradley Morant drives to the basket... Bradley Morant throws a bad pass! Stolen by Jarrett Smith! TURNOVER! (live ball)

[06:19] Team_059 possession (Score: 51-71)
Jarrett Smith drives and kicks out. Nikola Jokic attempts a Midrange. Contested by Carmelo Porzingis (3.7 feet, ZONE). Nikola Jokic misses. Rebound secured by Carmelo Porzingis.

[06:03] Team_073 possession (Score: 51-71)
Isaiah Smith attempts a 3Pt. Contested by Blake Tatum (4.4 feet, MAN). Isaiah Smith misses. FOUL! Loose ball foul on John Iverson during the rebound battle. [Team fouls: 3] No free throws, side out. (John Iverson: 1 personal fouls)

[05:44] Team_073 possession (Score: 51-71)
Karl Williamson drives and kicks out. FOUL! Shooting foul on Nikola Jokic. Carmelo Porzingis to the line for 2 free throws. [Team fouls: 4] (Nikola Jokic: 1 personal fouls)   FT 1/2: GOOD   FT 2/2: GOOD Carmelo Porzingis makes 2/2 from the line.
Score: 51-73

[05:27] Team_059 possession (Score: 51-73)
Nikola Jokic attempts a Layup. Contested by Bradley Morant (4.0 feet, ZONE). NIKOLA JOKIC MAKES IT! Assist: Bam Wade
Score: 53-73

[05:10] Team_073 possession (Score: 53-73)
Karl Williamson attempts a Midrange. Contested by Jarrett Smith (4.7 feet, ZONE). KARL WILLIAMSON MAKES IT! Assist: Bradley Morant
Score: 53-75

[04:57] Team_059 possession (Score: 53-75)
FOUL! Reach-in foul on Carmelo Porzingis during the drive. [Team fouls: 4] No free throws, side out. (Carmelo Porzingis: 2 personal fouls)

[04:40] Team_059 possession (Score: 53-75)
Blake Tatum drives, Isaiah Smith stays with him. Blake Tatum attempts a Layup. Contested by Isaiah Smith (4.2 feet, MAN). Blake Tatum misses. Rebound secured by Isaiah Smith.

[04:28] Team_073 possession (Score: 53-75)
FOUL! Reach-in foul on Jarrett Smith during the drive. [IN THE BONUS! 5 team fouls] Bradley Morant to the line for 2 free throws. (Jarrett Smith: 2 personal fouls)   FT 1/2: GOOD   FT 2/2: GOOD Bradley Morant makes 2/2 from the line.
Score: 53-77

[04:14] Team_059 possession (Score: 53-77)
Nikola Jokic drives and kicks out. Blake Tatum attempts a 3Pt. Contested by Isaiah Smith (4.3 feet, MAN). Blake Tatum misses. Rebound secured by Isaiah Smith.

[03:58] Team_073 possession (Score: 53-77)
Carmelo Young attempts a 3Pt. Contested by Bam Wade (4.0 feet, ZONE). Carmelo Young misses. Rebound secured by Jarrett Smith.

[03:47] Team_059 possession (Score: 53-77)
John Iverson drives and kicks out. Bam Wade attempts a Midrange. Contested by Carmelo Young (4.7 feet, MAN). Bam Wade misses. Rebound secured by Carmelo Porzingis.

[03:35] Team_073 possession (Score: 53-77)
Bradley Morant attempts a Layup. Contested by Jarrett Smith (5.0 feet, MAN). BRADLEY MORANT MAKES IT!
Score: 53-79

[03:22] Team_059 possession (Score: 53-79)
Bam Wade attempts a 3Pt. Contested by Carmelo Young (5.2 feet, MAN). Bam Wade misses. Rebound secured by Carmelo Porzingis.

[03:11] Team_073 possession (Score: 53-79)
Carmelo Porzingis attempts a Midrange. Contested by Nikola Jokic (5.6 feet, MAN). Carmelo Porzingis misses. Rebound secured by John Iverson.

[03:00] Team_059 possession (Score: 53-79)
John Iverson commits a violation (traveling/carry)! TURNOVER! (dead ball)

[03:00] Substitution (Team_059): John Iverson OUT → Allen Giddey IN (stamina_rule2)

[02:47] Team_073 possession (Score: 53-79)
Bradley Morant attempts a Layup. Contested by Jarrett Smith (5.0 feet, ZONE). BRADLEY MORANT MAKES IT! Assist: Carmelo Young
Score: 53-81

[02:36] Team_059 possession (Score: 53-81)
Blake Tatum attempts a 3Pt. Contested by Karl Williamson (3.3 feet, ZONE). Blake Tatum misses. Rebound secured by Bradley Morant.

[02:26] Team_073 possession (Score: 53-81)
FOUL! Holding foul on Bam Wade. [IN THE BONUS! 6 team fouls] Carmelo Young to the line for 2 free throws. (Bam Wade: 2 personal fouls)   FT 1/2: GOOD   FT 2/2: GOOD Carmelo Young makes 2/2 from the line.
Score: 53-83

[02:14] Team_059 possession (Score: 53-83)
Nikola Jokic drives and kicks out. Nikola Jokic attempts a Midrange. Contested by Carmelo Porzingis (4.0 feet, MAN). Nikola Jokic misses. Rebound secured by Carmelo Porzingis.

[02:01] Team_073 possession (Score: 53-83)
FOUL! Shooting foul on Nikola Jokic. Carmelo Porzingis to the line for 2 free throws. [BONUS: 7 team fouls] (Nikola Jokic: 2 personal fouls)   FT 1/2: GOOD   FT 2/2: GOOD Carmelo Porzingis makes 2/2 from the line.
Score: 53-85

[01:45] Team_059 possession (Score: 53-85)
Blake Tatum drives and kicks out. Blake Tatum attempts a 3Pt. Contested by Karl Williamson (3.5 feet, ZONE). Blake Tatum misses. Rebound secured by Isaiah Smith.

[01:31] Team_073 possession (Score: 53-85)
FOUL! Holding foul on Blake Tatum. [IN THE BONUS! 8 team fouls] Isaiah Smith to the line for 2 free throws. (Blake Tatum: 1 personal fouls)   FT 1/2: MISS   FT 2/2: GOOD Isaiah Smith makes 1/2 from the line.
Score: 53-86

[01:14] Team_059 possession (Score: 53-86)
Blake Tatum drives, Bradley Morant stays with him. Blake Tatum attempts a Layup. Contested by Bradley Morant (4.2 feet, ZONE). BLAKE TATUM MAKES IT! Assist: Bam Wade
Score: 55-86

[00:58] Team_073 possession (Score: 55-86)
Carmelo Young attempts a 3Pt. Contested by Bam Wade (4.4 feet, MAN). CARMELO YOUNG MAKES IT! Assist: Bradley Morant
Score: 55-89

[00:42] Team_059 possession (Score: 55-89)
Jarrett Smith throws a bad pass out of bounds! TURNOVER! (dead ball)

[00:42] Substitution (Team_059): Bam Wade OUT → Russell Quickley IN (stamina_rule2)

[00:42] Substitution (Team_059): Blake Tatum OUT → Scottie Ginobili IN (stamina_rule2)

[00:42] Substitution (Team_059): Nikola Jokic OUT → Bones Middleton IN (stamina_rule2)

[00:42] Substitution (Team_059): Jarrett Smith OUT → LeBron Lowry IN (stamina_rule2)

[00:42] Substitution (Team_073): Carmelo Young OUT → Zach Quickley IN (stamina_rule2)

[00:42] Substitution (Team_073): Isaiah Smith OUT → Luka Butler IN (stamina_rule2)

[00:42] Substitution (Team_073): Karl Williamson OUT → Dwyane McCollum IN (stamina_rule2)

[00:42] Substitution (Team_073): Carmelo Porzingis OUT → Shai Thompson IN (stamina_rule2)

[00:42] Substitution (Team_073): Bradley Morant OUT → Ja Rose IN (stamina_rule2)

[00:31] Team_073 possession (Score: 55-89)
Ja Rose attempts a Midrange. Contested by LeBron Lowry (4.8 feet, MAN). Ja Rose misses. Rebound secured by Scottie Ginobili.

[00:19] Team_059 possession (Score: 55-89)
FOUL! Reach-in foul on Shai Thompson during the drive. [IN THE BONUS! 5 team fouls] Scottie Ginobili to the line for 2 free throws. (Shai Thompson: 1 personal fouls)   FT 1/2: MISS   FT 2/2: GOOD Scottie Ginobili makes 1/2 from the line.
Score: 56-89

[00:07] Team_073 possession (Score: 56-89)
Dwyane McCollum drives, picks up Allen Giddey. Help arrives from Scottie Ginobili! Dwyane McCollum attempts a Dunk. Wide open! Scottie Ginobili is 6.7 feet away. [MAN] DWYANE MCCOLLUM MAKES IT! Assist: Shai Thompson
Score: 56-91

================================================================================
                              3RD QUARTER COMPLETE                              
================================================================================

3RD QUARTER SCORE: Team_059 11, Team_073 29

BOX SCORE:
================================================================================

Team_059
--------------------------------------------------------------------------------
Player                MIN  PTS  REB  AST  TO      FG   FG%      3P   3P%
--------------------------------------------------------------------------------
Nikola Jokic           28    5    0    0   0   2/5    40.0     0/0   0.0
John Iverson           21    3    1    0   0   1/2    50.0     0/0   0.0
Blake Tatum            28    2    0    0   0   1/5    20.0     0/0   0.0
Scottie Ginobili        8    1    1    0   0   1/1   100.0     0/0   0.0
Bam Wade               28    0    2    3   0   0/3     0.0     0/0   0.0
Jarrett Smith          28    0    4    0   0   0/1     0.0     0/0   0.0

TEAM: FG: 5/17 (29.4%), 3PT: 1/6 (16.7%), REB: 8 (1 off, 7 def), AST: 3, TO: 5
TEAM FOULS: 8 [Team_073 in BONUS]


Team_073
--------------------------------------------------------------------------------
Player                MIN  PTS  REB  AST  TO      FG   FG%      3P   3P%
--------------------------------------------------------------------------------
Carmelo Young          28   10    0    2   0   4/6    66.7     0/0   0.0
Bradley Morant         28    8    5    2   0   4/4   100.0     0/0   0.0
Carmelo Porzingis      28    4    6    1   0   2/4    50.0     0/0   0.0
Karl Williamson        28    4    0    0   0   2/3    66.7     0/0   0.0
Dwyane McCollum         8    2    0    0   0   1/1   100.0     0/0   0.0
Isaiah Smith           28    1    5    0   0   1/2    50.0     0/0   0.0
Ja Rose                 8    0    0    0   0   0/1     0.0     0/0   0.0
Shai Thompson           8    0    0    1   0   0/0     0.0     0/0   0.0

TEAM: FG: 14/21 (66.7%), 3PT: 2/5 (40.0%), REB: 16 (4 off, 12 def), AST: 6, TO: 1
TEAM FOULS: 5 [Team_059 in BONUS]

================================================================================

================================================================================
                       4TH QUARTER - Team_059 vs Team_073                       
================================================================================

[12:00] Substitution (Team_059): Bam Wade OUT (stamina: 72) → Russell Quickley IN (comeback_detected)

[12:00] Substitution (Team_073): Carmelo Young OUT (stamina: 71) → Zach Quickley IN (comeback_detected)

[12:00] Team_059 possession (Score: 56-91)
Jarrett Smith attempts a Midrange. Contested by Karl Williamson (3.6 feet, ZONE). Jarrett Smith misses. Offensive rebound by John Iverson! John Iverson kicks it out.

[11:48] Team_059 possession (Score: 56-91)
Blake Tatum loses the ball! Stripped by Isaiah Smith! TURNOVER! (live ball)

[11:33] Team_073 possession (Score: 56-91)
Karl Williamson makes the Layup and draws the foul on Blake Tatum! And-1! Karl Williamson to the line for 1. [Team fouls: 1] (Blake Tatum: 1 personal fouls)   FT 1/1: GOOD Karl Williamson makes 1/1 from the line.
Score: 56-94

[11:19] Team_059 possession (Score: 56-94)
John Iverson loses the ball! Stripped by Karl Williamson! TURNOVER! (live ball)

[11:03] Team_073 possession (Score: 56-94)
Isaiah Smith drives, Blake Tatum stays with him. Isaiah Smith attempts a Dunk. Contested by Blake Tatum (4.7 feet, MAN). ISAIAH SMITH MAKES IT! Assist: Carmelo Porzingis
Score: 56-96

[10:54] Team_059 possession (Score: 56-96)
John Iverson attempts a 3Pt. Contested by Karl Williamson (3.5 feet, MAN). JOHN IVERSON MAKES IT! Assist: Russell Quickley
Score: 59-96

[10:42] Team_073 possession (Score: 59-96)
Karl Williamson drives, picks up John Iverson. Help arrives from Blake Tatum! Karl Williamson attempts a Dunk. Contested by Blake Tatum (5.6 feet, MAN). KARL WILLIAMSON MAKES IT! Assist: Carmelo Porzingis
Score: 59-98

[10:33] Team_059 possession (Score: 59-98)
Jarrett Smith drives, picks up Bradley Morant. Help arrives from Isaiah Smith! Jarrett Smith attempts a Layup. Contested by Isaiah Smith (4.6 feet, MAN). Jarrett Smith misses. Rebound secured by Carmelo Porzingis.

[10:19] Team_073 possession (Score: 59-98)
Carmelo Porzingis attempts a 3Pt. Contested by Russell Quickley (4.5 feet, ZONE). Carmelo Porzingis misses. Rebound secured by Jarrett Smith.

[10:02] Team_059 possession (Score: 59-98)
Blake Tatum attempts a Midrange. Contested by Isaiah Smith (4.5 feet, ZONE). Blake Tatum misses. Rebound secured by Carmelo Porzingis.

[09:49] Team_073 possession (Score: 59-98)
Zach Quickley attempts a 3Pt. Contested by Russell Quickley (4.7 feet, ZONE). Zach Quickley misses. Rebound secured by Jarrett Smith.

[09:35] Team_059 possession (Score: 59-98)
Nikola Jokic attempts a Midrange. Contested by Carmelo Porzingis (4.3 feet, MAN). Nikola Jokic misses. Rebound secured by Isaiah Smith.

[09:21] Team_073 possession (Score: 59-98)
FOUL! Shooting foul on Blake Tatum. Isaiah Smith to the line for 2 free throws. [Team fouls: 2] (Blake Tatum: 2 personal fouls)   FT 1/2: GOOD   FT 2/2: MISS Isaiah Smith makes 1/2 from the line. Rebound secured by Nikola Jokic.
Score: 59-99

[09:06] Team_059 possession (Score: 59-99)
Russell Quickley attempts a 3Pt. Contested by Zach Quickley (4.8 feet, MAN). Russell Quickley misses. Rebound secured by Bradley Morant.

[08:54] Team_073 possession (Score: 59-99)
Zach Quickley attempts a 3Pt. Contested by Russell Quickley (4.7 feet, MAN). Zach Quickley misses. Rebound secured by Nikola Jokic.

[08:41] Team_059 possession (Score: 59-99)
FOUL! Shooting foul on Karl Williamson. John Iverson to the line for 2 free throws. [Team fouls: 1] (Karl Williamson: 1 personal fouls)   FT 1/2: GOOD   FT 2/2: GOOD John Iverson makes 2/2 from the line.
Score: 61-99

[08:26] Team_073 possession (Score: 61-99)
Carmelo Porzingis attempts a 3Pt. Contested by Nikola Jokic (6.0 feet, MAN). Carmelo Porzingis misses. Rebound secured by John Iverson.

[08:14] Team_059 possession (Score: 61-99)
FOUL! Shooting foul on Bradley Morant. Nikola Jokic to the line for 2 free throws. [Team fouls: 2] (Bradley Morant: 1 personal fouls)   FT 1/2: GOOD   FT 2/2: GOOD Nikola Jokic makes 2/2 from the line.
Score: 63-99

[08:02] Team_073 possession (Score: 63-99)
Isaiah Smith attempts a Midrange. Contested by Blake Tatum (5.1 feet, MAN). Isaiah Smith misses. Rebound secured by John Iverson.

[07:51] Team_059 possession (Score: 63-99)
Nikola Jokic attempts a 3Pt. Contested by Carmelo Porzingis (4.6 feet, MAN). Nikola Jokic misses. Rebound secured by Carmelo Porzingis.

[07:37] Team_073 possession (Score: 63-99)
Carmelo Porzingis attempts a Layup. Wide open! Nikola Jokic is 6.1 feet away. [MAN] Carmelo Porzingis misses. Offensive rebound by Bradley Morant! Bradley Morant kicks it out.

[07:24] Team_073 possession (Score: 63-99)
Bradley Morant attempts a 3Pt. Contested by Jarrett Smith (5.5 feet, MAN). Bradley Morant misses. Offensive rebound by Carmelo Porzingis! Carmelo Porzingis kicks it out.

[07:09] Team_073 possession (Score: 63-99)
FOUL! Reach-in foul on Jarrett Smith during the drive. [Team fouls: 3] No free throws, side out. (Jarrett Smith: 1 personal fouls)

[06:58] Team_073 possession (Score: 63-99)
Carmelo Porzingis attempts a 3Pt. Contested by Russell Quickley (4.4 feet, ZONE). Carmelo Porzingis misses. Rebound secured by Nikola Jokic.

[06:45] Team_059 possession (Score: 63-99)
Russell Quickley attempts a Layup. Contested by Bradley Morant (5.2 feet, ZONE). RUSSELL QUICKLEY MAKES IT! Assist: Nikola Jokic
Score: 65-99

[06:34] Team_073 possession (Score: 65-99)
Isaiah Smith attempts a 3Pt. Contested by Blake Tatum (5.3 feet, MAN). ISAIAH SMITH MAKES IT! Assist: Zach Quickley
Score: 65-102

[06:16] Team_059 possession (Score: 65-102)
Blake Tatum drives, Bradley Morant stays with him. Blake Tatum attempts a Layup. Contested by Bradley Morant (4.8 feet, ZONE). Blake Tatum misses. Offensive rebound by Jarrett Smith! Jarrett Smith kicks it out.

[06:05] Team_059 possession (Score: 65-102)
Jarrett Smith drives, picks up Bradley Morant. Help arrives from Zach Quickley! Jarrett Smith attempts a Layup. Contested by Zach Quickley (5.2 feet, MAN). Jarrett Smith misses. Rebound secured by Isaiah Smith.

[05:50] Team_073 possession (Score: 65-102)
Carmelo Porzingis drives and kicks out. Zach Quickley attempts a 3Pt. Contested by Russell Quickley (4.5 feet, MAN). Zach Quickley misses. FOUL! Loose ball foul on John Iverson during the rebound battle. [Team fouls: 4] No free throws, side out. (John Iverson: 1 personal fouls)

[05:39] Team_073 possession (Score: 65-102)
Zach Quickley attempts a 3Pt. Contested by Russell Quickley (4.8 feet, ZONE). ZACH QUICKLEY MAKES IT! Assist: Isaiah Smith
Score: 65-105

[05:22] Team_059 possession (Score: 65-105)
Nikola Jokic attempts a 3Pt. Contested by Zach Quickley (4.5 feet, ZONE). NIKOLA JOKIC MAKES IT! Assist: John Iverson
Score: 68-105

[05:07] Team_073 possession (Score: 68-105)
Bradley Morant attempts a 3Pt. Contested by Russell Quickley (4.7 feet, ZONE). BRADLEY MORANT MAKES IT! Assist: Isaiah Smith
Score: 68-108

[04:49] Team_059 possession (Score: 68-108)
FOUL! Reach-in foul on Bradley Morant during the drive. [Team fouls: 3] No free throws, side out. (Bradley Morant: 2 personal fouls)

[04:35] Team_059 possession (Score: 68-108)
Blake Tatum drives to the basket... Blake Tatum throws a bad pass out of bounds! TURNOVER! (dead ball)

[04:35] Substitution (Team_059): Blake Tatum OUT → Scottie Ginobili IN (stamina_rule2)

[04:35] Substitution (Team_059): John Iverson OUT → Allen Giddey IN (stamina_rule2)

[04:35] Substitution (Team_059): Nikola Jokic OUT → Bones Middleton IN (stamina_rule2)

[04:35] Substitution (Team_059): Jarrett Smith OUT → LeBron Lowry IN (stamina_rule2)

[04:35] Substitution (Team_073): Isaiah Smith OUT → Luka Butler IN (stamina_rule2)

[04:35] Substitution (Team_073): Karl Williamson OUT → Dwyane McCollum IN (stamina_rule2)

[04:35] Substitution (Team_073): Carmelo Porzingis OUT → Shai Thompson IN (stamina_rule2)

[04:35] Substitution (Team_073): Bradley Morant OUT → Ja Rose IN (stamina_rule2)

[04:20] Team_073 possession (Score: 68-108)
Shai Thompson attempts a 3Pt. Contested by Bones Middleton (4.7 feet, MAN). Shai Thompson misses. FOUL! Loose ball foul on Bones Middleton during the rebound battle. [IN THE BONUS! 5 team fouls] Ja Rose to the line for 2 free throws. (Bones Middleton: 1 personal fouls)   FT 1/2: GOOD   FT 2/2: MISS Ja Rose makes 1/2 from the line. FOUL! Loose ball foul on LeBron Lowry during the free throw rebound! [IN THE BONUS! 6 team fouls] Ja Rose to the line for 2 free throws. (LeBron Lowry: 1 personal fouls)   FT 1/2: GOOD   FT 2/2: MISS Ja Rose makes 1/2 from the line. Offensive rebound by Dwyane McCollum! Dwyane McCollum puts it back in!
Score: 68-112

[04:08] Team_059 possession (Score: 68-112)
Scottie Ginobili attempts a Layup. Contested by Shai Thompson (4.3 feet, ZONE). SCOTTIE GINOBILI MAKES IT! Assist: LeBron Lowry
Score: 70-112

[03:52] Team_073 possession (Score: 70-112)
Shai Thompson drives and kicks out. Dwyane McCollum attempts a Midrange. Contested by Bones Middleton (4.6 feet, ZONE). Dwyane McCollum misses. Offensive rebound by Ja Rose! Ja Rose kicks it out.

[03:39] Team_073 possession (Score: 70-112)
Luka Butler attempts a 3Pt. Contested by Scottie Ginobili (5.0 feet, MAN). LUKA BUTLER MAKES IT! Assist: Zach Quickley
Score: 70-115

[03:25] Team_059 possession (Score: 70-115)
Allen Giddey makes the 3Pt and draws the foul on Dwyane McCollum! And-1! Allen Giddey to the line for 1. [Team fouls: 4] (Dwyane McCollum: 1 personal fouls)   FT 1/1: GOOD Allen Giddey makes 1/1 from the line.
Score: 74-115

[03:10] Team_073 possession (Score: 74-115)
Luka Butler attempts a 3Pt. Contested by Scottie Ginobili (5.0 feet, MAN). Luka Butler misses. Offensive rebound by Dwyane McCollum! Dwyane McCollum puts it back in!
Score: 74-117

[03:00] Team_059 possession (Score: 74-117)
Allen Giddey attempts a Midrange. Contested by Dwyane McCollum (4.0 feet, MAN). Allen Giddey misses. FOUL! Loose ball foul on Dwyane McCollum during the rebound battle. [IN THE BONUS! 5 team fouls] Scottie Ginobili to the line for 2 free throws. (Dwyane McCollum: 2 personal fouls)   FT 1/2: GOOD   FT 2/2: GOOD Scottie Ginobili makes 2/2 from the line.
Score: 76-117

[02:43] Team_073 possession (Score: 76-117)
Luka Butler makes the 3Pt and draws the foul on Scottie Ginobili! And-1! Luka Butler to the line for 1. [BONUS: 7 team fouls] (Scottie Ginobili: 1 personal fouls)   FT 1/1: MISS Luka Butler makes 0/1 from the line. Rebound secured by Scottie Ginobili.
Score: 76-120

[02:29] Team_059 possession (Score: 76-120)
Russell Quickley attempts a 3Pt. Contested by Zach Quickley (5.0 feet, MAN). RUSSELL QUICKLEY MAKES IT! Assist: LeBron Lowry
Score: 79-120

[02:17] Team_073 possession (Score: 79-120)
FOUL! Shooting foul on Scottie Ginobili. Luka Butler to the line for 3 free throws. [BONUS: 8 team fouls] (Scottie Ginobili: 2 personal fouls)   FT 1/3: GOOD   FT 2/3: GOOD   FT 3/3: MISS Luka Butler makes 2/3 from the line. Rebound secured by LeBron Lowry.
Score: 79-122

[01:59] Team_059 possession (Score: 79-122)
Bones Middleton attempts a 3Pt. Contested by Luka Butler (4.8 feet, ZONE). BONES MIDDLETON MAKES IT! Assist: Russell Quickley
Score: 82-122

[01:46] Team_073 possession (Score: 82-122)
Ja Rose attempts a Layup. Contested by LeBron Lowry (4.8 feet, MAN). JA ROSE MAKES IT! Assist: Shai Thompson
Score: 82-124

[01:29] Team_059 possession (Score: 82-124)
Russell Quickley attempts a Layup. Contested by Shai Thompson (4.0 feet, ZONE). RUSSELL QUICKLEY MAKES IT! Assist: Allen Giddey
Score: 84-124

[01:15] Team_073 possession (Score: 84-124)
Zach Quickley attempts a 3Pt. Contested by Russell Quickley (5.3 feet, MAN). Zach Quickley misses. Rebound secured by Bones Middleton.

[00:58] Team_059 possession (Score: 84-124)
Russell Quickley drives and kicks out. Allen Giddey attempts a 3Pt. Contested by Dwyane McCollum (4.1 feet, MAN). ALLEN GIDDEY MAKES IT! Assist: LeBron Lowry
Score: 87-124

[00:42] Team_073 possession (Score: 87-124)
FOUL! Shooting foul on Scottie Ginobili. Luka Butler to the line for 2 free throws. [BONUS: 9 team fouls] (Scottie Ginobili: 3 personal fouls)   FT 1/2: GOOD   FT 2/2: GOOD Luka Butler makes 2/2 from the line.
Score: 87-126

[00:26] Team_059 possession (Score: 87-126)
LeBron Lowry makes the Midrange and draws the foul on Luka Butler! And-1! LeBron Lowry to the line for 1. [BONUS: 6 team fouls] (Luka Butler: 1 personal fouls)   FT 1/1: MISS LeBron Lowry makes 0/1 from the line. Rebound secured by Ja Rose.
Score: 89-126

[00:13] Team_073 possession (Score: 89-126)
FOUL! Shooting foul on Scottie Ginobili. Shai Thompson to the line for 3 free throws. [BONUS: 10 team fouls] (Scottie Ginobili: 4 personal fouls)   FT 1/3: GOOD   FT 2/3: MISS   FT 3/3: MISS Shai Thompson makes 1/3 from the line. Rebound secured by Bones Middleton.
Score: 89-127

================================================================================
                              4TH QUARTER COMPLETE                              
================================================================================

4TH QUARTER SCORE: Team_059 33, Team_073 36

BOX SCORE:
================================================================================

Team_059
--------------------------------------------------------------------------------
Player                MIN  PTS  REB  AST  TO      FG   FG%      3P   3P%
--------------------------------------------------------------------------------
Russell Quickley       20    7    0    2   0   3/4    75.0     0/0   0.0
Allen Giddey           19    7    0    1   0   2/2   100.0     0/0   0.0
John Iverson           29    5    3    1   0   2/2   100.0     0/0   0.0
Nikola Jokic           36    5    3    1   0   2/4    50.0     0/0   0.0
Scottie Ginobili       12    4    1    0   0   2/2   100.0     0/0   0.0
Bones Middleton        12    3    2    0   0   1/1   100.0     0/0   0.0
Jarrett Smith          36    0    3    0   0   0/2     0.0     0/0   0.0
Blake Tatum            36    0    0    0   0   0/1     0.0     0/0   0.0
LeBron Lowry           12    0    1    3   0   0/1     0.0     0/0   0.0

TEAM: FG: 12/19 (63.2%), 3PT: 5/7 (71.4%), REB: 13 (2 off, 11 def), AST: 8, TO: 3
TEAM FOULS: 10 [Team_073 in BONUS]


Team_073
--------------------------------------------------------------------------------
Player                MIN  PTS  REB  AST  TO      FG   FG%      3P   3P%
--------------------------------------------------------------------------------
Dwyane McCollum        12    6    2    0   0   2/2   100.0     0/0   0.0
Karl Williamson        36    5    0    0   0   2/2   100.0     0/0   0.0
Isaiah Smith           36    5    2    2   0   2/4    50.0     0/0   0.0
Luka Butler            12    5    0    0   0   2/4    50.0     0/0   0.0
Zach Quickley          20    3    0    2   0   1/4    25.0     0/0   0.0
Bradley Morant         36    3    3    0   0   1/1   100.0     0/0   0.0
Ja Rose                12    2    2    0   0   1/1   100.0     0/0   0.0
Carmelo Porzingis      36    0    4    2   0   0/3     0.0     0/0   0.0
Shai Thompson          12    0    0    1   0   0/1     0.0     0/0   0.0

TEAM: FG: 11/22 (50.0%), 3PT: 6/15 (40.0%), REB: 13 (6 off, 7 def), AST: 7, TO: 0
TEAM FOULS: 6 [Team_059 in BONUS]

================================================================================

================================================================================
                               FULL GAME COMPLETE                               
================================================================================

FINAL SCORE: Team_059 89, Team_073 127

SCORING BY QUARTER:
--------------------------------------------------------------------------------
Team                     Q1     Q2     Q3     Q4    FINAL
--------------------------------------------------------------------------------
Team_059                 21     24     11     33       89
Team_073                 31     31     29     36      127
--------------------------------------------------------------------------------

FULL GAME BOX SCORE:
================================================================================

Team_059
--------------------------------------------------------------------------------
Player                MIN  PTS  REB  AST  TO      FG   FG%      3P   3P%      FT STL BLK
--------------------------------------------------------------------------------
Blake Tatum            36    8    0    1   3   3/9    33.3   0/1     0.0   2/2     0   0
Nikola Jokic           36   13    4    1   0   5/13   38.5   2/5    40.0   3/3     0   0
Jarrett Smith          36    7   12    1   4   3/9    33.3   1/1   100.0   3/4     2   1
John Iverson           29   10    4    2   5   4/6    66.7   2/3    66.7   4/4     0   0
Bam Wade               28    6    6    3   2   2/11   18.2   1/7    14.3   1/1     1   1
Russell Quickley       20   10    0    4   0   5/8    62.5   2/4    50.0   0/0     0   0
Allen Giddey           19   10    0    1   0   4/6    66.7   2/4    50.0   2/2     0   0
Scottie Ginobili       12   16    5    0   0   6/7    85.7   1/2    50.0   5/7     1   0
Bones Middleton        12    5    3    2   1   2/3    66.7   1/2    50.0   0/0     0   0
LeBron Lowry           12    0    2    4   0   0/2     0.0   0/0     0.0   1/3     0   0

TEAM: FG: 34/74 (45.9%), 3PT: 12/29 (41.4%), REB: 36 (7 off, 29 def), AST: 19, TO: 15


Team_073
--------------------------------------------------------------------------------
Player                MIN  PTS  REB  AST  TO      FG   FG%      3P   3P%      FT STL BLK
--------------------------------------------------------------------------------
Isaiah Smith           36   10    9    4   2   4/7    57.1   1/2    50.0   2/4     1   1
Karl Williamson        36   13    0    3   1   7/9    77.8   0/0     0.0   1/1     1   0
Carmelo Porzingis      36   17   15    3   0   6/13   46.2   2/7    28.6   7/7     0   1
Bradley Morant         36   17   16    4   0   8/10   80.0   1/2    50.0   2/2     2   1
Carmelo Young          28   26    0    5   1  10/13   76.9   3/5    60.0   7/7     1   0
Zach Quickley          20    5    0    3   0   2/6    33.3   1/5    20.0   0/0     0   0
Luka Butler            12   10    0    2   1   5/7    71.4   3/5    60.0   4/6     0   0
Dwyane McCollum        12   13    6    0   0   3/6    50.0   0/3     0.0   1/1     0   0
Shai Thompson          12    5    2    3   0   3/5    60.0   1/2    50.0   2/4     1   0
Ja Rose                12    4    4    1   1   2/3    66.7   0/0     0.0   1/2     0   0

TEAM: FG: 52/81 (64.2%), 3PT: 12/31 (38.7%), REB: 52 (12 off, 40 def), AST: 28, TO: 6

================================================================================
