================================================================================
                        FULL GAME - Team_026 vs Team_096                        
================================================================================

================================================================================
                       1ST QUARTER - Team_026 vs Team_096                       
================================================================================

[12:00] Team_026 possession (Score: 0-0)
Wendell Gasol attempts a Midrange. Contested by Lamelo Quickley (4.3 feet, ZONE). WENDELL GASOL MAKES IT!
Score: 2-0

[11:46] Team_096 possession (Score: 2-0)
Lamelo Quickley attempts a 3Pt. Contested by Immanuel Hyland (3.5 feet, ZONE). Lamelo Quickley misses. Offensive rebound by Scottie Herro! Scottie Herro kicks it out.

[11:33] Team_096 possession (Score: 2-0)
Kyrie Adebayo drives and kicks out. Cole Griffin makes the Midrange and draws the foul on Klay Giddey! And-1! Cole Griffin to the line for 1. [Team fouls: 1] (Klay Giddey: 1 personal fouls)   FT 1/1: GOOD Cole Griffin makes 1/1 from the line.
Score: 2-3

[11:15] Team_026 possession (Score: 2-3)
FOUL! Reach-in foul on Kyrie Adebayo during the drive. [Team fouls: 1] No free throws, side out. (Kyrie Adebayo: 1 personal fouls)

[11:04] Team_026 possession (Score: 2-3)
FOUL! Holding foul on Kyrie Adebayo. [Team fouls: 2] No free throws, side out. (Kyrie Adebayo: 2 personal fouls)

[10:50] Team_026 possession (Score: 2-3)
Wendell Gasol attempts a Layup. Contested by Kyrie Adebayo (4.3 feet, ZONE). Wendell Gasol misses. Rebound secured by Cole Griffin.

[10:36] Team_096 possession (Score: 2-3)
FOUL! Reach-in foul on Kobe Booker during the drive. [Team fouls: 2] No free throws, side out. (Kobe Booker: 1 personal fouls)

[10:22] Team_096 possession (Score: 2-3)
Cole Griffin attempts a 3Pt. Contested by Klay Giddey (5.8 feet, MAN). Cole Griffin misses. Rebound secured by Kobe Booker.

[10:09] Team_026 possession (Score: 2-3)
Klay Giddey attempts a 3Pt. Contested by Scottie Herro (4.9 feet, ZONE). Klay Giddey misses. Offensive rebound by Shaquille Trent! Shaquille Trent kicks it out.

[09:53] Team_026 possession (Score: 2-3)
Klay Giddey attempts a Midrange. Contested by Cole Griffin (3.3 feet, MAN). Klay Giddey misses. Rebound secured by Cole Griffin.

[09:42] Team_096 possession (Score: 2-3)
Cole Griffin drives to the basket... Cole Griffin throws a bad pass out of bounds! TURNOVER! (dead ball)

[09:31] Team_026 possession (Score: 2-3)
Wendell Gasol drives, Terry Mobley stays with him. Wendell Gasol attempts a Dunk. Contested by Terry Mobley (4.9 feet, MAN). Wendell Gasol misses. Rebound secured by Kyrie Adebayo.

[09:16] Team_096 possession (Score: 2-3)
FOUL! Holding foul on Immanuel Hyland. [Team fouls: 3] No free throws, side out. (Immanuel Hyland: 1 personal fouls)

[09:01] Team_096 possession (Score: 2-3)
Kyrie Adebayo throws a bad pass! Stolen by Kobe Booker! TURNOVER! (live ball)

[08:46] Team_026 possession (Score: 2-3)
Wendell Gasol attempts a 3Pt. Contested by Cole Griffin (3.7 feet, ZONE). Wendell Gasol misses. Rebound secured by Scottie Herro.

[08:32] Team_096 possession (Score: 2-3)
FOUL! Shooting foul on Shaquille Trent. Scottie Herro to the line for 2 free throws. [Team fouls: 4] (Shaquille Trent: 1 personal fouls)   FT 1/2: GOOD   FT 2/2: GOOD Scottie Herro makes 2/2 from the line.
Score: 2-5

[08:18] Team_026 possession (Score: 2-5)
Klay Giddey attempts a 3Pt. Contested by Cole Griffin (3.3 feet, MAN). Klay Giddey misses. Rebound secured by Cole Griffin.

[08:02] Team_096 possession (Score: 2-5)
Kyrie Adebayo attempts a Layup. Contested by Kobe Booker (4.8 feet, ZONE). KYRIE ADEBAYO MAKES IT! Assist: Lamelo Quickley
Score: 2-7

[07:43] Team_026 possession (Score: 2-7)
Kobe Booker attempts a Midrange. Contested by Scottie Herro (5.2 feet, ZONE). Kobe Booker misses. Offensive rebound by Kobe Booker! Kobe Booker kicks it out.

[07:26] Team_026 possession (Score: 2-7)
FOUL! Holding foul on Kyrie Adebayo. [Team fouls: 3] No free throws, side out. (Kyrie Adebayo: 3 personal fouls)

[07:16] Team_026 possession (Score: 2-7)
Klay Giddey attempts a 3Pt. Contested by Cole Griffin (3.3 feet, MAN). Klay Giddey misses. Rebound secured by Scottie Herro.

[07:04] Team_096 possession (Score: 2-7)
FOUL! Holding foul on Shaquille Trent. [IN THE BONUS! 5 team fouls] Scottie Herro to the line for 2 free throws. (Shaquille Trent: 2 personal fouls)   FT 1/2: GOOD   FT 2/2: GOOD Scottie Herro makes 2/2 from the line.
Score: 2-9

[06:49] Team_026 possession (Score: 2-9)
Kobe Booker attempts a Midrange. Contested by Kyrie Adebayo (4.2 feet, MAN). Kobe Booker misses. Rebound secured by Cole Griffin.

[06:36] Team_096 possession (Score: 2-9)
Lamelo Quickley attempts a Midrange. Contested by Immanuel Hyland (3.5 feet, MAN). Lamelo Quickley misses. Rebound secured by Immanuel Hyland.

[06:23] Team_026 possession (Score: 2-9)
Shaquille Trent attempts a 3Pt. Contested by Scottie Herro (4.8 feet, MAN). Shaquille Trent misses. Rebound secured by Kyrie Adebayo.

[06:09] Team_096 possession (Score: 2-9)
Cole Griffin drives and kicks out. Lamelo Quickley attempts a 3Pt. Contested by Immanuel Hyland (4.0 feet, ZONE). Lamelo Quickley misses. Offensive rebound by Scottie Herro! Scottie Herro kicks it out.

[05:56] Team_096 possession (Score: 2-9)
Lamelo Quickley attempts a 3Pt. Contested by Immanuel Hyland (3.5 feet, ZONE). Lamelo Quickley misses. Offensive rebound by Kyrie Adebayo! Kyrie Adebayo's putback is no good. Offensive rebound by Scottie Herro! Scottie Herro kicks it out.

[05:42] Team_096 possession (Score: 2-9)
Scottie Herro drives to the basket... Scottie Herro throws a bad pass! Stolen by Shaquille Trent! TURNOVER! (live ball)

[05:25] Team_026 possession (Score: 2-9)
FOUL! Shooting foul on Lamelo Quickley. Klay Giddey to the line for 2 free throws. [Team fouls: 4] (Lamelo Quickley: 1 personal fouls)   FT 1/2: MISS   FT 2/2: GOOD Klay Giddey makes 1/2 from the line.
Score: 3-9

[05:10] Team_096 possession (Score: 3-9)
Terry Mobley drives, picks up Wendell Gasol. Help arrives from Immanuel Hyland! Terry Mobley attempts a Dunk. Contested by Immanuel Hyland (4.7 feet, MAN). TERRY MOBLEY MAKES IT! Assist: Kyrie Adebayo
Score: 3-11

[04:55] Team_026 possession (Score: 3-11)
Klay Giddey drives to the basket... FOUL! Offensive foul on Klay Giddey! Cole Griffin drew the charge! [Team fouls: 6] (Klay Giddey: 2 personal fouls) TURNOVER! (dead ball)

[04:38] Team_096 possession (Score: 3-11)
Kyrie Adebayo makes the Midrange and draws the foul on Kobe Booker! And-1! Kyrie Adebayo to the line for 1. [BONUS: 7 team fouls] (Kobe Booker: 2 personal fouls)   FT 1/1: GOOD Kyrie Adebayo makes 1/1 from the line.
Score: 3-14

[04:21] Team_026 possession (Score: 3-14)
Klay Giddey attempts a 3Pt. Contested by Cole Griffin (3.3 feet, MAN). Klay Giddey misses. Rebound secured by Cole Griffin.

[04:08] Team_096 possession (Score: 3-14)
Lamelo Quickley attempts a 3Pt. Contested by Immanuel Hyland (3.6 feet, ZONE). LAMELO QUICKLEY MAKES IT! Assist: Terry Mobley
Score: 3-17

[03:54] Team_026 possession (Score: 3-17)
Kobe Booker drives, Kyrie Adebayo stays with him. Kobe Booker attempts a Dunk. Contested by Kyrie Adebayo (4.3 feet, MAN). KOBE BOOKER MAKES IT! Assist: Klay Giddey
Score: 5-17

[03:37] Team_096 possession (Score: 5-17)
Lamelo Quickley attempts a Midrange. Contested by Immanuel Hyland (3.7 feet, MAN). Lamelo Quickley misses. Rebound secured by Immanuel Hyland.

[03:18] Team_026 possession (Score: 5-17)
Immanuel Hyland attempts a 3Pt. Contested by Cole Griffin (3.6 feet, ZONE). Immanuel Hyland misses. FOUL! Loose ball foul on Scottie Herro during the rebound battle. [IN THE BONUS! 5 team fouls] Shaquille Trent to the line for 2 free throws. (Scottie Herro: 1 personal fouls)   FT 1/2: GOOD   FT 2/2: GOOD Shaquille Trent makes 2/2 from the line.
Score: 7-17

[03:07] Team_096 possession (Score: 7-17)
Terry Mobley drives, picks up Kobe Booker. Help arrives from Immanuel Hyland! Terry Mobley attempts a Layup. Contested by Immanuel Hyland (4.6 feet, ZONE). TERRY MOBLEY MAKES IT!
Score: 7-19

[02:53] Team_026 possession (Score: 7-19)
FOUL! Holding foul on Scottie Herro. [IN THE BONUS! 6 team fouls] Shaquille Trent to the line for 2 free throws. (Scottie Herro: 2 personal fouls)   FT 1/2: GOOD   FT 2/2: MISS Shaquille Trent makes 1/2 from the line. Rebound secured by Kyrie Adebayo.
Score: 8-19

[02:38] Team_096 possession (Score: 8-19)
Cole Griffin drives and kicks out. Terry Mobley makes the Midrange and draws the foul on Immanuel Hyland! And-1! Terry Mobley to the line for 1. [BONUS: 8 team fouls] (Immanuel Hyland: 2 personal fouls)   FT 1/1: GOOD Terry Mobley makes 1/1 from the line.
Score: 8-22

[02:24] Team_026 possession (Score: 8-22)
Klay Giddey drives, Cole Griffin stays with him. Klay Giddey attempts a Dunk. Contested by Cole Griffin (3.5 feet, MAN). Klay Giddey misses. Rebound secured by Kyrie Adebayo.

[02:13] Team_096 possession (Score: 8-22)
Lamelo Quickley makes the Layup and draws the foul on Kobe Booker! And-1! Lamelo Quickley to the line for 1. [BONUS: 9 team fouls] (Kobe Booker: 3 personal fouls)   FT 1/1: MISS Lamelo Quickley makes 0/1 from the line. Rebound secured by Kobe Booker.
Score: 8-24

[02:02] Team_026 possession (Score: 8-24)
FOUL! Shooting foul on Lamelo Quickley. Immanuel Hyland to the line for 3 free throws. [BONUS: 7 team fouls] (Lamelo Quickley: 2 personal fouls)   FT 1/3: MISS   FT 2/3: GOOD   FT 3/3: MISS Immanuel Hyland makes 1/3 from the line. Rebound secured by Kyrie Adebayo.
Score: 9-24

[01:50] Team_096 possession (Score: 9-24)
Lamelo Quickley drives to the basket... Lamelo Quickley commits a violation (traveling/carry)! TURNOVER! (dead ball)

[01:50] Substitution (Team_026): Wendell Gasol OUT → Myles Tatum IN (stamina_rule2)

[01:50] Substitution (Team_026): Immanuel Hyland OUT → Karl Barrett IN (stamina_rule2)

[01:50] Substitution (Team_026): Klay Giddey OUT → Josh Simons IN (stamina_rule2)

[01:50] Substitution (Team_026): Shaquille Trent OUT → Damian Doncic IN (stamina_rule2)

[01:50] Substitution (Team_026): Kobe Booker OUT → Dirk Randle IN (stamina_rule2)

[01:50] Substitution (Team_096): Terry Mobley OUT → Cade Jokic IN (stamina_rule2)

[01:50] Substitution (Team_096): Lamelo Quickley OUT → Jarrett Markkanen IN (stamina_rule2)

[01:50] Substitution (Team_096): Cole Griffin OUT → Cole Holiday IN (stamina_rule2)

[01:50] Substitution (Team_096): Scottie Herro OUT → Tyler Haliburton IN (stamina_rule2)

[01:50] Substitution (Team_096): Kyrie Adebayo OUT → Devin Griffin IN (stamina_rule2)

[01:37] Team_026 possession (Score: 9-24)
Josh Simons makes the Layup and draws the foul on Devin Griffin! And-1! Josh Simons to the line for 1. [BONUS: 8 team fouls] (Devin Griffin: 1 personal fouls)   FT 1/1: GOOD Josh Simons makes 1/1 from the line.
Score: 12-24

[01:20] Team_096 possession (Score: 12-24)
Jarrett Markkanen attempts a Midrange. Contested by Karl Barrett (4.4 feet, ZONE). JARRETT MARKKANEN MAKES IT! Assist: Devin Griffin
Score: 12-26

[01:06] Team_026 possession (Score: 12-26)
Karl Barrett loses control! Ball rolls out of bounds! TURNOVER! (dead ball)

[00:54] Team_096 possession (Score: 12-26)
Jarrett Markkanen drives, Damian Doncic stays with him. Jarrett Markkanen attempts a Layup. Contested by Damian Doncic (5.2 feet, ZONE). Jarrett Markkanen misses. Rebound secured by Karl Barrett.

[00:39] Team_026 possession (Score: 12-26)
Myles Tatum attempts a Midrange. Contested by Cade Jokic (5.2 feet, MAN). Myles Tatum misses. Rebound secured by Tyler Haliburton.

[00:21] Team_096 possession (Score: 12-26)
Cade Jokic drives, Damian Doncic stays with him. Cade Jokic attempts a Dunk. Contested by Damian Doncic (5.6 feet, ZONE). CADE JOKIC MAKES IT! Assist: Tyler Haliburton
Score: 12-28

[00:05] Team_026 possession (Score: 12-28)
FOUL! Holding foul on Cole Holiday. [IN THE BONUS! 9 team fouls] Josh Simons to the line for 2 free throws. (Cole Holiday: 1 personal fouls)   FT 1/2: GOOD   FT 2/2: GOOD Josh Simons makes 2/2 from the line.
Score: 14-28

================================================================================
                              1ST QUARTER COMPLETE                              
================================================================================

1ST QUARTER SCORE: Team_026 14, Team_096 28

BOX SCORE:
================================================================================

Team_026
--------------------------------------------------------------------------------
Player                MIN  PTS  REB  AST  TO      FG   FG%      3P   3P%
--------------------------------------------------------------------------------
Josh Simons             2    5    0    0   0   2/2   100.0     0/0   0.0
Wendell Gasol          10    2    0    0   0   1/4    25.0     0/0   0.0
Kobe Booker            10    2    3    0   0   1/2    50.0     0/0   0.0
Shaquille Trent        10    2    1    0   0   1/2    50.0     0/0   0.0
Klay Giddey            10    1    0    1   0   1/6    16.7     0/0   0.0
Immanuel Hyland        10    0    2    0   0   0/1     0.0     0/0   0.0
Karl Barrett            2    0    1    0   0   0/0     0.0     0/0   0.0
Myles Tatum             2    0    0    0   0   0/1     0.0     0/0   0.0

TEAM: FG: 6/19 (31.6%), 3PT: 1/7 (14.3%), REB: 7 (2 off, 5 def), AST: 1, TO: 2
TEAM FOULS: 9 [Team_096 in BONUS]


Team_096
--------------------------------------------------------------------------------
Player                MIN  PTS  REB  AST  TO      FG   FG%      3P   3P%
--------------------------------------------------------------------------------
Terry Mobley           10    7    0    1   0   3/3   100.0     0/0   0.0
Kyrie Adebayo          10    5    5    1   0   2/2   100.0     0/0   0.0
Scottie Herro          10    4    5    0   0   2/2   100.0     0/0   0.0
Cole Griffin           10    3    5    0   0   1/2    50.0     0/0   0.0
Lamelo Quickley        10    3    0    1   0   1/4    25.0     0/0   0.0
Jarrett Markkanen       2    2    0    0   0   1/2    50.0     0/0   0.0
Cade Jokic              2    2    0    0   0   1/1   100.0     0/0   0.0
Devin Griffin           2    0    0    1   0   0/0     0.0     0/0   0.0
Tyler Haliburton        2    0    1    1   0   0/0     0.0     0/0   0.0

TEAM: FG: 11/16 (68.8%), 3PT: 1/2 (50.0%), REB: 16 (3 off, 13 def), AST: 5, TO: 4
TEAM FOULS: 9 [Team_026 in BONUS]

================================================================================

================================================================================
                       2ND QUARTER - Team_026 vs Team_096                       
================================================================================

[12:00] Team_026 possession (Score: 14-28)
Wendell Gasol attempts a 3Pt. Contested by Cole Griffin (3.7 feet, ZONE). WENDELL GASOL MAKES IT! Assist: Kobe Booker
Score: 17-28

[11:41] Team_096 possession (Score: 17-28)
Cole Griffin attempts a 3Pt. Contested by Immanuel Hyland (4.4 feet, ZONE). Cole Griffin misses. Rebound secured by Immanuel Hyland.

[11:30] Team_026 possession (Score: 17-28)
Klay Giddey attempts a Layup. Contested by Cole Griffin (3.3 feet, MAN). KLAY GIDDEY MAKES IT! Assist: Kobe Booker
Score: 19-28

[11:19] Team_096 possession (Score: 19-28)
Cole Griffin drives to the basket... Cole Griffin throws a bad pass out of bounds! TURNOVER! (dead ball)

[11:08] Team_026 possession (Score: 19-28)
Shaquille Trent attempts a Layup. Contested by Kyrie Adebayo (3.9 feet, ZONE). Shaquille Trent misses. Rebound secured by Scottie Herro.

[10:55] Team_096 possession (Score: 19-28)
FOUL! Reach-in foul on Shaquille Trent during the drive. [Team fouls: 1] No free throws, side out. (Shaquille Trent: 1 personal fouls)

[10:38] Team_096 possession (Score: 19-28)
Cole Griffin attempts a 3Pt. Contested by Klay Giddey (5.9 feet, MAN). Cole Griffin misses. Rebound secured by Immanuel Hyland.

[10:21] Team_026 possession (Score: 19-28)
Klay Giddey attempts a 3Pt. Contested by Cole Griffin (3.4 feet, MAN). Klay Giddey misses. Rebound secured by Cole Griffin.

[10:12] Team_096 possession (Score: 19-28)
FOUL! Reach-in foul on Kobe Booker during the drive. [Team fouls: 2] No free throws, side out. (Kobe Booker: 1 personal fouls)

[09:58] Team_096 possession (Score: 19-28)
Cole Griffin attempts a 3Pt. Contested by Klay Giddey (6.0 feet, MAN). Cole Griffin misses. Rebound secured by Shaquille Trent.

[09:47] Team_026 possession (Score: 19-28)
FOUL! Holding foul on Terry Mobley. [Team fouls: 1] No free throws, side out. (Terry Mobley: 1 personal fouls)

[09:34] Team_026 possession (Score: 19-28)
FOUL! Shooting foul on Scottie Herro. Shaquille Trent to the line for 2 free throws. [Team fouls: 2] (Scottie Herro: 1 personal fouls)   FT 1/2: GOOD   FT 2/2: GOOD Shaquille Trent makes 2/2 from the line.
Score: 21-28

[09:21] Team_096 possession (Score: 21-28)
Scottie Herro drives, Kobe Booker stays with him. Scottie Herro attempts a Dunk. Contested by Kobe Booker (4.7 feet, ZONE). Scottie Herro misses. Rebound secured by Kobe Booker.

[09:04] Team_026 possession (Score: 21-28)
Kobe Booker attempts a Midrange. Contested by Kyrie Adebayo (4.5 feet, MAN). Kobe Booker misses. Offensive rebound by Shaquille Trent! Shaquille Trent kicks it out.

[08:54] Team_026 possession (Score: 21-28)
Wendell Gasol attempts a 3Pt. Contested by Terry Mobley (5.3 feet, MAN). Wendell Gasol misses. Rebound secured by Kyrie Adebayo.

[08:44] Team_096 possession (Score: 21-28)
Lamelo Quickley attempts a 3Pt. Contested by Immanuel Hyland (4.0 feet, ZONE). LAMELO QUICKLEY MAKES IT! Assist: Scottie Herro
Score: 21-31

[08:34] Team_026 possession (Score: 21-31)
Wendell Gasol attempts a Midrange. Contested by Lamelo Quickley (4.7 feet, ZONE). WENDELL GASOL MAKES IT! Assist: Klay Giddey
Score: 23-31

[08:22] Team_096 possession (Score: 23-31)
Scottie Herro drives to the basket... Scottie Herro commits a violation (traveling/carry)! TURNOVER! (dead ball)

[08:22] Substitution (Team_026): Wendell Gasol OUT → Myles Tatum IN (stamina_rule2)

[08:22] Substitution (Team_026): Immanuel Hyland OUT → Karl Barrett IN (stamina_rule2)

[08:22] Substitution (Team_026): Klay Giddey OUT → Josh Simons IN (stamina_rule2)

[08:22] Substitution (Team_026): Shaquille Trent OUT → Damian Doncic IN (stamina_rule2)

[08:22] Substitution (Team_026): Kobe Booker OUT → Dirk Randle IN (stamina_rule2)

[08:22] Substitution (Team_096): Terry Mobley OUT → Cade Jokic IN (stamina_rule2)

[08:22] Substitution (Team_096): Lamelo Quickley OUT → Jarrett Markkanen IN (stamina_rule2)

[08:22] Substitution (Team_096): Cole Griffin OUT → Cole Holiday IN (stamina_rule2)

[08:22] Substitution (Team_096): Scottie Herro OUT → Tyler Haliburton IN (stamina_rule2)

[08:22] Substitution (Team_096): Kyrie Adebayo OUT → Devin Griffin IN (stamina_rule2)

[08:04] Team_026 possession (Score: 23-31)
Karl Barrett attempts a 3Pt. Contested by Cade Jokic (5.4 feet, ZONE). Karl Barrett misses. Rebound secured by Jarrett Markkanen.

[07:52] Team_096 possession (Score: 23-31)
Cade Jokic attempts a Midrange. Contested by Myles Tatum (5.3 feet, MAN). CADE JOKIC MAKES IT!
Score: 23-33

[07:37] Team_026 possession (Score: 23-33)
Damian Doncic drives, picks up Tyler Haliburton. Help arrives from Jarrett Markkanen! Damian Doncic attempts a Dunk. Contested by Jarrett Markkanen (4.8 feet, MAN). Damian Doncic misses. Rebound secured by Tyler Haliburton.

[07:18] Team_096 possession (Score: 23-33)
Cole Holiday drives, Josh Simons stays with him. Cole Holiday attempts a Layup. Contested by Josh Simons (5.4 feet, MAN). Cole Holiday misses. Rebound secured by Josh Simons.

[07:01] Team_026 possession (Score: 23-33)
Dirk Randle throws a bad pass! Stolen by Devin Griffin! TURNOVER! (live ball)

[06:47] Team_096 possession (Score: 23-33)
Jarrett Markkanen attempts a 3Pt. Contested by Karl Barrett (4.4 feet, MAN). Jarrett Markkanen misses. Offensive rebound by Tyler Haliburton! Tyler Haliburton kicks it out.

[06:36] Team_096 possession (Score: 23-33)
Cade Jokic loses control! Ball rolls out of bounds! TURNOVER! (dead ball)

[06:21] Team_026 possession (Score: 23-33)
Karl Barrett attempts a Midrange. Contested by Tyler Haliburton (5.1 feet, ZONE). Karl Barrett misses. Rebound secured by Tyler Haliburton.

[06:08] Team_096 possession (Score: 23-33)
Tyler Haliburton attempts a 3Pt. Contested by Karl Barrett (4.7 feet, ZONE). Tyler Haliburton misses. Rebound secured by Karl Barrett.

[05:52] Team_026 possession (Score: 23-33)
Damian Doncic drives, picks up Tyler Haliburton. Help arrives from Jarrett Markkanen! Damian Doncic attempts a Layup. Contested by Jarrett Markkanen (4.8 feet, MAN). Damian Doncic misses. Rebound secured by Tyler Haliburton.

[05:36] Team_096 possession (Score: 23-33)
Cole Holiday attempts a 3Pt. Contested by Josh Simons (5.4 feet, ZONE). Cole Holiday misses. Rebound secured by Damian Doncic.

[05:26] Team_026 possession (Score: 23-33)
Dirk Randle attempts a Layup. Contested by Devin Griffin (5.0 feet, MAN). DIRK RANDLE MAKES IT!
Score: 25-33

[05:09] Team_096 possession (Score: 25-33)
FOUL! Holding foul on Karl Barrett. [Team fouls: 3] No free throws, side out. (Karl Barrett: 1 personal fouls)

[04:52] Team_096 possession (Score: 25-33)
Devin Griffin drives, picks up Dirk Randle. Help arrives from Karl Barrett! Devin Griffin attempts a Layup. Wide open! Karl Barrett is 6.2 feet away. [MAN] Devin Griffin misses. Rebound secured by Karl Barrett.

[04:40] Team_026 possession (Score: 25-33)
Damian Doncic attempts a 3Pt. Contested by Tyler Haliburton (4.8 feet, MAN). Damian Doncic misses. Rebound secured by Jarrett Markkanen.

[04:30] Team_096 possession (Score: 25-33)
FOUL! Reach-in foul on Myles Tatum during the drive. [Team fouls: 4] No free throws, side out. (Myles Tatum: 1 personal fouls)

[04:18] Team_096 possession (Score: 25-33)
FOUL! Shooting foul on Myles Tatum. Cade Jokic to the line for 3 free throws. [BONUS: 5 team fouls] (Myles Tatum: 2 personal fouls)   FT 1/3: GOOD   FT 2/3: GOOD   FT 3/3: GOOD Cade Jokic makes 3/3 from the line.
Score: 25-36

[04:04] Team_026 possession (Score: 25-36)
Karl Barrett drives, Jarrett Markkanen stays with him. Karl Barrett attempts a Layup. Contested by Jarrett Markkanen (4.3 feet, MAN). KARL BARRETT MAKES IT! Assist: Damian Doncic
Score: 27-36

[03:51] Team_096 possession (Score: 27-36)
Tyler Haliburton throws a bad pass out of bounds! TURNOVER! (dead ball)

[03:38] Team_026 possession (Score: 27-36)
Josh Simons commits a violation (traveling/carry)! TURNOVER! (dead ball)

[03:25] Team_096 possession (Score: 27-36)
Cade Jokic loses the ball! Stripped by Myles Tatum! TURNOVER! (live ball)

[03:13] Team_026 possession (Score: 27-36)
Myles Tatum attempts a 3Pt. Contested by Cade Jokic (5.2 feet, ZONE). Myles Tatum misses. Rebound secured by Devin Griffin.

[03:00] Team_096 possession (Score: 27-36)
Tyler Haliburton attempts a 3Pt. Contested by Karl Barrett (4.7 feet, ZONE). Tyler Haliburton misses. Rebound secured by Karl Barrett.

[02:41] Team_026 possession (Score: 27-36)
FOUL! Reach-in foul on Devin Griffin during the drive. [Team fouls: 3] No free throws, side out. (Devin Griffin: 1 personal fouls)

[02:31] Team_026 possession (Score: 27-36)
Damian Doncic attempts a 3Pt. Contested by Tyler Haliburton (4.8 feet, MAN). DAMIAN DONCIC MAKES IT! Assist: Karl Barrett
Score: 30-36

[02:14] Team_096 possession (Score: 30-36)
Devin Griffin drives to the basket... Devin Griffin commits a violation (traveling/carry)! TURNOVER! (dead ball)

[01:57] Team_026 possession (Score: 30-36)
Josh Simons attempts a 3Pt. Contested by Cole Holiday (4.5 feet, MAN). Josh Simons misses. Rebound secured by Tyler Haliburton.

[01:39] Team_096 possession (Score: 30-36)
Tyler Haliburton attempts a Layup. Contested by Damian Doncic (5.6 feet, ZONE). TYLER HALIBURTON MAKES IT! Assist: Devin Griffin
Score: 30-38

[01:25] Team_026 possession (Score: 30-38)
Dirk Randle attempts a Layup. Contested by Devin Griffin (5.1 feet, MAN). DIRK RANDLE MAKES IT!
Score: 32-38

[01:13] Team_096 possession (Score: 32-38)
Cade Jokic attempts a 3Pt. Contested by Karl Barrett (4.9 feet, ZONE). Cade Jokic misses. Rebound secured by Josh Simons.

[00:58] Team_026 possession (Score: 32-38)
Myles Tatum attempts a 3Pt. Contested by Cade Jokic (5.3 feet, MAN). MYLES TATUM MAKES IT! Assist: Josh Simons
Score: 35-38

[00:42] Team_096 possession (Score: 35-38)
Devin Griffin throws a bad pass out of bounds! TURNOVER! (dead ball)

[00:27] Team_026 possession (Score: 35-38)
Dirk Randle attempts a Layup. BLOCKED BY DEVIN GRIFFIN! Ball is loose! Rebound secured by Devin Griffin.

[00:15] Team_096 possession (Score: 35-38)
Cole Holiday attempts a 3Pt. Contested by Karl Barrett (5.2 feet, ZONE). Cole Holiday misses. Rebound secured by Karl Barrett.

================================================================================
                              2ND QUARTER COMPLETE                              
================================================================================

2ND QUARTER SCORE: Team_026 21, Team_096 10

BOX SCORE:
================================================================================

Team_026
--------------------------------------------------------------------------------
Player                MIN  PTS  REB  AST  TO      FG   FG%      3P   3P%
--------------------------------------------------------------------------------
Wendell Gasol          14    5    0    0   0   2/3    66.7     0/0   0.0
Dirk Randle            10    4    0    0   0   2/3    66.7     0/0   0.0
Damian Doncic          10    3    1    1   0   1/4    25.0     0/0   0.0
Myles Tatum            10    3    0    0   0   1/2    50.0     0/0   0.0
Klay Giddey            14    2    0    1   0   1/2    50.0     0/0   0.0
Shaquille Trent        14    2    2    0   0   1/2    50.0     0/0   0.0
Karl Barrett           10    2    4    1   0   1/3    33.3     0/0   0.0
Kobe Booker            14    0    1    2   0   0/0     0.0     0/0   0.0
Immanuel Hyland        14    0    2    0   0   0/0     0.0     0/0   0.0
Josh Simons            10    0    2    1   0   0/1     0.0     0/0   0.0

TEAM: FG: 9/20 (45.0%), 3PT: 3/9 (33.3%), REB: 12 (1 off, 11 def), AST: 6, TO: 2
TEAM FOULS: 5 [Team_096 in BONUS]


Team_096
--------------------------------------------------------------------------------
Player                MIN  PTS  REB  AST  TO      FG   FG%      3P   3P%
--------------------------------------------------------------------------------
Cade Jokic             10    5    0    0   0   2/3    66.7     0/0   0.0
Lamelo Quickley        14    3    0    0   0   1/1   100.0     0/0   0.0
Tyler Haliburton       10    2    5    0   0   1/3    33.3     0/0   0.0
Cole Griffin           14    0    1    0   0   0/3     0.0     0/0   0.0
Scottie Herro          14    0    1    1   0   0/1     0.0     0/0   0.0
Kyrie Adebayo          14    0    1    0   0   0/0     0.0     0/0   0.0
Jarrett Markkanen      10    0    2    0   0   0/0     0.0     0/0   0.0
Cole Holiday           10    0    0    0   0   0/3     0.0     0/0   0.0
Devin Griffin          10    0    2    1   0   0/1     0.0     0/0   0.0

TEAM: FG: 4/15 (26.7%), 3PT: 2/10 (20.0%), REB: 12 (1 off, 11 def), AST: 2, TO: 7
TEAM FOULS: 3

================================================================================

================================================================================
                       3RD QUARTER - Team_026 vs Team_096                       
================================================================================

[12:00] Team_026 possession (Score: 35-38)
Klay Giddey drives to the basket... Klay Giddey loses control! Ball rolls out of bounds! TURNOVER! (dead ball)

[11:42] Team_096 possession (Score: 35-38)
Kyrie Adebayo drives, Kobe Booker stays with him. Kyrie Adebayo attempts a Layup. Contested by Kobe Booker (4.8 feet, MAN). Kyrie Adebayo misses. Rebound secured by Shaquille Trent.

[11:30] Team_026 possession (Score: 35-38)
Immanuel Hyland drives and kicks out. FOUL! Shooting foul on Lamelo Quickley. Immanuel Hyland to the line for 2 free throws. [Team fouls: 1] (Lamelo Quickley: 1 personal fouls)   FT 1/2: GOOD   FT 2/2: GOOD Immanuel Hyland makes 2/2 from the line.
Score: 37-38

[11:17] Team_096 possession (Score: 37-38)
Cole Griffin drives to the basket... Cole Griffin throws a bad pass out of bounds! TURNOVER! (dead ball)

[11:07] Team_026 possession (Score: 37-38)
Kobe Booker attempts a Dunk. BLOCKED BY LAMELO QUICKLEY! Ball is loose! Rebound secured by Kyrie Adebayo.

[10:52] Team_096 possession (Score: 37-38)
FOUL! Shooting foul on Shaquille Trent. Scottie Herro to the line for 2 free throws. [Team fouls: 1] (Shaquille Trent: 1 personal fouls)   FT 1/2: GOOD   FT 2/2: MISS Scottie Herro makes 1/2 from the line. Rebound secured by Shaquille Trent.
Score: 37-39

[10:42] Team_026 possession (Score: 37-39)
FOUL! Shooting foul on Lamelo Quickley. Immanuel Hyland to the line for 2 free throws. [Team fouls: 2] (Lamelo Quickley: 2 personal fouls)   FT 1/2: GOOD   FT 2/2: GOOD Immanuel Hyland makes 2/2 from the line.
Score: 39-39

[10:24] Team_096 possession (Score: 39-39)
Lamelo Quickley commits a violation (traveling/carry)! TURNOVER! (dead ball)

[10:11] Team_026 possession (Score: 39-39)
Klay Giddey drives and kicks out. Immanuel Hyland attempts a 3Pt. Contested by Lamelo Quickley (3.9 feet, MAN). IMMANUEL HYLAND MAKES IT! Assist: Kobe Booker
Score: 42-39

[09:59] Team_096 possession (Score: 42-39)
Cole Griffin attempts a 3Pt. Contested by Immanuel Hyland (4.3 feet, ZONE). Cole Griffin misses. Rebound secured by Shaquille Trent.

[09:45] Team_026 possession (Score: 42-39)
Wendell Gasol attempts a 3Pt. Contested by Lamelo Quickley (4.3 feet, ZONE). WENDELL GASOL MAKES IT!
Score: 45-39

[09:31] Team_096 possession (Score: 45-39)
FOUL! Reach-in foul on Shaquille Trent during the drive. [Team fouls: 2] No free throws, side out. (Shaquille Trent: 2 personal fouls)

[09:14] Team_096 possession (Score: 45-39)
Lamelo Quickley attempts a Layup. Contested by Kobe Booker (3.7 feet, ZONE). LAMELO QUICKLEY MAKES IT! Assist: Cole Griffin
Score: 45-41

[08:58] Team_026 possession (Score: 45-41)
Klay Giddey drives to the basket... Klay Giddey loses the ball! Stripped by Kyrie Adebayo! TURNOVER! (live ball)

[08:44] Team_096 possession (Score: 45-41)
Terry Mobley drives, Kobe Booker stays with him. Terry Mobley attempts a Dunk. Contested by Kobe Booker (4.3 feet, ZONE). Terry Mobley misses. Rebound secured by Kobe Booker.

[08:30] Team_026 possession (Score: 45-41)
Klay Giddey makes the Layup and draws the foul on Kyrie Adebayo! And-1! Klay Giddey to the line for 1. [Team fouls: 3] (Kyrie Adebayo: 1 personal fouls)   FT 1/1: GOOD Klay Giddey makes 1/1 from the line.
Score: 48-41

[08:21] Team_096 possession (Score: 48-41)
Lamelo Quickley drives and kicks out. Lamelo Quickley attempts a Midrange. Contested by Immanuel Hyland (4.0 feet, MAN). Lamelo Quickley misses. Rebound secured by Shaquille Trent.

[08:05] Team_026 possession (Score: 48-41)
Kobe Booker drives and kicks out. FOUL! Shooting foul on Terry Mobley. Wendell Gasol to the line for 2 free throws. [Team fouls: 4] (Terry Mobley: 1 personal fouls)   FT 1/2: GOOD   FT 2/2: GOOD Wendell Gasol makes 2/2 from the line.
Score: 50-41

[07:50] Team_096 possession (Score: 50-41)
Scottie Herro drives and kicks out. Cole Griffin attempts a 3Pt. Contested by Klay Giddey (5.5 feet, MAN). COLE GRIFFIN MAKES IT! Assist: Scottie Herro
Score: 50-44

[07:36] Team_026 possession (Score: 50-44)
Immanuel Hyland attempts a 3Pt. Contested by Cole Griffin (3.5 feet, ZONE). Immanuel Hyland misses. Rebound secured by Scottie Herro.

[07:20] Team_096 possession (Score: 50-44)
Terry Mobley drives, Wendell Gasol stays with him. Terry Mobley attempts a Dunk. Contested by Wendell Gasol (4.7 feet, MAN). TERRY MOBLEY MAKES IT! Assist: Cole Griffin
Score: 50-46

[07:04] Team_026 possession (Score: 50-46)
Klay Giddey attempts a 3Pt. Contested by Cole Griffin (3.3 feet, MAN). KLAY GIDDEY MAKES IT! Assist: Shaquille Trent
Score: 53-46

[06:47] Team_096 possession (Score: 53-46)
Scottie Herro attempts a 3Pt. Contested by Shaquille Trent (5.7 feet, MAN). Scottie Herro misses. Rebound secured by Shaquille Trent.

[06:30] Team_026 possession (Score: 53-46)
FOUL! Reach-in foul on Kyrie Adebayo during the drive. [IN THE BONUS! 5 team fouls] Wendell Gasol to the line for 2 free throws. (Kyrie Adebayo: 2 personal fouls)   FT 1/2: GOOD   FT 2/2: GOOD Wendell Gasol makes 2/2 from the line.
Score: 55-46

[06:19] Team_096 possession (Score: 55-46)
Cole Griffin drives to the basket... Cole Griffin throws a bad pass! Stolen by Kobe Booker! TURNOVER! (live ball)

[06:08] Team_026 possession (Score: 55-46)
Shaquille Trent attempts a Layup. Contested by Scottie Herro (4.8 feet, MAN). SHAQUILLE TRENT MAKES IT! Assist: Wendell Gasol
Score: 57-46

[05:55] Team_096 possession (Score: 57-46)
Lamelo Quickley attempts a 3Pt. Contested by Immanuel Hyland (3.5 feet, ZONE). Lamelo Quickley misses. Rebound secured by Kobe Booker.

[05:42] Team_026 possession (Score: 57-46)
Shaquille Trent attempts a 3Pt. Contested by Cole Griffin (3.2 feet, ZONE). Shaquille Trent misses. Rebound secured by Scottie Herro.

[05:32] Team_096 possession (Score: 57-46)
Scottie Herro attempts a Layup. Contested by Shaquille Trent (5.7 feet, MAN). Scottie Herro misses. Rebound secured by Kobe Booker.

[05:22] Team_026 possession (Score: 57-46)
Klay Giddey attempts a 3Pt. Contested by Cole Griffin (3.3 feet, ZONE). Klay Giddey misses. Rebound secured by Kyrie Adebayo.

[05:10] Team_096 possession (Score: 57-46)
Scottie Herro attempts a 3Pt. Contested by Shaquille Trent (5.8 feet, MAN). SCOTTIE HERRO MAKES IT! Assist: Kyrie Adebayo
Score: 57-49

[04:57] Team_026 possession (Score: 57-49)
Shaquille Trent attempts a Layup. BLOCKED BY LAMELO QUICKLEY! Ball is loose! Offensive rebound by Shaquille Trent! Shaquille Trent kicks it out.

[04:44] Team_026 possession (Score: 57-49)
Kobe Booker attempts a Layup. Contested by Kyrie Adebayo (4.3 feet, MAN). KOBE BOOKER MAKES IT! Assist: Wendell Gasol
Score: 59-49

[04:33] Team_096 possession (Score: 59-49)
Cole Griffin attempts a 3Pt. Contested by Immanuel Hyland (4.4 feet, ZONE). Cole Griffin misses. Offensive rebound by Scottie Herro! Scottie Herro kicks it out.

[04:17] Team_096 possession (Score: 59-49)
Terry Mobley attempts a Midrange. Contested by Klay Giddey (5.7 feet, ZONE). TERRY MOBLEY MAKES IT!
Score: 59-51

[04:03] Team_026 possession (Score: 59-51)
Kobe Booker attempts a Midrange. Contested by Kyrie Adebayo (4.3 feet, MAN). KOBE BOOKER MAKES IT! Assist: Klay Giddey
Score: 61-51

[03:47] Team_096 possession (Score: 61-51)
Scottie Herro drives and kicks out. Terry Mobley attempts a Midrange. Contested by Shaquille Trent (5.8 feet, ZONE). Terry Mobley misses. Rebound secured by Immanuel Hyland.

[03:35] Team_026 possession (Score: 61-51)
Klay Giddey attempts a Midrange. Contested by Lamelo Quickley (4.1 feet, ZONE). Klay Giddey misses. Rebound secured by Kyrie Adebayo.

[03:22] Team_096 possession (Score: 61-51)
Lamelo Quickley attempts a 3Pt. Contested by Immanuel Hyland (3.8 feet, ZONE). Lamelo Quickley misses. Offensive rebound by Scottie Herro! Scottie Herro kicks it out.

[03:09] Team_096 possession (Score: 61-51)
Scottie Herro attempts a Layup. Contested by Kobe Booker (4.6 feet, ZONE). Scottie Herro misses. Rebound secured by Shaquille Trent.

[02:58] Team_026 possession (Score: 61-51)
Wendell Gasol drives and kicks out. Klay Giddey attempts a 3Pt. Contested by Cole Griffin (3.6 feet, ZONE). Klay Giddey misses. Offensive rebound by Kobe Booker! Kobe Booker kicks it out.

[02:45] Team_026 possession (Score: 61-51)
Immanuel Hyland drives, Lamelo Quickley stays with him. Immanuel Hyland attempts a Dunk. Contested by Lamelo Quickley (4.3 feet, MAN). IMMANUEL HYLAND MAKES IT!
Score: 63-51

[02:28] Team_096 possession (Score: 63-51)
Terry Mobley attempts a 3Pt. Contested by Wendell Gasol (5.0 feet, MAN). Terry Mobley misses. Rebound secured by Immanuel Hyland.

[02:16] Team_026 possession (Score: 63-51)
Wendell Gasol attempts a Layup. Contested by Terry Mobley (5.2 feet, MAN). Wendell Gasol misses. Rebound secured by Kyrie Adebayo.

[02:06] Team_096 possession (Score: 63-51)
FOUL! Shooting foul on Immanuel Hyland. Terry Mobley to the line for 3 free throws. [Team fouls: 3] (Immanuel Hyland: 1 personal fouls)   FT 1/3: GOOD   FT 2/3: GOOD   FT 3/3: GOOD Terry Mobley makes 3/3 from the line.
Score: 63-54

[01:53] Team_026 possession (Score: 63-54)
Shaquille Trent drives and kicks out. Immanuel Hyland attempts a 3Pt. Contested by Scottie Herro (5.4 feet, ZONE). IMMANUEL HYLAND MAKES IT!
Score: 66-54

[01:40] Team_096 possession (Score: 66-54)
Kyrie Adebayo drives to the basket... Kyrie Adebayo loses control! Ball rolls out of bounds! TURNOVER! (dead ball)

[01:40] Substitution (Team_026): Wendell Gasol OUT → Myles Tatum IN (stamina_rule2)

[01:40] Substitution (Team_026): Immanuel Hyland OUT → Karl Barrett IN (stamina_rule2)

[01:40] Substitution (Team_026): Klay Giddey OUT → Josh Simons IN (stamina_rule2)

[01:40] Substitution (Team_026): Shaquille Trent OUT → Damian Doncic IN (stamina_rule2)

[01:40] Substitution (Team_026): Kobe Booker OUT → Dirk Randle IN (stamina_rule2)

[01:40] Substitution (Team_096): Terry Mobley OUT → Cade Jokic IN (stamina_rule2)

[01:40] Substitution (Team_096): Lamelo Quickley OUT → Jarrett Markkanen IN (stamina_rule2)

[01:40] Substitution (Team_096): Cole Griffin OUT → Cole Holiday IN (stamina_rule2)

[01:40] Substitution (Team_096): Scottie Herro OUT → Tyler Haliburton IN (stamina_rule2)

[01:40] Substitution (Team_096): Kyrie Adebayo OUT → Devin Griffin IN (stamina_rule2)

[01:29] Team_026 possession (Score: 66-54)
Karl Barrett attempts a Midrange. Contested by Jarrett Markkanen (4.3 feet, MAN). Karl Barrett misses. Rebound secured by Devin Griffin.

[01:12] Team_096 possession (Score: 66-54)
FOUL! Shooting foul on Karl Barrett. Jarrett Markkanen to the line for 2 free throws. [Team fouls: 4] (Karl Barrett: 1 personal fouls)   FT 1/2: MISS   FT 2/2: GOOD Jarrett Markkanen makes 1/2 from the line.
Score: 66-55

[00:59] Team_026 possession (Score: 66-55)
Damian Doncic attempts a 3Pt. Contested by Cade Jokic (5.0 feet, ZONE). Damian Doncic misses. Rebound secured by Tyler Haliburton.

[00:45] Team_096 possession (Score: 66-55)
Devin Griffin attempts a Midrange. Wide open! Dirk Randle is 6.2 feet away. [MAN] DEVIN GRIFFIN MAKES IT! Assist: Jarrett Markkanen
Score: 66-57

[00:31] Team_026 possession (Score: 66-57)
Dirk Randle drives and kicks out. Karl Barrett attempts a Midrange. Contested by Jarrett Markkanen (4.2 feet, MAN). KARL BARRETT MAKES IT! Assist: Damian Doncic
Score: 68-57

[00:19] Team_096 possession (Score: 68-57)
Cole Holiday attempts a 3Pt. Contested by Josh Simons (5.4 feet, MAN). Cole Holiday misses. Rebound secured by Damian Doncic.

[00:03] Team_026 possession (Score: 68-57)
Karl Barrett attempts a 3Pt. Contested by Jarrett Markkanen (4.3 feet, MAN). Karl Barrett misses. Rebound secured by Devin Griffin.

================================================================================
                              3RD QUARTER COMPLETE                              
================================================================================

3RD QUARTER SCORE: Team_026 33, Team_096 19

BOX SCORE:
================================================================================

Team_026
--------------------------------------------------------------------------------
Player                MIN  PTS  REB  AST  TO      FG   FG%      3P   3P%
--------------------------------------------------------------------------------
Immanuel Hyland        25   12    2    0   0   5/6    83.3     0/0   0.0
Wendell Gasol          25    7    0    2   0   3/4    75.0     0/0   0.0
Klay Giddey            25    6    0    1   0   2/4    50.0     0/0   0.0
Kobe Booker            25    4    4    1   0   2/3    66.7     0/0   0.0
Shaquille Trent        25    2    7    1   0   1/2    50.0     0/0   0.0
Karl Barrett           12    2    0    0   0   1/3    33.3     0/0   0.0
Damian Doncic          12    0    1    1   0   0/1     0.0     0/0   0.0

TEAM: FG: 14/23 (60.9%), 3PT: 2/7 (28.6%), REB: 14 (2 off, 12 def), AST: 6, TO: 2
TEAM FOULS: 4


Team_096
--------------------------------------------------------------------------------
Player                MIN  PTS  REB  AST  TO      FG   FG%      3P   3P%
--------------------------------------------------------------------------------
Terry Mobley           25    7    0    0   0   3/5    60.0     0/0   0.0
Scottie Herro          25    3    4    1   0   1/6    16.7     0/0   0.0
Cole Griffin           25    3    0    2   0   1/2    50.0     0/0   0.0
Lamelo Quickley        25    2    0    0   0   1/3    33.3     0/0   0.0
Devin Griffin          12    2    2    0   0   1/1   100.0     0/0   0.0
Jarrett Markkanen      12    1    0    1   0   1/1   100.0     0/0   0.0
Kyrie Adebayo          25    0    4    1   0   0/1     0.0     0/0   0.0
Tyler Haliburton       12    0    1    0   0   0/0     0.0     0/0   0.0
Cole Holiday           12    0    0    0   0   0/1     0.0     0/0   0.0

TEAM: FG: 8/20 (40.0%), 3PT: 2/7 (28.6%), REB: 11 (2 off, 9 def), AST: 5, TO: 4
TEAM FOULS: 5 [Team_026 in BONUS]

================================================================================

================================================================================
                       4TH QUARTER - Team_026 vs Team_096                       
================================================================================

[12:00] Team_026 possession (Score: 68-57)
Klay Giddey attempts a 3Pt. Contested by Cole Griffin (3.3 feet, ZONE). Klay Giddey misses. Offensive rebound by Shaquille Trent! Shaquille Trent kicks it out.

[11:48] Team_026 possession (Score: 68-57)
Kobe Booker attempts a Layup. Contested by Kyrie Adebayo (4.3 feet, ZONE). KOBE BOOKER MAKES IT! Assist: Shaquille Trent
Score: 70-57

[11:35] Team_096 possession (Score: 70-57)
Kyrie Adebayo drives to the basket... Kyrie Adebayo throws a bad pass! Stolen by Shaquille Trent! TURNOVER! (live ball)

[11:24] Team_026 possession (Score: 70-57)
Wendell Gasol attempts a 3Pt. Contested by Terry Mobley (5.1 feet, MAN). Wendell Gasol misses. Rebound secured by Cole Griffin.

[11:09] Team_096 possession (Score: 70-57)
Terry Mobley drives, picks up Kobe Booker. Help arrives from Immanuel Hyland! Terry Mobley attempts a Dunk. Contested by Immanuel Hyland (4.6 feet, ZONE). TERRY MOBLEY MAKES IT! Assist: Cole Griffin
Score: 70-59

[10:51] Team_026 possession (Score: 70-59)
Klay Giddey attempts a 3Pt. Contested by Cole Griffin (3.4 feet, MAN). Klay Giddey misses. Rebound secured by Kyrie Adebayo.

[10:39] Team_096 possession (Score: 70-59)
Cole Griffin attempts a 3Pt. Contested by Immanuel Hyland (4.6 feet, ZONE). Cole Griffin misses. Rebound secured by Kobe Booker.

[10:25] Team_026 possession (Score: 70-59)
Kobe Booker makes the Midrange and draws the foul on Scottie Herro! And-1! Kobe Booker to the line for 1. [Team fouls: 1] (Scottie Herro: 1 personal fouls)   FT 1/1: GOOD Kobe Booker makes 1/1 from the line.
Score: 73-59

[10:12] Team_096 possession (Score: 73-59)
Terry Mobley attempts a 3Pt. Contested by Wendell Gasol (4.9 feet, MAN). TERRY MOBLEY MAKES IT! Assist: Lamelo Quickley
Score: 73-62

[09:57] Team_026 possession (Score: 73-62)
Shaquille Trent attempts a Midrange. Contested by Scottie Herro (5.1 feet, MAN). Shaquille Trent misses. Rebound secured by Scottie Herro.

[09:44] Team_096 possession (Score: 73-62)
Kyrie Adebayo drives, picks up Kobe Booker. Help arrives from Immanuel Hyland! Kyrie Adebayo attempts a Dunk. Contested by Immanuel Hyland (5.2 feet, MAN). KYRIE ADEBAYO MAKES IT!
Score: 73-64

[09:29] Team_026 possession (Score: 73-64)
FOUL! Shooting foul on Scottie Herro. Shaquille Trent to the line for 2 free throws. [Team fouls: 2] (Scottie Herro: 2 personal fouls)   FT 1/2: MISS   FT 2/2: GOOD Shaquille Trent makes 1/2 from the line.
Score: 74-64

[09:14] Team_096 possession (Score: 74-64)
Lamelo Quickley attempts a 3Pt. Contested by Immanuel Hyland (4.0 feet, MAN). LAMELO QUICKLEY MAKES IT! Assist: Kyrie Adebayo
Score: 74-67

[09:02] Team_026 possession (Score: 74-67)
Shaquille Trent throws a bad pass! Stolen by Scottie Herro! TURNOVER! (live ball)

[08:44] Team_096 possession (Score: 74-67)
Terry Mobley attempts a Midrange. Wide open! Shaquille Trent is 6.1 feet away. [ZONE] Terry Mobley misses. Rebound secured by Immanuel Hyland.

[08:33] Team_026 possession (Score: 74-67)
Klay Giddey attempts a 3Pt. Contested by Cole Griffin (3.7 feet, ZONE). Klay Giddey misses. Rebound secured by Kyrie Adebayo.

[08:16] Team_096 possession (Score: 74-67)
Terry Mobley drives to the basket... Terry Mobley throws a bad pass out of bounds! TURNOVER! (dead ball)

[08:16] Substitution (Team_026): Wendell Gasol OUT → Myles Tatum IN (stamina_rule2)

[08:16] Substitution (Team_026): Immanuel Hyland OUT → Karl Barrett IN (stamina_rule2)

[08:16] Substitution (Team_026): Klay Giddey OUT → Josh Simons IN (stamina_rule2)

[08:16] Substitution (Team_026): Shaquille Trent OUT → Damian Doncic IN (stamina_rule2)

[08:16] Substitution (Team_026): Kobe Booker OUT → Dirk Randle IN (stamina_rule2)

[08:16] Substitution (Team_096): Terry Mobley OUT → Cade Jokic IN (stamina_rule2)

[08:16] Substitution (Team_096): Lamelo Quickley OUT → Jarrett Markkanen IN (stamina_rule2)

[08:16] Substitution (Team_096): Cole Griffin OUT → Cole Holiday IN (stamina_rule2)

[08:16] Substitution (Team_096): Scottie Herro OUT → Tyler Haliburton IN (stamina_rule2)

[08:16] Substitution (Team_096): Kyrie Adebayo OUT → Devin Griffin IN (stamina_rule2)

[07:59] Team_026 possession (Score: 74-67)
FOUL! Shooting foul on Jarrett Markkanen. Josh Simons to the line for 2 free throws. [Team fouls: 3] (Jarrett Markkanen: 1 personal fouls)   FT 1/2: MISS   FT 2/2: GOOD Josh Simons makes 1/2 from the line.
Score: 75-67

[07:43] Team_096 possession (Score: 75-67)
Devin Griffin attempts a 3Pt. Wide open! Dirk Randle is 6.2 feet away. [MAN] Devin Griffin misses. Rebound secured by Karl Barrett.

[07:28] Team_026 possession (Score: 75-67)
Josh Simons drives and kicks out. Karl Barrett attempts a Midrange. Contested by Jarrett Markkanen (4.2 feet, MAN). KARL BARRETT MAKES IT! Assist: Myles Tatum
Score: 77-67

[07:11] Team_096 possession (Score: 77-67)
Tyler Haliburton drives, Damian Doncic stays with him. Tyler Haliburton attempts a Dunk. Contested by Damian Doncic (5.5 feet, ZONE). Tyler Haliburton misses. Rebound secured by Josh Simons.

[06:52] Team_026 possession (Score: 77-67)
FOUL! Holding foul on Devin Griffin. [Team fouls: 4] No free throws, side out. (Devin Griffin: 1 personal fouls)

[06:34] Team_026 possession (Score: 77-67)
Karl Barrett attempts a 3Pt. Contested by Cade Jokic (5.4 feet, ZONE). KARL BARRETT MAKES IT! Assist: Myles Tatum
Score: 80-67

[06:21] Team_096 possession (Score: 80-67)
FOUL! Holding foul on Dirk Randle. [Team fouls: 1] No free throws, side out. (Dirk Randle: 1 personal fouls)

[06:06] Team_096 possession (Score: 80-67)
Jarrett Markkanen attempts a 3Pt. Contested by Karl Barrett (4.4 feet, ZONE). Jarrett Markkanen misses. Offensive rebound by Devin Griffin! Devin Griffin kicks it out.

[05:52] Team_096 possession (Score: 80-67)
Devin Griffin attempts a Midrange. Wide open! Dirk Randle is 6.2 feet away. [MAN] Devin Griffin misses. Offensive rebound by Tyler Haliburton! Tyler Haliburton kicks it out.

[05:35] Team_096 possession (Score: 80-67)
Devin Griffin drives and kicks out. Cole Holiday attempts a 3Pt. Contested by Karl Barrett (4.7 feet, ZONE). COLE HOLIDAY MAKES IT! Assist: Jarrett Markkanen
Score: 80-70

[05:20] Team_026 possession (Score: 80-70)
FOUL! Holding foul on Devin Griffin. [IN THE BONUS! 5 team fouls] Dirk Randle to the line for 2 free throws. (Devin Griffin: 2 personal fouls)   FT 1/2: GOOD   FT 2/2: GOOD Dirk Randle makes 2/2 from the line.
Score: 82-70

[05:06] Team_096 possession (Score: 82-70)
Jarrett Markkanen attempts a 3Pt. Contested by Karl Barrett (4.4 feet, MAN). Jarrett Markkanen misses. Rebound secured by Damian Doncic.

[04:47] Team_026 possession (Score: 82-70)
Damian Doncic attempts a 3Pt. Contested by Cade Jokic (5.0 feet, ZONE). Damian Doncic misses. Rebound secured by Jarrett Markkanen.

[04:35] Team_096 possession (Score: 82-70)
Devin Griffin drives, picks up Damian Doncic. Help arrives from Karl Barrett! Devin Griffin attempts a Layup. Contested by Karl Barrett (5.6 feet, ZONE). DEVIN GRIFFIN MAKES IT! Assist: Cade Jokic
Score: 82-72

[04:17] Team_026 possession (Score: 82-72)
Damian Doncic attempts a Layup. Contested by Tyler Haliburton (4.8 feet, MAN). DAMIAN DONCIC MAKES IT! Assist: Myles Tatum
Score: 84-72

[04:03] Team_096 possession (Score: 84-72)
Cade Jokic attempts a 3Pt. Contested by Myles Tatum (5.3 feet, MAN). Cade Jokic misses. Rebound secured by Josh Simons.

[03:48] Team_026 possession (Score: 84-72)
Josh Simons attempts a 3Pt. Contested by Cade Jokic (5.2 feet, ZONE). Josh Simons misses. Rebound secured by Jarrett Markkanen.

[03:32] Team_096 possession (Score: 84-72)
Cade Jokic drives, Damian Doncic stays with him. Cade Jokic attempts a Layup. Contested by Damian Doncic (5.6 feet, ZONE). CADE JOKIC MAKES IT! Assist: Cole Holiday
Score: 84-74

[03:18] Team_026 possession (Score: 84-74)
Damian Doncic attempts a 3Pt. Contested by Tyler Haliburton (4.8 feet, ZONE). DAMIAN DONCIC MAKES IT! Assist: Myles Tatum
Score: 87-74

[03:05] Team_096 possession (Score: 87-74)
Cade Jokic attempts a 3Pt. Contested by Karl Barrett (4.8 feet, ZONE). Cade Jokic misses. Rebound secured by Josh Simons.

[02:53] Team_026 possession (Score: 87-74)
Damian Doncic attempts a 3Pt. Contested by Tyler Haliburton (4.8 feet, MAN). DAMIAN DONCIC MAKES IT! Assist: Karl Barrett
Score: 90-74

[02:36] Team_096 possession (Score: 90-74)
Tyler Haliburton commits a violation (traveling/carry)! TURNOVER! (dead ball)

[02:24] Team_026 possession (Score: 90-74)
FOUL! Shooting foul on Cole Holiday. Myles Tatum to the line for 2 free throws. [BONUS: 6 team fouls] (Cole Holiday: 1 personal fouls)   FT 1/2: MISS   FT 2/2: MISS Myles Tatum makes 0/2 from the line. Rebound secured by Tyler Haliburton.

[02:06] Team_096 possession (Score: 90-74)
Cade Jokic attempts a 3Pt. Contested by Myles Tatum (5.4 feet, MAN). Cade Jokic misses. Rebound secured by Karl Barrett.

[01:51] Team_026 possession (Score: 90-74)
Josh Simons attempts a 3Pt. Contested by Cole Holiday (4.4 feet, MAN). JOSH SIMONS MAKES IT! Assist: Dirk Randle
Score: 93-74

[01:38] Team_096 possession (Score: 93-74)
Cole Holiday attempts a Midrange. Contested by Josh Simons (5.4 feet, MAN). COLE HOLIDAY MAKES IT!
Score: 93-76

[01:19] Team_026 possession (Score: 93-76)
Karl Barrett attempts a 3Pt. Contested by Jarrett Markkanen (4.3 feet, MAN). Karl Barrett misses. Offensive rebound by Damian Doncic! Damian Doncic kicks it out.

[01:06] Team_026 possession (Score: 93-76)
Karl Barrett attempts a 3Pt. Contested by Jarrett Markkanen (4.4 feet, MAN). Karl Barrett misses. Rebound secured by Tyler Haliburton.

[00:50] Team_096 possession (Score: 93-76)
Cole Holiday attempts a 3Pt. Contested by Karl Barrett (5.1 feet, ZONE). Cole Holiday misses. Rebound secured by Damian Doncic.

[00:37] Team_026 possession (Score: 93-76)
Damian Doncic attempts a Midrange. Contested by Cole Holiday (4.4 feet, ZONE). DAMIAN DONCIC MAKES IT! Assist: Myles Tatum
Score: 95-76

[00:20] Team_096 possession (Score: 95-76)
Devin Griffin attempts a Midrange. Contested by Damian Doncic (5.8 feet, ZONE). Devin Griffin misses. Rebound secured by Damian Doncic.

[00:06] Team_026 possession (Score: 95-76)
Myles Tatum attempts a 3Pt. Contested by Cade Jokic (5.3 feet, ZONE). MYLES TATUM MAKES IT! Assist: Karl Barrett
Score: 98-76

================================================================================
                              4TH QUARTER COMPLETE                              
================================================================================

4TH QUARTER SCORE: Team_026 30, Team_096 19

BOX SCORE:
================================================================================

Team_026
--------------------------------------------------------------------------------
Player                MIN  PTS  REB  AST  TO      FG   FG%      3P   3P%
--------------------------------------------------------------------------------
Damian Doncic          20   10    4    0   0   4/5    80.0     0/0   0.0
Kobe Booker            29    5    1    0   0   2/2   100.0     0/0   0.0
Karl Barrett           20    5    2    2   0   2/3    66.7     0/0   0.0
Josh Simons            20    4    3    0   0   2/3    66.7     0/0   0.0
Myles Tatum            20    3    0    5   0   1/2    50.0     0/0   0.0
Dirk Randle            20    2    0    1   0   1/1   100.0     0/0   0.0
Shaquille Trent        29    1    1    1   0   1/2    50.0     0/0   0.0
Wendell Gasol          29    0    0    0   0   0/1     0.0     0/0   0.0
Klay Giddey            29    0    0    0   0   0/2     0.0     0/0   0.0
Immanuel Hyland        29    0    1    0   0   0/0     0.0     0/0   0.0

TEAM: FG: 13/21 (61.9%), 3PT: 5/11 (45.5%), REB: 12 (2 off, 10 def), AST: 9, TO: 1
TEAM FOULS: 1


Team_096
--------------------------------------------------------------------------------
Player                MIN  PTS  REB  AST  TO      FG   FG%      3P   3P%
--------------------------------------------------------------------------------
Terry Mobley           29    5    0    0   0   2/3    66.7     0/0   0.0
Cole Holiday           20    5    0    1   0   2/3    66.7     0/0   0.0
Lamelo Quickley        29    3    0    1   0   1/1   100.0     0/0   0.0
Kyrie Adebayo          29    2    2    1   0   1/1   100.0     0/0   0.0
Devin Griffin          20    2    1    0   0   1/3    33.3     0/0   0.0
Cade Jokic             20    2    0    1   0   1/4    25.0     0/0   0.0
Cole Griffin           29    0    1    1   0   0/1     0.0     0/0   0.0
Scottie Herro          29    0    1    0   0   0/0     0.0     0/0   0.0
Tyler Haliburton       20    0    3    0   0   0/1     0.0     0/0   0.0
Jarrett Markkanen      20    0    2    1   0   0/1     0.0     0/0   0.0

TEAM: FG: 8/18 (44.4%), 3PT: 2/9 (22.2%), REB: 10 (2 off, 8 def), AST: 6, TO: 3
TEAM FOULS: 6 [Team_026 in BONUS]

================================================================================

================================================================================
                               FULL GAME COMPLETE                               
================================================================================

FINAL SCORE: Team_026 98, Team_096 76

SCORING BY QUARTER:
--------------------------------------------------------------------------------
Team                     Q1     Q2     Q3     Q4    FINAL
--------------------------------------------------------------------------------
Team_026                 14     21     33     30       98
Team_096                 28     10     19     19       76
--------------------------------------------------------------------------------

FULL GAME BOX SCORE:
================================================================================

Team_026
--------------------------------------------------------------------------------
Player                MIN  PTS  REB  AST  TO      FG   FG%      3P   3P%      FT STL BLK
--------------------------------------------------------------------------------
Wendell Gasol          29   14    0    2   0   5/11   45.5   2/5    40.0   4/4     0   0
Immanuel Hyland        29   12    7    0   0   4/6    66.7   1/3    33.3   5/7     0   0
Klay Giddey            29    9    0    3   0   5/15   33.3   1/8    12.5   2/3     0   0
Shaquille Trent        29    7   11    2   3   4/8    50.0   0/2     0.0   6/8     2   0
Kobe Booker            29   11    9    3   1   6/8    75.0   0/0     0.0   1/1     2   0
Myles Tatum            20    6    0    5   0   2/5    40.0   2/3    66.7   0/2     1   0
Karl Barrett           20    9    7    3   1   2/7    28.6   1/4    25.0   0/0     0   0
Josh Simons            20    9    5    1   1   4/6    66.7   1/3    33.3   4/5     0   0
Damian Doncic          20   13    6    2   0   5/10   50.0   3/6    50.0   0/0     0   0
Dirk Randle            20    6    0    1   1   3/4    75.0   0/0     0.0   2/2     0   0

TEAM: FG: 42/83 (50.6%), 3PT: 11/34 (32.4%), REB: 45 (7 off, 38 def), AST: 22, TO: 7


Team_096
--------------------------------------------------------------------------------
Player                MIN  PTS  REB  AST  TO      FG   FG%      3P   3P%      FT STL BLK
--------------------------------------------------------------------------------
Terry Mobley           29   19    0    1   3   7/10   70.0   2/3    66.7   4/4     0   0
Lamelo Quickley        29   11    0    2   3   4/9    44.4   3/4    75.0   0/1     0   2
Cole Griffin           29    6    7    3   2   1/7    14.3   0/6     0.0   1/1     0   0
Scottie Herro          29    7   11    2   2   3/9    33.3   1/2    50.0   5/6     1   0
Kyrie Adebayo          29    7   12    3   2   4/5    80.0   0/0     0.0   1/1     1   0
Cade Jokic             20    9    0    1   3   4/8    50.0   1/5    20.0   3/3     0   0
Jarrett Markkanen      20    3    4    2   0   2/4    50.0   0/1     0.0   1/2     0   0
Cole Holiday           20    5    0    1   0   1/6    16.7   0/4     0.0   0/0     0   0
Tyler Haliburton       20    2   10    1   2   1/4    25.0   0/2     0.0   0/0     0   0
Devin Griffin          20    4    5    2   1   3/6    50.0   0/1     0.0   0/0     1   1

TEAM: FG: 31/69 (44.9%), 3PT: 7/28 (25.0%), REB: 49 (8 off, 41 def), AST: 18, TO: 18

================================================================================
