================================================================================
                        FULL GAME - Team_100 vs Team_003                        
================================================================================

================================================================================
                       1ST QUARTER - Team_100 vs Team_003                       
================================================================================

[12:00] Team_100 possession (Score: 0-0)
Pau LaVine attempts a Midrange. Contested by Rudy Haliburton (3.3 feet, ZONE). Pau LaVine misses. Offensive rebound by Chris Mobley! Chris Mobley kicks it out.

[11:46] Team_100 possession (Score: 0-0)
Chris Mobley attempts a Midrange. Contested by Nikola Bryant (4.3 feet, ZONE). Chris Mobley misses. Offensive rebound by Chris Mobley! Chris Mobley kicks it out.

[11:30] Team_100 possession (Score: 0-0)
Manu Ball attempts a 3Pt. Contested by Nikola Bryant (4.0 feet, MAN). Manu Ball misses. Rebound secured by Rudy Haliburton.

[11:13] Team_003 possession (Score: 0-0)
Victor O'Neal attempts a Layup. Contested by Pau LaVine (4.5 feet, ZONE). Victor O'Neal misses. Offensive rebound by Rudy Haliburton! Rudy Haliburton puts it back in!
Score: 0-2

[10:59] Team_100 possession (Score: 0-2)
FOUL! Shooting foul on Giannis Turner. Chris Mobley to the line for 2 free throws. [Team fouls: 1] (Giannis Turner: 1 personal fouls)   FT 1/2: GOOD   FT 2/2: GOOD Chris Mobley makes 2/2 from the line.
Score: 2-2

[10:47] Team_003 possession (Score: 2-2)
Giannis Turner attempts a Midrange. Contested by Luka Green (5.7 feet, ZONE). Giannis Turner misses. Rebound secured by Tyler Griffin.

[10:35] Team_100 possession (Score: 2-2)
Tyler Griffin drives, Rudy Haliburton stays with him. Tyler Griffin attempts a Layup. Contested by Rudy Haliburton (3.5 feet, MAN). Tyler Griffin misses. Rebound secured by Rudy Haliburton.

[10:20] Team_003 possession (Score: 2-2)
Nikola Bryant attempts a Midrange. Wide open! Manu Ball is 6.3 feet away. [MAN] NIKOLA BRYANT MAKES IT!
Score: 2-4

[10:09] Team_100 possession (Score: 2-4)
Manu Ball makes the Dunk and draws the foul on Rudy Haliburton! And-1! Manu Ball to the line for 1. [Team fouls: 2] (Rudy Haliburton: 1 personal fouls)   FT 1/1: GOOD Manu Ball makes 1/1 from the line.
Score: 5-4

[10:00] Team_003 possession (Score: 5-4)
Victor O'Neal attempts a Midrange. Contested by Chris Mobley (5.1 feet, MAN). VICTOR O'NEAL MAKES IT! Assist: Giannis Turner
Score: 5-6

[09:42] Team_100 possession (Score: 5-6)
Chris Mobley attempts a Layup. Contested by Giannis Turner (3.1 feet, MAN). CHRIS MOBLEY MAKES IT! Assist: Pau LaVine
Score: 7-6

[09:30] Team_003 possession (Score: 7-6)
Rudy Haliburton attempts a 3Pt. Contested by Tyler Griffin (4.8 feet, MAN). RUDY HALIBURTON MAKES IT! Assist: Nikola Bryant
Score: 7-9

[09:17] Team_100 possession (Score: 7-9)
Luka Green attempts a 3Pt. Contested by Nikola Bryant (4.2 feet, ZONE). LUKA GREEN MAKES IT! Assist: Pau LaVine
Score: 10-9

[09:03] Team_003 possession (Score: 10-9)
Victor O'Neal attempts a Midrange. Contested by Chris Mobley (5.1 feet, MAN). Victor O'Neal misses. FOUL! Loose ball foul on Tyler Griffin during the rebound battle. [Team fouls: 1] No free throws, side out. (Tyler Griffin: 1 personal fouls)

[08:45] Team_003 possession (Score: 10-9)
Rudy Haliburton attempts a 3Pt. Contested by Tyler Griffin (4.8 feet, MAN). Rudy Haliburton misses. Rebound secured by Pau LaVine.

[08:30] Team_100 possession (Score: 10-9)
Chris Mobley attempts a Layup. Contested by Giannis Turner (3.1 feet, ZONE). Chris Mobley misses. Rebound secured by Victor O'Neal.

[08:16] Team_003 possession (Score: 10-9)
Victor O'Neal attempts a Layup. Contested by Pau LaVine (4.5 feet, ZONE). VICTOR O'NEAL MAKES IT!
Score: 10-11

[07:58] Team_100 possession (Score: 10-11)
Luka Green attempts a 3Pt. Contested by Nikola Bryant (4.2 feet, ZONE). Luka Green misses. Rebound secured by Victor O'Neal.

[07:48] Team_003 possession (Score: 10-11)
Victor O'Neal makes the 3Pt and draws the foul on Luka Green! And-1! Victor O'Neal to the line for 1. [Team fouls: 2] (Luka Green: 1 personal fouls)   FT 1/1: MISS Victor O'Neal makes 0/1 from the line. Rebound secured by Pau LaVine.
Score: 10-14

[07:32] Team_100 possession (Score: 10-14)
Pau LaVine attempts a 3Pt. Contested by Giannis Turner (2.9 feet, ZONE). Pau LaVine misses. Rebound secured by Giannis Turner.

[07:18] Team_003 possession (Score: 10-14)
Nikola Bryant drives to the basket... Nikola Bryant throws a bad pass out of bounds! TURNOVER! (dead ball)

[07:04] Team_100 possession (Score: 10-14)
Chris Mobley attempts a Layup. BLOCKED BY GIANNIS TURNER! Ball is loose! Rebound secured by Victor O'Neal.

[06:48] Team_003 possession (Score: 10-14)
Nikola Bryant drives to the basket... Nikola Bryant loses the ball! Stripped by Pau LaVine! TURNOVER! (live ball)

[06:32] Team_100 possession (Score: 10-14)
Tyler Griffin attempts a 3Pt. Contested by Rudy Haliburton (3.5 feet, MAN). TYLER GRIFFIN MAKES IT! Assist: Manu Ball
Score: 13-14

[06:21] Team_003 possession (Score: 13-14)
FOUL! Reach-in foul on Chris Mobley during the drive. [Team fouls: 3] No free throws, side out. (Chris Mobley: 1 personal fouls)

[06:07] Team_003 possession (Score: 13-14)
Rudy Haliburton drives and kicks out. FOUL! Shooting foul on Pau LaVine. Giannis Turner to the line for 2 free throws. [Team fouls: 4] (Pau LaVine: 1 personal fouls)   FT 1/2: GOOD   FT 2/2: MISS Giannis Turner makes 1/2 from the line. Rebound secured by Pau LaVine.
Score: 13-15

[05:52] Team_100 possession (Score: 13-15)
Chris Mobley drives and kicks out. FOUL! Shooting foul on Rudy Haliburton. Tyler Griffin to the line for 3 free throws. [Team fouls: 3] (Rudy Haliburton: 2 personal fouls)   FT 1/3: GOOD   FT 2/3: GOOD   FT 3/3: GOOD Tyler Griffin makes 3/3 from the line.
Score: 16-15

[05:39] Team_003 possession (Score: 16-15)
Nikola Bryant attempts a Layup. Contested by Pau LaVine (4.8 feet, ZONE). Nikola Bryant misses. Rebound secured by Tyler Griffin.

[05:27] Team_100 possession (Score: 16-15)
Luka Green attempts a 3Pt. Contested by Giannis Turner (3.0 feet, ZONE). Luka Green misses. Offensive rebound by Chris Mobley! Chris Mobley kicks it out.

[05:13] Team_100 possession (Score: 16-15)
Pau LaVine attempts a Midrange. BLOCKED BY GIANNIS TURNER! Ball is loose! Offensive rebound by Chris Mobley! Chris Mobley kicks it out.

[05:00] Team_100 possession (Score: 16-15)
Luka Green attempts a Midrange. Contested by Ayo Jackson (5.5 feet, MAN). Luka Green misses. Offensive rebound by Pau LaVine! Pau LaVine kicks it out.

[04:48] Team_100 possession (Score: 16-15)
Luka Green attempts a Midrange. Contested by Ayo Jackson (5.5 feet, MAN). LUKA GREEN MAKES IT!
Score: 18-15

[04:33] Team_003 possession (Score: 18-15)
Ayo Jackson drives, Luka Green stays with him. Ayo Jackson attempts a Dunk. Contested by Luka Green (5.7 feet, MAN). Ayo Jackson misses. Rebound secured by Chris Mobley.

[04:22] Team_100 possession (Score: 18-15)
Chris Mobley drives, Giannis Turner stays with him. Chris Mobley attempts a Dunk. Contested by Giannis Turner (3.1 feet, MAN). Chris Mobley misses. Rebound secured by Rudy Haliburton.

[04:04] Team_003 possession (Score: 18-15)
Ayo Jackson attempts a 3Pt. Contested by Luka Green (5.7 feet, MAN). Ayo Jackson misses. Rebound secured by Pau LaVine.

[03:51] Team_100 possession (Score: 18-15)
Luka Green commits a violation (traveling/carry)! TURNOVER! (dead ball)

[03:51] Substitution (Team_100): Chris Mobley OUT → John Rozier IN (stamina_rule2)

[03:39] Team_003 possession (Score: 18-15)
Nikola Bryant attempts a Layup. BLOCKED BY JOHN ROZIER! Ball is loose! Offensive rebound by Rudy Haliburton! Rudy Haliburton kicks it out.

[03:28] Team_003 possession (Score: 18-15)
Giannis Turner attempts a Midrange. Wide open! Manu Ball is 6.5 feet away. [ZONE] GIANNIS TURNER MAKES IT!
Score: 18-17

[03:11] Team_100 possession (Score: 18-17)
Manu Ball attempts a 3Pt. Contested by Giannis Turner (3.0 feet, ZONE). Manu Ball misses. Rebound secured by Giannis Turner.

[02:53] Team_003 possession (Score: 18-17)
FOUL! Reach-in foul on John Rozier during the drive. [IN THE BONUS! 6 team fouls] Giannis Turner to the line for 2 free throws. (John Rozier: 2 personal fouls)   FT 1/2: GOOD   FT 2/2: GOOD Giannis Turner makes 2/2 from the line.
Score: 18-19

[02:38] Team_100 possession (Score: 18-19)
Luka Green throws a bad pass! Stolen by Ayo Jackson! TURNOVER! (live ball)

[02:20] Team_003 possession (Score: 18-19)
Rudy Haliburton drives to the basket... FOUL! Offensive foul on Rudy Haliburton! John Rozier drew the charge! [Team fouls: 4] (Rudy Haliburton: 3 personal fouls) TURNOVER! (dead ball)

[02:06] Team_100 possession (Score: 18-19)
Manu Ball attempts a Midrange. Contested by Nikola Bryant (4.3 feet, ZONE). Manu Ball misses. Rebound secured by Rudy Haliburton.

[01:53] Team_003 possession (Score: 18-19)
Rudy Haliburton drives, picks up John Rozier. Help arrives from Manu Ball! Rudy Haliburton attempts a Layup. Contested by Manu Ball (4.5 feet, ZONE). RUDY HALIBURTON MAKES IT! Assist: Ayo Jackson
Score: 18-21

[01:35] Team_100 possession (Score: 18-21)
Manu Ball attempts a Midrange. Contested by Nikola Bryant (4.3 feet, ZONE). Manu Ball misses. Rebound secured by Giannis Turner.

[01:20] Team_003 possession (Score: 18-21)
Nikola Bryant attempts a 3Pt. Wide open! Manu Ball is 6.6 feet away. [MAN] Nikola Bryant misses. Rebound secured by Pau LaVine.

[01:06] Team_100 possession (Score: 18-21)
Luka Green attempts a Layup. Contested by Giannis Turner (3.5 feet, ZONE). Luka Green misses. Offensive rebound by Pau LaVine! Pau LaVine kicks it out.

[00:53] Team_100 possession (Score: 18-21)
Tyler Griffin attempts a 3Pt. Contested by Rudy Haliburton (3.8 feet, MAN). Tyler Griffin misses. Rebound secured by Rudy Haliburton.

[00:41] Team_003 possession (Score: 18-21)
Giannis Turner drives, Pau LaVine stays with him. Giannis Turner attempts a Layup. Contested by Pau LaVine (5.3 feet, MAN). GIANNIS TURNER MAKES IT! Assist: Rudy Haliburton
Score: 18-23

[00:28] Team_100 possession (Score: 18-23)
Tyler Griffin attempts a 3Pt. Contested by Rudy Haliburton (3.9 feet, MAN). Tyler Griffin misses. Offensive rebound by Pau LaVine! Pau LaVine kicks it out.

[00:17] Team_100 possession (Score: 18-23)
Tyler Griffin loses control! Ball rolls out of bounds! TURNOVER! (dead ball)

[00:17] Substitution (Team_100): Luka Green OUT → Dirk Sabonis IN (stamina_rule2)

[00:17] Substitution (Team_100): Manu Ball OUT → Evan Butler IN (stamina_rule2)

[00:17] Substitution (Team_100): Tyler Griffin OUT → Tyrese Wade IN (stamina_rule2)

[00:17] Substitution (Team_100): Pau LaVine OUT → Carmelo Ginobili IN (stamina_rule2)

[00:17] Substitution (Team_003): Ayo Jackson OUT → Miles Towns IN (stamina_rule2)

[00:17] Substitution (Team_003): Nikola Bryant OUT → Pau Williamson IN (stamina_rule2)

[00:17] Substitution (Team_003): Rudy Haliburton OUT → Collin Mitchell IN (stamina_rule2)

[00:17] Substitution (Team_003): Giannis Turner OUT → Anfernee Jordan IN (stamina_rule2)

[00:17] Substitution (Team_003): Victor O'Neal OUT → Bam Gilgeous-Alexander IN (stamina_rule2)

[00:04] Team_003 possession (Score: 18-23)
Anfernee Jordan attempts a 3Pt. Contested by Carmelo Ginobili (5.1 feet, MAN). Anfernee Jordan misses. Rebound secured by Carmelo Ginobili.

================================================================================
                              1ST QUARTER COMPLETE                              
================================================================================

1ST QUARTER SCORE: Team_100 18, Team_003 23

BOX SCORE:
================================================================================

Team_100
--------------------------------------------------------------------------------
Player                MIN  PTS  REB  AST  TO      FG   FG%      3P   3P%
--------------------------------------------------------------------------------
Tyler Griffin          12    6    2    0   0   2/4    50.0     0/0   0.0
Luka Green             12    5    0    0   0   2/3    66.7     0/0   0.0
Chris Mobley            8    4    5    0   0   2/5    40.0     0/0   0.0
Manu Ball              12    3    0    1   0   1/5    20.0     0/0   0.0
Pau LaVine             12    0    8    2   0   0/1     0.0     0/0   0.0
Carmelo Ginobili        0    0    1    0   0   0/0     0.0     0/0   0.0

TEAM: FG: 7/18 (38.9%), 3PT: 2/7 (28.6%), REB: 16 (7 off, 9 def), AST: 3, TO: 3
TEAM FOULS: 6 [Team_003 in BONUS]


Team_003
--------------------------------------------------------------------------------
Player                MIN  PTS  REB  AST  TO      FG   FG%      3P   3P%
--------------------------------------------------------------------------------
Rudy Haliburton        12    7    8    1   0   3/5    60.0     0/0   0.0
Giannis Turner         12    6    3    1   0   3/4    75.0     0/0   0.0
Victor O'Neal          12    4    3    0   0   2/3    66.7     0/0   0.0
Nikola Bryant          12    2    0    1   0   1/3    33.3     0/0   0.0
Ayo Jackson            12    0    0    1   0   0/2     0.0     0/0   0.0
Anfernee Jordan         0    0    0    0   0   0/1     0.0     0/0   0.0

TEAM: FG: 9/18 (50.0%), 3PT: 1/6 (16.7%), REB: 14 (3 off, 11 def), AST: 4, TO: 3
TEAM FOULS: 4

================================================================================

================================================================================
                       2ND QUARTER - Team_100 vs Team_003                       
================================================================================

[12:00] Team_100 possession (Score: 18-23)
Pau LaVine attempts a Midrange. Contested by Nikola Bryant (4.3 feet, ZONE). Pau LaVine misses. Rebound secured by Giannis Turner.

[11:42] Team_003 possession (Score: 18-23)
FOUL! Reach-in foul on Pau LaVine during the drive. [Team fouls: 1] No free throws, side out. (Pau LaVine: 1 personal fouls)

[11:32] Team_003 possession (Score: 18-23)
Rudy Haliburton attempts a 3Pt. Contested by Luka Green (5.6 feet, ZONE). RUDY HALIBURTON MAKES IT! Assist: Ayo Jackson
Score: 18-26

[11:17] Team_100 possession (Score: 18-26)
Pau LaVine makes the Layup and draws the foul on Giannis Turner! And-1! Pau LaVine to the line for 1. [Team fouls: 1] (Giannis Turner: 1 personal fouls)   FT 1/1: GOOD Pau LaVine makes 1/1 from the line.
Score: 21-26

[11:04] Team_003 possession (Score: 21-26)
Giannis Turner attempts a Layup. Contested by Pau LaVine (5.2 feet, MAN). GIANNIS TURNER MAKES IT!
Score: 21-28

[10:47] Team_100 possession (Score: 21-28)
Chris Mobley attempts a Midrange. Contested by Giannis Turner (3.6 feet, MAN). Chris Mobley misses. Rebound secured by Victor O'Neal.

[10:34] Team_003 possession (Score: 21-28)
FOUL! Shooting foul on Manu Ball. Victor O'Neal to the line for 2 free throws. [Team fouls: 2] (Manu Ball: 1 personal fouls)   FT 1/2: GOOD   FT 2/2: GOOD Victor O'Neal makes 2/2 from the line.
Score: 21-30

[10:21] Team_100 possession (Score: 21-30)
Chris Mobley attempts a Midrange. Contested by Giannis Turner (3.7 feet, ZONE). CHRIS MOBLEY MAKES IT!
Score: 23-30

[10:06] Team_003 possession (Score: 23-30)
Nikola Bryant attempts a 3Pt. Contested by Luka Green (5.9 feet, ZONE). NIKOLA BRYANT MAKES IT! Assist: Rudy Haliburton
Score: 23-33

[09:53] Team_100 possession (Score: 23-33)
FOUL! Holding foul on Rudy Haliburton. [Team fouls: 2] No free throws, side out. (Rudy Haliburton: 1 personal fouls)

[09:41] Team_100 possession (Score: 23-33)
Manu Ball attempts a 3Pt. Contested by Giannis Turner (3.4 feet, ZONE). Manu Ball misses. Rebound secured by Giannis Turner.

[09:29] Team_003 possession (Score: 23-33)
Nikola Bryant drives, picks up Manu Ball. Help arrives from Tyler Griffin! Nikola Bryant attempts a Layup. Wide open! Tyler Griffin is 6.8 feet away. [MAN] NIKOLA BRYANT MAKES IT! Assist: Rudy Haliburton
Score: 23-35

[09:19] Team_100 possession (Score: 23-35)
FOUL! Shooting foul on Giannis Turner. Pau LaVine to the line for 2 free throws. [Team fouls: 3] (Giannis Turner: 2 personal fouls)   FT 1/2: GOOD   FT 2/2: GOOD Pau LaVine makes 2/2 from the line.
Score: 25-35

[09:04] Team_003 possession (Score: 25-35)
Rudy Haliburton attempts a 3Pt. Contested by Tyler Griffin (5.5 feet, MAN). Rudy Haliburton misses. Offensive rebound by Rudy Haliburton! Rudy Haliburton kicks it out.

[08:52] Team_003 possession (Score: 25-35)
Rudy Haliburton drives, picks up Pau LaVine. Help arrives from Manu Ball! Rudy Haliburton attempts a Layup. Contested by Manu Ball (5.3 feet, ZONE). RUDY HALIBURTON MAKES IT! Assist: Ayo Jackson
Score: 25-37

[08:35] Team_100 possession (Score: 25-37)
Pau LaVine drives to the basket... FOUL! Offensive foul on Pau LaVine! Giannis Turner drew the charge! [Team fouls: 3] (Pau LaVine: 2 personal fouls) TURNOVER! (dead ball)

[08:20] Team_003 possession (Score: 25-37)
Nikola Bryant attempts a Midrange. Wide open! Manu Ball is 6.9 feet away. [ZONE] NIKOLA BRYANT MAKES IT! Assist: Rudy Haliburton
Score: 25-39

[08:03] Team_100 possession (Score: 25-39)
Luka Green attempts a 3Pt. Wide open! Ayo Jackson is 6.2 feet away. [MAN] Luka Green misses. Rebound secured by Rudy Haliburton.

[07:52] Team_003 possession (Score: 25-39)
Giannis Turner attempts a Midrange. Wide open! Manu Ball is 6.9 feet away. [ZONE] Giannis Turner misses. Rebound secured by Chris Mobley.

[07:38] Team_100 possession (Score: 25-39)
Manu Ball makes the 3Pt and draws the foul on Nikola Bryant! And-1! Manu Ball to the line for 1. [Team fouls: 4] (Nikola Bryant: 1 personal fouls)   FT 1/1: GOOD Manu Ball makes 1/1 from the line.
Score: 29-39

[07:20] Team_003 possession (Score: 29-39)
Victor O'Neal attempts a Layup. Contested by Pau LaVine (5.4 feet, ZONE). VICTOR O'NEAL MAKES IT! Assist: Ayo Jackson
Score: 29-41

[07:08] Team_100 possession (Score: 29-41)
Manu Ball attempts a 3Pt. Contested by Nikola Bryant (4.9 feet, MAN). Manu Ball misses. Rebound secured by Rudy Haliburton.

[06:56] Team_003 possession (Score: 29-41)
Ayo Jackson makes the Layup and draws the foul on Chris Mobley! And-1! Ayo Jackson to the line for 1. [Team fouls: 4] (Chris Mobley: 1 personal fouls)   FT 1/1: GOOD Ayo Jackson makes 1/1 from the line.
Score: 29-44

[06:44] Team_100 possession (Score: 29-44)
FOUL! Shooting foul on Giannis Turner. Pau LaVine to the line for 2 free throws. [BONUS: 5 team fouls] (Giannis Turner: 3 personal fouls)   FT 1/2: GOOD   FT 2/2: GOOD Pau LaVine makes 2/2 from the line.
Score: 31-44

[06:34] Team_003 possession (Score: 31-44)
FOUL! Shooting foul on Pau LaVine. Giannis Turner to the line for 2 free throws. [BONUS: 5 team fouls] (Pau LaVine: 3 personal fouls)   FT 1/2: GOOD   FT 2/2: GOOD Giannis Turner makes 2/2 from the line.
Score: 31-46

[06:18] Team_100 possession (Score: 31-46)
Tyler Griffin attempts a 3Pt. Contested by Giannis Turner (4.2 feet, ZONE). Tyler Griffin misses. Rebound secured by Giannis Turner.

[06:03] Team_003 possession (Score: 31-46)
Rudy Haliburton drives, Pau LaVine stays with him. Rudy Haliburton attempts a Layup. Contested by Pau LaVine (5.7 feet, ZONE). Rudy Haliburton misses. Rebound secured by Tyler Griffin.

[05:51] Team_100 possession (Score: 31-46)
Pau LaVine attempts a Midrange. Contested by Giannis Turner (4.1 feet, MAN). PAU LAVINE MAKES IT! Assist: Manu Ball
Score: 33-46

[05:41] Team_003 possession (Score: 33-46)
FOUL! Holding foul on Chris Mobley. [IN THE BONUS! 6 team fouls] Victor O'Neal to the line for 2 free throws. (Chris Mobley: 2 personal fouls)   FT 1/2: GOOD   FT 2/2: GOOD Victor O'Neal makes 2/2 from the line.
Score: 33-48

[05:27] Team_100 possession (Score: 33-48)
Pau LaVine drives and kicks out. Tyler Griffin attempts a Midrange. Contested by Rudy Haliburton (4.6 feet, MAN). Tyler Griffin misses. Rebound secured by Victor O'Neal.

[05:16] Team_003 possession (Score: 33-48)
Victor O'Neal attempts a 3Pt. Wide open! Luka Green is 6.1 feet away. [ZONE] Victor O'Neal misses. Rebound secured by Chris Mobley.

[05:00] Team_100 possession (Score: 33-48)
Chris Mobley drives, Giannis Turner stays with him. Chris Mobley attempts a Dunk. Contested by Giannis Turner (4.5 feet, ZONE). Chris Mobley misses. Offensive rebound by Pau LaVine! Pau LaVine kicks it out.

[04:49] Team_100 possession (Score: 33-48)
Manu Ball attempts a 3Pt. Contested by Rudy Haliburton (4.5 feet, ZONE). Manu Ball misses. Offensive rebound by Chris Mobley! Chris Mobley kicks it out.

[04:34] Team_100 possession (Score: 33-48)
Chris Mobley drives, Victor O'Neal stays with him. Chris Mobley attempts a Layup. Contested by Victor O'Neal (5.8 feet, MAN). CHRIS MOBLEY MAKES IT! Assist: Pau LaVine
Score: 35-48

[04:23] Team_003 possession (Score: 35-48)
FOUL! Reach-in foul on Chris Mobley during the drive. [IN THE BONUS! 7 team fouls] Rudy Haliburton to the line for 2 free throws. (Chris Mobley: 3 personal fouls)   FT 1/2: GOOD   FT 2/2: GOOD Rudy Haliburton makes 2/2 from the line.
Score: 35-50

[04:11] Team_100 possession (Score: 35-50)
Tyler Griffin throws a bad pass! Stolen by Rudy Haliburton! TURNOVER! (live ball)

[03:58] Team_003 possession (Score: 35-50)
Ayo Jackson attempts a 3Pt. Wide open! Luka Green is 6.5 feet away. [ZONE] AYO JACKSON MAKES IT! Assist: Rudy Haliburton
Score: 35-53

[03:45] Team_100 possession (Score: 35-53)
Pau LaVine drives to the basket... Pau LaVine throws a bad pass out of bounds! TURNOVER! (dead ball)

[03:45] Substitution (Team_100): Luka Green OUT → Dirk Sabonis IN (stamina_rule2)

[03:45] Substitution (Team_100): Manu Ball OUT → Evan Butler IN (stamina_rule2)

[03:45] Substitution (Team_100): Tyler Griffin OUT → Tyrese Wade IN (stamina_rule2)

[03:45] Substitution (Team_100): Pau LaVine OUT → Carmelo Ginobili IN (stamina_rule2)

[03:45] Substitution (Team_100): Chris Mobley OUT → John Rozier IN (stamina_rule2)

[03:45] Substitution (Team_003): Ayo Jackson OUT → Miles Towns IN (stamina_rule2)

[03:45] Substitution (Team_003): Nikola Bryant OUT → Pau Williamson IN (stamina_rule2)

[03:45] Substitution (Team_003): Rudy Haliburton OUT → Collin Mitchell IN (stamina_rule2)

[03:45] Substitution (Team_003): Giannis Turner OUT → Anfernee Jordan IN (stamina_rule2)

[03:45] Substitution (Team_003): Victor O'Neal OUT → Bam Gilgeous-Alexander IN (stamina_rule2)

[03:31] Team_003 possession (Score: 35-53)
Miles Towns drives, Dirk Sabonis stays with him. Miles Towns attempts a Dunk. Contested by Dirk Sabonis (5.6 feet, MAN). MILES TOWNS MAKES IT! Assist: Bam Gilgeous-Alexander
Score: 35-55

[03:13] Team_100 possession (Score: 35-55)
FOUL! Shooting foul on Bam Gilgeous-Alexander. Dirk Sabonis to the line for 2 free throws. [BONUS: 6 team fouls] (Bam Gilgeous-Alexander: 1 personal fouls)   FT 1/2: GOOD   FT 2/2: GOOD Dirk Sabonis makes 2/2 from the line.
Score: 37-55

[03:01] Team_003 possession (Score: 37-55)
Anfernee Jordan drives, picks up John Rozier. Help arrives from Evan Butler! Anfernee Jordan attempts a Dunk. Contested by Evan Butler (4.4 feet, ZONE). Anfernee Jordan misses. Offensive rebound by Bam Gilgeous-Alexander! Bam Gilgeous-Alexander's putback is no good. Rebound secured by John Rozier.

[02:49] Team_100 possession (Score: 37-55)
Tyrese Wade drives to the basket... Tyrese Wade throws a bad pass out of bounds! TURNOVER! (dead ball)

[02:32] Team_003 possession (Score: 37-55)
Bam Gilgeous-Alexander makes the Dunk and draws the foul on Evan Butler! And-1! Bam Gilgeous-Alexander to the line for 1. [BONUS: 8 team fouls] (Evan Butler: 1 personal fouls)   FT 1/1: GOOD Bam Gilgeous-Alexander makes 1/1 from the line.
Score: 37-58

[02:16] Team_100 possession (Score: 37-58)
John Rozier attempts a Midrange. Contested by Pau Williamson (5.4 feet, ZONE). JOHN ROZIER MAKES IT! Assist: Dirk Sabonis
Score: 39-58

[02:02] Team_003 possession (Score: 39-58)
Pau Williamson attempts a 3Pt. Contested by Tyrese Wade (4.4 feet, ZONE). PAU WILLIAMSON MAKES IT! Assist: Anfernee Jordan
Score: 39-61

[01:48] Team_100 possession (Score: 39-61)
Dirk Sabonis attempts a 3Pt. Contested by Miles Towns (5.6 feet, ZONE). DIRK SABONIS MAKES IT!
Score: 42-61

[01:33] Team_003 possession (Score: 42-61)
Collin Mitchell attempts a Layup. Contested by Tyrese Wade (4.7 feet, MAN). Collin Mitchell misses. Rebound secured by Tyrese Wade.

[01:16] Team_100 possession (Score: 42-61)
Dirk Sabonis attempts a Midrange. Contested by Miles Towns (5.6 feet, MAN). DIRK SABONIS MAKES IT! Assist: Carmelo Ginobili
Score: 44-61

[01:00] Team_003 possession (Score: 44-61)
Anfernee Jordan attempts a 3Pt. Contested by Carmelo Ginobili (5.1 feet, MAN). ANFERNEE JORDAN MAKES IT! Assist: Collin Mitchell
Score: 44-64

[00:43] Team_100 possession (Score: 44-64)
Tyrese Wade attempts a Midrange. Contested by Collin Mitchell (3.6 feet, MAN). TYRESE WADE MAKES IT! Assist: Evan Butler
Score: 46-64

[00:24] Team_003 possession (Score: 46-64)
Anfernee Jordan attempts a Layup. Contested by Carmelo Ginobili (5.1 feet, MAN). Anfernee Jordan misses. Rebound secured by John Rozier.

[00:13] Team_100 possession (Score: 46-64)
Dirk Sabonis attempts a 3Pt. Contested by Miles Towns (5.6 feet, MAN). Dirk Sabonis misses. Rebound secured by Anfernee Jordan.

================================================================================
                              2ND QUARTER COMPLETE                              
================================================================================

2ND QUARTER SCORE: Team_100 28, Team_003 41

BOX SCORE:
================================================================================

Team_100
--------------------------------------------------------------------------------
Player                MIN  PTS  REB  AST  TO      FG   FG%      3P   3P%
--------------------------------------------------------------------------------
Pau LaVine             20    9    1    1   0   4/6    66.7     0/0   0.0
Dirk Sabonis            4    7    0    1   0   3/4    75.0     0/0   0.0
Chris Mobley           17    4    3    0   0   2/3    66.7     0/0   0.0
Manu Ball              20    4    0    1   0   1/3    33.3     0/0   0.0
John Rozier             7    2    2    0   0   1/1   100.0     0/0   0.0
Tyrese Wade             4    2    1    0   0   1/1   100.0     0/0   0.0
Luka Green             20    0    0    0   0   0/1     0.0     0/0   0.0
Tyler Griffin          20    0    1    0   0   0/1     0.0     0/0   0.0
Carmelo Ginobili        4    0    0    1   0   0/0     0.0     0/0   0.0
Evan Butler             4    0    0    1   0   0/0     0.0     0/0   0.0

TEAM: FG: 12/20 (60.0%), 3PT: 2/7 (28.6%), REB: 7 (2 off, 5 def), AST: 5, TO: 4
TEAM FOULS: 8 [Team_003 in BONUS]


Team_003
--------------------------------------------------------------------------------
Player                MIN  PTS  REB  AST  TO      FG   FG%      3P   3P%
--------------------------------------------------------------------------------
Rudy Haliburton        20    7    3    4   0   3/4    75.0     0/0   0.0
Nikola Bryant          20    7    0    0   0   3/3   100.0     0/0   0.0
Ayo Jackson            20    6    0    3   0   2/2   100.0     0/0   0.0
Victor O'Neal          20    6    2    0   0   3/4    75.0     0/0   0.0
Giannis Turner         20    4    3    0   0   2/3    66.7     0/0   0.0
Bam Gilgeous-Alexander    4    3    0    1   0   1/1   100.0     0/0   0.0
Anfernee Jordan         4    3    1    1   0   1/3    33.3     0/0   0.0
Pau Williamson          4    3    0    0   0   1/1   100.0     0/0   0.0
Miles Towns             4    2    0    0   0   1/1   100.0     0/0   0.0
Collin Mitchell         4    0    0    1   0   0/1     0.0     0/0   0.0

TEAM: FG: 17/23 (73.9%), 3PT: 5/6 (83.3%), REB: 10 (2 off, 8 def), AST: 10, TO: 0
TEAM FOULS: 6 [Team_100 in BONUS]

================================================================================

================================================================================
                       3RD QUARTER - Team_100 vs Team_003                       
================================================================================

[12:00] Team_100 possession (Score: 46-64)
Pau LaVine throws a bad pass out of bounds! TURNOVER! (dead ball)

[11:47] Team_003 possession (Score: 46-64)
Victor O'Neal attempts a 3Pt. Contested by Luka Green (5.3 feet, ZONE). Victor O'Neal misses. Rebound secured by Chris Mobley.

[11:32] Team_100 possession (Score: 46-64)
Pau LaVine makes the Layup and draws the foul on Giannis Turner! And-1! Pau LaVine to the line for 1. [Team fouls: 1] (Giannis Turner: 1 personal fouls)   FT 1/1: GOOD Pau LaVine makes 1/1 from the line.
Score: 49-64

[11:14] Team_003 possession (Score: 49-64)
Ayo Jackson attempts a Midrange. Wide open! Manu Ball is 6.3 feet away. [ZONE] Ayo Jackson misses. Offensive rebound by Rudy Haliburton! Rudy Haliburton puts it back in!
Score: 49-66

[10:56] Team_100 possession (Score: 49-66)
Luka Green attempts a 3Pt. Contested by Giannis Turner (3.0 feet, ZONE). Luka Green misses. Rebound secured by Giannis Turner.

[10:44] Team_003 possession (Score: 49-66)
Victor O'Neal attempts a 3Pt. Contested by Chris Mobley (5.1 feet, MAN). Victor O'Neal misses. Offensive rebound by Victor O'Neal! Victor O'Neal kicks it out.

[10:26] Team_003 possession (Score: 49-66)
Ayo Jackson attempts a 3Pt. Contested by Luka Green (5.7 feet, ZONE). AYO JACKSON MAKES IT! Assist: Nikola Bryant
Score: 49-69

[10:15] Team_100 possession (Score: 49-69)
Chris Mobley drives to the basket... Chris Mobley throws a bad pass out of bounds! TURNOVER! (dead ball)

[10:03] Team_003 possession (Score: 49-69)
Nikola Bryant drives to the basket... Nikola Bryant commits a violation (traveling/carry)! TURNOVER! (dead ball)

[09:43] Team_100 possession (Score: 49-69)
Manu Ball attempts a 3Pt. Contested by Giannis Turner (2.8 feet, ZONE). Manu Ball misses. Rebound secured by Victor O'Neal.

[09:29] Team_003 possession (Score: 49-69)
Giannis Turner attempts a Midrange. Wide open! Manu Ball is 6.3 feet away. [ZONE] Giannis Turner misses. Rebound secured by Tyler Griffin.

[09:14] Team_100 possession (Score: 49-69)
Manu Ball attempts a 3Pt. Contested by Nikola Bryant (4.0 feet, MAN). MANU BALL MAKES IT! Assist: Pau LaVine
Score: 52-69

[09:01] Team_003 possession (Score: 52-69)
Nikola Bryant makes the Layup and draws the foul on Pau LaVine! And-1! Nikola Bryant to the line for 1. [Team fouls: 1] (Pau LaVine: 1 personal fouls)   FT 1/1: GOOD Nikola Bryant makes 1/1 from the line.
Score: 52-72

[08:44] Team_100 possession (Score: 52-72)
Chris Mobley attempts a Midrange. Contested by Giannis Turner (3.1 feet, MAN). Chris Mobley misses. Rebound secured by Giannis Turner.

[08:26] Team_003 possession (Score: 52-72)
Ayo Jackson throws a bad pass! Stolen by Luka Green! TURNOVER! (live ball)

[08:12] Team_100 possession (Score: 52-72)
Pau LaVine attempts a 3Pt. Contested by Giannis Turner (2.9 feet, ZONE). Pau LaVine misses. Rebound secured by Victor O'Neal.

[08:02] Team_003 possession (Score: 52-72)
FOUL! Reach-in foul on Pau LaVine during the drive. [Team fouls: 2] No free throws, side out. (Pau LaVine: 2 personal fouls)

[07:50] Team_003 possession (Score: 52-72)
Nikola Bryant attempts a 3Pt. Contested by Luka Green (5.6 feet, ZONE). NIKOLA BRYANT MAKES IT! Assist: Victor O'Neal
Score: 52-75

[07:41] Team_100 possession (Score: 52-75)
Tyler Griffin attempts a Midrange. Contested by Rudy Haliburton (3.5 feet, MAN). Tyler Griffin misses. Rebound secured by Giannis Turner.

[07:23] Team_003 possession (Score: 52-75)
Giannis Turner attempts a Layup. Contested by Pau LaVine (4.8 feet, MAN). Giannis Turner misses. Rebound secured by Tyler Griffin.

[07:08] Team_100 possession (Score: 52-75)
Chris Mobley makes the Layup and draws the foul on Giannis Turner! And-1! Chris Mobley to the line for 1. [Team fouls: 2] (Giannis Turner: 2 personal fouls)   FT 1/1: MISS Chris Mobley makes 0/1 from the line. Rebound secured by Giannis Turner.
Score: 54-75

[06:50] Team_003 possession (Score: 54-75)
Rudy Haliburton attempts a Layup. Contested by Pau LaVine (4.6 feet, ZONE). RUDY HALIBURTON MAKES IT! Assist: Nikola Bryant
Score: 54-77

[06:37] Team_100 possession (Score: 54-77)
Luka Green attempts a Midrange. Contested by Rudy Haliburton (3.5 feet, ZONE). Luka Green misses. Offensive rebound by Chris Mobley! Chris Mobley kicks it out.

[06:23] Team_100 possession (Score: 54-77)
Manu Ball attempts a Midrange. Contested by Rudy Haliburton (3.3 feet, ZONE). Manu Ball misses. Rebound secured by Rudy Haliburton.

[06:08] Team_003 possession (Score: 54-77)
Nikola Bryant attempts a 3Pt. Contested by Tyler Griffin (5.0 feet, ZONE). Nikola Bryant misses. Rebound secured by Pau LaVine.

[05:54] Team_100 possession (Score: 54-77)
FOUL! Reach-in foul on Nikola Bryant during the drive. [Team fouls: 3] No free throws, side out. (Nikola Bryant: 1 personal fouls)

[05:34] Team_100 possession (Score: 54-77)
Luka Green attempts a 3Pt. Contested by Giannis Turner (3.0 feet, ZONE). Luka Green misses. Rebound secured by Rudy Haliburton.

[05:19] Team_003 possession (Score: 54-77)
FOUL! Reach-in foul on Chris Mobley during the drive. [Team fouls: 3] No free throws, side out. (Chris Mobley: 1 personal fouls)

[05:03] Team_003 possession (Score: 54-77)
FOUL! Shooting foul on Pau LaVine. Victor O'Neal to the line for 2 free throws. [Team fouls: 4] (Pau LaVine: 3 personal fouls)   FT 1/2: GOOD   FT 2/2: GOOD Victor O'Neal makes 2/2 from the line.
Score: 54-79

[04:50] Team_100 possession (Score: 54-79)
Manu Ball attempts a Midrange. Contested by Nikola Bryant (4.0 feet, MAN). Manu Ball misses. Rebound secured by Victor O'Neal.

[04:36] Team_003 possession (Score: 54-79)
Giannis Turner makes the Layup and draws the foul on Pau LaVine! And-1! Giannis Turner to the line for 1. [BONUS: 5 team fouls] (Pau LaVine: 4 personal fouls)   FT 1/1: GOOD Giannis Turner makes 1/1 from the line.
Score: 54-82

[04:22] Team_100 possession (Score: 54-82)
Tyler Griffin attempts a Layup. Contested by Giannis Turner (3.1 feet, ZONE). Tyler Griffin misses. Rebound secured by Giannis Turner.

[04:05] Team_003 possession (Score: 54-82)
Victor O'Neal makes the Layup and draws the foul on Pau LaVine! And-1! Victor O'Neal to the line for 1. [BONUS: 6 team fouls] (Pau LaVine: 5 personal fouls)   FT 1/1: GOOD Victor O'Neal makes 1/1 from the line.
Score: 54-85

[03:48] Team_100 possession (Score: 54-85)
FOUL! Shooting foul on Nikola Bryant. Manu Ball to the line for 2 free throws. [Team fouls: 4] (Nikola Bryant: 2 personal fouls)   FT 1/2: GOOD   FT 2/2: GOOD Manu Ball makes 2/2 from the line.
Score: 56-85

[03:34] Team_003 possession (Score: 56-85)
Ayo Jackson drives to the basket... Ayo Jackson throws a bad pass! Stolen by Pau LaVine! TURNOVER! (live ball)

[03:19] Team_100 possession (Score: 56-85)
Tyler Griffin attempts a Midrange. Contested by Rudy Haliburton (3.6 feet, MAN). Tyler Griffin misses. Rebound secured by Victor O'Neal.

[03:06] Team_003 possession (Score: 56-85)
Rudy Haliburton makes the Layup and draws the foul on Manu Ball! And-1! Rudy Haliburton to the line for 1. [BONUS: 7 team fouls] (Manu Ball: 1 personal fouls)   FT 1/1: GOOD Rudy Haliburton makes 1/1 from the line.
Score: 56-88

[02:49] Team_100 possession (Score: 56-88)
Chris Mobley attempts a Midrange. Contested by Giannis Turner (3.2 feet, MAN). Chris Mobley misses. Rebound secured by Giannis Turner.

[02:37] Team_003 possession (Score: 56-88)
Victor O'Neal attempts a Layup. BLOCKED BY CHRIS MOBLEY! Ball is loose! Rebound secured by Chris Mobley.

[02:23] Team_100 possession (Score: 56-88)
Luka Green attempts a 3Pt. Contested by Nikola Bryant (4.4 feet, ZONE). Luka Green misses. Rebound secured by Rudy Haliburton.

[02:07] Team_003 possession (Score: 56-88)
Ayo Jackson attempts a 3Pt. Contested by Luka Green (5.8 feet, ZONE). Ayo Jackson misses. Rebound secured by Chris Mobley.

[01:55] Team_100 possession (Score: 56-88)
Pau LaVine attempts a Layup. BLOCKED BY GIANNIS TURNER! Ball is loose! Offensive rebound by Pau LaVine! Pau LaVine kicks it out.

[01:41] Team_100 possession (Score: 56-88)
Luka Green drives, Ayo Jackson stays with him. Luka Green attempts a Layup. Contested by Ayo Jackson (5.7 feet, MAN). Luka Green misses. Rebound secured by Giannis Turner.

[01:27] Team_003 possession (Score: 56-88)
Victor O'Neal drives and kicks out. Giannis Turner attempts a 3Pt. Contested by Luka Green (5.6 feet, ZONE). Giannis Turner misses. Rebound secured by Chris Mobley.

[01:08] Team_100 possession (Score: 56-88)
Manu Ball attempts a 3Pt. Contested by Nikola Bryant (4.3 feet, MAN). Manu Ball misses. Rebound secured by Giannis Turner.

[00:53] Team_003 possession (Score: 56-88)
FOUL! Holding foul on Luka Green. [IN THE BONUS! 8 team fouls] Ayo Jackson to the line for 2 free throws. (Luka Green: 1 personal fouls)   FT 1/2: GOOD   FT 2/2: GOOD Ayo Jackson makes 2/2 from the line.
Score: 56-90

[00:40] Team_100 possession (Score: 56-90)
Manu Ball makes the Layup and draws the foul on Giannis Turner! And-1! Manu Ball to the line for 1. [BONUS: 6 team fouls] (Giannis Turner: 3 personal fouls)   FT 1/1: GOOD Manu Ball makes 1/1 from the line.
Score: 59-90

[00:22] Team_003 possession (Score: 59-90)
Victor O'Neal attempts a 3Pt. Contested by Luka Green (5.6 feet, ZONE). Victor O'Neal misses. Rebound secured by Pau LaVine.

[00:12] Team_100 possession (Score: 59-90)
FOUL! Reach-in foul on Rudy Haliburton during the drive. [IN THE BONUS! 7 team fouls] Tyler Griffin to the line for 2 free throws. (Rudy Haliburton: 2 personal fouls)   FT 1/2: GOOD   FT 2/2: MISS Tyler Griffin makes 1/2 from the line. Rebound secured by Rudy Haliburton.
Score: 60-90

================================================================================
                              3RD QUARTER COMPLETE                              
================================================================================

3RD QUARTER SCORE: Team_100 14, Team_003 26

BOX SCORE:
================================================================================

Team_100
--------------------------------------------------------------------------------
Player                MIN  PTS  REB  AST  TO      FG   FG%      3P   3P%
--------------------------------------------------------------------------------
Manu Ball              32    8    0    0   0   3/7    42.9     0/0   0.0
Pau LaVine             32    3    3    1   0   1/2    50.0     0/0   0.0
Chris Mobley           29    0    5    0   0   0/3     0.0     0/0   0.0
Luka Green             32    0    0    0   0   0/4     0.0     0/0   0.0
Tyler Griffin          32    0    2    0   0   0/4     0.0     0/0   0.0

TEAM: FG: 4/20 (20.0%), 3PT: 1/7 (14.3%), REB: 10 (2 off, 8 def), AST: 1, TO: 2
TEAM FOULS: 8 [Team_003 in BONUS]


Team_003
--------------------------------------------------------------------------------
Player                MIN  PTS  REB  AST  TO      FG   FG%      3P   3P%
--------------------------------------------------------------------------------
Rudy Haliburton        32    7    5    0   0   3/3   100.0     0/0   0.0
Nikola Bryant          32    6    0    2   0   2/3    66.7     0/0   0.0
Victor O'Neal          32    5    5    1   0   2/6    33.3     0/0   0.0
Ayo Jackson            32    5    0    0   0   2/3    66.7     0/0   0.0
Giannis Turner         32    3    8    0   0   1/3    33.3     0/0   0.0

TEAM: FG: 10/18 (55.6%), 3PT: 2/6 (33.3%), REB: 18 (2 off, 16 def), AST: 3, TO: 3
TEAM FOULS: 7 [Team_100 in BONUS]

================================================================================

================================================================================
                       4TH QUARTER - Team_100 vs Team_003                       
================================================================================

[12:00] Substitution (Team_100): Luka Green OUT (stamina: 72) → Dirk Sabonis IN (comeback_detected)

[12:00] Substitution (Team_003): Ayo Jackson OUT (stamina: 69) → Miles Towns IN (comeback_detected)

[12:00] Team_100 possession (Score: 60-90)
Dirk Sabonis attempts a 3Pt. Contested by Giannis Turner (3.4 feet, ZONE). Dirk Sabonis misses. Rebound secured by Victor O'Neal.

[11:42] Team_003 possession (Score: 60-90)
Miles Towns drives to the basket... Miles Towns loses the ball! Stripped by Dirk Sabonis! TURNOVER! (live ball)

[11:27] Team_100 possession (Score: 60-90)
FOUL! Shooting foul on Nikola Bryant. Manu Ball to the line for 2 free throws. [Team fouls: 1] (Nikola Bryant: 1 personal fouls)   FT 1/2: GOOD   FT 2/2: MISS Manu Ball makes 1/2 from the line. Offensive rebound by Chris Mobley! Chris Mobley kicks it out.
Score: 61-90

[11:15] Team_100 possession (Score: 61-90)
Dirk Sabonis attempts a 3Pt. Contested by Giannis Turner (3.5 feet, ZONE). Dirk Sabonis misses. Rebound secured by Rudy Haliburton.

[11:02] Team_003 possession (Score: 61-90)
Miles Towns attempts a 3Pt. Contested by Dirk Sabonis (5.6 feet, MAN). Miles Towns misses. Rebound secured by Pau LaVine.

[10:48] Team_100 possession (Score: 61-90)
Dirk Sabonis attempts a 3Pt. Contested by Miles Towns (5.6 feet, MAN). Dirk Sabonis misses. Rebound secured by Rudy Haliburton.

[10:37] Team_003 possession (Score: 61-90)
Rudy Haliburton attempts a 3Pt. Contested by Pau LaVine (5.0 feet, ZONE). RUDY HALIBURTON MAKES IT! Assist: Giannis Turner
Score: 61-93

[10:23] Team_100 possession (Score: 61-93)
FOUL! Holding foul on Miles Towns. [Team fouls: 2] No free throws, side out. (Miles Towns: 1 personal fouls)

[10:11] Team_100 possession (Score: 61-93)
Manu Ball attempts a 3Pt. Contested by Nikola Bryant (4.5 feet, MAN). Manu Ball misses. Offensive rebound by Pau LaVine! Pau LaVine kicks it out.

[09:55] Team_100 possession (Score: 61-93)
Tyler Griffin attempts a 3Pt. Contested by Giannis Turner (3.6 feet, ZONE). Tyler Griffin misses. Rebound secured by Rudy Haliburton.

[09:41] Team_003 possession (Score: 61-93)
Rudy Haliburton drives, Tyler Griffin stays with him. Rudy Haliburton attempts a Dunk. Contested by Tyler Griffin (5.4 feet, MAN). Rudy Haliburton misses. Rebound secured by Tyler Griffin.

[09:26] Team_100 possession (Score: 61-93)
Dirk Sabonis drives and kicks out. Pau LaVine attempts a Midrange. Contested by Giannis Turner (3.5 feet, MAN). Pau LaVine misses. Rebound secured by Giannis Turner.

[09:11] Team_003 possession (Score: 61-93)
Miles Towns drives to the basket... Miles Towns loses the ball! Stripped by Dirk Sabonis! TURNOVER! (live ball)

[09:00] Team_100 possession (Score: 61-93)
Pau LaVine attempts a Midrange. BLOCKED BY GIANNIS TURNER! Ball deflects out of bounds off Pau LaVine.

[08:44] Team_003 possession (Score: 61-93)
Nikola Bryant makes the Midrange and draws the foul on Dirk Sabonis! And-1! Nikola Bryant to the line for 1. [Team fouls: 1] (Dirk Sabonis: 1 personal fouls)   FT 1/1: GOOD Nikola Bryant makes 1/1 from the line.
Score: 61-96

[08:27] Team_100 possession (Score: 61-96)
Dirk Sabonis drives, Miles Towns stays with him. Dirk Sabonis attempts a Layup. Contested by Miles Towns (5.6 feet, MAN). DIRK SABONIS MAKES IT!
Score: 63-96

[08:10] Team_003 possession (Score: 63-96)
FOUL! Reach-in foul on Pau LaVine during the drive. [Team fouls: 2] No free throws, side out. (Pau LaVine: 1 personal fouls)

[07:57] Team_003 possession (Score: 63-96)
Miles Towns attempts a Layup. BLOCKED BY PAU LAVINE! Ball deflects out of bounds off Miles Towns.

[07:42] Team_100 possession (Score: 63-96)
Manu Ball drives to the basket... Manu Ball commits a violation (traveling/carry)! TURNOVER! (dead ball)

[07:42] Substitution (Team_100): Manu Ball OUT → Evan Butler IN (stamina_rule2)

[07:42] Substitution (Team_100): Tyler Griffin OUT → Tyrese Wade IN (stamina_rule2)

[07:42] Substitution (Team_100): Pau LaVine OUT → Carmelo Ginobili IN (stamina_rule2)

[07:42] Substitution (Team_100): Chris Mobley OUT → John Rozier IN (stamina_rule2)

[07:42] Substitution (Team_003): Nikola Bryant OUT → Pau Williamson IN (stamina_rule2)

[07:42] Substitution (Team_003): Rudy Haliburton OUT → Collin Mitchell IN (stamina_rule2)

[07:42] Substitution (Team_003): Giannis Turner OUT → Anfernee Jordan IN (stamina_rule2)

[07:42] Substitution (Team_003): Victor O'Neal OUT → Bam Gilgeous-Alexander IN (stamina_rule2)

[07:31] Team_003 possession (Score: 63-96)
Bam Gilgeous-Alexander makes the Layup and draws the foul on Evan Butler! And-1! Bam Gilgeous-Alexander to the line for 1. [Team fouls: 3] (Evan Butler: 1 personal fouls)   FT 1/1: GOOD Bam Gilgeous-Alexander makes 1/1 from the line.
Score: 63-99

[07:13] Team_100 possession (Score: 63-99)
Dirk Sabonis attempts a 3Pt. Contested by Miles Towns (5.6 feet, MAN). Dirk Sabonis misses. Rebound secured by Collin Mitchell.

[07:00] Team_003 possession (Score: 63-99)
Collin Mitchell drives, picks up Tyrese Wade. Help arrives from Evan Butler! Collin Mitchell attempts a Dunk. Contested by Evan Butler (4.7 feet, MAN). COLLIN MITCHELL MAKES IT!
Score: 63-101

[06:48] Team_100 possession (Score: 63-101)
John Rozier drives to the basket... John Rozier loses the ball! Stripped by Bam Gilgeous-Alexander! TURNOVER! (live ball)

[06:35] Team_003 possession (Score: 63-101)
Bam Gilgeous-Alexander attempts a 3Pt. Contested by John Rozier (5.2 feet, MAN). Bam Gilgeous-Alexander misses. Rebound secured by Carmelo Ginobili.

[06:26] Team_100 possession (Score: 63-101)
Tyrese Wade makes the 3Pt and draws the foul on Collin Mitchell! And-1! Tyrese Wade to the line for 1. [Team fouls: 3] (Collin Mitchell: 1 personal fouls)   FT 1/1: GOOD Tyrese Wade makes 1/1 from the line.
Score: 67-101

[06:09] Team_003 possession (Score: 67-101)
FOUL! Shooting foul on Evan Butler. Pau Williamson to the line for 2 free throws. [Team fouls: 4] (Evan Butler: 2 personal fouls)   FT 1/2: MISS   FT 2/2: GOOD Pau Williamson makes 1/2 from the line.
Score: 67-102

[05:51] Team_100 possession (Score: 67-102)
Tyrese Wade attempts a 3Pt. Contested by Collin Mitchell (3.6 feet, MAN). Tyrese Wade misses. Rebound secured by Collin Mitchell.

[05:37] Team_003 possession (Score: 67-102)
Collin Mitchell attempts a 3Pt. Contested by Tyrese Wade (4.7 feet, ZONE). Collin Mitchell misses. Rebound secured by Tyrese Wade.

[05:20] Team_100 possession (Score: 67-102)
Carmelo Ginobili attempts a 3Pt. Contested by Bam Gilgeous-Alexander (2.7 feet, MAN). Carmelo Ginobili misses. Rebound secured by Bam Gilgeous-Alexander.

[05:03] Team_003 possession (Score: 67-102)
Anfernee Jordan attempts a 3Pt. Contested by Tyrese Wade (4.4 feet, ZONE). Anfernee Jordan misses. FOUL! Loose ball foul on John Rozier during the rebound battle. [IN THE BONUS! 5 team fouls] Bam Gilgeous-Alexander to the line for 2 free throws. (John Rozier: 1 personal fouls)   FT 1/2: GOOD   FT 2/2: MISS Bam Gilgeous-Alexander makes 1/2 from the line. Rebound secured by John Rozier.
Score: 67-103

[04:48] Team_100 possession (Score: 67-103)
Tyrese Wade attempts a 3Pt. Contested by Collin Mitchell (3.6 feet, MAN). Tyrese Wade misses. Offensive rebound by John Rozier! John Rozier's putback is no good. Rebound secured by Collin Mitchell.

[04:38] Team_003 possession (Score: 67-103)
FOUL! Shooting foul on John Rozier. Pau Williamson to the line for 2 free throws. [BONUS: 6 team fouls] (John Rozier: 2 personal fouls)   FT 1/2: GOOD   FT 2/2: GOOD Pau Williamson makes 2/2 from the line.
Score: 67-105

[04:24] Team_100 possession (Score: 67-105)
FOUL! Reach-in foul on Miles Towns during the drive. [Team fouls: 4] No free throws, side out. (Miles Towns: 2 personal fouls)

[04:11] Team_100 possession (Score: 67-105)
Dirk Sabonis makes the Layup and draws the foul on Miles Towns! And-1! Dirk Sabonis to the line for 1. [BONUS: 5 team fouls] (Miles Towns: 3 personal fouls)   FT 1/1: GOOD Dirk Sabonis makes 1/1 from the line.
Score: 70-105

[03:53] Team_003 possession (Score: 70-105)
Pau Williamson attempts a Midrange. Contested by Evan Butler (5.0 feet, ZONE). Pau Williamson misses. Rebound secured by Carmelo Ginobili.

[03:38] Team_100 possession (Score: 70-105)
Carmelo Ginobili drives and kicks out. Tyrese Wade attempts a 3Pt. Contested by Miles Towns (5.4 feet, ZONE). TYRESE WADE MAKES IT! Assist: Dirk Sabonis
Score: 73-105

[03:22] Team_003 possession (Score: 73-105)
Miles Towns attempts a Midrange. Contested by Dirk Sabonis (5.8 feet, MAN). MILES TOWNS MAKES IT! Assist: Anfernee Jordan
Score: 73-107

[03:12] Team_100 possession (Score: 73-107)
John Rozier drives, Bam Gilgeous-Alexander stays with him. John Rozier attempts a Layup. Contested by Bam Gilgeous-Alexander (3.3 feet, ZONE). John Rozier misses. Offensive rebound by John Rozier! John Rozier puts it back in!
Score: 75-107

[02:58] Team_003 possession (Score: 75-107)
Collin Mitchell attempts a 3Pt. Contested by Tyrese Wade (4.7 feet, ZONE). Collin Mitchell misses. Rebound secured by Carmelo Ginobili.

[02:47] Team_100 possession (Score: 75-107)
Tyrese Wade attempts a 3Pt. Contested by Collin Mitchell (3.6 feet, MAN). Tyrese Wade misses. Rebound secured by Collin Mitchell.

[02:29] Team_003 possession (Score: 75-107)
Collin Mitchell drives, Tyrese Wade stays with him. Collin Mitchell attempts a Layup. Contested by Tyrese Wade (4.7 feet, MAN). COLLIN MITCHELL MAKES IT! Assist: Pau Williamson
Score: 75-109

[02:12] Team_100 possession (Score: 75-109)
Evan Butler throws a bad pass out of bounds! TURNOVER! (dead ball)

[01:53] Team_003 possession (Score: 75-109)
Collin Mitchell attempts a Layup. Contested by John Rozier (4.7 feet, ZONE). COLLIN MITCHELL MAKES IT!
Score: 75-111

[01:40] Team_100 possession (Score: 75-111)
Carmelo Ginobili attempts a 3Pt. Contested by Miles Towns (5.2 feet, ZONE). CARMELO GINOBILI MAKES IT! Assist: Dirk Sabonis
Score: 78-111

[01:25] Team_003 possession (Score: 78-111)
Anfernee Jordan attempts a Midrange. Contested by Carmelo Ginobili (5.1 feet, ZONE). Anfernee Jordan misses. Offensive rebound by Collin Mitchell! Collin Mitchell kicks it out.

[01:13] Team_003 possession (Score: 78-111)
Collin Mitchell attempts a 3Pt. Contested by Tyrese Wade (4.7 feet, ZONE). Collin Mitchell misses. Rebound secured by Tyrese Wade.

[00:54] Team_100 possession (Score: 78-111)
Dirk Sabonis makes the Layup and draws the foul on Miles Towns! And-1! Dirk Sabonis to the line for 1. [BONUS: 6 team fouls] (Miles Towns: 4 personal fouls)   FT 1/1: GOOD Dirk Sabonis makes 1/1 from the line.
Score: 81-111

[00:36] Team_003 possession (Score: 81-111)
Anfernee Jordan attempts a Midrange. BLOCKED BY CARMELO GINOBILI! Ball goes out off Carmelo Ginobili. Anfernee Jordan's ball!

[00:19] Team_003 possession (Score: 81-111)
Bam Gilgeous-Alexander drives, John Rozier stays with him. Bam Gilgeous-Alexander attempts a Dunk. Contested by John Rozier (5.3 feet, MAN). BAM GILGEOUS-ALEXANDER MAKES IT! Assist: Anfernee Jordan
Score: 81-113

[00:06] Team_100 possession (Score: 81-113)
Tyrese Wade attempts a Midrange. Contested by Pau Williamson (4.7 feet, ZONE). Tyrese Wade misses. Offensive rebound by John Rozier! John Rozier's putback is no good. Rebound secured by Collin Mitchell.

================================================================================
                              4TH QUARTER COMPLETE                              
================================================================================

4TH QUARTER SCORE: Team_100 21, Team_003 23

BOX SCORE:
================================================================================

Team_100
--------------------------------------------------------------------------------
Player                MIN  PTS  REB  AST  TO      FG   FG%      3P   3P%
--------------------------------------------------------------------------------
Dirk Sabonis           16    8    0    2   0   3/8    37.5     0/0   0.0
Tyrese Wade            12    7    2    0   0   2/6    33.3     0/0   0.0
Collin Mitchell        12    6    6    0   0   3/6    50.0     0/0   0.0
Carmelo Ginobili       12    3    3    0   0   1/2    50.0     0/0   0.0
John Rozier            15    2    2    0   0   1/1   100.0     0/0   0.0
Chris Mobley           33    0    1    0   0   0/0     0.0     0/0   0.0
Pau LaVine             37    0    2    0   0   0/1     0.0     0/0   0.0
Tyler Griffin          37    0    1    0   0   0/1     0.0     0/0   0.0

TEAM: FG: 7/19 (36.8%), 3PT: 2/11 (18.2%), REB: 12 (5 off, 7 def), AST: 2, TO: 3
TEAM FOULS: 6 [Team_003 in BONUS]


Team_003
--------------------------------------------------------------------------------
Player                MIN  PTS  REB  AST  TO      FG   FG%      3P   3P%
--------------------------------------------------------------------------------
Bam Gilgeous-Alexander   12    5    1    0   0   2/3    66.7     0/0   0.0
Rudy Haliburton        37    3    3    0   0   1/2    50.0     0/0   0.0
Nikola Bryant          37    3    0    0   0   1/1   100.0     0/0   0.0
Pau Williamson         12    3    0    1   0   2/3    66.7     0/0   0.0
Miles Towns            16    2    0    0   0   1/3    33.3     0/0   0.0
Victor O'Neal          37    0    1    0   0   0/0     0.0     0/0   0.0
Giannis Turner         37    0    1    1   0   0/0     0.0     0/0   0.0
Anfernee Jordan        12    0    0    2   0   0/1     0.0     0/0   0.0

TEAM: FG: 10/19 (52.6%), 3PT: 1/7 (14.3%), REB: 11 (2 off, 9 def), AST: 4, TO: 2
TEAM FOULS: 6 [Team_100 in BONUS]

================================================================================

================================================================================
                               FULL GAME COMPLETE                               
================================================================================

FINAL SCORE: Team_100 81, Team_003 113

SCORING BY QUARTER:
--------------------------------------------------------------------------------
Team                     Q1     Q2     Q3     Q4    FINAL
--------------------------------------------------------------------------------
Team_100                 18     28     14     21       81
Team_003                 23     41     26     23      113
--------------------------------------------------------------------------------

FULL GAME BOX SCORE:
================================================================================

Team_100
--------------------------------------------------------------------------------
Player                MIN  PTS  REB  AST  TO      FG   FG%      3P   3P%      FT STL BLK
--------------------------------------------------------------------------------
Manu Ball              37   15    0    2   0   5/15   33.3   2/8    25.0   6/7     0   0
Tyler Griffin          37    6    6    0   2   1/9    11.1   1/4    25.0   4/5     0   0
Pau LaVine             37   12   14    4   2   5/10   50.0   0/2     0.0   6/6     2   1
Chris Mobley           33    8   14    0   1   5/12   41.7   0/0     0.0   2/3     0   1
Luka Green             32    5    0    0   3   2/8    25.0   1/6    16.7   0/0     1   0
Dirk Sabonis           16   15    0    3   1   6/12   50.0   1/6    16.7   4/4     2   0
John Rozier            15    4    4    0   2   2/2   100.0   0/0     0.0   0/0     0   1
Evan Butler            12    0    0    1   1   0/0     0.0   0/0     0.0   0/0     0   0
Tyrese Wade            12    9    3    0   0   2/6    33.3   1/4    25.0   1/1     0   0
Carmelo Ginobili       12    3    4    1   0   2/3    66.7   1/2    50.0   0/0     0   1

TEAM: FG: 30/77 (39.0%), 3PT: 7/32 (21.9%), REB: 45 (16 off, 29 def), AST: 11, TO: 12


Team_003
--------------------------------------------------------------------------------
Player                MIN  PTS  REB  AST  TO      FG   FG%      3P   3P%      FT STL BLK
--------------------------------------------------------------------------------
Nikola Bryant          37   18    0    3   1   7/10   70.0   2/4    50.0   2/2     0   0
Rudy Haliburton        37   24   19    5   0   8/12   66.7   3/4    75.0   3/3     1   0
Giannis Turner         37   13   15    2   2   6/10   60.0   0/0     0.0   6/7     0   4
Victor O'Neal          37   15   11    1   1   7/13   53.8   0/4     0.0   7/8     0   0
Ayo Jackson            32   11    0    4   4   4/7    57.1   2/4    50.0   3/3     1   0
Miles Towns            16    4    0    0   0   2/4    50.0   0/1     0.0   0/0     0   0
Pau Williamson         12    6    0    1   0   3/4    75.0   1/1   100.0   3/4     0   0
Collin Mitchell        12    6    6    1   0   3/7    42.9   0/3     0.0   0/0     0   0
Anfernee Jordan        12    3    1    3   0   1/5    20.0   1/3    33.3   0/0     0   0
Bam Gilgeous-Alexander   12    8    1    1   0   3/4    75.0   0/1     0.0   3/4     1   0

TEAM: FG: 46/78 (59.0%), 3PT: 9/25 (36.0%), REB: 53 (9 off, 44 def), AST: 21, TO: 8

================================================================================
