================================================================================
                        FULL GAME - Team_051 vs Team_084                        
================================================================================

================================================================================
                       1ST QUARTER - Team_051 vs Team_084                       
================================================================================

[12:00] Team_051 possession (Score: 0-0)
Franz Simmons attempts a 3Pt. Contested by Luka Sexton (4.1 feet, ZONE). Franz Simmons misses. Rebound secured by Giannis Quickley.

[11:49] Team_084 possession (Score: 0-0)
Jarrett Booker drives and kicks out. Giannis Quickley attempts a 3Pt. Contested by Shaquille Harden (4.2 feet, MAN). Giannis Quickley misses. Rebound secured by OG Siakam.

[11:33] Team_051 possession (Score: 0-0)
Shaquille Harden drives, Giannis Quickley stays with him. Shaquille Harden attempts a Dunk. Contested by Giannis Quickley (4.4 feet, ZONE). Shaquille Harden misses. Rebound secured by Giannis Quickley.

[11:17] Team_084 possession (Score: 0-0)
Dejounte Ginobili drives, Franz Simmons stays with him. Dejounte Ginobili attempts a Dunk. Contested by Franz Simmons (4.4 feet, ZONE). Dejounte Ginobili misses. FOUL! Loose ball foul on OG Siakam during the rebound battle. [Team fouls: 1] No free throws, side out. (OG Siakam: 1 personal fouls)

[11:04] Team_084 possession (Score: 0-0)
Luka Sexton attempts a 3Pt. Contested by Austin Sexton (4.7 feet, MAN). Luka Sexton misses. Rebound secured by Shaquille Harden.

[10:50] Team_051 possession (Score: 0-0)
FOUL! Reach-in foul on Giannis Quickley during the drive. [Team fouls: 1] No free throws, side out. (Giannis Quickley: 1 personal fouls)

[10:33] Team_051 possession (Score: 0-0)
OG Siakam attempts a 3Pt. Contested by Klay Thompson (5.1 feet, MAN). OG SIAKAM MAKES IT! Assist: Shaquille Harden
Score: 3-0

[10:21] Team_084 possession (Score: 3-0)
Klay Thompson attempts a Midrange. Contested by OG Siakam (4.3 feet, MAN). Klay Thompson misses. Rebound secured by OG Siakam.

[10:10] Team_051 possession (Score: 3-0)
Franz Simmons attempts a Midrange. BLOCKED BY JARRETT BOOKER! Ball is loose! Rebound secured by Klay Thompson.

[09:57] Team_084 possession (Score: 3-0)
Luka Sexton drives and kicks out. Klay Thompson attempts a 3Pt. Contested by OG Siakam (3.8 feet, MAN). Klay Thompson misses. Rebound secured by Shaquille Harden.

[09:44] Team_051 possession (Score: 3-0)
FOUL! Shooting foul on Jarrett Booker. Franz Simmons to the line for 2 free throws. [Team fouls: 2] (Jarrett Booker: 1 personal fouls)   FT 1/2: GOOD   FT 2/2: GOOD Franz Simmons makes 2/2 from the line.
Score: 5-0

[09:26] Team_084 possession (Score: 5-0)
Jarrett Booker throws a bad pass! Stolen by Franz Simmons! TURNOVER! (live ball)

[09:09] Team_051 possession (Score: 5-0)
OG Siakam attempts a 3Pt. Contested by Luka Sexton (3.9 feet, ZONE). OG Siakam misses. Rebound secured by Giannis Quickley.

[08:50] Team_084 possession (Score: 5-0)
Dejounte Ginobili attempts a Midrange. Contested by Larry McGrady (4.7 feet, MAN). Dejounte Ginobili misses. Rebound secured by Shaquille Harden.

[08:38] Team_051 possession (Score: 5-0)
Shaquille Harden drives and kicks out. Shaquille Harden attempts a 3Pt. Contested by Luka Sexton (3.6 feet, ZONE). Shaquille Harden misses. Rebound secured by Dejounte Ginobili.

[08:23] Team_084 possession (Score: 5-0)
Luka Sexton attempts a 3Pt. BLOCKED BY AUSTIN SEXTON! Ball is loose! Rebound secured by Franz Simmons.

[08:06] Team_051 possession (Score: 5-0)
OG Siakam attempts a 3Pt. Contested by Klay Thompson (5.1 feet, MAN). OG Siakam misses. Rebound secured by Klay Thompson.

[07:50] Team_084 possession (Score: 5-0)
Luka Sexton attempts a 3Pt. Contested by Austin Sexton (4.7 feet, ZONE). LUKA SEXTON MAKES IT! Assist: Klay Thompson
Score: 5-3

[07:33] Team_051 possession (Score: 5-3)
Shaquille Harden attempts a Midrange. Contested by Dejounte Ginobili (4.5 feet, ZONE). SHAQUILLE HARDEN MAKES IT! Assist: Larry McGrady
Score: 7-3

[07:16] Team_084 possession (Score: 7-3)
Jarrett Booker attempts a Layup. Contested by Franz Simmons (4.4 feet, MAN). JARRETT BOOKER MAKES IT!
Score: 7-5

[07:05] Team_051 possession (Score: 7-5)
OG Siakam attempts a 3Pt. Contested by Luka Sexton (3.9 feet, ZONE). OG SIAKAM MAKES IT! Assist: Austin Sexton
Score: 10-5

[06:47] Team_084 possession (Score: 10-5)
Giannis Quickley drives, Shaquille Harden stays with him. Giannis Quickley attempts a Dunk. Contested by Shaquille Harden (4.5 feet, MAN). GIANNIS QUICKLEY MAKES IT!
Score: 10-7

[06:31] Team_051 possession (Score: 10-7)
Shaquille Harden attempts a Midrange. Contested by Jarrett Booker (4.5 feet, ZONE). Shaquille Harden misses. Rebound secured by Dejounte Ginobili.

[06:18] Team_084 possession (Score: 10-7)
Klay Thompson drives, Franz Simmons stays with him. Klay Thompson attempts a Dunk. Contested by Franz Simmons (4.7 feet, ZONE). Klay Thompson misses. Rebound secured by Franz Simmons.

[06:05] Team_051 possession (Score: 10-7)
OG Siakam makes the 3Pt and draws the foul on Luka Sexton! And-1! OG Siakam to the line for 1. [Team fouls: 3] (Luka Sexton: 1 personal fouls)   FT 1/1: MISS OG Siakam makes 0/1 from the line. Rebound secured by Dejounte Ginobili.
Score: 13-7

[05:47] Team_084 possession (Score: 13-7)
FOUL! Reach-in foul on Larry McGrady during the drive. [Team fouls: 2] No free throws, side out. (Larry McGrady: 1 personal fouls)

[05:31] Team_084 possession (Score: 13-7)
FOUL! Holding foul on Larry McGrady. [Team fouls: 3] No free throws, side out. (Larry McGrady: 2 personal fouls)

[05:14] Team_084 possession (Score: 13-7)
Jarrett Booker drives to the basket... Jarrett Booker throws a bad pass out of bounds! TURNOVER! (dead ball)

[04:59] Team_051 possession (Score: 13-7)
FOUL! Holding foul on Klay Thompson. [Team fouls: 4] No free throws, side out. (Klay Thompson: 1 personal fouls)

[04:46] Team_051 possession (Score: 13-7)
FOUL! Shooting foul on Giannis Quickley. Austin Sexton to the line for 2 free throws. [BONUS: 5 team fouls] (Giannis Quickley: 2 personal fouls)   FT 1/2: GOOD   FT 2/2: GOOD Austin Sexton makes 2/2 from the line.
Score: 15-7

[04:34] Team_084 possession (Score: 15-7)
Dejounte Ginobili attempts a Midrange. Contested by Larry McGrady (4.7 feet, MAN). Dejounte Ginobili misses. FOUL! Loose ball foul on OG Siakam during the rebound battle. [Team fouls: 4] No free throws, side out. (OG Siakam: 2 personal fouls)

[04:22] Team_084 possession (Score: 15-7)
Giannis Quickley attempts a Midrange. Contested by Franz Simmons (4.5 feet, ZONE). Giannis Quickley misses. Rebound secured by Franz Simmons.

[04:03] Team_051 possession (Score: 15-7)
Shaquille Harden attempts a 3Pt. Contested by Luka Sexton (3.7 feet, ZONE). Shaquille Harden misses. Rebound secured by Giannis Quickley.

[03:51] Team_084 possession (Score: 15-7)
Klay Thompson attempts a 3Pt. Contested by OG Siakam (4.5 feet, MAN). KLAY THOMPSON MAKES IT! Assist: Jarrett Booker
Score: 15-10

[03:38] Team_051 possession (Score: 15-10)
Shaquille Harden drives and kicks out. Franz Simmons attempts a 3Pt. Contested by Jarrett Booker (4.7 feet, MAN). Franz Simmons misses. Rebound secured by Dejounte Ginobili.

[03:25] Team_084 possession (Score: 15-10)
Jarrett Booker attempts a Midrange. Contested by Franz Simmons (4.5 feet, MAN). JARRETT BOOKER MAKES IT!
Score: 15-12

[03:15] Team_051 possession (Score: 15-12)
Austin Sexton attempts a Midrange. Contested by Luka Sexton (3.8 feet, MAN). AUSTIN SEXTON MAKES IT! Assist: Larry McGrady
Score: 17-12

[02:59] Team_084 possession (Score: 17-12)
Dejounte Ginobili makes the Layup and draws the foul on Larry McGrady! And-1! Dejounte Ginobili to the line for 1. [BONUS: 5 team fouls] (Larry McGrady: 3 personal fouls)   FT 1/1: GOOD Dejounte Ginobili makes 1/1 from the line.
Score: 17-15

[02:49] Team_051 possession (Score: 17-15)
OG Siakam drives and kicks out. Larry McGrady attempts a 3Pt. Contested by Dejounte Ginobili (4.8 feet, MAN). Larry McGrady misses. Rebound secured by Dejounte Ginobili.

[02:33] Team_084 possession (Score: 17-15)
Luka Sexton attempts a 3Pt. Contested by Austin Sexton (4.8 feet, MAN). Luka Sexton misses. Rebound secured by Franz Simmons.

[02:14] Team_051 possession (Score: 17-15)
Shaquille Harden attempts a Layup. Contested by Giannis Quickley (4.7 feet, MAN). Shaquille Harden misses. Rebound secured by Klay Thompson.

[01:57] Team_084 possession (Score: 17-15)
Dejounte Ginobili drives to the basket... FOUL! Offensive foul on Dejounte Ginobili! Franz Simmons drew the charge! [Team fouls: 6] (Dejounte Ginobili: 1 personal fouls) TURNOVER! (dead ball)

[01:44] Team_051 possession (Score: 17-15)
Franz Simmons attempts a Layup. Contested by Jarrett Booker (5.3 feet, MAN). FRANZ SIMMONS MAKES IT! Assist: OG Siakam
Score: 19-15

[01:30] Team_084 possession (Score: 19-15)
Giannis Quickley attempts a Midrange. Contested by Shaquille Harden (4.8 feet, MAN). GIANNIS QUICKLEY MAKES IT! Assist: Jarrett Booker
Score: 19-17

[01:14] Team_051 possession (Score: 19-17)
Franz Simmons attempts a 3Pt. Contested by Jarrett Booker (5.4 feet, MAN). Franz Simmons misses. Rebound secured by Giannis Quickley.

[00:57] Team_084 possession (Score: 19-17)
Klay Thompson makes the Dunk and draws the foul on OG Siakam! And-1! Klay Thompson to the line for 1. [BONUS: 6 team fouls] (OG Siakam: 3 personal fouls)   FT 1/1: GOOD Klay Thompson makes 1/1 from the line.
Score: 19-20

[00:44] Team_051 possession (Score: 19-20)
Larry McGrady makes the Layup and draws the foul on Giannis Quickley! And-1! Larry McGrady to the line for 1. [BONUS: 7 team fouls] (Giannis Quickley: 3 personal fouls)   FT 1/1: GOOD Larry McGrady makes 1/1 from the line.
Score: 22-20

[00:34] Team_084 possession (Score: 22-20)
Klay Thompson attempts a Midrange. Contested by Larry McGrady (5.4 feet, ZONE). Klay Thompson misses. Rebound secured by Shaquille Harden.

[00:22] Team_051 possession (Score: 22-20)
Shaquille Harden drives and kicks out. Austin Sexton attempts a 3Pt. Contested by Luka Sexton (4.1 feet, ZONE). Austin Sexton misses. Offensive rebound by Franz Simmons! Franz Simmons kicks it out.

[00:08] Team_051 possession (Score: 22-20)
OG Siakam attempts a 3Pt. Contested by Luka Sexton (4.3 feet, ZONE). OG Siakam misses. Rebound secured by Dejounte Ginobili.

================================================================================
                              1ST QUARTER COMPLETE                              
================================================================================

1ST QUARTER SCORE: Team_051 22, Team_084 20

BOX SCORE:
================================================================================

Team_051
--------------------------------------------------------------------------------
Player                MIN  PTS  REB  AST  TO      FG   FG%      3P   3P%
--------------------------------------------------------------------------------
OG Siakam              12    6    2    1   0   2/7    28.6     0/0   0.0
Franz Simmons          12    4    5    0   0   2/5    40.0     0/0   0.0
Austin Sexton          12    4    0    1   0   2/2   100.0     0/0   0.0
Larry McGrady          12    3    0    2   0   1/1   100.0     0/0   0.0
Shaquille Harden       12    2    4    1   0   1/7    14.3     0/0   0.0

TEAM: FG: 8/22 (36.4%), 3PT: 2/9 (22.2%), REB: 11 (1 off, 10 def), AST: 5, TO: 0
TEAM FOULS: 6 [Team_084 in BONUS]


Team_084
--------------------------------------------------------------------------------
Player                MIN  PTS  REB  AST  TO      FG   FG%      3P   3P%
--------------------------------------------------------------------------------
Klay Thompson          12    6    3    1   0   2/5    40.0     0/0   0.0
Giannis Quickley       12    4    5    0   0   2/3    66.7     0/0   0.0
Jarrett Booker         12    4    0    2   0   2/3    66.7     0/0   0.0
Dejounte Ginobili      12    3    8    0   0   1/2    50.0     0/0   0.0
Luka Sexton            12    3    0    0   0   1/5    20.0     0/0   0.0

TEAM: FG: 8/18 (44.4%), 3PT: 2/5 (40.0%), REB: 16 (2 off, 14 def), AST: 3, TO: 3
TEAM FOULS: 7 [Team_051 in BONUS]

================================================================================

================================================================================
                       2ND QUARTER - Team_051 vs Team_084                       
================================================================================

[12:00] Team_051 possession (Score: 22-20)
Austin Sexton attempts a Layup. Contested by Luka Sexton (3.9 feet, MAN). AUSTIN SEXTON MAKES IT!
Score: 24-20

[11:45] Team_084 possession (Score: 24-20)
Luka Sexton attempts a Midrange. Contested by Franz Simmons (4.7 feet, ZONE). LUKA SEXTON MAKES IT!
Score: 24-22

[11:34] Team_051 possession (Score: 24-22)
Austin Sexton attempts a Midrange. Contested by Luka Sexton (4.0 feet, MAN). AUSTIN SEXTON MAKES IT! Assist: OG Siakam
Score: 26-22

[11:16] Team_084 possession (Score: 26-22)
Klay Thompson attempts a 3Pt. Contested by OG Siakam (4.7 feet, MAN). KLAY THOMPSON MAKES IT! Assist: Dejounte Ginobili
Score: 26-25

[10:57] Team_051 possession (Score: 26-25)
Larry McGrady attempts a 3Pt. Contested by Dejounte Ginobili (5.2 feet, MAN). Larry McGrady misses. Rebound secured by Dejounte Ginobili.

[10:43] Team_084 possession (Score: 26-25)
Luka Sexton attempts a 3Pt. Contested by Austin Sexton (5.0 feet, ZONE). Luka Sexton misses. Rebound secured by OG Siakam.

[10:30] Team_051 possession (Score: 26-25)
Shaquille Harden attempts a 3Pt. Contested by Luka Sexton (4.0 feet, ZONE). SHAQUILLE HARDEN MAKES IT! Assist: Larry McGrady
Score: 29-25

[10:15] Team_084 possession (Score: 29-25)
FOUL! Shooting foul on Austin Sexton. Luka Sexton to the line for 2 free throws. [Team fouls: 1] (Austin Sexton: 1 personal fouls)   FT 1/2: MISS   FT 2/2: GOOD Luka Sexton makes 1/2 from the line.
Score: 29-26

[10:02] Team_051 possession (Score: 29-26)
OG Siakam attempts a Midrange. Contested by Jarrett Booker (5.3 feet, ZONE). OG Siakam misses. Rebound secured by Giannis Quickley.

[09:44] Team_084 possession (Score: 29-26)
FOUL! Offensive foul on Dejounte Ginobili! Larry McGrady drew the charge! [Team fouls: 1] (Dejounte Ginobili: 1 personal fouls) TURNOVER! (dead ball)

[09:29] Team_051 possession (Score: 29-26)
Austin Sexton attempts a 3Pt. Contested by Luka Sexton (4.2 feet, ZONE). AUSTIN SEXTON MAKES IT! Assist: Larry McGrady
Score: 32-26

[09:20] Team_084 possession (Score: 32-26)
Giannis Quickley attempts a Layup. Contested by Shaquille Harden (5.0 feet, MAN). GIANNIS QUICKLEY MAKES IT! Assist: Jarrett Booker
Score: 32-28

[09:00] Team_051 possession (Score: 32-28)
OG Siakam attempts a 3Pt. Contested by Klay Thompson (5.7 feet, MAN). OG Siakam misses. Rebound secured by Klay Thompson.

[08:44] Team_084 possession (Score: 32-28)
Dejounte Ginobili drives, picks up Franz Simmons. Help arrives from Austin Sexton! Dejounte Ginobili attempts a Dunk. Contested by Austin Sexton (5.0 feet, ZONE). Dejounte Ginobili misses. Offensive rebound by Giannis Quickley! Giannis Quickley puts it back in!
Score: 32-30

[08:33] Team_051 possession (Score: 32-30)
Larry McGrady drives and kicks out. FOUL! Shooting foul on Luka Sexton. Austin Sexton to the line for 2 free throws. [Team fouls: 2] (Luka Sexton: 1 personal fouls)   FT 1/2: GOOD   FT 2/2: GOOD Austin Sexton makes 2/2 from the line.
Score: 34-30

[08:21] Team_084 possession (Score: 34-30)
Jarrett Booker attempts a Midrange. BLOCKED BY FRANZ SIMMONS! Ball is loose! Rebound secured by Shaquille Harden.

[08:07] Team_051 possession (Score: 34-30)
Larry McGrady attempts a 3Pt. Contested by Luka Sexton (4.6 feet, ZONE). LARRY MCGRADY MAKES IT! Assist: Austin Sexton
Score: 37-30

[07:54] Team_084 possession (Score: 37-30)
Giannis Quickley drives, Shaquille Harden stays with him. Giannis Quickley attempts a Dunk. Contested by Shaquille Harden (5.1 feet, MAN). GIANNIS QUICKLEY MAKES IT! Assist: Luka Sexton
Score: 37-32

[07:37] Team_051 possession (Score: 37-32)
Shaquille Harden drives and kicks out. OG Siakam attempts a 3Pt. Contested by Luka Sexton (4.5 feet, ZONE). OG Siakam misses. Rebound secured by Klay Thompson.

[07:18] Team_084 possession (Score: 37-32)
Luka Sexton drives and kicks out. Luka Sexton attempts a 3Pt. Contested by Larry McGrady (5.4 feet, ZONE). Luka Sexton misses. Rebound secured by Shaquille Harden.

[07:04] Team_051 possession (Score: 37-32)
Shaquille Harden attempts a 3Pt. Contested by Giannis Quickley (5.3 feet, MAN). SHAQUILLE HARDEN MAKES IT! Assist: Austin Sexton
Score: 40-32

[06:48] Team_084 possession (Score: 40-32)
Jarrett Booker attempts a Layup. BLOCKED BY FRANZ SIMMONS! Ball is loose! Rebound secured by Shaquille Harden.

[06:30] Team_051 possession (Score: 40-32)
Larry McGrady attempts a Midrange. Contested by Dejounte Ginobili (5.7 feet, ZONE). Larry McGrady misses. Rebound secured by Giannis Quickley.

[06:18] Team_084 possession (Score: 40-32)
Jarrett Booker attempts a Layup. BLOCKED BY AUSTIN SEXTON! Ball is loose! Rebound secured by Shaquille Harden.

[06:04] Team_051 possession (Score: 40-32)
OG Siakam attempts a Midrange. Wide open! Klay Thompson is 6.0 feet away. [MAN] OG Siakam misses. Rebound secured by Giannis Quickley.

[05:46] Team_084 possession (Score: 40-32)
Dejounte Ginobili attempts a Midrange. Contested by Larry McGrady (5.7 feet, MAN). Dejounte Ginobili misses. Rebound secured by Franz Simmons.

[05:34] Team_051 possession (Score: 40-32)
Austin Sexton attempts a Midrange. Contested by Luka Sexton (4.7 feet, MAN). Austin Sexton misses. Rebound secured by Dejounte Ginobili.

[05:20] Team_084 possession (Score: 40-32)
Dejounte Ginobili makes the Dunk and draws the foul on Larry McGrady! And-1! Dejounte Ginobili to the line for 1. [Team fouls: 2] (Larry McGrady: 1 personal fouls)   FT 1/1: GOOD Dejounte Ginobili makes 1/1 from the line.
Score: 40-35

[05:09] Team_051 possession (Score: 40-35)
Larry McGrady drives to the basket... Larry McGrady commits a violation (traveling/carry)! TURNOVER! (dead ball)

[05:09] Substitution (Team_051): Austin Sexton OUT → Myles Harden IN (stamina_rule2)

[05:09] Substitution (Team_051): Larry McGrady OUT → Zion Morant IN (stamina_rule2)

[05:09] Substitution (Team_051): OG Siakam OUT → Jrue Carter IN (stamina_rule2)

[05:09] Substitution (Team_051): Franz Simmons OUT → Tobias Jokic IN (stamina_rule2)

[05:09] Substitution (Team_051): Shaquille Harden OUT → Pau Tatum IN (stamina_rule2)

[05:09] Substitution (Team_084): Luka Sexton OUT → Magic Bryant IN (stamina_rule2)

[05:09] Substitution (Team_084): Dejounte Ginobili OUT → Chris Parker IN (stamina_rule2)

[05:09] Substitution (Team_084): Klay Thompson OUT → Evan Quickley IN (stamina_rule2)

[05:09] Substitution (Team_084): Jarrett Booker OUT → Pascal Jackson IN (stamina_rule2)

[05:09] Substitution (Team_084): Giannis Quickley OUT → Dejounte Porzingis IN (stamina_rule2)

[04:50] Team_084 possession (Score: 40-35)
Evan Quickley makes the Midrange and draws the foul on Jrue Carter! And-1! Evan Quickley to the line for 1. [Team fouls: 3] (Jrue Carter: 1 personal fouls)   FT 1/1: GOOD Evan Quickley makes 1/1 from the line.
Score: 40-38

[04:38] Team_051 possession (Score: 40-38)
Myles Harden attempts a 3Pt. Contested by Evan Quickley (4.7 feet, ZONE). Myles Harden misses. Rebound secured by Pascal Jackson.

[04:23] Team_084 possession (Score: 40-38)
FOUL! Holding foul on Myles Harden. [Team fouls: 4] No free throws, side out. (Myles Harden: 1 personal fouls)

[04:07] Team_084 possession (Score: 40-38)
Chris Parker throws a bad pass! Stolen by Zion Morant! TURNOVER! (live ball)

[03:55] Team_051 possession (Score: 40-38)
FOUL! Reach-in foul on Chris Parker during the drive. [Team fouls: 3] No free throws, side out. (Chris Parker: 1 personal fouls)

[03:44] Team_051 possession (Score: 40-38)
Myles Harden attempts a Midrange. Contested by Evan Quickley (4.7 feet, ZONE). Myles Harden misses. Rebound secured by Evan Quickley.

[03:27] Team_084 possession (Score: 40-38)
Dejounte Porzingis makes the Layup and draws the foul on Pau Tatum! And-1! Dejounte Porzingis to the line for 1. [BONUS: 5 team fouls] (Pau Tatum: 1 personal fouls)   FT 1/1: MISS Dejounte Porzingis makes 0/1 from the line. Rebound secured by Pau Tatum.
Score: 40-40

[03:15] Team_051 possession (Score: 40-40)
Tobias Jokic attempts a 3Pt. Contested by Magic Bryant (3.9 feet, ZONE). Tobias Jokic misses. Rebound secured by Pascal Jackson.

[02:57] Team_084 possession (Score: 40-40)
Chris Parker attempts a 3Pt. Contested by Zion Morant (5.7 feet, MAN). Chris Parker misses. FOUL! Loose ball foul on Myles Harden during the rebound battle. [IN THE BONUS! 6 team fouls] Dejounte Porzingis to the line for 2 free throws. (Myles Harden: 2 personal fouls)   FT 1/2: GOOD   FT 2/2: GOOD Dejounte Porzingis makes 2/2 from the line.
Score: 40-42

[02:44] Team_051 possession (Score: 40-42)
FOUL! Shooting foul on Magic Bryant. Zion Morant to the line for 3 free throws. [Team fouls: 4] (Magic Bryant: 1 personal fouls)   FT 1/3: GOOD   FT 2/3: GOOD   FT 3/3: GOOD Zion Morant makes 3/3 from the line.
Score: 43-42

[02:33] Team_084 possession (Score: 43-42)
Pascal Jackson loses control! Ball rolls out of bounds! TURNOVER! (dead ball)

[02:19] Team_051 possession (Score: 43-42)
FOUL! Shooting foul on Evan Quickley. Jrue Carter to the line for 2 free throws. [BONUS: 5 team fouls] (Evan Quickley: 1 personal fouls)   FT 1/2: GOOD   FT 2/2: GOOD Jrue Carter makes 2/2 from the line.
Score: 45-42

[02:07] Team_084 possession (Score: 45-42)
Magic Bryant attempts a 3Pt. Contested by Myles Harden (4.6 feet, ZONE). MAGIC BRYANT MAKES IT! Assist: Pascal Jackson
Score: 45-45

[01:50] Team_051 possession (Score: 45-45)
FOUL! Reach-in foul on Pascal Jackson during the drive. [IN THE BONUS! 6 team fouls] Myles Harden to the line for 2 free throws. (Pascal Jackson: 1 personal fouls)   FT 1/2: GOOD   FT 2/2: GOOD Myles Harden makes 2/2 from the line.
Score: 47-45

[01:35] Team_084 possession (Score: 47-45)
Dejounte Porzingis attempts a Midrange. Contested by Pau Tatum (4.4 feet, MAN). DEJOUNTE PORZINGIS MAKES IT!
Score: 47-47

[01:21] Team_051 possession (Score: 47-47)
Myles Harden attempts a Midrange. Contested by Magic Bryant (3.4 feet, MAN). Myles Harden misses. Rebound secured by Evan Quickley.

[01:08] Team_084 possession (Score: 47-47)
Chris Parker attempts a Midrange. Contested by Zion Morant (5.7 feet, MAN). CHRIS PARKER MAKES IT!
Score: 47-49

[00:54] Team_051 possession (Score: 47-49)
Zion Morant drives, picks up Dejounte Porzingis. Help arrives from Magic Bryant! Zion Morant attempts a Layup. Contested by Magic Bryant (5.3 feet, ZONE). Zion Morant misses. Rebound secured by Evan Quickley.

[00:37] Team_084 possession (Score: 47-49)
FOUL! Holding foul on Zion Morant. [IN THE BONUS! 7 team fouls] Chris Parker to the line for 2 free throws. (Zion Morant: 1 personal fouls)   FT 1/2: GOOD   FT 2/2: GOOD Chris Parker makes 2/2 from the line.
Score: 47-51

[00:21] Team_051 possession (Score: 47-51)
FOUL! Reach-in foul on Evan Quickley during the drive. [IN THE BONUS! 7 team fouls] Jrue Carter to the line for 2 free throws. (Evan Quickley: 2 personal fouls)   FT 1/2: GOOD   FT 2/2: GOOD Jrue Carter makes 2/2 from the line.
Score: 49-51

[00:07] Team_084 possession (Score: 49-51)
FOUL! Offensive foul on Magic Bryant! Myles Harden drew the charge! [Team fouls: 8] (Magic Bryant: 2 personal fouls) TURNOVER! (dead ball)

================================================================================
                              2ND QUARTER COMPLETE                              
================================================================================

2ND QUARTER SCORE: Team_051 27, Team_084 31

BOX SCORE:
================================================================================

Team_051
--------------------------------------------------------------------------------
Player                MIN  PTS  REB  AST  TO      FG   FG%      3P   3P%
--------------------------------------------------------------------------------
Austin Sexton          19    9    0    2   0   4/5    80.0     0/0   0.0
Shaquille Harden       19    6    4    0   0   2/3    66.7     0/0   0.0
Jrue Carter             5    4    0    0   0   2/2   100.0     0/0   0.0
Larry McGrady          19    3    0    2   0   1/3    33.3     0/0   0.0
Zion Morant             5    3    0    0   0   1/2    50.0     0/0   0.0
Myles Harden            5    2    0    0   0   1/4    25.0     0/0   0.0
OG Siakam              19    0    1    1   0   0/3     0.0     0/0   0.0
Franz Simmons          19    0    1    0   0   0/0     0.0     0/0   0.0
Pau Tatum               5    0    1    0   0   0/0     0.0     0/0   0.0
Tobias Jokic            5    0    0    0   0   0/1     0.0     0/0   0.0

TEAM: FG: 11/23 (47.8%), 3PT: 5/9 (55.6%), REB: 7 (0 off, 7 def), AST: 5, TO: 1
TEAM FOULS: 7 [Team_084 in BONUS]


Team_084
--------------------------------------------------------------------------------
Player                MIN  PTS  REB  AST  TO      FG   FG%      3P   3P%
--------------------------------------------------------------------------------
Giannis Quickley       19    6    4    0   0   3/3   100.0     0/0   0.0
Dejounte Porzingis      5    4    0    0   0   2/3    66.7     0/0   0.0
Chris Parker            5    4    0    0   0   2/2   100.0     0/0   0.0
Luka Sexton            19    3    0    1   0   2/4    50.0     0/0   0.0
Klay Thompson          19    3    2    0   0   1/1   100.0     0/0   0.0
Dejounte Ginobili      19    3    2    1   0   1/2    50.0     0/0   0.0
Evan Quickley           5    3    3    0   0   1/1   100.0     0/0   0.0
Magic Bryant            5    3    0    0   0   1/1   100.0     0/0   0.0
Jarrett Booker         19    0    0    1   0   0/3     0.0     0/0   0.0
Pascal Jackson          5    0    2    1   0   0/0     0.0     0/0   0.0

TEAM: FG: 13/20 (65.0%), 3PT: 3/4 (75.0%), REB: 13 (1 off, 12 def), AST: 4, TO: 4
TEAM FOULS: 8 [Team_051 in BONUS]

================================================================================

================================================================================
                       3RD QUARTER - Team_051 vs Team_084                       
================================================================================

[12:00] Team_051 possession (Score: 49-51)
FOUL! Shooting foul on Luka Sexton. Austin Sexton to the line for 3 free throws. [Team fouls: 1] (Luka Sexton: 1 personal fouls)   FT 1/3: GOOD   FT 2/3: GOOD   FT 3/3: GOOD Austin Sexton makes 3/3 from the line.
Score: 52-51

[11:45] Team_084 possession (Score: 52-51)
Luka Sexton drives and kicks out. Giannis Quickley attempts a 3Pt. Contested by Shaquille Harden (4.2 feet, MAN). GIANNIS QUICKLEY MAKES IT! Assist: Klay Thompson
Score: 52-54

[11:29] Team_051 possession (Score: 52-54)
FOUL! Holding foul on Jarrett Booker. [Team fouls: 2] No free throws, side out. (Jarrett Booker: 1 personal fouls)

[11:15] Team_051 possession (Score: 52-54)
Shaquille Harden attempts a 3Pt. Contested by Giannis Quickley (4.4 feet, MAN). Shaquille Harden misses. Rebound secured by Giannis Quickley.

[11:01] Team_084 possession (Score: 52-54)
Luka Sexton attempts a 3Pt. Contested by Austin Sexton (4.7 feet, ZONE). Luka Sexton misses. Rebound secured by Shaquille Harden.

[10:48] Team_051 possession (Score: 52-54)
FOUL! Reach-in foul on Luka Sexton during the drive. [Team fouls: 3] No free throws, side out. (Luka Sexton: 2 personal fouls)

[10:31] Team_051 possession (Score: 52-54)
Larry McGrady makes the Midrange and draws the foul on Dejounte Ginobili! And-1! Larry McGrady to the line for 1. [Team fouls: 4] (Dejounte Ginobili: 1 personal fouls)   FT 1/1: GOOD Larry McGrady makes 1/1 from the line.
Score: 55-54

[10:13] Team_084 possession (Score: 55-54)
Luka Sexton drives to the basket... Luka Sexton commits a violation (traveling/carry)! TURNOVER! (dead ball)

[10:03] Team_051 possession (Score: 55-54)
Larry McGrady attempts a 3Pt. Contested by Dejounte Ginobili (4.9 feet, MAN). Larry McGrady misses. Rebound secured by Klay Thompson.

[09:48] Team_084 possession (Score: 55-54)
Jarrett Booker drives and kicks out. Jarrett Booker attempts a Midrange. Contested by OG Siakam (3.8 feet, ZONE). Jarrett Booker misses. Offensive rebound by Giannis Quickley! Giannis Quickley puts it back in!
Score: 55-56

[09:35] Team_051 possession (Score: 55-56)
Larry McGrady drives, Giannis Quickley stays with him. Larry McGrady attempts a Dunk. Contested by Giannis Quickley (4.7 feet, ZONE). LARRY MCGRADY MAKES IT! Assist: OG Siakam
Score: 57-56

[09:20] Team_084 possession (Score: 57-56)
FOUL! Offensive foul on Klay Thompson! OG Siakam drew the charge! [Team fouls: 5] (Klay Thompson: 1 personal fouls) TURNOVER! (dead ball)

[09:09] Team_051 possession (Score: 57-56)
FOUL! Reach-in foul on Klay Thompson during the drive. [IN THE BONUS! 6 team fouls] OG Siakam to the line for 2 free throws. (Klay Thompson: 2 personal fouls)   FT 1/2: GOOD   FT 2/2: GOOD OG Siakam makes 2/2 from the line.
Score: 59-56

[08:51] Team_084 possession (Score: 59-56)
Jarrett Booker attempts a Layup. Contested by Franz Simmons (4.4 feet, ZONE). JARRETT BOOKER MAKES IT! Assist: Luka Sexton
Score: 59-58

[08:40] Team_051 possession (Score: 59-58)
Franz Simmons attempts a Layup. Contested by Giannis Quickley (4.9 feet, ZONE). FRANZ SIMMONS MAKES IT! Assist: Austin Sexton
Score: 61-58

[08:22] Team_084 possession (Score: 61-58)
Luka Sexton attempts a 3Pt. Contested by Austin Sexton (4.7 feet, ZONE). Luka Sexton misses. Offensive rebound by Dejounte Ginobili! Dejounte Ginobili kicks it out.

[08:03] Team_084 possession (Score: 61-58)
Giannis Quickley drives, Franz Simmons stays with him. Giannis Quickley attempts a Layup. Contested by Franz Simmons (4.5 feet, ZONE). GIANNIS QUICKLEY MAKES IT!
Score: 61-60

[07:50] Team_051 possession (Score: 61-60)
FOUL! Reach-in foul on Giannis Quickley during the drive. [IN THE BONUS! 7 team fouls] Shaquille Harden to the line for 2 free throws. (Giannis Quickley: 1 personal fouls)   FT 1/2: GOOD   FT 2/2: MISS Shaquille Harden makes 1/2 from the line. Rebound secured by Giannis Quickley.
Score: 62-60

[07:37] Team_084 possession (Score: 62-60)
Klay Thompson attempts a Layup. BLOCKED BY FRANZ SIMMONS! Ball goes out off Franz Simmons. Klay Thompson's ball!

[07:23] Team_084 possession (Score: 62-60)
Dejounte Ginobili attempts a 3Pt. Contested by Austin Sexton (4.6 feet, ZONE). Dejounte Ginobili misses. Rebound secured by Franz Simmons.

[07:06] Team_051 possession (Score: 62-60)
Larry McGrady drives to the basket... Larry McGrady throws a bad pass out of bounds! TURNOVER! (dead ball)

[06:51] Team_084 possession (Score: 62-60)
Giannis Quickley drives and kicks out. FOUL! Shooting foul on Austin Sexton. Giannis Quickley to the line for 3 free throws. [Team fouls: 1] (Austin Sexton: 1 personal fouls)   FT 1/3: GOOD   FT 2/3: GOOD   FT 3/3: GOOD Giannis Quickley makes 3/3 from the line.
Score: 62-63

[06:37] Team_051 possession (Score: 62-63)
OG Siakam drives and kicks out. FOUL! Shooting foul on Dejounte Ginobili. Austin Sexton to the line for 2 free throws. [BONUS: 8 team fouls] (Dejounte Ginobili: 2 personal fouls)   FT 1/2: MISS   FT 2/2: GOOD Austin Sexton makes 1/2 from the line.
Score: 63-63

[06:24] Team_084 possession (Score: 63-63)
Luka Sexton attempts a 3Pt. Contested by Austin Sexton (4.7 feet, MAN). Luka Sexton misses. Rebound secured by Shaquille Harden.

[06:05] Team_051 possession (Score: 63-63)
Larry McGrady attempts a Midrange. Contested by Dejounte Ginobili (4.9 feet, ZONE). LARRY MCGRADY MAKES IT! Assist: Franz Simmons
Score: 65-63

[05:46] Team_084 possession (Score: 65-63)
Jarrett Booker drives, picks up Franz Simmons. Help arrives from Larry McGrady! Jarrett Booker attempts a Layup. Contested by Larry McGrady (4.4 feet, MAN). JARRETT BOOKER MAKES IT! Assist: Luka Sexton
Score: 65-65

[05:31] Team_051 possession (Score: 65-65)
Franz Simmons drives to the basket... Franz Simmons throws a bad pass out of bounds! TURNOVER! (dead ball)

[05:14] Team_084 possession (Score: 65-65)
Klay Thompson attempts a 3Pt. Contested by OG Siakam (4.4 feet, MAN). KLAY THOMPSON MAKES IT! Assist: Giannis Quickley
Score: 65-68

[05:02] Team_051 possession (Score: 65-68)
Larry McGrady makes the Midrange and draws the foul on Dejounte Ginobili! And-1! Larry McGrady to the line for 1. [BONUS: 9 team fouls] (Dejounte Ginobili: 3 personal fouls)   FT 1/1: MISS Larry McGrady makes 0/1 from the line. Offensive rebound by Shaquille Harden! Shaquille Harden's putback is no good.
Score: 67-68

[04:52] Team_084 possession (Score: 67-68)
Dejounte Ginobili attempts a 3Pt. Contested by Austin Sexton (4.6 feet, ZONE). DEJOUNTE GINOBILI MAKES IT! Assist: Giannis Quickley
Score: 67-71

[04:39] Team_051 possession (Score: 67-71)
Shaquille Harden attempts a Layup. Contested by Giannis Quickley (4.4 feet, MAN). SHAQUILLE HARDEN MAKES IT! Assist: Franz Simmons
Score: 69-71

[04:24] Team_084 possession (Score: 69-71)
Jarrett Booker attempts a Midrange. Contested by OG Siakam (4.2 feet, ZONE). Jarrett Booker misses. FOUL! Loose ball foul on Shaquille Harden during the rebound battle. [Team fouls: 2] No free throws, side out. (Shaquille Harden: 1 personal fouls)

[04:11] Team_084 possession (Score: 69-71)
Giannis Quickley makes the Layup and draws the foul on Franz Simmons! And-1! Giannis Quickley to the line for 1. [Team fouls: 3] (Franz Simmons: 1 personal fouls)   FT 1/1: MISS Giannis Quickley makes 0/1 from the line. Rebound secured by Shaquille Harden.
Score: 69-73

[03:57] Team_051 possession (Score: 69-73)
FOUL! Reach-in foul on Giannis Quickley during the drive. [IN THE BONUS! 10 team fouls] OG Siakam to the line for 2 free throws. (Giannis Quickley: 2 personal fouls)   FT 1/2: GOOD   FT 2/2: GOOD OG Siakam makes 2/2 from the line.
Score: 71-73

[03:42] Team_084 possession (Score: 71-73)
FOUL! Reach-in foul on Franz Simmons during the drive. [Team fouls: 4] No free throws, side out. (Franz Simmons: 2 personal fouls)

[03:27] Team_084 possession (Score: 71-73)
Giannis Quickley makes the Midrange and draws the foul on Larry McGrady! And-1! Giannis Quickley to the line for 1. [BONUS: 5 team fouls] (Larry McGrady: 1 personal fouls)   FT 1/1: GOOD Giannis Quickley makes 1/1 from the line.
Score: 71-76

[03:14] Team_051 possession (Score: 71-76)
Larry McGrady attempts a 3Pt. Contested by Luka Sexton (4.1 feet, ZONE). Larry McGrady misses. Rebound secured by Giannis Quickley.

[03:02] Team_084 possession (Score: 71-76)
FOUL! Holding foul on Larry McGrady. [IN THE BONUS! 6 team fouls] Dejounte Ginobili to the line for 2 free throws. (Larry McGrady: 2 personal fouls)   FT 1/2: GOOD   FT 2/2: GOOD Dejounte Ginobili makes 2/2 from the line.
Score: 71-78

[02:51] Team_051 possession (Score: 71-78)
Franz Simmons attempts a Midrange. Contested by Jarrett Booker (5.3 feet, MAN). FRANZ SIMMONS MAKES IT! Assist: Shaquille Harden
Score: 73-78

[02:32] Team_084 possession (Score: 73-78)
Dejounte Ginobili makes the 3Pt and draws the foul on Larry McGrady! And-1! Dejounte Ginobili to the line for 1. [BONUS: 7 team fouls] (Larry McGrady: 3 personal fouls)   FT 1/1: GOOD Dejounte Ginobili makes 1/1 from the line.
Score: 73-82

[02:15] Team_051 possession (Score: 73-82)
Shaquille Harden drives, picks up Giannis Quickley. Help arrives from Dejounte Ginobili! Shaquille Harden attempts a Layup. Contested by Dejounte Ginobili (4.7 feet, MAN). SHAQUILLE HARDEN MAKES IT! Assist: Franz Simmons
Score: 75-82

[01:57] Team_084 possession (Score: 75-82)
Klay Thompson attempts a 3Pt. Contested by OG Siakam (4.6 feet, MAN). Klay Thompson misses. Rebound secured by OG Siakam.

[01:40] Team_051 possession (Score: 75-82)
FOUL! Holding foul on Luka Sexton. [IN THE BONUS! 11 team fouls] Austin Sexton to the line for 2 free throws. (Luka Sexton: 3 personal fouls)   FT 1/2: GOOD   FT 2/2: MISS Austin Sexton makes 1/2 from the line. Rebound secured by Giannis Quickley.
Score: 76-82

[01:26] Team_084 possession (Score: 76-82)
Dejounte Ginobili attempts a 3Pt. Contested by Larry McGrady (5.0 feet, MAN). DEJOUNTE GINOBILI MAKES IT! Assist: Luka Sexton
Score: 76-85

[01:13] Team_051 possession (Score: 76-85)
FOUL! Reach-in foul on Dejounte Ginobili during the drive. [IN THE BONUS! 12 team fouls] Larry McGrady to the line for 2 free throws. (Dejounte Ginobili: 4 personal fouls)   FT 1/2: MISS   FT 2/2: GOOD Larry McGrady makes 1/2 from the line.
Score: 77-85

[00:59] Team_084 possession (Score: 77-85)
Luka Sexton attempts a 3Pt. Contested by Austin Sexton (5.0 feet, MAN). Luka Sexton misses. Offensive rebound by Dejounte Ginobili! Dejounte Ginobili kicks it out.

[00:44] Team_084 possession (Score: 77-85)
FOUL! Holding foul on Shaquille Harden. [IN THE BONUS! 8 team fouls] Giannis Quickley to the line for 2 free throws. (Shaquille Harden: 2 personal fouls)   FT 1/2: GOOD   FT 2/2: GOOD Giannis Quickley makes 2/2 from the line.
Score: 77-87

[00:31] Team_051 possession (Score: 77-87)
Shaquille Harden attempts a Midrange. Contested by Giannis Quickley (4.8 feet, MAN). Shaquille Harden misses. Rebound secured by Giannis Quickley.

[00:19] Team_084 possession (Score: 77-87)
FOUL! Reach-in foul on Austin Sexton during the drive. [IN THE BONUS! 9 team fouls] Luka Sexton to the line for 2 free throws. (Austin Sexton: 2 personal fouls)   FT 1/2: GOOD   FT 2/2: GOOD Luka Sexton makes 2/2 from the line.
Score: 77-89

[00:04] Team_051 possession (Score: 77-89)
OG Siakam drives and kicks out. FOUL! Shooting foul on Luka Sexton. Austin Sexton to the line for 3 free throws. [BONUS: 13 team fouls] (Luka Sexton: 4 personal fouls)   FT 1/3: GOOD   FT 2/3: GOOD   FT 3/3: GOOD Austin Sexton makes 3/3 from the line.
Score: 80-89

================================================================================
                              3RD QUARTER COMPLETE                              
================================================================================

3RD QUARTER SCORE: Team_051 31, Team_084 38

BOX SCORE:
================================================================================

Team_051
--------------------------------------------------------------------------------
Player                MIN  PTS  REB  AST  TO      FG   FG%      3P   3P%
--------------------------------------------------------------------------------
Larry McGrady          32    8    0    0   0   4/7    57.1     0/0   0.0
Austin Sexton          32    7    0    1   0   3/3   100.0     0/0   0.0
Shaquille Harden       32    4    4    1   0   2/5    40.0     0/0   0.0
OG Siakam              32    4    1    1   0   2/2   100.0     0/0   0.0
Franz Simmons          32    4    1    3   0   2/2   100.0     0/0   0.0

TEAM: FG: 13/20 (65.0%), 3PT: 1/4 (25.0%), REB: 5 (0 off, 5 def), AST: 6, TO: 2
TEAM FOULS: 9 [Team_084 in BONUS]


Team_084
--------------------------------------------------------------------------------
Player                MIN  PTS  REB  AST  TO      FG   FG%      3P   3P%
--------------------------------------------------------------------------------
Giannis Quickley       32   15    7    2   0   6/7    85.7     0/0   0.0
Dejounte Ginobili      32   12    2    0   0   4/5    80.0     0/0   0.0
Jarrett Booker         32    4    0    0   0   2/2   100.0     0/0   0.0
Klay Thompson          32    3    1    1   0   1/2    50.0     0/0   0.0
Luka Sexton            32    2    0    3   0   1/3    33.3     0/0   0.0

TEAM: FG: 14/19 (73.7%), 3PT: 4/8 (50.0%), REB: 11 (4 off, 7 def), AST: 6, TO: 2
TEAM FOULS: 13 [Team_051 in BONUS]

================================================================================

================================================================================
                       4TH QUARTER - Team_051 vs Team_084                       
================================================================================

[12:00] Team_051 possession (Score: 80-89)
Larry McGrady attempts a Layup. Contested by Giannis Quickley (5.0 feet, ZONE). LARRY MCGRADY MAKES IT!
Score: 82-89

[11:46] Team_084 possession (Score: 82-89)
Klay Thompson attempts a Layup. Contested by OG Siakam (4.7 feet, MAN). KLAY THOMPSON MAKES IT! Assist: Giannis Quickley
Score: 82-91

[11:32] Team_051 possession (Score: 82-91)
Shaquille Harden makes the Layup and draws the foul on Giannis Quickley! And-1! Shaquille Harden to the line for 1. [Team fouls: 1] (Giannis Quickley: 1 personal fouls)   FT 1/1: GOOD Shaquille Harden makes 1/1 from the line.
Score: 85-91

[11:20] Team_084 possession (Score: 85-91)
Giannis Quickley attempts a Midrange. Contested by Shaquille Harden (4.8 feet, MAN). Giannis Quickley misses. Rebound secured by OG Siakam.

[11:08] Team_051 possession (Score: 85-91)
Shaquille Harden attempts a Layup. Contested by Giannis Quickley (4.8 feet, MAN). SHAQUILLE HARDEN MAKES IT!
Score: 87-91

[10:56] Team_084 possession (Score: 87-91)
Dejounte Ginobili attempts a 3Pt. Contested by Larry McGrady (5.1 feet, MAN). Dejounte Ginobili misses. Rebound secured by OG Siakam.

[10:45] Team_051 possession (Score: 87-91)
OG Siakam attempts a 3Pt. Contested by Luka Sexton (4.3 feet, ZONE). OG Siakam misses. Rebound secured by Dejounte Ginobili.

[10:33] Team_084 possession (Score: 87-91)
Luka Sexton drives and kicks out. Jarrett Booker attempts a 3Pt. Contested by Franz Simmons (4.7 feet, MAN). Jarrett Booker misses. Rebound secured by Franz Simmons.

[10:21] Team_051 possession (Score: 87-91)
Franz Simmons commits a violation (traveling/carry)! TURNOVER! (dead ball)

[10:21] Substitution (Team_051): Austin Sexton OUT → Myles Harden IN (stamina_rule2)

[10:21] Substitution (Team_051): Larry McGrady OUT → Zion Morant IN (stamina_rule2)

[10:21] Substitution (Team_051): OG Siakam OUT → Jrue Carter IN (stamina_rule2)

[10:21] Substitution (Team_051): Franz Simmons OUT → Tobias Jokic IN (stamina_rule2)

[10:21] Substitution (Team_051): Shaquille Harden OUT → Pau Tatum IN (stamina_rule2)

[10:21] Substitution (Team_084): Luka Sexton OUT → Magic Bryant IN (stamina_rule2)

[10:21] Substitution (Team_084): Dejounte Ginobili OUT → Chris Parker IN (stamina_rule2)

[10:21] Substitution (Team_084): Klay Thompson OUT → Evan Quickley IN (stamina_rule2)

[10:21] Substitution (Team_084): Jarrett Booker OUT → Pascal Jackson IN (stamina_rule2)

[10:21] Substitution (Team_084): Giannis Quickley OUT → Dejounte Porzingis IN (stamina_rule2)

[10:08] Team_084 possession (Score: 87-91)
Magic Bryant attempts a 3Pt. Contested by Myles Harden (4.6 feet, MAN). MAGIC BRYANT MAKES IT! Assist: Dejounte Porzingis
Score: 87-94

[09:55] Team_051 possession (Score: 87-94)
Pau Tatum attempts a 3Pt. Contested by Dejounte Porzingis (4.9 feet, MAN). Pau Tatum misses. Rebound secured by Dejounte Porzingis.

[09:36] Team_084 possession (Score: 87-94)
FOUL! Holding foul on Jrue Carter. [Team fouls: 1] No free throws, side out. (Jrue Carter: 1 personal fouls)

[09:24] Team_084 possession (Score: 87-94)
Magic Bryant attempts a Midrange. Contested by Zion Morant (5.6 feet, ZONE). MAGIC BRYANT MAKES IT!
Score: 87-96

[09:12] Team_051 possession (Score: 87-96)
Myles Harden drives to the basket... Myles Harden throws a bad pass! Stolen by Dejounte Porzingis! TURNOVER! (live ball)

[08:54] Team_084 possession (Score: 87-96)
Evan Quickley attempts a 3Pt. Contested by Jrue Carter (4.6 feet, MAN). Evan Quickley misses. Rebound secured by Tobias Jokic.

[08:36] Team_051 possession (Score: 87-96)
Pau Tatum attempts a 3Pt. Contested by Dejounte Porzingis (4.9 feet, MAN). Pau Tatum misses. Rebound secured by Dejounte Porzingis.

[08:21] Team_084 possession (Score: 87-96)
Dejounte Porzingis attempts a Midrange. Contested by Jrue Carter (4.7 feet, ZONE). Dejounte Porzingis misses. Rebound secured by Pau Tatum.

[08:09] Team_051 possession (Score: 87-96)
Jrue Carter attempts a Midrange. Contested by Chris Parker (4.8 feet, ZONE). JRUE CARTER MAKES IT!
Score: 89-96

[07:50] Team_084 possession (Score: 89-96)
Magic Bryant attempts a Layup. Contested by Myles Harden (4.6 feet, MAN). MAGIC BRYANT MAKES IT! Assist: Dejounte Porzingis
Score: 89-98

[07:35] Team_051 possession (Score: 89-98)
Pau Tatum drives, Dejounte Porzingis stays with him. Pau Tatum attempts a Layup. Contested by Dejounte Porzingis (4.9 feet, ZONE). PAU TATUM MAKES IT!
Score: 91-98

[07:23] Team_084 possession (Score: 91-98)
Dejounte Porzingis throws a bad pass out of bounds! TURNOVER! (dead ball)

[07:08] Team_051 possession (Score: 91-98)
FOUL! Reach-in foul on Dejounte Porzingis during the drive. [Team fouls: 2] No free throws, side out. (Dejounte Porzingis: 1 personal fouls)

[06:50] Team_051 possession (Score: 91-98)
Jrue Carter attempts a 3Pt. Contested by Chris Parker (4.8 feet, ZONE). JRUE CARTER MAKES IT! Assist: Pau Tatum
Score: 94-98

[06:37] Team_084 possession (Score: 94-98)
Chris Parker drives and kicks out. Dejounte Porzingis attempts a 3Pt. Contested by Myles Harden (4.6 feet, ZONE). DEJOUNTE PORZINGIS MAKES IT! Assist: Magic Bryant
Score: 94-101

[06:21] Team_051 possession (Score: 94-101)
Zion Morant attempts a 3Pt. Contested by Magic Bryant (3.9 feet, ZONE). Zion Morant misses. Offensive rebound by Tobias Jokic! Tobias Jokic kicks it out.

[06:06] Team_051 possession (Score: 94-101)
Zion Morant drives, Chris Parker stays with him. Zion Morant attempts a Dunk. Contested by Chris Parker (4.8 feet, MAN). ZION MORANT MAKES IT! Assist: Tobias Jokic
Score: 96-101

[05:52] Team_084 possession (Score: 96-101)
Magic Bryant drives, picks up Pau Tatum. Help arrives from Myles Harden! Magic Bryant attempts a Dunk. Contested by Myles Harden (4.3 feet, ZONE). MAGIC BRYANT MAKES IT! Assist: Chris Parker
Score: 96-103

[05:34] Team_051 possession (Score: 96-103)
Tobias Jokic attempts a 3Pt. Contested by Pascal Jackson (4.9 feet, MAN). Tobias Jokic misses. Offensive rebound by Pau Tatum! Pau Tatum puts it back in!
Score: 98-103

[05:16] Team_084 possession (Score: 98-103)
Chris Parker attempts a Midrange. Contested by Zion Morant (5.7 feet, MAN). Chris Parker misses. Rebound secured by Myles Harden.

[05:04] Team_051 possession (Score: 98-103)
Zion Morant makes the Layup and draws the foul on Chris Parker! And-1! Zion Morant to the line for 1. [Team fouls: 3] (Chris Parker: 1 personal fouls)   FT 1/1: GOOD Zion Morant makes 1/1 from the line.
Score: 101-103

[04:48] Team_084 possession (Score: 101-103)
Dejounte Porzingis drives to the basket... FOUL! Offensive foul on Dejounte Porzingis! Pau Tatum drew the charge! [Team fouls: 4] (Dejounte Porzingis: 2 personal fouls) TURNOVER! (dead ball)

[04:32] Team_051 possession (Score: 101-103)
Tobias Jokic attempts a Midrange. Contested by Pascal Jackson (4.9 feet, MAN). Tobias Jokic misses. Rebound secured by Dejounte Porzingis.

[04:15] Team_084 possession (Score: 101-103)
Magic Bryant attempts a Midrange. Contested by Myles Harden (4.6 feet, MAN). MAGIC BRYANT MAKES IT! Assist: Chris Parker
Score: 101-105

[04:02] Team_051 possession (Score: 101-105)
Jrue Carter attempts a 3Pt. Contested by Magic Bryant (3.9 feet, ZONE). Jrue Carter misses. Rebound secured by Evan Quickley.

[03:48] Team_084 possession (Score: 101-105)
Magic Bryant loses the ball! Stripped by Myles Harden! TURNOVER! (live ball)

[03:32] Team_051 possession (Score: 101-105)
Myles Harden attempts a Midrange. Contested by Evan Quickley (4.7 feet, ZONE). Myles Harden misses. Rebound secured by Evan Quickley.

[03:18] Team_084 possession (Score: 101-105)
Chris Parker drives, picks up Pau Tatum. Help arrives from Myles Harden! Chris Parker attempts a Layup. Contested by Myles Harden (4.4 feet, ZONE). Chris Parker misses. Rebound secured by Myles Harden.

[03:04] Team_051 possession (Score: 101-105)
Tobias Jokic attempts a 3Pt. Contested by Pascal Jackson (4.9 feet, MAN). Tobias Jokic misses. Offensive rebound by Tobias Jokic! Tobias Jokic kicks it out.

[02:51] Team_051 possession (Score: 101-105)
FOUL! Shooting foul on Magic Bryant. Pau Tatum to the line for 3 free throws. [BONUS: 5 team fouls] (Magic Bryant: 1 personal fouls)   FT 1/3: MISS   FT 2/3: MISS   FT 3/3: GOOD Pau Tatum makes 1/3 from the line.
Score: 102-105

[02:32] Team_084 possession (Score: 102-105)
Magic Bryant drives and kicks out. Evan Quickley attempts a 3Pt. Contested by Jrue Carter (4.7 feet, MAN). Evan Quickley misses. Rebound secured by Tobias Jokic.

[02:14] Team_051 possession (Score: 102-105)
Jrue Carter attempts a Midrange. Contested by Evan Quickley (5.2 feet, MAN). Jrue Carter misses. Offensive rebound by Pau Tatum! Pau Tatum's putback is no good. Offensive rebound by Pau Tatum! Pau Tatum kicks it out.

[01:59] Team_051 possession (Score: 102-105)
Tobias Jokic drives, picks up Dejounte Porzingis. Help arrives from Magic Bryant! Tobias Jokic attempts a Dunk. Contested by Magic Bryant (5.3 feet, ZONE). Tobias Jokic misses. Rebound secured by Evan Quickley.

[01:42] Team_084 possession (Score: 102-105)
Pascal Jackson attempts a 3Pt. Contested by Myles Harden (4.9 feet, ZONE). Pascal Jackson misses. Rebound secured by Pau Tatum.

[01:25] Team_051 possession (Score: 102-105)
Pau Tatum attempts a Layup. Contested by Dejounte Porzingis (5.0 feet, ZONE). Pau Tatum misses. Rebound secured by Dejounte Porzingis.

[01:09] Team_084 possession (Score: 102-105)
Evan Quickley attempts a 3Pt. Contested by Jrue Carter (4.7 feet, MAN). EVAN QUICKLEY MAKES IT!
Score: 102-108

[00:57] Team_051 possession (Score: 102-108)
Zion Morant attempts a Midrange. Contested by Chris Parker (5.0 feet, MAN). ZION MORANT MAKES IT! Assist: Myles Harden
Score: 104-108

[00:44] Team_084 possession (Score: 104-108)
Chris Parker attempts a Layup. BLOCKED BY PAU TATUM! Ball is loose! Offensive rebound by Pascal Jackson! Pascal Jackson kicks it out.

[00:31] Team_084 possession (Score: 104-108)
FOUL! Reach-in foul on Pau Tatum during the drive. [Team fouls: 2] No free throws, side out. (Pau Tatum: 1 personal fouls)

[00:17] Team_084 possession (Score: 104-108)
Magic Bryant attempts a 3Pt. Contested by Tobias Jokic (5.5 feet, ZONE). Magic Bryant misses. Rebound secured by Tobias Jokic.

[00:05] Team_051 possession (Score: 104-108)
FOUL! Holding foul on Pascal Jackson. [IN THE BONUS! 6 team fouls] Tobias Jokic to the line for 2 free throws. (Pascal Jackson: 1 personal fouls)   FT 1/2: GOOD   FT 2/2: GOOD Tobias Jokic makes 2/2 from the line.
Score: 106-108

================================================================================
                              4TH QUARTER COMPLETE                              
================================================================================

4TH QUARTER SCORE: Team_051 26, Team_084 19

BOX SCORE:
================================================================================

Team_051
--------------------------------------------------------------------------------
Player                MIN  PTS  REB  AST  TO      FG   FG%      3P   3P%
--------------------------------------------------------------------------------
Zion Morant            15    7    0    0   0   3/3   100.0     0/0   0.0
Shaquille Harden       33    5    0    0   0   2/2   100.0     0/0   0.0
Pau Tatum              15    5    4    1   0   3/6    50.0     0/0   0.0
Jrue Carter            15    5    0    0   0   2/3    66.7     0/0   0.0
Larry McGrady          33    2    0    0   0   1/1   100.0     0/0   0.0
Tobias Jokic           15    2    5    1   0   1/3    33.3     0/0   0.0
OG Siakam              33    0    2    0   0   0/1     0.0     0/0   0.0
Franz Simmons          33    0    1    0   0   0/0     0.0     0/0   0.0
Myles Harden           15    0    2    1   0   0/1     0.0     0/0   0.0

TEAM: FG: 12/20 (60.0%), 3PT: 3/7 (42.9%), REB: 14 (4 off, 10 def), AST: 3, TO: 2
TEAM FOULS: 2


Team_084
--------------------------------------------------------------------------------
Player                MIN  PTS  REB  AST  TO      FG   FG%      3P   3P%
--------------------------------------------------------------------------------
Magic Bryant           15   11    0    1   0   5/7    71.4     0/0   0.0
Dejounte Porzingis     15    3    4    2   0   1/2    50.0     0/0   0.0
Evan Quickley          15    3    3    0   0   1/2    50.0     0/0   0.0
Klay Thompson          33    2    0    0   0   1/1   100.0     0/0   0.0
Giannis Quickley       33    0    0    1   0   0/1     0.0     0/0   0.0
Dejounte Ginobili      33    0    1    0   0   0/1     0.0     0/0   0.0
Luka Sexton            33    0    0    0   0   0/1     0.0     0/0   0.0
Chris Parker           15    0    0    2   0   0/2     0.0     0/0   0.0
Pascal Jackson         15    0    1    0   0   0/1     0.0     0/0   0.0

TEAM: FG: 8/18 (44.4%), 3PT: 2/6 (33.3%), REB: 9 (1 off, 8 def), AST: 6, TO: 3
TEAM FOULS: 6 [Team_051 in BONUS]

================================================================================

================================================================================
                               FULL GAME COMPLETE                               
================================================================================

FINAL SCORE: Team_051 106, Team_084 108

SCORING BY QUARTER:
--------------------------------------------------------------------------------
Team                     Q1     Q2     Q3     Q4    FINAL
--------------------------------------------------------------------------------
Team_051                 22     27     31     26      106
Team_084                 20     31     38     19      108
--------------------------------------------------------------------------------

FULL GAME BOX SCORE:
================================================================================

Team_051
--------------------------------------------------------------------------------
Player                MIN  PTS  REB  AST  TO      FG   FG%      3P   3P%      FT STL BLK
--------------------------------------------------------------------------------
Austin Sexton          33   20    0    4   0   6/7    85.7   2/2   100.0  12/14    0   2
Larry McGrady          33   16    0    4   2   8/13   61.5   1/4    25.0   3/5     0   0
OG Siakam              33   10    6    3   0   6/15   40.0   2/8    25.0   4/5     0   0
Franz Simmons          33    8    8    3   1   4/7    57.1   0/2     0.0   2/2     1   3
Shaquille Harden       33   17   12    2   1   7/17   41.2   2/4    50.0   2/3     0   0
Myles Harden           15    2    2    1   0   1/5    20.0   0/1     0.0   2/2     1   0
Zion Morant            15   10    0    0   1   4/5    80.0   1/1   100.0   4/4     1   0
Jrue Carter            15    9    0    0   0   4/5    80.0   1/2    50.0   4/4     0   0
Tobias Jokic           15    2    5    1   0   1/4    25.0   1/2    50.0   2/2     0   0
Pau Tatum              15    5    5    1   0   2/5    40.0   1/3    33.3   1/3     0   1

TEAM: FG: 44/85 (51.8%), 3PT: 11/29 (37.9%), REB: 37 (5 off, 32 def), AST: 19, TO: 5


Team_084
--------------------------------------------------------------------------------
Player                MIN  PTS  REB  AST  TO      FG   FG%      3P   3P%      FT STL BLK
--------------------------------------------------------------------------------
Luka Sexton            33    8    0    4   0   5/14   35.7   1/7    14.3   3/4     0   0
Dejounte Ginobili      33   18   13    1   2   6/10   60.0   3/5    60.0   5/5     0   0
Klay Thompson          33   14    6    2   1   5/9    55.6   3/4    75.0   1/1     0   0
Jarrett Booker         33    8    0    3   3   5/9    55.6   0/0     0.0   0/0     0   1
Giannis Quickley       33   25   16    3   0   7/10   70.0   0/0     0.0   6/7     0   0
Magic Bryant           15   14    0    1   2   6/8    75.0   2/3    66.7   0/0     0   0
Chris Parker           15    4    0    2   1   3/5    60.0   1/1   100.0   2/2     0   0
Evan Quickley          15    6    6    0   1   2/3    66.7   1/2    50.0   1/1     0   0
Pascal Jackson         15    0    3    1   1   0/1     0.0   0/1     0.0   0/0     0   0
Dejounte Porzingis     15    7    4    2   1   1/3    33.3   0/0     0.0   2/3     1   0

TEAM: FG: 43/75 (57.3%), 3PT: 11/23 (47.8%), REB: 49 (8 off, 41 def), AST: 19, TO: 12

================================================================================
