================================================================================
                        FULL GAME - Team_067 vs Team_073                        
================================================================================

================================================================================
                       1ST QUARTER - Team_067 vs Team_073                       
================================================================================

[12:00] Team_067 possession (Score: 0-0)
Wendell Antetokounmpo attempts a 3Pt. Contested by Isaiah Smith (4.6 feet, MAN). Wendell Antetokounmpo misses. Rebound secured by Carmelo Porzingis.

[11:45] Team_073 possession (Score: 0-0)
Bradley Morant drives and kicks out. Carmelo Young attempts a 3Pt. Contested by Manu Reaves (3.9 feet, MAN). Carmelo Young misses. Rebound secured by Malcolm Westbrook.

[11:34] Team_067 possession (Score: 0-0)
FOUL! Reach-in foul on Carmelo Porzingis during the drive. [Team fouls: 1] No free throws, side out. (Carmelo Porzingis: 1 personal fouls)

[11:19] Team_067 possession (Score: 0-0)
Wendell Antetokounmpo attempts a 3Pt. Contested by Isaiah Smith (4.6 feet, MAN). Wendell Antetokounmpo misses. Offensive rebound by Malcolm Westbrook! Malcolm Westbrook's putback is no good. Rebound secured by Isaiah Smith.

[11:08] Team_073 possession (Score: 0-0)
Karl Williamson attempts a 3Pt. Contested by Desmond Simmons (4.0 feet, ZONE). Karl Williamson misses. Offensive rebound by Bradley Morant! Bradley Morant kicks it out.

[10:55] Team_073 possession (Score: 0-0)
Karl Williamson makes the Layup and draws the foul on Ben Ball! And-1! Karl Williamson to the line for 1. [Team fouls: 1] (Ben Ball: 1 personal fouls)   FT 1/1: GOOD Karl Williamson makes 1/1 from the line.
Score: 0-3

[10:40] Team_067 possession (Score: 0-3)
Manu Reaves attempts a 3Pt. Contested by Karl Williamson (3.5 feet, ZONE). MANU REAVES MAKES IT! Assist: Desmond Simmons
Score: 3-3

[10:23] Team_073 possession (Score: 3-3)
Bradley Morant attempts a Layup. Contested by Malcolm Westbrook (4.3 feet, MAN). BRADLEY MORANT MAKES IT! Assist: Isaiah Smith
Score: 3-5

[10:09] Team_067 possession (Score: 3-5)
Wendell Antetokounmpo attempts a 3Pt. Contested by Isaiah Smith (4.6 feet, MAN). Wendell Antetokounmpo misses. Rebound secured by Isaiah Smith.

[09:58] Team_073 possession (Score: 3-5)
Carmelo Young drives, Malcolm Westbrook stays with him. Carmelo Young attempts a Dunk. Contested by Malcolm Westbrook (4.2 feet, ZONE). CARMELO YOUNG MAKES IT! Assist: Karl Williamson
Score: 3-7

[09:43] Team_067 possession (Score: 3-7)
FOUL! Reach-in foul on Isaiah Smith during the drive. [Team fouls: 2] No free throws, side out. (Isaiah Smith: 1 personal fouls)

[09:31] Team_067 possession (Score: 3-7)
Malcolm Westbrook drives and kicks out. Malcolm Westbrook attempts a 3Pt. Contested by Bradley Morant (3.9 feet, MAN). Malcolm Westbrook misses. Offensive rebound by Desmond Simmons! Desmond Simmons kicks it out.

[09:16] Team_067 possession (Score: 3-7)
Desmond Simmons attempts a 3Pt. Contested by Karl Williamson (3.3 feet, ZONE). Desmond Simmons misses. Rebound secured by Bradley Morant.

[09:00] Team_073 possession (Score: 3-7)
Bradley Morant attempts a Midrange. Contested by Malcolm Westbrook (4.3 feet, MAN). BRADLEY MORANT MAKES IT! Assist: Isaiah Smith
Score: 3-9

[08:50] Team_067 possession (Score: 3-9)
Malcolm Westbrook attempts a 3Pt. Contested by Karl Williamson (3.4 feet, ZONE). Malcolm Westbrook misses. Rebound secured by Bradley Morant.

[08:35] Team_073 possession (Score: 3-9)
Carmelo Porzingis drives, Ben Ball stays with him. Carmelo Porzingis attempts a Dunk. Contested by Ben Ball (4.0 feet, MAN). Carmelo Porzingis misses. Rebound secured by Wendell Antetokounmpo.

[08:21] Team_067 possession (Score: 3-9)
Desmond Simmons attempts a Midrange. Contested by Carmelo Young (4.7 feet, ZONE). DESMOND SIMMONS MAKES IT!
Score: 5-9

[08:05] Team_073 possession (Score: 5-9)
Carmelo Porzingis attempts a 3Pt. Contested by Desmond Simmons (3.9 feet, ZONE). Carmelo Porzingis misses. Offensive rebound by Carmelo Porzingis! Carmelo Porzingis kicks it out.

[07:51] Team_073 possession (Score: 5-9)
Carmelo Young attempts a 3Pt. Contested by Manu Reaves (4.1 feet, MAN). Carmelo Young misses. Offensive rebound by Carmelo Porzingis! Carmelo Porzingis kicks it out.

[07:36] Team_073 possession (Score: 5-9)
Isaiah Smith makes the Layup and draws the foul on Wendell Antetokounmpo! And-1! Isaiah Smith to the line for 1. [Team fouls: 2] (Wendell Antetokounmpo: 1 personal fouls)   FT 1/1: MISS Isaiah Smith makes 0/1 from the line. Rebound secured by Malcolm Westbrook.
Score: 5-11

[07:21] Team_067 possession (Score: 5-11)
Desmond Simmons makes the Dunk and draws the foul on Karl Williamson! And-1! Desmond Simmons to the line for 1. [Team fouls: 3] (Karl Williamson: 1 personal fouls)   FT 1/1: GOOD Desmond Simmons makes 1/1 from the line.
Score: 8-11

[07:05] Team_073 possession (Score: 8-11)
Isaiah Smith loses the ball! Stripped by Wendell Antetokounmpo! TURNOVER! (live ball)

[06:50] Team_067 possession (Score: 8-11)
Malcolm Westbrook attempts a Layup. Contested by Carmelo Porzingis (4.0 feet, ZONE). MALCOLM WESTBROOK MAKES IT! Assist: Desmond Simmons
Score: 10-11

[06:36] Team_073 possession (Score: 10-11)
Karl Williamson attempts a Midrange. Contested by Desmond Simmons (4.0 feet, MAN). Karl Williamson misses. Rebound secured by Malcolm Westbrook.

[06:23] Team_067 possession (Score: 10-11)
Desmond Simmons drives, Bradley Morant stays with him. Desmond Simmons attempts a Layup. Contested by Bradley Morant (4.1 feet, ZONE). DESMOND SIMMONS MAKES IT!
Score: 12-11

[06:04] Team_073 possession (Score: 12-11)
Isaiah Smith attempts a Midrange. Contested by Wendell Antetokounmpo (4.6 feet, MAN). Isaiah Smith misses. Offensive rebound by Bradley Morant! Bradley Morant kicks it out.

[05:47] Team_073 possession (Score: 12-11)
Carmelo Young attempts a 3Pt. Contested by Manu Reaves (4.1 feet, ZONE). Carmelo Young misses. Rebound secured by Wendell Antetokounmpo.

[05:28] Team_067 possession (Score: 12-11)
Manu Reaves attempts a 3Pt. Contested by Karl Williamson (3.5 feet, ZONE). MANU REAVES MAKES IT!
Score: 15-11

[05:14] Team_073 possession (Score: 15-11)
Karl Williamson attempts a 3Pt. Contested by Desmond Simmons (4.0 feet, MAN). Karl Williamson misses. FOUL! Loose ball foul on Desmond Simmons during the rebound battle. [Team fouls: 3] No free throws, side out. (Desmond Simmons: 1 personal fouls)

[05:03] Team_073 possession (Score: 15-11)
Bradley Morant attempts a Midrange. Contested by Wendell Antetokounmpo (4.9 feet, ZONE). Bradley Morant misses. Rebound secured by Wendell Antetokounmpo.

[04:50] Team_067 possession (Score: 15-11)
Desmond Simmons attempts a Layup. Contested by Karl Williamson (3.3 feet, MAN). DESMOND SIMMONS MAKES IT!
Score: 17-11

[04:36] Team_073 possession (Score: 17-11)
Karl Williamson throws a bad pass! Stolen by Desmond Simmons! TURNOVER! (live ball)

[04:19] Team_067 possession (Score: 17-11)
Ben Ball attempts a Midrange. Contested by Carmelo Porzingis (4.6 feet, MAN). BEN BALL MAKES IT!
Score: 19-11

[04:02] Team_073 possession (Score: 19-11)
Bradley Morant attempts a Dunk. BLOCKED BY MALCOLM WESTBROOK! Ball goes out off Malcolm Westbrook. Bradley Morant's ball!

[03:46] Team_073 possession (Score: 19-11)
Karl Williamson drives and kicks out. FOUL! Shooting foul on Manu Reaves. Carmelo Young to the line for 2 free throws. [Team fouls: 4] (Manu Reaves: 1 personal fouls)   FT 1/2: GOOD   FT 2/2: GOOD Carmelo Young makes 2/2 from the line.
Score: 19-13

[03:30] Team_067 possession (Score: 19-13)
FOUL! Reach-in foul on Bradley Morant during the drive. [Team fouls: 4] No free throws, side out. (Bradley Morant: 1 personal fouls)

[03:16] Team_067 possession (Score: 19-13)
Desmond Simmons attempts a 3Pt. Contested by Karl Williamson (3.4 feet, MAN). Desmond Simmons misses. Offensive rebound by Malcolm Westbrook! Malcolm Westbrook's putback is no good. Rebound secured by Carmelo Porzingis.

[03:01] Team_073 possession (Score: 19-13)
Isaiah Smith attempts a 3Pt. Contested by Desmond Simmons (4.1 feet, ZONE). Isaiah Smith misses. Rebound secured by Malcolm Westbrook.

[02:44] Team_067 possession (Score: 19-13)
Manu Reaves attempts a 3Pt. Contested by Carmelo Young (5.1 feet, MAN). Manu Reaves misses. Rebound secured by Carmelo Porzingis.

[02:28] Team_073 possession (Score: 19-13)
Karl Williamson drives, picks up Malcolm Westbrook. Help arrives from Wendell Antetokounmpo! Karl Williamson attempts a Dunk. Contested by Wendell Antetokounmpo (4.5 feet, ZONE). Karl Williamson misses. Rebound secured by Manu Reaves.

[02:11] Team_067 possession (Score: 19-13)
Manu Reaves attempts a Midrange. Contested by Isaiah Smith (4.8 feet, ZONE). Manu Reaves misses. Rebound secured by Carmelo Porzingis.

[01:59] Team_073 possession (Score: 19-13)
FOUL! Shooting foul on Malcolm Westbrook. Bradley Morant to the line for 2 free throws. [BONUS: 5 team fouls] (Malcolm Westbrook: 1 personal fouls)   FT 1/2: GOOD   FT 2/2: GOOD Bradley Morant makes 2/2 from the line.
Score: 19-15

[01:41] Team_067 possession (Score: 19-15)
Ben Ball drives, Carmelo Porzingis stays with him. Ben Ball attempts a Layup. Contested by Carmelo Porzingis (4.8 feet, MAN). BEN BALL MAKES IT!
Score: 21-15

[01:25] Team_073 possession (Score: 21-15)
Carmelo Porzingis attempts a Midrange. Contested by Ben Ball (4.3 feet, ZONE). CARMELO PORZINGIS MAKES IT!
Score: 21-17

[01:11] Team_067 possession (Score: 21-17)
Malcolm Westbrook attempts a Layup. Contested by Bradley Morant (4.6 feet, ZONE). MALCOLM WESTBROOK MAKES IT! Assist: Manu Reaves
Score: 23-17

[01:00] Team_073 possession (Score: 23-17)
Carmelo Young makes the Dunk and draws the foul on Wendell Antetokounmpo! And-1! Carmelo Young to the line for 1. [BONUS: 6 team fouls] (Wendell Antetokounmpo: 2 personal fouls)   FT 1/1: GOOD Carmelo Young makes 1/1 from the line.
Score: 23-20

[00:43] Team_067 possession (Score: 23-20)
Ben Ball attempts a Midrange. Contested by Isaiah Smith (5.4 feet, ZONE). Ben Ball misses. Rebound secured by Bradley Morant.

[00:31] Team_073 possession (Score: 23-20)
Isaiah Smith attempts a 3Pt. Contested by Desmond Simmons (4.3 feet, ZONE). Isaiah Smith misses. Rebound secured by Desmond Simmons.

[00:18] Team_067 possession (Score: 23-20)
Malcolm Westbrook drives and kicks out. Malcolm Westbrook attempts a Midrange. Contested by Bradley Morant (4.4 feet, MAN). Malcolm Westbrook misses. Rebound secured by Bradley Morant.

[00:06] Team_073 possession (Score: 23-20)
Bradley Morant drives and kicks out. Karl Williamson attempts a 3Pt. Contested by Desmond Simmons (4.3 feet, MAN). KARL WILLIAMSON MAKES IT! Assist: Carmelo Young
Score: 23-23

================================================================================
                              1ST QUARTER COMPLETE                              
================================================================================

1ST QUARTER SCORE: Team_067 23, Team_073 23

BOX SCORE:
================================================================================

Team_067
--------------------------------------------------------------------------------
Player                MIN  PTS  REB  AST  TO      FG   FG%      3P   3P%
--------------------------------------------------------------------------------
Desmond Simmons        12    9    2    2   0   4/6    66.7     0/0   0.0
Manu Reaves            12    6    1    1   0   2/4    50.0     0/0   0.0
Malcolm Westbrook      12    4    4    0   0   2/4    50.0     0/0   0.0
Ben Ball               12    4    0    0   0   2/3    66.7     0/0   0.0
Wendell Antetokounmpo   12    0    3    0   0   0/3     0.0     0/0   0.0

TEAM: FG: 10/20 (50.0%), 3PT: 2/9 (22.2%), REB: 12 (3 off, 9 def), AST: 3, TO: 0
TEAM FOULS: 6 [Team_073 in BONUS]


Team_073
--------------------------------------------------------------------------------
Player                MIN  PTS  REB  AST  TO      FG   FG%      3P   3P%
--------------------------------------------------------------------------------
Carmelo Young          12    7    0    1   0   3/4    75.0     0/0   0.0
Bradley Morant         12    6    7    0   0   3/5    60.0     0/0   0.0
Karl Williamson        12    6    0    1   0   2/4    50.0     0/0   0.0
Carmelo Porzingis      12    2    6    0   0   1/2    50.0     0/0   0.0
Isaiah Smith           12    0    2    2   0   0/3     0.0     0/0   0.0

TEAM: FG: 9/18 (50.0%), 3PT: 0/3 (0.0%), REB: 13 (5 off, 8 def), AST: 4, TO: 2
TEAM FOULS: 4

================================================================================

================================================================================
                       2ND QUARTER - Team_067 vs Team_073                       
================================================================================

[12:00] Team_067 possession (Score: 23-23)
Malcolm Westbrook attempts a 3Pt. Contested by Karl Williamson (3.7 feet, ZONE). MALCOLM WESTBROOK MAKES IT! Assist: Wendell Antetokounmpo
Score: 26-23

[11:41] Team_073 possession (Score: 26-23)
FOUL! Holding foul on Ben Ball. [Team fouls: 1] No free throws, side out. (Ben Ball: 1 personal fouls)

[11:27] Team_073 possession (Score: 26-23)
Bradley Morant drives, Malcolm Westbrook stays with him. Bradley Morant attempts a Dunk. Contested by Malcolm Westbrook (4.7 feet, ZONE). BRADLEY MORANT MAKES IT!
Score: 26-25

[11:12] Team_067 possession (Score: 26-25)
Ben Ball attempts a Layup. Contested by Carmelo Porzingis (4.9 feet, MAN). BEN BALL MAKES IT! Assist: Manu Reaves
Score: 28-25

[10:57] Team_073 possession (Score: 28-25)
Carmelo Young drives to the basket... Carmelo Young commits a violation (traveling/carry)! TURNOVER! (dead ball)

[10:57] Substitution (Team_067): Manu Reaves OUT → James Rozier IN (stamina_rule2)

[10:57] Substitution (Team_067): Wendell Antetokounmpo OUT → Anfernee Wagner IN (stamina_rule2)

[10:57] Substitution (Team_067): Desmond Simmons OUT → Kyle Leonard IN (stamina_rule2)

[10:57] Substitution (Team_067): Ben Ball OUT → Kristaps Davis IN (stamina_rule2)

[10:57] Substitution (Team_067): Malcolm Westbrook OUT → Zach DeRozan IN (stamina_rule2)

[10:57] Substitution (Team_073): Carmelo Young OUT → Zach Quickley IN (stamina_rule2)

[10:57] Substitution (Team_073): Isaiah Smith OUT → Luka Butler IN (stamina_rule2)

[10:57] Substitution (Team_073): Karl Williamson OUT → Dwyane McCollum IN (stamina_rule2)

[10:57] Substitution (Team_073): Carmelo Porzingis OUT → Shai Thompson IN (stamina_rule2)

[10:57] Substitution (Team_073): Bradley Morant OUT → Ja Rose IN (stamina_rule2)

[10:43] Team_067 possession (Score: 28-25)
Kristaps Davis attempts a 3Pt. Contested by Luka Butler (5.1 feet, ZONE). Kristaps Davis misses. Rebound secured by Shai Thompson.

[10:31] Team_073 possession (Score: 28-25)
Shai Thompson attempts a Midrange. Contested by Kristaps Davis (4.5 feet, MAN). Shai Thompson misses. Rebound secured by Zach DeRozan.

[10:17] Team_067 possession (Score: 28-25)
Kyle Leonard attempts a Midrange. Contested by Zach Quickley (4.9 feet, ZONE). KYLE LEONARD MAKES IT! Assist: James Rozier
Score: 30-25

[10:04] Team_073 possession (Score: 30-25)
Ja Rose makes the Layup and draws the foul on Zach DeRozan! And-1! Ja Rose to the line for 1. [Team fouls: 2] (Zach DeRozan: 1 personal fouls)   FT 1/1: GOOD Ja Rose makes 1/1 from the line.
Score: 30-28

[09:49] Team_067 possession (Score: 30-28)
Zach DeRozan drives, picks up Ja Rose. Help arrives from Luka Butler! Zach DeRozan attempts a Dunk. Contested by Luka Butler (5.5 feet, MAN). ZACH DEROZAN MAKES IT!
Score: 32-28

[09:35] Team_073 possession (Score: 32-28)
FOUL! Shooting foul on Kristaps Davis. Shai Thompson to the line for 2 free throws. [Team fouls: 3] (Kristaps Davis: 1 personal fouls)   FT 1/2: GOOD   FT 2/2: GOOD Shai Thompson makes 2/2 from the line.
Score: 32-30

[09:19] Team_067 possession (Score: 32-30)
Kyle Leonard drives, Shai Thompson stays with him. Kyle Leonard attempts a Layup. Contested by Shai Thompson (4.2 feet, ZONE). KYLE LEONARD MAKES IT! Assist: Kristaps Davis
Score: 34-30

[09:08] Team_073 possession (Score: 34-30)
Ja Rose attempts a Midrange. Contested by Zach DeRozan (5.3 feet, MAN). Ja Rose misses. Offensive rebound by Ja Rose! Ja Rose kicks it out.

[08:55] Team_073 possession (Score: 34-30)
Luka Butler drives to the basket... Luka Butler throws a bad pass out of bounds! TURNOVER! (dead ball)

[08:40] Team_067 possession (Score: 34-30)
FOUL! Shooting foul on Shai Thompson. James Rozier to the line for 2 free throws. [Team fouls: 1] (Shai Thompson: 1 personal fouls)   FT 1/2: MISS   FT 2/2: GOOD James Rozier makes 1/2 from the line.
Score: 35-30

[08:29] Team_073 possession (Score: 35-30)
Dwyane McCollum attempts a 3Pt. Contested by Kyle Leonard (3.7 feet, MAN). Dwyane McCollum misses. Rebound secured by Anfernee Wagner.

[08:13] Team_067 possession (Score: 35-30)
Anfernee Wagner attempts a Midrange. Contested by Luka Butler (4.2 feet, MAN). ANFERNEE WAGNER MAKES IT! Assist: Zach DeRozan
Score: 37-30

[08:01] Team_073 possession (Score: 37-30)
Dwyane McCollum attempts a 3Pt. Contested by Kyle Leonard (3.7 feet, MAN). Dwyane McCollum misses. Rebound secured by Kristaps Davis.

[07:45] Team_067 possession (Score: 37-30)
James Rozier drives to the basket... James Rozier throws a bad pass! Stolen by Zach Quickley! TURNOVER! (live ball)

[07:31] Team_073 possession (Score: 37-30)
Ja Rose attempts a Midrange. Contested by Kyle Leonard (3.8 feet, ZONE). JA ROSE MAKES IT! Assist: Shai Thompson
Score: 37-32

[07:18] Team_067 possession (Score: 37-32)
Kristaps Davis drives and kicks out. Zach DeRozan attempts a 3Pt. Contested by Ja Rose (5.5 feet, MAN). Zach DeRozan misses. Rebound secured by Ja Rose.

[07:02] Team_073 possession (Score: 37-32)
Dwyane McCollum attempts a 3Pt. Contested by Kyle Leonard (3.7 feet, MAN). Dwyane McCollum misses. Rebound secured by Kristaps Davis.

[06:50] Team_067 possession (Score: 37-32)
James Rozier attempts a Midrange. Contested by Luka Butler (4.5 feet, ZONE). JAMES ROZIER MAKES IT! Assist: Zach DeRozan
Score: 39-32

[06:35] Team_073 possession (Score: 39-32)
Zach Quickley drives to the basket... Zach Quickley throws a bad pass! Stolen by Kristaps Davis! TURNOVER! (live ball)

[06:18] Team_067 possession (Score: 39-32)
Kristaps Davis makes the Layup and draws the foul on Shai Thompson! And-1! Kristaps Davis to the line for 1. [Team fouls: 2] (Shai Thompson: 2 personal fouls)   FT 1/1: GOOD Kristaps Davis makes 1/1 from the line.
Score: 42-32

[06:02] Team_073 possession (Score: 42-32)
Ja Rose attempts a Midrange. Contested by James Rozier (4.2 feet, ZONE). Ja Rose misses. Rebound secured by Kristaps Davis.

[05:45] Team_067 possession (Score: 42-32)
James Rozier attempts a 3Pt. Contested by Zach Quickley (4.5 feet, MAN). James Rozier misses. Rebound secured by Ja Rose.

[05:33] Team_073 possession (Score: 42-32)
FOUL! Shooting foul on Kyle Leonard. Dwyane McCollum to the line for 2 free throws. [Team fouls: 4] (Kyle Leonard: 1 personal fouls)   FT 1/2: GOOD   FT 2/2: GOOD Dwyane McCollum makes 2/2 from the line.
Score: 42-34

[05:16] Team_067 possession (Score: 42-34)
Kristaps Davis drives to the basket... Kristaps Davis loses the ball! Stripped by Shai Thompson! TURNOVER! (live ball)

[05:01] Team_073 possession (Score: 42-34)
Luka Butler attempts a Midrange. Contested by Anfernee Wagner (4.2 feet, MAN). Luka Butler misses. Rebound secured by Anfernee Wagner.

[04:47] Team_067 possession (Score: 42-34)
Kristaps Davis drives, picks up Shai Thompson. Help arrives from Luka Butler! Kristaps Davis attempts a Layup. Contested by Luka Butler (4.5 feet, MAN). KRISTAPS DAVIS MAKES IT!
Score: 44-34

[04:32] Team_073 possession (Score: 44-34)
Zach Quickley attempts a 3Pt. Contested by Kyle Leonard (4.0 feet, ZONE). ZACH QUICKLEY MAKES IT! Assist: Dwyane McCollum
Score: 44-37

[04:20] Team_067 possession (Score: 44-37)
James Rozier drives to the basket... James Rozier throws a bad pass! Stolen by Shai Thompson! TURNOVER! (live ball)

[04:04] Team_073 possession (Score: 44-37)
Luka Butler attempts a Midrange. Contested by Anfernee Wagner (4.2 feet, MAN). Luka Butler misses. Rebound secured by Anfernee Wagner.

[03:48] Team_067 possession (Score: 44-37)
FOUL! Shooting foul on Luka Butler. Anfernee Wagner to the line for 2 free throws. [Team fouls: 3] (Luka Butler: 1 personal fouls)   FT 1/2: GOOD   FT 2/2: GOOD Anfernee Wagner makes 2/2 from the line.
Score: 46-37

[03:35] Team_073 possession (Score: 46-37)
Luka Butler attempts a 3Pt. Contested by Anfernee Wagner (4.2 feet, MAN). Luka Butler misses. Offensive rebound by Ja Rose! Ja Rose kicks it out.

[03:18] Team_073 possession (Score: 46-37)
Ja Rose attempts a Midrange. Contested by Zach DeRozan (5.4 feet, MAN). Ja Rose misses. Rebound secured by Zach DeRozan.

[03:01] Team_067 possession (Score: 46-37)
Zach DeRozan drives, picks up Shai Thompson. Help arrives from Luka Butler! Zach DeRozan attempts a Layup. Contested by Luka Butler (3.9 feet, ZONE). Zach DeRozan misses. Rebound secured by Dwyane McCollum.

[02:45] Team_073 possession (Score: 46-37)
Ja Rose attempts a Layup. Contested by Zach DeRozan (5.4 feet, MAN). Ja Rose misses. Rebound secured by Zach DeRozan.

[02:29] Team_067 possession (Score: 46-37)
Zach DeRozan drives, Shai Thompson stays with him. Zach DeRozan attempts a Layup. Contested by Shai Thompson (4.0 feet, ZONE). Zach DeRozan misses. Rebound secured by Dwyane McCollum.

[02:15] Team_073 possession (Score: 46-37)
FOUL! Reach-in foul on James Rozier during the drive. [IN THE BONUS! 5 team fouls] Zach Quickley to the line for 2 free throws. (James Rozier: 1 personal fouls)   FT 1/2: GOOD   FT 2/2: MISS Zach Quickley makes 1/2 from the line. Rebound secured by Kristaps Davis.
Score: 46-38

[02:01] Team_067 possession (Score: 46-38)
James Rozier attempts a Layup. BLOCKED BY LUKA BUTLER! Ball is loose! Rebound secured by Shai Thompson.

[01:44] Team_073 possession (Score: 46-38)
Zach Quickley attempts a 3Pt. Contested by Anfernee Wagner (4.2 feet, ZONE). Zach Quickley misses. Offensive rebound by Ja Rose! Ja Rose kicks it out.

[01:28] Team_073 possession (Score: 46-38)
Ja Rose attempts a Midrange. Contested by Kristaps Davis (4.6 feet, ZONE). JA ROSE MAKES IT!
Score: 46-40

[01:15] Team_067 possession (Score: 46-40)
Kyle Leonard attempts a 3Pt. Contested by Dwyane McCollum (4.7 feet, MAN). Kyle Leonard misses. Rebound secured by Dwyane McCollum.

[01:01] Team_073 possession (Score: 46-40)
Luka Butler loses the ball! Stripped by Anfernee Wagner! TURNOVER! (live ball)

[00:46] Team_067 possession (Score: 46-40)
Kristaps Davis attempts a Layup. Contested by Shai Thompson (4.8 feet, ZONE). Kristaps Davis misses. Offensive rebound by Kristaps Davis! Kristaps Davis puts it back in!
Score: 48-40

[00:27] Team_073 possession (Score: 48-40)
Shai Thompson attempts a Layup. Contested by Kristaps Davis (4.8 feet, MAN). SHAI THOMPSON MAKES IT!
Score: 48-42

[00:12] Team_067 possession (Score: 48-42)
Kyle Leonard attempts a Midrange. Contested by Dwyane McCollum (4.8 feet, MAN). Kyle Leonard misses. Rebound secured by Ja Rose.

================================================================================
                              2ND QUARTER COMPLETE                              
================================================================================

2ND QUARTER SCORE: Team_067 25, Team_073 19

BOX SCORE:
================================================================================

Team_067
--------------------------------------------------------------------------------
Player                MIN  PTS  REB  AST  TO      FG   FG%      3P   3P%
--------------------------------------------------------------------------------
Kristaps Davis         11    7    5    1   0   3/5    60.0     0/0   0.0
Kyle Leonard           11    4    0    0   0   2/4    50.0     0/0   0.0
Anfernee Wagner        11    4    3    0   0   2/2   100.0     0/0   0.0
Malcolm Westbrook      13    3    0    0   0   1/1   100.0     0/0   0.0
James Rozier           11    3    0    1   0   2/4    50.0     0/0   0.0
Ben Ball               13    2    0    0   0   1/1   100.0     0/0   0.0
Zach DeRozan           11    2    3    2   0   1/3    33.3     0/0   0.0
Wendell Antetokounmpo   13    0    0    1   0   0/0     0.0     0/0   0.0
Manu Reaves            13    0    0    1   0   0/0     0.0     0/0   0.0

TEAM: FG: 12/20 (60.0%), 3PT: 1/4 (25.0%), REB: 11 (1 off, 10 def), AST: 6, TO: 3
TEAM FOULS: 5 [Team_073 in BONUS]


Team_073
--------------------------------------------------------------------------------
Player                MIN  PTS  REB  AST  TO      FG   FG%      3P   3P%
--------------------------------------------------------------------------------
Ja Rose                11    7    6    0   0   3/6    50.0     0/0   0.0
Shai Thompson          11    4    2    1   0   2/3    66.7     0/0   0.0
Zach Quickley          11    3    0    0   0   1/2    50.0     0/0   0.0
Bradley Morant         13    2    0    0   0   1/1   100.0     0/0   0.0
Dwyane McCollum        11    2    3    1   0   1/4    25.0     0/0   0.0
Luka Butler            11    0    0    0   0   0/2     0.0     0/0   0.0

TEAM: FG: 8/18 (44.4%), 3PT: 1/4 (25.0%), REB: 11 (3 off, 8 def), AST: 2, TO: 4
TEAM FOULS: 3

================================================================================

================================================================================
                       3RD QUARTER - Team_067 vs Team_073                       
================================================================================

[12:00] Team_067 possession (Score: 48-42)
Desmond Simmons attempts a 3Pt. Contested by Karl Williamson (3.3 feet, MAN). Desmond Simmons misses. Rebound secured by Carmelo Porzingis.

[11:44] Team_073 possession (Score: 48-42)
FOUL! Reach-in foul on Malcolm Westbrook during the drive. [Team fouls: 1] No free throws, side out. (Malcolm Westbrook: 1 personal fouls)

[11:29] Team_073 possession (Score: 48-42)
Carmelo Young drives and kicks out. Carmelo Young attempts a Midrange. Contested by Desmond Simmons (3.8 feet, ZONE). CARMELO YOUNG MAKES IT! Assist: Karl Williamson
Score: 48-44

[11:13] Team_067 possession (Score: 48-44)
Desmond Simmons attempts a 3Pt. Contested by Karl Williamson (3.3 feet, ZONE). Desmond Simmons misses. Rebound secured by Isaiah Smith.

[10:57] Team_073 possession (Score: 48-44)
Carmelo Young attempts a 3Pt. Contested by Manu Reaves (4.1 feet, MAN). Carmelo Young misses. Rebound secured by Desmond Simmons.

[10:42] Team_067 possession (Score: 48-44)
Malcolm Westbrook makes the Dunk and draws the foul on Isaiah Smith! And-1! Malcolm Westbrook to the line for 1. [Team fouls: 1] (Isaiah Smith: 1 personal fouls)   FT 1/1: GOOD Malcolm Westbrook makes 1/1 from the line.
Score: 51-44

[10:26] Team_073 possession (Score: 51-44)
FOUL! Shooting foul on Wendell Antetokounmpo. Karl Williamson to the line for 2 free throws. [Team fouls: 2] (Wendell Antetokounmpo: 1 personal fouls)   FT 1/2: GOOD   FT 2/2: MISS Karl Williamson makes 1/2 from the line. Rebound secured by Malcolm Westbrook.
Score: 51-45

[10:13] Team_067 possession (Score: 51-45)
Manu Reaves attempts a 3Pt. Contested by Carmelo Young (5.0 feet, MAN). MANU REAVES MAKES IT!
Score: 54-45

[10:00] Team_073 possession (Score: 54-45)
Carmelo Porzingis makes the Layup and draws the foul on Ben Ball! And-1! Carmelo Porzingis to the line for 1. [Team fouls: 3] (Ben Ball: 1 personal fouls)   FT 1/1: GOOD Carmelo Porzingis makes 1/1 from the line.
Score: 54-48

[09:46] Team_067 possession (Score: 54-48)
Manu Reaves attempts a Midrange. Contested by Carmelo Young (5.0 feet, MAN). Manu Reaves misses. Offensive rebound by Malcolm Westbrook! Malcolm Westbrook puts it back in!
Score: 56-48

[09:31] Team_073 possession (Score: 56-48)
FOUL! Shooting foul on Ben Ball. Carmelo Porzingis to the line for 3 free throws. [Team fouls: 4] (Ben Ball: 2 personal fouls)   FT 1/3: GOOD   FT 2/3: GOOD   FT 3/3: MISS Carmelo Porzingis makes 2/3 from the line. Rebound secured by Wendell Antetokounmpo.
Score: 56-50

[09:15] Team_067 possession (Score: 56-50)
Wendell Antetokounmpo attempts a 3Pt. Contested by Isaiah Smith (4.6 feet, MAN). Wendell Antetokounmpo misses. Rebound secured by Bradley Morant.

[08:58] Team_073 possession (Score: 56-50)
Karl Williamson attempts a Layup. Contested by Desmond Simmons (4.0 feet, MAN). Karl Williamson misses. Rebound secured by Wendell Antetokounmpo.

[08:47] Team_067 possession (Score: 56-50)
FOUL! Shooting foul on Carmelo Porzingis. Ben Ball to the line for 2 free throws. [Team fouls: 2] (Carmelo Porzingis: 1 personal fouls)   FT 1/2: GOOD   FT 2/2: GOOD Ben Ball makes 2/2 from the line.
Score: 58-50

[08:35] Team_073 possession (Score: 58-50)
Bradley Morant makes the Layup and draws the foul on Malcolm Westbrook! And-1! Bradley Morant to the line for 1. [BONUS: 5 team fouls] (Malcolm Westbrook: 2 personal fouls)   FT 1/1: GOOD Bradley Morant makes 1/1 from the line.
Score: 58-53

[08:20] Team_067 possession (Score: 58-53)
Desmond Simmons attempts a 3Pt. Contested by Karl Williamson (3.3 feet, MAN). Desmond Simmons misses. Rebound secured by Carmelo Porzingis.

[08:03] Team_073 possession (Score: 58-53)
Carmelo Porzingis attempts a 3Pt. Contested by Ben Ball (4.0 feet, MAN). Carmelo Porzingis misses. Rebound secured by Wendell Antetokounmpo.

[07:51] Team_067 possession (Score: 58-53)
Ben Ball attempts a 3Pt. Contested by Carmelo Porzingis (4.6 feet, MAN). BEN BALL MAKES IT! Assist: Wendell Antetokounmpo
Score: 61-53

[07:40] Team_073 possession (Score: 61-53)
Isaiah Smith drives and kicks out. Carmelo Young attempts a 3Pt. Contested by Desmond Simmons (3.8 feet, ZONE). Carmelo Young misses. Rebound secured by Desmond Simmons.

[07:25] Team_067 possession (Score: 61-53)
Ben Ball drives and kicks out. Wendell Antetokounmpo attempts a 3Pt. Contested by Carmelo Young (4.5 feet, ZONE). WENDELL ANTETOKOUNMPO MAKES IT! Assist: Desmond Simmons
Score: 64-53

[07:09] Team_073 possession (Score: 64-53)
FOUL! Offensive foul on Carmelo Porzingis! Ben Ball drew the charge! [Team fouls: 3] (Carmelo Porzingis: 2 personal fouls) TURNOVER! (dead ball)

[06:50] Team_067 possession (Score: 64-53)
Desmond Simmons attempts a 3Pt. Contested by Karl Williamson (3.3 feet, MAN). DESMOND SIMMONS MAKES IT! Assist: Manu Reaves
Score: 67-53

[06:37] Team_073 possession (Score: 67-53)
FOUL! Holding foul on Wendell Antetokounmpo. [IN THE BONUS! 6 team fouls] Isaiah Smith to the line for 2 free throws. (Wendell Antetokounmpo: 2 personal fouls)   FT 1/2: GOOD   FT 2/2: GOOD Isaiah Smith makes 2/2 from the line.
Score: 67-55

[06:23] Team_067 possession (Score: 67-55)
Ben Ball attempts a Midrange. Contested by Karl Williamson (4.0 feet, ZONE). BEN BALL MAKES IT! Assist: Malcolm Westbrook
Score: 69-55

[06:06] Team_073 possession (Score: 69-55)
Karl Williamson makes the Dunk and draws the foul on Wendell Antetokounmpo! And-1! Karl Williamson to the line for 1. [BONUS: 7 team fouls] (Wendell Antetokounmpo: 3 personal fouls)   FT 1/1: GOOD Karl Williamson makes 1/1 from the line.
Score: 69-58

[05:49] Team_067 possession (Score: 69-58)
Wendell Antetokounmpo attempts a Midrange. Contested by Isaiah Smith (4.6 feet, MAN). Wendell Antetokounmpo misses. Offensive rebound by Malcolm Westbrook! Malcolm Westbrook puts it back in!
Score: 71-58

[05:33] Team_073 possession (Score: 71-58)
Bradley Morant attempts a Layup. Contested by Malcolm Westbrook (4.3 feet, MAN). BRADLEY MORANT MAKES IT!
Score: 71-60

[05:15] Team_067 possession (Score: 71-60)
Desmond Simmons attempts a Midrange. Contested by Karl Williamson (3.3 feet, MAN). DESMOND SIMMONS MAKES IT! Assist: Manu Reaves
Score: 73-60

[05:01] Team_073 possession (Score: 73-60)
FOUL! Reach-in foul on Malcolm Westbrook during the drive. [IN THE BONUS! 8 team fouls] Isaiah Smith to the line for 2 free throws. (Malcolm Westbrook: 3 personal fouls)   FT 1/2: GOOD   FT 2/2: MISS Isaiah Smith makes 1/2 from the line. Rebound secured by Malcolm Westbrook.
Score: 73-61

[04:43] Team_067 possession (Score: 73-61)
Desmond Simmons commits a violation (traveling/carry)! TURNOVER! (dead ball)

[04:28] Team_073 possession (Score: 73-61)
Carmelo Porzingis attempts a 3Pt. Contested by Ben Ball (4.0 feet, MAN). Carmelo Porzingis misses. Rebound secured by Desmond Simmons.

[04:13] Team_067 possession (Score: 73-61)
Malcolm Westbrook attempts a Layup. Contested by Bradley Morant (4.3 feet, MAN). Malcolm Westbrook misses. Rebound secured by Carmelo Porzingis.

[03:59] Team_073 possession (Score: 73-61)
Carmelo Young loses control! Ball rolls out of bounds! TURNOVER! (dead ball)

[03:49] Team_067 possession (Score: 73-61)
Malcolm Westbrook drives and kicks out. Desmond Simmons attempts a Midrange. BLOCKED BY KARL WILLIAMSON! Ball is loose! Rebound secured by Bradley Morant.

[03:34] Team_073 possession (Score: 73-61)
Isaiah Smith throws a bad pass out of bounds! TURNOVER! (dead ball)

[03:15] Team_067 possession (Score: 73-61)
Malcolm Westbrook attempts a Midrange. Contested by Bradley Morant (4.4 feet, MAN). Malcolm Westbrook misses. Rebound secured by Isaiah Smith.

[03:01] Team_073 possession (Score: 73-61)
Carmelo Porzingis drives, picks up Malcolm Westbrook. Help arrives from Wendell Antetokounmpo! Carmelo Porzingis attempts a Dunk. Contested by Wendell Antetokounmpo (4.3 feet, ZONE). CARMELO PORZINGIS MAKES IT! Assist: Karl Williamson
Score: 73-63

[02:47] Team_067 possession (Score: 73-63)
Ben Ball attempts a 3Pt. Contested by Carmelo Porzingis (4.7 feet, MAN). Ben Ball misses. Rebound secured by Bradley Morant.

[02:29] Team_073 possession (Score: 73-63)
FOUL! Reach-in foul on Ben Ball during the drive. [IN THE BONUS! 9 team fouls] Carmelo Porzingis to the line for 2 free throws. (Ben Ball: 3 personal fouls)   FT 1/2: GOOD   FT 2/2: GOOD Carmelo Porzingis makes 2/2 from the line.
Score: 73-65

[02:14] Team_067 possession (Score: 73-65)
Malcolm Westbrook drives to the basket... Malcolm Westbrook throws a bad pass! Stolen by Bradley Morant! TURNOVER! (live ball)

[02:01] Team_073 possession (Score: 73-65)
Carmelo Porzingis attempts a Midrange. Contested by Ben Ball (4.2 feet, MAN). CARMELO PORZINGIS MAKES IT!
Score: 73-67

[01:44] Team_067 possession (Score: 73-67)
Malcolm Westbrook makes the Dunk and draws the foul on Isaiah Smith! And-1! Malcolm Westbrook to the line for 1. [Team fouls: 4] (Isaiah Smith: 2 personal fouls)   FT 1/1: MISS Malcolm Westbrook makes 0/1 from the line. Rebound secured by Carmelo Porzingis.
Score: 75-67

[01:28] Team_073 possession (Score: 75-67)
Carmelo Porzingis attempts a 3Pt. Contested by Desmond Simmons (4.1 feet, ZONE). CARMELO PORZINGIS MAKES IT! Assist: Karl Williamson
Score: 75-70

[01:11] Team_067 possession (Score: 75-70)
Ben Ball attempts a Layup. Contested by Carmelo Porzingis (4.8 feet, MAN). BEN BALL MAKES IT! Assist: Wendell Antetokounmpo
Score: 77-70

[00:58] Team_073 possession (Score: 77-70)
Carmelo Porzingis attempts a Midrange. Contested by Ben Ball (4.4 feet, MAN). Carmelo Porzingis misses. Offensive rebound by Carmelo Porzingis! Carmelo Porzingis kicks it out.

[00:41] Team_073 possession (Score: 77-70)
Carmelo Porzingis drives, Ben Ball stays with him. Carmelo Porzingis attempts a Dunk. Contested by Ben Ball (4.4 feet, MAN). CARMELO PORZINGIS MAKES IT! Assist: Carmelo Young
Score: 77-72

[00:24] Team_067 possession (Score: 77-72)
Malcolm Westbrook attempts a 3Pt. Contested by Bradley Morant (4.6 feet, MAN). Malcolm Westbrook misses. FOUL! Loose ball foul on Isaiah Smith during the rebound battle. [IN THE BONUS! 5 team fouls] Malcolm Westbrook to the line for 2 free throws. (Isaiah Smith: 3 personal fouls)   FT 1/2: GOOD   FT 2/2: GOOD Malcolm Westbrook makes 2/2 from the line.
Score: 79-72

[00:11] Team_073 possession (Score: 79-72)
Bradley Morant attempts a Layup. Contested by Malcolm Westbrook (4.8 feet, ZONE). BRADLEY MORANT MAKES IT! Assist: Isaiah Smith
Score: 79-74

================================================================================
                              3RD QUARTER COMPLETE                              
================================================================================

3RD QUARTER SCORE: Team_067 31, Team_073 32

BOX SCORE:
================================================================================

Team_067
--------------------------------------------------------------------------------
Player                MIN  PTS  REB  AST  TO      FG   FG%      3P   3P%
--------------------------------------------------------------------------------
Malcolm Westbrook      26    9    4    1   0   4/8    50.0     0/0   0.0
Ben Ball               26    9    0    0   0   4/5    80.0     0/0   0.0
Desmond Simmons        26    5    3    1   0   2/5    40.0     0/0   0.0
Manu Reaves            26    3    0    2   0   1/1   100.0     0/0   0.0
Wendell Antetokounmpo   26    3    3    2   0   1/2    50.0     0/0   0.0

TEAM: FG: 12/21 (57.1%), 3PT: 4/9 (44.4%), REB: 10 (2 off, 8 def), AST: 6, TO: 2
TEAM FOULS: 9 [Team_073 in BONUS]


Team_073
--------------------------------------------------------------------------------
Player                MIN  PTS  REB  AST  TO      FG   FG%      3P   3P%
--------------------------------------------------------------------------------
Carmelo Porzingis      26   14    5    0   0   6/9    66.7     0/0   0.0
Bradley Morant         26    7    3    0   0   3/3   100.0     0/0   0.0
Karl Williamson        26    3    0    3   0   1/3    33.3     0/0   0.0
Carmelo Young          26    2    0    1   0   1/2    50.0     0/0   0.0
Isaiah Smith           26    2    2    1   0   1/3    33.3     0/0   0.0

TEAM: FG: 12/20 (60.0%), 3PT: 1/5 (20.0%), REB: 10 (1 off, 9 def), AST: 5, TO: 3
TEAM FOULS: 5 [Team_067 in BONUS]

================================================================================

================================================================================
                       4TH QUARTER - Team_067 vs Team_073                       
================================================================================

[12:00] Team_067 possession (Score: 79-74)
Wendell Antetokounmpo drives and kicks out. Manu Reaves attempts a Midrange. Contested by Karl Williamson (3.3 feet, ZONE). Manu Reaves misses. Rebound secured by Bradley Morant.

[11:46] Team_073 possession (Score: 79-74)
Karl Williamson attempts a 3Pt. Contested by Desmond Simmons (4.2 feet, MAN). KARL WILLIAMSON MAKES IT! Assist: Carmelo Porzingis
Score: 79-77

[11:32] Team_067 possession (Score: 79-77)
Manu Reaves attempts a Layup. Contested by Bradley Morant (4.5 feet, ZONE). Manu Reaves misses. Rebound secured by Isaiah Smith.

[11:22] Team_073 possession (Score: 79-77)
Carmelo Young drives to the basket... Carmelo Young throws a bad pass! Stolen by Malcolm Westbrook! TURNOVER! (live ball)

[11:11] Team_067 possession (Score: 79-77)
Wendell Antetokounmpo attempts a 3Pt. Contested by Isaiah Smith (4.8 feet, MAN). Wendell Antetokounmpo misses. Rebound secured by Bradley Morant.

[10:57] Team_073 possession (Score: 79-77)
FOUL! Shooting foul on Malcolm Westbrook. Carmelo Young to the line for 2 free throws. [Team fouls: 1] (Malcolm Westbrook: 1 personal fouls)   FT 1/2: MISS   FT 2/2: GOOD Carmelo Young makes 1/2 from the line.
Score: 79-78

[10:45] Team_067 possession (Score: 79-78)
Desmond Simmons attempts a Midrange. Contested by Karl Williamson (3.7 feet, MAN). DESMOND SIMMONS MAKES IT! Assist: Manu Reaves
Score: 81-78

[10:31] Team_073 possession (Score: 81-78)
FOUL! Shooting foul on Malcolm Westbrook. Bradley Morant to the line for 2 free throws. [Team fouls: 2] (Malcolm Westbrook: 2 personal fouls)   FT 1/2: GOOD   FT 2/2: GOOD Bradley Morant makes 2/2 from the line.
Score: 81-80

[10:17] Team_067 possession (Score: 81-80)
FOUL! Shooting foul on Karl Williamson. Manu Reaves to the line for 2 free throws. [Team fouls: 1] (Karl Williamson: 1 personal fouls)   FT 1/2: GOOD   FT 2/2: MISS Manu Reaves makes 1/2 from the line. Offensive rebound by Desmond Simmons! Desmond Simmons kicks it out.
Score: 82-80

[10:03] Team_067 possession (Score: 82-80)
Malcolm Westbrook drives and kicks out. Malcolm Westbrook attempts a 3Pt. Contested by Bradley Morant (4.4 feet, MAN). Malcolm Westbrook misses. Rebound secured by Isaiah Smith.

[09:45] Team_073 possession (Score: 82-80)
Isaiah Smith attempts a Midrange. Contested by Wendell Antetokounmpo (5.3 feet, ZONE). Isaiah Smith misses. Offensive rebound by Bradley Morant! Bradley Morant kicks it out.

[09:30] Team_073 possession (Score: 82-80)
FOUL! Shooting foul on Desmond Simmons. Karl Williamson to the line for 3 free throws. [Team fouls: 3] (Desmond Simmons: 1 personal fouls)   FT 1/3: GOOD   FT 2/3: GOOD   FT 3/3: GOOD Karl Williamson makes 3/3 from the line.
Score: 82-83

[09:18] Team_067 possession (Score: 82-83)
Wendell Antetokounmpo attempts a Midrange. Contested by Karl Williamson (4.0 feet, ZONE). Wendell Antetokounmpo misses. Rebound secured by Isaiah Smith.

[09:04] Team_073 possession (Score: 82-83)
Karl Williamson drives and kicks out. Bradley Morant attempts a Midrange. Contested by Malcolm Westbrook (4.7 feet, MAN). Bradley Morant misses. Rebound secured by Malcolm Westbrook.

[08:50] Team_067 possession (Score: 82-83)
Manu Reaves attempts a 3Pt. Contested by Karl Williamson (4.1 feet, ZONE). MANU REAVES MAKES IT! Assist: Ben Ball
Score: 85-83

[08:33] Team_073 possession (Score: 85-83)
Carmelo Porzingis attempts a Layup. Contested by Ben Ball (4.7 feet, MAN). CARMELO PORZINGIS MAKES IT! Assist: Carmelo Young
Score: 85-85

[08:20] Team_067 possession (Score: 85-85)
Wendell Antetokounmpo makes the Dunk and draws the foul on Bradley Morant! And-1! Wendell Antetokounmpo to the line for 1. [Team fouls: 2] (Bradley Morant: 1 personal fouls)   FT 1/1: GOOD Wendell Antetokounmpo makes 1/1 from the line.
Score: 88-85

[08:07] Team_073 possession (Score: 88-85)
Bradley Morant loses control! Ball rolls out of bounds! TURNOVER! (dead ball)

[08:07] Substitution (Team_067): Manu Reaves OUT → James Rozier IN (stamina_rule2)

[08:07] Substitution (Team_067): Wendell Antetokounmpo OUT → Anfernee Wagner IN (stamina_rule2)

[08:07] Substitution (Team_067): Desmond Simmons OUT → Kyle Leonard IN (stamina_rule2)

[08:07] Substitution (Team_067): Ben Ball OUT → Kristaps Davis IN (stamina_rule2)

[08:07] Substitution (Team_067): Malcolm Westbrook OUT → Zach DeRozan IN (stamina_rule2)

[08:07] Substitution (Team_073): Carmelo Young OUT → Zach Quickley IN (stamina_rule2)

[08:07] Substitution (Team_073): Isaiah Smith OUT → Luka Butler IN (stamina_rule2)

[08:07] Substitution (Team_073): Karl Williamson OUT → Dwyane McCollum IN (stamina_rule2)

[08:07] Substitution (Team_073): Carmelo Porzingis OUT → Shai Thompson IN (stamina_rule2)

[08:07] Substitution (Team_073): Bradley Morant OUT → Ja Rose IN (stamina_rule2)

[07:54] Team_067 possession (Score: 88-85)
Kyle Leonard attempts a 3Pt. Contested by Luka Butler (4.8 feet, ZONE). Kyle Leonard misses. Rebound secured by Shai Thompson.

[07:38] Team_073 possession (Score: 88-85)
Zach Quickley attempts a 3Pt. Contested by James Rozier (4.3 feet, MAN). ZACH QUICKLEY MAKES IT! Assist: Luka Butler
Score: 88-88

[07:22] Team_067 possession (Score: 88-88)
Anfernee Wagner drives, Shai Thompson stays with him. Anfernee Wagner attempts a Layup. Contested by Shai Thompson (3.6 feet, ZONE). ANFERNEE WAGNER MAKES IT! Assist: Kristaps Davis
Score: 90-88

[07:08] Team_073 possession (Score: 90-88)
Dwyane McCollum attempts a Layup. BLOCKED BY KYLE LEONARD! Ball is loose! Rebound secured by Anfernee Wagner.

[06:49] Team_067 possession (Score: 90-88)
Anfernee Wagner attempts a 3Pt. Contested by Luka Butler (4.2 feet, ZONE). ANFERNEE WAGNER MAKES IT! Assist: James Rozier
Score: 93-88

[06:34] Team_073 possession (Score: 93-88)
Luka Butler attempts a 3Pt. Contested by Anfernee Wagner (4.2 feet, ZONE). LUKA BUTLER MAKES IT!
Score: 93-91

[06:20] Team_067 possession (Score: 93-91)
Kyle Leonard attempts a 3Pt. Contested by Luka Butler (4.8 feet, ZONE). Kyle Leonard misses. Rebound secured by Shai Thompson.

[06:07] Team_073 possession (Score: 93-91)
Dwyane McCollum attempts a 3Pt. Contested by Anfernee Wagner (3.7 feet, ZONE). Dwyane McCollum misses. Offensive rebound by Dwyane McCollum! Dwyane McCollum puts it back in!
Score: 93-93

[05:54] Team_067 possession (Score: 93-93)
James Rozier makes the Layup and draws the foul on Zach Quickley! And-1! James Rozier to the line for 1. [Team fouls: 3] (Zach Quickley: 1 personal fouls)   FT 1/1: GOOD James Rozier makes 1/1 from the line.
Score: 96-93

[05:42] Team_073 possession (Score: 96-93)
Zach Quickley attempts a Midrange. Contested by James Rozier (4.3 feet, MAN). Zach Quickley misses. Rebound secured by Anfernee Wagner.

[05:28] Team_067 possession (Score: 96-93)
Zach DeRozan drives and kicks out. Kyle Leonard attempts a 3Pt. Contested by Dwyane McCollum (4.1 feet, MAN). Kyle Leonard misses. Rebound secured by Dwyane McCollum.

[05:10] Team_073 possession (Score: 96-93)
FOUL! Shooting foul on Zach DeRozan. Ja Rose to the line for 2 free throws. [Team fouls: 4] (Zach DeRozan: 1 personal fouls)   FT 1/2: GOOD   FT 2/2: GOOD Ja Rose makes 2/2 from the line.
Score: 96-95

[04:54] Team_067 possession (Score: 96-95)
Anfernee Wagner attempts a Layup. Contested by Shai Thompson (3.6 feet, ZONE). Anfernee Wagner misses. Rebound secured by Shai Thompson.

[04:41] Team_073 possession (Score: 96-95)
Dwyane McCollum drives and kicks out. Luka Butler attempts a 3Pt. Contested by Kristaps Davis (4.3 feet, ZONE). Luka Butler misses. Rebound secured by Anfernee Wagner.

[04:24] Team_067 possession (Score: 96-95)
Kyle Leonard attempts a Layup. Contested by Dwyane McCollum (4.5 feet, MAN). Kyle Leonard misses. Rebound secured by Shai Thompson.

[04:14] Team_073 possession (Score: 96-95)
Zach Quickley attempts a 3Pt. Contested by Anfernee Wagner (4.0 feet, ZONE). ZACH QUICKLEY MAKES IT! Assist: Ja Rose
Score: 96-98

[03:57] Team_067 possession (Score: 96-98)
Anfernee Wagner drives to the basket... FOUL! Offensive foul on Anfernee Wagner! Shai Thompson drew the charge! [Team fouls: 5] (Anfernee Wagner: 1 personal fouls) TURNOVER! (dead ball)

[03:43] Team_073 possession (Score: 96-98)
Dwyane McCollum attempts a Midrange. Contested by Anfernee Wagner (3.7 feet, ZONE). DWYANE MCCOLLUM MAKES IT! Assist: Shai Thompson
Score: 96-100

[03:28] Team_067 possession (Score: 96-100)
Zach DeRozan drives and kicks out. Kristaps Davis makes the Midrange and draws the foul on Zach Quickley! And-1! Kristaps Davis to the line for 1. [Team fouls: 4] (Zach Quickley: 2 personal fouls)   FT 1/1: GOOD Kristaps Davis makes 1/1 from the line.
Score: 99-100

[03:17] Team_073 possession (Score: 99-100)
Dwyane McCollum drives to the basket... Dwyane McCollum loses the ball! Stripped by Kyle Leonard! TURNOVER! (live ball)

[03:03] Team_067 possession (Score: 99-100)
Anfernee Wagner attempts a 3Pt. Contested by Luka Butler (4.2 feet, ZONE). Anfernee Wagner misses. Rebound secured by Ja Rose.

[02:50] Team_073 possession (Score: 99-100)
Dwyane McCollum drives, Kristaps Davis stays with him. Dwyane McCollum attempts a Dunk. Contested by Kristaps Davis (4.3 feet, ZONE). Dwyane McCollum misses. FOUL! Loose ball foul on Zach DeRozan during the rebound battle. [IN THE BONUS! 6 team fouls] Ja Rose to the line for 2 free throws. (Zach DeRozan: 2 personal fouls)   FT 1/2: GOOD   FT 2/2: GOOD Ja Rose makes 2/2 from the line.
Score: 99-102

[02:34] Team_067 possession (Score: 99-102)
Zach DeRozan makes the Layup and draws the foul on Ja Rose! And-1! Zach DeRozan to the line for 1. [BONUS: 5 team fouls] (Ja Rose: 1 personal fouls)   FT 1/1: GOOD Zach DeRozan makes 1/1 from the line.
Score: 102-102

[02:21] Team_073 possession (Score: 102-102)
Ja Rose attempts a Midrange. Contested by Zach DeRozan (5.3 feet, MAN). Ja Rose misses. Rebound secured by Anfernee Wagner.

[02:07] Team_067 possession (Score: 102-102)
FOUL! Holding foul on Ja Rose. [IN THE BONUS! 6 team fouls] Zach DeRozan to the line for 2 free throws. (Ja Rose: 2 personal fouls)   FT 1/2: GOOD   FT 2/2: GOOD Zach DeRozan makes 2/2 from the line.
Score: 104-102

[01:49] Team_073 possession (Score: 104-102)
Luka Butler attempts a 3Pt. Contested by Anfernee Wagner (4.2 feet, MAN). LUKA BUTLER MAKES IT! Assist: Zach Quickley
Score: 104-105

[01:33] Team_067 possession (Score: 104-105)
Kyle Leonard attempts a 3Pt. Contested by Luka Butler (4.9 feet, ZONE). Kyle Leonard misses. FOUL! Loose ball foul on Shai Thompson during the rebound battle. [IN THE BONUS! 7 team fouls] Kristaps Davis to the line for 2 free throws. (Shai Thompson: 1 personal fouls)   FT 1/2: GOOD   FT 2/2: MISS Kristaps Davis makes 1/2 from the line. FOUL! Loose ball foul on Shai Thompson during the free throw rebound! [IN THE BONUS! 8 team fouls] Kristaps Davis to the line for 2 free throws. (Shai Thompson: 2 personal fouls)   FT 1/2: GOOD   FT 2/2: MISS Kristaps Davis makes 1/2 from the line. Offensive rebound by Kristaps Davis! Kristaps Davis puts it back in!
Score: 108-105

[01:23] Team_073 possession (Score: 108-105)
Ja Rose attempts a 3Pt. Contested by Anfernee Wagner (3.8 feet, ZONE). Ja Rose misses. Rebound secured by Kristaps Davis.

[01:05] Team_067 possession (Score: 108-105)
Kyle Leonard drives and kicks out. Zach DeRozan attempts a 3Pt. Contested by Luka Butler (4.5 feet, ZONE). ZACH DEROZAN MAKES IT! Assist: Kyle Leonard
Score: 111-105

[00:53] Team_073 possession (Score: 111-105)
Ja Rose drives, Zach DeRozan stays with him. Ja Rose attempts a Dunk. Contested by Zach DeRozan (5.4 feet, MAN). Ja Rose misses. Offensive rebound by Dwyane McCollum! Dwyane McCollum puts it back in!
Score: 111-107

[00:39] Team_067 possession (Score: 111-107)
Kyle Leonard attempts a 3Pt. Contested by Dwyane McCollum (4.6 feet, MAN). Kyle Leonard misses. Rebound secured by Dwyane McCollum.

[00:26] Team_073 possession (Score: 111-107)
Luka Butler drives, Anfernee Wagner stays with him. Luka Butler attempts a Dunk. Contested by Anfernee Wagner (4.3 feet, MAN). LUKA BUTLER MAKES IT!
Score: 111-109

[00:13] Team_067 possession (Score: 111-109)
James Rozier attempts a Midrange. Contested by Zach Quickley (4.5 feet, MAN). JAMES ROZIER MAKES IT!
Score: 113-109

================================================================================
                              4TH QUARTER COMPLETE                              
================================================================================

4TH QUARTER SCORE: Team_067 34, Team_073 35

BOX SCORE:
================================================================================

Team_067
--------------------------------------------------------------------------------
Player                MIN  PTS  REB  AST  TO      FG   FG%      3P   3P%
--------------------------------------------------------------------------------
Zach DeRozan           19    8    0    0   0   3/4    75.0     0/0   0.0
Kristaps Davis         19    7    2    1   0   2/2   100.0     0/0   0.0
Anfernee Wagner        19    5    4    0   0   2/4    50.0     0/0   0.0
James Rozier           19    5    0    1   0   2/2   100.0     0/0   0.0
Wendell Antetokounmpo   30    3    0    0   0   1/4    25.0     0/0   0.0
Manu Reaves            30    3    0    1   0   1/2    50.0     0/0   0.0
Desmond Simmons        30    2    1    0   0   1/1   100.0     0/0   0.0
Malcolm Westbrook      30    0    1    0   0   0/1     0.0     0/0   0.0
Ben Ball               30    0    0    1   0   0/0     0.0     0/0   0.0
Kyle Leonard           19    0    0    1   0   0/4     0.0     0/0   0.0

TEAM: FG: 12/24 (50.0%), 3PT: 3/8 (37.5%), REB: 8 (2 off, 6 def), AST: 5, TO: 1
TEAM FOULS: 6 [Team_073 in BONUS]


Team_073
--------------------------------------------------------------------------------
Player                MIN  PTS  REB  AST  TO      FG   FG%      3P   3P%
--------------------------------------------------------------------------------
Luka Butler            19    8    0    1   0   3/3   100.0     0/0   0.0
Karl Williamson        30    6    0    0   0   2/3    66.7     0/0   0.0
Zach Quickley          19    6    0    1   0   2/3    66.7     0/0   0.0
Dwyane McCollum        19    6    4    0   0   3/5    60.0     0/0   0.0
Ja Rose                19    4    1    1   0   2/4    50.0     0/0   0.0
Bradley Morant         30    2    3    0   0   1/1   100.0     0/0   0.0
Carmelo Porzingis      30    2    0    1   0   1/1   100.0     0/0   0.0
Carmelo Young          30    1    0    1   0   1/1   100.0     0/0   0.0
Isaiah Smith           30    0    3    0   0   0/0     0.0     0/0   0.0
Shai Thompson          19    0    4    1   0   0/0     0.0     0/0   0.0

TEAM: FG: 15/21 (71.4%), 3PT: 7/8 (87.5%), REB: 15 (3 off, 12 def), AST: 6, TO: 3
TEAM FOULS: 8 [Team_067 in BONUS]

================================================================================

================================================================================
                               FULL GAME COMPLETE                               
================================================================================

FINAL SCORE: Team_067 113, Team_073 109

SCORING BY QUARTER:
--------------------------------------------------------------------------------
Team                     Q1     Q2     Q3     Q4    FINAL
--------------------------------------------------------------------------------
Team_067                 23     25     31     34      113
Team_073                 23     19     32     35      109
--------------------------------------------------------------------------------

FULL GAME BOX SCORE:
================================================================================

Team_067
--------------------------------------------------------------------------------
Player                MIN  PTS  REB  AST  TO      FG   FG%      3P   3P%      FT STL BLK
--------------------------------------------------------------------------------
Manu Reaves            30   12    1    5   1   5/8    62.5   4/5    80.0   1/2     0   0
Wendell Antetokounmpo   30    6    6    3   0   2/9    22.2   0/5     0.0   1/1     1   0
Desmond Simmons        30   16    6    3   1   7/12   58.3   1/6    16.7   1/1     1   0
Ben Ball               30   15    0    1   0   8/10   80.0   1/2    50.0   2/2     0   0
Malcolm Westbrook      30   16    9    1   0   5/12   41.7   2/3    66.7   3/4     1   1
James Rozier           19    8    0    2   0   4/6    66.7   0/1     0.0   2/3     0   0
Anfernee Wagner        19    9    7    0   1   4/6    66.7   1/2    50.0   2/2     1   0
Kyle Leonard           19    4    0    1   1   4/10   40.0   1/5    20.0   0/0     1   1
Kristaps Davis         19   14    7    2   1   3/5    60.0   0/1     0.0   3/4     1   0
Zach DeRozan           19   10    3    2   1   3/6    50.0   0/0     0.0   3/3     0   0

TEAM: FG: 46/85 (54.1%), 3PT: 10/30 (33.3%), REB: 41 (8 off, 33 def), AST: 20, TO: 6


Team_073
--------------------------------------------------------------------------------
Player                MIN  PTS  REB  AST  TO      FG   FG%      3P   3P%      FT STL BLK
--------------------------------------------------------------------------------
Carmelo Young          30   10    0    3   1   4/6    66.7   0/2     0.0   4/5     0   0
Isaiah Smith           30    2    7    3   2   0/5     0.0   0/2     0.0   3/5     0   0
Karl Williamson        30   15    0    4   1   5/10   50.0   2/2   100.0   6/7     0   1
Carmelo Porzingis      30   18   11    1   3   8/12   66.7   1/4    25.0   5/6     0   0
Bradley Morant         30   17   13    0   1   9/11   81.8   0/0     0.0   5/5     1   0
Zach Quickley          19    9    0    1   0   3/5    60.0   3/3   100.0   1/2     1   0
Luka Butler            19    8    0    1   2   3/5    60.0   2/2   100.0   0/0     0   1
Dwyane McCollum        19    8    7    1   0   4/9    44.4   1/4    25.0   2/2     0   0
Shai Thompson          19    4    6    2   0   2/3    66.7   0/0     0.0   2/2     2   0
Ja Rose                19   11    7    1   2   5/10   50.0   0/1     0.0   5/5     0   0

TEAM: FG: 44/77 (57.1%), 3PT: 9/20 (45.0%), REB: 49 (12 off, 37 def), AST: 17, TO: 12

================================================================================
