================================================================================
                        FULL GAME - Team_077 vs Team_061                        
================================================================================

================================================================================
                       1ST QUARTER - Team_077 vs Team_061                       
================================================================================

[12:00] Team_077 possession (Score: 0-0)
Russell Harden makes the Layup and draws the foul on Bam Sexton! And-1! Russell Harden to the line for 1. [Team fouls: 1] (Bam Sexton: 1 personal fouls)   FT 1/1: MISS Russell Harden makes 0/1 from the line. Offensive rebound by Draymond Dosunmu! Draymond Dosunmu kicks it out.
Score: 2-0

[11:46] Team_077 possession (Score: 2-0)
Chris Ginobili attempts a 3Pt. Contested by Michael Russell (4.3 feet, MAN). Chris Ginobili misses. FOUL! Loose ball foul on Bam Sexton during the rebound battle. [Team fouls: 2] No free throws, side out. (Bam Sexton: 2 personal fouls)

[11:34] Team_077 possession (Score: 2-0)
Ja Ball attempts a Layup. Contested by Draymond Banchero (3.0 feet, ZONE). Ja Ball misses. Rebound secured by Bam Sexton.

[11:21] Team_061 possession (Score: 2-0)
Brandon Russell attempts a 3Pt. Contested by Dejounte Allen (3.9 feet, ZONE). BRANDON RUSSELL MAKES IT! Assist: Draymond Banchero
Score: 2-3

[11:06] Team_077 possession (Score: 2-3)
Ja Ball drives and kicks out. Russell Harden attempts a 3Pt. Contested by Bam Sexton (4.9 feet, MAN). Russell Harden misses. Offensive rebound by Russell Harden! Russell Harden kicks it out.

[10:50] Team_077 possession (Score: 2-3)
Chris Ginobili drives to the basket... Chris Ginobili throws a bad pass! Stolen by Michael Russell! TURNOVER! (live ball)

[10:31] Team_061 possession (Score: 2-3)
Jayson Holiday drives to the basket... Jayson Holiday commits a violation (traveling/carry)! TURNOVER! (dead ball)

[10:15] Team_077 possession (Score: 2-3)
Chris Ginobili attempts a Midrange. Contested by Michael Russell (4.3 feet, MAN). Chris Ginobili misses. Offensive rebound by Russell Harden! Russell Harden kicks it out.

[09:59] Team_077 possession (Score: 2-3)
Russell Harden attempts a Midrange. Contested by Bam Sexton (5.4 feet, ZONE). Russell Harden misses. Rebound secured by Bam Sexton.

[09:45] Team_061 possession (Score: 2-3)
Brandon Russell drives, Ja Ball stays with him. Brandon Russell attempts a Dunk. Contested by Ja Ball (4.3 feet, MAN). Brandon Russell misses. Offensive rebound by Draymond Banchero! Draymond Banchero's putback is no good. Rebound secured by Chris Ginobili.

[09:32] Team_077 possession (Score: 2-3)
Dejounte Allen attempts a 3Pt. Contested by Jayson Holiday (4.4 feet, MAN). Dejounte Allen misses. Rebound secured by Draymond Banchero.

[09:21] Team_061 possession (Score: 2-3)
Draymond Banchero makes the Midrange and draws the foul on Draymond Dosunmu! And-1! Draymond Banchero to the line for 1. [Team fouls: 1] (Draymond Dosunmu: 1 personal fouls)   FT 1/1: GOOD Draymond Banchero makes 1/1 from the line.
Score: 2-6

[09:06] Team_077 possession (Score: 2-6)
FOUL! Shooting foul on Draymond Banchero. Draymond Dosunmu to the line for 3 free throws. [Team fouls: 3] (Draymond Banchero: 1 personal fouls)   FT 1/3: GOOD   FT 2/3: GOOD   FT 3/3: GOOD Draymond Dosunmu makes 3/3 from the line.
Score: 5-6

[08:52] Team_061 possession (Score: 5-6)
Bam Sexton attempts a Midrange. Contested by Draymond Dosunmu (4.8 feet, ZONE). Bam Sexton misses. Rebound secured by Chris Ginobili.

[08:39] Team_077 possession (Score: 5-6)
Ja Ball attempts a 3Pt. Contested by Brandon Russell (4.3 feet, ZONE). Ja Ball misses. Offensive rebound by Draymond Dosunmu! Draymond Dosunmu kicks it out.

[08:28] Team_077 possession (Score: 5-6)
Chris Ginobili drives and kicks out. Dejounte Allen attempts a 3Pt. Contested by Brandon Russell (3.9 feet, ZONE). Dejounte Allen misses. Rebound secured by Bam Sexton.

[08:14] Team_061 possession (Score: 5-6)
Bam Sexton drives and kicks out. Draymond Banchero attempts a 3Pt. Contested by Dejounte Allen (3.7 feet, ZONE). Draymond Banchero misses. Rebound secured by Draymond Dosunmu.

[07:57] Team_077 possession (Score: 5-6)
Draymond Dosunmu attempts a 3Pt. Contested by Brandon Russell (3.5 feet, ZONE). Draymond Dosunmu misses. Rebound secured by Bam Sexton.

[07:41] Team_061 possession (Score: 5-6)
Michael Russell makes the 3Pt and draws the foul on Dejounte Allen! And-1! Michael Russell to the line for 1. [Team fouls: 2] (Dejounte Allen: 1 personal fouls)   FT 1/1: GOOD Michael Russell makes 1/1 from the line.
Score: 5-10

[07:25] Team_077 possession (Score: 5-10)
Ja Ball drives and kicks out. Chris Ginobili attempts a 3Pt. Contested by Michael Russell (3.7 feet, MAN). Chris Ginobili misses. Rebound secured by Bam Sexton.

[07:10] Team_061 possession (Score: 5-10)
Brandon Russell attempts a 3Pt. Contested by Chris Ginobili (4.0 feet, ZONE). Brandon Russell misses. Offensive rebound by Michael Russell! Michael Russell's putback is no good. Rebound secured by Russell Harden.

[06:56] Team_077 possession (Score: 5-10)
Draymond Dosunmu drives, picks up Draymond Banchero. Help arrives from Jayson Holiday! Draymond Dosunmu attempts a Dunk. Contested by Jayson Holiday (2.3 feet, ZONE). DRAYMOND DOSUNMU MAKES IT! Assist: Dejounte Allen
Score: 7-10

[06:39] Team_061 possession (Score: 7-10)
Brandon Russell attempts a 3Pt. Contested by Ja Ball (4.3 feet, MAN). Brandon Russell misses. Rebound secured by Russell Harden.

[06:25] Team_077 possession (Score: 7-10)
Dejounte Allen attempts a 3Pt. Contested by Jayson Holiday (4.4 feet, MAN). Dejounte Allen misses. Rebound secured by Bam Sexton.

[06:13] Team_061 possession (Score: 7-10)
Brandon Russell throws a bad pass out of bounds! TURNOVER! (dead ball)

[06:02] Team_077 possession (Score: 7-10)
Dejounte Allen attempts a Layup. Contested by Jayson Holiday (4.4 feet, MAN). Dejounte Allen misses. Rebound secured by Draymond Banchero.

[05:44] Team_061 possession (Score: 7-10)
Michael Russell attempts a 3Pt. Contested by Dejounte Allen (4.0 feet, ZONE). Michael Russell misses. Rebound secured by Draymond Dosunmu.

[05:28] Team_077 possession (Score: 7-10)
Chris Ginobili attempts a 3Pt. Contested by Brandon Russell (4.5 feet, ZONE). Chris Ginobili misses. Offensive rebound by Russell Harden! Russell Harden kicks it out.

[05:12] Team_077 possession (Score: 7-10)
Chris Ginobili drives to the basket... Chris Ginobili throws a bad pass out of bounds! TURNOVER! (dead ball)

[05:00] Team_061 possession (Score: 7-10)
Draymond Banchero attempts a Midrange. Contested by Russell Harden (5.1 feet, ZONE). Draymond Banchero misses. Rebound secured by Chris Ginobili.

[04:43] Team_077 possession (Score: 7-10)
Ja Ball attempts a Layup. BLOCKED BY MICHAEL RUSSELL! Ball is loose! Rebound secured by Draymond Banchero.

[04:31] Team_061 possession (Score: 7-10)
FOUL! Reach-in foul on Russell Harden during the drive. [Team fouls: 3] No free throws, side out. (Russell Harden: 1 personal fouls)

[04:15] Team_061 possession (Score: 7-10)
Brandon Russell attempts a 3Pt. Contested by Dejounte Allen (4.0 feet, ZONE). Brandon Russell misses. Rebound secured by Russell Harden.

[04:03] Team_077 possession (Score: 7-10)
Draymond Dosunmu drives to the basket... Draymond Dosunmu loses the ball! Stripped by Draymond Banchero! TURNOVER! (live ball)

[03:48] Team_061 possession (Score: 7-10)
Jayson Holiday drives to the basket... Jayson Holiday throws a bad pass! Stolen by Draymond Dosunmu! TURNOVER! (live ball)

[03:32] Team_077 possession (Score: 7-10)
Draymond Dosunmu attempts a 3Pt. Contested by Brandon Russell (3.6 feet, ZONE). Draymond Dosunmu misses. Rebound secured by Draymond Banchero.

[03:16] Team_061 possession (Score: 7-10)
Jayson Holiday attempts a 3Pt. Contested by Dejounte Allen (4.3 feet, ZONE). Jayson Holiday misses. Offensive rebound by Michael Russell! Michael Russell puts it back in!
Score: 7-12

[03:00] Team_077 possession (Score: 7-12)
FOUL! Shooting foul on Michael Russell. Dejounte Allen to the line for 2 free throws. [Team fouls: 4] (Michael Russell: 1 personal fouls)   FT 1/2: GOOD   FT 2/2: GOOD Dejounte Allen makes 2/2 from the line.
Score: 9-12

[02:44] Team_061 possession (Score: 9-12)
Draymond Banchero drives to the basket... Draymond Banchero loses control! Ball rolls out of bounds! TURNOVER! (dead ball)

[02:44] Substitution (Team_061): Michael Russell OUT → Desmond Morant IN (stamina_rule2)

[02:28] Team_077 possession (Score: 9-12)
Dejounte Allen drives and kicks out. Russell Harden attempts a 3Pt. Contested by Bam Sexton (5.0 feet, ZONE). Russell Harden misses. Rebound secured by Bam Sexton.

[02:14] Team_061 possession (Score: 9-12)
Bam Sexton drives and kicks out. Jayson Holiday attempts a Midrange. Contested by Dejounte Allen (4.0 feet, MAN). Jayson Holiday misses. Rebound secured by Russell Harden.

[01:58] Team_077 possession (Score: 9-12)
Russell Harden attempts a 3Pt. Contested by Bam Sexton (5.6 feet, MAN). Russell Harden misses. Rebound secured by Jayson Holiday.

[01:45] Team_061 possession (Score: 9-12)
Desmond Morant throws a bad pass! Stolen by Chris Ginobili! TURNOVER! (live ball)

[01:32] Team_077 possession (Score: 9-12)
Dejounte Allen attempts a Layup. Contested by Jayson Holiday (4.8 feet, MAN). DEJOUNTE ALLEN MAKES IT! Assist: Draymond Dosunmu
Score: 11-12

[01:21] Team_061 possession (Score: 11-12)
Desmond Morant attempts a 3Pt. Contested by Dejounte Allen (4.4 feet, ZONE). Desmond Morant misses. Rebound secured by Russell Harden.

[01:09] Team_077 possession (Score: 11-12)
Dejounte Allen attempts a Layup. Contested by Draymond Banchero (3.4 feet, ZONE). Dejounte Allen misses. Rebound secured by Draymond Banchero.

[00:53] Team_061 possession (Score: 11-12)
Jayson Holiday attempts a Midrange. Contested by Dejounte Allen (4.5 feet, ZONE). Jayson Holiday misses. Rebound secured by Russell Harden.

[00:40] Team_077 possession (Score: 11-12)
Russell Harden attempts a 3Pt. Contested by Brandon Russell (4.7 feet, ZONE). Russell Harden misses. Rebound secured by Bam Sexton.

[00:27] Team_061 possession (Score: 11-12)
Jayson Holiday attempts a 3Pt. Contested by Dejounte Allen (4.5 feet, ZONE). JAYSON HOLIDAY MAKES IT! Assist: Bam Sexton
Score: 11-15

[00:14] Team_077 possession (Score: 11-15)
Dejounte Allen attempts a 3Pt. Contested by Jayson Holiday (4.9 feet, MAN). DEJOUNTE ALLEN MAKES IT! Assist: Russell Harden
Score: 14-15

================================================================================
                              1ST QUARTER COMPLETE                              
================================================================================

1ST QUARTER SCORE: Team_077 14, Team_061 15

BOX SCORE:
================================================================================

Team_077
--------------------------------------------------------------------------------
Player                MIN  PTS  REB  AST  TO      FG   FG%      3P   3P%
--------------------------------------------------------------------------------
Dejounte Allen         12    7    0    1   0   3/8    37.5     0/0   0.0
Draymond Dosunmu       12    5    4    1   0   2/4    50.0     0/0   0.0
Russell Harden         12    0   10    1   0   0/3     0.0     0/0   0.0
Ja Ball                12    0    0    0   0   0/3     0.0     0/0   0.0
Chris Ginobili         12    0    3    0   0   0/1     0.0     0/0   0.0

TEAM: FG: 5/19 (26.3%), 3PT: 2/8 (25.0%), REB: 15 (6 off, 9 def), AST: 3, TO: 3
TEAM FOULS: 3


Team_061
--------------------------------------------------------------------------------
Player                MIN  PTS  REB  AST  TO      FG   FG%      3P   3P%
--------------------------------------------------------------------------------
Michael Russell        10    6    1    0   0   2/3    66.7     0/0   0.0
Brandon Russell        12    3    0    0   0   1/5    20.0     0/0   0.0
Draymond Banchero      12    3    5    1   0   1/2    50.0     0/0   0.0
Jayson Holiday         12    3    1    0   0   1/2    50.0     0/0   0.0
Bam Sexton             12    0    8    1   0   0/3     0.0     0/0   0.0
Desmond Morant          2    0    0    0   0   0/1     0.0     0/0   0.0

TEAM: FG: 5/16 (31.2%), 3PT: 4/9 (44.4%), REB: 17 (3 off, 14 def), AST: 2, TO: 5
TEAM FOULS: 4

================================================================================

================================================================================
                       2ND QUARTER - Team_077 vs Team_061                       
================================================================================

[12:00] Team_077 possession (Score: 14-15)
Dejounte Allen attempts a Layup. Contested by Jayson Holiday (4.7 feet, MAN). DEJOUNTE ALLEN MAKES IT! Assist: Ja Ball
Score: 16-15

[11:49] Team_061 possession (Score: 16-15)
Bam Sexton attempts a 3Pt. Contested by Russell Harden (5.2 feet, MAN). Bam Sexton misses. Rebound secured by Russell Harden.

[11:33] Team_077 possession (Score: 16-15)
Ja Ball attempts a Midrange. Contested by Brandon Russell (4.5 feet, MAN). Ja Ball misses. Rebound secured by Michael Russell.

[11:17] Team_061 possession (Score: 16-15)
Bam Sexton makes the Dunk and draws the foul on Russell Harden! And-1! Bam Sexton to the line for 1. [Team fouls: 1] (Russell Harden: 1 personal fouls)   FT 1/1: GOOD Bam Sexton makes 1/1 from the line.
Score: 16-18

[11:02] Team_077 possession (Score: 16-18)
Dejounte Allen attempts a 3Pt. Contested by Jayson Holiday (4.8 feet, MAN). Dejounte Allen misses. Rebound secured by Michael Russell.

[10:52] Team_061 possession (Score: 16-18)
FOUL! Shooting foul on Dejounte Allen. Jayson Holiday to the line for 2 free throws. [Team fouls: 2] (Dejounte Allen: 1 personal fouls)   FT 1/2: GOOD   FT 2/2: GOOD Jayson Holiday makes 2/2 from the line.
Score: 16-20

[10:41] Team_077 possession (Score: 16-20)
Dejounte Allen attempts a Layup. BLOCKED BY DRAYMOND BANCHERO! Ball deflects out of bounds off Dejounte Allen.

[10:23] Team_061 possession (Score: 16-20)
Jayson Holiday throws a bad pass out of bounds! TURNOVER! (dead ball)

[10:23] Substitution (Team_077): Ja Ball OUT → Bam Bryant IN (stamina_rule2)

[10:23] Substitution (Team_077): Dejounte Allen OUT → Dejounte Quickley IN (stamina_rule2)

[10:23] Substitution (Team_077): Chris Ginobili OUT → Tyler Poole IN (stamina_rule2)

[10:23] Substitution (Team_077): Russell Harden OUT → Jordan Simmons IN (stamina_rule2)

[10:23] Substitution (Team_077): Draymond Dosunmu OUT → Ayo Griffin IN (stamina_rule2)

[10:23] Substitution (Team_061): Brandon Russell OUT → Evan Rose IN (stamina_rule2)

[10:23] Substitution (Team_061): Jayson Holiday OUT → Gary Fox IN (stamina_rule2)

[10:23] Substitution (Team_061): Bam Sexton OUT → Stephen Towns IN (stamina_rule2)

[10:23] Substitution (Team_061): Draymond Banchero OUT → Tim Durant IN (stamina_rule2)

[10:06] Team_077 possession (Score: 16-20)
Tyler Poole attempts a 3Pt. Contested by Michael Russell (4.3 feet, MAN). Tyler Poole misses. Rebound secured by Stephen Towns.

[09:48] Team_061 possession (Score: 16-20)
Gary Fox attempts a 3Pt. Contested by Dejounte Quickley (4.3 feet, ZONE). Gary Fox misses. Rebound secured by Ayo Griffin.

[09:37] Team_077 possession (Score: 16-20)
Dejounte Quickley throws a bad pass! Stolen by Gary Fox! TURNOVER! (live ball)

[09:21] Team_061 possession (Score: 16-20)
Tim Durant drives, Ayo Griffin stays with him. Tim Durant attempts a Layup. Contested by Ayo Griffin (5.3 feet, MAN). TIM DURANT MAKES IT! Assist: Evan Rose
Score: 16-22

[09:03] Team_077 possession (Score: 16-22)
Dejounte Quickley drives to the basket... Dejounte Quickley loses control! Ball rolls out of bounds! TURNOVER! (dead ball)

[09:03] Substitution (Team_061): Michael Russell OUT → Desmond Morant IN (stamina_rule2)

[08:47] Team_061 possession (Score: 16-22)
FOUL! Shooting foul on Jordan Simmons. Desmond Morant to the line for 2 free throws. [Team fouls: 3] (Jordan Simmons: 1 personal fouls)   FT 1/2: GOOD   FT 2/2: GOOD Desmond Morant makes 2/2 from the line.
Score: 16-24

[08:37] Team_077 possession (Score: 16-24)
Dejounte Quickley attempts a 3Pt. Wide open! Gary Fox is 6.0 feet away. [MAN] Dejounte Quickley misses. Rebound secured by Desmond Morant.

[08:23] Team_061 possession (Score: 16-24)
Evan Rose drives and kicks out. Gary Fox attempts a Midrange. Contested by Dejounte Quickley (4.3 feet, MAN). Gary Fox misses. Rebound secured by Jordan Simmons.

[08:08] Team_077 possession (Score: 16-24)
Tyler Poole attempts a 3Pt. Contested by Desmond Morant (4.9 feet, ZONE). TYLER POOLE MAKES IT! Assist: Jordan Simmons
Score: 19-24

[07:53] Team_061 possession (Score: 19-24)
Evan Rose attempts a 3Pt. Wide open! Bam Bryant is 6.3 feet away. [MAN] Evan Rose misses. Rebound secured by Ayo Griffin.

[07:39] Team_077 possession (Score: 19-24)
Bam Bryant drives and kicks out. Tyler Poole makes the Midrange and draws the foul on Gary Fox! And-1! Tyler Poole to the line for 1. [Team fouls: 1] (Gary Fox: 1 personal fouls)   FT 1/1: GOOD Tyler Poole makes 1/1 from the line.
Score: 22-24

[07:25] Team_061 possession (Score: 22-24)
Tim Durant attempts a 3Pt. Contested by Ayo Griffin (5.3 feet, MAN). Tim Durant misses. Rebound secured by Ayo Griffin.

[07:10] Team_077 possession (Score: 22-24)
Bam Bryant attempts a Midrange. Contested by Desmond Morant (4.6 feet, ZONE). Bam Bryant misses. Rebound secured by Tim Durant.

[06:54] Team_061 possession (Score: 22-24)
FOUL! Holding foul on Jordan Simmons. [Team fouls: 4] No free throws, side out. (Jordan Simmons: 2 personal fouls)

[06:42] Team_061 possession (Score: 22-24)
Tim Durant attempts a 3Pt. Contested by Dejounte Quickley (4.8 feet, ZONE). Tim Durant misses. Offensive rebound by Tim Durant! Tim Durant puts it back in!
Score: 22-26

[06:24] Team_077 possession (Score: 22-26)
Bam Bryant attempts a Layup. Contested by Evan Rose (5.1 feet, MAN). BAM BRYANT MAKES IT! Assist: Tyler Poole
Score: 24-26

[06:11] Team_061 possession (Score: 24-26)
Stephen Towns attempts a Layup. Contested by Jordan Simmons (4.3 feet, MAN). Stephen Towns misses. Rebound secured by Ayo Griffin.

[06:00] Team_077 possession (Score: 24-26)
Bam Bryant attempts a Midrange. Contested by Evan Rose (5.1 feet, MAN). Bam Bryant misses. Rebound secured by Desmond Morant.

[05:41] Team_061 possession (Score: 24-26)
Gary Fox attempts a 3Pt. Contested by Dejounte Quickley (4.3 feet, ZONE). Gary Fox misses. Rebound secured by Tyler Poole.

[05:26] Team_077 possession (Score: 24-26)
Tyler Poole attempts a 3Pt. Contested by Desmond Morant (4.9 feet, ZONE). Tyler Poole misses. Rebound secured by Tim Durant.

[05:13] Team_061 possession (Score: 24-26)
FOUL! Shooting foul on Tyler Poole. Tim Durant to the line for 2 free throws. [BONUS: 5 team fouls] (Tyler Poole: 1 personal fouls)   FT 1/2: MISS   FT 2/2: GOOD Tim Durant makes 1/2 from the line.
Score: 24-27

[04:59] Team_077 possession (Score: 24-27)
Dejounte Quickley attempts a Midrange. Wide open! Gary Fox is 6.0 feet away. [MAN] Dejounte Quickley misses. FOUL! Loose ball foul on Tim Durant during the rebound battle. [Team fouls: 2] No free throws, side out. (Tim Durant: 1 personal fouls)

[04:44] Team_077 possession (Score: 24-27)
Bam Bryant makes the Dunk and draws the foul on Tim Durant! And-1! Bam Bryant to the line for 1. [Team fouls: 3] (Tim Durant: 2 personal fouls)   FT 1/1: GOOD Bam Bryant makes 1/1 from the line.
Score: 27-27

[04:33] Team_061 possession (Score: 27-27)
Tim Durant attempts a Midrange. Contested by Ayo Griffin (5.3 feet, MAN). Tim Durant misses. Rebound secured by Jordan Simmons.

[04:20] Team_077 possession (Score: 27-27)
Jordan Simmons drives, Stephen Towns stays with him. Jordan Simmons attempts a Layup. Contested by Stephen Towns (5.3 feet, MAN). JORDAN SIMMONS MAKES IT!
Score: 29-27

[04:10] Team_061 possession (Score: 29-27)
Evan Rose attempts a 3Pt. Contested by Dejounte Quickley (4.5 feet, ZONE). EVAN ROSE MAKES IT! Assist: Stephen Towns
Score: 29-30

[03:54] Team_077 possession (Score: 29-30)
Tyler Poole attempts a 3Pt. Contested by Desmond Morant (4.9 feet, MAN). TYLER POOLE MAKES IT! Assist: Dejounte Quickley
Score: 32-30

[03:40] Team_061 possession (Score: 32-30)
Evan Rose drives, picks up Bam Bryant. Help arrives from Tyler Poole! Evan Rose attempts a Dunk. Wide open! Tyler Poole is 6.3 feet away. [MAN] EVAN ROSE MAKES IT! Assist: Desmond Morant
Score: 32-32

[03:25] Team_077 possession (Score: 32-32)
Dejounte Quickley loses the ball! Stripped by Gary Fox! TURNOVER! (live ball)

[03:14] Team_061 possession (Score: 32-32)
Gary Fox drives, Dejounte Quickley stays with him. Gary Fox attempts a Layup. Contested by Dejounte Quickley (4.3 feet, MAN). Gary Fox misses. Rebound secured by Tyler Poole.

[03:04] Team_077 possession (Score: 32-32)
Bam Bryant drives and kicks out. FOUL! Shooting foul on Desmond Morant. Tyler Poole to the line for 3 free throws. [Team fouls: 4] (Desmond Morant: 1 personal fouls)   FT 1/3: MISS   FT 2/3: GOOD   FT 3/3: GOOD Tyler Poole makes 2/3 from the line.
Score: 34-32

[02:48] Team_061 possession (Score: 34-32)
Desmond Morant drives to the basket... Desmond Morant throws a bad pass out of bounds! TURNOVER! (dead ball)

[02:34] Team_077 possession (Score: 34-32)
Jordan Simmons makes the Dunk and draws the foul on Evan Rose! And-1! Jordan Simmons to the line for 1. [BONUS: 5 team fouls] (Evan Rose: 1 personal fouls)   FT 1/1: GOOD Jordan Simmons makes 1/1 from the line.
Score: 37-32

[02:18] Team_061 possession (Score: 37-32)
Gary Fox attempts a 3Pt. Contested by Dejounte Quickley (4.4 feet, MAN). GARY FOX MAKES IT! Assist: Stephen Towns
Score: 37-35

[02:05] Team_077 possession (Score: 37-35)
FOUL! Holding foul on Tim Durant. [IN THE BONUS! 6 team fouls] Ayo Griffin to the line for 2 free throws. (Tim Durant: 3 personal fouls)   FT 1/2: GOOD   FT 2/2: MISS Ayo Griffin makes 1/2 from the line. Rebound secured by Stephen Towns.
Score: 38-35

[01:50] Team_061 possession (Score: 38-35)
Stephen Towns attempts a Midrange. Contested by Jordan Simmons (4.4 feet, MAN). Stephen Towns misses. Rebound secured by Ayo Griffin.

[01:32] Team_077 possession (Score: 38-35)
Bam Bryant attempts a 3Pt. Contested by Desmond Morant (4.8 feet, ZONE). BAM BRYANT MAKES IT!
Score: 41-35

[01:13] Team_061 possession (Score: 41-35)
Stephen Towns attempts a 3Pt. Contested by Dejounte Quickley (4.7 feet, ZONE). STEPHEN TOWNS MAKES IT! Assist: Tim Durant
Score: 41-38

[01:00] Team_077 possession (Score: 41-38)
Bam Bryant drives, picks up Tim Durant. Help arrives from Evan Rose! Bam Bryant attempts a Layup. Contested by Evan Rose (4.6 feet, ZONE). BAM BRYANT MAKES IT!
Score: 43-38

[00:43] Team_061 possession (Score: 43-38)
Gary Fox attempts a Midrange. Contested by Dejounte Quickley (4.5 feet, MAN). GARY FOX MAKES IT!
Score: 43-40

[00:29] Team_077 possession (Score: 43-40)
Jordan Simmons attempts a 3Pt. Contested by Stephen Towns (5.5 feet, MAN). Jordan Simmons misses. Rebound secured by Tim Durant.

[00:14] Team_061 possession (Score: 43-40)
Evan Rose drives and kicks out. Stephen Towns attempts a Midrange. Contested by Tyler Poole (4.5 feet, ZONE). STEPHEN TOWNS MAKES IT! Assist: Tim Durant
Score: 43-42

[00:03] Team_077 possession (Score: 43-42)
Tyler Poole drives, Desmond Morant stays with him. Tyler Poole attempts a Dunk. Contested by Desmond Morant (5.2 feet, MAN). Tyler Poole misses. Rebound secured by Stephen Towns.

================================================================================
                              2ND QUARTER COMPLETE                              
================================================================================

2ND QUARTER SCORE: Team_077 29, Team_061 27

BOX SCORE:
================================================================================

Team_077
--------------------------------------------------------------------------------
Player                MIN  PTS  REB  AST  TO      FG   FG%      3P   3P%
--------------------------------------------------------------------------------
Tyler Poole            10   11    2    1   0   4/7    57.1     0/0   0.0
Bam Bryant             10   10    0    0   0   4/6    66.7     0/0   0.0
Jordan Simmons         10    5    3    1   0   2/3    66.7     0/0   0.0
Dejounte Allen         14    2    0    0   0   1/3    33.3     0/0   0.0
Ja Ball                14    0    0    1   0   0/1     0.0     0/0   0.0
Russell Harden         14    0    1    0   0   0/0     0.0     0/0   0.0
Ayo Griffin            10    0    5    0   0   0/0     0.0     0/0   0.0
Dejounte Quickley      10    0    0    1   0   0/1     0.0     0/0   0.0

TEAM: FG: 11/22 (50.0%), 3PT: 3/8 (37.5%), REB: 11 (1 off, 10 def), AST: 4, TO: 3
TEAM FOULS: 5 [Team_061 in BONUS]


Team_061
--------------------------------------------------------------------------------
Player                MIN  PTS  REB  AST  TO      FG   FG%      3P   3P%
--------------------------------------------------------------------------------
Stephen Towns          10    5    3    2   0   2/4    50.0     0/0   0.0
Gary Fox               10    5    0    0   0   2/5    40.0     0/0   0.0
Tim Durant             10    5    4    2   0   3/5    60.0     0/0   0.0
Evan Rose              10    5    0    1   0   2/4    50.0     0/0   0.0
Bam Sexton             14    3    0    0   0   1/2    50.0     0/0   0.0
Jayson Holiday         14    2    0    0   0   1/1   100.0     0/0   0.0
Desmond Morant         11    2    2    1   0   1/1   100.0     0/0   0.0
Michael Russell        13    0    2    0   0   0/0     0.0     0/0   0.0

TEAM: FG: 12/22 (54.5%), 3PT: 4/9 (44.4%), REB: 11 (1 off, 10 def), AST: 6, TO: 2
TEAM FOULS: 6 [Team_077 in BONUS]

================================================================================

================================================================================
                       3RD QUARTER - Team_077 vs Team_061                       
================================================================================

[12:00] Team_077 possession (Score: 43-42)
Russell Harden drives, Draymond Banchero stays with him. Russell Harden attempts a Layup. Contested by Draymond Banchero (3.2 feet, ZONE). RUSSELL HARDEN MAKES IT!
Score: 45-42

[11:48] Team_061 possession (Score: 45-42)
Brandon Russell attempts a Layup. Contested by Ja Ball (4.3 feet, MAN). Brandon Russell misses. Rebound secured by Chris Ginobili.

[11:29] Team_077 possession (Score: 45-42)
Chris Ginobili attempts a Layup. Contested by Draymond Banchero (3.2 feet, ZONE). CHRIS GINOBILI MAKES IT! Assist: Dejounte Allen
Score: 47-42

[11:14] Team_061 possession (Score: 47-42)
Michael Russell attempts a 3Pt. Contested by Chris Ginobili (4.0 feet, MAN). MICHAEL RUSSELL MAKES IT! Assist: Draymond Banchero
Score: 47-45

[10:55] Team_077 possession (Score: 47-45)
Russell Harden attempts a Layup. Contested by Bam Sexton (5.4 feet, MAN). RUSSELL HARDEN MAKES IT! Assist: Chris Ginobili
Score: 49-45

[10:39] Team_061 possession (Score: 49-45)
Jayson Holiday attempts a Layup. Contested by Dejounte Allen (4.1 feet, MAN). JAYSON HOLIDAY MAKES IT!
Score: 49-47

[10:22] Team_077 possession (Score: 49-47)
Dejounte Allen attempts a Layup. BLOCKED BY JAYSON HOLIDAY! Ball deflects out of bounds off Dejounte Allen.

[10:07] Team_061 possession (Score: 49-47)
Michael Russell attempts a Layup. Contested by Chris Ginobili (4.0 feet, MAN). MICHAEL RUSSELL MAKES IT! Assist: Draymond Banchero
Score: 49-49

[09:52] Team_077 possession (Score: 49-49)
Chris Ginobili makes the Layup and draws the foul on Jayson Holiday! And-1! Chris Ginobili to the line for 1. [Team fouls: 1] (Jayson Holiday: 1 personal fouls)   FT 1/1: GOOD Chris Ginobili makes 1/1 from the line.
Score: 52-49

[09:35] Team_061 possession (Score: 52-49)
Michael Russell makes the Dunk and draws the foul on Ja Ball! And-1! Michael Russell to the line for 1. [Team fouls: 1] (Ja Ball: 1 personal fouls)   FT 1/1: MISS Michael Russell makes 0/1 from the line. Rebound secured by Russell Harden.
Score: 52-51

[09:18] Team_077 possession (Score: 52-51)
Russell Harden makes the Layup and draws the foul on Jayson Holiday! And-1! Russell Harden to the line for 1. [Team fouls: 2] (Jayson Holiday: 2 personal fouls)   FT 1/1: GOOD Russell Harden makes 1/1 from the line.
Score: 55-51

[09:06] Team_061 possession (Score: 55-51)
Brandon Russell attempts a Layup. Contested by Draymond Dosunmu (4.6 feet, ZONE). Brandon Russell misses. Rebound secured by Russell Harden.

[08:54] Team_077 possession (Score: 55-51)
Chris Ginobili attempts a 3Pt. Contested by Brandon Russell (4.5 feet, ZONE). Chris Ginobili misses. Rebound secured by Bam Sexton.

[08:36] Team_061 possession (Score: 55-51)
Brandon Russell attempts a Midrange. Contested by Ja Ball (4.3 feet, MAN). BRANDON RUSSELL MAKES IT!
Score: 55-53

[08:22] Team_077 possession (Score: 55-53)
Russell Harden loses control! Ball rolls out of bounds! TURNOVER! (dead ball)

[08:08] Team_061 possession (Score: 55-53)
Draymond Banchero drives, picks up Draymond Dosunmu. Help arrives from Ja Ball! Draymond Banchero attempts a Layup. Contested by Ja Ball (5.0 feet, ZONE). DRAYMOND BANCHERO MAKES IT! Assist: Brandon Russell
Score: 55-55

[07:55] Team_077 possession (Score: 55-55)
Dejounte Allen attempts a 3Pt. Contested by Jayson Holiday (4.4 feet, MAN). Dejounte Allen misses. Rebound secured by Michael Russell.

[07:40] Team_061 possession (Score: 55-55)
Bam Sexton attempts a Midrange. Contested by Russell Harden (4.9 feet, MAN). Bam Sexton misses. Rebound secured by Chris Ginobili.

[07:26] Team_077 possession (Score: 55-55)
FOUL! Shooting foul on Michael Russell. Chris Ginobili to the line for 2 free throws. [Team fouls: 3] (Michael Russell: 1 personal fouls)   FT 1/2: MISS   FT 2/2: GOOD Chris Ginobili makes 1/2 from the line.
Score: 56-55

[07:14] Team_061 possession (Score: 56-55)
Michael Russell attempts a Midrange. Contested by Ja Ball (4.4 feet, ZONE). Michael Russell misses. Rebound secured by Draymond Dosunmu.

[06:59] Team_077 possession (Score: 56-55)
Draymond Dosunmu attempts a 3Pt. Contested by Draymond Banchero (2.3 feet, MAN). DRAYMOND DOSUNMU MAKES IT! Assist: Dejounte Allen
Score: 59-55

[06:47] Team_061 possession (Score: 59-55)
Bam Sexton attempts a 3Pt. Contested by Dejounte Allen (4.2 feet, ZONE). Bam Sexton misses. Rebound secured by Russell Harden.

[06:37] Team_077 possession (Score: 59-55)
FOUL! Holding foul on Jayson Holiday. [Team fouls: 4] No free throws, side out. (Jayson Holiday: 3 personal fouls)

[06:24] Team_077 possession (Score: 59-55)
Chris Ginobili attempts a 3Pt. Contested by Michael Russell (4.3 feet, MAN). Chris Ginobili misses. Rebound secured by Michael Russell.

[06:08] Team_061 possession (Score: 59-55)
Bam Sexton attempts a 3Pt. Contested by Russell Harden (4.9 feet, MAN). Bam Sexton misses. Offensive rebound by Draymond Banchero! Draymond Banchero puts it back in!
Score: 59-57

[05:55] Team_077 possession (Score: 59-57)
Russell Harden drives, Draymond Banchero stays with him. Russell Harden attempts a Dunk. Contested by Draymond Banchero (3.2 feet, ZONE). Russell Harden misses. Rebound secured by Michael Russell.

[05:40] Team_061 possession (Score: 59-57)
Brandon Russell attempts a 3Pt. Contested by Ja Ball (4.3 feet, MAN). Brandon Russell misses. Rebound secured by Chris Ginobili.

[05:23] Team_077 possession (Score: 59-57)
FOUL! Shooting foul on Michael Russell. Chris Ginobili to the line for 2 free throws. [BONUS: 5 team fouls] (Michael Russell: 2 personal fouls)   FT 1/2: GOOD   FT 2/2: GOOD Chris Ginobili makes 2/2 from the line.
Score: 61-57

[05:07] Team_061 possession (Score: 61-57)
Jayson Holiday attempts a Midrange. Contested by Dejounte Allen (4.1 feet, ZONE). JAYSON HOLIDAY MAKES IT! Assist: Draymond Banchero
Score: 61-59

[04:55] Team_077 possession (Score: 61-59)
Draymond Dosunmu makes the Midrange and draws the foul on Jayson Holiday! And-1! Draymond Dosunmu to the line for 1. [BONUS: 6 team fouls] (Jayson Holiday: 4 personal fouls)   FT 1/1: GOOD Draymond Dosunmu makes 1/1 from the line.
Score: 64-59

[04:42] Team_061 possession (Score: 64-59)
FOUL! Reach-in foul on Ja Ball during the drive. [Team fouls: 2] No free throws, side out. (Ja Ball: 2 personal fouls)

[04:26] Team_061 possession (Score: 64-59)
Draymond Banchero drives, Draymond Dosunmu stays with him. Draymond Banchero attempts a Layup. Contested by Draymond Dosunmu (5.1 feet, MAN). DRAYMOND BANCHERO MAKES IT! Assist: Bam Sexton
Score: 64-61

[04:13] Team_077 possession (Score: 64-61)
FOUL! Reach-in foul on Draymond Banchero during the drive. [IN THE BONUS! 7 team fouls] Russell Harden to the line for 2 free throws. (Draymond Banchero: 1 personal fouls)   FT 1/2: GOOD   FT 2/2: GOOD Russell Harden makes 2/2 from the line.
Score: 66-61

[03:57] Team_061 possession (Score: 66-61)
Michael Russell drives, Chris Ginobili stays with him. Michael Russell attempts a Dunk. Contested by Chris Ginobili (4.1 feet, MAN). Michael Russell misses. Offensive rebound by Draymond Banchero! Draymond Banchero puts it back in!
Score: 66-63

[03:42] Team_077 possession (Score: 66-63)
Chris Ginobili makes the Layup and draws the foul on Jayson Holiday! And-1! Chris Ginobili to the line for 1. [BONUS: 8 team fouls] (Jayson Holiday: 5 personal fouls)   FT 1/1: MISS Chris Ginobili makes 0/1 from the line. Rebound secured by Draymond Banchero.
Score: 68-63

[03:23] Team_061 possession (Score: 68-63)
Jayson Holiday attempts a Layup. Contested by Draymond Dosunmu (4.9 feet, ZONE). Jayson Holiday misses. Rebound secured by Draymond Dosunmu.

[03:10] Team_077 possession (Score: 68-63)
Dejounte Allen drives, Jayson Holiday stays with him. Dejounte Allen attempts a Dunk. Contested by Jayson Holiday (4.6 feet, MAN). DEJOUNTE ALLEN MAKES IT! Assist: Ja Ball
Score: 70-63

[02:53] Team_061 possession (Score: 70-63)
Jayson Holiday attempts a Midrange. Contested by Dejounte Allen (4.3 feet, MAN). JAYSON HOLIDAY MAKES IT!
Score: 70-65

[02:38] Team_077 possession (Score: 70-65)
Dejounte Allen attempts a 3Pt. Contested by Brandon Russell (4.5 feet, ZONE). Dejounte Allen misses. Offensive rebound by Russell Harden! Russell Harden kicks it out.

[02:23] Team_077 possession (Score: 70-65)
Chris Ginobili attempts a 3Pt. Contested by Brandon Russell (4.6 feet, ZONE). Chris Ginobili misses. Rebound secured by Draymond Banchero.

[02:10] Team_061 possession (Score: 70-65)
Michael Russell drives and kicks out. Michael Russell attempts a Midrange. Contested by Chris Ginobili (4.1 feet, MAN). Michael Russell misses. Offensive rebound by Michael Russell! Michael Russell puts it back in!
Score: 70-67

[01:56] Team_077 possession (Score: 70-67)
Chris Ginobili attempts a 3Pt. Contested by Michael Russell (4.6 feet, MAN). CHRIS GINOBILI MAKES IT! Assist: Dejounte Allen
Score: 73-67

[01:42] Team_061 possession (Score: 73-67)
Jayson Holiday attempts a 3Pt. Contested by Dejounte Allen (4.4 feet, MAN). Jayson Holiday misses. Offensive rebound by Michael Russell! Michael Russell's putback is no good. Offensive rebound by Michael Russell! Michael Russell kicks it out.

[01:32] Team_061 possession (Score: 73-67)
FOUL! Holding foul on Chris Ginobili. [Team fouls: 4] No free throws, side out. (Chris Ginobili: 1 personal fouls)

[01:21] Team_061 possession (Score: 73-67)
Jayson Holiday makes the Layup and draws the foul on Draymond Dosunmu! And-1! Jayson Holiday to the line for 1. [BONUS: 5 team fouls] (Draymond Dosunmu: 1 personal fouls)   FT 1/1: GOOD Jayson Holiday makes 1/1 from the line.
Score: 73-70

[01:09] Team_077 possession (Score: 73-70)
Dejounte Allen attempts a 3Pt. Contested by Brandon Russell (4.6 feet, ZONE). Dejounte Allen misses. Rebound secured by Michael Russell.

[01:00] Team_061 possession (Score: 73-70)
Brandon Russell drives to the basket... Brandon Russell throws a bad pass out of bounds! TURNOVER! (dead ball)

[01:00] Substitution (Team_077): Ja Ball OUT → Bam Bryant IN (stamina_rule2)

[01:00] Substitution (Team_077): Dejounte Allen OUT → Dejounte Quickley IN (stamina_rule2)

[01:00] Substitution (Team_077): Chris Ginobili OUT → Tyler Poole IN (stamina_rule2)

[01:00] Substitution (Team_077): Russell Harden OUT → Jordan Simmons IN (stamina_rule2)

[01:00] Substitution (Team_077): Draymond Dosunmu OUT → Ayo Griffin IN (stamina_rule2)

[01:00] Substitution (Team_061): Brandon Russell OUT → Evan Rose IN (stamina_rule2)

[01:00] Substitution (Team_061): Jayson Holiday OUT → Gary Fox IN (stamina_rule2)

[01:00] Substitution (Team_061): Michael Russell OUT → Desmond Morant IN (stamina_rule2)

[01:00] Substitution (Team_061): Bam Sexton OUT → Stephen Towns IN (stamina_rule2)

[01:00] Substitution (Team_061): Draymond Banchero OUT → Tim Durant IN (stamina_rule2)

[00:43] Team_077 possession (Score: 73-70)
Jordan Simmons attempts a Midrange. Contested by Desmond Morant (4.9 feet, ZONE). JORDAN SIMMONS MAKES IT! Assist: Dejounte Quickley
Score: 75-70

[00:29] Team_061 possession (Score: 75-70)
Gary Fox drives, picks up Dejounte Quickley. Help arrives from Tyler Poole! Gary Fox attempts a Dunk. Contested by Tyler Poole (4.3 feet, MAN). GARY FOX MAKES IT!
Score: 75-72

[00:15] Team_077 possession (Score: 75-72)
Bam Bryant attempts a 3Pt. Contested by Evan Rose (5.1 feet, MAN). Bam Bryant misses. Offensive rebound by Ayo Griffin! Ayo Griffin puts it back in!
Score: 77-72

================================================================================
                              3RD QUARTER COMPLETE                              
================================================================================

3RD QUARTER SCORE: Team_077 34, Team_061 30

BOX SCORE:
================================================================================

Team_077
--------------------------------------------------------------------------------
Player                MIN  PTS  REB  AST  TO      FG   FG%      3P   3P%
--------------------------------------------------------------------------------
Chris Ginobili         25   11    3    1   0   5/9    55.6     0/0   0.0
Russell Harden         25    9    4    0   0   4/5    80.0     0/0   0.0
Draymond Dosunmu       25    6    2    0   0   2/2   100.0     0/0   0.0
Dejounte Allen         25    2    0    3   0   1/4    25.0     0/0   0.0
Jordan Simmons         11    2    0    0   0   1/1   100.0     0/0   0.0
Ayo Griffin            11    2    1    0   0   1/1   100.0     0/0   0.0
Ja Ball                25    0    0    1   0   0/0     0.0     0/0   0.0
Dejounte Quickley      11    0    0    1   0   0/0     0.0     0/0   0.0

TEAM: FG: 14/22 (63.6%), 3PT: 3/8 (37.5%), REB: 10 (2 off, 8 def), AST: 6, TO: 1
TEAM FOULS: 5 [Team_061 in BONUS]


Team_061
--------------------------------------------------------------------------------
Player                MIN  PTS  REB  AST  TO      FG   FG%      3P   3P%
--------------------------------------------------------------------------------
Jayson Holiday         25    9    0    0   0   4/5    80.0     0/0   0.0
Draymond Banchero      25    8    4    3   0   4/4   100.0     0/0   0.0
Michael Russell        24    7    6    0   0   3/5    60.0     0/0   0.0
Brandon Russell        25    2    0    1   0   1/4    25.0     0/0   0.0
Gary Fox               11    2    0    0   0   1/1   100.0     0/0   0.0
Bam Sexton             25    0    1    1   0   0/2     0.0     0/0   0.0

TEAM: FG: 13/21 (61.9%), 3PT: 2/4 (50.0%), REB: 11 (4 off, 7 def), AST: 5, TO: 1
TEAM FOULS: 8 [Team_077 in BONUS]

================================================================================

================================================================================
                       4TH QUARTER - Team_077 vs Team_061                       
================================================================================

[12:00] Team_077 possession (Score: 77-72)
FOUL! Offensive foul on Russell Harden! Bam Sexton drew the charge! [Team fouls: 1] (Russell Harden: 1 personal fouls) TURNOVER! (dead ball)

[11:45] Team_061 possession (Score: 77-72)
Michael Russell attempts a 3Pt. Contested by Dejounte Allen (4.2 feet, ZONE). Michael Russell misses. Rebound secured by Chris Ginobili.

[11:30] Team_077 possession (Score: 77-72)
Russell Harden attempts a 3Pt. Contested by Bam Sexton (5.5 feet, MAN). Russell Harden misses. Rebound secured by Bam Sexton.

[11:17] Team_061 possession (Score: 77-72)
Michael Russell drives and kicks out. Jayson Holiday attempts a 3Pt. Contested by Dejounte Allen (4.0 feet, ZONE). Jayson Holiday misses. Rebound secured by Draymond Dosunmu.

[11:01] Team_077 possession (Score: 77-72)
Ja Ball attempts a 3Pt. Contested by Brandon Russell (4.5 feet, MAN). Ja Ball misses. Offensive rebound by Draymond Dosunmu! Draymond Dosunmu kicks it out.

[10:44] Team_077 possession (Score: 77-72)
Ja Ball attempts a Layup. BLOCKED BY DRAYMOND BANCHERO! Ball goes out off Draymond Banchero. Ja Ball's ball!

[10:29] Team_077 possession (Score: 77-72)
Chris Ginobili attempts a 3Pt. Contested by Brandon Russell (4.6 feet, ZONE). Chris Ginobili misses. Offensive rebound by Russell Harden! Russell Harden kicks it out.

[10:12] Team_077 possession (Score: 77-72)
Ja Ball attempts a Layup. Contested by Draymond Banchero (3.3 feet, ZONE). JA BALL MAKES IT!
Score: 79-72

[10:01] Team_061 possession (Score: 79-72)
Brandon Russell attempts a Midrange. Contested by Chris Ginobili (4.4 feet, ZONE). Brandon Russell misses. Rebound secured by Chris Ginobili.

[09:44] Team_077 possession (Score: 79-72)
Ja Ball attempts a Midrange. BLOCKED BY BRANDON RUSSELL! Ball deflects out of bounds off Ja Ball.

[09:30] Team_061 possession (Score: 79-72)
Jayson Holiday attempts a 3Pt. Contested by Dejounte Allen (4.5 feet, ZONE). Jayson Holiday misses. Rebound secured by Chris Ginobili.

[09:12] Team_077 possession (Score: 79-72)
Dejounte Allen drives, picks up Jayson Holiday. Help arrives from Michael Russell! Dejounte Allen attempts a Layup. Contested by Michael Russell (4.9 feet, MAN). Dejounte Allen misses. Rebound secured by Bam Sexton.

[08:57] Team_061 possession (Score: 79-72)
Bam Sexton attempts a Midrange. Contested by Russell Harden (5.4 feet, MAN). BAM SEXTON MAKES IT!
Score: 79-74

[08:41] Team_077 possession (Score: 79-74)
Ja Ball attempts a 3Pt. Contested by Brandon Russell (4.7 feet, MAN). Ja Ball misses. Rebound secured by Draymond Banchero.

[08:24] Team_061 possession (Score: 79-74)
Michael Russell attempts a 3Pt. Contested by Ja Ball (4.7 feet, ZONE). Michael Russell misses. Rebound secured by Draymond Dosunmu.

[08:12] Team_077 possession (Score: 79-74)
Russell Harden attempts a 3Pt. Contested by Brandon Russell (4.8 feet, ZONE). Russell Harden misses. Rebound secured by Michael Russell.

[07:59] Team_061 possession (Score: 79-74)
Brandon Russell attempts a 3Pt. Contested by Ja Ball (4.8 feet, MAN). Brandon Russell misses. Rebound secured by Chris Ginobili.

[07:43] Team_077 possession (Score: 79-74)
Chris Ginobili attempts a 3Pt. Contested by Michael Russell (5.0 feet, ZONE). Chris Ginobili misses. Rebound secured by Bam Sexton.

[07:32] Team_061 possession (Score: 79-74)
Michael Russell attempts a 3Pt. Contested by Chris Ginobili (4.7 feet, MAN). MICHAEL RUSSELL MAKES IT! Assist: Bam Sexton
Score: 79-77

[07:18] Team_077 possession (Score: 79-77)
Chris Ginobili attempts a Layup. Contested by Michael Russell (5.0 feet, MAN). Chris Ginobili misses. Rebound secured by Bam Sexton.

[07:03] Team_061 possession (Score: 79-77)
FOUL! Shooting foul on Russell Harden. Bam Sexton to the line for 2 free throws. [Team fouls: 2] (Russell Harden: 2 personal fouls)   FT 1/2: GOOD   FT 2/2: MISS Bam Sexton makes 1/2 from the line. Rebound secured by Russell Harden.
Score: 79-78

[06:44] Team_077 possession (Score: 79-78)
Chris Ginobili loses control! Ball rolls out of bounds! TURNOVER! (dead ball)

[06:44] Substitution (Team_077): Ja Ball OUT → Bam Bryant IN (stamina_rule2)

[06:44] Substitution (Team_077): Dejounte Allen OUT → Dejounte Quickley IN (stamina_rule2)

[06:44] Substitution (Team_077): Chris Ginobili OUT → Tyler Poole IN (stamina_rule2)

[06:44] Substitution (Team_077): Russell Harden OUT → Jordan Simmons IN (stamina_rule2)

[06:44] Substitution (Team_077): Draymond Dosunmu OUT → Ayo Griffin IN (stamina_rule2)

[06:44] Substitution (Team_061): Brandon Russell OUT → Evan Rose IN (stamina_rule2)

[06:44] Substitution (Team_061): Jayson Holiday OUT → Gary Fox IN (stamina_rule2)

[06:44] Substitution (Team_061): Michael Russell OUT → Desmond Morant IN (stamina_rule2)

[06:44] Substitution (Team_061): Bam Sexton OUT → Stephen Towns IN (stamina_rule2)

[06:44] Substitution (Team_061): Draymond Banchero OUT → Tim Durant IN (stamina_rule2)

[06:32] Team_061 possession (Score: 79-78)
FOUL! Shooting foul on Dejounte Quickley. Gary Fox to the line for 3 free throws. [Team fouls: 3] (Dejounte Quickley: 1 personal fouls)   FT 1/3: GOOD   FT 2/3: GOOD   FT 3/3: GOOD Gary Fox makes 3/3 from the line.
Score: 79-81

[06:21] Team_077 possession (Score: 79-81)
Tyler Poole attempts a 3Pt. Contested by Desmond Morant (4.9 feet, MAN). Tyler Poole misses. Rebound secured by Stephen Towns.

[06:04] Team_061 possession (Score: 79-81)
Gary Fox attempts a Midrange. Contested by Dejounte Quickley (4.3 feet, MAN). Gary Fox misses. Rebound secured by Ayo Griffin.

[05:49] Team_077 possession (Score: 79-81)
Dejounte Quickley attempts a Layup. Wide open! Gary Fox is 6.0 feet away. [MAN] Dejounte Quickley misses. Rebound secured by Tim Durant.

[05:31] Team_061 possession (Score: 79-81)
FOUL! Reach-in foul on Jordan Simmons during the drive. [Team fouls: 4] No free throws, side out. (Jordan Simmons: 1 personal fouls)

[05:17] Team_061 possession (Score: 79-81)
FOUL! Shooting foul on Tyler Poole. Desmond Morant to the line for 2 free throws. [BONUS: 5 team fouls] (Tyler Poole: 1 personal fouls)   FT 1/2: GOOD   FT 2/2: MISS Desmond Morant makes 1/2 from the line. Rebound secured by Ayo Griffin.
Score: 79-82

[05:01] Team_077 possession (Score: 79-82)
Bam Bryant drives and kicks out. Bam Bryant attempts a Midrange. Contested by Evan Rose (5.0 feet, MAN). Bam Bryant misses. Rebound secured by Stephen Towns.

[04:49] Team_061 possession (Score: 79-82)
Gary Fox attempts a Layup. Contested by Jordan Simmons (4.0 feet, ZONE). Gary Fox misses. Rebound secured by Jordan Simmons.

[04:34] Team_077 possession (Score: 79-82)
Dejounte Quickley attempts a 3Pt. Wide open! Gary Fox is 6.0 feet away. [MAN] Dejounte Quickley misses. Rebound secured by Tim Durant.

[04:15] Team_061 possession (Score: 79-82)
Tim Durant throws a bad pass! Stolen by Ayo Griffin! TURNOVER! (live ball)

[04:02] Team_077 possession (Score: 79-82)
Bam Bryant attempts a 3Pt. Contested by Desmond Morant (4.6 feet, ZONE). BAM BRYANT MAKES IT! Assist: Tyler Poole
Score: 82-82

[03:47] Team_061 possession (Score: 82-82)
Evan Rose attempts a Layup. Contested by Jordan Simmons (4.2 feet, ZONE). EVAN ROSE MAKES IT!
Score: 82-84

[03:35] Team_077 possession (Score: 82-84)
Ayo Griffin loses the ball! Stripped by Tim Durant! TURNOVER! (live ball)

[03:20] Team_061 possession (Score: 82-84)
Stephen Towns attempts a 3Pt. Contested by Jordan Simmons (4.3 feet, MAN). Stephen Towns misses. Rebound secured by Ayo Griffin.

[03:01] Team_077 possession (Score: 82-84)
Ayo Griffin drives and kicks out. Ayo Griffin attempts a 3Pt. Contested by Tim Durant (4.1 feet, MAN). Ayo Griffin misses. Offensive rebound by Jordan Simmons! Jordan Simmons kicks it out.

[02:46] Team_077 possession (Score: 82-84)
Ayo Griffin drives to the basket... Ayo Griffin throws a bad pass out of bounds! TURNOVER! (dead ball)

[02:36] Team_061 possession (Score: 82-84)
Gary Fox drives to the basket... Gary Fox throws a bad pass out of bounds! TURNOVER! (dead ball)

[02:26] Team_077 possession (Score: 82-84)
FOUL! Reach-in foul on Evan Rose during the drive. [Team fouls: 1] No free throws, side out. (Evan Rose: 1 personal fouls)

[02:13] Team_077 possession (Score: 82-84)
Ayo Griffin attempts a Layup. Contested by Tim Durant (4.0 feet, MAN). AYO GRIFFIN MAKES IT! Assist: Dejounte Quickley
Score: 84-84

[01:58] Team_061 possession (Score: 84-84)
FOUL! Shooting foul on Dejounte Quickley. Gary Fox to the line for 2 free throws. [BONUS: 6 team fouls] (Dejounte Quickley: 2 personal fouls)   FT 1/2: GOOD   FT 2/2: GOOD Gary Fox makes 2/2 from the line.
Score: 84-86

[01:44] Team_077 possession (Score: 84-86)
Dejounte Quickley drives to the basket... Dejounte Quickley loses the ball! Stripped by Gary Fox! TURNOVER! (live ball)

[01:27] Team_061 possession (Score: 84-86)
Gary Fox attempts a 3Pt. Contested by Dejounte Quickley (4.3 feet, ZONE). Gary Fox misses. Offensive rebound by Stephen Towns! Stephen Towns kicks it out.

[01:12] Team_061 possession (Score: 84-86)
Tim Durant attempts a Midrange. Contested by Tyler Poole (4.8 feet, ZONE). TIM DURANT MAKES IT!
Score: 84-88

[00:58] Team_077 possession (Score: 84-88)
Bam Bryant drives to the basket... Bam Bryant throws a bad pass out of bounds! TURNOVER! (dead ball)

[00:47] Team_061 possession (Score: 84-88)
FOUL! Reach-in foul on Dejounte Quickley during the drive. [IN THE BONUS! 7 team fouls] Gary Fox to the line for 2 free throws. (Dejounte Quickley: 3 personal fouls)   FT 1/2: GOOD   FT 2/2: GOOD Gary Fox makes 2/2 from the line.
Score: 84-90

[00:30] Team_077 possession (Score: 84-90)
Ayo Griffin attempts a Layup. Contested by Tim Durant (4.0 feet, MAN). AYO GRIFFIN MAKES IT! Assist: Bam Bryant
Score: 86-90

[00:16] Team_061 possession (Score: 86-90)
Tim Durant drives, Jordan Simmons stays with him. Tim Durant attempts a Layup. Contested by Jordan Simmons (4.6 feet, ZONE). Tim Durant misses. Rebound secured by Ayo Griffin.

[00:01] Team_077 possession (Score: 86-90)
Bam Bryant attempts a 3Pt. Contested by Desmond Morant (4.6 feet, ZONE). Bam Bryant misses. Rebound secured by Tim Durant.

================================================================================
                              4TH QUARTER COMPLETE                              
================================================================================

4TH QUARTER SCORE: Team_077 9, Team_061 18

BOX SCORE:
================================================================================

Team_077
--------------------------------------------------------------------------------
Player                MIN  PTS  REB  AST  TO      FG   FG%      3P   3P%
--------------------------------------------------------------------------------
Ayo Griffin            18    4    4    0   0   2/2   100.0     0/0   0.0
Bam Bryant             18    3    0    1   0   1/3    33.3     0/0   0.0
Ja Ball                31    2    0    0   0   1/3    33.3     0/0   0.0
Chris Ginobili         31    0    4    0   0   0/2     0.0     0/0   0.0
Russell Harden         31    0    2    0   0   0/2     0.0     0/0   0.0
Draymond Dosunmu       31    0    3    0   0   0/0     0.0     0/0   0.0
Dejounte Allen         31    0    0    0   0   0/1     0.0     0/0   0.0
Tyler Poole            18    0    0    1   0   0/1     0.0     0/0   0.0
Dejounte Quickley      18    0    0    1   0   0/2     0.0     0/0   0.0
Jordan Simmons         18    0    2    0   0   0/0     0.0     0/0   0.0

TEAM: FG: 4/16 (25.0%), 3PT: 1/8 (12.5%), REB: 15 (3 off, 12 def), AST: 3, TO: 6
TEAM FOULS: 7 [Team_061 in BONUS]


Team_061
--------------------------------------------------------------------------------
Player                MIN  PTS  REB  AST  TO      FG   FG%      3P   3P%
--------------------------------------------------------------------------------
Gary Fox               18    7    0    0   0   3/5    60.0     0/0   0.0
Michael Russell        30    3    1    0   0   1/4    25.0     0/0   0.0
Bam Sexton             31    2    4    1   0   1/2    50.0     0/0   0.0
Tim Durant             18    2    3    0   0   1/2    50.0     0/0   0.0
Evan Rose              18    2    0    0   0   1/1   100.0     0/0   0.0
Brandon Russell        31    0    0    0   0   0/2     0.0     0/0   0.0
Jayson Holiday         31    0    0    0   0   0/1     0.0     0/0   0.0
Draymond Banchero      31    0    1    0   0   0/0     0.0     0/0   0.0
Stephen Towns          18    0    3    0   0   0/1     0.0     0/0   0.0
Desmond Morant         19    0    0    0   0   0/1     0.0     0/0   0.0

TEAM: FG: 7/19 (36.8%), 3PT: 2/7 (28.6%), REB: 12 (1 off, 11 def), AST: 1, TO: 2
TEAM FOULS: 1

================================================================================

================================================================================
                               FULL GAME COMPLETE                               
================================================================================

FINAL SCORE: Team_077 86, Team_061 90

SCORING BY QUARTER:
--------------------------------------------------------------------------------
Team                     Q1     Q2     Q3     Q4    FINAL
--------------------------------------------------------------------------------
Team_077                 14     29     34      9       86
Team_061                 15     27     30     18       90
--------------------------------------------------------------------------------

FULL GAME BOX SCORE:
================================================================================

Team_077
--------------------------------------------------------------------------------
Player                MIN  PTS  REB  AST  TO      FG   FG%      3P   3P%      FT STL BLK
--------------------------------------------------------------------------------
Ja Ball                31    2    0    2   1   1/7    14.3   0/1     0.0   0/0     0   0
Dejounte Allen         31   11    0    4   2   5/16   31.2   1/6    16.7   2/2     0   0
Chris Ginobili         31   11   10    1   1   5/12   41.7   1/5    20.0   4/6     1   0
Russell Harden         31    9   17    1   2   4/10   40.0   0/4     0.0   3/4     0   0
Draymond Dosunmu       31   11    9    1   0   4/6    66.7   2/4    50.0   4/4     1   0
Bam Bryant             18   13    0    1   1   8/12   66.7   3/4    75.0   1/1     0   0
Dejounte Quickley      18    0    0    3   2   0/3     0.0   0/2     0.0   0/0     0   0
Tyler Poole            18   11    2    2   0   2/6    33.3   2/5    40.0   3/4     0   0
Jordan Simmons         18    7    5    1   2   3/4    75.0   0/1     0.0   1/1     0   0
Ayo Griffin            18    6   10    0   2   2/2   100.0   0/0     0.0   1/2     1   0

TEAM: FG: 34/79 (43.0%), 3PT: 9/32 (28.1%), REB: 51 (12 off, 39 def), AST: 16, TO: 13


Team_061
--------------------------------------------------------------------------------
Player                MIN  PTS  REB  AST  TO      FG   FG%      3P   3P%      FT STL BLK
--------------------------------------------------------------------------------
Brandon Russell        31    5    0    1   3   2/11   18.2   1/6    16.7   0/0     0   1
Jayson Holiday         31   14    1    0   2   7/10   70.0   2/3    66.7   3/3     0   1
Bam Sexton             31    5   13    3   0   3/10   30.0   1/3    33.3   2/3     0   0
Draymond Banchero      31   11   10    4   1   3/4    75.0   0/0     0.0   1/1     1   2
Michael Russell        30   16   10    0   0   6/12   50.0   3/6    50.0   1/2     1   1
Desmond Morant         19    2    2    1   2   1/3    33.3   0/1     0.0   3/4     0   0
Evan Rose              18    7    0    1   0   4/6    66.7   1/2    50.0   0/0     0   0
Gary Fox               18   14    0    0   1   6/11   54.5   2/4    50.0   7/7     3   0
Stephen Towns          18    5    6    2   0   1/4    25.0   1/2    50.0   0/0     0   0
Tim Durant             18    7    7    2   1   4/7    57.1   1/2    50.0   1/2     1   0

TEAM: FG: 37/78 (47.4%), 3PT: 12/29 (41.4%), REB: 51 (9 off, 42 def), AST: 14, TO: 10

================================================================================
