================================================================================
                        FULL GAME - Team_065 vs Team_041                        
================================================================================

================================================================================
                       1ST QUARTER - Team_065 vs Team_041                       
================================================================================

[12:00] Team_065 possession (Score: 0-0)
Russell Wade attempts a 3Pt. Contested by Jarrett Anunoby (4.3 feet, ZONE). Russell Wade misses. Rebound secured by Dejounte Griffin.

[11:42] Team_041 possession (Score: 0-0)
Dejounte Griffin attempts a 3Pt. Contested by RJ Harden (3.9 feet, ZONE). Dejounte Griffin misses. Rebound secured by Russell Wade.

[11:31] Team_065 possession (Score: 0-0)
FOUL! Shooting foul on Dejounte Griffin. RJ Harden to the line for 2 free throws. [Team fouls: 1] (Dejounte Griffin: 1 personal fouls)   FT 1/2: GOOD   FT 2/2: GOOD RJ Harden makes 2/2 from the line.
Score: 2-0

[11:19] Team_041 possession (Score: 2-0)
Stephen Ingram attempts a 3Pt. Contested by RJ Harden (4.0 feet, ZONE). Stephen Ingram misses. Offensive rebound by Terry Barrett! Terry Barrett puts it back in!
Score: 2-2

[11:01] Team_065 possession (Score: 2-2)
Manu McGrady attempts a Midrange. Contested by Dejounte Griffin (3.8 feet, MAN). MANU MCGRADY MAKES IT! Assist: Russell Wade
Score: 4-2

[10:47] Team_041 possession (Score: 4-2)
Scottie Turner attempts a 3Pt. Contested by RJ Harden (3.7 feet, MAN). Scottie Turner misses. Rebound secured by RJ Harden.

[10:28] Team_065 possession (Score: 4-2)
Paul Williamson drives and kicks out. Karl Booker attempts a 3Pt. Contested by Scottie Turner (4.1 feet, ZONE). Karl Booker misses. Offensive rebound by Manu McGrady! Manu McGrady kicks it out.

[10:12] Team_065 possession (Score: 4-2)
Russell Wade drives and kicks out. Paul Williamson attempts a 3Pt. Contested by Jarrett Anunoby (4.2 feet, MAN). Paul Williamson misses. Rebound secured by Stephen Ingram.

[09:57] Team_041 possession (Score: 4-2)
Terry Barrett attempts a Midrange. Contested by Paul Williamson (3.6 feet, ZONE). Terry Barrett misses. Rebound secured by RJ Harden.

[09:43] Team_065 possession (Score: 4-2)
Russell Wade attempts a Layup. BLOCKED BY STEPHEN INGRAM! Ball is loose! Rebound secured by Stephen Ingram.

[09:32] Team_041 possession (Score: 4-2)
Terry Barrett drives, Russell Wade stays with him. Terry Barrett attempts a Layup. Contested by Russell Wade (3.2 feet, ZONE). Terry Barrett misses. Rebound secured by RJ Harden.

[09:14] Team_065 possession (Score: 4-2)
RJ Harden attempts a Layup. Contested by Terry Barrett (3.7 feet, ZONE). RJ HARDEN MAKES IT! Assist: Manu McGrady
Score: 6-2

[09:03] Team_041 possession (Score: 6-2)
Terry Barrett attempts a Layup. Contested by Russell Wade (3.2 feet, ZONE). TERRY BARRETT MAKES IT! Assist: Scottie Turner
Score: 6-4

[08:48] Team_065 possession (Score: 6-4)
FOUL! Reach-in foul on Jarrett Anunoby during the drive. [Team fouls: 2] No free throws, side out. (Jarrett Anunoby: 1 personal fouls)

[08:29] Team_065 possession (Score: 6-4)
Karl Booker attempts a Midrange. Contested by Terry Barrett (3.2 feet, MAN). Karl Booker misses. Rebound secured by Dejounte Griffin.

[08:13] Team_041 possession (Score: 6-4)
FOUL! Shooting foul on Russell Wade. Terry Barrett to the line for 2 free throws. [Team fouls: 1] (Russell Wade: 1 personal fouls)   FT 1/2: GOOD   FT 2/2: GOOD Terry Barrett makes 2/2 from the line.
Score: 6-6

[07:53] Team_065 possession (Score: 6-6)
Karl Booker makes the Midrange and draws the foul on Terry Barrett! And-1! Karl Booker to the line for 1. [Team fouls: 3] (Terry Barrett: 1 personal fouls)   FT 1/1: GOOD Karl Booker makes 1/1 from the line.
Score: 9-6

[07:35] Team_041 possession (Score: 9-6)
Scottie Turner drives, picks up RJ Harden. Help arrives from Manu McGrady! Scottie Turner attempts a Dunk. Contested by Manu McGrady (3.7 feet, MAN). SCOTTIE TURNER MAKES IT! Assist: Dejounte Griffin
Score: 9-8

[07:24] Team_065 possession (Score: 9-8)
Manu McGrady attempts a 3Pt. Contested by Scottie Turner (4.0 feet, ZONE). Manu McGrady misses. Rebound secured by Stephen Ingram.

[07:08] Team_041 possession (Score: 9-8)
Jarrett Anunoby attempts a 3Pt. Contested by RJ Harden (4.4 feet, ZONE). Jarrett Anunoby misses. Offensive rebound by Terry Barrett! Terry Barrett puts it back in!
Score: 9-10

[06:54] Team_065 possession (Score: 9-10)
RJ Harden attempts a 3Pt. Contested by Scottie Turner (4.5 feet, ZONE). RJ Harden misses. Rebound secured by Terry Barrett.

[06:44] Team_041 possession (Score: 9-10)
Dejounte Griffin attempts a 3Pt. Contested by RJ Harden (3.9 feet, ZONE). Dejounte Griffin misses. Rebound secured by Russell Wade.

[06:31] Team_065 possession (Score: 9-10)
Karl Booker attempts a Midrange. Contested by Terry Barrett (3.2 feet, MAN). KARL BOOKER MAKES IT!
Score: 11-10

[06:15] Team_041 possession (Score: 11-10)
Terry Barrett attempts a Layup. Contested by Russell Wade (3.2 feet, ZONE). TERRY BARRETT MAKES IT! Assist: Stephen Ingram
Score: 11-12

[06:03] Team_065 possession (Score: 11-12)
Paul Williamson drives and kicks out. Russell Wade attempts a 3Pt. Contested by Scottie Turner (4.1 feet, ZONE). Russell Wade misses. Rebound secured by Dejounte Griffin.

[05:46] Team_041 possession (Score: 11-12)
Scottie Turner attempts a 3Pt. Contested by RJ Harden (3.7 feet, ZONE). Scottie Turner misses. Rebound secured by Russell Wade.

[05:30] Team_065 possession (Score: 11-12)
Russell Wade attempts a Midrange. Contested by Dejounte Griffin (4.0 feet, ZONE). Russell Wade misses. Rebound secured by Dejounte Griffin.

[05:18] Team_041 possession (Score: 11-12)
Jarrett Anunoby attempts a 3Pt. Contested by Paul Williamson (3.9 feet, MAN). Jarrett Anunoby misses. Rebound secured by RJ Harden.

[05:03] Team_065 possession (Score: 11-12)
FOUL! Reach-in foul on Terry Barrett during the drive. [Team fouls: 4] No free throws, side out. (Terry Barrett: 2 personal fouls)

[04:48] Team_065 possession (Score: 11-12)
Paul Williamson attempts a Midrange. Contested by Jarrett Anunoby (4.4 feet, ZONE). Paul Williamson misses. Offensive rebound by Manu McGrady! Manu McGrady kicks it out.

[04:36] Team_065 possession (Score: 11-12)
RJ Harden drives, Terry Barrett stays with him. RJ Harden attempts a Layup. Contested by Terry Barrett (3.7 feet, ZONE). RJ Harden misses. Offensive rebound by Manu McGrady! Manu McGrady kicks it out.

[04:19] Team_065 possession (Score: 11-12)
Karl Booker drives, picks up Terry Barrett. Help arrives from Jarrett Anunoby! Karl Booker attempts a Layup. Contested by Jarrett Anunoby (3.3 feet, MAN). Karl Booker misses. Rebound secured by Stephen Ingram.

[04:05] Team_041 possession (Score: 11-12)
Stephen Ingram drives and kicks out. Stephen Ingram attempts a 3Pt. Contested by RJ Harden (3.9 feet, ZONE). Stephen Ingram misses. Rebound secured by Manu McGrady.

[03:52] Team_065 possession (Score: 11-12)
Paul Williamson makes the Layup and draws the foul on Jarrett Anunoby! And-1! Paul Williamson to the line for 1. [BONUS: 5 team fouls] (Jarrett Anunoby: 2 personal fouls)   FT 1/1: GOOD Paul Williamson makes 1/1 from the line.
Score: 14-12

[03:36] Team_041 possession (Score: 14-12)
Dejounte Griffin attempts a Midrange. Contested by Manu McGrady (4.7 feet, MAN). Dejounte Griffin misses. Rebound secured by Russell Wade.

[03:22] Team_065 possession (Score: 14-12)
Karl Booker drives, Terry Barrett stays with him. Karl Booker attempts a Dunk. Contested by Terry Barrett (3.4 feet, MAN). Karl Booker misses. FOUL! Loose ball foul on Terry Barrett during the rebound battle. [IN THE BONUS! 6 team fouls] Manu McGrady to the line for 2 free throws. (Terry Barrett: 3 personal fouls)   FT 1/2: GOOD   FT 2/2: MISS Manu McGrady makes 1/2 from the line. Offensive rebound by Russell Wade! Russell Wade puts it back in!
Score: 17-12

[03:07] Team_041 possession (Score: 17-12)
Terry Barrett drives to the basket... Terry Barrett commits a violation (traveling/carry)! TURNOVER! (dead ball)

[02:55] Team_065 possession (Score: 17-12)
Paul Williamson attempts a Midrange. Contested by Jarrett Anunoby (4.6 feet, MAN). Paul Williamson misses. Rebound secured by Terry Barrett.

[02:41] Team_041 possession (Score: 17-12)
Dejounte Griffin drives to the basket... Dejounte Griffin throws a bad pass out of bounds! TURNOVER! (dead ball)

[02:41] Substitution (Team_041): Dejounte Griffin OUT → Bam McCollum IN (stamina_rule2)

[02:27] Team_065 possession (Score: 17-12)
Russell Wade loses the ball! Stripped by Stephen Ingram! TURNOVER! (live ball)

[02:17] Team_041 possession (Score: 17-12)
Bam McCollum attempts a 3Pt. Contested by Manu McGrady (4.5 feet, MAN). Bam McCollum misses. Rebound secured by RJ Harden.

[02:00] Team_065 possession (Score: 17-12)
Manu McGrady attempts a Layup. Contested by Terry Barrett (3.5 feet, ZONE). MANU MCGRADY MAKES IT!
Score: 19-12

[01:42] Team_041 possession (Score: 19-12)
Jarrett Anunoby attempts a 3Pt. Contested by RJ Harden (4.6 feet, ZONE). Jarrett Anunoby misses. Rebound secured by Russell Wade.

[01:33] Team_065 possession (Score: 19-12)
Karl Booker attempts a Layup. Contested by Terry Barrett (3.6 feet, ZONE). Karl Booker misses. FOUL! Loose ball foul on Jarrett Anunoby during the rebound battle. [IN THE BONUS! 7 team fouls] Russell Wade to the line for 2 free throws. (Jarrett Anunoby: 3 personal fouls)   FT 1/2: GOOD   FT 2/2: GOOD Russell Wade makes 2/2 from the line.
Score: 21-12

[01:18] Team_041 possession (Score: 21-12)
Scottie Turner throws a bad pass! Stolen by RJ Harden! TURNOVER! (live ball)

[01:00] Team_065 possession (Score: 21-12)
Russell Wade throws a bad pass out of bounds! TURNOVER! (dead ball)

[01:00] Substitution (Team_065): RJ Harden OUT → Paul Curry IN (stamina_rule2)

[01:00] Substitution (Team_065): Paul Williamson OUT → Derrick Poole IN (stamina_rule2)

[01:00] Substitution (Team_065): Manu McGrady OUT → D'Angelo Porzingis IN (stamina_rule2)

[01:00] Substitution (Team_065): Russell Wade OUT → Karl Leonard IN (stamina_rule2)

[01:00] Substitution (Team_065): Karl Booker OUT → Vince Mobley IN (stamina_rule2)

[01:00] Substitution (Team_041): Scottie Turner OUT → Franz Rose IN (stamina_rule2)

[01:00] Substitution (Team_041): Jarrett Anunoby OUT → Kyrie Booker IN (stamina_rule2)

[01:00] Substitution (Team_041): Stephen Ingram OUT → Tobias McCollum IN (stamina_rule2)

[01:00] Substitution (Team_041): Terry Barrett OUT → De'Aaron Poole IN (stamina_rule2)

[00:43] Team_041 possession (Score: 21-12)
Tobias McCollum makes the Dunk and draws the foul on Derrick Poole! And-1! Tobias McCollum to the line for 1. [Team fouls: 2] (Derrick Poole: 1 personal fouls)   FT 1/1: GOOD Tobias McCollum makes 1/1 from the line.
Score: 21-15

[00:25] Team_065 possession (Score: 21-15)
Vince Mobley attempts a Layup. Contested by Tobias McCollum (5.1 feet, ZONE). VINCE MOBLEY MAKES IT!
Score: 23-15

[00:14] Team_041 possession (Score: 23-15)
FOUL! Reach-in foul on Vince Mobley during the drive. [Team fouls: 3] No free throws, side out. (Vince Mobley: 1 personal fouls)

[00:01] Team_041 possession (Score: 23-15)
Franz Rose attempts a Layup. Contested by Paul Curry (4.9 feet, MAN). Franz Rose misses. Rebound secured by Vince Mobley.

================================================================================
                              1ST QUARTER COMPLETE                              
================================================================================

1ST QUARTER SCORE: Team_065 23, Team_041 15

BOX SCORE:
================================================================================

Team_065
--------------------------------------------------------------------------------
Player                MIN  PTS  REB  AST  TO      FG   FG%      3P   3P%
--------------------------------------------------------------------------------
Russell Wade           11    5    6    1   0   2/6    33.3     0/0   0.0
Karl Booker            11    5    0    0   0   2/4    50.0     0/0   0.0
RJ Harden              11    4    5    0   0   2/3    66.7     0/0   0.0
Manu McGrady           11    4    4    1   0   2/3    66.7     0/0   0.0
Paul Williamson        11    3    0    0   0   1/3    33.3     0/0   0.0
Vince Mobley            1    2    1    0   0   1/1   100.0     0/0   0.0

TEAM: FG: 10/20 (50.0%), 3PT: 0/3 (0.0%), REB: 16 (4 off, 12 def), AST: 2, TO: 2
TEAM FOULS: 3


Team_041
--------------------------------------------------------------------------------
Player                MIN  PTS  REB  AST  TO      FG   FG%      3P   3P%
--------------------------------------------------------------------------------
Terry Barrett          11   10    4    0   0   5/7    71.4     0/0   0.0
Tobias McCollum         1    3    0    0   0   1/1   100.0     0/0   0.0
Scottie Turner         11    2    0    1   0   1/3    33.3     0/0   0.0
Dejounte Griffin       10    0    4    1   0   0/3     0.0     0/0   0.0
Stephen Ingram         11    0    4    1   0   0/1     0.0     0/0   0.0
Jarrett Anunoby        11    0    0    0   0   0/2     0.0     0/0   0.0
Bam McCollum            3    0    0    0   0   0/1     0.0     0/0   0.0
Franz Rose              1    0    0    0   0   0/1     0.0     0/0   0.0

TEAM: FG: 7/19 (36.8%), 3PT: 2/9 (22.2%), REB: 12 (2 off, 10 def), AST: 3, TO: 3
TEAM FOULS: 7 [Team_065 in BONUS]

================================================================================

================================================================================
                       2ND QUARTER - Team_065 vs Team_041                       
================================================================================

[12:00] Team_065 possession (Score: 23-15)
Paul Williamson attempts a 3Pt. Contested by Jarrett Anunoby (4.5 feet, MAN). PAUL WILLIAMSON MAKES IT!
Score: 26-15

[11:45] Team_041 possession (Score: 26-15)
Scottie Turner makes the 3Pt and draws the foul on RJ Harden! And-1! Scottie Turner to the line for 1. [Team fouls: 1] (RJ Harden: 1 personal fouls)   FT 1/1: GOOD Scottie Turner makes 1/1 from the line.
Score: 26-19

[11:30] Team_065 possession (Score: 26-19)
FOUL! Offensive foul on RJ Harden! Scottie Turner drew the charge! [Team fouls: 2] (RJ Harden: 2 personal fouls) TURNOVER! (dead ball)

[11:15] Team_041 possession (Score: 26-19)
Dejounte Griffin attempts a 3Pt. Contested by Manu McGrady (4.8 feet, MAN). DEJOUNTE GRIFFIN MAKES IT! Assist: Jarrett Anunoby
Score: 26-22

[10:59] Team_065 possession (Score: 26-22)
Karl Booker attempts a Midrange. Contested by Terry Barrett (3.5 feet, MAN). Karl Booker misses. Rebound secured by Dejounte Griffin.

[10:40] Team_041 possession (Score: 26-22)
Stephen Ingram attempts a Midrange. Contested by Manu McGrady (4.9 feet, ZONE). Stephen Ingram misses. Rebound secured by Manu McGrady.

[10:28] Team_065 possession (Score: 26-22)
Paul Williamson attempts a 3Pt. Contested by Scottie Turner (4.5 feet, ZONE). Paul Williamson misses. Rebound secured by Terry Barrett.

[10:10] Team_041 possession (Score: 26-22)
Scottie Turner attempts a 3Pt. Contested by RJ Harden (4.0 feet, MAN). Scottie Turner misses. Rebound secured by RJ Harden.

[10:00] Team_065 possession (Score: 26-22)
Russell Wade drives to the basket... Russell Wade commits a violation (traveling/carry)! TURNOVER! (dead ball)

[10:00] Substitution (Team_065): RJ Harden OUT → Paul Curry IN (stamina_rule2)

[10:00] Substitution (Team_065): Paul Williamson OUT → Derrick Poole IN (stamina_rule2)

[10:00] Substitution (Team_065): Manu McGrady OUT → D'Angelo Porzingis IN (stamina_rule2)

[10:00] Substitution (Team_065): Russell Wade OUT → Karl Leonard IN (stamina_rule2)

[10:00] Substitution (Team_065): Karl Booker OUT → Vince Mobley IN (stamina_rule2)

[10:00] Substitution (Team_041): Scottie Turner OUT → Franz Rose IN (stamina_rule2)

[10:00] Substitution (Team_041): Jarrett Anunoby OUT → Kyrie Booker IN (stamina_rule2)

[10:00] Substitution (Team_041): Stephen Ingram OUT → Tobias McCollum IN (stamina_rule2)

[10:00] Substitution (Team_041): Terry Barrett OUT → De'Aaron Poole IN (stamina_rule2)

[09:45] Team_041 possession (Score: 26-22)
Kyrie Booker attempts a 3Pt. Contested by Derrick Poole (5.0 feet, MAN). Kyrie Booker misses. Rebound secured by Vince Mobley.

[09:25] Team_065 possession (Score: 26-22)
Paul Curry drives and kicks out. D'Angelo Porzingis attempts a Midrange. Contested by Dejounte Griffin (4.2 feet, MAN). D'Angelo Porzingis misses. Rebound secured by Tobias McCollum.

[09:14] Team_041 possession (Score: 26-22)
Kyrie Booker attempts a 3Pt. Contested by Derrick Poole (5.0 feet, MAN). Kyrie Booker misses. Offensive rebound by Dejounte Griffin! Dejounte Griffin kicks it out.

[09:00] Team_041 possession (Score: 26-22)
Dejounte Griffin drives, picks up D'Angelo Porzingis. Help arrives from Derrick Poole! Dejounte Griffin attempts a Layup. Contested by Derrick Poole (4.3 feet, MAN). Dejounte Griffin misses. Rebound secured by Vince Mobley.

[08:46] Team_065 possession (Score: 26-22)
Paul Curry attempts a 3Pt. Contested by Franz Rose (5.7 feet, MAN). Paul Curry misses. Rebound secured by Tobias McCollum.

[08:33] Team_041 possession (Score: 26-22)
De'Aaron Poole attempts a Layup. BLOCKED BY VINCE MOBLEY! Ball is loose! Offensive rebound by Dejounte Griffin! Dejounte Griffin kicks it out.

[08:19] Team_041 possession (Score: 26-22)
De'Aaron Poole attempts a Midrange. Contested by Derrick Poole (5.0 feet, ZONE). DE'AARON POOLE MAKES IT! Assist: Franz Rose
Score: 26-24

[08:00] Team_065 possession (Score: 26-24)
Derrick Poole attempts a Midrange. Contested by Kyrie Booker (4.4 feet, MAN). Derrick Poole misses. Rebound secured by De'Aaron Poole.

[07:48] Team_041 possession (Score: 26-24)
Tobias McCollum drives and kicks out. De'Aaron Poole attempts a 3Pt. Contested by Paul Curry (4.9 feet, ZONE). De'Aaron Poole misses. Rebound secured by Karl Leonard.

[07:34] Team_065 possession (Score: 26-24)
Karl Leonard attempts a Layup. BLOCKED BY TOBIAS MCCOLLUM! Ball is loose! Rebound secured by Dejounte Griffin.

[07:18] Team_041 possession (Score: 26-24)
Tobias McCollum attempts a Midrange. Contested by Karl Leonard (4.7 feet, MAN). Tobias McCollum misses. Rebound secured by Karl Leonard.

[07:01] Team_065 possession (Score: 26-24)
Paul Curry attempts a 3Pt. Contested by Franz Rose (5.7 feet, MAN). PAUL CURRY MAKES IT! Assist: Derrick Poole
Score: 29-24

[06:49] Team_041 possession (Score: 29-24)
De'Aaron Poole makes the Layup and draws the foul on Vince Mobley! And-1! De'Aaron Poole to the line for 1. [Team fouls: 3] (Vince Mobley: 1 personal fouls)   FT 1/1: GOOD De'Aaron Poole makes 1/1 from the line.
Score: 29-27

[06:32] Team_065 possession (Score: 29-27)
FOUL! Holding foul on De'Aaron Poole. [Team fouls: 1] No free throws, side out. (De'Aaron Poole: 1 personal fouls)

[06:19] Team_065 possession (Score: 29-27)
FOUL! Reach-in foul on Tobias McCollum during the drive. [Team fouls: 2] No free throws, side out. (Tobias McCollum: 1 personal fouls)

[06:09] Team_065 possession (Score: 29-27)
Derrick Poole makes the Layup and draws the foul on Kyrie Booker! And-1! Derrick Poole to the line for 1. [Team fouls: 3] (Kyrie Booker: 1 personal fouls)   FT 1/1: MISS Derrick Poole makes 0/1 from the line. Rebound secured by Tobias McCollum.
Score: 31-27

[05:57] Team_041 possession (Score: 31-27)
Kyrie Booker attempts a 3Pt. Contested by Derrick Poole (5.0 feet, MAN). Kyrie Booker misses. Rebound secured by Vince Mobley.

[05:42] Team_065 possession (Score: 31-27)
Karl Leonard attempts a 3Pt. Contested by Kyrie Booker (4.7 feet, ZONE). Karl Leonard misses. Rebound secured by Tobias McCollum.

[05:30] Team_041 possession (Score: 31-27)
Tobias McCollum attempts a 3Pt. Contested by Karl Leonard (4.7 feet, MAN). TOBIAS MCCOLLUM MAKES IT! Assist: Franz Rose
Score: 31-30

[05:14] Team_065 possession (Score: 31-30)
D'Angelo Porzingis throws a bad pass out of bounds! TURNOVER! (dead ball)

[05:14] Substitution (Team_041): Dejounte Griffin OUT → Bam McCollum IN (stamina_rule2)

[05:00] Team_041 possession (Score: 31-30)
FOUL! Shooting foul on Karl Leonard. Tobias McCollum to the line for 2 free throws. [Team fouls: 4] (Karl Leonard: 1 personal fouls)   FT 1/2: GOOD   FT 2/2: GOOD Tobias McCollum makes 2/2 from the line.
Score: 31-32

[04:42] Team_065 possession (Score: 31-32)
Derrick Poole attempts a Midrange. Contested by Bam McCollum (5.9 feet, ZONE). Derrick Poole misses. Offensive rebound by Vince Mobley! Vince Mobley puts it back in!
Score: 33-32

[04:23] Team_041 possession (Score: 33-32)
Kyrie Booker attempts a Layup. Contested by Derrick Poole (5.0 feet, MAN). KYRIE BOOKER MAKES IT!
Score: 33-34

[04:10] Team_065 possession (Score: 33-34)
Derrick Poole makes the Midrange and draws the foul on Kyrie Booker! And-1! Derrick Poole to the line for 1. [Team fouls: 4] (Kyrie Booker: 2 personal fouls)   FT 1/1: MISS Derrick Poole makes 0/1 from the line. Rebound secured by De'Aaron Poole.
Score: 35-34

[03:56] Team_041 possession (Score: 35-34)
FOUL! Reach-in foul on Vince Mobley during the drive. [IN THE BONUS! 5 team fouls] De'Aaron Poole to the line for 2 free throws. (Vince Mobley: 2 personal fouls)   FT 1/2: GOOD   FT 2/2: GOOD De'Aaron Poole makes 2/2 from the line.
Score: 35-36

[03:47] Team_065 possession (Score: 35-36)
Paul Curry attempts a 3Pt. Contested by Kyrie Booker (4.8 feet, ZONE). Paul Curry misses. Rebound secured by De'Aaron Poole.

[03:31] Team_041 possession (Score: 35-36)
Tobias McCollum attempts a Layup. Contested by Vince Mobley (4.5 feet, ZONE). TOBIAS MCCOLLUM MAKES IT! Assist: Bam McCollum
Score: 35-38

[03:13] Team_065 possession (Score: 35-38)
Karl Leonard attempts a 3Pt. Contested by Kyrie Booker (4.8 feet, ZONE). Karl Leonard misses. Rebound secured by Tobias McCollum.

[03:00] Team_041 possession (Score: 35-38)
De'Aaron Poole attempts a Midrange. Contested by Paul Curry (4.8 feet, ZONE). De'Aaron Poole misses. Rebound secured by Vince Mobley.

[02:43] Team_065 possession (Score: 35-38)
FOUL! Reach-in foul on Tobias McCollum during the drive. [IN THE BONUS! 5 team fouls] D'Angelo Porzingis to the line for 2 free throws. (Tobias McCollum: 2 personal fouls)   FT 1/2: GOOD   FT 2/2: GOOD D'Angelo Porzingis makes 2/2 from the line.
Score: 37-38

[02:29] Team_041 possession (Score: 37-38)
De'Aaron Poole attempts a 3Pt. Contested by D'Angelo Porzingis (4.3 feet, ZONE). De'Aaron Poole misses. Rebound secured by D'Angelo Porzingis.

[02:15] Team_065 possession (Score: 37-38)
Karl Leonard attempts a 3Pt. Contested by Kyrie Booker (4.9 feet, ZONE). Karl Leonard misses. Rebound secured by Kyrie Booker.

[01:59] Team_041 possession (Score: 37-38)
De'Aaron Poole drives and kicks out. Tobias McCollum attempts a Midrange. Contested by Karl Leonard (4.6 feet, MAN). Tobias McCollum misses. Offensive rebound by Tobias McCollum! Tobias McCollum kicks it out.

[01:47] Team_041 possession (Score: 37-38)
Franz Rose attempts a 3Pt. Contested by D'Angelo Porzingis (4.4 feet, ZONE). Franz Rose misses. Rebound secured by D'Angelo Porzingis.

[01:33] Team_065 possession (Score: 37-38)
Karl Leonard makes the Dunk and draws the foul on Tobias McCollum! And-1! Karl Leonard to the line for 1. [BONUS: 6 team fouls] (Tobias McCollum: 3 personal fouls)   FT 1/1: GOOD Karl Leonard makes 1/1 from the line.
Score: 40-38

[01:14] Team_041 possession (Score: 40-38)
Franz Rose loses the ball! Stripped by Paul Curry! TURNOVER! (live ball)

[00:57] Team_065 possession (Score: 40-38)
Vince Mobley makes the Layup and draws the foul on De'Aaron Poole! And-1! Vince Mobley to the line for 1. [BONUS: 7 team fouls] (De'Aaron Poole: 2 personal fouls)   FT 1/1: GOOD Vince Mobley makes 1/1 from the line.
Score: 43-38

[00:37] Team_041 possession (Score: 43-38)
Kyrie Booker makes the Layup and draws the foul on Derrick Poole! And-1! Kyrie Booker to the line for 1. [BONUS: 6 team fouls] (Derrick Poole: 1 personal fouls)   FT 1/1: GOOD Kyrie Booker makes 1/1 from the line.
Score: 43-41

[00:24] Team_065 possession (Score: 43-41)
FOUL! Reach-in foul on Tobias McCollum during the drive. [IN THE BONUS! 8 team fouls] Karl Leonard to the line for 2 free throws. (Tobias McCollum: 4 personal fouls)   FT 1/2: GOOD   FT 2/2: GOOD Karl Leonard makes 2/2 from the line.
Score: 45-41

[00:09] Team_041 possession (Score: 45-41)
De'Aaron Poole attempts a 3Pt. Contested by Vince Mobley (4.5 feet, MAN). De'Aaron Poole misses. Rebound secured by Vince Mobley.

================================================================================
                              2ND QUARTER COMPLETE                              
================================================================================

2ND QUARTER SCORE: Team_065 22, Team_041 26

BOX SCORE:
================================================================================

Team_065
--------------------------------------------------------------------------------
Player                MIN  PTS  REB  AST  TO      FG   FG%      3P   3P%
--------------------------------------------------------------------------------
Vince Mobley           11    5    6    0   0   2/2   100.0     0/0   0.0
Karl Leonard           11    5    2    0   0   2/6    33.3     0/0   0.0
Paul Williamson        14    3    0    0   0   1/2    50.0     0/0   0.0
Paul Curry             11    3    0    0   0   1/4    25.0     0/0   0.0
D'Angelo Porzingis     11    2    2    0   0   1/1   100.0     0/0   0.0
Karl Booker            14    0    0    0   0   0/1     0.0     0/0   0.0
Manu McGrady           14    0    1    0   0   0/0     0.0     0/0   0.0
RJ Harden              14    0    1    0   0   0/0     0.0     0/0   0.0
Derrick Poole          11    0    0    1   0   0/3     0.0     0/0   0.0

TEAM: FG: 7/19 (36.8%), 3PT: 2/8 (25.0%), REB: 12 (1 off, 11 def), AST: 1, TO: 3
TEAM FOULS: 6 [Team_041 in BONUS]


Team_041
--------------------------------------------------------------------------------
Player                MIN  PTS  REB  AST  TO      FG   FG%      3P   3P%
--------------------------------------------------------------------------------
Tobias McCollum        11    7    6    0   0   3/5    60.0     0/0   0.0
De'Aaron Poole         11    7    3    0   0   3/6    50.0     0/0   0.0
Kyrie Booker           11    5    1    0   0   2/4    50.0     0/0   0.0
Scottie Turner         14    4    0    0   0   1/2    50.0     0/0   0.0
Dejounte Griffin       17    3    4    0   0   1/2    50.0     0/0   0.0
Jarrett Anunoby        14    0    0    1   0   0/0     0.0     0/0   0.0
Stephen Ingram         14    0    0    0   0   0/1     0.0     0/0   0.0
Terry Barrett          14    0    1    0   0   0/0     0.0     0/0   0.0
Franz Rose             11    0    0    2   0   0/1     0.0     0/0   0.0
Bam McCollum            8    0    0    1   0   0/0     0.0     0/0   0.0

TEAM: FG: 10/21 (47.6%), 3PT: 3/9 (33.3%), REB: 15 (3 off, 12 def), AST: 4, TO: 1
TEAM FOULS: 8 [Team_065 in BONUS]

================================================================================

================================================================================
                       3RD QUARTER - Team_065 vs Team_041                       
================================================================================

[12:00] Team_065 possession (Score: 45-41)
RJ Harden attempts a 3Pt. Contested by Scottie Turner (4.5 feet, MAN). RJ Harden misses. Rebound secured by Terry Barrett.

[11:42] Team_041 possession (Score: 45-41)
Jarrett Anunoby attempts a Layup. Contested by Paul Williamson (3.9 feet, MAN). Jarrett Anunoby misses. Rebound secured by Manu McGrady.

[11:26] Team_065 possession (Score: 45-41)
Paul Williamson attempts a Midrange. Contested by Jarrett Anunoby (4.4 feet, ZONE). PAUL WILLIAMSON MAKES IT!
Score: 47-41

[11:15] Team_041 possession (Score: 47-41)
Jarrett Anunoby attempts a Layup. BLOCKED BY PAUL WILLIAMSON! Ball is loose! Rebound secured by Russell Wade.

[11:02] Team_065 possession (Score: 47-41)
Karl Booker drives to the basket... FOUL! Offensive foul on Karl Booker! Terry Barrett drew the charge! [Team fouls: 1] (Karl Booker: 1 personal fouls) TURNOVER! (dead ball)

[10:47] Team_041 possession (Score: 47-41)
Scottie Turner attempts a 3Pt. Contested by RJ Harden (3.7 feet, MAN). Scottie Turner misses. Rebound secured by Russell Wade.

[10:33] Team_065 possession (Score: 47-41)
Manu McGrady attempts a 3Pt. Contested by Dejounte Griffin (3.8 feet, MAN). Manu McGrady misses. Offensive rebound by Russell Wade! Russell Wade puts it back in!
Score: 49-41

[10:18] Team_041 possession (Score: 49-41)
Scottie Turner attempts a 3Pt. Contested by RJ Harden (3.7 feet, MAN). Scottie Turner misses. Rebound secured by RJ Harden.

[10:05] Team_065 possession (Score: 49-41)
Russell Wade drives and kicks out. Manu McGrady attempts a 3Pt. Contested by Dejounte Griffin (3.9 feet, MAN). MANU MCGRADY MAKES IT! Assist: Russell Wade
Score: 52-41

[09:48] Team_041 possession (Score: 52-41)
Dejounte Griffin attempts a 3Pt. Contested by RJ Harden (3.9 feet, ZONE). Dejounte Griffin misses. Rebound secured by Russell Wade.

[09:32] Team_065 possession (Score: 52-41)
RJ Harden drives, Scottie Turner stays with him. RJ Harden attempts a Dunk. Contested by Scottie Turner (4.5 feet, MAN). RJ Harden misses. Offensive rebound by Manu McGrady! Manu McGrady kicks it out.

[09:18] Team_065 possession (Score: 52-41)
Karl Booker attempts a Midrange. Contested by Stephen Ingram (4.2 feet, ZONE). Karl Booker misses. Rebound secured by Stephen Ingram.

[09:01] Team_041 possession (Score: 52-41)
FOUL! Holding foul on Manu McGrady. [Team fouls: 2] No free throws, side out. (Manu McGrady: 1 personal fouls)

[08:48] Team_041 possession (Score: 52-41)
Scottie Turner drives to the basket... Scottie Turner throws a bad pass! Stolen by RJ Harden! TURNOVER! (live ball)

[08:34] Team_065 possession (Score: 52-41)
Paul Williamson attempts a 3Pt. Contested by Scottie Turner (4.2 feet, ZONE). PAUL WILLIAMSON MAKES IT! Assist: Russell Wade
Score: 55-41

[08:19] Team_041 possession (Score: 55-41)
Terry Barrett attempts a Layup. Contested by Russell Wade (3.2 feet, ZONE). TERRY BARRETT MAKES IT! Assist: Dejounte Griffin
Score: 55-43

[08:09] Team_065 possession (Score: 55-43)
Karl Booker attempts a Layup. BLOCKED BY TERRY BARRETT! Ball goes out off Terry Barrett. Karl Booker's ball!

[07:52] Team_065 possession (Score: 55-43)
Paul Williamson attempts a Layup. BLOCKED BY TERRY BARRETT! Ball deflects out of bounds off Paul Williamson.

[07:40] Team_041 possession (Score: 55-43)
Stephen Ingram drives and kicks out. Dejounte Griffin attempts a 3Pt. Contested by Manu McGrady (4.6 feet, MAN). DEJOUNTE GRIFFIN MAKES IT! Assist: Jarrett Anunoby
Score: 55-46

[07:25] Team_065 possession (Score: 55-46)
Karl Booker attempts a 3Pt. Contested by Scottie Turner (4.1 feet, ZONE). Karl Booker misses. Rebound secured by Terry Barrett.

[07:11] Team_041 possession (Score: 55-46)
Stephen Ingram drives, picks up Russell Wade. Help arrives from Paul Williamson! Stephen Ingram attempts a Dunk. Contested by Paul Williamson (3.2 feet, ZONE). STEPHEN INGRAM MAKES IT!
Score: 55-48

[06:56] Team_065 possession (Score: 55-48)
Russell Wade attempts a Midrange. Contested by Dejounte Griffin (3.9 feet, ZONE). RUSSELL WADE MAKES IT!
Score: 57-48

[06:38] Team_041 possession (Score: 57-48)
FOUL! Reach-in foul on Russell Wade during the drive. [Team fouls: 3] No free throws, side out. (Russell Wade: 1 personal fouls)

[06:26] Team_041 possession (Score: 57-48)
Scottie Turner attempts a 3Pt. Contested by RJ Harden (3.7 feet, MAN). Scottie Turner misses. Rebound secured by Manu McGrady.

[06:15] Team_065 possession (Score: 57-48)
Paul Williamson loses control! Ball rolls out of bounds! TURNOVER! (dead ball)

[06:00] Team_041 possession (Score: 57-48)
Terry Barrett attempts a Layup. Contested by Russell Wade (3.2 feet, ZONE). TERRY BARRETT MAKES IT! Assist: Scottie Turner
Score: 57-50

[05:49] Team_065 possession (Score: 57-50)
RJ Harden attempts a 3Pt. Contested by Scottie Turner (4.5 feet, MAN). RJ Harden misses. Rebound secured by Stephen Ingram.

[05:37] Team_041 possession (Score: 57-50)
Dejounte Griffin attempts a 3Pt. Contested by RJ Harden (3.9 feet, ZONE). Dejounte Griffin misses. Offensive rebound by Terry Barrett! Terry Barrett puts it back in!
Score: 57-52

[05:25] Team_065 possession (Score: 57-52)
Paul Williamson throws a bad pass! Stolen by Jarrett Anunoby! TURNOVER! (live ball)

[05:12] Team_041 possession (Score: 57-52)
FOUL! Reach-in foul on Russell Wade during the drive. [Team fouls: 4] No free throws, side out. (Russell Wade: 2 personal fouls)

[04:57] Team_041 possession (Score: 57-52)
Dejounte Griffin drives and kicks out. Jarrett Anunoby attempts a Midrange. Contested by Paul Williamson (3.4 feet, ZONE). Jarrett Anunoby misses. Rebound secured by Russell Wade.

[04:44] Team_065 possession (Score: 57-52)
FOUL! Shooting foul on Jarrett Anunoby. Paul Williamson to the line for 2 free throws. [Team fouls: 1] (Jarrett Anunoby: 1 personal fouls)   FT 1/2: GOOD   FT 2/2: GOOD Paul Williamson makes 2/2 from the line.
Score: 59-52

[04:29] Team_041 possession (Score: 59-52)
Jarrett Anunoby attempts a Layup. Contested by Paul Williamson (4.0 feet, MAN). JARRETT ANUNOBY MAKES IT! Assist: Scottie Turner
Score: 59-54

[04:12] Team_065 possession (Score: 59-54)
Karl Booker drives and kicks out. Karl Booker attempts a 3Pt. Contested by Terry Barrett (3.4 feet, MAN). KARL BOOKER MAKES IT! Assist: RJ Harden
Score: 62-54

[03:57] Team_041 possession (Score: 62-54)
Terry Barrett makes the Layup and draws the foul on Russell Wade! And-1! Terry Barrett to the line for 1. [BONUS: 5 team fouls] (Russell Wade: 3 personal fouls)   FT 1/1: GOOD Terry Barrett makes 1/1 from the line.
Score: 62-57

[03:46] Team_065 possession (Score: 62-57)
Manu McGrady attempts a 3Pt. Contested by Jarrett Anunoby (4.4 feet, ZONE). Manu McGrady misses. Rebound secured by Terry Barrett.

[03:32] Team_041 possession (Score: 62-57)
Jarrett Anunoby attempts a 3Pt. Contested by Russell Wade (3.7 feet, ZONE). Jarrett Anunoby misses. Rebound secured by Manu McGrady.

[03:17] Team_065 possession (Score: 62-57)
Paul Williamson attempts a 3Pt. Contested by Dejounte Griffin (4.3 feet, ZONE). PAUL WILLIAMSON MAKES IT! Assist: Manu McGrady
Score: 65-57

[03:02] Team_041 possession (Score: 65-57)
Jarrett Anunoby attempts a Midrange. Contested by Paul Williamson (4.1 feet, MAN). JARRETT ANUNOBY MAKES IT!
Score: 65-59

[02:46] Team_065 possession (Score: 65-59)
Russell Wade drives, picks up Terry Barrett. Help arrives from Jarrett Anunoby! Russell Wade attempts a Dunk. Contested by Jarrett Anunoby (3.6 feet, ZONE). RUSSELL WADE MAKES IT! Assist: Manu McGrady
Score: 67-59

[02:32] Team_041 possession (Score: 67-59)
Jarrett Anunoby attempts a Midrange. Contested by Paul Williamson (4.1 feet, MAN). Jarrett Anunoby misses. Rebound secured by Russell Wade.

[02:17] Team_065 possession (Score: 67-59)
Manu McGrady attempts a Layup. Contested by Terry Barrett (3.5 feet, ZONE). MANU MCGRADY MAKES IT! Assist: Paul Williamson
Score: 69-59

[02:04] Team_041 possession (Score: 69-59)
Dejounte Griffin makes the Midrange and draws the foul on Manu McGrady! And-1! Dejounte Griffin to the line for 1. [BONUS: 6 team fouls] (Manu McGrady: 2 personal fouls)   FT 1/1: GOOD Dejounte Griffin makes 1/1 from the line.
Score: 69-62

[01:49] Team_065 possession (Score: 69-62)
Paul Williamson attempts a Midrange. Contested by Jarrett Anunoby (4.7 feet, MAN). Paul Williamson misses. Rebound secured by Dejounte Griffin.

[01:35] Team_041 possession (Score: 69-62)
Scottie Turner attempts a 3Pt. Contested by RJ Harden (4.0 feet, ZONE). Scottie Turner misses. Rebound secured by RJ Harden.

[01:23] Team_065 possession (Score: 69-62)
Russell Wade attempts a Layup. Contested by Terry Barrett (3.7 feet, ZONE). RUSSELL WADE MAKES IT!
Score: 71-62

[01:09] Team_041 possession (Score: 71-62)
Jarrett Anunoby makes the Midrange and draws the foul on Paul Williamson! And-1! Jarrett Anunoby to the line for 1. [BONUS: 7 team fouls] (Paul Williamson: 1 personal fouls)   FT 1/1: GOOD Jarrett Anunoby makes 1/1 from the line.
Score: 71-65

[00:53] Team_065 possession (Score: 71-65)
Paul Williamson attempts a Midrange. Contested by Jarrett Anunoby (4.8 feet, MAN). PAUL WILLIAMSON MAKES IT! Assist: RJ Harden
Score: 73-65

[00:41] Team_041 possession (Score: 73-65)
Terry Barrett attempts a Layup. BLOCKED BY PAUL WILLIAMSON! Ball is loose! Rebound secured by Manu McGrady.

[00:28] Team_065 possession (Score: 73-65)
Karl Booker attempts a Layup. Contested by Terry Barrett (3.8 feet, ZONE). KARL BOOKER MAKES IT!
Score: 75-65

[00:11] Team_041 possession (Score: 75-65)
Dejounte Griffin drives and kicks out. Terry Barrett attempts a 3Pt. Contested by Russell Wade (3.6 feet, MAN). Terry Barrett misses. Rebound secured by RJ Harden.

================================================================================
                              3RD QUARTER COMPLETE                              
================================================================================

3RD QUARTER SCORE: Team_065 30, Team_041 24

BOX SCORE:
================================================================================

Team_065
--------------------------------------------------------------------------------
Player                MIN  PTS  REB  AST  TO      FG   FG%      3P   3P%
--------------------------------------------------------------------------------
Paul Williamson        26   12    0    1   0   5/7    71.4     0/0   0.0
Russell Wade           26    8    6    2   0   4/4   100.0     0/0   0.0
Manu McGrady           26    5    5    2   0   2/3    66.7     0/0   0.0
Karl Booker            26    5    0    0   0   2/4    50.0     0/0   0.0
RJ Harden              26    0    3    2   0   0/2     0.0     0/0   0.0

TEAM: FG: 13/20 (65.0%), 3PT: 3/7 (42.9%), REB: 14 (2 off, 12 def), AST: 7, TO: 3
TEAM FOULS: 7 [Team_041 in BONUS]


Team_041
--------------------------------------------------------------------------------
Player                MIN  PTS  REB  AST  TO      FG   FG%      3P   3P%
--------------------------------------------------------------------------------
Terry Barrett          26    9    4    0   0   4/5    80.0     0/0   0.0
Jarrett Anunoby        26    7    0    1   0   3/7    42.9     0/0   0.0
Dejounte Griffin       29    6    1    1   0   2/5    40.0     0/0   0.0
Stephen Ingram         26    2    2    0   0   1/1   100.0     0/0   0.0
Scottie Turner         26    0    0    2   0   0/4     0.0     0/0   0.0

TEAM: FG: 10/22 (45.5%), 3PT: 1/7 (14.3%), REB: 7 (1 off, 6 def), AST: 4, TO: 1
TEAM FOULS: 1

================================================================================

================================================================================
                       4TH QUARTER - Team_065 vs Team_041                       
================================================================================

[12:00] Team_065 possession (Score: 75-65)
RJ Harden attempts a 3Pt. Contested by Scottie Turner (4.8 feet, MAN). RJ Harden misses. Rebound secured by Terry Barrett.

[11:47] Team_041 possession (Score: 75-65)
Dejounte Griffin attempts a 3Pt. Contested by RJ Harden (4.2 feet, ZONE). Dejounte Griffin misses. FOUL! Loose ball foul on Russell Wade during the rebound battle. [Team fouls: 1] No free throws, side out. (Russell Wade: 1 personal fouls)

[11:30] Team_041 possession (Score: 75-65)
Jarrett Anunoby drives, Paul Williamson stays with him. Jarrett Anunoby attempts a Dunk. Contested by Paul Williamson (4.2 feet, MAN). JARRETT ANUNOBY MAKES IT!
Score: 75-67

[11:17] Team_065 possession (Score: 75-67)
Manu McGrady commits a violation (traveling/carry)! TURNOVER! (dead ball)

[11:17] Substitution (Team_065): RJ Harden OUT → Paul Curry IN (stamina_rule2)

[11:17] Substitution (Team_065): Paul Williamson OUT → Derrick Poole IN (stamina_rule2)

[11:17] Substitution (Team_065): Manu McGrady OUT → D'Angelo Porzingis IN (stamina_rule2)

[11:17] Substitution (Team_065): Russell Wade OUT → Karl Leonard IN (stamina_rule2)

[11:17] Substitution (Team_065): Karl Booker OUT → Vince Mobley IN (stamina_rule2)

[11:17] Substitution (Team_041): Scottie Turner OUT → Franz Rose IN (stamina_rule2)

[11:17] Substitution (Team_041): Jarrett Anunoby OUT → Kyrie Booker IN (stamina_rule2)

[11:17] Substitution (Team_041): Dejounte Griffin OUT → Bam McCollum IN (stamina_rule2)

[11:17] Substitution (Team_041): Stephen Ingram OUT → Tobias McCollum IN (stamina_rule2)

[11:17] Substitution (Team_041): Terry Barrett OUT → De'Aaron Poole IN (stamina_rule2)

[11:05] Team_041 possession (Score: 75-67)
Kyrie Booker loses the ball! Stripped by Derrick Poole! TURNOVER! (live ball)

[10:49] Team_065 possession (Score: 75-67)
D'Angelo Porzingis attempts a 3Pt. Wide open! Bam McCollum is 6.0 feet away. [MAN] D'Angelo Porzingis misses. Rebound secured by Kyrie Booker.

[10:31] Team_041 possession (Score: 75-67)
Bam McCollum throws a bad pass! Stolen by D'Angelo Porzingis! TURNOVER! (live ball)

[10:17] Team_065 possession (Score: 75-67)
Paul Curry drives and kicks out. Karl Leonard attempts a 3Pt. Contested by Kyrie Booker (4.4 feet, ZONE). Karl Leonard misses. Rebound secured by De'Aaron Poole.

[10:04] Team_041 possession (Score: 75-67)
De'Aaron Poole attempts a Midrange. Contested by D'Angelo Porzingis (4.2 feet, ZONE). De'Aaron Poole misses. Rebound secured by Vince Mobley.

[09:52] Team_065 possession (Score: 75-67)
Derrick Poole drives, picks up Kyrie Booker. Help arrives from Bam McCollum! Derrick Poole attempts a Layup. Contested by Bam McCollum (4.4 feet, MAN). Derrick Poole misses. Rebound secured by Kyrie Booker.

[09:36] Team_041 possession (Score: 75-67)
Kyrie Booker attempts a 3Pt. Contested by Paul Curry (4.8 feet, ZONE). Kyrie Booker misses. Rebound secured by Karl Leonard.

[09:24] Team_065 possession (Score: 75-67)
D'Angelo Porzingis attempts a Layup. BLOCKED BY TOBIAS MCCOLLUM! Ball is loose! Offensive rebound by Vince Mobley! Vince Mobley kicks it out.

[09:10] Team_065 possession (Score: 75-67)
D'Angelo Porzingis attempts a 3Pt. Contested by Kyrie Booker (4.5 feet, ZONE). D'Angelo Porzingis misses. Rebound secured by De'Aaron Poole.

[08:55] Team_041 possession (Score: 75-67)
Franz Rose drives, Vince Mobley stays with him. Franz Rose attempts a Layup. Contested by Vince Mobley (4.2 feet, ZONE). FRANZ ROSE MAKES IT! Assist: Kyrie Booker
Score: 75-69

[08:37] Team_065 possession (Score: 75-69)
Karl Leonard drives and kicks out. Derrick Poole attempts a 3Pt. Contested by Kyrie Booker (4.4 feet, ZONE). DERRICK POOLE MAKES IT! Assist: Karl Leonard
Score: 78-69

[08:22] Team_041 possession (Score: 78-69)
FOUL! Shooting foul on Vince Mobley. Tobias McCollum to the line for 2 free throws. [Team fouls: 2] (Vince Mobley: 1 personal fouls)   FT 1/2: GOOD   FT 2/2: GOOD Tobias McCollum makes 2/2 from the line.
Score: 78-71

[08:03] Team_065 possession (Score: 78-71)
Paul Curry attempts a Midrange. Contested by Franz Rose (5.7 feet, MAN). Paul Curry misses. Rebound secured by Tobias McCollum.

[07:50] Team_041 possession (Score: 78-71)
Tobias McCollum attempts a 3Pt. Contested by Karl Leonard (4.7 feet, MAN). Tobias McCollum misses. Rebound secured by D'Angelo Porzingis.

[07:37] Team_065 possession (Score: 78-71)
Karl Leonard attempts a Midrange. Contested by Tobias McCollum (5.4 feet, MAN). Karl Leonard misses. Rebound secured by Kyrie Booker.

[07:19] Team_041 possession (Score: 78-71)
Bam McCollum attempts a 3Pt. Contested by D'Angelo Porzingis (4.0 feet, MAN). BAM MCCOLLUM MAKES IT! Assist: Tobias McCollum
Score: 78-74

[07:06] Team_065 possession (Score: 78-74)
D'Angelo Porzingis attempts a Midrange. Wide open! Bam McCollum is 6.0 feet away. [MAN] D'ANGELO PORZINGIS MAKES IT! Assist: Vince Mobley
Score: 80-74

[06:52] Team_041 possession (Score: 80-74)
Bam McCollum throws a bad pass! Stolen by D'Angelo Porzingis! TURNOVER! (live ball)

[06:37] Team_065 possession (Score: 80-74)
FOUL! Shooting foul on Tobias McCollum. Karl Leonard to the line for 2 free throws. [Team fouls: 1] (Tobias McCollum: 1 personal fouls)   FT 1/2: GOOD   FT 2/2: GOOD Karl Leonard makes 2/2 from the line.
Score: 82-74

[06:18] Team_041 possession (Score: 82-74)
Tobias McCollum attempts a 3Pt. Contested by Karl Leonard (4.7 feet, MAN). Tobias McCollum misses. Offensive rebound by De'Aaron Poole! De'Aaron Poole's putback is no good. Rebound secured by Karl Leonard.

[06:05] Team_065 possession (Score: 82-74)
Derrick Poole drives, Kyrie Booker stays with him. Derrick Poole attempts a Dunk. Contested by Kyrie Booker (4.4 feet, MAN). DERRICK POOLE MAKES IT! Assist: Karl Leonard
Score: 84-74

[05:54] Team_041 possession (Score: 84-74)
Franz Rose drives, Paul Curry stays with him. Franz Rose attempts a Dunk. Contested by Paul Curry (4.9 feet, MAN). FRANZ ROSE MAKES IT! Assist: Kyrie Booker
Score: 84-76

[05:40] Team_065 possession (Score: 84-76)
D'Angelo Porzingis makes the Dunk and draws the foul on Tobias McCollum! And-1! D'Angelo Porzingis to the line for 1. [Team fouls: 2] (Tobias McCollum: 2 personal fouls)   FT 1/1: GOOD D'Angelo Porzingis makes 1/1 from the line.
Score: 87-76

[05:27] Team_041 possession (Score: 87-76)
Franz Rose attempts a Midrange. Contested by Karl Leonard (4.5 feet, ZONE). Franz Rose misses. Rebound secured by Vince Mobley.

[05:11] Team_065 possession (Score: 87-76)
Paul Curry drives and kicks out. Paul Curry attempts a Midrange. Contested by Bam McCollum (5.9 feet, ZONE). PAUL CURRY MAKES IT! Assist: Vince Mobley
Score: 89-76

[04:58] Team_041 possession (Score: 89-76)
Kyrie Booker drives, Vince Mobley stays with him. Kyrie Booker attempts a Layup. Contested by Vince Mobley (4.2 feet, ZONE). KYRIE BOOKER MAKES IT! Assist: Bam McCollum
Score: 89-78

[04:41] Team_065 possession (Score: 89-78)
D'Angelo Porzingis attempts a 3Pt. Contested by Kyrie Booker (4.6 feet, ZONE). D'Angelo Porzingis misses. Rebound secured by Tobias McCollum.

[04:25] Team_041 possession (Score: 89-78)
Tobias McCollum makes the Layup and draws the foul on Karl Leonard! And-1! Tobias McCollum to the line for 1. [Team fouls: 3] (Karl Leonard: 1 personal fouls)   FT 1/1: GOOD Tobias McCollum makes 1/1 from the line.
Score: 89-81

[04:08] Team_065 possession (Score: 89-81)
D'Angelo Porzingis drives, Bam McCollum stays with him. D'Angelo Porzingis attempts a Layup. Wide open! Bam McCollum is 6.0 feet away. [MAN] D'ANGELO PORZINGIS MAKES IT! Assist: Derrick Poole
Score: 91-81

[03:51] Team_041 possession (Score: 91-81)
Tobias McCollum makes the Dunk and draws the foul on Derrick Poole! And-1! Tobias McCollum to the line for 1. [Team fouls: 4] (Derrick Poole: 1 personal fouls)   FT 1/1: GOOD Tobias McCollum makes 1/1 from the line.
Score: 91-84

[03:37] Team_065 possession (Score: 91-84)
D'Angelo Porzingis attempts a 3Pt. Contested by Kyrie Booker (4.6 feet, ZONE). D'Angelo Porzingis misses. Offensive rebound by Vince Mobley! Vince Mobley's putback is no good. Offensive rebound by Vince Mobley! Vince Mobley kicks it out.

[03:23] Team_065 possession (Score: 91-84)
Vince Mobley drives and kicks out. Paul Curry attempts a 3Pt. Contested by Kyrie Booker (4.5 feet, ZONE). Paul Curry misses. Rebound secured by De'Aaron Poole.

[03:08] Team_041 possession (Score: 91-84)
FOUL! Holding foul on D'Angelo Porzingis. [IN THE BONUS! 5 team fouls] Bam McCollum to the line for 2 free throws. (D'Angelo Porzingis: 1 personal fouls)   FT 1/2: GOOD   FT 2/2: GOOD Bam McCollum makes 2/2 from the line.
Score: 91-86

[02:52] Team_065 possession (Score: 91-86)
Paul Curry attempts a 3Pt. Contested by Franz Rose (5.8 feet, MAN). Paul Curry misses. Offensive rebound by D'Angelo Porzingis! D'Angelo Porzingis kicks it out.

[02:36] Team_065 possession (Score: 91-86)
D'Angelo Porzingis attempts a 3Pt. Contested by Kyrie Booker (4.7 feet, ZONE). D'Angelo Porzingis misses. Rebound secured by De'Aaron Poole.

[02:26] Team_041 possession (Score: 91-86)
Franz Rose attempts a 3Pt. Contested by D'Angelo Porzingis (4.4 feet, ZONE). Franz Rose misses. Rebound secured by Vince Mobley.

[02:06] Team_065 possession (Score: 91-86)
Derrick Poole attempts a Layup. Contested by Kyrie Booker (4.6 feet, MAN). DERRICK POOLE MAKES IT! Assist: Karl Leonard
Score: 93-86

[01:49] Team_041 possession (Score: 93-86)
De'Aaron Poole loses control! Ball rolls out of bounds! TURNOVER! (dead ball)

[01:37] Team_065 possession (Score: 93-86)
Paul Curry attempts a 3Pt. Contested by Franz Rose (5.9 feet, MAN). Paul Curry misses. Offensive rebound by D'Angelo Porzingis! D'Angelo Porzingis kicks it out.

[01:23] Team_065 possession (Score: 93-86)
Paul Curry attempts a 3Pt. Contested by Kyrie Booker (5.1 feet, ZONE). Paul Curry misses. Rebound secured by Tobias McCollum.

[01:05] Team_041 possession (Score: 93-86)
Kyrie Booker drives, picks up Vince Mobley. Help arrives from Derrick Poole! Kyrie Booker attempts a Dunk. Contested by Derrick Poole (4.5 feet, ZONE). Kyrie Booker misses. Rebound secured by Vince Mobley.

[00:49] Team_065 possession (Score: 93-86)
D'Angelo Porzingis drives and kicks out. Vince Mobley attempts a 3Pt. Contested by Kyrie Booker (4.8 feet, ZONE). Vince Mobley misses. FOUL! Loose ball foul on De'Aaron Poole during the rebound battle. [Team fouls: 3] No free throws, side out. (De'Aaron Poole: 1 personal fouls)

[00:33] Team_065 possession (Score: 93-86)
D'Angelo Porzingis drives, Bam McCollum stays with him. D'Angelo Porzingis attempts a Layup. Wide open! Bam McCollum is 6.3 feet away. [MAN] D'ANGELO PORZINGIS MAKES IT!
Score: 95-86

[00:21] Team_041 possession (Score: 95-86)
Kyrie Booker attempts a 3Pt. Contested by D'Angelo Porzingis (4.6 feet, ZONE). Kyrie Booker misses. Rebound secured by Karl Leonard.

[00:09] Team_065 possession (Score: 95-86)
FOUL! Shooting foul on Tobias McCollum. Karl Leonard to the line for 3 free throws. [Team fouls: 4] (Tobias McCollum: 3 personal fouls)   FT 1/3: GOOD   FT 2/3: GOOD   FT 3/3: GOOD Karl Leonard makes 3/3 from the line.
Score: 98-86

================================================================================
                              4TH QUARTER COMPLETE                              
================================================================================

4TH QUARTER SCORE: Team_065 23, Team_041 21

BOX SCORE:
================================================================================

Team_065
--------------------------------------------------------------------------------
Player                MIN  PTS  REB  AST  TO      FG   FG%      3P   3P%
--------------------------------------------------------------------------------
D'Angelo Porzingis     22    9    4    0   0   4/8    50.0     0/0   0.0
Derrick Poole          22    7    0    1   0   3/4    75.0     0/0   0.0
Karl Leonard           22    5    3    3   0   2/3    66.7     0/0   0.0
Paul Curry             22    2    0    0   0   1/4    25.0     0/0   0.0
RJ Harden              26    0    0    0   0   0/1     0.0     0/0   0.0
Vince Mobley           22    0    6    2   0   0/1     0.0     0/0   0.0

TEAM: FG: 10/21 (47.6%), 3PT: 1/7 (14.3%), REB: 12 (5 off, 7 def), AST: 6, TO: 1
TEAM FOULS: 5 [Team_041 in BONUS]


Team_041
--------------------------------------------------------------------------------
Player                MIN  PTS  REB  AST  TO      FG   FG%      3P   3P%
--------------------------------------------------------------------------------
Tobias McCollum        22    8    3    1   0   3/5    60.0     0/0   0.0
Bam McCollum           19    5    0    1   0   2/2   100.0     0/0   0.0
Franz Rose             22    4    0    0   0   2/4    50.0     0/0   0.0
Jarrett Anunoby        26    2    0    0   0   1/1   100.0     0/0   0.0
Kyrie Booker           22    2    3    2   0   1/4    25.0     0/0   0.0
Terry Barrett          26    0    2    0   0   0/0     0.0     0/0   0.0
De'Aaron Poole         22    0    4    0   0   0/1     0.0     0/0   0.0

TEAM: FG: 9/17 (52.9%), 3PT: 1/6 (16.7%), REB: 13 (2 off, 11 def), AST: 4, TO: 4
TEAM FOULS: 4

================================================================================

================================================================================
                               FULL GAME COMPLETE                               
================================================================================

FINAL SCORE: Team_065 98, Team_041 86

SCORING BY QUARTER:
--------------------------------------------------------------------------------
Team                     Q1     Q2     Q3     Q4    FINAL
--------------------------------------------------------------------------------
Team_065                 23     22     30     23       98
Team_041                 15     26     24     21       86
--------------------------------------------------------------------------------

FULL GAME BOX SCORE:
================================================================================

Team_065
--------------------------------------------------------------------------------
Player                MIN  PTS  REB  AST  TO      FG   FG%      3P   3P%      FT STL BLK
--------------------------------------------------------------------------------
RJ Harden              26    4    9    2   2   2/6    33.3   0/4     0.0   2/2     2   0
Paul Williamson        26   18    0    1   2   7/12   58.3   3/4    75.0   3/3     0   2
Manu McGrady           26    9   10    3   2   4/6    66.7   1/3    33.3   1/2     0   0
Russell Wade           26   13   12    3   2   4/8    50.0   0/1     0.0   2/2     0   0
Karl Booker            26   10    0    0   0   6/11   54.5   0/1     0.0   1/1     0   0
Paul Curry             22    5    0    0   0   2/8    25.0   1/4    25.0   0/0     1   0
Derrick Poole          22    7    0    2   0   3/7    42.9   0/0     0.0   0/2     1   0
D'Angelo Porzingis     22   11    6    0   1   5/9    55.6   0/4     0.0   3/3     2   0
Karl Leonard           22   10    5    3   0   5/10   50.0   1/4    25.0   8/8     0   0
Vince Mobley           22    7   13    2   0   2/3    66.7   0/0     0.0   1/1     0   1

TEAM: FG: 40/80 (50.0%), 3PT: 6/25 (24.0%), REB: 54 (12 off, 42 def), AST: 16, TO: 9


Team_041
--------------------------------------------------------------------------------
Player                MIN  PTS  REB  AST  TO      FG   FG%      3P   3P%      FT STL BLK
--------------------------------------------------------------------------------
Dejounte Griffin       29    9    9    2   0   3/10   30.0   2/5    40.0   1/1     0   0
Scottie Turner         26    6    0    3   1   2/9    22.2   1/8    12.5   1/1     0   0
Jarrett Anunoby        26    9    0    2   0   5/11   45.5   1/4    25.0   1/1     1   0
Stephen Ingram         26    2    6    1   2   3/5    60.0   1/1   100.0   0/0     1   1
Terry Barrett          26   19   11    0   1   6/9    66.7   0/0     0.0   3/3     0   2
Franz Rose             22    4    0    2   1   2/6    33.3   0/2     0.0   0/0     0   0
Kyrie Booker           22    7    4    2   1   3/8    37.5   0/4     0.0   1/1     0   0
Tobias McCollum        22   18    9    1   0   7/11   63.6   1/3    33.3   7/7     0   2
De'Aaron Poole         22    7    7    0   1   3/7    42.9   0/2     0.0   3/3     0   0
Bam McCollum           19    5    0    2   2   1/2    50.0   1/2    50.0   2/2     0   0

TEAM: FG: 36/79 (45.6%), 3PT: 7/31 (22.6%), REB: 47 (8 off, 39 def), AST: 15, TO: 9

================================================================================
