================================================================================
                        FULL GAME - Team_070 vs Team_086                        
================================================================================

================================================================================
                       1ST QUARTER - Team_070 vs Team_086                       
================================================================================

[12:00] Team_070 possession (Score: 0-0)
LeBron Barnes attempts a Midrange. Contested by Bones Ginobili (5.2 feet, ZONE). LeBron Barnes misses. Rebound secured by Rudy Rose.

[11:47] Team_086 possession (Score: 0-0)
Lauri Johnson attempts a 3Pt. Contested by Cole Gasol (5.5 feet, MAN). Lauri Johnson misses. Rebound secured by Khris Bryant.

[11:33] Team_070 possession (Score: 0-0)
LeBron Barnes attempts a 3Pt. Contested by Lauri Johnson (4.8 feet, ZONE). LEBRON BARNES MAKES IT!
Score: 3-0

[11:17] Team_086 possession (Score: 3-0)
FOUL! Shooting foul on Khris Bryant. Miles Gobert to the line for 3 free throws. [Team fouls: 1] (Khris Bryant: 1 personal fouls)   FT 1/3: GOOD   FT 2/3: GOOD   FT 3/3: GOOD Miles Gobert makes 3/3 from the line.
Score: 3-3

[11:02] Team_070 possession (Score: 3-3)
LeBron Barnes attempts a 3Pt. Contested by Anfernee Harris (4.7 feet, ZONE). LeBron Barnes misses. Rebound secured by Rudy Rose.

[10:49] Team_086 possession (Score: 3-3)
Miles Gobert throws a bad pass! Stolen by John Hyland! TURNOVER! (live ball)

[10:33] Team_070 possession (Score: 3-3)
LeBron Barnes attempts a Midrange. Contested by Anfernee Harris (4.7 feet, MAN). LEBRON BARNES MAKES IT!
Score: 5-3

[10:20] Team_086 possession (Score: 5-3)
Rudy Rose attempts a Midrange. Contested by Khris Bryant (2.7 feet, MAN). Rudy Rose misses. Rebound secured by Jabari Paul.

[10:05] Team_070 possession (Score: 5-3)
FOUL! Shooting foul on Anfernee Harris. Jabari Paul to the line for 2 free throws. [Team fouls: 1] (Anfernee Harris: 1 personal fouls)   FT 1/2: GOOD   FT 2/2: GOOD Jabari Paul makes 2/2 from the line.
Score: 7-3

[09:54] Team_086 possession (Score: 7-3)
Lauri Johnson attempts a 3Pt. Contested by Khris Bryant (2.7 feet, ZONE). LAURI JOHNSON MAKES IT! Assist: Miles Gobert
Score: 7-6

[09:41] Team_070 possession (Score: 7-6)
Jabari Paul makes the Layup and draws the foul on Rudy Rose! And-1! Jabari Paul to the line for 1. [Team fouls: 2] (Rudy Rose: 1 personal fouls)   FT 1/1: MISS Jabari Paul makes 0/1 from the line. Offensive rebound by Khris Bryant! Khris Bryant puts it back in!
Score: 11-6

[09:28] Team_086 possession (Score: 11-6)
Anfernee Harris attempts a 3Pt. Contested by Khris Bryant (3.0 feet, ZONE). Anfernee Harris misses. Rebound secured by Jabari Paul.

[09:14] Team_070 possession (Score: 11-6)
Khris Bryant attempts a 3Pt. Contested by Lauri Johnson (4.3 feet, ZONE). Khris Bryant misses. Rebound secured by Rudy Rose.

[09:00] Team_086 possession (Score: 11-6)
Miles Gobert attempts a 3Pt. Contested by John Hyland (4.7 feet, MAN). Miles Gobert misses. Rebound secured by Jabari Paul.

[08:47] Team_070 possession (Score: 11-6)
Cole Gasol attempts a 3Pt. Contested by Anfernee Harris (4.4 feet, ZONE). COLE GASOL MAKES IT!
Score: 14-6

[08:36] Team_086 possession (Score: 14-6)
FOUL! Holding foul on Cole Gasol. [Team fouls: 2] No free throws, side out. (Cole Gasol: 1 personal fouls)

[08:23] Team_086 possession (Score: 14-6)
Lauri Johnson makes the Midrange and draws the foul on Cole Gasol! And-1! Lauri Johnson to the line for 1. [Team fouls: 3] (Cole Gasol: 2 personal fouls)   FT 1/1: MISS Lauri Johnson makes 0/1 from the line. Rebound secured by Jabari Paul.
Score: 14-8

[08:06] Team_070 possession (Score: 14-8)
Cole Gasol attempts a 3Pt. Contested by Lauri Johnson (4.6 feet, MAN). Cole Gasol misses. Rebound secured by Miles Gobert.

[07:49] Team_086 possession (Score: 14-8)
FOUL! Shooting foul on Cole Gasol. Lauri Johnson to the line for 2 free throws. [Team fouls: 4] (Cole Gasol: 3 personal fouls)   FT 1/2: GOOD   FT 2/2: GOOD Lauri Johnson makes 2/2 from the line.
Score: 14-10

[07:36] Team_070 possession (Score: 14-10)
Khris Bryant attempts a Midrange. Contested by Bones Ginobili (4.7 feet, MAN). KHRIS BRYANT MAKES IT! Assist: John Hyland
Score: 16-10

[07:18] Team_086 possession (Score: 16-10)
Lauri Johnson drives and kicks out. Rudy Rose makes the Midrange and draws the foul on LeBron Barnes! And-1! Rudy Rose to the line for 1. [BONUS: 5 team fouls] (LeBron Barnes: 1 personal fouls)   FT 1/1: GOOD Rudy Rose makes 1/1 from the line.
Score: 16-13

[07:05] Team_070 possession (Score: 16-13)
Khris Bryant attempts a 3Pt. Contested by Bones Ginobili (4.7 feet, MAN). Khris Bryant misses. Rebound secured by Miles Gobert.

[06:52] Team_086 possession (Score: 16-13)
Rudy Rose attempts a Midrange. Contested by Khris Bryant (2.7 feet, ZONE). Rudy Rose misses. Offensive rebound by Rudy Rose! Rudy Rose's putback is no good. Rebound secured by LeBron Barnes.

[06:39] Team_070 possession (Score: 16-13)
Cole Gasol attempts a 3Pt. Contested by Miles Gobert (3.7 feet, ZONE). Cole Gasol misses. Rebound secured by Rudy Rose.

[06:29] Team_086 possession (Score: 16-13)
Bones Ginobili throws a bad pass! Stolen by Khris Bryant! TURNOVER! (live ball)

[06:15] Team_070 possession (Score: 16-13)
FOUL! Shooting foul on Miles Gobert. LeBron Barnes to the line for 2 free throws. [Team fouls: 3] (Miles Gobert: 1 personal fouls)   FT 1/2: GOOD   FT 2/2: GOOD LeBron Barnes makes 2/2 from the line.
Score: 18-13

[05:59] Team_086 possession (Score: 18-13)
Miles Gobert attempts a 3Pt. Contested by John Hyland (4.7 feet, MAN). MILES GOBERT MAKES IT! Assist: Rudy Rose
Score: 18-16

[05:42] Team_070 possession (Score: 18-16)
Cole Gasol drives and kicks out. Khris Bryant attempts a 3Pt. Contested by Lauri Johnson (4.4 feet, ZONE). Khris Bryant misses. FOUL! Loose ball foul on Miles Gobert during the rebound battle. [Team fouls: 4] No free throws, side out. (Miles Gobert: 2 personal fouls)

[05:24] Team_070 possession (Score: 18-16)
LeBron Barnes drives and kicks out. LeBron Barnes attempts a Midrange. Contested by Anfernee Harris (4.2 feet, MAN). LEBRON BARNES MAKES IT! Assist: John Hyland
Score: 20-16

[05:07] Team_086 possession (Score: 20-16)
Lauri Johnson drives and kicks out. Anfernee Harris attempts a 3Pt. Contested by Khris Bryant (2.5 feet, ZONE). Anfernee Harris misses. Rebound secured by LeBron Barnes.

[04:50] Team_070 possession (Score: 20-16)
LeBron Barnes attempts a 3Pt. Contested by Anfernee Harris (4.7 feet, MAN). LeBron Barnes misses. Rebound secured by Miles Gobert.

[04:36] Team_086 possession (Score: 20-16)
Rudy Rose attempts a Dunk. BLOCKED BY KHRIS BRYANT! Ball deflects out of bounds off Rudy Rose.

[04:19] Team_070 possession (Score: 20-16)
John Hyland attempts a 3Pt. Contested by Lauri Johnson (4.4 feet, ZONE). JOHN HYLAND MAKES IT! Assist: Jabari Paul
Score: 23-16

[04:05] Team_086 possession (Score: 23-16)
Miles Gobert drives, picks up Khris Bryant. Help arrives from LeBron Barnes! Miles Gobert attempts a Dunk. Contested by LeBron Barnes (2.8 feet, ZONE). MILES GOBERT MAKES IT! Assist: Anfernee Harris
Score: 23-18

[03:50] Team_070 possession (Score: 23-18)
LeBron Barnes drives and kicks out. Jabari Paul attempts a 3Pt. Contested by Rudy Rose (3.8 feet, MAN). Jabari Paul misses. Rebound secured by Miles Gobert.

[03:34] Team_086 possession (Score: 23-18)
FOUL! Shooting foul on Khris Bryant. Bones Ginobili to the line for 2 free throws. [BONUS: 6 team fouls] (Khris Bryant: 2 personal fouls)   FT 1/2: MISS   FT 2/2: GOOD Bones Ginobili makes 1/2 from the line.
Score: 23-19

[03:22] Team_070 possession (Score: 23-19)
LeBron Barnes attempts a 3Pt. Contested by Anfernee Harris (4.8 feet, MAN). LeBron Barnes misses. Rebound secured by Miles Gobert.

[03:08] Team_086 possession (Score: 23-19)
Lauri Johnson attempts a 3Pt. Contested by Khris Bryant (2.9 feet, ZONE). LAURI JOHNSON MAKES IT! Assist: Anfernee Harris
Score: 23-22

[02:49] Team_070 possession (Score: 23-22)
Khris Bryant throws a bad pass! Stolen by Bones Ginobili! TURNOVER! (live ball)

[02:39] Team_086 possession (Score: 23-22)
FOUL! Holding foul on Cole Gasol. [IN THE BONUS! 7 team fouls] Lauri Johnson to the line for 2 free throws. (Cole Gasol: 4 personal fouls)   FT 1/2: GOOD   FT 2/2: GOOD Lauri Johnson makes 2/2 from the line.
Score: 23-24

[02:25] Team_070 possession (Score: 23-24)
Khris Bryant attempts a Midrange. Contested by Bones Ginobili (4.9 feet, ZONE). KHRIS BRYANT MAKES IT!
Score: 25-24

[02:14] Team_086 possession (Score: 25-24)
Rudy Rose drives, Khris Bryant stays with him. Rudy Rose attempts a Dunk. Contested by Khris Bryant (3.1 feet, MAN). Rudy Rose misses. Rebound secured by Jabari Paul.

[01:59] Team_070 possession (Score: 25-24)
FOUL! Holding foul on Rudy Rose. [IN THE BONUS! 5 team fouls] Jabari Paul to the line for 2 free throws. (Rudy Rose: 2 personal fouls)   FT 1/2: GOOD   FT 2/2: GOOD Jabari Paul makes 2/2 from the line.
Score: 27-24

[01:43] Team_086 possession (Score: 27-24)
Rudy Rose attempts a Midrange. Contested by Khris Bryant (3.1 feet, MAN). Rudy Rose misses. Rebound secured by Jabari Paul.

[01:30] Team_070 possession (Score: 27-24)
Khris Bryant attempts a 3Pt. Contested by Bones Ginobili (5.0 feet, MAN). Khris Bryant misses. Rebound secured by Rudy Rose.

[01:18] Team_086 possession (Score: 27-24)
Lauri Johnson attempts a Midrange. Contested by LeBron Barnes (4.2 feet, ZONE). LAURI JOHNSON MAKES IT! Assist: Bones Ginobili
Score: 27-26

[01:05] Team_070 possession (Score: 27-26)
LeBron Barnes attempts a 3Pt. Contested by Lauri Johnson (5.2 feet, ZONE). LeBron Barnes misses. FOUL! Loose ball foul on Rudy Rose during the rebound battle. [IN THE BONUS! 6 team fouls] LeBron Barnes to the line for 2 free throws. (Rudy Rose: 3 personal fouls)   FT 1/2: GOOD   FT 2/2: GOOD LeBron Barnes makes 2/2 from the line.
Score: 29-26

[00:54] Team_086 possession (Score: 29-26)
FOUL! Shooting foul on Khris Bryant. Miles Gobert to the line for 3 free throws. [BONUS: 8 team fouls] (Khris Bryant: 3 personal fouls)   FT 1/3: GOOD   FT 2/3: MISS   FT 3/3: GOOD Miles Gobert makes 2/3 from the line.
Score: 29-28

[00:36] Team_070 possession (Score: 29-28)
John Hyland attempts a 3Pt. Contested by Lauri Johnson (4.7 feet, ZONE). JOHN HYLAND MAKES IT! Assist: LeBron Barnes
Score: 32-28

[00:23] Team_086 possession (Score: 32-28)
Miles Gobert attempts a 3Pt. Contested by John Hyland (5.1 feet, MAN). MILES GOBERT MAKES IT! Assist: Rudy Rose
Score: 32-31

[00:06] Team_070 possession (Score: 32-31)
Jabari Paul attempts a 3Pt. Contested by Lauri Johnson (5.5 feet, ZONE). JABARI PAUL MAKES IT! Assist: Cole Gasol
Score: 35-31

================================================================================
                              1ST QUARTER COMPLETE                              
================================================================================

1ST QUARTER SCORE: Team_070 35, Team_086 31

BOX SCORE:
================================================================================

Team_070
--------------------------------------------------------------------------------
Player                MIN  PTS  REB  AST  TO      FG   FG%      3P   3P%
--------------------------------------------------------------------------------
LeBron Barnes          12   11    2    1   0   5/10   50.0     0/0   0.0
Khris Bryant           12    8    2    0   0   3/6    50.0     0/0   0.0
Jabari Paul            12    7    6    1   0   3/3   100.0     0/0   0.0
John Hyland            12    6    0    2   0   2/2   100.0     0/0   0.0
Cole Gasol             12    3    0    1   0   1/3    33.3     0/0   0.0

TEAM: FG: 14/24 (58.3%), 3PT: 6/14 (42.9%), REB: 9 (1 off, 8 def), AST: 5, TO: 1
TEAM FOULS: 8 [Team_086 in BONUS]


Team_086
--------------------------------------------------------------------------------
Player                MIN  PTS  REB  AST  TO      FG   FG%      3P   3P%
--------------------------------------------------------------------------------
Miles Gobert           12   13    5    1   0   5/6    83.3     0/0   0.0
Lauri Johnson          12   12    0    0   0   5/8    62.5     0/0   0.0
Rudy Rose              12    3    5    2   0   1/6    16.7     0/0   0.0
Bones Ginobili         12    1    0    1   0   1/1   100.0     0/0   0.0
Anfernee Harris        12    0    0    2   0   0/1     0.0     0/0   0.0

TEAM: FG: 12/22 (54.5%), 3PT: 6/9 (66.7%), REB: 11 (1 off, 10 def), AST: 6, TO: 2
TEAM FOULS: 6 [Team_070 in BONUS]

================================================================================

================================================================================
                       2ND QUARTER - Team_070 vs Team_086                       
================================================================================

[12:00] Team_070 possession (Score: 35-31)
Cole Gasol attempts a Midrange. Contested by Lauri Johnson (4.8 feet, MAN). COLE GASOL MAKES IT! Assist: Jabari Paul
Score: 37-31

[11:50] Team_086 possession (Score: 37-31)
Anfernee Harris drives, LeBron Barnes stays with him. Anfernee Harris attempts a Layup. Contested by LeBron Barnes (4.4 feet, MAN). ANFERNEE HARRIS MAKES IT! Assist: Bones Ginobili
Score: 37-33

[11:40] Team_070 possession (Score: 37-33)
Jabari Paul loses control! Ball rolls out of bounds! TURNOVER! (dead ball)

[11:40] Substitution (Team_070): Cole Gasol OUT → Paul Quickley IN (stamina_rule2)

[11:40] Substitution (Team_070): LeBron Barnes OUT → Allen Quickley IN (stamina_rule2)

[11:40] Substitution (Team_070): John Hyland OUT → D'Angelo McGrady IN (stamina_rule2)

[11:40] Substitution (Team_070): Khris Bryant OUT → Luka Gobert IN (stamina_rule2)

[11:40] Substitution (Team_070): Jabari Paul OUT → Russell Morant IN (stamina_rule2)

[11:40] Substitution (Team_086): Lauri Johnson OUT → Anfernee Green IN (stamina_rule2)

[11:40] Substitution (Team_086): Anfernee Harris OUT → Anthony James IN (stamina_rule2)

[11:40] Substitution (Team_086): Miles Gobert OUT → Franz McGrady IN (stamina_rule2)

[11:40] Substitution (Team_086): Bones Ginobili OUT → Kyle McCollum IN (stamina_rule2)

[11:40] Substitution (Team_086): Rudy Rose OUT → Lamelo Towns IN (stamina_rule2)

[11:24] Team_086 possession (Score: 37-33)
Kyle McCollum attempts a Midrange. Contested by Luka Gobert (4.8 feet, MAN). KYLE MCCOLLUM MAKES IT!
Score: 37-35

[11:09] Team_070 possession (Score: 37-35)
FOUL! Holding foul on Franz McGrady. [Team fouls: 1] No free throws, side out. (Franz McGrady: 1 personal fouls)

[10:58] Team_070 possession (Score: 37-35)
Russell Morant drives and kicks out. Paul Quickley attempts a 3Pt. Contested by Anfernee Green (4.1 feet, MAN). Paul Quickley misses. Offensive rebound by Russell Morant! Russell Morant's putback is no good. Rebound secured by Anfernee Green.

[10:40] Team_086 possession (Score: 37-35)
Lamelo Towns attempts a Layup. Contested by Russell Morant (3.5 feet, ZONE). LAMELO TOWNS MAKES IT! Assist: Franz McGrady
Score: 37-37

[10:31] Team_070 possession (Score: 37-37)
FOUL! Holding foul on Anfernee Green. [Team fouls: 2] No free throws, side out. (Anfernee Green: 1 personal fouls)

[10:17] Team_070 possession (Score: 37-37)
D'Angelo McGrady attempts a Layup. Contested by Franz McGrady (5.0 feet, MAN). D'ANGELO MCGRADY MAKES IT!
Score: 39-37

[10:00] Team_086 possession (Score: 39-37)
FOUL! Offensive foul on Anthony James! Allen Quickley drew the charge! [Team fouls: 3] (Anthony James: 1 personal fouls) TURNOVER! (dead ball)

[09:50] Team_070 possession (Score: 39-37)
Allen Quickley attempts a Layup. Contested by Lamelo Towns (5.4 feet, ZONE). Allen Quickley misses. Offensive rebound by Russell Morant! Russell Morant's putback is no good. Rebound secured by Kyle McCollum.

[09:35] Team_086 possession (Score: 39-37)
Lamelo Towns attempts a 3Pt. Contested by Paul Quickley (4.1 feet, ZONE). Lamelo Towns misses. Offensive rebound by Lamelo Towns! Lamelo Towns kicks it out.

[09:16] Team_086 possession (Score: 39-37)
Franz McGrady attempts a 3Pt. Contested by Paul Quickley (4.5 feet, ZONE). Franz McGrady misses. Rebound secured by D'Angelo McGrady.

[09:01] Team_070 possession (Score: 39-37)
Paul Quickley commits a violation (traveling/carry)! TURNOVER! (dead ball)

[08:48] Team_086 possession (Score: 39-37)
Anfernee Green makes the Layup and draws the foul on Paul Quickley! And-1! Anfernee Green to the line for 1. [Team fouls: 1] (Paul Quickley: 1 personal fouls)   FT 1/1: GOOD Anfernee Green makes 1/1 from the line.
Score: 39-40

[08:34] Team_070 possession (Score: 39-40)
Luka Gobert drives and kicks out. Paul Quickley attempts a Midrange. Contested by Anfernee Green (4.1 feet, MAN). Paul Quickley misses. Rebound secured by Kyle McCollum.

[08:21] Team_086 possession (Score: 39-40)
Anthony James drives, Allen Quickley stays with him. Anthony James attempts a Dunk. Contested by Allen Quickley (5.9 feet, MAN). Anthony James misses. Rebound secured by Russell Morant.

[08:07] Team_070 possession (Score: 39-40)
Paul Quickley attempts a 3Pt. Contested by Anfernee Green (4.0 feet, MAN). Paul Quickley misses. Rebound secured by Lamelo Towns.

[07:49] Team_086 possession (Score: 39-40)
Lamelo Towns attempts a 3Pt. Contested by Paul Quickley (4.1 feet, ZONE). Lamelo Towns misses. FOUL! Loose ball foul on D'Angelo McGrady during the rebound battle. [Team fouls: 2] No free throws, side out. (D'Angelo McGrady: 1 personal fouls)

[07:37] Team_086 possession (Score: 39-40)
Lamelo Towns attempts a 3Pt. Contested by Paul Quickley (4.1 feet, ZONE). Lamelo Towns misses. Rebound secured by Russell Morant.

[07:23] Team_070 possession (Score: 39-40)
Luka Gobert attempts a 3Pt. Contested by Anthony James (4.1 feet, ZONE). Luka Gobert misses. Offensive rebound by Luka Gobert! Luka Gobert kicks it out.

[07:11] Team_070 possession (Score: 39-40)
FOUL! Shooting foul on Lamelo Towns. Russell Morant to the line for 2 free throws. [Team fouls: 4] (Lamelo Towns: 1 personal fouls)   FT 1/2: GOOD   FT 2/2: GOOD Russell Morant makes 2/2 from the line.
Score: 41-40

[06:53] Team_086 possession (Score: 41-40)
Lamelo Towns makes the Layup and draws the foul on Russell Morant! And-1! Lamelo Towns to the line for 1. [Team fouls: 3] (Russell Morant: 1 personal fouls)   FT 1/1: GOOD Lamelo Towns makes 1/1 from the line.
Score: 41-43

[06:39] Team_070 possession (Score: 41-43)
Allen Quickley attempts a 3Pt. Contested by Anthony James (4.1 feet, MAN). ALLEN QUICKLEY MAKES IT! Assist: D'Angelo McGrady
Score: 44-43

[06:21] Team_086 possession (Score: 44-43)
Anthony James drives, Luka Gobert stays with him. Anthony James attempts a Layup. Contested by Luka Gobert (5.5 feet, ZONE). ANTHONY JAMES MAKES IT!
Score: 44-45

[06:07] Team_070 possession (Score: 44-45)
Paul Quickley attempts a 3Pt. Contested by Anfernee Green (4.0 feet, MAN). Paul Quickley misses. FOUL! Loose ball foul on Lamelo Towns during the rebound battle. [IN THE BONUS! 5 team fouls] Russell Morant to the line for 2 free throws. (Lamelo Towns: 2 personal fouls)   FT 1/2: MISS   FT 2/2: GOOD Russell Morant makes 1/2 from the line.
Score: 45-45

[05:52] Team_086 possession (Score: 45-45)
Kyle McCollum drives, Russell Morant stays with him. Kyle McCollum attempts a Dunk. Contested by Russell Morant (3.7 feet, ZONE). KYLE MCCOLLUM MAKES IT!
Score: 45-47

[05:39] Team_070 possession (Score: 45-47)
Luka Gobert makes the Midrange and draws the foul on Kyle McCollum! And-1! Luka Gobert to the line for 1. [BONUS: 6 team fouls] (Kyle McCollum: 1 personal fouls)   FT 1/1: GOOD Luka Gobert makes 1/1 from the line.
Score: 48-47

[05:26] Team_086 possession (Score: 48-47)
FOUL! Holding foul on Russell Morant. [Team fouls: 4] No free throws, side out. (Russell Morant: 2 personal fouls)

[05:10] Team_086 possession (Score: 48-47)
Lamelo Towns makes the Dunk and draws the foul on Paul Quickley! And-1! Lamelo Towns to the line for 1. [BONUS: 5 team fouls] (Paul Quickley: 2 personal fouls)   FT 1/1: GOOD Lamelo Towns makes 1/1 from the line.
Score: 48-50

[04:56] Team_070 possession (Score: 48-50)
Paul Quickley drives, Lamelo Towns stays with him. Paul Quickley attempts a Dunk. Contested by Lamelo Towns (5.2 feet, ZONE). PAUL QUICKLEY MAKES IT!
Score: 50-50

[04:42] Team_086 possession (Score: 50-50)
Lamelo Towns attempts a Layup. Contested by Russell Morant (3.5 feet, ZONE). Lamelo Towns misses. Offensive rebound by Lamelo Towns! Lamelo Towns kicks it out.

[04:24] Team_086 possession (Score: 50-50)
Lamelo Towns attempts a Layup. Contested by Russell Morant (3.5 feet, MAN). Lamelo Towns misses. Offensive rebound by Lamelo Towns! Lamelo Towns kicks it out.

[04:07] Team_086 possession (Score: 50-50)
Anthony James attempts a 3Pt. Contested by Allen Quickley (6.0 feet, MAN). Anthony James misses. Offensive rebound by Lamelo Towns! Lamelo Towns kicks it out.

[03:53] Team_086 possession (Score: 50-50)
FOUL! Shooting foul on Russell Morant. Lamelo Towns to the line for 2 free throws. [BONUS: 6 team fouls] (Russell Morant: 3 personal fouls)   FT 1/2: MISS   FT 2/2: GOOD Lamelo Towns makes 1/2 from the line.
Score: 50-51

[03:38] Team_070 possession (Score: 50-51)
Allen Quickley attempts a 3Pt. Contested by Anfernee Green (4.2 feet, ZONE). Allen Quickley misses. Offensive rebound by Luka Gobert! Luka Gobert kicks it out.

[03:21] Team_070 possession (Score: 50-51)
Luka Gobert drives and kicks out. Russell Morant attempts a Midrange. Contested by Franz McGrady (5.0 feet, ZONE). Russell Morant misses. Rebound secured by Kyle McCollum.

[03:07] Team_086 possession (Score: 50-51)
Anfernee Green attempts a Layup. Contested by Russell Morant (4.1 feet, ZONE). Anfernee Green misses. Rebound secured by D'Angelo McGrady.

[02:55] Team_070 possession (Score: 50-51)
Allen Quickley attempts a 3Pt. Contested by Anfernee Green (4.3 feet, ZONE). ALLEN QUICKLEY MAKES IT! Assist: Luka Gobert
Score: 53-51

[02:42] Team_086 possession (Score: 53-51)
Anthony James commits a violation (traveling/carry)! TURNOVER! (dead ball)

[02:25] Team_070 possession (Score: 53-51)
Paul Quickley attempts a 3Pt. Contested by Anfernee Green (4.2 feet, ZONE). Paul Quickley misses. FOUL! Loose ball foul on Lamelo Towns during the rebound battle. [IN THE BONUS! 7 team fouls] Russell Morant to the line for 2 free throws. (Lamelo Towns: 3 personal fouls)   FT 1/2: GOOD   FT 2/2: GOOD Russell Morant makes 2/2 from the line.
Score: 55-51

[02:10] Team_086 possession (Score: 55-51)
Anfernee Green attempts a Midrange. Contested by Luka Gobert (5.3 feet, ZONE). Anfernee Green misses. Rebound secured by Russell Morant.

[01:53] Team_070 possession (Score: 55-51)
D'Angelo McGrady attempts a 3Pt. Contested by Anfernee Green (4.4 feet, ZONE). D'Angelo McGrady misses. Rebound secured by Lamelo Towns.

[01:40] Team_086 possession (Score: 55-51)
Franz McGrady attempts a Layup. Contested by Russell Morant (4.2 feet, ZONE). FRANZ MCGRADY MAKES IT! Assist: Anfernee Green
Score: 55-53

[01:30] Team_070 possession (Score: 55-53)
Allen Quickley attempts a Layup. Contested by Anthony James (4.4 feet, MAN). Allen Quickley misses. FOUL! Loose ball foul on Kyle McCollum during the rebound battle. [IN THE BONUS! 8 team fouls] Russell Morant to the line for 2 free throws. (Kyle McCollum: 2 personal fouls)   FT 1/2: MISS   FT 2/2: GOOD Russell Morant makes 1/2 from the line.
Score: 56-53

[01:15] Team_086 possession (Score: 56-53)
Anthony James drives, picks up Allen Quickley. Help arrives from Paul Quickley! Anthony James attempts a Dunk. Wide open! Paul Quickley is 6.2 feet away. [MAN] ANTHONY JAMES MAKES IT! Assist: Anfernee Green
Score: 56-55

[00:57] Team_070 possession (Score: 56-55)
Allen Quickley attempts a 3Pt. Contested by Anthony James (4.5 feet, MAN). ALLEN QUICKLEY MAKES IT! Assist: Paul Quickley
Score: 59-55

[00:45] Team_086 possession (Score: 59-55)
Franz McGrady drives and kicks out. Anthony James attempts a Midrange. Contested by Luka Gobert (5.2 feet, ZONE). Anthony James misses. Offensive rebound by Lamelo Towns! Lamelo Towns kicks it out.

[00:28] Team_086 possession (Score: 59-55)
Lamelo Towns attempts a Layup. Contested by Russell Morant (4.0 feet, MAN). LAMELO TOWNS MAKES IT!
Score: 59-57

[00:14] Team_070 possession (Score: 59-57)
D'Angelo McGrady makes the Layup and draws the foul on Franz McGrady! And-1! D'Angelo McGrady to the line for 1. [BONUS: 9 team fouls] (Franz McGrady: 2 personal fouls)   FT 1/1: GOOD D'Angelo McGrady makes 1/1 from the line.
Score: 62-57

================================================================================
                              2ND QUARTER COMPLETE                              
================================================================================

2ND QUARTER SCORE: Team_070 27, Team_086 26

BOX SCORE:
================================================================================

Team_070
--------------------------------------------------------------------------------
Player                MIN  PTS  REB  AST  TO      FG   FG%      3P   3P%
--------------------------------------------------------------------------------
Allen Quickley         11    9    0    0   0   3/4    75.0     0/0   0.0
Russell Morant         11    6    3    0   0   4/5    80.0     0/0   0.0
D'Angelo McGrady       11    5    2    1   0   2/3    66.7     0/0   0.0
Luka Gobert            11    3    2    1   0   1/3    33.3     0/0   0.0
Cole Gasol             13    2    0    0   0   1/1   100.0     0/0   0.0
Paul Quickley          11    2    0    1   0   1/2    50.0     0/0   0.0
Jabari Paul            13    0    0    1   0   0/0     0.0     0/0   0.0

TEAM: FG: 12/18 (66.7%), 3PT: 5/7 (71.4%), REB: 9 (4 off, 5 def), AST: 4, TO: 2
TEAM FOULS: 6 [Team_086 in BONUS]


Team_086
--------------------------------------------------------------------------------
Player                MIN  PTS  REB  AST  TO      FG   FG%      3P   3P%
--------------------------------------------------------------------------------
Lamelo Towns           11   11    7    0   0   5/6    83.3     0/0   0.0
Kyle McCollum          11    4    3    0   0   2/2   100.0     0/0   0.0
Anthony James          11    4    0    0   0   2/3    66.7     0/0   0.0
Anfernee Green         11    3    2    2   0   1/3    33.3     0/0   0.0
Anfernee Harris        13    2    0    0   0   1/1   100.0     0/0   0.0
Franz McGrady          11    2    0    1   0   1/2    50.0     0/0   0.0
Bones Ginobili         13    0    0    1   0   0/0     0.0     0/0   0.0

TEAM: FG: 12/17 (70.6%), 3PT: 0/2 (0.0%), REB: 10 (6 off, 4 def), AST: 4, TO: 2
TEAM FOULS: 9 [Team_070 in BONUS]

================================================================================

================================================================================
                       3RD QUARTER - Team_070 vs Team_086                       
================================================================================

[12:00] Team_070 possession (Score: 62-57)
FOUL! Holding foul on Lauri Johnson. [Team fouls: 1] No free throws, side out. (Lauri Johnson: 1 personal fouls)

[11:41] Team_070 possession (Score: 62-57)
John Hyland drives, Miles Gobert stays with him. John Hyland attempts a Layup. Contested by Miles Gobert (3.5 feet, MAN). John Hyland misses. Rebound secured by Rudy Rose.

[11:23] Team_086 possession (Score: 62-57)
Bones Ginobili attempts a 3Pt. Contested by Khris Bryant (2.9 feet, MAN). Bones Ginobili misses. Offensive rebound by Rudy Rose! Rudy Rose's putback is no good. Offensive rebound by Rudy Rose! Rudy Rose kicks it out.

[11:10] Team_086 possession (Score: 62-57)
Anfernee Harris drives and kicks out. Bones Ginobili attempts a Midrange. Contested by Khris Bryant (2.4 feet, MAN). Bones Ginobili misses. Rebound secured by Jabari Paul.

[10:51] Team_070 possession (Score: 62-57)
LeBron Barnes loses the ball! Stripped by Anfernee Harris! TURNOVER! (live ball)

[10:35] Team_086 possession (Score: 62-57)
FOUL! Reach-in foul on Khris Bryant during the drive. [Team fouls: 1] No free throws, side out. (Khris Bryant: 1 personal fouls)

[10:23] Team_086 possession (Score: 62-57)
Bones Ginobili attempts a Midrange. Contested by Jabari Paul (4.9 feet, ZONE). BONES GINOBILI MAKES IT! Assist: Miles Gobert
Score: 62-59

[10:05] Team_070 possession (Score: 62-59)
LeBron Barnes drives, picks up Rudy Rose. Help arrives from Anfernee Harris! LeBron Barnes attempts a Layup. Contested by Anfernee Harris (4.2 feet, ZONE). LEBRON BARNES MAKES IT! Assist: Cole Gasol
Score: 64-59

[09:48] Team_086 possession (Score: 64-59)
Bones Ginobili attempts a Layup. BLOCKED BY KHRIS BRYANT! Ball goes out off Khris Bryant. Bones Ginobili's ball!

[09:34] Team_086 possession (Score: 64-59)
Lauri Johnson attempts a Midrange. Contested by Cole Gasol (5.5 feet, MAN). Lauri Johnson misses. Rebound secured by Jabari Paul.

[09:17] Team_070 possession (Score: 64-59)
Khris Bryant attempts a 3Pt. Contested by Lauri Johnson (4.3 feet, ZONE). Khris Bryant misses. Rebound secured by Bones Ginobili.

[09:04] Team_086 possession (Score: 64-59)
FOUL! Shooting foul on John Hyland. Lauri Johnson to the line for 3 free throws. [Team fouls: 2] (John Hyland: 1 personal fouls)   FT 1/3: GOOD   FT 2/3: GOOD   FT 3/3: GOOD Lauri Johnson makes 3/3 from the line.
Score: 64-62

[08:46] Team_070 possession (Score: 64-62)
Khris Bryant attempts a Midrange. Contested by Bones Ginobili (4.7 feet, MAN). Khris Bryant misses. Rebound secured by Miles Gobert.

[08:33] Team_086 possession (Score: 64-62)
Rudy Rose drives, Khris Bryant stays with him. Rudy Rose attempts a Dunk. Contested by Khris Bryant (2.7 feet, MAN). RUDY ROSE MAKES IT! Assist: Lauri Johnson
Score: 64-64

[08:21] Team_070 possession (Score: 64-64)
FOUL! Reach-in foul on Bones Ginobili during the drive. [Team fouls: 2] No free throws, side out. (Bones Ginobili: 1 personal fouls)

[08:07] Team_070 possession (Score: 64-64)
John Hyland drives to the basket... John Hyland loses control! Ball rolls out of bounds! TURNOVER! (dead ball)

[07:52] Team_086 possession (Score: 64-64)
Rudy Rose drives, Khris Bryant stays with him. Rudy Rose attempts a Layup. Contested by Khris Bryant (2.7 feet, ZONE). RUDY ROSE MAKES IT! Assist: Bones Ginobili
Score: 64-66

[07:34] Team_070 possession (Score: 64-66)
LeBron Barnes attempts a 3Pt. Contested by Anfernee Harris (4.7 feet, MAN). LEBRON BARNES MAKES IT! Assist: John Hyland
Score: 67-66

[07:19] Team_086 possession (Score: 67-66)
Rudy Rose attempts a Midrange. Contested by Khris Bryant (2.7 feet, MAN). RUDY ROSE MAKES IT!
Score: 67-68

[07:05] Team_070 possession (Score: 67-68)
FOUL! Holding foul on Miles Gobert. [Team fouls: 3] No free throws, side out. (Miles Gobert: 1 personal fouls)

[06:50] Team_070 possession (Score: 67-68)
LeBron Barnes drives and kicks out. Khris Bryant attempts a 3Pt. Contested by Bones Ginobili (4.8 feet, MAN). Khris Bryant misses. Rebound secured by Bones Ginobili.

[06:34] Team_086 possession (Score: 67-68)
Bones Ginobili attempts a Midrange. Contested by Khris Bryant (2.9 feet, MAN). Bones Ginobili misses. Rebound secured by Khris Bryant.

[06:25] Team_070 possession (Score: 67-68)
Khris Bryant drives and kicks out. LeBron Barnes attempts a 3Pt. Contested by Anfernee Harris (4.2 feet, MAN). LeBron Barnes misses. Rebound secured by Miles Gobert.

[06:11] Team_086 possession (Score: 67-68)
Rudy Rose attempts a 3Pt. Contested by Khris Bryant (2.7 feet, MAN). Rudy Rose misses. Rebound secured by LeBron Barnes.

[06:02] Team_070 possession (Score: 67-68)
LeBron Barnes attempts a 3Pt. Contested by Lauri Johnson (4.8 feet, ZONE). LEBRON BARNES MAKES IT! Assist: John Hyland
Score: 70-68

[05:51] Team_086 possession (Score: 70-68)
Miles Gobert loses the ball! Stripped by John Hyland! TURNOVER! (live ball)

[05:37] Team_070 possession (Score: 70-68)
Khris Bryant makes the Layup and draws the foul on Rudy Rose! And-1! Khris Bryant to the line for 1. [Team fouls: 4] (Rudy Rose: 1 personal fouls)   FT 1/1: GOOD Khris Bryant makes 1/1 from the line.
Score: 73-68

[05:24] Team_086 possession (Score: 73-68)
Bones Ginobili attempts a 3Pt. Contested by Khris Bryant (2.9 feet, ZONE). Bones Ginobili misses. Offensive rebound by Rudy Rose! Rudy Rose's putback is no good. Rebound secured by Khris Bryant.

[05:09] Team_070 possession (Score: 73-68)
LeBron Barnes commits a violation (traveling/carry)! TURNOVER! (dead ball)

[04:58] Team_086 possession (Score: 73-68)
FOUL! Shooting foul on Cole Gasol. Rudy Rose to the line for 2 free throws. [Team fouls: 3] (Cole Gasol: 1 personal fouls)   FT 1/2: GOOD   FT 2/2: GOOD Rudy Rose makes 2/2 from the line.
Score: 73-70

[04:40] Team_070 possession (Score: 73-70)
Jabari Paul drives and kicks out. John Hyland attempts a 3Pt. Contested by Miles Gobert (3.5 feet, MAN). John Hyland misses. Offensive rebound by LeBron Barnes! LeBron Barnes kicks it out.

[04:28] Team_070 possession (Score: 73-70)
Khris Bryant attempts a 3Pt. Contested by Bones Ginobili (4.7 feet, MAN). Khris Bryant misses. Rebound secured by Rudy Rose.

[04:12] Team_086 possession (Score: 73-70)
Anfernee Harris attempts a Layup. BLOCKED BY JABARI PAUL! Ball deflects out of bounds off Anfernee Harris.

[04:00] Team_070 possession (Score: 73-70)
FOUL! Holding foul on Anfernee Harris. [IN THE BONUS! 5 team fouls] LeBron Barnes to the line for 2 free throws. (Anfernee Harris: 1 personal fouls)   FT 1/2: GOOD   FT 2/2: GOOD LeBron Barnes makes 2/2 from the line.
Score: 75-70

[03:47] Team_086 possession (Score: 75-70)
Lauri Johnson attempts a 3Pt. Contested by Khris Bryant (2.8 feet, ZONE). Lauri Johnson misses. Rebound secured by Jabari Paul.

[03:30] Team_070 possession (Score: 75-70)
FOUL! Shooting foul on Anfernee Harris. LeBron Barnes to the line for 2 free throws. [BONUS: 6 team fouls] (Anfernee Harris: 2 personal fouls)   FT 1/2: GOOD   FT 2/2: GOOD LeBron Barnes makes 2/2 from the line.
Score: 77-70

[03:13] Team_086 possession (Score: 77-70)
Miles Gobert attempts a Midrange. Contested by LeBron Barnes (4.0 feet, ZONE). Miles Gobert misses. Offensive rebound by Miles Gobert! Miles Gobert kicks it out.

[02:58] Team_086 possession (Score: 77-70)
Miles Gobert attempts a 3Pt. Contested by Khris Bryant (2.9 feet, ZONE). Miles Gobert misses. Offensive rebound by Rudy Rose! Rudy Rose's putback is no good. Rebound secured by Khris Bryant.

[02:43] Team_070 possession (Score: 77-70)
Jabari Paul drives and kicks out. Jabari Paul attempts a 3Pt. Contested by Rudy Rose (3.9 feet, MAN). Jabari Paul misses. Offensive rebound by LeBron Barnes! LeBron Barnes kicks it out.

[02:25] Team_070 possession (Score: 77-70)
FOUL! Holding foul on Rudy Rose. [IN THE BONUS! 7 team fouls] Jabari Paul to the line for 2 free throws. (Rudy Rose: 2 personal fouls)   FT 1/2: MISS   FT 2/2: MISS Jabari Paul makes 0/2 from the line. Rebound secured by Miles Gobert.

[02:14] Team_086 possession (Score: 77-70)
Miles Gobert attempts a Layup. Contested by Khris Bryant (3.0 feet, ZONE). MILES GOBERT MAKES IT!
Score: 77-72

[01:59] Team_070 possession (Score: 77-72)
LeBron Barnes attempts a Midrange. Contested by Anfernee Harris (5.0 feet, ZONE). LEBRON BARNES MAKES IT!
Score: 79-72

[01:50] Team_086 possession (Score: 79-72)
Bones Ginobili drives to the basket... Bones Ginobili throws a bad pass! Stolen by Khris Bryant! TURNOVER! (live ball)

[01:34] Team_070 possession (Score: 79-72)
John Hyland attempts a 3Pt. Contested by Lauri Johnson (4.6 feet, ZONE). John Hyland misses. Offensive rebound by Khris Bryant! Khris Bryant puts it back in!
Score: 81-72

[01:17] Team_086 possession (Score: 81-72)
Lauri Johnson attempts a Layup. Contested by Cole Gasol (5.8 feet, MAN). Lauri Johnson misses. Rebound secured by Jabari Paul.

[01:01] Team_070 possession (Score: 81-72)
Khris Bryant attempts a 3Pt. Contested by Lauri Johnson (4.6 feet, ZONE). Khris Bryant misses. Offensive rebound by LeBron Barnes! LeBron Barnes kicks it out.

[00:46] Team_070 possession (Score: 81-72)
Cole Gasol attempts a 3Pt. Contested by Lauri Johnson (4.9 feet, ZONE). Cole Gasol misses. Rebound secured by Rudy Rose.

[00:36] Team_086 possession (Score: 81-72)
Anfernee Harris attempts a Layup. Contested by Khris Bryant (3.5 feet, ZONE). Anfernee Harris misses. Rebound secured by Jabari Paul.

[00:18] Team_070 possession (Score: 81-72)
John Hyland attempts a 3Pt. Contested by Anfernee Harris (4.7 feet, ZONE). John Hyland misses. FOUL! Loose ball foul on Miles Gobert during the rebound battle. [IN THE BONUS! 8 team fouls] Khris Bryant to the line for 2 free throws. (Miles Gobert: 2 personal fouls)   FT 1/2: MISS   FT 2/2: GOOD Khris Bryant makes 1/2 from the line.
Score: 82-72

[00:01] Team_086 possession (Score: 82-72)
Rudy Rose drives to the basket... FOUL! Offensive foul on Rudy Rose! Khris Bryant drew the charge! [Team fouls: 9] (Rudy Rose: 3 personal fouls) TURNOVER! (dead ball)

================================================================================
                              3RD QUARTER COMPLETE                              
================================================================================

3RD QUARTER SCORE: Team_070 20, Team_086 15

BOX SCORE:
================================================================================

Team_070
--------------------------------------------------------------------------------
Player                MIN  PTS  REB  AST  TO      FG   FG%      3P   3P%
--------------------------------------------------------------------------------
LeBron Barnes          25   14    4    0   0   6/7    85.7     0/0   0.0
Khris Bryant           25    6    4    0   0   3/7    42.9     0/0   0.0
John Hyland            25    0    0    2   0   0/1     0.0     0/0   0.0
Jabari Paul            25    0    5    0   0   0/0     0.0     0/0   0.0
Cole Gasol             25    0    0    1   0   0/1     0.0     0/0   0.0

TEAM: FG: 9/17 (52.9%), 3PT: 4/7 (57.1%), REB: 11 (4 off, 7 def), AST: 3, TO: 3
TEAM FOULS: 3


Team_086
--------------------------------------------------------------------------------
Player                MIN  PTS  REB  AST  TO      FG   FG%      3P   3P%
--------------------------------------------------------------------------------
Rudy Rose              25    8    4    0   0   4/5    80.0     0/0   0.0
Lauri Johnson          25    3    0    1   0   1/4    25.0     0/0   0.0
Bones Ginobili         25    2    2    1   0   1/3    33.3     0/0   0.0
Miles Gobert           25    2    4    1   0   1/2    50.0     0/0   0.0
Anfernee Harris        25    0    0    0   0   0/3     0.0     0/0   0.0

TEAM: FG: 7/17 (41.2%), 3PT: 1/5 (20.0%), REB: 12 (4 off, 8 def), AST: 3, TO: 3
TEAM FOULS: 9 [Team_070 in BONUS]

================================================================================

================================================================================
                       4TH QUARTER - Team_070 vs Team_086                       
================================================================================

[12:00] Team_070 possession (Score: 82-72)
Cole Gasol drives, picks up Lauri Johnson. Help arrives from Miles Gobert! Cole Gasol attempts a Layup. Contested by Miles Gobert (4.8 feet, MAN). Cole Gasol misses. Rebound secured by Miles Gobert.

[11:47] Team_086 possession (Score: 82-72)
Rudy Rose attempts a 3Pt. Contested by LeBron Barnes (4.1 feet, ZONE). RUDY ROSE MAKES IT! Assist: Bones Ginobili
Score: 82-75

[11:33] Team_070 possession (Score: 82-75)
John Hyland makes the Midrange and draws the foul on Anfernee Harris! And-1! John Hyland to the line for 1. [Team fouls: 1] (Anfernee Harris: 1 personal fouls)   FT 1/1: GOOD John Hyland makes 1/1 from the line.
Score: 85-75

[11:21] Team_086 possession (Score: 85-75)
Rudy Rose drives, Khris Bryant stays with him. Rudy Rose attempts a Dunk. Contested by Khris Bryant (3.2 feet, ZONE). Rudy Rose misses. Rebound secured by Khris Bryant.

[11:04] Team_070 possession (Score: 85-75)
Jabari Paul attempts a Layup. Contested by Rudy Rose (4.8 feet, ZONE). JABARI PAUL MAKES IT! Assist: LeBron Barnes
Score: 87-75

[10:52] Team_086 possession (Score: 87-75)
Bones Ginobili makes the Layup and draws the foul on Khris Bryant! And-1! Bones Ginobili to the line for 1. [Team fouls: 1] (Khris Bryant: 1 personal fouls)   FT 1/1: GOOD Bones Ginobili makes 1/1 from the line.
Score: 87-78

[10:34] Team_070 possession (Score: 87-78)
Khris Bryant attempts a Layup. Contested by Bones Ginobili (5.1 feet, MAN). Khris Bryant misses. Rebound secured by Rudy Rose.

[10:23] Team_086 possession (Score: 87-78)
Rudy Rose attempts a Layup. Contested by Khris Bryant (3.3 feet, ZONE). RUDY ROSE MAKES IT! Assist: Anfernee Harris
Score: 87-80

[10:07] Team_070 possession (Score: 87-80)
LeBron Barnes makes the Layup and draws the foul on Anfernee Harris! And-1! LeBron Barnes to the line for 1. [Team fouls: 2] (Anfernee Harris: 2 personal fouls)   FT 1/1: GOOD LeBron Barnes makes 1/1 from the line.
Score: 90-80

[09:54] Team_086 possession (Score: 90-80)
FOUL! Offensive foul on Anfernee Harris! LeBron Barnes drew the charge! [Team fouls: 3] (Anfernee Harris: 3 personal fouls) TURNOVER! (dead ball)

[09:39] Team_070 possession (Score: 90-80)
LeBron Barnes drives and kicks out. Khris Bryant makes the 3Pt and draws the foul on Bones Ginobili! And-1! Khris Bryant to the line for 1. [Team fouls: 4] (Bones Ginobili: 1 personal fouls)   FT 1/1: GOOD Khris Bryant makes 1/1 from the line.
Score: 94-80

[09:26] Team_086 possession (Score: 94-80)
Bones Ginobili attempts a 3Pt. Contested by Khris Bryant (3.6 feet, ZONE). BONES GINOBILI MAKES IT!
Score: 94-83

[09:14] Team_070 possession (Score: 94-83)
Cole Gasol attempts a Midrange. Contested by Lauri Johnson (5.1 feet, MAN). Cole Gasol misses. Rebound secured by Rudy Rose.

[08:58] Team_086 possession (Score: 94-83)
Anfernee Harris makes the Dunk and draws the foul on LeBron Barnes! And-1! Anfernee Harris to the line for 1. [Team fouls: 2] (LeBron Barnes: 1 personal fouls)   FT 1/1: GOOD Anfernee Harris makes 1/1 from the line.
Score: 94-86

[08:46] Team_070 possession (Score: 94-86)
LeBron Barnes drives and kicks out. Cole Gasol attempts a 3Pt. Contested by Lauri Johnson (5.1 feet, MAN). Cole Gasol misses. FOUL! Loose ball foul on Rudy Rose during the rebound battle. [IN THE BONUS! 5 team fouls] LeBron Barnes to the line for 2 free throws. (Rudy Rose: 1 personal fouls)   FT 1/2: GOOD   FT 2/2: MISS LeBron Barnes makes 1/2 from the line. Offensive rebound by Khris Bryant! Khris Bryant's putback is no good.
Score: 95-86

[08:31] Team_086 possession (Score: 95-86)
Bones Ginobili drives to the basket... Bones Ginobili commits a violation (traveling/carry)! TURNOVER! (dead ball)

[08:31] Substitution (Team_070): Cole Gasol OUT → Paul Quickley IN (stamina_rule2)

[08:31] Substitution (Team_070): LeBron Barnes OUT → Allen Quickley IN (stamina_rule2)

[08:31] Substitution (Team_070): John Hyland OUT → D'Angelo McGrady IN (stamina_rule2)

[08:31] Substitution (Team_070): Khris Bryant OUT → Luka Gobert IN (stamina_rule2)

[08:31] Substitution (Team_070): Jabari Paul OUT → Russell Morant IN (stamina_rule2)

[08:31] Substitution (Team_086): Lauri Johnson OUT → Anfernee Green IN (stamina_rule2)

[08:31] Substitution (Team_086): Anfernee Harris OUT → Anthony James IN (stamina_rule2)

[08:31] Substitution (Team_086): Miles Gobert OUT → Franz McGrady IN (stamina_rule2)

[08:31] Substitution (Team_086): Bones Ginobili OUT → Kyle McCollum IN (stamina_rule2)

[08:31] Substitution (Team_086): Rudy Rose OUT → Lamelo Towns IN (stamina_rule2)

[08:16] Team_070 possession (Score: 95-86)
Paul Quickley attempts a 3Pt. Contested by Anfernee Green (4.0 feet, ZONE). Paul Quickley misses. Rebound secured by Kyle McCollum.

[08:02] Team_086 possession (Score: 95-86)
Anfernee Green drives and kicks out. Lamelo Towns attempts a 3Pt. Contested by Russell Morant (3.7 feet, MAN). Lamelo Towns misses. Rebound secured by D'Angelo McGrady.

[07:48] Team_070 possession (Score: 95-86)
Russell Morant attempts a Layup. Contested by Kyle McCollum (5.4 feet, ZONE). Russell Morant misses. Rebound secured by Lamelo Towns.

[07:35] Team_086 possession (Score: 95-86)
Kyle McCollum attempts a 3Pt. Contested by Paul Quickley (4.3 feet, ZONE). Kyle McCollum misses. Offensive rebound by Lamelo Towns! Lamelo Towns kicks it out.

[07:20] Team_086 possession (Score: 95-86)
FOUL! Holding foul on Paul Quickley. [Team fouls: 3] No free throws, side out. (Paul Quickley: 1 personal fouls)

[07:06] Team_086 possession (Score: 95-86)
Lamelo Towns attempts a Layup. BLOCKED BY PAUL QUICKLEY! Ball is loose! Offensive rebound by Lamelo Towns! Lamelo Towns kicks it out.

[06:51] Team_086 possession (Score: 95-86)
Franz McGrady attempts a 3Pt. Contested by Paul Quickley (4.5 feet, ZONE). FRANZ MCGRADY MAKES IT! Assist: Anfernee Green
Score: 95-89

[06:34] Team_070 possession (Score: 95-89)
Allen Quickley attempts a 3Pt. Contested by Anthony James (4.1 feet, MAN). Allen Quickley misses. Rebound secured by Kyle McCollum.

[06:20] Team_086 possession (Score: 95-89)
Franz McGrady attempts a Midrange. Contested by D'Angelo McGrady (5.8 feet, MAN). FRANZ MCGRADY MAKES IT!
Score: 95-91

[06:05] Team_070 possession (Score: 95-91)
Russell Morant drives to the basket... Russell Morant throws a bad pass out of bounds! TURNOVER! (dead ball)

[05:50] Team_086 possession (Score: 95-91)
Anthony James attempts a 3Pt. Contested by Paul Quickley (5.0 feet, ZONE). Anthony James misses. Rebound secured by D'Angelo McGrady.

[05:39] Team_070 possession (Score: 95-91)
Luka Gobert attempts a 3Pt. Contested by Kyle McCollum (5.3 feet, MAN). Luka Gobert misses. Rebound secured by Anfernee Green.

[05:25] Team_086 possession (Score: 95-91)
Anfernee Green drives and kicks out. Lamelo Towns attempts a 3Pt. Contested by Paul Quickley (4.3 feet, ZONE). Lamelo Towns misses. Rebound secured by Russell Morant.

[05:10] Team_070 possession (Score: 95-91)
Paul Quickley attempts a 3Pt. Contested by Anfernee Green (4.0 feet, MAN). Paul Quickley misses. Rebound secured by Kyle McCollum.

[04:56] Team_086 possession (Score: 95-91)
FOUL! Shooting foul on Russell Morant. Lamelo Towns to the line for 2 free throws. [Team fouls: 4] (Russell Morant: 1 personal fouls)   FT 1/2: GOOD   FT 2/2: GOOD Lamelo Towns makes 2/2 from the line.
Score: 95-93

[04:40] Team_070 possession (Score: 95-93)
Luka Gobert attempts a Midrange. Contested by Anthony James (4.1 feet, ZONE). LUKA GOBERT MAKES IT! Assist: Allen Quickley
Score: 97-93

[04:23] Team_086 possession (Score: 97-93)
Lamelo Towns drives, Russell Morant stays with him. Lamelo Towns attempts a Dunk. Contested by Russell Morant (3.5 feet, ZONE). LAMELO TOWNS MAKES IT! Assist: Franz McGrady
Score: 97-95

[04:09] Team_070 possession (Score: 97-95)
D'Angelo McGrady makes the Layup and draws the foul on Franz McGrady! And-1! D'Angelo McGrady to the line for 1. [BONUS: 6 team fouls] (Franz McGrady: 1 personal fouls)   FT 1/1: GOOD D'Angelo McGrady makes 1/1 from the line.
Score: 100-95

[03:53] Team_086 possession (Score: 100-95)
Anfernee Green attempts a 3Pt. Contested by Paul Quickley (4.6 feet, ZONE). Anfernee Green misses. Rebound secured by Russell Morant.

[03:38] Team_070 possession (Score: 100-95)
D'Angelo McGrady attempts a Midrange. Contested by Franz McGrady (5.0 feet, MAN). D'ANGELO MCGRADY MAKES IT! Assist: Luka Gobert
Score: 102-95

[03:22] Team_086 possession (Score: 102-95)
Lamelo Towns makes the Layup and draws the foul on Russell Morant! And-1! Lamelo Towns to the line for 1. [BONUS: 5 team fouls] (Russell Morant: 2 personal fouls)   FT 1/1: MISS Lamelo Towns makes 0/1 from the line. Rebound secured by Russell Morant.
Score: 102-97

[03:06] Team_070 possession (Score: 102-97)
Allen Quickley attempts a 3Pt. Contested by Kyle McCollum (5.3 feet, ZONE). ALLEN QUICKLEY MAKES IT! Assist: Paul Quickley
Score: 105-97

[02:54] Team_086 possession (Score: 105-97)
Anthony James attempts a 3Pt. Contested by Allen Quickley (5.9 feet, MAN). Anthony James misses. Rebound secured by D'Angelo McGrady.

[02:38] Team_070 possession (Score: 105-97)
Russell Morant drives to the basket... Russell Morant loses control! Ball rolls out of bounds! TURNOVER! (dead ball)

[02:20] Team_086 possession (Score: 105-97)
FOUL! Shooting foul on Paul Quickley. Anfernee Green to the line for 2 free throws. [BONUS: 6 team fouls] (Paul Quickley: 2 personal fouls)   FT 1/2: GOOD   FT 2/2: GOOD Anfernee Green makes 2/2 from the line.
Score: 105-99

[02:09] Team_070 possession (Score: 105-99)
Paul Quickley makes the Layup and draws the foul on Anfernee Green! And-1! Paul Quickley to the line for 1. [BONUS: 7 team fouls] (Anfernee Green: 1 personal fouls)   FT 1/1: GOOD Paul Quickley makes 1/1 from the line.
Score: 108-99

[01:54] Team_086 possession (Score: 108-99)
Anfernee Green attempts a 3Pt. Contested by D'Angelo McGrady (5.9 feet, ZONE). Anfernee Green misses. FOUL! Loose ball foul on Russell Morant during the rebound battle. [IN THE BONUS! 7 team fouls] Anfernee Green to the line for 2 free throws. (Russell Morant: 3 personal fouls)   FT 1/2: GOOD   FT 2/2: GOOD Anfernee Green makes 2/2 from the line.
Score: 108-101

[01:41] Team_070 possession (Score: 108-101)
Paul Quickley drives and kicks out. Russell Morant attempts a 3Pt. Contested by Anfernee Green (4.1 feet, ZONE). Russell Morant misses. Rebound secured by Lamelo Towns.

[01:29] Team_086 possession (Score: 108-101)
Kyle McCollum attempts a Layup. Contested by Russell Morant (3.8 feet, ZONE). Kyle McCollum misses. Offensive rebound by Anfernee Green! Anfernee Green kicks it out.

[01:18] Team_086 possession (Score: 108-101)
Anthony James throws a bad pass out of bounds! TURNOVER! (dead ball)

[01:03] Team_070 possession (Score: 108-101)
Paul Quickley attempts a Layup. Contested by Lamelo Towns (5.3 feet, ZONE). Paul Quickley misses. Offensive rebound by Russell Morant! Russell Morant's putback is no good. Rebound secured by Anfernee Green.

[00:49] Team_086 possession (Score: 108-101)
Franz McGrady attempts a Midrange. Contested by D'Angelo McGrady (5.8 feet, MAN). FRANZ MCGRADY MAKES IT! Assist: Anfernee Green
Score: 108-103

[00:33] Team_070 possession (Score: 108-103)
D'Angelo McGrady attempts a 3Pt. Contested by Anfernee Green (4.2 feet, ZONE). D'Angelo McGrady misses. Rebound secured by Anfernee Green.

[00:15] Team_086 possession (Score: 108-103)
Anthony James drives and kicks out. Kyle McCollum attempts a 3Pt. Contested by Luka Gobert (4.9 feet, MAN). Kyle McCollum misses. Rebound secured by Luka Gobert.

[00:04] Team_070 possession (Score: 108-103)
FOUL! Shooting foul on Anthony James. Luka Gobert to the line for 2 free throws. [BONUS: 8 team fouls] (Anthony James: 1 personal fouls)   FT 1/2: MISS   FT 2/2: GOOD Luka Gobert makes 1/2 from the line.
Score: 109-103

================================================================================
                              4TH QUARTER COMPLETE                              
================================================================================

4TH QUARTER SCORE: Team_070 27, Team_086 31

BOX SCORE:
================================================================================

Team_070
--------------------------------------------------------------------------------
Player                MIN  PTS  REB  AST  TO      FG   FG%      3P   3P%
--------------------------------------------------------------------------------
D'Angelo McGrady       20    5    3    0   0   2/3    66.7     0/0   0.0
Khris Bryant           29    4    2    0   0   1/2    50.0     0/0   0.0
John Hyland            29    3    0    0   0   1/1   100.0     0/0   0.0
LeBron Barnes          29    3    0    1   0   1/2    50.0     0/0   0.0
Paul Quickley          20    3    0    1   0   1/5    20.0     0/0   0.0
Allen Quickley         20    3    0    1   0   1/2    50.0     0/0   0.0
Luka Gobert            20    3    1    1   0   2/3    66.7     0/0   0.0
Jabari Paul            29    2    0    0   0   1/1   100.0     0/0   0.0
Cole Gasol             29    0    0    0   0   0/2     0.0     0/0   0.0
Russell Morant         20    0    3    0   0   0/1     0.0     0/0   0.0

TEAM: FG: 10/22 (45.5%), 3PT: 1/6 (16.7%), REB: 10 (2 off, 8 def), AST: 4, TO: 2
TEAM FOULS: 7 [Team_086 in BONUS]


Team_086
--------------------------------------------------------------------------------
Player                MIN  PTS  REB  AST  TO      FG   FG%      3P   3P%
--------------------------------------------------------------------------------
Franz McGrady          20    7    0    1   0   3/3   100.0     0/0   0.0
Bones Ginobili         29    6    0    1   0   2/2   100.0     0/0   0.0
Rudy Rose              29    5    2    0   0   2/3    66.7     0/0   0.0
Anfernee Green         20    4    4    2   0   2/5    40.0     0/0   0.0
Lamelo Towns           20    4    4    0   0   2/3    66.7     0/0   0.0
Anfernee Harris        29    3    0    1   0   1/1   100.0     0/0   0.0
Miles Gobert           29    0    1    0   0   0/0     0.0     0/0   0.0
Kyle McCollum          20    0    3    0   0   0/0     0.0     0/0   0.0
Anthony James          20    0    0    0   0   0/3     0.0     0/0   0.0

TEAM: FG: 12/20 (60.0%), 3PT: 4/7 (57.1%), REB: 13 (3 off, 10 def), AST: 5, TO: 3
TEAM FOULS: 8 [Team_070 in BONUS]

================================================================================

================================================================================
                               FULL GAME COMPLETE                               
================================================================================

FINAL SCORE: Team_070 109, Team_086 103

SCORING BY QUARTER:
--------------------------------------------------------------------------------
Team                     Q1     Q2     Q3     Q4    FINAL
--------------------------------------------------------------------------------
Team_070                 35     27     20     27      109
Team_086                 31     26     15     31      103
--------------------------------------------------------------------------------

FULL GAME BOX SCORE:
================================================================================

Team_070
--------------------------------------------------------------------------------
Player                MIN  PTS  REB  AST  TO      FG   FG%      3P   3P%      FT STL BLK
--------------------------------------------------------------------------------
Cole Gasol             29    5    0    2   0   2/7    28.6   1/4    25.0   0/0     0   0
LeBron Barnes          29   28    6    2   2  12/19   63.2   4/7    57.1  10/11    0   0
John Hyland            29    9    0    4   1   5/6    83.3   4/4   100.0   1/1     2   0
Khris Bryant           29   18    9    0   1   3/11   27.3   0/5     0.0   3/4     2   2
Jabari Paul            29    9   11    2   1   4/4   100.0   1/1   100.0   4/7     0   1
Paul Quickley          20    5    0    2   1   4/9    44.4   2/5    40.0   1/1     0   1
Allen Quickley         20   12    0    1   1   5/7    71.4   4/5    80.0   0/0     0   0
D'Angelo McGrady       20   10    5    1   0   4/6    66.7   0/2     0.0   2/2     0   0
Luka Gobert            20    6    3    2   0   3/6    50.0   0/1     0.0   2/3     0   0
Russell Morant         20    6    6    0   1   1/3    33.3   0/0     0.0   6/8     0   0

TEAM: FG: 45/81 (55.6%), 3PT: 16/34 (47.1%), REB: 39 (11 off, 28 def), AST: 16, TO: 8


Team_086
--------------------------------------------------------------------------------
Player                MIN  PTS  REB  AST  TO      FG   FG%      3P   3P%      FT STL BLK
--------------------------------------------------------------------------------
Lauri Johnson          29   15    0    1   2   6/12   50.0   3/5    60.0   7/8     0   0
Anfernee Harris        29    5    0    3   1   2/6    33.3   0/1     0.0   1/1     1   0
Miles Gobert           29   15   10    2   2   6/8    75.0   4/6    66.7   5/6     0   0
Bones Ginobili         29    9    2    4   1   4/6    66.7   1/2    50.0   2/3     1   0
Rudy Rose              29   16   11    2   1   6/13   46.2   1/2    50.0   3/3     0   0
Anfernee Green         20    7    6    4   0   3/8    37.5   1/2    50.0   5/5     0   0
Anthony James          20    4    0    0   3   2/6    33.3   0/2     0.0   0/0     0   0
Franz McGrady          20    9    0    2   0   4/5    80.0   1/2    50.0   0/0     0   0
Kyle McCollum          20    4    6    0   0   2/2   100.0   0/0     0.0   0/0     0   0
Lamelo Towns           20   15   11    0   0   7/9    77.8   0/1     0.0   5/7     0   0

TEAM: FG: 43/76 (56.6%), 3PT: 11/23 (47.8%), REB: 46 (14 off, 32 def), AST: 18, TO: 10

================================================================================
