================================================================================
                        FULL GAME - Team_068 vs Team_060                        
================================================================================

================================================================================
                       1ST QUARTER - Team_068 vs Team_060                       
================================================================================

[12:00] Team_068 possession (Score: 0-0)
Nikola Ginobili drives, Jaren George stays with him. Nikola Ginobili attempts a Layup. Contested by Jaren George (5.2 feet, MAN). NIKOLA GINOBILI MAKES IT!
Score: 2-0

[11:46] Team_060 possession (Score: 2-0)
Jaren George attempts a Midrange. Contested by Nikola Ginobili (4.2 feet, MAN). Jaren George misses. Rebound secured by Jaren Johnson.

[11:28] Team_068 possession (Score: 2-0)
Malcolm Herro attempts a Midrange. Contested by Julius Green (3.8 feet, MAN). Malcolm Herro misses. Offensive rebound by Nikola Ginobili! Nikola Ginobili puts it back in!
Score: 4-0

[11:10] Team_060 possession (Score: 4-0)
Joel Morant drives, Gary Simons stays with him. Joel Morant attempts a Dunk. Contested by Gary Simons (2.9 feet, ZONE). JOEL MORANT MAKES IT!
Score: 4-2

[10:55] Team_068 possession (Score: 4-2)
Jaren Johnson attempts a 3Pt. Contested by Immanuel Ming (4.1 feet, ZONE). Jaren Johnson misses. Rebound secured by Immanuel Ming.

[10:43] Team_060 possession (Score: 4-2)
FOUL! Shooting foul on Gary Simons. Julius Green to the line for 2 free throws. [Team fouls: 1] (Gary Simons: 1 personal fouls)   FT 1/2: GOOD   FT 2/2: GOOD Julius Green makes 2/2 from the line.
Score: 4-4

[10:31] Team_068 possession (Score: 4-4)
Nikola Ginobili loses the ball! Stripped by Jaren George! TURNOVER! (live ball)

[10:19] Team_060 possession (Score: 4-4)
Larry Westbrook attempts a 3Pt. Contested by Zion Anunoby (4.9 feet, ZONE). LARRY WESTBROOK MAKES IT! Assist: Immanuel Ming
Score: 4-7

[10:02] Team_068 possession (Score: 4-7)
Jaren Johnson attempts a Layup. BLOCKED BY JAREN GEORGE! Ball is loose! Rebound secured by Jaren George.

[09:48] Team_060 possession (Score: 4-7)
Joel Morant attempts a Layup. Contested by Gary Simons (2.9 feet, ZONE). JOEL MORANT MAKES IT!
Score: 4-9

[09:35] Team_068 possession (Score: 4-9)
Malcolm Herro attempts a 3Pt. Contested by Julius Green (3.8 feet, MAN). MALCOLM HERRO MAKES IT! Assist: Gary Simons
Score: 7-9

[09:18] Team_060 possession (Score: 7-9)
Julius Green attempts a 3Pt. Contested by Zion Anunoby (4.2 feet, ZONE). Julius Green misses. Offensive rebound by Jaren George! Jaren George puts it back in!
Score: 7-11

[09:04] Team_068 possession (Score: 7-11)
Malcolm Herro attempts a 3Pt. Contested by Julius Green (3.8 feet, ZONE). MALCOLM HERRO MAKES IT! Assist: Gary Simons
Score: 10-11

[08:49] Team_060 possession (Score: 10-11)
Larry Westbrook attempts a Midrange. Contested by Malcolm Herro (4.7 feet, ZONE). LARRY WESTBROOK MAKES IT! Assist: Joel Morant
Score: 10-13

[08:37] Team_068 possession (Score: 10-13)
Jaren Johnson attempts a 3Pt. Contested by Immanuel Ming (4.1 feet, MAN). Jaren Johnson misses. Offensive rebound by Jaren Johnson! Jaren Johnson kicks it out.

[08:23] Team_068 possession (Score: 10-13)
Zion Anunoby attempts a Midrange. Contested by Joel Morant (5.6 feet, MAN). ZION ANUNOBY MAKES IT!
Score: 12-13

[08:07] Team_060 possession (Score: 12-13)
Julius Green attempts a Midrange. Contested by Malcolm Herro (4.0 feet, ZONE). Julius Green misses. Offensive rebound by Jaren George! Jaren George's putback is no good. Rebound secured by Nikola Ginobili.

[07:50] Team_068 possession (Score: 12-13)
Nikola Ginobili throws a bad pass out of bounds! TURNOVER! (dead ball)

[07:37] Team_060 possession (Score: 12-13)
Jaren George attempts a Layup. Contested by Nikola Ginobili (4.2 feet, MAN). JAREN GEORGE MAKES IT!
Score: 12-15

[07:22] Team_068 possession (Score: 12-15)
Jaren Johnson drives to the basket... Jaren Johnson throws a bad pass! Stolen by Immanuel Ming! TURNOVER! (live ball)

[07:08] Team_060 possession (Score: 12-15)
Larry Westbrook makes the Midrange and draws the foul on Gary Simons! And-1! Larry Westbrook to the line for 1. [Team fouls: 2] (Gary Simons: 2 personal fouls)   FT 1/1: GOOD Larry Westbrook makes 1/1 from the line.
Score: 12-18

[06:57] Team_068 possession (Score: 12-18)
Gary Simons attempts a 3Pt. Contested by Larry Westbrook (5.4 feet, MAN). Gary Simons misses. Rebound secured by Jaren George.

[06:46] Team_060 possession (Score: 12-18)
Julius Green drives and kicks out. Joel Morant attempts a 3Pt. Contested by Zion Anunoby (4.4 feet, MAN). JOEL MORANT MAKES IT! Assist: Julius Green
Score: 12-21

[06:31] Team_068 possession (Score: 12-21)
Zion Anunoby drives, picks up Joel Morant. Help arrives from Immanuel Ming! Zion Anunoby attempts a Layup. Contested by Immanuel Ming (5.6 feet, MAN). ZION ANUNOBY MAKES IT! Assist: Malcolm Herro
Score: 14-21

[06:16] Team_060 possession (Score: 14-21)
Larry Westbrook makes the Dunk and draws the foul on Malcolm Herro! And-1! Larry Westbrook to the line for 1. [Team fouls: 3] (Malcolm Herro: 1 personal fouls)   FT 1/1: MISS Larry Westbrook makes 0/1 from the line. Rebound secured by Jaren Johnson.
Score: 14-23

[06:06] Team_068 possession (Score: 14-23)
FOUL! Shooting foul on Immanuel Ming. Malcolm Herro to the line for 2 free throws. [Team fouls: 1] (Immanuel Ming: 1 personal fouls)   FT 1/2: MISS   FT 2/2: GOOD Malcolm Herro makes 1/2 from the line.
Score: 15-23

[05:51] Team_060 possession (Score: 15-23)
Joel Morant attempts a Layup. Contested by Gary Simons (2.9 feet, ZONE). JOEL MORANT MAKES IT! Assist: Jaren George
Score: 15-25

[05:35] Team_068 possession (Score: 15-25)
FOUL! Holding foul on Julius Green. [Team fouls: 2] No free throws, side out. (Julius Green: 1 personal fouls)

[05:18] Team_068 possession (Score: 15-25)
Jaren Johnson attempts a 3Pt. Contested by Julius Green (4.2 feet, ZONE). JAREN JOHNSON MAKES IT! Assist: Gary Simons
Score: 18-25

[05:04] Team_060 possession (Score: 18-25)
FOUL! Holding foul on Jaren Johnson. [Team fouls: 4] No free throws, side out. (Jaren Johnson: 1 personal fouls)

[04:51] Team_060 possession (Score: 18-25)
Joel Morant attempts a Midrange. Contested by Zion Anunoby (4.1 feet, MAN). Joel Morant misses. Rebound secured by Nikola Ginobili.

[04:37] Team_068 possession (Score: 18-25)
FOUL! Reach-in foul on Jaren George during the drive. [Team fouls: 3] No free throws, side out. (Jaren George: 1 personal fouls)

[04:24] Team_068 possession (Score: 18-25)
Jaren Johnson drives and kicks out. Gary Simons attempts a 3Pt. Contested by Larry Westbrook (4.7 feet, MAN). Gary Simons misses. Offensive rebound by Jaren Johnson! Jaren Johnson kicks it out.

[04:09] Team_068 possession (Score: 18-25)
Jaren Johnson attempts a 3Pt. Contested by Immanuel Ming (4.2 feet, MAN). Jaren Johnson misses. Rebound secured by Larry Westbrook.

[03:52] Team_060 possession (Score: 18-25)
Larry Westbrook attempts a 3Pt. Contested by Gary Simons (3.8 feet, MAN). Larry Westbrook misses. Rebound secured by Nikola Ginobili.

[03:38] Team_068 possession (Score: 18-25)
Gary Simons attempts a 3Pt. Contested by Larry Westbrook (5.6 feet, MAN). Gary Simons misses. Rebound secured by Larry Westbrook.

[03:19] Team_060 possession (Score: 18-25)
Julius Green attempts a 3Pt. Contested by Zion Anunoby (4.3 feet, ZONE). Julius Green misses. FOUL! Loose ball foul on Gary Simons during the rebound battle. [IN THE BONUS! 5 team fouls] Jaren George to the line for 2 free throws. (Gary Simons: 3 personal fouls)   FT 1/2: GOOD   FT 2/2: GOOD Jaren George makes 2/2 from the line.
Score: 18-27

[03:02] Team_068 possession (Score: 18-27)
Nikola Ginobili drives, Jaren George stays with him. Nikola Ginobili attempts a Layup. Contested by Jaren George (5.5 feet, MAN). Nikola Ginobili misses. Rebound secured by Immanuel Ming.

[02:50] Team_060 possession (Score: 18-27)
Joel Morant attempts a Midrange. Contested by Zion Anunoby (4.2 feet, MAN). JOEL MORANT MAKES IT!
Score: 18-29

[02:39] Team_068 possession (Score: 18-29)
Jaren Johnson attempts a 3Pt. Contested by Julius Green (4.4 feet, ZONE). Jaren Johnson misses. Rebound secured by Jaren George.

[02:26] Team_060 possession (Score: 18-29)
Joel Morant attempts a 3Pt. Contested by Zion Anunoby (4.3 feet, MAN). Joel Morant misses. Rebound secured by Nikola Ginobili.

[02:11] Team_068 possession (Score: 18-29)
Jaren Johnson attempts a 3Pt. Contested by Immanuel Ming (4.3 feet, MAN). JAREN JOHNSON MAKES IT! Assist: Nikola Ginobili
Score: 21-29

[01:56] Team_060 possession (Score: 21-29)
Jaren George drives, Gary Simons stays with him. Jaren George attempts a Dunk. Contested by Gary Simons (3.7 feet, ZONE). JAREN GEORGE MAKES IT!
Score: 21-31

[01:41] Team_068 possession (Score: 21-31)
Malcolm Herro attempts a 3Pt. Contested by Larry Westbrook (5.0 feet, ZONE). Malcolm Herro misses. Rebound secured by Jaren George.

[01:26] Team_060 possession (Score: 21-31)
Joel Morant attempts a Layup. Contested by Zion Anunoby (4.4 feet, MAN). JOEL MORANT MAKES IT! Assist: Immanuel Ming
Score: 21-33

[01:12] Team_068 possession (Score: 21-33)
Zion Anunoby loses the ball! Stripped by Joel Morant! TURNOVER! (live ball)

[00:56] Team_060 possession (Score: 21-33)
FOUL! Shooting foul on Malcolm Herro. Jaren George to the line for 2 free throws. [BONUS: 6 team fouls] (Malcolm Herro: 2 personal fouls)   FT 1/2: GOOD   FT 2/2: GOOD Jaren George makes 2/2 from the line.
Score: 21-35

[00:37] Team_068 possession (Score: 21-35)
Zion Anunoby drives, Jaren George stays with him. Zion Anunoby attempts a Layup. Wide open! Jaren George is 6.1 feet away. [ZONE] ZION ANUNOBY MAKES IT!
Score: 23-35

[00:24] Team_060 possession (Score: 23-35)
Joel Morant attempts a Midrange. Contested by Zion Anunoby (4.5 feet, MAN). Joel Morant misses. Rebound secured by Nikola Ginobili.

[00:09] Team_068 possession (Score: 23-35)
Zion Anunoby throws a bad pass! Stolen by Joel Morant! TURNOVER! (live ball)

================================================================================
                              1ST QUARTER COMPLETE                              
================================================================================

1ST QUARTER SCORE: Team_068 23, Team_060 35

BOX SCORE:
================================================================================

Team_068
--------------------------------------------------------------------------------
Player                MIN  PTS  REB  AST  TO      FG   FG%      3P   3P%
--------------------------------------------------------------------------------
Malcolm Herro          12    7    0    1   0   3/4    75.0     0/0   0.0
Jaren Johnson          12    6    4    0   0   2/6    33.3     0/0   0.0
Zion Anunoby           12    6    0    0   0   3/3   100.0     0/0   0.0
Nikola Ginobili        12    4    6    1   0   2/3    66.7     0/0   0.0
Gary Simons            12    0    0    3   0   0/2     0.0     0/0   0.0

TEAM: FG: 10/18 (55.6%), 3PT: 4/10 (40.0%), REB: 9 (3 off, 6 def), AST: 5, TO: 5
TEAM FOULS: 6 [Team_060 in BONUS]


Team_060
--------------------------------------------------------------------------------
Player                MIN  PTS  REB  AST  TO      FG   FG%      3P   3P%
--------------------------------------------------------------------------------
Joel Morant            12   13    0    1   0   6/9    66.7     0/0   0.0
Jaren George           12   10    5    1   0   5/6    83.3     0/0   0.0
Larry Westbrook        12    8    2    0   0   3/5    60.0     0/0   0.0
Julius Green           12    2    0    1   0   1/2    50.0     0/0   0.0
Immanuel Ming          12    0    2    2   0   0/0     0.0     0/0   0.0

TEAM: FG: 15/22 (68.2%), 3PT: 3/5 (60.0%), REB: 10 (2 off, 8 def), AST: 5, TO: 0
TEAM FOULS: 3

================================================================================

================================================================================
                       2ND QUARTER - Team_068 vs Team_060                       
================================================================================

[12:00] Team_068 possession (Score: 23-35)
FOUL! Reach-in foul on Larry Westbrook during the drive. [Team fouls: 1] No free throws, side out. (Larry Westbrook: 1 personal fouls)

[11:46] Team_068 possession (Score: 23-35)
Gary Simons attempts a Layup. Contested by Larry Westbrook (5.8 feet, MAN). Gary Simons misses. Rebound secured by Larry Westbrook.

[11:31] Team_060 possession (Score: 23-35)
Larry Westbrook attempts a Layup. Contested by Gary Simons (4.1 feet, MAN). Larry Westbrook misses. Rebound secured by Jaren Johnson.

[11:14] Team_068 possession (Score: 23-35)
Zion Anunoby attempts a Layup. Wide open! Joel Morant is 6.0 feet away. [MAN] ZION ANUNOBY MAKES IT! Assist: Jaren Johnson
Score: 25-35

[10:58] Team_060 possession (Score: 25-35)
Larry Westbrook makes the Layup and draws the foul on Gary Simons! And-1! Larry Westbrook to the line for 1. [Team fouls: 1] (Gary Simons: 1 personal fouls)   FT 1/1: GOOD Larry Westbrook makes 1/1 from the line.
Score: 25-38

[10:42] Team_068 possession (Score: 25-38)
Zion Anunoby drives, Jaren George stays with him. Zion Anunoby attempts a Layup. Wide open! Jaren George is 6.1 feet away. [ZONE] Zion Anunoby misses. Rebound secured by Larry Westbrook.

[10:28] Team_060 possession (Score: 25-38)
Joel Morant attempts a Midrange. Contested by Malcolm Herro (4.4 feet, ZONE). Joel Morant misses. Rebound secured by Jaren Johnson.

[10:18] Team_068 possession (Score: 25-38)
Nikola Ginobili drives and kicks out. FOUL! Shooting foul on Immanuel Ming. Jaren Johnson to the line for 2 free throws. [Team fouls: 2] (Immanuel Ming: 1 personal fouls)   FT 1/2: MISS   FT 2/2: GOOD Jaren Johnson makes 1/2 from the line.
Score: 26-38

[10:06] Team_060 possession (Score: 26-38)
Larry Westbrook attempts a 3Pt. Contested by Zion Anunoby (5.2 feet, ZONE). Larry Westbrook misses. Rebound secured by Gary Simons.

[09:49] Team_068 possession (Score: 26-38)
Zion Anunoby makes the Layup and draws the foul on Joel Morant! And-1! Zion Anunoby to the line for 1. [Team fouls: 3] (Joel Morant: 1 personal fouls)   FT 1/1: GOOD Zion Anunoby makes 1/1 from the line.
Score: 29-38

[09:30] Team_060 possession (Score: 29-38)
Immanuel Ming attempts a 3Pt. Contested by Jaren Johnson (4.2 feet, MAN). Immanuel Ming misses. Offensive rebound by Immanuel Ming! Immanuel Ming kicks it out.

[09:16] Team_060 possession (Score: 29-38)
Larry Westbrook attempts a 3Pt. Contested by Jaren Johnson (4.6 feet, ZONE). Larry Westbrook misses. Rebound secured by Gary Simons.

[09:04] Team_068 possession (Score: 29-38)
Zion Anunoby attempts a Layup. Wide open! Joel Morant is 6.3 feet away. [MAN] Zion Anunoby misses. Rebound secured by Jaren George.

[08:51] Team_060 possession (Score: 29-38)
Larry Westbrook attempts a 3Pt. Contested by Zion Anunoby (5.3 feet, ZONE). Larry Westbrook misses. Rebound secured by Jaren Johnson.

[08:35] Team_068 possession (Score: 29-38)
Malcolm Herro attempts a 3Pt. Contested by Julius Green (4.4 feet, MAN). MALCOLM HERRO MAKES IT! Assist: Gary Simons
Score: 32-38

[08:19] Team_060 possession (Score: 32-38)
Joel Morant attempts a 3Pt. Contested by Gary Simons (3.8 feet, ZONE). JOEL MORANT MAKES IT!
Score: 32-41

[08:06] Team_068 possession (Score: 32-41)
Zion Anunoby drives to the basket... Zion Anunoby loses control! Ball rolls out of bounds! TURNOVER! (dead ball)

[08:06] Substitution (Team_068): Zion Anunoby OUT → Cole Anthony IN (stamina_rule2)

[08:06] Substitution (Team_068): Malcolm Herro OUT → Ja Banchero IN (stamina_rule2)

[08:06] Substitution (Team_068): Jaren Johnson OUT → Miles Murray IN (stamina_rule2)

[08:06] Substitution (Team_068): Gary Simons OUT → Jarrett Oladipo IN (stamina_rule2)

[08:06] Substitution (Team_068): Nikola Ginobili OUT → Franz Curry IN (stamina_rule2)

[08:06] Substitution (Team_060): Joel Morant OUT → Domantas Barnes IN (stamina_rule2)

[08:06] Substitution (Team_060): Julius Green OUT → Rudy Ginobili IN (stamina_rule2)

[08:06] Substitution (Team_060): Immanuel Ming OUT → Jarrett Wagner IN (stamina_rule2)

[08:06] Substitution (Team_060): Larry Westbrook OUT → Yao Tatum IN (stamina_rule2)

[08:06] Substitution (Team_060): Jaren George OUT → Klay Haliburton IN (stamina_rule2)

[07:53] Team_060 possession (Score: 32-41)
Jarrett Wagner drives and kicks out. Jarrett Wagner attempts a 3Pt. Contested by Ja Banchero (5.1 feet, ZONE). JARRETT WAGNER MAKES IT! Assist: Yao Tatum
Score: 32-44

[07:38] Team_068 possession (Score: 32-44)
Ja Banchero attempts a 3Pt. Contested by Domantas Barnes (4.7 feet, ZONE). JA BANCHERO MAKES IT! Assist: Franz Curry
Score: 35-44

[07:25] Team_060 possession (Score: 35-44)
Domantas Barnes attempts a 3Pt. Contested by Cole Anthony (4.7 feet, MAN). Domantas Barnes misses. Offensive rebound by Klay Haliburton! Klay Haliburton's putback is no good. Rebound secured by Jarrett Oladipo.

[07:12] Team_068 possession (Score: 35-44)
Ja Banchero attempts a Layup. Contested by Klay Haliburton (4.4 feet, ZONE). Ja Banchero misses. Rebound secured by Rudy Ginobili.

[06:58] Team_060 possession (Score: 35-44)
Yao Tatum throws a bad pass out of bounds! TURNOVER! (dead ball)

[06:44] Team_068 possession (Score: 35-44)
Ja Banchero drives to the basket... Ja Banchero throws a bad pass! Stolen by Klay Haliburton! TURNOVER! (live ball)

[06:29] Team_060 possession (Score: 35-44)
Jarrett Wagner drives to the basket... Jarrett Wagner commits a violation (traveling/carry)! TURNOVER! (dead ball)

[06:17] Team_068 possession (Score: 35-44)
Ja Banchero attempts a 3Pt. Contested by Rudy Ginobili (4.5 feet, MAN). Ja Banchero misses. FOUL! Loose ball foul on Rudy Ginobili during the rebound battle. [Team fouls: 4] No free throws, side out. (Rudy Ginobili: 1 personal fouls)

[06:00] Team_068 possession (Score: 35-44)
FOUL! Reach-in foul on Klay Haliburton during the drive. [IN THE BONUS! 5 team fouls] Miles Murray to the line for 2 free throws. (Klay Haliburton: 1 personal fouls)   FT 1/2: GOOD   FT 2/2: GOOD Miles Murray makes 2/2 from the line.
Score: 37-44

[05:48] Team_060 possession (Score: 37-44)
Domantas Barnes attempts a 3Pt. Contested by Cole Anthony (4.7 feet, MAN). DOMANTAS BARNES MAKES IT! Assist: Rudy Ginobili
Score: 37-47

[05:31] Team_068 possession (Score: 37-47)
Cole Anthony makes the Layup and draws the foul on Klay Haliburton! And-1! Cole Anthony to the line for 1. [BONUS: 6 team fouls] (Klay Haliburton: 2 personal fouls)   FT 1/1: MISS Cole Anthony makes 0/1 from the line. Offensive rebound by Franz Curry! Franz Curry's putback is no good.
Score: 39-47

[05:21] Team_060 possession (Score: 39-47)
Yao Tatum attempts a 3Pt. Contested by Ja Banchero (5.2 feet, ZONE). YAO TATUM MAKES IT! Assist: Klay Haliburton
Score: 39-50

[05:07] Team_068 possession (Score: 39-50)
Ja Banchero attempts a 3Pt. Contested by Domantas Barnes (4.7 feet, ZONE). Ja Banchero misses. Rebound secured by Rudy Ginobili.

[04:52] Team_060 possession (Score: 39-50)
Jarrett Wagner attempts a Midrange. Contested by Ja Banchero (5.3 feet, ZONE). Jarrett Wagner misses. Rebound secured by Jarrett Oladipo.

[04:37] Team_068 possession (Score: 39-50)
Miles Murray makes the Layup and draws the foul on Jarrett Wagner! And-1! Miles Murray to the line for 1. [BONUS: 7 team fouls] (Jarrett Wagner: 1 personal fouls)   FT 1/1: GOOD Miles Murray makes 1/1 from the line.
Score: 42-50

[04:22] Team_060 possession (Score: 42-50)
Rudy Ginobili attempts a Midrange. Contested by Franz Curry (4.6 feet, ZONE). RUDY GINOBILI MAKES IT!
Score: 42-52

[04:08] Team_068 possession (Score: 42-52)
Ja Banchero attempts a 3Pt. Contested by Domantas Barnes (4.7 feet, ZONE). Ja Banchero misses. Rebound secured by Rudy Ginobili.

[03:54] Team_060 possession (Score: 42-52)
Rudy Ginobili attempts a 3Pt. Contested by Ja Banchero (5.4 feet, MAN). Rudy Ginobili misses. Offensive rebound by Klay Haliburton! Klay Haliburton puts it back in!
Score: 42-54

[03:39] Team_068 possession (Score: 42-54)
Franz Curry attempts a Midrange. Contested by Rudy Ginobili (4.8 feet, ZONE). FRANZ CURRY MAKES IT! Assist: Cole Anthony
Score: 44-54

[03:24] Team_060 possession (Score: 44-54)
Jarrett Wagner commits a violation (traveling/carry)! TURNOVER! (dead ball)

[03:11] Team_068 possession (Score: 44-54)
FOUL! Reach-in foul on Yao Tatum during the drive. [IN THE BONUS! 8 team fouls] Jarrett Oladipo to the line for 2 free throws. (Yao Tatum: 1 personal fouls)   FT 1/2: GOOD   FT 2/2: GOOD Jarrett Oladipo makes 2/2 from the line.
Score: 46-54

[02:55] Team_060 possession (Score: 46-54)
Domantas Barnes drives and kicks out. Domantas Barnes attempts a Midrange. Contested by Ja Banchero (5.1 feet, ZONE). Domantas Barnes misses. Offensive rebound by Klay Haliburton! Klay Haliburton's putback is no good. Rebound secured by Ja Banchero.

[02:41] Team_068 possession (Score: 46-54)
Miles Murray attempts a 3Pt. Contested by Jarrett Wagner (5.0 feet, MAN). Miles Murray misses. Rebound secured by Klay Haliburton.

[02:30] Team_060 possession (Score: 46-54)
Rudy Ginobili attempts a 3Pt. Contested by Ja Banchero (5.4 feet, MAN). RUDY GINOBILI MAKES IT! Assist: Yao Tatum
Score: 46-57

[02:12] Team_068 possession (Score: 46-57)
Jarrett Oladipo attempts a 3Pt. Contested by Domantas Barnes (4.9 feet, ZONE). Jarrett Oladipo misses. Rebound secured by Domantas Barnes.

[01:56] Team_060 possession (Score: 46-57)
Yao Tatum drives to the basket... Yao Tatum loses the ball! Stripped by Franz Curry! TURNOVER! (live ball)

[01:42] Team_068 possession (Score: 46-57)
Miles Murray drives, picks up Jarrett Wagner. Help arrives from Domantas Barnes! Miles Murray attempts a Dunk. Contested by Domantas Barnes (5.0 feet, MAN). MILES MURRAY MAKES IT! Assist: Cole Anthony
Score: 48-57

[01:28] Team_060 possession (Score: 48-57)
Rudy Ginobili attempts a Midrange. Contested by Ja Banchero (5.4 feet, ZONE). Rudy Ginobili misses. Rebound secured by Ja Banchero.

[01:13] Team_068 possession (Score: 48-57)
Cole Anthony loses the ball! Stripped by Domantas Barnes! TURNOVER! (live ball)

[01:00] Team_060 possession (Score: 48-57)
Domantas Barnes drives to the basket... Domantas Barnes throws a bad pass out of bounds! TURNOVER! (dead ball)

[00:45] Team_068 possession (Score: 48-57)
Ja Banchero drives to the basket... Ja Banchero throws a bad pass! Stolen by Rudy Ginobili! TURNOVER! (live ball)

[00:26] Team_060 possession (Score: 48-57)
Domantas Barnes drives and kicks out. FOUL! Shooting foul on Cole Anthony. Domantas Barnes to the line for 3 free throws. [Team fouls: 2] (Cole Anthony: 1 personal fouls)   FT 1/3: GOOD   FT 2/3: MISS   FT 3/3: GOOD Domantas Barnes makes 2/3 from the line.
Score: 48-59

[00:14] Team_068 possession (Score: 48-59)
Ja Banchero makes the Layup and draws the foul on Klay Haliburton! And-1! Ja Banchero to the line for 1. [BONUS: 9 team fouls] (Klay Haliburton: 3 personal fouls)   FT 1/1: GOOD Ja Banchero makes 1/1 from the line.
Score: 51-59

================================================================================
                              2ND QUARTER COMPLETE                              
================================================================================

2ND QUARTER SCORE: Team_068 28, Team_060 24

BOX SCORE:
================================================================================

Team_068
--------------------------------------------------------------------------------
Player                MIN  PTS  REB  AST  TO      FG   FG%      3P   3P%
--------------------------------------------------------------------------------
Miles Murray            8    7    0    0   0   3/4    75.0     0/0   0.0
Ja Banchero             8    6    2    0   0   2/5    40.0     0/0   0.0
Zion Anunoby           16    5    0    0   0   2/4    50.0     0/0   0.0
Malcolm Herro          16    3    0    0   0   1/1   100.0     0/0   0.0
Franz Curry             8    2    2    1   0   1/1   100.0     0/0   0.0
Jarrett Oladipo         8    2    2    0   0   1/2    50.0     0/0   0.0
Jaren Johnson          16    1    3    1   0   1/1   100.0     0/0   0.0
Gary Simons            16    0    2    1   0   0/1     0.0     0/0   0.0
Cole Anthony            8    0    0    2   0   0/1     0.0     0/0   0.0

TEAM: FG: 11/20 (55.0%), 3PT: 2/6 (33.3%), REB: 8 (1 off, 7 def), AST: 5, TO: 4
TEAM FOULS: 2


Team_060
--------------------------------------------------------------------------------
Player                MIN  PTS  REB  AST  TO      FG   FG%      3P   3P%
--------------------------------------------------------------------------------
Domantas Barnes         8    5    1    0   0   2/4    50.0     0/0   0.0
Rudy Ginobili           8    5    3    1   0   2/3    66.7     0/0   0.0
Larry Westbrook        16    3    2    0   0   1/5    20.0     0/0   0.0
Joel Morant            16    3    0    0   0   1/2    50.0     0/0   0.0
Jarrett Wagner          8    3    0    0   0   1/2    50.0     0/0   0.0
Yao Tatum               8    3    0    2   0   1/1   100.0     0/0   0.0
Klay Haliburton         8    2    2    1   0   1/1   100.0     0/0   0.0
Immanuel Ming          16    0    1    0   0   0/0     0.0     0/0   0.0
Jaren George           16    0    1    0   0   0/0     0.0     0/0   0.0

TEAM: FG: 9/18 (50.0%), 3PT: 5/9 (55.6%), REB: 13 (4 off, 9 def), AST: 4, TO: 5
TEAM FOULS: 9 [Team_068 in BONUS]

================================================================================

================================================================================
                       3RD QUARTER - Team_068 vs Team_060                       
================================================================================

[12:00] Team_068 possession (Score: 51-59)
Jaren Johnson attempts a 3Pt. Contested by Julius Green (4.2 feet, ZONE). Jaren Johnson misses. FOUL! Loose ball foul on Larry Westbrook during the rebound battle. [Team fouls: 1] No free throws, side out. (Larry Westbrook: 1 personal fouls)

[11:42] Team_068 possession (Score: 51-59)
Malcolm Herro attempts a 3Pt. Contested by Immanuel Ming (3.7 feet, ZONE). MALCOLM HERRO MAKES IT! Assist: Gary Simons
Score: 54-59

[11:26] Team_060 possession (Score: 54-59)
Immanuel Ming drives, picks up Gary Simons. Help arrives from Malcolm Herro! Immanuel Ming attempts a Dunk. Contested by Malcolm Herro (3.1 feet, ZONE). IMMANUEL MING MAKES IT! Assist: Joel Morant
Score: 54-61

[11:14] Team_068 possession (Score: 54-61)
Gary Simons attempts a Midrange. Contested by Immanuel Ming (4.5 feet, ZONE). Gary Simons misses. Rebound secured by Larry Westbrook.

[11:00] Team_060 possession (Score: 54-61)
Immanuel Ming attempts a 3Pt. Contested by Jaren Johnson (3.6 feet, MAN). Immanuel Ming misses. Rebound secured by Nikola Ginobili.

[10:44] Team_068 possession (Score: 54-61)
Jaren Johnson attempts a Midrange. Contested by Larry Westbrook (5.1 feet, ZONE). JAREN JOHNSON MAKES IT!
Score: 56-61

[10:30] Team_060 possession (Score: 56-61)
FOUL! Shooting foul on Gary Simons. Immanuel Ming to the line for 2 free throws. [Team fouls: 1] (Gary Simons: 1 personal fouls)   FT 1/2: GOOD   FT 2/2: GOOD Immanuel Ming makes 2/2 from the line.
Score: 56-63

[10:17] Team_068 possession (Score: 56-63)
Gary Simons attempts a 3Pt. Contested by Julius Green (4.6 feet, ZONE). Gary Simons misses. Rebound secured by Larry Westbrook.

[10:05] Team_060 possession (Score: 56-63)
Larry Westbrook attempts a 3Pt. Contested by Malcolm Herro (4.7 feet, ZONE). LARRY WESTBROOK MAKES IT! Assist: Immanuel Ming
Score: 56-66

[09:49] Team_068 possession (Score: 56-66)
Zion Anunoby drives and kicks out. Gary Simons attempts a 3Pt. Contested by Larry Westbrook (4.6 feet, MAN). Gary Simons misses. Rebound secured by Jaren George.

[09:35] Team_060 possession (Score: 56-66)
Jaren George makes the Midrange and draws the foul on Nikola Ginobili! And-1! Jaren George to the line for 1. [Team fouls: 2] (Nikola Ginobili: 1 personal fouls)   FT 1/1: GOOD Jaren George makes 1/1 from the line.
Score: 56-69

[09:17] Team_068 possession (Score: 56-69)
Gary Simons attempts a 3Pt. Contested by Julius Green (4.6 feet, ZONE). GARY SIMONS MAKES IT! Assist: Jaren Johnson
Score: 59-69

[09:00] Team_060 possession (Score: 59-69)
Immanuel Ming drives, Gary Simons stays with him. Immanuel Ming attempts a Dunk. Contested by Gary Simons (3.1 feet, ZONE). IMMANUEL MING MAKES IT!
Score: 59-71

[08:45] Team_068 possession (Score: 59-71)
Nikola Ginobili attempts a Midrange. Contested by Julius Green (3.8 feet, ZONE). NIKOLA GINOBILI MAKES IT! Assist: Malcolm Herro
Score: 61-71

[08:33] Team_060 possession (Score: 61-71)
Immanuel Ming drives and kicks out. Julius Green attempts a Midrange. Contested by Malcolm Herro (4.2 feet, MAN). Julius Green misses. Offensive rebound by Immanuel Ming! Immanuel Ming kicks it out.

[08:23] Team_060 possession (Score: 61-71)
Larry Westbrook attempts a Layup. Contested by Nikola Ginobili (4.5 feet, ZONE). Larry Westbrook misses. Offensive rebound by Immanuel Ming! Immanuel Ming kicks it out.

[08:10] Team_060 possession (Score: 61-71)
FOUL! Shooting foul on Gary Simons. Joel Morant to the line for 2 free throws. [Team fouls: 3] (Gary Simons: 2 personal fouls)   FT 1/2: MISS   FT 2/2: GOOD Joel Morant makes 1/2 from the line.
Score: 61-72

[07:53] Team_068 possession (Score: 61-72)
Nikola Ginobili drives, Jaren George stays with him. Nikola Ginobili attempts a Dunk. Contested by Jaren George (5.2 feet, ZONE). NIKOLA GINOBILI MAKES IT! Assist: Jaren Johnson
Score: 63-72

[07:42] Team_060 possession (Score: 63-72)
FOUL! Shooting foul on Gary Simons. Jaren George to the line for 2 free throws. [Team fouls: 4] (Gary Simons: 3 personal fouls)   FT 1/2: GOOD   FT 2/2: GOOD Jaren George makes 2/2 from the line.
Score: 63-74

[07:28] Team_068 possession (Score: 63-74)
Nikola Ginobili attempts a Midrange. Contested by Jaren George (5.2 feet, MAN). NIKOLA GINOBILI MAKES IT! Assist: Zion Anunoby
Score: 65-74

[07:12] Team_060 possession (Score: 65-74)
FOUL! Shooting foul on Jaren Johnson. Larry Westbrook to the line for 2 free throws. [BONUS: 5 team fouls] (Jaren Johnson: 1 personal fouls)   FT 1/2: GOOD   FT 2/2: GOOD Larry Westbrook makes 2/2 from the line.
Score: 65-76

[06:57] Team_068 possession (Score: 65-76)
Zion Anunoby attempts a 3Pt. Contested by Julius Green (4.2 feet, ZONE). Zion Anunoby misses. Rebound secured by Immanuel Ming.

[06:40] Team_060 possession (Score: 65-76)
Julius Green attempts a 3Pt. Contested by Zion Anunoby (4.2 feet, ZONE). Julius Green misses. Rebound secured by Nikola Ginobili.

[06:26] Team_068 possession (Score: 65-76)
Zion Anunoby drives and kicks out. Malcolm Herro attempts a Midrange. Contested by Julius Green (3.8 feet, MAN). MALCOLM HERRO MAKES IT!
Score: 67-76

[06:11] Team_060 possession (Score: 67-76)
Julius Green attempts a 3Pt. Contested by Zion Anunoby (4.2 feet, ZONE). Julius Green misses. Rebound secured by Jaren Johnson.

[05:55] Team_068 possession (Score: 67-76)
Nikola Ginobili attempts a Midrange. Contested by Jaren George (5.2 feet, ZONE). NIKOLA GINOBILI MAKES IT!
Score: 69-76

[05:41] Team_060 possession (Score: 69-76)
Larry Westbrook attempts a 3Pt. Contested by Gary Simons (3.7 feet, MAN). Larry Westbrook misses. Rebound secured by Jaren Johnson.

[05:26] Team_068 possession (Score: 69-76)
Nikola Ginobili drives, Jaren George stays with him. Nikola Ginobili attempts a Layup. Contested by Jaren George (5.3 feet, MAN). NIKOLA GINOBILI MAKES IT! Assist: Malcolm Herro
Score: 71-76

[05:11] Team_060 possession (Score: 71-76)
Larry Westbrook attempts a Layup. BLOCKED BY MALCOLM HERRO! Ball goes out off Malcolm Herro. Larry Westbrook's ball!

[04:56] Team_060 possession (Score: 71-76)
Joel Morant drives to the basket... Joel Morant commits a violation (traveling/carry)! TURNOVER! (dead ball)

[04:38] Team_068 possession (Score: 71-76)
Zion Anunoby attempts a 3Pt. Contested by Joel Morant (5.7 feet, MAN). Zion Anunoby misses. FOUL! Loose ball foul on Larry Westbrook during the rebound battle. [Team fouls: 2] No free throws, side out. (Larry Westbrook: 2 personal fouls)

[04:25] Team_068 possession (Score: 71-76)
Malcolm Herro drives and kicks out. Gary Simons attempts a 3Pt. Contested by Larry Westbrook (4.7 feet, MAN). Gary Simons misses. Offensive rebound by Jaren Johnson! Jaren Johnson kicks it out.

[04:06] Team_068 possession (Score: 71-76)
Zion Anunoby drives, picks up Jaren George. Help arrives from Julius Green! Zion Anunoby attempts a Dunk. Contested by Julius Green (5.7 feet, ZONE). Zion Anunoby misses. Rebound secured by Larry Westbrook.

[03:51] Team_060 possession (Score: 71-76)
Immanuel Ming attempts a Layup. Contested by Gary Simons (3.3 feet, ZONE). Immanuel Ming misses. Rebound secured by Gary Simons.

[03:39] Team_068 possession (Score: 71-76)
Malcolm Herro attempts a 3Pt. Contested by Julius Green (3.9 feet, MAN). Malcolm Herro misses. Rebound secured by Jaren George.

[03:24] Team_060 possession (Score: 71-76)
Julius Green attempts a 3Pt. Contested by Malcolm Herro (4.2 feet, MAN). JULIUS GREEN MAKES IT! Assist: Jaren George
Score: 71-79

[03:11] Team_068 possession (Score: 71-79)
Zion Anunoby drives to the basket... Zion Anunoby throws a bad pass! Stolen by Jaren George! TURNOVER! (live ball)

[02:58] Team_060 possession (Score: 71-79)
Immanuel Ming makes the Layup and draws the foul on Gary Simons! And-1! Immanuel Ming to the line for 1. [BONUS: 6 team fouls] (Gary Simons: 4 personal fouls)   FT 1/1: GOOD Immanuel Ming makes 1/1 from the line.
Score: 71-82

[02:47] Team_068 possession (Score: 71-82)
Malcolm Herro drives to the basket... Malcolm Herro loses the ball! Stripped by Julius Green! TURNOVER! (live ball)

[02:33] Team_060 possession (Score: 71-82)
Immanuel Ming drives, Jaren Johnson stays with him. Immanuel Ming attempts a Layup. Contested by Jaren Johnson (3.8 feet, MAN). Immanuel Ming misses. Rebound secured by Nikola Ginobili.

[02:21] Team_068 possession (Score: 71-82)
FOUL! Offensive foul on Gary Simons! Larry Westbrook drew the charge! [Team fouls: 7] (Gary Simons: 5 personal fouls) TURNOVER! (dead ball)

[02:07] Team_060 possession (Score: 71-82)
FOUL! Holding foul on Jaren Johnson. [IN THE BONUS! 8 team fouls] Immanuel Ming to the line for 2 free throws. (Jaren Johnson: 2 personal fouls)   FT 1/2: GOOD   FT 2/2: MISS Immanuel Ming makes 1/2 from the line. Rebound secured by Jaren Johnson.
Score: 71-83

[01:51] Team_068 possession (Score: 71-83)
Malcolm Herro attempts a Midrange. Contested by Julius Green (4.1 feet, MAN). Malcolm Herro misses. Rebound secured by Jaren George.

[01:41] Team_060 possession (Score: 71-83)
Larry Westbrook attempts a 3Pt. Contested by Zion Anunoby (5.1 feet, ZONE). LARRY WESTBROOK MAKES IT! Assist: Joel Morant
Score: 71-86

[01:26] Team_068 possession (Score: 71-86)
Jaren Johnson attempts a Midrange. Contested by Larry Westbrook (5.5 feet, ZONE). Jaren Johnson misses. Rebound secured by Jaren George.

[01:16] Team_060 possession (Score: 71-86)
Julius Green attempts a Layup. Contested by Gary Simons (3.5 feet, ZONE). Julius Green misses. Rebound secured by Nikola Ginobili.

[01:00] Team_068 possession (Score: 71-86)
Gary Simons drives to the basket... Gary Simons loses the ball! Stripped by Larry Westbrook! TURNOVER! (live ball)

[00:51] Team_060 possession (Score: 71-86)
Joel Morant attempts a 3Pt. Contested by Zion Anunoby (4.4 feet, MAN). Joel Morant misses. Rebound secured by Jaren Johnson.

[00:33] Team_068 possession (Score: 71-86)
Malcolm Herro attempts a 3Pt. Contested by Julius Green (4.2 feet, MAN). Malcolm Herro misses. Rebound secured by Jaren George.

[00:22] Team_060 possession (Score: 71-86)
Larry Westbrook attempts a Layup. Contested by Gary Simons (4.3 feet, MAN). Larry Westbrook misses. Offensive rebound by Immanuel Ming! Immanuel Ming kicks it out.

[00:11] Team_060 possession (Score: 71-86)
Jaren George drives, Nikola Ginobili stays with him. Jaren George attempts a Layup. Contested by Nikola Ginobili (4.9 feet, MAN). Jaren George misses. Rebound secured by Gary Simons.

================================================================================
                              3RD QUARTER COMPLETE                              
================================================================================

3RD QUARTER SCORE: Team_068 20, Team_060 27

BOX SCORE:
================================================================================

Team_068
--------------------------------------------------------------------------------
Player                MIN  PTS  REB  AST  TO      FG   FG%      3P   3P%
--------------------------------------------------------------------------------
Nikola Ginobili        28   10    6    0   0   5/5   100.0     0/0   0.0
Malcolm Herro          28    5    0    2   0   2/5    40.0     0/0   0.0
Gary Simons            28    3    2    1   0   1/3    33.3     0/0   0.0
Jaren Johnson          28    2    5    2   0   1/2    50.0     0/0   0.0
Zion Anunoby           28    0    0    1   0   0/3     0.0     0/0   0.0

TEAM: FG: 9/18 (50.0%), 3PT: 2/6 (33.3%), REB: 13 (3 off, 10 def), AST: 6, TO: 4
TEAM FOULS: 8 [Team_060 in BONUS]


Team_060
--------------------------------------------------------------------------------
Player                MIN  PTS  REB  AST  TO      FG   FG%      3P   3P%
--------------------------------------------------------------------------------
Immanuel Ming          28    9    4    1   0   4/7    57.1     0/0   0.0
Larry Westbrook        28    8    3    0   0   3/4    75.0     0/0   0.0
Jaren George           28    5    5    1   0   2/3    66.7     0/0   0.0
Julius Green           28    3    0    0   0   1/4    25.0     0/0   0.0
Joel Morant            28    1    0    2   0   1/2    50.0     0/0   0.0

TEAM: FG: 11/21 (52.4%), 3PT: 3/8 (37.5%), REB: 12 (3 off, 9 def), AST: 4, TO: 1
TEAM FOULS: 2

================================================================================

================================================================================
                       4TH QUARTER - Team_068 vs Team_060                       
================================================================================

[12:00] Substitution (Team_068): Zion Anunoby OUT (stamina: 70) → Cole Anthony IN (comeback_detected)

[12:00] Substitution (Team_060): Joel Morant OUT (stamina: 65) → Domantas Barnes IN (comeback_detected)

[12:00] Team_068 possession (Score: 71-86)
Malcolm Herro drives to the basket... FOUL! Offensive foul on Malcolm Herro! Julius Green drew the charge! [Team fouls: 1] (Malcolm Herro: 1 personal fouls) TURNOVER! (dead ball)

[11:44] Team_060 possession (Score: 71-86)
Julius Green attempts a Midrange. Contested by Malcolm Herro (4.4 feet, MAN). Julius Green misses. Rebound secured by Gary Simons.

[11:28] Team_068 possession (Score: 71-86)
FOUL! Shooting foul on Domantas Barnes. Jaren Johnson to the line for 3 free throws. [Team fouls: 1] (Domantas Barnes: 1 personal fouls)   FT 1/3: MISS   FT 2/3: MISS   FT 3/3: MISS Jaren Johnson makes 0/3 from the line. Rebound secured by Domantas Barnes.

[11:15] Team_060 possession (Score: 71-86)
Jaren George drives and kicks out. Julius Green attempts a Midrange. Contested by Malcolm Herro (4.6 feet, MAN). Julius Green misses. Rebound secured by Nikola Ginobili.

[11:02] Team_068 possession (Score: 71-86)
Nikola Ginobili makes the Layup and draws the foul on Jaren George! And-1! Nikola Ginobili to the line for 1. [Team fouls: 2] (Jaren George: 1 personal fouls)   FT 1/1: GOOD Nikola Ginobili makes 1/1 from the line.
Score: 74-86

[10:47] Team_060 possession (Score: 74-86)
Jaren George attempts a Layup. BLOCKED BY NIKOLA GINOBILI! Ball is loose! Rebound secured by Nikola Ginobili.

[10:36] Team_068 possession (Score: 74-86)
Jaren Johnson drives to the basket... Jaren Johnson loses the ball! Stripped by Jaren George! TURNOVER! (live ball)

[10:23] Team_060 possession (Score: 74-86)
FOUL! Reach-in foul on Nikola Ginobili during the drive. [Team fouls: 2] No free throws, side out. (Nikola Ginobili: 1 personal fouls)

[10:06] Team_060 possession (Score: 74-86)
Domantas Barnes attempts a 3Pt. Contested by Cole Anthony (4.7 feet, MAN). Domantas Barnes misses. Rebound secured by Jaren Johnson.

[09:52] Team_068 possession (Score: 74-86)
Malcolm Herro makes the Dunk and draws the foul on Immanuel Ming! And-1! Malcolm Herro to the line for 1. [Team fouls: 3] (Immanuel Ming: 1 personal fouls)   FT 1/1: GOOD Malcolm Herro makes 1/1 from the line.
Score: 77-86

[09:39] Team_060 possession (Score: 77-86)
Larry Westbrook drives to the basket... Larry Westbrook loses the ball! Stripped by Gary Simons! TURNOVER! (live ball)

[09:26] Team_068 possession (Score: 77-86)
Nikola Ginobili attempts a Midrange. Contested by Immanuel Ming (4.2 feet, ZONE). NIKOLA GINOBILI MAKES IT! Assist: Malcolm Herro
Score: 79-86

[09:12] Team_060 possession (Score: 79-86)
Immanuel Ming attempts a 3Pt. Contested by Jaren Johnson (4.3 feet, MAN). Immanuel Ming misses. Rebound secured by Nikola Ginobili.

[08:58] Team_068 possession (Score: 79-86)
FOUL! Holding foul on Julius Green. [Team fouls: 4] No free throws, side out. (Julius Green: 1 personal fouls)

[08:39] Team_068 possession (Score: 79-86)
Malcolm Herro attempts a 3Pt. Contested by Immanuel Ming (4.2 feet, ZONE). Malcolm Herro misses. Rebound secured by Domantas Barnes.

[08:25] Team_060 possession (Score: 79-86)
Larry Westbrook attempts a 3Pt. Contested by Gary Simons (4.5 feet, MAN). Larry Westbrook misses. Rebound secured by Gary Simons.

[08:13] Team_068 possession (Score: 79-86)
Nikola Ginobili attempts a Midrange. Contested by Immanuel Ming (4.3 feet, ZONE). Nikola Ginobili misses. Offensive rebound by Jaren Johnson! Jaren Johnson kicks it out.

[07:59] Team_068 possession (Score: 79-86)
Malcolm Herro attempts a Layup. Wide open! Jaren George is 6.0 feet away. [ZONE] MALCOLM HERRO MAKES IT! Assist: Gary Simons
Score: 81-86

[07:41] Team_060 possession (Score: 81-86)
Larry Westbrook attempts a 3Pt. Contested by Cole Anthony (5.0 feet, ZONE). Larry Westbrook misses. Rebound secured by Gary Simons.

[07:26] Team_068 possession (Score: 81-86)
Malcolm Herro drives, Jaren George stays with him. Malcolm Herro attempts a Dunk. Wide open! Jaren George is 6.1 feet away. [ZONE] MALCOLM HERRO MAKES IT!
Score: 83-86

[07:11] Team_060 possession (Score: 83-86)
Immanuel Ming attempts a 3Pt. Contested by Gary Simons (4.4 feet, ZONE). Immanuel Ming misses. Rebound secured by Gary Simons.

[06:54] Team_068 possession (Score: 83-86)
FOUL! Holding foul on Jaren George. [IN THE BONUS! 5 team fouls] Nikola Ginobili to the line for 2 free throws. (Jaren George: 2 personal fouls)   FT 1/2: GOOD   FT 2/2: GOOD Nikola Ginobili makes 2/2 from the line.
Score: 85-86

[06:39] Team_060 possession (Score: 85-86)
Jaren George drives, Gary Simons stays with him. Jaren George attempts a Dunk. Contested by Gary Simons (4.5 feet, ZONE). JAREN GEORGE MAKES IT!
Score: 85-88

[06:26] Team_068 possession (Score: 85-88)
Gary Simons drives to the basket... Gary Simons loses the ball! Stripped by Jaren George! TURNOVER! (live ball)

[06:15] Team_060 possession (Score: 85-88)
Julius Green drives and kicks out. Immanuel Ming attempts a 3Pt. Contested by Jaren Johnson (4.9 feet, MAN). IMMANUEL MING MAKES IT! Assist: Julius Green
Score: 85-91

[05:58] Team_068 possession (Score: 85-91)
Nikola Ginobili throws a bad pass out of bounds! TURNOVER! (dead ball)

[05:58] Substitution (Team_068): Malcolm Herro OUT → Ja Banchero IN (stamina_rule2)

[05:58] Substitution (Team_068): Jaren Johnson OUT → Miles Murray IN (stamina_rule2)

[05:58] Substitution (Team_068): Gary Simons OUT → Jarrett Oladipo IN (stamina_rule2)

[05:58] Substitution (Team_068): Nikola Ginobili OUT → Franz Curry IN (stamina_rule2)

[05:58] Substitution (Team_060): Julius Green OUT → Rudy Ginobili IN (stamina_rule2)

[05:58] Substitution (Team_060): Immanuel Ming OUT → Jarrett Wagner IN (stamina_rule2)

[05:58] Substitution (Team_060): Larry Westbrook OUT → Yao Tatum IN (stamina_rule2)

[05:58] Substitution (Team_060): Jaren George OUT → Klay Haliburton IN (stamina_rule2)

[05:42] Team_060 possession (Score: 85-91)
Domantas Barnes attempts a 3Pt. Contested by Ja Banchero (5.1 feet, ZONE). Domantas Barnes misses. Rebound secured by Jarrett Oladipo.

[05:30] Team_068 possession (Score: 85-91)
Miles Murray attempts a 3Pt. Contested by Domantas Barnes (4.7 feet, ZONE). MILES MURRAY MAKES IT! Assist: Cole Anthony
Score: 88-91

[05:17] Team_060 possession (Score: 88-91)
Rudy Ginobili drives, picks up Ja Banchero. Help arrives from Miles Murray! Rudy Ginobili attempts a Dunk. Contested by Miles Murray (5.4 feet, MAN). Rudy Ginobili misses. Offensive rebound by Domantas Barnes! Domantas Barnes kicks it out.

[05:04] Team_060 possession (Score: 88-91)
Klay Haliburton attempts a Layup. Contested by Franz Curry (4.6 feet, ZONE). Klay Haliburton misses. Rebound secured by Jarrett Oladipo.

[04:49] Team_068 possession (Score: 88-91)
Jarrett Oladipo drives, Klay Haliburton stays with him. Jarrett Oladipo attempts a Layup. Contested by Klay Haliburton (4.6 feet, ZONE). JARRETT OLADIPO MAKES IT! Assist: Miles Murray
Score: 90-91

[04:34] Team_060 possession (Score: 90-91)
Rudy Ginobili attempts a 3Pt. Contested by Ja Banchero (5.4 feet, ZONE). Rudy Ginobili misses. Rebound secured by Ja Banchero.

[04:16] Team_068 possession (Score: 90-91)
Franz Curry drives and kicks out. Cole Anthony makes the Midrange and draws the foul on Domantas Barnes! And-1! Cole Anthony to the line for 1. [BONUS: 6 team fouls] (Domantas Barnes: 2 personal fouls)   FT 1/1: GOOD Cole Anthony makes 1/1 from the line.
Score: 93-91

[03:58] Team_060 possession (Score: 93-91)
Yao Tatum attempts a Layup. Contested by Franz Curry (4.4 feet, ZONE). YAO TATUM MAKES IT!
Score: 93-93

[03:43] Team_068 possession (Score: 93-93)
Cole Anthony attempts a Midrange. Contested by Rudy Ginobili (4.2 feet, ZONE). Cole Anthony misses. Rebound secured by Domantas Barnes.

[03:28] Team_060 possession (Score: 93-93)
Jarrett Wagner drives and kicks out. Yao Tatum attempts a Midrange. Contested by Jarrett Oladipo (3.8 feet, ZONE). YAO TATUM MAKES IT! Assist: Rudy Ginobili
Score: 93-95

[03:11] Team_068 possession (Score: 93-95)
FOUL! Reach-in foul on Rudy Ginobili during the drive. [IN THE BONUS! 7 team fouls] Ja Banchero to the line for 2 free throws. (Rudy Ginobili: 1 personal fouls)   FT 1/2: MISS   FT 2/2: GOOD Ja Banchero makes 1/2 from the line.
Score: 94-95

[02:56] Team_060 possession (Score: 94-95)
Klay Haliburton drives to the basket... Klay Haliburton loses the ball! Stripped by Franz Curry! TURNOVER! (live ball)

[02:44] Team_068 possession (Score: 94-95)
Ja Banchero attempts a Midrange. Contested by Rudy Ginobili (4.5 feet, MAN). Ja Banchero misses. Rebound secured by Klay Haliburton.

[02:31] Team_060 possession (Score: 94-95)
Jarrett Wagner drives and kicks out. Klay Haliburton attempts a Midrange. Contested by Ja Banchero (5.1 feet, ZONE). Klay Haliburton misses. Offensive rebound by Domantas Barnes! Domantas Barnes kicks it out.

[02:20] Team_060 possession (Score: 94-95)
Rudy Ginobili attempts a 3Pt. Contested by Ja Banchero (5.4 feet, ZONE). RUDY GINOBILI MAKES IT! Assist: Yao Tatum
Score: 94-98

[02:05] Team_068 possession (Score: 94-98)
Franz Curry drives and kicks out. Miles Murray attempts a 3Pt. Contested by Jarrett Wagner (4.8 feet, MAN). Miles Murray misses. Rebound secured by Domantas Barnes.

[01:51] Team_060 possession (Score: 94-98)
Yao Tatum attempts a 3Pt. Contested by Jarrett Oladipo (3.9 feet, MAN). Yao Tatum misses. Offensive rebound by Domantas Barnes! Domantas Barnes kicks it out.

[01:37] Team_060 possession (Score: 94-98)
Domantas Barnes attempts a 3Pt. Contested by Cole Anthony (5.0 feet, MAN). Domantas Barnes misses. Rebound secured by Franz Curry.

[01:22] Team_068 possession (Score: 94-98)
Ja Banchero attempts a 3Pt. Contested by Domantas Barnes (5.1 feet, ZONE). JA BANCHERO MAKES IT! Assist: Franz Curry
Score: 97-98

[01:09] Team_060 possession (Score: 97-98)
Klay Haliburton drives and kicks out. Klay Haliburton attempts a Midrange. Contested by Miles Murray (3.9 feet, ZONE). Klay Haliburton misses. Rebound secured by Franz Curry.

[00:54] Team_068 possession (Score: 97-98)
Jarrett Oladipo attempts a 3Pt. Contested by Yao Tatum (5.6 feet, MAN). Jarrett Oladipo misses. Rebound secured by Klay Haliburton.

[00:38] Team_060 possession (Score: 97-98)
Yao Tatum attempts a Midrange. Contested by Miles Murray (3.9 feet, ZONE). Yao Tatum misses. Rebound secured by Jarrett Oladipo.

[00:21] Team_068 possession (Score: 97-98)
FOUL! Shooting foul on Yao Tatum. Jarrett Oladipo to the line for 2 free throws. [BONUS: 8 team fouls] (Yao Tatum: 1 personal fouls)   FT 1/2: MISS   FT 2/2: MISS Jarrett Oladipo makes 0/2 from the line. Rebound secured by Klay Haliburton.

[00:08] Team_060 possession (Score: 97-98)
Yao Tatum attempts a Midrange. Contested by Jarrett Oladipo (3.9 feet, MAN). Yao Tatum misses. Rebound secured by Franz Curry.

================================================================================
                              4TH QUARTER COMPLETE                              
================================================================================

4TH QUARTER SCORE: Team_068 26, Team_060 12

BOX SCORE:
================================================================================

Team_068
--------------------------------------------------------------------------------
Player                MIN  PTS  REB  AST  TO      FG   FG%      3P   3P%
--------------------------------------------------------------------------------
Nikola Ginobili        35    7    3    0   0   3/3   100.0     0/0   0.0
Malcolm Herro          35    7    0    1   0   3/4    75.0     0/0   0.0
Ja Banchero            14    4    1    0   0   2/3    66.7     0/0   0.0
Miles Murray           14    3    0    1   0   1/1   100.0     0/0   0.0
Cole Anthony           20    3    0    1   0   1/2    50.0     0/0   0.0
Jarrett Oladipo        14    2    3    0   0   1/3    33.3     0/0   0.0
Gary Simons            35    0    4    1   0   0/0     0.0     0/0   0.0
Jaren Johnson          35    0    2    0   0   0/1     0.0     0/0   0.0
Franz Curry            14    0    3    1   0   0/1     0.0     0/0   0.0

TEAM: FG: 11/18 (61.1%), 3PT: 2/5 (40.0%), REB: 16 (1 off, 15 def), AST: 5, TO: 4
TEAM FOULS: 2


Team_060
--------------------------------------------------------------------------------
Player                MIN  PTS  REB  AST  TO      FG   FG%      3P   3P%
--------------------------------------------------------------------------------
Yao Tatum              14    4    0    1   0   2/4    50.0     0/0   0.0
Immanuel Ming          35    3    0    0   0   1/3    33.3     0/0   0.0
Rudy Ginobili          14    3    0    1   0   1/2    50.0     0/0   0.0
Jaren George           35    2    0    0   0   1/3    33.3     0/0   0.0
Julius Green           35    0    0    1   0   0/1     0.0     0/0   0.0
Domantas Barnes        20    0    7    0   0   0/3     0.0     0/0   0.0
Larry Westbrook        35    0    0    0   0   0/2     0.0     0/0   0.0
Klay Haliburton        14    0    3    0   0   0/2     0.0     0/0   0.0

TEAM: FG: 5/20 (25.0%), 3PT: 1/9 (11.1%), REB: 10 (3 off, 7 def), AST: 3, TO: 2
TEAM FOULS: 8 [Team_068 in BONUS]

================================================================================

================================================================================
                               FULL GAME COMPLETE                               
================================================================================

FINAL SCORE: Team_068 97, Team_060 98

SCORING BY QUARTER:
--------------------------------------------------------------------------------
Team                     Q1     Q2     Q3     Q4    FINAL
--------------------------------------------------------------------------------
Team_068                 23     28     20     26       97
Team_060                 35     24     27     12       98
--------------------------------------------------------------------------------

FULL GAME BOX SCORE:
================================================================================

Team_068
--------------------------------------------------------------------------------
Player                MIN  PTS  REB  AST  TO      FG   FG%      3P   3P%      FT STL BLK
--------------------------------------------------------------------------------
Malcolm Herro          35   22    0    4   0   9/14   64.3   4/8    50.0   2/3     0   1
Jaren Johnson          35    9   14    3   1   3/9    33.3   2/6    33.3   1/5     0   0
Gary Simons            35    3    8    6   4   1/6    16.7   1/4    25.0   0/0     1   0
Nikola Ginobili        35   21   15    1   6   9/10   90.0   0/0     0.0   3/3     0   1
Zion Anunoby           28   11    0    1   2   6/11   54.5   0/1     0.0   1/1     0   0
Cole Anthony           20    3    0    3   3   0/2     0.0   0/0     0.0   1/2     0   0
Ja Banchero            14   10    3    0   0   4/8    50.0   2/4    50.0   2/3     0   0
Miles Murray           14   10    0    1   0   4/5    80.0   1/2    50.0   3/3     0   0
Jarrett Oladipo        14    4    5    0   1   2/5    40.0   0/2     0.0   2/4     0   0
Franz Curry            14    2    5    2   0   2/3    66.7   0/0     0.0   0/0     2   0

TEAM: FG: 41/74 (55.4%), 3PT: 10/27 (37.0%), REB: 46 (8 off, 38 def), AST: 21, TO: 17


Team_060
--------------------------------------------------------------------------------
Player                MIN  PTS  REB  AST  TO      FG   FG%      3P   3P%      FT STL BLK
--------------------------------------------------------------------------------
Julius Green           35    5    0    2   0   6/11   54.5   3/5    60.0   2/2     1   0
Immanuel Ming          35   12    7    3   0   4/9    44.4   0/3     0.0   4/5     1   0
Larry Westbrook        35   19    7    0   0   7/16   43.8   3/10   30.0   4/5     1   0
Jaren George           35   17   11    2   1   6/10   60.0   0/0     0.0   7/7     4   1
Joel Morant            28   17    0    3   1   7/12   58.3   1/3    33.3   1/2     2   0
Domantas Barnes        20    5    8    0   1   2/7    28.6   1/5    20.0   2/3     1   0
Rudy Ginobili          14    8    3    2   1   4/6    66.7   3/4    75.0   0/0     1   0
Jarrett Wagner         14    3    0    0   3   2/3    66.7   0/0     0.0   0/0     0   0
Yao Tatum              14    7    0    3   1   2/4    50.0   1/1   100.0   0/0     0   0
Klay Haliburton        14    2    5    1   0   0/2     0.0   0/0     0.0   0/0     1   0

TEAM: FG: 40/81 (49.4%), 3PT: 12/31 (38.7%), REB: 45 (12 off, 33 def), AST: 16, TO: 8

================================================================================
