================================================================================
                        FULL GAME - Team_062 vs Team_025                        
================================================================================

================================================================================
                       1ST QUARTER - Team_062 vs Team_025                       
================================================================================

[12:00] Team_062 possession (Score: 0-0)
FOUL! Holding foul on Allen Embiid. [Team fouls: 1] No free throws, side out. (Allen Embiid: 1 personal fouls)

[11:43] Team_062 possession (Score: 0-0)
Kawhi Thompson makes the Layup and draws the foul on Ben Giddey! And-1! Kawhi Thompson to the line for 1. [Team fouls: 2] (Ben Giddey: 1 personal fouls)   FT 1/1: GOOD Kawhi Thompson makes 1/1 from the line.
Score: 3-0

[11:29] Team_025 possession (Score: 3-0)
Allen Embiid attempts a Midrange. Contested by Chris Bird (4.3 feet, ZONE). Allen Embiid misses. Rebound secured by Jalen Reaves.

[11:18] Team_062 possession (Score: 3-0)
Kawhi Thompson drives to the basket... Kawhi Thompson throws a bad pass! Stolen by Allen Embiid! TURNOVER! (live ball)

[11:07] Team_025 possession (Score: 3-0)
Paolo Lowry drives, Chris Bird stays with him. Paolo Lowry attempts a Layup. Contested by Chris Bird (4.6 feet, MAN). Paolo Lowry misses. Rebound secured by Michael Hyland.

[10:50] Team_062 possession (Score: 3-0)
Kawhi Thompson drives, picks up Allen Embiid. Help arrives from Ben Giddey! Kawhi Thompson attempts a Layup. Contested by Ben Giddey (2.9 feet, ZONE). KAWHI THOMPSON MAKES IT! Assist: Jalen Reaves
Score: 5-0

[10:34] Team_025 possession (Score: 5-0)
Paolo Lowry attempts a 3Pt. Contested by RJ Williamson (4.8 feet, ZONE). Paolo Lowry misses. Offensive rebound by Allen Embiid! Allen Embiid puts it back in!
Score: 5-2

[10:21] Team_062 possession (Score: 5-2)
Michael Hyland attempts a 3Pt. Contested by Desmond Jordan (3.3 feet, MAN). Michael Hyland misses. Rebound secured by Desmond Jordan.

[10:10] Team_025 possession (Score: 5-2)
Desmond Jordan attempts a 3Pt. Contested by RJ Williamson (4.5 feet, ZONE). DESMOND JORDAN MAKES IT! Assist: Ben Giddey
Score: 5-5

[09:53] Team_062 possession (Score: 5-5)
RJ Williamson drives, picks up Allen Embiid. Help arrives from Ben Giddey! RJ Williamson attempts a Dunk. Contested by Ben Giddey (2.6 feet, ZONE). RJ WILLIAMSON MAKES IT! Assist: Jalen Reaves
Score: 7-5

[09:40] Team_025 possession (Score: 7-5)
Desmond Jordan attempts a 3Pt. Contested by RJ Williamson (4.5 feet, ZONE). Desmond Jordan misses. Rebound secured by Jalen Reaves.

[09:25] Team_062 possession (Score: 7-5)
FOUL! Holding foul on Ben Giddey. [Team fouls: 3] No free throws, side out. (Ben Giddey: 2 personal fouls)

[09:09] Team_062 possession (Score: 7-5)
Jalen Reaves attempts a Layup. Contested by Allen Embiid (3.1 feet, MAN). JALEN REAVES MAKES IT! Assist: RJ Williamson
Score: 9-5

[08:54] Team_025 possession (Score: 9-5)
Desmond Jordan attempts a Midrange. Contested by Michael Hyland (4.8 feet, ZONE). Desmond Jordan misses. Rebound secured by Kawhi Thompson.

[08:43] Team_062 possession (Score: 9-5)
RJ Williamson attempts a Midrange. Contested by Desmond Jordan (3.1 feet, ZONE). RJ WILLIAMSON MAKES IT!
Score: 11-5

[08:33] Team_025 possession (Score: 11-5)
Cade Anthony attempts a Midrange. Contested by Kawhi Thompson (5.6 feet, ZONE). CADE ANTHONY MAKES IT!
Score: 11-7

[08:16] Team_062 possession (Score: 11-7)
FOUL! Reach-in foul on Allen Embiid during the drive. [Team fouls: 4] No free throws, side out. (Allen Embiid: 2 personal fouls)

[08:01] Team_062 possession (Score: 11-7)
Jalen Reaves attempts a Layup. Contested by Allen Embiid (3.1 feet, MAN). Jalen Reaves misses. Offensive rebound by Jalen Reaves! Jalen Reaves puts it back in!
Score: 13-7

[07:48] Team_025 possession (Score: 13-7)
Ben Giddey drives to the basket... Ben Giddey throws a bad pass out of bounds! TURNOVER! (dead ball)

[07:31] Team_062 possession (Score: 13-7)
RJ Williamson attempts a Layup. Contested by Allen Embiid (2.6 feet, ZONE). RJ Williamson misses. Rebound secured by Allen Embiid.

[07:16] Team_025 possession (Score: 13-7)
Desmond Jordan drives, picks up Michael Hyland. Help arrives from Chris Bird! Desmond Jordan attempts a Layup. Contested by Chris Bird (4.8 feet, MAN). Desmond Jordan misses. Rebound secured by Jalen Reaves.

[07:05] Team_062 possession (Score: 13-7)
Chris Bird attempts a Midrange. Contested by Paolo Lowry (5.1 feet, MAN). Chris Bird misses. Offensive rebound by Kawhi Thompson! Kawhi Thompson kicks it out.

[06:53] Team_062 possession (Score: 13-7)
Chris Bird drives to the basket... Chris Bird throws a bad pass! Stolen by Paolo Lowry! TURNOVER! (live ball)

[06:38] Team_025 possession (Score: 13-7)
FOUL! Shooting foul on RJ Williamson. Ben Giddey to the line for 2 free throws. [Team fouls: 1] (RJ Williamson: 1 personal fouls)   FT 1/2: GOOD   FT 2/2: GOOD Ben Giddey makes 2/2 from the line.
Score: 13-9

[06:26] Team_062 possession (Score: 13-9)
FOUL! Shooting foul on Ben Giddey. Jalen Reaves to the line for 2 free throws. [BONUS: 5 team fouls] (Ben Giddey: 3 personal fouls)   FT 1/2: GOOD   FT 2/2: GOOD Jalen Reaves makes 2/2 from the line.
Score: 15-9

[06:10] Team_025 possession (Score: 15-9)
Allen Embiid attempts a Midrange. Contested by RJ Williamson (4.5 feet, ZONE). Allen Embiid misses. Rebound secured by Michael Hyland.

[05:55] Team_062 possession (Score: 15-9)
Kawhi Thompson attempts a 3Pt. Contested by Cade Anthony (4.2 feet, MAN). Kawhi Thompson misses. Rebound secured by Allen Embiid.

[05:39] Team_025 possession (Score: 15-9)
FOUL! Shooting foul on RJ Williamson. Allen Embiid to the line for 2 free throws. [Team fouls: 2] (RJ Williamson: 2 personal fouls)   FT 1/2: GOOD   FT 2/2: GOOD Allen Embiid makes 2/2 from the line.
Score: 15-11

[05:24] Team_062 possession (Score: 15-11)
Chris Bird throws a bad pass out of bounds! TURNOVER! (dead ball)

[05:11] Team_025 possession (Score: 15-11)
Allen Embiid attempts a Layup. Contested by Jalen Reaves (5.1 feet, ZONE). ALLEN EMBIID MAKES IT!
Score: 15-13

[04:53] Team_062 possession (Score: 15-13)
RJ Williamson attempts a 3Pt. Contested by Ben Giddey (3.4 feet, MAN). RJ WILLIAMSON MAKES IT! Assist: Chris Bird
Score: 18-13

[04:37] Team_025 possession (Score: 18-13)
FOUL! Holding foul on Jalen Reaves. [Team fouls: 3] No free throws, side out. (Jalen Reaves: 1 personal fouls)

[04:20] Team_025 possession (Score: 18-13)
Paolo Lowry attempts a Layup. Contested by Jalen Reaves (5.4 feet, ZONE). PAOLO LOWRY MAKES IT!
Score: 18-15

[04:04] Team_062 possession (Score: 18-15)
Jalen Reaves makes the Layup and draws the foul on Ben Giddey! And-1! Jalen Reaves to the line for 1. [BONUS: 6 team fouls] (Ben Giddey: 4 personal fouls)   FT 1/1: GOOD Jalen Reaves makes 1/1 from the line.
Score: 21-15

[03:52] Team_025 possession (Score: 21-15)
Desmond Jordan attempts a 3Pt. Contested by RJ Williamson (4.7 feet, ZONE). Desmond Jordan misses. Rebound secured by Kawhi Thompson.

[03:41] Team_062 possession (Score: 21-15)
Jalen Reaves attempts a Layup. Contested by Allen Embiid (3.3 feet, ZONE). Jalen Reaves misses. Rebound secured by Desmond Jordan.

[03:28] Team_025 possession (Score: 21-15)
Ben Giddey drives and kicks out. FOUL! Shooting foul on Jalen Reaves. Paolo Lowry to the line for 2 free throws. [Team fouls: 4] (Jalen Reaves: 2 personal fouls)   FT 1/2: GOOD   FT 2/2: GOOD Paolo Lowry makes 2/2 from the line.
Score: 21-17

[03:12] Team_062 possession (Score: 21-17)
Chris Bird drives and kicks out. Kawhi Thompson attempts a 3Pt. Contested by Cade Anthony (4.4 feet, MAN). KAWHI THOMPSON MAKES IT! Assist: Michael Hyland
Score: 24-17

[03:01] Team_025 possession (Score: 24-17)
Desmond Jordan attempts a 3Pt. Contested by RJ Williamson (4.7 feet, ZONE). Desmond Jordan misses. Rebound secured by Michael Hyland.

[02:49] Team_062 possession (Score: 24-17)
Michael Hyland attempts a 3Pt. Contested by Desmond Jordan (3.5 feet, MAN). MICHAEL HYLAND MAKES IT! Assist: Kawhi Thompson
Score: 27-17

[02:30] Team_025 possession (Score: 27-17)
Allen Embiid drives, picks up Jalen Reaves. Help arrives from Chris Bird! Allen Embiid attempts a Layup. Contested by Chris Bird (5.3 feet, MAN). Allen Embiid misses. Rebound secured by Michael Hyland.

[02:12] Team_062 possession (Score: 27-17)
FOUL! Shooting foul on Cade Anthony. Kawhi Thompson to the line for 2 free throws. [BONUS: 7 team fouls] (Cade Anthony: 1 personal fouls)   FT 1/2: GOOD   FT 2/2: MISS Kawhi Thompson makes 1/2 from the line. FOUL! Loose ball foul on Cade Anthony during the free throw rebound! [IN THE BONUS! 8 team fouls] Jalen Reaves to the line for 2 free throws. (Cade Anthony: 2 personal fouls)   FT 1/2: GOOD   FT 2/2: GOOD Jalen Reaves makes 2/2 from the line.
Score: 30-17

[01:58] Team_025 possession (Score: 30-17)
Allen Embiid attempts a Midrange. Contested by Jalen Reaves (5.4 feet, MAN). Allen Embiid misses. Rebound secured by Kawhi Thompson.

[01:43] Team_062 possession (Score: 30-17)
Chris Bird attempts a Midrange. Contested by Paolo Lowry (5.3 feet, ZONE). Chris Bird misses. Rebound secured by Allen Embiid.

[01:24] Team_025 possession (Score: 30-17)
Ben Giddey attempts a Layup. Contested by Kawhi Thompson (5.6 feet, ZONE). BEN GIDDEY MAKES IT!
Score: 30-19

[01:13] Team_062 possession (Score: 30-19)
Jalen Reaves drives, Allen Embiid stays with him. Jalen Reaves attempts a Layup. Contested by Allen Embiid (3.6 feet, MAN). JALEN REAVES MAKES IT!
Score: 32-19

[00:57] Team_025 possession (Score: 32-19)
Ben Giddey attempts a 3Pt. Contested by RJ Williamson (5.2 feet, MAN). BEN GIDDEY MAKES IT!
Score: 32-22

[00:45] Team_062 possession (Score: 32-22)
Michael Hyland drives to the basket... Michael Hyland throws a bad pass out of bounds! TURNOVER! (dead ball)

[00:45] Substitution (Team_062): Chris Bird OUT → Paolo McCollum IN (stamina_rule2)

[00:45] Substitution (Team_062): RJ Williamson OUT → Tony LaVine IN (stamina_rule2)

[00:45] Substitution (Team_062): Michael Hyland OUT → Paul Poole IN (stamina_rule2)

[00:45] Substitution (Team_062): Kawhi Thompson OUT → RJ Wall IN (stamina_rule2)

[00:45] Substitution (Team_062): Jalen Reaves OUT → Devin Young IN (stamina_rule2)

[00:45] Substitution (Team_025): Paolo Lowry OUT → LeBron Griffin IN (stamina_rule2)

[00:45] Substitution (Team_025): Ben Giddey OUT → Dirk Gilgeous-Alexander IN (stamina_rule2)

[00:45] Substitution (Team_025): Desmond Jordan OUT → Immanuel LaVine IN (stamina_rule2)

[00:45] Substitution (Team_025): Cade Anthony OUT → Damian Adebayo IN (stamina_rule2)

[00:45] Substitution (Team_025): Allen Embiid OUT → Nikola Lillard IN (stamina_rule2)

[00:31] Team_025 possession (Score: 32-22)
LeBron Griffin attempts a 3Pt. Contested by Paolo McCollum (5.5 feet, MAN). LeBron Griffin misses. Offensive rebound by Immanuel LaVine! Immanuel LaVine kicks it out.

[00:15] Team_025 possession (Score: 32-22)
Immanuel LaVine attempts a Midrange. Wide open! Paul Poole is 6.4 feet away. [MAN] Immanuel LaVine misses. Rebound secured by Paul Poole.

================================================================================
                              1ST QUARTER COMPLETE                              
================================================================================

1ST QUARTER SCORE: Team_062 32, Team_025 22

BOX SCORE:
================================================================================

Team_062
--------------------------------------------------------------------------------
Player                MIN  PTS  REB  AST  TO      FG   FG%      3P   3P%
--------------------------------------------------------------------------------
Jalen Reaves           11   14    4    2   0   6/7    85.7     0/0   0.0
Kawhi Thompson         11    8    4    1   0   3/4    75.0     0/0   0.0
RJ Williamson          11    7    0    1   0   3/4    75.0     0/0   0.0
Michael Hyland         11    3    4    1   0   1/2    50.0     0/0   0.0
Chris Bird             11    0    0    1   0   0/1     0.0     0/0   0.0
Paul Poole              1    0    1    0   0   0/0     0.0     0/0   0.0

TEAM: FG: 13/18 (72.2%), 3PT: 2/4 (50.0%), REB: 13 (2 off, 11 def), AST: 6, TO: 4
TEAM FOULS: 4


Team_025
--------------------------------------------------------------------------------
Player                MIN  PTS  REB  AST  TO      FG   FG%      3P   3P%
--------------------------------------------------------------------------------
Ben Giddey             11    7    0    1   0   3/3   100.0     0/0   0.0
Allen Embiid           11    6    4    0   0   3/7    42.9     0/0   0.0
Paolo Lowry            11    4    0    0   0   2/3    66.7     0/0   0.0
Desmond Jordan         11    3    2    0   0   1/6    16.7     0/0   0.0
Cade Anthony           11    2    0    0   0   1/1   100.0     0/0   0.0
Immanuel LaVine         1    0    1    0   0   0/1     0.0     0/0   0.0

TEAM: FG: 10/21 (47.6%), 3PT: 3/6 (50.0%), REB: 7 (2 off, 5 def), AST: 1, TO: 1
TEAM FOULS: 8 [Team_062 in BONUS]

================================================================================

================================================================================
                       2ND QUARTER - Team_062 vs Team_025                       
================================================================================

[12:00] Team_062 possession (Score: 32-22)
Chris Bird attempts a 3Pt. Contested by Paolo Lowry (5.2 feet, MAN). Chris Bird misses. Offensive rebound by Kawhi Thompson! Kawhi Thompson kicks it out.

[11:49] Team_062 possession (Score: 32-22)
Jalen Reaves makes the Layup and draws the foul on Allen Embiid! And-1! Jalen Reaves to the line for 1. [Team fouls: 1] (Allen Embiid: 1 personal fouls)   FT 1/1: GOOD Jalen Reaves makes 1/1 from the line.
Score: 35-22

[11:30] Team_025 possession (Score: 35-22)
Cade Anthony attempts a Midrange. Contested by Michael Hyland (5.6 feet, ZONE). Cade Anthony misses. Rebound secured by Kawhi Thompson.

[11:16] Team_062 possession (Score: 35-22)
FOUL! Reach-in foul on Cade Anthony during the drive. [Team fouls: 2] No free throws, side out. (Cade Anthony: 1 personal fouls)

[11:04] Team_062 possession (Score: 35-22)
FOUL! Shooting foul on Desmond Jordan. Michael Hyland to the line for 2 free throws. [Team fouls: 3] (Desmond Jordan: 1 personal fouls)   FT 1/2: GOOD   FT 2/2: MISS Michael Hyland makes 1/2 from the line. Offensive rebound by Kawhi Thompson! Kawhi Thompson kicks it out.
Score: 36-22

[10:55] Team_062 possession (Score: 36-22)
Kawhi Thompson attempts a Layup. Contested by Cade Anthony (4.5 feet, MAN). KAWHI THOMPSON MAKES IT! Assist: Chris Bird
Score: 38-22

[10:42] Team_025 possession (Score: 38-22)
Ben Giddey attempts a 3Pt. Contested by Chris Bird (5.0 feet, ZONE). Ben Giddey misses. Rebound secured by Jalen Reaves.

[10:27] Team_062 possession (Score: 38-22)
Chris Bird attempts a 3Pt. Contested by Cade Anthony (4.7 feet, ZONE). Chris Bird misses. Rebound secured by Desmond Jordan.

[10:14] Team_025 possession (Score: 38-22)
Allen Embiid drives and kicks out. Allen Embiid attempts a 3Pt. Contested by RJ Williamson (4.8 feet, ZONE). Allen Embiid misses. Rebound secured by Jalen Reaves.

[10:03] Team_062 possession (Score: 38-22)
RJ Williamson drives, picks up Allen Embiid. Help arrives from Ben Giddey! RJ Williamson attempts a Dunk. Contested by Ben Giddey (3.2 feet, ZONE). RJ Williamson misses. Offensive rebound by Kawhi Thompson! Kawhi Thompson kicks it out.

[09:44] Team_062 possession (Score: 38-22)
FOUL! Shooting foul on Desmond Jordan. Michael Hyland to the line for 2 free throws. [Team fouls: 4] (Desmond Jordan: 2 personal fouls)   FT 1/2: GOOD   FT 2/2: MISS Michael Hyland makes 1/2 from the line. Rebound secured by Allen Embiid.
Score: 39-22

[09:30] Team_025 possession (Score: 39-22)
Paolo Lowry drives, Chris Bird stays with him. Paolo Lowry attempts a Layup. Contested by Chris Bird (5.0 feet, MAN). PAOLO LOWRY MAKES IT! Assist: Allen Embiid
Score: 39-24

[09:13] Team_062 possession (Score: 39-24)
Chris Bird makes the Layup and draws the foul on Paolo Lowry! And-1! Chris Bird to the line for 1. [BONUS: 5 team fouls] (Paolo Lowry: 1 personal fouls)   FT 1/1: GOOD Chris Bird makes 1/1 from the line.
Score: 42-24

[09:01] Team_025 possession (Score: 42-24)
Cade Anthony attempts a 3Pt. Wide open! Kawhi Thompson is 6.0 feet away. [MAN] Cade Anthony misses. Offensive rebound by Allen Embiid! Allen Embiid puts it back in!
Score: 42-26

[08:51] Team_062 possession (Score: 42-26)
FOUL! Reach-in foul on Allen Embiid during the drive. [IN THE BONUS! 6 team fouls] Jalen Reaves to the line for 2 free throws. (Allen Embiid: 2 personal fouls)   FT 1/2: GOOD   FT 2/2: GOOD Jalen Reaves makes 2/2 from the line.
Score: 44-26

[08:42] Team_025 possession (Score: 44-26)
Paolo Lowry attempts a Layup. Contested by Jalen Reaves (5.9 feet, ZONE). PAOLO LOWRY MAKES IT! Assist: Desmond Jordan
Score: 44-28

[08:26] Team_062 possession (Score: 44-28)
Michael Hyland attempts a 3Pt. Contested by Desmond Jordan (3.9 feet, MAN). Michael Hyland misses. Rebound secured by Allen Embiid.

[08:12] Team_025 possession (Score: 44-28)
Paolo Lowry attempts a Layup. BLOCKED BY CHRIS BIRD! Ball deflects out of bounds off Paolo Lowry.

[07:55] Team_062 possession (Score: 44-28)
FOUL! Offensive foul on Michael Hyland! Desmond Jordan drew the charge! [Team fouls: 1] (Michael Hyland: 1 personal fouls) TURNOVER! (dead ball)

[07:44] Team_025 possession (Score: 44-28)
FOUL! Shooting foul on Chris Bird. Paolo Lowry to the line for 2 free throws. [Team fouls: 2] (Chris Bird: 1 personal fouls)   FT 1/2: GOOD   FT 2/2: GOOD Paolo Lowry makes 2/2 from the line.
Score: 44-30

[07:32] Team_062 possession (Score: 44-30)
Jalen Reaves throws a bad pass! Stolen by Allen Embiid! TURNOVER! (live ball)

[07:19] Team_025 possession (Score: 44-30)
FOUL! Holding foul on Michael Hyland. [Team fouls: 3] No free throws, side out. (Michael Hyland: 2 personal fouls)

[07:03] Team_025 possession (Score: 44-30)
Cade Anthony attempts a 3Pt. Wide open! Kawhi Thompson is 6.3 feet away. [MAN] Cade Anthony misses. Rebound secured by Michael Hyland.

[06:48] Team_062 possession (Score: 44-30)
Jalen Reaves attempts a Midrange. Contested by Allen Embiid (4.2 feet, MAN). JALEN REAVES MAKES IT!
Score: 46-30

[06:34] Team_025 possession (Score: 46-30)
Cade Anthony attempts a Midrange. Contested by RJ Williamson (5.9 feet, ZONE). Cade Anthony misses. Rebound secured by Kawhi Thompson.

[06:21] Team_062 possession (Score: 46-30)
Chris Bird attempts a Midrange. Contested by Cade Anthony (5.1 feet, ZONE). CHRIS BIRD MAKES IT! Assist: Jalen Reaves
Score: 48-30

[06:04] Team_025 possession (Score: 48-30)
Desmond Jordan attempts a 3Pt. Contested by Michael Hyland (5.7 feet, MAN). Desmond Jordan misses. Rebound secured by Kawhi Thompson.

[05:46] Team_062 possession (Score: 48-30)
RJ Williamson attempts a 3Pt. Contested by Cade Anthony (4.8 feet, ZONE). RJ WILLIAMSON MAKES IT! Assist: Michael Hyland
Score: 51-30

[05:31] Team_025 possession (Score: 51-30)
Paolo Lowry drives to the basket... Paolo Lowry throws a bad pass! Stolen by Chris Bird! TURNOVER! (live ball)

[05:18] Team_062 possession (Score: 51-30)
Jalen Reaves makes the Layup and draws the foul on Allen Embiid! And-1! Jalen Reaves to the line for 1. [BONUS: 7 team fouls] (Allen Embiid: 3 personal fouls)   FT 1/1: GOOD Jalen Reaves makes 1/1 from the line.
Score: 54-30

[05:03] Team_025 possession (Score: 54-30)
Paolo Lowry attempts a Midrange. Wide open! Michael Hyland is 6.0 feet away. [ZONE] Paolo Lowry misses. Rebound secured by Kawhi Thompson.

[04:51] Team_062 possession (Score: 54-30)
Michael Hyland attempts a 3Pt. Contested by Cade Anthony (5.1 feet, ZONE). Michael Hyland misses. Rebound secured by Desmond Jordan.

[04:35] Team_025 possession (Score: 54-30)
Cade Anthony attempts a 3Pt. Wide open! RJ Williamson is 6.1 feet away. [ZONE] Cade Anthony misses. Rebound secured by Kawhi Thompson.

[04:19] Team_062 possession (Score: 54-30)
Jalen Reaves loses the ball! Stripped by Allen Embiid! TURNOVER! (live ball)

[04:04] Team_025 possession (Score: 54-30)
Allen Embiid drives and kicks out. Ben Giddey attempts a 3Pt. Contested by RJ Williamson (5.8 feet, ZONE). BEN GIDDEY MAKES IT! Assist: Paolo Lowry
Score: 54-33

[03:51] Team_062 possession (Score: 54-33)
RJ Williamson drives and kicks out. Jalen Reaves attempts a 3Pt. BLOCKED BY CADE ANTHONY! Ball is loose! Rebound secured by Allen Embiid.

[03:35] Team_025 possession (Score: 54-33)
Paolo Lowry attempts a Layup. Wide open! Jalen Reaves is 6.6 feet away. [ZONE] PAOLO LOWRY MAKES IT! Assist: Ben Giddey
Score: 54-35

[03:17] Team_062 possession (Score: 54-35)
Michael Hyland attempts a 3Pt. Contested by Cade Anthony (5.3 feet, ZONE). Michael Hyland misses. Rebound secured by Allen Embiid.

[03:00] Team_025 possession (Score: 54-35)
Cade Anthony attempts a 3Pt. Wide open! RJ Williamson is 6.3 feet away. [ZONE] Cade Anthony misses. Rebound secured by Jalen Reaves.

[02:49] Team_062 possession (Score: 54-35)
Chris Bird attempts a 3Pt. Contested by Ben Giddey (5.2 feet, ZONE). Chris Bird misses. Rebound secured by Desmond Jordan.

[02:34] Team_025 possession (Score: 54-35)
Paolo Lowry attempts a Layup. Wide open! Jalen Reaves is 6.7 feet away. [ZONE] PAOLO LOWRY MAKES IT! Assist: Cade Anthony
Score: 54-37

[02:21] Team_062 possession (Score: 54-37)
Jalen Reaves attempts a Layup. Contested by Allen Embiid (5.0 feet, ZONE). Jalen Reaves misses. Rebound secured by Desmond Jordan.

[02:07] Team_025 possession (Score: 54-37)
Paolo Lowry attempts a Midrange. Wide open! Michael Hyland is 6.4 feet away. [ZONE] Paolo Lowry misses. Rebound secured by Michael Hyland.

[01:51] Team_062 possession (Score: 54-37)
RJ Williamson attempts a 3Pt. Contested by Ben Giddey (5.0 feet, MAN). RJ Williamson misses. Offensive rebound by Kawhi Thompson! Kawhi Thompson kicks it out.

[01:39] Team_062 possession (Score: 54-37)
FOUL! Offensive foul on RJ Williamson! Ben Giddey drew the charge! [Team fouls: 4] (RJ Williamson: 1 personal fouls) TURNOVER! (dead ball)

[01:24] Team_025 possession (Score: 54-37)
Allen Embiid attempts a Layup. Wide open! Jalen Reaves is 6.6 feet away. [ZONE] Allen Embiid misses. Rebound secured by Jalen Reaves.

[01:11] Team_062 possession (Score: 54-37)
Jalen Reaves drives and kicks out. Jalen Reaves attempts a 3Pt. Contested by Allen Embiid (5.4 feet, MAN). Jalen Reaves misses. Rebound secured by Desmond Jordan.

[00:53] Team_025 possession (Score: 54-37)
Paolo Lowry attempts a Midrange. Wide open! Chris Bird is 6.2 feet away. [MAN] PAOLO LOWRY MAKES IT! Assist: Ben Giddey
Score: 54-39

[00:40] Team_062 possession (Score: 54-39)
Michael Hyland drives to the basket... Michael Hyland throws a bad pass! Stolen by Allen Embiid! TURNOVER! (live ball)

[00:28] Team_025 possession (Score: 54-39)
Cade Anthony attempts a Layup. Wide open! Jalen Reaves is 7.3 feet away. [ZONE] Cade Anthony misses. Rebound secured by Jalen Reaves.

[00:13] Team_062 possession (Score: 54-39)
Kawhi Thompson attempts a 3Pt. Contested by Cade Anthony (5.8 feet, MAN). Kawhi Thompson misses. Rebound secured by Allen Embiid.

================================================================================
                              2ND QUARTER COMPLETE                              
================================================================================

2ND QUARTER SCORE: Team_062 22, Team_025 17

BOX SCORE:
================================================================================

Team_062
--------------------------------------------------------------------------------
Player                MIN  PTS  REB  AST  TO      FG   FG%      3P   3P%
--------------------------------------------------------------------------------
Jalen Reaves           23   10    5    1   0   4/6    66.7     0/0   0.0
Chris Bird             23    5    0    1   0   2/4    50.0     0/0   0.0
RJ Williamson          23    3    0    0   0   1/2    50.0     0/0   0.0
Kawhi Thompson         23    2    9    0   0   1/2    50.0     0/0   0.0
Michael Hyland         23    0    2    1   0   0/4     0.0     0/0   0.0

TEAM: FG: 8/18 (44.4%), 3PT: 1/7 (14.3%), REB: 16 (4 off, 12 def), AST: 3, TO: 5
TEAM FOULS: 4


Team_025
--------------------------------------------------------------------------------
Player                MIN  PTS  REB  AST  TO      FG   FG%      3P   3P%
--------------------------------------------------------------------------------
Paolo Lowry            23   12    0    1   0   6/9    66.7     0/0   0.0
Ben Giddey             23    3    0    2   0   1/2    50.0     0/0   0.0
Allen Embiid           23    2    6    1   0   1/3    33.3     0/0   0.0
Cade Anthony           23    0    0    1   0   0/6     0.0     0/0   0.0
Desmond Jordan         23    0    5    1   0   0/1     0.0     0/0   0.0

TEAM: FG: 8/21 (38.1%), 3PT: 1/6 (16.7%), REB: 11 (1 off, 10 def), AST: 6, TO: 1
TEAM FOULS: 7 [Team_062 in BONUS]

================================================================================

================================================================================
                       3RD QUARTER - Team_062 vs Team_025                       
================================================================================

[12:00] Team_062 possession (Score: 54-39)
FOUL! Offensive foul on Kawhi Thompson! Cade Anthony drew the charge! [Team fouls: 1] (Kawhi Thompson: 1 personal fouls) TURNOVER! (dead ball)

[11:43] Team_025 possession (Score: 54-39)
Desmond Jordan attempts a 3Pt. Contested by RJ Williamson (4.5 feet, ZONE). Desmond Jordan misses. Rebound secured by Michael Hyland.

[11:31] Team_062 possession (Score: 54-39)
Jalen Reaves attempts a Layup. Contested by Allen Embiid (3.1 feet, MAN). JALEN REAVES MAKES IT! Assist: RJ Williamson
Score: 56-39

[11:16] Team_025 possession (Score: 56-39)
Cade Anthony drives, Jalen Reaves stays with him. Cade Anthony attempts a Dunk. Contested by Jalen Reaves (5.6 feet, ZONE). CADE ANTHONY MAKES IT! Assist: Allen Embiid
Score: 56-41

[11:03] Team_062 possession (Score: 56-41)
Michael Hyland drives, Allen Embiid stays with him. Michael Hyland attempts a Layup. Contested by Allen Embiid (2.8 feet, ZONE). MICHAEL HYLAND MAKES IT!
Score: 58-41

[10:49] Team_025 possession (Score: 58-41)
Allen Embiid attempts a Midrange. Contested by Jalen Reaves (5.1 feet, MAN). Allen Embiid misses. Rebound secured by Kawhi Thompson.

[10:32] Team_062 possession (Score: 58-41)
Jalen Reaves attempts a Layup. Contested by Allen Embiid (3.1 feet, ZONE). Jalen Reaves misses. Offensive rebound by Jalen Reaves! Jalen Reaves puts it back in!
Score: 60-41

[10:18] Team_025 possession (Score: 60-41)
Desmond Jordan attempts a 3Pt. Contested by RJ Williamson (4.5 feet, ZONE). Desmond Jordan misses. Rebound secured by Jalen Reaves.

[10:00] Team_062 possession (Score: 60-41)
FOUL! Shooting foul on Cade Anthony. Kawhi Thompson to the line for 3 free throws. [Team fouls: 1] (Cade Anthony: 1 personal fouls)   FT 1/3: MISS   FT 2/3: GOOD   FT 3/3: GOOD Kawhi Thompson makes 2/3 from the line.
Score: 62-41

[09:44] Team_025 possession (Score: 62-41)
Ben Giddey attempts a Layup. Contested by Jalen Reaves (5.4 feet, ZONE). Ben Giddey misses. Rebound secured by Jalen Reaves.

[09:31] Team_062 possession (Score: 62-41)
Kawhi Thompson makes the Layup and draws the foul on Cade Anthony! And-1! Kawhi Thompson to the line for 1. [Team fouls: 2] (Cade Anthony: 2 personal fouls)   FT 1/1: GOOD Kawhi Thompson makes 1/1 from the line.
Score: 65-41

[09:13] Team_025 possession (Score: 65-41)
Ben Giddey attempts a 3Pt. Contested by Michael Hyland (5.1 feet, ZONE). BEN GIDDEY MAKES IT! Assist: Paolo Lowry
Score: 65-44

[08:58] Team_062 possession (Score: 65-44)
Chris Bird attempts a Layup. BLOCKED BY ALLEN EMBIID! Ball deflects out of bounds off Chris Bird.

[08:42] Team_025 possession (Score: 65-44)
FOUL! Reach-in foul on Jalen Reaves during the drive. [Team fouls: 2] No free throws, side out. (Jalen Reaves: 1 personal fouls)

[08:30] Team_025 possession (Score: 65-44)
Ben Giddey makes the Layup and draws the foul on Jalen Reaves! And-1! Ben Giddey to the line for 1. [Team fouls: 3] (Jalen Reaves: 2 personal fouls)   FT 1/1: GOOD Ben Giddey makes 1/1 from the line.
Score: 65-47

[08:12] Team_062 possession (Score: 65-47)
Chris Bird makes the Dunk and draws the foul on Paolo Lowry! And-1! Chris Bird to the line for 1. [Team fouls: 3] (Paolo Lowry: 1 personal fouls)   FT 1/1: GOOD Chris Bird makes 1/1 from the line.
Score: 68-47

[08:00] Team_025 possession (Score: 68-47)
Desmond Jordan attempts a 3Pt. Contested by RJ Williamson (4.5 feet, ZONE). DESMOND JORDAN MAKES IT! Assist: Cade Anthony
Score: 68-50

[07:44] Team_062 possession (Score: 68-50)
Michael Hyland attempts a Layup. Contested by Allen Embiid (2.8 feet, ZONE). MICHAEL HYLAND MAKES IT! Assist: Jalen Reaves
Score: 70-50

[07:29] Team_025 possession (Score: 70-50)
Desmond Jordan attempts a Midrange. Contested by Michael Hyland (4.8 feet, MAN). DESMOND JORDAN MAKES IT! Assist: Ben Giddey
Score: 70-52

[07:13] Team_062 possession (Score: 70-52)
Chris Bird drives and kicks out. Chris Bird attempts a 3Pt. Contested by Ben Giddey (3.6 feet, ZONE). Chris Bird misses. Offensive rebound by Kawhi Thompson! Kawhi Thompson kicks it out.

[06:59] Team_062 possession (Score: 70-52)
Kawhi Thompson drives and kicks out. RJ Williamson attempts a 3Pt. Contested by Ben Giddey (3.6 feet, MAN). RJ Williamson misses. FOUL! Loose ball foul on Desmond Jordan during the rebound battle. [Team fouls: 4] No free throws, side out. (Desmond Jordan: 1 personal fouls)

[06:41] Team_062 possession (Score: 70-52)
Kawhi Thompson attempts a Layup. Contested by Allen Embiid (2.9 feet, ZONE). KAWHI THOMPSON MAKES IT! Assist: RJ Williamson
Score: 72-52

[06:27] Team_025 possession (Score: 72-52)
Allen Embiid attempts a Midrange. Contested by Michael Hyland (4.8 feet, ZONE). ALLEN EMBIID MAKES IT!
Score: 72-54

[06:11] Team_062 possession (Score: 72-54)
Jalen Reaves attempts a 3Pt. Contested by Allen Embiid (3.1 feet, MAN). Jalen Reaves misses. Rebound secured by Desmond Jordan.

[05:55] Team_025 possession (Score: 72-54)
Paolo Lowry drives, picks up Kawhi Thompson. Help arrives from Chris Bird! Paolo Lowry attempts a Dunk. Contested by Chris Bird (5.2 feet, ZONE). Paolo Lowry misses. Offensive rebound by Desmond Jordan! Desmond Jordan's putback is no good. Offensive rebound by Allen Embiid! Allen Embiid kicks it out.

[05:37] Team_025 possession (Score: 72-54)
Desmond Jordan drives and kicks out. Ben Giddey attempts a Midrange. Contested by Chris Bird (4.2 feet, ZONE). Ben Giddey misses. Rebound secured by Kawhi Thompson.

[05:23] Team_062 possession (Score: 72-54)
Chris Bird attempts a Midrange. Contested by Paolo Lowry (5.1 feet, MAN). Chris Bird misses. Rebound secured by Allen Embiid.

[05:05] Team_025 possession (Score: 72-54)
Paolo Lowry attempts a Midrange. Contested by Chris Bird (4.6 feet, MAN). PAOLO LOWRY MAKES IT! Assist: Allen Embiid
Score: 72-56

[04:51] Team_062 possession (Score: 72-56)
Kawhi Thompson attempts a 3Pt. Contested by Cade Anthony (4.2 feet, MAN). Kawhi Thompson misses. Rebound secured by Cade Anthony.

[04:34] Team_025 possession (Score: 72-56)
Allen Embiid attempts a Layup. Contested by Jalen Reaves (5.1 feet, ZONE). ALLEN EMBIID MAKES IT! Assist: Ben Giddey
Score: 72-58

[04:19] Team_062 possession (Score: 72-58)
Jalen Reaves attempts a Midrange. Contested by Allen Embiid (3.2 feet, MAN). Jalen Reaves misses. Rebound secured by Allen Embiid.

[04:02] Team_025 possession (Score: 72-58)
Paolo Lowry drives and kicks out. Desmond Jordan attempts a 3Pt. Contested by RJ Williamson (4.4 feet, ZONE). DESMOND JORDAN MAKES IT!
Score: 72-61

[03:47] Team_062 possession (Score: 72-61)
Kawhi Thompson makes the Layup and draws the foul on Cade Anthony! And-1! Kawhi Thompson to the line for 1. [BONUS: 5 team fouls] (Cade Anthony: 3 personal fouls)   FT 1/1: GOOD Kawhi Thompson makes 1/1 from the line.
Score: 75-61

[03:30] Team_025 possession (Score: 75-61)
Cade Anthony attempts a Layup. Contested by Kawhi Thompson (5.7 feet, MAN). Cade Anthony misses. Offensive rebound by Allen Embiid! Allen Embiid puts it back in!
Score: 75-63

[03:15] Team_062 possession (Score: 75-63)
FOUL! Shooting foul on Allen Embiid. Chris Bird to the line for 2 free throws. [BONUS: 6 team fouls] (Allen Embiid: 1 personal fouls)   FT 1/2: MISS   FT 2/2: MISS Chris Bird makes 0/2 from the line. Offensive rebound by Jalen Reaves! Jalen Reaves's putback is no good.

[03:00] Team_025 possession (Score: 75-63)
Cade Anthony attempts a Layup. Contested by Kawhi Thompson (5.7 feet, MAN). CADE ANTHONY MAKES IT! Assist: Paolo Lowry
Score: 75-65

[02:43] Team_062 possession (Score: 75-65)
FOUL! Offensive foul on Jalen Reaves! Allen Embiid drew the charge! [Team fouls: 4] (Jalen Reaves: 3 personal fouls) TURNOVER! (dead ball)

[02:29] Team_025 possession (Score: 75-65)
Ben Giddey drives and kicks out. Paolo Lowry attempts a 3Pt. Contested by Chris Bird (4.4 feet, MAN). Paolo Lowry misses. Rebound secured by Michael Hyland.

[02:14] Team_062 possession (Score: 75-65)
RJ Williamson drives and kicks out. Chris Bird attempts a Midrange. Contested by Ben Giddey (3.8 feet, ZONE). Chris Bird misses. Rebound secured by Allen Embiid.

[02:00] Team_025 possession (Score: 75-65)
Desmond Jordan attempts a 3Pt. Contested by RJ Williamson (4.8 feet, ZONE). Desmond Jordan misses. Rebound secured by Kawhi Thompson.

[01:49] Team_062 possession (Score: 75-65)
Kawhi Thompson attempts a 3Pt. Contested by Ben Giddey (3.9 feet, ZONE). Kawhi Thompson misses. Rebound secured by Allen Embiid.

[01:35] Team_025 possession (Score: 75-65)
Desmond Jordan attempts a Layup. BLOCKED BY JALEN REAVES! Ball is loose! Rebound secured by Jalen Reaves.

[01:18] Team_062 possession (Score: 75-65)
Michael Hyland attempts a 3Pt. Contested by Desmond Jordan (3.6 feet, MAN). MICHAEL HYLAND MAKES IT! Assist: RJ Williamson
Score: 78-65

[01:06] Team_025 possession (Score: 78-65)
Ben Giddey attempts a Midrange. Contested by RJ Williamson (5.2 feet, MAN). Ben Giddey misses. Rebound secured by Michael Hyland.

[00:53] Team_062 possession (Score: 78-65)
Michael Hyland attempts a Layup. BLOCKED BY BEN GIDDEY! Ball is loose! Rebound secured by Allen Embiid.

[00:39] Team_025 possession (Score: 78-65)
Ben Giddey drives, RJ Williamson stays with him. Ben Giddey attempts a Dunk. Contested by RJ Williamson (5.2 feet, MAN). BEN GIDDEY MAKES IT!
Score: 78-67

[00:24] Team_062 possession (Score: 78-67)
Chris Bird attempts a Midrange. Contested by Paolo Lowry (5.4 feet, MAN). CHRIS BIRD MAKES IT!
Score: 80-67

[00:09] Team_025 possession (Score: 80-67)
Allen Embiid attempts a 3Pt. Contested by Jalen Reaves (5.5 feet, MAN). Allen Embiid misses. Rebound secured by Jalen Reaves.

================================================================================
                              3RD QUARTER COMPLETE                              
================================================================================

3RD QUARTER SCORE: Team_062 26, Team_025 28

BOX SCORE:
================================================================================

Team_062
--------------------------------------------------------------------------------
Player                MIN  PTS  REB  AST  TO      FG   FG%      3P   3P%
--------------------------------------------------------------------------------
Kawhi Thompson         36   10    5    0   0   4/6    66.7     0/0   0.0
Michael Hyland         36    7    3    0   0   3/4    75.0     0/0   0.0
Chris Bird             36    5    0    0   0   2/5    40.0     0/0   0.0
Jalen Reaves           36    4    6    1   0   2/4    50.0     0/0   0.0
RJ Williamson          36    0    0    3   0   0/1     0.0     0/0   0.0

TEAM: FG: 11/20 (55.0%), 3PT: 2/5 (40.0%), REB: 13 (3 off, 10 def), AST: 4, TO: 2
TEAM FOULS: 4


Team_025
--------------------------------------------------------------------------------
Player                MIN  PTS  REB  AST  TO      FG   FG%      3P   3P%
--------------------------------------------------------------------------------
Desmond Jordan         36    8    1    0   0   3/8    37.5     0/0   0.0
Ben Giddey             36    8    0    2   0   3/6    50.0     0/0   0.0
Allen Embiid           36    6    7    2   0   3/5    60.0     0/0   0.0
Cade Anthony           36    4    1    1   0   2/2   100.0     0/0   0.0
Paolo Lowry            36    2    0    2   0   1/1   100.0     0/0   0.0

TEAM: FG: 12/22 (54.5%), 3PT: 2/6 (33.3%), REB: 10 (2 off, 8 def), AST: 7, TO: 0
TEAM FOULS: 6 [Team_062 in BONUS]

================================================================================

================================================================================
                       4TH QUARTER - Team_062 vs Team_025                       
================================================================================

[12:00] Team_062 possession (Score: 80-67)
Jalen Reaves attempts a Layup. Contested by Allen Embiid (3.4 feet, MAN). JALEN REAVES MAKES IT! Assist: Michael Hyland
Score: 82-67

[11:42] Team_025 possession (Score: 82-67)
Desmond Jordan drives to the basket... Desmond Jordan throws a bad pass out of bounds! TURNOVER! (dead ball)

[11:42] Substitution (Team_062): Chris Bird OUT → Paolo McCollum IN (stamina_rule2)

[11:42] Substitution (Team_062): RJ Williamson OUT → Tony LaVine IN (stamina_rule2)

[11:42] Substitution (Team_062): Michael Hyland OUT → Paul Poole IN (stamina_rule2)

[11:42] Substitution (Team_062): Kawhi Thompson OUT → RJ Wall IN (stamina_rule2)

[11:42] Substitution (Team_062): Jalen Reaves OUT → Devin Young IN (stamina_rule2)

[11:42] Substitution (Team_025): Paolo Lowry OUT → LeBron Griffin IN (stamina_rule2)

[11:42] Substitution (Team_025): Ben Giddey OUT → Dirk Gilgeous-Alexander IN (stamina_rule2)

[11:42] Substitution (Team_025): Desmond Jordan OUT → Immanuel LaVine IN (stamina_rule2)

[11:42] Substitution (Team_025): Allen Embiid OUT → Nikola Lillard IN (stamina_rule2)

[11:25] Team_062 possession (Score: 82-67)
Tony LaVine attempts a 3Pt. Contested by Dirk Gilgeous-Alexander (6.0 feet, MAN). TONY LAVINE MAKES IT! Assist: Paul Poole
Score: 85-67

[11:13] Team_025 possession (Score: 85-67)
Cade Anthony attempts a 3Pt. Wide open! Paolo McCollum is 6.2 feet away. [ZONE] Cade Anthony misses. Offensive rebound by Cade Anthony! Cade Anthony kicks it out.

[10:59] Team_025 possession (Score: 85-67)
LeBron Griffin drives and kicks out. Cade Anthony attempts a 3Pt. Contested by RJ Wall (5.2 feet, MAN). CADE ANTHONY MAKES IT! Assist: Dirk Gilgeous-Alexander
Score: 85-70

[10:44] Team_062 possession (Score: 85-70)
Paul Poole attempts a Layup. Contested by Cade Anthony (4.6 feet, ZONE). Paul Poole misses. Rebound secured by Cade Anthony.

[10:33] Team_025 possession (Score: 85-70)
Nikola Lillard attempts a Layup. BLOCKED BY RJ WALL! Ball is loose! Offensive rebound by Cade Anthony! Cade Anthony kicks it out.

[10:18] Team_025 possession (Score: 85-70)
Nikola Lillard attempts a Midrange. Wide open! Devin Young is 6.2 feet away. [MAN] Nikola Lillard misses. Rebound secured by Devin Young.

[10:00] Team_062 possession (Score: 85-70)
Tony LaVine attempts a Layup. Contested by Cade Anthony (5.0 feet, ZONE). Tony LaVine misses. Rebound secured by Immanuel LaVine.

[09:44] Team_025 possession (Score: 85-70)
Dirk Gilgeous-Alexander attempts a Layup. Wide open! Tony LaVine is 6.1 feet away. [MAN] Dirk Gilgeous-Alexander misses. Offensive rebound by Cade Anthony! Cade Anthony kicks it out.

[09:29] Team_025 possession (Score: 85-70)
Immanuel LaVine attempts a 3Pt. Contested by Paolo McCollum (5.7 feet, ZONE). Immanuel LaVine misses. Rebound secured by Devin Young.

[09:18] Team_062 possession (Score: 85-70)
Devin Young drives and kicks out. Devin Young attempts a 3Pt. Contested by LeBron Griffin (4.7 feet, ZONE). DEVIN YOUNG MAKES IT! Assist: Tony LaVine
Score: 88-70

[09:05] Team_025 possession (Score: 88-70)
FOUL! Holding foul on Paolo McCollum. [Team fouls: 1] No free throws, side out. (Paolo McCollum: 1 personal fouls)

[08:49] Team_025 possession (Score: 88-70)
Immanuel LaVine loses the ball! Stripped by Paul Poole! TURNOVER! (live ball)

[08:36] Team_062 possession (Score: 88-70)
Tony LaVine attempts a 3Pt. Contested by LeBron Griffin (5.0 feet, ZONE). Tony LaVine misses. Rebound secured by Cade Anthony.

[08:22] Team_025 possession (Score: 88-70)
Dirk Gilgeous-Alexander attempts a 3Pt. Wide open! Tony LaVine is 6.1 feet away. [MAN] Dirk Gilgeous-Alexander misses. FOUL! Loose ball foul on Paul Poole during the rebound battle. [Team fouls: 2] No free throws, side out. (Paul Poole: 1 personal fouls)

[08:09] Team_025 possession (Score: 88-70)
Nikola Lillard drives, Devin Young stays with him. Nikola Lillard attempts a Dunk. Wide open! Devin Young is 6.2 feet away. [MAN] NIKOLA LILLARD MAKES IT! Assist: Immanuel LaVine
Score: 88-72

[07:56] Team_062 possession (Score: 88-72)
FOUL! Reach-in foul on Nikola Lillard during the drive. [Team fouls: 1] No free throws, side out. (Nikola Lillard: 1 personal fouls)

[07:43] Team_062 possession (Score: 88-72)
FOUL! Reach-in foul on Cade Anthony during the drive. [Team fouls: 2] No free throws, side out. (Cade Anthony: 1 personal fouls)

[07:31] Team_062 possession (Score: 88-72)
Paolo McCollum attempts a 3Pt. Contested by LeBron Griffin (4.9 feet, MAN). Paolo McCollum misses. Offensive rebound by Devin Young! Devin Young kicks it out.

[07:21] Team_062 possession (Score: 88-72)
RJ Wall attempts a 3Pt. Contested by Cade Anthony (4.9 feet, MAN). RJ Wall misses. Offensive rebound by Devin Young! Devin Young kicks it out.

[07:07] Team_062 possession (Score: 88-72)
RJ Wall drives, picks up Cade Anthony. Help arrives from LeBron Griffin! RJ Wall attempts a Dunk. Contested by LeBron Griffin (5.0 feet, MAN). RJ WALL MAKES IT! Assist: Paolo McCollum
Score: 90-72

[06:53] Team_025 possession (Score: 90-72)
Nikola Lillard attempts a 3Pt. Contested by Paolo McCollum (5.7 feet, ZONE). Nikola Lillard misses. Rebound secured by Paul Poole.

[06:36] Team_062 possession (Score: 90-72)
RJ Wall attempts a Midrange. Contested by Cade Anthony (5.0 feet, ZONE). RJ Wall misses. Rebound secured by Nikola Lillard.

[06:21] Team_025 possession (Score: 90-72)
Nikola Lillard attempts a Midrange. Wide open! Devin Young is 6.2 feet away. [MAN] Nikola Lillard misses. Offensive rebound by Nikola Lillard! Nikola Lillard kicks it out.

[06:03] Team_025 possession (Score: 90-72)
Immanuel LaVine drives, Paul Poole stays with him. Immanuel LaVine attempts a Layup. Wide open! Paul Poole is 6.4 feet away. [MAN] Immanuel LaVine misses. Rebound secured by Paul Poole.

[05:44] Team_062 possession (Score: 90-72)
Paul Poole attempts a Midrange. Contested by Nikola Lillard (4.5 feet, ZONE). Paul Poole misses. Rebound secured by Nikola Lillard.

[05:34] Team_025 possession (Score: 90-72)
Dirk Gilgeous-Alexander attempts a 3Pt. Contested by Paolo McCollum (5.7 feet, ZONE). DIRK GILGEOUS-ALEXANDER MAKES IT! Assist: Immanuel LaVine
Score: 90-75

[05:22] Team_062 possession (Score: 90-75)
FOUL! Reach-in foul on LeBron Griffin during the drive. [Team fouls: 3] No free throws, side out. (LeBron Griffin: 1 personal fouls)

[05:04] Team_062 possession (Score: 90-75)
FOUL! Shooting foul on Dirk Gilgeous-Alexander. Tony LaVine to the line for 2 free throws. [Team fouls: 4] (Dirk Gilgeous-Alexander: 1 personal fouls)   FT 1/2: GOOD   FT 2/2: GOOD Tony LaVine makes 2/2 from the line.
Score: 92-75

[04:51] Team_025 possession (Score: 92-75)
Nikola Lillard drives to the basket... Nikola Lillard throws a bad pass out of bounds! TURNOVER! (dead ball)

[04:51] Substitution (Team_025): Cade Anthony OUT → Damian Adebayo IN (stamina_rule2)

[04:39] Team_062 possession (Score: 92-75)
RJ Wall throws a bad pass! Stolen by Damian Adebayo! TURNOVER! (live ball)

[04:25] Team_025 possession (Score: 92-75)
FOUL! Shooting foul on Paolo McCollum. LeBron Griffin to the line for 2 free throws. [Team fouls: 3] (Paolo McCollum: 2 personal fouls)   FT 1/2: GOOD   FT 2/2: GOOD LeBron Griffin makes 2/2 from the line.
Score: 92-77

[04:09] Team_062 possession (Score: 92-77)
Devin Young drives to the basket... Devin Young throws a bad pass! Stolen by Nikola Lillard! TURNOVER! (live ball)

[03:57] Team_025 possession (Score: 92-77)
FOUL! Reach-in foul on Tony LaVine during the drive. [Team fouls: 4] No free throws, side out. (Tony LaVine: 1 personal fouls)

[03:41] Team_025 possession (Score: 92-77)
Damian Adebayo attempts a Midrange. Contested by Tony LaVine (6.0 feet, ZONE). Damian Adebayo misses. Rebound secured by Paul Poole.

[03:26] Team_062 possession (Score: 92-77)
RJ Wall attempts a Midrange. Contested by Damian Adebayo (4.8 feet, MAN). RJ Wall misses. Rebound secured by Nikola Lillard.

[03:11] Team_025 possession (Score: 92-77)
Damian Adebayo attempts a 3Pt. Contested by RJ Wall (5.3 feet, MAN). DAMIAN ADEBAYO MAKES IT! Assist: Dirk Gilgeous-Alexander
Score: 92-80

[02:52] Team_062 possession (Score: 92-80)
Paolo McCollum attempts a 3Pt. Contested by LeBron Griffin (5.0 feet, MAN). Paolo McCollum misses. Rebound secured by Immanuel LaVine.

[02:41] Team_025 possession (Score: 92-80)
Dirk Gilgeous-Alexander attempts a Layup. BLOCKED BY RJ WALL! Ball is loose! Rebound secured by Paul Poole.

[02:27] Team_062 possession (Score: 92-80)
Paolo McCollum attempts a 3Pt. Contested by LeBron Griffin (5.1 feet, MAN). Paolo McCollum misses. Rebound secured by Nikola Lillard.

[02:12] Team_025 possession (Score: 92-80)
Immanuel LaVine makes the Layup and draws the foul on RJ Wall! And-1! Immanuel LaVine to the line for 1. [BONUS: 5 team fouls] (RJ Wall: 1 personal fouls)   FT 1/1: GOOD Immanuel LaVine makes 1/1 from the line.
Score: 92-83

[01:54] Team_062 possession (Score: 92-83)
Tony LaVine drives to the basket... FOUL! Offensive foul on Tony LaVine! Damian Adebayo drew the charge! [Team fouls: 6] (Tony LaVine: 2 personal fouls) TURNOVER! (dead ball)

[01:36] Team_025 possession (Score: 92-83)
Damian Adebayo attempts a 3Pt. Contested by Paolo McCollum (5.8 feet, ZONE). Damian Adebayo misses. Rebound secured by RJ Wall.

[01:24] Team_062 possession (Score: 92-83)
Devin Young attempts a Midrange. Contested by Nikola Lillard (5.1 feet, MAN). Devin Young misses. Rebound secured by Dirk Gilgeous-Alexander.

[01:08] Team_025 possession (Score: 92-83)
FOUL! Shooting foul on RJ Wall. Damian Adebayo to the line for 2 free throws. [BONUS: 7 team fouls] (RJ Wall: 2 personal fouls)   FT 1/2: GOOD   FT 2/2: GOOD Damian Adebayo makes 2/2 from the line.
Score: 92-85

[00:51] Team_062 possession (Score: 92-85)
RJ Wall drives and kicks out. Devin Young attempts a 3Pt. Contested by LeBron Griffin (5.1 feet, ZONE). Devin Young misses. Rebound secured by Nikola Lillard.

[00:37] Team_025 possession (Score: 92-85)
Immanuel LaVine attempts a Layup. Wide open! Devin Young is 6.6 feet away. [ZONE] Immanuel LaVine misses. Rebound secured by RJ Wall.

[00:19] Team_062 possession (Score: 92-85)
FOUL! Offensive foul on Paul Poole! Immanuel LaVine drew the charge! [Team fouls: 8] (Paul Poole: 2 personal fouls) TURNOVER! (dead ball)

[00:08] Team_025 possession (Score: 92-85)
FOUL! Shooting foul on RJ Wall. Damian Adebayo to the line for 2 free throws. [BONUS: 9 team fouls] (RJ Wall: 3 personal fouls)   FT 1/2: GOOD   FT 2/2: GOOD Damian Adebayo makes 2/2 from the line.
Score: 92-87

================================================================================
                              4TH QUARTER COMPLETE                              
================================================================================

4TH QUARTER SCORE: Team_062 12, Team_025 20

BOX SCORE:
================================================================================

Team_062
--------------------------------------------------------------------------------
Player                MIN  PTS  REB  AST  TO      FG   FG%      3P   3P%
--------------------------------------------------------------------------------
Tony LaVine            12    5    0    1   0   2/4    50.0     0/0   0.0
Devin Young            12    3    4    0   0   1/2    50.0     0/0   0.0
Jalen Reaves           36    2    0    0   0   1/1   100.0     0/0   0.0
RJ Wall                12    2    2    0   0   1/4    25.0     0/0   0.0
Michael Hyland         36    0    0    1   0   0/0     0.0     0/0   0.0
Paul Poole             12    0    4    1   0   0/2     0.0     0/0   0.0
Paolo McCollum         12    0    0    1   0   0/2     0.0     0/0   0.0

TEAM: FG: 5/15 (33.3%), 3PT: 1/4 (25.0%), REB: 10 (2 off, 8 def), AST: 4, TO: 4
TEAM FOULS: 9 [Team_025 in BONUS]


Team_025
--------------------------------------------------------------------------------
Player                MIN  PTS  REB  AST  TO      FG   FG%      3P   3P%
--------------------------------------------------------------------------------
Damian Adebayo          5    7    0    0   0   3/5    60.0     0/0   0.0
Cade Anthony           43    3    5    0   0   1/1   100.0     0/0   0.0
Dirk Gilgeous-Alexander   12    3    1    2   0   1/2    50.0     0/0   0.0
Immanuel LaVine        12    3    3    2   0   1/4    25.0     0/0   0.0
Nikola Lillard         12    2    6    0   0   1/3    33.3     0/0   0.0
LeBron Griffin         12    2    0    0   0   1/1   100.0     0/0   0.0

TEAM: FG: 8/16 (50.0%), 3PT: 2/5 (40.0%), REB: 15 (5 off, 10 def), AST: 4, TO: 3
TEAM FOULS: 4

================================================================================

================================================================================
                               FULL GAME COMPLETE                               
================================================================================

FINAL SCORE: Team_062 92, Team_025 87

SCORING BY QUARTER:
--------------------------------------------------------------------------------
Team                     Q1     Q2     Q3     Q4    FINAL
--------------------------------------------------------------------------------
Team_062                 32     22     26     12       92
Team_025                 22     17     28     20       87
--------------------------------------------------------------------------------

FULL GAME BOX SCORE:
================================================================================

Team_062
--------------------------------------------------------------------------------
Player                MIN  PTS  REB  AST  TO      FG   FG%      3P   3P%      FT STL BLK
--------------------------------------------------------------------------------
Chris Bird             36   10    0    2   3   5/11   45.5   0/2     0.0   2/4     1   1
RJ Williamson          36   10    0    4   1   4/7    57.1   2/2   100.0   0/0     0   0
Michael Hyland         36   10    9    3   2   4/10   40.0   2/6    33.3   2/4     0   0
Kawhi Thompson         36   20   18    1   1   8/12   66.7   1/5    20.0   6/8     0   0
Jalen Reaves           36   30   15    4   4  12/17   70.6   0/1     0.0   7/7     0   1
Paolo McCollum         12    0    0    1   0   0/2     0.0   0/2     0.0   0/0     0   0
Tony LaVine            12    5    0    1   1   2/4    50.0   1/2    50.0   2/2     0   0
Paul Poole             12    0    5    1   1   0/2     0.0   0/0     0.0   0/0     1   0
RJ Wall                12    2    2    0   2   1/4    25.0   0/0     0.0   0/0     0   2
Devin Young            12    3    4    0   0   1/2    50.0   0/0     0.0   0/0     0   0

TEAM: FG: 37/71 (52.1%), 3PT: 6/20 (30.0%), REB: 52 (11 off, 41 def), AST: 17, TO: 15


Team_025
--------------------------------------------------------------------------------
Player                MIN  PTS  REB  AST  TO      FG   FG%      3P   3P%      FT STL BLK
--------------------------------------------------------------------------------
Cade Anthony           43    9    6    2   0   5/11   45.5   1/4    25.0   0/0     0   1
Paolo Lowry            36   18    0    3   1  10/14   71.4   1/1   100.0   4/4     1   0
Ben Giddey             36   18    0    5   2   7/11   63.6   2/3    66.7   3/3     0   1
Desmond Jordan         36   11    8    1   0   3/14   21.4   2/9    22.2   0/0     0   0
Allen Embiid           36   14   17    3   0   5/13   38.5   0/1     0.0   2/2     4   1
LeBron Griffin         12    2    0    0   0   2/2   100.0   0/0     0.0   2/2     0   0
Dirk Gilgeous-Alexander   12    3    1    2   0   1/2    50.0   1/1   100.0   0/0     0   0
Immanuel LaVine        12    3    4    2   1   1/5    20.0   0/1     0.0   1/1     0   0
Nikola Lillard         12    2    6    0   1   1/3    33.3   0/1     0.0   0/0     1   0
Damian Adebayo          5    7    0    0   0   3/5    60.0   1/2    50.0   4/4     1   0

TEAM: FG: 38/80 (47.5%), 3PT: 8/23 (34.8%), REB: 43 (10 off, 33 def), AST: 18, TO: 5

================================================================================
