================================================================================
                        FULL GAME - Team_058 vs Team_010                        
================================================================================

================================================================================
                       1ST QUARTER - Team_058 vs Team_010                       
================================================================================

[12:00] Team_058 possession (Score: 0-0)
Kyle Westbrook drives and kicks out. Bradley Sexton attempts a Midrange. Contested by Cade Morant (3.9 feet, MAN). Bradley Sexton misses. Rebound secured by Cade Morant.

[11:47] Team_010 possession (Score: 0-0)
Michael Turner attempts a Midrange. Contested by Vince Hyland (4.8 feet, ZONE). Michael Turner misses. Offensive rebound by Cade Morant! Cade Morant kicks it out.

[11:33] Team_010 possession (Score: 0-0)
Desmond Antetokounmpo drives to the basket... Desmond Antetokounmpo commits a violation (traveling/carry)! TURNOVER! (dead ball)

[11:19] Team_058 possession (Score: 0-0)
Bradley Sexton attempts a 3Pt. Contested by Cade Morant (4.2 feet, ZONE). Bradley Sexton misses. Rebound secured by Anthony Durant.

[11:05] Team_010 possession (Score: 0-0)
Cade Morant drives, Stephen Haliburton stays with him. Cade Morant attempts a Dunk. Contested by Stephen Haliburton (3.9 feet, ZONE). CADE MORANT MAKES IT! Assist: Anthony Durant
Score: 0-2

[10:47] Team_058 possession (Score: 0-2)
Vince Hyland attempts a 3Pt. Contested by Cade Morant (4.2 feet, ZONE). Vince Hyland misses. FOUL! Loose ball foul on Anthony Durant during the rebound battle. [Team fouls: 1] No free throws, side out. (Anthony Durant: 1 personal fouls)

[10:35] Team_058 possession (Score: 0-2)
FOUL! Shooting foul on Anthony Durant. Stephen Haliburton to the line for 2 free throws. [Team fouls: 2] (Anthony Durant: 2 personal fouls)   FT 1/2: MISS   FT 2/2: GOOD Stephen Haliburton makes 1/2 from the line.
Score: 1-2

[10:19] Team_010 possession (Score: 1-2)
Desmond Antetokounmpo drives to the basket... Desmond Antetokounmpo commits a violation (traveling/carry)! TURNOVER! (dead ball)

[10:04] Team_058 possession (Score: 1-2)
Tyrese Doncic makes the Layup and draws the foul on Anthony Durant! And-1! Tyrese Doncic to the line for 1. [Team fouls: 3] (Anthony Durant: 3 personal fouls)   FT 1/1: GOOD Tyrese Doncic makes 1/1 from the line.
Score: 4-2

[09:50] Team_010 possession (Score: 4-2)
Cade Morant drives, Bradley Sexton stays with him. Cade Morant attempts a Layup. Contested by Bradley Sexton (3.5 feet, MAN). CADE MORANT MAKES IT! Assist: Michael Turner
Score: 4-4

[09:37] Team_058 possession (Score: 4-4)
Tyrese Doncic attempts a Midrange. Contested by Anthony Durant (3.5 feet, MAN). Tyrese Doncic misses. Rebound secured by Desmond Antetokounmpo.

[09:23] Team_010 possession (Score: 4-4)
Desmond Antetokounmpo attempts a 3Pt. Contested by Bradley Sexton (3.2 feet, ZONE). Desmond Antetokounmpo misses. Offensive rebound by Cade Morant! Cade Morant kicks it out.

[09:06] Team_010 possession (Score: 4-4)
Desmond Antetokounmpo attempts a Layup. BLOCKED BY STEPHEN HALIBURTON! Ball is loose! Rebound secured by Bradley Sexton.

[08:53] Team_058 possession (Score: 4-4)
Kyle Westbrook attempts a 3Pt. Contested by Michael Turner (4.2 feet, MAN). Kyle Westbrook misses. Rebound secured by Anthony Durant.

[08:35] Team_010 possession (Score: 4-4)
Desmond Antetokounmpo makes the Midrange and draws the foul on Kyle Westbrook! And-1! Desmond Antetokounmpo to the line for 1. [Team fouls: 1] (Kyle Westbrook: 1 personal fouls)   FT 1/1: GOOD Desmond Antetokounmpo makes 1/1 from the line.
Score: 4-7

[08:20] Team_058 possession (Score: 4-7)
Kyle Westbrook attempts a Layup. BLOCKED BY ANTHONY DURANT! Ball is loose! Rebound secured by Desmond Antetokounmpo.

[08:06] Team_010 possession (Score: 4-7)
Cade Morant attempts a 3Pt. Contested by Bradley Sexton (3.5 feet, ZONE). CADE MORANT MAKES IT! Assist: Anthony Durant
Score: 4-10

[07:52] Team_058 possession (Score: 4-10)
Bradley Sexton drives, Anthony Durant stays with him. Bradley Sexton attempts a Dunk. Contested by Anthony Durant (3.8 feet, ZONE). BRADLEY SEXTON MAKES IT! Assist: Vince Hyland
Score: 6-10

[07:32] Team_010 possession (Score: 6-10)
Michael Turner drives and kicks out. RJ Young attempts a Midrange. Contested by Vince Hyland (4.5 feet, MAN). RJ Young misses. Offensive rebound by Cade Morant! Cade Morant kicks it out.

[07:16] Team_010 possession (Score: 6-10)
FOUL! Shooting foul on Bradley Sexton. Michael Turner to the line for 3 free throws. [Team fouls: 2] (Bradley Sexton: 1 personal fouls)   FT 1/3: GOOD   FT 2/3: GOOD   FT 3/3: GOOD Michael Turner makes 3/3 from the line.
Score: 6-13

[07:06] Team_058 possession (Score: 6-13)
Tyrese Doncic makes the Midrange and draws the foul on Anthony Durant! And-1! Tyrese Doncic to the line for 1. [Team fouls: 4] (Anthony Durant: 4 personal fouls)   FT 1/1: MISS Tyrese Doncic makes 0/1 from the line. Rebound secured by Cade Morant.
Score: 8-13

[06:48] Team_010 possession (Score: 8-13)
Anthony Durant drives to the basket... Anthony Durant loses control! Ball rolls out of bounds! TURNOVER! (dead ball)

[06:32] Team_058 possession (Score: 8-13)
Tyrese Doncic attempts a Midrange. Contested by Desmond Antetokounmpo (4.3 feet, ZONE). Tyrese Doncic misses. Rebound secured by Anthony Durant.

[06:19] Team_010 possession (Score: 8-13)
Cade Morant drives, picks up Stephen Haliburton. Help arrives from Bradley Sexton! Cade Morant attempts a Dunk. Contested by Bradley Sexton (3.9 feet, ZONE). CADE MORANT MAKES IT! Assist: Michael Turner
Score: 8-15

[06:07] Team_058 possession (Score: 8-15)
FOUL! Holding foul on Anthony Durant. [IN THE BONUS! 5 team fouls] Tyrese Doncic to the line for 2 free throws. (Anthony Durant: 5 personal fouls)   FT 1/2: GOOD   FT 2/2: GOOD Tyrese Doncic makes 2/2 from the line.
Score: 10-15

[05:51] Team_010 possession (Score: 10-15)
FOUL! Shooting foul on Tyrese Doncic. Anthony Durant to the line for 2 free throws. [Team fouls: 3] (Tyrese Doncic: 1 personal fouls)   FT 1/2: GOOD   FT 2/2: GOOD Anthony Durant makes 2/2 from the line.
Score: 10-17

[05:33] Team_058 possession (Score: 10-17)
Tyrese Doncic drives and kicks out. Kyle Westbrook attempts a 3Pt. Contested by Michael Turner (4.0 feet, MAN). KYLE WESTBROOK MAKES IT! Assist: Stephen Haliburton
Score: 13-17

[05:19] Team_010 possession (Score: 13-17)
Desmond Antetokounmpo attempts a 3Pt. Contested by Bradley Sexton (3.2 feet, ZONE). DESMOND ANTETOKOUNMPO MAKES IT! Assist: Michael Turner
Score: 13-20

[05:05] Team_058 possession (Score: 13-20)
Tyrese Doncic attempts a Midrange. Contested by Michael Turner (4.0 feet, ZONE). Tyrese Doncic misses. Rebound secured by Cade Morant.

[04:50] Team_010 possession (Score: 13-20)
Desmond Antetokounmpo drives to the basket... Desmond Antetokounmpo loses control! Ball rolls out of bounds! TURNOVER! (dead ball)

[04:35] Team_058 possession (Score: 13-20)
Kyle Westbrook attempts a 3Pt. Contested by Cade Morant (4.1 feet, ZONE). Kyle Westbrook misses. Rebound secured by Michael Turner.

[04:21] Team_010 possession (Score: 13-20)
Cade Morant attempts a Midrange. Contested by Bradley Sexton (3.6 feet, MAN). CADE MORANT MAKES IT! Assist: RJ Young
Score: 13-22

[04:06] Team_058 possession (Score: 13-22)
Vince Hyland drives, picks up RJ Young. Help arrives from Cade Morant! Vince Hyland attempts a Layup. Contested by Cade Morant (5.1 feet, MAN). VINCE HYLAND MAKES IT! Assist: Bradley Sexton
Score: 15-22

[03:51] Team_010 possession (Score: 15-22)
Desmond Antetokounmpo attempts a 3Pt. Contested by Bradley Sexton (3.3 feet, ZONE). Desmond Antetokounmpo misses. Rebound secured by Bradley Sexton.

[03:31] Team_058 possession (Score: 15-22)
FOUL! Reach-in foul on Michael Turner during the drive. [IN THE BONUS! 6 team fouls] Kyle Westbrook to the line for 2 free throws. (Michael Turner: 1 personal fouls)   FT 1/2: GOOD   FT 2/2: GOOD Kyle Westbrook makes 2/2 from the line.
Score: 17-22

[03:13] Team_010 possession (Score: 17-22)
Desmond Antetokounmpo drives to the basket... Desmond Antetokounmpo loses the ball! Stripped by Stephen Haliburton! TURNOVER! (live ball)

[02:59] Team_058 possession (Score: 17-22)
Tyrese Doncic makes the Layup and draws the foul on Anthony Durant! And-1! Tyrese Doncic to the line for 1. [BONUS: 7 team fouls] (Anthony Durant: 6 personal fouls) Anthony Durant FOULS OUT!   FT 1/1: GOOD Tyrese Doncic makes 1/1 from the line.
Score: 20-22

[02:59] Substitution (Team_010): Anthony Durant OUT (stamina: 72) → Draymond Leonard IN (foul_out)

[02:44] Team_010 possession (Score: 20-22)
Cade Morant attempts a Midrange. Contested by Vince Hyland (5.1 feet, ZONE). CADE MORANT MAKES IT! Assist: Michael Turner
Score: 20-24

[02:29] Team_058 possession (Score: 20-24)
Kyle Westbrook attempts a 3Pt. Contested by Draymond Leonard (4.5 feet, ZONE). Kyle Westbrook misses. Rebound secured by Cade Morant.

[02:17] Team_010 possession (Score: 20-24)
Desmond Antetokounmpo makes the Dunk and draws the foul on Bradley Sexton! And-1! Desmond Antetokounmpo to the line for 1. [Team fouls: 4] (Bradley Sexton: 2 personal fouls)   FT 1/1: MISS Desmond Antetokounmpo makes 0/1 from the line. Rebound secured by Bradley Sexton.
Score: 20-26

[02:02] Team_058 possession (Score: 20-26)
Vince Hyland makes the Layup and draws the foul on Cade Morant! And-1! Vince Hyland to the line for 1. [BONUS: 8 team fouls] (Cade Morant: 1 personal fouls)   FT 1/1: GOOD Vince Hyland makes 1/1 from the line.
Score: 23-26

[01:45] Team_010 possession (Score: 23-26)
RJ Young attempts a 3Pt. Contested by Bradley Sexton (3.1 feet, ZONE). RJ YOUNG MAKES IT! Assist: Draymond Leonard
Score: 23-29

[01:31] Team_058 possession (Score: 23-29)
Vince Hyland drives, picks up Desmond Antetokounmpo. Help arrives from Cade Morant! Vince Hyland attempts a Layup. Contested by Cade Morant (4.9 feet, ZONE). Vince Hyland misses. Rebound secured by Desmond Antetokounmpo.

[01:18] Team_010 possession (Score: 23-29)
Michael Turner attempts a 3Pt. Contested by Kyle Westbrook (4.7 feet, MAN). Michael Turner misses. Rebound secured by Stephen Haliburton.

[01:07] Team_058 possession (Score: 23-29)
Vince Hyland attempts a Midrange. Contested by Cade Morant (4.6 feet, ZONE). Vince Hyland misses. Offensive rebound by Tyrese Doncic! Tyrese Doncic kicks it out.

[00:53] Team_058 possession (Score: 23-29)
Vince Hyland attempts a Layup. Contested by RJ Young (5.4 feet, MAN). VINCE HYLAND MAKES IT! Assist: Tyrese Doncic
Score: 25-29

[00:41] Team_010 possession (Score: 25-29)
RJ Young attempts a 3Pt. Contested by Vince Hyland (4.7 feet, ZONE). RJ Young misses. Offensive rebound by Michael Turner! Michael Turner kicks it out.

[00:30] Team_010 possession (Score: 25-29)
Draymond Leonard attempts a Layup. Contested by Bradley Sexton (3.9 feet, MAN). Draymond Leonard misses. Rebound secured by Bradley Sexton.

[00:16] Team_058 possession (Score: 25-29)
FOUL! Holding foul on Michael Turner. [IN THE BONUS! 9 team fouls] Kyle Westbrook to the line for 2 free throws. (Michael Turner: 2 personal fouls)   FT 1/2: GOOD   FT 2/2: GOOD Kyle Westbrook makes 2/2 from the line.
Score: 27-29

[00:01] Team_010 possession (Score: 27-29)
Draymond Leonard attempts a Midrange. Contested by Stephen Haliburton (4.5 feet, ZONE). Draymond Leonard misses. Rebound secured by Bradley Sexton.

================================================================================
                              1ST QUARTER COMPLETE                              
================================================================================

1ST QUARTER SCORE: Team_058 27, Team_010 29

BOX SCORE:
================================================================================

Team_058
--------------------------------------------------------------------------------
Player                MIN  PTS  REB  AST  TO      FG   FG%      3P   3P%
--------------------------------------------------------------------------------
Tyrese Doncic          12    8    2    1   0   3/7    42.9     0/0   0.0
Kyle Westbrook         12    7    0    0   0   3/8    37.5     0/0   0.0
Vince Hyland           12    7    0    1   0   3/4    75.0     0/0   0.0
Bradley Sexton         12    2    5    1   0   1/2    50.0     0/0   0.0
Stephen Haliburton     12    1    1    1   0   1/1   100.0     0/0   0.0

TEAM: FG: 11/22 (50.0%), 3PT: 0/4 (0.0%), REB: 8 (2 off, 6 def), AST: 4, TO: 0
TEAM FOULS: 4


Team_010
--------------------------------------------------------------------------------
Player                MIN  PTS  REB  AST  TO      FG   FG%      3P   3P%
--------------------------------------------------------------------------------
Cade Morant            12   13    7    0   0   6/6   100.0     0/0   0.0
Desmond Antetokounmpo   12    6    3    0   0   2/5    40.0     0/0   0.0
Michael Turner         12    3    2    4   0   1/2    50.0     0/0   0.0
RJ Young               12    3    0    1   0   1/1   100.0     0/0   0.0
Anthony Durant          9    2    3    2   0   1/1   100.0     0/0   0.0
Draymond Leonard        3    0    0    1   0   0/2     0.0     0/0   0.0

TEAM: FG: 11/17 (64.7%), 3PT: 4/6 (66.7%), REB: 15 (4 off, 11 def), AST: 8, TO: 5
TEAM FOULS: 9 [Team_058 in BONUS]

================================================================================

================================================================================
                       2ND QUARTER - Team_058 vs Team_010                       
================================================================================

[12:00] Team_058 possession (Score: 27-29)
Bradley Sexton attempts a 3Pt. Contested by Cade Morant (4.5 feet, ZONE). BRADLEY SEXTON MAKES IT! Assist: Vince Hyland
Score: 30-29

[11:44] Team_010 possession (Score: 30-29)
Desmond Antetokounmpo attempts a Midrange. Contested by Stephen Haliburton (4.0 feet, ZONE). Desmond Antetokounmpo misses. Rebound secured by Tyrese Doncic.

[11:28] Team_058 possession (Score: 30-29)
Bradley Sexton attempts a 3Pt. Contested by Cade Morant (4.6 feet, ZONE). Bradley Sexton misses. Rebound secured by Michael Turner.

[11:18] Team_010 possession (Score: 30-29)
Michael Turner attempts a Midrange. Contested by Kyle Westbrook (4.7 feet, ZONE). MICHAEL TURNER MAKES IT!
Score: 30-31

[11:04] Team_058 possession (Score: 30-31)
Kyle Westbrook attempts a Midrange. Contested by Michael Turner (4.5 feet, ZONE). Kyle Westbrook misses. Rebound secured by Cade Morant.

[10:54] Team_010 possession (Score: 30-31)
FOUL! Reach-in foul on Bradley Sexton during the drive. [Team fouls: 1] No free throws, side out. (Bradley Sexton: 1 personal fouls)

[10:38] Team_010 possession (Score: 30-31)
Desmond Antetokounmpo attempts a 3Pt. Contested by Bradley Sexton (3.6 feet, ZONE). Desmond Antetokounmpo misses. Rebound secured by Stephen Haliburton.

[10:26] Team_058 possession (Score: 30-31)
Vince Hyland attempts a 3Pt. Contested by RJ Young (5.5 feet, MAN). VINCE HYLAND MAKES IT! Assist: Kyle Westbrook
Score: 33-31

[10:10] Team_010 possession (Score: 33-31)
RJ Young attempts a Layup. BLOCKED BY VINCE HYLAND! Ball is loose! Offensive rebound by Cade Morant! Cade Morant kicks it out.

[09:54] Team_010 possession (Score: 33-31)
Michael Turner makes the Layup and draws the foul on Stephen Haliburton! And-1! Michael Turner to the line for 1. [Team fouls: 2] (Stephen Haliburton: 1 personal fouls)   FT 1/1: GOOD Michael Turner makes 1/1 from the line.
Score: 33-34

[09:35] Team_058 possession (Score: 33-34)
Stephen Haliburton attempts a Layup. Contested by Anthony Durant (3.7 feet, MAN). Stephen Haliburton misses. Offensive rebound by Stephen Haliburton! Stephen Haliburton puts it back in!
Score: 35-34

[09:20] Team_010 possession (Score: 35-34)
Michael Turner attempts a Layup. BLOCKED BY KYLE WESTBROOK! Ball goes out off Kyle Westbrook. Michael Turner's ball!

[09:04] Team_010 possession (Score: 35-34)
FOUL! Shooting foul on Tyrese Doncic. Anthony Durant to the line for 2 free throws. [Team fouls: 3] (Tyrese Doncic: 1 personal fouls)   FT 1/2: GOOD   FT 2/2: MISS Anthony Durant makes 1/2 from the line. Rebound secured by Vince Hyland.
Score: 35-35

[08:50] Team_058 possession (Score: 35-35)
Kyle Westbrook attempts a 3Pt. Contested by RJ Young (5.4 feet, ZONE). Kyle Westbrook misses. Offensive rebound by Stephen Haliburton! Stephen Haliburton's putback is no good. Rebound secured by Anthony Durant.

[08:36] Team_010 possession (Score: 35-35)
Desmond Antetokounmpo drives to the basket... FOUL! Offensive foul on Desmond Antetokounmpo! Stephen Haliburton drew the charge! [Team fouls: 1] (Desmond Antetokounmpo: 1 personal fouls) TURNOVER! (dead ball)

[08:20] Team_058 possession (Score: 35-35)
Bradley Sexton attempts a 3Pt. Contested by Cade Morant (5.0 feet, ZONE). Bradley Sexton misses. Rebound secured by Michael Turner.

[08:02] Team_010 possession (Score: 35-35)
Cade Morant attempts a 3Pt. Contested by Bradley Sexton (4.3 feet, ZONE). Cade Morant misses. Rebound secured by Tyrese Doncic.

[07:44] Team_058 possession (Score: 35-35)
Bradley Sexton attempts a 3Pt. Contested by Cade Morant (5.0 feet, ZONE). Bradley Sexton misses. Rebound secured by Anthony Durant.

[07:32] Team_010 possession (Score: 35-35)
Michael Turner drives and kicks out. Cade Morant attempts a Midrange. Contested by Stephen Haliburton (4.5 feet, ZONE). CADE MORANT MAKES IT! Assist: Desmond Antetokounmpo
Score: 35-37

[07:15] Team_058 possession (Score: 35-37)
Kyle Westbrook attempts a Midrange. Contested by Michael Turner (4.9 feet, MAN). Kyle Westbrook misses. Rebound secured by Anthony Durant.

[07:00] Team_010 possession (Score: 35-37)
Cade Morant attempts a 3Pt. Contested by Bradley Sexton (4.4 feet, MAN). Cade Morant misses. Rebound secured by Vince Hyland.

[06:45] Team_058 possession (Score: 35-37)
Tyrese Doncic attempts a Layup. Contested by Anthony Durant (3.9 feet, ZONE). Tyrese Doncic misses. Rebound secured by Anthony Durant.

[06:31] Team_010 possession (Score: 35-37)
RJ Young attempts a Midrange. Contested by Vince Hyland (5.1 feet, MAN). RJ Young misses. Rebound secured by Vince Hyland.

[06:19] Team_058 possession (Score: 35-37)
Bradley Sexton attempts a 3Pt. Contested by Cade Morant (5.2 feet, MAN). BRADLEY SEXTON MAKES IT! Assist: Vince Hyland
Score: 38-37

[06:03] Team_010 possession (Score: 38-37)
Michael Turner attempts a Layup. Contested by Stephen Haliburton (4.9 feet, ZONE). Michael Turner misses. Rebound secured by Vince Hyland.

[05:45] Team_058 possession (Score: 38-37)
Tyrese Doncic attempts a Layup. Contested by Anthony Durant (4.0 feet, MAN). Tyrese Doncic misses. Rebound secured by Cade Morant.

[05:31] Team_010 possession (Score: 38-37)
Anthony Durant attempts a Layup. Contested by Stephen Haliburton (5.1 feet, ZONE). Anthony Durant misses. Rebound secured by Tyrese Doncic.

[05:18] Team_058 possession (Score: 38-37)
Kyle Westbrook attempts a 3Pt. Contested by Michael Turner (5.2 feet, MAN). Kyle Westbrook misses. Rebound secured by Anthony Durant.

[05:05] Team_010 possession (Score: 38-37)
RJ Young attempts a Midrange. Contested by Vince Hyland (5.3 feet, MAN). RJ YOUNG MAKES IT! Assist: Cade Morant
Score: 38-39

[04:51] Team_058 possession (Score: 38-39)
Stephen Haliburton attempts a 3Pt. Contested by RJ Young (5.9 feet, ZONE). Stephen Haliburton misses. Rebound secured by Anthony Durant.

[04:34] Team_010 possession (Score: 38-39)
Michael Turner attempts a Midrange. Contested by Kyle Westbrook (5.7 feet, ZONE). Michael Turner misses. Rebound secured by Stephen Haliburton.

[04:18] Team_058 possession (Score: 38-39)
Stephen Haliburton attempts a Midrange. Contested by Anthony Durant (4.3 feet, MAN). Stephen Haliburton misses. Rebound secured by Michael Turner.

[04:05] Team_010 possession (Score: 38-39)
Cade Morant attempts a Midrange. Contested by Kyle Westbrook (5.9 feet, ZONE). CADE MORANT MAKES IT! Assist: RJ Young
Score: 38-41

[03:48] Team_058 possession (Score: 38-41)
Bradley Sexton attempts a 3Pt. Contested by Cade Morant (5.6 feet, ZONE). BRADLEY SEXTON MAKES IT! Assist: Tyrese Doncic
Score: 41-41

[03:34] Team_010 possession (Score: 41-41)
Michael Turner attempts a 3Pt. Contested by Bradley Sexton (4.8 feet, ZONE). MICHAEL TURNER MAKES IT! Assist: RJ Young
Score: 41-44

[03:15] Team_058 possession (Score: 41-44)
Bradley Sexton attempts a 3Pt. Contested by Cade Morant (5.7 feet, MAN). Bradley Sexton misses. Rebound secured by Michael Turner.

[02:59] Team_010 possession (Score: 41-44)
Anthony Durant drives and kicks out. Anthony Durant attempts a Midrange. Contested by Tyrese Doncic (5.9 feet, MAN). ANTHONY DURANT MAKES IT!
Score: 41-46

[02:43] Team_058 possession (Score: 41-46)
Kyle Westbrook drives, Anthony Durant stays with him. Kyle Westbrook attempts a Dunk. Contested by Anthony Durant (4.5 feet, ZONE). Kyle Westbrook misses. Offensive rebound by Stephen Haliburton! Stephen Haliburton kicks it out.

[02:31] Team_058 possession (Score: 41-46)
FOUL! Shooting foul on Michael Turner. Tyrese Doncic to the line for 2 free throws. [Team fouls: 2] (Michael Turner: 1 personal fouls)   FT 1/2: GOOD   FT 2/2: GOOD Tyrese Doncic makes 2/2 from the line.
Score: 43-46

[02:16] Team_010 possession (Score: 43-46)
FOUL! Shooting foul on Kyle Westbrook. Cade Morant to the line for 2 free throws. [Team fouls: 4] (Kyle Westbrook: 1 personal fouls)   FT 1/2: GOOD   FT 2/2: GOOD Cade Morant makes 2/2 from the line.
Score: 43-48

[01:59] Team_058 possession (Score: 43-48)
Kyle Westbrook attempts a Midrange. Contested by Michael Turner (5.6 feet, MAN). Kyle Westbrook misses. Rebound secured by Anthony Durant.

[01:46] Team_010 possession (Score: 43-48)
FOUL! Reach-in foul on Vince Hyland during the drive. [IN THE BONUS! 5 team fouls] RJ Young to the line for 2 free throws. (Vince Hyland: 1 personal fouls)   FT 1/2: GOOD   FT 2/2: GOOD RJ Young makes 2/2 from the line.
Score: 43-50

[01:31] Team_058 possession (Score: 43-50)
Bradley Sexton drives to the basket... FOUL! Offensive foul on Bradley Sexton! Cade Morant drew the charge! [Team fouls: 6] (Bradley Sexton: 2 personal fouls) TURNOVER! (dead ball)

[01:18] Team_010 possession (Score: 43-50)
Michael Turner attempts a 3Pt. Contested by Bradley Sexton (5.1 feet, ZONE). Michael Turner misses. Offensive rebound by Anthony Durant! Anthony Durant kicks it out.

[01:04] Team_010 possession (Score: 43-50)
Cade Morant attempts a Midrange. Wide open! Tyrese Doncic is 6.4 feet away. [ZONE] Cade Morant misses. FOUL! Loose ball foul on Vince Hyland during the rebound battle. [IN THE BONUS! 7 team fouls] Michael Turner to the line for 2 free throws. (Vince Hyland: 2 personal fouls)   FT 1/2: GOOD   FT 2/2: GOOD Michael Turner makes 2/2 from the line.
Score: 43-52

[00:51] Team_058 possession (Score: 43-52)
Bradley Sexton attempts a 3Pt. Wide open! Cade Morant is 6.1 feet away. [ZONE] Bradley Sexton misses. Rebound secured by Cade Morant.

[00:37] Team_010 possession (Score: 43-52)
Anthony Durant drives, Stephen Haliburton stays with him. Anthony Durant attempts a Dunk. Contested by Stephen Haliburton (6.0 feet, ZONE). Anthony Durant misses. Rebound secured by Tyrese Doncic.

[00:20] Team_058 possession (Score: 43-52)
FOUL! Offensive foul on Kyle Westbrook! Michael Turner drew the charge! [Team fouls: 8] (Kyle Westbrook: 2 personal fouls) TURNOVER! (dead ball)

[00:06] Team_010 possession (Score: 43-52)
Cade Morant drives, picks up Stephen Haliburton. Help arrives from Bradley Sexton! Cade Morant attempts a Layup. Wide open! Bradley Sexton is 6.0 feet away. [ZONE] Cade Morant misses. Offensive rebound by Anthony Durant! Anthony Durant kicks it out.

================================================================================
                              2ND QUARTER COMPLETE                              
================================================================================

2ND QUARTER SCORE: Team_058 16, Team_010 23

BOX SCORE:
================================================================================

Team_058
--------------------------------------------------------------------------------
Player                MIN  PTS  REB  AST  TO      FG   FG%      3P   3P%
--------------------------------------------------------------------------------
Bradley Sexton         24    9    0    0   0   3/8    37.5     0/0   0.0
Vince Hyland           24    3    4    2   0   1/1   100.0     0/0   0.0
Tyrese Doncic          24    2    4    1   0   1/3    33.3     0/0   0.0
Stephen Haliburton     24    2    4    0   0   1/3    33.3     0/0   0.0
Kyle Westbrook         24    0    0    1   0   0/5     0.0     0/0   0.0

TEAM: FG: 6/20 (30.0%), 3PT: 4/12 (33.3%), REB: 13 (3 off, 10 def), AST: 4, TO: 2
TEAM FOULS: 8 [Team_010 in BONUS]


Team_010
--------------------------------------------------------------------------------
Player                MIN  PTS  REB  AST  TO      FG   FG%      3P   3P%
--------------------------------------------------------------------------------
Michael Turner         24   10    4    0   0   4/6    66.7     0/0   0.0
Cade Morant            24    6    4    1   0   3/5    60.0     0/0   0.0
RJ Young               24    4    0    2   0   2/3    66.7     0/0   0.0
Anthony Durant         21    2    9    0   0   1/4    25.0     0/0   0.0
Desmond Antetokounmpo   24    0    0    1   0   0/2     0.0     0/0   0.0

TEAM: FG: 10/20 (50.0%), 3PT: 1/4 (25.0%), REB: 16 (3 off, 13 def), AST: 4, TO: 1
TEAM FOULS: 2

================================================================================

================================================================================
                       3RD QUARTER - Team_058 vs Team_010                       
================================================================================

[12:00] Team_058 possession (Score: 43-52)
FOUL! Reach-in foul on Michael Turner during the drive. [Team fouls: 1] No free throws, side out. (Michael Turner: 1 personal fouls)

[11:47] Team_058 possession (Score: 43-52)
Tyrese Doncic attempts a 3Pt. Contested by Cade Morant (3.9 feet, ZONE). Tyrese Doncic misses. Rebound secured by Desmond Antetokounmpo.

[11:30] Team_010 possession (Score: 43-52)
RJ Young attempts a 3Pt. Contested by Bradley Sexton (2.8 feet, ZONE). RJ YOUNG MAKES IT! Assist: Desmond Antetokounmpo
Score: 43-55

[11:18] Team_058 possession (Score: 43-55)
Vince Hyland attempts a 3Pt. Contested by Cade Morant (4.2 feet, ZONE). Vince Hyland misses. Rebound secured by Cade Morant.

[11:04] Team_010 possession (Score: 43-55)
Michael Turner makes the Layup and draws the foul on Kyle Westbrook! And-1! Michael Turner to the line for 1. [Team fouls: 1] (Kyle Westbrook: 1 personal fouls)   FT 1/1: GOOD Michael Turner makes 1/1 from the line.
Score: 43-58

[10:50] Team_058 possession (Score: 43-58)
Vince Hyland drives, picks up RJ Young. Help arrives from Cade Morant! Vince Hyland attempts a Dunk. Contested by Cade Morant (5.0 feet, MAN). VINCE HYLAND MAKES IT! Assist: Bradley Sexton
Score: 45-58

[10:39] Team_010 possession (Score: 45-58)
FOUL! Shooting foul on Tyrese Doncic. Anthony Durant to the line for 2 free throws. [Team fouls: 2] (Tyrese Doncic: 1 personal fouls)   FT 1/2: GOOD   FT 2/2: GOOD Anthony Durant makes 2/2 from the line.
Score: 45-60

[10:22] Team_058 possession (Score: 45-60)
FOUL! Shooting foul on Cade Morant. Tyrese Doncic to the line for 2 free throws. [Team fouls: 2] (Cade Morant: 1 personal fouls)   FT 1/2: MISS   FT 2/2: MISS Tyrese Doncic makes 0/2 from the line. Offensive rebound by Tyrese Doncic! Tyrese Doncic kicks it out.

[10:06] Team_058 possession (Score: 45-60)
Stephen Haliburton drives, Desmond Antetokounmpo stays with him. Stephen Haliburton attempts a Layup. Contested by Desmond Antetokounmpo (4.4 feet, MAN). STEPHEN HALIBURTON MAKES IT!
Score: 47-60

[09:53] Team_010 possession (Score: 47-60)
Desmond Antetokounmpo attempts a Midrange. Contested by Stephen Haliburton (3.6 feet, MAN). DESMOND ANTETOKOUNMPO MAKES IT! Assist: Anthony Durant
Score: 47-62

[09:38] Team_058 possession (Score: 47-62)
Tyrese Doncic drives, Anthony Durant stays with him. Tyrese Doncic attempts a Layup. Contested by Anthony Durant (3.5 feet, ZONE). TYRESE DONCIC MAKES IT!
Score: 49-62

[09:24] Team_010 possession (Score: 49-62)
Anthony Durant attempts a 3Pt. Contested by Bradley Sexton (3.3 feet, ZONE). Anthony Durant misses. Rebound secured by Bradley Sexton.

[09:07] Team_058 possession (Score: 49-62)
FOUL! Shooting foul on Cade Morant. Bradley Sexton to the line for 3 free throws. [Team fouls: 3] (Cade Morant: 2 personal fouls)   FT 1/3: GOOD   FT 2/3: GOOD   FT 3/3: GOOD Bradley Sexton makes 3/3 from the line.
Score: 52-62

[08:52] Team_010 possession (Score: 52-62)
FOUL! Offensive foul on Michael Turner! Kyle Westbrook drew the charge! [Team fouls: 4] (Michael Turner: 2 personal fouls) TURNOVER! (dead ball)

[08:37] Team_058 possession (Score: 52-62)
Stephen Haliburton makes the Midrange and draws the foul on Desmond Antetokounmpo! And-1! Stephen Haliburton to the line for 1. [BONUS: 5 team fouls] (Desmond Antetokounmpo: 1 personal fouls)   FT 1/1: GOOD Stephen Haliburton makes 1/1 from the line.
Score: 55-62

[08:24] Team_010 possession (Score: 55-62)
RJ Young attempts a Midrange. Contested by Stephen Haliburton (3.3 feet, ZONE). RJ Young misses. Rebound secured by Tyrese Doncic.

[08:12] Team_058 possession (Score: 55-62)
Bradley Sexton drives, Cade Morant stays with him. Bradley Sexton attempts a Layup. Contested by Cade Morant (4.2 feet, MAN). BRADLEY SEXTON MAKES IT! Assist: Kyle Westbrook
Score: 57-62

[07:58] Team_010 possession (Score: 57-62)
Michael Turner drives, picks up Kyle Westbrook. Help arrives from Bradley Sexton! Michael Turner attempts a Dunk. Contested by Bradley Sexton (4.3 feet, MAN). Michael Turner misses. Rebound secured by Stephen Haliburton.

[07:39] Team_058 possession (Score: 57-62)
Vince Hyland drives to the basket... Vince Hyland loses control! Ball rolls out of bounds! TURNOVER! (dead ball)

[07:27] Team_010 possession (Score: 57-62)
FOUL! Holding foul on Tyrese Doncic. [Team fouls: 3] No free throws, side out. (Tyrese Doncic: 2 personal fouls)

[07:13] Team_010 possession (Score: 57-62)
Cade Morant attempts a Midrange. Contested by Stephen Haliburton (3.9 feet, ZONE). Cade Morant misses. Rebound secured by Tyrese Doncic.

[06:59] Team_058 possession (Score: 57-62)
Tyrese Doncic attempts a Layup. Contested by Anthony Durant (3.5 feet, ZONE). Tyrese Doncic misses. Rebound secured by Cade Morant.

[06:42] Team_010 possession (Score: 57-62)
RJ Young attempts a 3Pt. Contested by Bradley Sexton (2.8 feet, ZONE). RJ Young misses. Rebound secured by Stephen Haliburton.

[06:31] Team_058 possession (Score: 57-62)
Tyrese Doncic loses the ball! Stripped by Anthony Durant! TURNOVER! (live ball)

[06:17] Team_010 possession (Score: 57-62)
Anthony Durant drives and kicks out. Desmond Antetokounmpo attempts a Midrange. Contested by Stephen Haliburton (3.4 feet, MAN). Desmond Antetokounmpo misses. FOUL! Loose ball foul on Stephen Haliburton during the rebound battle. [Team fouls: 4] No free throws, side out. (Stephen Haliburton: 1 personal fouls)

[06:00] Team_010 possession (Score: 57-62)
FOUL! Shooting foul on Bradley Sexton. Anthony Durant to the line for 2 free throws. [BONUS: 5 team fouls] (Bradley Sexton: 1 personal fouls)   FT 1/2: GOOD   FT 2/2: GOOD Anthony Durant makes 2/2 from the line.
Score: 57-64

[05:48] Team_058 possession (Score: 57-64)
Vince Hyland attempts a Layup. Contested by Anthony Durant (3.8 feet, ZONE). VINCE HYLAND MAKES IT! Assist: Stephen Haliburton
Score: 59-64

[05:34] Team_010 possession (Score: 59-64)
Michael Turner attempts a Midrange. Contested by Kyle Westbrook (4.3 feet, MAN). Michael Turner misses. Rebound secured by Stephen Haliburton.

[05:21] Team_058 possession (Score: 59-64)
Stephen Haliburton attempts a Midrange. Contested by Michael Turner (4.2 feet, ZONE). Stephen Haliburton misses. FOUL! Loose ball foul on Anthony Durant during the rebound battle. [IN THE BONUS! 6 team fouls] Tyrese Doncic to the line for 2 free throws. (Anthony Durant: 1 personal fouls)   FT 1/2: GOOD   FT 2/2: MISS Tyrese Doncic makes 1/2 from the line. Rebound secured by Michael Turner.
Score: 60-64

[05:04] Team_010 possession (Score: 60-64)
Michael Turner attempts a 3Pt. Contested by Kyle Westbrook (4.3 feet, MAN). Michael Turner misses. Rebound secured by Stephen Haliburton.

[04:50] Team_058 possession (Score: 60-64)
Tyrese Doncic drives, picks up Anthony Durant. Help arrives from Cade Morant! Tyrese Doncic attempts a Dunk. Contested by Cade Morant (3.6 feet, ZONE). Tyrese Doncic misses. Rebound secured by Cade Morant.

[04:34] Team_010 possession (Score: 60-64)
Michael Turner makes the Layup and draws the foul on Stephen Haliburton! And-1! Michael Turner to the line for 1. [BONUS: 6 team fouls] (Stephen Haliburton: 2 personal fouls)   FT 1/1: MISS Michael Turner makes 0/1 from the line. Rebound secured by Bradley Sexton.
Score: 60-66

[04:21] Team_058 possession (Score: 60-66)
Bradley Sexton drives to the basket... Bradley Sexton loses the ball! Stripped by Cade Morant! TURNOVER! (live ball)

[04:06] Team_010 possession (Score: 60-66)
Anthony Durant drives, Stephen Haliburton stays with him. Anthony Durant attempts a Layup. Contested by Stephen Haliburton (3.9 feet, ZONE). Anthony Durant misses. Rebound secured by Bradley Sexton.

[03:49] Team_058 possession (Score: 60-66)
FOUL! Holding foul on RJ Young. [IN THE BONUS! 7 team fouls] Vince Hyland to the line for 2 free throws. (RJ Young: 1 personal fouls)   FT 1/2: GOOD   FT 2/2: MISS Vince Hyland makes 1/2 from the line. Rebound secured by Anthony Durant.
Score: 61-66

[03:36] Team_010 possession (Score: 61-66)
Cade Morant attempts a Midrange. Contested by Bradley Sexton (3.6 feet, MAN). Cade Morant misses. Rebound secured by Bradley Sexton.

[03:26] Team_058 possession (Score: 61-66)
FOUL! Reach-in foul on Desmond Antetokounmpo during the drive. [IN THE BONUS! 8 team fouls] Stephen Haliburton to the line for 2 free throws. (Desmond Antetokounmpo: 2 personal fouls)   FT 1/2: GOOD   FT 2/2: GOOD Stephen Haliburton makes 2/2 from the line.
Score: 63-66

[03:14] Team_010 possession (Score: 63-66)
Desmond Antetokounmpo attempts a Midrange. Contested by Stephen Haliburton (3.8 feet, MAN). DESMOND ANTETOKOUNMPO MAKES IT!
Score: 63-68

[02:58] Team_058 possession (Score: 63-68)
Kyle Westbrook attempts a 3Pt. Contested by Cade Morant (4.3 feet, ZONE). Kyle Westbrook misses. Rebound secured by Michael Turner.

[02:45] Team_010 possession (Score: 63-68)
FOUL! Reach-in foul on Stephen Haliburton during the drive. [IN THE BONUS! 7 team fouls] Cade Morant to the line for 2 free throws. (Stephen Haliburton: 3 personal fouls)   FT 1/2: GOOD   FT 2/2: GOOD Cade Morant makes 2/2 from the line.
Score: 63-70

[02:33] Team_058 possession (Score: 63-70)
Stephen Haliburton attempts a 3Pt. Contested by Cade Morant (4.3 feet, ZONE). Stephen Haliburton misses. Offensive rebound by Tyrese Doncic! Tyrese Doncic kicks it out.

[02:20] Team_058 possession (Score: 63-70)
Vince Hyland drives to the basket... Vince Hyland commits a violation (traveling/carry)! TURNOVER! (dead ball)

[02:20] Substitution (Team_058): Bradley Sexton OUT → Draymond Williamson IN (stamina_rule2)

[02:20] Substitution (Team_058): Kyle Westbrook OUT → Jordan Ingram IN (stamina_rule2)

[02:20] Substitution (Team_058): Vince Hyland OUT → Pascal Holiday IN (stamina_rule2)

[02:20] Substitution (Team_058): Stephen Haliburton OUT → Shai Lowry IN (stamina_rule2)

[02:20] Substitution (Team_058): Tyrese Doncic OUT → Jarrett Gilgeous-Alexander IN (stamina_rule2)

[02:20] Substitution (Team_010): Cade Morant OUT → Draymond Leonard IN (stamina_rule2)

[02:20] Substitution (Team_010): Michael Turner OUT → Blake Harden IN (stamina_rule2)

[02:20] Substitution (Team_010): RJ Young OUT → Ben Gilgeous-Alexander IN (stamina_rule2)

[02:20] Substitution (Team_010): Desmond Antetokounmpo OUT → Vince Ingram IN (stamina_rule2)

[02:20] Substitution (Team_010): Anthony Durant OUT → Paolo Wade IN (stamina_rule2)

[02:08] Team_010 possession (Score: 63-70)
Vince Ingram makes the Dunk and draws the foul on Shai Lowry! And-1! Vince Ingram to the line for 1. [BONUS: 8 team fouls] (Shai Lowry: 1 personal fouls)   FT 1/1: GOOD Vince Ingram makes 1/1 from the line.
Score: 63-73

[01:54] Team_058 possession (Score: 63-73)
Jarrett Gilgeous-Alexander drives and kicks out. Jarrett Gilgeous-Alexander attempts a 3Pt. Contested by Draymond Leonard (4.4 feet, ZONE). Jarrett Gilgeous-Alexander misses. Offensive rebound by Shai Lowry! Shai Lowry kicks it out.

[01:43] Team_058 possession (Score: 63-73)
Draymond Williamson attempts a 3Pt. Contested by Draymond Leonard (4.8 feet, MAN). Draymond Williamson misses. Rebound secured by Blake Harden.

[01:27] Team_010 possession (Score: 63-73)
Blake Harden drives to the basket... Blake Harden commits a violation (traveling/carry)! TURNOVER! (dead ball)

[01:13] Team_058 possession (Score: 63-73)
Shai Lowry drives, picks up Vince Ingram. Help arrives from Blake Harden! Shai Lowry attempts a Layup. Contested by Blake Harden (5.3 feet, MAN). SHAI LOWRY MAKES IT! Assist: Pascal Holiday
Score: 65-73

[00:58] Team_010 possession (Score: 65-73)
Vince Ingram attempts a 3Pt. Contested by Shai Lowry (4.8 feet, MAN). VINCE INGRAM MAKES IT! Assist: Paolo Wade
Score: 65-76

[00:44] Team_058 possession (Score: 65-76)
Draymond Williamson attempts a 3Pt. Contested by Draymond Leonard (4.8 feet, MAN). Draymond Williamson misses. Rebound secured by Blake Harden.

[00:25] Team_010 possession (Score: 65-76)
Draymond Leonard attempts a 3Pt. Contested by Draymond Williamson (5.6 feet, ZONE). DRAYMOND LEONARD MAKES IT!
Score: 65-79

[00:12] Team_058 possession (Score: 65-79)
Shai Lowry attempts a 3Pt. Contested by Vince Ingram (5.3 feet, MAN). SHAI LOWRY MAKES IT! Assist: Pascal Holiday
Score: 68-79

[00:01] Team_010 possession (Score: 68-79)
Draymond Leonard drives and kicks out. Blake Harden attempts a 3Pt. Contested by Jordan Ingram (5.9 feet, MAN). Blake Harden misses. Rebound secured by Shai Lowry.

================================================================================
                              3RD QUARTER COMPLETE                              
================================================================================

3RD QUARTER SCORE: Team_058 25, Team_010 27

BOX SCORE:
================================================================================

Team_058
--------------------------------------------------------------------------------
Player                MIN  PTS  REB  AST  TO      FG   FG%      3P   3P%
--------------------------------------------------------------------------------
Stephen Haliburton     34    7    4    1   0   3/4    75.0     0/0   0.0
Bradley Sexton         34    5    4    1   0   2/2   100.0     0/0   0.0
Shai Lowry              2    5    2    0   0   2/2   100.0     0/0   0.0
Vince Hyland           34    4    0    0   0   2/3    66.7     0/0   0.0
Tyrese Doncic          34    2    4    0   0   1/4    25.0     0/0   0.0
Kyle Westbrook         34    0    0    1   0   0/1     0.0     0/0   0.0
Draymond Williamson     2    0    0    0   0   0/2     0.0     0/0   0.0
Pascal Holiday          2    0    0    2   0   0/0     0.0     0/0   0.0

TEAM: FG: 10/19 (52.6%), 3PT: 2/7 (28.6%), REB: 15 (4 off, 11 def), AST: 5, TO: 4
TEAM FOULS: 8 [Team_010 in BONUS]


Team_010
--------------------------------------------------------------------------------
Player                MIN  PTS  REB  AST  TO      FG   FG%      3P   3P%
--------------------------------------------------------------------------------
Vince Ingram            2    6    0    0   0   2/2   100.0     0/0   0.0
Desmond Antetokounmpo   34    4    1    1   0   2/2   100.0     0/0   0.0
Anthony Durant         31    4    1    1   0   2/4    50.0     0/0   0.0
RJ Young               34    3    0    0   0   1/3    33.3     0/0   0.0
Michael Turner         34    3    2    0   0   1/5    20.0     0/0   0.0
Draymond Leonard        5    3    0    0   0   1/2    50.0     0/0   0.0
Cade Morant            34    2    4    0   0   1/3    33.3     0/0   0.0
Blake Harden            2    0    2    0   0   0/0     0.0     0/0   0.0
Paolo Wade              2    0    0    1   0   0/0     0.0     0/0   0.0

TEAM: FG: 10/21 (47.6%), 3PT: 3/6 (50.0%), REB: 9 (1 off, 8 def), AST: 3, TO: 2
TEAM FOULS: 8 [Team_058 in BONUS]

================================================================================

================================================================================
                       4TH QUARTER - Team_058 vs Team_010                       
================================================================================

[12:00] Substitution (Team_058): Bradley Sexton OUT (stamina: 79) → Draymond Williamson IN (comeback_detected)

[12:00] Substitution (Team_010): Cade Morant OUT (stamina: 78) → Draymond Leonard IN (comeback_detected)

[12:00] Team_058 possession (Score: 68-79)
Tyrese Doncic attempts a Midrange. Contested by Anthony Durant (3.6 feet, MAN). TYRESE DONCIC MAKES IT! Assist: Kyle Westbrook
Score: 70-79

[11:46] Team_010 possession (Score: 70-79)
FOUL! Shooting foul on Kyle Westbrook. Michael Turner to the line for 2 free throws. [Team fouls: 1] (Kyle Westbrook: 1 personal fouls)   FT 1/2: MISS   FT 2/2: GOOD Michael Turner makes 1/2 from the line.
Score: 70-80

[11:31] Team_058 possession (Score: 70-80)
Kyle Westbrook attempts a Midrange. Contested by Michael Turner (4.2 feet, MAN). Kyle Westbrook misses. Rebound secured by Michael Turner.

[11:14] Team_010 possession (Score: 70-80)
Desmond Antetokounmpo makes the Dunk and draws the foul on Stephen Haliburton! And-1! Desmond Antetokounmpo to the line for 1. [Team fouls: 2] (Stephen Haliburton: 1 personal fouls)   FT 1/1: GOOD Desmond Antetokounmpo makes 1/1 from the line.
Score: 70-83

[11:02] Team_058 possession (Score: 70-83)
Vince Hyland attempts a 3Pt. Contested by RJ Young (5.1 feet, MAN). Vince Hyland misses. Rebound secured by Anthony Durant.

[10:45] Team_010 possession (Score: 70-83)
FOUL! Reach-in foul on Stephen Haliburton during the drive. [Team fouls: 3] No free throws, side out. (Stephen Haliburton: 2 personal fouls)

[10:30] Team_010 possession (Score: 70-83)
RJ Young attempts a Midrange. Contested by Vince Hyland (4.4 feet, MAN). RJ Young misses. Rebound secured by Tyrese Doncic.

[10:16] Team_058 possession (Score: 70-83)
Tyrese Doncic drives and kicks out. Kyle Westbrook attempts a Midrange. Contested by Michael Turner (4.1 feet, ZONE). Kyle Westbrook misses. Rebound secured by Desmond Antetokounmpo.

[10:01] Team_010 possession (Score: 70-83)
Michael Turner makes the Dunk and draws the foul on Stephen Haliburton! And-1! Michael Turner to the line for 1. [Team fouls: 4] (Stephen Haliburton: 3 personal fouls)   FT 1/1: GOOD Michael Turner makes 1/1 from the line.
Score: 70-86

[09:49] Team_058 possession (Score: 70-86)
Vince Hyland attempts a 3Pt. Contested by Draymond Leonard (4.7 feet, ZONE). VINCE HYLAND MAKES IT! Assist: Kyle Westbrook
Score: 73-86

[09:32] Team_010 possession (Score: 73-86)
Desmond Antetokounmpo attempts a Midrange. Contested by Stephen Haliburton (3.9 feet, MAN). DESMOND ANTETOKOUNMPO MAKES IT!
Score: 73-88

[09:16] Team_058 possession (Score: 73-88)
Tyrese Doncic attempts a Layup. Contested by Anthony Durant (3.8 feet, ZONE). TYRESE DONCIC MAKES IT!
Score: 75-88

[09:05] Team_010 possession (Score: 75-88)
Draymond Leonard attempts a 3Pt. Contested by Kyle Westbrook (4.8 feet, ZONE). Draymond Leonard misses. Rebound secured by Tyrese Doncic.

[08:51] Team_058 possession (Score: 75-88)
Tyrese Doncic attempts a 3Pt. Contested by Draymond Leonard (4.4 feet, ZONE). Tyrese Doncic misses. Rebound secured by Anthony Durant.

[08:32] Team_010 possession (Score: 75-88)
FOUL! Shooting foul on Stephen Haliburton. Draymond Leonard to the line for 2 free throws. [BONUS: 5 team fouls] (Stephen Haliburton: 4 personal fouls)   FT 1/2: GOOD   FT 2/2: GOOD Draymond Leonard makes 2/2 from the line.
Score: 75-90

[08:12] Team_058 possession (Score: 75-90)
Vince Hyland attempts a 3Pt. Contested by Desmond Antetokounmpo (4.9 feet, ZONE). Vince Hyland misses. FOUL! Loose ball foul on Desmond Antetokounmpo during the rebound battle. [Team fouls: 1] No free throws, side out. (Desmond Antetokounmpo: 1 personal fouls)

[07:58] Team_058 possession (Score: 75-90)
FOUL! Offensive foul on Kyle Westbrook! Michael Turner drew the charge! [Team fouls: 6] (Kyle Westbrook: 2 personal fouls) TURNOVER! (dead ball)

[07:43] Team_010 possession (Score: 75-90)
Desmond Antetokounmpo makes the Layup and draws the foul on Stephen Haliburton! And-1! Desmond Antetokounmpo to the line for 1. [BONUS: 7 team fouls] (Stephen Haliburton: 5 personal fouls)   FT 1/1: GOOD Desmond Antetokounmpo makes 1/1 from the line.
Score: 75-93

[07:28] Team_058 possession (Score: 75-93)
Stephen Haliburton attempts a Midrange. Contested by Desmond Antetokounmpo (4.8 feet, MAN). Stephen Haliburton misses. Offensive rebound by Tyrese Doncic! Tyrese Doncic kicks it out.

[07:14] Team_058 possession (Score: 75-93)
FOUL! Holding foul on Draymond Leonard. [Team fouls: 2] No free throws, side out. (Draymond Leonard: 1 personal fouls)

[07:01] Team_058 possession (Score: 75-93)
Stephen Haliburton attempts a Layup. Contested by Desmond Antetokounmpo (4.9 feet, MAN). Stephen Haliburton misses. Rebound secured by Anthony Durant.

[06:48] Team_010 possession (Score: 75-93)
FOUL! Shooting foul on Vince Hyland. Anthony Durant to the line for 2 free throws. [BONUS: 8 team fouls] (Vince Hyland: 1 personal fouls)   FT 1/2: MISS   FT 2/2: GOOD Anthony Durant makes 1/2 from the line.
Score: 75-94

[06:32] Team_058 possession (Score: 75-94)
FOUL! Shooting foul on Anthony Durant. Tyrese Doncic to the line for 2 free throws. [Team fouls: 3] (Anthony Durant: 1 personal fouls)   FT 1/2: GOOD   FT 2/2: GOOD Tyrese Doncic makes 2/2 from the line.
Score: 77-94

[06:16] Team_010 possession (Score: 77-94)
Draymond Leonard attempts a 3Pt. Contested by Draymond Williamson (5.7 feet, ZONE). DRAYMOND LEONARD MAKES IT! Assist: Michael Turner
Score: 77-97

[06:06] Team_058 possession (Score: 77-97)
Stephen Haliburton attempts a 3Pt. Contested by Draymond Leonard (4.5 feet, ZONE). Stephen Haliburton misses. Rebound secured by Michael Turner.

[05:53] Team_010 possession (Score: 77-97)
Anthony Durant attempts a Layup. BLOCKED BY KYLE WESTBROOK! Ball goes out off Kyle Westbrook. Anthony Durant's ball!

[05:38] Team_010 possession (Score: 77-97)
Michael Turner attempts a 3Pt. Contested by Draymond Williamson (5.5 feet, ZONE). Michael Turner misses. Rebound secured by Stephen Haliburton.

[05:22] Team_058 possession (Score: 77-97)
FOUL! Reach-in foul on Anthony Durant during the drive. [Team fouls: 4] No free throws, side out. (Anthony Durant: 2 personal fouls)

[05:10] Team_058 possession (Score: 77-97)
Vince Hyland makes the Dunk and draws the foul on RJ Young! And-1! Vince Hyland to the line for 1. [BONUS: 5 team fouls] (RJ Young: 1 personal fouls)   FT 1/1: GOOD Vince Hyland makes 1/1 from the line.
Score: 80-97

[04:55] Team_010 possession (Score: 80-97)
Anthony Durant attempts a Layup. BLOCKED BY KYLE WESTBROOK! Ball is loose! Rebound secured by Stephen Haliburton.

[04:41] Team_058 possession (Score: 80-97)
Tyrese Doncic drives and kicks out. Stephen Haliburton attempts a 3Pt. Contested by Desmond Antetokounmpo (5.2 feet, MAN). Stephen Haliburton misses. Rebound secured by Michael Turner.

[04:27] Team_010 possession (Score: 80-97)
Draymond Leonard attempts a 3Pt. Contested by Draymond Williamson (5.8 feet, MAN). Draymond Leonard misses. Offensive rebound by Draymond Leonard! Draymond Leonard kicks it out.

[04:14] Team_010 possession (Score: 80-97)
Desmond Antetokounmpo drives, picks up Stephen Haliburton. Help arrives from Kyle Westbrook! Desmond Antetokounmpo attempts a Layup. Contested by Kyle Westbrook (4.6 feet, ZONE). DESMOND ANTETOKOUNMPO MAKES IT! Assist: RJ Young
Score: 80-99

[04:00] Team_058 possession (Score: 80-99)
Kyle Westbrook attempts a Midrange. Contested by Michael Turner (5.0 feet, MAN). KYLE WESTBROOK MAKES IT! Assist: Draymond Williamson
Score: 82-99

[03:48] Team_010 possession (Score: 82-99)
Desmond Antetokounmpo attempts a Layup. BLOCKED BY STEPHEN HALIBURTON! Ball is loose! Offensive rebound by Draymond Leonard! Draymond Leonard kicks it out.

[03:29] Team_010 possession (Score: 82-99)
FOUL! Offensive foul on Anthony Durant! Tyrese Doncic drew the charge! [Team fouls: 6] (Anthony Durant: 3 personal fouls) TURNOVER! (dead ball)

[03:12] Team_058 possession (Score: 82-99)
Kyle Westbrook loses control! Ball rolls out of bounds! TURNOVER! (dead ball)

[03:12] Substitution (Team_058): Kyle Westbrook OUT → Jordan Ingram IN (stamina_rule2)

[03:12] Substitution (Team_058): Vince Hyland OUT → Pascal Holiday IN (stamina_rule2)

[03:12] Substitution (Team_058): Stephen Haliburton OUT → Shai Lowry IN (stamina_rule2)

[03:12] Substitution (Team_058): Tyrese Doncic OUT → Jarrett Gilgeous-Alexander IN (stamina_rule2)

[03:12] Substitution (Team_058): Draymond Williamson OUT → Bradley Sexton IN (starter_return_rule1)

[03:12] Substitution (Team_010): Michael Turner OUT → Blake Harden IN (stamina_rule2)

[03:12] Substitution (Team_010): RJ Young OUT → Ben Gilgeous-Alexander IN (stamina_rule2)

[03:12] Substitution (Team_010): Desmond Antetokounmpo OUT → Vince Ingram IN (stamina_rule2)

[03:12] Substitution (Team_010): Anthony Durant OUT → Paolo Wade IN (stamina_rule2)

[02:57] Team_010 possession (Score: 82-99)
Ben Gilgeous-Alexander attempts a 3Pt. BLOCKED BY BRADLEY SEXTON! Ball goes out off Bradley Sexton. Ben Gilgeous-Alexander's ball!

[02:46] Team_010 possession (Score: 82-99)
FOUL! Reach-in foul on Shai Lowry during the drive. [IN THE BONUS! 9 team fouls] Paolo Wade to the line for 2 free throws. (Shai Lowry: 1 personal fouls)   FT 1/2: MISS   FT 2/2: GOOD Paolo Wade makes 1/2 from the line.
Score: 82-100

[02:34] Team_058 possession (Score: 82-100)
Jordan Ingram attempts a 3Pt. Contested by Blake Harden (4.7 feet, MAN). JORDAN INGRAM MAKES IT! Assist: Shai Lowry
Score: 85-100

[02:22] Team_010 possession (Score: 85-100)
Paolo Wade attempts a 3Pt. Contested by Bradley Sexton (3.2 feet, ZONE). Paolo Wade misses. Rebound secured by Shai Lowry.

[02:05] Team_058 possession (Score: 85-100)
Jordan Ingram attempts a Layup. Contested by Blake Harden (4.7 feet, MAN). JORDAN INGRAM MAKES IT! Assist: Shai Lowry
Score: 87-100

[01:52] Team_010 possession (Score: 87-100)
FOUL! Reach-in foul on Shai Lowry during the drive. [IN THE BONUS! 10 team fouls] Vince Ingram to the line for 2 free throws. (Shai Lowry: 2 personal fouls)   FT 1/2: GOOD   FT 2/2: MISS Vince Ingram makes 1/2 from the line. Rebound secured by Pascal Holiday.
Score: 87-101

[01:33] Team_058 possession (Score: 87-101)
Jordan Ingram attempts a 3Pt. Contested by Vince Ingram (5.5 feet, ZONE). Jordan Ingram misses. Rebound secured by Paolo Wade.

[01:21] Team_010 possession (Score: 87-101)
Ben Gilgeous-Alexander loses control! Ball rolls out of bounds! TURNOVER! (dead ball)

[01:21] Substitution (Team_010): Draymond Leonard OUT → Cade Morant IN (starter_return_rule1)

[01:05] Team_058 possession (Score: 87-101)
Pascal Holiday attempts a 3Pt. Contested by Cade Morant (3.9 feet, ZONE). Pascal Holiday misses. Offensive rebound by Shai Lowry! Shai Lowry kicks it out.

[00:54] Team_058 possession (Score: 87-101)
FOUL! Shooting foul on Blake Harden. Jordan Ingram to the line for 3 free throws. [BONUS: 7 team fouls] (Blake Harden: 1 personal fouls)   FT 1/3: GOOD   FT 2/3: GOOD   FT 3/3: MISS Jordan Ingram makes 2/3 from the line. Rebound secured by Paolo Wade.
Score: 89-101

[00:38] Team_010 possession (Score: 89-101)
Ben Gilgeous-Alexander attempts a Layup. Contested by Jarrett Gilgeous-Alexander (5.5 feet, ZONE). BEN GILGEOUS-ALEXANDER MAKES IT! Assist: Cade Morant
Score: 89-103

[00:22] Team_058 possession (Score: 89-103)
Jarrett Gilgeous-Alexander drives, Paolo Wade stays with him. Jarrett Gilgeous-Alexander attempts a Dunk. Contested by Paolo Wade (5.1 feet, ZONE). Jarrett Gilgeous-Alexander misses. Offensive rebound by Shai Lowry! Shai Lowry kicks it out.

[00:08] Team_058 possession (Score: 89-103)
Bradley Sexton attempts a Midrange. Contested by Blake Harden (4.9 feet, ZONE). BRADLEY SEXTON MAKES IT! Assist: Jarrett Gilgeous-Alexander
Score: 91-103

================================================================================
                              4TH QUARTER COMPLETE                              
================================================================================

4TH QUARTER SCORE: Team_058 23, Team_010 24

BOX SCORE:
================================================================================

Team_058
--------------------------------------------------------------------------------
Player                MIN  PTS  REB  AST  TO      FG   FG%      3P   3P%
--------------------------------------------------------------------------------
Tyrese Doncic          43    6    3    0   0   3/6    50.0     0/0   0.0
Vince Hyland           43    6    0    0   0   2/3    66.7     0/0   0.0
Jordan Ingram           5    5    0    0   0   2/4    50.0     0/0   0.0
Kyle Westbrook         43    2    0    2   0   1/2    50.0     0/0   0.0
Bradley Sexton         37    2    0    0   0   1/1   100.0     0/0   0.0
Stephen Haliburton     43    0    3    0   0   0/2     0.0     0/0   0.0
Draymond Williamson    11    0    0    1   0   0/0     0.0     0/0   0.0
Shai Lowry              5    0    3    2   0   0/0     0.0     0/0   0.0
Pascal Holiday          5    0    1    0   0   0/0     0.0     0/0   0.0
Jarrett Gilgeous-Alexander    5    0    0    1   0   0/0     0.0     0/0   0.0

TEAM: FG: 9/18 (50.0%), 3PT: 2/7 (28.6%), REB: 10 (4 off, 6 def), AST: 6, TO: 2
TEAM FOULS: 10 [Team_010 in BONUS]


Team_010
--------------------------------------------------------------------------------
Player                MIN  PTS  REB  AST  TO      FG   FG%      3P   3P%
--------------------------------------------------------------------------------
Desmond Antetokounmpo   43   10    1    0   0   4/4   100.0     0/0   0.0
Draymond Leonard       16    5    2    0   0   2/3    66.7     0/0   0.0
Michael Turner         43    4    3    1   0   2/3    66.7     0/0   0.0
Ben Gilgeous-Alexander    5    2    0    0   0   1/1   100.0     0/0   0.0
Anthony Durant         40    1    3    0   0   1/2    50.0     0/0   0.0
Paolo Wade              5    1    2    0   0   1/2    50.0     0/0   0.0
RJ Young               43    0    0    1   0   0/1     0.0     0/0   0.0
Vince Ingram            5    0    0    0   0   0/1     0.0     0/0   0.0
Cade Morant            35    0    0    1   0   0/0     0.0     0/0   0.0

TEAM: FG: 11/17 (64.7%), 3PT: 1/4 (25.0%), REB: 11 (2 off, 9 def), AST: 3, TO: 2
TEAM FOULS: 7 [Team_058 in BONUS]

================================================================================

================================================================================
                               FULL GAME COMPLETE                               
================================================================================

FINAL SCORE: Team_058 91, Team_010 103

SCORING BY QUARTER:
--------------------------------------------------------------------------------
Team                     Q1     Q2     Q3     Q4    FINAL
--------------------------------------------------------------------------------
Team_058                 27     16     25     23       91
Team_010                 29     23     27     24      103
--------------------------------------------------------------------------------

FULL GAME BOX SCORE:
================================================================================

Team_058
--------------------------------------------------------------------------------
Player                MIN  PTS  REB  AST  TO      FG   FG%      3P   3P%      FT STL BLK
--------------------------------------------------------------------------------
Kyle Westbrook         43    9    0    4   4   2/14   14.3   0/6     0.0   4/4     0   3
Vince Hyland           43   20    4    3   1   8/11   72.7   2/4    50.0   3/4     0   1
Stephen Haliburton     43   10   12    2   2   5/10   50.0   0/2     0.0   4/5     1   2
Tyrese Doncic          43   18   13    2   1   8/20   40.0   0/2     0.0   9/13    0   0
Bradley Sexton         37   18    9    2   0   7/13   53.8   4/10   40.0   3/3     0   1
Draymond Williamson    11    0    0    1   0   0/2     0.0   0/2     0.0   0/0     0   0
Jordan Ingram           5    5    0    0   0   2/4    50.0   1/3    33.3   2/3     0   0
Pascal Holiday          5    0    1    2   0   0/0     0.0   0/0     0.0   0/0     0   0
Shai Lowry              5    5    5    2   0   2/2   100.0   1/1   100.0   0/0     0   0
Jarrett Gilgeous-Alexander    5    0    0    1   0   0/0     0.0   0/0     0.0   0/0     0   0

TEAM: FG: 36/79 (45.6%), 3PT: 8/30 (26.7%), REB: 46 (13 off, 33 def), AST: 19, TO: 8


Team_010
--------------------------------------------------------------------------------
Player                MIN  PTS  REB  AST  TO      FG   FG%      3P   3P%      FT STL BLK
--------------------------------------------------------------------------------
Michael Turner         43   20   11    5   1   8/16   50.0   2/5    40.0   9/11    0   0
RJ Young               43   10    0    4   2   4/8    50.0   2/3    66.7   2/2     0   0
Desmond Antetokounmpo   43   20    5    2   2   8/13   61.5   1/3    33.3   3/4     0   0
Anthony Durant         40    9   16    3   1   5/11   45.5   0/1     0.0   8/10    1   1
Cade Morant            35   21   15    2   2  10/14   71.4   1/3    33.3   4/4     1   0
Draymond Leonard       16    8    2    1   1   3/7    42.9   2/3    66.7   2/2     0   0
Blake Harden            5    0    2    0   0   0/0     0.0   0/0     0.0   0/0     0   0
Ben Gilgeous-Alexander    5    2    0    0   1   1/1   100.0   0/0     0.0   0/0     0   0
Vince Ingram            5    6    0    0   0   2/3    66.7   1/1   100.0   2/3     0   0
Paolo Wade              5    1    2    1   0   1/2    50.0   0/1     0.0   1/2     0   0

TEAM: FG: 42/75 (56.0%), 3PT: 9/20 (45.0%), REB: 51 (10 off, 41 def), AST: 18, TO: 10

================================================================================
