================================================================================
                        FULL GAME - Team_057 vs Team_063                        
================================================================================

================================================================================
                       1ST QUARTER - Team_057 vs Team_063                       
================================================================================

[12:00] Team_057 possession (Score: 0-0)
Ben Adebayo makes the Layup and draws the foul on Malcolm Quickley! And-1! Ben Adebayo to the line for 1. [Team fouls: 1] (Malcolm Quickley: 1 personal fouls)   FT 1/1: GOOD Ben Adebayo makes 1/1 from the line.
Score: 3-0

[11:49] Team_063 possession (Score: 3-0)
Malcolm Quickley drives and kicks out. Bradley Davis attempts a 3Pt. Contested by Kobe Ming (4.4 feet, MAN). BRADLEY DAVIS MAKES IT! Assist: Dirk Reaves
Score: 3-3

[11:32] Team_057 possession (Score: 3-3)
Kobe Ming attempts a Layup. Contested by Bradley Davis (5.2 feet, MAN). Kobe Ming misses. Rebound secured by Dirk Reaves.

[11:17] Team_063 possession (Score: 3-3)
Tyler Harris throws a bad pass! Stolen by Miles Middleton! TURNOVER! (live ball)

[11:03] Team_057 possession (Score: 3-3)
FOUL! Shooting foul on Terry Reaves. Anfernee Adebayo to the line for 2 free throws. [Team fouls: 2] (Terry Reaves: 1 personal fouls)   FT 1/2: GOOD   FT 2/2: MISS Anfernee Adebayo makes 1/2 from the line. Rebound secured by Malcolm Quickley.
Score: 4-3

[10:45] Team_063 possession (Score: 4-3)
FOUL! Holding foul on Klay Rozier. [Team fouls: 1] No free throws, side out. (Klay Rozier: 1 personal fouls)

[10:31] Team_063 possession (Score: 4-3)
FOUL! Reach-in foul on Miles Middleton during the drive. [Team fouls: 2] No free throws, side out. (Miles Middleton: 1 personal fouls)

[10:15] Team_063 possession (Score: 4-3)
Dirk Reaves drives and kicks out. Malcolm Quickley attempts a Midrange. Contested by Klay Rozier (3.6 feet, MAN). Malcolm Quickley misses. Rebound secured by Ben Adebayo.

[10:03] Team_057 possession (Score: 4-3)
Miles Middleton attempts a Layup. BLOCKED BY MALCOLM QUICKLEY! Ball deflects out of bounds off Miles Middleton.

[09:53] Team_063 possession (Score: 4-3)
FOUL! Reach-in foul on Ben Adebayo during the drive. [Team fouls: 3] No free throws, side out. (Ben Adebayo: 1 personal fouls)

[09:39] Team_063 possession (Score: 4-3)
Tyler Harris attempts a Midrange. Contested by Klay Rozier (3.6 feet, ZONE). Tyler Harris misses. Offensive rebound by Tyler Harris! Tyler Harris's putback is no good. Offensive rebound by Tyler Harris! Tyler Harris kicks it out.

[09:26] Team_063 possession (Score: 4-3)
Terry Reaves attempts a 3Pt. Contested by Anfernee Adebayo (5.1 feet, MAN). TERRY REAVES MAKES IT! Assist: Bradley Davis
Score: 4-6

[09:10] Team_057 possession (Score: 4-6)
FOUL! Offensive foul on Ben Adebayo! Dirk Reaves drew the charge! [Team fouls: 4] (Ben Adebayo: 2 personal fouls) TURNOVER! (dead ball)

[08:54] Team_063 possession (Score: 4-6)
Bradley Davis attempts a 3Pt. Contested by Kobe Ming (4.6 feet, ZONE). Bradley Davis misses. Rebound secured by Miles Middleton.

[08:40] Team_057 possession (Score: 4-6)
FOUL! Reach-in foul on Tyler Harris during the drive. [Team fouls: 3] No free throws, side out. (Tyler Harris: 1 personal fouls)

[08:24] Team_057 possession (Score: 4-6)
FOUL! Reach-in foul on Tyler Harris during the drive. [Team fouls: 4] No free throws, side out. (Tyler Harris: 2 personal fouls)

[08:07] Team_057 possession (Score: 4-6)
Miles Middleton makes the Layup and draws the foul on Tyler Harris! And-1! Miles Middleton to the line for 1. [BONUS: 5 team fouls] (Tyler Harris: 3 personal fouls)   FT 1/1: GOOD Miles Middleton makes 1/1 from the line.
Score: 7-6

[07:50] Team_063 possession (Score: 7-6)
Dirk Reaves throws a bad pass! Stolen by Ben Adebayo! TURNOVER! (live ball)

[07:35] Team_057 possession (Score: 7-6)
Ben Adebayo attempts a 3Pt. Contested by Dirk Reaves (4.2 feet, MAN). Ben Adebayo misses. FOUL! Loose ball foul on Malcolm Quickley during the rebound battle. [IN THE BONUS! 6 team fouls] Ben Adebayo to the line for 2 free throws. (Malcolm Quickley: 2 personal fouls)   FT 1/2: GOOD   FT 2/2: MISS Ben Adebayo makes 1/2 from the line. Rebound secured by Tyler Harris.
Score: 8-6

[07:21] Team_063 possession (Score: 8-6)
Dirk Reaves drives, Ben Adebayo stays with him. Dirk Reaves attempts a Layup. Contested by Ben Adebayo (4.7 feet, ZONE). Dirk Reaves misses. Rebound secured by Anfernee Adebayo.

[07:05] Team_057 possession (Score: 8-6)
Klay Rozier attempts a 3Pt. Contested by Malcolm Quickley (3.7 feet, ZONE). Klay Rozier misses. Rebound secured by Dirk Reaves.

[06:55] Team_063 possession (Score: 8-6)
Dirk Reaves drives, Ben Adebayo stays with him. Dirk Reaves attempts a Layup. Contested by Ben Adebayo (4.7 feet, MAN). DIRK REAVES MAKES IT! Assist: Bradley Davis
Score: 8-8

[06:41] Team_057 possession (Score: 8-8)
Miles Middleton attempts a 3Pt. Contested by Malcolm Quickley (3.4 feet, ZONE). Miles Middleton misses. Rebound secured by Tyler Harris.

[06:27] Team_063 possession (Score: 8-8)
FOUL! Offensive foul on Tyler Harris! Miles Middleton drew the charge! [Team fouls: 7] (Tyler Harris: 4 personal fouls) TURNOVER! (dead ball)

[06:10] Team_057 possession (Score: 8-8)
Klay Rozier attempts a Midrange. Contested by Terry Reaves (4.8 feet, ZONE). Klay Rozier misses. Rebound secured by Tyler Harris.

[05:57] Team_063 possession (Score: 8-8)
Tyler Harris loses control! Ball rolls out of bounds! TURNOVER! (dead ball)

[05:45] Team_057 possession (Score: 8-8)
Kobe Ming drives to the basket... Kobe Ming loses control! Ball rolls out of bounds! TURNOVER! (dead ball)

[05:27] Team_063 possession (Score: 8-8)
Terry Reaves attempts a Midrange. Contested by Ben Adebayo (4.7 feet, ZONE). TERRY REAVES MAKES IT! Assist: Dirk Reaves
Score: 8-10

[05:14] Team_057 possession (Score: 8-10)
Kobe Ming attempts a Midrange. Contested by Bradley Davis (5.2 feet, MAN). Kobe Ming misses. Rebound secured by Tyler Harris.

[04:59] Team_063 possession (Score: 8-10)
FOUL! Shooting foul on Kobe Ming. Bradley Davis to the line for 2 free throws. [BONUS: 5 team fouls] (Kobe Ming: 1 personal fouls)   FT 1/2: GOOD   FT 2/2: GOOD Bradley Davis makes 2/2 from the line.
Score: 8-12

[04:49] Team_057 possession (Score: 8-12)
Kobe Ming attempts a 3Pt. Contested by Bradley Davis (5.2 feet, MAN). Kobe Ming misses. Rebound secured by Dirk Reaves.

[04:35] Team_063 possession (Score: 8-12)
Terry Reaves attempts a 3Pt. Contested by Kobe Ming (4.8 feet, ZONE). Terry Reaves misses. Rebound secured by Miles Middleton.

[04:16] Team_057 possession (Score: 8-12)
Klay Rozier attempts a 3Pt. Contested by Malcolm Quickley (3.7 feet, MAN). Klay Rozier misses. Rebound secured by Tyler Harris.

[04:06] Team_063 possession (Score: 8-12)
Terry Reaves attempts a 3Pt. Contested by Kobe Ming (4.8 feet, ZONE). TERRY REAVES MAKES IT! Assist: Bradley Davis
Score: 8-15

[03:50] Team_057 possession (Score: 8-15)
Ben Adebayo attempts a 3Pt. Contested by Dirk Reaves (4.4 feet, MAN). BEN ADEBAYO MAKES IT! Assist: Kobe Ming
Score: 11-15

[03:38] Team_063 possession (Score: 11-15)
Terry Reaves attempts a 3Pt. Contested by Kobe Ming (4.8 feet, ZONE). Terry Reaves misses. Rebound secured by Miles Middleton.

[03:26] Team_057 possession (Score: 11-15)
FOUL! Shooting foul on Bradley Davis. Kobe Ming to the line for 2 free throws. [BONUS: 8 team fouls] (Bradley Davis: 1 personal fouls)   FT 1/2: GOOD   FT 2/2: GOOD Kobe Ming makes 2/2 from the line.
Score: 13-15

[03:14] Team_063 possession (Score: 13-15)
Malcolm Quickley attempts a 3Pt. Contested by Ben Adebayo (4.4 feet, ZONE). Malcolm Quickley misses. Rebound secured by Miles Middleton.

[03:01] Team_057 possession (Score: 13-15)
Anfernee Adebayo attempts a 3Pt. Contested by Terry Reaves (5.3 feet, MAN). Anfernee Adebayo misses. Rebound secured by Tyler Harris.

[02:50] Team_063 possession (Score: 13-15)
Tyler Harris drives to the basket... Tyler Harris throws a bad pass! Stolen by Ben Adebayo! TURNOVER! (live ball)

[02:35] Team_057 possession (Score: 13-15)
FOUL! Offensive foul on Klay Rozier! Malcolm Quickley drew the charge! [Team fouls: 6] (Klay Rozier: 2 personal fouls) TURNOVER! (dead ball)

[02:20] Team_063 possession (Score: 13-15)
Malcolm Quickley attempts a Layup. Contested by Miles Middleton (4.5 feet, ZONE). MALCOLM QUICKLEY MAKES IT! Assist: Terry Reaves
Score: 13-17

[02:05] Team_057 possession (Score: 13-17)
Miles Middleton drives to the basket... Miles Middleton throws a bad pass! Stolen by Tyler Harris! TURNOVER! (live ball)

[01:50] Team_063 possession (Score: 13-17)
Bradley Davis commits a violation (traveling/carry)! TURNOVER! (dead ball)

[01:50] Substitution (Team_057): Kobe Ming OUT → Scottie Johnson IN (stamina_rule2)

[01:50] Substitution (Team_057): Klay Rozier OUT → Bradley Ginobili IN (stamina_rule2)

[01:50] Substitution (Team_057): Anfernee Adebayo OUT → Joel Wade IN (stamina_rule2)

[01:50] Substitution (Team_057): Ben Adebayo OUT → Lamelo Irving IN (stamina_rule2)

[01:50] Substitution (Team_057): Miles Middleton OUT → Zion Lillard IN (stamina_rule2)

[01:50] Substitution (Team_063): Bradley Davis OUT → DeMar Banchero IN (stamina_rule2)

[01:50] Substitution (Team_063): Malcolm Quickley OUT → Cole Durant IN (stamina_rule2)

[01:50] Substitution (Team_063): Terry Reaves OUT → Jaren James IN (stamina_rule2)

[01:50] Substitution (Team_063): Dirk Reaves OUT → Lamelo Ball IN (stamina_rule2)

[01:50] Substitution (Team_063): Tyler Harris OUT → Kyle Green IN (stamina_rule2)

[01:37] Team_057 possession (Score: 13-17)
Bradley Ginobili drives to the basket... Bradley Ginobili throws a bad pass! Stolen by Cole Durant! TURNOVER! (live ball)

[01:22] Team_063 possession (Score: 13-17)
FOUL! Shooting foul on Bradley Ginobili. DeMar Banchero to the line for 2 free throws. [BONUS: 7 team fouls] (Bradley Ginobili: 1 personal fouls)   FT 1/2: MISS   FT 2/2: GOOD DeMar Banchero makes 1/2 from the line.
Score: 13-18

[01:08] Team_057 possession (Score: 13-18)
Lamelo Irving attempts a 3Pt. Contested by Cole Durant (4.8 feet, ZONE). Lamelo Irving misses. FOUL! Loose ball foul on Kyle Green during the rebound battle. [IN THE BONUS! 9 team fouls] Lamelo Irving to the line for 2 free throws. (Kyle Green: 1 personal fouls)   FT 1/2: GOOD   FT 2/2: GOOD Lamelo Irving makes 2/2 from the line.
Score: 15-18

[00:56] Team_063 possession (Score: 15-18)
Cole Durant attempts a Layup. Contested by Bradley Ginobili (5.2 feet, MAN). COLE DURANT MAKES IT!
Score: 15-20

[00:42] Team_057 possession (Score: 15-20)
Scottie Johnson attempts a Midrange. Contested by DeMar Banchero (4.1 feet, MAN). Scottie Johnson misses. Rebound secured by Cole Durant.

[00:29] Team_063 possession (Score: 15-20)
Cole Durant attempts a 3Pt. Contested by Scottie Johnson (5.1 feet, ZONE). Cole Durant misses. FOUL! Loose ball foul on Lamelo Irving during the rebound battle. [IN THE BONUS! 8 team fouls] Lamelo Ball to the line for 2 free throws. (Lamelo Irving: 1 personal fouls)   FT 1/2: GOOD   FT 2/2: GOOD Lamelo Ball makes 2/2 from the line.
Score: 15-22

[00:16] Team_057 possession (Score: 15-22)
Joel Wade attempts a 3Pt. Contested by Jaren James (3.8 feet, MAN). Joel Wade misses. Rebound secured by Kyle Green.

[00:02] Team_063 possession (Score: 15-22)
Jaren James attempts a 3Pt. Contested by Joel Wade (5.5 feet, MAN). Jaren James misses. Rebound secured by Lamelo Irving.

================================================================================
                              1ST QUARTER COMPLETE                              
================================================================================

1ST QUARTER SCORE: Team_057 15, Team_063 22

BOX SCORE:
================================================================================

Team_057
--------------------------------------------------------------------------------
Player                MIN  PTS  REB  AST  TO      FG   FG%      3P   3P%
--------------------------------------------------------------------------------
Ben Adebayo            10    6    1    0   0   2/3    66.7     0/0   0.0
Miles Middleton        10    3    4    0   0   1/3    33.3     0/0   0.0
Kobe Ming              10    2    0    1   0   1/4    25.0     0/0   0.0
Lamelo Irving           2    2    1    0   0   1/1   100.0     0/0   0.0
Anfernee Adebayo       10    0    1    0   0   0/2     0.0     0/0   0.0
Klay Rozier            10    0    0    0   0   0/3     0.0     0/0   0.0
Scottie Johnson         2    0    0    0   0   0/1     0.0     0/0   0.0
Joel Wade               2    0    0    0   0   0/1     0.0     0/0   0.0

TEAM: FG: 5/18 (27.8%), 3PT: 2/9 (22.2%), REB: 8 (1 off, 7 def), AST: 1, TO: 5
TEAM FOULS: 8 [Team_063 in BONUS]


Team_063
--------------------------------------------------------------------------------
Player                MIN  PTS  REB  AST  TO      FG   FG%      3P   3P%
--------------------------------------------------------------------------------
Terry Reaves           10    8    0    1   0   3/5    60.0     0/0   0.0
Bradley Davis          10    5    0    3   0   2/3    66.7     0/0   0.0
Dirk Reaves            10    2    3    2   0   1/3    33.3     0/0   0.0
Malcolm Quickley       10    2    1    0   0   1/2    50.0     0/0   0.0
Cole Durant             2    2    1    0   0   1/1   100.0     0/0   0.0
Lamelo Ball             2    2    0    0   0   1/1   100.0     0/0   0.0
DeMar Banchero          2    1    0    0   0   1/1   100.0     0/0   0.0
Tyler Harris           10    0    7    0   0   0/0     0.0     0/0   0.0
Kyle Green              2    0    1    0   0   0/0     0.0     0/0   0.0
Jaren James             2    0    0    0   0   0/1     0.0     0/0   0.0

TEAM: FG: 10/17 (58.8%), 3PT: 3/8 (37.5%), REB: 12 (1 off, 11 def), AST: 6, TO: 6
TEAM FOULS: 9 [Team_057 in BONUS]

================================================================================

================================================================================
                       2ND QUARTER - Team_057 vs Team_063                       
================================================================================

[12:00] Team_057 possession (Score: 15-22)
Ben Adebayo attempts a 3Pt. Contested by Malcolm Quickley (4.1 feet, ZONE). Ben Adebayo misses. FOUL! Loose ball foul on Malcolm Quickley during the rebound battle. [Team fouls: 1] No free throws, side out. (Malcolm Quickley: 1 personal fouls)

[11:49] Team_057 possession (Score: 15-22)
Miles Middleton attempts a Midrange. Contested by Malcolm Quickley (3.5 feet, ZONE). Miles Middleton misses. Rebound secured by Tyler Harris.

[11:35] Team_063 possession (Score: 15-22)
Tyler Harris drives and kicks out. Dirk Reaves attempts a 3Pt. Contested by Ben Adebayo (4.6 feet, MAN). Dirk Reaves misses. Rebound secured by Anfernee Adebayo.

[11:19] Team_057 possession (Score: 15-22)
Klay Rozier attempts a 3Pt. Contested by Malcolm Quickley (3.8 feet, ZONE). Klay Rozier misses. Rebound secured by Malcolm Quickley.

[11:03] Team_063 possession (Score: 15-22)
Dirk Reaves attempts a Midrange. Contested by Kobe Ming (4.8 feet, ZONE). Dirk Reaves misses. Rebound secured by Ben Adebayo.

[10:51] Team_057 possession (Score: 15-22)
Miles Middleton attempts a Midrange. Contested by Dirk Reaves (3.8 feet, ZONE). Miles Middleton misses. Rebound secured by Tyler Harris.

[10:35] Team_063 possession (Score: 15-22)
FOUL! Reach-in foul on Klay Rozier during the drive. [Team fouls: 1] No free throws, side out. (Klay Rozier: 1 personal fouls)

[10:23] Team_063 possession (Score: 15-22)
Bradley Davis attempts a 3Pt. Contested by Kobe Ming (4.8 feet, ZONE). Bradley Davis misses. Offensive rebound by Dirk Reaves! Dirk Reaves kicks it out.

[10:11] Team_063 possession (Score: 15-22)
Terry Reaves attempts a Layup. Contested by Ben Adebayo (5.0 feet, ZONE). Terry Reaves misses. Rebound secured by Ben Adebayo.

[09:58] Team_057 possession (Score: 15-22)
FOUL! Shooting foul on Tyler Harris. Kobe Ming to the line for 2 free throws. [Team fouls: 2] (Tyler Harris: 1 personal fouls)   FT 1/2: MISS   FT 2/2: GOOD Kobe Ming makes 1/2 from the line.
Score: 16-22

[09:40] Team_063 possession (Score: 16-22)
Bradley Davis attempts a 3Pt. Contested by Kobe Ming (4.9 feet, MAN). BRADLEY DAVIS MAKES IT! Assist: Terry Reaves
Score: 16-25

[09:23] Team_057 possession (Score: 16-25)
FOUL! Shooting foul on Malcolm Quickley. Kobe Ming to the line for 3 free throws. [Team fouls: 3] (Malcolm Quickley: 2 personal fouls)   FT 1/3: GOOD   FT 2/3: GOOD   FT 3/3: GOOD Kobe Ming makes 3/3 from the line.
Score: 19-25

[09:05] Team_063 possession (Score: 19-25)
Tyler Harris drives to the basket... FOUL! Offensive foul on Tyler Harris! Miles Middleton drew the charge! [Team fouls: 4] (Tyler Harris: 2 personal fouls) TURNOVER! (dead ball)

[08:50] Team_057 possession (Score: 19-25)
Kobe Ming attempts a Midrange. Contested by Bradley Davis (5.4 feet, MAN). Kobe Ming misses. Rebound secured by Tyler Harris.

[08:39] Team_063 possession (Score: 19-25)
FOUL! Shooting foul on Kobe Ming. Bradley Davis to the line for 2 free throws. [Team fouls: 2] (Kobe Ming: 1 personal fouls)   FT 1/2: GOOD   FT 2/2: GOOD Bradley Davis makes 2/2 from the line.
Score: 19-27

[08:29] Team_057 possession (Score: 19-27)
FOUL! Shooting foul on Tyler Harris. Miles Middleton to the line for 2 free throws. [BONUS: 5 team fouls] (Tyler Harris: 3 personal fouls)   FT 1/2: GOOD   FT 2/2: GOOD Miles Middleton makes 2/2 from the line.
Score: 21-27

[08:17] Team_063 possession (Score: 21-27)
FOUL! Shooting foul on Ben Adebayo. Dirk Reaves to the line for 2 free throws. [Team fouls: 3] (Ben Adebayo: 1 personal fouls)   FT 1/2: GOOD   FT 2/2: GOOD Dirk Reaves makes 2/2 from the line.
Score: 21-29

[08:05] Team_057 possession (Score: 21-29)
Ben Adebayo attempts a Layup. Contested by Dirk Reaves (4.8 feet, MAN). BEN ADEBAYO MAKES IT! Assist: Miles Middleton
Score: 23-29

[07:46] Team_063 possession (Score: 23-29)
Terry Reaves attempts a 3Pt. Contested by Anfernee Adebayo (5.6 feet, ZONE). Terry Reaves misses. Rebound secured by Ben Adebayo.

[07:28] Team_057 possession (Score: 23-29)
FOUL! Offensive foul on Kobe Ming! Bradley Davis drew the charge! [Team fouls: 4] (Kobe Ming: 2 personal fouls) TURNOVER! (dead ball)

[07:12] Team_063 possession (Score: 23-29)
Bradley Davis attempts a 3Pt. Contested by Kobe Ming (5.2 feet, ZONE). Bradley Davis misses. Rebound secured by Anfernee Adebayo.

[06:57] Team_057 possession (Score: 23-29)
Anfernee Adebayo attempts a 3Pt. Contested by Terry Reaves (5.6 feet, MAN). Anfernee Adebayo misses. Rebound secured by Malcolm Quickley.

[06:39] Team_063 possession (Score: 23-29)
Tyler Harris attempts a 3Pt. Contested by Kobe Ming (4.9 feet, ZONE). Tyler Harris misses. Rebound secured by Ben Adebayo.

[06:27] Team_057 possession (Score: 23-29)
Anfernee Adebayo drives and kicks out. Klay Rozier attempts a 3Pt. Contested by Malcolm Quickley (4.3 feet, MAN). KLAY ROZIER MAKES IT! Assist: Miles Middleton
Score: 26-29

[06:14] Team_063 possession (Score: 26-29)
Tyler Harris attempts a Layup. Contested by Ben Adebayo (5.0 feet, ZONE). Tyler Harris misses. Rebound secured by Miles Middleton.

[05:57] Team_057 possession (Score: 26-29)
FOUL! Shooting foul on Malcolm Quickley. Kobe Ming to the line for 3 free throws. [BONUS: 6 team fouls] (Malcolm Quickley: 3 personal fouls)   FT 1/3: GOOD   FT 2/3: GOOD   FT 3/3: GOOD Kobe Ming makes 3/3 from the line.
Score: 29-29

[05:45] Team_063 possession (Score: 29-29)
Dirk Reaves attempts a 3Pt. Contested by Kobe Ming (5.3 feet, ZONE). Dirk Reaves misses. Rebound secured by Ben Adebayo.

[05:30] Team_057 possession (Score: 29-29)
Anfernee Adebayo attempts a 3Pt. Contested by Bradley Davis (5.9 feet, ZONE). ANFERNEE ADEBAYO MAKES IT! Assist: Miles Middleton
Score: 32-29

[05:13] Team_063 possession (Score: 32-29)
FOUL! Shooting foul on Kobe Ming. Malcolm Quickley to the line for 2 free throws. [BONUS: 5 team fouls] (Kobe Ming: 3 personal fouls)   FT 1/2: GOOD   FT 2/2: GOOD Malcolm Quickley makes 2/2 from the line.
Score: 32-31

[04:58] Team_057 possession (Score: 32-31)
Kobe Ming attempts a 3Pt. Contested by Bradley Davis (5.8 feet, MAN). Kobe Ming misses. Rebound secured by Malcolm Quickley.

[04:43] Team_063 possession (Score: 32-31)
Bradley Davis drives, picks up Kobe Ming. Help arrives from Klay Rozier! Bradley Davis attempts a Dunk. Contested by Klay Rozier (5.4 feet, MAN). BRADLEY DAVIS MAKES IT!
Score: 32-33

[04:30] Team_057 possession (Score: 32-33)
Ben Adebayo attempts a 3Pt. Contested by Malcolm Quickley (4.9 feet, ZONE). Ben Adebayo misses. Rebound secured by Tyler Harris.

[04:14] Team_063 possession (Score: 32-33)
Terry Reaves throws a bad pass out of bounds! TURNOVER! (dead ball)

[04:14] Substitution (Team_057): Kobe Ming OUT → Scottie Johnson IN (stamina_rule2)

[04:14] Substitution (Team_057): Klay Rozier OUT → Bradley Ginobili IN (stamina_rule2)

[04:14] Substitution (Team_057): Anfernee Adebayo OUT → Joel Wade IN (stamina_rule2)

[04:14] Substitution (Team_057): Ben Adebayo OUT → Lamelo Irving IN (stamina_rule2)

[04:14] Substitution (Team_057): Miles Middleton OUT → Zion Lillard IN (stamina_rule2)

[04:14] Substitution (Team_063): Bradley Davis OUT → DeMar Banchero IN (stamina_rule2)

[04:14] Substitution (Team_063): Malcolm Quickley OUT → Cole Durant IN (stamina_rule2)

[04:14] Substitution (Team_063): Terry Reaves OUT → Jaren James IN (stamina_rule2)

[04:14] Substitution (Team_063): Dirk Reaves OUT → Lamelo Ball IN (stamina_rule2)

[04:14] Substitution (Team_063): Tyler Harris OUT → Kyle Green IN (stamina_rule2)

[03:59] Team_057 possession (Score: 32-33)
Lamelo Irving attempts a Layup. Contested by Lamelo Ball (5.4 feet, MAN). LAMELO IRVING MAKES IT!
Score: 34-33

[03:46] Team_063 possession (Score: 34-33)
Cole Durant attempts a 3Pt. Contested by Bradley Ginobili (5.2 feet, MAN). Cole Durant misses. Rebound secured by Joel Wade.

[03:28] Team_057 possession (Score: 34-33)
Lamelo Irving attempts a Midrange. Contested by Lamelo Ball (5.4 feet, ZONE). LAMELO IRVING MAKES IT! Assist: Joel Wade
Score: 36-33

[03:15] Team_063 possession (Score: 36-33)
Kyle Green drives and kicks out. Kyle Green attempts a 3Pt. Contested by Zion Lillard (3.6 feet, MAN). Kyle Green misses. Offensive rebound by Kyle Green! Kyle Green's putback is no good. Rebound secured by Lamelo Irving.

[02:58] Team_057 possession (Score: 36-33)
Bradley Ginobili attempts a Layup. Contested by Cole Durant (4.5 feet, MAN). BRADLEY GINOBILI MAKES IT!
Score: 38-33

[02:41] Team_063 possession (Score: 38-33)
FOUL! Shooting foul on Scottie Johnson. DeMar Banchero to the line for 2 free throws. [BONUS: 6 team fouls] (Scottie Johnson: 1 personal fouls)   FT 1/2: GOOD   FT 2/2: GOOD DeMar Banchero makes 2/2 from the line.
Score: 38-35

[02:26] Team_057 possession (Score: 38-35)
Zion Lillard drives, picks up Kyle Green. Help arrives from Cole Durant! Zion Lillard attempts a Layup. Contested by Cole Durant (4.6 feet, MAN). ZION LILLARD MAKES IT! Assist: Bradley Ginobili
Score: 40-35

[02:10] Team_063 possession (Score: 40-35)
Lamelo Ball drives, Lamelo Irving stays with him. Lamelo Ball attempts a Dunk. Contested by Lamelo Irving (5.1 feet, MAN). LAMELO BALL MAKES IT! Assist: DeMar Banchero
Score: 40-37

[01:58] Team_057 possession (Score: 40-37)
Lamelo Irving attempts a Layup. Contested by Kyle Green (5.1 feet, ZONE). Lamelo Irving misses. Rebound secured by Kyle Green.

[01:48] Team_063 possession (Score: 40-37)
Kyle Green drives to the basket... FOUL! Offensive foul on Kyle Green! Zion Lillard drew the charge! [Team fouls: 7] (Kyle Green: 1 personal fouls) TURNOVER! (dead ball)

[01:30] Team_057 possession (Score: 40-37)
Zion Lillard attempts a Midrange. Contested by Kyle Green (4.6 feet, MAN). ZION LILLARD MAKES IT!
Score: 42-37

[01:16] Team_063 possession (Score: 42-37)
DeMar Banchero attempts a Midrange. Contested by Scottie Johnson (5.1 feet, MAN). DeMar Banchero misses. Rebound secured by Joel Wade.

[01:02] Team_057 possession (Score: 42-37)
Zion Lillard drives, Kyle Green stays with him. Zion Lillard attempts a Dunk. Contested by Kyle Green (4.6 feet, ZONE). ZION LILLARD MAKES IT! Assist: Bradley Ginobili
Score: 44-37

[00:50] Team_063 possession (Score: 44-37)
FOUL! Holding foul on Scottie Johnson. [IN THE BONUS! 7 team fouls] DeMar Banchero to the line for 2 free throws. (Scottie Johnson: 2 personal fouls)   FT 1/2: MISS   FT 2/2: GOOD DeMar Banchero makes 1/2 from the line.
Score: 44-38

[00:32] Team_057 possession (Score: 44-38)
Zion Lillard drives, Kyle Green stays with him. Zion Lillard attempts a Dunk. Contested by Kyle Green (4.6 feet, ZONE). ZION LILLARD MAKES IT! Assist: Scottie Johnson
Score: 46-38

[00:17] Team_063 possession (Score: 46-38)
DeMar Banchero attempts a 3Pt. Contested by Scottie Johnson (5.1 feet, ZONE). DeMar Banchero misses. Rebound secured by Joel Wade.

[00:03] Team_057 possession (Score: 46-38)
Zion Lillard attempts a 3Pt. Contested by Lamelo Ball (4.9 feet, ZONE). Zion Lillard misses. Rebound secured by Lamelo Ball.

================================================================================
                              2ND QUARTER COMPLETE                              
================================================================================

2ND QUARTER SCORE: Team_057 31, Team_063 16

BOX SCORE:
================================================================================

Team_057
--------------------------------------------------------------------------------
Player                MIN  PTS  REB  AST  TO      FG   FG%      3P   3P%
--------------------------------------------------------------------------------
Zion Lillard            6    8    0    0   0   4/5    80.0     0/0   0.0
Kobe Ming              18    7    0    0   0   3/5    60.0     0/0   0.0
Lamelo Irving           6    4    1    0   0   2/3    66.7     0/0   0.0
Anfernee Adebayo       18    3    2    0   0   1/2    50.0     0/0   0.0
Klay Rozier            18    3    0    0   0   1/2    50.0     0/0   0.0
Miles Middleton        18    2    2    3   0   1/3    33.3     0/0   0.0
Ben Adebayo            18    2    5    0   0   1/2    50.0     0/0   0.0
Bradley Ginobili        6    2    0    2   0   1/1   100.0     0/0   0.0
Joel Wade               6    0    3    1   0   0/0     0.0     0/0   0.0
Scottie Johnson         6    0    0    1   0   0/0     0.0     0/0   0.0

TEAM: FG: 14/23 (60.9%), 3PT: 3/8 (37.5%), REB: 12 (1 off, 11 def), AST: 7, TO: 1
TEAM FOULS: 7 [Team_063 in BONUS]


Team_063
--------------------------------------------------------------------------------
Player                MIN  PTS  REB  AST  TO      FG   FG%      3P   3P%
--------------------------------------------------------------------------------
Bradley Davis          18    7    0    0   0   3/4    75.0     0/0   0.0
DeMar Banchero          6    3    0    1   0   2/4    50.0     0/0   0.0
Malcolm Quickley       18    2    3    0   0   1/1   100.0     0/0   0.0
Dirk Reaves            18    2    1    0   0   1/3    33.3     0/0   0.0
Lamelo Ball             6    2    1    0   0   1/1   100.0     0/0   0.0
Tyler Harris           18    0    4    0   0   0/3     0.0     0/0   0.0
Terry Reaves           18    0    0    1   0   0/2     0.0     0/0   0.0
Cole Durant             6    0    0    0   0   0/1     0.0     0/0   0.0
Kyle Green              6    0    1    0   0   0/1     0.0     0/0   0.0

TEAM: FG: 8/20 (40.0%), 3PT: 1/7 (14.3%), REB: 11 (2 off, 9 def), AST: 2, TO: 3
TEAM FOULS: 7 [Team_057 in BONUS]

================================================================================

================================================================================
                       3RD QUARTER - Team_057 vs Team_063                       
================================================================================

[12:00] Team_057 possession (Score: 46-38)
Kobe Ming throws a bad pass! Stolen by Bradley Davis! TURNOVER! (live ball)

[11:45] Team_063 possession (Score: 46-38)
Tyler Harris attempts a Midrange. Contested by Ben Adebayo (4.4 feet, ZONE). Tyler Harris misses. Rebound secured by Ben Adebayo.

[11:32] Team_057 possession (Score: 46-38)
Kobe Ming drives, Tyler Harris stays with him. Kobe Ming attempts a Dunk. Contested by Tyler Harris (4.7 feet, ZONE). Kobe Ming misses. Rebound secured by Malcolm Quickley.

[11:19] Team_063 possession (Score: 46-38)
Terry Reaves attempts a 3Pt. Contested by Kobe Ming (4.7 feet, ZONE). Terry Reaves misses. Offensive rebound by Dirk Reaves! Dirk Reaves puts it back in!
Score: 46-40

[11:04] Team_057 possession (Score: 46-40)
Miles Middleton attempts a 3Pt. Contested by Malcolm Quickley (3.4 feet, ZONE). Miles Middleton misses. Rebound secured by Tyler Harris.

[10:47] Team_063 possession (Score: 46-40)
Dirk Reaves loses control! Ball rolls out of bounds! TURNOVER! (dead ball)

[10:36] Team_057 possession (Score: 46-40)
Miles Middleton attempts a Layup. BLOCKED BY TYLER HARRIS! Ball deflects out of bounds off Miles Middleton.

[10:22] Team_063 possession (Score: 46-40)
Terry Reaves drives, picks up Ben Adebayo. Help arrives from Klay Rozier! Terry Reaves attempts a Layup. Contested by Klay Rozier (4.7 feet, ZONE). TERRY REAVES MAKES IT!
Score: 46-42

[10:08] Team_057 possession (Score: 46-42)
Anfernee Adebayo attempts a 3Pt. Contested by Malcolm Quickley (4.0 feet, ZONE). Anfernee Adebayo misses. Rebound secured by Malcolm Quickley.

[09:54] Team_063 possession (Score: 46-42)
Dirk Reaves drives and kicks out. Malcolm Quickley attempts a 3Pt. Contested by Kobe Ming (4.4 feet, ZONE). Malcolm Quickley misses. Rebound secured by Ben Adebayo.

[09:37] Team_057 possession (Score: 46-42)
Miles Middleton attempts a Layup. Contested by Tyler Harris (4.3 feet, MAN). MILES MIDDLETON MAKES IT!
Score: 48-42

[09:23] Team_063 possession (Score: 48-42)
Bradley Davis attempts a 3Pt. Contested by Kobe Ming (4.6 feet, MAN). Bradley Davis misses. Rebound secured by Anfernee Adebayo.

[09:09] Team_057 possession (Score: 48-42)
Anfernee Adebayo attempts a Midrange. Contested by Terry Reaves (5.1 feet, MAN). ANFERNEE ADEBAYO MAKES IT! Assist: Miles Middleton
Score: 50-42

[08:58] Team_063 possession (Score: 50-42)
Dirk Reaves attempts a 3Pt. Contested by Kobe Ming (4.7 feet, ZONE). DIRK REAVES MAKES IT! Assist: Terry Reaves
Score: 50-45

[08:42] Team_057 possession (Score: 50-45)
Kobe Ming attempts a Layup. BLOCKED BY TYLER HARRIS! Ball is loose! Offensive rebound by Ben Adebayo! Ben Adebayo kicks it out.

[08:26] Team_057 possession (Score: 50-45)
FOUL! Shooting foul on Malcolm Quickley. Ben Adebayo to the line for 3 free throws. [Team fouls: 1] (Malcolm Quickley: 1 personal fouls)   FT 1/3: GOOD   FT 2/3: GOOD   FT 3/3: MISS Ben Adebayo makes 2/3 from the line. Rebound secured by Dirk Reaves.
Score: 52-45

[08:10] Team_063 possession (Score: 52-45)
Tyler Harris drives to the basket... Tyler Harris throws a bad pass! Stolen by Miles Middleton! TURNOVER! (live ball)

[07:58] Team_057 possession (Score: 52-45)
Miles Middleton attempts a Layup. Contested by Tyler Harris (4.3 feet, MAN). Miles Middleton misses. Rebound secured by Malcolm Quickley.

[07:49] Team_063 possession (Score: 52-45)
Terry Reaves drives, Ben Adebayo stays with him. Terry Reaves attempts a Layup. Contested by Ben Adebayo (4.7 feet, ZONE). TERRY REAVES MAKES IT!
Score: 52-47

[07:32] Team_057 possession (Score: 52-47)
FOUL! Offensive foul on Anfernee Adebayo! Terry Reaves drew the charge! [Team fouls: 1] (Anfernee Adebayo: 1 personal fouls) TURNOVER! (dead ball)

[07:20] Team_063 possession (Score: 52-47)
Terry Reaves drives and kicks out. Bradley Davis attempts a 3Pt. Contested by Kobe Ming (4.4 feet, ZONE). Bradley Davis misses. Rebound secured by Anfernee Adebayo.

[07:07] Team_057 possession (Score: 52-47)
Miles Middleton attempts a Layup. Contested by Tyler Harris (4.3 feet, MAN). Miles Middleton misses. Rebound secured by Malcolm Quickley.

[06:51] Team_063 possession (Score: 52-47)
Tyler Harris drives to the basket... Tyler Harris commits a violation (traveling/carry)! TURNOVER! (dead ball)

[06:36] Team_057 possession (Score: 52-47)
FOUL! Reach-in foul on Terry Reaves during the drive. [Team fouls: 2] No free throws, side out. (Terry Reaves: 1 personal fouls)

[06:21] Team_057 possession (Score: 52-47)
Anfernee Adebayo attempts a 3Pt. Contested by Terry Reaves (5.1 feet, MAN). Anfernee Adebayo misses. Rebound secured by Dirk Reaves.

[06:07] Team_063 possession (Score: 52-47)
Bradley Davis drives, Miles Middleton stays with him. Bradley Davis attempts a Layup. Contested by Miles Middleton (4.6 feet, ZONE). BRADLEY DAVIS MAKES IT!
Score: 52-49

[05:48] Team_057 possession (Score: 52-49)
Ben Adebayo attempts a Midrange. Contested by Terry Reaves (5.1 feet, ZONE). Ben Adebayo misses. Rebound secured by Malcolm Quickley.

[05:32] Team_063 possession (Score: 52-49)
Malcolm Quickley drives to the basket... Malcolm Quickley throws a bad pass out of bounds! TURNOVER! (dead ball)

[05:16] Team_057 possession (Score: 52-49)
Anfernee Adebayo attempts a 3Pt. Contested by Terry Reaves (5.1 feet, MAN). ANFERNEE ADEBAYO MAKES IT! Assist: Klay Rozier
Score: 55-49

[05:03] Team_063 possession (Score: 55-49)
FOUL! Holding foul on Klay Rozier. [Team fouls: 2] No free throws, side out. (Klay Rozier: 1 personal fouls)

[04:45] Team_063 possession (Score: 55-49)
Dirk Reaves attempts a Midrange. Contested by Anfernee Adebayo (5.1 feet, ZONE). Dirk Reaves misses. Offensive rebound by Dirk Reaves! Dirk Reaves puts it back in!
Score: 55-51

[04:29] Team_057 possession (Score: 55-51)
Ben Adebayo loses the ball! Stripped by Dirk Reaves! TURNOVER! (live ball)

[04:14] Team_063 possession (Score: 55-51)
Terry Reaves attempts a Layup. BLOCKED BY BEN ADEBAYO! Ball is loose! Rebound secured by Ben Adebayo.

[04:00] Team_057 possession (Score: 55-51)
Anfernee Adebayo attempts a Midrange. Contested by Terry Reaves (5.2 feet, MAN). Anfernee Adebayo misses. Rebound secured by Tyler Harris.

[03:50] Team_063 possession (Score: 55-51)
Tyler Harris commits a violation (traveling/carry)! TURNOVER! (dead ball)

[03:37] Team_057 possession (Score: 55-51)
Kobe Ming attempts a 3Pt. Contested by Bradley Davis (5.3 feet, MAN). Kobe Ming misses. Rebound secured by Tyler Harris.

[03:22] Team_063 possession (Score: 55-51)
Tyler Harris attempts a Midrange. Contested by Miles Middleton (4.5 feet, MAN). TYLER HARRIS MAKES IT! Assist: Dirk Reaves
Score: 55-53

[03:08] Team_057 possession (Score: 55-53)
Klay Rozier attempts a Midrange. Contested by Malcolm Quickley (3.9 feet, MAN). Klay Rozier misses. Rebound secured by Malcolm Quickley.

[02:55] Team_063 possession (Score: 55-53)
Terry Reaves attempts a Layup. BLOCKED BY BEN ADEBAYO! Ball is loose! Rebound secured by Ben Adebayo.

[02:40] Team_057 possession (Score: 55-53)
Anfernee Adebayo drives, Tyler Harris stays with him. Anfernee Adebayo attempts a Dunk. Contested by Tyler Harris (5.1 feet, ZONE). ANFERNEE ADEBAYO MAKES IT! Assist: Ben Adebayo
Score: 57-53

[02:25] Team_063 possession (Score: 57-53)
Terry Reaves attempts a 3Pt. Contested by Klay Rozier (4.2 feet, ZONE). Terry Reaves misses. Rebound secured by Ben Adebayo.

[02:13] Team_057 possession (Score: 57-53)
FOUL! Reach-in foul on Tyler Harris during the drive. [Team fouls: 3] No free throws, side out. (Tyler Harris: 1 personal fouls)

[01:55] Team_057 possession (Score: 57-53)
Miles Middleton attempts a Midrange. Contested by Tyler Harris (4.6 feet, MAN). Miles Middleton misses. Offensive rebound by Ben Adebayo! Ben Adebayo kicks it out.

[01:44] Team_057 possession (Score: 57-53)
Anfernee Adebayo drives and kicks out. Miles Middleton attempts a Midrange. Contested by Tyler Harris (4.8 feet, MAN). Miles Middleton misses. Rebound secured by Dirk Reaves.

[01:29] Team_063 possession (Score: 57-53)
FOUL! Holding foul on Ben Adebayo. [Team fouls: 3] No free throws, side out. (Ben Adebayo: 1 personal fouls)

[01:15] Team_063 possession (Score: 57-53)
Terry Reaves attempts a 3Pt. Contested by Anfernee Adebayo (5.5 feet, MAN). Terry Reaves misses. Rebound secured by Ben Adebayo.

[01:04] Team_057 possession (Score: 57-53)
Klay Rozier attempts a 3Pt. Contested by Malcolm Quickley (4.1 feet, ZONE). Klay Rozier misses. Offensive rebound by Ben Adebayo! Ben Adebayo kicks it out.

[00:49] Team_057 possession (Score: 57-53)
Anfernee Adebayo attempts a 3Pt. Contested by Terry Reaves (5.5 feet, MAN). Anfernee Adebayo misses. Rebound secured by Dirk Reaves.

[00:33] Team_063 possession (Score: 57-53)
Dirk Reaves attempts a Midrange. Contested by Ben Adebayo (5.1 feet, MAN). Dirk Reaves misses. Rebound secured by Ben Adebayo.

[00:21] Team_057 possession (Score: 57-53)
Anfernee Adebayo attempts a 3Pt. Contested by Malcolm Quickley (4.5 feet, ZONE). Anfernee Adebayo misses. Rebound secured by Tyler Harris.

[00:02] Team_063 possession (Score: 57-53)
FOUL! Shooting foul on Ben Adebayo. Tyler Harris to the line for 2 free throws. [Team fouls: 4] (Ben Adebayo: 2 personal fouls)   FT 1/2: GOOD   FT 2/2: MISS Tyler Harris makes 1/2 from the line. FOUL! Loose ball foul on Ben Adebayo during the free throw rebound! [IN THE BONUS! 5 team fouls] Dirk Reaves to the line for 2 free throws. (Ben Adebayo: 3 personal fouls)   FT 1/2: GOOD   FT 2/2: MISS Dirk Reaves makes 1/2 from the line. Rebound secured by Anfernee Adebayo.
Score: 57-55

================================================================================
                              3RD QUARTER COMPLETE                              
================================================================================

3RD QUARTER SCORE: Team_057 11, Team_063 17

BOX SCORE:
================================================================================

Team_057
--------------------------------------------------------------------------------
Player                MIN  PTS  REB  AST  TO      FG   FG%      3P   3P%
--------------------------------------------------------------------------------
Anfernee Adebayo       31    7    3    0   0   3/9    33.3     0/0   0.0
Miles Middleton        31    2    0    1   0   1/5    20.0     0/0   0.0
Ben Adebayo            31    0   10    1   0   0/2     0.0     0/0   0.0
Kobe Ming              31    0    0    0   0   0/2     0.0     0/0   0.0
Klay Rozier            31    0    0    1   0   0/1     0.0     0/0   0.0

TEAM: FG: 4/19 (21.1%), 3PT: 1/8 (12.5%), REB: 13 (3 off, 10 def), AST: 3, TO: 3
TEAM FOULS: 5 [Team_063 in BONUS]


Team_063
--------------------------------------------------------------------------------
Player                MIN  PTS  REB  AST  TO      FG   FG%      3P   3P%
--------------------------------------------------------------------------------
Dirk Reaves            31    7    6    1   0   3/5    60.0     0/0   0.0
Terry Reaves           31    4    0    1   0   2/7    28.6     0/0   0.0
Tyler Harris           31    2    4    0   0   1/3    33.3     0/0   0.0
Bradley Davis          31    2    0    0   0   1/2    50.0     0/0   0.0
Malcolm Quickley       31    0    6    0   0   0/0     0.0     0/0   0.0

TEAM: FG: 7/17 (41.2%), 3PT: 2/5 (40.0%), REB: 16 (2 off, 14 def), AST: 2, TO: 5
TEAM FOULS: 3

================================================================================

================================================================================
                       4TH QUARTER - Team_057 vs Team_063                       
================================================================================

[12:00] Team_057 possession (Score: 57-55)
Anfernee Adebayo attempts a 3Pt. Contested by Terry Reaves (5.4 feet, MAN). Anfernee Adebayo misses. Rebound secured by Malcolm Quickley.

[11:44] Team_063 possession (Score: 57-55)
FOUL! Holding foul on Kobe Ming. [Team fouls: 1] No free throws, side out. (Kobe Ming: 1 personal fouls)

[11:28] Team_063 possession (Score: 57-55)
Malcolm Quickley attempts a 3Pt. Contested by Kobe Ming (4.6 feet, ZONE). MALCOLM QUICKLEY MAKES IT! Assist: Bradley Davis
Score: 57-58

[11:15] Team_057 possession (Score: 57-58)
Miles Middleton makes the Dunk and draws the foul on Malcolm Quickley! And-1! Miles Middleton to the line for 1. [Team fouls: 1] (Malcolm Quickley: 1 personal fouls)   FT 1/1: GOOD Miles Middleton makes 1/1 from the line.
Score: 60-58

[10:57] Team_063 possession (Score: 60-58)
Tyler Harris attempts a Layup. Contested by Ben Adebayo (4.8 feet, ZONE). TYLER HARRIS MAKES IT!
Score: 60-60

[10:44] Team_057 possession (Score: 60-60)
Klay Rozier attempts a 3Pt. Contested by Malcolm Quickley (4.1 feet, ZONE). Klay Rozier misses. Rebound secured by Tyler Harris.

[10:33] Team_063 possession (Score: 60-60)
Tyler Harris drives, picks up Miles Middleton. Help arrives from Klay Rozier! Tyler Harris attempts a Layup. Contested by Klay Rozier (4.8 feet, MAN). Tyler Harris misses. Rebound secured by Ben Adebayo.

[10:19] Team_057 possession (Score: 60-60)
FOUL! Reach-in foul on Tyler Harris during the drive. [Team fouls: 2] No free throws, side out. (Tyler Harris: 1 personal fouls)

[10:04] Team_057 possession (Score: 60-60)
Ben Adebayo makes the Layup and draws the foul on Malcolm Quickley! And-1! Ben Adebayo to the line for 1. [Team fouls: 3] (Malcolm Quickley: 2 personal fouls)   FT 1/1: GOOD Ben Adebayo makes 1/1 from the line.
Score: 63-60

[09:49] Team_063 possession (Score: 63-60)
Dirk Reaves attempts a Midrange. BLOCKED BY KLAY ROZIER! Ball goes out off Klay Rozier. Dirk Reaves's ball!

[09:30] Team_063 possession (Score: 63-60)
Dirk Reaves attempts a Midrange. Contested by Ben Adebayo (5.2 feet, MAN). Dirk Reaves misses. Rebound secured by Miles Middleton.

[09:16] Team_057 possession (Score: 63-60)
Anfernee Adebayo attempts a 3Pt. Contested by Malcolm Quickley (4.6 feet, ZONE). ANFERNEE ADEBAYO MAKES IT!
Score: 66-60

[09:00] Team_063 possession (Score: 66-60)
Tyler Harris makes the Layup and draws the foul on Ben Adebayo! And-1! Tyler Harris to the line for 1. [Team fouls: 2] (Ben Adebayo: 1 personal fouls)   FT 1/1: MISS Tyler Harris makes 0/1 from the line. Rebound secured by Ben Adebayo.
Score: 66-62

[08:47] Team_057 possession (Score: 66-62)
Ben Adebayo makes the Layup and draws the foul on Dirk Reaves! And-1! Ben Adebayo to the line for 1. [Team fouls: 4] (Dirk Reaves: 1 personal fouls)   FT 1/1: MISS Ben Adebayo makes 0/1 from the line. Rebound secured by Malcolm Quickley.
Score: 68-62

[08:36] Team_063 possession (Score: 68-62)
Terry Reaves attempts a Midrange. Contested by Anfernee Adebayo (5.8 feet, MAN). Terry Reaves misses. Rebound secured by Miles Middleton.

[08:19] Team_057 possession (Score: 68-62)
Miles Middleton drives, Tyler Harris stays with him. Miles Middleton attempts a Dunk. Contested by Tyler Harris (5.1 feet, MAN). MILES MIDDLETON MAKES IT!
Score: 70-62

[08:00] Team_063 possession (Score: 70-62)
Tyler Harris attempts a Layup. Contested by Miles Middleton (5.1 feet, MAN). TYLER HARRIS MAKES IT! Assist: Bradley Davis
Score: 70-64

[07:49] Team_057 possession (Score: 70-64)
Klay Rozier attempts a 3Pt. Contested by Malcolm Quickley (4.5 feet, MAN). KLAY ROZIER MAKES IT! Assist: Ben Adebayo
Score: 73-64

[07:34] Team_063 possession (Score: 73-64)
Tyler Harris attempts a 3Pt. Contested by Miles Middleton (5.2 feet, MAN). Tyler Harris misses. Rebound secured by Miles Middleton.

[07:21] Team_057 possession (Score: 73-64)
Miles Middleton attempts a Midrange. Contested by Tyler Harris (5.2 feet, MAN). Miles Middleton misses. Rebound secured by Malcolm Quickley.

[07:04] Team_063 possession (Score: 73-64)
Terry Reaves makes the Layup and draws the foul on Anfernee Adebayo! And-1! Terry Reaves to the line for 1. [Team fouls: 3] (Anfernee Adebayo: 1 personal fouls)   FT 1/1: GOOD Terry Reaves makes 1/1 from the line.
Score: 73-67

[06:50] Team_057 possession (Score: 73-67)
FOUL! Holding foul on Dirk Reaves. [IN THE BONUS! 5 team fouls] Ben Adebayo to the line for 2 free throws. (Dirk Reaves: 2 personal fouls)   FT 1/2: GOOD   FT 2/2: GOOD Ben Adebayo makes 2/2 from the line.
Score: 75-67

[06:36] Team_063 possession (Score: 75-67)
Bradley Davis attempts a Midrange. Contested by Klay Rozier (4.9 feet, ZONE). BRADLEY DAVIS MAKES IT!
Score: 75-69

[06:20] Team_057 possession (Score: 75-69)
FOUL! Offensive foul on Miles Middleton! Tyler Harris drew the charge! [Team fouls: 4] (Miles Middleton: 1 personal fouls) TURNOVER! (dead ball)

[06:05] Team_063 possession (Score: 75-69)
Tyler Harris attempts a Midrange. Contested by Miles Middleton (5.4 feet, MAN). TYLER HARRIS MAKES IT!
Score: 75-71

[05:53] Team_057 possession (Score: 75-71)
Klay Rozier attempts a Midrange. Contested by Malcolm Quickley (4.8 feet, MAN). KLAY ROZIER MAKES IT!
Score: 77-71

[05:37] Team_063 possession (Score: 77-71)
Malcolm Quickley attempts a 3Pt. Contested by Kobe Ming (5.3 feet, ZONE). Malcolm Quickley misses. Rebound secured by Ben Adebayo.

[05:24] Team_057 possession (Score: 77-71)
Anfernee Adebayo drives and kicks out. Klay Rozier attempts a Midrange. Contested by Malcolm Quickley (4.9 feet, MAN). Klay Rozier misses. FOUL! Loose ball foul on Tyler Harris during the rebound battle. [IN THE BONUS! 6 team fouls] Miles Middleton to the line for 2 free throws. (Tyler Harris: 2 personal fouls)   FT 1/2: MISS   FT 2/2: MISS Miles Middleton makes 0/2 from the line. FOUL! Loose ball foul on Tyler Harris during the free throw rebound! [IN THE BONUS! 7 team fouls] Miles Middleton to the line for 2 free throws. (Tyler Harris: 3 personal fouls)   FT 1/2: GOOD   FT 2/2: GOOD Miles Middleton makes 2/2 from the line.
Score: 79-71

[05:11] Team_063 possession (Score: 79-71)
Dirk Reaves attempts a Midrange. Contested by Klay Rozier (5.1 feet, ZONE). DIRK REAVES MAKES IT!
Score: 79-73

[04:56] Team_057 possession (Score: 79-73)
Anfernee Adebayo throws a bad pass! Stolen by Terry Reaves! TURNOVER! (live ball)

[04:44] Team_063 possession (Score: 79-73)
Dirk Reaves makes the Layup and draws the foul on Ben Adebayo! And-1! Dirk Reaves to the line for 1. [BONUS: 5 team fouls] (Ben Adebayo: 2 personal fouls)   FT 1/1: GOOD Dirk Reaves makes 1/1 from the line.
Score: 79-76

[04:28] Team_057 possession (Score: 79-76)
Kobe Ming makes the Midrange and draws the foul on Malcolm Quickley! And-1! Kobe Ming to the line for 1. [BONUS: 8 team fouls] (Malcolm Quickley: 3 personal fouls)   FT 1/1: GOOD Kobe Ming makes 1/1 from the line.
Score: 82-76

[04:11] Team_063 possession (Score: 82-76)
Terry Reaves drives and kicks out. Bradley Davis attempts a Midrange. Contested by Kobe Ming (5.9 feet, MAN). Bradley Davis misses. Rebound secured by Miles Middleton.

[03:55] Team_057 possession (Score: 82-76)
FOUL! Reach-in foul on Tyler Harris during the drive. [IN THE BONUS! 9 team fouls] Anfernee Adebayo to the line for 2 free throws. (Tyler Harris: 4 personal fouls)   FT 1/2: MISS   FT 2/2: GOOD Anfernee Adebayo makes 1/2 from the line.
Score: 83-76

[03:41] Team_063 possession (Score: 83-76)
Tyler Harris attempts a 3Pt. Contested by Klay Rozier (5.1 feet, ZONE). Tyler Harris misses. Rebound secured by Ben Adebayo.

[03:27] Team_057 possession (Score: 83-76)
FOUL! Reach-in foul on Tyler Harris during the drive. [IN THE BONUS! 10 team fouls] Miles Middleton to the line for 2 free throws. (Tyler Harris: 5 personal fouls)   FT 1/2: GOOD   FT 2/2: GOOD Miles Middleton makes 2/2 from the line.
Score: 85-76

[03:11] Team_063 possession (Score: 85-76)
FOUL! Reach-in foul on Miles Middleton during the drive. [IN THE BONUS! 6 team fouls] Tyler Harris to the line for 2 free throws. (Miles Middleton: 2 personal fouls)   FT 1/2: GOOD   FT 2/2: GOOD Tyler Harris makes 2/2 from the line.
Score: 85-78

[02:55] Team_057 possession (Score: 85-78)
Miles Middleton attempts a Midrange. Contested by Tyler Harris (5.9 feet, MAN). MILES MIDDLETON MAKES IT!
Score: 87-78

[02:38] Team_063 possession (Score: 87-78)
Dirk Reaves attempts a Midrange. Contested by Klay Rozier (5.5 feet, ZONE). Dirk Reaves misses. Rebound secured by Anfernee Adebayo.

[02:23] Team_057 possession (Score: 87-78)
Kobe Ming attempts a Midrange. Wide open! Bradley Davis is 6.4 feet away. [MAN] KOBE MING MAKES IT!
Score: 89-78

[02:07] Team_063 possession (Score: 89-78)
Tyler Harris drives, Miles Middleton stays with him. Tyler Harris attempts a Layup. Contested by Miles Middleton (6.0 feet, MAN). Tyler Harris misses. Rebound secured by Miles Middleton.

[01:53] Team_057 possession (Score: 89-78)
Ben Adebayo attempts a 3Pt. Wide open! Bradley Davis is 6.6 feet away. [ZONE] BEN ADEBAYO MAKES IT!
Score: 92-78

[01:40] Team_063 possession (Score: 92-78)
Terry Reaves attempts a 3Pt. Wide open! Anfernee Adebayo is 6.7 feet away. [MAN] Terry Reaves misses. Rebound secured by Ben Adebayo.

[01:23] Team_057 possession (Score: 92-78)
Anfernee Adebayo throws a bad pass out of bounds! TURNOVER! (dead ball)

[01:23] Substitution (Team_057): Kobe Ming OUT → Scottie Johnson IN (stamina_rule2)

[01:23] Substitution (Team_057): Klay Rozier OUT → Bradley Ginobili IN (stamina_rule2)

[01:23] Substitution (Team_057): Anfernee Adebayo OUT → Joel Wade IN (stamina_rule2)

[01:23] Substitution (Team_057): Ben Adebayo OUT → Lamelo Irving IN (stamina_rule2)

[01:23] Substitution (Team_057): Miles Middleton OUT → Zion Lillard IN (stamina_rule2)

[01:23] Substitution (Team_063): Bradley Davis OUT → DeMar Banchero IN (stamina_rule2)

[01:23] Substitution (Team_063): Malcolm Quickley OUT → Cole Durant IN (stamina_rule2)

[01:23] Substitution (Team_063): Terry Reaves OUT → Jaren James IN (stamina_rule2)

[01:23] Substitution (Team_063): Dirk Reaves OUT → Lamelo Ball IN (stamina_rule2)

[01:23] Substitution (Team_063): Tyler Harris OUT → Kyle Green IN (stamina_rule2)

[01:11] Team_063 possession (Score: 92-78)
Kyle Green drives to the basket... Kyle Green throws a bad pass out of bounds! TURNOVER! (dead ball)

[00:55] Team_057 possession (Score: 92-78)
Joel Wade attempts a 3Pt. Contested by Jaren James (3.8 feet, MAN). Joel Wade misses. Rebound secured by Lamelo Ball.

[00:37] Team_063 possession (Score: 92-78)
Lamelo Ball drives and kicks out. Cole Durant attempts a 3Pt. Contested by Scottie Johnson (4.8 feet, ZONE). Cole Durant misses. Rebound secured by Lamelo Irving.

[00:25] Team_057 possession (Score: 92-78)
Scottie Johnson attempts a Midrange. Contested by DeMar Banchero (4.1 feet, MAN). Scottie Johnson misses. Rebound secured by Cole Durant.

[00:11] Team_063 possession (Score: 92-78)
Lamelo Ball attempts a Midrange. Contested by Joel Wade (5.7 feet, ZONE). LAMELO BALL MAKES IT!
Score: 92-80

================================================================================
                              4TH QUARTER COMPLETE                              
================================================================================

4TH QUARTER SCORE: Team_057 35, Team_063 25

BOX SCORE:
================================================================================

Team_057
--------------------------------------------------------------------------------
Player                MIN  PTS  REB  AST  TO      FG   FG%      3P   3P%
--------------------------------------------------------------------------------
Miles Middleton        41   11    5    0   0   5/6    83.3     0/0   0.0
Ben Adebayo            41    8    5    1   0   3/4    75.0     0/0   0.0
Klay Rozier            41    5    0    0   0   2/3    66.7     0/0   0.0
Kobe Ming              41    5    0    0   0   2/2   100.0     0/0   0.0
Anfernee Adebayo       41    4    1    0   0   2/3    66.7     0/0   0.0
Joel Wade               7    0    0    0   0   0/1     0.0     0/0   0.0
Lamelo Irving           7    0    1    0   0   0/0     0.0     0/0   0.0
Scottie Johnson         7    0    0    0   0   0/1     0.0     0/0   0.0

TEAM: FG: 14/20 (70.0%), 3PT: 3/6 (50.0%), REB: 12 (0 off, 12 def), AST: 1, TO: 3
TEAM FOULS: 6 [Team_063 in BONUS]


Team_063
--------------------------------------------------------------------------------
Player                MIN  PTS  REB  AST  TO      FG   FG%      3P   3P%
--------------------------------------------------------------------------------
Tyler Harris           41    8    1    0   0   4/9    44.4     0/0   0.0
Dirk Reaves            41    5    0    0   0   2/4    50.0     0/0   0.0
Malcolm Quickley       41    3    3    0   0   1/2    50.0     0/0   0.0
Terry Reaves           41    3    0    0   0   1/4    25.0     0/0   0.0
Bradley Davis          41    2    0    2   0   1/1   100.0     0/0   0.0
Lamelo Ball             7    2    1    0   0   1/2    50.0     0/0   0.0
Cole Durant             7    0    1    0   0   0/0     0.0     0/0   0.0

TEAM: FG: 10/22 (45.5%), 3PT: 1/5 (20.0%), REB: 6 (0 off, 6 def), AST: 2, TO: 1
TEAM FOULS: 10 [Team_057 in BONUS]

================================================================================

================================================================================
                               FULL GAME COMPLETE                               
================================================================================

FINAL SCORE: Team_057 92, Team_063 80

SCORING BY QUARTER:
--------------------------------------------------------------------------------
Team                     Q1     Q2     Q3     Q4    FINAL
--------------------------------------------------------------------------------
Team_057                 15     31     11     35       92
Team_063                 22     16     17     25       80
--------------------------------------------------------------------------------

FULL GAME BOX SCORE:
================================================================================

Team_057
--------------------------------------------------------------------------------
Player                MIN  PTS  REB  AST  TO      FG   FG%      3P   3P%      FT STL BLK
--------------------------------------------------------------------------------
Kobe Ming              41   14    0    1   2   6/13   46.2   2/5    40.0  10/11    0   0
Klay Rozier            41    8    0    1   1   2/8    25.0   1/5    20.0   0/0     0   1
Anfernee Adebayo       41   14    7    0   4   8/18   44.4   3/10   30.0   2/4     0   0
Ben Adebayo            41   16   21    2   3   5/10   50.0   2/5    40.0   7/10    2   2
Miles Middleton        41   18   11    4   1   7/16   43.8   0/2     0.0   6/8     2   0
Scottie Johnson         7    0    0    1   0   0/2     0.0   0/0     0.0   0/0     0   0
Bradley Ginobili        7    2    0    2   0   1/1   100.0   0/0     0.0   0/0     0   0
Joel Wade               7    0    3    1   0   0/2     0.0   0/2     0.0   0/0     0   0
Lamelo Irving           7    6    3    0   0   3/4    75.0   1/1   100.0   2/2     0   0
Zion Lillard            7    8    0    0   1   4/5    80.0   0/1     0.0   0/0     0   0

TEAM: FG: 37/80 (46.2%), 3PT: 9/31 (29.0%), REB: 45 (5 off, 40 def), AST: 12, TO: 12


Team_063
--------------------------------------------------------------------------------
Player                MIN  PTS  REB  AST  TO      FG   FG%      3P   3P%      FT STL BLK
--------------------------------------------------------------------------------
Bradley Davis          41   16    0    5   1   6/9    66.7   1/4    25.0   4/4     1   0
Malcolm Quickley       41    7   13    0   1   4/6    66.7   1/3    33.3   2/2     0   1
Terry Reaves           41   15    0    3   3   7/19   36.8   3/9    33.3   1/1     1   0
Dirk Reaves            41   16   10    3   3   6/14   42.9   1/2    50.0   3/3     1   0
Tyler Harris           41   10   16    0   5   5/15   33.3   0/3     0.0   3/5     1   2
DeMar Banchero          7    4    0    1   1   2/4    50.0   0/1     0.0   4/6     0   0
Cole Durant             7    2    2    0   0   2/3    66.7   1/2    50.0   0/0     1   0
Jaren James             7    0    0    0   1   0/1     0.0   0/1     0.0   0/0     0   0
Lamelo Ball             7    6    2    0   0   2/3    66.7   0/0     0.0   2/2     0   0
Kyle Green              7    0    2    0   0   0/1     0.0   0/0     0.0   0/0     0   0

TEAM: FG: 35/76 (46.1%), 3PT: 7/25 (28.0%), REB: 45 (5 off, 40 def), AST: 12, TO: 15

================================================================================
