================================================================================
                        FULL GAME - Team_021 vs Team_035                        
================================================================================

================================================================================
                       1ST QUARTER - Team_021 vs Team_035                       
================================================================================

[12:00] Team_021 possession (Score: 0-0)
Anthony Oladipo attempts a 3Pt. Contested by Gary Johnson (3.7 feet, ZONE). ANTHONY OLADIPO MAKES IT! Assist: Kyrie Wagner
Score: 3-0

[11:51] Team_035 possession (Score: 3-0)
Magic Westbrook drives and kicks out. Shaquille Ginobili attempts a Midrange. Contested by Karl Bridges (5.5 feet, ZONE). Shaquille Ginobili misses. Offensive rebound by Magic Westbrook! Magic Westbrook kicks it out.

[11:36] Team_035 possession (Score: 3-0)
Shaquille Ginobili attempts a 3Pt. Contested by Kyrie Wagner (3.8 feet, ZONE). Shaquille Ginobili misses. Rebound secured by Kyrie Leonard.

[11:21] Team_021 possession (Score: 3-0)
Kyrie Wagner attempts a 3Pt. Contested by Shaquille Ginobili (4.0 feet, ZONE). Kyrie Wagner misses. Rebound secured by Magic Westbrook.

[11:06] Team_035 possession (Score: 3-0)
FOUL! Offensive foul on Domantas Green! Kyrie Leonard drew the charge! [Team fouls: 1] (Domantas Green: 1 personal fouls) TURNOVER! (dead ball)

[10:51] Team_021 possession (Score: 3-0)
Anthony Oladipo attempts a Midrange. Contested by Gary Johnson (3.7 feet, ZONE). Anthony Oladipo misses. Offensive rebound by Kyrie Leonard! Kyrie Leonard kicks it out.

[10:39] Team_021 possession (Score: 3-0)
Zach Carter attempts a Layup. Contested by Dwyane Johnson (4.3 feet, ZONE). ZACH CARTER MAKES IT! Assist: Kyrie Leonard
Score: 5-0

[10:22] Team_035 possession (Score: 5-0)
Magic Westbrook drives, picks up Zach Carter. Help arrives from Kyrie Leonard! Magic Westbrook attempts a Dunk. Contested by Kyrie Leonard (4.4 feet, MAN). Magic Westbrook misses. Rebound secured by Kyrie Leonard.

[10:08] Team_021 possession (Score: 5-0)
Kyrie Wagner drives to the basket... Kyrie Wagner commits a violation (traveling/carry)! TURNOVER! (dead ball)

[09:54] Team_035 possession (Score: 5-0)
Gary Johnson drives, picks up Karl Bridges. Help arrives from Kyrie Leonard! Gary Johnson attempts a Layup. Wide open! Kyrie Leonard is 6.0 feet away. [MAN] GARY JOHNSON MAKES IT!
Score: 5-2

[09:41] Team_021 possession (Score: 5-2)
FOUL! Reach-in foul on Dwyane Johnson during the drive. [Team fouls: 2] No free throws, side out. (Dwyane Johnson: 1 personal fouls)

[09:25] Team_021 possession (Score: 5-2)
Anthony Oladipo attempts a 3Pt. Contested by Dwyane Johnson (3.9 feet, ZONE). ANTHONY OLADIPO MAKES IT! Assist: Kyrie Wagner
Score: 8-2

[09:11] Team_035 possession (Score: 8-2)
Gary Johnson drives, picks up Kyrie Wagner. Help arrives from Kyrie Leonard! Gary Johnson attempts a Layup. Contested by Kyrie Leonard (4.5 feet, ZONE). Gary Johnson misses. Offensive rebound by Dwyane Johnson! Dwyane Johnson's putback is no good. Rebound secured by Anthony Oladipo.

[08:53] Team_021 possession (Score: 8-2)
Karl Bridges attempts a Layup. Contested by Dwyane Johnson (3.8 feet, ZONE). Karl Bridges misses. Rebound secured by Magic Westbrook.

[08:38] Team_035 possession (Score: 8-2)
Gary Johnson attempts a Midrange. Wide open! Karl Bridges is 6.0 feet away. [ZONE] GARY JOHNSON MAKES IT!
Score: 8-4

[08:25] Team_021 possession (Score: 8-4)
Kyrie Wagner makes the Dunk and draws the foul on Dwyane Johnson! And-1! Kyrie Wagner to the line for 1. [Team fouls: 3] (Dwyane Johnson: 2 personal fouls)   FT 1/1: MISS Kyrie Wagner makes 0/1 from the line. Rebound secured by Dwyane Johnson.
Score: 10-4

[08:11] Team_035 possession (Score: 10-4)
Domantas Green attempts a 3Pt. Contested by Kyrie Leonard (5.0 feet, MAN). Domantas Green misses. Rebound secured by Anthony Oladipo.

[07:53] Team_021 possession (Score: 10-4)
Zach Carter makes the Layup and draws the foul on Domantas Green! And-1! Zach Carter to the line for 1. [Team fouls: 4] (Domantas Green: 2 personal fouls)   FT 1/1: GOOD Zach Carter makes 1/1 from the line.
Score: 13-4

[07:39] Team_035 possession (Score: 13-4)
Shaquille Ginobili attempts a 3Pt. Contested by Kyrie Wagner (3.8 feet, ZONE). SHAQUILLE GINOBILI MAKES IT! Assist: Gary Johnson
Score: 13-7

[07:26] Team_021 possession (Score: 13-7)
Zach Carter drives and kicks out. Kyrie Wagner attempts a Midrange. Contested by Dwyane Johnson (3.9 feet, MAN). KYRIE WAGNER MAKES IT!
Score: 15-7

[07:07] Team_035 possession (Score: 15-7)
Dwyane Johnson attempts a Midrange. Contested by Karl Bridges (5.5 feet, ZONE). Dwyane Johnson misses. Rebound secured by Anthony Oladipo.

[06:56] Team_021 possession (Score: 15-7)
Karl Bridges attempts a Midrange. Contested by Gary Johnson (3.7 feet, MAN). Karl Bridges misses. Rebound secured by Magic Westbrook.

[06:38] Team_035 possession (Score: 15-7)
FOUL! Shooting foul on Kyrie Wagner. Dwyane Johnson to the line for 2 free throws. [Team fouls: 1] (Kyrie Wagner: 1 personal fouls)   FT 1/2: GOOD   FT 2/2: GOOD Dwyane Johnson makes 2/2 from the line.
Score: 15-9

[06:21] Team_021 possession (Score: 15-9)
Kyrie Wagner drives, picks up Dwyane Johnson. Help arrives from Domantas Green! Kyrie Wagner attempts a Dunk. Contested by Domantas Green (4.0 feet, MAN). KYRIE WAGNER MAKES IT!
Score: 17-9

[06:10] Team_035 possession (Score: 17-9)
Gary Johnson attempts a Midrange. Wide open! Karl Bridges is 6.0 feet away. [MAN] GARY JOHNSON MAKES IT! Assist: Shaquille Ginobili
Score: 17-11

[05:54] Team_021 possession (Score: 17-11)
Karl Bridges attempts a Midrange. Contested by Shaquille Ginobili (3.8 feet, ZONE). Karl Bridges misses. FOUL! Loose ball foul on Magic Westbrook during the rebound battle. [IN THE BONUS! 5 team fouls] Kyrie Leonard to the line for 2 free throws. (Magic Westbrook: 1 personal fouls)   FT 1/2: GOOD   FT 2/2: GOOD Kyrie Leonard makes 2/2 from the line.
Score: 19-11

[05:39] Team_035 possession (Score: 19-11)
Shaquille Ginobili attempts a 3Pt. Contested by Anthony Oladipo (4.4 feet, MAN). SHAQUILLE GINOBILI MAKES IT! Assist: Dwyane Johnson
Score: 19-14

[05:28] Team_021 possession (Score: 19-14)
Anthony Oladipo attempts a 3Pt. Contested by Shaquille Ginobili (3.9 feet, MAN). Anthony Oladipo misses. Rebound secured by Magic Westbrook.

[05:11] Team_035 possession (Score: 19-14)
Dwyane Johnson attempts a 3Pt. Contested by Kyrie Leonard (4.5 feet, ZONE). Dwyane Johnson misses. Rebound secured by Kyrie Leonard.

[04:56] Team_021 possession (Score: 19-14)
Kyrie Leonard drives, picks up Domantas Green. Help arrives from Shaquille Ginobili! Kyrie Leonard attempts a Layup. Contested by Shaquille Ginobili (4.4 feet, MAN). KYRIE LEONARD MAKES IT! Assist: Karl Bridges
Score: 21-14

[04:44] Team_035 possession (Score: 21-14)
Shaquille Ginobili attempts a Layup. Contested by Zach Carter (3.9 feet, ZONE). Shaquille Ginobili misses. Rebound secured by Anthony Oladipo.

[04:30] Team_021 possession (Score: 21-14)
Kyrie Wagner attempts a 3Pt. Contested by Dwyane Johnson (4.0 feet, MAN). Kyrie Wagner misses. Offensive rebound by Zach Carter! Zach Carter kicks it out.

[04:15] Team_021 possession (Score: 21-14)
Zach Carter drives, picks up Dwyane Johnson. Help arrives from Domantas Green! Zach Carter attempts a Dunk. Contested by Domantas Green (4.4 feet, ZONE). Zach Carter misses. Offensive rebound by Zach Carter! Zach Carter kicks it out.

[04:01] Team_021 possession (Score: 21-14)
Karl Bridges attempts a Midrange. Contested by Shaquille Ginobili (3.9 feet, ZONE). Karl Bridges misses. Rebound secured by Gary Johnson.

[03:51] Team_035 possession (Score: 21-14)
Shaquille Ginobili attempts a Midrange. Contested by Anthony Oladipo (4.5 feet, MAN). Shaquille Ginobili misses. Rebound secured by Zach Carter.

[03:35] Team_021 possession (Score: 21-14)
Anthony Oladipo drives and kicks out. Anthony Oladipo attempts a 3Pt. Contested by Shaquille Ginobili (4.1 feet, MAN). Anthony Oladipo misses. Offensive rebound by Zach Carter! Zach Carter kicks it out.

[03:21] Team_021 possession (Score: 21-14)
FOUL! Shooting foul on Shaquille Ginobili. Anthony Oladipo to the line for 2 free throws. [BONUS: 6 team fouls] (Shaquille Ginobili: 1 personal fouls)   FT 1/2: GOOD   FT 2/2: MISS Anthony Oladipo makes 1/2 from the line. Rebound secured by Dwyane Johnson.
Score: 22-14

[03:09] Team_035 possession (Score: 22-14)
Gary Johnson attempts a Midrange. Wide open! Karl Bridges is 6.2 feet away. [MAN] GARY JOHNSON MAKES IT!
Score: 22-16

[02:53] Team_021 possession (Score: 22-16)
Kyrie Leonard drives, Dwyane Johnson stays with him. Kyrie Leonard attempts a Dunk. Contested by Dwyane Johnson (3.9 feet, ZONE). KYRIE LEONARD MAKES IT! Assist: Zach Carter
Score: 24-16

[02:37] Team_035 possession (Score: 24-16)
Gary Johnson attempts a 3Pt. Wide open! Karl Bridges is 6.2 feet away. [MAN] Gary Johnson misses. Rebound secured by Kyrie Leonard.

[02:24] Team_021 possession (Score: 24-16)
Zach Carter drives and kicks out. Karl Bridges attempts a 3Pt. Contested by Shaquille Ginobili (4.2 feet, ZONE). KARL BRIDGES MAKES IT!
Score: 27-16

[02:07] Team_035 possession (Score: 27-16)
Shaquille Ginobili drives, picks up Zach Carter. Help arrives from Kyrie Leonard! Shaquille Ginobili attempts a Dunk. Contested by Kyrie Leonard (4.1 feet, ZONE). SHAQUILLE GINOBILI MAKES IT!
Score: 27-18

[01:54] Team_021 possession (Score: 27-18)
Karl Bridges attempts a 3Pt. Contested by Gary Johnson (3.9 feet, MAN). Karl Bridges misses. FOUL! Loose ball foul on Magic Westbrook during the rebound battle. [IN THE BONUS! 7 team fouls] Zach Carter to the line for 2 free throws. (Magic Westbrook: 2 personal fouls)   FT 1/2: MISS   FT 2/2: GOOD Zach Carter makes 1/2 from the line.
Score: 28-18

[01:42] Team_035 possession (Score: 28-18)
FOUL! Shooting foul on Zach Carter. Shaquille Ginobili to the line for 2 free throws. [Team fouls: 2] (Zach Carter: 1 personal fouls)   FT 1/2: GOOD   FT 2/2: GOOD Shaquille Ginobili makes 2/2 from the line.
Score: 28-20

[01:33] Team_021 possession (Score: 28-20)
Zach Carter commits a violation (traveling/carry)! TURNOVER! (dead ball)

[01:33] Substitution (Team_021): Kyrie Leonard OUT → Joel LaVine IN (stamina_rule2)

[01:33] Substitution (Team_021): Anthony Oladipo OUT → Victor Mitchell IN (stamina_rule2)

[01:33] Substitution (Team_021): Karl Bridges OUT → Paul Allen IN (stamina_rule2)

[01:33] Substitution (Team_021): Kyrie Wagner OUT → Vince George IN (stamina_rule2)

[01:33] Substitution (Team_021): Zach Carter OUT → Magic Ingram IN (stamina_rule2)

[01:33] Substitution (Team_035): Domantas Green OUT → CJ LaVine IN (stamina_rule2)

[01:33] Substitution (Team_035): Shaquille Ginobili OUT → Cole George IN (stamina_rule2)

[01:33] Substitution (Team_035): Gary Johnson OUT → Malcolm Turner IN (stamina_rule2)

[01:33] Substitution (Team_035): Dwyane Johnson OUT → Tobias Jordan IN (stamina_rule2)

[01:33] Substitution (Team_035): Magic Westbrook OUT → John Durant IN (stamina_rule2)

[01:18] Team_035 possession (Score: 28-20)
Tobias Jordan makes the Midrange and draws the foul on Vince George! And-1! Tobias Jordan to the line for 1. [Team fouls: 3] (Vince George: 1 personal fouls)   FT 1/1: GOOD Tobias Jordan makes 1/1 from the line.
Score: 28-23

[01:00] Team_021 possession (Score: 28-23)
Vince George attempts a Layup. Contested by John Durant (4.2 feet, ZONE). Vince George misses. Rebound secured by Tobias Jordan.

[00:47] Team_035 possession (Score: 28-23)
Cole George attempts a 3Pt. Contested by Victor Mitchell (4.5 feet, MAN). Cole George misses. Rebound secured by Victor Mitchell.

[00:30] Team_021 possession (Score: 28-23)
Victor Mitchell drives, John Durant stays with him. Victor Mitchell attempts a Dunk. Contested by John Durant (4.2 feet, ZONE). VICTOR MITCHELL MAKES IT!
Score: 30-23

[00:18] Team_035 possession (Score: 30-23)
Cole George attempts a 3Pt. Contested by Victor Mitchell (4.5 feet, MAN). Cole George misses. Rebound secured by Victor Mitchell.

[00:04] Team_021 possession (Score: 30-23)
Joel LaVine attempts a 3Pt. Contested by CJ LaVine (4.0 feet, ZONE). Joel LaVine misses. Rebound secured by John Durant.

================================================================================
                              1ST QUARTER COMPLETE                              
================================================================================

1ST QUARTER SCORE: Team_021 30, Team_035 23

BOX SCORE:
================================================================================

Team_021
--------------------------------------------------------------------------------
Player                MIN  PTS  REB  AST  TO      FG   FG%      3P   3P%
--------------------------------------------------------------------------------
Anthony Oladipo        11    6    4    0   0   2/4    50.0     0/0   0.0
Kyrie Leonard          11    6    5    1   0   3/3   100.0     0/0   0.0
Zach Carter            11    6    4    1   0   3/3   100.0     0/0   0.0
Kyrie Wagner           11    4    0    2   0   2/4    50.0     0/0   0.0
Karl Bridges           11    3    0    1   0   1/4    25.0     0/0   0.0
Victor Mitchell         1    2    2    0   0   1/1   100.0     0/0   0.0
Vince George            1    0    0    0   0   0/1     0.0     0/0   0.0
Joel LaVine             1    0    0    0   0   0/1     0.0     0/0   0.0

TEAM: FG: 12/21 (57.1%), 3PT: 3/6 (50.0%), REB: 14 (4 off, 10 def), AST: 5, TO: 2
TEAM FOULS: 3


Team_035
--------------------------------------------------------------------------------
Player                MIN  PTS  REB  AST  TO      FG   FG%      3P   3P%
--------------------------------------------------------------------------------
Shaquille Ginobili     11   10    0    1   0   4/7    57.1     0/0   0.0
Gary Johnson           11    8    1    1   0   4/6    66.7     0/0   0.0
Tobias Jordan           1    3    1    0   0   1/1   100.0     0/0   0.0
Dwyane Johnson         11    2    2    1   0   1/3    33.3     0/0   0.0
Magic Westbrook        11    0    5    0   0   0/1     0.0     0/0   0.0
Domantas Green         11    0    0    0   0   0/1     0.0     0/0   0.0
Cole George             1    0    0    0   0   0/2     0.0     0/0   0.0
John Durant             1    0    1    0   0   0/0     0.0     0/0   0.0

TEAM: FG: 10/21 (47.6%), 3PT: 2/8 (25.0%), REB: 11 (2 off, 9 def), AST: 3, TO: 1
TEAM FOULS: 7 [Team_021 in BONUS]

================================================================================

================================================================================
                       2ND QUARTER - Team_021 vs Team_035                       
================================================================================

[12:00] Team_021 possession (Score: 30-23)
Karl Bridges makes the Layup and draws the foul on Gary Johnson! And-1! Karl Bridges to the line for 1. [Team fouls: 1] (Gary Johnson: 1 personal fouls)   FT 1/1: GOOD Karl Bridges makes 1/1 from the line.
Score: 33-23

[11:44] Team_035 possession (Score: 33-23)
Shaquille Ginobili drives to the basket... Shaquille Ginobili throws a bad pass! Stolen by Anthony Oladipo! TURNOVER! (live ball)

[11:30] Team_021 possession (Score: 33-23)
Anthony Oladipo attempts a 3Pt. Contested by Shaquille Ginobili (4.0 feet, MAN). ANTHONY OLADIPO MAKES IT! Assist: Zach Carter
Score: 36-23

[11:11] Team_035 possession (Score: 36-23)
Domantas Green attempts a Layup. Contested by Zach Carter (4.5 feet, ZONE). Domantas Green misses. Rebound secured by Zach Carter.

[10:58] Team_021 possession (Score: 36-23)
FOUL! Shooting foul on Shaquille Ginobili. Kyrie Wagner to the line for 3 free throws. [Team fouls: 2] (Shaquille Ginobili: 1 personal fouls)   FT 1/3: GOOD   FT 2/3: MISS   FT 3/3: GOOD Kyrie Wagner makes 2/3 from the line.
Score: 38-23

[10:45] Team_035 possession (Score: 38-23)
Dwyane Johnson makes the Midrange and draws the foul on Kyrie Wagner! And-1! Dwyane Johnson to the line for 1. [Team fouls: 1] (Kyrie Wagner: 1 personal fouls)   FT 1/1: GOOD Dwyane Johnson makes 1/1 from the line.
Score: 38-26

[10:26] Team_021 possession (Score: 38-26)
Anthony Oladipo attempts a Midrange. Contested by Shaquille Ginobili (4.1 feet, MAN). Anthony Oladipo misses. Rebound secured by Magic Westbrook.

[10:08] Team_035 possession (Score: 38-26)
Shaquille Ginobili attempts a 3Pt. Contested by Anthony Oladipo (4.6 feet, MAN). Shaquille Ginobili misses. Offensive rebound by Dwyane Johnson! Dwyane Johnson's putback is no good. Rebound secured by Zach Carter.

[09:54] Team_021 possession (Score: 38-26)
Kyrie Leonard attempts a 3Pt. Contested by Shaquille Ginobili (4.0 feet, ZONE). Kyrie Leonard misses. Rebound secured by Dwyane Johnson.

[09:37] Team_035 possession (Score: 38-26)
Gary Johnson attempts a 3Pt. Wide open! Karl Bridges is 6.3 feet away. [MAN] Gary Johnson misses. Offensive rebound by Magic Westbrook! Magic Westbrook kicks it out.

[09:23] Team_035 possession (Score: 38-26)
Domantas Green attempts a 3Pt. Contested by Kyrie Leonard (5.2 feet, MAN). Domantas Green misses. Rebound secured by Zach Carter.

[09:07] Team_021 possession (Score: 38-26)
Karl Bridges makes the Layup and draws the foul on Gary Johnson! And-1! Karl Bridges to the line for 1. [Team fouls: 3] (Gary Johnson: 2 personal fouls)   FT 1/1: GOOD Karl Bridges makes 1/1 from the line.
Score: 41-26

[08:55] Team_035 possession (Score: 41-26)
FOUL! Reach-in foul on Zach Carter during the drive. [Team fouls: 2] No free throws, side out. (Zach Carter: 1 personal fouls)

[08:42] Team_035 possession (Score: 41-26)
Shaquille Ginobili makes the Midrange and draws the foul on Anthony Oladipo! And-1! Shaquille Ginobili to the line for 1. [Team fouls: 3] (Anthony Oladipo: 1 personal fouls)   FT 1/1: GOOD Shaquille Ginobili makes 1/1 from the line.
Score: 41-29

[08:23] Team_021 possession (Score: 41-29)
Anthony Oladipo attempts a Midrange. Contested by Shaquille Ginobili (4.3 feet, MAN). ANTHONY OLADIPO MAKES IT!
Score: 43-29

[08:12] Team_035 possession (Score: 43-29)
Magic Westbrook drives, Zach Carter stays with him. Magic Westbrook attempts a Dunk. Contested by Zach Carter (4.8 feet, MAN). Magic Westbrook misses. FOUL! Loose ball foul on Zach Carter during the rebound battle. [Team fouls: 4] No free throws, side out. (Zach Carter: 2 personal fouls)

[07:56] Team_035 possession (Score: 43-29)
Domantas Green attempts a 3Pt. Contested by Kyrie Wagner (4.9 feet, ZONE). Domantas Green misses. Rebound secured by Anthony Oladipo.

[07:43] Team_021 possession (Score: 43-29)
FOUL! Holding foul on Domantas Green. [Team fouls: 4] No free throws, side out. (Domantas Green: 1 personal fouls)

[07:29] Team_021 possession (Score: 43-29)
FOUL! Reach-in foul on Dwyane Johnson during the drive. [IN THE BONUS! 5 team fouls] Zach Carter to the line for 2 free throws. (Dwyane Johnson: 1 personal fouls)   FT 1/2: MISS   FT 2/2: GOOD Zach Carter makes 1/2 from the line.
Score: 44-29

[07:14] Team_035 possession (Score: 44-29)
FOUL! Holding foul on Karl Bridges. [IN THE BONUS! 5 team fouls] Gary Johnson to the line for 2 free throws. (Karl Bridges: 1 personal fouls)   FT 1/2: GOOD   FT 2/2: GOOD Gary Johnson makes 2/2 from the line.
Score: 44-31

[06:57] Team_021 possession (Score: 44-31)
Kyrie Wagner attempts a 3Pt. Contested by Dwyane Johnson (4.5 feet, MAN). Kyrie Wagner misses. Rebound secured by Magic Westbrook.

[06:37] Team_035 possession (Score: 44-31)
Domantas Green attempts a 3Pt. Contested by Kyrie Leonard (5.5 feet, MAN). Domantas Green misses. Offensive rebound by Magic Westbrook! Magic Westbrook kicks it out.

[06:21] Team_035 possession (Score: 44-31)
Shaquille Ginobili attempts a Midrange. Contested by Kyrie Wagner (4.5 feet, ZONE). SHAQUILLE GINOBILI MAKES IT! Assist: Domantas Green
Score: 44-33

[06:02] Team_021 possession (Score: 44-33)
Kyrie Leonard drives, Dwyane Johnson stays with him. Kyrie Leonard attempts a Layup. Contested by Dwyane Johnson (4.4 feet, ZONE). KYRIE LEONARD MAKES IT! Assist: Zach Carter
Score: 46-33

[05:43] Team_035 possession (Score: 46-33)
Gary Johnson attempts a 3Pt. Contested by Anthony Oladipo (5.7 feet, ZONE). GARY JOHNSON MAKES IT! Assist: Dwyane Johnson
Score: 46-36

[05:28] Team_021 possession (Score: 46-36)
Kyrie Leonard attempts a 3Pt. Contested by Domantas Green (5.1 feet, MAN). KYRIE LEONARD MAKES IT! Assist: Kyrie Wagner
Score: 49-36

[05:11] Team_035 possession (Score: 49-36)
Gary Johnson attempts a Midrange. Contested by Kyrie Wagner (5.3 feet, ZONE). GARY JOHNSON MAKES IT! Assist: Dwyane Johnson
Score: 49-38

[04:58] Team_021 possession (Score: 49-38)
Zach Carter attempts a Midrange. Contested by Dwyane Johnson (5.0 feet, ZONE). Zach Carter misses. Rebound secured by Dwyane Johnson.

[04:42] Team_035 possession (Score: 49-38)
Magic Westbrook attempts a Midrange. BLOCKED BY ANTHONY OLADIPO! Ball deflects out of bounds off Magic Westbrook.

[04:29] Team_021 possession (Score: 49-38)
Anthony Oladipo attempts a Midrange. Contested by Dwyane Johnson (4.7 feet, ZONE). Anthony Oladipo misses. Offensive rebound by Zach Carter! Zach Carter kicks it out.

[04:18] Team_021 possession (Score: 49-38)
Zach Carter drives and kicks out. Karl Bridges attempts a Midrange. Contested by Gary Johnson (4.7 feet, MAN). KARL BRIDGES MAKES IT!
Score: 51-38

[04:04] Team_035 possession (Score: 51-38)
Dwyane Johnson attempts a Midrange. Contested by Kyrie Wagner (4.9 feet, MAN). DWYANE JOHNSON MAKES IT!
Score: 51-40

[03:47] Team_021 possession (Score: 51-40)
Kyrie Wagner attempts a Layup. Contested by Dwyane Johnson (4.9 feet, MAN). KYRIE WAGNER MAKES IT! Assist: Anthony Oladipo
Score: 53-40

[03:30] Team_035 possession (Score: 53-40)
Shaquille Ginobili attempts a 3Pt. Contested by Kyrie Wagner (4.9 feet, ZONE). Shaquille Ginobili misses. Offensive rebound by Gary Johnson! Gary Johnson kicks it out.

[03:17] Team_035 possession (Score: 53-40)
Gary Johnson drives, Karl Bridges stays with him. Gary Johnson attempts a Dunk. Wide open! Karl Bridges is 6.8 feet away. [MAN] GARY JOHNSON MAKES IT! Assist: Magic Westbrook
Score: 53-42

[02:59] Team_021 possession (Score: 53-42)
Kyrie Wagner attempts a Midrange. Contested by Gary Johnson (4.8 feet, ZONE). KYRIE WAGNER MAKES IT!
Score: 55-42

[02:47] Team_035 possession (Score: 55-42)
Gary Johnson drives and kicks out. FOUL! Shooting foul on Kyrie Leonard. Domantas Green to the line for 2 free throws. [BONUS: 6 team fouls] (Kyrie Leonard: 1 personal fouls)   FT 1/2: GOOD   FT 2/2: GOOD Domantas Green makes 2/2 from the line.
Score: 55-44

[02:36] Team_021 possession (Score: 55-44)
FOUL! Shooting foul on Gary Johnson. Kyrie Leonard to the line for 2 free throws. [BONUS: 6 team fouls] (Gary Johnson: 3 personal fouls)   FT 1/2: GOOD   FT 2/2: MISS Kyrie Leonard makes 1/2 from the line. Rebound secured by Magic Westbrook.
Score: 56-44

[02:22] Team_035 possession (Score: 56-44)
Gary Johnson drives to the basket... Gary Johnson throws a bad pass! Stolen by Zach Carter! TURNOVER! (live ball)

[02:10] Team_021 possession (Score: 56-44)
FOUL! Reach-in foul on Dwyane Johnson during the drive. [IN THE BONUS! 7 team fouls] Karl Bridges to the line for 2 free throws. (Dwyane Johnson: 2 personal fouls)   FT 1/2: MISS   FT 2/2: GOOD Karl Bridges makes 1/2 from the line.
Score: 57-44

[01:56] Team_035 possession (Score: 57-44)
Domantas Green attempts a Midrange. Wide open! Kyrie Leonard is 6.0 feet away. [MAN] DOMANTAS GREEN MAKES IT!
Score: 57-46

[01:40] Team_021 possession (Score: 57-46)
Anthony Oladipo attempts a Layup. Contested by Shaquille Ginobili (5.2 feet, MAN). ANTHONY OLADIPO MAKES IT!
Score: 59-46

[01:25] Team_035 possession (Score: 59-46)
Shaquille Ginobili attempts a 3Pt. Wide open! Karl Bridges is 6.5 feet away. [ZONE] Shaquille Ginobili misses. Rebound secured by Anthony Oladipo.

[01:12] Team_021 possession (Score: 59-46)
Karl Bridges attempts a 3Pt. Contested by Shaquille Ginobili (5.2 feet, ZONE). Karl Bridges misses. Offensive rebound by Kyrie Leonard! Kyrie Leonard kicks it out.

[00:58] Team_021 possession (Score: 59-46)
Zach Carter attempts a Layup. Wide open! Magic Westbrook is 6.2 feet away. [MAN] ZACH CARTER MAKES IT!
Score: 61-46

[00:40] Team_035 possession (Score: 61-46)
Magic Westbrook attempts a 3Pt. Contested by Zach Carter (5.7 feet, MAN). MAGIC WESTBROOK MAKES IT!
Score: 61-49

[00:23] Team_021 possession (Score: 61-49)
Kyrie Wagner drives and kicks out. Zach Carter attempts a 3Pt. Wide open! Magic Westbrook is 6.1 feet away. [MAN] Zach Carter misses. Offensive rebound by Kyrie Leonard! Kyrie Leonard kicks it out.

[00:07] Team_021 possession (Score: 61-49)
Anthony Oladipo attempts a Layup. Contested by Shaquille Ginobili (5.4 feet, MAN). ANTHONY OLADIPO MAKES IT! Assist: Karl Bridges
Score: 63-49

================================================================================
                              2ND QUARTER COMPLETE                              
================================================================================

2ND QUARTER SCORE: Team_021 33, Team_035 26

BOX SCORE:
================================================================================

Team_021
--------------------------------------------------------------------------------
Player                MIN  PTS  REB  AST  TO      FG   FG%      3P   3P%
--------------------------------------------------------------------------------
Karl Bridges           23    9    0    1   0   4/4   100.0     0/0   0.0
Anthony Oladipo        23    9    2    1   0   4/5    80.0     0/0   0.0
Kyrie Wagner           23    6    0    1   0   3/4    75.0     0/0   0.0
Kyrie Leonard          23    5    2    0   0   2/4    50.0     0/0   0.0
Zach Carter            23    3    4    2   0   2/3    66.7     0/0   0.0

TEAM: FG: 15/20 (75.0%), 3PT: 3/5 (60.0%), REB: 7 (3 off, 4 def), AST: 5, TO: 0
TEAM FOULS: 6 [Team_035 in BONUS]


Team_035
--------------------------------------------------------------------------------
Player                MIN  PTS  REB  AST  TO      FG   FG%      3P   3P%
--------------------------------------------------------------------------------
Gary Johnson           23    9    1    0   0   4/4   100.0     0/0   0.0
Dwyane Johnson         23    5    3    2   0   2/2   100.0     0/0   0.0
Shaquille Ginobili     23    5    0    0   0   2/4    50.0     0/0   0.0
Domantas Green         23    4    0    1   0   2/5    40.0     0/0   0.0
Magic Westbrook        23    3    5    1   0   1/2    50.0     0/0   0.0

TEAM: FG: 11/17 (64.7%), 3PT: 2/6 (33.3%), REB: 10 (5 off, 5 def), AST: 4, TO: 2
TEAM FOULS: 7 [Team_021 in BONUS]

================================================================================

================================================================================
                       3RD QUARTER - Team_021 vs Team_035                       
================================================================================

[12:00] Team_021 possession (Score: 63-49)
Kyrie Wagner drives and kicks out. Zach Carter attempts a Midrange. Contested by Shaquille Ginobili (3.9 feet, ZONE). Zach Carter misses. Offensive rebound by Kyrie Leonard! Kyrie Leonard kicks it out.

[11:48] Team_021 possession (Score: 63-49)
Kyrie Wagner attempts a Midrange. Contested by Dwyane Johnson (4.0 feet, ZONE). Kyrie Wagner misses. Rebound secured by Magic Westbrook.

[11:32] Team_035 possession (Score: 63-49)
FOUL! Holding foul on Zach Carter. [Team fouls: 1] No free throws, side out. (Zach Carter: 1 personal fouls)

[11:20] Team_035 possession (Score: 63-49)
Gary Johnson drives, Karl Bridges stays with him. Gary Johnson attempts a Dunk. Wide open! Karl Bridges is 6.0 feet away. [MAN] Gary Johnson misses. Rebound secured by Zach Carter.

[11:03] Team_021 possession (Score: 63-49)
Zach Carter attempts a Layup. Contested by Dwyane Johnson (4.3 feet, ZONE). ZACH CARTER MAKES IT! Assist: Karl Bridges
Score: 65-49

[10:47] Team_035 possession (Score: 65-49)
Dwyane Johnson drives, picks up Zach Carter. Help arrives from Kyrie Leonard! Dwyane Johnson attempts a Layup. Contested by Kyrie Leonard (3.9 feet, ZONE). Dwyane Johnson misses. Rebound secured by Zach Carter.

[10:36] Team_021 possession (Score: 65-49)
Karl Bridges loses control! Ball rolls out of bounds! TURNOVER! (dead ball)

[10:25] Team_035 possession (Score: 65-49)
Shaquille Ginobili drives and kicks out. Domantas Green attempts a 3Pt. Contested by Kyrie Wagner (4.0 feet, ZONE). Domantas Green misses. Rebound secured by Zach Carter.

[10:10] Team_021 possession (Score: 65-49)
Zach Carter attempts a Midrange. Contested by Magic Westbrook (4.7 feet, MAN). Zach Carter misses. Rebound secured by Dwyane Johnson.

[09:52] Team_035 possession (Score: 65-49)
Magic Westbrook drives, picks up Zach Carter. Help arrives from Kyrie Leonard! Magic Westbrook attempts a Layup. Contested by Kyrie Leonard (4.4 feet, MAN). MAGIC WESTBROOK MAKES IT! Assist: Shaquille Ginobili
Score: 65-51

[09:41] Team_021 possession (Score: 65-51)
Zach Carter makes the Dunk and draws the foul on Magic Westbrook! And-1! Zach Carter to the line for 1. [Team fouls: 1] (Magic Westbrook: 1 personal fouls)   FT 1/1: GOOD Zach Carter makes 1/1 from the line.
Score: 68-51

[09:26] Team_035 possession (Score: 68-51)
Dwyane Johnson drives, Kyrie Wagner stays with him. Dwyane Johnson attempts a Dunk. Contested by Kyrie Wagner (3.9 feet, MAN). Dwyane Johnson misses. Rebound secured by Zach Carter.

[09:16] Team_021 possession (Score: 68-51)
Kyrie Wagner attempts a 3Pt. Contested by Dwyane Johnson (4.0 feet, MAN). Kyrie Wagner misses. Rebound secured by Gary Johnson.

[09:02] Team_035 possession (Score: 68-51)
Magic Westbrook attempts a Layup. BLOCKED BY ZACH CARTER! Ball is loose! Rebound secured by Kyrie Leonard.

[08:44] Team_021 possession (Score: 68-51)
Karl Bridges drives, Gary Johnson stays with him. Karl Bridges attempts a Layup. Contested by Gary Johnson (3.7 feet, MAN). KARL BRIDGES MAKES IT!
Score: 70-51

[08:29] Team_035 possession (Score: 70-51)
Domantas Green attempts a Midrange. Contested by Anthony Oladipo (5.0 feet, ZONE). DOMANTAS GREEN MAKES IT!
Score: 70-53

[08:14] Team_021 possession (Score: 70-53)
Anthony Oladipo attempts a 3Pt. Contested by Gary Johnson (3.7 feet, ZONE). Anthony Oladipo misses. Rebound secured by Gary Johnson.

[08:00] Team_035 possession (Score: 70-53)
Gary Johnson attempts a 3Pt. Contested by Kyrie Wagner (4.5 feet, ZONE). Gary Johnson misses. Rebound secured by Kyrie Leonard.

[07:42] Team_021 possession (Score: 70-53)
Zach Carter makes the Layup and draws the foul on Domantas Green! And-1! Zach Carter to the line for 1. [Team fouls: 2] (Domantas Green: 1 personal fouls)   FT 1/1: MISS Zach Carter makes 0/1 from the line. Rebound secured by Dwyane Johnson.
Score: 72-53

[07:25] Team_035 possession (Score: 72-53)
Dwyane Johnson attempts a 3Pt. Contested by Kyrie Wagner (3.9 feet, MAN). DWYANE JOHNSON MAKES IT! Assist: Magic Westbrook
Score: 72-56

[07:09] Team_021 possession (Score: 72-56)
FOUL! Holding foul on Domantas Green. [Team fouls: 3] No free throws, side out. (Domantas Green: 2 personal fouls)

[06:58] Team_021 possession (Score: 72-56)
Kyrie Wagner drives, picks up Dwyane Johnson. Help arrives from Domantas Green! Kyrie Wagner attempts a Dunk. Contested by Domantas Green (4.0 feet, ZONE). KYRIE WAGNER MAKES IT! Assist: Kyrie Leonard
Score: 74-56

[06:41] Team_035 possession (Score: 74-56)
FOUL! Holding foul on Kyrie Leonard. [Team fouls: 2] No free throws, side out. (Kyrie Leonard: 1 personal fouls)

[06:22] Team_035 possession (Score: 74-56)
Shaquille Ginobili attempts a Layup. Contested by Zach Carter (3.8 feet, ZONE). Shaquille Ginobili misses. Rebound secured by Kyrie Leonard.

[06:08] Team_021 possession (Score: 74-56)
FOUL! Shooting foul on Domantas Green. Kyrie Leonard to the line for 2 free throws. [Team fouls: 4] (Domantas Green: 3 personal fouls)   FT 1/2: GOOD   FT 2/2: GOOD Kyrie Leonard makes 2/2 from the line.
Score: 76-56

[05:56] Team_035 possession (Score: 76-56)
Shaquille Ginobili attempts a Midrange. Contested by Anthony Oladipo (4.4 feet, MAN). SHAQUILLE GINOBILI MAKES IT!
Score: 76-58

[05:44] Team_021 possession (Score: 76-58)
Zach Carter attempts a Midrange. Contested by Dwyane Johnson (4.3 feet, ZONE). Zach Carter misses. Rebound secured by Dwyane Johnson.

[05:33] Team_035 possession (Score: 76-58)
Gary Johnson attempts a Midrange. Wide open! Karl Bridges is 6.1 feet away. [ZONE] Gary Johnson misses. Rebound secured by Kyrie Leonard.

[05:17] Team_021 possession (Score: 76-58)
FOUL! Reach-in foul on Shaquille Ginobili during the drive. [IN THE BONUS! 5 team fouls] Anthony Oladipo to the line for 2 free throws. (Shaquille Ginobili: 1 personal fouls)   FT 1/2: GOOD   FT 2/2: MISS Anthony Oladipo makes 1/2 from the line. Rebound secured by Dwyane Johnson.
Score: 77-58

[05:04] Team_035 possession (Score: 77-58)
Domantas Green drives to the basket... Domantas Green throws a bad pass! Stolen by Zach Carter! TURNOVER! (live ball)

[04:46] Team_021 possession (Score: 77-58)
Kyrie Leonard attempts a 3Pt. Contested by Shaquille Ginobili (3.8 feet, ZONE). Kyrie Leonard misses. Rebound secured by Gary Johnson.

[04:31] Team_035 possession (Score: 77-58)
Gary Johnson drives, picks up Zach Carter. Help arrives from Kyrie Leonard! Gary Johnson attempts a Dunk. Contested by Kyrie Leonard (4.6 feet, ZONE). Gary Johnson misses. Rebound secured by Anthony Oladipo.

[04:19] Team_021 possession (Score: 77-58)
Kyrie Wagner loses the ball! Stripped by Dwyane Johnson! TURNOVER! (live ball)

[04:05] Team_035 possession (Score: 77-58)
Dwyane Johnson throws a bad pass out of bounds! TURNOVER! (dead ball)

[03:51] Team_021 possession (Score: 77-58)
Kyrie Wagner attempts a 3Pt. Contested by Dwyane Johnson (4.1 feet, MAN). Kyrie Wagner misses. Rebound secured by Magic Westbrook.

[03:36] Team_035 possession (Score: 77-58)
FOUL! Shooting foul on Anthony Oladipo. Domantas Green to the line for 2 free throws. [Team fouls: 3] (Anthony Oladipo: 1 personal fouls)   FT 1/2: GOOD   FT 2/2: GOOD Domantas Green makes 2/2 from the line.
Score: 77-60

[03:17] Team_021 possession (Score: 77-60)
FOUL! Holding foul on Dwyane Johnson. [IN THE BONUS! 6 team fouls] Kyrie Wagner to the line for 2 free throws. (Dwyane Johnson: 1 personal fouls)   FT 1/2: GOOD   FT 2/2: MISS Kyrie Wagner makes 1/2 from the line. Offensive rebound by Zach Carter! Zach Carter kicks it out.
Score: 78-60

[03:03] Team_021 possession (Score: 78-60)
Kyrie Leonard drives, Domantas Green stays with him. Kyrie Leonard attempts a Dunk. Contested by Domantas Green (4.6 feet, MAN). Kyrie Leonard misses. Rebound secured by Magic Westbrook.

[02:49] Team_035 possession (Score: 78-60)
Gary Johnson drives to the basket... FOUL! Offensive foul on Gary Johnson! Karl Bridges drew the charge! [Team fouls: 7] (Gary Johnson: 1 personal fouls) TURNOVER! (dead ball)

[02:31] Team_021 possession (Score: 78-60)
FOUL! Holding foul on Shaquille Ginobili. [IN THE BONUS! 8 team fouls] Anthony Oladipo to the line for 2 free throws. (Shaquille Ginobili: 2 personal fouls)   FT 1/2: MISS   FT 2/2: GOOD Anthony Oladipo makes 1/2 from the line.
Score: 79-60

[02:13] Team_035 possession (Score: 79-60)
Dwyane Johnson attempts a Layup. Contested by Kyrie Wagner (4.2 feet, MAN). DWYANE JOHNSON MAKES IT! Assist: Shaquille Ginobili
Score: 79-62

[01:55] Team_021 possession (Score: 79-62)
FOUL! Shooting foul on Dwyane Johnson. Zach Carter to the line for 2 free throws. [BONUS: 9 team fouls] (Dwyane Johnson: 2 personal fouls)   FT 1/2: GOOD   FT 2/2: GOOD Zach Carter makes 2/2 from the line.
Score: 81-62

[01:44] Team_035 possession (Score: 81-62)
Dwyane Johnson makes the Layup and draws the foul on Kyrie Wagner! And-1! Dwyane Johnson to the line for 1. [Team fouls: 4] (Kyrie Wagner: 1 personal fouls)   FT 1/1: GOOD Dwyane Johnson makes 1/1 from the line.
Score: 81-65

[01:28] Team_021 possession (Score: 81-65)
Kyrie Wagner attempts a 3Pt. Contested by Dwyane Johnson (4.3 feet, ZONE). Kyrie Wagner misses. Rebound secured by Gary Johnson.

[01:16] Team_035 possession (Score: 81-65)
Domantas Green attempts a Layup. Contested by Kyrie Leonard (5.3 feet, MAN). DOMANTAS GREEN MAKES IT! Assist: Shaquille Ginobili
Score: 81-67

[01:03] Team_021 possession (Score: 81-67)
FOUL! Holding foul on Domantas Green. [IN THE BONUS! 10 team fouls] Kyrie Leonard to the line for 2 free throws. (Domantas Green: 4 personal fouls)   FT 1/2: GOOD   FT 2/2: GOOD Kyrie Leonard makes 2/2 from the line.
Score: 83-67

[00:48] Team_035 possession (Score: 83-67)
FOUL! Shooting foul on Zach Carter. Magic Westbrook to the line for 2 free throws. [BONUS: 5 team fouls] (Zach Carter: 2 personal fouls)   FT 1/2: GOOD   FT 2/2: GOOD Magic Westbrook makes 2/2 from the line.
Score: 83-69

[00:32] Team_021 possession (Score: 83-69)
Zach Carter attempts a 3Pt. Contested by Magic Westbrook (5.2 feet, MAN). ZACH CARTER MAKES IT! Assist: Kyrie Leonard
Score: 86-69

[00:15] Team_035 possession (Score: 86-69)
Magic Westbrook drives, Zach Carter stays with him. Magic Westbrook attempts a Dunk. Contested by Zach Carter (4.8 feet, ZONE). MAGIC WESTBROOK MAKES IT!
Score: 86-71

================================================================================
                              3RD QUARTER COMPLETE                              
================================================================================

3RD QUARTER SCORE: Team_021 23, Team_035 22

BOX SCORE:
================================================================================

Team_021
--------------------------------------------------------------------------------
Player                MIN  PTS  REB  AST  TO      FG   FG%      3P   3P%
--------------------------------------------------------------------------------
Zach Carter            35   10    5    0   0   4/7    57.1     0/0   0.0
Kyrie Leonard          35    4    5    2   0   2/4    50.0     0/0   0.0
Kyrie Wagner           35    2    0    0   0   1/5    20.0     0/0   0.0
Karl Bridges           35    2    0    1   0   1/1   100.0     0/0   0.0
Anthony Oladipo        35    1    1    0   0   1/3    33.3     0/0   0.0

TEAM: FG: 9/20 (45.0%), 3PT: 1/6 (16.7%), REB: 11 (2 off, 9 def), AST: 3, TO: 2
TEAM FOULS: 5 [Team_035 in BONUS]


Team_035
--------------------------------------------------------------------------------
Player                MIN  PTS  REB  AST  TO      FG   FG%      3P   3P%
--------------------------------------------------------------------------------
Dwyane Johnson         35    8    4    0   0   3/5    60.0     0/0   0.0
Magic Westbrook        35    6    3    1   0   3/4    75.0     0/0   0.0
Domantas Green         35    6    0    0   0   3/3   100.0     0/0   0.0
Shaquille Ginobili     35    2    0    3   0   1/3    33.3     0/0   0.0
Gary Johnson           35    0    4    0   0   0/4     0.0     0/0   0.0

TEAM: FG: 10/19 (52.6%), 3PT: 1/2 (50.0%), REB: 11 (0 off, 11 def), AST: 4, TO: 3
TEAM FOULS: 10 [Team_021 in BONUS]

================================================================================

================================================================================
                       4TH QUARTER - Team_021 vs Team_035                       
================================================================================

[12:00] Team_021 possession (Score: 86-71)
Anthony Oladipo attempts a 3Pt. Contested by Dwyane Johnson (4.1 feet, ZONE). Anthony Oladipo misses. Offensive rebound by Kyrie Leonard! Kyrie Leonard kicks it out.

[11:47] Team_021 possession (Score: 86-71)
Anthony Oladipo drives to the basket... Anthony Oladipo loses control! Ball rolls out of bounds! TURNOVER! (dead ball)

[11:47] Substitution (Team_021): Kyrie Leonard OUT → Joel LaVine IN (stamina_rule2)

[11:47] Substitution (Team_021): Anthony Oladipo OUT → Victor Mitchell IN (stamina_rule2)

[11:47] Substitution (Team_021): Karl Bridges OUT → Paul Allen IN (stamina_rule2)

[11:47] Substitution (Team_021): Kyrie Wagner OUT → Vince George IN (stamina_rule2)

[11:47] Substitution (Team_021): Zach Carter OUT → Magic Ingram IN (stamina_rule2)

[11:47] Substitution (Team_035): Domantas Green OUT → CJ LaVine IN (stamina_rule2)

[11:47] Substitution (Team_035): Shaquille Ginobili OUT → Cole George IN (stamina_rule2)

[11:47] Substitution (Team_035): Dwyane Johnson OUT → Tobias Jordan IN (stamina_rule2)

[11:47] Substitution (Team_035): Magic Westbrook OUT → John Durant IN (stamina_rule2)

[11:32] Team_035 possession (Score: 86-71)
FOUL! Holding foul on Victor Mitchell. [Team fouls: 1] No free throws, side out. (Victor Mitchell: 1 personal fouls)

[11:19] Team_035 possession (Score: 86-71)
Gary Johnson attempts a Layup. Contested by Magic Ingram (5.5 feet, ZONE). GARY JOHNSON MAKES IT! Assist: CJ LaVine
Score: 86-73

[11:05] Team_021 possession (Score: 86-73)
Vince George attempts a Layup. Contested by Tobias Jordan (4.2 feet, MAN). Vince George misses. Rebound secured by Gary Johnson.

[10:52] Team_035 possession (Score: 86-73)
Cole George drives, Magic Ingram stays with him. Cole George attempts a Dunk. Contested by Magic Ingram (5.4 feet, ZONE). Cole George misses. Rebound secured by Vince George.

[10:39] Team_021 possession (Score: 86-73)
Joel LaVine drives, John Durant stays with him. Joel LaVine attempts a Dunk. Contested by John Durant (4.1 feet, ZONE). JOEL LAVINE MAKES IT! Assist: Magic Ingram
Score: 88-73

[10:25] Team_035 possession (Score: 88-73)
John Durant attempts a Midrange. Contested by Magic Ingram (5.0 feet, MAN). JOHN DURANT MAKES IT! Assist: Cole George
Score: 88-75

[10:14] Team_021 possession (Score: 88-75)
Magic Ingram drives, picks up John Durant. Help arrives from Cole George! Magic Ingram attempts a Dunk. Contested by Cole George (4.4 feet, MAN). MAGIC INGRAM MAKES IT!
Score: 90-75

[09:58] Team_035 possession (Score: 90-75)
Tobias Jordan attempts a Midrange. Contested by Vince George (4.7 feet, MAN). TOBIAS JORDAN MAKES IT! Assist: Gary Johnson
Score: 90-77

[09:45] Team_021 possession (Score: 90-77)
FOUL! Shooting foul on John Durant. Magic Ingram to the line for 2 free throws. [Team fouls: 1] (John Durant: 1 personal fouls)   FT 1/2: GOOD   FT 2/2: MISS Magic Ingram makes 1/2 from the line. Offensive rebound by Vince George! Vince George kicks it out.
Score: 91-77

[09:34] Team_021 possession (Score: 91-77)
Magic Ingram commits a violation (traveling/carry)! TURNOVER! (dead ball)

[09:34] Substitution (Team_035): Gary Johnson OUT → Malcolm Turner IN (stamina_rule2)

[09:22] Team_035 possession (Score: 91-77)
Cole George drives to the basket... Cole George commits a violation (traveling/carry)! TURNOVER! (dead ball)

[09:07] Team_021 possession (Score: 91-77)
Magic Ingram makes the Layup and draws the foul on John Durant! And-1! Magic Ingram to the line for 1. [Team fouls: 2] (John Durant: 2 personal fouls)   FT 1/1: GOOD Magic Ingram makes 1/1 from the line.
Score: 94-77

[08:49] Team_035 possession (Score: 94-77)
CJ LaVine attempts a Midrange. Wide open! Joel LaVine is 6.1 feet away. [MAN] CJ LAVINE MAKES IT!
Score: 94-79

[08:33] Team_021 possession (Score: 94-79)
Joel LaVine attempts a Midrange. BLOCKED BY COLE GEORGE! Ball is loose! Rebound secured by Cole George.

[08:20] Team_035 possession (Score: 94-79)
Cole George drives, Magic Ingram stays with him. Cole George attempts a Dunk. Contested by Magic Ingram (5.4 feet, ZONE). Cole George misses. Rebound secured by Victor Mitchell.

[08:04] Team_021 possession (Score: 94-79)
FOUL! Holding foul on CJ LaVine. [Team fouls: 3] No free throws, side out. (CJ LaVine: 1 personal fouls)

[07:52] Team_021 possession (Score: 94-79)
Paul Allen attempts a 3Pt. Contested by CJ LaVine (4.4 feet, ZONE). Paul Allen misses. Rebound secured by Cole George.

[07:39] Team_035 possession (Score: 94-79)
FOUL! Shooting foul on Vince George. Tobias Jordan to the line for 2 free throws. [Team fouls: 2] (Vince George: 1 personal fouls)   FT 1/2: MISS   FT 2/2: GOOD Tobias Jordan makes 1/2 from the line.
Score: 94-80

[07:26] Team_021 possession (Score: 94-80)
Paul Allen attempts a Midrange. Contested by Malcolm Turner (5.0 feet, MAN). Paul Allen misses. Rebound secured by Cole George.

[07:12] Team_035 possession (Score: 94-80)
John Durant attempts a 3Pt. Contested by Magic Ingram (5.0 feet, MAN). JOHN DURANT MAKES IT! Assist: Cole George
Score: 94-83

[06:58] Team_021 possession (Score: 94-83)
Joel LaVine attempts a Midrange. Contested by CJ LaVine (4.0 feet, MAN). Joel LaVine misses. Rebound secured by Tobias Jordan.

[06:45] Team_035 possession (Score: 94-83)
Cole George attempts a 3Pt. Contested by Victor Mitchell (4.5 feet, MAN). Cole George misses. Rebound secured by Vince George.

[06:31] Team_021 possession (Score: 94-83)
Vince George attempts a 3Pt. Contested by Tobias Jordan (4.2 feet, MAN). VINCE GEORGE MAKES IT! Assist: Joel LaVine
Score: 97-83

[06:22] Team_035 possession (Score: 97-83)
CJ LaVine drives, Joel LaVine stays with him. CJ LaVine attempts a Layup. Wide open! Joel LaVine is 6.1 feet away. [MAN] CJ LaVine misses. Rebound secured by Vince George.

[06:06] Team_021 possession (Score: 97-83)
Vince George attempts a 3Pt. Contested by CJ LaVine (4.1 feet, ZONE). Vince George misses. Offensive rebound by Magic Ingram! Magic Ingram kicks it out.

[05:48] Team_021 possession (Score: 97-83)
Joel LaVine makes the Layup and draws the foul on John Durant! And-1! Joel LaVine to the line for 1. [Team fouls: 4] (John Durant: 3 personal fouls)   FT 1/1: MISS Joel LaVine makes 0/1 from the line. Offensive rebound by Vince George! Vince George kicks it out.
Score: 99-83

[05:33] Team_021 possession (Score: 99-83)
Victor Mitchell attempts a 3Pt. Contested by Cole George (3.4 feet, MAN). Victor Mitchell misses. Rebound secured by Cole George.

[05:24] Team_035 possession (Score: 99-83)
Cole George attempts a Midrange. Wide open! Paul Allen is 6.2 feet away. [ZONE] Cole George misses. FOUL! Loose ball foul on Magic Ingram during the rebound battle. [Team fouls: 3] No free throws, side out. (Magic Ingram: 1 personal fouls)

[05:10] Team_035 possession (Score: 99-83)
Cole George attempts a 3Pt. Contested by Victor Mitchell (4.5 feet, ZONE). Cole George misses. Rebound secured by Vince George.

[04:54] Team_021 possession (Score: 99-83)
Paul Allen makes the Layup and draws the foul on John Durant! And-1! Paul Allen to the line for 1. [BONUS: 5 team fouls] (John Durant: 4 personal fouls)   FT 1/1: MISS Paul Allen makes 0/1 from the line. Rebound secured by John Durant.
Score: 101-83

[04:42] Team_035 possession (Score: 101-83)
Malcolm Turner attempts a Layup. BLOCKED BY VICTOR MITCHELL! Ball deflects out of bounds off Malcolm Turner.

[04:31] Team_021 possession (Score: 101-83)
Joel LaVine attempts a 3Pt. Contested by Malcolm Turner (4.6 feet, ZONE). JOEL LAVINE MAKES IT! Assist: Victor Mitchell
Score: 104-83

[04:18] Team_035 possession (Score: 104-83)
Cole George attempts a 3Pt. Contested by Victor Mitchell (4.6 feet, ZONE). COLE GEORGE MAKES IT! Assist: Malcolm Turner
Score: 104-86

[03:58] Team_021 possession (Score: 104-86)
Victor Mitchell attempts a 3Pt. Contested by Cole George (3.6 feet, MAN). Victor Mitchell misses. Rebound secured by John Durant.

[03:46] Team_035 possession (Score: 104-86)
CJ LaVine attempts a 3Pt. Wide open! Joel LaVine is 6.1 feet away. [MAN] CJ LaVine misses. Rebound secured by Vince George.

[03:32] Team_021 possession (Score: 104-86)
Joel LaVine attempts a 3Pt. Contested by CJ LaVine (4.2 feet, ZONE). JOEL LAVINE MAKES IT! Assist: Paul Allen
Score: 107-86

[03:18] Team_035 possession (Score: 107-86)
CJ LaVine attempts a 3Pt. Wide open! Joel LaVine is 6.2 feet away. [MAN] CJ LAVINE MAKES IT! Assist: Cole George
Score: 107-89

[03:05] Team_021 possession (Score: 107-89)
FOUL! Shooting foul on CJ LaVine. Joel LaVine to the line for 2 free throws. [BONUS: 6 team fouls] (CJ LaVine: 2 personal fouls)   FT 1/2: MISS   FT 2/2: GOOD Joel LaVine makes 1/2 from the line.
Score: 108-89

[02:51] Team_035 possession (Score: 108-89)
CJ LaVine attempts a Layup. BLOCKED BY VICTOR MITCHELL! Ball deflects out of bounds off CJ LaVine.

[02:35] Team_021 possession (Score: 108-89)
Paul Allen attempts a Midrange. Contested by Malcolm Turner (5.0 feet, MAN). PAUL ALLEN MAKES IT!
Score: 110-89

[02:21] Team_035 possession (Score: 110-89)
Cole George attempts a 3Pt. Contested by Victor Mitchell (4.8 feet, MAN). Cole George misses. Rebound secured by Victor Mitchell.

[02:06] Team_021 possession (Score: 110-89)
Magic Ingram loses the ball! Stripped by John Durant! TURNOVER! (live ball)

[01:50] Team_035 possession (Score: 110-89)
FOUL! Reach-in foul on Magic Ingram during the drive. [Team fouls: 4] No free throws, side out. (Magic Ingram: 2 personal fouls)

[01:34] Team_035 possession (Score: 110-89)
Cole George attempts a 3Pt. Contested by Victor Mitchell (4.9 feet, ZONE). Cole George misses. Offensive rebound by Tobias Jordan! Tobias Jordan kicks it out.

[01:22] Team_035 possession (Score: 110-89)
Malcolm Turner attempts a Midrange. Contested by Vince George (5.9 feet, ZONE). MALCOLM TURNER MAKES IT! Assist: Tobias Jordan
Score: 110-91

[01:07] Team_021 possession (Score: 110-91)
FOUL! Offensive foul on Magic Ingram! John Durant drew the charge! [Team fouls: 5] (Magic Ingram: 3 personal fouls) TURNOVER! (dead ball)

[00:58] Team_035 possession (Score: 110-91)
John Durant attempts a Midrange. Wide open! Paul Allen is 6.1 feet away. [ZONE] JOHN DURANT MAKES IT! Assist: CJ LaVine
Score: 110-93

[00:41] Team_021 possession (Score: 110-93)
Vince George attempts a Layup. Contested by John Durant (4.6 feet, ZONE). Vince George misses. Rebound secured by Cole George.

[00:23] Team_035 possession (Score: 110-93)
Tobias Jordan drives and kicks out. Tobias Jordan attempts a 3Pt. Contested by Victor Mitchell (4.8 feet, ZONE). Tobias Jordan misses. Rebound secured by Vince George.

[00:05] Team_021 possession (Score: 110-93)
FOUL! Reach-in foul on John Durant during the drive. [IN THE BONUS! 7 team fouls] Vince George to the line for 2 free throws. (John Durant: 5 personal fouls)   FT 1/2: GOOD   FT 2/2: MISS Vince George makes 1/2 from the line. Rebound secured by John Durant.
Score: 111-93

================================================================================
                              4TH QUARTER COMPLETE                              
================================================================================

4TH QUARTER SCORE: Team_021 25, Team_035 22

BOX SCORE:
================================================================================

Team_021
--------------------------------------------------------------------------------
Player                MIN  PTS  REB  AST  TO      FG   FG%      3P   3P%
--------------------------------------------------------------------------------
Joel LaVine            13    9    0    1   0   4/6    66.7     0/0   0.0
Magic Ingram           13    5    1    1   0   2/2   100.0     0/0   0.0
Vince George           13    3    8    0   0   1/4    25.0     0/0   0.0
Paul Allen             13    2    0    1   0   1/4    25.0     0/0   0.0
Kyrie Leonard          35    0    1    0   0   0/0     0.0     0/0   0.0
Victor Mitchell        13    0    2    1   0   0/2     0.0     0/0   0.0

TEAM: FG: 8/18 (44.4%), 3PT: 3/6 (50.0%), REB: 12 (4 off, 8 def), AST: 4, TO: 4
TEAM FOULS: 5 [Team_035 in BONUS]


Team_035
--------------------------------------------------------------------------------
Player                MIN  PTS  REB  AST  TO      FG   FG%      3P   3P%
--------------------------------------------------------------------------------
John Durant            13    7    4    0   0   3/3   100.0     0/0   0.0
CJ LaVine              13    5    0    2   0   2/5    40.0     0/0   0.0
Cole George            13    3    5    3   0   1/6    16.7     0/0   0.0
Tobias Jordan          13    3    2    1   0   2/3    66.7     0/0   0.0
Gary Johnson           37    2    1    1   0   1/1   100.0     0/0   0.0
Malcolm Turner         11    2    0    1   0   1/2    50.0     0/0   0.0

TEAM: FG: 10/20 (50.0%), 3PT: 3/7 (42.9%), REB: 12 (2 off, 10 def), AST: 8, TO: 1
TEAM FOULS: 7 [Team_021 in BONUS]

================================================================================

================================================================================
                               FULL GAME COMPLETE                               
================================================================================

FINAL SCORE: Team_021 111, Team_035 93

SCORING BY QUARTER:
--------------------------------------------------------------------------------
Team                     Q1     Q2     Q3     Q4    FINAL
--------------------------------------------------------------------------------
Team_021                 30     33     23     25      111
Team_035                 23     26     22     22       93
--------------------------------------------------------------------------------

FULL GAME BOX SCORE:
================================================================================

Team_021
--------------------------------------------------------------------------------
Player                MIN  PTS  REB  AST  TO      FG   FG%      3P   3P%      FT STL BLK
--------------------------------------------------------------------------------
Kyrie Leonard          35   15   13    3   0   5/9    55.6   1/3    33.3   7/8     0   0
Anthony Oladipo        35   16    7    1   1   6/11   54.5   3/5    60.0   3/6     1   1
Karl Bridges           35   14    0    3   1   6/9    66.7   1/1   100.0   3/4     0   0
Kyrie Wagner           35   12    0    3   2   5/12   41.7   1/6    16.7   3/6     0   0
Zach Carter            35   19   13    3   1  11/15   73.3   1/1   100.0   6/9     2   1
Joel LaVine            13    9    0    1   0   4/7    57.1   2/3    66.7   1/3     0   0
Victor Mitchell        13    2    4    1   0   1/3    33.3   0/2     0.0   0/0     0   2
Paul Allen             13    2    0    1   0   1/4    25.0   0/1     0.0   0/1     0   0
Vince George           13    3    8    0   0   1/5    20.0   1/1   100.0   1/2     0   0
Magic Ingram           13    5    1    1   3   2/2   100.0   0/0     0.0   2/3     0   0

TEAM: FG: 44/79 (55.7%), 3PT: 10/23 (43.5%), REB: 44 (13 off, 31 def), AST: 17, TO: 8


Team_035
--------------------------------------------------------------------------------
Player                MIN  PTS  REB  AST  TO      FG   FG%      3P   3P%      FT STL BLK
--------------------------------------------------------------------------------
Gary Johnson           37   19    7    2   0   9/15   60.0   1/3    33.3   2/2     0   0
Domantas Green         35   10    0    1   3   4/8    50.0   0/3     0.0   4/4     0   0
Shaquille Ginobili     35   17    0    4   1   7/14   50.0   2/5    40.0   3/3     0   0
Dwyane Johnson         35   15    9    3   2   6/10   60.0   1/2    50.0   4/4     1   0
Magic Westbrook        35    9   13    2   0   4/7    57.1   1/1   100.0   2/2     0   0
CJ LaVine              13    5    0    2   0   2/5    40.0   1/2    50.0   0/0     0   0
Cole George            13    3    5    3   0   1/8    12.5   1/6    16.7   0/0     0   1
Tobias Jordan          13    6    3    1   0   3/4    75.0   0/0     0.0   2/3     0   0
John Durant            13    7    5    0   0   3/3   100.0   1/1   100.0   0/0     1   0
Malcolm Turner         11    2    0    1   1   1/2    50.0   0/0     0.0   0/0     0   0

TEAM: FG: 41/77 (53.2%), 3PT: 8/23 (34.8%), REB: 44 (9 off, 35 def), AST: 19, TO: 7

================================================================================
