================================================================================
                        FULL GAME - Team_004 vs Team_074                        
================================================================================

================================================================================
                       1ST QUARTER - Team_004 vs Team_074                       
================================================================================

[12:00] Team_004 possession (Score: 0-0)
Jabari Wade attempts a 3Pt. Wide open! Dwyane Quickley is 6.1 feet away. [ZONE] Jabari Wade misses. Rebound secured by James Turner.

[11:44] Team_074 possession (Score: 0-0)
FOUL! Shooting foul on Draymond Fox. Donovan Doncic to the line for 3 free throws. [Team fouls: 1] (Draymond Fox: 1 personal fouls)   FT 1/3: MISS   FT 2/3: GOOD   FT 3/3: GOOD Donovan Doncic makes 2/3 from the line.
Score: 0-2

[11:26] Team_004 possession (Score: 0-2)
Michael Curry attempts a 3Pt. Contested by Dwyane Quickley (5.6 feet, MAN). MICHAEL CURRY MAKES IT! Assist: Jabari Wade
Score: 3-2

[11:11] Team_074 possession (Score: 3-2)
James Turner drives, Anthony Lillard stays with him. James Turner attempts a Layup. Contested by Anthony Lillard (4.8 feet, MAN). JAMES TURNER MAKES IT! Assist: Donovan Doncic
Score: 3-4

[11:01] Team_004 possession (Score: 3-4)
Draymond Fox drives, picks up Donovan Doncic. Help arrives from Chris Carter! Draymond Fox attempts a Dunk. Contested by Chris Carter (4.1 feet, ZONE). DRAYMOND FOX MAKES IT!
Score: 5-4

[10:48] Team_074 possession (Score: 5-4)
Dwyane Quickley attempts a Layup. Contested by Draymond Fox (4.4 feet, ZONE). DWYANE QUICKLEY MAKES IT! Assist: Chris Carter
Score: 5-6

[10:33] Team_004 possession (Score: 5-6)
Draymond Fox drives, Donovan Doncic stays with him. Draymond Fox attempts a Dunk. Contested by Donovan Doncic (4.1 feet, MAN). DRAYMOND FOX MAKES IT! Assist: Anthony Lillard
Score: 7-6

[10:16] Team_074 possession (Score: 7-6)
Chris Carter attempts a Midrange. Contested by Dwyane Irving (4.2 feet, ZONE). Chris Carter misses. Rebound secured by Draymond Fox.

[10:03] Team_004 possession (Score: 7-6)
Dwyane Irving attempts a 3Pt. Contested by Dwyane Quickley (5.7 feet, ZONE). Dwyane Irving misses. Rebound secured by Shai Green.

[09:47] Team_074 possession (Score: 7-6)
Donovan Doncic attempts a Midrange. Contested by Draymond Fox (4.5 feet, ZONE). Donovan Doncic misses. Rebound secured by Anthony Lillard.

[09:34] Team_004 possession (Score: 7-6)
Draymond Fox drives, Donovan Doncic stays with him. Draymond Fox attempts a Layup. Contested by Donovan Doncic (4.1 feet, ZONE). Draymond Fox misses. Rebound secured by Donovan Doncic.

[09:21] Team_074 possession (Score: 7-6)
Chris Carter attempts a Layup. BLOCKED BY JABARI WADE! Ball is loose! Offensive rebound by Donovan Doncic! Donovan Doncic kicks it out.

[09:01] Team_074 possession (Score: 7-6)
Dwyane Quickley drives to the basket... Dwyane Quickley throws a bad pass out of bounds! TURNOVER! (dead ball)

[08:49] Team_004 possession (Score: 7-6)
Anthony Lillard attempts a Layup. BLOCKED BY JAMES TURNER! Ball is loose! Rebound secured by Shai Green.

[08:38] Team_074 possession (Score: 7-6)
Dwyane Quickley makes the Layup and draws the foul on Anthony Lillard! And-1! Dwyane Quickley to the line for 1. [Team fouls: 2] (Anthony Lillard: 1 personal fouls)   FT 1/1: MISS Dwyane Quickley makes 0/1 from the line. Offensive rebound by James Turner! James Turner's putback is no good.
Score: 7-8

[08:22] Team_004 possession (Score: 7-8)
Draymond Fox drives and kicks out. Jabari Wade attempts a 3Pt. Contested by Chris Carter (4.2 feet, MAN). Jabari Wade misses. Rebound secured by Donovan Doncic.

[08:06] Team_074 possession (Score: 7-8)
Shai Green attempts a Layup. BLOCKED BY DWYANE IRVING! Ball deflects out of bounds off Shai Green.

[07:51] Team_004 possession (Score: 7-8)
Draymond Fox attempts a Midrange. Contested by Donovan Doncic (4.1 feet, MAN). DRAYMOND FOX MAKES IT! Assist: Anthony Lillard
Score: 9-8

[07:40] Team_074 possession (Score: 9-8)
FOUL! Shooting foul on Draymond Fox. Shai Green to the line for 2 free throws. [Team fouls: 3] (Draymond Fox: 2 personal fouls)   FT 1/2: MISS   FT 2/2: GOOD Shai Green makes 1/2 from the line.
Score: 9-9

[07:26] Team_004 possession (Score: 9-9)
FOUL! Reach-in foul on Dwyane Quickley during the drive. [Team fouls: 1] No free throws, side out. (Dwyane Quickley: 1 personal fouls)

[07:13] Team_004 possession (Score: 9-9)
Jabari Wade drives, picks up Donovan Doncic. Help arrives from Chris Carter! Jabari Wade attempts a Dunk. Contested by Chris Carter (4.4 feet, ZONE). Jabari Wade misses. Rebound secured by Shai Green.

[06:58] Team_074 possession (Score: 9-9)
Shai Green attempts a 3Pt. Contested by Dwyane Irving (4.1 feet, MAN). Shai Green misses. Rebound secured by Anthony Lillard.

[06:38] Team_004 possession (Score: 9-9)
Draymond Fox attempts a 3Pt. Contested by Dwyane Quickley (5.8 feet, ZONE). Draymond Fox misses. Rebound secured by Donovan Doncic.

[06:23] Team_074 possession (Score: 9-9)
Chris Carter attempts a 3Pt. Contested by Michael Curry (5.7 feet, ZONE). Chris Carter misses. Rebound secured by Draymond Fox.

[06:07] Team_004 possession (Score: 9-9)
Anthony Lillard attempts a Midrange. Contested by James Turner (3.8 feet, MAN). Anthony Lillard misses. Rebound secured by Donovan Doncic.

[05:52] Team_074 possession (Score: 9-9)
James Turner attempts a Layup. Contested by Anthony Lillard (4.8 feet, MAN). James Turner misses. Rebound secured by Dwyane Irving.

[05:34] Team_004 possession (Score: 9-9)
Michael Curry attempts a 3Pt. Contested by Dwyane Quickley (5.6 feet, ZONE). Michael Curry misses. Rebound secured by James Turner.

[05:18] Team_074 possession (Score: 9-9)
FOUL! Holding foul on Jabari Wade. [Team fouls: 4] No free throws, side out. (Jabari Wade: 1 personal fouls)

[05:05] Team_074 possession (Score: 9-9)
Donovan Doncic attempts a Midrange. Contested by Draymond Fox (4.5 feet, MAN). Donovan Doncic misses. Rebound secured by Draymond Fox.

[04:48] Team_004 possession (Score: 9-9)
Draymond Fox drives, Donovan Doncic stays with him. Draymond Fox attempts a Layup. Contested by Donovan Doncic (4.1 feet, MAN). DRAYMOND FOX MAKES IT! Assist: Dwyane Irving
Score: 11-9

[04:36] Team_074 possession (Score: 11-9)
Shai Green throws a bad pass out of bounds! TURNOVER! (dead ball)

[04:26] Team_004 possession (Score: 11-9)
Draymond Fox attempts a Layup. Contested by Donovan Doncic (4.1 feet, ZONE). DRAYMOND FOX MAKES IT! Assist: Jabari Wade
Score: 13-9

[04:12] Team_074 possession (Score: 13-9)
James Turner attempts a Midrange. Contested by Jabari Wade (5.4 feet, ZONE). JAMES TURNER MAKES IT! Assist: Donovan Doncic
Score: 13-11

[03:54] Team_004 possession (Score: 13-11)
Dwyane Irving attempts a Layup. Contested by Donovan Doncic (4.0 feet, ZONE). Dwyane Irving misses. Rebound secured by Donovan Doncic.

[03:37] Team_074 possession (Score: 13-11)
Shai Green makes the Dunk and draws the foul on Jabari Wade! And-1! Shai Green to the line for 1. [BONUS: 5 team fouls] (Jabari Wade: 2 personal fouls)   FT 1/1: GOOD Shai Green makes 1/1 from the line.
Score: 13-14

[03:26] Team_004 possession (Score: 13-14)
Michael Curry makes the Dunk and draws the foul on Donovan Doncic! And-1! Michael Curry to the line for 1. [Team fouls: 2] (Donovan Doncic: 1 personal fouls)   FT 1/1: GOOD Michael Curry makes 1/1 from the line.
Score: 16-14

[03:12] Team_074 possession (Score: 16-14)
Dwyane Quickley attempts a 3Pt. Contested by Michael Curry (5.4 feet, MAN). Dwyane Quickley misses. Offensive rebound by James Turner! James Turner's putback is no good. Rebound secured by Dwyane Irving.

[02:52] Team_004 possession (Score: 16-14)
Dwyane Irving throws a bad pass! Stolen by Shai Green! TURNOVER! (live ball)

[02:35] Team_074 possession (Score: 16-14)
Chris Carter attempts a 3Pt. Contested by Jabari Wade (5.5 feet, ZONE). Chris Carter misses. Offensive rebound by James Turner! James Turner puts it back in!
Score: 16-16

[02:18] Team_004 possession (Score: 16-16)
Anthony Lillard attempts a Midrange. Contested by James Turner (4.0 feet, MAN). ANTHONY LILLARD MAKES IT!
Score: 18-16

[02:04] Team_074 possession (Score: 18-16)
James Turner makes the Midrange and draws the foul on Jabari Wade! And-1! James Turner to the line for 1. [BONUS: 6 team fouls] (Jabari Wade: 3 personal fouls)   FT 1/1: MISS James Turner makes 0/1 from the line. Rebound secured by Dwyane Irving.
Score: 18-18

[01:49] Team_004 possession (Score: 18-18)
FOUL! Reach-in foul on Donovan Doncic during the drive. [Team fouls: 3] No free throws, side out. (Donovan Doncic: 2 personal fouls)

[01:37] Team_004 possession (Score: 18-18)
Jabari Wade attempts a Midrange. Contested by Chris Carter (5.2 feet, ZONE). Jabari Wade misses. Offensive rebound by Anthony Lillard! Anthony Lillard kicks it out.

[01:21] Team_004 possession (Score: 18-18)
Dwyane Irving attempts a Midrange. Contested by Chris Carter (4.9 feet, ZONE). Dwyane Irving misses. Rebound secured by Donovan Doncic.

[01:07] Team_074 possession (Score: 18-18)
Dwyane Quickley attempts a Midrange. Contested by Michael Curry (5.6 feet, MAN). Dwyane Quickley misses. Offensive rebound by Donovan Doncic! Donovan Doncic kicks it out.

[00:50] Team_074 possession (Score: 18-18)
Chris Carter attempts a 3Pt. Contested by Jabari Wade (5.7 feet, MAN). Chris Carter misses. Rebound secured by Dwyane Irving.

[00:41] Team_004 possession (Score: 18-18)
FOUL! Holding foul on Donovan Doncic. [Team fouls: 4] No free throws, side out. (Donovan Doncic: 3 personal fouls)

[00:27] Team_004 possession (Score: 18-18)
Dwyane Irving makes the Layup and draws the foul on Shai Green! And-1! Dwyane Irving to the line for 1. [BONUS: 5 team fouls] (Shai Green: 1 personal fouls)   FT 1/1: GOOD Dwyane Irving makes 1/1 from the line.
Score: 21-18

[00:09] Team_074 possession (Score: 21-18)
James Turner attempts a Midrange. Contested by Draymond Fox (5.2 feet, ZONE). James Turner misses. Rebound secured by Anthony Lillard.

================================================================================
                              1ST QUARTER COMPLETE                              
================================================================================

1ST QUARTER SCORE: Team_004 21, Team_074 18

BOX SCORE:
================================================================================

Team_004
--------------------------------------------------------------------------------
Player                MIN  PTS  REB  AST  TO      FG   FG%      3P   3P%
--------------------------------------------------------------------------------
Draymond Fox           12   10    3    0   0   5/8    62.5     0/0   0.0
Michael Curry          12    6    0    0   0   2/3    66.7     0/0   0.0
Dwyane Irving          12    3    4    1   0   1/4    25.0     0/0   0.0
Anthony Lillard        12    2    4    2   0   1/3    33.3     0/0   0.0
Jabari Wade            12    0    0    2   0   0/2     0.0     0/0   0.0

TEAM: FG: 9/20 (45.0%), 3PT: 1/5 (20.0%), REB: 11 (1 off, 10 def), AST: 5, TO: 1
TEAM FOULS: 6 [Team_074 in BONUS]


Team_074
--------------------------------------------------------------------------------
Player                MIN  PTS  REB  AST  TO      FG   FG%      3P   3P%
--------------------------------------------------------------------------------
James Turner           12    6    4    0   0   3/6    50.0     0/0   0.0
Shai Green             12    4    3    0   0   2/4    50.0     0/0   0.0
Donovan Doncic         12    2    8    2   0   1/3    33.3     0/0   0.0
Dwyane Quickley        12    2    0    0   0   1/3    33.3     0/0   0.0
Chris Carter           12    0    0    1   0   0/3     0.0     0/0   0.0

TEAM: FG: 7/19 (36.8%), 3PT: 2/6 (33.3%), REB: 15 (4 off, 11 def), AST: 3, TO: 2
TEAM FOULS: 5 [Team_004 in BONUS]

================================================================================

================================================================================
                       2ND QUARTER - Team_004 vs Team_074                       
================================================================================

[12:00] Team_004 possession (Score: 21-18)
FOUL! Reach-in foul on Chris Carter during the drive. [Team fouls: 1] No free throws, side out. (Chris Carter: 1 personal fouls)

[11:42] Team_004 possession (Score: 21-18)
Anthony Lillard attempts a 3Pt. Contested by James Turner (4.1 feet, MAN). Anthony Lillard misses. Rebound secured by James Turner.

[11:23] Team_074 possession (Score: 21-18)
FOUL! Offensive foul on Chris Carter! Jabari Wade drew the charge! [Team fouls: 2] (Chris Carter: 2 personal fouls) TURNOVER! (dead ball)

[11:13] Team_004 possession (Score: 21-18)
Dwyane Irving attempts a 3Pt. Contested by Shai Green (4.2 feet, MAN). Dwyane Irving misses. Rebound secured by Shai Green.

[10:59] Team_074 possession (Score: 21-18)
Donovan Doncic drives to the basket... Donovan Doncic loses control! Ball rolls out of bounds! TURNOVER! (dead ball)

[10:59] Substitution (Team_004): Michael Curry OUT → Karl Reaves IN (stamina_rule2)

[10:59] Substitution (Team_004): Jabari Wade OUT → Russell Barnes IN (stamina_rule2)

[10:59] Substitution (Team_004): Dwyane Irving OUT → Kristaps Green IN (stamina_rule2)

[10:59] Substitution (Team_004): Draymond Fox OUT → Michael Sabonis IN (stamina_rule2)

[10:59] Substitution (Team_004): Anthony Lillard OUT → Shai Beal IN (stamina_rule2)

[10:59] Substitution (Team_074): Dwyane Quickley OUT → James Barnes IN (stamina_rule2)

[10:59] Substitution (Team_074): Chris Carter OUT → Giannis Westbrook IN (stamina_rule2)

[10:59] Substitution (Team_074): Shai Green OUT → Ayo Smith IN (stamina_rule2)

[10:59] Substitution (Team_074): Donovan Doncic OUT → Yao Randle IN (stamina_rule2)

[10:59] Substitution (Team_074): James Turner OUT → Jaren Rozier IN (stamina_rule2)

[10:43] Team_004 possession (Score: 21-18)
Karl Reaves attempts a 3Pt. Contested by James Barnes (3.8 feet, ZONE). Karl Reaves misses. Rebound secured by Ayo Smith.

[10:28] Team_074 possession (Score: 21-18)
Giannis Westbrook attempts a 3Pt. Contested by Russell Barnes (4.7 feet, MAN). Giannis Westbrook misses. Rebound secured by Shai Beal.

[10:17] Team_004 possession (Score: 21-18)
Kristaps Green throws a bad pass! Stolen by Ayo Smith! TURNOVER! (live ball)

[10:05] Team_074 possession (Score: 21-18)
Jaren Rozier drives to the basket... Jaren Rozier commits a violation (traveling/carry)! TURNOVER! (dead ball)

[09:52] Team_004 possession (Score: 21-18)
FOUL! Offensive foul on Kristaps Green! Ayo Smith drew the charge! [Team fouls: 1] (Kristaps Green: 1 personal fouls) TURNOVER! (dead ball)

[09:38] Team_074 possession (Score: 21-18)
Jaren Rozier makes the Layup and draws the foul on Shai Beal! And-1! Jaren Rozier to the line for 1. [Team fouls: 2] (Shai Beal: 1 personal fouls)   FT 1/1: GOOD Jaren Rozier makes 1/1 from the line.
Score: 21-21

[09:25] Team_004 possession (Score: 21-21)
Shai Beal attempts a Midrange. Contested by Jaren Rozier (4.5 feet, MAN). Shai Beal misses. Offensive rebound by Russell Barnes! Russell Barnes kicks it out.

[09:12] Team_004 possession (Score: 21-21)
FOUL! Reach-in foul on Yao Randle during the drive. [Team fouls: 3] No free throws, side out. (Yao Randle: 1 personal fouls)

[08:59] Team_004 possession (Score: 21-21)
Shai Beal attempts a 3Pt. Contested by James Barnes (4.3 feet, ZONE). Shai Beal misses. Rebound secured by Jaren Rozier.

[08:47] Team_074 possession (Score: 21-21)
Yao Randle drives to the basket... Yao Randle throws a bad pass out of bounds! TURNOVER! (dead ball)

[08:35] Team_004 possession (Score: 21-21)
Michael Sabonis makes the Layup and draws the foul on Yao Randle! And-1! Michael Sabonis to the line for 1. [Team fouls: 4] (Yao Randle: 2 personal fouls)   FT 1/1: GOOD Michael Sabonis makes 1/1 from the line.
Score: 24-21

[08:16] Team_074 possession (Score: 24-21)
James Barnes attempts a 3Pt. Contested by Karl Reaves (5.0 feet, ZONE). James Barnes misses. Rebound secured by Russell Barnes.

[08:03] Team_004 possession (Score: 24-21)
Karl Reaves attempts a Midrange. Contested by James Barnes (3.8 feet, MAN). KARL REAVES MAKES IT!
Score: 26-21

[07:46] Team_074 possession (Score: 26-21)
Jaren Rozier attempts a 3Pt. Contested by Shai Beal (4.9 feet, MAN). Jaren Rozier misses. Offensive rebound by Jaren Rozier! Jaren Rozier kicks it out.

[07:33] Team_074 possession (Score: 26-21)
FOUL! Offensive foul on Giannis Westbrook! Russell Barnes drew the charge! [Team fouls: 5] (Giannis Westbrook: 1 personal fouls) TURNOVER! (dead ball)

[07:21] Team_004 possession (Score: 26-21)
Karl Reaves drives to the basket... Karl Reaves throws a bad pass! Stolen by James Barnes! TURNOVER! (live ball)

[07:08] Team_074 possession (Score: 26-21)
Giannis Westbrook makes the Layup and draws the foul on Russell Barnes! And-1! Giannis Westbrook to the line for 1. [Team fouls: 3] (Russell Barnes: 1 personal fouls)   FT 1/1: MISS Giannis Westbrook makes 0/1 from the line. Offensive rebound by Yao Randle! Yao Randle kicks it out.
Score: 26-23

[06:54] Team_074 possession (Score: 26-23)
Ayo Smith makes the Dunk and draws the foul on Kristaps Green! And-1! Ayo Smith to the line for 1. [Team fouls: 4] (Kristaps Green: 2 personal fouls)   FT 1/1: GOOD Ayo Smith makes 1/1 from the line.
Score: 26-26

[06:37] Team_004 possession (Score: 26-26)
Karl Reaves throws a bad pass! Stolen by James Barnes! TURNOVER! (live ball)

[06:20] Team_074 possession (Score: 26-26)
Jaren Rozier drives and kicks out. Yao Randle attempts a Midrange. Contested by Michael Sabonis (4.9 feet, ZONE). Yao Randle misses. Offensive rebound by Yao Randle! Yao Randle kicks it out.

[06:07] Team_074 possession (Score: 26-26)
Ayo Smith attempts a 3Pt. Contested by Karl Reaves (5.2 feet, ZONE). AYO SMITH MAKES IT! Assist: James Barnes
Score: 26-29

[05:55] Team_004 possession (Score: 26-29)
Michael Sabonis attempts a Layup. BLOCKED BY YAO RANDLE! Ball is loose! Rebound secured by Jaren Rozier.

[05:39] Team_074 possession (Score: 26-29)
Yao Randle attempts a Midrange. Contested by Russell Barnes (4.7 feet, ZONE). YAO RANDLE MAKES IT!
Score: 26-31

[05:27] Team_004 possession (Score: 26-31)
Karl Reaves drives, Yao Randle stays with him. Karl Reaves attempts a Dunk. Contested by Yao Randle (4.0 feet, ZONE). KARL REAVES MAKES IT!
Score: 28-31

[05:14] Team_074 possession (Score: 28-31)
FOUL! Shooting foul on Karl Reaves. James Barnes to the line for 3 free throws. [BONUS: 5 team fouls] (Karl Reaves: 1 personal fouls)   FT 1/3: GOOD   FT 2/3: GOOD   FT 3/3: GOOD James Barnes makes 3/3 from the line.
Score: 28-34

[05:02] Team_004 possession (Score: 28-34)
Shai Beal attempts a Layup. Contested by Jaren Rozier (4.5 feet, ZONE). SHAI BEAL MAKES IT! Assist: Russell Barnes
Score: 30-34

[04:45] Team_074 possession (Score: 30-34)
Jaren Rozier attempts a Midrange. Contested by Shai Beal (4.9 feet, MAN). JAREN ROZIER MAKES IT!
Score: 30-36

[04:34] Team_004 possession (Score: 30-36)
Michael Sabonis drives and kicks out. Michael Sabonis attempts a Midrange. Contested by Yao Randle (4.5 feet, MAN). MICHAEL SABONIS MAKES IT!
Score: 32-36

[04:19] Team_074 possession (Score: 32-36)
Jaren Rozier drives to the basket... Jaren Rozier throws a bad pass! Stolen by Shai Beal! TURNOVER! (live ball)

[04:03] Team_004 possession (Score: 32-36)
Kristaps Green drives to the basket... Kristaps Green loses control! Ball rolls out of bounds! TURNOVER! (dead ball)

[03:46] Team_074 possession (Score: 32-36)
Jaren Rozier attempts a Midrange. Contested by Shai Beal (4.9 feet, MAN). Jaren Rozier misses. Rebound secured by Shai Beal.

[03:32] Team_004 possession (Score: 32-36)
FOUL! Holding foul on Yao Randle. [IN THE BONUS! 6 team fouls] Michael Sabonis to the line for 2 free throws. (Yao Randle: 3 personal fouls)   FT 1/2: GOOD   FT 2/2: GOOD Michael Sabonis makes 2/2 from the line.
Score: 34-36

[03:20] Team_074 possession (Score: 34-36)
James Barnes attempts a Midrange. Contested by Karl Reaves (5.1 feet, MAN). JAMES BARNES MAKES IT! Assist: Giannis Westbrook
Score: 34-38

[03:04] Team_004 possession (Score: 34-38)
Shai Beal drives and kicks out. Karl Reaves makes the Midrange and draws the foul on Giannis Westbrook! And-1! Karl Reaves to the line for 1. [BONUS: 7 team fouls] (Giannis Westbrook: 2 personal fouls)   FT 1/1: MISS Karl Reaves makes 0/1 from the line. Rebound secured by Yao Randle.
Score: 36-38

[02:50] Team_074 possession (Score: 36-38)
Jaren Rozier drives to the basket... FOUL! Offensive foul on Jaren Rozier! Shai Beal drew the charge! [Team fouls: 8] (Jaren Rozier: 1 personal fouls) TURNOVER! (dead ball)

[02:37] Team_004 possession (Score: 36-38)
FOUL! Shooting foul on Giannis Westbrook. Michael Sabonis to the line for 2 free throws. [BONUS: 9 team fouls] (Giannis Westbrook: 3 personal fouls)   FT 1/2: MISS   FT 2/2: MISS Michael Sabonis makes 0/2 from the line. Offensive rebound by Shai Beal! Shai Beal kicks it out.

[02:19] Team_004 possession (Score: 36-38)
Michael Sabonis drives, picks up Yao Randle. Help arrives from Giannis Westbrook! Michael Sabonis attempts a Dunk. Contested by Giannis Westbrook (4.7 feet, MAN). Michael Sabonis misses. Offensive rebound by Shai Beal! Shai Beal kicks it out.

[02:03] Team_004 possession (Score: 36-38)
Michael Sabonis attempts a Midrange. Contested by Yao Randle (4.7 feet, MAN). MICHAEL SABONIS MAKES IT! Assist: Shai Beal
Score: 38-38

[01:50] Team_074 possession (Score: 38-38)
Ayo Smith attempts a Midrange. Contested by Kristaps Green (4.7 feet, ZONE). Ayo Smith misses. Rebound secured by Russell Barnes.

[01:36] Team_004 possession (Score: 38-38)
Michael Sabonis attempts a Midrange. Contested by Yao Randle (4.8 feet, MAN). Michael Sabonis misses. Rebound secured by Ayo Smith.

[01:18] Team_074 possession (Score: 38-38)
James Barnes attempts a 3Pt. Contested by Karl Reaves (5.2 feet, ZONE). James Barnes misses. Rebound secured by Russell Barnes.

[01:00] Team_004 possession (Score: 38-38)
Karl Reaves attempts a 3Pt. Contested by Ayo Smith (4.6 feet, ZONE). Karl Reaves misses. Rebound secured by Yao Randle.

[00:47] Team_074 possession (Score: 38-38)
Giannis Westbrook attempts a Midrange. Contested by Russell Barnes (5.1 feet, ZONE). Giannis Westbrook misses. FOUL! Loose ball foul on Michael Sabonis during the rebound battle. [IN THE BONUS! 6 team fouls] Yao Randle to the line for 2 free throws. (Michael Sabonis: 1 personal fouls)   FT 1/2: GOOD   FT 2/2: MISS Yao Randle makes 1/2 from the line. Rebound secured by Michael Sabonis.
Score: 38-39

[00:35] Team_004 possession (Score: 38-39)
Russell Barnes drives to the basket... Russell Barnes throws a bad pass! Stolen by Yao Randle! TURNOVER! (live ball)

[00:19] Team_074 possession (Score: 38-39)
Giannis Westbrook attempts a 3Pt. Contested by Russell Barnes (5.1 feet, MAN). Giannis Westbrook misses. Rebound secured by Shai Beal.

[00:07] Team_004 possession (Score: 38-39)
Kristaps Green drives, Ayo Smith stays with him. Kristaps Green attempts a Layup. Contested by Ayo Smith (5.1 feet, MAN). KRISTAPS GREEN MAKES IT! Assist: Michael Sabonis
Score: 40-39

================================================================================
                              2ND QUARTER COMPLETE                              
================================================================================

2ND QUARTER SCORE: Team_004 19, Team_074 21

BOX SCORE:
================================================================================

Team_004
--------------------------------------------------------------------------------
Player                MIN  PTS  REB  AST  TO      FG   FG%      3P   3P%
--------------------------------------------------------------------------------
Michael Sabonis        11    9    1    1   0   4/6    66.7     0/0   0.0
Karl Reaves            11    4    0    0   0   2/4    50.0     0/0   0.0
Shai Beal              11    2    5    1   0   1/3    33.3     0/0   0.0
Kristaps Green         11    2    0    0   0   1/1   100.0     0/0   0.0
Anthony Lillard        13    0    0    0   0   0/1     0.0     0/0   0.0
Dwyane Irving          13    0    0    0   0   0/1     0.0     0/0   0.0
Russell Barnes         11    0    4    1   0   0/0     0.0     0/0   0.0

TEAM: FG: 8/16 (50.0%), 3PT: 0/5 (0.0%), REB: 9 (3 off, 6 def), AST: 3, TO: 6
TEAM FOULS: 6 [Team_074 in BONUS]


Team_074
--------------------------------------------------------------------------------
Player                MIN  PTS  REB  AST  TO      FG   FG%      3P   3P%
--------------------------------------------------------------------------------
Ayo Smith              11    6    2    0   0   2/3    66.7     0/0   0.0
Jaren Rozier           11    5    3    0   0   2/3    66.7     0/0   0.0
James Barnes           11    5    0    1   0   2/4    50.0     0/0   0.0
Yao Randle             11    2    4    0   0   1/1   100.0     0/0   0.0
James Turner           13    0    1    0   0   0/0     0.0     0/0   0.0
Shai Green             13    0    1    0   0   0/0     0.0     0/0   0.0
Giannis Westbrook      11    0    0    1   0   0/3     0.0     0/0   0.0

TEAM: FG: 7/14 (50.0%), 3PT: 2/6 (33.3%), REB: 12 (4 off, 8 def), AST: 2, TO: 7
TEAM FOULS: 9 [Team_004 in BONUS]

================================================================================

================================================================================
                       3RD QUARTER - Team_004 vs Team_074                       
================================================================================

[12:00] Team_004 possession (Score: 40-39)
Anthony Lillard loses control! Ball rolls out of bounds! TURNOVER! (dead ball)

[11:42] Team_074 possession (Score: 40-39)
Dwyane Quickley attempts a 3Pt. Contested by Michael Curry (5.3 feet, MAN). DWYANE QUICKLEY MAKES IT! Assist: Donovan Doncic
Score: 40-42

[11:28] Team_004 possession (Score: 40-42)
Draymond Fox attempts a 3Pt. Contested by Donovan Doncic (4.1 feet, MAN). Draymond Fox misses. Rebound secured by Donovan Doncic.

[11:13] Team_074 possession (Score: 40-42)
Dwyane Quickley attempts a Midrange. Contested by Michael Curry (5.3 feet, MAN). Dwyane Quickley misses. Rebound secured by Draymond Fox.

[11:02] Team_004 possession (Score: 40-42)
Jabari Wade attempts a 3Pt. Wide open! Dwyane Quickley is 6.1 feet away. [ZONE] Jabari Wade misses. Rebound secured by James Turner.

[10:51] Team_074 possession (Score: 40-42)
James Turner attempts a Layup. Contested by Anthony Lillard (4.8 feet, MAN). JAMES TURNER MAKES IT! Assist: Dwyane Quickley
Score: 40-44

[10:37] Team_004 possession (Score: 40-44)
FOUL! Offensive foul on Draymond Fox! Donovan Doncic drew the charge! [Team fouls: 1] (Draymond Fox: 1 personal fouls) TURNOVER! (dead ball)

[10:23] Team_074 possession (Score: 40-44)
Donovan Doncic attempts a Midrange. Contested by Draymond Fox (4.5 feet, ZONE). Donovan Doncic misses. Rebound secured by Anthony Lillard.

[10:11] Team_004 possession (Score: 40-44)
Jabari Wade attempts a 3Pt. Wide open! Dwyane Quickley is 6.1 feet away. [ZONE] Jabari Wade misses. Offensive rebound by Draymond Fox! Draymond Fox kicks it out.

[09:58] Team_004 possession (Score: 40-44)
Draymond Fox drives, Donovan Doncic stays with him. Draymond Fox attempts a Layup. Contested by Donovan Doncic (4.1 feet, ZONE). Draymond Fox misses. Offensive rebound by Draymond Fox! Draymond Fox kicks it out.

[09:41] Team_004 possession (Score: 40-44)
Michael Curry attempts a 3Pt. Contested by Dwyane Quickley (5.6 feet, ZONE). Michael Curry misses. Rebound secured by James Turner.

[09:25] Team_074 possession (Score: 40-44)
Donovan Doncic attempts a Midrange. Contested by Draymond Fox (4.5 feet, MAN). Donovan Doncic misses. FOUL! Loose ball foul on Anthony Lillard during the rebound battle. [Team fouls: 2] No free throws, side out. (Anthony Lillard: 1 personal fouls)

[09:06] Team_074 possession (Score: 40-44)
Donovan Doncic loses control! Ball rolls out of bounds! TURNOVER! (dead ball)

[08:47] Team_004 possession (Score: 40-44)
Jabari Wade attempts a Layup. Contested by Chris Carter (4.9 feet, MAN). Jabari Wade misses. Rebound secured by Donovan Doncic.

[08:33] Team_074 possession (Score: 40-44)
James Turner makes the Layup and draws the foul on Anthony Lillard! And-1! James Turner to the line for 1. [Team fouls: 3] (Anthony Lillard: 2 personal fouls)   FT 1/1: GOOD James Turner makes 1/1 from the line.
Score: 40-47

[08:17] Team_004 possession (Score: 40-47)
Dwyane Irving attempts a 3Pt. Contested by Dwyane Quickley (5.7 feet, ZONE). Dwyane Irving misses. Rebound secured by Shai Green.

[07:59] Team_074 possession (Score: 40-47)
FOUL! Reach-in foul on Michael Curry during the drive. [Team fouls: 4] No free throws, side out. (Michael Curry: 1 personal fouls)

[07:44] Team_074 possession (Score: 40-47)
Dwyane Quickley attempts a 3Pt. Contested by Michael Curry (5.3 feet, MAN). DWYANE QUICKLEY MAKES IT! Assist: Donovan Doncic
Score: 40-50

[07:31] Team_004 possession (Score: 40-50)
Dwyane Irving attempts a 3Pt. Contested by Dwyane Quickley (5.7 feet, ZONE). Dwyane Irving misses. Rebound secured by James Turner.

[07:15] Team_074 possession (Score: 40-50)
Shai Green attempts a Midrange. Contested by Jabari Wade (5.2 feet, ZONE). Shai Green misses. Offensive rebound by James Turner! James Turner puts it back in!
Score: 40-52

[06:58] Team_004 possession (Score: 40-52)
Jabari Wade drives, picks up Donovan Doncic. Help arrives from Chris Carter! Jabari Wade attempts a Dunk. Contested by Chris Carter (4.4 feet, ZONE). Jabari Wade misses. Rebound secured by James Turner.

[06:42] Team_074 possession (Score: 40-52)
Shai Green attempts a Midrange. Contested by Dwyane Irving (4.1 feet, ZONE). Shai Green misses. Rebound secured by Draymond Fox.

[06:28] Team_004 possession (Score: 40-52)
Michael Curry attempts a Midrange. Contested by Shai Green (3.6 feet, ZONE). Michael Curry misses. Rebound secured by Donovan Doncic.

[06:16] Team_074 possession (Score: 40-52)
Dwyane Quickley makes the Layup and draws the foul on Michael Curry! And-1! Dwyane Quickley to the line for 1. [BONUS: 5 team fouls] (Michael Curry: 2 personal fouls)   FT 1/1: GOOD Dwyane Quickley makes 1/1 from the line.
Score: 40-55

[06:03] Team_004 possession (Score: 40-55)
Michael Curry attempts a 3Pt. Contested by Dwyane Quickley (5.6 feet, ZONE). Michael Curry misses. Rebound secured by Shai Green.

[05:49] Team_074 possession (Score: 40-55)
Chris Carter attempts a 3Pt. Contested by Michael Curry (5.7 feet, ZONE). CHRIS CARTER MAKES IT! Assist: Dwyane Quickley
Score: 40-58

[05:34] Team_004 possession (Score: 40-58)
Dwyane Irving attempts a 3Pt. Contested by Shai Green (3.8 feet, MAN). Dwyane Irving misses. Offensive rebound by Draymond Fox! Draymond Fox kicks it out.

[05:20] Team_004 possession (Score: 40-58)
FOUL! Shooting foul on Donovan Doncic. Draymond Fox to the line for 2 free throws. [Team fouls: 1] (Donovan Doncic: 1 personal fouls)   FT 1/2: GOOD   FT 2/2: GOOD Draymond Fox makes 2/2 from the line.
Score: 42-58

[05:04] Team_074 possession (Score: 42-58)
Donovan Doncic attempts a Midrange. Contested by Dwyane Irving (3.9 feet, ZONE). Donovan Doncic misses. Rebound secured by Anthony Lillard.

[04:54] Team_004 possession (Score: 42-58)
Jabari Wade attempts a 3Pt. Contested by Chris Carter (5.0 feet, ZONE). Jabari Wade misses. Rebound secured by Shai Green.

[04:35] Team_074 possession (Score: 42-58)
James Turner attempts a Midrange. Contested by Dwyane Irving (4.2 feet, ZONE). James Turner misses. Rebound secured by Draymond Fox.

[04:25] Team_004 possession (Score: 42-58)
Anthony Lillard makes the Layup and draws the foul on Donovan Doncic! And-1! Anthony Lillard to the line for 1. [Team fouls: 2] (Donovan Doncic: 2 personal fouls)   FT 1/1: GOOD Anthony Lillard makes 1/1 from the line.
Score: 45-58

[04:11] Team_074 possession (Score: 45-58)
Shai Green drives, Dwyane Irving stays with him. Shai Green attempts a Layup. Contested by Dwyane Irving (4.1 feet, MAN). Shai Green misses. Rebound secured by Draymond Fox.

[03:54] Team_004 possession (Score: 45-58)
Jabari Wade drives and kicks out. Michael Curry makes the 3Pt and draws the foul on Dwyane Quickley! And-1! Michael Curry to the line for 1. [Team fouls: 3] (Dwyane Quickley: 1 personal fouls)   FT 1/1: GOOD Michael Curry makes 1/1 from the line.
Score: 49-58

[03:44] Team_074 possession (Score: 49-58)
FOUL! Reach-in foul on Michael Curry during the drive. [IN THE BONUS! 6 team fouls] Dwyane Quickley to the line for 2 free throws. (Michael Curry: 3 personal fouls)   FT 1/2: GOOD   FT 2/2: GOOD Dwyane Quickley makes 2/2 from the line.
Score: 49-60

[03:29] Team_004 possession (Score: 49-60)
Michael Curry attempts a 3Pt. Contested by Dwyane Quickley (5.7 feet, ZONE). MICHAEL CURRY MAKES IT! Assist: Anthony Lillard
Score: 52-60

[03:10] Team_074 possession (Score: 52-60)
Shai Green attempts a Midrange. Contested by Dwyane Irving (4.2 feet, MAN). Shai Green misses. Rebound secured by Dwyane Irving.

[02:54] Team_004 possession (Score: 52-60)
Jabari Wade drives, Donovan Doncic stays with him. Jabari Wade attempts a Layup. Contested by Donovan Doncic (4.5 feet, ZONE). JABARI WADE MAKES IT!
Score: 54-60

[02:38] Team_074 possession (Score: 54-60)
James Turner attempts a Midrange. Contested by Anthony Lillard (5.0 feet, MAN). James Turner misses. Rebound secured by Dwyane Irving.

[02:24] Team_004 possession (Score: 54-60)
Jabari Wade attempts a 3Pt. Contested by Chris Carter (5.2 feet, MAN). Jabari Wade misses. Rebound secured by Donovan Doncic.

[02:08] Team_074 possession (Score: 54-60)
Donovan Doncic attempts a Midrange. Contested by Draymond Fox (4.7 feet, MAN). DONOVAN DONCIC MAKES IT!
Score: 54-62

[01:52] Team_004 possession (Score: 54-62)
Dwyane Irving attempts a 3Pt. Contested by Chris Carter (4.8 feet, ZONE). Dwyane Irving misses. Rebound secured by Donovan Doncic.

[01:38] Team_074 possession (Score: 54-62)
James Turner drives to the basket... James Turner loses the ball! Stripped by Anthony Lillard! TURNOVER! (live ball)

[01:20] Team_004 possession (Score: 54-62)
Jabari Wade attempts a 3Pt. Wide open! Dwyane Quickley is 6.3 feet away. [ZONE] JABARI WADE MAKES IT! Assist: Michael Curry
Score: 57-62

[01:07] Team_074 possession (Score: 57-62)
James Turner attempts a 3Pt. Contested by Michael Curry (6.0 feet, ZONE). James Turner misses. Rebound secured by Draymond Fox.

[00:50] Team_004 possession (Score: 57-62)
Michael Curry attempts a Layup. Contested by Dwyane Quickley (5.9 feet, MAN). MICHAEL CURRY MAKES IT! Assist: Anthony Lillard
Score: 59-62

[00:34] Team_074 possession (Score: 59-62)
Donovan Doncic drives and kicks out. James Turner attempts a Midrange. Contested by Anthony Lillard (4.7 feet, MAN). JAMES TURNER MAKES IT! Assist: Chris Carter
Score: 59-64

[00:22] Team_004 possession (Score: 59-64)
FOUL! Shooting foul on Dwyane Quickley. Michael Curry to the line for 2 free throws. [Team fouls: 4] (Dwyane Quickley: 2 personal fouls)   FT 1/2: GOOD   FT 2/2: GOOD Michael Curry makes 2/2 from the line.
Score: 61-64

[00:10] Team_074 possession (Score: 61-64)
Chris Carter attempts a Midrange. Contested by Jabari Wade (5.8 feet, MAN). Chris Carter misses. Offensive rebound by Donovan Doncic! Donovan Doncic kicks it out.

================================================================================
                              3RD QUARTER COMPLETE                              
================================================================================

3RD QUARTER SCORE: Team_004 21, Team_074 25

BOX SCORE:
================================================================================

Team_004
--------------------------------------------------------------------------------
Player                MIN  PTS  REB  AST  TO      FG   FG%      3P   3P%
--------------------------------------------------------------------------------
Michael Curry          25   11    0    1   0   4/7    57.1     0/0   0.0
Jabari Wade            25    5    0    0   0   2/7    28.6     0/0   0.0
Anthony Lillard        25    3    2    2   0   1/1   100.0     0/0   0.0
Draymond Fox           25    2    8    0   0   1/2    50.0     0/0   0.0
Dwyane Irving          25    0    2    0   0   0/3     0.0     0/0   0.0

TEAM: FG: 8/20 (40.0%), 3PT: 2/11 (18.2%), REB: 12 (3 off, 9 def), AST: 3, TO: 2
TEAM FOULS: 6 [Team_074 in BONUS]


Team_074
--------------------------------------------------------------------------------
Player                MIN  PTS  REB  AST  TO      FG   FG%      3P   3P%
--------------------------------------------------------------------------------
Dwyane Quickley        25   11    0    2   0   4/5    80.0     0/0   0.0
James Turner           25    9    6    0   0   4/7    57.1     0/0   0.0
Chris Carter           25    3    0    1   0   1/1   100.0     0/0   0.0
Donovan Doncic         25    2    6    2   0   1/3    33.3     0/0   0.0
Shai Green             25    0    3    0   0   0/3     0.0     0/0   0.0

TEAM: FG: 10/19 (52.6%), 3PT: 3/4 (75.0%), REB: 15 (3 off, 12 def), AST: 5, TO: 2
TEAM FOULS: 4

================================================================================

================================================================================
                       4TH QUARTER - Team_004 vs Team_074                       
================================================================================

[12:00] Substitution (Team_004): Michael Curry OUT → Karl Reaves IN (stamina_rule2)

[12:00] Substitution (Team_004): Jabari Wade OUT → Russell Barnes IN (stamina_rule2)

[12:00] Substitution (Team_004): Draymond Fox OUT → Michael Sabonis IN (stamina_rule2)

[12:00] Substitution (Team_004): Anthony Lillard OUT → Shai Beal IN (stamina_rule2)

[12:00] Substitution (Team_074): Dwyane Quickley OUT → James Barnes IN (stamina_rule2)

[12:00] Substitution (Team_074): Chris Carter OUT → Giannis Westbrook IN (stamina_rule2)

[12:00] Substitution (Team_074): Shai Green OUT → Ayo Smith IN (stamina_rule2)

[12:00] Team_004 possession (Score: 61-64)
Dwyane Irving drives to the basket... Dwyane Irving loses control! Ball rolls out of bounds! TURNOVER! (dead ball)

[11:45] Team_074 possession (Score: 61-64)
Giannis Westbrook attempts a 3Pt. Contested by Russell Barnes (4.7 feet, MAN). Giannis Westbrook misses. Rebound secured by Russell Barnes.

[11:34] Team_004 possession (Score: 61-64)
Russell Barnes attempts a 3Pt. Contested by James Barnes (4.8 feet, ZONE). Russell Barnes misses. Offensive rebound by Russell Barnes! Russell Barnes kicks it out.

[11:21] Team_004 possession (Score: 61-64)
Karl Reaves attempts a Midrange. Contested by James Barnes (3.8 feet, MAN). Karl Reaves misses. Offensive rebound by Russell Barnes! Russell Barnes kicks it out.

[11:07] Team_004 possession (Score: 61-64)
Russell Barnes attempts a 3Pt. Contested by James Barnes (4.8 feet, ZONE). Russell Barnes misses. Rebound secured by Donovan Doncic.

[10:50] Team_074 possession (Score: 61-64)
FOUL! Reach-in foul on Michael Sabonis during the drive. [Team fouls: 1] No free throws, side out. (Michael Sabonis: 1 personal fouls)

[10:33] Team_074 possession (Score: 61-64)
James Barnes attempts a Layup. Contested by Karl Reaves (5.0 feet, MAN). JAMES BARNES MAKES IT! Assist: James Turner
Score: 61-66

[10:17] Team_004 possession (Score: 61-66)
FOUL! Shooting foul on James Barnes. Karl Reaves to the line for 2 free throws. [Team fouls: 1] (James Barnes: 1 personal fouls)   FT 1/2: GOOD   FT 2/2: GOOD Karl Reaves makes 2/2 from the line.
Score: 63-66

[10:06] Team_074 possession (Score: 63-66)
Donovan Doncic attempts a Midrange. Contested by Karl Reaves (5.3 feet, ZONE). Donovan Doncic misses. Rebound secured by Russell Barnes.

[09:51] Team_004 possession (Score: 63-66)
Dwyane Irving attempts a 3Pt. Contested by Ayo Smith (5.0 feet, MAN). Dwyane Irving misses. Rebound secured by James Turner.

[09:34] Team_074 possession (Score: 63-66)
Donovan Doncic attempts a 3Pt. Contested by Karl Reaves (5.3 feet, ZONE). DONOVAN DONCIC MAKES IT! Assist: James Turner
Score: 63-69

[09:18] Team_004 possession (Score: 63-69)
Karl Reaves attempts a 3Pt. Contested by James Barnes (3.8 feet, MAN). Karl Reaves misses. Rebound secured by Donovan Doncic.

[09:06] Team_074 possession (Score: 63-69)
Giannis Westbrook attempts a 3Pt. Contested by Russell Barnes (4.7 feet, MAN). GIANNIS WESTBROOK MAKES IT! Assist: Ayo Smith
Score: 63-72

[08:53] Team_004 possession (Score: 63-72)
Shai Beal attempts a Midrange. Contested by Donovan Doncic (4.4 feet, ZONE). SHAI BEAL MAKES IT!
Score: 65-72

[08:34] Team_074 possession (Score: 65-72)
James Barnes attempts a Midrange. Contested by Karl Reaves (5.0 feet, MAN). James Barnes misses. Offensive rebound by Donovan Doncic! Donovan Doncic kicks it out.

[08:23] Team_074 possession (Score: 65-72)
Donovan Doncic attempts a Midrange. Contested by Michael Sabonis (5.1 feet, MAN). DONOVAN DONCIC MAKES IT! Assist: Giannis Westbrook
Score: 65-74

[08:11] Team_004 possession (Score: 65-74)
Russell Barnes attempts a 3Pt. Contested by Giannis Westbrook (5.0 feet, MAN). Russell Barnes misses. Rebound secured by James Turner.

[07:54] Team_074 possession (Score: 65-74)
Ayo Smith attempts a Layup. Contested by Dwyane Irving (4.5 feet, MAN). Ayo Smith misses. Rebound secured by Shai Beal.

[07:44] Team_004 possession (Score: 65-74)
Michael Sabonis attempts a Midrange. Contested by Donovan Doncic (4.5 feet, ZONE). Michael Sabonis misses. Rebound secured by Donovan Doncic.

[07:26] Team_074 possession (Score: 65-74)
Ayo Smith throws a bad pass! Stolen by Dwyane Irving! TURNOVER! (live ball)

[07:15] Team_004 possession (Score: 65-74)
Russell Barnes drives, Giannis Westbrook stays with him. Russell Barnes attempts a Layup. Contested by Giannis Westbrook (5.0 feet, MAN). RUSSELL BARNES MAKES IT! Assist: Karl Reaves
Score: 67-74

[06:57] Team_074 possession (Score: 67-74)
Donovan Doncic throws a bad pass! Stolen by Michael Sabonis! TURNOVER! (live ball)

[06:44] Team_004 possession (Score: 67-74)
FOUL! Holding foul on Giannis Westbrook. [Team fouls: 2] No free throws, side out. (Giannis Westbrook: 1 personal fouls)

[06:32] Team_004 possession (Score: 67-74)
Dwyane Irving attempts a 3Pt. Contested by Ayo Smith (4.9 feet, MAN). DWYANE IRVING MAKES IT! Assist: Shai Beal
Score: 70-74

[06:21] Team_074 possession (Score: 70-74)
James Turner drives to the basket... James Turner commits a violation (traveling/carry)! TURNOVER! (dead ball)

[06:21] Substitution (Team_004): Dwyane Irving OUT → Kristaps Green IN (stamina_rule2)

[06:21] Substitution (Team_074): Donovan Doncic OUT → Yao Randle IN (stamina_rule2)

[06:21] Substitution (Team_074): James Turner OUT → Jaren Rozier IN (stamina_rule2)

[06:07] Team_004 possession (Score: 70-74)
Shai Beal drives and kicks out. Kristaps Green attempts a 3Pt. Contested by James Barnes (4.2 feet, ZONE). Kristaps Green misses. Rebound secured by Ayo Smith.

[05:50] Team_074 possession (Score: 70-74)
Yao Randle drives to the basket... Yao Randle throws a bad pass out of bounds! TURNOVER! (dead ball)

[05:36] Team_004 possession (Score: 70-74)
Michael Sabonis makes the Dunk and draws the foul on Yao Randle! And-1! Michael Sabonis to the line for 1. [Team fouls: 3] (Yao Randle: 1 personal fouls)   FT 1/1: GOOD Michael Sabonis makes 1/1 from the line.
Score: 73-74

[05:17] Team_074 possession (Score: 73-74)
James Barnes drives, picks up Shai Beal. Help arrives from Russell Barnes! James Barnes attempts a Layup. Contested by Russell Barnes (5.0 feet, ZONE). James Barnes misses. Rebound secured by Russell Barnes.

[05:00] Team_004 possession (Score: 73-74)
Michael Sabonis attempts a Layup. Contested by Jaren Rozier (4.4 feet, ZONE). Michael Sabonis misses. Rebound secured by Ayo Smith.

[04:47] Team_074 possession (Score: 73-74)
FOUL! Offensive foul on Giannis Westbrook! Russell Barnes drew the charge! [Team fouls: 4] (Giannis Westbrook: 2 personal fouls) TURNOVER! (dead ball)

[04:30] Team_004 possession (Score: 73-74)
Russell Barnes attempts a Midrange. Contested by Giannis Westbrook (5.1 feet, ZONE). RUSSELL BARNES MAKES IT! Assist: Michael Sabonis
Score: 75-74

[04:11] Team_074 possession (Score: 75-74)
James Barnes attempts a 3Pt. Contested by Karl Reaves (5.0 feet, ZONE). JAMES BARNES MAKES IT! Assist: Yao Randle
Score: 75-77

[03:51] Team_004 possession (Score: 75-77)
Shai Beal attempts a Layup. Contested by Jaren Rozier (4.5 feet, MAN). SHAI BEAL MAKES IT! Assist: Karl Reaves
Score: 77-77

[03:36] Team_074 possession (Score: 77-77)
Yao Randle attempts a Midrange. BLOCKED BY MICHAEL SABONIS! Ball deflects out of bounds off Yao Randle.

[03:19] Team_004 possession (Score: 77-77)
Russell Barnes attempts a Midrange. Contested by Giannis Westbrook (5.1 feet, MAN). RUSSELL BARNES MAKES IT!
Score: 79-77

[03:00] Team_074 possession (Score: 79-77)
Ayo Smith attempts a 3Pt. Contested by Kristaps Green (4.5 feet, MAN). Ayo Smith misses. Rebound secured by Shai Beal.

[02:46] Team_004 possession (Score: 79-77)
Karl Reaves attempts a 3Pt. Contested by James Barnes (4.0 feet, MAN). Karl Reaves misses. Offensive rebound by Russell Barnes! Russell Barnes kicks it out.

[02:33] Team_004 possession (Score: 79-77)
Karl Reaves attempts a 3Pt. Contested by James Barnes (4.0 feet, MAN). KARL REAVES MAKES IT!
Score: 82-77

[02:18] Team_074 possession (Score: 82-77)
Giannis Westbrook attempts a 3Pt. Contested by Russell Barnes (5.0 feet, MAN). Giannis Westbrook misses. Rebound secured by Michael Sabonis.

[02:01] Team_004 possession (Score: 82-77)
Karl Reaves drives, James Barnes stays with him. Karl Reaves attempts a Dunk. Contested by James Barnes (4.1 feet, MAN). KARL REAVES MAKES IT! Assist: Michael Sabonis
Score: 84-77

[01:43] Team_074 possession (Score: 84-77)
Giannis Westbrook drives and kicks out. Yao Randle attempts a 3Pt. Contested by Michael Sabonis (5.2 feet, MAN). Yao Randle misses. Rebound secured by Russell Barnes.

[01:27] Team_004 possession (Score: 84-77)
Karl Reaves throws a bad pass out of bounds! TURNOVER! (dead ball)

[01:14] Team_074 possession (Score: 84-77)
Jaren Rozier drives and kicks out. Ayo Smith attempts a Midrange. Contested by Michael Sabonis (5.3 feet, ZONE). AYO SMITH MAKES IT! Assist: James Barnes
Score: 84-79

[01:00] Team_004 possession (Score: 84-79)
Michael Sabonis makes the Midrange and draws the foul on Yao Randle! And-1! Michael Sabonis to the line for 1. [BONUS: 5 team fouls] (Yao Randle: 2 personal fouls)   FT 1/1: MISS Michael Sabonis makes 0/1 from the line. Rebound secured by Ayo Smith.
Score: 86-79

[00:44] Team_074 possession (Score: 86-79)
FOUL! Shooting foul on Michael Sabonis. Yao Randle to the line for 2 free throws. [Team fouls: 2] (Michael Sabonis: 2 personal fouls)   FT 1/2: GOOD   FT 2/2: MISS Yao Randle makes 1/2 from the line. Offensive rebound by Yao Randle! Yao Randle kicks it out.
Score: 86-80

[00:29] Team_074 possession (Score: 86-80)
Yao Randle attempts a 3Pt. Contested by Michael Sabonis (5.5 feet, MAN). YAO RANDLE MAKES IT! Assist: Giannis Westbrook
Score: 86-83

[00:20] Team_004 possession (Score: 86-83)
Russell Barnes attempts a Midrange. Contested by Giannis Westbrook (5.4 feet, ZONE). Russell Barnes misses. FOUL! Loose ball foul on Jaren Rozier during the rebound battle. [IN THE BONUS! 6 team fouls] Russell Barnes to the line for 2 free throws. (Jaren Rozier: 1 personal fouls)   FT 1/2: GOOD   FT 2/2: MISS Russell Barnes makes 1/2 from the line. Rebound secured by Ayo Smith.
Score: 87-83

[00:03] Team_074 possession (Score: 87-83)
FOUL! Reach-in foul on Shai Beal during the drive. [Team fouls: 3] No free throws, side out. (Shai Beal: 1 personal fouls)

================================================================================
                              4TH QUARTER COMPLETE                              
================================================================================

4TH QUARTER SCORE: Team_004 26, Team_074 19

BOX SCORE:
================================================================================

Team_004
--------------------------------------------------------------------------------
Player                MIN  PTS  REB  AST  TO      FG   FG%      3P   3P%
--------------------------------------------------------------------------------
Karl Reaves            23    7    0    2   0   3/4    75.0     0/0   0.0
Russell Barnes         23    6    7    0   0   3/6    50.0     0/0   0.0
Shai Beal              23    4    2    1   0   2/3    66.7     0/0   0.0
Dwyane Irving          31    3    0    0   0   1/2    50.0     0/0   0.0
Michael Sabonis        23    3    1    2   0   1/4    25.0     0/0   0.0
Ayo Smith              23    2    4    1   0   1/3    33.3     0/0   0.0

TEAM: FG: 10/19 (52.6%), 3PT: 2/6 (33.3%), REB: 11 (4 off, 7 def), AST: 5, TO: 2
TEAM FOULS: 3


Team_074
--------------------------------------------------------------------------------
Player                MIN  PTS  REB  AST  TO      FG   FG%      3P   3P%
--------------------------------------------------------------------------------
Donovan Doncic         31    5    4    0   0   2/3    66.7     0/0   0.0
James Barnes           23    5    0    1   0   2/3    66.7     0/0   0.0
Giannis Westbrook      23    3    0    2   0   1/4    25.0     0/0   0.0
Yao Randle             17    3    1    1   0   1/2    50.0     0/0   0.0
James Turner           31    0    2    2   0   0/0     0.0     0/0   0.0

TEAM: FG: 7/15 (46.7%), 3PT: 4/7 (57.1%), REB: 10 (2 off, 8 def), AST: 7, TO: 5
TEAM FOULS: 6 [Team_004 in BONUS]

================================================================================

================================================================================
                               FULL GAME COMPLETE                               
================================================================================

FINAL SCORE: Team_004 87, Team_074 83

SCORING BY QUARTER:
--------------------------------------------------------------------------------
Team                     Q1     Q2     Q3     Q4    FINAL
--------------------------------------------------------------------------------
Team_004                 21     19     21     26       87
Team_074                 18     21     25     19       83
--------------------------------------------------------------------------------

FULL GAME BOX SCORE:
================================================================================

Team_004
--------------------------------------------------------------------------------
Player                MIN  PTS  REB  AST  TO      FG   FG%      3P   3P%      FT STL BLK
--------------------------------------------------------------------------------
Dwyane Irving          31    6    6    1   1   2/10   20.0   1/7    14.3   1/1     1   1
Michael Curry          26   17    0    1   0   5/9    55.6   2/5    40.0   4/4     0   0
Jabari Wade            26    5    0    2   0   3/10   30.0   1/5    20.0   0/0     0   1
Draymond Fox           26   12   11    0   2   6/10   60.0   0/2     0.0   2/2     0   0
Anthony Lillard        26    5    6    4   1   2/5    40.0   0/1     0.0   1/1     1   0
Karl Reaves            23   11    0    2   3   5/8    62.5   1/4    25.0   2/3     0   0
Russell Barnes         23    6   11    1   0   3/6    50.0   0/2     0.0   1/2     0   0
Michael Sabonis        23   12    2    3   0   4/9    44.4   0/0     0.0   4/7     1   1
Shai Beal              23    6    7    2   0   3/6    50.0   0/1     0.0   0/0     1   0
Kristaps Green         17    2    0    0   4   1/1   100.0   0/0     0.0   0/0     0   0

TEAM: FG: 35/75 (46.7%), 3PT: 5/27 (18.5%), REB: 43 (11 off, 32 def), AST: 16, TO: 11


Team_074
--------------------------------------------------------------------------------
Player                MIN  PTS  REB  AST  TO      FG   FG%      3P   3P%      FT STL BLK
--------------------------------------------------------------------------------
Donovan Doncic         31    9   18    4   2   5/10   50.0   2/2   100.0   2/3     0   0
James Turner           31   15   13    2   0   4/10   40.0   0/1     0.0   1/2     0   1
Dwyane Quickley        26   13    0    2   0   5/8    62.5   2/3    66.7   3/4     0   0
Chris Carter           26    3    0    2   3   2/5    40.0   2/4    50.0   0/0     0   0
Shai Green             26    4    7    0   2   3/8    37.5   0/1     0.0   2/3     1   0
James Barnes           23   10    0    2   2   4/7    57.1   2/4    50.0   3/3     2   0
Giannis Westbrook      23    3    0    3   3   1/7    14.3   1/5    20.0   0/1     0   0
Ayo Smith              23    8    6    1   2   2/5    40.0   1/2    50.0   1/1     1   0
Yao Randle             17    5    5    1   1   2/3    66.7   1/1   100.0   2/4     1   1
Jaren Rozier           17    5    3    0   1   3/4    75.0   0/0     0.0   1/1     0   0

TEAM: FG: 31/67 (46.3%), 3PT: 11/23 (47.8%), REB: 52 (13 off, 39 def), AST: 17, TO: 16

================================================================================
