================================================================================
                        FULL GAME - Team_048 vs Team_005                        
================================================================================

================================================================================
                       1ST QUARTER - Team_048 vs Team_005                       
================================================================================

[12:00] Team_048 possession (Score: 0-0)
Damian Mobley makes the Layup and draws the foul on Cade Markkanen! And-1! Damian Mobley to the line for 1. [Team fouls: 1] (Cade Markkanen: 1 personal fouls)   FT 1/1: GOOD Damian Mobley makes 1/1 from the line.
Score: 3-0

[11:47] Team_005 possession (Score: 3-0)
Jalen Rozier attempts a Midrange. Contested by Kevin Fox (3.8 feet, MAN). Jalen Rozier misses. Rebound secured by Damian Mobley.

[11:36] Team_048 possession (Score: 3-0)
Dejounte Sexton attempts a 3Pt. Contested by Derrick Allen (5.0 feet, MAN). DEJOUNTE SEXTON MAKES IT! Assist: Damian Mobley
Score: 6-0

[11:18] Team_005 possession (Score: 6-0)
Derrick Allen drives, Dejounte Sexton stays with him. Derrick Allen attempts a Dunk. Contested by Dejounte Sexton (3.4 feet, MAN). DERRICK ALLEN MAKES IT!
Score: 6-2

[11:03] Team_048 possession (Score: 6-2)
Kevin Fox drives, picks up Cade Markkanen. Help arrives from Anthony Rozier! Kevin Fox attempts a Dunk. Contested by Anthony Rozier (4.1 feet, MAN). KEVIN FOX MAKES IT!
Score: 8-2

[10:51] Team_005 possession (Score: 8-2)
Jalen Rozier attempts a Midrange. Contested by Kevin Fox (3.8 feet, MAN). JALEN ROZIER MAKES IT!
Score: 8-4

[10:36] Team_048 possession (Score: 8-4)
FOUL! Shooting foul on Derrick Allen. Dejounte Sexton to the line for 3 free throws. [Team fouls: 2] (Derrick Allen: 1 personal fouls)   FT 1/3: GOOD   FT 2/3: GOOD   FT 3/3: GOOD Dejounte Sexton makes 3/3 from the line.
Score: 11-4

[10:20] Team_005 possession (Score: 11-4)
Derrick Allen drives and kicks out. Cade Markkanen attempts a Midrange. Contested by Kevin Fox (3.4 feet, MAN). Cade Markkanen misses. Rebound secured by Damian Mobley.

[10:06] Team_048 possession (Score: 11-4)
Damian Mobley attempts a Midrange. Contested by Derrick Allen (4.9 feet, ZONE). Damian Mobley misses. Rebound secured by Jalen Rozier.

[09:50] Team_005 possession (Score: 11-4)
Brandon George attempts a Midrange. Contested by Paolo Rozier (5.3 feet, MAN). Brandon George misses. Rebound secured by Kevin Fox.

[09:33] Team_048 possession (Score: 11-4)
Damian Mobley drives, picks up Cade Markkanen. Help arrives from Anthony Rozier! Damian Mobley attempts a Dunk. Contested by Anthony Rozier (3.9 feet, ZONE). DAMIAN MOBLEY MAKES IT! Assist: Paolo Rozier
Score: 13-4

[09:21] Team_005 possession (Score: 13-4)
FOUL! Holding foul on Kevin Fox. [Team fouls: 1] No free throws, side out. (Kevin Fox: 1 personal fouls)

[09:05] Team_005 possession (Score: 13-4)
Jalen Rozier attempts a Layup. Contested by Kevin Fox (3.8 feet, ZONE). JALEN ROZIER MAKES IT! Assist: Anthony Rozier
Score: 13-6

[08:51] Team_048 possession (Score: 13-6)
Dejounte Sexton drives to the basket... Dejounte Sexton throws a bad pass out of bounds! TURNOVER! (dead ball)

[08:35] Team_005 possession (Score: 13-6)
Cade Markkanen makes the Dunk and draws the foul on Kevin Fox! And-1! Cade Markkanen to the line for 1. [Team fouls: 2] (Kevin Fox: 2 personal fouls)   FT 1/1: GOOD Cade Markkanen makes 1/1 from the line.
Score: 13-9

[08:23] Team_048 possession (Score: 13-9)
Karl Johnson attempts a Midrange. Contested by Derrick Allen (4.8 feet, ZONE). KARL JOHNSON MAKES IT!
Score: 15-9

[08:05] Team_005 possession (Score: 15-9)
Anthony Rozier drives and kicks out. Brandon George attempts a 3Pt. Contested by Paolo Rozier (5.1 feet, ZONE). Brandon George misses. Offensive rebound by Jalen Rozier! Jalen Rozier kicks it out.

[07:53] Team_005 possession (Score: 15-9)
Derrick Allen drives, Dejounte Sexton stays with him. Derrick Allen attempts a Layup. Contested by Dejounte Sexton (3.4 feet, MAN). Derrick Allen misses. Rebound secured by Kevin Fox.

[07:37] Team_048 possession (Score: 15-9)
FOUL! Reach-in foul on Derrick Allen during the drive. [Team fouls: 3] No free throws, side out. (Derrick Allen: 2 personal fouls)

[07:22] Team_048 possession (Score: 15-9)
Paolo Rozier attempts a 3Pt. Contested by Derrick Allen (4.4 feet, ZONE). Paolo Rozier misses. Rebound secured by Cade Markkanen.

[07:06] Team_005 possession (Score: 15-9)
Cade Markkanen attempts a Midrange. Contested by Kevin Fox (3.2 feet, ZONE). Cade Markkanen misses. Rebound secured by Damian Mobley.

[06:51] Team_048 possession (Score: 15-9)
Damian Mobley attempts a 3Pt. Contested by Cade Markkanen (3.9 feet, MAN). Damian Mobley misses. Rebound secured by Jalen Rozier.

[06:31] Team_005 possession (Score: 15-9)
FOUL! Shooting foul on Kevin Fox. Cade Markkanen to the line for 2 free throws. [Team fouls: 3] (Kevin Fox: 3 personal fouls)   FT 1/2: MISS   FT 2/2: GOOD Cade Markkanen makes 1/2 from the line.
Score: 15-10

[06:17] Team_048 possession (Score: 15-10)
Damian Mobley drives and kicks out. Karl Johnson attempts a 3Pt. Contested by Derrick Allen (4.2 feet, ZONE). Karl Johnson misses. Rebound secured by Jalen Rozier.

[06:03] Team_005 possession (Score: 15-10)
Jalen Rozier attempts a Midrange. Contested by Kevin Fox (3.8 feet, ZONE). Jalen Rozier misses. Rebound secured by Kevin Fox.

[05:50] Team_048 possession (Score: 15-10)
FOUL! Shooting foul on Derrick Allen. Paolo Rozier to the line for 3 free throws. [Team fouls: 4] (Derrick Allen: 3 personal fouls)   FT 1/3: GOOD   FT 2/3: GOOD   FT 3/3: GOOD Paolo Rozier makes 3/3 from the line.
Score: 18-10

[05:34] Team_005 possession (Score: 18-10)
Brandon George attempts a Midrange. Contested by Kevin Fox (3.6 feet, ZONE). BRANDON GEORGE MAKES IT!
Score: 18-12

[05:23] Team_048 possession (Score: 18-12)
Karl Johnson attempts a 3Pt. Contested by Anthony Rozier (5.2 feet, MAN). Karl Johnson misses. Rebound secured by Cade Markkanen.

[05:10] Team_005 possession (Score: 18-12)
Jalen Rozier drives, picks up Kevin Fox. Help arrives from Karl Johnson! Jalen Rozier attempts a Dunk. Contested by Karl Johnson (3.8 feet, MAN). Jalen Rozier misses. Offensive rebound by Jalen Rozier! Jalen Rozier kicks it out.

[04:53] Team_005 possession (Score: 18-12)
Anthony Rozier attempts a Midrange. Contested by Karl Johnson (4.5 feet, ZONE). Anthony Rozier misses. Rebound secured by Damian Mobley.

[04:41] Team_048 possession (Score: 18-12)
Paolo Rozier attempts a 3Pt. Contested by Brandon George (5.4 feet, MAN). PAOLO ROZIER MAKES IT! Assist: Karl Johnson
Score: 21-12

[04:24] Team_005 possession (Score: 21-12)
Derrick Allen attempts a 3Pt. Contested by Dejounte Sexton (3.4 feet, ZONE). DERRICK ALLEN MAKES IT! Assist: Brandon George
Score: 21-15

[04:11] Team_048 possession (Score: 21-15)
Karl Johnson drives and kicks out. Kevin Fox attempts a 3Pt. Contested by Cade Markkanen (3.4 feet, MAN). Kevin Fox misses. Rebound secured by Jalen Rozier.

[03:59] Team_005 possession (Score: 21-15)
Derrick Allen drives and kicks out. Derrick Allen attempts a 3Pt. Contested by Dejounte Sexton (3.1 feet, ZONE). Derrick Allen misses. Offensive rebound by Cade Markkanen! Cade Markkanen's putback is no good. Rebound secured by Kevin Fox.

[03:45] Team_048 possession (Score: 21-15)
Damian Mobley makes the Layup and draws the foul on Cade Markkanen! And-1! Damian Mobley to the line for 1. [BONUS: 5 team fouls] (Cade Markkanen: 2 personal fouls)   FT 1/1: GOOD Damian Mobley makes 1/1 from the line.
Score: 24-15

[03:30] Team_005 possession (Score: 24-15)
Anthony Rozier makes the Layup and draws the foul on Karl Johnson! And-1! Anthony Rozier to the line for 1. [Team fouls: 4] (Karl Johnson: 1 personal fouls)   FT 1/1: MISS Anthony Rozier makes 0/1 from the line. Offensive rebound by Jalen Rozier! Jalen Rozier kicks it out.
Score: 24-17

[03:13] Team_005 possession (Score: 24-17)
Anthony Rozier attempts a 3Pt. Contested by Karl Johnson (4.6 feet, MAN). ANTHONY ROZIER MAKES IT! Assist: Brandon George
Score: 24-20

[03:04] Team_048 possession (Score: 24-20)
Damian Mobley drives and kicks out. Kevin Fox attempts a 3Pt. Contested by Jalen Rozier (5.1 feet, MAN). KEVIN FOX MAKES IT! Assist: Paolo Rozier
Score: 27-20

[02:47] Team_005 possession (Score: 27-20)
Anthony Rozier loses control! Ball rolls out of bounds! TURNOVER! (dead ball)

[02:47] Substitution (Team_048): Karl Johnson OUT → Yao Booker IN (stamina_rule2)

[02:47] Substitution (Team_048): Damian Mobley OUT → Gary Giddey IN (stamina_rule2)

[02:47] Substitution (Team_005): Brandon George OUT → Blake O'Neal IN (stamina_rule2)

[02:47] Substitution (Team_005): Anthony Rozier OUT → Draymond Smith IN (stamina_rule2)

[02:47] Substitution (Team_005): Jalen Rozier OUT → Isaiah Durant IN (stamina_rule2)

[02:47] Substitution (Team_005): Cade Markkanen OUT → Zion Parker IN (stamina_rule2)

[02:33] Team_048 possession (Score: 27-20)
Gary Giddey drives to the basket... FOUL! Offensive foul on Gary Giddey! Zion Parker drew the charge! [Team fouls: 5] (Gary Giddey: 1 personal fouls) TURNOVER! (dead ball)

[02:20] Team_005 possession (Score: 27-20)
Draymond Smith attempts a 3Pt. Contested by Yao Booker (4.5 feet, ZONE). DRAYMOND SMITH MAKES IT! Assist: Zion Parker
Score: 27-23

[02:03] Team_048 possession (Score: 27-23)
Gary Giddey makes the Dunk and draws the foul on Blake O'Neal! And-1! Gary Giddey to the line for 1. [BONUS: 6 team fouls] (Blake O'Neal: 1 personal fouls)   FT 1/1: MISS Gary Giddey makes 0/1 from the line. Rebound secured by Derrick Allen.
Score: 29-23

[01:52] Team_005 possession (Score: 29-23)
Draymond Smith attempts a Layup. Contested by Kevin Fox (3.6 feet, ZONE). DRAYMOND SMITH MAKES IT! Assist: Blake O'Neal
Score: 29-25

[01:41] Team_048 possession (Score: 29-25)
Gary Giddey attempts a 3Pt. Contested by Blake O'Neal (4.3 feet, ZONE). GARY GIDDEY MAKES IT! Assist: Yao Booker
Score: 32-25

[01:23] Team_005 possession (Score: 32-25)
Draymond Smith attempts a Layup. Contested by Yao Booker (4.5 feet, MAN). Draymond Smith misses. Offensive rebound by Zion Parker! Zion Parker's putback is no good. Offensive rebound by Derrick Allen! Derrick Allen kicks it out.

[01:13] Team_005 possession (Score: 32-25)
Draymond Smith attempts a 3Pt. Contested by Yao Booker (4.5 feet, MAN). Draymond Smith misses. Rebound secured by Gary Giddey.

[00:58] Team_048 possession (Score: 32-25)
Dejounte Sexton attempts a 3Pt. Contested by Blake O'Neal (4.7 feet, ZONE). Dejounte Sexton misses. Rebound secured by Derrick Allen.

[00:45] Team_005 possession (Score: 32-25)
Isaiah Durant throws a bad pass! Stolen by Kevin Fox! TURNOVER! (live ball)

[00:36] Team_048 possession (Score: 32-25)
Dejounte Sexton attempts a Layup. Contested by Derrick Allen (5.3 feet, MAN). DEJOUNTE SEXTON MAKES IT! Assist: Yao Booker
Score: 34-25

[00:24] Team_005 possession (Score: 34-25)
Draymond Smith drives, picks up Gary Giddey. Help arrives from Paolo Rozier! Draymond Smith attempts a Dunk. Contested by Paolo Rozier (4.3 feet, ZONE). DRAYMOND SMITH MAKES IT! Assist: Zion Parker
Score: 34-27

[00:10] Team_048 possession (Score: 34-27)
Gary Giddey drives to the basket... Gary Giddey loses the ball! Stripped by Zion Parker! TURNOVER! (live ball)

================================================================================
                              1ST QUARTER COMPLETE                              
================================================================================

1ST QUARTER SCORE: Team_048 34, Team_005 27

BOX SCORE:
================================================================================

Team_048
--------------------------------------------------------------------------------
Player                MIN  PTS  REB  AST  TO      FG   FG%      3P   3P%
--------------------------------------------------------------------------------
Damian Mobley           9    8    4    1   0   3/6    50.0     0/0   0.0
Dejounte Sexton        12    8    0    0   0   3/4    75.0     0/0   0.0
Paolo Rozier           12    6    0    2   0   2/3    66.7     0/0   0.0
Kevin Fox              12    5    4    0   0   2/2   100.0     0/0   0.0
Gary Giddey             3    3    1    0   0   1/2    50.0     0/0   0.0
Karl Johnson            9    2    0    1   0   1/3    33.3     0/0   0.0
Yao Booker              3    0    0    2   0   0/0     0.0     0/0   0.0

TEAM: FG: 12/20 (60.0%), 3PT: 5/9 (55.6%), REB: 8 (0 off, 8 def), AST: 6, TO: 3
TEAM FOULS: 5 [Team_005 in BONUS]


Team_005
--------------------------------------------------------------------------------
Player                MIN  PTS  REB  AST  TO      FG   FG%      3P   3P%
--------------------------------------------------------------------------------
Draymond Smith          3    7    0    0   0   3/4    75.0     0/0   0.0
Derrick Allen          12    5    3    0   0   2/5    40.0     0/0   0.0
Jalen Rozier            9    4    7    0   0   2/4    50.0     0/0   0.0
Cade Markkanen          9    4    2    0   0   2/3    66.7     0/0   0.0
Anthony Rozier          9    3    0    1   0   1/2    50.0     0/0   0.0
Brandon George          9    2    0    2   0   1/2    50.0     0/0   0.0
Zion Parker             3    0    0    2   0   0/0     0.0     0/0   0.0
Blake O'Neal            3    0    0    1   0   0/0     0.0     0/0   0.0

TEAM: FG: 11/20 (55.0%), 3PT: 3/4 (75.0%), REB: 13 (5 off, 8 def), AST: 6, TO: 2
TEAM FOULS: 6 [Team_048 in BONUS]

================================================================================

================================================================================
                       2ND QUARTER - Team_048 vs Team_005                       
================================================================================

[12:00] Team_048 possession (Score: 34-27)
Dejounte Sexton makes the Midrange and draws the foul on Derrick Allen! And-1! Dejounte Sexton to the line for 1. [Team fouls: 1] (Derrick Allen: 1 personal fouls)   FT 1/1: GOOD Dejounte Sexton makes 1/1 from the line.
Score: 37-27

[11:46] Team_005 possession (Score: 37-27)
Anthony Rozier drives and kicks out. Jalen Rozier attempts a 3Pt. Contested by Kevin Fox (3.9 feet, MAN). Jalen Rozier misses. Rebound secured by Damian Mobley.

[11:31] Team_048 possession (Score: 37-27)
Paolo Rozier makes the Layup and draws the foul on Brandon George! And-1! Paolo Rozier to the line for 1. [Team fouls: 2] (Brandon George: 1 personal fouls)   FT 1/1: GOOD Paolo Rozier makes 1/1 from the line.
Score: 40-27

[11:18] Team_005 possession (Score: 40-27)
Brandon George attempts a 3Pt. Contested by Paolo Rozier (5.7 feet, MAN). Brandon George misses. Rebound secured by Dejounte Sexton.

[11:04] Team_048 possession (Score: 40-27)
Dejounte Sexton attempts a Midrange. Contested by Anthony Rozier (5.3 feet, ZONE). Dejounte Sexton misses. Rebound secured by Cade Markkanen.

[10:51] Team_005 possession (Score: 40-27)
Jalen Rozier drives and kicks out. Derrick Allen attempts a Midrange. Contested by Dejounte Sexton (3.5 feet, MAN). Derrick Allen misses. Rebound secured by Dejounte Sexton.

[10:36] Team_048 possession (Score: 40-27)
Dejounte Sexton attempts a Midrange. Contested by Derrick Allen (5.3 feet, MAN). Dejounte Sexton misses. Rebound secured by Derrick Allen.

[10:21] Team_005 possession (Score: 40-27)
Cade Markkanen attempts a Midrange. Contested by Dejounte Sexton (3.4 feet, ZONE). CADE MARKKANEN MAKES IT! Assist: Jalen Rozier
Score: 40-29

[10:08] Team_048 possession (Score: 40-29)
Dejounte Sexton attempts a 3Pt. Contested by Derrick Allen (5.4 feet, ZONE). DEJOUNTE SEXTON MAKES IT! Assist: Karl Johnson
Score: 43-29

[09:52] Team_005 possession (Score: 43-29)
Cade Markkanen attempts a Midrange. Contested by Dejounte Sexton (3.4 feet, ZONE). Cade Markkanen misses. Offensive rebound by Jalen Rozier! Jalen Rozier kicks it out.

[09:39] Team_005 possession (Score: 43-29)
Cade Markkanen drives to the basket... Cade Markkanen loses control! Ball rolls out of bounds! TURNOVER! (dead ball)

[09:39] Substitution (Team_048): Paolo Rozier OUT → Lauri Curry IN (stamina_rule2)

[09:39] Substitution (Team_048): Dejounte Sexton OUT → Kyle Irving IN (stamina_rule2)

[09:39] Substitution (Team_048): Kevin Fox OUT → DeMar Hyland IN (stamina_rule2)

[09:39] Substitution (Team_005): Brandon George OUT → Blake O'Neal IN (stamina_rule2)

[09:39] Substitution (Team_005): Anthony Rozier OUT → Draymond Smith IN (stamina_rule2)

[09:39] Substitution (Team_005): Derrick Allen OUT → Lauri Wade IN (stamina_rule2)

[09:39] Substitution (Team_005): Cade Markkanen OUT → Zion Parker IN (stamina_rule2)

[09:23] Team_048 possession (Score: 43-29)
Kyle Irving attempts a Layup. Contested by Jalen Rozier (5.1 feet, ZONE). KYLE IRVING MAKES IT!
Score: 45-29

[09:08] Team_005 possession (Score: 45-29)
FOUL! Shooting foul on Karl Johnson. Draymond Smith to the line for 2 free throws. [Team fouls: 1] (Karl Johnson: 1 personal fouls)   FT 1/2: GOOD   FT 2/2: GOOD Draymond Smith makes 2/2 from the line.
Score: 45-31

[08:53] Team_048 possession (Score: 45-31)
Kyle Irving drives to the basket... Kyle Irving loses control! Ball rolls out of bounds! TURNOVER! (dead ball)

[08:53] Substitution (Team_048): Karl Johnson OUT → Yao Booker IN (stamina_rule2)

[08:53] Substitution (Team_048): Damian Mobley OUT → Gary Giddey IN (stamina_rule2)

[08:53] Substitution (Team_005): Jalen Rozier OUT → Isaiah Durant IN (stamina_rule2)

[08:39] Team_005 possession (Score: 45-31)
Isaiah Durant attempts a Midrange. Contested by DeMar Hyland (3.7 feet, MAN). Isaiah Durant misses. Rebound secured by DeMar Hyland.

[08:24] Team_048 possession (Score: 45-31)
Lauri Curry drives and kicks out. Gary Giddey attempts a 3Pt. Contested by Zion Parker (4.0 feet, MAN). Gary Giddey misses. Offensive rebound by Kyle Irving! Kyle Irving puts it back in!
Score: 47-31

[08:13] Team_005 possession (Score: 47-31)
Isaiah Durant drives to the basket... Isaiah Durant throws a bad pass! Stolen by DeMar Hyland! TURNOVER! (live ball)

[07:54] Team_048 possession (Score: 47-31)
FOUL! Shooting foul on Zion Parker. DeMar Hyland to the line for 2 free throws. [Team fouls: 3] (Zion Parker: 1 personal fouls)   FT 1/2: GOOD   FT 2/2: GOOD DeMar Hyland makes 2/2 from the line.
Score: 49-31

[07:35] Team_005 possession (Score: 49-31)
Blake O'Neal drives to the basket... Blake O'Neal throws a bad pass out of bounds! TURNOVER! (dead ball)

[07:21] Team_048 possession (Score: 49-31)
Gary Giddey attempts a 3Pt. Contested by Zion Parker (4.2 feet, MAN). GARY GIDDEY MAKES IT!
Score: 52-31

[07:07] Team_005 possession (Score: 52-31)
FOUL! Shooting foul on Yao Booker. Lauri Wade to the line for 3 free throws. [Team fouls: 2] (Yao Booker: 1 personal fouls)   FT 1/3: GOOD   FT 2/3: MISS   FT 3/3: GOOD Lauri Wade makes 2/3 from the line.
Score: 52-33

[06:50] Team_048 possession (Score: 52-33)
FOUL! Shooting foul on Blake O'Neal. DeMar Hyland to the line for 3 free throws. [Team fouls: 4] (Blake O'Neal: 1 personal fouls)   FT 1/3: GOOD   FT 2/3: GOOD   FT 3/3: MISS DeMar Hyland makes 2/3 from the line. FOUL! Loose ball foul on Lauri Wade during the free throw rebound! [IN THE BONUS! 5 team fouls] Kyle Irving to the line for 2 free throws. (Lauri Wade: 1 personal fouls)   FT 1/2: MISS   FT 2/2: MISS Kyle Irving makes 0/2 from the line. Rebound secured by Lauri Wade.
Score: 54-33

[06:36] Team_005 possession (Score: 54-33)
Draymond Smith drives, DeMar Hyland stays with him. Draymond Smith attempts a Layup. Contested by DeMar Hyland (3.2 feet, ZONE). Draymond Smith misses. Rebound secured by DeMar Hyland.

[06:21] Team_048 possession (Score: 54-33)
Lauri Curry throws a bad pass! Stolen by Blake O'Neal! TURNOVER! (live ball)

[06:06] Team_005 possession (Score: 54-33)
Zion Parker attempts a Layup. BLOCKED BY LAURI CURRY! Ball is loose! Rebound secured by DeMar Hyland.

[05:52] Team_048 possession (Score: 54-33)
Yao Booker attempts a 3Pt. Contested by Blake O'Neal (4.1 feet, ZONE). Yao Booker misses. Rebound secured by Lauri Wade.

[05:35] Team_005 possession (Score: 54-33)
Zion Parker attempts a Midrange. Contested by DeMar Hyland (3.5 feet, MAN). Zion Parker misses. Rebound secured by Gary Giddey.

[05:22] Team_048 possession (Score: 54-33)
Lauri Curry drives to the basket... Lauri Curry throws a bad pass! Stolen by Zion Parker! TURNOVER! (live ball)

[05:12] Team_005 possession (Score: 54-33)
Isaiah Durant attempts a Layup. Contested by DeMar Hyland (3.7 feet, ZONE). ISAIAH DURANT MAKES IT!
Score: 54-35

[04:59] Team_048 possession (Score: 54-35)
DeMar Hyland attempts a 3Pt. Contested by Isaiah Durant (4.6 feet, MAN). DeMar Hyland misses. Rebound secured by Zion Parker.

[04:49] Team_005 possession (Score: 54-35)
FOUL! Shooting foul on DeMar Hyland. Isaiah Durant to the line for 2 free throws. [Team fouls: 3] (DeMar Hyland: 1 personal fouls)   FT 1/2: GOOD   FT 2/2: GOOD Isaiah Durant makes 2/2 from the line.
Score: 54-37

[04:34] Team_048 possession (Score: 54-37)
Kyle Irving attempts a 3Pt. Contested by Lauri Wade (5.0 feet, MAN). Kyle Irving misses. FOUL! Loose ball foul on Lauri Wade during the rebound battle. [IN THE BONUS! 6 team fouls] DeMar Hyland to the line for 2 free throws. (Lauri Wade: 2 personal fouls)   FT 1/2: GOOD   FT 2/2: GOOD DeMar Hyland makes 2/2 from the line.
Score: 56-37

[04:18] Team_005 possession (Score: 56-37)
Zion Parker attempts a Layup. BLOCKED BY LAURI CURRY! Ball is loose! Rebound secured by Kyle Irving.

[04:04] Team_048 possession (Score: 56-37)
Kyle Irving attempts a Midrange. Contested by Isaiah Durant (4.4 feet, ZONE). Kyle Irving misses. Rebound secured by Zion Parker.

[03:50] Team_005 possession (Score: 56-37)
Zion Parker attempts a Layup. BLOCKED BY DEMAR HYLAND! Ball is loose! Rebound secured by Kyle Irving.

[03:38] Team_048 possession (Score: 56-37)
Yao Booker attempts a 3Pt. Contested by Draymond Smith (4.4 feet, MAN). Yao Booker misses. Rebound secured by Lauri Wade.

[03:24] Team_005 possession (Score: 56-37)
FOUL! Shooting foul on DeMar Hyland. Zion Parker to the line for 2 free throws. [Team fouls: 4] (DeMar Hyland: 2 personal fouls)   FT 1/2: GOOD   FT 2/2: GOOD Zion Parker makes 2/2 from the line.
Score: 56-39

[03:04] Team_048 possession (Score: 56-39)
Gary Giddey drives to the basket... Gary Giddey loses control! Ball rolls out of bounds! TURNOVER! (dead ball)

[02:50] Team_005 possession (Score: 56-39)
FOUL! Holding foul on Kyle Irving. [IN THE BONUS! 5 team fouls] Lauri Wade to the line for 2 free throws. (Kyle Irving: 1 personal fouls)   FT 1/2: GOOD   FT 2/2: GOOD Lauri Wade makes 2/2 from the line.
Score: 56-41

[02:36] Team_048 possession (Score: 56-41)
FOUL! Reach-in foul on Lauri Wade during the drive. [IN THE BONUS! 7 team fouls] Kyle Irving to the line for 2 free throws. (Lauri Wade: 3 personal fouls)   FT 1/2: MISS   FT 2/2: GOOD Kyle Irving makes 1/2 from the line.
Score: 57-41

[02:22] Team_005 possession (Score: 57-41)
Blake O'Neal attempts a 3Pt. Contested by Lauri Curry (4.9 feet, MAN). Blake O'Neal misses. Rebound secured by Gary Giddey.

[02:12] Team_048 possession (Score: 57-41)
Gary Giddey attempts a 3Pt. Contested by Isaiah Durant (4.7 feet, ZONE). Gary Giddey misses. Rebound secured by Draymond Smith.

[01:56] Team_005 possession (Score: 57-41)
Lauri Wade drives and kicks out. Isaiah Durant attempts a 3Pt. Contested by DeMar Hyland (3.6 feet, ZONE). Isaiah Durant misses. Rebound secured by Kyle Irving.

[01:45] Team_048 possession (Score: 57-41)
Gary Giddey drives and kicks out. FOUL! Shooting foul on Isaiah Durant. DeMar Hyland to the line for 2 free throws. [BONUS: 8 team fouls] (Isaiah Durant: 1 personal fouls)   FT 1/2: GOOD   FT 2/2: GOOD DeMar Hyland makes 2/2 from the line.
Score: 59-41

[01:35] Team_005 possession (Score: 59-41)
Isaiah Durant makes the Layup and draws the foul on DeMar Hyland! And-1! Isaiah Durant to the line for 1. [BONUS: 6 team fouls] (DeMar Hyland: 3 personal fouls)   FT 1/1: MISS Isaiah Durant makes 0/1 from the line. Offensive rebound by Lauri Wade! Lauri Wade kicks it out.
Score: 59-43

[01:20] Team_005 possession (Score: 59-43)
FOUL! Offensive foul on Draymond Smith! Yao Booker drew the charge! [Team fouls: 9] (Draymond Smith: 1 personal fouls) TURNOVER! (dead ball)

[01:11] Team_048 possession (Score: 59-43)
Kyle Irving attempts a 3Pt. Contested by Lauri Wade (5.2 feet, MAN). KYLE IRVING MAKES IT! Assist: DeMar Hyland
Score: 62-43

[00:55] Team_005 possession (Score: 62-43)
FOUL! Shooting foul on DeMar Hyland. Blake O'Neal to the line for 2 free throws. [BONUS: 7 team fouls] (DeMar Hyland: 4 personal fouls)   FT 1/2: GOOD   FT 2/2: GOOD Blake O'Neal makes 2/2 from the line.
Score: 62-45

[00:36] Team_048 possession (Score: 62-45)
Gary Giddey drives, Zion Parker stays with him. Gary Giddey attempts a Dunk. Contested by Zion Parker (4.6 feet, MAN). Gary Giddey misses. Rebound secured by Zion Parker.

[00:24] Team_005 possession (Score: 62-45)
Isaiah Durant attempts a Midrange. Contested by DeMar Hyland (3.9 feet, ZONE). Isaiah Durant misses. Rebound secured by Kyle Irving.

[00:07] Team_048 possession (Score: 62-45)
Yao Booker attempts a Midrange. Contested by Draymond Smith (4.8 feet, MAN). YAO BOOKER MAKES IT!
Score: 64-45

================================================================================
                              2ND QUARTER COMPLETE                              
================================================================================

2ND QUARTER SCORE: Team_048 30, Team_005 18

BOX SCORE:
================================================================================

Team_048
--------------------------------------------------------------------------------
Player                MIN  PTS  REB  AST  TO      FG   FG%      3P   3P%
--------------------------------------------------------------------------------
Kyle Irving            10    8    5    0   0   4/5    80.0     0/0   0.0
Dejounte Sexton        15    6    2    0   0   2/4    50.0     0/0   0.0
DeMar Hyland           10    6    3    1   0   3/5    60.0     0/0   0.0
Paolo Rozier           15    3    0    0   0   1/1   100.0     0/0   0.0
Gary Giddey            11    3    2    0   0   1/3    33.3     0/0   0.0
Yao Booker             11    2    0    0   0   1/3    33.3     0/0   0.0
Damian Mobley          13    0    1    0   0   0/0     0.0     0/0   0.0
Karl Johnson           13    0    0    1   0   0/0     0.0     0/0   0.0

TEAM: FG: 12/21 (57.1%), 3PT: 4/9 (44.4%), REB: 13 (1 off, 12 def), AST: 2, TO: 4
TEAM FOULS: 7 [Team_005 in BONUS]


Team_005
--------------------------------------------------------------------------------
Player                MIN  PTS  REB  AST  TO      FG   FG%      3P   3P%
--------------------------------------------------------------------------------
Isaiah Durant          11    4    0    0   0   2/4    50.0     0/0   0.0
Lauri Wade             10    4    4    0   0   2/3    66.7     0/0   0.0
Cade Markkanen         12    2    1    0   0   1/1   100.0     0/0   0.0
Draymond Smith         12    2    1    0   0   1/2    50.0     0/0   0.0
Zion Parker            12    2    3    0   0   1/5    20.0     0/0   0.0
Blake O'Neal           12    2    0    0   0   1/2    50.0     0/0   0.0
Anthony Rozier         12    0    0    0   0   0/1     0.0     0/0   0.0
Brandon George         12    0    0    0   0   0/1     0.0     0/0   0.0
Jalen Rozier           13    0    1    1   0   0/1     0.0     0/0   0.0
Derrick Allen          15    0    1    0   0   0/0     0.0     0/0   0.0

TEAM: FG: 8/20 (40.0%), 3PT: 1/3 (33.3%), REB: 11 (2 off, 9 def), AST: 1, TO: 4
TEAM FOULS: 9 [Team_048 in BONUS]

================================================================================

================================================================================
                       3RD QUARTER - Team_048 vs Team_005                       
================================================================================

[12:00] Team_048 possession (Score: 64-45)
Damian Mobley drives and kicks out. FOUL! Shooting foul on Cade Markkanen. Kevin Fox to the line for 3 free throws. [Team fouls: 1] (Cade Markkanen: 1 personal fouls)   FT 1/3: GOOD   FT 2/3: GOOD   FT 3/3: GOOD Kevin Fox makes 3/3 from the line.
Score: 67-45

[11:47] Team_005 possession (Score: 67-45)
Derrick Allen attempts a 3Pt. Contested by Kevin Fox (3.8 feet, ZONE). Derrick Allen misses. Rebound secured by Dejounte Sexton.

[11:38] Team_048 possession (Score: 67-45)
Kevin Fox attempts a Midrange. Contested by Jalen Rozier (5.8 feet, ZONE). Kevin Fox misses. Rebound secured by Jalen Rozier.

[11:23] Team_005 possession (Score: 67-45)
Cade Markkanen makes the Midrange and draws the foul on Karl Johnson! And-1! Cade Markkanen to the line for 1. [Team fouls: 1] (Karl Johnson: 1 personal fouls)   FT 1/1: GOOD Cade Markkanen makes 1/1 from the line.
Score: 67-48

[11:05] Team_048 possession (Score: 67-48)
Paolo Rozier attempts a 3Pt. Contested by Derrick Allen (4.4 feet, ZONE). Paolo Rozier misses. Rebound secured by Jalen Rozier.

[10:51] Team_005 possession (Score: 67-48)
Cade Markkanen attempts a 3Pt. Contested by Kevin Fox (3.2 feet, MAN). Cade Markkanen misses. Rebound secured by Kevin Fox.

[10:35] Team_048 possession (Score: 67-48)
Kevin Fox makes the Dunk and draws the foul on Anthony Rozier! And-1! Kevin Fox to the line for 1. [Team fouls: 2] (Anthony Rozier: 1 personal fouls)   FT 1/1: MISS Kevin Fox makes 0/1 from the line. Rebound secured by Cade Markkanen.
Score: 69-48

[10:20] Team_005 possession (Score: 69-48)
Cade Markkanen attempts a Midrange. Contested by Kevin Fox (3.2 feet, ZONE). Cade Markkanen misses. Rebound secured by Kevin Fox.

[10:09] Team_048 possession (Score: 69-48)
Paolo Rozier drives, picks up Brandon George. Help arrives from Anthony Rozier! Paolo Rozier attempts a Dunk. Contested by Anthony Rozier (5.3 feet, MAN). PAOLO ROZIER MAKES IT!
Score: 71-48

[09:55] Team_005 possession (Score: 71-48)
Cade Markkanen attempts a 3Pt. Contested by Dejounte Sexton (2.8 feet, ZONE). Cade Markkanen misses. Offensive rebound by Cade Markkanen! Cade Markkanen's putback is no good. Rebound secured by Damian Mobley.

[09:43] Team_048 possession (Score: 71-48)
Karl Johnson drives and kicks out. Karl Johnson attempts a 3Pt. Contested by Anthony Rozier (4.6 feet, MAN). KARL JOHNSON MAKES IT! Assist: Damian Mobley
Score: 74-48

[09:29] Team_005 possession (Score: 74-48)
Brandon George attempts a 3Pt. Contested by Dejounte Sexton (3.2 feet, ZONE). Brandon George misses. Rebound secured by Kevin Fox.

[09:11] Team_048 possession (Score: 74-48)
Karl Johnson drives, picks up Anthony Rozier. Help arrives from Derrick Allen! Karl Johnson attempts a Dunk. Contested by Derrick Allen (5.1 feet, MAN). KARL JOHNSON MAKES IT!
Score: 76-48

[08:59] Team_005 possession (Score: 76-48)
Brandon George attempts a 3Pt. Contested by Dejounte Sexton (3.2 feet, ZONE). Brandon George misses. Rebound secured by Kevin Fox.

[08:44] Team_048 possession (Score: 76-48)
Kevin Fox attempts a Midrange. Contested by Cade Markkanen (4.1 feet, MAN). KEVIN FOX MAKES IT! Assist: Damian Mobley
Score: 78-48

[08:27] Team_005 possession (Score: 78-48)
Anthony Rozier attempts a 3Pt. Contested by Dejounte Sexton (3.1 feet, ZONE). Anthony Rozier misses. Rebound secured by Kevin Fox.

[08:09] Team_048 possession (Score: 78-48)
Paolo Rozier attempts a Midrange. Contested by Brandon George (5.3 feet, MAN). Paolo Rozier misses. Rebound secured by Jalen Rozier.

[08:00] Team_005 possession (Score: 78-48)
Brandon George attempts a Midrange. Contested by Kevin Fox (3.6 feet, ZONE). Brandon George misses. Rebound secured by Kevin Fox.

[07:45] Team_048 possession (Score: 78-48)
Karl Johnson attempts a 3Pt. Contested by Anthony Rozier (5.1 feet, ZONE). Karl Johnson misses. Rebound secured by Derrick Allen.

[07:34] Team_005 possession (Score: 78-48)
Jalen Rozier attempts a 3Pt. Contested by Kevin Fox (3.8 feet, MAN). Jalen Rozier misses. Rebound secured by Damian Mobley.

[07:19] Team_048 possession (Score: 78-48)
Paolo Rozier drives to the basket... Paolo Rozier loses control! Ball rolls out of bounds! TURNOVER! (dead ball)

[07:09] Team_005 possession (Score: 78-48)
Jalen Rozier attempts a 3Pt. Contested by Dejounte Sexton (3.3 feet, ZONE). JALEN ROZIER MAKES IT!
Score: 78-51

[06:52] Team_048 possession (Score: 78-51)
Dejounte Sexton attempts a 3Pt. Contested by Derrick Allen (5.0 feet, MAN). DEJOUNTE SEXTON MAKES IT! Assist: Kevin Fox
Score: 81-51

[06:41] Team_005 possession (Score: 81-51)
FOUL! Shooting foul on Karl Johnson. Derrick Allen to the line for 2 free throws. [Team fouls: 2] (Karl Johnson: 2 personal fouls)   FT 1/2: MISS   FT 2/2: GOOD Derrick Allen makes 1/2 from the line.
Score: 81-52

[06:27] Team_048 possession (Score: 81-52)
Dejounte Sexton attempts a 3Pt. Contested by Derrick Allen (5.0 feet, MAN). Dejounte Sexton misses. Rebound secured by Cade Markkanen.

[06:09] Team_005 possession (Score: 81-52)
FOUL! Offensive foul on Brandon George! Paolo Rozier drew the charge! [Team fouls: 3] (Brandon George: 1 personal fouls) TURNOVER! (dead ball)

[05:59] Team_048 possession (Score: 81-52)
FOUL! Holding foul on Anthony Rozier. [Team fouls: 4] No free throws, side out. (Anthony Rozier: 2 personal fouls)

[05:49] Team_048 possession (Score: 81-52)
Dejounte Sexton drives and kicks out. Damian Mobley attempts a Midrange. Contested by Cade Markkanen (3.3 feet, MAN). DAMIAN MOBLEY MAKES IT! Assist: Kevin Fox
Score: 83-52

[05:34] Team_005 possession (Score: 83-52)
Derrick Allen attempts a Midrange. Contested by Dejounte Sexton (3.4 feet, MAN). Derrick Allen misses. Rebound secured by Kevin Fox.

[05:18] Team_048 possession (Score: 83-52)
Kevin Fox attempts a Midrange. Contested by Jalen Rozier (5.8 feet, ZONE). KEVIN FOX MAKES IT! Assist: Dejounte Sexton
Score: 85-52

[05:06] Team_005 possession (Score: 85-52)
Cade Markkanen attempts a Dunk. BLOCKED BY KEVIN FOX! Ball is loose! Rebound secured by Damian Mobley.

[04:47] Team_048 possession (Score: 85-52)
Karl Johnson attempts a 3Pt. Contested by Derrick Allen (4.8 feet, ZONE). Karl Johnson misses. Rebound secured by Cade Markkanen.

[04:35] Team_005 possession (Score: 85-52)
Brandon George attempts a Layup. Contested by Paolo Rozier (5.4 feet, MAN). BRANDON GEORGE MAKES IT! Assist: Derrick Allen
Score: 85-54

[04:22] Team_048 possession (Score: 85-54)
Karl Johnson drives, Cade Markkanen stays with him. Karl Johnson attempts a Layup. Contested by Cade Markkanen (4.0 feet, ZONE). KARL JOHNSON MAKES IT! Assist: Paolo Rozier
Score: 87-54

[04:06] Team_005 possession (Score: 87-54)
FOUL! Shooting foul on Kevin Fox. Cade Markkanen to the line for 2 free throws. [Team fouls: 3] (Kevin Fox: 1 personal fouls)   FT 1/2: GOOD   FT 2/2: MISS Cade Markkanen makes 1/2 from the line. Rebound secured by Dejounte Sexton.
Score: 87-55

[03:54] Team_048 possession (Score: 87-55)
Paolo Rozier attempts a 3Pt. Contested by Brandon George (5.5 feet, MAN). Paolo Rozier misses. Offensive rebound by Damian Mobley! Damian Mobley's putback is no good. Rebound secured by Derrick Allen.

[03:39] Team_005 possession (Score: 87-55)
FOUL! Shooting foul on Kevin Fox. Cade Markkanen to the line for 2 free throws. [Team fouls: 4] (Kevin Fox: 2 personal fouls)   FT 1/2: GOOD   FT 2/2: GOOD Cade Markkanen makes 2/2 from the line.
Score: 87-57

[03:23] Team_048 possession (Score: 87-57)
Karl Johnson attempts a 3Pt. Contested by Anthony Rozier (5.4 feet, MAN). Karl Johnson misses. Offensive rebound by Damian Mobley! Damian Mobley's putback is no good. Offensive rebound by Damian Mobley! Damian Mobley kicks it out.

[03:08] Team_048 possession (Score: 87-57)
Dejounte Sexton attempts a 3Pt. Contested by Derrick Allen (5.1 feet, MAN). Dejounte Sexton misses. Rebound secured by Jalen Rozier.

[02:56] Team_005 possession (Score: 87-57)
Cade Markkanen makes the Layup and draws the foul on Damian Mobley! And-1! Cade Markkanen to the line for 1. [BONUS: 5 team fouls] (Damian Mobley: 1 personal fouls)   FT 1/1: GOOD Cade Markkanen makes 1/1 from the line.
Score: 87-60

[02:41] Team_048 possession (Score: 87-60)
Damian Mobley attempts a Layup. Contested by Cade Markkanen (4.3 feet, ZONE). DAMIAN MOBLEY MAKES IT!
Score: 89-60

[02:26] Team_005 possession (Score: 89-60)
Jalen Rozier drives and kicks out. Anthony Rozier attempts a 3Pt. Contested by Karl Johnson (4.7 feet, ZONE). Anthony Rozier misses. Rebound secured by Damian Mobley.

[02:13] Team_048 possession (Score: 89-60)
Damian Mobley drives and kicks out. Paolo Rozier attempts a 3Pt. Contested by Derrick Allen (4.5 feet, ZONE). Paolo Rozier misses. Rebound secured by Cade Markkanen.

[02:02] Team_005 possession (Score: 89-60)
Jalen Rozier attempts a Midrange. Contested by Kevin Fox (4.1 feet, MAN). Jalen Rozier misses. Rebound secured by Damian Mobley.

[01:53] Team_048 possession (Score: 89-60)
Dejounte Sexton attempts a 3Pt. Contested by Derrick Allen (5.2 feet, ZONE). Dejounte Sexton misses. Offensive rebound by Damian Mobley! Damian Mobley's putback is no good. Rebound secured by Jalen Rozier.

[01:37] Team_005 possession (Score: 89-60)
FOUL! Offensive foul on Anthony Rozier! Karl Johnson drew the charge! [Team fouls: 6] (Anthony Rozier: 3 personal fouls) TURNOVER! (dead ball)

[01:19] Team_048 possession (Score: 89-60)
Damian Mobley drives, picks up Cade Markkanen. Help arrives from Anthony Rozier! Damian Mobley attempts a Dunk. Contested by Anthony Rozier (4.5 feet, MAN). DAMIAN MOBLEY MAKES IT! Assist: Paolo Rozier
Score: 91-60

[01:06] Team_005 possession (Score: 91-60)
Brandon George attempts a 3Pt. Contested by Dejounte Sexton (3.6 feet, ZONE). BRANDON GEORGE MAKES IT! Assist: Anthony Rozier
Score: 91-63

[00:57] Team_048 possession (Score: 91-63)
Kevin Fox attempts a 3Pt. Contested by Anthony Rozier (6.0 feet, ZONE). Kevin Fox misses. Rebound secured by Cade Markkanen.

[00:44] Team_005 possession (Score: 91-63)
Cade Markkanen drives, picks up Kevin Fox. Help arrives from Karl Johnson! Cade Markkanen attempts a Layup. Contested by Karl Johnson (3.8 feet, MAN). CADE MARKKANEN MAKES IT! Assist: Derrick Allen
Score: 91-65

[00:25] Team_048 possession (Score: 91-65)
Damian Mobley attempts a Midrange. Contested by Cade Markkanen (4.6 feet, MAN). Damian Mobley misses. Rebound secured by Derrick Allen.

[00:11] Team_005 possession (Score: 91-65)
FOUL! Reach-in foul on Kevin Fox during the drive. [IN THE BONUS! 6 team fouls] Cade Markkanen to the line for 2 free throws. (Kevin Fox: 3 personal fouls)   FT 1/2: GOOD   FT 2/2: GOOD Cade Markkanen makes 2/2 from the line.
Score: 91-67

================================================================================
                              3RD QUARTER COMPLETE                              
================================================================================

3RD QUARTER SCORE: Team_048 27, Team_005 22

BOX SCORE:
================================================================================

Team_048
--------------------------------------------------------------------------------
Player                MIN  PTS  REB  AST  TO      FG   FG%      3P   3P%
--------------------------------------------------------------------------------
Kevin Fox              27    7    7    2   0   3/6    50.0     0/0   0.0
Karl Johnson           25    7    0    0   0   3/5    60.0     0/0   0.0
Damian Mobley          25    6    6    2   0   3/5    60.0     0/0   0.0
Dejounte Sexton        27    3    2    1   0   1/4    25.0     0/0   0.0
Jalen Rozier           25    3    5    0   0   1/4    25.0     0/0   0.0
Paolo Rozier           27    2    0    2   0   1/4    25.0     0/0   0.0

TEAM: FG: 11/24 (45.8%), 3PT: 1/9 (11.1%), REB: 16 (3 off, 13 def), AST: 7, TO: 1
TEAM FOULS: 6 [Team_005 in BONUS]


Team_005
--------------------------------------------------------------------------------
Player                MIN  PTS  REB  AST  TO      FG   FG%      3P   3P%
--------------------------------------------------------------------------------
Cade Markkanen         24   12    5    0   0   5/10   50.0     0/0   0.0
Brandon George         24    5    0    0   0   2/5    40.0     0/0   0.0
Derrick Allen          27    1    3    2   0   1/3    33.3     0/0   0.0
Anthony Rozier         24    0    0    1   0   0/1     0.0     0/0   0.0

TEAM: FG: 9/23 (39.1%), 3PT: 2/9 (22.2%), REB: 12 (1 off, 11 def), AST: 3, TO: 2
TEAM FOULS: 6 [Team_048 in BONUS]

================================================================================

================================================================================
                       4TH QUARTER - Team_048 vs Team_005                       
================================================================================

[12:00] Team_048 possession (Score: 91-67)
Damian Mobley attempts a Layup. Contested by Cade Markkanen (4.4 feet, MAN). DAMIAN MOBLEY MAKES IT! Assist: Kevin Fox
Score: 93-67

[11:45] Team_005 possession (Score: 93-67)
Cade Markkanen attempts a Midrange. Contested by Kevin Fox (3.6 feet, ZONE). Cade Markkanen misses. FOUL! Loose ball foul on Damian Mobley during the rebound battle. [Team fouls: 1] No free throws, side out. (Damian Mobley: 1 personal fouls)

[11:32] Team_005 possession (Score: 93-67)
FOUL! Holding foul on Dejounte Sexton. [Team fouls: 2] No free throws, side out. (Dejounte Sexton: 1 personal fouls)

[11:19] Team_005 possession (Score: 93-67)
Jalen Rozier drives and kicks out. Jalen Rozier attempts a 3Pt. Contested by Dejounte Sexton (3.4 feet, ZONE). Jalen Rozier misses. Rebound secured by Kevin Fox.

[11:02] Team_048 possession (Score: 93-67)
Dejounte Sexton throws a bad pass! Stolen by Derrick Allen! TURNOVER! (live ball)

[10:45] Team_005 possession (Score: 93-67)
Derrick Allen attempts a Layup. Contested by Dejounte Sexton (3.8 feet, MAN). Derrick Allen misses. Rebound secured by Damian Mobley.

[10:28] Team_048 possession (Score: 93-67)
FOUL! Shooting foul on Anthony Rozier. Paolo Rozier to the line for 2 free throws. [Team fouls: 1] (Anthony Rozier: 1 personal fouls)   FT 1/2: GOOD   FT 2/2: GOOD Paolo Rozier makes 2/2 from the line.
Score: 95-67

[10:16] Team_005 possession (Score: 95-67)
Brandon George drives, Kevin Fox stays with him. Brandon George attempts a Dunk. Contested by Kevin Fox (4.2 feet, ZONE). BRANDON GEORGE MAKES IT!
Score: 95-69

[10:06] Team_048 possession (Score: 95-69)
Damian Mobley loses control! Ball rolls out of bounds! TURNOVER! (dead ball)

[10:06] Substitution (Team_048): Paolo Rozier OUT → Lauri Curry IN (stamina_rule2)

[10:06] Substitution (Team_048): Karl Johnson OUT → Yao Booker IN (stamina_rule2)

[10:06] Substitution (Team_048): Dejounte Sexton OUT → Kyle Irving IN (stamina_rule2)

[10:06] Substitution (Team_048): Kevin Fox OUT → DeMar Hyland IN (stamina_rule2)

[10:06] Substitution (Team_048): Damian Mobley OUT → Gary Giddey IN (stamina_rule2)

[10:06] Substitution (Team_005): Brandon George OUT → Blake O'Neal IN (stamina_rule2)

[10:06] Substitution (Team_005): Anthony Rozier OUT → Draymond Smith IN (stamina_rule2)

[10:06] Substitution (Team_005): Derrick Allen OUT → Lauri Wade IN (stamina_rule2)

[10:06] Substitution (Team_005): Jalen Rozier OUT → Isaiah Durant IN (stamina_rule2)

[10:06] Substitution (Team_005): Cade Markkanen OUT → Zion Parker IN (stamina_rule2)

[09:51] Team_005 possession (Score: 95-69)
Zion Parker makes the Midrange and draws the foul on DeMar Hyland! And-1! Zion Parker to the line for 1. [Team fouls: 3] (DeMar Hyland: 1 personal fouls)   FT 1/1: GOOD Zion Parker makes 1/1 from the line.
Score: 95-72

[09:33] Team_048 possession (Score: 95-72)
Kyle Irving drives, Lauri Wade stays with him. Kyle Irving attempts a Dunk. Contested by Lauri Wade (5.0 feet, MAN). Kyle Irving misses. Rebound secured by Draymond Smith.

[09:16] Team_005 possession (Score: 95-72)
Lauri Wade attempts a 3Pt. Contested by DeMar Hyland (3.5 feet, ZONE). LAURI WADE MAKES IT! Assist: Isaiah Durant
Score: 95-75

[08:57] Team_048 possession (Score: 95-75)
Yao Booker drives to the basket... Yao Booker loses control! Ball rolls out of bounds! TURNOVER! (dead ball)

[08:41] Team_005 possession (Score: 95-75)
Lauri Wade attempts a 3Pt. Contested by DeMar Hyland (3.5 feet, ZONE). Lauri Wade misses. Rebound secured by Kyle Irving.

[08:24] Team_048 possession (Score: 95-75)
Kyle Irving attempts a 3Pt. Contested by Lauri Wade (5.0 feet, MAN). KYLE IRVING MAKES IT! Assist: DeMar Hyland
Score: 98-75

[08:11] Team_005 possession (Score: 98-75)
Blake O'Neal attempts a Midrange. Contested by Yao Booker (5.1 feet, ZONE). Blake O'Neal misses. Rebound secured by DeMar Hyland.

[07:53] Team_048 possession (Score: 98-75)
Gary Giddey drives, Zion Parker stays with him. Gary Giddey attempts a Layup. Contested by Zion Parker (4.2 feet, ZONE). GARY GIDDEY MAKES IT!
Score: 100-75

[07:38] Team_005 possession (Score: 100-75)
Lauri Wade attempts a Layup. Contested by DeMar Hyland (3.5 feet, ZONE). Lauri Wade misses. Offensive rebound by Zion Parker! Zion Parker puts it back in!
Score: 100-77

[07:25] Team_048 possession (Score: 100-77)
Kyle Irving drives, picks up Lauri Wade. Help arrives from Blake O'Neal! Kyle Irving attempts a Dunk. Contested by Blake O'Neal (5.0 feet, MAN). Kyle Irving misses. Rebound secured by Zion Parker.

[07:08] Team_005 possession (Score: 100-77)
Zion Parker drives, picks up Gary Giddey. Help arrives from Lauri Curry! Zion Parker attempts a Layup. Contested by Lauri Curry (4.6 feet, ZONE). Zion Parker misses. Rebound secured by Gary Giddey.

[06:53] Team_048 possession (Score: 100-77)
Yao Booker attempts a 3Pt. Contested by Blake O'Neal (4.1 feet, ZONE). YAO BOOKER MAKES IT! Assist: Gary Giddey
Score: 103-77

[06:39] Team_005 possession (Score: 103-77)
Isaiah Durant attempts a Midrange. Contested by DeMar Hyland (3.7 feet, MAN). Isaiah Durant misses. Rebound secured by Kyle Irving.

[06:25] Team_048 possession (Score: 103-77)
FOUL! Shooting foul on Isaiah Durant. DeMar Hyland to the line for 2 free throws. [Team fouls: 2] (Isaiah Durant: 1 personal fouls)   FT 1/2: GOOD   FT 2/2: GOOD DeMar Hyland makes 2/2 from the line.
Score: 105-77

[06:09] Team_005 possession (Score: 105-77)
Draymond Smith commits a violation (traveling/carry)! TURNOVER! (dead ball)

[05:59] Team_048 possession (Score: 105-77)
Gary Giddey attempts a Layup. Contested by Zion Parker (4.2 feet, MAN). Gary Giddey misses. Rebound secured by Lauri Wade.

[05:44] Team_005 possession (Score: 105-77)
Draymond Smith attempts a 3Pt. Contested by DeMar Hyland (3.2 feet, ZONE). Draymond Smith misses. Rebound secured by DeMar Hyland.

[05:31] Team_048 possession (Score: 105-77)
DeMar Hyland attempts a 3Pt. Contested by Blake O'Neal (4.3 feet, ZONE). DEMAR HYLAND MAKES IT! Assist: Lauri Curry
Score: 108-77

[05:14] Team_005 possession (Score: 108-77)
Zion Parker attempts a Midrange. Contested by DeMar Hyland (3.5 feet, ZONE). ZION PARKER MAKES IT!
Score: 108-79

[04:57] Team_048 possession (Score: 108-79)
Kyle Irving drives and kicks out. Kyle Irving attempts a 3Pt. Contested by Lauri Wade (5.0 feet, MAN). Kyle Irving misses. Offensive rebound by Kyle Irving! Kyle Irving's putback is no good. Offensive rebound by DeMar Hyland! DeMar Hyland kicks it out.

[04:39] Team_048 possession (Score: 108-79)
Kyle Irving attempts a 3Pt. Contested by Lauri Wade (5.0 feet, MAN). Kyle Irving misses. Offensive rebound by DeMar Hyland! DeMar Hyland kicks it out.

[04:23] Team_048 possession (Score: 108-79)
Gary Giddey drives, picks up Zion Parker. Help arrives from Blake O'Neal! Gary Giddey attempts a Dunk. Contested by Blake O'Neal (4.2 feet, ZONE). Gary Giddey misses. Rebound secured by Zion Parker.

[04:07] Team_005 possession (Score: 108-79)
Draymond Smith drives and kicks out. Isaiah Durant attempts a 3Pt. Contested by DeMar Hyland (3.4 feet, MAN). Isaiah Durant misses. Rebound secured by DeMar Hyland.

[03:53] Team_048 possession (Score: 108-79)
Kyle Irving attempts a Midrange. Contested by Lauri Wade (5.0 feet, MAN). Kyle Irving misses. Offensive rebound by Kyle Irving! Kyle Irving puts it back in!
Score: 110-79

[03:40] Team_005 possession (Score: 110-79)
Lauri Wade attempts a 3Pt. Contested by DeMar Hyland (3.5 feet, ZONE). Lauri Wade misses. Offensive rebound by Zion Parker! Zion Parker puts it back in!
Score: 110-81

[03:27] Team_048 possession (Score: 110-81)
Kyle Irving attempts a 3Pt. Contested by Lauri Wade (5.0 feet, MAN). Kyle Irving misses. Rebound secured by Zion Parker.

[03:13] Team_005 possession (Score: 110-81)
Isaiah Durant drives, picks up DeMar Hyland. Help arrives from Lauri Curry! Isaiah Durant attempts a Dunk. Contested by Lauri Curry (3.7 feet, MAN). ISAIAH DURANT MAKES IT! Assist: Draymond Smith
Score: 110-83

[03:01] Team_048 possession (Score: 110-83)
Gary Giddey drives and kicks out. Kyle Irving attempts a 3Pt. Contested by Lauri Wade (5.1 feet, MAN). KYLE IRVING MAKES IT! Assist: DeMar Hyland
Score: 113-83

[02:48] Team_005 possession (Score: 113-83)
Isaiah Durant attempts a Midrange. Contested by DeMar Hyland (3.7 feet, MAN). Isaiah Durant misses. Rebound secured by Kyle Irving.

[02:39] Team_048 possession (Score: 113-83)
Gary Giddey attempts a Layup. Contested by Zion Parker (4.3 feet, MAN). Gary Giddey misses. Rebound secured by Draymond Smith.

[02:25] Team_005 possession (Score: 113-83)
Blake O'Neal attempts a 3Pt. Contested by Lauri Curry (5.0 feet, MAN). Blake O'Neal misses. Rebound secured by Kyle Irving.

[02:11] Team_048 possession (Score: 113-83)
DeMar Hyland drives to the basket... DeMar Hyland throws a bad pass out of bounds! TURNOVER! (dead ball)

[01:55] Team_005 possession (Score: 113-83)
Draymond Smith drives and kicks out. Isaiah Durant attempts a 3Pt. Contested by DeMar Hyland (3.6 feet, MAN). ISAIAH DURANT MAKES IT! Assist: Draymond Smith
Score: 113-86

[01:41] Team_048 possession (Score: 113-86)
Gary Giddey makes the Midrange and draws the foul on Draymond Smith! And-1! Gary Giddey to the line for 1. [Team fouls: 4] (Draymond Smith: 2 personal fouls)   FT 1/1: GOOD Gary Giddey makes 1/1 from the line.
Score: 116-86

[01:26] Team_005 possession (Score: 116-86)
Lauri Wade attempts a 3Pt. Contested by Kyle Irving (4.6 feet, MAN). LAURI WADE MAKES IT! Assist: Blake O'Neal
Score: 116-89

[01:11] Team_048 possession (Score: 116-89)
DeMar Hyland attempts a 3Pt. Contested by Draymond Smith (4.6 feet, ZONE). DeMar Hyland misses. Offensive rebound by Kyle Irving! Kyle Irving kicks it out.

[00:57] Team_048 possession (Score: 116-89)
Lauri Curry attempts a Midrange. Contested by Isaiah Durant (4.7 feet, ZONE). LAURI CURRY MAKES IT!
Score: 118-89

[00:46] Team_005 possession (Score: 118-89)
Blake O'Neal attempts a 3Pt. Contested by Lauri Curry (5.1 feet, MAN). Blake O'Neal misses. Offensive rebound by Zion Parker! Zion Parker's putback is no good. Rebound secured by DeMar Hyland.

[00:30] Team_048 possession (Score: 118-89)
FOUL! Holding foul on Draymond Smith. [IN THE BONUS! 5 team fouls] Yao Booker to the line for 2 free throws. (Draymond Smith: 3 personal fouls)   FT 1/2: GOOD   FT 2/2: GOOD Yao Booker makes 2/2 from the line.
Score: 120-89

[00:17] Team_005 possession (Score: 120-89)
Draymond Smith attempts a Midrange. Contested by Yao Booker (4.7 feet, MAN). Draymond Smith misses. Rebound secured by Kyle Irving.

[00:03] Team_048 possession (Score: 120-89)
Kyle Irving makes the Layup and draws the foul on Zion Parker! And-1! Kyle Irving to the line for 1. [BONUS: 6 team fouls] (Zion Parker: 1 personal fouls)   FT 1/1: GOOD Kyle Irving makes 1/1 from the line.
Score: 123-89

================================================================================
                              4TH QUARTER COMPLETE                              
================================================================================

4TH QUARTER SCORE: Team_048 32, Team_005 22

BOX SCORE:
================================================================================

Team_048
--------------------------------------------------------------------------------
Player                MIN  PTS  REB  AST  TO      FG   FG%      3P   3P%
--------------------------------------------------------------------------------
Kyle Irving            20   11    7    0   0   4/7    57.1     0/0   0.0
Gary Giddey            21    5    1    1   0   2/5    40.0     0/0   0.0
Yao Booker             21    5    0    0   0   2/2   100.0     0/0   0.0
Damian Mobley          27    2    1    0   0   1/1   100.0     0/0   0.0
Paolo Rozier           29    2    0    0   0   1/1   100.0     0/0   0.0
Lauri Curry            20    2    0    1   0   1/1   100.0     0/0   0.0
Kevin Fox              29    0    1    1   0   0/0     0.0     0/0   0.0

TEAM: FG: 13/19 (68.4%), 3PT: 3/4 (75.0%), REB: 15 (4 off, 11 def), AST: 5, TO: 4
TEAM FOULS: 3


Team_005
--------------------------------------------------------------------------------
Player                MIN  PTS  REB  AST  TO      FG   FG%      3P   3P%
--------------------------------------------------------------------------------
Zion Parker            22    9    5    0   0   4/5    80.0     0/0   0.0
Lauri Wade             20    6    1    0   0   2/3    66.7     0/0   0.0
Isaiah Durant          21    5    0    1   0   2/4    50.0     0/0   0.0
DeMar Hyland           20    5    6    2   0   2/2   100.0     0/0   0.0
Brandon George         26    2    0    0   0   1/1   100.0     0/0   0.0
Jalen Rozier           27    0    1    0   0   0/1     0.0     0/0   0.0
Derrick Allen          29    0    0    0   0   0/1     0.0     0/0   0.0
Draymond Smith         22    0    2    2   0   0/3     0.0     0/0   0.0
Blake O'Neal           22    0    0    1   0   0/3     0.0     0/0   0.0

TEAM: FG: 9/21 (42.9%), 3PT: 3/7 (42.9%), REB: 10 (4 off, 6 def), AST: 4, TO: 1
TEAM FOULS: 6 [Team_048 in BONUS]

================================================================================

================================================================================
                               FULL GAME COMPLETE                               
================================================================================

FINAL SCORE: Team_048 123, Team_005 89

SCORING BY QUARTER:
--------------------------------------------------------------------------------
Team                     Q1     Q2     Q3     Q4    FINAL
--------------------------------------------------------------------------------
Team_048                 34     30     27     32      123
Team_005                 27     18     22     22       89
--------------------------------------------------------------------------------

FULL GAME BOX SCORE:
================================================================================

Team_048
--------------------------------------------------------------------------------
Player                MIN  PTS  REB  AST  TO      FG   FG%      3P   3P%      FT STL BLK
--------------------------------------------------------------------------------
Paolo Rozier           29   13    0    4   1   5/9    55.6   2/5    40.0   6/6     0   0
Dejounte Sexton        29   17    4    1   2   7/13   53.8   4/8    50.0   4/4     0   0
Kevin Fox              29   12   12    3   1   3/6    50.0   0/1     0.0   3/4     1   1
Karl Johnson           27    9    0    2   2   4/8    50.0   0/3     0.0   0/0     0   0
Damian Mobley          27   16   12    3   1   8/13   61.5   0/1     0.0   2/2     0   0
Yao Booker             21    7    0    2   0   2/4    50.0   1/3    33.3   2/2     0   0
Gary Giddey            21   11    4    1   3   6/12   50.0   2/3    66.7   1/2     0   0
Lauri Curry            20    2    0    1   1   2/2   100.0   0/0     0.0   0/0     0   2
Kyle Irving            20   19   12    0   1   7/11   63.6   3/4    75.0   2/3     0   0
DeMar Hyland           20   11    9    3   0   3/5    60.0   1/3    33.3  10/11    1   1

TEAM: FG: 48/84 (57.1%), 3PT: 13/31 (41.9%), REB: 52 (8 off, 44 def), AST: 20, TO: 12


Team_005
--------------------------------------------------------------------------------
Player                MIN  PTS  REB  AST  TO      FG   FG%      3P   3P%      FT STL BLK
--------------------------------------------------------------------------------
Derrick Allen          29    6    7    2   0   3/9    33.3   1/2    50.0   1/2     1   0
Jalen Rozier           27    7   14    1   0   3/10   30.0   1/2    50.0   0/0     0   0
Brandon George         26    9    0    2   1   4/9    44.4   1/4    25.0   0/0     0   0
Anthony Rozier         26    3    0    2   3   1/4    25.0   1/2    50.0   0/1     0   0
Cade Markkanen         26   18    8    0   0   8/14   57.1   0/2     0.0   9/11    0   0
Blake O'Neal           22    2    0    2   1   1/5    20.0   0/3     0.0   2/2     1   0
Draymond Smith         22    9    3    2   2   5/10   50.0   1/3    33.3   2/2     0   0
Zion Parker            22   11    8    2   0   3/8    37.5   0/0     0.0   3/3     2   0
Isaiah Durant          21    9    0    1   1   3/7    42.9   0/0     0.0   2/3     0   0
Lauri Wade             20   10    5    0   1   5/7    71.4   4/5    80.0   4/5     0   0

TEAM: FG: 37/84 (44.0%), 3PT: 9/23 (39.1%), REB: 46 (12 off, 34 def), AST: 14, TO: 9

================================================================================
