================================================================================
                        FULL GAME - Team_098 vs Team_095                        
================================================================================

================================================================================
                       1ST QUARTER - Team_098 vs Team_095                       
================================================================================

[12:00] Team_098 possession (Score: 0-0)
Blake Murray attempts a Midrange. Contested by Evan Carter (4.0 feet, ZONE). BLAKE MURRAY MAKES IT! Assist: Nikola Rose
Score: 2-0

[11:45] Team_095 possession (Score: 2-0)
Immanuel Middleton attempts a 3Pt. Contested by Pascal Lillard (4.0 feet, MAN). IMMANUEL MIDDLETON MAKES IT! Assist: Dejounte Hyland
Score: 2-3

[11:33] Team_098 possession (Score: 2-3)
Blake Murray attempts a Layup. Contested by Immanuel Middleton (5.0 feet, ZONE). Blake Murray misses. Rebound secured by Shaquille Ball.

[11:20] Team_095 possession (Score: 2-3)
Immanuel Middleton drives, Pascal Lillard stays with him. Immanuel Middleton attempts a Layup. Contested by Pascal Lillard (4.0 feet, MAN). Immanuel Middleton misses. FOUL! Loose ball foul on Pascal Lillard during the rebound battle. [Team fouls: 1] No free throws, side out. (Pascal Lillard: 1 personal fouls)

[11:09] Team_095 possession (Score: 2-3)
Dejounte Hyland drives, picks up Pascal Lillard. Help arrives from Nikola Rose! Dejounte Hyland attempts a Dunk. Contested by Nikola Rose (4.0 feet, ZONE). DEJOUNTE HYLAND MAKES IT!
Score: 2-5

[10:55] Team_098 possession (Score: 2-5)
FOUL! Shooting foul on Immanuel Middleton. Blake Murray to the line for 2 free throws. [Team fouls: 1] (Immanuel Middleton: 1 personal fouls)   FT 1/2: GOOD   FT 2/2: MISS Blake Murray makes 1/2 from the line. Rebound secured by Dejounte Hyland.
Score: 3-5

[10:42] Team_095 possession (Score: 3-5)
Dejounte Hyland drives to the basket... Dejounte Hyland throws a bad pass! Stolen by Malcolm Tatum! TURNOVER! (live ball)

[10:29] Team_098 possession (Score: 3-5)
Nikola Rose drives and kicks out. Pascal Lillard attempts a Midrange. Contested by Dejounte Hyland (4.9 feet, ZONE). PASCAL LILLARD MAKES IT! Assist: Derrick Durant
Score: 5-5

[10:17] Team_095 possession (Score: 5-5)
Dejounte Hyland attempts a Layup. BLOCKED BY DERRICK DURANT! Ball is loose! Rebound secured by Pascal Lillard.

[10:06] Team_098 possession (Score: 5-5)
Nikola Rose attempts a 3Pt. Contested by Shaquille Ball (4.7 feet, MAN). Nikola Rose misses. Rebound secured by Shaquille Ball.

[09:51] Team_095 possession (Score: 5-5)
Dejounte Hyland makes the Layup and draws the foul on Pascal Lillard! And-1! Dejounte Hyland to the line for 1. [Team fouls: 2] (Pascal Lillard: 2 personal fouls)   FT 1/1: GOOD Dejounte Hyland makes 1/1 from the line.
Score: 5-8

[09:32] Team_098 possession (Score: 5-8)
FOUL! Holding foul on Evan Carter. [Team fouls: 2] No free throws, side out. (Evan Carter: 1 personal fouls)

[09:16] Team_098 possession (Score: 5-8)
Malcolm Tatum makes the Midrange and draws the foul on Dejounte Hyland! And-1! Malcolm Tatum to the line for 1. [Team fouls: 3] (Dejounte Hyland: 1 personal fouls)   FT 1/1: GOOD Malcolm Tatum makes 1/1 from the line.
Score: 8-8

[09:06] Team_095 possession (Score: 8-8)
Dejounte Hyland attempts a 3Pt. Contested by Nikola Rose (3.2 feet, ZONE). Dejounte Hyland misses. Rebound secured by Pascal Lillard.

[08:50] Team_098 possession (Score: 8-8)
Nikola Rose attempts a Layup. Contested by Immanuel Middleton (5.2 feet, ZONE). Nikola Rose misses. FOUL! Loose ball foul on Evan Carter during the rebound battle. [Team fouls: 4] No free throws, side out. (Evan Carter: 2 personal fouls)

[08:39] Team_098 possession (Score: 8-8)
Blake Murray drives, picks up Evan Carter. Help arrives from Dejounte Hyland! Blake Murray attempts a Layup. Contested by Dejounte Hyland (4.0 feet, MAN). BLAKE MURRAY MAKES IT!
Score: 10-8

[08:27] Team_095 possession (Score: 10-8)
Shaquille Ball attempts a 3Pt. Contested by Nikola Rose (3.2 feet, ZONE). Shaquille Ball misses. Rebound secured by Derrick Durant.

[08:12] Team_098 possession (Score: 10-8)
Derrick Durant attempts a Layup. Contested by Immanuel Middleton (5.1 feet, ZONE). DERRICK DURANT MAKES IT! Assist: Pascal Lillard
Score: 12-8

[07:57] Team_095 possession (Score: 12-8)
FOUL! Reach-in foul on Nikola Rose during the drive. [Team fouls: 3] No free throws, side out. (Nikola Rose: 1 personal fouls)

[07:42] Team_095 possession (Score: 12-8)
Immanuel Middleton attempts a 3Pt. Contested by Nikola Rose (3.2 feet, ZONE). Immanuel Middleton misses. Offensive rebound by Dejounte Hyland! Dejounte Hyland kicks it out.

[07:31] Team_095 possession (Score: 12-8)
FOUL! Shooting foul on Blake Murray. Evan Carter to the line for 2 free throws. [Team fouls: 4] (Blake Murray: 1 personal fouls)   FT 1/2: GOOD   FT 2/2: GOOD Evan Carter makes 2/2 from the line.
Score: 12-10

[07:20] Team_098 possession (Score: 12-10)
Pascal Lillard drives, picks up Immanuel Middleton. Help arrives from Dejounte Hyland! Pascal Lillard attempts a Layup. Contested by Dejounte Hyland (5.4 feet, ZONE). PASCAL LILLARD MAKES IT!
Score: 14-10

[07:08] Team_095 possession (Score: 14-10)
Immanuel Middleton attempts a 3Pt. Contested by Malcolm Tatum (3.9 feet, ZONE). Immanuel Middleton misses. Rebound secured by Pascal Lillard.

[06:54] Team_098 possession (Score: 14-10)
Pascal Lillard attempts a 3Pt. Contested by Immanuel Middleton (5.4 feet, MAN). Pascal Lillard misses. Offensive rebound by Derrick Durant! Derrick Durant's putback is no good. Offensive rebound by Pascal Lillard! Pascal Lillard kicks it out.

[06:43] Team_098 possession (Score: 14-10)
Pascal Lillard attempts a Midrange. Contested by Evan Carter (4.4 feet, ZONE). Pascal Lillard misses. Rebound secured by Dejounte Hyland.

[06:26] Team_095 possession (Score: 14-10)
Immanuel Middleton drives to the basket... Immanuel Middleton loses the ball! Stripped by Pascal Lillard! TURNOVER! (live ball)

[06:14] Team_098 possession (Score: 14-10)
Nikola Rose attempts a Midrange. Contested by Shaquille Ball (4.7 feet, MAN). NIKOLA ROSE MAKES IT!
Score: 16-10

[05:58] Team_095 possession (Score: 16-10)
Shaquille Ball attempts a Midrange. Contested by Nikola Rose (3.2 feet, MAN). Shaquille Ball misses. Offensive rebound by Evan Carter! Evan Carter's putback is no good. Rebound secured by Derrick Durant.

[05:42] Team_098 possession (Score: 16-10)
Malcolm Tatum attempts a Layup. BLOCKED BY DEJOUNTE HYLAND! Ball is loose! Offensive rebound by Pascal Lillard! Pascal Lillard kicks it out.

[05:23] Team_098 possession (Score: 16-10)
Malcolm Tatum attempts a 3Pt. Contested by Dejounte Hyland (5.1 feet, MAN). MALCOLM TATUM MAKES IT! Assist: Pascal Lillard
Score: 19-10

[05:07] Team_095 possession (Score: 19-10)
Immanuel Middleton makes the Layup and draws the foul on Pascal Lillard! And-1! Immanuel Middleton to the line for 1. [BONUS: 5 team fouls] (Pascal Lillard: 3 personal fouls)   FT 1/1: GOOD Immanuel Middleton makes 1/1 from the line.
Score: 19-13

[04:52] Team_098 possession (Score: 19-13)
Derrick Durant drives and kicks out. Pascal Lillard attempts a 3Pt. Contested by Immanuel Middleton (5.0 feet, ZONE). PASCAL LILLARD MAKES IT! Assist: Malcolm Tatum
Score: 22-13

[04:37] Team_095 possession (Score: 22-13)
Shaquille Ball attempts a 3Pt. Contested by Nikola Rose (3.2 feet, ZONE). SHAQUILLE BALL MAKES IT! Assist: Dejounte Hyland
Score: 22-16

[04:26] Team_098 possession (Score: 22-16)
Nikola Rose attempts a Midrange. Contested by Shaquille Ball (4.7 feet, MAN). Nikola Rose misses. Offensive rebound by Pascal Lillard! Pascal Lillard kicks it out.

[04:08] Team_098 possession (Score: 22-16)
Blake Murray attempts a 3Pt. Contested by Evan Carter (4.1 feet, ZONE). Blake Murray misses. Rebound secured by Dejounte Hyland.

[03:50] Team_095 possession (Score: 22-16)
Dejounte Hyland drives, Pascal Lillard stays with him. Dejounte Hyland attempts a Layup. Contested by Pascal Lillard (4.2 feet, ZONE). DEJOUNTE HYLAND MAKES IT!
Score: 22-18

[03:35] Team_098 possession (Score: 22-18)
Nikola Rose attempts a Layup. Contested by Shaquille Ball (4.8 feet, MAN). NIKOLA ROSE MAKES IT! Assist: Malcolm Tatum
Score: 24-18

[03:22] Team_095 possession (Score: 24-18)
Evan Carter makes the Layup and draws the foul on Pascal Lillard! And-1! Evan Carter to the line for 1. [BONUS: 6 team fouls] (Pascal Lillard: 4 personal fouls)   FT 1/1: GOOD Evan Carter makes 1/1 from the line.
Score: 24-21

[03:05] Team_098 possession (Score: 24-21)
Pascal Lillard drives, picks up Immanuel Middleton. Help arrives from Dejounte Hyland! Pascal Lillard attempts a Layup. Contested by Dejounte Hyland (5.7 feet, MAN). PASCAL LILLARD MAKES IT!
Score: 26-21

[02:55] Team_095 possession (Score: 26-21)
Evan Carter attempts a 3Pt. Contested by Blake Murray (5.0 feet, MAN). Evan Carter misses. Rebound secured by Nikola Rose.

[02:41] Team_098 possession (Score: 26-21)
Nikola Rose drives, picks up Shaquille Ball. Help arrives from Evan Carter! Nikola Rose attempts a Layup. Contested by Evan Carter (4.8 feet, MAN). Nikola Rose misses. FOUL! Loose ball foul on Dejounte Hyland during the rebound battle. [IN THE BONUS! 5 team fouls] Pascal Lillard to the line for 2 free throws. (Dejounte Hyland: 2 personal fouls)   FT 1/2: GOOD   FT 2/2: MISS Pascal Lillard makes 1/2 from the line. Rebound secured by Evan Carter.
Score: 27-21

[02:27] Team_095 possession (Score: 27-21)
Evan Carter attempts a 3Pt. Contested by Blake Murray (5.0 feet, MAN). Evan Carter misses. Rebound secured by Nikola Rose.

[02:09] Team_098 possession (Score: 27-21)
Malcolm Tatum drives, Dejounte Hyland stays with him. Malcolm Tatum attempts a Layup. Contested by Dejounte Hyland (5.3 feet, MAN). MALCOLM TATUM MAKES IT! Assist: Blake Murray
Score: 29-21

[01:55] Team_095 possession (Score: 29-21)
Evan Carter drives, Blake Murray stays with him. Evan Carter attempts a Dunk. Contested by Blake Murray (5.1 feet, MAN). EVAN CARTER MAKES IT! Assist: Dejounte Hyland
Score: 29-23

[01:39] Team_098 possession (Score: 29-23)
Malcolm Tatum attempts a 3Pt. Contested by Dejounte Hyland (5.4 feet, MAN). Malcolm Tatum misses. Rebound secured by Shaquille Ball.

[01:27] Team_095 possession (Score: 29-23)
Shaquille Ball attempts a Midrange. Contested by Nikola Rose (3.5 feet, MAN). Shaquille Ball misses. Rebound secured by Pascal Lillard.

[01:13] Team_098 possession (Score: 29-23)
Pascal Lillard attempts a Midrange. Contested by Immanuel Middleton (5.9 feet, MAN). Pascal Lillard misses. Rebound secured by Evan Carter.

[00:55] Team_095 possession (Score: 29-23)
FOUL! Shooting foul on Nikola Rose. Shaquille Ball to the line for 2 free throws. [BONUS: 7 team fouls] (Nikola Rose: 2 personal fouls)   FT 1/2: GOOD   FT 2/2: GOOD Shaquille Ball makes 2/2 from the line.
Score: 29-25

[00:41] Team_098 possession (Score: 29-25)
FOUL! Shooting foul on Shaquille Ball. Nikola Rose to the line for 2 free throws. [BONUS: 6 team fouls] (Shaquille Ball: 1 personal fouls)   FT 1/2: MISS   FT 2/2: GOOD Nikola Rose makes 1/2 from the line.
Score: 30-25

[00:28] Team_095 possession (Score: 30-25)
Immanuel Middleton drives to the basket... Immanuel Middleton loses control! Ball rolls out of bounds! TURNOVER! (dead ball)

[00:28] Substitution (Team_098): Malcolm Tatum OUT → Tracy Rose IN (stamina_rule2)

[00:28] Substitution (Team_098): Nikola Rose OUT → Dirk McCollum IN (stamina_rule2)

[00:28] Substitution (Team_098): Blake Murray OUT → Kristaps Iverson IN (stamina_rule2)

[00:28] Substitution (Team_098): Pascal Lillard OUT → Manu Jordan IN (stamina_rule2)

[00:28] Substitution (Team_098): Derrick Durant OUT → Russell McGrady IN (stamina_rule2)

[00:28] Substitution (Team_095): Dejounte Hyland OUT → Kyle Poole IN (stamina_rule2)

[00:28] Substitution (Team_095): Shaquille Ball OUT → Cade Beal IN (stamina_rule2)

[00:28] Substitution (Team_095): Evan Carter OUT → Tobias Wagner IN (stamina_rule2)

[00:28] Substitution (Team_095): Immanuel Middleton OUT → Gary Davis IN (stamina_rule2)

[00:28] Substitution (Team_095): Kyrie Ming OUT → DeMar McCollum IN (stamina_rule2)

[00:12] Team_098 possession (Score: 30-25)
Russell McGrady throws a bad pass out of bounds! TURNOVER! (dead ball)

================================================================================
                              1ST QUARTER COMPLETE                              
================================================================================

1ST QUARTER SCORE: Team_098 30, Team_095 25

BOX SCORE:
================================================================================

Team_098
--------------------------------------------------------------------------------
Player                MIN  PTS  REB  AST  TO      FG   FG%      3P   3P%
--------------------------------------------------------------------------------
Pascal Lillard         12    9    7    2   0   4/6    66.7     0/0   0.0
Malcolm Tatum          12    8    0    2   0   3/4    75.0     0/0   0.0
Nikola Rose            12    5    2    1   0   3/5    60.0     0/0   0.0
Blake Murray           12    4    0    1   0   2/5    40.0     0/0   0.0

TEAM: FG: 13/21 (61.9%), 3PT: 1/4 (25.0%), REB: 12 (5 off, 7 def), AST: 7, TO: 1
TEAM FOULS: 7 [Team_095 in BONUS]


Team_095
--------------------------------------------------------------------------------
Player                MIN  PTS  REB  AST  TO      FG   FG%      3P   3P%
--------------------------------------------------------------------------------
Dejounte Hyland        12    7    5    3   0   3/5    60.0     0/0   0.0
Evan Carter            12    7    2    0   0   3/5    60.0     0/0   0.0
Immanuel Middleton     12    6    0    0   0   2/3    66.7     0/0   0.0
Shaquille Ball         12    5    3    0   0   2/5    40.0     0/0   0.0
Derrick Durant         12    2    3    1   0   1/1   100.0     0/0   0.0

TEAM: FG: 10/18 (55.6%), 3PT: 2/7 (28.6%), REB: 10 (3 off, 7 def), AST: 3, TO: 3
TEAM FOULS: 6 [Team_098 in BONUS]

================================================================================

================================================================================
                       2ND QUARTER - Team_098 vs Team_095                       
================================================================================

[12:00] Team_098 possession (Score: 30-25)
Nikola Rose attempts a 3Pt. Contested by Evan Carter (4.4 feet, ZONE). Nikola Rose misses. Rebound secured by Evan Carter.

[11:43] Team_095 possession (Score: 30-25)
Dejounte Hyland makes the Layup and draws the foul on Nikola Rose! And-1! Dejounte Hyland to the line for 1. [Team fouls: 1] (Nikola Rose: 1 personal fouls)   FT 1/1: GOOD Dejounte Hyland makes 1/1 from the line.
Score: 30-28

[11:26] Team_098 possession (Score: 30-28)
Malcolm Tatum attempts a Midrange. Contested by Shaquille Ball (4.8 feet, ZONE). Malcolm Tatum misses. Rebound secured by Dejounte Hyland.

[11:12] Team_095 possession (Score: 30-28)
Dejounte Hyland attempts a 3Pt. Contested by Nikola Rose (3.5 feet, ZONE). Dejounte Hyland misses. Rebound secured by Pascal Lillard.

[10:59] Team_098 possession (Score: 30-28)
Pascal Lillard attempts a Midrange. Contested by Shaquille Ball (5.2 feet, ZONE). Pascal Lillard misses. Rebound secured by Dejounte Hyland.

[10:41] Team_095 possession (Score: 30-28)
FOUL! Offensive foul on Evan Carter! Blake Murray drew the charge! [Team fouls: 1] (Evan Carter: 1 personal fouls) TURNOVER! (dead ball)

[10:27] Team_098 possession (Score: 30-28)
Blake Murray attempts a 3Pt. Contested by Evan Carter (4.4 feet, ZONE). Blake Murray misses. Rebound secured by Shaquille Ball.

[10:08] Team_095 possession (Score: 30-28)
Shaquille Ball drives, picks up Pascal Lillard. Help arrives from Nikola Rose! Shaquille Ball attempts a Dunk. Contested by Nikola Rose (4.5 feet, ZONE). Shaquille Ball misses. Rebound secured by Nikola Rose.

[09:50] Team_098 possession (Score: 30-28)
Malcolm Tatum attempts a Midrange. Contested by Kyrie Ming (5.8 feet, ZONE). Malcolm Tatum misses. Rebound secured by Dejounte Hyland.

[09:38] Team_095 possession (Score: 30-28)
Evan Carter drives, Blake Murray stays with him. Evan Carter attempts a Dunk. Contested by Blake Murray (5.3 feet, MAN). Evan Carter misses. FOUL! Loose ball foul on Derrick Durant during the rebound battle. [Team fouls: 2] No free throws, side out. (Derrick Durant: 1 personal fouls)

[09:26] Team_095 possession (Score: 30-28)
Kyrie Ming commits a violation (traveling/carry)! TURNOVER! (dead ball)

[09:26] Substitution (Team_098): Malcolm Tatum OUT → Tracy Rose IN (stamina_rule2)

[09:26] Substitution (Team_098): Nikola Rose OUT → Dirk McCollum IN (stamina_rule2)

[09:26] Substitution (Team_098): Blake Murray OUT → Kristaps Iverson IN (stamina_rule2)

[09:26] Substitution (Team_098): Pascal Lillard OUT → Manu Jordan IN (stamina_rule2)

[09:26] Substitution (Team_098): Derrick Durant OUT → Russell McGrady IN (stamina_rule2)

[09:26] Substitution (Team_095): Dejounte Hyland OUT → Kyle Poole IN (stamina_rule2)

[09:26] Substitution (Team_095): Shaquille Ball OUT → Cade Beal IN (stamina_rule2)

[09:26] Substitution (Team_095): Evan Carter OUT → Tobias Wagner IN (stamina_rule2)

[09:26] Substitution (Team_095): Immanuel Middleton OUT → Gary Davis IN (stamina_rule2)

[09:26] Substitution (Team_095): Kyrie Ming OUT → DeMar McCollum IN (stamina_rule2)

[09:14] Team_098 possession (Score: 30-28)
Manu Jordan attempts a Midrange. Contested by Gary Davis (5.7 feet, MAN). MANU JORDAN MAKES IT! Assist: Tracy Rose
Score: 32-28

[09:04] Team_095 possession (Score: 32-28)
Kyle Poole attempts a Midrange. Contested by Tracy Rose (3.6 feet, MAN). Kyle Poole misses. Rebound secured by Manu Jordan.

[08:50] Team_098 possession (Score: 32-28)
Kristaps Iverson attempts a 3Pt. Contested by Cade Beal (4.5 feet, ZONE). KRISTAPS IVERSON MAKES IT! Assist: Manu Jordan
Score: 35-28

[08:35] Team_095 possession (Score: 35-28)
Tobias Wagner attempts a 3Pt. Contested by Dirk McCollum (4.5 feet, ZONE). Tobias Wagner misses. Rebound secured by Kristaps Iverson.

[08:17] Team_098 possession (Score: 35-28)
Russell McGrady drives to the basket... Russell McGrady throws a bad pass! Stolen by DeMar McCollum! TURNOVER! (live ball)

[07:59] Team_095 possession (Score: 35-28)
Kyle Poole attempts a 3Pt. Contested by Tracy Rose (3.6 feet, MAN). Kyle Poole misses. Rebound secured by Kristaps Iverson.

[07:45] Team_098 possession (Score: 35-28)
Tracy Rose throws a bad pass! Stolen by Kyle Poole! TURNOVER! (live ball)

[07:34] Team_095 possession (Score: 35-28)
Gary Davis drives to the basket... Gary Davis commits a violation (traveling/carry)! TURNOVER! (dead ball)

[07:19] Team_098 possession (Score: 35-28)
Russell McGrady makes the Layup and draws the foul on DeMar McCollum! And-1! Russell McGrady to the line for 1. [Team fouls: 2] (DeMar McCollum: 1 personal fouls)   FT 1/1: GOOD Russell McGrady makes 1/1 from the line.
Score: 38-28

[07:04] Team_095 possession (Score: 38-28)
Gary Davis drives and kicks out. Kyle Poole attempts a 3Pt. Contested by Dirk McCollum (4.2 feet, ZONE). Kyle Poole misses. FOUL! Loose ball foul on Manu Jordan during the rebound battle. [Team fouls: 3] No free throws, side out. (Manu Jordan: 1 personal fouls)

[06:51] Team_095 possession (Score: 38-28)
Cade Beal attempts a 3Pt. Contested by Dirk McCollum (4.1 feet, ZONE). CADE BEAL MAKES IT! Assist: DeMar McCollum
Score: 38-31

[06:37] Team_098 possession (Score: 38-31)
Manu Jordan attempts a Layup. Contested by Gary Davis (5.7 feet, MAN). Manu Jordan misses. Rebound secured by Gary Davis.

[06:24] Team_095 possession (Score: 38-31)
Kyle Poole attempts a Layup. Contested by Tracy Rose (3.6 feet, MAN). KYLE POOLE MAKES IT! Assist: Tobias Wagner
Score: 38-33

[06:09] Team_098 possession (Score: 38-33)
Russell McGrady attempts a Midrange. Contested by DeMar McCollum (4.7 feet, MAN). RUSSELL MCGRADY MAKES IT!
Score: 40-33

[05:53] Team_095 possession (Score: 40-33)
Kyle Poole attempts a 3Pt. Contested by Tracy Rose (3.6 feet, MAN). Kyle Poole misses. Rebound secured by Manu Jordan.

[05:38] Team_098 possession (Score: 40-33)
FOUL! Shooting foul on Kyle Poole. Dirk McCollum to the line for 2 free throws. [Team fouls: 3] (Kyle Poole: 1 personal fouls)   FT 1/2: GOOD   FT 2/2: MISS Dirk McCollum makes 1/2 from the line. Offensive rebound by Kristaps Iverson! Kristaps Iverson kicks it out.
Score: 41-33

[05:24] Team_098 possession (Score: 41-33)
Kristaps Iverson drives, picks up Tobias Wagner. Help arrives from Kyle Poole! Kristaps Iverson attempts a Dunk. Contested by Kyle Poole (3.9 feet, MAN). KRISTAPS IVERSON MAKES IT! Assist: Manu Jordan
Score: 43-33

[05:13] Team_095 possession (Score: 43-33)
FOUL! Shooting foul on Kristaps Iverson. DeMar McCollum to the line for 2 free throws. [Team fouls: 4] (Kristaps Iverson: 1 personal fouls)   FT 1/2: GOOD   FT 2/2: MISS DeMar McCollum makes 1/2 from the line. Offensive rebound by DeMar McCollum! DeMar McCollum kicks it out.
Score: 43-34

[04:57] Team_095 possession (Score: 43-34)
Tobias Wagner attempts a 3Pt. Contested by Kristaps Iverson (4.3 feet, MAN). Tobias Wagner misses. Offensive rebound by Tobias Wagner! Tobias Wagner kicks it out.

[04:38] Team_095 possession (Score: 43-34)
FOUL! Reach-in foul on Manu Jordan during the drive. [IN THE BONUS! 5 team fouls] Gary Davis to the line for 2 free throws. (Manu Jordan: 2 personal fouls)   FT 1/2: MISS   FT 2/2: GOOD Gary Davis makes 1/2 from the line.
Score: 43-35

[04:23] Team_098 possession (Score: 43-35)
Manu Jordan attempts a 3Pt. Contested by Gary Davis (5.7 feet, MAN). Manu Jordan misses. Rebound secured by DeMar McCollum.

[04:07] Team_095 possession (Score: 43-35)
DeMar McCollum attempts a Midrange. Contested by Kristaps Iverson (4.5 feet, ZONE). DEMAR MCCOLLUM MAKES IT! Assist: Tobias Wagner
Score: 43-37

[03:52] Team_098 possession (Score: 43-37)
Tracy Rose attempts a 3Pt. Contested by Kyle Poole (4.8 feet, MAN). Tracy Rose misses. Rebound secured by Tobias Wagner.

[03:41] Team_095 possession (Score: 43-37)
DeMar McCollum drives, Russell McGrady stays with him. DeMar McCollum attempts a Dunk. Contested by Russell McGrady (4.4 feet, ZONE). DeMar McCollum misses. Rebound secured by Manu Jordan.

[03:24] Team_098 possession (Score: 43-37)
Tracy Rose attempts a 3Pt. Contested by Cade Beal (4.5 feet, ZONE). Tracy Rose misses. Rebound secured by Gary Davis.

[03:09] Team_095 possession (Score: 43-37)
FOUL! Holding foul on Manu Jordan. [IN THE BONUS! 6 team fouls] Gary Davis to the line for 2 free throws. (Manu Jordan: 3 personal fouls)   FT 1/2: GOOD   FT 2/2: GOOD Gary Davis makes 2/2 from the line.
Score: 43-39

[03:00] Team_098 possession (Score: 43-39)
Kristaps Iverson attempts a 3Pt. Contested by Kyle Poole (4.9 feet, ZONE). Kristaps Iverson misses. Rebound secured by Gary Davis.

[02:51] Team_095 possession (Score: 43-39)
Cade Beal drives and kicks out. Gary Davis attempts a Midrange. Contested by Kristaps Iverson (4.0 feet, ZONE). Gary Davis misses. Rebound secured by Manu Jordan.

[02:35] Team_098 possession (Score: 43-39)
Russell McGrady drives and kicks out. Dirk McCollum attempts a Midrange. Contested by Cade Beal (4.4 feet, ZONE). Dirk McCollum misses. Rebound secured by DeMar McCollum.

[02:16] Team_095 possession (Score: 43-39)
Cade Beal attempts a 3Pt. Contested by Dirk McCollum (4.1 feet, ZONE). Cade Beal misses. Rebound secured by Kristaps Iverson.

[01:58] Team_098 possession (Score: 43-39)
Dirk McCollum attempts a Layup. Contested by DeMar McCollum (5.1 feet, ZONE). DIRK MCCOLLUM MAKES IT!
Score: 45-39

[01:44] Team_095 possession (Score: 45-39)
Cade Beal attempts a 3Pt. Contested by Dirk McCollum (4.2 feet, MAN). CADE BEAL MAKES IT!
Score: 45-42

[01:32] Team_098 possession (Score: 45-42)
Kristaps Iverson makes the Layup and draws the foul on Tobias Wagner! And-1! Kristaps Iverson to the line for 1. [Team fouls: 4] (Tobias Wagner: 1 personal fouls)   FT 1/1: GOOD Kristaps Iverson makes 1/1 from the line.
Score: 48-42

[01:15] Team_095 possession (Score: 48-42)
Kyle Poole attempts a 3Pt. Contested by Dirk McCollum (4.6 feet, ZONE). KYLE POOLE MAKES IT! Assist: DeMar McCollum
Score: 48-45

[01:00] Team_098 possession (Score: 48-45)
Tracy Rose attempts a 3Pt. Contested by Kyle Poole (5.0 feet, ZONE). Tracy Rose misses. Rebound secured by Tobias Wagner.

[00:44] Team_095 possession (Score: 48-45)
Gary Davis drives and kicks out. Tobias Wagner attempts a 3Pt. Contested by Dirk McCollum (4.3 feet, ZONE). Tobias Wagner misses. Rebound secured by Kristaps Iverson.

[00:28] Team_098 possession (Score: 48-45)
Russell McGrady attempts a Layup. Contested by DeMar McCollum (5.0 feet, MAN). RUSSELL MCGRADY MAKES IT! Assist: Kristaps Iverson
Score: 50-45

[00:17] Team_095 possession (Score: 50-45)
Gary Davis drives and kicks out. Gary Davis attempts a Midrange. Contested by Manu Jordan (4.9 feet, MAN). Gary Davis misses. Rebound secured by Russell McGrady.

[00:05] Team_098 possession (Score: 50-45)
Russell McGrady attempts a Midrange. Contested by DeMar McCollum (5.0 feet, MAN). Russell McGrady misses. Rebound secured by DeMar McCollum.

================================================================================
                              2ND QUARTER COMPLETE                              
================================================================================

2ND QUARTER SCORE: Team_098 20, Team_095 20

BOX SCORE:
================================================================================

Team_098
--------------------------------------------------------------------------------
Player                MIN  PTS  REB  AST  TO      FG   FG%      3P   3P%
--------------------------------------------------------------------------------
Kristaps Iverson       10    8    5    1   0   3/4    75.0     0/0   0.0
Russell McGrady        10    7    1    0   0   3/5    60.0     0/0   0.0
Manu Jordan            10    2    4    2   0   1/3    33.3     0/0   0.0
Dirk McCollum          10    2    0    0   0   1/1   100.0     0/0   0.0
Nikola Rose            15    0    1    0   0   0/1     0.0     0/0   0.0
Malcolm Tatum          15    0    0    0   0   0/2     0.0     0/0   0.0
Pascal Lillard         15    0    1    0   0   0/1     0.0     0/0   0.0
Blake Murray           15    0    0    0   0   0/1     0.0     0/0   0.0
Tracy Rose             10    0    0    1   0   0/3     0.0     0/0   0.0

TEAM: FG: 8/21 (38.1%), 3PT: 1/8 (12.5%), REB: 12 (1 off, 11 def), AST: 4, TO: 2
TEAM FOULS: 6 [Team_095 in BONUS]


Team_095
--------------------------------------------------------------------------------
Player                MIN  PTS  REB  AST  TO      FG   FG%      3P   3P%
--------------------------------------------------------------------------------
Cade Beal              10    6    0    0   0   2/4    50.0     0/0   0.0
Kyle Poole             10    5    0    0   0   2/5    40.0     0/0   0.0
Dejounte Hyland        15    3    3    0   0   1/2    50.0     0/0   0.0
Gary Davis             10    3    3    0   0   2/4    50.0     0/0   0.0
DeMar McCollum         10    2    4    2   0   1/2    50.0     0/0   0.0
Evan Carter            15    0    1    0   0   0/0     0.0     0/0   0.0
Shaquille Ball         15    0    2    0   0   0/1     0.0     0/0   0.0
Tobias Wagner          10    0    4    2   0   0/1     0.0     0/0   0.0

TEAM: FG: 8/19 (42.1%), 3PT: 3/8 (37.5%), REB: 17 (4 off, 13 def), AST: 4, TO: 3
TEAM FOULS: 4

================================================================================

================================================================================
                       3RD QUARTER - Team_098 vs Team_095                       
================================================================================

[12:00] Team_098 possession (Score: 50-45)
Nikola Rose attempts a Layup. Contested by Shaquille Ball (4.7 feet, MAN). NIKOLA ROSE MAKES IT! Assist: Pascal Lillard
Score: 52-45

[11:44] Team_095 possession (Score: 52-45)
Kyrie Ming drives, Pascal Lillard stays with him. Kyrie Ming attempts a Dunk. Contested by Pascal Lillard (4.2 feet, ZONE). Kyrie Ming misses. Rebound secured by Nikola Rose.

[11:28] Team_098 possession (Score: 52-45)
FOUL! Holding foul on Evan Carter. [Team fouls: 1] No free throws, side out. (Evan Carter: 1 personal fouls)

[11:13] Team_098 possession (Score: 52-45)
Pascal Lillard makes the Layup and draws the foul on Dejounte Hyland! And-1! Pascal Lillard to the line for 1. [Team fouls: 2] (Dejounte Hyland: 1 personal fouls)   FT 1/1: GOOD Pascal Lillard makes 1/1 from the line.
Score: 55-45

[10:59] Team_095 possession (Score: 55-45)
Evan Carter makes the Dunk and draws the foul on Pascal Lillard! And-1! Evan Carter to the line for 1. [Team fouls: 1] (Pascal Lillard: 1 personal fouls)   FT 1/1: GOOD Evan Carter makes 1/1 from the line.
Score: 55-48

[10:40] Team_098 possession (Score: 55-48)
Pascal Lillard makes the Layup and draws the foul on Immanuel Middleton! And-1! Pascal Lillard to the line for 1. [Team fouls: 3] (Immanuel Middleton: 1 personal fouls)   FT 1/1: GOOD Pascal Lillard makes 1/1 from the line.
Score: 58-48

[10:22] Team_095 possession (Score: 58-48)
Shaquille Ball attempts a Midrange. Contested by Nikola Rose (3.2 feet, MAN). Shaquille Ball misses. Rebound secured by Pascal Lillard.

[10:06] Team_098 possession (Score: 58-48)
FOUL! Shooting foul on Shaquille Ball. Nikola Rose to the line for 2 free throws. [Team fouls: 4] (Shaquille Ball: 1 personal fouls)   FT 1/2: GOOD   FT 2/2: MISS Nikola Rose makes 1/2 from the line. Rebound secured by Dejounte Hyland.
Score: 59-48

[09:54] Team_095 possession (Score: 59-48)
FOUL! Shooting foul on Nikola Rose. Immanuel Middleton to the line for 3 free throws. [Team fouls: 2] (Nikola Rose: 1 personal fouls)   FT 1/3: GOOD   FT 2/3: GOOD   FT 3/3: MISS Immanuel Middleton makes 2/3 from the line. Rebound secured by Derrick Durant.
Score: 59-50

[09:43] Team_098 possession (Score: 59-50)
Blake Murray attempts a Midrange. Contested by Evan Carter (4.0 feet, ZONE). Blake Murray misses. Rebound secured by Shaquille Ball.

[09:26] Team_095 possession (Score: 59-50)
Evan Carter attempts a 3Pt. Contested by Nikola Rose (3.4 feet, ZONE). EVAN CARTER MAKES IT! Assist: Dejounte Hyland
Score: 59-53

[09:16] Team_098 possession (Score: 59-53)
Malcolm Tatum attempts a Layup. Contested by Immanuel Middleton (5.1 feet, ZONE). MALCOLM TATUM MAKES IT! Assist: Derrick Durant
Score: 61-53

[09:04] Team_095 possession (Score: 61-53)
Evan Carter attempts a 3Pt. Contested by Blake Murray (4.7 feet, MAN). EVAN CARTER MAKES IT! Assist: Kyrie Ming
Score: 61-56

[08:50] Team_098 possession (Score: 61-56)
Malcolm Tatum drives and kicks out. Blake Murray attempts a 3Pt. Contested by Evan Carter (3.8 feet, MAN). Blake Murray misses. Rebound secured by Shaquille Ball.

[08:36] Team_095 possession (Score: 61-56)
Dejounte Hyland attempts a 3Pt. Contested by Nikola Rose (3.2 feet, ZONE). DEJOUNTE HYLAND MAKES IT!
Score: 61-59

[08:23] Team_098 possession (Score: 61-59)
Derrick Durant attempts a 3Pt. Contested by Evan Carter (4.0 feet, ZONE). Derrick Durant misses. Rebound secured by Shaquille Ball.

[08:08] Team_095 possession (Score: 61-59)
FOUL! Offensive foul on Shaquille Ball! Nikola Rose drew the charge! [Team fouls: 5] (Shaquille Ball: 2 personal fouls) TURNOVER! (dead ball)

[07:55] Team_098 possession (Score: 61-59)
FOUL! Shooting foul on Immanuel Middleton. Nikola Rose to the line for 2 free throws. [BONUS: 6 team fouls] (Immanuel Middleton: 2 personal fouls)   FT 1/2: GOOD   FT 2/2: GOOD Nikola Rose makes 2/2 from the line.
Score: 63-59

[07:41] Team_095 possession (Score: 63-59)
Shaquille Ball makes the Layup and draws the foul on Nikola Rose! And-1! Shaquille Ball to the line for 1. [Team fouls: 3] (Nikola Rose: 2 personal fouls)   FT 1/1: GOOD Shaquille Ball makes 1/1 from the line.
Score: 63-62

[07:26] Team_098 possession (Score: 63-62)
FOUL! Reach-in foul on Kyrie Ming during the drive. [IN THE BONUS! 7 team fouls] Derrick Durant to the line for 2 free throws. (Kyrie Ming: 1 personal fouls)   FT 1/2: MISS   FT 2/2: GOOD Derrick Durant makes 1/2 from the line.
Score: 64-62

[07:10] Team_095 possession (Score: 64-62)
Immanuel Middleton attempts a 3Pt. Contested by Pascal Lillard (4.0 feet, MAN). Immanuel Middleton misses. Rebound secured by Nikola Rose.

[06:57] Team_098 possession (Score: 64-62)
Derrick Durant drives and kicks out. Nikola Rose attempts a 3Pt. Contested by Shaquille Ball (4.3 feet, MAN). Nikola Rose misses. Rebound secured by Evan Carter.

[06:46] Team_095 possession (Score: 64-62)
Dejounte Hyland attempts a 3Pt. Contested by Nikola Rose (3.2 feet, ZONE). Dejounte Hyland misses. Rebound secured by Derrick Durant.

[06:30] Team_098 possession (Score: 64-62)
FOUL! Shooting foul on Immanuel Middleton. Malcolm Tatum to the line for 2 free throws. [BONUS: 8 team fouls] (Immanuel Middleton: 3 personal fouls)   FT 1/2: GOOD   FT 2/2: GOOD Malcolm Tatum makes 2/2 from the line.
Score: 66-62

[06:15] Team_095 possession (Score: 66-62)
Dejounte Hyland drives and kicks out. Immanuel Middleton attempts a 3Pt. Contested by Nikola Rose (3.2 feet, ZONE). Immanuel Middleton misses. FOUL! Loose ball foul on Derrick Durant during the rebound battle. [Team fouls: 4] No free throws, side out. (Derrick Durant: 1 personal fouls)

[06:00] Team_095 possession (Score: 66-62)
Dejounte Hyland attempts a 3Pt. Contested by Nikola Rose (3.2 feet, ZONE). Dejounte Hyland misses. Rebound secured by Derrick Durant.

[05:49] Team_098 possession (Score: 66-62)
Pascal Lillard attempts a Layup. Contested by Immanuel Middleton (5.4 feet, ZONE). PASCAL LILLARD MAKES IT!
Score: 68-62

[05:35] Team_095 possession (Score: 68-62)
Immanuel Middleton drives, picks up Pascal Lillard. Help arrives from Nikola Rose! Immanuel Middleton attempts a Layup. Contested by Nikola Rose (4.0 feet, ZONE). IMMANUEL MIDDLETON MAKES IT! Assist: Kyrie Ming
Score: 68-64

[05:19] Team_098 possession (Score: 68-64)
Pascal Lillard drives, Immanuel Middleton stays with him. Pascal Lillard attempts a Dunk. Contested by Immanuel Middleton (5.5 feet, ZONE). PASCAL LILLARD MAKES IT! Assist: Blake Murray
Score: 70-64

[05:03] Team_095 possession (Score: 70-64)
Immanuel Middleton drives, picks up Pascal Lillard. Help arrives from Nikola Rose! Immanuel Middleton attempts a Layup. Contested by Nikola Rose (4.0 feet, ZONE). IMMANUEL MIDDLETON MAKES IT!
Score: 70-66

[04:45] Team_098 possession (Score: 70-66)
Malcolm Tatum makes the Layup and draws the foul on Dejounte Hyland! And-1! Malcolm Tatum to the line for 1. [BONUS: 9 team fouls] (Dejounte Hyland: 2 personal fouls)   FT 1/1: GOOD Malcolm Tatum makes 1/1 from the line.
Score: 73-66

[04:29] Team_095 possession (Score: 73-66)
Dejounte Hyland attempts a 3Pt. Contested by Malcolm Tatum (4.0 feet, MAN). Dejounte Hyland misses. Rebound secured by Pascal Lillard.

[04:13] Team_098 possession (Score: 73-66)
Blake Murray attempts a 3Pt. Contested by Evan Carter (4.1 feet, ZONE). Blake Murray misses. Rebound secured by Dejounte Hyland.

[03:59] Team_095 possession (Score: 73-66)
Evan Carter drives and kicks out. Immanuel Middleton attempts a Midrange. BLOCKED BY MALCOLM TATUM! Ball is loose! Rebound secured by Nikola Rose.

[03:41] Team_098 possession (Score: 73-66)
Blake Murray attempts a 3Pt. Contested by Evan Carter (4.1 feet, MAN). Blake Murray misses. Rebound secured by Evan Carter.

[03:29] Team_095 possession (Score: 73-66)
Kyrie Ming attempts a Midrange. Contested by Derrick Durant (4.7 feet, MAN). KYRIE MING MAKES IT!
Score: 73-68

[03:13] Team_098 possession (Score: 73-68)
Blake Murray attempts a Midrange. Contested by Evan Carter (4.2 feet, MAN). Blake Murray misses. Rebound secured by Evan Carter.

[02:57] Team_095 possession (Score: 73-68)
Evan Carter attempts a 3Pt. Contested by Blake Murray (4.9 feet, MAN). Evan Carter misses. Offensive rebound by Dejounte Hyland! Dejounte Hyland kicks it out.

[02:41] Team_095 possession (Score: 73-68)
FOUL! Shooting foul on Nikola Rose. Evan Carter to the line for 2 free throws. [BONUS: 5 team fouls] (Nikola Rose: 3 personal fouls)   FT 1/2: GOOD   FT 2/2: GOOD Evan Carter makes 2/2 from the line.
Score: 73-70

[02:26] Team_098 possession (Score: 73-70)
FOUL! Shooting foul on Evan Carter. Pascal Lillard to the line for 3 free throws. [BONUS: 10 team fouls] (Evan Carter: 2 personal fouls)   FT 1/3: GOOD   FT 2/3: GOOD   FT 3/3: MISS Pascal Lillard makes 2/3 from the line. Offensive rebound by Pascal Lillard! Pascal Lillard kicks it out.
Score: 75-70

[02:10] Team_098 possession (Score: 75-70)
Nikola Rose drives and kicks out. Derrick Durant attempts a Midrange. Contested by Immanuel Middleton (5.2 feet, ZONE). DERRICK DURANT MAKES IT! Assist: Nikola Rose
Score: 77-70

[01:54] Team_095 possession (Score: 77-70)
Kyrie Ming drives, Pascal Lillard stays with him. Kyrie Ming attempts a Layup. Contested by Pascal Lillard (4.5 feet, ZONE). Kyrie Ming misses. Rebound secured by Derrick Durant.

[01:40] Team_098 possession (Score: 77-70)
Malcolm Tatum makes the Dunk and draws the foul on Immanuel Middleton! And-1! Malcolm Tatum to the line for 1. [BONUS: 11 team fouls] (Immanuel Middleton: 4 personal fouls)   FT 1/1: MISS Malcolm Tatum makes 0/1 from the line. FOUL! Loose ball foul on Shaquille Ball during the free throw rebound! [IN THE BONUS! 12 team fouls] Derrick Durant to the line for 2 free throws. (Shaquille Ball: 3 personal fouls)   FT 1/2: GOOD   FT 2/2: GOOD Derrick Durant makes 2/2 from the line.
Score: 81-70

[01:21] Team_095 possession (Score: 81-70)
Dejounte Hyland attempts a 3Pt. Contested by Nikola Rose (3.5 feet, ZONE). DEJOUNTE HYLAND MAKES IT! Assist: Shaquille Ball
Score: 81-73

[01:08] Team_098 possession (Score: 81-73)
Derrick Durant attempts a Midrange. Contested by Kyrie Ming (5.6 feet, MAN). DERRICK DURANT MAKES IT! Assist: Malcolm Tatum
Score: 83-73

[00:57] Team_095 possession (Score: 83-73)
Dejounte Hyland attempts a 3Pt. Contested by Nikola Rose (3.5 feet, ZONE). Dejounte Hyland misses. Rebound secured by Derrick Durant.

[00:44] Team_098 possession (Score: 83-73)
Derrick Durant attempts a Layup. BLOCKED BY KYRIE MING! Ball deflects out of bounds off Derrick Durant.

[00:30] Team_095 possession (Score: 83-73)
FOUL! Reach-in foul on Derrick Durant during the drive. [IN THE BONUS! 6 team fouls] Kyrie Ming to the line for 2 free throws. (Derrick Durant: 2 personal fouls)   FT 1/2: GOOD   FT 2/2: MISS Kyrie Ming makes 1/2 from the line. Offensive rebound by Dejounte Hyland! Dejounte Hyland kicks it out.
Score: 83-74

[00:14] Team_095 possession (Score: 83-74)
Kyrie Ming attempts a Midrange. Contested by Nikola Rose (3.8 feet, ZONE). Kyrie Ming misses. Offensive rebound by Evan Carter! Evan Carter's putback is no good. Rebound secured by Derrick Durant.

================================================================================
                              3RD QUARTER COMPLETE                              
================================================================================

3RD QUARTER SCORE: Team_098 33, Team_095 29

BOX SCORE:
================================================================================

Team_098
--------------------------------------------------------------------------------
Player                MIN  PTS  REB  AST  TO      FG   FG%      3P   3P%
--------------------------------------------------------------------------------
Pascal Lillard         27   10    3    1   0   4/4   100.0     0/0   0.0
Malcolm Tatum          27    7    0    1   0   3/4    75.0     0/0   0.0
Nikola Rose            27    4    3    1   0   2/3    66.7     0/0   0.0
Blake Murray           27    0    0    1   0   0/4     0.0     0/0   0.0

TEAM: FG: 13/22 (59.1%), 3PT: 0/3 (0.0%), REB: 11 (1 off, 10 def), AST: 5, TO: 0
TEAM FOULS: 6 [Team_095 in BONUS]


Team_095
--------------------------------------------------------------------------------
Player                MIN  PTS  REB  AST  TO      FG   FG%      3P   3P%
--------------------------------------------------------------------------------
Evan Carter            27   11    3    0   0   4/5    80.0     0/0   0.0
Derrick Durant         27    9    6    1   0   4/7    57.1     0/0   0.0
Dejounte Hyland        27    6    5    1   0   2/6    33.3     0/0   0.0
Immanuel Middleton     27    4    0    0   0   2/4    50.0     0/0   0.0
Shaquille Ball         27    3    3    1   0   1/2    50.0     0/0   0.0
Kyrie Ming             27    2    0    2   0   1/4    25.0     0/0   0.0

TEAM: FG: 10/21 (47.6%), 3PT: 4/10 (40.0%), REB: 12 (4 off, 8 def), AST: 4, TO: 1
TEAM FOULS: 12 [Team_098 in BONUS]

================================================================================

================================================================================
                       4TH QUARTER - Team_098 vs Team_095                       
================================================================================

[12:00] Team_098 possession (Score: 83-74)
Blake Murray attempts a Layup. Contested by Immanuel Middleton (5.3 feet, ZONE). BLAKE MURRAY MAKES IT! Assist: Malcolm Tatum
Score: 85-74

[11:48] Team_095 possession (Score: 85-74)
FOUL! Shooting foul on Nikola Rose. Shaquille Ball to the line for 2 free throws. [Team fouls: 1] (Nikola Rose: 1 personal fouls)   FT 1/2: GOOD   FT 2/2: MISS Shaquille Ball makes 1/2 from the line. FOUL! Loose ball foul on Derrick Durant during the free throw rebound! [Team fouls: 2] No free throws, side out. (Derrick Durant: 1 personal fouls)
Score: 85-75

[11:33] Team_095 possession (Score: 85-75)
Evan Carter attempts a Midrange. Contested by Blake Murray (5.1 feet, MAN). EVAN CARTER MAKES IT! Assist: Kyrie Ming
Score: 85-77

[11:21] Team_098 possession (Score: 85-77)
Blake Murray drives to the basket... Blake Murray loses control! Ball rolls out of bounds! TURNOVER! (dead ball)

[11:21] Substitution (Team_098): Malcolm Tatum OUT → Tracy Rose IN (stamina_rule2)

[11:21] Substitution (Team_098): Nikola Rose OUT → Dirk McCollum IN (stamina_rule2)

[11:21] Substitution (Team_098): Blake Murray OUT → Kristaps Iverson IN (stamina_rule2)

[11:21] Substitution (Team_098): Pascal Lillard OUT → Manu Jordan IN (stamina_rule2)

[11:21] Substitution (Team_098): Derrick Durant OUT → Russell McGrady IN (stamina_rule2)

[11:21] Substitution (Team_095): Dejounte Hyland OUT → Kyle Poole IN (stamina_rule2)

[11:21] Substitution (Team_095): Shaquille Ball OUT → Cade Beal IN (stamina_rule2)

[11:21] Substitution (Team_095): Evan Carter OUT → Tobias Wagner IN (stamina_rule2)

[11:21] Substitution (Team_095): Immanuel Middleton OUT → Gary Davis IN (stamina_rule2)

[11:21] Substitution (Team_095): Kyrie Ming OUT → DeMar McCollum IN (stamina_rule2)

[11:06] Team_095 possession (Score: 85-77)
DeMar McCollum drives and kicks out. DeMar McCollum attempts a Midrange. Contested by Dirk McCollum (4.2 feet, ZONE). DEMAR MCCOLLUM MAKES IT! Assist: Cade Beal
Score: 85-79

[10:52] Team_098 possession (Score: 85-79)
Dirk McCollum drives to the basket... Dirk McCollum throws a bad pass out of bounds! TURNOVER! (dead ball)

[10:36] Team_095 possession (Score: 85-79)
DeMar McCollum attempts a 3Pt. Contested by Dirk McCollum (4.8 feet, ZONE). DeMar McCollum misses. Rebound secured by Russell McGrady.

[10:23] Team_098 possession (Score: 85-79)
Tracy Rose attempts a Midrange. Contested by Gary Davis (5.5 feet, ZONE). Tracy Rose misses. FOUL! Loose ball foul on DeMar McCollum during the rebound battle. [Team fouls: 1] No free throws, side out. (DeMar McCollum: 1 personal fouls)

[10:11] Team_098 possession (Score: 85-79)
Tracy Rose attempts a Midrange. Contested by Tobias Wagner (3.8 feet, ZONE). Tracy Rose misses. FOUL! Loose ball foul on Tobias Wagner during the rebound battle. [Team fouls: 2] No free throws, side out. (Tobias Wagner: 1 personal fouls)

[09:55] Team_098 possession (Score: 85-79)
Russell McGrady attempts a Layup. Contested by DeMar McCollum (4.7 feet, ZONE). Russell McGrady misses. Rebound secured by Tobias Wagner.

[09:43] Team_095 possession (Score: 85-79)
Cade Beal drives and kicks out. Kyle Poole attempts a Midrange. Contested by Tracy Rose (3.2 feet, MAN). KYLE POOLE MAKES IT! Assist: DeMar McCollum
Score: 85-81

[09:27] Team_098 possession (Score: 85-81)
Russell McGrady attempts a 3Pt. Contested by DeMar McCollum (4.7 feet, MAN). RUSSELL MCGRADY MAKES IT! Assist: Kristaps Iverson
Score: 88-81

[09:16] Team_095 possession (Score: 88-81)
DeMar McCollum attempts a Layup. Contested by Russell McGrady (4.4 feet, ZONE). DEMAR MCCOLLUM MAKES IT! Assist: Gary Davis
Score: 88-83

[09:05] Team_098 possession (Score: 88-83)
Dirk McCollum attempts a Midrange. Contested by Gary Davis (5.6 feet, ZONE). Dirk McCollum misses. Rebound secured by DeMar McCollum.

[08:55] Team_095 possession (Score: 88-83)
Gary Davis attempts a 3Pt. Contested by Manu Jordan (4.5 feet, MAN). GARY DAVIS MAKES IT! Assist: DeMar McCollum
Score: 88-86

[08:40] Team_098 possession (Score: 88-86)
FOUL! Holding foul on DeMar McCollum. [Team fouls: 3] No free throws, side out. (DeMar McCollum: 2 personal fouls)

[08:23] Team_098 possession (Score: 88-86)
Kristaps Iverson drives and kicks out. Dirk McCollum attempts a 3Pt. Contested by Cade Beal (4.4 feet, MAN). Dirk McCollum misses. Rebound secured by DeMar McCollum.

[08:06] Team_095 possession (Score: 88-86)
Cade Beal attempts a 3Pt. Contested by Dirk McCollum (4.1 feet, ZONE). Cade Beal misses. Rebound secured by Kristaps Iverson.

[07:49] Team_098 possession (Score: 88-86)
Dirk McCollum makes the Layup and draws the foul on DeMar McCollum! And-1! Dirk McCollum to the line for 1. [Team fouls: 4] (DeMar McCollum: 3 personal fouls)   FT 1/1: GOOD Dirk McCollum makes 1/1 from the line.
Score: 91-86

[07:37] Team_095 possession (Score: 91-86)
Tobias Wagner attempts a 3Pt. Contested by Kristaps Iverson (4.3 feet, MAN). Tobias Wagner misses. Rebound secured by Kristaps Iverson.

[07:23] Team_098 possession (Score: 91-86)
Tracy Rose attempts a Layup. Contested by Kyle Poole (4.8 feet, MAN). TRACY ROSE MAKES IT! Assist: Russell McGrady
Score: 93-86

[07:06] Team_095 possession (Score: 93-86)
Gary Davis drives, Manu Jordan stays with him. Gary Davis attempts a Layup. Contested by Manu Jordan (4.5 feet, MAN). Gary Davis misses. Offensive rebound by DeMar McCollum! DeMar McCollum kicks it out.

[06:50] Team_095 possession (Score: 93-86)
FOUL! Holding foul on Dirk McCollum. [Team fouls: 3] No free throws, side out. (Dirk McCollum: 1 personal fouls)

[06:36] Team_095 possession (Score: 93-86)
Tobias Wagner attempts a Midrange. BLOCKED BY KRISTAPS IVERSON! Ball is loose! Rebound secured by Russell McGrady.

[06:18] Team_098 possession (Score: 93-86)
Russell McGrady attempts a Midrange. Contested by DeMar McCollum (4.7 feet, MAN). RUSSELL MCGRADY MAKES IT!
Score: 95-86

[06:03] Team_095 possession (Score: 95-86)
Tobias Wagner attempts a 3Pt. Contested by Dirk McCollum (4.5 feet, ZONE). TOBIAS WAGNER MAKES IT! Assist: Gary Davis
Score: 95-89

[05:48] Team_098 possession (Score: 95-89)
Russell McGrady drives, picks up DeMar McCollum. Help arrives from Kyle Poole! Russell McGrady attempts a Layup. Contested by Kyle Poole (4.7 feet, ZONE). RUSSELL MCGRADY MAKES IT! Assist: Kristaps Iverson
Score: 97-89

[05:37] Team_095 possession (Score: 97-89)
Gary Davis attempts a 3Pt. Contested by Manu Jordan (4.5 feet, MAN). GARY DAVIS MAKES IT! Assist: Cade Beal
Score: 97-92

[05:19] Team_098 possession (Score: 97-92)
Manu Jordan makes the Layup and draws the foul on DeMar McCollum! And-1! Manu Jordan to the line for 1. [BONUS: 5 team fouls] (DeMar McCollum: 4 personal fouls)   FT 1/1: GOOD Manu Jordan makes 1/1 from the line.
Score: 100-92

[05:04] Team_095 possession (Score: 100-92)
Gary Davis makes the Dunk and draws the foul on Manu Jordan! And-1! Gary Davis to the line for 1. [Team fouls: 4] (Manu Jordan: 1 personal fouls)   FT 1/1: GOOD Gary Davis makes 1/1 from the line.
Score: 100-95

[04:52] Team_098 possession (Score: 100-95)
FOUL! Reach-in foul on DeMar McCollum during the drive. [IN THE BONUS! 6 team fouls] Russell McGrady to the line for 2 free throws. (DeMar McCollum: 5 personal fouls)   FT 1/2: GOOD   FT 2/2: GOOD Russell McGrady makes 2/2 from the line.
Score: 102-95

[04:39] Team_095 possession (Score: 102-95)
DeMar McCollum makes the Dunk and draws the foul on Russell McGrady! And-1! DeMar McCollum to the line for 1. [BONUS: 5 team fouls] (Russell McGrady: 1 personal fouls)   FT 1/1: GOOD DeMar McCollum makes 1/1 from the line.
Score: 102-98

[04:25] Team_098 possession (Score: 102-98)
Tracy Rose attempts a 3Pt. Contested by Kyle Poole (4.8 feet, MAN). Tracy Rose misses. Rebound secured by DeMar McCollum.

[04:07] Team_095 possession (Score: 102-98)
Gary Davis attempts a Midrange. Contested by Tracy Rose (3.1 feet, ZONE). Gary Davis misses. Rebound secured by Kristaps Iverson.

[03:48] Team_098 possession (Score: 102-98)
Dirk McCollum attempts a Midrange. Contested by Cade Beal (4.5 feet, MAN). DIRK MCCOLLUM MAKES IT! Assist: Kristaps Iverson
Score: 104-98

[03:33] Team_095 possession (Score: 104-98)
Gary Davis attempts a 3Pt. Contested by Dirk McCollum (4.0 feet, ZONE). Gary Davis misses. Rebound secured by Russell McGrady.

[03:19] Team_098 possession (Score: 104-98)
Russell McGrady attempts a Layup. Contested by DeMar McCollum (4.9 feet, ZONE). RUSSELL MCGRADY MAKES IT! Assist: Manu Jordan
Score: 106-98

[03:06] Team_095 possession (Score: 106-98)
Kyle Poole attempts a 3Pt. Contested by Tracy Rose (3.7 feet, MAN). Kyle Poole misses. Rebound secured by Manu Jordan.

[02:51] Team_098 possession (Score: 106-98)
Dirk McCollum attempts a 3Pt. Contested by Cade Beal (4.6 feet, ZONE). Dirk McCollum misses. Rebound secured by Tobias Wagner.

[02:38] Team_095 possession (Score: 106-98)
Kyle Poole attempts a 3Pt. Contested by Tracy Rose (3.8 feet, MAN). KYLE POOLE MAKES IT! Assist: Gary Davis
Score: 106-101

[02:23] Team_098 possession (Score: 106-101)
FOUL! Reach-in foul on DeMar McCollum during the drive. [IN THE BONUS! 7 team fouls] Kristaps Iverson to the line for 2 free throws. (DeMar McCollum: 6 personal fouls) DeMar McCollum FOULS OUT!   FT 1/2: MISS   FT 2/2: MISS Kristaps Iverson makes 0/2 from the line. Rebound secured by DeMar McCollum.

[02:23] Substitution (Team_095): DeMar McCollum OUT (stamina: 71) → Dejounte Hyland IN (foul_out)

[02:09] Team_095 possession (Score: 106-101)
Gary Davis attempts a Midrange. Contested by Dirk McCollum (4.1 feet, ZONE). Gary Davis misses. Rebound secured by Russell McGrady.

[01:53] Team_098 possession (Score: 106-101)
Tracy Rose attempts a Midrange. Contested by Gary Davis (5.7 feet, ZONE). Tracy Rose misses. Rebound secured by Tobias Wagner.

[01:39] Team_095 possession (Score: 106-101)
Dejounte Hyland attempts a 3Pt. Contested by Dirk McCollum (4.4 feet, ZONE). DEJOUNTE HYLAND MAKES IT! Assist: Cade Beal
Score: 106-104

[01:20] Team_098 possession (Score: 106-104)
Manu Jordan attempts a 3Pt. Contested by Cade Beal (4.8 feet, ZONE). Manu Jordan misses. Rebound secured by Dejounte Hyland.

[01:06] Team_095 possession (Score: 106-104)
Dejounte Hyland attempts a 3Pt. BLOCKED BY DIRK MCCOLLUM! Ball is loose! Rebound secured by Russell McGrady.

[00:50] Team_098 possession (Score: 106-104)
Russell McGrady drives and kicks out. Russell McGrady attempts a 3Pt. Contested by Gary Davis (5.8 feet, MAN). Russell McGrady misses. Rebound secured by Tobias Wagner.

[00:31] Team_095 possession (Score: 106-104)
Tobias Wagner attempts a Layup. Contested by Kristaps Iverson (4.8 feet, MAN). TOBIAS WAGNER MAKES IT! Assist: Cade Beal
Score: 106-106

[00:12] Team_098 possession (Score: 106-106)
Kristaps Iverson attempts a 3Pt. Contested by Cade Beal (4.7 feet, ZONE). Kristaps Iverson misses. Offensive rebound by Kristaps Iverson! Kristaps Iverson kicks it out.

================================================================================
                              4TH QUARTER COMPLETE                              
================================================================================

4TH QUARTER SCORE: Team_098 23, Team_095 32

BOX SCORE:
================================================================================

Team_098
--------------------------------------------------------------------------------
Player                MIN  PTS  REB  AST  TO      FG   FG%      3P   3P%
--------------------------------------------------------------------------------
Russell McGrady        21   11    7    1   0   5/7    71.4     0/0   0.0
Dirk McCollum          21    5    0    0   0   2/4    50.0     0/0   0.0
Manu Jordan            21    3    1    1   0   1/2    50.0     0/0   0.0
Blake Murray           28    2    0    0   0   1/1   100.0     0/0   0.0
Tracy Rose             21    2    0    0   0   1/3    33.3     0/0   0.0
Malcolm Tatum          28    0    0    1   0   0/0     0.0     0/0   0.0
Kristaps Iverson       21    0    4    3   0   0/2     0.0     0/0   0.0

TEAM: FG: 10/19 (52.6%), 3PT: 1/4 (25.0%), REB: 12 (3 off, 9 def), AST: 6, TO: 2
TEAM FOULS: 5 [Team_095 in BONUS]


Team_095
--------------------------------------------------------------------------------
Player                MIN  PTS  REB  AST  TO      FG   FG%      3P   3P%
--------------------------------------------------------------------------------
Gary Davis             21    9    0    3   0   3/6    50.0     0/0   0.0
DeMar McCollum         19    7    5    2   0   3/4    75.0     0/0   0.0
Tobias Wagner          21    5    4    0   0   2/4    50.0     0/0   0.0
Kyle Poole             21    5    0    0   0   2/3    66.7     0/0   0.0
Dejounte Hyland        30    3    2    0   0   1/2    50.0     0/0   0.0
Evan Carter            28    2    0    0   0   1/1   100.0     0/0   0.0
Kyrie Ming             28    0    0    1   0   0/0     0.0     0/0   0.0
Cade Beal              21    0    0    4   0   0/1     0.0     0/0   0.0

TEAM: FG: 12/21 (57.1%), 3PT: 5/11 (45.5%), REB: 11 (2 off, 9 def), AST: 10, TO: 0
TEAM FOULS: 7 [Team_098 in BONUS]

================================================================================

================================================================================
                               FULL GAME COMPLETE                               
================================================================================

FINAL SCORE: Team_098 106, Team_095 106

SCORING BY QUARTER:
--------------------------------------------------------------------------------
Team                     Q1     Q2     Q3     Q4    FINAL
--------------------------------------------------------------------------------
Team_098                 30     20     33     23      106
Team_095                 25     20     29     32      106
--------------------------------------------------------------------------------

FULL GAME BOX SCORE:
================================================================================

Team_098
--------------------------------------------------------------------------------
Player                MIN  PTS  REB  AST  TO      FG   FG%      3P   3P%      FT STL BLK
--------------------------------------------------------------------------------
Malcolm Tatum          28   15    0    4   0   7/11   63.6   1/2    50.0   4/5     1   1
Nikola Rose            28    9    6    2   0   7/11   63.6   0/2     0.0   4/6     0   0
Blake Murray           28    6    0    2   0   3/11   27.3   0/4     0.0   1/2     0   0
Pascal Lillard         28   19   11    3   1   6/9    66.7   0/0     0.0   5/7     1   0
Derrick Durant         28   11    9    2   0   4/7    57.1   0/1     0.0   1/2     0   1
Tracy Rose             21    2    0    1   1   1/6    16.7   0/4     0.0   0/0     0   0
Dirk McCollum          21    7    0    0   1   3/5    60.0   0/1     0.0   2/3     0   1
Kristaps Iverson       21    8    9    4   0   3/6    50.0   1/2    50.0   1/3     0   1
Manu Jordan            21    5    5    3   1   2/5    40.0   0/2     0.0   1/1     0   0
Russell McGrady        21   18    8    1   1   8/12   66.7   1/1   100.0   3/3     0   0

TEAM: FG: 44/83 (53.0%), 3PT: 3/19 (15.8%), REB: 47 (10 off, 37 def), AST: 22, TO: 5


Team_095
--------------------------------------------------------------------------------
Player                MIN  PTS  REB  AST  TO      FG   FG%      3P   3P%      FT STL BLK
--------------------------------------------------------------------------------
Dejounte Hyland        30   19   15    4   2   7/15   46.7   3/10   30.0   2/2     0   1
Shaquille Ball         28    8    8    1   1   3/8    37.5   1/2    50.0   4/5     0   0
Evan Carter            28   20    6    0   1   8/11   72.7   2/4    50.0   6/6     0   0
Immanuel Middleton     28   10    0    0   1   4/7    57.1   1/4    25.0   3/4     0   0
Kyrie Ming             28    2    0    3   1   1/4    25.0   0/0     0.0   1/2     0   1
Kyle Poole             21   10    0    0   0   3/7    42.9   2/5    40.0   0/0     1   0
Cade Beal              21    6    0    4   0   3/6    50.0   2/4    50.0   0/0     0   0
Tobias Wagner          21    5    8    2   0   2/5    40.0   1/3    33.3   0/0     0   0
Gary Davis             21   12    3    3   0   4/9    44.4   2/3    66.7   4/5     0   0
DeMar McCollum         19    9    9    4   1   4/6    66.7   0/1     0.0   2/3     1   0

TEAM: FG: 40/79 (50.6%), 3PT: 14/36 (38.9%), REB: 50 (13 off, 37 def), AST: 21, TO: 7

================================================================================
