================================================================================
                        FULL GAME - Team_013 vs Team_064                        
================================================================================

================================================================================
                       1ST QUARTER - Team_013 vs Team_064                       
================================================================================

[12:00] Team_013 possession (Score: 0-0)
Nikola Curry attempts a Midrange. Contested by Shai Hyland (5.5 feet, ZONE). Nikola Curry misses. FOUL! Loose ball foul on Kawhi Irving during the rebound battle. [Team fouls: 1] No free throws, side out. (Kawhi Irving: 1 personal fouls)

[11:47] Team_013 possession (Score: 0-0)
Manu Smith attempts a 3Pt. Contested by Ja Mitchell (5.6 feet, ZONE). MANU SMITH MAKES IT! Assist: Desmond Ginobili
Score: 3-0

[11:36] Team_064 possession (Score: 3-0)
Ja Mitchell attempts a 3Pt. Contested by Manu Smith (5.0 feet, MAN). Ja Mitchell misses. Rebound secured by Pau Mobley.

[11:24] Team_013 possession (Score: 3-0)
Pau Mobley attempts a 3Pt. Contested by Ja Mitchell (5.1 feet, ZONE). Pau Mobley misses. Rebound secured by Shai Hyland.

[11:10] Team_064 possession (Score: 3-0)
Ja Mitchell attempts a 3Pt. Contested by Manu Smith (5.0 feet, MAN). Ja Mitchell misses. Offensive rebound by Russell Simons! Russell Simons kicks it out.

[10:55] Team_064 possession (Score: 3-0)
Shai Hyland attempts a Midrange. Contested by Pau Mobley (4.1 feet, ZONE). Shai Hyland misses. Rebound secured by Pau Mobley.

[10:41] Team_013 possession (Score: 3-0)
Desmond Ginobili drives, Russell Simons stays with him. Desmond Ginobili attempts a Layup. Contested by Russell Simons (3.5 feet, MAN). Desmond Ginobili misses. Rebound secured by Kawhi Irving.

[10:27] Team_064 possession (Score: 3-0)
Ja Mitchell makes the Midrange and draws the foul on Manu Smith! And-1! Ja Mitchell to the line for 1. [Team fouls: 1] (Manu Smith: 1 personal fouls)   FT 1/1: GOOD Ja Mitchell makes 1/1 from the line.
Score: 3-3

[10:15] Team_013 possession (Score: 3-3)
Manu Smith attempts a 3Pt. Contested by Ja Mitchell (5.6 feet, ZONE). Manu Smith misses. Rebound secured by Russell Simons.

[09:58] Team_064 possession (Score: 3-3)
Ja Mitchell attempts a 3Pt. Contested by Manu Smith (5.0 feet, MAN). Ja Mitchell misses. Offensive rebound by Kawhi Irving! Kawhi Irving kicks it out.

[09:39] Team_064 possession (Score: 3-3)
Jordan Mitchell attempts a Midrange. Contested by Pau Mobley (3.3 feet, ZONE). JORDAN MITCHELL MAKES IT! Assist: Ja Mitchell
Score: 3-5

[09:24] Team_013 possession (Score: 3-5)
Desmond Ginobili attempts a 3Pt. Contested by Russell Simons (3.5 feet, MAN). DESMOND GINOBILI MAKES IT! Assist: Nikola Curry
Score: 6-5

[09:13] Team_064 possession (Score: 6-5)
Russell Simons attempts a Layup. Contested by Desmond Ginobili (4.9 feet, ZONE). RUSSELL SIMONS MAKES IT! Assist: Shai Hyland
Score: 6-7

[08:58] Team_013 possession (Score: 6-7)
FOUL! Shooting foul on Russell Simons. Pau Mobley to the line for 2 free throws. [Team fouls: 2] (Russell Simons: 1 personal fouls)   FT 1/2: GOOD   FT 2/2: MISS Pau Mobley makes 1/2 from the line. Offensive rebound by Nikola Curry! Nikola Curry kicks it out.
Score: 7-7

[08:42] Team_013 possession (Score: 7-7)
Desmond Ginobili attempts a Layup. Contested by Russell Simons (3.5 feet, ZONE). DESMOND GINOBILI MAKES IT!
Score: 9-7

[08:28] Team_064 possession (Score: 9-7)
Shai Hyland drives to the basket... FOUL! Offensive foul on Shai Hyland! Desmond Ginobili drew the charge! [Team fouls: 3] (Shai Hyland: 1 personal fouls) TURNOVER! (dead ball)

[08:15] Team_013 possession (Score: 9-7)
Manu Smith drives to the basket... FOUL! Offensive foul on Manu Smith! Russell Simons drew the charge! [Team fouls: 2] (Manu Smith: 2 personal fouls) TURNOVER! (dead ball)

[08:00] Team_064 possession (Score: 9-7)
Ja Mitchell drives, Manu Smith stays with him. Ja Mitchell attempts a Layup. Contested by Manu Smith (5.0 feet, MAN). JA MITCHELL MAKES IT!
Score: 9-9

[07:45] Team_013 possession (Score: 9-9)
Jayson Morant attempts a 3Pt. Contested by Jordan Mitchell (4.1 feet, ZONE). Jayson Morant misses. Rebound secured by Russell Simons.

[07:31] Team_064 possession (Score: 9-9)
Ja Mitchell drives and kicks out. Ja Mitchell attempts a 3Pt. Contested by Pau Mobley (3.7 feet, ZONE). Ja Mitchell misses. Rebound secured by Desmond Ginobili.

[07:19] Team_013 possession (Score: 9-9)
Desmond Ginobili throws a bad pass! Stolen by Russell Simons! TURNOVER! (live ball)

[07:00] Team_064 possession (Score: 9-9)
FOUL! Offensive foul on Jordan Mitchell! Pau Mobley drew the charge! [Team fouls: 4] (Jordan Mitchell: 1 personal fouls) TURNOVER! (dead ball)

[06:47] Team_013 possession (Score: 9-9)
FOUL! Shooting foul on Kawhi Irving. Jayson Morant to the line for 2 free throws. [BONUS: 5 team fouls] (Kawhi Irving: 2 personal fouls)   FT 1/2: GOOD   FT 2/2: GOOD Jayson Morant makes 2/2 from the line.
Score: 11-9

[06:28] Team_064 possession (Score: 11-9)
Ja Mitchell attempts a Midrange. Contested by Manu Smith (5.0 feet, MAN). JA MITCHELL MAKES IT!
Score: 11-11

[06:13] Team_013 possession (Score: 11-11)
Nikola Curry makes the Midrange and draws the foul on Jordan Mitchell! And-1! Nikola Curry to the line for 1. [BONUS: 6 team fouls] (Jordan Mitchell: 2 personal fouls)   FT 1/1: GOOD Nikola Curry makes 1/1 from the line.
Score: 14-11

[05:59] Team_064 possession (Score: 14-11)
Jordan Mitchell attempts a Midrange. Contested by Pau Mobley (3.3 feet, MAN). JORDAN MITCHELL MAKES IT!
Score: 14-13

[05:48] Team_013 possession (Score: 14-13)
FOUL! Reach-in foul on Russell Simons during the drive. [IN THE BONUS! 7 team fouls] Pau Mobley to the line for 2 free throws. (Russell Simons: 2 personal fouls)   FT 1/2: GOOD   FT 2/2: GOOD Pau Mobley makes 2/2 from the line.
Score: 16-13

[05:30] Team_064 possession (Score: 16-13)
Ja Mitchell attempts a 3Pt. Contested by Pau Mobley (4.0 feet, ZONE). JA MITCHELL MAKES IT! Assist: Russell Simons
Score: 16-16

[05:19] Team_013 possession (Score: 16-16)
Nikola Curry drives to the basket... Nikola Curry throws a bad pass out of bounds! TURNOVER! (dead ball)

[05:03] Team_064 possession (Score: 16-16)
Ja Mitchell attempts a 3Pt. Contested by Pau Mobley (4.0 feet, ZONE). Ja Mitchell misses. Rebound secured by Desmond Ginobili.

[04:48] Team_013 possession (Score: 16-16)
Desmond Ginobili drives and kicks out. Nikola Curry attempts a 3Pt. Contested by Ja Mitchell (5.2 feet, ZONE). Nikola Curry misses. FOUL! Loose ball foul on Shai Hyland during the rebound battle. [IN THE BONUS! 8 team fouls] Desmond Ginobili to the line for 2 free throws. (Shai Hyland: 2 personal fouls)   FT 1/2: GOOD   FT 2/2: GOOD Desmond Ginobili makes 2/2 from the line.
Score: 18-16

[04:37] Team_064 possession (Score: 18-16)
Russell Simons attempts a Midrange. BLOCKED BY PAU MOBLEY! Ball is loose! Rebound secured by Nikola Curry.

[04:21] Team_013 possession (Score: 18-16)
FOUL! Holding foul on Shai Hyland. [IN THE BONUS! 9 team fouls] Nikola Curry to the line for 2 free throws. (Shai Hyland: 3 personal fouls)   FT 1/2: GOOD   FT 2/2: MISS Nikola Curry makes 1/2 from the line. Rebound secured by Shai Hyland.
Score: 19-16

[04:10] Team_064 possession (Score: 19-16)
Jordan Mitchell drives to the basket... Jordan Mitchell commits a violation (traveling/carry)! TURNOVER! (dead ball)

[03:55] Team_013 possession (Score: 19-16)
Nikola Curry drives and kicks out. Pau Mobley attempts a 3Pt. Contested by Jordan Mitchell (4.0 feet, MAN). PAU MOBLEY MAKES IT! Assist: Manu Smith
Score: 22-16

[03:42] Team_064 possession (Score: 22-16)
Jordan Mitchell attempts a Midrange. Contested by Desmond Ginobili (4.5 feet, ZONE). Jordan Mitchell misses. Rebound secured by Nikola Curry.

[03:29] Team_013 possession (Score: 22-16)
Manu Smith attempts a 3Pt. Contested by Ja Mitchell (5.8 feet, MAN). Manu Smith misses. Offensive rebound by Nikola Curry! Nikola Curry kicks it out.

[03:16] Team_013 possession (Score: 22-16)
Nikola Curry drives to the basket... Nikola Curry throws a bad pass! Stolen by Shai Hyland! TURNOVER! (live ball)

[03:04] Team_064 possession (Score: 22-16)
Ja Mitchell drives and kicks out. Ja Mitchell attempts a Midrange. Contested by Jayson Morant (4.3 feet, ZONE). JA MITCHELL MAKES IT! Assist: Shai Hyland
Score: 22-18

[02:50] Team_013 possession (Score: 22-18)
Jayson Morant attempts a Midrange. Contested by Kawhi Irving (4.8 feet, MAN). Jayson Morant misses. Offensive rebound by Desmond Ginobili! Desmond Ginobili kicks it out.

[02:32] Team_013 possession (Score: 22-18)
Manu Smith drives to the basket... Manu Smith loses control! Ball rolls out of bounds! TURNOVER! (dead ball)

[02:32] Substitution (Team_013): Pau Mobley OUT → Chris Bryant IN (stamina_rule2)

[02:32] Substitution (Team_013): Jayson Morant OUT → Vince Nowitzki IN (stamina_rule2)

[02:32] Substitution (Team_013): Desmond Ginobili OUT → Dirk Booker IN (stamina_rule2)

[02:32] Substitution (Team_013): Nikola Curry OUT → Jayson Nowitzki IN (stamina_rule2)

[02:32] Substitution (Team_064): Ja Mitchell OUT → CJ Haliburton IN (stamina_rule2)

[02:32] Substitution (Team_064): Jordan Mitchell OUT → Ja Simmons IN (stamina_rule2)

[02:32] Substitution (Team_064): Kawhi Irving OUT → Tobias Herro IN (stamina_rule2)

[02:32] Substitution (Team_064): Russell Simons OUT → Austin Smith IN (stamina_rule2)

[02:32] Substitution (Team_064): Shai Hyland OUT → Devin Cunningham IN (stamina_rule2)

[02:14] Team_064 possession (Score: 22-18)
Tobias Herro attempts a Layup. Contested by Vince Nowitzki (5.5 feet, MAN). TOBIAS HERRO MAKES IT! Assist: Devin Cunningham
Score: 22-20

[02:05] Team_013 possession (Score: 22-20)
Dirk Booker attempts a Midrange. Wide open! Tobias Herro is 6.2 feet away. [ZONE] DIRK BOOKER MAKES IT!
Score: 24-20

[01:49] Team_064 possession (Score: 24-20)
CJ Haliburton attempts a 3Pt. Contested by Chris Bryant (4.9 feet, ZONE). CJ Haliburton misses. Rebound secured by Dirk Booker.

[01:37] Team_013 possession (Score: 24-20)
Vince Nowitzki drives and kicks out. Chris Bryant attempts a 3Pt. Contested by Austin Smith (4.6 feet, ZONE). Chris Bryant misses. Rebound secured by Austin Smith.

[01:24] Team_064 possession (Score: 24-20)
FOUL! Holding foul on Manu Smith. [Team fouls: 3] No free throws, side out. (Manu Smith: 3 personal fouls)

[01:12] Team_064 possession (Score: 24-20)
Devin Cunningham attempts a 3Pt. Contested by Chris Bryant (4.5 feet, ZONE). Devin Cunningham misses. Rebound secured by Manu Smith.

[01:00] Team_013 possession (Score: 24-20)
Manu Smith attempts a Layup. Wide open! CJ Haliburton is 6.4 feet away. [MAN] MANU SMITH MAKES IT! Assist: Dirk Booker
Score: 26-20

[00:44] Team_064 possession (Score: 26-20)
Ja Simmons attempts a 3Pt. Contested by Chris Bryant (4.5 feet, MAN). JA SIMMONS MAKES IT! Assist: CJ Haliburton
Score: 26-23

[00:30] Team_013 possession (Score: 26-23)
Manu Smith attempts a Midrange. Wide open! CJ Haliburton is 6.4 feet away. [MAN] Manu Smith misses. Rebound secured by Austin Smith.

[00:15] Team_064 possession (Score: 26-23)
Tobias Herro attempts a 3Pt. Contested by Vince Nowitzki (5.5 feet, MAN). Tobias Herro misses. Offensive rebound by Ja Simmons! Ja Simmons kicks it out.

[00:05] Team_064 possession (Score: 26-23)
Austin Smith attempts a 3Pt. Contested by Chris Bryant (4.2 feet, ZONE). AUSTIN SMITH MAKES IT! Assist: Devin Cunningham
Score: 26-26

================================================================================
                              1ST QUARTER COMPLETE                              
================================================================================

1ST QUARTER SCORE: Team_013 26, Team_064 26

BOX SCORE:
================================================================================

Team_013
--------------------------------------------------------------------------------
Player                MIN  PTS  REB  AST  TO      FG   FG%      3P   3P%
--------------------------------------------------------------------------------
Desmond Ginobili       10    7    4    1   0   3/4    75.0     0/0   0.0
Manu Smith             12    5    1    1   0   2/4    50.0     0/0   0.0
Pau Mobley             10    5    2    0   0   2/3    66.7     0/0   0.0
Nikola Curry           10    3    4    1   0   1/1   100.0     0/0   0.0
Jayson Morant          10    2    0    0   0   1/2    50.0     0/0   0.0
Dirk Booker             2    2    1    1   0   1/1   100.0     0/0   0.0
Vince Nowitzki          2    0    0    0   0   0/1     0.0     0/0   0.0

TEAM: FG: 10/17 (58.8%), 3PT: 2/5 (40.0%), REB: 12 (4 off, 8 def), AST: 4, TO: 5
TEAM FOULS: 3


Team_064
--------------------------------------------------------------------------------
Player                MIN  PTS  REB  AST  TO      FG   FG%      3P   3P%
--------------------------------------------------------------------------------
Ja Mitchell            10   12    0    1   0   5/8    62.5     0/0   0.0
Jordan Mitchell        10    4    0    0   0   2/3    66.7     0/0   0.0
Austin Smith            2    3    2    0   0   1/1   100.0     0/0   0.0
Ja Simmons              2    3    1    0   0   1/1   100.0     0/0   0.0
Russell Simons         10    2    3    1   0   1/2    50.0     0/0   0.0
Tobias Herro            2    2    0    0   0   1/1   100.0     0/0   0.0
Shai Hyland            10    0    2    2   0   0/1     0.0     0/0   0.0
Kawhi Irving           10    0    2    0   0   0/0     0.0     0/0   0.0
Devin Cunningham        2    0    0    2   0   0/1     0.0     0/0   0.0
CJ Haliburton           2    0    0    1   0   0/1     0.0     0/0   0.0

TEAM: FG: 11/19 (57.9%), 3PT: 3/7 (42.9%), REB: 10 (3 off, 7 def), AST: 7, TO: 3
TEAM FOULS: 9 [Team_013 in BONUS]

================================================================================

================================================================================
                       2ND QUARTER - Team_013 vs Team_064                       
================================================================================

[12:00] Team_013 possession (Score: 26-26)
Manu Smith attempts a 3Pt. Contested by Ja Mitchell (5.6 feet, MAN). Manu Smith misses. Rebound secured by Kawhi Irving.

[11:44] Team_064 possession (Score: 26-26)
Kawhi Irving drives and kicks out. Russell Simons attempts a 3Pt. Contested by Pau Mobley (3.7 feet, ZONE). Russell Simons misses. Rebound secured by Desmond Ginobili.

[11:31] Team_013 possession (Score: 26-26)
Manu Smith attempts a 3Pt. Contested by Ja Mitchell (5.6 feet, ZONE). Manu Smith misses. FOUL! Loose ball foul on Shai Hyland during the rebound battle. [Team fouls: 1] No free throws, side out. (Shai Hyland: 1 personal fouls)

[11:12] Team_013 possession (Score: 26-26)
Jayson Morant attempts a Midrange. Contested by Jordan Mitchell (4.2 feet, ZONE). Jayson Morant misses. Rebound secured by Shai Hyland.

[11:00] Team_064 possession (Score: 26-26)
Ja Mitchell attempts a Midrange. Contested by Manu Smith (5.3 feet, MAN). Ja Mitchell misses. Rebound secured by Desmond Ginobili.

[10:48] Team_013 possession (Score: 26-26)
FOUL! Holding foul on Jordan Mitchell. [Team fouls: 2] No free throws, side out. (Jordan Mitchell: 1 personal fouls)

[10:34] Team_013 possession (Score: 26-26)
Jayson Morant makes the Dunk and draws the foul on Jordan Mitchell! And-1! Jayson Morant to the line for 1. [Team fouls: 3] (Jordan Mitchell: 2 personal fouls)   FT 1/1: GOOD Jayson Morant makes 1/1 from the line.
Score: 29-26

[10:22] Team_064 possession (Score: 29-26)
Shai Hyland attempts a Midrange. Contested by Nikola Curry (5.4 feet, MAN). Shai Hyland misses. Rebound secured by Pau Mobley.

[10:06] Team_013 possession (Score: 29-26)
Desmond Ginobili attempts a Midrange. Contested by Russell Simons (3.8 feet, MAN). Desmond Ginobili misses. Offensive rebound by Nikola Curry! Nikola Curry kicks it out.

[09:54] Team_013 possession (Score: 29-26)
Pau Mobley attempts a 3Pt. Contested by Jordan Mitchell (4.0 feet, MAN). Pau Mobley misses. Rebound secured by Russell Simons.

[09:44] Team_064 possession (Score: 29-26)
Kawhi Irving attempts a 3Pt. Contested by Jayson Morant (4.2 feet, MAN). Kawhi Irving misses. Rebound secured by Desmond Ginobili.

[09:30] Team_013 possession (Score: 29-26)
Manu Smith attempts a 3Pt. Contested by Ja Mitchell (5.8 feet, ZONE). MANU SMITH MAKES IT! Assist: Jayson Morant
Score: 32-26

[09:13] Team_064 possession (Score: 32-26)
Ja Mitchell attempts a 3Pt. Contested by Manu Smith (5.5 feet, MAN). Ja Mitchell misses. Rebound secured by Nikola Curry.

[09:02] Team_013 possession (Score: 32-26)
Jayson Morant attempts a 3Pt. Contested by Kawhi Irving (4.9 feet, MAN). Jayson Morant misses. Offensive rebound by Desmond Ginobili! Desmond Ginobili kicks it out.

[08:49] Team_013 possession (Score: 32-26)
Manu Smith attempts a 3Pt. Contested by Ja Mitchell (5.9 feet, MAN). Manu Smith misses. Rebound secured by Russell Simons.

[08:37] Team_064 possession (Score: 32-26)
FOUL! Holding foul on Desmond Ginobili. [Team fouls: 1] No free throws, side out. (Desmond Ginobili: 1 personal fouls)

[08:23] Team_064 possession (Score: 32-26)
Shai Hyland makes the Layup and draws the foul on Desmond Ginobili! And-1! Shai Hyland to the line for 1. [Team fouls: 2] (Desmond Ginobili: 2 personal fouls)   FT 1/1: MISS Shai Hyland makes 0/1 from the line. Rebound secured by Desmond Ginobili.
Score: 32-28

[08:13] Team_013 possession (Score: 32-28)
FOUL! Holding foul on Russell Simons. [Team fouls: 4] No free throws, side out. (Russell Simons: 1 personal fouls)

[08:01] Team_013 possession (Score: 32-28)
FOUL! Reach-in foul on Russell Simons during the drive. [IN THE BONUS! 5 team fouls] Desmond Ginobili to the line for 2 free throws. (Russell Simons: 2 personal fouls)   FT 1/2: GOOD   FT 2/2: GOOD Desmond Ginobili makes 2/2 from the line.
Score: 34-28

[07:45] Team_064 possession (Score: 34-28)
FOUL! Holding foul on Desmond Ginobili. [Team fouls: 3] No free throws, side out. (Desmond Ginobili: 3 personal fouls)

[07:26] Team_064 possession (Score: 34-28)
Ja Mitchell attempts a 3Pt. Contested by Pau Mobley (4.4 feet, ZONE). Ja Mitchell misses. Rebound secured by Nikola Curry.

[07:11] Team_013 possession (Score: 34-28)
Pau Mobley attempts a 3Pt. Contested by Ja Mitchell (5.6 feet, ZONE). Pau Mobley misses. Rebound secured by Russell Simons.

[06:56] Team_064 possession (Score: 34-28)
Ja Mitchell attempts a 3Pt. Contested by Manu Smith (5.7 feet, MAN). Ja Mitchell misses. Offensive rebound by Russell Simons! Russell Simons kicks it out.

[06:44] Team_064 possession (Score: 34-28)
Kawhi Irving attempts a Layup. Contested by Jayson Morant (4.5 feet, MAN). Kawhi Irving misses. Rebound secured by Nikola Curry.

[06:32] Team_013 possession (Score: 34-28)
Nikola Curry attempts a Layup. Contested by Russell Simons (4.5 feet, ZONE). NIKOLA CURRY MAKES IT! Assist: Jayson Morant
Score: 36-28

[06:20] Team_064 possession (Score: 36-28)
Jordan Mitchell attempts a 3Pt. Contested by Pau Mobley (4.0 feet, ZONE). Jordan Mitchell misses. Rebound secured by Pau Mobley.

[06:10] Team_013 possession (Score: 36-28)
Desmond Ginobili attempts a 3Pt. Contested by Russell Simons (4.4 feet, MAN). Desmond Ginobili misses. FOUL! Loose ball foul on Kawhi Irving during the rebound battle. [IN THE BONUS! 6 team fouls] Nikola Curry to the line for 2 free throws. (Kawhi Irving: 1 personal fouls)   FT 1/2: MISS   FT 2/2: GOOD Nikola Curry makes 1/2 from the line.
Score: 37-28

[05:55] Team_064 possession (Score: 37-28)
Ja Mitchell attempts a 3Pt. Contested by Manu Smith (5.9 feet, MAN). JA MITCHELL MAKES IT! Assist: Shai Hyland
Score: 37-31

[05:38] Team_013 possession (Score: 37-31)
Nikola Curry drives, Shai Hyland stays with him. Nikola Curry attempts a Dunk. Wide open! Shai Hyland is 6.2 feet away. [MAN] NIKOLA CURRY MAKES IT! Assist: Pau Mobley
Score: 39-31

[05:21] Team_064 possession (Score: 39-31)
Russell Simons throws a bad pass out of bounds! TURNOVER! (dead ball)

[05:21] Substitution (Team_013): Manu Smith OUT → Gary Iverson IN (stamina_rule2)

[05:21] Substitution (Team_013): Pau Mobley OUT → Chris Bryant IN (stamina_rule2)

[05:21] Substitution (Team_013): Jayson Morant OUT → Vince Nowitzki IN (stamina_rule2)

[05:21] Substitution (Team_013): Desmond Ginobili OUT → Dirk Booker IN (stamina_rule2)

[05:21] Substitution (Team_013): Nikola Curry OUT → Jayson Nowitzki IN (stamina_rule2)

[05:21] Substitution (Team_064): Ja Mitchell OUT → CJ Haliburton IN (stamina_rule2)

[05:21] Substitution (Team_064): Jordan Mitchell OUT → Ja Simmons IN (stamina_rule2)

[05:21] Substitution (Team_064): Kawhi Irving OUT → Tobias Herro IN (stamina_rule2)

[05:21] Substitution (Team_064): Russell Simons OUT → Austin Smith IN (stamina_rule2)

[05:21] Substitution (Team_064): Shai Hyland OUT → Devin Cunningham IN (stamina_rule2)

[05:03] Team_013 possession (Score: 39-31)
Chris Bryant drives and kicks out. Dirk Booker attempts a 3Pt. Contested by Austin Smith (4.6 feet, ZONE). DIRK BOOKER MAKES IT! Assist: Gary Iverson
Score: 42-31

[04:51] Team_064 possession (Score: 42-31)
FOUL! Offensive foul on Ja Simmons! Chris Bryant drew the charge! [Team fouls: 7] (Ja Simmons: 1 personal fouls) TURNOVER! (dead ball)

[04:34] Team_013 possession (Score: 42-31)
Vince Nowitzki attempts a 3Pt. Contested by Tobias Herro (5.8 feet, MAN). Vince Nowitzki misses. Rebound secured by Devin Cunningham.

[04:21] Team_064 possession (Score: 42-31)
Austin Smith attempts a Midrange. Contested by Gary Iverson (4.3 feet, ZONE). Austin Smith misses. Rebound secured by Dirk Booker.

[04:09] Team_013 possession (Score: 42-31)
Jayson Nowitzki attempts a Layup. Contested by Austin Smith (4.4 feet, ZONE). JAYSON NOWITZKI MAKES IT!
Score: 44-31

[03:57] Team_064 possession (Score: 44-31)
FOUL! Offensive foul on Austin Smith! Dirk Booker drew the charge! [Team fouls: 8] (Austin Smith: 1 personal fouls) TURNOVER! (dead ball)

[03:44] Team_013 possession (Score: 44-31)
FOUL! Reach-in foul on Tobias Herro during the drive. [IN THE BONUS! 9 team fouls] Vince Nowitzki to the line for 2 free throws. (Tobias Herro: 1 personal fouls)   FT 1/2: GOOD   FT 2/2: MISS Vince Nowitzki makes 1/2 from the line. Rebound secured by Ja Simmons.
Score: 45-31

[03:29] Team_064 possession (Score: 45-31)
Devin Cunningham makes the Layup and draws the foul on Dirk Booker! And-1! Devin Cunningham to the line for 1. [Team fouls: 4] (Dirk Booker: 1 personal fouls)   FT 1/1: GOOD Devin Cunningham makes 1/1 from the line.
Score: 45-34

[03:17] Team_013 possession (Score: 45-34)
Jayson Nowitzki attempts a Layup. Contested by Austin Smith (4.4 feet, ZONE). JAYSON NOWITZKI MAKES IT! Assist: Chris Bryant
Score: 47-34

[03:05] Team_064 possession (Score: 47-34)
Tobias Herro attempts a Midrange. Contested by Vince Nowitzki (5.5 feet, MAN). TOBIAS HERRO MAKES IT!
Score: 47-36

[02:54] Team_013 possession (Score: 47-36)
Chris Bryant attempts a 3Pt. Contested by Austin Smith (4.8 feet, ZONE). CHRIS BRYANT MAKES IT! Assist: Gary Iverson
Score: 50-36

[02:40] Team_064 possession (Score: 50-36)
Ja Simmons attempts a Midrange. Contested by Chris Bryant (4.5 feet, MAN). Ja Simmons misses. Rebound secured by Dirk Booker.

[02:28] Team_013 possession (Score: 50-36)
Chris Bryant attempts a 3Pt. Contested by Austin Smith (4.8 feet, ZONE). Chris Bryant misses. Rebound secured by Ja Simmons.

[02:11] Team_064 possession (Score: 50-36)
Austin Smith attempts a Layup. Wide open! Jayson Nowitzki is 6.3 feet away. [ZONE] AUSTIN SMITH MAKES IT!
Score: 50-38

[01:59] Team_013 possession (Score: 50-38)
FOUL! Shooting foul on Ja Simmons. Vince Nowitzki to the line for 2 free throws. [BONUS: 10 team fouls] (Ja Simmons: 2 personal fouls)   FT 1/2: GOOD   FT 2/2: GOOD Vince Nowitzki makes 2/2 from the line.
Score: 52-38

[01:44] Team_064 possession (Score: 52-38)
Devin Cunningham attempts a 3Pt. Contested by Dirk Booker (5.3 feet, MAN). DEVIN CUNNINGHAM MAKES IT! Assist: Ja Simmons
Score: 52-41

[01:26] Team_013 possession (Score: 52-41)
Dirk Booker loses the ball! Stripped by Austin Smith! TURNOVER! (live ball)

[01:09] Team_064 possession (Score: 52-41)
Ja Simmons makes the Midrange and draws the foul on Chris Bryant! And-1! Ja Simmons to the line for 1. [BONUS: 5 team fouls] (Chris Bryant: 1 personal fouls)   FT 1/1: GOOD Ja Simmons makes 1/1 from the line.
Score: 52-44

[00:51] Team_013 possession (Score: 52-44)
Chris Bryant drives, Austin Smith stays with him. Chris Bryant attempts a Layup. Contested by Austin Smith (4.8 feet, ZONE). Chris Bryant misses. Rebound secured by Devin Cunningham.

[00:36] Team_064 possession (Score: 52-44)
Tobias Herro drives, Jayson Nowitzki stays with him. Tobias Herro attempts a Dunk. Wide open! Jayson Nowitzki is 6.2 feet away. [ZONE] TOBIAS HERRO MAKES IT! Assist: Devin Cunningham
Score: 52-46

[00:25] Team_013 possession (Score: 52-46)
Jayson Nowitzki attempts a Midrange. Contested by Devin Cunningham (5.1 feet, MAN). JAYSON NOWITZKI MAKES IT!
Score: 54-46

[00:11] Team_064 possession (Score: 54-46)
FOUL! Shooting foul on Vince Nowitzki. Tobias Herro to the line for 3 free throws. [BONUS: 6 team fouls] (Vince Nowitzki: 1 personal fouls)   FT 1/3: GOOD   FT 2/3: GOOD   FT 3/3: GOOD Tobias Herro makes 3/3 from the line.
Score: 54-49

================================================================================
                              2ND QUARTER COMPLETE                              
================================================================================

2ND QUARTER SCORE: Team_013 28, Team_064 23

BOX SCORE:
================================================================================

Team_013
--------------------------------------------------------------------------------
Player                MIN  PTS  REB  AST  TO      FG   FG%      3P   3P%
--------------------------------------------------------------------------------
Jayson Nowitzki         8    6    0    0   0   3/3   100.0     0/0   0.0
Nikola Curry           17    5    4    0   0   3/3   100.0     0/0   0.0
Manu Smith             19    3    0    0   0   1/3    33.3     0/0   0.0
Jayson Morant          17    3    0    2   0   1/2    50.0     0/0   0.0
Dirk Booker             8    3    2    0   0   1/1   100.0     0/0   0.0
Chris Bryant            8    3    0    1   0   1/3    33.3     0/0   0.0
Desmond Ginobili       17    2    6    0   0   1/1   100.0     0/0   0.0
Vince Nowitzki          8    2    0    0   0   1/3    33.3     0/0   0.0
Pau Mobley             17    0    2    1   0   0/2     0.0     0/0   0.0
Gary Iverson            5    0    0    2   0   0/0     0.0     0/0   0.0

TEAM: FG: 12/21 (57.1%), 3PT: 3/9 (33.3%), REB: 14 (3 off, 11 def), AST: 6, TO: 1
TEAM FOULS: 6 [Team_064 in BONUS]


Team_064
--------------------------------------------------------------------------------
Player                MIN  PTS  REB  AST  TO      FG   FG%      3P   3P%
--------------------------------------------------------------------------------
Tobias Herro            8    7    0    0   0   3/3   100.0     0/0   0.0
Devin Cunningham        8    6    2    1   0   2/2   100.0     0/0   0.0
Ja Mitchell            17    3    0    0   0   1/4    25.0     0/0   0.0
Ja Simmons              8    3    2    1   0   1/2    50.0     0/0   0.0
Austin Smith            8    2    0    0   0   1/2    50.0     0/0   0.0
Kawhi Irving           17    0    1    0   0   0/3     0.0     0/0   0.0
Shai Hyland            17    0    1    1   0   0/2     0.0     0/0   0.0
Russell Simons         17    0    4    0   0   0/0     0.0     0/0   0.0
Jordan Mitchell        17    0    0    0   0   0/1     0.0     0/0   0.0

TEAM: FG: 8/19 (42.1%), 3PT: 3/7 (42.9%), REB: 10 (1 off, 9 def), AST: 3, TO: 3
TEAM FOULS: 10 [Team_013 in BONUS]

================================================================================

================================================================================
                       3RD QUARTER - Team_013 vs Team_064                       
================================================================================

[12:00] Team_013 possession (Score: 54-49)
Manu Smith attempts a 3Pt. Contested by Ja Mitchell (5.6 feet, MAN). Manu Smith misses. Rebound secured by Russell Simons.

[11:48] Team_064 possession (Score: 54-49)
Jordan Mitchell attempts a 3Pt. Contested by Pau Mobley (3.3 feet, ZONE). JORDAN MITCHELL MAKES IT! Assist: Shai Hyland
Score: 54-52

[11:34] Team_013 possession (Score: 54-52)
Manu Smith attempts a Layup. Contested by Russell Simons (3.7 feet, ZONE). MANU SMITH MAKES IT! Assist: Desmond Ginobili
Score: 56-52

[11:18] Team_064 possession (Score: 56-52)
Shai Hyland drives to the basket... Shai Hyland loses control! Ball rolls out of bounds! TURNOVER! (dead ball)

[11:08] Team_013 possession (Score: 56-52)
Jayson Morant attempts a 3Pt. Contested by Ja Mitchell (5.5 feet, ZONE). JAYSON MORANT MAKES IT! Assist: Manu Smith
Score: 59-52

[10:53] Team_064 possession (Score: 59-52)
Jordan Mitchell attempts a 3Pt. Contested by Jayson Morant (3.6 feet, ZONE). Jordan Mitchell misses. Offensive rebound by Russell Simons! Russell Simons kicks it out.

[10:36] Team_064 possession (Score: 59-52)
FOUL! Shooting foul on Jayson Morant. Shai Hyland to the line for 2 free throws. [Team fouls: 1] (Jayson Morant: 1 personal fouls)   FT 1/2: GOOD   FT 2/2: GOOD Shai Hyland makes 2/2 from the line.
Score: 59-54

[10:22] Team_013 possession (Score: 59-54)
Pau Mobley drives, picks up Jordan Mitchell. Help arrives from Kawhi Irving! Pau Mobley attempts a Layup. Contested by Kawhi Irving (3.8 feet, MAN). PAU MOBLEY MAKES IT! Assist: Manu Smith
Score: 61-54

[10:12] Team_064 possession (Score: 61-54)
FOUL! Reach-in foul on Nikola Curry during the drive. [Team fouls: 2] No free throws, side out. (Nikola Curry: 1 personal fouls)

[09:59] Team_064 possession (Score: 61-54)
Ja Mitchell attempts a 3Pt. Contested by Manu Smith (5.0 feet, MAN). JA MITCHELL MAKES IT! Assist: Jordan Mitchell
Score: 61-57

[09:41] Team_013 possession (Score: 61-57)
Jayson Morant attempts a 3Pt. Contested by Ja Mitchell (5.5 feet, ZONE). Jayson Morant misses. Rebound secured by Russell Simons.

[09:21] Team_064 possession (Score: 61-57)
FOUL! Reach-in foul on Desmond Ginobili during the drive. [Team fouls: 3] No free throws, side out. (Desmond Ginobili: 1 personal fouls)

[09:10] Team_064 possession (Score: 61-57)
Russell Simons attempts a Midrange. Contested by Desmond Ginobili (4.9 feet, MAN). Russell Simons misses. Offensive rebound by Kawhi Irving! Kawhi Irving kicks it out.

[08:58] Team_064 possession (Score: 61-57)
Jordan Mitchell attempts a Layup. BLOCKED BY DESMOND GINOBILI! Ball is loose! Offensive rebound by Russell Simons! Russell Simons kicks it out.

[08:43] Team_064 possession (Score: 61-57)
Russell Simons attempts a Midrange. Contested by Nikola Curry (5.1 feet, ZONE). Russell Simons misses. Rebound secured by Nikola Curry.

[08:27] Team_013 possession (Score: 61-57)
Manu Smith drives to the basket... FOUL! Offensive foul on Manu Smith! Ja Mitchell drew the charge! [Team fouls: 4] (Manu Smith: 1 personal fouls) TURNOVER! (dead ball)

[08:13] Team_064 possession (Score: 61-57)
FOUL! Offensive foul on Ja Mitchell! Manu Smith drew the charge! [Team fouls: 1] (Ja Mitchell: 1 personal fouls) TURNOVER! (dead ball)

[07:58] Team_013 possession (Score: 61-57)
Pau Mobley attempts a 3Pt. Contested by Jordan Mitchell (3.8 feet, MAN). Pau Mobley misses. Rebound secured by Kawhi Irving.

[07:44] Team_064 possession (Score: 61-57)
Jordan Mitchell attempts a 3Pt. Contested by Pau Mobley (3.3 feet, MAN). Jordan Mitchell misses. Offensive rebound by Kawhi Irving! Kawhi Irving kicks it out.

[07:29] Team_064 possession (Score: 61-57)
Kawhi Irving attempts a Layup. BLOCKED BY PAU MOBLEY! Ball is loose! Rebound secured by Desmond Ginobili.

[07:16] Team_013 possession (Score: 61-57)
Pau Mobley attempts a 3Pt. Contested by Jordan Mitchell (3.8 feet, MAN). Pau Mobley misses. Rebound secured by Russell Simons.

[07:01] Team_064 possession (Score: 61-57)
Ja Mitchell attempts a 3Pt. Contested by Pau Mobley (4.0 feet, ZONE). Ja Mitchell misses. Rebound secured by Pau Mobley.

[06:47] Team_013 possession (Score: 61-57)
Manu Smith attempts a 3Pt. Contested by Ja Mitchell (5.6 feet, MAN). MANU SMITH MAKES IT! Assist: Desmond Ginobili
Score: 64-57

[06:33] Team_064 possession (Score: 64-57)
Shai Hyland attempts a Layup. BLOCKED BY NIKOLA CURRY! Ball is loose! Rebound secured by Desmond Ginobili.

[06:17] Team_013 possession (Score: 64-57)
FOUL! Reach-in foul on Kawhi Irving during the drive. [Team fouls: 2] No free throws, side out. (Kawhi Irving: 1 personal fouls)

[06:02] Team_013 possession (Score: 64-57)
Pau Mobley makes the Midrange and draws the foul on Jordan Mitchell! And-1! Pau Mobley to the line for 1. [Team fouls: 3] (Jordan Mitchell: 1 personal fouls)   FT 1/1: GOOD Pau Mobley makes 1/1 from the line.
Score: 67-57

[05:47] Team_064 possession (Score: 67-57)
Shai Hyland attempts a Midrange. Contested by Nikola Curry (5.3 feet, MAN). SHAI HYLAND MAKES IT!
Score: 67-59

[05:29] Team_013 possession (Score: 67-59)
Jayson Morant attempts a 3Pt. Contested by Kawhi Irving (4.6 feet, MAN). Jayson Morant misses. Rebound secured by Shai Hyland.

[05:17] Team_064 possession (Score: 67-59)
Kawhi Irving drives to the basket... FOUL! Offensive foul on Kawhi Irving! Desmond Ginobili drew the charge! [Team fouls: 4] (Kawhi Irving: 2 personal fouls) TURNOVER! (dead ball)

[05:04] Team_013 possession (Score: 67-59)
Desmond Ginobili drives, picks up Russell Simons. Help arrives from Jordan Mitchell! Desmond Ginobili attempts a Layup. Contested by Jordan Mitchell (3.6 feet, ZONE). Desmond Ginobili misses. Rebound secured by Shai Hyland.

[04:49] Team_064 possession (Score: 67-59)
Russell Simons attempts a 3Pt. Contested by Desmond Ginobili (5.0 feet, ZONE). RUSSELL SIMONS MAKES IT! Assist: Jordan Mitchell
Score: 67-62

[04:35] Team_013 possession (Score: 67-62)
Desmond Ginobili attempts a 3Pt. Contested by Ja Mitchell (5.5 feet, ZONE). DESMOND GINOBILI MAKES IT! Assist: Nikola Curry
Score: 70-62

[04:23] Team_064 possession (Score: 70-62)
Shai Hyland attempts a Midrange. Contested by Nikola Curry (5.4 feet, MAN). Shai Hyland misses. Rebound secured by Nikola Curry.

[04:09] Team_013 possession (Score: 70-62)
FOUL! Reach-in foul on Russell Simons during the drive. [IN THE BONUS! 5 team fouls] Jayson Morant to the line for 2 free throws. (Russell Simons: 1 personal fouls)   FT 1/2: GOOD   FT 2/2: GOOD Jayson Morant makes 2/2 from the line.
Score: 72-62

[03:50] Team_064 possession (Score: 72-62)
Shai Hyland throws a bad pass out of bounds! TURNOVER! (dead ball)

[03:40] Team_013 possession (Score: 72-62)
Manu Smith makes the Midrange and draws the foul on Jordan Mitchell! And-1! Manu Smith to the line for 1. [BONUS: 6 team fouls] (Jordan Mitchell: 2 personal fouls)   FT 1/1: MISS Manu Smith makes 0/1 from the line. Rebound secured by Russell Simons.
Score: 74-62

[03:25] Team_064 possession (Score: 74-62)
Ja Mitchell attempts a 3Pt. Contested by Pau Mobley (4.1 feet, ZONE). Ja Mitchell misses. Rebound secured by Desmond Ginobili.

[03:11] Team_013 possession (Score: 74-62)
Nikola Curry drives and kicks out. Pau Mobley attempts a 3Pt. Contested by Jordan Mitchell (4.1 feet, MAN). PAU MOBLEY MAKES IT! Assist: Jayson Morant
Score: 77-62

[02:55] Team_064 possession (Score: 77-62)
Jordan Mitchell drives to the basket... Jordan Mitchell throws a bad pass! Stolen by Desmond Ginobili! TURNOVER! (live ball)

[02:41] Team_013 possession (Score: 77-62)
Desmond Ginobili attempts a Midrange. Contested by Russell Simons (3.9 feet, ZONE). Desmond Ginobili misses. Rebound secured by Shai Hyland.

[02:22] Team_064 possession (Score: 77-62)
Russell Simons attempts a 3Pt. Contested by Pau Mobley (4.1 feet, ZONE). Russell Simons misses. Rebound secured by Pau Mobley.

[02:09] Team_013 possession (Score: 77-62)
Desmond Ginobili loses control! Ball rolls out of bounds! TURNOVER! (dead ball)

[02:09] Substitution (Team_013): Pau Mobley OUT → Chris Bryant IN (stamina_rule2)

[02:09] Substitution (Team_013): Jayson Morant OUT → Vince Nowitzki IN (stamina_rule2)

[02:09] Substitution (Team_013): Desmond Ginobili OUT → Dirk Booker IN (stamina_rule2)

[02:09] Substitution (Team_013): Nikola Curry OUT → Jayson Nowitzki IN (stamina_rule2)

[02:09] Substitution (Team_064): Ja Mitchell OUT → CJ Haliburton IN (stamina_rule2)

[02:09] Substitution (Team_064): Jordan Mitchell OUT → Ja Simmons IN (stamina_rule2)

[02:09] Substitution (Team_064): Kawhi Irving OUT → Tobias Herro IN (stamina_rule2)

[02:09] Substitution (Team_064): Russell Simons OUT → Austin Smith IN (stamina_rule2)

[02:09] Substitution (Team_064): Shai Hyland OUT → Devin Cunningham IN (stamina_rule2)

[01:56] Team_064 possession (Score: 77-62)
FOUL! Reach-in foul on Manu Smith during the drive. [IN THE BONUS! 5 team fouls] CJ Haliburton to the line for 2 free throws. (Manu Smith: 2 personal fouls)   FT 1/2: GOOD   FT 2/2: MISS CJ Haliburton makes 1/2 from the line. Rebound secured by Manu Smith.
Score: 77-63

[01:38] Team_013 possession (Score: 77-63)
FOUL! Reach-in foul on Tobias Herro during the drive. [IN THE BONUS! 7 team fouls] Vince Nowitzki to the line for 2 free throws. (Tobias Herro: 1 personal fouls)   FT 1/2: GOOD   FT 2/2: GOOD Vince Nowitzki makes 2/2 from the line.
Score: 79-63

[01:28] Team_064 possession (Score: 79-63)
Tobias Herro attempts a 3Pt. Contested by Vince Nowitzki (5.5 feet, MAN). Tobias Herro misses. Rebound secured by Jayson Nowitzki.

[01:16] Team_013 possession (Score: 79-63)
Jayson Nowitzki drives to the basket... Jayson Nowitzki throws a bad pass! Stolen by Austin Smith! TURNOVER! (live ball)

[00:59] Team_064 possession (Score: 79-63)
Devin Cunningham attempts a Midrange. Contested by Dirk Booker (5.3 feet, MAN). DEVIN CUNNINGHAM MAKES IT!
Score: 79-65

[00:44] Team_013 possession (Score: 79-65)
Manu Smith attempts a 3Pt. Wide open! CJ Haliburton is 6.4 feet away. [MAN] Manu Smith misses. Rebound secured by Devin Cunningham.

[00:28] Team_064 possession (Score: 79-65)
Austin Smith attempts a Layup. Contested by Dirk Booker (5.0 feet, MAN). AUSTIN SMITH MAKES IT! Assist: Tobias Herro
Score: 79-67

[00:11] Team_013 possession (Score: 79-67)
FOUL! Shooting foul on Austin Smith. Chris Bryant to the line for 2 free throws. [BONUS: 8 team fouls] (Austin Smith: 1 personal fouls)   FT 1/2: MISS   FT 2/2: GOOD Chris Bryant makes 1/2 from the line.
Score: 80-67

================================================================================
                              3RD QUARTER COMPLETE                              
================================================================================

3RD QUARTER SCORE: Team_013 26, Team_064 18

BOX SCORE:
================================================================================

Team_013
--------------------------------------------------------------------------------
Player                MIN  PTS  REB  AST  TO      FG   FG%      3P   3P%
--------------------------------------------------------------------------------
Pau Mobley             27    8    2    0   0   3/5    60.0     0/0   0.0
Manu Smith             31    5    1    2   0   2/5    40.0     0/0   0.0
Jayson Morant          27    5    0    1   0   2/4    50.0     0/0   0.0
Desmond Ginobili       27    3    3    2   0   1/3    33.3     0/0   0.0
Vince Nowitzki         10    2    0    0   0   1/1   100.0     0/0   0.0
Chris Bryant           10    1    0    0   0   1/1   100.0     0/0   0.0
Nikola Curry           27    0    2    1   0   0/0     0.0     0/0   0.0
Jayson Nowitzki        10    0    1    0   0   0/0     0.0     0/0   0.0

TEAM: FG: 10/19 (52.6%), 3PT: 3/9 (33.3%), REB: 9 (0 off, 9 def), AST: 6, TO: 3
TEAM FOULS: 5 [Team_064 in BONUS]


Team_064
--------------------------------------------------------------------------------
Player                MIN  PTS  REB  AST  TO      FG   FG%      3P   3P%
--------------------------------------------------------------------------------
Shai Hyland            27    4    3    1   0   2/4    50.0     0/0   0.0
Russell Simons         27    3    6    0   0   1/3    33.3     0/0   0.0
Jordan Mitchell        27    3    0    2   0   1/1   100.0     0/0   0.0
Ja Mitchell            27    3    0    0   0   1/3    33.3     0/0   0.0
Devin Cunningham       10    2    1    0   0   1/1   100.0     0/0   0.0
Austin Smith           10    2    0    0   0   1/1   100.0     0/0   0.0
Kawhi Irving           27    0    3    0   0   0/1     0.0     0/0   0.0
CJ Haliburton          10    0    0    0   0   0/1     0.0     0/0   0.0
Tobias Herro           10    0    0    1   0   0/1     0.0     0/0   0.0

TEAM: FG: 7/16 (43.8%), 3PT: 3/7 (42.9%), REB: 13 (4 off, 9 def), AST: 4, TO: 5
TEAM FOULS: 8 [Team_013 in BONUS]

================================================================================

================================================================================
                       4TH QUARTER - Team_013 vs Team_064                       
================================================================================

[12:00] Team_013 possession (Score: 80-67)
Desmond Ginobili attempts a Layup. BLOCKED BY JORDAN MITCHELL! Ball is loose! Rebound secured by Kawhi Irving.

[11:45] Team_064 possession (Score: 80-67)
Kawhi Irving attempts a 3Pt. Contested by Jayson Morant (4.0 feet, MAN). KAWHI IRVING MAKES IT! Assist: Shai Hyland
Score: 80-70

[11:26] Team_013 possession (Score: 80-70)
Nikola Curry attempts a Midrange. Contested by Shai Hyland (5.6 feet, MAN). Nikola Curry misses. Offensive rebound by Nikola Curry! Nikola Curry kicks it out.

[11:10] Team_013 possession (Score: 80-70)
Manu Smith attempts a Layup. Contested by Ja Mitchell (5.7 feet, MAN). Manu Smith misses. Rebound secured by Shai Hyland.

[10:56] Team_064 possession (Score: 80-70)
Jordan Mitchell attempts a 3Pt. Contested by Pau Mobley (3.4 feet, MAN). Jordan Mitchell misses. Rebound secured by Desmond Ginobili.

[10:42] Team_013 possession (Score: 80-70)
Pau Mobley attempts a 3Pt. Contested by Ja Mitchell (5.3 feet, ZONE). Pau Mobley misses. Rebound secured by Kawhi Irving.

[10:28] Team_064 possession (Score: 80-70)
Jordan Mitchell loses control! Ball rolls out of bounds! TURNOVER! (dead ball)

[10:28] Substitution (Team_013): Manu Smith OUT → Gary Iverson IN (stamina_rule2)

[10:17] Team_013 possession (Score: 80-70)
Nikola Curry drives to the basket... Nikola Curry throws a bad pass out of bounds! TURNOVER! (dead ball)

[10:17] Substitution (Team_064): Russell Simons OUT → Austin Smith IN (stamina_rule2)

[10:17] Substitution (Team_064): Shai Hyland OUT → Devin Cunningham IN (stamina_rule2)

[10:03] Team_064 possession (Score: 80-70)
Jordan Mitchell drives and kicks out. Austin Smith attempts a 3Pt. Contested by Desmond Ginobili (5.0 feet, MAN). Austin Smith misses. Offensive rebound by Kawhi Irving! Kawhi Irving kicks it out.

[09:49] Team_064 possession (Score: 80-70)
Devin Cunningham drives, picks up Desmond Ginobili. Help arrives from Pau Mobley! Devin Cunningham attempts a Dunk. Contested by Pau Mobley (4.9 feet, ZONE). Devin Cunningham misses. Offensive rebound by Austin Smith! Austin Smith kicks it out.

[09:39] Team_064 possession (Score: 80-70)
Devin Cunningham drives to the basket... Devin Cunningham throws a bad pass out of bounds! TURNOVER! (dead ball)

[09:39] Substitution (Team_013): Pau Mobley OUT → Chris Bryant IN (stamina_rule2)

[09:39] Substitution (Team_013): Jayson Morant OUT → Vince Nowitzki IN (stamina_rule2)

[09:39] Substitution (Team_013): Desmond Ginobili OUT → Dirk Booker IN (stamina_rule2)

[09:39] Substitution (Team_013): Nikola Curry OUT → Jayson Nowitzki IN (stamina_rule2)

[09:39] Substitution (Team_064): Ja Mitchell OUT → CJ Haliburton IN (stamina_rule2)

[09:39] Substitution (Team_064): Jordan Mitchell OUT → Ja Simmons IN (stamina_rule2)

[09:24] Team_013 possession (Score: 80-70)
FOUL! Reach-in foul on Austin Smith during the drive. [Team fouls: 1] No free throws, side out. (Austin Smith: 1 personal fouls)

[09:12] Team_013 possession (Score: 80-70)
Gary Iverson attempts a Midrange. Contested by CJ Haliburton (5.8 feet, MAN). GARY IVERSON MAKES IT!
Score: 82-70

[08:56] Team_064 possession (Score: 82-70)
Kawhi Irving attempts a Layup. Contested by Vince Nowitzki (5.9 feet, MAN). KAWHI IRVING MAKES IT!
Score: 82-72

[08:43] Team_013 possession (Score: 82-72)
Dirk Booker attempts a Layup. Contested by Austin Smith (4.8 feet, MAN). DIRK BOOKER MAKES IT! Assist: Gary Iverson
Score: 84-72

[08:33] Team_064 possession (Score: 84-72)
Devin Cunningham drives, picks up Jayson Nowitzki. Help arrives from Gary Iverson! Devin Cunningham attempts a Dunk. Wide open! Gary Iverson is 6.5 feet away. [ZONE] Devin Cunningham misses. Offensive rebound by Austin Smith! Austin Smith kicks it out.

[08:17] Team_064 possession (Score: 84-72)
Austin Smith makes the Layup and draws the foul on Dirk Booker! And-1! Austin Smith to the line for 1. [Team fouls: 1] (Dirk Booker: 1 personal fouls)   FT 1/1: GOOD Austin Smith makes 1/1 from the line.
Score: 84-75

[08:04] Team_013 possession (Score: 84-75)
Gary Iverson loses control! Ball rolls out of bounds! TURNOVER! (dead ball)

[08:04] Substitution (Team_064): Kawhi Irving OUT → Tobias Herro IN (stamina_rule2)

[07:54] Team_064 possession (Score: 84-75)
Ja Simmons attempts a Midrange. Contested by Dirk Booker (5.3 feet, ZONE). Ja Simmons misses. Rebound secured by Chris Bryant.

[07:34] Team_013 possession (Score: 84-75)
Vince Nowitzki loses control! Ball rolls out of bounds! TURNOVER! (dead ball)

[07:23] Team_064 possession (Score: 84-75)
Devin Cunningham loses the ball! Stripped by Dirk Booker! TURNOVER! (live ball)

[07:09] Team_013 possession (Score: 84-75)
Jayson Nowitzki drives, Austin Smith stays with him. Jayson Nowitzki attempts a Dunk. Contested by Austin Smith (4.4 feet, ZONE). JAYSON NOWITZKI MAKES IT! Assist: Chris Bryant
Score: 86-75

[06:56] Team_064 possession (Score: 86-75)
Austin Smith throws a bad pass out of bounds! TURNOVER! (dead ball)

[06:43] Team_013 possession (Score: 86-75)
Gary Iverson drives, CJ Haliburton stays with him. Gary Iverson attempts a Dunk. Contested by CJ Haliburton (5.8 feet, MAN). GARY IVERSON MAKES IT! Assist: Jayson Nowitzki
Score: 88-75

[06:28] Team_064 possession (Score: 88-75)
CJ Haliburton attempts a 3Pt. Contested by Chris Bryant (4.9 feet, ZONE). CJ Haliburton misses. Rebound secured by Chris Bryant.

[06:14] Team_013 possession (Score: 88-75)
FOUL! Reach-in foul on Austin Smith during the drive. [Team fouls: 2] No free throws, side out. (Austin Smith: 2 personal fouls)

[05:58] Team_013 possession (Score: 88-75)
Dirk Booker attempts a 3Pt. Contested by Austin Smith (4.8 feet, MAN). Dirk Booker misses. Rebound secured by Austin Smith.

[05:40] Team_064 possession (Score: 88-75)
FOUL! Shooting foul on Dirk Booker. Devin Cunningham to the line for 3 free throws. [Team fouls: 2] (Dirk Booker: 2 personal fouls)   FT 1/3: GOOD   FT 2/3: GOOD   FT 3/3: GOOD Devin Cunningham makes 3/3 from the line.
Score: 88-78

[05:28] Team_013 possession (Score: 88-78)
Jayson Nowitzki drives, Devin Cunningham stays with him. Jayson Nowitzki attempts a Dunk. Contested by Devin Cunningham (5.1 feet, MAN). Jayson Nowitzki misses. Rebound secured by Devin Cunningham.

[05:11] Team_064 possession (Score: 88-78)
CJ Haliburton drives and kicks out. CJ Haliburton attempts a 3Pt. Contested by Gary Iverson (4.7 feet, MAN). CJ Haliburton misses. Rebound secured by Dirk Booker.

[05:00] Team_013 possession (Score: 88-78)
Vince Nowitzki attempts a 3Pt. Contested by Tobias Herro (5.8 feet, MAN). Vince Nowitzki misses. Rebound secured by Ja Simmons.

[04:42] Team_064 possession (Score: 88-78)
FOUL! Shooting foul on Dirk Booker. Austin Smith to the line for 2 free throws. [Team fouls: 3] (Dirk Booker: 3 personal fouls)   FT 1/2: GOOD   FT 2/2: MISS Austin Smith makes 1/2 from the line. Rebound secured by Jayson Nowitzki.
Score: 88-79

[04:27] Team_013 possession (Score: 88-79)
Gary Iverson attempts a Layup. Contested by CJ Haliburton (5.8 feet, MAN). GARY IVERSON MAKES IT! Assist: Chris Bryant
Score: 90-79

[04:11] Team_064 possession (Score: 90-79)
Austin Smith attempts a 3Pt. Contested by Dirk Booker (5.0 feet, MAN). AUSTIN SMITH MAKES IT! Assist: Devin Cunningham
Score: 90-82

[03:55] Team_013 possession (Score: 90-82)
Chris Bryant attempts a Midrange. Contested by Ja Simmons (5.9 feet, MAN). CHRIS BRYANT MAKES IT!
Score: 92-82

[03:42] Team_064 possession (Score: 92-82)
Austin Smith attempts a 3Pt. Contested by Dirk Booker (5.1 feet, MAN). Austin Smith misses. Offensive rebound by Austin Smith! Austin Smith kicks it out.

[03:26] Team_064 possession (Score: 92-82)
Devin Cunningham drives, picks up Jayson Nowitzki. Help arrives from Gary Iverson! Devin Cunningham attempts a Dunk. Wide open! Gary Iverson is 6.5 feet away. [ZONE] Devin Cunningham misses. Rebound secured by Chris Bryant.

[03:15] Team_013 possession (Score: 92-82)
Gary Iverson attempts a Layup. Contested by CJ Haliburton (5.9 feet, MAN). GARY IVERSON MAKES IT! Assist: Chris Bryant
Score: 94-82

[03:05] Team_064 possession (Score: 94-82)
CJ Haliburton attempts a Midrange. Contested by Gary Iverson (5.1 feet, MAN). CJ HALIBURTON MAKES IT! Assist: Ja Simmons
Score: 94-84

[02:46] Team_013 possession (Score: 94-84)
Jayson Nowitzki attempts a Layup. BLOCKED BY DEVIN CUNNINGHAM! Ball deflects out of bounds off Jayson Nowitzki.

[02:33] Team_064 possession (Score: 94-84)
Devin Cunningham drives, picks up Jayson Nowitzki. Help arrives from Gary Iverson! Devin Cunningham attempts a Dunk. Wide open! Gary Iverson is 6.6 feet away. [ZONE] Devin Cunningham misses. FOUL! Loose ball foul on Chris Bryant during the rebound battle. [Team fouls: 4] No free throws, side out. (Chris Bryant: 1 personal fouls)

[02:18] Team_064 possession (Score: 94-84)
CJ Haliburton attempts a 3Pt. Contested by Chris Bryant (5.0 feet, ZONE). CJ Haliburton misses. Rebound secured by Jayson Nowitzki.

[02:06] Team_013 possession (Score: 94-84)
FOUL! Shooting foul on Austin Smith. Vince Nowitzki to the line for 3 free throws. [Team fouls: 3] (Austin Smith: 3 personal fouls)   FT 1/3: MISS   FT 2/3: MISS   FT 3/3: GOOD Vince Nowitzki makes 1/3 from the line.
Score: 95-84

[01:49] Team_064 possession (Score: 95-84)
Devin Cunningham drives, picks up Jayson Nowitzki. Help arrives from Gary Iverson! Devin Cunningham attempts a Dunk. Wide open! Gary Iverson is 6.6 feet away. [ZONE] Devin Cunningham misses. Rebound secured by Jayson Nowitzki.

[01:31] Team_013 possession (Score: 95-84)
Dirk Booker attempts a Midrange. Wide open! Ja Simmons is 6.0 feet away. [ZONE] DIRK BOOKER MAKES IT!
Score: 97-84

[01:20] Team_064 possession (Score: 97-84)
Devin Cunningham drives, Jayson Nowitzki stays with him. Devin Cunningham attempts a Layup. Wide open! Jayson Nowitzki is 6.7 feet away. [ZONE] DEVIN CUNNINGHAM MAKES IT!
Score: 97-86

[01:04] Team_013 possession (Score: 97-86)
Jayson Nowitzki attempts a Midrange. Contested by Devin Cunningham (5.4 feet, MAN). Jayson Nowitzki misses. Rebound secured by Austin Smith.

[00:54] Team_064 possession (Score: 97-86)
Ja Simmons loses control! Ball rolls out of bounds! TURNOVER! (dead ball)

[00:41] Team_013 possession (Score: 97-86)
Jayson Nowitzki makes the Layup and draws the foul on Devin Cunningham! And-1! Jayson Nowitzki to the line for 1. [Team fouls: 4] (Devin Cunningham: 1 personal fouls)   FT 1/1: MISS Jayson Nowitzki makes 0/1 from the line. Rebound secured by Austin Smith.
Score: 99-86

[00:25] Team_064 possession (Score: 99-86)
Austin Smith drives, picks up Jayson Nowitzki. Help arrives from Gary Iverson! Austin Smith attempts a Layup. Wide open! Gary Iverson is 6.5 feet away. [ZONE] Austin Smith misses. Rebound secured by Jayson Nowitzki.

[00:12] Team_013 possession (Score: 99-86)
Vince Nowitzki loses control! Ball rolls out of bounds! TURNOVER! (dead ball)

[00:01] Team_064 possession (Score: 99-86)
Austin Smith attempts a 3Pt. Contested by Dirk Booker (5.4 feet, MAN). Austin Smith misses. Rebound secured by Jayson Nowitzki.

================================================================================
                              4TH QUARTER COMPLETE                              
================================================================================

4TH QUARTER SCORE: Team_013 19, Team_064 19

BOX SCORE:
================================================================================

Team_013
--------------------------------------------------------------------------------
Player                MIN  PTS  REB  AST  TO      FG   FG%      3P   3P%
--------------------------------------------------------------------------------
Gary Iverson           16    8    0    1   0   4/4   100.0     0/0   0.0
Dirk Booker            19    4    1    0   0   2/3    66.7     0/0   0.0
Chris Bryant           19    2    3    3   0   1/1   100.0     0/0   0.0
Jayson Nowitzki        19    2    5    1   0   1/5    20.0     0/0   0.0
Vince Nowitzki         19    1    0    0   0   1/2    50.0     0/0   0.0
Desmond Ginobili       29    0    1    0   0   0/1     0.0     0/0   0.0
Nikola Curry           29    0    1    0   0   0/0     0.0     0/0   0.0
Manu Smith             33    0    0    0   0   0/1     0.0     0/0   0.0
Pau Mobley             29    0    0    0   0   0/1     0.0     0/0   0.0

TEAM: FG: 9/18 (50.0%), 3PT: 1/4 (25.0%), REB: 11 (1 off, 10 def), AST: 5, TO: 4
TEAM FOULS: 4


Team_064
--------------------------------------------------------------------------------
Player                MIN  PTS  REB  AST  TO      FG   FG%      3P   3P%
--------------------------------------------------------------------------------
Austin Smith           20    6    7    0   0   2/5    40.0     0/0   0.0
Kawhi Irving           31    5    3    0   0   2/2   100.0     0/0   0.0
Devin Cunningham       20    5    1    1   0   2/4    50.0     0/0   0.0
CJ Haliburton          19    2    0    0   0   1/4    25.0     0/0   0.0
Shai Hyland            29    0    1    1   0   0/0     0.0     0/0   0.0
Jordan Mitchell        29    0    0    0   0   0/1     0.0     0/0   0.0
Ja Simmons             19    0    1    1   0   0/1     0.0     0/0   0.0

TEAM: FG: 7/17 (41.2%), 3PT: 3/7 (42.9%), REB: 13 (5 off, 8 def), AST: 3, TO: 5
TEAM FOULS: 4

================================================================================

================================================================================
                               FULL GAME COMPLETE                               
================================================================================

FINAL SCORE: Team_013 99, Team_064 86

SCORING BY QUARTER:
--------------------------------------------------------------------------------
Team                     Q1     Q2     Q3     Q4    FINAL
--------------------------------------------------------------------------------
Team_013                 26     28     26     19       99
Team_064                 26     23     18     19       86
--------------------------------------------------------------------------------

FULL GAME BOX SCORE:
================================================================================

Team_013
--------------------------------------------------------------------------------
Player                MIN  PTS  REB  AST  TO      FG   FG%      3P   3P%      FT STL BLK
--------------------------------------------------------------------------------
Manu Smith             33   13    2    3   2   5/13   38.5   3/8    37.5   0/1     0   0
Pau Mobley             29   13    6    1   1   3/9    33.3   0/6     0.0   4/5     0   2
Jayson Morant          29   10    0    3   2   4/8    50.0   1/4    25.0   5/5     0   0
Desmond Ginobili       29   12   14    3   4   6/10   60.0   3/3   100.0   4/4     1   1
Nikola Curry           29    8   11    2   0   5/5   100.0   0/0     0.0   3/5     0   1
Chris Bryant           19    6    3    4   0   4/6    66.7   1/2    50.0   1/2     0   0
Vince Nowitzki         19    5    0    0   2   3/7    42.9   1/3    33.3   6/9     0   0
Dirk Booker            19    9    4    1   1   3/4    75.0   0/1     0.0   0/0     1   0
Jayson Nowitzki        19    8    6    1   0   4/8    50.0   0/0     0.0   0/1     0   0
Gary Iverson           16    8    0    3   1   4/4   100.0   0/0     0.0   0/0     0   0

TEAM: FG: 41/75 (54.7%), 3PT: 9/27 (33.3%), REB: 46 (8 off, 38 def), AST: 21, TO: 13


Team_064
--------------------------------------------------------------------------------
Player                MIN  PTS  REB  AST  TO      FG   FG%      3P   3P%      FT STL BLK
--------------------------------------------------------------------------------
Kawhi Irving           31    5    9    0   0   2/6    33.3   1/2    50.0   0/0     0   0
Ja Mitchell            29   18    0    1   2   7/15   46.7   3/9    33.3   1/1     0   0
Jordan Mitchell        29    7    0    2   4   3/6    50.0   1/3    33.3   0/0     0   1
Russell Simons         29    5   13    1   3   2/5    40.0   1/2    50.0   0/0     1   0
Shai Hyland            29    4    7    5   1   2/7    28.6   0/0     0.0   2/3     1   0
Austin Smith           20   13    9    0   2   5/9    55.6   2/3    66.7   2/3     2   0
Devin Cunningham       20   13    4    4   2   5/8    62.5   2/3    66.7   4/4     0   1
CJ Haliburton          19    2    0    1   0   1/6    16.7   0/3     0.0   1/2     0   0
Ja Simmons             19    6    4    2   2   2/4    50.0   1/1   100.0   1/1     0   0
Tobias Herro           18    9    0    1   0   4/5    80.0   1/2    50.0   3/3     0   0

TEAM: FG: 33/71 (46.5%), 3PT: 12/28 (42.9%), REB: 46 (13 off, 33 def), AST: 17, TO: 16

================================================================================
