================================================================================
                        FULL GAME - Team_063 vs Team_080                        
================================================================================

================================================================================
                       1ST QUARTER - Team_063 vs Team_080                       
================================================================================

[12:00] Team_063 possession (Score: 0-0)
Terry Reaves attempts a 3Pt. Contested by Khris Turner (4.9 feet, ZONE). Terry Reaves misses. Rebound secured by Draymond Simons.

[11:47] Team_080 possession (Score: 0-0)
Larry Paul drives and kicks out. Larry Paul attempts a 3Pt. Contested by Malcolm Quickley (3.5 feet, ZONE). Larry Paul misses. Rebound secured by Tyler Harris.

[11:34] Team_063 possession (Score: 0-0)
Malcolm Quickley drives, Draymond Simons stays with him. Malcolm Quickley attempts a Dunk. Contested by Draymond Simons (3.7 feet, ZONE). Malcolm Quickley misses. Rebound secured by Draymond Simons.

[11:19] Team_080 possession (Score: 0-0)
Khris Turner attempts a 3Pt. Contested by Bradley Davis (5.1 feet, ZONE). Khris Turner misses. Rebound secured by Dirk Reaves.

[11:06] Team_063 possession (Score: 0-0)
Terry Reaves attempts a Midrange. BLOCKED BY KHRIS TURNER! Ball is loose! Rebound secured by Larry Paul.

[10:53] Team_080 possession (Score: 0-0)
Lauri Dosunmu attempts a Layup. Contested by Tyler Harris (5.2 feet, ZONE). LAURI DOSUNMU MAKES IT!
Score: 0-2

[10:40] Team_063 possession (Score: 0-2)
Dirk Reaves drives to the basket... Dirk Reaves loses the ball! Stripped by Jaren Morant! TURNOVER! (live ball)

[10:25] Team_080 possession (Score: 0-2)
FOUL! Shooting foul on Malcolm Quickley. Jaren Morant to the line for 2 free throws. [Team fouls: 1] (Malcolm Quickley: 1 personal fouls)   FT 1/2: GOOD   FT 2/2: GOOD Jaren Morant makes 2/2 from the line.
Score: 0-4

[10:12] Team_063 possession (Score: 0-4)
Bradley Davis attempts a Midrange. Contested by Khris Turner (4.8 feet, ZONE). Bradley Davis misses. Rebound secured by Jaren Morant.

[10:00] Team_080 possession (Score: 0-4)
FOUL! Holding foul on Bradley Davis. [Team fouls: 2] No free throws, side out. (Bradley Davis: 1 personal fouls)

[09:46] Team_080 possession (Score: 0-4)
Khris Turner makes the Layup and draws the foul on Dirk Reaves! And-1! Khris Turner to the line for 1. [Team fouls: 3] (Dirk Reaves: 1 personal fouls)   FT 1/1: GOOD Khris Turner makes 1/1 from the line.
Score: 0-7

[09:31] Team_063 possession (Score: 0-7)
Dirk Reaves attempts a 3Pt. Contested by Lauri Dosunmu (4.3 feet, ZONE). DIRK REAVES MAKES IT! Assist: Bradley Davis
Score: 3-7

[09:11] Team_080 possession (Score: 3-7)
Lauri Dosunmu makes the Layup and draws the foul on Malcolm Quickley! And-1! Lauri Dosunmu to the line for 1. [Team fouls: 4] (Malcolm Quickley: 2 personal fouls)   FT 1/1: GOOD Lauri Dosunmu makes 1/1 from the line.
Score: 3-10

[08:54] Team_063 possession (Score: 3-10)
Malcolm Quickley attempts a 3Pt. Contested by Khris Turner (4.4 feet, MAN). MALCOLM QUICKLEY MAKES IT! Assist: Dirk Reaves
Score: 6-10

[08:40] Team_080 possession (Score: 6-10)
Lauri Dosunmu attempts a 3Pt. Contested by Malcolm Quickley (4.4 feet, ZONE). Lauri Dosunmu misses. Offensive rebound by Draymond Simons! Draymond Simons puts it back in!
Score: 6-12

[08:27] Team_063 possession (Score: 6-12)
Bradley Davis attempts a 3Pt. Contested by Lauri Dosunmu (4.3 feet, MAN). Bradley Davis misses. Rebound secured by Larry Paul.

[08:11] Team_080 possession (Score: 6-12)
Lauri Dosunmu attempts a 3Pt. Contested by Bradley Davis (5.7 feet, MAN). Lauri Dosunmu misses. Rebound secured by Malcolm Quickley.

[07:59] Team_063 possession (Score: 6-12)
Tyler Harris attempts a Midrange. Contested by Draymond Simons (3.8 feet, MAN). Tyler Harris misses. Rebound secured by Draymond Simons.

[07:46] Team_080 possession (Score: 6-12)
Jaren Morant attempts a Midrange. Contested by Dirk Reaves (4.1 feet, ZONE). JAREN MORANT MAKES IT! Assist: Larry Paul
Score: 6-14

[07:34] Team_063 possession (Score: 6-14)
Malcolm Quickley drives, picks up Khris Turner. Help arrives from Larry Paul! Malcolm Quickley attempts a Layup. Contested by Larry Paul (4.4 feet, MAN). MALCOLM QUICKLEY MAKES IT!
Score: 8-14

[07:18] Team_080 possession (Score: 8-14)
Draymond Simons drives, picks up Tyler Harris. Help arrives from Malcolm Quickley! Draymond Simons attempts a Dunk. Contested by Malcolm Quickley (4.6 feet, MAN). DRAYMOND SIMONS MAKES IT! Assist: Jaren Morant
Score: 8-16

[07:05] Team_063 possession (Score: 8-16)
Tyler Harris attempts a Midrange. Contested by Khris Turner (4.5 feet, ZONE). TYLER HARRIS MAKES IT!
Score: 10-16

[06:49] Team_080 possession (Score: 10-16)
Draymond Simons attempts a Layup. Contested by Tyler Harris (4.6 feet, ZONE). DRAYMOND SIMONS MAKES IT!
Score: 10-18

[06:33] Team_063 possession (Score: 10-18)
Dirk Reaves attempts a 3Pt. Contested by Lauri Dosunmu (4.3 feet, ZONE). Dirk Reaves misses. Rebound secured by Larry Paul.

[06:19] Team_080 possession (Score: 10-18)
Lauri Dosunmu attempts a Layup. BLOCKED BY TYLER HARRIS! Ball deflects out of bounds off Lauri Dosunmu.

[06:05] Team_063 possession (Score: 10-18)
Dirk Reaves attempts a Layup. Contested by Draymond Simons (4.1 feet, ZONE). Dirk Reaves misses. Rebound secured by Draymond Simons.

[05:51] Team_080 possession (Score: 10-18)
Khris Turner attempts a 3Pt. Contested by Malcolm Quickley (3.7 feet, ZONE). Khris Turner misses. Rebound secured by Malcolm Quickley.

[05:41] Team_063 possession (Score: 10-18)
FOUL! Reach-in foul on Draymond Simons during the drive. [Team fouls: 1] No free throws, side out. (Draymond Simons: 1 personal fouls)

[05:27] Team_063 possession (Score: 10-18)
Tyler Harris attempts a Dunk. BLOCKED BY JAREN MORANT! Ball is loose! Rebound secured by Jaren Morant.

[05:13] Team_080 possession (Score: 10-18)
Larry Paul attempts a Midrange. Contested by Malcolm Quickley (3.9 feet, ZONE). Larry Paul misses. Rebound secured by Tyler Harris.

[04:56] Team_063 possession (Score: 10-18)
Terry Reaves attempts a Layup. Contested by Jaren Morant (4.1 feet, ZONE). TERRY REAVES MAKES IT!
Score: 12-18

[04:43] Team_080 possession (Score: 12-18)
FOUL! Shooting foul on Terry Reaves. Larry Paul to the line for 3 free throws. [BONUS: 5 team fouls] (Terry Reaves: 1 personal fouls)   FT 1/3: GOOD   FT 2/3: GOOD   FT 3/3: GOOD Larry Paul makes 3/3 from the line.
Score: 12-21

[04:32] Team_063 possession (Score: 12-21)
Bradley Davis attempts a Layup. Contested by Lauri Dosunmu (4.3 feet, MAN). Bradley Davis misses. Rebound secured by Draymond Simons.

[04:22] Team_080 possession (Score: 12-21)
Draymond Simons attempts a 3Pt. Contested by Malcolm Quickley (3.8 feet, ZONE). Draymond Simons misses. Rebound secured by Tyler Harris.

[04:11] Team_063 possession (Score: 12-21)
Bradley Davis drives and kicks out. Tyler Harris attempts a 3Pt. Contested by Draymond Simons (4.1 feet, MAN). Tyler Harris misses. Rebound secured by Draymond Simons.

[03:54] Team_080 possession (Score: 12-21)
Larry Paul attempts a 3Pt. Contested by Terry Reaves (5.1 feet, MAN). Larry Paul misses. Rebound secured by Malcolm Quickley.

[03:38] Team_063 possession (Score: 12-21)
Bradley Davis attempts a 3Pt. Contested by Lauri Dosunmu (4.4 feet, MAN). Bradley Davis misses. Rebound secured by Draymond Simons.

[03:22] Team_080 possession (Score: 12-21)
Draymond Simons attempts a 3Pt. Contested by Malcolm Quickley (3.9 feet, ZONE). DRAYMOND SIMONS MAKES IT! Assist: Larry Paul
Score: 12-24

[03:04] Team_063 possession (Score: 12-24)
Malcolm Quickley attempts a Midrange. Contested by Khris Turner (4.6 feet, MAN). MALCOLM QUICKLEY MAKES IT! Assist: Tyler Harris
Score: 14-24

[02:46] Team_080 possession (Score: 14-24)
Khris Turner attempts a Layup. BLOCKED BY MALCOLM QUICKLEY! Ball is loose! Rebound secured by Dirk Reaves.

[02:29] Team_063 possession (Score: 14-24)
Terry Reaves drives and kicks out. Dirk Reaves attempts a 3Pt. Contested by Jaren Morant (4.1 feet, MAN). Dirk Reaves misses. FOUL! Loose ball foul on Draymond Simons during the rebound battle. [Team fouls: 2] No free throws, side out. (Draymond Simons: 2 personal fouls)

[02:17] Team_063 possession (Score: 14-24)
Bradley Davis drives and kicks out. Dirk Reaves attempts a 3Pt. Contested by Jaren Morant (4.1 feet, MAN). Dirk Reaves misses. Offensive rebound by Dirk Reaves! Dirk Reaves kicks it out.

[02:06] Team_063 possession (Score: 14-24)
Dirk Reaves drives, picks up Draymond Simons. Help arrives from Khris Turner! Dirk Reaves attempts a Dunk. Contested by Khris Turner (4.5 feet, ZONE). DIRK REAVES MAKES IT! Assist: Bradley Davis
Score: 16-24

[01:52] Team_080 possession (Score: 16-24)
FOUL! Shooting foul on Tyler Harris. Lauri Dosunmu to the line for 2 free throws. [BONUS: 6 team fouls] (Tyler Harris: 1 personal fouls)   FT 1/2: GOOD   FT 2/2: GOOD Lauri Dosunmu makes 2/2 from the line.
Score: 16-26

[01:40] Team_063 possession (Score: 16-26)
FOUL! Reach-in foul on Draymond Simons during the drive. [Team fouls: 3] No free throws, side out. (Draymond Simons: 3 personal fouls)

[01:27] Team_063 possession (Score: 16-26)
Bradley Davis attempts a 3Pt. Contested by Lauri Dosunmu (4.7 feet, MAN). BRADLEY DAVIS MAKES IT! Assist: Dirk Reaves
Score: 19-26

[01:16] Team_080 possession (Score: 19-26)
Jaren Morant attempts a Midrange. BLOCKED BY DIRK REAVES! Ball is loose! Rebound secured by Dirk Reaves.

[01:04] Team_063 possession (Score: 19-26)
FOUL! Reach-in foul on Draymond Simons during the drive. [Team fouls: 4] No free throws, side out. (Draymond Simons: 4 personal fouls)

[00:47] Team_063 possession (Score: 19-26)
Tyler Harris drives, Jaren Morant stays with him. Tyler Harris attempts a Layup. Contested by Jaren Morant (4.2 feet, ZONE). TYLER HARRIS MAKES IT! Assist: Bradley Davis
Score: 21-26

[00:30] Team_080 possession (Score: 21-26)
FOUL! Shooting foul on Tyler Harris. Draymond Simons to the line for 2 free throws. [BONUS: 7 team fouls] (Tyler Harris: 2 personal fouls)   FT 1/2: GOOD   FT 2/2: GOOD Draymond Simons makes 2/2 from the line.
Score: 21-28

[00:16] Team_063 possession (Score: 21-28)
Bradley Davis attempts a Midrange. Contested by Lauri Dosunmu (4.8 feet, MAN). Bradley Davis misses. Offensive rebound by Dirk Reaves! Dirk Reaves kicks it out.

[00:03] Team_063 possession (Score: 21-28)
Terry Reaves attempts a 3Pt. Contested by Larry Paul (4.2 feet, MAN). Terry Reaves misses. FOUL! Loose ball foul on Larry Paul during the rebound battle. [IN THE BONUS! 5 team fouls] Dirk Reaves to the line for 2 free throws. (Larry Paul: 1 personal fouls)   FT 1/2: GOOD   FT 2/2: GOOD Dirk Reaves makes 2/2 from the line.
Score: 23-28

================================================================================
                              1ST QUARTER COMPLETE                              
================================================================================

1ST QUARTER SCORE: Team_063 23, Team_080 28

BOX SCORE:
================================================================================

Team_063
--------------------------------------------------------------------------------
Player                MIN  PTS  REB  AST  TO      FG   FG%      3P   3P%
--------------------------------------------------------------------------------
Malcolm Quickley       12    7    3    0   0   3/4    75.0     0/0   0.0
Dirk Reaves            12    7    5    2   0   3/5    60.0     0/0   0.0
Tyler Harris           12    4    4    1   0   2/4    50.0     0/0   0.0
Bradley Davis          12    3    0    3   0   1/6    16.7     0/0   0.0
Terry Reaves           12    2    0    0   0   1/3    33.3     0/0   0.0

TEAM: FG: 10/22 (45.5%), 3PT: 4/8 (50.0%), REB: 12 (3 off, 9 def), AST: 6, TO: 1
TEAM FOULS: 7 [Team_080 in BONUS]


Team_080
--------------------------------------------------------------------------------
Player                MIN  PTS  REB  AST  TO      FG   FG%      3P   3P%
--------------------------------------------------------------------------------
Draymond Simons        12   11    8    0   0   5/6    83.3     0/0   0.0
Lauri Dosunmu          12    7    0    0   0   3/5    60.0     0/0   0.0
Jaren Morant           12    4    2    1   0   2/3    66.7     0/0   0.0
Larry Paul             12    3    3    2   0   1/4    25.0     0/0   0.0
Khris Turner           12    3    0    0   0   1/4    25.0     0/0   0.0

TEAM: FG: 12/22 (54.5%), 3PT: 3/8 (37.5%), REB: 13 (1 off, 12 def), AST: 3, TO: 0
TEAM FOULS: 5 [Team_063 in BONUS]

================================================================================

================================================================================
                       2ND QUARTER - Team_063 vs Team_080                       
================================================================================

[12:00] Team_063 possession (Score: 23-28)
Terry Reaves attempts a Layup. Contested by Draymond Simons (4.6 feet, ZONE). Terry Reaves misses. Offensive rebound by Dirk Reaves! Dirk Reaves kicks it out.

[11:49] Team_063 possession (Score: 23-28)
Terry Reaves attempts a 3Pt. Contested by Larry Paul (4.0 feet, MAN). TERRY REAVES MAKES IT! Assist: Tyler Harris
Score: 26-28

[11:33] Team_080 possession (Score: 26-28)
Lauri Dosunmu attempts a 3Pt. Contested by Bradley Davis (6.0 feet, MAN). Lauri Dosunmu misses. Rebound secured by Malcolm Quickley.

[11:21] Team_063 possession (Score: 26-28)
Terry Reaves attempts a Midrange. Contested by Larry Paul (4.1 feet, MAN). Terry Reaves misses. Rebound secured by Larry Paul.

[11:11] Team_080 possession (Score: 26-28)
Lauri Dosunmu makes the Layup and draws the foul on Malcolm Quickley! And-1! Lauri Dosunmu to the line for 1. [Team fouls: 1] (Malcolm Quickley: 1 personal fouls)   FT 1/1: GOOD Lauri Dosunmu makes 1/1 from the line.
Score: 26-31

[10:55] Team_063 possession (Score: 26-31)
Terry Reaves drives, Larry Paul stays with him. Terry Reaves attempts a Dunk. Contested by Larry Paul (4.1 feet, MAN). TERRY REAVES MAKES IT! Assist: Dirk Reaves
Score: 28-31

[10:39] Team_080 possession (Score: 28-31)
Draymond Simons drives to the basket... Draymond Simons loses the ball! Stripped by Tyler Harris! TURNOVER! (live ball)

[10:21] Team_063 possession (Score: 28-31)
Malcolm Quickley drives, Draymond Simons stays with him. Malcolm Quickley attempts a Layup. Contested by Draymond Simons (4.3 feet, ZONE). MALCOLM QUICKLEY MAKES IT! Assist: Bradley Davis
Score: 30-31

[10:06] Team_080 possession (Score: 30-31)
Lauri Dosunmu attempts a Layup. BLOCKED BY TYLER HARRIS! Ball is loose! Offensive rebound by Draymond Simons! Draymond Simons kicks it out.

[09:54] Team_080 possession (Score: 30-31)
Jaren Morant attempts a 3Pt. Contested by Dirk Reaves (4.7 feet, MAN). Jaren Morant misses. Rebound secured by Tyler Harris.

[09:40] Team_063 possession (Score: 30-31)
Terry Reaves attempts a Midrange. Contested by Khris Turner (5.4 feet, ZONE). TERRY REAVES MAKES IT!
Score: 32-31

[09:28] Team_080 possession (Score: 32-31)
Jaren Morant attempts a Layup. Contested by Dirk Reaves (4.8 feet, MAN). JAREN MORANT MAKES IT!
Score: 32-33

[09:15] Team_063 possession (Score: 32-33)
Tyler Harris attempts a Midrange. Contested by Draymond Simons (4.6 feet, MAN). Tyler Harris misses. Rebound secured by Draymond Simons.

[09:02] Team_080 possession (Score: 32-33)
FOUL! Reach-in foul on Malcolm Quickley during the drive. [Team fouls: 2] No free throws, side out. (Malcolm Quickley: 2 personal fouls)

[08:50] Team_080 possession (Score: 32-33)
Larry Paul attempts a Midrange. Contested by Terry Reaves (5.7 feet, ZONE). Larry Paul misses. Rebound secured by Dirk Reaves.

[08:37] Team_063 possession (Score: 32-33)
FOUL! Shooting foul on Draymond Simons. Dirk Reaves to the line for 2 free throws. [Team fouls: 1] (Draymond Simons: 1 personal fouls)   FT 1/2: MISS   FT 2/2: MISS Dirk Reaves makes 0/2 from the line. Rebound secured by Larry Paul.

[08:22] Team_080 possession (Score: 32-33)
Draymond Simons attempts a Layup. Contested by Tyler Harris (5.4 feet, MAN). DRAYMOND SIMONS MAKES IT! Assist: Lauri Dosunmu
Score: 32-35

[08:12] Team_063 possession (Score: 32-35)
Dirk Reaves attempts a Layup. Contested by Draymond Simons (5.1 feet, ZONE). DIRK REAVES MAKES IT! Assist: Terry Reaves
Score: 34-35

[08:01] Team_080 possession (Score: 34-35)
Larry Paul attempts a Midrange. Contested by Dirk Reaves (5.1 feet, ZONE). LARRY PAUL MAKES IT!
Score: 34-37

[07:48] Team_063 possession (Score: 34-37)
Terry Reaves attempts a 3Pt. Contested by Larry Paul (4.5 feet, MAN). Terry Reaves misses. Rebound secured by Draymond Simons.

[07:34] Team_080 possession (Score: 34-37)
FOUL! Shooting foul on Terry Reaves. Larry Paul to the line for 3 free throws. [Team fouls: 3] (Terry Reaves: 1 personal fouls)   FT 1/3: MISS   FT 2/3: GOOD   FT 3/3: MISS Larry Paul makes 1/3 from the line. Rebound secured by Dirk Reaves.
Score: 34-38

[07:20] Team_063 possession (Score: 34-38)
Bradley Davis attempts a 3Pt. Contested by Lauri Dosunmu (5.3 feet, ZONE). Bradley Davis misses. Offensive rebound by Malcolm Quickley! Malcolm Quickley kicks it out.

[07:01] Team_063 possession (Score: 34-38)
Tyler Harris attempts a 3Pt. Contested by Larry Paul (4.3 feet, ZONE). Tyler Harris misses. Rebound secured by Draymond Simons.

[06:45] Team_080 possession (Score: 34-38)
Lauri Dosunmu attempts a 3Pt. Wide open! Bradley Davis is 6.4 feet away. [MAN] LAURI DOSUNMU MAKES IT! Assist: Larry Paul
Score: 34-41

[06:26] Team_063 possession (Score: 34-41)
Tyler Harris attempts a 3Pt. Contested by Draymond Simons (5.1 feet, MAN). Tyler Harris misses. Rebound secured by Jaren Morant.

[06:06] Team_080 possession (Score: 34-41)
Larry Paul attempts a 3Pt. Wide open! Terry Reaves is 6.0 feet away. [MAN] Larry Paul misses. Offensive rebound by Draymond Simons! Draymond Simons kicks it out.

[05:55] Team_080 possession (Score: 34-41)
Khris Turner makes the 3Pt and draws the foul on Malcolm Quickley! And-1! Khris Turner to the line for 1. [Team fouls: 4] (Malcolm Quickley: 3 personal fouls)   FT 1/1: GOOD Khris Turner makes 1/1 from the line.
Score: 34-45

[05:38] Team_063 possession (Score: 34-45)
FOUL! Holding foul on Lauri Dosunmu. [Team fouls: 2] No free throws, side out. (Lauri Dosunmu: 1 personal fouls)

[05:25] Team_063 possession (Score: 34-45)
Tyler Harris drives to the basket... FOUL! Offensive foul on Tyler Harris! Draymond Simons drew the charge! [Team fouls: 5] (Tyler Harris: 1 personal fouls) TURNOVER! (dead ball)

[05:08] Team_080 possession (Score: 34-45)
Larry Paul attempts a Midrange. Wide open! Terry Reaves is 6.2 feet away. [ZONE] Larry Paul misses. Rebound secured by Dirk Reaves.

[04:50] Team_063 possession (Score: 34-45)
Bradley Davis attempts a 3Pt. Contested by Lauri Dosunmu (5.6 feet, ZONE). Bradley Davis misses. Offensive rebound by Tyler Harris! Tyler Harris kicks it out.

[04:37] Team_063 possession (Score: 34-45)
Terry Reaves attempts a 3Pt. Contested by Lauri Dosunmu (5.7 feet, ZONE). Terry Reaves misses. Rebound secured by Jaren Morant.

[04:24] Team_080 possession (Score: 34-45)
FOUL! Holding foul on Terry Reaves. [IN THE BONUS! 6 team fouls] Larry Paul to the line for 2 free throws. (Terry Reaves: 2 personal fouls)   FT 1/2: MISS   FT 2/2: GOOD Larry Paul makes 1/2 from the line.
Score: 34-46

[04:09] Team_063 possession (Score: 34-46)
Tyler Harris attempts a Midrange. Contested by Khris Turner (5.8 feet, ZONE). TYLER HARRIS MAKES IT!
Score: 36-46

[03:54] Team_080 possession (Score: 36-46)
Jaren Morant attempts a 3Pt. Contested by Dirk Reaves (5.6 feet, MAN). Jaren Morant misses. FOUL! Loose ball foul on Tyler Harris during the rebound battle. [IN THE BONUS! 7 team fouls] Jaren Morant to the line for 2 free throws. (Tyler Harris: 2 personal fouls)   FT 1/2: GOOD   FT 2/2: GOOD Jaren Morant makes 2/2 from the line.
Score: 36-48

[03:36] Team_063 possession (Score: 36-48)
Tyler Harris makes the Layup and draws the foul on Draymond Simons! And-1! Tyler Harris to the line for 1. [Team fouls: 3] (Draymond Simons: 2 personal fouls)   FT 1/1: GOOD Tyler Harris makes 1/1 from the line.
Score: 39-48

[03:23] Team_080 possession (Score: 39-48)
Khris Turner drives to the basket... Khris Turner loses the ball! Stripped by Tyler Harris! TURNOVER! (live ball)

[03:05] Team_063 possession (Score: 39-48)
Malcolm Quickley attempts a 3Pt. Contested by Jaren Morant (5.4 feet, ZONE). Malcolm Quickley misses. Rebound secured by Draymond Simons.

[02:48] Team_080 possession (Score: 39-48)
Khris Turner attempts a 3Pt. Contested by Malcolm Quickley (5.4 feet, MAN). Khris Turner misses. Rebound secured by Malcolm Quickley.

[02:36] Team_063 possession (Score: 39-48)
FOUL! Shooting foul on Khris Turner. Bradley Davis to the line for 2 free throws. [Team fouls: 4] (Khris Turner: 1 personal fouls)   FT 1/2: GOOD   FT 2/2: GOOD Bradley Davis makes 2/2 from the line.
Score: 41-48

[02:21] Team_080 possession (Score: 41-48)
Draymond Simons drives to the basket... Draymond Simons throws a bad pass out of bounds! TURNOVER! (dead ball)

[02:21] Substitution (Team_063): Bradley Davis OUT → DeMar Banchero IN (stamina_rule2)

[02:21] Substitution (Team_063): Malcolm Quickley OUT → Cole Durant IN (stamina_rule2)

[02:21] Substitution (Team_063): Terry Reaves OUT → Jaren James IN (stamina_rule2)

[02:21] Substitution (Team_063): Dirk Reaves OUT → Lamelo Ball IN (stamina_rule2)

[02:21] Substitution (Team_063): Tyler Harris OUT → Kyle Green IN (stamina_rule2)

[02:21] Substitution (Team_080): Lauri Dosunmu OUT → Tony James IN (stamina_rule2)

[02:21] Substitution (Team_080): Khris Turner OUT → Larry Reaves IN (stamina_rule2)

[02:21] Substitution (Team_080): Larry Paul OUT → Joel Bryant IN (stamina_rule2)

[02:21] Substitution (Team_080): Jaren Morant OUT → Ja Cunningham IN (stamina_rule2)

[02:21] Substitution (Team_080): Draymond Simons OUT → Trae Brogdon IN (stamina_rule2)

[02:08] Team_063 possession (Score: 41-48)
DeMar Banchero attempts a 3Pt. Contested by Joel Bryant (4.8 feet, ZONE). DEMAR BANCHERO MAKES IT! Assist: Lamelo Ball
Score: 44-48

[01:49] Team_080 possession (Score: 44-48)
Larry Reaves attempts a Midrange. Contested by Cole Durant (4.3 feet, MAN). Larry Reaves misses. Rebound secured by Kyle Green.

[01:34] Team_063 possession (Score: 44-48)
DeMar Banchero makes the Layup and draws the foul on Larry Reaves! And-1! DeMar Banchero to the line for 1. [BONUS: 5 team fouls] (Larry Reaves: 1 personal fouls)   FT 1/1: GOOD DeMar Banchero makes 1/1 from the line.
Score: 47-48

[01:17] Team_080 possession (Score: 47-48)
Trae Brogdon drives and kicks out. Trae Brogdon attempts a 3Pt. Contested by Kyle Green (4.4 feet, MAN). TRAE BROGDON MAKES IT! Assist: Joel Bryant
Score: 47-51

[01:02] Team_063 possession (Score: 47-51)
Kyle Green drives, Ja Cunningham stays with him. Kyle Green attempts a Dunk. Contested by Ja Cunningham (4.9 feet, ZONE). Kyle Green misses. Rebound secured by Trae Brogdon.

[00:45] Team_080 possession (Score: 47-51)
Trae Brogdon attempts a Layup. BLOCKED BY KYLE GREEN! Ball deflects out of bounds off Trae Brogdon.

[00:35] Team_063 possession (Score: 47-51)
Jaren James drives to the basket... Jaren James loses the ball! Stripped by Joel Bryant! TURNOVER! (live ball)

[00:22] Team_080 possession (Score: 47-51)
Ja Cunningham throws a bad pass out of bounds! TURNOVER! (dead ball)

[00:11] Team_063 possession (Score: 47-51)
Lamelo Ball attempts a Layup. Contested by Ja Cunningham (5.1 feet, MAN). LAMELO BALL MAKES IT! Assist: Cole Durant
Score: 49-51

================================================================================
                              2ND QUARTER COMPLETE                              
================================================================================

2ND QUARTER SCORE: Team_063 26, Team_080 23

BOX SCORE:
================================================================================

Team_063
--------------------------------------------------------------------------------
Player                MIN  PTS  REB  AST  TO      FG   FG%      3P   3P%
--------------------------------------------------------------------------------
Terry Reaves           22    7    0    1   0   3/6    50.0     0/0   0.0
DeMar Banchero          2    6    0    0   0   2/2   100.0     0/0   0.0
Tyler Harris           22    5    2    1   0   2/5    40.0     0/0   0.0
Dirk Reaves            22    2    4    1   0   1/2    50.0     0/0   0.0
Malcolm Quickley       22    2    3    0   0   1/2    50.0     0/0   0.0
Bradley Davis          22    2    0    1   0   1/1   100.0     0/0   0.0
Lamelo Ball             2    2    0    1   0   1/1   100.0     0/0   0.0
Kyle Green              2    0    1    0   0   0/1     0.0     0/0   0.0
Cole Durant             2    0    0    1   0   0/0     0.0     0/0   0.0

TEAM: FG: 11/20 (55.0%), 3PT: 2/7 (28.6%), REB: 10 (3 off, 7 def), AST: 6, TO: 2
TEAM FOULS: 7 [Team_080 in BONUS]


Team_080
--------------------------------------------------------------------------------
Player                MIN  PTS  REB  AST  TO      FG   FG%      3P   3P%
--------------------------------------------------------------------------------
Lauri Dosunmu          22    6    0    1   0   2/3    66.7     0/0   0.0
Jaren Morant           22    4    2    0   0   2/3    66.7     0/0   0.0
Khris Turner           22    4    0    0   0   1/2    50.0     0/0   0.0
Larry Paul             22    3    2    1   0   2/5    40.0     0/0   0.0
Trae Brogdon            2    3    1    0   0   1/2    50.0     0/0   0.0
Draymond Simons        22    2    6    0   0   1/1   100.0     0/0   0.0
Larry Reaves            2    0    0    0   0   0/1     0.0     0/0   0.0
Joel Bryant             2    0    0    1   0   0/0     0.0     0/0   0.0

TEAM: FG: 9/17 (52.9%), 3PT: 3/7 (42.9%), REB: 11 (2 off, 9 def), AST: 3, TO: 4
TEAM FOULS: 5 [Team_063 in BONUS]

================================================================================

================================================================================
                       3RD QUARTER - Team_063 vs Team_080                       
================================================================================

[12:00] Team_063 possession (Score: 49-51)
Tyler Harris makes the Layup and draws the foul on Draymond Simons! And-1! Tyler Harris to the line for 1. [Team fouls: 1] (Draymond Simons: 1 personal fouls)   FT 1/1: GOOD Tyler Harris makes 1/1 from the line.
Score: 52-51

[11:45] Team_080 possession (Score: 52-51)
Larry Paul drives, picks up Dirk Reaves. Help arrives from Malcolm Quickley! Larry Paul attempts a Layup. Contested by Malcolm Quickley (4.0 feet, ZONE). LARRY PAUL MAKES IT! Assist: Jaren Morant
Score: 52-53

[11:36] Team_063 possession (Score: 52-53)
Bradley Davis attempts a 3Pt. Contested by Lauri Dosunmu (4.3 feet, ZONE). Bradley Davis misses. Rebound secured by Draymond Simons.

[11:24] Team_080 possession (Score: 52-53)
FOUL! Shooting foul on Dirk Reaves. Larry Paul to the line for 2 free throws. [Team fouls: 1] (Dirk Reaves: 1 personal fouls)   FT 1/2: GOOD   FT 2/2: GOOD Larry Paul makes 2/2 from the line.
Score: 52-55

[11:10] Team_063 possession (Score: 52-55)
Tyler Harris attempts a Layup. Contested by Draymond Simons (3.8 feet, MAN). Tyler Harris misses. Rebound secured by Jaren Morant.

[10:56] Team_080 possession (Score: 52-55)
Khris Turner drives and kicks out. Jaren Morant attempts a 3Pt. Contested by Dirk Reaves (3.7 feet, MAN). Jaren Morant misses. Rebound secured by Tyler Harris.

[10:38] Team_063 possession (Score: 52-55)
Bradley Davis attempts a Layup. Contested by Draymond Simons (4.1 feet, ZONE). BRADLEY DAVIS MAKES IT! Assist: Malcolm Quickley
Score: 54-55

[10:22] Team_080 possession (Score: 54-55)
FOUL! Shooting foul on Malcolm Quickley. Larry Paul to the line for 3 free throws. [Team fouls: 2] (Malcolm Quickley: 1 personal fouls)   FT 1/3: GOOD   FT 2/3: GOOD   FT 3/3: GOOD Larry Paul makes 3/3 from the line.
Score: 54-58

[10:03] Team_063 possession (Score: 54-58)
Terry Reaves attempts a 3Pt. Contested by Larry Paul (3.8 feet, ZONE). TERRY REAVES MAKES IT! Assist: Malcolm Quickley
Score: 57-58

[09:44] Team_080 possession (Score: 57-58)
Khris Turner attempts a 3Pt. Contested by Malcolm Quickley (3.7 feet, ZONE). Khris Turner misses. Rebound secured by Dirk Reaves.

[09:30] Team_063 possession (Score: 57-58)
Dirk Reaves attempts a Midrange. BLOCKED BY JAREN MORANT! Ball is loose! Rebound secured by Draymond Simons.

[09:16] Team_080 possession (Score: 57-58)
Khris Turner attempts a Layup. Contested by Tyler Harris (4.6 feet, ZONE). Khris Turner misses. Rebound secured by Malcolm Quickley.

[09:01] Team_063 possession (Score: 57-58)
Bradley Davis attempts a Midrange. Contested by Lauri Dosunmu (4.3 feet, MAN). BRADLEY DAVIS MAKES IT!
Score: 59-58

[08:46] Team_080 possession (Score: 59-58)
Jaren Morant attempts a Layup. BLOCKED BY DIRK REAVES! Ball is loose! Rebound secured by Tyler Harris.

[08:31] Team_063 possession (Score: 59-58)
Terry Reaves makes the Midrange and draws the foul on Khris Turner! And-1! Terry Reaves to the line for 1. [Team fouls: 2] (Khris Turner: 1 personal fouls)   FT 1/1: GOOD Terry Reaves makes 1/1 from the line.
Score: 62-58

[08:22] Team_080 possession (Score: 62-58)
Khris Turner drives to the basket... FOUL! Offensive foul on Khris Turner! Malcolm Quickley drew the charge! [Team fouls: 3] (Khris Turner: 2 personal fouls) TURNOVER! (dead ball)

[08:08] Team_063 possession (Score: 62-58)
FOUL! Reach-in foul on Draymond Simons during the drive. [Team fouls: 4] No free throws, side out. (Draymond Simons: 2 personal fouls)

[07:55] Team_063 possession (Score: 62-58)
Tyler Harris attempts a Midrange. Contested by Draymond Simons (3.8 feet, MAN). Tyler Harris misses. Rebound secured by Larry Paul.

[07:39] Team_080 possession (Score: 62-58)
Draymond Simons attempts a Layup. Contested by Tyler Harris (4.6 feet, ZONE). DRAYMOND SIMONS MAKES IT! Assist: Khris Turner
Score: 62-60

[07:21] Team_063 possession (Score: 62-60)
Bradley Davis attempts a 3Pt. Contested by Lauri Dosunmu (4.3 feet, MAN). Bradley Davis misses. Rebound secured by Draymond Simons.

[07:07] Team_080 possession (Score: 62-60)
Larry Paul attempts a Midrange. Contested by Malcolm Quickley (3.9 feet, ZONE). LARRY PAUL MAKES IT!
Score: 62-62

[06:52] Team_063 possession (Score: 62-62)
Terry Reaves attempts a 3Pt. Contested by Larry Paul (3.8 feet, MAN). Terry Reaves misses. Rebound secured by Larry Paul.

[06:41] Team_080 possession (Score: 62-62)
Jaren Morant drives, Tyler Harris stays with him. Jaren Morant attempts a Layup. Contested by Tyler Harris (4.8 feet, ZONE). JAREN MORANT MAKES IT!
Score: 62-64

[06:22] Team_063 possession (Score: 62-64)
Malcolm Quickley makes the Midrange and draws the foul on Khris Turner! And-1! Malcolm Quickley to the line for 1. [BONUS: 5 team fouls] (Khris Turner: 3 personal fouls)   FT 1/1: GOOD Malcolm Quickley makes 1/1 from the line.
Score: 65-64

[06:09] Team_080 possession (Score: 65-64)
Jaren Morant makes the Layup and draws the foul on Dirk Reaves! And-1! Jaren Morant to the line for 1. [Team fouls: 3] (Dirk Reaves: 2 personal fouls)   FT 1/1: GOOD Jaren Morant makes 1/1 from the line.
Score: 65-67

[05:55] Team_063 possession (Score: 65-67)
Malcolm Quickley drives, picks up Draymond Simons. Help arrives from Khris Turner! Malcolm Quickley attempts a Layup. Contested by Khris Turner (3.7 feet, ZONE). MALCOLM QUICKLEY MAKES IT! Assist: Bradley Davis
Score: 67-67

[05:43] Team_080 possession (Score: 67-67)
FOUL! Shooting foul on Malcolm Quickley. Khris Turner to the line for 2 free throws. [Team fouls: 4] (Malcolm Quickley: 2 personal fouls)   FT 1/2: GOOD   FT 2/2: GOOD Khris Turner makes 2/2 from the line.
Score: 67-69

[05:25] Team_063 possession (Score: 67-69)
Malcolm Quickley attempts a Midrange. Contested by Khris Turner (4.4 feet, ZONE). Malcolm Quickley misses. Offensive rebound by Tyler Harris! Tyler Harris puts it back in!
Score: 69-69

[05:11] Team_080 possession (Score: 69-69)
Draymond Simons drives, picks up Tyler Harris. Help arrives from Malcolm Quickley! Draymond Simons attempts a Layup. Contested by Malcolm Quickley (4.6 feet, MAN). DRAYMOND SIMONS MAKES IT!
Score: 69-71

[04:55] Team_063 possession (Score: 69-71)
Malcolm Quickley drives to the basket... Malcolm Quickley throws a bad pass out of bounds! TURNOVER! (dead ball)

[04:39] Team_080 possession (Score: 69-71)
Lauri Dosunmu attempts a 3Pt. Contested by Dirk Reaves (4.6 feet, ZONE). Lauri Dosunmu misses. Rebound secured by Malcolm Quickley.

[04:23] Team_063 possession (Score: 69-71)
Dirk Reaves attempts a Layup. Contested by Jaren Morant (4.0 feet, MAN). DIRK REAVES MAKES IT! Assist: Terry Reaves
Score: 71-71

[04:06] Team_080 possession (Score: 71-71)
Draymond Simons drives to the basket... FOUL! Offensive foul on Draymond Simons! Tyler Harris drew the charge! [Team fouls: 6] (Draymond Simons: 3 personal fouls) TURNOVER! (dead ball)

[03:51] Team_063 possession (Score: 71-71)
FOUL! Shooting foul on Lauri Dosunmu. Dirk Reaves to the line for 3 free throws. [BONUS: 7 team fouls] (Lauri Dosunmu: 1 personal fouls)   FT 1/3: GOOD   FT 2/3: GOOD   FT 3/3: GOOD Dirk Reaves makes 3/3 from the line.
Score: 74-71

[03:33] Team_080 possession (Score: 74-71)
Jaren Morant attempts a 3Pt. Contested by Malcolm Quickley (4.0 feet, ZONE). Jaren Morant misses. Offensive rebound by Jaren Morant! Jaren Morant kicks it out.

[03:19] Team_080 possession (Score: 74-71)
Khris Turner makes the Dunk and draws the foul on Bradley Davis! And-1! Khris Turner to the line for 1. [BONUS: 5 team fouls] (Bradley Davis: 1 personal fouls)   FT 1/1: MISS Khris Turner makes 0/1 from the line. Rebound secured by Tyler Harris.
Score: 74-73

[03:00] Team_063 possession (Score: 74-73)
Dirk Reaves attempts a Layup. Contested by Draymond Simons (4.3 feet, ZONE). DIRK REAVES MAKES IT! Assist: Terry Reaves
Score: 76-73

[02:46] Team_080 possession (Score: 76-73)
Lauri Dosunmu attempts a 3Pt. Contested by Malcolm Quickley (4.5 feet, ZONE). Lauri Dosunmu misses. Rebound secured by Tyler Harris.

[02:35] Team_063 possession (Score: 76-73)
Terry Reaves drives and kicks out. Tyler Harris attempts a 3Pt. Contested by Lauri Dosunmu (4.3 feet, ZONE). Tyler Harris misses. Rebound secured by Larry Paul.

[02:23] Team_080 possession (Score: 76-73)
Larry Paul attempts a 3Pt. Contested by Malcolm Quickley (4.1 feet, ZONE). LARRY PAUL MAKES IT! Assist: Jaren Morant
Score: 76-76

[02:07] Team_063 possession (Score: 76-76)
Tyler Harris attempts a Midrange. Contested by Draymond Simons (4.1 feet, MAN). Tyler Harris misses. Rebound secured by Jaren Morant.

[01:53] Team_080 possession (Score: 76-76)
Draymond Simons drives, Tyler Harris stays with him. Draymond Simons attempts a Dunk. Contested by Tyler Harris (4.9 feet, MAN). DRAYMOND SIMONS MAKES IT!
Score: 76-78

[01:40] Team_063 possession (Score: 76-78)
Tyler Harris attempts a Layup. Contested by Draymond Simons (4.2 feet, ZONE). TYLER HARRIS MAKES IT! Assist: Bradley Davis
Score: 78-78

[01:30] Team_080 possession (Score: 78-78)
Lauri Dosunmu attempts a 3Pt. Contested by Malcolm Quickley (4.7 feet, ZONE). Lauri Dosunmu misses. Rebound secured by Tyler Harris.

[01:16] Team_063 possession (Score: 78-78)
Malcolm Quickley attempts a Midrange. Contested by Jaren Morant (4.0 feet, ZONE). Malcolm Quickley misses. Offensive rebound by Tyler Harris! Tyler Harris puts it back in!
Score: 80-78

[01:02] Team_080 possession (Score: 80-78)
Khris Turner attempts a Midrange. Contested by Dirk Reaves (4.4 feet, ZONE). KHRIS TURNER MAKES IT!
Score: 80-80

[00:46] Team_063 possession (Score: 80-80)
Malcolm Quickley attempts a 3Pt. Contested by Khris Turner (4.8 feet, MAN). Malcolm Quickley misses. Rebound secured by Larry Paul.

[00:32] Team_080 possession (Score: 80-80)
Jaren Morant drives to the basket... Jaren Morant commits a violation (traveling/carry)! TURNOVER! (dead ball)

[00:32] Substitution (Team_063): Bradley Davis OUT → DeMar Banchero IN (stamina_rule2)

[00:32] Substitution (Team_063): Malcolm Quickley OUT → Cole Durant IN (stamina_rule2)

[00:32] Substitution (Team_063): Terry Reaves OUT → Jaren James IN (stamina_rule2)

[00:32] Substitution (Team_063): Dirk Reaves OUT → Lamelo Ball IN (stamina_rule2)

[00:32] Substitution (Team_063): Tyler Harris OUT → Kyle Green IN (stamina_rule2)

[00:32] Substitution (Team_080): Lauri Dosunmu OUT → Tony James IN (stamina_rule2)

[00:32] Substitution (Team_080): Khris Turner OUT → Larry Reaves IN (stamina_rule2)

[00:32] Substitution (Team_080): Larry Paul OUT → Joel Bryant IN (stamina_rule2)

[00:32] Substitution (Team_080): Jaren Morant OUT → Ja Cunningham IN (stamina_rule2)

[00:32] Substitution (Team_080): Draymond Simons OUT → Trae Brogdon IN (stamina_rule2)

[00:17] Team_063 possession (Score: 80-80)
Kyle Green drives, picks up Trae Brogdon. Help arrives from Larry Reaves! Kyle Green attempts a Layup. Contested by Larry Reaves (5.6 feet, MAN). KYLE GREEN MAKES IT! Assist: DeMar Banchero
Score: 82-80

[00:04] Team_080 possession (Score: 82-80)
Trae Brogdon makes the Layup and draws the foul on Kyle Green! And-1! Trae Brogdon to the line for 1. [BONUS: 6 team fouls] (Kyle Green: 1 personal fouls)   FT 1/1: MISS Trae Brogdon makes 0/1 from the line. Rebound secured by Kyle Green.
Score: 82-82

================================================================================
                              3RD QUARTER COMPLETE                              
================================================================================

3RD QUARTER SCORE: Team_063 33, Team_080 31

BOX SCORE:
================================================================================

Team_063
--------------------------------------------------------------------------------
Player                MIN  PTS  REB  AST  TO      FG   FG%      3P   3P%
--------------------------------------------------------------------------------
Tyler Harris           34    9    7    0   0   4/7    57.1     0/0   0.0
Dirk Reaves            34    7    1    0   0   3/4    75.0     0/0   0.0
Terry Reaves           34    6    0    2   0   2/4    50.0     0/0   0.0
Malcolm Quickley       34    5    2    2   0   2/3    66.7     0/0   0.0
Bradley Davis          34    4    0    2   0   2/4    50.0     0/0   0.0
Kyle Green              3    2    1    0   0   1/1   100.0     0/0   0.0
DeMar Banchero          3    0    0    1   0   0/0     0.0     0/0   0.0

TEAM: FG: 14/23 (60.9%), 3PT: 2/6 (33.3%), REB: 11 (2 off, 9 def), AST: 7, TO: 1
TEAM FOULS: 6 [Team_080 in BONUS]


Team_080
--------------------------------------------------------------------------------
Player                MIN  PTS  REB  AST  TO      FG   FG%      3P   3P%
--------------------------------------------------------------------------------
Larry Paul             34   12    4    0   0   5/5   100.0     0/0   0.0
Draymond Simons        34    6    3    0   0   3/3   100.0     0/0   0.0
Jaren Morant           34    5    3    2   0   2/3    66.7     0/0   0.0
Khris Turner           34    4    0    1   0   2/6    33.3     0/0   0.0
Lauri Dosunmu          34    0    0    0   0   0/3     0.0     0/0   0.0
Trae Brogdon            3    0    0    0   0   0/1     0.0     0/0   0.0

TEAM: FG: 12/21 (57.1%), 3PT: 2/6 (33.3%), REB: 10 (1 off, 9 def), AST: 3, TO: 3
TEAM FOULS: 7 [Team_063 in BONUS]

================================================================================

================================================================================
                       4TH QUARTER - Team_063 vs Team_080                       
================================================================================

[12:00] Team_063 possession (Score: 82-82)
Dirk Reaves attempts a 3Pt. Contested by Jaren Morant (4.2 feet, MAN). Dirk Reaves misses. Rebound secured by Larry Paul.

[11:48] Team_080 possession (Score: 82-82)
FOUL! Reach-in foul on Tyler Harris during the drive. [Team fouls: 1] No free throws, side out. (Tyler Harris: 1 personal fouls)

[11:33] Team_080 possession (Score: 82-82)
Larry Paul drives, picks up Terry Reaves. Help arrives from Malcolm Quickley! Larry Paul attempts a Layup. Contested by Malcolm Quickley (5.2 feet, MAN). LARRY PAUL MAKES IT! Assist: Lauri Dosunmu
Score: 82-84

[11:14] Team_063 possession (Score: 82-84)
Tyler Harris makes the Midrange and draws the foul on Larry Paul! And-1! Tyler Harris to the line for 1. [Team fouls: 1] (Larry Paul: 1 personal fouls)   FT 1/1: GOOD Tyler Harris makes 1/1 from the line.
Score: 85-84

[10:59] Team_080 possession (Score: 85-84)
Lauri Dosunmu attempts a 3Pt. Contested by Malcolm Quickley (4.6 feet, ZONE). Lauri Dosunmu misses. Rebound secured by Dirk Reaves.

[10:46] Team_063 possession (Score: 85-84)
FOUL! Reach-in foul on Draymond Simons during the drive. [Team fouls: 2] No free throws, side out. (Draymond Simons: 1 personal fouls)

[10:32] Team_063 possession (Score: 85-84)
Malcolm Quickley drives and kicks out. Dirk Reaves attempts a 3Pt. Contested by Jaren Morant (4.2 feet, MAN). Dirk Reaves misses. Rebound secured by Jaren Morant.

[10:18] Team_080 possession (Score: 85-84)
Draymond Simons drives and kicks out. Lauri Dosunmu attempts a 3Pt. Contested by Bradley Davis (5.2 feet, MAN). LAURI DOSUNMU MAKES IT! Assist: Draymond Simons
Score: 85-87

[10:01] Team_063 possession (Score: 85-87)
FOUL! Holding foul on Larry Paul. [Team fouls: 3] No free throws, side out. (Larry Paul: 2 personal fouls)

[09:49] Team_063 possession (Score: 85-87)
Dirk Reaves drives to the basket... Dirk Reaves throws a bad pass! Stolen by Draymond Simons! TURNOVER! (live ball)

[09:31] Team_080 possession (Score: 85-87)
Larry Paul drives and kicks out. Lauri Dosunmu attempts a 3Pt. Contested by Bradley Davis (5.3 feet, MAN). Lauri Dosunmu misses. Rebound secured by Tyler Harris.

[09:12] Team_063 possession (Score: 85-87)
FOUL! Shooting foul on Lauri Dosunmu. Terry Reaves to the line for 3 free throws. [Team fouls: 4] (Lauri Dosunmu: 1 personal fouls)   FT 1/3: GOOD   FT 2/3: GOOD   FT 3/3: GOOD Terry Reaves makes 3/3 from the line.
Score: 88-87

[08:55] Team_080 possession (Score: 88-87)
Larry Paul drives, picks up Tyler Harris. Help arrives from Malcolm Quickley! Larry Paul attempts a Dunk. Contested by Malcolm Quickley (5.3 feet, ZONE). Larry Paul misses. Rebound secured by Dirk Reaves.

[08:41] Team_063 possession (Score: 88-87)
Malcolm Quickley drives and kicks out. Dirk Reaves attempts a Midrange. BLOCKED BY JAREN MORANT! Ball is loose! Offensive rebound by Tyler Harris! Tyler Harris kicks it out.

[08:24] Team_063 possession (Score: 88-87)
Bradley Davis attempts a 3Pt. Contested by Lauri Dosunmu (4.9 feet, MAN). Bradley Davis misses. Rebound secured by Larry Paul.

[08:06] Team_080 possession (Score: 88-87)
Larry Paul attempts a Midrange. Contested by Terry Reaves (5.6 feet, MAN). LARRY PAUL MAKES IT!
Score: 88-89

[07:53] Team_063 possession (Score: 88-89)
Malcolm Quickley drives to the basket... Malcolm Quickley throws a bad pass! Stolen by Khris Turner! TURNOVER! (live ball)

[07:37] Team_080 possession (Score: 88-89)
Larry Paul attempts a Midrange. Contested by Terry Reaves (5.6 feet, MAN). Larry Paul misses. Rebound secured by Tyler Harris.

[07:17] Team_063 possession (Score: 88-89)
FOUL! Reach-in foul on Draymond Simons during the drive. [IN THE BONUS! 5 team fouls] Tyler Harris to the line for 2 free throws. (Draymond Simons: 2 personal fouls)   FT 1/2: GOOD   FT 2/2: GOOD Tyler Harris makes 2/2 from the line.
Score: 90-89

[07:04] Team_080 possession (Score: 90-89)
Khris Turner attempts a 3Pt. Contested by Malcolm Quickley (4.5 feet, MAN). Khris Turner misses. Rebound secured by Dirk Reaves.

[06:55] Team_063 possession (Score: 90-89)
Malcolm Quickley attempts a 3Pt. Contested by Lauri Dosunmu (4.7 feet, ZONE). Malcolm Quickley misses. Offensive rebound by Malcolm Quickley! Malcolm Quickley kicks it out.

[06:37] Team_063 possession (Score: 90-89)
Bradley Davis attempts a Midrange. Contested by Lauri Dosunmu (5.1 feet, MAN). Bradley Davis misses. Offensive rebound by Tyler Harris! Tyler Harris kicks it out.

[06:23] Team_063 possession (Score: 90-89)
Dirk Reaves attempts a 3Pt. Contested by Lauri Dosunmu (5.1 feet, ZONE). Dirk Reaves misses. Rebound secured by Jaren Morant.

[06:05] Team_080 possession (Score: 90-89)
FOUL! Reach-in foul on Dirk Reaves during the drive. [Team fouls: 2] No free throws, side out. (Dirk Reaves: 1 personal fouls)

[05:49] Team_080 possession (Score: 90-89)
Larry Paul drives and kicks out. Draymond Simons attempts a 3Pt. BLOCKED BY TYLER HARRIS! Ball is loose! Offensive rebound by Jaren Morant! Jaren Morant kicks it out.

[05:36] Team_080 possession (Score: 90-89)
Larry Paul attempts a 3Pt. Contested by Terry Reaves (5.9 feet, MAN). LARRY PAUL MAKES IT! Assist: Jaren Morant
Score: 90-92

[05:20] Team_063 possession (Score: 90-92)
Bradley Davis drives, Draymond Simons stays with him. Bradley Davis attempts a Dunk. Contested by Draymond Simons (5.2 feet, ZONE). BRADLEY DAVIS MAKES IT! Assist: Dirk Reaves
Score: 92-92

[05:06] Team_080 possession (Score: 92-92)
Larry Paul attempts a 3Pt. Contested by Terry Reaves (5.9 feet, MAN). Larry Paul misses. Rebound secured by Dirk Reaves.

[04:52] Team_063 possession (Score: 92-92)
Bradley Davis makes the Layup and draws the foul on Draymond Simons! And-1! Bradley Davis to the line for 1. [BONUS: 6 team fouls] (Draymond Simons: 3 personal fouls)   FT 1/1: GOOD Bradley Davis makes 1/1 from the line.
Score: 95-92

[04:36] Team_080 possession (Score: 95-92)
FOUL! Shooting foul on Malcolm Quickley. Draymond Simons to the line for 3 free throws. [Team fouls: 3] (Malcolm Quickley: 1 personal fouls)   FT 1/3: GOOD   FT 2/3: GOOD   FT 3/3: MISS Draymond Simons makes 2/3 from the line. Rebound secured by Tyler Harris.
Score: 95-94

[04:22] Team_063 possession (Score: 95-94)
Dirk Reaves attempts a Layup. Contested by Jaren Morant (5.2 feet, MAN). Dirk Reaves misses. Rebound secured by Draymond Simons.

[04:13] Team_080 possession (Score: 95-94)
Draymond Simons attempts a Midrange. Contested by Tyler Harris (5.8 feet, MAN). Draymond Simons misses. Rebound secured by Tyler Harris.

[04:00] Team_063 possession (Score: 95-94)
Terry Reaves attempts a 3Pt. Contested by Lauri Dosunmu (5.5 feet, ZONE). Terry Reaves misses. Rebound secured by Draymond Simons.

[03:46] Team_080 possession (Score: 95-94)
Lauri Dosunmu attempts a 3Pt. Contested by Malcolm Quickley (5.5 feet, ZONE). Lauri Dosunmu misses. Rebound secured by Dirk Reaves.

[03:32] Team_063 possession (Score: 95-94)
Tyler Harris attempts a 3Pt. Contested by Lauri Dosunmu (5.3 feet, ZONE). Tyler Harris misses. Rebound secured by Draymond Simons.

[03:12] Team_080 possession (Score: 95-94)
Lauri Dosunmu attempts a Layup. Wide open! Bradley Davis is 6.6 feet away. [MAN] LAURI DOSUNMU MAKES IT! Assist: Jaren Morant
Score: 95-96

[02:57] Team_063 possession (Score: 95-96)
Tyler Harris drives, picks up Draymond Simons. Help arrives from Khris Turner! Tyler Harris attempts a Layup. Contested by Khris Turner (5.4 feet, ZONE). TYLER HARRIS MAKES IT! Assist: Malcolm Quickley
Score: 97-96

[02:45] Team_080 possession (Score: 97-96)
Lauri Dosunmu attempts a Midrange. Contested by Malcolm Quickley (5.6 feet, ZONE). LAURI DOSUNMU MAKES IT!
Score: 97-98

[02:31] Team_063 possession (Score: 97-98)
FOUL! Shooting foul on Lauri Dosunmu. Bradley Davis to the line for 2 free throws. [BONUS: 7 team fouls] (Lauri Dosunmu: 2 personal fouls)   FT 1/2: GOOD   FT 2/2: GOOD Bradley Davis makes 2/2 from the line.
Score: 99-98

[02:20] Team_080 possession (Score: 99-98)
Khris Turner attempts a Midrange. Wide open! Terry Reaves is 6.2 feet away. [ZONE] KHRIS TURNER MAKES IT! Assist: Draymond Simons
Score: 99-100

[02:06] Team_063 possession (Score: 99-100)
Bradley Davis drives, Lauri Dosunmu stays with him. Bradley Davis attempts a Dunk. Contested by Lauri Dosunmu (5.8 feet, MAN). BRADLEY DAVIS MAKES IT!
Score: 101-100

[01:48] Team_080 possession (Score: 101-100)
Khris Turner attempts a 3Pt. Contested by Malcolm Quickley (5.3 feet, MAN). KHRIS TURNER MAKES IT! Assist: Draymond Simons
Score: 101-103

[01:37] Team_063 possession (Score: 101-103)
Tyler Harris attempts a Layup. Contested by Draymond Simons (5.6 feet, ZONE). Tyler Harris misses. Rebound secured by Draymond Simons.

[01:22] Team_080 possession (Score: 101-103)
Lauri Dosunmu attempts a Midrange. Wide open! Terry Reaves is 6.8 feet away. [ZONE] LAURI DOSUNMU MAKES IT! Assist: Draymond Simons
Score: 101-105

[01:05] Team_063 possession (Score: 101-105)
Dirk Reaves attempts a Midrange. Wide open! Khris Turner is 6.2 feet away. [ZONE] Dirk Reaves misses. Offensive rebound by Malcolm Quickley! Malcolm Quickley kicks it out.

[00:50] Team_063 possession (Score: 101-105)
FOUL! Shooting foul on Draymond Simons. Malcolm Quickley to the line for 2 free throws. [BONUS: 8 team fouls] (Draymond Simons: 4 personal fouls)   FT 1/2: MISS   FT 2/2: GOOD Malcolm Quickley makes 1/2 from the line.
Score: 102-105

[00:36] Team_080 possession (Score: 102-105)
Draymond Simons attempts a Midrange. Wide open! Tyler Harris is 6.3 feet away. [MAN] DRAYMOND SIMONS MAKES IT! Assist: Larry Paul
Score: 102-107

[00:23] Team_063 possession (Score: 102-107)
Dirk Reaves attempts a 3Pt. Contested by Larry Paul (5.1 feet, ZONE). Dirk Reaves misses. Rebound secured by Draymond Simons.

[00:13] Team_080 possession (Score: 102-107)
Jaren Morant attempts a Midrange. Wide open! Dirk Reaves is 6.0 feet away. [MAN] Jaren Morant misses. Rebound secured by Tyler Harris.

================================================================================
                              4TH QUARTER COMPLETE                              
================================================================================

4TH QUARTER SCORE: Team_063 20, Team_080 25

BOX SCORE:
================================================================================

Team_063
--------------------------------------------------------------------------------
Player                MIN  PTS  REB  AST  TO      FG   FG%      3P   3P%
--------------------------------------------------------------------------------
Bradley Davis          46    9    0    0   0   4/5    80.0     0/0   0.0
Tyler Harris           46    7    7    0   0   3/5    60.0     0/0   0.0
Terry Reaves           46    3    0    0   0   1/2    50.0     0/0   0.0
Malcolm Quickley       46    1    2    1   0   1/2    50.0     0/0   0.0
Dirk Reaves            46    0    5    1   0   0/4     0.0     0/0   0.0

TEAM: FG: 9/18 (50.0%), 3PT: 1/7 (14.3%), REB: 14 (4 off, 10 def), AST: 2, TO: 2
TEAM FOULS: 3


Team_080
--------------------------------------------------------------------------------
Player                MIN  PTS  REB  AST  TO      FG   FG%      3P   3P%
--------------------------------------------------------------------------------
Lauri Dosunmu          46    9    0    1   0   4/6    66.7     0/0   0.0
Larry Paul             46    7    2    1   0   3/7    42.9     0/0   0.0
Khris Turner           46    5    0    0   0   2/3    66.7     0/0   0.0
Draymond Simons        46    2    5    4   0   1/3    33.3     0/0   0.0
Jaren Morant           46    0    3    2   0   0/1     0.0     0/0   0.0

TEAM: FG: 10/20 (50.0%), 3PT: 2/7 (28.6%), REB: 10 (1 off, 9 def), AST: 8, TO: 0
TEAM FOULS: 8 [Team_063 in BONUS]

================================================================================

================================================================================
                               FULL GAME COMPLETE                               
================================================================================

FINAL SCORE: Team_063 102, Team_080 107

SCORING BY QUARTER:
--------------------------------------------------------------------------------
Team                     Q1     Q2     Q3     Q4    FINAL
--------------------------------------------------------------------------------
Team_063                 23     26     33     20      102
Team_080                 28     23     31     25      107
--------------------------------------------------------------------------------

FULL GAME BOX SCORE:
================================================================================

Team_063
--------------------------------------------------------------------------------
Player                MIN  PTS  REB  AST  TO      FG   FG%      3P   3P%      FT STL BLK
--------------------------------------------------------------------------------
Bradley Davis          46   18    0    6   0   8/16   50.0   1/6    16.7   5/5     0   0
Malcolm Quickley       46   15   10    3   1   9/13   69.2   1/3    33.3   2/3     0   1
Terry Reaves           46   18    0    3   1   8/16   50.0   4/9    44.4   4/4     0   0
Dirk Reaves            46   16   15    4   1   6/14   42.9   2/6    33.3   5/7     0   2
Tyler Harris           46   25   20    2   2   9/19   47.4   0/3     0.0   5/5     2   3
DeMar Banchero          3    6    0    1   0   2/2   100.0   1/1   100.0   1/1     0   0
Cole Durant             3    0    0    1   1   0/0     0.0   0/0     0.0   0/0     0   0
Jaren James             3    0    0    0   0   0/0     0.0   0/0     0.0   0/0     0   0
Lamelo Ball             3    2    0    1   0   1/1   100.0   0/0     0.0   0/0     0   0
Kyle Green              3    2    2    0   0   1/2    50.0   0/0     0.0   0/0     0   1

TEAM: FG: 44/83 (53.0%), 3PT: 9/28 (32.1%), REB: 47 (12 off, 35 def), AST: 21, TO: 6


Team_080
--------------------------------------------------------------------------------
Player                MIN  PTS  REB  AST  TO      FG   FG%      3P   3P%      FT STL BLK
--------------------------------------------------------------------------------
Lauri Dosunmu          46   22    0    2   1   9/17   52.9   2/9    22.2   4/4     0   0
Khris Turner           46   16    0    1   2   6/15   40.0   2/7    28.6   4/5     1   1
Larry Paul             46   25   11    4   1  10/20   50.0   4/7    57.1  10/13    0   0
Jaren Morant           46   13   10    5   1   6/10   60.0   1/2    50.0   5/5     1   3
Draymond Simons        46   21   22    4   1  10/13   76.9   1/3    33.3   4/5     1   0
Tony James              3    0    0    0   0   0/0     0.0   0/0     0.0   0/0     0   0
Larry Reaves            3    0    0    0   0   0/1     0.0   0/0     0.0   0/0     0   0
Joel Bryant             3    0    0    1   0   0/0     0.0   0/0     0.0   0/0     1   0
Ja Cunningham           3    0    0    0   1   0/0     0.0   0/0     0.0   0/0     0   0
Trae Brogdon            3    3    1    0   0   1/3    33.3   0/0     0.0   0/1     0   0

TEAM: FG: 43/80 (53.8%), 3PT: 10/28 (35.7%), REB: 44 (5 off, 39 def), AST: 17, TO: 7

================================================================================
