================================================================================
                        FULL GAME - Team_073 vs Team_085                        
================================================================================

================================================================================
                       1ST QUARTER - Team_073 vs Team_085                       
================================================================================

[12:00] Team_073 possession (Score: 0-0)
Karl Williamson attempts a Midrange. Contested by Paul Wagner (3.8 feet, ZONE). KARL WILLIAMSON MAKES IT! Assist: Carmelo Young
Score: 2-0

[11:45] Team_085 possession (Score: 2-0)
FOUL! Shooting foul on Bradley Morant. Larry Duncan to the line for 2 free throws. [Team fouls: 1] (Bradley Morant: 1 personal fouls)   FT 1/2: GOOD   FT 2/2: MISS Larry Duncan makes 1/2 from the line. Rebound secured by Bradley Morant.
Score: 2-1

[11:29] Team_073 possession (Score: 2-1)
FOUL! Reach-in foul on Paul Wagner during the drive. [Team fouls: 1] No free throws, side out. (Paul Wagner: 1 personal fouls)

[11:14] Team_073 possession (Score: 2-1)
Bradley Morant attempts a Midrange. Contested by Magic Beal (4.4 feet, ZONE). BRADLEY MORANT MAKES IT!
Score: 4-1

[11:00] Team_085 possession (Score: 4-1)
Paul Wagner attempts a Layup. Contested by Bradley Morant (4.2 feet, ZONE). Paul Wagner misses. Offensive rebound by Paul Wagner! Paul Wagner kicks it out.

[10:42] Team_085 possession (Score: 4-1)
Stephen Bird attempts a 3Pt. Contested by Karl Williamson (3.3 feet, ZONE). STEPHEN BIRD MAKES IT! Assist: Larry Duncan
Score: 4-4

[10:27] Team_073 possession (Score: 4-4)
Isaiah Smith attempts a 3Pt. Contested by Stephen Bird (3.6 feet, MAN). Isaiah Smith misses. Rebound secured by Collin Mobley.

[10:09] Team_085 possession (Score: 4-4)
Paul Wagner drives and kicks out. Stephen Bird attempts a 3Pt. Contested by Karl Williamson (3.1 feet, ZONE). Stephen Bird misses. Rebound secured by Carmelo Porzingis.

[09:55] Team_073 possession (Score: 4-4)
Carmelo Young attempts a Midrange. Contested by Stephen Bird (3.6 feet, ZONE). CARMELO YOUNG MAKES IT! Assist: Carmelo Porzingis
Score: 6-4

[09:40] Team_085 possession (Score: 6-4)
Stephen Bird attempts a 3Pt. Contested by Karl Williamson (3.3 feet, ZONE). Stephen Bird misses. Rebound secured by Bradley Morant.

[09:25] Team_073 possession (Score: 6-4)
Carmelo Porzingis attempts a Layup. Contested by Paul Wagner (3.6 feet, MAN). CARMELO PORZINGIS MAKES IT! Assist: Carmelo Young
Score: 8-4

[09:07] Team_085 possession (Score: 8-4)
Paul Wagner attempts a 3Pt. Contested by Karl Williamson (3.4 feet, ZONE). Paul Wagner misses. Rebound secured by Carmelo Porzingis.

[08:54] Team_073 possession (Score: 8-4)
Carmelo Porzingis commits a violation (traveling/carry)! TURNOVER! (dead ball)

[08:38] Team_085 possession (Score: 8-4)
Stephen Bird drives, picks up Carmelo Porzingis. Help arrives from Isaiah Smith! Stephen Bird attempts a Dunk. Contested by Isaiah Smith (4.0 feet, ZONE). STEPHEN BIRD MAKES IT!
Score: 8-6

[08:20] Team_073 possession (Score: 8-6)
Bradley Morant attempts a Midrange. Contested by Larry Duncan (3.4 feet, ZONE). Bradley Morant misses. Rebound secured by Larry Duncan.

[08:06] Team_085 possession (Score: 8-6)
Paul Wagner commits a violation (traveling/carry)! TURNOVER! (dead ball)

[07:54] Team_073 possession (Score: 8-6)
Karl Williamson drives and kicks out. Carmelo Young attempts a 3Pt. Contested by Magic Beal (4.0 feet, MAN). Carmelo Young misses. Rebound secured by Paul Wagner.

[07:35] Team_085 possession (Score: 8-6)
Larry Duncan drives and kicks out. Collin Mobley attempts a 3Pt. Contested by Karl Williamson (3.1 feet, ZONE). Collin Mobley misses. Offensive rebound by Paul Wagner! Paul Wagner kicks it out.

[07:19] Team_085 possession (Score: 8-6)
Collin Mobley drives and kicks out. Collin Mobley attempts a 3Pt. Contested by Bradley Morant (3.9 feet, MAN). COLLIN MOBLEY MAKES IT! Assist: Stephen Bird
Score: 8-9

[07:05] Team_073 possession (Score: 8-9)
Isaiah Smith drives and kicks out. Carmelo Porzingis attempts a 3Pt. Contested by Paul Wagner (3.5 feet, MAN). Carmelo Porzingis misses. Rebound secured by Collin Mobley.

[06:45] Team_085 possession (Score: 8-9)
Paul Wagner drives, Carmelo Porzingis stays with him. Paul Wagner attempts a Dunk. Contested by Carmelo Porzingis (4.0 feet, MAN). Paul Wagner misses. Offensive rebound by Paul Wagner! Paul Wagner kicks it out.

[06:28] Team_085 possession (Score: 8-9)
Stephen Bird drives, Bradley Morant stays with him. Stephen Bird attempts a Layup. Contested by Bradley Morant (4.2 feet, ZONE). Stephen Bird misses. Offensive rebound by Paul Wagner! Paul Wagner kicks it out.

[06:16] Team_085 possession (Score: 8-9)
Larry Duncan attempts a 3Pt. Contested by Carmelo Porzingis (4.1 feet, ZONE). Larry Duncan misses. Rebound secured by Isaiah Smith.

[06:02] Team_073 possession (Score: 8-9)
Bradley Morant attempts a Midrange. Contested by Collin Mobley (4.3 feet, MAN). BRADLEY MORANT MAKES IT!
Score: 10-9

[05:43] Team_085 possession (Score: 10-9)
Collin Mobley attempts a Layup. Contested by Bradley Morant (3.8 feet, MAN). COLLIN MOBLEY MAKES IT! Assist: Magic Beal
Score: 10-11

[05:30] Team_073 possession (Score: 10-11)
Bradley Morant attempts a Layup. Contested by Collin Mobley (4.3 feet, MAN). BRADLEY MORANT MAKES IT! Assist: Carmelo Young
Score: 12-11

[05:20] Team_085 possession (Score: 12-11)
Larry Duncan attempts a 3Pt. Contested by Karl Williamson (3.4 feet, MAN). Larry Duncan misses. Offensive rebound by Larry Duncan! Larry Duncan kicks it out.

[05:08] Team_085 possession (Score: 12-11)
Larry Duncan attempts a 3Pt. Contested by Karl Williamson (3.4 feet, ZONE). Larry Duncan misses. Rebound secured by Bradley Morant.

[04:52] Team_073 possession (Score: 12-11)
Isaiah Smith attempts a 3Pt. Contested by Larry Duncan (3.2 feet, ZONE). Isaiah Smith misses. Rebound secured by Paul Wagner.

[04:42] Team_085 possession (Score: 12-11)
FOUL! Shooting foul on Karl Williamson. Stephen Bird to the line for 3 free throws. [Team fouls: 2] (Karl Williamson: 1 personal fouls)   FT 1/3: MISS   FT 2/3: GOOD   FT 3/3: GOOD Stephen Bird makes 2/3 from the line.
Score: 12-13

[04:25] Team_073 possession (Score: 12-13)
Karl Williamson attempts a 3Pt. Contested by Magic Beal (4.3 feet, ZONE). Karl Williamson misses. Rebound secured by Collin Mobley.

[04:12] Team_085 possession (Score: 12-13)
FOUL! Shooting foul on Karl Williamson. Larry Duncan to the line for 2 free throws. [Team fouls: 3] (Karl Williamson: 2 personal fouls)   FT 1/2: GOOD   FT 2/2: GOOD Larry Duncan makes 2/2 from the line.
Score: 12-15

[03:55] Team_073 possession (Score: 12-15)
FOUL! Reach-in foul on Paul Wagner during the drive. [Team fouls: 2] No free throws, side out. (Paul Wagner: 2 personal fouls)

[03:40] Team_073 possession (Score: 12-15)
Isaiah Smith attempts a 3Pt. Contested by Stephen Bird (3.7 feet, ZONE). Isaiah Smith misses. Rebound secured by Larry Duncan.

[03:26] Team_085 possession (Score: 12-15)
Stephen Bird attempts a Layup. BLOCKED BY ISAIAH SMITH! Ball deflects out of bounds off Stephen Bird.

[03:09] Team_073 possession (Score: 12-15)
Carmelo Porzingis makes the Midrange and draws the foul on Paul Wagner! And-1! Carmelo Porzingis to the line for 1. [Team fouls: 3] (Paul Wagner: 3 personal fouls)   FT 1/1: GOOD Carmelo Porzingis makes 1/1 from the line.
Score: 15-15

[02:55] Team_085 possession (Score: 15-15)
Larry Duncan makes the Layup and draws the foul on Bradley Morant! And-1! Larry Duncan to the line for 1. [Team fouls: 4] (Bradley Morant: 2 personal fouls)   FT 1/1: GOOD Larry Duncan makes 1/1 from the line.
Score: 15-18

[02:41] Team_073 possession (Score: 15-18)
Carmelo Young attempts a 3Pt. Contested by Magic Beal (4.4 feet, MAN). Carmelo Young misses. Offensive rebound by Bradley Morant! Bradley Morant kicks it out.

[02:28] Team_073 possession (Score: 15-18)
Carmelo Porzingis attempts a Midrange. Contested by Paul Wagner (3.8 feet, MAN). Carmelo Porzingis misses. Rebound secured by Collin Mobley.

[02:13] Team_085 possession (Score: 15-18)
Paul Wagner attempts a 3Pt. Contested by Karl Williamson (3.6 feet, ZONE). Paul Wagner misses. Rebound secured by Carmelo Porzingis.

[02:00] Team_073 possession (Score: 15-18)
Bradley Morant makes the Layup and draws the foul on Collin Mobley! And-1! Bradley Morant to the line for 1. [Team fouls: 4] (Collin Mobley: 1 personal fouls)   FT 1/1: GOOD Bradley Morant makes 1/1 from the line.
Score: 18-18

[01:49] Team_085 possession (Score: 18-18)
Magic Beal attempts a Layup. BLOCKED BY ISAIAH SMITH! Ball is loose! Rebound secured by Isaiah Smith.

[01:36] Team_073 possession (Score: 18-18)
Isaiah Smith attempts a 3Pt. Contested by Magic Beal (4.5 feet, ZONE). Isaiah Smith misses. Rebound secured by Larry Duncan.

[01:23] Team_085 possession (Score: 18-18)
Magic Beal drives, Bradley Morant stays with him. Magic Beal attempts a Dunk. Contested by Bradley Morant (4.6 feet, ZONE). MAGIC BEAL MAKES IT! Assist: Larry Duncan
Score: 18-20

[01:09] Team_073 possession (Score: 18-20)
Bradley Morant attempts a Midrange. Contested by Collin Mobley (4.7 feet, MAN). Bradley Morant misses. Rebound secured by Collin Mobley.

[00:50] Team_085 possession (Score: 18-20)
Larry Duncan attempts a Midrange. Contested by Karl Williamson (3.8 feet, MAN). Larry Duncan misses. Rebound secured by Bradley Morant.

[00:33] Team_073 possession (Score: 18-20)
FOUL! Shooting foul on Paul Wagner. Carmelo Young to the line for 3 free throws. [BONUS: 5 team fouls] (Paul Wagner: 4 personal fouls)   FT 1/3: GOOD   FT 2/3: MISS   FT 3/3: GOOD Carmelo Young makes 2/3 from the line.
Score: 20-20

[00:19] Team_085 possession (Score: 20-20)
Stephen Bird attempts a 3Pt. Contested by Karl Williamson (3.8 feet, ZONE). Stephen Bird misses. Offensive rebound by Paul Wagner! Paul Wagner kicks it out.

[00:04] Team_085 possession (Score: 20-20)
Collin Mobley drives and kicks out. Stephen Bird attempts a 3Pt. Contested by Karl Williamson (3.6 feet, ZONE). Stephen Bird misses. Rebound secured by Isaiah Smith.

================================================================================
                              1ST QUARTER COMPLETE                              
================================================================================

1ST QUARTER SCORE: Team_073 20, Team_085 20

BOX SCORE:
================================================================================

Team_073
--------------------------------------------------------------------------------
Player                MIN  PTS  REB  AST  TO      FG   FG%      3P   3P%
--------------------------------------------------------------------------------
Bradley Morant         12    9    5    0   0   4/6    66.7     0/0   0.0
Carmelo Porzingis      12    5    3    1   0   2/3    66.7     0/0   0.0
Carmelo Young          12    4    0    3   0   2/2   100.0     0/0   0.0
Karl Williamson        12    2    0    0   0   1/3    33.3     0/0   0.0
Isaiah Smith           12    0    3    0   0   0/5     0.0     0/0   0.0

TEAM: FG: 9/19 (47.4%), 3PT: 1/6 (16.7%), REB: 11 (1 off, 10 def), AST: 4, TO: 1
TEAM FOULS: 4


Team_085
--------------------------------------------------------------------------------
Player                MIN  PTS  REB  AST  TO      FG   FG%      3P   3P%
--------------------------------------------------------------------------------
Stephen Bird           12    7    0    1   0   3/5    60.0     0/0   0.0
Larry Duncan           12    5    4    2   0   2/6    33.3     0/0   0.0
Collin Mobley          12    5    5    0   0   2/3    66.7     0/0   0.0
Magic Beal             12    2    0    1   0   1/2    50.0     0/0   0.0
Paul Wagner            12    0    7    0   0   0/3     0.0     0/0   0.0

TEAM: FG: 8/19 (42.1%), 3PT: 2/7 (28.6%), REB: 16 (6 off, 10 def), AST: 4, TO: 1
TEAM FOULS: 5 [Team_073 in BONUS]

================================================================================

================================================================================
                       2ND QUARTER - Team_073 vs Team_085                       
================================================================================

[12:00] Team_073 possession (Score: 20-20)
Carmelo Porzingis attempts a Layup. Contested by Paul Wagner (3.8 feet, MAN). Carmelo Porzingis misses. Rebound secured by Collin Mobley.

[11:47] Team_085 possession (Score: 20-20)
Larry Duncan attempts a 3Pt. Contested by Karl Williamson (3.7 feet, ZONE). Larry Duncan misses. Offensive rebound by Larry Duncan! Larry Duncan kicks it out.

[11:33] Team_085 possession (Score: 20-20)
Magic Beal attempts a 3Pt. Contested by Carmelo Young (5.3 feet, MAN). Magic Beal misses. FOUL! Loose ball foul on Isaiah Smith during the rebound battle. [Team fouls: 1] No free throws, side out. (Isaiah Smith: 1 personal fouls)

[11:13] Team_085 possession (Score: 20-20)
Paul Wagner attempts a Layup. Contested by Carmelo Porzingis (4.3 feet, MAN). PAUL WAGNER MAKES IT! Assist: Collin Mobley
Score: 20-22

[10:54] Team_073 possession (Score: 20-22)
FOUL! Reach-in foul on Larry Duncan during the drive. [Team fouls: 1] No free throws, side out. (Larry Duncan: 1 personal fouls)

[10:44] Team_073 possession (Score: 20-22)
Bradley Morant drives, Collin Mobley stays with him. Bradley Morant attempts a Dunk. Contested by Collin Mobley (4.7 feet, MAN). BRADLEY MORANT MAKES IT! Assist: Isaiah Smith
Score: 22-22

[10:29] Team_085 possession (Score: 22-22)
Magic Beal attempts a Layup. Contested by Carmelo Young (5.4 feet, MAN). MAGIC BEAL MAKES IT! Assist: Larry Duncan
Score: 22-24

[10:15] Team_073 possession (Score: 22-24)
Bradley Morant drives, Paul Wagner stays with him. Bradley Morant attempts a Dunk. Contested by Paul Wagner (4.2 feet, ZONE). BRADLEY MORANT MAKES IT!
Score: 24-24

[09:59] Team_085 possession (Score: 24-24)
Magic Beal attempts a 3Pt. Contested by Karl Williamson (4.0 feet, ZONE). Magic Beal misses. Rebound secured by Bradley Morant.

[09:46] Team_073 possession (Score: 24-24)
Bradley Morant drives, Paul Wagner stays with him. Bradley Morant attempts a Dunk. Contested by Paul Wagner (4.3 feet, ZONE). BRADLEY MORANT MAKES IT!
Score: 26-24

[09:33] Team_085 possession (Score: 26-24)
Paul Wagner attempts a Midrange. Contested by Carmelo Porzingis (4.5 feet, MAN). Paul Wagner misses. Rebound secured by Isaiah Smith.

[09:20] Team_073 possession (Score: 26-24)
Bradley Morant attempts a Midrange. Contested by Collin Mobley (4.9 feet, MAN). BRADLEY MORANT MAKES IT!
Score: 28-24

[09:06] Team_085 possession (Score: 28-24)
FOUL! Holding foul on Bradley Morant. [Team fouls: 2] No free throws, side out. (Bradley Morant: 1 personal fouls)

[08:50] Team_085 possession (Score: 28-24)
Paul Wagner drives to the basket... FOUL! Offensive foul on Paul Wagner! Bradley Morant drew the charge! [Team fouls: 2] (Paul Wagner: 1 personal fouls) TURNOVER! (dead ball)

[08:32] Team_073 possession (Score: 28-24)
Carmelo Young attempts a 3Pt. Contested by Magic Beal (4.8 feet, MAN). Carmelo Young misses. Rebound secured by Collin Mobley.

[08:18] Team_085 possession (Score: 28-24)
Larry Duncan attempts a 3Pt. Contested by Karl Williamson (4.1 feet, MAN). Larry Duncan misses. Rebound secured by Isaiah Smith.

[08:06] Team_073 possession (Score: 28-24)
Carmelo Young attempts a 3Pt. Contested by Magic Beal (4.9 feet, ZONE). CARMELO YOUNG MAKES IT! Assist: Bradley Morant
Score: 31-24

[07:49] Team_085 possession (Score: 31-24)
Paul Wagner loses the ball! Stripped by Carmelo Porzingis! TURNOVER! (live ball)

[07:36] Team_073 possession (Score: 31-24)
Carmelo Porzingis attempts a Layup. BLOCKED BY MAGIC BEAL! Ball deflects out of bounds off Carmelo Porzingis.

[07:19] Team_085 possession (Score: 31-24)
Stephen Bird attempts a Layup. Contested by Bradley Morant (4.9 feet, ZONE). STEPHEN BIRD MAKES IT! Assist: Collin Mobley
Score: 31-26

[07:08] Team_073 possession (Score: 31-26)
FOUL! Shooting foul on Paul Wagner. Carmelo Porzingis to the line for 2 free throws. [Team fouls: 3] (Paul Wagner: 2 personal fouls)   FT 1/2: GOOD   FT 2/2: GOOD Carmelo Porzingis makes 2/2 from the line.
Score: 33-26

[06:52] Team_085 possession (Score: 33-26)
Stephen Bird attempts a 3Pt. Contested by Isaiah Smith (5.2 feet, MAN). STEPHEN BIRD MAKES IT! Assist: Collin Mobley
Score: 33-29

[06:33] Team_073 possession (Score: 33-29)
Carmelo Young drives and kicks out. Bradley Morant attempts a Midrange. Contested by Collin Mobley (5.1 feet, MAN). Bradley Morant misses. Offensive rebound by Carmelo Porzingis! Carmelo Porzingis kicks it out.

[06:20] Team_073 possession (Score: 33-29)
Karl Williamson attempts a Midrange. Contested by Larry Duncan (4.3 feet, MAN). KARL WILLIAMSON MAKES IT!
Score: 35-29

[06:07] Team_085 possession (Score: 35-29)
Larry Duncan makes the 3Pt and draws the foul on Karl Williamson! And-1! Larry Duncan to the line for 1. [Team fouls: 3] (Karl Williamson: 1 personal fouls)   FT 1/1: GOOD Larry Duncan makes 1/1 from the line.
Score: 35-33

[05:52] Team_073 possession (Score: 35-33)
Isaiah Smith attempts a 3Pt. Contested by Stephen Bird (4.8 feet, MAN). ISAIAH SMITH MAKES IT! Assist: Bradley Morant
Score: 38-33

[05:38] Team_085 possession (Score: 38-33)
Magic Beal attempts a 3Pt. Contested by Carmelo Young (5.9 feet, MAN). Magic Beal misses. Rebound secured by Bradley Morant.

[05:24] Team_073 possession (Score: 38-33)
Carmelo Young drives to the basket... Carmelo Young throws a bad pass out of bounds! TURNOVER! (dead ball)

[05:24] Substitution (Team_073): Carmelo Young OUT → Zach Quickley IN (stamina_rule2)

[05:24] Substitution (Team_073): Isaiah Smith OUT → Luka Butler IN (stamina_rule2)

[05:24] Substitution (Team_073): Karl Williamson OUT → Dwyane McCollum IN (stamina_rule2)

[05:24] Substitution (Team_073): Carmelo Porzingis OUT → Shai Thompson IN (stamina_rule2)

[05:24] Substitution (Team_073): Bradley Morant OUT → Ja Rose IN (stamina_rule2)

[05:24] Substitution (Team_085): Magic Beal OUT → Khris Brogdon IN (stamina_rule2)

[05:24] Substitution (Team_085): Stephen Bird OUT → Jordan Morant IN (stamina_rule2)

[05:24] Substitution (Team_085): Larry Duncan OUT → Giannis Johnson IN (stamina_rule2)

[05:24] Substitution (Team_085): Paul Wagner OUT → Jalen Leonard IN (stamina_rule2)

[05:24] Substitution (Team_085): Collin Mobley OUT → Malcolm Beal IN (stamina_rule2)

[05:11] Team_085 possession (Score: 38-33)
Jalen Leonard drives to the basket... FOUL! Offensive foul on Jalen Leonard! Shai Thompson drew the charge! [Team fouls: 4] (Jalen Leonard: 1 personal fouls) TURNOVER! (dead ball)

[05:01] Team_073 possession (Score: 38-33)
Luka Butler drives to the basket... Luka Butler throws a bad pass! Stolen by Malcolm Beal! TURNOVER! (live ball)

[04:44] Team_085 possession (Score: 38-33)
Khris Brogdon attempts a 3Pt. Contested by Zach Quickley (4.3 feet, MAN). KHRIS BROGDON MAKES IT! Assist: Jalen Leonard
Score: 38-36

[04:33] Team_073 possession (Score: 38-36)
FOUL! Holding foul on Khris Brogdon. [IN THE BONUS! 5 team fouls] Zach Quickley to the line for 2 free throws. (Khris Brogdon: 1 personal fouls)   FT 1/2: GOOD   FT 2/2: GOOD Zach Quickley makes 2/2 from the line.
Score: 40-36

[04:21] Team_085 possession (Score: 40-36)
Giannis Johnson attempts a 3Pt. Contested by Luka Butler (4.4 feet, ZONE). Giannis Johnson misses. Rebound secured by Shai Thompson.

[04:04] Team_073 possession (Score: 40-36)
Shai Thompson attempts a Midrange. Contested by Malcolm Beal (4.5 feet, ZONE). Shai Thompson misses. Rebound secured by Jalen Leonard.

[03:45] Team_085 possession (Score: 40-36)
Jordan Morant drives to the basket... Jordan Morant loses the ball! Stripped by Luka Butler! TURNOVER! (live ball)

[03:30] Team_073 possession (Score: 40-36)
Luka Butler attempts a Midrange. Contested by Jordan Morant (4.0 feet, MAN). Luka Butler misses. Rebound secured by Jalen Leonard.

[03:17] Team_085 possession (Score: 40-36)
Malcolm Beal drives, Ja Rose stays with him. Malcolm Beal attempts a Layup. Contested by Ja Rose (5.1 feet, MAN). MALCOLM BEAL MAKES IT!
Score: 40-38

[03:07] Team_073 possession (Score: 40-38)
Shai Thompson attempts a 3Pt. Contested by Jordan Morant (3.7 feet, ZONE). Shai Thompson misses. Rebound secured by Jalen Leonard.

[02:54] Team_085 possession (Score: 40-38)
Giannis Johnson attempts a Midrange. BLOCKED BY ZACH QUICKLEY! Ball is loose! Offensive rebound by Malcolm Beal! Malcolm Beal kicks it out.

[02:42] Team_085 possession (Score: 40-38)
Giannis Johnson attempts a 3Pt. Contested by Dwyane McCollum (4.1 feet, MAN). GIANNIS JOHNSON MAKES IT! Assist: Jordan Morant
Score: 40-41

[02:25] Team_073 possession (Score: 40-41)
Shai Thompson attempts a 3Pt. Contested by Jalen Leonard (4.3 feet, MAN). SHAI THOMPSON MAKES IT! Assist: Luka Butler
Score: 43-41

[02:13] Team_085 possession (Score: 43-41)
FOUL! Holding foul on Luka Butler. [IN THE BONUS! 5 team fouls] Jordan Morant to the line for 2 free throws. (Luka Butler: 1 personal fouls)   FT 1/2: MISS   FT 2/2: GOOD Jordan Morant makes 1/2 from the line.
Score: 43-42

[01:57] Team_073 possession (Score: 43-42)
Luka Butler drives and kicks out. Shai Thompson makes the Midrange and draws the foul on Jalen Leonard! And-1! Shai Thompson to the line for 1. [BONUS: 6 team fouls] (Jalen Leonard: 2 personal fouls)   FT 1/1: GOOD Shai Thompson makes 1/1 from the line.
Score: 46-42

[01:45] Team_085 possession (Score: 46-42)
Jordan Morant throws a bad pass out of bounds! TURNOVER! (dead ball)

[01:31] Team_073 possession (Score: 46-42)
Ja Rose makes the Layup and draws the foul on Jordan Morant! And-1! Ja Rose to the line for 1. [BONUS: 7 team fouls] (Jordan Morant: 1 personal fouls)   FT 1/1: GOOD Ja Rose makes 1/1 from the line.
Score: 49-42

[01:20] Team_085 possession (Score: 49-42)
Malcolm Beal drives, Ja Rose stays with him. Malcolm Beal attempts a Dunk. Contested by Ja Rose (5.1 feet, MAN). MALCOLM BEAL MAKES IT! Assist: Khris Brogdon
Score: 49-44

[01:03] Team_073 possession (Score: 49-44)
Ja Rose attempts a Midrange. Contested by Jalen Leonard (4.3 feet, ZONE). Ja Rose misses. Rebound secured by Malcolm Beal.

[00:50] Team_085 possession (Score: 49-44)
FOUL! Offensive foul on Jordan Morant! Luka Butler drew the charge! [Team fouls: 8] (Jordan Morant: 2 personal fouls) TURNOVER! (dead ball)

[00:35] Team_073 possession (Score: 49-44)
Ja Rose attempts a Midrange. Contested by Malcolm Beal (4.5 feet, MAN). JA ROSE MAKES IT!
Score: 51-44

[00:20] Team_085 possession (Score: 51-44)
Jalen Leonard attempts a 3Pt. Contested by Luka Butler (4.7 feet, ZONE). Jalen Leonard misses. Rebound secured by Shai Thompson.

[00:04] Team_073 possession (Score: 51-44)
Zach Quickley attempts a Midrange. Contested by Khris Brogdon (5.8 feet, MAN). Zach Quickley misses. Rebound secured by Jalen Leonard.

================================================================================
                              2ND QUARTER COMPLETE                              
================================================================================

2ND QUARTER SCORE: Team_073 31, Team_085 24

BOX SCORE:
================================================================================

Team_073
--------------------------------------------------------------------------------
Player                MIN  PTS  REB  AST  TO      FG   FG%      3P   3P%
--------------------------------------------------------------------------------
Bradley Morant         19    8    2    2   0   4/4   100.0     0/0   0.0
Shai Thompson           5    6    2    0   0   2/4    50.0     0/0   0.0
Ja Rose                 5    5    0    0   0   2/3    66.7     0/0   0.0
Isaiah Smith           19    3    2    1   0   1/1   100.0     0/0   0.0
Carmelo Young          19    3    0    0   0   1/2    50.0     0/0   0.0
Carmelo Porzingis      19    2    1    0   0   1/3    33.3     0/0   0.0
Karl Williamson        19    2    0    0   0   1/1   100.0     0/0   0.0
Zach Quickley           5    2    0    0   0   1/2    50.0     0/0   0.0
Luka Butler             5    0    0    1   0   0/1     0.0     0/0   0.0

TEAM: FG: 13/21 (61.9%), 3PT: 3/5 (60.0%), REB: 7 (1 off, 6 def), AST: 4, TO: 2
TEAM FOULS: 5 [Team_085 in BONUS]


Team_085
--------------------------------------------------------------------------------
Player                MIN  PTS  REB  AST  TO      FG   FG%      3P   3P%
--------------------------------------------------------------------------------
Stephen Bird           19    5    0    0   0   2/2   100.0     0/0   0.0
Larry Duncan           19    4    2    1   0   1/2    50.0     0/0   0.0
Malcolm Beal            5    4    2    0   0   2/2   100.0     0/0   0.0
Khris Brogdon           5    3    0    1   0   1/1   100.0     0/0   0.0
Giannis Johnson         5    3    0    0   0   1/2    50.0     0/0   0.0
Paul Wagner            19    2    0    0   0   1/2    50.0     0/0   0.0
Magic Beal             19    2    0    0   0   1/3    33.3     0/0   0.0
Jordan Morant           5    1    0    1   0   1/1   100.0     0/0   0.0
Collin Mobley          19    0    2    3   0   0/0     0.0     0/0   0.0
Jalen Leonard           5    0    4    1   0   0/1     0.0     0/0   0.0

TEAM: FG: 10/16 (62.5%), 3PT: 4/9 (44.4%), REB: 10 (3 off, 7 def), AST: 7, TO: 6
TEAM FOULS: 8 [Team_073 in BONUS]

================================================================================

================================================================================
                       3RD QUARTER - Team_073 vs Team_085                       
================================================================================

[12:00] Team_073 possession (Score: 51-44)
Isaiah Smith drives and kicks out. Isaiah Smith attempts a 3Pt. Contested by Stephen Bird (3.4 feet, MAN). Isaiah Smith misses. Rebound secured by Collin Mobley.

[11:42] Team_085 possession (Score: 51-44)
Larry Duncan drives to the basket... Larry Duncan throws a bad pass! Stolen by Bradley Morant! TURNOVER! (live ball)

[11:23] Team_073 possession (Score: 51-44)
Carmelo Young attempts a Layup. Contested by Paul Wagner (3.7 feet, ZONE). Carmelo Young misses. Offensive rebound by Carmelo Porzingis! Carmelo Porzingis kicks it out.

[11:08] Team_073 possession (Score: 51-44)
Isaiah Smith throws a bad pass out of bounds! TURNOVER! (dead ball)

[10:57] Team_085 possession (Score: 51-44)
Larry Duncan attempts a Midrange. Contested by Karl Williamson (3.4 feet, MAN). Larry Duncan misses. Rebound secured by Carmelo Porzingis.

[10:48] Team_073 possession (Score: 51-44)
Bradley Morant makes the Dunk and draws the foul on Collin Mobley! And-1! Bradley Morant to the line for 1. [Team fouls: 1] (Collin Mobley: 1 personal fouls)   FT 1/1: GOOD Bradley Morant makes 1/1 from the line.
Score: 54-44

[10:37] Team_085 possession (Score: 54-44)
Magic Beal attempts a 3Pt. Contested by Karl Williamson (3.5 feet, ZONE). Magic Beal misses. Rebound secured by Carmelo Porzingis.

[10:19] Team_073 possession (Score: 54-44)
Carmelo Porzingis drives, Paul Wagner stays with him. Carmelo Porzingis attempts a Layup. Contested by Paul Wagner (3.6 feet, MAN). CARMELO PORZINGIS MAKES IT!
Score: 56-44

[10:02] Team_085 possession (Score: 56-44)
Magic Beal drives and kicks out. Magic Beal attempts a 3Pt. Contested by Carmelo Young (4.5 feet, MAN). Magic Beal misses. Offensive rebound by Larry Duncan! Larry Duncan kicks it out.

[09:44] Team_085 possession (Score: 56-44)
FOUL! Reach-in foul on Bradley Morant during the drive. [Team fouls: 1] No free throws, side out. (Bradley Morant: 1 personal fouls)

[09:27] Team_085 possession (Score: 56-44)
Stephen Bird attempts a Layup. Contested by Isaiah Smith (4.5 feet, MAN). STEPHEN BIRD MAKES IT!
Score: 56-46

[09:12] Team_073 possession (Score: 56-46)
Isaiah Smith attempts a 3Pt. Contested by Magic Beal (4.2 feet, ZONE). Isaiah Smith misses. Offensive rebound by Carmelo Porzingis! Carmelo Porzingis kicks it out.

[09:02] Team_073 possession (Score: 56-46)
Carmelo Porzingis drives, Paul Wagner stays with him. Carmelo Porzingis attempts a Dunk. Contested by Paul Wagner (3.6 feet, ZONE). Carmelo Porzingis misses. Rebound secured by Collin Mobley.

[08:53] Team_085 possession (Score: 56-46)
FOUL! Reach-in foul on Bradley Morant during the drive. [Team fouls: 2] No free throws, side out. (Bradley Morant: 2 personal fouls)

[08:38] Team_085 possession (Score: 56-46)
Larry Duncan attempts a 3Pt. Contested by Karl Williamson (3.4 feet, MAN). Larry Duncan misses. Offensive rebound by Larry Duncan! Larry Duncan kicks it out.

[08:24] Team_085 possession (Score: 56-46)
Paul Wagner attempts a 3Pt. Contested by Karl Williamson (3.4 feet, ZONE). Paul Wagner misses. Rebound secured by Isaiah Smith.

[08:13] Team_073 possession (Score: 56-46)
FOUL! Reach-in foul on Paul Wagner during the drive. [Team fouls: 2] No free throws, side out. (Paul Wagner: 1 personal fouls)

[08:00] Team_073 possession (Score: 56-46)
Bradley Morant attempts a 3Pt. Contested by Paul Wagner (3.9 feet, ZONE). Bradley Morant misses. Rebound secured by Larry Duncan.

[07:47] Team_085 possession (Score: 56-46)
Stephen Bird attempts a 3Pt. Contested by Isaiah Smith (4.5 feet, MAN). STEPHEN BIRD MAKES IT! Assist: Magic Beal
Score: 56-49

[07:34] Team_073 possession (Score: 56-49)
Karl Williamson attempts a Midrange. Contested by Larry Duncan (3.3 feet, MAN). Karl Williamson misses. Offensive rebound by Carmelo Porzingis! Carmelo Porzingis kicks it out.

[07:17] Team_073 possession (Score: 56-49)
Carmelo Young attempts a Layup. Contested by Paul Wagner (3.7 feet, ZONE). CARMELO YOUNG MAKES IT! Assist: Isaiah Smith
Score: 58-49

[07:02] Team_085 possession (Score: 58-49)
Larry Duncan attempts a 3Pt. Contested by Karl Williamson (3.4 feet, ZONE). Larry Duncan misses. Rebound secured by Isaiah Smith.

[06:46] Team_073 possession (Score: 58-49)
Carmelo Porzingis attempts a 3Pt. Contested by Magic Beal (4.1 feet, ZONE). Carmelo Porzingis misses. Offensive rebound by Bradley Morant! Bradley Morant kicks it out.

[06:30] Team_073 possession (Score: 58-49)
Carmelo Young drives, picks up Magic Beal. Help arrives from Larry Duncan! Carmelo Young attempts a Dunk. Contested by Larry Duncan (4.2 feet, MAN). CARMELO YOUNG MAKES IT!
Score: 60-49

[06:17] Team_085 possession (Score: 60-49)
FOUL! Shooting foul on Carmelo Porzingis. Paul Wagner to the line for 2 free throws. [Team fouls: 3] (Carmelo Porzingis: 1 personal fouls)   FT 1/2: MISS   FT 2/2: GOOD Paul Wagner makes 1/2 from the line.
Score: 60-50

[06:01] Team_073 possession (Score: 60-50)
Carmelo Young attempts a 3Pt. Contested by Magic Beal (4.2 feet, MAN). Carmelo Young misses. Rebound secured by Paul Wagner.

[05:43] Team_085 possession (Score: 60-50)
Collin Mobley makes the Layup and draws the foul on Bradley Morant! And-1! Collin Mobley to the line for 1. [Team fouls: 4] (Bradley Morant: 3 personal fouls)   FT 1/1: GOOD Collin Mobley makes 1/1 from the line.
Score: 60-53

[05:30] Team_073 possession (Score: 60-53)
Carmelo Young throws a bad pass! Stolen by Magic Beal! TURNOVER! (live ball)

[05:20] Team_085 possession (Score: 60-53)
Paul Wagner drives, picks up Carmelo Porzingis. Help arrives from Isaiah Smith! Paul Wagner attempts a Dunk. Contested by Isaiah Smith (4.0 feet, MAN). PAUL WAGNER MAKES IT!
Score: 60-55

[05:09] Team_073 possession (Score: 60-55)
Isaiah Smith attempts a 3Pt. Contested by Stephen Bird (3.6 feet, MAN). Isaiah Smith misses. Rebound secured by Paul Wagner.

[04:57] Team_085 possession (Score: 60-55)
Stephen Bird attempts a 3Pt. Contested by Karl Williamson (3.4 feet, ZONE). Stephen Bird misses. Rebound secured by Isaiah Smith.

[04:39] Team_073 possession (Score: 60-55)
Karl Williamson attempts a Layup. BLOCKED BY PAUL WAGNER! Ball deflects out of bounds off Karl Williamson.

[04:22] Team_085 possession (Score: 60-55)
Magic Beal attempts a 3Pt. Contested by Karl Williamson (3.6 feet, ZONE). Magic Beal misses. Rebound secured by Bradley Morant.

[04:08] Team_073 possession (Score: 60-55)
Carmelo Young attempts a Midrange. Contested by Magic Beal (4.3 feet, MAN). CARMELO YOUNG MAKES IT! Assist: Carmelo Porzingis
Score: 62-55

[03:53] Team_085 possession (Score: 62-55)
Paul Wagner attempts a 3Pt. Contested by Carmelo Porzingis (4.1 feet, MAN). Paul Wagner misses. Rebound secured by Carmelo Porzingis.

[03:35] Team_073 possession (Score: 62-55)
Bradley Morant drives, Collin Mobley stays with him. Bradley Morant attempts a Dunk. Contested by Collin Mobley (4.4 feet, MAN). BRADLEY MORANT MAKES IT! Assist: Isaiah Smith
Score: 64-55

[03:19] Team_085 possession (Score: 64-55)
Magic Beal makes the Layup and draws the foul on Bradley Morant! And-1! Magic Beal to the line for 1. [BONUS: 5 team fouls] (Bradley Morant: 4 personal fouls)   FT 1/1: GOOD Magic Beal makes 1/1 from the line.
Score: 64-58

[03:10] Team_073 possession (Score: 64-58)
Carmelo Young attempts a 3Pt. Contested by Magic Beal (4.4 feet, ZONE). Carmelo Young misses. Rebound secured by Larry Duncan.

[02:52] Team_085 possession (Score: 64-58)
Larry Duncan drives and kicks out. Collin Mobley attempts a 3Pt. Contested by Karl Williamson (3.3 feet, ZONE). Collin Mobley misses. Rebound secured by Carmelo Porzingis.

[02:35] Team_073 possession (Score: 64-58)
Isaiah Smith attempts a 3Pt. Contested by Stephen Bird (3.9 feet, MAN). Isaiah Smith misses. Rebound secured by Collin Mobley.

[02:18] Team_085 possession (Score: 64-58)
Collin Mobley attempts a Midrange. Contested by Bradley Morant (4.0 feet, MAN). Collin Mobley misses. Offensive rebound by Paul Wagner! Paul Wagner kicks it out.

[02:00] Team_085 possession (Score: 64-58)
Magic Beal attempts a 3Pt. Contested by Carmelo Young (5.2 feet, MAN). Magic Beal misses. Offensive rebound by Paul Wagner! Paul Wagner kicks it out.

[01:48] Team_085 possession (Score: 64-58)
Larry Duncan makes the Dunk and draws the foul on Isaiah Smith! And-1! Larry Duncan to the line for 1. [BONUS: 6 team fouls] (Isaiah Smith: 1 personal fouls)   FT 1/1: GOOD Larry Duncan makes 1/1 from the line.
Score: 64-61

[01:37] Team_073 possession (Score: 64-61)
Bradley Morant attempts a Midrange. Contested by Stephen Bird (4.2 feet, ZONE). BRADLEY MORANT MAKES IT!
Score: 66-61

[01:20] Team_085 possession (Score: 66-61)
Paul Wagner attempts a 3Pt. Contested by Carmelo Porzingis (4.3 feet, MAN). Paul Wagner misses. Rebound secured by Bradley Morant.

[01:09] Team_073 possession (Score: 66-61)
Carmelo Young attempts a 3Pt. Contested by Paul Wagner (4.0 feet, ZONE). CARMELO YOUNG MAKES IT! Assist: Isaiah Smith
Score: 69-61

[00:58] Team_085 possession (Score: 69-61)
Paul Wagner drives and kicks out. Collin Mobley attempts a Midrange. Contested by Bradley Morant (4.3 feet, MAN). Collin Mobley misses. Rebound secured by Bradley Morant.

[00:43] Team_073 possession (Score: 69-61)
Isaiah Smith attempts a Midrange. Contested by Paul Wagner (4.0 feet, ZONE). Isaiah Smith misses. Rebound secured by Collin Mobley.

[00:24] Team_085 possession (Score: 69-61)
Paul Wagner makes the Midrange and draws the foul on Isaiah Smith! And-1! Paul Wagner to the line for 1. [BONUS: 7 team fouls] (Isaiah Smith: 2 personal fouls)   FT 1/1: GOOD Paul Wagner makes 1/1 from the line.
Score: 69-64

[00:06] Team_073 possession (Score: 69-64)
FOUL! Shooting foul on Paul Wagner. Carmelo Porzingis to the line for 2 free throws. [Team fouls: 3] (Paul Wagner: 2 personal fouls)   FT 1/2: GOOD   FT 2/2: GOOD Carmelo Porzingis makes 2/2 from the line.
Score: 71-64

================================================================================
                              3RD QUARTER COMPLETE                              
================================================================================

3RD QUARTER SCORE: Team_073 20, Team_085 20

BOX SCORE:
================================================================================

Team_073
--------------------------------------------------------------------------------
Player                MIN  PTS  REB  AST  TO      FG   FG%      3P   3P%
--------------------------------------------------------------------------------
Carmelo Young          31    9    0    0   0   4/6    66.7     0/0   0.0
Bradley Morant         31    7    4    0   0   3/4    75.0     0/0   0.0
Carmelo Porzingis      31    4    7    1   0   2/3    66.7     0/0   0.0
Isaiah Smith           31    0    3    3   0   0/4     0.0     0/0   0.0
Karl Williamson        31    0    0    0   0   0/1     0.0     0/0   0.0

TEAM: FG: 9/18 (50.0%), 3PT: 1/6 (16.7%), REB: 14 (4 off, 10 def), AST: 4, TO: 2
TEAM FOULS: 7 [Team_085 in BONUS]


Team_085
--------------------------------------------------------------------------------
Player                MIN  PTS  REB  AST  TO      FG   FG%      3P   3P%
--------------------------------------------------------------------------------
Paul Wagner            31    6    4    0   0   3/7    42.9     0/0   0.0
Stephen Bird           31    5    0    0   0   2/3    66.7     0/0   0.0
Collin Mobley          31    3    4    0   0   1/1   100.0     0/0   0.0
Larry Duncan           31    3    4    0   0   1/4    25.0     0/0   0.0
Magic Beal             31    3    0    1   0   1/3    33.3     0/0   0.0

TEAM: FG: 8/18 (44.4%), 3PT: 1/8 (12.5%), REB: 12 (4 off, 8 def), AST: 1, TO: 1
TEAM FOULS: 3

================================================================================

================================================================================
                       4TH QUARTER - Team_073 vs Team_085                       
================================================================================

[12:00] Team_073 possession (Score: 71-64)
Karl Williamson attempts a 3Pt. Contested by Magic Beal (4.5 feet, ZONE). Karl Williamson misses. Rebound secured by Collin Mobley.

[11:46] Team_085 possession (Score: 71-64)
Magic Beal attempts a 3Pt. Contested by Carmelo Young (5.3 feet, MAN). Magic Beal misses. Offensive rebound by Larry Duncan! Larry Duncan kicks it out.

[11:34] Team_085 possession (Score: 71-64)
Magic Beal makes the Dunk and draws the foul on Bradley Morant! And-1! Magic Beal to the line for 1. [Team fouls: 1] (Bradley Morant: 1 personal fouls)   FT 1/1: GOOD Magic Beal makes 1/1 from the line.
Score: 71-67

[11:20] Team_073 possession (Score: 71-67)
FOUL! Holding foul on Stephen Bird. [Team fouls: 1] No free throws, side out. (Stephen Bird: 1 personal fouls)

[11:06] Team_073 possession (Score: 71-67)
Isaiah Smith attempts a Midrange. Contested by Stephen Bird (4.1 feet, MAN). Isaiah Smith misses. FOUL! Loose ball foul on Paul Wagner during the rebound battle. [Team fouls: 2] No free throws, side out. (Paul Wagner: 1 personal fouls)

[10:51] Team_073 possession (Score: 71-67)
Carmelo Young attempts a Midrange. Contested by Stephen Bird (4.1 feet, ZONE). CARMELO YOUNG MAKES IT!
Score: 73-67

[10:40] Team_085 possession (Score: 73-67)
Paul Wagner attempts a 3Pt. Contested by Karl Williamson (3.8 feet, ZONE). PAUL WAGNER MAKES IT! Assist: Larry Duncan
Score: 73-70

[10:26] Team_073 possession (Score: 73-70)
Bradley Morant attempts a Dunk. BLOCKED BY PAUL WAGNER! Ball is loose! Rebound secured by Paul Wagner.

[10:13] Team_085 possession (Score: 73-70)
Stephen Bird attempts a 3Pt. Contested by Carmelo Young (5.3 feet, ZONE). Stephen Bird misses. Rebound secured by Bradley Morant.

[09:56] Team_073 possession (Score: 73-70)
Karl Williamson attempts a 3Pt. Contested by Larry Duncan (3.8 feet, MAN). Karl Williamson misses. Offensive rebound by Carmelo Porzingis! Carmelo Porzingis kicks it out.

[09:44] Team_073 possession (Score: 73-70)
Carmelo Young drives, picks up Magic Beal. Help arrives from Larry Duncan! Carmelo Young attempts a Layup. Contested by Larry Duncan (4.7 feet, MAN). CARMELO YOUNG MAKES IT!
Score: 75-70

[09:32] Team_085 possession (Score: 75-70)
FOUL! Reach-in foul on Bradley Morant during the drive. [Team fouls: 2] No free throws, side out. (Bradley Morant: 2 personal fouls)

[09:17] Team_085 possession (Score: 75-70)
Magic Beal attempts a 3Pt. Contested by Karl Williamson (4.1 feet, ZONE). Magic Beal misses. Rebound secured by Bradley Morant.

[09:02] Team_073 possession (Score: 75-70)
Carmelo Young drives and kicks out. Carmelo Young attempts a 3Pt. Contested by Magic Beal (4.7 feet, MAN). Carmelo Young misses. Offensive rebound by Bradley Morant! Bradley Morant kicks it out.

[08:44] Team_073 possession (Score: 75-70)
Carmelo Young drives, picks up Magic Beal. Help arrives from Larry Duncan! Carmelo Young attempts a Layup. Contested by Larry Duncan (4.8 feet, MAN). Carmelo Young misses. Rebound secured by Paul Wagner.

[08:28] Team_085 possession (Score: 75-70)
Stephen Bird attempts a Layup. Contested by Isaiah Smith (5.1 feet, MAN). STEPHEN BIRD MAKES IT! Assist: Magic Beal
Score: 75-72

[08:09] Team_073 possession (Score: 75-72)
Carmelo Young drives, Magic Beal stays with him. Carmelo Young attempts a Layup. Contested by Magic Beal (4.9 feet, MAN). CARMELO YOUNG MAKES IT!
Score: 77-72

[07:52] Team_085 possession (Score: 77-72)
Collin Mobley drives to the basket... Collin Mobley throws a bad pass! Stolen by Bradley Morant! TURNOVER! (live ball)

[07:38] Team_073 possession (Score: 77-72)
Bradley Morant attempts a Midrange. Contested by Collin Mobley (5.1 feet, MAN). Bradley Morant misses. Offensive rebound by Bradley Morant! Bradley Morant kicks it out.

[07:24] Team_073 possession (Score: 77-72)
Carmelo Porzingis drives, Paul Wagner stays with him. Carmelo Porzingis attempts a Dunk. Contested by Paul Wagner (4.3 feet, MAN). CARMELO PORZINGIS MAKES IT! Assist: Karl Williamson
Score: 79-72

[07:09] Team_085 possession (Score: 79-72)
Collin Mobley attempts a 3Pt. Contested by Bradley Morant (4.6 feet, MAN). Collin Mobley misses. FOUL! Loose ball foul on Bradley Morant during the rebound battle. [Team fouls: 3] No free throws, side out. (Bradley Morant: 3 personal fouls)

[06:53] Team_085 possession (Score: 79-72)
Stephen Bird attempts a 3Pt. Contested by Isaiah Smith (5.3 feet, MAN). STEPHEN BIRD MAKES IT! Assist: Collin Mobley
Score: 79-75

[06:38] Team_073 possession (Score: 79-75)
Carmelo Young makes the Dunk and draws the foul on Larry Duncan! And-1! Carmelo Young to the line for 1. [Team fouls: 3] (Larry Duncan: 1 personal fouls)   FT 1/1: GOOD Carmelo Young makes 1/1 from the line.
Score: 82-75

[06:24] Team_085 possession (Score: 82-75)
Stephen Bird attempts a 3Pt. Contested by Karl Williamson (4.3 feet, ZONE). STEPHEN BIRD MAKES IT! Assist: Collin Mobley
Score: 82-78

[06:12] Team_073 possession (Score: 82-78)
Carmelo Young drives and kicks out. Carmelo Porzingis attempts a 3Pt. Contested by Paul Wagner (4.5 feet, MAN). Carmelo Porzingis misses. Rebound secured by Paul Wagner.

[05:54] Team_085 possession (Score: 82-78)
FOUL! Reach-in foul on Carmelo Porzingis during the drive. [Team fouls: 4] No free throws, side out. (Carmelo Porzingis: 1 personal fouls)

[05:41] Team_085 possession (Score: 82-78)
Larry Duncan attempts a 3Pt. Contested by Karl Williamson (4.6 feet, ZONE). LARRY DUNCAN MAKES IT! Assist: Paul Wagner
Score: 82-81

[05:29] Team_073 possession (Score: 82-81)
Bradley Morant drives, Collin Mobley stays with him. Bradley Morant attempts a Dunk. Contested by Collin Mobley (5.5 feet, MAN). BRADLEY MORANT MAKES IT!
Score: 84-81

[05:14] Team_085 possession (Score: 84-81)
FOUL! Shooting foul on Bradley Morant. Collin Mobley to the line for 2 free throws. [BONUS: 5 team fouls] (Bradley Morant: 4 personal fouls)   FT 1/2: GOOD   FT 2/2: GOOD Collin Mobley makes 2/2 from the line.
Score: 84-83

[05:01] Team_073 possession (Score: 84-83)
Isaiah Smith attempts a Layup. BLOCKED BY MAGIC BEAL! Ball deflects out of bounds off Isaiah Smith.

[04:48] Team_085 possession (Score: 84-83)
Magic Beal makes the Layup and draws the foul on Isaiah Smith! And-1! Magic Beal to the line for 1. [BONUS: 6 team fouls] (Isaiah Smith: 1 personal fouls)   FT 1/1: GOOD Magic Beal makes 1/1 from the line.
Score: 84-86

[04:35] Team_073 possession (Score: 84-86)
Karl Williamson attempts a Midrange. Contested by Larry Duncan (4.6 feet, MAN). KARL WILLIAMSON MAKES IT! Assist: Isaiah Smith
Score: 86-86

[04:18] Team_085 possession (Score: 86-86)
FOUL! Shooting foul on Isaiah Smith. Collin Mobley to the line for 2 free throws. [BONUS: 7 team fouls] (Isaiah Smith: 2 personal fouls)   FT 1/2: GOOD   FT 2/2: GOOD Collin Mobley makes 2/2 from the line.
Score: 86-88

[04:01] Team_073 possession (Score: 86-88)
Carmelo Young attempts a 3Pt. Contested by Magic Beal (5.5 feet, ZONE). Carmelo Young misses. Rebound secured by Paul Wagner.

[03:48] Team_085 possession (Score: 86-88)
Collin Mobley drives, Bradley Morant stays with him. Collin Mobley attempts a Dunk. Contested by Bradley Morant (5.1 feet, MAN). COLLIN MOBLEY MAKES IT! Assist: Magic Beal
Score: 86-90

[03:36] Team_073 possession (Score: 86-90)
Carmelo Young attempts a Midrange. Contested by Magic Beal (5.5 feet, MAN). Carmelo Young misses. Rebound secured by Larry Duncan.

[03:24] Team_085 possession (Score: 86-90)
Collin Mobley attempts a 3Pt. Contested by Karl Williamson (4.5 feet, ZONE). Collin Mobley misses. Rebound secured by Carmelo Porzingis.

[03:09] Team_073 possession (Score: 86-90)
Karl Williamson attempts a 3Pt. Contested by Magic Beal (5.7 feet, ZONE). Karl Williamson misses. FOUL! Loose ball foul on Collin Mobley during the rebound battle. [Team fouls: 4] No free throws, side out. (Collin Mobley: 1 personal fouls)

[02:52] Team_073 possession (Score: 86-90)
Carmelo Porzingis attempts a Layup. BLOCKED BY PAUL WAGNER! Ball is loose! Rebound secured by Larry Duncan.

[02:41] Team_085 possession (Score: 86-90)
Collin Mobley drives, Bradley Morant stays with him. Collin Mobley attempts a Dunk. Contested by Bradley Morant (5.3 feet, MAN). Collin Mobley misses. Rebound secured by Bradley Morant.

[02:24] Team_073 possession (Score: 86-90)
Carmelo Young drives to the basket... Carmelo Young loses the ball! Stripped by Magic Beal! TURNOVER! (live ball)

[02:09] Team_085 possession (Score: 86-90)
FOUL! Shooting foul on Karl Williamson. Larry Duncan to the line for 3 free throws. [BONUS: 8 team fouls] (Karl Williamson: 1 personal fouls)   FT 1/3: MISS   FT 2/3: GOOD   FT 3/3: GOOD Larry Duncan makes 2/3 from the line.
Score: 86-92

[01:54] Team_073 possession (Score: 86-92)
Isaiah Smith attempts a Midrange. Contested by Stephen Bird (5.6 feet, ZONE). Isaiah Smith misses. Rebound secured by Larry Duncan.

[01:41] Team_085 possession (Score: 86-92)
Larry Duncan attempts a Layup. Contested by Karl Williamson (5.2 feet, MAN). Larry Duncan misses. Rebound secured by Bradley Morant.

[01:26] Team_073 possession (Score: 86-92)
Carmelo Porzingis attempts a 3Pt. Contested by Paul Wagner (5.2 feet, ZONE). Carmelo Porzingis misses. Rebound secured by Paul Wagner.

[01:16] Team_085 possession (Score: 86-92)
Larry Duncan attempts a Midrange. Wide open! Carmelo Young is 6.6 feet away. [ZONE] Larry Duncan misses. Offensive rebound by Paul Wagner! Paul Wagner kicks it out.

[01:02] Team_085 possession (Score: 86-92)
Magic Beal attempts a 3Pt. Wide open! Carmelo Young is 6.6 feet away. [ZONE] MAGIC BEAL MAKES IT! Assist: Paul Wagner
Score: 86-95

[00:49] Team_073 possession (Score: 86-95)
Carmelo Porzingis attempts a Layup. Contested by Paul Wagner (5.3 feet, ZONE). CARMELO PORZINGIS MAKES IT! Assist: Isaiah Smith
Score: 88-95

[00:38] Team_085 possession (Score: 88-95)
Larry Duncan drives, Bradley Morant stays with him. Larry Duncan attempts a Dunk. Wide open! Bradley Morant is 6.0 feet away. [ZONE] LARRY DUNCAN MAKES IT! Assist: Stephen Bird
Score: 88-97

[00:25] Team_073 possession (Score: 88-97)
Carmelo Porzingis drives to the basket... Carmelo Porzingis commits a violation (traveling/carry)! TURNOVER! (dead ball)

[00:25] Substitution (Team_073): Carmelo Young OUT → Zach Quickley IN (stamina_rule2)

[00:25] Substitution (Team_073): Isaiah Smith OUT → Luka Butler IN (stamina_rule2)

[00:25] Substitution (Team_073): Karl Williamson OUT → Dwyane McCollum IN (stamina_rule2)

[00:25] Substitution (Team_073): Carmelo Porzingis OUT → Shai Thompson IN (stamina_rule2)

[00:25] Substitution (Team_073): Bradley Morant OUT → Ja Rose IN (stamina_rule2)

[00:25] Substitution (Team_085): Magic Beal OUT → Khris Brogdon IN (stamina_rule2)

[00:25] Substitution (Team_085): Stephen Bird OUT → Jordan Morant IN (stamina_rule2)

[00:25] Substitution (Team_085): Larry Duncan OUT → Giannis Johnson IN (stamina_rule2)

[00:25] Substitution (Team_085): Paul Wagner OUT → Jalen Leonard IN (stamina_rule2)

[00:25] Substitution (Team_085): Collin Mobley OUT → Malcolm Beal IN (stamina_rule2)

[00:15] Team_085 possession (Score: 88-97)
Jordan Morant attempts a 3Pt. Contested by Luka Butler (4.6 feet, MAN). Jordan Morant misses. Rebound secured by Dwyane McCollum.

[00:02] Team_073 possession (Score: 88-97)
FOUL! Reach-in foul on Malcolm Beal during the drive. [IN THE BONUS! 5 team fouls] Ja Rose to the line for 2 free throws. (Malcolm Beal: 1 personal fouls)   FT 1/2: MISS   FT 2/2: GOOD Ja Rose makes 1/2 from the line.
Score: 89-97

================================================================================
                              4TH QUARTER COMPLETE                              
================================================================================

4TH QUARTER SCORE: Team_073 18, Team_085 33

BOX SCORE:
================================================================================

Team_073
--------------------------------------------------------------------------------
Player                MIN  PTS  REB  AST  TO      FG   FG%      3P   3P%
--------------------------------------------------------------------------------
Carmelo Young          43    9    0    0   0   4/8    50.0     0/0   0.0
Carmelo Porzingis      43    4    2    0   0   2/4    50.0     0/0   0.0
Karl Williamson        43    2    0    1   0   1/2    50.0     0/0   0.0
Bradley Morant         43    2    8    0   0   1/2    50.0     0/0   0.0
Ja Rose                 6    1    0    0   0   1/1   100.0     0/0   0.0
Isaiah Smith           43    0    0    2   0   0/2     0.0     0/0   0.0
Dwyane McCollum         6    0    1    0   0   0/0     0.0     0/0   0.0

TEAM: FG: 9/19 (47.4%), 3PT: 0/3 (0.0%), REB: 11 (5 off, 6 def), AST: 3, TO: 2
TEAM FOULS: 8 [Team_085 in BONUS]


Team_085
--------------------------------------------------------------------------------
Player                MIN  PTS  REB  AST  TO      FG   FG%      3P   3P%
--------------------------------------------------------------------------------
Magic Beal             43    9    0    2   0   3/4    75.0     0/0   0.0
Stephen Bird           43    8    0    1   0   3/4    75.0     0/0   0.0
Larry Duncan           43    7    4    1   0   3/4    75.0     0/0   0.0
Collin Mobley          43    6    1    2   0   3/5    60.0     0/0   0.0
Paul Wagner            43    3    7    2   0   1/1   100.0     0/0   0.0
Jordan Morant           6    0    0    0   0   0/1     0.0     0/0   0.0

TEAM: FG: 13/19 (68.4%), 3PT: 6/10 (60.0%), REB: 12 (3 off, 9 def), AST: 8, TO: 1
TEAM FOULS: 5 [Team_073 in BONUS]

================================================================================

================================================================================
                               FULL GAME COMPLETE                               
================================================================================

FINAL SCORE: Team_073 89, Team_085 97

SCORING BY QUARTER:
--------------------------------------------------------------------------------
Team                     Q1     Q2     Q3     Q4    FINAL
--------------------------------------------------------------------------------
Team_073                 20     31     20     18       89
Team_085                 20     24     20     33       97
--------------------------------------------------------------------------------

FULL GAME BOX SCORE:
================================================================================

Team_073
--------------------------------------------------------------------------------
Player                MIN  PTS  REB  AST  TO      FG   FG%      3P   3P%      FT STL BLK
--------------------------------------------------------------------------------
Carmelo Young          43   25    0    3   3  11/18   61.1   3/7    42.9   3/4     0   0
Isaiah Smith           43    3    8    6   1   1/12    8.3   1/7    14.3   0/0     0   2
Karl Williamson        43    6    0    1   1   3/7    42.9   0/2     0.0   0/0     0   0
Carmelo Porzingis      43   15   13    2   1   7/13   53.8   0/1     0.0   5/5     1   0
Bradley Morant         43   26   19    2   0  12/16   75.0   0/1     0.0   2/2     2   0
Zach Quickley           6    2    0    0   0   0/1     0.0   0/0     0.0   2/2     0   1
Luka Butler             6    0    0    1   0   1/2    50.0   0/0     0.0   0/0     1   0
Dwyane McCollum         6    0    1    0   0   0/0     0.0   0/0     0.0   0/0     0   0
Shai Thompson           6    6    2    0   1   1/3    33.3   1/2    50.0   1/1     0   0
Ja Rose                 6    6    0    0   0   3/4    75.0   0/0     0.0   2/3     0   0

TEAM: FG: 40/77 (51.9%), 3PT: 5/20 (25.0%), REB: 43 (11 off, 32 def), AST: 15, TO: 7


Team_085
--------------------------------------------------------------------------------
Player                MIN  PTS  REB  AST  TO      FG   FG%      3P   3P%      FT STL BLK
--------------------------------------------------------------------------------
Magic Beal             43   16    0    4   1   6/12   50.0   1/6    16.7   3/3     2   2
Stephen Bird           43   25    0    2   1  10/14   71.4   6/9    66.7   2/3     0   0
Larry Duncan           43   19   14    4   0   7/16   43.8   3/7    42.9   8/10    0   0
Paul Wagner            43   11   18    2   2   5/13   38.5   1/6    16.7   2/3     0   3
Collin Mobley          43   14   12    5   1   6/9    66.7   0/1     0.0   5/5     0   0
Khris Brogdon           6    3    0    1   1   1/1   100.0   1/1   100.0   0/0     0   0
Jordan Morant           6    1    0    1   2   0/1     0.0   0/1     0.0   1/2     0   0
Giannis Johnson         6    3    0    0   1   1/2    50.0   1/2    50.0   0/0     0   0
Jalen Leonard           6    0    4    1   0   0/1     0.0   0/1     0.0   0/0     0   0
Malcolm Beal            6    4    2    0   0   2/2   100.0   0/0     0.0   0/0     1   0

TEAM: FG: 39/72 (54.2%), 3PT: 13/34 (38.2%), REB: 50 (16 off, 34 def), AST: 20, TO: 9

================================================================================
