================================================================================
                        FULL GAME - Team_091 vs Team_022                        
================================================================================

================================================================================
                       1ST QUARTER - Team_091 vs Team_022                       
================================================================================

[12:00] Team_091 possession (Score: 0-0)
D'Angelo Ingram drives to the basket... D'Angelo Ingram loses control! Ball rolls out of bounds! TURNOVER! (dead ball)

[11:45] Team_022 possession (Score: 0-0)
Lamelo Dosunmu attempts a 3Pt. Contested by D'Angelo Ingram (5.1 feet, MAN). Lamelo Dosunmu misses. Rebound secured by Rudy Bridges.

[11:34] Team_091 possession (Score: 0-0)
Rudy Bridges drives, Myles Anthony stays with him. Rudy Bridges attempts a Layup. Contested by Myles Anthony (4.5 feet, MAN). Rudy Bridges misses. Rebound secured by Dirk Markkanen.

[11:21] Team_022 possession (Score: 0-0)
Dirk Markkanen attempts a 3Pt. Contested by Kevin Simons (4.0 feet, MAN). DIRK MARKKANEN MAKES IT! Assist: Malcolm Allen
Score: 0-3

[11:10] Team_091 possession (Score: 0-3)
FOUL! Shooting foul on Lamelo Dosunmu. Kevin Simons to the line for 2 free throws. [Team fouls: 1] (Lamelo Dosunmu: 1 personal fouls)   FT 1/2: GOOD   FT 2/2: GOOD Kevin Simons makes 2/2 from the line.
Score: 2-3

[10:51] Team_022 possession (Score: 2-3)
Malcolm Allen attempts a 3Pt. Contested by Kyrie Rozier (4.8 feet, ZONE). Malcolm Allen misses. Rebound secured by Kevin Simons.

[10:36] Team_091 possession (Score: 2-3)
Kevin Simons attempts a 3Pt. Contested by Michael Ginobili (3.9 feet, ZONE). KEVIN SIMONS MAKES IT! Assist: Isaiah Siakam
Score: 5-3

[10:18] Team_022 possession (Score: 5-3)
Lamelo Dosunmu makes the 3Pt and draws the foul on D'Angelo Ingram! And-1! Lamelo Dosunmu to the line for 1. [Team fouls: 1] (D'Angelo Ingram: 1 personal fouls)   FT 1/1: GOOD Lamelo Dosunmu makes 1/1 from the line.
Score: 5-7

[10:02] Team_091 possession (Score: 5-7)
Isaiah Siakam drives and kicks out. Rudy Bridges attempts a 3Pt. Contested by Michael Ginobili (3.5 feet, ZONE). Rudy Bridges misses. Offensive rebound by Rudy Bridges! Rudy Bridges kicks it out.

[09:51] Team_091 possession (Score: 5-7)
Rudy Bridges attempts a 3Pt. Contested by Myles Anthony (4.5 feet, MAN). Rudy Bridges misses. Rebound secured by Myles Anthony.

[09:40] Team_022 possession (Score: 5-7)
Myles Anthony attempts a Midrange. Contested by Rudy Bridges (4.5 feet, ZONE). Myles Anthony misses. Rebound secured by Kevin Simons.

[09:25] Team_091 possession (Score: 5-7)
Kyrie Rozier attempts a Midrange. Contested by Malcolm Allen (4.5 feet, ZONE). Kyrie Rozier misses. Offensive rebound by Kevin Simons! Kevin Simons's putback is no good. Rebound secured by Myles Anthony.

[09:11] Team_022 possession (Score: 5-7)
Michael Ginobili attempts a 3Pt. Contested by Isaiah Siakam (5.7 feet, MAN). Michael Ginobili misses. Rebound secured by Kyrie Rozier.

[08:54] Team_091 possession (Score: 5-7)
D'Angelo Ingram drives and kicks out. Rudy Bridges attempts a 3Pt. Contested by Myles Anthony (4.4 feet, MAN). Rudy Bridges misses. Rebound secured by Dirk Markkanen.

[08:39] Team_022 possession (Score: 5-7)
Dirk Markkanen attempts a Dunk. BLOCKED BY KYRIE ROZIER! Ball is loose! Offensive rebound by Dirk Markkanen! Dirk Markkanen kicks it out.

[08:21] Team_022 possession (Score: 5-7)
Michael Ginobili attempts a Midrange. Contested by Kyrie Rozier (4.1 feet, ZONE). Michael Ginobili misses. Offensive rebound by Michael Ginobili! Michael Ginobili kicks it out.

[08:04] Team_022 possession (Score: 5-7)
Lamelo Dosunmu attempts a Midrange. Contested by D'Angelo Ingram (5.1 feet, MAN). LAMELO DOSUNMU MAKES IT! Assist: Michael Ginobili
Score: 5-9

[07:46] Team_091 possession (Score: 5-9)
Kevin Simons attempts a Midrange. Contested by Dirk Markkanen (5.0 feet, MAN). Kevin Simons misses. Offensive rebound by Rudy Bridges! Rudy Bridges kicks it out.

[07:31] Team_091 possession (Score: 5-9)
D'Angelo Ingram makes the Layup and draws the foul on Dirk Markkanen! And-1! D'Angelo Ingram to the line for 1. [Team fouls: 2] (Dirk Markkanen: 1 personal fouls)   FT 1/1: GOOD D'Angelo Ingram makes 1/1 from the line.
Score: 8-9

[07:15] Team_022 possession (Score: 8-9)
Dirk Markkanen attempts a Midrange. Contested by Kevin Simons (4.0 feet, MAN). Dirk Markkanen misses. Offensive rebound by Dirk Markkanen! Dirk Markkanen puts it back in!
Score: 8-11

[07:01] Team_091 possession (Score: 8-11)
Kevin Simons attempts a Midrange. Contested by Dirk Markkanen (5.0 feet, MAN). KEVIN SIMONS MAKES IT!
Score: 10-11

[06:48] Team_022 possession (Score: 10-11)
Michael Ginobili attempts a 3Pt. Contested by Isaiah Siakam (5.7 feet, MAN). Michael Ginobili misses. Rebound secured by Rudy Bridges.

[06:30] Team_091 possession (Score: 10-11)
FOUL! Holding foul on Dirk Markkanen. [Team fouls: 3] No free throws, side out. (Dirk Markkanen: 2 personal fouls)

[06:16] Team_091 possession (Score: 10-11)
Isaiah Siakam attempts a 3Pt. Contested by Michael Ginobili (3.8 feet, ZONE). ISAIAH SIAKAM MAKES IT! Assist: Kyrie Rozier
Score: 13-11

[06:01] Team_022 possession (Score: 13-11)
Myles Anthony attempts a 3Pt. Contested by Rudy Bridges (4.5 feet, MAN). Myles Anthony misses. Rebound secured by Kyrie Rozier.

[05:48] Team_091 possession (Score: 13-11)
Kevin Simons drives, Dirk Markkanen stays with him. Kevin Simons attempts a Dunk. Contested by Dirk Markkanen (5.0 feet, ZONE). Kevin Simons misses. Rebound secured by Dirk Markkanen.

[05:32] Team_022 possession (Score: 13-11)
Myles Anthony drives and kicks out. Myles Anthony attempts a 3Pt. Contested by Rudy Bridges (4.3 feet, MAN). Myles Anthony misses. Rebound secured by Kyrie Rozier.

[05:17] Team_091 possession (Score: 13-11)
D'Angelo Ingram drives to the basket... FOUL! Offensive foul on D'Angelo Ingram! Lamelo Dosunmu drew the charge! [Team fouls: 2] (D'Angelo Ingram: 2 personal fouls) TURNOVER! (dead ball)

[05:02] Team_022 possession (Score: 13-11)
Myles Anthony attempts a Midrange. Contested by Rudy Bridges (4.5 feet, MAN). Myles Anthony misses. FOUL! Loose ball foul on Kyrie Rozier during the rebound battle. [Team fouls: 3] No free throws, side out. (Kyrie Rozier: 1 personal fouls)

[04:46] Team_022 possession (Score: 13-11)
Dirk Markkanen attempts a Layup. Contested by Kevin Simons (4.1 feet, ZONE). DIRK MARKKANEN MAKES IT! Assist: Michael Ginobili
Score: 13-13

[04:34] Team_091 possession (Score: 13-13)
Kyrie Rozier makes the Dunk and draws the foul on Lamelo Dosunmu! And-1! Kyrie Rozier to the line for 1. [Team fouls: 4] (Lamelo Dosunmu: 2 personal fouls)   FT 1/1: MISS Kyrie Rozier makes 0/1 from the line. Rebound secured by Dirk Markkanen.
Score: 15-13

[04:18] Team_022 possession (Score: 15-13)
Dirk Markkanen attempts a Layup. Contested by Kevin Simons (4.1 feet, MAN). DIRK MARKKANEN MAKES IT! Assist: Lamelo Dosunmu
Score: 15-15

[04:03] Team_091 possession (Score: 15-15)
Rudy Bridges drives, picks up Myles Anthony. Help arrives from Michael Ginobili! Rudy Bridges attempts a Layup. Contested by Michael Ginobili (4.6 feet, MAN). RUDY BRIDGES MAKES IT! Assist: Isaiah Siakam
Score: 17-15

[03:50] Team_022 possession (Score: 17-15)
Myles Anthony makes the Layup and draws the foul on Kevin Simons! And-1! Myles Anthony to the line for 1. [Team fouls: 4] (Kevin Simons: 1 personal fouls)   FT 1/1: GOOD Myles Anthony makes 1/1 from the line.
Score: 17-18

[03:34] Team_091 possession (Score: 17-18)
Kyrie Rozier drives and kicks out. Rudy Bridges attempts a Midrange. Contested by Myles Anthony (4.6 feet, MAN). RUDY BRIDGES MAKES IT!
Score: 19-18

[03:16] Team_022 possession (Score: 19-18)
Dirk Markkanen attempts a Midrange. Contested by Kevin Simons (4.2 feet, MAN). DIRK MARKKANEN MAKES IT!
Score: 19-20

[03:00] Team_091 possession (Score: 19-20)
Kyrie Rozier commits a violation (traveling/carry)! TURNOVER! (dead ball)

[03:00] Substitution (Team_022): Lamelo Dosunmu OUT → Kawhi Russell IN (stamina_rule2)

[02:44] Team_022 possession (Score: 19-20)
Kawhi Russell attempts a Layup. Contested by D'Angelo Ingram (5.1 feet, MAN). KAWHI RUSSELL MAKES IT! Assist: Malcolm Allen
Score: 19-22

[02:29] Team_091 possession (Score: 19-22)
Isaiah Siakam makes the Layup and draws the foul on Michael Ginobili! And-1! Isaiah Siakam to the line for 1. [BONUS: 5 team fouls] (Michael Ginobili: 1 personal fouls)   FT 1/1: GOOD Isaiah Siakam makes 1/1 from the line.
Score: 22-22

[02:18] Team_022 possession (Score: 22-22)
Dirk Markkanen attempts a Midrange. Contested by Kevin Simons (4.3 feet, MAN). DIRK MARKKANEN MAKES IT! Assist: Kawhi Russell
Score: 22-24

[02:02] Team_091 possession (Score: 22-24)
FOUL! Shooting foul on Kawhi Russell. Isaiah Siakam to the line for 2 free throws. [BONUS: 6 team fouls] (Kawhi Russell: 1 personal fouls)   FT 1/2: GOOD   FT 2/2: MISS Isaiah Siakam makes 1/2 from the line. Rebound secured by Dirk Markkanen.
Score: 23-24

[01:50] Team_022 possession (Score: 23-24)
Kawhi Russell attempts a 3Pt. Contested by D'Angelo Ingram (5.2 feet, MAN). Kawhi Russell misses. Rebound secured by Rudy Bridges.

[01:34] Team_091 possession (Score: 23-24)
FOUL! Holding foul on Myles Anthony. [IN THE BONUS! 7 team fouls] Rudy Bridges to the line for 2 free throws. (Myles Anthony: 1 personal fouls)   FT 1/2: MISS   FT 2/2: MISS Rudy Bridges makes 0/2 from the line. Rebound secured by Michael Ginobili.

[01:17] Team_022 possession (Score: 23-24)
FOUL! Shooting foul on Rudy Bridges. Myles Anthony to the line for 2 free throws. [BONUS: 5 team fouls] (Rudy Bridges: 1 personal fouls)   FT 1/2: GOOD   FT 2/2: GOOD Myles Anthony makes 2/2 from the line.
Score: 23-26

[01:05] Team_091 possession (Score: 23-26)
Rudy Bridges makes the Midrange and draws the foul on Michael Ginobili! And-1! Rudy Bridges to the line for 1. [BONUS: 8 team fouls] (Michael Ginobili: 2 personal fouls)   FT 1/1: GOOD Rudy Bridges makes 1/1 from the line.
Score: 26-26

[00:51] Team_022 possession (Score: 26-26)
Myles Anthony makes the Layup and draws the foul on Kyrie Rozier! And-1! Myles Anthony to the line for 1. [BONUS: 6 team fouls] (Kyrie Rozier: 2 personal fouls)   FT 1/1: GOOD Myles Anthony makes 1/1 from the line.
Score: 26-29

[00:37] Team_091 possession (Score: 26-29)
D'Angelo Ingram attempts a 3Pt. Contested by Malcolm Allen (5.7 feet, ZONE). D'ANGELO INGRAM MAKES IT!
Score: 29-29

[00:23] Team_022 possession (Score: 29-29)
Myles Anthony attempts a Midrange. Contested by Rudy Bridges (4.9 feet, MAN). Myles Anthony misses. Offensive rebound by Michael Ginobili! Michael Ginobili kicks it out.

[00:06] Team_022 possession (Score: 29-29)
FOUL! Holding foul on Rudy Bridges. [IN THE BONUS! 7 team fouls] Myles Anthony to the line for 2 free throws. (Rudy Bridges: 2 personal fouls)   FT 1/2: MISS   FT 2/2: GOOD Myles Anthony makes 1/2 from the line.
Score: 29-30

================================================================================
                              1ST QUARTER COMPLETE                              
================================================================================

1ST QUARTER SCORE: Team_091 29, Team_022 30

BOX SCORE:
================================================================================

Team_091
--------------------------------------------------------------------------------
Player                MIN  PTS  REB  AST  TO      FG   FG%      3P   3P%
--------------------------------------------------------------------------------
Rudy Bridges           12    7    5    0   0   3/5    60.0     0/0   0.0
Kevin Simons           12    7    2    0   0   3/4    75.0     0/0   0.0
Isaiah Siakam          12    6    0    2   0   2/3    66.7     0/0   0.0
D'Angelo Ingram        12    6    0    0   0   2/3    66.7     0/0   0.0
Kyrie Rozier           12    0    3    1   0   0/2     0.0     0/0   0.0

TEAM: FG: 10/18 (55.6%), 3PT: 3/4 (75.0%), REB: 11 (3 off, 8 def), AST: 3, TO: 3
TEAM FOULS: 7 [Team_022 in BONUS]


Team_022
--------------------------------------------------------------------------------
Player                MIN  PTS  REB  AST  TO      FG   FG%      3P   3P%
--------------------------------------------------------------------------------
Dirk Markkanen         12   13    8    0   0   6/6   100.0     0/0   0.0
Myles Anthony          12    9    2    0   0   4/7    57.1     0/0   0.0
Lamelo Dosunmu          9    6    0    1   0   2/3    66.7     0/0   0.0
Kawhi Russell           3    2    0    1   0   1/2    50.0     0/0   0.0
Malcolm Allen          12    0    0    2   0   0/1     0.0     0/0   0.0
Michael Ginobili       12    0    3    2   0   0/2     0.0     0/0   0.0

TEAM: FG: 13/21 (61.9%), 3PT: 2/8 (25.0%), REB: 12 (5 off, 7 def), AST: 6, TO: 0
TEAM FOULS: 8 [Team_091 in BONUS]

================================================================================

================================================================================
                       2ND QUARTER - Team_091 vs Team_022                       
================================================================================

[12:00] Team_091 possession (Score: 29-30)
FOUL! Shooting foul on Michael Ginobili. Isaiah Siakam to the line for 3 free throws. [Team fouls: 1] (Michael Ginobili: 1 personal fouls)   FT 1/3: GOOD   FT 2/3: GOOD   FT 3/3: GOOD Isaiah Siakam makes 3/3 from the line.
Score: 32-30

[11:44] Team_022 possession (Score: 32-30)
Myles Anthony attempts a Midrange. Wide open! Isaiah Siakam is 6.1 feet away. [ZONE] Myles Anthony misses. Rebound secured by Rudy Bridges.

[11:33] Team_091 possession (Score: 32-30)
D'Angelo Ingram attempts a Layup. Contested by Lamelo Dosunmu (5.5 feet, MAN). D'ANGELO INGRAM MAKES IT! Assist: Isaiah Siakam
Score: 34-30

[11:17] Team_022 possession (Score: 34-30)
FOUL! Shooting foul on Kevin Simons. Dirk Markkanen to the line for 2 free throws. [Team fouls: 1] (Kevin Simons: 1 personal fouls)   FT 1/2: GOOD   FT 2/2: GOOD Dirk Markkanen makes 2/2 from the line.
Score: 34-32

[11:02] Team_091 possession (Score: 34-32)
FOUL! Shooting foul on Lamelo Dosunmu. D'Angelo Ingram to the line for 2 free throws. [Team fouls: 2] (Lamelo Dosunmu: 1 personal fouls)   FT 1/2: GOOD   FT 2/2: GOOD D'Angelo Ingram makes 2/2 from the line.
Score: 36-32

[10:44] Team_022 possession (Score: 36-32)
Myles Anthony attempts a Layup. Contested by Rudy Bridges (4.8 feet, MAN). Myles Anthony misses. Rebound secured by Rudy Bridges.

[10:29] Team_091 possession (Score: 36-32)
D'Angelo Ingram attempts a Layup. Contested by Lamelo Dosunmu (5.6 feet, MAN). D'Angelo Ingram misses. FOUL! Loose ball foul on Lamelo Dosunmu during the rebound battle. [Team fouls: 3] No free throws, side out. (Lamelo Dosunmu: 2 personal fouls)

[10:17] Team_091 possession (Score: 36-32)
FOUL! Shooting foul on Michael Ginobili. Isaiah Siakam to the line for 3 free throws. [Team fouls: 4] (Michael Ginobili: 2 personal fouls)   FT 1/3: GOOD   FT 2/3: GOOD   FT 3/3: GOOD Isaiah Siakam makes 3/3 from the line.
Score: 39-32

[09:59] Team_022 possession (Score: 39-32)
Dirk Markkanen attempts a Layup. Contested by Kevin Simons (4.6 feet, ZONE). Dirk Markkanen misses. Rebound secured by Kevin Simons.

[09:42] Team_091 possession (Score: 39-32)
Kyrie Rozier attempts a 3Pt. Contested by Malcolm Allen (5.1 feet, MAN). KYRIE ROZIER MAKES IT! Assist: Isaiah Siakam
Score: 42-32

[09:29] Team_022 possession (Score: 42-32)
Michael Ginobili attempts a 3Pt. Wide open! Isaiah Siakam is 6.2 feet away. [MAN] Michael Ginobili misses. Rebound secured by Kevin Simons.

[09:12] Team_091 possession (Score: 42-32)
Kevin Simons drives, picks up Dirk Markkanen. Help arrives from Michael Ginobili! Kevin Simons attempts a Layup. Contested by Michael Ginobili (5.6 feet, ZONE). KEVIN SIMONS MAKES IT!
Score: 44-32

[08:57] Team_022 possession (Score: 44-32)
Dirk Markkanen drives to the basket... FOUL! Offensive foul on Dirk Markkanen! Kevin Simons drew the charge! [Team fouls: 5] (Dirk Markkanen: 1 personal fouls) TURNOVER! (dead ball)

[08:45] Team_091 possession (Score: 44-32)
Rudy Bridges attempts a 3Pt. Contested by Myles Anthony (5.2 feet, MAN). RUDY BRIDGES MAKES IT! Assist: Isaiah Siakam
Score: 47-32

[08:31] Team_022 possession (Score: 47-32)
Lamelo Dosunmu attempts a Layup. Contested by D'Angelo Ingram (5.7 feet, MAN). Lamelo Dosunmu misses. Rebound secured by Rudy Bridges.

[08:13] Team_091 possession (Score: 47-32)
Kyrie Rozier attempts a 3Pt. Contested by Michael Ginobili (4.4 feet, ZONE). Kyrie Rozier misses. Rebound secured by Lamelo Dosunmu.

[08:01] Team_022 possession (Score: 47-32)
Myles Anthony attempts a Midrange. Wide open! Isaiah Siakam is 6.5 feet away. [ZONE] MYLES ANTHONY MAKES IT!
Score: 47-34

[07:43] Team_091 possession (Score: 47-34)
Isaiah Siakam drives, Lamelo Dosunmu stays with him. Isaiah Siakam attempts a Layup. Contested by Lamelo Dosunmu (5.2 feet, ZONE). Isaiah Siakam misses. Rebound secured by Michael Ginobili.

[07:34] Team_022 possession (Score: 47-34)
Myles Anthony attempts a 3Pt. Contested by Rudy Bridges (5.1 feet, MAN). Myles Anthony misses. Rebound secured by Kevin Simons.

[07:22] Team_091 possession (Score: 47-34)
Isaiah Siakam attempts a 3Pt. Contested by Michael Ginobili (4.6 feet, MAN). Isaiah Siakam misses. Rebound secured by Michael Ginobili.

[07:04] Team_022 possession (Score: 47-34)
Dirk Markkanen makes the Layup and draws the foul on Kyrie Rozier! And-1! Dirk Markkanen to the line for 1. [Team fouls: 2] (Kyrie Rozier: 1 personal fouls)   FT 1/1: MISS Dirk Markkanen makes 0/1 from the line. Rebound secured by Kyrie Rozier.
Score: 47-36

[06:48] Team_091 possession (Score: 47-36)
Rudy Bridges attempts a 3Pt. Contested by Myles Anthony (5.4 feet, MAN). Rudy Bridges misses. Rebound secured by Dirk Markkanen.

[06:34] Team_022 possession (Score: 47-36)
Myles Anthony attempts a Layup. Contested by Rudy Bridges (5.2 feet, MAN). Myles Anthony misses. Offensive rebound by Michael Ginobili! Michael Ginobili kicks it out.

[06:22] Team_022 possession (Score: 47-36)
Malcolm Allen attempts a Midrange. Contested by Kyrie Rozier (5.4 feet, ZONE). Malcolm Allen misses. Rebound secured by Kyrie Rozier.

[06:09] Team_091 possession (Score: 47-36)
D'Angelo Ingram attempts a 3Pt. Contested by Michael Ginobili (5.4 feet, ZONE). D'Angelo Ingram misses. Offensive rebound by Kevin Simons! Kevin Simons kicks it out.

[05:56] Team_091 possession (Score: 47-36)
FOUL! Reach-in foul on Dirk Markkanen during the drive. [IN THE BONUS! 6 team fouls] D'Angelo Ingram to the line for 2 free throws. (Dirk Markkanen: 2 personal fouls)   FT 1/2: GOOD   FT 2/2: GOOD D'Angelo Ingram makes 2/2 from the line.
Score: 49-36

[05:42] Team_022 possession (Score: 49-36)
Malcolm Allen attempts a Layup. Wide open! D'Angelo Ingram is 6.2 feet away. [ZONE] MALCOLM ALLEN MAKES IT! Assist: Dirk Markkanen
Score: 49-38

[05:28] Team_091 possession (Score: 49-38)
Isaiah Siakam drives, picks up Michael Ginobili. Help arrives from Myles Anthony! Isaiah Siakam attempts a Layup. Contested by Myles Anthony (4.9 feet, MAN). ISAIAH SIAKAM MAKES IT! Assist: D'Angelo Ingram
Score: 51-38

[05:12] Team_022 possession (Score: 51-38)
Malcolm Allen drives and kicks out. Dirk Markkanen attempts a 3Pt. Contested by Kevin Simons (5.0 feet, MAN). Dirk Markkanen misses. Offensive rebound by Michael Ginobili! Michael Ginobili kicks it out.

[04:54] Team_022 possession (Score: 51-38)
Dirk Markkanen attempts a Layup. Contested by Kevin Simons (5.3 feet, MAN). Dirk Markkanen misses. Rebound secured by Rudy Bridges.

[04:41] Team_091 possession (Score: 51-38)
Rudy Bridges drives to the basket... FOUL! Offensive foul on Rudy Bridges! Myles Anthony drew the charge! [Team fouls: 3] (Rudy Bridges: 1 personal fouls) TURNOVER! (dead ball)

[04:32] Team_022 possession (Score: 51-38)
Lamelo Dosunmu drives to the basket... Lamelo Dosunmu loses the ball! Stripped by Kevin Simons! TURNOVER! (live ball)

[04:20] Team_091 possession (Score: 51-38)
Kyrie Rozier drives, Dirk Markkanen stays with him. Kyrie Rozier attempts a Dunk. Wide open! Dirk Markkanen is 6.0 feet away. [ZONE] KYRIE ROZIER MAKES IT! Assist: Rudy Bridges
Score: 53-38

[04:06] Team_022 possession (Score: 53-38)
Lamelo Dosunmu attempts a Layup. Contested by Kevin Simons (5.5 feet, ZONE). LAMELO DOSUNMU MAKES IT! Assist: Malcolm Allen
Score: 53-40

[03:53] Team_091 possession (Score: 53-40)
D'Angelo Ingram attempts a 3Pt. Contested by Michael Ginobili (5.7 feet, ZONE). D'Angelo Ingram misses. Rebound secured by Lamelo Dosunmu.

[03:38] Team_022 possession (Score: 53-40)
Dirk Markkanen attempts a Layup. Contested by Kevin Simons (5.5 feet, ZONE). Dirk Markkanen misses. Offensive rebound by Dirk Markkanen! Dirk Markkanen kicks it out.

[03:23] Team_022 possession (Score: 53-40)
FOUL! Shooting foul on Kyrie Rozier. Malcolm Allen to the line for 2 free throws. [Team fouls: 4] (Kyrie Rozier: 2 personal fouls)   FT 1/2: GOOD   FT 2/2: GOOD Malcolm Allen makes 2/2 from the line.
Score: 53-42

[03:06] Team_091 possession (Score: 53-42)
Rudy Bridges attempts a Layup. Wide open! Dirk Markkanen is 6.2 feet away. [ZONE] RUDY BRIDGES MAKES IT! Assist: Isaiah Siakam
Score: 55-42

[02:52] Team_022 possession (Score: 55-42)
Malcolm Allen attempts a Layup. Contested by Kyrie Rozier (5.8 feet, MAN). MALCOLM ALLEN MAKES IT! Assist: Michael Ginobili
Score: 55-44

[02:35] Team_091 possession (Score: 55-44)
Kyrie Rozier attempts a 3Pt. Wide open! Malcolm Allen is 6.1 feet away. [MAN] Kyrie Rozier misses. Rebound secured by Lamelo Dosunmu.

[02:21] Team_022 possession (Score: 55-44)
Dirk Markkanen drives to the basket... Dirk Markkanen commits a violation (traveling/carry)! TURNOVER! (dead ball)

[02:21] Substitution (Team_091): Kyrie Rozier OUT → Karl Morant IN (stamina_rule2)

[02:21] Substitution (Team_091): Isaiah Siakam OUT → Julius Barnes IN (stamina_rule2)

[02:21] Substitution (Team_091): Rudy Bridges OUT → Tim Antetokounmpo IN (stamina_rule2)

[02:21] Substitution (Team_091): D'Angelo Ingram OUT → Zion Mitchell IN (stamina_rule2)

[02:21] Substitution (Team_091): Kevin Simons OUT → Ja George IN (stamina_rule2)

[02:21] Substitution (Team_022): Malcolm Allen OUT → DeMar Harden IN (stamina_rule2)

[02:21] Substitution (Team_022): Michael Ginobili OUT → Lauri Gobert IN (stamina_rule2)

[02:21] Substitution (Team_022): Myles Anthony OUT → Dejounte Towns IN (stamina_rule2)

[02:21] Substitution (Team_022): Lamelo Dosunmu OUT → Kawhi Russell IN (stamina_rule2)

[02:21] Substitution (Team_022): Dirk Markkanen OUT → Cole Iverson IN (stamina_rule2)

[02:09] Team_091 possession (Score: 55-44)
Ja George attempts a Midrange. Contested by Cole Iverson (5.2 feet, MAN). Ja George misses. Offensive rebound by Zion Mitchell! Zion Mitchell kicks it out.

[01:56] Team_091 possession (Score: 55-44)
Ja George drives to the basket... Ja George loses the ball! Stripped by Cole Iverson! TURNOVER! (live ball)

[01:43] Team_022 possession (Score: 55-44)
Kawhi Russell attempts a Midrange. Contested by Tim Antetokounmpo (5.7 feet, ZONE). Kawhi Russell misses. Offensive rebound by Dejounte Towns! Dejounte Towns kicks it out.

[01:28] Team_022 possession (Score: 55-44)
Cole Iverson drives and kicks out. Dejounte Towns attempts a 3Pt. Contested by Tim Antetokounmpo (5.4 feet, MAN). Dejounte Towns misses. Offensive rebound by Lauri Gobert! Lauri Gobert kicks it out.

[01:14] Team_022 possession (Score: 55-44)
Dejounte Towns drives and kicks out. Cole Iverson attempts a Midrange. Contested by Ja George (4.7 feet, MAN). Cole Iverson misses. Rebound secured by Tim Antetokounmpo.

[00:58] Team_091 possession (Score: 55-44)
Karl Morant attempts a 3Pt. Contested by DeMar Harden (5.7 feet, MAN). Karl Morant misses. FOUL! Loose ball foul on Dejounte Towns during the rebound battle. [IN THE BONUS! 7 team fouls] Ja George to the line for 2 free throws. (Dejounte Towns: 1 personal fouls)   FT 1/2: GOOD   FT 2/2: GOOD Ja George makes 2/2 from the line.
Score: 57-44

[00:46] Team_022 possession (Score: 57-44)
Dejounte Towns loses the ball! Stripped by Tim Antetokounmpo! TURNOVER! (live ball)

[00:32] Team_091 possession (Score: 57-44)
FOUL! Shooting foul on Kawhi Russell. Julius Barnes to the line for 3 free throws. [BONUS: 8 team fouls] (Kawhi Russell: 1 personal fouls)   FT 1/3: GOOD   FT 2/3: MISS   FT 3/3: GOOD Julius Barnes makes 2/3 from the line.
Score: 59-44

[00:17] Team_022 possession (Score: 59-44)
Lauri Gobert loses control! Ball rolls out of bounds! TURNOVER! (dead ball)

[00:01] Team_091 possession (Score: 59-44)
Tim Antetokounmpo attempts a Layup. Contested by Dejounte Towns (4.6 feet, MAN). TIM ANTETOKOUNMPO MAKES IT! Assist: Julius Barnes
Score: 61-44

================================================================================
                              2ND QUARTER COMPLETE                              
================================================================================

2ND QUARTER SCORE: Team_091 32, Team_022 14

BOX SCORE:
================================================================================

Team_091
--------------------------------------------------------------------------------
Player                MIN  PTS  REB  AST  TO      FG   FG%      3P   3P%
--------------------------------------------------------------------------------
Isaiah Siakam          22    8    0    4   0   3/5    60.0     0/0   0.0
D'Angelo Ingram        22    6    0    1   0   3/4    75.0     0/0   0.0
Rudy Bridges           22    5    4    1   0   2/3    66.7     0/0   0.0
Kyrie Rozier           22    5    2    0   0   2/4    50.0     0/0   0.0
Kevin Simons           22    2    5    0   0   1/1   100.0     0/0   0.0
Tim Antetokounmpo       2    2    1    0   0   1/1   100.0     0/0   0.0
Ja George               2    2    0    0   0   1/1   100.0     0/0   0.0
Julius Barnes           2    2    0    1   0   1/1   100.0     0/0   0.0
Zion Mitchell           2    0    1    0   0   0/0     0.0     0/0   0.0

TEAM: FG: 14/20 (70.0%), 3PT: 6/11 (54.5%), REB: 13 (3 off, 10 def), AST: 7, TO: 2
TEAM FOULS: 4


Team_022
--------------------------------------------------------------------------------
Player                MIN  PTS  REB  AST  TO      FG   FG%      3P   3P%
--------------------------------------------------------------------------------
Malcolm Allen          22    6    0    1   0   3/4    75.0     0/0   0.0
Myles Anthony          22    2    0    0   0   1/4    25.0     0/0   0.0
Dirk Markkanen         22    2    2    1   0   1/4    25.0     0/0   0.0
Lamelo Dosunmu         19    2    3    0   0   1/2    50.0     0/0   0.0
Michael Ginobili       22    0    4    1   0   0/1     0.0     0/0   0.0
Dejounte Towns          2    0    1    0   0   0/1     0.0     0/0   0.0
Lauri Gobert            2    0    1    0   0   0/0     0.0     0/0   0.0

TEAM: FG: 6/16 (37.5%), 3PT: 0/2 (0.0%), REB: 11 (5 off, 6 def), AST: 3, TO: 5
TEAM FOULS: 8 [Team_091 in BONUS]

================================================================================

================================================================================
                       3RD QUARTER - Team_091 vs Team_022                       
================================================================================

[12:00] Team_091 possession (Score: 61-44)
Rudy Bridges attempts a Midrange. Contested by Myles Anthony (4.5 feet, ZONE). RUDY BRIDGES MAKES IT!
Score: 63-44

[11:43] Team_022 possession (Score: 63-44)
Michael Ginobili attempts a 3Pt. Contested by Kyrie Rozier (4.1 feet, ZONE). Michael Ginobili misses. Rebound secured by Rudy Bridges.

[11:27] Team_091 possession (Score: 63-44)
Isaiah Siakam attempts a 3Pt. Contested by Michael Ginobili (3.8 feet, ZONE). ISAIAH SIAKAM MAKES IT! Assist: Rudy Bridges
Score: 66-44

[11:13] Team_022 possession (Score: 66-44)
Myles Anthony drives and kicks out. FOUL! Shooting foul on Kyrie Rozier. Dirk Markkanen to the line for 3 free throws. [Team fouls: 1] (Kyrie Rozier: 1 personal fouls)   FT 1/3: GOOD   FT 2/3: GOOD   FT 3/3: GOOD Dirk Markkanen makes 3/3 from the line.
Score: 66-47

[10:57] Team_091 possession (Score: 66-47)
Kevin Simons throws a bad pass! Stolen by Dirk Markkanen! TURNOVER! (live ball)

[10:43] Team_022 possession (Score: 66-47)
Lamelo Dosunmu drives to the basket... FOUL! Offensive foul on Lamelo Dosunmu! D'Angelo Ingram drew the charge! [Team fouls: 1] (Lamelo Dosunmu: 1 personal fouls) TURNOVER! (dead ball)

[10:29] Team_091 possession (Score: 66-47)
FOUL! Shooting foul on Lamelo Dosunmu. D'Angelo Ingram to the line for 2 free throws. [Team fouls: 2] (Lamelo Dosunmu: 2 personal fouls)   FT 1/2: GOOD   FT 2/2: MISS D'Angelo Ingram makes 1/2 from the line. Rebound secured by Myles Anthony.
Score: 67-47

[10:15] Team_022 possession (Score: 67-47)
Dirk Markkanen attempts a Midrange. Contested by Kyrie Rozier (4.6 feet, ZONE). Dirk Markkanen misses. FOUL! Loose ball foul on Rudy Bridges during the rebound battle. [Team fouls: 2] No free throws, side out. (Rudy Bridges: 1 personal fouls)

[10:05] Team_022 possession (Score: 67-47)
Lamelo Dosunmu drives and kicks out. Dirk Markkanen attempts a 3Pt. Contested by Kevin Simons (3.5 feet, MAN). Dirk Markkanen misses. Offensive rebound by Michael Ginobili! Michael Ginobili kicks it out.

[09:50] Team_022 possession (Score: 67-47)
Michael Ginobili attempts a Midrange. Contested by Isaiah Siakam (5.7 feet, ZONE). Michael Ginobili misses. FOUL! Loose ball foul on Kevin Simons during the rebound battle. [Team fouls: 3] No free throws, side out. (Kevin Simons: 1 personal fouls)

[09:35] Team_022 possession (Score: 67-47)
Dirk Markkanen drives, picks up Kevin Simons. Help arrives from Kyrie Rozier! Dirk Markkanen attempts a Dunk. Contested by Kyrie Rozier (4.0 feet, MAN). Dirk Markkanen misses. Rebound secured by Kyrie Rozier.

[09:25] Team_091 possession (Score: 67-47)
Rudy Bridges attempts a 3Pt. Contested by Michael Ginobili (3.6 feet, ZONE). Rudy Bridges misses. Rebound secured by Myles Anthony.

[09:11] Team_022 possession (Score: 67-47)
Lamelo Dosunmu attempts a 3Pt. Contested by D'Angelo Ingram (5.1 feet, MAN). Lamelo Dosunmu misses. Rebound secured by Rudy Bridges.

[08:58] Team_091 possession (Score: 67-47)
Kevin Simons drives and kicks out. Kevin Simons attempts a Midrange. Contested by Dirk Markkanen (4.6 feet, MAN). Kevin Simons misses. Rebound secured by Dirk Markkanen.

[08:45] Team_022 possession (Score: 67-47)
FOUL! Reach-in foul on Kyrie Rozier during the drive. [Team fouls: 4] No free throws, side out. (Kyrie Rozier: 2 personal fouls)

[08:29] Team_022 possession (Score: 67-47)
Dirk Markkanen attempts a Layup. Contested by Kevin Simons (4.0 feet, ZONE). DIRK MARKKANEN MAKES IT!
Score: 67-49

[08:13] Team_091 possession (Score: 67-49)
Kevin Simons attempts a Midrange. Contested by Michael Ginobili (3.9 feet, ZONE). KEVIN SIMONS MAKES IT! Assist: D'Angelo Ingram
Score: 69-49

[08:01] Team_022 possession (Score: 69-49)
Malcolm Allen attempts a 3Pt. Contested by Kyrie Rozier (4.8 feet, MAN). Malcolm Allen misses. Rebound secured by Rudy Bridges.

[07:46] Team_091 possession (Score: 69-49)
Isaiah Siakam attempts a 3Pt. Contested by Michael Ginobili (3.8 feet, MAN). ISAIAH SIAKAM MAKES IT! Assist: Kevin Simons
Score: 72-49

[07:31] Team_022 possession (Score: 72-49)
Lamelo Dosunmu drives, D'Angelo Ingram stays with him. Lamelo Dosunmu attempts a Dunk. Contested by D'Angelo Ingram (5.1 feet, MAN). LAMELO DOSUNMU MAKES IT!
Score: 72-51

[07:17] Team_091 possession (Score: 72-51)
Kyrie Rozier attempts a 3Pt. Contested by Malcolm Allen (4.5 feet, ZONE). KYRIE ROZIER MAKES IT!
Score: 75-51

[07:06] Team_022 possession (Score: 75-51)
Lamelo Dosunmu attempts a Midrange. Contested by D'Angelo Ingram (5.1 feet, MAN). Lamelo Dosunmu misses. Rebound secured by Kyrie Rozier.

[06:54] Team_091 possession (Score: 75-51)
D'Angelo Ingram attempts a 3Pt. Contested by Malcolm Allen (5.4 feet, ZONE). D'Angelo Ingram misses. Offensive rebound by Kevin Simons! Kevin Simons puts it back in!
Score: 77-51

[06:38] Team_022 possession (Score: 77-51)
Lamelo Dosunmu attempts a 3Pt. Wide open! Isaiah Siakam is 6.1 feet away. [ZONE] Lamelo Dosunmu misses. Rebound secured by Kevin Simons.

[06:23] Team_091 possession (Score: 77-51)
Rudy Bridges attempts a 3Pt. Contested by Myles Anthony (4.5 feet, MAN). Rudy Bridges misses. Rebound secured by Dirk Markkanen.

[06:10] Team_022 possession (Score: 77-51)
Lamelo Dosunmu attempts a Midrange. Contested by D'Angelo Ingram (5.1 feet, ZONE). Lamelo Dosunmu misses. Rebound secured by Kyrie Rozier.

[05:57] Team_091 possession (Score: 77-51)
D'Angelo Ingram attempts a 3Pt. Contested by Lamelo Dosunmu (5.6 feet, MAN). D'Angelo Ingram misses. Rebound secured by Dirk Markkanen.

[05:43] Team_022 possession (Score: 77-51)
Lamelo Dosunmu attempts a Layup. Contested by D'Angelo Ingram (5.1 feet, MAN). Lamelo Dosunmu misses. Rebound secured by Rudy Bridges.

[05:28] Team_091 possession (Score: 77-51)
Isaiah Siakam attempts a Midrange. Contested by Lamelo Dosunmu (5.0 feet, ZONE). Isaiah Siakam misses. Rebound secured by Dirk Markkanen.

[05:11] Team_022 possession (Score: 77-51)
Myles Anthony makes the Layup and draws the foul on Rudy Bridges! And-1! Myles Anthony to the line for 1. [BONUS: 5 team fouls] (Rudy Bridges: 2 personal fouls)   FT 1/1: GOOD Myles Anthony makes 1/1 from the line.
Score: 77-54

[04:55] Team_091 possession (Score: 77-54)
Isaiah Siakam attempts a Midrange. Contested by Michael Ginobili (3.9 feet, MAN). ISAIAH SIAKAM MAKES IT!
Score: 79-54

[04:42] Team_022 possession (Score: 79-54)
Dirk Markkanen attempts a Midrange. Wide open! Isaiah Siakam is 6.2 feet away. [ZONE] Dirk Markkanen misses. FOUL! Loose ball foul on Kyrie Rozier during the rebound battle. [IN THE BONUS! 6 team fouls] Michael Ginobili to the line for 2 free throws. (Kyrie Rozier: 3 personal fouls)   FT 1/2: GOOD   FT 2/2: GOOD Michael Ginobili makes 2/2 from the line.
Score: 79-56

[04:26] Team_091 possession (Score: 79-56)
Kyrie Rozier attempts a 3Pt. Contested by Michael Ginobili (3.7 feet, ZONE). Kyrie Rozier misses. Rebound secured by Dirk Markkanen.

[04:10] Team_022 possession (Score: 79-56)
Malcolm Allen attempts a Midrange. Contested by Kyrie Rozier (4.8 feet, MAN). MALCOLM ALLEN MAKES IT!
Score: 79-58

[03:55] Team_091 possession (Score: 79-58)
D'Angelo Ingram makes the Layup and draws the foul on Lamelo Dosunmu! And-1! D'Angelo Ingram to the line for 1. [Team fouls: 3] (Lamelo Dosunmu: 3 personal fouls)   FT 1/1: GOOD D'Angelo Ingram makes 1/1 from the line.
Score: 82-58

[03:38] Team_022 possession (Score: 82-58)
Malcolm Allen drives to the basket... Malcolm Allen throws a bad pass out of bounds! TURNOVER! (dead ball)

[03:25] Team_091 possession (Score: 82-58)
Rudy Bridges attempts a 3Pt. Contested by Myles Anthony (4.7 feet, MAN). Rudy Bridges misses. Rebound secured by Michael Ginobili.

[03:13] Team_022 possession (Score: 82-58)
FOUL! Holding foul on D'Angelo Ingram. [IN THE BONUS! 7 team fouls] Lamelo Dosunmu to the line for 2 free throws. (D'Angelo Ingram: 1 personal fouls)   FT 1/2: GOOD   FT 2/2: GOOD Lamelo Dosunmu makes 2/2 from the line.
Score: 82-60

[02:57] Team_091 possession (Score: 82-60)
Kevin Simons attempts a Midrange. Contested by Dirk Markkanen (5.2 feet, MAN). Kevin Simons misses. Rebound secured by Myles Anthony.

[02:43] Team_022 possession (Score: 82-60)
Michael Ginobili drives to the basket... Michael Ginobili loses the ball! Stripped by Isaiah Siakam! TURNOVER! (live ball)

[02:23] Team_091 possession (Score: 82-60)
FOUL! Holding foul on Michael Ginobili. [Team fouls: 4] No free throws, side out. (Michael Ginobili: 1 personal fouls)

[02:06] Team_091 possession (Score: 82-60)
D'Angelo Ingram drives and kicks out. Kyrie Rozier attempts a 3Pt. Contested by Malcolm Allen (4.8 feet, MAN). Kyrie Rozier misses. Offensive rebound by Kevin Simons! Kevin Simons's putback is no good. Rebound secured by Myles Anthony.

[01:51] Team_022 possession (Score: 82-60)
Michael Ginobili attempts a Layup. Wide open! Isaiah Siakam is 6.0 feet away. [MAN] Michael Ginobili misses. Rebound secured by Kevin Simons.

[01:39] Team_091 possession (Score: 82-60)
D'Angelo Ingram attempts a Midrange. Contested by Lamelo Dosunmu (5.9 feet, ZONE). D'Angelo Ingram misses. Offensive rebound by Rudy Bridges! Rudy Bridges kicks it out.

[01:23] Team_091 possession (Score: 82-60)
Rudy Bridges attempts a 3Pt. Contested by Myles Anthony (4.9 feet, MAN). Rudy Bridges misses. Offensive rebound by Kevin Simons! Kevin Simons puts it back in!
Score: 84-60

[01:08] Team_022 possession (Score: 84-60)
Dirk Markkanen attempts a Midrange. Contested by D'Angelo Ingram (5.5 feet, ZONE). Dirk Markkanen misses. Offensive rebound by Dirk Markkanen! Dirk Markkanen puts it back in!
Score: 84-62

[00:54] Team_091 possession (Score: 84-62)
Kyrie Rozier attempts a Layup. Contested by Malcolm Allen (5.0 feet, MAN). KYRIE ROZIER MAKES IT! Assist: Rudy Bridges
Score: 86-62

[00:40] Team_022 possession (Score: 86-62)
Malcolm Allen attempts a Midrange. Contested by Kyrie Rozier (5.0 feet, MAN). MALCOLM ALLEN MAKES IT! Assist: Dirk Markkanen
Score: 86-64

[00:24] Team_091 possession (Score: 86-64)
Kyrie Rozier attempts a 3Pt. Contested by Michael Ginobili (4.1 feet, ZONE). Kyrie Rozier misses. Rebound secured by Dirk Markkanen.

[00:11] Team_022 possession (Score: 86-64)
Lamelo Dosunmu drives to the basket... Lamelo Dosunmu throws a bad pass out of bounds! TURNOVER! (dead ball)

[00:11] Substitution (Team_091): Kyrie Rozier OUT → Karl Morant IN (stamina_rule2)

[00:11] Substitution (Team_091): Isaiah Siakam OUT → Julius Barnes IN (stamina_rule2)

[00:11] Substitution (Team_091): Rudy Bridges OUT → Tim Antetokounmpo IN (stamina_rule2)

[00:11] Substitution (Team_091): D'Angelo Ingram OUT → Zion Mitchell IN (stamina_rule2)

[00:11] Substitution (Team_091): Kevin Simons OUT → Ja George IN (stamina_rule2)

[00:11] Substitution (Team_022): Malcolm Allen OUT → DeMar Harden IN (stamina_rule2)

[00:11] Substitution (Team_022): Michael Ginobili OUT → Lauri Gobert IN (stamina_rule2)

[00:11] Substitution (Team_022): Myles Anthony OUT → Dejounte Towns IN (stamina_rule2)

[00:11] Substitution (Team_022): Lamelo Dosunmu OUT → Kawhi Russell IN (stamina_rule2)

[00:11] Substitution (Team_022): Dirk Markkanen OUT → Cole Iverson IN (stamina_rule2)

================================================================================
                              3RD QUARTER COMPLETE                              
================================================================================

3RD QUARTER SCORE: Team_091 25, Team_022 20

BOX SCORE:
================================================================================

Team_091
--------------------------------------------------------------------------------
Player                MIN  PTS  REB  AST  TO      FG   FG%      3P   3P%
--------------------------------------------------------------------------------
Isaiah Siakam          34    8    0    0   0   3/4    75.0     0/0   0.0
Kevin Simons           34    6    4    1   0   3/5    60.0     0/0   0.0
Kyrie Rozier           34    5    3    0   0   2/4    50.0     0/0   0.0
D'Angelo Ingram        34    3    0    1   0   1/4    25.0     0/0   0.0
Myles Anthony          34    3    4    0   0   1/1   100.0     0/0   0.0
Rudy Bridges           34    2    5    2   0   1/4    25.0     0/0   0.0

TEAM: FG: 10/21 (47.6%), 3PT: 5/11 (45.5%), REB: 13 (4 off, 9 def), AST: 4, TO: 1
TEAM FOULS: 7 [Team_022 in BONUS]


Team_022
--------------------------------------------------------------------------------
Player                MIN  PTS  REB  AST  TO      FG   FG%      3P   3P%
--------------------------------------------------------------------------------
Dirk Markkanen         34    7    7    1   0   3/4    75.0     0/0   0.0
Lamelo Dosunmu         31    4    0    0   0   2/7    28.6     0/0   0.0
Malcolm Allen          34    4    0    0   0   2/3    66.7     0/0   0.0
Michael Ginobili       34    2    4    0   0   1/3    33.3     0/0   0.0

TEAM: FG: 9/18 (50.0%), 3PT: 0/4 (0.0%), REB: 14 (4 off, 10 def), AST: 1, TO: 4
TEAM FOULS: 4

================================================================================

================================================================================
                       4TH QUARTER - Team_091 vs Team_022                       
================================================================================

[12:00] Team_091 possession (Score: 86-64)
D'Angelo Ingram attempts a 3Pt. Contested by Lamelo Dosunmu (5.9 feet, MAN). D'Angelo Ingram misses. Rebound secured by Myles Anthony.

[11:48] Team_022 possession (Score: 86-64)
FOUL! Shooting foul on D'Angelo Ingram. Lamelo Dosunmu to the line for 2 free throws. [Team fouls: 1] (D'Angelo Ingram: 1 personal fouls)   FT 1/2: GOOD   FT 2/2: MISS Lamelo Dosunmu makes 1/2 from the line. Offensive rebound by Michael Ginobili! Michael Ginobili kicks it out.
Score: 86-65

[11:35] Team_022 possession (Score: 86-65)
Dirk Markkanen attempts a Midrange. Contested by D'Angelo Ingram (5.4 feet, ZONE). Dirk Markkanen misses. Rebound secured by Kyrie Rozier.

[11:24] Team_091 possession (Score: 86-65)
D'Angelo Ingram drives and kicks out. Kevin Simons attempts a 3Pt. Contested by Dirk Markkanen (5.0 feet, MAN). KEVIN SIMONS MAKES IT! Assist: D'Angelo Ingram
Score: 89-65

[11:10] Team_022 possession (Score: 89-65)
Myles Anthony drives to the basket... Myles Anthony loses control! Ball rolls out of bounds! TURNOVER! (dead ball)

[11:10] Substitution (Team_091): Kyrie Rozier OUT → Karl Morant IN (stamina_rule2)

[11:10] Substitution (Team_091): Isaiah Siakam OUT → Julius Barnes IN (stamina_rule2)

[11:10] Substitution (Team_091): Rudy Bridges OUT → Tim Antetokounmpo IN (stamina_rule2)

[11:10] Substitution (Team_091): D'Angelo Ingram OUT → Zion Mitchell IN (stamina_rule2)

[11:10] Substitution (Team_091): Kevin Simons OUT → Ja George IN (stamina_rule2)

[11:10] Substitution (Team_022): Malcolm Allen OUT → DeMar Harden IN (stamina_rule2)

[11:10] Substitution (Team_022): Michael Ginobili OUT → Lauri Gobert IN (stamina_rule2)

[11:10] Substitution (Team_022): Myles Anthony OUT → Dejounte Towns IN (stamina_rule2)

[11:10] Substitution (Team_022): Lamelo Dosunmu OUT → Kawhi Russell IN (stamina_rule2)

[11:10] Substitution (Team_022): Dirk Markkanen OUT → Cole Iverson IN (stamina_rule2)

[10:55] Team_091 possession (Score: 89-65)
Julius Barnes attempts a 3Pt. Contested by Kawhi Russell (4.0 feet, ZONE). Julius Barnes misses. Rebound secured by Kawhi Russell.

[10:39] Team_022 possession (Score: 89-65)
Dejounte Towns attempts a Layup. Contested by Ja George (4.8 feet, ZONE). DEJOUNTE TOWNS MAKES IT! Assist: Cole Iverson
Score: 89-67

[10:22] Team_091 possession (Score: 89-67)
Zion Mitchell makes the Layup and draws the foul on Kawhi Russell! And-1! Zion Mitchell to the line for 1. [Team fouls: 1] (Kawhi Russell: 1 personal fouls)   FT 1/1: GOOD Zion Mitchell makes 1/1 from the line.
Score: 92-67

[10:06] Team_022 possession (Score: 92-67)
FOUL! Shooting foul on Karl Morant. Cole Iverson to the line for 2 free throws. [Team fouls: 2] (Karl Morant: 1 personal fouls)   FT 1/2: MISS   FT 2/2: GOOD Cole Iverson makes 1/2 from the line.
Score: 92-68

[09:52] Team_091 possession (Score: 92-68)
Ja George drives, Cole Iverson stays with him. Ja George attempts a Dunk. Contested by Cole Iverson (5.2 feet, MAN). JA GEORGE MAKES IT! Assist: Tim Antetokounmpo
Score: 94-68

[09:35] Team_022 possession (Score: 94-68)
DeMar Harden attempts a Layup. Contested by Zion Mitchell (4.9 feet, ZONE). DEMAR HARDEN MAKES IT! Assist: Kawhi Russell
Score: 94-70

[09:18] Team_091 possession (Score: 94-70)
FOUL! Shooting foul on DeMar Harden. Karl Morant to the line for 3 free throws. [Team fouls: 2] (DeMar Harden: 1 personal fouls)   FT 1/3: GOOD   FT 2/3: GOOD   FT 3/3: MISS Karl Morant makes 2/3 from the line. Rebound secured by Lauri Gobert.
Score: 96-70

[08:59] Team_022 possession (Score: 96-70)
DeMar Harden attempts a Midrange. Contested by Karl Morant (4.9 feet, MAN). DeMar Harden misses. FOUL! Loose ball foul on Tim Antetokounmpo during the rebound battle. [Team fouls: 3] No free throws, side out. (Tim Antetokounmpo: 1 personal fouls)

[08:48] Team_022 possession (Score: 96-70)
Lauri Gobert attempts a Layup. BLOCKED BY JULIUS BARNES! Ball is loose! Rebound secured by Tim Antetokounmpo.

[08:32] Team_091 possession (Score: 96-70)
Julius Barnes attempts a 3Pt. Contested by Kawhi Russell (4.0 feet, ZONE). Julius Barnes misses. Offensive rebound by Ja George! Ja George kicks it out.

[08:22] Team_091 possession (Score: 96-70)
Tim Antetokounmpo drives to the basket... Tim Antetokounmpo throws a bad pass out of bounds! TURNOVER! (dead ball)

[08:11] Team_022 possession (Score: 96-70)
Dejounte Towns attempts a Layup. Contested by Tim Antetokounmpo (5.5 feet, MAN). DEJOUNTE TOWNS MAKES IT! Assist: Kawhi Russell
Score: 96-72

[07:53] Team_091 possession (Score: 96-72)
Julius Barnes attempts a 3Pt. Contested by Kawhi Russell (4.0 feet, ZONE). Julius Barnes misses. Rebound secured by Dejounte Towns.

[07:41] Team_022 possession (Score: 96-72)
Kawhi Russell makes the Layup and draws the foul on Zion Mitchell! And-1! Kawhi Russell to the line for 1. [Team fouls: 4] (Zion Mitchell: 1 personal fouls)   FT 1/1: GOOD Kawhi Russell makes 1/1 from the line.
Score: 96-75

[07:27] Team_091 possession (Score: 96-75)
Julius Barnes attempts a Midrange. Contested by Kawhi Russell (4.0 feet, ZONE). JULIUS BARNES MAKES IT! Assist: Zion Mitchell
Score: 98-75

[07:12] Team_022 possession (Score: 98-75)
FOUL! Offensive foul on Lauri Gobert! Julius Barnes drew the charge! [Team fouls: 3] (Lauri Gobert: 1 personal fouls) TURNOVER! (dead ball)

[06:57] Team_091 possession (Score: 98-75)
Tim Antetokounmpo drives and kicks out. Julius Barnes attempts a 3Pt. Contested by Dejounte Towns (4.5 feet, ZONE). JULIUS BARNES MAKES IT! Assist: Karl Morant
Score: 101-75

[06:45] Team_022 possession (Score: 101-75)
Kawhi Russell makes the Dunk and draws the foul on Karl Morant! And-1! Kawhi Russell to the line for 1. [BONUS: 5 team fouls] (Karl Morant: 2 personal fouls)   FT 1/1: GOOD Kawhi Russell makes 1/1 from the line.
Score: 101-78

[06:27] Team_091 possession (Score: 101-78)
Tim Antetokounmpo attempts a 3Pt. Contested by Kawhi Russell (4.2 feet, ZONE). Tim Antetokounmpo misses. Rebound secured by Dejounte Towns.

[06:13] Team_022 possession (Score: 101-78)
Dejounte Towns attempts a Midrange. Contested by Zion Mitchell (5.0 feet, ZONE). Dejounte Towns misses. Rebound secured by Tim Antetokounmpo.

[06:01] Team_091 possession (Score: 101-78)
Ja George drives, picks up Cole Iverson. Help arrives from Lauri Gobert! Ja George attempts a Layup. Contested by Lauri Gobert (5.2 feet, MAN). JA GEORGE MAKES IT!
Score: 103-78

[05:50] Team_022 possession (Score: 103-78)
Cole Iverson attempts a Midrange. Contested by Zion Mitchell (4.9 feet, ZONE). COLE IVERSON MAKES IT!
Score: 103-80

[05:36] Team_091 possession (Score: 103-80)
FOUL! Shooting foul on Kawhi Russell. Karl Morant to the line for 2 free throws. [Team fouls: 4] (Kawhi Russell: 2 personal fouls)   FT 1/2: GOOD   FT 2/2: GOOD Karl Morant makes 2/2 from the line.
Score: 105-80

[05:21] Team_022 possession (Score: 105-80)
Cole Iverson drives, picks up Zion Mitchell. Help arrives from Karl Morant! Cole Iverson attempts a Dunk. Contested by Karl Morant (4.9 feet, ZONE). Cole Iverson misses. Rebound secured by Ja George.

[05:09] Team_091 possession (Score: 105-80)
Julius Barnes attempts a Layup. Contested by Lauri Gobert (4.5 feet, MAN). JULIUS BARNES MAKES IT! Assist: Karl Morant
Score: 107-80

[04:52] Team_022 possession (Score: 107-80)
Kawhi Russell attempts a 3Pt. Contested by Tim Antetokounmpo (5.7 feet, ZONE). Kawhi Russell misses. Rebound secured by Ja George.

[04:39] Team_091 possession (Score: 107-80)
Ja George drives, picks up Cole Iverson. Help arrives from Lauri Gobert! Ja George attempts a Layup. Contested by Lauri Gobert (5.2 feet, MAN). JA GEORGE MAKES IT! Assist: Karl Morant
Score: 109-80

[04:19] Team_022 possession (Score: 109-80)
Lauri Gobert attempts a Layup. Contested by Julius Barnes (4.9 feet, MAN). Lauri Gobert misses. Offensive rebound by Dejounte Towns! Dejounte Towns kicks it out.

[04:00] Team_022 possession (Score: 109-80)
Cole Iverson attempts a Layup. Contested by Zion Mitchell (4.9 feet, ZONE). COLE IVERSON MAKES IT! Assist: Dejounte Towns
Score: 109-82

[03:47] Team_091 possession (Score: 109-82)
FOUL! Shooting foul on Kawhi Russell. Zion Mitchell to the line for 2 free throws. [BONUS: 5 team fouls] (Kawhi Russell: 3 personal fouls)   FT 1/2: MISS   FT 2/2: GOOD Zion Mitchell makes 1/2 from the line.
Score: 110-82

[03:29] Team_022 possession (Score: 110-82)
Kawhi Russell attempts a 3Pt. Contested by Karl Morant (5.2 feet, ZONE). KAWHI RUSSELL MAKES IT! Assist: Cole Iverson
Score: 110-85

[03:19] Team_091 possession (Score: 110-85)
Tim Antetokounmpo drives, Dejounte Towns stays with him. Tim Antetokounmpo attempts a Layup. Contested by Dejounte Towns (4.6 feet, MAN). TIM ANTETOKOUNMPO MAKES IT! Assist: Zion Mitchell
Score: 112-85

[03:07] Team_022 possession (Score: 112-85)
DeMar Harden attempts a 3Pt. Contested by Karl Morant (4.9 feet, ZONE). DeMar Harden misses. Rebound secured by Tim Antetokounmpo.

[02:51] Team_091 possession (Score: 112-85)
Ja George attempts a Midrange. Contested by Dejounte Towns (4.6 feet, ZONE). JA GEORGE MAKES IT! Assist: Karl Morant
Score: 114-85

[02:41] Team_022 possession (Score: 114-85)
Dejounte Towns attempts a Midrange. Contested by Tim Antetokounmpo (5.6 feet, MAN). DEJOUNTE TOWNS MAKES IT! Assist: Lauri Gobert
Score: 114-87

[02:27] Team_091 possession (Score: 114-87)
FOUL! Reach-in foul on Lauri Gobert during the drive. [IN THE BONUS! 6 team fouls] Julius Barnes to the line for 2 free throws. (Lauri Gobert: 2 personal fouls)   FT 1/2: GOOD   FT 2/2: GOOD Julius Barnes makes 2/2 from the line.
Score: 116-87

[02:14] Team_022 possession (Score: 116-87)
Cole Iverson attempts a Layup. Contested by Zion Mitchell (5.1 feet, ZONE). Cole Iverson misses. Rebound secured by Ja George.

[02:02] Team_091 possession (Score: 116-87)
Karl Morant attempts a Midrange. Contested by DeMar Harden (5.9 feet, MAN). KARL MORANT MAKES IT!
Score: 118-87

[01:47] Team_022 possession (Score: 118-87)
Kawhi Russell attempts a Layup. Contested by Zion Mitchell (5.4 feet, MAN). KAWHI RUSSELL MAKES IT!
Score: 118-89

[01:33] Team_091 possession (Score: 118-89)
Julius Barnes attempts a 3Pt. Contested by Kawhi Russell (4.3 feet, ZONE). Julius Barnes misses. Rebound secured by Lauri Gobert.

[01:22] Team_022 possession (Score: 118-89)
Cole Iverson attempts a Layup. BLOCKED BY JA GEORGE! Ball is loose! Offensive rebound by Lauri Gobert! Lauri Gobert kicks it out.

[01:09] Team_022 possession (Score: 118-89)
Dejounte Towns makes the Layup and draws the foul on Zion Mitchell! And-1! Dejounte Towns to the line for 1. [BONUS: 6 team fouls] (Zion Mitchell: 2 personal fouls)   FT 1/1: GOOD Dejounte Towns makes 1/1 from the line.
Score: 118-92

[00:56] Team_091 possession (Score: 118-92)
Zion Mitchell attempts a Midrange. Contested by Lauri Gobert (4.9 feet, ZONE). ZION MITCHELL MAKES IT!
Score: 120-92

[00:43] Team_022 possession (Score: 120-92)
Cole Iverson attempts a Midrange. Contested by Ja George (5.0 feet, MAN). Cole Iverson misses. Offensive rebound by Dejounte Towns! Dejounte Towns kicks it out.

[00:28] Team_022 possession (Score: 120-92)
FOUL! Holding foul on Tim Antetokounmpo. [IN THE BONUS! 7 team fouls] Dejounte Towns to the line for 2 free throws. (Tim Antetokounmpo: 2 personal fouls)   FT 1/2: MISS   FT 2/2: GOOD Dejounte Towns makes 1/2 from the line.
Score: 120-93

[00:12] Team_091 possession (Score: 120-93)
Julius Barnes attempts a 3Pt. Contested by Lauri Gobert (4.8 feet, MAN). JULIUS BARNES MAKES IT! Assist: Zion Mitchell
Score: 123-93

================================================================================
                              4TH QUARTER COMPLETE                              
================================================================================

4TH QUARTER SCORE: Team_091 37, Team_022 29

BOX SCORE:
================================================================================

Team_091
--------------------------------------------------------------------------------
Player                MIN  PTS  REB  AST  TO      FG   FG%      3P   3P%
--------------------------------------------------------------------------------
Julius Barnes          13   12    0    0   0   5/8    62.5     0/0   0.0
Ja George              13    8    4    0   0   4/4   100.0     0/0   0.0
Zion Mitchell          13    6    0    3   0   3/3   100.0     0/0   0.0
Karl Morant            13    4    0    4   0   2/3    66.7     0/0   0.0
Kevin Simons           35    3    0    0   0   1/1   100.0     0/0   0.0
Tim Antetokounmpo      13    2    3    1   0   1/2    50.0     0/0   0.0
D'Angelo Ingram        35    0    0    1   0   0/1     0.0     0/0   0.0
Kyrie Rozier           35    0    1    0   0   0/0     0.0     0/0   0.0

TEAM: FG: 16/22 (72.7%), 3PT: 1/7 (14.3%), REB: 8 (1 off, 7 def), AST: 9, TO: 1
TEAM FOULS: 7 [Team_022 in BONUS]


Team_022
--------------------------------------------------------------------------------
Player                MIN  PTS  REB  AST  TO      FG   FG%      3P   3P%
--------------------------------------------------------------------------------
Kawhi Russell          16   11    1    2   0   4/5    80.0     0/0   0.0
Dejounte Towns         13   10    5    1   0   5/6    83.3     0/0   0.0
Cole Iverson           13    5    0    2   0   3/5    60.0     0/0   0.0
DeMar Harden           13    2    0    0   0   1/2    50.0     0/0   0.0
Myles Anthony          35    0    1    0   0   0/0     0.0     0/0   0.0
Michael Ginobili       35    0    1    0   0   0/0     0.0     0/0   0.0
Dirk Markkanen         35    0    0    0   0   0/1     0.0     0/0   0.0
Lauri Gobert           13    0    3    1   0   0/1     0.0     0/0   0.0

TEAM: FG: 13/20 (65.0%), 3PT: 1/3 (33.3%), REB: 11 (5 off, 6 def), AST: 6, TO: 2
TEAM FOULS: 6 [Team_091 in BONUS]

================================================================================

================================================================================
                               FULL GAME COMPLETE                               
================================================================================

FINAL SCORE: Team_091 123, Team_022 93

SCORING BY QUARTER:
--------------------------------------------------------------------------------
Team                     Q1     Q2     Q3     Q4    FINAL
--------------------------------------------------------------------------------
Team_091                 29     32     25     37      123
Team_022                 30     14     20     29       93
--------------------------------------------------------------------------------

FULL GAME BOX SCORE:
================================================================================

Team_091
--------------------------------------------------------------------------------
Player                MIN  PTS  REB  AST  TO      FG   FG%      3P   3P%      FT STL BLK
--------------------------------------------------------------------------------
Kyrie Rozier           35   10    9    1   1   5/11   45.5   2/6    33.3   0/1     0   1
Isaiah Siakam          35   22    0    6   1   8/12   66.7   5/6    83.3   8/9     1   0
Rudy Bridges           35   14   14    3   2   6/12   50.0   2/7    28.6   1/3     0   0
D'Angelo Ingram        35   15    0    3   0   8/14   57.1   2/5    40.0   7/8     0   0
Kevin Simons           35   18   11    1   1   5/8    62.5   1/1   100.0   2/2     1   0
Karl Morant            13    4    0    4   2   3/4    75.0   1/2    50.0   4/5     0   0
Julius Barnes          13   14    0    1   0   5/8    62.5   2/5    40.0   4/5     0   1
Tim Antetokounmpo      13    4    4    1   0   3/4    75.0   0/1     0.0   0/0     1   0
Zion Mitchell          13    6    1    3   0   3/3   100.0   0/0     0.0   2/3     0   0
Ja George              13   10    4    0   0   4/4   100.0   0/0     0.0   2/2     0   1

TEAM: FG: 50/81 (61.7%), 3PT: 15/33 (45.5%), REB: 45 (11 off, 34 def), AST: 23, TO: 7


Team_022
--------------------------------------------------------------------------------
Player                MIN  PTS  REB  AST  TO      FG   FG%      3P   3P%      FT STL BLK
--------------------------------------------------------------------------------
Malcolm Allen          35   10    0    3   1   5/8    62.5   0/2     0.0   2/2     0   0
Michael Ginobili       35    2   12    3   2   0/5     0.0   0/4     0.0   2/2     0   0
Myles Anthony          35   14    7    0   1   6/12   50.0   0/2     0.0   6/7     0   0
Dirk Markkanen         35   22   17    2   2  10/15   66.7   1/1   100.0   5/6     1   0
Lamelo Dosunmu         32   12    3    1   2   4/11   36.4   1/4    25.0   4/5     0   0
Kawhi Russell          16   13    1    3   0   5/7    71.4   1/3    33.3   2/2     0   0
DeMar Harden           13    2    0    0   0   1/2    50.0   0/1     0.0   0/0     0   0
Lauri Gobert           13    0    4    1   2   0/1     0.0   0/0     0.0   0/0     0   0
Dejounte Towns         13   10    6    1   1   4/6    66.7   0/0     0.0   2/3     0   0
Cole Iverson           13    5    0    2   0   3/5    60.0   0/0     0.0   1/2     1   0

TEAM: FG: 41/75 (54.7%), 3PT: 3/17 (17.6%), REB: 48 (19 off, 29 def), AST: 16, TO: 11

================================================================================
