================================================================================
                        FULL GAME - Team_088 vs Team_003                        
================================================================================

================================================================================
                       1ST QUARTER - Team_088 vs Team_003                       
================================================================================

[12:00] Team_088 possession (Score: 0-0)
Giannis Smith drives to the basket... Giannis Smith throws a bad pass! Stolen by Giannis Turner! TURNOVER! (live ball)

[11:42] Team_003 possession (Score: 0-0)
Giannis Turner attempts a Midrange. Contested by Tobias Haliburton (5.3 feet, ZONE). Giannis Turner misses. Offensive rebound by Victor O'Neal! Victor O'Neal kicks it out.

[11:32] Team_003 possession (Score: 0-0)
Victor O'Neal makes the Dunk and draws the foul on Allen Ming! And-1! Victor O'Neal to the line for 1. [Team fouls: 1] (Allen Ming: 1 personal fouls)   FT 1/1: GOOD Victor O'Neal makes 1/1 from the line.
Score: 0-3

[11:19] Team_088 possession (Score: 0-3)
FOUL! Shooting foul on Giannis Turner. Allen Ming to the line for 2 free throws. [Team fouls: 1] (Giannis Turner: 1 personal fouls)   FT 1/2: MISS   FT 2/2: GOOD Allen Ming makes 1/2 from the line.
Score: 1-3

[11:04] Team_003 possession (Score: 1-3)
Victor O'Neal attempts a Midrange. Contested by Tobias Haliburton (5.0 feet, ZONE). Victor O'Neal misses. Offensive rebound by Rudy Haliburton! Rudy Haliburton puts it back in!
Score: 1-5

[10:46] Team_088 possession (Score: 1-5)
Tyler Hyland attempts a 3Pt. Contested by Rudy Haliburton (3.2 feet, MAN). Tyler Hyland misses. Offensive rebound by Allen Ming! Allen Ming's putback is no good. Rebound secured by Victor O'Neal.

[10:31] Team_003 possession (Score: 1-5)
Rudy Haliburton throws a bad pass! Stolen by Tyler Hyland! TURNOVER! (live ball)

[10:16] Team_088 possession (Score: 1-5)
Tyler Hyland makes the Layup and draws the foul on Giannis Turner! And-1! Tyler Hyland to the line for 1. [Team fouls: 2] (Giannis Turner: 2 personal fouls)   FT 1/1: GOOD Tyler Hyland makes 1/1 from the line.
Score: 4-5

[10:01] Team_003 possession (Score: 4-5)
Nikola Bryant attempts a 3Pt. Contested by Tobias Haliburton (5.3 feet, MAN). Nikola Bryant misses. Rebound secured by Giannis Smith.

[09:51] Team_088 possession (Score: 4-5)
Allen Ming throws a bad pass! Stolen by Giannis Turner! TURNOVER! (live ball)

[09:36] Team_003 possession (Score: 4-5)
Victor O'Neal drives, Allen Ming stays with him. Victor O'Neal attempts a Dunk. Contested by Allen Ming (4.2 feet, MAN). VICTOR O'NEAL MAKES IT! Assist: Rudy Haliburton
Score: 4-7

[09:19] Team_088 possession (Score: 4-7)
Allen Ming attempts a Layup. Contested by Giannis Turner (3.0 feet, ZONE). ALLEN MING MAKES IT!
Score: 6-7

[09:03] Team_003 possession (Score: 6-7)
Nikola Bryant attempts a 3Pt. Contested by Tobias Haliburton (5.3 feet, MAN). NIKOLA BRYANT MAKES IT! Assist: Ayo Jackson
Score: 6-10

[08:48] Team_088 possession (Score: 6-10)
Tobias Haliburton drives, Giannis Turner stays with him. Tobias Haliburton attempts a Dunk. Contested by Giannis Turner (2.8 feet, ZONE). TOBIAS HALIBURTON MAKES IT!
Score: 8-10

[08:31] Team_003 possession (Score: 8-10)
Nikola Bryant drives and kicks out. Nikola Bryant makes the Midrange and draws the foul on Tyler Hyland! And-1! Nikola Bryant to the line for 1. [Team fouls: 2] (Tyler Hyland: 1 personal fouls)   FT 1/1: GOOD Nikola Bryant makes 1/1 from the line.
Score: 8-13

[08:20] Team_088 possession (Score: 8-13)
Tobias Haliburton attempts a 3Pt. Contested by Giannis Turner (2.8 feet, ZONE). TOBIAS HALIBURTON MAKES IT! Assist: Giannis Smith
Score: 11-13

[08:05] Team_003 possession (Score: 11-13)
FOUL! Holding foul on Tyler Hyland. [Team fouls: 3] No free throws, side out. (Tyler Hyland: 2 personal fouls)

[07:49] Team_003 possession (Score: 11-13)
Rudy Haliburton attempts a 3Pt. Contested by Tyler Hyland (4.5 feet, MAN). Rudy Haliburton misses. Rebound secured by Allen Ming.

[07:31] Team_088 possession (Score: 11-13)
Tyler Hyland attempts a 3Pt. Contested by Rudy Haliburton (3.2 feet, MAN). Tyler Hyland misses. Rebound secured by Rudy Haliburton.

[07:19] Team_003 possession (Score: 11-13)
FOUL! Shooting foul on Giannis Smith. Giannis Turner to the line for 2 free throws. [Team fouls: 4] (Giannis Smith: 1 personal fouls)   FT 1/2: GOOD   FT 2/2: GOOD Giannis Turner makes 2/2 from the line.
Score: 11-15

[07:03] Team_088 possession (Score: 11-15)
Tobias Haliburton makes the Layup and draws the foul on Nikola Bryant! And-1! Tobias Haliburton to the line for 1. [Team fouls: 3] (Nikola Bryant: 1 personal fouls)   FT 1/1: MISS Tobias Haliburton makes 0/1 from the line. Rebound secured by Victor O'Neal.
Score: 13-15

[06:51] Team_003 possession (Score: 13-15)
Giannis Turner attempts a Layup. BLOCKED BY GIANNIS SMITH! Ball is loose! Rebound secured by Giannis Smith.

[06:39] Team_088 possession (Score: 13-15)
Josh Duncan attempts a Layup. BLOCKED BY AYO JACKSON! Ball goes out off Ayo Jackson. Josh Duncan's ball!

[06:23] Team_088 possession (Score: 13-15)
FOUL! Offensive foul on Allen Ming! Giannis Turner drew the charge! [Team fouls: 5] (Allen Ming: 2 personal fouls) TURNOVER! (dead ball)

[06:13] Team_003 possession (Score: 13-15)
Giannis Turner attempts a 3Pt. Contested by Tobias Haliburton (5.3 feet, ZONE). Giannis Turner misses. Rebound secured by Giannis Smith.

[06:03] Team_088 possession (Score: 13-15)
Giannis Smith attempts a 3Pt. Contested by Giannis Turner (3.0 feet, MAN). Giannis Smith misses. Rebound secured by Rudy Haliburton.

[05:49] Team_003 possession (Score: 13-15)
Nikola Bryant drives and kicks out. Ayo Jackson attempts a Midrange. Contested by Tyler Hyland (4.5 feet, ZONE). Ayo Jackson misses. Rebound secured by Allen Ming.

[05:33] Team_088 possession (Score: 13-15)
Tobias Haliburton attempts a 3Pt. Contested by Giannis Turner (2.8 feet, ZONE). Tobias Haliburton misses. Rebound secured by Rudy Haliburton.

[05:20] Team_003 possession (Score: 13-15)
FOUL! Reach-in foul on Giannis Smith during the drive. [IN THE BONUS! 6 team fouls] Giannis Turner to the line for 2 free throws. (Giannis Smith: 2 personal fouls)   FT 1/2: MISS   FT 2/2: GOOD Giannis Turner makes 1/2 from the line.
Score: 13-16

[05:05] Team_088 possession (Score: 13-16)
Josh Duncan attempts a 3Pt. Contested by Giannis Turner (2.9 feet, ZONE). Josh Duncan misses. Rebound secured by Rudy Haliburton.

[04:55] Team_003 possession (Score: 13-16)
Nikola Bryant drives to the basket... Nikola Bryant loses control! Ball rolls out of bounds! TURNOVER! (dead ball)

[04:43] Team_088 possession (Score: 13-16)
Josh Duncan drives and kicks out. Josh Duncan attempts a 3Pt. Contested by Giannis Turner (2.8 feet, ZONE). Josh Duncan misses. Offensive rebound by Giannis Smith! Giannis Smith puts it back in!
Score: 15-16

[04:31] Team_003 possession (Score: 15-16)
Ayo Jackson attempts a Midrange. Contested by Tyler Hyland (4.9 feet, ZONE). AYO JACKSON MAKES IT!
Score: 15-18

[04:14] Team_088 possession (Score: 15-18)
Giannis Smith drives and kicks out. Tobias Haliburton attempts a Midrange. Contested by Nikola Bryant (4.1 feet, MAN). Tobias Haliburton misses. Rebound secured by Rudy Haliburton.

[03:58] Team_003 possession (Score: 15-18)
Giannis Turner drives and kicks out. Ayo Jackson attempts a Midrange. Contested by Josh Duncan (5.4 feet, MAN). Ayo Jackson misses. Rebound secured by Tyler Hyland.

[03:42] Team_088 possession (Score: 15-18)
Josh Duncan attempts a 3Pt. Contested by Giannis Turner (3.0 feet, ZONE). Josh Duncan misses. Rebound secured by Rudy Haliburton.

[03:30] Team_003 possession (Score: 15-18)
Giannis Turner attempts a 3Pt. Contested by Giannis Smith (4.5 feet, MAN). Giannis Turner misses. Offensive rebound by Rudy Haliburton! Rudy Haliburton kicks it out.

[03:13] Team_003 possession (Score: 15-18)
FOUL! Shooting foul on Giannis Smith. Giannis Turner to the line for 2 free throws. [BONUS: 7 team fouls] (Giannis Smith: 3 personal fouls)   FT 1/2: GOOD   FT 2/2: GOOD Giannis Turner makes 2/2 from the line.
Score: 15-20

[02:56] Team_088 possession (Score: 15-20)
Giannis Smith attempts a Midrange. Contested by Rudy Haliburton (3.6 feet, ZONE). GIANNIS SMITH MAKES IT!
Score: 17-20

[02:44] Team_003 possession (Score: 17-20)
Victor O'Neal makes the Layup and draws the foul on Giannis Smith! And-1! Victor O'Neal to the line for 1. [BONUS: 8 team fouls] (Giannis Smith: 4 personal fouls)   FT 1/1: MISS Victor O'Neal makes 0/1 from the line. Rebound secured by Tyler Hyland.
Score: 17-22

[02:30] Team_088 possession (Score: 17-22)
Tyler Hyland attempts a 3Pt. Contested by Rudy Haliburton (3.4 feet, MAN). Tyler Hyland misses. Rebound secured by Rudy Haliburton.

[02:13] Team_003 possession (Score: 17-22)
Nikola Bryant makes the 3Pt and draws the foul on Tobias Haliburton! And-1! Nikola Bryant to the line for 1. [BONUS: 9 team fouls] (Tobias Haliburton: 1 personal fouls)   FT 1/1: GOOD Nikola Bryant makes 1/1 from the line.
Score: 17-26

[01:58] Team_088 possession (Score: 17-26)
Allen Ming loses the ball! Stripped by Giannis Turner! TURNOVER! (live ball)

[01:43] Team_003 possession (Score: 17-26)
Ayo Jackson attempts a 3Pt. Contested by Josh Duncan (5.9 feet, MAN). Ayo Jackson misses. Offensive rebound by Victor O'Neal! Victor O'Neal kicks it out.

[01:28] Team_003 possession (Score: 17-26)
FOUL! Holding foul on Tyler Hyland. [IN THE BONUS! 10 team fouls] Rudy Haliburton to the line for 2 free throws. (Tyler Hyland: 3 personal fouls)   FT 1/2: GOOD   FT 2/2: GOOD Rudy Haliburton makes 2/2 from the line.
Score: 17-28

[01:13] Team_088 possession (Score: 17-28)
FOUL! Reach-in foul on Nikola Bryant during the drive. [Team fouls: 4] No free throws, side out. (Nikola Bryant: 2 personal fouls)

[00:58] Team_088 possession (Score: 17-28)
Tyler Hyland commits a violation (traveling/carry)! TURNOVER! (dead ball)

[00:58] Substitution (Team_088): Josh Duncan OUT → Klay Quickley IN (stamina_rule2)

[00:58] Substitution (Team_088): Tobias Haliburton OUT → Vince Carter IN (stamina_rule2)

[00:58] Substitution (Team_088): Tyler Hyland OUT → Pau Bird IN (stamina_rule2)

[00:58] Substitution (Team_088): Giannis Smith OUT → Zion Harris IN (stamina_rule2)

[00:58] Substitution (Team_088): Allen Ming OUT → Josh Embiid IN (stamina_rule2)

[00:58] Substitution (Team_003): Ayo Jackson OUT → Miles Towns IN (stamina_rule2)

[00:58] Substitution (Team_003): Nikola Bryant OUT → Pau Williamson IN (stamina_rule2)

[00:58] Substitution (Team_003): Rudy Haliburton OUT → Collin Mitchell IN (stamina_rule2)

[00:58] Substitution (Team_003): Giannis Turner OUT → Anfernee Jordan IN (stamina_rule2)

[00:58] Substitution (Team_003): Victor O'Neal OUT → Bam Gilgeous-Alexander IN (stamina_rule2)

[00:46] Team_003 possession (Score: 17-28)
Bam Gilgeous-Alexander attempts a Midrange. Contested by Josh Embiid (6.0 feet, MAN). BAM GILGEOUS-ALEXANDER MAKES IT!
Score: 17-30

[00:29] Team_088 possession (Score: 17-30)
Josh Embiid attempts a Layup. Contested by Bam Gilgeous-Alexander (2.8 feet, MAN). JOSH EMBIID MAKES IT!
Score: 19-30

[00:15] Team_003 possession (Score: 19-30)
Anfernee Jordan attempts a 3Pt. Contested by Zion Harris (5.6 feet, MAN). ANFERNEE JORDAN MAKES IT! Assist: Pau Williamson
Score: 19-33

[00:01] Team_088 possession (Score: 19-33)
Josh Embiid attempts a 3Pt. Contested by Miles Towns (5.1 feet, ZONE). Josh Embiid misses. Rebound secured by Bam Gilgeous-Alexander.

================================================================================
                              1ST QUARTER COMPLETE                              
================================================================================

1ST QUARTER SCORE: Team_088 19, Team_003 33

BOX SCORE:
================================================================================

Team_088
--------------------------------------------------------------------------------
Player                MIN  PTS  REB  AST  TO      FG   FG%      3P   3P%
--------------------------------------------------------------------------------
Tobias Haliburton      11    5    0    0   0   2/4    50.0     0/0   0.0
Giannis Smith          11    4    4    1   0   2/4    50.0     0/0   0.0
Allen Ming             11    3    2    0   0   2/2   100.0     0/0   0.0
Tyler Hyland           11    3    2    0   0   1/4    25.0     0/0   0.0
Josh Embiid             1    2    0    0   0   1/2    50.0     0/0   0.0
Josh Duncan            11    0    0    0   0   0/2     0.0     0/0   0.0

TEAM: FG: 8/18 (44.4%), 3PT: 1/9 (11.1%), REB: 9 (2 off, 7 def), AST: 1, TO: 5
TEAM FOULS: 10 [Team_003 in BONUS]


Team_003
--------------------------------------------------------------------------------
Player                MIN  PTS  REB  AST  TO      FG   FG%      3P   3P%
--------------------------------------------------------------------------------
Nikola Bryant          11   10    0    0   0   3/5    60.0     0/0   0.0
Victor O'Neal          11    5    4    0   0   2/3    66.7     0/0   0.0
Giannis Turner         11    5    0    0   0   3/6    50.0     0/0   0.0
Rudy Haliburton        11    4    9    1   0   2/3    66.7     0/0   0.0
Anfernee Jordan         1    3    0    0   0   1/1   100.0     0/0   0.0
Ayo Jackson            11    2    0    1   0   1/1   100.0     0/0   0.0
Bam Gilgeous-Alexander    1    2    1    0   0   1/1   100.0     0/0   0.0
Pau Williamson          1    0    0    1   0   0/0     0.0     0/0   0.0

TEAM: FG: 13/20 (65.0%), 3PT: 3/6 (50.0%), REB: 13 (4 off, 9 def), AST: 3, TO: 2
TEAM FOULS: 4

================================================================================

================================================================================
                       2ND QUARTER - Team_088 vs Team_003                       
================================================================================

[12:00] Team_088 possession (Score: 19-33)
Tobias Haliburton attempts a 3Pt. Contested by Nikola Bryant (4.2 feet, MAN). Tobias Haliburton misses. Rebound secured by Rudy Haliburton.

[11:49] Team_003 possession (Score: 19-33)
Giannis Turner makes the Dunk and draws the foul on Giannis Smith! And-1! Giannis Turner to the line for 1. [Team fouls: 1] (Giannis Smith: 1 personal fouls)   FT 1/1: GOOD Giannis Turner makes 1/1 from the line.
Score: 19-36

[11:34] Team_088 possession (Score: 19-36)
Giannis Smith attempts a Midrange. Contested by Giannis Turner (3.2 feet, ZONE). GIANNIS SMITH MAKES IT! Assist: Josh Duncan
Score: 21-36

[11:21] Team_003 possession (Score: 21-36)
FOUL! Reach-in foul on Tyler Hyland during the drive. [Team fouls: 2] No free throws, side out. (Tyler Hyland: 1 personal fouls)

[11:08] Team_003 possession (Score: 21-36)
Nikola Bryant attempts a Midrange. Contested by Giannis Smith (4.6 feet, ZONE). Nikola Bryant misses. Rebound secured by Allen Ming.

[10:54] Team_088 possession (Score: 21-36)
Josh Duncan attempts a 3Pt. Contested by Ayo Jackson (5.6 feet, MAN). Josh Duncan misses. Rebound secured by Rudy Haliburton.

[10:40] Team_003 possession (Score: 21-36)
Rudy Haliburton attempts a Midrange. Contested by Tyler Hyland (4.9 feet, MAN). Rudy Haliburton misses. Rebound secured by Giannis Smith.

[10:28] Team_088 possession (Score: 21-36)
Tyler Hyland attempts a 3Pt. Contested by Rudy Haliburton (3.4 feet, MAN). Tyler Hyland misses. Rebound secured by Rudy Haliburton.

[10:11] Team_003 possession (Score: 21-36)
Ayo Jackson makes the 3Pt and draws the foul on Josh Duncan! And-1! Ayo Jackson to the line for 1. [Team fouls: 3] (Josh Duncan: 1 personal fouls)   FT 1/1: GOOD Ayo Jackson makes 1/1 from the line.
Score: 21-40

[09:53] Team_088 possession (Score: 21-40)
Tobias Haliburton attempts a 3Pt. Contested by Ayo Jackson (5.6 feet, ZONE). TOBIAS HALIBURTON MAKES IT! Assist: Tyler Hyland
Score: 24-40

[09:43] Team_003 possession (Score: 24-40)
Rudy Haliburton attempts a 3Pt. Contested by Giannis Smith (4.6 feet, ZONE). Rudy Haliburton misses. Rebound secured by Allen Ming.

[09:28] Team_088 possession (Score: 24-40)
Giannis Smith attempts a 3Pt. Contested by Giannis Turner (3.4 feet, MAN). Giannis Smith misses. Rebound secured by Victor O'Neal.

[09:14] Team_003 possession (Score: 24-40)
Rudy Haliburton drives to the basket... FOUL! Offensive foul on Rudy Haliburton! Giannis Smith drew the charge! [Team fouls: 1] (Rudy Haliburton: 1 personal fouls) TURNOVER! (dead ball)

[08:54] Team_088 possession (Score: 24-40)
Tobias Haliburton drives, Giannis Turner stays with him. Tobias Haliburton attempts a Dunk. Contested by Giannis Turner (3.4 feet, ZONE). Tobias Haliburton misses. Rebound secured by Giannis Turner.

[08:41] Team_003 possession (Score: 24-40)
Rudy Haliburton attempts a Midrange. Contested by Tyler Hyland (5.1 feet, MAN). Rudy Haliburton misses. Rebound secured by Giannis Smith.

[08:24] Team_088 possession (Score: 24-40)
FOUL! Holding foul on Nikola Bryant. [Team fouls: 2] No free throws, side out. (Nikola Bryant: 1 personal fouls)

[08:11] Team_088 possession (Score: 24-40)
Allen Ming attempts a Layup. Contested by Giannis Turner (3.6 feet, ZONE). Allen Ming misses. Rebound secured by Rudy Haliburton.

[07:59] Team_003 possession (Score: 24-40)
FOUL! Shooting foul on Giannis Smith. Giannis Turner to the line for 2 free throws. [Team fouls: 4] (Giannis Smith: 2 personal fouls)   FT 1/2: GOOD   FT 2/2: MISS Giannis Turner makes 1/2 from the line. Rebound secured by Tyler Hyland.
Score: 24-41

[07:43] Team_088 possession (Score: 24-41)
Giannis Smith drives, Giannis Turner stays with him. Giannis Smith attempts a Dunk. Contested by Giannis Turner (3.7 feet, MAN). Giannis Smith misses. Rebound secured by Victor O'Neal.

[07:26] Team_003 possession (Score: 24-41)
Nikola Bryant throws a bad pass! Stolen by Tobias Haliburton! TURNOVER! (live ball)

[07:15] Team_088 possession (Score: 24-41)
Josh Duncan attempts a 3Pt. Contested by Giannis Turner (3.6 feet, ZONE). Josh Duncan misses. Offensive rebound by Allen Ming! Allen Ming kicks it out.

[07:04] Team_088 possession (Score: 24-41)
Tyler Hyland attempts a Layup. Contested by Rudy Haliburton (3.8 feet, MAN). Tyler Hyland misses. Rebound secured by Rudy Haliburton.

[06:52] Team_003 possession (Score: 24-41)
Giannis Turner drives and kicks out. Rudy Haliburton attempts a 3Pt. Contested by Tobias Haliburton (5.9 feet, ZONE). RUDY HALIBURTON MAKES IT! Assist: Victor O'Neal
Score: 24-44

[06:42] Team_088 possession (Score: 24-44)
Josh Duncan drives and kicks out. Tobias Haliburton attempts a 3Pt. Contested by Nikola Bryant (4.9 feet, MAN). TOBIAS HALIBURTON MAKES IT!
Score: 27-44

[06:27] Team_003 possession (Score: 27-44)
Victor O'Neal drives, Giannis Smith stays with him. Victor O'Neal attempts a Dunk. Contested by Giannis Smith (5.0 feet, ZONE). VICTOR O'NEAL MAKES IT! Assist: Nikola Bryant
Score: 27-46

[06:14] Team_088 possession (Score: 27-46)
Tobias Haliburton drives, Nikola Bryant stays with him. Tobias Haliburton attempts a Dunk. Contested by Nikola Bryant (4.8 feet, MAN). Tobias Haliburton misses. Rebound secured by Giannis Turner.

[05:56] Team_003 possession (Score: 27-46)
Nikola Bryant attempts a Midrange. Wide open! Tobias Haliburton is 6.1 feet away. [MAN] NIKOLA BRYANT MAKES IT!
Score: 27-48

[05:40] Team_088 possession (Score: 27-48)
Josh Duncan attempts a 3Pt. Wide open! Ayo Jackson is 6.1 feet away. [MAN] Josh Duncan misses. Rebound secured by Giannis Turner.

[05:26] Team_003 possession (Score: 27-48)
Rudy Haliburton attempts a 3Pt. Contested by Tyler Hyland (5.6 feet, MAN). Rudy Haliburton misses. Rebound secured by Giannis Smith.

[05:09] Team_088 possession (Score: 27-48)
Josh Duncan attempts a 3Pt. Contested by Giannis Turner (4.0 feet, ZONE). Josh Duncan misses. Rebound secured by Rudy Haliburton.

[04:52] Team_003 possession (Score: 27-48)
Victor O'Neal throws a bad pass out of bounds! TURNOVER! (dead ball)

[04:52] Substitution (Team_088): Josh Duncan OUT → Klay Quickley IN (stamina_rule2)

[04:52] Substitution (Team_088): Tobias Haliburton OUT → Vince Carter IN (stamina_rule2)

[04:52] Substitution (Team_088): Tyler Hyland OUT → Pau Bird IN (stamina_rule2)

[04:52] Substitution (Team_088): Giannis Smith OUT → Zion Harris IN (stamina_rule2)

[04:52] Substitution (Team_088): Allen Ming OUT → Josh Embiid IN (stamina_rule2)

[04:52] Substitution (Team_003): Ayo Jackson OUT → Miles Towns IN (stamina_rule2)

[04:52] Substitution (Team_003): Nikola Bryant OUT → Pau Williamson IN (stamina_rule2)

[04:52] Substitution (Team_003): Rudy Haliburton OUT → Collin Mitchell IN (stamina_rule2)

[04:52] Substitution (Team_003): Giannis Turner OUT → Anfernee Jordan IN (stamina_rule2)

[04:52] Substitution (Team_003): Victor O'Neal OUT → Bam Gilgeous-Alexander IN (stamina_rule2)

[04:39] Team_088 possession (Score: 27-48)
Josh Embiid attempts a Layup. Contested by Bam Gilgeous-Alexander (2.8 feet, MAN). JOSH EMBIID MAKES IT!
Score: 29-48

[04:24] Team_003 possession (Score: 29-48)
Collin Mitchell drives to the basket... Collin Mitchell throws a bad pass! Stolen by Pau Bird! TURNOVER! (live ball)

[04:10] Team_088 possession (Score: 29-48)
Zion Harris attempts a Layup. Contested by Bam Gilgeous-Alexander (3.5 feet, ZONE). Zion Harris misses. Offensive rebound by Josh Embiid! Josh Embiid kicks it out.

[03:59] Team_088 possession (Score: 29-48)
Zion Harris attempts a 3Pt. Contested by Bam Gilgeous-Alexander (3.5 feet, MAN). Zion Harris misses. Rebound secured by Bam Gilgeous-Alexander.

[03:48] Team_003 possession (Score: 29-48)
Pau Williamson drives and kicks out. Miles Towns attempts a 3Pt. Contested by Klay Quickley (5.8 feet, MAN). MILES TOWNS MAKES IT! Assist: Pau Williamson
Score: 29-51

[03:33] Team_088 possession (Score: 29-51)
Klay Quickley drives, picks up Miles Towns. Help arrives from Collin Mitchell! Klay Quickley attempts a Layup. Contested by Collin Mitchell (5.4 feet, MAN). KLAY QUICKLEY MAKES IT! Assist: Vince Carter
Score: 31-51

[03:18] Team_003 possession (Score: 31-51)
Anfernee Jordan makes the Dunk and draws the foul on Klay Quickley! And-1! Anfernee Jordan to the line for 1. [BONUS: 5 team fouls] (Klay Quickley: 1 personal fouls)   FT 1/1: MISS Anfernee Jordan makes 0/1 from the line. Rebound secured by Josh Embiid.
Score: 31-53

[03:08] Team_088 possession (Score: 31-53)
FOUL! Shooting foul on Collin Mitchell. Vince Carter to the line for 2 free throws. [Team fouls: 3] (Collin Mitchell: 1 personal fouls)   FT 1/2: MISS   FT 2/2: GOOD Vince Carter makes 1/2 from the line.
Score: 32-53

[02:53] Team_003 possession (Score: 32-53)
Miles Towns attempts a Layup. Contested by Zion Harris (5.7 feet, ZONE). MILES TOWNS MAKES IT! Assist: Anfernee Jordan
Score: 32-55

[02:37] Team_088 possession (Score: 32-55)
FOUL! Holding foul on Pau Williamson. [Team fouls: 4] No free throws, side out. (Pau Williamson: 1 personal fouls)

[02:20] Team_088 possession (Score: 32-55)
Pau Bird attempts a 3Pt. Contested by Miles Towns (5.5 feet, ZONE). PAU BIRD MAKES IT! Assist: Zion Harris
Score: 35-55

[02:06] Team_003 possession (Score: 35-55)
FOUL! Holding foul on Pau Bird. [IN THE BONUS! 6 team fouls] Collin Mitchell to the line for 2 free throws. (Pau Bird: 1 personal fouls)   FT 1/2: GOOD   FT 2/2: GOOD Collin Mitchell makes 2/2 from the line.
Score: 35-57

[01:51] Team_088 possession (Score: 35-57)
Zion Harris attempts a Midrange. Contested by Pau Williamson (5.6 feet, ZONE). Zion Harris misses. Rebound secured by Collin Mitchell.

[01:33] Team_003 possession (Score: 35-57)
FOUL! Holding foul on Zion Harris. [IN THE BONUS! 7 team fouls] Anfernee Jordan to the line for 2 free throws. (Zion Harris: 1 personal fouls)   FT 1/2: GOOD   FT 2/2: GOOD Anfernee Jordan makes 2/2 from the line.
Score: 35-59

[01:22] Team_088 possession (Score: 35-59)
Zion Harris makes the Layup and draws the foul on Bam Gilgeous-Alexander! And-1! Zion Harris to the line for 1. [BONUS: 5 team fouls] (Bam Gilgeous-Alexander: 1 personal fouls)   FT 1/1: GOOD Zion Harris makes 1/1 from the line.
Score: 38-59

[01:04] Team_003 possession (Score: 38-59)
Bam Gilgeous-Alexander attempts a Dunk. BLOCKED BY JOSH EMBIID! Ball is loose! Rebound secured by Zion Harris.

[00:47] Team_088 possession (Score: 38-59)
Zion Harris attempts a 3Pt. Contested by Bam Gilgeous-Alexander (3.5 feet, MAN). Zion Harris misses. Rebound secured by Bam Gilgeous-Alexander.

[00:33] Team_003 possession (Score: 38-59)
Anfernee Jordan attempts a 3Pt. Contested by Zion Harris (5.6 feet, MAN). Anfernee Jordan misses. Rebound secured by Zion Harris.

[00:14] Team_088 possession (Score: 38-59)
Vince Carter attempts a 3Pt. Contested by Miles Towns (5.0 feet, ZONE). Vince Carter misses. FOUL! Loose ball foul on Anfernee Jordan during the rebound battle. [IN THE BONUS! 6 team fouls] Pau Bird to the line for 2 free throws. (Anfernee Jordan: 1 personal fouls)   FT 1/2: GOOD   FT 2/2: GOOD Pau Bird makes 2/2 from the line.
Score: 40-59

================================================================================
                              2ND QUARTER COMPLETE                              
================================================================================

2ND QUARTER SCORE: Team_088 21, Team_003 26

BOX SCORE:
================================================================================

Team_088
--------------------------------------------------------------------------------
Player                MIN  PTS  REB  AST  TO      FG   FG%      3P   3P%
--------------------------------------------------------------------------------
Tobias Haliburton      19    6    0    0   0   2/5    40.0     0/0   0.0
Pau Bird                6    5    0    0   0   2/2   100.0     0/0   0.0
Zion Harris             6    3    2    1   0   1/4    25.0     0/0   0.0
Giannis Smith          19    2    3    0   0   1/3    33.3     0/0   0.0
Josh Embiid             6    2    2    0   0   1/1   100.0     0/0   0.0
Klay Quickley           6    2    0    0   0   1/1   100.0     0/0   0.0
Vince Carter            6    1    0    1   0   1/1   100.0     0/0   0.0
Josh Duncan            19    0    0    1   0   0/3     0.0     0/0   0.0
Allen Ming             19    0    3    0   0   0/1     0.0     0/0   0.0
Tyler Hyland           19    0    1    1   0   0/2     0.0     0/0   0.0

TEAM: FG: 9/23 (39.1%), 3PT: 3/11 (27.3%), REB: 11 (2 off, 9 def), AST: 4, TO: 0
TEAM FOULS: 7 [Team_003 in BONUS]


Team_003
--------------------------------------------------------------------------------
Player                MIN  PTS  REB  AST  TO      FG   FG%      3P   3P%
--------------------------------------------------------------------------------
Miles Towns             6    5    0    0   0   2/2   100.0     0/0   0.0
Ayo Jackson            19    4    0    0   0   1/1   100.0     0/0   0.0
Rudy Haliburton        19    3    6    0   0   1/5    20.0     0/0   0.0
Giannis Turner         19    3    3    0   0   1/2    50.0     0/0   0.0
Nikola Bryant          19    2    0    1   0   1/2    50.0     0/0   0.0
Victor O'Neal          19    2    2    1   0   1/1   100.0     0/0   0.0
Anfernee Jordan         6    2    0    1   0   1/3    33.3     0/0   0.0
Collin Mitchell         6    2    1    0   0   1/1   100.0     0/0   0.0
Bam Gilgeous-Alexander    6    0    2    0   0   0/1     0.0     0/0   0.0
Pau Williamson          6    0    0    1   0   0/0     0.0     0/0   0.0

TEAM: FG: 9/18 (50.0%), 3PT: 1/4 (25.0%), REB: 14 (0 off, 14 def), AST: 4, TO: 4
TEAM FOULS: 6 [Team_088 in BONUS]

================================================================================

================================================================================
                       3RD QUARTER - Team_088 vs Team_003                       
================================================================================

[12:00] Team_088 possession (Score: 40-59)
Allen Ming drives, Giannis Turner stays with him. Allen Ming attempts a Layup. Contested by Giannis Turner (3.0 feet, MAN). ALLEN MING MAKES IT!
Score: 42-59

[11:49] Team_003 possession (Score: 42-59)
Nikola Bryant attempts a 3Pt. Contested by Tobias Haliburton (5.3 feet, MAN). Nikola Bryant misses. Rebound secured by Tyler Hyland.

[11:33] Team_088 possession (Score: 42-59)
Tobias Haliburton attempts a 3Pt. Contested by Nikola Bryant (4.0 feet, MAN). Tobias Haliburton misses. Rebound secured by Victor O'Neal.

[11:21] Team_003 possession (Score: 42-59)
Victor O'Neal attempts a Midrange. Contested by Allen Ming (4.2 feet, MAN). Victor O'Neal misses. Rebound secured by Allen Ming.

[11:06] Team_088 possession (Score: 42-59)
Tyler Hyland attempts a Midrange. Contested by Rudy Haliburton (3.2 feet, MAN). Tyler Hyland misses. FOUL! Loose ball foul on Victor O'Neal during the rebound battle. [Team fouls: 1] No free throws, side out. (Victor O'Neal: 1 personal fouls)

[10:54] Team_088 possession (Score: 42-59)
Josh Duncan makes the Midrange and draws the foul on Giannis Turner! And-1! Josh Duncan to the line for 1. [Team fouls: 2] (Giannis Turner: 1 personal fouls)   FT 1/1: GOOD Josh Duncan makes 1/1 from the line.
Score: 45-59

[10:41] Team_003 possession (Score: 45-59)
Victor O'Neal drives and kicks out. Victor O'Neal attempts a Midrange. Contested by Tobias Haliburton (5.0 feet, ZONE). Victor O'Neal misses. Offensive rebound by Victor O'Neal! Victor O'Neal kicks it out.

[10:25] Team_003 possession (Score: 45-59)
Ayo Jackson attempts a 3Pt. Contested by Tobias Haliburton (5.3 feet, ZONE). AYO JACKSON MAKES IT! Assist: Nikola Bryant
Score: 45-62

[10:12] Team_088 possession (Score: 45-62)
Tyler Hyland attempts a Midrange. Contested by Rudy Haliburton (3.2 feet, MAN). TYLER HYLAND MAKES IT! Assist: Tobias Haliburton
Score: 47-62

[09:59] Team_003 possession (Score: 47-62)
Nikola Bryant attempts a 3Pt. Contested by Tobias Haliburton (5.3 feet, MAN). Nikola Bryant misses. Rebound secured by Allen Ming.

[09:45] Team_088 possession (Score: 47-62)
FOUL! Reach-in foul on Victor O'Neal during the drive. [Team fouls: 3] No free throws, side out. (Victor O'Neal: 2 personal fouls)

[09:29] Team_088 possession (Score: 47-62)
Josh Duncan attempts a 3Pt. Contested by Ayo Jackson (5.3 feet, MAN). Josh Duncan misses. Rebound secured by Victor O'Neal.

[09:12] Team_003 possession (Score: 47-62)
FOUL! Holding foul on Josh Duncan. [Team fouls: 1] No free throws, side out. (Josh Duncan: 1 personal fouls)

[09:00] Team_003 possession (Score: 47-62)
Giannis Turner drives, Allen Ming stays with him. Giannis Turner attempts a Layup. Contested by Allen Ming (4.5 feet, ZONE). GIANNIS TURNER MAKES IT! Assist: Victor O'Neal
Score: 47-64

[08:47] Team_088 possession (Score: 47-64)
Giannis Smith drives, picks up Giannis Turner. Help arrives from Nikola Bryant! Giannis Smith attempts a Dunk. Contested by Nikola Bryant (3.0 feet, ZONE). Giannis Smith misses. Rebound secured by Rudy Haliburton.

[08:32] Team_003 possession (Score: 47-64)
FOUL! Shooting foul on Giannis Smith. Ayo Jackson to the line for 2 free throws. [Team fouls: 2] (Giannis Smith: 1 personal fouls)   FT 1/2: GOOD   FT 2/2: GOOD Ayo Jackson makes 2/2 from the line.
Score: 47-66

[08:21] Team_088 possession (Score: 47-66)
Josh Duncan attempts a 3Pt. Contested by Ayo Jackson (5.3 feet, MAN). Josh Duncan misses. Offensive rebound by Giannis Smith! Giannis Smith puts it back in!
Score: 49-66

[08:02] Team_003 possession (Score: 49-66)
Nikola Bryant drives and kicks out. Giannis Turner attempts a Midrange. Contested by Allen Ming (4.2 feet, ZONE). Giannis Turner misses. Offensive rebound by Victor O'Neal! Victor O'Neal kicks it out.

[07:47] Team_003 possession (Score: 49-66)
Nikola Bryant drives and kicks out. Victor O'Neal attempts a 3Pt. Contested by Tobias Haliburton (5.0 feet, ZONE). Victor O'Neal misses. Rebound secured by Giannis Smith.

[07:30] Team_088 possession (Score: 49-66)
Josh Duncan throws a bad pass! Stolen by Ayo Jackson! TURNOVER! (live ball)

[07:12] Team_003 possession (Score: 49-66)
Ayo Jackson drives and kicks out. Nikola Bryant attempts a 3Pt. Contested by Tobias Haliburton (5.0 feet, MAN). NIKOLA BRYANT MAKES IT!
Score: 49-69

[06:53] Team_088 possession (Score: 49-69)
Josh Duncan attempts a 3Pt. Contested by Giannis Turner (2.9 feet, ZONE). Josh Duncan misses. Rebound secured by Giannis Turner.

[06:39] Team_003 possession (Score: 49-69)
Giannis Turner attempts a Midrange. Contested by Tobias Haliburton (5.3 feet, ZONE). Giannis Turner misses. Rebound secured by Allen Ming.

[06:29] Team_088 possession (Score: 49-69)
Tobias Haliburton attempts a 3Pt. Contested by Nikola Bryant (4.0 feet, MAN). Tobias Haliburton misses. Rebound secured by Victor O'Neal.

[06:12] Team_003 possession (Score: 49-69)
Rudy Haliburton commits a violation (traveling/carry)! TURNOVER! (dead ball)

[06:00] Team_088 possession (Score: 49-69)
Allen Ming drives, Giannis Turner stays with him. Allen Ming attempts a Layup. Contested by Giannis Turner (3.0 feet, ZONE). ALLEN MING MAKES IT!
Score: 51-69

[05:47] Team_003 possession (Score: 51-69)
Ayo Jackson drives, picks up Josh Duncan. Help arrives from Tobias Haliburton! Ayo Jackson attempts a Layup. Contested by Tobias Haliburton (5.6 feet, MAN). AYO JACKSON MAKES IT!
Score: 51-71

[05:31] Team_088 possession (Score: 51-71)
Josh Duncan attempts a 3Pt. Contested by Giannis Turner (2.9 feet, ZONE). JOSH DUNCAN MAKES IT!
Score: 54-71

[05:18] Team_003 possession (Score: 54-71)
Ayo Jackson drives to the basket... Ayo Jackson loses control! Ball rolls out of bounds! TURNOVER! (dead ball)

[05:05] Team_088 possession (Score: 54-71)
Tyler Hyland drives and kicks out. Tyler Hyland attempts a 3Pt. Contested by Giannis Turner (2.8 feet, ZONE). TYLER HYLAND MAKES IT! Assist: Tobias Haliburton
Score: 57-71

[04:50] Team_003 possession (Score: 57-71)
Nikola Bryant attempts a 3Pt. Contested by Tobias Haliburton (5.4 feet, ZONE). NIKOLA BRYANT MAKES IT! Assist: Victor O'Neal
Score: 57-74

[04:37] Team_088 possession (Score: 57-74)
Josh Duncan attempts a 3Pt. Contested by Ayo Jackson (5.4 feet, MAN). Josh Duncan misses. Offensive rebound by Giannis Smith! Giannis Smith's putback is no good. Rebound secured by Victor O'Neal.

[04:24] Team_003 possession (Score: 57-74)
Nikola Bryant attempts a Midrange. Contested by Tobias Haliburton (5.4 feet, ZONE). Nikola Bryant misses. Rebound secured by Tyler Hyland.

[04:10] Team_088 possession (Score: 57-74)
Giannis Smith throws a bad pass out of bounds! TURNOVER! (dead ball)

[03:56] Team_003 possession (Score: 57-74)
Nikola Bryant drives to the basket... Nikola Bryant throws a bad pass! Stolen by Giannis Smith! TURNOVER! (live ball)

[03:41] Team_088 possession (Score: 57-74)
Tyler Hyland drives to the basket... Tyler Hyland commits a violation (traveling/carry)! TURNOVER! (dead ball)

[03:29] Team_003 possession (Score: 57-74)
Nikola Bryant attempts a 3Pt. Contested by Tobias Haliburton (5.5 feet, MAN). Nikola Bryant misses. FOUL! Loose ball foul on Tyler Hyland during the rebound battle. [Team fouls: 3] No free throws, side out. (Tyler Hyland: 1 personal fouls)

[03:12] Team_003 possession (Score: 57-74)
FOUL! Reach-in foul on Giannis Smith during the drive. [Team fouls: 4] No free throws, side out. (Giannis Smith: 2 personal fouls)

[02:57] Team_003 possession (Score: 57-74)
FOUL! Holding foul on Giannis Smith. [IN THE BONUS! 5 team fouls] Giannis Turner to the line for 2 free throws. (Giannis Smith: 3 personal fouls)   FT 1/2: GOOD   FT 2/2: MISS Giannis Turner makes 1/2 from the line. Rebound secured by Giannis Smith.
Score: 57-75

[02:46] Team_088 possession (Score: 57-75)
Tobias Haliburton attempts a 3Pt. Contested by Giannis Turner (3.1 feet, ZONE). TOBIAS HALIBURTON MAKES IT! Assist: Allen Ming
Score: 60-75

[02:31] Team_003 possession (Score: 60-75)
FOUL! Shooting foul on Tobias Haliburton. Ayo Jackson to the line for 3 free throws. [BONUS: 6 team fouls] (Tobias Haliburton: 1 personal fouls)   FT 1/3: GOOD   FT 2/3: GOOD   FT 3/3: GOOD Ayo Jackson makes 3/3 from the line.
Score: 60-78

[02:18] Team_088 possession (Score: 60-78)
FOUL! Reach-in foul on Rudy Haliburton during the drive. [Team fouls: 4] No free throws, side out. (Rudy Haliburton: 1 personal fouls)

[02:06] Team_088 possession (Score: 60-78)
Giannis Smith drives, Giannis Turner stays with him. Giannis Smith attempts a Layup. Contested by Giannis Turner (3.3 feet, MAN). Giannis Smith misses. Rebound secured by Rudy Haliburton.

[01:50] Team_003 possession (Score: 60-78)
Giannis Turner drives, Giannis Smith stays with him. Giannis Turner attempts a Layup. Contested by Giannis Smith (4.7 feet, ZONE). GIANNIS TURNER MAKES IT!
Score: 60-80

[01:33] Team_088 possession (Score: 60-80)
Tyler Hyland attempts a Layup. BLOCKED BY GIANNIS TURNER! Ball is loose! Rebound secured by Rudy Haliburton.

[01:15] Team_003 possession (Score: 60-80)
Nikola Bryant throws a bad pass out of bounds! TURNOVER! (dead ball)

[01:15] Substitution (Team_088): Josh Duncan OUT → Klay Quickley IN (stamina_rule2)

[01:15] Substitution (Team_088): Tobias Haliburton OUT → Vince Carter IN (stamina_rule2)

[01:15] Substitution (Team_088): Tyler Hyland OUT → Pau Bird IN (stamina_rule2)

[01:15] Substitution (Team_088): Giannis Smith OUT → Zion Harris IN (stamina_rule2)

[01:15] Substitution (Team_088): Allen Ming OUT → Josh Embiid IN (stamina_rule2)

[01:15] Substitution (Team_003): Ayo Jackson OUT → Miles Towns IN (stamina_rule2)

[01:15] Substitution (Team_003): Nikola Bryant OUT → Pau Williamson IN (stamina_rule2)

[01:15] Substitution (Team_003): Rudy Haliburton OUT → Collin Mitchell IN (stamina_rule2)

[01:15] Substitution (Team_003): Giannis Turner OUT → Anfernee Jordan IN (stamina_rule2)

[01:15] Substitution (Team_003): Victor O'Neal OUT → Bam Gilgeous-Alexander IN (stamina_rule2)

[00:58] Team_088 possession (Score: 60-80)
Zion Harris attempts a Layup. Contested by Bam Gilgeous-Alexander (3.5 feet, ZONE). ZION HARRIS MAKES IT! Assist: Vince Carter
Score: 62-80

[00:47] Team_003 possession (Score: 62-80)
Collin Mitchell attempts a Midrange. Contested by Pau Bird (5.2 feet, MAN). Collin Mitchell misses. Rebound secured by Pau Bird.

[00:37] Team_088 possession (Score: 62-80)
Zion Harris loses the ball! Stripped by Bam Gilgeous-Alexander! TURNOVER! (live ball)

[00:19] Team_003 possession (Score: 62-80)
Anfernee Jordan attempts a 3Pt. Contested by Pau Bird (4.8 feet, ZONE). Anfernee Jordan misses. Rebound secured by Pau Bird.

[00:01] Team_088 possession (Score: 62-80)
FOUL! Reach-in foul on Bam Gilgeous-Alexander during the drive. [IN THE BONUS! 5 team fouls] Vince Carter to the line for 2 free throws. (Bam Gilgeous-Alexander: 1 personal fouls)   FT 1/2: GOOD   FT 2/2: GOOD Vince Carter makes 2/2 from the line.
Score: 64-80

================================================================================
                              3RD QUARTER COMPLETE                              
================================================================================

3RD QUARTER SCORE: Team_088 24, Team_003 21

BOX SCORE:
================================================================================

Team_088
--------------------------------------------------------------------------------
Player                MIN  PTS  REB  AST  TO      FG   FG%      3P   3P%
--------------------------------------------------------------------------------
Josh Duncan            30    6    0    0   0   2/5    40.0     0/0   0.0
Tyler Hyland           30    5    2    0   0   2/3    66.7     0/0   0.0
Allen Ming             30    4    3    1   0   2/2   100.0     0/0   0.0
Tobias Haliburton      30    3    0    2   0   1/3    33.3     0/0   0.0
Giannis Smith          30    2    4    0   0   1/3    33.3     0/0   0.0
Zion Harris             7    2    0    0   0   1/1   100.0     0/0   0.0
Vince Carter            7    2    0    1   0   1/1   100.0     0/0   0.0
Victor O'Neal          30    0    6    2   0   0/1     0.0     0/0   0.0
Pau Bird                7    0    2    0   0   0/0     0.0     0/0   0.0

TEAM: FG: 10/18 (55.6%), 3PT: 3/8 (37.5%), REB: 12 (3 off, 9 def), AST: 4, TO: 4
TEAM FOULS: 6 [Team_003 in BONUS]


Team_003
--------------------------------------------------------------------------------
Player                MIN  PTS  REB  AST  TO      FG   FG%      3P   3P%
--------------------------------------------------------------------------------
Ayo Jackson            30   10    0    0   0   4/4   100.0     0/0   0.0
Nikola Bryant          30    6    0    1   0   2/6    33.3     0/0   0.0
Giannis Turner         30    4    1    0   0   2/3    66.7     0/0   0.0
Rudy Haliburton        30    0    4    0   0   0/0     0.0     0/0   0.0
Collin Mitchell         7    0    0    0   0   0/1     0.0     0/0   0.0
Anfernee Jordan         7    0    0    0   0   0/1     0.0     0/0   0.0

TEAM: FG: 8/17 (47.1%), 3PT: 3/6 (50.0%), REB: 10 (3 off, 7 def), AST: 3, TO: 4
TEAM FOULS: 5 [Team_088 in BONUS]

================================================================================

================================================================================
                       4TH QUARTER - Team_088 vs Team_003                       
================================================================================

[12:00] Substitution (Team_088): Josh Duncan OUT (stamina: 72) → Klay Quickley IN (comeback_detected)

[12:00] Substitution (Team_003): Ayo Jackson OUT (stamina: 74) → Miles Towns IN (comeback_detected)

[12:00] Team_088 possession (Score: 64-80)
Klay Quickley drives and kicks out. Klay Quickley attempts a Midrange. Contested by Nikola Bryant (4.1 feet, ZONE). Klay Quickley misses. Offensive rebound by Allen Ming! Allen Ming's putback is no good. Rebound secured by Giannis Turner.

[11:46] Team_003 possession (Score: 64-80)
Rudy Haliburton attempts a 3Pt. Contested by Tyler Hyland (4.7 feet, MAN). Rudy Haliburton misses. Rebound secured by Allen Ming.

[11:35] Team_088 possession (Score: 64-80)
Tobias Haliburton attempts a 3Pt. Contested by Nikola Bryant (4.2 feet, MAN). TOBIAS HALIBURTON MAKES IT! Assist: Giannis Smith
Score: 67-80

[11:17] Team_003 possession (Score: 67-80)
Giannis Turner attempts a 3Pt. Contested by Tobias Haliburton (5.5 feet, ZONE). Giannis Turner misses. Rebound secured by Giannis Smith.

[11:01] Team_088 possession (Score: 67-80)
Giannis Smith drives to the basket... Giannis Smith loses the ball! Stripped by Giannis Turner! TURNOVER! (live ball)

[10:47] Team_003 possession (Score: 67-80)
Rudy Haliburton drives, picks up Tyler Hyland. Help arrives from Klay Quickley! Rudy Haliburton attempts a Dunk. Contested by Klay Quickley (4.8 feet, MAN). RUDY HALIBURTON MAKES IT! Assist: Miles Towns
Score: 67-82

[10:33] Team_088 possession (Score: 67-82)
Tobias Haliburton attempts a Midrange. Contested by Nikola Bryant (4.3 feet, ZONE). Tobias Haliburton misses. Rebound secured by Giannis Turner.

[10:18] Team_003 possession (Score: 67-82)
Miles Towns loses the ball! Stripped by Klay Quickley! TURNOVER! (live ball)

[10:05] Team_088 possession (Score: 67-82)
Klay Quickley drives to the basket... Klay Quickley throws a bad pass out of bounds! TURNOVER! (dead ball)

[10:05] Substitution (Team_088): Tobias Haliburton OUT → Vince Carter IN (stamina_rule2)

[10:05] Substitution (Team_088): Tyler Hyland OUT → Pau Bird IN (stamina_rule2)

[10:05] Substitution (Team_088): Giannis Smith OUT → Zion Harris IN (stamina_rule2)

[10:05] Substitution (Team_088): Allen Ming OUT → Josh Embiid IN (stamina_rule2)

[10:05] Substitution (Team_003): Nikola Bryant OUT → Pau Williamson IN (stamina_rule2)

[10:05] Substitution (Team_003): Giannis Turner OUT → Anfernee Jordan IN (stamina_rule2)

[10:05] Substitution (Team_003): Victor O'Neal OUT → Bam Gilgeous-Alexander IN (stamina_rule2)

[09:50] Team_003 possession (Score: 67-82)
Pau Williamson drives to the basket... Pau Williamson throws a bad pass! Stolen by Vince Carter! TURNOVER! (live ball)

[09:31] Team_088 possession (Score: 67-82)
Klay Quickley drives and kicks out. FOUL! Shooting foul on Miles Towns. Klay Quickley to the line for 3 free throws. [Team fouls: 1] (Miles Towns: 1 personal fouls)   FT 1/3: GOOD   FT 2/3: MISS   FT 3/3: MISS Klay Quickley makes 1/3 from the line. Offensive rebound by Josh Embiid! Josh Embiid kicks it out.
Score: 68-82

[09:14] Team_088 possession (Score: 68-82)
FOUL! Holding foul on Miles Towns. [Team fouls: 2] No free throws, side out. (Miles Towns: 2 personal fouls)

[09:03] Team_088 possession (Score: 68-82)
Josh Embiid drives to the basket... Josh Embiid throws a bad pass! Stolen by Bam Gilgeous-Alexander! TURNOVER! (live ball)

[08:50] Team_003 possession (Score: 68-82)
FOUL! Reach-in foul on Josh Embiid during the drive. [Team fouls: 1] No free throws, side out. (Josh Embiid: 1 personal fouls)

[08:39] Team_003 possession (Score: 68-82)
FOUL! Shooting foul on Pau Bird. Pau Williamson to the line for 2 free throws. [Team fouls: 2] (Pau Bird: 1 personal fouls)   FT 1/2: GOOD   FT 2/2: MISS Pau Williamson makes 1/2 from the line. Rebound secured by Zion Harris.
Score: 68-83

[08:26] Team_088 possession (Score: 68-83)
Pau Bird attempts a 3Pt. Contested by Rudy Haliburton (4.0 feet, MAN). Pau Bird misses. Rebound secured by Anfernee Jordan.

[08:17] Team_003 possession (Score: 68-83)
Miles Towns attempts a Midrange. Contested by Klay Quickley (5.7 feet, MAN). MILES TOWNS MAKES IT! Assist: Bam Gilgeous-Alexander
Score: 68-85

[08:02] Team_088 possession (Score: 68-85)
Pau Bird attempts a 3Pt. Contested by Miles Towns (5.5 feet, ZONE). Pau Bird misses. Rebound secured by Anfernee Jordan.

[07:44] Team_003 possession (Score: 68-85)
Rudy Haliburton attempts a Layup. Contested by Zion Harris (5.8 feet, ZONE). Rudy Haliburton misses. Rebound secured by Zion Harris.

[07:28] Team_088 possession (Score: 68-85)
Zion Harris attempts a Midrange. Contested by Miles Towns (5.8 feet, ZONE). Zion Harris misses. Rebound secured by Rudy Haliburton.

[07:11] Team_003 possession (Score: 68-85)
Miles Towns attempts a 3Pt. Contested by Klay Quickley (5.7 feet, ZONE). MILES TOWNS MAKES IT! Assist: Rudy Haliburton
Score: 68-88

[06:52] Team_088 possession (Score: 68-88)
Vince Carter attempts a 3Pt. Contested by Miles Towns (5.0 feet, ZONE). Vince Carter misses. Offensive rebound by Josh Embiid! Josh Embiid kicks it out.

[06:36] Team_088 possession (Score: 68-88)
Klay Quickley attempts a 3Pt. Contested by Miles Towns (5.4 feet, MAN). Klay Quickley misses. Rebound secured by Rudy Haliburton.

[06:20] Team_003 possession (Score: 68-88)
Anfernee Jordan drives to the basket... Anfernee Jordan throws a bad pass out of bounds! TURNOVER! (dead ball)

[06:20] Substitution (Team_003): Rudy Haliburton OUT → Collin Mitchell IN (stamina_rule2)

[06:03] Team_088 possession (Score: 68-88)
FOUL! Shooting foul on Bam Gilgeous-Alexander. Zion Harris to the line for 3 free throws. [Team fouls: 3] (Bam Gilgeous-Alexander: 1 personal fouls)   FT 1/3: GOOD   FT 2/3: MISS   FT 3/3: MISS Zion Harris makes 1/3 from the line. Rebound secured by Collin Mitchell.
Score: 69-88

[05:48] Team_003 possession (Score: 69-88)
Pau Williamson attempts a Midrange. Contested by Vince Carter (4.6 feet, MAN). Pau Williamson misses. Rebound secured by Pau Bird.

[05:34] Team_088 possession (Score: 69-88)
Klay Quickley attempts a 3Pt. Contested by Miles Towns (5.4 feet, MAN). Klay Quickley misses. Rebound secured by Collin Mitchell.

[05:19] Team_003 possession (Score: 69-88)
FOUL! Offensive foul on Bam Gilgeous-Alexander! Josh Embiid drew the charge! [Team fouls: 4] (Bam Gilgeous-Alexander: 2 personal fouls) TURNOVER! (dead ball)

[05:04] Team_088 possession (Score: 69-88)
Josh Embiid drives, Bam Gilgeous-Alexander stays with him. Josh Embiid attempts a Dunk. Contested by Bam Gilgeous-Alexander (2.8 feet, MAN). JOSH EMBIID MAKES IT! Assist: Vince Carter
Score: 71-88

[04:47] Team_003 possession (Score: 71-88)
Miles Towns attempts a 3Pt. Contested by Pau Bird (4.9 feet, ZONE). Miles Towns misses. Rebound secured by Josh Embiid.

[04:33] Team_088 possession (Score: 71-88)
Klay Quickley attempts a Midrange. Contested by Miles Towns (5.4 feet, MAN). Klay Quickley misses. Offensive rebound by Pau Bird! Pau Bird kicks it out.

[04:20] Team_088 possession (Score: 71-88)
Klay Quickley attempts a 3Pt. Contested by Miles Towns (5.4 feet, ZONE). KLAY QUICKLEY MAKES IT! Assist: Vince Carter
Score: 74-88

[04:05] Team_003 possession (Score: 74-88)
Collin Mitchell attempts a 3Pt. Contested by Pau Bird (5.2 feet, MAN). Collin Mitchell misses. Offensive rebound by Collin Mitchell! Collin Mitchell kicks it out.

[03:47] Team_003 possession (Score: 74-88)
Miles Towns drives to the basket... Miles Towns throws a bad pass! Stolen by Zion Harris! TURNOVER! (live ball)

[03:33] Team_088 possession (Score: 74-88)
Josh Embiid attempts a Midrange. Contested by Bam Gilgeous-Alexander (2.9 feet, MAN). Josh Embiid misses. Rebound secured by Anfernee Jordan.

[03:19] Team_003 possession (Score: 74-88)
Anfernee Jordan attempts a 3Pt. Contested by Zion Harris (5.7 feet, MAN). ANFERNEE JORDAN MAKES IT! Assist: Miles Towns
Score: 74-91

[03:08] Team_088 possession (Score: 74-91)
Pau Bird loses the ball! Stripped by Collin Mitchell! TURNOVER! (live ball)

[02:53] Team_003 possession (Score: 74-91)
Pau Williamson drives, picks up Vince Carter. Help arrives from Pau Bird! Pau Williamson attempts a Dunk. Contested by Pau Bird (4.7 feet, MAN). PAU WILLIAMSON MAKES IT! Assist: Collin Mitchell
Score: 74-93

[02:37] Team_088 possession (Score: 74-93)
Klay Quickley attempts a 3Pt. Contested by Miles Towns (5.6 feet, MAN). KLAY QUICKLEY MAKES IT! Assist: Vince Carter
Score: 77-93

[02:19] Team_003 possession (Score: 77-93)
Anfernee Jordan attempts a Midrange. Contested by Pau Bird (5.0 feet, ZONE). Anfernee Jordan misses. Rebound secured by Josh Embiid.

[02:08] Team_088 possession (Score: 77-93)
Klay Quickley loses the ball! Stripped by Miles Towns! TURNOVER! (live ball)

[01:55] Team_003 possession (Score: 77-93)
Bam Gilgeous-Alexander drives to the basket... Bam Gilgeous-Alexander throws a bad pass out of bounds! TURNOVER! (dead ball)

[01:43] Team_088 possession (Score: 77-93)
Zion Harris attempts a 3Pt. Contested by Bam Gilgeous-Alexander (3.7 feet, MAN). ZION HARRIS MAKES IT!
Score: 80-93

[01:26] Team_003 possession (Score: 80-93)
Anfernee Jordan drives to the basket... Anfernee Jordan throws a bad pass out of bounds! TURNOVER! (dead ball)

[01:12] Team_088 possession (Score: 80-93)
Vince Carter drives and kicks out. Klay Quickley attempts a Midrange. Contested by Pau Williamson (5.4 feet, ZONE). KLAY QUICKLEY MAKES IT! Assist: Josh Embiid
Score: 82-93

[00:59] Team_003 possession (Score: 82-93)
Anfernee Jordan drives to the basket... Anfernee Jordan commits a violation (traveling/carry)! TURNOVER! (dead ball)

[00:41] Team_088 possession (Score: 82-93)
Klay Quickley attempts a 3Pt. Contested by Miles Towns (5.7 feet, MAN). Klay Quickley misses. FOUL! Loose ball foul on Anfernee Jordan during the rebound battle. [IN THE BONUS! 5 team fouls] Pau Bird to the line for 2 free throws. (Anfernee Jordan: 1 personal fouls)   FT 1/2: GOOD   FT 2/2: GOOD Pau Bird makes 2/2 from the line.
Score: 84-93

[00:30] Team_003 possession (Score: 84-93)
FOUL! Reach-in foul on Zion Harris during the drive. [Team fouls: 3] No free throws, side out. (Zion Harris: 1 personal fouls)

[00:15] Team_003 possession (Score: 84-93)
Bam Gilgeous-Alexander drives, picks up Zion Harris. Help arrives from Vince Carter! Bam Gilgeous-Alexander attempts a Layup. Wide open! Vince Carter is 6.7 feet away. [ZONE] BAM GILGEOUS-ALEXANDER MAKES IT!
Score: 84-95

[00:05] Team_088 possession (Score: 84-95)
Zion Harris attempts a Midrange. Contested by Bam Gilgeous-Alexander (3.9 feet, MAN). Zion Harris misses. Offensive rebound by Pau Bird! Pau Bird kicks it out.

================================================================================
                              4TH QUARTER COMPLETE                              
================================================================================

4TH QUARTER SCORE: Team_088 20, Team_003 15

BOX SCORE:
================================================================================

Team_088
--------------------------------------------------------------------------------
Player                MIN  PTS  REB  AST  TO      FG   FG%      3P   3P%
--------------------------------------------------------------------------------
Klay Quickley          19    8    0    0   0   3/6    50.0     0/0   0.0
Tobias Haliburton      32    3    0    0   0   1/2    50.0     0/0   0.0
Zion Harris            17    3    2    0   0   1/3    33.3     0/0   0.0
Josh Embiid            17    2    4    1   0   1/2    50.0     0/0   0.0
Pau Bird               17    2    3    0   0   1/3    33.3     0/0   0.0
Allen Ming             32    0    1    0   0   0/0     0.0     0/0   0.0
Giannis Smith          32    0    1    1   0   0/0     0.0     0/0   0.0
Vince Carter           17    0    0    3   0   0/0     0.0     0/0   0.0

TEAM: FG: 7/16 (43.8%), 3PT: 5/10 (50.0%), REB: 12 (5 off, 7 def), AST: 5, TO: 5
TEAM FOULS: 3


Team_003
--------------------------------------------------------------------------------
Player                MIN  PTS  REB  AST  TO      FG   FG%      3P   3P%
--------------------------------------------------------------------------------
Miles Towns            19    5    0    2   0   2/3    66.7     0/0   0.0
Anfernee Jordan        17    3    3    0   0   1/2    50.0     0/0   0.0
Rudy Haliburton        36    2    2    1   0   1/3    33.3     0/0   0.0
Pau Williamson         17    2    0    0   0   1/3    33.3     0/0   0.0
Bam Gilgeous-Alexander   17    2    0    1   0   1/1   100.0     0/0   0.0
Giannis Turner         32    0    2    0   0   0/1     0.0     0/0   0.0
Collin Mitchell        13    0    3    1   0   0/0     0.0     0/0   0.0

TEAM: FG: 6/13 (46.2%), 3PT: 2/5 (40.0%), REB: 9 (1 off, 8 def), AST: 5, TO: 8
TEAM FOULS: 5 [Team_088 in BONUS]

================================================================================

================================================================================
                               FULL GAME COMPLETE                               
================================================================================

FINAL SCORE: Team_088 84, Team_003 95

SCORING BY QUARTER:
--------------------------------------------------------------------------------
Team                     Q1     Q2     Q3     Q4    FINAL
--------------------------------------------------------------------------------
Team_088                 19     21     24     20       84
Team_003                 33     26     21     15       95
--------------------------------------------------------------------------------

FULL GAME BOX SCORE:
================================================================================

Team_088
--------------------------------------------------------------------------------
Player                MIN  PTS  REB  AST  TO      FG   FG%      3P   3P%      FT STL BLK
--------------------------------------------------------------------------------
Tobias Haliburton      32   17    0    2   0   5/13   38.5   4/8    50.0   0/1     1   0
Tyler Hyland           32    8    5    1   3   3/9    33.3   0/4     0.0   1/1     1   0
Giannis Smith          32    8   12    2   1   2/8    25.0   0/2     0.0   0/0     1   1
Allen Ming             32    7    9    1   4   4/5    80.0   0/0     0.0   1/2     0   0
Josh Duncan            30    6    0    1   1   5/13   38.5   2/10   20.0   1/1     0   0
Klay Quickley          19   10    0    0   2   4/7    57.1   3/5    60.0   1/3     1   0
Vince Carter           17    3    0    5   1   4/4   100.0   1/1   100.0   3/4     1   0
Pau Bird               17    7    5    0   1   1/3    33.3   1/3    33.3   4/4     1   0
Zion Harris            17    8    4    1   1   3/8    37.5   1/4    25.0   2/4     1   0
Josh Embiid            17    6    6    1   0   3/5    60.0   0/1     0.0   0/0     0   1

TEAM: FG: 34/75 (45.3%), 3PT: 12/38 (31.6%), REB: 44 (12 off, 32 def), AST: 14, TO: 14


Team_003
--------------------------------------------------------------------------------
Player                MIN  PTS  REB  AST  TO      FG   FG%      3P   3P%      FT STL BLK
--------------------------------------------------------------------------------
Rudy Haliburton        36    9   21    2   3   1/8    12.5   0/4     0.0   2/2     0   0
Nikola Bryant          32   18    0    2   2   5/12   41.7   3/6    50.0   2/2     0   0
Giannis Turner         32   12    6    0   0   7/13   53.8   0/2     0.0   8/11    4   1
Victor O'Neal          32    7   12    3   2   4/6    66.7   0/0     0.0   1/2     0   0
Ayo Jackson            30   16    0    1   2   7/7   100.0   3/3   100.0   6/6     1   1
Miles Towns            19   10    0    2   1   3/4    75.0   1/2    50.0   0/0     1   0
Pau Williamson         17    2    0    2   3   2/4    50.0   0/0     0.0   1/2     0   0
Anfernee Jordan        17    8    3    1   2   2/6    33.3   2/4    50.0   2/3     0   0
Bam Gilgeous-Alexander   17    4    3    1   2   2/3    66.7   0/0     0.0   0/0     2   0
Collin Mitchell        13    2    4    1   1   0/1     0.0   0/0     0.0   2/2     1   0

TEAM: FG: 36/68 (52.9%), 3PT: 9/21 (42.9%), REB: 46 (8 off, 38 def), AST: 15, TO: 18

================================================================================
