================================================================================
                        FULL GAME - Team_038 vs Team_060                        
================================================================================

================================================================================
                       1ST QUARTER - Team_038 vs Team_060                       
================================================================================

[12:00] Team_038 possession (Score: 0-0)
Luka Barnes attempts a Midrange. BLOCKED BY JAREN GEORGE! Ball is loose! Rebound secured by Jaren George.

[11:43] Team_060 possession (Score: 0-0)
Larry Westbrook attempts a Midrange. Contested by Malcolm Poole (5.4 feet, ZONE). Larry Westbrook misses. Rebound secured by Luka Barnes.

[11:32] Team_038 possession (Score: 0-0)
FOUL! Holding foul on Julius Green. [Team fouls: 1] No free throws, side out. (Julius Green: 1 personal fouls)

[11:18] Team_038 possession (Score: 0-0)
FOUL! Offensive foul on Rudy Thompson! Joel Morant drew the charge! [Team fouls: 1] (Rudy Thompson: 1 personal fouls) TURNOVER! (dead ball)

[11:03] Team_060 possession (Score: 0-0)
FOUL! Reach-in foul on Tracy LaVine during the drive. [Team fouls: 2] No free throws, side out. (Tracy LaVine: 1 personal fouls)

[10:50] Team_060 possession (Score: 0-0)
Immanuel Ming makes the Layup and draws the foul on Tracy LaVine! And-1! Immanuel Ming to the line for 1. [Team fouls: 3] (Tracy LaVine: 2 personal fouls)   FT 1/1: GOOD Immanuel Ming makes 1/1 from the line.
Score: 0-3

[10:39] Team_038 possession (Score: 0-3)
Malcolm Poole drives to the basket... Malcolm Poole loses the ball! Stripped by Julius Green! TURNOVER! (live ball)

[10:25] Team_060 possession (Score: 0-3)
Immanuel Ming drives, DeMar Harris stays with him. Immanuel Ming attempts a Layup. Contested by DeMar Harris (3.1 feet, MAN). Immanuel Ming misses. Rebound secured by Tracy LaVine.

[10:13] Team_038 possession (Score: 0-3)
FOUL! Offensive foul on Tracy LaVine! Larry Westbrook drew the charge! [Team fouls: 4] (Tracy LaVine: 3 personal fouls) TURNOVER! (dead ball)

[09:59] Team_060 possession (Score: 0-3)
FOUL! Holding foul on DeMar Harris. [IN THE BONUS! 5 team fouls] Immanuel Ming to the line for 2 free throws. (DeMar Harris: 1 personal fouls)   FT 1/2: GOOD   FT 2/2: MISS Immanuel Ming makes 1/2 from the line. Rebound secured by Luka Barnes.
Score: 0-4

[09:43] Team_038 possession (Score: 0-4)
Malcolm Poole attempts a Midrange. Contested by Julius Green (3.7 feet, MAN). Malcolm Poole misses. Rebound secured by Jaren George.

[09:33] Team_060 possession (Score: 0-4)
Larry Westbrook attempts a 3Pt. Contested by DeMar Harris (3.6 feet, ZONE). LARRY WESTBROOK MAKES IT! Assist: Joel Morant
Score: 0-7

[09:18] Team_038 possession (Score: 0-7)
DeMar Harris attempts a Midrange. Contested by Larry Westbrook (5.4 feet, ZONE). DEMAR HARRIS MAKES IT!
Score: 2-7

[09:06] Team_060 possession (Score: 2-7)
Immanuel Ming drives, Tracy LaVine stays with him. Immanuel Ming attempts a Layup. Contested by Tracy LaVine (3.8 feet, ZONE). Immanuel Ming misses. Rebound secured by Tracy LaVine.

[08:50] Team_038 possession (Score: 2-7)
Tracy LaVine drives to the basket... Tracy LaVine loses the ball! Stripped by Larry Westbrook! TURNOVER! (live ball)

[08:41] Team_060 possession (Score: 2-7)
Joel Morant attempts a 3Pt. Contested by Rudy Thompson (3.5 feet, MAN). Joel Morant misses. Rebound secured by Luka Barnes.

[08:23] Team_038 possession (Score: 2-7)
Malcolm Poole attempts a 3Pt. Contested by Julius Green (3.7 feet, MAN). Malcolm Poole misses. Rebound secured by Jaren George.

[08:12] Team_060 possession (Score: 2-7)
Larry Westbrook attempts a Layup. Contested by Tracy LaVine (4.3 feet, MAN). Larry Westbrook misses. Offensive rebound by Immanuel Ming! Immanuel Ming kicks it out.

[08:01] Team_060 possession (Score: 2-7)
Jaren George drives, Luka Barnes stays with him. Jaren George attempts a Layup. Contested by Luka Barnes (4.4 feet, MAN). Jaren George misses. Rebound secured by DeMar Harris.

[07:48] Team_038 possession (Score: 2-7)
Malcolm Poole drives to the basket... FOUL! Offensive foul on Malcolm Poole! Julius Green drew the charge! [Team fouls: 6] (Malcolm Poole: 1 personal fouls) TURNOVER! (dead ball)

[07:32] Team_060 possession (Score: 2-7)
Julius Green attempts a Midrange. Contested by Malcolm Poole (4.7 feet, MAN). Julius Green misses. Rebound secured by DeMar Harris.

[07:16] Team_038 possession (Score: 2-7)
FOUL! Shooting foul on Julius Green. DeMar Harris to the line for 3 free throws. [Team fouls: 2] (Julius Green: 2 personal fouls)   FT 1/3: MISS   FT 2/3: MISS   FT 3/3: MISS DeMar Harris makes 0/3 from the line. Rebound secured by Larry Westbrook.

[07:03] Team_060 possession (Score: 2-7)
Jaren George drives and kicks out. Julius Green attempts a Midrange. Contested by Malcolm Poole (4.9 feet, MAN). Julius Green misses. Rebound secured by Tracy LaVine.

[06:50] Team_038 possession (Score: 2-7)
Luka Barnes makes the Layup and draws the foul on Jaren George! And-1! Luka Barnes to the line for 1. [Team fouls: 3] (Jaren George: 1 personal fouls)   FT 1/1: GOOD Luka Barnes makes 1/1 from the line.
Score: 5-7

[06:35] Team_060 possession (Score: 5-7)
Jaren George attempts a Layup. BLOCKED BY LUKA BARNES! Ball is loose! Rebound secured by Tracy LaVine.

[06:24] Team_038 possession (Score: 5-7)
DeMar Harris drives to the basket... DeMar Harris loses the ball! Stripped by Jaren George! TURNOVER! (live ball)

[06:11] Team_060 possession (Score: 5-7)
FOUL! Reach-in foul on Luka Barnes during the drive. [IN THE BONUS! 7 team fouls] Jaren George to the line for 2 free throws. (Luka Barnes: 1 personal fouls)   FT 1/2: MISS   FT 2/2: GOOD Jaren George makes 1/2 from the line.
Score: 5-8

[05:56] Team_038 possession (Score: 5-8)
DeMar Harris attempts a 3Pt. Contested by Julius Green (4.5 feet, ZONE). DeMar Harris misses. Rebound secured by Larry Westbrook.

[05:42] Team_060 possession (Score: 5-8)
Joel Morant attempts a 3Pt. Contested by DeMar Harris (2.8 feet, ZONE). JOEL MORANT MAKES IT! Assist: Julius Green
Score: 5-11

[05:24] Team_038 possession (Score: 5-11)
Tracy LaVine drives and kicks out. DeMar Harris makes the Midrange and draws the foul on Immanuel Ming! And-1! DeMar Harris to the line for 1. [Team fouls: 4] (Immanuel Ming: 1 personal fouls)   FT 1/1: GOOD DeMar Harris makes 1/1 from the line.
Score: 8-11

[05:04] Team_060 possession (Score: 8-11)
Jaren George attempts a 3Pt. Contested by Luka Barnes (4.4 feet, MAN). Jaren George misses. Rebound secured by Tracy LaVine.

[04:49] Team_038 possession (Score: 8-11)
FOUL! Holding foul on Jaren George. [IN THE BONUS! 5 team fouls] Luka Barnes to the line for 2 free throws. (Jaren George: 2 personal fouls)   FT 1/2: GOOD   FT 2/2: GOOD Luka Barnes makes 2/2 from the line.
Score: 10-11

[04:33] Team_060 possession (Score: 10-11)
Immanuel Ming attempts a 3Pt. Contested by DeMar Harris (3.2 feet, MAN). IMMANUEL MING MAKES IT! Assist: Larry Westbrook
Score: 10-14

[04:18] Team_038 possession (Score: 10-14)
Luka Barnes loses the ball! Stripped by Jaren George! TURNOVER! (live ball)

[04:01] Team_060 possession (Score: 10-14)
Joel Morant attempts a 3Pt. Contested by DeMar Harris (2.9 feet, ZONE). Joel Morant misses. Rebound secured by Tracy LaVine.

[03:46] Team_038 possession (Score: 10-14)
Malcolm Poole attempts a 3Pt. Contested by Julius Green (3.8 feet, MAN). Malcolm Poole misses. Rebound secured by Immanuel Ming.

[03:33] Team_060 possession (Score: 10-14)
Julius Green attempts a Layup. Contested by Tracy LaVine (3.9 feet, ZONE). JULIUS GREEN MAKES IT! Assist: Larry Westbrook
Score: 10-16

[03:19] Team_038 possession (Score: 10-16)
Luka Barnes attempts a Midrange. Contested by Jaren George (5.7 feet, MAN). LUKA BARNES MAKES IT!
Score: 12-16

[03:01] Team_060 possession (Score: 12-16)
Jaren George drives, picks up Tracy LaVine. Help arrives from Malcolm Poole! Jaren George attempts a Dunk. Contested by Malcolm Poole (4.2 feet, ZONE). JAREN GEORGE MAKES IT! Assist: Julius Green
Score: 12-18

[02:44] Team_038 possession (Score: 12-18)
Luka Barnes attempts a Midrange. Contested by Jaren George (5.8 feet, MAN). Luka Barnes misses. Rebound secured by Immanuel Ming.

[02:31] Team_060 possession (Score: 12-18)
Immanuel Ming makes the Layup and draws the foul on DeMar Harris! And-1! Immanuel Ming to the line for 1. [BONUS: 8 team fouls] (DeMar Harris: 2 personal fouls)   FT 1/1: GOOD Immanuel Ming makes 1/1 from the line.
Score: 12-21

[02:16] Team_038 possession (Score: 12-21)
FOUL! Shooting foul on Julius Green. Rudy Thompson to the line for 3 free throws. [BONUS: 6 team fouls] (Julius Green: 3 personal fouls)   FT 1/3: GOOD   FT 2/3: GOOD   FT 3/3: GOOD Rudy Thompson makes 3/3 from the line.
Score: 15-21

[01:59] Team_060 possession (Score: 15-21)
Joel Morant attempts a 3Pt. Contested by DeMar Harris (3.1 feet, ZONE). JOEL MORANT MAKES IT! Assist: Immanuel Ming
Score: 15-24

[01:44] Team_038 possession (Score: 15-24)
DeMar Harris attempts a 3Pt. Contested by Julius Green (4.8 feet, ZONE). DeMar Harris misses. Rebound secured by Jaren George.

[01:30] Team_060 possession (Score: 15-24)
FOUL! Holding foul on DeMar Harris. [IN THE BONUS! 9 team fouls] Immanuel Ming to the line for 2 free throws. (DeMar Harris: 3 personal fouls)   FT 1/2: GOOD   FT 2/2: GOOD Immanuel Ming makes 2/2 from the line.
Score: 15-26

[01:13] Team_038 possession (Score: 15-26)
Rudy Thompson attempts a 3Pt. Contested by Julius Green (4.7 feet, ZONE). Rudy Thompson misses. Rebound secured by Immanuel Ming.

[00:55] Team_060 possession (Score: 15-26)
Jaren George attempts a Midrange. Contested by Tracy LaVine (4.4 feet, ZONE). Jaren George misses. Rebound secured by Tracy LaVine.

[00:40] Team_038 possession (Score: 15-26)
Rudy Thompson attempts a 3Pt. Wide open! Joel Morant is 6.3 feet away. [MAN] Rudy Thompson misses. Rebound secured by Immanuel Ming.

[00:26] Team_060 possession (Score: 15-26)
Larry Westbrook makes the Layup and draws the foul on Tracy LaVine! And-1! Larry Westbrook to the line for 1. [BONUS: 10 team fouls] (Tracy LaVine: 4 personal fouls)   FT 1/1: GOOD Larry Westbrook makes 1/1 from the line.
Score: 15-29

[00:15] Team_038 possession (Score: 15-29)
DeMar Harris drives, Immanuel Ming stays with him. DeMar Harris attempts a Dunk. Contested by Immanuel Ming (4.8 feet, MAN). DEMAR HARRIS MAKES IT! Assist: Luka Barnes
Score: 17-29

================================================================================
                              1ST QUARTER COMPLETE                              
================================================================================

1ST QUARTER SCORE: Team_038 17, Team_060 29

BOX SCORE:
================================================================================

Team_038
--------------------------------------------------------------------------------
Player                MIN  PTS  REB  AST  TO      FG   FG%      3P   3P%
--------------------------------------------------------------------------------
Luka Barnes            12    7    3    1   0   3/5    60.0     0/0   0.0
DeMar Harris           12    7    2    0   0   3/6    50.0     0/0   0.0
Rudy Thompson          12    3    0    0   0   1/3    33.3     0/0   0.0
Tracy LaVine           12    0    7    0   0   0/0     0.0     0/0   0.0
Malcolm Poole          12    0    0    0   0   0/3     0.0     0/0   0.0

TEAM: FG: 7/17 (41.2%), 3PT: 1/8 (12.5%), REB: 12 (0 off, 12 def), AST: 1, TO: 7
TEAM FOULS: 10 [Team_060 in BONUS]


Team_060
--------------------------------------------------------------------------------
Player                MIN  PTS  REB  AST  TO      FG   FG%      3P   3P%
--------------------------------------------------------------------------------
Immanuel Ming          12   11    5    1   0   4/6    66.7     0/0   0.0
Larry Westbrook        12    6    2    2   0   2/3    66.7     0/0   0.0
Joel Morant            12    6    0    1   0   2/4    50.0     0/0   0.0
Jaren George           12    3    4    0   0   2/7    28.6     0/0   0.0
Julius Green           12    2    0    2   0   1/2    50.0     0/0   0.0

TEAM: FG: 11/23 (47.8%), 3PT: 4/7 (57.1%), REB: 11 (1 off, 10 def), AST: 6, TO: 0
TEAM FOULS: 6 [Team_038 in BONUS]

================================================================================

================================================================================
                       2ND QUARTER - Team_038 vs Team_060                       
================================================================================

[12:00] Team_038 possession (Score: 17-29)
FOUL! Holding foul on Immanuel Ming. [Team fouls: 1] No free throws, side out. (Immanuel Ming: 1 personal fouls)

[11:49] Team_038 possession (Score: 17-29)
Rudy Thompson attempts a 3Pt. Wide open! Joel Morant is 6.2 feet away. [MAN] Rudy Thompson misses. Rebound secured by Larry Westbrook.

[11:31] Team_060 possession (Score: 17-29)
Julius Green drives and kicks out. Joel Morant attempts a 3Pt. Contested by DeMar Harris (3.5 feet, ZONE). Joel Morant misses. FOUL! Loose ball foul on Tracy LaVine during the rebound battle. [Team fouls: 1] No free throws, side out. (Tracy LaVine: 1 personal fouls)

[11:14] Team_060 possession (Score: 17-29)
FOUL! Holding foul on Tracy LaVine. [Team fouls: 2] No free throws, side out. (Tracy LaVine: 2 personal fouls)

[10:59] Team_060 possession (Score: 17-29)
Immanuel Ming attempts a 3Pt. Contested by Tracy LaVine (4.3 feet, ZONE). Immanuel Ming misses. Rebound secured by DeMar Harris.

[10:48] Team_038 possession (Score: 17-29)
Tracy LaVine attempts a Midrange. Contested by Larry Westbrook (5.0 feet, MAN). TRACY LAVINE MAKES IT!
Score: 19-29

[10:32] Team_060 possession (Score: 19-29)
Immanuel Ming attempts a Midrange. Contested by Tracy LaVine (4.3 feet, ZONE). IMMANUEL MING MAKES IT! Assist: Larry Westbrook
Score: 19-31

[10:22] Team_038 possession (Score: 19-31)
DeMar Harris attempts a Layup. Contested by Immanuel Ming (4.7 feet, MAN). DEMAR HARRIS MAKES IT! Assist: Malcolm Poole
Score: 21-31

[10:04] Team_060 possession (Score: 21-31)
Immanuel Ming drives and kicks out. FOUL! Shooting foul on Malcolm Poole. Julius Green to the line for 2 free throws. [Team fouls: 3] (Malcolm Poole: 1 personal fouls)   FT 1/2: MISS   FT 2/2: GOOD Julius Green makes 1/2 from the line.
Score: 21-32

[09:50] Team_038 possession (Score: 21-32)
Rudy Thompson attempts a Midrange. Contested by Larry Westbrook (5.8 feet, ZONE). RUDY THOMPSON MAKES IT! Assist: Tracy LaVine
Score: 23-32

[09:36] Team_060 possession (Score: 23-32)
Julius Green attempts a 3Pt. Contested by Malcolm Poole (5.1 feet, MAN). Julius Green misses. Rebound secured by DeMar Harris.

[09:20] Team_038 possession (Score: 23-32)
Malcolm Poole drives to the basket... Malcolm Poole commits a violation (traveling/carry)! TURNOVER! (dead ball)

[09:20] Substitution (Team_038): Rudy Thompson OUT → Jalen Hyland IN (stamina_rule2)

[09:20] Substitution (Team_038): Malcolm Poole OUT → Jaren Jokic IN (stamina_rule2)

[09:20] Substitution (Team_038): DeMar Harris OUT → Magic Dosunmu IN (stamina_rule2)

[09:20] Substitution (Team_038): Tracy LaVine OUT → Jabari Carter IN (stamina_rule2)

[09:20] Substitution (Team_038): Luka Barnes OUT → Ja Smith IN (stamina_rule2)

[09:20] Substitution (Team_060): Joel Morant OUT → Domantas Barnes IN (stamina_rule2)

[09:20] Substitution (Team_060): Julius Green OUT → Rudy Ginobili IN (stamina_rule2)

[09:20] Substitution (Team_060): Immanuel Ming OUT → Jarrett Wagner IN (stamina_rule2)

[09:20] Substitution (Team_060): Larry Westbrook OUT → Yao Tatum IN (stamina_rule2)

[09:20] Substitution (Team_060): Jaren George OUT → Klay Haliburton IN (stamina_rule2)

[09:08] Team_060 possession (Score: 23-32)
FOUL! Offensive foul on Rudy Ginobili! Jaren Jokic drew the charge! [Team fouls: 2] (Rudy Ginobili: 1 personal fouls) TURNOVER! (dead ball)

[08:53] Team_038 possession (Score: 23-32)
Jabari Carter drives and kicks out. Jalen Hyland attempts a Midrange. Contested by Jarrett Wagner (4.8 feet, ZONE). JALEN HYLAND MAKES IT! Assist: Jabari Carter
Score: 25-32

[08:35] Team_060 possession (Score: 25-32)
Jarrett Wagner attempts a Layup. Contested by Ja Smith (3.5 feet, ZONE). JARRETT WAGNER MAKES IT!
Score: 25-34

[08:20] Team_038 possession (Score: 25-34)
Jalen Hyland drives to the basket... Jalen Hyland loses the ball! Stripped by Domantas Barnes! TURNOVER! (live ball)

[08:07] Team_060 possession (Score: 25-34)
Jarrett Wagner drives to the basket... Jarrett Wagner throws a bad pass out of bounds! TURNOVER! (dead ball)

[07:52] Team_038 possession (Score: 25-34)
FOUL! Reach-in foul on Klay Haliburton during the drive. [Team fouls: 3] No free throws, side out. (Klay Haliburton: 1 personal fouls)

[07:32] Team_038 possession (Score: 25-34)
Jaren Jokic attempts a 3Pt. Contested by Domantas Barnes (4.3 feet, ZONE). Jaren Jokic misses. Rebound secured by Rudy Ginobili.

[07:16] Team_060 possession (Score: 25-34)
Klay Haliburton attempts a Midrange. Contested by Magic Dosunmu (3.4 feet, ZONE). KLAY HALIBURTON MAKES IT!
Score: 25-36

[07:05] Team_038 possession (Score: 25-36)
Jaren Jokic attempts a Midrange. Contested by Jarrett Wagner (4.5 feet, ZONE). Jaren Jokic misses. Rebound secured by Rudy Ginobili.

[06:54] Team_060 possession (Score: 25-36)
Rudy Ginobili attempts a 3Pt. Contested by Jaren Jokic (5.4 feet, MAN). Rudy Ginobili misses. Offensive rebound by Klay Haliburton! Klay Haliburton's putback is no good. Rebound secured by Jabari Carter.

[06:41] Team_038 possession (Score: 25-36)
Magic Dosunmu drives to the basket... Magic Dosunmu throws a bad pass! Stolen by Klay Haliburton! TURNOVER! (live ball)

[06:25] Team_060 possession (Score: 25-36)
Yao Tatum attempts a 3Pt. Contested by Jalen Hyland (4.3 feet, ZONE). Yao Tatum misses. Rebound secured by Jabari Carter.

[06:14] Team_038 possession (Score: 25-36)
Magic Dosunmu attempts a Midrange. Contested by Jarrett Wagner (5.1 feet, ZONE). MAGIC DOSUNMU MAKES IT!
Score: 27-36

[06:03] Team_060 possession (Score: 27-36)
Klay Haliburton drives and kicks out. FOUL! Shooting foul on Jalen Hyland. Jarrett Wagner to the line for 3 free throws. [Team fouls: 4] (Jalen Hyland: 1 personal fouls)   FT 1/3: MISS   FT 2/3: GOOD   FT 3/3: GOOD Jarrett Wagner makes 2/3 from the line.
Score: 27-38

[05:54] Team_038 possession (Score: 27-38)
Jaren Jokic attempts a 3Pt. Contested by Domantas Barnes (4.3 feet, ZONE). JAREN JOKIC MAKES IT! Assist: Magic Dosunmu
Score: 30-38

[05:39] Team_060 possession (Score: 30-38)
Rudy Ginobili makes the Layup and draws the foul on Jaren Jokic! And-1! Rudy Ginobili to the line for 1. [BONUS: 5 team fouls] (Jaren Jokic: 1 personal fouls)   FT 1/1: GOOD Rudy Ginobili makes 1/1 from the line.
Score: 30-41

[05:24] Team_038 possession (Score: 30-41)
FOUL! Shooting foul on Klay Haliburton. Jabari Carter to the line for 2 free throws. [Team fouls: 4] (Klay Haliburton: 2 personal fouls)   FT 1/2: MISS   FT 2/2: MISS Jabari Carter makes 0/2 from the line. Rebound secured by Domantas Barnes.

[05:05] Team_060 possession (Score: 30-41)
Jarrett Wagner drives, Ja Smith stays with him. Jarrett Wagner attempts a Layup. Contested by Ja Smith (3.5 feet, ZONE). JARRETT WAGNER MAKES IT! Assist: Klay Haliburton
Score: 30-43

[04:52] Team_038 possession (Score: 30-43)
Ja Smith attempts a Midrange. Contested by Domantas Barnes (5.6 feet, ZONE). JA SMITH MAKES IT!
Score: 32-43

[04:36] Team_060 possession (Score: 32-43)
Jarrett Wagner attempts a 3Pt. Contested by Magic Dosunmu (3.3 feet, MAN). JARRETT WAGNER MAKES IT! Assist: Rudy Ginobili
Score: 32-46

[04:22] Team_038 possession (Score: 32-46)
Ja Smith attempts a Layup. Contested by Klay Haliburton (5.3 feet, ZONE). JA SMITH MAKES IT! Assist: Jaren Jokic
Score: 34-46

[04:03] Team_060 possession (Score: 34-46)
Yao Tatum attempts a Midrange. Contested by Jabari Carter (4.1 feet, ZONE). Yao Tatum misses. Rebound secured by Jalen Hyland.

[03:45] Team_038 possession (Score: 34-46)
Jalen Hyland attempts a Midrange. Contested by Domantas Barnes (4.7 feet, MAN). Jalen Hyland misses. Rebound secured by Rudy Ginobili.

[03:35] Team_060 possession (Score: 34-46)
Rudy Ginobili attempts a Midrange. Contested by Jaren Jokic (5.4 feet, MAN). Rudy Ginobili misses. Rebound secured by Jalen Hyland.

[03:20] Team_038 possession (Score: 34-46)
FOUL! Shooting foul on Klay Haliburton. Ja Smith to the line for 2 free throws. [BONUS: 5 team fouls] (Klay Haliburton: 3 personal fouls)   FT 1/2: MISS   FT 2/2: GOOD Ja Smith makes 1/2 from the line.
Score: 35-46

[03:09] Team_060 possession (Score: 35-46)
Jarrett Wagner makes the Layup and draws the foul on Ja Smith! And-1! Jarrett Wagner to the line for 1. [BONUS: 6 team fouls] (Ja Smith: 1 personal fouls)   FT 1/1: GOOD Jarrett Wagner makes 1/1 from the line.
Score: 35-49

[02:55] Team_038 possession (Score: 35-49)
Jalen Hyland attempts a Midrange. Contested by Rudy Ginobili (4.5 feet, ZONE). Jalen Hyland misses. Rebound secured by Klay Haliburton.

[02:42] Team_060 possession (Score: 35-49)
Domantas Barnes attempts a 3Pt. Contested by Jalen Hyland (4.3 feet, ZONE). Domantas Barnes misses. Rebound secured by Jabari Carter.

[02:23] Team_038 possession (Score: 35-49)
Magic Dosunmu drives and kicks out. Magic Dosunmu makes the Midrange and draws the foul on Jarrett Wagner! And-1! Magic Dosunmu to the line for 1. [BONUS: 6 team fouls] (Jarrett Wagner: 1 personal fouls)   FT 1/1: MISS Magic Dosunmu makes 0/1 from the line. Offensive rebound by Jabari Carter! Jabari Carter's putback is no good.
Score: 37-49

[02:11] Team_060 possession (Score: 37-49)
Rudy Ginobili drives, picks up Jaren Jokic. Help arrives from Jalen Hyland! Rudy Ginobili attempts a Dunk. Contested by Jalen Hyland (5.4 feet, MAN). Rudy Ginobili misses. Offensive rebound by Klay Haliburton! Klay Haliburton puts it back in!
Score: 37-51

[01:52] Team_038 possession (Score: 37-51)
Jabari Carter drives, Klay Haliburton stays with him. Jabari Carter attempts a Layup. Contested by Klay Haliburton (4.9 feet, ZONE). Jabari Carter misses. Offensive rebound by Jabari Carter! Jabari Carter puts it back in!
Score: 39-51

[01:37] Team_060 possession (Score: 39-51)
Domantas Barnes attempts a 3Pt. Contested by Jalen Hyland (4.4 feet, MAN). Domantas Barnes misses. Rebound secured by Jabari Carter.

[01:23] Team_038 possession (Score: 39-51)
FOUL! Reach-in foul on Klay Haliburton during the drive. [IN THE BONUS! 7 team fouls] Jaren Jokic to the line for 2 free throws. (Klay Haliburton: 4 personal fouls)   FT 1/2: GOOD   FT 2/2: GOOD Jaren Jokic makes 2/2 from the line.
Score: 41-51

[01:10] Team_060 possession (Score: 41-51)
Rudy Ginobili attempts a 3Pt. Contested by Jaren Jokic (5.4 feet, MAN). Rudy Ginobili misses. Rebound secured by Jalen Hyland.

[00:54] Team_038 possession (Score: 41-51)
Magic Dosunmu attempts a 3Pt. Contested by Jarrett Wagner (5.2 feet, MAN). Magic Dosunmu misses. Rebound secured by Klay Haliburton.

[00:43] Team_060 possession (Score: 41-51)
Jarrett Wagner attempts a 3Pt. Contested by Magic Dosunmu (3.4 feet, MAN). Jarrett Wagner misses. Rebound secured by Jalen Hyland.

[00:30] Team_038 possession (Score: 41-51)
Magic Dosunmu makes the Layup and draws the foul on Domantas Barnes! And-1! Magic Dosunmu to the line for 1. [BONUS: 8 team fouls] (Domantas Barnes: 1 personal fouls)   FT 1/1: GOOD Magic Dosunmu makes 1/1 from the line.
Score: 44-51

[00:15] Team_060 possession (Score: 44-51)
Domantas Barnes attempts a 3Pt. Contested by Jalen Hyland (4.5 feet, ZONE). Domantas Barnes misses. Rebound secured by Jabari Carter.

[00:02] Team_038 possession (Score: 44-51)
Ja Smith attempts a Layup. Contested by Klay Haliburton (5.4 feet, ZONE). Ja Smith misses. Rebound secured by Rudy Ginobili.

================================================================================
                              2ND QUARTER COMPLETE                              
================================================================================

2ND QUARTER SCORE: Team_038 27, Team_060 22

BOX SCORE:
================================================================================

Team_038
--------------------------------------------------------------------------------
Player                MIN  PTS  REB  AST  TO      FG   FG%      3P   3P%
--------------------------------------------------------------------------------
Jaren Jokic             9    5    0    1   0   2/4    50.0     0/0   0.0
Magic Dosunmu           9    5    0    1   0   2/4    50.0     0/0   0.0
Ja Smith                9    5    0    0   0   3/4    75.0     0/0   0.0
Rudy Thompson          15    2    0    0   0   1/2    50.0     0/0   0.0
DeMar Harris           15    2    2    0   0   1/1   100.0     0/0   0.0
Tracy LaVine           15    2    0    1   0   1/1   100.0     0/0   0.0
Jalen Hyland            9    2    4    0   0   1/3    33.3     0/0   0.0
Jabari Carter           9    2    7    1   0   1/2    50.0     0/0   0.0
Malcolm Poole          15    0    0    1   0   0/0     0.0     0/0   0.0

TEAM: FG: 12/21 (57.1%), 3PT: 1/4 (25.0%), REB: 11 (1 off, 10 def), AST: 5, TO: 3
TEAM FOULS: 6 [Team_060 in BONUS]


Team_060
--------------------------------------------------------------------------------
Player                MIN  PTS  REB  AST  TO      FG   FG%      3P   3P%
--------------------------------------------------------------------------------
Jarrett Wagner          9   12    0    0   0   5/6    83.3     0/0   0.0
Klay Haliburton         9    4    3    1   0   2/2   100.0     0/0   0.0
Rudy Ginobili           9    3    4    1   0   1/4    25.0     0/0   0.0
Immanuel Ming          15    2    1    0   0   1/2    50.0     0/0   0.0
Julius Green           15    1    0    0   0   1/2    50.0     0/0   0.0
Larry Westbrook        15    0    1    1   0   0/0     0.0     0/0   0.0
Yao Tatum               9    0    0    0   0   0/2     0.0     0/0   0.0
Domantas Barnes         9    0    1    0   0   0/3     0.0     0/0   0.0

TEAM: FG: 10/21 (47.6%), 3PT: 1/10 (10.0%), REB: 12 (3 off, 9 def), AST: 3, TO: 2
TEAM FOULS: 8 [Team_038 in BONUS]

================================================================================

================================================================================
                       3RD QUARTER - Team_038 vs Team_060                       
================================================================================

[12:00] Team_038 possession (Score: 44-51)
Rudy Thompson attempts a 3Pt. Contested by Julius Green (4.4 feet, ZONE). Rudy Thompson misses. Rebound secured by Jaren George.

[11:43] Team_060 possession (Score: 44-51)
Larry Westbrook attempts a 3Pt. Contested by Tracy LaVine (4.3 feet, MAN). LARRY WESTBROOK MAKES IT! Assist: Julius Green
Score: 44-54

[11:24] Team_038 possession (Score: 44-54)
FOUL! Shooting foul on Julius Green. Luka Barnes to the line for 2 free throws. [Team fouls: 1] (Julius Green: 1 personal fouls)   FT 1/2: GOOD   FT 2/2: GOOD Luka Barnes makes 2/2 from the line.
Score: 46-54

[11:09] Team_060 possession (Score: 46-54)
Joel Morant attempts a 3Pt. Contested by Rudy Thompson (3.5 feet, MAN). Joel Morant misses. FOUL! Loose ball foul on DeMar Harris during the rebound battle. [Team fouls: 1] No free throws, side out. (DeMar Harris: 1 personal fouls)

[10:57] Team_060 possession (Score: 46-54)
FOUL! Offensive foul on Joel Morant! Rudy Thompson drew the charge! [Team fouls: 2] (Joel Morant: 1 personal fouls) TURNOVER! (dead ball)

[10:40] Team_038 possession (Score: 46-54)
Rudy Thompson attempts a 3Pt. Contested by Joel Morant (5.9 feet, MAN). Rudy Thompson misses. Rebound secured by Larry Westbrook.

[10:23] Team_060 possession (Score: 46-54)
Larry Westbrook attempts a 3Pt. Contested by Tracy LaVine (4.3 feet, MAN). Larry Westbrook misses. Rebound secured by Luka Barnes.

[10:13] Team_038 possession (Score: 46-54)
Malcolm Poole attempts a 3Pt. Contested by Julius Green (3.7 feet, MAN). Malcolm Poole misses. Rebound secured by Larry Westbrook.

[10:02] Team_060 possession (Score: 46-54)
Julius Green attempts a 3Pt. Contested by Malcolm Poole (4.7 feet, MAN). JULIUS GREEN MAKES IT! Assist: Larry Westbrook
Score: 46-57

[09:49] Team_038 possession (Score: 46-57)
Rudy Thompson attempts a 3Pt. Contested by Joel Morant (5.9 feet, MAN). Rudy Thompson misses. Rebound secured by Immanuel Ming.

[09:36] Team_060 possession (Score: 46-57)
Julius Green makes the Layup and draws the foul on Malcolm Poole! And-1! Julius Green to the line for 1. [Team fouls: 2] (Malcolm Poole: 1 personal fouls)   FT 1/1: GOOD Julius Green makes 1/1 from the line.
Score: 46-60

[09:21] Team_038 possession (Score: 46-60)
DeMar Harris drives and kicks out. Malcolm Poole attempts a Midrange. Contested by Immanuel Ming (3.7 feet, ZONE). Malcolm Poole misses. Rebound secured by Immanuel Ming.

[09:07] Team_060 possession (Score: 46-60)
Immanuel Ming attempts a Midrange. Contested by DeMar Harris (3.1 feet, MAN). Immanuel Ming misses. Rebound secured by DeMar Harris.

[08:55] Team_038 possession (Score: 46-60)
Rudy Thompson attempts a 3Pt. Contested by Julius Green (4.4 feet, ZONE). Rudy Thompson misses. Rebound secured by Jaren George.

[08:39] Team_060 possession (Score: 46-60)
Julius Green attempts a 3Pt. Contested by Malcolm Poole (4.7 feet, MAN). Julius Green misses. Rebound secured by DeMar Harris.

[08:23] Team_038 possession (Score: 46-60)
Rudy Thompson attempts a Midrange. Contested by Joel Morant (5.9 feet, MAN). RUDY THOMPSON MAKES IT!
Score: 48-60

[08:11] Team_060 possession (Score: 48-60)
Julius Green attempts a 3Pt. Contested by DeMar Harris (2.9 feet, ZONE). Julius Green misses. Offensive rebound by Jaren George! Jaren George puts it back in!
Score: 48-62

[07:53] Team_038 possession (Score: 48-62)
Luka Barnes attempts a Midrange. Contested by Jaren George (5.5 feet, MAN). Luka Barnes misses. Rebound secured by Jaren George.

[07:40] Team_060 possession (Score: 48-62)
Immanuel Ming throws a bad pass! Stolen by DeMar Harris! TURNOVER! (live ball)

[07:24] Team_038 possession (Score: 48-62)
Luka Barnes drives, picks up Jaren George. Help arrives from Julius Green! Luka Barnes attempts a Layup. Contested by Julius Green (5.5 feet, MAN). LUKA BARNES MAKES IT!
Score: 50-62

[07:07] Team_060 possession (Score: 50-62)
Jaren George attempts a Layup. Contested by Tracy LaVine (4.0 feet, ZONE). Jaren George misses. Offensive rebound by Jaren George! Jaren George puts it back in!
Score: 50-64

[06:52] Team_038 possession (Score: 50-64)
Tracy LaVine drives, picks up Larry Westbrook. Help arrives from Julius Green! Tracy LaVine attempts a Layup. Contested by Julius Green (4.5 feet, MAN). TRACY LAVINE MAKES IT! Assist: DeMar Harris
Score: 52-64

[06:37] Team_060 possession (Score: 52-64)
Julius Green makes the Layup and draws the foul on Tracy LaVine! And-1! Julius Green to the line for 1. [Team fouls: 3] (Tracy LaVine: 1 personal fouls)   FT 1/1: GOOD Julius Green makes 1/1 from the line.
Score: 52-67

[06:25] Team_038 possession (Score: 52-67)
Luka Barnes attempts a Midrange. Contested by Jaren George (5.5 feet, ZONE). LUKA BARNES MAKES IT! Assist: Rudy Thompson
Score: 54-67

[06:14] Team_060 possession (Score: 54-67)
Julius Green drives and kicks out. Jaren George attempts a 3Pt. Contested by Luka Barnes (4.3 feet, MAN). Jaren George misses. Rebound secured by DeMar Harris.

[05:59] Team_038 possession (Score: 54-67)
DeMar Harris attempts a Midrange. BLOCKED BY IMMANUEL MING! Ball goes out off Immanuel Ming. DeMar Harris's ball!

[05:43] Team_038 possession (Score: 54-67)
Tracy LaVine attempts a Midrange. Contested by Larry Westbrook (4.5 feet, ZONE). Tracy LaVine misses. Rebound secured by Jaren George.

[05:30] Team_060 possession (Score: 54-67)
FOUL! Holding foul on Luka Barnes. [Team fouls: 4] No free throws, side out. (Luka Barnes: 1 personal fouls)

[05:17] Team_060 possession (Score: 54-67)
Larry Westbrook attempts a 3Pt. Contested by DeMar Harris (3.6 feet, ZONE). Larry Westbrook misses. Rebound secured by DeMar Harris.

[05:06] Team_038 possession (Score: 54-67)
Tracy LaVine throws a bad pass out of bounds! TURNOVER! (dead ball)

[04:51] Team_060 possession (Score: 54-67)
Joel Morant drives, picks up Rudy Thompson. Help arrives from DeMar Harris! Joel Morant attempts a Dunk. Contested by DeMar Harris (3.5 feet, MAN). Joel Morant misses. Rebound secured by Tracy LaVine.

[04:36] Team_038 possession (Score: 54-67)
Malcolm Poole attempts a 3Pt. Contested by Julius Green (3.8 feet, MAN). Malcolm Poole misses. Rebound secured by Jaren George.

[04:20] Team_060 possession (Score: 54-67)
Julius Green attempts a Midrange. Contested by Malcolm Poole (4.7 feet, MAN). JULIUS GREEN MAKES IT!
Score: 54-69

[04:08] Team_038 possession (Score: 54-69)
Tracy LaVine drives, Larry Westbrook stays with him. Tracy LaVine attempts a Layup. Contested by Larry Westbrook (4.6 feet, MAN). TRACY LAVINE MAKES IT! Assist: DeMar Harris
Score: 56-69

[03:59] Team_060 possession (Score: 56-69)
Larry Westbrook attempts a Midrange. Contested by Tracy LaVine (4.5 feet, ZONE). Larry Westbrook misses. Rebound secured by Luka Barnes.

[03:47] Team_038 possession (Score: 56-69)
Tracy LaVine attempts a Layup. BLOCKED BY JULIUS GREEN! Ball is loose! Offensive rebound by Luka Barnes! Luka Barnes kicks it out.

[03:37] Team_038 possession (Score: 56-69)
DeMar Harris attempts a 3Pt. Contested by Immanuel Ming (4.5 feet, ZONE). DEMAR HARRIS MAKES IT! Assist: Rudy Thompson
Score: 59-69

[03:23] Team_060 possession (Score: 59-69)
Jaren George attempts a 3Pt. Contested by Malcolm Poole (5.1 feet, ZONE). Jaren George misses. Rebound secured by DeMar Harris.

[03:11] Team_038 possession (Score: 59-69)
Malcolm Poole attempts a 3Pt. Contested by Julius Green (3.9 feet, ZONE). Malcolm Poole misses. Rebound secured by Jaren George.

[02:57] Team_060 possession (Score: 59-69)
Joel Morant attempts a 3Pt. Contested by Rudy Thompson (3.7 feet, MAN). JOEL MORANT MAKES IT! Assist: Jaren George
Score: 59-72

[02:43] Team_038 possession (Score: 59-72)
Rudy Thompson attempts a 3Pt. Contested by Julius Green (4.6 feet, ZONE). RUDY THOMPSON MAKES IT!
Score: 62-72

[02:30] Team_060 possession (Score: 62-72)
Joel Morant attempts a Midrange. Contested by DeMar Harris (3.1 feet, ZONE). Joel Morant misses. Rebound secured by Tracy LaVine.

[02:17] Team_038 possession (Score: 62-72)
FOUL! Holding foul on Joel Morant. [Team fouls: 3] No free throws, side out. (Joel Morant: 2 personal fouls)

[02:03] Team_038 possession (Score: 62-72)
Rudy Thompson attempts a 3Pt. Contested by Julius Green (4.7 feet, ZONE). Rudy Thompson misses. Rebound secured by Larry Westbrook.

[01:50] Team_060 possession (Score: 62-72)
Jaren George drives, Luka Barnes stays with him. Jaren George attempts a Dunk. Contested by Luka Barnes (4.7 feet, MAN). JAREN GEORGE MAKES IT! Assist: Larry Westbrook
Score: 62-74

[01:39] Team_038 possession (Score: 62-74)
Malcolm Poole attempts a Midrange. Contested by Julius Green (4.1 feet, MAN). Malcolm Poole misses. FOUL! Loose ball foul on Larry Westbrook during the rebound battle. [Team fouls: 4] No free throws, side out. (Larry Westbrook: 1 personal fouls)

[01:23] Team_038 possession (Score: 62-74)
Tracy LaVine attempts a 3Pt. Contested by Larry Westbrook (5.0 feet, MAN). Tracy LaVine misses. Rebound secured by Jaren George.

[01:08] Team_060 possession (Score: 62-74)
Joel Morant attempts a 3Pt. Contested by Rudy Thompson (4.0 feet, MAN). Joel Morant misses. Rebound secured by Luka Barnes.

[00:49] Team_038 possession (Score: 62-74)
DeMar Harris attempts a Midrange. Contested by Immanuel Ming (4.7 feet, MAN). DEMAR HARRIS MAKES IT!
Score: 64-74

[00:36] Team_060 possession (Score: 64-74)
Larry Westbrook attempts a 3Pt. Contested by Tracy LaVine (4.8 feet, MAN). LARRY WESTBROOK MAKES IT! Assist: Joel Morant
Score: 64-77

[00:22] Team_038 possession (Score: 64-77)
DeMar Harris drives, Jaren George stays with him. DeMar Harris attempts a Dunk. Wide open! Jaren George is 6.5 feet away. [ZONE] DeMar Harris misses. FOUL! Loose ball foul on Jaren George during the rebound battle. [IN THE BONUS! 5 team fouls] Tracy LaVine to the line for 2 free throws. (Jaren George: 1 personal fouls)   FT 1/2: GOOD   FT 2/2: GOOD Tracy LaVine makes 2/2 from the line.
Score: 66-77

[00:10] Team_060 possession (Score: 66-77)
Joel Morant attempts a Midrange. Contested by DeMar Harris (3.4 feet, ZONE). JOEL MORANT MAKES IT!
Score: 66-79

================================================================================
                              3RD QUARTER COMPLETE                              
================================================================================

3RD QUARTER SCORE: Team_038 22, Team_060 28

BOX SCORE:
================================================================================

Team_038
--------------------------------------------------------------------------------
Player                MIN  PTS  REB  AST  TO      FG   FG%      3P   3P%
--------------------------------------------------------------------------------
Luka Barnes            27    6    5    0   0   3/4    75.0     0/0   0.0
Tracy LaVine           27    6    2    0   0   3/5    60.0     0/0   0.0
Rudy Thompson          27    5    0    2   0   2/7    28.6     0/0   0.0
DeMar Harris           27    5    5    2   0   2/3    66.7     0/0   0.0
Malcolm Poole          27    0    0    0   0   0/3     0.0     0/0   0.0

TEAM: FG: 10/22 (45.5%), 3PT: 2/11 (18.2%), REB: 12 (2 off, 10 def), AST: 4, TO: 1
TEAM FOULS: 4


Team_060
--------------------------------------------------------------------------------
Player                MIN  PTS  REB  AST  TO      FG   FG%      3P   3P%
--------------------------------------------------------------------------------
Julius Green           27   11    0    1   0   4/6    66.7     0/0   0.0
Jaren George           27    6   10    1   0   3/4    75.0     0/0   0.0
Larry Westbrook        27    6    3    2   0   2/5    40.0     0/0   0.0
Joel Morant            27    5    0    1   0   2/5    40.0     0/0   0.0
Immanuel Ming          27    0    2    0   0   0/1     0.0     0/0   0.0

TEAM: FG: 11/21 (52.4%), 3PT: 5/10 (50.0%), REB: 15 (3 off, 12 def), AST: 5, TO: 2
TEAM FOULS: 5 [Team_038 in BONUS]

================================================================================

================================================================================
                       4TH QUARTER - Team_038 vs Team_060                       
================================================================================

[12:00] Substitution (Team_038): Rudy Thompson OUT (stamina: 68) → Jalen Hyland IN (comeback_detected)

[12:00] Substitution (Team_060): Joel Morant OUT (stamina: 65) → Domantas Barnes IN (comeback_detected)

[12:00] Team_038 possession (Score: 66-79)
FOUL! Holding foul on Domantas Barnes. [Team fouls: 1] No free throws, side out. (Domantas Barnes: 1 personal fouls)

[11:46] Team_038 possession (Score: 66-79)
Jalen Hyland attempts a Layup. Contested by Jaren George (5.8 feet, ZONE). JALEN HYLAND MAKES IT!
Score: 68-79

[11:34] Team_060 possession (Score: 68-79)
Jaren George attempts a Midrange. Contested by DeMar Harris (3.7 feet, ZONE). Jaren George misses. Rebound secured by Luka Barnes.

[11:22] Team_038 possession (Score: 68-79)
Jalen Hyland attempts a Midrange. Contested by Domantas Barnes (4.7 feet, MAN). Jalen Hyland misses. Rebound secured by Immanuel Ming.

[11:13] Team_060 possession (Score: 68-79)
Julius Green attempts a 3Pt. Contested by Jalen Hyland (4.1 feet, ZONE). JULIUS GREEN MAKES IT! Assist: Larry Westbrook
Score: 68-82

[11:02] Team_038 possession (Score: 68-82)
FOUL! Holding foul on Julius Green. [Team fouls: 2] No free throws, side out. (Julius Green: 1 personal fouls)

[10:43] Team_038 possession (Score: 68-82)
Luka Barnes attempts a 3Pt. Contested by Domantas Barnes (4.8 feet, ZONE). Luka Barnes misses. Rebound secured by Jaren George.

[10:30] Team_060 possession (Score: 68-82)
Immanuel Ming throws a bad pass! Stolen by DeMar Harris! TURNOVER! (live ball)

[10:19] Team_038 possession (Score: 68-82)
Tracy LaVine attempts a 3Pt. Contested by Larry Westbrook (5.1 feet, MAN). Tracy LaVine misses. Rebound secured by Jaren George.

[10:04] Team_060 possession (Score: 68-82)
Jaren George attempts a Layup. Contested by Tracy LaVine (4.6 feet, ZONE). JAREN GEORGE MAKES IT! Assist: Larry Westbrook
Score: 68-84

[09:47] Team_038 possession (Score: 68-84)
Jalen Hyland drives to the basket... Jalen Hyland throws a bad pass out of bounds! TURNOVER! (dead ball)

[09:47] Substitution (Team_038): Malcolm Poole OUT → Jaren Jokic IN (stamina_rule2)

[09:47] Substitution (Team_038): DeMar Harris OUT → Magic Dosunmu IN (stamina_rule2)

[09:47] Substitution (Team_038): Tracy LaVine OUT → Jabari Carter IN (stamina_rule2)

[09:47] Substitution (Team_038): Luka Barnes OUT → Ja Smith IN (stamina_rule2)

[09:47] Substitution (Team_060): Julius Green OUT → Rudy Ginobili IN (stamina_rule2)

[09:47] Substitution (Team_060): Immanuel Ming OUT → Jarrett Wagner IN (stamina_rule2)

[09:47] Substitution (Team_060): Larry Westbrook OUT → Yao Tatum IN (stamina_rule2)

[09:47] Substitution (Team_060): Jaren George OUT → Klay Haliburton IN (stamina_rule2)

[09:32] Team_060 possession (Score: 68-84)
Jarrett Wagner attempts a Layup. Contested by Magic Dosunmu (3.3 feet, MAN). JARRETT WAGNER MAKES IT!
Score: 68-86

[09:13] Team_038 possession (Score: 68-86)
Ja Smith attempts a Dunk. BLOCKED BY KLAY HALIBURTON! Ball goes out off Klay Haliburton. Ja Smith's ball!

[08:58] Team_038 possession (Score: 68-86)
Ja Smith attempts a Midrange. Contested by Klay Haliburton (5.3 feet, MAN). Ja Smith misses. Offensive rebound by Jabari Carter! Jabari Carter puts it back in!
Score: 70-86

[08:48] Team_060 possession (Score: 70-86)
Klay Haliburton drives, Ja Smith stays with him. Klay Haliburton attempts a Layup. Contested by Ja Smith (3.6 feet, MAN). Klay Haliburton misses. Rebound secured by Ja Smith.

[08:35] Team_038 possession (Score: 70-86)
Jabari Carter attempts a Layup. Contested by Yao Tatum (5.8 feet, MAN). JABARI CARTER MAKES IT! Assist: Ja Smith
Score: 72-86

[08:20] Team_060 possession (Score: 72-86)
Yao Tatum throws a bad pass out of bounds! TURNOVER! (dead ball)

[08:07] Team_038 possession (Score: 72-86)
Jalen Hyland attempts a 3Pt. Contested by Domantas Barnes (4.7 feet, MAN). Jalen Hyland misses. Rebound secured by Klay Haliburton.

[07:48] Team_060 possession (Score: 72-86)
Domantas Barnes attempts a 3Pt. Contested by Jalen Hyland (4.3 feet, ZONE). Domantas Barnes misses. Offensive rebound by Klay Haliburton! Klay Haliburton's putback is no good. Rebound secured by Jabari Carter.

[07:33] Team_038 possession (Score: 72-86)
Jaren Jokic attempts a Layup. Contested by Klay Haliburton (3.9 feet, ZONE). Jaren Jokic misses. Offensive rebound by Jabari Carter! Jabari Carter puts it back in!
Score: 74-86

[07:15] Team_060 possession (Score: 74-86)
Domantas Barnes attempts a 3Pt. Contested by Magic Dosunmu (3.1 feet, ZONE). Domantas Barnes misses. Offensive rebound by Klay Haliburton! Klay Haliburton puts it back in!
Score: 74-88

[06:58] Team_038 possession (Score: 74-88)
Magic Dosunmu drives, Klay Haliburton stays with him. Magic Dosunmu attempts a Dunk. Contested by Klay Haliburton (4.5 feet, ZONE). MAGIC DOSUNMU MAKES IT!
Score: 76-88

[06:47] Team_060 possession (Score: 76-88)
Domantas Barnes attempts a Midrange. Contested by Jalen Hyland (4.3 feet, MAN). DOMANTAS BARNES MAKES IT!
Score: 76-90

[06:32] Team_038 possession (Score: 76-90)
Jaren Jokic attempts a 3Pt. Contested by Domantas Barnes (4.3 feet, ZONE). Jaren Jokic misses. Offensive rebound by Jabari Carter! Jabari Carter puts it back in!
Score: 78-90

[06:19] Team_060 possession (Score: 78-90)
Yao Tatum attempts a 3Pt. Contested by Jalen Hyland (4.3 feet, ZONE). Yao Tatum misses. Rebound secured by Ja Smith.

[06:06] Team_038 possession (Score: 78-90)
Magic Dosunmu attempts a 3Pt. Contested by Jarrett Wagner (5.1 feet, MAN). Magic Dosunmu misses. Rebound secured by Klay Haliburton.

[05:52] Team_060 possession (Score: 78-90)
Rudy Ginobili attempts a Midrange. Contested by Jaren Jokic (5.4 feet, MAN). Rudy Ginobili misses. Offensive rebound by Domantas Barnes! Domantas Barnes kicks it out.

[05:36] Team_060 possession (Score: 78-90)
Rudy Ginobili attempts a Midrange. Contested by Jaren Jokic (5.4 feet, ZONE). Rudy Ginobili misses. Rebound secured by Ja Smith.

[05:22] Team_038 possession (Score: 78-90)
Ja Smith drives, Klay Haliburton stays with him. Ja Smith attempts a Dunk. Contested by Klay Haliburton (5.3 feet, MAN). Ja Smith misses. Rebound secured by Domantas Barnes.

[05:05] Team_060 possession (Score: 78-90)
Jarrett Wagner attempts a Layup. Contested by Magic Dosunmu (3.3 feet, MAN). Jarrett Wagner misses. Rebound secured by Jalen Hyland.

[04:50] Team_038 possession (Score: 78-90)
Ja Smith drives to the basket... Ja Smith loses the ball! Stripped by Yao Tatum! TURNOVER! (live ball)

[04:36] Team_060 possession (Score: 78-90)
Yao Tatum attempts a Layup. Contested by Ja Smith (3.3 feet, ZONE). YAO TATUM MAKES IT! Assist: Klay Haliburton
Score: 78-92

[04:25] Team_038 possession (Score: 78-92)
Jabari Carter attempts a 3Pt. Contested by Yao Tatum (5.8 feet, MAN). Jabari Carter misses. Rebound secured by Rudy Ginobili.

[04:12] Team_060 possession (Score: 78-92)
Jarrett Wagner attempts a 3Pt. Contested by Jalen Hyland (4.6 feet, ZONE). Jarrett Wagner misses. Rebound secured by Jalen Hyland.

[03:57] Team_038 possession (Score: 78-92)
Jaren Jokic drives to the basket... Jaren Jokic throws a bad pass! Stolen by Rudy Ginobili! TURNOVER! (live ball)

[03:44] Team_060 possession (Score: 78-92)
Rudy Ginobili drives and kicks out. Rudy Ginobili attempts a 3Pt. Contested by Jaren Jokic (5.1 feet, MAN). Rudy Ginobili misses. Offensive rebound by Klay Haliburton! Klay Haliburton's putback is no good. Rebound secured by Ja Smith.

[03:29] Team_038 possession (Score: 78-92)
Jabari Carter throws a bad pass out of bounds! TURNOVER! (dead ball)

[03:10] Team_060 possession (Score: 78-92)
Yao Tatum attempts a 3Pt. Contested by Jabari Carter (4.1 feet, MAN). Yao Tatum misses. Rebound secured by Magic Dosunmu.

[02:55] Team_038 possession (Score: 78-92)
Jalen Hyland attempts a 3Pt. Contested by Domantas Barnes (4.9 feet, MAN). Jalen Hyland misses. Rebound secured by Klay Haliburton.

[02:41] Team_060 possession (Score: 78-92)
Klay Haliburton attempts a Midrange. Contested by Jabari Carter (4.4 feet, ZONE). Klay Haliburton misses. Rebound secured by Ja Smith.

[02:31] Team_038 possession (Score: 78-92)
Jalen Hyland attempts a 3Pt. Contested by Jarrett Wagner (5.0 feet, ZONE). JALEN HYLAND MAKES IT! Assist: Jabari Carter
Score: 81-92

[02:19] Team_060 possession (Score: 81-92)
Domantas Barnes drives to the basket... Domantas Barnes loses control! Ball rolls out of bounds! TURNOVER! (dead ball)

[02:06] Team_038 possession (Score: 81-92)
Jalen Hyland drives to the basket... Jalen Hyland loses control! Ball rolls out of bounds! TURNOVER! (dead ball)

[01:49] Team_060 possession (Score: 81-92)
Domantas Barnes drives and kicks out. Rudy Ginobili attempts a Midrange. Contested by Jaren Jokic (5.2 feet, MAN). RUDY GINOBILI MAKES IT!
Score: 81-94

[01:38] Team_038 possession (Score: 81-94)
Ja Smith drives to the basket... Ja Smith loses the ball! Stripped by Klay Haliburton! TURNOVER! (live ball)

[01:24] Team_060 possession (Score: 81-94)
Domantas Barnes attempts a 3Pt. Contested by Jaren Jokic (5.1 feet, ZONE). Domantas Barnes misses. Rebound secured by Jabari Carter.

[01:11] Team_038 possession (Score: 81-94)
Jaren Jokic makes the 3Pt and draws the foul on Domantas Barnes! And-1! Jaren Jokic to the line for 1. [Team fouls: 3] (Domantas Barnes: 2 personal fouls)   FT 1/1: GOOD Jaren Jokic makes 1/1 from the line.
Score: 85-94

[00:54] Team_060 possession (Score: 85-94)
Yao Tatum attempts a Layup. Contested by Jabari Carter (4.3 feet, ZONE). YAO TATUM MAKES IT! Assist: Jarrett Wagner
Score: 85-96

[00:37] Team_038 possession (Score: 85-96)
Jalen Hyland attempts a 3Pt. Contested by Domantas Barnes (5.1 feet, MAN). Jalen Hyland misses. Rebound secured by Domantas Barnes.

[00:19] Team_060 possession (Score: 85-96)
Domantas Barnes attempts a Midrange. Contested by Jalen Hyland (4.8 feet, MAN). DOMANTAS BARNES MAKES IT! Assist: Klay Haliburton
Score: 85-98

[00:07] Team_038 possession (Score: 85-98)
Jabari Carter attempts a Midrange. Contested by Yao Tatum (6.0 feet, MAN). Jabari Carter misses. Rebound secured by Domantas Barnes.

================================================================================
                              4TH QUARTER COMPLETE                              
================================================================================

4TH QUARTER SCORE: Team_038 19, Team_060 19

BOX SCORE:
================================================================================

Team_038
--------------------------------------------------------------------------------
Player                MIN  PTS  REB  AST  TO      FG   FG%      3P   3P%
--------------------------------------------------------------------------------
Jabari Carter          19    8    5    1   0   4/6    66.7     0/0   0.0
Jalen Hyland           22    5    2    0   0   2/6    33.3     0/0   0.0
Jaren Jokic            19    4    0    0   0   1/1   100.0     0/0   0.0
Magic Dosunmu          19    2    1    0   0   1/2    50.0     0/0   0.0
Luka Barnes            29    0    1    0   0   0/1     0.0     0/0   0.0
Tracy LaVine           29    0    0    0   0   0/1     0.0     0/0   0.0
Ja Smith               19    0    5    1   0   0/1     0.0     0/0   0.0

TEAM: FG: 8/18 (44.4%), 3PT: 3/10 (30.0%), REB: 12 (3 off, 9 def), AST: 2, TO: 6
TEAM FOULS: 0


Team_060
--------------------------------------------------------------------------------
Player                MIN  PTS  REB  AST  TO      FG   FG%      3P   3P%
--------------------------------------------------------------------------------
Domantas Barnes        22    4    4    0   0   2/4    50.0     0/0   0.0
Yao Tatum              19    4    0    0   0   2/4    50.0     0/0   0.0
Julius Green           29    3    0    0   0   1/1   100.0     0/0   0.0
Jaren George           29    2    2    0   0   1/2    50.0     0/0   0.0
Jarrett Wagner         19    2    0    1   0   1/3    33.3     0/0   0.0
Klay Haliburton        19    2    4    2   0   1/3    33.3     0/0   0.0
Rudy Ginobili          19    2    1    0   0   1/3    33.3     0/0   0.0
Immanuel Ming          29    0    1    0   0   0/0     0.0     0/0   0.0
Larry Westbrook        29    0    0    2   0   0/0     0.0     0/0   0.0

TEAM: FG: 9/20 (45.0%), 3PT: 2/7 (28.6%), REB: 14 (4 off, 10 def), AST: 5, TO: 3
TEAM FOULS: 3

================================================================================

================================================================================
                               FULL GAME COMPLETE                               
================================================================================

FINAL SCORE: Team_038 85, Team_060 98

SCORING BY QUARTER:
--------------------------------------------------------------------------------
Team                     Q1     Q2     Q3     Q4    FINAL
--------------------------------------------------------------------------------
Team_038                 17     27     22     19       85
Team_060                 29     22     28     19       98
--------------------------------------------------------------------------------

FULL GAME BOX SCORE:
================================================================================

Team_038
--------------------------------------------------------------------------------
Player                MIN  PTS  REB  AST  TO      FG   FG%      3P   3P%      FT STL BLK
--------------------------------------------------------------------------------
Malcolm Poole          29    0    0    1   0   0/6     0.0   0/5     0.0   0/0     0   0
DeMar Harris           29   14    9    2   1   6/10   60.0   1/4    25.0   1/4     2   0
Tracy LaVine           29    8    9    1   5   4/7    57.1   0/2     0.0   2/2     0   0
Luka Barnes            29   13    9    1   2   5/9    55.6   0/1     0.0   5/5     0   1
Rudy Thompson          27   10    0    2   2   4/12   33.3   2/10   20.0   3/3     0   0
Jalen Hyland           22    7    6    0   0   2/8    25.0   1/4    25.0   0/0     0   0
Jaren Jokic            19    9    0    1   1   5/7    71.4   3/4    75.0   3/3     0   0
Magic Dosunmu          19    7    1    1   2   3/6    50.0   0/2     0.0   1/2     0   0
Jabari Carter          19   10   12    2   3   3/6    50.0   0/1     0.0   0/2     0   0
Ja Smith               19    5    5    1   1   4/6    66.7   0/0     0.0   1/2     0   0

TEAM: FG: 37/78 (47.4%), 3PT: 7/33 (21.2%), REB: 47 (6 off, 41 def), AST: 12, TO: 17


Team_060
--------------------------------------------------------------------------------
Player                MIN  PTS  REB  AST  TO      FG   FG%      3P   3P%      FT STL BLK
--------------------------------------------------------------------------------
Julius Green           29   17    0    3   0   7/11   63.6   3/5    60.0   3/4     1   1
Immanuel Ming          29   13    9    1   2   5/9    55.6   1/2    50.0   5/6     0   1
Larry Westbrook        29   12    6    7   0   4/8    50.0   3/5    60.0   1/1     1   0
Jaren George           29   11   16    1   0   5/12   41.7   0/2     0.0   1/2     2   1
Joel Morant            27   11    0    2   1   4/9    44.4   3/6    50.0   0/0     0   0
Domantas Barnes        22    4    5    0   1   4/9    44.4   1/6    16.7   0/0     1   0
Rudy Ginobili          19    5    5    1   1   2/7    28.6   0/2     0.0   1/1     1   0
Jarrett Wagner         19   14    0    1   1   5/8    62.5   1/3    33.3   3/4     0   0
Yao Tatum              19    4    0    0   1   2/6    33.3   0/3     0.0   0/0     1   0
Klay Haliburton        19    6    7    3   0   2/4    50.0   0/0     0.0   0/0     2   1

TEAM: FG: 41/85 (48.2%), 3PT: 12/34 (35.3%), REB: 52 (11 off, 41 def), AST: 19, TO: 7

================================================================================
