================================================================================
                        FULL GAME - Team_082 vs Team_085                        
================================================================================

================================================================================
                       1ST QUARTER - Team_082 vs Team_085                       
================================================================================

[12:00] Team_082 possession (Score: 0-0)
Julius Anthony attempts a Midrange. Contested by Magic Beal (4.4 feet, MAN). JULIUS ANTHONY MAKES IT!
Score: 2-0

[11:42] Team_085 possession (Score: 2-0)
Stephen Bird drives and kicks out. Larry Duncan makes the Midrange and draws the foul on Kristaps Fox! And-1! Larry Duncan to the line for 1. [Team fouls: 1] (Kristaps Fox: 1 personal fouls)   FT 1/1: MISS Larry Duncan makes 0/1 from the line. Offensive rebound by Paul Wagner! Paul Wagner kicks it out.
Score: 2-2

[11:28] Team_085 possession (Score: 2-2)
Paul Wagner drives to the basket... Paul Wagner loses control! Ball rolls out of bounds! TURNOVER! (dead ball)

[11:16] Team_082 possession (Score: 2-2)
Julius Carter drives and kicks out. Julius Carter attempts a 3Pt. Contested by Collin Mobley (3.9 feet, MAN). Julius Carter misses. Rebound secured by Larry Duncan.

[11:01] Team_085 possession (Score: 2-2)
Stephen Bird attempts a Layup. Contested by Dwyane O'Neal (3.5 feet, MAN). Stephen Bird misses. Rebound secured by Dwyane O'Neal.

[10:51] Team_082 possession (Score: 2-2)
Jrue Green attempts a Midrange. Contested by Paul Wagner (3.8 feet, MAN). Jrue Green misses. Rebound secured by Larry Duncan.

[10:36] Team_085 possession (Score: 2-2)
Collin Mobley attempts a 3Pt. Contested by Dwyane O'Neal (3.2 feet, ZONE). Collin Mobley misses. Rebound secured by Julius Carter.

[10:22] Team_082 possession (Score: 2-2)
Julius Anthony throws a bad pass! Stolen by Magic Beal! TURNOVER! (live ball)

[10:08] Team_085 possession (Score: 2-2)
Larry Duncan drives and kicks out. Magic Beal attempts a 3Pt. Contested by Julius Anthony (4.5 feet, MAN). Magic Beal misses. Rebound secured by Julius Carter.

[09:53] Team_082 possession (Score: 2-2)
Dwyane O'Neal attempts a Midrange. Contested by Stephen Bird (3.4 feet, MAN). Dwyane O'Neal misses. Rebound secured by Larry Duncan.

[09:37] Team_085 possession (Score: 2-2)
Larry Duncan drives, Kristaps Fox stays with him. Larry Duncan attempts a Layup. Contested by Kristaps Fox (4.6 feet, MAN). Larry Duncan misses. Rebound secured by Julius Carter.

[09:25] Team_082 possession (Score: 2-2)
Jrue Green attempts a Layup. Contested by Paul Wagner (3.8 feet, MAN). JRUE GREEN MAKES IT! Assist: Julius Anthony
Score: 4-2

[09:09] Team_085 possession (Score: 4-2)
Stephen Bird drives to the basket... FOUL! Offensive foul on Stephen Bird! Jrue Green drew the charge! [Team fouls: 1] (Stephen Bird: 1 personal fouls) TURNOVER! (dead ball)

[08:57] Team_082 possession (Score: 4-2)
Julius Carter drives, Paul Wagner stays with him. Julius Carter attempts a Dunk. Contested by Paul Wagner (3.9 feet, ZONE). JULIUS CARTER MAKES IT! Assist: Dwyane O'Neal
Score: 6-2

[08:40] Team_085 possession (Score: 6-2)
Stephen Bird attempts a 3Pt. Contested by Dwyane O'Neal (3.5 feet, MAN). Stephen Bird misses. Offensive rebound by Paul Wagner! Paul Wagner kicks it out.

[08:28] Team_085 possession (Score: 6-2)
Larry Duncan drives, Jrue Green stays with him. Larry Duncan attempts a Dunk. Contested by Jrue Green (5.4 feet, ZONE). LARRY DUNCAN MAKES IT! Assist: Stephen Bird
Score: 6-4

[08:17] Team_082 possession (Score: 6-4)
FOUL! Reach-in foul on Paul Wagner during the drive. [Team fouls: 2] No free throws, side out. (Paul Wagner: 1 personal fouls)

[08:06] Team_082 possession (Score: 6-4)
Julius Anthony makes the Dunk and draws the foul on Collin Mobley! And-1! Julius Anthony to the line for 1. [Team fouls: 3] (Collin Mobley: 1 personal fouls)   FT 1/1: GOOD Julius Anthony makes 1/1 from the line.
Score: 9-4

[07:56] Team_085 possession (Score: 9-4)
Collin Mobley drives to the basket... Collin Mobley throws a bad pass out of bounds! TURNOVER! (dead ball)

[07:41] Team_082 possession (Score: 9-4)
Julius Anthony attempts a Layup. BLOCKED BY PAUL WAGNER! Ball is loose! Rebound secured by Larry Duncan.

[07:31] Team_085 possession (Score: 9-4)
Paul Wagner commits a violation (traveling/carry)! TURNOVER! (dead ball)

[07:13] Team_082 possession (Score: 9-4)
Dwyane O'Neal attempts a 3Pt. Contested by Stephen Bird (3.4 feet, MAN). Dwyane O'Neal misses. Offensive rebound by Jrue Green! Jrue Green kicks it out.

[06:56] Team_082 possession (Score: 9-4)
Julius Anthony attempts a 3Pt. Contested by Magic Beal (4.4 feet, MAN). Julius Anthony misses. Rebound secured by Collin Mobley.

[06:39] Team_085 possession (Score: 9-4)
FOUL! Shooting foul on Jrue Green. Collin Mobley to the line for 2 free throws. [Team fouls: 2] (Jrue Green: 1 personal fouls)   FT 1/2: MISS   FT 2/2: MISS Collin Mobley makes 0/2 from the line. Rebound secured by Julius Carter.

[06:22] Team_082 possession (Score: 9-4)
FOUL! Reach-in foul on Paul Wagner during the drive. [Team fouls: 4] No free throws, side out. (Paul Wagner: 2 personal fouls)

[06:04] Team_082 possession (Score: 9-4)
FOUL! Shooting foul on Magic Beal. Julius Anthony to the line for 2 free throws. [BONUS: 5 team fouls] (Magic Beal: 1 personal fouls)   FT 1/2: GOOD   FT 2/2: GOOD Julius Anthony makes 2/2 from the line.
Score: 11-4

[05:53] Team_085 possession (Score: 11-4)
Collin Mobley drives, Julius Carter stays with him. Collin Mobley attempts a Dunk. Contested by Julius Carter (5.7 feet, MAN). COLLIN MOBLEY MAKES IT!
Score: 11-6

[05:38] Team_082 possession (Score: 11-6)
FOUL! Offensive foul on Dwyane O'Neal! Stephen Bird drew the charge! [Team fouls: 3] (Dwyane O'Neal: 1 personal fouls) TURNOVER! (dead ball)

[05:26] Team_085 possession (Score: 11-6)
Paul Wagner attempts a Midrange. Contested by Jrue Green (5.4 feet, MAN). Paul Wagner misses. Rebound secured by Julius Carter.

[05:08] Team_082 possession (Score: 11-6)
FOUL! Reach-in foul on Paul Wagner during the drive. [IN THE BONUS! 6 team fouls] Kristaps Fox to the line for 2 free throws. (Paul Wagner: 3 personal fouls)   FT 1/2: GOOD   FT 2/2: GOOD Kristaps Fox makes 2/2 from the line.
Score: 13-6

[04:53] Team_085 possession (Score: 13-6)
Larry Duncan attempts a 3Pt. Contested by Jrue Green (5.5 feet, ZONE). Larry Duncan misses. Rebound secured by Dwyane O'Neal.

[04:34] Team_082 possession (Score: 13-6)
Kristaps Fox attempts a Layup. Contested by Larry Duncan (3.2 feet, MAN). KRISTAPS FOX MAKES IT! Assist: Julius Anthony
Score: 15-6

[04:16] Team_085 possession (Score: 15-6)
Stephen Bird drives, Jrue Green stays with him. Stephen Bird attempts a Layup. Contested by Jrue Green (5.4 feet, ZONE). Stephen Bird misses. Rebound secured by Julius Carter.

[04:00] Team_082 possession (Score: 15-6)
Dwyane O'Neal throws a bad pass! Stolen by Stephen Bird! TURNOVER! (live ball)

[03:43] Team_085 possession (Score: 15-6)
Paul Wagner drives and kicks out. Collin Mobley attempts a 3Pt. Contested by Dwyane O'Neal (3.4 feet, ZONE). Collin Mobley misses. Offensive rebound by Paul Wagner! Paul Wagner kicks it out.

[03:23] Team_085 possession (Score: 15-6)
FOUL! Reach-in foul on Jrue Green during the drive. [Team fouls: 4] No free throws, side out. (Jrue Green: 2 personal fouls)

[03:12] Team_085 possession (Score: 15-6)
Larry Duncan drives to the basket... FOUL! Offensive foul on Larry Duncan! Kristaps Fox drew the charge! [Team fouls: 7] (Larry Duncan: 1 personal fouls) TURNOVER! (dead ball)

[02:55] Team_082 possession (Score: 15-6)
FOUL! Holding foul on Magic Beal. [IN THE BONUS! 8 team fouls] Julius Anthony to the line for 2 free throws. (Magic Beal: 2 personal fouls)   FT 1/2: GOOD   FT 2/2: GOOD Julius Anthony makes 2/2 from the line.
Score: 17-6

[02:45] Team_085 possession (Score: 17-6)
Larry Duncan attempts a Layup. Contested by Kristaps Fox (4.8 feet, MAN). LARRY DUNCAN MAKES IT!
Score: 17-8

[02:29] Team_082 possession (Score: 17-8)
Julius Anthony attempts a 3Pt. Contested by Magic Beal (4.6 feet, ZONE). Julius Anthony misses. Rebound secured by Collin Mobley.

[02:14] Team_085 possession (Score: 17-8)
Larry Duncan drives and kicks out. Paul Wagner attempts a 3Pt. Contested by Dwyane O'Neal (3.6 feet, ZONE). Paul Wagner misses. Rebound secured by Julius Carter.

[02:00] Team_082 possession (Score: 17-8)
Kristaps Fox drives, Larry Duncan stays with him. Kristaps Fox attempts a Layup. Contested by Larry Duncan (3.4 feet, MAN). KRISTAPS FOX MAKES IT! Assist: Dwyane O'Neal
Score: 19-8

[01:45] Team_085 possession (Score: 19-8)
Stephen Bird drives, picks up Dwyane O'Neal. Help arrives from Kristaps Fox! Stephen Bird attempts a Layup. Contested by Kristaps Fox (3.9 feet, MAN). STEPHEN BIRD MAKES IT!
Score: 19-10

[01:29] Team_082 possession (Score: 19-10)
Julius Anthony attempts a 3Pt. Contested by Magic Beal (4.7 feet, MAN). JULIUS ANTHONY MAKES IT! Assist: Jrue Green
Score: 22-10

[01:17] Team_085 possession (Score: 22-10)
Stephen Bird attempts a 3Pt. Contested by Dwyane O'Neal (3.9 feet, MAN). Stephen Bird misses. Offensive rebound by Paul Wagner! Paul Wagner kicks it out.

[00:59] Team_085 possession (Score: 22-10)
Stephen Bird drives to the basket... Stephen Bird commits a violation (traveling/carry)! TURNOVER! (dead ball)

[00:59] Substitution (Team_082): Julius Anthony OUT → Jordan Rozier IN (stamina_rule2)

[00:59] Substitution (Team_082): Dwyane O'Neal OUT → Kawhi Poole IN (stamina_rule2)

[00:59] Substitution (Team_082): Kristaps Fox OUT → Shaquille Griffin IN (stamina_rule2)

[00:59] Substitution (Team_082): Jrue Green OUT → Tony Jokic IN (stamina_rule2)

[00:59] Substitution (Team_082): Julius Carter OUT → D'Angelo Parker IN (stamina_rule2)

[00:59] Substitution (Team_085): Magic Beal OUT → Khris Brogdon IN (stamina_rule2)

[00:59] Substitution (Team_085): Stephen Bird OUT → Jordan Morant IN (stamina_rule2)

[00:59] Substitution (Team_085): Larry Duncan OUT → Giannis Johnson IN (stamina_rule2)

[00:59] Substitution (Team_085): Paul Wagner OUT → Jalen Leonard IN (stamina_rule2)

[00:59] Substitution (Team_085): Collin Mobley OUT → Malcolm Beal IN (stamina_rule2)

[00:46] Team_082 possession (Score: 22-10)
Shaquille Griffin attempts a 3Pt. Contested by Jordan Morant (3.5 feet, ZONE). Shaquille Griffin misses. Offensive rebound by Shaquille Griffin! Shaquille Griffin kicks it out.

[00:37] Team_082 possession (Score: 22-10)
Jordan Rozier attempts a 3Pt. Contested by Khris Brogdon (5.6 feet, MAN). Jordan Rozier misses. Rebound secured by Malcolm Beal.

[00:27] Team_085 possession (Score: 22-10)
FOUL! Reach-in foul on Tony Jokic during the drive. [IN THE BONUS! 5 team fouls] Jalen Leonard to the line for 2 free throws. (Tony Jokic: 1 personal fouls)   FT 1/2: GOOD   FT 2/2: MISS Jalen Leonard makes 1/2 from the line. Rebound secured by D'Angelo Parker.
Score: 22-11

[00:13] Team_082 possession (Score: 22-11)
Jordan Rozier attempts a Midrange. Contested by Khris Brogdon (5.6 feet, MAN). JORDAN ROZIER MAKES IT! Assist: Tony Jokic
Score: 24-11

================================================================================
                              1ST QUARTER COMPLETE                              
================================================================================

1ST QUARTER SCORE: Team_082 24, Team_085 11

BOX SCORE:
================================================================================

Team_082
--------------------------------------------------------------------------------
Player                MIN  PTS  REB  AST  TO      FG   FG%      3P   3P%
--------------------------------------------------------------------------------
Julius Anthony         11   12    0    2   0   5/8    62.5     0/0   0.0
Kristaps Fox           11    6    0    0   0   3/3   100.0     0/0   0.0
Julius Carter          11    2    7    0   0   1/2    50.0     0/0   0.0
Jrue Green             11    2    1    1   0   1/2    50.0     0/0   0.0
Jordan Rozier           1    2    0    0   0   1/2    50.0     0/0   0.0
Dwyane O'Neal          11    0    2    2   0   0/1     0.0     0/0   0.0
Shaquille Griffin       1    0    1    0   0   0/0     0.0     0/0   0.0
D'Angelo Parker         1    0    1    0   0   0/0     0.0     0/0   0.0
Tony Jokic              1    0    0    1   0   0/0     0.0     0/0   0.0

TEAM: FG: 11/18 (61.1%), 3PT: 1/4 (25.0%), REB: 12 (2 off, 10 def), AST: 6, TO: 3
TEAM FOULS: 5 [Team_085 in BONUS]


Team_085
--------------------------------------------------------------------------------
Player                MIN  PTS  REB  AST  TO      FG   FG%      3P   3P%
--------------------------------------------------------------------------------
Larry Duncan           11    4    4    0   0   2/6    33.3     0/0   0.0
Stephen Bird           11    2    0    1   0   1/3    33.3     0/0   0.0
Collin Mobley          11    2    2    0   0   1/3    33.3     0/0   0.0
Paul Wagner            11    0    4    0   0   0/1     0.0     0/0   0.0
Malcolm Beal            1    0    1    0   0   0/0     0.0     0/0   0.0
Jalen Leonard           1    0    0    0   0   0/1     0.0     0/0   0.0

TEAM: FG: 4/14 (28.6%), 3PT: 0/2 (0.0%), REB: 11 (4 off, 7 def), AST: 1, TO: 6
TEAM FOULS: 8 [Team_082 in BONUS]

================================================================================

================================================================================
                       2ND QUARTER - Team_082 vs Team_085                       
================================================================================

[12:00] Team_082 possession (Score: 24-11)
Julius Carter drives, picks up Collin Mobley. Help arrives from Magic Beal! Julius Carter attempts a Layup. Contested by Magic Beal (4.4 feet, MAN). Julius Carter misses. Rebound secured by Larry Duncan.

[11:47] Team_085 possession (Score: 24-11)
Stephen Bird drives and kicks out. Larry Duncan attempts a 3Pt. Contested by Dwyane O'Neal (3.5 feet, ZONE). Larry Duncan misses. FOUL! Loose ball foul on Dwyane O'Neal during the rebound battle. [Team fouls: 1] No free throws, side out. (Dwyane O'Neal: 1 personal fouls)

[11:35] Team_085 possession (Score: 24-11)
Larry Duncan attempts a 3Pt. Contested by Kristaps Fox (4.8 feet, MAN). LARRY DUNCAN MAKES IT! Assist: Magic Beal
Score: 24-14

[11:23] Team_082 possession (Score: 24-14)
Julius Carter drives and kicks out. Julius Carter attempts a 3Pt. Contested by Magic Beal (4.2 feet, ZONE). Julius Carter misses. Rebound secured by Paul Wagner.

[11:11] Team_085 possession (Score: 24-14)
Collin Mobley attempts a Layup. Contested by Julius Carter (5.9 feet, MAN). COLLIN MOBLEY MAKES IT!
Score: 24-16

[10:57] Team_082 possession (Score: 24-16)
Julius Anthony drives to the basket... Julius Anthony throws a bad pass! Stolen by Paul Wagner! TURNOVER! (live ball)

[10:41] Team_085 possession (Score: 24-16)
Larry Duncan attempts a Midrange. Contested by Kristaps Fox (4.9 feet, MAN). Larry Duncan misses. Rebound secured by Dwyane O'Neal.

[10:26] Team_082 possession (Score: 24-16)
Julius Carter drives and kicks out. Dwyane O'Neal attempts a Midrange. Contested by Paul Wagner (3.8 feet, ZONE). Dwyane O'Neal misses. FOUL! Loose ball foul on Collin Mobley during the rebound battle. [Team fouls: 1] No free throws, side out. (Collin Mobley: 1 personal fouls)

[10:13] Team_082 possession (Score: 24-16)
Kristaps Fox attempts a 3Pt. Contested by Larry Duncan (3.5 feet, MAN). Kristaps Fox misses. Rebound secured by Paul Wagner.

[10:04] Team_085 possession (Score: 24-16)
Paul Wagner drives, picks up Jrue Green. Help arrives from Dwyane O'Neal! Paul Wagner attempts a Layup. Contested by Dwyane O'Neal (5.8 feet, ZONE). Paul Wagner misses. Offensive rebound by Paul Wagner! Paul Wagner kicks it out.

[09:53] Team_085 possession (Score: 24-16)
Collin Mobley attempts a Midrange. Contested by Julius Anthony (4.8 feet, ZONE). Collin Mobley misses. FOUL! Loose ball foul on Jrue Green during the rebound battle. [Team fouls: 2] No free throws, side out. (Jrue Green: 1 personal fouls)

[09:43] Team_085 possession (Score: 24-16)
FOUL! Holding foul on Julius Carter. [Team fouls: 3] No free throws, side out. (Julius Carter: 1 personal fouls)

[09:27] Team_085 possession (Score: 24-16)
Magic Beal attempts a 3Pt. Contested by Julius Anthony (5.3 feet, MAN). MAGIC BEAL MAKES IT! Assist: Larry Duncan
Score: 24-19

[09:11] Team_082 possession (Score: 24-19)
Julius Anthony drives and kicks out. Dwyane O'Neal attempts a 3Pt. Contested by Stephen Bird (4.1 feet, MAN). Dwyane O'Neal misses. Offensive rebound by Jrue Green! Jrue Green kicks it out.

[08:59] Team_082 possession (Score: 24-19)
Kristaps Fox attempts a Layup. Contested by Paul Wagner (4.0 feet, ZONE). KRISTAPS FOX MAKES IT! Assist: Dwyane O'Neal
Score: 26-19

[08:48] Team_085 possession (Score: 26-19)
Collin Mobley attempts a Layup. BLOCKED BY DWYANE O'NEAL! Ball is loose! Rebound secured by Dwyane O'Neal.

[08:33] Team_082 possession (Score: 26-19)
Dwyane O'Neal drives, picks up Stephen Bird. Help arrives from Larry Duncan! Dwyane O'Neal attempts a Layup. Contested by Larry Duncan (4.2 feet, MAN). DWYANE O'NEAL MAKES IT! Assist: Julius Carter
Score: 28-19

[08:17] Team_085 possession (Score: 28-19)
FOUL! Shooting foul on Julius Carter. Collin Mobley to the line for 2 free throws. [Team fouls: 4] (Julius Carter: 2 personal fouls)   FT 1/2: GOOD   FT 2/2: GOOD Collin Mobley makes 2/2 from the line.
Score: 28-21

[08:00] Team_082 possession (Score: 28-21)
Dwyane O'Neal attempts a 3Pt. Contested by Stephen Bird (4.2 feet, MAN). DWYANE O'NEAL MAKES IT! Assist: Julius Anthony
Score: 31-21

[07:47] Team_085 possession (Score: 31-21)
Larry Duncan attempts a 3Pt. Contested by Kristaps Fox (5.2 feet, MAN). LARRY DUNCAN MAKES IT! Assist: Collin Mobley
Score: 31-24

[07:33] Team_082 possession (Score: 31-24)
Kristaps Fox throws a bad pass out of bounds! TURNOVER! (dead ball)

[07:33] Substitution (Team_082): Julius Anthony OUT → Jordan Rozier IN (stamina_rule2)

[07:33] Substitution (Team_082): Dwyane O'Neal OUT → Kawhi Poole IN (stamina_rule2)

[07:33] Substitution (Team_082): Kristaps Fox OUT → Shaquille Griffin IN (stamina_rule2)

[07:33] Substitution (Team_082): Jrue Green OUT → Tony Jokic IN (stamina_rule2)

[07:33] Substitution (Team_082): Julius Carter OUT → D'Angelo Parker IN (stamina_rule2)

[07:33] Substitution (Team_085): Magic Beal OUT → Khris Brogdon IN (stamina_rule2)

[07:33] Substitution (Team_085): Stephen Bird OUT → Jordan Morant IN (stamina_rule2)

[07:33] Substitution (Team_085): Larry Duncan OUT → Giannis Johnson IN (stamina_rule2)

[07:33] Substitution (Team_085): Paul Wagner OUT → Jalen Leonard IN (stamina_rule2)

[07:33] Substitution (Team_085): Collin Mobley OUT → Malcolm Beal IN (stamina_rule2)

[07:19] Team_085 possession (Score: 31-24)
Jordan Morant attempts a Midrange. Contested by Shaquille Griffin (4.8 feet, ZONE). JORDAN MORANT MAKES IT!
Score: 31-26

[07:05] Team_082 possession (Score: 31-26)
Tony Jokic throws a bad pass out of bounds! TURNOVER! (dead ball)

[06:50] Team_085 possession (Score: 31-26)
FOUL! Holding foul on Tony Jokic. [IN THE BONUS! 5 team fouls] Jalen Leonard to the line for 2 free throws. (Tony Jokic: 1 personal fouls)   FT 1/2: MISS   FT 2/2: GOOD Jalen Leonard makes 1/2 from the line.
Score: 31-27

[06:37] Team_082 possession (Score: 31-27)
FOUL! Reach-in foul on Giannis Johnson during the drive. [Team fouls: 2] No free throws, side out. (Giannis Johnson: 1 personal fouls)

[06:21] Team_082 possession (Score: 31-27)
Tony Jokic drives to the basket... Tony Jokic throws a bad pass out of bounds! TURNOVER! (dead ball)

[06:11] Team_085 possession (Score: 31-27)
Jordan Morant attempts a Layup. Contested by D'Angelo Parker (5.2 feet, ZONE). Jordan Morant misses. Rebound secured by D'Angelo Parker.

[05:52] Team_082 possession (Score: 31-27)
Shaquille Griffin drives to the basket... Shaquille Griffin throws a bad pass! Stolen by Giannis Johnson! TURNOVER! (live ball)

[05:40] Team_085 possession (Score: 31-27)
Khris Brogdon attempts a 3Pt. Contested by Kawhi Poole (5.3 feet, ZONE). Khris Brogdon misses. Offensive rebound by Malcolm Beal! Malcolm Beal kicks it out.

[05:31] Team_085 possession (Score: 31-27)
Jalen Leonard attempts a Layup. Contested by Tony Jokic (5.4 feet, MAN). Jalen Leonard misses. Rebound secured by D'Angelo Parker.

[05:15] Team_082 possession (Score: 31-27)
Jordan Rozier attempts a 3Pt. Contested by Khris Brogdon (5.6 feet, MAN). JORDAN ROZIER MAKES IT! Assist: Kawhi Poole
Score: 34-27

[05:02] Team_085 possession (Score: 34-27)
Malcolm Beal attempts a Layup. BLOCKED BY D'ANGELO PARKER! Ball is loose! Rebound secured by D'Angelo Parker.

[04:50] Team_082 possession (Score: 34-27)
Kawhi Poole attempts a 3Pt. Contested by Jordan Morant (4.1 feet, MAN). Kawhi Poole misses. Offensive rebound by Shaquille Griffin! Shaquille Griffin kicks it out.

[04:39] Team_082 possession (Score: 34-27)
Tony Jokic drives and kicks out. Tony Jokic attempts a 3Pt. Contested by Jalen Leonard (4.1 feet, MAN). Tony Jokic misses. Rebound secured by Jalen Leonard.

[04:25] Team_085 possession (Score: 34-27)
Giannis Johnson throws a bad pass! Stolen by Shaquille Griffin! TURNOVER! (live ball)

[04:10] Team_082 possession (Score: 34-27)
Tony Jokic attempts a 3Pt. Contested by Jalen Leonard (3.9 feet, MAN). Tony Jokic misses. Rebound secured by Giannis Johnson.

[03:54] Team_085 possession (Score: 34-27)
FOUL! Shooting foul on D'Angelo Parker. Malcolm Beal to the line for 2 free throws. [BONUS: 6 team fouls] (D'Angelo Parker: 1 personal fouls)   FT 1/2: GOOD   FT 2/2: MISS Malcolm Beal makes 1/2 from the line. Rebound secured by D'Angelo Parker.
Score: 34-28

[03:45] Team_082 possession (Score: 34-28)
Tony Jokic attempts a Midrange. Contested by Giannis Johnson (5.6 feet, ZONE). Tony Jokic misses. Rebound secured by Malcolm Beal.

[03:31] Team_085 possession (Score: 34-28)
Giannis Johnson makes the Layup and draws the foul on Shaquille Griffin! And-1! Giannis Johnson to the line for 1. [BONUS: 7 team fouls] (Shaquille Griffin: 1 personal fouls)   FT 1/1: GOOD Giannis Johnson makes 1/1 from the line.
Score: 34-31

[03:18] Team_082 possession (Score: 34-31)
D'Angelo Parker attempts a 3Pt. Contested by Jordan Morant (3.9 feet, ZONE). D'Angelo Parker misses. Rebound secured by Giannis Johnson.

[03:07] Team_085 possession (Score: 34-31)
Khris Brogdon makes the Dunk and draws the foul on Shaquille Griffin! And-1! Khris Brogdon to the line for 1. [BONUS: 8 team fouls] (Shaquille Griffin: 2 personal fouls)   FT 1/1: MISS Khris Brogdon makes 0/1 from the line. Rebound secured by Shaquille Griffin.
Score: 34-33

[02:50] Team_082 possession (Score: 34-33)
Kawhi Poole attempts a 3Pt. Contested by Jordan Morant (4.1 feet, MAN). Kawhi Poole misses. Rebound secured by Jalen Leonard.

[02:34] Team_085 possession (Score: 34-33)
Jordan Morant makes the Layup and draws the foul on Kawhi Poole! And-1! Jordan Morant to the line for 1. [BONUS: 9 team fouls] (Kawhi Poole: 1 personal fouls)   FT 1/1: GOOD Jordan Morant makes 1/1 from the line.
Score: 34-36

[02:23] Team_082 possession (Score: 34-36)
Jordan Rozier drives, picks up Khris Brogdon. Help arrives from Jordan Morant! Jordan Rozier attempts a Layup. Contested by Jordan Morant (5.6 feet, MAN). Jordan Rozier misses. Rebound secured by Giannis Johnson.

[02:05] Team_085 possession (Score: 34-36)
Giannis Johnson attempts a 3Pt. Contested by Shaquille Griffin (4.6 feet, MAN). GIANNIS JOHNSON MAKES IT! Assist: Jalen Leonard
Score: 34-39

[01:51] Team_082 possession (Score: 34-39)
Tony Jokic drives, Malcolm Beal stays with him. Tony Jokic attempts a Layup. Contested by Malcolm Beal (4.0 feet, ZONE). TONY JOKIC MAKES IT! Assist: Shaquille Griffin
Score: 36-39

[01:37] Team_085 possession (Score: 36-39)
Jalen Leonard attempts a Midrange. Contested by Tony Jokic (5.4 feet, MAN). Jalen Leonard misses. Rebound secured by Tony Jokic.

[01:23] Team_082 possession (Score: 36-39)
Shaquille Griffin attempts a 3Pt. Contested by Giannis Johnson (5.8 feet, MAN). Shaquille Griffin misses. FOUL! Loose ball foul on Malcolm Beal during the rebound battle. [Team fouls: 3] No free throws, side out. (Malcolm Beal: 1 personal fouls)

[01:07] Team_082 possession (Score: 36-39)
D'Angelo Parker drives, Malcolm Beal stays with him. D'Angelo Parker attempts a Layup. Contested by Malcolm Beal (4.8 feet, ZONE). D'ANGELO PARKER MAKES IT!
Score: 38-39

[00:53] Team_085 possession (Score: 38-39)
Malcolm Beal drives to the basket... Malcolm Beal loses the ball! Stripped by D'Angelo Parker! TURNOVER! (live ball)

[00:39] Team_082 possession (Score: 38-39)
Shaquille Griffin attempts a Layup. Contested by Giannis Johnson (5.9 feet, MAN). Shaquille Griffin misses. Offensive rebound by Tony Jokic! Tony Jokic kicks it out.

[00:26] Team_082 possession (Score: 38-39)
D'Angelo Parker attempts a Layup. Contested by Malcolm Beal (4.8 feet, ZONE). D'ANGELO PARKER MAKES IT! Assist: Tony Jokic
Score: 40-39

[00:11] Team_085 possession (Score: 40-39)
Jordan Morant attempts a 3Pt. Contested by Kawhi Poole (5.7 feet, ZONE). Jordan Morant misses. Rebound secured by D'Angelo Parker.

================================================================================
                              2ND QUARTER COMPLETE                              
================================================================================

2ND QUARTER SCORE: Team_082 16, Team_085 28

BOX SCORE:
================================================================================

Team_082
--------------------------------------------------------------------------------
Player                MIN  PTS  REB  AST  TO      FG   FG%      3P   3P%
--------------------------------------------------------------------------------
Dwyane O'Neal          16    5    2    1   0   2/2   100.0     0/0   0.0
D'Angelo Parker         8    4    5    0   0   2/3    66.7     0/0   0.0
Jordan Rozier           8    3    0    0   0   1/2    50.0     0/0   0.0
Kristaps Fox           16    2    0    0   0   1/2    50.0     0/0   0.0
Tony Jokic              8    2    2    1   0   1/4    25.0     0/0   0.0
Julius Carter          16    0    1    1   0   0/2     0.0     0/0   0.0
Jrue Green             16    0    1    0   0   0/0     0.0     0/0   0.0
Julius Anthony         16    0    0    1   0   0/0     0.0     0/0   0.0
Kawhi Poole             8    0    0    1   0   0/1     0.0     0/0   0.0
Shaquille Griffin       8    0    3    1   0   0/0     0.0     0/0   0.0

TEAM: FG: 7/16 (43.8%), 3PT: 2/6 (33.3%), REB: 14 (5 off, 9 def), AST: 6, TO: 5
TEAM FOULS: 9 [Team_085 in BONUS]


Team_085
--------------------------------------------------------------------------------
Player                MIN  PTS  REB  AST  TO      FG   FG%      3P   3P%
--------------------------------------------------------------------------------
Larry Duncan           16    6    2    1   0   2/3    66.7     0/0   0.0
Giannis Johnson         8    6    3    0   0   2/2   100.0     0/0   0.0
Jordan Morant           8    5    0    0   0   2/4    50.0     0/0   0.0
Collin Mobley          16    4    0    1   0   2/3    66.7     0/0   0.0
Magic Beal             16    3    0    1   0   1/1   100.0     0/0   0.0
Jalen Leonard           8    1    2    1   0   1/3    33.3     0/0   0.0
Paul Wagner            16    0    4    0   0   0/0     0.0     0/0   0.0
Malcolm Beal            8    0    2    0   0   0/2     0.0     0/0   0.0
Khris Brogdon           8    0    0    0   0   0/1     0.0     0/0   0.0

TEAM: FG: 10/19 (52.6%), 3PT: 4/5 (80.0%), REB: 13 (4 off, 9 def), AST: 4, TO: 2
TEAM FOULS: 3

================================================================================

================================================================================
                       3RD QUARTER - Team_082 vs Team_085                       
================================================================================

[12:00] Team_082 possession (Score: 40-39)
Dwyane O'Neal attempts a 3Pt. Contested by Magic Beal (4.0 feet, ZONE). DWYANE O'NEAL MAKES IT! Assist: Julius Anthony
Score: 43-39

[11:50] Team_085 possession (Score: 43-39)
Collin Mobley drives and kicks out. Stephen Bird attempts a Midrange. Contested by Dwyane O'Neal (3.3 feet, MAN). Stephen Bird misses. Rebound secured by Dwyane O'Neal.

[11:40] Team_082 possession (Score: 43-39)
Julius Anthony attempts a 3Pt. Contested by Magic Beal (4.4 feet, MAN). Julius Anthony misses. Rebound secured by Collin Mobley.

[11:26] Team_085 possession (Score: 43-39)
Magic Beal throws a bad pass! Stolen by Julius Anthony! TURNOVER! (live ball)

[11:08] Team_082 possession (Score: 43-39)
Kristaps Fox throws a bad pass! Stolen by Larry Duncan! TURNOVER! (live ball)

[10:54] Team_085 possession (Score: 43-39)
Collin Mobley attempts a Midrange. Contested by Julius Carter (5.7 feet, MAN). COLLIN MOBLEY MAKES IT!
Score: 43-41

[10:40] Team_082 possession (Score: 43-41)
Julius Carter drives, Paul Wagner stays with him. Julius Carter attempts a Layup. Contested by Paul Wagner (3.9 feet, ZONE). JULIUS CARTER MAKES IT!
Score: 45-41

[10:22] Team_085 possession (Score: 45-41)
Stephen Bird attempts a 3Pt. Contested by Dwyane O'Neal (3.5 feet, MAN). Stephen Bird misses. Rebound secured by Dwyane O'Neal.

[10:05] Team_082 possession (Score: 45-41)
Julius Carter drives and kicks out. Julius Carter attempts a 3Pt. Contested by Collin Mobley (3.9 feet, MAN). Julius Carter misses. Rebound secured by Paul Wagner.

[09:51] Team_085 possession (Score: 45-41)
Larry Duncan attempts a 3Pt. Contested by Kristaps Fox (4.6 feet, MAN). Larry Duncan misses. Rebound secured by Jrue Green.

[09:39] Team_082 possession (Score: 45-41)
Julius Carter attempts a Layup. Contested by Collin Mobley (4.3 feet, MAN). Julius Carter misses. Rebound secured by Paul Wagner.

[09:27] Team_085 possession (Score: 45-41)
Magic Beal attempts a 3Pt. Contested by Julius Anthony (4.9 feet, MAN). MAGIC BEAL MAKES IT! Assist: Paul Wagner
Score: 45-44

[09:12] Team_082 possession (Score: 45-44)
Julius Carter attempts a Layup. BLOCKED BY COLLIN MOBLEY! Ball is loose! Rebound secured by Paul Wagner.

[08:55] Team_085 possession (Score: 45-44)
Larry Duncan makes the Layup and draws the foul on Kristaps Fox! And-1! Larry Duncan to the line for 1. [Team fouls: 1] (Kristaps Fox: 1 personal fouls)   FT 1/1: GOOD Larry Duncan makes 1/1 from the line.
Score: 45-47

[08:39] Team_082 possession (Score: 45-47)
Julius Anthony attempts a 3Pt. Contested by Magic Beal (4.4 feet, MAN). Julius Anthony misses. Rebound secured by Larry Duncan.

[08:21] Team_085 possession (Score: 45-47)
Collin Mobley attempts a Midrange. Contested by Jrue Green (5.0 feet, ZONE). COLLIN MOBLEY MAKES IT! Assist: Stephen Bird
Score: 45-49

[08:07] Team_082 possession (Score: 45-49)
FOUL! Holding foul on Paul Wagner. [Team fouls: 1] No free throws, side out. (Paul Wagner: 1 personal fouls)

[07:50] Team_082 possession (Score: 45-49)
Julius Anthony attempts a Midrange. Contested by Magic Beal (4.4 feet, MAN). JULIUS ANTHONY MAKES IT! Assist: Kristaps Fox
Score: 47-49

[07:36] Team_085 possession (Score: 47-49)
Paul Wagner throws a bad pass out of bounds! TURNOVER! (dead ball)

[07:24] Team_082 possession (Score: 47-49)
Kristaps Fox attempts a 3Pt. Contested by Larry Duncan (3.2 feet, MAN). KRISTAPS FOX MAKES IT! Assist: Jrue Green
Score: 50-49

[07:14] Team_085 possession (Score: 50-49)
FOUL! Shooting foul on Dwyane O'Neal. Paul Wagner to the line for 3 free throws. [Team fouls: 2] (Dwyane O'Neal: 1 personal fouls)   FT 1/3: GOOD   FT 2/3: GOOD   FT 3/3: GOOD Paul Wagner makes 3/3 from the line.
Score: 50-52

[06:56] Team_082 possession (Score: 50-52)
Jrue Green drives and kicks out. Kristaps Fox attempts a 3Pt. Contested by Larry Duncan (3.0 feet, MAN). Kristaps Fox misses. Rebound secured by Collin Mobley.

[06:41] Team_085 possession (Score: 50-52)
Paul Wagner attempts a 3Pt. Contested by Kristaps Fox (4.5 feet, ZONE). Paul Wagner misses. Rebound secured by Dwyane O'Neal.

[06:26] Team_082 possession (Score: 50-52)
Kristaps Fox attempts a Midrange. Contested by Larry Duncan (3.2 feet, ZONE). KRISTAPS FOX MAKES IT! Assist: Dwyane O'Neal
Score: 52-52

[06:11] Team_085 possession (Score: 52-52)
Stephen Bird attempts a Midrange. Contested by Jrue Green (5.3 feet, ZONE). Stephen Bird misses. Offensive rebound by Larry Duncan! Larry Duncan kicks it out.

[05:54] Team_085 possession (Score: 52-52)
Larry Duncan drives to the basket... Larry Duncan throws a bad pass! Stolen by Kristaps Fox! TURNOVER! (live ball)

[05:41] Team_082 possession (Score: 52-52)
Jrue Green attempts a 3Pt. Contested by Magic Beal (4.3 feet, ZONE). Jrue Green misses. Rebound secured by Paul Wagner.

[05:27] Team_085 possession (Score: 52-52)
Stephen Bird makes the 3Pt and draws the foul on Dwyane O'Neal! And-1! Stephen Bird to the line for 1. [Team fouls: 3] (Dwyane O'Neal: 2 personal fouls)   FT 1/1: GOOD Stephen Bird makes 1/1 from the line.
Score: 52-56

[05:16] Team_082 possession (Score: 52-56)
Dwyane O'Neal attempts a Layup. Contested by Paul Wagner (3.5 feet, ZONE). Dwyane O'Neal misses. Rebound secured by Larry Duncan.

[05:00] Team_085 possession (Score: 52-56)
FOUL! Shooting foul on Dwyane O'Neal. Stephen Bird to the line for 2 free throws. [Team fouls: 4] (Dwyane O'Neal: 3 personal fouls)   FT 1/2: MISS   FT 2/2: GOOD Stephen Bird makes 1/2 from the line.
Score: 52-57

[04:48] Team_082 possession (Score: 52-57)
Jrue Green drives, Paul Wagner stays with him. Jrue Green attempts a Layup. Contested by Paul Wagner (3.8 feet, ZONE). JRUE GREEN MAKES IT! Assist: Dwyane O'Neal
Score: 54-57

[04:33] Team_085 possession (Score: 54-57)
Larry Duncan attempts a Midrange. Contested by Kristaps Fox (4.6 feet, MAN). Larry Duncan misses. Rebound secured by Dwyane O'Neal.

[04:18] Team_082 possession (Score: 54-57)
Kristaps Fox attempts a 3Pt. Contested by Magic Beal (4.2 feet, ZONE). Kristaps Fox misses. Rebound secured by Paul Wagner.

[04:09] Team_085 possession (Score: 54-57)
Magic Beal drives and kicks out. FOUL! Shooting foul on Kristaps Fox. Larry Duncan to the line for 3 free throws. [BONUS: 5 team fouls] (Kristaps Fox: 2 personal fouls)   FT 1/3: GOOD   FT 2/3: GOOD   FT 3/3: MISS Larry Duncan makes 2/3 from the line. Offensive rebound by Larry Duncan! Larry Duncan kicks it out.
Score: 54-59

[03:50] Team_085 possession (Score: 54-59)
Collin Mobley drives and kicks out. Collin Mobley attempts a Midrange. Contested by Julius Carter (5.9 feet, MAN). Collin Mobley misses. Offensive rebound by Larry Duncan! Larry Duncan kicks it out.

[03:34] Team_085 possession (Score: 54-59)
Larry Duncan attempts a 3Pt. Contested by Kristaps Fox (4.7 feet, ZONE). LARRY DUNCAN MAKES IT! Assist: Collin Mobley
Score: 54-62

[03:14] Team_082 possession (Score: 54-62)
FOUL! Holding foul on Stephen Bird. [Team fouls: 2] No free throws, side out. (Stephen Bird: 1 personal fouls)

[02:58] Team_082 possession (Score: 54-62)
Julius Carter loses control! Ball rolls out of bounds! TURNOVER! (dead ball)

[02:58] Substitution (Team_082): Jrue Green OUT → Tony Jokic IN (stamina_rule2)

[02:58] Substitution (Team_085): Stephen Bird OUT → Jordan Morant IN (stamina_rule2)

[02:40] Team_085 possession (Score: 54-62)
Collin Mobley attempts a Midrange. Contested by Tony Jokic (5.0 feet, ZONE). Collin Mobley misses. Rebound secured by Dwyane O'Neal.

[02:26] Team_082 possession (Score: 54-62)
Kristaps Fox drives, picks up Collin Mobley. Help arrives from Magic Beal! Kristaps Fox attempts a Dunk. Contested by Magic Beal (4.3 feet, ZONE). KRISTAPS FOX MAKES IT!
Score: 56-62

[02:10] Team_085 possession (Score: 56-62)
Paul Wagner makes the Layup and draws the foul on Tony Jokic! And-1! Paul Wagner to the line for 1. [BONUS: 6 team fouls] (Tony Jokic: 1 personal fouls)   FT 1/1: GOOD Paul Wagner makes 1/1 from the line.
Score: 56-65

[01:57] Team_082 possession (Score: 56-65)
FOUL! Shooting foul on Jordan Morant. Dwyane O'Neal to the line for 2 free throws. [Team fouls: 3] (Jordan Morant: 1 personal fouls)   FT 1/2: GOOD   FT 2/2: MISS Dwyane O'Neal makes 1/2 from the line. Rebound secured by Collin Mobley.
Score: 57-65

[01:43] Team_085 possession (Score: 57-65)
Jordan Morant attempts a 3Pt. Contested by Dwyane O'Neal (3.8 feet, ZONE). Jordan Morant misses. Rebound secured by Dwyane O'Neal.

[01:32] Team_082 possession (Score: 57-65)
Julius Carter attempts a Layup. Contested by Collin Mobley (4.6 feet, MAN). JULIUS CARTER MAKES IT! Assist: Tony Jokic
Score: 59-65

[01:18] Team_085 possession (Score: 59-65)
Jordan Morant attempts a Midrange. Contested by Dwyane O'Neal (3.9 feet, ZONE). Jordan Morant misses. Rebound secured by Tony Jokic.

[01:03] Team_082 possession (Score: 59-65)
Dwyane O'Neal attempts a 3Pt. Contested by Magic Beal (4.4 feet, ZONE). DWYANE O'NEAL MAKES IT! Assist: Julius Carter
Score: 62-65

[00:54] Team_085 possession (Score: 62-65)
Magic Beal attempts a 3Pt. Contested by Dwyane O'Neal (4.1 feet, ZONE). Magic Beal misses. Rebound secured by Julius Carter.

[00:38] Team_082 possession (Score: 62-65)
FOUL! Reach-in foul on Collin Mobley during the drive. [Team fouls: 4] No free throws, side out. (Collin Mobley: 1 personal fouls)

[00:24] Team_082 possession (Score: 62-65)
Julius Anthony loses the ball! Stripped by Magic Beal! TURNOVER! (live ball)

[00:09] Team_085 possession (Score: 62-65)
FOUL! Reach-in foul on Julius Anthony during the drive. [IN THE BONUS! 7 team fouls] Magic Beal to the line for 2 free throws. (Julius Anthony: 1 personal fouls)   FT 1/2: GOOD   FT 2/2: GOOD Magic Beal makes 2/2 from the line.
Score: 62-67

================================================================================
                              3RD QUARTER COMPLETE                              
================================================================================

3RD QUARTER SCORE: Team_082 22, Team_085 28

BOX SCORE:
================================================================================

Team_082
--------------------------------------------------------------------------------
Player                MIN  PTS  REB  AST  TO      FG   FG%      3P   3P%
--------------------------------------------------------------------------------
Kristaps Fox           28    7    0    1   0   3/4    75.0     0/0   0.0
Dwyane O'Neal          28    6    6    2   0   2/4    50.0     0/0   0.0
Julius Carter          28    4    1    1   0   2/5    40.0     0/0   0.0
Julius Anthony         28    2    0    1   0   1/3    33.3     0/0   0.0
Jrue Green             25    2    1    1   0   1/3    33.3     0/0   0.0
Tony Jokic             11    0    1    1   0   0/0     0.0     0/0   0.0

TEAM: FG: 9/19 (47.4%), 3PT: 3/7 (42.9%), REB: 9 (0 off, 9 def), AST: 7, TO: 3
TEAM FOULS: 7 [Team_085 in BONUS]


Team_085
--------------------------------------------------------------------------------
Player                MIN  PTS  REB  AST  TO      FG   FG%      3P   3P%
--------------------------------------------------------------------------------
Paul Wagner            28    6    5    1   0   2/3    66.7     0/0   0.0
Larry Duncan           28    6    5    0   0   2/4    50.0     0/0   0.0
Stephen Bird           25    5    0    1   0   2/3    66.7     0/0   0.0
Magic Beal             28    5    0    0   0   2/3    66.7     0/0   0.0
Collin Mobley          28    4    3    1   0   2/4    50.0     0/0   0.0
Jordan Morant          11    0    0    0   0   0/2     0.0     0/0   0.0

TEAM: FG: 10/19 (52.6%), 3PT: 4/9 (44.4%), REB: 13 (3 off, 10 def), AST: 3, TO: 3
TEAM FOULS: 4

================================================================================

================================================================================
                       4TH QUARTER - Team_082 vs Team_085                       
================================================================================

[12:00] Team_082 possession (Score: 62-67)
Julius Carter drives to the basket... Julius Carter loses the ball! Stripped by Paul Wagner! TURNOVER! (live ball)

[11:45] Team_085 possession (Score: 62-67)
Collin Mobley attempts a Layup. Contested by Julius Carter (5.9 feet, MAN). COLLIN MOBLEY MAKES IT!
Score: 62-69

[11:31] Team_082 possession (Score: 62-69)
FOUL! Shooting foul on Paul Wagner. Julius Anthony to the line for 2 free throws. [Team fouls: 1] (Paul Wagner: 1 personal fouls)   FT 1/2: GOOD   FT 2/2: GOOD Julius Anthony makes 2/2 from the line.
Score: 64-69

[11:20] Team_085 possession (Score: 64-69)
FOUL! Reach-in foul on Julius Anthony during the drive. [Team fouls: 1] No free throws, side out. (Julius Anthony: 1 personal fouls)

[11:01] Team_085 possession (Score: 64-69)
Paul Wagner makes the Layup and draws the foul on Jrue Green! And-1! Paul Wagner to the line for 1. [Team fouls: 2] (Jrue Green: 1 personal fouls)   FT 1/1: GOOD Paul Wagner makes 1/1 from the line.
Score: 64-72

[10:47] Team_082 possession (Score: 64-72)
Julius Anthony drives to the basket... Julius Anthony throws a bad pass out of bounds! TURNOVER! (dead ball)

[10:47] Substitution (Team_082): Julius Anthony OUT → Jordan Rozier IN (stamina_rule2)

[10:47] Substitution (Team_082): Dwyane O'Neal OUT → Kawhi Poole IN (stamina_rule2)

[10:47] Substitution (Team_082): Kristaps Fox OUT → Shaquille Griffin IN (stamina_rule2)

[10:47] Substitution (Team_082): Julius Carter OUT → D'Angelo Parker IN (stamina_rule2)

[10:47] Substitution (Team_085): Magic Beal OUT → Khris Brogdon IN (stamina_rule2)

[10:47] Substitution (Team_085): Larry Duncan OUT → Giannis Johnson IN (stamina_rule2)

[10:47] Substitution (Team_085): Paul Wagner OUT → Jalen Leonard IN (stamina_rule2)

[10:47] Substitution (Team_085): Collin Mobley OUT → Malcolm Beal IN (stamina_rule2)

[10:32] Team_085 possession (Score: 64-72)
Stephen Bird attempts a Midrange. Contested by Jrue Green (5.4 feet, ZONE). Stephen Bird misses. Rebound secured by Shaquille Griffin.

[10:16] Team_082 possession (Score: 64-72)
Kawhi Poole drives, Malcolm Beal stays with him. Kawhi Poole attempts a Layup. Contested by Malcolm Beal (4.9 feet, ZONE). Kawhi Poole misses. Rebound secured by Jalen Leonard.

[10:02] Team_085 possession (Score: 64-72)
Malcolm Beal drives and kicks out. Stephen Bird attempts a 3Pt. Contested by Kawhi Poole (5.4 feet, MAN). Stephen Bird misses. FOUL! Loose ball foul on D'Angelo Parker during the rebound battle. [Team fouls: 3] No free throws, side out. (D'Angelo Parker: 1 personal fouls)

[09:50] Team_085 possession (Score: 64-72)
Jalen Leonard loses the ball! Stripped by Jrue Green! TURNOVER! (live ball)

[09:37] Team_082 possession (Score: 64-72)
Kawhi Poole attempts a 3Pt. Contested by Stephen Bird (4.2 feet, MAN). Kawhi Poole misses. Rebound secured by Jalen Leonard.

[09:20] Team_085 possession (Score: 64-72)
FOUL! Shooting foul on Jrue Green. Jalen Leonard to the line for 2 free throws. [Team fouls: 4] (Jrue Green: 2 personal fouls)   FT 1/2: MISS   FT 2/2: GOOD Jalen Leonard makes 1/2 from the line.
Score: 64-73

[09:07] Team_082 possession (Score: 64-73)
D'Angelo Parker drives, Malcolm Beal stays with him. D'Angelo Parker attempts a Layup. Contested by Malcolm Beal (4.8 feet, ZONE). D'ANGELO PARKER MAKES IT! Assist: Shaquille Griffin
Score: 66-73

[08:51] Team_085 possession (Score: 66-73)
Stephen Bird attempts a Midrange. Contested by Kawhi Poole (5.6 feet, MAN). STEPHEN BIRD MAKES IT! Assist: Malcolm Beal
Score: 66-75

[08:35] Team_082 possession (Score: 66-75)
Jrue Green attempts a Midrange. Contested by Jalen Leonard (4.4 feet, ZONE). JRUE GREEN MAKES IT!
Score: 68-75

[08:20] Team_085 possession (Score: 68-75)
Malcolm Beal attempts a Midrange. Contested by Jrue Green (4.9 feet, ZONE). Malcolm Beal misses. Rebound secured by Shaquille Griffin.

[08:06] Team_082 possession (Score: 68-75)
Jrue Green attempts a Layup. BLOCKED BY STEPHEN BIRD! Ball is loose! Rebound secured by Malcolm Beal.

[07:51] Team_085 possession (Score: 68-75)
Malcolm Beal attempts a 3Pt. Contested by Kawhi Poole (4.9 feet, ZONE). Malcolm Beal misses. Rebound secured by D'Angelo Parker.

[07:35] Team_082 possession (Score: 68-75)
Shaquille Griffin attempts a 3Pt. Contested by Giannis Johnson (5.8 feet, MAN). Shaquille Griffin misses. Offensive rebound by Shaquille Griffin! Shaquille Griffin kicks it out.

[07:17] Team_082 possession (Score: 68-75)
Jrue Green attempts a Midrange. Wide open! Giannis Johnson is 6.1 feet away. [ZONE] Jrue Green misses. Rebound secured by Jalen Leonard.

[07:00] Team_085 possession (Score: 68-75)
Khris Brogdon attempts a 3Pt. Contested by Shaquille Griffin (4.5 feet, ZONE). Khris Brogdon misses. Rebound secured by D'Angelo Parker.

[06:48] Team_082 possession (Score: 68-75)
D'Angelo Parker attempts a Layup. Contested by Malcolm Beal (4.8 feet, MAN). D'Angelo Parker misses. Rebound secured by Malcolm Beal.

[06:34] Team_085 possession (Score: 68-75)
Giannis Johnson throws a bad pass! Stolen by Shaquille Griffin! TURNOVER! (live ball)

[06:19] Team_082 possession (Score: 68-75)
Jrue Green attempts a 3Pt. Contested by Stephen Bird (4.3 feet, ZONE). Jrue Green misses. FOUL! Loose ball foul on Jalen Leonard during the rebound battle. [Team fouls: 2] No free throws, side out. (Jalen Leonard: 1 personal fouls)

[06:07] Team_082 possession (Score: 68-75)
D'Angelo Parker drives to the basket... D'Angelo Parker loses the ball! Stripped by Malcolm Beal! TURNOVER! (live ball)

[05:53] Team_085 possession (Score: 68-75)
Jalen Leonard attempts a Layup. Contested by D'Angelo Parker (5.3 feet, ZONE). JALEN LEONARD MAKES IT! Assist: Khris Brogdon
Score: 68-77

[05:41] Team_082 possession (Score: 68-77)
D'Angelo Parker drives to the basket... FOUL! Offensive foul on D'Angelo Parker! Malcolm Beal drew the charge! [Team fouls: 5] (D'Angelo Parker: 2 personal fouls) TURNOVER! (dead ball)

[05:29] Team_085 possession (Score: 68-77)
Jalen Leonard drives and kicks out. Malcolm Beal attempts a 3Pt. Contested by D'Angelo Parker (5.0 feet, MAN). MALCOLM BEAL MAKES IT! Assist: Stephen Bird
Score: 68-80

[05:10] Team_082 possession (Score: 68-80)
D'Angelo Parker drives, picks up Malcolm Beal. Help arrives from Khris Brogdon! D'Angelo Parker attempts a Dunk. Contested by Khris Brogdon (4.8 feet, ZONE). D'Angelo Parker misses. Rebound secured by Stephen Bird.

[04:51] Team_085 possession (Score: 68-80)
Stephen Bird attempts a 3Pt. Contested by Kawhi Poole (5.5 feet, MAN). Stephen Bird misses. Rebound secured by Shaquille Griffin.

[04:37] Team_082 possession (Score: 68-80)
Kawhi Poole attempts a 3Pt. Contested by Stephen Bird (4.9 feet, MAN). Kawhi Poole misses. Rebound secured by Jalen Leonard.

[04:21] Team_085 possession (Score: 68-80)
Giannis Johnson attempts a 3Pt. Contested by Shaquille Griffin (4.6 feet, MAN). Giannis Johnson misses. Rebound secured by Kawhi Poole.

[04:04] Team_082 possession (Score: 68-80)
Shaquille Griffin attempts a Layup. BLOCKED BY GIANNIS JOHNSON! Ball is loose! Rebound secured by Stephen Bird.

[03:48] Team_085 possession (Score: 68-80)
Giannis Johnson attempts a 3Pt. Contested by Shaquille Griffin (4.6 feet, MAN). GIANNIS JOHNSON MAKES IT! Assist: Stephen Bird
Score: 68-83

[03:32] Team_082 possession (Score: 68-83)
D'Angelo Parker attempts a Midrange. Contested by Malcolm Beal (4.8 feet, MAN). D'ANGELO PARKER MAKES IT!
Score: 70-83

[03:17] Team_085 possession (Score: 70-83)
Giannis Johnson drives and kicks out. Malcolm Beal attempts a 3Pt. Contested by Shaquille Griffin (4.7 feet, ZONE). MALCOLM BEAL MAKES IT!
Score: 70-86

[03:06] Team_082 possession (Score: 70-86)
Jordan Rozier attempts a Midrange. Wide open! Giannis Johnson is 6.0 feet away. [ZONE] JORDAN ROZIER MAKES IT!
Score: 72-86

[02:55] Team_085 possession (Score: 72-86)
Khris Brogdon attempts a 3Pt. Contested by Kawhi Poole (5.3 feet, ZONE). Khris Brogdon misses. Rebound secured by Shaquille Griffin.

[02:40] Team_082 possession (Score: 72-86)
Jrue Green attempts a Layup. Contested by Malcolm Beal (4.5 feet, ZONE). JRUE GREEN MAKES IT!
Score: 74-86

[02:24] Team_085 possession (Score: 74-86)
Giannis Johnson attempts a 3Pt. Contested by Shaquille Griffin (4.7 feet, MAN). GIANNIS JOHNSON MAKES IT! Assist: Jalen Leonard
Score: 74-89

[02:08] Team_082 possession (Score: 74-89)
FOUL! Offensive foul on Jordan Rozier! Khris Brogdon drew the charge! [Team fouls: 6] (Jordan Rozier: 1 personal fouls) TURNOVER! (dead ball)

[01:53] Team_085 possession (Score: 74-89)
Khris Brogdon drives and kicks out. Jalen Leonard attempts a Midrange. Wide open! Jrue Green is 6.3 feet away. [MAN] JALEN LEONARD MAKES IT! Assist: Malcolm Beal
Score: 74-91

[01:39] Team_082 possession (Score: 74-91)
Jrue Green attempts a 3Pt. Contested by Jalen Leonard (4.5 feet, ZONE). JRUE GREEN MAKES IT! Assist: Shaquille Griffin
Score: 77-91

[01:28] Team_085 possession (Score: 77-91)
Malcolm Beal drives, D'Angelo Parker stays with him. Malcolm Beal attempts a Layup. Contested by D'Angelo Parker (4.7 feet, ZONE). Malcolm Beal misses. FOUL! Loose ball foul on Shaquille Griffin during the rebound battle. [IN THE BONUS! 7 team fouls] Malcolm Beal to the line for 2 free throws. (Shaquille Griffin: 1 personal fouls)   FT 1/2: MISS   FT 2/2: GOOD Malcolm Beal makes 1/2 from the line.
Score: 77-92

[01:19] Team_082 possession (Score: 77-92)
FOUL! Offensive foul on Jordan Rozier! Khris Brogdon drew the charge! [Team fouls: 8] (Jordan Rozier: 2 personal fouls) TURNOVER! (dead ball)

[01:05] Team_085 possession (Score: 77-92)
FOUL! Reach-in foul on Jordan Rozier during the drive. [IN THE BONUS! 9 team fouls] Khris Brogdon to the line for 2 free throws. (Jordan Rozier: 3 personal fouls)   FT 1/2: GOOD   FT 2/2: MISS Khris Brogdon makes 1/2 from the line. Rebound secured by Shaquille Griffin.
Score: 77-93

[00:45] Team_082 possession (Score: 77-93)
FOUL! Offensive foul on Kawhi Poole! Stephen Bird drew the charge! [Team fouls: 10] (Kawhi Poole: 1 personal fouls) TURNOVER! (dead ball)

[00:26] Team_085 possession (Score: 77-93)
Giannis Johnson attempts a Midrange. Contested by Shaquille Griffin (4.9 feet, MAN). Giannis Johnson misses. Offensive rebound by Malcolm Beal! Malcolm Beal kicks it out.

[00:14] Team_085 possession (Score: 77-93)
Giannis Johnson attempts a Layup. BLOCKED BY KAWHI POOLE! Ball is loose! Rebound secured by Kawhi Poole.

================================================================================
                              4TH QUARTER COMPLETE                              
================================================================================

4TH QUARTER SCORE: Team_082 15, Team_085 26

BOX SCORE:
================================================================================

Team_082
--------------------------------------------------------------------------------
Player                MIN  PTS  REB  AST  TO      FG   FG%      3P   3P%
--------------------------------------------------------------------------------
Jrue Green             37    7    0    0   0   3/5    60.0     0/0   0.0
D'Angelo Parker        19    4    2    0   0   2/4    50.0     0/0   0.0
Julius Anthony         29    2    0    0   0   1/1   100.0     0/0   0.0
Jordan Rozier          19    2    0    0   0   1/1   100.0     0/0   0.0
Shaquille Griffin      19    0    7    2   0   0/1     0.0     0/0   0.0
Kawhi Poole            19    0    2    0   0   0/3     0.0     0/0   0.0

TEAM: FG: 7/15 (46.7%), 3PT: 1/3 (33.3%), REB: 11 (2 off, 9 def), AST: 2, TO: 7
TEAM FOULS: 10 [Team_085 in BONUS]


Team_085
--------------------------------------------------------------------------------
Player                MIN  PTS  REB  AST  TO      FG   FG%      3P   3P%
--------------------------------------------------------------------------------
Malcolm Beal           19    7    3    2   0   3/5    60.0     0/0   0.0
Giannis Johnson        19    6    0    0   0   2/4    50.0     0/0   0.0
Jalen Leonard          19    5    4    1   0   3/3   100.0     0/0   0.0
Paul Wagner            29    3    0    0   0   1/1   100.0     0/0   0.0
Collin Mobley          29    2    0    0   0   1/1   100.0     0/0   0.0
Stephen Bird           37    2    3    2   0   1/3    33.3     0/0   0.0
Khris Brogdon          19    0    0    1   0   0/3     0.0     0/0   0.0

TEAM: FG: 11/20 (55.0%), 3PT: 2/7 (28.6%), REB: 10 (2 off, 8 def), AST: 6, TO: 2
TEAM FOULS: 2

================================================================================

================================================================================
                               FULL GAME COMPLETE                               
================================================================================

FINAL SCORE: Team_082 77, Team_085 93

SCORING BY QUARTER:
--------------------------------------------------------------------------------
Team                     Q1     Q2     Q3     Q4    FINAL
--------------------------------------------------------------------------------
Team_082                 24     16     22     15       77
Team_085                 11     28     28     26       93
--------------------------------------------------------------------------------

FULL GAME BOX SCORE:
================================================================================

Team_082
--------------------------------------------------------------------------------
Player                MIN  PTS  REB  AST  TO      FG   FG%      3P   3P%      FT STL BLK
--------------------------------------------------------------------------------
Jrue Green             37   11    3    2   1   5/10   50.0   1/2    50.0   0/0     1   0
Julius Anthony         29   16    0    4   2   6/11   54.5   1/5    20.0   7/7     1   0
Dwyane O'Neal          29   11   10    5   2   4/7    57.1   3/3   100.0   1/2     0   1
Kristaps Fox           29   15    0    1   2   7/9    77.8   1/3    33.3   2/2     1   0
Julius Carter          29    6    9    2   3   3/9    33.3   0/0     0.0   0/0     0   0
Jordan Rozier          19    7    0    0   2   3/5    60.0   1/2    50.0   0/0     0   0
Kawhi Poole            19    0    2    1   3   0/4     0.0   0/3     0.0   0/0     0   1
Shaquille Griffin      19    0   11    3   1   0/1     0.0   0/0     0.0   0/0     2   0
D'Angelo Parker        19    8    8    0   1   4/7    57.1   0/1     0.0   0/0     1   1
Tony Jokic             11    2    3    3   1   1/4    25.0   0/1     0.0   0/0     0   0

TEAM: FG: 34/68 (50.0%), 3PT: 7/20 (35.0%), REB: 46 (9 off, 37 def), AST: 21, TO: 18


Team_085
--------------------------------------------------------------------------------
Player                MIN  PTS  REB  AST  TO      FG   FG%      3P   3P%      FT STL BLK
--------------------------------------------------------------------------------
Stephen Bird           37    9    3    4   0   4/9    44.4   1/3    33.3   2/3     1   1
Magic Beal             29    8    0    1   3   3/4    75.0   2/3    66.7   2/2     2   0
Larry Duncan           29   16   11    1   1   6/13   46.2   3/5    60.0   3/5     1   0
Paul Wagner            29    9   13    1   4   3/5    60.0   1/2    50.0   5/5     2   1
Collin Mobley          29   12    5    2   1   6/11   54.5   0/1     0.0   2/4     0   1
Khris Brogdon          19    0    0    1   0   1/5    20.0   0/2     0.0   1/3     0   0
Giannis Johnson        19   12    3    0   2   5/7    71.4   3/4    75.0   1/1     1   1
Jalen Leonard          19    6    6    2   1   3/6    50.0   0/0     0.0   3/6     0   0
Malcolm Beal           19    7    6    2   0   1/5    20.0   0/1     0.0   2/4     1   0
Jordan Morant          11    5    0    0   1   2/6    33.3   0/2     0.0   1/1     0   0

TEAM: FG: 35/72 (48.6%), 3PT: 10/23 (43.5%), REB: 47 (13 off, 34 def), AST: 14, TO: 13

================================================================================
