================================================================================
                        FULL GAME - Team_008 vs Team_056                        
================================================================================

================================================================================
                       1ST QUARTER - Team_008 vs Team_056                       
================================================================================

[12:00] Team_008 possession (Score: 0-0)
FOUL! Reach-in foul on Jrue Lillard during the drive. [Team fouls: 1] No free throws, side out. (Jrue Lillard: 1 personal fouls)

[11:46] Team_008 possession (Score: 0-0)
Tyrese Thompson attempts a Layup. Contested by Jrue Lillard (4.0 feet, MAN). TYRESE THOMPSON MAKES IT!
Score: 2-0

[11:28] Team_056 possession (Score: 2-0)
Jrue Lillard attempts a Layup. Contested by Tyrese Thompson (5.0 feet, MAN). Jrue Lillard misses. Rebound secured by Magic Young.

[11:14] Team_008 possession (Score: 2-0)
Jrue Harris attempts a 3Pt. Contested by Giannis Jokic (4.4 feet, ZONE). Jrue Harris misses. Rebound secured by Tony Carter.

[11:02] Team_056 possession (Score: 2-0)
Jrue Lillard attempts a 3Pt. Contested by Tyrese Thompson (5.0 feet, MAN). JRUE LILLARD MAKES IT! Assist: Tony Carter
Score: 2-3

[10:46] Team_008 possession (Score: 2-3)
Victor Leonard attempts a Layup. Contested by Giannis Jokic (4.6 feet, MAN). VICTOR LEONARD MAKES IT! Assist: Magic Young
Score: 4-3

[10:30] Team_056 possession (Score: 4-3)
Magic Russell attempts a 3Pt. Contested by Victor Leonard (5.4 feet, ZONE). Magic Russell misses. Rebound secured by Khris Hyland.

[10:16] Team_008 possession (Score: 4-3)
Jrue Harris attempts a Midrange. Contested by Magic Russell (5.6 feet, MAN). JRUE HARRIS MAKES IT!
Score: 6-3

[10:00] Team_056 possession (Score: 6-3)
Yao Poole attempts a Layup. Contested by Tyrese Thompson (4.1 feet, ZONE). Yao Poole misses. Rebound secured by Khris Hyland.

[09:46] Team_008 possession (Score: 6-3)
Magic Young attempts a 3Pt. Contested by Giannis Jokic (4.7 feet, ZONE). Magic Young misses. Rebound secured by Yao Poole.

[09:35] Team_056 possession (Score: 6-3)
Jrue Lillard attempts a Layup. Contested by Tyrese Thompson (5.0 feet, MAN). Jrue Lillard misses. Offensive rebound by Jrue Lillard! Jrue Lillard's putback is no good. Rebound secured by Tyrese Thompson.

[09:23] Team_008 possession (Score: 6-3)
Magic Young drives to the basket... Magic Young throws a bad pass! Stolen by Jrue Lillard! TURNOVER! (live ball)

[09:08] Team_056 possession (Score: 6-3)
Yao Poole drives and kicks out. Tony Carter attempts a 3Pt. Contested by Khris Hyland (4.0 feet, MAN). Tony Carter misses. Rebound secured by Magic Young.

[08:53] Team_008 possession (Score: 6-3)
Jrue Harris attempts a Layup. BLOCKED BY TONY CARTER! Ball is loose! Rebound secured by Tony Carter.

[08:38] Team_056 possession (Score: 6-3)
Magic Russell attempts a 3Pt. Contested by Jrue Harris (4.7 feet, ZONE). Magic Russell misses. Rebound secured by Magic Young.

[08:23] Team_008 possession (Score: 6-3)
Jrue Harris attempts a 3Pt. Contested by Giannis Jokic (4.4 feet, ZONE). JRUE HARRIS MAKES IT! Assist: Tyrese Thompson
Score: 9-3

[08:05] Team_056 possession (Score: 9-3)
Jrue Lillard attempts a Midrange. Contested by Khris Hyland (4.7 feet, ZONE). Jrue Lillard misses. Rebound secured by Khris Hyland.

[07:52] Team_008 possession (Score: 9-3)
Victor Leonard attempts a 3Pt. Contested by Giannis Jokic (4.6 feet, MAN). Victor Leonard misses. Rebound secured by Tony Carter.

[07:38] Team_056 possession (Score: 9-3)
Giannis Jokic attempts a Midrange. Contested by Jrue Harris (4.7 feet, ZONE). Giannis Jokic misses. Rebound secured by Khris Hyland.

[07:20] Team_008 possession (Score: 9-3)
Khris Hyland attempts a 3Pt. Contested by Tony Carter (4.2 feet, ZONE). Khris Hyland misses. Rebound secured by Yao Poole.

[07:02] Team_056 possession (Score: 9-3)
Magic Russell loses control! Ball rolls out of bounds! TURNOVER! (dead ball)

[06:46] Team_008 possession (Score: 9-3)
Khris Hyland attempts a Midrange. Contested by Tony Carter (4.2 feet, ZONE). KHRIS HYLAND MAKES IT!
Score: 11-3

[06:27] Team_056 possession (Score: 11-3)
Jrue Lillard attempts a 3Pt. Contested by Tyrese Thompson (5.0 feet, MAN). Jrue Lillard misses. Rebound secured by Tyrese Thompson.

[06:15] Team_008 possession (Score: 11-3)
Victor Leonard attempts a 3Pt. Contested by Giannis Jokic (4.6 feet, ZONE). Victor Leonard misses. Rebound secured by Jrue Lillard.

[06:03] Team_056 possession (Score: 11-3)
Yao Poole drives, picks up Tyrese Thompson. Help arrives from Jrue Harris! Yao Poole attempts a Dunk. Contested by Jrue Harris (4.1 feet, ZONE). YAO POOLE MAKES IT! Assist: Magic Russell
Score: 11-5

[05:50] Team_008 possession (Score: 11-5)
Victor Leonard attempts a 3Pt. Contested by Giannis Jokic (4.6 feet, MAN). Victor Leonard misses. Rebound secured by Jrue Lillard.

[05:38] Team_056 possession (Score: 11-5)
FOUL! Reach-in foul on Victor Leonard during the drive. [Team fouls: 1] No free throws, side out. (Victor Leonard: 1 personal fouls)

[05:20] Team_056 possession (Score: 11-5)
Jrue Lillard attempts a Midrange. Contested by Khris Hyland (4.7 feet, ZONE). Jrue Lillard misses. Rebound secured by Magic Young.

[05:06] Team_008 possession (Score: 11-5)
Victor Leonard attempts a Midrange. Contested by Giannis Jokic (4.7 feet, MAN). Victor Leonard misses. Offensive rebound by Tyrese Thompson! Tyrese Thompson kicks it out.

[04:52] Team_008 possession (Score: 11-5)
Khris Hyland drives and kicks out. Victor Leonard attempts a Midrange. Contested by Giannis Jokic (4.3 feet, MAN). Victor Leonard misses. Rebound secured by Jrue Lillard.

[04:37] Team_056 possession (Score: 11-5)
Tony Carter drives and kicks out. Giannis Jokic attempts a Midrange. Contested by Khris Hyland (4.1 feet, ZONE). GIANNIS JOKIC MAKES IT!
Score: 11-7

[04:21] Team_008 possession (Score: 11-7)
Tyrese Thompson commits a violation (traveling/carry)! TURNOVER! (dead ball)

[04:11] Team_056 possession (Score: 11-7)
Tony Carter makes the Layup and draws the foul on Tyrese Thompson! And-1! Tony Carter to the line for 1. [Team fouls: 2] (Tyrese Thompson: 1 personal fouls)   FT 1/1: MISS Tony Carter makes 0/1 from the line. FOUL! Loose ball foul on Tyrese Thompson during the free throw rebound! [Team fouls: 3] No free throws, side out. (Tyrese Thompson: 2 personal fouls)
Score: 11-9

[03:59] Team_056 possession (Score: 11-9)
Jrue Lillard drives, picks up Tyrese Thompson. Help arrives from Jrue Harris! Jrue Lillard attempts a Layup. Contested by Jrue Harris (5.2 feet, ZONE). JRUE LILLARD MAKES IT!
Score: 11-11

[03:48] Team_008 possession (Score: 11-11)
Tyrese Thompson attempts a 3Pt. Contested by Giannis Jokic (4.6 feet, ZONE). Tyrese Thompson misses. Rebound secured by Yao Poole.

[03:33] Team_056 possession (Score: 11-11)
Jrue Lillard attempts a Layup. Contested by Tyrese Thompson (5.2 feet, ZONE). Jrue Lillard misses. Rebound secured by Khris Hyland.

[03:19] Team_008 possession (Score: 11-11)
Jrue Harris drives and kicks out. Jrue Harris attempts a Midrange. Contested by Magic Russell (5.7 feet, MAN). JRUE HARRIS MAKES IT!
Score: 13-11

[03:03] Team_056 possession (Score: 13-11)
FOUL! Offensive foul on Tony Carter! Khris Hyland drew the charge! [Team fouls: 2] (Tony Carter: 1 personal fouls) TURNOVER! (dead ball)

[02:49] Team_008 possession (Score: 13-11)
Khris Hyland drives and kicks out. Victor Leonard attempts a 3Pt. Contested by Giannis Jokic (4.6 feet, MAN). Victor Leonard misses. Offensive rebound by Tyrese Thompson! Tyrese Thompson kicks it out.

[02:31] Team_008 possession (Score: 13-11)
Magic Young drives, Yao Poole stays with him. Magic Young attempts a Dunk. Contested by Yao Poole (4.8 feet, MAN). MAGIC YOUNG MAKES IT!
Score: 15-11

[02:20] Team_056 possession (Score: 15-11)
Yao Poole drives and kicks out. Tony Carter attempts a 3Pt. Contested by Khris Hyland (4.3 feet, MAN). Tony Carter misses. Rebound secured by Magic Young.

[02:04] Team_008 possession (Score: 15-11)
Victor Leonard drives, Giannis Jokic stays with him. Victor Leonard attempts a Dunk. Contested by Giannis Jokic (4.9 feet, MAN). Victor Leonard misses. Offensive rebound by Magic Young! Magic Young kicks it out.

[01:51] Team_008 possession (Score: 15-11)
Victor Leonard drives to the basket... Victor Leonard throws a bad pass! Stolen by Jrue Lillard! TURNOVER! (live ball)

[01:37] Team_056 possession (Score: 15-11)
Jrue Lillard attempts a 3Pt. Contested by Victor Leonard (5.9 feet, ZONE). Jrue Lillard misses. Rebound secured by Tyrese Thompson.

[01:26] Team_008 possession (Score: 15-11)
FOUL! Holding foul on Tony Carter. [Team fouls: 3] No free throws, side out. (Tony Carter: 2 personal fouls)

[01:08] Team_008 possession (Score: 15-11)
Tyrese Thompson throws a bad pass out of bounds! TURNOVER! (dead ball)

[01:08] Substitution (Team_008): Victor Leonard OUT → Blake Holiday IN (stamina_rule2)

[01:08] Substitution (Team_008): Jrue Harris OUT → Chris Griffin IN (stamina_rule2)

[01:08] Substitution (Team_008): Khris Hyland OUT → Immanuel Young IN (stamina_rule2)

[01:08] Substitution (Team_008): Tyrese Thompson OUT → Khris Giddey IN (stamina_rule2)

[01:08] Substitution (Team_008): Magic Young OUT → Lamelo Middleton IN (stamina_rule2)

[01:08] Substitution (Team_056): Giannis Jokic OUT → De'Aaron Murray IN (stamina_rule2)

[01:08] Substitution (Team_056): Magic Russell OUT → Damian Barrett IN (stamina_rule2)

[01:08] Substitution (Team_056): Tony Carter OUT → CJ Anthony IN (stamina_rule2)

[01:08] Substitution (Team_056): Jrue Lillard OUT → RJ Johnson IN (stamina_rule2)

[01:08] Substitution (Team_056): Yao Poole OUT → Derrick Bane IN (stamina_rule2)

[00:57] Team_056 possession (Score: 15-11)
CJ Anthony makes the Midrange and draws the foul on Khris Giddey! And-1! CJ Anthony to the line for 1. [Team fouls: 4] (Khris Giddey: 1 personal fouls)   FT 1/1: GOOD CJ Anthony makes 1/1 from the line.
Score: 15-14

[00:43] Team_008 possession (Score: 15-14)
Immanuel Young drives to the basket... FOUL! Offensive foul on Immanuel Young! CJ Anthony drew the charge! [Team fouls: 5] (Immanuel Young: 1 personal fouls) TURNOVER! (dead ball)

[00:27] Team_056 possession (Score: 15-14)
Derrick Bane drives, picks up Lamelo Middleton. Help arrives from Chris Griffin! Derrick Bane attempts a Layup. Contested by Chris Griffin (4.7 feet, ZONE). Derrick Bane misses. Rebound secured by Khris Giddey.

[00:09] Team_008 possession (Score: 15-14)
Blake Holiday attempts a 3Pt. Wide open! De'Aaron Murray is 6.1 feet away. [MAN] Blake Holiday misses. Rebound secured by Derrick Bane.

================================================================================
                              1ST QUARTER COMPLETE                              
================================================================================

1ST QUARTER SCORE: Team_008 15, Team_056 14

BOX SCORE:
================================================================================

Team_008
--------------------------------------------------------------------------------
Player                MIN  PTS  REB  AST  TO      FG   FG%      3P   3P%
--------------------------------------------------------------------------------
Jrue Harris            11    7    0    0   0   3/5    60.0     0/0   0.0
Tyrese Thompson        11    2    5    1   0   1/2    50.0     0/0   0.0
Magic Young            11    2    6    1   0   1/2    50.0     0/0   0.0
Victor Leonard         11    2    0    0   0   1/4    25.0     0/0   0.0
Khris Hyland           11    2    5    0   0   1/3    33.3     0/0   0.0
Khris Giddey            1    0    1    0   0   0/0     0.0     0/0   0.0
Blake Holiday           1    0    0    0   0   0/1     0.0     0/0   0.0

TEAM: FG: 7/17 (41.2%), 3PT: 1/9 (11.1%), REB: 16 (3 off, 13 def), AST: 2, TO: 5
TEAM FOULS: 5 [Team_056 in BONUS]


Team_056
--------------------------------------------------------------------------------
Player                MIN  PTS  REB  AST  TO      FG   FG%      3P   3P%
--------------------------------------------------------------------------------
Jrue Lillard           11    5    3    0   0   2/9    22.2     0/0   0.0
CJ Anthony              1    3    0    0   0   1/1   100.0     0/0   0.0
Yao Poole              11    2    4    0   0   1/4    25.0     0/0   0.0
Giannis Jokic          11    2    0    0   0   1/2    50.0     0/0   0.0
Tony Carter            11    0    3    1   0   0/0     0.0     0/0   0.0
Magic Russell          11    0    0    1   0   0/2     0.0     0/0   0.0
Derrick Bane            1    0    1    0   0   0/1     0.0     0/0   0.0

TEAM: FG: 5/19 (26.3%), 3PT: 1/5 (20.0%), REB: 12 (2 off, 10 def), AST: 2, TO: 2
TEAM FOULS: 3

================================================================================

================================================================================
                       2ND QUARTER - Team_008 vs Team_056                       
================================================================================

[12:00] Team_008 possession (Score: 15-14)
Magic Young attempts a Midrange. Contested by Tony Carter (4.6 feet, ZONE). Magic Young misses. Rebound secured by Jrue Lillard.

[11:48] Team_056 possession (Score: 15-14)
Giannis Jokic attempts a Midrange. Contested by Magic Young (5.5 feet, ZONE). GIANNIS JOKIC MAKES IT! Assist: Tony Carter
Score: 15-16

[11:31] Team_008 possession (Score: 15-16)
Victor Leonard attempts a 3Pt. Contested by Giannis Jokic (4.8 feet, ZONE). VICTOR LEONARD MAKES IT! Assist: Khris Hyland
Score: 18-16

[11:16] Team_056 possession (Score: 18-16)
Giannis Jokic attempts a 3Pt. Contested by Victor Leonard (5.6 feet, ZONE). Giannis Jokic misses. Offensive rebound by Jrue Lillard! Jrue Lillard's putback is no good. Rebound secured by Khris Hyland.

[11:03] Team_008 possession (Score: 18-16)
Khris Hyland attempts a 3Pt. Contested by Giannis Jokic (4.7 feet, ZONE). Khris Hyland misses. Rebound secured by Yao Poole.

[10:50] Team_056 possession (Score: 18-16)
Giannis Jokic attempts a Midrange. Contested by Victor Leonard (5.6 feet, MAN). Giannis Jokic misses. Rebound secured by Magic Young.

[10:34] Team_008 possession (Score: 18-16)
Tyrese Thompson attempts a 3Pt. Contested by Jrue Lillard (4.3 feet, MAN). Tyrese Thompson misses. Offensive rebound by Tyrese Thompson! Tyrese Thompson kicks it out.

[10:17] Team_008 possession (Score: 18-16)
Tyrese Thompson attempts a 3Pt. Contested by Giannis Jokic (4.8 feet, ZONE). Tyrese Thompson misses. Rebound secured by Tony Carter.

[10:05] Team_056 possession (Score: 18-16)
FOUL! Shooting foul on Victor Leonard. Tony Carter to the line for 3 free throws. [Team fouls: 1] (Victor Leonard: 1 personal fouls)   FT 1/3: GOOD   FT 2/3: GOOD   FT 3/3: GOOD Tony Carter makes 3/3 from the line.
Score: 18-19

[09:52] Team_008 possession (Score: 18-19)
Victor Leonard attempts a Layup. BLOCKED BY JRUE LILLARD! Ball goes out off Jrue Lillard. Victor Leonard's ball!

[09:36] Team_008 possession (Score: 18-19)
Jrue Harris makes the Midrange and draws the foul on Magic Russell! And-1! Jrue Harris to the line for 1. [Team fouls: 1] (Magic Russell: 1 personal fouls)   FT 1/1: GOOD Jrue Harris makes 1/1 from the line.
Score: 21-19

[09:21] Team_056 possession (Score: 21-19)
Yao Poole attempts a 3Pt. Contested by Victor Leonard (5.1 feet, ZONE). Yao Poole misses. Rebound secured by Khris Hyland.

[09:07] Team_008 possession (Score: 21-19)
Khris Hyland attempts a 3Pt. Contested by Giannis Jokic (4.9 feet, ZONE). KHRIS HYLAND MAKES IT! Assist: Magic Young
Score: 24-19

[08:50] Team_056 possession (Score: 24-19)
Yao Poole attempts a 3Pt. Contested by Magic Young (5.2 feet, MAN). Yao Poole misses. Rebound secured by Khris Hyland.

[08:36] Team_008 possession (Score: 24-19)
Magic Young attempts a Midrange. Contested by Yao Poole (5.1 feet, MAN). Magic Young misses. Rebound secured by Yao Poole.

[08:23] Team_056 possession (Score: 24-19)
Yao Poole attempts a 3Pt. Contested by Magic Young (5.2 feet, MAN). Yao Poole misses. Offensive rebound by Yao Poole! Yao Poole kicks it out.

[08:09] Team_056 possession (Score: 24-19)
Magic Russell drives and kicks out. Magic Russell attempts a 3Pt. Contested by Victor Leonard (5.6 feet, ZONE). MAGIC RUSSELL MAKES IT! Assist: Tony Carter
Score: 24-22

[07:57] Team_008 possession (Score: 24-22)
Jrue Harris attempts a Midrange. Wide open! Magic Russell is 6.2 feet away. [ZONE] Jrue Harris misses. Rebound secured by Yao Poole.

[07:41] Team_056 possession (Score: 24-22)
Yao Poole attempts a 3Pt. Contested by Victor Leonard (5.3 feet, ZONE). YAO POOLE MAKES IT! Assist: Magic Russell
Score: 24-25

[07:28] Team_008 possession (Score: 24-25)
Magic Young makes the Dunk and draws the foul on Jrue Lillard! And-1! Magic Young to the line for 1. [Team fouls: 2] (Jrue Lillard: 1 personal fouls)   FT 1/1: GOOD Magic Young makes 1/1 from the line.
Score: 27-25

[07:13] Team_056 possession (Score: 27-25)
Magic Russell attempts a Midrange. Contested by Jrue Harris (5.2 feet, ZONE). MAGIC RUSSELL MAKES IT! Assist: Jrue Lillard
Score: 27-27

[07:01] Team_008 possession (Score: 27-27)
Magic Young attempts a Layup. Contested by Yao Poole (5.3 feet, MAN). Magic Young misses. Rebound secured by Jrue Lillard.

[06:45] Team_056 possession (Score: 27-27)
Jrue Lillard makes the Layup and draws the foul on Tyrese Thompson! And-1! Jrue Lillard to the line for 1. [Team fouls: 2] (Tyrese Thompson: 1 personal fouls)   FT 1/1: GOOD Jrue Lillard makes 1/1 from the line.
Score: 27-30

[06:28] Team_008 possession (Score: 27-30)
Khris Hyland attempts a Layup. Contested by Tony Carter (5.0 feet, MAN). Khris Hyland misses. Rebound secured by Jrue Lillard.

[06:11] Team_056 possession (Score: 27-30)
Jrue Lillard makes the Dunk and draws the foul on Jrue Harris! And-1! Jrue Lillard to the line for 1. [Team fouls: 3] (Jrue Harris: 1 personal fouls)   FT 1/1: GOOD Jrue Lillard makes 1/1 from the line.
Score: 27-33

[05:57] Team_008 possession (Score: 27-33)
Khris Hyland attempts a 3Pt. Contested by Giannis Jokic (5.3 feet, ZONE). Khris Hyland misses. Offensive rebound by Tyrese Thompson! Tyrese Thompson kicks it out.

[05:39] Team_008 possession (Score: 27-33)
FOUL! Reach-in foul on Jrue Lillard during the drive. [Team fouls: 3] No free throws, side out. (Jrue Lillard: 2 personal fouls)

[05:24] Team_008 possession (Score: 27-33)
Khris Hyland attempts a 3Pt. Contested by Giannis Jokic (5.3 feet, ZONE). Khris Hyland misses. Rebound secured by Jrue Lillard.

[05:06] Team_056 possession (Score: 27-33)
Magic Russell attempts a 3Pt. Contested by Jrue Harris (5.5 feet, MAN). Magic Russell misses. Rebound secured by Khris Hyland.

[04:54] Team_008 possession (Score: 27-33)
Tyrese Thompson attempts a 3Pt. Contested by Giannis Jokic (5.4 feet, ZONE). Tyrese Thompson misses. Offensive rebound by Khris Hyland! Khris Hyland kicks it out.

[04:39] Team_008 possession (Score: 27-33)
FOUL! Shooting foul on Tony Carter. Khris Hyland to the line for 2 free throws. [Team fouls: 4] (Tony Carter: 1 personal fouls)   FT 1/2: GOOD   FT 2/2: MISS Khris Hyland makes 1/2 from the line. Rebound secured by Yao Poole.
Score: 28-33

[04:23] Team_056 possession (Score: 28-33)
Magic Russell attempts a Layup. Contested by Jrue Harris (5.5 feet, MAN). Magic Russell misses. Offensive rebound by Yao Poole! Yao Poole kicks it out.

[04:08] Team_056 possession (Score: 28-33)
FOUL! Shooting foul on Jrue Harris. Yao Poole to the line for 2 free throws. [Team fouls: 4] (Jrue Harris: 2 personal fouls)   FT 1/2: MISS   FT 2/2: MISS Yao Poole makes 0/2 from the line. Offensive rebound by Yao Poole! Yao Poole kicks it out.

[03:55] Team_056 possession (Score: 28-33)
Magic Russell attempts a 3Pt. Wide open! Victor Leonard is 6.3 feet away. [ZONE] MAGIC RUSSELL MAKES IT! Assist: Giannis Jokic
Score: 28-36

[03:42] Team_008 possession (Score: 28-36)
Jrue Harris attempts a Midrange. Contested by Tony Carter (5.3 feet, ZONE). Jrue Harris misses. Rebound secured by Yao Poole.

[03:29] Team_056 possession (Score: 28-36)
Giannis Jokic attempts a Midrange. Wide open! Victor Leonard is 6.4 feet away. [MAN] Giannis Jokic misses. Rebound secured by Magic Young.

[03:15] Team_008 possession (Score: 28-36)
Magic Young throws a bad pass out of bounds! TURNOVER! (dead ball)

[03:15] Substitution (Team_008): Victor Leonard OUT → Blake Holiday IN (stamina_rule2)

[03:15] Substitution (Team_008): Jrue Harris OUT → Chris Griffin IN (stamina_rule2)

[03:15] Substitution (Team_008): Khris Hyland OUT → Immanuel Young IN (stamina_rule2)

[03:15] Substitution (Team_008): Tyrese Thompson OUT → Khris Giddey IN (stamina_rule2)

[03:15] Substitution (Team_008): Magic Young OUT → Lamelo Middleton IN (stamina_rule2)

[03:15] Substitution (Team_056): Giannis Jokic OUT → De'Aaron Murray IN (stamina_rule2)

[03:15] Substitution (Team_056): Magic Russell OUT → Damian Barrett IN (stamina_rule2)

[03:15] Substitution (Team_056): Tony Carter OUT → CJ Anthony IN (stamina_rule2)

[03:15] Substitution (Team_056): Jrue Lillard OUT → RJ Johnson IN (stamina_rule2)

[03:15] Substitution (Team_056): Yao Poole OUT → Derrick Bane IN (stamina_rule2)

[02:58] Team_056 possession (Score: 28-36)
FOUL! Shooting foul on Chris Griffin. Damian Barrett to the line for 2 free throws. [BONUS: 5 team fouls] (Chris Griffin: 1 personal fouls)   FT 1/2: GOOD   FT 2/2: MISS Damian Barrett makes 1/2 from the line. Offensive rebound by CJ Anthony! CJ Anthony kicks it out.
Score: 28-37

[02:43] Team_056 possession (Score: 28-37)
FOUL! Holding foul on Chris Griffin. [IN THE BONUS! 6 team fouls] Damian Barrett to the line for 2 free throws. (Chris Griffin: 2 personal fouls)   FT 1/2: GOOD   FT 2/2: GOOD Damian Barrett makes 2/2 from the line.
Score: 28-39

[02:28] Team_008 possession (Score: 28-39)
Lamelo Middleton drives and kicks out. Chris Griffin attempts a 3Pt. Contested by De'Aaron Murray (5.9 feet, ZONE). Chris Griffin misses. Rebound secured by Derrick Bane.

[02:17] Team_056 possession (Score: 28-39)
De'Aaron Murray drives and kicks out. FOUL! Shooting foul on Khris Giddey. Derrick Bane to the line for 3 free throws. [BONUS: 7 team fouls] (Khris Giddey: 1 personal fouls)   FT 1/3: MISS   FT 2/3: MISS   FT 3/3: GOOD Derrick Bane makes 1/3 from the line.
Score: 28-40

[01:59] Team_008 possession (Score: 28-40)
Lamelo Middleton attempts a Layup. Contested by RJ Johnson (4.7 feet, ZONE). LAMELO MIDDLETON MAKES IT! Assist: Khris Giddey
Score: 30-40

[01:46] Team_056 possession (Score: 30-40)
De'Aaron Murray attempts a 3Pt. Contested by Blake Holiday (5.5 feet, MAN). De'Aaron Murray misses. Offensive rebound by CJ Anthony! CJ Anthony kicks it out.

[01:31] Team_056 possession (Score: 30-40)
Damian Barrett attempts a 3Pt. Contested by Chris Griffin (5.4 feet, MAN). Damian Barrett misses. Rebound secured by Khris Giddey.

[01:16] Team_008 possession (Score: 30-40)
Khris Giddey throws a bad pass! Stolen by RJ Johnson! TURNOVER! (live ball)

[01:01] Team_056 possession (Score: 30-40)
FOUL! Shooting foul on Blake Holiday. De'Aaron Murray to the line for 2 free throws. [BONUS: 8 team fouls] (Blake Holiday: 1 personal fouls)   FT 1/2: GOOD   FT 2/2: GOOD De'Aaron Murray makes 2/2 from the line.
Score: 30-42

[00:46] Team_008 possession (Score: 30-42)
Chris Griffin attempts a 3Pt. Contested by Damian Barrett (5.8 feet, ZONE). CHRIS GRIFFIN MAKES IT! Assist: Blake Holiday
Score: 33-42

[00:30] Team_056 possession (Score: 33-42)
CJ Anthony attempts a Midrange. Contested by Immanuel Young (4.2 feet, MAN). CJ Anthony misses. Rebound secured by Lamelo Middleton.

[00:18] Team_008 possession (Score: 33-42)
Khris Giddey throws a bad pass out of bounds! TURNOVER! (dead ball)

[00:06] Team_056 possession (Score: 33-42)
FOUL! Holding foul on Khris Giddey. [IN THE BONUS! 9 team fouls] RJ Johnson to the line for 2 free throws. (Khris Giddey: 2 personal fouls)   FT 1/2: GOOD   FT 2/2: GOOD RJ Johnson makes 2/2 from the line.
Score: 33-44

================================================================================
                              2ND QUARTER COMPLETE                              
================================================================================

2ND QUARTER SCORE: Team_008 18, Team_056 30

BOX SCORE:
================================================================================

Team_008
--------------------------------------------------------------------------------
Player                MIN  PTS  REB  AST  TO      FG   FG%      3P   3P%
--------------------------------------------------------------------------------
Magic Young            20    3    2    1   0   1/4    25.0     0/0   0.0
Victor Leonard         20    3    0    0   0   1/1   100.0     0/0   0.0
Khris Hyland           20    3    5    1   0   1/5    20.0     0/0   0.0
Jrue Harris            20    3    0    0   0   1/3    33.3     0/0   0.0
Chris Griffin           4    3    0    0   0   1/1   100.0     0/0   0.0
Lamelo Middleton        4    2    1    0   0   1/2    50.0     0/0   0.0
Tyrese Thompson        20    0    2    0   0   0/1     0.0     0/0   0.0
Khris Giddey            4    0    1    1   0   0/0     0.0     0/0   0.0
Blake Holiday           4    0    0    1   0   0/0     0.0     0/0   0.0

TEAM: FG: 6/17 (35.3%), 3PT: 3/6 (50.0%), REB: 10 (3 off, 7 def), AST: 4, TO: 3
TEAM FOULS: 9 [Team_056 in BONUS]


Team_056
--------------------------------------------------------------------------------
Player                MIN  PTS  REB  AST  TO      FG   FG%      3P   3P%
--------------------------------------------------------------------------------
Magic Russell          20    8    0    1   0   3/4    75.0     0/0   0.0
Jrue Lillard           20    6    4    1   0   2/2   100.0     0/0   0.0
Tony Carter            20    3    1    2   0   1/1   100.0     0/0   0.0
Yao Poole              20    3    8    0   0   1/3    33.3     0/0   0.0
Giannis Jokic          20    2    0    1   0   1/4    25.0     0/0   0.0
Damian Barrett          4    2    0    0   0   1/2    50.0     0/0   0.0
De'Aaron Murray         4    2    0    0   0   1/1   100.0     0/0   0.0
RJ Johnson              4    2    0    0   0   1/1   100.0     0/0   0.0
Derrick Bane            4    1    1    0   0   1/1   100.0     0/0   0.0
CJ Anthony              4    0    2    0   0   0/1     0.0     0/0   0.0

TEAM: FG: 12/20 (60.0%), 3PT: 3/8 (37.5%), REB: 17 (6 off, 11 def), AST: 5, TO: 0
TEAM FOULS: 4

================================================================================

================================================================================
                       3RD QUARTER - Team_008 vs Team_056                       
================================================================================

[12:00] Team_008 possession (Score: 33-44)
Khris Hyland drives and kicks out. FOUL! Shooting foul on Magic Russell. Jrue Harris to the line for 2 free throws. [Team fouls: 1] (Magic Russell: 1 personal fouls)   FT 1/2: GOOD   FT 2/2: GOOD Jrue Harris makes 2/2 from the line.
Score: 35-44

[11:49] Team_056 possession (Score: 35-44)
Giannis Jokic throws a bad pass out of bounds! TURNOVER! (dead ball)

[11:40] Team_008 possession (Score: 35-44)
Victor Leonard attempts a 3Pt. Contested by Giannis Jokic (4.6 feet, MAN). Victor Leonard misses. Rebound secured by Jrue Lillard.

[11:27] Team_056 possession (Score: 35-44)
Giannis Jokic makes the Midrange and draws the foul on Victor Leonard! And-1! Giannis Jokic to the line for 1. [Team fouls: 1] (Victor Leonard: 1 personal fouls)   FT 1/1: GOOD Giannis Jokic makes 1/1 from the line.
Score: 35-47

[11:10] Team_008 possession (Score: 35-47)
Jrue Harris attempts a 3Pt. Contested by Giannis Jokic (4.4 feet, ZONE). JRUE HARRIS MAKES IT! Assist: Khris Hyland
Score: 38-47

[10:54] Team_056 possession (Score: 38-47)
Jrue Lillard attempts a Midrange. Contested by Tyrese Thompson (5.0 feet, MAN). JRUE LILLARD MAKES IT!
Score: 38-49

[10:39] Team_008 possession (Score: 38-49)
Victor Leonard attempts a 3Pt. Contested by Giannis Jokic (4.6 feet, MAN). Victor Leonard misses. Rebound secured by Jrue Lillard.

[10:25] Team_056 possession (Score: 38-49)
Tony Carter attempts a Midrange. Contested by Khris Hyland (4.7 feet, ZONE). Tony Carter misses. Rebound secured by Magic Young.

[10:10] Team_008 possession (Score: 38-49)
Khris Hyland loses the ball! Stripped by Tony Carter! TURNOVER! (live ball)

[09:58] Team_056 possession (Score: 38-49)
Jrue Lillard attempts a Layup. Contested by Tyrese Thompson (5.0 feet, ZONE). Jrue Lillard misses. Rebound secured by Magic Young.

[09:41] Team_008 possession (Score: 38-49)
FOUL! Shooting foul on Jrue Lillard. Tyrese Thompson to the line for 2 free throws. [Team fouls: 2] (Jrue Lillard: 1 personal fouls)   FT 1/2: GOOD   FT 2/2: GOOD Tyrese Thompson makes 2/2 from the line.
Score: 40-49

[09:31] Team_056 possession (Score: 40-49)
Magic Russell attempts a 3Pt. Contested by Jrue Harris (4.7 feet, MAN). Magic Russell misses. Rebound secured by Tyrese Thompson.

[09:21] Team_008 possession (Score: 40-49)
FOUL! Offensive foul on Tyrese Thompson! Jrue Lillard drew the charge! [Team fouls: 2] (Tyrese Thompson: 1 personal fouls) TURNOVER! (dead ball)

[09:05] Team_056 possession (Score: 40-49)
Magic Russell attempts a 3Pt. Contested by Jrue Harris (4.7 feet, MAN). MAGIC RUSSELL MAKES IT! Assist: Tony Carter
Score: 40-52

[08:49] Team_008 possession (Score: 40-52)
Khris Hyland attempts a 3Pt. Contested by Tony Carter (4.2 feet, MAN). Khris Hyland misses. Rebound secured by Yao Poole.

[08:31] Team_056 possession (Score: 40-52)
Yao Poole drives to the basket... FOUL! Offensive foul on Yao Poole! Magic Young drew the charge! [Team fouls: 3] (Yao Poole: 1 personal fouls) TURNOVER! (dead ball)

[08:21] Team_008 possession (Score: 40-52)
Khris Hyland drives to the basket... Khris Hyland throws a bad pass! Stolen by Tony Carter! TURNOVER! (live ball)

[08:05] Team_056 possession (Score: 40-52)
Tony Carter attempts a 3Pt. Contested by Khris Hyland (4.7 feet, MAN). Tony Carter misses. Rebound secured by Khris Hyland.

[07:52] Team_008 possession (Score: 40-52)
FOUL! Reach-in foul on Jrue Lillard during the drive. [Team fouls: 4] No free throws, side out. (Jrue Lillard: 2 personal fouls)

[07:36] Team_008 possession (Score: 40-52)
Khris Hyland drives and kicks out. Victor Leonard attempts a Midrange. Contested by Giannis Jokic (4.3 feet, MAN). VICTOR LEONARD MAKES IT! Assist: Jrue Harris
Score: 42-52

[07:18] Team_056 possession (Score: 42-52)
Yao Poole drives to the basket... Yao Poole throws a bad pass out of bounds! TURNOVER! (dead ball)

[07:06] Team_008 possession (Score: 42-52)
FOUL! Holding foul on Magic Russell. [IN THE BONUS! 5 team fouls] Jrue Harris to the line for 2 free throws. (Magic Russell: 2 personal fouls)   FT 1/2: GOOD   FT 2/2: MISS Jrue Harris makes 1/2 from the line. Rebound secured by Yao Poole.
Score: 43-52

[06:57] Team_056 possession (Score: 43-52)
Magic Russell loses the ball! Stripped by Jrue Harris! TURNOVER! (live ball)

[06:40] Team_008 possession (Score: 43-52)
Jrue Harris attempts a 3Pt. Contested by Magic Russell (5.6 feet, MAN). Jrue Harris misses. Offensive rebound by Tyrese Thompson! Tyrese Thompson kicks it out.

[06:28] Team_008 possession (Score: 43-52)
Victor Leonard throws a bad pass! Stolen by Giannis Jokic! TURNOVER! (live ball)

[06:18] Team_056 possession (Score: 43-52)
Giannis Jokic attempts a Midrange. Contested by Victor Leonard (5.4 feet, MAN). Giannis Jokic misses. Offensive rebound by Yao Poole! Yao Poole kicks it out.

[06:04] Team_056 possession (Score: 43-52)
Giannis Jokic attempts a 3Pt. Contested by Victor Leonard (5.4 feet, ZONE). GIANNIS JOKIC MAKES IT! Assist: Magic Russell
Score: 43-55

[05:50] Team_008 possession (Score: 43-55)
Magic Young makes the Layup and draws the foul on Yao Poole! And-1! Magic Young to the line for 1. [BONUS: 6 team fouls] (Yao Poole: 2 personal fouls)   FT 1/1: MISS Magic Young makes 0/1 from the line. Rebound secured by Jrue Lillard.
Score: 45-55

[05:35] Team_056 possession (Score: 45-55)
Jrue Lillard drives to the basket... Jrue Lillard throws a bad pass out of bounds! TURNOVER! (dead ball)

[05:22] Team_008 possession (Score: 45-55)
Tyrese Thompson attempts a 3Pt. Contested by Jrue Lillard (4.0 feet, MAN). TYRESE THOMPSON MAKES IT! Assist: Khris Hyland
Score: 48-55

[05:08] Team_056 possession (Score: 48-55)
Giannis Jokic drives and kicks out. Yao Poole attempts a Midrange. Contested by Magic Young (5.0 feet, MAN). Yao Poole misses. Rebound secured by Magic Young.

[04:55] Team_008 possession (Score: 48-55)
Khris Hyland attempts a Layup. Contested by Tony Carter (4.3 feet, MAN). KHRIS HYLAND MAKES IT!
Score: 50-55

[04:39] Team_056 possession (Score: 50-55)
Tony Carter attempts a Midrange. Contested by Tyrese Thompson (5.2 feet, ZONE). Tony Carter misses. Rebound secured by Khris Hyland.

[04:22] Team_008 possession (Score: 50-55)
Victor Leonard attempts a 3Pt. Contested by Jrue Lillard (4.2 feet, ZONE). VICTOR LEONARD MAKES IT! Assist: Khris Hyland
Score: 53-55

[04:07] Team_056 possession (Score: 53-55)
Yao Poole throws a bad pass out of bounds! TURNOVER! (dead ball)

[03:50] Team_008 possession (Score: 53-55)
Khris Hyland attempts a 3Pt. Contested by Giannis Jokic (4.6 feet, ZONE). Khris Hyland misses. Rebound secured by Yao Poole.

[03:34] Team_056 possession (Score: 53-55)
FOUL! Shooting foul on Tyrese Thompson. Magic Russell to the line for 3 free throws. [Team fouls: 3] (Tyrese Thompson: 2 personal fouls)   FT 1/3: GOOD   FT 2/3: MISS   FT 3/3: GOOD Magic Russell makes 2/3 from the line.
Score: 53-57

[03:21] Team_008 possession (Score: 53-57)
Tyrese Thompson throws a bad pass! Stolen by Jrue Lillard! TURNOVER! (live ball)

[03:08] Team_056 possession (Score: 53-57)
Giannis Jokic attempts a Midrange. Contested by Victor Leonard (5.6 feet, ZONE). Giannis Jokic misses. Rebound secured by Tyrese Thompson.

[02:54] Team_008 possession (Score: 53-57)
Tyrese Thompson loses control! Ball rolls out of bounds! TURNOVER! (dead ball)

[02:54] Substitution (Team_008): Victor Leonard OUT → Blake Holiday IN (stamina_rule2)

[02:54] Substitution (Team_008): Khris Hyland OUT → Immanuel Young IN (stamina_rule2)

[02:54] Substitution (Team_008): Tyrese Thompson OUT → Khris Giddey IN (stamina_rule2)

[02:54] Substitution (Team_008): Magic Young OUT → Lamelo Middleton IN (stamina_rule2)

[02:54] Substitution (Team_056): Giannis Jokic OUT → De'Aaron Murray IN (stamina_rule2)

[02:54] Substitution (Team_056): Magic Russell OUT → Damian Barrett IN (stamina_rule2)

[02:54] Substitution (Team_056): Jrue Lillard OUT → RJ Johnson IN (stamina_rule2)

[02:54] Substitution (Team_056): Yao Poole OUT → Derrick Bane IN (stamina_rule2)

[02:38] Team_056 possession (Score: 53-57)
Damian Barrett attempts a 3Pt. Contested by Jrue Harris (4.7 feet, MAN). Damian Barrett misses. Rebound secured by Khris Giddey.

[02:23] Team_008 possession (Score: 53-57)
Lamelo Middleton attempts a Layup. Contested by RJ Johnson (4.7 feet, ZONE). Lamelo Middleton misses. Rebound secured by RJ Johnson.

[02:14] Team_056 possession (Score: 53-57)
RJ Johnson attempts a 3Pt. Contested by Khris Giddey (4.3 feet, MAN). RJ JOHNSON MAKES IT! Assist: Tony Carter
Score: 53-60

[01:57] Team_008 possession (Score: 53-60)
Blake Holiday attempts a 3Pt. Wide open! De'Aaron Murray is 6.1 feet away. [MAN] Blake Holiday misses. Rebound secured by RJ Johnson.

[01:43] Team_056 possession (Score: 53-60)
Tony Carter drives and kicks out. Damian Barrett makes the Midrange and draws the foul on Blake Holiday! And-1! Damian Barrett to the line for 1. [Team fouls: 4] (Blake Holiday: 1 personal fouls)   FT 1/1: GOOD Damian Barrett makes 1/1 from the line.
Score: 53-63

[01:26] Team_008 possession (Score: 53-63)
Lamelo Middleton drives and kicks out. Immanuel Young attempts a 3Pt. Contested by Tony Carter (4.6 feet, ZONE). IMMANUEL YOUNG MAKES IT! Assist: Khris Giddey
Score: 56-63

[01:08] Team_056 possession (Score: 56-63)
De'Aaron Murray loses the ball! Stripped by Blake Holiday! TURNOVER! (live ball)

[00:55] Team_008 possession (Score: 56-63)
Lamelo Middleton attempts a Midrange. Contested by Damian Barrett (5.8 feet, ZONE). Lamelo Middleton misses. Rebound secured by Derrick Bane.

[00:38] Team_056 possession (Score: 56-63)
Damian Barrett attempts a 3Pt. Contested by Khris Giddey (4.4 feet, ZONE). Damian Barrett misses. Rebound secured by Lamelo Middleton.

[00:28] Team_008 possession (Score: 56-63)
Immanuel Young drives and kicks out. Lamelo Middleton attempts a 3Pt. Contested by Derrick Bane (5.4 feet, MAN). LAMELO MIDDLETON MAKES IT! Assist: Blake Holiday
Score: 59-63

[00:13] Team_056 possession (Score: 59-63)
Damian Barrett attempts a Midrange. Contested by Jrue Harris (5.0 feet, ZONE). DAMIAN BARRETT MAKES IT! Assist: RJ Johnson
Score: 59-65

================================================================================
                              3RD QUARTER COMPLETE                              
================================================================================

3RD QUARTER SCORE: Team_008 26, Team_056 21

BOX SCORE:
================================================================================

Team_008
--------------------------------------------------------------------------------
Player                MIN  PTS  REB  AST  TO      FG   FG%      3P   3P%
--------------------------------------------------------------------------------
Jrue Harris            32    5    0    1   0   2/2   100.0     0/0   0.0
Victor Leonard         29    5    0    0   0   2/4    50.0     0/0   0.0
Tyrese Thompson        29    5    3    0   0   2/2   100.0     0/0   0.0
Lamelo Middleton        7    3    1    0   0   1/3    33.3     0/0   0.0
Immanuel Young          7    3    0    0   0   1/1   100.0     0/0   0.0
Khris Hyland           29    2    2    3   0   1/3    33.3     0/0   0.0
Magic Young            29    0    3    0   0   0/1     0.0     0/0   0.0
Khris Giddey            7    0    1    1   0   0/0     0.0     0/0   0.0
Blake Holiday           7    0    0    1   0   0/1     0.0     0/0   0.0

TEAM: FG: 9/18 (50.0%), 3PT: 3/8 (37.5%), REB: 10 (1 off, 9 def), AST: 6, TO: 6
TEAM FOULS: 4


Team_056
--------------------------------------------------------------------------------
Player                MIN  PTS  REB  AST  TO      FG   FG%      3P   3P%
--------------------------------------------------------------------------------
Giannis Jokic          29    6    0    0   0   2/4    50.0     0/0   0.0
Magic Russell          29    5    0    1   0   2/3    66.7     0/0   0.0
Damian Barrett          7    5    0    0   0   2/4    50.0     0/0   0.0
RJ Johnson              7    3    2    1   0   1/1   100.0     0/0   0.0
Jrue Lillard           29    2    3    0   0   1/2    50.0     0/0   0.0
Tony Carter            32    0    0    2   0   0/3     0.0     0/0   0.0
Yao Poole              29    0    4    0   0   0/0     0.0     0/0   0.0
Derrick Bane            7    0    1    0   0   0/0     0.0     0/0   0.0

TEAM: FG: 8/17 (47.1%), 3PT: 4/8 (50.0%), REB: 10 (1 off, 9 def), AST: 4, TO: 7
TEAM FOULS: 6 [Team_008 in BONUS]

================================================================================

================================================================================
                       4TH QUARTER - Team_008 vs Team_056                       
================================================================================

[12:00] Team_008 possession (Score: 59-65)
Khris Hyland attempts a 3Pt. Contested by Tony Carter (4.6 feet, MAN). Khris Hyland misses. Offensive rebound by Magic Young! Magic Young's putback is no good. Rebound secured by Jrue Lillard.

[11:41] Team_056 possession (Score: 59-65)
Yao Poole drives, picks up Magic Young. Help arrives from Jrue Harris! Yao Poole attempts a Layup. Contested by Jrue Harris (4.7 feet, MAN). Yao Poole misses. Offensive rebound by Yao Poole! Yao Poole kicks it out.

[11:31] Team_056 possession (Score: 59-65)
Tony Carter throws a bad pass! Stolen by Khris Hyland! TURNOVER! (live ball)

[11:15] Team_008 possession (Score: 59-65)
Tyrese Thompson loses control! Ball rolls out of bounds! TURNOVER! (dead ball)

[11:15] Substitution (Team_008): Jrue Harris OUT → Chris Griffin IN (stamina_rule2)

[11:15] Substitution (Team_056): Tony Carter OUT → CJ Anthony IN (stamina_rule2)

[11:00] Team_056 possession (Score: 59-65)
CJ Anthony attempts a 3Pt. Contested by Victor Leonard (5.0 feet, ZONE). CJ Anthony misses. Rebound secured by Magic Young.

[10:41] Team_008 possession (Score: 59-65)
Tyrese Thompson attempts a 3Pt. Contested by Giannis Jokic (4.6 feet, ZONE). Tyrese Thompson misses. Rebound secured by CJ Anthony.

[10:24] Team_056 possession (Score: 59-65)
Giannis Jokic drives to the basket... Giannis Jokic throws a bad pass! Stolen by Tyrese Thompson! TURNOVER! (live ball)

[10:08] Team_008 possession (Score: 59-65)
Chris Griffin attempts a 3Pt. Contested by Magic Russell (6.0 feet, MAN). CHRIS GRIFFIN MAKES IT! Assist: Khris Hyland
Score: 62-65

[09:52] Team_056 possession (Score: 62-65)
Magic Russell drives to the basket... Magic Russell loses control! Ball rolls out of bounds! TURNOVER! (dead ball)

[09:38] Team_008 possession (Score: 62-65)
Tyrese Thompson drives, picks up Jrue Lillard. Help arrives from Giannis Jokic! Tyrese Thompson attempts a Dunk. Contested by Giannis Jokic (4.1 feet, ZONE). TYRESE THOMPSON MAKES IT!
Score: 64-65

[09:22] Team_056 possession (Score: 64-65)
CJ Anthony drives, Khris Hyland stays with him. CJ Anthony attempts a Layup. Contested by Khris Hyland (4.1 feet, MAN). CJ Anthony misses. Offensive rebound by Jrue Lillard! Jrue Lillard's putback is no good. Rebound secured by Tyrese Thompson.

[09:07] Team_008 possession (Score: 64-65)
Chris Griffin drives, picks up Jrue Lillard. Help arrives from Giannis Jokic! Chris Griffin attempts a Dunk. Contested by Giannis Jokic (4.3 feet, ZONE). Chris Griffin misses. FOUL! Loose ball foul on Jrue Lillard during the rebound battle. [Team fouls: 1] No free throws, side out. (Jrue Lillard: 1 personal fouls)

[08:56] Team_008 possession (Score: 64-65)
Chris Griffin attempts a Midrange. Contested by Jrue Lillard (4.4 feet, ZONE). Chris Griffin misses. Rebound secured by Jrue Lillard.

[08:40] Team_056 possession (Score: 64-65)
Yao Poole drives to the basket... Yao Poole loses control! Ball rolls out of bounds! TURNOVER! (dead ball)

[08:40] Substitution (Team_008): Victor Leonard OUT → Blake Holiday IN (stamina_rule2)

[08:40] Substitution (Team_008): Khris Hyland OUT → Immanuel Young IN (stamina_rule2)

[08:40] Substitution (Team_008): Tyrese Thompson OUT → Khris Giddey IN (stamina_rule2)

[08:40] Substitution (Team_008): Magic Young OUT → Lamelo Middleton IN (stamina_rule2)

[08:40] Substitution (Team_056): Giannis Jokic OUT → De'Aaron Murray IN (stamina_rule2)

[08:40] Substitution (Team_056): Magic Russell OUT → Damian Barrett IN (stamina_rule2)

[08:40] Substitution (Team_056): Jrue Lillard OUT → RJ Johnson IN (stamina_rule2)

[08:40] Substitution (Team_056): Yao Poole OUT → Derrick Bane IN (stamina_rule2)

[08:23] Team_008 possession (Score: 64-65)
Chris Griffin attempts a 3Pt. Wide open! De'Aaron Murray is 6.2 feet away. [ZONE] CHRIS GRIFFIN MAKES IT! Assist: Khris Giddey
Score: 67-65

[08:10] Team_056 possession (Score: 67-65)
FOUL! Shooting foul on Chris Griffin. Damian Barrett to the line for 2 free throws. [Team fouls: 1] (Chris Griffin: 1 personal fouls)   FT 1/2: GOOD   FT 2/2: GOOD Damian Barrett makes 2/2 from the line.
Score: 67-67

[07:53] Team_008 possession (Score: 67-67)
Chris Griffin attempts a 3Pt. Contested by Damian Barrett (5.8 feet, MAN). CHRIS GRIFFIN MAKES IT! Assist: Blake Holiday
Score: 70-67

[07:39] Team_056 possession (Score: 70-67)
Derrick Bane attempts a Layup. Contested by Lamelo Middleton (4.7 feet, ZONE). DERRICK BANE MAKES IT! Assist: De'Aaron Murray
Score: 70-69

[07:23] Team_008 possession (Score: 70-69)
Lamelo Middleton drives and kicks out. Chris Griffin attempts a Midrange. Contested by Damian Barrett (5.5 feet, MAN). Chris Griffin misses. Rebound secured by RJ Johnson.

[07:08] Team_056 possession (Score: 70-69)
CJ Anthony attempts a 3Pt. Contested by Immanuel Young (4.2 feet, MAN). CJ ANTHONY MAKES IT! Assist: RJ Johnson
Score: 70-72

[06:52] Team_008 possession (Score: 70-72)
Khris Giddey drives to the basket... Khris Giddey loses the ball! Stripped by RJ Johnson! TURNOVER! (live ball)

[06:37] Team_056 possession (Score: 70-72)
RJ Johnson drives to the basket... RJ Johnson throws a bad pass! Stolen by Lamelo Middleton! TURNOVER! (live ball)

[06:21] Team_008 possession (Score: 70-72)
Immanuel Young attempts a 3Pt. Contested by CJ Anthony (4.7 feet, MAN). IMMANUEL YOUNG MAKES IT! Assist: Lamelo Middleton
Score: 73-72

[06:06] Team_056 possession (Score: 73-72)
De'Aaron Murray makes the Midrange and draws the foul on Blake Holiday! And-1! De'Aaron Murray to the line for 1. [Team fouls: 2] (Blake Holiday: 1 personal fouls)   FT 1/1: MISS De'Aaron Murray makes 0/1 from the line. Rebound secured by Khris Giddey.
Score: 73-74

[05:55] Team_008 possession (Score: 73-74)
Khris Giddey attempts a 3Pt. Contested by De'Aaron Murray (5.8 feet, ZONE). Khris Giddey misses. Rebound secured by Derrick Bane.

[05:41] Team_056 possession (Score: 73-74)
FOUL! Reach-in foul on Lamelo Middleton during the drive. [Team fouls: 3] No free throws, side out. (Lamelo Middleton: 1 personal fouls)

[05:27] Team_056 possession (Score: 73-74)
RJ Johnson attempts a Midrange. Contested by Khris Giddey (4.3 feet, MAN). RJ JOHNSON MAKES IT!
Score: 73-76

[05:12] Team_008 possession (Score: 73-76)
Immanuel Young loses the ball! Stripped by CJ Anthony! TURNOVER! (live ball)

[04:56] Team_056 possession (Score: 73-76)
De'Aaron Murray attempts a 3Pt. Contested by Blake Holiday (5.5 feet, MAN). De'Aaron Murray misses. Rebound secured by Lamelo Middleton.

[04:39] Team_008 possession (Score: 73-76)
Chris Griffin drives and kicks out. Immanuel Young attempts a 3Pt. Contested by De'Aaron Murray (5.9 feet, ZONE). IMMANUEL YOUNG MAKES IT! Assist: Lamelo Middleton
Score: 76-76

[04:23] Team_056 possession (Score: 76-76)
RJ Johnson drives, Lamelo Middleton stays with him. RJ Johnson attempts a Dunk. Contested by Lamelo Middleton (4.4 feet, ZONE). RJ Johnson misses. Rebound secured by Khris Giddey.

[04:10] Team_008 possession (Score: 76-76)
Chris Griffin drives, RJ Johnson stays with him. Chris Griffin attempts a Dunk. Contested by RJ Johnson (4.7 feet, ZONE). CHRIS GRIFFIN MAKES IT! Assist: Lamelo Middleton
Score: 78-76

[03:56] Team_056 possession (Score: 78-76)
RJ Johnson attempts a 3Pt. Contested by Khris Giddey (4.3 feet, ZONE). RJ Johnson misses. Rebound secured by Lamelo Middleton.

[03:43] Team_008 possession (Score: 78-76)
Immanuel Young attempts a Midrange. Wide open! Damian Barrett is 6.0 feet away. [ZONE] IMMANUEL YOUNG MAKES IT! Assist: Lamelo Middleton
Score: 80-76

[03:30] Team_056 possession (Score: 80-76)
De'Aaron Murray drives, Lamelo Middleton stays with him. De'Aaron Murray attempts a Dunk. Contested by Lamelo Middleton (4.4 feet, ZONE). DE'AARON MURRAY MAKES IT! Assist: CJ Anthony
Score: 80-78

[03:15] Team_008 possession (Score: 80-78)
Immanuel Young attempts a 3Pt. Wide open! De'Aaron Murray is 6.4 feet away. [ZONE] IMMANUEL YOUNG MAKES IT! Assist: Khris Giddey
Score: 83-78

[02:56] Team_056 possession (Score: 83-78)
De'Aaron Murray attempts a Layup. Contested by Blake Holiday (5.5 feet, MAN). DE'AARON MURRAY MAKES IT! Assist: Derrick Bane
Score: 83-80

[02:45] Team_008 possession (Score: 83-80)
Chris Griffin drives, Damian Barrett stays with him. Chris Griffin attempts a Layup. Contested by Damian Barrett (5.9 feet, MAN). Chris Griffin misses. Rebound secured by RJ Johnson.

[02:31] Team_056 possession (Score: 83-80)
Derrick Bane attempts a Midrange. Contested by Immanuel Young (4.7 feet, ZONE). DERRICK BANE MAKES IT!
Score: 83-82

[02:18] Team_008 possession (Score: 83-82)
Immanuel Young drives to the basket... Immanuel Young loses control! Ball rolls out of bounds! TURNOVER! (dead ball)

[02:02] Team_056 possession (Score: 83-82)
Damian Barrett drives and kicks out. RJ Johnson attempts a Midrange. Contested by Khris Giddey (4.3 feet, MAN). RJ JOHNSON MAKES IT!
Score: 83-84

[01:46] Team_008 possession (Score: 83-84)
Khris Giddey attempts a Midrange. Contested by RJ Johnson (4.4 feet, MAN). Khris Giddey misses. Rebound secured by Derrick Bane.

[01:37] Team_056 possession (Score: 83-84)
RJ Johnson attempts a Midrange. Contested by Immanuel Young (4.5 feet, ZONE). RJ Johnson misses. FOUL! Loose ball foul on Lamelo Middleton during the rebound battle. [Team fouls: 4] No free throws, side out. (Lamelo Middleton: 2 personal fouls)

[01:22] Team_056 possession (Score: 83-84)
CJ Anthony attempts a 3Pt. Contested by Immanuel Young (4.4 feet, MAN). CJ Anthony misses. Rebound secured by Chris Griffin.

[01:07] Team_008 possession (Score: 83-84)
Immanuel Young attempts a 3Pt. Contested by CJ Anthony (4.9 feet, MAN). Immanuel Young misses. FOUL! Loose ball foul on CJ Anthony during the rebound battle. [Team fouls: 2] No free throws, side out. (CJ Anthony: 1 personal fouls)

[00:50] Team_008 possession (Score: 83-84)
Lamelo Middleton drives, picks up Derrick Bane. Help arrives from Damian Barrett! Lamelo Middleton attempts a Dunk. Contested by Damian Barrett (5.9 feet, MAN). Lamelo Middleton misses. Offensive rebound by Khris Giddey! Khris Giddey kicks it out.

[00:34] Team_008 possession (Score: 83-84)
Blake Holiday attempts a 3Pt. Wide open! De'Aaron Murray is 6.3 feet away. [MAN] Blake Holiday misses. Offensive rebound by Khris Giddey! Khris Giddey kicks it out.

[00:24] Team_008 possession (Score: 83-84)
Chris Griffin attempts a 3Pt. Wide open! Damian Barrett is 6.1 feet away. [MAN] Chris Griffin misses. Rebound secured by CJ Anthony.

[00:12] Team_056 possession (Score: 83-84)
RJ Johnson attempts a 3Pt. Contested by Khris Giddey (4.6 feet, ZONE). RJ Johnson misses. Offensive rebound by Derrick Bane! Derrick Bane kicks it out.

================================================================================
                              4TH QUARTER COMPLETE                              
================================================================================

4TH QUARTER SCORE: Team_008 24, Team_056 19

BOX SCORE:
================================================================================

Team_008
--------------------------------------------------------------------------------
Player                MIN  PTS  REB  AST  TO      FG   FG%      3P   3P%
--------------------------------------------------------------------------------
Chris Griffin          15   11    1    0   0   4/7    57.1     0/0   0.0
Immanuel Young         15   11    0    0   0   4/4   100.0     0/0   0.0
Khris Hyland           33    0    0    1   0   0/1     0.0     0/0   0.0
Magic Young            33    0    2    0   0   0/0     0.0     0/0   0.0
Khris Giddey           15    0    5    2   0   0/2     0.0     0/0   0.0
Blake Holiday          15    0    0    1   0   0/0     0.0     0/0   0.0
Lamelo Middleton       15    0    2    4   0   0/1     0.0     0/0   0.0

TEAM: FG: 9/17 (52.9%), 3PT: 5/9 (55.6%), REB: 11 (5 off, 6 def), AST: 8, TO: 4
TEAM FOULS: 4


Team_056
--------------------------------------------------------------------------------
Player                MIN  PTS  REB  AST  TO      FG   FG%      3P   3P%
--------------------------------------------------------------------------------
Derrick Bane           15    4    3    1   0   2/2   100.0     0/0   0.0
De'Aaron Murray        15    4    0    1   0   2/4    50.0     0/0   0.0
RJ Johnson             15    4    3    1   0   2/4    50.0     0/0   0.0
CJ Anthony             15    3    2    1   0   1/4    25.0     0/0   0.0
Tyrese Thompson        33    2    1    0   0   1/2    50.0     0/0   0.0
Damian Barrett         15    2    0    0   0   1/1   100.0     0/0   0.0
Jrue Lillard           33    0    2    0   0   0/0     0.0     0/0   0.0
Yao Poole              33    0    1    0   0   0/0     0.0     0/0   0.0

TEAM: FG: 8/15 (53.3%), 3PT: 1/5 (20.0%), REB: 11 (4 off, 7 def), AST: 4, TO: 5
TEAM FOULS: 2

================================================================================

================================================================================
                               FULL GAME COMPLETE                               
================================================================================

FINAL SCORE: Team_008 83, Team_056 84

SCORING BY QUARTER:
--------------------------------------------------------------------------------
Team                     Q1     Q2     Q3     Q4    FINAL
--------------------------------------------------------------------------------
Team_008                 15     18     26     24       83
Team_056                 14     30     21     19       84
--------------------------------------------------------------------------------

FULL GAME BOX SCORE:
================================================================================

Team_008
--------------------------------------------------------------------------------
Player                MIN  PTS  REB  AST  TO      FG   FG%      3P   3P%      FT STL BLK
--------------------------------------------------------------------------------
Jrue Harris            33   15    0    1   0   5/9    55.6   2/3    66.7   4/5     1   0
Victor Leonard         33   10    0    0   2   3/8    37.5   2/7    28.6   0/0     0   0
Khris Hyland           33    7   12    5   2   5/14   35.7   1/7    14.3   1/2     1   0
Tyrese Thompson        33    9   11    1   7   4/7    57.1   1/4    25.0   2/2     1   0
Magic Young            33    5   13    2   1   2/7    28.6   0/1     0.0   1/2     0   0
Blake Holiday          15    0    0    3   1   0/2     0.0   0/2     0.0   0/0     1   0
Immanuel Young         15   14    0    0   1   4/4   100.0   2/2   100.0   0/0     0   0
Khris Giddey           15    0    8    4   3   0/2     0.0   0/1     0.0   0/0     0   0
Lamelo Middleton       15    5    4    4   1   2/6    33.3   0/0     0.0   0/0     1   0
Chris Griffin          15   14    1    0   0   6/9    66.7   4/5    80.0   0/0     0   0

TEAM: FG: 31/69 (44.9%), 3PT: 12/32 (37.5%), REB: 47 (12 off, 35 def), AST: 20, TO: 18


Team_056
--------------------------------------------------------------------------------
Player                MIN  PTS  REB  AST  TO      FG   FG%      3P   3P%      FT STL BLK
--------------------------------------------------------------------------------
Tony Carter            33    3    4    5   2   3/6    50.0   1/2    50.0   3/4     2   1
Giannis Jokic          33   10    0    1   2   3/9    33.3   1/2    50.0   1/1     1   0
Magic Russell          33   13    0    3   3   5/9    55.6   3/7    42.9   2/3     0   0
Jrue Lillard           33   13   12    1   1   5/13   38.5   1/3    33.3   2/2     3   1
Yao Poole              33    5   17    0   4   2/7    28.6   1/3    33.3   0/2     0   0
De'Aaron Murray        15    6    0    1   1   4/6    66.7   0/1     0.0   2/3     0   0
Damian Barrett         15    9    0    0   1   3/6    50.0   0/3     0.0   6/7     0   0
RJ Johnson             15    9    5    2   0   2/4    50.0   1/2    50.0   2/2     2   0
Derrick Bane           15    5    6    1   0   2/3    66.7   0/0     0.0   1/3     0   0
CJ Anthony             15    6    4    1   0   2/6    33.3   1/3    33.3   1/1     1   0

TEAM: FG: 33/71 (46.5%), 3PT: 9/26 (34.6%), REB: 50 (13 off, 37 def), AST: 15, TO: 14

================================================================================
