================================================================================
                        FULL GAME - Team_027 vs Team_010                        
================================================================================

================================================================================
                       1ST QUARTER - Team_027 vs Team_010                       
================================================================================

[12:00] Team_027 possession (Score: 0-0)
Tony Doncic drives, picks up Michael Turner. Help arrives from Cade Morant! Tony Doncic attempts a Layup. Contested by Cade Morant (4.1 feet, MAN). TONY DONCIC MAKES IT! Assist: Bradley Dosunmu
Score: 2-0

[11:43] Team_010 possession (Score: 2-0)
Desmond Antetokounmpo drives and kicks out. Cade Morant attempts a Midrange. Contested by Tony Doncic (3.9 feet, ZONE). CADE MORANT MAKES IT!
Score: 2-2

[11:28] Team_027 possession (Score: 2-2)
Bradley Dosunmu attempts a 3Pt. Contested by Desmond Antetokounmpo (4.3 feet, MAN). Bradley Dosunmu misses. FOUL! Loose ball foul on Anthony Durant during the rebound battle. [Team fouls: 1] No free throws, side out. (Anthony Durant: 1 personal fouls)

[11:16] Team_027 possession (Score: 2-2)
John Russell attempts a Layup. Contested by Anthony Durant (4.3 feet, MAN). John Russell misses. Rebound secured by Cade Morant.

[10:59] Team_010 possession (Score: 2-2)
Michael Turner makes the Layup and draws the foul on John Russell! And-1! Michael Turner to the line for 1. [Team fouls: 1] (John Russell: 1 personal fouls)   FT 1/1: GOOD Michael Turner makes 1/1 from the line.
Score: 2-5

[10:42] Team_027 possession (Score: 2-5)
John Russell drives, Anthony Durant stays with him. John Russell attempts a Layup. Contested by Anthony Durant (4.3 feet, ZONE). JOHN RUSSELL MAKES IT! Assist: Bradley Dosunmu
Score: 4-5

[10:28] Team_010 possession (Score: 4-5)
FOUL! Holding foul on John Russell. [Team fouls: 2] No free throws, side out. (John Russell: 2 personal fouls)

[10:13] Team_010 possession (Score: 4-5)
Cade Morant makes the Layup and draws the foul on Tim Johnson! And-1! Cade Morant to the line for 1. [Team fouls: 3] (Tim Johnson: 1 personal fouls)   FT 1/1: GOOD Cade Morant makes 1/1 from the line.
Score: 4-8

[10:01] Team_027 possession (Score: 4-8)
John Russell drives, Anthony Durant stays with him. John Russell attempts a Layup. Contested by Anthony Durant (4.3 feet, MAN). JOHN RUSSELL MAKES IT! Assist: Scottie Harden
Score: 6-8

[09:49] Team_010 possession (Score: 6-8)
FOUL! Holding foul on John Russell. [Team fouls: 4] No free throws, side out. (John Russell: 3 personal fouls)

[09:30] Team_010 possession (Score: 6-8)
Anthony Durant attempts a Midrange. Contested by Scottie Harden (4.8 feet, ZONE). Anthony Durant misses. Rebound secured by Tony Doncic.

[09:12] Team_027 possession (Score: 6-8)
FOUL! Reach-in foul on Anthony Durant during the drive. [Team fouls: 2] No free throws, side out. (Anthony Durant: 2 personal fouls)

[08:57] Team_027 possession (Score: 6-8)
John Russell drives, picks up Anthony Durant. Help arrives from Cade Morant! John Russell attempts a Dunk. Contested by Cade Morant (4.3 feet, MAN). JOHN RUSSELL MAKES IT! Assist: Tony Doncic
Score: 8-8

[08:42] Team_010 possession (Score: 8-8)
RJ Young attempts a Midrange. Contested by Scottie Harden (4.3 feet, MAN). RJ Young misses. Rebound secured by Bradley Dosunmu.

[08:29] Team_027 possession (Score: 8-8)
John Russell attempts a 3Pt. Contested by Cade Morant (4.7 feet, ZONE). John Russell misses. Offensive rebound by Bradley Dosunmu! Bradley Dosunmu kicks it out.

[08:14] Team_027 possession (Score: 8-8)
FOUL! Shooting foul on Anthony Durant. Tony Doncic to the line for 2 free throws. [Team fouls: 3] (Anthony Durant: 3 personal fouls)   FT 1/2: GOOD   FT 2/2: GOOD Tony Doncic makes 2/2 from the line.
Score: 10-8

[08:03] Team_010 possession (Score: 10-8)
Anthony Durant makes the Layup and draws the foul on John Russell! And-1! Anthony Durant to the line for 1. [BONUS: 5 team fouls] (John Russell: 4 personal fouls)   FT 1/1: GOOD Anthony Durant makes 1/1 from the line.
Score: 10-11

[07:48] Team_027 possession (Score: 10-11)
John Russell drives, picks up Anthony Durant. Help arrives from Cade Morant! John Russell attempts a Dunk. Contested by Cade Morant (4.3 feet, ZONE). JOHN RUSSELL MAKES IT! Assist: Scottie Harden
Score: 12-11

[07:32] Team_010 possession (Score: 12-11)
Desmond Antetokounmpo drives and kicks out. Anthony Durant attempts a Midrange. Contested by John Russell (3.9 feet, ZONE). ANTHONY DURANT MAKES IT!
Score: 12-13

[07:22] Team_027 possession (Score: 12-13)
FOUL! Reach-in foul on Anthony Durant during the drive. [Team fouls: 4] No free throws, side out. (Anthony Durant: 4 personal fouls)

[07:06] Team_027 possession (Score: 12-13)
Bradley Dosunmu attempts a Midrange. Contested by Desmond Antetokounmpo (4.3 feet, ZONE). Bradley Dosunmu misses. Rebound secured by Desmond Antetokounmpo.

[06:49] Team_010 possession (Score: 12-13)
Michael Turner loses the ball! Stripped by Tony Doncic! TURNOVER! (live ball)

[06:33] Team_027 possession (Score: 12-13)
FOUL! Shooting foul on Michael Turner. Tony Doncic to the line for 2 free throws. [BONUS: 5 team fouls] (Michael Turner: 1 personal fouls)   FT 1/2: GOOD   FT 2/2: GOOD Tony Doncic makes 2/2 from the line.
Score: 14-13

[06:17] Team_010 possession (Score: 14-13)
Michael Turner makes the Midrange and draws the foul on Tony Doncic! And-1! Michael Turner to the line for 1. [BONUS: 6 team fouls] (Tony Doncic: 1 personal fouls)   FT 1/1: GOOD Michael Turner makes 1/1 from the line.
Score: 14-16

[06:02] Team_027 possession (Score: 14-16)
John Russell attempts a Midrange. Contested by Anthony Durant (4.3 feet, MAN). John Russell misses. Rebound secured by Anthony Durant.

[05:47] Team_010 possession (Score: 14-16)
RJ Young drives and kicks out. Michael Turner attempts a 3Pt. Contested by Tim Johnson (4.9 feet, ZONE). Michael Turner misses. Rebound secured by John Russell.

[05:37] Team_027 possession (Score: 14-16)
Tim Johnson makes the Dunk and draws the foul on Cade Morant! And-1! Tim Johnson to the line for 1. [BONUS: 6 team fouls] (Cade Morant: 1 personal fouls)   FT 1/1: GOOD Tim Johnson makes 1/1 from the line.
Score: 17-16

[05:21] Team_010 possession (Score: 17-16)
RJ Young makes the Layup and draws the foul on Scottie Harden! And-1! RJ Young to the line for 1. [BONUS: 7 team fouls] (Scottie Harden: 1 personal fouls)   FT 1/1: GOOD RJ Young makes 1/1 from the line.
Score: 17-19

[05:02] Team_027 possession (Score: 17-19)
John Russell attempts a Midrange. Contested by Cade Morant (4.7 feet, ZONE). John Russell misses. FOUL! Loose ball foul on Anthony Durant during the rebound battle. [IN THE BONUS! 7 team fouls] Bradley Dosunmu to the line for 2 free throws. (Anthony Durant: 5 personal fouls)   FT 1/2: GOOD   FT 2/2: MISS Bradley Dosunmu makes 1/2 from the line. Rebound secured by Cade Morant.
Score: 18-19

[04:48] Team_010 possession (Score: 18-19)
FOUL! Reach-in foul on Bradley Dosunmu during the drive. [IN THE BONUS! 8 team fouls] Desmond Antetokounmpo to the line for 2 free throws. (Bradley Dosunmu: 1 personal fouls)   FT 1/2: GOOD   FT 2/2: GOOD Desmond Antetokounmpo makes 2/2 from the line.
Score: 18-21

[04:30] Team_027 possession (Score: 18-21)
Tony Doncic attempts a 3Pt. Contested by Cade Morant (4.1 feet, ZONE). Tony Doncic misses. Rebound secured by Anthony Durant.

[04:18] Team_010 possession (Score: 18-21)
Cade Morant attempts a 3Pt. Contested by Tim Johnson (5.5 feet, MAN). CADE MORANT MAKES IT! Assist: Anthony Durant
Score: 18-24

[04:07] Team_027 possession (Score: 18-24)
FOUL! Reach-in foul on Anthony Durant during the drive. [IN THE BONUS! 8 team fouls] Tim Johnson to the line for 2 free throws. (Anthony Durant: 6 personal fouls) Anthony Durant FOULS OUT!   FT 1/2: GOOD   FT 2/2: GOOD Tim Johnson makes 2/2 from the line.
Score: 20-24

[04:07] Substitution (Team_010): Anthony Durant OUT (stamina: 75) → Draymond Leonard IN (foul_out)

[03:55] Team_010 possession (Score: 20-24)
Draymond Leonard loses control! Ball rolls out of bounds! TURNOVER! (dead ball)

[03:40] Team_027 possession (Score: 20-24)
Tim Johnson makes the Layup and draws the foul on Cade Morant! And-1! Tim Johnson to the line for 1. [BONUS: 9 team fouls] (Cade Morant: 2 personal fouls)   FT 1/1: MISS Tim Johnson makes 0/1 from the line. FOUL! Loose ball foul on Michael Turner during the free throw rebound! [IN THE BONUS! 10 team fouls] Bradley Dosunmu to the line for 2 free throws. (Michael Turner: 2 personal fouls)   FT 1/2: GOOD   FT 2/2: GOOD Bradley Dosunmu makes 2/2 from the line.
Score: 24-24

[03:28] Team_010 possession (Score: 24-24)
Cade Morant attempts a Layup. Contested by John Russell (4.6 feet, ZONE). Cade Morant misses. Rebound secured by Tony Doncic.

[03:10] Team_027 possession (Score: 24-24)
Tim Johnson attempts a 3Pt. Contested by Draymond Leonard (4.7 feet, ZONE). Tim Johnson misses. Offensive rebound by John Russell! John Russell puts it back in!
Score: 26-24

[02:56] Team_010 possession (Score: 26-24)
FOUL! Shooting foul on Tony Doncic. Michael Turner to the line for 2 free throws. [BONUS: 9 team fouls] (Tony Doncic: 2 personal fouls)   FT 1/2: GOOD   FT 2/2: MISS Michael Turner makes 1/2 from the line. Rebound secured by John Russell.
Score: 26-25

[02:42] Team_027 possession (Score: 26-25)
Tim Johnson makes the Dunk and draws the foul on Cade Morant! And-1! Tim Johnson to the line for 1. [BONUS: 11 team fouls] (Cade Morant: 3 personal fouls)   FT 1/1: GOOD Tim Johnson makes 1/1 from the line.
Score: 29-25

[02:27] Team_010 possession (Score: 29-25)
Michael Turner attempts a Midrange. Contested by Tony Doncic (4.4 feet, MAN). MICHAEL TURNER MAKES IT!
Score: 29-27

[02:11] Team_027 possession (Score: 29-27)
Tim Johnson attempts a 3Pt. Contested by Draymond Leonard (4.6 feet, ZONE). Tim Johnson misses. Rebound secured by Desmond Antetokounmpo.

[01:58] Team_010 possession (Score: 29-27)
Desmond Antetokounmpo drives, picks up John Russell. Help arrives from Tony Doncic! Desmond Antetokounmpo attempts a Layup. Contested by Tony Doncic (4.4 feet, ZONE). DESMOND ANTETOKOUNMPO MAKES IT! Assist: Cade Morant
Score: 29-29

[01:43] Team_027 possession (Score: 29-29)
Scottie Harden drives and kicks out. Tony Doncic attempts a Midrange. Contested by Michael Turner (4.3 feet, MAN). Tony Doncic misses. Rebound secured by Desmond Antetokounmpo.

[01:31] Team_010 possession (Score: 29-29)
RJ Young attempts a Midrange. Contested by Scottie Harden (4.7 feet, MAN). RJ Young misses. Rebound secured by Bradley Dosunmu.

[01:17] Team_027 possession (Score: 29-29)
Tim Johnson attempts a 3Pt. Contested by Cade Morant (4.6 feet, MAN). TIM JOHNSON MAKES IT! Assist: Tony Doncic
Score: 32-29

[01:02] Team_010 possession (Score: 32-29)
Draymond Leonard loses the ball! Stripped by Tim Johnson! TURNOVER! (live ball)

[00:50] Team_027 possession (Score: 32-29)
Scottie Harden makes the Midrange and draws the foul on Michael Turner! And-1! Scottie Harden to the line for 1. [BONUS: 12 team fouls] (Michael Turner: 3 personal fouls)   FT 1/1: MISS Scottie Harden makes 0/1 from the line. Rebound secured by Cade Morant.
Score: 34-29

[00:38] Team_010 possession (Score: 34-29)
Michael Turner attempts a 3Pt. Contested by Tony Doncic (4.5 feet, MAN). MICHAEL TURNER MAKES IT! Assist: Desmond Antetokounmpo
Score: 34-32

[00:24] Team_027 possession (Score: 34-32)
Bradley Dosunmu makes the Layup and draws the foul on Desmond Antetokounmpo! And-1! Bradley Dosunmu to the line for 1. [BONUS: 13 team fouls] (Desmond Antetokounmpo: 1 personal fouls)   FT 1/1: GOOD Bradley Dosunmu makes 1/1 from the line.
Score: 37-32

[00:13] Team_010 possession (Score: 37-32)
Desmond Antetokounmpo drives to the basket... Desmond Antetokounmpo commits a violation (traveling/carry)! TURNOVER! (dead ball)

[00:13] Substitution (Team_027): Tim Johnson OUT → CJ Green IN (stamina_rule2)

[00:13] Substitution (Team_027): Tony Doncic OUT → Dirk Lillard IN (stamina_rule2)

[00:13] Substitution (Team_027): Scottie Harden OUT → Rudy Quickley IN (stamina_rule2)

[00:13] Substitution (Team_027): Bradley Dosunmu OUT → LeBron Russell IN (stamina_rule2)

[00:13] Substitution (Team_027): John Russell OUT → Ben Stewart IN (stamina_rule2)

[00:13] Substitution (Team_010): Cade Morant OUT → Blake Harden IN (stamina_rule2)

[00:13] Substitution (Team_010): Michael Turner OUT → Cade Morant IN (stamina_rule2)

[00:13] Substitution (Team_010): RJ Young OUT → Ben Gilgeous-Alexander IN (stamina_rule2)

[00:13] Substitution (Team_010): Desmond Antetokounmpo OUT → Vince Ingram IN (stamina_rule2)

================================================================================
                              1ST QUARTER COMPLETE                              
================================================================================

1ST QUARTER SCORE: Team_027 37, Team_010 32

BOX SCORE:
================================================================================

Team_027
--------------------------------------------------------------------------------
Player                MIN  PTS  REB  AST  TO      FG   FG%      3P   3P%
--------------------------------------------------------------------------------
Tim Johnson            12   11    0    0   0   4/5    80.0     0/0   0.0
John Russell           12   10    3    0   0   5/8    62.5     0/0   0.0
Bradley Dosunmu        12    7    4    2   0   2/3    66.7     0/0   0.0
Tony Doncic            12    6    2    2   0   3/4    75.0     0/0   0.0
Scottie Harden         12    0    0    2   0   0/2     0.0     0/0   0.0

TEAM: FG: 14/22 (63.6%), 3PT: 2/4 (50.0%), REB: 10 (4 off, 6 def), AST: 6, TO: 0
TEAM FOULS: 9 [Team_010 in BONUS]


Team_010
--------------------------------------------------------------------------------
Player                MIN  PTS  REB  AST  TO      FG   FG%      3P   3P%
--------------------------------------------------------------------------------
Michael Turner         12   11    0    0   0   4/5    80.0     0/0   0.0
Cade Morant            12    8    3    1   0   3/4    75.0     0/0   0.0
Anthony Durant          8    5    2    1   0   2/3    66.7     0/0   0.0
Desmond Antetokounmpo   12    4    3    1   0   2/2   100.0     0/0   0.0
RJ Young               12    3    0    0   0   1/4    25.0     0/0   0.0

TEAM: FG: 12/18 (66.7%), 3PT: 2/2 (100.0%), REB: 7 (0 off, 7 def), AST: 3, TO: 4
TEAM FOULS: 13 [Team_027 in BONUS]

================================================================================

================================================================================
                       2ND QUARTER - Team_027 vs Team_010                       
================================================================================

[12:00] Substitution (Team_027): Tim Johnson OUT → CJ Green IN (stamina_rule2)

[12:00] Substitution (Team_027): Scottie Harden OUT → Rudy Quickley IN (stamina_rule2)

[12:00] Substitution (Team_027): Bradley Dosunmu OUT → LeBron Russell IN (stamina_rule2)

[12:00] Substitution (Team_027): John Russell OUT → Ben Stewart IN (stamina_rule2)

[12:00] Substitution (Team_010): Cade Morant OUT → Blake Harden IN (stamina_rule2)

[12:00] Substitution (Team_010): Michael Turner OUT → Draymond Leonard IN (stamina_rule2)

[12:00] Substitution (Team_010): RJ Young OUT → Ben Gilgeous-Alexander IN (stamina_rule2)

[12:00] Substitution (Team_010): Desmond Antetokounmpo OUT → Vince Ingram IN (stamina_rule2)

[12:00] Team_027 possession (Score: 37-32)
Scottie Harden throws a bad pass out of bounds! TURNOVER! (dead ball)

[11:50] Team_010 possession (Score: 37-32)
Blake Harden commits a violation (traveling/carry)! TURNOVER! (dead ball)

[11:50] Substitution (Team_027): Tony Doncic OUT → Dirk Lillard IN (stamina_rule2)

[11:38] Team_027 possession (Score: 37-32)
LeBron Russell attempts a Midrange. Contested by Anthony Durant (3.5 feet, MAN). LeBron Russell misses. Rebound secured by Blake Harden.

[11:26] Team_010 possession (Score: 37-32)
Anthony Durant attempts a Layup. Contested by Ben Stewart (5.0 feet, MAN). ANTHONY DURANT MAKES IT!
Score: 37-34

[11:08] Team_027 possession (Score: 37-34)
Dirk Lillard attempts a Midrange. Contested by Blake Harden (4.7 feet, ZONE). Dirk Lillard misses. Rebound secured by Anthony Durant.

[10:51] Team_010 possession (Score: 37-34)
Blake Harden drives to the basket... FOUL! Offensive foul on Blake Harden! Dirk Lillard drew the charge! [Team fouls: 1] (Blake Harden: 1 personal fouls) TURNOVER! (dead ball)

[10:31] Team_027 possession (Score: 37-34)
LeBron Russell makes the Dunk and draws the foul on Blake Harden! And-1! LeBron Russell to the line for 1. [Team fouls: 2] (Blake Harden: 2 personal fouls)   FT 1/1: GOOD LeBron Russell makes 1/1 from the line.
Score: 40-34

[10:14] Team_010 possession (Score: 40-34)
Anthony Durant drives to the basket... Anthony Durant throws a bad pass! Stolen by Ben Stewart! TURNOVER! (live ball)

[10:00] Team_027 possession (Score: 40-34)
CJ Green attempts a 3Pt. Contested by Draymond Leonard (4.6 feet, MAN). CJ GREEN MAKES IT! Assist: LeBron Russell
Score: 43-34

[09:48] Team_010 possession (Score: 43-34)
Vince Ingram attempts a 3Pt. Wide open! LeBron Russell is 6.2 feet away. [MAN] VINCE INGRAM MAKES IT! Assist: Anthony Durant
Score: 43-37

[09:32] Team_027 possession (Score: 43-37)
Ben Stewart drives and kicks out. Ben Stewart attempts a 3Pt. Contested by Draymond Leonard (4.4 feet, ZONE). BEN STEWART MAKES IT! Assist: Dirk Lillard
Score: 46-37

[09:18] Team_010 possession (Score: 46-37)
Anthony Durant drives and kicks out. Blake Harden attempts a 3Pt. Contested by Dirk Lillard (4.1 feet, MAN). BLAKE HARDEN MAKES IT! Assist: Ben Gilgeous-Alexander
Score: 46-40

[09:04] Team_027 possession (Score: 46-40)
CJ Green attempts a 3Pt. Contested by Draymond Leonard (4.6 feet, MAN). CJ Green misses. Rebound secured by Blake Harden.

[08:53] Team_010 possession (Score: 46-40)
Ben Gilgeous-Alexander attempts a 3Pt. Contested by Rudy Quickley (3.6 feet, MAN). Ben Gilgeous-Alexander misses. Rebound secured by Ben Stewart.

[08:39] Team_027 possession (Score: 46-40)
Dirk Lillard attempts a Layup. Contested by Blake Harden (4.7 feet, MAN). Dirk Lillard misses. Rebound secured by Anthony Durant.

[08:22] Team_010 possession (Score: 46-40)
Draymond Leonard attempts a 3Pt. Contested by Rudy Quickley (3.7 feet, ZONE). Draymond Leonard misses. Rebound secured by LeBron Russell.

[08:08] Team_027 possession (Score: 46-40)
CJ Green attempts a 3Pt. Contested by Draymond Leonard (4.6 feet, MAN). CJ Green misses. Rebound secured by Blake Harden.

[07:57] Team_010 possession (Score: 46-40)
Draymond Leonard attempts a 3Pt. Contested by Rudy Quickley (3.7 feet, ZONE). Draymond Leonard misses. Rebound secured by Ben Stewart.

[07:38] Team_027 possession (Score: 46-40)
CJ Green attempts a 3Pt. Contested by Ben Gilgeous-Alexander (4.7 feet, ZONE). CJ Green misses. Rebound secured by Blake Harden.

[07:22] Team_010 possession (Score: 46-40)
FOUL! Reach-in foul on Ben Stewart during the drive. [Team fouls: 1] No free throws, side out. (Ben Stewart: 1 personal fouls)

[07:12] Team_010 possession (Score: 46-40)
Anthony Durant makes the Midrange and draws the foul on Ben Stewart! And-1! Anthony Durant to the line for 1. [Team fouls: 2] (Ben Stewart: 2 personal fouls)   FT 1/1: GOOD Anthony Durant makes 1/1 from the line.
Score: 46-43

[07:00] Team_027 possession (Score: 46-43)
Rudy Quickley attempts a 3Pt. Contested by Blake Harden (5.1 feet, ZONE). Rudy Quickley misses. Rebound secured by Ben Gilgeous-Alexander.

[06:40] Team_010 possession (Score: 46-43)
Anthony Durant drives, Ben Stewart stays with him. Anthony Durant attempts a Layup. Contested by Ben Stewart (4.9 feet, ZONE). ANTHONY DURANT MAKES IT!
Score: 46-45

[06:26] Team_027 possession (Score: 46-45)
Ben Stewart makes the Layup and draws the foul on Anthony Durant! And-1! Ben Stewart to the line for 1. [Team fouls: 3] (Anthony Durant: 1 personal fouls)   FT 1/1: GOOD Ben Stewart makes 1/1 from the line.
Score: 49-45

[06:08] Team_010 possession (Score: 49-45)
Draymond Leonard makes the Layup and draws the foul on Ben Stewart! And-1! Draymond Leonard to the line for 1. [Team fouls: 3] (Ben Stewart: 3 personal fouls)   FT 1/1: GOOD Draymond Leonard makes 1/1 from the line.
Score: 49-48

[05:53] Team_027 possession (Score: 49-48)
FOUL! Holding foul on Anthony Durant. [Team fouls: 4] No free throws, side out. (Anthony Durant: 2 personal fouls)

[05:35] Team_027 possession (Score: 49-48)
Dirk Lillard makes the Layup and draws the foul on Anthony Durant! And-1! Dirk Lillard to the line for 1. [BONUS: 5 team fouls] (Anthony Durant: 3 personal fouls)   FT 1/1: GOOD Dirk Lillard makes 1/1 from the line.
Score: 52-48

[05:23] Team_010 possession (Score: 52-48)
Vince Ingram attempts a 3Pt. Contested by Rudy Quickley (4.1 feet, ZONE). Vince Ingram misses. Rebound secured by Ben Stewart.

[05:11] Team_027 possession (Score: 52-48)
Ben Stewart drives to the basket... Ben Stewart throws a bad pass out of bounds! TURNOVER! (dead ball)

[05:11] Substitution (Team_010): Anthony Durant OUT → Paolo Wade IN (stamina_rule2)

[04:57] Team_010 possession (Score: 52-48)
Draymond Leonard attempts a Midrange. Contested by LeBron Russell (5.8 feet, ZONE). Draymond Leonard misses. Rebound secured by LeBron Russell.

[04:42] Team_027 possession (Score: 52-48)
LeBron Russell attempts a 3Pt. Contested by Vince Ingram (5.5 feet, MAN). LeBron Russell misses. Rebound secured by Blake Harden.

[04:26] Team_010 possession (Score: 52-48)
Blake Harden attempts a 3Pt. Contested by Dirk Lillard (3.9 feet, MAN). BLAKE HARDEN MAKES IT! Assist: Draymond Leonard
Score: 52-51

[04:09] Team_027 possession (Score: 52-51)
Rudy Quickley drives, Ben Gilgeous-Alexander stays with him. Rudy Quickley attempts a Layup. Contested by Ben Gilgeous-Alexander (5.1 feet, MAN). Rudy Quickley misses. Rebound secured by Paolo Wade.

[03:55] Team_010 possession (Score: 52-51)
Blake Harden drives and kicks out. Ben Gilgeous-Alexander attempts a Midrange. Contested by Rudy Quickley (3.4 feet, MAN). Ben Gilgeous-Alexander misses. Rebound secured by LeBron Russell.

[03:39] Team_027 possession (Score: 52-51)
LeBron Russell attempts a Midrange. Contested by Ben Gilgeous-Alexander (4.7 feet, ZONE). LeBron Russell misses. Offensive rebound by Dirk Lillard! Dirk Lillard kicks it out.

[03:27] Team_027 possession (Score: 52-51)
Rudy Quickley attempts a Midrange. Wide open! Vince Ingram is 6.0 feet away. [ZONE] Rudy Quickley misses. Offensive rebound by Dirk Lillard! Dirk Lillard kicks it out.

[03:12] Team_027 possession (Score: 52-51)
Dirk Lillard attempts a 3Pt. Contested by Blake Harden (4.8 feet, MAN). Dirk Lillard misses. Rebound secured by Ben Gilgeous-Alexander.

[02:58] Team_010 possession (Score: 52-51)
FOUL! Holding foul on Ben Stewart. [Team fouls: 4] No free throws, side out. (Ben Stewart: 4 personal fouls)

[02:43] Team_010 possession (Score: 52-51)
FOUL! Reach-in foul on Ben Stewart during the drive. [IN THE BONUS! 5 team fouls] Blake Harden to the line for 2 free throws. (Ben Stewart: 5 personal fouls)   FT 1/2: GOOD   FT 2/2: GOOD Blake Harden makes 2/2 from the line.
Score: 52-53

[02:28] Team_027 possession (Score: 52-53)
Ben Stewart attempts a Midrange. Contested by Paolo Wade (5.0 feet, MAN). BEN STEWART MAKES IT! Assist: Rudy Quickley
Score: 54-53

[02:10] Team_010 possession (Score: 54-53)
Ben Gilgeous-Alexander drives and kicks out. Vince Ingram attempts a 3Pt. Contested by LeBron Russell (5.7 feet, MAN). Vince Ingram misses. Offensive rebound by Blake Harden! Blake Harden kicks it out.

[01:54] Team_010 possession (Score: 54-53)
Paolo Wade attempts a 3Pt. Contested by Ben Stewart (5.2 feet, MAN). Paolo Wade misses. Offensive rebound by Blake Harden! Blake Harden kicks it out.

[01:35] Team_010 possession (Score: 54-53)
Paolo Wade drives to the basket... Paolo Wade throws a bad pass out of bounds! TURNOVER! (dead ball)

[01:22] Team_027 possession (Score: 54-53)
CJ Green attempts a 3Pt. Contested by Draymond Leonard (5.3 feet, MAN). CJ Green misses. Rebound secured by Paolo Wade.

[01:07] Team_010 possession (Score: 54-53)
Draymond Leonard attempts a 3Pt. Contested by CJ Green (5.7 feet, MAN). DRAYMOND LEONARD MAKES IT! Assist: Paolo Wade
Score: 54-56

[00:50] Team_027 possession (Score: 54-56)
Ben Stewart attempts a Layup. Contested by Paolo Wade (5.0 feet, MAN). BEN STEWART MAKES IT!
Score: 56-56

[00:35] Team_010 possession (Score: 56-56)
Blake Harden loses control! Ball rolls out of bounds! TURNOVER! (dead ball)

[00:19] Team_027 possession (Score: 56-56)
Ben Stewart drives, picks up Paolo Wade. Help arrives from Blake Harden! Ben Stewart attempts a Dunk. Contested by Blake Harden (5.0 feet, ZONE). Ben Stewart misses. Rebound secured by Paolo Wade.

[00:05] Team_010 possession (Score: 56-56)
FOUL! Shooting foul on Ben Stewart. Paolo Wade to the line for 2 free throws. [BONUS: 6 team fouls] (Ben Stewart: 6 personal fouls) Ben Stewart FOULS OUT!   FT 1/2: GOOD   FT 2/2: GOOD Paolo Wade makes 2/2 from the line.
Score: 56-58

[00:05] Substitution (Team_027): Ben Stewart OUT (stamina: 65) → Tim Johnson IN (foul_out)

================================================================================
                              2ND QUARTER COMPLETE                              
================================================================================

2ND QUARTER SCORE: Team_027 19, Team_010 26

BOX SCORE:
================================================================================

Team_027
--------------------------------------------------------------------------------
Player                MIN  PTS  REB  AST  TO      FG   FG%      3P   3P%
--------------------------------------------------------------------------------
Ben Stewart            12   10    3    0   0   4/5    80.0     0/0   0.0
LeBron Russell         12    3    3    1   0   1/3    33.3     0/0   0.0
Dirk Lillard           12    3    2    1   0   1/4    25.0     0/0   0.0
CJ Green               12    3    0    0   0   1/5    20.0     0/0   0.0
Rudy Quickley          12    0    0    1   0   0/2     0.0     0/0   0.0

TEAM: FG: 7/19 (36.8%), 3PT: 1/8 (12.5%), REB: 8 (2 off, 6 def), AST: 3, TO: 2
TEAM FOULS: 6 [Team_010 in BONUS]


Team_010
--------------------------------------------------------------------------------
Player                MIN  PTS  REB  AST  TO      FG   FG%      3P   3P%
--------------------------------------------------------------------------------
Blake Harden           12    8    7    0   0   3/4    75.0     0/0   0.0
Anthony Durant         15    7    2    1   0   3/3   100.0     0/0   0.0
Draymond Leonard       16    6    0    1   0   2/5    40.0     0/0   0.0
Vince Ingram           12    3    0    0   0   1/2    50.0     0/0   0.0
Paolo Wade              5    2    3    1   0   1/1   100.0     0/0   0.0
Ben Gilgeous-Alexander   12    0    2    1   0   0/1     0.0     0/0   0.0

TEAM: FG: 10/16 (62.5%), 3PT: 3/7 (42.9%), REB: 14 (2 off, 12 def), AST: 4, TO: 5
TEAM FOULS: 5 [Team_027 in BONUS]

================================================================================

================================================================================
                       3RD QUARTER - Team_027 vs Team_010                       
================================================================================

[12:00] Team_027 possession (Score: 56-58)
Tim Johnson attempts a 3Pt. Contested by Cade Morant (4.2 feet, ZONE). Tim Johnson misses. Rebound secured by Desmond Antetokounmpo.

[11:47] Team_010 possession (Score: 56-58)
Anthony Durant drives, John Russell stays with him. Anthony Durant attempts a Layup. Contested by John Russell (4.2 feet, MAN). ANTHONY DURANT MAKES IT!
Score: 56-60

[11:31] Team_027 possession (Score: 56-60)
Scottie Harden attempts a 3Pt. Contested by RJ Young (4.8 feet, MAN). SCOTTIE HARDEN MAKES IT! Assist: Tony Doncic
Score: 59-60

[11:16] Team_010 possession (Score: 59-60)
Cade Morant attempts a 3Pt. Contested by Tim Johnson (5.4 feet, MAN). CADE MORANT MAKES IT! Assist: RJ Young
Score: 59-63

[11:05] Team_027 possession (Score: 59-63)
John Russell makes the Midrange and draws the foul on Anthony Durant! And-1! John Russell to the line for 1. [Team fouls: 1] (Anthony Durant: 1 personal fouls)   FT 1/1: GOOD John Russell makes 1/1 from the line.
Score: 62-63

[10:48] Team_010 possession (Score: 62-63)
Anthony Durant attempts a Layup. Contested by John Russell (4.2 feet, MAN). Anthony Durant misses. Rebound secured by John Russell.

[10:34] Team_027 possession (Score: 62-63)
John Russell attempts a Midrange. Contested by Desmond Antetokounmpo (5.0 feet, ZONE). John Russell misses. Offensive rebound by John Russell! John Russell puts it back in!
Score: 64-63

[10:23] Team_010 possession (Score: 64-63)
RJ Young drives to the basket... RJ Young commits a violation (traveling/carry)! TURNOVER! (dead ball)

[10:08] Team_027 possession (Score: 64-63)
Bradley Dosunmu attempts a 3Pt. Contested by Cade Morant (4.0 feet, ZONE). Bradley Dosunmu misses. Rebound secured by Cade Morant.

[09:54] Team_010 possession (Score: 64-63)
RJ Young drives, John Russell stays with him. RJ Young attempts a Dunk. Contested by John Russell (3.7 feet, ZONE). RJ Young misses. Rebound secured by John Russell.

[09:39] Team_027 possession (Score: 64-63)
Scottie Harden attempts a 3Pt. Contested by Cade Morant (4.0 feet, ZONE). SCOTTIE HARDEN MAKES IT! Assist: Bradley Dosunmu
Score: 67-63

[09:25] Team_010 possession (Score: 67-63)
Cade Morant attempts a 3Pt. Contested by Tim Johnson (5.4 feet, MAN). Cade Morant misses. Rebound secured by Bradley Dosunmu.

[09:11] Team_027 possession (Score: 67-63)
Scottie Harden drives and kicks out. Tim Johnson attempts a 3Pt. Contested by Cade Morant (3.9 feet, MAN). Tim Johnson misses. Rebound secured by Desmond Antetokounmpo.

[08:59] Team_010 possession (Score: 67-63)
Anthony Durant attempts a Midrange. Contested by John Russell (4.2 feet, MAN). Anthony Durant misses. Rebound secured by Bradley Dosunmu.

[08:48] Team_027 possession (Score: 67-63)
Scottie Harden makes the Dunk and draws the foul on RJ Young! And-1! Scottie Harden to the line for 1. [Team fouls: 2] (RJ Young: 1 personal fouls)   FT 1/1: MISS Scottie Harden makes 0/1 from the line. Offensive rebound by John Russell! John Russell's putback is no good.
Score: 69-63

[08:33] Team_010 possession (Score: 69-63)
Anthony Durant attempts a 3Pt. Contested by John Russell (4.2 feet, MAN). Anthony Durant misses. Rebound secured by Tony Doncic.

[08:16] Team_027 possession (Score: 69-63)
Bradley Dosunmu drives, Desmond Antetokounmpo stays with him. Bradley Dosunmu attempts a Layup. Contested by Desmond Antetokounmpo (4.3 feet, MAN). Bradley Dosunmu misses. FOUL! Loose ball foul on Cade Morant during the rebound battle. [Team fouls: 3] No free throws, side out. (Cade Morant: 1 personal fouls)

[07:59] Team_027 possession (Score: 69-63)
John Russell attempts a 3Pt. Contested by Cade Morant (4.7 feet, ZONE). John Russell misses. Rebound secured by Desmond Antetokounmpo.

[07:45] Team_010 possession (Score: 69-63)
Desmond Antetokounmpo drives, Bradley Dosunmu stays with him. Desmond Antetokounmpo attempts a Layup. Contested by Bradley Dosunmu (4.5 feet, MAN). DESMOND ANTETOKOUNMPO MAKES IT! Assist: RJ Young
Score: 69-65

[07:30] Team_027 possession (Score: 69-65)
John Russell drives, picks up Anthony Durant. Help arrives from Cade Morant! John Russell attempts a Layup. Contested by Cade Morant (4.3 feet, MAN). JOHN RUSSELL MAKES IT! Assist: Scottie Harden
Score: 71-65

[07:16] Team_010 possession (Score: 71-65)
Michael Turner attempts a Midrange. Contested by Tony Doncic (4.2 feet, MAN). Michael Turner misses. Rebound secured by Bradley Dosunmu.

[07:03] Team_027 possession (Score: 71-65)
Scottie Harden attempts a 3Pt. Contested by Cade Morant (4.0 feet, ZONE). Scottie Harden misses. Rebound secured by Anthony Durant.

[06:45] Team_010 possession (Score: 71-65)
Anthony Durant attempts a Layup. Contested by John Russell (4.2 feet, ZONE). Anthony Durant misses. Offensive rebound by Cade Morant! Cade Morant kicks it out.

[06:27] Team_010 possession (Score: 71-65)
Anthony Durant attempts a Midrange. Contested by John Russell (4.2 feet, MAN). ANTHONY DURANT MAKES IT!
Score: 71-67

[06:14] Team_027 possession (Score: 71-67)
Tony Doncic attempts a 3Pt. Contested by Cade Morant (4.0 feet, ZONE). Tony Doncic misses. FOUL! Loose ball foul on Desmond Antetokounmpo during the rebound battle. [Team fouls: 4] No free throws, side out. (Desmond Antetokounmpo: 1 personal fouls)

[06:03] Team_027 possession (Score: 71-67)
Scottie Harden drives, picks up RJ Young. Help arrives from Cade Morant! Scottie Harden attempts a Dunk. Contested by Cade Morant (4.8 feet, MAN). SCOTTIE HARDEN MAKES IT! Assist: Tim Johnson
Score: 73-67

[05:44] Team_010 possession (Score: 73-67)
FOUL! Shooting foul on Tim Johnson. Desmond Antetokounmpo to the line for 3 free throws. [Team fouls: 1] (Tim Johnson: 1 personal fouls)   FT 1/3: GOOD   FT 2/3: GOOD   FT 3/3: GOOD Desmond Antetokounmpo makes 3/3 from the line.
Score: 73-70

[05:29] Team_027 possession (Score: 73-70)
Bradley Dosunmu attempts a Midrange. Contested by Desmond Antetokounmpo (4.3 feet, MAN). BRADLEY DOSUNMU MAKES IT!
Score: 75-70

[05:12] Team_010 possession (Score: 75-70)
Michael Turner drives, John Russell stays with him. Michael Turner attempts a Layup. Contested by John Russell (4.2 feet, ZONE). Michael Turner misses. Rebound secured by John Russell.

[04:56] Team_027 possession (Score: 75-70)
Tim Johnson attempts a Midrange. Contested by Cade Morant (4.2 feet, MAN). Tim Johnson misses. Rebound secured by Michael Turner.

[04:45] Team_010 possession (Score: 75-70)
RJ Young attempts a Midrange. Contested by Scottie Harden (4.4 feet, ZONE). RJ Young misses. Rebound secured by John Russell.

[04:28] Team_027 possession (Score: 75-70)
Tim Johnson attempts a 3Pt. Contested by Cade Morant (4.3 feet, MAN). Tim Johnson misses. Offensive rebound by Bradley Dosunmu! Bradley Dosunmu kicks it out.

[04:10] Team_027 possession (Score: 75-70)
Bradley Dosunmu drives, Desmond Antetokounmpo stays with him. Bradley Dosunmu attempts a Layup. Contested by Desmond Antetokounmpo (4.4 feet, MAN). BRADLEY DOSUNMU MAKES IT! Assist: John Russell
Score: 77-70

[03:55] Team_010 possession (Score: 77-70)
Anthony Durant drives, John Russell stays with him. Anthony Durant attempts a Layup. Contested by John Russell (4.4 feet, ZONE). Anthony Durant misses. Rebound secured by John Russell.

[03:41] Team_027 possession (Score: 77-70)
Tony Doncic attempts a 3Pt. Contested by Cade Morant (4.2 feet, ZONE). Tony Doncic misses. Offensive rebound by Bradley Dosunmu! Bradley Dosunmu kicks it out.

[03:25] Team_027 possession (Score: 77-70)
Tony Doncic attempts a 3Pt. Contested by Michael Turner (4.3 feet, MAN). TONY DONCIC MAKES IT! Assist: John Russell
Score: 80-70

[03:10] Team_010 possession (Score: 80-70)
Michael Turner attempts a 3Pt. Contested by Tim Johnson (5.3 feet, ZONE). MICHAEL TURNER MAKES IT! Assist: Cade Morant
Score: 80-73

[02:55] Team_027 possession (Score: 80-73)
Bradley Dosunmu attempts a 3Pt. Contested by Desmond Antetokounmpo (4.5 feet, MAN). BRADLEY DOSUNMU MAKES IT! Assist: Tony Doncic
Score: 83-73

[02:41] Team_010 possession (Score: 83-73)
Michael Turner attempts a 3Pt. Contested by Bradley Dosunmu (4.8 feet, ZONE). Michael Turner misses. FOUL! Loose ball foul on Tony Doncic during the rebound battle. [Team fouls: 2] No free throws, side out. (Tony Doncic: 1 personal fouls)

[02:27] Team_010 possession (Score: 83-73)
Desmond Antetokounmpo attempts a 3Pt. Contested by Tim Johnson (5.3 feet, ZONE). Desmond Antetokounmpo misses. Offensive rebound by Anthony Durant! Anthony Durant kicks it out.

[02:11] Team_010 possession (Score: 83-73)
Desmond Antetokounmpo attempts a Midrange. Contested by Bradley Dosunmu (4.8 feet, MAN). Desmond Antetokounmpo misses. Rebound secured by Tony Doncic.

[02:00] Team_027 possession (Score: 83-73)
Bradley Dosunmu throws a bad pass out of bounds! TURNOVER! (dead ball)

[02:00] Substitution (Team_027): Tim Johnson OUT → CJ Green IN (stamina_rule2)

[02:00] Substitution (Team_027): Scottie Harden OUT → Rudy Quickley IN (stamina_rule2)

[02:00] Substitution (Team_027): Bradley Dosunmu OUT → LeBron Russell IN (stamina_rule2)

[02:00] Substitution (Team_027): John Russell OUT → Ben Stewart IN (stamina_rule2)

[02:00] Substitution (Team_010): Cade Morant OUT → Draymond Leonard IN (stamina_rule2)

[02:00] Substitution (Team_010): Michael Turner OUT → Blake Harden IN (stamina_rule2)

[02:00] Substitution (Team_010): RJ Young OUT → Ben Gilgeous-Alexander IN (stamina_rule2)

[02:00] Substitution (Team_010): Desmond Antetokounmpo OUT → Vince Ingram IN (stamina_rule2)

[02:00] Substitution (Team_010): Anthony Durant OUT → Paolo Wade IN (stamina_rule2)

[01:46] Team_010 possession (Score: 83-73)
Blake Harden attempts a 3Pt. Contested by Rudy Quickley (3.0 feet, ZONE). Blake Harden misses. Rebound secured by Ben Stewart.

[01:30] Team_027 possession (Score: 83-73)
Tony Doncic attempts a Midrange. Contested by Ben Gilgeous-Alexander (4.7 feet, ZONE). Tony Doncic misses. Rebound secured by Ben Gilgeous-Alexander.

[01:15] Team_010 possession (Score: 83-73)
Blake Harden drives and kicks out. Ben Gilgeous-Alexander attempts a 3Pt. Contested by Rudy Quickley (3.3 feet, MAN). BEN GILGEOUS-ALEXANDER MAKES IT! Assist: Vince Ingram
Score: 83-76

[01:05] Team_027 possession (Score: 83-76)
Rudy Quickley attempts a Midrange. Contested by Ben Gilgeous-Alexander (5.0 feet, MAN). RUDY QUICKLEY MAKES IT! Assist: LeBron Russell
Score: 85-76

[00:48] Team_010 possession (Score: 85-76)
Vince Ingram drives, picks up LeBron Russell. Help arrives from Tony Doncic! Vince Ingram attempts a Dunk. Wide open! Tony Doncic is 6.2 feet away. [MAN] VINCE INGRAM MAKES IT! Assist: Draymond Leonard
Score: 85-78

[00:37] Team_027 possession (Score: 85-78)
Rudy Quickley attempts a 3Pt. Contested by Ben Gilgeous-Alexander (5.0 feet, MAN). Rudy Quickley misses. Rebound secured by Ben Gilgeous-Alexander.

[00:22] Team_010 possession (Score: 85-78)
Paolo Wade attempts a Midrange. Contested by Rudy Quickley (3.5 feet, ZONE). PAOLO WADE MAKES IT!
Score: 85-80

[00:08] Team_027 possession (Score: 85-80)
LeBron Russell drives, Paolo Wade stays with him. LeBron Russell attempts a Layup. Contested by Paolo Wade (5.1 feet, ZONE). LeBron Russell misses. Rebound secured by Blake Harden.

================================================================================
                              3RD QUARTER COMPLETE                              
================================================================================

3RD QUARTER SCORE: Team_027 29, Team_010 22

BOX SCORE:
================================================================================

Team_027
--------------------------------------------------------------------------------
Player                MIN  PTS  REB  AST  TO      FG   FG%      3P   3P%
--------------------------------------------------------------------------------
Scottie Harden         22    8    0    1   0   3/6    50.0     0/0   0.0
John Russell           22    7    7    2   0   3/4    75.0     0/0   0.0
Bradley Dosunmu        22    7    7    1   0   3/4    75.0     0/0   0.0
Tony Doncic            24    3    2    2   0   1/2    50.0     0/0   0.0
Rudy Quickley          14    2    0    0   0   1/2    50.0     0/0   0.0
Tim Johnson            22    0    0    1   0   0/2     0.0     0/0   0.0
Ben Stewart            14    0    1    0   0   0/0     0.0     0/0   0.0
LeBron Russell         14    0    0    1   0   0/1     0.0     0/0   0.0

TEAM: FG: 11/21 (52.4%), 3PT: 4/9 (44.4%), REB: 16 (5 off, 11 def), AST: 8, TO: 1
TEAM FOULS: 2


Team_010
--------------------------------------------------------------------------------
Player                MIN  PTS  REB  AST  TO      FG   FG%      3P   3P%
--------------------------------------------------------------------------------
Desmond Antetokounmpo   22    5    3    0   0   2/3    66.7     0/0   0.0
Anthony Durant         25    4    3    0   0   2/6    33.3     0/0   0.0
Cade Morant            22    3    2    1   0   1/2    50.0     0/0   0.0
Michael Turner         22    3    1    0   0   1/3    33.3     0/0   0.0
Ben Gilgeous-Alexander   14    3    2    0   0   1/1   100.0     0/0   0.0
Vince Ingram           14    2    0    1   0   1/1   100.0     0/0   0.0
Paolo Wade              7    2    0    0   0   1/1   100.0     0/0   0.0
RJ Young               22    0    0    2   0   0/2     0.0     0/0   0.0
Blake Harden           14    0    1    0   0   0/1     0.0     0/0   0.0
Draymond Leonard       18    0    0    1   0   0/0     0.0     0/0   0.0

TEAM: FG: 9/20 (45.0%), 3PT: 3/6 (50.0%), REB: 13 (3 off, 10 def), AST: 5, TO: 1
TEAM FOULS: 4

================================================================================

================================================================================
                       4TH QUARTER - Team_027 vs Team_010                       
================================================================================

[12:00] Team_027 possession (Score: 85-80)
Scottie Harden attempts a Midrange. Contested by RJ Young (4.8 feet, MAN). SCOTTIE HARDEN MAKES IT! Assist: Bradley Dosunmu
Score: 87-80

[11:48] Team_010 possession (Score: 87-80)
Michael Turner attempts a Midrange. Contested by Tony Doncic (4.5 feet, MAN). Michael Turner misses. Rebound secured by Bradley Dosunmu.

[11:31] Team_027 possession (Score: 87-80)
Scottie Harden attempts a 3Pt. Contested by RJ Young (4.8 feet, MAN). Scottie Harden misses. FOUL! Loose ball foul on Anthony Durant during the rebound battle. [Team fouls: 1] No free throws, side out. (Anthony Durant: 1 personal fouls)

[11:15] Team_027 possession (Score: 87-80)
Bradley Dosunmu makes the Layup and draws the foul on Desmond Antetokounmpo! And-1! Bradley Dosunmu to the line for 1. [Team fouls: 2] (Desmond Antetokounmpo: 1 personal fouls)   FT 1/1: MISS Bradley Dosunmu makes 0/1 from the line. Rebound secured by Anthony Durant.
Score: 89-80

[11:03] Team_010 possession (Score: 89-80)
Cade Morant drives, Tim Johnson stays with him. Cade Morant attempts a Layup. Contested by Tim Johnson (5.5 feet, MAN). CADE MORANT MAKES IT! Assist: Desmond Antetokounmpo
Score: 89-82

[10:48] Team_027 possession (Score: 89-82)
Scottie Harden attempts a 3Pt. Contested by RJ Young (4.9 feet, MAN). Scottie Harden misses. Rebound secured by Michael Turner.

[10:33] Team_010 possession (Score: 89-82)
Anthony Durant drives, John Russell stays with him. Anthony Durant attempts a Layup. Contested by John Russell (4.4 feet, ZONE). ANTHONY DURANT MAKES IT! Assist: RJ Young
Score: 89-84

[10:15] Team_027 possession (Score: 89-84)
Bradley Dosunmu drives to the basket... Bradley Dosunmu throws a bad pass! Stolen by Desmond Antetokounmpo! TURNOVER! (live ball)

[09:59] Team_010 possession (Score: 89-84)
RJ Young attempts a 3Pt. Contested by Scottie Harden (4.6 feet, MAN). RJ Young misses. Rebound secured by Tony Doncic.

[09:47] Team_027 possession (Score: 89-84)
FOUL! Reach-in foul on Anthony Durant during the drive. [Team fouls: 3] No free throws, side out. (Anthony Durant: 2 personal fouls)

[09:34] Team_027 possession (Score: 89-84)
Tim Johnson loses the ball! Stripped by Cade Morant! TURNOVER! (live ball)

[09:21] Team_010 possession (Score: 89-84)
Anthony Durant attempts a Layup. BLOCKED BY JOHN RUSSELL! Ball deflects out of bounds off Anthony Durant.

[09:06] Team_027 possession (Score: 89-84)
Scottie Harden attempts a Layup. BLOCKED BY CADE MORANT! Ball is loose! Rebound secured by Anthony Durant.

[08:50] Team_010 possession (Score: 89-84)
Michael Turner makes the Layup and draws the foul on Tony Doncic! And-1! Michael Turner to the line for 1. [Team fouls: 1] (Tony Doncic: 1 personal fouls)   FT 1/1: GOOD Michael Turner makes 1/1 from the line.
Score: 89-87

[08:31] Team_027 possession (Score: 89-87)
Tim Johnson attempts a Layup. Contested by Anthony Durant (4.2 feet, ZONE). TIM JOHNSON MAKES IT! Assist: Tony Doncic
Score: 91-87

[08:16] Team_010 possession (Score: 91-87)
Cade Morant attempts a 3Pt. Contested by Tim Johnson (5.8 feet, ZONE). Cade Morant misses. Offensive rebound by Cade Morant! Cade Morant kicks it out.

[08:03] Team_010 possession (Score: 91-87)
FOUL! Holding foul on Tony Doncic. [Team fouls: 2] No free throws, side out. (Tony Doncic: 2 personal fouls)

[07:49] Team_010 possession (Score: 91-87)
RJ Young throws a bad pass out of bounds! TURNOVER! (dead ball)

[07:49] Substitution (Team_027): Tim Johnson OUT → CJ Green IN (stamina_rule2)

[07:49] Substitution (Team_027): Tony Doncic OUT → Dirk Lillard IN (stamina_rule2)

[07:49] Substitution (Team_027): Scottie Harden OUT → Rudy Quickley IN (stamina_rule2)

[07:49] Substitution (Team_027): Bradley Dosunmu OUT → LeBron Russell IN (stamina_rule2)

[07:49] Substitution (Team_027): John Russell OUT → Ben Stewart IN (stamina_rule2)

[07:49] Substitution (Team_010): Cade Morant OUT → Draymond Leonard IN (stamina_rule2)

[07:49] Substitution (Team_010): Michael Turner OUT → Blake Harden IN (stamina_rule2)

[07:49] Substitution (Team_010): RJ Young OUT → Ben Gilgeous-Alexander IN (stamina_rule2)

[07:49] Substitution (Team_010): Desmond Antetokounmpo OUT → Vince Ingram IN (stamina_rule2)

[07:49] Substitution (Team_010): Anthony Durant OUT → Paolo Wade IN (stamina_rule2)

[07:36] Team_027 possession (Score: 91-87)
Rudy Quickley attempts a 3Pt. Contested by Draymond Leonard (4.9 feet, ZONE). Rudy Quickley misses. Rebound secured by Ben Gilgeous-Alexander.

[07:26] Team_010 possession (Score: 91-87)
Draymond Leonard makes the Midrange and draws the foul on Rudy Quickley! And-1! Draymond Leonard to the line for 1. [Team fouls: 3] (Rudy Quickley: 1 personal fouls)   FT 1/1: GOOD Draymond Leonard makes 1/1 from the line.
Score: 91-90

[07:07] Team_027 possession (Score: 91-90)
FOUL! Reach-in foul on Paolo Wade during the drive. [Team fouls: 4] No free throws, side out. (Paolo Wade: 1 personal fouls)

[06:50] Team_027 possession (Score: 91-90)
CJ Green drives to the basket... CJ Green loses control! Ball rolls out of bounds! TURNOVER! (dead ball)

[06:36] Team_010 possession (Score: 91-90)
Draymond Leonard makes the Dunk and draws the foul on Dirk Lillard! And-1! Draymond Leonard to the line for 1. [Team fouls: 4] (Dirk Lillard: 1 personal fouls)   FT 1/1: GOOD Draymond Leonard makes 1/1 from the line.
Score: 91-93

[06:20] Team_027 possession (Score: 91-93)
FOUL! Holding foul on Ben Gilgeous-Alexander. [IN THE BONUS! 5 team fouls] Rudy Quickley to the line for 2 free throws. (Ben Gilgeous-Alexander: 1 personal fouls)   FT 1/2: MISS   FT 2/2: MISS Rudy Quickley makes 0/2 from the line. Rebound secured by Paolo Wade.

[06:01] Team_010 possession (Score: 91-93)
Ben Gilgeous-Alexander attempts a Midrange. Contested by CJ Green (5.3 feet, ZONE). BEN GILGEOUS-ALEXANDER MAKES IT!
Score: 91-95

[05:47] Team_027 possession (Score: 91-95)
Ben Stewart drives, Paolo Wade stays with him. Ben Stewart attempts a Dunk. Contested by Paolo Wade (5.0 feet, MAN). BEN STEWART MAKES IT!
Score: 93-95

[05:35] Team_010 possession (Score: 93-95)
FOUL! Reach-in foul on Ben Stewart during the drive. [IN THE BONUS! 5 team fouls] Paolo Wade to the line for 2 free throws. (Ben Stewart: 1 personal fouls)   FT 1/2: GOOD   FT 2/2: GOOD Paolo Wade makes 2/2 from the line.
Score: 93-97

[05:19] Team_027 possession (Score: 93-97)
FOUL! Holding foul on Blake Harden. [IN THE BONUS! 6 team fouls] Dirk Lillard to the line for 2 free throws. (Blake Harden: 1 personal fouls)   FT 1/2: MISS   FT 2/2: GOOD Dirk Lillard makes 1/2 from the line.
Score: 94-97

[05:05] Team_010 possession (Score: 94-97)
Blake Harden attempts a 3Pt. Contested by Dirk Lillard (3.9 feet, MAN). Blake Harden misses. Offensive rebound by Paolo Wade! Paolo Wade kicks it out.

[04:51] Team_010 possession (Score: 94-97)
Draymond Leonard makes the Layup and draws the foul on Ben Stewart! And-1! Draymond Leonard to the line for 1. [BONUS: 6 team fouls] (Ben Stewart: 2 personal fouls)   FT 1/1: GOOD Draymond Leonard makes 1/1 from the line.
Score: 94-100

[04:40] Team_027 possession (Score: 94-100)
FOUL! Holding foul on Blake Harden. [IN THE BONUS! 7 team fouls] Dirk Lillard to the line for 2 free throws. (Blake Harden: 2 personal fouls)   FT 1/2: GOOD   FT 2/2: GOOD Dirk Lillard makes 2/2 from the line.
Score: 96-100

[04:26] Team_010 possession (Score: 96-100)
Blake Harden drives and kicks out. Draymond Leonard attempts a 3Pt. Contested by CJ Green (5.1 feet, MAN). DRAYMOND LEONARD MAKES IT! Assist: Ben Gilgeous-Alexander
Score: 96-103

[04:11] Team_027 possession (Score: 96-103)
LeBron Russell drives and kicks out. Ben Stewart attempts a 3Pt. Contested by Paolo Wade (5.1 feet, MAN). Ben Stewart misses. Rebound secured by Ben Gilgeous-Alexander.

[03:53] Team_010 possession (Score: 96-103)
Ben Gilgeous-Alexander attempts a 3Pt. Contested by Rudy Quickley (3.6 feet, MAN). Ben Gilgeous-Alexander misses. Offensive rebound by Paolo Wade! Paolo Wade kicks it out.

[03:37] Team_010 possession (Score: 96-103)
Paolo Wade commits a violation (traveling/carry)! TURNOVER! (dead ball)

[03:22] Team_027 possession (Score: 96-103)
FOUL! Shooting foul on Vince Ingram. LeBron Russell to the line for 2 free throws. [BONUS: 8 team fouls] (Vince Ingram: 1 personal fouls)   FT 1/2: MISS   FT 2/2: GOOD LeBron Russell makes 1/2 from the line.
Score: 97-103

[03:08] Team_010 possession (Score: 97-103)
Paolo Wade attempts a Layup. Contested by Ben Stewart (4.9 feet, ZONE). PAOLO WADE MAKES IT!
Score: 97-105

[02:52] Team_027 possession (Score: 97-105)
Dirk Lillard attempts a Layup. Contested by Paolo Wade (5.2 feet, ZONE). DIRK LILLARD MAKES IT! Assist: LeBron Russell
Score: 99-105

[02:35] Team_010 possession (Score: 99-105)
FOUL! Holding foul on Rudy Quickley. [IN THE BONUS! 7 team fouls] Ben Gilgeous-Alexander to the line for 2 free throws. (Rudy Quickley: 2 personal fouls)   FT 1/2: GOOD   FT 2/2: GOOD Ben Gilgeous-Alexander makes 2/2 from the line.
Score: 99-107

[02:19] Team_027 possession (Score: 99-107)
FOUL! Holding foul on Blake Harden. [IN THE BONUS! 9 team fouls] Dirk Lillard to the line for 2 free throws. (Blake Harden: 3 personal fouls)   FT 1/2: GOOD   FT 2/2: GOOD Dirk Lillard makes 2/2 from the line.
Score: 101-107

[02:05] Team_010 possession (Score: 101-107)
Vince Ingram drives, Ben Stewart stays with him. Vince Ingram attempts a Dunk. Contested by Ben Stewart (5.4 feet, ZONE). VINCE INGRAM MAKES IT! Assist: Paolo Wade
Score: 101-109

[01:50] Team_027 possession (Score: 101-109)
LeBron Russell attempts a Midrange. Contested by Vince Ingram (5.5 feet, MAN). LeBron Russell misses. Rebound secured by Blake Harden.

[01:35] Team_010 possession (Score: 101-109)
Blake Harden drives to the basket... FOUL! Offensive foul on Blake Harden! LeBron Russell drew the charge! [Team fouls: 10] (Blake Harden: 4 personal fouls) TURNOVER! (dead ball)

[01:19] Team_027 possession (Score: 101-109)
CJ Green attempts a 3Pt. Contested by Draymond Leonard (4.6 feet, MAN). CJ Green misses. Offensive rebound by Ben Stewart! Ben Stewart puts it back in!
Score: 103-109

[01:08] Team_010 possession (Score: 103-109)
Paolo Wade attempts a Midrange. Contested by Ben Stewart (4.9 feet, MAN). Paolo Wade misses. Rebound secured by LeBron Russell.

[00:52] Team_027 possession (Score: 103-109)
Dirk Lillard attempts a 3Pt. Contested by Draymond Leonard (4.5 feet, ZONE). Dirk Lillard misses. Rebound secured by Blake Harden.

[00:37] Team_010 possession (Score: 103-109)
Blake Harden drives and kicks out. Paolo Wade attempts a 3Pt. Contested by Rudy Quickley (3.4 feet, ZONE). PAOLO WADE MAKES IT! Assist: Ben Gilgeous-Alexander
Score: 103-112

[00:24] Team_027 possession (Score: 103-112)
Rudy Quickley drives, Paolo Wade stays with him. Rudy Quickley attempts a Dunk. Contested by Paolo Wade (5.7 feet, ZONE). Rudy Quickley misses. Rebound secured by Blake Harden.

[00:07] Team_010 possession (Score: 103-112)
Blake Harden attempts a Midrange. Contested by LeBron Russell (5.3 feet, ZONE). Blake Harden misses. Rebound secured by Ben Stewart.

================================================================================
                              4TH QUARTER COMPLETE                              
================================================================================

4TH QUARTER SCORE: Team_027 18, Team_010 32

BOX SCORE:
================================================================================

Team_027
--------------------------------------------------------------------------------
Player                MIN  PTS  REB  AST  TO      FG   FG%      3P   3P%
--------------------------------------------------------------------------------
Dirk Lillard           20    7    0    0   0   4/5    80.0     0/0   0.0
Ben Stewart            22    4    2    0   0   2/2   100.0     0/0   0.0
Scottie Harden         27    2    0    0   0   1/3    33.3     0/0   0.0
Tim Johnson            27    2    0    0   0   1/1   100.0     0/0   0.0
LeBron Russell         22    1    1    1   0   1/3    33.3     0/0   0.0
Bradley Dosunmu        27    0    2    1   0   0/1     0.0     0/0   0.0
Tony Doncic            29    0    1    1   0   0/0     0.0     0/0   0.0
Rudy Quickley          22    0    0    0   0   0/2     0.0     0/0   0.0

TEAM: FG: 9/18 (50.0%), 3PT: 1/4 (25.0%), REB: 6 (2 off, 4 def), AST: 3, TO: 3
TEAM FOULS: 7 [Team_010 in BONUS]


Team_010
--------------------------------------------------------------------------------
Player                MIN  PTS  REB  AST  TO      FG   FG%      3P   3P%
--------------------------------------------------------------------------------
Draymond Leonard       26   12    0    0   0   4/4   100.0     0/0   0.0
Paolo Wade             15    7    3    1   0   3/4    75.0     0/0   0.0
Ben Gilgeous-Alexander   22    4    2    2   0   2/2   100.0     0/0   0.0
Michael Turner         27    3    1    0   0   1/2    50.0     0/0   0.0
Anthony Durant         30    2    2    0   0   1/2    50.0     0/0   0.0
Cade Morant            27    2    1    0   0   1/1   100.0     0/0   0.0
Vince Ingram           22    2    0    0   0   1/1   100.0     0/0   0.0
Desmond Antetokounmpo   27    0    0    1   0   0/0     0.0     0/0   0.0
RJ Young               27    0    0    1   0   0/1     0.0     0/0   0.0
Blake Harden           22    0    3    0   0   0/1     0.0     0/0   0.0

TEAM: FG: 13/18 (72.2%), 3PT: 0/1 (0.0%), REB: 12 (3 off, 9 def), AST: 5, TO: 3
TEAM FOULS: 10 [Team_027 in BONUS]

================================================================================

================================================================================
                               FULL GAME COMPLETE                               
================================================================================

FINAL SCORE: Team_027 103, Team_010 112

SCORING BY QUARTER:
--------------------------------------------------------------------------------
Team                     Q1     Q2     Q3     Q4    FINAL
--------------------------------------------------------------------------------
Team_027                 37     19     29     18      103
Team_010                 32     26     22     32      112
--------------------------------------------------------------------------------

FULL GAME BOX SCORE:
================================================================================

Team_027
--------------------------------------------------------------------------------
Player                MIN  PTS  REB  AST  TO      FG   FG%      3P   3P%      FT STL BLK
--------------------------------------------------------------------------------
Tony Doncic            29    9    5    5   0   4/6    66.7   1/2    50.0   4/4     1   0
Tim Johnson            27   13    0    1   1   7/10   70.0   2/4    50.0   4/5     1   0
Scottie Harden         27   10    0    3   1   4/11   36.4   2/4    50.0   0/2     0   0
Bradley Dosunmu        27   14   13    4   1   4/7    57.1   1/2    50.0   2/4     0   0
John Russell           27   17   10    2   1   7/11   63.6   0/1     0.0   1/1     0   1
CJ Green               22    3    0    0   0   2/6    33.3   2/6    33.3   0/0     0   0
Rudy Quickley          22    2    0    1   1   1/6    16.7   0/3     0.0   0/2     0   0
LeBron Russell         22    4    4    3   0   2/7    28.6   0/1     0.0   2/3     0   0
Ben Stewart            22   14    6    0   1   5/6    83.3   0/0     0.0   1/1     1   0
Dirk Lillard           20   10    2    1   0   2/6    33.3   0/2     0.0   6/7     0   0

TEAM: FG: 41/80 (51.2%), 3PT: 8/25 (32.0%), REB: 40 (13 off, 27 def), AST: 20, TO: 6


Team_010
--------------------------------------------------------------------------------
Player                MIN  PTS  REB  AST  TO      FG   FG%      3P   3P%      FT STL BLK
--------------------------------------------------------------------------------
Anthony Durant         30   18    9    2   0   8/14   57.1   0/1     0.0   2/2     0   0
Cade Morant            27   13    6    2   1   4/6    66.7   2/3    66.7   1/1     1   1
Michael Turner         27   17    2    0   1   6/10   60.0   2/2   100.0   4/5     0   0
RJ Young               27    3    0    3   1   1/7    14.3   0/1     0.0   1/1     0   0
Desmond Antetokounmpo   27    9    6    2   1   6/7    85.7   1/1   100.0   5/5     1   0
Draymond Leonard       26   18    0    2   5   5/8    62.5   1/3    33.3   4/4     0   0
Blake Harden           22    8   11    0   2   5/8    62.5   1/2    50.0   2/2     0   0
Ben Gilgeous-Alexander   22    7    6    3   1   1/2    50.0   0/1     0.0   2/2     0   0
Vince Ingram           22    7    0    1   0   3/4    75.0   1/2    50.0   0/0     0   0
Paolo Wade             15   11    6    2   1   4/5    80.0   0/0     0.0   4/4     0   0

TEAM: FG: 44/72 (61.1%), 3PT: 8/16 (50.0%), REB: 46 (8 off, 38 def), AST: 17, TO: 13

================================================================================
