================================================================================
                        FULL GAME - Team_047 vs Team_076                        
================================================================================

================================================================================
                       1ST QUARTER - Team_047 vs Team_076                       
================================================================================

[12:00] Team_047 possession (Score: 0-0)
De'Aaron Rose attempts a Layup. Contested by Cade Barnes (3.8 feet, ZONE). DE'AARON ROSE MAKES IT! Assist: Myles LaVine
Score: 2-0

[11:46] Team_076 possession (Score: 2-0)
Cade Barnes makes the Dunk and draws the foul on Derrick Irving! And-1! Cade Barnes to the line for 1. [Team fouls: 1] (Derrick Irving: 1 personal fouls)   FT 1/1: GOOD Cade Barnes makes 1/1 from the line.
Score: 2-3

[11:30] Team_047 possession (Score: 2-3)
FOUL! Offensive foul on Josh Harris! Cade Barnes drew the charge! [Team fouls: 2] (Josh Harris: 1 personal fouls) TURNOVER! (dead ball)

[11:18] Team_076 possession (Score: 2-3)
Paul Leonard attempts a Midrange. Contested by Josh Harris (4.5 feet, ZONE). Paul Leonard misses. Offensive rebound by D'Angelo Tatum! D'Angelo Tatum kicks it out.

[11:01] Team_076 possession (Score: 2-3)
D'Angelo Tatum drives, Myles LaVine stays with him. D'Angelo Tatum attempts a Layup. Contested by Myles LaVine (5.4 feet, MAN). D'ANGELO TATUM MAKES IT!
Score: 2-5

[10:43] Team_047 possession (Score: 2-5)
De'Aaron Rose drives to the basket... De'Aaron Rose loses control! Ball rolls out of bounds! TURNOVER! (dead ball)

[10:32] Team_076 possession (Score: 2-5)
Tobias Mitchell attempts a 3Pt. Contested by De'Aaron Rose (4.4 feet, ZONE). Tobias Mitchell misses. Rebound secured by Myles LaVine.

[10:17] Team_047 possession (Score: 2-5)
Derrick Irving attempts a Midrange. Contested by Tobias Mitchell (4.4 feet, MAN). DERRICK IRVING MAKES IT! Assist: De'Aaron Rose
Score: 4-5

[09:58] Team_076 possession (Score: 4-5)
Dejounte LaVine attempts a Midrange. Contested by De'Aaron Rose (3.9 feet, MAN). Dejounte LaVine misses. Rebound secured by Josh Harris.

[09:40] Team_047 possession (Score: 4-5)
Josh Harris attempts a 3Pt. Contested by Cade Barnes (3.8 feet, MAN). Josh Harris misses. Rebound secured by Tobias Mitchell.

[09:25] Team_076 possession (Score: 4-5)
D'Angelo Tatum drives to the basket... D'Angelo Tatum commits a violation (traveling/carry)! TURNOVER! (dead ball)

[09:11] Team_047 possession (Score: 4-5)
Myles LaVine attempts a 3Pt. Contested by Cade Barnes (3.6 feet, ZONE). Myles LaVine misses. Rebound secured by Tobias Mitchell.

[08:55] Team_076 possession (Score: 4-5)
D'Angelo Tatum attempts a Midrange. Contested by Blake Jokic (5.1 feet, ZONE). D'ANGELO TATUM MAKES IT! Assist: Cade Barnes
Score: 4-7

[08:38] Team_047 possession (Score: 4-7)
Blake Jokic attempts a 3Pt. Contested by Paul Leonard (4.9 feet, MAN). Blake Jokic misses. Rebound secured by Cade Barnes.

[08:25] Team_076 possession (Score: 4-7)
Cade Barnes drives, picks up Josh Harris. Help arrives from Derrick Irving! Cade Barnes attempts a Dunk. Contested by Derrick Irving (4.3 feet, MAN). Cade Barnes misses. Rebound secured by Josh Harris.

[08:11] Team_047 possession (Score: 4-7)
Derrick Irving attempts a 3Pt. Contested by Cade Barnes (3.8 feet, ZONE). Derrick Irving misses. FOUL! Loose ball foul on Tobias Mitchell during the rebound battle. [Team fouls: 1] No free throws, side out. (Tobias Mitchell: 1 personal fouls)

[07:57] Team_047 possession (Score: 4-7)
De'Aaron Rose throws a bad pass out of bounds! TURNOVER! (dead ball)

[07:40] Team_076 possession (Score: 4-7)
Dejounte LaVine attempts a 3Pt. Contested by De'Aaron Rose (3.9 feet, MAN). Dejounte LaVine misses. Rebound secured by Derrick Irving.

[07:29] Team_047 possession (Score: 4-7)
De'Aaron Rose drives to the basket... De'Aaron Rose commits a violation (traveling/carry)! TURNOVER! (dead ball)

[07:15] Team_076 possession (Score: 4-7)
Paul Leonard attempts a 3Pt. Contested by De'Aaron Rose (4.3 feet, ZONE). Paul Leonard misses. Rebound secured by Josh Harris.

[07:00] Team_047 possession (Score: 4-7)
Myles LaVine loses control! Ball rolls out of bounds! TURNOVER! (dead ball)

[06:45] Team_076 possession (Score: 4-7)
Tobias Mitchell attempts a 3Pt. Contested by Derrick Irving (5.2 feet, MAN). Tobias Mitchell misses. Rebound secured by Derrick Irving.

[06:32] Team_047 possession (Score: 4-7)
Myles LaVine attempts a Midrange. Contested by D'Angelo Tatum (3.8 feet, MAN). Myles LaVine misses. Rebound secured by Tobias Mitchell.

[06:17] Team_076 possession (Score: 4-7)
Tobias Mitchell drives, Derrick Irving stays with him. Tobias Mitchell attempts a Dunk. Contested by Derrick Irving (5.2 feet, MAN). Tobias Mitchell misses. Rebound secured by Myles LaVine.

[06:06] Team_047 possession (Score: 4-7)
Myles LaVine attempts a Midrange. Contested by Paul Leonard (5.2 feet, ZONE). Myles LaVine misses. Rebound secured by Tobias Mitchell.

[05:53] Team_076 possession (Score: 4-7)
Cade Barnes attempts a 3Pt. Contested by Josh Harris (4.3 feet, MAN). Cade Barnes misses. Rebound secured by Josh Harris.

[05:39] Team_047 possession (Score: 4-7)
Myles LaVine drives to the basket... Myles LaVine throws a bad pass! Stolen by D'Angelo Tatum! TURNOVER! (live ball)

[05:26] Team_076 possession (Score: 4-7)
Paul Leonard drives, picks up Blake Jokic. Help arrives from Derrick Irving! Paul Leonard attempts a Layup. Contested by Derrick Irving (5.2 feet, MAN). PAUL LEONARD MAKES IT!
Score: 4-9

[05:10] Team_047 possession (Score: 4-9)
Josh Harris throws a bad pass! Stolen by Cade Barnes! TURNOVER! (live ball)

[04:54] Team_076 possession (Score: 4-9)
Paul Leonard drives and kicks out. D'Angelo Tatum attempts a 3Pt. Contested by Myles LaVine (5.2 feet, MAN). D'Angelo Tatum misses. Rebound secured by Myles LaVine.

[04:43] Team_047 possession (Score: 4-9)
Myles LaVine drives and kicks out. Derrick Irving attempts a Midrange. Contested by Tobias Mitchell (4.1 feet, MAN). DERRICK IRVING MAKES IT! Assist: Blake Jokic
Score: 6-9

[04:28] Team_076 possession (Score: 6-9)
Cade Barnes attempts a Layup. Contested by Josh Harris (4.4 feet, ZONE). Cade Barnes misses. Offensive rebound by D'Angelo Tatum! D'Angelo Tatum kicks it out.

[04:17] Team_076 possession (Score: 6-9)
Paul Leonard attempts a 3Pt. Contested by Blake Jokic (5.2 feet, MAN). Paul Leonard misses. Rebound secured by Josh Harris.

[04:02] Team_047 possession (Score: 6-9)
Derrick Irving attempts a 3Pt. Contested by Cade Barnes (3.9 feet, ZONE). Derrick Irving misses. Offensive rebound by Josh Harris! Josh Harris kicks it out.

[03:46] Team_047 possession (Score: 6-9)
FOUL! Offensive foul on Myles LaVine! D'Angelo Tatum drew the charge! [Team fouls: 3] (Myles LaVine: 1 personal fouls) TURNOVER! (dead ball)

[03:34] Team_076 possession (Score: 6-9)
Cade Barnes attempts a Midrange. Contested by Josh Harris (4.5 feet, MAN). Cade Barnes misses. Rebound secured by Josh Harris.

[03:21] Team_047 possession (Score: 6-9)
Myles LaVine drives and kicks out. Myles LaVine attempts a 3Pt. Contested by Tobias Mitchell (4.3 feet, ZONE). Myles LaVine misses. Rebound secured by Cade Barnes.

[03:07] Team_076 possession (Score: 6-9)
D'Angelo Tatum drives, Myles LaVine stays with him. D'Angelo Tatum attempts a Layup. Contested by Myles LaVine (5.6 feet, MAN). D'Angelo Tatum misses. Rebound secured by Josh Harris.

[02:53] Team_047 possession (Score: 6-9)
Derrick Irving attempts a Layup. Contested by Tobias Mitchell (4.6 feet, MAN). Derrick Irving misses. Offensive rebound by Josh Harris! Josh Harris kicks it out.

[02:38] Team_047 possession (Score: 6-9)
Derrick Irving attempts a Layup. Contested by Tobias Mitchell (4.7 feet, MAN). Derrick Irving misses. Rebound secured by Cade Barnes.

[02:23] Team_076 possession (Score: 6-9)
Dejounte LaVine drives and kicks out. Dejounte LaVine attempts a 3Pt. Contested by De'Aaron Rose (4.3 feet, MAN). Dejounte LaVine misses. Rebound secured by Myles LaVine.

[02:11] Team_047 possession (Score: 6-9)
Josh Harris makes the Layup and draws the foul on Tobias Mitchell! And-1! Josh Harris to the line for 1. [Team fouls: 2] (Tobias Mitchell: 2 personal fouls)   FT 1/1: GOOD Josh Harris makes 1/1 from the line.
Score: 9-9

[01:57] Team_076 possession (Score: 9-9)
Cade Barnes attempts a Layup. Contested by Myles LaVine (5.6 feet, ZONE). CADE BARNES MAKES IT! Assist: Tobias Mitchell
Score: 9-11

[01:43] Team_047 possession (Score: 9-11)
Myles LaVine makes the Layup and draws the foul on Cade Barnes! And-1! Myles LaVine to the line for 1. [Team fouls: 3] (Cade Barnes: 1 personal fouls)   FT 1/1: MISS Myles LaVine makes 0/1 from the line. Rebound secured by Cade Barnes.
Score: 11-11

[01:33] Team_076 possession (Score: 11-11)
FOUL! Holding foul on Blake Jokic. [Team fouls: 4] No free throws, side out. (Blake Jokic: 1 personal fouls)

[01:18] Team_076 possession (Score: 11-11)
Cade Barnes attempts a Midrange. Contested by Josh Harris (4.7 feet, MAN). Cade Barnes misses. Rebound secured by Derrick Irving.

[01:05] Team_047 possession (Score: 11-11)
Derrick Irving attempts a 3Pt. Contested by Tobias Mitchell (4.8 feet, MAN). Derrick Irving misses. Rebound secured by D'Angelo Tatum.

[00:53] Team_076 possession (Score: 11-11)
Cade Barnes throws a bad pass! Stolen by Josh Harris! TURNOVER! (live ball)

[00:38] Team_047 possession (Score: 11-11)
Derrick Irving attempts a Midrange. Contested by Tobias Mitchell (4.9 feet, MAN). Derrick Irving misses. Rebound secured by Cade Barnes.

[00:20] Team_076 possession (Score: 11-11)
Tobias Mitchell makes the Layup and draws the foul on Josh Harris! And-1! Tobias Mitchell to the line for 1. [BONUS: 5 team fouls] (Josh Harris: 2 personal fouls)   FT 1/1: GOOD Tobias Mitchell makes 1/1 from the line.
Score: 11-14

[00:06] Team_047 possession (Score: 11-14)
Blake Jokic attempts a Midrange. Contested by Paul Leonard (5.4 feet, MAN). BLAKE JOKIC MAKES IT!
Score: 13-14

================================================================================
                              1ST QUARTER COMPLETE                              
================================================================================

1ST QUARTER SCORE: Team_047 13, Team_076 14

BOX SCORE:
================================================================================

Team_047
--------------------------------------------------------------------------------
Player                MIN  PTS  REB  AST  TO      FG   FG%      3P   3P%
--------------------------------------------------------------------------------
Derrick Irving         12    4    3    0   0   2/5    40.0     0/0   0.0
Josh Harris            12    3   10    0   0   1/2    50.0     0/0   0.0
De'Aaron Rose          12    2    0    1   0   1/1   100.0     0/0   0.0
Blake Jokic            12    2    0    1   0   1/2    50.0     0/0   0.0
Myles LaVine           12    0    4    1   0   0/5     0.0     0/0   0.0

TEAM: FG: 5/15 (33.3%), 3PT: 0/4 (0.0%), REB: 17 (3 off, 14 def), AST: 3, TO: 8
TEAM FOULS: 5 [Team_076 in BONUS]


Team_076
--------------------------------------------------------------------------------
Player                MIN  PTS  REB  AST  TO      FG   FG%      3P   3P%
--------------------------------------------------------------------------------
Cade Barnes            12    5    5    1   0   2/6    33.3     0/0   0.0
D'Angelo Tatum         12    4    3    0   0   2/3    66.7     0/0   0.0
Tobias Mitchell        12    3    4    1   0   1/4    25.0     0/0   0.0
Paul Leonard           12    2    0    0   0   1/4    25.0     0/0   0.0
Dejounte LaVine        12    0    0    0   0   0/3     0.0     0/0   0.0

TEAM: FG: 6/20 (30.0%), 3PT: 0/6 (0.0%), REB: 12 (2 off, 10 def), AST: 2, TO: 2
TEAM FOULS: 3

================================================================================

================================================================================
                       2ND QUARTER - Team_047 vs Team_076                       
================================================================================

[12:00] Team_047 possession (Score: 13-14)
Josh Harris attempts a 3Pt. Contested by Cade Barnes (4.1 feet, ZONE). Josh Harris misses. Rebound secured by Cade Barnes.

[11:45] Team_076 possession (Score: 13-14)
Paul Leonard attempts a Layup. Contested by Josh Harris (4.8 feet, ZONE). PAUL LEONARD MAKES IT! Assist: D'Angelo Tatum
Score: 13-16

[11:32] Team_047 possession (Score: 13-16)
Blake Jokic drives, Cade Barnes stays with him. Blake Jokic attempts a Dunk. Contested by Cade Barnes (3.7 feet, ZONE). Blake Jokic misses. Offensive rebound by Josh Harris! Josh Harris kicks it out.

[11:15] Team_047 possession (Score: 13-16)
Josh Harris attempts a Midrange. Contested by Paul Leonard (5.7 feet, ZONE). JOSH HARRIS MAKES IT!
Score: 15-16

[11:03] Team_076 possession (Score: 15-16)
Dejounte LaVine loses the ball! Stripped by De'Aaron Rose! TURNOVER! (live ball)

[10:50] Team_047 possession (Score: 15-16)
De'Aaron Rose drives and kicks out. FOUL! Shooting foul on D'Angelo Tatum. Myles LaVine to the line for 3 free throws. [Team fouls: 1] (D'Angelo Tatum: 1 personal fouls)   FT 1/3: GOOD   FT 2/3: GOOD   FT 3/3: GOOD Myles LaVine makes 3/3 from the line.
Score: 18-16

[10:34] Team_076 possession (Score: 18-16)
Cade Barnes attempts a 3Pt. Contested by De'Aaron Rose (4.6 feet, ZONE). Cade Barnes misses. Rebound secured by Josh Harris.

[10:21] Team_047 possession (Score: 18-16)
De'Aaron Rose drives, Cade Barnes stays with him. De'Aaron Rose attempts a Layup. Contested by Cade Barnes (4.3 feet, ZONE). De'Aaron Rose misses. Rebound secured by D'Angelo Tatum.

[10:08] Team_076 possession (Score: 18-16)
Tobias Mitchell drives and kicks out. Cade Barnes attempts a Midrange. Contested by Josh Harris (4.8 feet, ZONE). Cade Barnes misses. Rebound secured by Myles LaVine.

[09:53] Team_047 possession (Score: 18-16)
Blake Jokic attempts a Layup. BLOCKED BY TOBIAS MITCHELL! Ball is loose! Rebound secured by D'Angelo Tatum.

[09:39] Team_076 possession (Score: 18-16)
Tobias Mitchell drives, picks up Derrick Irving. Help arrives from Blake Jokic! Tobias Mitchell attempts a Dunk. Contested by Blake Jokic (5.7 feet, MAN). Tobias Mitchell misses. Offensive rebound by Cade Barnes! Cade Barnes kicks it out.

[09:25] Team_076 possession (Score: 18-16)
FOUL! Reach-in foul on Josh Harris during the drive. [Team fouls: 1] No free throws, side out. (Josh Harris: 1 personal fouls)

[09:10] Team_076 possession (Score: 18-16)
Cade Barnes attempts a Midrange. Contested by Josh Harris (5.0 feet, MAN). CADE BARNES MAKES IT!
Score: 18-18

[08:55] Team_047 possession (Score: 18-18)
Blake Jokic attempts a Layup. Contested by Cade Barnes (4.1 feet, ZONE). BLAKE JOKIC MAKES IT! Assist: Derrick Irving
Score: 20-18

[08:39] Team_076 possession (Score: 20-18)
Dejounte LaVine drives, picks up De'Aaron Rose. Help arrives from Blake Jokic! Dejounte LaVine attempts a Layup. Contested by Blake Jokic (4.6 feet, MAN). DEJOUNTE LAVINE MAKES IT! Assist: Paul Leonard
Score: 20-20

[08:27] Team_047 possession (Score: 20-20)
Derrick Irving attempts a 3Pt. Contested by Cade Barnes (4.6 feet, ZONE). Derrick Irving misses. Rebound secured by Cade Barnes.

[08:09] Team_076 possession (Score: 20-20)
Paul Leonard makes the 3Pt and draws the foul on Blake Jokic! And-1! Paul Leonard to the line for 1. [Team fouls: 2] (Blake Jokic: 1 personal fouls)   FT 1/1: GOOD Paul Leonard makes 1/1 from the line.
Score: 20-24

[07:55] Team_047 possession (Score: 20-24)
FOUL! Holding foul on D'Angelo Tatum. [Team fouls: 2] No free throws, side out. (D'Angelo Tatum: 2 personal fouls)

[07:37] Team_047 possession (Score: 20-24)
Derrick Irving attempts a Layup. Contested by Cade Barnes (4.7 feet, ZONE). DERRICK IRVING MAKES IT! Assist: De'Aaron Rose
Score: 22-24

[07:24] Team_076 possession (Score: 22-24)
Dejounte LaVine drives to the basket... Dejounte LaVine throws a bad pass out of bounds! TURNOVER! (dead ball)

[07:24] Substitution (Team_047): De'Aaron Rose OUT → Austin Giddey IN (stamina_rule2)

[07:24] Substitution (Team_047): Derrick Irving OUT → Donovan Iverson IN (stamina_rule2)

[07:24] Substitution (Team_047): Blake Jokic OUT → Blake Jackson IN (stamina_rule2)

[07:24] Substitution (Team_047): Josh Harris OUT → Tony Poole IN (stamina_rule2)

[07:24] Substitution (Team_047): Myles LaVine OUT → Zion Thompson IN (stamina_rule2)

[07:24] Substitution (Team_076): Dejounte LaVine OUT → Pascal Lowry IN (stamina_rule2)

[07:24] Substitution (Team_076): Tobias Mitchell OUT → Jalen Poole IN (stamina_rule2)

[07:24] Substitution (Team_076): Paul Leonard OUT → Vince Lowry IN (stamina_rule2)

[07:24] Substitution (Team_076): Cade Barnes OUT → Kevin Nowitzki IN (stamina_rule2)

[07:24] Substitution (Team_076): D'Angelo Tatum OUT → Jordan Doncic IN (stamina_rule2)

[07:10] Team_047 possession (Score: 22-24)
Blake Jackson attempts a Layup. Contested by Jordan Doncic (3.0 feet, ZONE). Blake Jackson misses. Offensive rebound by Zion Thompson! Zion Thompson kicks it out.

[06:56] Team_047 possession (Score: 22-24)
Blake Jackson drives and kicks out. Tony Poole attempts a 3Pt. Contested by Kevin Nowitzki (4.2 feet, MAN). TONY POOLE MAKES IT! Assist: Blake Jackson
Score: 25-24

[06:40] Team_076 possession (Score: 25-24)
Jalen Poole attempts a 3Pt. Contested by Donovan Iverson (4.6 feet, MAN). JALEN POOLE MAKES IT! Assist: Vince Lowry
Score: 25-27

[06:25] Team_047 possession (Score: 25-27)
Blake Jackson drives, Vince Lowry stays with him. Blake Jackson attempts a Dunk. Contested by Vince Lowry (3.9 feet, MAN). BLAKE JACKSON MAKES IT!
Score: 27-27

[06:11] Team_076 possession (Score: 27-27)
Pascal Lowry attempts a 3Pt. Contested by Donovan Iverson (3.9 feet, ZONE). Pascal Lowry misses. Rebound secured by Donovan Iverson.

[05:54] Team_047 possession (Score: 27-27)
Blake Jackson attempts a Midrange. Contested by Kevin Nowitzki (4.0 feet, ZONE). Blake Jackson misses. Rebound secured by Vince Lowry.

[05:37] Team_076 possession (Score: 27-27)
Kevin Nowitzki attempts a Layup. Contested by Tony Poole (5.3 feet, MAN). KEVIN NOWITZKI MAKES IT!
Score: 27-29

[05:25] Team_047 possession (Score: 27-29)
Austin Giddey attempts a 3Pt. Contested by Vince Lowry (4.8 feet, ZONE). Austin Giddey misses. Rebound secured by Vince Lowry.

[05:12] Team_076 possession (Score: 27-29)
Pascal Lowry drives and kicks out. Jordan Doncic attempts a 3Pt. Contested by Zion Thompson (5.3 feet, MAN). Jordan Doncic misses. Rebound secured by Zion Thompson.

[04:56] Team_047 possession (Score: 27-29)
Blake Jackson attempts a 3Pt. Contested by Vince Lowry (3.9 feet, ZONE). Blake Jackson misses. Offensive rebound by Blake Jackson! Blake Jackson kicks it out.

[04:39] Team_047 possession (Score: 27-29)
Blake Jackson makes the Layup and draws the foul on Vince Lowry! And-1! Blake Jackson to the line for 1. [Team fouls: 3] (Vince Lowry: 1 personal fouls)   FT 1/1: MISS Blake Jackson makes 0/1 from the line. Rebound secured by Jordan Doncic.
Score: 29-29

[04:26] Team_076 possession (Score: 29-29)
Kevin Nowitzki drives and kicks out. Kevin Nowitzki attempts a Midrange. Contested by Tony Poole (5.0 feet, MAN). KEVIN NOWITZKI MAKES IT!
Score: 29-31

[04:16] Team_047 possession (Score: 29-31)
Zion Thompson loses the ball! Stripped by Jordan Doncic! TURNOVER! (live ball)

[03:58] Team_076 possession (Score: 29-31)
Vince Lowry attempts a Midrange. Contested by Tony Poole (4.9 feet, ZONE). Vince Lowry misses. Rebound secured by Blake Jackson.

[03:43] Team_047 possession (Score: 29-31)
Donovan Iverson attempts a 3Pt. Contested by Jalen Poole (5.6 feet, MAN). Donovan Iverson misses. FOUL! Loose ball foul on Jordan Doncic during the rebound battle. [Team fouls: 4] No free throws, side out. (Jordan Doncic: 1 personal fouls)

[03:28] Team_047 possession (Score: 29-31)
Donovan Iverson attempts a 3Pt. Contested by Jalen Poole (5.6 feet, MAN). DONOVAN IVERSON MAKES IT!
Score: 32-31

[03:16] Team_076 possession (Score: 32-31)
Vince Lowry drives and kicks out. Pascal Lowry attempts a 3Pt. Contested by Donovan Iverson (4.2 feet, ZONE). Pascal Lowry misses. FOUL! Loose ball foul on Donovan Iverson during the rebound battle. [Team fouls: 3] No free throws, side out. (Donovan Iverson: 1 personal fouls)

[02:59] Team_076 possession (Score: 32-31)
Jordan Doncic loses the ball! Stripped by Zion Thompson! TURNOVER! (live ball)

[02:44] Team_047 possession (Score: 32-31)
Tony Poole drives, Kevin Nowitzki stays with him. Tony Poole attempts a Layup. Contested by Kevin Nowitzki (4.8 feet, MAN). TONY POOLE MAKES IT! Assist: Donovan Iverson
Score: 34-31

[02:27] Team_076 possession (Score: 34-31)
Kevin Nowitzki attempts a 3Pt. Contested by Donovan Iverson (4.5 feet, ZONE). Kevin Nowitzki misses. Rebound secured by Blake Jackson.

[02:11] Team_047 possession (Score: 34-31)
Zion Thompson attempts a Layup. Contested by Jordan Doncic (3.2 feet, ZONE). ZION THOMPSON MAKES IT! Assist: Donovan Iverson
Score: 36-31

[02:00] Team_076 possession (Score: 36-31)
Kevin Nowitzki drives to the basket... Kevin Nowitzki throws a bad pass! Stolen by Tony Poole! TURNOVER! (live ball)

[01:45] Team_047 possession (Score: 36-31)
Tony Poole drives, picks up Kevin Nowitzki. Help arrives from Jalen Poole! Tony Poole attempts a Dunk. Contested by Jalen Poole (4.8 feet, MAN). Tony Poole misses. Rebound secured by Jordan Doncic.

[01:30] Team_076 possession (Score: 36-31)
Jalen Poole drives and kicks out. Kevin Nowitzki attempts a Midrange. BLOCKED BY BLAKE JACKSON! Ball is loose! Rebound secured by Donovan Iverson.

[01:16] Team_047 possession (Score: 36-31)
FOUL! Reach-in foul on Jordan Doncic during the drive. [IN THE BONUS! 5 team fouls] Zion Thompson to the line for 2 free throws. (Jordan Doncic: 2 personal fouls)   FT 1/2: GOOD   FT 2/2: GOOD Zion Thompson makes 2/2 from the line.
Score: 38-31

[00:58] Team_076 possession (Score: 38-31)
Vince Lowry attempts a Layup. Contested by Zion Thompson (5.2 feet, ZONE). Vince Lowry misses. Rebound secured by Zion Thompson.

[00:45] Team_047 possession (Score: 38-31)
Austin Giddey attempts a Midrange. Wide open! Pascal Lowry is 6.8 feet away. [MAN] AUSTIN GIDDEY MAKES IT! Assist: Donovan Iverson
Score: 40-31

[00:33] Team_076 possession (Score: 40-31)
Pascal Lowry drives and kicks out. Jalen Poole attempts a 3Pt. Contested by Donovan Iverson (4.2 feet, MAN). JALEN POOLE MAKES IT! Assist: Vince Lowry
Score: 40-34

[00:16] Team_047 possession (Score: 40-34)
Austin Giddey drives, picks up Pascal Lowry. Help arrives from Vince Lowry! Austin Giddey attempts a Layup. Wide open! Vince Lowry is 6.9 feet away. [MAN] AUSTIN GIDDEY MAKES IT! Assist: Donovan Iverson
Score: 42-34

[00:03] Team_076 possession (Score: 42-34)
FOUL! Holding foul on Donovan Iverson. [Team fouls: 4] No free throws, side out. (Donovan Iverson: 2 personal fouls)

================================================================================
                              2ND QUARTER COMPLETE                              
================================================================================

2ND QUARTER SCORE: Team_047 29, Team_076 20

BOX SCORE:
================================================================================

Team_047
--------------------------------------------------------------------------------
Player                MIN  PTS  REB  AST  TO      FG   FG%      3P   3P%
--------------------------------------------------------------------------------
Tony Poole              7    5    0    0   0   2/3    66.7     0/0   0.0
Zion Thompson           7    4    3    0   0   2/2   100.0     0/0   0.0
Austin Giddey           7    4    0    0   0   2/3    66.7     0/0   0.0
Myles LaVine           17    3    1    0   0   1/1   100.0     0/0   0.0
Donovan Iverson         7    3    2    4   0   1/1   100.0     0/0   0.0
Josh Harris            17    2    2    0   0   1/2    50.0     0/0   0.0
Blake Jokic            17    2    0    0   0   1/2    50.0     0/0   0.0
Derrick Irving         17    2    0    1   0   1/2    50.0     0/0   0.0
Blake Jackson           7    2    4    1   0   1/3    33.3     0/0   0.0
De'Aaron Rose          17    0    0    1   0   0/1     0.0     0/0   0.0

TEAM: FG: 12/20 (60.0%), 3PT: 1/4 (25.0%), REB: 12 (4 off, 8 def), AST: 7, TO: 1
TEAM FOULS: 4


Team_076
--------------------------------------------------------------------------------
Player                MIN  PTS  REB  AST  TO      FG   FG%      3P   3P%
--------------------------------------------------------------------------------
Paul Leonard           17    6    0    1   0   2/2   100.0     0/0   0.0
Jalen Poole             7    6    0    0   0   2/3    66.7     0/0   0.0
Kevin Nowitzki          7    4    0    0   0   2/3    66.7     0/0   0.0
Cade Barnes            17    2    3    0   0   1/2    50.0     0/0   0.0
Dejounte LaVine        17    2    0    0   0   1/1   100.0     0/0   0.0
D'Angelo Tatum         17    0    2    1   0   0/0     0.0     0/0   0.0
Tobias Mitchell        17    0    0    0   0   0/1     0.0     0/0   0.0
Vince Lowry             7    0    2    2   0   0/2     0.0     0/0   0.0
Pascal Lowry            7    0    0    0   0   0/2     0.0     0/0   0.0
Jordan Doncic           7    0    3    0   0   0/0     0.0     0/0   0.0

TEAM: FG: 8/16 (50.0%), 3PT: 2/5 (40.0%), REB: 10 (2 off, 8 def), AST: 4, TO: 4
TEAM FOULS: 5 [Team_047 in BONUS]

================================================================================

================================================================================
                       3RD QUARTER - Team_047 vs Team_076                       
================================================================================

[12:00] Team_047 possession (Score: 42-34)
FOUL! Shooting foul on Cade Barnes. Blake Jokic to the line for 2 free throws. [Team fouls: 1] (Cade Barnes: 1 personal fouls)   FT 1/2: GOOD   FT 2/2: MISS Blake Jokic makes 1/2 from the line. Rebound secured by Cade Barnes.
Score: 43-34

[11:45] Team_076 possession (Score: 43-34)
Dejounte LaVine attempts a Midrange. Contested by Josh Harris (4.1 feet, ZONE). Dejounte LaVine misses. Rebound secured by Josh Harris.

[11:32] Team_047 possession (Score: 43-34)
Blake Jokic attempts a 3Pt. Contested by Paul Leonard (4.9 feet, ZONE). Blake Jokic misses. Rebound secured by Cade Barnes.

[11:19] Team_076 possession (Score: 43-34)
D'Angelo Tatum attempts a Layup. Contested by Josh Harris (4.4 feet, ZONE). D'ANGELO TATUM MAKES IT!
Score: 43-36

[11:03] Team_047 possession (Score: 43-36)
Blake Jokic throws a bad pass! Stolen by Paul Leonard! TURNOVER! (live ball)

[10:52] Team_076 possession (Score: 43-36)
Paul Leonard attempts a 3Pt. Contested by De'Aaron Rose (4.3 feet, ZONE). Paul Leonard misses. Rebound secured by Myles LaVine.

[10:39] Team_047 possession (Score: 43-36)
Myles LaVine loses the ball! Stripped by D'Angelo Tatum! TURNOVER! (live ball)

[10:25] Team_076 possession (Score: 43-36)
Tobias Mitchell attempts a 3Pt. Contested by De'Aaron Rose (4.4 feet, ZONE). Tobias Mitchell misses. Rebound secured by Myles LaVine.

[10:16] Team_047 possession (Score: 43-36)
Derrick Irving attempts a 3Pt. Contested by Tobias Mitchell (4.4 feet, MAN). Derrick Irving misses. Rebound secured by Cade Barnes.

[10:01] Team_076 possession (Score: 43-36)
Dejounte LaVine attempts a Layup. Contested by Josh Harris (4.1 feet, ZONE). DEJOUNTE LAVINE MAKES IT!
Score: 43-38

[09:45] Team_047 possession (Score: 43-38)
FOUL! Reach-in foul on Paul Leonard during the drive. [Team fouls: 2] No free throws, side out. (Paul Leonard: 1 personal fouls)

[09:29] Team_047 possession (Score: 43-38)
Myles LaVine attempts a 3Pt. Contested by Cade Barnes (3.6 feet, ZONE). MYLES LAVINE MAKES IT! Assist: De'Aaron Rose
Score: 46-38

[09:10] Team_076 possession (Score: 46-38)
Cade Barnes makes the Midrange and draws the foul on Josh Harris! And-1! Cade Barnes to the line for 1. [Team fouls: 1] (Josh Harris: 1 personal fouls)   FT 1/1: GOOD Cade Barnes makes 1/1 from the line.
Score: 46-41

[08:53] Team_047 possession (Score: 46-41)
De'Aaron Rose drives and kicks out. Myles LaVine attempts a Midrange. Contested by D'Angelo Tatum (3.7 feet, MAN). Myles LaVine misses. Rebound secured by Cade Barnes.

[08:36] Team_076 possession (Score: 46-41)
Tobias Mitchell drives, picks up Josh Harris. Help arrives from Derrick Irving! Tobias Mitchell attempts a Dunk. Contested by Derrick Irving (4.5 feet, ZONE). Tobias Mitchell misses. Offensive rebound by Cade Barnes! Cade Barnes kicks it out.

[08:24] Team_076 possession (Score: 46-41)
D'Angelo Tatum drives and kicks out. Tobias Mitchell attempts a 3Pt. Contested by De'Aaron Rose (4.0 feet, ZONE). Tobias Mitchell misses. Rebound secured by Myles LaVine.

[08:09] Team_047 possession (Score: 46-41)
Blake Jokic drives to the basket... Blake Jokic loses the ball! Stripped by Cade Barnes! TURNOVER! (live ball)

[07:54] Team_076 possession (Score: 46-41)
Tobias Mitchell drives, Derrick Irving stays with him. Tobias Mitchell attempts a Layup. Contested by Derrick Irving (5.2 feet, MAN). Tobias Mitchell misses. Offensive rebound by D'Angelo Tatum! D'Angelo Tatum kicks it out.

[07:39] Team_076 possession (Score: 46-41)
Tobias Mitchell attempts a 3Pt. Contested by De'Aaron Rose (4.4 feet, ZONE). Tobias Mitchell misses. Rebound secured by Josh Harris.

[07:23] Team_047 possession (Score: 46-41)
FOUL! Holding foul on Cade Barnes. [Team fouls: 3] No free throws, side out. (Cade Barnes: 2 personal fouls)

[07:10] Team_047 possession (Score: 46-41)
De'Aaron Rose attempts a 3Pt. Contested by Dejounte LaVine (5.1 feet, MAN). De'Aaron Rose misses. Rebound secured by D'Angelo Tatum.

[06:54] Team_076 possession (Score: 46-41)
Tobias Mitchell attempts a 3Pt. Contested by De'Aaron Rose (4.4 feet, ZONE). Tobias Mitchell misses. Offensive rebound by Cade Barnes! Cade Barnes kicks it out.

[06:40] Team_076 possession (Score: 46-41)
D'Angelo Tatum drives, Josh Harris stays with him. D'Angelo Tatum attempts a Layup. Contested by Josh Harris (4.4 feet, ZONE). D'ANGELO TATUM MAKES IT! Assist: Tobias Mitchell
Score: 46-43

[06:25] Team_047 possession (Score: 46-43)
De'Aaron Rose attempts a 3Pt. Contested by Dejounte LaVine (5.1 feet, MAN). DE'AARON ROSE MAKES IT! Assist: Myles LaVine
Score: 49-43

[06:09] Team_076 possession (Score: 49-43)
Paul Leonard attempts a 3Pt. Contested by De'Aaron Rose (4.3 feet, ZONE). PAUL LEONARD MAKES IT! Assist: Cade Barnes
Score: 49-46

[05:56] Team_047 possession (Score: 49-46)
Josh Harris throws a bad pass! Stolen by Cade Barnes! TURNOVER! (live ball)

[05:44] Team_076 possession (Score: 49-46)
D'Angelo Tatum attempts a 3Pt. Contested by Myles LaVine (5.4 feet, MAN). D'ANGELO TATUM MAKES IT!
Score: 49-49

[05:30] Team_047 possession (Score: 49-49)
Blake Jokic attempts a 3Pt. Contested by Paul Leonard (4.9 feet, MAN). BLAKE JOKIC MAKES IT! Assist: Derrick Irving
Score: 52-49

[05:17] Team_076 possession (Score: 52-49)
Paul Leonard attempts a 3Pt. Contested by De'Aaron Rose (4.3 feet, ZONE). Paul Leonard misses. Rebound secured by Myles LaVine.

[05:04] Team_047 possession (Score: 52-49)
Blake Jokic attempts a 3Pt. Contested by Paul Leonard (5.0 feet, MAN). Blake Jokic misses. Offensive rebound by Josh Harris! Josh Harris kicks it out.

[04:46] Team_047 possession (Score: 52-49)
Blake Jokic attempts a Midrange. Contested by Paul Leonard (5.0 feet, MAN). Blake Jokic misses. Offensive rebound by Myles LaVine! Myles LaVine kicks it out.

[04:34] Team_047 possession (Score: 52-49)
Derrick Irving drives, Tobias Mitchell stays with him. Derrick Irving attempts a Layup. Contested by Tobias Mitchell (4.5 feet, MAN). DERRICK IRVING MAKES IT!
Score: 54-49

[04:21] Team_076 possession (Score: 54-49)
FOUL! Reach-in foul on Myles LaVine during the drive. [Team fouls: 2] No free throws, side out. (Myles LaVine: 1 personal fouls)

[04:06] Team_076 possession (Score: 54-49)
Dejounte LaVine drives, Josh Harris stays with him. Dejounte LaVine attempts a Dunk. Contested by Josh Harris (4.2 feet, ZONE). DEJOUNTE LAVINE MAKES IT! Assist: Paul Leonard
Score: 54-51

[03:57] Team_047 possession (Score: 54-51)
Derrick Irving throws a bad pass out of bounds! TURNOVER! (dead ball)

[03:44] Team_076 possession (Score: 54-51)
Dejounte LaVine attempts a Layup. Contested by Josh Harris (4.2 feet, ZONE). DEJOUNTE LAVINE MAKES IT!
Score: 54-53

[03:28] Team_047 possession (Score: 54-53)
De'Aaron Rose attempts a 3Pt. Contested by Dejounte LaVine (5.3 feet, MAN). De'Aaron Rose misses. Rebound secured by D'Angelo Tatum.

[03:13] Team_076 possession (Score: 54-53)
FOUL! Shooting foul on Josh Harris. D'Angelo Tatum to the line for 2 free throws. [Team fouls: 3] (Josh Harris: 2 personal fouls)   FT 1/2: MISS   FT 2/2: GOOD D'Angelo Tatum makes 1/2 from the line.
Score: 54-54

[02:57] Team_047 possession (Score: 54-54)
De'Aaron Rose drives to the basket... FOUL! Offensive foul on De'Aaron Rose! D'Angelo Tatum drew the charge! [Team fouls: 4] (De'Aaron Rose: 1 personal fouls) TURNOVER! (dead ball)

[02:39] Team_076 possession (Score: 54-54)
FOUL! Shooting foul on De'Aaron Rose. Tobias Mitchell to the line for 3 free throws. [BONUS: 5 team fouls] (De'Aaron Rose: 2 personal fouls)   FT 1/3: GOOD   FT 2/3: GOOD   FT 3/3: GOOD Tobias Mitchell makes 3/3 from the line.
Score: 54-57

[02:27] Team_047 possession (Score: 54-57)
De'Aaron Rose attempts a Layup. Contested by Dejounte LaVine (5.3 feet, MAN). De'Aaron Rose misses. Offensive rebound by Myles LaVine! Myles LaVine kicks it out.

[02:14] Team_047 possession (Score: 54-57)
Derrick Irving makes the Layup and draws the foul on Tobias Mitchell! And-1! Derrick Irving to the line for 1. [Team fouls: 4] (Tobias Mitchell: 1 personal fouls)   FT 1/1: GOOD Derrick Irving makes 1/1 from the line.
Score: 57-57

[02:01] Team_076 possession (Score: 57-57)
FOUL! Shooting foul on Josh Harris. Tobias Mitchell to the line for 2 free throws. [BONUS: 6 team fouls] (Josh Harris: 3 personal fouls)   FT 1/2: GOOD   FT 2/2: GOOD Tobias Mitchell makes 2/2 from the line.
Score: 57-59

[01:46] Team_047 possession (Score: 57-59)
Derrick Irving drives to the basket... Derrick Irving throws a bad pass out of bounds! TURNOVER! (dead ball)

[01:46] Substitution (Team_047): De'Aaron Rose OUT → Austin Giddey IN (stamina_rule2)

[01:46] Substitution (Team_047): Derrick Irving OUT → Donovan Iverson IN (stamina_rule2)

[01:46] Substitution (Team_047): Blake Jokic OUT → Blake Jackson IN (stamina_rule2)

[01:46] Substitution (Team_047): Josh Harris OUT → Tony Poole IN (stamina_rule2)

[01:46] Substitution (Team_047): Myles LaVine OUT → Zion Thompson IN (stamina_rule2)

[01:46] Substitution (Team_076): Dejounte LaVine OUT → Pascal Lowry IN (stamina_rule2)

[01:46] Substitution (Team_076): Tobias Mitchell OUT → Jalen Poole IN (stamina_rule2)

[01:46] Substitution (Team_076): Paul Leonard OUT → Vince Lowry IN (stamina_rule2)

[01:46] Substitution (Team_076): Cade Barnes OUT → Kevin Nowitzki IN (stamina_rule2)

[01:46] Substitution (Team_076): D'Angelo Tatum OUT → Jordan Doncic IN (stamina_rule2)

[01:31] Team_076 possession (Score: 57-59)
Jalen Poole drives, Tony Poole stays with him. Jalen Poole attempts a Layup. Contested by Tony Poole (5.4 feet, ZONE). JALEN POOLE MAKES IT! Assist: Pascal Lowry
Score: 57-61

[01:18] Team_047 possession (Score: 57-61)
Zion Thompson attempts a Midrange. Contested by Jalen Poole (5.3 feet, ZONE). ZION THOMPSON MAKES IT! Assist: Blake Jackson
Score: 59-61

[01:01] Team_076 possession (Score: 59-61)
FOUL! Holding foul on Zion Thompson. [IN THE BONUS! 7 team fouls] Jordan Doncic to the line for 2 free throws. (Zion Thompson: 1 personal fouls)   FT 1/2: GOOD   FT 2/2: GOOD Jordan Doncic makes 2/2 from the line.
Score: 59-63

[00:49] Team_047 possession (Score: 59-63)
Tony Poole drives, picks up Kevin Nowitzki. Help arrives from Jalen Poole! Tony Poole attempts a Dunk. Contested by Jalen Poole (4.8 feet, MAN). TONY POOLE MAKES IT! Assist: Blake Jackson
Score: 61-63

[00:36] Team_076 possession (Score: 61-63)
Vince Lowry drives, Zion Thompson stays with him. Vince Lowry attempts a Dunk. Contested by Zion Thompson (5.2 feet, ZONE). Vince Lowry misses. Rebound secured by Blake Jackson.

[00:20] Team_047 possession (Score: 61-63)
Zion Thompson drives to the basket... Zion Thompson loses control! Ball rolls out of bounds! TURNOVER! (dead ball)

[00:08] Team_076 possession (Score: 61-63)
Jordan Doncic throws a bad pass! Stolen by Zion Thompson! TURNOVER! (live ball)

================================================================================
                              3RD QUARTER COMPLETE                              
================================================================================

3RD QUARTER SCORE: Team_047 19, Team_076 29

BOX SCORE:
================================================================================

Team_047
--------------------------------------------------------------------------------
Player                MIN  PTS  REB  AST  TO      FG   FG%      3P   3P%
--------------------------------------------------------------------------------
Derrick Irving         27    5    0    1   0   2/3    66.7     0/0   0.0
Blake Jokic            27    3    0    0   0   1/3    33.3     0/0   0.0
Myles LaVine           27    3    6    1   0   1/1   100.0     0/0   0.0
De'Aaron Rose          27    3    0    1   0   1/4    25.0     0/0   0.0
Zion Thompson           9    2    0    0   0   1/1   100.0     0/0   0.0
Tony Poole              9    2    0    0   0   1/1   100.0     0/0   0.0
Josh Harris            27    0    3    0   0   0/0     0.0     0/0   0.0
Blake Jackson           9    0    1    2   0   0/0     0.0     0/0   0.0

TEAM: FG: 7/13 (53.8%), 3PT: 3/7 (42.9%), REB: 10 (3 off, 7 def), AST: 5, TO: 8
TEAM FOULS: 7 [Team_076 in BONUS]


Team_076
--------------------------------------------------------------------------------
Player                MIN  PTS  REB  AST  TO      FG   FG%      3P   3P%
--------------------------------------------------------------------------------
D'Angelo Tatum         27    8    3    0   0   4/5    80.0     0/0   0.0
Dejounte LaVine        27    6    0    0   0   3/4    75.0     0/0   0.0
Tobias Mitchell        27    5    0    1   0   2/4    50.0     0/0   0.0
Cade Barnes            27    3    6    1   0   1/1   100.0     0/0   0.0
Paul Leonard           27    3    0    1   0   1/3    33.3     0/0   0.0
Jalen Poole             9    2    0    0   0   1/1   100.0     0/0   0.0
Jordan Doncic           9    2    0    0   0   1/1   100.0     0/0   0.0
Pascal Lowry            9    0    0    1   0   0/0     0.0     0/0   0.0
Vince Lowry             9    0    0    0   0   0/1     0.0     0/0   0.0

TEAM: FG: 13/20 (65.0%), 3PT: 3/7 (42.9%), REB: 9 (3 off, 6 def), AST: 4, TO: 1
TEAM FOULS: 4

================================================================================

================================================================================
                       4TH QUARTER - Team_047 vs Team_076                       
================================================================================

[12:00] Team_047 possession (Score: 61-63)
De'Aaron Rose attempts a 3Pt. Contested by Dejounte LaVine (5.2 feet, MAN). De'Aaron Rose misses. Rebound secured by D'Angelo Tatum.

[11:46] Team_076 possession (Score: 61-63)
Paul Leonard drives, Blake Jokic stays with him. Paul Leonard attempts a Layup. Contested by Blake Jokic (5.2 feet, MAN). PAUL LEONARD MAKES IT! Assist: D'Angelo Tatum
Score: 61-65

[11:36] Team_047 possession (Score: 61-65)
Josh Harris drives to the basket... Josh Harris loses the ball! Stripped by Cade Barnes! TURNOVER! (live ball)

[11:18] Team_076 possession (Score: 61-65)
Dejounte LaVine attempts a Midrange. Contested by De'Aaron Rose (4.0 feet, MAN). DEJOUNTE LAVINE MAKES IT! Assist: Paul Leonard
Score: 61-67

[11:05] Team_047 possession (Score: 61-67)
Josh Harris attempts a Midrange. Contested by Cade Barnes (3.9 feet, MAN). Josh Harris misses. Offensive rebound by Myles LaVine! Myles LaVine kicks it out.

[10:51] Team_047 possession (Score: 61-67)
Blake Jokic drives, picks up Paul Leonard. Help arrives from Tobias Mitchell! Blake Jokic attempts a Layup. Contested by Tobias Mitchell (5.1 feet, MAN). BLAKE JOKIC MAKES IT!
Score: 63-67

[10:36] Team_076 possession (Score: 63-67)
Cade Barnes drives, Josh Harris stays with him. Cade Barnes attempts a Dunk. Contested by Josh Harris (4.5 feet, MAN). CADE BARNES MAKES IT! Assist: Dejounte LaVine
Score: 63-69

[10:21] Team_047 possession (Score: 63-69)
Myles LaVine attempts a 3Pt. Contested by Dejounte LaVine (5.2 feet, ZONE). Myles LaVine misses. Offensive rebound by Myles LaVine! Myles LaVine kicks it out.

[10:11] Team_047 possession (Score: 63-69)
Blake Jokic commits a violation (traveling/carry)! TURNOVER! (dead ball)

[10:11] Substitution (Team_047): Derrick Irving OUT → Donovan Iverson IN (stamina_rule2)

[10:11] Substitution (Team_047): Josh Harris OUT → Tony Poole IN (stamina_rule2)

[10:11] Substitution (Team_047): Myles LaVine OUT → Zion Thompson IN (stamina_rule2)

[10:11] Substitution (Team_076): Dejounte LaVine OUT → Pascal Lowry IN (stamina_rule2)

[10:11] Substitution (Team_076): Tobias Mitchell OUT → Jalen Poole IN (stamina_rule2)

[10:11] Substitution (Team_076): Paul Leonard OUT → Vince Lowry IN (stamina_rule2)

[10:11] Substitution (Team_076): Cade Barnes OUT → Kevin Nowitzki IN (stamina_rule2)

[10:00] Team_076 possession (Score: 63-69)
Vince Lowry makes the 3Pt and draws the foul on De'Aaron Rose! And-1! Vince Lowry to the line for 1. [Team fouls: 1] (De'Aaron Rose: 1 personal fouls)   FT 1/1: GOOD Vince Lowry makes 1/1 from the line.
Score: 63-73

[09:43] Team_047 possession (Score: 63-73)
Zion Thompson drives to the basket... Zion Thompson throws a bad pass out of bounds! TURNOVER! (dead ball)

[09:43] Substitution (Team_047): De'Aaron Rose OUT → Austin Giddey IN (stamina_rule2)

[09:43] Substitution (Team_076): D'Angelo Tatum OUT → Jordan Doncic IN (stamina_rule2)

[09:28] Team_076 possession (Score: 63-73)
Vince Lowry attempts a 3Pt. Contested by Donovan Iverson (4.2 feet, ZONE). Vince Lowry misses. Rebound secured by Zion Thompson.

[09:14] Team_047 possession (Score: 63-73)
Austin Giddey attempts a 3Pt. Contested by Vince Lowry (4.8 feet, ZONE). Austin Giddey misses. Rebound secured by Jordan Doncic.

[09:00] Team_076 possession (Score: 63-73)
Pascal Lowry drives and kicks out. Pascal Lowry attempts a Midrange. Contested by Tony Poole (5.0 feet, ZONE). Pascal Lowry misses. Rebound secured by Zion Thompson.

[08:44] Team_047 possession (Score: 63-73)
Blake Jokic attempts a 3Pt. Contested by Vince Lowry (4.0 feet, ZONE). Blake Jokic misses. Rebound secured by Vince Lowry.

[08:28] Team_076 possession (Score: 63-73)
Pascal Lowry attempts a 3Pt. Contested by Austin Giddey (4.5 feet, MAN). Pascal Lowry misses. Rebound secured by Donovan Iverson.

[08:12] Team_047 possession (Score: 63-73)
Zion Thompson drives, Jordan Doncic stays with him. Zion Thompson attempts a Layup. Contested by Jordan Doncic (3.2 feet, ZONE). Zion Thompson misses. Rebound secured by Jordan Doncic.

[07:58] Team_076 possession (Score: 63-73)
Pascal Lowry drives and kicks out. Jalen Poole attempts a 3Pt. Contested by Donovan Iverson (4.2 feet, MAN). JALEN POOLE MAKES IT! Assist: Pascal Lowry
Score: 63-76

[07:45] Team_047 possession (Score: 63-76)
FOUL! Holding foul on Vince Lowry. [Team fouls: 1] No free throws, side out. (Vince Lowry: 1 personal fouls)

[07:28] Team_047 possession (Score: 63-76)
Tony Poole attempts a 3Pt. Contested by Vince Lowry (4.8 feet, ZONE). TONY POOLE MAKES IT! Assist: Donovan Iverson
Score: 66-76

[07:10] Team_076 possession (Score: 66-76)
Vince Lowry attempts a 3Pt. Contested by Blake Jokic (5.2 feet, MAN). VINCE LOWRY MAKES IT! Assist: Jordan Doncic
Score: 66-79

[06:52] Team_047 possession (Score: 66-79)
Zion Thompson attempts a Layup. Contested by Jordan Doncic (3.2 feet, ZONE). ZION THOMPSON MAKES IT!
Score: 68-79

[06:35] Team_076 possession (Score: 68-79)
Pascal Lowry drives and kicks out. Pascal Lowry attempts a 3Pt. Contested by Donovan Iverson (4.2 feet, ZONE). Pascal Lowry misses. Offensive rebound by Kevin Nowitzki! Kevin Nowitzki kicks it out.

[06:23] Team_076 possession (Score: 68-79)
Jalen Poole attempts a 3Pt. Contested by Donovan Iverson (4.6 feet, ZONE). Jalen Poole misses. Rebound secured by Donovan Iverson.

[06:07] Team_047 possession (Score: 68-79)
Tony Poole drives, Kevin Nowitzki stays with him. Tony Poole attempts a Layup. Contested by Kevin Nowitzki (4.8 feet, MAN). TONY POOLE MAKES IT! Assist: Zion Thompson
Score: 70-79

[05:58] Team_076 possession (Score: 70-79)
Jordan Doncic attempts a Midrange. Contested by Zion Thompson (4.7 feet, MAN). Jordan Doncic misses. Offensive rebound by Jordan Doncic! Jordan Doncic kicks it out.

[05:49] Team_076 possession (Score: 70-79)
Kevin Nowitzki drives, picks up Zion Thompson. Help arrives from Donovan Iverson! Kevin Nowitzki attempts a Dunk. Contested by Donovan Iverson (5.5 feet, ZONE). KEVIN NOWITZKI MAKES IT! Assist: Vince Lowry
Score: 70-81

[05:35] Team_047 possession (Score: 70-81)
Tony Poole attempts a 3Pt. Contested by Kevin Nowitzki (4.8 feet, MAN). Tony Poole misses. Rebound secured by Kevin Nowitzki.

[05:19] Team_076 possession (Score: 70-81)
Vince Lowry attempts a Midrange. Contested by Blake Jokic (5.4 feet, MAN). Vince Lowry misses. Offensive rebound by Kevin Nowitzki! Kevin Nowitzki kicks it out.

[05:02] Team_076 possession (Score: 70-81)
Jordan Doncic attempts a Midrange. Contested by Tony Poole (4.5 feet, ZONE). Jordan Doncic misses. Rebound secured by Donovan Iverson.

[04:45] Team_047 possession (Score: 70-81)
Blake Jokic attempts a 3Pt. Contested by Vince Lowry (4.0 feet, MAN). Blake Jokic misses. Offensive rebound by Zion Thompson! Zion Thompson kicks it out.

[04:32] Team_047 possession (Score: 70-81)
Donovan Iverson attempts a 3Pt. Contested by Jalen Poole (5.6 feet, MAN). DONOVAN IVERSON MAKES IT! Assist: Zion Thompson
Score: 73-81

[04:18] Team_076 possession (Score: 73-81)
Pascal Lowry attempts a Midrange. Contested by Austin Giddey (4.5 feet, MAN). Pascal Lowry misses. FOUL! Loose ball foul on Tony Poole during the rebound battle. [Team fouls: 2] No free throws, side out. (Tony Poole: 1 personal fouls)

[04:05] Team_076 possession (Score: 73-81)
Jordan Doncic attempts a Midrange. Contested by Zion Thompson (4.8 feet, MAN). Jordan Doncic misses. FOUL! Loose ball foul on Donovan Iverson during the rebound battle. [Team fouls: 3] No free throws, side out. (Donovan Iverson: 1 personal fouls)

[03:54] Team_076 possession (Score: 73-81)
Jordan Doncic drives to the basket... Jordan Doncic throws a bad pass! Stolen by Zion Thompson! TURNOVER! (live ball)

[03:39] Team_047 possession (Score: 73-81)
Zion Thompson attempts a Layup. Contested by Jordan Doncic (3.2 feet, ZONE). ZION THOMPSON MAKES IT! Assist: Austin Giddey
Score: 75-81

[03:28] Team_076 possession (Score: 75-81)
Pascal Lowry attempts a Midrange. Contested by Austin Giddey (4.5 feet, MAN). PASCAL LOWRY MAKES IT! Assist: Jalen Poole
Score: 75-83

[03:11] Team_047 possession (Score: 75-83)
FOUL! Offensive foul on Zion Thompson! Jordan Doncic drew the charge! [Team fouls: 4] (Zion Thompson: 1 personal fouls) TURNOVER! (dead ball)

[02:57] Team_076 possession (Score: 75-83)
Pascal Lowry attempts a 3Pt. Contested by Donovan Iverson (4.0 feet, ZONE). Pascal Lowry misses. Offensive rebound by Kevin Nowitzki! Kevin Nowitzki kicks it out.

[02:42] Team_076 possession (Score: 75-83)
Kevin Nowitzki drives and kicks out. Vince Lowry attempts a 3Pt. Contested by Blake Jokic (5.8 feet, MAN). Vince Lowry misses. Offensive rebound by Jordan Doncic! Jordan Doncic kicks it out.

[02:29] Team_076 possession (Score: 75-83)
Vince Lowry attempts a Midrange. Contested by Blake Jokic (5.7 feet, MAN). Vince Lowry misses. Offensive rebound by Kevin Nowitzki! Kevin Nowitzki kicks it out.

[02:18] Team_076 possession (Score: 75-83)
Kevin Nowitzki drives to the basket... Kevin Nowitzki commits a violation (traveling/carry)! TURNOVER! (dead ball)

[02:18] Substitution (Team_047): Blake Jokic OUT → Blake Jackson IN (stamina_rule2)

[02:04] Team_047 possession (Score: 75-83)
Zion Thompson attempts a Layup. Contested by Jordan Doncic (3.4 feet, ZONE). Zion Thompson misses. Offensive rebound by Blake Jackson! Blake Jackson kicks it out.

[01:45] Team_047 possession (Score: 75-83)
Donovan Iverson attempts a 3Pt. Contested by Vince Lowry (4.6 feet, ZONE). Donovan Iverson misses. Rebound secured by Vince Lowry.

[01:33] Team_076 possession (Score: 75-83)
Kevin Nowitzki attempts a Midrange. Contested by Tony Poole (5.5 feet, ZONE). Kevin Nowitzki misses. Rebound secured by Donovan Iverson.

[01:19] Team_047 possession (Score: 75-83)
Donovan Iverson attempts a 3Pt. BLOCKED BY JALEN POOLE! Ball is loose! Offensive rebound by Blake Jackson! Blake Jackson kicks it out.

[01:00] Team_047 possession (Score: 75-83)
Zion Thompson makes the Layup and draws the foul on Jordan Doncic! And-1! Zion Thompson to the line for 1. [Team fouls: 2] (Jordan Doncic: 1 personal fouls)   FT 1/1: GOOD Zion Thompson makes 1/1 from the line.
Score: 78-83

[00:49] Team_076 possession (Score: 78-83)
Jordan Doncic drives to the basket... Jordan Doncic throws a bad pass! Stolen by Zion Thompson! TURNOVER! (live ball)

[00:33] Team_047 possession (Score: 78-83)
Austin Giddey makes the Layup and draws the foul on Jordan Doncic! And-1! Austin Giddey to the line for 1. [Team fouls: 3] (Jordan Doncic: 2 personal fouls)   FT 1/1: MISS Austin Giddey makes 0/1 from the line. Rebound secured by Kevin Nowitzki.
Score: 80-83

[00:18] Team_076 possession (Score: 80-83)
Pascal Lowry drives, Zion Thompson stays with him. Pascal Lowry attempts a Dunk. Contested by Zion Thompson (5.4 feet, ZONE). Pascal Lowry misses. Rebound secured by Donovan Iverson.

[00:06] Team_047 possession (Score: 80-83)
Blake Jackson drives, picks up Vince Lowry. Help arrives from Jalen Poole! Blake Jackson attempts a Layup. Contested by Jalen Poole (4.4 feet, MAN). BLAKE JACKSON MAKES IT! Assist: Austin Giddey
Score: 82-83

================================================================================
                              4TH QUARTER COMPLETE                              
================================================================================

4TH QUARTER SCORE: Team_047 21, Team_076 20

BOX SCORE:
================================================================================

Team_047
--------------------------------------------------------------------------------
Player                MIN  PTS  REB  AST  TO      FG   FG%      3P   3P%
--------------------------------------------------------------------------------
Zion Thompson          19    7    3    2   0   3/4    75.0     0/0   0.0
Tony Poole             19    5    0    0   0   2/3    66.7     0/0   0.0
Donovan Iverson        19    3    5    1   0   1/2    50.0     0/0   0.0
Blake Jokic            37    2    0    0   0   1/2    50.0     0/0   0.0
Blake Jackson          11    2    2    0   0   1/1   100.0     0/0   0.0
De'Aaron Rose          30    0    0    0   0   0/1     0.0     0/0   0.0
Myles LaVine           29    0    2    0   0   0/0     0.0     0/0   0.0
Austin Giddey          19    0    0    2   0   0/2     0.0     0/0   0.0

TEAM: FG: 8/15 (53.3%), 3PT: 2/7 (28.6%), REB: 12 (5 off, 7 def), AST: 5, TO: 4
TEAM FOULS: 4


Team_076
--------------------------------------------------------------------------------
Player                MIN  PTS  REB  AST  TO      FG   FG%      3P   3P%
--------------------------------------------------------------------------------
Vince Lowry            19    7    2    1   0   2/3    66.7     0/0   0.0
Jalen Poole            19    3    0    1   0   1/2    50.0     0/0   0.0
Paul Leonard           29    2    0    1   0   1/1   100.0     0/0   0.0
Dejounte LaVine        29    2    0    1   0   1/1   100.0     0/0   0.0
Cade Barnes            29    2    0    0   0   1/1   100.0     0/0   0.0
Pascal Lowry           19    2    0    1   0   1/4    25.0     0/0   0.0
Kevin Nowitzki         19    2    7    0   0   1/2    50.0     0/0   0.0
D'Angelo Tatum         30    0    1    1   0   0/0     0.0     0/0   0.0
Jordan Doncic          19    0    5    1   0   0/1     0.0     0/0   0.0

TEAM: FG: 8/15 (53.3%), 3PT: 2/5 (40.0%), REB: 15 (8 off, 7 def), AST: 7, TO: 3
TEAM FOULS: 3

================================================================================

================================================================================
                               FULL GAME COMPLETE                               
================================================================================

FINAL SCORE: Team_047 82, Team_076 83

SCORING BY QUARTER:
--------------------------------------------------------------------------------
Team                     Q1     Q2     Q3     Q4    FINAL
--------------------------------------------------------------------------------
Team_047                 13     29     19     21       82
Team_076                 14     20     29     20       83
--------------------------------------------------------------------------------

FULL GAME BOX SCORE:
================================================================================

Team_047
--------------------------------------------------------------------------------
Player                MIN  PTS  REB  AST  TO      FG   FG%      3P   3P%      FT STL BLK
--------------------------------------------------------------------------------
Blake Jokic            37    9    0    1   4   4/9    44.4   1/4    25.0   1/2     0   0
De'Aaron Rose          30    5    0    3   2   3/8    37.5   1/4    25.0   0/0     1   0
Derrick Irving         29   11    3    2   2   4/9    44.4   0/3     0.0   1/1     0   0
Josh Harris            29    5   15    0   4   2/4    50.0   0/2     0.0   1/1     1   0
Myles LaVine           29    6   13    2   5   2/7    28.6   1/2    50.0   3/4     0   0
Donovan Iverson        19    6    7    5   0   2/3    66.7   2/3    66.7   0/0     0   0
Tony Poole             19   12    0    0   0   4/6    66.7   1/2    50.0   0/0     1   0
Zion Thompson          19   13    6    2   3   6/7    85.7   0/0     0.0   3/3     4   0
Austin Giddey          19    4    0    2   1   2/5    40.0   0/2     0.0   0/1     0   0
Blake Jackson          11    4    7    3   0   3/5    60.0   0/0     0.0   0/1     0   1

TEAM: FG: 32/63 (50.8%), 3PT: 6/22 (27.3%), REB: 51 (15 off, 36 def), AST: 20, TO: 21


Team_076
--------------------------------------------------------------------------------
Player                MIN  PTS  REB  AST  TO      FG   FG%      3P   3P%      FT STL BLK
--------------------------------------------------------------------------------
D'Angelo Tatum         30   12    9    2   0   6/8    75.0   1/1   100.0   1/2     2   0
Dejounte LaVine        29   10    0    1   3   5/9    55.6   0/1     0.0   0/0     0   0
Tobias Mitchell        29    8    4    2   0   3/9    33.3   1/5    20.0   6/6     0   1
Paul Leonard           29   13    0    3   0   5/10   50.0   2/6    33.3   1/1     1   0
Cade Barnes            29   12   14    2   1   5/10   50.0   0/2     0.0   2/2     4   0
Pascal Lowry           19    2    0    2   2   3/8    37.5   0/2     0.0   0/0     0   0
Jalen Poole            19   11    0    1   1   2/4    50.0   1/2    50.0   0/0     0   1
Vince Lowry            19    7    4    3   0   2/6    33.3   2/3    66.7   1/1     0   0
Kevin Nowitzki         19    6    7    0   1   3/5    60.0   0/1     0.0   0/0     0   0
Jordan Doncic          19    2    8    1   2   0/1     0.0   0/0     0.0   2/2     1   0

TEAM: FG: 35/71 (49.3%), 3PT: 7/23 (30.4%), REB: 46 (15 off, 31 def), AST: 17, TO: 10

================================================================================
