================================================================================
                        FULL GAME - Team_089 vs Team_094                        
================================================================================

================================================================================
                       1ST QUARTER - Team_089 vs Team_094                       
================================================================================

[12:00] Team_089 possession (Score: 0-0)
Terry Simmons attempts a Midrange. Contested by Lauri Thompson (5.4 feet, ZONE). Terry Simmons misses. Rebound secured by Tim Russell.

[11:45] Team_094 possession (Score: 0-0)
FOUL! Holding foul on Terry Simmons. [Team fouls: 1] No free throws, side out. (Terry Simmons: 1 personal fouls)

[11:30] Team_094 possession (Score: 0-0)
Kobe Wagner attempts a 3Pt. Contested by Allen Mobley (4.6 feet, MAN). Kobe Wagner misses. Rebound secured by Terry Simmons.

[11:12] Team_089 possession (Score: 0-0)
Rudy Smith throws a bad pass out of bounds! TURNOVER! (dead ball)

[10:58] Team_094 possession (Score: 0-0)
Tim Russell attempts a 3Pt. Contested by Jordan Brogdon (3.4 feet, ZONE). Tim Russell misses. Rebound secured by Terry Simmons.

[10:42] Team_089 possession (Score: 0-0)
Jordan Brogdon attempts a Midrange. Contested by Kobe Wagner (4.2 feet, ZONE). JORDAN BROGDON MAKES IT!
Score: 2-0

[10:28] Team_094 possession (Score: 2-0)
Tim Russell drives and kicks out. Kobe Wagner attempts a Midrange. Contested by Jalen Jackson (4.7 feet, ZONE). Kobe Wagner misses. Rebound secured by Jalen Jackson.

[10:15] Team_089 possession (Score: 2-0)
Terry Simmons drives, Tim Russell stays with him. Terry Simmons attempts a Dunk. Contested by Tim Russell (5.4 feet, ZONE). TERRY SIMMONS MAKES IT!
Score: 4-0

[09:56] Team_094 possession (Score: 4-0)
Tim Russell throws a bad pass out of bounds! TURNOVER! (dead ball)

[09:38] Team_089 possession (Score: 4-0)
Rudy Smith drives and kicks out. Rudy Smith attempts a 3Pt. Contested by Tim Russell (4.8 feet, MAN). Rudy Smith misses. Rebound secured by Kobe Bryant.

[09:24] Team_094 possession (Score: 4-0)
Tim Russell attempts a Layup. Contested by Rudy Smith (4.9 feet, MAN). TIM RUSSELL MAKES IT!
Score: 4-2

[09:13] Team_089 possession (Score: 4-2)
Jalen Jackson attempts a 3Pt. Contested by Lauri Thompson (5.1 feet, MAN). JALEN JACKSON MAKES IT! Assist: Allen Mobley
Score: 7-2

[08:59] Team_094 possession (Score: 7-2)
Terry Ingram makes the Layup and draws the foul on Jordan Brogdon! And-1! Terry Ingram to the line for 1. [Team fouls: 2] (Jordan Brogdon: 1 personal fouls)   FT 1/1: GOOD Terry Ingram makes 1/1 from the line.
Score: 7-5

[08:44] Team_089 possession (Score: 7-5)
Allen Mobley drives, Tim Russell stays with him. Allen Mobley attempts a Dunk. Contested by Tim Russell (4.9 feet, ZONE). Allen Mobley misses. Rebound secured by Kobe Bryant.

[08:34] Team_094 possession (Score: 7-5)
Lauri Thompson attempts a Midrange. Contested by Jalen Jackson (5.1 feet, MAN). Lauri Thompson misses. Rebound secured by Rudy Smith.

[08:16] Team_089 possession (Score: 7-5)
Allen Mobley drives and kicks out. Jordan Brogdon attempts a 3Pt. Contested by Terry Ingram (4.7 feet, MAN). JORDAN BROGDON MAKES IT! Assist: Rudy Smith
Score: 10-5

[08:02] Team_094 possession (Score: 10-5)
Tim Russell drives to the basket... Tim Russell throws a bad pass out of bounds! TURNOVER! (dead ball)

[07:47] Team_089 possession (Score: 10-5)
Rudy Smith attempts a Layup. BLOCKED BY TIM RUSSELL! Ball is loose! Offensive rebound by Terry Simmons! Terry Simmons kicks it out.

[07:30] Team_089 possession (Score: 10-5)
Allen Mobley drives and kicks out. Terry Simmons attempts a 3Pt. Contested by Kobe Bryant (5.0 feet, MAN). Terry Simmons misses. Offensive rebound by Jalen Jackson! Jalen Jackson kicks it out.

[07:17] Team_089 possession (Score: 10-5)
Jalen Jackson attempts a 3Pt. Contested by Lauri Thompson (5.1 feet, MAN). JALEN JACKSON MAKES IT! Assist: Rudy Smith
Score: 13-5

[07:00] Team_094 possession (Score: 13-5)
Lauri Thompson attempts a 3Pt. Contested by Jalen Jackson (5.1 feet, MAN). Lauri Thompson misses. Rebound secured by Terry Simmons.

[06:46] Team_089 possession (Score: 13-5)
Allen Mobley attempts a Midrange. Contested by Kobe Wagner (4.2 feet, MAN). Allen Mobley misses. Rebound secured by Kobe Wagner.

[06:31] Team_094 possession (Score: 13-5)
Tim Russell drives and kicks out. Terry Ingram attempts a 3Pt. Contested by Jordan Brogdon (3.2 feet, MAN). TERRY INGRAM MAKES IT! Assist: Tim Russell
Score: 13-8

[06:16] Team_089 possession (Score: 13-8)
Jordan Brogdon attempts a Layup. Contested by Tim Russell (4.8 feet, ZONE). JORDAN BROGDON MAKES IT!
Score: 15-8

[06:00] Team_094 possession (Score: 15-8)
Terry Ingram attempts a Layup. Contested by Terry Simmons (3.8 feet, ZONE). Terry Ingram misses. Rebound secured by Terry Simmons.

[05:48] Team_089 possession (Score: 15-8)
Terry Simmons attempts a Midrange. Contested by Lauri Thompson (5.4 feet, ZONE). Terry Simmons misses. Rebound secured by Kobe Bryant.

[05:34] Team_094 possession (Score: 15-8)
Tim Russell attempts a 3Pt. Contested by Jalen Jackson (4.9 feet, ZONE). Tim Russell misses. Rebound secured by Rudy Smith.

[05:24] Team_089 possession (Score: 15-8)
Rudy Smith attempts a Layup. Contested by Tim Russell (5.3 feet, ZONE). RUDY SMITH MAKES IT!
Score: 17-8

[05:11] Team_094 possession (Score: 17-8)
Tim Russell attempts a Midrange. Contested by Allen Mobley (4.3 feet, ZONE). Tim Russell misses. Offensive rebound by Tim Russell! Tim Russell kicks it out.

[04:52] Team_094 possession (Score: 17-8)
Kobe Wagner drives, Terry Simmons stays with him. Kobe Wagner attempts a Dunk. Contested by Terry Simmons (4.0 feet, ZONE). Kobe Wagner misses. Offensive rebound by Tim Russell! Tim Russell kicks it out.

[04:39] Team_094 possession (Score: 17-8)
Tim Russell attempts a Midrange. Contested by Allen Mobley (4.3 feet, ZONE). TIM RUSSELL MAKES IT! Assist: Terry Ingram
Score: 17-10

[04:22] Team_089 possession (Score: 17-10)
Terry Simmons attempts a Midrange. Contested by Tim Russell (5.4 feet, ZONE). Terry Simmons misses. Rebound secured by Tim Russell.

[04:08] Team_094 possession (Score: 17-10)
Terry Ingram attempts a 3Pt. Contested by Jordan Brogdon (3.6 feet, ZONE). TERRY INGRAM MAKES IT! Assist: Lauri Thompson
Score: 17-13

[03:49] Team_089 possession (Score: 17-13)
Jalen Jackson attempts a Midrange. Contested by Lauri Thompson (5.2 feet, ZONE). JALEN JACKSON MAKES IT!
Score: 19-13

[03:32] Team_094 possession (Score: 19-13)
Kobe Bryant drives, Terry Simmons stays with him. Kobe Bryant attempts a Dunk. Contested by Terry Simmons (3.9 feet, MAN). KOBE BRYANT MAKES IT! Assist: Tim Russell
Score: 19-15

[03:19] Team_089 possession (Score: 19-15)
Rudy Smith attempts a 3Pt. Contested by Tim Russell (5.4 feet, MAN). Rudy Smith misses. Rebound secured by Tim Russell.

[03:03] Team_094 possession (Score: 19-15)
FOUL! Holding foul on Jordan Brogdon. [Team fouls: 3] No free throws, side out. (Jordan Brogdon: 2 personal fouls)

[02:45] Team_094 possession (Score: 19-15)
Kobe Bryant attempts a 3Pt. Contested by Jalen Jackson (5.1 feet, ZONE). Kobe Bryant misses. Rebound secured by Terry Simmons.

[02:33] Team_089 possession (Score: 19-15)
Allen Mobley attempts a Midrange. BLOCKED BY KOBE WAGNER! Ball is loose! Rebound secured by Kobe Bryant.

[02:20] Team_094 possession (Score: 19-15)
Kobe Bryant drives to the basket... Kobe Bryant throws a bad pass! Stolen by Terry Simmons! TURNOVER! (live ball)

[02:03] Team_089 possession (Score: 19-15)
Jordan Brogdon attempts a 3Pt. Contested by Terry Ingram (5.0 feet, MAN). JORDAN BROGDON MAKES IT! Assist: Allen Mobley
Score: 22-15

[01:45] Team_094 possession (Score: 22-15)
Kobe Bryant attempts a Midrange. Contested by Rudy Smith (5.2 feet, ZONE). Kobe Bryant misses. Rebound secured by Rudy Smith.

[01:35] Team_089 possession (Score: 22-15)
Terry Simmons attempts a Midrange. Contested by Kobe Bryant (5.8 feet, MAN). Terry Simmons misses. Rebound secured by Kobe Wagner.

[01:18] Team_094 possession (Score: 22-15)
Lauri Thompson makes the Layup and draws the foul on Jalen Jackson! And-1! Lauri Thompson to the line for 1. [Team fouls: 4] (Jalen Jackson: 1 personal fouls)   FT 1/1: MISS Lauri Thompson makes 0/1 from the line. Rebound secured by Jalen Jackson.
Score: 22-17

[01:01] Team_089 possession (Score: 22-17)
Rudy Smith commits a violation (traveling/carry)! TURNOVER! (dead ball)

[01:01] Substitution (Team_089): Jordan Brogdon OUT → Tony Parker IN (stamina_rule2)

[01:01] Substitution (Team_089): Jalen Jackson OUT → Joel Barnes IN (stamina_rule2)

[01:01] Substitution (Team_089): Allen Mobley OUT → Pascal Durant IN (stamina_rule2)

[01:01] Substitution (Team_089): Rudy Smith OUT → Devin Haliburton IN (stamina_rule2)

[01:01] Substitution (Team_089): Terry Simmons OUT → Evan Gasol IN (stamina_rule2)

[01:01] Substitution (Team_094): Terry Ingram OUT → Shaquille Bryant IN (stamina_rule2)

[01:01] Substitution (Team_094): Lauri Thompson OUT → Kevin Rozier IN (stamina_rule2)

[01:01] Substitution (Team_094): Kobe Wagner OUT → Ayo Gasol IN (stamina_rule2)

[01:01] Substitution (Team_094): Tim Russell OUT → Domantas Haliburton IN (stamina_rule2)

[01:01] Substitution (Team_094): Kobe Bryant OUT → Isaiah Quickley IN (stamina_rule2)

[00:47] Team_094 possession (Score: 22-17)
Kevin Rozier attempts a Layup. Wide open! Joel Barnes is 6.0 feet away. [MAN] KEVIN ROZIER MAKES IT! Assist: Shaquille Bryant
Score: 22-19

[00:35] Team_089 possession (Score: 22-19)
Joel Barnes makes the Midrange and draws the foul on Kevin Rozier! And-1! Joel Barnes to the line for 1. [Team fouls: 1] (Kevin Rozier: 1 personal fouls)   FT 1/1: GOOD Joel Barnes makes 1/1 from the line.
Score: 25-19

[00:16] Team_094 possession (Score: 25-19)
Domantas Haliburton attempts a Midrange. Contested by Pascal Durant (3.9 feet, ZONE). Domantas Haliburton misses. Rebound secured by Devin Haliburton.

================================================================================
                              1ST QUARTER COMPLETE                              
================================================================================

1ST QUARTER SCORE: Team_089 25, Team_094 19

BOX SCORE:
================================================================================

Team_089
--------------------------------------------------------------------------------
Player                MIN  PTS  REB  AST  TO      FG   FG%      3P   3P%
--------------------------------------------------------------------------------
Jordan Brogdon         11   10    0    0   0   4/4   100.0     0/0   0.0
Jalen Jackson          11    8    3    0   0   3/3   100.0     0/0   0.0
Joel Barnes             1    3    0    0   0   1/1   100.0     0/0   0.0
Terry Simmons          11    2    6    0   0   1/5    20.0     0/0   0.0
Rudy Smith             11    2    3    2   0   1/3    33.3     0/0   0.0
Allen Mobley           11    0    0    2   0   0/3     0.0     0/0   0.0
Devin Haliburton        1    0    1    0   0   0/0     0.0     0/0   0.0

TEAM: FG: 10/19 (52.6%), 3PT: 3/4 (75.0%), REB: 13 (2 off, 11 def), AST: 4, TO: 2
TEAM FOULS: 4


Team_094
--------------------------------------------------------------------------------
Player                MIN  PTS  REB  AST  TO      FG   FG%      3P   3P%
--------------------------------------------------------------------------------
Terry Ingram           11    9    0    1   0   3/4    75.0     0/0   0.0
Tim Russell            11    4    5    2   0   2/5    40.0     0/0   0.0
Kobe Bryant            11    2    4    0   0   1/3    33.3     0/0   0.0
Kevin Rozier            1    2    0    0   0   1/1   100.0     0/0   0.0
Kobe Wagner            11    0    2    0   0   0/1     0.0     0/0   0.0
Lauri Thompson         11    0    0    1   0   0/3     0.0     0/0   0.0
Shaquille Bryant        1    0    0    1   0   0/0     0.0     0/0   0.0
Domantas Haliburton     1    0    0    0   0   0/1     0.0     0/0   0.0

TEAM: FG: 7/18 (38.9%), 3PT: 1/6 (16.7%), REB: 11 (2 off, 9 def), AST: 5, TO: 3
TEAM FOULS: 1

================================================================================

================================================================================
                       2ND QUARTER - Team_089 vs Team_094                       
================================================================================

[12:00] Team_089 possession (Score: 25-19)
Jalen Jackson attempts a 3Pt. Contested by Kobe Wagner (4.5 feet, ZONE). Jalen Jackson misses. Rebound secured by Tim Russell.

[11:46] Team_094 possession (Score: 25-19)
Tim Russell drives, Rudy Smith stays with him. Tim Russell attempts a Dunk. Contested by Rudy Smith (5.0 feet, MAN). TIM RUSSELL MAKES IT!
Score: 25-21

[11:31] Team_089 possession (Score: 25-21)
Terry Simmons attempts a 3Pt. Contested by Kobe Wagner (4.9 feet, ZONE). Terry Simmons misses. Rebound secured by Kobe Bryant.

[11:16] Team_094 possession (Score: 25-21)
FOUL! Shooting foul on Rudy Smith. Tim Russell to the line for 2 free throws. [Team fouls: 1] (Rudy Smith: 1 personal fouls)   FT 1/2: MISS   FT 2/2: GOOD Tim Russell makes 1/2 from the line.
Score: 25-22

[11:03] Team_089 possession (Score: 25-22)
Terry Simmons drives to the basket... Terry Simmons loses control! Ball rolls out of bounds! TURNOVER! (dead ball)

[11:03] Substitution (Team_089): Jordan Brogdon OUT → Tony Parker IN (stamina_rule2)

[11:03] Substitution (Team_089): Terry Simmons OUT → Evan Gasol IN (stamina_rule2)

[11:03] Substitution (Team_094): Terry Ingram OUT → Shaquille Bryant IN (stamina_rule2)

[10:48] Team_094 possession (Score: 25-22)
Shaquille Bryant throws a bad pass out of bounds! TURNOVER! (dead ball)

[10:48] Substitution (Team_089): Rudy Smith OUT → Devin Haliburton IN (stamina_rule2)

[10:48] Substitution (Team_094): Tim Russell OUT → Domantas Haliburton IN (stamina_rule2)

[10:32] Team_089 possession (Score: 25-22)
Devin Haliburton attempts a Layup. Wide open! Domantas Haliburton is 6.3 feet away. [MAN] Devin Haliburton misses. Rebound secured by Kobe Bryant.

[10:15] Team_094 possession (Score: 25-22)
Lauri Thompson drives, Devin Haliburton stays with him. Lauri Thompson attempts a Dunk. Contested by Devin Haliburton (5.3 feet, ZONE). Lauri Thompson misses. Rebound secured by Devin Haliburton.

[09:58] Team_089 possession (Score: 25-22)
Jalen Jackson attempts a Midrange. Contested by Lauri Thompson (5.3 feet, MAN). Jalen Jackson misses. Rebound secured by Domantas Haliburton.

[09:41] Team_094 possession (Score: 25-22)
Lauri Thompson attempts a Layup. BLOCKED BY JALEN JACKSON! Ball goes out off Jalen Jackson. Lauri Thompson's ball!

[09:26] Team_094 possession (Score: 25-22)
FOUL! Reach-in foul on Devin Haliburton during the drive. [Team fouls: 2] No free throws, side out. (Devin Haliburton: 1 personal fouls)

[09:15] Team_094 possession (Score: 25-22)
Shaquille Bryant throws a bad pass! Stolen by Tony Parker! TURNOVER! (live ball)

[09:02] Team_089 possession (Score: 25-22)
Jalen Jackson attempts a 3Pt. Contested by Shaquille Bryant (5.5 feet, ZONE). JALEN JACKSON MAKES IT! Assist: Tony Parker
Score: 28-22

[08:43] Team_094 possession (Score: 28-22)
Kobe Bryant attempts a 3Pt. Contested by Evan Gasol (4.6 feet, MAN). Kobe Bryant misses. Offensive rebound by Kobe Bryant! Kobe Bryant puts it back in!
Score: 28-24

[08:26] Team_089 possession (Score: 28-24)
Devin Haliburton attempts a 3Pt. Contested by Lauri Thompson (5.7 feet, ZONE). Devin Haliburton misses. Rebound secured by Kobe Bryant.

[08:11] Team_094 possession (Score: 28-24)
FOUL! Reach-in foul on Devin Haliburton during the drive. [Team fouls: 3] No free throws, side out. (Devin Haliburton: 2 personal fouls)

[08:01] Team_094 possession (Score: 28-24)
Lauri Thompson attempts a 3Pt. Contested by Jalen Jackson (5.5 feet, ZONE). Lauri Thompson misses. Rebound secured by Evan Gasol.

[07:45] Team_089 possession (Score: 28-24)
Allen Mobley attempts a 3Pt. Contested by Shaquille Bryant (5.3 feet, ZONE). Allen Mobley misses. Offensive rebound by Devin Haliburton! Devin Haliburton kicks it out.

[07:26] Team_089 possession (Score: 28-24)
Evan Gasol makes the Layup and draws the foul on Kobe Bryant! And-1! Evan Gasol to the line for 1. [Team fouls: 1] (Kobe Bryant: 1 personal fouls)   FT 1/1: GOOD Evan Gasol makes 1/1 from the line.
Score: 31-24

[07:13] Team_094 possession (Score: 31-24)
Shaquille Bryant drives and kicks out. FOUL! Shooting foul on Tony Parker. Shaquille Bryant to the line for 2 free throws. [Team fouls: 4] (Tony Parker: 1 personal fouls)   FT 1/2: GOOD   FT 2/2: GOOD Shaquille Bryant makes 2/2 from the line.
Score: 31-26

[06:59] Team_089 possession (Score: 31-26)
Devin Haliburton attempts a Midrange. Wide open! Domantas Haliburton is 6.3 feet away. [MAN] Devin Haliburton misses. Rebound secured by Kobe Bryant.

[06:46] Team_094 possession (Score: 31-26)
Kobe Bryant attempts a Midrange. Contested by Devin Haliburton (5.1 feet, ZONE). Kobe Bryant misses. Offensive rebound by Domantas Haliburton! Domantas Haliburton kicks it out.

[06:36] Team_094 possession (Score: 31-26)
Lauri Thompson attempts a Midrange. Contested by Jalen Jackson (5.7 feet, MAN). Lauri Thompson misses. Rebound secured by Evan Gasol.

[06:20] Team_089 possession (Score: 31-26)
Evan Gasol drives and kicks out. Allen Mobley attempts a 3Pt. Contested by Kobe Wagner (5.0 feet, MAN). Allen Mobley misses. Offensive rebound by Devin Haliburton! Devin Haliburton kicks it out.

[06:06] Team_089 possession (Score: 31-26)
Devin Haliburton attempts a Midrange. Wide open! Domantas Haliburton is 6.3 feet away. [ZONE] Devin Haliburton misses. Offensive rebound by Devin Haliburton! Devin Haliburton kicks it out.

[05:54] Team_089 possession (Score: 31-26)
Jalen Jackson attempts a 3Pt. Contested by Kobe Wagner (5.1 feet, ZONE). Jalen Jackson misses. Rebound secured by Kobe Wagner.

[05:39] Team_094 possession (Score: 31-26)
Lauri Thompson attempts a 3Pt. Contested by Jalen Jackson (5.8 feet, MAN). Lauri Thompson misses. Rebound secured by Jalen Jackson.

[05:25] Team_089 possession (Score: 31-26)
Devin Haliburton attempts a 3Pt. Wide open! Domantas Haliburton is 6.3 feet away. [MAN] DEVIN HALIBURTON MAKES IT! Assist: Jalen Jackson
Score: 34-26

[05:07] Team_094 possession (Score: 34-26)
Lauri Thompson attempts a Layup. Contested by Evan Gasol (4.6 feet, ZONE). LAURI THOMPSON MAKES IT!
Score: 34-28

[04:51] Team_089 possession (Score: 34-28)
Tony Parker attempts a 3Pt. Contested by Shaquille Bryant (5.6 feet, MAN). TONY PARKER MAKES IT! Assist: Devin Haliburton
Score: 37-28

[04:39] Team_094 possession (Score: 37-28)
FOUL! Reach-in foul on Tony Parker during the drive. [IN THE BONUS! 5 team fouls] Shaquille Bryant to the line for 2 free throws. (Tony Parker: 2 personal fouls)   FT 1/2: MISS   FT 2/2: GOOD Shaquille Bryant makes 1/2 from the line.
Score: 37-29

[04:24] Team_089 possession (Score: 37-29)
FOUL! Reach-in foul on Domantas Haliburton during the drive. [Team fouls: 2] No free throws, side out. (Domantas Haliburton: 1 personal fouls)

[04:10] Team_089 possession (Score: 37-29)
Jalen Jackson attempts a Layup. Contested by Domantas Haliburton (5.9 feet, ZONE). JALEN JACKSON MAKES IT! Assist: Tony Parker
Score: 39-29

[03:54] Team_094 possession (Score: 39-29)
FOUL! Holding foul on Jalen Jackson. [IN THE BONUS! 6 team fouls] Lauri Thompson to the line for 2 free throws. (Jalen Jackson: 1 personal fouls)   FT 1/2: GOOD   FT 2/2: GOOD Lauri Thompson makes 2/2 from the line.
Score: 39-31

[03:41] Team_089 possession (Score: 39-31)
Tony Parker attempts a 3Pt. Contested by Kobe Wagner (5.6 feet, ZONE). TONY PARKER MAKES IT! Assist: Allen Mobley
Score: 42-31

[03:26] Team_094 possession (Score: 42-31)
Lauri Thompson attempts a Midrange. Wide open! Jalen Jackson is 6.0 feet away. [MAN] LAURI THOMPSON MAKES IT! Assist: Kobe Wagner
Score: 42-33

[03:12] Team_089 possession (Score: 42-33)
Jalen Jackson attempts a Midrange. Wide open! Lauri Thompson is 6.0 feet away. [MAN] Jalen Jackson misses. Rebound secured by Domantas Haliburton.

[02:57] Team_094 possession (Score: 42-33)
Lauri Thompson attempts a Layup. BLOCKED BY DEVIN HALIBURTON! Ball deflects out of bounds off Lauri Thompson.

[02:45] Team_089 possession (Score: 42-33)
Allen Mobley throws a bad pass! Stolen by Kobe Wagner! TURNOVER! (live ball)

[02:32] Team_094 possession (Score: 42-33)
Lauri Thompson attempts a Layup. Contested by Devin Haliburton (5.2 feet, ZONE). Lauri Thompson misses. Rebound secured by Evan Gasol.

[02:18] Team_089 possession (Score: 42-33)
Evan Gasol makes the Midrange and draws the foul on Kobe Wagner! And-1! Evan Gasol to the line for 1. [Team fouls: 3] (Kobe Wagner: 1 personal fouls)   FT 1/1: GOOD Evan Gasol makes 1/1 from the line.
Score: 45-33

[02:00] Team_094 possession (Score: 45-33)
FOUL! Reach-in foul on Devin Haliburton during the drive. [IN THE BONUS! 7 team fouls] Kobe Bryant to the line for 2 free throws. (Devin Haliburton: 3 personal fouls)   FT 1/2: MISS   FT 2/2: GOOD Kobe Bryant makes 1/2 from the line.
Score: 45-34

[01:46] Team_089 possession (Score: 45-34)
FOUL! Holding foul on Kobe Bryant. [Team fouls: 4] No free throws, side out. (Kobe Bryant: 2 personal fouls)

[01:31] Team_089 possession (Score: 45-34)
Jalen Jackson attempts a Midrange. Wide open! Domantas Haliburton is 6.0 feet away. [ZONE] Jalen Jackson misses. Rebound secured by Kobe Bryant.

[01:17] Team_094 possession (Score: 45-34)
Lauri Thompson attempts a Midrange. Wide open! Jalen Jackson is 6.3 feet away. [MAN] LAURI THOMPSON MAKES IT! Assist: Kobe Wagner
Score: 45-36

[00:59] Team_089 possession (Score: 45-36)
Jalen Jackson drives, Lauri Thompson stays with him. Jalen Jackson attempts a Dunk. Wide open! Lauri Thompson is 6.3 feet away. [MAN] JALEN JACKSON MAKES IT! Assist: Evan Gasol
Score: 47-36

[00:41] Team_094 possession (Score: 47-36)
FOUL! Holding foul on Devin Haliburton. [IN THE BONUS! 8 team fouls] Domantas Haliburton to the line for 2 free throws. (Devin Haliburton: 4 personal fouls)   FT 1/2: MISS   FT 2/2: GOOD Domantas Haliburton makes 1/2 from the line.
Score: 47-37

[00:30] Team_089 possession (Score: 47-37)
Devin Haliburton attempts a 3Pt. Wide open! Domantas Haliburton is 6.5 feet away. [ZONE] Devin Haliburton misses. Rebound secured by Kobe Bryant.

[00:11] Team_094 possession (Score: 47-37)
Shaquille Bryant attempts a 3Pt. Contested by Devin Haliburton (5.0 feet, ZONE). SHAQUILLE BRYANT MAKES IT! Assist: Kobe Bryant
Score: 47-40

================================================================================
                              2ND QUARTER COMPLETE                              
================================================================================

2ND QUARTER SCORE: Team_089 22, Team_094 21

BOX SCORE:
================================================================================

Team_089
--------------------------------------------------------------------------------
Player                MIN  PTS  REB  AST  TO      FG   FG%      3P   3P%
--------------------------------------------------------------------------------
Jalen Jackson          23    7    1    1   0   3/8    37.5     0/0   0.0
Tony Parker            12    6    0    2   0   2/2   100.0     0/0   0.0
Evan Gasol             12    6    3    1   0   2/2   100.0     0/0   0.0
Devin Haliburton       11    3    4    1   0   1/5    20.0     0/0   0.0
Terry Simmons          12    0    0    0   0   0/1     0.0     0/0   0.0
Allen Mobley           23    0    0    1   0   0/0     0.0     0/0   0.0

TEAM: FG: 8/18 (44.4%), 3PT: 4/9 (44.4%), REB: 8 (3 off, 5 def), AST: 6, TO: 2
TEAM FOULS: 8 [Team_094 in BONUS]


Team_094
--------------------------------------------------------------------------------
Player                MIN  PTS  REB  AST  TO      FG   FG%      3P   3P%
--------------------------------------------------------------------------------
Lauri Thompson         23    8    0    0   0   4/10   40.0     0/0   0.0
Shaquille Bryant       12    6    0    0   0   3/3   100.0     0/0   0.0
Tim Russell            13    3    1    0   0   2/2   100.0     0/0   0.0
Kobe Bryant            23    3    7    1   0   2/2   100.0     0/0   0.0
Domantas Haliburton    11    1    3    0   0   1/1   100.0     0/0   0.0
Kobe Wagner            23    0    1    2   0   0/0     0.0     0/0   0.0

TEAM: FG: 12/18 (66.7%), 3PT: 2/4 (50.0%), REB: 12 (2 off, 10 def), AST: 3, TO: 2
TEAM FOULS: 4

================================================================================

================================================================================
                       3RD QUARTER - Team_089 vs Team_094                       
================================================================================

[12:00] Team_089 possession (Score: 47-40)
Allen Mobley attempts a 3Pt. Contested by Kobe Wagner (4.2 feet, ZONE). Allen Mobley misses. Rebound secured by Kobe Wagner.

[11:46] Team_094 possession (Score: 47-40)
Kobe Wagner attempts a 3Pt. Contested by Allen Mobley (4.6 feet, MAN). Kobe Wagner misses. Offensive rebound by Tim Russell! Tim Russell kicks it out.

[11:31] Team_094 possession (Score: 47-40)
Kobe Bryant attempts a Midrange. Contested by Rudy Smith (4.9 feet, ZONE). Kobe Bryant misses. Offensive rebound by Kobe Bryant! Kobe Bryant's putback is no good. Rebound secured by Rudy Smith.

[11:15] Team_089 possession (Score: 47-40)
Jalen Jackson attempts a 3Pt. Contested by Tim Russell (5.1 feet, ZONE). Jalen Jackson misses. Rebound secured by Tim Russell.

[11:00] Team_094 possession (Score: 47-40)
Kobe Wagner attempts a Midrange. Contested by Jalen Jackson (5.1 feet, ZONE). Kobe Wagner misses. Rebound secured by Jalen Jackson.

[10:41] Team_089 possession (Score: 47-40)
Jordan Brogdon attempts a 3Pt. Contested by Kobe Wagner (4.2 feet, ZONE). Jordan Brogdon misses. Rebound secured by Tim Russell.

[10:24] Team_094 possession (Score: 47-40)
Kobe Bryant makes the Dunk and draws the foul on Jalen Jackson! And-1! Kobe Bryant to the line for 1. [Team fouls: 1] (Jalen Jackson: 1 personal fouls)   FT 1/1: GOOD Kobe Bryant makes 1/1 from the line.
Score: 47-43

[10:06] Team_089 possession (Score: 47-43)
Terry Simmons attempts a Layup. Contested by Tim Russell (5.4 feet, ZONE). TERRY SIMMONS MAKES IT! Assist: Jalen Jackson
Score: 49-43

[09:50] Team_094 possession (Score: 49-43)
Kobe Bryant drives to the basket... Kobe Bryant throws a bad pass! Stolen by Terry Simmons! TURNOVER! (live ball)

[09:30] Team_089 possession (Score: 49-43)
Rudy Smith drives and kicks out. Terry Simmons attempts a Midrange. Contested by Lauri Thompson (4.8 feet, ZONE). TERRY SIMMONS MAKES IT! Assist: Rudy Smith
Score: 51-43

[09:13] Team_094 possession (Score: 51-43)
Tim Russell throws a bad pass out of bounds! TURNOVER! (dead ball)

[08:59] Team_089 possession (Score: 51-43)
Rudy Smith attempts a 3Pt. Contested by Kobe Wagner (4.6 feet, ZONE). RUDY SMITH MAKES IT! Assist: Jordan Brogdon
Score: 54-43

[08:43] Team_094 possession (Score: 54-43)
Lauri Thompson attempts a Layup. Contested by Terry Simmons (3.9 feet, ZONE). Lauri Thompson misses. Offensive rebound by Tim Russell! Tim Russell kicks it out.

[08:26] Team_094 possession (Score: 54-43)
Lauri Thompson makes the Midrange and draws the foul on Jalen Jackson! And-1! Lauri Thompson to the line for 1. [Team fouls: 2] (Jalen Jackson: 2 personal fouls)   FT 1/1: GOOD Lauri Thompson makes 1/1 from the line.
Score: 54-46

[08:14] Team_089 possession (Score: 54-46)
Rudy Smith makes the Layup and draws the foul on Tim Russell! And-1! Rudy Smith to the line for 1. [Team fouls: 1] (Tim Russell: 1 personal fouls)   FT 1/1: GOOD Rudy Smith makes 1/1 from the line.
Score: 57-46

[07:55] Team_094 possession (Score: 57-46)
Kobe Bryant attempts a Layup. Contested by Terry Simmons (3.7 feet, ZONE). KOBE BRYANT MAKES IT!
Score: 57-48

[07:41] Team_089 possession (Score: 57-48)
Allen Mobley attempts a 3Pt. Contested by Kobe Wagner (4.2 feet, MAN). Allen Mobley misses. Offensive rebound by Terry Simmons! Terry Simmons's putback is no good. Offensive rebound by Jalen Jackson! Jalen Jackson kicks it out.

[07:24] Team_089 possession (Score: 57-48)
Rudy Smith attempts a Midrange. Contested by Tim Russell (5.3 feet, MAN). Rudy Smith misses. Rebound secured by Kobe Bryant.

[07:15] Team_094 possession (Score: 57-48)
Terry Ingram attempts a 3Pt. Contested by Jordan Brogdon (3.5 feet, ZONE). Terry Ingram misses. Rebound secured by Jalen Jackson.

[07:02] Team_089 possession (Score: 57-48)
FOUL! Reach-in foul on Tim Russell during the drive. [Team fouls: 2] No free throws, side out. (Tim Russell: 2 personal fouls)

[06:47] Team_089 possession (Score: 57-48)
Terry Simmons makes the Layup and draws the foul on Tim Russell! And-1! Terry Simmons to the line for 1. [Team fouls: 3] (Tim Russell: 3 personal fouls)   FT 1/1: GOOD Terry Simmons makes 1/1 from the line.
Score: 60-48

[06:32] Team_094 possession (Score: 60-48)
Terry Ingram attempts a 3Pt. Contested by Jordan Brogdon (3.5 feet, ZONE). Terry Ingram misses. Offensive rebound by Tim Russell! Tim Russell kicks it out.

[06:19] Team_094 possession (Score: 60-48)
Kobe Wagner drives to the basket... Kobe Wagner commits a violation (traveling/carry)! TURNOVER! (dead ball)

[06:01] Team_089 possession (Score: 60-48)
FOUL! Holding foul on Tim Russell. [Team fouls: 4] No free throws, side out. (Tim Russell: 4 personal fouls)

[05:47] Team_089 possession (Score: 60-48)
Jordan Brogdon drives, picks up Terry Ingram. Help arrives from Kobe Wagner! Jordan Brogdon attempts a Dunk. Contested by Kobe Wagner (4.7 feet, MAN). Jordan Brogdon misses. Rebound secured by Tim Russell.

[05:32] Team_094 possession (Score: 60-48)
Terry Ingram attempts a 3Pt. Contested by Jordan Brogdon (3.5 feet, MAN). Terry Ingram misses. Rebound secured by Jalen Jackson.

[05:18] Team_089 possession (Score: 60-48)
Jordan Brogdon attempts a Layup. Contested by Tim Russell (4.8 feet, ZONE). JORDAN BROGDON MAKES IT! Assist: Jalen Jackson
Score: 62-48

[05:06] Team_094 possession (Score: 62-48)
Lauri Thompson attempts a Midrange. Contested by Jalen Jackson (5.1 feet, MAN). Lauri Thompson misses. Offensive rebound by Kobe Bryant! Kobe Bryant puts it back in!
Score: 62-50

[04:54] Team_089 possession (Score: 62-50)
Allen Mobley attempts a 3Pt. Contested by Kobe Wagner (4.2 feet, ZONE). Allen Mobley misses. Rebound secured by Tim Russell.

[04:40] Team_094 possession (Score: 62-50)
Lauri Thompson attempts a 3Pt. Contested by Jalen Jackson (5.1 feet, MAN). Lauri Thompson misses. FOUL! Loose ball foul on Jalen Jackson during the rebound battle. [Team fouls: 3] No free throws, side out. (Jalen Jackson: 3 personal fouls)

[04:26] Team_094 possession (Score: 62-50)
Tim Russell drives to the basket... Tim Russell loses the ball! Stripped by Terry Simmons! TURNOVER! (live ball)

[04:09] Team_089 possession (Score: 62-50)
Allen Mobley drives to the basket... Allen Mobley throws a bad pass! Stolen by Kobe Bryant! TURNOVER! (live ball)

[03:53] Team_094 possession (Score: 62-50)
Kobe Bryant drives to the basket... Kobe Bryant throws a bad pass! Stolen by Terry Simmons! TURNOVER! (live ball)

[03:42] Team_089 possession (Score: 62-50)
Allen Mobley drives to the basket... FOUL! Offensive foul on Allen Mobley! Kobe Wagner drew the charge! [Team fouls: 4] (Allen Mobley: 1 personal fouls) TURNOVER! (dead ball)

[03:30] Team_094 possession (Score: 62-50)
Kobe Bryant attempts a Midrange. Contested by Allen Mobley (4.4 feet, ZONE). KOBE BRYANT MAKES IT!
Score: 62-52

[03:12] Team_089 possession (Score: 62-52)
FOUL! Holding foul on Kobe Bryant. [IN THE BONUS! 5 team fouls] Terry Simmons to the line for 2 free throws. (Kobe Bryant: 1 personal fouls)   FT 1/2: MISS   FT 2/2: MISS Terry Simmons makes 0/2 from the line. Rebound secured by Kobe Wagner.

[02:59] Team_094 possession (Score: 62-52)
Terry Ingram attempts a 3Pt. Contested by Jordan Brogdon (3.7 feet, MAN). TERRY INGRAM MAKES IT! Assist: Lauri Thompson
Score: 62-55

[02:40] Team_089 possession (Score: 62-55)
Terry Simmons drives, Kobe Bryant stays with him. Terry Simmons attempts a Dunk. Contested by Kobe Bryant (5.7 feet, MAN). TERRY SIMMONS MAKES IT!
Score: 64-55

[02:25] Team_094 possession (Score: 64-55)
Kobe Wagner attempts a 3Pt. Contested by Jordan Brogdon (3.9 feet, ZONE). Kobe Wagner misses. Rebound secured by Rudy Smith.

[02:11] Team_089 possession (Score: 64-55)
Rudy Smith attempts a 3Pt. Contested by Kobe Wagner (4.8 feet, ZONE). RUDY SMITH MAKES IT! Assist: Allen Mobley
Score: 67-55

[01:58] Team_094 possession (Score: 67-55)
FOUL! Shooting foul on Allen Mobley. Kobe Wagner to the line for 2 free throws. [BONUS: 5 team fouls] (Allen Mobley: 2 personal fouls)   FT 1/2: GOOD   FT 2/2: GOOD Kobe Wagner makes 2/2 from the line.
Score: 67-57

[01:47] Team_089 possession (Score: 67-57)
Terry Simmons drives and kicks out. Allen Mobley attempts a Midrange. Contested by Kobe Wagner (4.4 feet, ZONE). ALLEN MOBLEY MAKES IT!
Score: 69-57

[01:34] Team_094 possession (Score: 69-57)
Terry Ingram attempts a 3Pt. Contested by Jordan Brogdon (3.9 feet, MAN). Terry Ingram misses. Rebound secured by Jalen Jackson.

[01:25] Team_089 possession (Score: 69-57)
Jalen Jackson drives, picks up Tim Russell. Help arrives from Lauri Thompson! Jalen Jackson attempts a Dunk. Contested by Lauri Thompson (5.3 feet, ZONE). Jalen Jackson misses. Rebound secured by Kobe Bryant.

[01:14] Team_094 possession (Score: 69-57)
Kobe Bryant drives to the basket... Kobe Bryant throws a bad pass out of bounds! TURNOVER! (dead ball)

[01:14] Substitution (Team_089): Jordan Brogdon OUT → Tony Parker IN (stamina_rule2)

[01:14] Substitution (Team_089): Jalen Jackson OUT → Joel Barnes IN (stamina_rule2)

[01:14] Substitution (Team_089): Allen Mobley OUT → Pascal Durant IN (stamina_rule2)

[01:14] Substitution (Team_089): Rudy Smith OUT → Devin Haliburton IN (stamina_rule2)

[01:14] Substitution (Team_089): Terry Simmons OUT → Evan Gasol IN (stamina_rule2)

[01:14] Substitution (Team_094): Terry Ingram OUT → Shaquille Bryant IN (stamina_rule2)

[01:14] Substitution (Team_094): Lauri Thompson OUT → Kevin Rozier IN (stamina_rule2)

[01:14] Substitution (Team_094): Kobe Wagner OUT → Ayo Gasol IN (stamina_rule2)

[01:14] Substitution (Team_094): Tim Russell OUT → Domantas Haliburton IN (stamina_rule2)

[01:14] Substitution (Team_094): Kobe Bryant OUT → Isaiah Quickley IN (stamina_rule2)

[01:02] Team_089 possession (Score: 69-57)
Joel Barnes drives, Kevin Rozier stays with him. Joel Barnes attempts a Dunk. Contested by Kevin Rozier (5.2 feet, MAN). JOEL BARNES MAKES IT!
Score: 71-57

[00:48] Team_094 possession (Score: 71-57)
Shaquille Bryant loses control! Ball rolls out of bounds! TURNOVER! (dead ball)

[00:32] Team_089 possession (Score: 71-57)
FOUL! Shooting foul on Isaiah Quickley. Evan Gasol to the line for 2 free throws. [BONUS: 6 team fouls] (Isaiah Quickley: 1 personal fouls)   FT 1/2: MISS   FT 2/2: GOOD Evan Gasol makes 1/2 from the line.
Score: 72-57

[00:15] Team_094 possession (Score: 72-57)
FOUL! Holding foul on Pascal Durant. [IN THE BONUS! 6 team fouls] Ayo Gasol to the line for 2 free throws. (Pascal Durant: 1 personal fouls)   FT 1/2: GOOD   FT 2/2: GOOD Ayo Gasol makes 2/2 from the line.
Score: 72-59

[00:02] Team_089 possession (Score: 72-59)
Devin Haliburton drives and kicks out. Tony Parker attempts a 3Pt. Contested by Shaquille Bryant (5.3 feet, MAN). Tony Parker misses. Rebound secured by Domantas Haliburton.

================================================================================
                              3RD QUARTER COMPLETE                              
================================================================================

3RD QUARTER SCORE: Team_089 25, Team_094 19

BOX SCORE:
================================================================================

Team_089
--------------------------------------------------------------------------------
Player                MIN  PTS  REB  AST  TO      FG   FG%      3P   3P%
--------------------------------------------------------------------------------
Rudy Smith             24    9    2    1   0   3/4    75.0     0/0   0.0
Terry Simmons          23    9    0    0   0   4/4   100.0     0/0   0.0
Allen Mobley           34    2    0    1   0   1/3    33.3     0/0   0.0
Jordan Brogdon         23    2    0    1   0   1/3    33.3     0/0   0.0
Joel Barnes             2    2    0    0   0   1/1   100.0     0/0   0.0
Evan Gasol             13    1    0    0   0   1/1   100.0     0/0   0.0
Jalen Jackson          34    0    5    2   0   0/2     0.0     0/0   0.0
Devin Haliburton       13    0    0    0   0   0/1     0.0     0/0   0.0

TEAM: FG: 11/20 (55.0%), 3PT: 2/6 (33.3%), REB: 6 (1 off, 5 def), AST: 5, TO: 2
TEAM FOULS: 6 [Team_094 in BONUS]


Team_094
--------------------------------------------------------------------------------
Player                MIN  PTS  REB  AST  TO      FG   FG%      3P   3P%
--------------------------------------------------------------------------------
Kobe Bryant            34    9    4    0   0   4/5    80.0     0/0   0.0
Lauri Thompson         34    3    0    1   0   1/1   100.0     0/0   0.0
Terry Ingram           23    3    0    0   0   1/4    25.0     0/0   0.0
Kobe Wagner            34    2    2    0   0   1/3    33.3     0/0   0.0
Ayo Gasol               2    2    0    0   0   1/1   100.0     0/0   0.0
Tim Russell            24    0    7    0   0   0/0     0.0     0/0   0.0
Domantas Haliburton    13    0    1    0   0   0/0     0.0     0/0   0.0

TEAM: FG: 8/14 (57.1%), 3PT: 1/5 (20.0%), REB: 15 (6 off, 9 def), AST: 1, TO: 7
TEAM FOULS: 6 [Team_089 in BONUS]

================================================================================

================================================================================
                       4TH QUARTER - Team_089 vs Team_094                       
================================================================================

[12:00] Team_089 possession (Score: 72-59)
Jalen Jackson attempts a 3Pt. Contested by Lauri Thompson (5.2 feet, MAN). Jalen Jackson misses. Rebound secured by Kobe Wagner.

[11:44] Team_094 possession (Score: 72-59)
Tim Russell attempts a 3Pt. Contested by Jordan Brogdon (3.5 feet, ZONE). Tim Russell misses. Rebound secured by Rudy Smith.

[11:31] Team_089 possession (Score: 72-59)
FOUL! Offensive foul on Rudy Smith! Tim Russell drew the charge! [Team fouls: 1] (Rudy Smith: 1 personal fouls) TURNOVER! (dead ball)

[11:20] Team_094 possession (Score: 72-59)
Tim Russell attempts a Midrange. Contested by Rudy Smith (5.0 feet, MAN). TIM RUSSELL MAKES IT! Assist: Lauri Thompson
Score: 72-61

[11:05] Team_089 possession (Score: 72-61)
Allen Mobley attempts a Midrange. Contested by Kobe Wagner (4.4 feet, MAN). Allen Mobley misses. Rebound secured by Tim Russell.

[10:48] Team_094 possession (Score: 72-61)
Kobe Wagner drives to the basket... Kobe Wagner loses the ball! Stripped by Terry Simmons! TURNOVER! (live ball)

[10:34] Team_089 possession (Score: 72-61)
Allen Mobley attempts a 3Pt. Contested by Kobe Wagner (4.4 feet, MAN). Allen Mobley misses. Rebound secured by Kobe Wagner.

[10:22] Team_094 possession (Score: 72-61)
Kobe Wagner attempts a Layup. Contested by Allen Mobley (4.7 feet, MAN). KOBE WAGNER MAKES IT!
Score: 72-63

[10:07] Team_089 possession (Score: 72-63)
Jordan Brogdon attempts a 3Pt. Contested by Kobe Wagner (4.4 feet, ZONE). Jordan Brogdon misses. Rebound secured by Tim Russell.

[09:52] Team_094 possession (Score: 72-63)
Terry Ingram attempts a Layup. Contested by Terry Simmons (4.2 feet, ZONE). TERRY INGRAM MAKES IT! Assist: Tim Russell
Score: 72-65

[09:40] Team_089 possession (Score: 72-65)
FOUL! Reach-in foul on Tim Russell during the drive. [Team fouls: 1] No free throws, side out. (Tim Russell: 1 personal fouls)

[09:25] Team_089 possession (Score: 72-65)
Jordan Brogdon attempts a 3Pt. Contested by Terry Ingram (5.2 feet, MAN). Jordan Brogdon misses. Rebound secured by Tim Russell.

[09:11] Team_094 possession (Score: 72-65)
Terry Ingram drives, Jordan Brogdon stays with him. Terry Ingram attempts a Dunk. Contested by Jordan Brogdon (4.0 feet, MAN). Terry Ingram misses. Rebound secured by Jalen Jackson.

[08:58] Team_089 possession (Score: 72-65)
Allen Mobley attempts a 3Pt. Contested by Kobe Wagner (4.6 feet, ZONE). Allen Mobley misses. Rebound secured by Kobe Bryant.

[08:40] Team_094 possession (Score: 72-65)
Tim Russell attempts a Midrange. Contested by Rudy Smith (5.3 feet, MAN). Tim Russell misses. Rebound secured by Rudy Smith.

[08:24] Team_089 possession (Score: 72-65)
Rudy Smith drives and kicks out. Allen Mobley attempts a 3Pt. Contested by Kobe Wagner (4.6 feet, MAN). Allen Mobley misses. Rebound secured by Kobe Bryant.

[08:10] Team_094 possession (Score: 72-65)
Kobe Bryant attempts a 3Pt. Contested by Terry Simmons (4.3 feet, MAN). Kobe Bryant misses. Rebound secured by Terry Simmons.

[07:57] Team_089 possession (Score: 72-65)
Rudy Smith attempts a Layup. Contested by Tim Russell (5.7 feet, ZONE). RUDY SMITH MAKES IT! Assist: Allen Mobley
Score: 74-65

[07:42] Team_094 possession (Score: 74-65)
Kobe Bryant attempts a Midrange. Contested by Terry Simmons (4.4 feet, MAN). Kobe Bryant misses. Rebound secured by Rudy Smith.

[07:29] Team_089 possession (Score: 74-65)
Allen Mobley attempts a Midrange. Contested by Tim Russell (5.4 feet, ZONE). Allen Mobley misses. Rebound secured by Kobe Bryant.

[07:18] Team_094 possession (Score: 74-65)
FOUL! Holding foul on Allen Mobley. [Team fouls: 2] No free throws, side out. (Allen Mobley: 1 personal fouls)

[07:05] Team_094 possession (Score: 74-65)
Kobe Bryant drives, picks up Terry Simmons. Help arrives from Jalen Jackson! Kobe Bryant attempts a Layup. Contested by Jalen Jackson (4.5 feet, ZONE). KOBE BRYANT MAKES IT! Assist: Kobe Wagner
Score: 74-67

[06:52] Team_089 possession (Score: 74-67)
Jalen Jackson attempts a Midrange. Contested by Lauri Thompson (5.6 feet, ZONE). JALEN JACKSON MAKES IT! Assist: Terry Simmons
Score: 76-67

[06:35] Team_094 possession (Score: 76-67)
Terry Ingram drives to the basket... Terry Ingram throws a bad pass! Stolen by Jordan Brogdon! TURNOVER! (live ball)

[06:19] Team_089 possession (Score: 76-67)
Jordan Brogdon attempts a 3Pt. Contested by Terry Ingram (5.6 feet, MAN). Jordan Brogdon misses. Rebound secured by Tim Russell.

[06:07] Team_094 possession (Score: 76-67)
Kobe Bryant attempts a Midrange. Contested by Terry Simmons (4.6 feet, MAN). Kobe Bryant misses. Rebound secured by Terry Simmons.

[05:55] Team_089 possession (Score: 76-67)
Jalen Jackson attempts a 3Pt. Contested by Terry Ingram (5.9 feet, ZONE). Jalen Jackson misses. Rebound secured by Kobe Bryant.

[05:43] Team_094 possession (Score: 76-67)
Tim Russell attempts a Midrange. Contested by Jalen Jackson (5.6 feet, ZONE). TIM RUSSELL MAKES IT! Assist: Kobe Wagner
Score: 76-69

[05:29] Team_089 possession (Score: 76-69)
Allen Mobley attempts a 3Pt. Contested by Terry Ingram (5.8 feet, ZONE). Allen Mobley misses. Rebound secured by Tim Russell.

[05:14] Team_094 possession (Score: 76-69)
Kobe Wagner attempts a 3Pt. Contested by Allen Mobley (5.2 feet, MAN). KOBE WAGNER MAKES IT! Assist: Lauri Thompson
Score: 76-72

[04:58] Team_089 possession (Score: 76-72)
FOUL! Shooting foul on Kobe Wagner. Jalen Jackson to the line for 2 free throws. [Team fouls: 2] (Kobe Wagner: 1 personal fouls)   FT 1/2: GOOD   FT 2/2: MISS Jalen Jackson makes 1/2 from the line. Rebound secured by Tim Russell.
Score: 77-72

[04:47] Team_094 possession (Score: 77-72)
FOUL! Offensive foul on Tim Russell! Rudy Smith drew the charge! [Team fouls: 3] (Tim Russell: 2 personal fouls) TURNOVER! (dead ball)

[04:31] Team_089 possession (Score: 77-72)
Jordan Brogdon attempts a 3Pt. Contested by Kobe Wagner (5.1 feet, ZONE). Jordan Brogdon misses. Rebound secured by Tim Russell.

[04:15] Team_094 possession (Score: 77-72)
Tim Russell drives, picks up Terry Simmons. Help arrives from Jalen Jackson! Tim Russell attempts a Layup. Contested by Jalen Jackson (4.9 feet, ZONE). TIM RUSSELL MAKES IT!
Score: 77-74

[04:04] Team_089 possession (Score: 77-74)
Jordan Brogdon makes the Layup and draws the foul on Terry Ingram! And-1! Jordan Brogdon to the line for 1. [Team fouls: 4] (Terry Ingram: 1 personal fouls)   FT 1/1: GOOD Jordan Brogdon makes 1/1 from the line.
Score: 80-74

[03:52] Team_094 possession (Score: 80-74)
Tim Russell commits a violation (traveling/carry)! TURNOVER! (dead ball)

[03:52] Substitution (Team_089): Jordan Brogdon OUT → Tony Parker IN (stamina_rule2)

[03:52] Substitution (Team_089): Jalen Jackson OUT → Joel Barnes IN (stamina_rule2)

[03:52] Substitution (Team_089): Allen Mobley OUT → Pascal Durant IN (stamina_rule2)

[03:52] Substitution (Team_089): Rudy Smith OUT → Devin Haliburton IN (stamina_rule2)

[03:52] Substitution (Team_089): Terry Simmons OUT → Evan Gasol IN (stamina_rule2)

[03:52] Substitution (Team_094): Terry Ingram OUT → Shaquille Bryant IN (stamina_rule2)

[03:52] Substitution (Team_094): Lauri Thompson OUT → Kevin Rozier IN (stamina_rule2)

[03:52] Substitution (Team_094): Kobe Wagner OUT → Ayo Gasol IN (stamina_rule2)

[03:52] Substitution (Team_094): Tim Russell OUT → Domantas Haliburton IN (stamina_rule2)

[03:52] Substitution (Team_094): Kobe Bryant OUT → Isaiah Quickley IN (stamina_rule2)

[03:36] Team_089 possession (Score: 80-74)
Devin Haliburton attempts a 3Pt. Wide open! Domantas Haliburton is 6.3 feet away. [ZONE] DEVIN HALIBURTON MAKES IT! Assist: Pascal Durant
Score: 83-74

[03:17] Team_094 possession (Score: 83-74)
Isaiah Quickley drives and kicks out. Shaquille Bryant attempts a 3Pt. Contested by Tony Parker (5.3 feet, MAN). Shaquille Bryant misses. Rebound secured by Devin Haliburton.

[03:02] Team_089 possession (Score: 83-74)
Tony Parker drives, Isaiah Quickley stays with him. Tony Parker attempts a Dunk. Wide open! Isaiah Quickley is 6.3 feet away. [ZONE] Tony Parker misses. Rebound secured by Isaiah Quickley.

[02:49] Team_094 possession (Score: 83-74)
Shaquille Bryant attempts a Midrange. Contested by Tony Parker (5.0 feet, MAN). Shaquille Bryant misses. Rebound secured by Evan Gasol.

[02:33] Team_089 possession (Score: 83-74)
Joel Barnes drives and kicks out. Pascal Durant attempts a 3Pt. Contested by Domantas Haliburton (5.8 feet, ZONE). Pascal Durant misses. Rebound secured by Domantas Haliburton.

[02:16] Team_094 possession (Score: 83-74)
Kevin Rozier attempts a Midrange. Wide open! Joel Barnes is 6.0 feet away. [MAN] Kevin Rozier misses. Offensive rebound by Domantas Haliburton! Domantas Haliburton kicks it out.

[02:02] Team_094 possession (Score: 83-74)
Isaiah Quickley attempts a Layup. Contested by Devin Haliburton (5.2 feet, ZONE). ISAIAH QUICKLEY MAKES IT!
Score: 83-76

[01:48] Team_089 possession (Score: 83-76)
FOUL! Reach-in foul on Kevin Rozier during the drive. [IN THE BONUS! 5 team fouls] Joel Barnes to the line for 2 free throws. (Kevin Rozier: 1 personal fouls)   FT 1/2: GOOD   FT 2/2: GOOD Joel Barnes makes 2/2 from the line.
Score: 85-76

[01:36] Team_094 possession (Score: 85-76)
Isaiah Quickley makes the Layup and draws the foul on Devin Haliburton! And-1! Isaiah Quickley to the line for 1. [Team fouls: 3] (Devin Haliburton: 1 personal fouls)   FT 1/1: GOOD Isaiah Quickley makes 1/1 from the line.
Score: 85-79

[01:21] Team_089 possession (Score: 85-79)
Devin Haliburton attempts a 3Pt. Contested by Shaquille Bryant (5.8 feet, ZONE). Devin Haliburton misses. Offensive rebound by Evan Gasol! Evan Gasol kicks it out.

[01:07] Team_089 possession (Score: 85-79)
Joel Barnes attempts a 3Pt. Contested by Domantas Haliburton (6.0 feet, ZONE). Joel Barnes misses. Rebound secured by Domantas Haliburton.

[00:53] Team_094 possession (Score: 85-79)
FOUL! Reach-in foul on Evan Gasol during the drive. [Team fouls: 4] No free throws, side out. (Evan Gasol: 1 personal fouls)

[00:40] Team_094 possession (Score: 85-79)
Kevin Rozier attempts a Layup. Contested by Devin Haliburton (5.5 feet, ZONE). Kevin Rozier misses. Rebound secured by Pascal Durant.

[00:25] Team_089 possession (Score: 85-79)
Joel Barnes attempts a 3Pt. Contested by Domantas Haliburton (6.0 feet, ZONE). Joel Barnes misses. Offensive rebound by Evan Gasol! Evan Gasol kicks it out.

[00:12] Team_089 possession (Score: 85-79)
Devin Haliburton attempts a 3Pt. Wide open! Domantas Haliburton is 6.3 feet away. [ZONE] Devin Haliburton misses. Rebound secured by Ayo Gasol.

================================================================================
                              4TH QUARTER COMPLETE                              
================================================================================

4TH QUARTER SCORE: Team_089 13, Team_094 20

BOX SCORE:
================================================================================

Team_089
--------------------------------------------------------------------------------
Player                MIN  PTS  REB  AST  TO      FG   FG%      3P   3P%
--------------------------------------------------------------------------------
Jordan Brogdon         32    3    0    0   0   1/5    20.0     0/0   0.0
Devin Haliburton       16    3    1    0   0   1/2    50.0     0/0   0.0
Jalen Jackson          43    2    1    0   0   1/4    25.0     0/0   0.0
Rudy Smith             32    2    3    0   0   1/2    50.0     0/0   0.0
Joel Barnes             6    2    0    0   0   1/3    33.3     0/0   0.0
Allen Mobley           43    0    0    1   0   0/5     0.0     0/0   0.0
Terry Simmons          32    0    2    1   0   0/0     0.0     0/0   0.0
Pascal Durant           6    0    1    1   0   0/0     0.0     0/0   0.0
Tony Parker            16    0    0    0   0   0/1     0.0     0/0   0.0
Evan Gasol             16    0    3    0   0   0/0     0.0     0/0   0.0

TEAM: FG: 5/22 (22.7%), 3PT: 1/12 (8.3%), REB: 11 (2 off, 9 def), AST: 3, TO: 1
TEAM FOULS: 4


Team_094
--------------------------------------------------------------------------------
Player                MIN  PTS  REB  AST  TO      FG   FG%      3P   3P%
--------------------------------------------------------------------------------
Tim Russell            32    6    7    1   0   3/5    60.0     0/0   0.0
Kobe Wagner            43    5    2    2   0   2/2   100.0     0/0   0.0
Isaiah Quickley         6    5    1    0   0   2/3    66.7     0/0   0.0
Terry Ingram           32    2    0    0   0   1/2    50.0     0/0   0.0
Kobe Bryant            43    2    4    0   0   1/4    25.0     0/0   0.0
Lauri Thompson         43    0    0    2   0   0/0     0.0     0/0   0.0
Shaquille Bryant       16    0    0    0   0   0/1     0.0     0/0   0.0
Domantas Haliburton    16    0    3    0   0   0/0     0.0     0/0   0.0
Kevin Rozier            6    0    0    0   0   0/1     0.0     0/0   0.0
Ayo Gasol               6    0    1    0   0   0/0     0.0     0/0   0.0

TEAM: FG: 9/18 (50.0%), 3PT: 1/3 (33.3%), REB: 18 (1 off, 17 def), AST: 5, TO: 4
TEAM FOULS: 5 [Team_089 in BONUS]

================================================================================

================================================================================
                               FULL GAME COMPLETE                               
================================================================================

FINAL SCORE: Team_089 85, Team_094 79

SCORING BY QUARTER:
--------------------------------------------------------------------------------
Team                     Q1     Q2     Q3     Q4    FINAL
--------------------------------------------------------------------------------
Team_089                 25     22     25     13       85
Team_094                 19     21     19     20       79
--------------------------------------------------------------------------------

FULL GAME BOX SCORE:
================================================================================

Team_089
--------------------------------------------------------------------------------
Player                MIN  PTS  REB  AST  TO      FG   FG%      3P   3P%      FT STL BLK
--------------------------------------------------------------------------------
Jalen Jackson          43   17   10    3   1   7/17   41.2   3/8    37.5   1/2     0   1
Allen Mobley           43    2    0    5   3   1/11    9.1   0/5     0.0   0/0     0   0
Rudy Smith             32   13    8    3   3   6/10   60.0   2/3    66.7   1/1     0   0
Jordan Brogdon         32   15    0    1   0   5/11   45.5   1/6    16.7   1/1     1   0
Terry Simmons          32   11    8    1   0   5/10   50.0   0/1     0.0   1/3     5   0
Tony Parker            16    6    0    2   0   2/3    66.7   2/2   100.0   0/0     1   0
Evan Gasol             16    7    6    1   0   3/3   100.0   0/0     0.0   3/4     0   0
Devin Haliburton       16    6    6    1   0   2/8    25.0   2/5    40.0   0/0     0   1
Joel Barnes             6    7    0    0   0   3/5    60.0   0/1     0.0   3/3     0   0
Pascal Durant           6    0    1    1   0   0/0     0.0   0/0     0.0   0/0     0   0

TEAM: FG: 34/79 (43.0%), 3PT: 10/31 (32.3%), REB: 38 (8 off, 30 def), AST: 18, TO: 7


Team_094
--------------------------------------------------------------------------------
Player                MIN  PTS  REB  AST  TO      FG   FG%      3P   3P%      FT STL BLK
--------------------------------------------------------------------------------
Lauri Thompson         43   11    0    4   1   5/14   35.7   0/3     0.0   3/4     0   0
Kobe Wagner            43    7    7    4   0   3/6    50.0   1/3    33.3   2/2     1   1
Kobe Bryant            43   16   19    1   5   7/13   53.8   1/3    33.3   2/3     1   0
Tim Russell            32   13   20    3   5   8/13   61.5   0/3     0.0   1/2     0   1
Terry Ingram           32   14    0    1   2   4/9    44.4   2/5    40.0   1/1     0   0
Shaquille Bryant       16    6    0    1   3   3/4    75.0   1/1   100.0   3/4     0   0
Domantas Haliburton    16    1    7    0   0   0/1     0.0   0/0     0.0   1/2     0   0
Kevin Rozier            6    2    0    0   0   1/2    50.0   0/0     0.0   0/0     0   0
Ayo Gasol               6    2    1    0   0   0/0     0.0   0/0     0.0   2/2     0   0
Isaiah Quickley         6    5    1    0   0   2/3    66.7   0/0     0.0   1/1     0   0

TEAM: FG: 36/68 (52.9%), 3PT: 5/18 (27.8%), REB: 56 (11 off, 45 def), AST: 14, TO: 16

================================================================================
