================================================================================
                        FULL GAME - Team_060 vs Team_054                        
================================================================================

================================================================================
                       1ST QUARTER - Team_060 vs Team_054                       
================================================================================

[12:00] Team_060 possession (Score: 0-0)
FOUL! Shooting foul on Blake Russell. Larry Westbrook to the line for 2 free throws. [Team fouls: 1] (Blake Russell: 1 personal fouls)   FT 1/2: GOOD   FT 2/2: MISS Larry Westbrook makes 1/2 from the line. Rebound secured by Lauri Irving.
Score: 1-0

[11:43] Team_054 possession (Score: 1-0)
Vince Ball attempts a Layup. Contested by Immanuel Ming (3.8 feet, MAN). VINCE BALL MAKES IT! Assist: Malcolm Harden
Score: 1-2

[11:29] Team_060 possession (Score: 1-2)
Julius Green attempts a Midrange. Contested by Lauri Irving (3.2 feet, MAN). Julius Green misses. Rebound secured by Lauri Irving.

[11:13] Team_054 possession (Score: 1-2)
Blake Russell attempts a 3Pt. Contested by Jaren George (5.6 feet, MAN). BLAKE RUSSELL MAKES IT! Assist: Lauri Irving
Score: 1-5

[10:57] Team_060 possession (Score: 1-5)
Julius Green attempts a Midrange. Contested by Lauri Irving (3.2 feet, MAN). Julius Green misses. Rebound secured by Luka Brogdon.

[10:39] Team_054 possession (Score: 1-5)
Malcolm Harden drives, Joel Morant stays with him. Malcolm Harden attempts a Dunk. Contested by Joel Morant (5.5 feet, MAN). Malcolm Harden misses. Rebound secured by Jaren George.

[10:28] Team_060 possession (Score: 1-5)
Larry Westbrook attempts a Midrange. Contested by Luka Brogdon (4.5 feet, ZONE). LARRY WESTBROOK MAKES IT!
Score: 3-5

[10:14] Team_054 possession (Score: 3-5)
Lauri Irving attempts a Midrange. Contested by Julius Green (4.3 feet, MAN). Lauri Irving misses. Rebound secured by Jaren George.

[10:00] Team_060 possession (Score: 3-5)
Jaren George drives and kicks out. Joel Morant attempts a 3Pt. Contested by Malcolm Harden (4.1 feet, MAN). Joel Morant misses. Rebound secured by Blake Russell.

[09:45] Team_054 possession (Score: 3-5)
Vince Ball attempts a 3Pt. Contested by Julius Green (3.9 feet, ZONE). VINCE BALL MAKES IT! Assist: Blake Russell
Score: 3-8

[09:29] Team_060 possession (Score: 3-8)
Jaren George drives to the basket... Jaren George loses control! Ball rolls out of bounds! TURNOVER! (dead ball)

[09:15] Team_054 possession (Score: 3-8)
Blake Russell attempts a Midrange. Contested by Larry Westbrook (5.1 feet, ZONE). BLAKE RUSSELL MAKES IT! Assist: Lauri Irving
Score: 3-10

[08:59] Team_060 possession (Score: 3-10)
Larry Westbrook attempts a Layup. Contested by Luka Brogdon (4.5 feet, MAN). Larry Westbrook misses. Rebound secured by Lauri Irving.

[08:46] Team_054 possession (Score: 3-10)
Luka Brogdon attempts a Midrange. Contested by Larry Westbrook (5.0 feet, ZONE). Luka Brogdon misses. Offensive rebound by Blake Russell! Blake Russell puts it back in!
Score: 3-12

[08:35] Team_060 possession (Score: 3-12)
Julius Green attempts a 3Pt. Contested by Lauri Irving (3.2 feet, MAN). JULIUS GREEN MAKES IT! Assist: Jaren George
Score: 6-12

[08:23] Team_054 possession (Score: 6-12)
Vince Ball attempts a 3Pt. Contested by Immanuel Ming (3.8 feet, MAN). VINCE BALL MAKES IT! Assist: Luka Brogdon
Score: 6-15

[08:11] Team_060 possession (Score: 6-15)
Immanuel Ming attempts a 3Pt. Contested by Lauri Irving (3.4 feet, ZONE). IMMANUEL MING MAKES IT! Assist: Joel Morant
Score: 9-15

[07:54] Team_054 possession (Score: 9-15)
Malcolm Harden drives, Jaren George stays with him. Malcolm Harden attempts a Dunk. Contested by Jaren George (5.5 feet, ZONE). MALCOLM HARDEN MAKES IT! Assist: Vince Ball
Score: 9-17

[07:41] Team_060 possession (Score: 9-17)
Immanuel Ming makes the Layup and draws the foul on Vince Ball! And-1! Immanuel Ming to the line for 1. [Team fouls: 2] (Vince Ball: 1 personal fouls)   FT 1/1: GOOD Immanuel Ming makes 1/1 from the line.
Score: 12-17

[07:25] Team_054 possession (Score: 12-17)
Lauri Irving drives to the basket... Lauri Irving loses control! Ball rolls out of bounds! TURNOVER! (dead ball)

[07:16] Team_060 possession (Score: 12-17)
Julius Green attempts a Midrange. Contested by Lauri Irving (3.2 feet, MAN). Julius Green misses. Rebound secured by Blake Russell.

[07:01] Team_054 possession (Score: 12-17)
Blake Russell makes the Layup and draws the foul on Jaren George! And-1! Blake Russell to the line for 1. [Team fouls: 1] (Jaren George: 1 personal fouls)   FT 1/1: GOOD Blake Russell makes 1/1 from the line.
Score: 12-20

[06:50] Team_060 possession (Score: 12-20)
Jaren George drives to the basket... Jaren George loses the ball! Stripped by Blake Russell! TURNOVER! (live ball)

[06:36] Team_054 possession (Score: 12-20)
Luka Brogdon drives, Larry Westbrook stays with him. Luka Brogdon attempts a Dunk. Contested by Larry Westbrook (5.0 feet, MAN). LUKA BROGDON MAKES IT! Assist: Blake Russell
Score: 12-22

[06:25] Team_060 possession (Score: 12-22)
Jaren George makes the Layup and draws the foul on Blake Russell! And-1! Jaren George to the line for 1. [Team fouls: 3] (Blake Russell: 2 personal fouls)   FT 1/1: MISS Jaren George makes 0/1 from the line. Rebound secured by Luka Brogdon.
Score: 14-22

[06:08] Team_054 possession (Score: 14-22)
Blake Russell attempts a 3Pt. Contested by Jaren George (5.6 feet, MAN). BLAKE RUSSELL MAKES IT! Assist: Malcolm Harden
Score: 14-25

[05:52] Team_060 possession (Score: 14-25)
Julius Green attempts a Midrange. Contested by Lauri Irving (3.2 feet, MAN). Julius Green misses. Offensive rebound by Jaren George! Jaren George puts it back in!
Score: 16-25

[05:38] Team_054 possession (Score: 16-25)
Malcolm Harden attempts a 3Pt. Contested by Julius Green (4.1 feet, ZONE). Malcolm Harden misses. Rebound secured by Larry Westbrook.

[05:26] Team_060 possession (Score: 16-25)
Joel Morant attempts a Layup. Contested by Blake Russell (2.7 feet, ZONE). JOEL MORANT MAKES IT!
Score: 18-25

[05:14] Team_054 possession (Score: 18-25)
Lauri Irving attempts a 3Pt. Contested by Julius Green (4.3 feet, MAN). LAURI IRVING MAKES IT! Assist: Vince Ball
Score: 18-28

[04:59] Team_060 possession (Score: 18-28)
Larry Westbrook throws a bad pass! Stolen by Luka Brogdon! TURNOVER! (live ball)

[04:41] Team_054 possession (Score: 18-28)
Malcolm Harden attempts a Layup. Contested by Joel Morant (5.6 feet, MAN). MALCOLM HARDEN MAKES IT!
Score: 18-30

[04:25] Team_060 possession (Score: 18-30)
Larry Westbrook attempts a 3Pt. Contested by Lauri Irving (4.0 feet, ZONE). Larry Westbrook misses. Offensive rebound by Immanuel Ming! Immanuel Ming kicks it out.

[04:13] Team_060 possession (Score: 18-30)
Joel Morant attempts a Layup. Contested by Blake Russell (2.9 feet, ZONE). JOEL MORANT MAKES IT! Assist: Jaren George
Score: 20-30

[03:56] Team_054 possession (Score: 20-30)
Blake Russell attempts a Midrange. Contested by Julius Green (4.3 feet, ZONE). BLAKE RUSSELL MAKES IT!
Score: 20-32

[03:42] Team_060 possession (Score: 20-32)
Immanuel Ming makes the Dunk and draws the foul on Lauri Irving! And-1! Immanuel Ming to the line for 1. [Team fouls: 4] (Lauri Irving: 1 personal fouls)   FT 1/1: MISS Immanuel Ming makes 0/1 from the line. Rebound secured by Blake Russell.
Score: 22-32

[03:27] Team_054 possession (Score: 22-32)
FOUL! Offensive foul on Vince Ball! Immanuel Ming drew the charge! [Team fouls: 5] (Vince Ball: 2 personal fouls) TURNOVER! (dead ball)

[03:12] Team_060 possession (Score: 22-32)
FOUL! Shooting foul on Lauri Irving. Jaren George to the line for 2 free throws. [BONUS: 6 team fouls] (Lauri Irving: 2 personal fouls)   FT 1/2: MISS   FT 2/2: GOOD Jaren George makes 1/2 from the line.
Score: 23-32

[03:00] Team_054 possession (Score: 23-32)
Luka Brogdon drives, picks up Jaren George. Help arrives from Julius Green! Luka Brogdon attempts a Layup. Contested by Julius Green (5.8 feet, ZONE). LUKA BROGDON MAKES IT! Assist: Lauri Irving
Score: 23-34

[02:47] Team_060 possession (Score: 23-34)
Larry Westbrook attempts a Layup. Contested by Luka Brogdon (4.6 feet, ZONE). LARRY WESTBROOK MAKES IT! Assist: Julius Green
Score: 25-34

[02:30] Team_054 possession (Score: 25-34)
Luka Brogdon attempts a 3Pt. Contested by Larry Westbrook (5.3 feet, MAN). Luka Brogdon misses. Offensive rebound by Blake Russell! Blake Russell puts it back in!
Score: 25-36

[02:16] Team_060 possession (Score: 25-36)
Julius Green attempts a 3Pt. Contested by Lauri Irving (3.5 feet, MAN). Julius Green misses. Rebound secured by Luka Brogdon.

[02:01] Team_054 possession (Score: 25-36)
Blake Russell attempts a Midrange. Contested by Jaren George (6.0 feet, MAN). Blake Russell misses. Rebound secured by Jaren George.

[01:49] Team_060 possession (Score: 25-36)
Joel Morant drives to the basket... Joel Morant loses control! Ball rolls out of bounds! TURNOVER! (dead ball)

[01:49] Substitution (Team_060): Joel Morant OUT → Domantas Barnes IN (stamina_rule2)

[01:49] Substitution (Team_060): Julius Green OUT → Rudy Ginobili IN (stamina_rule2)

[01:49] Substitution (Team_060): Immanuel Ming OUT → Jarrett Wagner IN (stamina_rule2)

[01:49] Substitution (Team_060): Larry Westbrook OUT → Yao Tatum IN (stamina_rule2)

[01:49] Substitution (Team_060): Jaren George OUT → Klay Haliburton IN (stamina_rule2)

[01:49] Substitution (Team_054): Malcolm Harden OUT → Shaquille Irving IN (stamina_rule2)

[01:49] Substitution (Team_054): Lauri Irving OUT → Bradley Quickley IN (stamina_rule2)

[01:49] Substitution (Team_054): Luka Brogdon OUT → Tobias Nowitzki IN (stamina_rule2)

[01:49] Substitution (Team_054): Blake Russell OUT → Devin Jackson IN (stamina_rule2)

[01:34] Team_054 possession (Score: 25-36)
Tobias Nowitzki attempts a Midrange. Contested by Yao Tatum (5.2 feet, MAN). Tobias Nowitzki misses. Rebound secured by Rudy Ginobili.

[01:25] Team_060 possession (Score: 25-36)
Domantas Barnes attempts a 3Pt. Contested by Shaquille Irving (4.6 feet, ZONE). Domantas Barnes misses. Rebound secured by Devin Jackson.

[01:11] Team_054 possession (Score: 25-36)
Devin Jackson attempts a 3Pt. Contested by Domantas Barnes (4.7 feet, ZONE). Devin Jackson misses. Rebound secured by Klay Haliburton.

[00:55] Team_060 possession (Score: 25-36)
Klay Haliburton attempts a Layup. Contested by Devin Jackson (5.6 feet, ZONE). KLAY HALIBURTON MAKES IT!
Score: 27-36

[00:42] Team_054 possession (Score: 27-36)
Vince Ball attempts a 3Pt. Contested by Domantas Barnes (4.7 feet, ZONE). Vince Ball misses. Rebound secured by Domantas Barnes.

[00:23] Team_060 possession (Score: 27-36)
Rudy Ginobili drives and kicks out. Jarrett Wagner attempts a Midrange. Contested by Vince Ball (4.5 feet, MAN). JARRETT WAGNER MAKES IT! Assist: Rudy Ginobili
Score: 29-36

[00:08] Team_054 possession (Score: 29-36)
Devin Jackson attempts a Midrange. Contested by Jarrett Wagner (5.0 feet, ZONE). Devin Jackson misses. Rebound secured by Klay Haliburton.

================================================================================
                              1ST QUARTER COMPLETE                              
================================================================================

1ST QUARTER SCORE: Team_060 29, Team_054 36

BOX SCORE:
================================================================================

Team_060
--------------------------------------------------------------------------------
Player                MIN  PTS  REB  AST  TO      FG   FG%      3P   3P%
--------------------------------------------------------------------------------
Immanuel Ming          10    6    1    0   0   2/3    66.7     0/0   0.0
Larry Westbrook        10    4    1    0   0   2/4    50.0     0/0   0.0
Joel Morant            10    4    0    1   0   2/2   100.0     0/0   0.0
Julius Green           10    3    0    1   0   1/5    20.0     0/0   0.0
Jaren George           10    3    4    2   0   2/4    50.0     0/0   0.0
Klay Haliburton         2    2    2    0   0   1/1   100.0     0/0   0.0
Jarrett Wagner          2    2    0    0   0   1/1   100.0     0/0   0.0
Rudy Ginobili           2    0    1    1   0   0/0     0.0     0/0   0.0
Domantas Barnes         2    0    1    0   0   0/1     0.0     0/0   0.0

TEAM: FG: 11/21 (52.4%), 3PT: 2/4 (50.0%), REB: 10 (2 off, 8 def), AST: 5, TO: 4
TEAM FOULS: 1


Team_054
--------------------------------------------------------------------------------
Player                MIN  PTS  REB  AST  TO      FG   FG%      3P   3P%
--------------------------------------------------------------------------------
Blake Russell          10   17    5    2   0   7/8    87.5     0/0   0.0
Vince Ball             12    8    0    2   0   3/4    75.0     0/0   0.0
Malcolm Harden         10    4    0    2   0   2/4    50.0     0/0   0.0
Luka Brogdon           10    4    3    1   0   2/2   100.0     0/0   0.0
Lauri Irving           10    3    3    3   0   1/2    50.0     0/0   0.0
Tobias Nowitzki         2    0    0    0   0   0/1     0.0     0/0   0.0
Devin Jackson           2    0    1    0   0   0/2     0.0     0/0   0.0

TEAM: FG: 15/23 (65.2%), 3PT: 6/9 (66.7%), REB: 12 (2 off, 10 def), AST: 10, TO: 2
TEAM FOULS: 6 [Team_060 in BONUS]

================================================================================

================================================================================
                       2ND QUARTER - Team_060 vs Team_054                       
================================================================================

[12:00] Team_060 possession (Score: 29-36)
Larry Westbrook drives and kicks out. Immanuel Ming attempts a 3Pt. Contested by Lauri Irving (3.5 feet, ZONE). Immanuel Ming misses. Rebound secured by Blake Russell.

[11:49] Team_054 possession (Score: 29-36)
Blake Russell throws a bad pass out of bounds! TURNOVER! (dead ball)

[11:36] Team_060 possession (Score: 29-36)
Julius Green attempts a Midrange. Contested by Luka Brogdon (3.9 feet, ZONE). JULIUS GREEN MAKES IT! Assist: Jaren George
Score: 31-36

[11:26] Team_054 possession (Score: 31-36)
Malcolm Harden attempts a Midrange. Contested by Joel Morant (5.7 feet, MAN). Malcolm Harden misses. Offensive rebound by Luka Brogdon! Luka Brogdon kicks it out.

[11:10] Team_054 possession (Score: 31-36)
Luka Brogdon drives and kicks out. Vince Ball attempts a Midrange. Contested by Julius Green (3.9 feet, ZONE). VINCE BALL MAKES IT!
Score: 31-38

[10:56] Team_060 possession (Score: 31-38)
Immanuel Ming attempts a Midrange. Contested by Vince Ball (4.4 feet, MAN). Immanuel Ming misses. Rebound secured by Lauri Irving.

[10:45] Team_054 possession (Score: 31-38)
Malcolm Harden attempts a Midrange. Contested by Jaren George (5.7 feet, ZONE). Malcolm Harden misses. Offensive rebound by Blake Russell! Blake Russell puts it back in!
Score: 31-40

[10:36] Team_060 possession (Score: 31-40)
Joel Morant attempts a 3Pt. Contested by Malcolm Harden (4.0 feet, MAN). Joel Morant misses. Rebound secured by Luka Brogdon.

[10:22] Team_054 possession (Score: 31-40)
Luka Brogdon attempts a 3Pt. Contested by Julius Green (4.3 feet, ZONE). LUKA BROGDON MAKES IT! Assist: Blake Russell
Score: 31-43

[10:09] Team_060 possession (Score: 31-43)
Joel Morant makes the Layup and draws the foul on Malcolm Harden! And-1! Joel Morant to the line for 1. [Team fouls: 1] (Malcolm Harden: 1 personal fouls)   FT 1/1: MISS Joel Morant makes 0/1 from the line. Rebound secured by Luka Brogdon.
Score: 33-43

[09:55] Team_054 possession (Score: 33-43)
Luka Brogdon drives, Jaren George stays with him. Luka Brogdon attempts a Dunk. Contested by Jaren George (5.9 feet, ZONE). LUKA BROGDON MAKES IT!
Score: 33-45

[09:43] Team_060 possession (Score: 33-45)
Julius Green loses the ball! Stripped by Lauri Irving! TURNOVER! (live ball)

[09:26] Team_054 possession (Score: 33-45)
Malcolm Harden attempts a 3Pt. Contested by Joel Morant (5.9 feet, MAN). MALCOLM HARDEN MAKES IT! Assist: Luka Brogdon
Score: 33-48

[09:12] Team_060 possession (Score: 33-48)
Larry Westbrook attempts a 3Pt. Contested by Luka Brogdon (4.7 feet, MAN). Larry Westbrook misses. Rebound secured by Blake Russell.

[08:56] Team_054 possession (Score: 33-48)
Vince Ball attempts a 3Pt. Contested by Immanuel Ming (4.0 feet, ZONE). Vince Ball misses. Rebound secured by Immanuel Ming.

[08:44] Team_060 possession (Score: 33-48)
Immanuel Ming attempts a 3Pt. Contested by Lauri Irving (3.8 feet, ZONE). Immanuel Ming misses. FOUL! Loose ball foul on Lauri Irving during the rebound battle. [Team fouls: 2] No free throws, side out. (Lauri Irving: 1 personal fouls)

[08:33] Team_060 possession (Score: 33-48)
FOUL! Holding foul on Vince Ball. [Team fouls: 3] No free throws, side out. (Vince Ball: 1 personal fouls)

[08:18] Team_060 possession (Score: 33-48)
Larry Westbrook attempts a 3Pt. Contested by Lauri Irving (4.3 feet, ZONE). Larry Westbrook misses. Rebound secured by Lauri Irving.

[08:04] Team_054 possession (Score: 33-48)
Malcolm Harden attempts a 3Pt. Wide open! Joel Morant is 6.1 feet away. [MAN] Malcolm Harden misses. Rebound secured by Jaren George.

[07:47] Team_060 possession (Score: 33-48)
Joel Morant attempts a Midrange. Contested by Malcolm Harden (4.4 feet, MAN). Joel Morant misses. Rebound secured by Luka Brogdon.

[07:32] Team_054 possession (Score: 33-48)
Lauri Irving attempts a 3Pt. Contested by Julius Green (4.8 feet, MAN). Lauri Irving misses. Rebound secured by Larry Westbrook.

[07:17] Team_060 possession (Score: 33-48)
Joel Morant attempts a 3Pt. Contested by Malcolm Harden (4.4 feet, MAN). JOEL MORANT MAKES IT! Assist: Julius Green
Score: 36-48

[06:59] Team_054 possession (Score: 36-48)
Blake Russell attempts a Midrange. Wide open! Jaren George is 6.3 feet away. [MAN] Blake Russell misses. Rebound secured by Jaren George.

[06:44] Team_060 possession (Score: 36-48)
Joel Morant makes the Layup and draws the foul on Malcolm Harden! And-1! Joel Morant to the line for 1. [Team fouls: 4] (Malcolm Harden: 2 personal fouls)   FT 1/1: GOOD Joel Morant makes 1/1 from the line.
Score: 39-48

[06:26] Team_054 possession (Score: 39-48)
Malcolm Harden drives to the basket... Malcolm Harden throws a bad pass! Stolen by Joel Morant! TURNOVER! (live ball)

[06:14] Team_060 possession (Score: 39-48)
Larry Westbrook drives, picks up Luka Brogdon. Help arrives from Lauri Irving! Larry Westbrook attempts a Layup. Contested by Lauri Irving (5.0 feet, MAN). LARRY WESTBROOK MAKES IT! Assist: Julius Green
Score: 41-48

[06:02] Team_054 possession (Score: 41-48)
Blake Russell drives, picks up Jaren George. Help arrives from Julius Green! Blake Russell attempts a Layup. Wide open! Julius Green is 6.4 feet away. [MAN] Blake Russell misses. Rebound secured by Larry Westbrook.

[05:45] Team_060 possession (Score: 41-48)
FOUL! Shooting foul on Lauri Irving. Julius Green to the line for 2 free throws. [BONUS: 5 team fouls] (Lauri Irving: 2 personal fouls)   FT 1/2: GOOD   FT 2/2: GOOD Julius Green makes 2/2 from the line.
Score: 43-48

[05:27] Team_054 possession (Score: 43-48)
Blake Russell attempts a Midrange. Contested by Larry Westbrook (6.0 feet, ZONE). BLAKE RUSSELL MAKES IT!
Score: 43-50

[05:13] Team_060 possession (Score: 43-50)
Immanuel Ming drives, Vince Ball stays with him. Immanuel Ming attempts a Layup. Contested by Vince Ball (5.1 feet, MAN). IMMANUEL MING MAKES IT! Assist: Larry Westbrook
Score: 45-50

[04:54] Team_054 possession (Score: 45-50)
Vince Ball attempts a 3Pt. Contested by Julius Green (4.8 feet, ZONE). VINCE BALL MAKES IT! Assist: Lauri Irving
Score: 45-53

[04:37] Team_060 possession (Score: 45-53)
Joel Morant attempts a 3Pt. Contested by Malcolm Harden (4.7 feet, MAN). JOEL MORANT MAKES IT! Assist: Larry Westbrook
Score: 48-53

[04:18] Team_054 possession (Score: 48-53)
Vince Ball attempts a Midrange. Contested by Immanuel Ming (4.5 feet, MAN). Vince Ball misses. Rebound secured by Jaren George.

[04:02] Team_060 possession (Score: 48-53)
Immanuel Ming attempts a Layup. Contested by Vince Ball (5.2 feet, MAN). Immanuel Ming misses. Rebound secured by Lauri Irving.

[03:50] Team_054 possession (Score: 48-53)
Luka Brogdon drives, Jaren George stays with him. Luka Brogdon attempts a Dunk. Wide open! Jaren George is 6.6 feet away. [ZONE] LUKA BROGDON MAKES IT! Assist: Lauri Irving
Score: 48-55

[03:38] Team_060 possession (Score: 48-55)
Immanuel Ming attempts a 3Pt. Contested by Vince Ball (5.2 feet, MAN). Immanuel Ming misses. Rebound secured by Blake Russell.

[03:22] Team_054 possession (Score: 48-55)
Luka Brogdon drives to the basket... Luka Brogdon loses the ball! Stripped by Larry Westbrook! TURNOVER! (live ball)

[03:09] Team_060 possession (Score: 48-55)
Julius Green attempts a Midrange. Contested by Lauri Irving (4.4 feet, ZONE). JULIUS GREEN MAKES IT! Assist: Larry Westbrook
Score: 50-55

[02:54] Team_054 possession (Score: 50-55)
Malcolm Harden drives and kicks out. Malcolm Harden attempts a 3Pt. Contested by Immanuel Ming (4.8 feet, ZONE). Malcolm Harden misses. Rebound secured by Jaren George.

[02:41] Team_060 possession (Score: 50-55)
Jaren George attempts a 3Pt. Contested by Blake Russell (4.7 feet, MAN). JAREN GEORGE MAKES IT! Assist: Larry Westbrook
Score: 53-55

[02:29] Team_054 possession (Score: 53-55)
Luka Brogdon attempts a 3Pt. Wide open! Larry Westbrook is 6.4 feet away. [MAN] Luka Brogdon misses. Rebound secured by Immanuel Ming.

[02:18] Team_060 possession (Score: 53-55)
Larry Westbrook attempts a 3Pt. Contested by Luka Brogdon (5.4 feet, ZONE). Larry Westbrook misses. Rebound secured by Luka Brogdon.

[02:04] Team_054 possession (Score: 53-55)
Malcolm Harden attempts a 3Pt. Contested by Immanuel Ming (5.0 feet, ZONE). Malcolm Harden misses. Offensive rebound by Blake Russell! Blake Russell kicks it out.

[01:51] Team_054 possession (Score: 53-55)
Malcolm Harden drives and kicks out. Lauri Irving attempts a Midrange. Contested by Immanuel Ming (5.0 feet, ZONE). LAURI IRVING MAKES IT!
Score: 53-57

[01:37] Team_060 possession (Score: 53-57)
Julius Green loses the ball! Stripped by Lauri Irving! TURNOVER! (live ball)

[01:23] Team_054 possession (Score: 53-57)
Malcolm Harden drives to the basket... Malcolm Harden throws a bad pass! Stolen by Jaren George! TURNOVER! (live ball)

[01:12] Team_060 possession (Score: 53-57)
FOUL! Reach-in foul on Blake Russell during the drive. [IN THE BONUS! 6 team fouls] Julius Green to the line for 2 free throws. (Blake Russell: 1 personal fouls)   FT 1/2: MISS   FT 2/2: MISS Julius Green makes 0/2 from the line. Rebound secured by Blake Russell.

[00:58] Team_054 possession (Score: 53-57)
Blake Russell attempts a Midrange. Contested by Immanuel Ming (5.3 feet, ZONE). BLAKE RUSSELL MAKES IT!
Score: 53-59

[00:45] Team_060 possession (Score: 53-59)
Larry Westbrook throws a bad pass out of bounds! TURNOVER! (dead ball)

[00:45] Substitution (Team_060): Joel Morant OUT → Domantas Barnes IN (stamina_rule2)

[00:45] Substitution (Team_060): Julius Green OUT → Rudy Ginobili IN (stamina_rule2)

[00:45] Substitution (Team_060): Immanuel Ming OUT → Jarrett Wagner IN (stamina_rule2)

[00:45] Substitution (Team_060): Larry Westbrook OUT → Yao Tatum IN (stamina_rule2)

[00:45] Substitution (Team_060): Jaren George OUT → Klay Haliburton IN (stamina_rule2)

[00:45] Substitution (Team_054): Malcolm Harden OUT → Shaquille Irving IN (stamina_rule2)

[00:45] Substitution (Team_054): Lauri Irving OUT → Bradley Quickley IN (stamina_rule2)

[00:45] Substitution (Team_054): Vince Ball OUT → Vince James IN (stamina_rule2)

[00:45] Substitution (Team_054): Luka Brogdon OUT → Tobias Nowitzki IN (stamina_rule2)

[00:45] Substitution (Team_054): Blake Russell OUT → Devin Jackson IN (stamina_rule2)

[00:32] Team_054 possession (Score: 53-59)
Tobias Nowitzki drives to the basket... Tobias Nowitzki throws a bad pass out of bounds! TURNOVER! (dead ball)

[00:20] Team_060 possession (Score: 53-59)
Jarrett Wagner attempts a 3Pt. Contested by Vince James (5.0 feet, ZONE). JARRETT WAGNER MAKES IT! Assist: Domantas Barnes
Score: 56-59

[00:07] Team_054 possession (Score: 56-59)
FOUL! Shooting foul on Domantas Barnes. Shaquille Irving to the line for 3 free throws. [Team fouls: 1] (Domantas Barnes: 1 personal fouls)   FT 1/3: GOOD   FT 2/3: GOOD   FT 3/3: GOOD Shaquille Irving makes 3/3 from the line.
Score: 56-62

================================================================================
                              2ND QUARTER COMPLETE                              
================================================================================

2ND QUARTER SCORE: Team_060 27, Team_054 26

BOX SCORE:
================================================================================

Team_060
--------------------------------------------------------------------------------
Player                MIN  PTS  REB  AST  TO      FG   FG%      3P   3P%
--------------------------------------------------------------------------------
Joel Morant            22    9    0    0   0   3/6    50.0     0/0   0.0
Julius Green           22    6    0    2   0   3/4    75.0     0/0   0.0
Jaren George           22    3    4    1   0   1/1   100.0     0/0   0.0
Jarrett Wagner          2    3    0    0   0   1/1   100.0     0/0   0.0
Larry Westbrook        22    2    2    4   0   1/5    20.0     0/0   0.0
Immanuel Ming          22    2    3    0   0   1/4    25.0     0/0   0.0
Domantas Barnes         2    0    0    1   0   0/0     0.0     0/0   0.0

TEAM: FG: 10/21 (47.6%), 3PT: 4/9 (44.4%), REB: 9 (1 off, 8 def), AST: 8, TO: 3
TEAM FOULS: 1


Team_054
--------------------------------------------------------------------------------
Player                MIN  PTS  REB  AST  TO      FG   FG%      3P   3P%
--------------------------------------------------------------------------------
Luka Brogdon           22    7    5    1   0   3/4    75.0     0/0   0.0
Blake Russell          22    6    6    1   0   3/5    60.0     0/0   0.0
Vince Ball             24    5    0    0   0   2/4    50.0     0/0   0.0
Malcolm Harden         22    3    0    0   0   1/3    33.3     0/0   0.0
Shaquille Irving        2    3    0    0   0   1/1   100.0     0/0   0.0
Lauri Irving           22    2    3    2   0   1/2    50.0     0/0   0.0

TEAM: FG: 11/19 (57.9%), 3PT: 4/8 (50.0%), REB: 14 (3 off, 11 def), AST: 4, TO: 5
TEAM FOULS: 6 [Team_060 in BONUS]

================================================================================

================================================================================
                       3RD QUARTER - Team_060 vs Team_054                       
================================================================================

[12:00] Team_060 possession (Score: 56-62)
FOUL! Shooting foul on Lauri Irving. Joel Morant to the line for 3 free throws. [Team fouls: 1] (Lauri Irving: 1 personal fouls)   FT 1/3: MISS   FT 2/3: MISS   FT 3/3: MISS Joel Morant makes 0/3 from the line. Rebound secured by Blake Russell.

[11:48] Team_054 possession (Score: 56-62)
Malcolm Harden drives to the basket... Malcolm Harden loses control! Ball rolls out of bounds! TURNOVER! (dead ball)

[11:39] Team_060 possession (Score: 56-62)
Joel Morant attempts a 3Pt. Contested by Malcolm Harden (3.8 feet, MAN). Joel Morant misses. Rebound secured by Lauri Irving.

[11:23] Team_054 possession (Score: 56-62)
FOUL! Reach-in foul on Jaren George during the drive. [Team fouls: 1] No free throws, side out. (Jaren George: 1 personal fouls)

[11:09] Team_054 possession (Score: 56-62)
FOUL! Shooting foul on Larry Westbrook. Lauri Irving to the line for 2 free throws. [Team fouls: 2] (Larry Westbrook: 1 personal fouls)   FT 1/2: MISS   FT 2/2: GOOD Lauri Irving makes 1/2 from the line.
Score: 56-63

[10:58] Team_060 possession (Score: 56-63)
Larry Westbrook attempts a 3Pt. Contested by Luka Brogdon (4.5 feet, MAN). Larry Westbrook misses. Rebound secured by Lauri Irving.

[10:40] Team_054 possession (Score: 56-63)
Vince Ball attempts a 3Pt. Contested by Julius Green (3.9 feet, ZONE). Vince Ball misses. Offensive rebound by Blake Russell! Blake Russell's putback is no good. Rebound secured by Larry Westbrook.

[10:23] Team_060 possession (Score: 56-63)
Julius Green attempts a 3Pt. Contested by Lauri Irving (3.2 feet, MAN). Julius Green misses. FOUL! Loose ball foul on Luka Brogdon during the rebound battle. [Team fouls: 2] No free throws, side out. (Luka Brogdon: 1 personal fouls)

[10:10] Team_060 possession (Score: 56-63)
Larry Westbrook drives and kicks out. FOUL! Shooting foul on Blake Russell. Jaren George to the line for 3 free throws. [Team fouls: 3] (Blake Russell: 1 personal fouls)   FT 1/3: MISS   FT 2/3: GOOD   FT 3/3: GOOD Jaren George makes 2/3 from the line.
Score: 58-63

[09:58] Team_054 possession (Score: 58-63)
FOUL! Holding foul on Joel Morant. [Team fouls: 3] No free throws, side out. (Joel Morant: 1 personal fouls)

[09:41] Team_054 possession (Score: 58-63)
Luka Brogdon attempts a Midrange. Contested by Larry Westbrook (5.0 feet, ZONE). Luka Brogdon misses. FOUL! Loose ball foul on Larry Westbrook during the rebound battle. [Team fouls: 4] No free throws, side out. (Larry Westbrook: 2 personal fouls)

[09:26] Team_054 possession (Score: 58-63)
Malcolm Harden drives to the basket... FOUL! Offensive foul on Malcolm Harden! Joel Morant drew the charge! [Team fouls: 4] (Malcolm Harden: 1 personal fouls) TURNOVER! (dead ball)

[09:07] Team_060 possession (Score: 58-63)
Immanuel Ming attempts a Midrange. Contested by Vince Ball (4.1 feet, MAN). IMMANUEL MING MAKES IT! Assist: Julius Green
Score: 60-63

[08:49] Team_054 possession (Score: 60-63)
Vince Ball attempts a Midrange. Contested by Immanuel Ming (3.8 feet, MAN). VINCE BALL MAKES IT! Assist: Luka Brogdon
Score: 60-65

[08:35] Team_060 possession (Score: 60-65)
FOUL! Holding foul on Malcolm Harden. [IN THE BONUS! 5 team fouls] Joel Morant to the line for 2 free throws. (Malcolm Harden: 2 personal fouls)   FT 1/2: GOOD   FT 2/2: MISS Joel Morant makes 1/2 from the line. Rebound secured by Blake Russell.
Score: 61-65

[08:23] Team_054 possession (Score: 61-65)
Blake Russell attempts a Layup. Contested by Jaren George (5.6 feet, ZONE). BLAKE RUSSELL MAKES IT! Assist: Lauri Irving
Score: 61-67

[08:09] Team_060 possession (Score: 61-67)
Immanuel Ming makes the Layup and draws the foul on Vince Ball! And-1! Immanuel Ming to the line for 1. [BONUS: 6 team fouls] (Vince Ball: 1 personal fouls)   FT 1/1: GOOD Immanuel Ming makes 1/1 from the line.
Score: 64-67

[07:51] Team_054 possession (Score: 64-67)
Blake Russell drives to the basket... FOUL! Offensive foul on Blake Russell! Jaren George drew the charge! [Team fouls: 7] (Blake Russell: 2 personal fouls) TURNOVER! (dead ball)

[07:41] Team_060 possession (Score: 64-67)
FOUL! Offensive foul on Immanuel Ming! Vince Ball drew the charge! [Team fouls: 5] (Immanuel Ming: 1 personal fouls) TURNOVER! (dead ball)

[07:26] Team_054 possession (Score: 64-67)
Lauri Irving makes the Dunk and draws the foul on Immanuel Ming! And-1! Lauri Irving to the line for 1. [BONUS: 6 team fouls] (Immanuel Ming: 2 personal fouls)   FT 1/1: GOOD Lauri Irving makes 1/1 from the line.
Score: 64-70

[07:13] Team_060 possession (Score: 64-70)
Julius Green attempts a Midrange. Contested by Lauri Irving (3.2 feet, MAN). JULIUS GREEN MAKES IT!
Score: 66-70

[06:59] Team_054 possession (Score: 66-70)
Lauri Irving attempts a Midrange. Contested by Julius Green (4.3 feet, MAN). Lauri Irving misses. Rebound secured by Larry Westbrook.

[06:44] Team_060 possession (Score: 66-70)
FOUL! Shooting foul on Blake Russell. Jaren George to the line for 2 free throws. [BONUS: 8 team fouls] (Blake Russell: 3 personal fouls)   FT 1/2: GOOD   FT 2/2: GOOD Jaren George makes 2/2 from the line.
Score: 68-70

[06:31] Team_054 possession (Score: 68-70)
Vince Ball attempts a Layup. Contested by Jaren George (5.3 feet, ZONE). Vince Ball misses. FOUL! Loose ball foul on Jaren George during the rebound battle. [IN THE BONUS! 7 team fouls] Luka Brogdon to the line for 2 free throws. (Jaren George: 2 personal fouls)   FT 1/2: GOOD   FT 2/2: GOOD Luka Brogdon makes 2/2 from the line.
Score: 68-72

[06:13] Team_060 possession (Score: 68-72)
Immanuel Ming attempts a Layup. BLOCKED BY VINCE BALL! Ball deflects out of bounds off Immanuel Ming.

[05:58] Team_054 possession (Score: 68-72)
Vince Ball attempts a Midrange. Contested by Larry Westbrook (4.7 feet, ZONE). Vince Ball misses. Offensive rebound by Luka Brogdon! Luka Brogdon kicks it out.

[05:44] Team_054 possession (Score: 68-72)
Vince Ball drives and kicks out. Luka Brogdon makes the Midrange and draws the foul on Julius Green! And-1! Luka Brogdon to the line for 1. [BONUS: 8 team fouls] (Julius Green: 1 personal fouls)   FT 1/1: GOOD Luka Brogdon makes 1/1 from the line.
Score: 68-75

[05:27] Team_060 possession (Score: 68-75)
Jaren George attempts a Layup. Contested by Blake Russell (3.2 feet, MAN). JAREN GEORGE MAKES IT! Assist: Immanuel Ming
Score: 70-75

[05:14] Team_054 possession (Score: 70-75)
FOUL! Reach-in foul on Jaren George during the drive. [IN THE BONUS! 9 team fouls] Blake Russell to the line for 2 free throws. (Jaren George: 3 personal fouls)   FT 1/2: GOOD   FT 2/2: MISS Blake Russell makes 1/2 from the line. Rebound secured by Immanuel Ming.
Score: 70-76

[04:57] Team_060 possession (Score: 70-76)
Jaren George attempts a 3Pt. Contested by Blake Russell (3.2 feet, MAN). Jaren George misses. Rebound secured by Lauri Irving.

[04:42] Team_054 possession (Score: 70-76)
Malcolm Harden attempts a 3Pt. Contested by Joel Morant (5.6 feet, MAN). MALCOLM HARDEN MAKES IT! Assist: Lauri Irving
Score: 70-79

[04:26] Team_060 possession (Score: 70-79)
Jaren George drives, picks up Blake Russell. Help arrives from Lauri Irving! Jaren George attempts a Dunk. Contested by Lauri Irving (3.3 feet, ZONE). Jaren George misses. Rebound secured by Lauri Irving.

[04:09] Team_054 possession (Score: 70-79)
Malcolm Harden drives and kicks out. Blake Russell attempts a 3Pt. Contested by Jaren George (5.3 feet, MAN). BLAKE RUSSELL MAKES IT! Assist: Luka Brogdon
Score: 70-82

[03:55] Team_060 possession (Score: 70-82)
Larry Westbrook attempts a Layup. BLOCKED BY BLAKE RUSSELL! Ball is loose! Rebound secured by Luka Brogdon.

[03:44] Team_054 possession (Score: 70-82)
Malcolm Harden drives and kicks out. Lauri Irving attempts a 3Pt. Contested by Julius Green (3.9 feet, MAN). Lauri Irving misses. Rebound secured by Larry Westbrook.

[03:30] Team_060 possession (Score: 70-82)
FOUL! Shooting foul on Blake Russell. Immanuel Ming to the line for 2 free throws. [BONUS: 9 team fouls] (Blake Russell: 4 personal fouls)   FT 1/2: MISS   FT 2/2: GOOD Immanuel Ming makes 1/2 from the line.
Score: 71-82

[03:13] Team_054 possession (Score: 71-82)
Malcolm Harden attempts a Layup. Contested by Jaren George (5.7 feet, ZONE). MALCOLM HARDEN MAKES IT!
Score: 71-84

[03:01] Team_060 possession (Score: 71-84)
Immanuel Ming drives and kicks out. Julius Green attempts a Midrange. Contested by Lauri Irving (3.6 feet, MAN). JULIUS GREEN MAKES IT!
Score: 73-84

[02:47] Team_054 possession (Score: 73-84)
Blake Russell attempts a Layup. Contested by Jaren George (5.9 feet, ZONE). BLAKE RUSSELL MAKES IT! Assist: Vince Ball
Score: 73-86

[02:32] Team_060 possession (Score: 73-86)
FOUL! Holding foul on Luka Brogdon. [IN THE BONUS! 10 team fouls] Larry Westbrook to the line for 2 free throws. (Luka Brogdon: 2 personal fouls)   FT 1/2: GOOD   FT 2/2: GOOD Larry Westbrook makes 2/2 from the line.
Score: 75-86

[02:13] Team_054 possession (Score: 75-86)
Malcolm Harden drives, Jaren George stays with him. Malcolm Harden attempts a Layup. Contested by Jaren George (5.8 feet, ZONE). MALCOLM HARDEN MAKES IT!
Score: 75-88

[01:54] Team_060 possession (Score: 75-88)
Julius Green drives to the basket... FOUL! Offensive foul on Julius Green! Blake Russell drew the charge! [Team fouls: 10] (Julius Green: 2 personal fouls) TURNOVER! (dead ball)

[01:36] Team_054 possession (Score: 75-88)
Vince Ball attempts a Layup. Contested by Jaren George (5.7 feet, ZONE). VINCE BALL MAKES IT! Assist: Malcolm Harden
Score: 75-90

[01:23] Team_060 possession (Score: 75-90)
Immanuel Ming attempts a 3Pt. Contested by Vince Ball (4.3 feet, MAN). Immanuel Ming misses. Rebound secured by Vince Ball.

[01:07] Team_054 possession (Score: 75-90)
Blake Russell attempts a Midrange. Wide open! Jaren George is 6.0 feet away. [MAN] BLAKE RUSSELL MAKES IT! Assist: Lauri Irving
Score: 75-92

[00:51] Team_060 possession (Score: 75-92)
Immanuel Ming attempts a 3Pt. Contested by Lauri Irving (3.8 feet, ZONE). Immanuel Ming misses. Rebound secured by Blake Russell.

[00:36] Team_054 possession (Score: 75-92)
Vince Ball attempts a 3Pt. Contested by Immanuel Ming (4.1 feet, MAN). Vince Ball misses. Rebound secured by Immanuel Ming.

[00:21] Team_060 possession (Score: 75-92)
Julius Green attempts a Midrange. Contested by Lauri Irving (3.7 feet, MAN). Julius Green misses. Offensive rebound by Immanuel Ming! Immanuel Ming kicks it out.

[00:06] Team_060 possession (Score: 75-92)
Jaren George drives and kicks out. Immanuel Ming attempts a 3Pt. Contested by Lauri Irving (4.0 feet, ZONE). Immanuel Ming misses. Rebound secured by Vince Ball.

================================================================================
                              3RD QUARTER COMPLETE                              
================================================================================

3RD QUARTER SCORE: Team_060 19, Team_054 30

BOX SCORE:
================================================================================

Team_060
--------------------------------------------------------------------------------
Player                MIN  PTS  REB  AST  TO      FG   FG%      3P   3P%
--------------------------------------------------------------------------------
Jaren George           34    6    1    0   0   3/6    50.0     0/0   0.0
Immanuel Ming          34    6    3    1   0   3/6    50.0     0/0   0.0
Julius Green           34    4    0    1   0   2/2   100.0     0/0   0.0
Larry Westbrook        34    2    3    0   0   1/3    33.3     0/0   0.0
Joel Morant            34    0    0    0   0   0/2     0.0     0/0   0.0

TEAM: FG: 9/20 (45.0%), 3PT: 0/6 (0.0%), REB: 6 (2 off, 4 def), AST: 2, TO: 2
TEAM FOULS: 10 [Team_054 in BONUS]


Team_054
--------------------------------------------------------------------------------
Player                MIN  PTS  REB  AST  TO      FG   FG%      3P   3P%
--------------------------------------------------------------------------------
Blake Russell          34    9    4    0   0   4/5    80.0     0/0   0.0
Malcolm Harden         34    7    0    1   0   3/4    75.0     0/0   0.0
Luka Brogdon           34    5    2    2   0   2/2   100.0     0/0   0.0
Lauri Irving           34    4    4    3   0   2/3    66.7     0/0   0.0
Vince Ball             36    4    2    1   0   2/4    50.0     0/0   0.0

TEAM: FG: 13/18 (72.2%), 3PT: 1/3 (33.3%), REB: 13 (3 off, 10 def), AST: 7, TO: 3
TEAM FOULS: 10 [Team_060 in BONUS]

================================================================================

================================================================================
                       4TH QUARTER - Team_060 vs Team_054                       
================================================================================

[12:00] Substitution (Team_060): Joel Morant OUT (stamina: 67) → Domantas Barnes IN (comeback_detected)

[12:00] Substitution (Team_054): Malcolm Harden OUT (stamina: 70) → Shaquille Irving IN (comeback_detected)

[12:00] Team_060 possession (Score: 75-92)
Immanuel Ming drives to the basket... FOUL! Offensive foul on Immanuel Ming! Blake Russell drew the charge! [Team fouls: 1] (Immanuel Ming: 1 personal fouls) TURNOVER! (dead ball)

[11:47] Team_054 possession (Score: 75-92)
Vince Ball attempts a Layup. BLOCKED BY IMMANUEL MING! Ball is loose! Offensive rebound by Luka Brogdon! Luka Brogdon kicks it out.

[11:38] Team_054 possession (Score: 75-92)
Luka Brogdon attempts a 3Pt. Contested by Larry Westbrook (5.4 feet, MAN). Luka Brogdon misses. Rebound secured by Domantas Barnes.

[11:26] Team_060 possession (Score: 75-92)
Julius Green drives and kicks out. Larry Westbrook attempts a 3Pt. Contested by Shaquille Irving (4.6 feet, ZONE). LARRY WESTBROOK MAKES IT!
Score: 78-92

[11:13] Team_054 possession (Score: 78-92)
Vince Ball drives to the basket... FOUL! Offensive foul on Vince Ball! Jaren George drew the charge! [Team fouls: 1] (Vince Ball: 1 personal fouls) TURNOVER! (dead ball)

[11:00] Team_060 possession (Score: 78-92)
Julius Green drives and kicks out. Larry Westbrook attempts a 3Pt. Contested by Luka Brogdon (4.3 feet, MAN). Larry Westbrook misses. Offensive rebound by Immanuel Ming! Immanuel Ming kicks it out.

[10:44] Team_060 possession (Score: 78-92)
Larry Westbrook attempts a Midrange. Contested by Blake Russell (4.0 feet, ZONE). Larry Westbrook misses. Rebound secured by Luka Brogdon.

[10:30] Team_054 possession (Score: 78-92)
Vince Ball attempts a 3Pt. Contested by Domantas Barnes (4.7 feet, ZONE). Vince Ball misses. Offensive rebound by Luka Brogdon! Luka Brogdon kicks it out.

[10:13] Team_054 possession (Score: 78-92)
Luka Brogdon attempts a 3Pt. Contested by Domantas Barnes (4.9 feet, ZONE). Luka Brogdon misses. Rebound secured by Immanuel Ming.

[09:58] Team_060 possession (Score: 78-92)
Larry Westbrook attempts a Layup. Contested by Blake Russell (4.1 feet, ZONE). LARRY WESTBROOK MAKES IT! Assist: Julius Green
Score: 80-92

[09:46] Team_054 possession (Score: 80-92)
Lauri Irving attempts a 3Pt. Contested by Julius Green (4.8 feet, MAN). LAURI IRVING MAKES IT! Assist: Shaquille Irving
Score: 80-95

[09:35] Team_060 possession (Score: 80-95)
Jaren George attempts a Midrange. Contested by Vince Ball (4.6 feet, ZONE). JAREN GEORGE MAKES IT! Assist: Domantas Barnes
Score: 82-95

[09:23] Team_054 possession (Score: 82-95)
Lauri Irving drives and kicks out. Shaquille Irving attempts a 3Pt. Contested by Domantas Barnes (4.6 feet, ZONE). SHAQUILLE IRVING MAKES IT! Assist: Blake Russell
Score: 82-98

[09:05] Team_060 possession (Score: 82-98)
Julius Green attempts a Midrange. Contested by Lauri Irving (3.9 feet, MAN). Julius Green misses. Offensive rebound by Domantas Barnes! Domantas Barnes kicks it out.

[08:54] Team_060 possession (Score: 82-98)
Jaren George attempts a Midrange. Contested by Vince Ball (4.7 feet, ZONE). Jaren George misses. Rebound secured by Vince Ball.

[08:38] Team_054 possession (Score: 82-98)
Vince Ball drives and kicks out. Vince Ball attempts a 3Pt. Contested by Domantas Barnes (4.6 feet, ZONE). VINCE BALL MAKES IT! Assist: Blake Russell
Score: 82-101

[08:19] Team_060 possession (Score: 82-101)
Julius Green drives, Lauri Irving stays with him. Julius Green attempts a Dunk. Contested by Lauri Irving (4.0 feet, MAN). Julius Green misses. Offensive rebound by Jaren George! Jaren George kicks it out.

[08:04] Team_060 possession (Score: 82-101)
Immanuel Ming attempts a 3Pt. Contested by Shaquille Irving (4.5 feet, ZONE). IMMANUEL MING MAKES IT! Assist: Julius Green
Score: 85-101

[07:49] Team_054 possession (Score: 85-101)
Blake Russell drives, Jaren George stays with him. Blake Russell attempts a Layup. Wide open! Jaren George is 6.4 feet away. [MAN] BLAKE RUSSELL MAKES IT!
Score: 85-103

[07:36] Team_060 possession (Score: 85-103)
Immanuel Ming attempts a 3Pt. Contested by Shaquille Irving (4.5 feet, ZONE). Immanuel Ming misses. Rebound secured by Blake Russell.

[07:17] Team_054 possession (Score: 85-103)
Shaquille Irving attempts a 3Pt. Contested by Domantas Barnes (5.0 feet, ZONE). Shaquille Irving misses. Rebound secured by Jaren George.

[07:05] Team_060 possession (Score: 85-103)
Immanuel Ming attempts a 3Pt. Contested by Shaquille Irving (4.5 feet, ZONE). Immanuel Ming misses. Rebound secured by Blake Russell.

[06:49] Team_054 possession (Score: 85-103)
Blake Russell attempts a Midrange. Wide open! Jaren George is 6.5 feet away. [MAN] BLAKE RUSSELL MAKES IT! Assist: Shaquille Irving
Score: 85-105

[06:35] Team_060 possession (Score: 85-105)
Larry Westbrook drives and kicks out. Immanuel Ming attempts a 3Pt. Contested by Vince Ball (4.9 feet, MAN). Immanuel Ming misses. Rebound secured by Blake Russell.

[06:21] Team_054 possession (Score: 85-105)
Lauri Irving drives, Julius Green stays with him. Lauri Irving attempts a Layup. Contested by Julius Green (5.2 feet, MAN). Lauri Irving misses. Rebound secured by Immanuel Ming.

[06:06] Team_060 possession (Score: 85-105)
Domantas Barnes attempts a 3Pt. Contested by Shaquille Irving (4.6 feet, MAN). Domantas Barnes misses. Rebound secured by Blake Russell.

[05:51] Team_054 possession (Score: 85-105)
Blake Russell attempts a 3Pt. Wide open! Jaren George is 6.6 feet away. [MAN] Blake Russell misses. Rebound secured by Domantas Barnes.

[05:32] Team_060 possession (Score: 85-105)
FOUL! Shooting foul on Blake Russell. Jaren George to the line for 2 free throws. [Team fouls: 2] (Blake Russell: 1 personal fouls)   FT 1/2: GOOD   FT 2/2: GOOD Jaren George makes 2/2 from the line.
Score: 87-105

[05:18] Team_054 possession (Score: 87-105)
FOUL! Shooting foul on Julius Green. Lauri Irving to the line for 2 free throws. [Team fouls: 2] (Julius Green: 1 personal fouls)   FT 1/2: MISS   FT 2/2: GOOD Lauri Irving makes 1/2 from the line.
Score: 87-106

[04:59] Team_060 possession (Score: 87-106)
Julius Green attempts a 3Pt. Contested by Lauri Irving (4.5 feet, MAN). Julius Green misses. Rebound secured by Blake Russell.

[04:50] Team_054 possession (Score: 87-106)
Shaquille Irving attempts a 3Pt. Contested by Domantas Barnes (5.1 feet, ZONE). Shaquille Irving misses. Rebound secured by Immanuel Ming.

[04:34] Team_060 possession (Score: 87-106)
Larry Westbrook attempts a Midrange. Contested by Luka Brogdon (5.3 feet, ZONE). Larry Westbrook misses. Rebound secured by Luka Brogdon.

[04:24] Team_054 possession (Score: 87-106)
Shaquille Irving attempts a 3Pt. Contested by Domantas Barnes (5.1 feet, ZONE). Shaquille Irving misses. Rebound secured by Jaren George.

[04:07] Team_060 possession (Score: 87-106)
Immanuel Ming attempts a 3Pt. Contested by Vince Ball (5.1 feet, MAN). Immanuel Ming misses. Offensive rebound by Domantas Barnes! Domantas Barnes kicks it out.

[03:55] Team_060 possession (Score: 87-106)
Julius Green attempts a Layup. BLOCKED BY LAURI IRVING! Ball is loose! Rebound secured by Luka Brogdon.

[03:38] Team_054 possession (Score: 87-106)
Lauri Irving drives and kicks out. Vince Ball attempts a 3Pt. Contested by Domantas Barnes (4.7 feet, ZONE). Vince Ball misses. Offensive rebound by Blake Russell! Blake Russell kicks it out.

[03:20] Team_054 possession (Score: 87-106)
Luka Brogdon attempts a Midrange. Contested by Julius Green (5.5 feet, ZONE). LUKA BROGDON MAKES IT!
Score: 87-108

[03:00] Team_060 possession (Score: 87-108)
FOUL! Shooting foul on Blake Russell. Jaren George to the line for 2 free throws. [Team fouls: 3] (Blake Russell: 2 personal fouls)   FT 1/2: GOOD   FT 2/2: GOOD Jaren George makes 2/2 from the line.
Score: 89-108

[02:45] Team_054 possession (Score: 89-108)
Shaquille Irving attempts a Midrange. Wide open! Larry Westbrook is 6.9 feet away. [ZONE] SHAQUILLE IRVING MAKES IT! Assist: Blake Russell
Score: 89-110

[02:29] Team_060 possession (Score: 89-110)
Domantas Barnes attempts a 3Pt. Contested by Shaquille Irving (4.8 feet, MAN). Domantas Barnes misses. Offensive rebound by Immanuel Ming! Immanuel Ming kicks it out.

[02:15] Team_060 possession (Score: 89-110)
FOUL! Shooting foul on Lauri Irving. Larry Westbrook to the line for 2 free throws. [Team fouls: 4] (Lauri Irving: 1 personal fouls)   FT 1/2: GOOD   FT 2/2: GOOD Larry Westbrook makes 2/2 from the line.
Score: 91-110

[02:02] Team_054 possession (Score: 91-110)
Blake Russell attempts a Midrange. Wide open! Jaren George is 7.1 feet away. [MAN] BLAKE RUSSELL MAKES IT!
Score: 91-112

[01:45] Team_060 possession (Score: 91-112)
FOUL! Shooting foul on Vince Ball. Immanuel Ming to the line for 3 free throws. [BONUS: 5 team fouls] (Vince Ball: 2 personal fouls)   FT 1/3: GOOD   FT 2/3: GOOD   FT 3/3: GOOD Immanuel Ming makes 3/3 from the line.
Score: 94-112

[01:30] Team_054 possession (Score: 94-112)
Luka Brogdon throws a bad pass out of bounds! TURNOVER! (dead ball)

[01:30] Substitution (Team_060): Julius Green OUT → Rudy Ginobili IN (stamina_rule2)

[01:30] Substitution (Team_060): Immanuel Ming OUT → Jarrett Wagner IN (stamina_rule2)

[01:30] Substitution (Team_060): Larry Westbrook OUT → Yao Tatum IN (stamina_rule2)

[01:30] Substitution (Team_060): Jaren George OUT → Klay Haliburton IN (stamina_rule2)

[01:30] Substitution (Team_054): Lauri Irving OUT → Bradley Quickley IN (stamina_rule2)

[01:30] Substitution (Team_054): Vince Ball OUT → Vince James IN (stamina_rule2)

[01:30] Substitution (Team_054): Luka Brogdon OUT → Tobias Nowitzki IN (stamina_rule2)

[01:30] Substitution (Team_054): Blake Russell OUT → Devin Jackson IN (stamina_rule2)

[01:14] Team_060 possession (Score: 94-112)
Yao Tatum attempts a Midrange. Contested by Bradley Quickley (4.2 feet, ZONE). Yao Tatum misses. Rebound secured by Vince James.

[01:00] Team_054 possession (Score: 94-112)
Tobias Nowitzki attempts a Layup. Contested by Klay Haliburton (4.3 feet, ZONE). TOBIAS NOWITZKI MAKES IT! Assist: Bradley Quickley
Score: 94-114

[00:43] Team_060 possession (Score: 94-114)
Domantas Barnes drives and kicks out. Rudy Ginobili attempts a 3Pt. Contested by Shaquille Irving (5.0 feet, ZONE). Rudy Ginobili misses. Rebound secured by Devin Jackson.

[00:30] Team_054 possession (Score: 94-114)
Tobias Nowitzki attempts a Layup. Contested by Yao Tatum (5.2 feet, MAN). TOBIAS NOWITZKI MAKES IT! Assist: Shaquille Irving
Score: 94-116

[00:14] Team_060 possession (Score: 94-116)
FOUL! Shooting foul on Devin Jackson. Klay Haliburton to the line for 2 free throws. [BONUS: 6 team fouls] (Devin Jackson: 1 personal fouls)   FT 1/2: GOOD   FT 2/2: GOOD Klay Haliburton makes 2/2 from the line.
Score: 96-116

================================================================================
                              4TH QUARTER COMPLETE                              
================================================================================

4TH QUARTER SCORE: Team_060 21, Team_054 24

BOX SCORE:
================================================================================

Team_060
--------------------------------------------------------------------------------
Player                MIN  PTS  REB  AST  TO      FG   FG%      3P   3P%
--------------------------------------------------------------------------------
Larry Westbrook        45    7    0    0   0   3/6    50.0     0/0   0.0
Immanuel Ming          45    6    5    0   0   2/4    50.0     0/0   0.0
Jaren George           45    6    3    0   0   3/4    75.0     0/0   0.0
Klay Haliburton         4    2    0    0   0   1/1   100.0     0/0   0.0
Domantas Barnes        14    0    4    1   0   0/2     0.0     0/0   0.0
Julius Green           45    0    0    2   0   0/2     0.0     0/0   0.0
Yao Tatum               4    0    0    0   0   0/1     0.0     0/0   0.0

TEAM: FG: 9/20 (45.0%), 3PT: 2/6 (33.3%), REB: 12 (5 off, 7 def), AST: 3, TO: 1
TEAM FOULS: 2


Team_054
--------------------------------------------------------------------------------
Player                MIN  PTS  REB  AST  TO      FG   FG%      3P   3P%
--------------------------------------------------------------------------------
Blake Russell          45    6    6    3   0   3/4    75.0     0/0   0.0
Shaquille Irving       14    5    0    3   0   2/5    40.0     0/0   0.0
Lauri Irving           45    4    0    0   0   2/3    66.7     0/0   0.0
Tobias Nowitzki         4    4    0    0   0   2/2   100.0     0/0   0.0
Vince Ball             47    3    1    0   0   1/1   100.0     0/0   0.0
Luka Brogdon           45    2    5    0   0   1/3    33.3     0/0   0.0
Vince James             2    0    1    0   0   0/0     0.0     0/0   0.0
Bradley Quickley        4    0    0    1   0   0/0     0.0     0/0   0.0
Devin Jackson           4    0    1    0   0   0/0     0.0     0/0   0.0

TEAM: FG: 11/18 (61.1%), 3PT: 1/7 (14.3%), REB: 14 (3 off, 11 def), AST: 7, TO: 2
TEAM FOULS: 6 [Team_060 in BONUS]

================================================================================

================================================================================
                               FULL GAME COMPLETE                               
================================================================================

FINAL SCORE: Team_060 96, Team_054 116

SCORING BY QUARTER:
--------------------------------------------------------------------------------
Team                     Q1     Q2     Q3     Q4    FINAL
--------------------------------------------------------------------------------
Team_060                 29     27     19     21       96
Team_054                 36     26     30     24      116
--------------------------------------------------------------------------------

FULL GAME BOX SCORE:
================================================================================

Team_060
--------------------------------------------------------------------------------
Player                MIN  PTS  REB  AST  TO      FG   FG%      3P   3P%      FT STL BLK
--------------------------------------------------------------------------------
Julius Green           45   13    0    6   4   7/14   50.0   1/3    33.3   2/4     0   0
Immanuel Ming          45   20   12    1   1   9/18   50.0   3/8    37.5   6/8     0   1
Larry Westbrook        45   15    6    4   2   6/17   35.3   0/4     0.0   5/6     1   0
Jaren George           45   18   12    3   3   7/13   53.8   1/2    50.0   9/12    1   0
Joel Morant            34   13    0    1   0   5/10   50.0   2/5    40.0   2/7     1   0
Domantas Barnes        14    0    5    2   0   0/3     0.0   0/2     0.0   0/0     0   0
Rudy Ginobili           4    0    1    1   0   1/1   100.0   0/0     0.0   0/0     0   0
Jarrett Wagner          4    5    0    0   0   1/1   100.0   1/1   100.0   0/0     0   0
Yao Tatum               4    0    0    0   0   0/1     0.0   0/0     0.0   0/0     0   0
Klay Haliburton         4    4    2    0   0   2/2   100.0   0/0     0.0   2/2     0   0

TEAM: FG: 39/82 (47.6%), 3PT: 8/25 (32.0%), REB: 37 (10 off, 27 def), AST: 18, TO: 10


Team_054
--------------------------------------------------------------------------------
Player                MIN  PTS  REB  AST  TO      FG   FG%      3P   3P%      FT STL BLK
--------------------------------------------------------------------------------
Vince Ball             47   20    3    3   3   9/14   64.3   3/7    42.9   0/0     0   1
Lauri Irving           45   13   10    8   2   6/10   60.0   2/3    66.7   3/5     2   1
Luka Brogdon           45   18   15    4   2   9/12   75.0   2/5    40.0   3/3     1   0
Blake Russell          45   38   21    6   3  13/18   72.2   2/3    66.7   2/3     1   1
Malcolm Harden         34   14    0    3   1   9/14   64.3   2/4    50.0   0/0     0   0
Shaquille Irving       14    8    0    3   0   2/5    40.0   1/4    25.0   3/3     0   0
Bradley Quickley        4    0    0    1   0   0/0     0.0   0/0     0.0   0/0     0   0
Tobias Nowitzki         4    4    0    0   0   2/3    66.7   0/0     0.0   0/0     0   0
Devin Jackson           4    0    2    0   1   0/2     0.0   0/1     0.0   0/0     0   0
Vince James             2    0    1    0   0   0/0     0.0   0/0     0.0   0/0     0   0

TEAM: FG: 50/78 (64.1%), 3PT: 12/27 (44.4%), REB: 53 (11 off, 42 def), AST: 28, TO: 12

================================================================================
