================================================================================
                        FULL GAME - Team_076 vs Team_031                        
================================================================================

================================================================================
                       1ST QUARTER - Team_076 vs Team_031                       
================================================================================

[12:00] Team_076 possession (Score: 0-0)
Tobias Mitchell attempts a 3Pt. Contested by Gary Morant (4.2 feet, ZONE). Tobias Mitchell misses. Offensive rebound by Cade Barnes! Cade Barnes kicks it out.

[11:47] Team_076 possession (Score: 0-0)
Paul Leonard drives to the basket... Paul Leonard loses control! Ball rolls out of bounds! TURNOVER! (dead ball)

[11:31] Team_031 possession (Score: 0-0)
Gary Morant attempts a 3Pt. Contested by Tobias Mitchell (4.7 feet, MAN). Gary Morant misses. Rebound secured by D'Angelo Tatum.

[11:17] Team_076 possession (Score: 0-0)
Dejounte LaVine attempts a Midrange. Contested by Immanuel James (2.9 feet, ZONE). Dejounte LaVine misses. Rebound secured by Gary Morant.

[11:03] Team_031 possession (Score: 0-0)
Pau Irving attempts a 3Pt. Contested by Cade Barnes (3.6 feet, ZONE). PAU IRVING MAKES IT! Assist: Luka Sabonis
Score: 0-3

[10:48] Team_076 possession (Score: 0-3)
Dejounte LaVine attempts a Midrange. Contested by Pau Irving (3.5 feet, ZONE). DEJOUNTE LAVINE MAKES IT!
Score: 2-3

[10:29] Team_031 possession (Score: 2-3)
Pau Irving attempts a 3Pt. Contested by Paul Leonard (5.1 feet, MAN). Pau Irving misses. Rebound secured by Tobias Mitchell.

[10:13] Team_076 possession (Score: 2-3)
D'Angelo Tatum drives to the basket... D'Angelo Tatum loses the ball! Stripped by Immanuel James! TURNOVER! (live ball)

[09:55] Team_031 possession (Score: 2-3)
Gary Morant attempts a 3Pt. Contested by Tobias Mitchell (4.7 feet, MAN). Gary Morant misses. Rebound secured by Cade Barnes.

[09:40] Team_076 possession (Score: 2-3)
Tobias Mitchell attempts a 3Pt. Contested by Pau Irving (4.0 feet, ZONE). Tobias Mitchell misses. Rebound secured by Luka Sabonis.

[09:30] Team_031 possession (Score: 2-3)
Immanuel James makes the Layup and draws the foul on Cade Barnes! And-1! Immanuel James to the line for 1. [Team fouls: 1] (Cade Barnes: 1 personal fouls)   FT 1/1: GOOD Immanuel James makes 1/1 from the line.
Score: 2-6

[09:14] Team_076 possession (Score: 2-6)
Dejounte LaVine attempts a 3Pt. Contested by Shai Durant (3.8 feet, MAN). Dejounte LaVine misses. Rebound secured by Gary Morant.

[08:56] Team_031 possession (Score: 2-6)
Gary Morant attempts a Midrange. Contested by Paul Leonard (5.7 feet, ZONE). GARY MORANT MAKES IT! Assist: Pau Irving
Score: 2-8

[08:39] Team_076 possession (Score: 2-8)
Cade Barnes attempts a Midrange. Contested by Pau Irving (3.8 feet, ZONE). CADE BARNES MAKES IT!
Score: 4-8

[08:21] Team_031 possession (Score: 4-8)
Shai Durant attempts a 3Pt. Contested by Dejounte LaVine (4.9 feet, MAN). SHAI DURANT MAKES IT! Assist: Gary Morant
Score: 4-11

[08:03] Team_076 possession (Score: 4-11)
Tobias Mitchell drives and kicks out. D'Angelo Tatum attempts a Midrange. Contested by Luka Sabonis (3.2 feet, MAN). D'ANGELO TATUM MAKES IT!
Score: 6-11

[07:43] Team_031 possession (Score: 6-11)
Immanuel James makes the Layup and draws the foul on Cade Barnes! And-1! Immanuel James to the line for 1. [Team fouls: 2] (Cade Barnes: 2 personal fouls)   FT 1/1: GOOD Immanuel James makes 1/1 from the line.
Score: 6-14

[07:33] Team_076 possession (Score: 6-14)
Cade Barnes throws a bad pass out of bounds! TURNOVER! (dead ball)

[07:20] Team_031 possession (Score: 6-14)
Pau Irving attempts a 3Pt. Contested by Paul Leonard (5.1 feet, MAN). Pau Irving misses. Rebound secured by Cade Barnes.

[07:08] Team_076 possession (Score: 6-14)
Tobias Mitchell drives to the basket... Tobias Mitchell loses the ball! Stripped by Gary Morant! TURNOVER! (live ball)

[06:51] Team_031 possession (Score: 6-14)
Gary Morant attempts a Midrange. Contested by Paul Leonard (5.7 feet, ZONE). GARY MORANT MAKES IT!
Score: 6-16

[06:34] Team_076 possession (Score: 6-16)
FOUL! Holding foul on Pau Irving. [Team fouls: 1] No free throws, side out. (Pau Irving: 1 personal fouls)

[06:19] Team_076 possession (Score: 6-16)
Cade Barnes attempts a 3Pt. Contested by Pau Irving (3.8 feet, ZONE). CADE BARNES MAKES IT! Assist: Tobias Mitchell
Score: 9-16

[06:04] Team_031 possession (Score: 9-16)
FOUL! Offensive foul on Shai Durant! Dejounte LaVine drew the charge! [Team fouls: 2] (Shai Durant: 1 personal fouls) TURNOVER! (dead ball)

[05:51] Team_076 possession (Score: 9-16)
Cade Barnes attempts a 3Pt. Contested by Immanuel James (3.2 feet, MAN). Cade Barnes misses. Rebound secured by Immanuel James.

[05:34] Team_031 possession (Score: 9-16)
FOUL! Offensive foul on Luka Sabonis! D'Angelo Tatum drew the charge! [Team fouls: 3] (Luka Sabonis: 1 personal fouls) TURNOVER! (dead ball)

[05:19] Team_076 possession (Score: 9-16)
D'Angelo Tatum attempts a Layup. Contested by Immanuel James (3.3 feet, ZONE). D'ANGELO TATUM MAKES IT!
Score: 11-16

[05:03] Team_031 possession (Score: 11-16)
Shai Durant attempts a 3Pt. Contested by Cade Barnes (3.6 feet, ZONE). Shai Durant misses. Rebound secured by Cade Barnes.

[04:52] Team_076 possession (Score: 11-16)
Paul Leonard attempts a 3Pt. Contested by Pau Irving (4.0 feet, ZONE). Paul Leonard misses. Offensive rebound by D'Angelo Tatum! D'Angelo Tatum kicks it out.

[04:39] Team_076 possession (Score: 11-16)
Dejounte LaVine attempts a Layup. Contested by Immanuel James (3.0 feet, ZONE). Dejounte LaVine misses. FOUL! Loose ball foul on Immanuel James during the rebound battle. [Team fouls: 4] No free throws, side out. (Immanuel James: 1 personal fouls)

[04:22] Team_076 possession (Score: 11-16)
Tobias Mitchell attempts a Layup. Contested by Gary Morant (4.2 feet, MAN). TOBIAS MITCHELL MAKES IT!
Score: 13-16

[04:08] Team_031 possession (Score: 13-16)
Immanuel James drives to the basket... Immanuel James loses the ball! Stripped by Cade Barnes! TURNOVER! (live ball)

[03:54] Team_076 possession (Score: 13-16)
D'Angelo Tatum drives, picks up Immanuel James. Help arrives from Shai Durant! D'Angelo Tatum attempts a Dunk. Contested by Shai Durant (3.4 feet, ZONE). D'ANGELO TATUM MAKES IT! Assist: Tobias Mitchell
Score: 15-16

[03:35] Team_031 possession (Score: 15-16)
Gary Morant drives and kicks out. Gary Morant attempts a Midrange. Contested by Tobias Mitchell (4.2 feet, MAN). Gary Morant misses. Offensive rebound by Immanuel James! Immanuel James's putback is no good. Offensive rebound by Luka Sabonis! Luka Sabonis kicks it out.

[03:25] Team_031 possession (Score: 15-16)
Luka Sabonis drives to the basket... Luka Sabonis commits a violation (traveling/carry)! TURNOVER! (dead ball)

[03:11] Team_076 possession (Score: 15-16)
FOUL! Shooting foul on Gary Morant. Tobias Mitchell to the line for 3 free throws. [BONUS: 5 team fouls] (Gary Morant: 1 personal fouls)   FT 1/3: GOOD   FT 2/3: GOOD   FT 3/3: GOOD Tobias Mitchell makes 3/3 from the line.
Score: 18-16

[02:56] Team_031 possession (Score: 18-16)
Pau Irving attempts a 3Pt. Contested by Cade Barnes (3.7 feet, ZONE). Pau Irving misses. Rebound secured by Tobias Mitchell.

[02:40] Team_076 possession (Score: 18-16)
D'Angelo Tatum drives and kicks out. Tobias Mitchell attempts a 3Pt. Contested by Gary Morant (4.0 feet, MAN). Tobias Mitchell misses. Offensive rebound by D'Angelo Tatum! D'Angelo Tatum kicks it out.

[02:25] Team_076 possession (Score: 18-16)
Paul Leonard attempts a Midrange. Contested by Pau Irving (4.2 feet, MAN). Paul Leonard misses. Offensive rebound by D'Angelo Tatum! D'Angelo Tatum kicks it out.

[02:11] Team_076 possession (Score: 18-16)
Tobias Mitchell makes the Dunk and draws the foul on Shai Durant! And-1! Tobias Mitchell to the line for 1. [BONUS: 6 team fouls] (Shai Durant: 2 personal fouls)   FT 1/1: GOOD Tobias Mitchell makes 1/1 from the line.
Score: 21-16

[01:57] Team_031 possession (Score: 21-16)
Immanuel James attempts a Layup. BLOCKED BY CADE BARNES! Ball is loose! Rebound secured by D'Angelo Tatum.

[01:45] Team_076 possession (Score: 21-16)
Dejounte LaVine attempts a 3Pt. Contested by Pau Irving (3.8 feet, ZONE). Dejounte LaVine misses. Rebound secured by Luka Sabonis.

[01:30] Team_031 possession (Score: 21-16)
Immanuel James attempts a Midrange. Contested by Dejounte LaVine (5.5 feet, ZONE). IMMANUEL JAMES MAKES IT!
Score: 21-18

[01:16] Team_076 possession (Score: 21-18)
Tobias Mitchell drives to the basket... Tobias Mitchell throws a bad pass! Stolen by Immanuel James! TURNOVER! (live ball)

[01:03] Team_031 possession (Score: 21-18)
Pau Irving makes the Layup and draws the foul on Paul Leonard! And-1! Pau Irving to the line for 1. [Team fouls: 3] (Paul Leonard: 1 personal fouls)   FT 1/1: GOOD Pau Irving makes 1/1 from the line.
Score: 21-21

[00:49] Team_076 possession (Score: 21-21)
Dejounte LaVine makes the Layup and draws the foul on Shai Durant! And-1! Dejounte LaVine to the line for 1. [BONUS: 7 team fouls] (Shai Durant: 3 personal fouls)   FT 1/1: GOOD Dejounte LaVine makes 1/1 from the line.
Score: 24-21

[00:34] Team_031 possession (Score: 24-21)
Shai Durant attempts a Midrange. Contested by Dejounte LaVine (5.3 feet, MAN). Shai Durant misses. Rebound secured by Tobias Mitchell.

[00:21] Team_076 possession (Score: 24-21)
D'Angelo Tatum drives, Immanuel James stays with him. D'Angelo Tatum attempts a Dunk. Contested by Immanuel James (4.0 feet, ZONE). D'Angelo Tatum misses. Rebound secured by Gary Morant.

[00:10] Team_031 possession (Score: 24-21)
Immanuel James throws a bad pass out of bounds! TURNOVER! (dead ball)

[00:10] Substitution (Team_076): Dejounte LaVine OUT → Pascal Lowry IN (stamina_rule2)

[00:10] Substitution (Team_076): Tobias Mitchell OUT → Jalen Poole IN (stamina_rule2)

[00:10] Substitution (Team_076): Paul Leonard OUT → Vince Lowry IN (stamina_rule2)

[00:10] Substitution (Team_076): Cade Barnes OUT → Kevin Nowitzki IN (stamina_rule2)

[00:10] Substitution (Team_076): D'Angelo Tatum OUT → Jordan Doncic IN (stamina_rule2)

[00:10] Substitution (Team_031): Shai Durant OUT → Kevin Morant IN (stamina_rule2)

[00:10] Substitution (Team_031): Gary Morant OUT → Isaiah Ingram IN (stamina_rule2)

[00:10] Substitution (Team_031): Pau Irving OUT → Miles Stewart IN (stamina_rule2)

[00:10] Substitution (Team_031): Immanuel James OUT → Kobe Randle IN (stamina_rule2)

[00:10] Substitution (Team_031): Luka Sabonis OUT → Jimmy Poole IN (stamina_rule2)

================================================================================
                              1ST QUARTER COMPLETE                              
================================================================================

1ST QUARTER SCORE: Team_076 24, Team_031 21

BOX SCORE:
================================================================================

Team_076
--------------------------------------------------------------------------------
Player                MIN  PTS  REB  AST  TO      FG   FG%      3P   3P%
--------------------------------------------------------------------------------
Tobias Mitchell        12    8    3    2   0   3/4    75.0     0/0   0.0
D'Angelo Tatum         12    6    5    0   0   3/4    75.0     0/0   0.0
Cade Barnes            12    5    5    0   0   2/3    66.7     0/0   0.0
Dejounte LaVine        12    5    0    0   0   2/5    40.0     0/0   0.0

TEAM: FG: 10/16 (62.5%), 3PT: 2/6 (33.3%), REB: 13 (5 off, 8 def), AST: 2, TO: 5
TEAM FOULS: 3


Team_031
--------------------------------------------------------------------------------
Player                MIN  PTS  REB  AST  TO      FG   FG%      3P   3P%
--------------------------------------------------------------------------------
Immanuel James         12    8    1    0   0   3/4    75.0     0/0   0.0
Pau Irving             12    6    0    1   0   2/5    40.0     0/0   0.0
Gary Morant            12    4    3    1   0   2/4    50.0     0/0   0.0
Shai Durant            12    3    0    0   0   1/3    33.3     0/0   0.0
Luka Sabonis           12    0    3    1   0   0/0     0.0     0/0   0.0

TEAM: FG: 8/16 (50.0%), 3PT: 2/8 (25.0%), REB: 7 (1 off, 6 def), AST: 3, TO: 5
TEAM FOULS: 7 [Team_076 in BONUS]

================================================================================

================================================================================
                       2ND QUARTER - Team_076 vs Team_031                       
================================================================================

[12:00] Team_076 possession (Score: 24-21)
Paul Leonard makes the Midrange and draws the foul on Pau Irving! And-1! Paul Leonard to the line for 1. [Team fouls: 1] (Pau Irving: 1 personal fouls)   FT 1/1: GOOD Paul Leonard makes 1/1 from the line.
Score: 27-21

[11:51] Team_031 possession (Score: 27-21)
Immanuel James attempts a Layup. Contested by D'Angelo Tatum (4.3 feet, ZONE). Immanuel James misses. Rebound secured by Cade Barnes.

[11:33] Team_076 possession (Score: 27-21)
Dejounte LaVine attempts a Midrange. Contested by Luka Sabonis (3.6 feet, ZONE). Dejounte LaVine misses. Rebound secured by Immanuel James.

[11:18] Team_031 possession (Score: 27-21)
Gary Morant drives and kicks out. Shai Durant attempts a Midrange. Contested by Dejounte LaVine (5.2 feet, ZONE). Shai Durant misses. Rebound secured by Cade Barnes.

[11:05] Team_076 possession (Score: 27-21)
Dejounte LaVine attempts a Midrange. Contested by Immanuel James (3.6 feet, ZONE). Dejounte LaVine misses. Rebound secured by Luka Sabonis.

[10:47] Team_031 possession (Score: 27-21)
Immanuel James attempts a Midrange. Contested by D'Angelo Tatum (4.4 feet, ZONE). Immanuel James misses. Offensive rebound by Immanuel James! Immanuel James kicks it out.

[10:32] Team_031 possession (Score: 27-21)
Gary Morant drives and kicks out. Pau Irving attempts a 3Pt. Contested by Cade Barnes (4.0 feet, ZONE). PAU IRVING MAKES IT! Assist: Shai Durant
Score: 27-24

[10:20] Team_076 possession (Score: 27-24)
Cade Barnes drives, Immanuel James stays with him. Cade Barnes attempts a Dunk. Contested by Immanuel James (3.9 feet, ZONE). Cade Barnes misses. Rebound secured by Luka Sabonis.

[10:05] Team_031 possession (Score: 27-24)
Shai Durant attempts a Midrange. Contested by Paul Leonard (5.6 feet, ZONE). SHAI DURANT MAKES IT! Assist: Pau Irving
Score: 27-26

[09:50] Team_076 possession (Score: 27-26)
Dejounte LaVine attempts a 3Pt. Contested by Pau Irving (4.1 feet, ZONE). DEJOUNTE LAVINE MAKES IT! Assist: Cade Barnes
Score: 30-26

[09:37] Team_031 possession (Score: 30-26)
Immanuel James makes the Layup and draws the foul on Cade Barnes! And-1! Immanuel James to the line for 1. [Team fouls: 1] (Cade Barnes: 1 personal fouls)   FT 1/1: MISS Immanuel James makes 0/1 from the line. Offensive rebound by Luka Sabonis! Luka Sabonis puts it back in!
Score: 30-30

[09:24] Team_076 possession (Score: 30-30)
Tobias Mitchell attempts a Layup. Contested by Gary Morant (4.7 feet, MAN). Tobias Mitchell misses. Rebound secured by Luka Sabonis.

[09:08] Team_031 possession (Score: 30-30)
Immanuel James attempts a 3Pt. Contested by Cade Barnes (4.5 feet, MAN). Immanuel James misses. Rebound secured by Cade Barnes.

[08:57] Team_076 possession (Score: 30-30)
Dejounte LaVine attempts a 3Pt. Contested by Shai Durant (4.4 feet, MAN). Dejounte LaVine misses. Rebound secured by Gary Morant.

[08:47] Team_031 possession (Score: 30-30)
FOUL! Reach-in foul on Paul Leonard during the drive. [Team fouls: 2] No free throws, side out. (Paul Leonard: 1 personal fouls)

[08:37] Team_031 possession (Score: 30-30)
FOUL! Shooting foul on Tobias Mitchell. Gary Morant to the line for 2 free throws. [Team fouls: 3] (Tobias Mitchell: 1 personal fouls)   FT 1/2: GOOD   FT 2/2: MISS Gary Morant makes 1/2 from the line. Rebound secured by D'Angelo Tatum.
Score: 30-31

[08:22] Team_076 possession (Score: 30-31)
Cade Barnes attempts a 3Pt. Contested by Pau Irving (4.5 feet, ZONE). CADE BARNES MAKES IT! Assist: D'Angelo Tatum
Score: 33-31

[08:08] Team_031 possession (Score: 33-31)
Pau Irving attempts a 3Pt. Contested by Paul Leonard (5.8 feet, MAN). Pau Irving misses. Rebound secured by Cade Barnes.

[07:54] Team_076 possession (Score: 33-31)
Dejounte LaVine attempts a 3Pt. Contested by Shai Durant (4.6 feet, MAN). Dejounte LaVine misses. Rebound secured by Immanuel James.

[07:39] Team_031 possession (Score: 33-31)
Luka Sabonis drives to the basket... Luka Sabonis loses control! Ball rolls out of bounds! TURNOVER! (dead ball)

[07:39] Substitution (Team_076): Dejounte LaVine OUT → Pascal Lowry IN (stamina_rule2)

[07:39] Substitution (Team_076): Tobias Mitchell OUT → Jalen Poole IN (stamina_rule2)

[07:39] Substitution (Team_076): Paul Leonard OUT → Vince Lowry IN (stamina_rule2)

[07:39] Substitution (Team_076): Cade Barnes OUT → Kevin Nowitzki IN (stamina_rule2)

[07:39] Substitution (Team_076): D'Angelo Tatum OUT → Jordan Doncic IN (stamina_rule2)

[07:39] Substitution (Team_031): Shai Durant OUT → Kevin Morant IN (stamina_rule2)

[07:39] Substitution (Team_031): Gary Morant OUT → Isaiah Ingram IN (stamina_rule2)

[07:39] Substitution (Team_031): Pau Irving OUT → Miles Stewart IN (stamina_rule2)

[07:39] Substitution (Team_031): Immanuel James OUT → Kobe Randle IN (stamina_rule2)

[07:39] Substitution (Team_031): Luka Sabonis OUT → Jimmy Poole IN (stamina_rule2)

[07:23] Team_076 possession (Score: 33-31)
FOUL! Shooting foul on Isaiah Ingram. Jalen Poole to the line for 2 free throws. [Team fouls: 2] (Isaiah Ingram: 1 personal fouls)   FT 1/2: GOOD   FT 2/2: GOOD Jalen Poole makes 2/2 from the line.
Score: 35-31

[07:06] Team_031 possession (Score: 35-31)
Kevin Morant drives to the basket... Kevin Morant throws a bad pass! Stolen by Pascal Lowry! TURNOVER! (live ball)

[06:50] Team_076 possession (Score: 35-31)
Vince Lowry drives, Kobe Randle stays with him. Vince Lowry attempts a Dunk. Contested by Kobe Randle (4.3 feet, ZONE). Vince Lowry misses. FOUL! Loose ball foul on Kobe Randle during the rebound battle. [Team fouls: 3] No free throws, side out. (Kobe Randle: 1 personal fouls)

[06:36] Team_076 possession (Score: 35-31)
Pascal Lowry attempts a Layup. BLOCKED BY KOBE RANDLE! Ball deflects out of bounds off Pascal Lowry.

[06:21] Team_031 possession (Score: 35-31)
Jimmy Poole drives and kicks out. Jimmy Poole attempts a 3Pt. Contested by Jordan Doncic (3.3 feet, MAN). Jimmy Poole misses. Rebound secured by Kevin Nowitzki.

[06:05] Team_076 possession (Score: 35-31)
Vince Lowry attempts a Layup. Contested by Miles Stewart (5.2 feet, MAN). VINCE LOWRY MAKES IT!
Score: 37-31

[05:53] Team_031 possession (Score: 37-31)
Kevin Morant attempts a 3Pt. Wide open! Pascal Lowry is 6.3 feet away. [MAN] Kevin Morant misses. Rebound secured by Jordan Doncic.

[05:37] Team_076 possession (Score: 37-31)
Jalen Poole attempts a 3Pt. Contested by Isaiah Ingram (4.6 feet, MAN). Jalen Poole misses. Rebound secured by Kobe Randle.

[05:21] Team_031 possession (Score: 37-31)
FOUL! Reach-in foul on Kevin Nowitzki during the drive. [Team fouls: 4] No free throws, side out. (Kevin Nowitzki: 1 personal fouls)

[05:07] Team_031 possession (Score: 37-31)
FOUL! Holding foul on Jalen Poole. [IN THE BONUS! 5 team fouls] Isaiah Ingram to the line for 2 free throws. (Jalen Poole: 1 personal fouls)   FT 1/2: GOOD   FT 2/2: GOOD Isaiah Ingram makes 2/2 from the line.
Score: 37-33

[04:57] Team_076 possession (Score: 37-33)
FOUL! Offensive foul on Jalen Poole! Isaiah Ingram drew the charge! [Team fouls: 6] (Jalen Poole: 2 personal fouls) TURNOVER! (dead ball)

[04:42] Team_031 possession (Score: 37-33)
FOUL! Shooting foul on Jalen Poole. Kevin Morant to the line for 2 free throws. [BONUS: 7 team fouls] (Jalen Poole: 3 personal fouls)   FT 1/2: MISS   FT 2/2: GOOD Kevin Morant makes 1/2 from the line.
Score: 37-34

[04:29] Team_076 possession (Score: 37-34)
FOUL! Reach-in foul on Kobe Randle during the drive. [Team fouls: 4] No free throws, side out. (Kobe Randle: 2 personal fouls)

[04:11] Team_076 possession (Score: 37-34)
Kevin Nowitzki attempts a 3Pt. Contested by Miles Stewart (5.5 feet, ZONE). KEVIN NOWITZKI MAKES IT! Assist: Pascal Lowry
Score: 40-34

[03:56] Team_031 possession (Score: 40-34)
Jimmy Poole attempts a Midrange. Contested by Vince Lowry (4.1 feet, ZONE). Jimmy Poole misses. Rebound secured by Kevin Nowitzki.

[03:41] Team_076 possession (Score: 40-34)
Jalen Poole attempts a 3Pt. Contested by Isaiah Ingram (4.6 feet, MAN). JALEN POOLE MAKES IT! Assist: Pascal Lowry
Score: 43-34

[03:24] Team_031 possession (Score: 43-34)
Kevin Morant attempts a 3Pt. Contested by Kevin Nowitzki (4.3 feet, ZONE). Kevin Morant misses. Rebound secured by Kevin Nowitzki.

[03:09] Team_076 possession (Score: 43-34)
Kevin Nowitzki attempts a 3Pt. Contested by Kobe Randle (4.6 feet, ZONE). Kevin Nowitzki misses. Rebound secured by Kobe Randle.

[02:57] Team_031 possession (Score: 43-34)
FOUL! Reach-in foul on Vince Lowry during the drive. [IN THE BONUS! 8 team fouls] Miles Stewart to the line for 2 free throws. (Vince Lowry: 1 personal fouls)   FT 1/2: GOOD   FT 2/2: GOOD Miles Stewart makes 2/2 from the line.
Score: 43-36

[02:40] Team_076 possession (Score: 43-36)
Kevin Nowitzki attempts a 3Pt. Contested by Kobe Randle (4.6 feet, MAN). KEVIN NOWITZKI MAKES IT! Assist: Jalen Poole
Score: 46-36

[02:27] Team_031 possession (Score: 46-36)
Isaiah Ingram attempts a Layup. Contested by Jordan Doncic (3.7 feet, ZONE). ISAIAH INGRAM MAKES IT!
Score: 46-38

[02:12] Team_076 possession (Score: 46-38)
FOUL! Shooting foul on Kobe Randle. Jordan Doncic to the line for 2 free throws. [BONUS: 5 team fouls] (Kobe Randle: 3 personal fouls)   FT 1/2: MISS   FT 2/2: MISS Jordan Doncic makes 0/2 from the line. Rebound secured by Jimmy Poole.

[01:55] Team_031 possession (Score: 46-38)
Kevin Morant makes the Dunk and draws the foul on Jordan Doncic! And-1! Kevin Morant to the line for 1. [BONUS: 9 team fouls] (Jordan Doncic: 1 personal fouls)   FT 1/1: GOOD Kevin Morant makes 1/1 from the line.
Score: 46-41

[01:41] Team_076 possession (Score: 46-41)
Vince Lowry attempts a 3Pt. Contested by Miles Stewart (5.2 feet, MAN). Vince Lowry misses. Rebound secured by Isaiah Ingram.

[01:26] Team_031 possession (Score: 46-41)
Jimmy Poole drives to the basket... Jimmy Poole throws a bad pass out of bounds! TURNOVER! (dead ball)

[01:13] Team_076 possession (Score: 46-41)
Pascal Lowry attempts a 3Pt. Contested by Miles Stewart (5.0 feet, ZONE). Pascal Lowry misses. Rebound secured by Kobe Randle.

[00:56] Team_031 possession (Score: 46-41)
FOUL! Offensive foul on Jimmy Poole! Jordan Doncic drew the charge! [Team fouls: 6] (Jimmy Poole: 1 personal fouls) TURNOVER! (dead ball)

[00:37] Team_076 possession (Score: 46-41)
Jalen Poole throws a bad pass! Stolen by Isaiah Ingram! TURNOVER! (live ball)

[00:20] Team_031 possession (Score: 46-41)
Isaiah Ingram drives to the basket... FOUL! Offensive foul on Isaiah Ingram! Jalen Poole drew the charge! [Team fouls: 7] (Isaiah Ingram: 2 personal fouls) TURNOVER! (dead ball)

[00:09] Team_076 possession (Score: 46-41)
Jalen Poole drives, Isaiah Ingram stays with him. Jalen Poole attempts a Dunk. Contested by Isaiah Ingram (4.7 feet, MAN). JALEN POOLE MAKES IT!
Score: 48-41

================================================================================
                              2ND QUARTER COMPLETE                              
================================================================================

2ND QUARTER SCORE: Team_076 24, Team_031 20

BOX SCORE:
================================================================================

Team_076
--------------------------------------------------------------------------------
Player                MIN  PTS  REB  AST  TO      FG   FG%      3P   3P%
--------------------------------------------------------------------------------
Jalen Poole             8    7    0    1   0   3/4    75.0     0/0   0.0
Kevin Nowitzki          8    6    4    0   0   2/3    66.7     0/0   0.0
Paul Leonard           17    3    0    0   0   1/1   100.0     0/0   0.0
Cade Barnes            17    3    4    1   0   1/2    50.0     0/0   0.0
Dejounte LaVine        17    3    0    0   0   1/5    20.0     0/0   0.0
Vince Lowry             8    2    0    0   0   1/2    50.0     0/0   0.0
Tobias Mitchell        17    0    0    0   0   0/1     0.0     0/0   0.0
D'Angelo Tatum         17    0    1    1   0   0/0     0.0     0/0   0.0
Pascal Lowry            8    0    0    2   0   0/2     0.0     0/0   0.0
Jordan Doncic           8    0    1    0   0   0/1     0.0     0/0   0.0

TEAM: FG: 9/21 (42.9%), 3PT: 5/11 (45.5%), REB: 10 (1 off, 9 def), AST: 5, TO: 2
TEAM FOULS: 9 [Team_031 in BONUS]


Team_031
--------------------------------------------------------------------------------
Player                MIN  PTS  REB  AST  TO      FG   FG%      3P   3P%
--------------------------------------------------------------------------------
Luka Sabonis           17    4    3    0   0   1/1   100.0     0/0   0.0
Kevin Morant            8    4    0    0   0   2/4    50.0     0/0   0.0
Isaiah Ingram           8    4    1    0   0   2/2   100.0     0/0   0.0
Pau Irving             17    3    0    1   0   1/2    50.0     0/0   0.0
Shai Durant            17    2    0    1   0   1/1   100.0     0/0   0.0
Miles Stewart           8    2    0    0   0   1/1   100.0     0/0   0.0
Immanuel James         17    0    3    0   0   0/2     0.0     0/0   0.0
Gary Morant            17    0    1    0   0   0/2     0.0     0/0   0.0
Jimmy Poole             8    0    1    0   0   0/2     0.0     0/0   0.0
Kobe Randle             8    0    3    0   0   0/0     0.0     0/0   0.0

TEAM: FG: 8/17 (47.1%), 3PT: 0/4 (0.0%), REB: 12 (1 off, 11 def), AST: 2, TO: 5
TEAM FOULS: 7 [Team_076 in BONUS]

================================================================================

================================================================================
                       3RD QUARTER - Team_076 vs Team_031                       
================================================================================

[12:00] Team_076 possession (Score: 48-41)
D'Angelo Tatum attempts a 3Pt. Contested by Pau Irving (3.8 feet, ZONE). D'Angelo Tatum misses. Rebound secured by Luka Sabonis.

[11:47] Team_031 possession (Score: 48-41)
FOUL! Shooting foul on D'Angelo Tatum. Luka Sabonis to the line for 2 free throws. [Team fouls: 1] (D'Angelo Tatum: 1 personal fouls)   FT 1/2: GOOD   FT 2/2: MISS Luka Sabonis makes 1/2 from the line. Rebound secured by D'Angelo Tatum.
Score: 48-42

[11:37] Team_076 possession (Score: 48-42)
Cade Barnes attempts a Midrange. Contested by Immanuel James (3.2 feet, MAN). Cade Barnes misses. Rebound secured by Immanuel James.

[11:24] Team_031 possession (Score: 48-42)
Immanuel James attempts a Layup. Contested by Cade Barnes (3.9 feet, MAN). Immanuel James misses. Rebound secured by Cade Barnes.

[11:09] Team_076 possession (Score: 48-42)
Tobias Mitchell attempts a Layup. BLOCKED BY IMMANUEL JAMES! Ball is loose! Rebound secured by Gary Morant.

[10:49] Team_031 possession (Score: 48-42)
Immanuel James drives and kicks out. Pau Irving attempts a 3Pt. Contested by Paul Leonard (5.1 feet, MAN). Pau Irving misses. Rebound secured by D'Angelo Tatum.

[10:36] Team_076 possession (Score: 48-42)
Dejounte LaVine attempts a Midrange. Contested by Shai Durant (3.8 feet, MAN). Dejounte LaVine misses. Rebound secured by Immanuel James.

[10:21] Team_031 possession (Score: 48-42)
Pau Irving attempts a Layup. BLOCKED BY CADE BARNES! Ball is loose! Offensive rebound by Luka Sabonis! Luka Sabonis kicks it out.

[10:08] Team_031 possession (Score: 48-42)
Shai Durant makes the Midrange and draws the foul on Paul Leonard! And-1! Shai Durant to the line for 1. [Team fouls: 2] (Paul Leonard: 1 personal fouls)   FT 1/1: GOOD Shai Durant makes 1/1 from the line.
Score: 48-45

[09:52] Team_076 possession (Score: 48-45)
Cade Barnes makes the Midrange and draws the foul on Immanuel James! And-1! Cade Barnes to the line for 1. [Team fouls: 1] (Immanuel James: 1 personal fouls)   FT 1/1: GOOD Cade Barnes makes 1/1 from the line.
Score: 51-45

[09:36] Team_031 possession (Score: 51-45)
Shai Durant throws a bad pass! Stolen by Dejounte LaVine! TURNOVER! (live ball)

[09:24] Team_076 possession (Score: 51-45)
Tobias Mitchell attempts a 3Pt. Contested by Gary Morant (4.2 feet, MAN). Tobias Mitchell misses. Offensive rebound by Cade Barnes! Cade Barnes kicks it out.

[09:11] Team_076 possession (Score: 51-45)
Cade Barnes attempts a 3Pt. Contested by Pau Irving (3.8 feet, ZONE). Cade Barnes misses. Rebound secured by Immanuel James.

[09:02] Team_031 possession (Score: 51-45)
Pau Irving attempts a 3Pt. Contested by Paul Leonard (5.1 feet, MAN). Pau Irving misses. Rebound secured by Tobias Mitchell.

[08:45] Team_076 possession (Score: 51-45)
FOUL! Shooting foul on Immanuel James. Tobias Mitchell to the line for 2 free throws. [Team fouls: 2] (Immanuel James: 2 personal fouls)   FT 1/2: GOOD   FT 2/2: GOOD Tobias Mitchell makes 2/2 from the line.
Score: 53-45

[08:29] Team_031 possession (Score: 53-45)
FOUL! Shooting foul on Tobias Mitchell. Gary Morant to the line for 2 free throws. [Team fouls: 3] (Tobias Mitchell: 1 personal fouls)   FT 1/2: GOOD   FT 2/2: GOOD Gary Morant makes 2/2 from the line.
Score: 53-47

[08:19] Team_076 possession (Score: 53-47)
D'Angelo Tatum attempts a Midrange. Contested by Luka Sabonis (3.4 feet, MAN). D'Angelo Tatum misses. Offensive rebound by Cade Barnes! Cade Barnes kicks it out.

[08:05] Team_076 possession (Score: 53-47)
Cade Barnes loses the ball! Stripped by Immanuel James! TURNOVER! (live ball)

[07:49] Team_031 possession (Score: 53-47)
Gary Morant attempts a Midrange. Contested by Tobias Mitchell (4.7 feet, MAN). Gary Morant misses. Rebound secured by Cade Barnes.

[07:33] Team_076 possession (Score: 53-47)
Cade Barnes attempts a Midrange. Contested by Immanuel James (3.2 feet, MAN). CADE BARNES MAKES IT! Assist: Paul Leonard
Score: 55-47

[07:21] Team_031 possession (Score: 55-47)
Luka Sabonis attempts a Midrange. Contested by D'Angelo Tatum (4.3 feet, MAN). Luka Sabonis misses. Offensive rebound by Luka Sabonis! Luka Sabonis's putback is no good. Rebound secured by D'Angelo Tatum.

[07:08] Team_076 possession (Score: 55-47)
Cade Barnes attempts a 3Pt. Contested by Immanuel James (3.2 feet, MAN). Cade Barnes misses. Rebound secured by Luka Sabonis.

[06:53] Team_031 possession (Score: 55-47)
Luka Sabonis drives, Cade Barnes stays with him. Luka Sabonis attempts a Dunk. Contested by Cade Barnes (4.1 feet, ZONE). LUKA SABONIS MAKES IT! Assist: Immanuel James
Score: 55-49

[06:43] Team_076 possession (Score: 55-49)
Tobias Mitchell attempts a 3Pt. Contested by Gary Morant (4.2 feet, MAN). Tobias Mitchell misses. Rebound secured by Immanuel James.

[06:30] Team_031 possession (Score: 55-49)
Immanuel James attempts a Midrange. Contested by Cade Barnes (3.9 feet, MAN). Immanuel James misses. Rebound secured by Tobias Mitchell.

[06:17] Team_076 possession (Score: 55-49)
Dejounte LaVine attempts a 3Pt. Contested by Shai Durant (3.8 feet, MAN). DEJOUNTE LAVINE MAKES IT! Assist: Paul Leonard
Score: 58-49

[06:03] Team_031 possession (Score: 58-49)
Shai Durant attempts a 3Pt. Contested by Dejounte LaVine (4.9 feet, MAN). Shai Durant misses. Offensive rebound by Luka Sabonis! Luka Sabonis puts it back in!
Score: 58-51

[05:48] Team_076 possession (Score: 58-51)
Dejounte LaVine drives, Luka Sabonis stays with him. Dejounte LaVine attempts a Dunk. Contested by Luka Sabonis (3.1 feet, ZONE). DEJOUNTE LAVINE MAKES IT!
Score: 60-51

[05:33] Team_031 possession (Score: 60-51)
Gary Morant attempts a Midrange. Contested by Paul Leonard (5.7 feet, ZONE). Gary Morant misses. FOUL! Loose ball foul on Cade Barnes during the rebound battle. [Team fouls: 4] No free throws, side out. (Cade Barnes: 1 personal fouls)

[05:19] Team_031 possession (Score: 60-51)
Gary Morant attempts a 3Pt. Contested by Cade Barnes (4.1 feet, ZONE). GARY MORANT MAKES IT! Assist: Immanuel James
Score: 60-54

[05:05] Team_076 possession (Score: 60-54)
Paul Leonard attempts a Midrange. Contested by Pau Irving (4.0 feet, MAN). Paul Leonard misses. Rebound secured by Immanuel James.

[04:50] Team_031 possession (Score: 60-54)
Immanuel James makes the Midrange and draws the foul on Tobias Mitchell! And-1! Immanuel James to the line for 1. [BONUS: 5 team fouls] (Tobias Mitchell: 2 personal fouls)   FT 1/1: GOOD Immanuel James makes 1/1 from the line.
Score: 60-57

[04:34] Team_076 possession (Score: 60-57)
Cade Barnes attempts a 3Pt. Contested by Immanuel James (3.4 feet, MAN). CADE BARNES MAKES IT! Assist: D'Angelo Tatum
Score: 63-57

[04:20] Team_031 possession (Score: 63-57)
Immanuel James attempts a 3Pt. Contested by Cade Barnes (4.0 feet, MAN). Immanuel James misses. Rebound secured by Tobias Mitchell.

[04:04] Team_076 possession (Score: 63-57)
Cade Barnes makes the Layup and draws the foul on Immanuel James! And-1! Cade Barnes to the line for 1. [Team fouls: 3] (Immanuel James: 3 personal fouls)   FT 1/1: GOOD Cade Barnes makes 1/1 from the line.
Score: 66-57

[03:52] Team_031 possession (Score: 66-57)
Immanuel James makes the Layup and draws the foul on Tobias Mitchell! And-1! Immanuel James to the line for 1. [BONUS: 6 team fouls] (Tobias Mitchell: 3 personal fouls)   FT 1/1: GOOD Immanuel James makes 1/1 from the line.
Score: 66-60

[03:38] Team_076 possession (Score: 66-60)
Dejounte LaVine drives, picks up Shai Durant. Help arrives from Pau Irving! Dejounte LaVine attempts a Dunk. Contested by Pau Irving (4.0 feet, MAN). Dejounte LaVine misses. Rebound secured by Immanuel James.

[03:23] Team_031 possession (Score: 66-60)
Immanuel James attempts a 3Pt. Contested by Cade Barnes (4.1 feet, MAN). IMMANUEL JAMES MAKES IT! Assist: Luka Sabonis
Score: 66-63

[03:11] Team_076 possession (Score: 66-63)
D'Angelo Tatum attempts a Midrange. Contested by Shai Durant (4.3 feet, ZONE). D'ANGELO TATUM MAKES IT! Assist: Tobias Mitchell
Score: 68-63

[02:58] Team_031 possession (Score: 68-63)
Pau Irving attempts a 3Pt. Contested by Paul Leonard (5.3 feet, MAN). PAU IRVING MAKES IT! Assist: Shai Durant
Score: 68-66

[02:43] Team_076 possession (Score: 68-66)
Paul Leonard attempts a Layup. Contested by Immanuel James (3.8 feet, ZONE). PAUL LEONARD MAKES IT! Assist: D'Angelo Tatum
Score: 70-66

[02:26] Team_031 possession (Score: 70-66)
Luka Sabonis attempts a 3Pt. Contested by Paul Leonard (5.9 feet, ZONE). Luka Sabonis misses. Offensive rebound by Immanuel James! Immanuel James puts it back in!
Score: 70-68

[02:12] Team_076 possession (Score: 70-68)
Dejounte LaVine attempts a 3Pt. Contested by Pau Irving (3.9 feet, ZONE). Dejounte LaVine misses. Rebound secured by Luka Sabonis.

[01:55] Team_031 possession (Score: 70-68)
FOUL! Shooting foul on D'Angelo Tatum. Pau Irving to the line for 2 free throws. [BONUS: 7 team fouls] (D'Angelo Tatum: 2 personal fouls)   FT 1/2: GOOD   FT 2/2: GOOD Pau Irving makes 2/2 from the line.
Score: 70-70

[01:41] Team_076 possession (Score: 70-70)
FOUL! Reach-in foul on Immanuel James during the drive. [Team fouls: 4] No free throws, side out. (Immanuel James: 4 personal fouls)

[01:28] Team_076 possession (Score: 70-70)
Tobias Mitchell attempts a 3Pt. Contested by Pau Irving (4.4 feet, ZONE). Tobias Mitchell misses. Offensive rebound by D'Angelo Tatum! D'Angelo Tatum kicks it out.

[01:14] Team_076 possession (Score: 70-70)
D'Angelo Tatum makes the Dunk and draws the foul on Shai Durant! And-1! D'Angelo Tatum to the line for 1. [BONUS: 5 team fouls] (Shai Durant: 1 personal fouls)   FT 1/1: GOOD D'Angelo Tatum makes 1/1 from the line.
Score: 73-70

[01:01] Team_031 possession (Score: 73-70)
FOUL! Shooting foul on Cade Barnes. Immanuel James to the line for 2 free throws. [BONUS: 8 team fouls] (Cade Barnes: 2 personal fouls)   FT 1/2: GOOD   FT 2/2: MISS Immanuel James makes 1/2 from the line. Offensive rebound by Luka Sabonis! Luka Sabonis puts it back in!
Score: 73-73

[00:47] Team_076 possession (Score: 73-73)
Paul Leonard attempts a 3Pt. Contested by Pau Irving (4.4 feet, MAN). Paul Leonard misses. Rebound secured by Immanuel James.

[00:34] Team_031 possession (Score: 73-73)
Gary Morant commits a violation (traveling/carry)! TURNOVER! (dead ball)

[00:34] Substitution (Team_076): Dejounte LaVine OUT → Pascal Lowry IN (stamina_rule2)

[00:34] Substitution (Team_076): Tobias Mitchell OUT → Jalen Poole IN (stamina_rule2)

[00:34] Substitution (Team_076): Paul Leonard OUT → Vince Lowry IN (stamina_rule2)

[00:34] Substitution (Team_076): Cade Barnes OUT → Kevin Nowitzki IN (stamina_rule2)

[00:34] Substitution (Team_076): D'Angelo Tatum OUT → Jordan Doncic IN (stamina_rule2)

[00:34] Substitution (Team_031): Shai Durant OUT → Kevin Morant IN (stamina_rule2)

[00:34] Substitution (Team_031): Gary Morant OUT → Isaiah Ingram IN (stamina_rule2)

[00:34] Substitution (Team_031): Pau Irving OUT → Miles Stewart IN (stamina_rule2)

[00:34] Substitution (Team_031): Immanuel James OUT → Kobe Randle IN (stamina_rule2)

[00:34] Substitution (Team_031): Luka Sabonis OUT → Jimmy Poole IN (stamina_rule2)

[00:17] Team_076 possession (Score: 73-73)
Vince Lowry attempts a 3Pt. Contested by Miles Stewart (5.2 feet, ZONE). VINCE LOWRY MAKES IT! Assist: Kevin Nowitzki
Score: 76-73

[00:08] Team_031 possession (Score: 76-73)
Jimmy Poole attempts a Midrange. Contested by Kevin Nowitzki (4.2 feet, ZONE). Jimmy Poole misses. Rebound secured by Kevin Nowitzki.

================================================================================
                              3RD QUARTER COMPLETE                              
================================================================================

3RD QUARTER SCORE: Team_076 28, Team_031 32

BOX SCORE:
================================================================================

Team_076
--------------------------------------------------------------------------------
Player                MIN  PTS  REB  AST  TO      FG   FG%      3P   3P%
--------------------------------------------------------------------------------
Cade Barnes            28   11    4    0   0   4/7    57.1     0/0   0.0
D'Angelo Tatum         28    5    4    2   0   2/3    66.7     0/0   0.0
Dejounte LaVine        28    5    0    0   0   2/5    40.0     0/0   0.0
Vince Lowry             8    3    0    0   0   1/1   100.0     0/0   0.0
Tobias Mitchell        28    2    3    1   0   1/3    33.3     0/0   0.0
Paul Leonard           28    2    0    2   0   1/3    33.3     0/0   0.0
Kevin Nowitzki          8    0    1    1   0   0/0     0.0     0/0   0.0

TEAM: FG: 11/22 (50.0%), 3PT: 3/9 (33.3%), REB: 11 (3 off, 8 def), AST: 6, TO: 1
TEAM FOULS: 8 [Team_031 in BONUS]


Team_031
--------------------------------------------------------------------------------
Player                MIN  PTS  REB  AST  TO      FG   FG%      3P   3P%
--------------------------------------------------------------------------------
Immanuel James         28   11    8    2   0   4/8    50.0     0/0   0.0
Luka Sabonis           28    7    6    1   0   3/5    60.0     0/0   0.0
Gary Morant            28    5    1    0   0   2/3    66.7     0/0   0.0
Pau Irving             28    5    0    0   0   2/3    66.7     0/0   0.0
Shai Durant            28    3    0    1   0   1/1   100.0     0/0   0.0
Jimmy Poole             8    0    0    0   0   0/1     0.0     0/0   0.0

TEAM: FG: 12/21 (57.1%), 3PT: 5/7 (71.4%), REB: 16 (5 off, 11 def), AST: 4, TO: 2
TEAM FOULS: 5 [Team_076 in BONUS]

================================================================================

================================================================================
                       4TH QUARTER - Team_076 vs Team_031                       
================================================================================

[12:00] Team_076 possession (Score: 76-73)
D'Angelo Tatum attempts a Midrange. Contested by Pau Irving (4.1 feet, ZONE). D'Angelo Tatum misses. Rebound secured by Luka Sabonis.

[11:47] Team_031 possession (Score: 76-73)
Immanuel James attempts a 3Pt. Contested by Cade Barnes (4.1 feet, MAN). Immanuel James misses. Rebound secured by D'Angelo Tatum.

[11:38] Team_076 possession (Score: 76-73)
Cade Barnes drives to the basket... Cade Barnes throws a bad pass! Stolen by Immanuel James! TURNOVER! (live ball)

[11:25] Team_031 possession (Score: 76-73)
Immanuel James attempts a Midrange. Contested by Cade Barnes (4.2 feet, ZONE). Immanuel James misses. Rebound secured by Cade Barnes.

[11:07] Team_076 possession (Score: 76-73)
Tobias Mitchell makes the Dunk and draws the foul on Gary Morant! And-1! Tobias Mitchell to the line for 1. [Team fouls: 1] (Gary Morant: 1 personal fouls)   FT 1/1: GOOD Tobias Mitchell makes 1/1 from the line.
Score: 79-73

[10:56] Team_031 possession (Score: 79-73)
Pau Irving drives, Cade Barnes stays with him. Pau Irving attempts a Layup. Contested by Cade Barnes (4.0 feet, ZONE). PAU IRVING MAKES IT!
Score: 79-75

[10:40] Team_076 possession (Score: 79-75)
FOUL! Shooting foul on Shai Durant. Paul Leonard to the line for 2 free throws. [Team fouls: 2] (Shai Durant: 1 personal fouls)   FT 1/2: GOOD   FT 2/2: GOOD Paul Leonard makes 2/2 from the line.
Score: 81-75

[10:24] Team_031 possession (Score: 81-75)
Luka Sabonis attempts a Midrange. Contested by D'Angelo Tatum (4.7 feet, MAN). Luka Sabonis misses. Rebound secured by D'Angelo Tatum.

[10:08] Team_076 possession (Score: 81-75)
FOUL! Holding foul on Luka Sabonis. [Team fouls: 3] No free throws, side out. (Luka Sabonis: 1 personal fouls)

[09:56] Team_076 possession (Score: 81-75)
Paul Leonard attempts a 3Pt. Contested by Pau Irving (4.4 feet, ZONE). Paul Leonard misses. Rebound secured by Luka Sabonis.

[09:38] Team_031 possession (Score: 81-75)
Immanuel James drives and kicks out. Luka Sabonis attempts a Midrange. Contested by D'Angelo Tatum (4.3 feet, MAN). Luka Sabonis misses. Rebound secured by Tobias Mitchell.

[09:22] Team_076 possession (Score: 81-75)
D'Angelo Tatum drives and kicks out. Dejounte LaVine attempts a 3Pt. Contested by Shai Durant (4.5 feet, MAN). Dejounte LaVine misses. Rebound secured by Gary Morant.

[09:05] Team_031 possession (Score: 81-75)
Pau Irving attempts a Midrange. Contested by Paul Leonard (5.6 feet, MAN). PAU IRVING MAKES IT!
Score: 81-77

[08:48] Team_076 possession (Score: 81-77)
Tobias Mitchell attempts a 3Pt. Contested by Gary Morant (4.8 feet, MAN). Tobias Mitchell misses. Rebound secured by Immanuel James.

[08:33] Team_031 possession (Score: 81-77)
Immanuel James drives, picks up Cade Barnes. Help arrives from Tobias Mitchell! Immanuel James attempts a Dunk. Contested by Tobias Mitchell (4.5 feet, MAN). Immanuel James misses. Rebound secured by Cade Barnes.

[08:20] Team_076 possession (Score: 81-77)
Dejounte LaVine throws a bad pass! Stolen by Shai Durant! TURNOVER! (live ball)

[08:07] Team_031 possession (Score: 81-77)
Pau Irving attempts a 3Pt. Contested by Dejounte LaVine (5.5 feet, ZONE). PAU IRVING MAKES IT! Assist: Shai Durant
Score: 81-80

[07:54] Team_076 possession (Score: 81-80)
Tobias Mitchell drives, picks up Gary Morant. Help arrives from Pau Irving! Tobias Mitchell attempts a Layup. Contested by Pau Irving (4.9 feet, MAN). TOBIAS MITCHELL MAKES IT! Assist: Dejounte LaVine
Score: 83-80

[07:41] Team_031 possession (Score: 83-80)
Shai Durant drives and kicks out. Luka Sabonis attempts a 3Pt. Contested by Cade Barnes (4.4 feet, ZONE). Luka Sabonis misses. Rebound secured by D'Angelo Tatum.

[07:28] Team_076 possession (Score: 83-80)
FOUL! Shooting foul on Shai Durant. Dejounte LaVine to the line for 2 free throws. [Team fouls: 4] (Shai Durant: 2 personal fouls)   FT 1/2: GOOD   FT 2/2: GOOD Dejounte LaVine makes 2/2 from the line.
Score: 85-80

[07:13] Team_031 possession (Score: 85-80)
FOUL! Holding foul on Tobias Mitchell. [Team fouls: 1] No free throws, side out. (Tobias Mitchell: 1 personal fouls)

[06:57] Team_031 possession (Score: 85-80)
Immanuel James attempts a Layup. BLOCKED BY CADE BARNES! Ball is loose! Rebound secured by Cade Barnes.

[06:44] Team_076 possession (Score: 85-80)
Cade Barnes attempts a 3Pt. Contested by Immanuel James (4.6 feet, MAN). Cade Barnes misses. Rebound secured by Luka Sabonis.

[06:29] Team_031 possession (Score: 85-80)
Pau Irving throws a bad pass out of bounds! TURNOVER! (dead ball)

[06:29] Substitution (Team_076): Dejounte LaVine OUT → Pascal Lowry IN (stamina_rule2)

[06:29] Substitution (Team_076): Tobias Mitchell OUT → Jalen Poole IN (stamina_rule2)

[06:29] Substitution (Team_076): Paul Leonard OUT → Vince Lowry IN (stamina_rule2)

[06:29] Substitution (Team_076): Cade Barnes OUT → Kevin Nowitzki IN (stamina_rule2)

[06:29] Substitution (Team_076): D'Angelo Tatum OUT → Jordan Doncic IN (stamina_rule2)

[06:29] Substitution (Team_031): Shai Durant OUT → Kevin Morant IN (stamina_rule2)

[06:29] Substitution (Team_031): Gary Morant OUT → Isaiah Ingram IN (stamina_rule2)

[06:29] Substitution (Team_031): Pau Irving OUT → Miles Stewart IN (stamina_rule2)

[06:29] Substitution (Team_031): Immanuel James OUT → Kobe Randle IN (stamina_rule2)

[06:29] Substitution (Team_031): Luka Sabonis OUT → Jimmy Poole IN (stamina_rule2)

[06:15] Team_076 possession (Score: 85-80)
Pascal Lowry attempts a 3Pt. Contested by Isaiah Ingram (3.9 feet, ZONE). Pascal Lowry misses. Rebound secured by Kobe Randle.

[06:01] Team_031 possession (Score: 85-80)
Kevin Morant attempts a Midrange. Contested by Kevin Nowitzki (4.3 feet, ZONE). KEVIN MORANT MAKES IT! Assist: Kobe Randle
Score: 85-82

[05:43] Team_076 possession (Score: 85-82)
Kevin Nowitzki drives, picks up Kobe Randle. Help arrives from Isaiah Ingram! Kevin Nowitzki attempts a Dunk. Contested by Isaiah Ingram (4.6 feet, ZONE). KEVIN NOWITZKI MAKES IT! Assist: Pascal Lowry
Score: 87-82

[05:31] Team_031 possession (Score: 87-82)
Kevin Morant attempts a Midrange. Wide open! Pascal Lowry is 6.3 feet away. [MAN] Kevin Morant misses. Rebound secured by Kevin Nowitzki.

[05:20] Team_076 possession (Score: 87-82)
Pascal Lowry attempts a Layup. BLOCKED BY KEVIN MORANT! Ball is loose! Rebound secured by Isaiah Ingram.

[05:06] Team_031 possession (Score: 87-82)
Kobe Randle attempts a Layup. BLOCKED BY KEVIN NOWITZKI! Ball is loose! Offensive rebound by Isaiah Ingram! Isaiah Ingram kicks it out.

[04:55] Team_031 possession (Score: 87-82)
Kobe Randle throws a bad pass! Stolen by Kevin Nowitzki! TURNOVER! (live ball)

[04:46] Team_076 possession (Score: 87-82)
FOUL! Shooting foul on Isaiah Ingram. Jalen Poole to the line for 2 free throws. [BONUS: 5 team fouls] (Isaiah Ingram: 1 personal fouls)   FT 1/2: MISS   FT 2/2: GOOD Jalen Poole makes 1/2 from the line.
Score: 88-82

[04:27] Team_031 possession (Score: 88-82)
Isaiah Ingram attempts a 3Pt. Contested by Vince Lowry (4.6 feet, ZONE). Isaiah Ingram misses. Rebound secured by Jordan Doncic.

[04:10] Team_076 possession (Score: 88-82)
Jalen Poole attempts a 3Pt. Contested by Kobe Randle (4.7 feet, ZONE). Jalen Poole misses. Rebound secured by Jimmy Poole.

[03:54] Team_031 possession (Score: 88-82)
FOUL! Shooting foul on Jordan Doncic. Isaiah Ingram to the line for 2 free throws. [Team fouls: 3] (Jordan Doncic: 1 personal fouls)   FT 1/2: MISS   FT 2/2: GOOD Isaiah Ingram makes 1/2 from the line.
Score: 88-83

[03:39] Team_076 possession (Score: 88-83)
Kevin Nowitzki attempts a Midrange. Contested by Isaiah Ingram (4.5 feet, ZONE). Kevin Nowitzki misses. Offensive rebound by Kevin Nowitzki! Kevin Nowitzki kicks it out.

[03:22] Team_076 possession (Score: 88-83)
Jordan Doncic makes the Layup and draws the foul on Jimmy Poole! And-1! Jordan Doncic to the line for 1. [BONUS: 6 team fouls] (Jimmy Poole: 1 personal fouls)   FT 1/1: GOOD Jordan Doncic makes 1/1 from the line.
Score: 91-83

[03:05] Team_031 possession (Score: 91-83)
Kevin Morant loses control! Ball rolls out of bounds! TURNOVER! (dead ball)

[02:50] Team_076 possession (Score: 91-83)
Pascal Lowry attempts a Midrange. Contested by Jimmy Poole (5.3 feet, ZONE). Pascal Lowry misses. Rebound secured by Isaiah Ingram.

[02:35] Team_031 possession (Score: 91-83)
Isaiah Ingram makes the Layup and draws the foul on Jalen Poole! And-1! Isaiah Ingram to the line for 1. [Team fouls: 4] (Jalen Poole: 1 personal fouls)   FT 1/1: GOOD Isaiah Ingram makes 1/1 from the line.
Score: 91-86

[02:22] Team_076 possession (Score: 91-86)
Vince Lowry attempts a 3Pt. Contested by Miles Stewart (5.2 feet, ZONE). Vince Lowry misses. Rebound secured by Isaiah Ingram.

[02:06] Team_031 possession (Score: 91-86)
Kobe Randle attempts a 3Pt. Contested by Vince Lowry (4.8 feet, ZONE). Kobe Randle misses. Offensive rebound by Jimmy Poole! Jimmy Poole kicks it out.

[01:47] Team_031 possession (Score: 91-86)
Isaiah Ingram attempts a 3Pt. Contested by Jalen Poole (5.9 feet, MAN). Isaiah Ingram misses. FOUL! Loose ball foul on Jordan Doncic during the rebound battle. [IN THE BONUS! 5 team fouls] Isaiah Ingram to the line for 2 free throws. (Jordan Doncic: 2 personal fouls)   FT 1/2: GOOD   FT 2/2: MISS Isaiah Ingram makes 1/2 from the line. Rebound secured by Kevin Nowitzki.
Score: 91-87

[01:34] Team_076 possession (Score: 91-87)
Jordan Doncic attempts a Midrange. Contested by Isaiah Ingram (3.7 feet, ZONE). Jordan Doncic misses. Rebound secured by Jimmy Poole.

[01:19] Team_031 possession (Score: 91-87)
Kevin Morant attempts a Midrange. Contested by Jalen Poole (5.5 feet, ZONE). KEVIN MORANT MAKES IT!
Score: 91-89

[01:04] Team_076 possession (Score: 91-89)
Pascal Lowry attempts a 3Pt. Contested by Kevin Morant (4.5 feet, MAN). Pascal Lowry misses. Rebound secured by Jimmy Poole.

[00:50] Team_031 possession (Score: 91-89)
FOUL! Reach-in foul on Jordan Doncic during the drive. [IN THE BONUS! 6 team fouls] Miles Stewart to the line for 2 free throws. (Jordan Doncic: 3 personal fouls)   FT 1/2: GOOD   FT 2/2: GOOD Miles Stewart makes 2/2 from the line.
Score: 91-91

[00:36] Team_076 possession (Score: 91-91)
Jordan Doncic makes the Dunk and draws the foul on Kobe Randle! And-1! Jordan Doncic to the line for 1. [BONUS: 7 team fouls] (Kobe Randle: 1 personal fouls)   FT 1/1: MISS Jordan Doncic makes 0/1 from the line. Rebound secured by Kobe Randle.
Score: 93-91

[00:21] Team_031 possession (Score: 93-91)
Jimmy Poole drives, picks up Jordan Doncic. Help arrives from Jalen Poole! Jimmy Poole attempts a Layup. Contested by Jalen Poole (3.2 feet, MAN). JIMMY POOLE MAKES IT!
Score: 93-93

[00:09] Team_076 possession (Score: 93-93)
Vince Lowry attempts a Midrange. Contested by Miles Stewart (5.2 feet, ZONE). Vince Lowry misses. Rebound secured by Kobe Randle.

================================================================================
                              4TH QUARTER COMPLETE                              
================================================================================

4TH QUARTER SCORE: Team_076 17, Team_031 20

BOX SCORE:
================================================================================

Team_076
--------------------------------------------------------------------------------
Player                MIN  PTS  REB  AST  TO      FG   FG%      3P   3P%
--------------------------------------------------------------------------------
Tobias Mitchell        34    5    1    0   0   2/3    66.7     0/0   0.0
Jordan Doncic          14    3    1    0   0   1/3    33.3     0/0   0.0
Paul Leonard           34    2    0    0   0   1/2    50.0     0/0   0.0
Dejounte LaVine        34    2    0    1   0   1/1   100.0     0/0   0.0
Jalen Poole            14    1    0    0   0   1/2    50.0     0/0   0.0
D'Angelo Tatum         34    0    3    0   0   0/2     0.0     0/0   0.0
Cade Barnes            34    0    3    0   0   0/1     0.0     0/0   0.0
Pascal Lowry           14    0    0    1   0   0/4     0.0     0/0   0.0
Vince Lowry            14    0    0    0   0   0/2     0.0     0/0   0.0

TEAM: FG: 7/21 (33.3%), 3PT: 0/7 (0.0%), REB: 10 (1 off, 9 def), AST: 2, TO: 2
TEAM FOULS: 6 [Team_031 in BONUS]


Team_031
--------------------------------------------------------------------------------
Player                MIN  PTS  REB  AST  TO      FG   FG%      3P   3P%
--------------------------------------------------------------------------------
Pau Irving             34    7    0    0   0   3/3   100.0     0/0   0.0
Kevin Morant           14    4    0    0   0   2/3    66.7     0/0   0.0
Isaiah Ingram          14    4    4    0   0   2/4    50.0     0/0   0.0
Kevin Nowitzki         14    2    3    0   0   1/1   100.0     0/0   0.0
Jimmy Poole            14    2    4    0   0   1/1   100.0     0/0   0.0
Miles Stewart          14    2    0    0   0   1/1   100.0     0/0   0.0
Luka Sabonis           34    0    3    0   0   0/1     0.0     0/0   0.0
Immanuel James         34    0    1    0   0   0/5     0.0     0/0   0.0
Gary Morant            34    0    1    0   0   0/0     0.0     0/0   0.0
Shai Durant            34    0    0    1   0   0/1     0.0     0/0   0.0
Kobe Randle            14    0    3    1   0   0/0     0.0     0/0   0.0

TEAM: FG: 9/19 (47.4%), 3PT: 1/4 (25.0%), REB: 17 (3 off, 14 def), AST: 2, TO: 3
TEAM FOULS: 7 [Team_076 in BONUS]

================================================================================

================================================================================
                               FULL GAME COMPLETE                               
================================================================================

FINAL SCORE: Team_076 93, Team_031 93

SCORING BY QUARTER:
--------------------------------------------------------------------------------
Team                     Q1     Q2     Q3     Q4    FINAL
--------------------------------------------------------------------------------
Team_076                 24     24     28     17       93
Team_031                 21     20     32     20       93
--------------------------------------------------------------------------------

FULL GAME BOX SCORE:
================================================================================

Team_076
--------------------------------------------------------------------------------
Player                MIN  PTS  REB  AST  TO      FG   FG%      3P   3P%      FT STL BLK
--------------------------------------------------------------------------------
Dejounte LaVine        34   15    0    1   3   6/16   37.5   2/7    28.6   3/3     1   0
Tobias Mitchell        34   15    7    3   0   7/12   58.3   1/4    25.0   7/7     0   0
Paul Leonard           34    7    0    2   0   3/6    50.0   0/2     0.0   3/3     0   0
Cade Barnes            34   19   16    1   5   7/13   53.8   3/7    42.9   2/2     1   3
D'Angelo Tatum         34   11   13    3   0   4/8    50.0   0/1     0.0   1/1     0   0
Pascal Lowry           14    0    0    3   0   0/6     0.0   0/3     0.0   0/0     1   0
Jalen Poole            14    8    0    1   2   4/6    66.7   1/3    33.3   3/4     0   0
Vince Lowry            14    5    0    0   0   2/5    40.0   1/3    33.3   0/0     0   0
Kevin Nowitzki         14    8    8    1   0   3/4    75.0   2/3    66.7   0/0     1   1
Jordan Doncic          14    3    2    0   0   1/4    25.0   0/0     0.0   1/4     0   0

TEAM: FG: 37/80 (46.2%), 3PT: 10/33 (30.3%), REB: 44 (10 off, 34 def), AST: 15, TO: 10


Team_031
--------------------------------------------------------------------------------
Player                MIN  PTS  REB  AST  TO      FG   FG%      3P   3P%      FT STL BLK
--------------------------------------------------------------------------------
Shai Durant            34    8    0    3   2   4/7    57.1   2/3    66.7   1/1     1   0
Gary Morant            34    9    6    1   1   5/10   50.0   1/3    33.3   3/4     1   0
Pau Irving             34   21    0    2   1   7/12   58.3   3/8    37.5   3/3     0   0
Immanuel James         34   19   13    2   2   8/20   40.0   1/4    25.0   5/7     4   1
Luka Sabonis           34   11   17    2   3   2/5    40.0   1/1   100.0   1/2     0   0
Kevin Morant           14    8    0    0   1   4/7    57.1   0/2     0.0   2/3     0   1
Isaiah Ingram          14    8    5    0   0   3/5    60.0   0/2     0.0   5/7     1   0
Miles Stewart          14    4    0    0   2   2/2   100.0   0/0     0.0   4/4     0   0
Kobe Randle            14    0    6    1   1   0/0     0.0   0/0     0.0   0/0     0   1
Jimmy Poole            14    2    5    0   2   1/4    25.0   0/0     0.0   0/0     0   0

TEAM: FG: 37/73 (50.7%), 3PT: 8/23 (34.8%), REB: 52 (10 off, 42 def), AST: 11, TO: 15

================================================================================
