================================================================================
                        FULL GAME - Team_033 vs Team_028                        
================================================================================

================================================================================
                       1ST QUARTER - Team_033 vs Team_028                       
================================================================================

[12:00] Team_033 possession (Score: 0-0)
Cade Randle attempts a 3Pt. Contested by Myles Haliburton (4.1 feet, MAN). CADE RANDLE MAKES IT! Assist: Chris Anunoby
Score: 3-0

[11:45] Team_028 possession (Score: 3-0)
Carmelo Carter attempts a Layup. Contested by Bradley Simmons (3.4 feet, ZONE). CARMELO CARTER MAKES IT!
Score: 3-2

[11:31] Team_033 possession (Score: 3-2)
Desmond DeRozan attempts a Midrange. Contested by Myles Haliburton (3.6 feet, ZONE). Desmond DeRozan misses. Offensive rebound by Bradley Simmons! Bradley Simmons's putback is no good. Rebound secured by Jimmy Brogdon.

[11:18] Team_028 possession (Score: 3-2)
Jimmy Brogdon drives to the basket... Jimmy Brogdon loses the ball! Stripped by Bradley Simmons! TURNOVER! (live ball)

[11:04] Team_033 possession (Score: 3-2)
Joel Green attempts a 3Pt. Contested by Austin Russell (4.8 feet, ZONE). Joel Green misses. Rebound secured by Jimmy Brogdon.

[10:45] Team_028 possession (Score: 3-2)
Jimmy Brogdon drives and kicks out. Carmelo Carter attempts a Midrange. Contested by Desmond DeRozan (4.8 feet, ZONE). Carmelo Carter misses. Rebound secured by Desmond DeRozan.

[10:30] Team_033 possession (Score: 3-2)
Desmond DeRozan drives, Kawhi Ball stays with him. Desmond DeRozan attempts a Dunk. Contested by Kawhi Ball (4.2 feet, MAN). DESMOND DEROZAN MAKES IT! Assist: Cade Randle
Score: 5-2

[10:16] Team_028 possession (Score: 5-2)
Austin Russell attempts a 3Pt. Contested by Joel Green (4.2 feet, MAN). AUSTIN RUSSELL MAKES IT! Assist: Jimmy Brogdon
Score: 5-5

[10:01] Team_033 possession (Score: 5-5)
Desmond DeRozan attempts a 3Pt. Contested by Kawhi Ball (4.2 feet, ZONE). DESMOND DEROZAN MAKES IT! Assist: Joel Green
Score: 8-5

[09:48] Team_028 possession (Score: 8-5)
Myles Haliburton attempts a 3Pt. Contested by Joel Green (4.4 feet, ZONE). MYLES HALIBURTON MAKES IT! Assist: Carmelo Carter
Score: 8-8

[09:31] Team_033 possession (Score: 8-8)
Joel Green attempts a Layup. Contested by Austin Russell (4.8 feet, MAN). JOEL GREEN MAKES IT! Assist: Cade Randle
Score: 10-8

[09:13] Team_028 possession (Score: 10-8)
Myles Haliburton drives, picks up Cade Randle. Help arrives from Chris Anunoby! Myles Haliburton attempts a Dunk. Contested by Chris Anunoby (3.1 feet, MAN). MYLES HALIBURTON MAKES IT! Assist: Carmelo Carter
Score: 10-10

[08:59] Team_033 possession (Score: 10-10)
Cade Randle drives to the basket... Cade Randle loses control! Ball rolls out of bounds! TURNOVER! (dead ball)

[08:45] Team_028 possession (Score: 10-10)
Jimmy Brogdon attempts a Layup. Contested by Bradley Simmons (3.5 feet, ZONE). JIMMY BROGDON MAKES IT! Assist: Carmelo Carter
Score: 10-12

[08:31] Team_033 possession (Score: 10-12)
Bradley Simmons drives to the basket... Bradley Simmons loses the ball! Stripped by Jimmy Brogdon! TURNOVER! (live ball)

[08:14] Team_028 possession (Score: 10-12)
Jimmy Brogdon drives, picks up Bradley Simmons. Help arrives from Chris Anunoby! Jimmy Brogdon attempts a Dunk. Contested by Chris Anunoby (3.5 feet, MAN). Jimmy Brogdon misses. Rebound secured by Cade Randle.

[08:01] Team_033 possession (Score: 10-12)
Cade Randle attempts a 3Pt. Contested by Austin Russell (5.0 feet, ZONE). Cade Randle misses. Rebound secured by Jimmy Brogdon.

[07:45] Team_028 possession (Score: 10-12)
Kawhi Ball attempts a Layup. Contested by Bradley Simmons (3.2 feet, ZONE). Kawhi Ball misses. Rebound secured by Cade Randle.

[07:32] Team_033 possession (Score: 10-12)
Cade Randle attempts a 3Pt. Contested by Austin Russell (5.0 feet, ZONE). CADE RANDLE MAKES IT! Assist: Desmond DeRozan
Score: 13-12

[07:19] Team_028 possession (Score: 13-12)
Kawhi Ball throws a bad pass out of bounds! TURNOVER! (dead ball)

[07:02] Team_033 possession (Score: 13-12)
Desmond DeRozan drives, Kawhi Ball stays with him. Desmond DeRozan attempts a Dunk. Contested by Kawhi Ball (4.2 feet, ZONE). Desmond DeRozan misses. Offensive rebound by Desmond DeRozan! Desmond DeRozan kicks it out.

[06:49] Team_033 possession (Score: 13-12)
Chris Anunoby attempts a Layup. Contested by Carmelo Carter (4.4 feet, MAN). Chris Anunoby misses. Rebound secured by Kawhi Ball.

[06:31] Team_028 possession (Score: 13-12)
Myles Haliburton loses the ball! Stripped by Cade Randle! TURNOVER! (live ball)

[06:16] Team_033 possession (Score: 13-12)
Cade Randle attempts a Midrange. Contested by Myles Haliburton (4.1 feet, MAN). Cade Randle misses. Offensive rebound by Desmond DeRozan! Desmond DeRozan kicks it out.

[06:02] Team_033 possession (Score: 13-12)
Chris Anunoby drives, Kawhi Ball stays with him. Chris Anunoby attempts a Layup. Contested by Kawhi Ball (4.2 feet, ZONE). CHRIS ANUNOBY MAKES IT! Assist: Desmond DeRozan
Score: 15-12

[05:44] Team_028 possession (Score: 15-12)
Kawhi Ball makes the Layup and draws the foul on Desmond DeRozan! And-1! Kawhi Ball to the line for 1. [Team fouls: 1] (Desmond DeRozan: 1 personal fouls)   FT 1/1: GOOD Kawhi Ball makes 1/1 from the line.
Score: 15-15

[05:25] Team_033 possession (Score: 15-15)
Cade Randle drives and kicks out. Joel Green attempts a 3Pt. Contested by Austin Russell (4.4 feet, ZONE). Joel Green misses. FOUL! Loose ball foul on Jimmy Brogdon during the rebound battle. [Team fouls: 1] No free throws, side out. (Jimmy Brogdon: 1 personal fouls)

[05:15] Team_033 possession (Score: 15-15)
Desmond DeRozan drives to the basket... Desmond DeRozan throws a bad pass out of bounds! TURNOVER! (dead ball)

[05:02] Team_028 possession (Score: 15-15)
Myles Haliburton attempts a Midrange. Contested by Cade Randle (3.1 feet, MAN). Myles Haliburton misses. Rebound secured by Desmond DeRozan.

[04:48] Team_033 possession (Score: 15-15)
Bradley Simmons drives to the basket... Bradley Simmons loses control! Ball rolls out of bounds! TURNOVER! (dead ball)

[04:29] Team_028 possession (Score: 15-15)
Carmelo Carter attempts a Midrange. Contested by Chris Anunoby (4.2 feet, MAN). CARMELO CARTER MAKES IT!
Score: 15-17

[04:11] Team_033 possession (Score: 15-17)
Bradley Simmons drives to the basket... Bradley Simmons throws a bad pass! Stolen by Jimmy Brogdon! TURNOVER! (live ball)

[03:58] Team_028 possession (Score: 15-17)
Jimmy Brogdon makes the Dunk and draws the foul on Chris Anunoby! And-1! Jimmy Brogdon to the line for 1. [Team fouls: 2] (Chris Anunoby: 1 personal fouls)   FT 1/1: GOOD Jimmy Brogdon makes 1/1 from the line.
Score: 15-20

[03:48] Team_033 possession (Score: 15-20)
Joel Green commits a violation (traveling/carry)! TURNOVER! (dead ball)

[03:31] Team_028 possession (Score: 15-20)
Kawhi Ball attempts a 3Pt. Contested by Joel Green (4.6 feet, ZONE). Kawhi Ball misses. Rebound secured by Desmond DeRozan.

[03:17] Team_033 possession (Score: 15-20)
Bradley Simmons attempts a Midrange. Contested by Carmelo Carter (4.5 feet, ZONE). Bradley Simmons misses. Rebound secured by Jimmy Brogdon.

[03:04] Team_028 possession (Score: 15-20)
Carmelo Carter attempts a Layup. Contested by Bradley Simmons (3.6 feet, ZONE). CARMELO CARTER MAKES IT! Assist: Austin Russell
Score: 15-22

[02:46] Team_033 possession (Score: 15-22)
FOUL! Shooting foul on Kawhi Ball. Chris Anunoby to the line for 2 free throws. [Team fouls: 2] (Kawhi Ball: 1 personal fouls)   FT 1/2: GOOD   FT 2/2: GOOD Chris Anunoby makes 2/2 from the line.
Score: 17-22

[02:31] Team_028 possession (Score: 17-22)
Carmelo Carter commits a violation (traveling/carry)! TURNOVER! (dead ball)

[02:31] Substitution (Team_033): Chris Anunoby OUT → Manu Irving IN (stamina_rule2)

[02:31] Substitution (Team_033): Desmond DeRozan OUT → Zion Adebayo IN (stamina_rule2)

[02:31] Substitution (Team_033): Bradley Simmons OUT → Tim Griffin IN (stamina_rule2)

[02:31] Substitution (Team_028): Kawhi Ball OUT → Bam Towns IN (stamina_rule2)

[02:31] Substitution (Team_028): Jimmy Brogdon OUT → Collin Bridges IN (stamina_rule2)

[02:17] Team_033 possession (Score: 17-22)
FOUL! Reach-in foul on Collin Bridges during the drive. [Team fouls: 3] No free throws, side out. (Collin Bridges: 1 personal fouls)

[02:01] Team_033 possession (Score: 17-22)
Tim Griffin drives, Collin Bridges stays with him. Tim Griffin attempts a Layup. Contested by Collin Bridges (3.9 feet, ZONE). TIM GRIFFIN MAKES IT!
Score: 19-22

[01:44] Team_028 possession (Score: 19-22)
Carmelo Carter attempts a 3Pt. Contested by Manu Irving (5.0 feet, MAN). Carmelo Carter misses. Rebound secured by Zion Adebayo.

[01:27] Team_033 possession (Score: 19-22)
Zion Adebayo attempts a Midrange. Contested by Myles Haliburton (4.1 feet, ZONE). ZION ADEBAYO MAKES IT! Assist: Cade Randle
Score: 21-22

[01:11] Team_028 possession (Score: 21-22)
Austin Russell attempts a Midrange. Contested by Manu Irving (4.5 feet, ZONE). Austin Russell misses. Offensive rebound by Bam Towns! Bam Towns kicks it out.

[00:58] Team_028 possession (Score: 21-22)
Carmelo Carter attempts a 3Pt. Contested by Joel Green (4.9 feet, ZONE). Carmelo Carter misses. Rebound secured by Zion Adebayo.

[00:44] Team_033 possession (Score: 21-22)
Tim Griffin drives and kicks out. Manu Irving attempts a 3Pt. Contested by Carmelo Carter (4.9 feet, MAN). Manu Irving misses. Rebound secured by Bam Towns.

[00:31] Team_028 possession (Score: 21-22)
Carmelo Carter attempts a 3Pt. Contested by Joel Green (5.0 feet, ZONE). Carmelo Carter misses. Rebound secured by Zion Adebayo.

[00:21] Team_033 possession (Score: 21-22)
Tim Griffin attempts a Midrange. Contested by Collin Bridges (3.9 feet, MAN). Tim Griffin misses. Rebound secured by Bam Towns.

[00:11] Team_028 possession (Score: 21-22)
Myles Haliburton attempts a Layup. BLOCKED BY CADE RANDLE! Ball is loose! Offensive rebound by Collin Bridges! Collin Bridges kicks it out.

================================================================================
                              1ST QUARTER COMPLETE                              
================================================================================

1ST QUARTER SCORE: Team_033 21, Team_028 22

BOX SCORE:
================================================================================

Team_033
--------------------------------------------------------------------------------
Player                MIN  PTS  REB  AST  TO      FG   FG%      3P   3P%
--------------------------------------------------------------------------------
Cade Randle            12    6    2    3   0   2/3    66.7     0/0   0.0
Desmond DeRozan        10    5    6    2   0   2/3    66.7     0/0   0.0
Chris Anunoby          10    4    0    1   0   2/3    66.7     0/0   0.0
Joel Green             12    2    0    1   0   1/2    50.0     0/0   0.0
Tim Griffin             2    2    0    0   0   1/3    33.3     0/0   0.0
Zion Adebayo            2    2    3    0   0   1/1   100.0     0/0   0.0
Bradley Simmons        10    0    0    0   0   0/1     0.0     0/0   0.0

TEAM: FG: 9/16 (56.2%), 3PT: 3/5 (60.0%), REB: 12 (4 off, 8 def), AST: 7, TO: 6
TEAM FOULS: 2


Team_028
--------------------------------------------------------------------------------
Player                MIN  PTS  REB  AST  TO      FG   FG%      3P   3P%
--------------------------------------------------------------------------------
Carmelo Carter         12    6    0    3   0   3/6    50.0     0/0   0.0
Jimmy Brogdon          10    5    4    1   0   2/4    50.0     0/0   0.0
Myles Haliburton       12    5    0    0   0   2/3    66.7     0/0   0.0
Austin Russell         12    3    0    1   0   1/1   100.0     0/0   0.0
Kawhi Ball             10    3    1    0   0   1/3    33.3     0/0   0.0
Bam Towns               2    0    3    0   0   0/0     0.0     0/0   0.0
Collin Bridges          2    0    1    0   0   0/0     0.0     0/0   0.0

TEAM: FG: 9/17 (52.9%), 3PT: 2/6 (33.3%), REB: 8 (2 off, 6 def), AST: 5, TO: 4
TEAM FOULS: 3

================================================================================

================================================================================
                       2ND QUARTER - Team_033 vs Team_028                       
================================================================================

[12:00] Team_033 possession (Score: 21-22)
Bradley Simmons makes the Layup and draws the foul on Jimmy Brogdon! And-1! Bradley Simmons to the line for 1. [Team fouls: 1] (Jimmy Brogdon: 1 personal fouls)   FT 1/1: GOOD Bradley Simmons makes 1/1 from the line.
Score: 24-22

[11:46] Team_028 possession (Score: 24-22)
Carmelo Carter drives, Bradley Simmons stays with him. Carmelo Carter attempts a Layup. Contested by Bradley Simmons (3.3 feet, ZONE). Carmelo Carter misses. Offensive rebound by Kawhi Ball! Kawhi Ball kicks it out.

[11:31] Team_028 possession (Score: 24-22)
Carmelo Carter attempts a Layup. Contested by Bradley Simmons (3.3 feet, ZONE). CARMELO CARTER MAKES IT!
Score: 24-24

[11:17] Team_033 possession (Score: 24-24)
Desmond DeRozan drives, Kawhi Ball stays with him. Desmond DeRozan attempts a Layup. Contested by Kawhi Ball (4.3 feet, ZONE). Desmond DeRozan misses. Offensive rebound by Bradley Simmons! Bradley Simmons's putback is no good. Offensive rebound by Bradley Simmons! Bradley Simmons kicks it out.

[11:03] Team_033 possession (Score: 24-24)
Desmond DeRozan attempts a 3Pt. Contested by Kawhi Ball (4.3 feet, MAN). Desmond DeRozan misses. Rebound secured by Carmelo Carter.

[10:47] Team_028 possession (Score: 24-24)
Myles Haliburton attempts a 3Pt. Contested by Cade Randle (3.4 feet, ZONE). Myles Haliburton misses. Offensive rebound by Jimmy Brogdon! Jimmy Brogdon kicks it out.

[10:29] Team_028 possession (Score: 24-24)
FOUL! Shooting foul on Desmond DeRozan. Carmelo Carter to the line for 2 free throws. [Team fouls: 1] (Desmond DeRozan: 1 personal fouls)   FT 1/2: GOOD   FT 2/2: GOOD Carmelo Carter makes 2/2 from the line.
Score: 24-26

[10:15] Team_033 possession (Score: 24-26)
Desmond DeRozan attempts a 3Pt. Contested by Myles Haliburton (4.1 feet, ZONE). Desmond DeRozan misses. Rebound secured by Carmelo Carter.

[10:02] Team_028 possession (Score: 24-26)
FOUL! Shooting foul on Desmond DeRozan. Kawhi Ball to the line for 2 free throws. [Team fouls: 2] (Desmond DeRozan: 2 personal fouls)   FT 1/2: GOOD   FT 2/2: GOOD Kawhi Ball makes 2/2 from the line.
Score: 24-28

[09:50] Team_033 possession (Score: 24-28)
FOUL! Reach-in foul on Kawhi Ball during the drive. [Team fouls: 2] No free throws, side out. (Kawhi Ball: 1 personal fouls)

[09:38] Team_033 possession (Score: 24-28)
Bradley Simmons attempts a Midrange. Contested by Jimmy Brogdon (4.4 feet, MAN). BRADLEY SIMMONS MAKES IT! Assist: Cade Randle
Score: 26-28

[09:25] Team_028 possession (Score: 26-28)
Jimmy Brogdon attempts a Layup. BLOCKED BY BRADLEY SIMMONS! Ball is loose! Rebound secured by Desmond DeRozan.

[09:16] Team_033 possession (Score: 26-28)
Cade Randle attempts a 3Pt. Contested by Myles Haliburton (4.7 feet, MAN). CADE RANDLE MAKES IT! Assist: Bradley Simmons
Score: 29-28

[09:06] Team_028 possession (Score: 29-28)
Myles Haliburton attempts a Midrange. Contested by Cade Randle (3.7 feet, MAN). Myles Haliburton misses. FOUL! Loose ball foul on Chris Anunoby during the rebound battle. [Team fouls: 3] No free throws, side out. (Chris Anunoby: 1 personal fouls)

[08:50] Team_028 possession (Score: 29-28)
FOUL! Shooting foul on Bradley Simmons. Jimmy Brogdon to the line for 2 free throws. [Team fouls: 4] (Bradley Simmons: 1 personal fouls)   FT 1/2: MISS   FT 2/2: MISS Jimmy Brogdon makes 0/2 from the line. Rebound secured by Desmond DeRozan.

[08:41] Team_033 possession (Score: 29-28)
Joel Green attempts a 3Pt. Contested by Carmelo Carter (5.4 feet, ZONE). Joel Green misses. Rebound secured by Kawhi Ball.

[08:24] Team_028 possession (Score: 29-28)
Jimmy Brogdon attempts a Layup. Contested by Bradley Simmons (3.9 feet, ZONE). Jimmy Brogdon misses. Rebound secured by Desmond DeRozan.

[08:10] Team_033 possession (Score: 29-28)
Joel Green attempts a Layup. Contested by Kawhi Ball (4.9 feet, ZONE). Joel Green misses. FOUL! Loose ball foul on Kawhi Ball during the rebound battle. [Team fouls: 3] No free throws, side out. (Kawhi Ball: 2 personal fouls)

[07:58] Team_033 possession (Score: 29-28)
Desmond DeRozan attempts a 3Pt. Contested by Kawhi Ball (4.7 feet, MAN). Desmond DeRozan misses. Rebound secured by Jimmy Brogdon.

[07:45] Team_028 possession (Score: 29-28)
Myles Haliburton loses the ball! Stripped by Cade Randle! TURNOVER! (live ball)

[07:28] Team_033 possession (Score: 29-28)
Bradley Simmons attempts a Midrange. Contested by Carmelo Carter (5.2 feet, ZONE). Bradley Simmons misses. Rebound secured by Jimmy Brogdon.

[07:13] Team_028 possession (Score: 29-28)
Kawhi Ball attempts a Layup. Contested by Bradley Simmons (3.8 feet, ZONE). Kawhi Ball misses. Rebound secured by Bradley Simmons.

[06:57] Team_033 possession (Score: 29-28)
Joel Green attempts a Layup. Contested by Austin Russell (5.5 feet, MAN). JOEL GREEN MAKES IT! Assist: Bradley Simmons
Score: 31-28

[06:40] Team_028 possession (Score: 31-28)
Myles Haliburton makes the Layup and draws the foul on Cade Randle! And-1! Myles Haliburton to the line for 1. [BONUS: 5 team fouls] (Cade Randle: 1 personal fouls)   FT 1/1: GOOD Myles Haliburton makes 1/1 from the line.
Score: 31-31

[06:25] Team_033 possession (Score: 31-31)
Cade Randle attempts a Layup. Contested by Kawhi Ball (5.3 feet, ZONE). Cade Randle misses. Rebound secured by Jimmy Brogdon.

[06:08] Team_028 possession (Score: 31-31)
Jimmy Brogdon drives to the basket... Jimmy Brogdon throws a bad pass! Stolen by Bradley Simmons! TURNOVER! (live ball)

[05:56] Team_033 possession (Score: 31-31)
Bradley Simmons drives to the basket... FOUL! Offensive foul on Bradley Simmons! Jimmy Brogdon drew the charge! [Team fouls: 6] (Bradley Simmons: 2 personal fouls) TURNOVER! (dead ball)

[05:40] Team_028 possession (Score: 31-31)
Jimmy Brogdon attempts a Midrange. Contested by Bradley Simmons (4.3 feet, MAN). Jimmy Brogdon misses. Rebound secured by Desmond DeRozan.

[05:21] Team_033 possession (Score: 31-31)
Joel Green attempts a 3Pt. Contested by Austin Russell (5.7 feet, MAN). JOEL GREEN MAKES IT! Assist: Bradley Simmons
Score: 34-31

[05:05] Team_028 possession (Score: 34-31)
Kawhi Ball attempts a 3Pt. Contested by Desmond DeRozan (5.7 feet, MAN). KAWHI BALL MAKES IT! Assist: Jimmy Brogdon
Score: 34-34

[04:50] Team_033 possession (Score: 34-34)
Cade Randle attempts a Midrange. Contested by Myles Haliburton (5.2 feet, ZONE). Cade Randle misses. Rebound secured by Kawhi Ball.

[04:37] Team_028 possession (Score: 34-34)
FOUL! Reach-in foul on Desmond DeRozan during the drive. [IN THE BONUS! 7 team fouls] Kawhi Ball to the line for 2 free throws. (Desmond DeRozan: 3 personal fouls)   FT 1/2: GOOD   FT 2/2: GOOD Kawhi Ball makes 2/2 from the line.
Score: 34-36

[04:23] Team_033 possession (Score: 34-36)
Chris Anunoby attempts a 3Pt. Contested by Carmelo Carter (5.7 feet, MAN). CHRIS ANUNOBY MAKES IT! Assist: Joel Green
Score: 37-36

[04:08] Team_028 possession (Score: 37-36)
Carmelo Carter drives, Chris Anunoby stays with him. Carmelo Carter attempts a Dunk. Contested by Chris Anunoby (5.0 feet, MAN). CARMELO CARTER MAKES IT! Assist: Austin Russell
Score: 37-38

[03:56] Team_033 possession (Score: 37-38)
Chris Anunoby attempts a Layup. Contested by Carmelo Carter (5.7 feet, MAN). CHRIS ANUNOBY MAKES IT! Assist: Bradley Simmons
Score: 39-38

[03:47] Team_028 possession (Score: 39-38)
Jimmy Brogdon drives, Bradley Simmons stays with him. Jimmy Brogdon attempts a Layup. Contested by Bradley Simmons (4.6 feet, MAN). Jimmy Brogdon misses. Offensive rebound by Kawhi Ball! Kawhi Ball kicks it out.

[03:34] Team_028 possession (Score: 39-38)
Carmelo Carter drives, Chris Anunoby stays with him. Carmelo Carter attempts a Dunk. Contested by Chris Anunoby (5.1 feet, MAN). CARMELO CARTER MAKES IT!
Score: 39-40

[03:20] Team_033 possession (Score: 39-40)
Joel Green attempts a Midrange. Contested by Kawhi Ball (5.5 feet, ZONE). JOEL GREEN MAKES IT!
Score: 41-40

[03:07] Team_028 possession (Score: 41-40)
FOUL! Offensive foul on Jimmy Brogdon! Bradley Simmons drew the charge! [Team fouls: 4] (Jimmy Brogdon: 2 personal fouls) TURNOVER! (dead ball)

[02:57] Team_033 possession (Score: 41-40)
Chris Anunoby attempts a Layup. BLOCKED BY KAWHI BALL! Ball deflects out of bounds off Chris Anunoby.

[02:40] Team_028 possession (Score: 41-40)
Kawhi Ball attempts a 3Pt. Wide open! Desmond DeRozan is 6.0 feet away. [MAN] Kawhi Ball misses. Rebound secured by Bradley Simmons.

[02:26] Team_033 possession (Score: 41-40)
Chris Anunoby attempts a 3Pt. Contested by Austin Russell (5.9 feet, ZONE). Chris Anunoby misses. Rebound secured by Carmelo Carter.

[02:13] Team_028 possession (Score: 41-40)
Jimmy Brogdon attempts a Midrange. Contested by Cade Randle (5.1 feet, ZONE). JIMMY BROGDON MAKES IT! Assist: Kawhi Ball
Score: 41-42

[01:57] Team_033 possession (Score: 41-42)
Bradley Simmons attempts a Layup. Contested by Kawhi Ball (5.5 feet, ZONE). Bradley Simmons misses. Rebound secured by Carmelo Carter.

[01:47] Team_028 possession (Score: 41-42)
Carmelo Carter drives to the basket... Carmelo Carter throws a bad pass! Stolen by Chris Anunoby! TURNOVER! (live ball)

[01:33] Team_033 possession (Score: 41-42)
Joel Green drives, Jimmy Brogdon stays with him. Joel Green attempts a Dunk. Contested by Jimmy Brogdon (5.8 feet, ZONE). JOEL GREEN MAKES IT! Assist: Bradley Simmons
Score: 43-42

[01:20] Team_028 possession (Score: 43-42)
Austin Russell attempts a 3Pt. Contested by Joel Green (5.9 feet, MAN). AUSTIN RUSSELL MAKES IT! Assist: Myles Haliburton
Score: 43-45

[01:08] Team_033 possession (Score: 43-45)
Joel Green attempts a Midrange. Wide open! Austin Russell is 6.3 feet away. [MAN] JOEL GREEN MAKES IT!
Score: 45-45

[00:56] Team_028 possession (Score: 45-45)
Myles Haliburton attempts a 3Pt. Contested by Chris Anunoby (5.4 feet, ZONE). MYLES HALIBURTON MAKES IT! Assist: Austin Russell
Score: 45-48

[00:43] Team_033 possession (Score: 45-48)
Cade Randle drives and kicks out. Cade Randle attempts a Midrange. Wide open! Carmelo Carter is 6.5 feet away. [ZONE] CADE RANDLE MAKES IT!
Score: 47-48

[00:30] Team_028 possession (Score: 47-48)
Myles Haliburton makes the Layup and draws the foul on Desmond DeRozan! And-1! Myles Haliburton to the line for 1. [BONUS: 8 team fouls] (Desmond DeRozan: 4 personal fouls)   FT 1/1: GOOD Myles Haliburton makes 1/1 from the line.
Score: 47-51

[00:15] Team_033 possession (Score: 47-51)
Joel Green drives to the basket... FOUL! Offensive foul on Joel Green! Kawhi Ball drew the charge! [Team fouls: 9] (Joel Green: 1 personal fouls) TURNOVER! (dead ball)

[00:03] Team_028 possession (Score: 47-51)
Jimmy Brogdon attempts a Layup. Contested by Bradley Simmons (5.3 feet, MAN). JIMMY BROGDON MAKES IT!
Score: 47-53

================================================================================
                              2ND QUARTER COMPLETE                              
================================================================================

2ND QUARTER SCORE: Team_033 26, Team_028 31

BOX SCORE:
================================================================================

Team_033
--------------------------------------------------------------------------------
Player                MIN  PTS  REB  AST  TO      FG   FG%      3P   3P%
--------------------------------------------------------------------------------
Joel Green             24   11    0    1   0   5/6    83.3     0/0   0.0
Bradley Simmons        22    5    3    5   0   2/4    50.0     0/0   0.0
Cade Randle            24    5    0    1   0   2/4    50.0     0/0   0.0
Chris Anunoby          22    5    0    0   0   2/4    50.0     0/0   0.0
Desmond DeRozan        22    0    5    0   0   0/3     0.0     0/0   0.0

TEAM: FG: 11/21 (52.4%), 3PT: 3/8 (37.5%), REB: 8 (2 off, 6 def), AST: 7, TO: 2
TEAM FOULS: 9 [Team_028 in BONUS]


Team_028
--------------------------------------------------------------------------------
Player                MIN  PTS  REB  AST  TO      FG   FG%      3P   3P%
--------------------------------------------------------------------------------
Myles Haliburton       24    9    0    1   0   3/3   100.0     0/0   0.0
Carmelo Carter         24    8    4    0   0   4/4   100.0     0/0   0.0
Kawhi Ball             22    7    4    1   0   3/5    60.0     0/0   0.0
Jimmy Brogdon          22    4    5    1   0   2/6    33.3     0/0   0.0
Austin Russell         24    3    0    2   0   1/1   100.0     0/0   0.0

TEAM: FG: 13/19 (68.4%), 3PT: 3/4 (75.0%), REB: 13 (4 off, 9 def), AST: 5, TO: 4
TEAM FOULS: 4

================================================================================

================================================================================
                       3RD QUARTER - Team_033 vs Team_028                       
================================================================================

[12:00] Team_033 possession (Score: 47-53)
Chris Anunoby attempts a 3Pt. Contested by Carmelo Carter (4.4 feet, MAN). CHRIS ANUNOBY MAKES IT!
Score: 50-53

[11:45] Team_028 possession (Score: 50-53)
Jimmy Brogdon attempts a Midrange. Contested by Desmond DeRozan (5.3 feet, ZONE). Jimmy Brogdon misses. Rebound secured by Bradley Simmons.

[11:35] Team_033 possession (Score: 50-53)
FOUL! Holding foul on Kawhi Ball. [Team fouls: 1] No free throws, side out. (Kawhi Ball: 1 personal fouls)

[11:19] Team_033 possession (Score: 50-53)
Desmond DeRozan attempts a Layup. BLOCKED BY CARMELO CARTER! Ball deflects out of bounds off Desmond DeRozan.

[11:04] Team_028 possession (Score: 50-53)
Kawhi Ball makes the Layup and draws the foul on Desmond DeRozan! And-1! Kawhi Ball to the line for 1. [Team fouls: 1] (Desmond DeRozan: 1 personal fouls)   FT 1/1: GOOD Kawhi Ball makes 1/1 from the line.
Score: 50-56

[10:52] Team_033 possession (Score: 50-56)
Desmond DeRozan drives, Kawhi Ball stays with him. Desmond DeRozan attempts a Layup. Contested by Kawhi Ball (4.2 feet, MAN). DESMOND DEROZAN MAKES IT! Assist: Bradley Simmons
Score: 52-56

[10:38] Team_028 possession (Score: 52-56)
Jimmy Brogdon drives and kicks out. Carmelo Carter attempts a 3Pt. Contested by Joel Green (4.3 feet, ZONE). Carmelo Carter misses. Rebound secured by Cade Randle.

[10:23] Team_033 possession (Score: 52-56)
Bradley Simmons attempts a Midrange. Contested by Myles Haliburton (3.5 feet, ZONE). Bradley Simmons misses. Rebound secured by Jimmy Brogdon.

[10:06] Team_028 possession (Score: 52-56)
Myles Haliburton makes the 3Pt and draws the foul on Cade Randle! And-1! Myles Haliburton to the line for 1. [Team fouls: 2] (Cade Randle: 1 personal fouls)   FT 1/1: GOOD Myles Haliburton makes 1/1 from the line.
Score: 52-60

[09:53] Team_033 possession (Score: 52-60)
Bradley Simmons attempts a 3Pt. Contested by Austin Russell (4.4 feet, ZONE). Bradley Simmons misses. Rebound secured by Kawhi Ball.

[09:38] Team_028 possession (Score: 52-60)
FOUL! Holding foul on Bradley Simmons. [Team fouls: 3] No free throws, side out. (Bradley Simmons: 1 personal fouls)

[09:27] Team_028 possession (Score: 52-60)
FOUL! Shooting foul on Cade Randle. Myles Haliburton to the line for 2 free throws. [Team fouls: 4] (Cade Randle: 2 personal fouls)   FT 1/2: MISS   FT 2/2: GOOD Myles Haliburton makes 1/2 from the line.
Score: 52-61

[09:12] Team_033 possession (Score: 52-61)
Cade Randle attempts a Midrange. Contested by Carmelo Carter (5.0 feet, ZONE). Cade Randle misses. Rebound secured by Kawhi Ball.

[08:56] Team_028 possession (Score: 52-61)
Austin Russell attempts a 3Pt. Contested by Chris Anunoby (3.7 feet, ZONE). Austin Russell misses. Rebound secured by Desmond DeRozan.

[08:40] Team_033 possession (Score: 52-61)
FOUL! Offensive foul on Desmond DeRozan! Kawhi Ball drew the charge! [Team fouls: 5] (Desmond DeRozan: 2 personal fouls) TURNOVER! (dead ball)

[08:25] Team_028 possession (Score: 52-61)
Kawhi Ball makes the Dunk and draws the foul on Chris Anunoby! And-1! Kawhi Ball to the line for 1. [BONUS: 6 team fouls] (Chris Anunoby: 1 personal fouls)   FT 1/1: GOOD Kawhi Ball makes 1/1 from the line.
Score: 52-64

[08:10] Team_033 possession (Score: 52-64)
Cade Randle makes the Midrange and draws the foul on Myles Haliburton! And-1! Cade Randle to the line for 1. [Team fouls: 2] (Myles Haliburton: 1 personal fouls)   FT 1/1: GOOD Cade Randle makes 1/1 from the line.
Score: 55-64

[07:56] Team_028 possession (Score: 55-64)
Austin Russell attempts a 3Pt. Contested by Joel Green (4.2 feet, ZONE). AUSTIN RUSSELL MAKES IT! Assist: Myles Haliburton
Score: 55-67

[07:42] Team_033 possession (Score: 55-67)
Bradley Simmons attempts a Midrange. Contested by Kawhi Ball (4.1 feet, ZONE). Bradley Simmons misses. Offensive rebound by Desmond DeRozan! Desmond DeRozan kicks it out.

[07:26] Team_033 possession (Score: 55-67)
Desmond DeRozan attempts a Layup. Contested by Kawhi Ball (4.2 feet, MAN). DESMOND DEROZAN MAKES IT! Assist: Cade Randle
Score: 57-67

[07:12] Team_028 possession (Score: 57-67)
FOUL! Shooting foul on Chris Anunoby. Carmelo Carter to the line for 2 free throws. [BONUS: 7 team fouls] (Chris Anunoby: 2 personal fouls)   FT 1/2: GOOD   FT 2/2: GOOD Carmelo Carter makes 2/2 from the line.
Score: 57-69

[06:58] Team_033 possession (Score: 57-69)
Chris Anunoby attempts a 3Pt. Contested by Carmelo Carter (4.4 feet, MAN). Chris Anunoby misses. Rebound secured by Kawhi Ball.

[06:43] Team_028 possession (Score: 57-69)
FOUL! Shooting foul on Bradley Simmons. Jimmy Brogdon to the line for 2 free throws. [BONUS: 8 team fouls] (Bradley Simmons: 2 personal fouls)   FT 1/2: GOOD   FT 2/2: GOOD Jimmy Brogdon makes 2/2 from the line.
Score: 57-71

[06:30] Team_033 possession (Score: 57-71)
Chris Anunoby attempts a 3Pt. Contested by Austin Russell (4.4 feet, ZONE). CHRIS ANUNOBY MAKES IT! Assist: Bradley Simmons
Score: 60-71

[06:18] Team_028 possession (Score: 60-71)
Kawhi Ball drives to the basket... FOUL! Offensive foul on Kawhi Ball! Bradley Simmons drew the charge! [Team fouls: 3] (Kawhi Ball: 2 personal fouls) TURNOVER! (dead ball)

[06:04] Team_033 possession (Score: 60-71)
Bradley Simmons drives to the basket... Bradley Simmons throws a bad pass out of bounds! TURNOVER! (dead ball)

[05:45] Team_028 possession (Score: 60-71)
FOUL! Holding foul on Desmond DeRozan. [IN THE BONUS! 9 team fouls] Kawhi Ball to the line for 2 free throws. (Desmond DeRozan: 3 personal fouls)   FT 1/2: MISS   FT 2/2: GOOD Kawhi Ball makes 1/2 from the line.
Score: 60-72

[05:32] Team_033 possession (Score: 60-72)
FOUL! Shooting foul on Kawhi Ball. Desmond DeRozan to the line for 2 free throws. [Team fouls: 4] (Kawhi Ball: 3 personal fouls)   FT 1/2: GOOD   FT 2/2: MISS Desmond DeRozan makes 1/2 from the line. Rebound secured by Jimmy Brogdon.
Score: 61-72

[05:19] Team_028 possession (Score: 61-72)
Jimmy Brogdon attempts a 3Pt. Contested by Bradley Simmons (3.6 feet, MAN). Jimmy Brogdon misses. Offensive rebound by Jimmy Brogdon! Jimmy Brogdon kicks it out.

[05:06] Team_028 possession (Score: 61-72)
Kawhi Ball attempts a 3Pt. Contested by Joel Green (4.5 feet, ZONE). Kawhi Ball misses. Rebound secured by Cade Randle.

[04:49] Team_033 possession (Score: 61-72)
Cade Randle attempts a 3Pt. Contested by Austin Russell (5.0 feet, ZONE). Cade Randle misses. Offensive rebound by Bradley Simmons! Bradley Simmons puts it back in!
Score: 63-72

[04:38] Team_028 possession (Score: 63-72)
Carmelo Carter attempts a 3Pt. Contested by Cade Randle (3.4 feet, ZONE). CARMELO CARTER MAKES IT! Assist: Myles Haliburton
Score: 63-75

[04:27] Team_033 possession (Score: 63-75)
Chris Anunoby attempts a Layup. Contested by Kawhi Ball (4.3 feet, ZONE). CHRIS ANUNOBY MAKES IT!
Score: 65-75

[04:11] Team_028 possession (Score: 65-75)
Austin Russell drives to the basket... Austin Russell commits a violation (traveling/carry)! TURNOVER! (dead ball)

[03:56] Team_033 possession (Score: 65-75)
FOUL! Reach-in foul on Kawhi Ball during the drive. [IN THE BONUS! 5 team fouls] Chris Anunoby to the line for 2 free throws. (Kawhi Ball: 4 personal fouls)   FT 1/2: GOOD   FT 2/2: GOOD Chris Anunoby makes 2/2 from the line.
Score: 67-75

[03:38] Team_028 possession (Score: 67-75)
Carmelo Carter attempts a 3Pt. Contested by Chris Anunoby (4.3 feet, MAN). Carmelo Carter misses. Rebound secured by Cade Randle.

[03:22] Team_033 possession (Score: 67-75)
Bradley Simmons attempts a Midrange. Contested by Jimmy Brogdon (4.4 feet, MAN). Bradley Simmons misses. Rebound secured by Carmelo Carter.

[03:09] Team_028 possession (Score: 67-75)
Carmelo Carter attempts a 3Pt. Contested by Chris Anunoby (4.4 feet, MAN). Carmelo Carter misses. Rebound secured by Bradley Simmons.

[02:51] Team_033 possession (Score: 67-75)
Desmond DeRozan attempts a Layup. Contested by Kawhi Ball (4.5 feet, ZONE). Desmond DeRozan misses. Rebound secured by Jimmy Brogdon.

[02:37] Team_028 possession (Score: 67-75)
Austin Russell attempts a Midrange. Contested by Joel Green (4.4 feet, MAN). Austin Russell misses. Rebound secured by Bradley Simmons.

[02:21] Team_033 possession (Score: 67-75)
Desmond DeRozan drives to the basket... Desmond DeRozan loses control! Ball rolls out of bounds! TURNOVER! (dead ball)

[02:21] Substitution (Team_033): Joel Green OUT → Ben Anthony IN (stamina_rule2)

[02:21] Substitution (Team_033): Chris Anunoby OUT → Manu Irving IN (stamina_rule2)

[02:21] Substitution (Team_033): Desmond DeRozan OUT → Zion Adebayo IN (stamina_rule2)

[02:21] Substitution (Team_033): Bradley Simmons OUT → Tim Griffin IN (stamina_rule2)

[02:21] Substitution (Team_028): Carmelo Carter OUT → Tyrese Quickley IN (stamina_rule2)

[02:21] Substitution (Team_028): Kawhi Ball OUT → Bam Towns IN (stamina_rule2)

[02:21] Substitution (Team_028): Jimmy Brogdon OUT → Collin Bridges IN (stamina_rule2)

[02:09] Team_028 possession (Score: 67-75)
FOUL! Holding foul on Ben Anthony. [IN THE BONUS! 10 team fouls] Austin Russell to the line for 2 free throws. (Ben Anthony: 1 personal fouls)   FT 1/2: GOOD   FT 2/2: GOOD Austin Russell makes 2/2 from the line.
Score: 67-77

[01:57] Team_033 possession (Score: 67-77)
Tim Griffin drives, Collin Bridges stays with him. Tim Griffin attempts a Dunk. Contested by Collin Bridges (3.9 feet, ZONE). Tim Griffin misses. Offensive rebound by Cade Randle! Cade Randle puts it back in!
Score: 69-77

[01:43] Team_028 possession (Score: 69-77)
Tyrese Quickley drives to the basket... Tyrese Quickley loses the ball! Stripped by Tim Griffin! TURNOVER! (live ball)

[01:25] Team_033 possession (Score: 69-77)
Zion Adebayo attempts a Midrange. Contested by Collin Bridges (3.9 feet, MAN). Zion Adebayo misses. Rebound secured by Collin Bridges.

[01:14] Team_028 possession (Score: 69-77)
Bam Towns drives to the basket... Bam Towns throws a bad pass! Stolen by Tim Griffin! TURNOVER! (live ball)

[00:57] Team_033 possession (Score: 69-77)
Zion Adebayo drives, Collin Bridges stays with him. Zion Adebayo attempts a Layup. Contested by Collin Bridges (3.9 feet, ZONE). ZION ADEBAYO MAKES IT!
Score: 71-77

[00:38] Team_028 possession (Score: 71-77)
Bam Towns attempts a 3Pt. Contested by Zion Adebayo (4.5 feet, MAN). Bam Towns misses. Offensive rebound by Bam Towns! Bam Towns kicks it out.

[00:24] Team_028 possession (Score: 71-77)
Collin Bridges attempts a Midrange. Contested by Cade Randle (3.7 feet, ZONE). Collin Bridges misses. Rebound secured by Tim Griffin.

[00:14] Team_033 possession (Score: 71-77)
Tim Griffin attempts a Layup. Contested by Collin Bridges (3.9 feet, ZONE). Tim Griffin misses. Rebound secured by Collin Bridges.

[00:01] Team_028 possession (Score: 71-77)
FOUL! Holding foul on Tim Griffin. [IN THE BONUS! 11 team fouls] Collin Bridges to the line for 2 free throws. (Tim Griffin: 1 personal fouls)   FT 1/2: GOOD   FT 2/2: GOOD Collin Bridges makes 2/2 from the line.
Score: 71-79

================================================================================
                              3RD QUARTER COMPLETE                              
================================================================================

3RD QUARTER SCORE: Team_033 24, Team_028 26

BOX SCORE:
================================================================================

Team_033
--------------------------------------------------------------------------------
Player                MIN  PTS  REB  AST  TO      FG   FG%      3P   3P%
--------------------------------------------------------------------------------
Chris Anunoby          32   10    0    0   0   4/5    80.0     0/0   0.0
Cade Randle            36    5    4    1   0   2/3    66.7     0/0   0.0
Desmond DeRozan        32    4    2    0   0   2/5    40.0     0/0   0.0
Bradley Simmons        32    2    4    2   0   1/4    25.0     0/0   0.0
Zion Adebayo            5    2    0    0   0   1/2    50.0     0/0   0.0
Tim Griffin             5    0    1    0   0   0/1     0.0     0/0   0.0

TEAM: FG: 10/20 (50.0%), 3PT: 3/5 (60.0%), REB: 11 (3 off, 8 def), AST: 3, TO: 3
TEAM FOULS: 11 [Team_028 in BONUS]


Team_028
--------------------------------------------------------------------------------
Player                MIN  PTS  REB  AST  TO      FG   FG%      3P   3P%
--------------------------------------------------------------------------------
Kawhi Ball             32    7    3    0   0   3/4    75.0     0/0   0.0
Myles Haliburton       36    5    0    2   0   2/2   100.0     0/0   0.0
Austin Russell         36    5    0    0   0   2/4    50.0     0/0   0.0
Carmelo Carter         34    5    1    0   0   2/4    50.0     0/0   0.0
Jimmy Brogdon          32    2    4    0   0   1/3    33.3     0/0   0.0
Collin Bridges          5    2    2    0   0   1/2    50.0     0/0   0.0
Bam Towns               5    0    1    0   0   0/0     0.0     0/0   0.0

TEAM: FG: 11/19 (57.9%), 3PT: 3/7 (42.9%), REB: 11 (2 off, 9 def), AST: 2, TO: 4
TEAM FOULS: 5 [Team_033 in BONUS]

================================================================================

================================================================================
                       4TH QUARTER - Team_033 vs Team_028                       
================================================================================

[12:00] Team_033 possession (Score: 71-79)
FOUL! Shooting foul on Kawhi Ball. Cade Randle to the line for 2 free throws. [Team fouls: 1] (Kawhi Ball: 1 personal fouls)   FT 1/2: GOOD   FT 2/2: MISS Cade Randle makes 1/2 from the line. Rebound secured by Kawhi Ball.
Score: 72-79

[11:45] Team_028 possession (Score: 72-79)
Jimmy Brogdon loses the ball! Stripped by Bradley Simmons! TURNOVER! (live ball)

[11:30] Team_033 possession (Score: 72-79)
Bradley Simmons drives and kicks out. Cade Randle attempts a Midrange. Contested by Carmelo Carter (4.5 feet, ZONE). Cade Randle misses. Rebound secured by Jimmy Brogdon.

[11:15] Team_028 possession (Score: 72-79)
Kawhi Ball attempts a Layup. Contested by Bradley Simmons (3.3 feet, ZONE). Kawhi Ball misses. FOUL! Loose ball foul on Bradley Simmons during the rebound battle. [Team fouls: 1] No free throws, side out. (Bradley Simmons: 1 personal fouls)

[11:01] Team_028 possession (Score: 72-79)
Carmelo Carter attempts a Midrange. Contested by Joel Green (4.7 feet, ZONE). CARMELO CARTER MAKES IT!
Score: 72-81

[10:47] Team_033 possession (Score: 72-81)
Joel Green attempts a 3Pt. Contested by Austin Russell (5.2 feet, ZONE). Joel Green misses. Rebound secured by Carmelo Carter.

[10:34] Team_028 possession (Score: 72-81)
Jimmy Brogdon attempts a Midrange. Contested by Bradley Simmons (3.7 feet, MAN). Jimmy Brogdon misses. Offensive rebound by Kawhi Ball! Kawhi Ball kicks it out.

[10:19] Team_028 possession (Score: 72-81)
Jimmy Brogdon makes the Layup and draws the foul on Bradley Simmons! And-1! Jimmy Brogdon to the line for 1. [Team fouls: 2] (Bradley Simmons: 2 personal fouls)   FT 1/1: GOOD Jimmy Brogdon makes 1/1 from the line.
Score: 72-84

[10:04] Team_033 possession (Score: 72-84)
FOUL! Shooting foul on Myles Haliburton. Cade Randle to the line for 2 free throws. [Team fouls: 2] (Myles Haliburton: 1 personal fouls)   FT 1/2: GOOD   FT 2/2: GOOD Cade Randle makes 2/2 from the line.
Score: 74-84

[09:48] Team_028 possession (Score: 74-84)
FOUL! Reach-in foul on Bradley Simmons during the drive. [Team fouls: 3] No free throws, side out. (Bradley Simmons: 3 personal fouls)

[09:34] Team_028 possession (Score: 74-84)
Myles Haliburton attempts a Midrange. Contested by Desmond DeRozan (5.1 feet, ZONE). Myles Haliburton misses. Rebound secured by Chris Anunoby.

[09:20] Team_033 possession (Score: 74-84)
Cade Randle attempts a 3Pt. Contested by Austin Russell (5.5 feet, ZONE). Cade Randle misses. Rebound secured by Kawhi Ball.

[09:04] Team_028 possession (Score: 74-84)
Kawhi Ball attempts a 3Pt. Contested by Desmond DeRozan (5.3 feet, MAN). Kawhi Ball misses. Rebound secured by Bradley Simmons.

[08:46] Team_033 possession (Score: 74-84)
Desmond DeRozan attempts a 3Pt. Contested by Kawhi Ball (4.6 feet, MAN). Desmond DeRozan misses. Rebound secured by Carmelo Carter.

[08:36] Team_028 possession (Score: 74-84)
Austin Russell attempts a 3Pt. Contested by Joel Green (4.4 feet, ZONE). AUSTIN RUSSELL MAKES IT! Assist: Jimmy Brogdon
Score: 74-87

[08:21] Team_033 possession (Score: 74-87)
Desmond DeRozan attempts a Layup. Contested by Kawhi Ball (4.6 feet, MAN). Desmond DeRozan misses. Rebound secured by Carmelo Carter.

[08:04] Team_028 possession (Score: 74-87)
Myles Haliburton attempts a 3Pt. Contested by Joel Green (4.7 feet, ZONE). MYLES HALIBURTON MAKES IT! Assist: Kawhi Ball
Score: 74-90

[07:51] Team_033 possession (Score: 74-90)
Chris Anunoby attempts a Midrange. Contested by Carmelo Carter (4.8 feet, MAN). CHRIS ANUNOBY MAKES IT!
Score: 76-90

[07:36] Team_028 possession (Score: 76-90)
Jimmy Brogdon loses the ball! Stripped by Bradley Simmons! TURNOVER! (live ball)

[07:17] Team_033 possession (Score: 76-90)
Desmond DeRozan attempts a Midrange. Contested by Kawhi Ball (4.8 feet, ZONE). DESMOND DEROZAN MAKES IT!
Score: 78-90

[07:03] Team_028 possession (Score: 78-90)
Jimmy Brogdon drives, Bradley Simmons stays with him. Jimmy Brogdon attempts a Layup. Contested by Bradley Simmons (4.1 feet, ZONE). Jimmy Brogdon misses. Rebound secured by Desmond DeRozan.

[06:50] Team_033 possession (Score: 78-90)
Bradley Simmons drives, picks up Kawhi Ball. Help arrives from Carmelo Carter! Bradley Simmons attempts a Layup. Contested by Carmelo Carter (4.7 feet, ZONE). BRADLEY SIMMONS MAKES IT! Assist: Joel Green
Score: 80-90

[06:35] Team_028 possession (Score: 80-90)
Austin Russell attempts a 3Pt. Contested by Joel Green (4.6 feet, ZONE). Austin Russell misses. Rebound secured by Desmond DeRozan.

[06:19] Team_033 possession (Score: 80-90)
Bradley Simmons attempts a Midrange. Contested by Carmelo Carter (4.9 feet, ZONE). BRADLEY SIMMONS MAKES IT! Assist: Cade Randle
Score: 82-90

[06:01] Team_028 possession (Score: 82-90)
Myles Haliburton drives, Bradley Simmons stays with him. Myles Haliburton attempts a Layup. Contested by Bradley Simmons (3.8 feet, ZONE). MYLES HALIBURTON MAKES IT! Assist: Austin Russell
Score: 82-92

[05:49] Team_033 possession (Score: 82-92)
Chris Anunoby attempts a Layup. Contested by Carmelo Carter (5.0 feet, MAN). CHRIS ANUNOBY MAKES IT! Assist: Cade Randle
Score: 84-92

[05:36] Team_028 possession (Score: 84-92)
Jimmy Brogdon attempts a Layup. Contested by Bradley Simmons (4.3 feet, ZONE). JIMMY BROGDON MAKES IT! Assist: Myles Haliburton
Score: 84-94

[05:18] Team_033 possession (Score: 84-94)
Desmond DeRozan attempts a Layup. Contested by Kawhi Ball (5.0 feet, MAN). DESMOND DEROZAN MAKES IT! Assist: Cade Randle
Score: 86-94

[05:04] Team_028 possession (Score: 86-94)
Carmelo Carter attempts a Midrange. Contested by Chris Anunoby (5.0 feet, MAN). Carmelo Carter misses. Rebound secured by Bradley Simmons.

[04:49] Team_033 possession (Score: 86-94)
FOUL! Shooting foul on Kawhi Ball. Desmond DeRozan to the line for 2 free throws. [Team fouls: 3] (Kawhi Ball: 2 personal fouls)   FT 1/2: GOOD   FT 2/2: GOOD Desmond DeRozan makes 2/2 from the line.
Score: 88-94

[04:33] Team_028 possession (Score: 88-94)
Kawhi Ball attempts a Midrange. Contested by Desmond DeRozan (5.8 feet, MAN). Kawhi Ball misses. Offensive rebound by Kawhi Ball! Kawhi Ball kicks it out.

[04:17] Team_028 possession (Score: 88-94)
Kawhi Ball attempts a Midrange. Contested by Desmond DeRozan (5.8 feet, MAN). KAWHI BALL MAKES IT!
Score: 88-96

[04:04] Team_033 possession (Score: 88-96)
Bradley Simmons attempts a 3Pt. Contested by Jimmy Brogdon (5.1 feet, MAN). BRADLEY SIMMONS MAKES IT! Assist: Chris Anunoby
Score: 91-96

[03:54] Team_028 possession (Score: 91-96)
Austin Russell attempts a Midrange. Contested by Joel Green (4.9 feet, MAN). AUSTIN RUSSELL MAKES IT! Assist: Jimmy Brogdon
Score: 91-98

[03:42] Team_033 possession (Score: 91-98)
Chris Anunoby attempts a 3Pt. Contested by Carmelo Carter (5.2 feet, MAN). CHRIS ANUNOBY MAKES IT! Assist: Desmond DeRozan
Score: 94-98

[03:28] Team_028 possession (Score: 94-98)
Myles Haliburton attempts a 3Pt. Contested by Joel Green (5.2 feet, ZONE). Myles Haliburton misses. Rebound secured by Chris Anunoby.

[03:15] Team_033 possession (Score: 94-98)
Cade Randle attempts a 3Pt. Contested by Myles Haliburton (5.5 feet, MAN). CADE RANDLE MAKES IT! Assist: Chris Anunoby
Score: 97-98

[02:58] Team_028 possession (Score: 97-98)
Myles Haliburton attempts a Layup. Contested by Cade Randle (4.6 feet, MAN). Myles Haliburton misses. Offensive rebound by Jimmy Brogdon! Jimmy Brogdon kicks it out.

[02:48] Team_028 possession (Score: 97-98)
FOUL! Shooting foul on Cade Randle. Myles Haliburton to the line for 2 free throws. [Team fouls: 4] (Cade Randle: 1 personal fouls)   FT 1/2: GOOD   FT 2/2: MISS Myles Haliburton makes 1/2 from the line. Offensive rebound by Kawhi Ball! Kawhi Ball kicks it out.
Score: 97-99

[02:37] Team_028 possession (Score: 97-99)
Carmelo Carter attempts a 3Pt. Contested by Joel Green (5.6 feet, ZONE). Carmelo Carter misses. Offensive rebound by Jimmy Brogdon! Jimmy Brogdon kicks it out.

[02:21] Team_028 possession (Score: 97-99)
Carmelo Carter attempts a Midrange. Contested by Cade Randle (4.9 feet, ZONE). Carmelo Carter misses. Rebound secured by Chris Anunoby.

[02:09] Team_033 possession (Score: 97-99)
FOUL! Holding foul on Kawhi Ball. [Team fouls: 4] No free throws, side out. (Kawhi Ball: 3 personal fouls)

[01:54] Team_033 possession (Score: 97-99)
Desmond DeRozan attempts a Midrange. Contested by Kawhi Ball (5.6 feet, MAN). DESMOND DEROZAN MAKES IT! Assist: Cade Randle
Score: 99-99

[01:39] Team_028 possession (Score: 99-99)
FOUL! Holding foul on Chris Anunoby. [IN THE BONUS! 5 team fouls] Carmelo Carter to the line for 2 free throws. (Chris Anunoby: 1 personal fouls)   FT 1/2: GOOD   FT 2/2: GOOD Carmelo Carter makes 2/2 from the line.
Score: 99-101

[01:23] Team_033 possession (Score: 99-101)
Bradley Simmons attempts a Midrange. Wide open! Austin Russell is 6.0 feet away. [ZONE] Bradley Simmons misses. Rebound secured by Carmelo Carter.

[01:12] Team_028 possession (Score: 99-101)
Myles Haliburton attempts a 3Pt. Contested by Joel Green (5.5 feet, ZONE). Myles Haliburton misses. Offensive rebound by Jimmy Brogdon! Jimmy Brogdon kicks it out.

[01:00] Team_028 possession (Score: 99-101)
Austin Russell attempts a 3Pt. Contested by Chris Anunoby (5.2 feet, ZONE). Austin Russell misses. Rebound secured by Desmond DeRozan.

[00:47] Team_033 possession (Score: 99-101)
Chris Anunoby attempts a 3Pt. Wide open! Austin Russell is 6.2 feet away. [ZONE] CHRIS ANUNOBY MAKES IT! Assist: Desmond DeRozan
Score: 102-101

[00:36] Team_028 possession (Score: 102-101)
FOUL! Reach-in foul on Bradley Simmons during the drive. [IN THE BONUS! 6 team fouls] Kawhi Ball to the line for 2 free throws. (Bradley Simmons: 4 personal fouls)   FT 1/2: GOOD   FT 2/2: GOOD Kawhi Ball makes 2/2 from the line.
Score: 102-103

[00:22] Team_033 possession (Score: 102-103)
Cade Randle attempts a 3Pt. Wide open! Austin Russell is 6.6 feet away. [ZONE] Cade Randle misses. Rebound secured by Jimmy Brogdon.

[00:12] Team_028 possession (Score: 102-103)
Carmelo Carter attempts a Midrange. Contested by Chris Anunoby (5.8 feet, ZONE). Carmelo Carter misses. Offensive rebound by Carmelo Carter! Carmelo Carter kicks it out.

================================================================================
                              4TH QUARTER COMPLETE                              
================================================================================

4TH QUARTER SCORE: Team_033 31, Team_028 24

BOX SCORE:
================================================================================

Team_033
--------------------------------------------------------------------------------
Player                MIN  PTS  REB  AST  TO      FG   FG%      3P   3P%
--------------------------------------------------------------------------------
Chris Anunoby          44   10    3    2   0   4/4   100.0     0/0   0.0
Desmond DeRozan        44    8    3    2   0   4/6    66.7     0/0   0.0
Bradley Simmons        44    7    2    0   0   3/5    60.0     0/0   0.0
Cade Randle            48    5    0    4   0   2/5    40.0     0/0   0.0
Joel Green             46    0    0    1   0   0/1     0.0     0/0   0.0

TEAM: FG: 13/21 (61.9%), 3PT: 4/8 (50.0%), REB: 8 (0 off, 8 def), AST: 9, TO: 0
TEAM FOULS: 6 [Team_028 in BONUS]


Team_028
--------------------------------------------------------------------------------
Player                MIN  PTS  REB  AST  TO      FG   FG%      3P   3P%
--------------------------------------------------------------------------------
Jimmy Brogdon          44    5    5    2   0   2/3    66.7     0/0   0.0
Myles Haliburton       48    5    0    1   0   2/4    50.0     0/0   0.0
Austin Russell         48    5    0    1   0   2/4    50.0     0/0   0.0
Kawhi Ball             44    4    6    1   0   2/3    66.7     0/0   0.0
Carmelo Carter         46    4    5    0   0   2/4    50.0     0/0   0.0

TEAM: FG: 10/18 (55.6%), 3PT: 2/6 (33.3%), REB: 16 (8 off, 8 def), AST: 5, TO: 2
TEAM FOULS: 4

================================================================================

================================================================================
                               FULL GAME COMPLETE                               
================================================================================

FINAL SCORE: Team_033 102, Team_028 103

SCORING BY QUARTER:
--------------------------------------------------------------------------------
Team                     Q1     Q2     Q3     Q4    FINAL
--------------------------------------------------------------------------------
Team_033                 21     26     24     31      102
Team_028                 22     31     26     24      103
--------------------------------------------------------------------------------

FULL GAME BOX SCORE:
================================================================================

Team_033
--------------------------------------------------------------------------------
Player                MIN  PTS  REB  AST  TO      FG   FG%      3P   3P%      FT STL BLK
--------------------------------------------------------------------------------
Cade Randle            48   21    6    9   3   8/15   53.3   5/8    62.5   4/5     2   1
Joel Green             46   13    0    3   2   6/9    66.7   1/4    25.0   0/0     0   0
Chris Anunoby          44   29    3    3   0  12/16   75.0   5/7    71.4   4/4     1   0
Desmond DeRozan        44   17   16    4   4   8/17   47.1   1/5    20.0   3/4     0   0
Bradley Simmons        44   14    9    7   2   5/13   38.5   1/2    50.0   1/1     4   1
Manu Irving             5    0    0    0   0   0/0     0.0   0/0     0.0   0/0     0   0
Zion Adebayo            5    4    3    0   0   2/3    66.7   0/0     0.0   0/0     0   0
Tim Griffin             5    2    1    0   0   2/5    40.0   0/0     0.0   0/0     2   0
Ben Anthony             2    0    0    0   0   0/0     0.0   0/0     0.0   0/0     0   0
Terry Jokic             0    0    0    0   0   0/0     0.0   0/0     0.0   0/0     0   0

TEAM: FG: 43/78 (55.1%), 3PT: 13/26 (50.0%), REB: 39 (9 off, 30 def), AST: 26, TO: 11


Team_028
--------------------------------------------------------------------------------
Player                MIN  PTS  REB  AST  TO      FG   FG%      3P   3P%      FT STL BLK
--------------------------------------------------------------------------------
Austin Russell         48   16    0    4   0   5/9    55.6   4/7    57.1   2/2     0   0
Myles Haliburton       48   24    0    4   5   9/12   75.0   4/5    80.0   5/7     0   0
Carmelo Carter         46   23   10    3   2  10/17   58.8   1/6    16.7   6/6     0   1
Kawhi Ball             44   21   14    2   2   8/14   57.1   1/5    20.0  10/11    0   1
Jimmy Brogdon          44   16   18    4   3   7/16   43.8   0/0     0.0   4/6     2   0
Bam Towns               5    0    4    0   2   0/0     0.0   0/0     0.0   0/0     0   0
Collin Bridges          5    2    3    0   0   0/1     0.0   0/0     0.0   2/2     0   0
Tyrese Quickley         2    0    0    0   0   0/0     0.0   0/0     0.0   0/0     0   0
Scottie Ingram          0    0    0    0   0   0/0     0.0   0/0     0.0   0/0     0   0
Miles Booker            0    0    0    0   0   0/0     0.0   0/0     0.0   0/0     0   0

TEAM: FG: 43/73 (58.9%), 3PT: 10/23 (43.5%), REB: 48 (16 off, 32 def), AST: 17, TO: 14

================================================================================
