================================================================================
                        FULL GAME - Team_059 vs Team_074                        
================================================================================

================================================================================
                       1ST QUARTER - Team_059 vs Team_074                       
================================================================================

[12:00] Team_059 possession (Score: 0-0)
Bam Wade attempts a 3Pt. Contested by Dwyane Quickley (5.9 feet, MAN). BAM WADE MAKES IT! Assist: Blake Tatum
Score: 3-0

[11:47] Team_074 possession (Score: 3-0)
Dwyane Quickley throws a bad pass! Stolen by Bam Wade! TURNOVER! (live ball)

[11:30] Team_059 possession (Score: 3-0)
Jarrett Smith drives to the basket... Jarrett Smith loses the ball! Stripped by James Turner! TURNOVER! (live ball)

[11:16] Team_074 possession (Score: 3-0)
Dwyane Quickley attempts a 3Pt. Contested by Bam Wade (4.0 feet, MAN). Dwyane Quickley misses. Rebound secured by John Iverson.

[11:01] Team_059 possession (Score: 3-0)
John Iverson attempts a Midrange. Contested by Shai Green (3.6 feet, MAN). JOHN IVERSON MAKES IT!
Score: 5-0

[10:46] Team_074 possession (Score: 5-0)
Donovan Doncic drives, picks up Nikola Jokic. Help arrives from Bam Wade! Donovan Doncic attempts a Dunk. Contested by Bam Wade (5.7 feet, MAN). DONOVAN DONCIC MAKES IT!
Score: 5-2

[10:33] Team_059 possession (Score: 5-2)
Jarrett Smith drives, Donovan Doncic stays with him. Jarrett Smith attempts a Layup. Contested by Donovan Doncic (4.1 feet, ZONE). Jarrett Smith misses. Rebound secured by Donovan Doncic.

[10:17] Team_074 possession (Score: 5-2)
FOUL! Shooting foul on Blake Tatum. James Turner to the line for 2 free throws. [Team fouls: 1] (Blake Tatum: 1 personal fouls)   FT 1/2: GOOD   FT 2/2: GOOD James Turner makes 2/2 from the line.
Score: 5-4

[10:03] Team_059 possession (Score: 5-4)
Blake Tatum attempts a Midrange. Contested by Shai Green (3.4 feet, ZONE). BLAKE TATUM MAKES IT!
Score: 7-4

[09:50] Team_074 possession (Score: 7-4)
FOUL! Holding foul on Nikola Jokic. [Team fouls: 2] No free throws, side out. (Nikola Jokic: 1 personal fouls)

[09:35] Team_074 possession (Score: 7-4)
Dwyane Quickley attempts a 3Pt. Contested by Bam Wade (4.0 feet, MAN). Dwyane Quickley misses. Rebound secured by Jarrett Smith.

[09:18] Team_059 possession (Score: 7-4)
Blake Tatum attempts a Midrange. Contested by Chris Carter (4.2 feet, MAN). Blake Tatum misses. Rebound secured by Donovan Doncic.

[09:04] Team_074 possession (Score: 7-4)
Donovan Doncic drives and kicks out. Donovan Doncic attempts a 3Pt. Contested by Nikola Jokic (5.4 feet, MAN). DONOVAN DONCIC MAKES IT!
Score: 7-7

[08:55] Team_059 possession (Score: 7-7)
Nikola Jokic attempts a 3Pt. Contested by Shai Green (3.6 feet, ZONE). Nikola Jokic misses. Offensive rebound by John Iverson! John Iverson kicks it out.

[08:39] Team_059 possession (Score: 7-7)
FOUL! Offensive foul on Bam Wade! Dwyane Quickley drew the charge! [Team fouls: 3] (Bam Wade: 1 personal fouls) TURNOVER! (dead ball)

[08:21] Team_074 possession (Score: 7-7)
Shai Green attempts a 3Pt. Contested by Bam Wade (4.3 feet, ZONE). Shai Green misses. Rebound secured by John Iverson.

[08:04] Team_059 possession (Score: 7-7)
Bam Wade drives and kicks out. Bam Wade attempts a 3Pt. Contested by Dwyane Quickley (5.4 feet, ZONE). Bam Wade misses. Rebound secured by James Turner.

[07:50] Team_074 possession (Score: 7-7)
Donovan Doncic attempts a Midrange. Contested by Nikola Jokic (5.7 feet, MAN). Donovan Doncic misses. Rebound secured by Bam Wade.

[07:38] Team_059 possession (Score: 7-7)
Blake Tatum attempts a Midrange. Contested by Chris Carter (4.2 feet, MAN). Blake Tatum misses. Rebound secured by Donovan Doncic.

[07:22] Team_074 possession (Score: 7-7)
Shai Green drives, John Iverson stays with him. Shai Green attempts a Layup. Contested by John Iverson (5.8 feet, MAN). SHAI GREEN MAKES IT! Assist: James Turner
Score: 7-9

[07:05] Team_059 possession (Score: 7-9)
Jarrett Smith attempts a Layup. Contested by James Turner (3.8 feet, ZONE). JARRETT SMITH MAKES IT!
Score: 9-9

[06:46] Team_074 possession (Score: 9-9)
James Turner attempts a Midrange. Contested by Jarrett Smith (5.1 feet, MAN). James Turner misses. Rebound secured by Bam Wade.

[06:31] Team_059 possession (Score: 9-9)
Bam Wade attempts a 3Pt. Contested by Dwyane Quickley (5.9 feet, MAN). BAM WADE MAKES IT! Assist: Nikola Jokic
Score: 12-9

[06:16] Team_074 possession (Score: 12-9)
Shai Green attempts a 3Pt. Contested by John Iverson (5.8 feet, MAN). Shai Green misses. Rebound secured by Bam Wade.

[05:58] Team_059 possession (Score: 12-9)
John Iverson attempts a 3Pt. Contested by Dwyane Quickley (5.5 feet, ZONE). John Iverson misses. Rebound secured by Donovan Doncic.

[05:42] Team_074 possession (Score: 12-9)
James Turner attempts a 3Pt. Contested by Bam Wade (4.4 feet, ZONE). James Turner misses. Rebound secured by John Iverson.

[05:24] Team_059 possession (Score: 12-9)
Jarrett Smith drives, Donovan Doncic stays with him. Jarrett Smith attempts a Dunk. Contested by Donovan Doncic (4.1 feet, ZONE). JARRETT SMITH MAKES IT!
Score: 14-9

[05:09] Team_074 possession (Score: 14-9)
FOUL! Shooting foul on Jarrett Smith. James Turner to the line for 2 free throws. [Team fouls: 4] (Jarrett Smith: 1 personal fouls)   FT 1/2: GOOD   FT 2/2: GOOD James Turner makes 2/2 from the line.
Score: 14-11

[04:56] Team_059 possession (Score: 14-11)
John Iverson makes the Dunk and draws the foul on Donovan Doncic! And-1! John Iverson to the line for 1. [Team fouls: 1] (Donovan Doncic: 1 personal fouls)   FT 1/1: MISS John Iverson makes 0/1 from the line. Rebound secured by Shai Green.
Score: 16-11

[04:40] Team_074 possession (Score: 16-11)
James Turner drives to the basket... James Turner loses control! Ball rolls out of bounds! TURNOVER! (dead ball)

[04:27] Team_059 possession (Score: 16-11)
Bam Wade attempts a 3Pt. Contested by Dwyane Quickley (5.9 feet, ZONE). Bam Wade misses. Rebound secured by Donovan Doncic.

[04:12] Team_074 possession (Score: 16-11)
Chris Carter attempts a Layup. Contested by Jarrett Smith (5.2 feet, ZONE). Chris Carter misses. Rebound secured by John Iverson.

[03:57] Team_059 possession (Score: 16-11)
Bam Wade attempts a 3Pt. Contested by Dwyane Quickley (5.9 feet, MAN). Bam Wade misses. Rebound secured by Donovan Doncic.

[03:42] Team_074 possession (Score: 16-11)
James Turner makes the Layup and draws the foul on Jarrett Smith! And-1! James Turner to the line for 1. [BONUS: 5 team fouls] (Jarrett Smith: 2 personal fouls)   FT 1/1: GOOD James Turner makes 1/1 from the line.
Score: 16-14

[03:25] Team_059 possession (Score: 16-14)
Bam Wade attempts a 3Pt. Contested by Dwyane Quickley (6.0 feet, MAN). Bam Wade misses. Rebound secured by James Turner.

[03:10] Team_074 possession (Score: 16-14)
Chris Carter drives, picks up Jarrett Smith. Help arrives from Bam Wade! Chris Carter attempts a Dunk. Contested by Bam Wade (5.2 feet, ZONE). Chris Carter misses. Rebound secured by John Iverson.

[02:57] Team_059 possession (Score: 16-14)
FOUL! Reach-in foul on Donovan Doncic during the drive. [Team fouls: 2] No free throws, side out. (Donovan Doncic: 2 personal fouls)

[02:38] Team_059 possession (Score: 16-14)
John Iverson attempts a 3Pt. Contested by Shai Green (3.8 feet, MAN). John Iverson misses. Rebound secured by James Turner.

[02:25] Team_074 possession (Score: 16-14)
James Turner attempts a Midrange. Contested by Jarrett Smith (5.3 feet, MAN). JAMES TURNER MAKES IT!
Score: 16-16

[02:09] Team_059 possession (Score: 16-16)
Bam Wade attempts a Midrange. Wide open! Dwyane Quickley is 6.1 feet away. [MAN] BAM WADE MAKES IT! Assist: Blake Tatum
Score: 18-16

[01:56] Team_074 possession (Score: 18-16)
Donovan Doncic attempts a Layup. Contested by Jarrett Smith (5.0 feet, ZONE). Donovan Doncic misses. Offensive rebound by James Turner! James Turner's putback is no good. Rebound secured by Bam Wade.

[01:43] Team_059 possession (Score: 18-16)
John Iverson attempts a Layup. Contested by Shai Green (3.9 feet, MAN). JOHN IVERSON MAKES IT! Assist: Blake Tatum
Score: 20-16

[01:29] Team_074 possession (Score: 20-16)
FOUL! Shooting foul on Jarrett Smith. Chris Carter to the line for 2 free throws. [BONUS: 6 team fouls] (Jarrett Smith: 3 personal fouls)   FT 1/2: GOOD   FT 2/2: GOOD Chris Carter makes 2/2 from the line.
Score: 20-18

[01:13] Team_059 possession (Score: 20-18)
Nikola Jokic attempts a 3Pt. Contested by Dwyane Quickley (5.8 feet, ZONE). Nikola Jokic misses. Rebound secured by Donovan Doncic.

[00:58] Team_074 possession (Score: 20-18)
Shai Green attempts a 3Pt. Wide open! John Iverson is 6.2 feet away. [MAN] Shai Green misses. Offensive rebound by Donovan Doncic! Donovan Doncic kicks it out.

[00:40] Team_074 possession (Score: 20-18)
James Turner attempts a Layup. BLOCKED BY JARRETT SMITH! Ball deflects out of bounds off James Turner.

[00:24] Team_059 possession (Score: 20-18)
FOUL! Offensive foul on Nikola Jokic! Donovan Doncic drew the charge! [Team fouls: 7] (Nikola Jokic: 2 personal fouls) TURNOVER! (dead ball)

[00:08] Team_074 possession (Score: 20-18)
Dwyane Quickley attempts a 3Pt. Contested by Bam Wade (4.5 feet, MAN). Dwyane Quickley misses. Rebound secured by John Iverson.

================================================================================
                              1ST QUARTER COMPLETE                              
================================================================================

1ST QUARTER SCORE: Team_059 20, Team_074 18

BOX SCORE:
================================================================================

Team_059
--------------------------------------------------------------------------------
Player                MIN  PTS  REB  AST  TO      FG   FG%      3P   3P%
--------------------------------------------------------------------------------
John Iverson           12    4    7    0   0   2/5    40.0     0/0   0.0
Jarrett Smith          12    4    1    0   0   2/3    66.7     0/0   0.0
Blake Tatum            12    2    0    3   0   1/3    33.3     0/0   0.0
Nikola Jokic           12    0    0    1   0   0/1     0.0     0/0   0.0

TEAM: FG: 8/19 (42.1%), 3PT: 2/8 (25.0%), REB: 11 (1 off, 10 def), AST: 4, TO: 3
TEAM FOULS: 7 [Team_074 in BONUS]


Team_074
--------------------------------------------------------------------------------
Player                MIN  PTS  REB  AST  TO      FG   FG%      3P   3P%
--------------------------------------------------------------------------------
James Turner           12    9    3    1   0   4/7    57.1     0/0   0.0
Bam Wade               12    8    4    0   0   3/7    42.9     0/0   0.0
Donovan Doncic         12    5    8    0   0   2/4    50.0     0/0   0.0
Shai Green             12    2    1    0   0   1/3    33.3     0/0   0.0
Chris Carter           12    2    0    0   0   1/3    33.3     0/0   0.0
Dwyane Quickley        12    0    0    0   0   0/3     0.0     0/0   0.0

TEAM: FG: 8/20 (40.0%), 3PT: 0/6 (0.0%), REB: 13 (2 off, 11 def), AST: 1, TO: 2
TEAM FOULS: 2

================================================================================

================================================================================
                       2ND QUARTER - Team_059 vs Team_074                       
================================================================================

[12:00] Team_059 possession (Score: 20-18)
FOUL! Shooting foul on James Turner. Jarrett Smith to the line for 2 free throws. [Team fouls: 1] (James Turner: 1 personal fouls)   FT 1/2: GOOD   FT 2/2: GOOD Jarrett Smith makes 2/2 from the line.
Score: 22-18

[11:45] Team_074 possession (Score: 22-18)
Dwyane Quickley attempts a Midrange. Contested by John Iverson (5.9 feet, ZONE). DWYANE QUICKLEY MAKES IT! Assist: Chris Carter
Score: 22-20

[11:32] Team_059 possession (Score: 22-20)
Nikola Jokic attempts a 3Pt. Contested by Dwyane Quickley (5.8 feet, ZONE). Nikola Jokic misses. Rebound secured by Donovan Doncic.

[11:16] Team_074 possession (Score: 22-20)
Dwyane Quickley drives, Bam Wade stays with him. Dwyane Quickley attempts a Dunk. Contested by Bam Wade (4.3 feet, MAN). Dwyane Quickley misses. Offensive rebound by James Turner! James Turner puts it back in!
Score: 22-22

[11:01] Team_059 possession (Score: 22-22)
FOUL! Shooting foul on Donovan Doncic. Bam Wade to the line for 2 free throws. [Team fouls: 2] (Donovan Doncic: 1 personal fouls)   FT 1/2: MISS   FT 2/2: GOOD Bam Wade makes 1/2 from the line.
Score: 23-22

[10:45] Team_074 possession (Score: 23-22)
Shai Green attempts a 3Pt. Wide open! John Iverson is 6.2 feet away. [MAN] Shai Green misses. Rebound secured by Jarrett Smith.

[10:34] Team_059 possession (Score: 23-22)
Bam Wade attempts a 3Pt. Wide open! Dwyane Quickley is 6.2 feet away. [ZONE] BAM WADE MAKES IT! Assist: John Iverson
Score: 26-22

[10:16] Team_074 possession (Score: 26-22)
Shai Green drives to the basket... FOUL! Offensive foul on Shai Green! John Iverson drew the charge! [Team fouls: 3] (Shai Green: 1 personal fouls) TURNOVER! (dead ball)

[10:02] Team_059 possession (Score: 26-22)
Jarrett Smith attempts a Midrange. Contested by Donovan Doncic (4.4 feet, ZONE). JARRETT SMITH MAKES IT! Assist: Bam Wade
Score: 28-22

[09:50] Team_074 possession (Score: 28-22)
Chris Carter attempts a Layup. BLOCKED BY BLAKE TATUM! Ball is loose! Rebound secured by Jarrett Smith.

[09:36] Team_059 possession (Score: 28-22)
Jarrett Smith drives, James Turner stays with him. Jarrett Smith attempts a Dunk. Contested by James Turner (4.3 feet, MAN). JARRETT SMITH MAKES IT! Assist: Bam Wade
Score: 30-22

[09:22] Team_074 possession (Score: 30-22)
James Turner attempts a Midrange. Contested by Jarrett Smith (5.6 feet, MAN). James Turner misses. Rebound secured by Nikola Jokic.

[09:08] Team_059 possession (Score: 30-22)
FOUL! Reach-in foul on Donovan Doncic during the drive. [Team fouls: 4] No free throws, side out. (Donovan Doncic: 2 personal fouls)

[08:55] Team_059 possession (Score: 30-22)
Bam Wade drives to the basket... Bam Wade loses control! Ball rolls out of bounds! TURNOVER! (dead ball)

[08:55] Substitution (Team_059): Bam Wade OUT → Russell Quickley IN (stamina_rule2)

[08:55] Substitution (Team_059): Blake Tatum OUT → Scottie Ginobili IN (stamina_rule2)

[08:55] Substitution (Team_059): John Iverson OUT → Allen Giddey IN (stamina_rule2)

[08:55] Substitution (Team_059): Nikola Jokic OUT → Bones Middleton IN (stamina_rule2)

[08:55] Substitution (Team_059): Jarrett Smith OUT → LeBron Lowry IN (stamina_rule2)

[08:55] Substitution (Team_074): Dwyane Quickley OUT → James Barnes IN (stamina_rule2)

[08:55] Substitution (Team_074): Chris Carter OUT → Giannis Westbrook IN (stamina_rule2)

[08:55] Substitution (Team_074): Shai Green OUT → Ayo Smith IN (stamina_rule2)

[08:55] Substitution (Team_074): Donovan Doncic OUT → Yao Randle IN (stamina_rule2)

[08:55] Substitution (Team_074): James Turner OUT → Jaren Rozier IN (stamina_rule2)

[08:41] Team_074 possession (Score: 30-22)
Yao Randle loses control! Ball rolls out of bounds! TURNOVER! (dead ball)

[08:32] Team_059 possession (Score: 30-22)
Scottie Ginobili makes the Layup and draws the foul on Giannis Westbrook! And-1! Scottie Ginobili to the line for 1. [BONUS: 5 team fouls] (Giannis Westbrook: 1 personal fouls)   FT 1/1: GOOD Scottie Ginobili makes 1/1 from the line.
Score: 33-22

[08:17] Team_074 possession (Score: 33-22)
James Barnes attempts a 3Pt. Contested by Russell Quickley (4.3 feet, ZONE). James Barnes misses. FOUL! Loose ball foul on LeBron Lowry during the rebound battle. [Team fouls: 1] No free throws, side out. (LeBron Lowry: 1 personal fouls)

[08:07] Team_074 possession (Score: 33-22)
Jaren Rozier drives to the basket... Jaren Rozier commits a violation (traveling/carry)! TURNOVER! (dead ball)

[07:50] Team_059 possession (Score: 33-22)
LeBron Lowry attempts a Midrange. Contested by Jaren Rozier (4.5 feet, MAN). LeBron Lowry misses. Rebound secured by Yao Randle.

[07:35] Team_074 possession (Score: 33-22)
Giannis Westbrook attempts a 3Pt. Contested by Scottie Ginobili (4.6 feet, MAN). Giannis Westbrook misses. Rebound secured by Bones Middleton.

[07:24] Team_059 possession (Score: 33-22)
Russell Quickley drives, Yao Randle stays with him. Russell Quickley attempts a Dunk. Contested by Yao Randle (4.8 feet, ZONE). RUSSELL QUICKLEY MAKES IT! Assist: Scottie Ginobili
Score: 35-22

[07:14] Team_074 possession (Score: 35-22)
Giannis Westbrook drives, Bones Middleton stays with him. Giannis Westbrook attempts a Dunk. Contested by Bones Middleton (4.7 feet, ZONE). GIANNIS WESTBROOK MAKES IT! Assist: Ayo Smith
Score: 35-24

[07:02] Team_059 possession (Score: 35-24)
Allen Giddey drives to the basket... Allen Giddey loses control! Ball rolls out of bounds! TURNOVER! (dead ball)

[06:45] Team_074 possession (Score: 35-24)
Jaren Rozier drives to the basket... Jaren Rozier throws a bad pass out of bounds! TURNOVER! (dead ball)

[06:31] Team_059 possession (Score: 35-24)
Russell Quickley attempts a 3Pt. Contested by James Barnes (4.6 feet, ZONE). Russell Quickley misses. Rebound secured by Jaren Rozier.

[06:21] Team_074 possession (Score: 35-24)
Jaren Rozier attempts a Layup. Contested by Bones Middleton (4.4 feet, ZONE). JAREN ROZIER MAKES IT!
Score: 35-26

[06:02] Team_059 possession (Score: 35-26)
LeBron Lowry drives, picks up Jaren Rozier. Help arrives from Giannis Westbrook! LeBron Lowry attempts a Dunk. Contested by Giannis Westbrook (4.5 feet, MAN). LEBRON LOWRY MAKES IT! Assist: Bones Middleton
Score: 37-26

[05:43] Team_074 possession (Score: 37-26)
Jaren Rozier attempts a Layup. Contested by LeBron Lowry (4.5 feet, ZONE). JAREN ROZIER MAKES IT!
Score: 37-28

[05:27] Team_059 possession (Score: 37-28)
Scottie Ginobili attempts a 3Pt. Contested by Giannis Westbrook (5.0 feet, MAN). SCOTTIE GINOBILI MAKES IT! Assist: Russell Quickley
Score: 40-28

[05:17] Team_074 possession (Score: 40-28)
FOUL! Holding foul on Scottie Ginobili. [Team fouls: 2] No free throws, side out. (Scottie Ginobili: 1 personal fouls)

[05:01] Team_074 possession (Score: 40-28)
Ayo Smith attempts a Midrange. Contested by LeBron Lowry (4.8 feet, ZONE). AYO SMITH MAKES IT!
Score: 40-30

[04:47] Team_059 possession (Score: 40-30)
Allen Giddey attempts a Midrange. Contested by Ayo Smith (4.6 feet, MAN). Allen Giddey misses. Rebound secured by Yao Randle.

[04:38] Team_074 possession (Score: 40-30)
Giannis Westbrook attempts a 3Pt. Contested by Scottie Ginobili (4.6 feet, MAN). GIANNIS WESTBROOK MAKES IT! Assist: Ayo Smith
Score: 40-33

[04:23] Team_059 possession (Score: 40-33)
Allen Giddey attempts a Midrange. Contested by Ayo Smith (4.6 feet, MAN). Allen Giddey misses. Rebound secured by Jaren Rozier.

[04:10] Team_074 possession (Score: 40-33)
Yao Randle attempts a Midrange. Contested by Scottie Ginobili (4.6 feet, ZONE). YAO RANDLE MAKES IT! Assist: Jaren Rozier
Score: 40-35

[03:53] Team_059 possession (Score: 40-35)
Bones Middleton attempts a Midrange. Contested by Yao Randle (4.8 feet, MAN). BONES MIDDLETON MAKES IT!
Score: 42-35

[03:36] Team_074 possession (Score: 42-35)
Giannis Westbrook drives, picks up Bones Middleton. Help arrives from Scottie Ginobili! Giannis Westbrook attempts a Dunk. Contested by Scottie Ginobili (4.7 feet, ZONE). GIANNIS WESTBROOK MAKES IT! Assist: Ayo Smith
Score: 42-37

[03:18] Team_059 possession (Score: 42-37)
Allen Giddey drives to the basket... Allen Giddey throws a bad pass! Stolen by Yao Randle! TURNOVER! (live ball)

[03:04] Team_074 possession (Score: 42-37)
Yao Randle attempts a Midrange. Wide open! Allen Giddey is 6.8 feet away. [ZONE] YAO RANDLE MAKES IT!
Score: 42-39

[02:45] Team_059 possession (Score: 42-39)
Allen Giddey attempts a 3Pt. Contested by James Barnes (4.1 feet, ZONE). Allen Giddey misses. Offensive rebound by Bones Middleton! Bones Middleton kicks it out.

[02:33] Team_059 possession (Score: 42-39)
Bones Middleton attempts a Midrange. Contested by Yao Randle (4.8 feet, MAN). Bones Middleton misses. FOUL! Loose ball foul on Jaren Rozier during the rebound battle. [IN THE BONUS! 6 team fouls] Bones Middleton to the line for 2 free throws. (Jaren Rozier: 1 personal fouls)   FT 1/2: GOOD   FT 2/2: GOOD Bones Middleton makes 2/2 from the line.
Score: 44-39

[02:17] Team_074 possession (Score: 44-39)
Ayo Smith drives, picks up Allen Giddey. Help arrives from Scottie Ginobili! Ayo Smith attempts a Layup. Wide open! Scottie Ginobili is 6.8 feet away. [MAN] AYO SMITH MAKES IT!
Score: 44-41

[02:03] Team_059 possession (Score: 44-41)
LeBron Lowry drives to the basket... LeBron Lowry loses control! Ball rolls out of bounds! TURNOVER! (dead ball)

[01:50] Team_074 possession (Score: 44-41)
Yao Randle drives and kicks out. James Barnes attempts a 3Pt. Contested by Russell Quickley (4.5 feet, MAN). James Barnes misses. Rebound secured by Bones Middleton.

[01:34] Team_059 possession (Score: 44-41)
LeBron Lowry drives, Yao Randle stays with him. LeBron Lowry attempts a Dunk. Contested by Yao Randle (4.7 feet, ZONE). LeBron Lowry misses. Rebound secured by Yao Randle.

[01:23] Team_074 possession (Score: 44-41)
Jaren Rozier attempts a Midrange. Contested by LeBron Lowry (4.6 feet, MAN). JAREN ROZIER MAKES IT! Assist: Ayo Smith
Score: 44-43

[01:07] Team_059 possession (Score: 44-43)
FOUL! Offensive foul on LeBron Lowry! Jaren Rozier drew the charge! [Team fouls: 3] (LeBron Lowry: 2 personal fouls) TURNOVER! (dead ball)

[00:55] Team_074 possession (Score: 44-43)
Giannis Westbrook drives to the basket... Giannis Westbrook throws a bad pass! Stolen by Bones Middleton! TURNOVER! (live ball)

[00:40] Team_059 possession (Score: 44-43)
Scottie Ginobili attempts a 3Pt. Contested by James Barnes (4.9 feet, ZONE). Scottie Ginobili misses. Offensive rebound by Scottie Ginobili! Scottie Ginobili kicks it out.

[00:29] Team_059 possession (Score: 44-43)
LeBron Lowry drives, picks up Jaren Rozier. Help arrives from Giannis Westbrook! LeBron Lowry attempts a Dunk. Contested by Giannis Westbrook (4.7 feet, MAN). LEBRON LOWRY MAKES IT! Assist: Bones Middleton
Score: 46-43

[00:15] Team_074 possession (Score: 46-43)
Jaren Rozier makes the Midrange and draws the foul on Bones Middleton! And-1! Jaren Rozier to the line for 1. [Team fouls: 4] (Bones Middleton: 1 personal fouls)   FT 1/1: GOOD Jaren Rozier makes 1/1 from the line.
Score: 46-46

================================================================================
                              2ND QUARTER COMPLETE                              
================================================================================

2ND QUARTER SCORE: Team_059 26, Team_074 28

BOX SCORE:
================================================================================

Team_059
--------------------------------------------------------------------------------
Player                MIN  PTS  REB  AST  TO      FG   FG%      3P   3P%
--------------------------------------------------------------------------------
Jarrett Smith          15    6    2    0   0   3/3   100.0     0/0   0.0
Scottie Ginobili        9    6    1    1   0   2/2   100.0     0/0   0.0
Bam Wade               15    4    0    2   0   2/2   100.0     0/0   0.0
LeBron Lowry            9    4    0    0   0   2/4    50.0     0/0   0.0
Bones Middleton         9    4    3    2   0   2/2   100.0     0/0   0.0
Russell Quickley        9    2    0    1   0   1/2    50.0     0/0   0.0
Nikola Jokic           15    0    1    0   0   0/1     0.0     0/0   0.0
John Iverson           15    0    0    1   0   0/0     0.0     0/0   0.0
Allen Giddey            9    0    0    0   0   0/2     0.0     0/0   0.0

TEAM: FG: 12/18 (66.7%), 3PT: 2/4 (50.0%), REB: 7 (2 off, 5 def), AST: 7, TO: 5
TEAM FOULS: 4


Team_074
--------------------------------------------------------------------------------
Player                MIN  PTS  REB  AST  TO      FG   FG%      3P   3P%
--------------------------------------------------------------------------------
Jaren Rozier            9    9    3    1   0   4/4   100.0     0/0   0.0
Giannis Westbrook       9    7    0    0   0   3/4    75.0     0/0   0.0
Yao Randle              9    4    3    0   0   2/3    66.7     0/0   0.0
Ayo Smith               9    4    0    4   0   2/2   100.0     0/0   0.0
Dwyane Quickley        15    2    0    0   0   1/1   100.0     0/0   0.0
James Turner           15    2    1    0   0   1/2    50.0     0/0   0.0
Chris Carter           15    0    0    1   0   0/1     0.0     0/0   0.0
Donovan Doncic         15    0    1    0   0   0/0     0.0     0/0   0.0
Shai Green             15    0    0    0   0   0/1     0.0     0/0   0.0

TEAM: FG: 13/18 (72.2%), 3PT: 1/3 (33.3%), REB: 8 (2 off, 6 def), AST: 6, TO: 5
TEAM FOULS: 6 [Team_059 in BONUS]

================================================================================

================================================================================
                       3RD QUARTER - Team_059 vs Team_074                       
================================================================================

[12:00] Team_059 possession (Score: 46-46)
Nikola Jokic attempts a 3Pt. Contested by Donovan Doncic (3.8 feet, MAN). Nikola Jokic misses. FOUL! Loose ball foul on Donovan Doncic during the rebound battle. [Team fouls: 1] No free throws, side out. (Donovan Doncic: 1 personal fouls)

[11:49] Team_059 possession (Score: 46-46)
FOUL! Shooting foul on Shai Green. John Iverson to the line for 2 free throws. [Team fouls: 2] (Shai Green: 1 personal fouls)   FT 1/2: GOOD   FT 2/2: MISS John Iverson makes 1/2 from the line. Rebound secured by Donovan Doncic.
Score: 47-46

[11:33] Team_074 possession (Score: 47-46)
Shai Green attempts a 3Pt. Contested by John Iverson (5.8 feet, MAN). Shai Green misses. Rebound secured by John Iverson.

[11:16] Team_059 possession (Score: 47-46)
FOUL! Reach-in foul on Shai Green during the drive. [Team fouls: 3] No free throws, side out. (Shai Green: 2 personal fouls)

[11:06] Team_059 possession (Score: 47-46)
Jarrett Smith attempts a Layup. Contested by James Turner (3.8 feet, MAN). JARRETT SMITH MAKES IT! Assist: Blake Tatum
Score: 49-46

[10:49] Team_074 possession (Score: 49-46)
Donovan Doncic attempts a Midrange. Contested by Nikola Jokic (5.7 feet, ZONE). Donovan Doncic misses. Rebound secured by John Iverson.

[10:33] Team_059 possession (Score: 49-46)
FOUL! Shooting foul on Chris Carter. Blake Tatum to the line for 2 free throws. [Team fouls: 4] (Chris Carter: 1 personal fouls)   FT 1/2: GOOD   FT 2/2: GOOD Blake Tatum makes 2/2 from the line.
Score: 51-46

[10:19] Team_074 possession (Score: 51-46)
Shai Green drives to the basket... Shai Green loses control! Ball rolls out of bounds! TURNOVER! (dead ball)

[10:04] Team_059 possession (Score: 51-46)
Jarrett Smith drives and kicks out. Jarrett Smith attempts a 3Pt. Contested by James Turner (3.4 feet, MAN). Jarrett Smith misses. Rebound secured by Donovan Doncic.

[09:50] Team_074 possession (Score: 51-46)
Chris Carter attempts a 3Pt. Contested by Bam Wade (4.4 feet, ZONE). Chris Carter misses. Offensive rebound by Donovan Doncic! Donovan Doncic kicks it out.

[09:39] Team_074 possession (Score: 51-46)
Donovan Doncic attempts a Layup. Contested by Nikola Jokic (5.7 feet, MAN). Donovan Doncic misses. Rebound secured by Bam Wade.

[09:24] Team_059 possession (Score: 51-46)
Bam Wade drives, picks up Dwyane Quickley. Help arrives from Shai Green! Bam Wade attempts a Layup. Contested by Shai Green (5.9 feet, MAN). BAM WADE MAKES IT!
Score: 53-46

[09:10] Team_074 possession (Score: 53-46)
James Turner makes the Layup and draws the foul on Jarrett Smith! And-1! James Turner to the line for 1. [Team fouls: 1] (Jarrett Smith: 1 personal fouls)   FT 1/1: MISS James Turner makes 0/1 from the line. Rebound secured by John Iverson.
Score: 53-48

[08:55] Team_059 possession (Score: 53-48)
Bam Wade makes the Layup and draws the foul on Dwyane Quickley! And-1! Bam Wade to the line for 1. [BONUS: 5 team fouls] (Dwyane Quickley: 1 personal fouls)   FT 1/1: MISS Bam Wade makes 0/1 from the line. Rebound secured by James Turner.
Score: 55-48

[08:41] Team_074 possession (Score: 55-48)
Dwyane Quickley attempts a Midrange. Contested by Blake Tatum (4.5 feet, ZONE). DWYANE QUICKLEY MAKES IT!
Score: 55-50

[08:26] Team_059 possession (Score: 55-50)
John Iverson attempts a Midrange. Contested by Shai Green (3.6 feet, MAN). JOHN IVERSON MAKES IT! Assist: Blake Tatum
Score: 57-50

[08:14] Team_074 possession (Score: 57-50)
Dwyane Quickley attempts a 3Pt. Contested by Bam Wade (4.0 feet, MAN). Dwyane Quickley misses. Offensive rebound by Donovan Doncic! Donovan Doncic kicks it out.

[07:59] Team_074 possession (Score: 57-50)
Chris Carter attempts a Midrange. Contested by Jarrett Smith (5.1 feet, ZONE). CHRIS CARTER MAKES IT! Assist: Dwyane Quickley
Score: 57-52

[07:48] Team_059 possession (Score: 57-52)
Nikola Jokic attempts a Layup. Contested by Donovan Doncic (3.8 feet, MAN). Nikola Jokic misses. FOUL! Loose ball foul on Shai Green during the rebound battle. [IN THE BONUS! 6 team fouls] Jarrett Smith to the line for 2 free throws. (Shai Green: 3 personal fouls)   FT 1/2: GOOD   FT 2/2: GOOD Jarrett Smith makes 2/2 from the line.
Score: 59-52

[07:34] Team_074 possession (Score: 59-52)
Donovan Doncic attempts a 3Pt. Contested by Nikola Jokic (5.7 feet, MAN). DONOVAN DONCIC MAKES IT!
Score: 59-55

[07:18] Team_059 possession (Score: 59-55)
Jarrett Smith makes the Layup and draws the foul on James Turner! And-1! Jarrett Smith to the line for 1. [BONUS: 7 team fouls] (James Turner: 1 personal fouls)   FT 1/1: GOOD Jarrett Smith makes 1/1 from the line.
Score: 62-55

[07:07] Team_074 possession (Score: 62-55)
James Turner makes the Layup and draws the foul on Jarrett Smith! And-1! James Turner to the line for 1. [Team fouls: 2] (Jarrett Smith: 2 personal fouls)   FT 1/1: GOOD James Turner makes 1/1 from the line.
Score: 62-58

[06:57] Team_059 possession (Score: 62-58)
Nikola Jokic drives, Donovan Doncic stays with him. Nikola Jokic attempts a Layup. Contested by Donovan Doncic (3.8 feet, ZONE). Nikola Jokic misses. Rebound secured by Donovan Doncic.

[06:43] Team_074 possession (Score: 62-58)
Shai Green attempts a Midrange. Contested by John Iverson (5.8 feet, ZONE). Shai Green misses. Rebound secured by Bam Wade.

[06:31] Team_059 possession (Score: 62-58)
Nikola Jokic attempts a Midrange. Contested by Chris Carter (4.4 feet, ZONE). NIKOLA JOKIC MAKES IT! Assist: Blake Tatum
Score: 64-58

[06:16] Team_074 possession (Score: 64-58)
James Turner drives and kicks out. Dwyane Quickley attempts a Midrange. Contested by John Iverson (5.3 feet, ZONE). DWYANE QUICKLEY MAKES IT!
Score: 64-60

[06:01] Team_059 possession (Score: 64-60)
Blake Tatum drives, picks up Donovan Doncic. Help arrives from Chris Carter! Blake Tatum attempts a Layup. Contested by Chris Carter (3.6 feet, ZONE). BLAKE TATUM MAKES IT! Assist: John Iverson
Score: 66-60

[05:47] Team_074 possession (Score: 66-60)
FOUL! Shooting foul on Jarrett Smith. James Turner to the line for 2 free throws. [Team fouls: 3] (Jarrett Smith: 3 personal fouls)   FT 1/2: GOOD   FT 2/2: GOOD James Turner makes 2/2 from the line.
Score: 66-62

[05:35] Team_059 possession (Score: 66-62)
FOUL! Shooting foul on James Turner. Jarrett Smith to the line for 2 free throws. [BONUS: 8 team fouls] (James Turner: 2 personal fouls)   FT 1/2: GOOD   FT 2/2: GOOD Jarrett Smith makes 2/2 from the line.
Score: 68-62

[05:20] Team_074 possession (Score: 68-62)
Chris Carter drives and kicks out. Dwyane Quickley attempts a 3Pt. Contested by Nikola Jokic (5.4 feet, ZONE). DWYANE QUICKLEY MAKES IT! Assist: James Turner
Score: 68-65

[05:07] Team_059 possession (Score: 68-65)
Nikola Jokic attempts a 3Pt. Contested by Dwyane Quickley (5.6 feet, ZONE). Nikola Jokic misses. Rebound secured by James Turner.

[04:51] Team_074 possession (Score: 68-65)
Shai Green attempts a 3Pt. Contested by John Iverson (5.9 feet, MAN). SHAI GREEN MAKES IT! Assist: Donovan Doncic
Score: 68-68

[04:34] Team_059 possession (Score: 68-68)
Jarrett Smith drives, picks up Donovan Doncic. Help arrives from Chris Carter! Jarrett Smith attempts a Layup. Contested by Chris Carter (4.1 feet, ZONE). JARRETT SMITH MAKES IT! Assist: Blake Tatum
Score: 70-68

[04:20] Team_074 possession (Score: 70-68)
Donovan Doncic attempts a Midrange. Contested by Blake Tatum (4.7 feet, ZONE). Donovan Doncic misses. Rebound secured by John Iverson.

[04:09] Team_059 possession (Score: 70-68)
John Iverson attempts a Layup. BLOCKED BY SHAI GREEN! Ball is loose! Rebound secured by Shai Green.

[03:55] Team_074 possession (Score: 70-68)
Shai Green attempts a Midrange. Wide open! John Iverson is 6.0 feet away. [MAN] Shai Green misses. Rebound secured by Jarrett Smith.

[03:38] Team_059 possession (Score: 70-68)
FOUL! Holding foul on James Turner. [IN THE BONUS! 9 team fouls] Jarrett Smith to the line for 2 free throws. (James Turner: 3 personal fouls)   FT 1/2: GOOD   FT 2/2: MISS Jarrett Smith makes 1/2 from the line. Rebound secured by Shai Green.
Score: 71-68

[03:19] Team_074 possession (Score: 71-68)
FOUL! Holding foul on John Iverson. [Team fouls: 4] No free throws, side out. (John Iverson: 1 personal fouls)

[03:04] Team_074 possession (Score: 71-68)
Shai Green attempts a Midrange. Wide open! John Iverson is 6.1 feet away. [MAN] SHAI GREEN MAKES IT! Assist: Donovan Doncic
Score: 71-70

[02:51] Team_059 possession (Score: 71-70)
FOUL! Holding foul on Chris Carter. [IN THE BONUS! 10 team fouls] Blake Tatum to the line for 2 free throws. (Chris Carter: 2 personal fouls)   FT 1/2: GOOD   FT 2/2: GOOD Blake Tatum makes 2/2 from the line.
Score: 73-70

[02:34] Team_074 possession (Score: 73-70)
James Turner attempts a Layup. Wide open! Nikola Jokic is 6.2 feet away. [ZONE] JAMES TURNER MAKES IT!
Score: 73-72

[02:21] Team_059 possession (Score: 73-72)
Blake Tatum drives, picks up Chris Carter. Help arrives from Shai Green! Blake Tatum attempts a Dunk. Contested by Shai Green (4.5 feet, MAN). BLAKE TATUM MAKES IT! Assist: Bam Wade
Score: 75-72

[02:08] Team_074 possession (Score: 75-72)
James Turner commits a violation (traveling/carry)! TURNOVER! (dead ball)

[02:08] Substitution (Team_059): Bam Wade OUT → Russell Quickley IN (stamina_rule2)

[02:08] Substitution (Team_059): Blake Tatum OUT → Scottie Ginobili IN (stamina_rule2)

[02:08] Substitution (Team_059): John Iverson OUT → Allen Giddey IN (stamina_rule2)

[02:08] Substitution (Team_059): Nikola Jokic OUT → Bones Middleton IN (stamina_rule2)

[02:08] Substitution (Team_059): Jarrett Smith OUT → LeBron Lowry IN (stamina_rule2)

[02:08] Substitution (Team_074): Dwyane Quickley OUT → James Barnes IN (stamina_rule2)

[02:08] Substitution (Team_074): Chris Carter OUT → Giannis Westbrook IN (stamina_rule2)

[02:08] Substitution (Team_074): Shai Green OUT → Ayo Smith IN (stamina_rule2)

[02:08] Substitution (Team_074): Donovan Doncic OUT → Yao Randle IN (stamina_rule2)

[02:08] Substitution (Team_074): James Turner OUT → Jaren Rozier IN (stamina_rule2)

[01:51] Team_059 possession (Score: 75-72)
Bones Middleton makes the Dunk and draws the foul on Yao Randle! And-1! Bones Middleton to the line for 1. [BONUS: 11 team fouls] (Yao Randle: 1 personal fouls)   FT 1/1: GOOD Bones Middleton makes 1/1 from the line.
Score: 78-72

[01:32] Team_074 possession (Score: 78-72)
Yao Randle attempts a Midrange. Wide open! Allen Giddey is 6.8 feet away. [ZONE] YAO RANDLE MAKES IT!
Score: 78-74

[01:19] Team_059 possession (Score: 78-74)
LeBron Lowry drives, Jaren Rozier stays with him. LeBron Lowry attempts a Dunk. Contested by Jaren Rozier (4.5 feet, ZONE). LeBron Lowry misses. Rebound secured by Yao Randle.

[01:01] Team_074 possession (Score: 78-74)
Ayo Smith attempts a Layup. BLOCKED BY BONES MIDDLETON! Ball is loose! Offensive rebound by Jaren Rozier! Jaren Rozier kicks it out.

[00:43] Team_074 possession (Score: 78-74)
Ayo Smith attempts a 3Pt. Contested by Russell Quickley (4.6 feet, ZONE). Ayo Smith misses. Rebound secured by Scottie Ginobili.

[00:29] Team_059 possession (Score: 78-74)
Russell Quickley attempts a 3Pt. Contested by James Barnes (4.6 feet, ZONE). Russell Quickley misses. Offensive rebound by Scottie Ginobili! Scottie Ginobili kicks it out.

[00:17] Team_059 possession (Score: 78-74)
Allen Giddey attempts a 3Pt. Contested by James Barnes (4.1 feet, ZONE). Allen Giddey misses. Rebound secured by Yao Randle.

[00:05] Team_074 possession (Score: 78-74)
Yao Randle attempts a 3Pt. Contested by Bones Middleton (4.7 feet, MAN). YAO RANDLE MAKES IT! Assist: James Barnes
Score: 78-77

================================================================================
                              3RD QUARTER COMPLETE                              
================================================================================

3RD QUARTER SCORE: Team_059 32, Team_074 31

BOX SCORE:
================================================================================

Team_059
--------------------------------------------------------------------------------
Player                MIN  PTS  REB  AST  TO      FG   FG%      3P   3P%
--------------------------------------------------------------------------------
Jarrett Smith          26   11    2    0   0   5/6    83.3     0/0   0.0
Blake Tatum            26    8    0    4   0   4/4   100.0     0/0   0.0
Bones Middleton        11    3    0    0   0   1/1   100.0     0/0   0.0
John Iverson           26    2    4    1   0   1/3    33.3     0/0   0.0
Bam Wade               26    2    2    1   0   1/2    50.0     0/0   0.0
Nikola Jokic           26    2    0    0   0   1/3    33.3     0/0   0.0
LeBron Lowry           11    0    0    0   0   0/1     0.0     0/0   0.0
Scottie Ginobili       11    0    2    0   0   0/0     0.0     0/0   0.0
Allen Giddey           11    0    0    0   0   0/1     0.0     0/0   0.0

TEAM: FG: 13/22 (59.1%), 3PT: 0/2 (0.0%), REB: 10 (2 off, 8 def), AST: 6, TO: 0
TEAM FOULS: 4


Team_074
--------------------------------------------------------------------------------
Player                MIN  PTS  REB  AST  TO      FG   FG%      3P   3P%
--------------------------------------------------------------------------------
James Turner           26    7    2    1   0   3/4    75.0     0/0   0.0
Dwyane Quickley        26    7    0    1   0   3/3   100.0     0/0   0.0
Shai Green             26    5    2    0   0   2/5    40.0     0/0   0.0
Yao Randle             11    5    2    0   0   2/2   100.0     0/0   0.0
Donovan Doncic         26    3    5    2   0   1/4    25.0     0/0   0.0
Chris Carter           26    2    0    0   0   1/1   100.0     0/0   0.0
Jaren Rozier           11    0    1    0   0   0/0     0.0     0/0   0.0
Ayo Smith              11    0    0    0   0   0/1     0.0     0/0   0.0
James Barnes           11    0    0    1   0   0/0     0.0     0/0   0.0

TEAM: FG: 12/20 (60.0%), 3PT: 3/5 (60.0%), REB: 12 (3 off, 9 def), AST: 5, TO: 2
TEAM FOULS: 11 [Team_059 in BONUS]

================================================================================

================================================================================
                       4TH QUARTER - Team_059 vs Team_074                       
================================================================================

[12:00] Team_059 possession (Score: 78-77)
Blake Tatum attempts a 3Pt. Contested by Chris Carter (4.2 feet, MAN). Blake Tatum misses. Rebound secured by Donovan Doncic.

[11:41] Team_074 possession (Score: 78-77)
Donovan Doncic attempts a 3Pt. Contested by Nikola Jokic (5.7 feet, MAN). Donovan Doncic misses. Rebound secured by John Iverson.

[11:25] Team_059 possession (Score: 78-77)
John Iverson attempts a 3Pt. Contested by Dwyane Quickley (5.6 feet, ZONE). John Iverson misses. Rebound secured by Donovan Doncic.

[11:08] Team_074 possession (Score: 78-77)
Donovan Doncic drives to the basket... Donovan Doncic throws a bad pass out of bounds! TURNOVER! (dead ball)

[10:54] Team_059 possession (Score: 78-77)
Jarrett Smith drives to the basket... Jarrett Smith throws a bad pass! Stolen by James Turner! TURNOVER! (live ball)

[10:40] Team_074 possession (Score: 78-77)
James Turner makes the Layup and draws the foul on Jarrett Smith! And-1! James Turner to the line for 1. [Team fouls: 1] (Jarrett Smith: 1 personal fouls)   FT 1/1: GOOD James Turner makes 1/1 from the line.
Score: 78-80

[10:23] Team_059 possession (Score: 78-80)
Nikola Jokic attempts a Midrange. Contested by Donovan Doncic (3.9 feet, MAN). Nikola Jokic misses. Offensive rebound by Jarrett Smith! Jarrett Smith kicks it out.

[10:07] Team_059 possession (Score: 78-80)
FOUL! Reach-in foul on Shai Green during the drive. [Team fouls: 1] No free throws, side out. (Shai Green: 1 personal fouls)

[09:51] Team_059 possession (Score: 78-80)
Blake Tatum attempts a Midrange. Contested by Donovan Doncic (3.7 feet, ZONE). Blake Tatum misses. Rebound secured by James Turner.

[09:35] Team_074 possession (Score: 78-80)
Donovan Doncic attempts a Midrange. Contested by John Iverson (5.9 feet, ZONE). Donovan Doncic misses. Rebound secured by John Iverson.

[09:21] Team_059 possession (Score: 78-80)
Jarrett Smith commits a violation (traveling/carry)! TURNOVER! (dead ball)

[09:21] Substitution (Team_059): Bam Wade OUT → Russell Quickley IN (stamina_rule2)

[09:21] Substitution (Team_059): Blake Tatum OUT → Scottie Ginobili IN (stamina_rule2)

[09:21] Substitution (Team_059): John Iverson OUT → Allen Giddey IN (stamina_rule2)

[09:21] Substitution (Team_074): Dwyane Quickley OUT → James Barnes IN (stamina_rule2)

[09:21] Substitution (Team_074): Chris Carter OUT → Giannis Westbrook IN (stamina_rule2)

[09:21] Substitution (Team_074): Shai Green OUT → Ayo Smith IN (stamina_rule2)

[09:06] Team_074 possession (Score: 78-80)
Ayo Smith attempts a Midrange. Contested by Russell Quickley (4.6 feet, ZONE). Ayo Smith misses. Rebound secured by Scottie Ginobili.

[08:47] Team_059 possession (Score: 78-80)
FOUL! Shooting foul on Donovan Doncic. Nikola Jokic to the line for 2 free throws. [Team fouls: 2] (Donovan Doncic: 1 personal fouls)   FT 1/2: GOOD   FT 2/2: GOOD Nikola Jokic makes 2/2 from the line.
Score: 80-80

[08:35] Team_074 possession (Score: 80-80)
James Barnes drives and kicks out. Giannis Westbrook attempts a 3Pt. Contested by Scottie Ginobili (4.5 feet, MAN). Giannis Westbrook misses. Rebound secured by Scottie Ginobili.

[08:17] Team_059 possession (Score: 80-80)
FOUL! Reach-in foul on Donovan Doncic during the drive. [Team fouls: 3] No free throws, side out. (Donovan Doncic: 2 personal fouls)

[08:03] Team_059 possession (Score: 80-80)
Russell Quickley attempts a Midrange. Contested by Giannis Westbrook (4.8 feet, ZONE). RUSSELL QUICKLEY MAKES IT! Assist: Nikola Jokic
Score: 82-80

[07:49] Team_074 possession (Score: 82-80)
Giannis Westbrook throws a bad pass out of bounds! TURNOVER! (dead ball)

[07:49] Substitution (Team_059): Nikola Jokic OUT → Bones Middleton IN (stamina_rule2)

[07:49] Substitution (Team_059): Jarrett Smith OUT → LeBron Lowry IN (stamina_rule2)

[07:49] Substitution (Team_074): Donovan Doncic OUT → Yao Randle IN (stamina_rule2)

[07:49] Substitution (Team_074): James Turner OUT → Jaren Rozier IN (stamina_rule2)

[07:31] Team_059 possession (Score: 82-80)
Allen Giddey attempts a Midrange. Contested by Giannis Westbrook (4.3 feet, ZONE). Allen Giddey misses. Rebound secured by Yao Randle.

[07:20] Team_074 possession (Score: 82-80)
James Barnes attempts a 3Pt. Contested by Russell Quickley (4.3 feet, ZONE). James Barnes misses. FOUL! Loose ball foul on Scottie Ginobili during the rebound battle. [Team fouls: 2] No free throws, side out. (Scottie Ginobili: 1 personal fouls)

[07:03] Team_074 possession (Score: 82-80)
James Barnes attempts a Midrange. Contested by Russell Quickley (4.3 feet, MAN). JAMES BARNES MAKES IT! Assist: Jaren Rozier
Score: 82-82

[06:48] Team_059 possession (Score: 82-82)
Scottie Ginobili attempts a 3Pt. Contested by James Barnes (4.8 feet, ZONE). Scottie Ginobili misses. Offensive rebound by Bones Middleton! Bones Middleton kicks it out.

[06:37] Team_059 possession (Score: 82-82)
FOUL! Reach-in foul on Yao Randle during the drive. [Team fouls: 4] No free throws, side out. (Yao Randle: 1 personal fouls)

[06:23] Team_059 possession (Score: 82-82)
LeBron Lowry drives to the basket... LeBron Lowry throws a bad pass! Stolen by Yao Randle! TURNOVER! (live ball)

[06:07] Team_074 possession (Score: 82-82)
Ayo Smith attempts a 3Pt. Wide open! Allen Giddey is 6.8 feet away. [MAN] Ayo Smith misses. Rebound secured by Scottie Ginobili.

[05:50] Team_059 possession (Score: 82-82)
Scottie Ginobili drives and kicks out. Russell Quickley attempts a Midrange. Contested by Yao Randle (4.5 feet, ZONE). RUSSELL QUICKLEY MAKES IT! Assist: Allen Giddey
Score: 84-82

[05:36] Team_074 possession (Score: 84-82)
James Barnes attempts a 3Pt. Contested by Russell Quickley (4.3 feet, ZONE). JAMES BARNES MAKES IT! Assist: Giannis Westbrook
Score: 84-85

[05:22] Team_059 possession (Score: 84-85)
Scottie Ginobili attempts a Midrange. Contested by Giannis Westbrook (5.0 feet, MAN). Scottie Ginobili misses. Rebound secured by Yao Randle.

[05:10] Team_074 possession (Score: 84-85)
Jaren Rozier makes the Layup and draws the foul on Bones Middleton! And-1! Jaren Rozier to the line for 1. [Team fouls: 3] (Bones Middleton: 1 personal fouls)   FT 1/1: MISS Jaren Rozier makes 0/1 from the line. Rebound secured by LeBron Lowry.
Score: 84-87

[04:58] Team_059 possession (Score: 84-87)
Bones Middleton drives, Yao Randle stays with him. Bones Middleton attempts a Layup. Contested by Yao Randle (4.8 feet, MAN). BONES MIDDLETON MAKES IT!
Score: 86-87

[04:40] Team_074 possession (Score: 86-87)
Giannis Westbrook attempts a Midrange. Contested by Scottie Ginobili (4.6 feet, MAN). Giannis Westbrook misses. Rebound secured by LeBron Lowry.

[04:25] Team_059 possession (Score: 86-87)
Bones Middleton drives and kicks out. Bones Middleton attempts a 3Pt. Contested by James Barnes (4.2 feet, ZONE). Bones Middleton misses. Rebound secured by Jaren Rozier.

[04:06] Team_074 possession (Score: 86-87)
FOUL! Shooting foul on Allen Giddey. Ayo Smith to the line for 3 free throws. [Team fouls: 4] (Allen Giddey: 1 personal fouls)   FT 1/3: GOOD   FT 2/3: GOOD   FT 3/3: MISS Ayo Smith makes 2/3 from the line. Rebound secured by Bones Middleton.
Score: 86-89

[03:51] Team_059 possession (Score: 86-89)
Russell Quickley attempts a 3Pt. Contested by James Barnes (4.6 feet, MAN). Russell Quickley misses. Rebound secured by Ayo Smith.

[03:33] Team_074 possession (Score: 86-89)
Yao Randle attempts a 3Pt. Contested by Bones Middleton (4.7 feet, MAN). YAO RANDLE MAKES IT! Assist: James Barnes
Score: 86-92

[03:20] Team_059 possession (Score: 86-92)
Russell Quickley attempts a Layup. BLOCKED BY YAO RANDLE! Ball is loose! Offensive rebound by Scottie Ginobili! Scottie Ginobili kicks it out.

[03:04] Team_059 possession (Score: 86-92)
Scottie Ginobili drives to the basket... Scottie Ginobili loses the ball! Stripped by Giannis Westbrook! TURNOVER! (live ball)

[02:51] Team_074 possession (Score: 86-92)
Giannis Westbrook attempts a 3Pt. Contested by Russell Quickley (4.6 feet, ZONE). Giannis Westbrook misses. FOUL! Loose ball foul on Bones Middleton during the rebound battle. [IN THE BONUS! 5 team fouls] Jaren Rozier to the line for 2 free throws. (Bones Middleton: 2 personal fouls)   FT 1/2: GOOD   FT 2/2: GOOD Jaren Rozier makes 2/2 from the line.
Score: 86-94

[02:35] Team_059 possession (Score: 86-94)
LeBron Lowry drives and kicks out. Bones Middleton attempts a 3Pt. Contested by James Barnes (4.4 feet, ZONE). Bones Middleton misses. FOUL! Loose ball foul on Yao Randle during the rebound battle. [IN THE BONUS! 5 team fouls] Scottie Ginobili to the line for 2 free throws. (Yao Randle: 2 personal fouls)   FT 1/2: GOOD   FT 2/2: MISS Scottie Ginobili makes 1/2 from the line. Rebound secured by Jaren Rozier.
Score: 87-94

[02:19] Team_074 possession (Score: 87-94)
James Barnes attempts a 3Pt. Contested by Russell Quickley (4.4 feet, ZONE). JAMES BARNES MAKES IT!
Score: 87-97

[02:06] Team_059 possession (Score: 87-97)
Scottie Ginobili attempts a Layup. Contested by Yao Randle (5.0 feet, ZONE). SCOTTIE GINOBILI MAKES IT! Assist: LeBron Lowry
Score: 89-97

[01:49] Team_074 possession (Score: 89-97)
Ayo Smith drives, picks up Allen Giddey. Help arrives from Scottie Ginobili! Ayo Smith attempts a Dunk. Wide open! Scottie Ginobili is 6.9 feet away. [MAN] Ayo Smith misses. Rebound secured by Scottie Ginobili.

[01:39] Team_059 possession (Score: 89-97)
Russell Quickley attempts a Midrange. Contested by Giannis Westbrook (4.9 feet, ZONE). Russell Quickley misses. Rebound secured by Ayo Smith.

[01:23] Team_074 possession (Score: 89-97)
Giannis Westbrook loses control! Ball rolls out of bounds! TURNOVER! (dead ball)

[01:07] Team_059 possession (Score: 89-97)
Russell Quickley attempts a Layup. Contested by Yao Randle (4.8 feet, ZONE). Russell Quickley misses. Offensive rebound by Bones Middleton! Bones Middleton kicks it out.

[00:49] Team_059 possession (Score: 89-97)
Scottie Ginobili attempts a 3Pt. Contested by Ayo Smith (5.5 feet, ZONE). Scottie Ginobili misses. Offensive rebound by Scottie Ginobili! Scottie Ginobili kicks it out.

[00:31] Team_059 possession (Score: 89-97)
Allen Giddey drives, picks up Yao Randle. Help arrives from Giannis Westbrook! Allen Giddey attempts a Dunk. Contested by Giannis Westbrook (4.4 feet, ZONE). ALLEN GIDDEY MAKES IT!
Score: 91-97

[00:19] Team_074 possession (Score: 91-97)
Ayo Smith attempts a Midrange. Wide open! Allen Giddey is 7.0 feet away. [MAN] Ayo Smith misses. Rebound secured by Scottie Ginobili.

[00:02] Team_059 possession (Score: 91-97)
Russell Quickley drives, Yao Randle stays with him. Russell Quickley attempts a Layup. Contested by Yao Randle (4.9 feet, ZONE). RUSSELL QUICKLEY MAKES IT!
Score: 93-97

================================================================================
                              4TH QUARTER COMPLETE                              
================================================================================

4TH QUARTER SCORE: Team_059 15, Team_074 20

BOX SCORE:
================================================================================

Team_059
--------------------------------------------------------------------------------
Player                MIN  PTS  REB  AST  TO      FG   FG%      3P   3P%
--------------------------------------------------------------------------------
Russell Quickley       20    6    0    0   0   3/5    60.0     0/0   0.0
Scottie Ginobili       20    2    7    0   0   1/2    50.0     0/0   0.0
Nikola Jokic           30    2    0    1   0   1/1   100.0     0/0   0.0
Allen Giddey           20    2    0    1   0   1/2    50.0     0/0   0.0
Jaren Rozier           18    2    3    1   0   1/2    50.0     0/0   0.0
Bones Middleton        18    2    3    0   0   1/2    50.0     0/0   0.0
Blake Tatum            28    0    0    0   0   0/2     0.0     0/0   0.0
John Iverson           28    0    2    0   0   0/1     0.0     0/0   0.0
Jarrett Smith          30    0    1    0   0   0/0     0.0     0/0   0.0
LeBron Lowry           18    0    2    1   0   0/1     0.0     0/0   0.0

TEAM: FG: 7/16 (43.8%), 3PT: 0/3 (0.0%), REB: 16 (6 off, 10 def), AST: 3, TO: 4
TEAM FOULS: 5 [Team_074 in BONUS]


Team_074
--------------------------------------------------------------------------------
Player                MIN  PTS  REB  AST  TO      FG   FG%      3P   3P%
--------------------------------------------------------------------------------
James Barnes           20    8    0    1   0   3/4    75.0     0/0   0.0
James Turner           30    3    1    0   0   1/1   100.0     0/0   0.0
Yao Randle             18    3    2    0   0   1/1   100.0     0/0   0.0
Donovan Doncic         30    0    2    0   0   0/2     0.0     0/0   0.0
Ayo Smith              20    0    2    0   0   0/5     0.0     0/0   0.0
Giannis Westbrook      20    0    0    1   0   0/1     0.0     0/0   0.0

TEAM: FG: 6/16 (37.5%), 3PT: 4/7 (57.1%), REB: 9 (1 off, 8 def), AST: 3, TO: 3
TEAM FOULS: 5 [Team_059 in BONUS]

================================================================================

================================================================================
                               FULL GAME COMPLETE                               
================================================================================

FINAL SCORE: Team_059 93, Team_074 97

SCORING BY QUARTER:
--------------------------------------------------------------------------------
Team                     Q1     Q2     Q3     Q4    FINAL
--------------------------------------------------------------------------------
Team_059                 20     26     32     15       93
Team_074                 18     28     31     20       97
--------------------------------------------------------------------------------

FULL GAME BOX SCORE:
================================================================================

Team_059
--------------------------------------------------------------------------------
Player                MIN  PTS  REB  AST  TO      FG   FG%      3P   3P%      FT STL BLK
--------------------------------------------------------------------------------
Nikola Jokic           30    4    1    2   1   3/7    42.9   0/3     0.0   2/2     0   0
Jarrett Smith          30   21    6    0   1   9/11   81.8   0/0     0.0   8/9     0   1
Bam Wade               28   14    6    3   1   6/11   54.5   3/6    50.0   1/3     1   0
Blake Tatum            28   10    0    7   2   4/8    50.0   0/1     0.0   4/4     0   1
John Iverson           28    6   13    2   1   3/9    33.3   0/3     0.0   1/3     0   0
Russell Quickley       20    8    0    1   0   3/6    50.0   0/2     0.0   0/0     0   0
Scottie Ginobili       20    8   10    1   0   4/5    80.0   1/1   100.0   2/3     0   0
Allen Giddey           20    2    0    1   3   1/5    20.0   0/1     0.0   0/0     0   0
Bones Middleton        18    9    6    2   2   4/5    80.0   0/0     0.0   3/3     1   1
LeBron Lowry           18    4    2    1   1   2/6    33.3   0/0     0.0   0/0     0   0

TEAM: FG: 40/75 (53.3%), 3PT: 4/17 (23.5%), REB: 44 (11 off, 33 def), AST: 20, TO: 12


Team_074
--------------------------------------------------------------------------------
Player                MIN  PTS  REB  AST  TO      FG   FG%      3P   3P%      FT STL BLK
--------------------------------------------------------------------------------
Donovan Doncic         30    8   16    2   0   3/10   30.0   1/2    50.0   0/0     0   0
James Turner           30   21    7    2   3   9/14   64.3   0/1     0.0   9/10    2   0
Dwyane Quickley        28    9    0    1   2   3/6    50.0   0/3     0.0   0/0     0   0
Chris Carter           28    4    0    1   0   3/6    50.0   0/0     0.0   2/2     0   0
Shai Green             28    7    3    0   1   3/9    33.3   1/5    20.0   0/0     0   1
James Barnes           20    8    0    2   0   3/4    75.0   2/2   100.0   0/0     0   0
Giannis Westbrook      20    7    0    1   5   4/6    66.7   2/3    66.7   0/0     1   0
Ayo Smith              20    4    2    4   0   2/8    25.0   0/3     0.0   2/3     0   0
Yao Randle             18   12    7    0   1   5/6    83.3   2/2   100.0   0/0     2   1
Jaren Rozier           18   11    7    2   0   4/5    80.0   0/0     0.0   3/4     0   0

TEAM: FG: 39/74 (52.7%), 3PT: 8/21 (38.1%), REB: 42 (8 off, 34 def), AST: 15, TO: 12

================================================================================
