================================================================================
                        FULL GAME - Team_003 vs Team_095                        
================================================================================

================================================================================
                       1ST QUARTER - Team_003 vs Team_095                       
================================================================================

[12:00] Team_003 possession (Score: 0-0)
Rudy Haliburton makes the 3Pt and draws the foul on Evan Carter! And-1! Rudy Haliburton to the line for 1. [Team fouls: 1] (Evan Carter: 1 personal fouls)   FT 1/1: GOOD Rudy Haliburton makes 1/1 from the line.
Score: 4-0

[11:46] Team_095 possession (Score: 4-0)
Shaquille Ball attempts a Layup. BLOCKED BY RUDY HALIBURTON! Ball deflects out of bounds off Shaquille Ball.

[11:31] Team_003 possession (Score: 4-0)
Nikola Bryant attempts a 3Pt. Contested by Evan Carter (4.1 feet, ZONE). NIKOLA BRYANT MAKES IT!
Score: 7-0

[11:17] Team_095 possession (Score: 7-0)
Evan Carter throws a bad pass out of bounds! TURNOVER! (dead ball)

[11:01] Team_003 possession (Score: 7-0)
Nikola Bryant attempts a Midrange. Contested by Shaquille Ball (4.6 feet, MAN). NIKOLA BRYANT MAKES IT!
Score: 9-0

[10:42] Team_095 possession (Score: 9-0)
Immanuel Middleton attempts a Midrange. BLOCKED BY GIANNIS TURNER! Ball is loose! Rebound secured by Victor O'Neal.

[10:32] Team_003 possession (Score: 9-0)
Victor O'Neal attempts a Midrange. Contested by Evan Carter (3.8 feet, ZONE). VICTOR O'NEAL MAKES IT! Assist: Ayo Jackson
Score: 11-0

[10:20] Team_095 possession (Score: 11-0)
Immanuel Middleton drives and kicks out. Immanuel Middleton attempts a 3Pt. Contested by Giannis Turner (2.8 feet, ZONE). Immanuel Middleton misses. Rebound secured by Giannis Turner.

[10:06] Team_003 possession (Score: 11-0)
FOUL! Shooting foul on Evan Carter. Rudy Haliburton to the line for 3 free throws. [Team fouls: 2] (Evan Carter: 2 personal fouls)   FT 1/3: GOOD   FT 2/3: GOOD   FT 3/3: GOOD Rudy Haliburton makes 3/3 from the line.
Score: 14-0

[09:52] Team_095 possession (Score: 14-0)
Immanuel Middleton attempts a Midrange. Contested by Giannis Turner (2.8 feet, MAN). Immanuel Middleton misses. Rebound secured by Giannis Turner.

[09:38] Team_003 possession (Score: 14-0)
Nikola Bryant drives, picks up Kyrie Ming. Help arrives from Dejounte Hyland! Nikola Bryant attempts a Dunk. Contested by Dejounte Hyland (5.4 feet, ZONE). NIKOLA BRYANT MAKES IT!
Score: 16-0

[09:26] Team_095 possession (Score: 16-0)
FOUL! Shooting foul on Giannis Turner. Kyrie Ming to the line for 2 free throws. [Team fouls: 1] (Giannis Turner: 1 personal fouls)   FT 1/2: GOOD   FT 2/2: GOOD Kyrie Ming makes 2/2 from the line.
Score: 16-2

[09:11] Team_003 possession (Score: 16-2)
Rudy Haliburton attempts a 3Pt. Contested by Evan Carter (3.9 feet, ZONE). RUDY HALIBURTON MAKES IT! Assist: Giannis Turner
Score: 19-2

[08:54] Team_095 possession (Score: 19-2)
FOUL! Reach-in foul on Giannis Turner during the drive. [Team fouls: 2] No free throws, side out. (Giannis Turner: 2 personal fouls)

[08:41] Team_095 possession (Score: 19-2)
FOUL! Offensive foul on Immanuel Middleton! Giannis Turner drew the charge! [Team fouls: 3] (Immanuel Middleton: 1 personal fouls) TURNOVER! (dead ball)

[08:26] Team_003 possession (Score: 19-2)
Ayo Jackson attempts a Midrange. Contested by Dejounte Hyland (5.2 feet, MAN). Ayo Jackson misses. Rebound secured by Dejounte Hyland.

[08:13] Team_095 possession (Score: 19-2)
Shaquille Ball attempts a Midrange. Contested by Nikola Bryant (4.0 feet, MAN). SHAQUILLE BALL MAKES IT! Assist: Immanuel Middleton
Score: 19-4

[07:59] Team_003 possession (Score: 19-4)
Rudy Haliburton attempts a Midrange. Contested by Evan Carter (3.9 feet, MAN). Rudy Haliburton misses. Offensive rebound by Victor O'Neal! Victor O'Neal kicks it out.

[07:49] Team_003 possession (Score: 19-4)
Nikola Bryant drives and kicks out. Nikola Bryant attempts a Midrange. Contested by Shaquille Ball (4.3 feet, MAN). NIKOLA BRYANT MAKES IT! Assist: Rudy Haliburton
Score: 21-4

[07:34] Team_095 possession (Score: 21-4)
Kyrie Ming drives, Giannis Turner stays with him. Kyrie Ming attempts a Layup. Contested by Giannis Turner (3.0 feet, ZONE). KYRIE MING MAKES IT! Assist: Evan Carter
Score: 21-6

[07:24] Team_003 possession (Score: 21-6)
Rudy Haliburton attempts a Midrange. Contested by Evan Carter (3.9 feet, MAN). Rudy Haliburton misses. Rebound secured by Evan Carter.

[07:09] Team_095 possession (Score: 21-6)
FOUL! Reach-in foul on Giannis Turner during the drive. [Team fouls: 3] No free throws, side out. (Giannis Turner: 3 personal fouls)

[06:54] Team_095 possession (Score: 21-6)
Immanuel Middleton drives to the basket... Immanuel Middleton throws a bad pass out of bounds! TURNOVER! (dead ball)

[06:39] Team_003 possession (Score: 21-6)
Ayo Jackson makes the Midrange and draws the foul on Dejounte Hyland! And-1! Ayo Jackson to the line for 1. [Team fouls: 4] (Dejounte Hyland: 1 personal fouls)   FT 1/1: GOOD Ayo Jackson makes 1/1 from the line.
Score: 24-6

[06:24] Team_095 possession (Score: 24-6)
Shaquille Ball attempts a Midrange. Contested by Nikola Bryant (4.0 feet, MAN). SHAQUILLE BALL MAKES IT! Assist: Immanuel Middleton
Score: 24-8

[06:09] Team_003 possession (Score: 24-8)
Ayo Jackson attempts a Layup. Contested by Immanuel Middleton (5.2 feet, ZONE). AYO JACKSON MAKES IT! Assist: Nikola Bryant
Score: 26-8

[05:57] Team_095 possession (Score: 26-8)
Shaquille Ball attempts a 3Pt. Contested by Ayo Jackson (5.2 feet, ZONE). SHAQUILLE BALL MAKES IT! Assist: Dejounte Hyland
Score: 26-11

[05:44] Team_003 possession (Score: 26-11)
Nikola Bryant attempts a 3Pt. Contested by Shaquille Ball (4.6 feet, MAN). NIKOLA BRYANT MAKES IT! Assist: Rudy Haliburton
Score: 29-11

[05:32] Team_095 possession (Score: 29-11)
Immanuel Middleton drives, Giannis Turner stays with him. Immanuel Middleton attempts a Dunk. Contested by Giannis Turner (2.8 feet, ZONE). Immanuel Middleton misses. Rebound secured by Victor O'Neal.

[05:20] Team_003 possession (Score: 29-11)
Nikola Bryant attempts a 3Pt. Contested by Shaquille Ball (4.6 feet, MAN). Nikola Bryant misses. Rebound secured by Shaquille Ball.

[05:04] Team_095 possession (Score: 29-11)
Immanuel Middleton drives and kicks out. Evan Carter attempts a 3Pt. Contested by Rudy Haliburton (3.3 feet, MAN). Evan Carter misses. Offensive rebound by Evan Carter! Evan Carter's putback is no good. Rebound secured by Rudy Haliburton.

[04:49] Team_003 possession (Score: 29-11)
Ayo Jackson attempts a 3Pt. Contested by Evan Carter (4.2 feet, ZONE). Ayo Jackson misses. Rebound secured by Shaquille Ball.

[04:35] Team_095 possession (Score: 29-11)
Shaquille Ball attempts a Midrange. Contested by Nikola Bryant (4.1 feet, MAN). Shaquille Ball misses. Rebound secured by Victor O'Neal.

[04:22] Team_003 possession (Score: 29-11)
Nikola Bryant attempts a 3Pt. Contested by Shaquille Ball (4.7 feet, MAN). Nikola Bryant misses. Rebound secured by Evan Carter.

[04:08] Team_095 possession (Score: 29-11)
Immanuel Middleton attempts a 3Pt. Contested by Giannis Turner (2.9 feet, MAN). Immanuel Middleton misses. Rebound secured by Victor O'Neal.

[03:54] Team_003 possession (Score: 29-11)
Ayo Jackson attempts a Layup. Contested by Immanuel Middleton (5.3 feet, ZONE). AYO JACKSON MAKES IT!
Score: 31-11

[03:41] Team_095 possession (Score: 31-11)
Shaquille Ball attempts a 3Pt. Contested by Giannis Turner (3.0 feet, ZONE). Shaquille Ball misses. Rebound secured by Victor O'Neal.

[03:25] Team_003 possession (Score: 31-11)
Ayo Jackson drives, Dejounte Hyland stays with him. Ayo Jackson attempts a Layup. Contested by Dejounte Hyland (5.3 feet, MAN). AYO JACKSON MAKES IT!
Score: 33-11

[03:10] Team_095 possession (Score: 33-11)
Immanuel Middleton drives, Giannis Turner stays with him. Immanuel Middleton attempts a Dunk. Contested by Giannis Turner (3.0 feet, MAN). Immanuel Middleton misses. Rebound secured by Rudy Haliburton.

[02:54] Team_003 possession (Score: 33-11)
Rudy Haliburton attempts a Layup. Contested by Immanuel Middleton (5.2 feet, ZONE). Rudy Haliburton misses. Rebound secured by Dejounte Hyland.

[02:38] Team_095 possession (Score: 33-11)
FOUL! Holding foul on Giannis Turner. [Team fouls: 4] No free throws, side out. (Giannis Turner: 4 personal fouls)

[02:24] Team_095 possession (Score: 33-11)
Dejounte Hyland attempts a Layup. Contested by Ayo Jackson (5.5 feet, MAN). DEJOUNTE HYLAND MAKES IT! Assist: Evan Carter
Score: 33-13

[02:05] Team_003 possession (Score: 33-13)
Giannis Turner attempts a 3Pt. Contested by Immanuel Middleton (5.5 feet, MAN). GIANNIS TURNER MAKES IT! Assist: Nikola Bryant
Score: 36-13

[01:49] Team_095 possession (Score: 36-13)
Immanuel Middleton makes the Layup and draws the foul on Giannis Turner! And-1! Immanuel Middleton to the line for 1. [BONUS: 5 team fouls] (Giannis Turner: 5 personal fouls)   FT 1/1: MISS Immanuel Middleton makes 0/1 from the line. Rebound secured by Victor O'Neal.
Score: 36-15

[01:31] Team_003 possession (Score: 36-15)
Victor O'Neal attempts a Midrange. Contested by Shaquille Ball (4.6 feet, ZONE). Victor O'Neal misses. Rebound secured by Shaquille Ball.

[01:19] Team_095 possession (Score: 36-15)
Dejounte Hyland drives and kicks out. Dejounte Hyland attempts a Midrange. Contested by Nikola Bryant (4.4 feet, ZONE). DEJOUNTE HYLAND MAKES IT!
Score: 36-17

[01:04] Team_003 possession (Score: 36-17)
Ayo Jackson loses the ball! Stripped by Dejounte Hyland! TURNOVER! (live ball)

[00:47] Team_095 possession (Score: 36-17)
Evan Carter attempts a Layup. Contested by Rudy Haliburton (3.9 feet, MAN). EVAN CARTER MAKES IT! Assist: Immanuel Middleton
Score: 36-19

[00:31] Team_003 possession (Score: 36-19)
FOUL! Shooting foul on Dejounte Hyland. Rudy Haliburton to the line for 2 free throws. [BONUS: 5 team fouls] (Dejounte Hyland: 2 personal fouls)   FT 1/2: GOOD   FT 2/2: GOOD Rudy Haliburton makes 2/2 from the line.
Score: 38-19

[00:17] Team_095 possession (Score: 38-19)
Shaquille Ball drives, picks up Nikola Bryant. Help arrives from Rudy Haliburton! Shaquille Ball attempts a Layup. Contested by Rudy Haliburton (4.5 feet, MAN). SHAQUILLE BALL MAKES IT! Assist: Evan Carter
Score: 38-21

[00:02] Team_003 possession (Score: 38-21)
Giannis Turner attempts a 3Pt. Contested by Immanuel Middleton (5.7 feet, MAN). Giannis Turner misses. Offensive rebound by Rudy Haliburton! Rudy Haliburton kicks it out.

================================================================================
                              1ST QUARTER COMPLETE                              
================================================================================

1ST QUARTER SCORE: Team_003 38, Team_095 21

BOX SCORE:
================================================================================

Team_003
--------------------------------------------------------------------------------
Player                MIN  PTS  REB  AST  TO      FG   FG%      3P   3P%
--------------------------------------------------------------------------------
Rudy Haliburton        12   12    3    2   0   4/6    66.7     0/0   0.0
Nikola Bryant          12   12    0    2   0   5/7    71.4     0/0   0.0
Ayo Jackson            12    9    0    1   0   4/6    66.7     0/0   0.0
Giannis Turner         12    3    2    1   0   1/1   100.0     0/0   0.0
Victor O'Neal          12    2    7    0   0   1/2    50.0     0/0   0.0

TEAM: FG: 15/22 (68.2%), 3PT: 6/9 (66.7%), REB: 11 (2 off, 9 def), AST: 6, TO: 1
TEAM FOULS: 5 [Team_095 in BONUS]


Team_095
--------------------------------------------------------------------------------
Player                MIN  PTS  REB  AST  TO      FG   FG%      3P   3P%
--------------------------------------------------------------------------------
Shaquille Ball         12    9    3    0   0   4/7    57.1     0/0   0.0
Kyrie Ming             12    4    0    0   0   2/2   100.0     0/0   0.0
Dejounte Hyland        12    4    2    1   0   2/2   100.0     0/0   0.0
Evan Carter            12    2    2    3   0   1/1   100.0     0/0   0.0
Immanuel Middleton     12    0    0    3   0   0/8     0.0     0/0   0.0

TEAM: FG: 9/20 (45.0%), 3PT: 1/3 (33.3%), REB: 8 (1 off, 7 def), AST: 7, TO: 3
TEAM FOULS: 5 [Team_003 in BONUS]

================================================================================

================================================================================
                       2ND QUARTER - Team_003 vs Team_095                       
================================================================================

[12:00] Team_003 possession (Score: 38-21)
FOUL! Shooting foul on Kyrie Ming. Victor O'Neal to the line for 2 free throws. [Team fouls: 1] (Kyrie Ming: 1 personal fouls)   FT 1/2: GOOD   FT 2/2: GOOD Victor O'Neal makes 2/2 from the line.
Score: 40-21

[11:44] Team_095 possession (Score: 40-21)
Immanuel Middleton attempts a Midrange. Contested by Giannis Turner (3.1 feet, MAN). IMMANUEL MIDDLETON MAKES IT!
Score: 40-23

[11:32] Team_003 possession (Score: 40-23)
Nikola Bryant attempts a Layup. Contested by Shaquille Ball (4.9 feet, MAN). NIKOLA BRYANT MAKES IT!
Score: 42-23

[11:16] Team_095 possession (Score: 42-23)
Immanuel Middleton attempts a Layup. BLOCKED BY GIANNIS TURNER! Ball deflects out of bounds off Immanuel Middleton.

[10:56] Team_003 possession (Score: 42-23)
Nikola Bryant drives and kicks out. Ayo Jackson attempts a 3Pt. Contested by Evan Carter (4.3 feet, ZONE). Ayo Jackson misses. Offensive rebound by Rudy Haliburton! Rudy Haliburton kicks it out.

[10:47] Team_003 possession (Score: 42-23)
Rudy Haliburton drives, picks up Evan Carter. Help arrives from Dejounte Hyland! Rudy Haliburton attempts a Layup. Contested by Dejounte Hyland (4.3 feet, MAN). Rudy Haliburton misses. Rebound secured by Evan Carter.

[10:34] Team_095 possession (Score: 42-23)
Kyrie Ming attempts a Midrange. Contested by Victor O'Neal (4.8 feet, ZONE). KYRIE MING MAKES IT!
Score: 42-25

[10:24] Team_003 possession (Score: 42-25)
Nikola Bryant attempts a Midrange. Contested by Immanuel Middleton (5.7 feet, ZONE). Nikola Bryant misses. Rebound secured by Evan Carter.

[10:09] Team_095 possession (Score: 42-25)
Evan Carter attempts a 3Pt. Contested by Giannis Turner (3.6 feet, ZONE). EVAN CARTER MAKES IT! Assist: Shaquille Ball
Score: 42-28

[09:53] Team_003 possession (Score: 42-28)
Nikola Bryant drives, picks up Shaquille Ball. Help arrives from Evan Carter! Nikola Bryant attempts a Layup. Contested by Evan Carter (5.0 feet, MAN). Nikola Bryant misses. Rebound secured by Evan Carter.

[09:35] Team_095 possession (Score: 42-28)
Evan Carter attempts a 3Pt. Contested by Rudy Haliburton (4.0 feet, MAN). Evan Carter misses. Offensive rebound by Evan Carter! Evan Carter's putback is no good. Rebound secured by Giannis Turner.

[09:20] Team_003 possession (Score: 42-28)
Ayo Jackson attempts a Midrange. Contested by Dejounte Hyland (5.7 feet, MAN). Ayo Jackson misses. Rebound secured by Evan Carter.

[09:08] Team_095 possession (Score: 42-28)
Kyrie Ming drives, Giannis Turner stays with him. Kyrie Ming attempts a Dunk. Contested by Giannis Turner (3.7 feet, ZONE). KYRIE MING MAKES IT! Assist: Shaquille Ball
Score: 42-30

[08:54] Team_003 possession (Score: 42-30)
FOUL! Holding foul on Dejounte Hyland. [Team fouls: 2] No free throws, side out. (Dejounte Hyland: 1 personal fouls)

[08:40] Team_003 possession (Score: 42-30)
Victor O'Neal drives and kicks out. Ayo Jackson attempts a Midrange. Contested by Dejounte Hyland (5.6 feet, MAN). Ayo Jackson misses. Rebound secured by Shaquille Ball.

[08:29] Team_095 possession (Score: 42-30)
Dejounte Hyland attempts a Layup. Contested by Giannis Turner (3.6 feet, ZONE). Dejounte Hyland misses. Rebound secured by Rudy Haliburton.

[08:16] Team_003 possession (Score: 42-30)
Giannis Turner attempts a 3Pt. Contested by Immanuel Middleton (6.0 feet, MAN). Giannis Turner misses. Rebound secured by Shaquille Ball.

[08:05] Team_095 possession (Score: 42-30)
Dejounte Hyland attempts a 3Pt. Contested by Ayo Jackson (6.0 feet, MAN). Dejounte Hyland misses. Rebound secured by Rudy Haliburton.

[07:46] Team_003 possession (Score: 42-30)
Nikola Bryant attempts a 3Pt. Contested by Evan Carter (4.9 feet, ZONE). NIKOLA BRYANT MAKES IT! Assist: Rudy Haliburton
Score: 45-30

[07:29] Team_095 possession (Score: 45-30)
Immanuel Middleton drives and kicks out. Kyrie Ming attempts a Midrange. Contested by Giannis Turner (3.9 feet, ZONE). Kyrie Ming misses. Rebound secured by Victor O'Neal.

[07:14] Team_003 possession (Score: 45-30)
Giannis Turner makes the Layup and draws the foul on Immanuel Middleton! And-1! Giannis Turner to the line for 1. [Team fouls: 3] (Immanuel Middleton: 1 personal fouls)   FT 1/1: GOOD Giannis Turner makes 1/1 from the line.
Score: 48-30

[07:03] Team_095 possession (Score: 48-30)
Dejounte Hyland attempts a 3Pt. Contested by Giannis Turner (3.9 feet, ZONE). Dejounte Hyland misses. Offensive rebound by Shaquille Ball! Shaquille Ball kicks it out.

[06:45] Team_095 possession (Score: 48-30)
Dejounte Hyland attempts a 3Pt. Contested by Giannis Turner (3.9 feet, ZONE). DEJOUNTE HYLAND MAKES IT! Assist: Immanuel Middleton
Score: 48-33

[06:30] Team_003 possession (Score: 48-33)
Nikola Bryant throws a bad pass out of bounds! TURNOVER! (dead ball)

[06:30] Substitution (Team_003): Ayo Jackson OUT → Miles Towns IN (stamina_rule2)

[06:30] Substitution (Team_003): Nikola Bryant OUT → Pau Williamson IN (stamina_rule2)

[06:30] Substitution (Team_003): Rudy Haliburton OUT → Collin Mitchell IN (stamina_rule2)

[06:30] Substitution (Team_003): Giannis Turner OUT → Anfernee Jordan IN (stamina_rule2)

[06:30] Substitution (Team_003): Victor O'Neal OUT → Bam Gilgeous-Alexander IN (stamina_rule2)

[06:30] Substitution (Team_095): Dejounte Hyland OUT → Kyle Poole IN (stamina_rule2)

[06:30] Substitution (Team_095): Shaquille Ball OUT → Cade Beal IN (stamina_rule2)

[06:30] Substitution (Team_095): Evan Carter OUT → Tobias Wagner IN (stamina_rule2)

[06:30] Substitution (Team_095): Immanuel Middleton OUT → Gary Davis IN (stamina_rule2)

[06:30] Substitution (Team_095): Kyrie Ming OUT → DeMar McCollum IN (stamina_rule2)

[06:14] Team_095 possession (Score: 48-33)
Tobias Wagner attempts a 3Pt. Contested by Miles Towns (5.6 feet, ZONE). Tobias Wagner misses. Rebound secured by Bam Gilgeous-Alexander.

[06:00] Team_003 possession (Score: 48-33)
Pau Williamson attempts a 3Pt. Contested by Cade Beal (4.3 feet, MAN). PAU WILLIAMSON MAKES IT! Assist: Collin Mitchell
Score: 51-33

[05:43] Team_095 possession (Score: 51-33)
DeMar McCollum makes the Dunk and draws the foul on Pau Williamson! And-1! DeMar McCollum to the line for 1. [Team fouls: 1] (Pau Williamson: 1 personal fouls)   FT 1/1: MISS DeMar McCollum makes 0/1 from the line. Rebound secured by Anfernee Jordan.
Score: 51-35

[05:30] Team_003 possession (Score: 51-35)
Collin Mitchell attempts a 3Pt. Contested by Cade Beal (4.6 feet, ZONE). Collin Mitchell misses. Rebound secured by Gary Davis.

[05:14] Team_095 possession (Score: 51-35)
Gary Davis attempts a 3Pt. Contested by Miles Towns (5.1 feet, ZONE). Gary Davis misses. Rebound secured by Bam Gilgeous-Alexander.

[04:58] Team_003 possession (Score: 51-35)
Anfernee Jordan drives, picks up DeMar McCollum. Help arrives from Kyle Poole! Anfernee Jordan attempts a Dunk. Contested by Kyle Poole (4.7 feet, ZONE). ANFERNEE JORDAN MAKES IT! Assist: Miles Towns
Score: 53-35

[04:42] Team_095 possession (Score: 53-35)
Gary Davis drives, Bam Gilgeous-Alexander stays with him. Gary Davis attempts a Dunk. Contested by Bam Gilgeous-Alexander (2.8 feet, ZONE). Gary Davis misses. Rebound secured by Collin Mitchell.

[04:28] Team_003 possession (Score: 53-35)
Pau Williamson makes the Midrange and draws the foul on Cade Beal! And-1! Pau Williamson to the line for 1. [Team fouls: 4] (Cade Beal: 1 personal fouls)   FT 1/1: GOOD Pau Williamson makes 1/1 from the line.
Score: 56-35

[04:15] Team_095 possession (Score: 56-35)
DeMar McCollum makes the Dunk and draws the foul on Bam Gilgeous-Alexander! And-1! DeMar McCollum to the line for 1. [Team fouls: 2] (Bam Gilgeous-Alexander: 1 personal fouls)   FT 1/1: GOOD DeMar McCollum makes 1/1 from the line.
Score: 56-38

[04:04] Team_003 possession (Score: 56-38)
Miles Towns drives and kicks out. Bam Gilgeous-Alexander attempts a 3Pt. Contested by Cade Beal (4.4 feet, ZONE). Bam Gilgeous-Alexander misses. Rebound secured by Gary Davis.

[03:53] Team_095 possession (Score: 56-38)
Tobias Wagner attempts a 3Pt. Contested by Miles Towns (5.6 feet, ZONE). Tobias Wagner misses. Rebound secured by Anfernee Jordan.

[03:39] Team_003 possession (Score: 56-38)
Miles Towns attempts a Midrange. Contested by Cade Beal (4.3 feet, ZONE). Miles Towns misses. Rebound secured by Gary Davis.

[03:29] Team_095 possession (Score: 56-38)
DeMar McCollum attempts a Layup. Contested by Anfernee Jordan (5.0 feet, ZONE). DEMAR MCCOLLUM MAKES IT! Assist: Gary Davis
Score: 56-40

[03:10] Team_003 possession (Score: 56-40)
Collin Mitchell drives, DeMar McCollum stays with him. Collin Mitchell attempts a Dunk. Contested by DeMar McCollum (5.1 feet, ZONE). Collin Mitchell misses. Rebound secured by DeMar McCollum.

[03:00] Team_095 possession (Score: 56-40)
FOUL! Holding foul on Pau Williamson. [Team fouls: 3] No free throws, side out. (Pau Williamson: 2 personal fouls)

[02:45] Team_095 possession (Score: 56-40)
Tobias Wagner attempts a 3Pt. Contested by Miles Towns (5.6 feet, ZONE). TOBIAS WAGNER MAKES IT! Assist: Gary Davis
Score: 56-43

[02:33] Team_003 possession (Score: 56-43)
Bam Gilgeous-Alexander attempts a Layup. Contested by DeMar McCollum (5.6 feet, ZONE). BAM GILGEOUS-ALEXANDER MAKES IT! Assist: Miles Towns
Score: 58-43

[02:14] Team_095 possession (Score: 58-43)
FOUL! Shooting foul on Miles Towns. Kyle Poole to the line for 2 free throws. [Team fouls: 4] (Miles Towns: 1 personal fouls)   FT 1/2: GOOD   FT 2/2: GOOD Kyle Poole makes 2/2 from the line.
Score: 58-45

[02:02] Team_003 possession (Score: 58-45)
Bam Gilgeous-Alexander drives to the basket... FOUL! Offensive foul on Bam Gilgeous-Alexander! DeMar McCollum drew the charge! [Team fouls: 5] (Bam Gilgeous-Alexander: 2 personal fouls) TURNOVER! (dead ball)

[01:53] Team_095 possession (Score: 58-45)
Kyle Poole attempts a 3Pt. Contested by Miles Towns (5.6 feet, MAN). KYLE POOLE MAKES IT! Assist: Gary Davis
Score: 58-48

[01:37] Team_003 possession (Score: 58-48)
FOUL! Shooting foul on DeMar McCollum. Miles Towns to the line for 2 free throws. [BONUS: 5 team fouls] (DeMar McCollum: 1 personal fouls)   FT 1/2: GOOD   FT 2/2: GOOD Miles Towns makes 2/2 from the line.
Score: 60-48

[01:26] Team_095 possession (Score: 60-48)
Tobias Wagner drives to the basket... Tobias Wagner commits a violation (traveling/carry)! TURNOVER! (dead ball)

[01:09] Team_003 possession (Score: 60-48)
Collin Mitchell attempts a Midrange. Contested by Tobias Wagner (4.0 feet, MAN). COLLIN MITCHELL MAKES IT! Assist: Pau Williamson
Score: 62-48

[00:55] Team_095 possession (Score: 62-48)
Tobias Wagner attempts a 3Pt. Contested by Miles Towns (5.6 feet, ZONE). Tobias Wagner misses. Rebound secured by Bam Gilgeous-Alexander.

[00:35] Team_003 possession (Score: 62-48)
Bam Gilgeous-Alexander drives to the basket... Bam Gilgeous-Alexander throws a bad pass! Stolen by DeMar McCollum! TURNOVER! (live ball)

[00:21] Team_095 possession (Score: 62-48)
Kyle Poole attempts a 3Pt. Contested by Miles Towns (5.6 feet, ZONE). Kyle Poole misses. Rebound secured by Collin Mitchell.

[00:05] Team_003 possession (Score: 62-48)
Miles Towns attempts a 3Pt. Contested by Kyle Poole (4.6 feet, MAN). Miles Towns misses. Rebound secured by DeMar McCollum.

================================================================================
                              2ND QUARTER COMPLETE                              
================================================================================

2ND QUARTER SCORE: Team_003 24, Team_095 27

BOX SCORE:
================================================================================

Team_003
--------------------------------------------------------------------------------
Player                MIN  PTS  REB  AST  TO      FG   FG%      3P   3P%
--------------------------------------------------------------------------------
Pau Williamson          6    6    0    1   0   2/2   100.0     0/0   0.0
Nikola Bryant          18    5    0    0   0   2/4    50.0     0/0   0.0
Giannis Turner         18    3    1    0   0   1/2    50.0     0/0   0.0
Victor O'Neal          18    2    1    0   0   1/2    50.0     0/0   0.0
Bam Gilgeous-Alexander    6    2    3    0   0   1/1   100.0     0/0   0.0
Collin Mitchell         6    2    2    1   0   1/3    33.3     0/0   0.0
Anfernee Jordan         6    2    2    0   0   1/1   100.0     0/0   0.0
Miles Towns             6    2    0    2   0   1/4    25.0     0/0   0.0
Rudy Haliburton        18    0    3    1   0   0/1     0.0     0/0   0.0
Ayo Jackson            18    0    0    0   0   0/1     0.0     0/0   0.0

TEAM: FG: 10/21 (47.6%), 3PT: 2/5 (40.0%), REB: 11 (1 off, 10 def), AST: 5, TO: 3
TEAM FOULS: 5 [Team_095 in BONUS]


Team_095
--------------------------------------------------------------------------------
Player                MIN  PTS  REB  AST  TO      FG   FG%      3P   3P%
--------------------------------------------------------------------------------
DeMar McCollum          6    5    2    0   0   2/3    66.7     0/0   0.0
Kyle Poole              6    5    0    0   0   2/3    66.7     0/0   0.0
Kyrie Ming             18    4    0    0   0   2/2   100.0     0/0   0.0
Evan Carter            18    3    4    0   0   1/2    50.0     0/0   0.0
Dejounte Hyland        18    3    0    0   0   1/3    33.3     0/0   0.0
Tobias Wagner           6    3    0    0   0   1/4    25.0     0/0   0.0
Immanuel Middleton     18    2    0    1   0   1/3    33.3     0/0   0.0
Shaquille Ball         18    0    3    2   0   0/0     0.0     0/0   0.0
Gary Davis              6    0    3    3   0   0/2     0.0     0/0   0.0

TEAM: FG: 10/22 (45.5%), 3PT: 4/11 (36.4%), REB: 13 (2 off, 11 def), AST: 6, TO: 1
TEAM FOULS: 5 [Team_003 in BONUS]

================================================================================

================================================================================
                       3RD QUARTER - Team_003 vs Team_095                       
================================================================================

[12:00] Team_003 possession (Score: 62-48)
FOUL! Holding foul on Kyrie Ming. [Team fouls: 1] No free throws, side out. (Kyrie Ming: 1 personal fouls)

[11:43] Team_003 possession (Score: 62-48)
Giannis Turner attempts a 3Pt. Contested by Evan Carter (4.1 feet, ZONE). Giannis Turner misses. Offensive rebound by Rudy Haliburton! Rudy Haliburton's putback is no good. Rebound secured by Evan Carter.

[11:26] Team_095 possession (Score: 62-48)
Kyrie Ming attempts a Midrange. Contested by Victor O'Neal (4.4 feet, ZONE). KYRIE MING MAKES IT! Assist: Evan Carter
Score: 62-50

[11:10] Team_003 possession (Score: 62-50)
FOUL! Shooting foul on Evan Carter. Rudy Haliburton to the line for 3 free throws. [Team fouls: 2] (Evan Carter: 1 personal fouls)   FT 1/3: GOOD   FT 2/3: MISS   FT 3/3: GOOD Rudy Haliburton makes 2/3 from the line.
Score: 64-50

[10:54] Team_095 possession (Score: 64-50)
Kyrie Ming attempts a Midrange. Contested by Nikola Bryant (4.2 feet, ZONE). KYRIE MING MAKES IT! Assist: Immanuel Middleton
Score: 64-52

[10:37] Team_003 possession (Score: 64-52)
Nikola Bryant drives to the basket... FOUL! Offensive foul on Nikola Bryant! Shaquille Ball drew the charge! [Team fouls: 1] (Nikola Bryant: 1 personal fouls) TURNOVER! (dead ball)

[10:22] Team_095 possession (Score: 64-52)
Evan Carter drives, picks up Rudy Haliburton. Help arrives from Nikola Bryant! Evan Carter attempts a Dunk. Contested by Nikola Bryant (3.5 feet, MAN). EVAN CARTER MAKES IT!
Score: 64-54

[10:09] Team_003 possession (Score: 64-54)
Victor O'Neal attempts a Midrange. Contested by Immanuel Middleton (4.8 feet, ZONE). VICTOR O'NEAL MAKES IT!
Score: 66-54

[09:53] Team_095 possession (Score: 66-54)
Kyrie Ming attempts a 3Pt. Contested by Giannis Turner (3.0 feet, ZONE). Kyrie Ming misses. Rebound secured by Rudy Haliburton.

[09:39] Team_003 possession (Score: 66-54)
FOUL! Shooting foul on Evan Carter. Rudy Haliburton to the line for 3 free throws. [Team fouls: 3] (Evan Carter: 2 personal fouls)   FT 1/3: GOOD   FT 2/3: MISS   FT 3/3: GOOD Rudy Haliburton makes 2/3 from the line.
Score: 68-54

[09:27] Team_095 possession (Score: 68-54)
Immanuel Middleton drives and kicks out. Shaquille Ball attempts a Midrange. Contested by Rudy Haliburton (3.3 feet, ZONE). Shaquille Ball misses. Offensive rebound by Evan Carter! Evan Carter puts it back in!
Score: 68-56

[09:11] Team_003 possession (Score: 68-56)
Giannis Turner attempts a Midrange. Contested by Immanuel Middleton (5.1 feet, MAN). Giannis Turner misses. Offensive rebound by Victor O'Neal! Victor O'Neal kicks it out.

[08:55] Team_003 possession (Score: 68-56)
Nikola Bryant drives, Shaquille Ball stays with him. Nikola Bryant attempts a Layup. Contested by Shaquille Ball (4.6 feet, MAN). NIKOLA BRYANT MAKES IT!
Score: 70-56

[08:41] Team_095 possession (Score: 70-56)
Shaquille Ball attempts a 3Pt. Contested by Nikola Bryant (4.0 feet, MAN). Shaquille Ball misses. Rebound secured by Victor O'Neal.

[08:28] Team_003 possession (Score: 70-56)
Ayo Jackson attempts a 3Pt. Contested by Dejounte Hyland (5.2 feet, MAN). Ayo Jackson misses. Rebound secured by Evan Carter.

[08:13] Team_095 possession (Score: 70-56)
Immanuel Middleton attempts a 3Pt. Contested by Giannis Turner (2.8 feet, ZONE). Immanuel Middleton misses. Rebound secured by Victor O'Neal.

[07:57] Team_003 possession (Score: 70-56)
FOUL! Shooting foul on Evan Carter. Ayo Jackson to the line for 3 free throws. [Team fouls: 4] (Evan Carter: 3 personal fouls)   FT 1/3: GOOD   FT 2/3: GOOD   FT 3/3: GOOD Ayo Jackson makes 3/3 from the line.
Score: 73-56

[07:39] Team_095 possession (Score: 73-56)
Shaquille Ball makes the Midrange and draws the foul on Nikola Bryant! And-1! Shaquille Ball to the line for 1. [Team fouls: 2] (Nikola Bryant: 2 personal fouls)   FT 1/1: GOOD Shaquille Ball makes 1/1 from the line.
Score: 73-59

[07:24] Team_003 possession (Score: 73-59)
Nikola Bryant attempts a Midrange. Contested by Shaquille Ball (4.6 feet, ZONE). Nikola Bryant misses. Offensive rebound by Victor O'Neal! Victor O'Neal kicks it out.

[07:08] Team_003 possession (Score: 73-59)
FOUL! Shooting foul on Evan Carter. Rudy Haliburton to the line for 2 free throws. [BONUS: 5 team fouls] (Evan Carter: 4 personal fouls)   FT 1/2: GOOD   FT 2/2: GOOD Rudy Haliburton makes 2/2 from the line.
Score: 75-59

[06:54] Team_095 possession (Score: 75-59)
Kyrie Ming drives to the basket... Kyrie Ming loses control! Ball rolls out of bounds! TURNOVER! (dead ball)

[06:40] Team_003 possession (Score: 75-59)
Rudy Haliburton attempts a 3Pt. Contested by Evan Carter (3.9 feet, MAN). Rudy Haliburton misses. Rebound secured by Evan Carter.

[06:25] Team_095 possession (Score: 75-59)
Evan Carter attempts a 3Pt. Contested by Rudy Haliburton (3.5 feet, MAN). Evan Carter misses. Rebound secured by Giannis Turner.

[06:13] Team_003 possession (Score: 75-59)
Victor O'Neal throws a bad pass! Stolen by Kyrie Ming! TURNOVER! (live ball)

[05:58] Team_095 possession (Score: 75-59)
Shaquille Ball attempts a Midrange. Contested by Nikola Bryant (4.0 feet, MAN). SHAQUILLE BALL MAKES IT!
Score: 75-61

[05:41] Team_003 possession (Score: 75-61)
Rudy Haliburton throws a bad pass! Stolen by Evan Carter! TURNOVER! (live ball)

[05:24] Team_095 possession (Score: 75-61)
Kyrie Ming attempts a Midrange. Contested by Giannis Turner (3.0 feet, MAN). KYRIE MING MAKES IT! Assist: Dejounte Hyland
Score: 75-63

[05:12] Team_003 possession (Score: 75-63)
Nikola Bryant attempts a 3Pt. Contested by Evan Carter (4.1 feet, ZONE). Nikola Bryant misses. Rebound secured by Evan Carter.

[04:59] Team_095 possession (Score: 75-63)
Shaquille Ball makes the Layup and draws the foul on Giannis Turner! And-1! Shaquille Ball to the line for 1. [Team fouls: 3] (Giannis Turner: 1 personal fouls)   FT 1/1: GOOD Shaquille Ball makes 1/1 from the line.
Score: 75-66

[04:41] Team_003 possession (Score: 75-66)
Ayo Jackson drives, picks up Dejounte Hyland. Help arrives from Evan Carter! Ayo Jackson attempts a Dunk. Contested by Evan Carter (5.2 feet, MAN). AYO JACKSON MAKES IT! Assist: Giannis Turner
Score: 77-66

[04:25] Team_095 possession (Score: 77-66)
Immanuel Middleton attempts a Midrange. Contested by Giannis Turner (2.8 feet, MAN). Immanuel Middleton misses. Rebound secured by Giannis Turner.

[04:12] Team_003 possession (Score: 77-66)
Rudy Haliburton attempts a Midrange. Contested by Evan Carter (3.9 feet, MAN). Rudy Haliburton misses. Rebound secured by Dejounte Hyland.

[03:53] Team_095 possession (Score: 77-66)
Immanuel Middleton attempts a Layup. Contested by Giannis Turner (2.9 feet, MAN). IMMANUEL MIDDLETON MAKES IT! Assist: Evan Carter
Score: 77-68

[03:40] Team_003 possession (Score: 77-68)
Giannis Turner makes the Layup and draws the foul on Immanuel Middleton! And-1! Giannis Turner to the line for 1. [BONUS: 6 team fouls] (Immanuel Middleton: 1 personal fouls)   FT 1/1: GOOD Giannis Turner makes 1/1 from the line.
Score: 80-68

[03:27] Team_095 possession (Score: 80-68)
Immanuel Middleton attempts a 3Pt. Contested by Giannis Turner (2.9 feet, MAN). Immanuel Middleton misses. Rebound secured by Victor O'Neal.

[03:14] Team_003 possession (Score: 80-68)
Ayo Jackson throws a bad pass out of bounds! TURNOVER! (dead ball)

[03:02] Team_095 possession (Score: 80-68)
Immanuel Middleton drives and kicks out. Shaquille Ball attempts a 3Pt. Contested by Nikola Bryant (4.2 feet, MAN). Shaquille Ball misses. Rebound secured by Giannis Turner.

[02:46] Team_003 possession (Score: 80-68)
Rudy Haliburton attempts a Midrange. Contested by Shaquille Ball (4.5 feet, ZONE). Rudy Haliburton misses. Rebound secured by Shaquille Ball.

[02:31] Team_095 possession (Score: 80-68)
FOUL! Holding foul on Nikola Bryant. [Team fouls: 4] No free throws, side out. (Nikola Bryant: 3 personal fouls)

[02:18] Team_095 possession (Score: 80-68)
Dejounte Hyland attempts a 3Pt. Contested by Ayo Jackson (5.5 feet, MAN). Dejounte Hyland misses. Rebound secured by Rudy Haliburton.

[02:00] Team_003 possession (Score: 80-68)
Nikola Bryant attempts a 3Pt. Contested by Shaquille Ball (4.8 feet, MAN). NIKOLA BRYANT MAKES IT! Assist: Ayo Jackson
Score: 83-68

[01:41] Team_095 possession (Score: 83-68)
Evan Carter attempts a Layup. Contested by Rudy Haliburton (3.7 feet, MAN). EVAN CARTER MAKES IT! Assist: Immanuel Middleton
Score: 83-70

[01:25] Team_003 possession (Score: 83-70)
Nikola Bryant attempts a Midrange. Contested by Shaquille Ball (4.8 feet, MAN). NIKOLA BRYANT MAKES IT! Assist: Rudy Haliburton
Score: 85-70

[01:14] Team_095 possession (Score: 85-70)
FOUL! Reach-in foul on Victor O'Neal during the drive. [IN THE BONUS! 5 team fouls] Immanuel Middleton to the line for 2 free throws. (Victor O'Neal: 1 personal fouls)   FT 1/2: GOOD   FT 2/2: MISS Immanuel Middleton makes 1/2 from the line. Offensive rebound by Evan Carter! Evan Carter puts it back in!
Score: 85-73

[01:00] Team_003 possession (Score: 85-73)
Ayo Jackson attempts a Layup. Contested by Dejounte Hyland (5.5 feet, MAN). AYO JACKSON MAKES IT! Assist: Rudy Haliburton
Score: 87-73

[00:46] Team_095 possession (Score: 87-73)
Evan Carter attempts a 3Pt. Contested by Rudy Haliburton (3.8 feet, MAN). Evan Carter misses. Rebound secured by Victor O'Neal.

[00:31] Team_003 possession (Score: 87-73)
Ayo Jackson drives and kicks out. Ayo Jackson attempts a Midrange. Contested by Evan Carter (4.3 feet, ZONE). Ayo Jackson misses. Rebound secured by Shaquille Ball.

[00:20] Team_095 possession (Score: 87-73)
FOUL! Holding foul on Ayo Jackson. [IN THE BONUS! 6 team fouls] Dejounte Hyland to the line for 2 free throws. (Ayo Jackson: 1 personal fouls)   FT 1/2: GOOD   FT 2/2: GOOD Dejounte Hyland makes 2/2 from the line.
Score: 87-75

[00:08] Team_003 possession (Score: 87-75)
Ayo Jackson loses the ball! Stripped by Dejounte Hyland! TURNOVER! (live ball)

================================================================================
                              3RD QUARTER COMPLETE                              
================================================================================

3RD QUARTER SCORE: Team_003 25, Team_095 27

BOX SCORE:
================================================================================

Team_003
--------------------------------------------------------------------------------
Player                MIN  PTS  REB  AST  TO      FG   FG%      3P   3P%
--------------------------------------------------------------------------------
Nikola Bryant          30    7    0    0   0   3/4    75.0     0/0   0.0
Ayo Jackson            30    7    0    1   0   3/5    60.0     0/0   0.0
Rudy Haliburton        30    6    2    2   0   3/6    50.0     0/0   0.0
Giannis Turner         30    3    3    1   0   1/2    50.0     0/0   0.0
Victor O'Neal          30    2    6    0   0   1/1   100.0     0/0   0.0

TEAM: FG: 11/18 (61.1%), 3PT: 4/8 (50.0%), REB: 12 (3 off, 9 def), AST: 4, TO: 5
TEAM FOULS: 6 [Team_095 in BONUS]


Team_095
--------------------------------------------------------------------------------
Player                MIN  PTS  REB  AST  TO      FG   FG%      3P   3P%
--------------------------------------------------------------------------------
Evan Carter            30    9    5    2   0   4/6    66.7     0/0   0.0
Shaquille Ball         30    8    2    0   0   3/4    75.0     0/0   0.0
Kyrie Ming             30    6    0    0   0   3/4    75.0     0/0   0.0
Immanuel Middleton     30    2    0    2   0   1/5    20.0     0/0   0.0
Dejounte Hyland        30    2    1    1   0   1/2    50.0     0/0   0.0

TEAM: FG: 12/21 (57.1%), 3PT: 0/7 (0.0%), REB: 7 (1 off, 6 def), AST: 5, TO: 1
TEAM FOULS: 6 [Team_003 in BONUS]

================================================================================

================================================================================
                       4TH QUARTER - Team_003 vs Team_095                       
================================================================================

[12:00] Team_003 possession (Score: 87-75)
Nikola Bryant attempts a Layup. Contested by Shaquille Ball (4.8 feet, MAN). NIKOLA BRYANT MAKES IT! Assist: Giannis Turner
Score: 89-75

[11:48] Team_095 possession (Score: 89-75)
Immanuel Middleton drives, Giannis Turner stays with him. Immanuel Middleton attempts a Layup. Contested by Giannis Turner (3.1 feet, ZONE). Immanuel Middleton misses. Rebound secured by Rudy Haliburton.

[11:35] Team_003 possession (Score: 89-75)
Rudy Haliburton drives and kicks out. Ayo Jackson attempts a 3Pt. Contested by Dejounte Hyland (5.2 feet, MAN). Ayo Jackson misses. Offensive rebound by Rudy Haliburton! Rudy Haliburton kicks it out.

[11:23] Team_003 possession (Score: 89-75)
Nikola Bryant attempts a 3Pt. Contested by Shaquille Ball (4.9 feet, MAN). Nikola Bryant misses. Rebound secured by Evan Carter.

[11:06] Team_095 possession (Score: 89-75)
FOUL! Reach-in foul on Giannis Turner during the drive. [Team fouls: 1] No free throws, side out. (Giannis Turner: 1 personal fouls)

[10:53] Team_095 possession (Score: 89-75)
Evan Carter drives, Rudy Haliburton stays with him. Evan Carter attempts a Dunk. Contested by Rudy Haliburton (3.8 feet, MAN). EVAN CARTER MAKES IT! Assist: Kyrie Ming
Score: 89-77

[10:42] Team_003 possession (Score: 89-77)
Ayo Jackson attempts a Layup. Contested by Immanuel Middleton (5.6 feet, ZONE). AYO JACKSON MAKES IT! Assist: Victor O'Neal
Score: 91-77

[10:28] Team_095 possession (Score: 91-77)
Shaquille Ball attempts a Layup. Contested by Giannis Turner (3.3 feet, ZONE). SHAQUILLE BALL MAKES IT! Assist: Dejounte Hyland
Score: 91-79

[10:14] Team_003 possession (Score: 91-79)
Rudy Haliburton drives to the basket... Rudy Haliburton loses the ball! Stripped by Immanuel Middleton! TURNOVER! (live ball)

[09:59] Team_095 possession (Score: 91-79)
FOUL! Holding foul on Ayo Jackson. [Team fouls: 2] No free throws, side out. (Ayo Jackson: 1 personal fouls)

[09:47] Team_095 possession (Score: 91-79)
Kyrie Ming drives and kicks out. Shaquille Ball attempts a Midrange. Contested by Nikola Bryant (4.6 feet, MAN). SHAQUILLE BALL MAKES IT!
Score: 91-81

[09:33] Team_003 possession (Score: 91-81)
FOUL! Shooting foul on Evan Carter. Giannis Turner to the line for 3 free throws. [Team fouls: 1] (Evan Carter: 1 personal fouls)   FT 1/3: GOOD   FT 2/3: GOOD   FT 3/3: GOOD Giannis Turner makes 3/3 from the line.
Score: 94-81

[09:17] Team_095 possession (Score: 94-81)
Shaquille Ball attempts a 3Pt. Contested by Giannis Turner (3.5 feet, ZONE). SHAQUILLE BALL MAKES IT! Assist: Dejounte Hyland
Score: 94-84

[09:03] Team_003 possession (Score: 94-84)
FOUL! Shooting foul on Kyrie Ming. Victor O'Neal to the line for 2 free throws. [Team fouls: 2] (Kyrie Ming: 1 personal fouls)   FT 1/2: GOOD   FT 2/2: MISS Victor O'Neal makes 1/2 from the line. Rebound secured by Evan Carter.
Score: 95-84

[08:50] Team_095 possession (Score: 95-84)
Shaquille Ball attempts a 3Pt. Contested by Nikola Bryant (4.6 feet, MAN). Shaquille Ball misses. Rebound secured by Rudy Haliburton.

[08:34] Team_003 possession (Score: 95-84)
Ayo Jackson attempts a 3Pt. Contested by Dejounte Hyland (5.7 feet, MAN). Ayo Jackson misses. Rebound secured by Dejounte Hyland.

[08:22] Team_095 possession (Score: 95-84)
Evan Carter attempts a 3Pt. Contested by Rudy Haliburton (4.1 feet, MAN). Evan Carter misses. Rebound secured by Rudy Haliburton.

[08:10] Team_003 possession (Score: 95-84)
Rudy Haliburton attempts a Midrange. Contested by Evan Carter (4.6 feet, MAN). RUDY HALIBURTON MAKES IT! Assist: Ayo Jackson
Score: 97-84

[07:58] Team_095 possession (Score: 97-84)
Immanuel Middleton attempts a Midrange. Contested by Giannis Turner (3.7 feet, MAN). Immanuel Middleton misses. Rebound secured by Rudy Haliburton.

[07:42] Team_003 possession (Score: 97-84)
Nikola Bryant makes the Layup and draws the foul on Shaquille Ball! And-1! Nikola Bryant to the line for 1. [Team fouls: 3] (Shaquille Ball: 1 personal fouls)   FT 1/1: GOOD Nikola Bryant makes 1/1 from the line.
Score: 100-84

[07:27] Team_095 possession (Score: 100-84)
Immanuel Middleton attempts a Midrange. Contested by Giannis Turner (3.7 feet, MAN). Immanuel Middleton misses. Rebound secured by Giannis Turner.

[07:08] Team_003 possession (Score: 100-84)
Ayo Jackson attempts a 3Pt. Contested by Evan Carter (5.0 feet, ZONE). Ayo Jackson misses. Rebound secured by Dejounte Hyland.

[06:52] Team_095 possession (Score: 100-84)
Immanuel Middleton attempts a Midrange. Contested by Nikola Bryant (4.9 feet, ZONE). IMMANUEL MIDDLETON MAKES IT! Assist: Evan Carter
Score: 100-86

[06:40] Team_003 possession (Score: 100-86)
Victor O'Neal attempts a Midrange. Contested by Kyrie Ming (6.0 feet, MAN). Victor O'Neal misses. Rebound secured by Shaquille Ball.

[06:23] Team_095 possession (Score: 100-86)
Dejounte Hyland attempts a 3Pt. Contested by Giannis Turner (3.9 feet, ZONE). DEJOUNTE HYLAND MAKES IT! Assist: Kyrie Ming
Score: 100-89

[06:06] Team_003 possession (Score: 100-89)
Nikola Bryant attempts a Midrange. Wide open! Dejounte Hyland is 6.0 feet away. [ZONE] NIKOLA BRYANT MAKES IT!
Score: 102-89

[05:51] Team_095 possession (Score: 102-89)
Dejounte Hyland attempts a 3Pt. Contested by Giannis Turner (4.0 feet, ZONE). Dejounte Hyland misses. Rebound secured by Rudy Haliburton.

[05:40] Team_003 possession (Score: 102-89)
Ayo Jackson attempts a Midrange. Wide open! Dejounte Hyland is 6.1 feet away. [MAN] Ayo Jackson misses. Rebound secured by Evan Carter.

[05:22] Team_095 possession (Score: 102-89)
Shaquille Ball attempts a 3Pt. Contested by Giannis Turner (4.1 feet, ZONE). Shaquille Ball misses. Rebound secured by Rudy Haliburton.

[05:10] Team_003 possession (Score: 102-89)
Ayo Jackson attempts a 3Pt. Contested by Shaquille Ball (5.6 feet, ZONE). Ayo Jackson misses. Rebound secured by Evan Carter.

[04:54] Team_095 possession (Score: 102-89)
Shaquille Ball drives, picks up Giannis Turner. Help arrives from Nikola Bryant! Shaquille Ball attempts a Dunk. Contested by Nikola Bryant (4.2 feet, ZONE). Shaquille Ball misses. Offensive rebound by Evan Carter! Evan Carter kicks it out.

[04:40] Team_095 possession (Score: 102-89)
Dejounte Hyland drives to the basket... Dejounte Hyland throws a bad pass out of bounds! TURNOVER! (dead ball)

[04:40] Substitution (Team_003): Ayo Jackson OUT → Miles Towns IN (stamina_rule2)

[04:40] Substitution (Team_003): Nikola Bryant OUT → Pau Williamson IN (stamina_rule2)

[04:40] Substitution (Team_003): Rudy Haliburton OUT → Collin Mitchell IN (stamina_rule2)

[04:40] Substitution (Team_003): Giannis Turner OUT → Anfernee Jordan IN (stamina_rule2)

[04:40] Substitution (Team_003): Victor O'Neal OUT → Bam Gilgeous-Alexander IN (stamina_rule2)

[04:40] Substitution (Team_095): Dejounte Hyland OUT → Kyle Poole IN (stamina_rule2)

[04:40] Substitution (Team_095): Shaquille Ball OUT → Cade Beal IN (stamina_rule2)

[04:40] Substitution (Team_095): Evan Carter OUT → Tobias Wagner IN (stamina_rule2)

[04:40] Substitution (Team_095): Immanuel Middleton OUT → Gary Davis IN (stamina_rule2)

[04:40] Substitution (Team_095): Kyrie Ming OUT → DeMar McCollum IN (stamina_rule2)

[04:27] Team_003 possession (Score: 102-89)
FOUL! Reach-in foul on DeMar McCollum during the drive. [Team fouls: 4] No free throws, side out. (DeMar McCollum: 1 personal fouls)

[04:09] Team_003 possession (Score: 102-89)
Bam Gilgeous-Alexander attempts a 3Pt. Contested by Cade Beal (5.1 feet, ZONE). Bam Gilgeous-Alexander misses. Rebound secured by Tobias Wagner.

[03:52] Team_095 possession (Score: 102-89)
DeMar McCollum attempts a 3Pt. Contested by Miles Towns (5.8 feet, ZONE). DeMar McCollum misses. Rebound secured by Bam Gilgeous-Alexander.

[03:35] Team_003 possession (Score: 102-89)
Bam Gilgeous-Alexander makes the Layup and draws the foul on DeMar McCollum! And-1! Bam Gilgeous-Alexander to the line for 1. [BONUS: 5 team fouls] (DeMar McCollum: 2 personal fouls)   FT 1/1: GOOD Bam Gilgeous-Alexander makes 1/1 from the line.
Score: 105-89

[03:23] Team_095 possession (Score: 105-89)
FOUL! Shooting foul on Miles Towns. Kyle Poole to the line for 2 free throws. [Team fouls: 3] (Miles Towns: 1 personal fouls)   FT 1/2: GOOD   FT 2/2: GOOD Kyle Poole makes 2/2 from the line.
Score: 105-91

[03:09] Team_003 possession (Score: 105-91)
Bam Gilgeous-Alexander attempts a Midrange. Contested by Tobias Wagner (4.5 feet, ZONE). Bam Gilgeous-Alexander misses. Rebound secured by DeMar McCollum.

[02:58] Team_095 possession (Score: 105-91)
Cade Beal attempts a Layup. Contested by Pau Williamson (5.1 feet, MAN). Cade Beal misses. Rebound secured by Anfernee Jordan.

[02:42] Team_003 possession (Score: 105-91)
Anfernee Jordan drives to the basket... FOUL! Offensive foul on Anfernee Jordan! DeMar McCollum drew the charge! [Team fouls: 4] (Anfernee Jordan: 1 personal fouls) TURNOVER! (dead ball)

[02:29] Team_095 possession (Score: 105-91)
DeMar McCollum drives, picks up Bam Gilgeous-Alexander. Help arrives from Pau Williamson! DeMar McCollum attempts a Layup. Contested by Pau Williamson (3.5 feet, MAN). DeMar McCollum misses. Offensive rebound by DeMar McCollum! DeMar McCollum kicks it out.

[02:14] Team_095 possession (Score: 105-91)
DeMar McCollum attempts a Midrange. Contested by Bam Gilgeous-Alexander (3.5 feet, ZONE). DeMar McCollum misses. Rebound secured by Bam Gilgeous-Alexander.

[02:04] Team_003 possession (Score: 105-91)
Anfernee Jordan attempts a Midrange. Contested by Gary Davis (5.3 feet, ZONE). Anfernee Jordan misses. Rebound secured by Tobias Wagner.

[01:49] Team_095 possession (Score: 105-91)
Cade Beal attempts a 3Pt. Contested by Pau Williamson (5.1 feet, MAN). Cade Beal misses. Rebound secured by Bam Gilgeous-Alexander.

[01:35] Team_003 possession (Score: 105-91)
Miles Towns makes the Layup and draws the foul on DeMar McCollum! And-1! Miles Towns to the line for 1. [BONUS: 6 team fouls] (DeMar McCollum: 3 personal fouls)   FT 1/1: GOOD Miles Towns makes 1/1 from the line.
Score: 108-91

[01:26] Team_095 possession (Score: 108-91)
Cade Beal attempts a 3Pt. Contested by Pau Williamson (5.1 feet, MAN). Cade Beal misses. Rebound secured by Collin Mitchell.

[01:11] Team_003 possession (Score: 108-91)
Miles Towns attempts a 3Pt. Contested by Cade Beal (4.3 feet, ZONE). Miles Towns misses. Rebound secured by DeMar McCollum.

[00:57] Team_095 possession (Score: 108-91)
Cade Beal attempts a 3Pt. Contested by Miles Towns (5.2 feet, ZONE). Cade Beal misses. Offensive rebound by DeMar McCollum! DeMar McCollum kicks it out.

[00:42] Team_095 possession (Score: 108-91)
Cade Beal drives and kicks out. DeMar McCollum makes the 3Pt and draws the foul on Miles Towns! And-1! DeMar McCollum to the line for 1. [BONUS: 5 team fouls] (Miles Towns: 2 personal fouls)   FT 1/1: GOOD DeMar McCollum makes 1/1 from the line.
Score: 108-95

[00:32] Team_003 possession (Score: 108-95)
Collin Mitchell loses the ball! Stripped by Tobias Wagner! TURNOVER! (live ball)

[00:20] Team_095 possession (Score: 108-95)
FOUL! Reach-in foul on Bam Gilgeous-Alexander during the drive. [IN THE BONUS! 6 team fouls] Gary Davis to the line for 2 free throws. (Bam Gilgeous-Alexander: 1 personal fouls)   FT 1/2: MISS   FT 2/2: MISS Gary Davis makes 0/2 from the line. FOUL! Loose ball foul on Collin Mitchell during the free throw rebound! [IN THE BONUS! 7 team fouls] DeMar McCollum to the line for 2 free throws. (Collin Mitchell: 1 personal fouls)   FT 1/2: GOOD   FT 2/2: GOOD DeMar McCollum makes 2/2 from the line.
Score: 108-97

[00:06] Team_003 possession (Score: 108-97)
FOUL! Shooting foul on Cade Beal. Pau Williamson to the line for 3 free throws. [BONUS: 7 team fouls] (Cade Beal: 1 personal fouls)   FT 1/3: MISS   FT 2/3: MISS   FT 3/3: GOOD Pau Williamson makes 1/3 from the line.
Score: 109-97

================================================================================
                              4TH QUARTER COMPLETE                              
================================================================================

4TH QUARTER SCORE: Team_003 22, Team_095 22

BOX SCORE:
================================================================================

Team_003
--------------------------------------------------------------------------------
Player                MIN  PTS  REB  AST  TO      FG   FG%      3P   3P%
--------------------------------------------------------------------------------
Nikola Bryant          38    7    0    0   0   3/4    75.0     0/0   0.0
Giannis Turner         38    3    1    1   0   1/1   100.0     0/0   0.0
Bam Gilgeous-Alexander   11    3    3    0   0   1/3    33.3     0/0   0.0
Miles Towns            11    3    0    0   0   1/2    50.0     0/0   0.0
Rudy Haliburton        38    2    7    0   0   1/1   100.0     0/0   0.0
Ayo Jackson            38    2    0    1   0   1/5    20.0     0/0   0.0
Pau Williamson         11    1    0    0   0   1/1   100.0     0/0   0.0
Victor O'Neal          38    0    0    1   0   0/2     0.0     0/0   0.0
Anfernee Jordan        11    0    1    0   0   0/1     0.0     0/0   0.0
Collin Mitchell        11    0    1    0   0   0/0     0.0     0/0   0.0

TEAM: FG: 9/20 (45.0%), 3PT: 2/8 (25.0%), REB: 13 (1 off, 12 def), AST: 3, TO: 3
TEAM FOULS: 7 [Team_095 in BONUS]


Team_095
--------------------------------------------------------------------------------
Player                MIN  PTS  REB  AST  TO      FG   FG%      3P   3P%
--------------------------------------------------------------------------------
Shaquille Ball         38    7    1    0   0   3/5    60.0     0/0   0.0
DeMar McCollum         11    6    4    0   0   2/4    50.0     0/0   0.0
Dejounte Hyland        38    3    2    2   0   1/2    50.0     0/0   0.0
Immanuel Middleton     38    2    0    0   0   1/4    25.0     0/0   0.0
Evan Carter            38    2    5    1   0   1/2    50.0     0/0   0.0
Kyle Poole             11    2    0    0   0   1/1   100.0     0/0   0.0
Kyrie Ming             38    0    0    2   0   0/0     0.0     0/0   0.0
Tobias Wagner          11    0    2    0   0   0/0     0.0     0/0   0.0
Cade Beal              11    0    0    0   0   0/3     0.0     0/0   0.0

TEAM: FG: 9/21 (42.9%), 3PT: 2/9 (22.2%), REB: 14 (3 off, 11 def), AST: 5, TO: 1
TEAM FOULS: 7 [Team_003 in BONUS]

================================================================================

================================================================================
                               FULL GAME COMPLETE                               
================================================================================

FINAL SCORE: Team_003 109, Team_095 97

SCORING BY QUARTER:
--------------------------------------------------------------------------------
Team                     Q1     Q2     Q3     Q4    FINAL
--------------------------------------------------------------------------------
Team_003                 38     24     25     22      109
Team_095                 21     27     27     22       97
--------------------------------------------------------------------------------

FULL GAME BOX SCORE:
================================================================================

Team_003
--------------------------------------------------------------------------------
Player                MIN  PTS  REB  AST  TO      FG   FG%      3P   3P%      FT STL BLK
--------------------------------------------------------------------------------
Ayo Jackson            38   18    0    3   4   8/17   47.1   1/6    16.7   4/4     0   0
Nikola Bryant          38   31    0    2   1  13/19   68.4   4/8    50.0   1/1     0   0
Rudy Haliburton        38   20   15    5   1   8/14   57.1   5/6    83.3  12/14    0   1
Giannis Turner         38   12    7    3   1   4/6    66.7   2/4    50.0   5/5     0   2
Victor O'Neal          38    6   14    1   1   3/7    42.9   0/0     0.0   3/4     0   0
Miles Towns            11    5    0    2   2   2/6    33.3   0/2     0.0   3/3     0   0
Pau Williamson         11    7    0    1   0   3/3   100.0   2/2   100.0   2/4     0   0
Collin Mitchell        11    2    3    1   2   1/3    33.3   0/1     0.0   0/0     0   0
Anfernee Jordan        11    2    3    0   0   1/2    50.0   0/0     0.0   0/0     0   0
Bam Gilgeous-Alexander   11    5    6    0   0   2/4    50.0   0/1     0.0   1/1     0   0

TEAM: FG: 45/81 (55.6%), 3PT: 14/30 (46.7%), REB: 47 (7 off, 40 def), AST: 18, TO: 12


Team_095
--------------------------------------------------------------------------------
Player                MIN  PTS  REB  AST  TO      FG   FG%      3P   3P%      FT STL BLK
--------------------------------------------------------------------------------
Dejounte Hyland        38   12    5    4   0   4/8    50.0   2/5    40.0   2/2     2   0
Shaquille Ball         38   24    9    2   1   9/15   60.0   2/6    33.3   2/2     0   0
Evan Carter            38   16   17    6   2   5/9    55.6   1/5    20.0   0/0     1   0
Immanuel Middleton     38    6    0    6   1   5/22   22.7   0/3     0.0   1/3     1   0
Kyrie Ming             38   14    0    2   1   8/9    88.9   0/1     0.0   2/2     1   0
Kyle Poole             11    7    0    0   0   3/4    75.0   1/2    50.0   4/4     0   0
Cade Beal              11    0    0    0   0   1/4    25.0   0/2     0.0   0/0     0   0
Tobias Wagner          11    3    2    0   1   1/4    25.0   1/4    25.0   0/0     1   0
Gary Davis             11    0    3    3   0   1/3    33.3   0/1     0.0   0/2     0   0
DeMar McCollum         11   11    6    0   0   2/5    40.0   0/1     0.0   2/3     1   0

TEAM: FG: 40/84 (47.6%), 3PT: 7/30 (23.3%), REB: 42 (7 off, 35 def), AST: 23, TO: 6

================================================================================
