================================================================================
                        FULL GAME - Team_029 vs Team_078                        
================================================================================

================================================================================
                       1ST QUARTER - Team_029 vs Team_078                       
================================================================================

[12:00] Team_029 possession (Score: 0-0)
FOUL! Reach-in foul on Jabari Barrett during the drive. [Team fouls: 1] No free throws, side out. (Jabari Barrett: 1 personal fouls)

[11:42] Team_029 possession (Score: 0-0)
Paul Iverson drives, picks up Jabari Barnes. Help arrives from Isaiah Simmons! Paul Iverson attempts a Dunk. Contested by Isaiah Simmons (4.1 feet, MAN). Paul Iverson misses. Rebound secured by Ben Ginobili.

[11:27] Team_078 possession (Score: 0-0)
Jabari Barnes drives to the basket... FOUL! Offensive foul on Jabari Barnes! Paul Iverson drew the charge! [Team fouls: 2] (Jabari Barnes: 1 personal fouls) TURNOVER! (dead ball)

[11:09] Team_029 possession (Score: 0-0)
Giannis Banchero attempts a 3Pt. Contested by Isaiah Simmons (3.6 feet, MAN). GIANNIS BANCHERO MAKES IT!
Score: 3-0

[10:53] Team_078 possession (Score: 3-0)
Kyrie Carter drives and kicks out. Kyrie Carter attempts a 3Pt. Contested by Scottie Bird (3.1 feet, MAN). Kyrie Carter misses. Rebound secured by Devin Butler.

[10:43] Team_029 possession (Score: 3-0)
James Wall attempts a Midrange. Contested by Kyrie Carter (4.4 feet, ZONE). JAMES WALL MAKES IT!
Score: 5-0

[10:32] Team_078 possession (Score: 5-0)
Isaiah Simmons attempts a Midrange. Contested by Giannis Banchero (3.7 feet, ZONE). Isaiah Simmons misses. Offensive rebound by Isaiah Simmons! Isaiah Simmons's putback is no good. Offensive rebound by Jabari Barrett! Jabari Barrett kicks it out.

[10:18] Team_078 possession (Score: 5-0)
Isaiah Simmons drives to the basket... Isaiah Simmons throws a bad pass! Stolen by Giannis Banchero! TURNOVER! (live ball)

[10:03] Team_029 possession (Score: 5-0)
Scottie Bird attempts a Midrange. Contested by Kyrie Carter (4.1 feet, MAN). Scottie Bird misses. Rebound secured by Ben Ginobili.

[09:53] Team_078 possession (Score: 5-0)
FOUL! Shooting foul on James Wall. Ben Ginobili to the line for 2 free throws. [Team fouls: 1] (James Wall: 1 personal fouls)   FT 1/2: MISS   FT 2/2: GOOD Ben Ginobili makes 1/2 from the line.
Score: 5-1

[09:41] Team_029 possession (Score: 5-1)
Devin Butler drives, Jabari Barrett stays with him. Devin Butler attempts a Dunk. Contested by Jabari Barrett (5.2 feet, ZONE). Devin Butler misses. Rebound secured by Ben Ginobili.

[09:29] Team_078 possession (Score: 5-1)
Ben Ginobili attempts a Layup. Contested by James Wall (2.9 feet, MAN). Ben Ginobili misses. Offensive rebound by Jabari Barrett! Jabari Barrett kicks it out.

[09:15] Team_078 possession (Score: 5-1)
Jabari Barrett drives to the basket... Jabari Barrett loses control! Ball rolls out of bounds! TURNOVER! (dead ball)

[09:01] Team_029 possession (Score: 5-1)
Paul Iverson attempts a Layup. Contested by Jabari Barnes (4.1 feet, MAN). Paul Iverson misses. Rebound secured by Isaiah Simmons.

[08:47] Team_078 possession (Score: 5-1)
FOUL! Shooting foul on Giannis Banchero. Isaiah Simmons to the line for 2 free throws. [Team fouls: 2] (Giannis Banchero: 1 personal fouls)   FT 1/2: GOOD   FT 2/2: GOOD Isaiah Simmons makes 2/2 from the line.
Score: 5-3

[08:34] Team_029 possession (Score: 5-3)
Scottie Bird attempts a 3Pt. Contested by Isaiah Simmons (3.4 feet, ZONE). SCOTTIE BIRD MAKES IT! Assist: Devin Butler
Score: 8-3

[08:19] Team_078 possession (Score: 8-3)
Jabari Barnes drives, Paul Iverson stays with him. Jabari Barnes attempts a Layup. Contested by Paul Iverson (4.7 feet, MAN). JABARI BARNES MAKES IT!
Score: 8-5

[08:00] Team_029 possession (Score: 8-5)
Devin Butler drives and kicks out. Paul Iverson attempts a Midrange. Contested by Ben Ginobili (4.6 feet, ZONE). PAUL IVERSON MAKES IT!
Score: 10-5

[07:45] Team_078 possession (Score: 10-5)
FOUL! Shooting foul on Devin Butler. Jabari Barrett to the line for 2 free throws. [Team fouls: 3] (Devin Butler: 1 personal fouls)   FT 1/2: MISS   FT 2/2: MISS Jabari Barrett makes 0/2 from the line. Rebound secured by Devin Butler.

[07:29] Team_029 possession (Score: 10-5)
Giannis Banchero attempts a Midrange. Contested by Isaiah Simmons (3.6 feet, ZONE). Giannis Banchero misses. Rebound secured by Isaiah Simmons.

[07:16] Team_078 possession (Score: 10-5)
Jabari Barnes attempts a Midrange. Contested by Giannis Banchero (4.0 feet, ZONE). Jabari Barnes misses. Rebound secured by James Wall.

[07:05] Team_029 possession (Score: 10-5)
Giannis Banchero attempts a 3Pt. Contested by Isaiah Simmons (3.6 feet, MAN). Giannis Banchero misses. Rebound secured by Jabari Barrett.

[06:48] Team_078 possession (Score: 10-5)
Jabari Barrett drives, James Wall stays with him. Jabari Barrett attempts a Dunk. Contested by James Wall (2.6 feet, ZONE). JABARI BARRETT MAKES IT!
Score: 10-7

[06:34] Team_029 possession (Score: 10-7)
James Wall drives, Ben Ginobili stays with him. James Wall attempts a Dunk. Contested by Ben Ginobili (5.2 feet, MAN). JAMES WALL MAKES IT!
Score: 12-7

[06:21] Team_078 possession (Score: 12-7)
Jabari Barnes attempts a Layup. Contested by James Wall (3.0 feet, ZONE). Jabari Barnes misses. Rebound secured by Giannis Banchero.

[06:10] Team_029 possession (Score: 12-7)
James Wall drives, Ben Ginobili stays with him. James Wall attempts a Layup. Contested by Ben Ginobili (5.2 feet, MAN). James Wall misses. Rebound secured by Jabari Barrett.

[05:54] Team_078 possession (Score: 12-7)
Jabari Barnes drives to the basket... FOUL! Offensive foul on Jabari Barnes! Paul Iverson drew the charge! [Team fouls: 3] (Jabari Barnes: 2 personal fouls) TURNOVER! (dead ball)

[05:37] Team_029 possession (Score: 12-7)
Devin Butler drives, picks up Jabari Barrett. Help arrives from Kyrie Carter! Devin Butler attempts a Dunk. Contested by Kyrie Carter (5.2 feet, MAN). Devin Butler misses. Offensive rebound by James Wall! James Wall puts it back in!
Score: 14-7

[05:22] Team_078 possession (Score: 14-7)
Kyrie Carter makes the 3Pt and draws the foul on Scottie Bird! And-1! Kyrie Carter to the line for 1. [Team fouls: 4] (Scottie Bird: 1 personal fouls)   FT 1/1: GOOD Kyrie Carter makes 1/1 from the line.
Score: 14-11

[05:10] Team_029 possession (Score: 14-11)
Devin Butler attempts a 3Pt. Contested by Jabari Barrett (5.2 feet, MAN). Devin Butler misses. Rebound secured by Jabari Barrett.

[04:52] Team_078 possession (Score: 14-11)
Isaiah Simmons attempts a 3Pt. Contested by Giannis Banchero (3.8 feet, ZONE). Isaiah Simmons misses. Rebound secured by Devin Butler.

[04:42] Team_029 possession (Score: 14-11)
James Wall attempts a 3Pt. Contested by Kyrie Carter (4.4 feet, ZONE). James Wall misses. Rebound secured by Jabari Barrett.

[04:29] Team_078 possession (Score: 14-11)
Jabari Barrett drives to the basket... Jabari Barrett throws a bad pass out of bounds! TURNOVER! (dead ball)

[04:13] Team_029 possession (Score: 14-11)
FOUL! Reach-in foul on Isaiah Simmons during the drive. [Team fouls: 4] No free throws, side out. (Isaiah Simmons: 1 personal fouls)

[03:59] Team_029 possession (Score: 14-11)
FOUL! Shooting foul on Jabari Barnes. Paul Iverson to the line for 2 free throws. [BONUS: 5 team fouls] (Jabari Barnes: 3 personal fouls)   FT 1/2: MISS   FT 2/2: GOOD Paul Iverson makes 1/2 from the line.
Score: 15-11

[03:41] Team_078 possession (Score: 15-11)
Jabari Barrett attempts a Midrange. Contested by Devin Butler (4.2 feet, MAN). Jabari Barrett misses. Offensive rebound by Isaiah Simmons! Isaiah Simmons's putback is no good. Offensive rebound by Jabari Barrett! Jabari Barrett kicks it out.

[03:23] Team_078 possession (Score: 15-11)
Isaiah Simmons makes the Dunk and draws the foul on Giannis Banchero! And-1! Isaiah Simmons to the line for 1. [BONUS: 6 team fouls] (Giannis Banchero: 3 personal fouls)   FT 1/1: GOOD Isaiah Simmons makes 1/1 from the line.
Score: 15-14

[03:11] Team_029 possession (Score: 15-14)
Devin Butler attempts a Midrange. Contested by Jabari Barrett (5.3 feet, MAN). DEVIN BUTLER MAKES IT! Assist: Scottie Bird
Score: 17-14

[02:57] Team_078 possession (Score: 17-14)
Jabari Barnes attempts a 3Pt. Contested by Paul Iverson (4.8 feet, MAN). Jabari Barnes misses. Offensive rebound by Isaiah Simmons! Isaiah Simmons puts it back in!
Score: 17-16

[02:43] Team_029 possession (Score: 17-16)
Giannis Banchero attempts a 3Pt. Contested by Isaiah Simmons (3.9 feet, ZONE). Giannis Banchero misses. Offensive rebound by James Wall! James Wall's putback is no good. Offensive rebound by Devin Butler! Devin Butler kicks it out.

[02:25] Team_029 possession (Score: 17-16)
Scottie Bird attempts a 3Pt. Contested by Isaiah Simmons (3.6 feet, ZONE). Scottie Bird misses. Rebound secured by Jabari Barrett.

[02:11] Team_078 possession (Score: 17-16)
Jabari Barnes attempts a 3Pt. Contested by Scottie Bird (3.8 feet, ZONE). Jabari Barnes misses. Rebound secured by Giannis Banchero.

[01:58] Team_029 possession (Score: 17-16)
Scottie Bird drives, picks up Kyrie Carter. Help arrives from Isaiah Simmons! Scottie Bird attempts a Layup. Contested by Isaiah Simmons (4.4 feet, MAN). SCOTTIE BIRD MAKES IT!
Score: 19-16

[01:44] Team_078 possession (Score: 19-16)
Kyrie Carter attempts a Midrange. Contested by Giannis Banchero (3.9 feet, ZONE). Kyrie Carter misses. Rebound secured by Giannis Banchero.

[01:30] Team_029 possession (Score: 19-16)
Scottie Bird attempts a Layup. Contested by Kyrie Carter (4.5 feet, MAN). SCOTTIE BIRD MAKES IT!
Score: 21-16

[01:12] Team_078 possession (Score: 21-16)
Jabari Barnes attempts a 3Pt. Contested by Giannis Banchero (4.4 feet, ZONE). Jabari Barnes misses. Rebound secured by James Wall.

[00:54] Team_029 possession (Score: 21-16)
Devin Butler drives, Jabari Barrett stays with him. Devin Butler attempts a Layup. Contested by Jabari Barrett (5.5 feet, ZONE). DEVIN BUTLER MAKES IT! Assist: Giannis Banchero
Score: 23-16

[00:38] Team_078 possession (Score: 23-16)
Jabari Barrett drives, picks up Devin Butler. Help arrives from Scottie Bird! Jabari Barrett attempts a Layup. Contested by Scottie Bird (4.6 feet, MAN). Jabari Barrett misses. Rebound secured by Giannis Banchero.

[00:26] Team_029 possession (Score: 23-16)
Scottie Bird attempts a Layup. Contested by Kyrie Carter (4.6 feet, MAN). SCOTTIE BIRD MAKES IT! Assist: James Wall
Score: 25-16

[00:10] Team_078 possession (Score: 25-16)
Jabari Barnes drives to the basket... Jabari Barnes throws a bad pass out of bounds! TURNOVER! (dead ball)

[00:10] Substitution (Team_029): Paul Iverson OUT → Immanuel Irving IN (stamina_rule2)

[00:10] Substitution (Team_029): Scottie Bird OUT → Bones Carter IN (stamina_rule2)

[00:10] Substitution (Team_029): Giannis Banchero OUT → Pau Anthony IN (stamina_rule2)

[00:10] Substitution (Team_029): James Wall OUT → Derrick Rozier IN (stamina_rule2)

[00:10] Substitution (Team_029): Devin Butler OUT → Shai Ball IN (stamina_rule2)

[00:10] Substitution (Team_078): Jabari Barnes OUT → Magic Barrett IN (stamina_rule2)

[00:10] Substitution (Team_078): Kyrie Carter OUT → Damian Allen IN (stamina_rule2)

[00:10] Substitution (Team_078): Isaiah Simmons OUT → Malcolm Randle IN (stamina_rule2)

[00:10] Substitution (Team_078): Ben Ginobili OUT → Paul Ming IN (stamina_rule2)

[00:10] Substitution (Team_078): Jabari Barrett OUT → Draymond Irving IN (stamina_rule2)

================================================================================
                              1ST QUARTER COMPLETE                              
================================================================================

1ST QUARTER SCORE: Team_029 25, Team_078 16

BOX SCORE:
================================================================================

Team_029
--------------------------------------------------------------------------------
Player                MIN  PTS  REB  AST  TO      FG   FG%      3P   3P%
--------------------------------------------------------------------------------
Scottie Bird           12    9    0    1   0   4/6    66.7     0/0   0.0
James Wall             12    6    3    1   0   3/5    60.0     0/0   0.0
Devin Butler           12    4    4    1   0   2/4    50.0     0/0   0.0
Paul Iverson           12    3    0    0   0   2/4    50.0     0/0   0.0
Giannis Banchero       12    3    4    1   0   1/3    33.3     0/0   0.0

TEAM: FG: 12/22 (54.5%), 3PT: 2/6 (33.3%), REB: 11 (2 off, 9 def), AST: 4, TO: 0
TEAM FOULS: 6 [Team_078 in BONUS]


Team_078
--------------------------------------------------------------------------------
Player                MIN  PTS  REB  AST  TO      FG   FG%      3P   3P%
--------------------------------------------------------------------------------
Isaiah Simmons         12    7    3    0   0   3/4    75.0     0/0   0.0
Kyrie Carter           12    4    0    0   0   1/3    33.3     0/0   0.0
Jabari Barrett         12    2    8    0   0   1/3    33.3     0/0   0.0
Jabari Barnes          12    2    0    0   0   1/5    20.0     0/0   0.0
Ben Ginobili           12    1    3    0   0   1/1   100.0     0/0   0.0

TEAM: FG: 7/16 (43.8%), 3PT: 2/5 (40.0%), REB: 14 (4 off, 10 def), AST: 0, TO: 6
TEAM FOULS: 5 [Team_029 in BONUS]

================================================================================

================================================================================
                       2ND QUARTER - Team_029 vs Team_078                       
================================================================================

[12:00] Team_029 possession (Score: 25-16)
James Wall attempts a 3Pt. Contested by Isaiah Simmons (3.9 feet, ZONE). James Wall misses. Rebound secured by Isaiah Simmons.

[11:43] Team_078 possession (Score: 25-16)
Jabari Barrett attempts a Layup. Contested by Devin Butler (4.4 feet, MAN). JABARI BARRETT MAKES IT! Assist: Jabari Barnes
Score: 25-18

[11:27] Team_029 possession (Score: 25-18)
James Wall attempts a Midrange. Contested by Ben Ginobili (5.5 feet, MAN). James Wall misses. Rebound secured by Ben Ginobili.

[11:14] Team_078 possession (Score: 25-18)
Ben Ginobili attempts a Midrange. Contested by Scottie Bird (3.8 feet, ZONE). BEN GINOBILI MAKES IT! Assist: Jabari Barnes
Score: 25-20

[10:59] Team_029 possession (Score: 25-20)
Paul Iverson drives to the basket... Paul Iverson loses the ball! Stripped by Jabari Barnes! TURNOVER! (live ball)

[10:47] Team_078 possession (Score: 25-20)
Jabari Barrett attempts a Layup. Contested by Devin Butler (4.5 feet, MAN). JABARI BARRETT MAKES IT!
Score: 25-22

[10:33] Team_029 possession (Score: 25-22)
Paul Iverson attempts a 3Pt. Contested by Ben Ginobili (5.3 feet, ZONE). Paul Iverson misses. Offensive rebound by Devin Butler! Devin Butler kicks it out.

[10:22] Team_029 possession (Score: 25-22)
Paul Iverson attempts a 3Pt. Contested by Jabari Barnes (4.7 feet, MAN). Paul Iverson misses. Rebound secured by Isaiah Simmons.

[10:05] Team_078 possession (Score: 25-22)
Jabari Barnes drives and kicks out. Jabari Barnes attempts a 3Pt. Contested by Paul Iverson (4.8 feet, MAN). JABARI BARNES MAKES IT! Assist: Jabari Barrett
Score: 25-25

[09:50] Team_029 possession (Score: 25-25)
Scottie Bird attempts a Midrange. Contested by Kyrie Carter (4.6 feet, MAN). SCOTTIE BIRD MAKES IT!
Score: 27-25

[09:35] Team_078 possession (Score: 27-25)
Kyrie Carter attempts a Layup. Contested by James Wall (3.1 feet, ZONE). KYRIE CARTER MAKES IT! Assist: Jabari Barnes
Score: 27-27

[09:19] Team_029 possession (Score: 27-27)
Paul Iverson attempts a 3Pt. Contested by Jabari Barnes (4.8 feet, MAN). Paul Iverson misses. Rebound secured by Isaiah Simmons.

[09:01] Team_078 possession (Score: 27-27)
Jabari Barrett attempts a Layup. Contested by Devin Butler (4.7 feet, MAN). JABARI BARRETT MAKES IT! Assist: Jabari Barnes
Score: 27-29

[08:48] Team_029 possession (Score: 27-29)
Giannis Banchero makes the 3Pt and draws the foul on Isaiah Simmons! And-1! Giannis Banchero to the line for 1. [Team fouls: 1] (Isaiah Simmons: 1 personal fouls)   FT 1/1: GOOD Giannis Banchero makes 1/1 from the line.
Score: 31-29

[08:33] Team_078 possession (Score: 31-29)
Jabari Barrett attempts a 3Pt. Contested by Devin Butler (4.8 feet, MAN). Jabari Barrett misses. Offensive rebound by Isaiah Simmons! Isaiah Simmons puts it back in!
Score: 31-31

[08:19] Team_029 possession (Score: 31-31)
Scottie Bird attempts a Midrange. BLOCKED BY KYRIE CARTER! Ball deflects out of bounds off Scottie Bird.

[08:02] Team_078 possession (Score: 31-31)
Kyrie Carter attempts a 3Pt. BLOCKED BY GIANNIS BANCHERO! Ball is loose! Rebound secured by Giannis Banchero.

[07:50] Team_029 possession (Score: 31-31)
Giannis Banchero attempts a 3Pt. Contested by Isaiah Simmons (4.4 feet, ZONE). Giannis Banchero misses. Offensive rebound by James Wall! James Wall puts it back in!
Score: 33-31

[07:32] Team_078 possession (Score: 33-31)
Jabari Barnes attempts a Midrange. Contested by James Wall (3.8 feet, ZONE). Jabari Barnes misses. Offensive rebound by Jabari Barrett! Jabari Barrett kicks it out.

[07:20] Team_078 possession (Score: 33-31)
Isaiah Simmons attempts a 3Pt. Contested by Giannis Banchero (4.8 feet, MAN). Isaiah Simmons misses. Rebound secured by Giannis Banchero.

[07:09] Team_029 possession (Score: 33-31)
Scottie Bird attempts a 3Pt. Contested by Kyrie Carter (5.0 feet, MAN). Scottie Bird misses. Rebound secured by Isaiah Simmons.

[06:56] Team_078 possession (Score: 33-31)
FOUL! Shooting foul on Devin Butler. Jabari Barrett to the line for 2 free throws. [Team fouls: 1] (Devin Butler: 1 personal fouls)   FT 1/2: GOOD   FT 2/2: MISS Jabari Barrett makes 1/2 from the line. Rebound secured by Devin Butler.
Score: 33-32

[06:41] Team_029 possession (Score: 33-32)
Giannis Banchero attempts a Midrange. Contested by Isaiah Simmons (4.6 feet, ZONE). Giannis Banchero misses. Offensive rebound by James Wall! James Wall puts it back in!
Score: 35-32

[06:26] Team_078 possession (Score: 35-32)
Jabari Barnes drives, Paul Iverson stays with him. Jabari Barnes attempts a Layup. Contested by Paul Iverson (5.5 feet, MAN). JABARI BARNES MAKES IT! Assist: Jabari Barrett
Score: 35-34

[06:14] Team_029 possession (Score: 35-34)
James Wall attempts a Midrange. Contested by Isaiah Simmons (4.7 feet, ZONE). James Wall misses. Rebound secured by Jabari Barrett.

[05:57] Team_078 possession (Score: 35-34)
Isaiah Simmons attempts a 3Pt. Contested by Giannis Banchero (5.0 feet, MAN). Isaiah Simmons misses. Rebound secured by James Wall.

[05:42] Team_029 possession (Score: 35-34)
Paul Iverson attempts a Midrange. Contested by Jabari Barnes (5.4 feet, MAN). PAUL IVERSON MAKES IT!
Score: 37-34

[05:27] Team_078 possession (Score: 37-34)
Isaiah Simmons drives, James Wall stays with him. Isaiah Simmons attempts a Layup. Contested by James Wall (3.9 feet, ZONE). ISAIAH SIMMONS MAKES IT! Assist: Jabari Barnes
Score: 37-36

[05:15] Team_029 possession (Score: 37-36)
FOUL! Offensive foul on Devin Butler! Jabari Barrett drew the charge! [Team fouls: 2] (Devin Butler: 2 personal fouls) TURNOVER! (dead ball)

[05:01] Team_078 possession (Score: 37-36)
Jabari Barrett drives and kicks out. Ben Ginobili attempts a Midrange. Contested by Devin Butler (5.5 feet, ZONE). BEN GINOBILI MAKES IT!
Score: 37-38

[04:46] Team_029 possession (Score: 37-38)
Scottie Bird attempts a 3Pt. Contested by Kyrie Carter (5.3 feet, MAN). SCOTTIE BIRD MAKES IT! Assist: Giannis Banchero
Score: 40-38

[04:32] Team_078 possession (Score: 40-38)
Ben Ginobili makes the Dunk and draws the foul on James Wall! And-1! Ben Ginobili to the line for 1. [Team fouls: 3] (James Wall: 1 personal fouls)   FT 1/1: GOOD Ben Ginobili makes 1/1 from the line.
Score: 40-41

[04:19] Team_029 possession (Score: 40-41)
James Wall throws a bad pass out of bounds! TURNOVER! (dead ball)

[04:19] Substitution (Team_029): Paul Iverson OUT → Immanuel Irving IN (stamina_rule2)

[04:19] Substitution (Team_029): Scottie Bird OUT → Bones Carter IN (stamina_rule2)

[04:19] Substitution (Team_029): Giannis Banchero OUT → Pau Anthony IN (stamina_rule2)

[04:19] Substitution (Team_029): James Wall OUT → Derrick Rozier IN (stamina_rule2)

[04:19] Substitution (Team_029): Devin Butler OUT → Shai Ball IN (stamina_rule2)

[04:19] Substitution (Team_078): Jabari Barnes OUT → Magic Barrett IN (stamina_rule2)

[04:19] Substitution (Team_078): Kyrie Carter OUT → Damian Allen IN (stamina_rule2)

[04:19] Substitution (Team_078): Isaiah Simmons OUT → Malcolm Randle IN (stamina_rule2)

[04:19] Substitution (Team_078): Ben Ginobili OUT → Paul Ming IN (stamina_rule2)

[04:19] Substitution (Team_078): Jabari Barrett OUT → Draymond Irving IN (stamina_rule2)

[04:00] Team_078 possession (Score: 40-41)
Draymond Irving throws a bad pass out of bounds! TURNOVER! (dead ball)

[03:49] Team_029 possession (Score: 40-41)
Derrick Rozier attempts a Midrange. Contested by Draymond Irving (5.7 feet, ZONE). DERRICK ROZIER MAKES IT!
Score: 42-41

[03:37] Team_078 possession (Score: 42-41)
Paul Ming makes the Layup and draws the foul on Derrick Rozier! And-1! Paul Ming to the line for 1. [Team fouls: 4] (Derrick Rozier: 1 personal fouls)   FT 1/1: GOOD Paul Ming makes 1/1 from the line.
Score: 42-44

[03:17] Team_029 possession (Score: 42-44)
Shai Ball drives, picks up Draymond Irving. Help arrives from Damian Allen! Shai Ball attempts a Layup. Contested by Damian Allen (5.7 feet, MAN). Shai Ball misses. Rebound secured by Draymond Irving.

[02:59] Team_078 possession (Score: 42-44)
Draymond Irving attempts a 3Pt. Contested by Pau Anthony (4.0 feet, ZONE). Draymond Irving misses. Rebound secured by Pau Anthony.

[02:46] Team_029 possession (Score: 42-44)
Bones Carter drives, Paul Ming stays with him. Bones Carter attempts a Dunk. Contested by Paul Ming (4.4 feet, ZONE). BONES CARTER MAKES IT! Assist: Shai Ball
Score: 44-44

[02:27] Team_078 possession (Score: 44-44)
FOUL! Shooting foul on Shai Ball. Draymond Irving to the line for 2 free throws. [BONUS: 5 team fouls] (Shai Ball: 1 personal fouls)   FT 1/2: GOOD   FT 2/2: GOOD Draymond Irving makes 2/2 from the line.
Score: 44-46

[02:12] Team_029 possession (Score: 44-46)
FOUL! Reach-in foul on Damian Allen during the drive. [Team fouls: 2] No free throws, side out. (Damian Allen: 1 personal fouls)

[02:01] Team_029 possession (Score: 44-46)
Shai Ball makes the Layup and draws the foul on Paul Ming! And-1! Shai Ball to the line for 1. [Team fouls: 3] (Paul Ming: 1 personal fouls)   FT 1/1: GOOD Shai Ball makes 1/1 from the line.
Score: 47-46

[01:45] Team_078 possession (Score: 47-46)
Draymond Irving attempts a 3Pt. Contested by Pau Anthony (4.0 feet, ZONE). Draymond Irving misses. Rebound secured by Pau Anthony.

[01:31] Team_029 possession (Score: 47-46)
Immanuel Irving drives to the basket... Immanuel Irving throws a bad pass out of bounds! TURNOVER! (dead ball)

[01:21] Team_078 possession (Score: 47-46)
Magic Barrett drives to the basket... Magic Barrett throws a bad pass! Stolen by Immanuel Irving! TURNOVER! (live ball)

[01:09] Team_029 possession (Score: 47-46)
FOUL! Reach-in foul on Paul Ming during the drive. [Team fouls: 4] No free throws, side out. (Paul Ming: 2 personal fouls)

[00:58] Team_029 possession (Score: 47-46)
Bones Carter drives, Paul Ming stays with him. Bones Carter attempts a Layup. Contested by Paul Ming (4.4 feet, ZONE). Bones Carter misses. Rebound secured by Draymond Irving.

[00:47] Team_078 possession (Score: 47-46)
Draymond Irving attempts a Layup. Contested by Shai Ball (4.1 feet, ZONE). DRAYMOND IRVING MAKES IT! Assist: Paul Ming
Score: 47-48

[00:29] Team_029 possession (Score: 47-48)
Pau Anthony makes the Midrange and draws the foul on Damian Allen! And-1! Pau Anthony to the line for 1. [BONUS: 5 team fouls] (Damian Allen: 2 personal fouls)   FT 1/1: GOOD Pau Anthony makes 1/1 from the line.
Score: 50-48

[00:20] Team_078 possession (Score: 50-48)
Magic Barrett attempts a Midrange. Contested by Bones Carter (6.0 feet, ZONE). Magic Barrett misses. Rebound secured by Derrick Rozier.

[00:03] Team_029 possession (Score: 50-48)
Immanuel Irving drives to the basket... Immanuel Irving throws a bad pass out of bounds! TURNOVER! (dead ball)

================================================================================
                              2ND QUARTER COMPLETE                              
================================================================================

2ND QUARTER SCORE: Team_029 25, Team_078 32

BOX SCORE:
================================================================================

Team_029
--------------------------------------------------------------------------------
Player                MIN  PTS  REB  AST  TO      FG   FG%      3P   3P%
--------------------------------------------------------------------------------
Scottie Bird           20    5    0    0   0   2/4    50.0     0/0   0.0
James Wall             20    4    3    0   0   2/5    40.0     0/0   0.0
Giannis Banchero       20    4    2    1   0   1/1   100.0     0/0   0.0
Shai Ball               4    3    0    1   0   1/2    50.0     0/0   0.0
Pau Anthony             4    3    2    0   0   1/1   100.0     0/0   0.0
Paul Iverson           20    2    0    0   0   1/3    33.3     0/0   0.0
Derrick Rozier          4    2    1    0   0   1/1   100.0     0/0   0.0
Bones Carter            4    2    0    0   0   1/2    50.0     0/0   0.0
Devin Butler           20    0    2    0   0   0/0     0.0     0/0   0.0

TEAM: FG: 10/19 (52.6%), 3PT: 3/7 (42.9%), REB: 10 (3 off, 7 def), AST: 2, TO: 5
TEAM FOULS: 5 [Team_078 in BONUS]


Team_078
--------------------------------------------------------------------------------
Player                MIN  PTS  REB  AST  TO      FG   FG%      3P   3P%
--------------------------------------------------------------------------------
Ben Ginobili           20    7    1    0   0   3/3   100.0     0/0   0.0
Jabari Barrett         20    6    2    2   0   3/4    75.0     0/0   0.0
Jabari Barnes          20    5    0    5   0   2/2   100.0     0/0   0.0
Isaiah Simmons         20    4    5    0   0   2/4    50.0     0/0   0.0
Draymond Irving         4    4    2    0   0   2/4    50.0     0/0   0.0
Paul Ming               4    3    0    1   0   1/1   100.0     0/0   0.0
Kyrie Carter           20    2    0    0   0   1/2    50.0     0/0   0.0
Magic Barrett           4    0    0    0   0   0/1     0.0     0/0   0.0

TEAM: FG: 14/21 (66.7%), 3PT: 1/6 (16.7%), REB: 10 (2 off, 8 def), AST: 8, TO: 2
TEAM FOULS: 5 [Team_029 in BONUS]

================================================================================

================================================================================
                       3RD QUARTER - Team_029 vs Team_078                       
================================================================================

[12:00] Team_029 possession (Score: 50-48)
Scottie Bird drives and kicks out. Devin Butler attempts a 3Pt. Contested by Isaiah Simmons (3.0 feet, ZONE). Devin Butler misses. Rebound secured by Ben Ginobili.

[11:46] Team_078 possession (Score: 50-48)
Ben Ginobili attempts a Midrange. Contested by James Wall (2.9 feet, MAN). Ben Ginobili misses. Rebound secured by Devin Butler.

[11:33] Team_029 possession (Score: 50-48)
Scottie Bird attempts a 3Pt. Contested by Kyrie Carter (4.1 feet, MAN). Scottie Bird misses. Rebound secured by Ben Ginobili.

[11:20] Team_078 possession (Score: 50-48)
Jabari Barnes drives, Paul Iverson stays with him. Jabari Barnes attempts a Layup. Contested by Paul Iverson (4.7 feet, MAN). JABARI BARNES MAKES IT! Assist: Ben Ginobili
Score: 50-50

[11:04] Team_029 possession (Score: 50-50)
Devin Butler drives to the basket... Devin Butler throws a bad pass! Stolen by Jabari Barrett! TURNOVER! (live ball)

[10:49] Team_078 possession (Score: 50-50)
Ben Ginobili attempts a 3Pt. Contested by James Wall (2.9 feet, MAN). BEN GINOBILI MAKES IT! Assist: Isaiah Simmons
Score: 50-53

[10:32] Team_029 possession (Score: 50-53)
Giannis Banchero attempts a 3Pt. Contested by Isaiah Simmons (3.6 feet, ZONE). Giannis Banchero misses. FOUL! Loose ball foul on Jabari Barrett during the rebound battle. [Team fouls: 1] No free throws, side out. (Jabari Barrett: 1 personal fouls)

[10:21] Team_029 possession (Score: 50-53)
Paul Iverson attempts a 3Pt. Contested by Isaiah Simmons (3.3 feet, ZONE). Paul Iverson misses. FOUL! Loose ball foul on Isaiah Simmons during the rebound battle. [Team fouls: 2] No free throws, side out. (Isaiah Simmons: 1 personal fouls)

[10:08] Team_029 possession (Score: 50-53)
Devin Butler drives, Jabari Barrett stays with him. Devin Butler attempts a Layup. Contested by Jabari Barrett (5.2 feet, MAN). DEVIN BUTLER MAKES IT! Assist: Scottie Bird
Score: 52-53

[09:52] Team_078 possession (Score: 52-53)
Kyrie Carter drives and kicks out. Isaiah Simmons attempts a 3Pt. Contested by Giannis Banchero (3.5 feet, ZONE). Isaiah Simmons misses. Rebound secured by Giannis Banchero.

[09:35] Team_029 possession (Score: 52-53)
Devin Butler drives, picks up Jabari Barrett. Help arrives from Kyrie Carter! Devin Butler attempts a Dunk. Contested by Kyrie Carter (5.2 feet, ZONE). DEVIN BUTLER MAKES IT! Assist: Giannis Banchero
Score: 54-53

[09:22] Team_078 possession (Score: 54-53)
Jabari Barrett makes the Layup and draws the foul on James Wall! And-1! Jabari Barrett to the line for 1. [Team fouls: 1] (James Wall: 1 personal fouls)   FT 1/1: GOOD Jabari Barrett makes 1/1 from the line.
Score: 54-56

[09:11] Team_029 possession (Score: 54-56)
James Wall throws a bad pass out of bounds! TURNOVER! (dead ball)

[08:58] Team_078 possession (Score: 54-56)
Jabari Barrett makes the Midrange and draws the foul on Scottie Bird! And-1! Jabari Barrett to the line for 1. [Team fouls: 2] (Scottie Bird: 1 personal fouls)   FT 1/1: GOOD Jabari Barrett makes 1/1 from the line.
Score: 54-59

[08:43] Team_029 possession (Score: 54-59)
Giannis Banchero makes the Layup and draws the foul on Isaiah Simmons! And-1! Giannis Banchero to the line for 1. [Team fouls: 3] (Isaiah Simmons: 2 personal fouls)   FT 1/1: MISS Giannis Banchero makes 0/1 from the line. Rebound secured by Isaiah Simmons.
Score: 56-59

[08:29] Team_078 possession (Score: 56-59)
Kyrie Carter attempts a 3Pt. Contested by Giannis Banchero (3.4 feet, ZONE). KYRIE CARTER MAKES IT!
Score: 56-62

[08:14] Team_029 possession (Score: 56-62)
Paul Iverson attempts a 3Pt. Contested by Isaiah Simmons (3.3 feet, ZONE). PAUL IVERSON MAKES IT! Assist: James Wall
Score: 59-62

[08:02] Team_078 possession (Score: 59-62)
Jabari Barnes drives and kicks out. Jabari Barnes attempts a Midrange. Contested by Paul Iverson (4.3 feet, MAN). Jabari Barnes misses. Offensive rebound by Jabari Barrett! Jabari Barrett kicks it out.

[07:48] Team_078 possession (Score: 59-62)
FOUL! Shooting foul on Giannis Banchero. Ben Ginobili to the line for 3 free throws. [Team fouls: 3] (Giannis Banchero: 1 personal fouls)   FT 1/3: GOOD   FT 2/3: MISS   FT 3/3: MISS Ben Ginobili makes 1/3 from the line. Rebound secured by Giannis Banchero.
Score: 59-63

[07:33] Team_029 possession (Score: 59-63)
Devin Butler attempts a Midrange. Contested by Ben Ginobili (5.1 feet, ZONE). DEVIN BUTLER MAKES IT!
Score: 61-63

[07:19] Team_078 possession (Score: 61-63)
Ben Ginobili attempts a Midrange. Contested by James Wall (2.9 feet, MAN). BEN GINOBILI MAKES IT! Assist: Isaiah Simmons
Score: 61-65

[07:06] Team_029 possession (Score: 61-65)
James Wall drives and kicks out. Giannis Banchero attempts a 3Pt. Contested by Isaiah Simmons (3.0 feet, ZONE). GIANNIS BANCHERO MAKES IT!
Score: 64-65

[06:53] Team_078 possession (Score: 64-65)
Ben Ginobili attempts a Layup. BLOCKED BY JAMES WALL! Ball is loose! Offensive rebound by Jabari Barrett! Jabari Barrett kicks it out.

[06:40] Team_078 possession (Score: 64-65)
Jabari Barrett drives to the basket... Jabari Barrett throws a bad pass out of bounds! TURNOVER! (dead ball)

[06:21] Team_029 possession (Score: 64-65)
Giannis Banchero attempts a 3Pt. Contested by Isaiah Simmons (3.6 feet, MAN). Giannis Banchero misses. Rebound secured by Jabari Barrett.

[06:09] Team_078 possession (Score: 64-65)
Jabari Barnes drives and kicks out. Ben Ginobili attempts a Midrange. Contested by Scottie Bird (3.1 feet, ZONE). Ben Ginobili misses. Rebound secured by James Wall.

[05:54] Team_029 possession (Score: 64-65)
James Wall drives, Ben Ginobili stays with him. James Wall attempts a Layup. Contested by Ben Ginobili (5.2 feet, MAN). JAMES WALL MAKES IT! Assist: Devin Butler
Score: 66-65

[05:39] Team_078 possession (Score: 66-65)
Jabari Barnes attempts a 3Pt. Contested by Paul Iverson (4.7 feet, MAN). JABARI BARNES MAKES IT! Assist: Jabari Barrett
Score: 66-68

[05:27] Team_029 possession (Score: 66-68)
Devin Butler drives and kicks out. Scottie Bird attempts a 3Pt. Contested by Kyrie Carter (3.8 feet, MAN). Scottie Bird misses. Rebound secured by Ben Ginobili.

[05:16] Team_078 possession (Score: 66-68)
FOUL! Reach-in foul on Devin Butler during the drive. [IN THE BONUS! 5 team fouls] Jabari Barrett to the line for 2 free throws. (Devin Butler: 1 personal fouls)   FT 1/2: GOOD   FT 2/2: GOOD Jabari Barrett makes 2/2 from the line.
Score: 66-70

[04:58] Team_029 possession (Score: 66-70)
Paul Iverson drives to the basket... FOUL! Offensive foul on Paul Iverson! Jabari Barrett drew the charge! [Team fouls: 6] (Paul Iverson: 1 personal fouls) TURNOVER! (dead ball)

[04:45] Team_078 possession (Score: 66-70)
Ben Ginobili drives, James Wall stays with him. Ben Ginobili attempts a Layup. Contested by James Wall (3.0 feet, MAN). Ben Ginobili misses. Offensive rebound by Isaiah Simmons! Isaiah Simmons's putback is no good. Offensive rebound by Isaiah Simmons! Isaiah Simmons kicks it out.

[04:31] Team_078 possession (Score: 66-70)
Ben Ginobili attempts a 3Pt. Contested by Scottie Bird (3.5 feet, ZONE). Ben Ginobili misses. Rebound secured by Giannis Banchero.

[04:13] Team_029 possession (Score: 66-70)
Giannis Banchero attempts a 3Pt. Contested by Isaiah Simmons (3.7 feet, MAN). Giannis Banchero misses. Rebound secured by Jabari Barrett.

[04:00] Team_078 possession (Score: 66-70)
FOUL! Shooting foul on James Wall. Ben Ginobili to the line for 2 free throws. [BONUS: 7 team fouls] (James Wall: 3 personal fouls)   FT 1/2: GOOD   FT 2/2: GOOD Ben Ginobili makes 2/2 from the line.
Score: 66-72

[03:49] Team_029 possession (Score: 66-72)
Paul Iverson drives, picks up Jabari Barnes. Help arrives from Isaiah Simmons! Paul Iverson attempts a Layup. Contested by Isaiah Simmons (4.3 feet, MAN). PAUL IVERSON MAKES IT!
Score: 68-72

[03:35] Team_078 possession (Score: 68-72)
Ben Ginobili attempts a 3Pt. Contested by James Wall (3.1 feet, MAN). Ben Ginobili misses. Rebound secured by James Wall.

[03:21] Team_029 possession (Score: 68-72)
Paul Iverson attempts a 3Pt. Contested by Isaiah Simmons (3.5 feet, ZONE). Paul Iverson misses. Rebound secured by Ben Ginobili.

[03:11] Team_078 possession (Score: 68-72)
FOUL! Holding foul on Paul Iverson. [IN THE BONUS! 8 team fouls] Jabari Barnes to the line for 2 free throws. (Paul Iverson: 2 personal fouls)   FT 1/2: GOOD   FT 2/2: GOOD Jabari Barnes makes 2/2 from the line.
Score: 68-74

[02:54] Team_029 possession (Score: 68-74)
FOUL! Holding foul on Ben Ginobili. [Team fouls: 4] No free throws, side out. (Ben Ginobili: 1 personal fouls)

[02:40] Team_029 possession (Score: 68-74)
Scottie Bird attempts a 3Pt. Contested by Isaiah Simmons (3.6 feet, ZONE). Scottie Bird misses. Rebound secured by Jabari Barrett.

[02:27] Team_078 possession (Score: 68-74)
Isaiah Simmons drives, James Wall stays with him. Isaiah Simmons attempts a Dunk. Contested by James Wall (3.1 feet, ZONE). Isaiah Simmons misses. Rebound secured by Devin Butler.

[02:12] Team_029 possession (Score: 68-74)
Devin Butler attempts a Midrange. Contested by Isaiah Simmons (3.9 feet, ZONE). Devin Butler misses. Rebound secured by Jabari Barrett.

[01:58] Team_078 possession (Score: 68-74)
Jabari Barrett attempts a Midrange. Contested by Devin Butler (4.4 feet, MAN). Jabari Barrett misses. Rebound secured by Devin Butler.

[01:48] Team_029 possession (Score: 68-74)
Giannis Banchero attempts a 3Pt. Contested by Kyrie Carter (4.7 feet, ZONE). Giannis Banchero misses. Rebound secured by Ben Ginobili.

[01:36] Team_078 possession (Score: 68-74)
Jabari Barnes attempts a 3Pt. Contested by Giannis Banchero (4.4 feet, ZONE). Jabari Barnes misses. Rebound secured by Devin Butler.

[01:19] Team_029 possession (Score: 68-74)
Scottie Bird throws a bad pass out of bounds! TURNOVER! (dead ball)

[01:19] Substitution (Team_029): Paul Iverson OUT → Immanuel Irving IN (stamina_rule2)

[01:19] Substitution (Team_029): Scottie Bird OUT → Bones Carter IN (stamina_rule2)

[01:19] Substitution (Team_029): Giannis Banchero OUT → Pau Anthony IN (stamina_rule2)

[01:19] Substitution (Team_029): James Wall OUT → Derrick Rozier IN (stamina_rule2)

[01:19] Substitution (Team_029): Devin Butler OUT → Shai Ball IN (stamina_rule2)

[01:19] Substitution (Team_078): Jabari Barnes OUT → Magic Barrett IN (stamina_rule2)

[01:19] Substitution (Team_078): Kyrie Carter OUT → Damian Allen IN (stamina_rule2)

[01:19] Substitution (Team_078): Isaiah Simmons OUT → Malcolm Randle IN (stamina_rule2)

[01:19] Substitution (Team_078): Ben Ginobili OUT → Paul Ming IN (stamina_rule2)

[01:19] Substitution (Team_078): Jabari Barrett OUT → Draymond Irving IN (stamina_rule2)

[01:04] Team_078 possession (Score: 68-74)
Paul Ming drives and kicks out. Magic Barrett attempts a 3Pt. Contested by Immanuel Irving (5.1 feet, MAN). Magic Barrett misses. Rebound secured by Pau Anthony.

[00:49] Team_029 possession (Score: 68-74)
FOUL! Holding foul on Malcolm Randle. [IN THE BONUS! 5 team fouls] Pau Anthony to the line for 2 free throws. (Malcolm Randle: 1 personal fouls)   FT 1/2: GOOD   FT 2/2: GOOD Pau Anthony makes 2/2 from the line.
Score: 70-74

[00:33] Team_078 possession (Score: 70-74)
Magic Barrett attempts a 3Pt. Contested by Pau Anthony (4.2 feet, ZONE). Magic Barrett misses. Offensive rebound by Paul Ming! Paul Ming kicks it out.

[00:18] Team_078 possession (Score: 70-74)
Damian Allen attempts a 3Pt. Contested by Pau Anthony (3.8 feet, ZONE). Damian Allen misses. Rebound secured by Derrick Rozier.

[00:07] Team_029 possession (Score: 70-74)
Shai Ball drives to the basket... Shai Ball throws a bad pass out of bounds! TURNOVER! (dead ball)

================================================================================
                              3RD QUARTER COMPLETE                              
================================================================================

3RD QUARTER SCORE: Team_029 20, Team_078 26

BOX SCORE:
================================================================================

Team_029
--------------------------------------------------------------------------------
Player                MIN  PTS  REB  AST  TO      FG   FG%      3P   3P%
--------------------------------------------------------------------------------
Devin Butler           31    6    6    1   0   3/5    60.0     0/0   0.0
Paul Iverson           31    5    0    0   0   2/3    66.7     0/0   0.0
Giannis Banchero       31    3    3    1   0   1/5    20.0     0/0   0.0
James Wall             31    2    2    1   0   1/1   100.0     0/0   0.0
Pau Anthony             5    2    1    0   0   1/1   100.0     0/0   0.0
Scottie Bird           31    0    0    1   0   0/3     0.0     0/0   0.0
Derrick Rozier          5    0    1    0   0   0/0     0.0     0/0   0.0

TEAM: FG: 8/18 (44.4%), 3PT: 1/7 (14.3%), REB: 13 (2 off, 11 def), AST: 4, TO: 5
TEAM FOULS: 8 [Team_078 in BONUS]


Team_078
--------------------------------------------------------------------------------
Player                MIN  PTS  REB  AST  TO      FG   FG%      3P   3P%
--------------------------------------------------------------------------------
Jabari Barrett         31    8    6    1   0   3/4    75.0     0/0   0.0
Ben Ginobili           31    7    5    1   0   3/7    42.9     0/0   0.0
Jabari Barnes          31    7    0    0   0   3/5    60.0     0/0   0.0
Kyrie Carter           31    3    0    0   0   1/2    50.0     0/0   0.0
Isaiah Simmons         31    0    2    2   0   0/1     0.0     0/0   0.0
Paul Ming               5    0    1    0   0   0/1     0.0     0/0   0.0
Damian Allen            5    0    0    0   0   0/1     0.0     0/0   0.0

TEAM: FG: 10/21 (47.6%), 3PT: 3/8 (37.5%), REB: 14 (4 off, 10 def), AST: 4, TO: 1
TEAM FOULS: 5 [Team_029 in BONUS]

================================================================================

================================================================================
                       4TH QUARTER - Team_029 vs Team_078                       
================================================================================

[12:00] Team_029 possession (Score: 70-74)
Paul Iverson attempts a Midrange. Contested by Jabari Barnes (4.3 feet, MAN). PAUL IVERSON MAKES IT! Assist: James Wall
Score: 72-74

[11:46] Team_078 possession (Score: 72-74)
FOUL! Shooting foul on James Wall. Ben Ginobili to the line for 2 free throws. [Team fouls: 1] (James Wall: 1 personal fouls)   FT 1/2: GOOD   FT 2/2: GOOD Ben Ginobili makes 2/2 from the line.
Score: 72-76

[11:33] Team_029 possession (Score: 72-76)
James Wall attempts a Midrange. Contested by Ben Ginobili (5.4 feet, MAN). James Wall misses. Rebound secured by Ben Ginobili.

[11:16] Team_078 possession (Score: 72-76)
Kyrie Carter attempts a Layup. Contested by James Wall (2.7 feet, ZONE). KYRIE CARTER MAKES IT!
Score: 72-78

[11:01] Team_029 possession (Score: 72-78)
Giannis Banchero attempts a Layup. Contested by Jabari Barrett (5.5 feet, ZONE). Giannis Banchero misses. Rebound secured by Ben Ginobili.

[10:43] Team_078 possession (Score: 72-78)
Jabari Barnes attempts a 3Pt. Contested by Paul Iverson (4.9 feet, MAN). Jabari Barnes misses. Rebound secured by Giannis Banchero.

[10:32] Team_029 possession (Score: 72-78)
Scottie Bird attempts a 3Pt. Contested by Ben Ginobili (5.2 feet, ZONE). Scottie Bird misses. Rebound secured by Ben Ginobili.

[10:18] Team_078 possession (Score: 72-78)
Jabari Barrett drives, Devin Butler stays with him. Jabari Barrett attempts a Layup. Contested by Devin Butler (4.4 feet, MAN). JABARI BARRETT MAKES IT! Assist: Jabari Barnes
Score: 72-80

[10:05] Team_029 possession (Score: 72-80)
Scottie Bird makes the Layup and draws the foul on Jabari Barrett! And-1! Scottie Bird to the line for 1. [Team fouls: 1] (Jabari Barrett: 1 personal fouls)   FT 1/1: GOOD Scottie Bird makes 1/1 from the line.
Score: 75-80

[09:48] Team_078 possession (Score: 75-80)
Kyrie Carter drives and kicks out. Jabari Barnes attempts a 3Pt. Contested by Giannis Banchero (4.1 feet, ZONE). Jabari Barnes misses. Rebound secured by James Wall.

[09:32] Team_029 possession (Score: 75-80)
Giannis Banchero makes the Dunk and draws the foul on Isaiah Simmons! And-1! Giannis Banchero to the line for 1. [Team fouls: 2] (Isaiah Simmons: 1 personal fouls)   FT 1/1: GOOD Giannis Banchero makes 1/1 from the line.
Score: 78-80

[09:21] Team_078 possession (Score: 78-80)
Kyrie Carter attempts a 3Pt. Contested by Giannis Banchero (4.0 feet, ZONE). Kyrie Carter misses. Rebound secured by Devin Butler.

[09:03] Team_029 possession (Score: 78-80)
Giannis Banchero drives and kicks out. Giannis Banchero attempts a Midrange. Contested by Isaiah Simmons (3.6 feet, MAN). Giannis Banchero misses. Offensive rebound by James Wall! James Wall puts it back in!
Score: 80-80

[08:50] Team_078 possession (Score: 80-80)
Isaiah Simmons attempts a Midrange. Contested by Giannis Banchero (4.3 feet, ZONE). ISAIAH SIMMONS MAKES IT! Assist: Ben Ginobili
Score: 80-82

[08:33] Team_029 possession (Score: 80-82)
Giannis Banchero attempts a 3Pt. Contested by Isaiah Simmons (4.1 feet, MAN). Giannis Banchero misses. Rebound secured by Jabari Barrett.

[08:21] Team_078 possession (Score: 80-82)
Ben Ginobili attempts a Layup. Contested by James Wall (3.4 feet, ZONE). BEN GINOBILI MAKES IT!
Score: 80-84

[08:07] Team_029 possession (Score: 80-84)
Paul Iverson attempts a 3Pt. Contested by Isaiah Simmons (3.9 feet, ZONE). Paul Iverson misses. FOUL! Loose ball foul on Ben Ginobili during the rebound battle. [Team fouls: 3] No free throws, side out. (Ben Ginobili: 1 personal fouls)

[07:52] Team_029 possession (Score: 80-84)
Giannis Banchero throws a bad pass out of bounds! TURNOVER! (dead ball)

[07:52] Substitution (Team_029): Paul Iverson OUT → Immanuel Irving IN (stamina_rule2)

[07:52] Substitution (Team_029): Scottie Bird OUT → Bones Carter IN (stamina_rule2)

[07:52] Substitution (Team_029): Giannis Banchero OUT → Pau Anthony IN (stamina_rule2)

[07:52] Substitution (Team_029): James Wall OUT → Derrick Rozier IN (stamina_rule2)

[07:52] Substitution (Team_029): Devin Butler OUT → Shai Ball IN (stamina_rule2)

[07:52] Substitution (Team_078): Jabari Barnes OUT → Magic Barrett IN (stamina_rule2)

[07:52] Substitution (Team_078): Kyrie Carter OUT → Damian Allen IN (stamina_rule2)

[07:52] Substitution (Team_078): Isaiah Simmons OUT → Malcolm Randle IN (stamina_rule2)

[07:52] Substitution (Team_078): Ben Ginobili OUT → Paul Ming IN (stamina_rule2)

[07:52] Substitution (Team_078): Jabari Barrett OUT → Draymond Irving IN (stamina_rule2)

[07:38] Team_078 possession (Score: 80-84)
Paul Ming makes the Layup and draws the foul on Derrick Rozier! And-1! Paul Ming to the line for 1. [Team fouls: 2] (Derrick Rozier: 1 personal fouls)   FT 1/1: GOOD Paul Ming makes 1/1 from the line.
Score: 80-87

[07:23] Team_029 possession (Score: 80-87)
Shai Ball makes the Layup and draws the foul on Paul Ming! And-1! Shai Ball to the line for 1. [Team fouls: 4] (Paul Ming: 1 personal fouls)   FT 1/1: MISS Shai Ball makes 0/1 from the line. Rebound secured by Malcolm Randle.
Score: 82-87

[07:09] Team_078 possession (Score: 82-87)
Damian Allen drives and kicks out. FOUL! Shooting foul on Shai Ball. Draymond Irving to the line for 2 free throws. [Team fouls: 3] (Shai Ball: 1 personal fouls)   FT 1/2: GOOD   FT 2/2: GOOD Draymond Irving makes 2/2 from the line.
Score: 82-89

[06:54] Team_029 possession (Score: 82-89)
Immanuel Irving throws a bad pass! Stolen by Magic Barrett! TURNOVER! (live ball)

[06:41] Team_078 possession (Score: 82-89)
Draymond Irving makes the Layup and draws the foul on Bones Carter! And-1! Draymond Irving to the line for 1. [Team fouls: 4] (Bones Carter: 1 personal fouls)   FT 1/1: GOOD Draymond Irving makes 1/1 from the line.
Score: 82-92

[06:30] Team_029 possession (Score: 82-92)
Bones Carter attempts a Layup. Contested by Damian Allen (5.0 feet, MAN). BONES CARTER MAKES IT!
Score: 84-92

[06:14] Team_078 possession (Score: 84-92)
Paul Ming drives and kicks out. Paul Ming attempts a 3Pt. Contested by Pau Anthony (3.7 feet, ZONE). Paul Ming misses. Rebound secured by Derrick Rozier.

[05:57] Team_029 possession (Score: 84-92)
Bones Carter attempts a 3Pt. Contested by Paul Ming (4.4 feet, ZONE). Bones Carter misses. Rebound secured by Draymond Irving.

[05:44] Team_078 possession (Score: 84-92)
Malcolm Randle drives, Pau Anthony stays with him. Malcolm Randle attempts a Dunk. Contested by Pau Anthony (3.9 feet, MAN). Malcolm Randle misses. Offensive rebound by Draymond Irving! Draymond Irving kicks it out.

[05:29] Team_078 possession (Score: 84-92)
Malcolm Randle drives to the basket... Malcolm Randle loses the ball! Stripped by Pau Anthony! TURNOVER! (live ball)

[05:11] Team_029 possession (Score: 84-92)
FOUL! Shooting foul on Magic Barrett. Shai Ball to the line for 2 free throws. [BONUS: 5 team fouls] (Magic Barrett: 1 personal fouls)   FT 1/2: GOOD   FT 2/2: GOOD Shai Ball makes 2/2 from the line.
Score: 86-92

[04:55] Team_078 possession (Score: 86-92)
Draymond Irving attempts a Layup. Contested by Shai Ball (4.1 feet, MAN). DRAYMOND IRVING MAKES IT!
Score: 86-94

[04:41] Team_029 possession (Score: 86-94)
Shai Ball drives and kicks out. Immanuel Irving attempts a 3Pt. Contested by Damian Allen (4.9 feet, ZONE). Immanuel Irving misses. Rebound secured by Paul Ming.

[04:24] Team_078 possession (Score: 86-94)
Malcolm Randle attempts a Layup. Contested by Derrick Rozier (4.1 feet, ZONE). MALCOLM RANDLE MAKES IT! Assist: Magic Barrett
Score: 86-96

[04:10] Team_029 possession (Score: 86-96)
Shai Ball drives, Draymond Irving stays with him. Shai Ball attempts a Layup. Contested by Draymond Irving (5.7 feet, MAN). SHAI BALL MAKES IT!
Score: 88-96

[03:55] Team_078 possession (Score: 88-96)
Malcolm Randle drives to the basket... Malcolm Randle commits a violation (traveling/carry)! TURNOVER! (dead ball)

[03:38] Team_029 possession (Score: 88-96)
Pau Anthony attempts a 3Pt. Contested by Damian Allen (5.3 feet, ZONE). Pau Anthony misses. Rebound secured by Malcolm Randle.

[03:21] Team_078 possession (Score: 88-96)
Magic Barrett drives and kicks out. Magic Barrett attempts a 3Pt. Contested by Immanuel Irving (5.1 feet, MAN). Magic Barrett misses. Rebound secured by Shai Ball.

[03:04] Team_029 possession (Score: 88-96)
Bones Carter drives to the basket... FOUL! Offensive foul on Bones Carter! Paul Ming drew the charge! [Team fouls: 5] (Bones Carter: 2 personal fouls) TURNOVER! (dead ball)

[02:48] Team_078 possession (Score: 88-96)
Draymond Irving attempts a 3Pt. Contested by Pau Anthony (4.0 feet, ZONE). Draymond Irving misses. Rebound secured by Shai Ball.

[02:34] Team_029 possession (Score: 88-96)
Immanuel Irving attempts a 3Pt. Contested by Magic Barrett (5.5 feet, MAN). Immanuel Irving misses. Offensive rebound by Derrick Rozier! Derrick Rozier kicks it out.

[02:18] Team_029 possession (Score: 88-96)
Derrick Rozier drives and kicks out. Bones Carter attempts a Midrange. Contested by Damian Allen (4.9 feet, MAN). Bones Carter misses. Rebound secured by Draymond Irving.

[02:00] Team_078 possession (Score: 88-96)
FOUL! Reach-in foul on Derrick Rozier during the drive. [IN THE BONUS! 6 team fouls] Magic Barrett to the line for 2 free throws. (Derrick Rozier: 2 personal fouls)   FT 1/2: MISS   FT 2/2: GOOD Magic Barrett makes 1/2 from the line.
Score: 88-97

[01:43] Team_029 possession (Score: 88-97)
Pau Anthony attempts a 3Pt. Contested by Malcolm Randle (4.6 feet, MAN). Pau Anthony misses. Rebound secured by Draymond Irving.

[01:26] Team_078 possession (Score: 88-97)
Paul Ming drives and kicks out. Magic Barrett attempts a Midrange. Contested by Immanuel Irving (5.2 feet, MAN). Magic Barrett misses. Rebound secured by Pau Anthony.

[01:14] Team_029 possession (Score: 88-97)
Immanuel Irving attempts a Layup. Contested by Paul Ming (4.9 feet, ZONE). Immanuel Irving misses. Rebound secured by Paul Ming.

[01:01] Team_078 possession (Score: 88-97)
Malcolm Randle attempts a 3Pt. Contested by Pau Anthony (3.9 feet, MAN). Malcolm Randle misses. Offensive rebound by Paul Ming! Paul Ming kicks it out.

[00:50] Team_078 possession (Score: 88-97)
Malcolm Randle makes the Layup and draws the foul on Derrick Rozier! And-1! Malcolm Randle to the line for 1. [BONUS: 7 team fouls] (Derrick Rozier: 3 personal fouls)   FT 1/1: GOOD Malcolm Randle makes 1/1 from the line.
Score: 88-100

[00:35] Team_029 possession (Score: 88-100)
Pau Anthony attempts a Midrange. Contested by Paul Ming (4.7 feet, ZONE). Pau Anthony misses. Rebound secured by Draymond Irving.

[00:16] Team_078 possession (Score: 88-100)
Magic Barrett attempts a 3Pt. Contested by Immanuel Irving (5.7 feet, ZONE). Magic Barrett misses. Rebound secured by Shai Ball.

================================================================================
                              4TH QUARTER COMPLETE                              
================================================================================

4TH QUARTER SCORE: Team_029 18, Team_078 26

BOX SCORE:
================================================================================

Team_029
--------------------------------------------------------------------------------
Player                MIN  PTS  REB  AST  TO      FG   FG%      3P   3P%
--------------------------------------------------------------------------------
Shai Ball              13    4    3    0   0   2/4    50.0     0/0   0.0
Giannis Banchero       35    3    1    0   0   1/3    33.3     0/0   0.0
Scottie Bird           35    3    0    0   0   1/2    50.0     0/0   0.0
Paul Iverson           35    2    0    0   0   1/1   100.0     0/0   0.0
James Wall             35    2    3    1   0   1/2    50.0     0/0   0.0
Bones Carter           13    2    0    0   0   1/2    50.0     0/0   0.0
Devin Butler           35    0    1    0   0   0/0     0.0     0/0   0.0
Derrick Rozier         13    0    2    0   0   0/1     0.0     0/0   0.0
Pau Anthony            13    0    1    0   0   0/3     0.0     0/0   0.0
Immanuel Irving        13    0    0    0   0   0/1     0.0     0/0   0.0

TEAM: FG: 7/19 (36.8%), 3PT: 0/5 (0.0%), REB: 11 (3 off, 8 def), AST: 1, TO: 3
TEAM FOULS: 7 [Team_078 in BONUS]


Team_078
--------------------------------------------------------------------------------
Player                MIN  PTS  REB  AST  TO      FG   FG%      3P   3P%
--------------------------------------------------------------------------------
Draymond Irving        13    7    5    0   0   3/4    75.0     0/0   0.0
Malcolm Randle         13    5    2    0   0   2/2   100.0     0/0   0.0
Ben Ginobili           35    4    3    1   0   2/2   100.0     0/0   0.0
Paul Ming              13    3    3    0   0   1/3    33.3     0/0   0.0
Kyrie Carter           35    2    0    0   0   1/3    33.3     0/0   0.0
Jabari Barrett         35    2    1    0   0   1/1   100.0     0/0   0.0
Isaiah Simmons         35    2    0    0   0   1/1   100.0     0/0   0.0
Magic Barrett          13    1    0    1   0   1/3    33.3     0/0   0.0
Jabari Barnes          35    0    0    1   0   0/1     0.0     0/0   0.0

TEAM: FG: 12/20 (60.0%), 3PT: 0/4 (0.0%), REB: 14 (2 off, 12 def), AST: 3, TO: 2
TEAM FOULS: 5 [Team_029 in BONUS]

================================================================================

================================================================================
                               FULL GAME COMPLETE                               
================================================================================

FINAL SCORE: Team_029 88, Team_078 100

SCORING BY QUARTER:
--------------------------------------------------------------------------------
Team                     Q1     Q2     Q3     Q4    FINAL
--------------------------------------------------------------------------------
Team_029                 25     25     20     18       88
Team_078                 16     32     26     26      100
--------------------------------------------------------------------------------

FULL GAME BOX SCORE:
================================================================================

Team_029
--------------------------------------------------------------------------------
Player                MIN  PTS  REB  AST  TO      FG   FG%      3P   3P%      FT STL BLK
--------------------------------------------------------------------------------
Paul Iverson           35   12    0    0   2   5/10   50.0   1/4    25.0   1/2     0   0
Scottie Bird           35   17    0    2   1   7/15   46.7   2/7    28.6   1/1     0   0
Giannis Banchero       35   13   10    3   1   6/14   42.9   3/8    37.5   2/3     1   1
James Wall             35   14   11    3   2   4/10   40.0   0/2     0.0   0/0     0   1
Devin Butler           35   10   13    2   2   7/11   63.6   0/1     0.0   0/0     0   0
Immanuel Irving        13    0    0    0   1   0/1     0.0   0/0     0.0   0/0     1   0
Bones Carter           13    4    0    0   1   2/4    50.0   0/1     0.0   0/0     0   0
Pau Anthony            13    5    4    0   0   1/4    25.0   0/2     0.0   3/3     1   0
Derrick Rozier         13    2    4    0   1   1/2    50.0   0/0     0.0   0/0     0   0
Shai Ball              13    7    3    1   2   3/6    50.0   0/0     0.0   3/4     0   0

TEAM: FG: 37/78 (47.4%), 3PT: 6/25 (24.0%), REB: 45 (10 off, 35 def), AST: 11, TO: 13


Team_078
--------------------------------------------------------------------------------
Player                MIN  PTS  REB  AST  TO      FG   FG%      3P   3P%      FT STL BLK
--------------------------------------------------------------------------------
Jabari Barnes          35   14    0    6   2   6/13   46.2   2/6    33.3   2/2     1   0
Kyrie Carter           35   11    0    0   1   4/10   40.0   2/4    50.0   1/1     0   1
Isaiah Simmons         35   13   10    2   1   4/8    50.0   0/3     0.0   3/3     0   0
Ben Ginobili           35   19   12    2   1   8/12   66.7   1/4    25.0   7/10    0   0
Jabari Barrett         35   18   17    3   2  10/14   71.4   1/1   100.0   5/8     1   0
Magic Barrett          13    1    0    1   2   1/4    25.0   0/1     0.0   1/2     1   0
Damian Allen           13    0    0    0   0   1/2    50.0   0/1     0.0   0/0     0   0
Malcolm Randle         13    5    2    0   0   2/2   100.0   0/0     0.0   1/1     0   0
Paul Ming              13    6    4    1   1   2/5    40.0   0/0     0.0   2/2     0   0
Draymond Irving        13   11    7    0   1   4/7    57.1   0/3     0.0   5/5     0   0

TEAM: FG: 43/78 (55.1%), 3PT: 6/23 (26.1%), REB: 52 (12 off, 40 def), AST: 15, TO: 11

================================================================================
