================================================================================
                        FULL GAME - Team_062 vs Team_031                        
================================================================================

================================================================================
                       1ST QUARTER - Team_062 vs Team_031                       
================================================================================

[12:00] Team_062 possession (Score: 0-0)
RJ Williamson attempts a Midrange. Contested by Gary Morant (3.5 feet, MAN). RJ Williamson misses. Rebound secured by Luka Sabonis.

[11:45] Team_031 possession (Score: 0-0)
Luka Sabonis attempts a 3Pt. Contested by RJ Williamson (5.0 feet, ZONE). Luka Sabonis misses. Rebound secured by Michael Hyland.

[11:35] Team_062 possession (Score: 0-0)
Michael Hyland attempts a 3Pt. Contested by Pau Irving (3.5 feet, MAN). Michael Hyland misses. Rebound secured by Immanuel James.

[11:19] Team_031 possession (Score: 0-0)
Shai Durant drives, Jalen Reaves stays with him. Shai Durant attempts a Dunk. Contested by Jalen Reaves (5.1 feet, ZONE). SHAI DURANT MAKES IT! Assist: Gary Morant
Score: 0-2

[11:04] Team_062 possession (Score: 0-2)
Michael Hyland drives and kicks out. Michael Hyland attempts a 3Pt. Contested by Pau Irving (3.6 feet, MAN). Michael Hyland misses. FOUL! Loose ball foul on Gary Morant during the rebound battle. [Team fouls: 1] No free throws, side out. (Gary Morant: 1 personal fouls)

[10:46] Team_062 possession (Score: 0-2)
RJ Williamson makes the Midrange and draws the foul on Gary Morant! And-1! RJ Williamson to the line for 1. [Team fouls: 2] (Gary Morant: 2 personal fouls)   FT 1/1: GOOD RJ Williamson makes 1/1 from the line.
Score: 3-2

[10:32] Team_031 possession (Score: 3-2)
Pau Irving drives and kicks out. Pau Irving attempts a Midrange. Contested by RJ Williamson (4.4 feet, ZONE). PAU IRVING MAKES IT!
Score: 3-4

[10:19] Team_062 possession (Score: 3-4)
FOUL! Reach-in foul on Immanuel James during the drive. [Team fouls: 3] No free throws, side out. (Immanuel James: 1 personal fouls)

[10:05] Team_062 possession (Score: 3-4)
RJ Williamson attempts a 3Pt. Contested by Gary Morant (3.5 feet, MAN). RJ Williamson misses. Offensive rebound by Jalen Reaves! Jalen Reaves puts it back in!
Score: 5-4

[09:54] Team_031 possession (Score: 5-4)
Pau Irving attempts a 3Pt. Contested by RJ Williamson (4.4 feet, ZONE). PAU IRVING MAKES IT! Assist: Gary Morant
Score: 5-7

[09:41] Team_062 possession (Score: 5-7)
Kawhi Thompson drives, picks up Immanuel James. Help arrives from Shai Durant! Kawhi Thompson attempts a Layup. Contested by Shai Durant (3.0 feet, ZONE). Kawhi Thompson misses. FOUL! Loose ball foul on Immanuel James during the rebound battle. [Team fouls: 4] No free throws, side out. (Immanuel James: 2 personal fouls)

[09:30] Team_062 possession (Score: 5-7)
Jalen Reaves attempts a Midrange. Contested by Pau Irving (3.8 feet, ZONE). Jalen Reaves misses. Rebound secured by Luka Sabonis.

[09:17] Team_031 possession (Score: 5-7)
Luka Sabonis drives, picks up Kawhi Thompson. Help arrives from Chris Bird! Luka Sabonis attempts a Layup. Contested by Chris Bird (5.5 feet, ZONE). LUKA SABONIS MAKES IT!
Score: 5-9

[09:00] Team_062 possession (Score: 5-9)
Chris Bird attempts a Midrange. Contested by Shai Durant (4.0 feet, MAN). Chris Bird misses. Rebound secured by Luka Sabonis.

[08:44] Team_031 possession (Score: 5-9)
Immanuel James attempts a Midrange. Contested by Kawhi Thompson (5.3 feet, MAN). IMMANUEL JAMES MAKES IT! Assist: Shai Durant
Score: 5-11

[08:32] Team_062 possession (Score: 5-11)
Chris Bird makes the Dunk and draws the foul on Shai Durant! And-1! Chris Bird to the line for 1. [BONUS: 5 team fouls] (Shai Durant: 1 personal fouls)   FT 1/1: GOOD Chris Bird makes 1/1 from the line.
Score: 8-11

[08:17] Team_031 possession (Score: 8-11)
Luka Sabonis drives and kicks out. Gary Morant attempts a 3Pt. Contested by RJ Williamson (4.4 feet, ZONE). GARY MORANT MAKES IT! Assist: Shai Durant
Score: 8-14

[08:03] Team_062 possession (Score: 8-14)
Michael Hyland attempts a 3Pt. BLOCKED BY PAU IRVING! Ball is loose! Rebound secured by Gary Morant.

[07:49] Team_031 possession (Score: 8-14)
Immanuel James attempts a Midrange. Contested by Chris Bird (4.6 feet, ZONE). Immanuel James misses. Offensive rebound by Luka Sabonis! Luka Sabonis puts it back in!
Score: 8-16

[07:36] Team_062 possession (Score: 8-16)
Michael Hyland drives and kicks out. RJ Williamson attempts a 3Pt. Contested by Gary Morant (3.8 feet, MAN). RJ Williamson misses. Rebound secured by Immanuel James.

[07:22] Team_031 possession (Score: 8-16)
Shai Durant loses control! Ball rolls out of bounds! TURNOVER! (dead ball)

[07:06] Team_062 possession (Score: 8-16)
Michael Hyland attempts a 3Pt. Contested by Pau Irving (3.5 feet, MAN). Michael Hyland misses. Rebound secured by Immanuel James.

[06:54] Team_031 possession (Score: 8-16)
Luka Sabonis attempts a Midrange. Contested by Kawhi Thompson (5.5 feet, ZONE). Luka Sabonis misses. Offensive rebound by Immanuel James! Immanuel James's putback is no good. Rebound secured by Kawhi Thompson.

[06:41] Team_062 possession (Score: 8-16)
Chris Bird attempts a 3Pt. Contested by Pau Irving (3.8 feet, ZONE). Chris Bird misses. Rebound secured by Luka Sabonis.

[06:26] Team_031 possession (Score: 8-16)
Pau Irving attempts a 3Pt. Contested by Michael Hyland (4.7 feet, MAN). Pau Irving misses. Rebound secured by Jalen Reaves.

[06:13] Team_062 possession (Score: 8-16)
Kawhi Thompson attempts a Dunk. BLOCKED BY IMMANUEL JAMES! Ball deflects out of bounds off Kawhi Thompson.

[05:58] Team_031 possession (Score: 8-16)
Immanuel James makes the Layup and draws the foul on Kawhi Thompson! And-1! Immanuel James to the line for 1. [Team fouls: 1] (Kawhi Thompson: 1 personal fouls)   FT 1/1: GOOD Immanuel James makes 1/1 from the line.
Score: 8-19

[05:46] Team_062 possession (Score: 8-19)
Chris Bird attempts a Midrange. Contested by Immanuel James (3.2 feet, ZONE). CHRIS BIRD MAKES IT!
Score: 10-19

[05:30] Team_031 possession (Score: 10-19)
FOUL! Shooting foul on Chris Bird. Shai Durant to the line for 2 free throws. [Team fouls: 2] (Chris Bird: 1 personal fouls)   FT 1/2: GOOD   FT 2/2: GOOD Shai Durant makes 2/2 from the line.
Score: 10-21

[05:21] Team_062 possession (Score: 10-21)
RJ Williamson drives to the basket... RJ Williamson throws a bad pass! Stolen by Gary Morant! TURNOVER! (live ball)

[05:10] Team_031 possession (Score: 10-21)
FOUL! Holding foul on Chris Bird. [Team fouls: 3] No free throws, side out. (Chris Bird: 2 personal fouls)

[04:57] Team_031 possession (Score: 10-21)
Pau Irving attempts a Midrange. Contested by Michael Hyland (4.8 feet, MAN). Pau Irving misses. Rebound secured by Jalen Reaves.

[04:43] Team_062 possession (Score: 10-21)
Chris Bird attempts a 3Pt. Contested by Pau Irving (3.8 feet, ZONE). CHRIS BIRD MAKES IT! Assist: Michael Hyland
Score: 13-21

[04:29] Team_031 possession (Score: 13-21)
Gary Morant drives, RJ Williamson stays with him. Gary Morant attempts a Dunk. Contested by RJ Williamson (5.1 feet, MAN). Gary Morant misses. Rebound secured by Kawhi Thompson.

[04:12] Team_062 possession (Score: 13-21)
RJ Williamson attempts a Midrange. Contested by Immanuel James (3.0 feet, ZONE). RJ Williamson misses. Rebound secured by Gary Morant.

[03:59] Team_031 possession (Score: 13-21)
Luka Sabonis drives to the basket... Luka Sabonis throws a bad pass! Stolen by Jalen Reaves! TURNOVER! (live ball)

[03:40] Team_062 possession (Score: 13-21)
Kawhi Thompson drives and kicks out. Chris Bird attempts a Midrange. Contested by Immanuel James (3.3 feet, ZONE). Chris Bird misses. Rebound secured by Luka Sabonis.

[03:21] Team_031 possession (Score: 13-21)
Shai Durant drives to the basket... Shai Durant loses the ball! Stripped by Chris Bird! TURNOVER! (live ball)

[03:09] Team_062 possession (Score: 13-21)
Jalen Reaves attempts a 3Pt. Contested by Pau Irving (4.0 feet, ZONE). JALEN REAVES MAKES IT! Assist: RJ Williamson
Score: 16-21

[02:58] Team_031 possession (Score: 16-21)
Luka Sabonis attempts a Midrange. Contested by RJ Williamson (5.2 feet, ZONE). LUKA SABONIS MAKES IT! Assist: Gary Morant
Score: 16-23

[02:44] Team_062 possession (Score: 16-23)
Jalen Reaves drives, Luka Sabonis stays with him. Jalen Reaves attempts a Layup. Contested by Luka Sabonis (3.7 feet, MAN). Jalen Reaves misses. Rebound secured by Luka Sabonis.

[02:31] Team_031 possession (Score: 16-23)
Luka Sabonis drives to the basket... Luka Sabonis throws a bad pass out of bounds! TURNOVER! (dead ball)

[02:31] Substitution (Team_062): Chris Bird OUT → Paolo McCollum IN (stamina_rule2)

[02:31] Substitution (Team_062): RJ Williamson OUT → Tony LaVine IN (stamina_rule2)

[02:31] Substitution (Team_062): Michael Hyland OUT → Paul Poole IN (stamina_rule2)

[02:31] Substitution (Team_062): Kawhi Thompson OUT → RJ Wall IN (stamina_rule2)

[02:31] Substitution (Team_062): Jalen Reaves OUT → Devin Young IN (stamina_rule2)

[02:31] Substitution (Team_031): Shai Durant OUT → Kevin Morant IN (stamina_rule2)

[02:31] Substitution (Team_031): Gary Morant OUT → Isaiah Ingram IN (stamina_rule2)

[02:31] Substitution (Team_031): Pau Irving OUT → Miles Stewart IN (stamina_rule2)

[02:31] Substitution (Team_031): Immanuel James OUT → Kobe Randle IN (stamina_rule2)

[02:31] Substitution (Team_031): Luka Sabonis OUT → Jimmy Poole IN (stamina_rule2)

[02:19] Team_062 possession (Score: 16-23)
Paul Poole attempts a Midrange. Contested by Kobe Randle (4.4 feet, ZONE). PAUL POOLE MAKES IT!
Score: 18-23

[02:03] Team_031 possession (Score: 18-23)
Isaiah Ingram attempts a 3Pt. Wide open! Tony LaVine is 6.3 feet away. [MAN] ISAIAH INGRAM MAKES IT! Assist: Kevin Morant
Score: 18-26

[01:50] Team_062 possession (Score: 18-26)
Devin Young attempts a Midrange. Wide open! Jimmy Poole is 6.1 feet away. [MAN] Devin Young misses. FOUL! Loose ball foul on Isaiah Ingram during the rebound battle. [IN THE BONUS! 6 team fouls] Devin Young to the line for 2 free throws. (Isaiah Ingram: 1 personal fouls)   FT 1/2: MISS   FT 2/2: GOOD Devin Young makes 1/2 from the line.
Score: 19-26

[01:36] Team_031 possession (Score: 19-26)
Kevin Morant makes the Layup and draws the foul on RJ Wall! And-1! Kevin Morant to the line for 1. [Team fouls: 4] (RJ Wall: 1 personal fouls)   FT 1/1: GOOD Kevin Morant makes 1/1 from the line.
Score: 19-29

[01:21] Team_062 possession (Score: 19-29)
Paul Poole attempts a 3Pt. Contested by Miles Stewart (5.4 feet, ZONE). PAUL POOLE MAKES IT! Assist: Tony LaVine
Score: 22-29

[01:10] Team_031 possession (Score: 22-29)
FOUL! Holding foul on Tony LaVine. [IN THE BONUS! 5 team fouls] Isaiah Ingram to the line for 2 free throws. (Tony LaVine: 1 personal fouls)   FT 1/2: MISS   FT 2/2: GOOD Isaiah Ingram makes 1/2 from the line.
Score: 22-30

[00:55] Team_062 possession (Score: 22-30)
Paolo McCollum drives and kicks out. Devin Young attempts a 3Pt. Contested by Jimmy Poole (5.7 feet, MAN). Devin Young misses. Offensive rebound by RJ Wall! RJ Wall kicks it out.

[00:43] Team_062 possession (Score: 22-30)
FOUL! Shooting foul on Kevin Morant. Paolo McCollum to the line for 2 free throws. [BONUS: 7 team fouls] (Kevin Morant: 1 personal fouls)   FT 1/2: GOOD   FT 2/2: GOOD Paolo McCollum makes 2/2 from the line.
Score: 24-30

[00:28] Team_031 possession (Score: 24-30)
Miles Stewart attempts a 3Pt. Wide open! Paul Poole is 6.3 feet away. [MAN] Miles Stewart misses. Rebound secured by RJ Wall.

[00:13] Team_062 possession (Score: 24-30)
Devin Young attempts a Layup. Wide open! Jimmy Poole is 6.1 feet away. [MAN] DEVIN YOUNG MAKES IT!
Score: 26-30

================================================================================
                              1ST QUARTER COMPLETE                              
================================================================================

1ST QUARTER SCORE: Team_062 26, Team_031 30

BOX SCORE:
================================================================================

Team_062
--------------------------------------------------------------------------------
Player                MIN  PTS  REB  AST  TO      FG   FG%      3P   3P%
--------------------------------------------------------------------------------
Chris Bird             10    8    0    0   0   3/5    60.0     0/0   0.0
Jalen Reaves           10    5    3    0   0   2/4    50.0     0/0   0.0
Paul Poole              2    5    0    0   0   2/2   100.0     0/0   0.0
RJ Williamson          10    3    0    1   0   1/3    33.3     0/0   0.0
Devin Young             2    3    0    0   0   2/2   100.0     0/0   0.0
Paolo McCollum          2    2    0    0   0   1/1   100.0     0/0   0.0
Michael Hyland         10    0    1    1   0   0/4     0.0     0/0   0.0
Kawhi Thompson         10    0    4    0   0   0/2     0.0     0/0   0.0
Tony LaVine             2    0    0    1   0   0/0     0.0     0/0   0.0
RJ Wall                 2    0    2    0   0   0/0     0.0     0/0   0.0

TEAM: FG: 11/23 (47.8%), 3PT: 4/8 (50.0%), REB: 9 (4 off, 5 def), AST: 3, TO: 1
TEAM FOULS: 5 [Team_031 in BONUS]


Team_031
--------------------------------------------------------------------------------
Player                MIN  PTS  REB  AST  TO      FG   FG%      3P   3P%
--------------------------------------------------------------------------------
Luka Sabonis           10    6    7    0   0   3/5    60.0     0/0   0.0
Immanuel James         10    5    3    0   0   2/2   100.0     0/0   0.0
Pau Irving             10    5    0    0   0   2/4    50.0     0/0   0.0
Shai Durant            10    4    0    2   0   2/2   100.0     0/0   0.0
Isaiah Ingram           2    4    0    0   0   2/2   100.0     0/0   0.0
Gary Morant            10    3    2    3   0   1/2    50.0     0/0   0.0
Kevin Morant            2    3    0    1   0   1/1   100.0     0/0   0.0
Miles Stewart           2    0    0    0   0   0/1     0.0     0/0   0.0

TEAM: FG: 13/19 (68.4%), 3PT: 2/5 (40.0%), REB: 13 (2 off, 11 def), AST: 6, TO: 4
TEAM FOULS: 7 [Team_062 in BONUS]

================================================================================

================================================================================
                       2ND QUARTER - Team_062 vs Team_031                       
================================================================================

[12:00] Team_062 possession (Score: 26-30)
Kawhi Thompson attempts a 3Pt. Contested by Gary Morant (3.8 feet, ZONE). Kawhi Thompson misses. Rebound secured by Luka Sabonis.

[11:46] Team_031 possession (Score: 26-30)
Shai Durant drives, picks up Chris Bird. Help arrives from Michael Hyland! Shai Durant attempts a Layup. Contested by Michael Hyland (4.3 feet, MAN). SHAI DURANT MAKES IT!
Score: 26-32

[11:30] Team_062 possession (Score: 26-32)
Michael Hyland drives and kicks out. Michael Hyland attempts a 3Pt. Contested by Pau Irving (3.6 feet, MAN). MICHAEL HYLAND MAKES IT! Assist: Chris Bird
Score: 29-32

[11:16] Team_031 possession (Score: 29-32)
Luka Sabonis makes the Layup and draws the foul on Chris Bird! And-1! Luka Sabonis to the line for 1. [Team fouls: 1] (Chris Bird: 1 personal fouls)   FT 1/1: GOOD Luka Sabonis makes 1/1 from the line.
Score: 29-35

[10:57] Team_062 possession (Score: 29-35)
Chris Bird attempts a 3Pt. Contested by Pau Irving (3.9 feet, ZONE). Chris Bird misses. Offensive rebound by Jalen Reaves! Jalen Reaves's putback is no good. Rebound secured by Luka Sabonis.

[10:40] Team_031 possession (Score: 29-35)
Shai Durant attempts a Midrange. Contested by Kawhi Thompson (5.1 feet, ZONE). Shai Durant misses. Rebound secured by Jalen Reaves.

[10:22] Team_062 possession (Score: 29-35)
Chris Bird attempts a Layup. Contested by Immanuel James (3.5 feet, ZONE). Chris Bird misses. FOUL! Loose ball foul on Luka Sabonis during the rebound battle. [Team fouls: 1] No free throws, side out. (Luka Sabonis: 1 personal fouls)

[10:09] Team_062 possession (Score: 29-35)
RJ Williamson drives and kicks out. Jalen Reaves attempts a 3Pt. Contested by Pau Irving (3.8 feet, ZONE). Jalen Reaves misses. Rebound secured by Gary Morant.

[09:51] Team_031 possession (Score: 29-35)
FOUL! Shooting foul on RJ Williamson. Immanuel James to the line for 3 free throws. [Team fouls: 2] (RJ Williamson: 1 personal fouls)   FT 1/3: GOOD   FT 2/3: GOOD   FT 3/3: GOOD Immanuel James makes 3/3 from the line.
Score: 29-38

[09:38] Team_062 possession (Score: 29-38)
Kawhi Thompson attempts a 3Pt. Contested by Immanuel James (3.4 feet, MAN). Kawhi Thompson misses. FOUL! Loose ball foul on Gary Morant during the rebound battle. [Team fouls: 2] No free throws, side out. (Gary Morant: 1 personal fouls)

[09:24] Team_062 possession (Score: 29-38)
Jalen Reaves attempts a 3Pt. Contested by Luka Sabonis (3.7 feet, MAN). Jalen Reaves misses. Rebound secured by Immanuel James.

[09:06] Team_031 possession (Score: 29-38)
Immanuel James attempts a Midrange. Contested by Chris Bird (4.8 feet, ZONE). Immanuel James misses. Rebound secured by Michael Hyland.

[08:50] Team_062 possession (Score: 29-38)
Jalen Reaves drives, Immanuel James stays with him. Jalen Reaves attempts a Dunk. Contested by Immanuel James (3.7 feet, ZONE). JALEN REAVES MAKES IT! Assist: Kawhi Thompson
Score: 31-38

[08:34] Team_031 possession (Score: 31-38)
Immanuel James attempts a Midrange. Contested by Kawhi Thompson (5.5 feet, MAN). Immanuel James misses. Rebound secured by Michael Hyland.

[08:24] Team_062 possession (Score: 31-38)
Jalen Reaves drives and kicks out. RJ Williamson attempts a Midrange. Contested by Immanuel James (3.6 feet, ZONE). RJ WILLIAMSON MAKES IT! Assist: Chris Bird
Score: 33-38

[08:08] Team_031 possession (Score: 33-38)
Gary Morant drives and kicks out. Gary Morant attempts a 3Pt. Contested by RJ Williamson (4.8 feet, MAN). GARY MORANT MAKES IT! Assist: Luka Sabonis
Score: 33-41

[07:55] Team_062 possession (Score: 33-41)
Chris Bird attempts a 3Pt. Contested by Shai Durant (4.4 feet, MAN). Chris Bird misses. Rebound secured by Immanuel James.

[07:38] Team_031 possession (Score: 33-41)
Pau Irving attempts a Layup. Contested by Michael Hyland (5.1 feet, MAN). Pau Irving misses. Rebound secured by Michael Hyland.

[07:27] Team_062 possession (Score: 33-41)
Chris Bird attempts a 3Pt. Contested by Immanuel James (3.9 feet, ZONE). Chris Bird misses. Offensive rebound by Kawhi Thompson! Kawhi Thompson kicks it out.

[07:11] Team_062 possession (Score: 33-41)
RJ Williamson attempts a Midrange. Contested by Pau Irving (3.8 feet, ZONE). RJ Williamson misses. Rebound secured by Gary Morant.

[06:58] Team_031 possession (Score: 33-41)
Luka Sabonis drives, Jalen Reaves stays with him. Luka Sabonis attempts a Layup. Contested by Jalen Reaves (6.0 feet, MAN). LUKA SABONIS MAKES IT! Assist: Immanuel James
Score: 33-43

[06:42] Team_062 possession (Score: 33-43)
Michael Hyland attempts a 3Pt. Contested by Pau Irving (4.1 feet, MAN). Michael Hyland misses. Rebound secured by Luka Sabonis.

[06:26] Team_031 possession (Score: 33-43)
FOUL! Shooting foul on Jalen Reaves. Pau Irving to the line for 2 free throws. [Team fouls: 3] (Jalen Reaves: 1 personal fouls)   FT 1/2: GOOD   FT 2/2: GOOD Pau Irving makes 2/2 from the line.
Score: 33-45

[06:13] Team_062 possession (Score: 33-45)
Jalen Reaves drives and kicks out. RJ Williamson attempts a 3Pt. Contested by Pau Irving (4.3 feet, ZONE). RJ Williamson misses. Offensive rebound by Jalen Reaves! Jalen Reaves kicks it out.

[05:56] Team_062 possession (Score: 33-45)
Kawhi Thompson drives to the basket... Kawhi Thompson commits a violation (traveling/carry)! TURNOVER! (dead ball)

[05:56] Substitution (Team_062): Chris Bird OUT → Paolo McCollum IN (stamina_rule2)

[05:56] Substitution (Team_062): RJ Williamson OUT → Tony LaVine IN (stamina_rule2)

[05:56] Substitution (Team_062): Michael Hyland OUT → Paul Poole IN (stamina_rule2)

[05:56] Substitution (Team_062): Kawhi Thompson OUT → RJ Wall IN (stamina_rule2)

[05:56] Substitution (Team_062): Jalen Reaves OUT → Devin Young IN (stamina_rule2)

[05:56] Substitution (Team_031): Shai Durant OUT → Kevin Morant IN (stamina_rule2)

[05:56] Substitution (Team_031): Gary Morant OUT → Isaiah Ingram IN (stamina_rule2)

[05:56] Substitution (Team_031): Pau Irving OUT → Miles Stewart IN (stamina_rule2)

[05:56] Substitution (Team_031): Immanuel James OUT → Kobe Randle IN (stamina_rule2)

[05:56] Substitution (Team_031): Luka Sabonis OUT → Jimmy Poole IN (stamina_rule2)

[05:42] Team_031 possession (Score: 33-45)
Kobe Randle attempts a Layup. Contested by RJ Wall (5.8 feet, ZONE). KOBE RANDLE MAKES IT! Assist: Kevin Morant
Score: 33-47

[05:29] Team_062 possession (Score: 33-47)
Tony LaVine attempts a Layup. Contested by Isaiah Ingram (4.6 feet, MAN). Tony LaVine misses. Rebound secured by Jimmy Poole.

[05:12] Team_031 possession (Score: 33-47)
Kevin Morant makes the Layup and draws the foul on RJ Wall! And-1! Kevin Morant to the line for 1. [Team fouls: 4] (RJ Wall: 1 personal fouls)   FT 1/1: GOOD Kevin Morant makes 1/1 from the line.
Score: 33-50

[04:54] Team_062 possession (Score: 33-50)
Tony LaVine attempts a 3Pt. Contested by Isaiah Ingram (4.6 feet, MAN). TONY LAVINE MAKES IT! Assist: RJ Wall
Score: 36-50

[04:40] Team_031 possession (Score: 36-50)
Jimmy Poole makes the Layup and draws the foul on RJ Wall! And-1! Jimmy Poole to the line for 1. [BONUS: 5 team fouls] (RJ Wall: 2 personal fouls)   FT 1/1: GOOD Jimmy Poole makes 1/1 from the line.
Score: 36-53

[04:23] Team_062 possession (Score: 36-53)
Paolo McCollum attempts a Midrange. Contested by Kevin Morant (5.1 feet, MAN). Paolo McCollum misses. Rebound secured by Kobe Randle.

[04:10] Team_031 possession (Score: 36-53)
Kevin Morant attempts a Midrange. Contested by Paolo McCollum (5.6 feet, MAN). Kevin Morant misses. Rebound secured by Devin Young.

[03:59] Team_062 possession (Score: 36-53)
RJ Wall attempts a 3Pt. Contested by Kobe Randle (4.3 feet, MAN). RJ WALL MAKES IT! Assist: Paolo McCollum
Score: 39-53

[03:43] Team_031 possession (Score: 39-53)
Kevin Morant attempts a Layup. Contested by Paolo McCollum (5.6 feet, MAN). Kevin Morant misses. Rebound secured by Paul Poole.

[03:28] Team_062 possession (Score: 39-53)
RJ Wall attempts a 3Pt. Contested by Miles Stewart (5.2 feet, ZONE). RJ WALL MAKES IT! Assist: Tony LaVine
Score: 42-53

[03:15] Team_031 possession (Score: 42-53)
Kevin Morant makes the Layup and draws the foul on Paolo McCollum! And-1! Kevin Morant to the line for 1. [BONUS: 6 team fouls] (Paolo McCollum: 1 personal fouls)   FT 1/1: MISS Kevin Morant makes 0/1 from the line. Offensive rebound by Jimmy Poole! Jimmy Poole kicks it out.
Score: 42-55

[03:02] Team_031 possession (Score: 42-55)
Isaiah Ingram attempts a 3Pt. Wide open! Paolo McCollum is 6.0 feet away. [ZONE] ISAIAH INGRAM MAKES IT! Assist: Kevin Morant
Score: 42-58

[02:43] Team_062 possession (Score: 42-58)
Paul Poole attempts a Midrange. Contested by Miles Stewart (5.4 feet, ZONE). PAUL POOLE MAKES IT! Assist: Devin Young
Score: 44-58

[02:27] Team_031 possession (Score: 44-58)
Kevin Morant makes the Midrange and draws the foul on Tony LaVine! And-1! Kevin Morant to the line for 1. [BONUS: 7 team fouls] (Tony LaVine: 1 personal fouls)   FT 1/1: MISS Kevin Morant makes 0/1 from the line. Rebound secured by RJ Wall.
Score: 44-60

[02:09] Team_062 possession (Score: 44-60)
RJ Wall drives to the basket... FOUL! Offensive foul on RJ Wall! Kobe Randle drew the charge! [Team fouls: 8] (RJ Wall: 3 personal fouls) TURNOVER! (dead ball)

[01:57] Team_031 possession (Score: 44-60)
Kobe Randle attempts a 3Pt. Wide open! Paolo McCollum is 6.2 feet away. [ZONE] Kobe Randle misses. Rebound secured by Devin Young.

[01:43] Team_062 possession (Score: 44-60)
RJ Wall drives to the basket... RJ Wall throws a bad pass out of bounds! TURNOVER! (dead ball)

[01:27] Team_031 possession (Score: 44-60)
Kevin Morant drives, Paolo McCollum stays with him. Kevin Morant attempts a Dunk. Contested by Paolo McCollum (5.6 feet, MAN). KEVIN MORANT MAKES IT! Assist: Jimmy Poole
Score: 44-62

[01:12] Team_062 possession (Score: 44-62)
RJ Wall attempts a Midrange. Contested by Isaiah Ingram (4.2 feet, ZONE). RJ WALL MAKES IT!
Score: 46-62

[01:01] Team_031 possession (Score: 46-62)
Kobe Randle attempts a Midrange. Contested by RJ Wall (5.8 feet, MAN). Kobe Randle misses. Rebound secured by RJ Wall.

[00:45] Team_062 possession (Score: 46-62)
Paul Poole attempts a Layup. Contested by Miles Stewart (5.4 feet, MAN). PAUL POOLE MAKES IT!
Score: 48-62

[00:30] Team_031 possession (Score: 48-62)
Miles Stewart attempts a Layup. Wide open! Paul Poole is 6.3 feet away. [MAN] MILES STEWART MAKES IT!
Score: 48-64

[00:14] Team_062 possession (Score: 48-64)
Paul Poole drives, Kobe Randle stays with him. Paul Poole attempts a Layup. Contested by Kobe Randle (4.5 feet, ZONE). PAUL POOLE MAKES IT! Assist: RJ Wall
Score: 50-64

================================================================================
                              2ND QUARTER COMPLETE                              
================================================================================

2ND QUARTER SCORE: Team_062 24, Team_031 34

BOX SCORE:
================================================================================

Team_062
--------------------------------------------------------------------------------
Player                MIN  PTS  REB  AST  TO      FG   FG%      3P   3P%
--------------------------------------------------------------------------------
RJ Wall                 8    8    2    2   0   3/3   100.0     0/0   0.0
Paul Poole              8    6    1    0   0   3/3   100.0     0/0   0.0
Michael Hyland         16    3    3    0   0   1/2    50.0     0/0   0.0
Tony LaVine             8    3    0    1   0   1/2    50.0     0/0   0.0
Jalen Reaves           16    2    3    0   0   1/2    50.0     0/0   0.0
RJ Williamson          16    2    0    0   0   1/3    33.3     0/0   0.0
Kawhi Thompson         16    0    2    1   0   0/1     0.0     0/0   0.0
Chris Bird             16    0    0    2   0   0/2     0.0     0/0   0.0
Paolo McCollum          8    0    0    1   0   0/1     0.0     0/0   0.0
Devin Young             8    0    2    1   0   0/0     0.0     0/0   0.0

TEAM: FG: 10/19 (52.6%), 3PT: 3/8 (37.5%), REB: 14 (5 off, 9 def), AST: 8, TO: 3
TEAM FOULS: 8 [Team_031 in BONUS]


Team_031
--------------------------------------------------------------------------------
Player                MIN  PTS  REB  AST  TO      FG   FG%      3P   3P%
--------------------------------------------------------------------------------
Luka Sabonis           16    5    3    1   0   2/2   100.0     0/0   0.0
Kevin Morant            8    5    0    2   0   2/5    40.0     0/0   0.0
Gary Morant            16    3    2    0   0   1/1   100.0     0/0   0.0
Immanuel James         16    3    2    1   0   1/3    33.3     0/0   0.0
Jimmy Poole             8    3    2    1   0   1/1   100.0     0/0   0.0
Isaiah Ingram           8    3    0    0   0   1/1   100.0     0/0   0.0
Shai Durant            16    2    0    0   0   1/2    50.0     0/0   0.0
Pau Irving             16    2    0    0   0   1/2    50.0     0/0   0.0
Kobe Randle             8    2    1    0   0   1/3    33.3     0/0   0.0
Miles Stewart           8    2    0    0   0   1/1   100.0     0/0   0.0

TEAM: FG: 12/21 (57.1%), 3PT: 2/3 (66.7%), REB: 9 (1 off, 8 def), AST: 5, TO: 0
TEAM FOULS: 2

================================================================================

================================================================================
                       3RD QUARTER - Team_062 vs Team_031                       
================================================================================

[12:00] Team_062 possession (Score: 50-64)
Chris Bird attempts a Layup. Contested by Shai Durant (4.0 feet, MAN). Chris Bird misses. Rebound secured by Luka Sabonis.

[11:46] Team_031 possession (Score: 50-64)
Immanuel James attempts a Midrange. Contested by Kawhi Thompson (5.3 feet, MAN). Immanuel James misses. Rebound secured by Michael Hyland.

[11:33] Team_062 possession (Score: 50-64)
RJ Williamson attempts a 3Pt. Contested by Gary Morant (3.5 feet, MAN). RJ Williamson misses. Rebound secured by Gary Morant.

[11:19] Team_031 possession (Score: 50-64)
Luka Sabonis attempts a 3Pt. Contested by RJ Williamson (5.0 feet, ZONE). LUKA SABONIS MAKES IT! Assist: Pau Irving
Score: 50-67

[11:01] Team_062 possession (Score: 50-67)
Chris Bird makes the Layup and draws the foul on Shai Durant! And-1! Chris Bird to the line for 1. [Team fouls: 1] (Shai Durant: 1 personal fouls)   FT 1/1: GOOD Chris Bird makes 1/1 from the line.
Score: 53-67

[10:50] Team_031 possession (Score: 53-67)
Pau Irving drives and kicks out. Shai Durant attempts a Midrange. Contested by Kawhi Thompson (4.8 feet, ZONE). SHAI DURANT MAKES IT!
Score: 53-69

[10:34] Team_062 possession (Score: 53-69)
FOUL! Offensive foul on Kawhi Thompson! Immanuel James drew the charge! [Team fouls: 1] (Kawhi Thompson: 1 personal fouls) TURNOVER! (dead ball)

[10:15] Team_031 possession (Score: 53-69)
Immanuel James drives and kicks out. Luka Sabonis attempts a 3Pt. Contested by Jalen Reaves (4.9 feet, MAN). Luka Sabonis misses. Offensive rebound by Luka Sabonis! Luka Sabonis puts it back in!
Score: 53-71

[09:58] Team_062 possession (Score: 53-71)
Kawhi Thompson attempts a 3Pt. Contested by Pau Irving (3.6 feet, ZONE). Kawhi Thompson misses. Offensive rebound by Kawhi Thompson! Kawhi Thompson kicks it out.

[09:43] Team_062 possession (Score: 53-71)
Kawhi Thompson attempts a Midrange. Contested by Immanuel James (3.0 feet, MAN). KAWHI THOMPSON MAKES IT! Assist: Chris Bird
Score: 55-71

[09:34] Team_031 possession (Score: 55-71)
FOUL! Shooting foul on RJ Williamson. Immanuel James to the line for 3 free throws. [Team fouls: 2] (RJ Williamson: 1 personal fouls)   FT 1/3: GOOD   FT 2/3: GOOD   FT 3/3: GOOD Immanuel James makes 3/3 from the line.
Score: 55-74

[09:20] Team_062 possession (Score: 55-74)
Kawhi Thompson makes the Layup and draws the foul on Immanuel James! And-1! Kawhi Thompson to the line for 1. [Team fouls: 2] (Immanuel James: 1 personal fouls)   FT 1/1: GOOD Kawhi Thompson makes 1/1 from the line.
Score: 58-74

[09:02] Team_031 possession (Score: 58-74)
Immanuel James attempts a Midrange. Contested by Kawhi Thompson (5.3 feet, MAN). Immanuel James misses. Rebound secured by Michael Hyland.

[08:46] Team_062 possession (Score: 58-74)
FOUL! Shooting foul on Immanuel James. Chris Bird to the line for 2 free throws. [Team fouls: 3] (Immanuel James: 2 personal fouls)   FT 1/2: GOOD   FT 2/2: MISS Chris Bird makes 1/2 from the line. Rebound secured by Immanuel James.
Score: 59-74

[08:34] Team_031 possession (Score: 59-74)
Gary Morant attempts a 3Pt. Contested by RJ Williamson (5.0 feet, MAN). Gary Morant misses. Rebound secured by Michael Hyland.

[08:18] Team_062 possession (Score: 59-74)
Michael Hyland drives to the basket... FOUL! Offensive foul on Michael Hyland! Immanuel James drew the charge! [Team fouls: 3] (Michael Hyland: 1 personal fouls) TURNOVER! (dead ball)

[08:04] Team_031 possession (Score: 59-74)
Shai Durant throws a bad pass! Stolen by Chris Bird! TURNOVER! (live ball)

[07:49] Team_062 possession (Score: 59-74)
Kawhi Thompson makes the Layup and draws the foul on Immanuel James! And-1! Kawhi Thompson to the line for 1. [Team fouls: 4] (Immanuel James: 3 personal fouls)   FT 1/1: MISS Kawhi Thompson makes 0/1 from the line. Rebound secured by Immanuel James.
Score: 61-74

[07:32] Team_031 possession (Score: 61-74)
Luka Sabonis attempts a Midrange. Contested by Jalen Reaves (5.5 feet, MAN). Luka Sabonis misses. Rebound secured by Kawhi Thompson.

[07:15] Team_062 possession (Score: 61-74)
FOUL! Reach-in foul on Immanuel James during the drive. [IN THE BONUS! 5 team fouls] Chris Bird to the line for 2 free throws. (Immanuel James: 4 personal fouls)   FT 1/2: GOOD   FT 2/2: GOOD Chris Bird makes 2/2 from the line.
Score: 63-74

[06:56] Team_031 possession (Score: 63-74)
Shai Durant attempts a 3Pt. Contested by RJ Williamson (4.5 feet, ZONE). SHAI DURANT MAKES IT! Assist: Pau Irving
Score: 63-77

[06:44] Team_062 possession (Score: 63-77)
Chris Bird attempts a 3Pt. Contested by Pau Irving (3.8 feet, ZONE). Chris Bird misses. Rebound secured by Immanuel James.

[06:33] Team_031 possession (Score: 63-77)
Luka Sabonis attempts a Layup. Contested by Jalen Reaves (5.5 feet, MAN). LUKA SABONIS MAKES IT! Assist: Gary Morant
Score: 63-79

[06:20] Team_062 possession (Score: 63-79)
Chris Bird drives, Immanuel James stays with him. Chris Bird attempts a Layup. Contested by Immanuel James (3.2 feet, ZONE). Chris Bird misses. Rebound secured by Gary Morant.

[06:04] Team_031 possession (Score: 63-79)
Immanuel James attempts a Midrange. BLOCKED BY KAWHI THOMPSON! Ball deflects out of bounds off Immanuel James.

[05:53] Team_062 possession (Score: 63-79)
Kawhi Thompson attempts a Dunk. BLOCKED BY IMMANUEL JAMES! Ball is loose! Offensive rebound by Kawhi Thompson! Kawhi Thompson kicks it out.

[05:36] Team_062 possession (Score: 63-79)
Chris Bird drives, Immanuel James stays with him. Chris Bird attempts a Layup. Contested by Immanuel James (3.2 feet, ZONE). CHRIS BIRD MAKES IT!
Score: 65-79

[05:18] Team_031 possession (Score: 65-79)
Shai Durant attempts a 3Pt. Contested by RJ Williamson (4.5 feet, ZONE). Shai Durant misses. Rebound secured by Kawhi Thompson.

[05:03] Team_062 possession (Score: 65-79)
RJ Williamson loses the ball! Stripped by Gary Morant! TURNOVER! (live ball)

[04:46] Team_031 possession (Score: 65-79)
Shai Durant attempts a Midrange. Contested by Chris Bird (4.3 feet, MAN). SHAI DURANT MAKES IT!
Score: 65-81

[04:29] Team_062 possession (Score: 65-81)
Chris Bird attempts a Layup. BLOCKED BY SHAI DURANT! Ball deflects out of bounds off Chris Bird.

[04:12] Team_031 possession (Score: 65-81)
Pau Irving attempts a Midrange. Contested by Michael Hyland (4.8 feet, MAN). PAU IRVING MAKES IT!
Score: 65-83

[03:56] Team_062 possession (Score: 65-83)
Michael Hyland attempts a 3Pt. Contested by Pau Irving (3.6 feet, MAN). MICHAEL HYLAND MAKES IT! Assist: Kawhi Thompson
Score: 68-83

[03:40] Team_031 possession (Score: 68-83)
Shai Durant attempts a 3Pt. Contested by Chris Bird (4.4 feet, MAN). Shai Durant misses. Rebound secured by Jalen Reaves.

[03:23] Team_062 possession (Score: 68-83)
FOUL! Holding foul on Luka Sabonis. [IN THE BONUS! 6 team fouls] Jalen Reaves to the line for 2 free throws. (Luka Sabonis: 1 personal fouls)   FT 1/2: GOOD   FT 2/2: GOOD Jalen Reaves makes 2/2 from the line.
Score: 70-83

[03:10] Team_031 possession (Score: 70-83)
Gary Morant drives to the basket... FOUL! Offensive foul on Gary Morant! Jalen Reaves drew the charge! [Team fouls: 7] (Gary Morant: 1 personal fouls) TURNOVER! (dead ball)

[02:55] Team_062 possession (Score: 70-83)
Jalen Reaves attempts a 3Pt. Contested by Luka Sabonis (3.6 feet, MAN). JALEN REAVES MAKES IT! Assist: Michael Hyland
Score: 73-83

[02:44] Team_031 possession (Score: 73-83)
Pau Irving attempts a 3Pt. Contested by RJ Williamson (4.6 feet, ZONE). Pau Irving misses. Rebound secured by Kawhi Thompson.

[02:28] Team_062 possession (Score: 73-83)
Chris Bird drives and kicks out. Chris Bird attempts a 3Pt. Contested by Pau Irving (3.8 feet, ZONE). Chris Bird misses. FOUL! Loose ball foul on Gary Morant during the rebound battle. [IN THE BONUS! 8 team fouls] Kawhi Thompson to the line for 2 free throws. (Gary Morant: 2 personal fouls)   FT 1/2: GOOD   FT 2/2: MISS Kawhi Thompson makes 1/2 from the line. Rebound secured by Immanuel James.
Score: 74-83

[02:16] Team_031 possession (Score: 74-83)
Shai Durant attempts a 3Pt. Contested by Chris Bird (4.5 feet, MAN). Shai Durant misses. Rebound secured by Kawhi Thompson.

[02:05] Team_062 possession (Score: 74-83)
FOUL! Reach-in foul on Immanuel James during the drive. [IN THE BONUS! 9 team fouls] Jalen Reaves to the line for 2 free throws. (Immanuel James: 5 personal fouls)   FT 1/2: MISS   FT 2/2: GOOD Jalen Reaves makes 1/2 from the line.
Score: 75-83

[01:51] Team_031 possession (Score: 75-83)
Immanuel James attempts a 3Pt. Contested by Kawhi Thompson (5.5 feet, MAN). Immanuel James misses. Rebound secured by Kawhi Thompson.

[01:36] Team_062 possession (Score: 75-83)
Michael Hyland attempts a Midrange. Contested by Pau Irving (3.9 feet, MAN). Michael Hyland misses. Rebound secured by Luka Sabonis.

[01:17] Team_031 possession (Score: 75-83)
Luka Sabonis drives, picks up Jalen Reaves. Help arrives from Chris Bird! Luka Sabonis attempts a Layup. Contested by Chris Bird (5.9 feet, MAN). LUKA SABONIS MAKES IT!
Score: 75-85

[01:04] Team_062 possession (Score: 75-85)
Kawhi Thompson attempts a 3Pt. Contested by Immanuel James (3.6 feet, MAN). Kawhi Thompson misses. Rebound secured by Immanuel James.

[00:49] Team_031 possession (Score: 75-85)
Luka Sabonis attempts a Layup. Contested by Jalen Reaves (5.9 feet, MAN). Luka Sabonis misses. Rebound secured by Jalen Reaves.

[00:34] Team_062 possession (Score: 75-85)
Jalen Reaves drives, Luka Sabonis stays with him. Jalen Reaves attempts a Layup. Contested by Luka Sabonis (3.9 feet, MAN). JALEN REAVES MAKES IT!
Score: 77-85

[00:16] Team_031 possession (Score: 77-85)
Pau Irving makes the Dunk and draws the foul on Chris Bird! And-1! Pau Irving to the line for 1. [Team fouls: 4] (Chris Bird: 1 personal fouls)   FT 1/1: GOOD Pau Irving makes 1/1 from the line.
Score: 77-88

[00:03] Team_062 possession (Score: 77-88)
Michael Hyland attempts a Midrange. Contested by Pau Irving (4.0 feet, MAN). MICHAEL HYLAND MAKES IT! Assist: Kawhi Thompson
Score: 79-88

================================================================================
                              3RD QUARTER COMPLETE                              
================================================================================

3RD QUARTER SCORE: Team_062 29, Team_031 24

BOX SCORE:
================================================================================

Team_062
--------------------------------------------------------------------------------
Player                MIN  PTS  REB  AST  TO      FG   FG%      3P   3P%
--------------------------------------------------------------------------------
Jalen Reaves           28    8    2    0   0   4/4   100.0     0/0   0.0
Chris Bird             28    7    0    1   0   3/9    33.3     0/0   0.0
Michael Hyland         28    5    3    1   0   2/3    66.7     0/0   0.0
Kawhi Thompson         28    5    7    2   0   2/4    50.0     0/0   0.0
RJ Williamson          28    0    0    0   0   0/1     0.0     0/0   0.0

TEAM: FG: 11/21 (52.4%), 3PT: 2/5 (40.0%), REB: 13 (3 off, 10 def), AST: 4, TO: 3
TEAM FOULS: 4


Team_031
--------------------------------------------------------------------------------
Player                MIN  PTS  REB  AST  TO      FG   FG%      3P   3P%
--------------------------------------------------------------------------------
Luka Sabonis           28    9    3    0   0   4/6    66.7     0/0   0.0
Shai Durant            28    7    0    0   0   3/6    50.0     0/0   0.0
Pau Irving             28    5    0    2   0   2/3    66.7     0/0   0.0
Immanuel James         28    3    5    0   0   1/5    20.0     0/0   0.0
Gary Morant            28    0    2    1   0   0/1     0.0     0/0   0.0

TEAM: FG: 10/21 (47.6%), 3PT: 3/9 (33.3%), REB: 9 (1 off, 8 def), AST: 3, TO: 2
TEAM FOULS: 9 [Team_062 in BONUS]

================================================================================

================================================================================
                       4TH QUARTER - Team_062 vs Team_031                       
================================================================================

[12:00] Team_062 possession (Score: 79-88)
Jalen Reaves attempts a 3Pt. Contested by Luka Sabonis (3.8 feet, MAN). Jalen Reaves misses. Rebound secured by Gary Morant.

[11:44] Team_031 possession (Score: 79-88)
Gary Morant attempts a Layup. Contested by Jalen Reaves (5.8 feet, ZONE). GARY MORANT MAKES IT! Assist: Luka Sabonis
Score: 79-90

[11:28] Team_062 possession (Score: 79-90)
Jalen Reaves drives to the basket... Jalen Reaves loses the ball! Stripped by Luka Sabonis! TURNOVER! (live ball)

[11:12] Team_031 possession (Score: 79-90)
Pau Irving drives, Michael Hyland stays with him. Pau Irving attempts a Layup. Contested by Michael Hyland (5.0 feet, MAN). PAU IRVING MAKES IT! Assist: Shai Durant
Score: 79-92

[10:58] Team_062 possession (Score: 79-92)
Chris Bird drives, Immanuel James stays with him. Chris Bird attempts a Dunk. Contested by Immanuel James (3.8 feet, ZONE). CHRIS BIRD MAKES IT! Assist: Kawhi Thompson
Score: 81-92

[10:44] Team_031 possession (Score: 81-92)
Gary Morant attempts a 3Pt. Contested by RJ Williamson (5.3 feet, MAN). GARY MORANT MAKES IT! Assist: Immanuel James
Score: 81-95

[10:28] Team_062 possession (Score: 81-95)
Kawhi Thompson drives, Immanuel James stays with him. Kawhi Thompson attempts a Layup. Contested by Immanuel James (3.7 feet, MAN). KAWHI THOMPSON MAKES IT! Assist: RJ Williamson
Score: 83-95

[10:16] Team_031 possession (Score: 83-95)
Immanuel James attempts a Midrange. Contested by RJ Williamson (5.2 feet, ZONE). Immanuel James misses. Rebound secured by Kawhi Thompson.

[10:01] Team_062 possession (Score: 83-95)
Jalen Reaves drives and kicks out. RJ Williamson attempts a 3Pt. Contested by Gary Morant (4.3 feet, MAN). RJ Williamson misses. Rebound secured by Luka Sabonis.

[09:51] Team_031 possession (Score: 83-95)
Luka Sabonis attempts a Midrange. Contested by Jalen Reaves (6.0 feet, MAN). Luka Sabonis misses. Rebound secured by Michael Hyland.

[09:39] Team_062 possession (Score: 83-95)
Kawhi Thompson drives and kicks out. Jalen Reaves attempts a 3Pt. Contested by Pau Irving (4.2 feet, ZONE). Jalen Reaves misses. Rebound secured by Immanuel James.

[09:25] Team_031 possession (Score: 83-95)
Immanuel James attempts a Midrange. Contested by Chris Bird (5.1 feet, ZONE). Immanuel James misses. Rebound secured by Jalen Reaves.

[09:09] Team_062 possession (Score: 83-95)
Michael Hyland attempts a Layup. Contested by Immanuel James (3.9 feet, ZONE). MICHAEL HYLAND MAKES IT!
Score: 85-95

[08:54] Team_031 possession (Score: 85-95)
Gary Morant attempts a 3Pt. Contested by RJ Williamson (5.5 feet, MAN). Gary Morant misses. Offensive rebound by Luka Sabonis! Luka Sabonis's putback is no good. Rebound secured by Kawhi Thompson.

[08:36] Team_062 possession (Score: 85-95)
Jalen Reaves attempts a Layup. Contested by Immanuel James (4.2 feet, ZONE). Jalen Reaves misses. Rebound secured by Immanuel James.

[08:20] Team_031 possession (Score: 85-95)
Luka Sabonis drives and kicks out. Pau Irving attempts a 3Pt. Contested by RJ Williamson (5.2 feet, ZONE). Pau Irving misses. Rebound secured by Jalen Reaves.

[08:05] Team_062 possession (Score: 85-95)
Chris Bird attempts a 3Pt. Contested by Shai Durant (4.7 feet, ZONE). Chris Bird misses. Offensive rebound by Jalen Reaves! Jalen Reaves kicks it out.

[07:54] Team_062 possession (Score: 85-95)
RJ Williamson drives to the basket... RJ Williamson throws a bad pass out of bounds! TURNOVER! (dead ball)

[07:54] Substitution (Team_062): Chris Bird OUT → Paolo McCollum IN (stamina_rule2)

[07:54] Substitution (Team_062): RJ Williamson OUT → Tony LaVine IN (stamina_rule2)

[07:54] Substitution (Team_062): Michael Hyland OUT → Paul Poole IN (stamina_rule2)

[07:54] Substitution (Team_062): Kawhi Thompson OUT → RJ Wall IN (stamina_rule2)

[07:54] Substitution (Team_062): Jalen Reaves OUT → Devin Young IN (stamina_rule2)

[07:54] Substitution (Team_031): Shai Durant OUT → Kevin Morant IN (stamina_rule2)

[07:54] Substitution (Team_031): Gary Morant OUT → Isaiah Ingram IN (stamina_rule2)

[07:54] Substitution (Team_031): Pau Irving OUT → Miles Stewart IN (stamina_rule2)

[07:54] Substitution (Team_031): Immanuel James OUT → Kobe Randle IN (stamina_rule2)

[07:54] Substitution (Team_031): Luka Sabonis OUT → Jimmy Poole IN (stamina_rule2)

[07:45] Team_031 possession (Score: 85-95)
Kevin Morant drives, picks up RJ Wall. Help arrives from Paolo McCollum! Kevin Morant attempts a Layup. Contested by Paolo McCollum (5.3 feet, ZONE). KEVIN MORANT MAKES IT! Assist: Kobe Randle
Score: 85-97

[07:31] Team_062 possession (Score: 85-97)
RJ Wall attempts a Midrange. Contested by Kobe Randle (4.3 feet, MAN). RJ Wall misses. Rebound secured by Kobe Randle.

[07:13] Team_031 possession (Score: 85-97)
Isaiah Ingram drives, RJ Wall stays with him. Isaiah Ingram attempts a Layup. Contested by RJ Wall (5.6 feet, ZONE). ISAIAH INGRAM MAKES IT!
Score: 85-99

[06:57] Team_062 possession (Score: 85-99)
RJ Wall attempts a 3Pt. Contested by Kobe Randle (4.3 feet, MAN). RJ Wall misses. Rebound secured by Jimmy Poole.

[06:42] Team_031 possession (Score: 85-99)
Isaiah Ingram drives, RJ Wall stays with him. Isaiah Ingram attempts a Layup. Contested by RJ Wall (5.6 feet, ZONE). Isaiah Ingram misses. Rebound secured by Devin Young.

[06:28] Team_062 possession (Score: 85-99)
FOUL! Reach-in foul on Jimmy Poole during the drive. [Team fouls: 1] No free throws, side out. (Jimmy Poole: 1 personal fouls)

[06:13] Team_062 possession (Score: 85-99)
FOUL! Holding foul on Kevin Morant. [Team fouls: 2] No free throws, side out. (Kevin Morant: 1 personal fouls)

[06:04] Team_062 possession (Score: 85-99)
Paolo McCollum attempts a 3Pt. Contested by Miles Stewart (5.5 feet, ZONE). Paolo McCollum misses. Rebound secured by Isaiah Ingram.

[05:48] Team_031 possession (Score: 85-99)
Kobe Randle attempts a Layup. Contested by RJ Wall (5.8 feet, ZONE). KOBE RANDLE MAKES IT! Assist: Jimmy Poole
Score: 85-101

[05:30] Team_062 possession (Score: 85-101)
RJ Wall attempts a 3Pt. Contested by Miles Stewart (5.2 feet, ZONE). RJ Wall misses. Rebound secured by Jimmy Poole.

[05:17] Team_031 possession (Score: 85-101)
Jimmy Poole commits a violation (traveling/carry)! TURNOVER! (dead ball)

[05:05] Team_062 possession (Score: 85-101)
FOUL! Reach-in foul on Kobe Randle during the drive. [Team fouls: 3] No free throws, side out. (Kobe Randle: 1 personal fouls)

[04:51] Team_062 possession (Score: 85-101)
Paolo McCollum loses control! Ball rolls out of bounds! TURNOVER! (dead ball)

[04:34] Team_031 possession (Score: 85-101)
Jimmy Poole attempts a 3Pt. Contested by Paolo McCollum (5.5 feet, ZONE). JIMMY POOLE MAKES IT!
Score: 85-104

[04:16] Team_062 possession (Score: 85-104)
Tony LaVine attempts a Midrange. Contested by Isaiah Ingram (4.6 feet, MAN). Tony LaVine misses. Rebound secured by Kobe Randle.

[04:03] Team_031 possession (Score: 85-104)
Jimmy Poole drives and kicks out. Kobe Randle attempts a 3Pt. Contested by RJ Wall (5.2 feet, MAN). Kobe Randle misses. Rebound secured by RJ Wall.

[03:49] Team_062 possession (Score: 85-104)
Paul Poole attempts a Midrange. Contested by Kobe Randle (4.4 feet, ZONE). PAUL POOLE MAKES IT!
Score: 87-104

[03:37] Team_031 possession (Score: 87-104)
Jimmy Poole drives, RJ Wall stays with him. Jimmy Poole attempts a Layup. Contested by RJ Wall (5.1 feet, ZONE). JIMMY POOLE MAKES IT! Assist: Kobe Randle
Score: 87-106

[03:25] Team_062 possession (Score: 87-106)
Devin Young drives, Jimmy Poole stays with him. Devin Young attempts a Dunk. Wide open! Jimmy Poole is 6.1 feet away. [MAN] Devin Young misses. FOUL! Loose ball foul on Isaiah Ingram during the rebound battle. [Team fouls: 4] No free throws, side out. (Isaiah Ingram: 1 personal fouls)

[03:11] Team_062 possession (Score: 87-106)
RJ Wall attempts a Layup. Contested by Kobe Randle (4.3 feet, ZONE). RJ Wall misses. Offensive rebound by RJ Wall! RJ Wall kicks it out.

[02:51] Team_062 possession (Score: 87-106)
Tony LaVine makes the Layup and draws the foul on Isaiah Ingram! And-1! Tony LaVine to the line for 1. [BONUS: 5 team fouls] (Isaiah Ingram: 2 personal fouls)   FT 1/1: GOOD Tony LaVine makes 1/1 from the line.
Score: 90-106

[02:38] Team_031 possession (Score: 90-106)
FOUL! Reach-in foul on RJ Wall during the drive. [Team fouls: 1] No free throws, side out. (RJ Wall: 1 personal fouls)

[02:19] Team_031 possession (Score: 90-106)
Jimmy Poole attempts a Midrange. Contested by Tony LaVine (5.8 feet, ZONE). Jimmy Poole misses. Offensive rebound by Isaiah Ingram! Isaiah Ingram kicks it out.

[02:04] Team_031 possession (Score: 90-106)
Isaiah Ingram attempts a Layup. Wide open! Tony LaVine is 6.3 feet away. [MAN] ISAIAH INGRAM MAKES IT! Assist: Kevin Morant
Score: 90-108

[01:45] Team_062 possession (Score: 90-108)
Paolo McCollum drives and kicks out. RJ Wall attempts a Midrange. Contested by Kobe Randle (4.4 feet, MAN). RJ Wall misses. Rebound secured by Isaiah Ingram.

[01:34] Team_031 possession (Score: 90-108)
Kevin Morant drives and kicks out. Jimmy Poole attempts a Midrange. Wide open! Devin Young is 6.0 feet away. [MAN] JIMMY POOLE MAKES IT!
Score: 90-110

[01:23] Team_062 possession (Score: 90-110)
Tony LaVine makes the Layup and draws the foul on Isaiah Ingram! And-1! Tony LaVine to the line for 1. [BONUS: 6 team fouls] (Isaiah Ingram: 3 personal fouls)   FT 1/1: GOOD Tony LaVine makes 1/1 from the line.
Score: 93-110

[01:06] Team_031 possession (Score: 93-110)
Kevin Morant attempts a Midrange. Wide open! Paul Poole is 6.4 feet away. [ZONE] KEVIN MORANT MAKES IT!
Score: 93-112

[00:51] Team_062 possession (Score: 93-112)
Paolo McCollum attempts a 3Pt. Contested by Kevin Morant (5.1 feet, MAN). Paolo McCollum misses. Rebound secured by Jimmy Poole.

[00:37] Team_031 possession (Score: 93-112)
Miles Stewart attempts a 3Pt. Wide open! Paul Poole is 6.3 feet away. [MAN] Miles Stewart misses. Rebound secured by RJ Wall.

[00:24] Team_062 possession (Score: 93-112)
Devin Young attempts a Layup. Wide open! Jimmy Poole is 6.1 feet away. [MAN] DEVIN YOUNG MAKES IT! Assist: Tony LaVine
Score: 95-112

[00:10] Team_031 possession (Score: 95-112)
Isaiah Ingram attempts a 3Pt. Wide open! Paolo McCollum is 6.1 feet away. [ZONE] Isaiah Ingram misses. Offensive rebound by Isaiah Ingram! Isaiah Ingram kicks it out.

================================================================================
                              4TH QUARTER COMPLETE                              
================================================================================

4TH QUARTER SCORE: Team_062 16, Team_031 24

BOX SCORE:
================================================================================

Team_062
--------------------------------------------------------------------------------
Player                MIN  PTS  REB  AST  TO      FG   FG%      3P   3P%
--------------------------------------------------------------------------------
Tony LaVine            16    6    0    1   0   2/3    66.7     0/0   0.0
Chris Bird             32    2    0    0   0   1/1   100.0     0/0   0.0
Michael Hyland         32    2    1    0   0   1/1   100.0     0/0   0.0
Devin Young            16    2    2    0   0   1/1   100.0     0/0   0.0
Paul Poole             16    2    0    0   0   1/1   100.0     0/0   0.0
Jalen Reaves           32    0    3    0   0   0/3     0.0     0/0   0.0
RJ Williamson          32    0    0    1   0   0/0     0.0     0/0   0.0
RJ Wall                16    0    3    0   0   0/3     0.0     0/0   0.0
Paolo McCollum         16    0    0    0   0   0/3     0.0     0/0   0.0

TEAM: FG: 7/18 (38.9%), 3PT: 0/5 (0.0%), REB: 10 (3 off, 7 def), AST: 3, TO: 3
TEAM FOULS: 1


Team_031
--------------------------------------------------------------------------------
Player                MIN  PTS  REB  AST  TO      FG   FG%      3P   3P%
--------------------------------------------------------------------------------
Jimmy Poole            16    7    3    1   0   3/4    75.0     0/0   0.0
Gary Morant            32    5    1    0   0   2/3    66.7     0/0   0.0
Kevin Morant           16    4    0    1   0   2/2   100.0     0/0   0.0
Isaiah Ingram          16    4    4    0   0   2/3    66.7     0/0   0.0
Pau Irving             32    2    0    0   0   1/1   100.0     0/0   0.0
Kawhi Thompson         32    2    2    1   0   1/2    50.0     0/0   0.0
Kobe Randle            16    2    2    2   0   1/1   100.0     0/0   0.0
Luka Sabonis           32    0    1    1   0   0/2     0.0     0/0   0.0
Shai Durant            32    0    0    1   0   0/0     0.0     0/0   0.0
Immanuel James         32    0    2    1   0   0/2     0.0     0/0   0.0
Miles Stewart          16    0    0    0   0   0/1     0.0     0/0   0.0

TEAM: FG: 11/19 (57.9%), 3PT: 2/4 (50.0%), REB: 14 (3 off, 11 def), AST: 7, TO: 1
TEAM FOULS: 6 [Team_062 in BONUS]

================================================================================

================================================================================
                               FULL GAME COMPLETE                               
================================================================================

FINAL SCORE: Team_062 95, Team_031 112

SCORING BY QUARTER:
--------------------------------------------------------------------------------
Team                     Q1     Q2     Q3     Q4    FINAL
--------------------------------------------------------------------------------
Team_062                 26     24     29     16       95
Team_031                 30     34     24     24      112
--------------------------------------------------------------------------------

FULL GAME BOX SCORE:
================================================================================

Team_062
--------------------------------------------------------------------------------
Player                MIN  PTS  REB  AST  TO      FG   FG%      3P   3P%      FT STL BLK
--------------------------------------------------------------------------------
Chris Bird             32   17    0    3   0   7/17   41.2   1/5    20.0   5/6     2   0
RJ Williamson          32    5    0    2   2   2/7    28.6   1/2    50.0   1/1     0   0
Michael Hyland         32   10    8    2   2   4/10   40.0   1/5    20.0   0/0     0   0
Kawhi Thompson         32    7   15    4   2   3/9    33.3   0/2     0.0   2/4     0   1
Jalen Reaves           32   15   11    0   1   6/12   50.0   2/4    50.0   3/4     1   0
Paolo McCollum         16    2    0    1   1   1/5    20.0   0/2     0.0   2/2     0   0
Tony LaVine            16    9    0    3   0   3/5    60.0   1/1   100.0   2/2     0   0
Paul Poole             16   13    1    0   0   6/6   100.0   1/1   100.0   0/0     0   0
RJ Wall                16    8    7    2   2   3/6    50.0   2/4    50.0   0/0     0   0
Devin Young            16    5    4    1   0   3/3   100.0   0/0     0.0   1/2     0   0

TEAM: FG: 39/81 (48.1%), 3PT: 9/26 (34.6%), REB: 46 (15 off, 31 def), AST: 18, TO: 10


Team_031
--------------------------------------------------------------------------------
Player                MIN  PTS  REB  AST  TO      FG   FG%      3P   3P%      FT STL BLK
--------------------------------------------------------------------------------
Shai Durant            32   13    0    3   3   5/9    55.6   1/4    25.0   2/2     0   1
Gary Morant            32   11    7    4   0   3/6    50.0   1/3    33.3   0/0     2   0
Pau Irving             32   14    0    2   0   7/11   63.6   1/3    33.3   3/3     0   1
Immanuel James         32   11   12    2   2   6/14   42.9   2/3    66.7   7/7     0   2
Luka Sabonis           32   20   14    2   1   8/14   57.1   1/2    50.0   1/1     1   0
Kevin Morant           16   12    0    4   0   6/9    66.7   0/0     0.0   2/4     0   0
Isaiah Ingram          16   11    4    0   0   4/5    80.0   2/2   100.0   1/2     0   0
Miles Stewart          16    2    0    0   0   1/3    33.3   0/2     0.0   0/0     0   0
Kobe Randle            16    4    3    2   0   2/4    50.0   0/1     0.0   0/0     0   0
Jimmy Poole            16   10    5    2   1   3/4    75.0   1/1   100.0   1/1     0   0

TEAM: FG: 46/80 (57.5%), 3PT: 9/21 (42.9%), REB: 45 (7 off, 38 def), AST: 21, TO: 7

================================================================================
