================================================================================
                        FULL GAME - Team_023 vs Team_081                        
================================================================================

================================================================================
                       1ST QUARTER - Team_023 vs Team_081                       
================================================================================

[12:00] Team_023 possession (Score: 0-0)
Tim Bane attempts a Midrange. Contested by Franz Antetokounmpo (4.7 feet, MAN). Tim Bane misses. Rebound secured by Bradley Sabonis.

[11:43] Team_081 possession (Score: 0-0)
Vince Adebayo attempts a 3Pt. BLOCKED BY KYLE PAUL! Ball deflects out of bounds off Vince Adebayo.

[11:33] Team_023 possession (Score: 0-0)
FOUL! Reach-in foul on Franz Antetokounmpo during the drive. [Team fouls: 1] No free throws, side out. (Franz Antetokounmpo: 1 personal fouls)

[11:20] Team_023 possession (Score: 0-0)
Kyle Paul attempts a Midrange. Contested by Bradley Leonard (4.1 feet, ZONE). KYLE PAUL MAKES IT! Assist: Trae Ingram
Score: 2-0

[11:09] Team_081 possession (Score: 2-0)
Franz Antetokounmpo attempts a Dunk. BLOCKED BY TIM BANE! Ball is loose! Rebound secured by Tim Bane.

[10:59] Team_023 possession (Score: 2-0)
Tim Bane attempts a Layup. Contested by Franz Antetokounmpo (4.7 feet, ZONE). TIM BANE MAKES IT!
Score: 4-0

[10:45] Team_081 possession (Score: 4-0)
FOUL! Reach-in foul on Tim Bane during the drive. [Team fouls: 1] No free throws, side out. (Tim Bane: 1 personal fouls)

[10:34] Team_081 possession (Score: 4-0)
Bradley Leonard attempts a 3Pt. Contested by Collin Ginobili (5.0 feet, MAN). Bradley Leonard misses. Rebound secured by Josh Morant.

[10:23] Team_023 possession (Score: 4-0)
Josh Morant attempts a 3Pt. Contested by Bradley Sabonis (4.2 feet, MAN). Josh Morant misses. Rebound secured by Bradley Sabonis.

[10:08] Team_081 possession (Score: 4-0)
Bradley Leonard drives, Tim Bane stays with him. Bradley Leonard attempts a Layup. Contested by Tim Bane (4.0 feet, ZONE). BRADLEY LEONARD MAKES IT! Assist: Vince Adebayo
Score: 4-2

[09:55] Team_023 possession (Score: 4-2)
Kyle Paul attempts a 3Pt. Contested by Vince Adebayo (3.8 feet, ZONE). Kyle Paul misses. Rebound secured by Franz Antetokounmpo.

[09:43] Team_081 possession (Score: 4-2)
Julius Durant attempts a 3Pt. Contested by Kyle Paul (2.9 feet, ZONE). Julius Durant misses. Rebound secured by Josh Morant.

[09:25] Team_023 possession (Score: 4-2)
Trae Ingram attempts a 3Pt. Contested by Julius Durant (4.0 feet, MAN). Trae Ingram misses. Offensive rebound by Tim Bane! Tim Bane puts it back in!
Score: 6-2

[09:07] Team_081 possession (Score: 6-2)
FOUL! Reach-in foul on Kyle Paul during the drive. [Team fouls: 2] No free throws, side out. (Kyle Paul: 1 personal fouls)

[08:52] Team_081 possession (Score: 6-2)
Vince Adebayo attempts a Midrange. Contested by Kyle Paul (2.8 feet, MAN). VINCE ADEBAYO MAKES IT!
Score: 6-4

[08:41] Team_023 possession (Score: 6-4)
Josh Morant attempts a 3Pt. Contested by Bradley Sabonis (4.2 feet, MAN). Josh Morant misses. Offensive rebound by Tim Bane! Tim Bane puts it back in!
Score: 8-4

[08:21] Team_081 possession (Score: 8-4)
Bradley Leonard drives, picks up Collin Ginobili. Help arrives from Kyle Paul! Bradley Leonard attempts a Layup. Contested by Kyle Paul (5.0 feet, MAN). Bradley Leonard misses. Rebound secured by Kyle Paul.

[08:07] Team_023 possession (Score: 8-4)
Josh Morant makes the Layup and draws the foul on Bradley Sabonis! And-1! Josh Morant to the line for 1. [Team fouls: 2] (Bradley Sabonis: 1 personal fouls)   FT 1/1: MISS Josh Morant makes 0/1 from the line. Rebound secured by Bradley Sabonis.
Score: 10-4

[07:53] Team_081 possession (Score: 10-4)
Julius Durant drives, Tim Bane stays with him. Julius Durant attempts a Layup. Contested by Tim Bane (3.9 feet, ZONE). Julius Durant misses. Rebound secured by Kyle Paul.

[07:42] Team_023 possession (Score: 10-4)
Tim Bane drives, Franz Antetokounmpo stays with him. Tim Bane attempts a Dunk. Contested by Franz Antetokounmpo (4.7 feet, ZONE). TIM BANE MAKES IT! Assist: Collin Ginobili
Score: 12-4

[07:32] Team_081 possession (Score: 12-4)
Bradley Sabonis attempts a 3Pt. Contested by Kyle Paul (2.7 feet, ZONE). Bradley Sabonis misses. Rebound secured by Kyle Paul.

[07:18] Team_023 possession (Score: 12-4)
Collin Ginobili attempts a Midrange. Contested by Bradley Leonard (4.2 feet, MAN). COLLIN GINOBILI MAKES IT!
Score: 14-4

[07:03] Team_081 possession (Score: 14-4)
Bradley Sabonis loses the ball! Stripped by Josh Morant! TURNOVER! (live ball)

[06:47] Team_023 possession (Score: 14-4)
Josh Morant attempts a Layup. Contested by Franz Antetokounmpo (4.4 feet, ZONE). JOSH MORANT MAKES IT! Assist: Collin Ginobili
Score: 16-4

[06:33] Team_081 possession (Score: 16-4)
Bradley Leonard attempts a 3Pt. Contested by Kyle Paul (3.0 feet, ZONE). Bradley Leonard misses. Offensive rebound by Franz Antetokounmpo! Franz Antetokounmpo puts it back in!
Score: 16-6

[06:19] Team_023 possession (Score: 16-6)
Tim Bane drives and kicks out. Collin Ginobili attempts a 3Pt. Contested by Bradley Leonard (3.7 feet, MAN). Collin Ginobili misses. Offensive rebound by Tim Bane! Tim Bane puts it back in!
Score: 18-6

[06:06] Team_081 possession (Score: 18-6)
Bradley Leonard attempts a 3Pt. Contested by Kyle Paul (3.0 feet, ZONE). Bradley Leonard misses. Rebound secured by Josh Morant.

[05:52] Team_023 possession (Score: 18-6)
Josh Morant drives, Bradley Sabonis stays with him. Josh Morant attempts a Layup. Contested by Bradley Sabonis (4.2 feet, MAN). JOSH MORANT MAKES IT!
Score: 20-6

[05:43] Team_081 possession (Score: 20-6)
Bradley Sabonis attempts a 3Pt. Contested by Kyle Paul (2.7 feet, ZONE). Bradley Sabonis misses. FOUL! Loose ball foul on Kyle Paul during the rebound battle. [Team fouls: 3] No free throws, side out. (Kyle Paul: 2 personal fouls)

[05:27] Team_081 possession (Score: 20-6)
Bradley Sabonis attempts a 3Pt. Contested by Kyle Paul (2.8 feet, ZONE). Bradley Sabonis misses. Rebound secured by Josh Morant.

[05:12] Team_023 possession (Score: 20-6)
Tim Bane drives, picks up Franz Antetokounmpo. Help arrives from Bradley Leonard! Tim Bane attempts a Layup. Contested by Bradley Leonard (4.7 feet, ZONE). TIM BANE MAKES IT! Assist: Kyle Paul
Score: 22-6

[04:56] Team_081 possession (Score: 22-6)
Bradley Leonard attempts a 3Pt. Contested by Kyle Paul (3.1 feet, ZONE). BRADLEY LEONARD MAKES IT! Assist: Julius Durant
Score: 22-9

[04:43] Team_023 possession (Score: 22-9)
Josh Morant makes the Layup and draws the foul on Bradley Sabonis! And-1! Josh Morant to the line for 1. [Team fouls: 3] (Bradley Sabonis: 2 personal fouls)   FT 1/1: GOOD Josh Morant makes 1/1 from the line.
Score: 25-9

[04:26] Team_081 possession (Score: 25-9)
Julius Durant attempts a 3Pt. Contested by Trae Ingram (3.6 feet, MAN). JULIUS DURANT MAKES IT! Assist: Vince Adebayo
Score: 25-12

[04:13] Team_023 possession (Score: 25-12)
Kyle Paul attempts a 3Pt. Contested by Bradley Leonard (4.1 feet, ZONE). Kyle Paul misses. Rebound secured by Vince Adebayo.

[04:00] Team_081 possession (Score: 25-12)
Bradley Leonard drives, picks up Collin Ginobili. Help arrives from Kyle Paul! Bradley Leonard attempts a Dunk. Contested by Kyle Paul (5.1 feet, MAN). BRADLEY LEONARD MAKES IT! Assist: Bradley Sabonis
Score: 25-14

[03:46] Team_023 possession (Score: 25-14)
Collin Ginobili attempts a Layup. BLOCKED BY VINCE ADEBAYO! Ball is loose! Rebound secured by Vince Adebayo.

[03:32] Team_081 possession (Score: 25-14)
Bradley Sabonis attempts a 3Pt. Contested by Kyle Paul (3.0 feet, ZONE). Bradley Sabonis misses. Rebound secured by Josh Morant.

[03:16] Team_023 possession (Score: 25-14)
Josh Morant drives, picks up Bradley Sabonis. Help arrives from Bradley Leonard! Josh Morant attempts a Dunk. Contested by Bradley Leonard (4.4 feet, MAN). JOSH MORANT MAKES IT! Assist: Collin Ginobili
Score: 27-14

[03:04] Team_081 possession (Score: 27-14)
FOUL! Reach-in foul on Tim Bane during the drive. [Team fouls: 4] No free throws, side out. (Tim Bane: 2 personal fouls)

[02:48] Team_081 possession (Score: 27-14)
Franz Antetokounmpo attempts a 3Pt. Contested by Collin Ginobili (5.2 feet, ZONE). FRANZ ANTETOKOUNMPO MAKES IT! Assist: Julius Durant
Score: 27-17

[02:32] Team_023 possession (Score: 27-17)
Tim Bane attempts a Layup. Contested by Franz Antetokounmpo (4.9 feet, ZONE). Tim Bane misses. Rebound secured by Franz Antetokounmpo.

[02:20] Team_081 possession (Score: 27-17)
Vince Adebayo drives, Kyle Paul stays with him. Vince Adebayo attempts a Layup. Contested by Kyle Paul (3.2 feet, MAN). Vince Adebayo misses. Rebound secured by Tim Bane.

[02:07] Team_023 possession (Score: 27-17)
Tim Bane makes the Layup and draws the foul on Franz Antetokounmpo! And-1! Tim Bane to the line for 1. [Team fouls: 4] (Franz Antetokounmpo: 2 personal fouls)   FT 1/1: GOOD Tim Bane makes 1/1 from the line.
Score: 30-17

[01:52] Team_081 possession (Score: 30-17)
Bradley Sabonis makes the Layup and draws the foul on Tim Bane! And-1! Bradley Sabonis to the line for 1. [BONUS: 5 team fouls] (Tim Bane: 3 personal fouls)   FT 1/1: GOOD Bradley Sabonis makes 1/1 from the line.
Score: 30-20

[01:36] Team_023 possession (Score: 30-20)
Kyle Paul drives, picks up Franz Antetokounmpo. Help arrives from Bradley Leonard! Kyle Paul attempts a Layup. Contested by Bradley Leonard (5.0 feet, ZONE). KYLE PAUL MAKES IT! Assist: Trae Ingram
Score: 32-20

[01:24] Team_081 possession (Score: 32-20)
Franz Antetokounmpo attempts a Midrange. Contested by Tim Bane (4.4 feet, MAN). FRANZ ANTETOKOUNMPO MAKES IT! Assist: Vince Adebayo
Score: 32-22

[01:14] Team_023 possession (Score: 32-22)
FOUL! Offensive foul on Kyle Paul! Vince Adebayo drew the charge! [Team fouls: 6] (Kyle Paul: 3 personal fouls) TURNOVER! (dead ball)

[00:58] Team_081 possession (Score: 32-22)
FOUL! Holding foul on Kyle Paul. [IN THE BONUS! 7 team fouls] Vince Adebayo to the line for 2 free throws. (Kyle Paul: 4 personal fouls)   FT 1/2: GOOD   FT 2/2: GOOD Vince Adebayo makes 2/2 from the line.
Score: 32-24

[00:46] Team_023 possession (Score: 32-24)
Collin Ginobili attempts a Midrange. Contested by Bradley Leonard (4.6 feet, ZONE). COLLIN GINOBILI MAKES IT! Assist: Josh Morant
Score: 34-24

[00:35] Team_081 possession (Score: 34-24)
Vince Adebayo attempts a 3Pt. Contested by Kyle Paul (3.5 feet, MAN). Vince Adebayo misses. Rebound secured by Tim Bane.

[00:18] Team_023 possession (Score: 34-24)
Tim Bane attempts a Midrange. Contested by Vince Adebayo (4.5 feet, ZONE). Tim Bane misses. Rebound secured by Vince Adebayo.

[00:04] Team_081 possession (Score: 34-24)
Vince Adebayo attempts a Midrange. Contested by Josh Morant (4.6 feet, ZONE). Vince Adebayo misses. Rebound secured by Josh Morant.

================================================================================
                              1ST QUARTER COMPLETE                              
================================================================================

1ST QUARTER SCORE: Team_023 34, Team_081 24

BOX SCORE:
================================================================================

Team_023
--------------------------------------------------------------------------------
Player                MIN  PTS  REB  AST  TO      FG   FG%      3P   3P%
--------------------------------------------------------------------------------
Tim Bane               12   15    6    0   0   7/10   70.0     0/0   0.0
Josh Morant            12    9    6    1   0   4/6    66.7     0/0   0.0
Kyle Paul              12    4    3    1   0   2/4    50.0     0/0   0.0
Collin Ginobili        12    4    0    3   0   2/3    66.7     0/0   0.0
Trae Ingram            12    0    0    2   0   0/0     0.0     0/0   0.0

TEAM: FG: 15/23 (65.2%), 3PT: 2/5 (40.0%), REB: 15 (3 off, 12 def), AST: 7, TO: 1
TEAM FOULS: 7 [Team_081 in BONUS]


Team_081
--------------------------------------------------------------------------------
Player                MIN  PTS  REB  AST  TO      FG   FG%      3P   3P%
--------------------------------------------------------------------------------
Franz Antetokounmpo    12    7    4    0   0   3/4    75.0     0/0   0.0
Bradley Leonard        12    7    0    0   0   3/6    50.0     0/0   0.0
Vince Adebayo          12    4    3    3   0   2/6    33.3     0/0   0.0
Bradley Sabonis        12    3    3    1   0   1/4    25.0     0/0   0.0
Julius Durant          12    3    0    2   0   1/3    33.3     0/0   0.0

TEAM: FG: 10/23 (43.5%), 3PT: 4/12 (33.3%), REB: 10 (2 off, 8 def), AST: 6, TO: 1
TEAM FOULS: 4

================================================================================

================================================================================
                       2ND QUARTER - Team_023 vs Team_081                       
================================================================================

[12:00] Team_023 possession (Score: 34-24)
Trae Ingram attempts a Midrange. Contested by Vince Adebayo (3.8 feet, ZONE). TRAE INGRAM MAKES IT!
Score: 36-24

[11:45] Team_081 possession (Score: 36-24)
Julius Durant attempts a 3Pt. Contested by Kyle Paul (3.4 feet, ZONE). JULIUS DURANT MAKES IT! Assist: Bradley Leonard
Score: 36-27

[11:30] Team_023 possession (Score: 36-27)
Tim Bane attempts a Layup. Contested by Franz Antetokounmpo (5.0 feet, ZONE). TIM BANE MAKES IT!
Score: 38-27

[11:15] Team_081 possession (Score: 38-27)
Bradley Leonard attempts a 3Pt. Contested by Trae Ingram (4.0 feet, ZONE). Bradley Leonard misses. Offensive rebound by Franz Antetokounmpo! Franz Antetokounmpo puts it back in!
Score: 38-29

[10:57] Team_023 possession (Score: 38-29)
Josh Morant drives, picks up Franz Antetokounmpo. Help arrives from Bradley Leonard! Josh Morant attempts a Layup. Contested by Bradley Leonard (4.9 feet, ZONE). JOSH MORANT MAKES IT! Assist: Collin Ginobili
Score: 40-29

[10:45] Team_081 possession (Score: 40-29)
FOUL! Holding foul on Josh Morant. [Team fouls: 1] No free throws, side out. (Josh Morant: 1 personal fouls)

[10:28] Team_081 possession (Score: 40-29)
Julius Durant makes the Dunk and draws the foul on Tim Bane! And-1! Julius Durant to the line for 1. [Team fouls: 2] (Tim Bane: 1 personal fouls)   FT 1/1: GOOD Julius Durant makes 1/1 from the line.
Score: 40-32

[10:10] Team_023 possession (Score: 40-32)
Josh Morant drives and kicks out. Tim Bane attempts a 3Pt. Contested by Bradley Leonard (4.3 feet, ZONE). Tim Bane misses. Offensive rebound by Tim Bane! Tim Bane kicks it out.

[09:57] Team_023 possession (Score: 40-32)
Josh Morant drives and kicks out. Collin Ginobili attempts a Midrange. Contested by Vince Adebayo (4.3 feet, ZONE). COLLIN GINOBILI MAKES IT! Assist: Kyle Paul
Score: 42-32

[09:45] Team_081 possession (Score: 42-32)
FOUL! Reach-in foul on Tim Bane during the drive. [Team fouls: 3] No free throws, side out. (Tim Bane: 2 personal fouls)

[09:31] Team_081 possession (Score: 42-32)
Vince Adebayo attempts a Midrange. Contested by Kyle Paul (3.6 feet, MAN). VINCE ADEBAYO MAKES IT!
Score: 42-34

[09:17] Team_023 possession (Score: 42-34)
Tim Bane attempts a Layup. Contested by Franz Antetokounmpo (5.3 feet, MAN). Tim Bane misses. Rebound secured by Bradley Sabonis.

[09:00] Team_081 possession (Score: 42-34)
Bradley Sabonis attempts a Midrange. Contested by Collin Ginobili (5.4 feet, ZONE). BRADLEY SABONIS MAKES IT! Assist: Bradley Leonard
Score: 42-36

[08:45] Team_023 possession (Score: 42-36)
FOUL! Shooting foul on Bradley Leonard. Kyle Paul to the line for 3 free throws. [Team fouls: 1] (Bradley Leonard: 1 personal fouls)   FT 1/3: GOOD   FT 2/3: GOOD   FT 3/3: GOOD Kyle Paul makes 3/3 from the line.
Score: 45-36

[08:31] Team_081 possession (Score: 45-36)
Franz Antetokounmpo drives, Tim Bane stays with him. Franz Antetokounmpo attempts a Dunk. Contested by Tim Bane (4.8 feet, MAN). FRANZ ANTETOKOUNMPO MAKES IT! Assist: Bradley Sabonis
Score: 45-38

[08:21] Team_023 possession (Score: 45-38)
Tim Bane drives, Franz Antetokounmpo stays with him. Tim Bane attempts a Layup. Contested by Franz Antetokounmpo (5.4 feet, ZONE). Tim Bane misses. Offensive rebound by Tim Bane! Tim Bane kicks it out.

[08:06] Team_023 possession (Score: 45-38)
FOUL! Reach-in foul on Bradley Leonard during the drive. [Team fouls: 2] No free throws, side out. (Bradley Leonard: 2 personal fouls)

[07:53] Team_023 possession (Score: 45-38)
FOUL! Shooting foul on Franz Antetokounmpo. Josh Morant to the line for 2 free throws. [Team fouls: 3] (Franz Antetokounmpo: 1 personal fouls)   FT 1/2: GOOD   FT 2/2: MISS Josh Morant makes 1/2 from the line. Rebound secured by Bradley Sabonis.
Score: 46-38

[07:35] Team_081 possession (Score: 46-38)
Julius Durant drives and kicks out. Franz Antetokounmpo attempts a 3Pt. Contested by Trae Ingram (4.5 feet, ZONE). Franz Antetokounmpo misses. Rebound secured by Kyle Paul.

[07:21] Team_023 possession (Score: 46-38)
Kyle Paul attempts a 3Pt. Contested by Bradley Leonard (4.9 feet, ZONE). Kyle Paul misses. Rebound secured by Franz Antetokounmpo.

[07:03] Team_081 possession (Score: 46-38)
Bradley Leonard drives, Collin Ginobili stays with him. Bradley Leonard attempts a Layup. Contested by Collin Ginobili (5.8 feet, MAN). BRADLEY LEONARD MAKES IT! Assist: Julius Durant
Score: 46-40

[06:49] Team_023 possession (Score: 46-40)
Josh Morant attempts a 3Pt. Contested by Bradley Sabonis (5.1 feet, MAN). JOSH MORANT MAKES IT! Assist: Trae Ingram
Score: 49-40

[06:35] Team_081 possession (Score: 49-40)
Bradley Leonard commits a violation (traveling/carry)! TURNOVER! (dead ball)

[06:35] Substitution (Team_023): Trae Ingram OUT → Tracy Anthony IN (stamina_rule2)

[06:35] Substitution (Team_023): Collin Ginobili OUT → Magic Booker IN (stamina_rule2)

[06:35] Substitution (Team_023): Kyle Paul OUT → Gary Westbrook IN (stamina_rule2)

[06:35] Substitution (Team_023): Josh Morant OUT → Evan Parker IN (stamina_rule2)

[06:35] Substitution (Team_023): Tim Bane OUT → Vince Gasol IN (stamina_rule2)

[06:35] Substitution (Team_081): Julius Durant OUT → Dejounte Bane IN (stamina_rule2)

[06:35] Substitution (Team_081): Bradley Leonard OUT → Lamelo Wade IN (stamina_rule2)

[06:35] Substitution (Team_081): Vince Adebayo OUT → Larry Adebayo IN (stamina_rule2)

[06:35] Substitution (Team_081): Bradley Sabonis OUT → Chris Holiday IN (stamina_rule2)

[06:35] Substitution (Team_081): Franz Antetokounmpo OUT → D'Angelo Markkanen IN (stamina_rule2)

[06:22] Team_023 possession (Score: 49-40)
Vince Gasol drives, picks up Chris Holiday. Help arrives from Lamelo Wade! Vince Gasol attempts a Dunk. Contested by Lamelo Wade (4.4 feet, MAN). Vince Gasol misses. Rebound secured by Lamelo Wade.

[06:08] Team_081 possession (Score: 49-40)
D'Angelo Markkanen drives, Vince Gasol stays with him. D'Angelo Markkanen attempts a Dunk. Contested by Vince Gasol (3.7 feet, MAN). D'ANGELO MARKKANEN MAKES IT! Assist: Lamelo Wade
Score: 49-42

[05:56] Team_023 possession (Score: 49-42)
Vince Gasol attempts a Midrange. Contested by Chris Holiday (4.4 feet, ZONE). Vince Gasol misses. FOUL! Loose ball foul on Lamelo Wade during the rebound battle. [Team fouls: 4] No free throws, side out. (Lamelo Wade: 1 personal fouls)

[05:41] Team_023 possession (Score: 49-42)
Vince Gasol attempts a 3Pt. Contested by Chris Holiday (4.4 feet, ZONE). Vince Gasol misses. Rebound secured by Larry Adebayo.

[05:28] Team_081 possession (Score: 49-42)
Lamelo Wade attempts a 3Pt. Contested by Magic Booker (4.2 feet, MAN). Lamelo Wade misses. Rebound secured by Gary Westbrook.

[05:14] Team_023 possession (Score: 49-42)
Gary Westbrook drives, picks up Larry Adebayo. Help arrives from Lamelo Wade! Gary Westbrook attempts a Layup. Contested by Lamelo Wade (5.6 feet, MAN). GARY WESTBROOK MAKES IT!
Score: 51-42

[05:04] Team_081 possession (Score: 51-42)
Chris Holiday makes the Layup and draws the foul on Vince Gasol! And-1! Chris Holiday to the line for 1. [Team fouls: 4] (Vince Gasol: 1 personal fouls)   FT 1/1: MISS Chris Holiday makes 0/1 from the line. Rebound secured by Gary Westbrook.
Score: 51-44

[04:46] Team_023 possession (Score: 51-44)
Gary Westbrook drives to the basket... FOUL! Offensive foul on Gary Westbrook! Chris Holiday drew the charge! [Team fouls: 5] (Gary Westbrook: 1 personal fouls) TURNOVER! (dead ball)

[04:32] Team_081 possession (Score: 51-44)
Larry Adebayo attempts a Midrange. Contested by Magic Booker (4.2 feet, ZONE). Larry Adebayo misses. Rebound secured by Vince Gasol.

[04:18] Team_023 possession (Score: 51-44)
Vince Gasol drives to the basket... Vince Gasol throws a bad pass! Stolen by Chris Holiday! TURNOVER! (live ball)

[04:05] Team_081 possession (Score: 51-44)
Chris Holiday attempts a 3Pt. Contested by Tracy Anthony (3.6 feet, ZONE). Chris Holiday misses. Offensive rebound by Lamelo Wade! Lamelo Wade kicks it out.

[03:54] Team_081 possession (Score: 51-44)
Larry Adebayo drives and kicks out. D'Angelo Markkanen attempts a 3Pt. Contested by Vince Gasol (3.6 feet, MAN). D'Angelo Markkanen misses. FOUL! Loose ball foul on Gary Westbrook during the rebound battle. [IN THE BONUS! 6 team fouls] Chris Holiday to the line for 2 free throws. (Gary Westbrook: 2 personal fouls)   FT 1/2: MISS   FT 2/2: GOOD Chris Holiday makes 1/2 from the line.
Score: 51-45

[03:41] Team_023 possession (Score: 51-45)
Gary Westbrook attempts a 3Pt. Contested by Chris Holiday (4.6 feet, ZONE). Gary Westbrook misses. Rebound secured by Chris Holiday.

[03:27] Team_081 possession (Score: 51-45)
FOUL! Reach-in foul on Vince Gasol during the drive. [IN THE BONUS! 7 team fouls] D'Angelo Markkanen to the line for 2 free throws. (Vince Gasol: 2 personal fouls)   FT 1/2: GOOD   FT 2/2: GOOD D'Angelo Markkanen makes 2/2 from the line.
Score: 51-47

[03:14] Team_023 possession (Score: 51-47)
Gary Westbrook attempts a 3Pt. Contested by Larry Adebayo (5.6 feet, MAN). Gary Westbrook misses. Rebound secured by Lamelo Wade.

[02:59] Team_081 possession (Score: 51-47)
Dejounte Bane drives to the basket... Dejounte Bane loses the ball! Stripped by Tracy Anthony! TURNOVER! (live ball)

[02:43] Team_023 possession (Score: 51-47)
Vince Gasol drives, picks up Chris Holiday. Help arrives from Lamelo Wade! Vince Gasol attempts a Layup. Contested by Lamelo Wade (4.4 feet, MAN). VINCE GASOL MAKES IT!
Score: 53-47

[02:32] Team_081 possession (Score: 53-47)
FOUL! Shooting foul on Magic Booker. Lamelo Wade to the line for 2 free throws. [BONUS: 8 team fouls] (Magic Booker: 1 personal fouls)   FT 1/2: GOOD   FT 2/2: GOOD Lamelo Wade makes 2/2 from the line.
Score: 53-49

[02:16] Team_023 possession (Score: 53-49)
Tracy Anthony throws a bad pass! Stolen by Dejounte Bane! TURNOVER! (live ball)

[02:03] Team_081 possession (Score: 53-49)
Lamelo Wade drives, picks up Magic Booker. Help arrives from Gary Westbrook! Lamelo Wade attempts a Dunk. Contested by Gary Westbrook (4.2 feet, MAN). LAMELO WADE MAKES IT! Assist: D'Angelo Markkanen
Score: 53-51

[01:46] Team_023 possession (Score: 53-51)
FOUL! Offensive foul on Tracy Anthony! Dejounte Bane drew the charge! [Team fouls: 9] (Tracy Anthony: 1 personal fouls) TURNOVER! (dead ball)

[01:33] Team_081 possession (Score: 53-51)
D'Angelo Markkanen attempts a Midrange. Contested by Vince Gasol (3.7 feet, MAN). D'Angelo Markkanen misses. Rebound secured by Vince Gasol.

[01:22] Team_023 possession (Score: 53-51)
Evan Parker drives and kicks out. Vince Gasol attempts a 3Pt. Contested by Chris Holiday (4.3 feet, ZONE). Vince Gasol misses. Rebound secured by Larry Adebayo.

[01:08] Team_081 possession (Score: 53-51)
FOUL! Holding foul on Magic Booker. [IN THE BONUS! 10 team fouls] Lamelo Wade to the line for 2 free throws. (Magic Booker: 2 personal fouls)   FT 1/2: GOOD   FT 2/2: GOOD Lamelo Wade makes 2/2 from the line.
Score: 53-53

[00:54] Team_023 possession (Score: 53-53)
Tracy Anthony attempts a 3Pt. Contested by Dejounte Bane (5.5 feet, MAN). Tracy Anthony misses. Rebound secured by Larry Adebayo.

[00:38] Team_081 possession (Score: 53-53)
D'Angelo Markkanen attempts a 3Pt. Contested by Tracy Anthony (3.8 feet, ZONE). D'Angelo Markkanen misses. Rebound secured by Vince Gasol.

[00:27] Team_023 possession (Score: 53-53)
Vince Gasol attempts a Layup. BLOCKED BY CHRIS HOLIDAY! Ball is loose! Rebound secured by Lamelo Wade.

[00:11] Team_081 possession (Score: 53-53)
FOUL! Holding foul on Gary Westbrook. [IN THE BONUS! 11 team fouls] Larry Adebayo to the line for 2 free throws. (Gary Westbrook: 3 personal fouls)   FT 1/2: GOOD   FT 2/2: MISS Larry Adebayo makes 1/2 from the line. FOUL! Loose ball foul on Evan Parker during the free throw rebound! [IN THE BONUS! 12 team fouls] Lamelo Wade to the line for 2 free throws. (Evan Parker: 1 personal fouls)   FT 1/2: GOOD   FT 2/2: GOOD Lamelo Wade makes 2/2 from the line.
Score: 53-56

================================================================================
                              2ND QUARTER COMPLETE                              
================================================================================

2ND QUARTER SCORE: Team_023 19, Team_081 32

BOX SCORE:
================================================================================

Team_023
--------------------------------------------------------------------------------
Player                MIN  PTS  REB  AST  TO      FG   FG%      3P   3P%
--------------------------------------------------------------------------------
Josh Morant            18    5    0    0   0   2/3    66.7     0/0   0.0
Kyle Paul              18    3    1    1   0   1/2    50.0     0/0   0.0
Trae Ingram            18    2    0    1   0   1/1   100.0     0/0   0.0
Tim Bane               18    2    2    0   0   1/2    50.0     0/0   0.0
Collin Ginobili        18    2    0    1   0   1/1   100.0     0/0   0.0
Vince Gasol             6    2    3    0   0   1/4    25.0     0/0   0.0
Gary Westbrook          6    2    2    0   0   1/3    33.3     0/0   0.0
Evan Parker             6    0    1    0   0   0/1     0.0     0/0   0.0
Tracy Anthony           6    0    0    0   0   0/1     0.0     0/0   0.0

TEAM: FG: 8/18 (44.4%), 3PT: 2/7 (28.6%), REB: 9 (3 off, 6 def), AST: 3, TO: 4
TEAM FOULS: 12 [Team_081 in BONUS]


Team_081
--------------------------------------------------------------------------------
Player                MIN  PTS  REB  AST  TO      FG   FG%      3P   3P%
--------------------------------------------------------------------------------
Lamelo Wade             6    9    4    1   0   4/5    80.0     0/0   0.0
Julius Durant          18    6    0    1   0   2/3    66.7     0/0   0.0
Franz Antetokounmpo    18    4    2    0   0   2/2   100.0     0/0   0.0
D'Angelo Markkanen      6    4    0    1   0   2/4    50.0     0/0   0.0
Bradley Leonard        18    2    0    2   0   1/1   100.0     0/0   0.0
Vince Adebayo          18    2    0    0   0   1/1   100.0     0/0   0.0
Bradley Sabonis        18    2    2    1   0   1/1   100.0     0/0   0.0
Chris Holiday           6    1    1    0   0   1/2    50.0     0/0   0.0
Larry Adebayo           6    0    3    0   0   0/1     0.0     0/0   0.0

TEAM: FG: 14/20 (70.0%), 3PT: 2/4 (50.0%), REB: 12 (2 off, 10 def), AST: 6, TO: 2
TEAM FOULS: 4

================================================================================

================================================================================
                       3RD QUARTER - Team_023 vs Team_081                       
================================================================================

[12:00] Team_023 possession (Score: 53-56)
FOUL! Shooting foul on Franz Antetokounmpo. Josh Morant to the line for 2 free throws. [Team fouls: 1] (Franz Antetokounmpo: 1 personal fouls)   FT 1/2: GOOD   FT 2/2: GOOD Josh Morant makes 2/2 from the line.
Score: 55-56

[11:45] Team_081 possession (Score: 55-56)
Bradley Sabonis drives, picks up Tim Bane. Help arrives from Trae Ingram! Bradley Sabonis attempts a Layup. Contested by Trae Ingram (3.7 feet, ZONE). Bradley Sabonis misses. Offensive rebound by Bradley Sabonis! Bradley Sabonis kicks it out.

[11:31] Team_081 possession (Score: 55-56)
Julius Durant drives, picks up Trae Ingram. Help arrives from Kyle Paul! Julius Durant attempts a Dunk. Contested by Kyle Paul (3.5 feet, MAN). Julius Durant misses. Rebound secured by Tim Bane.

[11:15] Team_023 possession (Score: 55-56)
Tim Bane drives, picks up Franz Antetokounmpo. Help arrives from Bradley Leonard! Tim Bane attempts a Layup. Contested by Bradley Leonard (4.7 feet, MAN). TIM BANE MAKES IT!
Score: 57-56

[10:57] Team_081 possession (Score: 57-56)
Bradley Sabonis attempts a 3Pt. Contested by Kyle Paul (2.7 feet, ZONE). Bradley Sabonis misses. Rebound secured by Josh Morant.

[10:42] Team_023 possession (Score: 57-56)
Trae Ingram drives and kicks out. Josh Morant attempts a Midrange. Contested by Vince Adebayo (3.4 feet, ZONE). Josh Morant misses. Rebound secured by Bradley Sabonis.

[10:27] Team_081 possession (Score: 57-56)
Julius Durant attempts a Midrange. Contested by Trae Ingram (3.5 feet, MAN). Julius Durant misses. Rebound secured by Tim Bane.

[10:16] Team_023 possession (Score: 57-56)
Trae Ingram drives and kicks out. Trae Ingram attempts a 3Pt. Contested by Julius Durant (4.0 feet, MAN). Trae Ingram misses. Offensive rebound by Tim Bane! Tim Bane's putback is no good. Rebound secured by Vince Adebayo.

[10:02] Team_081 possession (Score: 57-56)
Vince Adebayo drives and kicks out. Franz Antetokounmpo attempts a Midrange. Contested by Tim Bane (3.8 feet, MAN). FRANZ ANTETOKOUNMPO MAKES IT! Assist: Vince Adebayo
Score: 57-58

[09:50] Team_023 possession (Score: 57-58)
Trae Ingram attempts a Midrange. Contested by Julius Durant (4.0 feet, MAN). TRAE INGRAM MAKES IT!
Score: 59-58

[09:38] Team_081 possession (Score: 59-58)
Vince Adebayo attempts a Layup. Contested by Kyle Paul (2.8 feet, MAN). Vince Adebayo misses. Rebound secured by Josh Morant.

[09:26] Team_023 possession (Score: 59-58)
Kyle Paul attempts a 3Pt. Contested by Vince Adebayo (3.8 feet, ZONE). Kyle Paul misses. Rebound secured by Bradley Sabonis.

[09:12] Team_081 possession (Score: 59-58)
Bradley Sabonis attempts a Midrange. Contested by Collin Ginobili (4.8 feet, ZONE). BRADLEY SABONIS MAKES IT!
Score: 59-60

[08:56] Team_023 possession (Score: 59-60)
Kyle Paul attempts a Layup. BLOCKED BY FRANZ ANTETOKOUNMPO! Ball is loose! Rebound secured by Franz Antetokounmpo.

[08:40] Team_081 possession (Score: 59-60)
Julius Durant attempts a 3Pt. Contested by Trae Ingram (3.5 feet, ZONE). Julius Durant misses. Rebound secured by Kyle Paul.

[08:24] Team_023 possession (Score: 59-60)
Tim Bane attempts a Midrange. Contested by Franz Antetokounmpo (4.7 feet, MAN). Tim Bane misses. Rebound secured by Vince Adebayo.

[08:08] Team_081 possession (Score: 59-60)
Bradley Leonard makes the Midrange and draws the foul on Collin Ginobili! And-1! Bradley Leonard to the line for 1. [Team fouls: 1] (Collin Ginobili: 1 personal fouls)   FT 1/1: GOOD Bradley Leonard makes 1/1 from the line.
Score: 59-63

[07:53] Team_023 possession (Score: 59-63)
FOUL! Holding foul on Bradley Sabonis. [Team fouls: 2] No free throws, side out. (Bradley Sabonis: 1 personal fouls)

[07:37] Team_023 possession (Score: 59-63)
Trae Ingram drives and kicks out. Collin Ginobili attempts a 3Pt. Contested by Bradley Leonard (3.7 feet, ZONE). Collin Ginobili misses. Rebound secured by Franz Antetokounmpo.

[07:19] Team_081 possession (Score: 59-63)
Vince Adebayo drives and kicks out. Bradley Sabonis attempts a 3Pt. Contested by Kyle Paul (2.8 feet, ZONE). BRADLEY SABONIS MAKES IT! Assist: Franz Antetokounmpo
Score: 59-66

[07:03] Team_023 possession (Score: 59-66)
FOUL! Reach-in foul on Bradley Leonard during the drive. [Team fouls: 3] No free throws, side out. (Bradley Leonard: 1 personal fouls)

[06:50] Team_023 possession (Score: 59-66)
Trae Ingram attempts a 3Pt. Contested by Vince Adebayo (3.4 feet, ZONE). Trae Ingram misses. Rebound secured by Bradley Sabonis.

[06:36] Team_081 possession (Score: 59-66)
Vince Adebayo attempts a 3Pt. Contested by Kyle Paul (2.8 feet, ZONE). Vince Adebayo misses. Offensive rebound by Franz Antetokounmpo! Franz Antetokounmpo's putback is no good. Offensive rebound by Franz Antetokounmpo! Franz Antetokounmpo kicks it out.

[06:21] Team_081 possession (Score: 59-66)
FOUL! Holding foul on Kyle Paul. [Team fouls: 2] No free throws, side out. (Kyle Paul: 1 personal fouls)

[06:04] Team_081 possession (Score: 59-66)
Franz Antetokounmpo drives and kicks out. Bradley Leonard attempts a 3Pt. Contested by Collin Ginobili (4.9 feet, MAN). BRADLEY LEONARD MAKES IT! Assist: Bradley Sabonis
Score: 59-69

[05:52] Team_023 possession (Score: 59-69)
Collin Ginobili attempts a 3Pt. Contested by Bradley Leonard (4.2 feet, MAN). Collin Ginobili misses. Offensive rebound by Tim Bane! Tim Bane's putback is no good. Rebound secured by Bradley Sabonis.

[05:38] Team_081 possession (Score: 59-69)
Vince Adebayo drives to the basket... Vince Adebayo throws a bad pass! Stolen by Tim Bane! TURNOVER! (live ball)

[05:27] Team_023 possession (Score: 59-69)
Kyle Paul attempts a 3Pt. Contested by Vince Adebayo (3.8 feet, ZONE). Kyle Paul misses. Rebound secured by Franz Antetokounmpo.

[05:13] Team_081 possession (Score: 59-69)
Julius Durant attempts a Midrange. Contested by Trae Ingram (3.5 feet, MAN). JULIUS DURANT MAKES IT! Assist: Bradley Leonard
Score: 59-71

[04:58] Team_023 possession (Score: 59-71)
Collin Ginobili attempts a 3Pt. Contested by Bradley Leonard (4.2 feet, MAN). Collin Ginobili misses. Rebound secured by Bradley Sabonis.

[04:46] Team_081 possession (Score: 59-71)
Franz Antetokounmpo drives, Tim Bane stays with him. Franz Antetokounmpo attempts a Dunk. Contested by Tim Bane (4.0 feet, ZONE). FRANZ ANTETOKOUNMPO MAKES IT! Assist: Bradley Sabonis
Score: 59-73

[04:34] Team_023 possession (Score: 59-73)
Kyle Paul attempts a 3Pt. BLOCKED BY VINCE ADEBAYO! Ball is loose! Rebound secured by Franz Antetokounmpo.

[04:19] Team_081 possession (Score: 59-73)
Bradley Leonard drives and kicks out. Julius Durant attempts a 3Pt. Contested by Collin Ginobili (4.9 feet, ZONE). Julius Durant misses. Rebound secured by Kyle Paul.

[04:05] Team_023 possession (Score: 59-73)
FOUL! Offensive foul on Collin Ginobili! Bradley Leonard drew the charge! [Team fouls: 3] (Collin Ginobili: 2 personal fouls) TURNOVER! (dead ball)

[03:52] Team_081 possession (Score: 59-73)
Franz Antetokounmpo drives to the basket... Franz Antetokounmpo loses the ball! Stripped by Tim Bane! TURNOVER! (live ball)

[03:39] Team_023 possession (Score: 59-73)
Collin Ginobili throws a bad pass! Stolen by Bradley Leonard! TURNOVER! (live ball)

[03:28] Team_081 possession (Score: 59-73)
Bradley Sabonis attempts a 3Pt. Contested by Kyle Paul (2.9 feet, ZONE). Bradley Sabonis misses. Rebound secured by Tim Bane.

[03:17] Team_023 possession (Score: 59-73)
Collin Ginobili attempts a Midrange. Contested by Franz Antetokounmpo (4.9 feet, ZONE). Collin Ginobili misses. Rebound secured by Franz Antetokounmpo.

[02:59] Team_081 possession (Score: 59-73)
Bradley Leonard attempts a 3Pt. Contested by Collin Ginobili (5.2 feet, MAN). Bradley Leonard misses. Offensive rebound by Franz Antetokounmpo! Franz Antetokounmpo's putback is no good. Rebound secured by Tim Bane.

[02:43] Team_023 possession (Score: 59-73)
Kyle Paul attempts a 3Pt. Contested by Vince Adebayo (4.1 feet, MAN). Kyle Paul misses. Rebound secured by Vince Adebayo.

[02:30] Team_081 possession (Score: 59-73)
Bradley Sabonis attempts a Layup. Contested by Josh Morant (4.2 feet, MAN). Bradley Sabonis misses. Offensive rebound by Franz Antetokounmpo! Franz Antetokounmpo puts it back in!
Score: 59-75

[02:13] Team_023 possession (Score: 59-75)
Collin Ginobili loses the ball! Stripped by Bradley Leonard! TURNOVER! (live ball)

[02:03] Team_081 possession (Score: 59-75)
Julius Durant attempts a Layup. Contested by Trae Ingram (3.8 feet, MAN). JULIUS DURANT MAKES IT! Assist: Franz Antetokounmpo
Score: 59-77

[01:43] Team_023 possession (Score: 59-77)
Trae Ingram attempts a 3Pt. Contested by Julius Durant (4.3 feet, MAN). TRAE INGRAM MAKES IT! Assist: Kyle Paul
Score: 62-77

[01:30] Team_081 possession (Score: 62-77)
Franz Antetokounmpo attempts a Midrange. Contested by Kyle Paul (3.4 feet, ZONE). FRANZ ANTETOKOUNMPO MAKES IT! Assist: Bradley Sabonis
Score: 62-79

[01:18] Team_023 possession (Score: 62-79)
Collin Ginobili drives, picks up Bradley Leonard. Help arrives from Vince Adebayo! Collin Ginobili attempts a Dunk. Contested by Vince Adebayo (4.5 feet, MAN). COLLIN GINOBILI MAKES IT! Assist: Josh Morant
Score: 64-79

[01:05] Team_081 possession (Score: 64-79)
Franz Antetokounmpo attempts a 3Pt. Contested by Kyle Paul (3.4 feet, ZONE). FRANZ ANTETOKOUNMPO MAKES IT! Assist: Bradley Leonard
Score: 64-82

[00:50] Team_023 possession (Score: 64-82)
FOUL! Holding foul on Franz Antetokounmpo. [Team fouls: 4] No free throws, side out. (Franz Antetokounmpo: 2 personal fouls)

[00:34] Team_023 possession (Score: 64-82)
Kyle Paul drives to the basket... FOUL! Offensive foul on Kyle Paul! Vince Adebayo drew the charge! [Team fouls: 4] (Kyle Paul: 2 personal fouls) TURNOVER! (dead ball)

[00:17] Team_081 possession (Score: 64-82)
Bradley Leonard attempts a Layup. BLOCKED BY TIM BANE! Ball is loose! Rebound secured by Josh Morant.

================================================================================
                              3RD QUARTER COMPLETE                              
================================================================================

3RD QUARTER SCORE: Team_023 11, Team_081 26

BOX SCORE:
================================================================================

Team_023
--------------------------------------------------------------------------------
Player                MIN  PTS  REB  AST  TO      FG   FG%      3P   3P%
--------------------------------------------------------------------------------
Trae Ingram            30    5    0    0   0   2/6    33.3     0/0   0.0
Josh Morant            30    2    3    1   0   1/1   100.0     0/0   0.0
Collin Ginobili        30    2    0    0   0   1/4    25.0     0/0   0.0
Kyle Paul              30    0    2    1   0   0/5     0.0     0/0   0.0

TEAM: FG: 5/18 (27.8%), 3PT: 1/8 (12.5%), REB: 10 (2 off, 8 def), AST: 2, TO: 4
TEAM FOULS: 4


Team_081
--------------------------------------------------------------------------------
Player                MIN  PTS  REB  AST  TO      FG   FG%      3P   3P%
--------------------------------------------------------------------------------
Franz Antetokounmpo    30   11    7    2   0   5/5   100.0     0/0   0.0
Bradley Leonard        30    6    0    2   0   2/5    40.0     0/0   0.0
Bradley Sabonis        30    5    6    3   0   2/4    50.0     0/0   0.0
Julius Durant          30    4    0    0   0   2/5    40.0     0/0   0.0
Tim Bane               30    2    4    0   0   1/2    50.0     0/0   0.0
Vince Adebayo          30    0    3    1   0   0/1     0.0     0/0   0.0

TEAM: FG: 11/20 (55.0%), 3PT: 1/5 (20.0%), REB: 15 (4 off, 11 def), AST: 8, TO: 2
TEAM FOULS: 4

================================================================================

================================================================================
                       4TH QUARTER - Team_023 vs Team_081                       
================================================================================

[12:00] Substitution (Team_023): Trae Ingram OUT (stamina: 69) → Tracy Anthony IN (comeback_detected)

[12:00] Substitution (Team_081): Julius Durant OUT (stamina: 70) → Dejounte Bane IN (comeback_detected)

[12:00] Team_023 possession (Score: 64-82)
Collin Ginobili drives, Bradley Sabonis stays with him. Collin Ginobili attempts a Dunk. Contested by Bradley Sabonis (4.7 feet, ZONE). COLLIN GINOBILI MAKES IT! Assist: Kyle Paul
Score: 66-82

[11:48] Team_081 possession (Score: 66-82)
Vince Adebayo attempts a 3Pt. Contested by Kyle Paul (3.2 feet, MAN). Vince Adebayo misses. Offensive rebound by Bradley Sabonis! Bradley Sabonis kicks it out.

[11:35] Team_081 possession (Score: 66-82)
Bradley Sabonis makes the Dunk and draws the foul on Tracy Anthony! And-1! Bradley Sabonis to the line for 1. [Team fouls: 1] (Tracy Anthony: 1 personal fouls)   FT 1/1: MISS Bradley Sabonis makes 0/1 from the line. Rebound secured by Tim Bane.
Score: 66-84

[11:16] Team_023 possession (Score: 66-84)
Tracy Anthony attempts a 3Pt. Contested by Bradley Leonard (4.1 feet, ZONE). TRACY ANTHONY MAKES IT! Assist: Kyle Paul
Score: 69-84

[11:03] Team_081 possession (Score: 69-84)
Bradley Leonard drives, Josh Morant stays with him. Bradley Leonard attempts a Layup. Contested by Josh Morant (4.6 feet, ZONE). BRADLEY LEONARD MAKES IT! Assist: Franz Antetokounmpo
Score: 69-86

[10:49] Team_023 possession (Score: 69-86)
Tracy Anthony drives and kicks out. Kyle Paul attempts a 3Pt. Contested by Bradley Leonard (4.1 feet, ZONE). Kyle Paul misses. Rebound secured by Vince Adebayo.

[10:32] Team_081 possession (Score: 69-86)
Bradley Sabonis attempts a Midrange. Contested by Josh Morant (4.4 feet, ZONE). Bradley Sabonis misses. Rebound secured by Josh Morant.

[10:18] Team_023 possession (Score: 69-86)
Collin Ginobili drives and kicks out. Collin Ginobili attempts a 3Pt. Contested by Bradley Leonard (4.2 feet, MAN). Collin Ginobili misses. Rebound secured by Franz Antetokounmpo.

[10:07] Team_081 possession (Score: 69-86)
Bradley Leonard attempts a 3Pt. Contested by Collin Ginobili (5.5 feet, MAN). BRADLEY LEONARD MAKES IT! Assist: Dejounte Bane
Score: 69-89

[09:54] Team_023 possession (Score: 69-89)
Collin Ginobili attempts a Midrange. Contested by Vince Adebayo (4.6 feet, ZONE). Collin Ginobili misses. Rebound secured by Franz Antetokounmpo.

[09:38] Team_081 possession (Score: 69-89)
Dejounte Bane attempts a Midrange. Contested by Kyle Paul (3.8 feet, ZONE). Dejounte Bane misses. Rebound secured by Kyle Paul.

[09:23] Team_023 possession (Score: 69-89)
Kyle Paul attempts a 3Pt. Contested by Vince Adebayo (4.5 feet, MAN). Kyle Paul misses. Rebound secured by Franz Antetokounmpo.

[09:03] Team_081 possession (Score: 69-89)
Franz Antetokounmpo attempts a 3Pt. Contested by Tracy Anthony (3.6 feet, ZONE). Franz Antetokounmpo misses. FOUL! Loose ball foul on Kyle Paul during the rebound battle. [Team fouls: 2] No free throws, side out. (Kyle Paul: 1 personal fouls)

[08:47] Team_081 possession (Score: 69-89)
Franz Antetokounmpo attempts a Layup. BLOCKED BY TIM BANE! Ball is loose! Rebound secured by Josh Morant.

[08:31] Team_023 possession (Score: 69-89)
Kyle Paul loses the ball! Stripped by Vince Adebayo! TURNOVER! (live ball)

[08:18] Team_081 possession (Score: 69-89)
FOUL! Holding foul on Tracy Anthony. [Team fouls: 3] No free throws, side out. (Tracy Anthony: 2 personal fouls)

[08:05] Team_081 possession (Score: 69-89)
Franz Antetokounmpo attempts a Midrange. Contested by Tim Bane (4.8 feet, ZONE). FRANZ ANTETOKOUNMPO MAKES IT! Assist: Dejounte Bane
Score: 69-91

[07:52] Team_023 possession (Score: 69-91)
Tracy Anthony drives, Franz Antetokounmpo stays with him. Tracy Anthony attempts a Dunk. Contested by Franz Antetokounmpo (5.2 feet, ZONE). TRACY ANTHONY MAKES IT!
Score: 71-91

[07:36] Team_081 possession (Score: 71-91)
Vince Adebayo drives, Kyle Paul stays with him. Vince Adebayo attempts a Dunk. Contested by Kyle Paul (3.8 feet, MAN). Vince Adebayo misses. Rebound secured by Kyle Paul.

[07:22] Team_023 possession (Score: 71-91)
Kyle Paul attempts a 3Pt. Contested by Bradley Leonard (4.8 feet, ZONE). Kyle Paul misses. Rebound secured by Bradley Sabonis.

[07:07] Team_081 possession (Score: 71-91)
Bradley Leonard attempts a 3Pt. Contested by Collin Ginobili (5.8 feet, MAN). Bradley Leonard misses. Rebound secured by Tim Bane.

[06:57] Team_023 possession (Score: 71-91)
Collin Ginobili attempts a 3Pt. Contested by Bradley Leonard (5.0 feet, MAN). COLLIN GINOBILI MAKES IT! Assist: Tracy Anthony
Score: 74-91

[06:47] Team_081 possession (Score: 74-91)
Dejounte Bane attempts a 3Pt. Contested by Tracy Anthony (3.8 feet, MAN). Dejounte Bane misses. Rebound secured by Kyle Paul.

[06:33] Team_023 possession (Score: 74-91)
Josh Morant attempts a Layup. Contested by Franz Antetokounmpo (5.4 feet, ZONE). JOSH MORANT MAKES IT! Assist: Tracy Anthony
Score: 76-91

[06:21] Team_081 possession (Score: 76-91)
Vince Adebayo attempts a 3Pt. Contested by Kyle Paul (4.1 feet, MAN). VINCE ADEBAYO MAKES IT! Assist: Franz Antetokounmpo
Score: 76-94

[06:11] Team_023 possession (Score: 76-94)
Kyle Paul attempts a Midrange. Contested by Bradley Leonard (5.0 feet, ZONE). Kyle Paul misses. Rebound secured by Vince Adebayo.

[05:56] Team_081 possession (Score: 76-94)
Bradley Leonard drives to the basket... Bradley Leonard throws a bad pass out of bounds! TURNOVER! (dead ball)

[05:56] Substitution (Team_023): Collin Ginobili OUT → Magic Booker IN (stamina_rule2)

[05:56] Substitution (Team_023): Kyle Paul OUT → Gary Westbrook IN (stamina_rule2)

[05:56] Substitution (Team_023): Josh Morant OUT → Evan Parker IN (stamina_rule2)

[05:56] Substitution (Team_023): Tim Bane OUT → Vince Gasol IN (stamina_rule2)

[05:56] Substitution (Team_081): Bradley Leonard OUT → Lamelo Wade IN (stamina_rule2)

[05:56] Substitution (Team_081): Vince Adebayo OUT → Larry Adebayo IN (stamina_rule2)

[05:56] Substitution (Team_081): Bradley Sabonis OUT → Chris Holiday IN (stamina_rule2)

[05:56] Substitution (Team_081): Franz Antetokounmpo OUT → D'Angelo Markkanen IN (stamina_rule2)

[05:45] Team_023 possession (Score: 76-94)
Magic Booker attempts a 3Pt. Contested by Lamelo Wade (4.4 feet, MAN). Magic Booker misses. Rebound secured by Lamelo Wade.

[05:30] Team_081 possession (Score: 76-94)
Dejounte Bane attempts a Midrange. Contested by Evan Parker (3.3 feet, ZONE). Dejounte Bane misses. Offensive rebound by Chris Holiday! Chris Holiday kicks it out.

[05:17] Team_081 possession (Score: 76-94)
Chris Holiday attempts a Layup. Contested by Evan Parker (3.1 feet, MAN). Chris Holiday misses. Rebound secured by Gary Westbrook.

[05:04] Team_023 possession (Score: 76-94)
Evan Parker attempts a Midrange. Contested by Chris Holiday (4.4 feet, ZONE). Evan Parker misses. Rebound secured by Chris Holiday.

[04:49] Team_081 possession (Score: 76-94)
Dejounte Bane attempts a Midrange. Contested by Gary Westbrook (4.1 feet, ZONE). DEJOUNTE BANE MAKES IT! Assist: Lamelo Wade
Score: 76-96

[04:32] Team_023 possession (Score: 76-96)
Tracy Anthony attempts a 3Pt. Contested by Dejounte Bane (5.6 feet, MAN). Tracy Anthony misses. Rebound secured by Larry Adebayo.

[04:16] Team_081 possession (Score: 76-96)
Lamelo Wade makes the Layup and draws the foul on Gary Westbrook! And-1! Lamelo Wade to the line for 1. [Team fouls: 4] (Gary Westbrook: 1 personal fouls)   FT 1/1: GOOD Lamelo Wade makes 1/1 from the line.
Score: 76-99

[04:04] Team_023 possession (Score: 76-99)
FOUL! Shooting foul on Chris Holiday. Magic Booker to the line for 2 free throws. [Team fouls: 1] (Chris Holiday: 1 personal fouls)   FT 1/2: GOOD   FT 2/2: GOOD Magic Booker makes 2/2 from the line.
Score: 78-99

[03:50] Team_081 possession (Score: 78-99)
D'Angelo Markkanen attempts a Midrange. Contested by Magic Booker (4.4 feet, ZONE). D'Angelo Markkanen misses. Rebound secured by Evan Parker.

[03:34] Team_023 possession (Score: 78-99)
Vince Gasol attempts a 3Pt. Contested by Chris Holiday (4.4 feet, MAN). Vince Gasol misses. Rebound secured by Larry Adebayo.

[03:19] Team_081 possession (Score: 78-99)
Dejounte Bane attempts a 3Pt. Contested by Magic Booker (4.4 feet, ZONE). DEJOUNTE BANE MAKES IT! Assist: D'Angelo Markkanen
Score: 78-102

[03:02] Team_023 possession (Score: 78-102)
Magic Booker attempts a 3Pt. Contested by Chris Holiday (4.0 feet, ZONE). Magic Booker misses. Rebound secured by Chris Holiday.

[02:50] Team_081 possession (Score: 78-102)
Lamelo Wade attempts a Layup. BLOCKED BY VINCE GASOL! Ball deflects out of bounds off Lamelo Wade.

[02:35] Team_023 possession (Score: 78-102)
Evan Parker attempts a 3Pt. Contested by Chris Holiday (4.4 feet, ZONE). Evan Parker misses. Offensive rebound by Evan Parker! Evan Parker's putback is no good. Offensive rebound by Vince Gasol! Vince Gasol kicks it out.

[02:20] Team_023 possession (Score: 78-102)
FOUL! Shooting foul on Lamelo Wade. Vince Gasol to the line for 2 free throws. [Team fouls: 2] (Lamelo Wade: 1 personal fouls)   FT 1/2: GOOD   FT 2/2: MISS Vince Gasol makes 1/2 from the line. Rebound secured by Lamelo Wade.
Score: 79-102

[02:04] Team_081 possession (Score: 79-102)
FOUL! Holding foul on Evan Parker. [IN THE BONUS! 5 team fouls] Chris Holiday to the line for 2 free throws. (Evan Parker: 1 personal fouls)   FT 1/2: GOOD   FT 2/2: GOOD Chris Holiday makes 2/2 from the line.
Score: 79-104

[01:49] Team_023 possession (Score: 79-104)
Vince Gasol drives, Chris Holiday stays with him. Vince Gasol attempts a Layup. Contested by Chris Holiday (4.4 feet, ZONE). VINCE GASOL MAKES IT! Assist: Evan Parker
Score: 81-104

[01:36] Team_081 possession (Score: 81-104)
FOUL! Reach-in foul on Vince Gasol during the drive. [IN THE BONUS! 6 team fouls] D'Angelo Markkanen to the line for 2 free throws. (Vince Gasol: 1 personal fouls)   FT 1/2: GOOD   FT 2/2: GOOD D'Angelo Markkanen makes 2/2 from the line.
Score: 81-106

[01:19] Team_023 possession (Score: 81-106)
Magic Booker attempts a 3Pt. Contested by Lamelo Wade (4.4 feet, MAN). Magic Booker misses. Rebound secured by Chris Holiday.

[01:04] Team_081 possession (Score: 81-106)
FOUL! Shooting foul on Vince Gasol. D'Angelo Markkanen to the line for 2 free throws. [BONUS: 7 team fouls] (Vince Gasol: 2 personal fouls)   FT 1/2: MISS   FT 2/2: GOOD D'Angelo Markkanen makes 1/2 from the line.
Score: 81-107

[00:54] Team_023 possession (Score: 81-107)
FOUL! Offensive foul on Tracy Anthony! Dejounte Bane drew the charge! [Team fouls: 8] (Tracy Anthony: 3 personal fouls) TURNOVER! (dead ball)

[00:38] Team_081 possession (Score: 81-107)
D'Angelo Markkanen commits a violation (traveling/carry)! TURNOVER! (dead ball)

[00:24] Team_023 possession (Score: 81-107)
Vince Gasol loses control! Ball rolls out of bounds! TURNOVER! (dead ball)

[00:09] Team_081 possession (Score: 81-107)
Lamelo Wade drives to the basket... Lamelo Wade throws a bad pass! Stolen by Magic Booker! TURNOVER! (live ball)

================================================================================
                              4TH QUARTER COMPLETE                              
================================================================================

4TH QUARTER SCORE: Team_023 17, Team_081 25

BOX SCORE:
================================================================================

Team_023
--------------------------------------------------------------------------------
Player                MIN  PTS  REB  AST  TO      FG   FG%      3P   3P%
--------------------------------------------------------------------------------
Collin Ginobili        36    5    0    0   0   2/4    50.0     0/0   0.0
Tracy Anthony          19    5    0    2   0   2/4    50.0     0/0   0.0
Josh Morant            36    2    2    0   0   1/1   100.0     0/0   0.0
Magic Booker           12    2    0    0   0   1/4    25.0     0/0   0.0
Vince Gasol            12    2    1    0   0   1/3    33.3     0/0   0.0
Kyle Paul              36    0    3    2   0   0/3     0.0     0/0   0.0
Tim Bane               36    0    2    0   0   0/0     0.0     0/0   0.0
Gary Westbrook         12    0    1    0   0   0/0     0.0     0/0   0.0
Evan Parker            12    0    1    1   0   0/1     0.0     0/0   0.0

TEAM: FG: 7/20 (35.0%), 3PT: 2/9 (22.2%), REB: 10 (1 off, 9 def), AST: 5, TO: 3
TEAM FOULS: 8 [Team_081 in BONUS]


Team_081
--------------------------------------------------------------------------------
Player                MIN  PTS  REB  AST  TO      FG   FG%      3P   3P%
--------------------------------------------------------------------------------
Bradley Leonard        36    5    0    0   0   2/3    66.7     0/0   0.0
Dejounte Bane          19    5    0    2   0   2/4    50.0     0/0   0.0
Vince Adebayo          36    3    2    0   0   1/2    50.0     0/0   0.0
Lamelo Wade            12    3    2    1   0   1/2    50.0     0/0   0.0
D'Angelo Markkanen     12    3    0    1   0   2/3    66.7     0/0   0.0
Franz Antetokounmpo    36    2    4    2   0   1/2    50.0     0/0   0.0
Chris Holiday          12    2    4    0   0   1/2    50.0     0/0   0.0
Bradley Sabonis        36    0    2    0   0   0/2     0.0     0/0   0.0
Larry Adebayo          12    0    2    0   0   0/0     0.0     0/0   0.0

TEAM: FG: 10/20 (50.0%), 3PT: 3/5 (60.0%), REB: 16 (3 off, 13 def), AST: 6, TO: 3
TEAM FOULS: 2

================================================================================

================================================================================
                               FULL GAME COMPLETE                               
================================================================================

FINAL SCORE: Team_023 81, Team_081 107

SCORING BY QUARTER:
--------------------------------------------------------------------------------
Team                     Q1     Q2     Q3     Q4    FINAL
--------------------------------------------------------------------------------
Team_023                 34     19     11     17       81
Team_081                 24     32     26     25      107
--------------------------------------------------------------------------------

FULL GAME BOX SCORE:
================================================================================

Team_023
--------------------------------------------------------------------------------
Player                MIN  PTS  REB  AST  TO      FG   FG%      3P   3P%      FT STL BLK
--------------------------------------------------------------------------------
Collin Ginobili        36   13    0    4   3   5/11   45.5   1/3    33.3   0/0     0   0
Kyle Paul              36    7    9    5   2   3/14   21.4   1/10   10.0   3/3     0   1
Josh Morant            36   18   11    2   1  10/13   76.9   2/3    66.7   4/6     1   0
Tim Bane               36   19   14    0   0   7/12   58.3   0/0     0.0   1/1     2   3
Trae Ingram            30    7    0    3   0   4/8    50.0   2/3    66.7   0/0     0   0
Tracy Anthony          19    5    0    2   4   2/5    40.0   1/3    33.3   0/0     1   0
Magic Booker           12    2    0    0   0   1/4    25.0   0/3     0.0   2/2     1   0
Gary Westbrook         12    2    3    0   0   1/3    33.3   0/2     0.0   0/0     0   0
Evan Parker            12    0    2    1   1   0/2     0.0   0/0     0.0   0/0     0   0
Vince Gasol            12    4    4    0   1   2/7    28.6   0/2     0.0   1/2     0   1

TEAM: FG: 35/79 (44.3%), 3PT: 7/29 (24.1%), REB: 44 (9 off, 35 def), AST: 17, TO: 12


Team_081
--------------------------------------------------------------------------------
Player                MIN  PTS  REB  AST  TO      FG   FG%      3P   3P%      FT STL BLK
--------------------------------------------------------------------------------
Bradley Leonard        36   20    0    4   2   9/16   56.2   4/8    50.0   1/1     2   0
Vince Adebayo          36    9    8    4   0   5/11   45.5   1/3    33.3   2/2     1   2
Bradley Sabonis        36   10   13    5   1   4/11   36.4   0/5     0.0   1/2     0   0
Franz Antetokounmpo    36   24   17    4   0   8/10   80.0   2/2   100.0   0/0     0   1
Julius Durant          30   13    0    3   2   5/11   45.5   2/4    50.0   1/1     0   0
Dejounte Bane          19    5    0    2   0   2/4    50.0   1/2    50.0   0/0     1   0
Lamelo Wade            12   12    6    2   0   3/5    60.0   0/1     0.0   5/5     0   0
Larry Adebayo          12    0    5    0   1   1/2    50.0   0/0     0.0   1/2     0   0
Chris Holiday          12    3    5    0   1   0/2     0.0   0/0     0.0   3/5     1   1
D'Angelo Markkanen     12    7    0    2   1   4/7    57.1   0/1     0.0   5/6     0   0

TEAM: FG: 45/83 (54.2%), 3PT: 10/26 (38.5%), REB: 53 (11 off, 42 def), AST: 26, TO: 8

================================================================================
