================================================================================
                        FULL GAME - Team_020 vs Team_093                        
================================================================================

================================================================================
                       1ST QUARTER - Team_020 vs Team_093                       
================================================================================

[12:00] Team_020 possession (Score: 0-0)
FOUL! Shooting foul on Carmelo Wagner. James Cunningham to the line for 3 free throws. [Team fouls: 1] (Carmelo Wagner: 1 personal fouls)   FT 1/3: GOOD   FT 2/3: GOOD   FT 3/3: MISS James Cunningham makes 2/3 from the line. Offensive rebound by Trae Curry! Trae Curry puts it back in!
Score: 4-0

[11:46] Team_093 possession (Score: 4-0)
FOUL! Shooting foul on Trae Curry. Damian Williamson to the line for 2 free throws. [Team fouls: 1] (Trae Curry: 1 personal fouls)   FT 1/2: MISS   FT 2/2: GOOD Damian Williamson makes 1/2 from the line.
Score: 4-1

[11:30] Team_020 possession (Score: 4-1)
Jarrett McCollum attempts a Midrange. Contested by Damian Williamson (4.9 feet, MAN). JARRETT MCCOLLUM MAKES IT!
Score: 6-1

[11:18] Team_093 possession (Score: 6-1)
Ben Cunningham attempts a Midrange. Contested by James Cunningham (5.5 feet, ZONE). Ben Cunningham misses. Rebound secured by Trae Curry.

[11:02] Team_020 possession (Score: 6-1)
Bam Leonard attempts a 3Pt. Contested by Vince Barnes (4.4 feet, MAN). Bam Leonard misses. Rebound secured by Carmelo Wagner.

[10:45] Team_093 possession (Score: 6-1)
Trae Westbrook attempts a 3Pt. Contested by James Cunningham (4.8 feet, MAN). Trae Westbrook misses. Rebound secured by Trae Curry.

[10:35] Team_020 possession (Score: 6-1)
James Cunningham makes the Dunk and draws the foul on Trae Westbrook! And-1! James Cunningham to the line for 1. [Team fouls: 2] (Trae Westbrook: 1 personal fouls)   FT 1/1: GOOD James Cunningham makes 1/1 from the line.
Score: 9-1

[10:23] Team_093 possession (Score: 9-1)
Vince Barnes attempts a 3Pt. Contested by Bam Leonard (2.5 feet, ZONE). Vince Barnes misses. Offensive rebound by Ben Cunningham! Ben Cunningham kicks it out.

[10:08] Team_093 possession (Score: 9-1)
Vince Barnes throws a bad pass out of bounds! TURNOVER! (dead ball)

[09:53] Team_020 possession (Score: 9-1)
Trae Curry makes the Layup and draws the foul on Ben Cunningham! And-1! Trae Curry to the line for 1. [Team fouls: 3] (Ben Cunningham: 1 personal fouls)   FT 1/1: GOOD Trae Curry makes 1/1 from the line.
Score: 12-1

[09:35] Team_093 possession (Score: 12-1)
Vince Barnes drives and kicks out. Vince Barnes attempts a 3Pt. Contested by Bam Leonard (2.3 feet, MAN). Vince Barnes misses. Rebound secured by Trae Curry.

[09:18] Team_020 possession (Score: 12-1)
Bam Leonard attempts a Midrange. Contested by Vince Barnes (4.4 feet, MAN). Bam Leonard misses. Rebound secured by Carmelo Wagner.

[09:00] Team_093 possession (Score: 12-1)
Damian Williamson attempts a Layup. Contested by Jarrett McCollum (4.3 feet, MAN). DAMIAN WILLIAMSON MAKES IT! Assist: Carmelo Wagner
Score: 12-3

[08:45] Team_020 possession (Score: 12-3)
Bam Leonard attempts a Layup. Contested by Vince Barnes (4.4 feet, MAN). BAM LEONARD MAKES IT! Assist: Trae Curry
Score: 14-3

[08:29] Team_093 possession (Score: 14-3)
Damian Williamson attempts a 3Pt. Contested by Jarrett McCollum (4.3 feet, MAN). DAMIAN WILLIAMSON MAKES IT! Assist: Carmelo Wagner
Score: 14-6

[08:13] Team_020 possession (Score: 14-6)
Trae Curry drives, picks up Ben Cunningham. Help arrives from Trae Westbrook! Trae Curry attempts a Dunk. Contested by Trae Westbrook (5.4 feet, MAN). TRAE CURRY MAKES IT!
Score: 16-6

[07:57] Team_093 possession (Score: 16-6)
Ben Cunningham attempts a Midrange. Contested by Terry Simons (4.7 feet, ZONE). BEN CUNNINGHAM MAKES IT! Assist: Carmelo Wagner
Score: 16-8

[07:44] Team_020 possession (Score: 16-8)
Jarrett McCollum attempts a 3Pt. Contested by Carmelo Wagner (3.5 feet, ZONE). Jarrett McCollum misses. FOUL! Loose ball foul on Carmelo Wagner during the rebound battle. [Team fouls: 4] No free throws, side out. (Carmelo Wagner: 2 personal fouls)

[07:31] Team_020 possession (Score: 16-8)
Trae Curry attempts a 3Pt. Contested by Ben Cunningham (5.4 feet, MAN). TRAE CURRY MAKES IT!
Score: 19-8

[07:18] Team_093 possession (Score: 19-8)
Damian Williamson attempts a Midrange. Contested by James Cunningham (4.9 feet, ZONE). Damian Williamson misses. Rebound secured by Terry Simons.

[07:06] Team_020 possession (Score: 19-8)
Bam Leonard drives to the basket... FOUL! Offensive foul on Bam Leonard! Ben Cunningham drew the charge! [Team fouls: 2] (Bam Leonard: 1 personal fouls) TURNOVER! (dead ball)

[06:51] Team_093 possession (Score: 19-8)
Carmelo Wagner throws a bad pass! Stolen by Terry Simons! TURNOVER! (live ball)

[06:34] Team_020 possession (Score: 19-8)
James Cunningham attempts a 3Pt. Contested by Carmelo Wagner (3.7 feet, ZONE). James Cunningham misses. Rebound secured by Ben Cunningham.

[06:15] Team_093 possession (Score: 19-8)
Ben Cunningham attempts a 3Pt. Contested by Bam Leonard (2.8 feet, ZONE). BEN CUNNINGHAM MAKES IT! Assist: Vince Barnes
Score: 19-11

[06:00] Team_020 possession (Score: 19-11)
Terry Simons attempts a Midrange. Wide open! Trae Westbrook is 6.1 feet away. [ZONE] Terry Simons misses. Rebound secured by Carmelo Wagner.

[05:47] Team_093 possession (Score: 19-11)
Damian Williamson attempts a Layup. BLOCKED BY TERRY SIMONS! Ball is loose! Offensive rebound by Ben Cunningham! Ben Cunningham kicks it out.

[05:32] Team_093 possession (Score: 19-11)
Carmelo Wagner attempts a Midrange. Contested by Terry Simons (3.9 feet, ZONE). Carmelo Wagner misses. Rebound secured by Terry Simons.

[05:17] Team_020 possession (Score: 19-11)
Trae Curry loses the ball! Stripped by Ben Cunningham! TURNOVER! (live ball)

[05:03] Team_093 possession (Score: 19-11)
FOUL! Shooting foul on Trae Curry. Trae Westbrook to the line for 2 free throws. [Team fouls: 3] (Trae Curry: 2 personal fouls)   FT 1/2: GOOD   FT 2/2: GOOD Trae Westbrook makes 2/2 from the line.
Score: 19-13

[04:48] Team_020 possession (Score: 19-13)
Jarrett McCollum attempts a 3Pt. Contested by Damian Williamson (5.0 feet, MAN). JARRETT MCCOLLUM MAKES IT! Assist: Bam Leonard
Score: 22-13

[04:36] Team_093 possession (Score: 22-13)
FOUL! Holding foul on Jarrett McCollum. [Team fouls: 4] No free throws, side out. (Jarrett McCollum: 1 personal fouls)

[04:22] Team_093 possession (Score: 22-13)
Vince Barnes attempts a Layup. BLOCKED BY BAM LEONARD! Ball is loose! Rebound secured by Bam Leonard.

[04:10] Team_020 possession (Score: 22-13)
Trae Curry attempts a 3Pt. Contested by Ben Cunningham (5.5 feet, MAN). TRAE CURRY MAKES IT! Assist: James Cunningham
Score: 25-13

[03:55] Team_093 possession (Score: 25-13)
FOUL! Holding foul on Bam Leonard. [IN THE BONUS! 5 team fouls] Ben Cunningham to the line for 2 free throws. (Bam Leonard: 2 personal fouls)   FT 1/2: GOOD   FT 2/2: GOOD Ben Cunningham makes 2/2 from the line.
Score: 25-15

[03:40] Team_020 possession (Score: 25-15)
Bam Leonard drives and kicks out. Terry Simons attempts a Midrange. Contested by Carmelo Wagner (3.6 feet, MAN). Terry Simons misses. Offensive rebound by Bam Leonard! Bam Leonard puts it back in!
Score: 27-15

[03:20] Team_093 possession (Score: 27-15)
FOUL! Shooting foul on Terry Simons. Vince Barnes to the line for 2 free throws. [BONUS: 6 team fouls] (Terry Simons: 1 personal fouls)   FT 1/2: GOOD   FT 2/2: GOOD Vince Barnes makes 2/2 from the line.
Score: 27-17

[03:03] Team_020 possession (Score: 27-17)
Trae Curry throws a bad pass out of bounds! TURNOVER! (dead ball)

[03:03] Substitution (Team_093): Damian Williamson OUT → Shaquille George IN (stamina_rule2)

[03:03] Substitution (Team_093): Ben Cunningham OUT → Cade O'Neal IN (stamina_rule2)

[02:49] Team_093 possession (Score: 27-17)
Carmelo Wagner drives, Terry Simons stays with him. Carmelo Wagner attempts a Dunk. Contested by Terry Simons (4.1 feet, MAN). Carmelo Wagner misses. Rebound secured by Trae Curry.

[02:35] Team_020 possession (Score: 27-17)
Trae Curry drives, Cade O'Neal stays with him. Trae Curry attempts a Dunk. Contested by Cade O'Neal (5.6 feet, ZONE). TRAE CURRY MAKES IT! Assist: Terry Simons
Score: 29-17

[02:22] Team_093 possession (Score: 29-17)
Shaquille George drives to the basket... Shaquille George commits a violation (traveling/carry)! TURNOVER! (dead ball)

[02:22] Substitution (Team_020): Jarrett McCollum OUT → Franz Doncic IN (stamina_rule2)

[02:22] Substitution (Team_020): Terry Simons OUT → Victor Holiday IN (stamina_rule2)

[02:22] Substitution (Team_020): Bam Leonard OUT → Cole Barnes IN (stamina_rule2)

[02:22] Substitution (Team_020): Trae Curry OUT → Miles Siakam IN (stamina_rule2)

[02:22] Substitution (Team_093): Trae Westbrook OUT → Immanuel Cunningham IN (stamina_rule2)

[02:22] Substitution (Team_093): Carmelo Wagner OUT → Lauri Parker IN (stamina_rule2)

[02:06] Team_020 possession (Score: 29-17)
Cole Barnes throws a bad pass! Stolen by Vince Barnes! TURNOVER! (live ball)

[01:52] Team_093 possession (Score: 29-17)
FOUL! Reach-in foul on Miles Siakam during the drive. [IN THE BONUS! 7 team fouls] Cade O'Neal to the line for 2 free throws. (Miles Siakam: 1 personal fouls)   FT 1/2: GOOD   FT 2/2: GOOD Cade O'Neal makes 2/2 from the line.
Score: 29-19

[01:41] Team_020 possession (Score: 29-19)
Cole Barnes attempts a Layup. Contested by Cade O'Neal (5.3 feet, ZONE). COLE BARNES MAKES IT! Assist: Franz Doncic
Score: 31-19

[01:23] Team_093 possession (Score: 31-19)
Lauri Parker attempts a 3Pt. Contested by James Cunningham (5.3 feet, ZONE). Lauri Parker misses. Rebound secured by Miles Siakam.

[01:10] Team_020 possession (Score: 31-19)
Miles Siakam attempts a Midrange. Contested by Cade O'Neal (5.4 feet, MAN). MILES SIAKAM MAKES IT!
Score: 33-19

[00:57] Team_093 possession (Score: 33-19)
Cade O'Neal attempts a Layup. BLOCKED BY MILES SIAKAM! Ball deflects out of bounds off Cade O'Neal.

[00:42] Team_020 possession (Score: 33-19)
James Cunningham attempts a 3Pt. Contested by Immanuel Cunningham (5.9 feet, MAN). JAMES CUNNINGHAM MAKES IT! Assist: Franz Doncic
Score: 36-19

[00:23] Team_093 possession (Score: 36-19)
Cade O'Neal attempts a Midrange. Contested by Victor Holiday (4.3 feet, ZONE). CADE O'NEAL MAKES IT! Assist: Immanuel Cunningham
Score: 36-21

[00:10] Team_020 possession (Score: 36-21)
Victor Holiday attempts a Midrange. Contested by Lauri Parker (5.0 feet, MAN). Victor Holiday misses. Offensive rebound by Miles Siakam! Miles Siakam kicks it out.

================================================================================
                              1ST QUARTER COMPLETE                              
================================================================================

1ST QUARTER SCORE: Team_020 36, Team_093 21

BOX SCORE:
================================================================================

Team_020
--------------------------------------------------------------------------------
Player                MIN  PTS  REB  AST  TO      FG   FG%      3P   3P%
--------------------------------------------------------------------------------
Trae Curry             10   17    5    1   0   6/6   100.0     0/0   0.0
James Cunningham       12    6    0    1   0   2/3    66.7     0/0   0.0
Jarrett McCollum       10    5    0    0   0   2/2   100.0     0/0   0.0
Bam Leonard            10    4    2    1   0   2/4    50.0     0/0   0.0
Cole Barnes             2    2    0    0   0   1/1   100.0     0/0   0.0
Miles Siakam            2    2    2    0   0   1/1   100.0     0/0   0.0
Terry Simons           10    0    2    1   0   0/1     0.0     0/0   0.0
Franz Doncic            2    0    0    2   0   0/0     0.0     0/0   0.0

TEAM: FG: 14/18 (77.8%), 3PT: 5/7 (71.4%), REB: 11 (3 off, 8 def), AST: 6, TO: 4
TEAM FOULS: 7 [Team_093 in BONUS]


Team_093
--------------------------------------------------------------------------------
Player                MIN  PTS  REB  AST  TO      FG   FG%      3P   3P%
--------------------------------------------------------------------------------
Ben Cunningham          9    7    3    0   0   3/4    75.0     0/0   0.0
Damian Williamson       9    6    0    0   0   3/4    75.0     0/0   0.0
Cade O'Neal             3    4    0    0   0   2/3    66.7     0/0   0.0
Trae Westbrook         10    2    0    0   0   1/2    50.0     0/0   0.0
Vince Barnes           12    2    0    1   0   1/3    33.3     0/0   0.0
Carmelo Wagner         10    0    3    3   0   0/2     0.0     0/0   0.0
Lauri Parker            2    0    0    0   0   0/1     0.0     0/0   0.0
Immanuel Cunningham     2    0    0    1   0   0/0     0.0     0/0   0.0

TEAM: FG: 10/19 (52.6%), 3PT: 2/4 (50.0%), REB: 6 (2 off, 4 def), AST: 5, TO: 3
TEAM FOULS: 4

================================================================================

================================================================================
                       2ND QUARTER - Team_020 vs Team_093                       
================================================================================

[12:00] Team_020 possession (Score: 36-21)
Trae Curry drives and kicks out. Trae Curry attempts a 3Pt. Contested by Ben Cunningham (4.9 feet, MAN). Trae Curry misses. Offensive rebound by Bam Leonard! Bam Leonard puts it back in!
Score: 38-21

[11:46] Team_093 possession (Score: 38-21)
Vince Barnes attempts a Layup. Contested by Trae Curry (4.8 feet, ZONE). Vince Barnes misses. Rebound secured by Terry Simons.

[11:28] Team_020 possession (Score: 38-21)
Bam Leonard attempts a 3Pt. Contested by Vince Barnes (4.7 feet, MAN). Bam Leonard misses. Rebound secured by Vince Barnes.

[11:13] Team_093 possession (Score: 38-21)
Ben Cunningham attempts a Layup. Contested by Trae Curry (5.2 feet, ZONE). Ben Cunningham misses. Rebound secured by Trae Curry.

[10:58] Team_020 possession (Score: 38-21)
Terry Simons drives to the basket... FOUL! Offensive foul on Terry Simons! Ben Cunningham drew the charge! [Team fouls: 1] (Terry Simons: 1 personal fouls) TURNOVER! (dead ball)

[10:45] Team_093 possession (Score: 38-21)
FOUL! Shooting foul on Bam Leonard. Ben Cunningham to the line for 2 free throws. [Team fouls: 2] (Bam Leonard: 1 personal fouls)   FT 1/2: GOOD   FT 2/2: GOOD Ben Cunningham makes 2/2 from the line.
Score: 38-23

[10:30] Team_020 possession (Score: 38-23)
FOUL! Reach-in foul on Damian Williamson during the drive. [Team fouls: 1] No free throws, side out. (Damian Williamson: 1 personal fouls)

[10:16] Team_020 possession (Score: 38-23)
Jarrett McCollum attempts a Midrange. Contested by Damian Williamson (5.1 feet, MAN). JARRETT MCCOLLUM MAKES IT!
Score: 40-23

[09:58] Team_093 possession (Score: 40-23)
Damian Williamson attempts a Midrange. Contested by Terry Simons (4.3 feet, ZONE). DAMIAN WILLIAMSON MAKES IT!
Score: 40-25

[09:41] Team_020 possession (Score: 40-25)
Terry Simons attempts a 3Pt. Contested by Carmelo Wagner (4.2 feet, MAN). Terry Simons misses. Rebound secured by Vince Barnes.

[09:28] Team_093 possession (Score: 40-25)
Damian Williamson attempts a 3Pt. Contested by Jarrett McCollum (4.5 feet, ZONE). Damian Williamson misses. Rebound secured by Terry Simons.

[09:14] Team_020 possession (Score: 40-25)
Bam Leonard attempts a Midrange. Contested by Vince Barnes (5.0 feet, ZONE). Bam Leonard misses. Rebound secured by Vince Barnes.

[08:59] Team_093 possession (Score: 40-25)
FOUL! Holding foul on Bam Leonard. [Team fouls: 3] No free throws, side out. (Bam Leonard: 2 personal fouls)

[08:47] Team_093 possession (Score: 40-25)
Vince Barnes throws a bad pass! Stolen by Bam Leonard! TURNOVER! (live ball)

[08:33] Team_020 possession (Score: 40-25)
Trae Curry makes the Dunk and draws the foul on Ben Cunningham! And-1! Trae Curry to the line for 1. [Team fouls: 2] (Ben Cunningham: 1 personal fouls)   FT 1/1: GOOD Trae Curry makes 1/1 from the line.
Score: 43-25

[08:19] Team_093 possession (Score: 43-25)
Carmelo Wagner attempts a 3Pt. Contested by Bam Leonard (2.5 feet, ZONE). CARMELO WAGNER MAKES IT! Assist: Damian Williamson
Score: 43-28

[08:00] Team_020 possession (Score: 43-28)
Terry Simons drives and kicks out. Bam Leonard attempts a Midrange. Contested by Trae Westbrook (5.7 feet, ZONE). Bam Leonard misses. Rebound secured by Ben Cunningham.

[07:48] Team_093 possession (Score: 43-28)
Vince Barnes attempts a Layup. Contested by Trae Curry (5.1 feet, ZONE). Vince Barnes misses. Rebound secured by Bam Leonard.

[07:33] Team_020 possession (Score: 43-28)
Trae Curry drives and kicks out. James Cunningham attempts a 3Pt. Contested by Trae Westbrook (5.8 feet, MAN). James Cunningham misses. Rebound secured by Carmelo Wagner.

[07:20] Team_093 possession (Score: 43-28)
Ben Cunningham makes the Dunk and draws the foul on Trae Curry! And-1! Ben Cunningham to the line for 1. [Team fouls: 4] (Trae Curry: 1 personal fouls)   FT 1/1: GOOD Ben Cunningham makes 1/1 from the line.
Score: 43-31

[07:07] Team_020 possession (Score: 43-31)
Bam Leonard attempts a Layup. Contested by Vince Barnes (5.2 feet, MAN). BAM LEONARD MAKES IT! Assist: James Cunningham
Score: 45-31

[06:53] Team_093 possession (Score: 45-31)
Trae Westbrook attempts a 3Pt. Contested by Bam Leonard (2.8 feet, ZONE). Trae Westbrook misses. Rebound secured by Terry Simons.

[06:41] Team_020 possession (Score: 45-31)
Terry Simons drives to the basket... Terry Simons throws a bad pass! Stolen by Ben Cunningham! TURNOVER! (live ball)

[06:26] Team_093 possession (Score: 45-31)
Vince Barnes attempts a 3Pt. Contested by Bam Leonard (3.2 feet, MAN). Vince Barnes misses. Rebound secured by Terry Simons.

[06:11] Team_020 possession (Score: 45-31)
Terry Simons attempts a Layup. Contested by Carmelo Wagner (4.7 feet, MAN). TERRY SIMONS MAKES IT!
Score: 47-31

[05:57] Team_093 possession (Score: 47-31)
Carmelo Wagner drives, picks up Trae Curry. Help arrives from Jarrett McCollum! Carmelo Wagner attempts a Dunk. Contested by Jarrett McCollum (5.0 feet, ZONE). CARMELO WAGNER MAKES IT! Assist: Damian Williamson
Score: 47-33

[05:46] Team_020 possession (Score: 47-33)
James Cunningham attempts a 3Pt. Wide open! Trae Westbrook is 6.1 feet away. [MAN] JAMES CUNNINGHAM MAKES IT! Assist: Trae Curry
Score: 50-33

[05:36] Team_093 possession (Score: 50-33)
Carmelo Wagner attempts a Layup. Contested by Terry Simons (4.7 feet, MAN). Carmelo Wagner misses. Rebound secured by Terry Simons.

[05:22] Team_020 possession (Score: 50-33)
Jarrett McCollum attempts a Midrange. Wide open! Trae Westbrook is 6.1 feet away. [ZONE] JARRETT MCCOLLUM MAKES IT! Assist: James Cunningham
Score: 52-33

[05:04] Team_093 possession (Score: 52-33)
FOUL! Shooting foul on James Cunningham. Trae Westbrook to the line for 3 free throws. [BONUS: 5 team fouls] (James Cunningham: 1 personal fouls)   FT 1/3: GOOD   FT 2/3: GOOD   FT 3/3: GOOD Trae Westbrook makes 3/3 from the line.
Score: 52-36

[04:51] Team_020 possession (Score: 52-36)
Trae Curry makes the Layup and draws the foul on Trae Westbrook! And-1! Trae Curry to the line for 1. [Team fouls: 3] (Trae Westbrook: 1 personal fouls)   FT 1/1: GOOD Trae Curry makes 1/1 from the line.
Score: 55-36

[04:37] Team_093 possession (Score: 55-36)
Trae Westbrook attempts a 3Pt. Contested by Bam Leonard (3.2 feet, ZONE). Trae Westbrook misses. Offensive rebound by Ben Cunningham! Ben Cunningham kicks it out.

[04:23] Team_093 possession (Score: 55-36)
Damian Williamson attempts a Midrange. Contested by Jarrett McCollum (5.2 feet, MAN). DAMIAN WILLIAMSON MAKES IT! Assist: Carmelo Wagner
Score: 55-38

[04:14] Team_020 possession (Score: 55-38)
Bam Leonard attempts a 3Pt. Contested by Carmelo Wagner (4.7 feet, ZONE). Bam Leonard misses. Rebound secured by Vince Barnes.

[04:01] Team_093 possession (Score: 55-38)
Vince Barnes attempts a Midrange. Contested by Terry Simons (5.2 feet, ZONE). Vince Barnes misses. Offensive rebound by Carmelo Wagner! Carmelo Wagner kicks it out.

[03:42] Team_093 possession (Score: 55-38)
Trae Westbrook attempts a 3Pt. Wide open! James Cunningham is 6.0 feet away. [MAN] TRAE WESTBROOK MAKES IT! Assist: Damian Williamson
Score: 55-41

[03:29] Team_020 possession (Score: 55-41)
James Cunningham attempts a 3Pt. Contested by Carmelo Wagner (4.8 feet, ZONE). James Cunningham misses. Offensive rebound by Trae Curry! Trae Curry kicks it out.

[03:16] Team_020 possession (Score: 55-41)
Trae Curry attempts a Midrange. Wide open! Ben Cunningham is 6.2 feet away. [MAN] Trae Curry misses. Rebound secured by Ben Cunningham.

[02:59] Team_093 possession (Score: 55-41)
Vince Barnes attempts a 3Pt. Contested by Bam Leonard (3.8 feet, ZONE). Vince Barnes misses. Rebound secured by Trae Curry.

[02:45] Team_020 possession (Score: 55-41)
Terry Simons drives and kicks out. Jarrett McCollum attempts a Midrange. Wide open! Damian Williamson is 6.0 feet away. [MAN] JARRETT MCCOLLUM MAKES IT!
Score: 57-41

[02:32] Team_093 possession (Score: 57-41)
Carmelo Wagner attempts a Midrange. Contested by Terry Simons (5.1 feet, ZONE). Carmelo Wagner misses. Rebound secured by Bam Leonard.

[02:16] Team_020 possession (Score: 57-41)
Terry Simons attempts a 3Pt. Contested by Carmelo Wagner (5.3 feet, ZONE). Terry Simons misses. Rebound secured by Vince Barnes.

[02:06] Team_093 possession (Score: 57-41)
FOUL! Shooting foul on Trae Curry. Carmelo Wagner to the line for 2 free throws. [BONUS: 6 team fouls] (Trae Curry: 2 personal fouls)   FT 1/2: GOOD   FT 2/2: GOOD Carmelo Wagner makes 2/2 from the line.
Score: 57-43

[01:52] Team_020 possession (Score: 57-43)
James Cunningham attempts a Midrange. Contested by Vince Barnes (6.0 feet, ZONE). JAMES CUNNINGHAM MAKES IT! Assist: Trae Curry
Score: 59-43

[01:34] Team_093 possession (Score: 59-43)
Ben Cunningham attempts a Midrange. Wide open! Trae Curry is 6.3 feet away. [MAN] BEN CUNNINGHAM MAKES IT!
Score: 59-45

[01:22] Team_020 possession (Score: 59-45)
Trae Curry drives, picks up Ben Cunningham. Help arrives from Trae Westbrook! Trae Curry attempts a Layup. Wide open! Trae Westbrook is 6.4 feet away. [MAN] TRAE CURRY MAKES IT! Assist: Terry Simons
Score: 61-45

[01:12] Team_093 possession (Score: 61-45)
Vince Barnes attempts a Layup. Contested by Bam Leonard (4.2 feet, MAN). VINCE BARNES MAKES IT! Assist: Ben Cunningham
Score: 61-47

[01:00] Team_020 possession (Score: 61-47)
James Cunningham attempts a 3Pt. Wide open! Trae Westbrook is 6.6 feet away. [MAN] JAMES CUNNINGHAM MAKES IT! Assist: Trae Curry
Score: 64-47

[00:43] Team_093 possession (Score: 64-47)
Damian Williamson attempts a 3Pt. Contested by Jarrett McCollum (5.7 feet, MAN). Damian Williamson misses. Offensive rebound by Ben Cunningham! Ben Cunningham kicks it out.

[00:30] Team_093 possession (Score: 64-47)
Trae Westbrook attempts a Midrange. Contested by Bam Leonard (4.1 feet, ZONE). Trae Westbrook misses. Rebound secured by Bam Leonard.

[00:14] Team_020 possession (Score: 64-47)
Trae Curry attempts a 3Pt. Contested by Carmelo Wagner (5.5 feet, ZONE). Trae Curry misses. Offensive rebound by Trae Curry! Trae Curry kicks it out.

================================================================================
                              2ND QUARTER COMPLETE                              
================================================================================

2ND QUARTER SCORE: Team_020 28, Team_093 26

BOX SCORE:
================================================================================

Team_020
--------------------------------------------------------------------------------
Player                MIN  PTS  REB  AST  TO      FG   FG%      3P   3P%
--------------------------------------------------------------------------------
Trae Curry             22    8    4    3   0   3/5    60.0     0/0   0.0
James Cunningham       24    8    0    2   0   3/3   100.0     0/0   0.0
Jarrett McCollum       22    6    0    0   0   3/3   100.0     0/0   0.0
Bam Leonard            22    4    4    0   0   2/5    40.0     0/0   0.0
Terry Simons           22    2    5    1   0   1/4    25.0     0/0   0.0

TEAM: FG: 12/20 (60.0%), 3PT: 2/6 (33.3%), REB: 13 (3 off, 10 def), AST: 6, TO: 2
TEAM FOULS: 6 [Team_093 in BONUS]


Team_093
--------------------------------------------------------------------------------
Player                MIN  PTS  REB  AST  TO      FG   FG%      3P   3P%
--------------------------------------------------------------------------------
Ben Cunningham         21    7    4    1   0   3/4    75.0     0/0   0.0
Carmelo Wagner         22    7    2    1   0   3/5    60.0     0/0   0.0
Trae Westbrook         22    6    0    0   0   2/4    50.0     0/0   0.0
Damian Williamson      21    4    0    3   0   2/3    66.7     0/0   0.0
Vince Barnes           24    2    5    0   0   1/5    20.0     0/0   0.0

TEAM: FG: 11/21 (52.4%), 3PT: 3/7 (42.9%), REB: 11 (3 off, 8 def), AST: 5, TO: 1
TEAM FOULS: 3

================================================================================

================================================================================
                       3RD QUARTER - Team_020 vs Team_093                       
================================================================================

[12:00] Team_020 possession (Score: 64-47)
Terry Simons drives and kicks out. FOUL! Shooting foul on Vince Barnes. Jarrett McCollum to the line for 2 free throws. [Team fouls: 1] (Vince Barnes: 1 personal fouls)   FT 1/2: GOOD   FT 2/2: GOOD Jarrett McCollum makes 2/2 from the line.
Score: 66-47

[11:43] Team_093 possession (Score: 66-47)
Vince Barnes drives and kicks out. FOUL! Shooting foul on Bam Leonard. Vince Barnes to the line for 3 free throws. [Team fouls: 1] (Bam Leonard: 1 personal fouls)   FT 1/3: GOOD   FT 2/3: GOOD   FT 3/3: GOOD Vince Barnes makes 3/3 from the line.
Score: 66-50

[11:30] Team_020 possession (Score: 66-50)
Jarrett McCollum attempts a 3Pt. Contested by Carmelo Wagner (3.5 feet, ZONE). Jarrett McCollum misses. Rebound secured by Ben Cunningham.

[11:20] Team_093 possession (Score: 66-50)
Vince Barnes throws a bad pass! Stolen by Bam Leonard! TURNOVER! (live ball)

[11:06] Team_020 possession (Score: 66-50)
FOUL! Shooting foul on Carmelo Wagner. James Cunningham to the line for 2 free throws. [Team fouls: 2] (Carmelo Wagner: 1 personal fouls)   FT 1/2: GOOD   FT 2/2: GOOD James Cunningham makes 2/2 from the line.
Score: 68-50

[10:50] Team_093 possession (Score: 68-50)
Carmelo Wagner attempts a 3Pt. Contested by Terry Simons (3.9 feet, MAN). CARMELO WAGNER MAKES IT! Assist: Ben Cunningham
Score: 68-53

[10:33] Team_020 possession (Score: 68-53)
Jarrett McCollum drives and kicks out. Bam Leonard attempts a 3Pt. Contested by Carmelo Wagner (3.3 feet, ZONE). Bam Leonard misses. FOUL! Loose ball foul on Carmelo Wagner during the rebound battle. [Team fouls: 3] No free throws, side out. (Carmelo Wagner: 2 personal fouls)

[10:15] Team_020 possession (Score: 68-53)
James Cunningham drives and kicks out. James Cunningham attempts a Midrange. Contested by Trae Westbrook (5.4 feet, MAN). JAMES CUNNINGHAM MAKES IT! Assist: Bam Leonard
Score: 70-53

[09:58] Team_093 possession (Score: 70-53)
Damian Williamson drives and kicks out. Trae Westbrook attempts a 3Pt. Contested by Bam Leonard (2.3 feet, ZONE). Trae Westbrook misses. Rebound secured by Trae Curry.

[09:41] Team_020 possession (Score: 70-53)
James Cunningham attempts a 3Pt. Contested by Trae Westbrook (5.7 feet, MAN). James Cunningham misses. Rebound secured by Carmelo Wagner.

[09:27] Team_093 possession (Score: 70-53)
Ben Cunningham attempts a Layup. BLOCKED BY TRAE CURRY! Ball deflects out of bounds off Ben Cunningham.

[09:10] Team_020 possession (Score: 70-53)
Terry Simons attempts a 3Pt. Contested by Carmelo Wagner (4.0 feet, ZONE). TERRY SIMONS MAKES IT! Assist: Trae Curry
Score: 73-53

[08:56] Team_093 possession (Score: 73-53)
Carmelo Wagner drives, picks up Trae Curry. Help arrives from Jarrett McCollum! Carmelo Wagner attempts a Dunk. Contested by Jarrett McCollum (4.3 feet, ZONE). CARMELO WAGNER MAKES IT! Assist: Trae Westbrook
Score: 73-55

[08:41] Team_020 possession (Score: 73-55)
James Cunningham drives and kicks out. Trae Curry attempts a 3Pt. Contested by Ben Cunningham (4.9 feet, MAN). Trae Curry misses. Rebound secured by Carmelo Wagner.

[08:25] Team_093 possession (Score: 73-55)
Vince Barnes attempts a Midrange. BLOCKED BY BAM LEONARD! Ball deflects out of bounds off Vince Barnes.

[08:07] Team_020 possession (Score: 73-55)
James Cunningham attempts a 3Pt. Contested by Carmelo Wagner (3.7 feet, ZONE). James Cunningham misses. Rebound secured by Carmelo Wagner.

[07:54] Team_093 possession (Score: 73-55)
Trae Westbrook attempts a 3Pt. Contested by James Cunningham (4.8 feet, MAN). TRAE WESTBROOK MAKES IT! Assist: Damian Williamson
Score: 73-58

[07:43] Team_020 possession (Score: 73-58)
Jarrett McCollum attempts a 3Pt. BLOCKED BY CARMELO WAGNER! Ball is loose! Offensive rebound by Bam Leonard! Bam Leonard kicks it out.

[07:32] Team_020 possession (Score: 73-58)
James Cunningham loses control! Ball rolls out of bounds! TURNOVER! (dead ball)

[07:16] Team_093 possession (Score: 73-58)
Trae Westbrook drives, picks up Trae Curry. Help arrives from Jarrett McCollum! Trae Westbrook attempts a Layup. Contested by Jarrett McCollum (4.4 feet, ZONE). Trae Westbrook misses. Rebound secured by Bam Leonard.

[07:00] Team_020 possession (Score: 73-58)
Trae Curry attempts a Layup. Contested by Ben Cunningham (5.4 feet, MAN). TRAE CURRY MAKES IT!
Score: 75-58

[06:43] Team_093 possession (Score: 75-58)
Damian Williamson attempts a 3Pt. Contested by Jarrett McCollum (4.3 feet, MAN). Damian Williamson misses. Rebound secured by Terry Simons.

[06:30] Team_020 possession (Score: 75-58)
Trae Curry drives, Ben Cunningham stays with him. Trae Curry attempts a Dunk. Contested by Ben Cunningham (5.4 feet, ZONE). TRAE CURRY MAKES IT!
Score: 77-58

[06:18] Team_093 possession (Score: 77-58)
Vince Barnes attempts a Midrange. BLOCKED BY BAM LEONARD! Ball goes out off Bam Leonard. Vince Barnes's ball!

[06:01] Team_093 possession (Score: 77-58)
Carmelo Wagner drives to the basket... Carmelo Wagner throws a bad pass! Stolen by Terry Simons! TURNOVER! (live ball)

[05:49] Team_020 possession (Score: 77-58)
Trae Curry attempts a Midrange. Contested by Carmelo Wagner (3.8 feet, ZONE). Trae Curry misses. FOUL! Loose ball foul on Ben Cunningham during the rebound battle. [IN THE BONUS! 5 team fouls] Trae Curry to the line for 2 free throws. (Ben Cunningham: 1 personal fouls)   FT 1/2: GOOD   FT 2/2: GOOD Trae Curry makes 2/2 from the line.
Score: 79-58

[05:38] Team_093 possession (Score: 79-58)
FOUL! Shooting foul on Bam Leonard. Carmelo Wagner to the line for 3 free throws. [Team fouls: 2] (Bam Leonard: 2 personal fouls)   FT 1/3: GOOD   FT 2/3: MISS   FT 3/3: GOOD Carmelo Wagner makes 2/3 from the line.
Score: 79-60

[05:20] Team_020 possession (Score: 79-60)
Terry Simons attempts a 3Pt. Contested by Carmelo Wagner (4.0 feet, ZONE). TERRY SIMONS MAKES IT! Assist: Bam Leonard
Score: 82-60

[05:07] Team_093 possession (Score: 82-60)
Carmelo Wagner attempts a 3Pt. Contested by Terry Simons (3.9 feet, MAN). CARMELO WAGNER MAKES IT! Assist: Ben Cunningham
Score: 82-63

[04:50] Team_020 possession (Score: 82-63)
Trae Curry attempts a 3Pt. Contested by Carmelo Wagner (3.8 feet, ZONE). TRAE CURRY MAKES IT! Assist: Jarrett McCollum
Score: 85-63

[04:37] Team_093 possession (Score: 85-63)
Damian Williamson attempts a Midrange. Contested by Jarrett McCollum (4.4 feet, MAN). DAMIAN WILLIAMSON MAKES IT! Assist: Ben Cunningham
Score: 85-65

[04:27] Team_020 possession (Score: 85-65)
James Cunningham drives, Trae Westbrook stays with him. James Cunningham attempts a Layup. Contested by Trae Westbrook (5.8 feet, MAN). JAMES CUNNINGHAM MAKES IT! Assist: Bam Leonard
Score: 87-65

[04:17] Team_093 possession (Score: 87-65)
Ben Cunningham loses control! Ball rolls out of bounds! TURNOVER! (dead ball)

[04:01] Team_020 possession (Score: 87-65)
Bam Leonard attempts a Midrange. Contested by Vince Barnes (4.5 feet, MAN). BAM LEONARD MAKES IT!
Score: 89-65

[03:46] Team_093 possession (Score: 89-65)
FOUL! Holding foul on Terry Simons. [Team fouls: 3] No free throws, side out. (Terry Simons: 1 personal fouls)

[03:35] Team_093 possession (Score: 89-65)
Ben Cunningham attempts a Midrange. Contested by Bam Leonard (3.0 feet, MAN). BEN CUNNINGHAM MAKES IT! Assist: Damian Williamson
Score: 89-67

[03:22] Team_020 possession (Score: 89-67)
James Cunningham attempts a Midrange. Contested by Carmelo Wagner (3.9 feet, ZONE). James Cunningham misses. Rebound secured by Ben Cunningham.

[03:08] Team_093 possession (Score: 89-67)
FOUL! Shooting foul on Jarrett McCollum. Carmelo Wagner to the line for 3 free throws. [Team fouls: 4] (Jarrett McCollum: 1 personal fouls)   FT 1/3: GOOD   FT 2/3: GOOD   FT 3/3: GOOD Carmelo Wagner makes 3/3 from the line.
Score: 89-70

[02:49] Team_020 possession (Score: 89-70)
Trae Curry attempts a 3Pt. Contested by Ben Cunningham (5.6 feet, MAN). Trae Curry misses. Rebound secured by Ben Cunningham.

[02:31] Team_093 possession (Score: 89-70)
Ben Cunningham attempts a Midrange. BLOCKED BY BAM LEONARD! Ball deflects out of bounds off Ben Cunningham.

[02:18] Team_020 possession (Score: 89-70)
Jarrett McCollum attempts a 3Pt. Contested by Damian Williamson (5.3 feet, MAN). JARRETT MCCOLLUM MAKES IT!
Score: 92-70

[02:03] Team_093 possession (Score: 92-70)
Ben Cunningham attempts a 3Pt. Contested by Bam Leonard (3.2 feet, ZONE). Ben Cunningham misses. Rebound secured by Bam Leonard.

[01:48] Team_020 possession (Score: 92-70)
Trae Curry drives to the basket... FOUL! Offensive foul on Trae Curry! Ben Cunningham drew the charge! [Team fouls: 5] (Trae Curry: 1 personal fouls) TURNOVER! (dead ball)

[01:34] Team_093 possession (Score: 92-70)
Ben Cunningham attempts a Layup. BLOCKED BY TRAE CURRY! Ball goes out off Trae Curry. Ben Cunningham's ball!

[01:22] Team_093 possession (Score: 92-70)
Ben Cunningham throws a bad pass! Stolen by Bam Leonard! TURNOVER! (live ball)

[01:08] Team_020 possession (Score: 92-70)
James Cunningham attempts a Layup. Contested by Ben Cunningham (5.7 feet, ZONE). JAMES CUNNINGHAM MAKES IT!
Score: 94-70

[00:51] Team_093 possession (Score: 94-70)
FOUL! Shooting foul on Bam Leonard. Ben Cunningham to the line for 2 free throws. [BONUS: 6 team fouls] (Bam Leonard: 3 personal fouls)   FT 1/2: GOOD   FT 2/2: MISS Ben Cunningham makes 1/2 from the line. Rebound secured by Bam Leonard.
Score: 94-71

[00:38] Team_020 possession (Score: 94-71)
James Cunningham attempts a 3Pt. Contested by Carmelo Wagner (4.2 feet, ZONE). James Cunningham misses. Offensive rebound by Bam Leonard! Bam Leonard puts it back in!
Score: 96-71

[00:23] Team_093 possession (Score: 96-71)
Vince Barnes attempts a Layup. Contested by Bam Leonard (3.1 feet, MAN). Vince Barnes misses. Offensive rebound by Carmelo Wagner! Carmelo Wagner kicks it out.

[00:10] Team_093 possession (Score: 96-71)
Vince Barnes drives and kicks out. FOUL! Shooting foul on Bam Leonard. Ben Cunningham to the line for 2 free throws. [BONUS: 7 team fouls] (Bam Leonard: 4 personal fouls)   FT 1/2: MISS   FT 2/2: GOOD Ben Cunningham makes 1/2 from the line.
Score: 96-72

================================================================================
                              3RD QUARTER COMPLETE                              
================================================================================

3RD QUARTER SCORE: Team_020 32, Team_093 25

BOX SCORE:
================================================================================

Team_020
--------------------------------------------------------------------------------
Player                MIN  PTS  REB  AST  TO      FG   FG%      3P   3P%
--------------------------------------------------------------------------------
Trae Curry             34    9    1    1   0   4/5    80.0     0/0   0.0
James Cunningham       36    8    0    0   0   4/8    50.0     0/0   0.0
Terry Simons           34    6    1    0   0   2/2   100.0     0/0   0.0
Jarrett McCollum       34    5    0    1   0   2/3    66.7     0/0   0.0
Bam Leonard            34    4    6    3   0   2/2   100.0     0/0   0.0

TEAM: FG: 14/20 (70.0%), 3PT: 5/9 (55.6%), REB: 8 (3 off, 5 def), AST: 5, TO: 2
TEAM FOULS: 7 [Team_093 in BONUS]


Team_093
--------------------------------------------------------------------------------
Player                MIN  PTS  REB  AST  TO      FG   FG%      3P   3P%
--------------------------------------------------------------------------------
Carmelo Wagner         34   13    4    0   0   5/5   100.0     0/0   0.0
Vince Barnes           36    3    0    0   0   1/2    50.0     0/0   0.0
Ben Cunningham         33    3    3    3   0   2/6    33.3     0/0   0.0
Trae Westbrook         34    3    0    1   0   1/2    50.0     0/0   0.0
Damian Williamson      33    2    0    2   0   1/3    33.3     0/0   0.0

TEAM: FG: 10/18 (55.6%), 3PT: 5/7 (71.4%), REB: 7 (1 off, 6 def), AST: 6, TO: 4
TEAM FOULS: 5 [Team_020 in BONUS]

================================================================================

================================================================================
                       4TH QUARTER - Team_020 vs Team_093                       
================================================================================

[12:00] Team_020 possession (Score: 96-72)
Jarrett McCollum attempts a Layup. Contested by Damian Williamson (5.3 feet, MAN). JARRETT MCCOLLUM MAKES IT! Assist: Bam Leonard
Score: 98-72

[11:50] Team_093 possession (Score: 98-72)
Damian Williamson attempts a 3Pt. Contested by Jarrett McCollum (4.6 feet, MAN). Damian Williamson misses. FOUL! Loose ball foul on Terry Simons during the rebound battle. [Team fouls: 1] No free throws, side out. (Terry Simons: 1 personal fouls)

[11:35] Team_093 possession (Score: 98-72)
Trae Westbrook attempts a 3Pt. Contested by Bam Leonard (2.6 feet, ZONE). Trae Westbrook misses. Rebound secured by Bam Leonard.

[11:23] Team_020 possession (Score: 98-72)
Trae Curry attempts a Layup. Contested by Ben Cunningham (5.7 feet, MAN). TRAE CURRY MAKES IT! Assist: Jarrett McCollum
Score: 100-72

[11:08] Team_093 possession (Score: 100-72)
Ben Cunningham attempts a Layup. Contested by Bam Leonard (3.3 feet, MAN). Ben Cunningham misses. Rebound secured by Trae Curry.

[10:54] Team_020 possession (Score: 100-72)
Terry Simons drives to the basket... Terry Simons throws a bad pass! Stolen by Ben Cunningham! TURNOVER! (live ball)

[10:43] Team_093 possession (Score: 100-72)
Vince Barnes drives to the basket... Vince Barnes loses the ball! Stripped by Bam Leonard! TURNOVER! (live ball)

[10:30] Team_020 possession (Score: 100-72)
Bam Leonard attempts a 3Pt. Contested by Vince Barnes (4.8 feet, MAN). BAM LEONARD MAKES IT! Assist: Trae Curry
Score: 103-72

[10:18] Team_093 possession (Score: 103-72)
Carmelo Wagner attempts a Layup. Contested by Terry Simons (4.5 feet, MAN). Carmelo Wagner misses. Rebound secured by Terry Simons.

[10:05] Team_020 possession (Score: 103-72)
FOUL! Shooting foul on Ben Cunningham. Trae Curry to the line for 2 free throws. [Team fouls: 1] (Ben Cunningham: 1 personal fouls)   FT 1/2: GOOD   FT 2/2: GOOD Trae Curry makes 2/2 from the line.
Score: 105-72

[09:54] Team_093 possession (Score: 105-72)
Ben Cunningham throws a bad pass! Stolen by Bam Leonard! TURNOVER! (live ball)

[09:42] Team_020 possession (Score: 105-72)
Bam Leonard attempts a Midrange. Wide open! Trae Westbrook is 6.2 feet away. [ZONE] BAM LEONARD MAKES IT! Assist: Terry Simons
Score: 107-72

[09:23] Team_093 possession (Score: 107-72)
Ben Cunningham attempts a Layup. Contested by Trae Curry (5.7 feet, ZONE). BEN CUNNINGHAM MAKES IT! Assist: Trae Westbrook
Score: 107-74

[09:08] Team_020 possession (Score: 107-74)
FOUL! Reach-in foul on Ben Cunningham during the drive. [Team fouls: 2] No free throws, side out. (Ben Cunningham: 2 personal fouls)

[08:54] Team_020 possession (Score: 107-74)
FOUL! Shooting foul on Vince Barnes. Terry Simons to the line for 2 free throws. [Team fouls: 3] (Vince Barnes: 1 personal fouls)   FT 1/2: GOOD   FT 2/2: GOOD Terry Simons makes 2/2 from the line.
Score: 109-74

[08:40] Team_093 possession (Score: 109-74)
Ben Cunningham attempts a Midrange. Contested by Bam Leonard (3.7 feet, MAN). Ben Cunningham misses. Rebound secured by Terry Simons.

[08:26] Team_020 possession (Score: 109-74)
Trae Curry drives, Ben Cunningham stays with him. Trae Curry attempts a Dunk. Wide open! Ben Cunningham is 6.1 feet away. [ZONE] Trae Curry misses. Offensive rebound by Trae Curry! Trae Curry kicks it out.

[08:13] Team_020 possession (Score: 109-74)
Trae Curry attempts a Midrange. Wide open! Trae Westbrook is 6.4 feet away. [ZONE] Trae Curry misses. Rebound secured by Carmelo Wagner.

[07:55] Team_093 possession (Score: 109-74)
Damian Williamson attempts a Midrange. Contested by Terry Simons (5.0 feet, ZONE). DAMIAN WILLIAMSON MAKES IT!
Score: 109-76

[07:42] Team_020 possession (Score: 109-76)
Terry Simons drives to the basket... Terry Simons loses the ball! Stripped by Ben Cunningham! TURNOVER! (live ball)

[07:28] Team_093 possession (Score: 109-76)
Trae Westbrook throws a bad pass out of bounds! TURNOVER! (dead ball)

[07:28] Substitution (Team_020): Jarrett McCollum OUT → Franz Doncic IN (stamina_rule2)

[07:28] Substitution (Team_020): James Cunningham OUT → Stephen Parker IN (stamina_rule2)

[07:28] Substitution (Team_020): Terry Simons OUT → Victor Holiday IN (stamina_rule2)

[07:28] Substitution (Team_020): Bam Leonard OUT → Cole Barnes IN (stamina_rule2)

[07:28] Substitution (Team_020): Trae Curry OUT → Miles Siakam IN (stamina_rule2)

[07:28] Substitution (Team_093): Damian Williamson OUT → Shaquille George IN (stamina_rule2)

[07:28] Substitution (Team_093): Trae Westbrook OUT → Immanuel Cunningham IN (stamina_rule2)

[07:28] Substitution (Team_093): Carmelo Wagner OUT → Lauri Parker IN (stamina_rule2)

[07:28] Substitution (Team_093): Vince Barnes OUT → Kobe Murray IN (stamina_rule2)

[07:28] Substitution (Team_093): Ben Cunningham OUT → Cade O'Neal IN (stamina_rule2)

[07:13] Team_020 possession (Score: 109-76)
Franz Doncic throws a bad pass! Stolen by Shaquille George! TURNOVER! (live ball)

[06:57] Team_093 possession (Score: 109-76)
Immanuel Cunningham makes the Midrange and draws the foul on Victor Holiday! And-1! Immanuel Cunningham to the line for 1. [Team fouls: 2] (Victor Holiday: 1 personal fouls)   FT 1/1: GOOD Immanuel Cunningham makes 1/1 from the line.
Score: 109-79

[06:42] Team_020 possession (Score: 109-79)
Victor Holiday attempts a 3Pt. Contested by Shaquille George (4.8 feet, ZONE). Victor Holiday misses. Offensive rebound by Miles Siakam! Miles Siakam kicks it out.

[06:29] Team_020 possession (Score: 109-79)
FOUL! Shooting foul on Kobe Murray. Stephen Parker to the line for 2 free throws. [Team fouls: 4] (Kobe Murray: 1 personal fouls)   FT 1/2: GOOD   FT 2/2: GOOD Stephen Parker makes 2/2 from the line.
Score: 111-79

[06:15] Team_093 possession (Score: 111-79)
Immanuel Cunningham drives and kicks out. Kobe Murray attempts a 3Pt. Contested by Stephen Parker (5.4 feet, ZONE). Kobe Murray misses. Offensive rebound by Kobe Murray! Kobe Murray's putback is no good. Rebound secured by Cole Barnes.

[05:59] Team_020 possession (Score: 111-79)
FOUL! Holding foul on Kobe Murray. [IN THE BONUS! 5 team fouls] Miles Siakam to the line for 2 free throws. (Kobe Murray: 2 personal fouls)   FT 1/2: MISS   FT 2/2: GOOD Miles Siakam makes 1/2 from the line.
Score: 112-79

[05:44] Team_093 possession (Score: 112-79)
Immanuel Cunningham drives, picks up Stephen Parker. Help arrives from Victor Holiday! Immanuel Cunningham attempts a Dunk. Contested by Victor Holiday (5.6 feet, MAN). IMMANUEL CUNNINGHAM MAKES IT! Assist: Cade O'Neal
Score: 112-81

[05:27] Team_020 possession (Score: 112-81)
Stephen Parker makes the Layup and draws the foul on Shaquille George! And-1! Stephen Parker to the line for 1. [BONUS: 6 team fouls] (Shaquille George: 1 personal fouls)   FT 1/1: GOOD Stephen Parker makes 1/1 from the line.
Score: 115-81

[05:13] Team_093 possession (Score: 115-81)
Immanuel Cunningham makes the Layup and draws the foul on Stephen Parker! And-1! Immanuel Cunningham to the line for 1. [Team fouls: 3] (Stephen Parker: 1 personal fouls)   FT 1/1: GOOD Immanuel Cunningham makes 1/1 from the line.
Score: 115-84

[04:57] Team_020 possession (Score: 115-84)
Cole Barnes attempts a Layup. Contested by Kobe Murray (4.1 feet, MAN). Cole Barnes misses. Rebound secured by Lauri Parker.

[04:43] Team_093 possession (Score: 115-84)
Lauri Parker makes the Layup and draws the foul on Victor Holiday! And-1! Lauri Parker to the line for 1. [Team fouls: 4] (Victor Holiday: 2 personal fouls)   FT 1/1: GOOD Lauri Parker makes 1/1 from the line.
Score: 115-87

[04:29] Team_020 possession (Score: 115-87)
FOUL! Holding foul on Shaquille George. [IN THE BONUS! 7 team fouls] Franz Doncic to the line for 2 free throws. (Shaquille George: 2 personal fouls)   FT 1/2: MISS   FT 2/2: MISS Franz Doncic makes 0/2 from the line. Rebound secured by Cade O'Neal.

[04:14] Team_093 possession (Score: 115-87)
FOUL! Holding foul on Stephen Parker. [IN THE BONUS! 5 team fouls] Immanuel Cunningham to the line for 2 free throws. (Stephen Parker: 2 personal fouls)   FT 1/2: GOOD   FT 2/2: GOOD Immanuel Cunningham makes 2/2 from the line.
Score: 115-89

[04:01] Team_020 possession (Score: 115-89)
Victor Holiday attempts a Midrange. Contested by Lauri Parker (5.0 feet, ZONE). VICTOR HOLIDAY MAKES IT! Assist: Miles Siakam
Score: 117-89

[03:45] Team_093 possession (Score: 117-89)
Kobe Murray attempts a 3Pt. Contested by Cole Barnes (5.0 feet, ZONE). Kobe Murray misses. Offensive rebound by Cade O'Neal! Cade O'Neal kicks it out.

[03:29] Team_093 possession (Score: 117-89)
Lauri Parker attempts a Layup. BLOCKED BY MILES SIAKAM! Ball deflects out of bounds off Lauri Parker.

[03:15] Team_020 possession (Score: 117-89)
Miles Siakam attempts a Midrange. Contested by Kobe Murray (4.3 feet, MAN). MILES SIAKAM MAKES IT! Assist: Stephen Parker
Score: 119-89

[02:59] Team_093 possession (Score: 119-89)
FOUL! Reach-in foul on Miles Siakam during the drive. [IN THE BONUS! 6 team fouls] Immanuel Cunningham to the line for 2 free throws. (Miles Siakam: 1 personal fouls)   FT 1/2: GOOD   FT 2/2: GOOD Immanuel Cunningham makes 2/2 from the line.
Score: 119-91

[02:44] Team_020 possession (Score: 119-91)
Miles Siakam makes the Layup and draws the foul on Shaquille George! And-1! Miles Siakam to the line for 1. [BONUS: 8 team fouls] (Shaquille George: 3 personal fouls)   FT 1/1: MISS Miles Siakam makes 0/1 from the line. Rebound secured by Cade O'Neal.
Score: 121-91

[02:27] Team_093 possession (Score: 121-91)
Kobe Murray attempts a Layup. Contested by Miles Siakam (4.0 feet, ZONE). KOBE MURRAY MAKES IT! Assist: Lauri Parker
Score: 121-93

[02:12] Team_020 possession (Score: 121-93)
Victor Holiday attempts a Layup. Contested by Kobe Murray (4.5 feet, ZONE). VICTOR HOLIDAY MAKES IT! Assist: Cole Barnes
Score: 123-93

[01:57] Team_093 possession (Score: 123-93)
Shaquille George attempts a Layup. Contested by Franz Doncic (4.2 feet, MAN). Shaquille George misses. Offensive rebound by Cade O'Neal! Cade O'Neal kicks it out.

[01:38] Team_093 possession (Score: 123-93)
Shaquille George attempts a Midrange. Contested by Franz Doncic (4.2 feet, MAN). Shaquille George misses. Rebound secured by Victor Holiday.

[01:24] Team_020 possession (Score: 123-93)
FOUL! Holding foul on Kobe Murray. [IN THE BONUS! 9 team fouls] Cole Barnes to the line for 2 free throws. (Kobe Murray: 3 personal fouls)   FT 1/2: GOOD   FT 2/2: GOOD Cole Barnes makes 2/2 from the line.
Score: 125-93

[01:11] Team_093 possession (Score: 125-93)
Kobe Murray attempts a 3Pt. Contested by Cole Barnes (5.0 feet, MAN). Kobe Murray misses. Rebound secured by Cole Barnes.

[01:01] Team_020 possession (Score: 125-93)
Franz Doncic attempts a 3Pt. Contested by Shaquille George (3.9 feet, ZONE). Franz Doncic misses. Offensive rebound by Miles Siakam! Miles Siakam kicks it out.

[00:45] Team_020 possession (Score: 125-93)
Miles Siakam attempts a Layup. Contested by Kobe Murray (4.3 feet, ZONE). MILES SIAKAM MAKES IT! Assist: Cole Barnes
Score: 127-93

[00:30] Team_093 possession (Score: 127-93)
Immanuel Cunningham drives and kicks out. Lauri Parker attempts a 3Pt. Contested by Stephen Parker (5.4 feet, ZONE). Lauri Parker misses. Offensive rebound by Kobe Murray! Kobe Murray puts it back in!
Score: 127-95

[00:13] Team_020 possession (Score: 127-95)
Miles Siakam drives and kicks out. Stephen Parker attempts a 3Pt. Contested by Immanuel Cunningham (5.6 feet, MAN). STEPHEN PARKER MAKES IT! Assist: Victor Holiday
Score: 130-95

================================================================================
                              4TH QUARTER COMPLETE                              
================================================================================

4TH QUARTER SCORE: Team_020 34, Team_093 23

BOX SCORE:
================================================================================

Team_020
--------------------------------------------------------------------------------
Player                MIN  PTS  REB  AST  TO      FG   FG%      3P   3P%
--------------------------------------------------------------------------------
Stephen Parker          7    8    0    1   0   3/3   100.0     0/0   0.0
Bam Leonard            39    5    1    1   0   2/2   100.0     0/0   0.0
Miles Siakam            9    5    2    1   0   3/4    75.0     0/0   0.0
Trae Curry             39    4    2    1   0   2/3    66.7     0/0   0.0
Victor Holiday          9    4    1    1   0   2/2   100.0     0/0   0.0
Jarrett McCollum       39    2    0    1   0   1/1   100.0     0/0   0.0
Terry Simons           39    2    2    1   0   1/1   100.0     0/0   0.0
Cole Barnes             9    2    2    2   0   1/2    50.0     0/0   0.0

TEAM: FG: 15/19 (78.9%), 3PT: 1/1 (100.0%), REB: 9 (3 off, 6 def), AST: 9, TO: 3
TEAM FOULS: 6 [Team_093 in BONUS]


Team_093
--------------------------------------------------------------------------------
Player                MIN  PTS  REB  AST  TO      FG   FG%      3P   3P%
--------------------------------------------------------------------------------
Immanuel Cunningham     9   12    0    0   0   5/6    83.3     0/0   0.0
Kobe Murray             7    4    1    0   0   2/3    66.7     0/0   0.0
Lauri Parker            9    3    1    1   0   1/2    50.0     0/0   0.0
Ben Cunningham         38    2    1    0   0   1/3    33.3     0/0   0.0
Damian Williamson      38    2    0    0   0   1/1   100.0     0/0   0.0
Trae Westbrook         39    0    0    1   0   0/1     0.0     0/0   0.0
Carmelo Wagner         39    0    1    0   0   0/1     0.0     0/0   0.0
Cade O'Neal            10    0    4    1   0   0/0     0.0     0/0   0.0
Shaquille George       10    0    0    0   0   0/1     0.0     0/0   0.0

TEAM: FG: 10/18 (55.6%), 3PT: 0/2 (0.0%), REB: 9 (5 off, 4 def), AST: 3, TO: 3
TEAM FOULS: 9 [Team_020 in BONUS]

================================================================================

================================================================================
                               FULL GAME COMPLETE                               
================================================================================

FINAL SCORE: Team_020 130, Team_093 95

SCORING BY QUARTER:
--------------------------------------------------------------------------------
Team                     Q1     Q2     Q3     Q4    FINAL
--------------------------------------------------------------------------------
Team_020                 36     28     32     34      130
Team_093                 21     26     25     23       95
--------------------------------------------------------------------------------

FULL GAME BOX SCORE:
================================================================================

Team_020
--------------------------------------------------------------------------------
Player                MIN  PTS  REB  AST  TO      FG   FG%      3P   3P%      FT STL BLK
--------------------------------------------------------------------------------
James Cunningham       41   22    0    3   1  11/16   68.8   5/8    62.5   5/6     0   0
Jarrett McCollum       39   18    0    2   1   6/7    85.7   2/3    66.7   2/2     0   0
Terry Simons           39   10   10    3   2   6/10   60.0   2/4    50.0   2/2     2   1
Bam Leonard            39   17   13    5   0   6/11   54.5   1/4    25.0   0/0     5   4
Trae Curry             39   38   13    6   5  15/19   78.9   3/4    75.0   7/7     0   2
Franz Doncic            9    0    0    2   1   0/0     0.0   0/0     0.0   0/2     0   0
Victor Holiday          9    4    1    1   0   2/2   100.0   0/0     0.0   0/0     0   0
Cole Barnes             9    4    2    2   1   1/2    50.0   0/0     0.0   2/2     0   0
Miles Siakam            9    7    4    1   0   4/5    80.0   0/0     0.0   1/3     0   2
Stephen Parker          7    8    0    1   0   2/2   100.0   0/0     0.0   3/3     0   0

TEAM: FG: 55/77 (71.4%), 3PT: 13/23 (56.5%), REB: 41 (12 off, 29 def), AST: 26, TO: 11


Team_093
--------------------------------------------------------------------------------
Player                MIN  PTS  REB  AST  TO      FG   FG%      3P   3P%      FT STL BLK
--------------------------------------------------------------------------------
Vince Barnes           41    7    5    1   4   4/11   36.4   0/2     0.0   5/5     1   0
Trae Westbrook         39   11    0    2   3   4/9    44.4   3/6    50.0   5/5     0   0
Carmelo Wagner         39   20   10    4   1   8/13   61.5   5/5   100.0   7/8     0   1
Damian Williamson      38   14    0    5   0   7/11   63.6   1/3    33.3   1/2     0   0
Ben Cunningham         38   19   11    4   3   7/15   46.7   1/2    50.0   7/9     4   0
Shaquille George       10    0    0    0   0   0/1     0.0   0/0     0.0   0/0     1   0
Cade O'Neal            10    4    4    1   0   2/3    66.7   0/0     0.0   2/2     0   0
Immanuel Cunningham     9   12    0    1   0   5/6    83.3   0/0     0.0   6/6     0   0
Lauri Parker            9    3    1    1   0   1/3    33.3   0/1     0.0   1/1     0   0
Kobe Murray             7    4    1    0   0   1/2    50.0   0/1     0.0   0/0     0   0

TEAM: FG: 41/76 (53.9%), 3PT: 10/20 (50.0%), REB: 33 (11 off, 22 def), AST: 19, TO: 11

================================================================================
