================================================================================
                        FULL GAME - Team_020 vs Team_042                        
================================================================================

================================================================================
                       1ST QUARTER - Team_020 vs Team_042                       
================================================================================

[12:00] Team_020 possession (Score: 0-0)
Jarrett McCollum drives to the basket... Jarrett McCollum commits a violation (traveling/carry)! TURNOVER! (dead ball)

[11:48] Team_042 possession (Score: 0-0)
Jarrett Sabonis attempts a Layup. Contested by Trae Curry (5.0 feet, ZONE). JARRETT SABONIS MAKES IT! Assist: Dejounte Butler
Score: 0-2

[11:34] Team_020 possession (Score: 0-2)
Terry Simons attempts a 3Pt. Contested by Jarrett Sabonis (4.5 feet, MAN). Terry Simons misses. Offensive rebound by Bam Leonard! Bam Leonard's putback is no good. Offensive rebound by Bam Leonard! Bam Leonard kicks it out.

[11:20] Team_020 possession (Score: 0-2)
Bam Leonard attempts a 3Pt. Contested by Tyler Barrett (3.7 feet, ZONE). Bam Leonard misses. Rebound secured by Tyler Barrett.

[11:05] Team_042 possession (Score: 0-2)
FOUL! Reach-in foul on Bam Leonard during the drive. [Team fouls: 1] No free throws, side out. (Bam Leonard: 1 personal fouls)

[10:49] Team_042 possession (Score: 0-2)
Dejounte Butler attempts a 3Pt. Contested by Jarrett McCollum (4.6 feet, ZONE). Dejounte Butler misses. Offensive rebound by Cade Dosunmu! Cade Dosunmu puts it back in!
Score: 0-4

[10:37] Team_020 possession (Score: 0-4)
Terry Simons attempts a 3Pt. Contested by Jarrett Sabonis (4.5 feet, MAN). TERRY SIMONS MAKES IT! Assist: Bam Leonard
Score: 3-4

[10:20] Team_042 possession (Score: 3-4)
Jarrett Sabonis attempts a Midrange. Contested by Terry Simons (4.6 feet, MAN). JARRETT SABONIS MAKES IT! Assist: Kristaps Parker
Score: 3-6

[10:06] Team_020 possession (Score: 3-6)
Bam Leonard drives, picks up Dejounte Butler. Help arrives from Tyler Barrett! Bam Leonard attempts a Dunk. Contested by Tyler Barrett (3.9 feet, MAN). Bam Leonard misses. Rebound secured by Cade Dosunmu.

[09:52] Team_042 possession (Score: 3-6)
Cade Dosunmu attempts a 3Pt. Contested by Bam Leonard (2.6 feet, ZONE). Cade Dosunmu misses. Rebound secured by Trae Curry.

[09:38] Team_020 possession (Score: 3-6)
Jarrett McCollum attempts a 3Pt. Contested by Tyler Barrett (3.5 feet, MAN). JARRETT MCCOLLUM MAKES IT! Assist: Trae Curry
Score: 6-6

[09:26] Team_042 possession (Score: 6-6)
Kristaps Parker attempts a Midrange. Contested by James Cunningham (4.9 feet, MAN). KRISTAPS PARKER MAKES IT! Assist: Cade Dosunmu
Score: 6-8

[09:12] Team_020 possession (Score: 6-8)
James Cunningham attempts a 3Pt. Contested by Kristaps Parker (5.3 feet, MAN). JAMES CUNNINGHAM MAKES IT! Assist: Jarrett McCollum
Score: 9-8

[09:00] Team_042 possession (Score: 9-8)
Cade Dosunmu drives, Bam Leonard stays with him. Cade Dosunmu attempts a Layup. Contested by Bam Leonard (2.6 feet, MAN). Cade Dosunmu misses. Rebound secured by Trae Curry.

[08:41] Team_020 possession (Score: 9-8)
Jarrett McCollum drives and kicks out. James Cunningham attempts a 3Pt. Contested by Tyler Barrett (3.4 feet, ZONE). James Cunningham misses. Rebound secured by Dejounte Butler.

[08:28] Team_042 possession (Score: 9-8)
Cade Dosunmu attempts a Midrange. Contested by Bam Leonard (2.6 feet, MAN). Cade Dosunmu misses. Rebound secured by Bam Leonard.

[08:09] Team_020 possession (Score: 9-8)
James Cunningham attempts a 3Pt. Contested by Tyler Barrett (3.7 feet, ZONE). James Cunningham misses. Rebound secured by Dejounte Butler.

[07:57] Team_042 possession (Score: 9-8)
Cade Dosunmu drives to the basket... FOUL! Offensive foul on Cade Dosunmu! Trae Curry drew the charge! [Team fouls: 1] (Cade Dosunmu: 1 personal fouls) TURNOVER! (dead ball)

[07:38] Team_020 possession (Score: 9-8)
Bam Leonard attempts a 3Pt. Contested by Jarrett Sabonis (4.2 feet, ZONE). Bam Leonard misses. Rebound secured by Tyler Barrett.

[07:26] Team_042 possession (Score: 9-8)
Cade Dosunmu drives to the basket... Cade Dosunmu loses the ball! Stripped by Trae Curry! TURNOVER! (live ball)

[07:12] Team_020 possession (Score: 9-8)
Terry Simons makes the 3Pt and draws the foul on Jarrett Sabonis! And-1! Terry Simons to the line for 1. [Team fouls: 2] (Jarrett Sabonis: 1 personal fouls)   FT 1/1: GOOD Terry Simons makes 1/1 from the line.
Score: 13-8

[06:55] Team_042 possession (Score: 13-8)
Jarrett Sabonis attempts a Midrange. Contested by Bam Leonard (2.7 feet, ZONE). JARRETT SABONIS MAKES IT!
Score: 13-10

[06:43] Team_020 possession (Score: 13-10)
Terry Simons attempts a Layup. BLOCKED BY JARRETT SABONIS! Ball is loose! Rebound secured by Dejounte Butler.

[06:29] Team_042 possession (Score: 13-10)
Tyler Barrett attempts a Midrange. Contested by Jarrett McCollum (4.8 feet, MAN). TYLER BARRETT MAKES IT! Assist: Jarrett Sabonis
Score: 13-12

[06:15] Team_020 possession (Score: 13-12)
James Cunningham drives, Kristaps Parker stays with him. James Cunningham attempts a Dunk. Contested by Kristaps Parker (5.3 feet, MAN). James Cunningham misses. Rebound secured by Dejounte Butler.

[06:01] Team_042 possession (Score: 13-12)
Jarrett Sabonis drives and kicks out. Kristaps Parker attempts a 3Pt. Contested by James Cunningham (5.0 feet, MAN). KRISTAPS PARKER MAKES IT! Assist: Jarrett Sabonis
Score: 13-15

[05:44] Team_020 possession (Score: 13-15)
Jarrett McCollum attempts a Midrange. Contested by Tyler Barrett (3.5 feet, MAN). Jarrett McCollum misses. Offensive rebound by Bam Leonard! Bam Leonard puts it back in!
Score: 15-15

[05:31] Team_042 possession (Score: 15-15)
Dejounte Butler throws a bad pass out of bounds! TURNOVER! (dead ball)

[05:20] Team_020 possession (Score: 15-15)
Trae Curry drives, picks up Cade Dosunmu. Help arrives from Tyler Barrett! Trae Curry attempts a Dunk. Contested by Tyler Barrett (4.4 feet, ZONE). TRAE CURRY MAKES IT!
Score: 17-15

[05:05] Team_042 possession (Score: 17-15)
Kristaps Parker attempts a 3Pt. Contested by James Cunningham (4.9 feet, MAN). Kristaps Parker misses. Offensive rebound by Dejounte Butler! Dejounte Butler puts it back in!
Score: 17-17

[04:48] Team_020 possession (Score: 17-17)
FOUL! Reach-in foul on Cade Dosunmu during the drive. [Team fouls: 3] No free throws, side out. (Cade Dosunmu: 2 personal fouls)

[04:33] Team_020 possession (Score: 17-17)
FOUL! Shooting foul on Kristaps Parker. James Cunningham to the line for 2 free throws. [Team fouls: 4] (Kristaps Parker: 1 personal fouls)   FT 1/2: MISS   FT 2/2: GOOD James Cunningham makes 1/2 from the line.
Score: 18-17

[04:22] Team_042 possession (Score: 18-17)
Kristaps Parker throws a bad pass out of bounds! TURNOVER! (dead ball)

[04:07] Team_020 possession (Score: 18-17)
James Cunningham attempts a 3Pt. Contested by Tyler Barrett (3.8 feet, ZONE). James Cunningham misses. Offensive rebound by Bam Leonard! Bam Leonard's putback is no good. Offensive rebound by Trae Curry! Trae Curry kicks it out.

[03:51] Team_020 possession (Score: 18-17)
Jarrett McCollum attempts a 3Pt. Contested by Dejounte Butler (3.8 feet, ZONE). JARRETT MCCOLLUM MAKES IT! Assist: Trae Curry
Score: 21-17

[03:35] Team_042 possession (Score: 21-17)
Cade Dosunmu drives and kicks out. Tyler Barrett attempts a 3Pt. Contested by Jarrett McCollum (4.5 feet, MAN). TYLER BARRETT MAKES IT! Assist: Kristaps Parker
Score: 21-20

[03:16] Team_020 possession (Score: 21-20)
Trae Curry attempts a Layup. Contested by Cade Dosunmu (4.5 feet, MAN). TRAE CURRY MAKES IT!
Score: 23-20

[03:02] Team_042 possession (Score: 23-20)
Dejounte Butler attempts a 3Pt. Contested by Bam Leonard (2.8 feet, MAN). DEJOUNTE BUTLER MAKES IT! Assist: Cade Dosunmu
Score: 23-23

[02:44] Team_020 possession (Score: 23-23)
Terry Simons attempts a Midrange. Contested by Jarrett Sabonis (4.7 feet, MAN). Terry Simons misses. Offensive rebound by Bam Leonard! Bam Leonard's putback is no good. Rebound secured by Cade Dosunmu.

[02:32] Team_042 possession (Score: 23-23)
Cade Dosunmu makes the Layup and draws the foul on Jarrett McCollum! And-1! Cade Dosunmu to the line for 1. [Team fouls: 2] (Jarrett McCollum: 1 personal fouls)   FT 1/1: MISS Cade Dosunmu makes 0/1 from the line. Rebound secured by Trae Curry.
Score: 23-25

[02:19] Team_020 possession (Score: 23-25)
Jarrett McCollum drives to the basket... Jarrett McCollum loses control! Ball rolls out of bounds! TURNOVER! (dead ball)

[02:19] Substitution (Team_020): Jarrett McCollum OUT → Franz Doncic IN (stamina_rule2)

[02:19] Substitution (Team_020): James Cunningham OUT → Stephen Parker IN (stamina_rule2)

[02:19] Substitution (Team_020): Terry Simons OUT → Victor Holiday IN (stamina_rule2)

[02:19] Substitution (Team_020): Bam Leonard OUT → Cole Barnes IN (stamina_rule2)

[02:19] Substitution (Team_020): Trae Curry OUT → Miles Siakam IN (stamina_rule2)

[02:19] Substitution (Team_042): Tyler Barrett OUT → Khris George IN (stamina_rule2)

[02:19] Substitution (Team_042): Kristaps Parker OUT → Isaiah Randle IN (stamina_rule2)

[02:19] Substitution (Team_042): Jarrett Sabonis OUT → Gary Jackson IN (stamina_rule2)

[02:19] Substitution (Team_042): Dejounte Butler OUT → Allen Towns IN (stamina_rule2)

[02:19] Substitution (Team_042): Cade Dosunmu OUT → Lamelo Stewart IN (stamina_rule2)

[02:06] Team_042 possession (Score: 23-25)
Gary Jackson attempts a 3Pt. Contested by Victor Holiday (4.2 feet, MAN). Gary Jackson misses. Rebound secured by Victor Holiday.

[01:52] Team_020 possession (Score: 23-25)
Stephen Parker drives and kicks out. Franz Doncic attempts a 3Pt. Contested by Khris George (4.0 feet, MAN). Franz Doncic misses. Rebound secured by Lamelo Stewart.

[01:38] Team_042 possession (Score: 23-25)
Gary Jackson attempts a Midrange. Contested by Victor Holiday (4.2 feet, MAN). Gary Jackson misses. Rebound secured by Cole Barnes.

[01:20] Team_020 possession (Score: 23-25)
Victor Holiday attempts a 3Pt. Contested by Khris George (4.4 feet, ZONE). Victor Holiday misses. Rebound secured by Lamelo Stewart.

[01:03] Team_042 possession (Score: 23-25)
Allen Towns drives to the basket... Allen Towns throws a bad pass! Stolen by Miles Siakam! TURNOVER! (live ball)

[00:50] Team_020 possession (Score: 23-25)
Victor Holiday drives, picks up Allen Towns. Help arrives from Khris George! Victor Holiday attempts a Layup. Contested by Khris George (4.7 feet, ZONE). Victor Holiday misses. FOUL! Loose ball foul on Lamelo Stewart during the rebound battle. [IN THE BONUS! 6 team fouls] Cole Barnes to the line for 2 free throws. (Lamelo Stewart: 1 personal fouls)   FT 1/2: GOOD   FT 2/2: GOOD Cole Barnes makes 2/2 from the line.
Score: 25-25

[00:30] Team_042 possession (Score: 25-25)
Isaiah Randle attempts a 3Pt. Contested by Stephen Parker (5.6 feet, ZONE). Isaiah Randle misses. Rebound secured by Cole Barnes.

[00:16] Team_020 possession (Score: 25-25)
Cole Barnes drives to the basket... Cole Barnes throws a bad pass out of bounds! TURNOVER! (dead ball)

[00:03] Team_042 possession (Score: 25-25)
Allen Towns throws a bad pass out of bounds! TURNOVER! (dead ball)

================================================================================
                              1ST QUARTER COMPLETE                              
================================================================================

1ST QUARTER SCORE: Team_020 25, Team_042 25

BOX SCORE:
================================================================================

Team_020
--------------------------------------------------------------------------------
Player                MIN  PTS  REB  AST  TO      FG   FG%      3P   3P%
--------------------------------------------------------------------------------
Terry Simons           10    7    0    0   0   2/4    50.0     0/0   0.0
Jarrett McCollum       10    6    0    1   0   2/3    66.7     0/0   0.0
Trae Curry             10    4    4    2   0   2/2   100.0     0/0   0.0
James Cunningham       10    4    0    0   0   2/4    50.0     0/0   0.0
Bam Leonard            10    2    3    1   0   1/4    25.0     0/0   0.0
Cole Barnes             2    2    2    0   0   1/1   100.0     0/0   0.0
Victor Holiday          2    0    1    0   0   0/1     0.0     0/0   0.0
Stephen Parker          2    0    0    0   0   0/1     0.0     0/0   0.0

TEAM: FG: 10/20 (50.0%), 3PT: 5/9 (55.6%), REB: 11 (4 off, 7 def), AST: 4, TO: 3
TEAM FOULS: 2


Team_042
--------------------------------------------------------------------------------
Player                MIN  PTS  REB  AST  TO      FG   FG%      3P   3P%
--------------------------------------------------------------------------------
Jarrett Sabonis        10    6    0    2   0   3/3   100.0     0/0   0.0
Dejounte Butler        10    5    5    1   0   2/2   100.0     0/0   0.0
Tyler Barrett          10    5    2    0   0   2/2   100.0     0/0   0.0
Kristaps Parker        10    5    0    2   0   2/2   100.0     0/0   0.0
Cade Dosunmu           10    2    3    2   0   1/5    20.0     0/0   0.0
Gary Jackson            2    0    0    0   0   0/2     0.0     0/0   0.0
Lamelo Stewart          2    0    2    0   0   0/0     0.0     0/0   0.0
Isaiah Randle           2    0    0    0   0   0/1     0.0     0/0   0.0

TEAM: FG: 10/17 (58.8%), 3PT: 3/6 (50.0%), REB: 11 (2 off, 9 def), AST: 7, TO: 6
TEAM FOULS: 6 [Team_020 in BONUS]

================================================================================

================================================================================
                       2ND QUARTER - Team_020 vs Team_042                       
================================================================================

[12:00] Team_020 possession (Score: 25-25)
Bam Leonard commits a violation (traveling/carry)! TURNOVER! (dead ball)

[11:50] Team_042 possession (Score: 25-25)
Tyler Barrett attempts a Midrange. BLOCKED BY BAM LEONARD! Ball is loose! Rebound secured by Bam Leonard.

[11:34] Team_020 possession (Score: 25-25)
Trae Curry attempts a 3Pt. Contested by Tyler Barrett (3.8 feet, ZONE). Trae Curry misses. Offensive rebound by Bam Leonard! Bam Leonard puts it back in!
Score: 27-25

[11:23] Team_042 possession (Score: 27-25)
Cade Dosunmu attempts a 3Pt. Contested by Bam Leonard (2.7 feet, MAN). Cade Dosunmu misses. Rebound secured by Trae Curry.

[11:09] Team_020 possession (Score: 27-25)
FOUL! Reach-in foul on Cade Dosunmu during the drive. [Team fouls: 1] No free throws, side out. (Cade Dosunmu: 1 personal fouls)

[10:56] Team_020 possession (Score: 27-25)
Bam Leonard attempts a 3Pt. Contested by Kristaps Parker (5.4 feet, ZONE). Bam Leonard misses. Rebound secured by Dejounte Butler.

[10:40] Team_042 possession (Score: 27-25)
Jarrett Sabonis drives to the basket... Jarrett Sabonis loses the ball! Stripped by Terry Simons! TURNOVER! (live ball)

[10:23] Team_020 possession (Score: 27-25)
FOUL! Offensive foul on Bam Leonard! Dejounte Butler drew the charge! [Team fouls: 1] (Bam Leonard: 1 personal fouls) TURNOVER! (dead ball)

[10:09] Team_042 possession (Score: 27-25)
Kristaps Parker drives to the basket... Kristaps Parker commits a violation (traveling/carry)! TURNOVER! (dead ball)

[09:55] Team_020 possession (Score: 27-25)
Terry Simons drives and kicks out. Terry Simons attempts a 3Pt. Contested by Jarrett Sabonis (4.1 feet, MAN). Terry Simons misses. Offensive rebound by Bam Leonard! Bam Leonard's putback is no good. Rebound secured by Dejounte Butler.

[09:41] Team_042 possession (Score: 27-25)
Dejounte Butler attempts a 3Pt. Contested by Bam Leonard (2.9 feet, MAN). Dejounte Butler misses. Rebound secured by Bam Leonard.

[09:29] Team_020 possession (Score: 27-25)
FOUL! Shooting foul on Tyler Barrett. Terry Simons to the line for 2 free throws. [Team fouls: 2] (Tyler Barrett: 1 personal fouls)   FT 1/2: GOOD   FT 2/2: GOOD Terry Simons makes 2/2 from the line.
Score: 29-25

[09:18] Team_042 possession (Score: 29-25)
Dejounte Butler attempts a 3Pt. Contested by Bam Leonard (2.9 feet, MAN). DEJOUNTE BUTLER MAKES IT! Assist: Kristaps Parker
Score: 29-28

[09:01] Team_020 possession (Score: 29-28)
Terry Simons attempts a Midrange. Contested by Cade Dosunmu (4.9 feet, ZONE). TERRY SIMONS MAKES IT!
Score: 31-28

[08:46] Team_042 possession (Score: 31-28)
FOUL! Shooting foul on Trae Curry. Cade Dosunmu to the line for 2 free throws. [Team fouls: 2] (Trae Curry: 1 personal fouls)   FT 1/2: GOOD   FT 2/2: GOOD Cade Dosunmu makes 2/2 from the line.
Score: 31-30

[08:28] Team_020 possession (Score: 31-30)
Trae Curry drives, Cade Dosunmu stays with him. Trae Curry attempts a Dunk. Contested by Cade Dosunmu (4.7 feet, ZONE). Trae Curry misses. Rebound secured by Dejounte Butler.

[08:16] Team_042 possession (Score: 31-30)
FOUL! Reach-in foul on James Cunningham during the drive. [Team fouls: 3] No free throws, side out. (James Cunningham: 1 personal fouls)

[07:57] Team_042 possession (Score: 31-30)
Cade Dosunmu drives to the basket... Cade Dosunmu throws a bad pass! Stolen by Bam Leonard! TURNOVER! (live ball)

[07:41] Team_020 possession (Score: 31-30)
Bam Leonard attempts a Layup. Contested by Cade Dosunmu (4.7 feet, ZONE). Bam Leonard misses. Rebound secured by Cade Dosunmu.

[07:26] Team_042 possession (Score: 31-30)
Cade Dosunmu attempts a Midrange. Contested by Terry Simons (4.9 feet, ZONE). Cade Dosunmu misses. Rebound secured by Bam Leonard.

[07:14] Team_020 possession (Score: 31-30)
FOUL! Reach-in foul on Dejounte Butler during the drive. [Team fouls: 3] No free throws, side out. (Dejounte Butler: 1 personal fouls)

[06:59] Team_020 possession (Score: 31-30)
James Cunningham attempts a 3Pt. Contested by Kristaps Parker (5.7 feet, MAN). JAMES CUNNINGHAM MAKES IT! Assist: Jarrett McCollum
Score: 34-30

[06:47] Team_042 possession (Score: 34-30)
Cade Dosunmu commits a violation (traveling/carry)! TURNOVER! (dead ball)

[06:47] Substitution (Team_020): Jarrett McCollum OUT → Franz Doncic IN (stamina_rule2)

[06:47] Substitution (Team_020): James Cunningham OUT → Stephen Parker IN (stamina_rule2)

[06:47] Substitution (Team_020): Terry Simons OUT → Victor Holiday IN (stamina_rule2)

[06:47] Substitution (Team_020): Bam Leonard OUT → Cole Barnes IN (stamina_rule2)

[06:47] Substitution (Team_020): Trae Curry OUT → Miles Siakam IN (stamina_rule2)

[06:47] Substitution (Team_042): Tyler Barrett OUT → Khris George IN (stamina_rule2)

[06:47] Substitution (Team_042): Kristaps Parker OUT → Isaiah Randle IN (stamina_rule2)

[06:47] Substitution (Team_042): Jarrett Sabonis OUT → Gary Jackson IN (stamina_rule2)

[06:47] Substitution (Team_042): Dejounte Butler OUT → Allen Towns IN (stamina_rule2)

[06:47] Substitution (Team_042): Cade Dosunmu OUT → Lamelo Stewart IN (stamina_rule2)

[06:34] Team_020 possession (Score: 34-30)
FOUL! Reach-in foul on Isaiah Randle during the drive. [Team fouls: 4] No free throws, side out. (Isaiah Randle: 1 personal fouls)

[06:24] Team_020 possession (Score: 34-30)
Cole Barnes attempts a Midrange. Contested by Khris George (4.0 feet, ZONE). Cole Barnes misses. Rebound secured by Gary Jackson.

[06:09] Team_042 possession (Score: 34-30)
FOUL! Shooting foul on Victor Holiday. Allen Towns to the line for 2 free throws. [Team fouls: 4] (Victor Holiday: 1 personal fouls)   FT 1/2: GOOD   FT 2/2: MISS Allen Towns makes 1/2 from the line. Rebound secured by Miles Siakam.
Score: 34-31

[05:55] Team_020 possession (Score: 34-31)
Miles Siakam attempts a 3Pt. Contested by Lamelo Stewart (4.4 feet, MAN). Miles Siakam misses. Rebound secured by Lamelo Stewart.

[05:44] Team_042 possession (Score: 34-31)
Allen Towns drives and kicks out. Gary Jackson attempts a Midrange. Contested by Victor Holiday (4.2 feet, ZONE). Gary Jackson misses. Rebound secured by Miles Siakam.

[05:28] Team_020 possession (Score: 34-31)
Cole Barnes drives to the basket... Cole Barnes loses the ball! Stripped by Allen Towns! TURNOVER! (live ball)

[05:15] Team_042 possession (Score: 34-31)
Lamelo Stewart throws a bad pass out of bounds! TURNOVER! (dead ball)

[05:02] Team_020 possession (Score: 34-31)
Victor Holiday drives and kicks out. Franz Doncic attempts a 3Pt. Contested by Khris George (4.0 feet, MAN). Franz Doncic misses. Offensive rebound by Miles Siakam! Miles Siakam kicks it out.

[04:49] Team_020 possession (Score: 34-31)
Cole Barnes attempts a Layup. Contested by Allen Towns (4.4 feet, MAN). COLE BARNES MAKES IT! Assist: Stephen Parker
Score: 36-31

[04:35] Team_042 possession (Score: 36-31)
FOUL! Holding foul on Cole Barnes. [IN THE BONUS! 5 team fouls] Allen Towns to the line for 2 free throws. (Cole Barnes: 1 personal fouls)   FT 1/2: GOOD   FT 2/2: GOOD Allen Towns makes 2/2 from the line.
Score: 36-33

[04:20] Team_020 possession (Score: 36-33)
Victor Holiday attempts a Layup. Contested by Allen Towns (4.7 feet, ZONE). VICTOR HOLIDAY MAKES IT! Assist: Miles Siakam
Score: 38-33

[04:05] Team_042 possession (Score: 38-33)
Allen Towns throws a bad pass! Stolen by Cole Barnes! TURNOVER! (live ball)

[03:51] Team_020 possession (Score: 38-33)
Victor Holiday drives, picks up Gary Jackson. Help arrives from Khris George! Victor Holiday attempts a Layup. Contested by Khris George (5.0 feet, MAN). VICTOR HOLIDAY MAKES IT! Assist: Franz Doncic
Score: 40-33

[03:37] Team_042 possession (Score: 40-33)
Khris George drives, Franz Doncic stays with him. Khris George attempts a Dunk. Contested by Franz Doncic (4.6 feet, MAN). Khris George misses. Rebound secured by Cole Barnes.

[03:24] Team_020 possession (Score: 40-33)
Stephen Parker attempts a 3Pt. Contested by Isaiah Randle (5.2 feet, MAN). Stephen Parker misses. Rebound secured by Lamelo Stewart.

[03:11] Team_042 possession (Score: 40-33)
Lamelo Stewart attempts a Midrange. BLOCKED BY VICTOR HOLIDAY! Ball is loose! Offensive rebound by Lamelo Stewart! Lamelo Stewart kicks it out.

[02:57] Team_042 possession (Score: 40-33)
Allen Towns drives, picks up Miles Siakam. Help arrives from Franz Doncic! Allen Towns attempts a Layup. Contested by Franz Doncic (4.5 feet, ZONE). ALLEN TOWNS MAKES IT! Assist: Isaiah Randle
Score: 40-35

[02:43] Team_020 possession (Score: 40-35)
Cole Barnes attempts a Midrange. Contested by Isaiah Randle (5.2 feet, ZONE). Cole Barnes misses. Offensive rebound by Cole Barnes! Cole Barnes kicks it out.

[02:28] Team_020 possession (Score: 40-35)
Franz Doncic attempts a Layup. BLOCKED BY GARY JACKSON! Ball deflects out of bounds off Franz Doncic.

[02:12] Team_042 possession (Score: 40-35)
Khris George attempts a Layup. BLOCKED BY MILES SIAKAM! Ball is loose! Rebound secured by Miles Siakam.

[01:56] Team_020 possession (Score: 40-35)
Franz Doncic attempts a Midrange. Contested by Isaiah Randle (4.7 feet, ZONE). Franz Doncic misses. Offensive rebound by Miles Siakam! Miles Siakam kicks it out.

[01:43] Team_020 possession (Score: 40-35)
Franz Doncic makes the 3Pt and draws the foul on Khris George! And-1! Franz Doncic to the line for 1. [BONUS: 5 team fouls] (Khris George: 1 personal fouls)   FT 1/1: GOOD Franz Doncic makes 1/1 from the line.
Score: 44-35

[01:29] Team_042 possession (Score: 44-35)
Gary Jackson drives to the basket... Gary Jackson throws a bad pass! Stolen by Victor Holiday! TURNOVER! (live ball)

[01:17] Team_020 possession (Score: 44-35)
Stephen Parker attempts a Midrange. Contested by Isaiah Randle (5.3 feet, MAN). Stephen Parker misses. FOUL! Loose ball foul on Gary Jackson during the rebound battle. [IN THE BONUS! 6 team fouls] Cole Barnes to the line for 2 free throws. (Gary Jackson: 1 personal fouls)   FT 1/2: GOOD   FT 2/2: MISS Cole Barnes makes 1/2 from the line. Rebound secured by Lamelo Stewart.
Score: 45-35

[01:03] Team_042 possession (Score: 45-35)
Gary Jackson makes the 3Pt and draws the foul on Stephen Parker! And-1! Gary Jackson to the line for 1. [BONUS: 6 team fouls] (Stephen Parker: 1 personal fouls)   FT 1/1: GOOD Gary Jackson makes 1/1 from the line.
Score: 45-39

[00:53] Team_020 possession (Score: 45-39)
Miles Siakam attempts a Layup. Contested by Lamelo Stewart (4.4 feet, MAN). Miles Siakam misses. Rebound secured by Allen Towns.

[00:42] Team_042 possession (Score: 45-39)
Khris George attempts a 3Pt. Contested by Franz Doncic (4.7 feet, MAN). Khris George misses. Rebound secured by Victor Holiday.

[00:28] Team_020 possession (Score: 45-39)
Victor Holiday attempts a 3Pt. Contested by Khris George (4.5 feet, ZONE). Victor Holiday misses. Rebound secured by Allen Towns.

[00:15] Team_042 possession (Score: 45-39)
Lamelo Stewart drives and kicks out. Isaiah Randle attempts a 3Pt. Contested by Stephen Parker (5.5 feet, MAN). Isaiah Randle misses. Rebound secured by Victor Holiday.

[00:05] Team_020 possession (Score: 45-39)
Cole Barnes attempts a Midrange. Contested by Allen Towns (4.4 feet, ZONE). Cole Barnes misses. Offensive rebound by Miles Siakam! Miles Siakam kicks it out.

================================================================================
                              2ND QUARTER COMPLETE                              
================================================================================

2ND QUARTER SCORE: Team_020 20, Team_042 14

BOX SCORE:
================================================================================

Team_020
--------------------------------------------------------------------------------
Player                MIN  PTS  REB  AST  TO      FG   FG%      3P   3P%
--------------------------------------------------------------------------------
Terry Simons           15    4    0    0   0   2/3    66.7     0/0   0.0
Victor Holiday          9    4    2    0   0   2/3    66.7     0/0   0.0
Franz Doncic            9    4    0    1   0   1/2    50.0     0/0   0.0
James Cunningham       15    3    0    0   0   1/1   100.0     0/0   0.0
Bam Leonard            15    2    4    0   0   1/3    33.3     0/0   0.0
Cole Barnes             9    2    2    0   0   1/2    50.0     0/0   0.0
Trae Curry             15    0    1    0   0   0/1     0.0     0/0   0.0
Jarrett McCollum       15    0    0    1   0   0/0     0.0     0/0   0.0
Miles Siakam            9    0    6    1   0   0/2     0.0     0/0   0.0
Stephen Parker          9    0    0    1   0   0/2     0.0     0/0   0.0

TEAM: FG: 8/19 (42.1%), 3PT: 3/7 (42.9%), REB: 17 (7 off, 10 def), AST: 4, TO: 3
TEAM FOULS: 6 [Team_042 in BONUS]


Team_042
--------------------------------------------------------------------------------
Player                MIN  PTS  REB  AST  TO      FG   FG%      3P   3P%
--------------------------------------------------------------------------------
Gary Jackson            9    4    1    0   0   1/1   100.0     0/0   0.0
Allen Towns             9    4    2    0   0   2/4    50.0     0/0   0.0
Dejounte Butler        15    3    3    0   0   1/2    50.0     0/0   0.0
Cade Dosunmu           15    2    1    0   0   1/3    33.3     0/0   0.0
Tyler Barrett          15    0    0    0   0   0/1     0.0     0/0   0.0
Kristaps Parker        15    0    0    1   0   0/0     0.0     0/0   0.0
Lamelo Stewart          9    0    4    0   0   0/1     0.0     0/0   0.0
Khris George            9    0    0    0   0   0/3     0.0     0/0   0.0
Isaiah Randle           9    0    0    1   0   0/0     0.0     0/0   0.0

TEAM: FG: 5/15 (33.3%), 3PT: 2/5 (40.0%), REB: 9 (1 off, 8 def), AST: 2, TO: 7
TEAM FOULS: 6 [Team_020 in BONUS]

================================================================================

================================================================================
                       3RD QUARTER - Team_020 vs Team_042                       
================================================================================

[12:00] Team_020 possession (Score: 45-39)
Jarrett McCollum attempts a 3Pt. Contested by Tyler Barrett (3.5 feet, MAN). Jarrett McCollum misses. Offensive rebound by Trae Curry! Trae Curry puts it back in!
Score: 47-39

[11:46] Team_042 possession (Score: 47-39)
Tyler Barrett attempts a Midrange. Contested by Bam Leonard (2.8 feet, ZONE). Tyler Barrett misses. Rebound secured by Terry Simons.

[11:36] Team_020 possession (Score: 47-39)
Terry Simons drives to the basket... Terry Simons loses the ball! Stripped by Cade Dosunmu! TURNOVER! (live ball)

[11:18] Team_042 possession (Score: 47-39)
Kristaps Parker attempts a 3Pt. Contested by Bam Leonard (2.2 feet, ZONE). Kristaps Parker misses. Rebound secured by Bam Leonard.

[11:04] Team_020 possession (Score: 47-39)
James Cunningham attempts a 3Pt. Contested by Tyler Barrett (3.7 feet, ZONE). JAMES CUNNINGHAM MAKES IT! Assist: Terry Simons
Score: 50-39

[10:49] Team_042 possession (Score: 50-39)
Tyler Barrett attempts a 3Pt. Contested by Bam Leonard (2.8 feet, ZONE). Tyler Barrett misses. Offensive rebound by Dejounte Butler! Dejounte Butler's putback is no good. Rebound secured by Bam Leonard.

[10:32] Team_020 possession (Score: 50-39)
Terry Simons makes the Dunk and draws the foul on Tyler Barrett! And-1! Terry Simons to the line for 1. [Team fouls: 1] (Tyler Barrett: 1 personal fouls)   FT 1/1: GOOD Terry Simons makes 1/1 from the line.
Score: 53-39

[10:21] Team_042 possession (Score: 53-39)
Dejounte Butler attempts a Layup. BLOCKED BY TRAE CURRY! Ball is loose! Rebound secured by Trae Curry.

[10:08] Team_020 possession (Score: 53-39)
Terry Simons attempts a 3Pt. Contested by Jarrett Sabonis (4.5 feet, MAN). Terry Simons misses. Rebound secured by Dejounte Butler.

[09:53] Team_042 possession (Score: 53-39)
Jarrett Sabonis attempts a Midrange. Contested by Terry Simons (4.6 feet, ZONE). JARRETT SABONIS MAKES IT! Assist: Tyler Barrett
Score: 53-41

[09:39] Team_020 possession (Score: 53-41)
Trae Curry attempts a Layup. Contested by Cade Dosunmu (4.3 feet, MAN). TRAE CURRY MAKES IT!
Score: 55-41

[09:28] Team_042 possession (Score: 55-41)
Jarrett Sabonis drives and kicks out. Cade Dosunmu attempts a 3Pt. Contested by Bam Leonard (2.3 feet, ZONE). Cade Dosunmu misses. Rebound secured by Terry Simons.

[09:17] Team_020 possession (Score: 55-41)
Bam Leonard attempts a Midrange. Contested by Dejounte Butler (3.9 feet, MAN). BAM LEONARD MAKES IT! Assist: Terry Simons
Score: 57-41

[09:04] Team_042 possession (Score: 57-41)
Jarrett Sabonis throws a bad pass out of bounds! TURNOVER! (dead ball)

[08:53] Team_020 possession (Score: 57-41)
Jarrett McCollum attempts a 3Pt. Contested by Tyler Barrett (3.5 feet, MAN). JARRETT MCCOLLUM MAKES IT! Assist: Bam Leonard
Score: 60-41

[08:36] Team_042 possession (Score: 60-41)
Jarrett Sabonis attempts a 3Pt. Contested by Bam Leonard (2.7 feet, ZONE). Jarrett Sabonis misses. Rebound secured by Bam Leonard.

[08:18] Team_020 possession (Score: 60-41)
FOUL! Offensive foul on Bam Leonard! Dejounte Butler drew the charge! [Team fouls: 1] (Bam Leonard: 1 personal fouls) TURNOVER! (dead ball)

[08:04] Team_042 possession (Score: 60-41)
Dejounte Butler attempts a 3Pt. Contested by Bam Leonard (2.5 feet, ZONE). Dejounte Butler misses. Rebound secured by Terry Simons.

[07:52] Team_020 possession (Score: 60-41)
Bam Leonard attempts a Midrange. Contested by Jarrett Sabonis (4.2 feet, ZONE). Bam Leonard misses. FOUL! Loose ball foul on Tyler Barrett during the rebound battle. [Team fouls: 2] No free throws, side out. (Tyler Barrett: 2 personal fouls)

[07:37] Team_020 possession (Score: 60-41)
Terry Simons attempts a Midrange. Contested by Kristaps Parker (5.6 feet, ZONE). TERRY SIMONS MAKES IT!
Score: 62-41

[07:23] Team_042 possession (Score: 62-41)
Cade Dosunmu makes the Layup and draws the foul on Trae Curry! And-1! Cade Dosunmu to the line for 1. [Team fouls: 2] (Trae Curry: 1 personal fouls)   FT 1/1: GOOD Cade Dosunmu makes 1/1 from the line.
Score: 62-44

[07:06] Team_020 possession (Score: 62-44)
Jarrett McCollum attempts a 3Pt. Contested by Tyler Barrett (3.5 feet, MAN). Jarrett McCollum misses. Rebound secured by Dejounte Butler.

[06:52] Team_042 possession (Score: 62-44)
Kristaps Parker drives to the basket... Kristaps Parker throws a bad pass out of bounds! TURNOVER! (dead ball)

[06:34] Team_020 possession (Score: 62-44)
James Cunningham drives to the basket... James Cunningham loses control! Ball rolls out of bounds! TURNOVER! (dead ball)

[06:21] Team_042 possession (Score: 62-44)
Cade Dosunmu attempts a Midrange. Contested by Bam Leonard (2.6 feet, ZONE). Cade Dosunmu misses. Rebound secured by Terry Simons.

[06:10] Team_020 possession (Score: 62-44)
Terry Simons attempts a Midrange. Contested by Jarrett Sabonis (4.5 feet, MAN). TERRY SIMONS MAKES IT! Assist: Bam Leonard
Score: 64-44

[05:59] Team_042 possession (Score: 64-44)
Jarrett Sabonis attempts a 3Pt. Contested by Terry Simons (4.7 feet, MAN). Jarrett Sabonis misses. Rebound secured by Bam Leonard.

[05:49] Team_020 possession (Score: 64-44)
James Cunningham attempts a Midrange. Contested by Kristaps Parker (5.3 feet, MAN). James Cunningham misses. Rebound secured by Dejounte Butler.

[05:35] Team_042 possession (Score: 64-44)
Dejounte Butler attempts a 3Pt. Contested by Bam Leonard (2.6 feet, MAN). Dejounte Butler misses. Rebound secured by Bam Leonard.

[05:23] Team_020 possession (Score: 64-44)
Trae Curry drives to the basket... Trae Curry commits a violation (traveling/carry)! TURNOVER! (dead ball)

[05:13] Team_042 possession (Score: 64-44)
Jarrett Sabonis makes the Layup and draws the foul on Trae Curry! And-1! Jarrett Sabonis to the line for 1. [Team fouls: 3] (Trae Curry: 2 personal fouls)   FT 1/1: GOOD Jarrett Sabonis makes 1/1 from the line.
Score: 64-47

[04:59] Team_020 possession (Score: 64-47)
FOUL! Reach-in foul on Cade Dosunmu during the drive. [Team fouls: 3] No free throws, side out. (Cade Dosunmu: 1 personal fouls)

[04:46] Team_020 possession (Score: 64-47)
FOUL! Holding foul on Dejounte Butler. [Team fouls: 4] No free throws, side out. (Dejounte Butler: 1 personal fouls)

[04:29] Team_020 possession (Score: 64-47)
Terry Simons drives, Cade Dosunmu stays with him. Terry Simons attempts a Layup. Contested by Cade Dosunmu (4.7 feet, ZONE). Terry Simons misses. Offensive rebound by Trae Curry! Trae Curry's putback is no good. Rebound secured by Tyler Barrett.

[04:12] Team_042 possession (Score: 64-47)
Tyler Barrett loses the ball! Stripped by Jarrett McCollum! TURNOVER! (live ball)

[04:00] Team_020 possession (Score: 64-47)
James Cunningham attempts a 3Pt. Contested by Tyler Barrett (3.8 feet, ZONE). James Cunningham misses. Rebound secured by Dejounte Butler.

[03:43] Team_042 possession (Score: 64-47)
Jarrett Sabonis attempts a 3Pt. Contested by Bam Leonard (3.0 feet, ZONE). JARRETT SABONIS MAKES IT! Assist: Dejounte Butler
Score: 64-50

[03:30] Team_020 possession (Score: 64-50)
Bam Leonard attempts a 3Pt. Contested by Tyler Barrett (3.9 feet, ZONE). Bam Leonard misses. Rebound secured by Dejounte Butler.

[03:15] Team_042 possession (Score: 64-50)
Tyler Barrett drives and kicks out. Cade Dosunmu attempts a Midrange. Contested by Bam Leonard (2.6 feet, MAN). CADE DOSUNMU MAKES IT! Assist: Jarrett Sabonis
Score: 64-52

[03:06] Team_020 possession (Score: 64-52)
Trae Curry drives and kicks out. FOUL! Shooting foul on Jarrett Sabonis. Terry Simons to the line for 3 free throws. [BONUS: 5 team fouls] (Jarrett Sabonis: 1 personal fouls)   FT 1/3: GOOD   FT 2/3: GOOD   FT 3/3: GOOD Terry Simons makes 3/3 from the line.
Score: 67-52

[02:55] Team_042 possession (Score: 67-52)
Tyler Barrett drives, picks up Jarrett McCollum. Help arrives from Terry Simons! Tyler Barrett attempts a Dunk. Contested by Terry Simons (5.1 feet, MAN). TYLER BARRETT MAKES IT! Assist: Kristaps Parker
Score: 67-54

[02:42] Team_020 possession (Score: 67-54)
James Cunningham attempts a Midrange. Contested by Kristaps Parker (5.5 feet, MAN). James Cunningham misses. Offensive rebound by Trae Curry! Trae Curry puts it back in!
Score: 69-54

[02:26] Team_042 possession (Score: 69-54)
FOUL! Reach-in foul on Trae Curry during the drive. [Team fouls: 4] No free throws, side out. (Trae Curry: 3 personal fouls)

[02:13] Team_042 possession (Score: 69-54)
FOUL! Reach-in foul on Terry Simons during the drive. [IN THE BONUS! 5 team fouls] Jarrett Sabonis to the line for 2 free throws. (Terry Simons: 1 personal fouls)   FT 1/2: MISS   FT 2/2: GOOD Jarrett Sabonis makes 1/2 from the line.
Score: 69-55

[01:58] Team_020 possession (Score: 69-55)
Bam Leonard attempts a Layup. BLOCKED BY CADE DOSUNMU! Ball deflects out of bounds off Bam Leonard.

[01:45] Team_042 possession (Score: 69-55)
Tyler Barrett attempts a Layup. BLOCKED BY JARRETT MCCOLLUM! Ball is loose! Offensive rebound by Dejounte Butler! Dejounte Butler kicks it out.

[01:32] Team_042 possession (Score: 69-55)
FOUL! Reach-in foul on Jarrett McCollum during the drive. [IN THE BONUS! 6 team fouls] Tyler Barrett to the line for 2 free throws. (Jarrett McCollum: 1 personal fouls)   FT 1/2: MISS   FT 2/2: GOOD Tyler Barrett makes 1/2 from the line.
Score: 69-56

[01:17] Team_020 possession (Score: 69-56)
FOUL! Offensive foul on Terry Simons! Jarrett Sabonis drew the charge! [Team fouls: 7] (Terry Simons: 2 personal fouls) TURNOVER! (dead ball)

[01:04] Team_042 possession (Score: 69-56)
Dejounte Butler drives, Trae Curry stays with him. Dejounte Butler attempts a Layup. Contested by Trae Curry (5.4 feet, ZONE). Dejounte Butler misses. Rebound secured by Terry Simons.

[00:51] Team_020 possession (Score: 69-56)
Terry Simons drives, picks up Jarrett Sabonis. Help arrives from Tyler Barrett! Terry Simons attempts a Layup. Contested by Tyler Barrett (5.0 feet, MAN). TERRY SIMONS MAKES IT! Assist: Trae Curry
Score: 71-56

[00:34] Team_042 possession (Score: 71-56)
Cade Dosunmu attempts a Layup. Contested by Trae Curry (5.4 feet, ZONE). Cade Dosunmu misses. Rebound secured by Terry Simons.

[00:16] Team_020 possession (Score: 71-56)
Trae Curry attempts a Layup. Contested by Cade Dosunmu (5.0 feet, ZONE). Trae Curry misses. Rebound secured by Tyler Barrett.

[00:03] Team_042 possession (Score: 71-56)
Dejounte Butler attempts a Midrange. Contested by Bam Leonard (3.4 feet, MAN). Dejounte Butler misses. Offensive rebound by Dejounte Butler! Dejounte Butler's putback is no good. Offensive rebound by Cade Dosunmu! Cade Dosunmu kicks it out.

================================================================================
                              3RD QUARTER COMPLETE                              
================================================================================

3RD QUARTER SCORE: Team_020 26, Team_042 17

BOX SCORE:
================================================================================

Team_020
--------------------------------------------------------------------------------
Player                MIN  PTS  REB  AST  TO      FG   FG%      3P   3P%
--------------------------------------------------------------------------------
Terry Simons           28   12    6    2   0   5/7    71.4     0/0   0.0
Trae Curry             28    6    3    1   0   3/4    75.0     0/0   0.0
James Cunningham       28    3    0    0   0   1/3    33.3     0/0   0.0
Jarrett McCollum       28    3    0    0   0   1/2    50.0     0/0   0.0
Bam Leonard            28    2    6    2   0   1/3    33.3     0/0   0.0

TEAM: FG: 11/19 (57.9%), 3PT: 3/7 (42.9%), REB: 15 (4 off, 11 def), AST: 5, TO: 5
TEAM FOULS: 7 [Team_042 in BONUS]


Team_042
--------------------------------------------------------------------------------
Player                MIN  PTS  REB  AST  TO      FG   FG%      3P   3P%
--------------------------------------------------------------------------------
Jarrett Sabonis        28    9    0    1   0   4/7    57.1     0/0   0.0
Cade Dosunmu           28    5    1    0   0   2/4    50.0     0/0   0.0
Tyler Barrett          28    3    2    1   0   2/4    50.0     0/0   0.0
Kristaps Parker        28    0    0    1   0   0/1     0.0     0/0   0.0
Dejounte Butler        28    0    6    1   0   0/4     0.0     0/0   0.0

TEAM: FG: 8/20 (40.0%), 3PT: 1/7 (14.3%), REB: 9 (3 off, 6 def), AST: 4, TO: 3
TEAM FOULS: 5 [Team_020 in BONUS]

================================================================================

================================================================================
                       4TH QUARTER - Team_020 vs Team_042                       
================================================================================

[12:00] Team_020 possession (Score: 71-56)
Terry Simons drives, picks up Jarrett Sabonis. Help arrives from Tyler Barrett! Terry Simons attempts a Dunk. Contested by Tyler Barrett (4.8 feet, MAN). TERRY SIMONS MAKES IT!
Score: 73-56

[11:48] Team_042 possession (Score: 73-56)
Kristaps Parker drives, James Cunningham stays with him. Kristaps Parker attempts a Dunk. Contested by James Cunningham (5.2 feet, MAN). Kristaps Parker misses. FOUL! Loose ball foul on Trae Curry during the rebound battle. [Team fouls: 1] No free throws, side out. (Trae Curry: 1 personal fouls)

[11:30] Team_042 possession (Score: 73-56)
FOUL! Reach-in foul on Bam Leonard during the drive. [Team fouls: 2] No free throws, side out. (Bam Leonard: 1 personal fouls)

[11:11] Team_042 possession (Score: 73-56)
Jarrett Sabonis attempts a Layup. Contested by Trae Curry (5.5 feet, ZONE). JARRETT SABONIS MAKES IT! Assist: Kristaps Parker
Score: 73-58

[10:54] Team_020 possession (Score: 73-58)
Bam Leonard drives and kicks out. Terry Simons attempts a 3Pt. Contested by Jarrett Sabonis (4.4 feet, MAN). Terry Simons misses. Rebound secured by Dejounte Butler.

[10:37] Team_042 possession (Score: 73-58)
Kristaps Parker drives and kicks out. Jarrett Sabonis attempts a Midrange. Contested by Bam Leonard (3.1 feet, ZONE). Jarrett Sabonis misses. Offensive rebound by Cade Dosunmu! Cade Dosunmu's putback is no good. Offensive rebound by Cade Dosunmu! Cade Dosunmu kicks it out.

[10:26] Team_042 possession (Score: 73-58)
Cade Dosunmu drives, Bam Leonard stays with him. Cade Dosunmu attempts a Dunk. Contested by Bam Leonard (3.3 feet, ZONE). CADE DOSUNMU MAKES IT!
Score: 73-60

[10:13] Team_020 possession (Score: 73-60)
Bam Leonard throws a bad pass! Stolen by Dejounte Butler! TURNOVER! (live ball)

[09:58] Team_042 possession (Score: 73-60)
FOUL! Holding foul on Terry Simons. [Team fouls: 3] No free throws, side out. (Terry Simons: 1 personal fouls)

[09:42] Team_042 possession (Score: 73-60)
Cade Dosunmu drives to the basket... Cade Dosunmu throws a bad pass out of bounds! TURNOVER! (dead ball)

[09:42] Substitution (Team_020): Jarrett McCollum OUT → Franz Doncic IN (stamina_rule2)

[09:42] Substitution (Team_020): James Cunningham OUT → Stephen Parker IN (stamina_rule2)

[09:42] Substitution (Team_020): Terry Simons OUT → Victor Holiday IN (stamina_rule2)

[09:42] Substitution (Team_020): Bam Leonard OUT → Cole Barnes IN (stamina_rule2)

[09:42] Substitution (Team_020): Trae Curry OUT → Miles Siakam IN (stamina_rule2)

[09:42] Substitution (Team_042): Tyler Barrett OUT → Khris George IN (stamina_rule2)

[09:42] Substitution (Team_042): Kristaps Parker OUT → Isaiah Randle IN (stamina_rule2)

[09:42] Substitution (Team_042): Jarrett Sabonis OUT → Gary Jackson IN (stamina_rule2)

[09:42] Substitution (Team_042): Dejounte Butler OUT → Allen Towns IN (stamina_rule2)

[09:42] Substitution (Team_042): Cade Dosunmu OUT → Lamelo Stewart IN (stamina_rule2)

[09:32] Team_020 possession (Score: 73-60)
FOUL! Holding foul on Khris George. [Team fouls: 1] No free throws, side out. (Khris George: 1 personal fouls)

[09:18] Team_020 possession (Score: 73-60)
Stephen Parker attempts a Layup. BLOCKED BY ALLEN TOWNS! Ball goes out off Allen Towns. Stephen Parker's ball!

[09:04] Team_020 possession (Score: 73-60)
FOUL! Reach-in foul on Allen Towns during the drive. [Team fouls: 2] No free throws, side out. (Allen Towns: 1 personal fouls)

[08:45] Team_020 possession (Score: 73-60)
Franz Doncic drives to the basket... Franz Doncic loses the ball! Stripped by Allen Towns! TURNOVER! (live ball)

[08:32] Team_042 possession (Score: 73-60)
Gary Jackson drives and kicks out. Lamelo Stewart attempts a Midrange. Contested by Miles Siakam (4.0 feet, MAN). LAMELO STEWART MAKES IT! Assist: Gary Jackson
Score: 73-62

[08:21] Team_020 possession (Score: 73-62)
Franz Doncic attempts a 3Pt. Contested by Khris George (3.6 feet, MAN). Franz Doncic misses. Offensive rebound by Cole Barnes! Cole Barnes kicks it out.

[08:07] Team_020 possession (Score: 73-62)
FOUL! Holding foul on Lamelo Stewart. [Team fouls: 3] No free throws, side out. (Lamelo Stewart: 1 personal fouls)

[07:52] Team_020 possession (Score: 73-62)
Franz Doncic attempts a 3Pt. Contested by Khris George (3.6 feet, MAN). Franz Doncic misses. Rebound secured by Gary Jackson.

[07:39] Team_042 possession (Score: 73-62)
Lamelo Stewart drives, Miles Siakam stays with him. Lamelo Stewart attempts a Layup. Contested by Miles Siakam (3.9 feet, MAN). Lamelo Stewart misses. Rebound secured by Cole Barnes.

[07:25] Team_020 possession (Score: 73-62)
Cole Barnes makes the Midrange and draws the foul on Gary Jackson! And-1! Cole Barnes to the line for 1. [Team fouls: 4] (Gary Jackson: 1 personal fouls)   FT 1/1: GOOD Cole Barnes makes 1/1 from the line.
Score: 76-62

[07:10] Team_042 possession (Score: 76-62)
Gary Jackson drives, picks up Miles Siakam. Help arrives from Franz Doncic! Gary Jackson attempts a Dunk. Contested by Franz Doncic (4.0 feet, ZONE). Gary Jackson misses. Rebound secured by Victor Holiday.

[06:56] Team_020 possession (Score: 76-62)
Cole Barnes attempts a Midrange. Contested by Allen Towns (4.4 feet, MAN). Cole Barnes misses. Rebound secured by Lamelo Stewart.

[06:40] Team_042 possession (Score: 76-62)
Lamelo Stewart attempts a 3Pt. Contested by Miles Siakam (3.9 feet, MAN). Lamelo Stewart misses. Rebound secured by Miles Siakam.

[06:21] Team_020 possession (Score: 76-62)
Victor Holiday attempts a 3Pt. Contested by Gary Jackson (5.0 feet, MAN). Victor Holiday misses. Rebound secured by Gary Jackson.

[06:06] Team_042 possession (Score: 76-62)
Lamelo Stewart attempts a Layup. Contested by Miles Siakam (3.9 feet, ZONE). LAMELO STEWART MAKES IT! Assist: Allen Towns
Score: 76-64

[05:55] Team_020 possession (Score: 76-64)
Miles Siakam attempts a 3Pt. Contested by Lamelo Stewart (4.4 feet, MAN). Miles Siakam misses. Rebound secured by Allen Towns.

[05:40] Team_042 possession (Score: 76-64)
Lamelo Stewart attempts a Midrange. Contested by Miles Siakam (3.9 feet, MAN). LAMELO STEWART MAKES IT! Assist: Allen Towns
Score: 76-66

[05:26] Team_020 possession (Score: 76-66)
Cole Barnes drives and kicks out. Miles Siakam attempts a 3Pt. Contested by Khris George (4.0 feet, ZONE). MILES SIAKAM MAKES IT! Assist: Franz Doncic
Score: 79-66

[05:09] Team_042 possession (Score: 79-66)
Allen Towns drives, picks up Cole Barnes. Help arrives from Franz Doncic! Allen Towns attempts a Dunk. Contested by Franz Doncic (5.5 feet, MAN). ALLEN TOWNS MAKES IT!
Score: 79-68

[04:53] Team_020 possession (Score: 79-68)
Stephen Parker attempts a 3Pt. Contested by Khris George (4.1 feet, ZONE). Stephen Parker misses. Rebound secured by Lamelo Stewart.

[04:37] Team_042 possession (Score: 79-68)
Khris George attempts a 3Pt. Wide open! Stephen Parker is 6.1 feet away. [ZONE] Khris George misses. Rebound secured by Miles Siakam.

[04:24] Team_020 possession (Score: 79-68)
Franz Doncic drives, picks up Khris George. Help arrives from Gary Jackson! Franz Doncic attempts a Dunk. Contested by Gary Jackson (3.6 feet, MAN). Franz Doncic misses. Rebound secured by Lamelo Stewart.

[04:12] Team_042 possession (Score: 79-68)
Gary Jackson drives and kicks out. FOUL! Shooting foul on Victor Holiday. Gary Jackson to the line for 2 free throws. [Team fouls: 4] (Victor Holiday: 1 personal fouls)   FT 1/2: MISS   FT 2/2: GOOD Gary Jackson makes 1/2 from the line.
Score: 79-69

[04:00] Team_020 possession (Score: 79-69)
FOUL! Reach-in foul on Lamelo Stewart during the drive. [IN THE BONUS! 5 team fouls] Miles Siakam to the line for 2 free throws. (Lamelo Stewart: 2 personal fouls)   FT 1/2: GOOD   FT 2/2: MISS Miles Siakam makes 1/2 from the line. Rebound secured by Lamelo Stewart.
Score: 80-69

[03:49] Team_042 possession (Score: 80-69)
Lamelo Stewart attempts a Layup. Contested by Miles Siakam (3.9 feet, ZONE). LAMELO STEWART MAKES IT! Assist: Isaiah Randle
Score: 80-71

[03:36] Team_020 possession (Score: 80-71)
Cole Barnes attempts a Midrange. Contested by Allen Towns (4.4 feet, MAN). COLE BARNES MAKES IT!
Score: 82-71

[03:25] Team_042 possession (Score: 82-71)
Lamelo Stewart drives to the basket... FOUL! Offensive foul on Lamelo Stewart! Miles Siakam drew the charge! [Team fouls: 6] (Lamelo Stewart: 3 personal fouls) TURNOVER! (dead ball)

[03:10] Team_020 possession (Score: 82-71)
FOUL! Shooting foul on Allen Towns. Miles Siakam to the line for 2 free throws. [BONUS: 7 team fouls] (Allen Towns: 2 personal fouls)   FT 1/2: MISS   FT 2/2: GOOD Miles Siakam makes 1/2 from the line.
Score: 83-71

[02:56] Team_042 possession (Score: 83-71)
Khris George throws a bad pass out of bounds! TURNOVER! (dead ball)

[02:42] Team_020 possession (Score: 83-71)
Victor Holiday attempts a 3Pt. Contested by Khris George (4.5 feet, ZONE). Victor Holiday misses. Rebound secured by Gary Jackson.

[02:28] Team_042 possession (Score: 83-71)
Allen Towns attempts a 3Pt. Contested by Stephen Parker (6.0 feet, ZONE). Allen Towns misses. Rebound secured by Victor Holiday.

[02:11] Team_020 possession (Score: 83-71)
Franz Doncic attempts a Layup. Contested by Khris George (3.7 feet, MAN). FRANZ DONCIC MAKES IT!
Score: 85-71

[01:55] Team_042 possession (Score: 85-71)
Gary Jackson drives to the basket... Gary Jackson throws a bad pass out of bounds! TURNOVER! (dead ball)

[01:42] Team_020 possession (Score: 85-71)
Miles Siakam attempts a Midrange. Contested by Lamelo Stewart (4.5 feet, MAN). Miles Siakam misses. Rebound secured by Gary Jackson.

[01:23] Team_042 possession (Score: 85-71)
FOUL! Reach-in foul on Victor Holiday during the drive. [IN THE BONUS! 5 team fouls] Gary Jackson to the line for 2 free throws. (Victor Holiday: 2 personal fouls)   FT 1/2: GOOD   FT 2/2: GOOD Gary Jackson makes 2/2 from the line.
Score: 85-73

[01:14] Team_020 possession (Score: 85-73)
Miles Siakam attempts a Layup. Contested by Lamelo Stewart (4.5 feet, MAN). Miles Siakam misses. Rebound secured by Gary Jackson.

[00:56] Team_042 possession (Score: 85-73)
Allen Towns attempts a 3Pt. Contested by Cole Barnes (5.6 feet, MAN). ALLEN TOWNS MAKES IT! Assist: Gary Jackson
Score: 85-76

[00:39] Team_020 possession (Score: 85-76)
Victor Holiday attempts a Midrange. Contested by Gary Jackson (5.2 feet, MAN). Victor Holiday misses. Rebound secured by Gary Jackson.

[00:25] Team_042 possession (Score: 85-76)
Khris George attempts a 3Pt. Contested by Victor Holiday (5.1 feet, ZONE). Khris George misses. Rebound secured by Victor Holiday.

[00:10] Team_020 possession (Score: 85-76)
FOUL! Offensive foul on Stephen Parker! Isaiah Randle drew the charge! [Team fouls: 6] (Stephen Parker: 1 personal fouls) TURNOVER! (dead ball)

================================================================================
                              4TH QUARTER COMPLETE                              
================================================================================

4TH QUARTER SCORE: Team_020 14, Team_042 20

BOX SCORE:
================================================================================

Team_020
--------------------------------------------------------------------------------
Player                MIN  PTS  REB  AST  TO      FG   FG%      3P   3P%
--------------------------------------------------------------------------------
Cole Barnes            19    5    2    0   0   2/3    66.7     0/0   0.0
Miles Siakam           19    4    2    0   0   2/6    33.3     0/0   0.0
Terry Simons           30    2    0    0   0   1/1   100.0     0/0   0.0
Franz Doncic           19    2    0    1   0   1/3    33.3     0/0   0.0
Bam Leonard            30    0    0    0   0   0/1     0.0     0/0   0.0
Victor Holiday         19    0    3    0   0   0/3     0.0     0/0   0.0
Stephen Parker         19    0    0    0   0   0/1     0.0     0/0   0.0

TEAM: FG: 6/18 (33.3%), 3PT: 0/5 (0.0%), REB: 7 (1 off, 6 def), AST: 1, TO: 3
TEAM FOULS: 6 [Team_042 in BONUS]


Team_042
--------------------------------------------------------------------------------
Player                MIN  PTS  REB  AST  TO      FG   FG%      3P   3P%
--------------------------------------------------------------------------------
Lamelo Stewart         19    8    4    0   0   4/6    66.7     0/0   0.0
Allen Towns            19    5    1    2   0   2/3    66.7     0/0   0.0
Gary Jackson           19    3    6    2   0   2/3    66.7     0/0   0.0
Jarrett Sabonis        30    2    0    0   0   1/1   100.0     0/0   0.0
Cade Dosunmu           30    2    1    0   0   1/1   100.0     0/0   0.0
Dejounte Butler        30    0    2    0   0   0/0     0.0     0/0   0.0
Kristaps Parker        30    0    0    1   0   0/0     0.0     0/0   0.0
Khris George           19    0    0    0   0   0/2     0.0     0/0   0.0
Isaiah Randle          19    0    0    1   0   0/0     0.0     0/0   0.0

TEAM: FG: 10/16 (62.5%), 3PT: 1/5 (20.0%), REB: 14 (2 off, 12 def), AST: 6, TO: 4
TEAM FOULS: 7 [Team_020 in BONUS]

================================================================================

================================================================================
                               FULL GAME COMPLETE                               
================================================================================

FINAL SCORE: Team_020 85, Team_042 76

SCORING BY QUARTER:
--------------------------------------------------------------------------------
Team                     Q1     Q2     Q3     Q4    FINAL
--------------------------------------------------------------------------------
Team_020                 25     20     26     14       85
Team_042                 25     14     17     20       76
--------------------------------------------------------------------------------

FULL GAME BOX SCORE:
================================================================================

Team_020
--------------------------------------------------------------------------------
Player                MIN  PTS  REB  AST  TO      FG   FG%      3P   3P%      FT STL BLK
--------------------------------------------------------------------------------
Jarrett McCollum       30    9    0    2   2   5/7    71.4   4/5    80.0   0/0     1   1
James Cunningham       30   10    0    0   3   5/9    55.6   3/5    60.0   1/2     0   0
Terry Simons           30   25    6    2   1   9/14   64.3   2/3    66.7   7/7     1   0
Bam Leonard            30    6   13    3   4   1/9    11.1   0/4     0.0   0/0     1   1
Trae Curry             30   10    8    3   0   5/7    71.4   1/1   100.0   0/0     1   1
Franz Doncic           19    6    0    2   0   2/5    40.0   1/2    50.0   1/1     0   0
Stephen Parker         19    0    0    1   2   0/4     0.0   0/2     0.0   0/0     0   0
Victor Holiday         19    4    6    0   0   3/8    37.5   0/4     0.0   0/0     1   1
Cole Barnes            19    9    6    0   1   4/6    66.7   0/0     0.0   4/5     1   0
Miles Siakam           19    4    8    1   1   1/7    14.3   0/2     0.0   2/4     1   1

TEAM: FG: 35/76 (46.1%), 3PT: 11/28 (39.3%), REB: 50 (16 off, 34 def), AST: 14, TO: 14


Team_042
--------------------------------------------------------------------------------
Player                MIN  PTS  REB  AST  TO      FG   FG%      3P   3P%      FT STL BLK
--------------------------------------------------------------------------------
Tyler Barrett          30    8    4    1   3   4/7    57.1   0/1     0.0   1/2     0   0
Kristaps Parker        30    5    0    5   2   2/3    66.7   1/2    50.0   0/0     0   0
Jarrett Sabonis        30   17    0    3   3   9/12   75.0   1/3    33.3   2/3     0   1
Dejounte Butler        30    8   16    2   2   3/8    37.5   3/6    50.0   0/0     1   0
Cade Dosunmu           30   11    6    2   2   4/12   33.3   0/2     0.0   3/4     1   1
Khris George           19    0    0    0   2   0/5     0.0   0/3     0.0   0/0     0   0
Isaiah Randle          19    0    0    2   0   0/1     0.0   0/1     0.0   0/0     0   0
Gary Jackson           19    7    7    2   1   4/7    57.1   1/2    50.0   4/5     0   1
Allen Towns            19    9    3    2   3   3/6    50.0   1/2    50.0   3/4     2   1
Lamelo Stewart         19    8   10    0   2   3/6    50.0   0/1     0.0   0/0     0   0

TEAM: FG: 33/68 (48.5%), 3PT: 7/23 (30.4%), REB: 43 (8 off, 35 def), AST: 19, TO: 20

================================================================================
