================================================================================
                        FULL GAME - Team_009 vs Team_053                        
================================================================================

================================================================================
                       1ST QUARTER - Team_009 vs Team_053                       
================================================================================

[12:00] Team_009 possession (Score: 0-0)
FOUL! Shooting foul on Kobe Ginobili. Miles Sabonis to the line for 2 free throws. [Team fouls: 1] (Kobe Ginobili: 1 personal fouls)   FT 1/2: GOOD   FT 2/2: GOOD Miles Sabonis makes 2/2 from the line.
Score: 2-0

[11:44] Team_053 possession (Score: 2-0)
Kobe Ginobili drives and kicks out. Kobe Ginobili attempts a Midrange. Contested by Anfernee Anunoby (5.1 feet, ZONE). Kobe Ginobili misses. Rebound secured by Anfernee Anunoby.

[11:24] Team_009 possession (Score: 2-0)
Cole Mitchell drives to the basket... Cole Mitchell throws a bad pass! Stolen by Michael Gasol! TURNOVER! (live ball)

[11:10] Team_053 possession (Score: 2-0)
Kobe Ginobili drives, picks up Miles Sabonis. Help arrives from Desmond Harden! Kobe Ginobili attempts a Dunk. Contested by Desmond Harden (5.2 feet, MAN). Kobe Ginobili misses. Rebound secured by Cole Mitchell.

[10:56] Team_009 possession (Score: 2-0)
Anfernee Anunoby attempts a 3Pt. Contested by Immanuel Curry (4.6 feet, MAN). Anfernee Anunoby misses. Offensive rebound by Kyle Brogdon! Kyle Brogdon puts it back in!
Score: 4-0

[10:44] Team_053 possession (Score: 4-0)
James Murray attempts a 3Pt. Contested by Desmond Harden (5.5 feet, MAN). James Murray misses. Rebound secured by Cole Mitchell.

[10:28] Team_009 possession (Score: 4-0)
Cole Mitchell commits a violation (traveling/carry)! TURNOVER! (dead ball)

[10:15] Team_053 possession (Score: 4-0)
Kobe Ginobili attempts a 3Pt. Contested by Miles Sabonis (5.2 feet, MAN). Kobe Ginobili misses. Offensive rebound by Draymond LaVine! Draymond LaVine kicks it out.

[09:59] Team_053 possession (Score: 4-0)
Michael Gasol attempts a 3Pt. Contested by Cole Mitchell (4.3 feet, MAN). Michael Gasol misses. FOUL! Loose ball foul on Anfernee Anunoby during the rebound battle. [Team fouls: 1] No free throws, side out. (Anfernee Anunoby: 1 personal fouls)

[09:46] Team_053 possession (Score: 4-0)
Draymond LaVine attempts a Layup. Contested by Kyle Brogdon (4.9 feet, MAN). DRAYMOND LAVINE MAKES IT! Assist: Immanuel Curry
Score: 4-2

[09:33] Team_009 possession (Score: 4-2)
Desmond Harden attempts a Layup. BLOCKED BY JAMES MURRAY! Ball is loose! Rebound secured by James Murray.

[09:18] Team_053 possession (Score: 4-2)
James Murray attempts a 3Pt. Contested by Miles Sabonis (5.9 feet, ZONE). JAMES MURRAY MAKES IT!
Score: 4-5

[09:08] Team_009 possession (Score: 4-5)
Cole Mitchell attempts a Layup. Contested by Michael Gasol (3.9 feet, MAN). Cole Mitchell misses. Rebound secured by James Murray.

[08:54] Team_053 possession (Score: 4-5)
Kobe Ginobili drives and kicks out. Michael Gasol attempts a 3Pt. Contested by Cole Mitchell (4.4 feet, MAN). MICHAEL GASOL MAKES IT! Assist: Kobe Ginobili
Score: 4-8

[08:38] Team_009 possession (Score: 4-8)
Cole Mitchell drives and kicks out. Desmond Harden attempts a 3Pt. Contested by Kobe Ginobili (4.1 feet, ZONE). Desmond Harden misses. Rebound secured by Michael Gasol.

[08:21] Team_053 possession (Score: 4-8)
Michael Gasol drives and kicks out. Draymond LaVine attempts a 3Pt. Contested by Miles Sabonis (5.3 feet, ZONE). Draymond LaVine misses. Rebound secured by Anfernee Anunoby.

[08:07] Team_009 possession (Score: 4-8)
Desmond Harden attempts a 3Pt. Contested by Kobe Ginobili (4.1 feet, ZONE). Desmond Harden misses. Offensive rebound by Kyle Brogdon! Kyle Brogdon puts it back in!
Score: 6-8

[07:53] Team_053 possession (Score: 6-8)
Draymond LaVine drives, picks up Kyle Brogdon. Help arrives from Miles Sabonis! Draymond LaVine attempts a Dunk. Contested by Miles Sabonis (4.9 feet, ZONE). DRAYMOND LAVINE MAKES IT! Assist: James Murray
Score: 6-10

[07:37] Team_009 possession (Score: 6-10)
Miles Sabonis drives to the basket... FOUL! Offensive foul on Miles Sabonis! Kobe Ginobili drew the charge! [Team fouls: 2] (Miles Sabonis: 1 personal fouls) TURNOVER! (dead ball)

[07:20] Team_053 possession (Score: 6-10)
Kobe Ginobili attempts a Midrange. Contested by Miles Sabonis (5.2 feet, MAN). Kobe Ginobili misses. Offensive rebound by Michael Gasol! Michael Gasol puts it back in!
Score: 6-12

[07:11] Team_009 possession (Score: 6-12)
Desmond Harden attempts a Midrange. Contested by Kobe Ginobili (4.1 feet, ZONE). DESMOND HARDEN MAKES IT! Assist: Miles Sabonis
Score: 8-12

[06:57] Team_053 possession (Score: 8-12)
James Murray attempts a 3Pt. Contested by Desmond Harden (5.5 feet, MAN). James Murray misses. Rebound secured by Cole Mitchell.

[06:41] Team_009 possession (Score: 8-12)
FOUL! Shooting foul on Kobe Ginobili. Cole Mitchell to the line for 3 free throws. [Team fouls: 2] (Kobe Ginobili: 2 personal fouls)   FT 1/3: GOOD   FT 2/3: GOOD   FT 3/3: GOOD Cole Mitchell makes 3/3 from the line.
Score: 11-12

[06:25] Team_053 possession (Score: 11-12)
Draymond LaVine drives to the basket... Draymond LaVine loses the ball! Stripped by Kyle Brogdon! TURNOVER! (live ball)

[06:11] Team_009 possession (Score: 11-12)
Miles Sabonis attempts a Midrange. Contested by Kobe Ginobili (4.0 feet, MAN). Miles Sabonis misses. Rebound secured by Michael Gasol.

[05:52] Team_053 possession (Score: 11-12)
Immanuel Curry attempts a Layup. Contested by Kyle Brogdon (5.1 feet, ZONE). Immanuel Curry misses. Rebound secured by Kyle Brogdon.

[05:39] Team_009 possession (Score: 11-12)
Desmond Harden drives, picks up James Murray. Help arrives from Immanuel Curry! Desmond Harden attempts a Layup. Contested by Immanuel Curry (4.3 feet, MAN). DESMOND HARDEN MAKES IT!
Score: 13-12

[05:25] Team_053 possession (Score: 13-12)
FOUL! Holding foul on Desmond Harden. [Team fouls: 3] No free throws, side out. (Desmond Harden: 1 personal fouls)

[05:10] Team_053 possession (Score: 13-12)
Michael Gasol drives and kicks out. Kobe Ginobili attempts a 3Pt. Contested by Miles Sabonis (5.3 feet, ZONE). Kobe Ginobili misses. FOUL! Loose ball foul on Kyle Brogdon during the rebound battle. [Team fouls: 4] No free throws, side out. (Kyle Brogdon: 1 personal fouls)

[04:57] Team_053 possession (Score: 13-12)
Immanuel Curry attempts a 3Pt. Contested by Miles Sabonis (5.5 feet, ZONE). Immanuel Curry misses. Rebound secured by Cole Mitchell.

[04:43] Team_009 possession (Score: 13-12)
Cole Mitchell attempts a Midrange. Contested by Michael Gasol (3.9 feet, MAN). Cole Mitchell misses. Rebound secured by Draymond LaVine.

[04:28] Team_053 possession (Score: 13-12)
FOUL! Offensive foul on Immanuel Curry! Anfernee Anunoby drew the charge! [Team fouls: 3] (Immanuel Curry: 1 personal fouls) TURNOVER! (dead ball)

[04:16] Team_009 possession (Score: 13-12)
Miles Sabonis drives to the basket... FOUL! Offensive foul on Miles Sabonis! Kobe Ginobili drew the charge! [Team fouls: 5] (Miles Sabonis: 2 personal fouls) TURNOVER! (dead ball)

[04:03] Team_053 possession (Score: 13-12)
James Murray drives, Kyle Brogdon stays with him. James Murray attempts a Layup. Contested by Kyle Brogdon (5.6 feet, ZONE). JAMES MURRAY MAKES IT! Assist: Immanuel Curry
Score: 13-14

[03:47] Team_009 possession (Score: 13-14)
Kyle Brogdon drives and kicks out. Kyle Brogdon attempts a 3Pt. Contested by Draymond LaVine (4.3 feet, MAN). KYLE BROGDON MAKES IT! Assist: Desmond Harden
Score: 16-14

[03:32] Team_053 possession (Score: 16-14)
James Murray attempts a 3Pt. Contested by Desmond Harden (5.6 feet, MAN). James Murray misses. Rebound secured by Anfernee Anunoby.

[03:17] Team_009 possession (Score: 16-14)
Desmond Harden makes the Layup and draws the foul on Michael Gasol! And-1! Desmond Harden to the line for 1. [Team fouls: 4] (Michael Gasol: 1 personal fouls)   FT 1/1: GOOD Desmond Harden makes 1/1 from the line.
Score: 19-14

[03:04] Team_053 possession (Score: 19-14)
Immanuel Curry attempts a Midrange. Contested by Desmond Harden (5.2 feet, ZONE). Immanuel Curry misses. Offensive rebound by Michael Gasol! Michael Gasol puts it back in!
Score: 19-16

[02:47] Team_009 possession (Score: 19-16)
Kyle Brogdon makes the Layup and draws the foul on James Murray! And-1! Kyle Brogdon to the line for 1. [BONUS: 5 team fouls] (James Murray: 1 personal fouls)   FT 1/1: GOOD Kyle Brogdon makes 1/1 from the line.
Score: 22-16

[02:31] Team_053 possession (Score: 22-16)
FOUL! Reach-in foul on Kyle Brogdon during the drive. [IN THE BONUS! 6 team fouls] Michael Gasol to the line for 2 free throws. (Kyle Brogdon: 2 personal fouls)   FT 1/2: MISS   FT 2/2: GOOD Michael Gasol makes 1/2 from the line.
Score: 22-17

[02:15] Team_009 possession (Score: 22-17)
Cole Mitchell attempts a Midrange. Contested by Immanuel Curry (4.8 feet, ZONE). Cole Mitchell misses. Offensive rebound by Kyle Brogdon! Kyle Brogdon's putback is no good. Rebound secured by Draymond LaVine.

[02:01] Team_053 possession (Score: 22-17)
Michael Gasol attempts a 3Pt. Contested by Cole Mitchell (4.7 feet, MAN). Michael Gasol misses. Rebound secured by Cole Mitchell.

[01:48] Team_009 possession (Score: 22-17)
FOUL! Shooting foul on James Murray. Miles Sabonis to the line for 2 free throws. [BONUS: 6 team fouls] (James Murray: 2 personal fouls)   FT 1/2: GOOD   FT 2/2: GOOD Miles Sabonis makes 2/2 from the line.
Score: 24-17

[01:36] Team_053 possession (Score: 24-17)
FOUL! Shooting foul on Kyle Brogdon. Draymond LaVine to the line for 2 free throws. [BONUS: 7 team fouls] (Kyle Brogdon: 3 personal fouls)   FT 1/2: GOOD   FT 2/2: MISS Draymond LaVine makes 1/2 from the line. Rebound secured by Cole Mitchell.
Score: 24-18

[01:17] Team_009 possession (Score: 24-18)
Anfernee Anunoby attempts a Midrange. Contested by James Murray (4.6 feet, ZONE). Anfernee Anunoby misses. Rebound secured by James Murray.

[01:04] Team_053 possession (Score: 24-18)
Kobe Ginobili attempts a 3Pt. Contested by Miles Sabonis (5.6 feet, ZONE). Kobe Ginobili misses. FOUL! Loose ball foul on Cole Mitchell during the rebound battle. [IN THE BONUS! 8 team fouls] Michael Gasol to the line for 2 free throws. (Cole Mitchell: 1 personal fouls)   FT 1/2: GOOD   FT 2/2: MISS Michael Gasol makes 1/2 from the line. Rebound secured by Cole Mitchell.
Score: 24-19

[00:50] Team_009 possession (Score: 24-19)
Kyle Brogdon drives, Draymond LaVine stays with him. Kyle Brogdon attempts a Dunk. Contested by Draymond LaVine (4.2 feet, MAN). Kyle Brogdon misses. Rebound secured by James Murray.

[00:35] Team_053 possession (Score: 24-19)
Immanuel Curry attempts a 3Pt. Contested by Miles Sabonis (5.8 feet, ZONE). IMMANUEL CURRY MAKES IT! Assist: Michael Gasol
Score: 24-22

[00:18] Team_009 possession (Score: 24-22)
Anfernee Anunoby drives, picks up Immanuel Curry. Help arrives from James Murray! Anfernee Anunoby attempts a Dunk. Contested by James Murray (5.0 feet, MAN). ANFERNEE ANUNOBY MAKES IT! Assist: Cole Mitchell
Score: 26-22

================================================================================
                              1ST QUARTER COMPLETE                              
================================================================================

1ST QUARTER SCORE: Team_009 26, Team_053 22

BOX SCORE:
================================================================================

Team_009
--------------------------------------------------------------------------------
Player                MIN  PTS  REB  AST  TO      FG   FG%      3P   3P%
--------------------------------------------------------------------------------
Kyle Brogdon           12   10    3    0   0   4/5    80.0     0/0   0.0
Desmond Harden         12    7    0    1   0   3/4    75.0     0/0   0.0
Miles Sabonis          12    4    0    1   0   2/3    66.7     0/0   0.0
Cole Mitchell          12    3    7    1   0   1/5    20.0     0/0   0.0
Anfernee Anunoby       12    2    3    0   0   1/2    50.0     0/0   0.0

TEAM: FG: 11/19 (57.9%), 3PT: 3/3 (100.0%), REB: 13 (3 off, 10 def), AST: 3, TO: 4
TEAM FOULS: 8 [Team_053 in BONUS]


Team_053
--------------------------------------------------------------------------------
Player                MIN  PTS  REB  AST  TO      FG   FG%      3P   3P%
--------------------------------------------------------------------------------
Michael Gasol          12    8    5    1   0   4/6    66.7     0/0   0.0
James Murray           12    5    4    1   0   2/5    40.0     0/0   0.0
Draymond LaVine        12    4    4    0   0   2/3    66.7     0/0   0.0
Immanuel Curry         12    3    0    2   0   1/3    33.3     0/0   0.0
Kobe Ginobili          12    0    0    1   0   0/3     0.0     0/0   0.0

TEAM: FG: 9/20 (45.0%), 3PT: 2/8 (25.0%), REB: 13 (6 off, 7 def), AST: 5, TO: 2
TEAM FOULS: 6 [Team_009 in BONUS]

================================================================================

================================================================================
                       2ND QUARTER - Team_009 vs Team_053                       
================================================================================

[12:00] Team_009 possession (Score: 26-22)
Anfernee Anunoby attempts a 3Pt. Contested by Immanuel Curry (4.8 feet, MAN). Anfernee Anunoby misses. Offensive rebound by Cole Mitchell! Cole Mitchell kicks it out.

[11:47] Team_009 possession (Score: 26-22)
Anfernee Anunoby attempts a 3Pt. Contested by Immanuel Curry (4.9 feet, MAN). Anfernee Anunoby misses. Offensive rebound by Kyle Brogdon! Kyle Brogdon's putback is no good. Rebound secured by Michael Gasol.

[11:37] Team_053 possession (Score: 26-22)
Draymond LaVine drives and kicks out. Kobe Ginobili attempts a 3Pt. Contested by Miles Sabonis (5.6 feet, ZONE). KOBE GINOBILI MAKES IT! Assist: Draymond LaVine
Score: 26-25

[11:20] Team_009 possession (Score: 26-25)
Miles Sabonis attempts a 3Pt. Contested by Kobe Ginobili (4.3 feet, ZONE). Miles Sabonis misses. Rebound secured by Michael Gasol.

[11:03] Team_053 possession (Score: 26-25)
Draymond LaVine drives, picks up Kyle Brogdon. Help arrives from Miles Sabonis! Draymond LaVine attempts a Dunk. Contested by Miles Sabonis (5.3 feet, MAN). DRAYMOND LAVINE MAKES IT! Assist: James Murray
Score: 26-27

[10:45] Team_009 possession (Score: 26-27)
Desmond Harden drives and kicks out. Cole Mitchell attempts a 3Pt. Contested by James Murray (4.7 feet, ZONE). Cole Mitchell misses. Rebound secured by Draymond LaVine.

[10:30] Team_053 possession (Score: 26-27)
Immanuel Curry attempts a Layup. Contested by Anfernee Anunoby (5.6 feet, MAN). Immanuel Curry misses. Rebound secured by Anfernee Anunoby.

[10:13] Team_009 possession (Score: 26-27)
Desmond Harden attempts a 3Pt. Contested by James Murray (4.7 feet, MAN). Desmond Harden misses. Rebound secured by Michael Gasol.

[09:57] Team_053 possession (Score: 26-27)
Draymond LaVine attempts a Layup. Contested by Kyle Brogdon (5.4 feet, MAN). Draymond LaVine misses. Rebound secured by Cole Mitchell.

[09:42] Team_009 possession (Score: 26-27)
FOUL! Reach-in foul on Michael Gasol during the drive. [Team fouls: 1] No free throws, side out. (Michael Gasol: 1 personal fouls)

[09:29] Team_009 possession (Score: 26-27)
Cole Mitchell attempts a Layup. Contested by Michael Gasol (4.4 feet, MAN). Cole Mitchell misses. Rebound secured by Michael Gasol.

[09:12] Team_053 possession (Score: 26-27)
Immanuel Curry attempts a Midrange. Contested by Cole Mitchell (5.3 feet, ZONE). IMMANUEL CURRY MAKES IT!
Score: 26-29

[08:54] Team_009 possession (Score: 26-29)
Miles Sabonis attempts a 3Pt. Contested by Kobe Ginobili (4.5 feet, MAN). Miles Sabonis misses. Rebound secured by Draymond LaVine.

[08:40] Team_053 possession (Score: 26-29)
Michael Gasol makes the Dunk and draws the foul on Kyle Brogdon! And-1! Michael Gasol to the line for 1. [Team fouls: 1] (Kyle Brogdon: 1 personal fouls)   FT 1/1: MISS Michael Gasol makes 0/1 from the line. Rebound secured by Cole Mitchell.
Score: 26-31

[08:24] Team_009 possession (Score: 26-31)
Desmond Harden attempts a 3Pt. Contested by James Murray (4.9 feet, MAN). DESMOND HARDEN MAKES IT! Assist: Anfernee Anunoby
Score: 29-31

[08:06] Team_053 possession (Score: 29-31)
James Murray attempts a 3Pt. Wide open! Anfernee Anunoby is 6.3 feet away. [ZONE] James Murray misses. Offensive rebound by Draymond LaVine! Draymond LaVine kicks it out.

[07:52] Team_053 possession (Score: 29-31)
Draymond LaVine makes the Midrange and draws the foul on Kyle Brogdon! And-1! Draymond LaVine to the line for 1. [Team fouls: 2] (Kyle Brogdon: 2 personal fouls)   FT 1/1: GOOD Draymond LaVine makes 1/1 from the line.
Score: 29-34

[07:40] Team_009 possession (Score: 29-34)
Kyle Brogdon attempts a Layup. Contested by Draymond LaVine (4.6 feet, MAN). Kyle Brogdon misses. Rebound secured by Michael Gasol.

[07:26] Team_053 possession (Score: 29-34)
Draymond LaVine drives and kicks out. Michael Gasol attempts a 3Pt. Contested by Cole Mitchell (5.5 feet, ZONE). Michael Gasol misses. Offensive rebound by Draymond LaVine! Draymond LaVine kicks it out.

[07:09] Team_053 possession (Score: 29-34)
Draymond LaVine drives, Kyle Brogdon stays with him. Draymond LaVine attempts a Dunk. Contested by Kyle Brogdon (5.8 feet, ZONE). Draymond LaVine misses. Rebound secured by Kyle Brogdon.

[06:50] Team_009 possession (Score: 29-34)
Desmond Harden attempts a 3Pt. Contested by James Murray (5.1 feet, ZONE). Desmond Harden misses. Rebound secured by Michael Gasol.

[06:35] Team_053 possession (Score: 29-34)
Kobe Ginobili attempts a Midrange. Contested by Cole Mitchell (5.4 feet, ZONE). KOBE GINOBILI MAKES IT!
Score: 29-36

[06:23] Team_009 possession (Score: 29-36)
Desmond Harden attempts a Midrange. Contested by James Murray (5.1 feet, ZONE). DESMOND HARDEN MAKES IT!
Score: 31-36

[06:06] Team_053 possession (Score: 31-36)
Kobe Ginobili drives, Miles Sabonis stays with him. Kobe Ginobili attempts a Dunk. Wide open! Miles Sabonis is 6.0 feet away. [MAN] KOBE GINOBILI MAKES IT! Assist: Immanuel Curry
Score: 31-38

[05:49] Team_009 possession (Score: 31-38)
Kyle Brogdon attempts a 3Pt. Contested by Draymond LaVine (4.8 feet, MAN). Kyle Brogdon misses. FOUL! Loose ball foul on Draymond LaVine during the rebound battle. [Team fouls: 2] No free throws, side out. (Draymond LaVine: 1 personal fouls)

[05:33] Team_009 possession (Score: 31-38)
Desmond Harden attempts a Midrange. Contested by James Murray (5.2 feet, ZONE). Desmond Harden misses. Offensive rebound by Cole Mitchell! Cole Mitchell kicks it out.

[05:16] Team_009 possession (Score: 31-38)
Anfernee Anunoby attempts a Midrange. Contested by James Murray (5.2 feet, ZONE). Anfernee Anunoby misses. Offensive rebound by Kyle Brogdon! Kyle Brogdon kicks it out.

[05:00] Team_009 possession (Score: 31-38)
Miles Sabonis drives, Draymond LaVine stays with him. Miles Sabonis attempts a Layup. Contested by Draymond LaVine (5.2 feet, ZONE). Miles Sabonis misses. Rebound secured by James Murray.

[04:45] Team_053 possession (Score: 31-38)
James Murray drives, Desmond Harden stays with him. James Murray attempts a Dunk. Wide open! Desmond Harden is 6.5 feet away. [MAN] James Murray misses. Rebound secured by Kyle Brogdon.

[04:32] Team_009 possession (Score: 31-38)
Kyle Brogdon drives and kicks out. Desmond Harden attempts a 3Pt. Contested by Kobe Ginobili (5.4 feet, ZONE). DESMOND HARDEN MAKES IT! Assist: Anfernee Anunoby
Score: 34-38

[04:17] Team_053 possession (Score: 34-38)
Michael Gasol attempts a 3Pt. Contested by Cole Mitchell (5.7 feet, MAN). Michael Gasol misses. Offensive rebound by Michael Gasol! Michael Gasol kicks it out.

[04:03] Team_053 possession (Score: 34-38)
Michael Gasol drives to the basket... FOUL! Offensive foul on Michael Gasol! Cole Mitchell drew the charge! [Team fouls: 3] (Michael Gasol: 2 personal fouls) TURNOVER! (dead ball)

[03:45] Team_009 possession (Score: 34-38)
FOUL! Shooting foul on Kobe Ginobili. Anfernee Anunoby to the line for 3 free throws. [Team fouls: 4] (Kobe Ginobili: 1 personal fouls)   FT 1/3: GOOD   FT 2/3: GOOD   FT 3/3: GOOD Anfernee Anunoby makes 3/3 from the line.
Score: 37-38

[03:31] Team_053 possession (Score: 37-38)
James Murray attempts a 3Pt. Wide open! Miles Sabonis is 6.8 feet away. [ZONE] James Murray misses. Rebound secured by Cole Mitchell.

[03:17] Team_009 possession (Score: 37-38)
Kyle Brogdon drives, picks up Draymond LaVine. Help arrives from James Murray! Kyle Brogdon attempts a Layup. Contested by James Murray (5.2 feet, MAN). KYLE BROGDON MAKES IT!
Score: 39-38

[03:07] Team_053 possession (Score: 39-38)
Kobe Ginobili attempts a Midrange. Wide open! Miles Sabonis is 6.4 feet away. [MAN] Kobe Ginobili misses. Rebound secured by Cole Mitchell.

[02:54] Team_009 possession (Score: 39-38)
Kyle Brogdon attempts a Midrange. Contested by Draymond LaVine (5.3 feet, MAN). Kyle Brogdon misses. Rebound secured by James Murray.

[02:45] Team_053 possession (Score: 39-38)
Draymond LaVine attempts a 3Pt. Wide open! Kyle Brogdon is 6.4 feet away. [MAN] DRAYMOND LAVINE MAKES IT! Assist: Kobe Ginobili
Score: 39-41

[02:27] Team_009 possession (Score: 39-41)
Desmond Harden attempts a Layup. Contested by Michael Gasol (5.5 feet, ZONE). DESMOND HARDEN MAKES IT!
Score: 41-41

[02:12] Team_053 possession (Score: 41-41)
Kobe Ginobili attempts a Midrange. Wide open! Miles Sabonis is 6.5 feet away. [MAN] Kobe Ginobili misses. Rebound secured by Anfernee Anunoby.

[01:59] Team_009 possession (Score: 41-41)
Desmond Harden attempts a 3Pt. Contested by James Murray (5.7 feet, MAN). Desmond Harden misses. Rebound secured by James Murray.

[01:43] Team_053 possession (Score: 41-41)
James Murray attempts a 3Pt. Wide open! Desmond Harden is 6.9 feet away. [MAN] JAMES MURRAY MAKES IT! Assist: Immanuel Curry
Score: 41-44

[01:25] Team_009 possession (Score: 41-44)
Cole Mitchell drives to the basket... Cole Mitchell loses control! Ball rolls out of bounds! TURNOVER! (dead ball)

[01:25] Substitution (Team_009): Miles Sabonis OUT → Paul Trent IN (stamina_rule2)

[01:25] Substitution (Team_009): Desmond Harden OUT → Evan Curry IN (stamina_rule2)

[01:25] Substitution (Team_009): Anfernee Anunoby OUT → RJ Jokic IN (stamina_rule2)

[01:25] Substitution (Team_009): Cole Mitchell OUT → Kawhi Herro IN (stamina_rule2)

[01:25] Substitution (Team_009): Kyle Brogdon OUT → Shaquille Green IN (stamina_rule2)

[01:25] Substitution (Team_053): Kobe Ginobili OUT → Michael DeRozan IN (stamina_rule2)

[01:25] Substitution (Team_053): James Murray OUT → Tyrese Mitchell IN (stamina_rule2)

[01:25] Substitution (Team_053): Immanuel Curry OUT → Brandon Bryant IN (stamina_rule2)

[01:25] Substitution (Team_053): Michael Gasol OUT → Klay Anunoby IN (stamina_rule2)

[01:25] Substitution (Team_053): Draymond LaVine OUT → Devin Green IN (stamina_rule2)

[01:11] Team_053 possession (Score: 41-44)
Michael DeRozan attempts a Midrange. Contested by Paul Trent (5.3 feet, ZONE). Michael DeRozan misses. Rebound secured by RJ Jokic.

[00:54] Team_009 possession (Score: 41-44)
Shaquille Green attempts a Layup. BLOCKED BY KLAY ANUNOBY! Ball is loose! Rebound secured by Brandon Bryant.

[00:43] Team_053 possession (Score: 41-44)
Brandon Bryant drives, picks up Kawhi Herro. Help arrives from Paul Trent! Brandon Bryant attempts a Dunk. Contested by Paul Trent (3.5 feet, ZONE). BRANDON BRYANT MAKES IT! Assist: Devin Green
Score: 41-46

[00:26] Team_009 possession (Score: 41-46)
Evan Curry attempts a Layup. Contested by Devin Green (5.1 feet, ZONE). Evan Curry misses. FOUL! Loose ball foul on Klay Anunoby during the rebound battle. [IN THE BONUS! 5 team fouls] Shaquille Green to the line for 2 free throws. (Klay Anunoby: 1 personal fouls)   FT 1/2: GOOD   FT 2/2: GOOD Shaquille Green makes 2/2 from the line.
Score: 43-46

[00:14] Team_053 possession (Score: 43-46)
Brandon Bryant makes the Dunk and draws the foul on Kawhi Herro! And-1! Brandon Bryant to the line for 1. [Team fouls: 3] (Kawhi Herro: 1 personal fouls)   FT 1/1: GOOD Brandon Bryant makes 1/1 from the line.
Score: 43-49

[00:04] Team_009 possession (Score: 43-49)
RJ Jokic attempts a 3Pt. Contested by Brandon Bryant (3.2 feet, ZONE). RJ Jokic misses. Rebound secured by Klay Anunoby.

================================================================================
                              2ND QUARTER COMPLETE                              
================================================================================

2ND QUARTER SCORE: Team_009 17, Team_053 27

BOX SCORE:
================================================================================

Team_009
--------------------------------------------------------------------------------
Player                MIN  PTS  REB  AST  TO      FG   FG%      3P   3P%
--------------------------------------------------------------------------------
Desmond Harden         23   10    0    0   0   4/8    50.0     0/0   0.0
Anfernee Anunoby       23    3    2    2   0   1/2    50.0     0/0   0.0
Kyle Brogdon           23    2    3    0   0   1/3    33.3     0/0   0.0
Shaquille Green         1    2    0    0   0   1/2    50.0     0/0   0.0
Cole Mitchell          23    0    7    0   0   0/1     0.0     0/0   0.0
Miles Sabonis          23    0    0    0   0   0/3     0.0     0/0   0.0
RJ Jokic                1    0    1    0   0   0/1     0.0     0/0   0.0

TEAM: FG: 7/20 (35.0%), 3PT: 2/9 (22.2%), REB: 14 (5 off, 9 def), AST: 2, TO: 1
TEAM FOULS: 3


Team_053
--------------------------------------------------------------------------------
Player                MIN  PTS  REB  AST  TO      FG   FG%      3P   3P%
--------------------------------------------------------------------------------
Draymond LaVine        23    8    4    1   0   3/5    60.0     0/0   0.0
Kobe Ginobili          23    7    0    1   0   3/5    60.0     0/0   0.0
Brandon Bryant          1    5    1    0   0   2/2   100.0     0/0   0.0
James Murray           23    3    3    1   0   1/3    33.3     0/0   0.0
Immanuel Curry         23    2    0    2   0   1/2    50.0     0/0   0.0
Michael Gasol          23    0    7    0   0   0/1     0.0     0/0   0.0
Michael DeRozan         1    0    0    0   0   0/1     0.0     0/0   0.0
Devin Green             1    0    0    1   0   0/0     0.0     0/0   0.0
Klay Anunoby            1    0    1    0   0   0/0     0.0     0/0   0.0

TEAM: FG: 10/19 (52.6%), 3PT: 2/3 (66.7%), REB: 15 (3 off, 12 def), AST: 6, TO: 1
TEAM FOULS: 5 [Team_009 in BONUS]

================================================================================

================================================================================
                       3RD QUARTER - Team_009 vs Team_053                       
================================================================================

[12:00] Team_009 possession (Score: 43-49)
Desmond Harden attempts a 3Pt. Contested by James Murray (4.3 feet, MAN). DESMOND HARDEN MAKES IT! Assist: Miles Sabonis
Score: 46-49

[11:47] Team_053 possession (Score: 46-49)
Kobe Ginobili drives and kicks out. Draymond LaVine attempts a 3Pt. Contested by Kyle Brogdon (4.9 feet, MAN). Draymond LaVine misses. Rebound secured by Cole Mitchell.

[11:30] Team_009 possession (Score: 46-49)
Desmond Harden attempts a Layup. BLOCKED BY IMMANUEL CURRY! Ball is loose! Offensive rebound by Cole Mitchell! Cole Mitchell kicks it out.

[11:17] Team_009 possession (Score: 46-49)
Cole Mitchell makes the Dunk and draws the foul on Michael Gasol! And-1! Cole Mitchell to the line for 1. [Team fouls: 1] (Michael Gasol: 1 personal fouls)   FT 1/1: GOOD Cole Mitchell makes 1/1 from the line.
Score: 49-49

[11:07] Team_053 possession (Score: 49-49)
FOUL! Shooting foul on Kyle Brogdon. Michael Gasol to the line for 2 free throws. [Team fouls: 1] (Kyle Brogdon: 1 personal fouls)   FT 1/2: MISS   FT 2/2: GOOD Michael Gasol makes 1/2 from the line.
Score: 49-50

[10:56] Team_009 possession (Score: 49-50)
FOUL! Shooting foul on Draymond LaVine. Kyle Brogdon to the line for 2 free throws. [Team fouls: 2] (Draymond LaVine: 1 personal fouls)   FT 1/2: MISS   FT 2/2: MISS Kyle Brogdon makes 0/2 from the line. Rebound secured by Draymond LaVine.

[10:44] Team_053 possession (Score: 49-50)
FOUL! Reach-in foul on Kyle Brogdon during the drive. [Team fouls: 2] No free throws, side out. (Kyle Brogdon: 2 personal fouls)

[10:30] Team_053 possession (Score: 49-50)
Draymond LaVine attempts a Layup. Contested by Kyle Brogdon (4.9 feet, ZONE). DRAYMOND LAVINE MAKES IT! Assist: Michael Gasol
Score: 49-52

[10:15] Team_009 possession (Score: 49-52)
Anfernee Anunoby attempts a Layup. BLOCKED BY MICHAEL GASOL! Ball deflects out of bounds off Anfernee Anunoby.

[09:59] Team_053 possession (Score: 49-52)
Immanuel Curry drives and kicks out. Draymond LaVine attempts a Midrange. Contested by Kyle Brogdon (4.9 feet, MAN). Draymond LaVine misses. Offensive rebound by Michael Gasol! Michael Gasol's putback is no good. Rebound secured by Cole Mitchell.

[09:44] Team_009 possession (Score: 49-52)
FOUL! Shooting foul on Michael Gasol. Miles Sabonis to the line for 2 free throws. [Team fouls: 3] (Michael Gasol: 2 personal fouls)   FT 1/2: GOOD   FT 2/2: GOOD Miles Sabonis makes 2/2 from the line.
Score: 51-52

[09:31] Team_053 possession (Score: 51-52)
Immanuel Curry attempts a 3Pt. Contested by Miles Sabonis (5.5 feet, ZONE). Immanuel Curry misses. Rebound secured by Cole Mitchell.

[09:15] Team_009 possession (Score: 51-52)
Cole Mitchell loses control! Ball rolls out of bounds! TURNOVER! (dead ball)

[08:57] Team_053 possession (Score: 51-52)
Kobe Ginobili attempts a Layup. Contested by Kyle Brogdon (4.9 feet, ZONE). Kobe Ginobili misses. Rebound secured by Cole Mitchell.

[08:42] Team_009 possession (Score: 51-52)
Desmond Harden drives, Michael Gasol stays with him. Desmond Harden attempts a Dunk. Contested by Michael Gasol (4.0 feet, ZONE). Desmond Harden misses. Rebound secured by Draymond LaVine.

[08:27] Team_053 possession (Score: 51-52)
James Murray attempts a Midrange. Contested by Cole Mitchell (5.1 feet, ZONE). James Murray misses. Rebound secured by Kyle Brogdon.

[08:11] Team_009 possession (Score: 51-52)
Cole Mitchell attempts a Midrange. Contested by Michael Gasol (3.9 feet, MAN). Cole Mitchell misses. Rebound secured by James Murray.

[07:59] Team_053 possession (Score: 51-52)
Draymond LaVine drives to the basket... Draymond LaVine loses control! Ball rolls out of bounds! TURNOVER! (dead ball)

[07:45] Team_009 possession (Score: 51-52)
Kyle Brogdon drives, Draymond LaVine stays with him. Kyle Brogdon attempts a Layup. Contested by Draymond LaVine (3.8 feet, MAN). KYLE BROGDON MAKES IT!
Score: 53-52

[07:31] Team_053 possession (Score: 53-52)
Immanuel Curry attempts a Midrange. Contested by Cole Mitchell (4.6 feet, ZONE). Immanuel Curry misses. Rebound secured by Anfernee Anunoby.

[07:14] Team_009 possession (Score: 53-52)
Desmond Harden attempts a Layup. Contested by James Murray (4.3 feet, MAN). DESMOND HARDEN MAKES IT!
Score: 55-52

[07:00] Team_053 possession (Score: 55-52)
James Murray attempts a 3Pt. Contested by Miles Sabonis (5.9 feet, ZONE). James Murray misses. Rebound secured by Anfernee Anunoby.

[06:46] Team_009 possession (Score: 55-52)
Miles Sabonis attempts a 3Pt. Contested by Kobe Ginobili (4.0 feet, ZONE). Miles Sabonis misses. Rebound secured by James Murray.

[06:34] Team_053 possession (Score: 55-52)
Immanuel Curry attempts a 3Pt. Contested by Anfernee Anunoby (5.3 feet, MAN). Immanuel Curry misses. Rebound secured by Kyle Brogdon.

[06:15] Team_009 possession (Score: 55-52)
Desmond Harden attempts a 3Pt. Contested by Kobe Ginobili (4.1 feet, ZONE). DESMOND HARDEN MAKES IT! Assist: Anfernee Anunoby
Score: 58-52

[05:59] Team_053 possession (Score: 58-52)
Kobe Ginobili drives, Miles Sabonis stays with him. Kobe Ginobili attempts a Layup. Contested by Miles Sabonis (5.2 feet, MAN). KOBE GINOBILI MAKES IT! Assist: Immanuel Curry
Score: 58-54

[05:42] Team_009 possession (Score: 58-54)
Kyle Brogdon attempts a Layup. Contested by Michael Gasol (3.6 feet, ZONE). Kyle Brogdon misses. Rebound secured by Michael Gasol.

[05:28] Team_053 possession (Score: 58-54)
Kobe Ginobili attempts a 3Pt. Contested by Miles Sabonis (5.2 feet, MAN). Kobe Ginobili misses. Rebound secured by Cole Mitchell.

[05:17] Team_009 possession (Score: 58-54)
Kyle Brogdon drives to the basket... Kyle Brogdon commits a violation (traveling/carry)! TURNOVER! (dead ball)

[05:03] Team_053 possession (Score: 58-54)
James Murray attempts a Midrange. Contested by Kyle Brogdon (5.6 feet, ZONE). James Murray misses. Rebound secured by Cole Mitchell.

[04:48] Team_009 possession (Score: 58-54)
Kyle Brogdon attempts a 3Pt. Contested by Kobe Ginobili (3.7 feet, ZONE). Kyle Brogdon misses. Rebound secured by James Murray.

[04:30] Team_053 possession (Score: 58-54)
FOUL! Shooting foul on Desmond Harden. Draymond LaVine to the line for 2 free throws. [Team fouls: 3] (Desmond Harden: 1 personal fouls)   FT 1/2: GOOD   FT 2/2: GOOD Draymond LaVine makes 2/2 from the line.
Score: 58-56

[04:14] Team_009 possession (Score: 58-56)
Kyle Brogdon attempts a Midrange. Contested by Immanuel Curry (4.3 feet, ZONE). KYLE BROGDON MAKES IT! Assist: Anfernee Anunoby
Score: 60-56

[03:57] Team_053 possession (Score: 60-56)
Draymond LaVine makes the Dunk and draws the foul on Kyle Brogdon! And-1! Draymond LaVine to the line for 1. [Team fouls: 4] (Kyle Brogdon: 3 personal fouls)   FT 1/1: MISS Draymond LaVine makes 0/1 from the line. Rebound secured by Anfernee Anunoby.
Score: 60-58

[03:46] Team_009 possession (Score: 60-58)
Cole Mitchell drives and kicks out. Desmond Harden attempts a Midrange. Contested by James Murray (4.4 feet, MAN). Desmond Harden misses. Rebound secured by Draymond LaVine.

[03:28] Team_053 possession (Score: 60-58)
FOUL! Holding foul on Cole Mitchell. [IN THE BONUS! 5 team fouls] Michael Gasol to the line for 2 free throws. (Cole Mitchell: 1 personal fouls)   FT 1/2: GOOD   FT 2/2: MISS Michael Gasol makes 1/2 from the line. Offensive rebound by Draymond LaVine! Draymond LaVine kicks it out.
Score: 60-59

[03:11] Team_053 possession (Score: 60-59)
Draymond LaVine attempts a 3Pt. Contested by Kyle Brogdon (5.1 feet, MAN). Draymond LaVine misses. Offensive rebound by Draymond LaVine! Draymond LaVine kicks it out.

[03:02] Team_053 possession (Score: 60-59)
Kobe Ginobili attempts a 3Pt. Contested by Miles Sabonis (5.4 feet, ZONE). Kobe Ginobili misses. Rebound secured by Cole Mitchell.

[02:48] Team_009 possession (Score: 60-59)
Kyle Brogdon makes the Layup and draws the foul on Draymond LaVine! And-1! Kyle Brogdon to the line for 1. [Team fouls: 4] (Draymond LaVine: 2 personal fouls)   FT 1/1: GOOD Kyle Brogdon makes 1/1 from the line.
Score: 63-59

[02:30] Team_053 possession (Score: 63-59)
Draymond LaVine drives, Kyle Brogdon stays with him. Draymond LaVine attempts a Layup. Contested by Kyle Brogdon (5.2 feet, MAN). Draymond LaVine misses. Rebound secured by Cole Mitchell.

[02:15] Team_009 possession (Score: 63-59)
Kyle Brogdon makes the Layup and draws the foul on Draymond LaVine! And-1! Kyle Brogdon to the line for 1. [BONUS: 5 team fouls] (Draymond LaVine: 3 personal fouls)   FT 1/1: GOOD Kyle Brogdon makes 1/1 from the line.
Score: 66-59

[02:01] Team_053 possession (Score: 66-59)
Michael Gasol attempts a 3Pt. Contested by Cole Mitchell (4.7 feet, MAN). MICHAEL GASOL MAKES IT! Assist: Immanuel Curry
Score: 66-62

[01:46] Team_009 possession (Score: 66-62)
Miles Sabonis attempts a 3Pt. Contested by Kobe Ginobili (4.3 feet, ZONE). Miles Sabonis misses. Rebound secured by Draymond LaVine.

[01:30] Team_053 possession (Score: 66-62)
Michael Gasol throws a bad pass out of bounds! TURNOVER! (dead ball)

[01:30] Substitution (Team_009): Miles Sabonis OUT → Paul Trent IN (stamina_rule2)

[01:30] Substitution (Team_009): Desmond Harden OUT → Evan Curry IN (stamina_rule2)

[01:30] Substitution (Team_009): Anfernee Anunoby OUT → RJ Jokic IN (stamina_rule2)

[01:30] Substitution (Team_009): Cole Mitchell OUT → Kawhi Herro IN (stamina_rule2)

[01:30] Substitution (Team_009): Kyle Brogdon OUT → Shaquille Green IN (stamina_rule2)

[01:30] Substitution (Team_053): Kobe Ginobili OUT → Michael DeRozan IN (stamina_rule2)

[01:30] Substitution (Team_053): James Murray OUT → Tyrese Mitchell IN (stamina_rule2)

[01:30] Substitution (Team_053): Immanuel Curry OUT → Brandon Bryant IN (stamina_rule2)

[01:30] Substitution (Team_053): Michael Gasol OUT → Klay Anunoby IN (stamina_rule2)

[01:30] Substitution (Team_053): Draymond LaVine OUT → Devin Green IN (stamina_rule2)

[01:16] Team_009 possession (Score: 66-62)
Shaquille Green commits a violation (traveling/carry)! TURNOVER! (dead ball)

[01:05] Team_053 possession (Score: 66-62)
FOUL! Shooting foul on RJ Jokic. Brandon Bryant to the line for 2 free throws. [BONUS: 6 team fouls] (RJ Jokic: 1 personal fouls)   FT 1/2: GOOD   FT 2/2: GOOD Brandon Bryant makes 2/2 from the line.
Score: 66-64

[00:53] Team_009 possession (Score: 66-64)
RJ Jokic attempts a 3Pt. Contested by Brandon Bryant (3.2 feet, MAN). RJ Jokic misses. Rebound secured by Klay Anunoby.

[00:42] Team_053 possession (Score: 66-64)
Michael DeRozan drives, Kawhi Herro stays with him. Michael DeRozan attempts a Dunk. Contested by Kawhi Herro (3.2 feet, ZONE). Michael DeRozan misses. Rebound secured by Shaquille Green.

[00:28] Team_009 possession (Score: 66-64)
Evan Curry loses the ball! Stripped by Tyrese Mitchell! TURNOVER! (live ball)

[00:15] Team_053 possession (Score: 66-64)
Brandon Bryant attempts a Layup. Contested by Kawhi Herro (3.5 feet, ZONE). Brandon Bryant misses. Offensive rebound by Devin Green! Devin Green puts it back in!
Score: 66-66

[00:01] Team_009 possession (Score: 66-66)
Evan Curry attempts a 3Pt. Contested by Tyrese Mitchell (5.1 feet, MAN). Evan Curry misses. Rebound secured by Klay Anunoby.

================================================================================
                              3RD QUARTER COMPLETE                              
================================================================================

3RD QUARTER SCORE: Team_009 23, Team_053 17

BOX SCORE:
================================================================================

Team_009
--------------------------------------------------------------------------------
Player                MIN  PTS  REB  AST  TO      FG   FG%      3P   3P%
--------------------------------------------------------------------------------
Kyle Brogdon           34   10    2    0   0   4/7    57.1     0/0   0.0
Desmond Harden         34    8    0    0   0   3/4    75.0     0/0   0.0
Cole Mitchell          34    3    9    0   0   1/3    33.3     0/0   0.0
Miles Sabonis          34    2    0    1   0   1/3    33.3     0/0   0.0
Anfernee Anunoby       34    0    3    2   0   0/1     0.0     0/0   0.0
RJ Jokic                3    0    0    0   0   0/1     0.0     0/0   0.0
Shaquille Green         3    0    1    0   0   0/0     0.0     0/0   0.0
Evan Curry              3    0    0    0   0   0/1     0.0     0/0   0.0

TEAM: FG: 9/20 (45.0%), 3PT: 2/7 (28.6%), REB: 14 (1 off, 13 def), AST: 3, TO: 4
TEAM FOULS: 6 [Team_053 in BONUS]


Team_053
--------------------------------------------------------------------------------
Player                MIN  PTS  REB  AST  TO      FG   FG%      3P   3P%
--------------------------------------------------------------------------------
Michael Gasol          34    4    1    1   0   2/2   100.0     0/0   0.0
Draymond LaVine        34    4    6    0   0   2/4    50.0     0/0   0.0
Kobe Ginobili          34    2    0    0   0   1/5    20.0     0/0   0.0
Brandon Bryant          3    2    0    0   0   1/1   100.0     0/0   0.0
Devin Green             3    2    1    0   0   1/1   100.0     0/0   0.0
Immanuel Curry         34    0    0    2   0   0/4     0.0     0/0   0.0
James Murray           34    0    3    0   0   0/3     0.0     0/0   0.0
Klay Anunoby            3    0    2    0   0   0/0     0.0     0/0   0.0
Michael DeRozan         3    0    0    0   0   0/1     0.0     0/0   0.0

TEAM: FG: 7/21 (33.3%), 3PT: 1/6 (16.7%), REB: 14 (4 off, 10 def), AST: 3, TO: 2
TEAM FOULS: 5 [Team_009 in BONUS]

================================================================================

================================================================================
                       4TH QUARTER - Team_009 vs Team_053                       
================================================================================

[12:00] Team_009 possession (Score: 66-66)
Cole Mitchell attempts a Midrange. Contested by Michael Gasol (4.0 feet, MAN). Cole Mitchell misses. Offensive rebound by Cole Mitchell! Cole Mitchell kicks it out.

[11:47] Team_009 possession (Score: 66-66)
Kyle Brogdon attempts a Layup. Contested by Draymond LaVine (3.9 feet, MAN). Kyle Brogdon misses. Rebound secured by Draymond LaVine.

[11:37] Team_053 possession (Score: 66-66)
James Murray attempts a 3Pt. Contested by Miles Sabonis (6.0 feet, ZONE). James Murray misses. Rebound secured by Kyle Brogdon.

[11:24] Team_009 possession (Score: 66-66)
FOUL! Holding foul on James Murray. [Team fouls: 1] No free throws, side out. (James Murray: 1 personal fouls)

[11:05] Team_009 possession (Score: 66-66)
FOUL! Shooting foul on Kobe Ginobili. Cole Mitchell to the line for 3 free throws. [Team fouls: 2] (Kobe Ginobili: 1 personal fouls)   FT 1/3: GOOD   FT 2/3: GOOD   FT 3/3: GOOD Cole Mitchell makes 3/3 from the line.
Score: 69-66

[10:56] Team_053 possession (Score: 69-66)
Michael Gasol attempts a 3Pt. Contested by Cole Mitchell (4.6 feet, MAN). Michael Gasol misses. Offensive rebound by Draymond LaVine! Draymond LaVine kicks it out.

[10:45] Team_053 possession (Score: 69-66)
Draymond LaVine drives, Cole Mitchell stays with him. Draymond LaVine attempts a Layup. Contested by Cole Mitchell (4.8 feet, ZONE). DRAYMOND LAVINE MAKES IT! Assist: Kobe Ginobili
Score: 69-68

[10:28] Team_009 possession (Score: 69-68)
Kyle Brogdon attempts a Layup. Contested by Draymond LaVine (4.0 feet, MAN). KYLE BROGDON MAKES IT! Assist: Desmond Harden
Score: 71-68

[10:11] Team_053 possession (Score: 71-68)
James Murray loses control! Ball rolls out of bounds! TURNOVER! (dead ball)

[10:11] Substitution (Team_009): Miles Sabonis OUT → Paul Trent IN (stamina_rule2)

[10:11] Substitution (Team_009): Desmond Harden OUT → Evan Curry IN (stamina_rule2)

[10:11] Substitution (Team_009): Anfernee Anunoby OUT → RJ Jokic IN (stamina_rule2)

[10:11] Substitution (Team_009): Cole Mitchell OUT → Kawhi Herro IN (stamina_rule2)

[10:11] Substitution (Team_009): Kyle Brogdon OUT → Shaquille Green IN (stamina_rule2)

[10:11] Substitution (Team_053): Kobe Ginobili OUT → Michael DeRozan IN (stamina_rule2)

[10:11] Substitution (Team_053): Immanuel Curry OUT → Brandon Bryant IN (stamina_rule2)

[10:11] Substitution (Team_053): Michael Gasol OUT → Klay Anunoby IN (stamina_rule2)

[10:11] Substitution (Team_053): Draymond LaVine OUT → Devin Green IN (stamina_rule2)

[09:57] Team_009 possession (Score: 71-68)
Kawhi Herro attempts a Midrange. Contested by Devin Green (5.1 feet, ZONE). KAWHI HERRO MAKES IT!
Score: 73-68

[09:43] Team_053 possession (Score: 73-68)
Klay Anunoby throws a bad pass out of bounds! TURNOVER! (dead ball)

[09:43] Substitution (Team_053): James Murray OUT → Tyrese Mitchell IN (stamina_rule2)

[09:29] Team_009 possession (Score: 73-68)
Kawhi Herro attempts a Layup. Contested by Klay Anunoby (3.7 feet, MAN). KAWHI HERRO MAKES IT! Assist: RJ Jokic
Score: 75-68

[09:16] Team_053 possession (Score: 75-68)
Michael DeRozan attempts a 3Pt. Contested by Paul Trent (5.3 feet, ZONE). MICHAEL DEROZAN MAKES IT! Assist: Klay Anunoby
Score: 75-71

[09:01] Team_009 possession (Score: 75-71)
FOUL! Shooting foul on Devin Green. Shaquille Green to the line for 2 free throws. [Team fouls: 3] (Devin Green: 1 personal fouls)   FT 1/2: GOOD   FT 2/2: GOOD Shaquille Green makes 2/2 from the line.
Score: 77-71

[08:46] Team_053 possession (Score: 77-71)
Brandon Bryant attempts a Layup. Contested by RJ Jokic (4.4 feet, MAN). BRANDON BRYANT MAKES IT! Assist: Tyrese Mitchell
Score: 77-73

[08:28] Team_009 possession (Score: 77-73)
Shaquille Green attempts a Layup. Contested by Devin Green (5.1 feet, MAN). SHAQUILLE GREEN MAKES IT! Assist: Kawhi Herro
Score: 79-73

[08:12] Team_053 possession (Score: 79-73)
Tyrese Mitchell attempts a 3Pt. Contested by Paul Trent (5.5 feet, ZONE). Tyrese Mitchell misses. Rebound secured by Kawhi Herro.

[07:56] Team_009 possession (Score: 79-73)
RJ Jokic attempts a Midrange. Contested by Brandon Bryant (3.2 feet, MAN). RJ JOKIC MAKES IT!
Score: 81-73

[07:44] Team_053 possession (Score: 81-73)
Brandon Bryant drives, Kawhi Herro stays with him. Brandon Bryant attempts a Layup. Contested by Kawhi Herro (3.5 feet, ZONE). Brandon Bryant misses. Rebound secured by Kawhi Herro.

[07:32] Team_009 possession (Score: 81-73)
Evan Curry attempts a 3Pt. Contested by Tyrese Mitchell (5.1 feet, MAN). EVAN CURRY MAKES IT! Assist: Shaquille Green
Score: 84-73

[07:22] Team_053 possession (Score: 84-73)
Klay Anunoby makes the Dunk and draws the foul on Kawhi Herro! And-1! Klay Anunoby to the line for 1. [Team fouls: 1] (Kawhi Herro: 1 personal fouls)   FT 1/1: GOOD Klay Anunoby makes 1/1 from the line.
Score: 84-76

[07:11] Team_009 possession (Score: 84-76)
Kawhi Herro attempts a Layup. Contested by Klay Anunoby (3.7 feet, MAN). Kawhi Herro misses. FOUL! Loose ball foul on Devin Green during the rebound battle. [Team fouls: 4] No free throws, side out. (Devin Green: 2 personal fouls)

[06:56] Team_009 possession (Score: 84-76)
Evan Curry attempts a Layup. Contested by Devin Green (5.1 feet, ZONE). Evan Curry misses. Rebound secured by Brandon Bryant.

[06:42] Team_053 possession (Score: 84-76)
Michael DeRozan drives and kicks out. Klay Anunoby attempts a Midrange. Contested by Kawhi Herro (3.6 feet, MAN). Klay Anunoby misses. Offensive rebound by Klay Anunoby! Klay Anunoby kicks it out.

[06:27] Team_053 possession (Score: 84-76)
Devin Green drives, Kawhi Herro stays with him. Devin Green attempts a Dunk. Contested by Kawhi Herro (3.9 feet, ZONE). DEVIN GREEN MAKES IT!
Score: 84-78

[06:15] Team_009 possession (Score: 84-78)
Evan Curry attempts a 3Pt. Contested by Brandon Bryant (3.5 feet, ZONE). Evan Curry misses. Rebound secured by Klay Anunoby.

[06:01] Team_053 possession (Score: 84-78)
Klay Anunoby attempts a Layup. BLOCKED BY PAUL TRENT! Ball is loose! Offensive rebound by Devin Green! Devin Green kicks it out.

[05:45] Team_053 possession (Score: 84-78)
FOUL! Reach-in foul on Shaquille Green during the drive. [Team fouls: 2] No free throws, side out. (Shaquille Green: 1 personal fouls)

[05:33] Team_053 possession (Score: 84-78)
Tyrese Mitchell attempts a 3Pt. Contested by Paul Trent (5.5 feet, ZONE). TYRESE MITCHELL MAKES IT! Assist: Michael DeRozan
Score: 84-81

[05:16] Team_009 possession (Score: 84-81)
Shaquille Green drives and kicks out. Kawhi Herro attempts a 3Pt. Contested by Klay Anunoby (3.6 feet, MAN). KAWHI HERRO MAKES IT! Assist: Shaquille Green
Score: 87-81

[05:06] Team_053 possession (Score: 87-81)
Tyrese Mitchell attempts a 3Pt. Contested by RJ Jokic (4.4 feet, ZONE). Tyrese Mitchell misses. Offensive rebound by Klay Anunoby! Klay Anunoby kicks it out.

[04:53] Team_053 possession (Score: 87-81)
FOUL! Holding foul on Kawhi Herro. [Team fouls: 3] No free throws, side out. (Kawhi Herro: 2 personal fouls)

[04:36] Team_053 possession (Score: 87-81)
Brandon Bryant drives and kicks out. Tyrese Mitchell attempts a 3Pt. Contested by Evan Curry (5.3 feet, MAN). Tyrese Mitchell misses. Rebound secured by Shaquille Green.

[04:20] Team_009 possession (Score: 87-81)
Paul Trent attempts a 3Pt. Contested by Michael DeRozan (5.8 feet, MAN). Paul Trent misses. Offensive rebound by Shaquille Green! Shaquille Green kicks it out.

[04:02] Team_009 possession (Score: 87-81)
RJ Jokic attempts a Midrange. Contested by Brandon Bryant (3.2 feet, MAN). RJ Jokic misses. Rebound secured by Brandon Bryant.

[03:46] Team_053 possession (Score: 87-81)
FOUL! Reach-in foul on Shaquille Green during the drive. [Team fouls: 4] No free throws, side out. (Shaquille Green: 2 personal fouls)

[03:34] Team_053 possession (Score: 87-81)
Devin Green attempts a 3Pt. Wide open! Paul Trent is 6.0 feet away. [ZONE] DEVIN GREEN MAKES IT! Assist: Brandon Bryant
Score: 87-84

[03:17] Team_009 possession (Score: 87-84)
FOUL! Shooting foul on Tyrese Mitchell. Evan Curry to the line for 2 free throws. [BONUS: 5 team fouls] (Tyrese Mitchell: 1 personal fouls)   FT 1/2: GOOD   FT 2/2: GOOD Evan Curry makes 2/2 from the line.
Score: 89-84

[03:05] Team_053 possession (Score: 89-84)
Brandon Bryant attempts a Midrange. Contested by RJ Jokic (4.5 feet, MAN). Brandon Bryant misses. FOUL! Loose ball foul on RJ Jokic during the rebound battle. [IN THE BONUS! 5 team fouls] Klay Anunoby to the line for 2 free throws. (RJ Jokic: 1 personal fouls)   FT 1/2: GOOD   FT 2/2: GOOD Klay Anunoby makes 2/2 from the line.
Score: 89-86

[02:49] Team_009 possession (Score: 89-86)
FOUL! Shooting foul on Devin Green. Paul Trent to the line for 2 free throws. [BONUS: 6 team fouls] (Devin Green: 3 personal fouls)   FT 1/2: GOOD   FT 2/2: GOOD Paul Trent makes 2/2 from the line.
Score: 91-86

[02:37] Team_053 possession (Score: 91-86)
Tyrese Mitchell attempts a 3Pt. Contested by Paul Trent (5.7 feet, ZONE). Tyrese Mitchell misses. Rebound secured by Kawhi Herro.

[02:23] Team_009 possession (Score: 91-86)
RJ Jokic drives to the basket... FOUL! Offensive foul on RJ Jokic! Brandon Bryant drew the charge! [Team fouls: 6] (RJ Jokic: 2 personal fouls) TURNOVER! (dead ball)

[02:11] Team_053 possession (Score: 91-86)
FOUL! Reach-in foul on Kawhi Herro during the drive. [IN THE BONUS! 7 team fouls] Klay Anunoby to the line for 2 free throws. (Kawhi Herro: 3 personal fouls)   FT 1/2: GOOD   FT 2/2: GOOD Klay Anunoby makes 2/2 from the line.
Score: 91-88

[01:58] Team_009 possession (Score: 91-88)
Kawhi Herro attempts a Midrange. Contested by Klay Anunoby (4.0 feet, MAN). Kawhi Herro misses. Rebound secured by Klay Anunoby.

[01:45] Team_053 possession (Score: 91-88)
Klay Anunoby attempts a 3Pt. Contested by Kawhi Herro (3.8 feet, MAN). Klay Anunoby misses. Rebound secured by RJ Jokic.

[01:34] Team_009 possession (Score: 91-88)
Evan Curry attempts a Layup. Contested by Tyrese Mitchell (5.3 feet, MAN). Evan Curry misses. Offensive rebound by Kawhi Herro! Kawhi Herro puts it back in!
Score: 93-88

[01:18] Team_053 possession (Score: 93-88)
Michael DeRozan attempts a 3Pt. Contested by Paul Trent (5.5 feet, ZONE). MICHAEL DEROZAN MAKES IT!
Score: 93-91

[01:06] Team_009 possession (Score: 93-91)
Kawhi Herro attempts a Layup. Contested by Klay Anunoby (4.2 feet, MAN). Kawhi Herro misses. Rebound secured by Tyrese Mitchell.

[00:49] Team_053 possession (Score: 93-91)
Tyrese Mitchell attempts a Midrange. Contested by Shaquille Green (5.1 feet, ZONE). Tyrese Mitchell misses. Rebound secured by Kawhi Herro.

[00:32] Team_009 possession (Score: 93-91)
RJ Jokic attempts a 3Pt. Contested by Brandon Bryant (3.6 feet, MAN). RJ JOKIC MAKES IT! Assist: Evan Curry
Score: 96-91

[00:17] Team_053 possession (Score: 96-91)
Devin Green attempts a Layup. Contested by Shaquille Green (5.6 feet, MAN). DEVIN GREEN MAKES IT! Assist: Brandon Bryant
Score: 96-93

[00:05] Team_009 possession (Score: 96-93)
Evan Curry drives and kicks out. Paul Trent attempts a Midrange. Wide open! Michael DeRozan is 6.8 feet away. [MAN] PAUL TRENT MAKES IT!
Score: 98-93

================================================================================
                              4TH QUARTER COMPLETE                              
================================================================================

4TH QUARTER SCORE: Team_009 32, Team_053 27

BOX SCORE:
================================================================================

Team_009
--------------------------------------------------------------------------------
Player                MIN  PTS  REB  AST  TO      FG   FG%      3P   3P%
--------------------------------------------------------------------------------
Kawhi Herro            13    9    6    1   0   4/6    66.7     0/0   0.0
RJ Jokic               13    5    1    1   0   2/3    66.7     0/0   0.0
Evan Curry             13    5    0    1   0   2/4    50.0     0/0   0.0
Shaquille Green        13    4    2    2   0   2/2   100.0     0/0   0.0
Paul Trent             13    4    0    0   0   2/2   100.0     0/0   0.0
Cole Mitchell          36    3    1    0   0   1/1   100.0     0/0   0.0
Kyle Brogdon           36    2    1    0   0   1/2    50.0     0/0   0.0
Desmond Harden         36    0    0    1   0   0/0     0.0     0/0   0.0

TEAM: FG: 14/20 (70.0%), 3PT: 3/4 (75.0%), REB: 11 (4 off, 7 def), AST: 6, TO: 1
TEAM FOULS: 7 [Team_053 in BONUS]


Team_053
--------------------------------------------------------------------------------
Player                MIN  PTS  REB  AST  TO      FG   FG%      3P   3P%
--------------------------------------------------------------------------------
Klay Anunoby           13    7    4    1   0   3/4    75.0     0/0   0.0
Devin Green            13    7    1    0   0   3/3   100.0     0/0   0.0
Michael DeRozan        13    6    0    1   0   2/2   100.0     0/0   0.0
Tyrese Mitchell        13    3    1    1   0   1/4    25.0     0/0   0.0
Draymond LaVine        36    2    2    0   0   1/1   100.0     0/0   0.0
Brandon Bryant         13    2    2    2   0   1/3    33.3     0/0   0.0
James Murray           36    0    0    0   0   0/1     0.0     0/0   0.0
Kobe Ginobili          36    0    0    1   0   0/0     0.0     0/0   0.0

TEAM: FG: 11/18 (61.1%), 3PT: 4/8 (50.0%), REB: 10 (4 off, 6 def), AST: 6, TO: 2
TEAM FOULS: 6 [Team_009 in BONUS]

================================================================================

================================================================================
                               FULL GAME COMPLETE                               
================================================================================

FINAL SCORE: Team_009 98, Team_053 93

SCORING BY QUARTER:
--------------------------------------------------------------------------------
Team                     Q1     Q2     Q3     Q4    FINAL
--------------------------------------------------------------------------------
Team_009                 26     17     23     32       98
Team_053                 22     27     17     27       93
--------------------------------------------------------------------------------

FULL GAME BOX SCORE:
================================================================================

Team_009
--------------------------------------------------------------------------------
Player                MIN  PTS  REB  AST  TO      FG   FG%      3P   3P%      FT STL BLK
--------------------------------------------------------------------------------
Miles Sabonis          36    6    0    2   2   3/9    33.3   0/4     0.0   6/6     0   0
Desmond Harden         36   25    0    2   1  10/16   62.5   4/7    57.1   1/1     0   0
Anfernee Anunoby       36    5    8    4   1   3/6    50.0   2/3    66.7   3/3     0   0
Cole Mitchell          36    9   24    1   3   3/10   30.0   2/2   100.0   7/7     0   0
Kyle Brogdon           36   24    9    0   0   9/16   56.2   0/1     0.0   3/5     1   0
Paul Trent             13    4    0    0   0   1/1   100.0   0/0     0.0   2/2     0   1
Evan Curry             13    5    0    1   1   5/8    62.5   1/3    33.3   2/2     0   0
RJ Jokic               13    5    2    1   0   2/5    40.0   1/3    33.3   0/0     0   0
Kawhi Herro            13    9    6    1   0   2/4    50.0   0/0     0.0   0/0     0   0
Shaquille Green        13    6    3    2   2   3/4    75.0   0/0     0.0   4/4     0   0

TEAM: FG: 41/79 (51.9%), 3PT: 10/23 (43.5%), REB: 52 (13 off, 39 def), AST: 14, TO: 10


Team_053
--------------------------------------------------------------------------------
Player                MIN  PTS  REB  AST  TO      FG   FG%      3P   3P%      FT STL BLK
--------------------------------------------------------------------------------
James Murray           36    8   10    2   1   3/12   25.0   2/8    25.0   0/0     0   1
Kobe Ginobili          36    9    0    3   1   5/14   35.7   0/3     0.0   0/0     0   0
Immanuel Curry         36    5    0    6   1   3/10   30.0   1/4    25.0   0/0     0   1
Michael Gasol          36   12   13    2   2   3/6    50.0   1/2    50.0   4/9     1   1
Draymond LaVine        36   18   16    1   1   9/14   64.3   1/1   100.0   4/6     0   0
Michael DeRozan        13    6    0    1   0   2/4    50.0   2/2   100.0   0/0     0   0
Brandon Bryant         13    9    3    2   0   6/8    75.0   0/0     0.0   3/3     0   0
Klay Anunoby           13    7    7    1   1   2/3    66.7   0/1     0.0   5/5     0   1
Devin Green            13    9    2    1   0   3/3   100.0   1/1   100.0   0/0     0   0
Tyrese Mitchell        13    3    1    1   0   1/4    25.0   1/3    33.3   0/0     1   0

TEAM: FG: 37/78 (47.4%), 3PT: 9/25 (36.0%), REB: 52 (17 off, 35 def), AST: 20, TO: 7

================================================================================
