================================================================================
                        FULL GAME - Team_068 vs Team_088                        
================================================================================

================================================================================
                       1ST QUARTER - Team_068 vs Team_088                       
================================================================================

[12:00] Team_068 possession (Score: 0-0)
Malcolm Herro attempts a 3Pt. Contested by Tobias Haliburton (5.0 feet, ZONE). Malcolm Herro misses. FOUL! Loose ball foul on Allen Ming during the rebound battle. [Team fouls: 1] No free throws, side out. (Allen Ming: 1 personal fouls)

[11:45] Team_068 possession (Score: 0-0)
Malcolm Herro drives and kicks out. Gary Simons attempts a 3Pt. Contested by Giannis Smith (4.0 feet, MAN). Gary Simons misses. Rebound secured by Tyler Hyland.

[11:29] Team_088 possession (Score: 0-0)
Giannis Smith attempts a Midrange. Contested by Gary Simons (3.4 feet, MAN). Giannis Smith misses. Rebound secured by Nikola Ginobili.

[11:20] Team_068 possession (Score: 0-0)
Gary Simons drives and kicks out. Malcolm Herro attempts a 3Pt. Contested by Tobias Haliburton (5.0 feet, MAN). Malcolm Herro misses. Rebound secured by Giannis Smith.

[11:06] Team_088 possession (Score: 0-0)
Allen Ming attempts a 3Pt. Contested by Nikola Ginobili (4.2 feet, MAN). Allen Ming misses. Rebound secured by Jaren Johnson.

[10:57] Team_068 possession (Score: 0-0)
Malcolm Herro attempts a 3Pt. Contested by Tobias Haliburton (5.0 feet, ZONE). MALCOLM HERRO MAKES IT! Assist: Jaren Johnson
Score: 3-0

[10:46] Team_088 possession (Score: 3-0)
Tyler Hyland loses the ball! Stripped by Jaren Johnson! TURNOVER! (live ball)

[10:32] Team_068 possession (Score: 3-0)
Gary Simons makes the Layup and draws the foul on Giannis Smith! And-1! Gary Simons to the line for 1. [Team fouls: 2] (Giannis Smith: 1 personal fouls)   FT 1/1: GOOD Gary Simons makes 1/1 from the line.
Score: 6-0

[10:19] Team_088 possession (Score: 6-0)
Giannis Smith attempts a 3Pt. Contested by Zion Anunoby (4.6 feet, ZONE). Giannis Smith misses. Offensive rebound by Allen Ming! Allen Ming's putback is no good. Rebound secured by Nikola Ginobili.

[10:04] Team_068 possession (Score: 6-0)
Malcolm Herro commits a violation (traveling/carry)! TURNOVER! (dead ball)

[09:53] Team_088 possession (Score: 6-0)
FOUL! Shooting foul on Zion Anunoby. Allen Ming to the line for 2 free throws. [Team fouls: 1] (Zion Anunoby: 1 personal fouls)   FT 1/2: GOOD   FT 2/2: GOOD Allen Ming makes 2/2 from the line.
Score: 6-2

[09:35] Team_068 possession (Score: 6-2)
Nikola Ginobili drives and kicks out. Jaren Johnson attempts a 3Pt. Contested by Tyler Hyland (4.5 feet, MAN). Jaren Johnson misses. Offensive rebound by Jaren Johnson! Jaren Johnson kicks it out.

[09:23] Team_068 possession (Score: 6-2)
Gary Simons attempts a 3Pt. Contested by Giannis Smith (4.8 feet, MAN). Gary Simons misses. Rebound secured by Allen Ming.

[09:07] Team_088 possession (Score: 6-2)
Tobias Haliburton attempts a Layup. BLOCKED BY NIKOLA GINOBILI! Ball deflects out of bounds off Tobias Haliburton.

[08:55] Team_068 possession (Score: 6-2)
FOUL! Holding foul on Tobias Haliburton. [Team fouls: 3] No free throws, side out. (Tobias Haliburton: 1 personal fouls)

[08:37] Team_068 possession (Score: 6-2)
Jaren Johnson attempts a 3Pt. Contested by Tyler Hyland (5.0 feet, MAN). JAREN JOHNSON MAKES IT! Assist: Nikola Ginobili
Score: 9-2

[08:24] Team_088 possession (Score: 9-2)
Giannis Smith drives and kicks out. Allen Ming attempts a 3Pt. Contested by Nikola Ginobili (4.0 feet, MAN). Allen Ming misses. Rebound secured by Jaren Johnson.

[08:08] Team_068 possession (Score: 9-2)
FOUL! Offensive foul on Gary Simons! Giannis Smith drew the charge! [Team fouls: 2] (Gary Simons: 1 personal fouls) TURNOVER! (dead ball)

[07:55] Team_088 possession (Score: 9-2)
Giannis Smith attempts a Midrange. Contested by Gary Simons (3.4 feet, MAN). Giannis Smith misses. Rebound secured by Gary Simons.

[07:43] Team_068 possession (Score: 9-2)
Malcolm Herro makes the Layup and draws the foul on Giannis Smith! And-1! Malcolm Herro to the line for 1. [Team fouls: 4] (Giannis Smith: 2 personal fouls)   FT 1/1: GOOD Malcolm Herro makes 1/1 from the line.
Score: 12-2

[07:32] Team_088 possession (Score: 12-2)
Allen Ming drives to the basket... Allen Ming loses the ball! Stripped by Nikola Ginobili! TURNOVER! (live ball)

[07:17] Team_068 possession (Score: 12-2)
Malcolm Herro makes the Dunk and draws the foul on Giannis Smith! And-1! Malcolm Herro to the line for 1. [BONUS: 5 team fouls] (Giannis Smith: 3 personal fouls)   FT 1/1: GOOD Malcolm Herro makes 1/1 from the line.
Score: 15-2

[07:01] Team_088 possession (Score: 15-2)
Josh Duncan attempts a 3Pt. Contested by Jaren Johnson (3.7 feet, ZONE). JOSH DUNCAN MAKES IT! Assist: Tyler Hyland
Score: 15-5

[06:42] Team_068 possession (Score: 15-5)
FOUL! Shooting foul on Giannis Smith. Nikola Ginobili to the line for 2 free throws. [BONUS: 6 team fouls] (Giannis Smith: 4 personal fouls)   FT 1/2: MISS   FT 2/2: GOOD Nikola Ginobili makes 1/2 from the line.
Score: 16-5

[06:27] Team_088 possession (Score: 16-5)
Giannis Smith throws a bad pass out of bounds! TURNOVER! (dead ball)

[06:14] Team_068 possession (Score: 16-5)
Malcolm Herro makes the 3Pt and draws the foul on Tobias Haliburton! And-1! Malcolm Herro to the line for 1. [BONUS: 7 team fouls] (Tobias Haliburton: 2 personal fouls)   FT 1/1: GOOD Malcolm Herro makes 1/1 from the line.
Score: 20-5

[06:00] Team_088 possession (Score: 20-5)
Tyler Hyland attempts a Layup. Contested by Gary Simons (3.1 feet, ZONE). TYLER HYLAND MAKES IT!
Score: 20-7

[05:45] Team_068 possession (Score: 20-7)
Jaren Johnson attempts a Layup. Contested by Tyler Hyland (5.0 feet, MAN). Jaren Johnson misses. Offensive rebound by Jaren Johnson! Jaren Johnson kicks it out.

[05:32] Team_068 possession (Score: 20-7)
Zion Anunoby attempts a 3Pt. Contested by Josh Duncan (5.7 feet, MAN). Zion Anunoby misses. Rebound secured by Allen Ming.

[05:19] Team_088 possession (Score: 20-7)
Tyler Hyland attempts a 3Pt. Contested by Zion Anunoby (4.3 feet, ZONE). TYLER HYLAND MAKES IT! Assist: Josh Duncan
Score: 20-10

[04:59] Team_068 possession (Score: 20-10)
FOUL! Shooting foul on Allen Ming. Nikola Ginobili to the line for 2 free throws. [BONUS: 8 team fouls] (Allen Ming: 2 personal fouls)   FT 1/2: GOOD   FT 2/2: GOOD Nikola Ginobili makes 2/2 from the line.
Score: 22-10

[04:50] Team_088 possession (Score: 22-10)
Giannis Smith makes the Dunk and draws the foul on Malcolm Herro! And-1! Giannis Smith to the line for 1. [Team fouls: 3] (Malcolm Herro: 1 personal fouls)   FT 1/1: GOOD Giannis Smith makes 1/1 from the line.
Score: 22-13

[04:35] Team_068 possession (Score: 22-13)
Malcolm Herro attempts a 3Pt. Contested by Giannis Smith (4.1 feet, ZONE). Malcolm Herro misses. Rebound secured by Allen Ming.

[04:20] Team_088 possession (Score: 22-13)
Tobias Haliburton makes the Midrange and draws the foul on Gary Simons! And-1! Tobias Haliburton to the line for 1. [Team fouls: 4] (Gary Simons: 2 personal fouls)   FT 1/1: MISS Tobias Haliburton makes 0/1 from the line. Rebound secured by Nikola Ginobili.
Score: 22-15

[04:06] Team_068 possession (Score: 22-15)
Malcolm Herro drives, Tobias Haliburton stays with him. Malcolm Herro attempts a Dunk. Contested by Tobias Haliburton (5.1 feet, MAN). MALCOLM HERRO MAKES IT! Assist: Zion Anunoby
Score: 24-15

[03:48] Team_088 possession (Score: 24-15)
Tyler Hyland attempts a Layup. Contested by Jaren Johnson (3.6 feet, MAN). TYLER HYLAND MAKES IT! Assist: Giannis Smith
Score: 24-17

[03:35] Team_068 possession (Score: 24-17)
FOUL! Shooting foul on Allen Ming. Zion Anunoby to the line for 2 free throws. [BONUS: 9 team fouls] (Allen Ming: 3 personal fouls)   FT 1/2: MISS   FT 2/2: GOOD Zion Anunoby makes 1/2 from the line.
Score: 25-17

[03:16] Team_088 possession (Score: 25-17)
Tobias Haliburton attempts a 3Pt. Contested by Malcolm Herro (4.4 feet, MAN). Tobias Haliburton misses. Rebound secured by Nikola Ginobili.

[03:04] Team_068 possession (Score: 25-17)
Malcolm Herro attempts a 3Pt. Contested by Tobias Haliburton (5.2 feet, MAN). Malcolm Herro misses. Rebound secured by Giannis Smith.

[02:49] Team_088 possession (Score: 25-17)
Giannis Smith throws a bad pass! Stolen by Gary Simons! TURNOVER! (live ball)

[02:30] Team_068 possession (Score: 25-17)
Nikola Ginobili makes the Dunk and draws the foul on Tobias Haliburton! And-1! Nikola Ginobili to the line for 1. [BONUS: 10 team fouls] (Tobias Haliburton: 3 personal fouls)   FT 1/1: GOOD Nikola Ginobili makes 1/1 from the line.
Score: 28-17

[02:17] Team_088 possession (Score: 28-17)
Josh Duncan attempts a 3Pt. Contested by Zion Anunoby (4.7 feet, MAN). Josh Duncan misses. Rebound secured by Gary Simons.

[02:06] Team_068 possession (Score: 28-17)
Zion Anunoby attempts a Midrange. Contested by Josh Duncan (6.0 feet, MAN). ZION ANUNOBY MAKES IT! Assist: Nikola Ginobili
Score: 30-17

[01:53] Team_088 possession (Score: 30-17)
Giannis Smith drives to the basket... Giannis Smith throws a bad pass! Stolen by Gary Simons! TURNOVER! (live ball)

[01:36] Team_068 possession (Score: 30-17)
Nikola Ginobili attempts a Layup. Contested by Giannis Smith (4.5 feet, ZONE). NIKOLA GINOBILI MAKES IT!
Score: 32-17

[01:21] Team_088 possession (Score: 32-17)
FOUL! Offensive foul on Giannis Smith! Gary Simons drew the charge! [Team fouls: 11] (Giannis Smith: 5 personal fouls) TURNOVER! (dead ball)

[01:04] Team_068 possession (Score: 32-17)
Gary Simons attempts a Midrange. Wide open! Tobias Haliburton is 6.2 feet away. [ZONE] GARY SIMONS MAKES IT!
Score: 34-17

[00:53] Team_088 possession (Score: 34-17)
Allen Ming attempts a Midrange. Contested by Nikola Ginobili (4.8 feet, MAN). Allen Ming misses. Rebound secured by Nikola Ginobili.

[00:38] Team_068 possession (Score: 34-17)
FOUL! Shooting foul on Tyler Hyland. Zion Anunoby to the line for 2 free throws. [BONUS: 12 team fouls] (Tyler Hyland: 1 personal fouls)   FT 1/2: GOOD   FT 2/2: GOOD Zion Anunoby makes 2/2 from the line.
Score: 36-17

[00:23] Team_088 possession (Score: 36-17)
Giannis Smith drives to the basket... Giannis Smith commits a violation (traveling/carry)! TURNOVER! (dead ball)

[00:23] Substitution (Team_068): Zion Anunoby OUT → Cole Anthony IN (stamina_rule2)

[00:23] Substitution (Team_068): Malcolm Herro OUT → Ja Banchero IN (stamina_rule2)

[00:23] Substitution (Team_068): Jaren Johnson OUT → Miles Murray IN (stamina_rule2)

[00:23] Substitution (Team_068): Gary Simons OUT → Jarrett Oladipo IN (stamina_rule2)

[00:23] Substitution (Team_068): Nikola Ginobili OUT → Franz Curry IN (stamina_rule2)

[00:23] Substitution (Team_088): Josh Duncan OUT → Klay Quickley IN (stamina_rule2)

[00:23] Substitution (Team_088): Tobias Haliburton OUT → Vince Carter IN (stamina_rule2)

[00:23] Substitution (Team_088): Tyler Hyland OUT → Pau Bird IN (stamina_rule2)

[00:23] Substitution (Team_088): Giannis Smith OUT → Zion Harris IN (stamina_rule2)

[00:23] Substitution (Team_088): Allen Ming OUT → Josh Embiid IN (stamina_rule2)

[00:08] Team_068 possession (Score: 36-17)
Cole Anthony attempts a 3Pt. Contested by Pau Bird (4.9 feet, ZONE). Cole Anthony misses. Rebound secured by Zion Harris.

================================================================================
                              1ST QUARTER COMPLETE                              
================================================================================

1ST QUARTER SCORE: Team_068 36, Team_088 17

BOX SCORE:
================================================================================

Team_068
--------------------------------------------------------------------------------
Player                MIN  PTS  REB  AST  TO      FG   FG%      3P   3P%
--------------------------------------------------------------------------------
Malcolm Herro          12   15    0    0   0   5/8    62.5     0/0   0.0
Nikola Ginobili        12    8    5    2   0   4/4   100.0     0/0   0.0
Gary Simons            12    5    2    0   0   2/4    50.0     0/0   0.0
Zion Anunoby           12    5    0    1   0   3/4    75.0     0/0   0.0
Jaren Johnson          12    3    5    1   0   1/1   100.0     0/0   0.0
Cole Anthony            0    0    0    0   0   0/1     0.0     0/0   0.0

TEAM: FG: 15/22 (68.2%), 3PT: 3/8 (37.5%), REB: 11 (3 off, 8 def), AST: 4, TO: 2
TEAM FOULS: 4


Team_088
--------------------------------------------------------------------------------
Player                MIN  PTS  REB  AST  TO      FG   FG%      3P   3P%
--------------------------------------------------------------------------------
Tyler Hyland           12    7    1    1   0   3/3   100.0     0/0   0.0
Giannis Smith          12    3    2    1   0   1/5    20.0     0/0   0.0
Josh Duncan            12    3    0    1   0   1/2    50.0     0/0   0.0
Allen Ming             12    2    3    0   0   1/3    33.3     0/0   0.0
Tobias Haliburton      12    0    0    0   0   0/3     0.0     0/0   0.0
Zion Harris             0    0    1    0   0   0/0     0.0     0/0   0.0

TEAM: FG: 6/16 (37.5%), 3PT: 2/6 (33.3%), REB: 8 (1 off, 7 def), AST: 3, TO: 7
TEAM FOULS: 12 [Team_068 in BONUS]

================================================================================

================================================================================
                       2ND QUARTER - Team_068 vs Team_088                       
================================================================================

[12:00] Team_068 possession (Score: 36-17)
Zion Anunoby drives and kicks out. Nikola Ginobili attempts a 3Pt. Contested by Allen Ming (4.6 feet, MAN). Nikola Ginobili misses. Rebound secured by Tyler Hyland.

[11:46] Team_088 possession (Score: 36-17)
Allen Ming attempts a Layup. Contested by Gary Simons (3.8 feet, ZONE). Allen Ming misses. Rebound secured by Nikola Ginobili.

[11:33] Team_068 possession (Score: 36-17)
Gary Simons attempts a 3Pt. Wide open! Tobias Haliburton is 6.1 feet away. [ZONE] GARY SIMONS MAKES IT! Assist: Zion Anunoby
Score: 39-17

[11:16] Team_088 possession (Score: 39-17)
FOUL! Shooting foul on Malcolm Herro. Tobias Haliburton to the line for 2 free throws. [Team fouls: 1] (Malcolm Herro: 1 personal fouls)   FT 1/2: GOOD   FT 2/2: GOOD Tobias Haliburton makes 2/2 from the line.
Score: 39-19

[11:07] Team_068 possession (Score: 39-19)
FOUL! Shooting foul on Allen Ming. Nikola Ginobili to the line for 2 free throws. [Team fouls: 1] (Allen Ming: 1 personal fouls)   FT 1/2: GOOD   FT 2/2: MISS Nikola Ginobili makes 1/2 from the line. Rebound secured by Giannis Smith.
Score: 40-19

[10:51] Team_088 possession (Score: 40-19)
Tobias Haliburton attempts a Layup. BLOCKED BY GARY SIMONS! Ball is loose! Rebound secured by Jaren Johnson.

[10:39] Team_068 possession (Score: 40-19)
Malcolm Herro attempts a 3Pt. Contested by Tobias Haliburton (5.4 feet, MAN). Malcolm Herro misses. Rebound secured by Giannis Smith.

[10:21] Team_088 possession (Score: 40-19)
FOUL! Shooting foul on Malcolm Herro. Tobias Haliburton to the line for 2 free throws. [Team fouls: 2] (Malcolm Herro: 2 personal fouls)   FT 1/2: GOOD   FT 2/2: GOOD Tobias Haliburton makes 2/2 from the line.
Score: 40-21

[10:08] Team_068 possession (Score: 40-21)
Jaren Johnson drives and kicks out. Gary Simons attempts a Midrange. Contested by Giannis Smith (4.7 feet, MAN). Gary Simons misses. Rebound secured by Allen Ming.

[09:56] Team_088 possession (Score: 40-21)
Allen Ming attempts a Midrange. Contested by Gary Simons (4.0 feet, ZONE). ALLEN MING MAKES IT! Assist: Josh Duncan
Score: 40-23

[09:43] Team_068 possession (Score: 40-23)
Nikola Ginobili attempts a Layup. BLOCKED BY ALLEN MING! Ball is loose! Rebound secured by Tyler Hyland.

[09:30] Team_088 possession (Score: 40-23)
Giannis Smith drives to the basket... Giannis Smith loses the ball! Stripped by Gary Simons! TURNOVER! (live ball)

[09:16] Team_068 possession (Score: 40-23)
Gary Simons drives, Giannis Smith stays with him. Gary Simons attempts a Dunk. Contested by Giannis Smith (5.5 feet, MAN). GARY SIMONS MAKES IT! Assist: Malcolm Herro
Score: 42-23

[08:56] Team_088 possession (Score: 42-23)
Josh Duncan attempts a 3Pt. Contested by Zion Anunoby (4.9 feet, ZONE). JOSH DUNCAN MAKES IT! Assist: Tobias Haliburton
Score: 42-26

[08:41] Team_068 possession (Score: 42-26)
Jaren Johnson attempts a 3Pt. Contested by Tyler Hyland (5.6 feet, MAN). Jaren Johnson misses. Rebound secured by Giannis Smith.

[08:25] Team_088 possession (Score: 42-26)
Allen Ming attempts a Layup. Contested by Nikola Ginobili (5.1 feet, MAN). ALLEN MING MAKES IT! Assist: Tyler Hyland
Score: 42-28

[08:14] Team_068 possession (Score: 42-28)
Nikola Ginobili attempts a Midrange. Contested by Allen Ming (5.1 feet, MAN). Nikola Ginobili misses. Rebound secured by Allen Ming.

[08:00] Team_088 possession (Score: 42-28)
Allen Ming attempts a Midrange. Contested by Zion Anunoby (5.2 feet, ZONE). ALLEN MING MAKES IT! Assist: Tyler Hyland
Score: 42-30

[07:44] Team_068 possession (Score: 42-30)
Nikola Ginobili makes the Layup and draws the foul on Giannis Smith! And-1! Nikola Ginobili to the line for 1. [Team fouls: 2] (Giannis Smith: 1 personal fouls)   FT 1/1: MISS Nikola Ginobili makes 0/1 from the line. Rebound secured by Allen Ming.
Score: 44-30

[07:28] Team_088 possession (Score: 44-30)
Tobias Haliburton attempts a 3Pt. Contested by Gary Simons (4.3 feet, ZONE). TOBIAS HALIBURTON MAKES IT! Assist: Josh Duncan
Score: 44-33

[07:16] Team_068 possession (Score: 44-33)
Malcolm Herro attempts a 3Pt. Contested by Tobias Haliburton (5.8 feet, MAN). Malcolm Herro misses. Rebound secured by Tyler Hyland.

[07:00] Team_088 possession (Score: 44-33)
Allen Ming drives to the basket... Allen Ming loses control! Ball rolls out of bounds! TURNOVER! (dead ball)

[07:00] Substitution (Team_068): Zion Anunoby OUT → Cole Anthony IN (stamina_rule2)

[07:00] Substitution (Team_068): Malcolm Herro OUT → Ja Banchero IN (stamina_rule2)

[07:00] Substitution (Team_068): Jaren Johnson OUT → Miles Murray IN (stamina_rule2)

[07:00] Substitution (Team_068): Gary Simons OUT → Jarrett Oladipo IN (stamina_rule2)

[07:00] Substitution (Team_068): Nikola Ginobili OUT → Franz Curry IN (stamina_rule2)

[07:00] Substitution (Team_088): Josh Duncan OUT → Klay Quickley IN (stamina_rule2)

[07:00] Substitution (Team_088): Tobias Haliburton OUT → Vince Carter IN (stamina_rule2)

[07:00] Substitution (Team_088): Tyler Hyland OUT → Pau Bird IN (stamina_rule2)

[07:00] Substitution (Team_088): Giannis Smith OUT → Zion Harris IN (stamina_rule2)

[07:00] Substitution (Team_088): Allen Ming OUT → Josh Embiid IN (stamina_rule2)

[06:42] Team_068 possession (Score: 44-33)
FOUL! Shooting foul on Klay Quickley. Cole Anthony to the line for 2 free throws. [Team fouls: 3] (Klay Quickley: 1 personal fouls)   FT 1/2: GOOD   FT 2/2: GOOD Cole Anthony makes 2/2 from the line.
Score: 46-33

[06:31] Team_088 possession (Score: 46-33)
Klay Quickley makes the Layup and draws the foul on Cole Anthony! And-1! Klay Quickley to the line for 1. [Team fouls: 3] (Cole Anthony: 1 personal fouls)   FT 1/1: GOOD Klay Quickley makes 1/1 from the line.
Score: 46-36

[06:16] Team_068 possession (Score: 46-36)
Cole Anthony attempts a 3Pt. Contested by Pau Bird (4.9 feet, ZONE). Cole Anthony misses. FOUL! Loose ball foul on Pau Bird during the rebound battle. [Team fouls: 4] No free throws, side out. (Pau Bird: 1 personal fouls)

[06:00] Team_068 possession (Score: 46-36)
FOUL! Holding foul on Vince Carter. [IN THE BONUS! 5 team fouls] Ja Banchero to the line for 2 free throws. (Vince Carter: 1 personal fouls)   FT 1/2: GOOD   FT 2/2: MISS Ja Banchero makes 1/2 from the line. Rebound secured by Josh Embiid.
Score: 47-36

[05:46] Team_088 possession (Score: 47-36)
Josh Embiid drives to the basket... Josh Embiid commits a violation (traveling/carry)! TURNOVER! (dead ball)

[05:30] Team_068 possession (Score: 47-36)
Ja Banchero makes the Layup and draws the foul on Zion Harris! And-1! Ja Banchero to the line for 1. [BONUS: 6 team fouls] (Zion Harris: 1 personal fouls)   FT 1/1: MISS Ja Banchero makes 0/1 from the line. Offensive rebound by Jarrett Oladipo! Jarrett Oladipo kicks it out.
Score: 49-36

[05:19] Team_068 possession (Score: 49-36)
Ja Banchero throws a bad pass out of bounds! TURNOVER! (dead ball)

[05:04] Team_088 possession (Score: 49-36)
Klay Quickley attempts a Layup. Contested by Franz Curry (4.4 feet, ZONE). Klay Quickley misses. Offensive rebound by Pau Bird! Pau Bird kicks it out.

[04:51] Team_088 possession (Score: 49-36)
Pau Bird attempts a 3Pt. Contested by Ja Banchero (5.4 feet, ZONE). Pau Bird misses. Rebound secured by Jarrett Oladipo.

[04:33] Team_068 possession (Score: 49-36)
Cole Anthony attempts a 3Pt. Contested by Pau Bird (4.9 feet, ZONE). COLE ANTHONY MAKES IT! Assist: Miles Murray
Score: 52-36

[04:20] Team_088 possession (Score: 52-36)
Josh Embiid drives and kicks out. Pau Bird attempts a 3Pt. Contested by Miles Murray (3.9 feet, MAN). Pau Bird misses. Rebound secured by Ja Banchero.

[04:09] Team_068 possession (Score: 52-36)
Cole Anthony attempts a 3Pt. Contested by Pau Bird (4.9 feet, ZONE). Cole Anthony misses. Rebound secured by Josh Embiid.

[03:55] Team_088 possession (Score: 52-36)
FOUL! Shooting foul on Miles Murray. Klay Quickley to the line for 2 free throws. [Team fouls: 4] (Miles Murray: 1 personal fouls)   FT 1/2: GOOD   FT 2/2: GOOD Klay Quickley makes 2/2 from the line.
Score: 52-38

[03:45] Team_068 possession (Score: 52-38)
Franz Curry drives and kicks out. Cole Anthony attempts a 3Pt. Contested by Pau Bird (5.0 feet, ZONE). Cole Anthony misses. Rebound secured by Pau Bird.

[03:33] Team_088 possession (Score: 52-38)
Klay Quickley attempts a 3Pt. Contested by Cole Anthony (4.8 feet, MAN). Klay Quickley misses. Rebound secured by Jarrett Oladipo.

[03:17] Team_068 possession (Score: 52-38)
Miles Murray drives, picks up Zion Harris. Help arrives from Klay Quickley! Miles Murray attempts a Dunk. Contested by Klay Quickley (5.9 feet, ZONE). MILES MURRAY MAKES IT! Assist: Franz Curry
Score: 54-38

[03:02] Team_088 possession (Score: 54-38)
Josh Embiid drives and kicks out. Josh Embiid attempts a 3Pt. Contested by Franz Curry (4.3 feet, MAN). Josh Embiid misses. Rebound secured by Franz Curry.

[02:47] Team_068 possession (Score: 54-38)
Ja Banchero drives, picks up Zion Harris. Help arrives from Klay Quickley! Ja Banchero attempts a Layup. Contested by Klay Quickley (5.9 feet, ZONE). JA BANCHERO MAKES IT!
Score: 56-38

[02:31] Team_088 possession (Score: 56-38)
Vince Carter makes the Midrange and draws the foul on Ja Banchero! And-1! Vince Carter to the line for 1. [BONUS: 5 team fouls] (Ja Banchero: 1 personal fouls)   FT 1/1: GOOD Vince Carter makes 1/1 from the line.
Score: 56-41

[02:18] Team_068 possession (Score: 56-41)
Franz Curry drives to the basket... Franz Curry throws a bad pass out of bounds! TURNOVER! (dead ball)

[02:01] Team_088 possession (Score: 56-41)
Klay Quickley attempts a 3Pt. Contested by Cole Anthony (4.8 feet, MAN). Klay Quickley misses. FOUL! Loose ball foul on Ja Banchero during the rebound battle. [IN THE BONUS! 6 team fouls] Pau Bird to the line for 2 free throws. (Ja Banchero: 2 personal fouls)   FT 1/2: GOOD   FT 2/2: MISS Pau Bird makes 1/2 from the line. Rebound secured by Jarrett Oladipo.
Score: 56-42

[01:47] Team_068 possession (Score: 56-42)
Jarrett Oladipo makes the Layup and draws the foul on Zion Harris! And-1! Jarrett Oladipo to the line for 1. [BONUS: 7 team fouls] (Zion Harris: 2 personal fouls)   FT 1/1: GOOD Jarrett Oladipo makes 1/1 from the line.
Score: 59-42

[01:27] Team_088 possession (Score: 59-42)
Josh Embiid drives to the basket... Josh Embiid throws a bad pass! Stolen by Franz Curry! TURNOVER! (live ball)

[01:14] Team_068 possession (Score: 59-42)
Ja Banchero attempts a Layup. BLOCKED BY PAU BIRD! Ball is loose! Offensive rebound by Jarrett Oladipo! Jarrett Oladipo kicks it out.

[00:58] Team_068 possession (Score: 59-42)
Cole Anthony attempts a 3Pt. Contested by Pau Bird (4.9 feet, ZONE). Cole Anthony misses. Rebound secured by Zion Harris.

[00:41] Team_088 possession (Score: 59-42)
Josh Embiid drives to the basket... Josh Embiid commits a violation (traveling/carry)! TURNOVER! (dead ball)

[00:28] Team_068 possession (Score: 59-42)
Franz Curry drives, Zion Harris stays with him. Franz Curry attempts a Dunk. Wide open! Zion Harris is 6.3 feet away. [ZONE] FRANZ CURRY MAKES IT!
Score: 61-42

[00:12] Team_088 possession (Score: 61-42)
Klay Quickley attempts a Midrange. Contested by Ja Banchero (5.2 feet, ZONE). Klay Quickley misses. Offensive rebound by Josh Embiid! Josh Embiid kicks it out.

================================================================================
                              2ND QUARTER COMPLETE                              
================================================================================

2ND QUARTER SCORE: Team_068 25, Team_088 25

BOX SCORE:
================================================================================

Team_068
--------------------------------------------------------------------------------
Player                MIN  PTS  REB  AST  TO      FG   FG%      3P   3P%
--------------------------------------------------------------------------------
Gary Simons            17    5    0    0   0   2/2   100.0     0/0   0.0
Cole Anthony            7    5    0    0   0   2/4    50.0     0/0   0.0
Jarrett Oladipo         7    3    6    0   0   1/1   100.0     0/0   0.0
Miles Murray            7    2    0    1   0   1/1   100.0     0/0   0.0
Ja Banchero             7    2    1    0   0   1/1   100.0     0/0   0.0
Franz Curry             7    2    1    1   0   1/2    50.0     0/0   0.0
Zion Anunoby           17    0    0    1   0   0/1     0.0     0/0   0.0
Nikola Ginobili        17    0    1    0   0   0/4     0.0     0/0   0.0
Jaren Johnson          17    0    1    0   0   0/2     0.0     0/0   0.0
Malcolm Herro          17    0    0    1   0   0/2     0.0     0/0   0.0

TEAM: FG: 8/21 (38.1%), 3PT: 2/7 (28.6%), REB: 9 (3 off, 6 def), AST: 4, TO: 2
TEAM FOULS: 6 [Team_088 in BONUS]


Team_088
--------------------------------------------------------------------------------
Player                MIN  PTS  REB  AST  TO      FG   FG%      3P   3P%
--------------------------------------------------------------------------------
Tobias Haliburton      17    7    0    1   0   3/4    75.0     0/0   0.0
Allen Ming             17    6    3    0   0   3/4    75.0     0/0   0.0
Klay Quickley           7    5    0    0   0   2/4    50.0     0/0   0.0
Josh Duncan            17    3    0    2   0   1/1   100.0     0/0   0.0
Vince Carter            7    3    0    0   0   1/1   100.0     0/0   0.0
Tyler Hyland           17    0    3    2   0   0/0     0.0     0/0   0.0
Giannis Smith          17    0    3    0   0   0/0     0.0     0/0   0.0
Josh Embiid             7    0    3    0   0   0/2     0.0     0/0   0.0
Pau Bird                7    0    2    0   0   0/1     0.0     0/0   0.0
Zion Harris             7    0    1    0   0   0/0     0.0     0/0   0.0

TEAM: FG: 10/17 (58.8%), 3PT: 2/5 (40.0%), REB: 16 (3 off, 13 def), AST: 5, TO: 5
TEAM FOULS: 8 [Team_068 in BONUS]

================================================================================

================================================================================
                       3RD QUARTER - Team_068 vs Team_088                       
================================================================================

[12:00] Team_068 possession (Score: 61-42)
FOUL! Offensive foul on Jaren Johnson! Tyler Hyland drew the charge! [Team fouls: 1] (Jaren Johnson: 1 personal fouls) TURNOVER! (dead ball)

[11:44] Team_088 possession (Score: 61-42)
Giannis Smith attempts a Midrange. Contested by Gary Simons (3.4 feet, MAN). Giannis Smith misses. Rebound secured by Jaren Johnson.

[11:31] Team_068 possession (Score: 61-42)
Zion Anunoby attempts a Midrange. Contested by Josh Duncan (5.7 feet, MAN). Zion Anunoby misses. Offensive rebound by Nikola Ginobili! Nikola Ginobili puts it back in!
Score: 63-42

[11:17] Team_088 possession (Score: 63-42)
Josh Duncan drives, Gary Simons stays with him. Josh Duncan attempts a Layup. Contested by Gary Simons (3.2 feet, ZONE). Josh Duncan misses. Rebound secured by Nikola Ginobili.

[11:03] Team_068 possession (Score: 63-42)
Jaren Johnson makes the Layup and draws the foul on Tyler Hyland! And-1! Jaren Johnson to the line for 1. [Team fouls: 1] (Tyler Hyland: 1 personal fouls)   FT 1/1: GOOD Jaren Johnson makes 1/1 from the line.
Score: 66-42

[10:49] Team_088 possession (Score: 66-42)
FOUL! Shooting foul on Zion Anunoby. Josh Duncan to the line for 3 free throws. [Team fouls: 2] (Zion Anunoby: 1 personal fouls)   FT 1/3: GOOD   FT 2/3: GOOD   FT 3/3: GOOD Josh Duncan makes 3/3 from the line.
Score: 66-45

[10:36] Team_068 possession (Score: 66-45)
Jaren Johnson makes the Midrange and draws the foul on Tyler Hyland! And-1! Jaren Johnson to the line for 1. [Team fouls: 2] (Tyler Hyland: 2 personal fouls)   FT 1/1: GOOD Jaren Johnson makes 1/1 from the line.
Score: 69-45

[10:25] Team_088 possession (Score: 69-45)
Tyler Hyland attempts a 3Pt. Contested by Jaren Johnson (3.5 feet, MAN). Tyler Hyland misses. Rebound secured by Jaren Johnson.

[10:07] Team_068 possession (Score: 69-45)
Gary Simons makes the Layup and draws the foul on Giannis Smith! And-1! Gary Simons to the line for 1. [Team fouls: 3] (Giannis Smith: 1 personal fouls)   FT 1/1: GOOD Gary Simons makes 1/1 from the line.
Score: 72-45

[09:53] Team_088 possession (Score: 72-45)
Tobias Haliburton attempts a 3Pt. Contested by Malcolm Herro (4.2 feet, MAN). TOBIAS HALIBURTON MAKES IT! Assist: Josh Duncan
Score: 72-48

[09:43] Team_068 possession (Score: 72-48)
Gary Simons attempts a 3Pt. Contested by Giannis Smith (4.8 feet, MAN). GARY SIMONS MAKES IT! Assist: Nikola Ginobili
Score: 75-48

[09:24] Team_088 possession (Score: 75-48)
Tobias Haliburton throws a bad pass out of bounds! TURNOVER! (dead ball)

[09:10] Team_068 possession (Score: 75-48)
Gary Simons attempts a Midrange. Contested by Tyler Hyland (5.3 feet, ZONE). GARY SIMONS MAKES IT!
Score: 77-48

[08:51] Team_088 possession (Score: 77-48)
Giannis Smith attempts a Layup. Contested by Gary Simons (3.4 feet, ZONE). GIANNIS SMITH MAKES IT!
Score: 77-50

[08:36] Team_068 possession (Score: 77-50)
Malcolm Herro attempts a Midrange. Contested by Tobias Haliburton (5.0 feet, MAN). Malcolm Herro misses. Rebound secured by Allen Ming.

[08:21] Team_088 possession (Score: 77-50)
Giannis Smith drives to the basket... Giannis Smith commits a violation (traveling/carry)! TURNOVER! (dead ball)

[08:06] Team_068 possession (Score: 77-50)
Jaren Johnson attempts a 3Pt. Contested by Giannis Smith (4.4 feet, ZONE). Jaren Johnson misses. Rebound secured by Tyler Hyland.

[07:53] Team_088 possession (Score: 77-50)
FOUL! Reach-in foul on Jaren Johnson during the drive. [Team fouls: 3] No free throws, side out. (Jaren Johnson: 2 personal fouls)

[07:38] Team_088 possession (Score: 77-50)
Josh Duncan makes the Layup and draws the foul on Gary Simons! And-1! Josh Duncan to the line for 1. [Team fouls: 4] (Gary Simons: 1 personal fouls)   FT 1/1: GOOD Josh Duncan makes 1/1 from the line.
Score: 77-53

[07:20] Team_068 possession (Score: 77-53)
Gary Simons drives, picks up Giannis Smith. Help arrives from Tobias Haliburton! Gary Simons attempts a Layup. Contested by Tobias Haliburton (4.8 feet, ZONE). Gary Simons misses. Rebound secured by Giannis Smith.

[07:08] Team_088 possession (Score: 77-53)
Josh Duncan drives, Gary Simons stays with him. Josh Duncan attempts a Layup. Contested by Gary Simons (3.2 feet, ZONE). JOSH DUNCAN MAKES IT!
Score: 77-55

[06:53] Team_068 possession (Score: 77-55)
Zion Anunoby attempts a 3Pt. Contested by Tobias Haliburton (5.4 feet, ZONE). Zion Anunoby misses. Rebound secured by Allen Ming.

[06:40] Team_088 possession (Score: 77-55)
FOUL! Reach-in foul on Gary Simons during the drive. [IN THE BONUS! 5 team fouls] Giannis Smith to the line for 2 free throws. (Gary Simons: 2 personal fouls)   FT 1/2: GOOD   FT 2/2: GOOD Giannis Smith makes 2/2 from the line.
Score: 77-57

[06:21] Team_068 possession (Score: 77-57)
Jaren Johnson throws a bad pass out of bounds! TURNOVER! (dead ball)

[06:12] Team_088 possession (Score: 77-57)
Giannis Smith attempts a Midrange. Contested by Gary Simons (3.4 feet, MAN). Giannis Smith misses. Rebound secured by Jaren Johnson.

[05:56] Team_068 possession (Score: 77-57)
Gary Simons loses the ball! Stripped by Giannis Smith! TURNOVER! (live ball)

[05:40] Team_088 possession (Score: 77-57)
Allen Ming attempts a Midrange. Contested by Nikola Ginobili (4.3 feet, MAN). ALLEN MING MAKES IT! Assist: Tobias Haliburton
Score: 77-59

[05:26] Team_068 possession (Score: 77-59)
Malcolm Herro attempts a 3Pt. Contested by Tobias Haliburton (5.0 feet, ZONE). MALCOLM HERRO MAKES IT! Assist: Zion Anunoby
Score: 80-59

[05:15] Team_088 possession (Score: 80-59)
Tyler Hyland attempts a 3Pt. Contested by Zion Anunoby (4.3 feet, ZONE). Tyler Hyland misses. Rebound secured by Nikola Ginobili.

[05:00] Team_068 possession (Score: 80-59)
Zion Anunoby drives and kicks out. Gary Simons attempts a 3Pt. Contested by Tobias Haliburton (5.1 feet, ZONE). Gary Simons misses. Rebound secured by Allen Ming.

[04:51] Team_088 possession (Score: 80-59)
Josh Duncan attempts a Midrange. Contested by Jaren Johnson (3.7 feet, ZONE). Josh Duncan misses. Rebound secured by Gary Simons.

[04:36] Team_068 possession (Score: 80-59)
FOUL! Offensive foul on Jaren Johnson! Tyler Hyland drew the charge! [Team fouls: 6] (Jaren Johnson: 3 personal fouls) TURNOVER! (dead ball)

[04:21] Team_088 possession (Score: 80-59)
FOUL! Shooting foul on Malcolm Herro. Tobias Haliburton to the line for 2 free throws. [BONUS: 7 team fouls] (Malcolm Herro: 1 personal fouls)   FT 1/2: GOOD   FT 2/2: MISS Tobias Haliburton makes 1/2 from the line. Offensive rebound by Giannis Smith! Giannis Smith puts it back in!
Score: 80-62

[04:09] Team_068 possession (Score: 80-62)
Nikola Ginobili attempts a Layup. Contested by Giannis Smith (4.2 feet, ZONE). NIKOLA GINOBILI MAKES IT! Assist: Jaren Johnson
Score: 82-62

[03:53] Team_088 possession (Score: 82-62)
Tobias Haliburton attempts a 3Pt. Contested by Zion Anunoby (4.5 feet, ZONE). Tobias Haliburton misses. Offensive rebound by Giannis Smith! Giannis Smith's putback is no good. Offensive rebound by Giannis Smith! Giannis Smith kicks it out.

[03:34] Team_088 possession (Score: 82-62)
Allen Ming attempts a Layup. Contested by Gary Simons (3.6 feet, ZONE). ALLEN MING MAKES IT! Assist: Tyler Hyland
Score: 82-64

[03:21] Team_068 possession (Score: 82-64)
Malcolm Herro throws a bad pass out of bounds! TURNOVER! (dead ball)

[03:21] Substitution (Team_068): Nikola Ginobili OUT → Franz Curry IN (stamina_rule2)

[03:21] Substitution (Team_088): Giannis Smith OUT → Zion Harris IN (stamina_rule2)

[03:21] Substitution (Team_088): Allen Ming OUT → Josh Embiid IN (stamina_rule2)

[03:02] Team_088 possession (Score: 82-64)
Josh Duncan attempts a Midrange. Contested by Gary Simons (3.5 feet, ZONE). JOSH DUNCAN MAKES IT!
Score: 82-66

[02:48] Team_068 possession (Score: 82-66)
Gary Simons drives and kicks out. Jaren Johnson attempts a 3Pt. Contested by Josh Duncan (5.5 feet, ZONE). Jaren Johnson misses. Rebound secured by Tyler Hyland.

[02:34] Team_088 possession (Score: 82-66)
Tyler Hyland attempts a Midrange. Contested by Jaren Johnson (3.7 feet, MAN). TYLER HYLAND MAKES IT!
Score: 82-68

[02:21] Team_068 possession (Score: 82-68)
Zion Anunoby attempts a 3Pt. Contested by Tobias Haliburton (5.7 feet, ZONE). ZION ANUNOBY MAKES IT! Assist: Franz Curry
Score: 85-68

[02:09] Team_088 possession (Score: 85-68)
Josh Embiid drives, Franz Curry stays with him. Josh Embiid attempts a Layup. Contested by Franz Curry (4.2 feet, MAN). JOSH EMBIID MAKES IT! Assist: Josh Duncan
Score: 85-70

[01:55] Team_068 possession (Score: 85-70)
Zion Anunoby attempts a 3Pt. Contested by Tobias Haliburton (5.7 feet, ZONE). ZION ANUNOBY MAKES IT! Assist: Franz Curry
Score: 88-70

[01:39] Team_088 possession (Score: 88-70)
Josh Duncan makes the Layup and draws the foul on Franz Curry! And-1! Josh Duncan to the line for 1. [BONUS: 9 team fouls] (Franz Curry: 1 personal fouls)   FT 1/1: GOOD Josh Duncan makes 1/1 from the line.
Score: 88-73

[01:24] Team_068 possession (Score: 88-73)
Malcolm Herro attempts a 3Pt. Contested by Tobias Haliburton (5.4 feet, ZONE). MALCOLM HERRO MAKES IT! Assist: Franz Curry
Score: 91-73

[01:13] Team_088 possession (Score: 91-73)
Josh Duncan attempts a 3Pt. Contested by Zion Anunoby (4.7 feet, MAN). Josh Duncan misses. Rebound secured by Gary Simons.

[01:00] Team_068 possession (Score: 91-73)
Gary Simons attempts a Midrange. Contested by Tyler Hyland (5.7 feet, ZONE). Gary Simons misses. Rebound secured by Tyler Hyland.

[00:48] Team_088 possession (Score: 91-73)
Josh Embiid throws a bad pass! Stolen by Franz Curry! TURNOVER! (live ball)

[00:34] Team_068 possession (Score: 91-73)
Franz Curry attempts a Layup. Contested by Josh Embiid (5.7 feet, MAN). FRANZ CURRY MAKES IT!
Score: 93-73

[00:20] Team_088 possession (Score: 93-73)
Josh Duncan attempts a 3Pt. Contested by Zion Anunoby (4.8 feet, ZONE). Josh Duncan misses. Rebound secured by Jaren Johnson.

[00:10] Team_068 possession (Score: 93-73)
Zion Anunoby attempts a 3Pt. Wide open! Josh Duncan is 6.2 feet away. [MAN] ZION ANUNOBY MAKES IT! Assist: Jaren Johnson
Score: 96-73

================================================================================
                              3RD QUARTER COMPLETE                              
================================================================================

3RD QUARTER SCORE: Team_068 35, Team_088 31

BOX SCORE:
================================================================================

Team_068
--------------------------------------------------------------------------------
Player                MIN  PTS  REB  AST  TO      FG   FG%      3P   3P%
--------------------------------------------------------------------------------
Zion Anunoby           29    9    0    1   0   3/5    60.0     0/0   0.0
Gary Simons            29    8    2    0   0   3/6    50.0     0/0   0.0
Jaren Johnson          29    6    4    2   0   2/3    66.7     0/0   0.0
Malcolm Herro          29    6    0    0   0   2/3    66.7     0/0   0.0
Nikola Ginobili        26    4    3    1   0   2/2   100.0     0/0   0.0
Franz Curry            10    2    0    3   0   1/1   100.0     0/0   0.0

TEAM: FG: 13/20 (65.0%), 3PT: 6/8 (75.0%), REB: 9 (1 off, 8 def), AST: 7, TO: 5
TEAM FOULS: 9 [Team_088 in BONUS]


Team_088
--------------------------------------------------------------------------------
Player                MIN  PTS  REB  AST  TO      FG   FG%      3P   3P%
--------------------------------------------------------------------------------
Josh Duncan            29   13    0    2   0   5/9    55.6     0/0   0.0
Giannis Smith          26    7    2    0   0   3/5    60.0     0/0   0.0
Allen Ming             26    4    3    0   0   2/2   100.0     0/0   0.0
Tobias Haliburton      29    3    0    1   0   1/1   100.0     0/0   0.0
Tyler Hyland           29    2    3    1   0   1/3    33.3     0/0   0.0
Josh Embiid            10    2    0    0   0   1/1   100.0     0/0   0.0

TEAM: FG: 13/21 (61.9%), 3PT: 2/6 (33.3%), REB: 8 (1 off, 7 def), AST: 4, TO: 3
TEAM FOULS: 3

================================================================================

================================================================================
                       4TH QUARTER - Team_068 vs Team_088                       
================================================================================

[12:00] Team_068 possession (Score: 96-73)
Malcolm Herro attempts a 3Pt. Contested by Tobias Haliburton (5.3 feet, MAN). Malcolm Herro misses. Rebound secured by Giannis Smith.

[11:48] Team_088 possession (Score: 96-73)
Giannis Smith attempts a 3Pt. Contested by Zion Anunoby (4.9 feet, ZONE). Giannis Smith misses. Rebound secured by Gary Simons.

[11:32] Team_068 possession (Score: 96-73)
Zion Anunoby attempts a 3Pt. Contested by Tobias Haliburton (5.8 feet, ZONE). ZION ANUNOBY MAKES IT! Assist: Nikola Ginobili
Score: 99-73

[11:19] Team_088 possession (Score: 99-73)
Allen Ming attempts a 3Pt. Contested by Nikola Ginobili (4.3 feet, MAN). Allen Ming misses. Rebound secured by Nikola Ginobili.

[11:02] Team_068 possession (Score: 99-73)
Zion Anunoby drives, Josh Duncan stays with him. Zion Anunoby attempts a Layup. Wide open! Josh Duncan is 6.1 feet away. [MAN] ZION ANUNOBY MAKES IT! Assist: Gary Simons
Score: 101-73

[10:46] Team_088 possession (Score: 101-73)
Giannis Smith attempts a Layup. Contested by Gary Simons (4.0 feet, MAN). Giannis Smith misses. Rebound secured by Gary Simons.

[10:30] Team_068 possession (Score: 101-73)
Jaren Johnson attempts a 3Pt. Contested by Tyler Hyland (5.4 feet, MAN). JAREN JOHNSON MAKES IT! Assist: Nikola Ginobili
Score: 104-73

[10:16] Team_088 possession (Score: 104-73)
FOUL! Holding foul on Nikola Ginobili. [Team fouls: 1] No free throws, side out. (Nikola Ginobili: 1 personal fouls)

[10:01] Team_088 possession (Score: 104-73)
Allen Ming makes the Layup and draws the foul on Nikola Ginobili! And-1! Allen Ming to the line for 1. [Team fouls: 2] (Nikola Ginobili: 2 personal fouls)   FT 1/1: GOOD Allen Ming makes 1/1 from the line.
Score: 104-76

[09:44] Team_068 possession (Score: 104-76)
FOUL! Shooting foul on Giannis Smith. Gary Simons to the line for 2 free throws. [Team fouls: 1] (Giannis Smith: 1 personal fouls)   FT 1/2: GOOD   FT 2/2: GOOD Gary Simons makes 2/2 from the line.
Score: 106-76

[09:27] Team_088 possession (Score: 106-76)
Tobias Haliburton drives and kicks out. Josh Duncan attempts a 3Pt. Contested by Gary Simons (4.0 feet, ZONE). Josh Duncan misses. Rebound secured by Nikola Ginobili.

[09:09] Team_068 possession (Score: 106-76)
Gary Simons makes the Layup and draws the foul on Giannis Smith! And-1! Gary Simons to the line for 1. [Team fouls: 2] (Giannis Smith: 2 personal fouls)   FT 1/1: GOOD Gary Simons makes 1/1 from the line.
Score: 109-76

[08:57] Team_088 possession (Score: 109-76)
Josh Duncan attempts a Layup. Contested by Nikola Ginobili (4.3 feet, ZONE). JOSH DUNCAN MAKES IT!
Score: 109-78

[08:46] Team_068 possession (Score: 109-78)
Jaren Johnson attempts a 3Pt. Contested by Tyler Hyland (5.6 feet, MAN). Jaren Johnson misses. Rebound secured by Giannis Smith.

[08:32] Team_088 possession (Score: 109-78)
Giannis Smith attempts a Midrange. Contested by Gary Simons (4.4 feet, MAN). Giannis Smith misses. Rebound secured by Jaren Johnson.

[08:18] Team_068 possession (Score: 109-78)
Jaren Johnson attempts a 3Pt. Wide open! Josh Duncan is 6.4 feet away. [ZONE] JAREN JOHNSON MAKES IT! Assist: Nikola Ginobili
Score: 112-78

[08:05] Team_088 possession (Score: 112-78)
Tobias Haliburton attempts a Layup. Contested by Malcolm Herro (5.0 feet, MAN). TOBIAS HALIBURTON MAKES IT! Assist: Josh Duncan
Score: 112-80

[07:55] Team_068 possession (Score: 112-80)
FOUL! Reach-in foul on Josh Duncan during the drive. [Team fouls: 3] No free throws, side out. (Josh Duncan: 1 personal fouls)

[07:41] Team_068 possession (Score: 112-80)
Zion Anunoby attempts a 3Pt. Wide open! Josh Duncan is 6.5 feet away. [MAN] ZION ANUNOBY MAKES IT! Assist: Malcolm Herro
Score: 115-80

[07:28] Team_088 possession (Score: 115-80)
Josh Duncan loses control! Ball rolls out of bounds! TURNOVER! (dead ball)

[07:28] Substitution (Team_068): Zion Anunoby OUT → Cole Anthony IN (stamina_rule2)

[07:28] Substitution (Team_068): Malcolm Herro OUT → Ja Banchero IN (stamina_rule2)

[07:28] Substitution (Team_068): Jaren Johnson OUT → Miles Murray IN (stamina_rule2)

[07:28] Substitution (Team_068): Gary Simons OUT → Jarrett Oladipo IN (stamina_rule2)

[07:28] Substitution (Team_068): Nikola Ginobili OUT → Franz Curry IN (stamina_rule2)

[07:28] Substitution (Team_088): Josh Duncan OUT → Klay Quickley IN (stamina_rule2)

[07:28] Substitution (Team_088): Tobias Haliburton OUT → Vince Carter IN (stamina_rule2)

[07:28] Substitution (Team_088): Tyler Hyland OUT → Pau Bird IN (stamina_rule2)

[07:28] Substitution (Team_088): Giannis Smith OUT → Zion Harris IN (stamina_rule2)

[07:28] Substitution (Team_088): Allen Ming OUT → Josh Embiid IN (stamina_rule2)

[07:15] Team_068 possession (Score: 115-80)
Cole Anthony attempts a Midrange. Contested by Pau Bird (4.9 feet, ZONE). COLE ANTHONY MAKES IT!
Score: 117-80

[07:02] Team_088 possession (Score: 117-80)
Vince Carter attempts a 3Pt. Contested by Ja Banchero (4.9 feet, MAN). VINCE CARTER MAKES IT! Assist: Zion Harris
Score: 117-83

[06:51] Team_068 possession (Score: 117-83)
Cole Anthony attempts a 3Pt. Contested by Zion Harris (5.7 feet, ZONE). Cole Anthony misses. Offensive rebound by Franz Curry! Franz Curry puts it back in!
Score: 119-83

[06:37] Team_088 possession (Score: 119-83)
Klay Quickley attempts a Layup. Contested by Cole Anthony (4.8 feet, MAN). KLAY QUICKLEY MAKES IT!
Score: 119-85

[06:23] Team_068 possession (Score: 119-85)
Jarrett Oladipo attempts a 3Pt. Wide open! Zion Harris is 6.1 feet away. [MAN] Jarrett Oladipo misses. Rebound secured by Pau Bird.

[06:07] Team_088 possession (Score: 119-85)
Klay Quickley loses control! Ball rolls out of bounds! TURNOVER! (dead ball)

[05:57] Team_068 possession (Score: 119-85)
Miles Murray attempts a Midrange. Contested by Pau Bird (5.1 feet, ZONE). Miles Murray misses. Rebound secured by Pau Bird.

[05:42] Team_088 possession (Score: 119-85)
Vince Carter drives to the basket... FOUL! Offensive foul on Vince Carter! Ja Banchero drew the charge! [Team fouls: 4] (Vince Carter: 1 personal fouls) TURNOVER! (dead ball)

[05:28] Team_068 possession (Score: 119-85)
Franz Curry attempts a Dunk. BLOCKED BY JOSH EMBIID! Ball is loose! Rebound secured by Pau Bird.

[05:12] Team_088 possession (Score: 119-85)
Vince Carter drives to the basket... Vince Carter throws a bad pass out of bounds! TURNOVER! (dead ball)

[05:00] Team_068 possession (Score: 119-85)
Jarrett Oladipo attempts a Midrange. Wide open! Zion Harris is 6.1 feet away. [MAN] JARRETT OLADIPO MAKES IT! Assist: Ja Banchero
Score: 121-85

[04:48] Team_088 possession (Score: 121-85)
Pau Bird drives and kicks out. Pau Bird attempts a 3Pt. Contested by Miles Murray (3.9 feet, MAN). Pau Bird misses. Rebound secured by Jarrett Oladipo.

[04:32] Team_068 possession (Score: 121-85)
Cole Anthony attempts a 3Pt. Contested by Pau Bird (4.9 feet, ZONE). Cole Anthony misses. Rebound secured by Pau Bird.

[04:15] Team_088 possession (Score: 121-85)
Vince Carter attempts a Layup. BLOCKED BY JA BANCHERO! Ball is loose! Rebound secured by Franz Curry.

[04:00] Team_068 possession (Score: 121-85)
FOUL! Holding foul on Josh Embiid. [IN THE BONUS! 5 team fouls] Franz Curry to the line for 2 free throws. (Josh Embiid: 1 personal fouls)   FT 1/2: GOOD   FT 2/2: GOOD Franz Curry makes 2/2 from the line.
Score: 123-85

[03:48] Team_088 possession (Score: 123-85)
Zion Harris attempts a Midrange. Contested by Jarrett Oladipo (4.4 feet, MAN). Zion Harris misses. Offensive rebound by Pau Bird! Pau Bird kicks it out.

[03:32] Team_088 possession (Score: 123-85)
Josh Embiid drives to the basket... Josh Embiid throws a bad pass! Stolen by Franz Curry! TURNOVER! (live ball)

[03:20] Team_068 possession (Score: 123-85)
Jarrett Oladipo attempts a Midrange. Wide open! Zion Harris is 6.1 feet away. [MAN] JARRETT OLADIPO MAKES IT! Assist: Cole Anthony
Score: 125-85

[03:03] Team_088 possession (Score: 125-85)
FOUL! Shooting foul on Miles Murray. Vince Carter to the line for 2 free throws. [Team fouls: 3] (Miles Murray: 1 personal fouls)   FT 1/2: MISS   FT 2/2: GOOD Vince Carter makes 1/2 from the line.
Score: 125-86

[02:48] Team_068 possession (Score: 125-86)
FOUL! Holding foul on Zion Harris. [IN THE BONUS! 6 team fouls] Jarrett Oladipo to the line for 2 free throws. (Zion Harris: 1 personal fouls)   FT 1/2: GOOD   FT 2/2: MISS Jarrett Oladipo makes 1/2 from the line. Rebound secured by Zion Harris.
Score: 126-86

[02:33] Team_088 possession (Score: 126-86)
Klay Quickley attempts a 3Pt. Contested by Cole Anthony (4.8 feet, MAN). Klay Quickley misses. Rebound secured by Jarrett Oladipo.

[02:17] Team_068 possession (Score: 126-86)
Cole Anthony attempts a 3Pt. Contested by Pau Bird (4.9 feet, ZONE). COLE ANTHONY MAKES IT! Assist: Franz Curry
Score: 129-86

[02:00] Team_088 possession (Score: 129-86)
FOUL! Reach-in foul on Jarrett Oladipo during the drive. [Team fouls: 4] No free throws, side out. (Jarrett Oladipo: 1 personal fouls)

[01:49] Team_088 possession (Score: 129-86)
Vince Carter attempts a 3Pt. Contested by Ja Banchero (4.9 feet, MAN). VINCE CARTER MAKES IT! Assist: Klay Quickley
Score: 129-89

[01:37] Team_068 possession (Score: 129-89)
Jarrett Oladipo drives to the basket... Jarrett Oladipo throws a bad pass out of bounds! TURNOVER! (dead ball)

[01:23] Team_088 possession (Score: 129-89)
Klay Quickley attempts a Midrange. Contested by Jarrett Oladipo (3.9 feet, ZONE). Klay Quickley misses. Offensive rebound by Josh Embiid! Josh Embiid kicks it out.

[01:09] Team_088 possession (Score: 129-89)
Pau Bird attempts a Midrange. Contested by Miles Murray (4.2 feet, MAN). Pau Bird misses. Offensive rebound by Pau Bird! Pau Bird kicks it out.

[00:57] Team_088 possession (Score: 129-89)
Pau Bird drives, Miles Murray stays with him. Pau Bird attempts a Layup. Contested by Miles Murray (4.2 feet, MAN). PAU BIRD MAKES IT!
Score: 129-91

[00:44] Team_068 possession (Score: 129-91)
Miles Murray attempts a 3Pt. Contested by Pau Bird (5.2 feet, ZONE). MILES MURRAY MAKES IT! Assist: Cole Anthony
Score: 132-91

[00:30] Team_088 possession (Score: 132-91)
Vince Carter attempts a 3Pt. Contested by Jarrett Oladipo (3.6 feet, ZONE). Vince Carter misses. Rebound secured by Franz Curry.

[00:13] Team_068 possession (Score: 132-91)
FOUL! Holding foul on Josh Embiid. [IN THE BONUS! 7 team fouls] Franz Curry to the line for 2 free throws. (Josh Embiid: 2 personal fouls)   FT 1/2: GOOD   FT 2/2: GOOD Franz Curry makes 2/2 from the line.
Score: 134-91

================================================================================
                              4TH QUARTER COMPLETE                              
================================================================================

4TH QUARTER SCORE: Team_068 38, Team_088 18

BOX SCORE:
================================================================================

Team_068
--------------------------------------------------------------------------------
Player                MIN  PTS  REB  AST  TO      FG   FG%      3P   3P%
--------------------------------------------------------------------------------
Zion Anunoby           34    8    0    0   0   3/3   100.0     0/0   0.0
Jaren Johnson          34    6    1    0   0   2/3    66.7     0/0   0.0
Franz Curry            17    6    3    1   0   3/4    75.0     0/0   0.0
Gary Simons            34    5    2    1   0   2/2   100.0     0/0   0.0
Cole Anthony           14    5    0    2   0   2/3    66.7     0/0   0.0
Jarrett Oladipo        14    4    2    0   0   2/3    66.7     0/0   0.0
Miles Murray           14    3    0    0   0   1/2    50.0     0/0   0.0
Malcolm Herro          34    0    0    1   0   0/1     0.0     0/0   0.0
Nikola Ginobili        31    0    2    3   0   0/0     0.0     0/0   0.0
Ja Banchero            14    0    0    1   0   0/0     0.0     0/0   0.0

TEAM: FG: 15/22 (68.2%), 3PT: 7/11 (63.6%), REB: 10 (1 off, 9 def), AST: 9, TO: 1
TEAM FOULS: 4


Team_088
--------------------------------------------------------------------------------
Player                MIN  PTS  REB  AST  TO      FG   FG%      3P   3P%
--------------------------------------------------------------------------------
Vince Carter           14    7    0    0   0   3/5    60.0     0/0   0.0
Allen Ming             31    3    0    0   0   1/2    50.0     0/0   0.0
Tobias Haliburton      34    2    0    0   0   1/2    50.0     0/0   0.0
Josh Duncan            34    2    0    1   0   1/1   100.0     0/0   0.0
Klay Quickley          14    2    0    1   0   1/2    50.0     0/0   0.0
Pau Bird               14    2    6    0   0   1/2    50.0     0/0   0.0
Giannis Smith          31    0    2    0   0   0/3     0.0     0/0   0.0
Zion Harris            17    0    1    1   0   0/0     0.0     0/0   0.0
Josh Embiid            17    0    1    0   0   0/0     0.0     0/0   0.0

TEAM: FG: 8/17 (47.1%), 3PT: 2/6 (33.3%), REB: 10 (3 off, 7 def), AST: 3, TO: 5
TEAM FOULS: 7 [Team_068 in BONUS]

================================================================================

================================================================================
                               FULL GAME COMPLETE                               
================================================================================

FINAL SCORE: Team_068 134, Team_088 91

SCORING BY QUARTER:
--------------------------------------------------------------------------------
Team                     Q1     Q2     Q3     Q4    FINAL
--------------------------------------------------------------------------------
Team_068                 36     25     35     38      134
Team_088                 17     25     31     18       91
--------------------------------------------------------------------------------

FULL GAME BOX SCORE:
================================================================================

Team_068
--------------------------------------------------------------------------------
Player                MIN  PTS  REB  AST  TO      FG   FG%      3P   3P%      FT STL BLK
--------------------------------------------------------------------------------
Zion Anunoby           34   22    0    3   0  10/14   71.4   5/7    71.4   3/4     0   0
Malcolm Herro          34   21    0    2   2   7/14   50.0   4/9    44.4   3/3     0   0
Jaren Johnson          34   15   11    3   3   5/9    55.6   3/6    50.0   2/2     1   0
Gary Simons            34   23    6    1   2   9/14   64.3   2/3    66.7   5/5     3   1
Nikola Ginobili        31   12   11    6   0   5/9    55.6   0/0     0.0   5/8     1   1
Franz Curry            17   10    4    5   0   2/4    50.0   0/0     0.0   4/4     3   0
Cole Anthony           14   10    0    2   0   5/9    55.6   3/7    42.9   2/2     0   0
Ja Banchero            14    2    1    1   2   1/1   100.0   0/0     0.0   1/3     0   1
Miles Murray           14    5    0    1   1   2/3    66.7   1/1   100.0   0/0     0   0
Jarrett Oladipo        14    7    8    0   0   3/4    75.0   0/1     0.0   2/3     0   0

TEAM: FG: 51/85 (60.0%), 3PT: 18/34 (52.9%), REB: 39 (8 off, 31 def), AST: 24, TO: 10


Team_088
--------------------------------------------------------------------------------
Player                MIN  PTS  REB  AST  TO      FG   FG%      3P   3P%      FT STL BLK
--------------------------------------------------------------------------------
Josh Duncan            34   21    0    6   3   8/13   61.5   3/6    50.0   5/5     0   0
Tobias Haliburton      34   12    0    2   3   6/11   54.5   2/3    66.7   5/7     0   0
Tyler Hyland           34    9    7    4   1   4/6    66.7   1/3    33.3   0/0     0   0
Giannis Smith          31   10   10    1   3   3/12   25.0   0/2     0.0   3/3     1   0
Allen Ming             31   15    9    0   2   7/11   63.6   0/2     0.0   3/3     0   1
Zion Harris            17    0    3    1   2   0/0     0.0   0/0     0.0   0/0     0   0
Josh Embiid            17    2    4    0   1   1/3    33.3   0/0     0.0   0/0     0   1
Klay Quickley          14    7    0    1   3   3/6    50.0   0/3     0.0   3/3     0   0
Vince Carter           14   10    0    0   1   4/6    66.7   2/3    66.7   2/3     0   0
Pau Bird               14    2    8    0   1   1/3    33.3   0/1     0.0   1/2     0   1

TEAM: FG: 37/71 (52.1%), 3PT: 8/23 (34.8%), REB: 42 (8 off, 34 def), AST: 15, TO: 20

================================================================================
