================================================================================
                        FULL GAME - Team_070 vs Team_042                        
================================================================================

================================================================================
                       1ST QUARTER - Team_070 vs Team_042                       
================================================================================

[12:00] Team_070 possession (Score: 0-0)
FOUL! Reach-in foul on Dejounte Butler during the drive. [Team fouls: 1] No free throws, side out. (Dejounte Butler: 1 personal fouls)

[11:49] Team_070 possession (Score: 0-0)
Jabari Paul makes the Dunk and draws the foul on Cade Dosunmu! And-1! Jabari Paul to the line for 1. [Team fouls: 2] (Cade Dosunmu: 1 personal fouls)   FT 1/1: GOOD Jabari Paul makes 1/1 from the line.
Score: 3-0

[11:31] Team_042 possession (Score: 3-0)
Cade Dosunmu drives to the basket... FOUL! Offensive foul on Cade Dosunmu! Khris Bryant drew the charge! [Team fouls: 3] (Cade Dosunmu: 2 personal fouls) TURNOVER! (dead ball)

[11:13] Team_070 possession (Score: 3-0)
Cole Gasol attempts a 3Pt. Contested by Tyler Barrett (3.6 feet, MAN). Cole Gasol misses. FOUL! Loose ball foul on Dejounte Butler during the rebound battle. [Team fouls: 4] No free throws, side out. (Dejounte Butler: 2 personal fouls)

[10:54] Team_070 possession (Score: 3-0)
Jabari Paul attempts a Layup. Contested by Cade Dosunmu (4.7 feet, MAN). JABARI PAUL MAKES IT! Assist: John Hyland
Score: 5-0

[10:41] Team_042 possession (Score: 5-0)
Dejounte Butler attempts a 3Pt. Contested by Khris Bryant (2.7 feet, MAN). Dejounte Butler misses. Rebound secured by Khris Bryant.

[10:24] Team_070 possession (Score: 5-0)
FOUL! Shooting foul on Tyler Barrett. LeBron Barnes to the line for 2 free throws. [BONUS: 5 team fouls] (Tyler Barrett: 1 personal fouls)   FT 1/2: GOOD   FT 2/2: GOOD LeBron Barnes makes 2/2 from the line.
Score: 7-0

[10:10] Team_042 possession (Score: 7-0)
Dejounte Butler drives to the basket... FOUL! Offensive foul on Dejounte Butler! Khris Bryant drew the charge! [Team fouls: 6] (Dejounte Butler: 3 personal fouls) TURNOVER! (dead ball)

[10:00] Team_070 possession (Score: 7-0)
FOUL! Holding foul on Cade Dosunmu. [IN THE BONUS! 7 team fouls] Jabari Paul to the line for 2 free throws. (Cade Dosunmu: 3 personal fouls)   FT 1/2: MISS   FT 2/2: MISS Jabari Paul makes 0/2 from the line. Rebound secured by Tyler Barrett.

[09:44] Team_042 possession (Score: 7-0)
Cade Dosunmu attempts a 3Pt. Contested by John Hyland (4.8 feet, ZONE). Cade Dosunmu misses. Rebound secured by LeBron Barnes.

[09:35] Team_070 possession (Score: 7-0)
LeBron Barnes attempts a Midrange. Contested by Kristaps Parker (5.4 feet, MAN). LeBron Barnes misses. Rebound secured by Dejounte Butler.

[09:19] Team_042 possession (Score: 7-0)
Cade Dosunmu makes the Midrange and draws the foul on Khris Bryant! And-1! Cade Dosunmu to the line for 1. [Team fouls: 1] (Khris Bryant: 1 personal fouls)   FT 1/1: GOOD Cade Dosunmu makes 1/1 from the line.
Score: 7-3

[09:07] Team_070 possession (Score: 7-3)
Khris Bryant attempts a Midrange. Contested by Dejounte Butler (3.5 feet, MAN). KHRIS BRYANT MAKES IT!
Score: 9-3

[08:52] Team_042 possession (Score: 9-3)
Dejounte Butler attempts a 3Pt. Contested by Khris Bryant (2.7 feet, MAN). Dejounte Butler misses. Rebound secured by Khris Bryant.

[08:41] Team_070 possession (Score: 9-3)
LeBron Barnes attempts a 3Pt. Contested by Kristaps Parker (5.4 feet, MAN). LEBRON BARNES MAKES IT!
Score: 12-3

[08:27] Team_042 possession (Score: 12-3)
Dejounte Butler loses the ball! Stripped by Khris Bryant! TURNOVER! (live ball)

[08:15] Team_070 possession (Score: 12-3)
Khris Bryant attempts a 3Pt. Contested by Jarrett Sabonis (3.8 feet, ZONE). Khris Bryant misses. Rebound secured by Tyler Barrett.

[08:02] Team_042 possession (Score: 12-3)
Kristaps Parker attempts a 3Pt. Contested by Khris Bryant (2.4 feet, ZONE). Kristaps Parker misses. Rebound secured by Khris Bryant.

[07:47] Team_070 possession (Score: 12-3)
Jabari Paul attempts a 3Pt. Contested by Tyler Barrett (4.1 feet, ZONE). Jabari Paul misses. Rebound secured by Dejounte Butler.

[07:33] Team_042 possession (Score: 12-3)
Jarrett Sabonis drives to the basket... Jarrett Sabonis throws a bad pass! Stolen by John Hyland! TURNOVER! (live ball)

[07:18] Team_070 possession (Score: 12-3)
FOUL! Reach-in foul on Jarrett Sabonis during the drive. [IN THE BONUS! 8 team fouls] John Hyland to the line for 2 free throws. (Jarrett Sabonis: 1 personal fouls)   FT 1/2: GOOD   FT 2/2: GOOD John Hyland makes 2/2 from the line.
Score: 14-3

[07:00] Team_042 possession (Score: 14-3)
Dejounte Butler attempts a Layup. BLOCKED BY KHRIS BRYANT! Ball is loose! Offensive rebound by Cade Dosunmu! Cade Dosunmu kicks it out.

[06:47] Team_042 possession (Score: 14-3)
Kristaps Parker drives, LeBron Barnes stays with him. Kristaps Parker attempts a Dunk. Contested by LeBron Barnes (3.5 feet, MAN). KRISTAPS PARKER MAKES IT! Assist: Tyler Barrett
Score: 14-5

[06:35] Team_070 possession (Score: 14-5)
LeBron Barnes attempts a Midrange. Contested by Jarrett Sabonis (4.3 feet, ZONE). LEBRON BARNES MAKES IT!
Score: 16-5

[06:19] Team_042 possession (Score: 16-5)
Jarrett Sabonis attempts a 3Pt. Contested by Khris Bryant (2.9 feet, ZONE). Jarrett Sabonis misses. Rebound secured by LeBron Barnes.

[06:07] Team_070 possession (Score: 16-5)
Jabari Paul drives and kicks out. Jabari Paul attempts a Midrange. Contested by Cade Dosunmu (3.9 feet, MAN). Jabari Paul misses. Rebound secured by Tyler Barrett.

[05:53] Team_042 possession (Score: 16-5)
Cade Dosunmu makes the Layup and draws the foul on Khris Bryant! And-1! Cade Dosunmu to the line for 1. [Team fouls: 2] (Khris Bryant: 2 personal fouls)   FT 1/1: GOOD Cade Dosunmu makes 1/1 from the line.
Score: 16-8

[05:39] Team_070 possession (Score: 16-8)
Khris Bryant attempts a Midrange. Contested by Dejounte Butler (3.5 feet, MAN). Khris Bryant misses. Rebound secured by Tyler Barrett.

[05:27] Team_042 possession (Score: 16-8)
Jarrett Sabonis drives, Khris Bryant stays with him. Jarrett Sabonis attempts a Dunk. Contested by Khris Bryant (2.9 feet, ZONE). Jarrett Sabonis misses. Rebound secured by Jabari Paul.

[05:14] Team_070 possession (Score: 16-8)
John Hyland drives and kicks out. Cole Gasol attempts a Midrange. Contested by Tyler Barrett (3.4 feet, MAN). Cole Gasol misses. Offensive rebound by LeBron Barnes! LeBron Barnes kicks it out.

[05:02] Team_070 possession (Score: 16-8)
John Hyland attempts a 3Pt. Contested by Tyler Barrett (3.4 feet, ZONE). John Hyland misses. Rebound secured by Tyler Barrett.

[04:45] Team_042 possession (Score: 16-8)
Tyler Barrett makes the Dunk and draws the foul on LeBron Barnes! And-1! Tyler Barrett to the line for 1. [Team fouls: 3] (LeBron Barnes: 1 personal fouls)   FT 1/1: GOOD Tyler Barrett makes 1/1 from the line.
Score: 16-11

[04:29] Team_070 possession (Score: 16-11)
Khris Bryant throws a bad pass out of bounds! TURNOVER! (dead ball)

[04:15] Team_042 possession (Score: 16-11)
Dejounte Butler attempts a Midrange. Contested by Khris Bryant (2.8 feet, MAN). Dejounte Butler misses. Rebound secured by Jabari Paul.

[03:57] Team_070 possession (Score: 16-11)
Cole Gasol attempts a Midrange. Contested by Cade Dosunmu (4.3 feet, ZONE). Cole Gasol misses. FOUL! Loose ball foul on Dejounte Butler during the rebound battle. [IN THE BONUS! 9 team fouls] LeBron Barnes to the line for 2 free throws. (Dejounte Butler: 4 personal fouls)   FT 1/2: MISS   FT 2/2: MISS LeBron Barnes makes 0/2 from the line. Rebound secured by Cade Dosunmu.

[03:43] Team_042 possession (Score: 16-11)
Kristaps Parker attempts a 3Pt. Contested by LeBron Barnes (3.6 feet, MAN). KRISTAPS PARKER MAKES IT! Assist: Jarrett Sabonis
Score: 16-14

[03:33] Team_070 possession (Score: 16-14)
Cole Gasol throws a bad pass out of bounds! TURNOVER! (dead ball)

[03:18] Team_042 possession (Score: 16-14)
Tyler Barrett throws a bad pass out of bounds! TURNOVER! (dead ball)

[03:18] Substitution (Team_042): Cade Dosunmu OUT → Lamelo Stewart IN (stamina_rule2)

[03:04] Team_070 possession (Score: 16-14)
Cole Gasol drives and kicks out. Cole Gasol attempts a 3Pt. Contested by Tyler Barrett (3.6 feet, MAN). Cole Gasol misses. Rebound secured by Lamelo Stewart.

[02:47] Team_042 possession (Score: 16-14)
Lamelo Stewart attempts a 3Pt. Contested by Khris Bryant (2.7 feet, ZONE). LAMELO STEWART MAKES IT! Assist: Kristaps Parker
Score: 16-17

[02:31] Team_070 possession (Score: 16-17)
LeBron Barnes attempts a 3Pt. Contested by Kristaps Parker (5.6 feet, MAN). LeBron Barnes misses. Rebound secured by Dejounte Butler.

[02:15] Team_042 possession (Score: 16-17)
Kristaps Parker attempts a 3Pt. Contested by Khris Bryant (2.7 feet, ZONE). Kristaps Parker misses. Offensive rebound by Lamelo Stewart! Lamelo Stewart kicks it out.

[02:02] Team_042 possession (Score: 16-17)
Dejounte Butler attempts a Midrange. Contested by LeBron Barnes (4.1 feet, ZONE). Dejounte Butler misses. Rebound secured by LeBron Barnes.

[01:44] Team_070 possession (Score: 16-17)
Cole Gasol drives and kicks out. Khris Bryant attempts a 3Pt. Contested by Dejounte Butler (4.0 feet, MAN). Khris Bryant misses. Rebound secured by Lamelo Stewart.

[01:26] Team_042 possession (Score: 16-17)
Tyler Barrett drives, picks up Cole Gasol. Help arrives from LeBron Barnes! Tyler Barrett attempts a Dunk. Contested by LeBron Barnes (6.0 feet, MAN). TYLER BARRETT MAKES IT!
Score: 16-19

[01:11] Team_070 possession (Score: 16-19)
Khris Bryant attempts a Midrange. Contested by Jarrett Sabonis (4.2 feet, ZONE). KHRIS BRYANT MAKES IT! Assist: Jabari Paul
Score: 18-19

[00:57] Team_042 possession (Score: 18-19)
Dejounte Butler drives, Khris Bryant stays with him. Dejounte Butler attempts a Layup. Contested by Khris Bryant (3.2 feet, MAN). DEJOUNTE BUTLER MAKES IT! Assist: Kristaps Parker
Score: 18-21

[00:41] Team_070 possession (Score: 18-21)
Cole Gasol attempts a 3Pt. Contested by Tyler Barrett (4.0 feet, ZONE). Cole Gasol misses. FOUL! Loose ball foul on Tyler Barrett during the rebound battle. [IN THE BONUS! 10 team fouls] LeBron Barnes to the line for 2 free throws. (Tyler Barrett: 2 personal fouls)   FT 1/2: GOOD   FT 2/2: GOOD LeBron Barnes makes 2/2 from the line.
Score: 20-21

[00:27] Team_042 possession (Score: 20-21)
FOUL! Reach-in foul on Khris Bryant during the drive. [Team fouls: 4] No free throws, side out. (Khris Bryant: 3 personal fouls)

[00:10] Team_042 possession (Score: 20-21)
Tyler Barrett attempts a 3Pt. Wide open! Cole Gasol is 6.1 feet away. [MAN] TYLER BARRETT MAKES IT! Assist: Dejounte Butler
Score: 20-24

================================================================================
                              1ST QUARTER COMPLETE                              
================================================================================

1ST QUARTER SCORE: Team_070 20, Team_042 24

BOX SCORE:
================================================================================

Team_070
--------------------------------------------------------------------------------
Player                MIN  PTS  REB  AST  TO      FG   FG%      3P   3P%
--------------------------------------------------------------------------------
LeBron Barnes          12    9    5    0   0   4/6    66.7     0/0   0.0
Cade Dosunmu            9    6    2    0   0   2/3    66.7     0/0   0.0
Jabari Paul            12    5    2    1   0   2/4    50.0     0/0   0.0
Khris Bryant           12    4    3    0   0   2/4    50.0     0/0   0.0
John Hyland            12    2    0    1   0   1/2    50.0     0/0   0.0
Cole Gasol             12    0    0    0   0   0/3     0.0     0/0   0.0

TEAM: FG: 9/20 (45.0%), 3PT: 2/6 (33.3%), REB: 11 (3 off, 8 def), AST: 2, TO: 2
TEAM FOULS: 4


Team_042
--------------------------------------------------------------------------------
Player                MIN  PTS  REB  AST  TO      FG   FG%      3P   3P%
--------------------------------------------------------------------------------
Tyler Barrett          12    8    5    1   0   3/3   100.0     0/0   0.0
Kristaps Parker        12    5    0    2   0   2/3    66.7     0/0   0.0
Lamelo Stewart          3    3    3    0   0   1/1   100.0     0/0   0.0
Dejounte Butler        12    2    3    1   0   1/5    20.0     0/0   0.0
Jarrett Sabonis        12    0    0    1   0   0/2     0.0     0/0   0.0

TEAM: FG: 9/17 (52.9%), 3PT: 3/8 (37.5%), REB: 12 (2 off, 10 def), AST: 5, TO: 5
TEAM FOULS: 10 [Team_070 in BONUS]

================================================================================

================================================================================
                       2ND QUARTER - Team_070 vs Team_042                       
================================================================================

[12:00] Team_070 possession (Score: 20-24)
Cole Gasol drives, Cade Dosunmu stays with him. Cole Gasol attempts a Layup. Contested by Cade Dosunmu (4.1 feet, ZONE). COLE GASOL MAKES IT! Assist: John Hyland
Score: 22-24

[11:44] Team_042 possession (Score: 22-24)
Jarrett Sabonis attempts a 3Pt. Contested by Khris Bryant (3.2 feet, ZONE). Jarrett Sabonis misses. Rebound secured by Khris Bryant.

[11:29] Team_070 possession (Score: 22-24)
LeBron Barnes throws a bad pass! Stolen by Kristaps Parker! TURNOVER! (live ball)

[11:15] Team_042 possession (Score: 22-24)
FOUL! Reach-in foul on Khris Bryant during the drive. [Team fouls: 1] No free throws, side out. (Khris Bryant: 1 personal fouls)

[10:59] Team_042 possession (Score: 22-24)
Cade Dosunmu drives to the basket... Cade Dosunmu loses control! Ball rolls out of bounds! TURNOVER! (dead ball)

[10:59] Substitution (Team_070): Cole Gasol OUT → Paul Quickley IN (stamina_rule2)

[10:59] Substitution (Team_070): LeBron Barnes OUT → Allen Quickley IN (stamina_rule2)

[10:59] Substitution (Team_070): John Hyland OUT → D'Angelo McGrady IN (stamina_rule2)

[10:59] Substitution (Team_070): Khris Bryant OUT → Luka Gobert IN (stamina_rule2)

[10:59] Substitution (Team_070): Jabari Paul OUT → Russell Morant IN (stamina_rule2)

[10:59] Substitution (Team_042): Tyler Barrett OUT → Khris George IN (stamina_rule2)

[10:59] Substitution (Team_042): Kristaps Parker OUT → Isaiah Randle IN (stamina_rule2)

[10:59] Substitution (Team_042): Jarrett Sabonis OUT → Gary Jackson IN (stamina_rule2)

[10:59] Substitution (Team_042): Dejounte Butler OUT → Allen Towns IN (stamina_rule2)

[10:48] Team_070 possession (Score: 22-24)
Paul Quickley makes the Dunk and draws the foul on Khris George! And-1! Paul Quickley to the line for 1. [Team fouls: 1] (Khris George: 1 personal fouls)   FT 1/1: GOOD Paul Quickley makes 1/1 from the line.
Score: 25-24

[10:30] Team_042 possession (Score: 25-24)
Isaiah Randle drives, picks up Russell Morant. Help arrives from Paul Quickley! Isaiah Randle attempts a Layup. Contested by Paul Quickley (3.9 feet, ZONE). ISAIAH RANDLE MAKES IT!
Score: 25-26

[10:20] Team_070 possession (Score: 25-26)
Luka Gobert attempts a Layup. Contested by Cade Dosunmu (4.1 feet, ZONE). Luka Gobert misses. Rebound secured by Allen Towns.

[10:08] Team_042 possession (Score: 25-26)
Allen Towns loses the ball! Stripped by Luka Gobert! TURNOVER! (live ball)

[09:56] Team_070 possession (Score: 25-26)
Russell Morant attempts a Layup. Contested by Cade Dosunmu (4.2 feet, MAN). RUSSELL MORANT MAKES IT! Assist: Luka Gobert
Score: 27-26

[09:43] Team_042 possession (Score: 27-26)
Allen Towns loses the ball! Stripped by Luka Gobert! TURNOVER! (live ball)

[09:26] Team_070 possession (Score: 27-26)
D'Angelo McGrady attempts a Midrange. Contested by Gary Jackson (4.6 feet, ZONE). D'ANGELO MCGRADY MAKES IT! Assist: Russell Morant
Score: 29-26

[09:16] Team_042 possession (Score: 29-26)
Cade Dosunmu loses the ball! Stripped by Russell Morant! TURNOVER! (live ball)

[09:02] Team_070 possession (Score: 29-26)
FOUL! Holding foul on Allen Towns. [Team fouls: 2] No free throws, side out. (Allen Towns: 1 personal fouls)

[08:52] Team_070 possession (Score: 29-26)
Allen Quickley attempts a 3Pt. Contested by Allen Towns (4.3 feet, ZONE). Allen Quickley misses. Rebound secured by Cade Dosunmu.

[08:37] Team_042 possession (Score: 29-26)
Isaiah Randle drives and kicks out. Allen Towns attempts a Midrange. Contested by Luka Gobert (4.8 feet, MAN). ALLEN TOWNS MAKES IT! Assist: Khris George
Score: 29-28

[08:28] Team_070 possession (Score: 29-28)
FOUL! Reach-in foul on Gary Jackson during the drive. [Team fouls: 3] No free throws, side out. (Gary Jackson: 1 personal fouls)

[08:13] Team_070 possession (Score: 29-28)
Allen Quickley drives and kicks out. Allen Quickley attempts a 3Pt. Contested by Allen Towns (4.3 feet, ZONE). Allen Quickley misses. Rebound secured by Allen Towns.

[07:58] Team_042 possession (Score: 29-28)
FOUL! Holding foul on D'Angelo McGrady. [Team fouls: 2] No free throws, side out. (D'Angelo McGrady: 1 personal fouls)

[07:40] Team_042 possession (Score: 29-28)
Isaiah Randle attempts a 3Pt. Contested by Allen Quickley (5.4 feet, MAN). Isaiah Randle misses. Rebound secured by Russell Morant.

[07:23] Team_070 possession (Score: 29-28)
Paul Quickley attempts a 3Pt. Contested by Khris George (3.9 feet, ZONE). Paul Quickley misses. Rebound secured by Gary Jackson.

[07:09] Team_042 possession (Score: 29-28)
Khris George drives, Paul Quickley stays with him. Khris George attempts a Layup. Contested by Paul Quickley (5.0 feet, MAN). KHRIS GEORGE MAKES IT!
Score: 29-30

[06:58] Team_070 possession (Score: 29-30)
Paul Quickley attempts a 3Pt. Contested by Khris George (3.9 feet, ZONE). Paul Quickley misses. FOUL! Loose ball foul on Gary Jackson during the rebound battle. [Team fouls: 4] No free throws, side out. (Gary Jackson: 2 personal fouls)

[06:39] Team_070 possession (Score: 29-30)
D'Angelo McGrady attempts a 3Pt. Contested by Gary Jackson (4.6 feet, MAN). D'Angelo McGrady misses. Offensive rebound by Luka Gobert! Luka Gobert kicks it out.

[06:28] Team_070 possession (Score: 29-30)
D'Angelo McGrady attempts a 3Pt. Contested by Khris George (4.0 feet, ZONE). D'ANGELO MCGRADY MAKES IT! Assist: Luka Gobert
Score: 32-30

[06:15] Team_042 possession (Score: 32-30)
Gary Jackson makes the Layup and draws the foul on Paul Quickley! And-1! Gary Jackson to the line for 1. [Team fouls: 3] (Paul Quickley: 1 personal fouls)   FT 1/1: GOOD Gary Jackson makes 1/1 from the line.
Score: 32-33

[06:06] Team_070 possession (Score: 32-33)
Paul Quickley attempts a Midrange. Contested by Khris George (3.9 feet, MAN). PAUL QUICKLEY MAKES IT!
Score: 34-33

[05:53] Team_042 possession (Score: 34-33)
Gary Jackson drives and kicks out. Isaiah Randle attempts a Midrange. Contested by Allen Quickley (5.2 feet, MAN). ISAIAH RANDLE MAKES IT! Assist: Allen Towns
Score: 34-35

[05:40] Team_070 possession (Score: 34-35)
Paul Quickley drives to the basket... Paul Quickley loses the ball! Stripped by Khris George! TURNOVER! (live ball)

[05:24] Team_042 possession (Score: 34-35)
Isaiah Randle drives to the basket... Isaiah Randle loses the ball! Stripped by Russell Morant! TURNOVER! (live ball)

[05:05] Team_070 possession (Score: 34-35)
Luka Gobert attempts a Layup. Contested by Allen Towns (4.3 feet, ZONE). LUKA GOBERT MAKES IT!
Score: 36-35

[04:54] Team_042 possession (Score: 36-35)
Cade Dosunmu drives, Russell Morant stays with him. Cade Dosunmu attempts a Dunk. Contested by Russell Morant (3.9 feet, ZONE). CADE DOSUNMU MAKES IT!
Score: 36-37

[04:43] Team_070 possession (Score: 36-37)
Russell Morant attempts a Midrange. Contested by Allen Towns (4.4 feet, ZONE). Russell Morant misses. Rebound secured by Allen Towns.

[04:24] Team_042 possession (Score: 36-37)
Cade Dosunmu makes the Layup and draws the foul on Russell Morant! And-1! Cade Dosunmu to the line for 1. [Team fouls: 4] (Russell Morant: 1 personal fouls)   FT 1/1: GOOD Cade Dosunmu makes 1/1 from the line.
Score: 36-40

[04:11] Team_070 possession (Score: 36-40)
Allen Quickley attempts a 3Pt. Contested by Khris George (4.1 feet, ZONE). Allen Quickley misses. Rebound secured by Cade Dosunmu.

[04:01] Team_042 possession (Score: 36-40)
Gary Jackson attempts a Midrange. Contested by D'Angelo McGrady (5.7 feet, MAN). Gary Jackson misses. Offensive rebound by Cade Dosunmu! Cade Dosunmu puts it back in!
Score: 36-42

[03:46] Team_070 possession (Score: 36-42)
Paul Quickley attempts a 3Pt. Contested by Khris George (4.0 feet, ZONE). Paul Quickley misses. Rebound secured by Gary Jackson.

[03:32] Team_042 possession (Score: 36-42)
Khris George attempts a 3Pt. Contested by Paul Quickley (5.1 feet, ZONE). KHRIS GEORGE MAKES IT! Assist: Gary Jackson
Score: 36-45

[03:14] Team_070 possession (Score: 36-45)
Allen Quickley attempts a 3Pt. Contested by Isaiah Randle (5.2 feet, MAN). Allen Quickley misses. Rebound secured by Allen Towns.

[03:01] Team_042 possession (Score: 36-45)
Allen Towns attempts a Midrange. Contested by Luka Gobert (5.5 feet, MAN). Allen Towns misses. Offensive rebound by Allen Towns! Allen Towns kicks it out.

[02:44] Team_042 possession (Score: 36-45)
Gary Jackson drives, picks up Russell Morant. Help arrives from Paul Quickley! Gary Jackson attempts a Layup. Contested by Paul Quickley (3.9 feet, ZONE). GARY JACKSON MAKES IT! Assist: Allen Towns
Score: 36-47

[02:28] Team_070 possession (Score: 36-47)
D'Angelo McGrady attempts a Layup. Contested by Allen Towns (4.4 feet, ZONE). D'ANGELO MCGRADY MAKES IT! Assist: Paul Quickley
Score: 38-47

[02:17] Team_042 possession (Score: 38-47)
Isaiah Randle makes the Layup and draws the foul on Russell Morant! And-1! Isaiah Randle to the line for 1. [BONUS: 5 team fouls] (Russell Morant: 2 personal fouls)   FT 1/1: MISS Isaiah Randle makes 0/1 from the line. Rebound secured by D'Angelo McGrady.
Score: 38-49

[02:00] Team_070 possession (Score: 38-49)
Luka Gobert attempts a Midrange. Contested by Allen Towns (4.5 feet, MAN). Luka Gobert misses. Rebound secured by Gary Jackson.

[01:44] Team_042 possession (Score: 38-49)
Khris George throws a bad pass! Stolen by Paul Quickley! TURNOVER! (live ball)

[01:33] Team_070 possession (Score: 38-49)
Luka Gobert attempts a Layup. Contested by Allen Towns (4.6 feet, MAN). LUKA GOBERT MAKES IT! Assist: Paul Quickley
Score: 40-49

[01:17] Team_042 possession (Score: 40-49)
FOUL! Reach-in foul on Russell Morant during the drive. [IN THE BONUS! 6 team fouls] Cade Dosunmu to the line for 2 free throws. (Russell Morant: 3 personal fouls)   FT 1/2: GOOD   FT 2/2: GOOD Cade Dosunmu makes 2/2 from the line.
Score: 40-51

[00:59] Team_070 possession (Score: 40-51)
Paul Quickley attempts a 3Pt. Contested by Khris George (4.2 feet, MAN). PAUL QUICKLEY MAKES IT! Assist: Allen Quickley
Score: 43-51

[00:46] Team_042 possession (Score: 43-51)
Khris George attempts a Midrange. Contested by Paul Quickley (5.4 feet, MAN). Khris George misses. Rebound secured by D'Angelo McGrady.

[00:28] Team_070 possession (Score: 43-51)
Luka Gobert attempts a 3Pt. Contested by Khris George (4.5 feet, ZONE). Luka Gobert misses. Offensive rebound by Luka Gobert! Luka Gobert kicks it out.

[00:14] Team_070 possession (Score: 43-51)
D'Angelo McGrady drives, Allen Towns stays with him. D'Angelo McGrady attempts a Dunk. Contested by Allen Towns (4.7 feet, ZONE). D'Angelo McGrady misses. Rebound secured by Gary Jackson.

================================================================================
                              2ND QUARTER COMPLETE                              
================================================================================

2ND QUARTER SCORE: Team_070 23, Team_042 27

BOX SCORE:
================================================================================

Team_070
--------------------------------------------------------------------------------
Player                MIN  PTS  REB  AST  TO      FG   FG%      3P   3P%
--------------------------------------------------------------------------------
Paul Quickley          11    8    0    2   0   3/5    60.0     0/0   0.0
D'Angelo McGrady       11    7    2    0   0   3/4    75.0     0/0   0.0
Luka Gobert            11    4    3    2   0   2/4    50.0     0/0   0.0
Cole Gasol             13    2    0    0   0   1/1   100.0     0/0   0.0
Russell Morant         11    2    1    1   0   1/2    50.0     0/0   0.0
John Hyland            13    0    0    1   0   0/0     0.0     0/0   0.0
Khris Bryant           13    0    1    0   0   0/0     0.0     0/0   0.0
Allen Quickley         11    0    0    1   0   0/4     0.0     0/0   0.0

TEAM: FG: 10/20 (50.0%), 3PT: 2/7 (28.6%), REB: 7 (3 off, 4 def), AST: 7, TO: 2
TEAM FOULS: 6 [Team_042 in BONUS]


Team_042
--------------------------------------------------------------------------------
Player                MIN  PTS  REB  AST  TO      FG   FG%      3P   3P%
--------------------------------------------------------------------------------
Cade Dosunmu           21    9    3    0   0   4/4   100.0     0/0   0.0
Khris George           11    5    0    1   0   2/3    66.7     0/0   0.0
Gary Jackson           11    5    4    1   0   2/2   100.0     0/0   0.0
Isaiah Randle          11    4    0    0   0   2/4    50.0     0/0   0.0
Allen Towns            11    2    5    2   0   1/1   100.0     0/0   0.0
Jarrett Sabonis        13    0    0    0   0   0/1     0.0     0/0   0.0

TEAM: FG: 11/15 (73.3%), 3PT: 1/3 (33.3%), REB: 12 (2 off, 10 def), AST: 4, TO: 6
TEAM FOULS: 4

================================================================================

================================================================================
                       3RD QUARTER - Team_070 vs Team_042                       
================================================================================

[12:00] Team_070 possession (Score: 43-51)
Khris Bryant makes the Layup and draws the foul on Cade Dosunmu! And-1! Khris Bryant to the line for 1. [Team fouls: 1] (Cade Dosunmu: 1 personal fouls)   FT 1/1: GOOD Khris Bryant makes 1/1 from the line.
Score: 46-51

[11:45] Team_042 possession (Score: 46-51)
Jarrett Sabonis drives to the basket... Jarrett Sabonis loses control! Ball rolls out of bounds! TURNOVER! (dead ball)

[11:28] Team_070 possession (Score: 46-51)
Jabari Paul drives to the basket... Jabari Paul loses the ball! Stripped by Cade Dosunmu! TURNOVER! (live ball)

[11:16] Team_042 possession (Score: 46-51)
Kristaps Parker drives, picks up Khris Bryant. Help arrives from LeBron Barnes! Kristaps Parker attempts a Dunk. Contested by LeBron Barnes (2.4 feet, ZONE). KRISTAPS PARKER MAKES IT! Assist: Tyler Barrett
Score: 46-53

[10:59] Team_070 possession (Score: 46-53)
Cole Gasol attempts a 3Pt. Contested by Tyler Barrett (3.6 feet, ZONE). Cole Gasol misses. FOUL! Loose ball foul on Tyler Barrett during the rebound battle. [Team fouls: 2] No free throws, side out. (Tyler Barrett: 1 personal fouls)

[10:45] Team_070 possession (Score: 46-53)
Cole Gasol attempts a 3Pt. Contested by Tyler Barrett (3.6 feet, ZONE). Cole Gasol misses. Rebound secured by Cade Dosunmu.

[10:35] Team_042 possession (Score: 46-53)
Cade Dosunmu makes the Layup and draws the foul on Khris Bryant! And-1! Cade Dosunmu to the line for 1. [Team fouls: 1] (Khris Bryant: 1 personal fouls)   FT 1/1: GOOD Cade Dosunmu makes 1/1 from the line.
Score: 46-56

[10:17] Team_070 possession (Score: 46-56)
LeBron Barnes attempts a Layup. Contested by Dejounte Butler (4.0 feet, ZONE). LEBRON BARNES MAKES IT! Assist: Khris Bryant
Score: 48-56

[10:03] Team_042 possession (Score: 48-56)
Jarrett Sabonis throws a bad pass out of bounds! TURNOVER! (dead ball)

[09:49] Team_070 possession (Score: 48-56)
LeBron Barnes attempts a Layup. BLOCKED BY CADE DOSUNMU! Ball deflects out of bounds off LeBron Barnes.

[09:34] Team_042 possession (Score: 48-56)
Dejounte Butler makes the Dunk and draws the foul on Khris Bryant! And-1! Dejounte Butler to the line for 1. [Team fouls: 2] (Khris Bryant: 2 personal fouls)   FT 1/1: MISS Dejounte Butler makes 0/1 from the line. Rebound secured by LeBron Barnes.
Score: 48-58

[09:19] Team_070 possession (Score: 48-58)
Khris Bryant attempts a Midrange. Contested by Dejounte Butler (3.5 feet, MAN). Khris Bryant misses. Rebound secured by Dejounte Butler.

[09:07] Team_042 possession (Score: 48-58)
Cade Dosunmu drives, Khris Bryant stays with him. Cade Dosunmu attempts a Dunk. Contested by Khris Bryant (2.7 feet, ZONE). CADE DOSUNMU MAKES IT! Assist: Tyler Barrett
Score: 48-60

[08:50] Team_070 possession (Score: 48-60)
Jabari Paul attempts a Layup. Contested by Cade Dosunmu (4.7 feet, MAN). JABARI PAUL MAKES IT!
Score: 50-60

[08:36] Team_042 possession (Score: 50-60)
Dejounte Butler attempts a 3Pt. Contested by Khris Bryant (2.7 feet, MAN). Dejounte Butler misses. Rebound secured by LeBron Barnes.

[08:23] Team_070 possession (Score: 50-60)
FOUL! Shooting foul on Cade Dosunmu. Jabari Paul to the line for 2 free throws. [Team fouls: 3] (Cade Dosunmu: 2 personal fouls)   FT 1/2: GOOD   FT 2/2: MISS Jabari Paul makes 1/2 from the line. Rebound secured by Dejounte Butler.
Score: 51-60

[08:08] Team_042 possession (Score: 51-60)
Tyler Barrett attempts a Layup. Contested by Cole Gasol (5.7 feet, MAN). TYLER BARRETT MAKES IT! Assist: Dejounte Butler
Score: 51-62

[07:55] Team_070 possession (Score: 51-62)
Cole Gasol attempts a 3Pt. Contested by Tyler Barrett (3.6 feet, ZONE). COLE GASOL MAKES IT! Assist: Khris Bryant
Score: 54-62

[07:44] Team_042 possession (Score: 54-62)
FOUL! Reach-in foul on Khris Bryant during the drive. [Team fouls: 3] No free throws, side out. (Khris Bryant: 3 personal fouls)

[07:29] Team_042 possession (Score: 54-62)
Tyler Barrett drives, Cole Gasol stays with him. Tyler Barrett attempts a Layup. Contested by Cole Gasol (5.7 feet, MAN). TYLER BARRETT MAKES IT!
Score: 54-64

[07:14] Team_070 possession (Score: 54-64)
LeBron Barnes makes the Layup and draws the foul on Cade Dosunmu! And-1! LeBron Barnes to the line for 1. [Team fouls: 4] (Cade Dosunmu: 3 personal fouls)   FT 1/1: MISS LeBron Barnes makes 0/1 from the line. Rebound secured by Dejounte Butler.
Score: 56-64

[06:59] Team_042 possession (Score: 56-64)
Dejounte Butler attempts a Midrange. Contested by Khris Bryant (2.7 feet, ZONE). Dejounte Butler misses. Rebound secured by Jabari Paul.

[06:44] Team_070 possession (Score: 56-64)
Khris Bryant loses control! Ball rolls out of bounds! TURNOVER! (dead ball)

[06:24] Team_042 possession (Score: 56-64)
Jarrett Sabonis attempts a 3Pt. Contested by John Hyland (4.9 feet, MAN). JARRETT SABONIS MAKES IT! Assist: Cade Dosunmu
Score: 56-67

[06:08] Team_070 possession (Score: 56-67)
Cole Gasol drives, picks up Tyler Barrett. Help arrives from Jarrett Sabonis! Cole Gasol attempts a Layup. Contested by Jarrett Sabonis (3.6 feet, MAN). Cole Gasol misses. Rebound secured by Tyler Barrett.

[05:54] Team_042 possession (Score: 56-67)
FOUL! Holding foul on Khris Bryant. [Team fouls: 4] No free throws, side out. (Khris Bryant: 4 personal fouls)

[05:40] Team_042 possession (Score: 56-67)
FOUL! Shooting foul on LeBron Barnes. Kristaps Parker to the line for 2 free throws. [BONUS: 5 team fouls] (LeBron Barnes: 1 personal fouls)   FT 1/2: GOOD   FT 2/2: GOOD Kristaps Parker makes 2/2 from the line.
Score: 56-69

[05:25] Team_070 possession (Score: 56-69)
FOUL! Shooting foul on Kristaps Parker. LeBron Barnes to the line for 2 free throws. [BONUS: 5 team fouls] (Kristaps Parker: 1 personal fouls)   FT 1/2: GOOD   FT 2/2: GOOD LeBron Barnes makes 2/2 from the line.
Score: 58-69

[05:12] Team_042 possession (Score: 58-69)
Jarrett Sabonis attempts a 3Pt. Contested by John Hyland (4.9 feet, MAN). Jarrett Sabonis misses. Rebound secured by Khris Bryant.

[04:58] Team_070 possession (Score: 58-69)
LeBron Barnes attempts a 3Pt. Contested by Kristaps Parker (5.4 feet, MAN). LEBRON BARNES MAKES IT! Assist: John Hyland
Score: 61-69

[04:38] Team_042 possession (Score: 61-69)
Jarrett Sabonis attempts a 3Pt. Contested by Khris Bryant (2.9 feet, ZONE). Jarrett Sabonis misses. Rebound secured by LeBron Barnes.

[04:24] Team_070 possession (Score: 61-69)
John Hyland attempts a 3Pt. Contested by Tyler Barrett (3.4 feet, ZONE). John Hyland misses. Rebound secured by Dejounte Butler.

[04:10] Team_042 possession (Score: 61-69)
Kristaps Parker attempts a 3Pt. Contested by LeBron Barnes (3.6 feet, MAN). Kristaps Parker misses. Offensive rebound by Cade Dosunmu! Cade Dosunmu puts it back in!
Score: 61-71

[03:57] Team_070 possession (Score: 61-71)
Khris Bryant attempts a Layup. Contested by Dejounte Butler (3.6 feet, MAN). KHRIS BRYANT MAKES IT!
Score: 63-71

[03:39] Team_042 possession (Score: 63-71)
Cade Dosunmu makes the Dunk and draws the foul on LeBron Barnes! And-1! Cade Dosunmu to the line for 1. [BONUS: 6 team fouls] (LeBron Barnes: 2 personal fouls)   FT 1/1: GOOD Cade Dosunmu makes 1/1 from the line.
Score: 63-74

[03:26] Team_070 possession (Score: 63-74)
Cole Gasol attempts a Midrange. Contested by Kristaps Parker (5.3 feet, ZONE). Cole Gasol misses. Rebound secured by Cade Dosunmu.

[03:09] Team_042 possession (Score: 63-74)
Tyler Barrett attempts a 3Pt. Contested by Khris Bryant (3.1 feet, ZONE). Tyler Barrett misses. Rebound secured by Khris Bryant.

[02:57] Team_070 possession (Score: 63-74)
Cole Gasol attempts a 3Pt. Contested by Tyler Barrett (3.8 feet, ZONE). COLE GASOL MAKES IT! Assist: John Hyland
Score: 66-74

[02:44] Team_042 possession (Score: 66-74)
Jarrett Sabonis attempts a 3Pt. Contested by Khris Bryant (3.1 feet, ZONE). Jarrett Sabonis misses. Offensive rebound by Cade Dosunmu! Cade Dosunmu's putback is no good. Offensive rebound by Dejounte Butler! Dejounte Butler kicks it out.

[02:27] Team_042 possession (Score: 66-74)
Cade Dosunmu drives, Khris Bryant stays with him. Cade Dosunmu attempts a Layup. Contested by Khris Bryant (3.0 feet, MAN). Cade Dosunmu misses. Rebound secured by Jabari Paul.

[02:08] Team_070 possession (Score: 66-74)
Jabari Paul attempts a Layup. Contested by Cade Dosunmu (5.0 feet, ZONE). Jabari Paul misses. Rebound secured by Cade Dosunmu.

[01:57] Team_042 possession (Score: 66-74)
FOUL! Shooting foul on LeBron Barnes. Jarrett Sabonis to the line for 2 free throws. [BONUS: 7 team fouls] (LeBron Barnes: 3 personal fouls)   FT 1/2: MISS   FT 2/2: GOOD Jarrett Sabonis makes 1/2 from the line.
Score: 66-75

[01:44] Team_070 possession (Score: 66-75)
Cole Gasol attempts a 3Pt. Contested by Tyler Barrett (3.9 feet, ZONE). Cole Gasol misses. Offensive rebound by Khris Bryant! Khris Bryant's putback is no good. Offensive rebound by LeBron Barnes! LeBron Barnes kicks it out.

[01:30] Team_070 possession (Score: 66-75)
Cole Gasol makes the Layup and draws the foul on Cade Dosunmu! And-1! Cole Gasol to the line for 1. [BONUS: 6 team fouls] (Cade Dosunmu: 4 personal fouls)   FT 1/1: GOOD Cole Gasol makes 1/1 from the line.
Score: 69-75

[01:11] Team_042 possession (Score: 69-75)
Jarrett Sabonis attempts a 3Pt. Contested by Khris Bryant (3.3 feet, ZONE). JARRETT SABONIS MAKES IT! Assist: Dejounte Butler
Score: 69-78

[00:57] Team_070 possession (Score: 69-78)
John Hyland attempts a Midrange. BLOCKED BY JARRETT SABONIS! Ball deflects out of bounds off John Hyland.

[00:43] Team_042 possession (Score: 69-78)
Tyler Barrett attempts a Midrange. Contested by LeBron Barnes (4.4 feet, ZONE). TYLER BARRETT MAKES IT!
Score: 69-80

[00:31] Team_070 possession (Score: 69-80)
John Hyland attempts a Layup. Contested by Cade Dosunmu (4.4 feet, ZONE). JOHN HYLAND MAKES IT! Assist: Khris Bryant
Score: 71-80

[00:12] Team_042 possession (Score: 71-80)
Jarrett Sabonis makes the Layup and draws the foul on Khris Bryant! And-1! Jarrett Sabonis to the line for 1. [BONUS: 8 team fouls] (Khris Bryant: 5 personal fouls)   FT 1/1: GOOD Jarrett Sabonis makes 1/1 from the line.
Score: 71-83

================================================================================
                              3RD QUARTER COMPLETE                              
================================================================================

3RD QUARTER SCORE: Team_070 28, Team_042 32

BOX SCORE:
================================================================================

Team_070
--------------------------------------------------------------------------------
Player                MIN  PTS  REB  AST  TO      FG   FG%      3P   3P%
--------------------------------------------------------------------------------
Cole Gasol             25    9    0    0   0   3/6    50.0     0/0   0.0
LeBron Barnes          25    7    5    0   0   3/5    60.0     0/0   0.0
Khris Bryant           25    5    2    3   0   2/3    66.7     0/0   0.0
Jabari Paul            25    2    2    0   0   1/3    33.3     0/0   0.0
John Hyland            25    2    0    2   0   1/3    33.3     0/0   0.0

TEAM: FG: 10/20 (50.0%), 3PT: 3/5 (60.0%), REB: 9 (2 off, 7 def), AST: 5, TO: 2
TEAM FOULS: 8 [Team_042 in BONUS]


Team_042
--------------------------------------------------------------------------------
Player                MIN  PTS  REB  AST  TO      FG   FG%      3P   3P%
--------------------------------------------------------------------------------
Cade Dosunmu           33   10    4    1   0   4/5    80.0     0/0   0.0
Jarrett Sabonis        25   10    0    0   0   4/6    66.7     0/0   0.0
Tyler Barrett          25    6    1    2   0   3/4    75.0     0/0   0.0
Kristaps Parker        25    4    0    0   0   2/2   100.0     0/0   0.0
Dejounte Butler        25    0    5    2   0   0/3     0.0     0/0   0.0

TEAM: FG: 13/20 (65.0%), 3PT: 3/7 (42.9%), REB: 10 (2 off, 8 def), AST: 5, TO: 2
TEAM FOULS: 6 [Team_070 in BONUS]

================================================================================

================================================================================
                       4TH QUARTER - Team_070 vs Team_042                       
================================================================================

[12:00] Substitution (Team_070): Cole Gasol OUT (stamina: 71) → Paul Quickley IN (comeback_detected)

[12:00] Substitution (Team_042): Tyler Barrett OUT (stamina: 70) → Khris George IN (comeback_detected)

[12:00] Team_070 possession (Score: 71-83)
Paul Quickley attempts a Midrange. Contested by Kristaps Parker (5.1 feet, ZONE). PAUL QUICKLEY MAKES IT! Assist: LeBron Barnes
Score: 73-83

[11:45] Team_042 possession (Score: 73-83)
Kristaps Parker attempts a 3Pt. Contested by LeBron Barnes (3.8 feet, MAN). Kristaps Parker misses. FOUL! Loose ball foul on Jabari Paul during the rebound battle. [Team fouls: 1] No free throws, side out. (Jabari Paul: 1 personal fouls)

[11:29] Team_042 possession (Score: 73-83)
Cade Dosunmu drives, picks up Khris Bryant. Help arrives from LeBron Barnes! Cade Dosunmu attempts a Dunk. Contested by LeBron Barnes (3.1 feet, ZONE). CADE DOSUNMU MAKES IT! Assist: Khris George
Score: 73-85

[11:18] Team_070 possession (Score: 73-85)
John Hyland attempts a 3Pt. Contested by Jarrett Sabonis (4.2 feet, MAN). JOHN HYLAND MAKES IT! Assist: Khris Bryant
Score: 76-85

[11:02] Team_042 possession (Score: 76-85)
Kristaps Parker loses control! Ball rolls out of bounds! TURNOVER! (dead ball)

[11:02] Substitution (Team_070): LeBron Barnes OUT → Allen Quickley IN (stamina_rule2)

[11:02] Substitution (Team_070): John Hyland OUT → D'Angelo McGrady IN (stamina_rule2)

[11:02] Substitution (Team_070): Khris Bryant OUT → Luka Gobert IN (stamina_rule2)

[11:02] Substitution (Team_070): Jabari Paul OUT → Russell Morant IN (stamina_rule2)

[11:02] Substitution (Team_042): Kristaps Parker OUT → Isaiah Randle IN (stamina_rule2)

[11:02] Substitution (Team_042): Jarrett Sabonis OUT → Gary Jackson IN (stamina_rule2)

[11:02] Substitution (Team_042): Dejounte Butler OUT → Allen Towns IN (stamina_rule2)

[11:02] Substitution (Team_042): Cade Dosunmu OUT → Lamelo Stewart IN (stamina_rule2)

[10:46] Team_070 possession (Score: 76-85)
Luka Gobert drives to the basket... FOUL! Offensive foul on Luka Gobert! Allen Towns drew the charge! [Team fouls: 2] (Luka Gobert: 1 personal fouls) TURNOVER! (dead ball)

[10:30] Team_042 possession (Score: 76-85)
Khris George attempts a Layup. BLOCKED BY ALLEN QUICKLEY! Ball deflects out of bounds off Khris George.

[10:15] Team_070 possession (Score: 76-85)
FOUL! Holding foul on Gary Jackson. [Team fouls: 1] No free throws, side out. (Gary Jackson: 1 personal fouls)

[10:01] Team_070 possession (Score: 76-85)
FOUL! Shooting foul on Isaiah Randle. Allen Quickley to the line for 2 free throws. [Team fouls: 2] (Isaiah Randle: 1 personal fouls)   FT 1/2: MISS   FT 2/2: GOOD Allen Quickley makes 1/2 from the line.
Score: 77-85

[09:46] Team_042 possession (Score: 77-85)
FOUL! Shooting foul on Russell Morant. Gary Jackson to the line for 2 free throws. [Team fouls: 3] (Russell Morant: 1 personal fouls)   FT 1/2: GOOD   FT 2/2: GOOD Gary Jackson makes 2/2 from the line.
Score: 77-87

[09:32] Team_070 possession (Score: 77-87)
FOUL! Holding foul on Allen Towns. [Team fouls: 3] No free throws, side out. (Allen Towns: 1 personal fouls)

[09:22] Team_070 possession (Score: 77-87)
D'Angelo McGrady attempts a 3Pt. Contested by Khris George (4.0 feet, ZONE). D'Angelo McGrady misses. Offensive rebound by Russell Morant! Russell Morant puts it back in!
Score: 79-87

[09:10] Team_042 possession (Score: 79-87)
Isaiah Randle drives and kicks out. Gary Jackson attempts a 3Pt. Contested by D'Angelo McGrady (5.6 feet, MAN). Gary Jackson misses. Rebound secured by Russell Morant.

[08:54] Team_070 possession (Score: 79-87)
FOUL! Reach-in foul on Allen Towns during the drive. [Team fouls: 4] No free throws, side out. (Allen Towns: 2 personal fouls)

[08:40] Team_070 possession (Score: 79-87)
Russell Morant drives and kicks out. Paul Quickley attempts a 3Pt. Contested by Khris George (4.0 feet, MAN). Paul Quickley misses. Rebound secured by Lamelo Stewart.

[08:29] Team_042 possession (Score: 79-87)
Khris George makes the Layup and draws the foul on Paul Quickley! And-1! Khris George to the line for 1. [Team fouls: 4] (Paul Quickley: 1 personal fouls)   FT 1/1: GOOD Khris George makes 1/1 from the line.
Score: 79-90

[08:16] Team_070 possession (Score: 79-90)
Russell Morant attempts a Layup. Contested by Lamelo Stewart (4.3 feet, MAN). RUSSELL MORANT MAKES IT!
Score: 81-90

[07:59] Team_042 possession (Score: 81-90)
Allen Towns attempts a 3Pt. Contested by Paul Quickley (4.9 feet, ZONE). Allen Towns misses. Rebound secured by D'Angelo McGrady.

[07:43] Team_070 possession (Score: 81-90)
FOUL! Holding foul on Lamelo Stewart. [IN THE BONUS! 5 team fouls] Russell Morant to the line for 2 free throws. (Lamelo Stewart: 1 personal fouls)   FT 1/2: MISS   FT 2/2: GOOD Russell Morant makes 1/2 from the line.
Score: 82-90

[07:25] Team_042 possession (Score: 82-90)
FOUL! Shooting foul on Paul Quickley. Khris George to the line for 2 free throws. [BONUS: 5 team fouls] (Paul Quickley: 2 personal fouls)   FT 1/2: GOOD   FT 2/2: MISS Khris George makes 1/2 from the line. Offensive rebound by Allen Towns! Allen Towns kicks it out.
Score: 82-91

[07:07] Team_042 possession (Score: 82-91)
Isaiah Randle attempts a Layup. Contested by Russell Morant (3.9 feet, ZONE). ISAIAH RANDLE MAKES IT! Assist: Khris George
Score: 82-93

[06:49] Team_070 possession (Score: 82-93)
D'Angelo McGrady attempts a 3Pt. Contested by Khris George (4.0 feet, ZONE). D'Angelo McGrady misses. Rebound secured by Allen Towns.

[06:31] Team_042 possession (Score: 82-93)
Gary Jackson attempts a 3Pt. Contested by Paul Quickley (4.3 feet, ZONE). Gary Jackson misses. Rebound secured by D'Angelo McGrady.

[06:21] Team_070 possession (Score: 82-93)
Paul Quickley drives, Allen Towns stays with him. Paul Quickley attempts a Layup. Contested by Allen Towns (4.2 feet, ZONE). PAUL QUICKLEY MAKES IT! Assist: D'Angelo McGrady
Score: 84-93

[06:11] Team_042 possession (Score: 84-93)
Allen Towns attempts a 3Pt. Contested by Luka Gobert (5.3 feet, ZONE). Allen Towns misses. Rebound secured by Russell Morant.

[05:52] Team_070 possession (Score: 84-93)
Russell Morant drives, picks up Lamelo Stewart. Help arrives from Khris George! Russell Morant attempts a Layup. Contested by Khris George (4.3 feet, MAN). RUSSELL MORANT MAKES IT!
Score: 86-93

[05:40] Team_042 possession (Score: 86-93)
Allen Towns drives and kicks out. Lamelo Stewart attempts a Midrange. Contested by Russell Morant (3.7 feet, MAN). LAMELO STEWART MAKES IT! Assist: Allen Towns
Score: 86-95

[05:25] Team_070 possession (Score: 86-95)
Russell Morant drives and kicks out. D'Angelo McGrady attempts a 3Pt. Contested by Khris George (4.0 feet, ZONE). D'Angelo McGrady misses. Rebound secured by Gary Jackson.

[05:09] Team_042 possession (Score: 86-95)
Isaiah Randle attempts a 3Pt. Contested by D'Angelo McGrady (5.8 feet, ZONE). Isaiah Randle misses. Rebound secured by Russell Morant.

[04:53] Team_070 possession (Score: 86-95)
D'Angelo McGrady drives and kicks out. D'Angelo McGrady attempts a 3Pt. Contested by Gary Jackson (4.6 feet, MAN). D'ANGELO MCGRADY MAKES IT! Assist: Russell Morant
Score: 89-95

[04:40] Team_042 possession (Score: 89-95)
Lamelo Stewart makes the Layup and draws the foul on Russell Morant! And-1! Lamelo Stewart to the line for 1. [BONUS: 6 team fouls] (Russell Morant: 2 personal fouls)   FT 1/1: GOOD Lamelo Stewart makes 1/1 from the line.
Score: 89-98

[04:30] Team_070 possession (Score: 89-98)
Allen Quickley attempts a Layup. Contested by Allen Towns (4.3 feet, ZONE). Allen Quickley misses. Rebound secured by Allen Towns.

[04:16] Team_042 possession (Score: 89-98)
Isaiah Randle drives, picks up Russell Morant. Help arrives from Paul Quickley! Isaiah Randle attempts a Layup. Contested by Paul Quickley (3.9 feet, ZONE). ISAIAH RANDLE MAKES IT!
Score: 89-100

[03:58] Team_070 possession (Score: 89-100)
Allen Quickley attempts a Layup. Contested by Isaiah Randle (5.2 feet, MAN). Allen Quickley misses. Rebound secured by Allen Towns.

[03:43] Team_042 possession (Score: 89-100)
Khris George drives and kicks out. Isaiah Randle attempts a 3Pt. Contested by Allen Quickley (5.3 feet, MAN). Isaiah Randle misses. Offensive rebound by Lamelo Stewart! Lamelo Stewart kicks it out.

[03:30] Team_042 possession (Score: 89-100)
Khris George attempts a 3Pt. Contested by Paul Quickley (5.2 feet, MAN). Khris George misses. Rebound secured by Russell Morant.

[03:16] Team_070 possession (Score: 89-100)
Allen Quickley attempts a 3Pt. Contested by Isaiah Randle (5.2 feet, ZONE). Allen Quickley misses. Rebound secured by Lamelo Stewart.

[03:01] Team_042 possession (Score: 89-100)
Gary Jackson makes the Midrange and draws the foul on D'Angelo McGrady! And-1! Gary Jackson to the line for 1. [BONUS: 7 team fouls] (D'Angelo McGrady: 1 personal fouls)   FT 1/1: MISS Gary Jackson makes 0/1 from the line. Rebound secured by Russell Morant.
Score: 89-102

[02:51] Team_070 possession (Score: 89-102)
Paul Quickley drives, Allen Towns stays with him. Paul Quickley attempts a Dunk. Contested by Allen Towns (4.2 feet, ZONE). Paul Quickley misses. Rebound secured by Lamelo Stewart.

[02:34] Team_042 possession (Score: 89-102)
Allen Towns attempts a 3Pt. Contested by Paul Quickley (5.1 feet, ZONE). Allen Towns misses. FOUL! Loose ball foul on Russell Morant during the rebound battle. [IN THE BONUS! 8 team fouls] Lamelo Stewart to the line for 2 free throws. (Russell Morant: 3 personal fouls)   FT 1/2: GOOD   FT 2/2: GOOD Lamelo Stewart makes 2/2 from the line.
Score: 89-104

[02:24] Team_070 possession (Score: 89-104)
D'Angelo McGrady attempts a 3Pt. Contested by Khris George (4.3 feet, ZONE). D'Angelo McGrady misses. Rebound secured by Allen Towns.

[02:14] Team_042 possession (Score: 89-104)
Isaiah Randle attempts a 3Pt. Contested by Paul Quickley (4.8 feet, ZONE). ISAIAH RANDLE MAKES IT! Assist: Lamelo Stewart
Score: 89-107

[01:59] Team_070 possession (Score: 89-107)
Luka Gobert attempts a 3Pt. Contested by Allen Towns (4.5 feet, MAN). Luka Gobert misses. Rebound secured by Gary Jackson.

[01:42] Team_042 possession (Score: 89-107)
Lamelo Stewart attempts a 3Pt. Contested by Russell Morant (3.9 feet, MAN). Lamelo Stewart misses. Rebound secured by Luka Gobert.

[01:24] Team_070 possession (Score: 89-107)
Paul Quickley drives, Allen Towns stays with him. Paul Quickley attempts a Dunk. Contested by Allen Towns (4.4 feet, ZONE). PAUL QUICKLEY MAKES IT!
Score: 91-107

[01:12] Team_042 possession (Score: 91-107)
Khris George attempts a Layup. Contested by Russell Morant (4.7 feet, ZONE). KHRIS GEORGE MAKES IT! Assist: Gary Jackson
Score: 91-109

[00:55] Team_070 possession (Score: 91-109)
D'Angelo McGrady makes the Layup and draws the foul on Allen Towns! And-1! D'Angelo McGrady to the line for 1. [BONUS: 6 team fouls] (Allen Towns: 3 personal fouls)   FT 1/1: GOOD D'Angelo McGrady makes 1/1 from the line.
Score: 94-109

[00:42] Team_042 possession (Score: 94-109)
Gary Jackson attempts a 3Pt. Contested by D'Angelo McGrady (5.9 feet, MAN). Gary Jackson misses. Offensive rebound by Lamelo Stewart! Lamelo Stewart kicks it out.

[00:23] Team_042 possession (Score: 94-109)
Gary Jackson attempts a 3Pt. Contested by Paul Quickley (4.9 feet, ZONE). GARY JACKSON MAKES IT! Assist: Khris George
Score: 94-112

[00:08] Team_070 possession (Score: 94-112)
Allen Quickley attempts a 3Pt. Contested by Isaiah Randle (5.4 feet, ZONE). Allen Quickley misses. Rebound secured by Allen Towns.

================================================================================
                              4TH QUARTER COMPLETE                              
================================================================================

4TH QUARTER SCORE: Team_070 23, Team_042 29

BOX SCORE:
================================================================================

Team_070
--------------------------------------------------------------------------------
Player                MIN  PTS  REB  AST  TO      FG   FG%      3P   3P%
--------------------------------------------------------------------------------
Russell Morant         22    7    6    1   0   4/6    66.7     0/0   0.0
Paul Quickley          23    6    0    0   0   3/4    75.0     0/0   0.0
D'Angelo McGrady       22    6    2    1   0   2/4    50.0     0/0   0.0
John Hyland            27    3    0    0   0   1/1   100.0     0/0   0.0
Allen Quickley         22    1    0    0   0   1/5    20.0     0/0   0.0
LeBron Barnes          27    0    0    1   0   0/0     0.0     0/0   0.0
Khris Bryant           27    0    0    1   0   0/0     0.0     0/0   0.0
Luka Gobert            22    0    1    0   0   0/1     0.0     0/0   0.0

TEAM: FG: 11/21 (52.4%), 3PT: 2/7 (28.6%), REB: 9 (1 off, 8 def), AST: 4, TO: 1
TEAM FOULS: 8 [Team_042 in BONUS]


Team_042
--------------------------------------------------------------------------------
Player                MIN  PTS  REB  AST  TO      FG   FG%      3P   3P%
--------------------------------------------------------------------------------
Isaiah Randle          22    7    0    0   0   3/5    60.0     0/0   0.0
Lamelo Stewart         14    7    5    1   0   3/4    75.0     0/0   0.0
Khris George           23    5    0    3   0   2/4    50.0     0/0   0.0
Gary Jackson           22    5    2    1   0   2/4    50.0     0/0   0.0
Cade Dosunmu           34    2    0    0   0   1/1   100.0     0/0   0.0
Dejounte Butler        27    0    1    0   0   0/0     0.0     0/0   0.0
Allen Towns            22    0    6    1   0   0/2     0.0     0/0   0.0

TEAM: FG: 11/20 (55.0%), 3PT: 3/9 (33.3%), REB: 14 (4 off, 10 def), AST: 6, TO: 1
TEAM FOULS: 6 [Team_070 in BONUS]

================================================================================

================================================================================
                               FULL GAME COMPLETE                               
================================================================================

FINAL SCORE: Team_070 94, Team_042 112

SCORING BY QUARTER:
--------------------------------------------------------------------------------
Team                     Q1     Q2     Q3     Q4    FINAL
--------------------------------------------------------------------------------
Team_070                 20     23     28     23       94
Team_042                 24     27     32     29      112
--------------------------------------------------------------------------------

FULL GAME BOX SCORE:
================================================================================

Team_070
--------------------------------------------------------------------------------
Player                MIN  PTS  REB  AST  TO      FG   FG%      3P   3P%      FT STL BLK
--------------------------------------------------------------------------------
LeBron Barnes          27   16   10    1   1   6/10   60.0   2/3    66.7   6/9     0   0
John Hyland            27    7    0    4   1   3/6    50.0   1/3    33.3   2/2     1   0
Khris Bryant           27    9    6    4   2   4/7    57.1   0/1     0.0   1/1     1   1
Jabari Paul            27    7    4    1   0   3/7    42.9   0/1     0.0   2/5     0   0
Cole Gasol             25   11    0    0   1   5/11   45.5   3/4    75.0   1/1     0   0
Paul Quickley          23   14    0    2   0   6/9    66.7   1/3    33.3   1/1     1   0
Allen Quickley         22    1    0    1   0   1/9    11.1   0/5     0.0   1/2     0   1
D'Angelo McGrady       22   13    4    1   0   6/9    66.7   2/4    50.0   1/1     0   0
Luka Gobert            22    4    4    2   0   2/5    40.0   0/1     0.0   0/0     2   0
Russell Morant         22    9    7    2   2   3/6    50.0   0/0     0.0   1/2     2   0

TEAM: FG: 40/81 (49.4%), 3PT: 9/25 (36.0%), REB: 36 (9 off, 27 def), AST: 18, TO: 7


Team_042
--------------------------------------------------------------------------------
Player                MIN  PTS  REB  AST  TO      FG   FG%      3P   3P%      FT STL BLK
--------------------------------------------------------------------------------
Cade Dosunmu           34   27    9    1   3   9/11   81.8   0/1     0.0   7/7     1   1
Kristaps Parker        27    9    0    2   2   5/6    83.3   2/3    66.7   2/2     1   0
Jarrett Sabonis        27   10    0    1   1   4/9    44.4   2/6    33.3   2/3     0   1
Dejounte Butler        27    2    9    3   1   1/8    12.5   0/3     0.0   0/1     0   0
Tyler Barrett          25   14    6    3   3   6/7    85.7   1/2    50.0   1/1     0   0
Khris George           23   10    0    4   1   4/7    57.1   1/2    50.0   2/3     1   0
Isaiah Randle          22   11    0    0   1   5/9    55.6   1/3    33.3   0/1     0   0
Gary Jackson           22   10    6    2   0   6/8    75.0   1/2    50.0   3/4     0   0
Allen Towns            22    2   11    3   2   2/4    50.0   1/3    33.3   0/0     0   0
Lamelo Stewart         14   10    8    1   0   2/3    66.7   1/2    50.0   3/3     0   0

TEAM: FG: 44/72 (61.1%), 3PT: 10/27 (37.0%), REB: 48 (10 off, 38 def), AST: 20, TO: 14

================================================================================
