================================================================================
                        FULL GAME - Team_007 vs Team_044                        
================================================================================

================================================================================
                       1ST QUARTER - Team_007 vs Team_044                       
================================================================================

[12:00] Team_007 possession (Score: 0-0)
Tobias Johnson attempts a Midrange. Contested by Zach McGrady (4.5 feet, MAN). Tobias Johnson misses. Rebound secured by Ayo McCollum.

[11:43] Team_044 possession (Score: 0-0)
FOUL! Shooting foul on John Quickley. Victor Westbrook to the line for 2 free throws. [Team fouls: 1] (John Quickley: 1 personal fouls)   FT 1/2: GOOD   FT 2/2: GOOD Victor Westbrook makes 2/2 from the line.
Score: 0-2

[11:30] Team_007 possession (Score: 0-2)
John Quickley attempts a Layup. Contested by Ayo McCollum (5.3 feet, ZONE). JOHN QUICKLEY MAKES IT! Assist: Carmelo Siakam
Score: 2-2

[11:16] Team_044 possession (Score: 2-2)
Victor Westbrook loses control! Ball rolls out of bounds! TURNOVER! (dead ball)

[11:05] Team_007 possession (Score: 2-2)
Bones Siakam attempts a 3Pt. Contested by Victor Westbrook (5.3 feet, ZONE). BONES SIAKAM MAKES IT! Assist: Jaren Dosunmu
Score: 5-2

[10:53] Team_044 possession (Score: 5-2)
Isaiah Murray attempts a 3Pt. Contested by John Quickley (3.4 feet, ZONE). Isaiah Murray misses. Rebound secured by Bones Siakam.

[10:38] Team_007 possession (Score: 5-2)
Bones Siakam attempts a 3Pt. Contested by Victor Westbrook (5.3 feet, MAN). BONES SIAKAM MAKES IT! Assist: Carmelo Siakam
Score: 8-2

[10:26] Team_044 possession (Score: 8-2)
Karl Fox attempts a Midrange. Contested by John Quickley (3.1 feet, MAN). Karl Fox misses. Rebound secured by Bones Siakam.

[10:10] Team_007 possession (Score: 8-2)
Tobias Johnson attempts a Midrange. Contested by Zach McGrady (4.5 feet, MAN). TOBIAS JOHNSON MAKES IT!
Score: 10-2

[09:57] Team_044 possession (Score: 10-2)
Isaiah Murray attempts a 3Pt. Contested by Jaren Dosunmu (4.8 feet, MAN). ISAIAH MURRAY MAKES IT! Assist: Victor Westbrook
Score: 10-5

[09:48] Team_007 possession (Score: 10-5)
John Quickley drives and kicks out. Tobias Johnson attempts a Midrange. Contested by Isaiah Murray (4.7 feet, ZONE). TOBIAS JOHNSON MAKES IT! Assist: Carmelo Siakam
Score: 12-5

[09:32] Team_044 possession (Score: 12-5)
Zach McGrady attempts a Layup. BLOCKED BY JAREN DOSUNMU! Ball is loose! Rebound secured by Bones Siakam.

[09:16] Team_007 possession (Score: 12-5)
Jaren Dosunmu attempts a 3Pt. Contested by Isaiah Murray (4.7 feet, ZONE). Jaren Dosunmu misses. Rebound secured by Ayo McCollum.

[09:02] Team_044 possession (Score: 12-5)
Victor Westbrook attempts a 3Pt. Contested by Bones Siakam (3.7 feet, MAN). Victor Westbrook misses. Rebound secured by Carmelo Siakam.

[08:51] Team_007 possession (Score: 12-5)
Bones Siakam attempts a 3Pt. Contested by Victor Westbrook (5.3 feet, MAN). BONES SIAKAM MAKES IT! Assist: Tobias Johnson
Score: 15-5

[08:35] Team_044 possession (Score: 15-5)
FOUL! Shooting foul on John Quickley. Karl Fox to the line for 3 free throws. [Team fouls: 2] (John Quickley: 2 personal fouls)   FT 1/3: GOOD   FT 2/3: GOOD   FT 3/3: GOOD Karl Fox makes 3/3 from the line.
Score: 15-8

[08:17] Team_007 possession (Score: 15-8)
Tobias Johnson drives, Ayo McCollum stays with him. Tobias Johnson attempts a Dunk. Contested by Ayo McCollum (4.9 feet, ZONE). Tobias Johnson misses. Rebound secured by Ayo McCollum.

[08:01] Team_044 possession (Score: 15-8)
Ayo McCollum drives, picks up John Quickley. Help arrives from Jaren Dosunmu! Ayo McCollum attempts a Layup. Contested by Jaren Dosunmu (3.0 feet, ZONE). AYO MCCOLLUM MAKES IT! Assist: Karl Fox
Score: 15-10

[07:47] Team_007 possession (Score: 15-10)
John Quickley drives, Ayo McCollum stays with him. John Quickley attempts a Layup. Contested by Ayo McCollum (5.3 feet, ZONE). John Quickley misses. Rebound secured by Victor Westbrook.

[07:29] Team_044 possession (Score: 15-10)
Karl Fox drives, John Quickley stays with him. Karl Fox attempts a Dunk. Contested by John Quickley (3.1 feet, MAN). Karl Fox misses. Rebound secured by John Quickley.

[07:17] Team_007 possession (Score: 15-10)
Tobias Johnson attempts a 3Pt. Contested by Zach McGrady (4.5 feet, MAN). Tobias Johnson misses. Rebound secured by Victor Westbrook.

[07:03] Team_044 possession (Score: 15-10)
Victor Westbrook attempts a Layup. Contested by John Quickley (3.1 feet, ZONE). VICTOR WESTBROOK MAKES IT!
Score: 15-12

[06:52] Team_007 possession (Score: 15-12)
Carmelo Siakam makes the Dunk and draws the foul on Ayo McCollum! And-1! Carmelo Siakam to the line for 1. [Team fouls: 1] (Ayo McCollum: 1 personal fouls)   FT 1/1: GOOD Carmelo Siakam makes 1/1 from the line.
Score: 18-12

[06:37] Team_044 possession (Score: 18-12)
Karl Fox attempts a 3Pt. Contested by John Quickley (3.1 feet, MAN). Karl Fox misses. Rebound secured by Bones Siakam.

[06:19] Team_007 possession (Score: 18-12)
Jaren Dosunmu drives to the basket... Jaren Dosunmu throws a bad pass! Stolen by Ayo McCollum! TURNOVER! (live ball)

[06:08] Team_044 possession (Score: 18-12)
Zach McGrady attempts a 3Pt. Contested by Tobias Johnson (5.1 feet, MAN). ZACH MCGRADY MAKES IT! Assist: Victor Westbrook
Score: 18-15

[05:52] Team_007 possession (Score: 18-15)
John Quickley drives and kicks out. John Quickley attempts a 3Pt. Contested by Karl Fox (3.9 feet, MAN). John Quickley misses. Rebound secured by Victor Westbrook.

[05:42] Team_044 possession (Score: 18-15)
Karl Fox attempts a 3Pt. Contested by John Quickley (3.2 feet, ZONE). KARL FOX MAKES IT! Assist: Zach McGrady
Score: 18-18

[05:26] Team_007 possession (Score: 18-18)
Tobias Johnson drives to the basket... Tobias Johnson throws a bad pass out of bounds! TURNOVER! (dead ball)

[05:13] Team_044 possession (Score: 18-18)
Victor Westbrook attempts a Midrange. Contested by Bones Siakam (3.7 feet, MAN). Victor Westbrook misses. Offensive rebound by Victor Westbrook! Victor Westbrook kicks it out.

[05:01] Team_044 possession (Score: 18-18)
Zach McGrady attempts a Midrange. Contested by Tobias Johnson (5.1 feet, MAN). Zach McGrady misses. Rebound secured by Bones Siakam.

[04:47] Team_007 possession (Score: 18-18)
FOUL! Shooting foul on Ayo McCollum. Bones Siakam to the line for 2 free throws. [Team fouls: 2] (Ayo McCollum: 2 personal fouls)   FT 1/2: GOOD   FT 2/2: GOOD Bones Siakam makes 2/2 from the line.
Score: 20-18

[04:32] Team_044 possession (Score: 20-18)
Zach McGrady drives, picks up John Quickley. Help arrives from Jaren Dosunmu! Zach McGrady attempts a Dunk. Contested by Jaren Dosunmu (3.4 feet, ZONE). Zach McGrady misses. Rebound secured by Carmelo Siakam.

[04:14] Team_007 possession (Score: 20-18)
John Quickley drives, Ayo McCollum stays with him. John Quickley attempts a Layup. Contested by Ayo McCollum (5.5 feet, ZONE). JOHN QUICKLEY MAKES IT!
Score: 22-18

[04:00] Team_044 possession (Score: 22-18)
Ayo McCollum drives to the basket... Ayo McCollum throws a bad pass! Stolen by John Quickley! TURNOVER! (live ball)

[03:46] Team_007 possession (Score: 22-18)
FOUL! Shooting foul on Karl Fox. John Quickley to the line for 2 free throws. [Team fouls: 3] (Karl Fox: 1 personal fouls)   FT 1/2: MISS   FT 2/2: GOOD John Quickley makes 1/2 from the line.
Score: 23-18

[03:31] Team_044 possession (Score: 23-18)
Victor Westbrook attempts a Layup. Contested by Bones Siakam (3.9 feet, MAN). VICTOR WESTBROOK MAKES IT! Assist: Isaiah Murray
Score: 23-20

[03:15] Team_007 possession (Score: 23-20)
Tobias Johnson drives and kicks out. Jaren Dosunmu attempts a 3Pt. Contested by Isaiah Murray (4.8 feet, MAN). Jaren Dosunmu misses. Rebound secured by Karl Fox.

[03:02] Team_044 possession (Score: 23-20)
Ayo McCollum drives to the basket... Ayo McCollum throws a bad pass out of bounds! TURNOVER! (dead ball)

[03:02] Substitution (Team_007): Bones Siakam OUT → Gary LaVine IN (stamina_rule2)

[03:02] Substitution (Team_007): John Quickley OUT → Austin Simons IN (stamina_rule2)

[03:02] Substitution (Team_007): Carmelo Siakam OUT → Draymond Harris IN (stamina_rule2)

[03:02] Substitution (Team_044): Victor Westbrook OUT → Tim Siakam IN (stamina_rule2)

[03:02] Substitution (Team_044): Ayo McCollum OUT → Victor Anthony IN (stamina_rule2)

[02:49] Team_007 possession (Score: 23-20)
Jaren Dosunmu attempts a Midrange. Contested by Isaiah Murray (4.9 feet, MAN). JAREN DOSUNMU MAKES IT! Assist: Tobias Johnson
Score: 25-20

[02:32] Team_044 possession (Score: 25-20)
Tim Siakam attempts a Midrange. Contested by Gary LaVine (4.4 feet, MAN). TIM SIAKAM MAKES IT! Assist: Isaiah Murray
Score: 25-22

[02:20] Team_007 possession (Score: 25-22)
Gary LaVine attempts a 3Pt. Contested by Tim Siakam (3.8 feet, MAN). Gary LaVine misses. Offensive rebound by Draymond Harris! Draymond Harris kicks it out.

[02:10] Team_007 possession (Score: 25-22)
Tobias Johnson attempts a Layup. Contested by Zach McGrady (4.7 feet, MAN). Tobias Johnson misses. FOUL! Loose ball foul on Karl Fox during the rebound battle. [Team fouls: 4] No free throws, side out. (Karl Fox: 2 personal fouls)

[01:57] Team_007 possession (Score: 25-22)
Gary LaVine attempts a 3Pt. Contested by Tim Siakam (3.8 feet, MAN). Gary LaVine misses. Rebound secured by Tim Siakam.

[01:44] Team_044 possession (Score: 25-22)
Victor Anthony loses the ball! Stripped by Draymond Harris! TURNOVER! (live ball)

[01:30] Team_007 possession (Score: 25-22)
Draymond Harris makes the Layup and draws the foul on Victor Anthony! And-1! Draymond Harris to the line for 1. [BONUS: 5 team fouls] (Victor Anthony: 1 personal fouls)   FT 1/1: GOOD Draymond Harris makes 1/1 from the line.
Score: 28-22

[01:16] Team_044 possession (Score: 28-22)
Karl Fox attempts a 3Pt. Contested by Austin Simons (3.8 feet, MAN). Karl Fox misses. FOUL! Loose ball foul on Gary LaVine during the rebound battle. [Team fouls: 3] No free throws, side out. (Gary LaVine: 1 personal fouls)

[01:04] Team_044 possession (Score: 28-22)
Zach McGrady attempts a 3Pt. Contested by Tobias Johnson (5.4 feet, MAN). Zach McGrady misses. Rebound secured by Gary LaVine.

[00:50] Team_007 possession (Score: 28-22)
Austin Simons attempts a Layup. Contested by Karl Fox (4.8 feet, MAN). AUSTIN SIMONS MAKES IT! Assist: Tobias Johnson
Score: 30-22

[00:33] Team_044 possession (Score: 30-22)
Victor Anthony drives, Draymond Harris stays with him. Victor Anthony attempts a Layup. Contested by Draymond Harris (5.6 feet, MAN). Victor Anthony misses. Rebound secured by Gary LaVine.

[00:19] Team_007 possession (Score: 30-22)
Jaren Dosunmu attempts a 3Pt. Contested by Isaiah Murray (5.2 feet, MAN). JAREN DOSUNMU MAKES IT! Assist: Austin Simons
Score: 33-22

[00:01] Team_044 possession (Score: 33-22)
Victor Anthony drives, Austin Simons stays with him. Victor Anthony attempts a Dunk. Contested by Austin Simons (4.5 feet, ZONE). VICTOR ANTHONY MAKES IT! Assist: Zach McGrady
Score: 33-24

================================================================================
                              1ST QUARTER COMPLETE                              
================================================================================

1ST QUARTER SCORE: Team_007 33, Team_044 24

BOX SCORE:
================================================================================

Team_007
--------------------------------------------------------------------------------
Player                MIN  PTS  REB  AST  TO      FG   FG%      3P   3P%
--------------------------------------------------------------------------------
Bones Siakam            9   11    5    0   0   4/4   100.0     0/0   0.0
John Quickley           9    5    1    0   0   3/5    60.0     0/0   0.0
Jaren Dosunmu          12    5    0    1   0   2/3    66.7     0/0   0.0
Tobias Johnson         12    4    0    3   0   2/6    33.3     0/0   0.0
Carmelo Siakam          9    3    2    3   0   1/1   100.0     0/0   0.0
Draymond Harris         3    3    2    0   0   1/1   100.0     0/0   0.0
Austin Simons           3    2    0    1   0   1/1   100.0     0/0   0.0
Gary LaVine             3    0    2    0   0   0/1     0.0     0/0   0.0

TEAM: FG: 14/22 (63.6%), 3PT: 4/7 (57.1%), REB: 12 (2 off, 10 def), AST: 8, TO: 2
TEAM FOULS: 3


Team_044
--------------------------------------------------------------------------------
Player                MIN  PTS  REB  AST  TO      FG   FG%      3P   3P%
--------------------------------------------------------------------------------
Victor Westbrook        9    6    4    2   0   3/4    75.0     0/0   0.0
Karl Fox               12    6    2    1   0   2/5    40.0     0/0   0.0
Isaiah Murray          12    3    0    2   0   1/2    50.0     0/0   0.0
Zach McGrady           12    3    0    2   0   1/5    20.0     0/0   0.0
Ayo McCollum            9    2    3    0   0   1/1   100.0     0/0   0.0
Tim Siakam              3    2    1    0   0   1/1   100.0     0/0   0.0
Victor Anthony          3    2    0    0   0   1/2    50.0     0/0   0.0

TEAM: FG: 10/20 (50.0%), 3PT: 4/8 (50.0%), REB: 10 (2 off, 8 def), AST: 7, TO: 4
TEAM FOULS: 5 [Team_007 in BONUS]

================================================================================

================================================================================
                       2ND QUARTER - Team_007 vs Team_044                       
================================================================================

[12:00] Team_007 possession (Score: 33-24)
FOUL! Shooting foul on Isaiah Murray. Jaren Dosunmu to the line for 2 free throws. [Team fouls: 1] (Isaiah Murray: 1 personal fouls)   FT 1/2: GOOD   FT 2/2: GOOD Jaren Dosunmu makes 2/2 from the line.
Score: 35-24

[11:45] Team_044 possession (Score: 35-24)
Zach McGrady drives, John Quickley stays with him. Zach McGrady attempts a Layup. Contested by John Quickley (3.2 feet, ZONE). ZACH MCGRADY MAKES IT! Assist: Isaiah Murray
Score: 35-26

[11:27] Team_007 possession (Score: 35-26)
Tobias Johnson throws a bad pass out of bounds! TURNOVER! (dead ball)

[11:27] Substitution (Team_007): Tobias Johnson OUT → Wendell Poole IN (stamina_rule2)

[11:27] Substitution (Team_007): Jaren Dosunmu OUT → OG Porzingis IN (stamina_rule2)

[11:27] Substitution (Team_044): Zach McGrady OUT → Kyrie Poole IN (stamina_rule2)

[11:27] Substitution (Team_044): Isaiah Murray OUT → Tim Towns IN (stamina_rule2)

[11:27] Substitution (Team_044): Karl Fox OUT → Pau Quickley IN (stamina_rule2)

[11:13] Team_044 possession (Score: 35-26)
Tim Towns attempts a 3Pt. Contested by John Quickley (3.3 feet, ZONE). Tim Towns misses. Rebound secured by Carmelo Siakam.

[11:00] Team_007 possession (Score: 35-26)
Carmelo Siakam drives and kicks out. Carmelo Siakam makes the 3Pt and draws the foul on Kyrie Poole! And-1! Carmelo Siakam to the line for 1. [Team fouls: 2] (Kyrie Poole: 1 personal fouls)   FT 1/1: GOOD Carmelo Siakam makes 1/1 from the line.
Score: 39-26

[10:45] Team_044 possession (Score: 39-26)
Tim Towns drives and kicks out. Victor Westbrook attempts a Midrange. Contested by Bones Siakam (3.7 feet, MAN). VICTOR WESTBROOK MAKES IT!
Score: 39-28

[10:34] Team_007 possession (Score: 39-28)
Bones Siakam drives, picks up Victor Westbrook. Help arrives from Tim Towns! Bones Siakam attempts a Layup. Contested by Tim Towns (5.4 feet, MAN). BONES SIAKAM MAKES IT! Assist: Wendell Poole
Score: 41-28

[10:21] Team_044 possession (Score: 41-28)
Kyrie Poole drives and kicks out. Ayo McCollum attempts a Midrange. Contested by Bones Siakam (3.7 feet, ZONE). Ayo McCollum misses. Offensive rebound by Ayo McCollum! Ayo McCollum kicks it out.

[10:02] Team_044 possession (Score: 41-28)
FOUL! Shooting foul on John Quickley. Tim Towns to the line for 3 free throws. [Team fouls: 1] (John Quickley: 1 personal fouls)   FT 1/3: MISS   FT 2/3: GOOD   FT 3/3: GOOD Tim Towns makes 2/3 from the line.
Score: 41-30

[09:46] Team_007 possession (Score: 41-30)
FOUL! Reach-in foul on Pau Quickley during the drive. [Team fouls: 3] No free throws, side out. (Pau Quickley: 1 personal fouls)

[09:30] Team_007 possession (Score: 41-30)
Bones Siakam attempts a Midrange. Contested by Pau Quickley (3.5 feet, ZONE). Bones Siakam misses. Rebound secured by Ayo McCollum.

[09:16] Team_044 possession (Score: 41-30)
Kyrie Poole makes the Layup and draws the foul on OG Porzingis! And-1! Kyrie Poole to the line for 1. [Team fouls: 2] (OG Porzingis: 1 personal fouls)   FT 1/1: GOOD Kyrie Poole makes 1/1 from the line.
Score: 41-33

[09:04] Team_007 possession (Score: 41-33)
Bones Siakam attempts a 3Pt. Contested by Victor Westbrook (5.5 feet, MAN). BONES SIAKAM MAKES IT!
Score: 44-33

[08:51] Team_044 possession (Score: 44-33)
Ayo McCollum attempts a Midrange. Contested by John Quickley (3.3 feet, MAN). Ayo McCollum misses. Rebound secured by Bones Siakam.

[08:33] Team_007 possession (Score: 44-33)
Bones Siakam attempts a Layup. Contested by Victor Westbrook (5.6 feet, MAN). Bones Siakam misses. Rebound secured by Victor Westbrook.

[08:17] Team_044 possession (Score: 44-33)
FOUL! Reach-in foul on John Quickley during the drive. [Team fouls: 3] No free throws, side out. (John Quickley: 2 personal fouls)

[08:00] Team_044 possession (Score: 44-33)
Tim Towns attempts a 3Pt. Contested by John Quickley (3.7 feet, ZONE). Tim Towns misses. Offensive rebound by Victor Westbrook! Victor Westbrook kicks it out.

[07:43] Team_044 possession (Score: 44-33)
FOUL! Holding foul on Bones Siakam. [Team fouls: 4] No free throws, side out. (Bones Siakam: 1 personal fouls)

[07:31] Team_044 possession (Score: 44-33)
Pau Quickley drives to the basket... FOUL! Offensive foul on Pau Quickley! John Quickley drew the charge! [Team fouls: 4] (Pau Quickley: 2 personal fouls) TURNOVER! (dead ball)

[07:17] Team_007 possession (Score: 44-33)
Carmelo Siakam drives to the basket... Carmelo Siakam throws a bad pass! Stolen by Pau Quickley! TURNOVER! (live ball)

[07:05] Team_044 possession (Score: 44-33)
Victor Westbrook drives and kicks out. Ayo McCollum attempts a 3Pt. Contested by John Quickley (3.7 feet, ZONE). Ayo McCollum misses. Rebound secured by Bones Siakam.

[06:51] Team_007 possession (Score: 44-33)
OG Porzingis attempts a Midrange. Contested by Victor Westbrook (5.3 feet, ZONE). OG Porzingis misses. Rebound secured by Pau Quickley.

[06:38] Team_044 possession (Score: 44-33)
Kyrie Poole attempts a Midrange. Contested by Wendell Poole (5.1 feet, MAN). Kyrie Poole misses. Rebound secured by Carmelo Siakam.

[06:25] Team_007 possession (Score: 44-33)
John Quickley drives to the basket... John Quickley loses control! Ball rolls out of bounds! TURNOVER! (dead ball)

[06:25] Substitution (Team_007): Bones Siakam OUT → Gary LaVine IN (stamina_rule2)

[06:25] Substitution (Team_007): John Quickley OUT → Austin Simons IN (stamina_rule2)

[06:25] Substitution (Team_007): Carmelo Siakam OUT → Draymond Harris IN (stamina_rule2)

[06:25] Substitution (Team_044): Victor Westbrook OUT → Tim Siakam IN (stamina_rule2)

[06:25] Substitution (Team_044): Ayo McCollum OUT → Victor Anthony IN (stamina_rule2)

[06:11] Team_044 possession (Score: 44-33)
Tim Towns drives, Austin Simons stays with him. Tim Towns attempts a Dunk. Contested by Austin Simons (4.0 feet, ZONE). TIM TOWNS MAKES IT! Assist: Tim Siakam
Score: 44-35

[05:53] Team_007 possession (Score: 44-35)
OG Porzingis commits a violation (traveling/carry)! TURNOVER! (dead ball)

[05:37] Team_044 possession (Score: 44-35)
Tim Siakam attempts a 3Pt. Contested by Gary LaVine (4.4 feet, MAN). Tim Siakam misses. Rebound secured by Gary LaVine.

[05:25] Team_007 possession (Score: 44-35)
OG Porzingis attempts a 3Pt. Contested by Tim Towns (4.9 feet, MAN). OG PORZINGIS MAKES IT! Assist: Gary LaVine
Score: 47-35

[05:11] Team_044 possession (Score: 47-35)
Kyrie Poole drives and kicks out. Victor Anthony attempts a Midrange. Contested by Draymond Harris (5.0 feet, MAN). Victor Anthony misses. Rebound secured by Gary LaVine.

[04:52] Team_007 possession (Score: 47-35)
Gary LaVine attempts a 3Pt. Contested by Tim Siakam (3.8 feet, ZONE). GARY LAVINE MAKES IT!
Score: 50-35

[04:38] Team_044 possession (Score: 50-35)
Kyrie Poole attempts a 3Pt. Contested by Wendell Poole (5.1 feet, MAN). Kyrie Poole misses. Offensive rebound by Tim Siakam! Tim Siakam kicks it out.

[04:22] Team_044 possession (Score: 50-35)
Kyrie Poole attempts a 3Pt. Contested by Wendell Poole (5.2 feet, MAN). Kyrie Poole misses. Offensive rebound by Tim Siakam! Tim Siakam kicks it out.

[04:09] Team_044 possession (Score: 50-35)
Tim Siakam attempts a Layup. Contested by Gary LaVine (4.4 feet, MAN). TIM SIAKAM MAKES IT! Assist: Pau Quickley
Score: 50-37

[03:50] Team_007 possession (Score: 50-37)
OG Porzingis attempts a 3Pt. Contested by Tim Towns (5.0 feet, MAN). OG Porzingis misses. Rebound secured by Victor Anthony.

[03:34] Team_044 possession (Score: 50-37)
Tim Siakam attempts a 3Pt. Contested by OG Porzingis (4.4 feet, ZONE). Tim Siakam misses. Rebound secured by Draymond Harris.

[03:15] Team_007 possession (Score: 50-37)
Austin Simons attempts a 3Pt. Contested by Tim Siakam (4.0 feet, ZONE). Austin Simons misses. Rebound secured by Victor Anthony.

[03:06] Team_044 possession (Score: 50-37)
FOUL! Shooting foul on OG Porzingis. Pau Quickley to the line for 2 free throws. [BONUS: 5 team fouls] (OG Porzingis: 2 personal fouls)   FT 1/2: GOOD   FT 2/2: GOOD Pau Quickley makes 2/2 from the line.
Score: 50-39

[02:52] Team_007 possession (Score: 50-39)
Draymond Harris attempts a Midrange. Contested by Victor Anthony (4.3 feet, MAN). Draymond Harris misses. Rebound secured by Victor Anthony.

[02:35] Team_044 possession (Score: 50-39)
Victor Anthony attempts a Layup. Contested by Austin Simons (4.5 feet, ZONE). Victor Anthony misses. Offensive rebound by Tim Siakam! Tim Siakam kicks it out.

[02:19] Team_044 possession (Score: 50-39)
Tim Towns attempts a 3Pt. Contested by OG Porzingis (4.6 feet, ZONE). Tim Towns misses. Rebound secured by Austin Simons.

[02:08] Team_007 possession (Score: 50-39)
Wendell Poole attempts a 3Pt. Contested by Tim Siakam (3.9 feet, ZONE). Wendell Poole misses. Offensive rebound by Draymond Harris! Draymond Harris kicks it out.

[01:57] Team_007 possession (Score: 50-39)
OG Porzingis attempts a Midrange. Contested by Tim Towns (5.2 feet, ZONE). OG Porzingis misses. Rebound secured by Victor Anthony.

[01:44] Team_044 possession (Score: 50-39)
FOUL! Holding foul on Gary LaVine. [IN THE BONUS! 6 team fouls] Tim Siakam to the line for 2 free throws. (Gary LaVine: 1 personal fouls)   FT 1/2: GOOD   FT 2/2: GOOD Tim Siakam makes 2/2 from the line.
Score: 50-41

[01:26] Team_007 possession (Score: 50-41)
OG Porzingis attempts a Layup. Contested by Tim Towns (5.2 feet, MAN). OG PORZINGIS MAKES IT! Assist: Gary LaVine
Score: 52-41

[01:11] Team_044 possession (Score: 52-41)
Pau Quickley attempts a 3Pt. Contested by Austin Simons (4.0 feet, MAN). Pau Quickley misses. Rebound secured by Austin Simons.

[00:57] Team_007 possession (Score: 52-41)
Gary LaVine drives, picks up Tim Siakam. Help arrives from Tim Towns! Gary LaVine attempts a Dunk. Contested by Tim Towns (3.8 feet, MAN). Gary LaVine misses. Rebound secured by Victor Anthony.

[00:45] Team_044 possession (Score: 52-41)
Tim Towns attempts a Midrange. Contested by OG Porzingis (4.7 feet, MAN). Tim Towns misses. Rebound secured by Draymond Harris.

[00:34] Team_007 possession (Score: 52-41)
Gary LaVine attempts a 3Pt. Contested by Tim Siakam (3.8 feet, ZONE). Gary LaVine misses. Offensive rebound by Austin Simons! Austin Simons's putback is no good. Rebound secured by Victor Anthony.

[00:20] Team_044 possession (Score: 52-41)
Kyrie Poole drives and kicks out. Tim Siakam attempts a 3Pt. Contested by Gary LaVine (4.4 feet, MAN). Tim Siakam misses. Rebound secured by Austin Simons.

[00:05] Team_007 possession (Score: 52-41)
Austin Simons attempts a 3Pt. Contested by Tim Siakam (4.1 feet, ZONE). AUSTIN SIMONS MAKES IT!
Score: 55-41

================================================================================
                              2ND QUARTER COMPLETE                              
================================================================================

2ND QUARTER SCORE: Team_007 22, Team_044 17

BOX SCORE:
================================================================================

Team_007
--------------------------------------------------------------------------------
Player                MIN  PTS  REB  AST  TO      FG   FG%      3P   3P%
--------------------------------------------------------------------------------
Bones Siakam           15    5    2    0   0   2/4    50.0     0/0   0.0
OG Porzingis           11    5    0    0   0   2/5    40.0     0/0   0.0
Carmelo Siakam         15    4    2    0   0   1/1   100.0     0/0   0.0
Gary LaVine             9    3    2    2   0   1/3    33.3     0/0   0.0
Austin Simons           9    3    3    0   0   1/2    50.0     0/0   0.0
Jaren Dosunmu          13    2    0    0   0   1/1   100.0     0/0   0.0
Wendell Poole          11    0    0    1   0   0/0     0.0     0/0   0.0
Victor Anthony          9    0    6    0   0   0/0     0.0     0/0   0.0
Draymond Harris         9    0    3    0   0   0/1     0.0     0/0   0.0

TEAM: FG: 8/17 (47.1%), 3PT: 4/7 (57.1%), REB: 13 (2 off, 11 def), AST: 3, TO: 4
TEAM FOULS: 6 [Team_044 in BONUS]


Team_044
--------------------------------------------------------------------------------
Player                MIN  PTS  REB  AST  TO      FG   FG%      3P   3P%
--------------------------------------------------------------------------------
Tim Towns              11    4    0    0   0   2/5    40.0     0/0   0.0
Tim Siakam              9    4    3    1   0   2/4    50.0     0/0   0.0
Kyrie Poole            11    3    0    0   0   1/4    25.0     0/0   0.0
Zach McGrady           13    2    0    0   0   1/1   100.0     0/0   0.0
Victor Westbrook       15    2    2    0   0   1/2    50.0     0/0   0.0
Pau Quickley           11    2    1    1   0   1/2    50.0     0/0   0.0
Isaiah Murray          13    0    0    1   0   0/0     0.0     0/0   0.0
Ayo McCollum           15    0    2    0   0   0/1     0.0     0/0   0.0

TEAM: FG: 8/19 (42.1%), 3PT: 1/6 (16.7%), REB: 13 (5 off, 8 def), AST: 3, TO: 1
TEAM FOULS: 4

================================================================================

================================================================================
                       3RD QUARTER - Team_007 vs Team_044                       
================================================================================

[12:00] Team_007 possession (Score: 55-41)
Carmelo Siakam throws a bad pass! Stolen by Ayo McCollum! TURNOVER! (live ball)

[11:49] Team_044 possession (Score: 55-41)
Ayo McCollum drives, John Quickley stays with him. Ayo McCollum attempts a Dunk. Contested by John Quickley (3.0 feet, MAN). Ayo McCollum misses. Rebound secured by John Quickley.

[11:31] Team_007 possession (Score: 55-41)
FOUL! Reach-in foul on Ayo McCollum during the drive. [Team fouls: 1] No free throws, side out. (Ayo McCollum: 1 personal fouls)

[11:22] Team_007 possession (Score: 55-41)
Jaren Dosunmu attempts a 3Pt. Contested by Isaiah Murray (4.7 feet, MAN). Jaren Dosunmu misses. Rebound secured by Karl Fox.

[11:10] Team_044 possession (Score: 55-41)
Karl Fox attempts a 3Pt. Contested by John Quickley (3.1 feet, MAN). Karl Fox misses. Rebound secured by John Quickley.

[10:53] Team_007 possession (Score: 55-41)
Carmelo Siakam makes the Layup and draws the foul on Ayo McCollum! And-1! Carmelo Siakam to the line for 1. [Team fouls: 2] (Ayo McCollum: 2 personal fouls)   FT 1/1: MISS Carmelo Siakam makes 0/1 from the line. Offensive rebound by Carmelo Siakam! Carmelo Siakam puts it back in!
Score: 59-41

[10:42] Team_044 possession (Score: 59-41)
Zach McGrady attempts a 3Pt. Contested by John Quickley (3.3 feet, ZONE). Zach McGrady misses. Rebound secured by John Quickley.

[10:28] Team_007 possession (Score: 59-41)
Tobias Johnson attempts a Midrange. Contested by Zach McGrady (4.5 feet, MAN). Tobias Johnson misses. Offensive rebound by Bones Siakam! Bones Siakam puts it back in!
Score: 61-41

[10:10] Team_044 possession (Score: 61-41)
Karl Fox attempts a 3Pt. Contested by Bones Siakam (3.7 feet, ZONE). KARL FOX MAKES IT! Assist: Zach McGrady
Score: 61-44

[10:00] Team_007 possession (Score: 61-44)
Bones Siakam attempts a 3Pt. Contested by Victor Westbrook (5.3 feet, MAN). BONES SIAKAM MAKES IT! Assist: Tobias Johnson
Score: 64-44

[09:42] Team_044 possession (Score: 64-44)
Zach McGrady attempts a 3Pt. Contested by Bones Siakam (3.8 feet, ZONE). ZACH MCGRADY MAKES IT! Assist: Isaiah Murray
Score: 64-47

[09:28] Team_007 possession (Score: 64-47)
Jaren Dosunmu drives and kicks out. Jaren Dosunmu attempts a Midrange. Contested by Isaiah Murray (4.7 feet, MAN). JAREN DOSUNMU MAKES IT! Assist: Tobias Johnson
Score: 66-47

[09:15] Team_044 possession (Score: 66-47)
Victor Westbrook attempts a 3Pt. Contested by John Quickley (3.1 feet, ZONE). VICTOR WESTBROOK MAKES IT! Assist: Isaiah Murray
Score: 66-50

[08:59] Team_007 possession (Score: 66-50)
John Quickley drives and kicks out. Tobias Johnson attempts a 3Pt. Contested by Zach McGrady (4.1 feet, ZONE). Tobias Johnson misses. Rebound secured by Victor Westbrook.

[08:45] Team_044 possession (Score: 66-50)
Victor Westbrook attempts a Midrange. Contested by Bones Siakam (3.7 feet, MAN). Victor Westbrook misses. Rebound secured by Carmelo Siakam.

[08:33] Team_007 possession (Score: 66-50)
FOUL! Reach-in foul on Ayo McCollum during the drive. [Team fouls: 3] No free throws, side out. (Ayo McCollum: 3 personal fouls)

[08:19] Team_007 possession (Score: 66-50)
Bones Siakam attempts a Midrange. Contested by Victor Westbrook (5.3 feet, MAN). BONES SIAKAM MAKES IT! Assist: Tobias Johnson
Score: 68-50

[08:03] Team_044 possession (Score: 68-50)
Ayo McCollum attempts a Layup. Contested by Carmelo Siakam (4.1 feet, ZONE). AYO MCCOLLUM MAKES IT!
Score: 68-52

[07:54] Team_007 possession (Score: 68-52)
Tobias Johnson attempts a 3Pt. Contested by Zach McGrady (4.5 feet, MAN). Tobias Johnson misses. Rebound secured by Ayo McCollum.

[07:41] Team_044 possession (Score: 68-52)
Zach McGrady drives and kicks out. Victor Westbrook attempts a Midrange. Contested by Bones Siakam (3.6 feet, MAN). Victor Westbrook misses. Rebound secured by Bones Siakam.

[07:23] Team_007 possession (Score: 68-52)
Tobias Johnson throws a bad pass out of bounds! TURNOVER! (dead ball)

[07:06] Team_044 possession (Score: 68-52)
Zach McGrady attempts a Midrange. BLOCKED BY TOBIAS JOHNSON! Ball is loose! Offensive rebound by Victor Westbrook! Victor Westbrook kicks it out.

[06:51] Team_044 possession (Score: 68-52)
Isaiah Murray drives to the basket... Isaiah Murray throws a bad pass out of bounds! TURNOVER! (dead ball)

[06:36] Team_007 possession (Score: 68-52)
Jaren Dosunmu throws a bad pass! Stolen by Isaiah Murray! TURNOVER! (live ball)

[06:24] Team_044 possession (Score: 68-52)
Ayo McCollum makes the Layup and draws the foul on John Quickley! And-1! Ayo McCollum to the line for 1. [Team fouls: 1] (John Quickley: 1 personal fouls)   FT 1/1: GOOD Ayo McCollum makes 1/1 from the line.
Score: 68-55

[06:07] Team_007 possession (Score: 68-55)
Jaren Dosunmu makes the Midrange and draws the foul on Victor Westbrook! And-1! Jaren Dosunmu to the line for 1. [Team fouls: 4] (Victor Westbrook: 1 personal fouls)   FT 1/1: GOOD Jaren Dosunmu makes 1/1 from the line.
Score: 71-55

[05:51] Team_044 possession (Score: 71-55)
Zach McGrady attempts a 3Pt. Contested by Tobias Johnson (5.1 feet, MAN). ZACH MCGRADY MAKES IT! Assist: Isaiah Murray
Score: 71-58

[05:40] Team_007 possession (Score: 71-58)
FOUL! Shooting foul on Ayo McCollum. Carmelo Siakam to the line for 2 free throws. [BONUS: 5 team fouls] (Ayo McCollum: 4 personal fouls)   FT 1/2: GOOD   FT 2/2: GOOD Carmelo Siakam makes 2/2 from the line.
Score: 73-58

[05:25] Team_044 possession (Score: 73-58)
Victor Westbrook throws a bad pass out of bounds! TURNOVER! (dead ball)

[05:12] Team_007 possession (Score: 73-58)
Carmelo Siakam attempts a Dunk. BLOCKED BY ZACH MCGRADY! Ball is loose! Rebound secured by Ayo McCollum.

[04:56] Team_044 possession (Score: 73-58)
Zach McGrady attempts a 3Pt. Contested by John Quickley (3.4 feet, ZONE). Zach McGrady misses. Rebound secured by Bones Siakam.

[04:39] Team_007 possession (Score: 73-58)
John Quickley attempts a 3Pt. Contested by Karl Fox (4.6 feet, MAN). John Quickley misses. Rebound secured by Karl Fox.

[04:25] Team_044 possession (Score: 73-58)
Victor Westbrook attempts a 3Pt. Contested by Bones Siakam (3.8 feet, MAN). Victor Westbrook misses. Rebound secured by Carmelo Siakam.

[04:08] Team_007 possession (Score: 73-58)
Carmelo Siakam drives to the basket... Carmelo Siakam throws a bad pass! Stolen by Ayo McCollum! TURNOVER! (live ball)

[03:56] Team_044 possession (Score: 73-58)
Victor Westbrook makes the Dunk and draws the foul on Bones Siakam! And-1! Victor Westbrook to the line for 1. [Team fouls: 2] (Bones Siakam: 1 personal fouls)   FT 1/1: GOOD Victor Westbrook makes 1/1 from the line.
Score: 73-61

[03:43] Team_007 possession (Score: 73-61)
Carmelo Siakam attempts a 3Pt. Contested by Ayo McCollum (5.2 feet, MAN). CARMELO SIAKAM MAKES IT! Assist: John Quickley
Score: 76-61

[03:29] Team_044 possession (Score: 76-61)
Victor Westbrook attempts a 3Pt. Contested by Bones Siakam (3.9 feet, ZONE). Victor Westbrook misses. Offensive rebound by Victor Westbrook! Victor Westbrook kicks it out.

[03:15] Team_044 possession (Score: 76-61)
Isaiah Murray makes the Dunk and draws the foul on John Quickley! And-1! Isaiah Murray to the line for 1. [Team fouls: 3] (John Quickley: 2 personal fouls)   FT 1/1: GOOD Isaiah Murray makes 1/1 from the line.
Score: 76-64

[03:02] Team_007 possession (Score: 76-64)
Bones Siakam attempts a Layup. Contested by Victor Westbrook (5.5 feet, MAN). BONES SIAKAM MAKES IT!
Score: 78-64

[02:47] Team_044 possession (Score: 78-64)
Zach McGrady attempts a Midrange. Contested by Tobias Johnson (5.2 feet, MAN). Zach McGrady misses. Rebound secured by Carmelo Siakam.

[02:32] Team_007 possession (Score: 78-64)
Bones Siakam makes the Midrange and draws the foul on Victor Westbrook! And-1! Bones Siakam to the line for 1. [BONUS: 6 team fouls] (Victor Westbrook: 2 personal fouls)   FT 1/1: MISS Bones Siakam makes 0/1 from the line. Rebound secured by Ayo McCollum.
Score: 80-64

[02:19] Team_044 possession (Score: 80-64)
Zach McGrady attempts a 3Pt. Contested by John Quickley (3.7 feet, ZONE). ZACH MCGRADY MAKES IT! Assist: Isaiah Murray
Score: 80-67

[02:07] Team_007 possession (Score: 80-67)
Tobias Johnson throws a bad pass out of bounds! TURNOVER! (dead ball)

[02:07] Substitution (Team_007): Tobias Johnson OUT → Wendell Poole IN (stamina_rule2)

[02:07] Substitution (Team_007): Jaren Dosunmu OUT → OG Porzingis IN (stamina_rule2)

[02:07] Substitution (Team_007): Bones Siakam OUT → Gary LaVine IN (stamina_rule2)

[02:07] Substitution (Team_007): John Quickley OUT → Austin Simons IN (stamina_rule2)

[02:07] Substitution (Team_007): Carmelo Siakam OUT → Draymond Harris IN (stamina_rule2)

[02:07] Substitution (Team_044): Zach McGrady OUT → Kyrie Poole IN (stamina_rule2)

[02:07] Substitution (Team_044): Isaiah Murray OUT → Tim Towns IN (stamina_rule2)

[02:07] Substitution (Team_044): Victor Westbrook OUT → Tim Siakam IN (stamina_rule2)

[02:07] Substitution (Team_044): Karl Fox OUT → Pau Quickley IN (stamina_rule2)

[02:07] Substitution (Team_044): Ayo McCollum OUT → Victor Anthony IN (stamina_rule2)

[01:50] Team_044 possession (Score: 80-67)
Kyrie Poole attempts a 3Pt. Contested by Wendell Poole (5.1 feet, MAN). Kyrie Poole misses. Rebound secured by Austin Simons.

[01:35] Team_007 possession (Score: 80-67)
Draymond Harris drives to the basket... Draymond Harris throws a bad pass! Stolen by Pau Quickley! TURNOVER! (live ball)

[01:17] Team_044 possession (Score: 80-67)
Kyrie Poole drives and kicks out. Kyrie Poole attempts a 3Pt. Contested by OG Porzingis (4.3 feet, ZONE). Kyrie Poole misses. FOUL! Loose ball foul on Draymond Harris during the rebound battle. [Team fouls: 4] No free throws, side out. (Draymond Harris: 1 personal fouls)

[01:04] Team_044 possession (Score: 80-67)
Tim Towns drives, OG Porzingis stays with him. Tim Towns attempts a Layup. Contested by OG Porzingis (4.4 feet, MAN). Tim Towns misses. Rebound secured by Austin Simons.

[00:52] Team_007 possession (Score: 80-67)
Gary LaVine attempts a 3Pt. Contested by Tim Siakam (3.8 feet, ZONE). GARY LAVINE MAKES IT! Assist: Wendell Poole
Score: 83-67

[00:35] Team_044 possession (Score: 83-67)
Tim Towns drives, Austin Simons stays with him. Tim Towns attempts a Layup. Contested by Austin Simons (4.0 feet, ZONE). TIM TOWNS MAKES IT!
Score: 83-69

[00:20] Team_007 possession (Score: 83-69)
Gary LaVine attempts a Midrange. Contested by Tim Siakam (3.8 feet, MAN). GARY LAVINE MAKES IT! Assist: Austin Simons
Score: 85-69

[00:07] Team_044 possession (Score: 85-69)
Tim Siakam attempts a 3Pt. Contested by Gary LaVine (4.4 feet, MAN). Tim Siakam misses. Offensive rebound by Victor Anthony! Victor Anthony kicks it out.

================================================================================
                              3RD QUARTER COMPLETE                              
================================================================================

3RD QUARTER SCORE: Team_007 30, Team_044 28

BOX SCORE:
================================================================================

Team_007
--------------------------------------------------------------------------------
Player                MIN  PTS  REB  AST  TO      FG   FG%      3P   3P%
--------------------------------------------------------------------------------
Carmelo Siakam         25    9    3    0   0   3/4    75.0     0/0   0.0
Bones Siakam           25    9    3    0   0   4/5    80.0     0/0   0.0
Jaren Dosunmu          23    5    0    0   0   2/3    66.7     0/0   0.0
Gary LaVine            11    5    0    0   0   2/2   100.0     0/0   0.0
John Quickley          25    0    3    1   0   0/2     0.0     0/0   0.0
Tobias Johnson         23    0    0    3   0   0/1     0.0     0/0   0.0
Austin Simons          11    0    2    1   0   0/0     0.0     0/0   0.0
Wendell Poole          13    0    0    1   0   0/0     0.0     0/0   0.0

TEAM: FG: 11/17 (64.7%), 3PT: 3/6 (50.0%), REB: 11 (1 off, 10 def), AST: 6, TO: 6
TEAM FOULS: 4


Team_044
--------------------------------------------------------------------------------
Player                MIN  PTS  REB  AST  TO      FG   FG%      3P   3P%
--------------------------------------------------------------------------------
Zach McGrady           23    9    0    1   0   3/7    42.9     0/0   0.0
Victor Westbrook       25    6    3    0   0   2/4    50.0     0/0   0.0
Ayo McCollum           25    5    3    0   0   2/3    66.7     0/0   0.0
Karl Fox               23    3    2    0   0   1/2    50.0     0/0   0.0
Isaiah Murray          23    3    0    4   0   1/1   100.0     0/0   0.0
Tim Towns              13    2    0    0   0   1/2    50.0     0/0   0.0
Kyrie Poole            13    0    0    0   0   0/1     0.0     0/0   0.0
Victor Anthony         11    0    2    0   0   0/0     0.0     0/0   0.0

TEAM: FG: 10/20 (50.0%), 3PT: 5/10 (50.0%), REB: 10 (4 off, 6 def), AST: 5, TO: 2
TEAM FOULS: 6 [Team_007 in BONUS]

================================================================================

================================================================================
                       4TH QUARTER - Team_007 vs Team_044                       
================================================================================

[12:00] Team_007 possession (Score: 85-69)
FOUL! Holding foul on Victor Westbrook. [Team fouls: 1] No free throws, side out. (Victor Westbrook: 1 personal fouls)

[11:49] Team_007 possession (Score: 85-69)
John Quickley drives, Ayo McCollum stays with him. John Quickley attempts a Layup. Contested by Ayo McCollum (5.4 feet, ZONE). JOHN QUICKLEY MAKES IT! Assist: Jaren Dosunmu
Score: 87-69

[11:32] Team_044 possession (Score: 87-69)
Zach McGrady throws a bad pass out of bounds! TURNOVER! (dead ball)

[11:19] Team_007 possession (Score: 87-69)
Carmelo Siakam loses the ball! Stripped by Ayo McCollum! TURNOVER! (live ball)

[11:04] Team_044 possession (Score: 87-69)
Ayo McCollum makes the Midrange and draws the foul on Bones Siakam! And-1! Ayo McCollum to the line for 1. [Team fouls: 1] (Bones Siakam: 1 personal fouls)   FT 1/1: GOOD Ayo McCollum makes 1/1 from the line.
Score: 87-72

[10:49] Team_007 possession (Score: 87-72)
Carmelo Siakam drives to the basket... Carmelo Siakam loses the ball! Stripped by Ayo McCollum! TURNOVER! (live ball)

[10:33] Team_044 possession (Score: 87-72)
Victor Westbrook attempts a 3Pt. Contested by John Quickley (3.4 feet, ZONE). Victor Westbrook misses. Rebound secured by John Quickley.

[10:18] Team_007 possession (Score: 87-72)
Bones Siakam attempts a 3Pt. Contested by Isaiah Murray (4.9 feet, ZONE). Bones Siakam misses. Offensive rebound by Carmelo Siakam! Carmelo Siakam puts it back in!
Score: 89-72

[10:09] Team_044 possession (Score: 89-72)
Karl Fox attempts a 3Pt. Contested by John Quickley (3.5 feet, MAN). Karl Fox misses. FOUL! Loose ball foul on Carmelo Siakam during the rebound battle. [Team fouls: 2] No free throws, side out. (Carmelo Siakam: 1 personal fouls)

[09:53] Team_044 possession (Score: 89-72)
Karl Fox loses the ball! Stripped by John Quickley! TURNOVER! (live ball)

[09:39] Team_007 possession (Score: 89-72)
John Quickley makes the Dunk and draws the foul on Ayo McCollum! And-1! John Quickley to the line for 1. [Team fouls: 2] (Ayo McCollum: 1 personal fouls)   FT 1/1: GOOD John Quickley makes 1/1 from the line.
Score: 92-72

[09:25] Team_044 possession (Score: 92-72)
FOUL! Reach-in foul on John Quickley during the drive. [Team fouls: 3] No free throws, side out. (John Quickley: 1 personal fouls)

[09:09] Team_044 possession (Score: 92-72)
Victor Westbrook loses control! Ball rolls out of bounds! TURNOVER! (dead ball)

[09:09] Substitution (Team_007): Tobias Johnson OUT → Wendell Poole IN (stamina_rule2)

[09:09] Substitution (Team_007): Bones Siakam OUT → Gary LaVine IN (stamina_rule2)

[09:09] Substitution (Team_007): John Quickley OUT → Austin Simons IN (stamina_rule2)

[09:09] Substitution (Team_007): Carmelo Siakam OUT → Draymond Harris IN (stamina_rule2)

[09:09] Substitution (Team_044): Zach McGrady OUT → Kyrie Poole IN (stamina_rule2)

[09:09] Substitution (Team_044): Isaiah Murray OUT → Tim Towns IN (stamina_rule2)

[09:09] Substitution (Team_044): Victor Westbrook OUT → Tim Siakam IN (stamina_rule2)

[09:09] Substitution (Team_044): Karl Fox OUT → Pau Quickley IN (stamina_rule2)

[09:09] Substitution (Team_044): Ayo McCollum OUT → Victor Anthony IN (stamina_rule2)

[08:54] Team_007 possession (Score: 92-72)
Wendell Poole attempts a Midrange. Contested by Kyrie Poole (4.9 feet, MAN). Wendell Poole misses. Offensive rebound by Austin Simons! Austin Simons puts it back in!
Score: 94-72

[08:43] Team_044 possession (Score: 94-72)
Pau Quickley makes the Dunk and draws the foul on Jaren Dosunmu! And-1! Pau Quickley to the line for 1. [Team fouls: 4] (Jaren Dosunmu: 1 personal fouls)   FT 1/1: GOOD Pau Quickley makes 1/1 from the line.
Score: 94-75

[08:32] Team_007 possession (Score: 94-75)
Austin Simons loses control! Ball rolls out of bounds! TURNOVER! (dead ball)

[08:32] Substitution (Team_007): Jaren Dosunmu OUT → OG Porzingis IN (stamina_rule2)

[08:17] Team_044 possession (Score: 94-75)
Tim Towns attempts a Midrange. Contested by OG Porzingis (4.4 feet, MAN). Tim Towns misses. Rebound secured by Austin Simons.

[07:58] Team_007 possession (Score: 94-75)
Gary LaVine attempts a 3Pt. Contested by Tim Siakam (3.8 feet, ZONE). GARY LAVINE MAKES IT!
Score: 97-75

[07:44] Team_044 possession (Score: 97-75)
Pau Quickley attempts a Midrange. Contested by Austin Simons (4.1 feet, ZONE). Pau Quickley misses. Rebound secured by Gary LaVine.

[07:30] Team_007 possession (Score: 97-75)
Wendell Poole attempts a 3Pt. Contested by Kyrie Poole (4.9 feet, MAN). Wendell Poole misses. Offensive rebound by Austin Simons! Austin Simons's putback is no good. Offensive rebound by Austin Simons! Austin Simons kicks it out.

[07:14] Team_007 possession (Score: 97-75)
Gary LaVine attempts a 3Pt. Contested by Tim Siakam (3.8 feet, MAN). Gary LaVine misses. Rebound secured by Tim Siakam.

[06:56] Team_044 possession (Score: 97-75)
Tim Siakam drives, Austin Simons stays with him. Tim Siakam attempts a Layup. Contested by Austin Simons (3.9 feet, ZONE). TIM SIAKAM MAKES IT! Assist: Victor Anthony
Score: 97-77

[06:40] Team_007 possession (Score: 97-77)
Austin Simons attempts a 3Pt. Contested by Tim Siakam (4.0 feet, ZONE). Austin Simons misses. Rebound secured by Victor Anthony.

[06:24] Team_044 possession (Score: 97-77)
Tim Towns makes the 3Pt and draws the foul on OG Porzingis! And-1! Tim Towns to the line for 1. [BONUS: 5 team fouls] (OG Porzingis: 1 personal fouls)   FT 1/1: GOOD Tim Towns makes 1/1 from the line.
Score: 97-81

[06:10] Team_007 possession (Score: 97-81)
Wendell Poole drives and kicks out. Austin Simons attempts a 3Pt. Contested by Pau Quickley (3.4 feet, MAN). Austin Simons misses. Rebound secured by Pau Quickley.

[06:00] Team_044 possession (Score: 97-81)
FOUL! Shooting foul on OG Porzingis. Kyrie Poole to the line for 3 free throws. [BONUS: 6 team fouls] (OG Porzingis: 2 personal fouls)   FT 1/3: GOOD   FT 2/3: GOOD   FT 3/3: GOOD Kyrie Poole makes 3/3 from the line.
Score: 97-84

[05:41] Team_007 possession (Score: 97-84)
OG Porzingis makes the Layup and draws the foul on Tim Towns! And-1! OG Porzingis to the line for 1. [Team fouls: 3] (Tim Towns: 1 personal fouls)   FT 1/1: MISS OG Porzingis makes 0/1 from the line. Offensive rebound by Austin Simons! Austin Simons puts it back in!
Score: 101-84

[05:27] Team_044 possession (Score: 101-84)
Kyrie Poole attempts a 3Pt. Contested by Wendell Poole (5.1 feet, MAN). Kyrie Poole misses. Offensive rebound by Tim Siakam! Tim Siakam kicks it out.

[05:13] Team_044 possession (Score: 101-84)
Victor Anthony attempts a Midrange. Contested by Austin Simons (4.5 feet, ZONE). VICTOR ANTHONY MAKES IT!
Score: 101-86

[04:57] Team_007 possession (Score: 101-86)
Gary LaVine attempts a Midrange. Contested by Tim Siakam (3.8 feet, MAN). Gary LaVine misses. Offensive rebound by Austin Simons! Austin Simons's putback is no good. Offensive rebound by Austin Simons! Austin Simons kicks it out.

[04:43] Team_007 possession (Score: 101-86)
OG Porzingis attempts a 3Pt. Contested by Tim Siakam (3.3 feet, ZONE). OG Porzingis misses. Rebound secured by Tim Siakam.

[04:25] Team_044 possession (Score: 101-86)
Kyrie Poole commits a violation (traveling/carry)! TURNOVER! (dead ball)

[04:09] Team_007 possession (Score: 101-86)
Gary LaVine attempts a 3Pt. Contested by Tim Siakam (3.8 feet, ZONE). Gary LaVine misses. Rebound secured by Tim Siakam.

[03:54] Team_044 possession (Score: 101-86)
Tim Siakam drives and kicks out. Tim Towns attempts a 3Pt. Contested by OG Porzingis (4.3 feet, MAN). TIM TOWNS MAKES IT! Assist: Tim Siakam
Score: 101-89

[03:38] Team_007 possession (Score: 101-89)
Gary LaVine makes the Layup and draws the foul on Tim Siakam! And-1! Gary LaVine to the line for 1. [Team fouls: 4] (Tim Siakam: 1 personal fouls)   FT 1/1: MISS Gary LaVine makes 0/1 from the line. Rebound secured by Tim Siakam.
Score: 103-89

[03:26] Team_044 possession (Score: 103-89)
Tim Towns attempts a 3Pt. Contested by Gary LaVine (4.5 feet, ZONE). TIM TOWNS MAKES IT! Assist: Kyrie Poole
Score: 103-92

[03:10] Team_007 possession (Score: 103-92)
Draymond Harris drives to the basket... Draymond Harris loses control! Ball rolls out of bounds! TURNOVER! (dead ball)

[02:52] Team_044 possession (Score: 103-92)
Pau Quickley attempts a 3Pt. Contested by OG Porzingis (4.5 feet, ZONE). Pau Quickley misses. Rebound secured by Draymond Harris.

[02:38] Team_007 possession (Score: 103-92)
Draymond Harris drives, Victor Anthony stays with him. Draymond Harris attempts a Layup. Contested by Victor Anthony (4.4 feet, MAN). DRAYMOND HARRIS MAKES IT! Assist: Wendell Poole
Score: 105-92

[02:22] Team_044 possession (Score: 105-92)
Victor Anthony drives to the basket... Victor Anthony loses the ball! Stripped by Austin Simons! TURNOVER! (live ball)

[02:07] Team_007 possession (Score: 105-92)
FOUL! Reach-in foul on Tim Siakam during the drive. [IN THE BONUS! 5 team fouls] Gary LaVine to the line for 2 free throws. (Tim Siakam: 2 personal fouls)   FT 1/2: MISS   FT 2/2: GOOD Gary LaVine makes 1/2 from the line.
Score: 106-92

[01:55] Team_044 possession (Score: 106-92)
Victor Anthony drives and kicks out. Kyrie Poole attempts a Midrange. Contested by Wendell Poole (5.3 feet, MAN). Kyrie Poole misses. Rebound secured by Austin Simons.

[01:42] Team_007 possession (Score: 106-92)
Austin Simons drives, picks up Pau Quickley. Help arrives from Tim Towns! Austin Simons attempts a Dunk. Contested by Tim Towns (3.8 feet, ZONE). AUSTIN SIMONS MAKES IT! Assist: Draymond Harris
Score: 108-92

[01:23] Team_044 possession (Score: 108-92)
Pau Quickley makes the Dunk and draws the foul on OG Porzingis! And-1! Pau Quickley to the line for 1. [BONUS: 7 team fouls] (OG Porzingis: 3 personal fouls)   FT 1/1: GOOD Pau Quickley makes 1/1 from the line.
Score: 108-95

[01:08] Team_007 possession (Score: 108-95)
OG Porzingis attempts a Midrange. Contested by Tim Siakam (3.4 feet, ZONE). OG PORZINGIS MAKES IT!
Score: 110-95

[00:53] Team_044 possession (Score: 110-95)
Tim Siakam drives to the basket... FOUL! Offensive foul on Tim Siakam! Austin Simons drew the charge! [Team fouls: 6] (Tim Siakam: 3 personal fouls) TURNOVER! (dead ball)

[00:40] Team_007 possession (Score: 110-95)
FOUL! Shooting foul on Pau Quickley. Draymond Harris to the line for 2 free throws. [BONUS: 7 team fouls] (Pau Quickley: 1 personal fouls)   FT 1/2: GOOD   FT 2/2: GOOD Draymond Harris makes 2/2 from the line.
Score: 112-95

[00:26] Team_044 possession (Score: 112-95)
Kyrie Poole attempts a Layup. Contested by Wendell Poole (5.3 feet, MAN). KYRIE POOLE MAKES IT! Assist: Tim Siakam
Score: 112-97

[00:11] Team_007 possession (Score: 112-97)
FOUL! Reach-in foul on Pau Quickley during the drive. [IN THE BONUS! 8 team fouls] Austin Simons to the line for 2 free throws. (Pau Quickley: 2 personal fouls)   FT 1/2: GOOD   FT 2/2: MISS Austin Simons makes 1/2 from the line. Rebound secured by Pau Quickley.
Score: 113-97

================================================================================
                              4TH QUARTER COMPLETE                              
================================================================================

4TH QUARTER SCORE: Team_007 28, Team_044 28

BOX SCORE:
================================================================================

Team_007
--------------------------------------------------------------------------------
Player                MIN  PTS  REB  AST  TO      FG   FG%      3P   3P%
--------------------------------------------------------------------------------
Austin Simons          20    8    5    0   0   3/5    60.0     0/0   0.0
John Quickley          28    5    1    0   0   2/2   100.0     0/0   0.0
Gary LaVine            20    4    1    0   0   2/5    40.0     0/0   0.0
Draymond Harris        20    4    1    1   0   2/2   100.0     0/0   0.0
Carmelo Siakam         28    2    1    0   0   1/1   100.0     0/0   0.0
OG Porzingis           22    2    0    0   0   1/2    50.0     0/0   0.0
Jaren Dosunmu          27    0    0    1   0   0/0     0.0     0/0   0.0
Wendell Poole          22    0    0    1   0   0/1     0.0     0/0   0.0

TEAM: FG: 11/18 (61.1%), 3PT: 2/6 (33.3%), REB: 9 (4 off, 5 def), AST: 3, TO: 4
TEAM FOULS: 7 [Team_044 in BONUS]


Team_044
--------------------------------------------------------------------------------
Player                MIN  PTS  REB  AST  TO      FG   FG%      3P   3P%
--------------------------------------------------------------------------------
Tim Towns              22   10    0    0   0   3/4    75.0     0/0   0.0
Pau Quickley           22    6    2    0   0   2/4    50.0     0/0   0.0
Kyrie Poole            22    5    0    1   0   2/2   100.0     0/0   0.0
Ayo McCollum           28    3    0    0   0   1/1   100.0     0/0   0.0
Tim Siakam             20    2    5    2   0   1/1   100.0     0/0   0.0
Victor Anthony         20    2    1    1   0   1/2    50.0     0/0   0.0
Victor Westbrook       28    0    1    0   0   0/1     0.0     0/0   0.0

TEAM: FG: 10/15 (66.7%), 3PT: 3/5 (60.0%), REB: 9 (2 off, 7 def), AST: 4, TO: 6
TEAM FOULS: 8 [Team_007 in BONUS]

================================================================================

================================================================================
                               FULL GAME COMPLETE                               
================================================================================

FINAL SCORE: Team_007 113, Team_044 97

SCORING BY QUARTER:
--------------------------------------------------------------------------------
Team                     Q1     Q2     Q3     Q4    FINAL
--------------------------------------------------------------------------------
Team_007                 33     22     30     28      113
Team_044                 24     17     28     28       97
--------------------------------------------------------------------------------

FULL GAME BOX SCORE:
================================================================================

Team_007
--------------------------------------------------------------------------------
Player                MIN  PTS  REB  AST  TO      FG   FG%      3P   3P%      FT STL BLK
--------------------------------------------------------------------------------
Bones Siakam           28   25   10    0   2  10/13   76.9   6/6   100.0   2/3     0   0
John Quickley          28   10    5    1   2   6/10   60.0   0/1     0.0   2/3     2   0
Carmelo Siakam         28   18    9    3   3   5/6    83.3   1/1   100.0   4/5     0   0
Jaren Dosunmu          27   12    0    2   1   5/7    71.4   1/3    33.3   3/3     0   1
Tobias Johnson         26    4    0    6   4   2/7    28.6   0/2     0.0   0/0     0   1
Wendell Poole          22    0    0    3   0   1/2    50.0   0/0     0.0   0/0     0   0
OG Porzingis           22    7    0    0   1   4/8    50.0   1/3    33.3   0/1     0   0
Gary LaVine            20   12    5    2   1   5/11   45.5   3/7    42.9   1/3     0   0
Austin Simons          20   13   11    2   2   3/6    50.0   1/3    33.3   1/2     1   0
Draymond Harris        20    7    6    1   0   3/4    75.0   0/0     0.0   3/3     1   0

TEAM: FG: 44/74 (59.5%), 3PT: 13/26 (50.0%), REB: 45 (9 off, 36 def), AST: 20, TO: 16


Team_044
--------------------------------------------------------------------------------
Player                MIN  PTS  REB  AST  TO      FG   FG%      3P   3P%      FT STL BLK
--------------------------------------------------------------------------------
Victor Westbrook       28   14   10    2   4   5/10   50.0   1/4    25.0   3/3     0   0
Ayo McCollum           28   10    8    0   1   4/6    66.7   0/0     0.0   2/2     5   0
Zach McGrady           26   14    0    3   2   5/13   38.5   4/7    57.1   0/0     0   1
Isaiah Murray          26    6    0    7   0   2/3    66.7   1/2    50.0   1/1     1   0
Karl Fox               26    9    4    1   1   3/7    42.9   3/5    60.0   3/3     0   0
Kyrie Poole            22    8    0    1   1   3/7    42.9   1/2    50.0   4/4     0   0
Tim Towns              22   16    0    0   0   6/11   54.5   3/5    60.0   3/4     0   0
Pau Quickley           22    8    3    1   3   3/6    50.0   0/2     0.0   4/4     2   0
Tim Siakam             20    8    9    3   0   4/6    66.7   0/2     0.0   2/2     0   0
Victor Anthony         20    4    9    1   1   2/4    50.0   0/0     0.0   0/0     0   0

TEAM: FG: 38/74 (51.4%), 3PT: 13/29 (44.8%), REB: 42 (13 off, 29 def), AST: 19, TO: 13

================================================================================
