================================================================================
                        FULL GAME - Team_018 vs Team_009                        
================================================================================

================================================================================
                       1ST QUARTER - Team_018 vs Team_009                       
================================================================================

[12:00] Team_018 possession (Score: 0-0)
Klay Stewart attempts a Midrange. Contested by Miles Sabonis (5.5 feet, MAN). KLAY STEWART MAKES IT! Assist: Domantas Wall
Score: 2-0

[11:44] Team_009 possession (Score: 2-0)
Cole Mitchell attempts a 3Pt. Contested by Bones Anunoby (3.2 feet, MAN). Cole Mitchell misses. Rebound secured by Allen Markkanen.

[11:29] Team_018 possession (Score: 2-0)
Domantas Wall makes the Midrange and draws the foul on Desmond Harden! And-1! Domantas Wall to the line for 1. [Team fouls: 1] (Desmond Harden: 1 personal fouls)   FT 1/1: GOOD Domantas Wall makes 1/1 from the line.
Score: 5-0

[11:19] Team_009 possession (Score: 5-0)
Miles Sabonis attempts a 3Pt. Contested by Klay Stewart (4.0 feet, ZONE). MILES SABONIS MAKES IT! Assist: Desmond Harden
Score: 5-3

[11:01] Team_018 possession (Score: 5-3)
Tracy Bryant attempts a 3Pt. Contested by Desmond Harden (5.2 feet, ZONE). Tracy Bryant misses. Rebound secured by Cole Mitchell.

[10:49] Team_009 possession (Score: 5-3)
Kyle Brogdon drives to the basket... Kyle Brogdon throws a bad pass out of bounds! TURNOVER! (dead ball)

[10:34] Team_018 possession (Score: 5-3)
FOUL! Reach-in foul on Kyle Brogdon during the drive. [Team fouls: 2] No free throws, side out. (Kyle Brogdon: 1 personal fouls)

[10:20] Team_018 possession (Score: 5-3)
Tracy Bryant attempts a Midrange. Contested by Desmond Harden (5.2 feet, MAN). Tracy Bryant misses. Rebound secured by Anfernee Anunoby.

[10:08] Team_009 possession (Score: 5-3)
Cole Mitchell attempts a Midrange. Contested by Bones Anunoby (3.2 feet, ZONE). COLE MITCHELL MAKES IT! Assist: Anfernee Anunoby
Score: 5-5

[09:50] Team_018 possession (Score: 5-5)
Tracy Bryant drives and kicks out. Tracy Bryant attempts a 3Pt. Contested by Desmond Harden (4.8 feet, MAN). Tracy Bryant misses. Rebound secured by Kyle Brogdon.

[09:36] Team_009 possession (Score: 5-5)
Kyle Brogdon drives to the basket... Kyle Brogdon throws a bad pass! Stolen by Domantas Wall! TURNOVER! (live ball)

[09:21] Team_018 possession (Score: 5-5)
Klay Stewart attempts a 3Pt. Contested by Miles Sabonis (5.5 feet, ZONE). Klay Stewart misses. Rebound secured by Kyle Brogdon.

[09:07] Team_009 possession (Score: 5-5)
Cole Mitchell drives, Domantas Wall stays with him. Cole Mitchell attempts a Dunk. Contested by Domantas Wall (3.4 feet, ZONE). COLE MITCHELL MAKES IT!
Score: 5-7

[08:52] Team_018 possession (Score: 5-7)
Allen Markkanen attempts a Midrange. Contested by Anfernee Anunoby (5.4 feet, MAN). ALLEN MARKKANEN MAKES IT!
Score: 7-7

[08:37] Team_009 possession (Score: 7-7)
Anfernee Anunoby attempts a 3Pt. Contested by Klay Stewart (4.1 feet, ZONE). ANFERNEE ANUNOBY MAKES IT! Assist: Miles Sabonis
Score: 7-10

[08:22] Team_018 possession (Score: 7-10)
Bones Anunoby attempts a Layup. Contested by Kyle Brogdon (5.2 feet, ZONE). BONES ANUNOBY MAKES IT! Assist: Tracy Bryant
Score: 9-10

[08:08] Team_009 possession (Score: 9-10)
Miles Sabonis throws a bad pass! Stolen by Klay Stewart! TURNOVER! (live ball)

[07:57] Team_018 possession (Score: 9-10)
Tracy Bryant drives to the basket... Tracy Bryant throws a bad pass out of bounds! TURNOVER! (dead ball)

[07:44] Team_009 possession (Score: 9-10)
Kyle Brogdon loses the ball! Stripped by Domantas Wall! TURNOVER! (live ball)

[07:29] Team_018 possession (Score: 9-10)
FOUL! Reach-in foul on Kyle Brogdon during the drive. [Team fouls: 3] No free throws, side out. (Kyle Brogdon: 2 personal fouls)

[07:15] Team_018 possession (Score: 9-10)
Klay Stewart attempts a 3Pt. Contested by Miles Sabonis (5.5 feet, ZONE). Klay Stewart misses. Rebound secured by Cole Mitchell.

[07:00] Team_009 possession (Score: 9-10)
Anfernee Anunoby attempts a 3Pt. Contested by Allen Markkanen (3.8 feet, MAN). Anfernee Anunoby misses. Rebound secured by Domantas Wall.

[06:43] Team_018 possession (Score: 9-10)
Allen Markkanen drives, picks up Anfernee Anunoby. Help arrives from Miles Sabonis! Allen Markkanen attempts a Layup. Contested by Miles Sabonis (5.4 feet, MAN). Allen Markkanen misses. Rebound secured by Kyle Brogdon.

[06:24] Team_009 possession (Score: 9-10)
Desmond Harden attempts a 3Pt. Contested by Tracy Bryant (3.5 feet, MAN). Desmond Harden misses. Rebound secured by Bones Anunoby.

[06:08] Team_018 possession (Score: 9-10)
Allen Markkanen attempts a 3Pt. Contested by Miles Sabonis (5.6 feet, ZONE). ALLEN MARKKANEN MAKES IT!
Score: 12-10

[05:54] Team_009 possession (Score: 12-10)
Anfernee Anunoby attempts a 3Pt. Contested by Allen Markkanen (3.8 feet, MAN). ANFERNEE ANUNOBY MAKES IT!
Score: 12-13

[05:39] Team_018 possession (Score: 12-13)
Domantas Wall makes the Midrange and draws the foul on Desmond Harden! And-1! Domantas Wall to the line for 1. [Team fouls: 4] (Desmond Harden: 2 personal fouls)   FT 1/1: GOOD Domantas Wall makes 1/1 from the line.
Score: 15-13

[05:25] Team_009 possession (Score: 15-13)
Anfernee Anunoby attempts a 3Pt. Contested by Allen Markkanen (3.8 feet, MAN). ANFERNEE ANUNOBY MAKES IT! Assist: Miles Sabonis
Score: 15-16

[05:13] Team_018 possession (Score: 15-16)
Bones Anunoby attempts a 3Pt. Contested by Cole Mitchell (4.8 feet, MAN). Bones Anunoby misses. Offensive rebound by Domantas Wall! Domantas Wall puts it back in!
Score: 17-16

[05:00] Team_009 possession (Score: 17-16)
Cole Mitchell attempts a Layup. Contested by Bones Anunoby (3.3 feet, MAN). COLE MITCHELL MAKES IT!
Score: 17-18

[04:46] Team_018 possession (Score: 17-18)
Klay Stewart drives, Miles Sabonis stays with him. Klay Stewart attempts a Dunk. Contested by Miles Sabonis (5.5 feet, MAN). Klay Stewart misses. Offensive rebound by Bones Anunoby! Bones Anunoby kicks it out.

[04:27] Team_018 possession (Score: 17-18)
FOUL! Shooting foul on Kyle Brogdon. Tracy Bryant to the line for 2 free throws. [BONUS: 5 team fouls] (Kyle Brogdon: 3 personal fouls)   FT 1/2: GOOD   FT 2/2: GOOD Tracy Bryant makes 2/2 from the line.
Score: 19-18

[04:14] Team_009 possession (Score: 19-18)
Kyle Brogdon attempts a 3Pt. Contested by Domantas Wall (3.2 feet, MAN). Kyle Brogdon misses. Rebound secured by Domantas Wall.

[04:03] Team_018 possession (Score: 19-18)
Klay Stewart drives, picks up Kyle Brogdon. Help arrives from Miles Sabonis! Klay Stewart attempts a Layup. Contested by Miles Sabonis (5.2 feet, ZONE). KLAY STEWART MAKES IT!
Score: 21-18

[03:45] Team_009 possession (Score: 21-18)
Anfernee Anunoby drives to the basket... Anfernee Anunoby throws a bad pass out of bounds! TURNOVER! (dead ball)

[03:32] Team_018 possession (Score: 21-18)
Domantas Wall drives to the basket... Domantas Wall loses control! Ball rolls out of bounds! TURNOVER! (dead ball)

[03:17] Team_009 possession (Score: 21-18)
Desmond Harden attempts a Layup. Contested by Bones Anunoby (3.6 feet, ZONE). DESMOND HARDEN MAKES IT! Assist: Anfernee Anunoby
Score: 21-20

[03:04] Team_018 possession (Score: 21-20)
Domantas Wall drives, Kyle Brogdon stays with him. Domantas Wall attempts a Layup. Contested by Kyle Brogdon (5.3 feet, MAN). DOMANTAS WALL MAKES IT! Assist: Bones Anunoby
Score: 23-20

[02:50] Team_009 possession (Score: 23-20)
Anfernee Anunoby attempts a Midrange. Contested by Allen Markkanen (3.9 feet, MAN). ANFERNEE ANUNOBY MAKES IT! Assist: Kyle Brogdon
Score: 23-22

[02:34] Team_018 possession (Score: 23-22)
FOUL! Shooting foul on Miles Sabonis. Klay Stewart to the line for 3 free throws. [BONUS: 6 team fouls] (Miles Sabonis: 1 personal fouls)   FT 1/3: GOOD   FT 2/3: GOOD   FT 3/3: GOOD Klay Stewart makes 3/3 from the line.
Score: 26-22

[02:19] Team_009 possession (Score: 26-22)
Desmond Harden attempts a Midrange. Contested by Klay Stewart (4.3 feet, ZONE). DESMOND HARDEN MAKES IT!
Score: 26-24

[02:03] Team_018 possession (Score: 26-24)
FOUL! Reach-in foul on Cole Mitchell during the drive. [IN THE BONUS! 7 team fouls] Bones Anunoby to the line for 2 free throws. (Cole Mitchell: 1 personal fouls)   FT 1/2: GOOD   FT 2/2: MISS Bones Anunoby makes 1/2 from the line. Rebound secured by Anfernee Anunoby.
Score: 27-24

[01:48] Team_009 possession (Score: 27-24)
Anfernee Anunoby attempts a Midrange. Contested by Allen Markkanen (4.0 feet, MAN). Anfernee Anunoby misses. Rebound secured by Domantas Wall.

[01:36] Team_018 possession (Score: 27-24)
Domantas Wall loses the ball! Stripped by Kyle Brogdon! TURNOVER! (live ball)

[01:26] Team_009 possession (Score: 27-24)
Kyle Brogdon attempts a Layup. BLOCKED BY DOMANTAS WALL! Ball is loose! Rebound secured by Domantas Wall.

[01:12] Team_018 possession (Score: 27-24)
Klay Stewart attempts a 3Pt. Contested by Miles Sabonis (5.8 feet, MAN). KLAY STEWART MAKES IT!
Score: 30-24

[01:02] Team_009 possession (Score: 30-24)
Cole Mitchell drives to the basket... Cole Mitchell throws a bad pass! Stolen by Bones Anunoby! TURNOVER! (live ball)

[00:48] Team_018 possession (Score: 30-24)
Tracy Bryant attempts a Midrange. Contested by Miles Sabonis (6.0 feet, ZONE). Tracy Bryant misses. FOUL! Loose ball foul on Anfernee Anunoby during the rebound battle. [IN THE BONUS! 8 team fouls] Bones Anunoby to the line for 2 free throws. (Anfernee Anunoby: 1 personal fouls)   FT 1/2: GOOD   FT 2/2: GOOD Bones Anunoby makes 2/2 from the line.
Score: 32-24

[00:34] Team_009 possession (Score: 32-24)
Desmond Harden attempts a Midrange. Contested by Tracy Bryant (3.9 feet, MAN). DESMOND HARDEN MAKES IT!
Score: 32-26

[00:21] Team_018 possession (Score: 32-26)
Tracy Bryant drives to the basket... Tracy Bryant throws a bad pass! Stolen by Desmond Harden! TURNOVER! (live ball)

[00:07] Team_009 possession (Score: 32-26)
Kyle Brogdon drives and kicks out. Kyle Brogdon attempts a 3Pt. Contested by Domantas Wall (4.3 feet, MAN). Kyle Brogdon misses. FOUL! Loose ball foul on Allen Markkanen during the rebound battle. [Team fouls: 1] No free throws, side out. (Allen Markkanen: 1 personal fouls)

================================================================================
                              1ST QUARTER COMPLETE                              
================================================================================

1ST QUARTER SCORE: Team_018 32, Team_009 26

BOX SCORE:
================================================================================

Team_018
--------------------------------------------------------------------------------
Player                MIN  PTS  REB  AST  TO      FG   FG%      3P   3P%
--------------------------------------------------------------------------------
Klay Stewart           12   10    0    0   0   4/6    66.7     0/0   0.0
Domantas Wall          12   10    5    1   0   4/4   100.0     0/0   0.0
Allen Markkanen        12    5    1    0   0   2/3    66.7     0/0   0.0
Bones Anunoby          12    4    2    1   0   2/3    66.7     0/0   0.0
Tracy Bryant           12    2    0    1   0   1/4    25.0     0/0   0.0

TEAM: FG: 13/20 (65.0%), 3PT: 4/7 (57.1%), REB: 8 (2 off, 6 def), AST: 3, TO: 4
TEAM FOULS: 1


Team_009
--------------------------------------------------------------------------------
Player                MIN  PTS  REB  AST  TO      FG   FG%      3P   3P%
--------------------------------------------------------------------------------
Anfernee Anunoby       12   11    2    2   0   4/6    66.7     0/0   0.0
Cole Mitchell          12    6    2    0   0   3/4    75.0     0/0   0.0
Desmond Harden         12    6    0    1   0   3/4    75.0     0/0   0.0
Miles Sabonis          12    3    0    2   0   1/1   100.0     0/0   0.0
Kyle Brogdon           12    0    4    1   0   0/2     0.0     0/0   0.0

TEAM: FG: 11/17 (64.7%), 3PT: 4/8 (50.0%), REB: 8 (1 off, 7 def), AST: 6, TO: 6
TEAM FOULS: 8 [Team_018 in BONUS]

================================================================================

================================================================================
                       2ND QUARTER - Team_018 vs Team_009                       
================================================================================

[12:00] Team_018 possession (Score: 32-26)
Klay Stewart drives, Miles Sabonis stays with him. Klay Stewart attempts a Dunk. Contested by Miles Sabonis (5.7 feet, MAN). KLAY STEWART MAKES IT! Assist: Tracy Bryant
Score: 34-26

[11:47] Team_009 possession (Score: 34-26)
Kyle Brogdon drives, Domantas Wall stays with him. Kyle Brogdon attempts a Dunk. Contested by Domantas Wall (3.5 feet, MAN). Kyle Brogdon misses. Rebound secured by Domantas Wall.

[11:27] Team_018 possession (Score: 34-26)
FOUL! Shooting foul on Kyle Brogdon. Domantas Wall to the line for 2 free throws. [Team fouls: 1] (Kyle Brogdon: 1 personal fouls)   FT 1/2: GOOD   FT 2/2: GOOD Domantas Wall makes 2/2 from the line.
Score: 36-26

[11:15] Team_009 possession (Score: 36-26)
Kyle Brogdon attempts a Layup. Contested by Domantas Wall (3.6 feet, ZONE). Kyle Brogdon misses. Offensive rebound by Cole Mitchell! Cole Mitchell kicks it out.

[11:00] Team_009 possession (Score: 36-26)
Anfernee Anunoby attempts a Layup. Contested by Allen Markkanen (4.1 feet, MAN). Anfernee Anunoby misses. Rebound secured by Bones Anunoby.

[10:49] Team_018 possession (Score: 36-26)
Tracy Bryant drives, Kyle Brogdon stays with him. Tracy Bryant attempts a Layup. Contested by Kyle Brogdon (5.7 feet, ZONE). Tracy Bryant misses. Rebound secured by Cole Mitchell.

[10:34] Team_009 possession (Score: 36-26)
Miles Sabonis attempts a Midrange. Contested by Klay Stewart (4.4 feet, MAN). Miles Sabonis misses. Offensive rebound by Cole Mitchell! Cole Mitchell kicks it out.

[10:24] Team_009 possession (Score: 36-26)
FOUL! Holding foul on Domantas Wall. [Team fouls: 1] No free throws, side out. (Domantas Wall: 1 personal fouls)

[10:11] Team_009 possession (Score: 36-26)
Kyle Brogdon drives to the basket... Kyle Brogdon throws a bad pass out of bounds! TURNOVER! (dead ball)

[10:11] Substitution (Team_018): Klay Stewart OUT → Michael Simons IN (stamina_rule2)

[10:11] Substitution (Team_018): Tracy Bryant OUT → Miles Herro IN (stamina_rule2)

[10:11] Substitution (Team_018): Allen Markkanen OUT → Austin Antetokounmpo IN (stamina_rule2)

[10:11] Substitution (Team_018): Bones Anunoby OUT → Shai Wade IN (stamina_rule2)

[10:11] Substitution (Team_018): Domantas Wall OUT → Julius Jackson IN (stamina_rule2)

[10:11] Substitution (Team_009): Miles Sabonis OUT → Paul Trent IN (stamina_rule2)

[10:11] Substitution (Team_009): Desmond Harden OUT → Evan Curry IN (stamina_rule2)

[10:11] Substitution (Team_009): Anfernee Anunoby OUT → RJ Jokic IN (stamina_rule2)

[10:11] Substitution (Team_009): Cole Mitchell OUT → Kawhi Herro IN (stamina_rule2)

[10:11] Substitution (Team_009): Kyle Brogdon OUT → Shaquille Green IN (stamina_rule2)

[09:55] Team_018 possession (Score: 36-26)
Miles Herro attempts a 3Pt. Contested by Evan Curry (5.6 feet, MAN). MILES HERRO MAKES IT! Assist: Shai Wade
Score: 39-26

[09:40] Team_009 possession (Score: 39-26)
Paul Trent makes the Layup and draws the foul on Miles Herro! And-1! Paul Trent to the line for 1. [Team fouls: 2] (Miles Herro: 1 personal fouls)   FT 1/1: GOOD Paul Trent makes 1/1 from the line.
Score: 39-29

[09:25] Team_018 possession (Score: 39-29)
Shai Wade drives and kicks out. Austin Antetokounmpo attempts a Midrange. Contested by RJ Jokic (4.5 feet, MAN). AUSTIN ANTETOKOUNMPO MAKES IT!
Score: 41-29

[09:14] Team_009 possession (Score: 41-29)
RJ Jokic attempts a 3Pt. Contested by Michael Simons (5.2 feet, ZONE). RJ Jokic misses. Rebound secured by Austin Antetokounmpo.

[08:55] Team_018 possession (Score: 41-29)
Austin Antetokounmpo drives to the basket... Austin Antetokounmpo throws a bad pass! Stolen by Kawhi Herro! TURNOVER! (live ball)

[08:41] Team_009 possession (Score: 41-29)
Evan Curry drives and kicks out. Shaquille Green attempts a Midrange. Contested by Austin Antetokounmpo (5.4 feet, ZONE). SHAQUILLE GREEN MAKES IT! Assist: Kawhi Herro
Score: 41-31

[08:24] Team_018 possession (Score: 41-31)
Julius Jackson attempts a 3Pt. Wide open! Paul Trent is 6.1 feet away. [ZONE] Julius Jackson misses. Rebound secured by Kawhi Herro.

[08:10] Team_009 possession (Score: 41-31)
RJ Jokic attempts a Midrange. Contested by Austin Antetokounmpo (5.1 feet, MAN). RJ Jokic misses. Offensive rebound by Shaquille Green! Shaquille Green kicks it out.

[07:53] Team_009 possession (Score: 41-31)
Evan Curry attempts a 3Pt. Contested by Michael Simons (5.5 feet, ZONE). Evan Curry misses. FOUL! Loose ball foul on Julius Jackson during the rebound battle. [Team fouls: 3] No free throws, side out. (Julius Jackson: 1 personal fouls)

[07:35] Team_009 possession (Score: 41-31)
RJ Jokic attempts a Layup. Contested by Julius Jackson (4.5 feet, ZONE). RJ JOKIC MAKES IT!
Score: 41-33

[07:19] Team_018 possession (Score: 41-33)
Miles Herro attempts a Layup. Contested by Kawhi Herro (3.8 feet, ZONE). Miles Herro misses. Rebound secured by Kawhi Herro.

[07:03] Team_009 possession (Score: 41-33)
Shaquille Green drives, Julius Jackson stays with him. Shaquille Green attempts a Layup. Contested by Julius Jackson (5.0 feet, ZONE). Shaquille Green misses. Rebound secured by Julius Jackson.

[06:46] Team_018 possession (Score: 41-33)
Shai Wade drives to the basket... Shai Wade throws a bad pass! Stolen by Kawhi Herro! TURNOVER! (live ball)

[06:32] Team_009 possession (Score: 41-33)
Kawhi Herro attempts a 3Pt. Contested by Shai Wade (5.0 feet, MAN). Kawhi Herro misses. Rebound secured by Austin Antetokounmpo.

[06:18] Team_018 possession (Score: 41-33)
FOUL! Shooting foul on Kawhi Herro. Austin Antetokounmpo to the line for 2 free throws. [Team fouls: 2] (Kawhi Herro: 1 personal fouls)   FT 1/2: GOOD   FT 2/2: GOOD Austin Antetokounmpo makes 2/2 from the line.
Score: 43-33

[06:04] Team_009 possession (Score: 43-33)
Shaquille Green drives, Julius Jackson stays with him. Shaquille Green attempts a Dunk. Contested by Julius Jackson (5.0 feet, ZONE). Shaquille Green misses. Rebound secured by Julius Jackson.

[05:52] Team_018 possession (Score: 43-33)
Austin Antetokounmpo attempts a 3Pt. Contested by RJ Jokic (3.9 feet, MAN). Austin Antetokounmpo misses. Rebound secured by Shaquille Green.

[05:39] Team_009 possession (Score: 43-33)
FOUL! Holding foul on Miles Herro. [Team fouls: 4] No free throws, side out. (Miles Herro: 2 personal fouls)

[05:20] Team_009 possession (Score: 43-33)
Evan Curry attempts a 3Pt. Contested by Michael Simons (5.5 feet, ZONE). Evan Curry misses. Rebound secured by Shai Wade.

[05:07] Team_018 possession (Score: 43-33)
Julius Jackson drives, picks up Kawhi Herro. Help arrives from Paul Trent! Julius Jackson attempts a Dunk. Contested by Paul Trent (4.0 feet, ZONE). Julius Jackson misses. Rebound secured by RJ Jokic.

[04:50] Team_009 possession (Score: 43-33)
Kawhi Herro attempts a Midrange. Contested by Shai Wade (5.0 feet, MAN). KAWHI HERRO MAKES IT! Assist: Shaquille Green
Score: 43-35

[04:36] Team_018 possession (Score: 43-35)
Miles Herro drives, picks up Evan Curry. Help arrives from RJ Jokic! Miles Herro attempts a Layup. Contested by RJ Jokic (5.6 feet, MAN). MILES HERRO MAKES IT!
Score: 45-35

[04:25] Team_009 possession (Score: 45-35)
Kawhi Herro drives, Julius Jackson stays with him. Kawhi Herro attempts a Dunk. Contested by Julius Jackson (4.9 feet, ZONE). Kawhi Herro misses. Offensive rebound by Shaquille Green! Shaquille Green kicks it out.

[04:13] Team_009 possession (Score: 45-35)
Kawhi Herro drives, picks up Shai Wade. Help arrives from Miles Herro! Kawhi Herro attempts a Dunk. Contested by Miles Herro (5.0 feet, MAN). Kawhi Herro misses. Rebound secured by Shai Wade.

[03:58] Team_018 possession (Score: 45-35)
Austin Antetokounmpo attempts a 3Pt. Contested by RJ Jokic (3.9 feet, MAN). AUSTIN ANTETOKOUNMPO MAKES IT! Assist: Miles Herro
Score: 48-35

[03:44] Team_009 possession (Score: 48-35)
Kawhi Herro attempts a 3Pt. Contested by Shai Wade (5.0 feet, MAN). Kawhi Herro misses. Rebound secured by Julius Jackson.

[03:33] Team_018 possession (Score: 48-35)
Austin Antetokounmpo attempts a 3Pt. Contested by Paul Trent (5.1 feet, ZONE). AUSTIN ANTETOKOUNMPO MAKES IT! Assist: Michael Simons
Score: 51-35

[03:22] Team_009 possession (Score: 51-35)
RJ Jokic attempts a 3Pt. Contested by Austin Antetokounmpo (5.1 feet, MAN). RJ Jokic misses. Rebound secured by Austin Antetokounmpo.

[03:06] Team_018 possession (Score: 51-35)
Austin Antetokounmpo attempts a Midrange. Contested by Evan Curry (4.8 feet, ZONE). Austin Antetokounmpo misses. Rebound secured by Shaquille Green.

[02:50] Team_009 possession (Score: 51-35)
Kawhi Herro drives and kicks out. RJ Jokic attempts a Midrange. Contested by Austin Antetokounmpo (5.4 feet, MAN). RJ JOKIC MAKES IT! Assist: Paul Trent
Score: 51-37

[02:40] Team_018 possession (Score: 51-37)
Miles Herro attempts a 3Pt. Contested by Paul Trent (5.9 feet, ZONE). Miles Herro misses. Rebound secured by Kawhi Herro.

[02:25] Team_009 possession (Score: 51-37)
Shaquille Green attempts a Midrange. Contested by Miles Herro (5.7 feet, ZONE). Shaquille Green misses. Rebound secured by Shai Wade.

[02:06] Team_018 possession (Score: 51-37)
Miles Herro attempts a 3Pt. Contested by RJ Jokic (4.7 feet, ZONE). Miles Herro misses. Rebound secured by RJ Jokic.

[01:54] Team_009 possession (Score: 51-37)
Kawhi Herro drives and kicks out. Kawhi Herro attempts a 3Pt. Contested by Michael Simons (5.5 feet, ZONE). KAWHI HERRO MAKES IT! Assist: Shaquille Green
Score: 51-40

[01:35] Team_018 possession (Score: 51-40)
Austin Antetokounmpo attempts a 3Pt. Contested by RJ Jokic (4.0 feet, MAN). Austin Antetokounmpo misses. Rebound secured by RJ Jokic.

[01:22] Team_009 possession (Score: 51-40)
FOUL! Reach-in foul on Julius Jackson during the drive. [IN THE BONUS! 5 team fouls] Kawhi Herro to the line for 2 free throws. (Julius Jackson: 2 personal fouls)   FT 1/2: GOOD   FT 2/2: GOOD Kawhi Herro makes 2/2 from the line.
Score: 51-42

[01:05] Team_018 possession (Score: 51-42)
FOUL! Reach-in foul on Kawhi Herro during the drive. [Team fouls: 3] No free throws, side out. (Kawhi Herro: 2 personal fouls)

[00:51] Team_018 possession (Score: 51-42)
Shai Wade attempts a 3Pt. Contested by Kawhi Herro (3.3 feet, MAN). Shai Wade misses. Rebound secured by RJ Jokic.

[00:33] Team_009 possession (Score: 51-42)
Evan Curry attempts a Layup. BLOCKED BY MILES HERRO! Ball is loose! Rebound secured by Shai Wade.

[00:18] Team_018 possession (Score: 51-42)
Miles Herro attempts a 3Pt. Wide open! Paul Trent is 6.1 feet away. [ZONE] Miles Herro misses. Rebound secured by Shaquille Green.

[00:07] Team_009 possession (Score: 51-42)
Paul Trent drives to the basket... Paul Trent loses control! Ball rolls out of bounds! TURNOVER! (dead ball)

================================================================================
                              2ND QUARTER COMPLETE                              
================================================================================

2ND QUARTER SCORE: Team_018 19, Team_009 16

BOX SCORE:
================================================================================

Team_018
--------------------------------------------------------------------------------
Player                MIN  PTS  REB  AST  TO      FG   FG%      3P   3P%
--------------------------------------------------------------------------------
Austin Antetokounmpo   10   10    3    0   0   4/7    57.1     0/0   0.0
Miles Herro            10    5    0    1   0   2/6    33.3     0/0   0.0
Klay Stewart           14    2    0    0   0   1/1   100.0     0/0   0.0
Domantas Wall          14    2    1    0   0   1/1   100.0     0/0   0.0
Tracy Bryant           14    0    0    1   0   0/1     0.0     0/0   0.0
Bones Anunoby          14    0    1    0   0   0/0     0.0     0/0   0.0
Shai Wade              10    0    4    1   0   0/1     0.0     0/0   0.0
Julius Jackson         10    0    3    0   0   0/2     0.0     0/0   0.0
Michael Simons         10    0    0    1   0   0/0     0.0     0/0   0.0

TEAM: FG: 8/19 (42.1%), 3PT: 3/10 (30.0%), REB: 12 (0 off, 12 def), AST: 4, TO: 2
TEAM FOULS: 5 [Team_009 in BONUS]


Team_009
--------------------------------------------------------------------------------
Player                MIN  PTS  REB  AST  TO      FG   FG%      3P   3P%
--------------------------------------------------------------------------------
Kawhi Herro            10    7    4    1   0   3/6    50.0     0/0   0.0
RJ Jokic               10    4    4    0   0   2/4    50.0     0/0   0.0
Paul Trent             10    3    0    1   0   1/1   100.0     0/0   0.0
Shaquille Green        10    2    5    2   0   1/4    25.0     0/0   0.0
Kyle Brogdon           14    0    0    0   0   0/1     0.0     0/0   0.0
Cole Mitchell          14    0    3    0   0   0/0     0.0     0/0   0.0
Anfernee Anunoby       14    0    0    0   0   0/1     0.0     0/0   0.0
Evan Curry             10    0    0    0   0   0/2     0.0     0/0   0.0

TEAM: FG: 7/19 (36.8%), 3PT: 0/5 (0.0%), REB: 16 (5 off, 11 def), AST: 4, TO: 2
TEAM FOULS: 3

================================================================================

================================================================================
                       3RD QUARTER - Team_018 vs Team_009                       
================================================================================

[12:00] Team_018 possession (Score: 51-42)
Bones Anunoby makes the Layup and draws the foul on Kyle Brogdon! And-1! Bones Anunoby to the line for 1. [Team fouls: 1] (Kyle Brogdon: 1 personal fouls)   FT 1/1: GOOD Bones Anunoby makes 1/1 from the line.
Score: 54-42

[11:44] Team_009 possession (Score: 54-42)
Miles Sabonis drives to the basket... Miles Sabonis throws a bad pass! Stolen by Klay Stewart! TURNOVER! (live ball)

[11:32] Team_018 possession (Score: 54-42)
Allen Markkanen drives to the basket... Allen Markkanen loses the ball! Stripped by Kyle Brogdon! TURNOVER! (live ball)

[11:19] Team_009 possession (Score: 54-42)
Cole Mitchell drives, Bones Anunoby stays with him. Cole Mitchell attempts a Layup. Contested by Bones Anunoby (3.2 feet, MAN). Cole Mitchell misses. Rebound secured by Domantas Wall.

[11:05] Team_018 possession (Score: 54-42)
Domantas Wall makes the Layup and draws the foul on Kyle Brogdon! And-1! Domantas Wall to the line for 1. [Team fouls: 2] (Kyle Brogdon: 2 personal fouls)   FT 1/1: GOOD Domantas Wall makes 1/1 from the line.
Score: 57-42

[10:50] Team_009 possession (Score: 57-42)
Kyle Brogdon drives to the basket... Kyle Brogdon loses the ball! Stripped by Domantas Wall! TURNOVER! (live ball)

[10:37] Team_018 possession (Score: 57-42)
Klay Stewart drives and kicks out. Domantas Wall attempts a Midrange. Contested by Kyle Brogdon (4.9 feet, MAN). Domantas Wall misses. Offensive rebound by Domantas Wall! Domantas Wall's putback is no good. Rebound secured by Kyle Brogdon.

[10:23] Team_009 possession (Score: 57-42)
FOUL! Shooting foul on Klay Stewart. Miles Sabonis to the line for 3 free throws. [Team fouls: 1] (Klay Stewart: 1 personal fouls)   FT 1/3: GOOD   FT 2/3: GOOD   FT 3/3: GOOD Miles Sabonis makes 3/3 from the line.
Score: 57-45

[10:11] Team_018 possession (Score: 57-45)
FOUL! Shooting foul on Cole Mitchell. Domantas Wall to the line for 2 free throws. [Team fouls: 3] (Cole Mitchell: 1 personal fouls)   FT 1/2: GOOD   FT 2/2: GOOD Domantas Wall makes 2/2 from the line.
Score: 59-45

[09:59] Team_009 possession (Score: 59-45)
Miles Sabonis attempts a Midrange. Contested by Tracy Bryant (3.3 feet, ZONE). Miles Sabonis misses. Rebound secured by Allen Markkanen.

[09:45] Team_018 possession (Score: 59-45)
Bones Anunoby attempts a Midrange. Contested by Cole Mitchell (4.8 feet, MAN). Bones Anunoby misses. Rebound secured by Cole Mitchell.

[09:31] Team_009 possession (Score: 59-45)
Cole Mitchell loses control! Ball rolls out of bounds! TURNOVER! (dead ball)

[09:15] Team_018 possession (Score: 59-45)
Bones Anunoby attempts a 3Pt. Contested by Miles Sabonis (5.6 feet, ZONE). Bones Anunoby misses. Rebound secured by Anfernee Anunoby.

[09:05] Team_009 possession (Score: 59-45)
Desmond Harden attempts a 3Pt. Contested by Tracy Bryant (3.5 feet, MAN). Desmond Harden misses. Offensive rebound by Cole Mitchell! Cole Mitchell kicks it out.

[08:49] Team_009 possession (Score: 59-45)
FOUL! Reach-in foul on Klay Stewart during the drive. [Team fouls: 2] No free throws, side out. (Klay Stewart: 2 personal fouls)

[08:38] Team_009 possession (Score: 59-45)
FOUL! Shooting foul on Tracy Bryant. Desmond Harden to the line for 2 free throws. [Team fouls: 3] (Tracy Bryant: 1 personal fouls)   FT 1/2: MISS   FT 2/2: MISS Desmond Harden makes 0/2 from the line. FOUL! Loose ball foul on Domantas Wall during the free throw rebound! [Team fouls: 4] No free throws, side out. (Domantas Wall: 1 personal fouls)

[08:21] Team_009 possession (Score: 59-45)
Cole Mitchell attempts a Layup. Contested by Bones Anunoby (3.2 feet, MAN). COLE MITCHELL MAKES IT! Assist: Anfernee Anunoby
Score: 59-47

[08:07] Team_018 possession (Score: 59-47)
FOUL! Offensive foul on Tracy Bryant! Desmond Harden drew the charge! [Team fouls: 5] (Tracy Bryant: 2 personal fouls) TURNOVER! (dead ball)

[07:56] Team_009 possession (Score: 59-47)
Anfernee Anunoby makes the 3Pt and draws the foul on Allen Markkanen! And-1! Anfernee Anunoby to the line for 1. [BONUS: 6 team fouls] (Allen Markkanen: 1 personal fouls)   FT 1/1: MISS Anfernee Anunoby makes 0/1 from the line. Rebound secured by Bones Anunoby.
Score: 59-50

[07:40] Team_018 possession (Score: 59-50)
Bones Anunoby attempts a 3Pt. Contested by Cole Mitchell (4.8 feet, MAN). Bones Anunoby misses. Rebound secured by Anfernee Anunoby.

[07:23] Team_009 possession (Score: 59-50)
Desmond Harden attempts a 3Pt. Contested by Klay Stewart (4.1 feet, ZONE). Desmond Harden misses. Rebound secured by Domantas Wall.

[07:09] Team_018 possession (Score: 59-50)
FOUL! Reach-in foul on Kyle Brogdon during the drive. [Team fouls: 4] No free throws, side out. (Kyle Brogdon: 3 personal fouls)

[06:54] Team_018 possession (Score: 59-50)
Klay Stewart attempts a 3Pt. Contested by Miles Sabonis (5.5 feet, ZONE). Klay Stewart misses. FOUL! Loose ball foul on Cole Mitchell during the rebound battle. [IN THE BONUS! 5 team fouls] Domantas Wall to the line for 2 free throws. (Cole Mitchell: 2 personal fouls)   FT 1/2: GOOD   FT 2/2: GOOD Domantas Wall makes 2/2 from the line.
Score: 61-50

[06:39] Team_009 possession (Score: 61-50)
Cole Mitchell makes the Layup and draws the foul on Domantas Wall! And-1! Cole Mitchell to the line for 1. [BONUS: 7 team fouls] (Domantas Wall: 2 personal fouls)   FT 1/1: GOOD Cole Mitchell makes 1/1 from the line.
Score: 61-53

[06:23] Team_018 possession (Score: 61-53)
Bones Anunoby attempts a 3Pt. Contested by Miles Sabonis (5.6 feet, ZONE). Bones Anunoby misses. Rebound secured by Cole Mitchell.

[06:06] Team_009 possession (Score: 61-53)
Miles Sabonis drives, Klay Stewart stays with him. Miles Sabonis attempts a Layup. Contested by Klay Stewart (4.0 feet, MAN). Miles Sabonis misses. Rebound secured by Domantas Wall.

[05:47] Team_018 possession (Score: 61-53)
Klay Stewart attempts a 3Pt. Contested by Miles Sabonis (5.5 feet, MAN). Klay Stewart misses. Offensive rebound by Domantas Wall! Domantas Wall puts it back in!
Score: 63-53

[05:29] Team_009 possession (Score: 63-53)
Miles Sabonis attempts a 3Pt. Contested by Klay Stewart (4.0 feet, ZONE). Miles Sabonis misses. Rebound secured by Bones Anunoby.

[05:11] Team_018 possession (Score: 63-53)
Bones Anunoby attempts a Layup. Contested by Cole Mitchell (4.8 feet, MAN). Bones Anunoby misses. Rebound secured by Cole Mitchell.

[05:01] Team_009 possession (Score: 63-53)
Cole Mitchell attempts a Layup. Contested by Bones Anunoby (3.3 feet, MAN). COLE MITCHELL MAKES IT! Assist: Anfernee Anunoby
Score: 63-55

[04:47] Team_018 possession (Score: 63-55)
Tracy Bryant attempts a Midrange. Contested by Cole Mitchell (4.8 feet, ZONE). TRACY BRYANT MAKES IT!
Score: 65-55

[04:35] Team_009 possession (Score: 65-55)
Miles Sabonis drives, Domantas Wall stays with him. Miles Sabonis attempts a Dunk. Contested by Domantas Wall (3.4 feet, ZONE). Miles Sabonis misses. Rebound secured by Domantas Wall.

[04:16] Team_018 possession (Score: 65-55)
Allen Markkanen attempts a 3Pt. Contested by Miles Sabonis (5.7 feet, ZONE). Allen Markkanen misses. FOUL! Loose ball foul on Cole Mitchell during the rebound battle. [IN THE BONUS! 6 team fouls] Domantas Wall to the line for 2 free throws. (Cole Mitchell: 3 personal fouls)   FT 1/2: GOOD   FT 2/2: GOOD Domantas Wall makes 2/2 from the line.
Score: 67-55

[04:04] Team_009 possession (Score: 67-55)
Desmond Harden attempts a 3Pt. Contested by Tracy Bryant (3.5 feet, MAN). Desmond Harden misses. Offensive rebound by Kyle Brogdon! Kyle Brogdon puts it back in!
Score: 67-57

[03:49] Team_018 possession (Score: 67-57)
FOUL! Reach-in foul on Kyle Brogdon during the drive. [IN THE BONUS! 7 team fouls] Domantas Wall to the line for 2 free throws. (Kyle Brogdon: 4 personal fouls)   FT 1/2: GOOD   FT 2/2: GOOD Domantas Wall makes 2/2 from the line.
Score: 69-57

[03:34] Team_009 possession (Score: 69-57)
Cole Mitchell drives to the basket... Cole Mitchell throws a bad pass! Stolen by Bones Anunoby! TURNOVER! (live ball)

[03:19] Team_018 possession (Score: 69-57)
Domantas Wall attempts a Midrange. Contested by Desmond Harden (5.2 feet, ZONE). Domantas Wall misses. Rebound secured by Cole Mitchell.

[03:04] Team_009 possession (Score: 69-57)
FOUL! Holding foul on Bones Anunoby. [IN THE BONUS! 8 team fouls] Cole Mitchell to the line for 2 free throws. (Bones Anunoby: 1 personal fouls)   FT 1/2: GOOD   FT 2/2: GOOD Cole Mitchell makes 2/2 from the line.
Score: 69-59

[02:48] Team_018 possession (Score: 69-59)
Allen Markkanen attempts a 3Pt. Contested by Anfernee Anunoby (5.6 feet, MAN). Allen Markkanen misses. Rebound secured by Anfernee Anunoby.

[02:38] Team_009 possession (Score: 69-59)
Kyle Brogdon attempts a Layup. Contested by Domantas Wall (3.4 feet, MAN). KYLE BROGDON MAKES IT! Assist: Desmond Harden
Score: 69-61

[02:24] Team_018 possession (Score: 69-61)
Tracy Bryant attempts a Midrange. Contested by Desmond Harden (5.4 feet, MAN). Tracy Bryant misses. Rebound secured by Cole Mitchell.

[02:08] Team_009 possession (Score: 69-61)
Kyle Brogdon attempts a Midrange. Contested by Domantas Wall (3.5 feet, MAN). Kyle Brogdon misses. Rebound secured by Allen Markkanen.

[01:50] Team_018 possession (Score: 69-61)
Tracy Bryant drives to the basket... Tracy Bryant loses the ball! Stripped by Desmond Harden! TURNOVER! (live ball)

[01:35] Team_009 possession (Score: 69-61)
Miles Sabonis attempts a Midrange. Contested by Klay Stewart (4.3 feet, MAN). MILES SABONIS MAKES IT!
Score: 69-63

[01:21] Team_018 possession (Score: 69-63)
Klay Stewart attempts a 3Pt. Contested by Miles Sabonis (5.8 feet, ZONE). Klay Stewart misses. Rebound secured by Anfernee Anunoby.

[01:04] Team_009 possession (Score: 69-63)
Miles Sabonis attempts a 3Pt. Contested by Klay Stewart (4.3 feet, MAN). Miles Sabonis misses. Rebound secured by Allen Markkanen.

[00:51] Team_018 possession (Score: 69-63)
Tracy Bryant attempts a Layup. BLOCKED BY MILES SABONIS! Ball goes out off Miles Sabonis. Tracy Bryant's ball!

[00:36] Team_018 possession (Score: 69-63)
FOUL! Shooting foul on Kyle Brogdon. Bones Anunoby to the line for 2 free throws. [BONUS: 8 team fouls] (Kyle Brogdon: 5 personal fouls)   FT 1/2: GOOD   FT 2/2: GOOD Bones Anunoby makes 2/2 from the line.
Score: 71-63

[00:27] Team_009 possession (Score: 71-63)
Anfernee Anunoby attempts a Midrange. Contested by Tracy Bryant (3.8 feet, ZONE). Anfernee Anunoby misses. Rebound secured by Allen Markkanen.

[00:12] Team_018 possession (Score: 71-63)
Domantas Wall attempts a Midrange. Contested by Kyle Brogdon (5.6 feet, MAN). Domantas Wall misses. Rebound secured by Kyle Brogdon.

================================================================================
                              3RD QUARTER COMPLETE                              
================================================================================

3RD QUARTER SCORE: Team_018 20, Team_009 21

BOX SCORE:
================================================================================

Team_018
--------------------------------------------------------------------------------
Player                MIN  PTS  REB  AST  TO      FG   FG%      3P   3P%
--------------------------------------------------------------------------------
Domantas Wall          26   13    5    0   0   6/8    75.0     0/0   0.0
Bones Anunoby          26    5    2    0   0   2/7    28.6     0/0   0.0
Tracy Bryant           26    2    0    0   0   1/2    50.0     0/0   0.0
Klay Stewart           26    0    0    0   0   0/2     0.0     0/0   0.0
Allen Markkanen        26    0    4    0   0   0/1     0.0     0/0   0.0

TEAM: FG: 9/20 (45.0%), 3PT: 3/8 (37.5%), REB: 12 (2 off, 10 def), AST: 0, TO: 3
TEAM FOULS: 8 [Team_009 in BONUS]


Team_009
--------------------------------------------------------------------------------
Player                MIN  PTS  REB  AST  TO      FG   FG%      3P   3P%
--------------------------------------------------------------------------------
Cole Mitchell          26    9    6    0   0   4/5    80.0     0/0   0.0
Miles Sabonis          26    5    0    0   0   2/7    28.6     0/0   0.0
Kyle Brogdon           26    4    4    0   0   2/3    66.7     0/0   0.0
Anfernee Anunoby       26    0    4    2   0   0/2     0.0     0/0   0.0
Desmond Harden         26    0    0    1   0   0/1     0.0     0/0   0.0

TEAM: FG: 8/18 (44.4%), 3PT: 2/6 (33.3%), REB: 13 (3 off, 10 def), AST: 3, TO: 4
TEAM FOULS: 8 [Team_018 in BONUS]

================================================================================

================================================================================
                       4TH QUARTER - Team_018 vs Team_009                       
================================================================================

[12:00] Team_018 possession (Score: 71-63)
Klay Stewart attempts a Layup. BLOCKED BY MILES SABONIS! Ball is loose! Offensive rebound by Bones Anunoby! Bones Anunoby kicks it out.

[11:41] Team_018 possession (Score: 71-63)
Allen Markkanen attempts a Midrange. Contested by Anfernee Anunoby (5.7 feet, MAN). Allen Markkanen misses. Rebound secured by Cole Mitchell.

[11:27] Team_009 possession (Score: 71-63)
Miles Sabonis attempts a 3Pt. Contested by Klay Stewart (4.3 feet, MAN). Miles Sabonis misses. Rebound secured by Domantas Wall.

[11:12] Team_018 possession (Score: 71-63)
FOUL! Offensive foul on Bones Anunoby! Cole Mitchell drew the charge! [Team fouls: 1] (Bones Anunoby: 1 personal fouls) TURNOVER! (dead ball)

[10:58] Team_009 possession (Score: 71-63)
Cole Mitchell attempts a 3Pt. Contested by Klay Stewart (4.3 feet, ZONE). COLE MITCHELL MAKES IT! Assist: Desmond Harden
Score: 71-66

[10:44] Team_018 possession (Score: 71-66)
Bones Anunoby attempts a 3Pt. Contested by Cole Mitchell (5.2 feet, MAN). Bones Anunoby misses. Rebound secured by Kyle Brogdon.

[10:28] Team_009 possession (Score: 71-66)
FOUL! Reach-in foul on Bones Anunoby during the drive. [Team fouls: 2] No free throws, side out. (Bones Anunoby: 2 personal fouls)

[10:10] Team_009 possession (Score: 71-66)
FOUL! Shooting foul on Klay Stewart. Miles Sabonis to the line for 2 free throws. [Team fouls: 3] (Klay Stewart: 1 personal fouls)   FT 1/2: GOOD   FT 2/2: GOOD Miles Sabonis makes 2/2 from the line.
Score: 71-68

[09:56] Team_018 possession (Score: 71-68)
Domantas Wall drives to the basket... Domantas Wall throws a bad pass out of bounds! TURNOVER! (dead ball)

[09:56] Substitution (Team_018): Klay Stewart OUT → Michael Simons IN (stamina_rule2)

[09:56] Substitution (Team_018): Tracy Bryant OUT → Miles Herro IN (stamina_rule2)

[09:56] Substitution (Team_018): Allen Markkanen OUT → Austin Antetokounmpo IN (stamina_rule2)

[09:56] Substitution (Team_018): Bones Anunoby OUT → Shai Wade IN (stamina_rule2)

[09:56] Substitution (Team_018): Domantas Wall OUT → Julius Jackson IN (stamina_rule2)

[09:56] Substitution (Team_009): Miles Sabonis OUT → Paul Trent IN (stamina_rule2)

[09:56] Substitution (Team_009): Desmond Harden OUT → Evan Curry IN (stamina_rule2)

[09:56] Substitution (Team_009): Anfernee Anunoby OUT → RJ Jokic IN (stamina_rule2)

[09:56] Substitution (Team_009): Cole Mitchell OUT → Kawhi Herro IN (stamina_rule2)

[09:56] Substitution (Team_009): Kyle Brogdon OUT → Shaquille Green IN (stamina_rule2)

[09:42] Team_009 possession (Score: 71-68)
RJ Jokic makes the 3Pt and draws the foul on Michael Simons! And-1! RJ Jokic to the line for 1. [Team fouls: 4] (Michael Simons: 1 personal fouls)   FT 1/1: MISS RJ Jokic makes 0/1 from the line. Offensive rebound by Kawhi Herro! Kawhi Herro puts it back in!
Score: 71-73

[09:32] Team_018 possession (Score: 71-73)
Julius Jackson drives and kicks out. FOUL! Shooting foul on Shaquille Green. Julius Jackson to the line for 3 free throws. [Team fouls: 1] (Shaquille Green: 1 personal fouls)   FT 1/3: MISS   FT 2/3: GOOD   FT 3/3: GOOD Julius Jackson makes 2/3 from the line.
Score: 73-73

[09:20] Team_009 possession (Score: 73-73)
Kawhi Herro drives and kicks out. Shaquille Green attempts a 3Pt. Contested by Michael Simons (5.4 feet, ZONE). Shaquille Green misses. Rebound secured by Austin Antetokounmpo.

[09:05] Team_018 possession (Score: 73-73)
FOUL! Shooting foul on RJ Jokic. Austin Antetokounmpo to the line for 2 free throws. [Team fouls: 2] (RJ Jokic: 1 personal fouls)   FT 1/2: MISS   FT 2/2: MISS Austin Antetokounmpo makes 0/2 from the line. Offensive rebound by Julius Jackson! Julius Jackson kicks it out.

[08:54] Team_018 possession (Score: 73-73)
Miles Herro drives, Kawhi Herro stays with him. Miles Herro attempts a Dunk. Contested by Kawhi Herro (3.8 feet, ZONE). Miles Herro misses. Rebound secured by RJ Jokic.

[08:38] Team_009 possession (Score: 73-73)
Paul Trent attempts a 3Pt. Contested by Michael Simons (4.7 feet, ZONE). Paul Trent misses. FOUL! Loose ball foul on Austin Antetokounmpo during the rebound battle. [IN THE BONUS! 5 team fouls] Shaquille Green to the line for 2 free throws. (Austin Antetokounmpo: 1 personal fouls)   FT 1/2: MISS   FT 2/2: MISS Shaquille Green makes 0/2 from the line. Rebound secured by Austin Antetokounmpo.

[08:19] Team_018 possession (Score: 73-73)
Austin Antetokounmpo attempts a Layup. Contested by RJ Jokic (3.9 feet, MAN). AUSTIN ANTETOKOUNMPO MAKES IT! Assist: Julius Jackson
Score: 75-73

[08:06] Team_009 possession (Score: 75-73)
FOUL! Reach-in foul on Julius Jackson during the drive. [IN THE BONUS! 6 team fouls] RJ Jokic to the line for 2 free throws. (Julius Jackson: 1 personal fouls)   FT 1/2: GOOD   FT 2/2: GOOD RJ Jokic makes 2/2 from the line.
Score: 75-75

[07:53] Team_018 possession (Score: 75-75)
Austin Antetokounmpo drives to the basket... FOUL! Offensive foul on Austin Antetokounmpo! Kawhi Herro drew the charge! [Team fouls: 7] (Austin Antetokounmpo: 2 personal fouls) TURNOVER! (dead ball)

[07:34] Team_009 possession (Score: 75-75)
Shaquille Green attempts a Midrange. Contested by Miles Herro (5.7 feet, ZONE). SHAQUILLE GREEN MAKES IT!
Score: 75-77

[07:16] Team_018 possession (Score: 75-77)
Julius Jackson attempts a Layup. Contested by Kawhi Herro (4.0 feet, ZONE). Julius Jackson misses. Rebound secured by Kawhi Herro.

[07:02] Team_009 possession (Score: 75-77)
Kawhi Herro attempts a Midrange. Contested by Miles Herro (5.6 feet, ZONE). KAWHI HERRO MAKES IT! Assist: Evan Curry
Score: 75-79

[06:46] Team_018 possession (Score: 75-79)
Shai Wade attempts a 3Pt. Contested by Kawhi Herro (3.1 feet, MAN). Shai Wade misses. Offensive rebound by Shai Wade! Shai Wade kicks it out.

[06:32] Team_018 possession (Score: 75-79)
Miles Herro attempts a 3Pt. Contested by Paul Trent (5.9 feet, ZONE). Miles Herro misses. Rebound secured by Shaquille Green.

[06:16] Team_009 possession (Score: 75-79)
FOUL! Shooting foul on Michael Simons. RJ Jokic to the line for 3 free throws. [BONUS: 8 team fouls] (Michael Simons: 2 personal fouls)   FT 1/3: MISS   FT 2/3: GOOD   FT 3/3: GOOD RJ Jokic makes 2/3 from the line.
Score: 75-81

[06:03] Team_018 possession (Score: 75-81)
Julius Jackson drives, Kawhi Herro stays with him. Julius Jackson attempts a Dunk. Contested by Kawhi Herro (4.0 feet, ZONE). JULIUS JACKSON MAKES IT!
Score: 77-81

[05:50] Team_009 possession (Score: 77-81)
Shaquille Green attempts a Layup. Contested by Julius Jackson (5.0 feet, MAN). Shaquille Green misses. Rebound secured by Shai Wade.

[05:36] Team_018 possession (Score: 77-81)
Michael Simons attempts a Layup. BLOCKED BY PAUL TRENT! Ball is loose! Rebound secured by RJ Jokic.

[05:22] Team_009 possession (Score: 77-81)
Kawhi Herro attempts a 3Pt. Contested by Shai Wade (5.0 feet, MAN). KAWHI HERRO MAKES IT! Assist: Paul Trent
Score: 77-84

[05:06] Team_018 possession (Score: 77-84)
Shai Wade attempts a Layup. Contested by Kawhi Herro (3.1 feet, ZONE). SHAI WADE MAKES IT! Assist: Austin Antetokounmpo
Score: 79-84

[04:53] Team_009 possession (Score: 79-84)
Kawhi Herro attempts a Midrange. Contested by Shai Wade (5.0 feet, MAN). Kawhi Herro misses. Offensive rebound by Shaquille Green! Shaquille Green kicks it out.

[04:39] Team_009 possession (Score: 79-84)
Kawhi Herro attempts a Layup. Contested by Julius Jackson (4.9 feet, ZONE). KAWHI HERRO MAKES IT!
Score: 79-86

[04:25] Team_018 possession (Score: 79-86)
Michael Simons attempts a Midrange. Contested by Evan Curry (5.6 feet, ZONE). MICHAEL SIMONS MAKES IT!
Score: 81-86

[04:14] Team_009 possession (Score: 81-86)
Shaquille Green attempts a 3Pt. Contested by Michael Simons (5.6 feet, ZONE). Shaquille Green misses. Rebound secured by Austin Antetokounmpo.

[04:02] Team_018 possession (Score: 81-86)
Michael Simons drives, Paul Trent stays with him. Michael Simons attempts a Layup. Contested by Paul Trent (5.9 feet, MAN). MICHAEL SIMONS MAKES IT!
Score: 83-86

[03:50] Team_009 possession (Score: 83-86)
Shaquille Green drives to the basket... Shaquille Green throws a bad pass out of bounds! TURNOVER! (dead ball)

[03:37] Team_018 possession (Score: 83-86)
Miles Herro attempts a 3Pt. Contested by Evan Curry (5.6 feet, MAN). MILES HERRO MAKES IT! Assist: Austin Antetokounmpo
Score: 86-86

[03:24] Team_009 possession (Score: 86-86)
Evan Curry attempts a Midrange. Contested by Shai Wade (5.1 feet, ZONE). Evan Curry misses. Rebound secured by Shai Wade.

[03:08] Team_018 possession (Score: 86-86)
Austin Antetokounmpo attempts a 3Pt. Contested by RJ Jokic (3.9 feet, MAN). Austin Antetokounmpo misses. Rebound secured by Shaquille Green.

[02:56] Team_009 possession (Score: 86-86)
Kawhi Herro drives, picks up Julius Jackson. Help arrives from Miles Herro! Kawhi Herro attempts a Dunk. Contested by Miles Herro (5.0 feet, ZONE). KAWHI HERRO MAKES IT! Assist: Evan Curry
Score: 86-88

[02:44] Team_018 possession (Score: 86-88)
Shai Wade drives, picks up Kawhi Herro. Help arrives from Paul Trent! Shai Wade attempts a Dunk. Contested by Paul Trent (3.1 feet, ZONE). Shai Wade misses. Offensive rebound by Shai Wade! Shai Wade kicks it out.

[02:32] Team_018 possession (Score: 86-88)
Michael Simons drives to the basket... Michael Simons throws a bad pass! Stolen by Kawhi Herro! TURNOVER! (live ball)

[02:19] Team_009 possession (Score: 86-88)
Shaquille Green makes the Layup and draws the foul on Julius Jackson! And-1! Shaquille Green to the line for 1. [BONUS: 9 team fouls] (Julius Jackson: 2 personal fouls)   FT 1/1: GOOD Shaquille Green makes 1/1 from the line.
Score: 86-91

[02:03] Team_018 possession (Score: 86-91)
Miles Herro attempts a Midrange. Contested by Evan Curry (5.7 feet, MAN). Miles Herro misses. Rebound secured by Kawhi Herro.

[01:49] Team_009 possession (Score: 86-91)
RJ Jokic drives, picks up Austin Antetokounmpo. Help arrives from Miles Herro! RJ Jokic attempts a Dunk. Contested by Miles Herro (5.2 feet, MAN). RJ Jokic misses. Rebound secured by Austin Antetokounmpo.

[01:33] Team_018 possession (Score: 86-91)
Shai Wade attempts a 3Pt. Contested by Paul Trent (5.3 feet, ZONE). SHAI WADE MAKES IT! Assist: Miles Herro
Score: 89-91

[01:23] Team_009 possession (Score: 89-91)
Kawhi Herro attempts a Midrange. Contested by Shai Wade (5.2 feet, MAN). Kawhi Herro misses. Rebound secured by Austin Antetokounmpo.

[01:11] Team_018 possession (Score: 89-91)
Shai Wade attempts a Layup. Contested by Kawhi Herro (3.3 feet, MAN). Shai Wade misses. Rebound secured by Kawhi Herro.

[00:59] Team_009 possession (Score: 89-91)
Shaquille Green drives and kicks out. Paul Trent attempts a 3Pt. Contested by Michael Simons (5.6 feet, MAN). Paul Trent misses. Offensive rebound by Kawhi Herro! Kawhi Herro puts it back in!
Score: 89-93

[00:49] Team_018 possession (Score: 89-93)
Austin Antetokounmpo attempts a 3Pt. Contested by Paul Trent (5.3 feet, ZONE). AUSTIN ANTETOKOUNMPO MAKES IT! Assist: Miles Herro
Score: 92-93

[00:35] Team_009 possession (Score: 92-93)
Shaquille Green attempts a Layup. BLOCKED BY JULIUS JACKSON! Ball is loose! Rebound secured by Austin Antetokounmpo.

[00:21] Team_018 possession (Score: 92-93)
Miles Herro attempts a 3Pt. Wide open! Paul Trent is 6.1 feet away. [ZONE] Miles Herro misses. Rebound secured by Kawhi Herro.

[00:04] Team_009 possession (Score: 92-93)
Shaquille Green attempts a Layup. Contested by Julius Jackson (5.3 feet, ZONE). SHAQUILLE GREEN MAKES IT! Assist: Evan Curry
Score: 92-95

================================================================================
                              4TH QUARTER COMPLETE                              
================================================================================

4TH QUARTER SCORE: Team_018 21, Team_009 32

BOX SCORE:
================================================================================

Team_018
--------------------------------------------------------------------------------
Player                MIN  PTS  REB  AST  TO      FG   FG%      3P   3P%
--------------------------------------------------------------------------------
Austin Antetokounmpo   20    5    6    2   0   2/3    66.7     0/0   0.0
Shai Wade              20    5    4    0   0   2/3    66.7     0/0   0.0
Julius Jackson         20    4    1    1   0   2/3    66.7     0/0   0.0
Michael Simons         20    4    0    0   0   2/3    66.7     0/0   0.0
Miles Herro            20    3    0    2   0   1/5    20.0     0/0   0.0
Bones Anunoby          29    0    1    0   0   0/1     0.0     0/0   0.0
Allen Markkanen        29    0    0    0   0   0/1     0.0     0/0   0.0
Domantas Wall          29    0    1    0   0   0/0     0.0     0/0   0.0

TEAM: FG: 9/19 (47.4%), 3PT: 3/7 (42.9%), REB: 12 (4 off, 8 def), AST: 5, TO: 4
TEAM FOULS: 9 [Team_009 in BONUS]


Team_009
--------------------------------------------------------------------------------
Player                MIN  PTS  REB  AST  TO      FG   FG%      3P   3P%
--------------------------------------------------------------------------------
Kawhi Herro            20   16    5    0   0   6/8    75.0     0/0   0.0
Shaquille Green        20    7    3    0   0   3/6    50.0     0/0   0.0
RJ Jokic               20    4    2    0   0   2/3    66.7     0/0   0.0
Cole Mitchell          29    3    1    0   0   1/1   100.0     0/0   0.0
Miles Sabonis          29    2    0    0   0   1/2    50.0     0/0   0.0
Desmond Harden         29    0    0    1   0   0/0     0.0     0/0   0.0
Kyle Brogdon           29    0    1    0   0   0/0     0.0     0/0   0.0
Paul Trent             20    0    0    1   0   0/1     0.0     0/0   0.0
Evan Curry             20    0    0    3   0   0/1     0.0     0/0   0.0

TEAM: FG: 13/22 (59.1%), 3PT: 4/7 (57.1%), REB: 13 (3 off, 10 def), AST: 5, TO: 1
TEAM FOULS: 2

================================================================================

================================================================================
                               FULL GAME COMPLETE                               
================================================================================

FINAL SCORE: Team_018 92, Team_009 95

SCORING BY QUARTER:
--------------------------------------------------------------------------------
Team                     Q1     Q2     Q3     Q4    FINAL
--------------------------------------------------------------------------------
Team_018                 32     19     20     21       92
Team_009                 26     16     21     32       95
--------------------------------------------------------------------------------

FULL GAME BOX SCORE:
================================================================================

Team_018
--------------------------------------------------------------------------------
Player                MIN  PTS  REB  AST  TO      FG   FG%      3P   3P%      FT STL BLK
--------------------------------------------------------------------------------
Klay Stewart           29   12    0    0   1   7/11   63.6   4/7    57.1   3/3     2   0
Tracy Bryant           29    4    0    2   2   3/8    37.5   0/1     0.0   2/2     0   0
Allen Markkanen        29    5    5    0   2   3/6    50.0   2/3    66.7   0/0     0   0
Bones Anunoby          29    9    6    1   3   4/11   36.4   1/5    20.0   6/7     2   0
Domantas Wall          29   25   12    1   1   7/9    77.8   0/0     0.0  13/13    3   1
Michael Simons         20    4    0    1   1   2/3    66.7   0/0     0.0   0/0     0   0
Miles Herro            20    8    0    3   1   3/11   27.3   2/7    28.6   0/0     0   1
Austin Antetokounmpo   20   15    9    2   0   5/9    55.6   3/6    50.0   2/4     0   0
Shai Wade              20    5    8    1   0   3/5    60.0   1/2    50.0   0/0     0   0
Julius Jackson         20    4    4    1   2   2/5    40.0   0/1     0.0   2/3     0   1

TEAM: FG: 39/78 (50.0%), 3PT: 13/32 (40.6%), REB: 44 (8 off, 36 def), AST: 12, TO: 13


Team_009
--------------------------------------------------------------------------------
Player                MIN  PTS  REB  AST  TO      FG   FG%      3P   3P%      FT STL BLK
--------------------------------------------------------------------------------
Miles Sabonis          29   10    0    2   2   4/10   40.0   2/5    40.0   5/5     0   2
Desmond Harden         29    6    0    3   2   4/6    66.7   1/3    33.3   0/2     2   0
Anfernee Anunoby       29   11    6    4   2   4/9    44.4   3/5    60.0   0/1     0   0
Cole Mitchell          29   18   12    0   2   7/9    77.8   1/2    50.0   3/3     0   0
Kyle Brogdon           29    4    9    1   3   1/5    20.0   0/1     0.0   0/0     2   0
Paul Trent             20    3    0    2   0   1/2    50.0   0/1     0.0   1/1     0   1
Evan Curry             20    0    0    3   1   1/4    25.0   0/1     0.0   0/0     0   0
RJ Jokic               20    8    6    0   1   4/7    57.1   2/4    50.0   4/6     0   0
Kawhi Herro            20   23   10    1   0   8/13   61.5   1/3    33.3   2/2     3   0
Shaquille Green        20    9    8    2   0   4/10   40.0   0/1     0.0   1/3     0   0

TEAM: FG: 39/76 (51.3%), 3PT: 10/26 (38.5%), REB: 50 (12 off, 38 def), AST: 18, TO: 13

================================================================================
