================================================================================
                        FULL GAME - Team_008 vs Team_067                        
================================================================================

================================================================================
                       1ST QUARTER - Team_008 vs Team_067                       
================================================================================

[12:00] Team_008 possession (Score: 0-0)
FOUL! Shooting foul on Malcolm Westbrook. Magic Young to the line for 2 free throws. [Team fouls: 1] (Malcolm Westbrook: 1 personal fouls)   FT 1/2: GOOD   FT 2/2: GOOD Magic Young makes 2/2 from the line.
Score: 2-0

[11:48] Team_067 possession (Score: 2-0)
Malcolm Westbrook drives, picks up Tyrese Thompson. Help arrives from Jrue Harris! Malcolm Westbrook attempts a Dunk. Contested by Jrue Harris (4.7 feet, ZONE). MALCOLM WESTBROOK MAKES IT!
Score: 2-2

[11:30] Team_008 possession (Score: 2-2)
Victor Leonard attempts a Layup. Contested by Manu Reaves (4.2 feet, MAN). Victor Leonard misses. Rebound secured by Desmond Simmons.

[11:15] Team_067 possession (Score: 2-2)
Desmond Simmons attempts a 3Pt. Contested by Khris Hyland (4.2 feet, MAN). Desmond Simmons misses. Rebound secured by Tyrese Thompson.

[10:58] Team_008 possession (Score: 2-2)
Victor Leonard attempts a 3Pt. Contested by Desmond Simmons (4.1 feet, ZONE). VICTOR LEONARD MAKES IT! Assist: Jrue Harris
Score: 5-2

[10:43] Team_067 possession (Score: 5-2)
Manu Reaves attempts a Midrange. Contested by Khris Hyland (4.5 feet, ZONE). MANU REAVES MAKES IT! Assist: Desmond Simmons
Score: 5-4

[10:31] Team_008 possession (Score: 5-4)
Jrue Harris throws a bad pass! Stolen by Wendell Antetokounmpo! TURNOVER! (live ball)

[10:17] Team_067 possession (Score: 5-4)
Malcolm Westbrook drives and kicks out. Wendell Antetokounmpo attempts a Midrange. Contested by Khris Hyland (4.0 feet, ZONE). WENDELL ANTETOKOUNMPO MAKES IT! Assist: Malcolm Westbrook
Score: 5-6

[10:05] Team_008 possession (Score: 5-6)
Khris Hyland attempts a Layup. Contested by Malcolm Westbrook (4.1 feet, ZONE). KHRIS HYLAND MAKES IT! Assist: Jrue Harris
Score: 7-6

[09:51] Team_067 possession (Score: 7-6)
Malcolm Westbrook drives, picks up Tyrese Thompson. Help arrives from Jrue Harris! Malcolm Westbrook attempts a Layup. Contested by Jrue Harris (4.7 feet, ZONE). MALCOLM WESTBROOK MAKES IT!
Score: 7-8

[09:40] Team_008 possession (Score: 7-8)
Khris Hyland attempts a 3Pt. Contested by Desmond Simmons (3.9 feet, ZONE). KHRIS HYLAND MAKES IT! Assist: Jrue Harris
Score: 10-8

[09:28] Team_067 possession (Score: 10-8)
Manu Reaves attempts a Midrange. Contested by Khris Hyland (4.5 feet, ZONE). Manu Reaves misses. Rebound secured by Tyrese Thompson.

[09:17] Team_008 possession (Score: 10-8)
Victor Leonard makes the Dunk and draws the foul on Malcolm Westbrook! And-1! Victor Leonard to the line for 1. [Team fouls: 2] (Malcolm Westbrook: 2 personal fouls)   FT 1/1: MISS Victor Leonard makes 0/1 from the line. FOUL! Loose ball foul on Desmond Simmons during the free throw rebound! [Team fouls: 3] No free throws, side out. (Desmond Simmons: 1 personal fouls)
Score: 12-8

[09:01] Team_008 possession (Score: 12-8)
Khris Hyland attempts a Layup. Contested by Desmond Simmons (3.9 feet, MAN). Khris Hyland misses. Rebound secured by Wendell Antetokounmpo.

[08:50] Team_067 possession (Score: 12-8)
Wendell Antetokounmpo loses the ball! Stripped by Jrue Harris! TURNOVER! (live ball)

[08:33] Team_008 possession (Score: 12-8)
Magic Young attempts a Layup. BLOCKED BY MALCOLM WESTBROOK! Ball deflects out of bounds off Magic Young.

[08:20] Team_067 possession (Score: 12-8)
Wendell Antetokounmpo drives and kicks out. Malcolm Westbrook attempts a 3Pt. Contested by Jrue Harris (4.3 feet, ZONE). Malcolm Westbrook misses. Rebound secured by Khris Hyland.

[08:06] Team_008 possession (Score: 12-8)
Magic Young attempts a 3Pt. Contested by Desmond Simmons (4.2 feet, ZONE). Magic Young misses. FOUL! Loose ball foul on Desmond Simmons during the rebound battle. [Team fouls: 4] No free throws, side out. (Desmond Simmons: 2 personal fouls)

[07:49] Team_008 possession (Score: 12-8)
Khris Hyland attempts a 3Pt. Contested by Desmond Simmons (3.9 feet, MAN). Khris Hyland misses. Rebound secured by Desmond Simmons.

[07:35] Team_067 possession (Score: 12-8)
Manu Reaves makes the Layup and draws the foul on Tyrese Thompson! And-1! Manu Reaves to the line for 1. [Team fouls: 1] (Tyrese Thompson: 1 personal fouls)   FT 1/1: GOOD Manu Reaves makes 1/1 from the line.
Score: 12-11

[07:24] Team_008 possession (Score: 12-11)
Khris Hyland attempts a 3Pt. Contested by Desmond Simmons (3.9 feet, MAN). Khris Hyland misses. Rebound secured by Wendell Antetokounmpo.

[07:09] Team_067 possession (Score: 12-11)
Desmond Simmons drives and kicks out. Wendell Antetokounmpo attempts a 3Pt. Contested by Jrue Harris (4.3 feet, MAN). Wendell Antetokounmpo misses. FOUL! Loose ball foul on Magic Young during the rebound battle. [Team fouls: 2] No free throws, side out. (Magic Young: 1 personal fouls)

[06:55] Team_067 possession (Score: 12-11)
Manu Reaves throws a bad pass! Stolen by Victor Leonard! TURNOVER! (live ball)

[06:35] Team_008 possession (Score: 12-11)
Magic Young attempts a Layup. Contested by Malcolm Westbrook (4.4 feet, MAN). MAGIC YOUNG MAKES IT! Assist: Jrue Harris
Score: 14-11

[06:18] Team_067 possession (Score: 14-11)
Manu Reaves drives and kicks out. Malcolm Westbrook attempts a 3Pt. Contested by Magic Young (4.9 feet, MAN). Malcolm Westbrook misses. FOUL! Loose ball foul on Magic Young during the rebound battle. [Team fouls: 3] No free throws, side out. (Magic Young: 2 personal fouls)

[06:00] Team_067 possession (Score: 14-11)
Ben Ball attempts a 3Pt. Contested by Jrue Harris (5.2 feet, ZONE). BEN BALL MAKES IT! Assist: Malcolm Westbrook
Score: 14-14

[05:46] Team_008 possession (Score: 14-14)
Magic Young attempts a Midrange. Contested by Malcolm Westbrook (4.4 feet, MAN). MAGIC YOUNG MAKES IT! Assist: Khris Hyland
Score: 16-14

[05:31] Team_067 possession (Score: 16-14)
Manu Reaves attempts a Midrange. BLOCKED BY VICTOR LEONARD! Ball goes out off Victor Leonard. Manu Reaves's ball!

[05:15] Team_067 possession (Score: 16-14)
Desmond Simmons attempts a 3Pt. Contested by Khris Hyland (4.2 feet, MAN). Desmond Simmons misses. Offensive rebound by Malcolm Westbrook! Malcolm Westbrook puts it back in!
Score: 16-16

[04:57] Team_008 possession (Score: 16-16)
Victor Leonard attempts a 3Pt. Contested by Ben Ball (4.2 feet, ZONE). VICTOR LEONARD MAKES IT! Assist: Magic Young
Score: 19-16

[04:45] Team_067 possession (Score: 19-16)
Malcolm Westbrook attempts a Midrange. Contested by Magic Young (5.4 feet, MAN). Malcolm Westbrook misses. Rebound secured by Magic Young.

[04:31] Team_008 possession (Score: 19-16)
Magic Young attempts a Midrange. Contested by Malcolm Westbrook (4.4 feet, MAN). MAGIC YOUNG MAKES IT!
Score: 21-16

[04:14] Team_067 possession (Score: 21-16)
Desmond Simmons attempts a Layup. Contested by Khris Hyland (4.3 feet, MAN). DESMOND SIMMONS MAKES IT! Assist: Malcolm Westbrook
Score: 21-18

[04:01] Team_008 possession (Score: 21-18)
Victor Leonard attempts a Midrange. Contested by Manu Reaves (4.3 feet, MAN). Victor Leonard misses. Rebound secured by Malcolm Westbrook.

[03:44] Team_067 possession (Score: 21-18)
FOUL! Shooting foul on Magic Young. Malcolm Westbrook to the line for 2 free throws. [Team fouls: 4] (Magic Young: 3 personal fouls)   FT 1/2: GOOD   FT 2/2: MISS Malcolm Westbrook makes 1/2 from the line. Rebound secured by Tyrese Thompson.
Score: 21-19

[03:29] Team_008 possession (Score: 21-19)
Tyrese Thompson attempts a Layup. Contested by Ben Ball (4.2 feet, MAN). TYRESE THOMPSON MAKES IT!
Score: 23-19

[03:14] Team_067 possession (Score: 23-19)
Manu Reaves attempts a 3Pt. Contested by Victor Leonard (5.5 feet, ZONE). Manu Reaves misses. Rebound secured by Magic Young.

[02:58] Team_008 possession (Score: 23-19)
Magic Young throws a bad pass! Stolen by Malcolm Westbrook! TURNOVER! (live ball)

[02:43] Team_067 possession (Score: 23-19)
Malcolm Westbrook makes the Dunk and draws the foul on Jrue Harris! And-1! Malcolm Westbrook to the line for 1. [BONUS: 5 team fouls] (Jrue Harris: 1 personal fouls)   FT 1/1: GOOD Malcolm Westbrook makes 1/1 from the line.
Score: 23-22

[02:30] Team_008 possession (Score: 23-22)
Khris Hyland attempts a 3Pt. Contested by Desmond Simmons (4.0 feet, MAN). Khris Hyland misses. Rebound secured by Manu Reaves.

[02:15] Team_067 possession (Score: 23-22)
Desmond Simmons attempts a Midrange. Contested by Jrue Harris (4.7 feet, ZONE). DESMOND SIMMONS MAKES IT!
Score: 23-24

[01:56] Team_008 possession (Score: 23-24)
Jrue Harris attempts a Midrange. Contested by Wendell Antetokounmpo (4.9 feet, MAN). JRUE HARRIS MAKES IT! Assist: Khris Hyland
Score: 25-24

[01:45] Team_067 possession (Score: 25-24)
Malcolm Westbrook attempts a Layup. Contested by Magic Young (5.6 feet, MAN). MALCOLM WESTBROOK MAKES IT! Assist: Manu Reaves
Score: 25-26

[01:33] Team_008 possession (Score: 25-26)
Khris Hyland attempts a 3Pt. Contested by Desmond Simmons (4.1 feet, ZONE). KHRIS HYLAND MAKES IT! Assist: Victor Leonard
Score: 28-26

[01:22] Team_067 possession (Score: 28-26)
FOUL! Reach-in foul on Tyrese Thompson during the drive. [IN THE BONUS! 6 team fouls] Ben Ball to the line for 2 free throws. (Tyrese Thompson: 2 personal fouls)   FT 1/2: GOOD   FT 2/2: GOOD Ben Ball makes 2/2 from the line.
Score: 28-28

[01:09] Team_008 possession (Score: 28-28)
Khris Hyland attempts a 3Pt. Contested by Desmond Simmons (4.2 feet, ZONE). Khris Hyland misses. Offensive rebound by Magic Young! Magic Young kicks it out.

[00:52] Team_008 possession (Score: 28-28)
Tyrese Thompson drives to the basket... Tyrese Thompson throws a bad pass! Stolen by Malcolm Westbrook! TURNOVER! (live ball)

[00:39] Team_067 possession (Score: 28-28)
Wendell Antetokounmpo attempts a 3Pt. Contested by Jrue Harris (5.0 feet, MAN). Wendell Antetokounmpo misses. Rebound secured by Khris Hyland.

[00:25] Team_008 possession (Score: 28-28)
Magic Young attempts a 3Pt. Contested by Malcolm Westbrook (4.8 feet, MAN). Magic Young misses. Rebound secured by Malcolm Westbrook.

[00:15] Team_067 possession (Score: 28-28)
Malcolm Westbrook attempts a 3Pt. Contested by Magic Young (5.8 feet, MAN). Malcolm Westbrook misses. Rebound secured by Khris Hyland.

================================================================================
                              1ST QUARTER COMPLETE                              
================================================================================

1ST QUARTER SCORE: Team_008 28, Team_067 28

BOX SCORE:
================================================================================

Team_008
--------------------------------------------------------------------------------
Player                MIN  PTS  REB  AST  TO      FG   FG%      3P   3P%
--------------------------------------------------------------------------------
Magic Young            12    8    4    1   0   4/6    66.7     0/0   0.0
Khris Hyland           12    8    3    2   0   3/7    42.9     0/0   0.0
Victor Leonard         12    6    0    1   0   2/4    50.0     0/0   0.0
Tyrese Thompson        12    2    4    0   0   1/1   100.0     0/0   0.0
Jrue Harris            12    2    0    4   0   1/1   100.0     0/0   0.0

TEAM: FG: 11/19 (57.9%), 3PT: 4/8 (50.0%), REB: 11 (3 off, 8 def), AST: 8, TO: 3
TEAM FOULS: 6 [Team_067 in BONUS]


Team_067
--------------------------------------------------------------------------------
Player                MIN  PTS  REB  AST  TO      FG   FG%      3P   3P%
--------------------------------------------------------------------------------
Malcolm Westbrook      12   11    4    3   0   5/8    62.5     0/0   0.0
Manu Reaves            12    5    1    1   0   2/4    50.0     0/0   0.0
Ben Ball               12    5    0    0   0   2/2   100.0     0/0   0.0
Desmond Simmons        12    4    3    1   0   2/3    66.7     0/0   0.0
Wendell Antetokounmpo   12    2    2    0   0   1/3    33.3     0/0   0.0

TEAM: FG: 12/20 (60.0%), 3PT: 2/6 (33.3%), REB: 10 (3 off, 7 def), AST: 5, TO: 2
TEAM FOULS: 4

================================================================================

================================================================================
                       2ND QUARTER - Team_008 vs Team_067                       
================================================================================

[12:00] Team_008 possession (Score: 28-28)
Jrue Harris loses the ball! Stripped by Wendell Antetokounmpo! TURNOVER! (live ball)

[11:47] Team_067 possession (Score: 28-28)
Ben Ball attempts a 3Pt. Wide open! Victor Leonard is 6.1 feet away. [ZONE] Ben Ball misses. Offensive rebound by Malcolm Westbrook! Malcolm Westbrook puts it back in!
Score: 28-30

[11:33] Team_008 possession (Score: 28-30)
FOUL! Shooting foul on Ben Ball. Tyrese Thompson to the line for 2 free throws. [Team fouls: 1] (Ben Ball: 1 personal fouls)   FT 1/2: GOOD   FT 2/2: MISS Tyrese Thompson makes 1/2 from the line. Rebound secured by Malcolm Westbrook.
Score: 29-30

[11:16] Team_067 possession (Score: 29-30)
Wendell Antetokounmpo attempts a 3Pt. Contested by Victor Leonard (5.7 feet, ZONE). WENDELL ANTETOKOUNMPO MAKES IT! Assist: Desmond Simmons
Score: 29-33

[11:02] Team_008 possession (Score: 29-33)
Khris Hyland attempts a 3Pt. Contested by Desmond Simmons (4.2 feet, MAN). Khris Hyland misses. Rebound secured by Desmond Simmons.

[10:50] Team_067 possession (Score: 29-33)
Manu Reaves attempts a Midrange. Contested by Jrue Harris (5.0 feet, ZONE). Manu Reaves misses. Offensive rebound by Desmond Simmons! Desmond Simmons kicks it out.

[10:35] Team_067 possession (Score: 29-33)
Ben Ball attempts a Midrange. Contested by Khris Hyland (5.3 feet, ZONE). Ben Ball misses. Offensive rebound by Malcolm Westbrook! Malcolm Westbrook's putback is no good. Rebound secured by Magic Young.

[10:20] Team_008 possession (Score: 29-33)
Khris Hyland throws a bad pass! Stolen by Desmond Simmons! TURNOVER! (live ball)

[10:08] Team_067 possession (Score: 29-33)
FOUL! Holding foul on Magic Young. [Team fouls: 1] No free throws, side out. (Magic Young: 1 personal fouls)

[09:54] Team_067 possession (Score: 29-33)
Ben Ball drives and kicks out. Malcolm Westbrook attempts a Midrange. Contested by Tyrese Thompson (5.1 feet, ZONE). Malcolm Westbrook misses. Rebound secured by Tyrese Thompson.

[09:41] Team_008 possession (Score: 29-33)
Tyrese Thompson attempts a Layup. Contested by Ben Ball (4.6 feet, MAN). TYRESE THOMPSON MAKES IT! Assist: Khris Hyland
Score: 31-33

[09:27] Team_067 possession (Score: 31-33)
Wendell Antetokounmpo drives and kicks out. Wendell Antetokounmpo attempts a 3Pt. Contested by Jrue Harris (4.9 feet, MAN). Wendell Antetokounmpo misses. Rebound secured by Khris Hyland.

[09:14] Team_008 possession (Score: 31-33)
Khris Hyland attempts a Layup. BLOCKED BY MALCOLM WESTBROOK! Ball is loose! Offensive rebound by Magic Young! Magic Young kicks it out.

[08:59] Team_008 possession (Score: 31-33)
Khris Hyland attempts a 3Pt. Contested by Desmond Simmons (4.4 feet, ZONE). Khris Hyland misses. Rebound secured by Manu Reaves.

[08:43] Team_067 possession (Score: 31-33)
Desmond Simmons attempts a 3Pt. Contested by Victor Leonard (5.8 feet, ZONE). DESMOND SIMMONS MAKES IT! Assist: Wendell Antetokounmpo
Score: 31-36

[08:29] Team_008 possession (Score: 31-36)
Jrue Harris drives, Wendell Antetokounmpo stays with him. Jrue Harris attempts a Layup. Contested by Wendell Antetokounmpo (5.4 feet, MAN). JRUE HARRIS MAKES IT! Assist: Tyrese Thompson
Score: 33-36

[08:19] Team_067 possession (Score: 33-36)
Ben Ball drives and kicks out. Manu Reaves attempts a Midrange. Contested by Jrue Harris (5.1 feet, ZONE). Manu Reaves misses. Offensive rebound by Desmond Simmons! Desmond Simmons kicks it out.

[08:06] Team_067 possession (Score: 33-36)
Malcolm Westbrook attempts a Layup. Wide open! Magic Young is 6.1 feet away. [MAN] MALCOLM WESTBROOK MAKES IT! Assist: Manu Reaves
Score: 33-38

[07:52] Team_008 possession (Score: 33-38)
Tyrese Thompson attempts a 3Pt. Contested by Ben Ball (4.9 feet, MAN). Tyrese Thompson misses. Rebound secured by Malcolm Westbrook.

[07:35] Team_067 possession (Score: 33-38)
Ben Ball attempts a Layup. Wide open! Tyrese Thompson is 6.2 feet away. [ZONE] Ben Ball misses. Rebound secured by Khris Hyland.

[07:24] Team_008 possession (Score: 33-38)
Khris Hyland attempts a 3Pt. Contested by Desmond Simmons (4.6 feet, ZONE). Khris Hyland misses. Rebound secured by Ben Ball.

[07:12] Team_067 possession (Score: 33-38)
Malcolm Westbrook drives, Magic Young stays with him. Malcolm Westbrook attempts a Layup. Wide open! Magic Young is 6.2 feet away. [ZONE] MALCOLM WESTBROOK MAKES IT! Assist: Desmond Simmons
Score: 33-40

[06:59] Team_008 possession (Score: 33-40)
Tyrese Thompson attempts a 3Pt. Contested by Ben Ball (5.0 feet, MAN). Tyrese Thompson misses. Rebound secured by Desmond Simmons.

[06:43] Team_067 possession (Score: 33-40)
FOUL! Reach-in foul on Tyrese Thompson during the drive. [Team fouls: 2] No free throws, side out. (Tyrese Thompson: 1 personal fouls)

[06:27] Team_067 possession (Score: 33-40)
Malcolm Westbrook attempts a Layup. Wide open! Magic Young is 6.3 feet away. [MAN] MALCOLM WESTBROOK MAKES IT! Assist: Wendell Antetokounmpo
Score: 33-42

[06:13] Team_008 possession (Score: 33-42)
Khris Hyland attempts a Midrange. Contested by Ben Ball (5.1 feet, ZONE). KHRIS HYLAND MAKES IT!
Score: 35-42

[05:59] Team_067 possession (Score: 35-42)
Desmond Simmons drives and kicks out. Desmond Simmons attempts a 3Pt. Contested by Khris Hyland (5.3 feet, MAN). Desmond Simmons misses. Offensive rebound by Desmond Simmons! Desmond Simmons kicks it out.

[05:41] Team_067 possession (Score: 35-42)
FOUL! Reach-in foul on Jrue Harris during the drive. [Team fouls: 3] No free throws, side out. (Jrue Harris: 1 personal fouls)

[05:25] Team_067 possession (Score: 35-42)
Manu Reaves attempts a 3Pt. Wide open! Victor Leonard is 6.4 feet away. [ZONE] Manu Reaves misses. Rebound secured by Khris Hyland.

[05:11] Team_008 possession (Score: 35-42)
Victor Leonard attempts a Midrange. Contested by Manu Reaves (5.5 feet, MAN). Victor Leonard misses. FOUL! Loose ball foul on Ben Ball during the rebound battle. [Team fouls: 2] No free throws, side out. (Ben Ball: 2 personal fouls)

[04:55] Team_008 possession (Score: 35-42)
Jrue Harris drives, picks up Malcolm Westbrook. Help arrives from Wendell Antetokounmpo! Jrue Harris attempts a Layup. Contested by Wendell Antetokounmpo (5.4 feet, ZONE). Jrue Harris misses. Rebound secured by Desmond Simmons.

[04:36] Team_067 possession (Score: 35-42)
Manu Reaves attempts a Midrange. Wide open! Victor Leonard is 6.5 feet away. [MAN] MANU REAVES MAKES IT! Assist: Desmond Simmons
Score: 35-44

[04:23] Team_008 possession (Score: 35-44)
Tyrese Thompson attempts a Midrange. Contested by Desmond Simmons (5.0 feet, ZONE). TYRESE THOMPSON MAKES IT! Assist: Jrue Harris
Score: 37-44

[04:14] Team_067 possession (Score: 37-44)
Desmond Simmons attempts a 3Pt. Contested by Khris Hyland (5.6 feet, MAN). Desmond Simmons misses. Rebound secured by Magic Young.

[04:01] Team_008 possession (Score: 37-44)
Magic Young attempts a Midrange. Contested by Malcolm Westbrook (5.7 feet, MAN). MAGIC YOUNG MAKES IT!
Score: 39-44

[03:44] Team_067 possession (Score: 39-44)
Manu Reaves attempts a Layup. Wide open! Victor Leonard is 6.6 feet away. [MAN] Manu Reaves misses. Rebound secured by Tyrese Thompson.

[03:34] Team_008 possession (Score: 39-44)
FOUL! Holding foul on Ben Ball. [Team fouls: 3] No free throws, side out. (Ben Ball: 3 personal fouls)

[03:19] Team_008 possession (Score: 39-44)
FOUL! Offensive foul on Magic Young! Malcolm Westbrook drew the charge! [Team fouls: 4] (Magic Young: 2 personal fouls) TURNOVER! (dead ball)

[03:04] Team_067 possession (Score: 39-44)
Desmond Simmons attempts a Midrange. Contested by Khris Hyland (5.8 feet, ZONE). DESMOND SIMMONS MAKES IT!
Score: 39-46

[02:51] Team_008 possession (Score: 39-46)
Khris Hyland drives and kicks out. FOUL! Shooting foul on Desmond Simmons. Jrue Harris to the line for 3 free throws. [Team fouls: 4] (Desmond Simmons: 1 personal fouls)   FT 1/3: GOOD   FT 2/3: GOOD   FT 3/3: GOOD Jrue Harris makes 3/3 from the line.
Score: 42-46

[02:34] Team_067 possession (Score: 42-46)
Ben Ball attempts a Midrange. Wide open! Jrue Harris is 6.4 feet away. [ZONE] BEN BALL MAKES IT!
Score: 42-48

[02:20] Team_008 possession (Score: 42-48)
Magic Young attempts a Layup. Contested by Malcolm Westbrook (6.0 feet, ZONE). Magic Young misses. Offensive rebound by Khris Hyland! Khris Hyland kicks it out.

[02:03] Team_008 possession (Score: 42-48)
Tyrese Thompson attempts a 3Pt. Contested by Ben Ball (5.7 feet, MAN). Tyrese Thompson misses. Rebound secured by Ben Ball.

[01:50] Team_067 possession (Score: 42-48)
Desmond Simmons loses the ball! Stripped by Khris Hyland! TURNOVER! (live ball)

[01:31] Team_008 possession (Score: 42-48)
Tyrese Thompson attempts a 3Pt. Contested by Desmond Simmons (5.3 feet, ZONE). Tyrese Thompson misses. Rebound secured by Desmond Simmons.

[01:21] Team_067 possession (Score: 42-48)
Desmond Simmons attempts a Midrange. Wide open! Tyrese Thompson is 6.7 feet away. [ZONE] DESMOND SIMMONS MAKES IT!
Score: 42-50

[01:10] Team_008 possession (Score: 42-50)
Tyrese Thompson attempts a Midrange. Contested by Ben Ball (5.9 feet, MAN). TYRESE THOMPSON MAKES IT! Assist: Jrue Harris
Score: 44-50

[00:57] Team_067 possession (Score: 44-50)
Manu Reaves attempts a Layup. Wide open! Tyrese Thompson is 6.8 feet away. [ZONE] MANU REAVES MAKES IT! Assist: Desmond Simmons
Score: 44-52

[00:42] Team_008 possession (Score: 44-52)
Jrue Harris attempts a 3Pt. Contested by Desmond Simmons (5.5 feet, ZONE). Jrue Harris misses. Offensive rebound by Tyrese Thompson! Tyrese Thompson kicks it out.

[00:30] Team_008 possession (Score: 44-52)
FOUL! Reach-in foul on Ben Ball during the drive. [IN THE BONUS! 5 team fouls] Tyrese Thompson to the line for 2 free throws. (Ben Ball: 4 personal fouls)   FT 1/2: GOOD   FT 2/2: GOOD Tyrese Thompson makes 2/2 from the line.
Score: 46-52

[00:14] Team_067 possession (Score: 46-52)
Manu Reaves drives, Tyrese Thompson stays with him. Manu Reaves attempts a Layup. Wide open! Tyrese Thompson is 6.9 feet away. [ZONE] MANU REAVES MAKES IT! Assist: Wendell Antetokounmpo
Score: 46-54

================================================================================
                              2ND QUARTER COMPLETE                              
================================================================================

2ND QUARTER SCORE: Team_008 18, Team_067 26

BOX SCORE:
================================================================================

Team_008
--------------------------------------------------------------------------------
Player                MIN  PTS  REB  AST  TO      FG   FG%      3P   3P%
--------------------------------------------------------------------------------
Tyrese Thompson        24    8    3    1   0   4/9    44.4     0/0   0.0
Jrue Harris            24    5    0    2   0   2/3    66.7     0/0   0.0
Khris Hyland           24    2    5    1   0   1/4    25.0     0/0   0.0
Magic Young            24    2    3    0   0   1/1   100.0     0/0   0.0

TEAM: FG: 8/17 (47.1%), 3PT: 0/7 (0.0%), REB: 10 (4 off, 6 def), AST: 4, TO: 3
TEAM FOULS: 4


Team_067
--------------------------------------------------------------------------------
Player                MIN  PTS  REB  AST  TO      FG   FG%      3P   3P%
--------------------------------------------------------------------------------
Malcolm Westbrook      24    8    3    0   0   4/4   100.0     0/0   0.0
Desmond Simmons        24    7    7    4   0   3/4    75.0     0/0   0.0
Manu Reaves            24    6    1    1   0   3/5    60.0     0/0   0.0
Wendell Antetokounmpo   24    3    0    3   0   1/2    50.0     0/0   0.0
Ben Ball               24    2    2    0   0   1/4    25.0     0/0   0.0

TEAM: FG: 12/19 (63.2%), 3PT: 3/5 (60.0%), REB: 14 (5 off, 9 def), AST: 8, TO: 1
TEAM FOULS: 5 [Team_008 in BONUS]

================================================================================

================================================================================
                       3RD QUARTER - Team_008 vs Team_067                       
================================================================================

[12:00] Team_008 possession (Score: 46-54)
Jrue Harris drives and kicks out. Tyrese Thompson attempts a 3Pt. Contested by Ben Ball (3.8 feet, MAN). TYRESE THOMPSON MAKES IT! Assist: Khris Hyland
Score: 49-54

[11:43] Team_067 possession (Score: 49-54)
Desmond Simmons drives and kicks out. Malcolm Westbrook attempts a Midrange. Contested by Magic Young (4.9 feet, MAN). Malcolm Westbrook misses. Rebound secured by Magic Young.

[11:28] Team_008 possession (Score: 49-54)
Tyrese Thompson attempts a Midrange. Contested by Ben Ball (4.0 feet, MAN). TYRESE THOMPSON MAKES IT! Assist: Jrue Harris
Score: 51-54

[11:14] Team_067 possession (Score: 51-54)
Ben Ball attempts a Midrange. Contested by Tyrese Thompson (5.3 feet, MAN). BEN BALL MAKES IT! Assist: Malcolm Westbrook
Score: 51-56

[10:59] Team_008 possession (Score: 51-56)
Khris Hyland attempts a 3Pt. Contested by Wendell Antetokounmpo (4.5 feet, ZONE). Khris Hyland misses. Rebound secured by Desmond Simmons.

[10:42] Team_067 possession (Score: 51-56)
Desmond Simmons attempts a 3Pt. Contested by Khris Hyland (4.2 feet, MAN). Desmond Simmons misses. Rebound secured by Khris Hyland.

[10:29] Team_008 possession (Score: 51-56)
Tyrese Thompson drives and kicks out. Jrue Harris attempts a 3Pt. Contested by Desmond Simmons (3.8 feet, ZONE). Jrue Harris misses. Rebound secured by Malcolm Westbrook.

[10:12] Team_067 possession (Score: 51-56)
Desmond Simmons makes the Layup and draws the foul on Tyrese Thompson! And-1! Desmond Simmons to the line for 1. [Team fouls: 1] (Tyrese Thompson: 1 personal fouls)   FT 1/1: GOOD Desmond Simmons makes 1/1 from the line.
Score: 51-59

[09:57] Team_008 possession (Score: 51-59)
FOUL! Shooting foul on Ben Ball. Tyrese Thompson to the line for 2 free throws. [Team fouls: 1] (Ben Ball: 1 personal fouls)   FT 1/2: GOOD   FT 2/2: GOOD Tyrese Thompson makes 2/2 from the line.
Score: 53-59

[09:39] Team_067 possession (Score: 53-59)
Desmond Simmons drives, Tyrese Thompson stays with him. Desmond Simmons attempts a Dunk. Contested by Tyrese Thompson (4.6 feet, ZONE). Desmond Simmons misses. Rebound secured by Magic Young.

[09:19] Team_008 possession (Score: 53-59)
FOUL! Holding foul on Malcolm Westbrook. [Team fouls: 2] No free throws, side out. (Malcolm Westbrook: 1 personal fouls)

[09:07] Team_008 possession (Score: 53-59)
Tyrese Thompson attempts a Midrange. Contested by Ben Ball (4.0 feet, MAN). Tyrese Thompson misses. Offensive rebound by Magic Young! Magic Young's putback is no good. Rebound secured by Wendell Antetokounmpo.

[08:57] Team_067 possession (Score: 53-59)
Ben Ball drives and kicks out. FOUL! Shooting foul on Magic Young. Malcolm Westbrook to the line for 3 free throws. [Team fouls: 2] (Magic Young: 1 personal fouls)   FT 1/3: GOOD   FT 2/3: GOOD   FT 3/3: MISS Malcolm Westbrook makes 2/3 from the line. Offensive rebound by Malcolm Westbrook! Malcolm Westbrook puts it back in!
Score: 53-63

[08:43] Team_008 possession (Score: 53-63)
Jrue Harris attempts a 3Pt. Contested by Wendell Antetokounmpo (4.5 feet, MAN). Jrue Harris misses. Offensive rebound by Tyrese Thompson! Tyrese Thompson kicks it out.

[08:28] Team_008 possession (Score: 53-63)
Jrue Harris attempts a Layup. Contested by Wendell Antetokounmpo (4.5 feet, MAN). JRUE HARRIS MAKES IT!
Score: 55-63

[08:11] Team_067 possession (Score: 55-63)
FOUL! Offensive foul on Wendell Antetokounmpo! Jrue Harris drew the charge! [Team fouls: 3] (Wendell Antetokounmpo: 1 personal fouls) TURNOVER! (dead ball)

[07:59] Team_008 possession (Score: 55-63)
Khris Hyland attempts a Midrange. Contested by Desmond Simmons (3.9 feet, MAN). KHRIS HYLAND MAKES IT! Assist: Victor Leonard
Score: 57-63

[07:46] Team_067 possession (Score: 57-63)
Wendell Antetokounmpo drives and kicks out. FOUL! Shooting foul on Victor Leonard. Desmond Simmons to the line for 3 free throws. [Team fouls: 3] (Victor Leonard: 1 personal fouls)   FT 1/3: GOOD   FT 2/3: GOOD   FT 3/3: GOOD Desmond Simmons makes 3/3 from the line.
Score: 57-66

[07:34] Team_008 possession (Score: 57-66)
Khris Hyland attempts a Layup. BLOCKED BY WENDELL ANTETOKOUNMPO! Ball is loose! Rebound secured by Wendell Antetokounmpo.

[07:24] Team_067 possession (Score: 57-66)
Ben Ball attempts a Midrange. Contested by Khris Hyland (4.9 feet, ZONE). Ben Ball misses. Offensive rebound by Malcolm Westbrook! Malcolm Westbrook puts it back in!
Score: 57-68

[07:06] Team_008 possession (Score: 57-68)
FOUL! Holding foul on Manu Reaves. [Team fouls: 4] No free throws, side out. (Manu Reaves: 1 personal fouls)

[06:56] Team_008 possession (Score: 57-68)
Tyrese Thompson drives, picks up Ben Ball. Help arrives from Wendell Antetokounmpo! Tyrese Thompson attempts a Dunk. Contested by Wendell Antetokounmpo (4.0 feet, ZONE). TYRESE THOMPSON MAKES IT! Assist: Victor Leonard
Score: 59-68

[06:45] Team_067 possession (Score: 59-68)
Desmond Simmons attempts a 3Pt. Contested by Khris Hyland (4.2 feet, MAN). DESMOND SIMMONS MAKES IT! Assist: Manu Reaves
Score: 59-71

[06:32] Team_008 possession (Score: 59-71)
Victor Leonard attempts a 3Pt. Contested by Manu Reaves (4.2 feet, MAN). Victor Leonard misses. Offensive rebound by Tyrese Thompson! Tyrese Thompson kicks it out.

[06:17] Team_008 possession (Score: 59-71)
Victor Leonard attempts a 3Pt. Contested by Manu Reaves (4.2 feet, MAN). Victor Leonard misses. Rebound secured by Malcolm Westbrook.

[06:03] Team_067 possession (Score: 59-71)
Desmond Simmons attempts a Midrange. Contested by Jrue Harris (4.5 feet, ZONE). DESMOND SIMMONS MAKES IT! Assist: Ben Ball
Score: 59-73

[05:48] Team_008 possession (Score: 59-73)
Victor Leonard attempts a Midrange. Contested by Desmond Simmons (4.1 feet, ZONE). Victor Leonard misses. Rebound secured by Malcolm Westbrook.

[05:32] Team_067 possession (Score: 59-73)
Ben Ball attempts a Midrange. Contested by Khris Hyland (4.9 feet, ZONE). Ben Ball misses. Rebound secured by Khris Hyland.

[05:14] Team_008 possession (Score: 59-73)
Tyrese Thompson drives to the basket... Tyrese Thompson loses control! Ball rolls out of bounds! TURNOVER! (dead ball)

[05:02] Team_067 possession (Score: 59-73)
Manu Reaves attempts a 3Pt. Contested by Victor Leonard (5.4 feet, MAN). Manu Reaves misses. Rebound secured by Khris Hyland.

[04:49] Team_008 possession (Score: 59-73)
FOUL! Reach-in foul on Wendell Antetokounmpo during the drive. [IN THE BONUS! 5 team fouls] Jrue Harris to the line for 2 free throws. (Wendell Antetokounmpo: 2 personal fouls)   FT 1/2: GOOD   FT 2/2: GOOD Jrue Harris makes 2/2 from the line.
Score: 61-73

[04:36] Team_067 possession (Score: 61-73)
Wendell Antetokounmpo attempts a 3Pt. Contested by Jrue Harris (4.7 feet, MAN). Wendell Antetokounmpo misses. FOUL! Loose ball foul on Tyrese Thompson during the rebound battle. [Team fouls: 4] No free throws, side out. (Tyrese Thompson: 2 personal fouls)

[04:26] Team_067 possession (Score: 61-73)
Malcolm Westbrook attempts a 3Pt. Contested by Victor Leonard (5.4 feet, ZONE). Malcolm Westbrook misses. Rebound secured by Magic Young.

[04:15] Team_008 possession (Score: 61-73)
Tyrese Thompson attempts a Midrange. Contested by Ben Ball (4.1 feet, MAN). Tyrese Thompson misses. Rebound secured by Wendell Antetokounmpo.

[04:03] Team_067 possession (Score: 61-73)
Malcolm Westbrook drives to the basket... Malcolm Westbrook throws a bad pass! Stolen by Magic Young! TURNOVER! (live ball)

[03:48] Team_008 possession (Score: 61-73)
Victor Leonard attempts a 3Pt. Contested by Manu Reaves (4.4 feet, ZONE). VICTOR LEONARD MAKES IT! Assist: Jrue Harris
Score: 64-73

[03:30] Team_067 possession (Score: 64-73)
Ben Ball drives, picks up Tyrese Thompson. Help arrives from Jrue Harris! Ben Ball attempts a Dunk. Contested by Jrue Harris (5.5 feet, ZONE). BEN BALL MAKES IT!
Score: 64-75

[03:15] Team_008 possession (Score: 64-75)
Jrue Harris loses the ball! Stripped by Wendell Antetokounmpo! TURNOVER! (live ball)

[02:59] Team_067 possession (Score: 64-75)
Wendell Antetokounmpo attempts a Midrange. Contested by Jrue Harris (4.8 feet, MAN). Wendell Antetokounmpo misses. Rebound secured by Magic Young.

[02:41] Team_008 possession (Score: 64-75)
FOUL! Shooting foul on Manu Reaves. Khris Hyland to the line for 3 free throws. [BONUS: 6 team fouls] (Manu Reaves: 2 personal fouls)   FT 1/3: GOOD   FT 2/3: GOOD   FT 3/3: GOOD Khris Hyland makes 3/3 from the line.
Score: 67-75

[02:28] Team_067 possession (Score: 67-75)
Desmond Simmons makes the Layup and draws the foul on Khris Hyland! And-1! Desmond Simmons to the line for 1. [BONUS: 5 team fouls] (Khris Hyland: 1 personal fouls)   FT 1/1: GOOD Desmond Simmons makes 1/1 from the line.
Score: 67-78

[02:11] Team_008 possession (Score: 67-78)
Victor Leonard attempts a Layup. Contested by Manu Reaves (4.5 feet, MAN). VICTOR LEONARD MAKES IT!
Score: 69-78

[01:59] Team_067 possession (Score: 69-78)
Malcolm Westbrook drives to the basket... Malcolm Westbrook commits a violation (traveling/carry)! TURNOVER! (dead ball)

[01:59] Substitution (Team_008): Victor Leonard OUT → Blake Holiday IN (stamina_rule2)

[01:59] Substitution (Team_008): Jrue Harris OUT → Chris Griffin IN (stamina_rule2)

[01:59] Substitution (Team_008): Khris Hyland OUT → Immanuel Young IN (stamina_rule2)

[01:59] Substitution (Team_008): Tyrese Thompson OUT → Khris Giddey IN (stamina_rule2)

[01:59] Substitution (Team_008): Magic Young OUT → Lamelo Middleton IN (stamina_rule2)

[01:59] Substitution (Team_067): Manu Reaves OUT → James Rozier IN (stamina_rule2)

[01:59] Substitution (Team_067): Wendell Antetokounmpo OUT → Anfernee Wagner IN (stamina_rule2)

[01:59] Substitution (Team_067): Ben Ball OUT → Kristaps Davis IN (stamina_rule2)

[01:59] Substitution (Team_067): Malcolm Westbrook OUT → Zach DeRozan IN (stamina_rule2)

[01:48] Team_008 possession (Score: 69-78)
Chris Griffin drives to the basket... Chris Griffin throws a bad pass! Stolen by Kristaps Davis! TURNOVER! (live ball)

[01:29] Team_067 possession (Score: 69-78)
Kristaps Davis attempts a 3Pt. Contested by Khris Giddey (5.0 feet, ZONE). KRISTAPS DAVIS MAKES IT! Assist: Desmond Simmons
Score: 69-81

[01:14] Team_008 possession (Score: 69-81)
Chris Griffin drives to the basket... Chris Griffin throws a bad pass! Stolen by Kristaps Davis! TURNOVER! (live ball)

[00:58] Team_067 possession (Score: 69-81)
Desmond Simmons drives, Immanuel Young stays with him. Desmond Simmons attempts a Layup. Contested by Immanuel Young (4.5 feet, MAN). DESMOND SIMMONS MAKES IT! Assist: Kristaps Davis
Score: 69-83

[00:42] Team_008 possession (Score: 69-83)
FOUL! Shooting foul on Anfernee Wagner. Khris Giddey to the line for 2 free throws. [BONUS: 7 team fouls] (Anfernee Wagner: 1 personal fouls)   FT 1/2: GOOD   FT 2/2: GOOD Khris Giddey makes 2/2 from the line.
Score: 71-83

[00:33] Team_067 possession (Score: 71-83)
James Rozier attempts a 3Pt. Contested by Khris Giddey (4.3 feet, ZONE). James Rozier misses. Offensive rebound by Kristaps Davis! Kristaps Davis's putback is no good. Rebound secured by Chris Griffin.

[00:17] Team_008 possession (Score: 71-83)
FOUL! Holding foul on Desmond Simmons. [IN THE BONUS! 8 team fouls] Immanuel Young to the line for 2 free throws. (Desmond Simmons: 1 personal fouls)   FT 1/2: GOOD   FT 2/2: GOOD Immanuel Young makes 2/2 from the line.
Score: 73-83

================================================================================
                              3RD QUARTER COMPLETE                              
================================================================================

3RD QUARTER SCORE: Team_008 27, Team_067 29

BOX SCORE:
================================================================================

Team_008
--------------------------------------------------------------------------------
Player                MIN  PTS  REB  AST  TO      FG   FG%      3P   3P%
--------------------------------------------------------------------------------
Tyrese Thompson        34    9    2    0   0   4/7    57.1     0/0   0.0
Khris Hyland           34    5    3    1   0   2/4    50.0     0/0   0.0
Victor Leonard         34    5    0    2   0   2/4    50.0     0/0   0.0
Jrue Harris            34    4    0    2   0   2/2   100.0     0/0   0.0
Khris Giddey            2    2    0    0   0   1/1   100.0     0/0   0.0
Immanuel Young          2    2    0    0   0   1/1   100.0     0/0   0.0
Magic Young            34    0    4    0   0   0/0     0.0     0/0   0.0

TEAM: FG: 12/19 (63.2%), 3PT: 2/4 (50.0%), REB: 10 (3 off, 7 def), AST: 5, TO: 4
TEAM FOULS: 5 [Team_067 in BONUS]


Team_067
--------------------------------------------------------------------------------
Player                MIN  PTS  REB  AST  TO      FG   FG%      3P   3P%
--------------------------------------------------------------------------------
Desmond Simmons        36   16    2    1   0   6/9    66.7     0/0   0.0
Malcolm Westbrook      34    6    4    1   0   2/3    66.7     0/0   0.0
Ben Ball               34    4    0    1   0   2/3    66.7     0/0   0.0
Kristaps Davis          2    3    0    1   0   1/1   100.0     0/0   0.0
Wendell Antetokounmpo   34    0    3    0   0   0/1     0.0     0/0   0.0
Manu Reaves            34    0    0    1   0   0/1     0.0     0/0   0.0
James Rozier            2    0    0    0   0   0/1     0.0     0/0   0.0
Chris Griffin           2    0    1    0   0   0/0     0.0     0/0   0.0

TEAM: FG: 11/19 (57.9%), 3PT: 2/6 (33.3%), REB: 9 (3 off, 6 def), AST: 5, TO: 3
TEAM FOULS: 8 [Team_008 in BONUS]

================================================================================

================================================================================
                       4TH QUARTER - Team_008 vs Team_067                       
================================================================================

[12:00] Substitution (Team_008): Victor Leonard OUT (stamina: 76) → Blake Holiday IN (comeback_detected)

[12:00] Substitution (Team_067): Manu Reaves OUT (stamina: 76) → James Rozier IN (comeback_detected)

[12:00] Team_008 possession (Score: 73-83)
Blake Holiday attempts a 3Pt. Contested by Desmond Simmons (4.2 feet, ZONE). BLAKE HOLIDAY MAKES IT! Assist: Khris Hyland
Score: 76-83

[11:51] Team_067 possession (Score: 76-83)
Wendell Antetokounmpo drives, Jrue Harris stays with him. Wendell Antetokounmpo attempts a Dunk. Contested by Jrue Harris (4.7 feet, MAN). WENDELL ANTETOKOUNMPO MAKES IT!
Score: 76-85

[11:37] Team_008 possession (Score: 76-85)
Tyrese Thompson attempts a Midrange. Contested by Ben Ball (4.1 feet, MAN). Tyrese Thompson misses. Offensive rebound by Tyrese Thompson! Tyrese Thompson kicks it out.

[11:22] Team_008 possession (Score: 76-85)
Tyrese Thompson attempts a Midrange. Contested by Ben Ball (4.1 feet, ZONE). Tyrese Thompson misses. Rebound secured by James Rozier.

[11:08] Team_067 possession (Score: 76-85)
Ben Ball drives and kicks out. Desmond Simmons attempts a Midrange. Contested by Khris Hyland (4.2 feet, MAN). DESMOND SIMMONS MAKES IT!
Score: 76-87

[10:53] Team_008 possession (Score: 76-87)
Magic Young attempts a Layup. Contested by Malcolm Westbrook (4.5 feet, MAN). MAGIC YOUNG MAKES IT! Assist: Jrue Harris
Score: 78-87

[10:39] Team_067 possession (Score: 78-87)
James Rozier drives to the basket... James Rozier loses the ball! Stripped by Blake Holiday! TURNOVER! (live ball)

[10:21] Team_008 possession (Score: 78-87)
Jrue Harris makes the Midrange and draws the foul on Wendell Antetokounmpo! And-1! Jrue Harris to the line for 1. [Team fouls: 1] (Wendell Antetokounmpo: 1 personal fouls)   FT 1/1: GOOD Jrue Harris makes 1/1 from the line.
Score: 81-87

[10:07] Team_067 possession (Score: 81-87)
James Rozier attempts a 3Pt. Contested by Blake Holiday (5.4 feet, ZONE). James Rozier misses. Offensive rebound by Malcolm Westbrook! Malcolm Westbrook's putback is no good. Offensive rebound by Malcolm Westbrook! Malcolm Westbrook kicks it out.

[09:55] Team_067 possession (Score: 81-87)
Wendell Antetokounmpo attempts a Layup. Contested by Tyrese Thompson (5.1 feet, ZONE). WENDELL ANTETOKOUNMPO MAKES IT! Assist: Malcolm Westbrook
Score: 81-89

[09:37] Team_008 possession (Score: 81-89)
Blake Holiday attempts a Midrange. Contested by James Rozier (4.2 feet, MAN). BLAKE HOLIDAY MAKES IT!
Score: 83-89

[09:24] Team_067 possession (Score: 83-89)
James Rozier attempts a 3Pt. Contested by Blake Holiday (5.4 feet, ZONE). James Rozier misses. Rebound secured by Magic Young.

[09:06] Team_008 possession (Score: 83-89)
FOUL! Holding foul on Ben Ball. [Team fouls: 2] No free throws, side out. (Ben Ball: 1 personal fouls)

[08:55] Team_008 possession (Score: 83-89)
Khris Hyland drives to the basket... FOUL! Offensive foul on Khris Hyland! Desmond Simmons drew the charge! [Team fouls: 1] (Khris Hyland: 1 personal fouls) TURNOVER! (dead ball)

[08:41] Team_067 possession (Score: 83-89)
Wendell Antetokounmpo attempts a 3Pt. Contested by Jrue Harris (4.9 feet, MAN). Wendell Antetokounmpo misses. Offensive rebound by James Rozier! James Rozier kicks it out.

[08:30] Team_067 possession (Score: 83-89)
James Rozier attempts a 3Pt. Contested by Blake Holiday (5.4 feet, ZONE). James Rozier misses. Rebound secured by Khris Hyland.

[08:17] Team_008 possession (Score: 83-89)
FOUL! Shooting foul on James Rozier. Tyrese Thompson to the line for 2 free throws. [Team fouls: 3] (James Rozier: 1 personal fouls)   FT 1/2: MISS   FT 2/2: GOOD Tyrese Thompson makes 1/2 from the line.
Score: 84-89

[07:59] Team_067 possession (Score: 84-89)
Malcolm Westbrook drives and kicks out. James Rozier attempts a Midrange. Contested by Blake Holiday (5.4 feet, ZONE). James Rozier misses. Offensive rebound by James Rozier! James Rozier kicks it out.

[07:45] Team_067 possession (Score: 84-89)
Wendell Antetokounmpo makes the Midrange and draws the foul on Jrue Harris! And-1! Wendell Antetokounmpo to the line for 1. [Team fouls: 2] (Jrue Harris: 1 personal fouls)   FT 1/1: GOOD Wendell Antetokounmpo makes 1/1 from the line.
Score: 84-92

[07:31] Team_008 possession (Score: 84-92)
FOUL! Holding foul on Desmond Simmons. [Team fouls: 4] No free throws, side out. (Desmond Simmons: 1 personal fouls)

[07:16] Team_008 possession (Score: 84-92)
Khris Hyland attempts a Midrange. Contested by Wendell Antetokounmpo (5.2 feet, ZONE). Khris Hyland misses. Rebound secured by Malcolm Westbrook.

[07:04] Team_067 possession (Score: 84-92)
FOUL! Holding foul on Jrue Harris. [Team fouls: 3] No free throws, side out. (Jrue Harris: 2 personal fouls)

[06:48] Team_067 possession (Score: 84-92)
Malcolm Westbrook attempts a Midrange. Contested by Tyrese Thompson (5.5 feet, ZONE). Malcolm Westbrook misses. Rebound secured by Khris Hyland.

[06:32] Team_008 possession (Score: 84-92)
Khris Hyland attempts a 3Pt. Contested by James Rozier (4.1 feet, ZONE). Khris Hyland misses. Offensive rebound by Magic Young! Magic Young kicks it out.

[06:15] Team_008 possession (Score: 84-92)
Magic Young attempts a Layup. Contested by Malcolm Westbrook (5.0 feet, ZONE). MAGIC YOUNG MAKES IT!
Score: 86-92

[05:57] Team_067 possession (Score: 86-92)
Ben Ball drives, Tyrese Thompson stays with him. Ben Ball attempts a Layup. Wide open! Tyrese Thompson is 6.0 feet away. [MAN] Ben Ball misses. Rebound secured by Magic Young.

[05:44] Team_008 possession (Score: 86-92)
Magic Young drives to the basket... FOUL! Offensive foul on Magic Young! Malcolm Westbrook drew the charge! [Team fouls: 4] (Magic Young: 1 personal fouls) TURNOVER! (dead ball)

[05:28] Team_067 possession (Score: 86-92)
Ben Ball drives and kicks out. Wendell Antetokounmpo attempts a 3Pt. Contested by Jrue Harris (5.1 feet, MAN). Wendell Antetokounmpo misses. Rebound secured by Tyrese Thompson.

[05:10] Team_008 possession (Score: 86-92)
FOUL! Shooting foul on Ben Ball. Tyrese Thompson to the line for 2 free throws. [BONUS: 5 team fouls] (Ben Ball: 2 personal fouls)   FT 1/2: GOOD   FT 2/2: GOOD Tyrese Thompson makes 2/2 from the line.
Score: 88-92

[05:00] Team_067 possession (Score: 88-92)
Malcolm Westbrook attempts a Layup. Wide open! Magic Young is 6.1 feet away. [MAN] MALCOLM WESTBROOK MAKES IT!
Score: 88-94

[04:44] Team_008 possession (Score: 88-94)
Khris Hyland drives, picks up Desmond Simmons. Help arrives from James Rozier! Khris Hyland attempts a Layup. Contested by James Rozier (4.9 feet, MAN). Khris Hyland misses. Offensive rebound by Magic Young! Magic Young kicks it out.

[04:27] Team_008 possession (Score: 88-94)
Jrue Harris drives and kicks out. Magic Young attempts a 3Pt. Contested by Malcolm Westbrook (5.1 feet, MAN). Magic Young misses. Rebound secured by Malcolm Westbrook.

[04:11] Team_067 possession (Score: 88-94)
Wendell Antetokounmpo attempts a Layup. Contested by Jrue Harris (5.4 feet, MAN). WENDELL ANTETOKOUNMPO MAKES IT!
Score: 88-96

[03:58] Team_008 possession (Score: 88-96)
Tyrese Thompson attempts a 3Pt. Contested by James Rozier (4.3 feet, ZONE). Tyrese Thompson misses. Offensive rebound by Tyrese Thompson! Tyrese Thompson kicks it out.

[03:45] Team_008 possession (Score: 88-96)
FOUL! Shooting foul on James Rozier. Blake Holiday to the line for 2 free throws. [BONUS: 6 team fouls] (James Rozier: 2 personal fouls)   FT 1/2: GOOD   FT 2/2: GOOD Blake Holiday makes 2/2 from the line.
Score: 90-96

[03:32] Team_067 possession (Score: 90-96)
Desmond Simmons drives, Khris Hyland stays with him. Desmond Simmons attempts a Layup. Contested by Khris Hyland (5.2 feet, MAN). DESMOND SIMMONS MAKES IT! Assist: Wendell Antetokounmpo
Score: 90-98

[03:14] Team_008 possession (Score: 90-98)
Blake Holiday drives to the basket... Blake Holiday throws a bad pass! Stolen by Malcolm Westbrook! TURNOVER! (live ball)

[02:59] Team_067 possession (Score: 90-98)
Malcolm Westbrook attempts a Layup. Contested by Tyrese Thompson (6.0 feet, ZONE). MALCOLM WESTBROOK MAKES IT! Assist: Desmond Simmons
Score: 90-100

[02:43] Team_008 possession (Score: 90-100)
Jrue Harris throws a bad pass out of bounds! TURNOVER! (dead ball)

[02:43] Substitution (Team_008): Jrue Harris OUT → Chris Griffin IN (stamina_rule2)

[02:43] Substitution (Team_008): Khris Hyland OUT → Immanuel Young IN (stamina_rule2)

[02:43] Substitution (Team_008): Tyrese Thompson OUT → Khris Giddey IN (stamina_rule2)

[02:43] Substitution (Team_008): Magic Young OUT → Lamelo Middleton IN (stamina_rule2)

[02:43] Substitution (Team_067): Wendell Antetokounmpo OUT → Anfernee Wagner IN (stamina_rule2)

[02:43] Substitution (Team_067): Desmond Simmons OUT → Kyle Leonard IN (stamina_rule2)

[02:43] Substitution (Team_067): Ben Ball OUT → Kristaps Davis IN (stamina_rule2)

[02:43] Substitution (Team_067): Malcolm Westbrook OUT → Zach DeRozan IN (stamina_rule2)

[02:28] Team_067 possession (Score: 90-100)
Anfernee Wagner drives to the basket... Anfernee Wagner loses control! Ball rolls out of bounds! TURNOVER! (dead ball)

[02:16] Team_008 possession (Score: 90-100)
Immanuel Young attempts a Midrange. Contested by Kyle Leonard (4.1 feet, ZONE). Immanuel Young misses. Offensive rebound by Lamelo Middleton! Lamelo Middleton's putback is no good. Rebound secured by Zach DeRozan.

[02:01] Team_067 possession (Score: 90-100)
FOUL! Reach-in foul on Lamelo Middleton during the drive. [IN THE BONUS! 5 team fouls] Anfernee Wagner to the line for 2 free throws. (Lamelo Middleton: 1 personal fouls)   FT 1/2: MISS   FT 2/2: GOOD Anfernee Wagner makes 1/2 from the line.
Score: 90-101

[01:43] Team_008 possession (Score: 90-101)
Khris Giddey drives to the basket... Khris Giddey commits a violation (traveling/carry)! TURNOVER! (dead ball)

[01:43] Substitution (Team_008): Blake Holiday OUT → Victor Leonard IN (starter_return_rule1)

[01:27] Team_067 possession (Score: 90-101)
Kyle Leonard attempts a 3Pt. Contested by Immanuel Young (4.7 feet, MAN). Kyle Leonard misses. Offensive rebound by Kristaps Davis! Kristaps Davis's putback is no good. Rebound secured by Khris Giddey.

[01:13] Team_008 possession (Score: 90-101)
Khris Giddey attempts a Midrange. Contested by Kristaps Davis (4.1 feet, MAN). Khris Giddey misses. Rebound secured by Anfernee Wagner.

[00:59] Team_067 possession (Score: 90-101)
Kristaps Davis attempts a Midrange. Contested by Chris Griffin (6.0 feet, ZONE). Kristaps Davis misses. Rebound secured by Khris Giddey.

[00:43] Team_008 possession (Score: 90-101)
Victor Leonard attempts a 3Pt. Contested by Anfernee Wagner (4.0 feet, ZONE). Victor Leonard misses. FOUL! Loose ball foul on Zach DeRozan during the rebound battle. [IN THE BONUS! 7 team fouls] Lamelo Middleton to the line for 2 free throws. (Zach DeRozan: 1 personal fouls)   FT 1/2: GOOD   FT 2/2: GOOD Lamelo Middleton makes 2/2 from the line.
Score: 92-101

[00:25] Team_067 possession (Score: 92-101)
FOUL! Reach-in foul on Lamelo Middleton during the drive. [IN THE BONUS! 6 team fouls] Zach DeRozan to the line for 2 free throws. (Lamelo Middleton: 2 personal fouls)   FT 1/2: GOOD   FT 2/2: GOOD Zach DeRozan makes 2/2 from the line.
Score: 92-103

[00:08] Team_008 possession (Score: 92-103)
FOUL! Shooting foul on Anfernee Wagner. Chris Griffin to the line for 2 free throws. [BONUS: 8 team fouls] (Anfernee Wagner: 1 personal fouls)   FT 1/2: GOOD   FT 2/2: GOOD Chris Griffin makes 2/2 from the line.
Score: 94-103

================================================================================
                              4TH QUARTER COMPLETE                              
================================================================================

4TH QUARTER SCORE: Team_008 21, Team_067 20

BOX SCORE:
================================================================================

Team_008
--------------------------------------------------------------------------------
Player                MIN  PTS  REB  AST  TO      FG   FG%      3P   3P%
--------------------------------------------------------------------------------
Blake Holiday          12    7    0    0   0   3/3   100.0     0/0   0.0
Magic Young            44    4    4    0   0   2/2   100.0     0/0   0.0
Tyrese Thompson        44    3    3    0   0   2/3    66.7     0/0   0.0
Jrue Harris            44    3    0    1   0   1/2    50.0     0/0   0.0
Lamelo Middleton        4    2    0    0   0   1/1   100.0     0/0   0.0
Chris Griffin           4    2    0    0   0   1/1   100.0     0/0   0.0
Khris Hyland           44    0    2    1   0   0/1     0.0     0/0   0.0
Immanuel Young          4    0    0    0   0   0/1     0.0     0/0   0.0
Khris Giddey            4    0    2    0   0   0/1     0.0     0/0   0.0

TEAM: FG: 10/15 (66.7%), 3PT: 2/2 (100.0%), REB: 11 (5 off, 6 def), AST: 2, TO: 5
TEAM FOULS: 6 [Team_067 in BONUS]


Team_067
--------------------------------------------------------------------------------
Player                MIN  PTS  REB  AST  TO      FG   FG%      3P   3P%
--------------------------------------------------------------------------------
Wendell Antetokounmpo   44    9    0    1   0   4/4   100.0     0/0   0.0
Desmond Simmons        46    4    0    1   0   2/2   100.0     0/0   0.0
Malcolm Westbrook      44    4    3    1   0   2/3    66.7     0/0   0.0
Zach DeRozan            4    2    1    0   0   1/1   100.0     0/0   0.0
Anfernee Wagner         4    1    1    0   0   1/1   100.0     0/0   0.0
James Rozier           14    0    3    0   0   0/2     0.0     0/0   0.0
Ben Ball               44    0    0    0   0   0/2     0.0     0/0   0.0
Kyle Leonard            3    0    0    0   0   0/1     0.0     0/0   0.0
Kristaps Davis          4    0    0    0   0   0/1     0.0     0/0   0.0

TEAM: FG: 10/17 (58.8%), 3PT: 0/3 (0.0%), REB: 8 (4 off, 4 def), AST: 3, TO: 2
TEAM FOULS: 8 [Team_008 in BONUS]

================================================================================

================================================================================
                               FULL GAME COMPLETE                               
================================================================================

FINAL SCORE: Team_008 94, Team_067 103

SCORING BY QUARTER:
--------------------------------------------------------------------------------
Team                     Q1     Q2     Q3     Q4    FINAL
--------------------------------------------------------------------------------
Team_008                 28     18     27     21       94
Team_067                 28     26     29     20      103
--------------------------------------------------------------------------------

FULL GAME BOX SCORE:
================================================================================

Team_008
--------------------------------------------------------------------------------
Player                MIN  PTS  REB  AST  TO      FG   FG%      3P   3P%      FT STL BLK
--------------------------------------------------------------------------------
Jrue Harris            44   14    0    9   6   6/8    75.0   0/0     0.0   6/6     1   0
Khris Hyland           44   15   13    5   2   7/17   41.2   3/10   30.0   3/3     1   0
Tyrese Thompson        44   22   12    1   1  10/19   52.6   0/4     0.0   8/10    0   0
Magic Young            44   14   15    1   3   7/9    77.8   0/1     0.0   2/2     1   0
Victor Leonard         36   11    0    3   0   5/9    55.6   4/5    80.0   0/1     1   1
Blake Holiday          12    7    0    0   0   3/3   100.0   1/1   100.0   2/2     1   0
Chris Griffin           4    2    1    0   0   1/1   100.0   0/0     0.0   2/2     0   0
Immanuel Young          4    2    0    0   1   0/1     0.0   0/0     0.0   2/2     0   0
Khris Giddey            4    2    2    0   0   1/2    50.0   0/0     0.0   2/2     0   0
Lamelo Middleton        4    2    0    0   2   0/0     0.0   0/0     0.0   2/2     0   0

TEAM: FG: 41/70 (58.6%), 3PT: 8/21 (38.1%), REB: 42 (15 off, 27 def), AST: 19, TO: 15


Team_067
--------------------------------------------------------------------------------
Player                MIN  PTS  REB  AST  TO      FG   FG%      3P   3P%      FT STL BLK
--------------------------------------------------------------------------------
Desmond Simmons        46   31   12    7   1  12/17   70.6   3/6    50.0   5/5     1   0
Wendell Antetokounmpo   44   14    5    4   3   6/10   60.0   1/2    50.0   1/1     3   1
Ben Ball               44   11    2    1   0   9/15   60.0   2/2   100.0   2/2     0   0
Malcolm Westbrook      44   29   15    5   2  10/15   66.7   0/2     0.0   4/6     3   2
Manu Reaves            34   11    2    3   1   5/10   50.0   0/3     0.0   1/1     0   0
James Rozier           14    0    3    0   0   0/3     0.0   0/3     0.0   0/0     0   0
Anfernee Wagner         4    1    1    0   1   1/1   100.0   0/0     0.0   1/2     0   0
Kristaps Davis          4    3    0    1   0   1/2    50.0   1/1   100.0   0/0     2   0
Zach DeRozan            4    2    1    0   0   1/1   100.0   0/0     0.0   2/2     0   0
Kyle Leonard            3    0    0    0   0   0/1     0.0   0/1     0.0   0/0     0   0

TEAM: FG: 45/75 (60.0%), 3PT: 7/20 (35.0%), REB: 41 (15 off, 26 def), AST: 21, TO: 8

================================================================================
