================================================================================
                        FULL GAME - Team_063 vs Team_002                        
================================================================================

================================================================================
                       1ST QUARTER - Team_063 vs Team_002                       
================================================================================

[12:00] Team_063 possession (Score: 0-0)
Terry Reaves attempts a 3Pt. Contested by Miles Bane (4.6 feet, ZONE). Terry Reaves misses. Rebound secured by Miles Bane.

[11:47] Team_002 possession (Score: 0-0)
Miles Bane attempts a 3Pt. Contested by Bradley Davis (4.8 feet, MAN). Miles Bane misses. Rebound secured by Malcolm Quickley.

[11:29] Team_063 possession (Score: 0-0)
Bradley Davis loses control! Ball rolls out of bounds! TURNOVER! (dead ball)

[11:17] Team_002 possession (Score: 0-0)
FOUL! Shooting foul on Bradley Davis. Jordan Green to the line for 2 free throws. [Team fouls: 1] (Bradley Davis: 1 personal fouls)   FT 1/2: GOOD   FT 2/2: MISS Jordan Green makes 1/2 from the line. Rebound secured by Malcolm Quickley.
Score: 0-1

[11:01] Team_063 possession (Score: 0-1)
Tyler Harris drives, Tyler Porzingis stays with him. Tyler Harris attempts a Dunk. Contested by Tyler Porzingis (3.0 feet, ZONE). TYLER HARRIS MAKES IT!
Score: 2-1

[10:43] Team_002 possession (Score: 2-1)
CJ Barrett attempts a 3Pt. Contested by Malcolm Quickley (3.9 feet, MAN). CJ Barrett misses. Rebound secured by Dirk Reaves.

[10:26] Team_063 possession (Score: 2-1)
Malcolm Quickley throws a bad pass! Stolen by CJ Barrett! TURNOVER! (live ball)

[10:14] Team_002 possession (Score: 2-1)
Miles Bane makes the Layup and draws the foul on Bradley Davis! And-1! Miles Bane to the line for 1. [Team fouls: 2] (Bradley Davis: 2 personal fouls)   FT 1/1: GOOD Miles Bane makes 1/1 from the line.
Score: 2-4

[10:00] Team_063 possession (Score: 2-4)
Tyler Harris attempts a Midrange. Contested by Tyler Porzingis (3.0 feet, MAN). Tyler Harris misses. Rebound secured by Tyler Porzingis.

[09:48] Team_002 possession (Score: 2-4)
CJ Barrett attempts a 3Pt. Contested by Malcolm Quickley (3.9 feet, ZONE). CJ Barrett misses. Offensive rebound by Carmelo Lowry! Carmelo Lowry kicks it out.

[09:34] Team_002 possession (Score: 2-4)
Carmelo Lowry drives and kicks out. Miles Bane attempts a 3Pt. Contested by Malcolm Quickley (3.5 feet, ZONE). Miles Bane misses. Rebound secured by Malcolm Quickley.

[09:19] Team_063 possession (Score: 2-4)
Dirk Reaves attempts a 3Pt. Contested by Carmelo Lowry (4.0 feet, ZONE). Dirk Reaves misses. Offensive rebound by Tyler Harris! Tyler Harris puts it back in!
Score: 4-4

[09:02] Team_002 possession (Score: 4-4)
Jordan Green attempts a 3Pt. Contested by Malcolm Quickley (4.3 feet, ZONE). Jordan Green misses. Offensive rebound by Tyler Porzingis! Tyler Porzingis puts it back in!
Score: 4-6

[08:50] Team_063 possession (Score: 4-6)
Dirk Reaves drives, Carmelo Lowry stays with him. Dirk Reaves attempts a Dunk. Contested by Carmelo Lowry (4.0 feet, MAN). Dirk Reaves misses. Rebound secured by Miles Bane.

[08:34] Team_002 possession (Score: 4-6)
CJ Barrett makes the 3Pt and draws the foul on Malcolm Quickley! And-1! CJ Barrett to the line for 1. [Team fouls: 3] (Malcolm Quickley: 1 personal fouls)   FT 1/1: MISS CJ Barrett makes 0/1 from the line. Rebound secured by Tyler Harris.
Score: 4-9

[08:20] Team_063 possession (Score: 4-9)
Malcolm Quickley attempts a Layup. Contested by CJ Barrett (3.7 feet, MAN). MALCOLM QUICKLEY MAKES IT! Assist: Tyler Harris
Score: 6-9

[08:05] Team_002 possession (Score: 6-9)
FOUL! Offensive foul on Miles Bane! Bradley Davis drew the charge! [Team fouls: 1] (Miles Bane: 1 personal fouls) TURNOVER! (dead ball)

[07:49] Team_063 possession (Score: 6-9)
FOUL! Shooting foul on Jordan Green. Terry Reaves to the line for 3 free throws. [Team fouls: 2] (Jordan Green: 1 personal fouls)   FT 1/3: GOOD   FT 2/3: GOOD   FT 3/3: MISS Terry Reaves makes 2/3 from the line. Offensive rebound by Dirk Reaves! Dirk Reaves puts it back in!
Score: 10-9

[07:39] Team_002 possession (Score: 10-9)
Tyler Porzingis attempts a Layup. Contested by Tyler Harris (4.6 feet, ZONE). TYLER PORZINGIS MAKES IT! Assist: Jordan Green
Score: 10-11

[07:27] Team_063 possession (Score: 10-11)
FOUL! Holding foul on Carmelo Lowry. [Team fouls: 3] No free throws, side out. (Carmelo Lowry: 1 personal fouls)

[07:11] Team_063 possession (Score: 10-11)
Bradley Davis drives, Miles Bane stays with him. Bradley Davis attempts a Layup. Contested by Miles Bane (4.5 feet, MAN). Bradley Davis misses. Offensive rebound by Tyler Harris! Tyler Harris puts it back in!
Score: 12-11

[06:53] Team_002 possession (Score: 12-11)
FOUL! Holding foul on Terry Reaves. [Team fouls: 4] No free throws, side out. (Terry Reaves: 1 personal fouls)

[06:39] Team_002 possession (Score: 12-11)
Carmelo Lowry attempts a Midrange. Contested by Dirk Reaves (3.6 feet, ZONE). CARMELO LOWRY MAKES IT!
Score: 12-13

[06:26] Team_063 possession (Score: 12-13)
Tyler Harris attempts a Layup. Contested by Tyler Porzingis (3.0 feet, ZONE). TYLER HARRIS MAKES IT! Assist: Bradley Davis
Score: 14-13

[06:08] Team_002 possession (Score: 14-13)
CJ Barrett attempts a Layup. Contested by Tyler Harris (4.7 feet, ZONE). CJ Barrett misses. Rebound secured by Tyler Harris.

[05:51] Team_063 possession (Score: 14-13)
Bradley Davis attempts a 3Pt. Contested by Miles Bane (4.5 feet, MAN). Bradley Davis misses. Rebound secured by Tyler Porzingis.

[05:35] Team_002 possession (Score: 14-13)
Jordan Green attempts a 3Pt. Contested by Terry Reaves (5.4 feet, MAN). Jordan Green misses. Rebound secured by Dirk Reaves.

[05:21] Team_063 possession (Score: 14-13)
Dirk Reaves attempts a 3Pt. Contested by CJ Barrett (4.1 feet, ZONE). Dirk Reaves misses. Rebound secured by Tyler Porzingis.

[05:07] Team_002 possession (Score: 14-13)
CJ Barrett attempts a 3Pt. Contested by Malcolm Quickley (3.9 feet, MAN). CJ Barrett misses. Rebound secured by Malcolm Quickley.

[04:52] Team_063 possession (Score: 14-13)
Malcolm Quickley attempts a Layup. BLOCKED BY TYLER PORZINGIS! Ball is loose! Offensive rebound by Tyler Harris! Tyler Harris kicks it out.

[04:35] Team_063 possession (Score: 14-13)
Terry Reaves attempts a Midrange. Contested by Jordan Green (4.7 feet, MAN). TERRY REAVES MAKES IT!
Score: 16-13

[04:21] Team_002 possession (Score: 16-13)
Carmelo Lowry attempts a Layup. Contested by Dirk Reaves (3.7 feet, MAN). Carmelo Lowry misses. Rebound secured by Dirk Reaves.

[04:06] Team_063 possession (Score: 16-13)
Bradley Davis attempts a 3Pt. Contested by Miles Bane (4.6 feet, MAN). Bradley Davis misses. Rebound secured by Miles Bane.

[03:51] Team_002 possession (Score: 16-13)
Jordan Green attempts a 3Pt. Contested by Terry Reaves (5.5 feet, MAN). Jordan Green misses. Rebound secured by Tyler Harris.

[03:37] Team_063 possession (Score: 16-13)
Tyler Harris attempts a Midrange. Contested by Miles Bane (4.3 feet, ZONE). TYLER HARRIS MAKES IT! Assist: Bradley Davis
Score: 18-13

[03:22] Team_002 possession (Score: 18-13)
Tyler Porzingis makes the Layup and draws the foul on Tyler Harris! And-1! Tyler Porzingis to the line for 1. [BONUS: 5 team fouls] (Tyler Harris: 1 personal fouls)   FT 1/1: GOOD Tyler Porzingis makes 1/1 from the line.
Score: 18-16

[03:05] Team_063 possession (Score: 18-16)
Malcolm Quickley attempts a Layup. Contested by CJ Barrett (3.9 feet, MAN). MALCOLM QUICKLEY MAKES IT! Assist: Bradley Davis
Score: 20-16

[02:55] Team_002 possession (Score: 20-16)
Carmelo Lowry attempts a Midrange. Contested by Dirk Reaves (3.8 feet, MAN). Carmelo Lowry misses. Offensive rebound by Tyler Porzingis! Tyler Porzingis puts it back in!
Score: 20-18

[02:44] Team_063 possession (Score: 20-18)
FOUL! Reach-in foul on Tyler Porzingis during the drive. [Team fouls: 4] No free throws, side out. (Tyler Porzingis: 1 personal fouls)

[02:28] Team_063 possession (Score: 20-18)
Dirk Reaves drives, Carmelo Lowry stays with him. Dirk Reaves attempts a Dunk. Contested by Carmelo Lowry (4.3 feet, MAN). DIRK REAVES MAKES IT! Assist: Terry Reaves
Score: 22-18

[02:17] Team_002 possession (Score: 22-18)
Carmelo Lowry attempts a 3Pt. Contested by Malcolm Quickley (3.7 feet, ZONE). Carmelo Lowry misses. Rebound secured by Tyler Harris.

[02:03] Team_063 possession (Score: 22-18)
Bradley Davis attempts a Midrange. Contested by Miles Bane (4.8 feet, MAN). Bradley Davis misses. Offensive rebound by Dirk Reaves! Dirk Reaves kicks it out.

[01:48] Team_063 possession (Score: 22-18)
Terry Reaves makes the Layup and draws the foul on Tyler Porzingis! And-1! Terry Reaves to the line for 1. [BONUS: 5 team fouls] (Tyler Porzingis: 2 personal fouls)   FT 1/1: GOOD Terry Reaves makes 1/1 from the line.
Score: 25-18

[01:31] Team_002 possession (Score: 25-18)
CJ Barrett attempts a 3Pt. Contested by Malcolm Quickley (4.2 feet, MAN). CJ Barrett misses. Rebound secured by Dirk Reaves.

[01:17] Team_063 possession (Score: 25-18)
Terry Reaves attempts a 3Pt. Contested by Miles Bane (4.9 feet, ZONE). Terry Reaves misses. Rebound secured by Miles Bane.

[01:05] Team_002 possession (Score: 25-18)
Jordan Green makes the Dunk and draws the foul on Tyler Harris! And-1! Jordan Green to the line for 1. [BONUS: 6 team fouls] (Tyler Harris: 2 personal fouls)   FT 1/1: GOOD Jordan Green makes 1/1 from the line.
Score: 25-21

[00:53] Team_063 possession (Score: 25-21)
Terry Reaves attempts a 3Pt. Contested by Jordan Green (5.0 feet, MAN). Terry Reaves misses. Rebound secured by Tyler Porzingis.

[00:40] Team_002 possession (Score: 25-21)
Tyler Porzingis drives and kicks out. CJ Barrett attempts a Midrange. Contested by Dirk Reaves (4.3 feet, ZONE). CJ Barrett misses. Rebound secured by Malcolm Quickley.

[00:24] Team_063 possession (Score: 25-21)
Malcolm Quickley attempts a Midrange. Contested by Jordan Green (4.6 feet, ZONE). MALCOLM QUICKLEY MAKES IT!
Score: 27-21

[00:08] Team_002 possession (Score: 27-21)
Jordan Green drives, picks up Tyler Harris. Help arrives from Malcolm Quickley! Jordan Green attempts a Layup. Contested by Malcolm Quickley (5.7 feet, ZONE). JORDAN GREEN MAKES IT!
Score: 27-23

================================================================================
                              1ST QUARTER COMPLETE                              
================================================================================

1ST QUARTER SCORE: Team_063 27, Team_002 23

BOX SCORE:
================================================================================

Team_063
--------------------------------------------------------------------------------
Player                MIN  PTS  REB  AST  TO      FG   FG%      3P   3P%
--------------------------------------------------------------------------------
Tyler Harris           12   10    7    1   0   5/6    83.3     0/0   0.0
Malcolm Quickley       12    6    5    0   0   3/3   100.0     0/0   0.0
Dirk Reaves            12    6    5    0   0   2/4    50.0     0/0   0.0
Terry Reaves           12    5    0    1   0   2/5    40.0     0/0   0.0
Bradley Davis          12    0    0    3   0   0/2     0.0     0/0   0.0

TEAM: FG: 12/20 (60.0%), 3PT: 2/8 (25.0%), REB: 17 (4 off, 13 def), AST: 5, TO: 2
TEAM FOULS: 6 [Team_002 in BONUS]


Team_002
--------------------------------------------------------------------------------
Player                MIN  PTS  REB  AST  TO      FG   FG%      3P   3P%
--------------------------------------------------------------------------------
Tyler Porzingis        12    9    6    0   0   4/5    80.0     0/0   0.0
Jordan Green           12    5    0    1   0   2/5    40.0     0/0   0.0
Miles Bane             12    3    4    0   0   1/2    50.0     0/0   0.0
Carmelo Lowry          12    2    1    0   0   1/4    25.0     0/0   0.0
CJ Barrett             12    0    0    0   0   0/5     0.0     0/0   0.0

TEAM: FG: 8/21 (38.1%), 3PT: 1/9 (11.1%), REB: 11 (3 off, 8 def), AST: 1, TO: 1
TEAM FOULS: 5 [Team_063 in BONUS]

================================================================================

================================================================================
                       2ND QUARTER - Team_063 vs Team_002                       
================================================================================

[12:00] Team_063 possession (Score: 27-23)
FOUL! Shooting foul on CJ Barrett. Malcolm Quickley to the line for 3 free throws. [Team fouls: 1] (CJ Barrett: 1 personal fouls)   FT 1/3: GOOD   FT 2/3: GOOD   FT 3/3: GOOD Malcolm Quickley makes 3/3 from the line.
Score: 30-23

[11:46] Team_002 possession (Score: 30-23)
CJ Barrett attempts a Midrange. Contested by Dirk Reaves (4.4 feet, ZONE). CJ BARRETT MAKES IT! Assist: Carmelo Lowry
Score: 30-25

[11:31] Team_063 possession (Score: 30-25)
Dirk Reaves drives and kicks out. Dirk Reaves attempts a 3Pt. Contested by Miles Bane (4.7 feet, ZONE). DIRK REAVES MAKES IT! Assist: Tyler Harris
Score: 33-25

[11:17] Team_002 possession (Score: 33-25)
FOUL! Holding foul on Bradley Davis. [Team fouls: 1] No free throws, side out. (Bradley Davis: 1 personal fouls)

[11:03] Team_002 possession (Score: 33-25)
Carmelo Lowry attempts a Midrange. Contested by Dirk Reaves (4.1 feet, MAN). Carmelo Lowry misses. Offensive rebound by Tyler Porzingis! Tyler Porzingis's putback is no good. Rebound secured by Tyler Harris.

[10:44] Team_063 possession (Score: 33-25)
Bradley Davis attempts a Midrange. Contested by Jordan Green (4.9 feet, ZONE). Bradley Davis misses. Rebound secured by Miles Bane.

[10:28] Team_002 possession (Score: 33-25)
Carmelo Lowry drives and kicks out. Miles Bane attempts a Midrange. Contested by Bradley Davis (5.3 feet, MAN). Miles Bane misses. Rebound secured by Tyler Harris.

[10:12] Team_063 possession (Score: 33-25)
Bradley Davis attempts a 3Pt. Contested by Miles Bane (4.9 feet, ZONE). Bradley Davis misses. Rebound secured by Tyler Porzingis.

[10:01] Team_002 possession (Score: 33-25)
Jordan Green attempts a 3Pt. Contested by Malcolm Quickley (4.8 feet, ZONE). Jordan Green misses. Rebound secured by Tyler Harris.

[09:50] Team_063 possession (Score: 33-25)
Dirk Reaves attempts a Midrange. Contested by Carmelo Lowry (4.7 feet, ZONE). Dirk Reaves misses. FOUL! Loose ball foul on Tyler Porzingis during the rebound battle. [Team fouls: 2] No free throws, side out. (Tyler Porzingis: 1 personal fouls)

[09:34] Team_063 possession (Score: 33-25)
Terry Reaves attempts a 3Pt. Contested by Miles Bane (5.1 feet, ZONE). Terry Reaves misses. Rebound secured by Tyler Porzingis.

[09:22] Team_002 possession (Score: 33-25)
FOUL! Reach-in foul on Tyler Harris during the drive. [Team fouls: 2] No free throws, side out. (Tyler Harris: 1 personal fouls)

[09:08] Team_002 possession (Score: 33-25)
Miles Bane attempts a Midrange. Contested by Malcolm Quickley (4.1 feet, ZONE). Miles Bane misses. Rebound secured by Tyler Harris.

[08:51] Team_063 possession (Score: 33-25)
Bradley Davis drives to the basket... Bradley Davis loses the ball! Stripped by Tyler Porzingis! TURNOVER! (live ball)

[08:32] Team_002 possession (Score: 33-25)
CJ Barrett attempts a 3Pt. Contested by Malcolm Quickley (4.5 feet, ZONE). CJ Barrett misses. Rebound secured by Tyler Harris.

[08:21] Team_063 possession (Score: 33-25)
Dirk Reaves attempts a 3Pt. Contested by Carmelo Lowry (4.9 feet, MAN). Dirk Reaves misses. Rebound secured by Tyler Porzingis.

[08:08] Team_002 possession (Score: 33-25)
Tyler Porzingis attempts a Layup. Contested by Tyler Harris (5.4 feet, ZONE). Tyler Porzingis misses. Rebound secured by Tyler Harris.

[07:54] Team_063 possession (Score: 33-25)
Tyler Harris drives, Tyler Porzingis stays with him. Tyler Harris attempts a Dunk. Contested by Tyler Porzingis (4.0 feet, ZONE). Tyler Harris misses. Rebound secured by Carmelo Lowry.

[07:42] Team_002 possession (Score: 33-25)
Miles Bane attempts a 3Pt. Contested by Malcolm Quickley (4.3 feet, ZONE). Miles Bane misses. Rebound secured by Malcolm Quickley.

[07:29] Team_063 possession (Score: 33-25)
FOUL! Holding foul on Tyler Porzingis. [Team fouls: 3] No free throws, side out. (Tyler Porzingis: 2 personal fouls)

[07:13] Team_063 possession (Score: 33-25)
Terry Reaves attempts a 3Pt. Contested by Jordan Green (5.4 feet, MAN). TERRY REAVES MAKES IT! Assist: Dirk Reaves
Score: 36-25

[07:00] Team_002 possession (Score: 36-25)
CJ Barrett drives, Tyler Harris stays with him. CJ Barrett attempts a Dunk. Contested by Tyler Harris (5.7 feet, ZONE). CJ BARRETT MAKES IT! Assist: Tyler Porzingis
Score: 36-27

[06:47] Team_063 possession (Score: 36-27)
Tyler Harris drives and kicks out. Terry Reaves attempts a 3Pt. Contested by Jordan Green (5.3 feet, MAN). Terry Reaves misses. Rebound secured by Carmelo Lowry.

[06:36] Team_002 possession (Score: 36-27)
Carmelo Lowry attempts a Midrange. Contested by Dirk Reaves (4.7 feet, ZONE). Carmelo Lowry misses. Rebound secured by Dirk Reaves.

[06:22] Team_063 possession (Score: 36-27)
Dirk Reaves attempts a 3Pt. Contested by Carmelo Lowry (5.2 feet, MAN). Dirk Reaves misses. Rebound secured by Carmelo Lowry.

[06:09] Team_002 possession (Score: 36-27)
Miles Bane attempts a 3Pt. Contested by Malcolm Quickley (4.6 feet, ZONE). Miles Bane misses. Rebound secured by Tyler Harris.

[05:52] Team_063 possession (Score: 36-27)
Dirk Reaves attempts a 3Pt. Contested by Miles Bane (5.5 feet, ZONE). Dirk Reaves misses. Rebound secured by Miles Bane.

[05:40] Team_002 possession (Score: 36-27)
Tyler Porzingis attempts a Midrange. Contested by Tyler Harris (5.8 feet, MAN). TYLER PORZINGIS MAKES IT! Assist: Carmelo Lowry
Score: 36-29

[05:21] Team_063 possession (Score: 36-29)
Malcolm Quickley attempts a 3Pt. Contested by CJ Barrett (4.9 feet, MAN). MALCOLM QUICKLEY MAKES IT! Assist: Bradley Davis
Score: 39-29

[05:07] Team_002 possession (Score: 39-29)
Miles Bane attempts a 3Pt. Contested by Malcolm Quickley (4.7 feet, ZONE). Miles Bane misses. Rebound secured by Dirk Reaves.

[04:51] Team_063 possession (Score: 39-29)
Bradley Davis drives to the basket... Bradley Davis throws a bad pass! Stolen by Miles Bane! TURNOVER! (live ball)

[04:34] Team_002 possession (Score: 39-29)
Carmelo Lowry drives, Tyler Harris stays with him. Carmelo Lowry attempts a Dunk. Contested by Tyler Harris (5.6 feet, ZONE). Carmelo Lowry misses. Offensive rebound by Carmelo Lowry! Carmelo Lowry kicks it out.

[04:21] Team_002 possession (Score: 39-29)
Jordan Green drives, Terry Reaves stays with him. Jordan Green attempts a Layup. Wide open! Terry Reaves is 6.6 feet away. [MAN] JORDAN GREEN MAKES IT! Assist: CJ Barrett
Score: 39-31

[04:07] Team_063 possession (Score: 39-31)
Malcolm Quickley attempts a 3Pt. Contested by Miles Bane (5.3 feet, ZONE). Malcolm Quickley misses. Rebound secured by Tyler Porzingis.

[03:52] Team_002 possession (Score: 39-31)
Tyler Porzingis drives and kicks out. Tyler Porzingis attempts a 3Pt. Wide open! Tyler Harris is 6.1 feet away. [MAN] TYLER PORZINGIS MAKES IT! Assist: Jordan Green
Score: 39-34

[03:39] Team_063 possession (Score: 39-34)
Terry Reaves attempts a Midrange. Contested by CJ Barrett (5.5 feet, ZONE). Terry Reaves misses. Rebound secured by Tyler Porzingis.

[03:25] Team_002 possession (Score: 39-34)
Jordan Green attempts a 3Pt. Contested by Malcolm Quickley (5.7 feet, ZONE). Jordan Green misses. Rebound secured by Tyler Harris.

[03:09] Team_063 possession (Score: 39-34)
Tyler Harris attempts a Layup. Contested by Tyler Porzingis (4.8 feet, ZONE). TYLER HARRIS MAKES IT!
Score: 41-34

[02:55] Team_002 possession (Score: 41-34)
CJ Barrett attempts a 3Pt. Contested by Malcolm Quickley (5.4 feet, ZONE). CJ Barrett misses. Rebound secured by Malcolm Quickley.

[02:41] Team_063 possession (Score: 41-34)
Malcolm Quickley attempts a Midrange. Contested by Carmelo Lowry (5.5 feet, ZONE). Malcolm Quickley misses. Rebound secured by Miles Bane.

[02:22] Team_002 possession (Score: 41-34)
CJ Barrett attempts a Midrange. Contested by Malcolm Quickley (5.5 feet, MAN). CJ Barrett misses. Rebound secured by Malcolm Quickley.

[02:04] Team_063 possession (Score: 41-34)
Dirk Reaves attempts a 3Pt. Contested by Carmelo Lowry (5.9 feet, MAN). Dirk Reaves misses. Rebound secured by Carmelo Lowry.

[01:50] Team_002 possession (Score: 41-34)
Tyler Porzingis drives, picks up Tyler Harris. Help arrives from Malcolm Quickley! Tyler Porzingis attempts a Layup. Wide open! Malcolm Quickley is 6.3 feet away. [ZONE] TYLER PORZINGIS MAKES IT! Assist: Carmelo Lowry
Score: 41-36

[01:38] Team_063 possession (Score: 41-36)
Terry Reaves drives and kicks out. Terry Reaves attempts a 3Pt. Wide open! Jordan Green is 6.1 feet away. [ZONE] Terry Reaves misses. Rebound secured by Carmelo Lowry.

[01:25] Team_002 possession (Score: 41-36)
FOUL! Reach-in foul on Tyler Harris during the drive. [Team fouls: 3] No free throws, side out. (Tyler Harris: 2 personal fouls)

[01:09] Team_002 possession (Score: 41-36)
CJ Barrett attempts a Midrange. Contested by Malcolm Quickley (5.7 feet, ZONE). CJ Barrett misses. Rebound secured by Malcolm Quickley.

[00:54] Team_063 possession (Score: 41-36)
Malcolm Quickley attempts a Layup. Contested by CJ Barrett (5.6 feet, MAN). Malcolm Quickley misses. Rebound secured by Carmelo Lowry.

[00:40] Team_002 possession (Score: 41-36)
Miles Bane makes the Dunk and draws the foul on Bradley Davis! And-1! Miles Bane to the line for 1. [Team fouls: 4] (Bradley Davis: 2 personal fouls)   FT 1/1: GOOD Miles Bane makes 1/1 from the line.
Score: 41-39

[00:26] Team_063 possession (Score: 41-39)
Tyler Harris drives to the basket... Tyler Harris throws a bad pass! Stolen by Tyler Porzingis! TURNOVER! (live ball)

[00:12] Team_002 possession (Score: 41-39)
Miles Bane attempts a Layup. Wide open! Bradley Davis is 6.4 feet away. [MAN] Miles Bane misses. Rebound secured by Malcolm Quickley.

================================================================================
                              2ND QUARTER COMPLETE                              
================================================================================

2ND QUARTER SCORE: Team_063 14, Team_002 16

BOX SCORE:
================================================================================

Team_063
--------------------------------------------------------------------------------
Player                MIN  PTS  REB  AST  TO      FG   FG%      3P   3P%
--------------------------------------------------------------------------------
Malcolm Quickley       24    6    5    0   0   2/5    40.0     0/0   0.0
Dirk Reaves            24    3    2    1   0   1/5    20.0     0/0   0.0
Terry Reaves           24    3    0    0   0   1/4    25.0     0/0   0.0
Tyler Harris           24    2    9    1   0   1/3    33.3     0/0   0.0
Bradley Davis          24    0    0    1   0   0/2     0.0     0/0   0.0

TEAM: FG: 5/19 (26.3%), 3PT: 3/10 (30.0%), REB: 15 (1 off, 14 def), AST: 3, TO: 3
TEAM FOULS: 4


Team_002
--------------------------------------------------------------------------------
Player                MIN  PTS  REB  AST  TO      FG   FG%      3P   3P%
--------------------------------------------------------------------------------
Tyler Porzingis        24    7    5    1   0   3/4    75.0     0/0   0.0
CJ Barrett             24    4    0    1   0   2/6    33.3     0/0   0.0
Miles Bane             24    3    3    0   0   1/6    16.7     0/0   0.0
Jordan Green           24    2    0    1   0   1/3    33.3     0/0   0.0
Carmelo Lowry          24    0    7    3   0   0/3     0.0     0/0   0.0

TEAM: FG: 7/22 (31.8%), 3PT: 0/7 (0.0%), REB: 16 (2 off, 14 def), AST: 6, TO: 0
TEAM FOULS: 3

================================================================================

================================================================================
                       3RD QUARTER - Team_063 vs Team_002                       
================================================================================

[12:00] Team_063 possession (Score: 41-39)
Bradley Davis attempts a Layup. BLOCKED BY MILES BANE! Ball deflects out of bounds off Bradley Davis.

[11:47] Team_002 possession (Score: 41-39)
Miles Bane attempts a 3Pt. Contested by Malcolm Quickley (3.4 feet, ZONE). Miles Bane misses. Rebound secured by Malcolm Quickley.

[11:34] Team_063 possession (Score: 41-39)
Bradley Davis drives and kicks out. Bradley Davis attempts a 3Pt. Contested by Miles Bane (4.3 feet, MAN). Bradley Davis misses. Offensive rebound by Tyler Harris! Tyler Harris's putback is no good. Rebound secured by Carmelo Lowry.

[11:23] Team_002 possession (Score: 41-39)
Miles Bane drives to the basket... Miles Bane throws a bad pass out of bounds! TURNOVER! (dead ball)

[11:11] Team_063 possession (Score: 41-39)
Dirk Reaves attempts a Midrange. Contested by Carmelo Lowry (4.0 feet, MAN). DIRK REAVES MAKES IT!
Score: 43-39

[10:55] Team_002 possession (Score: 43-39)
FOUL! Holding foul on Dirk Reaves. [Team fouls: 1] No free throws, side out. (Dirk Reaves: 1 personal fouls)

[10:39] Team_002 possession (Score: 43-39)
CJ Barrett attempts a 3Pt. Contested by Malcolm Quickley (3.9 feet, ZONE). CJ Barrett misses. Rebound secured by Dirk Reaves.

[10:27] Team_063 possession (Score: 43-39)
FOUL! Shooting foul on Carmelo Lowry. Dirk Reaves to the line for 2 free throws. [Team fouls: 1] (Carmelo Lowry: 1 personal fouls)   FT 1/2: GOOD   FT 2/2: GOOD Dirk Reaves makes 2/2 from the line.
Score: 45-39

[10:09] Team_002 possession (Score: 45-39)
Tyler Porzingis drives, Tyler Harris stays with him. Tyler Porzingis attempts a Layup. Contested by Tyler Harris (4.6 feet, ZONE). TYLER PORZINGIS MAKES IT! Assist: Jordan Green
Score: 45-41

[09:51] Team_063 possession (Score: 45-41)
Dirk Reaves attempts a Midrange. Contested by Jordan Green (4.6 feet, ZONE). DIRK REAVES MAKES IT!
Score: 47-41

[09:40] Team_002 possession (Score: 47-41)
Carmelo Lowry attempts a 3Pt. Contested by Malcolm Quickley (3.4 feet, ZONE). Carmelo Lowry misses. Offensive rebound by Carmelo Lowry! Carmelo Lowry kicks it out.

[09:21] Team_002 possession (Score: 47-41)
Carmelo Lowry attempts a Midrange. Contested by Terry Reaves (4.5 feet, ZONE). CARMELO LOWRY MAKES IT! Assist: Miles Bane
Score: 47-43

[09:06] Team_063 possession (Score: 47-43)
Terry Reaves makes the Layup and draws the foul on Jordan Green! And-1! Terry Reaves to the line for 1. [Team fouls: 2] (Jordan Green: 1 personal fouls)   FT 1/1: GOOD Terry Reaves makes 1/1 from the line.
Score: 50-43

[08:51] Team_002 possession (Score: 50-43)
Tyler Porzingis drives and kicks out. FOUL! Shooting foul on Tyler Harris. Tyler Porzingis to the line for 2 free throws. [Team fouls: 2] (Tyler Harris: 1 personal fouls)   FT 1/2: MISS   FT 2/2: GOOD Tyler Porzingis makes 1/2 from the line.
Score: 50-44

[08:38] Team_063 possession (Score: 50-44)
Tyler Harris attempts a 3Pt. Contested by CJ Barrett (3.8 feet, ZONE). Tyler Harris misses. Rebound secured by Carmelo Lowry.

[08:21] Team_002 possession (Score: 50-44)
Miles Bane attempts a Layup. Contested by Bradley Davis (4.8 feet, MAN). MILES BANE MAKES IT! Assist: Carmelo Lowry
Score: 50-46

[08:12] Team_063 possession (Score: 50-46)
Terry Reaves loses control! Ball rolls out of bounds! TURNOVER! (dead ball)

[07:55] Team_002 possession (Score: 50-46)
Jordan Green attempts a 3Pt. Contested by Terry Reaves (5.4 feet, MAN). Jordan Green misses. Rebound secured by Dirk Reaves.

[07:46] Team_063 possession (Score: 50-46)
Malcolm Quickley attempts a Midrange. Contested by CJ Barrett (3.7 feet, MAN). Malcolm Quickley misses. Offensive rebound by Tyler Harris! Tyler Harris's putback is no good. Offensive rebound by Tyler Harris! Tyler Harris kicks it out.

[07:30] Team_063 possession (Score: 50-46)
Dirk Reaves attempts a 3Pt. Contested by Carmelo Lowry (4.0 feet, MAN). Dirk Reaves misses. Rebound secured by Tyler Porzingis.

[07:20] Team_002 possession (Score: 50-46)
Tyler Porzingis attempts a Layup. Contested by Tyler Harris (4.6 feet, ZONE). TYLER PORZINGIS MAKES IT! Assist: Carmelo Lowry
Score: 50-48

[07:04] Team_063 possession (Score: 50-48)
FOUL! Holding foul on Miles Bane. [Team fouls: 3] No free throws, side out. (Miles Bane: 1 personal fouls)

[06:46] Team_063 possession (Score: 50-48)
Tyler Harris attempts a 3Pt. Contested by CJ Barrett (3.8 feet, ZONE). Tyler Harris misses. Offensive rebound by Dirk Reaves! Dirk Reaves puts it back in!
Score: 52-48

[06:27] Team_002 possession (Score: 52-48)
Carmelo Lowry attempts a 3Pt. Contested by Malcolm Quickley (3.4 feet, ZONE). CARMELO LOWRY MAKES IT! Assist: CJ Barrett
Score: 52-51

[06:14] Team_063 possession (Score: 52-51)
Malcolm Quickley attempts a Midrange. BLOCKED BY CJ BARRETT! Ball is loose! Rebound secured by Tyler Porzingis.

[05:55] Team_002 possession (Score: 52-51)
Miles Bane attempts a 3Pt. Contested by Bradley Davis (4.8 feet, MAN). MILES BANE MAKES IT! Assist: CJ Barrett
Score: 52-54

[05:42] Team_063 possession (Score: 52-54)
Bradley Davis attempts a 3Pt. Contested by CJ Barrett (4.1 feet, ZONE). Bradley Davis misses. Rebound secured by Carmelo Lowry.

[05:29] Team_002 possession (Score: 52-54)
Jordan Green attempts a Midrange. Contested by Dirk Reaves (4.5 feet, ZONE). Jordan Green misses. Rebound secured by Dirk Reaves.

[05:12] Team_063 possession (Score: 52-54)
Terry Reaves attempts a Layup. Contested by Tyler Porzingis (3.4 feet, ZONE). TERRY REAVES MAKES IT!
Score: 54-54

[04:58] Team_002 possession (Score: 54-54)
CJ Barrett attempts a Midrange. Contested by Malcolm Quickley (3.9 feet, MAN). CJ Barrett misses. Offensive rebound by Tyler Porzingis! Tyler Porzingis's putback is no good. Rebound secured by Malcolm Quickley.

[04:44] Team_063 possession (Score: 54-54)
Bradley Davis attempts a 3Pt. Contested by CJ Barrett (4.2 feet, ZONE). Bradley Davis misses. Rebound secured by Carmelo Lowry.

[04:32] Team_002 possession (Score: 54-54)
CJ Barrett attempts a 3Pt. Contested by Malcolm Quickley (3.9 feet, MAN). CJ Barrett misses. Rebound secured by Dirk Reaves.

[04:15] Team_063 possession (Score: 54-54)
Tyler Harris throws a bad pass out of bounds! TURNOVER! (dead ball)

[04:01] Team_002 possession (Score: 54-54)
CJ Barrett attempts a 3Pt. Contested by Malcolm Quickley (3.9 feet, MAN). CJ BARRETT MAKES IT! Assist: Jordan Green
Score: 54-57

[03:43] Team_063 possession (Score: 54-57)
Bradley Davis attempts a Midrange. Contested by Carmelo Lowry (4.2 feet, ZONE). Bradley Davis misses. Rebound secured by Carmelo Lowry.

[03:33] Team_002 possession (Score: 54-57)
Miles Bane makes the Midrange and draws the foul on Bradley Davis! And-1! Miles Bane to the line for 1. [Team fouls: 3] (Bradley Davis: 1 personal fouls)   FT 1/1: GOOD Miles Bane makes 1/1 from the line.
Score: 54-60

[03:17] Team_063 possession (Score: 54-60)
Terry Reaves drives, picks up Tyler Porzingis. Help arrives from CJ Barrett! Terry Reaves attempts a Layup. Contested by CJ Barrett (3.6 feet, ZONE). Terry Reaves misses. Rebound secured by Tyler Porzingis.

[03:05] Team_002 possession (Score: 54-60)
CJ Barrett attempts a 3Pt. Contested by Malcolm Quickley (4.0 feet, ZONE). CJ Barrett misses. Rebound secured by Dirk Reaves.

[02:47] Team_063 possession (Score: 54-60)
Terry Reaves attempts a 3Pt. Contested by Jordan Green (4.8 feet, MAN). Terry Reaves misses. Offensive rebound by Tyler Harris! Tyler Harris puts it back in!
Score: 56-60

[02:32] Team_002 possession (Score: 56-60)
CJ Barrett attempts a 3Pt. Contested by Malcolm Quickley (4.1 feet, ZONE). CJ Barrett misses. Rebound secured by Tyler Harris.

[02:19] Team_063 possession (Score: 56-60)
Tyler Harris drives and kicks out. Terry Reaves attempts a 3Pt. Contested by Jordan Green (4.6 feet, MAN). Terry Reaves misses. Rebound secured by Tyler Porzingis.

[02:01] Team_002 possession (Score: 56-60)
Jordan Green attempts a 3Pt. Contested by Malcolm Quickley (4.6 feet, ZONE). Jordan Green misses. Rebound secured by Malcolm Quickley.

[01:47] Team_063 possession (Score: 56-60)
Malcolm Quickley drives and kicks out. FOUL! Shooting foul on Carmelo Lowry. Dirk Reaves to the line for 2 free throws. [Team fouls: 4] (Carmelo Lowry: 2 personal fouls)   FT 1/2: GOOD   FT 2/2: MISS Dirk Reaves makes 1/2 from the line. Offensive rebound by Tyler Harris! Tyler Harris's putback is no good.
Score: 57-60

[01:29] Team_002 possession (Score: 57-60)
Miles Bane attempts a Midrange. Contested by Bradley Davis (5.1 feet, MAN). Miles Bane misses. Rebound secured by Dirk Reaves.

[01:13] Team_063 possession (Score: 57-60)
Terry Reaves makes the Dunk and draws the foul on Jordan Green! And-1! Terry Reaves to the line for 1. [BONUS: 5 team fouls] (Jordan Green: 2 personal fouls)   FT 1/1: GOOD Terry Reaves makes 1/1 from the line.
Score: 60-60

[01:02] Team_002 possession (Score: 60-60)
Carmelo Lowry attempts a 3Pt. Contested by Terry Reaves (4.9 feet, ZONE). Carmelo Lowry misses. Rebound secured by Dirk Reaves.

[00:45] Team_063 possession (Score: 60-60)
Bradley Davis attempts a 3Pt. Contested by Miles Bane (4.9 feet, MAN). Bradley Davis misses. Offensive rebound by Tyler Harris! Tyler Harris's putback is no good. Offensive rebound by Tyler Harris! Tyler Harris kicks it out.

[00:30] Team_063 possession (Score: 60-60)
Terry Reaves attempts a 3Pt. Contested by Miles Bane (5.0 feet, ZONE). Terry Reaves misses. Rebound secured by Tyler Porzingis.

[00:17] Team_002 possession (Score: 60-60)
FOUL! Shooting foul on Tyler Harris. Tyler Porzingis to the line for 2 free throws. [Team fouls: 4] (Tyler Harris: 2 personal fouls)   FT 1/2: GOOD   FT 2/2: GOOD Tyler Porzingis makes 2/2 from the line.
Score: 60-62

[00:05] Team_063 possession (Score: 60-62)
Terry Reaves attempts a Midrange. Contested by Miles Bane (5.0 feet, ZONE). Terry Reaves misses. Rebound secured by Miles Bane.

================================================================================
                              3RD QUARTER COMPLETE                              
================================================================================

3RD QUARTER SCORE: Team_063 19, Team_002 23

BOX SCORE:
================================================================================

Team_063
--------------------------------------------------------------------------------
Player                MIN  PTS  REB  AST  TO      FG   FG%      3P   3P%
--------------------------------------------------------------------------------
Dirk Reaves            36    8    8    0   0   4/5    80.0     0/0   0.0
Terry Reaves           36    8    0    0   0   3/6    50.0     0/0   0.0
Tyler Harris           36    2    5    0   0   1/3    33.3     0/0   0.0
Bradley Davis          36    0    0    0   0   0/5     0.0     0/0   0.0
Malcolm Quickley       36    0    3    0   0   0/2     0.0     0/0   0.0

TEAM: FG: 8/21 (38.1%), 3PT: 2/7 (28.6%), REB: 15 (5 off, 10 def), AST: 0, TO: 2
TEAM FOULS: 4


Team_002
--------------------------------------------------------------------------------
Player                MIN  PTS  REB  AST  TO      FG   FG%      3P   3P%
--------------------------------------------------------------------------------
Miles Bane             36    8    1    1   0   3/5    60.0     0/0   0.0
Tyler Porzingis        36    7    5    0   0   4/4   100.0     0/0   0.0
Carmelo Lowry          36    5    6    2   0   2/3    66.7     0/0   0.0
CJ Barrett             36    3    0    2   0   1/6    16.7     0/0   0.0
Jordan Green           36    0    0    2   0   0/3     0.0     0/0   0.0

TEAM: FG: 10/21 (47.6%), 3PT: 3/11 (27.3%), REB: 13 (2 off, 11 def), AST: 7, TO: 1
TEAM FOULS: 5 [Team_063 in BONUS]

================================================================================

================================================================================
                       4TH QUARTER - Team_063 vs Team_002                       
================================================================================

[12:00] Team_063 possession (Score: 60-62)
Malcolm Quickley drives and kicks out. Tyler Harris attempts a Midrange. Contested by Carmelo Lowry (4.2 feet, ZONE). Tyler Harris misses. Offensive rebound by Tyler Harris! Tyler Harris puts it back in!
Score: 62-62

[11:43] Team_002 possession (Score: 62-62)
FOUL! Offensive foul on Miles Bane! Bradley Davis drew the charge! [Team fouls: 1] (Miles Bane: 1 personal fouls) TURNOVER! (dead ball)

[11:28] Team_063 possession (Score: 62-62)
Dirk Reaves attempts a 3Pt. Contested by Miles Bane (4.8 feet, ZONE). DIRK REAVES MAKES IT! Assist: Tyler Harris
Score: 65-62

[11:17] Team_002 possession (Score: 65-62)
FOUL! Shooting foul on Tyler Harris. Tyler Porzingis to the line for 2 free throws. [Team fouls: 1] (Tyler Harris: 1 personal fouls)   FT 1/2: GOOD   FT 2/2: GOOD Tyler Porzingis makes 2/2 from the line.
Score: 65-64

[10:58] Team_063 possession (Score: 65-64)
Malcolm Quickley attempts a 3Pt. Contested by CJ Barrett (4.1 feet, MAN). MALCOLM QUICKLEY MAKES IT! Assist: Tyler Harris
Score: 68-64

[10:47] Team_002 possession (Score: 68-64)
FOUL! Reach-in foul on Tyler Harris during the drive. [Team fouls: 2] No free throws, side out. (Tyler Harris: 2 personal fouls)

[10:32] Team_002 possession (Score: 68-64)
Tyler Porzingis drives and kicks out. CJ Barrett attempts a Midrange. Contested by Terry Reaves (5.1 feet, ZONE). CJ BARRETT MAKES IT!
Score: 68-66

[10:18] Team_063 possession (Score: 68-66)
Bradley Davis attempts a 3Pt. Contested by Miles Bane (4.9 feet, MAN). BRADLEY DAVIS MAKES IT! Assist: Terry Reaves
Score: 71-66

[10:03] Team_002 possession (Score: 71-66)
Miles Bane attempts a 3Pt. Contested by Dirk Reaves (4.2 feet, ZONE). Miles Bane misses. Rebound secured by Malcolm Quickley.

[09:44] Team_063 possession (Score: 71-66)
Dirk Reaves attempts a 3Pt. Contested by Carmelo Lowry (4.7 feet, MAN). Dirk Reaves misses. Rebound secured by Tyler Porzingis.

[09:32] Team_002 possession (Score: 71-66)
Tyler Porzingis attempts a 3Pt. Contested by Malcolm Quickley (4.3 feet, ZONE). Tyler Porzingis misses. Rebound secured by Tyler Harris.

[09:23] Team_063 possession (Score: 71-66)
FOUL! Holding foul on Tyler Porzingis. [Team fouls: 2] No free throws, side out. (Tyler Porzingis: 1 personal fouls)

[09:09] Team_063 possession (Score: 71-66)
Malcolm Quickley attempts a 3Pt. Contested by Miles Bane (4.7 feet, ZONE). Malcolm Quickley misses. Rebound secured by Miles Bane.

[08:52] Team_002 possession (Score: 71-66)
Tyler Porzingis attempts a Layup. Contested by Tyler Harris (5.3 feet, ZONE). Tyler Porzingis misses. Rebound secured by Tyler Harris.

[08:36] Team_063 possession (Score: 71-66)
Tyler Harris attempts a Midrange. Contested by Tyler Porzingis (3.9 feet, MAN). Tyler Harris misses. Rebound secured by Carmelo Lowry.

[08:18] Team_002 possession (Score: 71-66)
FOUL! Shooting foul on Malcolm Quickley. Tyler Porzingis to the line for 2 free throws. [Team fouls: 3] (Malcolm Quickley: 1 personal fouls)   FT 1/2: GOOD   FT 2/2: GOOD Tyler Porzingis makes 2/2 from the line.
Score: 71-68

[08:05] Team_063 possession (Score: 71-68)
Bradley Davis attempts a Layup. Contested by Miles Bane (5.2 feet, MAN). Bradley Davis misses. Rebound secured by Carmelo Lowry.

[07:52] Team_002 possession (Score: 71-68)
Miles Bane attempts a 3Pt. Contested by Bradley Davis (5.4 feet, MAN). Miles Bane misses. Rebound secured by Dirk Reaves.

[07:37] Team_063 possession (Score: 71-68)
Bradley Davis attempts a 3Pt. Contested by CJ Barrett (4.9 feet, ZONE). Bradley Davis misses. Rebound secured by Tyler Porzingis.

[07:20] Team_002 possession (Score: 71-68)
Jordan Green attempts a 3Pt. Contested by Malcolm Quickley (5.1 feet, ZONE). Jordan Green misses. Rebound secured by Tyler Harris.

[07:07] Team_063 possession (Score: 71-68)
FOUL! Shooting foul on Carmelo Lowry. Dirk Reaves to the line for 2 free throws. [Team fouls: 3] (Carmelo Lowry: 1 personal fouls)   FT 1/2: GOOD   FT 2/2: GOOD Dirk Reaves makes 2/2 from the line.
Score: 73-68

[06:50] Team_002 possession (Score: 73-68)
Miles Bane attempts a Midrange. Contested by Bradley Davis (5.6 feet, MAN). MILES BANE MAKES IT! Assist: Carmelo Lowry
Score: 73-70

[06:37] Team_063 possession (Score: 73-70)
Dirk Reaves makes the Layup and draws the foul on Tyler Porzingis! And-1! Dirk Reaves to the line for 1. [Team fouls: 4] (Tyler Porzingis: 2 personal fouls)   FT 1/1: GOOD Dirk Reaves makes 1/1 from the line.
Score: 76-70

[06:21] Team_002 possession (Score: 76-70)
Tyler Porzingis attempts a Midrange. Contested by Tyler Harris (5.7 feet, MAN). TYLER PORZINGIS MAKES IT!
Score: 76-72

[06:10] Team_063 possession (Score: 76-72)
Dirk Reaves attempts a 3Pt. Contested by Miles Bane (5.4 feet, ZONE). Dirk Reaves misses. FOUL! Loose ball foul on Carmelo Lowry during the rebound battle. [IN THE BONUS! 5 team fouls] Malcolm Quickley to the line for 2 free throws. (Carmelo Lowry: 2 personal fouls)   FT 1/2: MISS   FT 2/2: MISS Malcolm Quickley makes 0/2 from the line. Offensive rebound by Malcolm Quickley! Malcolm Quickley kicks it out.

[05:56] Team_063 possession (Score: 76-72)
Terry Reaves attempts a 3Pt. Contested by Miles Bane (5.5 feet, ZONE). TERRY REAVES MAKES IT!
Score: 79-72

[05:42] Team_002 possession (Score: 79-72)
FOUL! Reach-in foul on Tyler Harris during the drive. [Team fouls: 4] No free throws, side out. (Tyler Harris: 3 personal fouls)

[05:25] Team_002 possession (Score: 79-72)
Carmelo Lowry attempts a Layup. Contested by Tyler Harris (5.5 feet, ZONE). CARMELO LOWRY MAKES IT!
Score: 79-74

[05:08] Team_063 possession (Score: 79-74)
FOUL! Reach-in foul on Tyler Porzingis during the drive. [IN THE BONUS! 6 team fouls] Dirk Reaves to the line for 2 free throws. (Tyler Porzingis: 3 personal fouls)   FT 1/2: MISS   FT 2/2: MISS Dirk Reaves makes 0/2 from the line. Rebound secured by Carmelo Lowry.

[04:57] Team_002 possession (Score: 79-74)
Jordan Green attempts a 3Pt. Contested by Malcolm Quickley (5.5 feet, ZONE). Jordan Green misses. Offensive rebound by Tyler Porzingis! Tyler Porzingis kicks it out.

[04:40] Team_002 possession (Score: 79-74)
FOUL! Offensive foul on Miles Bane! Bradley Davis drew the charge! [Team fouls: 7] (Miles Bane: 2 personal fouls) TURNOVER! (dead ball)

[04:24] Team_063 possession (Score: 79-74)
Terry Reaves attempts a 3Pt. Contested by CJ Barrett (5.4 feet, ZONE). Terry Reaves misses. Rebound secured by Carmelo Lowry.

[04:06] Team_002 possession (Score: 79-74)
Tyler Porzingis drives and kicks out. Tyler Porzingis attempts a 3Pt. Contested by Malcolm Quickley (5.1 feet, ZONE). Tyler Porzingis misses. Rebound secured by Tyler Harris.

[03:50] Team_063 possession (Score: 79-74)
Terry Reaves attempts a Midrange. Contested by Jordan Green (5.8 feet, MAN). Terry Reaves misses. Rebound secured by Miles Bane.

[03:38] Team_002 possession (Score: 79-74)
FOUL! Holding foul on Tyler Harris. [IN THE BONUS! 5 team fouls] Tyler Porzingis to the line for 2 free throws. (Tyler Harris: 4 personal fouls)   FT 1/2: GOOD   FT 2/2: GOOD Tyler Porzingis makes 2/2 from the line.
Score: 79-76

[03:24] Team_063 possession (Score: 79-76)
Malcolm Quickley attempts a Midrange. Contested by CJ Barrett (5.2 feet, MAN). Malcolm Quickley misses. Rebound secured by Carmelo Lowry.

[03:10] Team_002 possession (Score: 79-76)
FOUL! Reach-in foul on Tyler Harris during the drive. [IN THE BONUS! 6 team fouls] Miles Bane to the line for 2 free throws. (Tyler Harris: 5 personal fouls)   FT 1/2: GOOD   FT 2/2: GOOD Miles Bane makes 2/2 from the line.
Score: 79-78

[02:58] Team_063 possession (Score: 79-78)
Malcolm Quickley attempts a 3Pt. Contested by Miles Bane (5.5 feet, ZONE). MALCOLM QUICKLEY MAKES IT! Assist: Terry Reaves
Score: 82-78

[02:40] Team_002 possession (Score: 82-78)
CJ Barrett attempts a 3Pt. Contested by Malcolm Quickley (5.4 feet, ZONE). CJ Barrett misses. Rebound secured by Tyler Harris.

[02:26] Team_063 possession (Score: 82-78)
Dirk Reaves drives, picks up Carmelo Lowry. Help arrives from CJ Barrett! Dirk Reaves attempts a Dunk. Contested by CJ Barrett (5.9 feet, MAN). Dirk Reaves misses. Offensive rebound by Malcolm Quickley! Malcolm Quickley kicks it out.

[02:12] Team_063 possession (Score: 82-78)
Malcolm Quickley drives and kicks out. Malcolm Quickley makes the 3Pt and draws the foul on Miles Bane! And-1! Malcolm Quickley to the line for 1. [BONUS: 8 team fouls] (Miles Bane: 3 personal fouls)   FT 1/1: GOOD Malcolm Quickley makes 1/1 from the line.
Score: 86-78

[01:56] Team_002 possession (Score: 86-78)
FOUL! Holding foul on Malcolm Quickley. [IN THE BONUS! 7 team fouls] CJ Barrett to the line for 2 free throws. (Malcolm Quickley: 2 personal fouls)   FT 1/2: GOOD   FT 2/2: GOOD CJ Barrett makes 2/2 from the line.
Score: 86-80

[01:41] Team_063 possession (Score: 86-80)
FOUL! Holding foul on Carmelo Lowry. [IN THE BONUS! 9 team fouls] Dirk Reaves to the line for 2 free throws. (Carmelo Lowry: 3 personal fouls)   FT 1/2: GOOD   FT 2/2: GOOD Dirk Reaves makes 2/2 from the line.
Score: 88-80

[01:24] Team_002 possession (Score: 88-80)
Tyler Porzingis attempts a Midrange. Wide open! Tyler Harris is 6.4 feet away. [MAN] Tyler Porzingis misses. Offensive rebound by Tyler Porzingis! Tyler Porzingis kicks it out.

[01:11] Team_002 possession (Score: 88-80)
CJ Barrett attempts a Midrange. Contested by Malcolm Quickley (5.6 feet, MAN). CJ BARRETT MAKES IT! Assist: Jordan Green
Score: 88-82

[00:52] Team_063 possession (Score: 88-82)
Malcolm Quickley attempts a 3Pt. Contested by CJ Barrett (5.6 feet, MAN). Malcolm Quickley misses. Rebound secured by Carmelo Lowry.

[00:37] Team_002 possession (Score: 88-82)
Miles Bane attempts a 3Pt. Contested by Malcolm Quickley (5.4 feet, ZONE). MILES BANE MAKES IT! Assist: Tyler Porzingis
Score: 88-85

[00:23] Team_063 possession (Score: 88-85)
Dirk Reaves attempts a Midrange. Wide open! Carmelo Lowry is 6.2 feet away. [ZONE] DIRK REAVES MAKES IT! Assist: Bradley Davis
Score: 90-85

[00:12] Team_002 possession (Score: 90-85)
Miles Bane attempts a Layup. Wide open! Tyler Harris is 6.4 feet away. [ZONE] Miles Bane misses. FOUL! Loose ball foul on Malcolm Quickley during the rebound battle. [IN THE BONUS! 8 team fouls] Tyler Porzingis to the line for 2 free throws. (Malcolm Quickley: 3 personal fouls)   FT 1/2: GOOD   FT 2/2: GOOD Tyler Porzingis makes 2/2 from the line.
Score: 90-87

================================================================================
                              4TH QUARTER COMPLETE                              
================================================================================

4TH QUARTER SCORE: Team_063 30, Team_002 25

BOX SCORE:
================================================================================

Team_063
--------------------------------------------------------------------------------
Player                MIN  PTS  REB  AST  TO      FG   FG%      3P   3P%
--------------------------------------------------------------------------------
Dirk Reaves            48   12    1    0   0   5/7    71.4     0/0   0.0
Malcolm Quickley       48   10    3    0   0   3/6    50.0     0/0   0.0
Bradley Davis          48    3    0    1   0   1/3    33.3     0/0   0.0
Terry Reaves           48    3    0    2   0   1/3    33.3     0/0   0.0
Tyler Harris           48    2    6    2   0   1/2    50.0     0/0   0.0

TEAM: FG: 11/21 (52.4%), 3PT: 5/10 (50.0%), REB: 10 (3 off, 7 def), AST: 5, TO: 0
TEAM FOULS: 8 [Team_002 in BONUS]


Team_002
--------------------------------------------------------------------------------
Player                MIN  PTS  REB  AST  TO      FG   FG%      3P   3P%
--------------------------------------------------------------------------------
Tyler Porzingis        48   10    4    1   0   5/8    62.5     0/0   0.0
Miles Bane             48    7    2    0   0   3/5    60.0     0/0   0.0
CJ Barrett             48    6    0    0   0   3/4    75.0     0/0   0.0
Carmelo Lowry          48    2    6    1   0   1/1   100.0     0/0   0.0
Jordan Green           48    0    0    1   0   0/1     0.0     0/0   0.0

TEAM: FG: 12/19 (63.2%), 3PT: 1/6 (16.7%), REB: 12 (2 off, 10 def), AST: 3, TO: 2
TEAM FOULS: 9 [Team_063 in BONUS]

================================================================================

================================================================================
                               FULL GAME COMPLETE                               
================================================================================

FINAL SCORE: Team_063 90, Team_002 87

SCORING BY QUARTER:
--------------------------------------------------------------------------------
Team                     Q1     Q2     Q3     Q4    FINAL
--------------------------------------------------------------------------------
Team_063                 27     14     19     30       90
Team_002                 23     16     23     25       87
--------------------------------------------------------------------------------

FULL GAME BOX SCORE:
================================================================================

Team_063
--------------------------------------------------------------------------------
Player                MIN  PTS  REB  AST  TO      FG   FG%      3P   3P%      FT STL BLK
--------------------------------------------------------------------------------
Bradley Davis          48    3    0    5   1   2/13   15.4   1/7    14.3   0/0     0   0
Malcolm Quickley       48   22   16    0   2   9/17   52.9   4/7    57.1   4/6     0   0
Terry Reaves           48   19    0    3   1   9/20   45.0   4/10   40.0   5/6     0   0
Dirk Reaves            48   29   17    1   1  10/19   52.6   2/9    22.2   8/11    0   0
Tyler Harris           48   16   27    4   2   5/11   45.5   1/2    50.0   0/0     0   0
DeMar Banchero          0    0    0    0   0   0/0     0.0   0/0     0.0   0/0     0   0
Cole Durant             0    0    0    0   0   0/0     0.0   0/0     0.0   0/0     0   0
Jaren James             0    0    0    0   0   0/0     0.0   0/0     0.0   0/0     0   0
Lamelo Ball             0    0    0    0   0   0/0     0.0   0/0     0.0   0/0     0   0
Kyle Green              0    0    0    0   0   0/0     0.0   0/0     0.0   0/0     0   0

TEAM: FG: 36/81 (44.4%), 3PT: 12/35 (34.3%), REB: 57 (13 off, 44 def), AST: 13, TO: 7


Team_002
--------------------------------------------------------------------------------
Player                MIN  PTS  REB  AST  TO      FG   FG%      3P   3P%      FT STL BLK
--------------------------------------------------------------------------------
Miles Bane             48   21   10    1   3   9/19   47.4   2/9    22.2   5/5     1   1
CJ Barrett             48   13    0    3   0   4/19   21.1   1/12    8.3   2/3     1   1
Jordan Green           48    7    0    5   1   4/13   30.8   1/8    12.5   2/3     0   0
Carmelo Lowry          48    9   20    6   0   5/12   41.7   1/3    33.3   0/0     0   0
Tyler Porzingis        48   33   20    2   0  13/18   72.2   0/1     0.0  12/13    2   1
John Duncan             0    0    0    0   0   0/0     0.0   0/0     0.0   0/0     0   0
Dirk Middleton          0    0    0    0   0   0/0     0.0   0/0     0.0   0/0     0   0
Anfernee Sexton         0    0    0    0   0   0/0     0.0   0/0     0.0   0/0     0   0
Julius Curry            0    0    0    0   0   0/0     0.0   0/0     0.0   0/0     0   0
Lamelo O'Neal           0    0    0    0   0   0/0     0.0   0/0     0.0   0/0     0   0

TEAM: FG: 37/83 (44.6%), 3PT: 5/33 (15.2%), REB: 52 (9 off, 43 def), AST: 17, TO: 4

================================================================================
