================================================================================
                        FULL GAME - Team_052 vs Team_019                        
================================================================================

================================================================================
                       1ST QUARTER - Team_052 vs Team_019                       
================================================================================

[12:00] Team_052 possession (Score: 0-0)
Bones Morant attempts a 3Pt. Contested by D'Angelo Randle (4.0 feet, ZONE). Bones Morant misses. Offensive rebound by Bones Morant! Bones Morant kicks it out.

[11:46] Team_052 possession (Score: 0-0)
Gary Gasol drives and kicks out. James Paul attempts a Midrange. Contested by DeMar James (4.2 feet, ZONE). James Paul misses. Rebound secured by Tobias Hyland.

[11:33] Team_019 possession (Score: 0-0)
Rudy Giddey drives, Gary Gasol stays with him. Rudy Giddey attempts a Layup. Contested by Gary Gasol (4.0 feet, MAN). RUDY GIDDEY MAKES IT! Assist: DeMar James
Score: 0-2

[11:20] Team_052 possession (Score: 0-2)
Josh Durant drives and kicks out. Bones Morant attempts a Midrange. Contested by D'Angelo Randle (3.6 feet, MAN). BONES MORANT MAKES IT!
Score: 2-2

[11:06] Team_019 possession (Score: 2-2)
Rudy Giddey throws a bad pass! Stolen by Gary Gasol! TURNOVER! (live ball)

[10:49] Team_052 possession (Score: 2-2)
Carmelo Middleton attempts a 3Pt. Contested by D'Angelo Randle (4.0 feet, ZONE). CARMELO MIDDLETON MAKES IT! Assist: Gary Gasol
Score: 5-2

[10:38] Team_019 possession (Score: 5-2)
D'Angelo Randle attempts a 3Pt. Contested by Bones Morant (3.8 feet, ZONE). D'Angelo Randle misses. FOUL! Loose ball foul on James Paul during the rebound battle. [Team fouls: 1] No free throws, side out. (James Paul: 1 personal fouls)

[10:25] Team_019 possession (Score: 5-2)
Rudy Giddey attempts a Midrange. Contested by Josh Durant (3.5 feet, ZONE). Rudy Giddey misses. Offensive rebound by D'Angelo Randle! D'Angelo Randle's putback is no good. Offensive rebound by D'Angelo Randle! D'Angelo Randle kicks it out.

[10:13] Team_019 possession (Score: 5-2)
D'Angelo Randle makes the Layup and draws the foul on James Paul! And-1! D'Angelo Randle to the line for 1. [Team fouls: 2] (James Paul: 2 personal fouls)   FT 1/1: GOOD D'Angelo Randle makes 1/1 from the line.
Score: 5-5

[10:00] Team_052 possession (Score: 5-5)
Bones Morant attempts a 3Pt. Contested by D'Angelo Randle (4.0 feet, MAN). Bones Morant misses. Rebound secured by DeMar James.

[09:49] Team_019 possession (Score: 5-5)
D'Angelo Randle attempts a 3Pt. Contested by Bones Morant (3.8 feet, ZONE). D'Angelo Randle misses. Rebound secured by James Paul.

[09:35] Team_052 possession (Score: 5-5)
Gary Gasol commits a violation (traveling/carry)! TURNOVER! (dead ball)

[09:21] Team_019 possession (Score: 5-5)
FOUL! Offensive foul on DeMar James! Carmelo Middleton drew the charge! [Team fouls: 1] (DeMar James: 1 personal fouls) TURNOVER! (dead ball)

[09:08] Team_052 possession (Score: 5-5)
Bones Morant attempts a 3Pt. Contested by D'Angelo Randle (4.0 feet, MAN). Bones Morant misses. Offensive rebound by James Paul! James Paul puts it back in!
Score: 7-5

[08:55] Team_019 possession (Score: 7-5)
Tobias Hyland attempts a Midrange. Contested by James Paul (3.5 feet, MAN). Tobias Hyland misses. Rebound secured by James Paul.

[08:40] Team_052 possession (Score: 7-5)
Gary Gasol attempts a 3Pt. Contested by Rudy Giddey (5.8 feet, MAN). GARY GASOL MAKES IT! Assist: Carmelo Middleton
Score: 10-5

[08:26] Team_019 possession (Score: 10-5)
D'Angelo Randle attempts a 3Pt. Contested by Bones Morant (3.8 feet, MAN). D'Angelo Randle misses. Rebound secured by Carmelo Middleton.

[08:07] Team_052 possession (Score: 10-5)
Gary Gasol attempts a Layup. BLOCKED BY D'ANGELO RANDLE! Ball is loose! Offensive rebound by James Paul! James Paul kicks it out.

[07:50] Team_052 possession (Score: 10-5)
Bones Morant attempts a 3Pt. Contested by D'Angelo Randle (4.0 feet, ZONE). Bones Morant misses. Offensive rebound by James Paul! James Paul puts it back in!
Score: 12-5

[07:36] Team_019 possession (Score: 12-5)
Brandon James attempts a Midrange. Contested by Josh Durant (3.3 feet, MAN). BRANDON JAMES MAKES IT! Assist: D'Angelo Randle
Score: 12-7

[07:18] Team_052 possession (Score: 12-7)
FOUL! Holding foul on Tobias Hyland. [Team fouls: 2] No free throws, side out. (Tobias Hyland: 1 personal fouls)

[07:04] Team_052 possession (Score: 12-7)
FOUL! Holding foul on Brandon James. [Team fouls: 3] No free throws, side out. (Brandon James: 1 personal fouls)

[06:49] Team_052 possession (Score: 12-7)
Carmelo Middleton loses the ball! Stripped by DeMar James! TURNOVER! (live ball)

[06:38] Team_019 possession (Score: 12-7)
Tobias Hyland drives, James Paul stays with him. Tobias Hyland attempts a Layup. Contested by James Paul (3.5 feet, ZONE). Tobias Hyland misses. Rebound secured by Bones Morant.

[06:22] Team_052 possession (Score: 12-7)
FOUL! Shooting foul on DeMar James. Carmelo Middleton to the line for 2 free throws. [Team fouls: 4] (DeMar James: 2 personal fouls)   FT 1/2: MISS   FT 2/2: MISS Carmelo Middleton makes 0/2 from the line. Offensive rebound by Bones Morant! Bones Morant kicks it out.

[06:09] Team_052 possession (Score: 12-7)
Gary Gasol makes the 3Pt and draws the foul on Rudy Giddey! And-1! Gary Gasol to the line for 1. [BONUS: 5 team fouls] (Rudy Giddey: 1 personal fouls)   FT 1/1: GOOD Gary Gasol makes 1/1 from the line.
Score: 16-7

[05:52] Team_019 possession (Score: 16-7)
Rudy Giddey attempts a 3Pt. Contested by Bones Morant (3.8 feet, ZONE). Rudy Giddey misses. Rebound secured by Carmelo Middleton.

[05:34] Team_052 possession (Score: 16-7)
Bones Morant attempts a Midrange. Contested by DeMar James (4.7 feet, ZONE). BONES MORANT MAKES IT! Assist: James Paul
Score: 18-7

[05:18] Team_019 possession (Score: 18-7)
FOUL! Reach-in foul on Carmelo Middleton during the drive. [Team fouls: 3] No free throws, side out. (Carmelo Middleton: 1 personal fouls)

[05:08] Team_019 possession (Score: 18-7)
DeMar James drives and kicks out. DeMar James attempts a Midrange. Contested by Carmelo Middleton (4.3 feet, MAN). DEMAR JAMES MAKES IT! Assist: D'Angelo Randle
Score: 18-9

[04:49] Team_052 possession (Score: 18-9)
James Paul drives and kicks out. Gary Gasol attempts a 3Pt. Contested by D'Angelo Randle (3.7 feet, ZONE). GARY GASOL MAKES IT! Assist: Bones Morant
Score: 21-9

[04:33] Team_019 possession (Score: 21-9)
FOUL! Offensive foul on Tobias Hyland! James Paul drew the charge! [Team fouls: 6] (Tobias Hyland: 2 personal fouls) TURNOVER! (dead ball)

[04:16] Team_052 possession (Score: 21-9)
Gary Gasol throws a bad pass out of bounds! TURNOVER! (dead ball)

[03:57] Team_019 possession (Score: 21-9)
FOUL! Offensive foul on Tobias Hyland! James Paul drew the charge! [Team fouls: 7] (Tobias Hyland: 3 personal fouls) TURNOVER! (dead ball)

[03:40] Team_052 possession (Score: 21-9)
Carmelo Middleton attempts a Layup. Wide open! Tobias Hyland is 6.1 feet away. [ZONE] CARMELO MIDDLETON MAKES IT!
Score: 23-9

[03:28] Team_019 possession (Score: 23-9)
Brandon James drives and kicks out. Tobias Hyland attempts a 3Pt. Contested by James Paul (3.6 feet, MAN). Tobias Hyland misses. Rebound secured by James Paul.

[03:11] Team_052 possession (Score: 23-9)
FOUL! Shooting foul on DeMar James. Bones Morant to the line for 2 free throws. [BONUS: 8 team fouls] (DeMar James: 3 personal fouls)   FT 1/2: GOOD   FT 2/2: GOOD Bones Morant makes 2/2 from the line.
Score: 25-9

[02:55] Team_019 possession (Score: 25-9)
Brandon James drives and kicks out. DeMar James attempts a Midrange. Contested by Carmelo Middleton (4.5 feet, MAN). DeMar James misses. Rebound secured by Carmelo Middleton.

[02:40] Team_052 possession (Score: 25-9)
Josh Durant attempts a Midrange. Contested by Brandon James (5.1 feet, MAN). JOSH DURANT MAKES IT! Assist: Bones Morant
Score: 27-9

[02:27] Team_019 possession (Score: 27-9)
DeMar James attempts a Midrange. Contested by Carmelo Middleton (4.9 feet, MAN). DEMAR JAMES MAKES IT!
Score: 27-11

[02:16] Team_052 possession (Score: 27-11)
Bones Morant throws a bad pass out of bounds! TURNOVER! (dead ball)

[02:16] Substitution (Team_052): Gary Gasol OUT → Jimmy Doncic IN (stamina_rule2)

[02:16] Substitution (Team_052): Carmelo Middleton OUT → Carmelo Beal IN (stamina_rule2)

[02:16] Substitution (Team_019): Rudy Giddey OUT → Gary Ginobili IN (stamina_rule2)

[02:16] Substitution (Team_019): Brandon James OUT → Jalen Turner IN (stamina_rule2)

[02:16] Substitution (Team_019): D'Angelo Randle OUT → Blake LaVine IN (stamina_rule2)

[02:16] Substitution (Team_019): Tobias Hyland OUT → Shai Ingram IN (stamina_rule2)

[02:16] Substitution (Team_019): DeMar James OUT → Tim Jordan IN (stamina_rule2)

[02:02] Team_019 possession (Score: 27-11)
Jalen Turner drives, picks up James Paul. Help arrives from Josh Durant! Jalen Turner attempts a Dunk. Contested by Josh Durant (4.0 feet, ZONE). Jalen Turner misses. Rebound secured by James Paul.

[01:47] Team_052 possession (Score: 27-11)
James Paul drives, Shai Ingram stays with him. James Paul attempts a Dunk. Contested by Shai Ingram (4.9 feet, MAN). JAMES PAUL MAKES IT! Assist: Josh Durant
Score: 29-11

[01:35] Team_019 possession (Score: 29-11)
Blake LaVine attempts a 3Pt. Contested by Bones Morant (4.1 feet, MAN). Blake LaVine misses. Rebound secured by James Paul.

[01:23] Team_052 possession (Score: 29-11)
Jimmy Doncic attempts a 3Pt. Contested by Gary Ginobili (5.7 feet, MAN). Jimmy Doncic misses. Offensive rebound by Carmelo Beal! Carmelo Beal kicks it out.

[01:07] Team_052 possession (Score: 29-11)
James Paul attempts a 3Pt. Contested by Blake LaVine (5.0 feet, ZONE). JAMES PAUL MAKES IT! Assist: Bones Morant
Score: 32-11

[00:51] Team_019 possession (Score: 32-11)
Blake LaVine loses the ball! Stripped by Bones Morant! TURNOVER! (live ball)

[00:36] Team_052 possession (Score: 32-11)
Jimmy Doncic attempts a 3Pt. Contested by Gary Ginobili (5.7 feet, MAN). Jimmy Doncic misses. Rebound secured by Blake LaVine.

[00:23] Team_019 possession (Score: 32-11)
Tim Jordan drives and kicks out. Jalen Turner attempts a 3Pt. Contested by Josh Durant (3.8 feet, MAN). JALEN TURNER MAKES IT! Assist: Gary Ginobili
Score: 32-14

[00:09] Team_052 possession (Score: 32-14)
James Paul attempts a 3Pt. Contested by Shai Ingram (4.8 feet, MAN). JAMES PAUL MAKES IT! Assist: Josh Durant
Score: 35-14

================================================================================
                              1ST QUARTER COMPLETE                              
================================================================================

1ST QUARTER SCORE: Team_052 35, Team_019 14

BOX SCORE:
================================================================================

Team_052
--------------------------------------------------------------------------------
Player                MIN  PTS  REB  AST  TO      FG   FG%      3P   3P%
--------------------------------------------------------------------------------
James Paul             12   12    8    1   0   5/5   100.0     0/0   0.0
Gary Gasol             10   10    0    1   0   3/4    75.0     0/0   0.0
Bones Morant           12    6    3    3   0   3/4    75.0     0/0   0.0
Carmelo Middleton      10    5    3    1   0   2/2   100.0     0/0   0.0
Josh Durant            12    2    0    2   0   1/1   100.0     0/0   0.0
Carmelo Beal            2    0    1    0   0   0/0     0.0     0/0   0.0
Jimmy Doncic            2    0    0    0   0   0/1     0.0     0/0   0.0

TEAM: FG: 14/17 (82.4%), 3PT: 7/9 (77.8%), REB: 15 (6 off, 9 def), AST: 8, TO: 4
TEAM FOULS: 3


Team_019
--------------------------------------------------------------------------------
Player                MIN  PTS  REB  AST  TO      FG   FG%      3P   3P%
--------------------------------------------------------------------------------
DeMar James            10    4    1    1   0   2/2   100.0     0/0   0.0
D'Angelo Randle        10    3    2    2   0   1/3    33.3     0/0   0.0
Jalen Turner            2    3    0    0   0   1/2    50.0     0/0   0.0
Rudy Giddey            10    2    0    0   0   1/2    50.0     0/0   0.0
Brandon James          10    2    0    0   0   1/3    33.3     0/0   0.0
Tobias Hyland          10    0    1    0   0   0/2     0.0     0/0   0.0
Blake LaVine            2    0    1    0   0   0/1     0.0     0/0   0.0
Gary Ginobili           2    0    0    1   0   0/0     0.0     0/0   0.0

TEAM: FG: 6/15 (40.0%), 3PT: 0/4 (0.0%), REB: 5 (2 off, 3 def), AST: 4, TO: 5
TEAM FOULS: 8 [Team_052 in BONUS]

================================================================================

================================================================================
                       2ND QUARTER - Team_052 vs Team_019                       
================================================================================

[12:00] Team_052 possession (Score: 35-14)
Josh Durant attempts a Layup. Contested by Brandon James (4.9 feet, MAN). JOSH DURANT MAKES IT!
Score: 37-14

[11:45] Team_019 possession (Score: 37-14)
D'Angelo Randle drives and kicks out. Brandon James makes the Midrange and draws the foul on Josh Durant! And-1! Brandon James to the line for 1. [Team fouls: 1] (Josh Durant: 1 personal fouls)   FT 1/1: GOOD Brandon James makes 1/1 from the line.
Score: 37-17

[11:29] Team_052 possession (Score: 37-17)
FOUL! Reach-in foul on DeMar James during the drive. [Team fouls: 1] No free throws, side out. (DeMar James: 1 personal fouls)

[11:15] Team_052 possession (Score: 37-17)
Carmelo Middleton drives, DeMar James stays with him. Carmelo Middleton attempts a Layup. Contested by DeMar James (4.7 feet, MAN). CARMELO MIDDLETON MAKES IT! Assist: Bones Morant
Score: 39-17

[11:01] Team_019 possession (Score: 39-17)
Tobias Hyland attempts a Midrange. Contested by James Paul (3.9 feet, MAN). TOBIAS HYLAND MAKES IT! Assist: Brandon James
Score: 39-19

[10:45] Team_052 possession (Score: 39-19)
FOUL! Shooting foul on Brandon James. James Paul to the line for 2 free throws. [Team fouls: 2] (Brandon James: 1 personal fouls)   FT 1/2: MISS   FT 2/2: GOOD James Paul makes 1/2 from the line.
Score: 40-19

[10:29] Team_019 possession (Score: 40-19)
Tobias Hyland makes the Dunk and draws the foul on James Paul! And-1! Tobias Hyland to the line for 1. [Team fouls: 2] (James Paul: 1 personal fouls)   FT 1/1: GOOD Tobias Hyland makes 1/1 from the line.
Score: 40-22

[10:15] Team_052 possession (Score: 40-22)
Josh Durant attempts a Midrange. Contested by Brandon James (5.0 feet, MAN). Josh Durant misses. Rebound secured by Tobias Hyland.

[10:04] Team_019 possession (Score: 40-22)
DeMar James attempts a Midrange. Contested by Carmelo Middleton (4.8 feet, MAN). DeMar James misses. Offensive rebound by DeMar James! DeMar James's putback is no good. Rebound secured by James Paul.

[09:45] Team_052 possession (Score: 40-22)
Bones Morant drives and kicks out. Josh Durant makes the 3Pt and draws the foul on Brandon James! And-1! Josh Durant to the line for 1. [Team fouls: 3] (Brandon James: 2 personal fouls)   FT 1/1: GOOD Josh Durant makes 1/1 from the line.
Score: 44-22

[09:27] Team_019 possession (Score: 44-22)
Rudy Giddey attempts a 3Pt. Contested by Bones Morant (4.4 feet, ZONE). Rudy Giddey misses. Rebound secured by Carmelo Middleton.

[09:14] Team_052 possession (Score: 44-22)
FOUL! Reach-in foul on DeMar James during the drive. [Team fouls: 4] No free throws, side out. (DeMar James: 2 personal fouls)

[09:03] Team_052 possession (Score: 44-22)
Bones Morant drives and kicks out. Josh Durant attempts a 3Pt. Contested by D'Angelo Randle (4.0 feet, ZONE). JOSH DURANT MAKES IT!
Score: 47-22

[08:46] Team_019 possession (Score: 47-22)
D'Angelo Randle attempts a 3Pt. Contested by Bones Morant (4.5 feet, MAN). D'ANGELO RANDLE MAKES IT! Assist: Tobias Hyland
Score: 47-25

[08:34] Team_052 possession (Score: 47-25)
Gary Gasol attempts a Midrange. Wide open! Rudy Giddey is 6.0 feet away. [MAN] GARY GASOL MAKES IT! Assist: Bones Morant
Score: 49-25

[08:23] Team_019 possession (Score: 49-25)
Tobias Hyland attempts a Midrange. Contested by James Paul (4.2 feet, MAN). Tobias Hyland misses. Offensive rebound by D'Angelo Randle! D'Angelo Randle kicks it out.

[08:08] Team_019 possession (Score: 49-25)
DeMar James attempts a Midrange. Contested by Carmelo Middleton (5.0 feet, MAN). DeMar James misses. FOUL! Loose ball foul on Bones Morant during the rebound battle. [Team fouls: 3] No free throws, side out. (Bones Morant: 1 personal fouls)

[07:55] Team_019 possession (Score: 49-25)
DeMar James attempts a Layup. Contested by Carmelo Middleton (5.1 feet, ZONE). DeMar James misses. Rebound secured by James Paul.

[07:42] Team_052 possession (Score: 49-25)
Gary Gasol drives, picks up Rudy Giddey. Help arrives from D'Angelo Randle! Gary Gasol attempts a Dunk. Wide open! D'Angelo Randle is 6.1 feet away. [MAN] Gary Gasol misses. Rebound secured by Tobias Hyland.

[07:26] Team_019 possession (Score: 49-25)
Rudy Giddey attempts a 3Pt. Contested by Gary Gasol (4.4 feet, MAN). Rudy Giddey misses. Rebound secured by Bones Morant.

[07:12] Team_052 possession (Score: 49-25)
Bones Morant attempts a 3Pt. Wide open! Rudy Giddey is 6.0 feet away. [ZONE] BONES MORANT MAKES IT! Assist: Carmelo Middleton
Score: 52-25

[06:58] Team_019 possession (Score: 52-25)
Tobias Hyland drives and kicks out. FOUL! Shooting foul on Bones Morant. Tobias Hyland to the line for 3 free throws. [Team fouls: 4] (Bones Morant: 2 personal fouls)   FT 1/3: GOOD   FT 2/3: GOOD   FT 3/3: GOOD Tobias Hyland makes 3/3 from the line.
Score: 52-28

[06:43] Team_052 possession (Score: 52-28)
FOUL! Reach-in foul on DeMar James during the drive. [IN THE BONUS! 5 team fouls] Carmelo Middleton to the line for 2 free throws. (DeMar James: 3 personal fouls)   FT 1/2: MISS   FT 2/2: MISS Carmelo Middleton makes 0/2 from the line. Rebound secured by D'Angelo Randle.

[06:26] Team_019 possession (Score: 52-28)
D'Angelo Randle attempts a 3Pt. Contested by Bones Morant (4.8 feet, MAN). D'Angelo Randle misses. Rebound secured by James Paul.

[06:09] Team_052 possession (Score: 52-28)
FOUL! Shooting foul on D'Angelo Randle. Bones Morant to the line for 2 free throws. [BONUS: 6 team fouls] (D'Angelo Randle: 1 personal fouls)   FT 1/2: GOOD   FT 2/2: GOOD Bones Morant makes 2/2 from the line.
Score: 54-28

[05:55] Team_019 possession (Score: 54-28)
Brandon James drives, picks up Josh Durant. Help arrives from Bones Morant! Brandon James attempts a Layup. Contested by Bones Morant (4.4 feet, MAN). Brandon James misses. Rebound secured by James Paul.

[05:41] Team_052 possession (Score: 54-28)
FOUL! Shooting foul on DeMar James. James Paul to the line for 2 free throws. [BONUS: 7 team fouls] (DeMar James: 4 personal fouls)   FT 1/2: GOOD   FT 2/2: GOOD James Paul makes 2/2 from the line.
Score: 56-28

[05:24] Team_019 possession (Score: 56-28)
FOUL! Holding foul on Carmelo Middleton. [IN THE BONUS! 5 team fouls] DeMar James to the line for 2 free throws. (Carmelo Middleton: 1 personal fouls)   FT 1/2: MISS   FT 2/2: GOOD DeMar James makes 1/2 from the line.
Score: 56-29

[05:08] Team_052 possession (Score: 56-29)
Gary Gasol attempts a Midrange. Wide open! Brandon James is 6.2 feet away. [ZONE] GARY GASOL MAKES IT!
Score: 58-29

[04:50] Team_019 possession (Score: 58-29)
Brandon James attempts a Midrange. Contested by James Paul (4.7 feet, ZONE). Brandon James misses. Rebound secured by Bones Morant.

[04:36] Team_052 possession (Score: 58-29)
Josh Durant drives to the basket... FOUL! Offensive foul on Josh Durant! Brandon James drew the charge! [Team fouls: 6] (Josh Durant: 2 personal fouls) TURNOVER! (dead ball)

[04:22] Team_019 possession (Score: 58-29)
D'Angelo Randle drives and kicks out. Rudy Giddey attempts a 3Pt. Contested by Bones Morant (5.0 feet, ZONE). RUDY GIDDEY MAKES IT! Assist: Tobias Hyland
Score: 58-32

[04:09] Team_052 possession (Score: 58-32)
James Paul attempts a Midrange. Wide open! Tobias Hyland is 6.7 feet away. [MAN] JAMES PAUL MAKES IT! Assist: Carmelo Middleton
Score: 60-32

[03:53] Team_019 possession (Score: 60-32)
Rudy Giddey attempts a 3Pt. Contested by Bones Morant (5.2 feet, ZONE). Rudy Giddey misses. Rebound secured by James Paul.

[03:35] Team_052 possession (Score: 60-32)
Carmelo Middleton attempts a 3Pt. Contested by D'Angelo Randle (5.0 feet, ZONE). CARMELO MIDDLETON MAKES IT! Assist: James Paul
Score: 63-32

[03:24] Team_019 possession (Score: 63-32)
DeMar James attempts a Layup. Contested by James Paul (5.2 feet, ZONE). DEMAR JAMES MAKES IT!
Score: 63-34

[03:06] Team_052 possession (Score: 63-34)
James Paul attempts a Layup. Wide open! Tobias Hyland is 6.8 feet away. [ZONE] JAMES PAUL MAKES IT!
Score: 65-34

[02:50] Team_019 possession (Score: 65-34)
D'Angelo Randle attempts a 3Pt. Contested by Bones Morant (5.3 feet, MAN). D'Angelo Randle misses. Rebound secured by Carmelo Middleton.

[02:33] Team_052 possession (Score: 65-34)
Bones Morant drives, picks up DeMar James. Help arrives from Brandon James! Bones Morant attempts a Layup. Contested by Brandon James (5.7 feet, ZONE). BONES MORANT MAKES IT! Assist: Carmelo Middleton
Score: 67-34

[02:18] Team_019 possession (Score: 67-34)
DeMar James attempts a Midrange. Contested by Carmelo Middleton (5.7 feet, MAN). DeMar James misses. Rebound secured by Bones Morant.

[02:06] Team_052 possession (Score: 67-34)
Gary Gasol attempts a 3Pt. Wide open! Rudy Giddey is 6.6 feet away. [MAN] Gary Gasol misses. Rebound secured by Tobias Hyland.

[01:53] Team_019 possession (Score: 67-34)
Rudy Giddey attempts a 3Pt. Contested by Bones Morant (5.5 feet, ZONE). RUDY GIDDEY MAKES IT! Assist: Tobias Hyland
Score: 67-37

[01:40] Team_052 possession (Score: 67-37)
James Paul drives and kicks out. Gary Gasol attempts a 3Pt. Contested by D'Angelo Randle (5.2 feet, ZONE). Gary Gasol misses. Offensive rebound by James Paul! James Paul kicks it out.

[01:28] Team_052 possession (Score: 67-37)
Josh Durant attempts a 3Pt. Contested by Brandon James (6.0 feet, MAN). Josh Durant misses. Rebound secured by DeMar James.

[01:16] Team_019 possession (Score: 67-37)
Rudy Giddey makes the Dunk and draws the foul on James Paul! And-1! Rudy Giddey to the line for 1. [BONUS: 7 team fouls] (James Paul: 2 personal fouls)   FT 1/1: MISS Rudy Giddey makes 0/1 from the line. Offensive rebound by DeMar James! DeMar James kicks it out.
Score: 67-39

[01:03] Team_019 possession (Score: 67-39)
FOUL! Holding foul on Bones Morant. [IN THE BONUS! 8 team fouls] D'Angelo Randle to the line for 2 free throws. (Bones Morant: 3 personal fouls)   FT 1/2: GOOD   FT 2/2: GOOD D'Angelo Randle makes 2/2 from the line.
Score: 67-41

[00:49] Team_052 possession (Score: 67-41)
Bones Morant attempts a Midrange. Contested by D'Angelo Randle (5.4 feet, MAN). BONES MORANT MAKES IT! Assist: Carmelo Middleton
Score: 69-41

[00:31] Team_019 possession (Score: 69-41)
Rudy Giddey makes the Midrange and draws the foul on Gary Gasol! And-1! Rudy Giddey to the line for 1. [BONUS: 9 team fouls] (Gary Gasol: 1 personal fouls)   FT 1/1: GOOD Rudy Giddey makes 1/1 from the line.
Score: 69-44

[00:14] Team_052 possession (Score: 69-44)
Carmelo Middleton drives, picks up DeMar James. Help arrives from Brandon James! Carmelo Middleton attempts a Layup. Wide open! Brandon James is 6.1 feet away. [ZONE] Carmelo Middleton misses. FOUL! Loose ball foul on DeMar James during the rebound battle. [IN THE BONUS! 8 team fouls] James Paul to the line for 2 free throws. (DeMar James: 5 personal fouls)   FT 1/2: GOOD   FT 2/2: MISS James Paul makes 1/2 from the line. Rebound secured by D'Angelo Randle.
Score: 70-44

================================================================================
                              2ND QUARTER COMPLETE                              
================================================================================

2ND QUARTER SCORE: Team_052 35, Team_019 30

BOX SCORE:
================================================================================

Team_052
--------------------------------------------------------------------------------
Player                MIN  PTS  REB  AST  TO      FG   FG%      3P   3P%
--------------------------------------------------------------------------------
Josh Durant            24    9    0    0   0   3/5    60.0     0/0   0.0
Bones Morant           24    9    3    2   0   4/4   100.0     0/0   0.0
James Paul             24    7    6    1   0   4/4   100.0     0/0   0.0
Carmelo Middleton      22    5    2    4   0   2/4    50.0     0/0   0.0
D'Angelo Randle        22    5    4    0   0   2/4    50.0     0/0   0.0
Gary Gasol             22    4    0    0   0   2/4    50.0     0/0   0.0

TEAM: FG: 15/21 (71.4%), 3PT: 2/4 (50.0%), REB: 11 (2 off, 9 def), AST: 7, TO: 1
TEAM FOULS: 9 [Team_019 in BONUS]


Team_019
--------------------------------------------------------------------------------
Player                MIN  PTS  REB  AST  TO      FG   FG%      3P   3P%
--------------------------------------------------------------------------------
Rudy Giddey            22    9    0    0   0   3/6    50.0     0/0   0.0
Tobias Hyland          22    8    3    3   0   3/3   100.0     0/0   0.0
Brandon James          22    3    0    1   0   1/3    33.3     0/0   0.0
DeMar James            22    3    2    0   0   2/5    40.0     0/0   0.0

TEAM: FG: 11/21 (52.4%), 3PT: 2/7 (28.6%), REB: 9 (4 off, 5 def), AST: 4, TO: 0
TEAM FOULS: 8 [Team_052 in BONUS]

================================================================================

================================================================================
                       3RD QUARTER - Team_052 vs Team_019                       
================================================================================

[12:00] Team_052 possession (Score: 70-44)
Josh Durant attempts a Midrange. Contested by Brandon James (4.9 feet, MAN). Josh Durant misses. Rebound secured by DeMar James.

[11:43] Team_019 possession (Score: 70-44)
Rudy Giddey attempts a Midrange. Contested by James Paul (3.6 feet, ZONE). Rudy Giddey misses. Rebound secured by Bones Morant.

[11:26] Team_052 possession (Score: 70-44)
Bones Morant attempts a Layup. Contested by D'Angelo Randle (4.0 feet, MAN). BONES MORANT MAKES IT! Assist: Carmelo Middleton
Score: 72-44

[11:07] Team_019 possession (Score: 72-44)
Rudy Giddey attempts a Midrange. Contested by Gary Gasol (4.0 feet, MAN). RUDY GIDDEY MAKES IT!
Score: 72-46

[10:53] Team_052 possession (Score: 72-46)
Bones Morant attempts a 3Pt. Contested by D'Angelo Randle (4.0 feet, ZONE). BONES MORANT MAKES IT! Assist: James Paul
Score: 75-46

[10:39] Team_019 possession (Score: 75-46)
Brandon James attempts a 3Pt. Contested by James Paul (3.4 feet, ZONE). Brandon James misses. Offensive rebound by DeMar James! DeMar James's putback is no good. Rebound secured by Carmelo Middleton.

[10:24] Team_052 possession (Score: 75-46)
FOUL! Shooting foul on Tobias Hyland. James Paul to the line for 2 free throws. [Team fouls: 1] (Tobias Hyland: 1 personal fouls)   FT 1/2: GOOD   FT 2/2: GOOD James Paul makes 2/2 from the line.
Score: 77-46

[10:08] Team_019 possession (Score: 77-46)
Rudy Giddey makes the 3Pt and draws the foul on Gary Gasol! And-1! Rudy Giddey to the line for 1. [Team fouls: 1] (Gary Gasol: 1 personal fouls)   FT 1/1: GOOD Rudy Giddey makes 1/1 from the line.
Score: 77-50

[09:54] Team_052 possession (Score: 77-50)
Carmelo Middleton attempts a 3Pt. Contested by DeMar James (4.6 feet, MAN). Carmelo Middleton misses. Offensive rebound by James Paul! James Paul puts it back in!
Score: 79-50

[09:42] Team_019 possession (Score: 79-50)
DeMar James attempts a Layup. Contested by James Paul (3.8 feet, ZONE). DEMAR JAMES MAKES IT!
Score: 79-52

[09:29] Team_052 possession (Score: 79-52)
FOUL! Shooting foul on Tobias Hyland. James Paul to the line for 2 free throws. [Team fouls: 2] (Tobias Hyland: 2 personal fouls)   FT 1/2: GOOD   FT 2/2: GOOD James Paul makes 2/2 from the line.
Score: 81-52

[09:11] Team_019 possession (Score: 81-52)
Tobias Hyland drives to the basket... Tobias Hyland throws a bad pass! Stolen by James Paul! TURNOVER! (live ball)

[08:55] Team_052 possession (Score: 81-52)
Bones Morant drives to the basket... Bones Morant commits a violation (traveling/carry)! TURNOVER! (dead ball)

[08:39] Team_019 possession (Score: 81-52)
FOUL! Holding foul on Carmelo Middleton. [Team fouls: 2] No free throws, side out. (Carmelo Middleton: 1 personal fouls)

[08:24] Team_019 possession (Score: 81-52)
Tobias Hyland attempts a Layup. Contested by James Paul (3.5 feet, ZONE). TOBIAS HYLAND MAKES IT!
Score: 81-54

[08:10] Team_052 possession (Score: 81-54)
James Paul makes the Layup and draws the foul on DeMar James! And-1! James Paul to the line for 1. [Team fouls: 3] (DeMar James: 1 personal fouls)   FT 1/1: GOOD James Paul makes 1/1 from the line.
Score: 84-54

[07:56] Team_019 possession (Score: 84-54)
Tobias Hyland attempts a Midrange. Contested by James Paul (3.5 feet, MAN). Tobias Hyland misses. Offensive rebound by DeMar James! DeMar James puts it back in!
Score: 84-56

[07:44] Team_052 possession (Score: 84-56)
Gary Gasol attempts a Midrange. Contested by D'Angelo Randle (4.1 feet, ZONE). GARY GASOL MAKES IT! Assist: Josh Durant
Score: 86-56

[07:34] Team_019 possession (Score: 86-56)
D'Angelo Randle attempts a 3Pt. Contested by Gary Gasol (4.0 feet, ZONE). D'Angelo Randle misses. Rebound secured by James Paul.

[07:18] Team_052 possession (Score: 86-56)
Carmelo Middleton attempts a Midrange. Contested by DeMar James (4.6 feet, MAN). Carmelo Middleton misses. Rebound secured by DeMar James.

[07:04] Team_019 possession (Score: 86-56)
Tobias Hyland drives, James Paul stays with him. Tobias Hyland attempts a Layup. Contested by James Paul (3.5 feet, MAN). Tobias Hyland misses. Rebound secured by Bones Morant.

[06:47] Team_052 possession (Score: 86-56)
Bones Morant attempts a Midrange. Contested by D'Angelo Randle (4.0 feet, MAN). BONES MORANT MAKES IT!
Score: 88-56

[06:31] Team_019 possession (Score: 88-56)
D'Angelo Randle attempts a Midrange. Contested by Bones Morant (3.8 feet, ZONE). D'ANGELO RANDLE MAKES IT! Assist: Rudy Giddey
Score: 88-58

[06:17] Team_052 possession (Score: 88-58)
Gary Gasol attempts a 3Pt. Contested by D'Angelo Randle (4.1 feet, ZONE). Gary Gasol misses. Rebound secured by DeMar James.

[06:04] Team_019 possession (Score: 88-58)
Tobias Hyland attempts a 3Pt. Contested by Bones Morant (3.6 feet, ZONE). Tobias Hyland misses. Rebound secured by James Paul.

[05:49] Team_052 possession (Score: 88-58)
Bones Morant attempts a Midrange. Contested by Brandon James (5.5 feet, ZONE). BONES MORANT MAKES IT!
Score: 90-58

[05:35] Team_019 possession (Score: 90-58)
DeMar James attempts a Midrange. Contested by Carmelo Middleton (4.7 feet, MAN). DeMar James misses. Rebound secured by Bones Morant.

[05:16] Team_052 possession (Score: 90-58)
FOUL! Holding foul on Rudy Giddey. [Team fouls: 4] No free throws, side out. (Rudy Giddey: 1 personal fouls)

[04:57] Team_052 possession (Score: 90-58)
Carmelo Middleton drives and kicks out. James Paul attempts a Midrange. Contested by Tobias Hyland (5.7 feet, ZONE). James Paul misses. Rebound secured by D'Angelo Randle.

[04:42] Team_019 possession (Score: 90-58)
Brandon James drives and kicks out. D'Angelo Randle attempts a 3Pt. Contested by Bones Morant (3.6 feet, MAN). D'Angelo Randle misses. Rebound secured by Carmelo Middleton.

[04:29] Team_052 possession (Score: 90-58)
FOUL! Holding foul on Brandon James. [IN THE BONUS! 5 team fouls] Josh Durant to the line for 2 free throws. (Brandon James: 1 personal fouls)   FT 1/2: GOOD   FT 2/2: GOOD Josh Durant makes 2/2 from the line.
Score: 92-58

[04:15] Team_019 possession (Score: 92-58)
DeMar James drives, Carmelo Middleton stays with him. DeMar James attempts a Layup. Contested by Carmelo Middleton (4.7 feet, MAN). DeMar James misses. Offensive rebound by DeMar James! DeMar James puts it back in!
Score: 92-60

[03:58] Team_052 possession (Score: 92-60)
Bones Morant drives to the basket... Bones Morant loses control! Ball rolls out of bounds! TURNOVER! (dead ball)

[03:42] Team_019 possession (Score: 92-60)
D'Angelo Randle drives to the basket... FOUL! Offensive foul on D'Angelo Randle! James Paul drew the charge! [Team fouls: 6] (D'Angelo Randle: 1 personal fouls) TURNOVER! (dead ball)

[03:29] Team_052 possession (Score: 92-60)
FOUL! Shooting foul on D'Angelo Randle. Josh Durant to the line for 2 free throws. [BONUS: 7 team fouls] (D'Angelo Randle: 2 personal fouls)   FT 1/2: GOOD   FT 2/2: GOOD Josh Durant makes 2/2 from the line.
Score: 94-60

[03:13] Team_019 possession (Score: 94-60)
Brandon James drives, picks up James Paul. Help arrives from Josh Durant! Brandon James attempts a Layup. Contested by Josh Durant (3.6 feet, ZONE). Brandon James misses. Rebound secured by Bones Morant.

[02:59] Team_052 possession (Score: 94-60)
Carmelo Middleton attempts a Layup. Contested by DeMar James (4.8 feet, MAN). CARMELO MIDDLETON MAKES IT!
Score: 96-60

[02:44] Team_019 possession (Score: 96-60)
FOUL! Shooting foul on Josh Durant. D'Angelo Randle to the line for 2 free throws. [Team fouls: 3] (Josh Durant: 1 personal fouls)   FT 1/2: MISS   FT 2/2: GOOD D'Angelo Randle makes 1/2 from the line.
Score: 96-61

[02:35] Team_052 possession (Score: 96-61)
FOUL! Holding foul on Rudy Giddey. [IN THE BONUS! 8 team fouls] Gary Gasol to the line for 2 free throws. (Rudy Giddey: 2 personal fouls)   FT 1/2: GOOD   FT 2/2: MISS Gary Gasol makes 1/2 from the line. Rebound secured by DeMar James.
Score: 97-61

[02:26] Team_019 possession (Score: 97-61)
Tobias Hyland attempts a 3Pt. Contested by Gary Gasol (4.0 feet, ZONE). Tobias Hyland misses. Offensive rebound by DeMar James! DeMar James's putback is no good. Rebound secured by Carmelo Middleton.

[02:12] Team_052 possession (Score: 97-61)
Gary Gasol attempts a 3Pt. Contested by D'Angelo Randle (4.4 feet, ZONE). Gary Gasol misses. Rebound secured by Tobias Hyland.

[02:00] Team_019 possession (Score: 97-61)
Rudy Giddey drives and kicks out. DeMar James attempts a Midrange. Contested by Josh Durant (3.6 feet, ZONE). DeMar James misses. Rebound secured by James Paul.

[01:45] Team_052 possession (Score: 97-61)
Carmelo Middleton attempts a Layup. Contested by DeMar James (4.9 feet, ZONE). Carmelo Middleton misses. Rebound secured by Tobias Hyland.

[01:31] Team_019 possession (Score: 97-61)
Brandon James attempts a Layup. BLOCKED BY JAMES PAUL! Ball is loose! Rebound secured by Carmelo Middleton.

[01:19] Team_052 possession (Score: 97-61)
Josh Durant attempts a 3Pt. Contested by D'Angelo Randle (3.9 feet, ZONE). Josh Durant misses. Rebound secured by DeMar James.

[01:05] Team_019 possession (Score: 97-61)
Rudy Giddey attempts a 3Pt. Contested by Bones Morant (4.2 feet, ZONE). Rudy Giddey misses. Rebound secured by Bones Morant.

[00:54] Team_052 possession (Score: 97-61)
FOUL! Shooting foul on D'Angelo Randle. Josh Durant to the line for 3 free throws. [BONUS: 9 team fouls] (D'Angelo Randle: 3 personal fouls)   FT 1/3: GOOD   FT 2/3: GOOD   FT 3/3: GOOD Josh Durant makes 3/3 from the line.
Score: 100-61

[00:35] Team_019 possession (Score: 100-61)
Rudy Giddey attempts a 3Pt. Contested by Gary Gasol (4.4 feet, MAN). RUDY GIDDEY MAKES IT! Assist: DeMar James
Score: 100-64

[00:16] Team_052 possession (Score: 100-64)
James Paul attempts a Midrange. Wide open! Tobias Hyland is 6.5 feet away. [MAN] JAMES PAUL MAKES IT! Assist: Carmelo Middleton
Score: 102-64

[00:01] Team_019 possession (Score: 102-64)
DeMar James attempts a Layup. Contested by Carmelo Middleton (5.2 feet, MAN). DeMar James misses. Rebound secured by James Paul.

================================================================================
                              3RD QUARTER COMPLETE                              
================================================================================

3RD QUARTER SCORE: Team_052 32, Team_019 20

BOX SCORE:
================================================================================

Team_052
--------------------------------------------------------------------------------
Player                MIN  PTS  REB  AST  TO      FG   FG%      3P   3P%
--------------------------------------------------------------------------------
James Paul             36   11    5    1   0   5/5   100.0     0/0   0.0
Bones Morant           36    9    5    0   0   4/4   100.0     0/0   0.0
Josh Durant            36    7    0    1   0   3/5    60.0     0/0   0.0
Carmelo Middleton      34    2    4    2   0   1/4    25.0     0/0   0.0
Gary Gasol             34    2    0    0   0   1/3    33.3     0/0   0.0

TEAM: FG: 14/22 (63.6%), 3PT: 3/6 (50.0%), REB: 12 (1 off, 11 def), AST: 4, TO: 2
TEAM FOULS: 3


Team_019
--------------------------------------------------------------------------------
Player                MIN  PTS  REB  AST  TO      FG   FG%      3P   3P%
--------------------------------------------------------------------------------
Rudy Giddey            34    9    0    1   0   3/6    50.0     0/0   0.0
DeMar James            34    6    7    1   0   3/5    60.0     0/0   0.0
D'Angelo Randle        34    3    1    0   0   2/3    66.7     0/0   0.0
Tobias Hyland          34    2    2    0   0   1/4    25.0     0/0   0.0
Brandon James          34    0    0    0   0   0/4     0.0     0/0   0.0

TEAM: FG: 9/22 (40.9%), 3PT: 2/7 (28.6%), REB: 12 (4 off, 8 def), AST: 2, TO: 2
TEAM FOULS: 9 [Team_052 in BONUS]

================================================================================

================================================================================
                       4TH QUARTER - Team_052 vs Team_019                       
================================================================================

[12:00] Team_052 possession (Score: 102-64)
James Paul attempts a Midrange. Contested by Rudy Giddey (5.9 feet, ZONE). JAMES PAUL MAKES IT!
Score: 104-64

[11:45] Team_019 possession (Score: 104-64)
Rudy Giddey attempts a 3Pt. Contested by Gary Gasol (4.3 feet, MAN). Rudy Giddey misses. Rebound secured by Carmelo Middleton.

[11:28] Team_052 possession (Score: 104-64)
FOUL! Holding foul on Tobias Hyland. [Team fouls: 1] No free throws, side out. (Tobias Hyland: 1 personal fouls)

[11:16] Team_052 possession (Score: 104-64)
FOUL! Shooting foul on Brandon James. Gary Gasol to the line for 2 free throws. [Team fouls: 2] (Brandon James: 1 personal fouls)   FT 1/2: GOOD   FT 2/2: GOOD Gary Gasol makes 2/2 from the line.
Score: 106-64

[11:00] Team_019 possession (Score: 106-64)
Brandon James attempts a 3Pt. Contested by Josh Durant (3.7 feet, MAN). Brandon James misses. Rebound secured by James Paul.

[10:51] Team_052 possession (Score: 106-64)
Josh Durant attempts a Midrange. Contested by Brandon James (5.3 feet, MAN). JOSH DURANT MAKES IT!
Score: 108-64

[10:38] Team_019 possession (Score: 108-64)
DeMar James drives to the basket... DeMar James throws a bad pass out of bounds! TURNOVER! (dead ball)

[10:38] Substitution (Team_052): Gary Gasol OUT → Jimmy Doncic IN (stamina_rule2)

[10:38] Substitution (Team_052): Josh Durant OUT → Carmelo Giddey IN (stamina_rule2)

[10:38] Substitution (Team_052): Bones Morant OUT → Donovan Stewart IN (stamina_rule2)

[10:38] Substitution (Team_052): James Paul OUT → Jalen Haliburton IN (stamina_rule2)

[10:38] Substitution (Team_052): Carmelo Middleton OUT → Carmelo Beal IN (stamina_rule2)

[10:38] Substitution (Team_019): Rudy Giddey OUT → Gary Ginobili IN (stamina_rule2)

[10:38] Substitution (Team_019): Brandon James OUT → Jalen Turner IN (stamina_rule2)

[10:38] Substitution (Team_019): D'Angelo Randle OUT → Blake LaVine IN (stamina_rule2)

[10:38] Substitution (Team_019): Tobias Hyland OUT → Shai Ingram IN (stamina_rule2)

[10:38] Substitution (Team_019): DeMar James OUT → Tim Jordan IN (stamina_rule2)

[10:21] Team_052 possession (Score: 108-64)
Jimmy Doncic drives and kicks out. Carmelo Beal attempts a Midrange. Contested by Blake LaVine (4.7 feet, ZONE). Carmelo Beal misses. Rebound secured by Tim Jordan.

[10:08] Team_019 possession (Score: 108-64)
Jalen Turner attempts a Midrange. Contested by Jalen Haliburton (4.8 feet, ZONE). Jalen Turner misses. Rebound secured by Jalen Haliburton.

[09:53] Team_052 possession (Score: 108-64)
FOUL! Reach-in foul on Shai Ingram during the drive. [Team fouls: 3] No free throws, side out. (Shai Ingram: 1 personal fouls)

[09:43] Team_052 possession (Score: 108-64)
Carmelo Giddey attempts a 3Pt. Contested by Blake LaVine (5.3 feet, ZONE). Carmelo Giddey misses. Rebound secured by Blake LaVine.

[09:29] Team_019 possession (Score: 108-64)
Shai Ingram attempts a Layup. Contested by Jalen Haliburton (4.5 feet, MAN). SHAI INGRAM MAKES IT!
Score: 108-66

[09:15] Team_052 possession (Score: 108-66)
Carmelo Beal attempts a Layup. Contested by Shai Ingram (4.3 feet, ZONE). CARMELO BEAL MAKES IT!
Score: 110-66

[09:03] Team_019 possession (Score: 110-66)
Shai Ingram throws a bad pass out of bounds! TURNOVER! (dead ball)

[08:43] Team_052 possession (Score: 110-66)
Carmelo Beal attempts a Midrange. Contested by Jalen Turner (3.7 feet, ZONE). Carmelo Beal misses. Offensive rebound by Jalen Haliburton! Jalen Haliburton kicks it out.

[08:29] Team_052 possession (Score: 110-66)
Jimmy Doncic drives and kicks out. Jimmy Doncic attempts a 3Pt. Contested by Gary Ginobili (5.8 feet, MAN). Jimmy Doncic misses. Rebound secured by Blake LaVine.

[08:17] Team_019 possession (Score: 110-66)
Shai Ingram attempts a 3Pt. Contested by Jalen Haliburton (4.5 feet, MAN). SHAI INGRAM MAKES IT! Assist: Tim Jordan
Score: 110-69

[08:07] Team_052 possession (Score: 110-69)
Carmelo Beal makes the Layup and draws the foul on Shai Ingram! And-1! Carmelo Beal to the line for 1. [Team fouls: 4] (Shai Ingram: 2 personal fouls)   FT 1/1: GOOD Carmelo Beal makes 1/1 from the line.
Score: 113-69

[07:54] Team_019 possession (Score: 113-69)
Jalen Turner attempts a 3Pt. Contested by Jalen Haliburton (4.8 feet, ZONE). Jalen Turner misses. Rebound secured by Carmelo Beal.

[07:40] Team_052 possession (Score: 113-69)
Carmelo Giddey makes the Layup and draws the foul on Shai Ingram! And-1! Carmelo Giddey to the line for 1. [BONUS: 5 team fouls] (Shai Ingram: 3 personal fouls)   FT 1/1: GOOD Carmelo Giddey makes 1/1 from the line.
Score: 116-69

[07:27] Team_019 possession (Score: 116-69)
Tim Jordan attempts a 3Pt. Contested by Jalen Haliburton (4.5 feet, ZONE). Tim Jordan misses. Offensive rebound by Tim Jordan! Tim Jordan kicks it out.

[07:14] Team_019 possession (Score: 116-69)
Gary Ginobili attempts a 3Pt. Contested by Donovan Stewart (5.3 feet, ZONE). GARY GINOBILI MAKES IT! Assist: Tim Jordan
Score: 116-72

[06:59] Team_052 possession (Score: 116-72)
Carmelo Giddey attempts a 3Pt. Contested by Blake LaVine (5.3 feet, ZONE). CARMELO GIDDEY MAKES IT! Assist: Jimmy Doncic
Score: 119-72

[06:46] Team_019 possession (Score: 119-72)
Tim Jordan attempts a Layup. Contested by Carmelo Beal (3.5 feet, MAN). Tim Jordan misses. Rebound secured by Donovan Stewart.

[06:30] Team_052 possession (Score: 119-72)
Jalen Haliburton drives and kicks out. Donovan Stewart attempts a Midrange. Contested by Blake LaVine (4.7 feet, MAN). Donovan Stewart misses. Rebound secured by Blake LaVine.

[06:17] Team_019 possession (Score: 119-72)
Blake LaVine makes the Layup and draws the foul on Carmelo Beal! And-1! Blake LaVine to the line for 1. [Team fouls: 1] (Carmelo Beal: 1 personal fouls)   FT 1/1: MISS Blake LaVine makes 0/1 from the line. Rebound secured by Jalen Haliburton.
Score: 119-74

[06:02] Team_052 possession (Score: 119-74)
Carmelo Giddey attempts a Midrange. Contested by Jalen Turner (4.5 feet, MAN). Carmelo Giddey misses. Rebound secured by Shai Ingram.

[05:50] Team_019 possession (Score: 119-74)
Gary Ginobili attempts a Midrange. Contested by Jimmy Doncic (5.2 feet, MAN). Gary Ginobili misses. Rebound secured by Jalen Haliburton.

[05:35] Team_052 possession (Score: 119-74)
Carmelo Giddey makes the Layup and draws the foul on Jalen Turner! And-1! Carmelo Giddey to the line for 1. [BONUS: 6 team fouls] (Jalen Turner: 1 personal fouls)   FT 1/1: MISS Carmelo Giddey makes 0/1 from the line. Rebound secured by Tim Jordan.
Score: 121-74

[05:17] Team_019 possession (Score: 121-74)
Shai Ingram attempts a 3Pt. Contested by Jalen Haliburton (4.5 feet, MAN). Shai Ingram misses. Rebound secured by Carmelo Beal.

[05:06] Team_052 possession (Score: 121-74)
Carmelo Giddey drives, Jalen Turner stays with him. Carmelo Giddey attempts a Layup. Contested by Jalen Turner (4.5 feet, MAN). CARMELO GIDDEY MAKES IT!
Score: 123-74

[04:49] Team_019 possession (Score: 123-74)
Blake LaVine attempts a Midrange. Contested by Jalen Haliburton (4.7 feet, ZONE). BLAKE LAVINE MAKES IT!
Score: 123-76

[04:30] Team_052 possession (Score: 123-76)
FOUL! Shooting foul on Shai Ingram. Carmelo Giddey to the line for 2 free throws. [BONUS: 7 team fouls] (Shai Ingram: 4 personal fouls)   FT 1/2: GOOD   FT 2/2: GOOD Carmelo Giddey makes 2/2 from the line.
Score: 125-76

[04:15] Team_019 possession (Score: 125-76)
FOUL! Shooting foul on Carmelo Beal. Tim Jordan to the line for 2 free throws. [Team fouls: 2] (Carmelo Beal: 2 personal fouls)   FT 1/2: GOOD   FT 2/2: MISS Tim Jordan makes 1/2 from the line. Rebound secured by Jalen Haliburton.
Score: 125-77

[03:59] Team_052 possession (Score: 125-77)
FOUL! Offensive foul on Donovan Stewart! Blake LaVine drew the charge! [Team fouls: 3] (Donovan Stewart: 1 personal fouls) TURNOVER! (dead ball)

[03:43] Team_019 possession (Score: 125-77)
Gary Ginobili attempts a 3Pt. Contested by Jimmy Doncic (5.2 feet, MAN). Gary Ginobili misses. Rebound secured by Donovan Stewart.

[03:30] Team_052 possession (Score: 125-77)
Donovan Stewart attempts a Midrange. Contested by Blake LaVine (4.9 feet, MAN). Donovan Stewart misses. Rebound secured by Shai Ingram.

[03:16] Team_019 possession (Score: 125-77)
Blake LaVine attempts a Midrange. Contested by Jimmy Doncic (4.9 feet, ZONE). BLAKE LAVINE MAKES IT!
Score: 125-79

[03:03] Team_052 possession (Score: 125-79)
Jalen Haliburton drives, picks up Shai Ingram. Help arrives from Jalen Turner! Jalen Haliburton attempts a Layup. Contested by Jalen Turner (4.8 feet, MAN). JALEN HALIBURTON MAKES IT! Assist: Carmelo Giddey
Score: 127-79

[02:49] Team_019 possession (Score: 127-79)
Blake LaVine drives, Donovan Stewart stays with him. Blake LaVine attempts a Layup. Contested by Donovan Stewart (5.0 feet, MAN). BLAKE LAVINE MAKES IT!
Score: 127-81

[02:39] Team_052 possession (Score: 127-81)
Jimmy Doncic attempts a 3Pt. Contested by Blake LaVine (4.7 feet, ZONE). JIMMY DONCIC MAKES IT! Assist: Carmelo Giddey
Score: 130-81

[02:23] Team_019 possession (Score: 130-81)
FOUL! Holding foul on Carmelo Beal. [Team fouls: 4] No free throws, side out. (Carmelo Beal: 3 personal fouls)

[02:08] Team_019 possession (Score: 130-81)
Gary Ginobili attempts a Layup. Contested by Jimmy Doncic (5.3 feet, MAN). GARY GINOBILI MAKES IT!
Score: 130-83

[01:53] Team_052 possession (Score: 130-83)
Jalen Haliburton attempts a Midrange. Contested by Shai Ingram (4.9 feet, MAN). Jalen Haliburton misses. Offensive rebound by Jalen Haliburton! Jalen Haliburton kicks it out.

[01:36] Team_052 possession (Score: 130-83)
Carmelo Beal drives, Shai Ingram stays with him. Carmelo Beal attempts a Dunk. Contested by Shai Ingram (4.6 feet, ZONE). CARMELO BEAL MAKES IT!
Score: 132-83

[01:21] Team_019 possession (Score: 132-83)
Jalen Turner drives to the basket... FOUL! Offensive foul on Jalen Turner! Carmelo Giddey drew the charge! [Team fouls: 8] (Jalen Turner: 2 personal fouls) TURNOVER! (dead ball)

[01:09] Team_052 possession (Score: 132-83)
FOUL! Holding foul on Blake LaVine. [IN THE BONUS! 9 team fouls] Donovan Stewart to the line for 2 free throws. (Blake LaVine: 1 personal fouls)   FT 1/2: GOOD   FT 2/2: GOOD Donovan Stewart makes 2/2 from the line.
Score: 134-83

[00:56] Team_019 possession (Score: 134-83)
Shai Ingram attempts a 3Pt. Contested by Donovan Stewart (4.9 feet, ZONE). Shai Ingram misses. Rebound secured by Donovan Stewart.

[00:41] Team_052 possession (Score: 134-83)
Jimmy Doncic drives and kicks out. Donovan Stewart attempts a 3Pt. Contested by Blake LaVine (5.0 feet, MAN). Donovan Stewart misses. Offensive rebound by Carmelo Beal! Carmelo Beal kicks it out.

[00:31] Team_052 possession (Score: 134-83)
Carmelo Giddey attempts a Midrange. Contested by Jalen Turner (4.8 feet, MAN). Carmelo Giddey misses. Rebound secured by Tim Jordan.

[00:17] Team_019 possession (Score: 134-83)
Shai Ingram throws a bad pass out of bounds! TURNOVER! (dead ball)

================================================================================
                              4TH QUARTER COMPLETE                              
================================================================================

4TH QUARTER SCORE: Team_052 32, Team_019 19

BOX SCORE:
================================================================================

Team_052
--------------------------------------------------------------------------------
Player                MIN  PTS  REB  AST  TO      FG   FG%      3P   3P%
--------------------------------------------------------------------------------
Carmelo Giddey         10   10    0    2   0   4/8    50.0     0/0   0.0
Carmelo Beal           12    7    3    0   0   3/3   100.0     0/0   0.0
Jimmy Doncic           12    3    0    1   0   1/3    33.3     0/0   0.0
James Paul             38    2    1    0   0   1/1   100.0     0/0   0.0
Gary Gasol             36    2    0    0   0   1/1   100.0     0/0   0.0
Josh Durant            38    2    0    0   0   1/1   100.0     0/0   0.0
Jalen Haliburton       10    2    6    0   0   1/2    50.0     0/0   0.0
Donovan Stewart        10    2    3    0   0   1/2    50.0     0/0   0.0
Carmelo Middleton      36    0    1    0   0   0/0     0.0     0/0   0.0

TEAM: FG: 13/21 (61.9%), 3PT: 2/3 (66.7%), REB: 14 (3 off, 11 def), AST: 3, TO: 1
TEAM FOULS: 4


Team_019
--------------------------------------------------------------------------------
Player                MIN  PTS  REB  AST  TO      FG   FG%      3P   3P%
--------------------------------------------------------------------------------
Blake LaVine           12    6    3    0   0   3/4    75.0     0/0   0.0
Shai Ingram            12    5    2    0   0   2/4    50.0     0/0   0.0
Gary Ginobili          12    5    0    0   0   2/4    50.0     0/0   0.0
Rudy Giddey            36    0    0    0   0   0/1     0.0     0/0   0.0
Brandon James          36    0    0    0   0   0/1     0.0     0/0   0.0
Tim Jordan             12    0    4    2   0   0/2     0.0     0/0   0.0
Jalen Turner           12    0    0    0   0   0/2     0.0     0/0   0.0

TEAM: FG: 7/18 (38.9%), 3PT: 2/8 (25.0%), REB: 9 (1 off, 8 def), AST: 2, TO: 4
TEAM FOULS: 9 [Team_052 in BONUS]

================================================================================

================================================================================
                               FULL GAME COMPLETE                               
================================================================================

FINAL SCORE: Team_052 134, Team_019 83

SCORING BY QUARTER:
--------------------------------------------------------------------------------
Team                     Q1     Q2     Q3     Q4    FINAL
--------------------------------------------------------------------------------
Team_052                 35     35     32     32      134
Team_019                 14     30     20     19       83
--------------------------------------------------------------------------------

FULL GAME BOX SCORE:
================================================================================

Team_052
--------------------------------------------------------------------------------
Player                MIN  PTS  REB  AST  TO      FG   FG%      3P   3P%      FT STL BLK
--------------------------------------------------------------------------------
Josh Durant            38   20    0    3   1   6/10   60.0   1/3    33.3   8/8     0   0
Bones Morant           38   24   11    5   1  14/15   93.3   4/5    80.0   4/4     1   0
James Paul             38   32   20    3   1  13/13  100.0   2/2   100.0   9/11    1   1
Gary Gasol             36   18    0    1   2   6/11   54.5   2/5    40.0   4/5     1   0
Carmelo Middleton      36   12   10    7   2   6/11   54.5   3/3   100.0   0/4     0   0
Jimmy Doncic           12    3    0    1   0   1/4    25.0   1/2    50.0   0/0     0   0
Carmelo Beal           12    7    4    0   0   3/3   100.0   0/0     0.0   1/1     0   0
Carmelo Giddey         10   10    0    2   0   4/8    50.0   1/2    50.0   3/4     0   0
Donovan Stewart        10    2    3    0   1   0/1     0.0   0/0     0.0   2/2     0   0
Jalen Haliburton       10    2    6    0   0   1/2    50.0   0/0     0.0   0/0     0   0

TEAM: FG: 56/81 (69.1%), 3PT: 14/22 (63.6%), REB: 52 (12 off, 40 def), AST: 22, TO: 8


Team_019
--------------------------------------------------------------------------------
Player                MIN  PTS  REB  AST  TO      FG   FG%      3P   3P%      FT STL BLK
--------------------------------------------------------------------------------
Rudy Giddey            36   20    0    1   1   6/14   42.9   3/9    33.3   2/3     0   0
Brandon James          36    5    0    1   1   1/10   10.0   0/2     0.0   1/1     0   0
D'Angelo Randle        36   11    7    2   0   6/11   54.5   1/6    16.7   4/5     0   1
Tobias Hyland          36   10    6    3   3   5/10   50.0   0/2     0.0   4/4     0   0
DeMar James            36   13   10    2   2   5/10   50.0   0/0     0.0   1/2     1   0
Gary Ginobili          12    5    0    1   0   2/4    50.0   1/2    50.0   0/0     0   0
Jalen Turner           12    3    0    0   0   0/3     0.0   0/1     0.0   0/0     0   0
Blake LaVine           12    6    4    0   2   3/5    60.0   0/1     0.0   0/1     0   0
Shai Ingram            12    5    2    0   2   2/4    50.0   1/3    33.3   0/0     0   0
Tim Jordan             12    0    4    2   0   1/3    33.3   0/0     0.0   1/2     0   0

TEAM: FG: 33/76 (43.4%), 3PT: 6/26 (23.1%), REB: 35 (11 off, 24 def), AST: 12, TO: 11

================================================================================
