================================================================================
                        FULL GAME - Team_091 vs Team_065                        
================================================================================

================================================================================
                       1ST QUARTER - Team_091 vs Team_065                       
================================================================================

[12:00] Team_091 possession (Score: 0-0)
Kevin Simons attempts a 3Pt. Contested by Russell Wade (3.5 feet, MAN). Kevin Simons misses. Rebound secured by RJ Harden.

[11:48] Team_065 possession (Score: 0-0)
FOUL! Reach-in foul on Kevin Simons during the drive. [Team fouls: 1] No free throws, side out. (Kevin Simons: 1 personal fouls)

[11:31] Team_065 possession (Score: 0-0)
Russell Wade makes the Midrange and draws the foul on Isaiah Siakam! And-1! Russell Wade to the line for 1. [Team fouls: 2] (Isaiah Siakam: 1 personal fouls)   FT 1/1: GOOD Russell Wade makes 1/1 from the line.
Score: 0-3

[11:16] Team_091 possession (Score: 0-3)
FOUL! Shooting foul on Russell Wade. Kevin Simons to the line for 2 free throws. [Team fouls: 1] (Russell Wade: 1 personal fouls)   FT 1/2: MISS   FT 2/2: GOOD Kevin Simons makes 1/2 from the line.
Score: 1-3

[11:06] Team_065 possession (Score: 1-3)
RJ Harden attempts a Layup. Contested by Kyrie Rozier (4.5 feet, MAN). RJ HARDEN MAKES IT! Assist: Russell Wade
Score: 1-5

[10:53] Team_091 possession (Score: 1-5)
FOUL! Shooting foul on Russell Wade. D'Angelo Ingram to the line for 2 free throws. [Team fouls: 2] (Russell Wade: 2 personal fouls)   FT 1/2: GOOD   FT 2/2: GOOD D'Angelo Ingram makes 2/2 from the line.
Score: 3-5

[10:39] Team_065 possession (Score: 3-5)
Paul Williamson drives and kicks out. Paul Williamson attempts a 3Pt. Contested by Kyrie Rozier (4.1 feet, ZONE). PAUL WILLIAMSON MAKES IT!
Score: 3-8

[10:29] Team_091 possession (Score: 3-8)
Kevin Simons makes the Layup and draws the foul on Russell Wade! And-1! Kevin Simons to the line for 1. [Team fouls: 3] (Russell Wade: 3 personal fouls)   FT 1/1: MISS Kevin Simons makes 0/1 from the line. Rebound secured by Russell Wade.
Score: 5-8

[10:09] Team_065 possession (Score: 5-8)
FOUL! Holding foul on D'Angelo Ingram. [Team fouls: 3] No free throws, side out. (D'Angelo Ingram: 1 personal fouls)

[09:53] Team_065 possession (Score: 5-8)
Manu McGrady drives, Kevin Simons stays with him. Manu McGrady attempts a Dunk. Contested by Kevin Simons (3.5 feet, ZONE). Manu McGrady misses. Offensive rebound by Manu McGrady! Manu McGrady kicks it out.

[09:41] Team_065 possession (Score: 5-8)
FOUL! Reach-in foul on Kevin Simons during the drive. [Team fouls: 4] No free throws, side out. (Kevin Simons: 2 personal fouls)

[09:27] Team_065 possession (Score: 5-8)
Russell Wade drives and kicks out. Manu McGrady attempts a 3Pt. Contested by Kyrie Rozier (4.1 feet, ZONE). MANU MCGRADY MAKES IT! Assist: Paul Williamson
Score: 5-11

[09:14] Team_091 possession (Score: 5-11)
Isaiah Siakam drives to the basket... FOUL! Offensive foul on Isaiah Siakam! Karl Booker drew the charge! [Team fouls: 5] (Isaiah Siakam: 2 personal fouls) TURNOVER! (dead ball)

[09:01] Team_065 possession (Score: 5-11)
Karl Booker attempts a Layup. Contested by Kevin Simons (3.5 feet, ZONE). Karl Booker misses. Rebound secured by Rudy Bridges.

[08:45] Team_091 possession (Score: 5-11)
Rudy Bridges attempts a Midrange. Contested by Manu McGrady (4.6 feet, MAN). Rudy Bridges misses. Rebound secured by Russell Wade.

[08:29] Team_065 possession (Score: 5-11)
RJ Harden attempts a 3Pt. Contested by Kyrie Rozier (4.5 feet, MAN). RJ Harden misses. Rebound secured by Kevin Simons.

[08:14] Team_091 possession (Score: 5-11)
FOUL! Holding foul on Russell Wade. [Team fouls: 4] No free throws, side out. (Russell Wade: 4 personal fouls)

[08:02] Team_091 possession (Score: 5-11)
Kevin Simons attempts a Layup. Contested by Russell Wade (3.5 feet, MAN). KEVIN SIMONS MAKES IT! Assist: Kyrie Rozier
Score: 7-11

[07:44] Team_065 possession (Score: 7-11)
FOUL! Holding foul on D'Angelo Ingram. [IN THE BONUS! 6 team fouls] Russell Wade to the line for 2 free throws. (D'Angelo Ingram: 2 personal fouls)   FT 1/2: GOOD   FT 2/2: GOOD Russell Wade makes 2/2 from the line.
Score: 7-13

[07:29] Team_091 possession (Score: 7-13)
D'Angelo Ingram attempts a Layup. Contested by Russell Wade (4.0 feet, ZONE). D'ANGELO INGRAM MAKES IT! Assist: Isaiah Siakam
Score: 9-13

[07:16] Team_065 possession (Score: 9-13)
Russell Wade attempts a Midrange. Contested by Kevin Simons (3.6 feet, ZONE). RUSSELL WADE MAKES IT!
Score: 9-15

[07:03] Team_091 possession (Score: 9-15)
Rudy Bridges attempts a Midrange. Contested by Manu McGrady (4.6 feet, ZONE). RUDY BRIDGES MAKES IT! Assist: Isaiah Siakam
Score: 11-15

[06:49] Team_065 possession (Score: 11-15)
Manu McGrady drives and kicks out. FOUL! Shooting foul on Isaiah Siakam. Paul Williamson to the line for 2 free throws. [BONUS: 7 team fouls] (Isaiah Siakam: 3 personal fouls)   FT 1/2: GOOD   FT 2/2: GOOD Paul Williamson makes 2/2 from the line.
Score: 11-17

[06:35] Team_091 possession (Score: 11-17)
Kevin Simons attempts a 3Pt. Contested by Russell Wade (3.5 feet, MAN). Kevin Simons misses. Offensive rebound by Kevin Simons! Kevin Simons's putback is no good. Rebound secured by RJ Harden.

[06:20] Team_065 possession (Score: 11-17)
Paul Williamson drives and kicks out. RJ Harden makes the Midrange and draws the foul on Isaiah Siakam! And-1! RJ Harden to the line for 1. [BONUS: 8 team fouls] (Isaiah Siakam: 4 personal fouls)   FT 1/1: GOOD RJ Harden makes 1/1 from the line.
Score: 11-20

[06:04] Team_091 possession (Score: 11-20)
Kevin Simons drives to the basket... Kevin Simons throws a bad pass! Stolen by Russell Wade! TURNOVER! (live ball)

[05:54] Team_065 possession (Score: 11-20)
RJ Harden attempts a 3Pt. Contested by Kyrie Rozier (4.5 feet, ZONE). RJ Harden misses. Rebound secured by Rudy Bridges.

[05:38] Team_091 possession (Score: 11-20)
Kyrie Rozier attempts a Midrange. Contested by RJ Harden (4.0 feet, ZONE). Kyrie Rozier misses. Rebound secured by Russell Wade.

[05:24] Team_065 possession (Score: 11-20)
Manu McGrady attempts a 3Pt. Contested by Rudy Bridges (4.3 feet, MAN). Manu McGrady misses. Offensive rebound by Russell Wade! Russell Wade's putback is no good. Offensive rebound by Russell Wade! Russell Wade kicks it out.

[05:09] Team_065 possession (Score: 11-20)
Karl Booker drives, picks up Kevin Simons. Help arrives from Kyrie Rozier! Karl Booker attempts a Layup. Contested by Kyrie Rozier (3.6 feet, MAN). KARL BOOKER MAKES IT! Assist: Paul Williamson
Score: 11-22

[04:58] Team_091 possession (Score: 11-22)
FOUL! Shooting foul on Russell Wade. Kevin Simons to the line for 2 free throws. [BONUS: 5 team fouls] (Russell Wade: 5 personal fouls)   FT 1/2: GOOD   FT 2/2: GOOD Kevin Simons makes 2/2 from the line.
Score: 13-22

[04:42] Team_065 possession (Score: 13-22)
RJ Harden attempts a 3Pt. Contested by Kyrie Rozier (4.5 feet, MAN). RJ Harden misses. Rebound secured by Kevin Simons.

[04:26] Team_091 possession (Score: 13-22)
Rudy Bridges drives, picks up Russell Wade. Help arrives from Paul Williamson! Rudy Bridges attempts a Dunk. Contested by Paul Williamson (3.2 feet, ZONE). RUDY BRIDGES MAKES IT! Assist: Kyrie Rozier
Score: 15-22

[04:09] Team_065 possession (Score: 15-22)
RJ Harden drives and kicks out. Paul Williamson attempts a 3Pt. Contested by Isaiah Siakam (5.8 feet, MAN). Paul Williamson misses. Offensive rebound by Russell Wade! Russell Wade puts it back in!
Score: 15-24

[03:55] Team_091 possession (Score: 15-24)
D'Angelo Ingram attempts a 3Pt. Contested by RJ Harden (4.9 feet, ZONE). D'ANGELO INGRAM MAKES IT! Assist: Isaiah Siakam
Score: 18-24

[03:39] Team_065 possession (Score: 18-24)
RJ Harden drives and kicks out. FOUL! Shooting foul on Kyrie Rozier. Paul Williamson to the line for 3 free throws. [BONUS: 9 team fouls] (Kyrie Rozier: 1 personal fouls)   FT 1/3: GOOD   FT 2/3: GOOD   FT 3/3: GOOD Paul Williamson makes 3/3 from the line.
Score: 18-27

[03:22] Team_091 possession (Score: 18-27)
Rudy Bridges attempts a Midrange. Contested by Paul Williamson (3.6 feet, ZONE). Rudy Bridges misses. Rebound secured by Manu McGrady.

[03:07] Team_065 possession (Score: 18-27)
FOUL! Offensive foul on Russell Wade! D'Angelo Ingram drew the charge! [Team fouls: 6] (Russell Wade: 6 personal fouls) TURNOVER! (dead ball)

[03:07] Substitution (Team_065): Russell Wade OUT (stamina: 74) → Paul Curry IN (foul_out)

[02:50] Team_091 possession (Score: 18-27)
Isaiah Siakam attempts a 3Pt. Contested by RJ Harden (4.3 feet, ZONE). ISAIAH SIAKAM MAKES IT! Assist: Kyrie Rozier
Score: 21-27

[02:34] Team_065 possession (Score: 21-27)
Paul Curry attempts a 3Pt. Contested by Kyrie Rozier (4.7 feet, MAN). Paul Curry misses. Offensive rebound by Manu McGrady! Manu McGrady kicks it out.

[02:21] Team_065 possession (Score: 21-27)
Manu McGrady makes the Midrange and draws the foul on Isaiah Siakam! And-1! Manu McGrady to the line for 1. [BONUS: 10 team fouls] (Isaiah Siakam: 5 personal fouls)   FT 1/1: GOOD Manu McGrady makes 1/1 from the line.
Score: 21-30

[02:10] Team_091 possession (Score: 21-30)
Rudy Bridges makes the Dunk and draws the foul on Manu McGrady! And-1! Rudy Bridges to the line for 1. [BONUS: 7 team fouls] (Manu McGrady: 1 personal fouls)   FT 1/1: GOOD Rudy Bridges makes 1/1 from the line.
Score: 24-30

[01:56] Team_065 possession (Score: 24-30)
Paul Williamson attempts a 3Pt. Contested by Kyrie Rozier (4.4 feet, ZONE). Paul Williamson misses. Rebound secured by Kevin Simons.

[01:43] Team_091 possession (Score: 24-30)
Rudy Bridges drives, picks up Manu McGrady. Help arrives from Paul Williamson! Rudy Bridges attempts a Layup. Contested by Paul Williamson (4.9 feet, MAN). Rudy Bridges misses. Offensive rebound by Rudy Bridges! Rudy Bridges kicks it out.

[01:27] Team_091 possession (Score: 24-30)
Isaiah Siakam attempts a Midrange. BLOCKED BY PAUL WILLIAMSON! Ball goes out off Paul Williamson. Isaiah Siakam's ball!

[01:16] Team_091 possession (Score: 24-30)
Kyrie Rozier attempts a 3Pt. Contested by RJ Harden (4.3 feet, ZONE). Kyrie Rozier misses. Rebound secured by Karl Booker.

[01:02] Team_065 possession (Score: 24-30)
RJ Harden attempts a 3Pt. Contested by Kyrie Rozier (4.8 feet, MAN). RJ HARDEN MAKES IT! Assist: Paul Curry
Score: 24-33

[00:44] Team_091 possession (Score: 24-33)
Kevin Simons drives to the basket... Kevin Simons loses the ball! Stripped by Karl Booker! TURNOVER! (live ball)

[00:26] Team_065 possession (Score: 24-33)
FOUL! Reach-in foul on Isaiah Siakam during the drive. [IN THE BONUS! 11 team fouls] Paul Williamson to the line for 2 free throws. (Isaiah Siakam: 6 personal fouls) Isaiah Siakam FOULS OUT!   FT 1/2: GOOD   FT 2/2: GOOD Paul Williamson makes 2/2 from the line.
Score: 24-35

[00:26] Substitution (Team_091): Isaiah Siakam OUT (stamina: 61) → Karl Morant IN (foul_out)

[00:15] Team_091 possession (Score: 24-35)
Kevin Simons drives, Karl Booker stays with him. Kevin Simons attempts a Layup. Contested by Karl Booker (5.5 feet, ZONE). KEVIN SIMONS MAKES IT!
Score: 26-35

================================================================================
                              1ST QUARTER COMPLETE                              
================================================================================

1ST QUARTER SCORE: Team_091 26, Team_065 35

BOX SCORE:
================================================================================

Team_091
--------------------------------------------------------------------------------
Player                MIN  PTS  REB  AST  TO      FG   FG%      3P   3P%
--------------------------------------------------------------------------------
Kevin Simons           12    7    3    0   0   4/7    57.1     0/0   0.0
D'Angelo Ingram        12    7    0    0   0   3/3   100.0     0/0   0.0
Rudy Bridges           12    7    3    0   0   3/5    60.0     0/0   0.0
Isaiah Siakam          12    3    0    3   0   1/1   100.0     0/0   0.0
Kyrie Rozier           12    0    0    3   0   0/2     0.0     0/0   0.0

TEAM: FG: 11/18 (61.1%), 3PT: 2/5 (40.0%), REB: 7 (2 off, 5 def), AST: 6, TO: 3
TEAM FOULS: 11 [Team_065 in BONUS]


Team_065
--------------------------------------------------------------------------------
Player                MIN  PTS  REB  AST  TO      FG   FG%      3P   3P%
--------------------------------------------------------------------------------
Paul Williamson        12   10    0    2   0   4/5    80.0     0/0   0.0
Russell Wade            9    9    5    1   0   4/4   100.0     0/0   0.0
RJ Harden              12    8    2    0   0   3/6    50.0     0/0   0.0
Manu McGrady           12    6    3    0   0   2/2   100.0     0/0   0.0
Karl Booker            12    2    1    0   0   1/2    50.0     0/0   0.0
Paul Curry              3    0    0    1   0   0/0     0.0     0/0   0.0

TEAM: FG: 14/19 (73.7%), 3PT: 1/5 (20.0%), REB: 10 (4 off, 6 def), AST: 4, TO: 1
TEAM FOULS: 7 [Team_091 in BONUS]

================================================================================

================================================================================
                       2ND QUARTER - Team_091 vs Team_065                       
================================================================================

[12:00] Team_091 possession (Score: 26-35)
Rudy Bridges attempts a 3Pt. Contested by Manu McGrady (4.9 feet, MAN). Rudy Bridges misses. Rebound secured by Manu McGrady.

[11:40] Team_065 possession (Score: 26-35)
FOUL! Shooting foul on Kevin Simons. Karl Booker to the line for 2 free throws. [Team fouls: 1] (Kevin Simons: 1 personal fouls)   FT 1/2: MISS   FT 2/2: GOOD Karl Booker makes 1/2 from the line.
Score: 26-36

[11:28] Team_091 possession (Score: 26-36)
Rudy Bridges drives, Russell Wade stays with him. Rudy Bridges attempts a Layup. Contested by Russell Wade (3.1 feet, ZONE). Rudy Bridges misses. FOUL! Loose ball foul on RJ Harden during the rebound battle. [Team fouls: 1] No free throws, side out. (RJ Harden: 1 personal fouls)

[11:12] Team_091 possession (Score: 26-36)
D'Angelo Ingram drives, Russell Wade stays with him. D'Angelo Ingram attempts a Dunk. Contested by Russell Wade (3.9 feet, ZONE). D'ANGELO INGRAM MAKES IT! Assist: Rudy Bridges
Score: 28-36

[10:56] Team_065 possession (Score: 28-36)
Russell Wade drives, picks up D'Angelo Ingram. Help arrives from Kyrie Rozier! Russell Wade attempts a Layup. Contested by Kyrie Rozier (5.1 feet, MAN). Russell Wade misses. Rebound secured by Kevin Simons.

[10:40] Team_091 possession (Score: 28-36)
Kyrie Rozier attempts a Layup. BLOCKED BY RUSSELL WADE! Ball deflects out of bounds off Kyrie Rozier.

[10:21] Team_065 possession (Score: 28-36)
FOUL! Reach-in foul on D'Angelo Ingram during the drive. [Team fouls: 2] No free throws, side out. (D'Angelo Ingram: 1 personal fouls)

[10:05] Team_065 possession (Score: 28-36)
FOUL! Reach-in foul on D'Angelo Ingram during the drive. [Team fouls: 3] No free throws, side out. (D'Angelo Ingram: 2 personal fouls)

[09:51] Team_065 possession (Score: 28-36)
FOUL! Holding foul on D'Angelo Ingram. [Team fouls: 4] No free throws, side out. (D'Angelo Ingram: 3 personal fouls)

[09:35] Team_065 possession (Score: 28-36)
RJ Harden attempts a Midrange. Contested by Rudy Bridges (5.2 feet, ZONE). RJ HARDEN MAKES IT!
Score: 28-38

[09:20] Team_091 possession (Score: 28-38)
D'Angelo Ingram attempts a 3Pt. Contested by Russell Wade (3.9 feet, MAN). D'ANGELO INGRAM MAKES IT! Assist: Kevin Simons
Score: 31-38

[09:08] Team_065 possession (Score: 31-38)
RJ Harden makes the Layup and draws the foul on Kevin Simons! And-1! RJ Harden to the line for 1. [BONUS: 5 team fouls] (Kevin Simons: 2 personal fouls)   FT 1/1: GOOD RJ Harden makes 1/1 from the line.
Score: 31-41

[08:55] Team_091 possession (Score: 31-41)
Kyrie Rozier attempts a Layup. BLOCKED BY MANU MCGRADY! Ball goes out off Manu McGrady. Kyrie Rozier's ball!

[08:44] Team_091 possession (Score: 31-41)
FOUL! Shooting foul on RJ Harden. Kevin Simons to the line for 2 free throws. [Team fouls: 2] (RJ Harden: 2 personal fouls)   FT 1/2: GOOD   FT 2/2: MISS Kevin Simons makes 1/2 from the line. Offensive rebound by Rudy Bridges! Rudy Bridges kicks it out.
Score: 32-41

[08:25] Team_091 possession (Score: 32-41)
D'Angelo Ingram makes the Dunk and draws the foul on Paul Williamson! And-1! D'Angelo Ingram to the line for 1. [Team fouls: 3] (Paul Williamson: 1 personal fouls)   FT 1/1: GOOD D'Angelo Ingram makes 1/1 from the line.
Score: 35-41

[08:07] Team_065 possession (Score: 35-41)
Russell Wade attempts a Midrange. Contested by D'Angelo Ingram (5.4 feet, MAN). Russell Wade misses. Rebound secured by Kyrie Rozier.

[07:53] Team_091 possession (Score: 35-41)
Isaiah Siakam attempts a Midrange. Contested by Paul Williamson (4.4 feet, MAN). Isaiah Siakam misses. Rebound secured by RJ Harden.

[07:40] Team_065 possession (Score: 35-41)
RJ Harden drives and kicks out. Russell Wade attempts a 3Pt. Contested by D'Angelo Ingram (5.5 feet, MAN). RUSSELL WADE MAKES IT!
Score: 35-44

[07:24] Team_091 possession (Score: 35-44)
Kevin Simons drives and kicks out. Isaiah Siakam attempts a Midrange. Contested by Paul Williamson (4.3 feet, MAN). ISAIAH SIAKAM MAKES IT!
Score: 37-44

[07:09] Team_065 possession (Score: 37-44)
Karl Booker drives to the basket... FOUL! Offensive foul on Karl Booker! Kevin Simons drew the charge! [Team fouls: 4] (Karl Booker: 1 personal fouls) TURNOVER! (dead ball)

[06:52] Team_091 possession (Score: 37-44)
Isaiah Siakam attempts a 3Pt. Contested by Russell Wade (3.5 feet, ZONE). ISAIAH SIAKAM MAKES IT! Assist: Rudy Bridges
Score: 40-44

[06:43] Team_065 possession (Score: 40-44)
Manu McGrady attempts a Layup. Contested by Rudy Bridges (5.0 feet, MAN). MANU MCGRADY MAKES IT!
Score: 40-46

[06:29] Team_091 possession (Score: 40-46)
Rudy Bridges drives to the basket... Rudy Bridges loses control! Ball rolls out of bounds! TURNOVER! (dead ball)

[06:29] Substitution (Team_091): Kyrie Rozier OUT → Karl Morant IN (stamina_rule2)

[06:29] Substitution (Team_091): Isaiah Siakam OUT → Julius Barnes IN (stamina_rule2)

[06:29] Substitution (Team_091): Rudy Bridges OUT → Tim Antetokounmpo IN (stamina_rule2)

[06:29] Substitution (Team_091): D'Angelo Ingram OUT → Zion Mitchell IN (stamina_rule2)

[06:29] Substitution (Team_091): Kevin Simons OUT → Ja George IN (stamina_rule2)

[06:29] Substitution (Team_065): RJ Harden OUT → Paul Curry IN (stamina_rule2)

[06:29] Substitution (Team_065): Paul Williamson OUT → Derrick Poole IN (stamina_rule2)

[06:29] Substitution (Team_065): Manu McGrady OUT → D'Angelo Porzingis IN (stamina_rule2)

[06:29] Substitution (Team_065): Russell Wade OUT → Karl Leonard IN (stamina_rule2)

[06:29] Substitution (Team_065): Karl Booker OUT → Vince Mobley IN (stamina_rule2)

[06:14] Team_065 possession (Score: 40-46)
Karl Leonard drives to the basket... Karl Leonard loses the ball! Stripped by Ja George! TURNOVER! (live ball)

[06:01] Team_091 possession (Score: 40-46)
Zion Mitchell attempts a Midrange. Contested by Karl Leonard (4.7 feet, MAN). Zion Mitchell misses. Rebound secured by Vince Mobley.

[05:42] Team_065 possession (Score: 40-46)
D'Angelo Porzingis drives, Zion Mitchell stays with him. D'Angelo Porzingis attempts a Dunk. Contested by Zion Mitchell (5.0 feet, ZONE). D'ANGELO PORZINGIS MAKES IT! Assist: Vince Mobley
Score: 40-48

[05:27] Team_091 possession (Score: 40-48)
Karl Morant throws a bad pass out of bounds! TURNOVER! (dead ball)

[05:10] Team_065 possession (Score: 40-48)
Derrick Poole drives and kicks out. Karl Leonard attempts a 3Pt. Contested by Zion Mitchell (4.9 feet, MAN). Karl Leonard misses. Rebound secured by Zion Mitchell.

[04:57] Team_091 possession (Score: 40-48)
FOUL! Holding foul on Paul Curry. [IN THE BONUS! 5 team fouls] Karl Morant to the line for 2 free throws. (Paul Curry: 1 personal fouls)   FT 1/2: GOOD   FT 2/2: GOOD Karl Morant makes 2/2 from the line.
Score: 42-48

[04:42] Team_065 possession (Score: 42-48)
Vince Mobley drives and kicks out. D'Angelo Porzingis attempts a 3Pt. Contested by Tim Antetokounmpo (5.4 feet, MAN). D'ANGELO PORZINGIS MAKES IT! Assist: Vince Mobley
Score: 42-51

[04:26] Team_091 possession (Score: 42-51)
FOUL! Shooting foul on Vince Mobley. Tim Antetokounmpo to the line for 2 free throws. [BONUS: 6 team fouls] (Vince Mobley: 1 personal fouls)   FT 1/2: GOOD   FT 2/2: GOOD Tim Antetokounmpo makes 2/2 from the line.
Score: 44-51

[04:09] Team_065 possession (Score: 44-51)
Derrick Poole attempts a 3Pt. Contested by Karl Morant (4.9 feet, ZONE). Derrick Poole misses. Rebound secured by Zion Mitchell.

[03:54] Team_091 possession (Score: 44-51)
Tim Antetokounmpo drives, picks up D'Angelo Porzingis. Help arrives from Derrick Poole! Tim Antetokounmpo attempts a Layup. Contested by Derrick Poole (4.4 feet, MAN). TIM ANTETOKOUNMPO MAKES IT!
Score: 46-51

[03:40] Team_065 possession (Score: 46-51)
FOUL! Shooting foul on Karl Morant. Derrick Poole to the line for 3 free throws. [BONUS: 6 team fouls] (Karl Morant: 1 personal fouls)   FT 1/3: GOOD   FT 2/3: GOOD   FT 3/3: GOOD Derrick Poole makes 3/3 from the line.
Score: 46-54

[03:29] Team_091 possession (Score: 46-54)
Julius Barnes loses control! Ball rolls out of bounds! TURNOVER! (dead ball)

[03:19] Team_065 possession (Score: 46-54)
D'Angelo Porzingis attempts a 3Pt. Contested by Tim Antetokounmpo (5.6 feet, MAN). D'ANGELO PORZINGIS MAKES IT! Assist: Karl Leonard
Score: 46-57

[03:05] Team_091 possession (Score: 46-57)
Tim Antetokounmpo drives and kicks out. FOUL! Shooting foul on Paul Curry. Karl Morant to the line for 2 free throws. [BONUS: 7 team fouls] (Paul Curry: 2 personal fouls)   FT 1/2: MISS   FT 2/2: GOOD Karl Morant makes 1/2 from the line.
Score: 47-57

[02:51] Team_065 possession (Score: 47-57)
Karl Leonard drives, picks up Zion Mitchell. Help arrives from Karl Morant! Karl Leonard attempts a Layup. Contested by Karl Morant (5.2 feet, ZONE). KARL LEONARD MAKES IT! Assist: Paul Curry
Score: 47-59

[02:37] Team_091 possession (Score: 47-59)
Karl Morant drives and kicks out. Ja George attempts a Midrange. Contested by Vince Mobley (4.2 feet, MAN). Ja George misses. Rebound secured by Vince Mobley.

[02:22] Team_065 possession (Score: 47-59)
Paul Curry throws a bad pass! Stolen by Karl Morant! TURNOVER! (live ball)

[02:04] Team_091 possession (Score: 47-59)
FOUL! Reach-in foul on Vince Mobley during the drive. [IN THE BONUS! 8 team fouls] Tim Antetokounmpo to the line for 2 free throws. (Vince Mobley: 2 personal fouls)   FT 1/2: GOOD   FT 2/2: GOOD Tim Antetokounmpo makes 2/2 from the line.
Score: 49-59

[01:51] Team_065 possession (Score: 49-59)
Karl Leonard attempts a Midrange. Contested by Tim Antetokounmpo (5.7 feet, ZONE). KARL LEONARD MAKES IT! Assist: Vince Mobley
Score: 49-61

[01:35] Team_091 possession (Score: 49-61)
Ja George drives and kicks out. Ja George attempts a 3Pt. Contested by Vince Mobley (4.2 feet, MAN). Ja George misses. Offensive rebound by Ja George! Ja George kicks it out.

[01:26] Team_091 possession (Score: 49-61)
Julius Barnes makes the Layup and draws the foul on Vince Mobley! And-1! Julius Barnes to the line for 1. [BONUS: 9 team fouls] (Vince Mobley: 3 personal fouls)   FT 1/1: GOOD Julius Barnes makes 1/1 from the line.
Score: 52-61

[01:13] Team_065 possession (Score: 52-61)
Vince Mobley drives to the basket... Vince Mobley commits a violation (traveling/carry)! TURNOVER! (dead ball)

[01:00] Team_091 possession (Score: 52-61)
Zion Mitchell attempts a 3Pt. Contested by Karl Leonard (4.7 feet, MAN). ZION MITCHELL MAKES IT! Assist: Ja George
Score: 55-61

[00:49] Team_065 possession (Score: 55-61)
Paul Curry attempts a 3Pt. Contested by Karl Morant (5.3 feet, MAN). Paul Curry misses. Offensive rebound by D'Angelo Porzingis! D'Angelo Porzingis kicks it out.

[00:34] Team_065 possession (Score: 55-61)
Vince Mobley attempts a Midrange. Contested by Julius Barnes (4.9 feet, ZONE). VINCE MOBLEY MAKES IT! Assist: Paul Curry
Score: 55-63

[00:21] Team_091 possession (Score: 55-63)
Karl Morant attempts a 3Pt. Contested by D'Angelo Porzingis (4.6 feet, ZONE). KARL MORANT MAKES IT! Assist: Zion Mitchell
Score: 58-63

[00:04] Team_065 possession (Score: 58-63)
FOUL! Shooting foul on Tim Antetokounmpo. D'Angelo Porzingis to the line for 2 free throws. [BONUS: 7 team fouls] (Tim Antetokounmpo: 1 personal fouls)   FT 1/2: GOOD   FT 2/2: MISS D'Angelo Porzingis makes 1/2 from the line. Rebound secured by Zion Mitchell.
Score: 58-64

================================================================================
                              2ND QUARTER COMPLETE                              
================================================================================

2ND QUARTER SCORE: Team_091 32, Team_065 29

BOX SCORE:
================================================================================

Team_091
--------------------------------------------------------------------------------
Player                MIN  PTS  REB  AST  TO      FG   FG%      3P   3P%
--------------------------------------------------------------------------------
D'Angelo Ingram        18    8    0    0   0   3/3   100.0     0/0   0.0
Karl Morant             7    6    0    0   0   3/4    75.0     0/0   0.0
Tim Antetokounmpo       6    6    0    0   0   3/3   100.0     0/0   0.0
Isaiah Siakam          18    5    0    0   0   2/3    66.7     0/0   0.0
Zion Mitchell           6    3    3    1   0   1/2    50.0     0/0   0.0
Julius Barnes           6    3    0    0   0   1/1   100.0     0/0   0.0
Rudy Bridges           18    0    1    2   0   0/1     0.0     0/0   0.0
Kevin Simons           18    0    2    1   0   0/0     0.0     0/0   0.0
Kyrie Rozier           18    0    1    0   0   0/1     0.0     0/0   0.0
Ja George               6    0    1    1   0   0/0     0.0     0/0   0.0

TEAM: FG: 13/18 (72.2%), 3PT: 4/5 (80.0%), REB: 8 (3 off, 5 def), AST: 5, TO: 3
TEAM FOULS: 7 [Team_065 in BONUS]


Team_065
--------------------------------------------------------------------------------
Player                MIN  PTS  REB  AST  TO      FG   FG%      3P   3P%
--------------------------------------------------------------------------------
D'Angelo Porzingis      6    8    1    0   0   3/4    75.0     0/0   0.0
RJ Harden              18    5    1    0   0   2/2   100.0     0/0   0.0
Karl Leonard            6    4    0    1   0   2/2   100.0     0/0   0.0
Russell Wade           15    3    0    0   0   1/3    33.3     0/0   0.0
Derrick Poole           6    3    0    0   0   1/3    33.3     0/0   0.0
Manu McGrady           18    2    1    0   0   1/1   100.0     0/0   0.0
Vince Mobley            6    2    2    3   0   1/1   100.0     0/0   0.0
Karl Booker            18    1    0    0   0   1/1   100.0     0/0   0.0
Paul Curry              9    0    0    2   0   0/0     0.0     0/0   0.0

TEAM: FG: 12/17 (70.6%), 3PT: 2/3 (66.7%), REB: 5 (1 off, 4 def), AST: 6, TO: 4
TEAM FOULS: 9 [Team_091 in BONUS]

================================================================================

================================================================================
                       3RD QUARTER - Team_091 vs Team_065                       
================================================================================

[12:00] Team_091 possession (Score: 58-64)
D'Angelo Ingram attempts a Midrange. Contested by Russell Wade (4.0 feet, MAN). D'ANGELO INGRAM MAKES IT!
Score: 60-64

[11:44] Team_065 possession (Score: 60-64)
Manu McGrady attempts a 3Pt. Contested by Isaiah Siakam (5.6 feet, ZONE). Manu McGrady misses. Rebound secured by Kyrie Rozier.

[11:29] Team_091 possession (Score: 60-64)
D'Angelo Ingram drives, Russell Wade stays with him. D'Angelo Ingram attempts a Dunk. Contested by Russell Wade (4.0 feet, ZONE). D'Angelo Ingram misses. Rebound secured by Russell Wade.

[11:19] Team_065 possession (Score: 60-64)
Manu McGrady attempts a 3Pt. Contested by Rudy Bridges (4.3 feet, MAN). Manu McGrady misses. Rebound secured by Kyrie Rozier.

[11:09] Team_091 possession (Score: 60-64)
FOUL! Reach-in foul on RJ Harden during the drive. [Team fouls: 1] No free throws, side out. (RJ Harden: 1 personal fouls)

[10:55] Team_091 possession (Score: 60-64)
Rudy Bridges attempts a 3Pt. Contested by RJ Harden (3.9 feet, ZONE). Rudy Bridges misses. Rebound secured by Russell Wade.

[10:38] Team_065 possession (Score: 60-64)
Russell Wade attempts a 3Pt. Contested by D'Angelo Ingram (4.7 feet, MAN). Russell Wade misses. Rebound secured by Rudy Bridges.

[10:20] Team_091 possession (Score: 60-64)
D'Angelo Ingram drives to the basket... D'Angelo Ingram loses control! Ball rolls out of bounds! TURNOVER! (dead ball)

[10:03] Team_065 possession (Score: 60-64)
Paul Williamson makes the Layup and draws the foul on Kevin Simons! And-1! Paul Williamson to the line for 1. [Team fouls: 1] (Kevin Simons: 1 personal fouls)   FT 1/1: GOOD Paul Williamson makes 1/1 from the line.
Score: 60-67

[09:47] Team_091 possession (Score: 60-67)
Rudy Bridges drives and kicks out. D'Angelo Ingram attempts a 3Pt. Contested by Russell Wade (3.0 feet, MAN). D'Angelo Ingram misses. Rebound secured by Russell Wade.

[09:31] Team_065 possession (Score: 60-67)
Russell Wade attempts a Midrange. BLOCKED BY D'ANGELO INGRAM! Ball is loose! Rebound secured by Kyrie Rozier.

[09:14] Team_091 possession (Score: 60-67)
FOUL! Shooting foul on Russell Wade. D'Angelo Ingram to the line for 2 free throws. [Team fouls: 2] (Russell Wade: 1 personal fouls)   FT 1/2: GOOD   FT 2/2: GOOD D'Angelo Ingram makes 2/2 from the line.
Score: 62-67

[09:00] Team_065 possession (Score: 62-67)
Karl Booker makes the Layup and draws the foul on Kyrie Rozier! And-1! Karl Booker to the line for 1. [Team fouls: 2] (Kyrie Rozier: 1 personal fouls)   FT 1/1: GOOD Karl Booker makes 1/1 from the line.
Score: 62-70

[08:47] Team_091 possession (Score: 62-70)
Isaiah Siakam drives and kicks out. Rudy Bridges attempts a 3Pt. Contested by RJ Harden (3.9 feet, ZONE). RUDY BRIDGES MAKES IT!
Score: 65-70

[08:33] Team_065 possession (Score: 65-70)
Russell Wade attempts a 3Pt. Contested by D'Angelo Ingram (4.7 feet, MAN). Russell Wade misses. Rebound secured by Rudy Bridges.

[08:18] Team_091 possession (Score: 65-70)
Kevin Simons attempts a 3Pt. Contested by Paul Williamson (3.8 feet, ZONE). KEVIN SIMONS MAKES IT! Assist: Kyrie Rozier
Score: 68-70

[08:08] Team_065 possession (Score: 68-70)
Paul Williamson attempts a 3Pt. Contested by Kyrie Rozier (4.2 feet, ZONE). Paul Williamson misses. Offensive rebound by Manu McGrady! Manu McGrady kicks it out.

[07:53] Team_065 possession (Score: 68-70)
Manu McGrady attempts a 3Pt. Contested by Rudy Bridges (4.3 feet, MAN). Manu McGrady misses. Offensive rebound by Russell Wade! Russell Wade puts it back in!
Score: 68-72

[07:39] Team_091 possession (Score: 68-72)
Kyrie Rozier attempts a 3Pt. Contested by RJ Harden (4.0 feet, ZONE). Kyrie Rozier misses. Rebound secured by Manu McGrady.

[07:29] Team_065 possession (Score: 68-72)
Manu McGrady attempts a 3Pt. Contested by Kyrie Rozier (4.0 feet, ZONE). Manu McGrady misses. Rebound secured by Kevin Simons.

[07:10] Team_091 possession (Score: 68-72)
D'Angelo Ingram drives and kicks out. Rudy Bridges attempts a Midrange. Contested by Manu McGrady (4.6 feet, MAN). RUDY BRIDGES MAKES IT!
Score: 70-72

[06:56] Team_065 possession (Score: 70-72)
Russell Wade attempts a Layup. Contested by D'Angelo Ingram (4.7 feet, MAN). Russell Wade misses. Rebound secured by Rudy Bridges.

[06:42] Team_091 possession (Score: 70-72)
D'Angelo Ingram attempts a 3Pt. Contested by Russell Wade (4.0 feet, MAN). D'Angelo Ingram misses. Offensive rebound by Kevin Simons! Kevin Simons puts it back in!
Score: 72-72

[06:28] Team_065 possession (Score: 72-72)
Paul Williamson throws a bad pass! Stolen by Isaiah Siakam! TURNOVER! (live ball)

[06:12] Team_091 possession (Score: 72-72)
D'Angelo Ingram attempts a 3Pt. Contested by Russell Wade (4.0 feet, MAN). D'ANGELO INGRAM MAKES IT! Assist: Rudy Bridges
Score: 75-72

[05:56] Team_065 possession (Score: 75-72)
Karl Booker drives, picks up Kevin Simons. Help arrives from Kyrie Rozier! Karl Booker attempts a Dunk. Contested by Kyrie Rozier (3.5 feet, ZONE). KARL BOOKER MAKES IT! Assist: RJ Harden
Score: 75-74

[05:37] Team_091 possession (Score: 75-74)
Kyrie Rozier attempts a 3Pt. Contested by RJ Harden (4.0 feet, ZONE). Kyrie Rozier misses. Rebound secured by Manu McGrady.

[05:20] Team_065 possession (Score: 75-74)
Manu McGrady drives and kicks out. Russell Wade attempts a Midrange. Contested by D'Angelo Ingram (4.6 feet, ZONE). RUSSELL WADE MAKES IT! Assist: Karl Booker
Score: 75-76

[05:02] Team_091 possession (Score: 75-76)
Isaiah Siakam makes the Layup and draws the foul on Russell Wade! And-1! Isaiah Siakam to the line for 1. [Team fouls: 3] (Russell Wade: 2 personal fouls)   FT 1/1: GOOD Isaiah Siakam makes 1/1 from the line.
Score: 78-76

[04:43] Team_065 possession (Score: 78-76)
Russell Wade attempts a Layup. Contested by Kevin Simons (3.7 feet, ZONE). RUSSELL WADE MAKES IT! Assist: Manu McGrady
Score: 78-78

[04:29] Team_091 possession (Score: 78-78)
Isaiah Siakam loses the ball! Stripped by Paul Williamson! TURNOVER! (live ball)

[04:15] Team_065 possession (Score: 78-78)
RJ Harden attempts a 3Pt. Contested by Kyrie Rozier (4.5 feet, ZONE). RJ Harden misses. Rebound secured by Rudy Bridges.

[03:59] Team_091 possession (Score: 78-78)
D'Angelo Ingram drives, Russell Wade stays with him. D'Angelo Ingram attempts a Dunk. Contested by Russell Wade (4.0 feet, MAN). D'ANGELO INGRAM MAKES IT!
Score: 80-78

[03:43] Team_065 possession (Score: 80-78)
Paul Williamson makes the Layup and draws the foul on D'Angelo Ingram! And-1! Paul Williamson to the line for 1. [Team fouls: 3] (D'Angelo Ingram: 1 personal fouls)   FT 1/1: GOOD Paul Williamson makes 1/1 from the line.
Score: 80-81

[03:25] Team_091 possession (Score: 80-81)
Kevin Simons drives, Russell Wade stays with him. Kevin Simons attempts a Layup. Contested by Russell Wade (3.5 feet, ZONE). KEVIN SIMONS MAKES IT! Assist: D'Angelo Ingram
Score: 82-81

[03:06] Team_065 possession (Score: 82-81)
Paul Williamson attempts a Layup. Contested by Isaiah Siakam (5.9 feet, MAN). Paul Williamson misses. Rebound secured by Rudy Bridges.

[02:53] Team_091 possession (Score: 82-81)
Kyrie Rozier attempts a Midrange. Contested by RJ Harden (4.1 feet, MAN). KYRIE ROZIER MAKES IT!
Score: 84-81

[02:35] Team_065 possession (Score: 84-81)
RJ Harden attempts a 3Pt. Contested by D'Angelo Ingram (5.2 feet, ZONE). RJ Harden misses. Rebound secured by Kyrie Rozier.

[02:21] Team_091 possession (Score: 84-81)
Isaiah Siakam drives, picks up Paul Williamson. Help arrives from Manu McGrady! Isaiah Siakam attempts a Dunk. Contested by Manu McGrady (3.9 feet, MAN). Isaiah Siakam misses. Rebound secured by Russell Wade.

[02:02] Team_065 possession (Score: 84-81)
RJ Harden attempts a Midrange. Contested by D'Angelo Ingram (5.3 feet, ZONE). RJ Harden misses. Rebound secured by Kevin Simons.

[01:52] Team_091 possession (Score: 84-81)
Kyrie Rozier attempts a 3Pt. Contested by RJ Harden (4.2 feet, MAN). KYRIE ROZIER MAKES IT! Assist: Rudy Bridges
Score: 87-81

[01:35] Team_065 possession (Score: 87-81)
Karl Booker drives and kicks out. Paul Williamson attempts a Midrange. Contested by Rudy Bridges (4.6 feet, ZONE). Paul Williamson misses. Offensive rebound by Russell Wade! Russell Wade puts it back in!
Score: 87-83

[01:20] Team_091 possession (Score: 87-83)
D'Angelo Ingram attempts a Midrange. Contested by Manu McGrady (5.7 feet, ZONE). D'ANGELO INGRAM MAKES IT! Assist: Kyrie Rozier
Score: 89-83

[01:04] Team_065 possession (Score: 89-83)
Russell Wade drives, Kevin Simons stays with him. Russell Wade attempts a Dunk. Contested by Kevin Simons (4.0 feet, ZONE). Russell Wade misses. Offensive rebound by Manu McGrady! Manu McGrady kicks it out.

[00:53] Team_065 possession (Score: 89-83)
Paul Williamson throws a bad pass! Stolen by Isaiah Siakam! TURNOVER! (live ball)

[00:40] Team_091 possession (Score: 89-83)
Kevin Simons drives, Russell Wade stays with him. Kevin Simons attempts a Layup. Contested by Russell Wade (3.8 feet, MAN). KEVIN SIMONS MAKES IT! Assist: Kyrie Rozier
Score: 91-83

[00:23] Team_065 possession (Score: 91-83)
Manu McGrady attempts a 3Pt. Contested by Kyrie Rozier (4.3 feet, ZONE). Manu McGrady misses. Rebound secured by Kevin Simons.

[00:10] Team_091 possession (Score: 91-83)
D'Angelo Ingram attempts a Midrange. Contested by Russell Wade (4.3 feet, MAN). D'Angelo Ingram misses. Rebound secured by Manu McGrady.

================================================================================
                              3RD QUARTER COMPLETE                              
================================================================================

3RD QUARTER SCORE: Team_091 33, Team_065 19

BOX SCORE:
================================================================================

Team_091
--------------------------------------------------------------------------------
Player                MIN  PTS  REB  AST  TO      FG   FG%      3P   3P%
--------------------------------------------------------------------------------
D'Angelo Ingram        30   11    0    1   0   5/7    71.4     0/0   0.0
Kevin Simons           30    9    4    0   0   4/4   100.0     0/0   0.0
Kyrie Rozier           30    5    4    3   0   2/4    50.0     0/0   0.0
Rudy Bridges           30    5    5    2   0   2/4    50.0     0/0   0.0
Isaiah Siakam          30    3    0    0   0   1/2    50.0     0/0   0.0

TEAM: FG: 14/21 (66.7%), 3PT: 4/7 (57.1%), REB: 13 (1 off, 12 def), AST: 6, TO: 2
TEAM FOULS: 3


Team_065
--------------------------------------------------------------------------------
Player                MIN  PTS  REB  AST  TO      FG   FG%      3P   3P%
--------------------------------------------------------------------------------
Russell Wade           27    8    6    0   0   4/8    50.0     0/0   0.0
Paul Williamson        30    6    0    0   0   2/3    66.7     0/0   0.0
Karl Booker            30    5    0    1   0   2/2   100.0     0/0   0.0
Manu McGrady           30    0    5    1   0   0/4     0.0     0/0   0.0
RJ Harden              30    0    0    1   0   0/3     0.0     0/0   0.0

TEAM: FG: 8/20 (40.0%), 3PT: 1/9 (11.1%), REB: 11 (4 off, 7 def), AST: 3, TO: 2
TEAM FOULS: 3

================================================================================

================================================================================
                       4TH QUARTER - Team_091 vs Team_065                       
================================================================================

[12:00] Team_091 possession (Score: 91-83)
Kyrie Rozier drives, picks up RJ Harden. Help arrives from Manu McGrady! Kyrie Rozier attempts a Dunk. Contested by Manu McGrady (4.2 feet, MAN). KYRIE ROZIER MAKES IT! Assist: Rudy Bridges
Score: 93-83

[11:42] Team_065 possession (Score: 93-83)
Russell Wade drives and kicks out. RJ Harden attempts a 3Pt. Contested by Kyrie Rozier (4.3 feet, ZONE). RJ Harden misses. Offensive rebound by Manu McGrady! Manu McGrady kicks it out.

[11:27] Team_065 possession (Score: 93-83)
Paul Williamson attempts a 3Pt. Wide open! Isaiah Siakam is 6.1 feet away. [MAN] Paul Williamson misses. Rebound secured by Kyrie Rozier.

[11:11] Team_091 possession (Score: 93-83)
Kevin Simons attempts a Midrange. BLOCKED BY RUSSELL WADE! Ball is loose! Rebound secured by RJ Harden.

[10:57] Team_065 possession (Score: 93-83)
FOUL! Reach-in foul on Kevin Simons during the drive. [Team fouls: 1] No free throws, side out. (Kevin Simons: 1 personal fouls)

[10:42] Team_065 possession (Score: 93-83)
FOUL! Reach-in foul on Kevin Simons during the drive. [Team fouls: 2] No free throws, side out. (Kevin Simons: 2 personal fouls)

[10:28] Team_065 possession (Score: 93-83)
Russell Wade attempts a Midrange. Contested by D'Angelo Ingram (5.1 feet, ZONE). Russell Wade misses. FOUL! Loose ball foul on Kyrie Rozier during the rebound battle. [Team fouls: 3] No free throws, side out. (Kyrie Rozier: 1 personal fouls)

[10:16] Team_065 possession (Score: 93-83)
Russell Wade attempts a 3Pt. Contested by D'Angelo Ingram (5.1 feet, MAN). Russell Wade misses. Rebound secured by Kevin Simons.

[10:02] Team_091 possession (Score: 93-83)
FOUL! Shooting foul on Russell Wade. Rudy Bridges to the line for 2 free throws. [Team fouls: 1] (Russell Wade: 1 personal fouls)   FT 1/2: GOOD   FT 2/2: GOOD Rudy Bridges makes 2/2 from the line.
Score: 95-83

[09:46] Team_065 possession (Score: 95-83)
Karl Booker attempts a Midrange. Contested by Kevin Simons (4.1 feet, MAN). Karl Booker misses. Rebound secured by Kevin Simons.

[09:30] Team_091 possession (Score: 95-83)
Isaiah Siakam attempts a 3Pt. Contested by RJ Harden (4.6 feet, ZONE). Isaiah Siakam misses. Rebound secured by RJ Harden.

[09:16] Team_065 possession (Score: 95-83)
Russell Wade drives and kicks out. RJ Harden attempts a Midrange. Contested by Rudy Bridges (4.8 feet, ZONE). RJ HARDEN MAKES IT!
Score: 95-85

[09:03] Team_091 possession (Score: 95-85)
FOUL! Shooting foul on Paul Williamson. Isaiah Siakam to the line for 3 free throws. [Team fouls: 2] (Paul Williamson: 1 personal fouls)   FT 1/3: GOOD   FT 2/3: GOOD   FT 3/3: GOOD Isaiah Siakam makes 3/3 from the line.
Score: 98-85

[08:53] Team_065 possession (Score: 98-85)
Manu McGrady attempts a 3Pt. Contested by Rudy Bridges (4.8 feet, MAN). Manu McGrady misses. FOUL! Loose ball foul on Kevin Simons during the rebound battle. [Team fouls: 4] No free throws, side out. (Kevin Simons: 3 personal fouls)

[08:35] Team_065 possession (Score: 98-85)
Paul Williamson attempts a Midrange. Wide open! Isaiah Siakam is 6.4 feet away. [MAN] Paul Williamson misses. Rebound secured by Kyrie Rozier.

[08:19] Team_091 possession (Score: 98-85)
Rudy Bridges attempts a 3Pt. Contested by Russell Wade (3.7 feet, ZONE). RUDY BRIDGES MAKES IT! Assist: D'Angelo Ingram
Score: 101-85

[08:10] Team_065 possession (Score: 101-85)
Paul Williamson attempts a 3Pt. Wide open! Isaiah Siakam is 6.4 feet away. [ZONE] Paul Williamson misses. Offensive rebound by Manu McGrady! Manu McGrady kicks it out.

[07:59] Team_065 possession (Score: 101-85)
Karl Booker attempts a Midrange. Contested by Rudy Bridges (4.9 feet, ZONE). Karl Booker misses. Rebound secured by Kyrie Rozier.

[07:46] Team_091 possession (Score: 101-85)
Rudy Bridges drives, Russell Wade stays with him. Rudy Bridges attempts a Layup. Contested by Russell Wade (3.8 feet, ZONE). RUDY BRIDGES MAKES IT! Assist: Isaiah Siakam
Score: 103-85

[07:30] Team_065 possession (Score: 103-85)
Manu McGrady attempts a 3Pt. Contested by Kyrie Rozier (4.7 feet, ZONE). Manu McGrady misses. Offensive rebound by Russell Wade! Russell Wade's putback is no good. Rebound secured by Kevin Simons.

[07:15] Team_091 possession (Score: 103-85)
Isaiah Siakam attempts a Layup. Contested by Paul Williamson (4.5 feet, MAN). ISAIAH SIAKAM MAKES IT! Assist: Rudy Bridges
Score: 105-85

[07:02] Team_065 possession (Score: 105-85)
Paul Williamson attempts a 3Pt. Wide open! Isaiah Siakam is 6.6 feet away. [MAN] Paul Williamson misses. Rebound secured by Rudy Bridges.

[06:52] Team_091 possession (Score: 105-85)
Kevin Simons drives, Karl Booker stays with him. Kevin Simons attempts a Dunk. Contested by Karl Booker (5.8 feet, ZONE). KEVIN SIMONS MAKES IT! Assist: Kyrie Rozier
Score: 107-85

[06:39] Team_065 possession (Score: 107-85)
Russell Wade drives, D'Angelo Ingram stays with him. Russell Wade attempts a Dunk. Contested by D'Angelo Ingram (5.6 feet, MAN). RUSSELL WADE MAKES IT!
Score: 107-87

[06:24] Team_091 possession (Score: 107-87)
FOUL! Shooting foul on Russell Wade. Kyrie Rozier to the line for 2 free throws. [Team fouls: 3] (Russell Wade: 2 personal fouls)   FT 1/2: MISS   FT 2/2: GOOD Kyrie Rozier makes 1/2 from the line.
Score: 108-87

[06:11] Team_065 possession (Score: 108-87)
Manu McGrady attempts a 3Pt. Contested by Kyrie Rozier (4.9 feet, ZONE). Manu McGrady misses. Rebound secured by Rudy Bridges.

[05:59] Team_091 possession (Score: 108-87)
Rudy Bridges drives, Manu McGrady stays with him. Rudy Bridges attempts a Dunk. Contested by Manu McGrady (5.5 feet, MAN). Rudy Bridges misses. Offensive rebound by Rudy Bridges! Rudy Bridges kicks it out.

[05:48] Team_091 possession (Score: 108-87)
Kyrie Rozier makes the Midrange and draws the foul on RJ Harden! And-1! Kyrie Rozier to the line for 1. [Team fouls: 4] (RJ Harden: 1 personal fouls)   FT 1/1: GOOD Kyrie Rozier makes 1/1 from the line.
Score: 111-87

[05:30] Team_065 possession (Score: 111-87)
Manu McGrady attempts a 3Pt. Contested by Kyrie Rozier (4.9 feet, ZONE). Manu McGrady misses. Rebound secured by Kyrie Rozier.

[05:14] Team_091 possession (Score: 111-87)
D'Angelo Ingram throws a bad pass out of bounds! TURNOVER! (dead ball)

[05:14] Substitution (Team_091): Kyrie Rozier OUT → Karl Morant IN (stamina_rule2)

[05:14] Substitution (Team_091): Isaiah Siakam OUT → Julius Barnes IN (stamina_rule2)

[05:14] Substitution (Team_091): Rudy Bridges OUT → Tim Antetokounmpo IN (stamina_rule2)

[05:14] Substitution (Team_091): D'Angelo Ingram OUT → Zion Mitchell IN (stamina_rule2)

[05:14] Substitution (Team_091): Kevin Simons OUT → Ja George IN (stamina_rule2)

[05:14] Substitution (Team_065): RJ Harden OUT → Paul Curry IN (stamina_rule2)

[05:14] Substitution (Team_065): Paul Williamson OUT → Derrick Poole IN (stamina_rule2)

[05:14] Substitution (Team_065): Manu McGrady OUT → D'Angelo Porzingis IN (stamina_rule2)

[05:14] Substitution (Team_065): Russell Wade OUT → Karl Leonard IN (stamina_rule2)

[05:14] Substitution (Team_065): Karl Booker OUT → Vince Mobley IN (stamina_rule2)

[04:58] Team_065 possession (Score: 111-87)
Paul Curry attempts a Midrange. Contested by Karl Morant (5.3 feet, MAN). Paul Curry misses. Rebound secured by Ja George.

[04:45] Team_091 possession (Score: 111-87)
Julius Barnes drives and kicks out. Zion Mitchell attempts a Midrange. Contested by D'Angelo Porzingis (4.3 feet, ZONE). Zion Mitchell misses. FOUL! Loose ball foul on Karl Leonard during the rebound battle. [IN THE BONUS! 5 team fouls] Ja George to the line for 2 free throws. (Karl Leonard: 1 personal fouls)   FT 1/2: GOOD   FT 2/2: GOOD Ja George makes 2/2 from the line.
Score: 113-87

[04:33] Team_065 possession (Score: 113-87)
D'Angelo Porzingis attempts a 3Pt. Contested by Karl Morant (5.0 feet, ZONE). D'ANGELO PORZINGIS MAKES IT! Assist: Derrick Poole
Score: 113-90

[04:18] Team_091 possession (Score: 113-90)
Ja George attempts a Midrange. Contested by D'Angelo Porzingis (4.4 feet, ZONE). Ja George misses. FOUL! Loose ball foul on D'Angelo Porzingis during the rebound battle. [IN THE BONUS! 6 team fouls] Zion Mitchell to the line for 2 free throws. (D'Angelo Porzingis: 1 personal fouls)   FT 1/2: GOOD   FT 2/2: MISS Zion Mitchell makes 1/2 from the line. Rebound secured by D'Angelo Porzingis.
Score: 114-90

[04:05] Team_065 possession (Score: 114-90)
Vince Mobley attempts a 3Pt. Contested by Karl Morant (4.9 feet, ZONE). Vince Mobley misses. Rebound secured by Zion Mitchell.

[03:48] Team_091 possession (Score: 114-90)
Ja George loses control! Ball rolls out of bounds! TURNOVER! (dead ball)

[03:31] Team_065 possession (Score: 114-90)
Karl Leonard drives to the basket... Karl Leonard commits a violation (traveling/carry)! TURNOVER! (dead ball)

[03:16] Team_091 possession (Score: 114-90)
Tim Antetokounmpo attempts a 3Pt. Contested by Karl Leonard (4.6 feet, ZONE). Tim Antetokounmpo misses. FOUL! Loose ball foul on Vince Mobley during the rebound battle. [IN THE BONUS! 7 team fouls] Ja George to the line for 2 free throws. (Vince Mobley: 1 personal fouls)   FT 1/2: GOOD   FT 2/2: MISS Ja George makes 1/2 from the line. Offensive rebound by Zion Mitchell! Zion Mitchell kicks it out.
Score: 115-90

[03:07] Team_091 possession (Score: 115-90)
Karl Morant attempts a Midrange. Contested by Karl Leonard (4.8 feet, ZONE). Karl Morant misses. Rebound secured by Vince Mobley.

[02:49] Team_065 possession (Score: 115-90)
Karl Leonard attempts a Midrange. Contested by Zion Mitchell (5.2 feet, MAN). KARL LEONARD MAKES IT!
Score: 115-92

[02:34] Team_091 possession (Score: 115-92)
Karl Morant drives, Vince Mobley stays with him. Karl Morant attempts a Layup. Contested by Vince Mobley (4.5 feet, ZONE). Karl Morant misses. Rebound secured by D'Angelo Porzingis.

[02:20] Team_065 possession (Score: 115-92)
D'Angelo Porzingis makes the 3Pt and draws the foul on Tim Antetokounmpo! And-1! D'Angelo Porzingis to the line for 1. [BONUS: 5 team fouls] (Tim Antetokounmpo: 1 personal fouls)   FT 1/1: GOOD D'Angelo Porzingis makes 1/1 from the line.
Score: 115-96

[02:04] Team_091 possession (Score: 115-96)
Tim Antetokounmpo attempts a 3Pt. Contested by Paul Curry (5.0 feet, ZONE). TIM ANTETOKOUNMPO MAKES IT! Assist: Julius Barnes
Score: 118-96

[01:50] Team_065 possession (Score: 118-96)
Karl Leonard attempts a Midrange. Contested by Zion Mitchell (5.2 feet, MAN). Karl Leonard misses. Rebound secured by Ja George.

[01:36] Team_091 possession (Score: 118-96)
Tim Antetokounmpo attempts a 3Pt. Contested by D'Angelo Porzingis (4.4 feet, MAN). Tim Antetokounmpo misses. Rebound secured by Vince Mobley.

[01:26] Team_065 possession (Score: 118-96)
Paul Curry attempts a Midrange. Contested by Zion Mitchell (5.3 feet, ZONE). Paul Curry misses. Rebound secured by Ja George.

[01:10] Team_091 possession (Score: 118-96)
FOUL! Reach-in foul on D'Angelo Porzingis during the drive. [IN THE BONUS! 8 team fouls] Tim Antetokounmpo to the line for 2 free throws. (D'Angelo Porzingis: 2 personal fouls)   FT 1/2: GOOD   FT 2/2: MISS Tim Antetokounmpo makes 1/2 from the line. Rebound secured by Karl Leonard.
Score: 119-96

[00:57] Team_065 possession (Score: 119-96)
Vince Mobley drives and kicks out. FOUL! Shooting foul on Julius Barnes. Derrick Poole to the line for 3 free throws. [BONUS: 6 team fouls] (Julius Barnes: 1 personal fouls)   FT 1/3: GOOD   FT 2/3: GOOD   FT 3/3: GOOD Derrick Poole makes 3/3 from the line.
Score: 119-99

[00:42] Team_091 possession (Score: 119-99)
Karl Morant drives and kicks out. Zion Mitchell attempts a 3Pt. Contested by Paul Curry (4.9 feet, ZONE). Zion Mitchell misses. Rebound secured by Vince Mobley.

[00:26] Team_065 possession (Score: 119-99)
Vince Mobley attempts a Midrange. Contested by Zion Mitchell (4.9 feet, ZONE). VINCE MOBLEY MAKES IT!
Score: 119-101

[00:11] Team_091 possession (Score: 119-101)
Zion Mitchell attempts a Layup. Contested by Karl Leonard (4.7 feet, MAN). ZION MITCHELL MAKES IT!
Score: 121-101

================================================================================
                              4TH QUARTER COMPLETE                              
================================================================================

4TH QUARTER SCORE: Team_091 30, Team_065 18

BOX SCORE:
================================================================================

Team_091
--------------------------------------------------------------------------------
Player                MIN  PTS  REB  AST  TO      FG   FG%      3P   3P%
--------------------------------------------------------------------------------
Rudy Bridges           37    7    3    2   0   3/3   100.0     0/0   0.0
Kyrie Rozier           37    6    4    1   0   3/3   100.0     0/0   0.0
Isaiah Siakam          37    5    0    1   0   2/3    66.7     0/0   0.0
Tim Antetokounmpo      11    3    0    0   0   1/3    33.3     0/0   0.0
Kevin Simons           37    2    3    0   0   1/2    50.0     0/0   0.0
Ja George              11    2    3    0   0   1/2    50.0     0/0   0.0
Zion Mitchell          11    2    2    0   0   1/1   100.0     0/0   0.0
D'Angelo Ingram        37    0    0    1   0   0/0     0.0     0/0   0.0
Karl Morant            12    0    0    0   0   0/3     0.0     0/0   0.0
Julius Barnes          11    0    0    1   0   0/0     0.0     0/0   0.0

TEAM: FG: 12/20 (60.0%), 3PT: 3/5 (60.0%), REB: 15 (3 off, 12 def), AST: 6, TO: 2
TEAM FOULS: 6 [Team_065 in BONUS]


Team_065
--------------------------------------------------------------------------------
Player                MIN  PTS  REB  AST  TO      FG   FG%      3P   3P%
--------------------------------------------------------------------------------
D'Angelo Porzingis     11    7    2    0   0   2/2   100.0     0/0   0.0
Derrick Poole          11    3    0    1   0   1/1   100.0     0/0   0.0
RJ Harden              37    2    2    0   0   1/1   100.0     0/0   0.0
Russell Wade           34    2    1    0   0   1/2    50.0     0/0   0.0
Vince Mobley           11    2    3    0   0   1/2    50.0     0/0   0.0
Karl Leonard           11    2    1    0   0   1/2    50.0     0/0   0.0
Manu McGrady           37    0    3    0   0   0/3     0.0     0/0   0.0
Paul Williamson        37    0    0    0   0   0/3     0.0     0/0   0.0
Karl Booker            37    0    0    0   0   0/2     0.0     0/0   0.0
Paul Curry             14    0    0    0   0   0/2     0.0     0/0   0.0

TEAM: FG: 7/20 (35.0%), 3PT: 2/9 (22.2%), REB: 12 (5 off, 7 def), AST: 1, TO: 1
TEAM FOULS: 8 [Team_091 in BONUS]

================================================================================

================================================================================
                               FULL GAME COMPLETE                               
================================================================================

FINAL SCORE: Team_091 121, Team_065 101

SCORING BY QUARTER:
--------------------------------------------------------------------------------
Team                     Q1     Q2     Q3     Q4    FINAL
--------------------------------------------------------------------------------
Team_091                 26     32     33     30      121
Team_065                 35     29     19     18      101
--------------------------------------------------------------------------------

FULL GAME BOX SCORE:
================================================================================

Team_091
--------------------------------------------------------------------------------
Player                MIN  PTS  REB  AST  TO      FG   FG%      3P   3P%      FT STL BLK
--------------------------------------------------------------------------------
Kyrie Rozier           37   11    9    7   0   5/10   50.0   1/4    25.0   2/3     0   0
Rudy Bridges           37   19   12    6   3   6/11   54.5   1/3    33.3   3/3     0   0
D'Angelo Ingram        37   26    0    2   2  13/15   86.7   4/4   100.0   5/5     0   1
Kevin Simons           37   18   12    1   0   9/13   69.2   1/3    33.3   4/7     0   0
Isaiah Siakam          37   16    0    4   2   6/9    66.7   3/4    75.0   4/4     2   0
Karl Morant            12    6    0    0   1   1/5    20.0   1/1   100.0   3/4     1   0
Julius Barnes          11    3    0    1   1   2/2   100.0   0/0     0.0   1/1     0   0
Tim Antetokounmpo      11    9    0    0   0   5/7    71.4   1/2    50.0   5/6     0   0
Zion Mitchell          11    5    5    1   0   2/3    66.7   1/1   100.0   1/2     0   0
Ja George              11    2    4    1   1   0/1     0.0   0/0     0.0   3/4     1   0

TEAM: FG: 50/77 (64.9%), 3PT: 13/22 (59.1%), REB: 43 (9 off, 34 def), AST: 23, TO: 10


Team_065
--------------------------------------------------------------------------------
Player                MIN  PTS  REB  AST  TO      FG   FG%      3P   3P%      FT STL BLK
--------------------------------------------------------------------------------
RJ Harden              37   15    5    1   0   7/13   53.8   1/6    16.7   2/2     0   0
Paul Williamson        37   16    0    2   3   5/10   50.0   0/3     0.0   9/9     1   1
Manu McGrady           37    8   12    1   0   5/12   41.7   1/8    12.5   1/1     0   1
Karl Booker            37    8    1    1   0   5/8    62.5   0/0     0.0   2/3     1   0
Russell Wade           34   22   12    1   1   6/13   46.2   0/3     0.0   3/3     1   2
Paul Curry             14    0    0    3   1   0/2     0.0   0/0     0.0   0/0     0   0
Derrick Poole          11    6    0    1   0   1/3    33.3   1/2    50.0   6/6     0   0
D'Angelo Porzingis     11   15    3    0   0   4/5    80.0   3/3   100.0   2/3     0   0
Karl Leonard           11    6    1    1   0   3/4    75.0   0/0     0.0   0/0     0   0
Vince Mobley           11    4    5    3   3   4/5    80.0   0/1     0.0   0/0     0   0

TEAM: FG: 41/76 (53.9%), 3PT: 6/26 (23.1%), REB: 38 (14 off, 24 def), AST: 14, TO: 8

================================================================================
