================================================================================
                        FULL GAME - Team_016 vs Team_074                        
================================================================================

================================================================================
                       1ST QUARTER - Team_016 vs Team_074                       
================================================================================

[12:00] Team_016 possession (Score: 0-0)
Vince Quickley drives, picks up Shai Green. Help arrives from Chris Carter! Vince Quickley attempts a Layup. Contested by Chris Carter (3.0 feet, MAN). VINCE QUICKLEY MAKES IT! Assist: Ben Barrett
Score: 2-0

[11:45] Team_074 possession (Score: 2-0)
Dwyane Quickley attempts a 3Pt. Contested by Collin Barnes (4.3 feet, MAN). Dwyane Quickley misses. Rebound secured by Ben Barrett.

[11:28] Team_016 possession (Score: 2-0)
Ben Barrett drives to the basket... Ben Barrett loses control! Ball rolls out of bounds! TURNOVER! (dead ball)

[11:14] Team_074 possession (Score: 2-0)
James Turner drives, picks up Vince Duncan. Help arrives from Collin Barnes! James Turner attempts a Dunk. Contested by Collin Barnes (3.8 feet, MAN). JAMES TURNER MAKES IT! Assist: Chris Carter
Score: 2-2

[10:59] Team_016 possession (Score: 2-2)
FOUL! Reach-in foul on Donovan Doncic during the drive. [Team fouls: 1] No free throws, side out. (Donovan Doncic: 1 personal fouls)

[10:48] Team_016 possession (Score: 2-2)
Collin Barnes attempts a 3Pt. Contested by Chris Carter (4.3 feet, ZONE). Collin Barnes misses. Rebound secured by Shai Green.

[10:34] Team_074 possession (Score: 2-2)
FOUL! Shooting foul on Vince Duncan. Shai Green to the line for 2 free throws. [Team fouls: 1] (Vince Duncan: 1 personal fouls)   FT 1/2: GOOD   FT 2/2: GOOD Shai Green makes 2/2 from the line.
Score: 2-4

[10:21] Team_016 possession (Score: 2-4)
Collin Barnes throws a bad pass! Stolen by Dwyane Quickley! TURNOVER! (live ball)

[10:03] Team_074 possession (Score: 2-4)
Donovan Doncic attempts a Midrange. Contested by Ben Barrett (4.0 feet, MAN). Donovan Doncic misses. Offensive rebound by James Turner! James Turner puts it back in!
Score: 2-6

[09:47] Team_016 possession (Score: 2-6)
Vince Duncan drives and kicks out. Vince Quickley attempts a 3Pt. Contested by Dwyane Quickley (5.4 feet, ZONE). VINCE QUICKLEY MAKES IT! Assist: Vince Duncan
Score: 5-6

[09:30] Team_074 possession (Score: 5-6)
Shai Green attempts a 3Pt. Wide open! Giannis Ginobili is 6.2 feet away. [ZONE] Shai Green misses. Rebound secured by Vince Duncan.

[09:16] Team_016 possession (Score: 5-6)
Vince Quickley attempts a Midrange. Contested by Donovan Doncic (3.2 feet, ZONE). Vince Quickley misses. FOUL! Loose ball foul on Shai Green during the rebound battle. [Team fouls: 2] No free throws, side out. (Shai Green: 1 personal fouls)

[08:58] Team_016 possession (Score: 5-6)
Collin Barnes makes the 3Pt and draws the foul on Dwyane Quickley! And-1! Collin Barnes to the line for 1. [Team fouls: 3] (Dwyane Quickley: 1 personal fouls)   FT 1/1: GOOD Collin Barnes makes 1/1 from the line.
Score: 9-6

[08:46] Team_074 possession (Score: 9-6)
James Turner attempts a Layup. Contested by Vince Duncan (3.8 feet, ZONE). James Turner misses. Rebound secured by Ben Barrett.

[08:28] Team_016 possession (Score: 9-6)
FOUL! Offensive foul on Vince Quickley! Shai Green drew the charge! [Team fouls: 2] (Vince Quickley: 1 personal fouls) TURNOVER! (dead ball)

[08:14] Team_074 possession (Score: 9-6)
FOUL! Holding foul on Vince Quickley. [Team fouls: 3] No free throws, side out. (Vince Quickley: 2 personal fouls)

[08:05] Team_074 possession (Score: 9-6)
Dwyane Quickley attempts a 3Pt. Contested by Collin Barnes (4.3 feet, MAN). Dwyane Quickley misses. Rebound secured by Vince Duncan.

[07:50] Team_016 possession (Score: 9-6)
Collin Barnes drives, picks up Dwyane Quickley. Help arrives from Shai Green! Collin Barnes attempts a Layup. Contested by Shai Green (5.5 feet, MAN). Collin Barnes misses. Rebound secured by James Turner.

[07:33] Team_074 possession (Score: 9-6)
Shai Green attempts a 3Pt. Contested by Vince Quickley (4.8 feet, MAN). Shai Green misses. Rebound secured by Vince Duncan.

[07:20] Team_016 possession (Score: 9-6)
Vince Duncan drives to the basket... Vince Duncan loses the ball! Stripped by Donovan Doncic! TURNOVER! (live ball)

[07:05] Team_074 possession (Score: 9-6)
James Turner attempts a Layup. Contested by Vince Duncan (3.8 feet, MAN). JAMES TURNER MAKES IT!
Score: 9-8

[06:48] Team_016 possession (Score: 9-8)
FOUL! Shooting foul on Donovan Doncic. Collin Barnes to the line for 2 free throws. [Team fouls: 4] (Donovan Doncic: 2 personal fouls)   FT 1/2: MISS   FT 2/2: GOOD Collin Barnes makes 1/2 from the line.
Score: 10-8

[06:35] Team_074 possession (Score: 10-8)
Dwyane Quickley attempts a Midrange. Contested by Collin Barnes (4.3 feet, MAN). Dwyane Quickley misses. Offensive rebound by Donovan Doncic! Donovan Doncic kicks it out.

[06:19] Team_074 possession (Score: 10-8)
FOUL! Holding foul on Collin Barnes. [Team fouls: 4] No free throws, side out. (Collin Barnes: 1 personal fouls)

[06:07] Team_074 possession (Score: 10-8)
FOUL! Holding foul on Collin Barnes. [IN THE BONUS! 5 team fouls] Dwyane Quickley to the line for 2 free throws. (Collin Barnes: 2 personal fouls)   FT 1/2: MISS   FT 2/2: GOOD Dwyane Quickley makes 1/2 from the line.
Score: 10-9

[05:49] Team_016 possession (Score: 10-9)
Collin Barnes attempts a Layup. BLOCKED BY DWYANE QUICKLEY! Ball is loose! Offensive rebound by Ben Barrett! Ben Barrett kicks it out.

[05:36] Team_016 possession (Score: 10-9)
Collin Barnes attempts a 3Pt. Contested by Dwyane Quickley (5.4 feet, MAN). Collin Barnes misses. Rebound secured by Shai Green.

[05:20] Team_074 possession (Score: 10-9)
Shai Green attempts a 3Pt. Contested by Collin Barnes (4.6 feet, ZONE). Shai Green misses. Rebound secured by Vince Duncan.

[05:05] Team_016 possession (Score: 10-9)
Ben Barrett attempts a Layup. Contested by Donovan Doncic (4.2 feet, MAN). BEN BARRETT MAKES IT! Assist: Collin Barnes
Score: 12-9

[04:47] Team_074 possession (Score: 12-9)
FOUL! Reach-in foul on Giannis Ginobili during the drive. [IN THE BONUS! 6 team fouls] Chris Carter to the line for 2 free throws. (Giannis Ginobili: 1 personal fouls)   FT 1/2: GOOD   FT 2/2: GOOD Chris Carter makes 2/2 from the line.
Score: 12-11

[04:33] Team_016 possession (Score: 12-11)
Vince Duncan drives and kicks out. FOUL! Shooting foul on Donovan Doncic. Ben Barrett to the line for 2 free throws. [BONUS: 6 team fouls] (Donovan Doncic: 4 personal fouls)   FT 1/2: GOOD   FT 2/2: MISS Ben Barrett makes 1/2 from the line. Rebound secured by Shai Green.
Score: 13-11

[04:17] Team_074 possession (Score: 13-11)
Dwyane Quickley attempts a 3Pt. Contested by Collin Barnes (4.4 feet, MAN). Dwyane Quickley misses. FOUL! Loose ball foul on Ben Barrett during the rebound battle. [IN THE BONUS! 7 team fouls] James Turner to the line for 2 free throws. (Ben Barrett: 1 personal fouls)   FT 1/2: GOOD   FT 2/2: GOOD James Turner makes 2/2 from the line.
Score: 13-13

[04:02] Team_016 possession (Score: 13-13)
Vince Duncan attempts a 3Pt. Contested by James Turner (3.8 feet, MAN). Vince Duncan misses. Rebound secured by James Turner.

[03:48] Team_074 possession (Score: 13-13)
Chris Carter attempts a 3Pt. Contested by Collin Barnes (4.8 feet, ZONE). CHRIS CARTER MAKES IT! Assist: Shai Green
Score: 13-16

[03:36] Team_016 possession (Score: 13-16)
FOUL! Holding foul on Chris Carter. [IN THE BONUS! 7 team fouls] Giannis Ginobili to the line for 2 free throws. (Chris Carter: 1 personal fouls)   FT 1/2: GOOD   FT 2/2: GOOD Giannis Ginobili makes 2/2 from the line.
Score: 15-16

[03:21] Team_074 possession (Score: 15-16)
Chris Carter attempts a 3Pt. Contested by Collin Barnes (4.8 feet, ZONE). Chris Carter misses. Offensive rebound by James Turner! James Turner puts it back in!
Score: 15-18

[03:07] Team_016 possession (Score: 15-18)
Collin Barnes attempts a 3Pt. Contested by Dwyane Quickley (5.6 feet, ZONE). COLLIN BARNES MAKES IT! Assist: Ben Barrett
Score: 18-18

[02:54] Team_074 possession (Score: 18-18)
Dwyane Quickley attempts a 3Pt. Contested by Collin Barnes (4.5 feet, ZONE). Dwyane Quickley misses. Rebound secured by Ben Barrett.

[02:38] Team_016 possession (Score: 18-18)
Ben Barrett attempts a Layup. Contested by Donovan Doncic (4.4 feet, ZONE). BEN BARRETT MAKES IT!
Score: 20-18

[02:23] Team_074 possession (Score: 20-18)
Shai Green attempts a 3Pt. Contested by Collin Barnes (4.8 feet, ZONE). SHAI GREEN MAKES IT! Assist: James Turner
Score: 20-21

[02:09] Team_016 possession (Score: 20-21)
Giannis Ginobili attempts a Layup. Contested by Chris Carter (4.6 feet, MAN). Giannis Ginobili misses. Rebound secured by Donovan Doncic.

[01:58] Team_074 possession (Score: 20-21)
FOUL! Shooting foul on Vince Quickley. Shai Green to the line for 2 free throws. [BONUS: 8 team fouls] (Vince Quickley: 3 personal fouls)   FT 1/2: MISS   FT 2/2: GOOD Shai Green makes 1/2 from the line.
Score: 20-22

[01:46] Team_016 possession (Score: 20-22)
Vince Duncan attempts a Midrange. Contested by James Turner (4.1 feet, MAN). Vince Duncan misses. Rebound secured by James Turner.

[01:32] Team_074 possession (Score: 20-22)
Shai Green drives and kicks out. Dwyane Quickley attempts a Midrange. Contested by Collin Barnes (4.5 feet, MAN). Dwyane Quickley misses. Rebound secured by Vince Quickley.

[01:14] Team_016 possession (Score: 20-22)
Vince Quickley drives and kicks out. Collin Barnes attempts a 3Pt. Contested by Dwyane Quickley (5.7 feet, ZONE). Collin Barnes misses. Rebound secured by James Turner.

[00:58] Team_074 possession (Score: 20-22)
FOUL! Holding foul on Giannis Ginobili. [IN THE BONUS! 9 team fouls] Chris Carter to the line for 2 free throws. (Giannis Ginobili: 2 personal fouls)   FT 1/2: MISS   FT 2/2: GOOD Chris Carter makes 1/2 from the line.
Score: 20-23

[00:45] Team_016 possession (Score: 20-23)
Vince Duncan attempts a Dunk. BLOCKED BY DONOVAN DONCIC! Ball is loose! Rebound secured by James Turner.

[00:32] Team_074 possession (Score: 20-23)
Dwyane Quickley attempts a 3Pt. Contested by Collin Barnes (4.8 feet, MAN). Dwyane Quickley misses. Rebound secured by Vince Duncan.

[00:19] Team_016 possession (Score: 20-23)
Vince Quickley attempts a 3Pt. Contested by Shai Green (3.6 feet, MAN). Vince Quickley misses. Offensive rebound by Vince Duncan! Vince Duncan kicks it out.

[00:06] Team_016 possession (Score: 20-23)
Giannis Ginobili attempts a Layup. BLOCKED BY CHRIS CARTER! Ball goes out off Chris Carter. Giannis Ginobili's ball!

================================================================================
                              1ST QUARTER COMPLETE                              
================================================================================

1ST QUARTER SCORE: Team_016 20, Team_074 23

BOX SCORE:
================================================================================

Team_016
--------------------------------------------------------------------------------
Player                MIN  PTS  REB  AST  TO      FG   FG%      3P   3P%
--------------------------------------------------------------------------------
Collin Barnes          12    8    0    1   0   3/6    50.0     0/0   0.0
Vince Quickley         12    5    1    0   0   2/3    66.7     0/0   0.0
Ben Barrett            12    4    4    2   0   2/2   100.0     0/0   0.0
Giannis Ginobili       12    2    0    0   0   1/2    50.0     0/0   0.0
Vince Duncan           12    0    7    1   0   0/4     0.0     0/0   0.0

TEAM: FG: 8/17 (47.1%), 3PT: 2/5 (40.0%), REB: 12 (3 off, 9 def), AST: 4, TO: 4
TEAM FOULS: 9 [Team_074 in BONUS]


Team_074
--------------------------------------------------------------------------------
Player                MIN  PTS  REB  AST  TO      FG   FG%      3P   3P%
--------------------------------------------------------------------------------
James Turner           12   10    7    1   0   5/6    83.3     0/0   0.0
Chris Carter           12    6    0    1   0   3/3   100.0     0/0   0.0
Shai Green             12    6    3    1   0   3/7    42.9     0/0   0.0
Dwyane Quickley        12    1    0    0   0   1/5    20.0     0/0   0.0
Donovan Doncic         12    0    2    0   0   0/0     0.0     0/0   0.0

TEAM: FG: 12/21 (57.1%), 3PT: 4/11 (36.4%), REB: 12 (3 off, 9 def), AST: 3, TO: 0
TEAM FOULS: 7 [Team_016 in BONUS]

================================================================================

================================================================================
                       2ND QUARTER - Team_016 vs Team_074                       
================================================================================

[12:00] Team_016 possession (Score: 20-23)
Ben Barrett drives and kicks out. Giannis Ginobili attempts a Midrange. Contested by Donovan Doncic (3.9 feet, ZONE). GIANNIS GINOBILI MAKES IT! Assist: Collin Barnes
Score: 22-23

[11:45] Team_074 possession (Score: 22-23)
Donovan Doncic attempts a 3Pt. Contested by Ben Barrett (4.3 feet, MAN). Donovan Doncic misses. Rebound secured by Ben Barrett.

[11:32] Team_016 possession (Score: 22-23)
FOUL! Holding foul on Dwyane Quickley. [Team fouls: 1] No free throws, side out. (Dwyane Quickley: 1 personal fouls)

[11:20] Team_016 possession (Score: 22-23)
Ben Barrett attempts a Midrange. Contested by Chris Carter (5.1 feet, ZONE). BEN BARRETT MAKES IT! Assist: Giannis Ginobili
Score: 24-23

[11:06] Team_074 possession (Score: 24-23)
James Turner attempts a 3Pt. Contested by Vince Duncan (4.3 feet, MAN). James Turner misses. Rebound secured by Vince Quickley.

[10:48] Team_016 possession (Score: 24-23)
Vince Quickley throws a bad pass out of bounds! TURNOVER! (dead ball)

[10:48] Substitution (Team_016): Collin Barnes OUT → Lamelo Herro IN (stamina_rule2)

[10:48] Substitution (Team_016): Giannis Ginobili OUT → Immanuel Nowitzki IN (stamina_rule2)

[10:48] Substitution (Team_016): Vince Quickley OUT → Kevin Butler IN (stamina_rule2)

[10:48] Substitution (Team_016): Ben Barrett OUT → Giannis Doncic IN (stamina_rule2)

[10:48] Substitution (Team_016): Vince Duncan OUT → Trae Barnes IN (stamina_rule2)

[10:48] Substitution (Team_074): Dwyane Quickley OUT → James Barnes IN (stamina_rule2)

[10:48] Substitution (Team_074): Chris Carter OUT → Giannis Westbrook IN (stamina_rule2)

[10:48] Substitution (Team_074): Shai Green OUT → Ayo Smith IN (stamina_rule2)

[10:48] Substitution (Team_074): Donovan Doncic OUT → Yao Randle IN (stamina_rule2)

[10:48] Substitution (Team_074): James Turner OUT → Jaren Rozier IN (stamina_rule2)

[10:32] Team_074 possession (Score: 24-23)
Yao Randle attempts a Layup. Contested by Giannis Doncic (3.9 feet, ZONE). YAO RANDLE MAKES IT! Assist: Jaren Rozier
Score: 24-25

[10:14] Team_016 possession (Score: 24-25)
Trae Barnes attempts a Midrange. Contested by Jaren Rozier (4.2 feet, MAN). Trae Barnes misses. Rebound secured by Yao Randle.

[10:02] Team_074 possession (Score: 24-25)
FOUL! Holding foul on Trae Barnes. [Team fouls: 1] No free throws, side out. (Trae Barnes: 1 personal fouls)

[09:48] Team_074 possession (Score: 24-25)
Giannis Westbrook attempts a 3Pt. Contested by Immanuel Nowitzki (4.7 feet, MAN). GIANNIS WESTBROOK MAKES IT! Assist: Yao Randle
Score: 24-28

[09:31] Team_016 possession (Score: 24-28)
Kevin Butler attempts a 3Pt. Contested by James Barnes (4.0 feet, ZONE). Kevin Butler misses. Rebound secured by Yao Randle.

[09:18] Team_074 possession (Score: 24-28)
James Barnes attempts a 3Pt. Contested by Lamelo Herro (3.7 feet, ZONE). JAMES BARNES MAKES IT! Assist: Ayo Smith
Score: 24-31

[09:06] Team_016 possession (Score: 24-31)
Trae Barnes attempts a Layup. Contested by Jaren Rozier (4.2 feet, MAN). TRAE BARNES MAKES IT! Assist: Lamelo Herro
Score: 26-31

[08:52] Team_074 possession (Score: 26-31)
Giannis Westbrook drives and kicks out. Giannis Westbrook attempts a 3Pt. Contested by Immanuel Nowitzki (4.6 feet, MAN). Giannis Westbrook misses. Rebound secured by Giannis Doncic.

[08:39] Team_016 possession (Score: 26-31)
Lamelo Herro attempts a Layup. Contested by James Barnes (4.2 feet, MAN). LAMELO HERRO MAKES IT!
Score: 28-31

[08:21] Team_074 possession (Score: 28-31)
Ayo Smith attempts a 3Pt. Contested by Kevin Butler (4.6 feet, ZONE). AYO SMITH MAKES IT! Assist: Jaren Rozier
Score: 28-34

[08:05] Team_016 possession (Score: 28-34)
Giannis Doncic drives and kicks out. Immanuel Nowitzki attempts a Midrange. Contested by Yao Randle (4.5 feet, ZONE). Immanuel Nowitzki misses. Rebound secured by Ayo Smith.

[07:54] Team_074 possession (Score: 28-34)
Ayo Smith drives to the basket... Ayo Smith loses the ball! Stripped by Giannis Doncic! TURNOVER! (live ball)

[07:39] Team_016 possession (Score: 28-34)
FOUL! Shooting foul on Yao Randle. Giannis Doncic to the line for 3 free throws. [Team fouls: 2] (Yao Randle: 1 personal fouls)   FT 1/3: GOOD   FT 2/3: MISS   FT 3/3: GOOD Giannis Doncic makes 2/3 from the line.
Score: 30-34

[07:24] Team_074 possession (Score: 30-34)
Giannis Westbrook attempts a 3Pt. Contested by Immanuel Nowitzki (4.7 feet, ZONE). Giannis Westbrook misses. Offensive rebound by Yao Randle! Yao Randle kicks it out.

[07:10] Team_074 possession (Score: 30-34)
FOUL! Reach-in foul on Lamelo Herro during the drive. [Team fouls: 2] No free throws, side out. (Lamelo Herro: 1 personal fouls)

[06:55] Team_074 possession (Score: 30-34)
Ayo Smith attempts a Layup. Contested by Giannis Doncic (3.9 feet, ZONE). Ayo Smith misses. Rebound secured by Giannis Doncic.

[06:40] Team_016 possession (Score: 30-34)
Lamelo Herro attempts a 3Pt. Contested by Giannis Westbrook (4.4 feet, ZONE). LAMELO HERRO MAKES IT! Assist: Kevin Butler
Score: 33-34

[06:25] Team_074 possession (Score: 33-34)
Yao Randle attempts a Midrange. Contested by Giannis Doncic (3.9 feet, MAN). Yao Randle misses. Rebound secured by Lamelo Herro.

[06:08] Team_016 possession (Score: 33-34)
Immanuel Nowitzki attempts a 3Pt. Contested by Giannis Westbrook (4.5 feet, MAN). IMMANUEL NOWITZKI MAKES IT!
Score: 36-34

[05:50] Team_074 possession (Score: 36-34)
Ayo Smith attempts a 3Pt. Contested by Lamelo Herro (4.0 feet, ZONE). AYO SMITH MAKES IT! Assist: Jaren Rozier
Score: 36-37

[05:36] Team_016 possession (Score: 36-37)
Trae Barnes drives and kicks out. Trae Barnes attempts a Midrange. Contested by Jaren Rozier (4.4 feet, MAN). Trae Barnes misses. Rebound secured by Ayo Smith.

[05:22] Team_074 possession (Score: 36-37)
FOUL! Shooting foul on Giannis Doncic. James Barnes to the line for 2 free throws. [Team fouls: 3] (Giannis Doncic: 1 personal fouls)   FT 1/2: GOOD   FT 2/2: GOOD James Barnes makes 2/2 from the line.
Score: 36-39

[05:11] Team_016 possession (Score: 36-39)
Kevin Butler makes the Layup and draws the foul on Yao Randle! And-1! Kevin Butler to the line for 1. [Team fouls: 3] (Yao Randle: 2 personal fouls)   FT 1/1: GOOD Kevin Butler makes 1/1 from the line.
Score: 39-39

[04:52] Team_074 possession (Score: 39-39)
Ayo Smith attempts a 3Pt. Contested by Lamelo Herro (4.0 feet, ZONE). Ayo Smith misses. Rebound secured by Trae Barnes.

[04:41] Team_016 possession (Score: 39-39)
FOUL! Shooting foul on Ayo Smith. Immanuel Nowitzki to the line for 3 free throws. [Team fouls: 4] (Ayo Smith: 1 personal fouls)   FT 1/3: GOOD   FT 2/3: GOOD   FT 3/3: GOOD Immanuel Nowitzki makes 3/3 from the line.
Score: 42-39

[04:28] Team_074 possession (Score: 42-39)
Jaren Rozier attempts a Midrange. Contested by Lamelo Herro (3.6 feet, ZONE). JAREN ROZIER MAKES IT!
Score: 42-41

[04:14] Team_016 possession (Score: 42-41)
Immanuel Nowitzki drives and kicks out. Lamelo Herro attempts a 3Pt. Contested by James Barnes (4.2 feet, ZONE). Lamelo Herro misses. Offensive rebound by Giannis Doncic! Giannis Doncic kicks it out.

[04:04] Team_016 possession (Score: 42-41)
Trae Barnes attempts a Layup. Contested by Yao Randle (4.3 feet, ZONE). Trae Barnes misses. Rebound secured by Ayo Smith.

[03:49] Team_074 possession (Score: 42-41)
Jaren Rozier attempts a Midrange. Contested by Kevin Butler (4.3 feet, ZONE). Jaren Rozier misses. Offensive rebound by Jaren Rozier! Jaren Rozier kicks it out.

[03:29] Team_074 possession (Score: 42-41)
Giannis Westbrook attempts a 3Pt. Contested by Lamelo Herro (3.9 feet, ZONE). Giannis Westbrook misses. Rebound secured by Giannis Doncic.

[03:18] Team_016 possession (Score: 42-41)
Immanuel Nowitzki attempts a 3Pt. Contested by James Barnes (4.4 feet, ZONE). IMMANUEL NOWITZKI MAKES IT! Assist: Kevin Butler
Score: 45-41

[03:02] Team_074 possession (Score: 45-41)
Ayo Smith attempts a Midrange. Contested by Kevin Butler (4.6 feet, MAN). Ayo Smith misses. Rebound secured by Lamelo Herro.

[02:43] Team_016 possession (Score: 45-41)
Giannis Doncic attempts a Midrange. Contested by Yao Randle (4.6 feet, MAN). GIANNIS DONCIC MAKES IT! Assist: Immanuel Nowitzki
Score: 47-41

[02:28] Team_074 possession (Score: 47-41)
James Barnes drives to the basket... James Barnes commits a violation (traveling/carry)! TURNOVER! (dead ball)

[02:09] Team_016 possession (Score: 47-41)
Kevin Butler attempts a 3Pt. Contested by Ayo Smith (4.6 feet, MAN). Kevin Butler misses. Rebound secured by Ayo Smith.

[01:55] Team_074 possession (Score: 47-41)
James Barnes attempts a Midrange. Contested by Immanuel Nowitzki (4.7 feet, ZONE). James Barnes misses. Rebound secured by Lamelo Herro.

[01:36] Team_016 possession (Score: 47-41)
Immanuel Nowitzki attempts a 3Pt. Contested by Giannis Westbrook (4.7 feet, MAN). Immanuel Nowitzki misses. Rebound secured by Jaren Rozier.

[01:24] Team_074 possession (Score: 47-41)
FOUL! Holding foul on Giannis Doncic. [Team fouls: 4] No free throws, side out. (Giannis Doncic: 2 personal fouls)

[01:10] Team_074 possession (Score: 47-41)
Ayo Smith attempts a Midrange. Contested by Immanuel Nowitzki (5.0 feet, ZONE). AYO SMITH MAKES IT! Assist: Jaren Rozier
Score: 47-43

[00:52] Team_016 possession (Score: 47-43)
Kevin Butler attempts a 3Pt. Contested by Ayo Smith (4.7 feet, MAN). Kevin Butler misses. Rebound secured by Yao Randle.

[00:36] Team_074 possession (Score: 47-43)
James Barnes attempts a 3Pt. Contested by Lamelo Herro (3.9 feet, MAN). JAMES BARNES MAKES IT! Assist: Yao Randle
Score: 47-46

[00:22] Team_016 possession (Score: 47-46)
Kevin Butler makes the Midrange and draws the foul on Giannis Westbrook! And-1! Kevin Butler to the line for 1. [BONUS: 5 team fouls] (Giannis Westbrook: 1 personal fouls)   FT 1/1: GOOD Kevin Butler makes 1/1 from the line.
Score: 50-46

[00:11] Team_074 possession (Score: 50-46)
FOUL! Reach-in foul on Immanuel Nowitzki during the drive. [IN THE BONUS! 5 team fouls] Giannis Westbrook to the line for 2 free throws. (Immanuel Nowitzki: 1 personal fouls)   FT 1/2: GOOD   FT 2/2: GOOD Giannis Westbrook makes 2/2 from the line.
Score: 50-48

================================================================================
                              2ND QUARTER COMPLETE                              
================================================================================

2ND QUARTER SCORE: Team_016 30, Team_074 25

BOX SCORE:
================================================================================

Team_016
--------------------------------------------------------------------------------
Player                MIN  PTS  REB  AST  TO      FG   FG%      3P   3P%
--------------------------------------------------------------------------------
Immanuel Nowitzki      11    9    0    1   0   3/4    75.0     0/0   0.0
Kevin Butler           11    6    0    2   0   2/5    40.0     0/0   0.0
Lamelo Herro           11    5    3    1   0   2/2   100.0     0/0   0.0
Giannis Doncic         11    4    4    0   0   2/3    66.7     0/0   0.0
Giannis Ginobili       14    2    0    1   0   1/1   100.0     0/0   0.0
Ben Barrett            14    2    1    0   0   1/1   100.0     0/0   0.0
Trae Barnes            11    2    1    0   0   1/4    25.0     0/0   0.0
Collin Barnes          14    0    0    1   0   0/0     0.0     0/0   0.0
Vince Quickley         14    0    1    0   0   0/0     0.0     0/0   0.0

TEAM: FG: 12/20 (60.0%), 3PT: 5/9 (55.6%), REB: 10 (1 off, 9 def), AST: 6, TO: 1
TEAM FOULS: 5 [Team_074 in BONUS]


Team_074
--------------------------------------------------------------------------------
Player                MIN  PTS  REB  AST  TO      FG   FG%      3P   3P%
--------------------------------------------------------------------------------
James Barnes           11    8    0    0   0   3/4    75.0     0/0   0.0
Ayo Smith              11    8    4    1   0   3/6    50.0     0/0   0.0
Giannis Westbrook      11    5    0    0   0   2/4    50.0     0/0   0.0
Yao Randle             11    2    4    2   0   1/2    50.0     0/0   0.0
Jaren Rozier           11    2    2    4   0   1/1   100.0     0/0   0.0
Donovan Doncic         14    0    0    0   0   0/1     0.0     0/0   0.0
James Turner           14    0    0    0   0   0/1     0.0     0/0   0.0

TEAM: FG: 10/19 (52.6%), 3PT: 5/9 (55.6%), REB: 10 (2 off, 8 def), AST: 7, TO: 2
TEAM FOULS: 5 [Team_016 in BONUS]

================================================================================

================================================================================
                       3RD QUARTER - Team_016 vs Team_074                       
================================================================================

[12:00] Team_016 possession (Score: 50-48)
Vince Duncan drives to the basket... Vince Duncan commits a violation (traveling/carry)! TURNOVER! (dead ball)

[11:46] Team_074 possession (Score: 50-48)
Donovan Doncic drives to the basket... Donovan Doncic loses control! Ball rolls out of bounds! TURNOVER! (dead ball)

[11:28] Team_016 possession (Score: 50-48)
Giannis Ginobili makes the Layup and draws the foul on Donovan Doncic! And-1! Giannis Ginobili to the line for 1. [Team fouls: 1] (Donovan Doncic: 1 personal fouls)   FT 1/1: GOOD Giannis Ginobili makes 1/1 from the line.
Score: 53-48

[11:13] Team_074 possession (Score: 53-48)
Shai Green attempts a 3Pt. Contested by Vince Quickley (4.8 feet, MAN). Shai Green misses. Rebound secured by Ben Barrett.

[11:00] Team_016 possession (Score: 53-48)
Collin Barnes attempts a 3Pt. Contested by Dwyane Quickley (5.5 feet, ZONE). COLLIN BARNES MAKES IT! Assist: Vince Duncan
Score: 56-48

[10:43] Team_074 possession (Score: 56-48)
Dwyane Quickley makes the Layup and draws the foul on Vince Duncan! And-1! Dwyane Quickley to the line for 1. [Team fouls: 1] (Vince Duncan: 1 personal fouls)   FT 1/1: GOOD Dwyane Quickley makes 1/1 from the line.
Score: 56-51

[10:27] Team_016 possession (Score: 56-51)
Giannis Ginobili drives, Chris Carter stays with him. Giannis Ginobili attempts a Dunk. Contested by Chris Carter (4.3 feet, MAN). Giannis Ginobili misses. Rebound secured by James Turner.

[10:14] Team_074 possession (Score: 56-51)
FOUL! Holding foul on Giannis Ginobili. [Team fouls: 2] No free throws, side out. (Giannis Ginobili: 1 personal fouls)

[10:01] Team_074 possession (Score: 56-51)
James Turner attempts a 3Pt. Contested by Collin Barnes (4.7 feet, ZONE). JAMES TURNER MAKES IT! Assist: Dwyane Quickley
Score: 56-54

[09:43] Team_016 possession (Score: 56-54)
Ben Barrett attempts a Midrange. Contested by Donovan Doncic (4.2 feet, MAN). Ben Barrett misses. Rebound secured by James Turner.

[09:31] Team_074 possession (Score: 56-54)
FOUL! Holding foul on Vince Duncan. [Team fouls: 3] No free throws, side out. (Vince Duncan: 2 personal fouls)

[09:13] Team_074 possession (Score: 56-54)
Dwyane Quickley drives and kicks out. Dwyane Quickley attempts a 3Pt. Contested by Collin Barnes (4.0 feet, MAN). Dwyane Quickley misses. Rebound secured by Vince Duncan.

[08:57] Team_016 possession (Score: 56-54)
Vince Quickley drives, picks up Donovan Doncic. Help arrives from Chris Carter! Vince Quickley attempts a Layup. Contested by Chris Carter (3.2 feet, ZONE). VINCE QUICKLEY MAKES IT! Assist: Ben Barrett
Score: 58-54

[08:45] Team_074 possession (Score: 58-54)
Dwyane Quickley attempts a Midrange. Contested by Giannis Ginobili (5.9 feet, ZONE). DWYANE QUICKLEY MAKES IT! Assist: James Turner
Score: 58-56

[08:28] Team_016 possession (Score: 58-56)
Collin Barnes drives and kicks out. Vince Quickley attempts a Midrange. Contested by Shai Green (3.5 feet, MAN). VINCE QUICKLEY MAKES IT! Assist: Giannis Ginobili
Score: 60-56

[08:12] Team_074 possession (Score: 60-56)
James Turner drives to the basket... James Turner loses control! Ball rolls out of bounds! TURNOVER! (dead ball)

[07:53] Team_016 possession (Score: 60-56)
Giannis Ginobili attempts a 3Pt. Contested by Chris Carter (4.3 feet, MAN). GIANNIS GINOBILI MAKES IT! Assist: Collin Barnes
Score: 63-56

[07:40] Team_074 possession (Score: 63-56)
Chris Carter attempts a 3Pt. Contested by Collin Barnes (4.7 feet, ZONE). Chris Carter misses. Rebound secured by Ben Barrett.

[07:25] Team_016 possession (Score: 63-56)
FOUL! Reach-in foul on Donovan Doncic during the drive. [Team fouls: 2] No free throws, side out. (Donovan Doncic: 2 personal fouls)

[07:14] Team_016 possession (Score: 63-56)
Ben Barrett drives, James Turner stays with him. Ben Barrett attempts a Layup. Contested by James Turner (4.0 feet, ZONE). BEN BARRETT MAKES IT!
Score: 65-56

[06:57] Team_074 possession (Score: 65-56)
Dwyane Quickley drives to the basket... Dwyane Quickley loses the ball! Stripped by Vince Duncan! TURNOVER! (live ball)

[06:39] Team_016 possession (Score: 65-56)
Vince Quickley drives to the basket... Vince Quickley throws a bad pass! Stolen by Shai Green! TURNOVER! (live ball)

[06:29] Team_074 possession (Score: 65-56)
FOUL! Reach-in foul on Vince Duncan during the drive. [Team fouls: 4] No free throws, side out. (Vince Duncan: 3 personal fouls)

[06:16] Team_074 possession (Score: 65-56)
FOUL! Shooting foul on Vince Quickley. James Turner to the line for 2 free throws. [BONUS: 5 team fouls] (Vince Quickley: 1 personal fouls)   FT 1/2: MISS   FT 2/2: GOOD James Turner makes 1/2 from the line.
Score: 65-57

[05:59] Team_016 possession (Score: 65-57)
Giannis Ginobili attempts a Midrange. Contested by Chris Carter (4.3 feet, MAN). Giannis Ginobili misses. Rebound secured by James Turner.

[05:44] Team_074 possession (Score: 65-57)
Shai Green drives, Vince Quickley stays with him. Shai Green attempts a Dunk. Contested by Vince Quickley (4.8 feet, MAN). Shai Green misses. Offensive rebound by James Turner! James Turner puts it back in!
Score: 65-59

[05:25] Team_016 possession (Score: 65-59)
Vince Duncan drives, Donovan Doncic stays with him. Vince Duncan attempts a Dunk. Contested by Donovan Doncic (4.1 feet, ZONE). VINCE DUNCAN MAKES IT!
Score: 67-59

[05:10] Team_074 possession (Score: 67-59)
James Turner attempts a Midrange. Contested by Ben Barrett (4.3 feet, ZONE). James Turner misses. Rebound secured by Vince Duncan.

[04:54] Team_016 possession (Score: 67-59)
Collin Barnes attempts a 3Pt. Contested by Dwyane Quickley (5.5 feet, ZONE). COLLIN BARNES MAKES IT! Assist: Vince Quickley
Score: 70-59

[04:40] Team_074 possession (Score: 70-59)
Dwyane Quickley drives and kicks out. Chris Carter attempts a 3Pt. Contested by Giannis Ginobili (5.6 feet, MAN). Chris Carter misses. Rebound secured by Vince Duncan.

[04:31] Team_016 possession (Score: 70-59)
Ben Barrett drives, Donovan Doncic stays with him. Ben Barrett attempts a Layup. Contested by Donovan Doncic (4.2 feet, ZONE). BEN BARRETT MAKES IT! Assist: Vince Duncan
Score: 72-59

[04:21] Team_074 possession (Score: 72-59)
Chris Carter attempts a Layup. BLOCKED BY COLLIN BARNES! Ball is loose! Rebound secured by Vince Quickley.

[04:09] Team_016 possession (Score: 72-59)
Collin Barnes attempts a 3Pt. Contested by Dwyane Quickley (5.5 feet, MAN). Collin Barnes misses. Rebound secured by Shai Green.

[03:58] Team_074 possession (Score: 72-59)
FOUL! Shooting foul on Collin Barnes. Dwyane Quickley to the line for 3 free throws. [BONUS: 6 team fouls] (Collin Barnes: 1 personal fouls)   FT 1/3: GOOD   FT 2/3: GOOD   FT 3/3: GOOD Dwyane Quickley makes 3/3 from the line.
Score: 72-62

[03:41] Team_016 possession (Score: 72-62)
Giannis Ginobili attempts a 3Pt. Contested by Chris Carter (4.5 feet, MAN). Giannis Ginobili misses. Offensive rebound by Vince Duncan! Vince Duncan's putback is no good. Rebound secured by James Turner.

[03:26] Team_074 possession (Score: 72-62)
Dwyane Quickley attempts a 3Pt. Contested by Collin Barnes (4.5 feet, MAN). Dwyane Quickley misses. Rebound secured by Vince Quickley.

[03:11] Team_016 possession (Score: 72-62)
Giannis Ginobili attempts a 3Pt. Contested by Dwyane Quickley (5.6 feet, ZONE). GIANNIS GINOBILI MAKES IT! Assist: Collin Barnes
Score: 75-62

[02:57] Team_074 possession (Score: 75-62)
Donovan Doncic attempts a 3Pt. Contested by Vince Quickley (4.7 feet, ZONE). Donovan Doncic misses. Rebound secured by Vince Duncan.

[02:42] Team_016 possession (Score: 75-62)
Giannis Ginobili attempts a Midrange. Contested by Chris Carter (4.6 feet, ZONE). GIANNIS GINOBILI MAKES IT! Assist: Vince Quickley
Score: 77-62

[02:32] Team_074 possession (Score: 77-62)
Shai Green makes the 3Pt and draws the foul on Vince Quickley! And-1! Shai Green to the line for 1. [BONUS: 7 team fouls] (Vince Quickley: 2 personal fouls)   FT 1/1: GOOD Shai Green makes 1/1 from the line.
Score: 77-66

[02:13] Team_016 possession (Score: 77-66)
Vince Quickley attempts a 3Pt. Contested by Shai Green (3.3 feet, MAN). VINCE QUICKLEY MAKES IT! Assist: Collin Barnes
Score: 80-66

[01:58] Team_074 possession (Score: 80-66)
Shai Green drives, Vince Duncan stays with him. Shai Green attempts a Layup. Contested by Vince Duncan (4.0 feet, ZONE). Shai Green misses. Offensive rebound by James Turner! James Turner's putback is no good. Rebound secured by Vince Duncan.

[01:45] Team_016 possession (Score: 80-66)
Vince Duncan drives to the basket... Vince Duncan loses the ball! Stripped by James Turner! TURNOVER! (live ball)

[01:31] Team_074 possession (Score: 80-66)
FOUL! Holding foul on Giannis Ginobili. [IN THE BONUS! 8 team fouls] Chris Carter to the line for 2 free throws. (Giannis Ginobili: 2 personal fouls)   FT 1/2: GOOD   FT 2/2: GOOD Chris Carter makes 2/2 from the line.
Score: 80-68

[01:13] Team_016 possession (Score: 80-68)
FOUL! Shooting foul on James Turner. Vince Duncan to the line for 2 free throws. [Team fouls: 3] (James Turner: 1 personal fouls)   FT 1/2: MISS   FT 2/2: GOOD Vince Duncan makes 1/2 from the line.
Score: 81-68

[00:57] Team_074 possession (Score: 81-68)
Donovan Doncic drives, picks up Ben Barrett. Help arrives from Collin Barnes! Donovan Doncic attempts a Dunk. Contested by Collin Barnes (4.4 feet, MAN). Donovan Doncic misses. Rebound secured by Vince Duncan.

[00:43] Team_016 possession (Score: 81-68)
FOUL! Shooting foul on Dwyane Quickley. Collin Barnes to the line for 3 free throws. [Team fouls: 4] (Dwyane Quickley: 1 personal fouls)   FT 1/3: GOOD   FT 2/3: MISS   FT 3/3: GOOD Collin Barnes makes 2/3 from the line.
Score: 83-68

[00:30] Team_074 possession (Score: 83-68)
Donovan Doncic drives to the basket... Donovan Doncic loses the ball! Stripped by Ben Barrett! TURNOVER! (live ball)

[00:11] Team_016 possession (Score: 83-68)
Collin Barnes attempts a Midrange. Contested by Donovan Doncic (4.1 feet, ZONE). COLLIN BARNES MAKES IT! Assist: Ben Barrett
Score: 85-68

================================================================================
                              3RD QUARTER COMPLETE                              
================================================================================

3RD QUARTER SCORE: Team_016 35, Team_074 20

BOX SCORE:
================================================================================

Team_016
--------------------------------------------------------------------------------
Player                MIN  PTS  REB  AST  TO      FG   FG%      3P   3P%
--------------------------------------------------------------------------------
Giannis Ginobili       26   11    0    1   0   4/7    57.1     0/0   0.0
Collin Barnes          26   10    0    3   0   4/5    80.0     0/0   0.0
Vince Quickley         26    7    2    2   0   3/3   100.0     0/0   0.0
James Turner           26    6    5    1   0   3/4    75.0     0/0   0.0
Ben Barrett            26    4    2    2   0   2/3    66.7     0/0   0.0
Vince Duncan           26    3    6    2   0   2/2   100.0     0/0   0.0

TEAM: FG: 15/20 (75.0%), 3PT: 6/8 (75.0%), REB: 10 (1 off, 9 def), AST: 10, TO: 3
TEAM FOULS: 8 [Team_074 in BONUS]


Team_074
--------------------------------------------------------------------------------
Player                MIN  PTS  REB  AST  TO      FG   FG%      3P   3P%
--------------------------------------------------------------------------------
Dwyane Quickley        26    8    0    1   0   3/6    50.0     0/0   0.0
Shai Green             26    4    1    0   0   1/3    33.3     0/0   0.0
Chris Carter           26    2    0    0   0   1/3    33.3     0/0   0.0
Donovan Doncic         26    0    0    0   0   0/2     0.0     0/0   0.0

TEAM: FG: 8/18 (44.4%), 3PT: 3/7 (42.9%), REB: 6 (2 off, 4 def), AST: 2, TO: 4
TEAM FOULS: 4

================================================================================

================================================================================
                       4TH QUARTER - Team_016 vs Team_074                       
================================================================================

[12:00] Team_016 possession (Score: 85-68)
Giannis Ginobili attempts a 3Pt. Contested by Dwyane Quickley (5.7 feet, ZONE). GIANNIS GINOBILI MAKES IT! Assist: Vince Quickley
Score: 88-68

[11:47] Team_074 possession (Score: 88-68)
Donovan Doncic drives, Vince Duncan stays with him. Donovan Doncic attempts a Layup. Contested by Vince Duncan (3.8 feet, ZONE). Donovan Doncic misses. Rebound secured by Vince Duncan.

[11:32] Team_016 possession (Score: 88-68)
Giannis Ginobili makes the Dunk and draws the foul on Donovan Doncic! And-1! Giannis Ginobili to the line for 1. [Team fouls: 1] (Donovan Doncic: 1 personal fouls)   FT 1/1: GOOD Giannis Ginobili makes 1/1 from the line.
Score: 91-68

[11:17] Team_074 possession (Score: 91-68)
Chris Carter attempts a Midrange. Wide open! Giannis Ginobili is 6.4 feet away. [MAN] Chris Carter misses. Rebound secured by Vince Quickley.

[10:59] Team_016 possession (Score: 91-68)
Ben Barrett attempts a 3Pt. Wide open! Dwyane Quickley is 6.2 feet away. [ZONE] BEN BARRETT MAKES IT! Assist: Vince Duncan
Score: 94-68

[10:44] Team_074 possession (Score: 94-68)
Chris Carter makes the Layup and draws the foul on Vince Duncan! And-1! Chris Carter to the line for 1. [Team fouls: 1] (Vince Duncan: 1 personal fouls)   FT 1/1: GOOD Chris Carter makes 1/1 from the line.
Score: 94-71

[10:29] Team_016 possession (Score: 94-71)
Collin Barnes makes the Dunk and draws the foul on Donovan Doncic! And-1! Collin Barnes to the line for 1. [Team fouls: 2] (Donovan Doncic: 2 personal fouls)   FT 1/1: MISS Collin Barnes makes 0/1 from the line. Rebound secured by James Turner.
Score: 96-71

[10:16] Team_074 possession (Score: 96-71)
FOUL! Shooting foul on Ben Barrett. Shai Green to the line for 2 free throws. [Team fouls: 2] (Ben Barrett: 1 personal fouls)   FT 1/2: MISS   FT 2/2: GOOD Shai Green makes 1/2 from the line.
Score: 96-72

[10:02] Team_016 possession (Score: 96-72)
Vince Duncan drives and kicks out. Vince Duncan attempts a 3Pt. Contested by James Turner (3.9 feet, MAN). Vince Duncan misses. Rebound secured by Shai Green.

[09:47] Team_074 possession (Score: 96-72)
James Turner attempts a Layup. Contested by Vince Duncan (4.4 feet, ZONE). JAMES TURNER MAKES IT! Assist: Donovan Doncic
Score: 96-74

[09:32] Team_016 possession (Score: 96-74)
Collin Barnes loses control! Ball rolls out of bounds! TURNOVER! (dead ball)

[09:32] Substitution (Team_016): Collin Barnes OUT → Lamelo Herro IN (stamina_rule2)

[09:32] Substitution (Team_016): Giannis Ginobili OUT → Immanuel Nowitzki IN (stamina_rule2)

[09:32] Substitution (Team_016): Vince Quickley OUT → Kevin Butler IN (stamina_rule2)

[09:32] Substitution (Team_016): Ben Barrett OUT → Giannis Doncic IN (stamina_rule2)

[09:32] Substitution (Team_016): Vince Duncan OUT → Trae Barnes IN (stamina_rule2)

[09:32] Substitution (Team_074): Dwyane Quickley OUT → James Barnes IN (stamina_rule2)

[09:32] Substitution (Team_074): Chris Carter OUT → Giannis Westbrook IN (stamina_rule2)

[09:32] Substitution (Team_074): Shai Green OUT → Ayo Smith IN (stamina_rule2)

[09:32] Substitution (Team_074): Donovan Doncic OUT → Yao Randle IN (stamina_rule2)

[09:32] Substitution (Team_074): James Turner OUT → Jaren Rozier IN (stamina_rule2)

[09:18] Team_074 possession (Score: 96-74)
James Barnes drives to the basket... FOUL! Offensive foul on James Barnes! Lamelo Herro drew the charge! [Team fouls: 3] (James Barnes: 1 personal fouls) TURNOVER! (dead ball)

[09:08] Team_016 possession (Score: 96-74)
Immanuel Nowitzki makes the Dunk and draws the foul on Giannis Westbrook! And-1! Immanuel Nowitzki to the line for 1. [Team fouls: 4] (Giannis Westbrook: 1 personal fouls)   FT 1/1: GOOD Immanuel Nowitzki makes 1/1 from the line.
Score: 99-74

[08:54] Team_074 possession (Score: 99-74)
Ayo Smith attempts a 3Pt. Contested by Kevin Butler (4.6 feet, MAN). Ayo Smith misses. Rebound secured by Giannis Doncic.

[08:41] Team_016 possession (Score: 99-74)
Giannis Doncic attempts a Midrange. Contested by Ayo Smith (4.8 feet, ZONE). Giannis Doncic misses. Rebound secured by Yao Randle.

[08:28] Team_074 possession (Score: 99-74)
Yao Randle drives, Giannis Doncic stays with him. Yao Randle attempts a Dunk. Contested by Giannis Doncic (3.9 feet, MAN). YAO RANDLE MAKES IT! Assist: Jaren Rozier
Score: 99-76

[08:15] Team_016 possession (Score: 99-76)
Immanuel Nowitzki commits a violation (traveling/carry)! TURNOVER! (dead ball)

[08:06] Team_074 possession (Score: 99-76)
Giannis Westbrook attempts a 3Pt. Contested by Lamelo Herro (3.9 feet, ZONE). Giannis Westbrook misses. Rebound secured by Trae Barnes.

[07:47] Team_016 possession (Score: 99-76)
Lamelo Herro drives, picks up Yao Randle. Help arrives from Giannis Westbrook! Lamelo Herro attempts a Layup. Contested by Giannis Westbrook (4.4 feet, ZONE). Lamelo Herro misses. Rebound secured by Yao Randle.

[07:33] Team_074 possession (Score: 99-76)
James Barnes attempts a 3Pt. Contested by Lamelo Herro (3.7 feet, ZONE). JAMES BARNES MAKES IT! Assist: Ayo Smith
Score: 99-79

[07:15] Team_016 possession (Score: 99-79)
FOUL! Shooting foul on Giannis Westbrook. Immanuel Nowitzki to the line for 2 free throws. [BONUS: 5 team fouls] (Giannis Westbrook: 2 personal fouls)   FT 1/2: GOOD   FT 2/2: GOOD Immanuel Nowitzki makes 2/2 from the line.
Score: 101-79

[07:02] Team_074 possession (Score: 101-79)
Yao Randle loses the ball! Stripped by Giannis Doncic! TURNOVER! (live ball)

[06:47] Team_016 possession (Score: 101-79)
Immanuel Nowitzki attempts a 3Pt. Contested by James Barnes (4.3 feet, ZONE). Immanuel Nowitzki misses. Rebound secured by Yao Randle.

[06:31] Team_074 possession (Score: 101-79)
Yao Randle attempts a Midrange. Contested by Immanuel Nowitzki (4.8 feet, ZONE). Yao Randle misses. Rebound secured by Trae Barnes.

[06:14] Team_016 possession (Score: 101-79)
Kevin Butler attempts a 3Pt. Contested by James Barnes (4.0 feet, ZONE). Kevin Butler misses. Rebound secured by Jaren Rozier.

[05:58] Team_074 possession (Score: 101-79)
Jaren Rozier attempts a Layup. BLOCKED BY GIANNIS DONCIC! Ball deflects out of bounds off Jaren Rozier.

[05:45] Team_016 possession (Score: 101-79)
FOUL! Reach-in foul on Yao Randle during the drive. [IN THE BONUS! 6 team fouls] Lamelo Herro to the line for 2 free throws. (Yao Randle: 1 personal fouls)   FT 1/2: GOOD   FT 2/2: GOOD Lamelo Herro makes 2/2 from the line.
Score: 103-79

[05:28] Team_074 possession (Score: 103-79)
Jaren Rozier drives, picks up Trae Barnes. Help arrives from Lamelo Herro! Jaren Rozier attempts a Layup. Contested by Lamelo Herro (5.5 feet, MAN). Jaren Rozier misses. Rebound secured by Lamelo Herro.

[05:11] Team_016 possession (Score: 103-79)
Immanuel Nowitzki drives and kicks out. Immanuel Nowitzki attempts a Midrange. Contested by Jaren Rozier (4.4 feet, ZONE). Immanuel Nowitzki misses. Offensive rebound by Giannis Doncic! Giannis Doncic kicks it out.

[04:52] Team_016 possession (Score: 103-79)
Trae Barnes drives, Yao Randle stays with him. Trae Barnes attempts a Layup. Contested by Yao Randle (4.3 feet, ZONE). TRAE BARNES MAKES IT! Assist: Lamelo Herro
Score: 105-79

[04:35] Team_074 possession (Score: 105-79)
Jaren Rozier attempts a Midrange. Contested by Kevin Butler (4.2 feet, ZONE). Jaren Rozier misses. Rebound secured by Giannis Doncic.

[04:19] Team_016 possession (Score: 105-79)
Kevin Butler attempts a Midrange. Contested by Giannis Westbrook (4.2 feet, ZONE). Kevin Butler misses. Rebound secured by Jaren Rozier.

[04:04] Team_074 possession (Score: 105-79)
James Barnes attempts a Midrange. Contested by Immanuel Nowitzki (4.5 feet, ZONE). James Barnes misses. Rebound secured by Lamelo Herro.

[03:48] Team_016 possession (Score: 105-79)
Lamelo Herro attempts a Midrange. Contested by Giannis Westbrook (4.4 feet, ZONE). Lamelo Herro misses. Rebound secured by Jaren Rozier.

[03:32] Team_074 possession (Score: 105-79)
Ayo Smith attempts a 3Pt. Contested by Kevin Butler (4.6 feet, MAN). Ayo Smith misses. Rebound secured by Giannis Doncic.

[03:18] Team_016 possession (Score: 105-79)
Immanuel Nowitzki drives and kicks out. Kevin Butler attempts a 3Pt. Contested by Ayo Smith (4.8 feet, MAN). Kevin Butler misses. Rebound secured by Yao Randle.

[03:00] Team_074 possession (Score: 105-79)
Ayo Smith drives and kicks out. Giannis Westbrook attempts a 3Pt. Contested by Immanuel Nowitzki (4.6 feet, MAN). Giannis Westbrook misses. Offensive rebound by Jaren Rozier! Jaren Rozier kicks it out.

[02:48] Team_074 possession (Score: 105-79)
Giannis Westbrook drives, Giannis Doncic stays with him. Giannis Westbrook attempts a Dunk. Contested by Giannis Doncic (3.8 feet, ZONE). Giannis Westbrook misses. Offensive rebound by Yao Randle! Yao Randle kicks it out.

[02:32] Team_074 possession (Score: 105-79)
Giannis Westbrook drives, Immanuel Nowitzki stays with him. Giannis Westbrook attempts a Layup. Contested by Immanuel Nowitzki (4.7 feet, MAN). Giannis Westbrook misses. Rebound secured by Trae Barnes.

[02:17] Team_016 possession (Score: 105-79)
Lamelo Herro attempts a 3Pt. Contested by James Barnes (4.2 feet, ZONE). LAMELO HERRO MAKES IT! Assist: Kevin Butler
Score: 108-79

[02:05] Team_074 possession (Score: 108-79)
James Barnes loses the ball! Stripped by Lamelo Herro! TURNOVER! (live ball)

[01:52] Team_016 possession (Score: 108-79)
FOUL! Holding foul on Giannis Westbrook. [IN THE BONUS! 7 team fouls] Immanuel Nowitzki to the line for 2 free throws. (Giannis Westbrook: 3 personal fouls)   FT 1/2: GOOD   FT 2/2: GOOD Immanuel Nowitzki makes 2/2 from the line.
Score: 110-79

[01:39] Team_074 possession (Score: 110-79)
Jaren Rozier attempts a Midrange. Contested by Immanuel Nowitzki (4.5 feet, ZONE). JAREN ROZIER MAKES IT! Assist: Ayo Smith
Score: 110-81

[01:26] Team_016 possession (Score: 110-81)
FOUL! Holding foul on Ayo Smith. [IN THE BONUS! 8 team fouls] Kevin Butler to the line for 2 free throws. (Ayo Smith: 1 personal fouls)   FT 1/2: MISS   FT 2/2: GOOD Kevin Butler makes 1/2 from the line.
Score: 111-81

[01:10] Team_074 possession (Score: 111-81)
James Barnes attempts a Midrange. Contested by Lamelo Herro (3.8 feet, MAN). James Barnes misses. Rebound secured by Giannis Doncic.

[00:57] Team_016 possession (Score: 111-81)
Kevin Butler drives to the basket... Kevin Butler throws a bad pass out of bounds! TURNOVER! (dead ball)

[00:43] Team_074 possession (Score: 111-81)
Ayo Smith attempts a Layup. BLOCKED BY KEVIN BUTLER! Ball deflects out of bounds off Ayo Smith.

[00:33] Team_016 possession (Score: 111-81)
Kevin Butler attempts a 3Pt. Contested by Ayo Smith (4.7 feet, MAN). Kevin Butler misses. Rebound secured by Yao Randle.

[00:21] Team_074 possession (Score: 111-81)
Yao Randle attempts a 3Pt. Contested by Giannis Doncic (4.0 feet, MAN). Yao Randle misses. Rebound secured by Trae Barnes.

[00:08] Team_016 possession (Score: 111-81)
Immanuel Nowitzki attempts a 3Pt. Contested by Ayo Smith (5.0 feet, ZONE). Immanuel Nowitzki misses. Offensive rebound by Trae Barnes! Trae Barnes kicks it out.

================================================================================
                              4TH QUARTER COMPLETE                              
================================================================================

4TH QUARTER SCORE: Team_016 26, Team_074 13

BOX SCORE:
================================================================================

Team_016
--------------------------------------------------------------------------------
Player                MIN  PTS  REB  AST  TO      FG   FG%      3P   3P%
--------------------------------------------------------------------------------
Immanuel Nowitzki      20    7    0    0   0   3/5    60.0     0/0   0.0
Giannis Ginobili       28    6    0    0   0   2/2   100.0     0/0   0.0
Lamelo Herro           20    5    2    1   0   2/4    50.0     0/0   0.0
Ben Barrett            28    3    0    0   0   1/1   100.0     0/0   0.0
Trae Barnes            20    2    5    0   0   1/1   100.0     0/0   0.0
Kevin Butler           20    1    0    1   0   1/4    25.0     0/0   0.0
Vince Quickley         28    0    1    1   0   0/0     0.0     0/0   0.0
Vince Duncan           28    0    1    1   0   0/1     0.0     0/0   0.0
Collin Barnes          28    0    0    0   0   0/1     0.0     0/0   0.0
Giannis Doncic         20    0    5    0   0   0/1     0.0     0/0   0.0

TEAM: FG: 10/20 (50.0%), 3PT: 3/6 (50.0%), REB: 14 (2 off, 12 def), AST: 4, TO: 3
TEAM FOULS: 2


Team_074
--------------------------------------------------------------------------------
Player                MIN  PTS  REB  AST  TO      FG   FG%      3P   3P%
--------------------------------------------------------------------------------
Chris Carter           28    3    0    0   0   1/2    50.0     0/0   0.0
James Barnes           20    3    0    0   0   1/3    33.3     0/0   0.0
James Turner           28    2    1    0   0   1/1   100.0     0/0   0.0
Yao Randle             20    2    6    0   0   1/3    33.3     0/0   0.0
Jaren Rozier           20    2    4    1   0   1/4    25.0     0/0   0.0
Shai Green             28    1    1    0   0   1/1   100.0     0/0   0.0
Donovan Doncic         28    0    0    1   0   0/1     0.0     0/0   0.0
Ayo Smith              20    0    0    2   0   0/3     0.0     0/0   0.0
Giannis Westbrook      20    0    0    0   0   0/2     0.0     0/0   0.0

TEAM: FG: 6/20 (30.0%), 3PT: 1/5 (20.0%), REB: 12 (2 off, 10 def), AST: 4, TO: 3
TEAM FOULS: 8 [Team_016 in BONUS]

================================================================================

================================================================================
                               FULL GAME COMPLETE                               
================================================================================

FINAL SCORE: Team_016 111, Team_074 81

SCORING BY QUARTER:
--------------------------------------------------------------------------------
Team                     Q1     Q2     Q3     Q4    FINAL
--------------------------------------------------------------------------------
Team_016                 20     30     35     26      111
Team_074                 23     25     20     13       81
--------------------------------------------------------------------------------

FULL GAME BOX SCORE:
================================================================================

Team_016
--------------------------------------------------------------------------------
Player                MIN  PTS  REB  AST  TO      FG   FG%      3P   3P%      FT STL BLK
--------------------------------------------------------------------------------
Collin Barnes          28   18    0    5   4   8/13   61.5   5/8    62.5   4/7     0   1
Giannis Ginobili       28   21    0    2   1   6/10   60.0   3/4    75.0   4/4     0   0
Vince Quickley         28   12    5    3   3   3/4    75.0   1/1   100.0   0/0     0   0
Ben Barrett            28   13    7    4   1   7/8    87.5   1/1   100.0   1/2     1   0
Vince Duncan           28    3   14    4   0   3/8    37.5   0/1     0.0   1/2     1   0
Lamelo Herro           20   10    5    2   1   4/6    66.7   2/2   100.0   2/2     1   0
Immanuel Nowitzki      20   16    0    1   1   5/8    62.5   3/5    60.0   8/8     0   0
Kevin Butler           20    7    0    3   0   2/8    25.0   0/5     0.0   3/4     0   1
Giannis Doncic         20    4    9    0   0   2/4    50.0   1/1   100.0   2/3     2   1
Trae Barnes            20    4    6    0   0   2/5    40.0   0/0     0.0   0/0     0   0

TEAM: FG: 45/77 (58.4%), 3PT: 16/28 (57.1%), REB: 46 (7 off, 39 def), AST: 24, TO: 11


Team_074
--------------------------------------------------------------------------------
Player                MIN  PTS  REB  AST  TO      FG   FG%      3P   3P%      FT STL BLK
--------------------------------------------------------------------------------
Dwyane Quickley        28    9    0    1   3   4/11   36.4   2/7    28.6   5/6     1   1
Chris Carter           28   11    0    1   0   4/7    57.1   2/3    66.7   6/7     0   1
Shai Green             28   11    5    1   1   6/12   50.0   2/6    33.3   5/7     1   0
Donovan Doncic         28    0    2    1   0   1/5    20.0   0/2     0.0   0/0     1   1
James Turner           28   18   13    2   0   5/8    62.5   1/2    50.0   3/4     1   0
James Barnes           20   11    0    0   1   4/7    57.1   3/3   100.0   2/2     0   0
Giannis Westbrook      20    5    0    0   0   2/6    33.3   1/3    33.3   2/2     0   0
Ayo Smith              20    8    4    3   1   3/9    33.3   2/5    40.0   0/0     0   0
Yao Randle             20    4   10    2   2   2/5    40.0   0/1     0.0   0/0     0   0
Jaren Rozier           20    4    6    5   1   2/5    40.0   0/0     0.0   0/0     0   0

TEAM: FG: 36/78 (46.2%), 3PT: 13/32 (40.6%), REB: 40 (9 off, 31 def), AST: 16, TO: 9

================================================================================
