================================================================================
                        FULL GAME - Team_080 vs Team_094                        
================================================================================

================================================================================
                       1ST QUARTER - Team_080 vs Team_094                       
================================================================================

[12:00] Team_080 possession (Score: 0-0)
Larry Paul throws a bad pass! Stolen by Kobe Wagner! TURNOVER! (live ball)

[11:46] Team_094 possession (Score: 0-0)
Tim Russell drives and kicks out. Kobe Bryant attempts a 3Pt. Contested by Lauri Dosunmu (4.0 feet, ZONE). Kobe Bryant misses. Rebound secured by Draymond Simons.

[11:30] Team_080 possession (Score: 0-0)
Lauri Dosunmu attempts a 3Pt. Contested by Terry Ingram (5.6 feet, MAN). LAURI DOSUNMU MAKES IT! Assist: Larry Paul
Score: 3-0

[11:17] Team_094 possession (Score: 3-0)
Tim Russell drives, Jaren Morant stays with him. Tim Russell attempts a Dunk. Contested by Jaren Morant (3.9 feet, MAN). TIM RUSSELL MAKES IT!
Score: 3-2

[11:05] Team_080 possession (Score: 3-2)
Larry Paul attempts a Midrange. Contested by Kobe Wagner (4.5 feet, MAN). Larry Paul misses. Rebound secured by Kobe Bryant.

[10:47] Team_094 possession (Score: 3-2)
Kobe Wagner attempts a Layup. Contested by Larry Paul (4.0 feet, MAN). KOBE WAGNER MAKES IT! Assist: Terry Ingram
Score: 3-4

[10:34] Team_080 possession (Score: 3-4)
Jaren Morant drives, Tim Russell stays with him. Jaren Morant attempts a Layup. Contested by Tim Russell (5.2 feet, ZONE). Jaren Morant misses. Rebound secured by Kobe Wagner.

[10:23] Team_094 possession (Score: 3-4)
Terry Ingram attempts a Midrange. Contested by Lauri Dosunmu (4.4 feet, MAN). TERRY INGRAM MAKES IT!
Score: 3-6

[10:09] Team_080 possession (Score: 3-6)
Jaren Morant drives, picks up Kobe Bryant. Help arrives from Lauri Thompson! Jaren Morant attempts a Dunk. Contested by Lauri Thompson (5.4 feet, ZONE). JAREN MORANT MAKES IT! Assist: Larry Paul
Score: 5-6

[09:53] Team_094 possession (Score: 5-6)
Terry Ingram attempts a 3Pt. Contested by Lauri Dosunmu (4.4 feet, ZONE). TERRY INGRAM MAKES IT! Assist: Kobe Bryant
Score: 5-9

[09:37] Team_080 possession (Score: 5-9)
Draymond Simons attempts a 3Pt. Contested by Kobe Bryant (5.2 feet, MAN). Draymond Simons misses. Rebound secured by Kobe Wagner.

[09:20] Team_094 possession (Score: 5-9)
Terry Ingram attempts a Midrange. Contested by Lauri Dosunmu (4.4 feet, MAN). TERRY INGRAM MAKES IT! Assist: Kobe Bryant
Score: 5-11

[09:07] Team_080 possession (Score: 5-11)
Draymond Simons drives, Tim Russell stays with him. Draymond Simons attempts a Dunk. Contested by Tim Russell (5.0 feet, ZONE). DRAYMOND SIMONS MAKES IT! Assist: Larry Paul
Score: 7-11

[08:52] Team_094 possession (Score: 7-11)
FOUL! Shooting foul on Jaren Morant. Tim Russell to the line for 2 free throws. [Team fouls: 1] (Jaren Morant: 1 personal fouls)   FT 1/2: GOOD   FT 2/2: GOOD Tim Russell makes 2/2 from the line.
Score: 7-13

[08:35] Team_080 possession (Score: 7-13)
Draymond Simons attempts a Layup. Contested by Kobe Bryant (5.2 feet, MAN). DRAYMOND SIMONS MAKES IT! Assist: Jaren Morant
Score: 9-13

[08:18] Team_094 possession (Score: 9-13)
Tim Russell attempts a 3Pt. Contested by Jaren Morant (3.9 feet, MAN). Tim Russell misses. Rebound secured by Jaren Morant.

[08:06] Team_080 possession (Score: 9-13)
Lauri Dosunmu drives and kicks out. Jaren Morant attempts a 3Pt. Contested by Tim Russell (4.8 feet, MAN). Jaren Morant misses. Rebound secured by Kobe Wagner.

[07:53] Team_094 possession (Score: 9-13)
FOUL! Shooting foul on Lauri Dosunmu. Kobe Bryant to the line for 3 free throws. [Team fouls: 2] (Lauri Dosunmu: 1 personal fouls)   FT 1/3: MISS   FT 2/3: GOOD   FT 3/3: MISS Kobe Bryant makes 1/3 from the line. Rebound secured by Draymond Simons.
Score: 9-14

[07:41] Team_080 possession (Score: 9-14)
Draymond Simons attempts a Dunk. BLOCKED BY KOBE BRYANT! Ball is loose! Rebound secured by Tim Russell.

[07:29] Team_094 possession (Score: 9-14)
Kobe Bryant drives and kicks out. Kobe Bryant attempts a 3Pt. Contested by Lauri Dosunmu (4.0 feet, ZONE). Kobe Bryant misses. Rebound secured by Larry Paul.

[07:12] Team_080 possession (Score: 9-14)
Jaren Morant drives, Tim Russell stays with him. Jaren Morant attempts a Layup. Contested by Tim Russell (5.2 feet, ZONE). JAREN MORANT MAKES IT!
Score: 11-14

[07:02] Team_094 possession (Score: 11-14)
Kobe Bryant drives, Draymond Simons stays with him. Kobe Bryant attempts a Dunk. Contested by Draymond Simons (4.1 feet, MAN). Kobe Bryant misses. Rebound secured by Jaren Morant.

[06:44] Team_080 possession (Score: 11-14)
Larry Paul attempts a Midrange. Contested by Kobe Wagner (4.5 feet, MAN). Larry Paul misses. Rebound secured by Kobe Wagner.

[06:25] Team_094 possession (Score: 11-14)
Tim Russell attempts a 3Pt. Contested by Jaren Morant (3.9 feet, MAN). Tim Russell misses. Offensive rebound by Tim Russell! Tim Russell kicks it out.

[06:11] Team_094 possession (Score: 11-14)
Lauri Thompson makes the Layup and draws the foul on Draymond Simons! And-1! Lauri Thompson to the line for 1. [Team fouls: 3] (Draymond Simons: 1 personal fouls)   FT 1/1: GOOD Lauri Thompson makes 1/1 from the line.
Score: 11-17

[05:56] Team_080 possession (Score: 11-17)
Khris Turner attempts a 3Pt. Contested by Lauri Thompson (5.0 feet, MAN). Khris Turner misses. Rebound secured by Tim Russell.

[05:43] Team_094 possession (Score: 11-17)
Terry Ingram makes the Dunk and draws the foul on Draymond Simons! And-1! Terry Ingram to the line for 1. [Team fouls: 4] (Draymond Simons: 2 personal fouls)   FT 1/1: GOOD Terry Ingram makes 1/1 from the line.
Score: 11-20

[05:30] Team_080 possession (Score: 11-20)
Larry Paul attempts a 3Pt. Contested by Kobe Wagner (4.5 feet, ZONE). Larry Paul misses. Rebound secured by Tim Russell.

[05:14] Team_094 possession (Score: 11-20)
Lauri Thompson attempts a Midrange. Contested by Khris Turner (5.0 feet, MAN). Lauri Thompson misses. Offensive rebound by Tim Russell! Tim Russell kicks it out.

[05:02] Team_094 possession (Score: 11-20)
Kobe Bryant makes the Layup and draws the foul on Draymond Simons! And-1! Kobe Bryant to the line for 1. [BONUS: 5 team fouls] (Draymond Simons: 3 personal fouls)   FT 1/1: GOOD Kobe Bryant makes 1/1 from the line.
Score: 11-23

[04:43] Team_080 possession (Score: 11-23)
Lauri Dosunmu attempts a 3Pt. Contested by Terry Ingram (5.6 feet, MAN). LAURI DOSUNMU MAKES IT! Assist: Draymond Simons
Score: 14-23

[04:28] Team_094 possession (Score: 14-23)
Kobe Bryant drives, Draymond Simons stays with him. Kobe Bryant attempts a Dunk. Contested by Draymond Simons (4.2 feet, ZONE). KOBE BRYANT MAKES IT! Assist: Tim Russell
Score: 14-25

[04:17] Team_080 possession (Score: 14-25)
Jaren Morant attempts a 3Pt. Contested by Tim Russell (5.2 feet, MAN). Jaren Morant misses. Rebound secured by Kobe Wagner.

[04:03] Team_094 possession (Score: 14-25)
FOUL! Shooting foul on Jaren Morant. Tim Russell to the line for 2 free throws. [BONUS: 6 team fouls] (Jaren Morant: 2 personal fouls)   FT 1/2: GOOD   FT 2/2: GOOD Tim Russell makes 2/2 from the line.
Score: 14-27

[03:50] Team_080 possession (Score: 14-27)
Khris Turner attempts a 3Pt. Contested by Kobe Wagner (4.5 feet, ZONE). Khris Turner misses. Rebound secured by Tim Russell.

[03:39] Team_094 possession (Score: 14-27)
FOUL! Shooting foul on Draymond Simons. Kobe Bryant to the line for 2 free throws. [BONUS: 7 team fouls] (Draymond Simons: 4 personal fouls)   FT 1/2: GOOD   FT 2/2: MISS Kobe Bryant makes 1/2 from the line. Offensive rebound by Tim Russell! Tim Russell kicks it out.
Score: 14-28

[03:24] Team_094 possession (Score: 14-28)
Kobe Wagner attempts a Layup. Contested by Larry Paul (4.1 feet, MAN). Kobe Wagner misses. Rebound secured by Draymond Simons.

[03:13] Team_080 possession (Score: 14-28)
FOUL! Offensive foul on Lauri Dosunmu! Terry Ingram drew the charge! [Team fouls: 8] (Lauri Dosunmu: 2 personal fouls) TURNOVER! (dead ball)

[02:59] Team_094 possession (Score: 14-28)
Tim Russell attempts a Midrange. Contested by Larry Paul (3.8 feet, ZONE). Tim Russell misses. Rebound secured by Draymond Simons.

[02:44] Team_080 possession (Score: 14-28)
Lauri Dosunmu attempts a 3Pt. Contested by Lauri Thompson (5.8 feet, ZONE). LAURI DOSUNMU MAKES IT! Assist: Jaren Morant
Score: 17-28

[02:28] Team_094 possession (Score: 17-28)
Terry Ingram attempts a 3Pt. Contested by Lauri Dosunmu (4.6 feet, ZONE). Terry Ingram misses. Rebound secured by Draymond Simons.

[02:15] Team_080 possession (Score: 17-28)
Lauri Dosunmu attempts a 3Pt. Contested by Tim Russell (5.8 feet, ZONE). Lauri Dosunmu misses. FOUL! Loose ball foul on Kobe Bryant during the rebound battle. [Team fouls: 1] No free throws, side out. (Kobe Bryant: 1 personal fouls)

[02:00] Team_080 possession (Score: 17-28)
Lauri Dosunmu attempts a 3Pt. Contested by Terry Ingram (5.9 feet, MAN). Lauri Dosunmu misses. Rebound secured by Kobe Bryant.

[01:46] Team_094 possession (Score: 17-28)
Kobe Bryant attempts a Midrange. Contested by Draymond Simons (4.5 feet, MAN). KOBE BRYANT MAKES IT! Assist: Terry Ingram
Score: 17-30

[01:29] Team_080 possession (Score: 17-30)
FOUL! Reach-in foul on Tim Russell during the drive. [Team fouls: 2] No free throws, side out. (Tim Russell: 1 personal fouls)

[01:14] Team_080 possession (Score: 17-30)
Larry Paul attempts a 3Pt. Contested by Kobe Wagner (4.8 feet, ZONE). Larry Paul misses. Rebound secured by Kobe Bryant.

[01:04] Team_094 possession (Score: 17-30)
Terry Ingram attempts a 3Pt. Contested by Lauri Dosunmu (4.8 feet, MAN). Terry Ingram misses. Rebound secured by Jaren Morant.

[00:50] Team_080 possession (Score: 17-30)
Draymond Simons attempts a Layup. Contested by Kobe Bryant (5.5 feet, MAN). DRAYMOND SIMONS MAKES IT! Assist: Jaren Morant
Score: 19-30

[00:37] Team_094 possession (Score: 19-30)
Kobe Bryant drives and kicks out. Kobe Bryant attempts a Midrange. Contested by Draymond Simons (4.5 feet, MAN). Kobe Bryant misses. Rebound secured by Draymond Simons.

[00:22] Team_080 possession (Score: 19-30)
Draymond Simons attempts a Midrange. Contested by Kobe Bryant (5.6 feet, MAN). Draymond Simons misses. Rebound secured by Kobe Wagner.

[00:09] Team_094 possession (Score: 19-30)
Tim Russell attempts a 3Pt. Contested by Lauri Dosunmu (4.8 feet, ZONE). Tim Russell misses. Rebound secured by Larry Paul.

================================================================================
                              1ST QUARTER COMPLETE                              
================================================================================

1ST QUARTER SCORE: Team_080 19, Team_094 30

BOX SCORE:
================================================================================

Team_080
--------------------------------------------------------------------------------
Player                MIN  PTS  REB  AST  TO      FG   FG%      3P   3P%
--------------------------------------------------------------------------------
Lauri Dosunmu          12    9    0    0   0   3/5    60.0     0/0   0.0
Draymond Simons        12    6    6    1   0   3/6    50.0     0/0   0.0
Jaren Morant           12    4    4    3   0   2/4    50.0     0/0   0.0
Larry Paul             12    0    2    3   0   0/4     0.0     0/0   0.0
Khris Turner           12    0    0    0   0   0/2     0.0     0/0   0.0

TEAM: FG: 8/21 (38.1%), 3PT: 3/10 (30.0%), REB: 12 (1 off, 11 def), AST: 7, TO: 2
TEAM FOULS: 8 [Team_094 in BONUS]


Team_094
--------------------------------------------------------------------------------
Player                MIN  PTS  REB  AST  TO      FG   FG%      3P   3P%
--------------------------------------------------------------------------------
Terry Ingram           12   10    0    2   0   4/6    66.7     0/0   0.0
Kobe Bryant            12    7    3    2   0   3/7    42.9     0/0   0.0
Tim Russell            12    6    7    1   0   3/7    42.9     0/0   0.0
Lauri Thompson         12    3    0    0   0   1/1   100.0     0/0   0.0
Kobe Wagner            12    2    6    0   0   1/2    50.0     0/0   0.0

TEAM: FG: 12/23 (52.2%), 3PT: 1/6 (16.7%), REB: 16 (3 off, 13 def), AST: 5, TO: 0
TEAM FOULS: 2

================================================================================

================================================================================
                       2ND QUARTER - Team_080 vs Team_094                       
================================================================================

[12:00] Team_080 possession (Score: 19-30)
Draymond Simons drives, picks up Tim Russell. Help arrives from Lauri Thompson! Draymond Simons attempts a Dunk. Contested by Lauri Thompson (5.2 feet, ZONE). DRAYMOND SIMONS MAKES IT! Assist: Larry Paul
Score: 21-30

[11:46] Team_094 possession (Score: 21-30)
Kobe Wagner attempts a 3Pt. Contested by Larry Paul (4.2 feet, ZONE). KOBE WAGNER MAKES IT! Assist: Kobe Bryant
Score: 21-33

[11:27] Team_080 possession (Score: 21-33)
Larry Paul attempts a 3Pt. Contested by Kobe Wagner (4.8 feet, MAN). LARRY PAUL MAKES IT! Assist: Lauri Dosunmu
Score: 24-33

[11:12] Team_094 possession (Score: 24-33)
Lauri Thompson makes the Midrange and draws the foul on Khris Turner! And-1! Lauri Thompson to the line for 1. [Team fouls: 1] (Khris Turner: 1 personal fouls)   FT 1/1: GOOD Lauri Thompson makes 1/1 from the line.
Score: 24-36

[10:55] Team_080 possession (Score: 24-36)
Khris Turner attempts a 3Pt. Contested by Lauri Thompson (5.4 feet, MAN). KHRIS TURNER MAKES IT! Assist: Jaren Morant
Score: 27-36

[10:39] Team_094 possession (Score: 27-36)
Lauri Thompson attempts a Midrange. Contested by Larry Paul (4.2 feet, ZONE). Lauri Thompson misses. Rebound secured by Draymond Simons.

[10:25] Team_080 possession (Score: 27-36)
Lauri Dosunmu attempts a 3Pt. Wide open! Terry Ingram is 6.0 feet away. [MAN] LAURI DOSUNMU MAKES IT! Assist: Larry Paul
Score: 30-36

[10:07] Team_094 possession (Score: 30-36)
Tim Russell drives, Jaren Morant stays with him. Tim Russell attempts a Dunk. Contested by Jaren Morant (4.5 feet, MAN). Tim Russell misses. Rebound secured by Draymond Simons.

[09:53] Team_080 possession (Score: 30-36)
Larry Paul makes the Layup and draws the foul on Lauri Thompson! And-1! Larry Paul to the line for 1. [Team fouls: 1] (Lauri Thompson: 1 personal fouls)   FT 1/1: GOOD Larry Paul makes 1/1 from the line.
Score: 33-36

[09:36] Team_094 possession (Score: 33-36)
Kobe Bryant attempts a Layup. Contested by Draymond Simons (4.8 feet, MAN). Kobe Bryant misses. Rebound secured by Jaren Morant.

[09:27] Team_080 possession (Score: 33-36)
Khris Turner attempts a 3Pt. Contested by Kobe Wagner (4.9 feet, ZONE). KHRIS TURNER MAKES IT! Assist: Jaren Morant
Score: 36-36

[09:11] Team_094 possession (Score: 36-36)
Kobe Bryant drives, Draymond Simons stays with him. Kobe Bryant attempts a Dunk. Contested by Draymond Simons (4.9 feet, MAN). Kobe Bryant misses. Offensive rebound by Kobe Bryant! Kobe Bryant puts it back in!
Score: 36-38

[08:57] Team_080 possession (Score: 36-38)
Jaren Morant attempts a Layup. Contested by Tim Russell (5.7 feet, MAN). JAREN MORANT MAKES IT!
Score: 38-38

[08:42] Team_094 possession (Score: 38-38)
Kobe Wagner attempts a 3Pt. Contested by Larry Paul (4.5 feet, MAN). Kobe Wagner misses. Offensive rebound by Tim Russell! Tim Russell kicks it out.

[08:31] Team_094 possession (Score: 38-38)
Tim Russell drives to the basket... Tim Russell throws a bad pass! Stolen by Draymond Simons! TURNOVER! (live ball)

[08:18] Team_080 possession (Score: 38-38)
Draymond Simons attempts a Layup. Contested by Tim Russell (5.6 feet, ZONE). DRAYMOND SIMONS MAKES IT!
Score: 40-38

[08:05] Team_094 possession (Score: 40-38)
Terry Ingram loses control! Ball rolls out of bounds! TURNOVER! (dead ball)

[08:05] Substitution (Team_080): Lauri Dosunmu OUT → Tony James IN (stamina_rule2)

[08:05] Substitution (Team_080): Khris Turner OUT → Larry Reaves IN (stamina_rule2)

[08:05] Substitution (Team_080): Larry Paul OUT → Joel Bryant IN (stamina_rule2)

[08:05] Substitution (Team_080): Jaren Morant OUT → Ja Cunningham IN (stamina_rule2)

[08:05] Substitution (Team_080): Draymond Simons OUT → Trae Brogdon IN (stamina_rule2)

[08:05] Substitution (Team_094): Terry Ingram OUT → Shaquille Bryant IN (stamina_rule2)

[08:05] Substitution (Team_094): Lauri Thompson OUT → Kevin Rozier IN (stamina_rule2)

[08:05] Substitution (Team_094): Kobe Wagner OUT → Ayo Gasol IN (stamina_rule2)

[08:05] Substitution (Team_094): Tim Russell OUT → Domantas Haliburton IN (stamina_rule2)

[08:05] Substitution (Team_094): Kobe Bryant OUT → Isaiah Quickley IN (stamina_rule2)

[07:55] Team_080 possession (Score: 40-38)
Ja Cunningham attempts a 3Pt. Contested by Ayo Gasol (5.0 feet, ZONE). Ja Cunningham misses. Rebound secured by Isaiah Quickley.

[07:40] Team_094 possession (Score: 40-38)
FOUL! Reach-in foul on Ja Cunningham during the drive. [Team fouls: 2] No free throws, side out. (Ja Cunningham: 1 personal fouls)

[07:23] Team_094 possession (Score: 40-38)
Isaiah Quickley attempts a Midrange. Contested by Trae Brogdon (5.8 feet, MAN). ISAIAH QUICKLEY MAKES IT!
Score: 40-40

[07:07] Team_080 possession (Score: 40-40)
Trae Brogdon attempts a 3Pt. Contested by Domantas Haliburton (5.7 feet, ZONE). Trae Brogdon misses. Rebound secured by Isaiah Quickley.

[06:58] Team_094 possession (Score: 40-40)
Shaquille Bryant attempts a 3Pt. Contested by Joel Bryant (4.1 feet, ZONE). Shaquille Bryant misses. Rebound secured by Trae Brogdon.

[06:46] Team_080 possession (Score: 40-40)
Joel Bryant attempts a 3Pt. Contested by Ayo Gasol (5.2 feet, MAN). Joel Bryant misses. Offensive rebound by Ja Cunningham! Ja Cunningham kicks it out.

[06:29] Team_080 possession (Score: 40-40)
Ja Cunningham makes the Layup and draws the foul on Domantas Haliburton! And-1! Ja Cunningham to the line for 1. [Team fouls: 2] (Domantas Haliburton: 1 personal fouls)   FT 1/1: MISS Ja Cunningham makes 0/1 from the line. Rebound secured by Domantas Haliburton.
Score: 42-40

[06:15] Team_094 possession (Score: 42-40)
Domantas Haliburton attempts a Layup. BLOCKED BY JA CUNNINGHAM! Ball is loose! Rebound secured by Trae Brogdon.

[05:58] Team_080 possession (Score: 42-40)
Trae Brogdon attempts a Midrange. Contested by Shaquille Bryant (5.2 feet, ZONE). Trae Brogdon misses. Rebound secured by Ayo Gasol.

[05:45] Team_094 possession (Score: 42-40)
Shaquille Bryant attempts a Layup. Contested by Tony James (3.8 feet, MAN). SHAQUILLE BRYANT MAKES IT! Assist: Kevin Rozier
Score: 42-42

[05:30] Team_080 possession (Score: 42-42)
Ja Cunningham drives, picks up Isaiah Quickley. Help arrives from Kevin Rozier! Ja Cunningham attempts a Dunk. Wide open! Kevin Rozier is 6.1 feet away. [ZONE] JA CUNNINGHAM MAKES IT! Assist: Trae Brogdon
Score: 44-42

[05:16] Team_094 possession (Score: 44-42)
Kevin Rozier attempts a 3Pt. Contested by Joel Bryant (4.9 feet, ZONE). KEVIN ROZIER MAKES IT! Assist: Shaquille Bryant
Score: 44-45

[04:59] Team_080 possession (Score: 44-45)
Joel Bryant attempts a 3Pt. Wide open! Domantas Haliburton is 6.1 feet away. [ZONE] JOEL BRYANT MAKES IT! Assist: Ja Cunningham
Score: 47-45

[04:40] Team_094 possession (Score: 47-45)
Domantas Haliburton throws a bad pass! Stolen by Ja Cunningham! TURNOVER! (live ball)

[04:26] Team_080 possession (Score: 47-45)
Ja Cunningham attempts a Midrange. Contested by Domantas Haliburton (5.9 feet, MAN). Ja Cunningham misses. Offensive rebound by Larry Reaves! Larry Reaves kicks it out.

[04:12] Team_080 possession (Score: 47-45)
Joel Bryant attempts a 3Pt. Contested by Ayo Gasol (5.2 feet, MAN). Joel Bryant misses. Offensive rebound by Ja Cunningham! Ja Cunningham kicks it out.

[03:59] Team_080 possession (Score: 47-45)
FOUL! Reach-in foul on Isaiah Quickley during the drive. [Team fouls: 3] No free throws, side out. (Isaiah Quickley: 1 personal fouls)

[03:46] Team_080 possession (Score: 47-45)
Tony James drives and kicks out. Joel Bryant attempts a Midrange. Contested by Ayo Gasol (4.9 feet, MAN). JOEL BRYANT MAKES IT! Assist: Larry Reaves
Score: 49-45

[03:34] Team_094 possession (Score: 49-45)
Domantas Haliburton attempts a 3Pt. Contested by Ja Cunningham (4.9 feet, MAN). Domantas Haliburton misses. Rebound secured by Trae Brogdon.

[03:18] Team_080 possession (Score: 49-45)
Ja Cunningham makes the Layup and draws the foul on Domantas Haliburton! And-1! Ja Cunningham to the line for 1. [Team fouls: 4] (Domantas Haliburton: 2 personal fouls)   FT 1/1: GOOD Ja Cunningham makes 1/1 from the line.
Score: 52-45

[03:07] Team_094 possession (Score: 52-45)
FOUL! Shooting foul on Trae Brogdon. Isaiah Quickley to the line for 2 free throws. [Team fouls: 3] (Trae Brogdon: 1 personal fouls)   FT 1/2: GOOD   FT 2/2: GOOD Isaiah Quickley makes 2/2 from the line.
Score: 52-47

[02:53] Team_080 possession (Score: 52-47)
Joel Bryant attempts a 3Pt. Wide open! Domantas Haliburton is 6.1 feet away. [ZONE] Joel Bryant misses. Offensive rebound by Larry Reaves! Larry Reaves kicks it out.

[02:35] Team_080 possession (Score: 52-47)
Tony James attempts a Layup. Wide open! Isaiah Quickley is 6.3 feet away. [ZONE] TONY JAMES MAKES IT!
Score: 54-47

[02:18] Team_094 possession (Score: 54-47)
Domantas Haliburton drives and kicks out. Domantas Haliburton attempts a Midrange. Contested by Ja Cunningham (4.8 feet, MAN). Domantas Haliburton misses. Rebound secured by Ja Cunningham.

[02:06] Team_080 possession (Score: 54-47)
Joel Bryant attempts a 3Pt. Contested by Ayo Gasol (5.2 feet, MAN). Joel Bryant misses. Rebound secured by Ayo Gasol.

[01:48] Team_094 possession (Score: 54-47)
Shaquille Bryant attempts a 3Pt. Contested by Tony James (3.8 feet, MAN). Shaquille Bryant misses. Rebound secured by Trae Brogdon.

[01:33] Team_080 possession (Score: 54-47)
FOUL! Reach-in foul on Isaiah Quickley during the drive. [IN THE BONUS! 5 team fouls] Trae Brogdon to the line for 2 free throws. (Isaiah Quickley: 2 personal fouls)   FT 1/2: GOOD   FT 2/2: MISS Trae Brogdon makes 1/2 from the line. Rebound secured by Isaiah Quickley.
Score: 55-47

[01:21] Team_094 possession (Score: 55-47)
Shaquille Bryant attempts a 3Pt. Contested by Tony James (3.8 feet, MAN). SHAQUILLE BRYANT MAKES IT! Assist: Ayo Gasol
Score: 55-50

[01:05] Team_080 possession (Score: 55-50)
Larry Reaves attempts a 3Pt. Contested by Kevin Rozier (5.2 feet, MAN). LARRY REAVES MAKES IT! Assist: Tony James
Score: 58-50

[00:52] Team_094 possession (Score: 58-50)
FOUL! Shooting foul on Joel Bryant. Ayo Gasol to the line for 2 free throws. [Team fouls: 4] (Joel Bryant: 1 personal fouls)   FT 1/2: GOOD   FT 2/2: MISS Ayo Gasol makes 1/2 from the line. Rebound secured by Ja Cunningham.
Score: 58-51

[00:38] Team_080 possession (Score: 58-51)
FOUL! Shooting foul on Ayo Gasol. Joel Bryant to the line for 2 free throws. [BONUS: 6 team fouls] (Ayo Gasol: 1 personal fouls)   FT 1/2: MISS   FT 2/2: GOOD Joel Bryant makes 1/2 from the line.
Score: 59-51

[00:25] Team_094 possession (Score: 59-51)
Domantas Haliburton drives, Ja Cunningham stays with him. Domantas Haliburton attempts a Dunk. Contested by Ja Cunningham (4.9 feet, ZONE). Domantas Haliburton misses. Offensive rebound by Domantas Haliburton! Domantas Haliburton kicks it out.

[00:12] Team_094 possession (Score: 59-51)
FOUL! Reach-in foul on Ja Cunningham during the drive. [IN THE BONUS! 5 team fouls] Shaquille Bryant to the line for 2 free throws. (Ja Cunningham: 2 personal fouls)   FT 1/2: GOOD   FT 2/2: GOOD Shaquille Bryant makes 2/2 from the line.
Score: 59-53

================================================================================
                              2ND QUARTER COMPLETE                              
================================================================================

2ND QUARTER SCORE: Team_080 40, Team_094 23

BOX SCORE:
================================================================================

Team_080
--------------------------------------------------------------------------------
Player                MIN  PTS  REB  AST  TO      FG   FG%      3P   3P%
--------------------------------------------------------------------------------
Larry Paul             16    6    0    2   0   2/2   100.0     0/0   0.0
Khris Turner           16    6    0    0   0   2/2   100.0     0/0   0.0
Joel Bryant             8    6    0    0   0   3/4    75.0     0/0   0.0
Ja Cunningham           8    5    4    1   0   2/4    50.0     0/0   0.0
Draymond Simons        16    4    2    0   0   2/2   100.0     0/0   0.0
Lauri Dosunmu          16    3    0    1   0   1/1   100.0     0/0   0.0
Larry Reaves            8    3    2    1   0   1/1   100.0     0/0   0.0
Jaren Morant           16    2    1    2   0   1/1   100.0     0/0   0.0
Tony James              8    2    0    1   0   1/1   100.0     0/0   0.0
Trae Brogdon            8    0    4    1   0   0/3     0.0     0/0   0.0

TEAM: FG: 15/21 (71.4%), 3PT: 6/9 (66.7%), REB: 13 (4 off, 9 def), AST: 9, TO: 0
TEAM FOULS: 5 [Team_094 in BONUS]


Team_094
--------------------------------------------------------------------------------
Player                MIN  PTS  REB  AST  TO      FG   FG%      3P   3P%
--------------------------------------------------------------------------------
Shaquille Bryant        8    7    0    1   0   3/5    60.0     0/0   0.0
Isaiah Quickley         8    4    3    0   0   2/2   100.0     0/0   0.0
Kobe Wagner            16    3    0    0   0   1/1   100.0     0/0   0.0
Lauri Thompson         16    3    0    0   0   1/2    50.0     0/0   0.0
Kevin Rozier            8    3    0    1   0   1/1   100.0     0/0   0.0
Kobe Bryant            16    2    1    1   0   1/2    50.0     0/0   0.0
Tim Russell            16    0    1    0   0   0/1     0.0     0/0   0.0
Domantas Haliburton     8    0    2    0   0   0/3     0.0     0/0   0.0
Ayo Gasol               8    0    2    1   0   0/1     0.0     0/0   0.0

TEAM: FG: 9/18 (50.0%), 3PT: 3/6 (50.0%), REB: 9 (3 off, 6 def), AST: 4, TO: 3
TEAM FOULS: 6 [Team_080 in BONUS]

================================================================================

================================================================================
                       3RD QUARTER - Team_080 vs Team_094                       
================================================================================

[12:00] Team_080 possession (Score: 59-53)
FOUL! Reach-in foul on Kobe Bryant during the drive. [Team fouls: 1] No free throws, side out. (Kobe Bryant: 1 personal fouls)

[11:48] Team_080 possession (Score: 59-53)
Jaren Morant attempts a 3Pt. Contested by Kobe Wagner (4.5 feet, ZONE). JAREN MORANT MAKES IT! Assist: Draymond Simons
Score: 62-53

[11:33] Team_094 possession (Score: 62-53)
FOUL! Shooting foul on Draymond Simons. Lauri Thompson to the line for 2 free throws. [Team fouls: 1] (Draymond Simons: 1 personal fouls)   FT 1/2: GOOD   FT 2/2: MISS Lauri Thompson makes 1/2 from the line. Rebound secured by Larry Paul.
Score: 62-54

[11:20] Team_080 possession (Score: 62-54)
Lauri Dosunmu attempts a 3Pt. Contested by Terry Ingram (5.6 feet, MAN). Lauri Dosunmu misses. Rebound secured by Kobe Bryant.

[11:01] Team_094 possession (Score: 62-54)
Kobe Wagner drives and kicks out. Kobe Bryant attempts a 3Pt. Contested by Lauri Dosunmu (4.0 feet, ZONE). Kobe Bryant misses. Rebound secured by Jaren Morant.

[10:45] Team_080 possession (Score: 62-54)
Larry Paul drives and kicks out. Draymond Simons attempts a Midrange. Contested by Kobe Bryant (5.0 feet, MAN). DRAYMOND SIMONS MAKES IT! Assist: Jaren Morant
Score: 64-54

[10:29] Team_094 possession (Score: 64-54)
FOUL! Holding foul on Lauri Dosunmu. [Team fouls: 2] No free throws, side out. (Lauri Dosunmu: 1 personal fouls)

[10:17] Team_094 possession (Score: 64-54)
Tim Russell drives and kicks out. Tim Russell attempts a 3Pt. Contested by Lauri Dosunmu (4.0 feet, ZONE). Tim Russell misses. Offensive rebound by Kobe Bryant! Kobe Bryant puts it back in!
Score: 64-56

[09:58] Team_080 possession (Score: 64-56)
Jaren Morant attempts a 3Pt. Contested by Tim Russell (5.2 feet, MAN). Jaren Morant misses. Rebound secured by Tim Russell.

[09:46] Team_094 possession (Score: 64-56)
FOUL! Reach-in foul on Draymond Simons during the drive. [Team fouls: 3] No free throws, side out. (Draymond Simons: 2 personal fouls)

[09:32] Team_094 possession (Score: 64-56)
Tim Russell attempts a 3Pt. Contested by Jaren Morant (3.9 feet, ZONE). TIM RUSSELL MAKES IT! Assist: Kobe Wagner
Score: 64-59

[09:20] Team_080 possession (Score: 64-59)
Jaren Morant drives, Tim Russell stays with him. Jaren Morant attempts a Dunk. Contested by Tim Russell (5.2 feet, ZONE). JAREN MORANT MAKES IT!
Score: 66-59

[09:03] Team_094 possession (Score: 66-59)
Kobe Wagner attempts a Midrange. Contested by Larry Paul (4.0 feet, MAN). Kobe Wagner misses. Rebound secured by Larry Paul.

[08:47] Team_080 possession (Score: 66-59)
Draymond Simons attempts a Midrange. Contested by Lauri Thompson (5.0 feet, ZONE). Draymond Simons misses. Rebound secured by Kobe Wagner.

[08:35] Team_094 possession (Score: 66-59)
Kobe Bryant drives, Draymond Simons stays with him. Kobe Bryant attempts a Layup. Contested by Draymond Simons (4.1 feet, ZONE). Kobe Bryant misses. Offensive rebound by Tim Russell! Tim Russell kicks it out.

[08:22] Team_094 possession (Score: 66-59)
Tim Russell attempts a Midrange. Contested by Larry Paul (3.7 feet, ZONE). TIM RUSSELL MAKES IT! Assist: Kobe Wagner
Score: 66-61

[08:07] Team_080 possession (Score: 66-61)
Jaren Morant makes the Layup and draws the foul on Tim Russell! And-1! Jaren Morant to the line for 1. [Team fouls: 2] (Tim Russell: 1 personal fouls)   FT 1/1: GOOD Jaren Morant makes 1/1 from the line.
Score: 69-61

[07:49] Team_094 possession (Score: 69-61)
Lauri Thompson attempts a 3Pt. Contested by Lauri Dosunmu (4.4 feet, ZONE). Lauri Thompson misses. Rebound secured by Draymond Simons.

[07:36] Team_080 possession (Score: 69-61)
Khris Turner attempts a 3Pt. Contested by Kobe Wagner (4.4 feet, ZONE). KHRIS TURNER MAKES IT!
Score: 72-61

[07:21] Team_094 possession (Score: 72-61)
Terry Ingram makes the Layup and draws the foul on Lauri Dosunmu! And-1! Terry Ingram to the line for 1. [Team fouls: 4] (Lauri Dosunmu: 2 personal fouls)   FT 1/1: GOOD Terry Ingram makes 1/1 from the line.
Score: 72-64

[07:07] Team_080 possession (Score: 72-64)
FOUL! Reach-in foul on Tim Russell during the drive. [Team fouls: 3] No free throws, side out. (Tim Russell: 2 personal fouls)

[06:49] Team_080 possession (Score: 72-64)
Larry Paul attempts a 3Pt. Contested by Kobe Wagner (4.5 feet, MAN). LARRY PAUL MAKES IT! Assist: Draymond Simons
Score: 75-64

[06:37] Team_094 possession (Score: 75-64)
Tim Russell attempts a Midrange. Contested by Jaren Morant (3.9 feet, ZONE). TIM RUSSELL MAKES IT!
Score: 75-66

[06:22] Team_080 possession (Score: 75-66)
Jaren Morant drives and kicks out. Khris Turner attempts a Midrange. Contested by Lauri Thompson (4.8 feet, MAN). Khris Turner misses. Rebound secured by Kobe Bryant.

[06:04] Team_094 possession (Score: 75-66)
Terry Ingram makes the Dunk and draws the foul on Lauri Dosunmu! And-1! Terry Ingram to the line for 1. [BONUS: 5 team fouls] (Lauri Dosunmu: 3 personal fouls)   FT 1/1: GOOD Terry Ingram makes 1/1 from the line.
Score: 75-69

[05:48] Team_080 possession (Score: 75-69)
Khris Turner attempts a 3Pt. Contested by Lauri Thompson (5.0 feet, MAN). Khris Turner misses. Rebound secured by Tim Russell.

[05:34] Team_094 possession (Score: 75-69)
Terry Ingram attempts a Midrange. Contested by Larry Paul (3.9 feet, ZONE). TERRY INGRAM MAKES IT! Assist: Lauri Thompson
Score: 75-71

[05:23] Team_080 possession (Score: 75-71)
Draymond Simons drives to the basket... FOUL! Offensive foul on Draymond Simons! Tim Russell drew the charge! [Team fouls: 6] (Draymond Simons: 3 personal fouls) TURNOVER! (dead ball)

[05:06] Team_094 possession (Score: 75-71)
Lauri Thompson attempts a 3Pt. Contested by Khris Turner (5.0 feet, MAN). Lauri Thompson misses. Rebound secured by Jaren Morant.

[04:48] Team_080 possession (Score: 75-71)
FOUL! Shooting foul on Tim Russell. Jaren Morant to the line for 2 free throws. [Team fouls: 4] (Tim Russell: 3 personal fouls)   FT 1/2: MISS   FT 2/2: GOOD Jaren Morant makes 1/2 from the line.
Score: 76-71

[04:33] Team_094 possession (Score: 76-71)
Lauri Thompson drives, Draymond Simons stays with him. Lauri Thompson attempts a Dunk. Contested by Draymond Simons (4.3 feet, ZONE). Lauri Thompson misses. Rebound secured by Draymond Simons.

[04:23] Team_080 possession (Score: 76-71)
FOUL! Reach-in foul on Kobe Wagner during the drive. [IN THE BONUS! 5 team fouls] Larry Paul to the line for 2 free throws. (Kobe Wagner: 1 personal fouls)   FT 1/2: GOOD   FT 2/2: GOOD Larry Paul makes 2/2 from the line.
Score: 78-71

[04:09] Team_094 possession (Score: 78-71)
Lauri Thompson attempts a 3Pt. Contested by Khris Turner (5.0 feet, MAN). Lauri Thompson misses. Rebound secured by Larry Paul.

[03:57] Team_080 possession (Score: 78-71)
Lauri Dosunmu attempts a 3Pt. Contested by Kobe Wagner (5.1 feet, ZONE). LAURI DOSUNMU MAKES IT! Assist: Jaren Morant
Score: 81-71

[03:42] Team_094 possession (Score: 81-71)
Kobe Bryant drives, picks up Draymond Simons. Help arrives from Khris Turner! Kobe Bryant attempts a Dunk. Contested by Khris Turner (4.3 feet, ZONE). KOBE BRYANT MAKES IT!
Score: 81-73

[03:28] Team_080 possession (Score: 81-73)
Draymond Simons attempts a Dunk. BLOCKED BY KOBE BRYANT! Ball goes out off Kobe Bryant. Draymond Simons's ball!

[03:14] Team_080 possession (Score: 81-73)
Larry Paul attempts a 3Pt. Contested by Tim Russell (5.3 feet, ZONE). Larry Paul misses. Rebound secured by Tim Russell.

[03:01] Team_094 possession (Score: 81-73)
Tim Russell attempts a Midrange. Contested by Jaren Morant (4.1 feet, MAN). TIM RUSSELL MAKES IT!
Score: 81-75

[02:45] Team_080 possession (Score: 81-75)
Larry Paul attempts a 3Pt. Contested by Kobe Wagner (4.7 feet, ZONE). Larry Paul misses. Rebound secured by Kobe Bryant.

[02:29] Team_094 possession (Score: 81-75)
FOUL! Offensive foul on Lauri Thompson! Khris Turner drew the charge! [Team fouls: 6] (Lauri Thompson: 1 personal fouls) TURNOVER! (dead ball)

[02:16] Team_080 possession (Score: 81-75)
Lauri Dosunmu drives to the basket... Lauri Dosunmu throws a bad pass! Stolen by Tim Russell! TURNOVER! (live ball)

[02:03] Team_094 possession (Score: 81-75)
Tim Russell attempts a 3Pt. Contested by Lauri Dosunmu (4.5 feet, ZONE). Tim Russell misses. Rebound secured by Jaren Morant.

[01:49] Team_080 possession (Score: 81-75)
Draymond Simons drives, Tim Russell stays with him. Draymond Simons attempts a Layup. Contested by Tim Russell (5.3 feet, ZONE). DRAYMOND SIMONS MAKES IT!
Score: 83-75

[01:34] Team_094 possession (Score: 83-75)
Lauri Thompson attempts a 3Pt. Contested by Khris Turner (5.3 feet, MAN). Lauri Thompson misses. Offensive rebound by Tim Russell! Tim Russell kicks it out.

[01:19] Team_094 possession (Score: 83-75)
Terry Ingram drives, Lauri Dosunmu stays with him. Terry Ingram attempts a Dunk. Contested by Lauri Dosunmu (4.7 feet, MAN). TERRY INGRAM MAKES IT! Assist: Tim Russell
Score: 83-77

[01:03] Team_080 possession (Score: 83-77)
Draymond Simons attempts a Dunk. BLOCKED BY KOBE BRYANT! Ball is loose! Rebound secured by Kobe Bryant.

[00:47] Team_094 possession (Score: 83-77)
Tim Russell drives to the basket... Tim Russell throws a bad pass! Stolen by Jaren Morant! TURNOVER! (live ball)

[00:32] Team_080 possession (Score: 83-77)
Lauri Dosunmu throws a bad pass! Stolen by Terry Ingram! TURNOVER! (live ball)

[00:23] Team_094 possession (Score: 83-77)
Tim Russell drives to the basket... Tim Russell loses control! Ball rolls out of bounds! TURNOVER! (dead ball)

[00:23] Substitution (Team_080): Lauri Dosunmu OUT → Tony James IN (stamina_rule2)

[00:23] Substitution (Team_080): Khris Turner OUT → Larry Reaves IN (stamina_rule2)

[00:23] Substitution (Team_080): Larry Paul OUT → Joel Bryant IN (stamina_rule2)

[00:23] Substitution (Team_080): Jaren Morant OUT → Ja Cunningham IN (stamina_rule2)

[00:23] Substitution (Team_080): Draymond Simons OUT → Trae Brogdon IN (stamina_rule2)

[00:23] Substitution (Team_094): Terry Ingram OUT → Shaquille Bryant IN (stamina_rule2)

[00:23] Substitution (Team_094): Lauri Thompson OUT → Kevin Rozier IN (stamina_rule2)

[00:23] Substitution (Team_094): Kobe Wagner OUT → Ayo Gasol IN (stamina_rule2)

[00:23] Substitution (Team_094): Tim Russell OUT → Domantas Haliburton IN (stamina_rule2)

[00:23] Substitution (Team_094): Kobe Bryant OUT → Isaiah Quickley IN (stamina_rule2)

[00:06] Team_080 possession (Score: 83-77)
Tony James attempts a 3Pt. Wide open! Domantas Haliburton is 6.0 feet away. [ZONE] Tony James misses. Rebound secured by Isaiah Quickley.

================================================================================
                              3RD QUARTER COMPLETE                              
================================================================================

3RD QUARTER SCORE: Team_080 24, Team_094 24

BOX SCORE:
================================================================================

Team_080
--------------------------------------------------------------------------------
Player                MIN  PTS  REB  AST  TO      FG   FG%      3P   3P%
--------------------------------------------------------------------------------
Jaren Morant           28    9    3    2   0   4/6    66.7     0/0   0.0
Larry Paul             28    5    3    0   0   2/4    50.0     0/0   0.0
Draymond Simons        28    4    2    2   0   2/4    50.0     0/0   0.0
Lauri Dosunmu          28    3    0    0   0   1/2    50.0     0/0   0.0
Khris Turner           28    3    0    0   0   1/2    50.0     0/0   0.0
Tony James              8    0    0    0   0   0/1     0.0     0/0   0.0

TEAM: FG: 10/19 (52.6%), 3PT: 4/10 (40.0%), REB: 8 (0 off, 8 def), AST: 4, TO: 3
TEAM FOULS: 6 [Team_094 in BONUS]


Team_094
--------------------------------------------------------------------------------
Player                MIN  PTS  REB  AST  TO      FG   FG%      3P   3P%
--------------------------------------------------------------------------------
Terry Ingram           28   10    0    0   0   4/4   100.0     0/0   0.0
Tim Russell            28    9    5    1   0   4/5    80.0     0/0   0.0
Kobe Bryant            28    4    5    0   0   2/2   100.0     0/0   0.0
Lauri Thompson         28    0    0    1   0   0/5     0.0     0/0   0.0
Kobe Wagner            28    0    1    2   0   0/2     0.0     0/0   0.0
Isaiah Quickley         8    0    1    0   0   0/0     0.0     0/0   0.0

TEAM: FG: 10/18 (55.6%), 3PT: 1/5 (20.0%), REB: 12 (3 off, 9 def), AST: 4, TO: 3
TEAM FOULS: 6 [Team_080 in BONUS]

================================================================================

================================================================================
                       4TH QUARTER - Team_080 vs Team_094                       
================================================================================

[12:00] Team_080 possession (Score: 83-77)
Lauri Dosunmu attempts a 3Pt. Contested by Kobe Wagner (5.2 feet, ZONE). LAURI DOSUNMU MAKES IT! Assist: Draymond Simons
Score: 86-77

[11:47] Team_094 possession (Score: 86-77)
FOUL! Reach-in foul on Draymond Simons during the drive. [Team fouls: 1] No free throws, side out. (Draymond Simons: 1 personal fouls)

[11:32] Team_094 possession (Score: 86-77)
Lauri Thompson attempts a 3Pt. Contested by Lauri Dosunmu (4.7 feet, ZONE). Lauri Thompson misses. Offensive rebound by Tim Russell! Tim Russell kicks it out.

[11:16] Team_094 possession (Score: 86-77)
Kobe Wagner throws a bad pass out of bounds! TURNOVER! (dead ball)

[11:16] Substitution (Team_080): Lauri Dosunmu OUT → Tony James IN (stamina_rule2)

[11:16] Substitution (Team_080): Khris Turner OUT → Larry Reaves IN (stamina_rule2)

[11:16] Substitution (Team_080): Jaren Morant OUT → Ja Cunningham IN (stamina_rule2)

[11:16] Substitution (Team_080): Draymond Simons OUT → Trae Brogdon IN (stamina_rule2)

[11:16] Substitution (Team_094): Terry Ingram OUT → Shaquille Bryant IN (stamina_rule2)

[11:16] Substitution (Team_094): Lauri Thompson OUT → Kevin Rozier IN (stamina_rule2)

[11:16] Substitution (Team_094): Kobe Wagner OUT → Ayo Gasol IN (stamina_rule2)

[11:16] Substitution (Team_094): Tim Russell OUT → Domantas Haliburton IN (stamina_rule2)

[11:16] Substitution (Team_094): Kobe Bryant OUT → Isaiah Quickley IN (stamina_rule2)

[11:03] Team_080 possession (Score: 86-77)
Ja Cunningham attempts a 3Pt. Contested by Domantas Haliburton (5.9 feet, ZONE). JA CUNNINGHAM MAKES IT! Assist: Trae Brogdon
Score: 89-77

[10:47] Team_094 possession (Score: 89-77)
Kevin Rozier attempts a Midrange. Contested by Ja Cunningham (5.3 feet, ZONE). KEVIN ROZIER MAKES IT! Assist: Shaquille Bryant
Score: 89-79

[10:33] Team_080 possession (Score: 89-79)
Larry Paul attempts a 3Pt. Wide open! Domantas Haliburton is 6.1 feet away. [ZONE] Larry Paul misses. Rebound secured by Domantas Haliburton.

[10:16] Team_094 possession (Score: 89-79)
Domantas Haliburton drives, Ja Cunningham stays with him. Domantas Haliburton attempts a Dunk. Contested by Ja Cunningham (4.9 feet, ZONE). DOMANTAS HALIBURTON MAKES IT! Assist: Shaquille Bryant
Score: 89-81

[10:01] Team_080 possession (Score: 89-81)
FOUL! Shooting foul on Isaiah Quickley. Trae Brogdon to the line for 2 free throws. [Team fouls: 1] (Isaiah Quickley: 1 personal fouls)   FT 1/2: GOOD   FT 2/2: GOOD Trae Brogdon makes 2/2 from the line.
Score: 91-81

[09:45] Team_094 possession (Score: 91-81)
FOUL! Holding foul on Tony James. [Team fouls: 2] No free throws, side out. (Tony James: 1 personal fouls)

[09:28] Team_094 possession (Score: 91-81)
Kevin Rozier attempts a 3Pt. Contested by Larry Reaves (5.0 feet, MAN). Kevin Rozier misses. Offensive rebound by Domantas Haliburton! Domantas Haliburton kicks it out.

[09:12] Team_094 possession (Score: 91-81)
Kevin Rozier drives, Larry Reaves stays with him. Kevin Rozier attempts a Layup. Contested by Larry Reaves (5.0 feet, MAN). KEVIN ROZIER MAKES IT! Assist: Ayo Gasol
Score: 91-83

[08:58] Team_080 possession (Score: 91-83)
Larry Paul attempts a 3Pt. Wide open! Domantas Haliburton is 6.1 feet away. [ZONE] LARRY PAUL MAKES IT! Assist: Trae Brogdon
Score: 94-83

[08:41] Team_094 possession (Score: 94-83)
Shaquille Bryant attempts a 3Pt. Contested by Tony James (3.8 feet, ZONE). Shaquille Bryant misses. Rebound secured by Larry Paul.

[08:26] Team_080 possession (Score: 94-83)
FOUL! Holding foul on Kevin Rozier. [Team fouls: 2] No free throws, side out. (Kevin Rozier: 1 personal fouls)

[08:16] Team_080 possession (Score: 94-83)
Larry Paul drives, picks up Isaiah Quickley. Help arrives from Kevin Rozier! Larry Paul attempts a Layup. Wide open! Kevin Rozier is 6.3 feet away. [ZONE] Larry Paul misses. Rebound secured by Ayo Gasol.

[08:02] Team_094 possession (Score: 94-83)
Domantas Haliburton attempts a 3Pt. Contested by Ja Cunningham (4.9 feet, MAN). DOMANTAS HALIBURTON MAKES IT! Assist: Shaquille Bryant
Score: 94-86

[07:48] Team_080 possession (Score: 94-86)
Larry Paul attempts a 3Pt. Contested by Ayo Gasol (5.2 feet, MAN). LARRY PAUL MAKES IT! Assist: Trae Brogdon
Score: 97-86

[07:34] Team_094 possession (Score: 97-86)
Domantas Haliburton drives to the basket... FOUL! Offensive foul on Domantas Haliburton! Ja Cunningham drew the charge! [Team fouls: 3] (Domantas Haliburton: 1 personal fouls) TURNOVER! (dead ball)

[07:23] Team_080 possession (Score: 97-86)
Larry Paul attempts a 3Pt. Wide open! Domantas Haliburton is 6.1 feet away. [ZONE] Larry Paul misses. Offensive rebound by Ja Cunningham! Ja Cunningham kicks it out.

[07:09] Team_080 possession (Score: 97-86)
Larry Reaves attempts a 3Pt. Wide open! Domantas Haliburton is 6.0 feet away. [ZONE] Larry Reaves misses. Offensive rebound by Ja Cunningham! Ja Cunningham kicks it out.

[06:51] Team_080 possession (Score: 97-86)
Larry Reaves attempts a 3Pt. Wide open! Domantas Haliburton is 6.0 feet away. [ZONE] LARRY REAVES MAKES IT!
Score: 100-86

[06:32] Team_094 possession (Score: 100-86)
Isaiah Quickley drives to the basket... FOUL! Offensive foul on Isaiah Quickley! Trae Brogdon drew the charge! [Team fouls: 4] (Isaiah Quickley: 2 personal fouls) TURNOVER! (dead ball)

[06:17] Team_080 possession (Score: 100-86)
Tony James makes the Dunk and draws the foul on Kevin Rozier! And-1! Tony James to the line for 1. [BONUS: 5 team fouls] (Kevin Rozier: 2 personal fouls)   FT 1/1: MISS Tony James makes 0/1 from the line. Rebound secured by Ayo Gasol.
Score: 102-86

[06:04] Team_094 possession (Score: 102-86)
Isaiah Quickley drives to the basket... Isaiah Quickley throws a bad pass out of bounds! TURNOVER! (dead ball)

[06:04] Substitution (Team_080): Larry Paul OUT → Joel Bryant IN (stamina_rule2)

[05:45] Team_080 possession (Score: 102-86)
Trae Brogdon attempts a Layup. Contested by Isaiah Quickley (5.9 feet, ZONE). TRAE BROGDON MAKES IT! Assist: Larry Reaves
Score: 104-86

[05:30] Team_094 possession (Score: 104-86)
Isaiah Quickley attempts a 3Pt. Contested by Joel Bryant (4.7 feet, ZONE). Isaiah Quickley misses. Rebound secured by Trae Brogdon.

[05:16] Team_080 possession (Score: 104-86)
Trae Brogdon drives, Isaiah Quickley stays with him. Trae Brogdon attempts a Dunk. Contested by Isaiah Quickley (5.9 feet, MAN). TRAE BROGDON MAKES IT! Assist: Ja Cunningham
Score: 106-86

[05:01] Team_094 possession (Score: 106-86)
Isaiah Quickley drives, Ja Cunningham stays with him. Isaiah Quickley attempts a Dunk. Contested by Ja Cunningham (5.1 feet, ZONE). ISAIAH QUICKLEY MAKES IT! Assist: Ayo Gasol
Score: 106-88

[04:44] Team_080 possession (Score: 106-88)
Tony James drives to the basket... Tony James throws a bad pass! Stolen by Isaiah Quickley! TURNOVER! (live ball)

[04:27] Team_094 possession (Score: 106-88)
Isaiah Quickley drives, picks up Trae Brogdon. Help arrives from Larry Reaves! Isaiah Quickley attempts a Dunk. Contested by Larry Reaves (5.8 feet, MAN). ISAIAH QUICKLEY MAKES IT! Assist: Domantas Haliburton
Score: 106-90

[04:15] Team_080 possession (Score: 106-90)
Tony James drives and kicks out. Joel Bryant attempts a Midrange. Contested by Domantas Haliburton (5.8 feet, ZONE). Joel Bryant misses. Rebound secured by Isaiah Quickley.

[04:00] Team_094 possession (Score: 106-90)
Ayo Gasol drives, Joel Bryant stays with him. Ayo Gasol attempts a Dunk. Contested by Joel Bryant (4.7 feet, MAN). Ayo Gasol misses. Offensive rebound by Domantas Haliburton! Domantas Haliburton kicks it out.

[03:46] Team_094 possession (Score: 106-90)
Domantas Haliburton attempts a Midrange. Contested by Ja Cunningham (4.9 feet, MAN). Domantas Haliburton misses. Rebound secured by Ja Cunningham.

[03:32] Team_080 possession (Score: 106-90)
Tony James attempts a 3Pt. Contested by Shaquille Bryant (5.6 feet, MAN). TONY JAMES MAKES IT! Assist: Trae Brogdon
Score: 109-90

[03:17] Team_094 possession (Score: 109-90)
Shaquille Bryant drives and kicks out. Shaquille Bryant attempts a Midrange. Contested by Ja Cunningham (4.9 feet, ZONE). Shaquille Bryant misses. Rebound secured by Larry Reaves.

[03:03] Team_080 possession (Score: 109-90)
Joel Bryant attempts a Layup. BLOCKED BY AYO GASOL! Ball deflects out of bounds off Joel Bryant.

[02:48] Team_094 possession (Score: 109-90)
Kevin Rozier attempts a 3Pt. Contested by Larry Reaves (5.1 feet, MAN). KEVIN ROZIER MAKES IT! Assist: Shaquille Bryant
Score: 109-93

[02:36] Team_080 possession (Score: 109-93)
Ja Cunningham attempts a 3Pt. Contested by Domantas Haliburton (6.0 feet, MAN). Ja Cunningham misses. Rebound secured by Isaiah Quickley.

[02:22] Team_094 possession (Score: 109-93)
Shaquille Bryant drives to the basket... Shaquille Bryant loses the ball! Stripped by Tony James! TURNOVER! (live ball)

[02:08] Team_080 possession (Score: 109-93)
Larry Reaves attempts a Layup. Wide open! Isaiah Quickley is 6.4 feet away. [ZONE] Larry Reaves misses. Offensive rebound by Ja Cunningham! Ja Cunningham kicks it out.

[01:56] Team_080 possession (Score: 109-93)
Joel Bryant attempts a 3Pt. Contested by Kevin Rozier (5.5 feet, ZONE). JOEL BRYANT MAKES IT! Assist: Ja Cunningham
Score: 112-93

[01:42] Team_094 possession (Score: 112-93)
Domantas Haliburton attempts a 3Pt. Contested by Joel Bryant (4.5 feet, ZONE). Domantas Haliburton misses. Rebound secured by Ja Cunningham.

[01:31] Team_080 possession (Score: 112-93)
Trae Brogdon attempts a 3Pt. Contested by Ayo Gasol (5.1 feet, ZONE). Trae Brogdon misses. FOUL! Loose ball foul on Ayo Gasol during the rebound battle. [IN THE BONUS! 6 team fouls] Larry Reaves to the line for 2 free throws. (Ayo Gasol: 1 personal fouls)   FT 1/2: MISS   FT 2/2: GOOD Larry Reaves makes 1/2 from the line.
Score: 113-93

[01:18] Team_094 possession (Score: 113-93)
Shaquille Bryant drives and kicks out. Domantas Haliburton attempts a Midrange. Contested by Ja Cunningham (5.1 feet, MAN). Domantas Haliburton misses. Rebound secured by Joel Bryant.

[01:05] Team_080 possession (Score: 113-93)
Tony James attempts a 3Pt. Wide open! Domantas Haliburton is 6.2 feet away. [ZONE] Tony James misses. Rebound secured by Isaiah Quickley.

[00:49] Team_094 possession (Score: 113-93)
Domantas Haliburton drives and kicks out. Shaquille Bryant attempts a 3Pt. Contested by Tony James (4.5 feet, MAN). Shaquille Bryant misses. Rebound secured by Larry Reaves.

[00:35] Team_080 possession (Score: 113-93)
Trae Brogdon attempts a Layup. Wide open! Isaiah Quickley is 6.2 feet away. [MAN] TRAE BROGDON MAKES IT! Assist: Joel Bryant
Score: 115-93

[00:18] Team_094 possession (Score: 115-93)
Domantas Haliburton drives to the basket... Domantas Haliburton commits a violation (traveling/carry)! TURNOVER! (dead ball)

[00:08] Team_080 possession (Score: 115-93)
Ja Cunningham commits a violation (traveling/carry)! TURNOVER! (dead ball)

================================================================================
                              4TH QUARTER COMPLETE                              
================================================================================

4TH QUARTER SCORE: Team_080 32, Team_094 16

BOX SCORE:
================================================================================

Team_080
--------------------------------------------------------------------------------
Player                MIN  PTS  REB  AST  TO      FG   FG%      3P   3P%
--------------------------------------------------------------------------------
Trae Brogdon           19    8    1    4   0   4/4   100.0     0/0   0.0
Larry Paul             34    6    1    0   0   2/4    50.0     0/0   0.0
Larry Reaves           19    4    2    1   0   2/2   100.0     0/0   0.0
Lauri Dosunmu          29    3    0    0   0   1/1   100.0     0/0   0.0
Ja Cunningham          19    3    5    2   0   1/2    50.0     0/0   0.0
Tony James             19    3    0    0   0   1/4    25.0     0/0   0.0
Joel Bryant            14    3    1    1   0   1/2    50.0     0/0   0.0
Draymond Simons        29    0    0    1   0   0/0     0.0     0/0   0.0

TEAM: FG: 12/19 (63.2%), 3PT: 8/11 (72.7%), REB: 10 (3 off, 7 def), AST: 9, TO: 2
TEAM FOULS: 2


Team_094
--------------------------------------------------------------------------------
Player                MIN  PTS  REB  AST  TO      FG   FG%      3P   3P%
--------------------------------------------------------------------------------
Kevin Rozier           19    7    0    0   0   3/3   100.0     0/0   0.0
Domantas Haliburton    19    5    3    1   0   2/5    40.0     0/0   0.0
Isaiah Quickley        19    4    3    0   0   2/3    66.7     0/0   0.0
Tim Russell            29    0    1    0   0   0/0     0.0     0/0   0.0
Shaquille Bryant       19    0    0    4   0   0/3     0.0     0/0   0.0
Ayo Gasol              19    0    2    2   0   0/0     0.0     0/0   0.0

TEAM: FG: 7/14 (50.0%), 3PT: 2/5 (40.0%), REB: 9 (3 off, 6 def), AST: 7, TO: 6
TEAM FOULS: 6 [Team_080 in BONUS]

================================================================================

================================================================================
                               FULL GAME COMPLETE                               
================================================================================

FINAL SCORE: Team_080 115, Team_094 93

SCORING BY QUARTER:
--------------------------------------------------------------------------------
Team                     Q1     Q2     Q3     Q4    FINAL
--------------------------------------------------------------------------------
Team_080                 19     40     24     32      115
Team_094                 30     23     24     16       93
--------------------------------------------------------------------------------

FULL GAME BOX SCORE:
================================================================================

Team_080
--------------------------------------------------------------------------------
Player                MIN  PTS  REB  AST  TO      FG   FG%      3P   3P%      FT STL BLK
--------------------------------------------------------------------------------
Larry Paul             34   17    6    5   1   7/15   46.7   4/9    44.4   3/3     0   0
Lauri Dosunmu          29   18    0    1   2   6/9    66.7   6/8    75.0   0/0     0   0
Khris Turner           29    9    0    0   0   3/6    50.0   3/6    50.0   0/0     0   0
Jaren Morant           29   15    8    7   1   7/11   63.6   1/3    33.3   2/3     1   0
Draymond Simons        29   14   10    4   1   6/11   54.5   0/1     0.0   0/0     1   0
Tony James             19    5    0    1   0   3/7    42.9   1/3    33.3   0/1     1   0
Larry Reaves           19    7    4    2   1   2/2   100.0   2/2   100.0   1/2     0   0
Ja Cunningham          19    8    9    3   1   3/6    50.0   1/3    33.3   1/2     1   1
Trae Brogdon           19    8    5    5   0   5/8    62.5   1/2    50.0   3/4     0   0
Joel Bryant            14    9    1    1   0   3/5    60.0   2/3    66.7   1/2     0   0

TEAM: FG: 45/80 (56.2%), 3PT: 21/40 (52.5%), REB: 43 (8 off, 35 def), AST: 29, TO: 7


Team_094
--------------------------------------------------------------------------------
Player                MIN  PTS  REB  AST  TO      FG   FG%      3P   3P%      FT STL BLK
--------------------------------------------------------------------------------
Terry Ingram           29   20    0    2   1   8/10   80.0   1/3    33.3   3/3     1   0
Lauri Thompson         29    6    0    1   2   2/8    25.0   0/3     0.0   3/4     0   0
Kobe Wagner            29    5    7    2   2   2/5    40.0   1/1   100.0   0/0     1   0
Tim Russell            29   15   14    2   0   8/14   57.1   1/4    25.0   4/4     1   0
Kobe Bryant            29   13    9    3   1   5/10   50.0   0/1     0.0   3/6     0   3
Shaquille Bryant       19    7    0    5   1   3/8    37.5   1/4    25.0   2/2     0   0
Kevin Rozier           19   10    0    1   1   4/4   100.0   2/2   100.0   0/0     0   0
Ayo Gasol              19    0    4    3   2   0/1     0.0   0/0     0.0   1/2     0   1
Domantas Haliburton    19    5    5    1   1   2/8    25.0   1/3    33.3   0/0     0   0
Isaiah Quickley        19    8    7    0   1   4/5    80.0   0/1     0.0   2/2     1   0

TEAM: FG: 38/73 (52.1%), 3PT: 7/22 (31.8%), REB: 46 (12 off, 34 def), AST: 20, TO: 12

================================================================================
