================================================================================
                        FULL GAME - Team_090 vs Team_041                        
================================================================================

================================================================================
                       1ST QUARTER - Team_090 vs Team_041                       
================================================================================

[12:00] Team_090 possession (Score: 0-0)
Tracy Adebayo makes the Layup and draws the foul on Terry Barrett! And-1! Tracy Adebayo to the line for 1. [Team fouls: 1] (Terry Barrett: 1 personal fouls)   FT 1/1: GOOD Tracy Adebayo makes 1/1 from the line.
Score: 3-0

[11:47] Team_041 possession (Score: 3-0)
Stephen Ingram drives to the basket... Stephen Ingram throws a bad pass out of bounds! TURNOVER! (dead ball)

[11:28] Team_090 possession (Score: 3-0)
Zach Wall attempts a 3Pt. Contested by Dejounte Griffin (4.2 feet, MAN). Zach Wall misses. Rebound secured by Dejounte Griffin.

[11:18] Team_041 possession (Score: 3-0)
Terry Barrett makes the Dunk and draws the foul on Tracy Adebayo! And-1! Terry Barrett to the line for 1. [Team fouls: 1] (Tracy Adebayo: 1 personal fouls)   FT 1/1: GOOD Terry Barrett makes 1/1 from the line.
Score: 3-3

[11:02] Team_090 possession (Score: 3-3)
Larry Bridges drives to the basket... Larry Bridges throws a bad pass! Stolen by Terry Barrett! TURNOVER! (live ball)

[10:43] Team_041 possession (Score: 3-3)
Terry Barrett drives and kicks out. Terry Barrett attempts a 3Pt. Contested by Tracy Adebayo (4.7 feet, MAN). TERRY BARRETT MAKES IT! Assist: Dejounte Griffin
Score: 3-6

[10:29] Team_090 possession (Score: 3-6)
Larry Bridges drives to the basket... Larry Bridges throws a bad pass! Stolen by Terry Barrett! TURNOVER! (live ball)

[10:16] Team_041 possession (Score: 3-6)
Stephen Ingram attempts a Midrange. Contested by Gary Brogdon (3.7 feet, MAN). Stephen Ingram misses. Rebound secured by Gary Brogdon.

[10:00] Team_090 possession (Score: 3-6)
Zach Wall attempts a Midrange. Contested by Dejounte Griffin (4.2 feet, MAN). ZACH WALL MAKES IT!
Score: 5-6

[09:46] Team_041 possession (Score: 5-6)
Dejounte Griffin drives, picks up Gary Brogdon. Help arrives from Larry Bridges! Dejounte Griffin attempts a Dunk. Contested by Larry Bridges (3.7 feet, ZONE). Dejounte Griffin misses. Offensive rebound by Stephen Ingram! Stephen Ingram kicks it out.

[09:34] Team_041 possession (Score: 5-6)
Dejounte Griffin attempts a 3Pt. Contested by Zach Wall (5.0 feet, MAN). Dejounte Griffin misses. Rebound secured by Zach Wall.

[09:18] Team_090 possession (Score: 5-6)
Larry Bridges attempts a 3Pt. Contested by Scottie Turner (4.1 feet, ZONE). Larry Bridges misses. Rebound secured by Terry Barrett.

[09:02] Team_041 possession (Score: 5-6)
Jarrett Anunoby loses control! Ball rolls out of bounds! TURNOVER! (dead ball)

[08:48] Team_090 possession (Score: 5-6)
Gary Brogdon attempts a Midrange. Contested by Jarrett Anunoby (4.5 feet, ZONE). Gary Brogdon misses. Rebound secured by Dejounte Griffin.

[08:36] Team_041 possession (Score: 5-6)
Jarrett Anunoby attempts a 3Pt. Contested by Derrick Mitchell (3.8 feet, ZONE). Jarrett Anunoby misses. Offensive rebound by Terry Barrett! Terry Barrett puts it back in!
Score: 5-8

[08:18] Team_090 possession (Score: 5-8)
Larry Bridges attempts a 3Pt. Contested by Jarrett Anunoby (4.3 feet, ZONE). Larry Bridges misses. Rebound secured by Dejounte Griffin.

[08:05] Team_041 possession (Score: 5-8)
Jarrett Anunoby commits a violation (traveling/carry)! TURNOVER! (dead ball)

[07:54] Team_090 possession (Score: 5-8)
Larry Bridges attempts a 3Pt. Contested by Scottie Turner (4.1 feet, ZONE). LARRY BRIDGES MAKES IT! Assist: Tracy Adebayo
Score: 8-8

[07:38] Team_041 possession (Score: 8-8)
Stephen Ingram makes the Layup and draws the foul on Gary Brogdon! And-1! Stephen Ingram to the line for 1. [Team fouls: 2] (Gary Brogdon: 1 personal fouls)   FT 1/1: GOOD Stephen Ingram makes 1/1 from the line.
Score: 8-11

[07:28] Team_090 possession (Score: 8-11)
Gary Brogdon attempts a 3Pt. Contested by Stephen Ingram (4.4 feet, MAN). Gary Brogdon misses. Rebound secured by Stephen Ingram.

[07:14] Team_041 possession (Score: 8-11)
Dejounte Griffin attempts a Layup. Contested by Gary Brogdon (3.7 feet, ZONE). DEJOUNTE GRIFFIN MAKES IT! Assist: Terry Barrett
Score: 8-13

[06:59] Team_090 possession (Score: 8-13)
Gary Brogdon drives and kicks out. Zach Wall attempts a 3Pt. Contested by Scottie Turner (4.1 feet, ZONE). Zach Wall misses. Offensive rebound by Tracy Adebayo! Tracy Adebayo kicks it out.

[06:40] Team_090 possession (Score: 8-13)
Zach Wall attempts a 3Pt. Contested by Scottie Turner (4.4 feet, ZONE). Zach Wall misses. Rebound secured by Dejounte Griffin.

[06:28] Team_041 possession (Score: 8-13)
Stephen Ingram attempts a Midrange. Contested by Gary Brogdon (3.7 feet, MAN). STEPHEN INGRAM MAKES IT! Assist: Terry Barrett
Score: 8-15

[06:13] Team_090 possession (Score: 8-15)
Tracy Adebayo attempts a Layup. Contested by Terry Barrett (3.1 feet, MAN). Tracy Adebayo misses. Offensive rebound by Gary Brogdon! Gary Brogdon kicks it out.

[06:00] Team_090 possession (Score: 8-15)
Derrick Mitchell attempts a 3Pt. Contested by Scottie Turner (4.4 feet, MAN). Derrick Mitchell misses. Rebound secured by Dejounte Griffin.

[05:47] Team_041 possession (Score: 8-15)
Stephen Ingram attempts a 3Pt. Contested by Derrick Mitchell (3.3 feet, ZONE). Stephen Ingram misses. FOUL! Loose ball foul on Tracy Adebayo during the rebound battle. [Team fouls: 3] No free throws, side out. (Tracy Adebayo: 2 personal fouls)

[05:28] Team_041 possession (Score: 8-15)
Dejounte Griffin drives and kicks out. Stephen Ingram attempts a 3Pt. Contested by Gary Brogdon (3.7 feet, MAN). Stephen Ingram misses. Rebound secured by Zach Wall.

[05:11] Team_090 possession (Score: 8-15)
FOUL! Shooting foul on Scottie Turner. Derrick Mitchell to the line for 3 free throws. [Team fouls: 2] (Scottie Turner: 1 personal fouls)   FT 1/3: GOOD   FT 2/3: GOOD   FT 3/3: GOOD Derrick Mitchell makes 3/3 from the line.
Score: 11-15

[05:00] Team_041 possession (Score: 11-15)
Terry Barrett drives to the basket... Terry Barrett loses the ball! Stripped by Tracy Adebayo! TURNOVER! (live ball)

[04:47] Team_090 possession (Score: 11-15)
Tracy Adebayo drives, Terry Barrett stays with him. Tracy Adebayo attempts a Layup. Contested by Terry Barrett (3.1 feet, MAN). Tracy Adebayo misses. Rebound secured by Stephen Ingram.

[04:33] Team_041 possession (Score: 11-15)
Terry Barrett attempts a Midrange. Contested by Gary Brogdon (3.9 feet, ZONE). Terry Barrett misses. Rebound secured by Tracy Adebayo.

[04:23] Team_090 possession (Score: 11-15)
Larry Bridges drives and kicks out. Derrick Mitchell attempts a 3Pt. Contested by Scottie Turner (4.2 feet, ZONE). Derrick Mitchell misses. Rebound secured by Terry Barrett.

[04:08] Team_041 possession (Score: 11-15)
FOUL! Reach-in foul on Gary Brogdon during the drive. [Team fouls: 4] No free throws, side out. (Gary Brogdon: 2 personal fouls)

[03:51] Team_041 possession (Score: 11-15)
Stephen Ingram drives and kicks out. Jarrett Anunoby attempts a 3Pt. Contested by Larry Bridges (4.8 feet, MAN). Jarrett Anunoby misses. Rebound secured by Tracy Adebayo.

[03:31] Team_090 possession (Score: 11-15)
Derrick Mitchell drives and kicks out. Larry Bridges attempts a 3Pt. Contested by Jarrett Anunoby (4.4 feet, ZONE). Larry Bridges misses. Rebound secured by Stephen Ingram.

[03:20] Team_041 possession (Score: 11-15)
Jarrett Anunoby makes the Layup and draws the foul on Zach Wall! And-1! Jarrett Anunoby to the line for 1. [BONUS: 5 team fouls] (Zach Wall: 1 personal fouls)   FT 1/1: GOOD Jarrett Anunoby makes 1/1 from the line.
Score: 11-18

[03:02] Team_090 possession (Score: 11-18)
Gary Brogdon makes the Layup and draws the foul on Terry Barrett! And-1! Gary Brogdon to the line for 1. [Team fouls: 3] (Terry Barrett: 2 personal fouls)   FT 1/1: MISS Gary Brogdon makes 0/1 from the line. Rebound secured by Dejounte Griffin.
Score: 13-18

[02:47] Team_041 possession (Score: 13-18)
Jarrett Anunoby drives to the basket... Jarrett Anunoby throws a bad pass! Stolen by Larry Bridges! TURNOVER! (live ball)

[02:30] Team_090 possession (Score: 13-18)
Larry Bridges drives to the basket... Larry Bridges throws a bad pass out of bounds! TURNOVER! (dead ball)

[02:30] Substitution (Team_090): Gary Brogdon OUT → Derrick Nowitzki IN (stamina_rule2)

[02:30] Substitution (Team_090): Tracy Adebayo OUT → Tobias Tatum IN (stamina_rule2)

[02:30] Substitution (Team_041): Jarrett Anunoby OUT → Kyrie Booker IN (stamina_rule2)

[02:30] Substitution (Team_041): Dejounte Griffin OUT → Bam McCollum IN (stamina_rule2)

[02:14] Team_041 possession (Score: 13-18)
Bam McCollum attempts a Layup. Contested by Zach Wall (4.8 feet, MAN). BAM MCCOLLUM MAKES IT!
Score: 13-20

[01:59] Team_090 possession (Score: 13-20)
FOUL! Shooting foul on Kyrie Booker. Derrick Mitchell to the line for 2 free throws. [Team fouls: 4] (Kyrie Booker: 1 personal fouls)   FT 1/2: GOOD   FT 2/2: MISS Derrick Mitchell makes 1/2 from the line. Offensive rebound by Zach Wall! Zach Wall kicks it out.
Score: 14-20

[01:45] Team_090 possession (Score: 14-20)
Derrick Nowitzki attempts a Midrange. Contested by Kyrie Booker (4.0 feet, ZONE). Derrick Nowitzki misses. Rebound secured by Stephen Ingram.

[01:32] Team_041 possession (Score: 14-20)
Bam McCollum loses control! Ball rolls out of bounds! TURNOVER! (dead ball)

[01:32] Substitution (Team_090): Derrick Mitchell OUT → OG Anunoby IN (stamina_rule2)

[01:32] Substitution (Team_090): Larry Bridges OUT → Josh Wall IN (stamina_rule2)

[01:32] Substitution (Team_090): Zach Wall OUT → Russell Smith IN (stamina_rule2)

[01:32] Substitution (Team_041): Scottie Turner OUT → Franz Rose IN (stamina_rule2)

[01:32] Substitution (Team_041): Stephen Ingram OUT → Tobias McCollum IN (stamina_rule2)

[01:32] Substitution (Team_041): Terry Barrett OUT → De'Aaron Poole IN (stamina_rule2)

[01:18] Team_090 possession (Score: 14-20)
Josh Wall drives and kicks out. Derrick Nowitzki attempts a Midrange. Contested by Tobias McCollum (5.1 feet, MAN). DERRICK NOWITZKI MAKES IT! Assist: Russell Smith
Score: 16-20

[01:05] Team_041 possession (Score: 16-20)
FOUL! Shooting foul on Derrick Nowitzki. Tobias McCollum to the line for 2 free throws. [BONUS: 6 team fouls] (Derrick Nowitzki: 1 personal fouls)   FT 1/2: GOOD   FT 2/2: GOOD Tobias McCollum makes 2/2 from the line.
Score: 16-22

[00:52] Team_090 possession (Score: 16-22)
Tobias Tatum throws a bad pass out of bounds! TURNOVER! (dead ball)

[00:40] Team_041 possession (Score: 16-22)
De'Aaron Poole attempts a Midrange. Contested by Derrick Nowitzki (4.3 feet, ZONE). De'Aaron Poole misses. Rebound secured by Russell Smith.

[00:25] Team_090 possession (Score: 16-22)
Tobias Tatum throws a bad pass! Stolen by De'Aaron Poole! TURNOVER! (live ball)

[00:10] Team_041 possession (Score: 16-22)
De'Aaron Poole drives and kicks out. Kyrie Booker attempts a Midrange. Contested by Josh Wall (4.1 feet, MAN). Kyrie Booker misses. Rebound secured by Derrick Nowitzki.

================================================================================
                              1ST QUARTER COMPLETE                              
================================================================================

1ST QUARTER SCORE: Team_090 16, Team_041 22

BOX SCORE:
================================================================================

Team_090
--------------------------------------------------------------------------------
Player                MIN  PTS  REB  AST  TO      FG   FG%      3P   3P%
--------------------------------------------------------------------------------
Tracy Adebayo          10    3    3    1   0   1/2    50.0     0/0   0.0
Larry Bridges          11    3    0    0   0   1/4    25.0     0/0   0.0
Derrick Mitchell       11    3    0    0   0   1/3    33.3     0/0   0.0
Zach Wall              11    2    3    0   0   1/3    33.3     0/0   0.0
Derrick Nowitzki        2    2    1    0   0   1/2    50.0     0/0   0.0
Gary Brogdon           10    0    2    0   0   0/3     0.0     0/0   0.0
Russell Smith           1    0    1    1   0   0/0     0.0     0/0   0.0

TEAM: FG: 5/17 (29.4%), 3PT: 2/8 (25.0%), REB: 10 (3 off, 7 def), AST: 2, TO: 5
TEAM FOULS: 6 [Team_041 in BONUS]


Team_041
--------------------------------------------------------------------------------
Player                MIN  PTS  REB  AST  TO      FG   FG%      3P   3P%
--------------------------------------------------------------------------------
Terry Barrett          11    8    4    2   0   3/4    75.0     0/0   0.0
Stephen Ingram         11    5    5    0   0   2/4    50.0     0/0   0.0
Jarrett Anunoby        10    3    0    0   0   1/1   100.0     0/0   0.0
Dejounte Griffin       10    2    6    1   0   1/3    33.3     0/0   0.0
Bam McCollum            2    2    0    0   0   1/1   100.0     0/0   0.0
Tobias McCollum         1    2    0    0   0   1/1   100.0     0/0   0.0
De'Aaron Poole          1    0    0    0   0   0/2     0.0     0/0   0.0

TEAM: FG: 9/16 (56.2%), 3PT: 1/2 (50.0%), REB: 15 (3 off, 12 def), AST: 3, TO: 6
TEAM FOULS: 4

================================================================================

================================================================================
                       2ND QUARTER - Team_090 vs Team_041                       
================================================================================

[12:00] Team_090 possession (Score: 16-22)
Larry Bridges attempts a 3Pt. Contested by Jarrett Anunoby (4.3 feet, MAN). Larry Bridges misses. Rebound secured by Terry Barrett.

[11:46] Team_041 possession (Score: 16-22)
Stephen Ingram drives and kicks out. FOUL! Shooting foul on Larry Bridges. Jarrett Anunoby to the line for 2 free throws. [Team fouls: 1] (Larry Bridges: 1 personal fouls)   FT 1/2: GOOD   FT 2/2: GOOD Jarrett Anunoby makes 2/2 from the line.
Score: 16-24

[11:33] Team_090 possession (Score: 16-24)
Tracy Adebayo drives to the basket... Tracy Adebayo loses control! Ball rolls out of bounds! TURNOVER! (dead ball)

[11:15] Team_041 possession (Score: 16-24)
Dejounte Griffin makes the Dunk and draws the foul on Zach Wall! And-1! Dejounte Griffin to the line for 1. [Team fouls: 2] (Zach Wall: 1 personal fouls)   FT 1/1: GOOD Dejounte Griffin makes 1/1 from the line.
Score: 16-27

[11:00] Team_090 possession (Score: 16-27)
FOUL! Shooting foul on Terry Barrett. Tracy Adebayo to the line for 2 free throws. [Team fouls: 1] (Terry Barrett: 1 personal fouls)   FT 1/2: GOOD   FT 2/2: GOOD Tracy Adebayo makes 2/2 from the line.
Score: 18-27

[10:44] Team_041 possession (Score: 18-27)
Scottie Turner attempts a 3Pt. Contested by Derrick Mitchell (3.2 feet, ZONE). Scottie Turner misses. Rebound secured by Zach Wall.

[10:27] Team_090 possession (Score: 18-27)
Derrick Mitchell attempts a 3Pt. Contested by Scottie Turner (4.6 feet, MAN). Derrick Mitchell misses. Rebound secured by Stephen Ingram.

[10:12] Team_041 possession (Score: 18-27)
Scottie Turner attempts a Midrange. Contested by Derrick Mitchell (3.2 feet, MAN). Scottie Turner misses. Rebound secured by Zach Wall.

[09:54] Team_090 possession (Score: 18-27)
Derrick Mitchell attempts a 3Pt. Contested by Scottie Turner (4.6 feet, MAN). Derrick Mitchell misses. Offensive rebound by Tracy Adebayo! Tracy Adebayo kicks it out.

[09:42] Team_090 possession (Score: 18-27)
Zach Wall attempts a 3Pt. Contested by Dejounte Griffin (4.4 feet, MAN). Zach Wall misses. Rebound secured by Dejounte Griffin.

[09:29] Team_041 possession (Score: 18-27)
Terry Barrett drives, picks up Gary Brogdon. Help arrives from Larry Bridges! Terry Barrett attempts a Dunk. Contested by Larry Bridges (4.1 feet, ZONE). TERRY BARRETT MAKES IT! Assist: Scottie Turner
Score: 18-29

[09:14] Team_090 possession (Score: 18-29)
FOUL! Reach-in foul on Stephen Ingram during the drive. [Team fouls: 2] No free throws, side out. (Stephen Ingram: 1 personal fouls)

[09:03] Team_090 possession (Score: 18-29)
Gary Brogdon attempts a Midrange. Contested by Stephen Ingram (4.7 feet, MAN). Gary Brogdon misses. Rebound secured by Stephen Ingram.

[08:48] Team_041 possession (Score: 18-29)
Stephen Ingram drives, picks up Gary Brogdon. Help arrives from Larry Bridges! Stephen Ingram attempts a Dunk. Contested by Larry Bridges (4.2 feet, MAN). Stephen Ingram misses. Rebound secured by Gary Brogdon.

[08:37] Team_090 possession (Score: 18-29)
Tracy Adebayo attempts a Layup. Contested by Terry Barrett (3.5 feet, MAN). Tracy Adebayo misses. Rebound secured by Dejounte Griffin.

[08:25] Team_041 possession (Score: 18-29)
FOUL! Reach-in foul on Gary Brogdon during the drive. [Team fouls: 3] No free throws, side out. (Gary Brogdon: 1 personal fouls)

[08:10] Team_041 possession (Score: 18-29)
Jarrett Anunoby attempts a 3Pt. Contested by Derrick Mitchell (4.1 feet, ZONE). Jarrett Anunoby misses. Rebound secured by Zach Wall.

[07:59] Team_090 possession (Score: 18-29)
FOUL! Reach-in foul on Terry Barrett during the drive. [Team fouls: 3] No free throws, side out. (Terry Barrett: 2 personal fouls)

[07:46] Team_090 possession (Score: 18-29)
Derrick Mitchell attempts a Layup. Contested by Scottie Turner (4.9 feet, MAN). DERRICK MITCHELL MAKES IT! Assist: Tracy Adebayo
Score: 20-29

[07:34] Team_041 possession (Score: 20-29)
FOUL! Reach-in foul on Gary Brogdon during the drive. [Team fouls: 4] No free throws, side out. (Gary Brogdon: 2 personal fouls)

[07:25] Team_041 possession (Score: 20-29)
Stephen Ingram attempts a 3Pt. Contested by Derrick Mitchell (3.8 feet, ZONE). STEPHEN INGRAM MAKES IT!
Score: 20-32

[07:06] Team_090 possession (Score: 20-32)
Gary Brogdon attempts a Layup. Contested by Terry Barrett (4.1 feet, ZONE). GARY BROGDON MAKES IT!
Score: 22-32

[06:51] Team_041 possession (Score: 22-32)
Jarrett Anunoby drives, Gary Brogdon stays with him. Jarrett Anunoby attempts a Dunk. Contested by Gary Brogdon (4.9 feet, ZONE). Jarrett Anunoby misses. Rebound secured by Tracy Adebayo.

[06:35] Team_090 possession (Score: 22-32)
Tracy Adebayo makes the Layup and draws the foul on Terry Barrett! And-1! Tracy Adebayo to the line for 1. [Team fouls: 4] (Terry Barrett: 3 personal fouls)   FT 1/1: GOOD Tracy Adebayo makes 1/1 from the line.
Score: 25-32

[06:20] Team_041 possession (Score: 25-32)
Dejounte Griffin throws a bad pass! Stolen by Zach Wall! TURNOVER! (live ball)

[06:04] Team_090 possession (Score: 25-32)
Derrick Mitchell attempts a 3Pt. Contested by Scottie Turner (5.1 feet, ZONE). DERRICK MITCHELL MAKES IT! Assist: Zach Wall
Score: 28-32

[05:51] Team_041 possession (Score: 28-32)
Terry Barrett attempts a Layup. Contested by Gary Brogdon (4.7 feet, ZONE). TERRY BARRETT MAKES IT! Assist: Jarrett Anunoby
Score: 28-34

[05:36] Team_090 possession (Score: 28-34)
Tracy Adebayo attempts a Midrange. Contested by Dejounte Griffin (4.6 feet, ZONE). Tracy Adebayo misses. Offensive rebound by Tracy Adebayo! Tracy Adebayo kicks it out.

[05:21] Team_090 possession (Score: 28-34)
FOUL! Holding foul on Stephen Ingram. [IN THE BONUS! 5 team fouls] Gary Brogdon to the line for 2 free throws. (Stephen Ingram: 2 personal fouls)   FT 1/2: GOOD   FT 2/2: GOOD Gary Brogdon makes 2/2 from the line.
Score: 30-34

[05:07] Team_041 possession (Score: 30-34)
Stephen Ingram throws a bad pass! Stolen by Gary Brogdon! TURNOVER! (live ball)

[04:54] Team_090 possession (Score: 30-34)
Tracy Adebayo attempts a 3Pt. Contested by Scottie Turner (4.8 feet, ZONE). Tracy Adebayo misses. Rebound secured by Terry Barrett.

[04:38] Team_041 possession (Score: 30-34)
Jarrett Anunoby attempts a Midrange. Contested by Larry Bridges (6.0 feet, ZONE). JARRETT ANUNOBY MAKES IT!
Score: 30-36

[04:26] Team_090 possession (Score: 30-36)
Larry Bridges attempts a 3Pt. Contested by Scottie Turner (5.0 feet, ZONE). Larry Bridges misses. Rebound secured by Stephen Ingram.

[04:11] Team_041 possession (Score: 30-36)
Jarrett Anunoby loses the ball! Stripped by Larry Bridges! TURNOVER! (live ball)

[03:57] Team_090 possession (Score: 30-36)
Derrick Mitchell drives and kicks out. Derrick Mitchell attempts a Midrange. Contested by Scottie Turner (5.2 feet, MAN). DERRICK MITCHELL MAKES IT! Assist: Zach Wall
Score: 32-36

[03:42] Team_041 possession (Score: 32-36)
Jarrett Anunoby attempts a 3Pt. Contested by Derrick Mitchell (4.6 feet, ZONE). Jarrett Anunoby misses. Rebound secured by Zach Wall.

[03:26] Team_090 possession (Score: 32-36)
Tracy Adebayo attempts a 3Pt. Contested by Terry Barrett (4.3 feet, MAN). Tracy Adebayo misses. Rebound secured by Dejounte Griffin.

[03:09] Team_041 possession (Score: 32-36)
Jarrett Anunoby attempts a 3Pt. Wide open! Larry Bridges is 6.2 feet away. [ZONE] Jarrett Anunoby misses. Rebound secured by Zach Wall.

[02:52] Team_090 possession (Score: 32-36)
Larry Bridges throws a bad pass out of bounds! TURNOVER! (dead ball)

[02:52] Substitution (Team_090): Derrick Mitchell OUT → OG Anunoby IN (stamina_rule2)

[02:52] Substitution (Team_090): Larry Bridges OUT → Josh Wall IN (stamina_rule2)

[02:52] Substitution (Team_090): Zach Wall OUT → Russell Smith IN (stamina_rule2)

[02:52] Substitution (Team_090): Gary Brogdon OUT → Derrick Nowitzki IN (stamina_rule2)

[02:52] Substitution (Team_090): Tracy Adebayo OUT → Tobias Tatum IN (stamina_rule2)

[02:52] Substitution (Team_041): Scottie Turner OUT → Franz Rose IN (stamina_rule2)

[02:52] Substitution (Team_041): Jarrett Anunoby OUT → Kyrie Booker IN (stamina_rule2)

[02:52] Substitution (Team_041): Dejounte Griffin OUT → Bam McCollum IN (stamina_rule2)

[02:52] Substitution (Team_041): Stephen Ingram OUT → Tobias McCollum IN (stamina_rule2)

[02:52] Substitution (Team_041): Terry Barrett OUT → De'Aaron Poole IN (stamina_rule2)

[02:41] Team_041 possession (Score: 32-36)
Bam McCollum drives and kicks out. Bam McCollum attempts a 3Pt. Contested by Russell Smith (4.3 feet, ZONE). Bam McCollum misses. Rebound secured by Derrick Nowitzki.

[02:28] Team_090 possession (Score: 32-36)
Tobias Tatum attempts a Midrange. Contested by De'Aaron Poole (5.7 feet, MAN). Tobias Tatum misses. Rebound secured by De'Aaron Poole.

[02:13] Team_041 possession (Score: 32-36)
FOUL! Shooting foul on Tobias Tatum. De'Aaron Poole to the line for 2 free throws. [BONUS: 5 team fouls] (Tobias Tatum: 1 personal fouls)   FT 1/2: MISS   FT 2/2: GOOD De'Aaron Poole makes 1/2 from the line.
Score: 32-37

[02:01] Team_090 possession (Score: 32-37)
Derrick Nowitzki attempts a 3Pt. Contested by Tobias McCollum (4.7 feet, MAN). DERRICK NOWITZKI MAKES IT! Assist: Russell Smith
Score: 35-37

[01:46] Team_041 possession (Score: 35-37)
De'Aaron Poole drives to the basket... De'Aaron Poole loses the ball! Stripped by Derrick Nowitzki! TURNOVER! (live ball)

[01:31] Team_090 possession (Score: 35-37)
FOUL! Reach-in foul on De'Aaron Poole during the drive. [IN THE BONUS! 6 team fouls] Tobias Tatum to the line for 2 free throws. (De'Aaron Poole: 1 personal fouls)   FT 1/2: GOOD   FT 2/2: GOOD Tobias Tatum makes 2/2 from the line.
Score: 37-37

[01:14] Team_041 possession (Score: 37-37)
Bam McCollum drives and kicks out. FOUL! Shooting foul on Josh Wall. Kyrie Booker to the line for 3 free throws. [BONUS: 6 team fouls] (Josh Wall: 1 personal fouls)   FT 1/3: GOOD   FT 2/3: MISS   FT 3/3: GOOD Kyrie Booker makes 2/3 from the line.
Score: 37-39

[01:04] Team_090 possession (Score: 37-39)
Russell Smith throws a bad pass out of bounds! TURNOVER! (dead ball)

[00:48] Team_041 possession (Score: 37-39)
Tobias McCollum makes the Layup and draws the foul on Derrick Nowitzki! And-1! Tobias McCollum to the line for 1. [BONUS: 7 team fouls] (Derrick Nowitzki: 1 personal fouls)   FT 1/1: GOOD Tobias McCollum makes 1/1 from the line.
Score: 37-42

[00:34] Team_090 possession (Score: 37-42)
Russell Smith drives, Tobias McCollum stays with him. Russell Smith attempts a Dunk. Contested by Tobias McCollum (5.4 feet, ZONE). RUSSELL SMITH MAKES IT!
Score: 39-42

[00:22] Team_041 possession (Score: 39-42)
Bam McCollum throws a bad pass out of bounds! TURNOVER! (dead ball)

[00:05] Team_090 possession (Score: 39-42)
Josh Wall makes the Layup and draws the foul on Tobias McCollum! And-1! Josh Wall to the line for 1. [BONUS: 7 team fouls] (Tobias McCollum: 1 personal fouls)   FT 1/1: GOOD Josh Wall makes 1/1 from the line.
Score: 42-42

================================================================================
                              2ND QUARTER COMPLETE                              
================================================================================

2ND QUARTER SCORE: Team_090 26, Team_041 20

BOX SCORE:
================================================================================

Team_090
--------------------------------------------------------------------------------
Player                MIN  PTS  REB  AST  TO      FG   FG%      3P   3P%
--------------------------------------------------------------------------------
Derrick Mitchell       20    7    0    0   0   3/4    75.0     0/0   0.0
Tracy Adebayo          19    5    3    1   0   2/5    40.0     0/0   0.0
Gary Brogdon           19    4    1    0   0   2/3    66.7     0/0   0.0
Derrick Nowitzki        5    3    1    0   0   1/1   100.0     0/0   0.0
Josh Wall               4    3    0    0   0   1/1   100.0     0/0   0.0
Tobias Tatum            5    2    0    0   0   1/2    50.0     0/0   0.0
Russell Smith           4    2    0    1   0   1/1   100.0     0/0   0.0
Larry Bridges          20    0    0    0   0   0/2     0.0     0/0   0.0
Zach Wall              20    0    5    2   0   0/1     0.0     0/0   0.0

TEAM: FG: 11/20 (55.0%), 3PT: 2/8 (25.0%), REB: 10 (2 off, 8 def), AST: 4, TO: 3
TEAM FOULS: 7 [Team_041 in BONUS]


Team_041
--------------------------------------------------------------------------------
Player                MIN  PTS  REB  AST  TO      FG   FG%      3P   3P%
--------------------------------------------------------------------------------
Terry Barrett          20    4    2    0   0   2/2   100.0     0/0   0.0
Jarrett Anunoby        19    4    0    1   0   2/6    33.3     0/0   0.0
Dejounte Griffin       19    3    3    0   0   1/1   100.0     0/0   0.0
Stephen Ingram         20    3    3    0   0   1/2    50.0     0/0   0.0
Tobias McCollum         4    3    0    0   0   1/1   100.0     0/0   0.0
Kyrie Booker            5    2    0    0   0   1/1   100.0     0/0   0.0
De'Aaron Poole          4    1    1    0   0   1/1   100.0     0/0   0.0
Scottie Turner         20    0    0    1   0   0/2     0.0     0/0   0.0
Bam McCollum            5    0    0    0   0   0/1     0.0     0/0   0.0

TEAM: FG: 9/17 (52.9%), 3PT: 1/5 (20.0%), REB: 9 (0 off, 9 def), AST: 2, TO: 5
TEAM FOULS: 7 [Team_090 in BONUS]

================================================================================

================================================================================
                       3RD QUARTER - Team_090 vs Team_041                       
================================================================================

[12:00] Team_090 possession (Score: 42-42)
Derrick Mitchell makes the Layup and draws the foul on Scottie Turner! And-1! Derrick Mitchell to the line for 1. [Team fouls: 1] (Scottie Turner: 1 personal fouls)   FT 1/1: GOOD Derrick Mitchell makes 1/1 from the line.
Score: 45-42

[11:44] Team_041 possession (Score: 45-42)
Stephen Ingram attempts a 3Pt. Contested by Derrick Mitchell (3.3 feet, ZONE). STEPHEN INGRAM MAKES IT! Assist: Scottie Turner
Score: 45-45

[11:34] Team_090 possession (Score: 45-45)
Derrick Mitchell drives to the basket... Derrick Mitchell loses control! Ball rolls out of bounds! TURNOVER! (dead ball)

[11:22] Team_041 possession (Score: 45-45)
FOUL! Reach-in foul on Zach Wall during the drive. [Team fouls: 1] No free throws, side out. (Zach Wall: 1 personal fouls)

[11:10] Team_041 possession (Score: 45-45)
Stephen Ingram attempts a 3Pt. Contested by Derrick Mitchell (3.3 feet, ZONE). STEPHEN INGRAM MAKES IT! Assist: Jarrett Anunoby
Score: 45-48

[10:53] Team_090 possession (Score: 45-48)
Tracy Adebayo drives, picks up Terry Barrett. Help arrives from Jarrett Anunoby! Tracy Adebayo attempts a Dunk. Contested by Jarrett Anunoby (3.1 feet, ZONE). Tracy Adebayo misses. Offensive rebound by Tracy Adebayo! Tracy Adebayo kicks it out.

[10:43] Team_090 possession (Score: 45-48)
Zach Wall attempts a 3Pt. Contested by Scottie Turner (4.4 feet, ZONE). Zach Wall misses. Rebound secured by Terry Barrett.

[10:29] Team_041 possession (Score: 45-48)
FOUL! Reach-in foul on Gary Brogdon during the drive. [Team fouls: 2] No free throws, side out. (Gary Brogdon: 1 personal fouls)

[10:12] Team_041 possession (Score: 45-48)
Dejounte Griffin attempts a 3Pt. Contested by Zach Wall (5.0 feet, MAN). DEJOUNTE GRIFFIN MAKES IT! Assist: Terry Barrett
Score: 45-51

[10:00] Team_090 possession (Score: 45-51)
Zach Wall attempts a Midrange. Contested by Dejounte Griffin (4.2 feet, MAN). Zach Wall misses. Rebound secured by Dejounte Griffin.

[09:49] Team_041 possession (Score: 45-51)
Stephen Ingram attempts a Midrange. BLOCKED BY GARY BROGDON! Ball is loose! Rebound secured by Zach Wall.

[09:36] Team_090 possession (Score: 45-51)
Derrick Mitchell drives and kicks out. Zach Wall attempts a 3Pt. Contested by Dejounte Griffin (3.9 feet, MAN). Zach Wall misses. Rebound secured by Terry Barrett.

[09:23] Team_041 possession (Score: 45-51)
FOUL! Shooting foul on Gary Brogdon. Stephen Ingram to the line for 2 free throws. [Team fouls: 3] (Gary Brogdon: 2 personal fouls)   FT 1/2: GOOD   FT 2/2: GOOD Stephen Ingram makes 2/2 from the line.
Score: 45-53

[09:05] Team_090 possession (Score: 45-53)
Gary Brogdon throws a bad pass! Stolen by Stephen Ingram! TURNOVER! (live ball)

[08:48] Team_041 possession (Score: 45-53)
Dejounte Griffin attempts a 3Pt. Contested by Derrick Mitchell (3.3 feet, ZONE). Dejounte Griffin misses. Rebound secured by Tracy Adebayo.

[08:29] Team_090 possession (Score: 45-53)
Larry Bridges attempts a Midrange. Contested by Jarrett Anunoby (4.3 feet, MAN). Larry Bridges misses. Rebound secured by Terry Barrett.

[08:17] Team_041 possession (Score: 45-53)
Terry Barrett drives and kicks out. Terry Barrett attempts a 3Pt. Contested by Derrick Mitchell (3.2 feet, ZONE). Terry Barrett misses. Rebound secured by Gary Brogdon.

[08:02] Team_090 possession (Score: 45-53)
Derrick Mitchell attempts a 3Pt. BLOCKED BY SCOTTIE TURNER! Ball is loose! Rebound secured by Stephen Ingram.

[07:45] Team_041 possession (Score: 45-53)
Dejounte Griffin attempts a 3Pt. Contested by Zach Wall (5.0 feet, MAN). Dejounte Griffin misses. Rebound secured by Zach Wall.

[07:29] Team_090 possession (Score: 45-53)
Derrick Mitchell attempts a 3Pt. Contested by Scottie Turner (4.4 feet, ZONE). DERRICK MITCHELL MAKES IT! Assist: Zach Wall
Score: 48-53

[07:12] Team_041 possession (Score: 48-53)
Terry Barrett attempts a Midrange. Contested by Larry Bridges (4.9 feet, ZONE). TERRY BARRETT MAKES IT! Assist: Jarrett Anunoby
Score: 48-55

[06:55] Team_090 possession (Score: 48-55)
Gary Brogdon attempts a Layup. Contested by Stephen Ingram (4.4 feet, MAN). GARY BROGDON MAKES IT!
Score: 50-55

[06:44] Team_041 possession (Score: 50-55)
Dejounte Griffin attempts a 3Pt. Contested by Derrick Mitchell (3.3 feet, ZONE). DEJOUNTE GRIFFIN MAKES IT! Assist: Scottie Turner
Score: 50-58

[06:26] Team_090 possession (Score: 50-58)
Tracy Adebayo drives, Terry Barrett stays with him. Tracy Adebayo attempts a Dunk. Contested by Terry Barrett (3.1 feet, MAN). TRACY ADEBAYO MAKES IT!
Score: 52-58

[06:10] Team_041 possession (Score: 52-58)
Terry Barrett attempts a Midrange. Contested by Gary Brogdon (3.8 feet, ZONE). Terry Barrett misses. Rebound secured by Gary Brogdon.

[05:57] Team_090 possession (Score: 52-58)
Zach Wall drives, Terry Barrett stays with him. Zach Wall attempts a Dunk. Contested by Terry Barrett (3.5 feet, ZONE). Zach Wall misses. Rebound secured by Stephen Ingram.

[05:44] Team_041 possession (Score: 52-58)
Dejounte Griffin makes the 3Pt and draws the foul on Derrick Mitchell! And-1! Dejounte Griffin to the line for 1. [Team fouls: 4] (Derrick Mitchell: 1 personal fouls)   FT 1/1: MISS Dejounte Griffin makes 0/1 from the line. Rebound secured by Gary Brogdon.
Score: 52-61

[05:26] Team_090 possession (Score: 52-61)
FOUL! Reach-in foul on Jarrett Anunoby during the drive. [Team fouls: 2] No free throws, side out. (Jarrett Anunoby: 1 personal fouls)

[05:10] Team_090 possession (Score: 52-61)
FOUL! Holding foul on Jarrett Anunoby. [Team fouls: 3] No free throws, side out. (Jarrett Anunoby: 2 personal fouls)

[04:53] Team_090 possession (Score: 52-61)
Gary Brogdon drives and kicks out. Derrick Mitchell attempts a 3Pt. Contested by Scottie Turner (4.1 feet, MAN). Derrick Mitchell misses. Offensive rebound by Tracy Adebayo! Tracy Adebayo kicks it out.

[04:39] Team_090 possession (Score: 52-61)
FOUL! Holding foul on Terry Barrett. [Team fouls: 4] No free throws, side out. (Terry Barrett: 1 personal fouls)

[04:22] Team_090 possession (Score: 52-61)
Derrick Mitchell attempts a Midrange. Contested by Scottie Turner (4.5 feet, MAN). DERRICK MITCHELL MAKES IT!
Score: 54-61

[04:09] Team_041 possession (Score: 54-61)
Dejounte Griffin attempts a Layup. BLOCKED BY LARRY BRIDGES! Ball is loose! Offensive rebound by Terry Barrett! Terry Barrett kicks it out.

[03:52] Team_041 possession (Score: 54-61)
Dejounte Griffin attempts a 3Pt. Contested by Zach Wall (5.0 feet, MAN). Dejounte Griffin misses. Rebound secured by Gary Brogdon.

[03:36] Team_090 possession (Score: 54-61)
Derrick Mitchell drives and kicks out. Larry Bridges attempts a 3Pt. Contested by Jarrett Anunoby (4.4 feet, MAN). Larry Bridges misses. Rebound secured by Terry Barrett.

[03:21] Team_041 possession (Score: 54-61)
FOUL! Holding foul on Gary Brogdon. [IN THE BONUS! 6 team fouls] Stephen Ingram to the line for 2 free throws. (Gary Brogdon: 3 personal fouls)   FT 1/2: GOOD   FT 2/2: GOOD Stephen Ingram makes 2/2 from the line.
Score: 54-63

[03:06] Team_090 possession (Score: 54-63)
Zach Wall makes the 3Pt and draws the foul on Stephen Ingram! And-1! Zach Wall to the line for 1. [BONUS: 5 team fouls] (Stephen Ingram: 1 personal fouls)   FT 1/1: GOOD Zach Wall makes 1/1 from the line.
Score: 58-63

[02:56] Team_041 possession (Score: 58-63)
FOUL! Reach-in foul on Gary Brogdon during the drive. [IN THE BONUS! 7 team fouls] Terry Barrett to the line for 2 free throws. (Gary Brogdon: 4 personal fouls)   FT 1/2: GOOD   FT 2/2: GOOD Terry Barrett makes 2/2 from the line.
Score: 58-65

[02:40] Team_090 possession (Score: 58-65)
Zach Wall drives and kicks out. Tracy Adebayo attempts a Midrange. Contested by Terry Barrett (3.5 feet, MAN). TRACY ADEBAYO MAKES IT! Assist: Derrick Mitchell
Score: 60-65

[02:26] Team_041 possession (Score: 60-65)
Dejounte Griffin attempts a 3Pt. Contested by Zach Wall (5.1 feet, ZONE). Dejounte Griffin misses. Rebound secured by Zach Wall.

[02:11] Team_090 possession (Score: 60-65)
FOUL! Reach-in foul on Terry Barrett during the drive. [IN THE BONUS! 6 team fouls] Zach Wall to the line for 2 free throws. (Terry Barrett: 2 personal fouls)   FT 1/2: GOOD   FT 2/2: GOOD Zach Wall makes 2/2 from the line.
Score: 62-65

[01:57] Team_041 possession (Score: 62-65)
Stephen Ingram makes the Midrange and draws the foul on Zach Wall! And-1! Stephen Ingram to the line for 1. [BONUS: 8 team fouls] (Zach Wall: 3 personal fouls)   FT 1/1: GOOD Stephen Ingram makes 1/1 from the line.
Score: 62-68

[01:42] Team_090 possession (Score: 62-68)
Tracy Adebayo drives to the basket... Tracy Adebayo throws a bad pass out of bounds! TURNOVER! (dead ball)

[01:42] Substitution (Team_090): Larry Bridges OUT → Josh Wall IN (stamina_rule2)

[01:42] Substitution (Team_090): Gary Brogdon OUT → Derrick Nowitzki IN (stamina_rule2)

[01:42] Substitution (Team_090): Tracy Adebayo OUT → Tobias Tatum IN (stamina_rule2)

[01:42] Substitution (Team_041): Scottie Turner OUT → Franz Rose IN (stamina_rule2)

[01:42] Substitution (Team_041): Jarrett Anunoby OUT → Kyrie Booker IN (stamina_rule2)

[01:42] Substitution (Team_041): Dejounte Griffin OUT → Bam McCollum IN (stamina_rule2)

[01:42] Substitution (Team_041): Terry Barrett OUT → De'Aaron Poole IN (stamina_rule2)

[01:26] Team_041 possession (Score: 62-68)
Franz Rose attempts a 3Pt. Contested by Josh Wall (4.1 feet, ZONE). Franz Rose misses. Rebound secured by Zach Wall.

[01:16] Team_090 possession (Score: 62-68)
Derrick Nowitzki drives and kicks out. Tobias Tatum attempts a Midrange. Contested by De'Aaron Poole (5.0 feet, MAN). Tobias Tatum misses. Rebound secured by De'Aaron Poole.

[01:02] Team_041 possession (Score: 62-68)
Kyrie Booker attempts a 3Pt. Contested by Derrick Mitchell (3.6 feet, ZONE). Kyrie Booker misses. Rebound secured by Derrick Nowitzki.

[00:47] Team_090 possession (Score: 62-68)
Zach Wall attempts a Midrange. Contested by Stephen Ingram (4.8 feet, ZONE). ZACH WALL MAKES IT!
Score: 64-68

[00:33] Team_041 possession (Score: 64-68)
Franz Rose attempts a Midrange. Contested by Tobias Tatum (4.7 feet, ZONE). Franz Rose misses. Rebound secured by Zach Wall.

[00:15] Team_090 possession (Score: 64-68)
Josh Wall attempts a 3Pt. Contested by Stephen Ingram (5.0 feet, ZONE). Josh Wall misses. Rebound secured by De'Aaron Poole.

================================================================================
                              3RD QUARTER COMPLETE                              
================================================================================

3RD QUARTER SCORE: Team_090 22, Team_041 26

BOX SCORE:
================================================================================

Team_090
--------------------------------------------------------------------------------
Player                MIN  PTS  REB  AST  TO      FG   FG%      3P   3P%
--------------------------------------------------------------------------------
Derrick Mitchell       32    8    0    1   0   3/6    50.0     0/0   0.0
Zach Wall              32    8    5    1   0   3/6    50.0     0/0   0.0
Tracy Adebayo          30    4    3    0   0   2/2   100.0     0/0   0.0
Gary Brogdon           30    2    4    0   0   1/1   100.0     0/0   0.0
Larry Bridges          31    0    0    0   0   0/1     0.0     0/0   0.0
Derrick Nowitzki        7    0    1    0   0   0/1     0.0     0/0   0.0
Josh Wall               6    0    0    0   0   0/1     0.0     0/0   0.0

TEAM: FG: 9/18 (50.0%), 3PT: 2/5 (40.0%), REB: 13 (2 off, 11 def), AST: 2, TO: 3
TEAM FOULS: 8 [Team_041 in BONUS]


Team_041
--------------------------------------------------------------------------------
Player                MIN  PTS  REB  AST  TO      FG   FG%      3P   3P%
--------------------------------------------------------------------------------
Stephen Ingram         32   13    2    0   0   5/6    83.3     0/0   0.0
Dejounte Griffin       30    6    1    0   0   2/7    28.6     0/0   0.0
Terry Barrett          31    4    5    1   0   2/4    50.0     0/0   0.0
Scottie Turner         31    0    0    2   0   0/0     0.0     0/0   0.0
Jarrett Anunoby        30    0    0    2   0   0/0     0.0     0/0   0.0
Franz Rose              6    0    0    0   0   0/2     0.0     0/0   0.0
De'Aaron Poole          6    0    2    0   0   0/0     0.0     0/0   0.0
Kyrie Booker            7    0    0    0   0   0/1     0.0     0/0   0.0

TEAM: FG: 9/20 (45.0%), 3PT: 4/11 (36.4%), REB: 10 (1 off, 9 def), AST: 5, TO: 0
TEAM FOULS: 6 [Team_090 in BONUS]

================================================================================

================================================================================
                       4TH QUARTER - Team_090 vs Team_041                       
================================================================================

[12:00] Team_090 possession (Score: 64-68)
Zach Wall attempts a 3Pt. Contested by Scottie Turner (4.4 feet, ZONE). ZACH WALL MAKES IT! Assist: Derrick Mitchell
Score: 67-68

[11:45] Team_041 possession (Score: 67-68)
FOUL! Reach-in foul on Gary Brogdon during the drive. [Team fouls: 1] No free throws, side out. (Gary Brogdon: 1 personal fouls)

[11:30] Team_041 possession (Score: 67-68)
FOUL! Offensive foul on Scottie Turner! Derrick Mitchell drew the charge! [Team fouls: 1] (Scottie Turner: 1 personal fouls) TURNOVER! (dead ball)

[11:16] Team_090 possession (Score: 67-68)
Derrick Mitchell attempts a 3Pt. Contested by Scottie Turner (4.5 feet, MAN). Derrick Mitchell misses. Rebound secured by Stephen Ingram.

[11:07] Team_041 possession (Score: 67-68)
Scottie Turner drives and kicks out. Scottie Turner attempts a Midrange. Contested by Derrick Mitchell (3.5 feet, MAN). Scottie Turner misses. Rebound secured by Zach Wall.

[10:54] Team_090 possession (Score: 67-68)
FOUL! Offensive foul on Gary Brogdon! Stephen Ingram drew the charge! [Team fouls: 2] (Gary Brogdon: 2 personal fouls) TURNOVER! (dead ball)

[10:38] Team_041 possession (Score: 67-68)
Scottie Turner loses control! Ball rolls out of bounds! TURNOVER! (dead ball)

[10:38] Substitution (Team_090): Derrick Mitchell OUT → OG Anunoby IN (stamina_rule2)

[10:38] Substitution (Team_090): Zach Wall OUT → Russell Smith IN (stamina_rule2)

[10:38] Substitution (Team_090): Gary Brogdon OUT → Derrick Nowitzki IN (stamina_rule2)

[10:38] Substitution (Team_090): Tracy Adebayo OUT → Tobias Tatum IN (stamina_rule2)

[10:38] Substitution (Team_041): Dejounte Griffin OUT → Bam McCollum IN (stamina_rule2)

[10:38] Substitution (Team_041): Stephen Ingram OUT → Tobias McCollum IN (stamina_rule2)

[10:25] Team_090 possession (Score: 67-68)
OG Anunoby throws a bad pass! Stolen by Scottie Turner! TURNOVER! (live ball)

[10:11] Team_041 possession (Score: 67-68)
Terry Barrett attempts a Dunk. BLOCKED BY DERRICK NOWITZKI! Ball is loose! Offensive rebound by Tobias McCollum! Tobias McCollum kicks it out.

[09:55] Team_041 possession (Score: 67-68)
Jarrett Anunoby attempts a Midrange. Contested by Larry Bridges (5.4 feet, MAN). Jarrett Anunoby misses. Rebound secured by Tobias Tatum.

[09:42] Team_090 possession (Score: 67-68)
Larry Bridges makes the Layup and draws the foul on Terry Barrett! And-1! Larry Bridges to the line for 1. [Team fouls: 2] (Terry Barrett: 1 personal fouls)   FT 1/1: GOOD Larry Bridges makes 1/1 from the line.
Score: 70-68

[09:29] Team_041 possession (Score: 70-68)
Terry Barrett attempts a 3Pt. Contested by Russell Smith (4.5 feet, ZONE). TERRY BARRETT MAKES IT! Assist: Scottie Turner
Score: 70-71

[09:14] Team_090 possession (Score: 70-71)
FOUL! Shooting foul on Scottie Turner. OG Anunoby to the line for 2 free throws. [Team fouls: 3] (Scottie Turner: 2 personal fouls)   FT 1/2: MISS   FT 2/2: GOOD OG Anunoby makes 1/2 from the line.
Score: 71-71

[09:01] Team_041 possession (Score: 71-71)
Bam McCollum attempts a Midrange. Contested by Derrick Nowitzki (4.0 feet, ZONE). Bam McCollum misses. Rebound secured by Russell Smith.

[08:43] Team_090 possession (Score: 71-71)
FOUL! Offensive foul on Larry Bridges! Jarrett Anunoby drew the charge! [Team fouls: 3] (Larry Bridges: 1 personal fouls) TURNOVER! (dead ball)

[08:28] Team_041 possession (Score: 71-71)
Scottie Turner attempts a 3Pt. Contested by Russell Smith (4.2 feet, ZONE). SCOTTIE TURNER MAKES IT! Assist: Jarrett Anunoby
Score: 71-74

[08:19] Team_090 possession (Score: 71-74)
Tobias Tatum attempts a Layup. Contested by Terry Barrett (4.5 feet, MAN). TOBIAS TATUM MAKES IT! Assist: Derrick Nowitzki
Score: 73-74

[07:59] Team_041 possession (Score: 73-74)
Bam McCollum attempts a 3Pt. Contested by Russell Smith (4.0 feet, MAN). Bam McCollum misses. Rebound secured by Derrick Nowitzki.

[07:43] Team_090 possession (Score: 73-74)
Larry Bridges drives, picks up Terry Barrett. Help arrives from Jarrett Anunoby! Larry Bridges attempts a Dunk. Contested by Jarrett Anunoby (3.9 feet, ZONE). Larry Bridges misses. Offensive rebound by Russell Smith! Russell Smith kicks it out.

[07:30] Team_090 possession (Score: 73-74)
Derrick Nowitzki attempts a Midrange. Contested by Bam McCollum (5.5 feet, ZONE). Derrick Nowitzki misses. Rebound secured by Tobias McCollum.

[07:18] Team_041 possession (Score: 73-74)
Bam McCollum attempts a 3Pt. Contested by Russell Smith (4.0 feet, ZONE). BAM MCCOLLUM MAKES IT! Assist: Scottie Turner
Score: 73-77

[07:00] Team_090 possession (Score: 73-77)
Derrick Nowitzki drives, Terry Barrett stays with him. Derrick Nowitzki attempts a Dunk. Contested by Terry Barrett (3.6 feet, ZONE). DERRICK NOWITZKI MAKES IT!
Score: 75-77

[06:43] Team_041 possession (Score: 75-77)
Tobias McCollum drives, picks up Derrick Nowitzki. Help arrives from Larry Bridges! Tobias McCollum attempts a Dunk. Contested by Larry Bridges (4.6 feet, MAN). TOBIAS MCCOLLUM MAKES IT! Assist: Jarrett Anunoby
Score: 75-79

[06:34] Team_090 possession (Score: 75-79)
FOUL! Offensive foul on Larry Bridges! Jarrett Anunoby drew the charge! [Team fouls: 4] (Larry Bridges: 2 personal fouls) TURNOVER! (dead ball)

[06:19] Team_041 possession (Score: 75-79)
Tobias McCollum attempts a Midrange. Contested by Tobias Tatum (4.9 feet, ZONE). Tobias McCollum misses. Rebound secured by Russell Smith.

[06:07] Team_090 possession (Score: 75-79)
FOUL! Shooting foul on Tobias McCollum. Derrick Nowitzki to the line for 2 free throws. [Team fouls: 4] (Tobias McCollum: 1 personal fouls)   FT 1/2: GOOD   FT 2/2: GOOD Derrick Nowitzki makes 2/2 from the line.
Score: 77-79

[05:57] Team_041 possession (Score: 77-79)
Scottie Turner attempts a Layup. BLOCKED BY DERRICK NOWITZKI! Ball is loose! Rebound secured by Russell Smith.

[05:41] Team_090 possession (Score: 77-79)
OG Anunoby attempts a 3Pt. Contested by Scottie Turner (5.0 feet, ZONE). OG Anunoby misses. Rebound secured by Jarrett Anunoby.

[05:23] Team_041 possession (Score: 77-79)
Bam McCollum drives, Derrick Nowitzki stays with him. Bam McCollum attempts a Layup. Contested by Derrick Nowitzki (4.0 feet, ZONE). Bam McCollum misses. Rebound secured by Tobias Tatum.

[05:07] Team_090 possession (Score: 77-79)
FOUL! Holding foul on Jarrett Anunoby. [IN THE BONUS! 5 team fouls] Larry Bridges to the line for 2 free throws. (Jarrett Anunoby: 1 personal fouls)   FT 1/2: MISS   FT 2/2: MISS Larry Bridges makes 0/2 from the line. Rebound secured by Tobias McCollum.

[04:54] Team_041 possession (Score: 77-79)
FOUL! Holding foul on Larry Bridges. [IN THE BONUS! 5 team fouls] Jarrett Anunoby to the line for 2 free throws. (Larry Bridges: 3 personal fouls)   FT 1/2: GOOD   FT 2/2: GOOD Jarrett Anunoby makes 2/2 from the line.
Score: 77-81

[04:40] Team_090 possession (Score: 77-81)
FOUL! Offensive foul on Larry Bridges! Jarrett Anunoby drew the charge! [Team fouls: 6] (Larry Bridges: 4 personal fouls) TURNOVER! (dead ball)

[04:27] Team_041 possession (Score: 77-81)
Terry Barrett drives, Tobias Tatum stays with him. Terry Barrett attempts a Dunk. Contested by Tobias Tatum (4.7 feet, MAN). TERRY BARRETT MAKES IT! Assist: Bam McCollum
Score: 77-83

[04:15] Team_090 possession (Score: 77-83)
Tobias Tatum attempts a Layup. BLOCKED BY TERRY BARRETT! Ball is loose! Rebound secured by Terry Barrett.

[04:01] Team_041 possession (Score: 77-83)
Jarrett Anunoby drives, Larry Bridges stays with him. Jarrett Anunoby attempts a Dunk. Wide open! Larry Bridges is 6.0 feet away. [MAN] Jarrett Anunoby misses. Offensive rebound by Tobias McCollum! Tobias McCollum kicks it out.

[03:48] Team_041 possession (Score: 77-83)
Tobias McCollum attempts a 3Pt. Contested by Derrick Nowitzki (4.7 feet, MAN). Tobias McCollum misses. Rebound secured by Derrick Nowitzki.

[03:33] Team_090 possession (Score: 77-83)
FOUL! Shooting foul on Jarrett Anunoby. OG Anunoby to the line for 2 free throws. [BONUS: 6 team fouls] (Jarrett Anunoby: 2 personal fouls)   FT 1/2: MISS   FT 2/2: MISS OG Anunoby makes 0/2 from the line. Rebound secured by Tobias McCollum.

[03:19] Team_041 possession (Score: 77-83)
Scottie Turner drives to the basket... Scottie Turner loses the ball! Stripped by OG Anunoby! TURNOVER! (live ball)

[03:05] Team_090 possession (Score: 77-83)
Russell Smith attempts a Layup. Contested by Terry Barrett (5.0 feet, ZONE). RUSSELL SMITH MAKES IT! Assist: Derrick Nowitzki
Score: 79-83

[02:50] Team_041 possession (Score: 79-83)
Scottie Turner drives, Derrick Nowitzki stays with him. Scottie Turner attempts a Layup. Contested by Derrick Nowitzki (4.3 feet, ZONE). SCOTTIE TURNER MAKES IT!
Score: 79-85

[02:34] Team_090 possession (Score: 79-85)
Derrick Nowitzki attempts a Midrange. Contested by Tobias McCollum (4.9 feet, MAN). Derrick Nowitzki misses. Rebound secured by Tobias McCollum.

[02:22] Team_041 possession (Score: 79-85)
Tobias McCollum attempts a 3Pt. Contested by Russell Smith (4.7 feet, ZONE). Tobias McCollum misses. Rebound secured by Tobias Tatum.

[02:04] Team_090 possession (Score: 79-85)
Larry Bridges attempts a 3Pt. Contested by Jarrett Anunoby (5.6 feet, MAN). Larry Bridges misses. FOUL! Loose ball foul on Jarrett Anunoby during the rebound battle. [IN THE BONUS! 7 team fouls] Russell Smith to the line for 2 free throws. (Jarrett Anunoby: 3 personal fouls)   FT 1/2: GOOD   FT 2/2: GOOD Russell Smith makes 2/2 from the line.
Score: 81-85

[01:51] Team_041 possession (Score: 81-85)
FOUL! Shooting foul on Russell Smith. Jarrett Anunoby to the line for 3 free throws. [BONUS: 7 team fouls] (Russell Smith: 1 personal fouls)   FT 1/3: GOOD   FT 2/3: GOOD   FT 3/3: MISS Jarrett Anunoby makes 2/3 from the line. Offensive rebound by Terry Barrett! Terry Barrett kicks it out.
Score: 81-87

[01:41] Team_041 possession (Score: 81-87)
Terry Barrett drives, picks up Tobias Tatum. Help arrives from OG Anunoby! Terry Barrett attempts a Dunk. Contested by OG Anunoby (4.8 feet, MAN). Terry Barrett misses. Rebound secured by Derrick Nowitzki.

[01:26] Team_090 possession (Score: 81-87)
Larry Bridges attempts a 3Pt. Contested by Scottie Turner (5.4 feet, ZONE). Larry Bridges misses. Rebound secured by Jarrett Anunoby.

[01:14] Team_041 possession (Score: 81-87)
Tobias McCollum attempts a 3Pt. Contested by Russell Smith (4.8 feet, ZONE). Tobias McCollum misses. Rebound secured by Tobias Tatum.

[01:00] Team_090 possession (Score: 81-87)
Derrick Nowitzki attempts a 3Pt. Contested by Tobias McCollum (5.1 feet, MAN). Derrick Nowitzki misses. Rebound secured by Jarrett Anunoby.

[00:44] Team_041 possession (Score: 81-87)
Bam McCollum attempts a 3Pt. Contested by Russell Smith (4.3 feet, MAN). Bam McCollum misses. Offensive rebound by Tobias McCollum! Tobias McCollum kicks it out.

[00:30] Team_041 possession (Score: 81-87)
Bam McCollum makes the Dunk and draws the foul on Russell Smith! And-1! Bam McCollum to the line for 1. [BONUS: 8 team fouls] (Russell Smith: 2 personal fouls)   FT 1/1: MISS Bam McCollum makes 0/1 from the line. Rebound secured by Derrick Nowitzki.
Score: 81-89

[00:13] Team_090 possession (Score: 81-89)
Derrick Nowitzki attempts a 3Pt. Contested by Tobias McCollum (5.2 feet, MAN). DERRICK NOWITZKI MAKES IT! Assist: Russell Smith
Score: 84-89

================================================================================
                              4TH QUARTER COMPLETE                              
================================================================================

4TH QUARTER SCORE: Team_090 20, Team_041 21

BOX SCORE:
================================================================================

Team_090
--------------------------------------------------------------------------------
Player                MIN  PTS  REB  AST  TO      FG   FG%      3P   3P%
--------------------------------------------------------------------------------
Derrick Nowitzki       17    7    4    2   0   3/6    50.0     0/0   0.0
Russell Smith          15    4    4    1   0   2/2   100.0     0/0   0.0
Zach Wall              34    3    1    0   0   1/1   100.0     0/0   0.0
Larry Bridges          43    3    0    0   0   1/2    50.0     0/0   0.0
Tobias Tatum           17    2    4    0   0   1/2    50.0     0/0   0.0
OG Anunoby             15    1    0    0   0   1/3    33.3     0/0   0.0
Derrick Mitchell       34    0    0    1   0   0/1     0.0     0/0   0.0

TEAM: FG: 9/18 (50.0%), 3PT: 3/7 (42.9%), REB: 13 (1 off, 12 def), AST: 4, TO: 5
TEAM FOULS: 8 [Team_041 in BONUS]


Team_041
--------------------------------------------------------------------------------
Player                MIN  PTS  REB  AST  TO      FG   FG%      3P   3P%
--------------------------------------------------------------------------------
Scottie Turner         43    5    0    2   0   2/4    50.0     0/0   0.0
Terry Barrett          43    5    2    0   0   2/3    66.7     0/0   0.0
Bam McCollum           17    3    0    1   0   1/5    20.0     0/0   0.0
Tobias McCollum        15    2    7    0   0   1/5    20.0     0/0   0.0
Jarrett Anunoby        42    2    3    2   0   1/2    50.0     0/0   0.0
Stephen Ingram         34    0    1    0   0   0/0     0.0     0/0   0.0

TEAM: FG: 7/19 (36.8%), 3PT: 3/7 (42.9%), REB: 13 (4 off, 9 def), AST: 5, TO: 3
TEAM FOULS: 7 [Team_090 in BONUS]

================================================================================

================================================================================
                               FULL GAME COMPLETE                               
================================================================================

FINAL SCORE: Team_090 84, Team_041 89

SCORING BY QUARTER:
--------------------------------------------------------------------------------
Team                     Q1     Q2     Q3     Q4    FINAL
--------------------------------------------------------------------------------
Team_090                 16     26     22     20       84
Team_041                 22     20     26     21       89
--------------------------------------------------------------------------------

FULL GAME BOX SCORE:
================================================================================

Team_090
--------------------------------------------------------------------------------
Player                MIN  PTS  REB  AST  TO      FG   FG%      3P   3P%      FT STL BLK
--------------------------------------------------------------------------------
Larry Bridges          43    6    0    0   7   3/10   30.0   2/7    28.6   1/3     2   1
Derrick Mitchell       34   18    0    2   0   7/14   50.0   3/7    42.9   5/6     0   0
Zach Wall              34   13   14    3   1   6/12   50.0   2/6    33.3   3/3     1   0
Gary Brogdon           31    6    7    0   4   2/6    33.3   0/1     0.0   2/3     1   1
Tracy Adebayo          31   12    9    2   0   4/8    50.0   0/2     0.0   4/4     1   0
Derrick Nowitzki       17   12    7    2   0   4/9    44.4   2/3    66.7   2/2     1   2
Tobias Tatum           17    4    4    0   2   2/4    50.0   0/0     0.0   2/2     0   0
OG Anunoby             15    1    0    0   1   1/3    33.3   0/1     0.0   1/4     1   0
Russell Smith          15    6    5    3   1   2/2   100.0   0/0     0.0   2/2     0   0
Josh Wall               6    3    0    0   0   2/3    66.7   0/1     0.0   1/1     0   0

TEAM: FG: 34/73 (46.6%), 3PT: 9/28 (32.1%), REB: 46 (8 off, 38 def), AST: 12, TO: 16


Team_041
--------------------------------------------------------------------------------
Player                MIN  PTS  REB  AST  TO      FG   FG%      3P   3P%      FT STL BLK
--------------------------------------------------------------------------------
Scottie Turner         43    5    0    5   3   2/6    33.3   1/2    50.0   0/0     1   1
Terry Barrett          43   21   13    3   3   8/12   66.7   1/1   100.0   3/3     2   1
Jarrett Anunoby        42    9    3    5   3   3/8    37.5   1/4    25.0   7/8     0   0
Stephen Ingram         34   21   11    0   1   8/12   66.7   3/3   100.0   6/6     1   0
Dejounte Griffin       31   11   10    1   1   4/11   36.4   2/8    25.0   1/2     0   0
Bam McCollum           17    5    0    1   2   3/8    37.5   1/2    50.0   0/1     0   0
Tobias McCollum        15    7    7    0   0   3/7    42.9   0/3     0.0   3/3     0   0
Kyrie Booker            7    2    0    0   1   0/1     0.0   0/1     0.0   2/3     0   0
Franz Rose              6    0    0    0   0   0/2     0.0   0/1     0.0   0/0     0   0
De'Aaron Poole          6    1    3    0   0   1/3    33.3   0/0     0.0   1/2     1   0

TEAM: FG: 34/72 (47.2%), 3PT: 9/25 (36.0%), REB: 47 (8 off, 39 def), AST: 15, TO: 14

================================================================================
