================================================================================
                        FULL GAME - Team_019 vs Team_070                        
================================================================================

================================================================================
                       1ST QUARTER - Team_019 vs Team_070                       
================================================================================

[12:00] Team_019 possession (Score: 0-0)
DeMar James attempts a Layup. Contested by Khris Bryant (2.8 feet, ZONE). DEMAR JAMES MAKES IT! Assist: Brandon James
Score: 2-0

[11:45] Team_070 possession (Score: 2-0)
LeBron Barnes makes the Layup and draws the foul on DeMar James! And-1! LeBron Barnes to the line for 1. [Team fouls: 1] (DeMar James: 1 personal fouls)   FT 1/1: GOOD LeBron Barnes makes 1/1 from the line.
Score: 2-3

[11:29] Team_019 possession (Score: 2-3)
D'Angelo Randle attempts a 3Pt. Contested by Khris Bryant (2.7 feet, ZONE). D'Angelo Randle misses. Rebound secured by Jabari Paul.

[11:15] Team_070 possession (Score: 2-3)
Khris Bryant attempts a 3Pt. Contested by Tobias Hyland (5.5 feet, MAN). Khris Bryant misses. Rebound secured by D'Angelo Randle.

[11:05] Team_019 possession (Score: 2-3)
D'Angelo Randle attempts a 3Pt. Contested by John Hyland (4.7 feet, MAN). D'Angelo Randle misses. Rebound secured by LeBron Barnes.

[10:50] Team_070 possession (Score: 2-3)
John Hyland attempts a Layup. Contested by DeMar James (4.2 feet, ZONE). John Hyland misses. Rebound secured by DeMar James.

[10:34] Team_019 possession (Score: 2-3)
FOUL! Holding foul on Khris Bryant. [Team fouls: 1] No free throws, side out. (Khris Bryant: 1 personal fouls)

[10:21] Team_019 possession (Score: 2-3)
D'Angelo Randle attempts a Midrange. Contested by Khris Bryant (2.7 feet, ZONE). D'Angelo Randle misses. Rebound secured by Khris Bryant.

[10:07] Team_070 possession (Score: 2-3)
Jabari Paul attempts a Layup. Contested by DeMar James (5.0 feet, MAN). Jabari Paul misses. Offensive rebound by LeBron Barnes! LeBron Barnes kicks it out.

[09:55] Team_070 possession (Score: 2-3)
FOUL! Reach-in foul on DeMar James during the drive. [Team fouls: 2] No free throws, side out. (DeMar James: 2 personal fouls)

[09:41] Team_070 possession (Score: 2-3)
John Hyland attempts a Midrange. Contested by D'Angelo Randle (3.5 feet, MAN). John Hyland misses. Offensive rebound by Khris Bryant! Khris Bryant's putback is no good. Rebound secured by D'Angelo Randle.

[09:29] Team_019 possession (Score: 2-3)
DeMar James attempts a 3Pt. Contested by Khris Bryant (2.8 feet, ZONE). DeMar James misses. FOUL! Loose ball foul on Khris Bryant during the rebound battle. [Team fouls: 2] No free throws, side out. (Khris Bryant: 2 personal fouls)

[09:13] Team_019 possession (Score: 2-3)
D'Angelo Randle attempts a 3Pt. Contested by John Hyland (4.7 feet, MAN). D'ANGELO RANDLE MAKES IT! Assist: Rudy Giddey
Score: 5-3

[09:00] Team_070 possession (Score: 5-3)
Cole Gasol attempts a 3Pt. Contested by D'Angelo Randle (3.8 feet, ZONE). Cole Gasol misses. Rebound secured by D'Angelo Randle.

[08:49] Team_019 possession (Score: 5-3)
DeMar James attempts a Layup. Contested by Khris Bryant (2.8 feet, ZONE). DeMar James misses. Rebound secured by Khris Bryant.

[08:36] Team_070 possession (Score: 5-3)
Khris Bryant makes the Midrange and draws the foul on Tobias Hyland! And-1! Khris Bryant to the line for 1. [Team fouls: 3] (Tobias Hyland: 1 personal fouls)   FT 1/1: GOOD Khris Bryant makes 1/1 from the line.
Score: 5-6

[08:18] Team_019 possession (Score: 5-6)
FOUL! Shooting foul on Cole Gasol. Rudy Giddey to the line for 2 free throws. [Team fouls: 3] (Cole Gasol: 1 personal fouls)   FT 1/2: GOOD   FT 2/2: MISS Rudy Giddey makes 1/2 from the line. Rebound secured by LeBron Barnes.
Score: 6-6

[08:00] Team_070 possession (Score: 6-6)
Jabari Paul drives and kicks out. FOUL! Shooting foul on D'Angelo Randle. Khris Bryant to the line for 3 free throws. [Team fouls: 4] (D'Angelo Randle: 1 personal fouls)   FT 1/3: GOOD   FT 2/3: GOOD   FT 3/3: GOOD Khris Bryant makes 3/3 from the line.
Score: 6-9

[07:46] Team_019 possession (Score: 6-9)
Tobias Hyland attempts a 3Pt. Contested by Khris Bryant (2.5 feet, ZONE). Tobias Hyland misses. Offensive rebound by D'Angelo Randle! D'Angelo Randle puts it back in!
Score: 8-9

[07:30] Team_070 possession (Score: 8-9)
Cole Gasol attempts a Midrange. Contested by Rudy Giddey (5.5 feet, MAN). Cole Gasol misses. Rebound secured by DeMar James.

[07:19] Team_019 possession (Score: 8-9)
Rudy Giddey attempts a Layup. Contested by Cole Gasol (5.5 feet, MAN). Rudy Giddey misses. Offensive rebound by DeMar James! DeMar James puts it back in!
Score: 10-9

[07:06] Team_070 possession (Score: 10-9)
John Hyland attempts a Layup. Contested by DeMar James (4.2 feet, ZONE). JOHN HYLAND MAKES IT! Assist: LeBron Barnes
Score: 10-11

[06:55] Team_019 possession (Score: 10-11)
DeMar James drives and kicks out. Tobias Hyland attempts a Midrange. Contested by Khris Bryant (2.4 feet, MAN). TOBIAS HYLAND MAKES IT! Assist: DeMar James
Score: 12-11

[06:39] Team_070 possession (Score: 12-11)
Cole Gasol drives and kicks out. John Hyland attempts a 3Pt. Contested by D'Angelo Randle (3.6 feet, ZONE). JOHN HYLAND MAKES IT! Assist: Jabari Paul
Score: 12-14

[06:25] Team_019 possession (Score: 12-14)
Brandon James attempts a 3Pt. Contested by LeBron Barnes (3.5 feet, MAN). Brandon James misses. Rebound secured by Jabari Paul.

[06:11] Team_070 possession (Score: 12-14)
FOUL! Shooting foul on DeMar James. Jabari Paul to the line for 2 free throws. [BONUS: 5 team fouls] (DeMar James: 3 personal fouls)   FT 1/2: MISS   FT 2/2: GOOD Jabari Paul makes 1/2 from the line.
Score: 12-15

[05:54] Team_019 possession (Score: 12-15)
Brandon James attempts a Midrange. Contested by Khris Bryant (2.4 feet, ZONE). Brandon James misses. Offensive rebound by DeMar James! DeMar James puts it back in!
Score: 14-15

[05:38] Team_070 possession (Score: 14-15)
LeBron Barnes drives, Brandon James stays with him. LeBron Barnes attempts a Layup. Contested by Brandon James (5.5 feet, MAN). LeBron Barnes misses. Rebound secured by D'Angelo Randle.

[05:20] Team_019 possession (Score: 14-15)
Brandon James drives, LeBron Barnes stays with him. Brandon James attempts a Dunk. Contested by LeBron Barnes (3.6 feet, MAN). BRANDON JAMES MAKES IT! Assist: Rudy Giddey
Score: 16-15

[05:06] Team_070 possession (Score: 16-15)
FOUL! Reach-in foul on D'Angelo Randle during the drive. [IN THE BONUS! 6 team fouls] John Hyland to the line for 2 free throws. (D'Angelo Randle: 2 personal fouls)   FT 1/2: GOOD   FT 2/2: MISS John Hyland makes 1/2 from the line. Offensive rebound by LeBron Barnes! LeBron Barnes kicks it out.
Score: 16-16

[04:52] Team_070 possession (Score: 16-16)
LeBron Barnes makes the Midrange and draws the foul on Brandon James! And-1! LeBron Barnes to the line for 1. [BONUS: 7 team fouls] (Brandon James: 1 personal fouls)   FT 1/1: GOOD LeBron Barnes makes 1/1 from the line.
Score: 16-19

[04:36] Team_019 possession (Score: 16-19)
D'Angelo Randle drives and kicks out. Rudy Giddey attempts a 3Pt. Contested by Cole Gasol (5.3 feet, MAN). RUDY GIDDEY MAKES IT!
Score: 19-19

[04:24] Team_070 possession (Score: 19-19)
Cole Gasol attempts a Midrange. Contested by Brandon James (5.4 feet, ZONE). Cole Gasol misses. Rebound secured by D'Angelo Randle.

[04:10] Team_019 possession (Score: 19-19)
Brandon James drives to the basket... Brandon James loses the ball! Stripped by Khris Bryant! TURNOVER! (live ball)

[03:56] Team_070 possession (Score: 19-19)
Jabari Paul attempts a Midrange. Wide open! Tobias Hyland is 6.5 feet away. [ZONE] JABARI PAUL MAKES IT! Assist: Cole Gasol
Score: 19-21

[03:44] Team_019 possession (Score: 19-21)
Rudy Giddey drives, picks up Cole Gasol. Help arrives from LeBron Barnes! Rudy Giddey attempts a Layup. Contested by LeBron Barnes (5.6 feet, MAN). RUDY GIDDEY MAKES IT! Assist: Tobias Hyland
Score: 21-21

[03:27] Team_070 possession (Score: 21-21)
Cole Gasol attempts a 3Pt. Contested by Rudy Giddey (5.6 feet, MAN). COLE GASOL MAKES IT! Assist: Khris Bryant
Score: 21-24

[03:11] Team_019 possession (Score: 21-24)
Rudy Giddey attempts a 3Pt. Contested by Khris Bryant (2.9 feet, ZONE). RUDY GIDDEY MAKES IT!
Score: 24-24

[03:00] Team_070 possession (Score: 24-24)
Cole Gasol attempts a 3Pt. Contested by Rudy Giddey (5.7 feet, MAN). Cole Gasol misses. Rebound secured by DeMar James.

[02:49] Team_019 possession (Score: 24-24)
D'Angelo Randle drives, picks up John Hyland. Help arrives from LeBron Barnes! D'Angelo Randle attempts a Dunk. Contested by LeBron Barnes (4.9 feet, MAN). D'Angelo Randle misses. FOUL! Loose ball foul on Khris Bryant during the rebound battle. [Team fouls: 4] No free throws, side out. (Khris Bryant: 3 personal fouls)

[02:40] Team_019 possession (Score: 24-24)
DeMar James drives, Khris Bryant stays with him. DeMar James attempts a Layup. Contested by Khris Bryant (3.1 feet, MAN). DEMAR JAMES MAKES IT! Assist: Rudy Giddey
Score: 26-24

[02:28] Team_070 possession (Score: 26-24)
John Hyland attempts a 3Pt. Contested by D'Angelo Randle (3.9 feet, ZONE). John Hyland misses. Rebound secured by D'Angelo Randle.

[02:13] Team_019 possession (Score: 26-24)
Tobias Hyland attempts a Layup. Contested by Khris Bryant (2.8 feet, ZONE). Tobias Hyland misses. Rebound secured by Jabari Paul.

[02:00] Team_070 possession (Score: 26-24)
John Hyland attempts a Midrange. Contested by D'Angelo Randle (4.0 feet, ZONE). JOHN HYLAND MAKES IT!
Score: 26-26

[01:46] Team_019 possession (Score: 26-26)
FOUL! Shooting foul on Khris Bryant. Rudy Giddey to the line for 2 free throws. [BONUS: 5 team fouls] (Khris Bryant: 4 personal fouls)   FT 1/2: MISS   FT 2/2: GOOD Rudy Giddey makes 1/2 from the line.
Score: 27-26

[01:33] Team_070 possession (Score: 27-26)
LeBron Barnes drives to the basket... LeBron Barnes throws a bad pass! Stolen by DeMar James! TURNOVER! (live ball)

[01:15] Team_019 possession (Score: 27-26)
D'Angelo Randle drives and kicks out. DeMar James attempts a Midrange. Contested by Khris Bryant (3.0 feet, ZONE). DeMar James misses. Offensive rebound by DeMar James! DeMar James kicks it out.

[00:59] Team_019 possession (Score: 27-26)
D'Angelo Randle attempts a Midrange. Contested by John Hyland (5.1 feet, MAN). D'ANGELO RANDLE MAKES IT!
Score: 29-26

[00:45] Team_070 possession (Score: 29-26)
Cole Gasol drives to the basket... Cole Gasol commits a violation (traveling/carry)! TURNOVER! (dead ball)

[00:45] Substitution (Team_019): Rudy Giddey OUT → Gary Ginobili IN (stamina_rule2)

[00:45] Substitution (Team_019): Brandon James OUT → Jalen Turner IN (stamina_rule2)

[00:45] Substitution (Team_019): D'Angelo Randle OUT → Blake LaVine IN (stamina_rule2)

[00:45] Substitution (Team_019): Tobias Hyland OUT → Shai Ingram IN (stamina_rule2)

[00:45] Substitution (Team_019): DeMar James OUT → Tim Jordan IN (stamina_rule2)

[00:45] Substitution (Team_070): Cole Gasol OUT → Paul Quickley IN (stamina_rule2)

[00:45] Substitution (Team_070): LeBron Barnes OUT → Allen Quickley IN (stamina_rule2)

[00:45] Substitution (Team_070): John Hyland OUT → D'Angelo McGrady IN (stamina_rule2)

[00:45] Substitution (Team_070): Khris Bryant OUT → Luka Gobert IN (stamina_rule2)

[00:45] Substitution (Team_070): Jabari Paul OUT → Russell Morant IN (stamina_rule2)

[00:35] Team_019 possession (Score: 29-26)
FOUL! Shooting foul on Luka Gobert. Blake LaVine to the line for 2 free throws. [BONUS: 6 team fouls] (Luka Gobert: 1 personal fouls)   FT 1/2: MISS   FT 2/2: MISS Blake LaVine makes 0/2 from the line. Rebound secured by Russell Morant.

[00:17] Team_070 possession (Score: 29-26)
Paul Quickley attempts a 3Pt. Contested by Gary Ginobili (5.7 feet, MAN). PAUL QUICKLEY MAKES IT!
Score: 29-29

================================================================================
                              1ST QUARTER COMPLETE                              
================================================================================

1ST QUARTER SCORE: Team_019 29, Team_070 29

BOX SCORE:
================================================================================

Team_019
--------------------------------------------------------------------------------
Player                MIN  PTS  REB  AST  TO      FG   FG%      3P   3P%
--------------------------------------------------------------------------------
Rudy Giddey            11    9    0    3   0   4/5    80.0     0/0   0.0
DeMar James            11    8    8    1   0   4/5    80.0     0/0   0.0
D'Angelo Randle        11    7    7    0   0   3/6    50.0     0/0   0.0
Brandon James          11    2    0    1   0   1/2    50.0     0/0   0.0
Tobias Hyland          11    2    0    1   0   1/2    50.0     0/0   0.0
Blake LaVine            1    0    0    0   0   0/1     0.0     0/0   0.0

TEAM: FG: 13/21 (61.9%), 3PT: 3/6 (50.0%), REB: 14 (6 off, 8 def), AST: 6, TO: 1
TEAM FOULS: 7 [Team_070 in BONUS]


Team_070
--------------------------------------------------------------------------------
Player                MIN  PTS  REB  AST  TO      FG   FG%      3P   3P%
--------------------------------------------------------------------------------
John Hyland            11    7    0    0   0   3/6    50.0     0/0   0.0
LeBron Barnes          11    6    4    1   0   2/3    66.7     0/0   0.0
Khris Bryant           11    6    2    1   0   2/3    66.7     0/0   0.0
Jabari Paul            11    3    3    1   0   2/2   100.0     0/0   0.0
Cole Gasol             11    3    0    1   0   1/5    20.0     0/0   0.0
Paul Quickley           1    3    0    0   0   1/1   100.0     0/0   0.0
Russell Morant          1    0    1    0   0   0/0     0.0     0/0   0.0

TEAM: FG: 11/20 (55.0%), 3PT: 2/6 (33.3%), REB: 11 (3 off, 8 def), AST: 4, TO: 2
TEAM FOULS: 6 [Team_019 in BONUS]

================================================================================

================================================================================
                       2ND QUARTER - Team_019 vs Team_070                       
================================================================================

[12:00] Substitution (Team_019): D'Angelo Randle OUT → Blake LaVine IN (stamina_rule2)

[12:00] Substitution (Team_019): Tobias Hyland OUT → Shai Ingram IN (stamina_rule2)

[12:00] Substitution (Team_019): DeMar James OUT → Tim Jordan IN (stamina_rule2)

[12:00] Team_019 possession (Score: 29-29)
Brandon James drives to the basket... Brandon James loses control! Ball rolls out of bounds! TURNOVER! (dead ball)

[11:47] Team_070 possession (Score: 29-29)
Khris Bryant attempts a 3Pt. Contested by Blake LaVine (4.6 feet, ZONE). KHRIS BRYANT MAKES IT! Assist: LeBron Barnes
Score: 29-32

[11:27] Team_019 possession (Score: 29-32)
Blake LaVine attempts a 3Pt. Contested by John Hyland (4.9 feet, MAN). Blake LaVine misses. Rebound secured by Jabari Paul.

[11:14] Team_070 possession (Score: 29-32)
John Hyland drives and kicks out. Jabari Paul attempts a 3Pt. Contested by Blake LaVine (4.7 feet, ZONE). Jabari Paul misses. Offensive rebound by Khris Bryant! Khris Bryant puts it back in!
Score: 29-34

[10:57] Team_019 possession (Score: 29-34)
Shai Ingram attempts a 3Pt. Contested by Khris Bryant (2.8 feet, ZONE). SHAI INGRAM MAKES IT! Assist: Rudy Giddey
Score: 32-34

[10:44] Team_070 possession (Score: 32-34)
Jabari Paul drives to the basket... Jabari Paul throws a bad pass! Stolen by Shai Ingram! TURNOVER! (live ball)

[10:30] Team_019 possession (Score: 32-34)
Tim Jordan commits a violation (traveling/carry)! TURNOVER! (dead ball)

[10:30] Substitution (Team_019): Rudy Giddey OUT → Gary Ginobili IN (stamina_rule2)

[10:30] Substitution (Team_019): Brandon James OUT → Jalen Turner IN (stamina_rule2)

[10:30] Substitution (Team_070): Cole Gasol OUT → Paul Quickley IN (stamina_rule2)

[10:30] Substitution (Team_070): LeBron Barnes OUT → Allen Quickley IN (stamina_rule2)

[10:30] Substitution (Team_070): John Hyland OUT → D'Angelo McGrady IN (stamina_rule2)

[10:30] Substitution (Team_070): Khris Bryant OUT → Luka Gobert IN (stamina_rule2)

[10:30] Substitution (Team_070): Jabari Paul OUT → Russell Morant IN (stamina_rule2)

[10:16] Team_070 possession (Score: 32-34)
Paul Quickley drives, Gary Ginobili stays with him. Paul Quickley attempts a Dunk. Contested by Gary Ginobili (5.7 feet, MAN). PAUL QUICKLEY MAKES IT! Assist: Allen Quickley
Score: 32-36

[10:02] Team_019 possession (Score: 32-36)
Shai Ingram drives, Luka Gobert stays with him. Shai Ingram attempts a Layup. Contested by Luka Gobert (4.7 feet, MAN). Shai Ingram misses. Offensive rebound by Shai Ingram! Shai Ingram kicks it out.

[09:48] Team_019 possession (Score: 32-36)
Shai Ingram throws a bad pass! Stolen by Luka Gobert! TURNOVER! (live ball)

[09:37] Team_070 possession (Score: 32-36)
FOUL! Holding foul on Jalen Turner. [Team fouls: 1] No free throws, side out. (Jalen Turner: 1 personal fouls)

[09:27] Team_070 possession (Score: 32-36)
D'Angelo McGrady attempts a 3Pt. Contested by Blake LaVine (4.8 feet, MAN). D'Angelo McGrady misses. Rebound secured by Shai Ingram.

[09:12] Team_019 possession (Score: 32-36)
Shai Ingram drives and kicks out. Tim Jordan attempts a Midrange. Contested by Luka Gobert (4.8 feet, ZONE). Tim Jordan misses. Rebound secured by Luka Gobert.

[08:59] Team_070 possession (Score: 32-36)
Allen Quickley attempts a 3Pt. Contested by Jalen Turner (4.0 feet, MAN). Allen Quickley misses. Rebound secured by Tim Jordan.

[08:46] Team_019 possession (Score: 32-36)
Gary Ginobili attempts a Layup. Contested by Russell Morant (4.2 feet, ZONE). GARY GINOBILI MAKES IT! Assist: Shai Ingram
Score: 34-36

[08:31] Team_070 possession (Score: 34-36)
Russell Morant drives, picks up Shai Ingram. Help arrives from Jalen Turner! Russell Morant attempts a Dunk. Contested by Jalen Turner (4.7 feet, ZONE). RUSSELL MORANT MAKES IT! Assist: Paul Quickley
Score: 34-38

[08:17] Team_019 possession (Score: 34-38)
Blake LaVine drives, Russell Morant stays with him. Blake LaVine attempts a Dunk. Contested by Russell Morant (3.9 feet, ZONE). Blake LaVine misses. Offensive rebound by Tim Jordan! Tim Jordan kicks it out.

[08:00] Team_019 possession (Score: 34-38)
FOUL! Offensive foul on Shai Ingram! Luka Gobert drew the charge! [Team fouls: 2] (Shai Ingram: 1 personal fouls) TURNOVER! (dead ball)

[07:45] Team_070 possession (Score: 34-38)
FOUL! Shooting foul on Shai Ingram. Luka Gobert to the line for 2 free throws. [Team fouls: 3] (Shai Ingram: 2 personal fouls)   FT 1/2: MISS   FT 2/2: GOOD Luka Gobert makes 1/2 from the line.
Score: 34-39

[07:32] Team_019 possession (Score: 34-39)
Jalen Turner attempts a 3Pt. Contested by D'Angelo McGrady (5.9 feet, ZONE). Jalen Turner misses. Rebound secured by D'Angelo McGrady.

[07:19] Team_070 possession (Score: 34-39)
D'Angelo McGrady drives and kicks out. Russell Morant attempts a Midrange. Contested by Shai Ingram (4.5 feet, MAN). RUSSELL MORANT MAKES IT! Assist: Luka Gobert
Score: 34-41

[07:07] Team_019 possession (Score: 34-41)
Gary Ginobili drives and kicks out. Tim Jordan attempts a 3Pt. Contested by Russell Morant (3.7 feet, MAN). TIM JORDAN MAKES IT! Assist: Jalen Turner
Score: 37-41

[06:55] Team_070 possession (Score: 37-41)
Allen Quickley attempts a Layup. BLOCKED BY SHAI INGRAM! Ball deflects out of bounds off Allen Quickley.

[06:40] Team_019 possession (Score: 37-41)
Gary Ginobili attempts a 3Pt. Contested by Paul Quickley (4.8 feet, ZONE). Gary Ginobili misses. Rebound secured by Russell Morant.

[06:26] Team_070 possession (Score: 37-41)
Paul Quickley attempts a 3Pt. Contested by Gary Ginobili (5.7 feet, MAN). PAUL QUICKLEY MAKES IT! Assist: Russell Morant
Score: 37-44

[06:14] Team_019 possession (Score: 37-44)
FOUL! Shooting foul on Paul Quickley. Jalen Turner to the line for 3 free throws. [Team fouls: 1] (Paul Quickley: 1 personal fouls)   FT 1/3: GOOD   FT 2/3: MISS   FT 3/3: MISS Jalen Turner makes 1/3 from the line. Rebound secured by D'Angelo McGrady.
Score: 38-44

[05:56] Team_070 possession (Score: 38-44)
Luka Gobert attempts a 3Pt. Contested by Blake LaVine (4.8 feet, ZONE). LUKA GOBERT MAKES IT! Assist: Paul Quickley
Score: 38-47

[05:43] Team_019 possession (Score: 38-47)
Tim Jordan attempts a Layup. Contested by Russell Morant (3.7 feet, MAN). TIM JORDAN MAKES IT! Assist: Shai Ingram
Score: 40-47

[05:26] Team_070 possession (Score: 40-47)
Paul Quickley attempts a Layup. Contested by Shai Ingram (4.5 feet, ZONE). PAUL QUICKLEY MAKES IT! Assist: D'Angelo McGrady
Score: 40-49

[05:12] Team_019 possession (Score: 40-49)
Gary Ginobili attempts a 3Pt. Contested by Paul Quickley (4.8 feet, MAN). Gary Ginobili misses. Rebound secured by Luka Gobert.

[04:55] Team_070 possession (Score: 40-49)
Paul Quickley drives and kicks out. D'Angelo McGrady attempts a 3Pt. Contested by Blake LaVine (4.8 feet, MAN). D'ANGELO MCGRADY MAKES IT! Assist: Russell Morant
Score: 40-52

[04:39] Team_019 possession (Score: 40-52)
FOUL! Shooting foul on Allen Quickley. Jalen Turner to the line for 2 free throws. [Team fouls: 2] (Allen Quickley: 1 personal fouls)   FT 1/2: GOOD   FT 2/2: GOOD Jalen Turner makes 2/2 from the line.
Score: 42-52

[04:23] Team_070 possession (Score: 42-52)
Russell Morant makes the Midrange and draws the foul on Jalen Turner! And-1! Russell Morant to the line for 1. [Team fouls: 4] (Jalen Turner: 2 personal fouls)   FT 1/1: GOOD Russell Morant makes 1/1 from the line.
Score: 42-55

[04:05] Team_019 possession (Score: 42-55)
Jalen Turner makes the Dunk and draws the foul on Paul Quickley! And-1! Jalen Turner to the line for 1. [Team fouls: 3] (Paul Quickley: 2 personal fouls)   FT 1/1: GOOD Jalen Turner makes 1/1 from the line.
Score: 45-55

[03:52] Team_070 possession (Score: 45-55)
Allen Quickley attempts a 3Pt. Contested by Blake LaVine (4.9 feet, ZONE). ALLEN QUICKLEY MAKES IT! Assist: D'Angelo McGrady
Score: 45-58

[03:40] Team_019 possession (Score: 45-58)
Shai Ingram attempts a 3Pt. Contested by Paul Quickley (4.3 feet, ZONE). Shai Ingram misses. Rebound secured by Russell Morant.

[03:22] Team_070 possession (Score: 45-58)
Luka Gobert attempts a 3Pt. Contested by Blake LaVine (5.0 feet, ZONE). LUKA GOBERT MAKES IT! Assist: Russell Morant
Score: 45-61

[03:11] Team_019 possession (Score: 45-61)
Jalen Turner attempts a 3Pt. Contested by Paul Quickley (4.7 feet, ZONE). Jalen Turner misses. Rebound secured by Russell Morant.

[03:00] Team_070 possession (Score: 45-61)
FOUL! Shooting foul on Blake LaVine. Russell Morant to the line for 2 free throws. [BONUS: 5 team fouls] (Blake LaVine: 1 personal fouls)   FT 1/2: GOOD   FT 2/2: MISS Russell Morant makes 1/2 from the line. Rebound secured by Shai Ingram.
Score: 45-62

[02:44] Team_019 possession (Score: 45-62)
Gary Ginobili attempts a 3Pt. Contested by Paul Quickley (4.9 feet, MAN). Gary Ginobili misses. Rebound secured by Luka Gobert.

[02:31] Team_070 possession (Score: 45-62)
Allen Quickley makes the Dunk and draws the foul on Shai Ingram! And-1! Allen Quickley to the line for 1. [BONUS: 6 team fouls] (Shai Ingram: 3 personal fouls)   FT 1/1: GOOD Allen Quickley makes 1/1 from the line.
Score: 45-65

[02:14] Team_019 possession (Score: 45-65)
Blake LaVine attempts a 3Pt. Contested by Paul Quickley (4.6 feet, ZONE). Blake LaVine misses. Rebound secured by D'Angelo McGrady.

[01:57] Team_070 possession (Score: 45-65)
Luka Gobert drives to the basket... Luka Gobert commits a violation (traveling/carry)! TURNOVER! (dead ball)

[01:43] Team_019 possession (Score: 45-65)
Tim Jordan attempts a Layup. Contested by Luka Gobert (5.0 feet, ZONE). TIM JORDAN MAKES IT! Assist: Gary Ginobili
Score: 47-65

[01:31] Team_070 possession (Score: 47-65)
D'Angelo McGrady attempts a 3Pt. Contested by Blake LaVine (5.1 feet, MAN). D'Angelo McGrady misses. Rebound secured by Tim Jordan.

[01:15] Team_019 possession (Score: 47-65)
Gary Ginobili drives, picks up Russell Morant. Help arrives from Paul Quickley! Gary Ginobili attempts a Dunk. Contested by Paul Quickley (4.5 feet, ZONE). Gary Ginobili misses. Offensive rebound by Tim Jordan! Tim Jordan kicks it out.

[01:00] Team_019 possession (Score: 47-65)
FOUL! Shooting foul on Allen Quickley. Jalen Turner to the line for 2 free throws. [Team fouls: 4] (Allen Quickley: 2 personal fouls)   FT 1/2: GOOD   FT 2/2: GOOD Jalen Turner makes 2/2 from the line.
Score: 49-65

[00:47] Team_070 possession (Score: 49-65)
FOUL! Shooting foul on Shai Ingram. Luka Gobert to the line for 2 free throws. [BONUS: 7 team fouls] (Shai Ingram: 4 personal fouls)   FT 1/2: MISS   FT 2/2: GOOD Luka Gobert makes 1/2 from the line.
Score: 49-66

[00:34] Team_019 possession (Score: 49-66)
Blake LaVine attempts a Layup. Contested by Russell Morant (4.2 feet, ZONE). Blake LaVine misses. Rebound secured by D'Angelo McGrady.

[00:15] Team_070 possession (Score: 49-66)
Russell Morant makes the Midrange and draws the foul on Jalen Turner! And-1! Russell Morant to the line for 1. [BONUS: 8 team fouls] (Jalen Turner: 3 personal fouls)   FT 1/1: GOOD Russell Morant makes 1/1 from the line.
Score: 49-69

================================================================================
                              2ND QUARTER COMPLETE                              
================================================================================

2ND QUARTER SCORE: Team_019 20, Team_070 40

BOX SCORE:
================================================================================

Team_019
--------------------------------------------------------------------------------
Player                MIN  PTS  REB  AST  TO      FG   FG%      3P   3P%
--------------------------------------------------------------------------------
Tim Jordan             12    7    4    0   0   3/3   100.0     0/0   0.0
Jalen Turner           11    7    0    1   0   3/6    50.0     0/0   0.0
Shai Ingram            12    3    3    2   0   1/3    33.3     0/0   0.0
Gary Ginobili          11    2    0    1   0   1/4    25.0     0/0   0.0
Blake LaVine           12    0    0    0   0   0/3     0.0     0/0   0.0
Rudy Giddey            13    0    0    1   0   0/0     0.0     0/0   0.0

TEAM: FG: 8/19 (42.1%), 3PT: 1/10 (10.0%), REB: 7 (3 off, 4 def), AST: 5, TO: 4
TEAM FOULS: 8 [Team_070 in BONUS]


Team_070
--------------------------------------------------------------------------------
Player                MIN  PTS  REB  AST  TO      FG   FG%      3P   3P%
--------------------------------------------------------------------------------
Russell Morant         11   10    3    3   0   4/5    80.0     0/0   0.0
Luka Gobert            11    8    3    1   0   4/4   100.0     0/0   0.0
Paul Quickley          11    7    0    2   0   3/3   100.0     0/0   0.0
Allen Quickley         11    6    0    1   0   2/4    50.0     0/0   0.0
Khris Bryant           13    5    1    0   0   2/2   100.0     0/0   0.0
D'Angelo McGrady       11    3    4    2   0   1/3    33.3     0/0   0.0
LeBron Barnes          13    0    0    1   0   0/0     0.0     0/0   0.0
Jabari Paul            13    0    1    0   0   0/0     0.0     0/0   0.0

TEAM: FG: 16/21 (76.2%), 3PT: 5/8 (62.5%), REB: 12 (1 off, 11 def), AST: 10, TO: 2
TEAM FOULS: 4

================================================================================

================================================================================
                       3RD QUARTER - Team_019 vs Team_070                       
================================================================================

[12:00] Team_019 possession (Score: 49-69)
Brandon James attempts a 3Pt. Contested by Khris Bryant (2.4 feet, ZONE). Brandon James misses. Rebound secured by LeBron Barnes.

[11:48] Team_070 possession (Score: 49-69)
FOUL! Shooting foul on D'Angelo Randle. John Hyland to the line for 3 free throws. [Team fouls: 1] (D'Angelo Randle: 1 personal fouls)   FT 1/3: GOOD   FT 2/3: GOOD   FT 3/3: GOOD John Hyland makes 3/3 from the line.
Score: 49-72

[11:33] Team_019 possession (Score: 49-72)
D'Angelo Randle attempts a Midrange. Contested by John Hyland (4.7 feet, ZONE). D'Angelo Randle misses. Offensive rebound by DeMar James! DeMar James puts it back in!
Score: 51-72

[11:19] Team_070 possession (Score: 51-72)
LeBron Barnes attempts a Layup. Contested by Brandon James (5.5 feet, MAN). LEBRON BARNES MAKES IT!
Score: 51-74

[11:06] Team_019 possession (Score: 51-74)
FOUL! Offensive foul on Tobias Hyland! Khris Bryant drew the charge! [Team fouls: 2] (Tobias Hyland: 1 personal fouls) TURNOVER! (dead ball)

[10:53] Team_070 possession (Score: 51-74)
John Hyland attempts a Midrange. Contested by D'Angelo Randle (3.5 feet, MAN). John Hyland misses. Rebound secured by D'Angelo Randle.

[10:37] Team_019 possession (Score: 51-74)
Rudy Giddey drives to the basket... Rudy Giddey throws a bad pass! Stolen by Cole Gasol! TURNOVER! (live ball)

[10:24] Team_070 possession (Score: 51-74)
LeBron Barnes drives, Brandon James stays with him. LeBron Barnes attempts a Layup. Contested by Brandon James (5.5 feet, MAN). LEBRON BARNES MAKES IT! Assist: Khris Bryant
Score: 51-76

[10:07] Team_019 possession (Score: 51-76)
Rudy Giddey attempts a 3Pt. Contested by Cole Gasol (5.5 feet, MAN). Rudy Giddey misses. Offensive rebound by D'Angelo Randle! D'Angelo Randle's putback is no good. Rebound secured by LeBron Barnes.

[09:53] Team_070 possession (Score: 51-76)
John Hyland makes the Layup and draws the foul on D'Angelo Randle! And-1! John Hyland to the line for 1. [Team fouls: 3] (D'Angelo Randle: 2 personal fouls)   FT 1/1: GOOD John Hyland makes 1/1 from the line.
Score: 51-79

[09:38] Team_019 possession (Score: 51-79)
FOUL! Shooting foul on Khris Bryant. D'Angelo Randle to the line for 3 free throws. [Team fouls: 1] (Khris Bryant: 1 personal fouls)   FT 1/3: GOOD   FT 2/3: GOOD   FT 3/3: GOOD D'Angelo Randle makes 3/3 from the line.
Score: 54-79

[09:25] Team_070 possession (Score: 54-79)
Jabari Paul drives, DeMar James stays with him. Jabari Paul attempts a Layup. Contested by DeMar James (5.0 feet, MAN). JABARI PAUL MAKES IT!
Score: 54-81

[09:14] Team_019 possession (Score: 54-81)
Brandon James attempts a 3Pt. Contested by LeBron Barnes (3.5 feet, MAN). BRANDON JAMES MAKES IT! Assist: Tobias Hyland
Score: 57-81

[09:00] Team_070 possession (Score: 57-81)
John Hyland drives to the basket... FOUL! Offensive foul on John Hyland! D'Angelo Randle drew the charge! [Team fouls: 2] (John Hyland: 1 personal fouls) TURNOVER! (dead ball)

[08:45] Team_019 possession (Score: 57-81)
D'Angelo Randle attempts a 3Pt. Contested by Khris Bryant (2.7 feet, ZONE). D'ANGELO RANDLE MAKES IT! Assist: Tobias Hyland
Score: 60-81

[08:32] Team_070 possession (Score: 60-81)
Cole Gasol drives, Rudy Giddey stays with him. Cole Gasol attempts a Layup. Contested by Rudy Giddey (5.5 feet, MAN). COLE GASOL MAKES IT! Assist: LeBron Barnes
Score: 60-83

[08:19] Team_019 possession (Score: 60-83)
D'Angelo Randle attempts a 3Pt. Contested by Khris Bryant (2.7 feet, ZONE). D'Angelo Randle misses. Offensive rebound by D'Angelo Randle! D'Angelo Randle puts it back in!
Score: 62-83

[08:07] Team_070 possession (Score: 62-83)
LeBron Barnes attempts a 3Pt. Contested by Brandon James (5.5 feet, MAN). LeBron Barnes misses. Rebound secured by D'Angelo Randle.

[07:56] Team_019 possession (Score: 62-83)
Rudy Giddey drives, Khris Bryant stays with him. Rudy Giddey attempts a Dunk. Contested by Khris Bryant (2.6 feet, ZONE). Rudy Giddey misses. Rebound secured by Khris Bryant.

[07:41] Team_070 possession (Score: 62-83)
FOUL! Holding foul on D'Angelo Randle. [Team fouls: 4] No free throws, side out. (D'Angelo Randle: 3 personal fouls)

[07:27] Team_070 possession (Score: 62-83)
Khris Bryant attempts a 3Pt. Contested by Tobias Hyland (5.5 feet, MAN). Khris Bryant misses. Rebound secured by DeMar James.

[07:12] Team_019 possession (Score: 62-83)
Brandon James attempts a 3Pt. Contested by LeBron Barnes (3.5 feet, MAN). Brandon James misses. Offensive rebound by DeMar James! DeMar James puts it back in!
Score: 64-83

[06:57] Team_070 possession (Score: 64-83)
Khris Bryant commits a violation (traveling/carry)! TURNOVER! (dead ball)

[06:43] Team_019 possession (Score: 64-83)
DeMar James drives to the basket... DeMar James throws a bad pass! Stolen by Khris Bryant! TURNOVER! (live ball)

[06:30] Team_070 possession (Score: 64-83)
John Hyland attempts a Layup. BLOCKED BY TOBIAS HYLAND! Ball is loose! Rebound secured by Tobias Hyland.

[06:12] Team_019 possession (Score: 64-83)
FOUL! Shooting foul on Khris Bryant. Tobias Hyland to the line for 2 free throws. [Team fouls: 3] (Khris Bryant: 2 personal fouls)   FT 1/2: GOOD   FT 2/2: MISS Tobias Hyland makes 1/2 from the line. FOUL! Loose ball foul on Khris Bryant during the free throw rebound! [Team fouls: 4] No free throws, side out. (Khris Bryant: 3 personal fouls)
Score: 65-83

[05:57] Team_019 possession (Score: 65-83)
FOUL! Shooting foul on LeBron Barnes. D'Angelo Randle to the line for 2 free throws. [BONUS: 5 team fouls] (LeBron Barnes: 1 personal fouls)   FT 1/2: MISS   FT 2/2: GOOD D'Angelo Randle makes 1/2 from the line.
Score: 66-83

[05:47] Team_070 possession (Score: 66-83)
FOUL! Holding foul on DeMar James. [IN THE BONUS! 5 team fouls] Jabari Paul to the line for 2 free throws. (DeMar James: 1 personal fouls)   FT 1/2: GOOD   FT 2/2: GOOD Jabari Paul makes 2/2 from the line.
Score: 66-85

[05:33] Team_019 possession (Score: 66-85)
DeMar James attempts a Midrange. Contested by Khris Bryant (2.8 feet, MAN). DeMar James misses. Rebound secured by Khris Bryant.

[05:20] Team_070 possession (Score: 66-85)
John Hyland throws a bad pass out of bounds! TURNOVER! (dead ball)

[05:09] Team_019 possession (Score: 66-85)
D'Angelo Randle attempts a 3Pt. Contested by Khris Bryant (2.7 feet, ZONE). D'ANGELO RANDLE MAKES IT! Assist: Tobias Hyland
Score: 69-85

[04:55] Team_070 possession (Score: 69-85)
Cole Gasol attempts a 3Pt. Contested by D'Angelo Randle (3.9 feet, ZONE). Cole Gasol misses. Rebound secured by D'Angelo Randle.

[04:45] Team_019 possession (Score: 69-85)
Rudy Giddey attempts a 3Pt. Contested by Khris Bryant (2.7 feet, ZONE). RUDY GIDDEY MAKES IT! Assist: Brandon James
Score: 72-85

[04:33] Team_070 possession (Score: 72-85)
LeBron Barnes attempts a 3Pt. Contested by D'Angelo Randle (4.2 feet, ZONE). LeBron Barnes misses. FOUL! Loose ball foul on Tobias Hyland during the rebound battle. [IN THE BONUS! 6 team fouls] LeBron Barnes to the line for 2 free throws. (Tobias Hyland: 2 personal fouls)   FT 1/2: GOOD   FT 2/2: GOOD LeBron Barnes makes 2/2 from the line.
Score: 72-87

[04:17] Team_019 possession (Score: 72-87)
D'Angelo Randle attempts a Layup. Contested by John Hyland (4.8 feet, MAN). D'Angelo Randle misses. Rebound secured by Jabari Paul.

[04:02] Team_070 possession (Score: 72-87)
LeBron Barnes drives, Brandon James stays with him. LeBron Barnes attempts a Dunk. Contested by Brandon James (5.7 feet, MAN). LeBron Barnes misses. Offensive rebound by LeBron Barnes! LeBron Barnes kicks it out.

[03:44] Team_070 possession (Score: 72-87)
John Hyland attempts a Midrange. Contested by Tobias Hyland (5.8 feet, ZONE). John Hyland misses. Rebound secured by D'Angelo Randle.

[03:33] Team_019 possession (Score: 72-87)
FOUL! Holding foul on LeBron Barnes. [IN THE BONUS! 6 team fouls] Brandon James to the line for 2 free throws. (LeBron Barnes: 2 personal fouls)   FT 1/2: MISS   FT 2/2: MISS Brandon James makes 0/2 from the line. Rebound secured by Jabari Paul.

[03:17] Team_070 possession (Score: 72-87)
Khris Bryant drives to the basket... Khris Bryant throws a bad pass out of bounds! TURNOVER! (dead ball)

[03:17] Substitution (Team_019): D'Angelo Randle OUT → Blake LaVine IN (stamina_rule2)

[03:17] Substitution (Team_019): Tobias Hyland OUT → Shai Ingram IN (stamina_rule2)

[03:17] Substitution (Team_019): DeMar James OUT → Tim Jordan IN (stamina_rule2)

[03:04] Team_019 possession (Score: 72-87)
Brandon James attempts a Midrange. Contested by LeBron Barnes (3.8 feet, MAN). Brandon James misses. Rebound secured by Khris Bryant.

[02:50] Team_070 possession (Score: 72-87)
Jabari Paul loses control! Ball rolls out of bounds! TURNOVER! (dead ball)

[02:50] Substitution (Team_019): Rudy Giddey OUT → Gary Ginobili IN (stamina_rule2)

[02:50] Substitution (Team_019): Brandon James OUT → Jalen Turner IN (stamina_rule2)

[02:50] Substitution (Team_070): LeBron Barnes OUT → Allen Quickley IN (stamina_rule2)

[02:50] Substitution (Team_070): Khris Bryant OUT → Luka Gobert IN (stamina_rule2)

[02:50] Substitution (Team_070): Jabari Paul OUT → Russell Morant IN (stamina_rule2)

[02:33] Team_019 possession (Score: 72-87)
Blake LaVine drives, picks up Russell Morant. Help arrives from Allen Quickley! Blake LaVine attempts a Layup. Contested by Allen Quickley (3.9 feet, ZONE). BLAKE LAVINE MAKES IT!
Score: 74-87

[02:23] Team_070 possession (Score: 74-87)
Cole Gasol attempts a Midrange. Contested by Jalen Turner (4.1 feet, ZONE). COLE GASOL MAKES IT!
Score: 74-89

[02:11] Team_019 possession (Score: 74-89)
Gary Ginobili attempts a Midrange. Wide open! Cole Gasol is 6.0 feet away. [MAN] GARY GINOBILI MAKES IT! Assist: Jalen Turner
Score: 76-89

[02:02] Team_070 possession (Score: 76-89)
Cole Gasol attempts a Layup. Contested by Gary Ginobili (6.0 feet, MAN). COLE GASOL MAKES IT!
Score: 76-91

[01:43] Team_019 possession (Score: 76-91)
Gary Ginobili drives to the basket... Gary Ginobili loses control! Ball rolls out of bounds! TURNOVER! (dead ball)

[01:43] Substitution (Team_070): Cole Gasol OUT → Paul Quickley IN (stamina_rule2)

[01:43] Substitution (Team_070): John Hyland OUT → D'Angelo McGrady IN (stamina_rule2)

[01:26] Team_070 possession (Score: 76-91)
Allen Quickley attempts a 3Pt. Contested by Blake LaVine (4.8 feet, ZONE). Allen Quickley misses. Rebound secured by Tim Jordan.

[01:08] Team_019 possession (Score: 76-91)
Gary Ginobili attempts a 3Pt. Contested by Paul Quickley (4.8 feet, MAN). Gary Ginobili misses. Rebound secured by Luka Gobert.

[00:54] Team_070 possession (Score: 76-91)
FOUL! Shooting foul on Shai Ingram. Russell Morant to the line for 2 free throws. [BONUS: 7 team fouls] (Shai Ingram: 1 personal fouls)   FT 1/2: MISS   FT 2/2: GOOD Russell Morant makes 1/2 from the line.
Score: 76-92

[00:39] Team_019 possession (Score: 76-92)
Tim Jordan attempts a Midrange. Contested by Luka Gobert (4.8 feet, ZONE). TIM JORDAN MAKES IT!
Score: 78-92

[00:20] Team_070 possession (Score: 78-92)
Paul Quickley drives to the basket... Paul Quickley commits a violation (traveling/carry)! TURNOVER! (dead ball)

[00:08] Team_019 possession (Score: 78-92)
FOUL! Shooting foul on Russell Morant. Shai Ingram to the line for 2 free throws. [BONUS: 7 team fouls] (Russell Morant: 1 personal fouls)   FT 1/2: GOOD   FT 2/2: GOOD Shai Ingram makes 2/2 from the line.
Score: 80-92

================================================================================
                              3RD QUARTER COMPLETE                              
================================================================================

3RD QUARTER SCORE: Team_019 31, Team_070 23

BOX SCORE:
================================================================================

Team_019
--------------------------------------------------------------------------------
Player                MIN  PTS  REB  AST  TO      FG   FG%      3P   3P%
--------------------------------------------------------------------------------
D'Angelo Randle        21   12    5    0   0   5/6    83.3     0/0   0.0
DeMar James            21    4    4    0   0   2/3    66.7     0/0   0.0
Brandon James          23    3    0    1   0   1/3    33.3     0/0   0.0
Rudy Giddey            23    3    0    0   0   1/3    33.3     0/0   0.0
Blake LaVine           15    2    0    0   0   1/1   100.0     0/0   0.0
Gary Ginobili          13    2    0    0   0   1/2    50.0     0/0   0.0
Tim Jordan             15    2    1    0   0   1/1   100.0     0/0   0.0
Shai Ingram            15    2    0    0   0   1/1   100.0     0/0   0.0
Tobias Hyland          21    0    1    3   0   0/0     0.0     0/0   0.0
Jalen Turner           13    0    0    1   0   0/0     0.0     0/0   0.0

TEAM: FG: 13/21 (61.9%), 3PT: 7/10 (70.0%), REB: 12 (5 off, 7 def), AST: 5, TO: 4
TEAM FOULS: 7 [Team_070 in BONUS]


Team_070
--------------------------------------------------------------------------------
Player                MIN  PTS  REB  AST  TO      FG   FG%      3P   3P%
--------------------------------------------------------------------------------
LeBron Barnes          23    6    3    1   0   3/4    75.0     0/0   0.0
John Hyland            24    6    0    0   0   2/5    40.0     0/0   0.0
Cole Gasol             24    6    0    0   0   3/4    75.0     0/0   0.0
Jabari Paul            23    4    2    0   0   2/2   100.0     0/0   0.0
Russell Morant         13    1    0    0   0   1/1   100.0     0/0   0.0
Khris Bryant           23    0    3    1   0   0/1     0.0     0/0   0.0
Allen Quickley         13    0    0    0   0   0/1     0.0     0/0   0.0
Luka Gobert            13    0    1    0   0   0/0     0.0     0/0   0.0

TEAM: FG: 11/18 (61.1%), 3PT: 2/6 (33.3%), REB: 8 (1 off, 7 def), AST: 2, TO: 6
TEAM FOULS: 7 [Team_019 in BONUS]

================================================================================

================================================================================
                       4TH QUARTER - Team_019 vs Team_070                       
================================================================================

[12:00] Substitution (Team_019): Rudy Giddey OUT (stamina: 80) → Gary Ginobili IN (comeback_detected)

[12:00] Substitution (Team_070): Cole Gasol OUT (stamina: 76) → Paul Quickley IN (comeback_detected)

[12:00] Team_019 possession (Score: 80-92)
Brandon James attempts a 3Pt. Contested by Khris Bryant (2.4 feet, ZONE). Brandon James misses. Rebound secured by LeBron Barnes.

[11:43] Team_070 possession (Score: 80-92)
FOUL! Holding foul on Gary Ginobili. [Team fouls: 1] No free throws, side out. (Gary Ginobili: 1 personal fouls)

[11:27] Team_070 possession (Score: 80-92)
FOUL! Holding foul on D'Angelo Randle. [Team fouls: 2] No free throws, side out. (D'Angelo Randle: 1 personal fouls)

[11:12] Team_070 possession (Score: 80-92)
John Hyland attempts a 3Pt. Contested by D'Angelo Randle (3.6 feet, MAN). JOHN HYLAND MAKES IT! Assist: Jabari Paul
Score: 80-95

[11:00] Team_019 possession (Score: 80-95)
D'Angelo Randle drives to the basket... D'Angelo Randle throws a bad pass! Stolen by John Hyland! TURNOVER! (live ball)

[10:44] Team_070 possession (Score: 80-95)
John Hyland attempts a Midrange. Contested by Brandon James (5.1 feet, ZONE). John Hyland misses. Rebound secured by Tobias Hyland.

[10:29] Team_019 possession (Score: 80-95)
Brandon James makes the 3Pt and draws the foul on Khris Bryant! And-1! Brandon James to the line for 1. [Team fouls: 1] (Khris Bryant: 1 personal fouls)   FT 1/1: GOOD Brandon James makes 1/1 from the line.
Score: 84-95

[10:18] Team_070 possession (Score: 84-95)
Khris Bryant attempts a Midrange. Contested by Gary Ginobili (5.7 feet, ZONE). KHRIS BRYANT MAKES IT! Assist: John Hyland
Score: 84-97

[10:01] Team_019 possession (Score: 84-97)
DeMar James makes the Layup and draws the foul on Khris Bryant! And-1! DeMar James to the line for 1. [Team fouls: 2] (Khris Bryant: 2 personal fouls)   FT 1/1: GOOD DeMar James makes 1/1 from the line.
Score: 87-97

[09:48] Team_070 possession (Score: 87-97)
John Hyland makes the Layup and draws the foul on Brandon James! And-1! John Hyland to the line for 1. [Team fouls: 3] (Brandon James: 1 personal fouls)   FT 1/1: GOOD John Hyland makes 1/1 from the line.
Score: 87-100

[09:34] Team_019 possession (Score: 87-100)
DeMar James attempts a 3Pt. Contested by Khris Bryant (3.0 feet, MAN). DeMar James misses. Rebound secured by Khris Bryant.

[09:20] Team_070 possession (Score: 87-100)
Paul Quickley loses the ball! Stripped by Gary Ginobili! TURNOVER! (live ball)

[09:09] Team_019 possession (Score: 87-100)
FOUL! Holding foul on Khris Bryant. [Team fouls: 3] No free throws, side out. (Khris Bryant: 3 personal fouls)

[08:59] Team_019 possession (Score: 87-100)
DeMar James loses the ball! Stripped by Khris Bryant! TURNOVER! (live ball)

[08:42] Team_070 possession (Score: 87-100)
Paul Quickley drives, DeMar James stays with him. Paul Quickley attempts a Layup. Contested by DeMar James (4.4 feet, ZONE). Paul Quickley misses. Rebound secured by DeMar James.

[08:30] Team_019 possession (Score: 87-100)
D'Angelo Randle attempts a 3Pt. Contested by Khris Bryant (3.0 feet, ZONE). D'Angelo Randle misses. Rebound secured by Khris Bryant.

[08:13] Team_070 possession (Score: 87-100)
John Hyland attempts a Midrange. Contested by D'Angelo Randle (3.9 feet, MAN). John Hyland misses. FOUL! Loose ball foul on D'Angelo Randle during the rebound battle. [Team fouls: 4] No free throws, side out. (D'Angelo Randle: 2 personal fouls)

[07:55] Team_070 possession (Score: 87-100)
Khris Bryant attempts a 3Pt. Contested by D'Angelo Randle (3.9 feet, ZONE). Khris Bryant misses. Rebound secured by DeMar James.

[07:39] Team_019 possession (Score: 87-100)
FOUL! Shooting foul on Khris Bryant. Tobias Hyland to the line for 2 free throws. [Team fouls: 4] (Khris Bryant: 4 personal fouls)   FT 1/2: MISS   FT 2/2: GOOD Tobias Hyland makes 1/2 from the line.
Score: 88-100

[07:23] Team_070 possession (Score: 88-100)
John Hyland attempts a Midrange. Contested by Tobias Hyland (5.9 feet, ZONE). John Hyland misses. Rebound secured by DeMar James.

[07:06] Team_019 possession (Score: 88-100)
Gary Ginobili attempts a Midrange. Contested by Paul Quickley (4.8 feet, MAN). GARY GINOBILI MAKES IT! Assist: DeMar James
Score: 90-100

[06:51] Team_070 possession (Score: 90-100)
Khris Bryant attempts a 3Pt. Contested by D'Angelo Randle (4.0 feet, ZONE). Khris Bryant misses. Rebound secured by Tobias Hyland.

[06:36] Team_019 possession (Score: 90-100)
Tobias Hyland attempts a Midrange. Contested by LeBron Barnes (4.1 feet, ZONE). TOBIAS HYLAND MAKES IT!
Score: 92-100

[06:21] Team_070 possession (Score: 92-100)
LeBron Barnes drives to the basket... LeBron Barnes throws a bad pass! Stolen by DeMar James! TURNOVER! (live ball)

[06:06] Team_019 possession (Score: 92-100)
D'Angelo Randle drives, picks up Jabari Paul. Help arrives from LeBron Barnes! D'Angelo Randle attempts a Layup. Contested by LeBron Barnes (5.1 feet, ZONE). D'ANGELO RANDLE MAKES IT!
Score: 94-100

[05:47] Team_070 possession (Score: 94-100)
John Hyland attempts a Midrange. Contested by D'Angelo Randle (4.2 feet, MAN). John Hyland misses. Rebound secured by Tobias Hyland.

[05:34] Team_019 possession (Score: 94-100)
D'Angelo Randle attempts a 3Pt. Contested by LeBron Barnes (4.4 feet, ZONE). D'ANGELO RANDLE MAKES IT! Assist: Brandon James
Score: 97-100

[05:22] Team_070 possession (Score: 97-100)
FOUL! Shooting foul on Brandon James. LeBron Barnes to the line for 2 free throws. [BONUS: 5 team fouls] (Brandon James: 2 personal fouls)   FT 1/2: MISS   FT 2/2: GOOD LeBron Barnes makes 1/2 from the line.
Score: 97-101

[05:07] Team_019 possession (Score: 97-101)
DeMar James attempts a Layup. BLOCKED BY LEBRON BARNES! Ball deflects out of bounds off DeMar James.

[04:51] Team_070 possession (Score: 97-101)
Paul Quickley drives, picks up DeMar James. Help arrives from Brandon James! Paul Quickley attempts a Layup. Contested by Brandon James (4.9 feet, ZONE). Paul Quickley misses. Rebound secured by D'Angelo Randle.

[04:34] Team_019 possession (Score: 97-101)
Brandon James attempts a Layup. Contested by LeBron Barnes (4.4 feet, MAN). Brandon James misses. Rebound secured by Khris Bryant.

[04:16] Team_070 possession (Score: 97-101)
Khris Bryant drives and kicks out. Jabari Paul attempts a 3Pt. Contested by DeMar James (5.1 feet, MAN). Jabari Paul misses. Offensive rebound by Khris Bryant! Khris Bryant kicks it out.

[04:05] Team_070 possession (Score: 97-101)
Khris Bryant attempts a Midrange. Wide open! Tobias Hyland is 6.2 feet away. [ZONE] Khris Bryant misses. Rebound secured by Tobias Hyland.

[03:47] Team_019 possession (Score: 97-101)
D'Angelo Randle loses control! Ball rolls out of bounds! TURNOVER! (dead ball)

[03:47] Substitution (Team_019): Brandon James OUT → Jalen Turner IN (stamina_rule2)

[03:47] Substitution (Team_019): D'Angelo Randle OUT → Blake LaVine IN (stamina_rule2)

[03:47] Substitution (Team_019): Tobias Hyland OUT → Shai Ingram IN (stamina_rule2)

[03:47] Substitution (Team_019): DeMar James OUT → Tim Jordan IN (stamina_rule2)

[03:47] Substitution (Team_070): LeBron Barnes OUT → Allen Quickley IN (stamina_rule2)

[03:47] Substitution (Team_070): John Hyland OUT → D'Angelo McGrady IN (stamina_rule2)

[03:47] Substitution (Team_070): Khris Bryant OUT → Luka Gobert IN (stamina_rule2)

[03:47] Substitution (Team_070): Jabari Paul OUT → Russell Morant IN (stamina_rule2)

[03:34] Team_070 possession (Score: 97-101)
Paul Quickley attempts a Midrange. Contested by Blake LaVine (4.6 feet, ZONE). Paul Quickley misses. Offensive rebound by Russell Morant! Russell Morant's putback is no good. Rebound secured by Shai Ingram.

[03:19] Team_019 possession (Score: 97-101)
Tim Jordan makes the Layup and draws the foul on Russell Morant! And-1! Tim Jordan to the line for 1. [BONUS: 5 team fouls] (Russell Morant: 1 personal fouls)   FT 1/1: GOOD Tim Jordan makes 1/1 from the line.
Score: 100-101

[03:02] Team_070 possession (Score: 100-101)
Paul Quickley attempts a 3Pt. Wide open! Gary Ginobili is 6.1 feet away. [MAN] Paul Quickley misses. Offensive rebound by Luka Gobert! Luka Gobert kicks it out.

[02:47] Team_070 possession (Score: 100-101)
D'Angelo McGrady drives, picks up Blake LaVine. Help arrives from Jalen Turner! D'Angelo McGrady attempts a Dunk. Contested by Jalen Turner (4.8 feet, MAN). D'ANGELO MCGRADY MAKES IT! Assist: Allen Quickley
Score: 100-103

[02:36] Team_019 possession (Score: 100-103)
Shai Ingram attempts a 3Pt. Contested by Luka Gobert (4.7 feet, MAN). SHAI INGRAM MAKES IT! Assist: Blake LaVine
Score: 103-103

[02:21] Team_070 possession (Score: 103-103)
Luka Gobert attempts a 3Pt. Contested by Blake LaVine (4.8 feet, ZONE). Luka Gobert misses. Rebound secured by Tim Jordan.

[02:06] Team_019 possession (Score: 103-103)
Jalen Turner makes the Layup and draws the foul on Russell Morant! And-1! Jalen Turner to the line for 1. [BONUS: 6 team fouls] (Russell Morant: 2 personal fouls)   FT 1/1: GOOD Jalen Turner makes 1/1 from the line.
Score: 106-103

[01:50] Team_070 possession (Score: 106-103)
FOUL! Reach-in foul on Jalen Turner during the drive. [IN THE BONUS! 6 team fouls] Allen Quickley to the line for 2 free throws. (Jalen Turner: 1 personal fouls)   FT 1/2: GOOD   FT 2/2: GOOD Allen Quickley makes 2/2 from the line.
Score: 106-105

[01:38] Team_019 possession (Score: 106-105)
Gary Ginobili attempts a 3Pt. Contested by Luka Gobert (5.1 feet, ZONE). Gary Ginobili misses. Rebound secured by Luka Gobert.

[01:24] Team_070 possession (Score: 106-105)
Luka Gobert drives, Shai Ingram stays with him. Luka Gobert attempts a Layup. Contested by Shai Ingram (4.6 feet, ZONE). LUKA GOBERT MAKES IT!
Score: 106-107

[01:10] Team_019 possession (Score: 106-107)
Gary Ginobili attempts a Layup. Contested by Luka Gobert (5.1 feet, ZONE). GARY GINOBILI MAKES IT!
Score: 108-107

[00:57] Team_070 possession (Score: 108-107)
FOUL! Shooting foul on Blake LaVine. D'Angelo McGrady to the line for 2 free throws. [BONUS: 7 team fouls] (Blake LaVine: 1 personal fouls)   FT 1/2: MISS   FT 2/2: GOOD D'Angelo McGrady makes 1/2 from the line.
Score: 108-108

[00:39] Team_019 possession (Score: 108-108)
Shai Ingram drives, Luka Gobert stays with him. Shai Ingram attempts a Layup. Contested by Luka Gobert (4.7 feet, MAN). SHAI INGRAM MAKES IT! Assist: Blake LaVine
Score: 110-108

[00:23] Team_070 possession (Score: 110-108)
Allen Quickley drives to the basket... Allen Quickley loses control! Ball rolls out of bounds! TURNOVER! (dead ball)

[00:23] Substitution (Team_019): Gary Ginobili OUT → Rudy Giddey IN (starter_return_rule1)

[00:23] Substitution (Team_070): Paul Quickley OUT → Cole Gasol IN (starter_return_rule1)

[00:12] Team_019 possession (Score: 110-108)
FOUL! Holding foul on D'Angelo McGrady. [IN THE BONUS! 7 team fouls] Blake LaVine to the line for 2 free throws. (D'Angelo McGrady: 1 personal fouls)   FT 1/2: GOOD   FT 2/2: GOOD Blake LaVine makes 2/2 from the line.
Score: 112-108

================================================================================
                              4TH QUARTER COMPLETE                              
================================================================================

4TH QUARTER SCORE: Team_019 32, Team_070 16

BOX SCORE:
================================================================================

Team_019
--------------------------------------------------------------------------------
Player                MIN  PTS  REB  AST  TO      FG   FG%      3P   3P%
--------------------------------------------------------------------------------
D'Angelo Randle        29    5    1    0   0   2/3    66.7     0/0   0.0
Shai Ingram            19    5    1    0   0   2/2   100.0     0/0   0.0
Brandon James          31    4    0    1   0   1/3    33.3     0/0   0.0
Gary Ginobili          25    4    0    0   0   2/3    66.7     0/0   0.0
Tobias Hyland          29    3    4    0   0   2/2   100.0     0/0   0.0
DeMar James            29    3    3    1   0   1/3    33.3     0/0   0.0
Tim Jordan             19    3    1    0   0   1/1   100.0     0/0   0.0
Jalen Turner           17    3    0    0   0   1/1   100.0     0/0   0.0
Blake LaVine           19    2    0    2   0   1/1   100.0     0/0   0.0

TEAM: FG: 13/19 (68.4%), 3PT: 3/7 (42.9%), REB: 9 (0 off, 9 def), AST: 4, TO: 3
TEAM FOULS: 7 [Team_070 in BONUS]


Team_070
--------------------------------------------------------------------------------
Player                MIN  PTS  REB  AST  TO      FG   FG%      3P   3P%
--------------------------------------------------------------------------------
John Hyland            32    6    0    1   0   2/5    40.0     0/0   0.0
D'Angelo McGrady       16    3    0    0   0   2/2   100.0     0/0   0.0
Khris Bryant           31    2    4    0   0   1/4    25.0     0/0   0.0
Luka Gobert            17    2    2    0   0   1/2    50.0     0/0   0.0
Allen Quickley         17    2    0    1   0   1/1   100.0     0/0   0.0
LeBron Barnes          31    1    2    0   0   1/1   100.0     0/0   0.0
Jabari Paul            31    0    0    1   0   0/0     0.0     0/0   0.0
Paul Quickley          24    0    0    0   0   0/3     0.0     0/0   0.0

TEAM: FG: 8/18 (44.4%), 3PT: 1/4 (25.0%), REB: 9 (4 off, 5 def), AST: 3, TO: 3
TEAM FOULS: 7 [Team_019 in BONUS]

================================================================================

================================================================================
                               FULL GAME COMPLETE                               
================================================================================

FINAL SCORE: Team_019 112, Team_070 108

SCORING BY QUARTER:
--------------------------------------------------------------------------------
Team                     Q1     Q2     Q3     Q4    FINAL
--------------------------------------------------------------------------------
Team_019                 29     20     31     32      112
Team_070                 29     40     23     16      108
--------------------------------------------------------------------------------

FULL GAME BOX SCORE:
================================================================================

Team_019
--------------------------------------------------------------------------------
Player                MIN  PTS  REB  AST  TO      FG   FG%      3P   3P%      FT STL BLK
--------------------------------------------------------------------------------
Brandon James          31    9    0    3   0   5/10   50.0   3/6    50.0   1/3     0   0
D'Angelo Randle        29   24   13    0   3  11/16   68.8   6/9    66.7   4/5     0   0
Tobias Hyland          29    5    5    4   2   3/4    75.0   1/1   100.0   2/4     0   1
DeMar James            29   15   15    2   1   4/8    50.0   0/1     0.0   1/1     2   0
Gary Ginobili          25    8    0    1   0   5/10   50.0   0/5     0.0   0/0     1   0
Rudy Giddey            23   12    0    4   2   5/8    62.5   2/3    66.7   2/4     0   0
Blake LaVine           19    4    0    2   0   1/5    20.0   0/2     0.0   2/4     0   0
Shai Ingram            19   10    4    2   3   4/6    66.7   2/3    66.7   2/2     1   1
Tim Jordan             19   12    6    0   1   4/4   100.0   0/0     0.0   1/1     0   0
Jalen Turner           17   10    0    2   0   4/7    57.1   0/3     0.0   7/9     0   0

TEAM: FG: 47/80 (58.8%), 3PT: 14/33 (42.4%), REB: 42 (14 off, 28 def), AST: 20, TO: 12


Team_070
--------------------------------------------------------------------------------
Player                MIN  PTS  REB  AST  TO      FG   FG%      3P   3P%      FT STL BLK
--------------------------------------------------------------------------------
John Hyland            32   19    0    1   2   7/16   43.8   2/3    66.7   6/7     1   0
LeBron Barnes          31   13    9    3   1   6/8    75.0   1/2    50.0   5/6     0   1
Khris Bryant           31   13   10    2   2   3/8    37.5   1/5    20.0   4/4     3   0
Jabari Paul            31    7    6    2   3   4/4   100.0   0/0     0.0   3/4     0   0
Paul Quickley          24   10    0    2   2   5/8    62.5   2/2   100.0   0/0     0   0
Cole Gasol             24    9    0    1   1   5/10   50.0   1/4    25.0   0/0     1   0
Allen Quickley         17    8    0    2   0   3/6    50.0   1/3    33.3   3/3     0   0
Luka Gobert            17   10    6    1   0   5/6    83.3   2/3    66.7   2/4     1   0
Russell Morant         17   11    4    3   2   4/5    80.0   0/0     0.0   4/6     0   0
D'Angelo McGrady       16    6    4    2   0   3/5    60.0   0/2     0.0   1/2     0   0

TEAM: FG: 46/77 (59.7%), 3PT: 10/24 (41.7%), REB: 40 (9 off, 31 def), AST: 19, TO: 13

================================================================================
