================================================================================
                        FULL GAME - Team_096 vs Team_022                        
================================================================================

================================================================================
                       1ST QUARTER - Team_096 vs Team_022                       
================================================================================

[12:00] Team_096 possession (Score: 0-0)
Cole Griffin attempts a 3Pt. Contested by Michael Ginobili (3.8 feet, ZONE). Cole Griffin misses. Rebound secured by Myles Anthony.

[11:45] Team_022 possession (Score: 0-0)
Michael Ginobili drives, Lamelo Quickley stays with him. Michael Ginobili attempts a Dunk. Contested by Lamelo Quickley (4.0 feet, MAN). MICHAEL GINOBILI MAKES IT! Assist: Dirk Markkanen
Score: 0-2

[11:30] Team_096 possession (Score: 0-2)
FOUL! Holding foul on Malcolm Allen. [Team fouls: 1] No free throws, side out. (Malcolm Allen: 1 personal fouls)

[11:14] Team_096 possession (Score: 0-2)
Terry Mobley makes the Layup and draws the foul on Malcolm Allen! And-1! Terry Mobley to the line for 1. [Team fouls: 2] (Malcolm Allen: 2 personal fouls)   FT 1/1: MISS Terry Mobley makes 0/1 from the line. Rebound secured by Michael Ginobili.
Score: 2-2

[10:56] Team_022 possession (Score: 2-2)
Lamelo Dosunmu attempts a 3Pt. Contested by Cole Griffin (3.8 feet, ZONE). Lamelo Dosunmu misses. Rebound secured by Cole Griffin.

[10:40] Team_096 possession (Score: 2-2)
Cole Griffin attempts a 3Pt. Contested by Michael Ginobili (3.8 feet, ZONE). Cole Griffin misses. Rebound secured by Myles Anthony.

[10:24] Team_022 possession (Score: 2-2)
Michael Ginobili makes the Layup and draws the foul on Kyrie Adebayo! And-1! Michael Ginobili to the line for 1. [Team fouls: 1] (Kyrie Adebayo: 1 personal fouls)   FT 1/1: GOOD Michael Ginobili makes 1/1 from the line.
Score: 2-5

[10:11] Team_096 possession (Score: 2-5)
Scottie Herro attempts a 3Pt. Contested by Lamelo Dosunmu (4.7 feet, MAN). SCOTTIE HERRO MAKES IT! Assist: Kyrie Adebayo
Score: 5-5

[09:57] Team_022 possession (Score: 5-5)
Michael Ginobili attempts a Midrange. Contested by Lamelo Quickley (4.0 feet, MAN). Michael Ginobili misses. Rebound secured by Scottie Herro.

[09:47] Team_096 possession (Score: 5-5)
Cole Griffin drives and kicks out. FOUL! Shooting foul on Michael Ginobili. Terry Mobley to the line for 3 free throws. [Team fouls: 3] (Michael Ginobili: 1 personal fouls)   FT 1/3: GOOD   FT 2/3: GOOD   FT 3/3: GOOD Terry Mobley makes 3/3 from the line.
Score: 8-5

[09:35] Team_022 possession (Score: 8-5)
Malcolm Allen attempts a 3Pt. Contested by Terry Mobley (5.2 feet, MAN). Malcolm Allen misses. Rebound secured by Scottie Herro.

[09:24] Team_096 possession (Score: 8-5)
Terry Mobley attempts a Midrange. Contested by Myles Anthony (4.6 feet, ZONE). TERRY MOBLEY MAKES IT!
Score: 10-5

[09:11] Team_022 possession (Score: 10-5)
Dirk Markkanen drives, Kyrie Adebayo stays with him. Dirk Markkanen attempts a Layup. Contested by Kyrie Adebayo (4.5 feet, MAN). DIRK MARKKANEN MAKES IT! Assist: Michael Ginobili
Score: 10-7

[09:00] Team_096 possession (Score: 10-7)
Kyrie Adebayo attempts a 3Pt. Contested by Michael Ginobili (4.2 feet, ZONE). Kyrie Adebayo misses. Rebound secured by Michael Ginobili.

[08:48] Team_022 possession (Score: 10-7)
FOUL! Shooting foul on Scottie Herro. Lamelo Dosunmu to the line for 2 free throws. [Team fouls: 2] (Scottie Herro: 1 personal fouls)   FT 1/2: MISS   FT 2/2: GOOD Lamelo Dosunmu makes 1/2 from the line.
Score: 10-8

[08:34] Team_096 possession (Score: 10-8)
Kyrie Adebayo attempts a 3Pt. Contested by Dirk Markkanen (5.2 feet, MAN). Kyrie Adebayo misses. Offensive rebound by Kyrie Adebayo! Kyrie Adebayo's putback is no good. Rebound secured by Michael Ginobili.

[08:14] Team_022 possession (Score: 10-8)
FOUL! Holding foul on Kyrie Adebayo. [Team fouls: 3] No free throws, side out. (Kyrie Adebayo: 2 personal fouls)

[07:55] Team_022 possession (Score: 10-8)
Lamelo Dosunmu drives to the basket... Lamelo Dosunmu throws a bad pass out of bounds! TURNOVER! (dead ball)

[07:37] Team_096 possession (Score: 10-8)
Cole Griffin attempts a 3Pt. Contested by Michael Ginobili (3.8 feet, ZONE). COLE GRIFFIN MAKES IT! Assist: Terry Mobley
Score: 13-8

[07:27] Team_022 possession (Score: 13-8)
FOUL! Shooting foul on Lamelo Quickley. Lamelo Dosunmu to the line for 2 free throws. [Team fouls: 4] (Lamelo Quickley: 1 personal fouls)   FT 1/2: GOOD   FT 2/2: GOOD Lamelo Dosunmu makes 2/2 from the line.
Score: 13-10

[07:13] Team_096 possession (Score: 13-10)
Lamelo Quickley drives and kicks out. Kyrie Adebayo attempts a 3Pt. Contested by Michael Ginobili (3.5 feet, ZONE). Kyrie Adebayo misses. Rebound secured by Myles Anthony.

[06:55] Team_022 possession (Score: 13-10)
Dirk Markkanen throws a bad pass out of bounds! TURNOVER! (dead ball)

[06:41] Team_096 possession (Score: 13-10)
Cole Griffin attempts a 3Pt. Contested by Myles Anthony (4.7 feet, MAN). Cole Griffin misses. Rebound secured by Myles Anthony.

[06:29] Team_022 possession (Score: 13-10)
Michael Ginobili attempts a Midrange. Contested by Lamelo Quickley (4.0 feet, MAN). Michael Ginobili misses. Rebound secured by Kyrie Adebayo.

[06:13] Team_096 possession (Score: 13-10)
Terry Mobley attempts a 3Pt. Contested by Michael Ginobili (3.6 feet, ZONE). TERRY MOBLEY MAKES IT! Assist: Cole Griffin
Score: 16-10

[06:00] Team_022 possession (Score: 16-10)
Lamelo Dosunmu attempts a Midrange. Contested by Cole Griffin (3.8 feet, ZONE). Lamelo Dosunmu misses. Offensive rebound by Dirk Markkanen! Dirk Markkanen puts it back in!
Score: 16-12

[05:48] Team_096 possession (Score: 16-12)
Lamelo Quickley attempts a Midrange. Contested by Michael Ginobili (3.0 feet, MAN). LAMELO QUICKLEY MAKES IT! Assist: Terry Mobley
Score: 18-12

[05:34] Team_022 possession (Score: 18-12)
Myles Anthony throws a bad pass! Stolen by Cole Griffin! TURNOVER! (live ball)

[05:21] Team_096 possession (Score: 18-12)
Terry Mobley attempts a 3Pt. Contested by Michael Ginobili (3.6 feet, ZONE). Terry Mobley misses. Rebound secured by Myles Anthony.

[05:03] Team_022 possession (Score: 18-12)
Michael Ginobili loses the ball! Stripped by Lamelo Quickley! TURNOVER! (live ball)

[04:51] Team_096 possession (Score: 18-12)
Scottie Herro drives, Dirk Markkanen stays with him. Scottie Herro attempts a Layup. Contested by Dirk Markkanen (4.8 feet, ZONE). SCOTTIE HERRO MAKES IT! Assist: Terry Mobley
Score: 20-12

[04:34] Team_022 possession (Score: 20-12)
Michael Ginobili drives, picks up Lamelo Quickley. Help arrives from Cole Griffin! Michael Ginobili attempts a Dunk. Contested by Cole Griffin (4.1 feet, MAN). MICHAEL GINOBILI MAKES IT! Assist: Myles Anthony
Score: 20-14

[04:22] Team_096 possession (Score: 20-14)
Scottie Herro drives to the basket... Scottie Herro throws a bad pass out of bounds! TURNOVER! (dead ball)

[04:06] Team_022 possession (Score: 20-14)
Malcolm Allen attempts a 3Pt. Contested by Terry Mobley (5.3 feet, MAN). Malcolm Allen misses. Rebound secured by Kyrie Adebayo.

[03:47] Team_096 possession (Score: 20-14)
Scottie Herro attempts a Midrange. Contested by Lamelo Dosunmu (4.9 feet, MAN). Scottie Herro misses. Offensive rebound by Kyrie Adebayo! Kyrie Adebayo puts it back in!
Score: 22-14

[03:36] Team_022 possession (Score: 22-14)
Malcolm Allen attempts a Layup. Contested by Terry Mobley (5.4 feet, MAN). MALCOLM ALLEN MAKES IT! Assist: Lamelo Dosunmu
Score: 22-16

[03:20] Team_096 possession (Score: 22-16)
Terry Mobley attempts a 3Pt. Contested by Michael Ginobili (3.8 feet, ZONE). Terry Mobley misses. Rebound secured by Myles Anthony.

[03:08] Team_022 possession (Score: 22-16)
Myles Anthony attempts a Midrange. Contested by Cole Griffin (3.6 feet, MAN). MYLES ANTHONY MAKES IT! Assist: Michael Ginobili
Score: 22-18

[02:56] Team_096 possession (Score: 22-18)
FOUL! Shooting foul on Dirk Markkanen. Kyrie Adebayo to the line for 2 free throws. [Team fouls: 4] (Dirk Markkanen: 1 personal fouls)   FT 1/2: GOOD   FT 2/2: MISS Kyrie Adebayo makes 1/2 from the line. Rebound secured by Michael Ginobili.
Score: 23-18

[02:46] Team_022 possession (Score: 23-18)
Michael Ginobili attempts a 3Pt. Contested by Cole Griffin (3.6 feet, ZONE). MICHAEL GINOBILI MAKES IT! Assist: Malcolm Allen
Score: 23-21

[02:35] Team_096 possession (Score: 23-21)
Kyrie Adebayo attempts a 3Pt. Contested by Michael Ginobili (4.4 feet, ZONE). KYRIE ADEBAYO MAKES IT! Assist: Terry Mobley
Score: 26-21

[02:22] Team_022 possession (Score: 26-21)
Malcolm Allen attempts a 3Pt. Contested by Terry Mobley (5.5 feet, MAN). Malcolm Allen misses. Rebound secured by Cole Griffin.

[02:08] Team_096 possession (Score: 26-21)
Cole Griffin attempts a 3Pt. Contested by Myles Anthony (5.0 feet, MAN). Cole Griffin misses. Rebound secured by Dirk Markkanen.

[01:55] Team_022 possession (Score: 26-21)
Lamelo Dosunmu drives, Kyrie Adebayo stays with him. Lamelo Dosunmu attempts a Layup. Contested by Kyrie Adebayo (4.6 feet, ZONE). LAMELO DOSUNMU MAKES IT! Assist: Dirk Markkanen
Score: 26-23

[01:37] Team_096 possession (Score: 26-23)
Kyrie Adebayo attempts a Midrange. Contested by Myles Anthony (5.4 feet, ZONE). Kyrie Adebayo misses. Rebound secured by Michael Ginobili.

[01:18] Team_022 possession (Score: 26-23)
Myles Anthony drives, Kyrie Adebayo stays with him. Myles Anthony attempts a Layup. Contested by Kyrie Adebayo (4.4 feet, ZONE). Myles Anthony misses. Rebound secured by Kyrie Adebayo.

[01:04] Team_096 possession (Score: 26-23)
Lamelo Quickley attempts a 3Pt. Contested by Michael Ginobili (3.5 feet, ZONE). Lamelo Quickley misses. Rebound secured by Myles Anthony.

[00:47] Team_022 possession (Score: 26-23)
Lamelo Dosunmu makes the Dunk and draws the foul on Lamelo Quickley! And-1! Lamelo Dosunmu to the line for 1. [BONUS: 5 team fouls] (Lamelo Quickley: 2 personal fouls)   FT 1/1: GOOD Lamelo Dosunmu makes 1/1 from the line.
Score: 26-26

[00:29] Team_096 possession (Score: 26-26)
FOUL! Shooting foul on Dirk Markkanen. Kyrie Adebayo to the line for 2 free throws. [BONUS: 5 team fouls] (Dirk Markkanen: 2 personal fouls)   FT 1/2: GOOD   FT 2/2: MISS Kyrie Adebayo makes 1/2 from the line. Rebound secured by Michael Ginobili.
Score: 27-26

[00:14] Team_022 possession (Score: 27-26)
Dirk Markkanen drives to the basket... Dirk Markkanen loses the ball! Stripped by Kyrie Adebayo! TURNOVER! (live ball)

================================================================================
                              1ST QUARTER COMPLETE                              
================================================================================

1ST QUARTER SCORE: Team_096 27, Team_022 26

BOX SCORE:
================================================================================

Team_096
--------------------------------------------------------------------------------
Player                MIN  PTS  REB  AST  TO      FG   FG%      3P   3P%
--------------------------------------------------------------------------------
Terry Mobley           12    8    0    4   0   3/6    50.0     0/0   0.0
Scottie Herro          12    5    2    0   0   2/2   100.0     0/0   0.0
Kyrie Adebayo          12    5    4    1   0   2/7    28.6     0/0   0.0
Cole Griffin           12    3    2    1   0   1/5    20.0     0/0   0.0
Lamelo Quickley        12    2    0    0   0   1/3    33.3     0/0   0.0

TEAM: FG: 9/23 (39.1%), 3PT: 4/13 (30.8%), REB: 9 (2 off, 7 def), AST: 6, TO: 1
TEAM FOULS: 5 [Team_022 in BONUS]


Team_022
--------------------------------------------------------------------------------
Player                MIN  PTS  REB  AST  TO      FG   FG%      3P   3P%
--------------------------------------------------------------------------------
Michael Ginobili       12   10    6    2   0   4/6    66.7     0/0   0.0
Lamelo Dosunmu         12    8    0    1   0   4/5    80.0     0/0   0.0
Dirk Markkanen         12    4    2    2   0   2/2   100.0     0/0   0.0
Myles Anthony          12    2    7    1   0   1/2    50.0     0/0   0.0
Malcolm Allen          12    2    0    1   0   1/4    25.0     0/0   0.0

TEAM: FG: 12/19 (63.2%), 3PT: 1/5 (20.0%), REB: 14 (1 off, 13 def), AST: 7, TO: 5
TEAM FOULS: 5 [Team_096 in BONUS]

================================================================================

================================================================================
                       2ND QUARTER - Team_096 vs Team_022                       
================================================================================

[12:00] Team_096 possession (Score: 27-26)
Terry Mobley attempts a 3Pt. Contested by Lamelo Dosunmu (5.1 feet, ZONE). TERRY MOBLEY MAKES IT! Assist: Cole Griffin
Score: 30-26

[11:45] Team_022 possession (Score: 30-26)
Myles Anthony drives, Cole Griffin stays with him. Myles Anthony attempts a Layup. Contested by Cole Griffin (3.8 feet, MAN). MYLES ANTHONY MAKES IT!
Score: 30-28

[11:29] Team_096 possession (Score: 30-28)
Lamelo Quickley loses control! Ball rolls out of bounds! TURNOVER! (dead ball)

[11:29] Substitution (Team_096): Terry Mobley OUT → Cade Jokic IN (stamina_rule2)

[11:29] Substitution (Team_096): Lamelo Quickley OUT → Jarrett Markkanen IN (stamina_rule2)

[11:29] Substitution (Team_096): Cole Griffin OUT → Cole Holiday IN (stamina_rule2)

[11:29] Substitution (Team_096): Scottie Herro OUT → Tyler Haliburton IN (stamina_rule2)

[11:29] Substitution (Team_096): Kyrie Adebayo OUT → Devin Griffin IN (stamina_rule2)

[11:29] Substitution (Team_022): Malcolm Allen OUT → DeMar Harden IN (stamina_rule2)

[11:29] Substitution (Team_022): Michael Ginobili OUT → Lauri Gobert IN (stamina_rule2)

[11:29] Substitution (Team_022): Myles Anthony OUT → Dejounte Towns IN (stamina_rule2)

[11:29] Substitution (Team_022): Lamelo Dosunmu OUT → Kawhi Russell IN (stamina_rule2)

[11:29] Substitution (Team_022): Dirk Markkanen OUT → Cole Iverson IN (stamina_rule2)

[11:15] Team_022 possession (Score: 30-28)
FOUL! Reach-in foul on Cade Jokic during the drive. [Team fouls: 1] No free throws, side out. (Cade Jokic: 1 personal fouls)

[11:01] Team_022 possession (Score: 30-28)
Kawhi Russell drives, picks up Tyler Haliburton. Help arrives from Jarrett Markkanen! Kawhi Russell attempts a Layup. Contested by Jarrett Markkanen (5.4 feet, MAN). Kawhi Russell misses. Rebound secured by Jarrett Markkanen.

[10:51] Team_096 possession (Score: 30-28)
Jarrett Markkanen attempts a Midrange. Contested by Dejounte Towns (4.1 feet, ZONE). Jarrett Markkanen misses. Rebound secured by Kawhi Russell.

[10:35] Team_022 possession (Score: 30-28)
Dejounte Towns attempts a 3Pt. Contested by Cole Holiday (4.6 feet, MAN). Dejounte Towns misses. Rebound secured by Jarrett Markkanen.

[10:18] Team_096 possession (Score: 30-28)
Cade Jokic attempts a 3Pt. Contested by DeMar Harden (5.4 feet, MAN). Cade Jokic misses. Offensive rebound by Devin Griffin! Devin Griffin kicks it out.

[10:03] Team_096 possession (Score: 30-28)
Tyler Haliburton attempts a Midrange. Contested by Lauri Gobert (4.4 feet, ZONE). TYLER HALIBURTON MAKES IT! Assist: Cole Holiday
Score: 32-28

[09:46] Team_022 possession (Score: 32-28)
Dejounte Towns attempts a 3Pt. Contested by Cade Jokic (5.4 feet, ZONE). Dejounte Towns misses. Rebound secured by Jarrett Markkanen.

[09:35] Team_096 possession (Score: 32-28)
Tyler Haliburton attempts a 3Pt. Contested by Kawhi Russell (4.0 feet, MAN). Tyler Haliburton misses. Offensive rebound by Devin Griffin! Devin Griffin kicks it out.

[09:25] Team_096 possession (Score: 32-28)
Devin Griffin attempts a Layup. Contested by Cole Iverson (5.2 feet, MAN). DEVIN GRIFFIN MAKES IT! Assist: Tyler Haliburton
Score: 34-28

[09:11] Team_022 possession (Score: 34-28)
DeMar Harden throws a bad pass! Stolen by Cade Jokic! TURNOVER! (live ball)

[08:57] Team_096 possession (Score: 34-28)
Cole Holiday attempts a 3Pt. Contested by Lauri Gobert (4.7 feet, ZONE). COLE HOLIDAY MAKES IT! Assist: Tyler Haliburton
Score: 37-28

[08:42] Team_022 possession (Score: 37-28)
Cole Iverson attempts a Midrange. Contested by Cole Holiday (4.6 feet, ZONE). Cole Iverson misses. Rebound secured by Jarrett Markkanen.

[08:27] Team_096 possession (Score: 37-28)
FOUL! Shooting foul on Kawhi Russell. Tyler Haliburton to the line for 2 free throws. [Team fouls: 1] (Kawhi Russell: 1 personal fouls)   FT 1/2: GOOD   FT 2/2: GOOD Tyler Haliburton makes 2/2 from the line.
Score: 39-28

[08:12] Team_022 possession (Score: 39-28)
Lauri Gobert attempts a Layup. Contested by Devin Griffin (4.6 feet, ZONE). LAURI GOBERT MAKES IT! Assist: Cole Iverson
Score: 39-30

[08:01] Team_096 possession (Score: 39-30)
Tyler Haliburton drives, picks up Kawhi Russell. Help arrives from Lauri Gobert! Tyler Haliburton attempts a Layup. Contested by Lauri Gobert (4.0 feet, MAN). TYLER HALIBURTON MAKES IT! Assist: Cole Holiday
Score: 41-30

[07:47] Team_022 possession (Score: 41-30)
FOUL! Holding foul on Cole Holiday. [Team fouls: 2] No free throws, side out. (Cole Holiday: 1 personal fouls)

[07:34] Team_022 possession (Score: 41-30)
Dejounte Towns drives to the basket... Dejounte Towns loses control! Ball rolls out of bounds! TURNOVER! (dead ball)

[07:17] Team_096 possession (Score: 41-30)
Cade Jokic attempts a 3Pt. Contested by Kawhi Russell (4.1 feet, ZONE). Cade Jokic misses. Rebound secured by Lauri Gobert.

[07:05] Team_022 possession (Score: 41-30)
FOUL! Offensive foul on Kawhi Russell! Tyler Haliburton drew the charge! [Team fouls: 2] (Kawhi Russell: 2 personal fouls) TURNOVER! (dead ball)

[06:52] Team_096 possession (Score: 41-30)
FOUL! Shooting foul on Cole Iverson. Devin Griffin to the line for 2 free throws. [Team fouls: 3] (Cole Iverson: 1 personal fouls)   FT 1/2: MISS   FT 2/2: GOOD Devin Griffin makes 1/2 from the line.
Score: 42-30

[06:38] Team_022 possession (Score: 42-30)
DeMar Harden attempts a Layup. BLOCKED BY CADE JOKIC! Ball goes out off Cade Jokic. DeMar Harden's ball!

[06:24] Team_022 possession (Score: 42-30)
DeMar Harden attempts a Midrange. Contested by Cole Holiday (4.5 feet, ZONE). DEMAR HARDEN MAKES IT! Assist: Dejounte Towns
Score: 42-32

[06:11] Team_096 possession (Score: 42-32)
Devin Griffin drives and kicks out. Jarrett Markkanen attempts a 3Pt. Contested by Lauri Gobert (4.5 feet, MAN). JARRETT MARKKANEN MAKES IT! Assist: Cade Jokic
Score: 45-32

[05:57] Team_022 possession (Score: 45-32)
FOUL! Shooting foul on Cade Jokic. DeMar Harden to the line for 2 free throws. [Team fouls: 3] (Cade Jokic: 2 personal fouls)   FT 1/2: GOOD   FT 2/2: GOOD DeMar Harden makes 2/2 from the line.
Score: 45-34

[05:40] Team_096 possession (Score: 45-34)
Cade Jokic drives, Kawhi Russell stays with him. Cade Jokic attempts a Dunk. Contested by Kawhi Russell (4.1 feet, ZONE). CADE JOKIC MAKES IT! Assist: Cole Holiday
Score: 47-34

[05:23] Team_022 possession (Score: 47-34)
Kawhi Russell attempts a 3Pt. Contested by Cade Jokic (5.6 feet, ZONE). Kawhi Russell misses. Rebound secured by Devin Griffin.

[05:05] Team_096 possession (Score: 47-34)
Cole Holiday attempts a Layup. BLOCKED BY KAWHI RUSSELL! Ball goes out off Kawhi Russell. Cole Holiday's ball!

[04:47] Team_096 possession (Score: 47-34)
Devin Griffin drives and kicks out. FOUL! Shooting foul on Lauri Gobert. Jarrett Markkanen to the line for 2 free throws. [Team fouls: 4] (Lauri Gobert: 1 personal fouls)   FT 1/2: GOOD   FT 2/2: GOOD Jarrett Markkanen makes 2/2 from the line.
Score: 49-34

[04:31] Team_022 possession (Score: 49-34)
FOUL! Shooting foul on Jarrett Markkanen. Cole Iverson to the line for 2 free throws. [Team fouls: 4] (Jarrett Markkanen: 1 personal fouls)   FT 1/2: GOOD   FT 2/2: GOOD Cole Iverson makes 2/2 from the line.
Score: 49-36

[04:15] Team_096 possession (Score: 49-36)
Jarrett Markkanen attempts a 3Pt. Contested by Kawhi Russell (3.7 feet, ZONE). Jarrett Markkanen misses. Rebound secured by Dejounte Towns.

[03:59] Team_022 possession (Score: 49-36)
Lauri Gobert attempts a Midrange. Contested by Jarrett Markkanen (4.2 feet, MAN). Lauri Gobert misses. Offensive rebound by Dejounte Towns! Dejounte Towns kicks it out.

[03:44] Team_022 possession (Score: 49-36)
DeMar Harden attempts a 3Pt. Contested by Cade Jokic (5.4 feet, MAN). DEMAR HARDEN MAKES IT! Assist: Dejounte Towns
Score: 49-39

[03:26] Team_096 possession (Score: 49-39)
Tyler Haliburton attempts a 3Pt. Contested by Kawhi Russell (4.1 feet, MAN). Tyler Haliburton misses. Offensive rebound by Devin Griffin! Devin Griffin kicks it out.

[03:11] Team_096 possession (Score: 49-39)
Cole Holiday attempts a 3Pt. Contested by Dejounte Towns (4.8 feet, MAN). Cole Holiday misses. Offensive rebound by Tyler Haliburton! Tyler Haliburton kicks it out.

[02:56] Team_096 possession (Score: 49-39)
Tyler Haliburton attempts a Midrange. Contested by Kawhi Russell (4.1 feet, MAN). Tyler Haliburton misses. Rebound secured by Dejounte Towns.

[02:44] Team_022 possession (Score: 49-39)
Lauri Gobert drives and kicks out. DeMar Harden attempts a 3Pt. Contested by Cade Jokic (5.5 feet, ZONE). DEMAR HARDEN MAKES IT! Assist: Cole Iverson
Score: 49-42

[02:30] Team_096 possession (Score: 49-42)
Tyler Haliburton attempts a Layup. Contested by Kawhi Russell (4.2 feet, ZONE). TYLER HALIBURTON MAKES IT! Assist: Cade Jokic
Score: 51-42

[02:16] Team_022 possession (Score: 51-42)
FOUL! Reach-in foul on Devin Griffin during the drive. [IN THE BONUS! 5 team fouls] Lauri Gobert to the line for 2 free throws. (Devin Griffin: 1 personal fouls)   FT 1/2: GOOD   FT 2/2: GOOD Lauri Gobert makes 2/2 from the line.
Score: 51-44

[02:06] Team_096 possession (Score: 51-44)
FOUL! Shooting foul on Kawhi Russell. Cole Holiday to the line for 3 free throws. [BONUS: 5 team fouls] (Kawhi Russell: 3 personal fouls)   FT 1/3: GOOD   FT 2/3: GOOD   FT 3/3: GOOD Cole Holiday makes 3/3 from the line.
Score: 54-44

[01:53] Team_022 possession (Score: 54-44)
FOUL! Offensive foul on Lauri Gobert! Jarrett Markkanen drew the charge! [Team fouls: 6] (Lauri Gobert: 2 personal fouls) TURNOVER! (dead ball)

[01:42] Team_096 possession (Score: 54-44)
Devin Griffin drives and kicks out. Cole Holiday attempts a 3Pt. Contested by Kawhi Russell (4.4 feet, ZONE). Cole Holiday misses. Rebound secured by Lauri Gobert.

[01:27] Team_022 possession (Score: 54-44)
FOUL! Holding foul on Cade Jokic. [IN THE BONUS! 6 team fouls] DeMar Harden to the line for 2 free throws. (Cade Jokic: 3 personal fouls)   FT 1/2: GOOD   FT 2/2: GOOD DeMar Harden makes 2/2 from the line.
Score: 54-46

[01:09] Team_096 possession (Score: 54-46)
Cole Holiday attempts a Layup. Contested by Kawhi Russell (4.6 feet, ZONE). COLE HOLIDAY MAKES IT!
Score: 56-46

[00:57] Team_022 possession (Score: 56-46)
Dejounte Towns attempts a 3Pt. Contested by Cole Holiday (5.0 feet, MAN). Dejounte Towns misses. Rebound secured by Devin Griffin.

[00:44] Team_096 possession (Score: 56-46)
Jarrett Markkanen attempts a 3Pt. Contested by Kawhi Russell (4.1 feet, ZONE). Jarrett Markkanen misses. Rebound secured by Kawhi Russell.

[00:31] Team_022 possession (Score: 56-46)
Dejounte Towns attempts a 3Pt. Contested by Cade Jokic (5.7 feet, ZONE). Dejounte Towns misses. Rebound secured by Tyler Haliburton.

[00:17] Team_096 possession (Score: 56-46)
Tyler Haliburton drives and kicks out. Cole Holiday attempts a 3Pt. Contested by Dejounte Towns (4.8 feet, MAN). Cole Holiday misses. Offensive rebound by Devin Griffin! Devin Griffin kicks it out.

[00:01] Team_096 possession (Score: 56-46)
Devin Griffin drives, picks up Cole Iverson. Help arrives from Lauri Gobert! Devin Griffin attempts a Layup. Contested by Lauri Gobert (5.6 feet, ZONE). DEVIN GRIFFIN MAKES IT!
Score: 58-46

================================================================================
                              2ND QUARTER COMPLETE                              
================================================================================

2ND QUARTER SCORE: Team_096 31, Team_022 20

BOX SCORE:
================================================================================

Team_096
--------------------------------------------------------------------------------
Player                MIN  PTS  REB  AST  TO      FG   FG%      3P   3P%
--------------------------------------------------------------------------------
Tyler Haliburton       11    8    2    2   0   4/5    80.0     0/0   0.0
Cole Holiday           11    8    0    3   0   3/3   100.0     0/0   0.0
Jarrett Markkanen      11    5    4    0   0   2/5    40.0     0/0   0.0
Devin Griffin          11    5    6    0   0   3/4    75.0     0/0   0.0
Terry Mobley           13    3    0    0   0   1/1   100.0     0/0   0.0
Cade Jokic             11    2    0    2   0   1/2    50.0     0/0   0.0
Cole Griffin           13    0    0    1   0   0/0     0.0     0/0   0.0

TEAM: FG: 14/20 (70.0%), 3PT: 3/6 (50.0%), REB: 12 (5 off, 7 def), AST: 8, TO: 1
TEAM FOULS: 6 [Team_022 in BONUS]


Team_022
--------------------------------------------------------------------------------
Player                MIN  PTS  REB  AST  TO      FG   FG%      3P   3P%
--------------------------------------------------------------------------------
DeMar Harden           11   12    0    0   0   5/5   100.0     0/0   0.0
Lauri Gobert           11    4    2    0   0   2/2   100.0     0/0   0.0
Myles Anthony          13    2    0    0   0   1/1   100.0     0/0   0.0
Cole Iverson           11    2    0    2   0   1/2    50.0     0/0   0.0
Kawhi Russell          11    0    2    0   0   0/2     0.0     0/0   0.0
Dejounte Towns         11    0    3    2   0   0/4     0.0     0/0   0.0

TEAM: FG: 9/16 (56.2%), 3PT: 1/6 (16.7%), REB: 7 (1 off, 6 def), AST: 4, TO: 4
TEAM FOULS: 6 [Team_096 in BONUS]

================================================================================

================================================================================
                       3RD QUARTER - Team_096 vs Team_022                       
================================================================================

[12:00] Team_096 possession (Score: 58-46)
FOUL! Reach-in foul on Dirk Markkanen during the drive. [Team fouls: 1] No free throws, side out. (Dirk Markkanen: 1 personal fouls)

[11:44] Team_096 possession (Score: 58-46)
Cole Griffin attempts a 3Pt. Contested by Michael Ginobili (3.8 feet, ZONE). COLE GRIFFIN MAKES IT! Assist: Lamelo Quickley
Score: 61-46

[11:31] Team_022 possession (Score: 61-46)
Michael Ginobili drives to the basket... Michael Ginobili loses control! Ball rolls out of bounds! TURNOVER! (dead ball)

[11:16] Team_096 possession (Score: 61-46)
Lamelo Quickley attempts a Midrange. Contested by Michael Ginobili (3.0 feet, MAN). Lamelo Quickley misses. Rebound secured by Myles Anthony.

[10:57] Team_022 possession (Score: 61-46)
FOUL! Shooting foul on Lamelo Quickley. Myles Anthony to the line for 2 free throws. [Team fouls: 1] (Lamelo Quickley: 1 personal fouls)   FT 1/2: GOOD   FT 2/2: GOOD Myles Anthony makes 2/2 from the line.
Score: 61-48

[10:45] Team_096 possession (Score: 61-48)
Kyrie Adebayo makes the Layup and draws the foul on Dirk Markkanen! And-1! Kyrie Adebayo to the line for 1. [Team fouls: 2] (Dirk Markkanen: 2 personal fouls)   FT 1/1: GOOD Kyrie Adebayo makes 1/1 from the line.
Score: 64-48

[10:31] Team_022 possession (Score: 64-48)
Dirk Markkanen drives, picks up Kyrie Adebayo. Help arrives from Lamelo Quickley! Dirk Markkanen attempts a Layup. Contested by Lamelo Quickley (4.5 feet, MAN). DIRK MARKKANEN MAKES IT!
Score: 64-50

[10:14] Team_096 possession (Score: 64-50)
Lamelo Quickley attempts a 3Pt. Contested by Michael Ginobili (3.0 feet, ZONE). Lamelo Quickley misses. FOUL! Loose ball foul on Michael Ginobili during the rebound battle. [Team fouls: 3] No free throws, side out. (Michael Ginobili: 1 personal fouls)

[10:01] Team_096 possession (Score: 64-50)
Terry Mobley attempts a 3Pt. Contested by Lamelo Dosunmu (4.8 feet, ZONE). Terry Mobley misses. Rebound secured by Dirk Markkanen.

[09:51] Team_022 possession (Score: 64-50)
Dirk Markkanen drives and kicks out. FOUL! Shooting foul on Cole Griffin. Michael Ginobili to the line for 3 free throws. [Team fouls: 2] (Cole Griffin: 1 personal fouls)   FT 1/3: GOOD   FT 2/3: GOOD   FT 3/3: GOOD Michael Ginobili makes 3/3 from the line.
Score: 64-53

[09:35] Team_096 possession (Score: 64-53)
Lamelo Quickley attempts a 3Pt. Contested by Michael Ginobili (3.0 feet, MAN). Lamelo Quickley misses. Rebound secured by Dirk Markkanen.

[09:19] Team_022 possession (Score: 64-53)
Lamelo Dosunmu attempts a Midrange. Contested by Cole Griffin (3.8 feet, ZONE). LAMELO DOSUNMU MAKES IT!
Score: 64-55

[09:03] Team_096 possession (Score: 64-55)
Lamelo Quickley attempts a 3Pt. Contested by Michael Ginobili (3.0 feet, ZONE). Lamelo Quickley misses. Rebound secured by Myles Anthony.

[08:49] Team_022 possession (Score: 64-55)
Malcolm Allen drives and kicks out. Dirk Markkanen attempts a 3Pt. Contested by Cole Griffin (3.3 feet, ZONE). DIRK MARKKANEN MAKES IT! Assist: Malcolm Allen
Score: 64-58

[08:33] Team_096 possession (Score: 64-58)
FOUL! Reach-in foul on Dirk Markkanen during the drive. [Team fouls: 4] No free throws, side out. (Dirk Markkanen: 3 personal fouls)

[08:17] Team_096 possession (Score: 64-58)
Lamelo Quickley attempts a Midrange. Contested by Michael Ginobili (3.0 feet, MAN). Lamelo Quickley misses. FOUL! Loose ball foul on Michael Ginobili during the rebound battle. [IN THE BONUS! 5 team fouls] Scottie Herro to the line for 2 free throws. (Michael Ginobili: 2 personal fouls)   FT 1/2: GOOD   FT 2/2: MISS Scottie Herro makes 1/2 from the line. Rebound secured by Myles Anthony.
Score: 65-58

[08:00] Team_022 possession (Score: 65-58)
Michael Ginobili attempts a Midrange. Contested by Cole Griffin (3.4 feet, ZONE). MICHAEL GINOBILI MAKES IT! Assist: Dirk Markkanen
Score: 65-60

[07:45] Team_096 possession (Score: 65-60)
Terry Mobley loses control! Ball rolls out of bounds! TURNOVER! (dead ball)

[07:31] Team_022 possession (Score: 65-60)
FOUL! Shooting foul on Cole Griffin. Michael Ginobili to the line for 2 free throws. [Team fouls: 3] (Cole Griffin: 2 personal fouls)   FT 1/2: GOOD   FT 2/2: GOOD Michael Ginobili makes 2/2 from the line.
Score: 65-62

[07:13] Team_096 possession (Score: 65-62)
Lamelo Quickley attempts a Layup. BLOCKED BY MICHAEL GINOBILI! Ball is loose! Rebound secured by Michael Ginobili.

[07:03] Team_022 possession (Score: 65-62)
Michael Ginobili attempts a Layup. Contested by Lamelo Quickley (4.0 feet, MAN). MICHAEL GINOBILI MAKES IT!
Score: 65-64

[06:50] Team_096 possession (Score: 65-64)
FOUL! Shooting foul on Dirk Markkanen. Kyrie Adebayo to the line for 2 free throws. [BONUS: 6 team fouls] (Dirk Markkanen: 4 personal fouls)   FT 1/2: GOOD   FT 2/2: GOOD Kyrie Adebayo makes 2/2 from the line.
Score: 67-64

[06:36] Team_022 possession (Score: 67-64)
Michael Ginobili attempts a Layup. Contested by Kyrie Adebayo (4.0 feet, ZONE). MICHAEL GINOBILI MAKES IT!
Score: 67-66

[06:23] Team_096 possession (Score: 67-66)
Terry Mobley makes the Layup and draws the foul on Malcolm Allen! And-1! Terry Mobley to the line for 1. [BONUS: 7 team fouls] (Malcolm Allen: 1 personal fouls)   FT 1/1: MISS Terry Mobley makes 0/1 from the line. Offensive rebound by Kyrie Adebayo! Kyrie Adebayo puts it back in!
Score: 71-66

[06:09] Team_022 possession (Score: 71-66)
Myles Anthony drives, picks up Cole Griffin. Help arrives from Lamelo Quickley! Myles Anthony attempts a Layup. Contested by Lamelo Quickley (3.5 feet, MAN). MYLES ANTHONY MAKES IT!
Score: 71-68

[05:54] Team_096 possession (Score: 71-68)
Cole Griffin drives to the basket... FOUL! Offensive foul on Cole Griffin! Myles Anthony drew the charge! [Team fouls: 4] (Cole Griffin: 3 personal fouls) TURNOVER! (dead ball)

[05:40] Team_022 possession (Score: 71-68)
Lamelo Dosunmu drives, Scottie Herro stays with him. Lamelo Dosunmu attempts a Layup. Contested by Scottie Herro (5.4 feet, MAN). LAMELO DOSUNMU MAKES IT! Assist: Michael Ginobili
Score: 71-70

[05:23] Team_096 possession (Score: 71-70)
Scottie Herro attempts a Layup. Contested by Dirk Markkanen (4.7 feet, ZONE). SCOTTIE HERRO MAKES IT!
Score: 73-70

[05:10] Team_022 possession (Score: 73-70)
Myles Anthony makes the Dunk and draws the foul on Lamelo Quickley! And-1! Myles Anthony to the line for 1. [BONUS: 5 team fouls] (Lamelo Quickley: 2 personal fouls)   FT 1/1: GOOD Myles Anthony makes 1/1 from the line.
Score: 73-73

[04:55] Team_096 possession (Score: 73-73)
Lamelo Quickley attempts a 3Pt. BLOCKED BY MICHAEL GINOBILI! Ball deflects out of bounds off Lamelo Quickley.

[04:40] Team_022 possession (Score: 73-73)
Myles Anthony drives and kicks out. Lamelo Dosunmu attempts a 3Pt. Contested by Cole Griffin (3.3 feet, ZONE). Lamelo Dosunmu misses. Rebound secured by Kyrie Adebayo.

[04:25] Team_096 possession (Score: 73-73)
Cole Griffin drives, picks up Dirk Markkanen. Help arrives from Michael Ginobili! Cole Griffin attempts a Layup. Contested by Michael Ginobili (5.0 feet, ZONE). Cole Griffin misses. Rebound secured by Dirk Markkanen.

[04:10] Team_022 possession (Score: 73-73)
Michael Ginobili makes the 3Pt and draws the foul on Terry Mobley! And-1! Michael Ginobili to the line for 1. [BONUS: 6 team fouls] (Terry Mobley: 1 personal fouls)   FT 1/1: GOOD Michael Ginobili makes 1/1 from the line.
Score: 73-77

[03:57] Team_096 possession (Score: 73-77)
Terry Mobley attempts a 3Pt. Contested by Michael Ginobili (3.7 feet, ZONE). Terry Mobley misses. Rebound secured by Dirk Markkanen.

[03:43] Team_022 possession (Score: 73-77)
Lamelo Dosunmu attempts a 3Pt. Contested by Scottie Herro (5.5 feet, MAN). LAMELO DOSUNMU MAKES IT! Assist: Dirk Markkanen
Score: 73-80

[03:26] Team_096 possession (Score: 73-80)
Lamelo Quickley attempts a Midrange. Contested by Michael Ginobili (3.2 feet, MAN). Lamelo Quickley misses. Rebound secured by Dirk Markkanen.

[03:14] Team_022 possession (Score: 73-80)
Lamelo Dosunmu drives to the basket... FOUL! Offensive foul on Lamelo Dosunmu! Kyrie Adebayo drew the charge! [Team fouls: 8] (Lamelo Dosunmu: 1 personal fouls) TURNOVER! (dead ball)

[03:00] Team_096 possession (Score: 73-80)
Kyrie Adebayo drives, Dirk Markkanen stays with him. Kyrie Adebayo attempts a Layup. Contested by Dirk Markkanen (5.4 feet, ZONE). KYRIE ADEBAYO MAKES IT!
Score: 75-80

[02:42] Team_022 possession (Score: 75-80)
Dirk Markkanen attempts a Layup. Contested by Kyrie Adebayo (4.6 feet, ZONE). DIRK MARKKANEN MAKES IT!
Score: 75-82

[02:29] Team_096 possession (Score: 75-82)
Scottie Herro attempts a 3Pt. Contested by Lamelo Dosunmu (5.0 feet, MAN). Scottie Herro misses. Rebound secured by Michael Ginobili.

[02:16] Team_022 possession (Score: 75-82)
Myles Anthony loses control! Ball rolls out of bounds! TURNOVER! (dead ball)

[02:16] Substitution (Team_096): Terry Mobley OUT → Cade Jokic IN (stamina_rule2)

[02:16] Substitution (Team_096): Lamelo Quickley OUT → Jarrett Markkanen IN (stamina_rule2)

[02:16] Substitution (Team_096): Scottie Herro OUT → Tyler Haliburton IN (stamina_rule2)

[02:16] Substitution (Team_022): Malcolm Allen OUT → DeMar Harden IN (stamina_rule2)

[02:16] Substitution (Team_022): Michael Ginobili OUT → Lauri Gobert IN (stamina_rule2)

[02:16] Substitution (Team_022): Myles Anthony OUT → Dejounte Towns IN (stamina_rule2)

[02:16] Substitution (Team_022): Lamelo Dosunmu OUT → Kawhi Russell IN (stamina_rule2)

[02:16] Substitution (Team_022): Dirk Markkanen OUT → Cole Iverson IN (stamina_rule2)

[02:03] Team_096 possession (Score: 75-82)
Cade Jokic attempts a 3Pt. Contested by Kawhi Russell (4.1 feet, ZONE). Cade Jokic misses. Rebound secured by Dejounte Towns.

[01:52] Team_022 possession (Score: 75-82)
Lauri Gobert attempts a 3Pt. Contested by Jarrett Markkanen (4.2 feet, MAN). Lauri Gobert misses. Rebound secured by Jarrett Markkanen.

[01:36] Team_096 possession (Score: 75-82)
Tyler Haliburton drives, picks up Kawhi Russell. Help arrives from Lauri Gobert! Tyler Haliburton attempts a Dunk. Contested by Lauri Gobert (4.0 feet, ZONE). Tyler Haliburton misses. Rebound secured by Lauri Gobert.

[01:20] Team_022 possession (Score: 75-82)
Lauri Gobert attempts a 3Pt. BLOCKED BY COLE GRIFFIN! Ball is loose! Rebound secured by Jarrett Markkanen.

[01:04] Team_096 possession (Score: 75-82)
Kyrie Adebayo attempts a 3Pt. Contested by Kawhi Russell (4.6 feet, ZONE). KYRIE ADEBAYO MAKES IT! Assist: Jarrett Markkanen
Score: 78-82

[00:47] Team_022 possession (Score: 78-82)
Dejounte Towns attempts a Layup. Contested by Cole Griffin (3.8 feet, MAN). DEJOUNTE TOWNS MAKES IT!
Score: 78-84

[00:36] Team_096 possession (Score: 78-84)
Jarrett Markkanen attempts a 3Pt. Contested by Lauri Gobert (4.1 feet, MAN). JARRETT MARKKANEN MAKES IT! Assist: Cole Griffin
Score: 81-84

[00:19] Team_022 possession (Score: 81-84)
Lauri Gobert attempts a Midrange. Contested by Jarrett Markkanen (4.2 feet, MAN). Lauri Gobert misses. Offensive rebound by Lauri Gobert! Lauri Gobert kicks it out.

[00:01] Team_022 possession (Score: 81-84)
Lauri Gobert attempts a Layup. BLOCKED BY JARRETT MARKKANEN! Ball is loose! Rebound secured by Kyrie Adebayo.

================================================================================
                              3RD QUARTER COMPLETE                              
================================================================================

3RD QUARTER SCORE: Team_096 23, Team_022 38

BOX SCORE:
================================================================================

Team_096
--------------------------------------------------------------------------------
Player                MIN  PTS  REB  AST  TO      FG   FG%      3P   3P%
--------------------------------------------------------------------------------
Kyrie Adebayo          25   14    2    0   0   5/5   100.0     0/0   0.0
Cole Griffin           25    3    0    1   0   1/2    50.0     0/0   0.0
Jarrett Markkanen      14    3    2    1   0   1/1   100.0     0/0   0.0
Scottie Herro          23    2    1    0   0   1/2    50.0     0/0   0.0
Lamelo Quickley        23    0    0    1   0   0/7     0.0     0/0   0.0
Terry Mobley           23    0    0    0   0   0/2     0.0     0/0   0.0
Cade Jokic             14    0    0    0   0   0/1     0.0     0/0   0.0
Tyler Haliburton       14    0    0    0   0   0/1     0.0     0/0   0.0

TEAM: FG: 8/21 (38.1%), 3PT: 3/10 (30.0%), REB: 6 (2 off, 4 def), AST: 3, TO: 2
TEAM FOULS: 6 [Team_022 in BONUS]


Team_022
--------------------------------------------------------------------------------
Player                MIN  PTS  REB  AST  TO      FG   FG%      3P   3P%
--------------------------------------------------------------------------------
Michael Ginobili       23   15    2    1   0   6/6   100.0     0/0   0.0
Myles Anthony          23    7    3    0   0   3/4    75.0     0/0   0.0
Dirk Markkanen         23    7    5    2   0   3/3   100.0     0/0   0.0
Lamelo Dosunmu         23    7    0    0   0   3/3   100.0     0/0   0.0
Dejounte Towns         14    2    1    0   0   1/1   100.0     0/0   0.0
Malcolm Allen          23    0    0    1   0   0/0     0.0     0/0   0.0
Lauri Gobert           14    0    2    0   0   0/3     0.0     0/0   0.0

TEAM: FG: 16/20 (80.0%), 3PT: 2/4 (50.0%), REB: 12 (1 off, 11 def), AST: 4, TO: 3
TEAM FOULS: 8 [Team_096 in BONUS]

================================================================================

================================================================================
                       4TH QUARTER - Team_096 vs Team_022                       
================================================================================

[12:00] Team_096 possession (Score: 81-84)
Lamelo Quickley attempts a Layup. Contested by Michael Ginobili (3.0 feet, MAN). LAMELO QUICKLEY MAKES IT! Assist: Terry Mobley
Score: 83-84

[11:46] Team_022 possession (Score: 83-84)
Lamelo Dosunmu attempts a 3Pt. Contested by Scottie Herro (5.4 feet, MAN). LAMELO DOSUNMU MAKES IT! Assist: Myles Anthony
Score: 83-87

[11:34] Team_096 possession (Score: 83-87)
Terry Mobley attempts a 3Pt. Contested by Malcolm Allen (4.6 feet, MAN). Terry Mobley misses. Rebound secured by Myles Anthony.

[11:17] Team_022 possession (Score: 83-87)
Malcolm Allen attempts a 3Pt. Contested by Terry Mobley (5.3 feet, ZONE). Malcolm Allen misses. Rebound secured by Kyrie Adebayo.

[10:58] Team_096 possession (Score: 83-87)
Terry Mobley drives and kicks out. Cole Griffin attempts a 3Pt. Contested by Myles Anthony (4.5 feet, MAN). COLE GRIFFIN MAKES IT! Assist: Scottie Herro
Score: 86-87

[10:42] Team_022 possession (Score: 86-87)
Myles Anthony drives, picks up Cole Griffin. Help arrives from Lamelo Quickley! Myles Anthony attempts a Layup. Contested by Lamelo Quickley (3.9 feet, MAN). MYLES ANTHONY MAKES IT!
Score: 86-89

[10:30] Team_096 possession (Score: 86-89)
FOUL! Reach-in foul on Lamelo Dosunmu during the drive. [Team fouls: 1] No free throws, side out. (Lamelo Dosunmu: 1 personal fouls)

[10:13] Team_096 possession (Score: 86-89)
Cole Griffin drives to the basket... Cole Griffin throws a bad pass out of bounds! TURNOVER! (dead ball)

[10:13] Substitution (Team_096): Cole Griffin OUT → Cole Holiday IN (stamina_rule2)

[10:13] Substitution (Team_096): Kyrie Adebayo OUT → Devin Griffin IN (stamina_rule2)

[09:59] Team_022 possession (Score: 86-89)
Myles Anthony makes the Layup and draws the foul on Scottie Herro! And-1! Myles Anthony to the line for 1. [Team fouls: 1] (Scottie Herro: 1 personal fouls)   FT 1/1: GOOD Myles Anthony makes 1/1 from the line.
Score: 86-92

[09:48] Team_096 possession (Score: 86-92)
Scottie Herro attempts a 3Pt. Contested by Michael Ginobili (3.8 feet, ZONE). Scottie Herro misses. Rebound secured by Dirk Markkanen.

[09:32] Team_022 possession (Score: 86-92)
Dirk Markkanen attempts a 3Pt. Contested by Devin Griffin (5.1 feet, MAN). Dirk Markkanen misses. Rebound secured by Scottie Herro.

[09:18] Team_096 possession (Score: 86-92)
Cole Holiday attempts a Midrange. Contested by Lamelo Dosunmu (5.2 feet, ZONE). COLE HOLIDAY MAKES IT! Assist: Terry Mobley
Score: 88-92

[09:04] Team_022 possession (Score: 88-92)
Myles Anthony drives to the basket... Myles Anthony throws a bad pass! Stolen by Cole Holiday! TURNOVER! (live ball)

[08:49] Team_096 possession (Score: 88-92)
Terry Mobley attempts a Midrange. Contested by Malcolm Allen (4.8 feet, MAN). TERRY MOBLEY MAKES IT!
Score: 90-92

[08:35] Team_022 possession (Score: 90-92)
Myles Anthony drives, picks up Scottie Herro. Help arrives from Lamelo Quickley! Myles Anthony attempts a Dunk. Contested by Lamelo Quickley (5.4 feet, ZONE). MYLES ANTHONY MAKES IT! Assist: Dirk Markkanen
Score: 90-94

[08:20] Team_096 possession (Score: 90-94)
Cole Holiday loses the ball! Stripped by Myles Anthony! TURNOVER! (live ball)

[08:01] Team_022 possession (Score: 90-94)
Lamelo Dosunmu attempts a 3Pt. Contested by Scottie Herro (5.7 feet, MAN). Lamelo Dosunmu misses. FOUL! Loose ball foul on Devin Griffin during the rebound battle. [Team fouls: 2] No free throws, side out. (Devin Griffin: 1 personal fouls)

[07:47] Team_022 possession (Score: 90-94)
Lamelo Dosunmu makes the Layup and draws the foul on Scottie Herro! And-1! Lamelo Dosunmu to the line for 1. [Team fouls: 3] (Scottie Herro: 2 personal fouls)   FT 1/1: GOOD Lamelo Dosunmu makes 1/1 from the line.
Score: 90-97

[07:38] Team_096 possession (Score: 90-97)
Terry Mobley drives to the basket... Terry Mobley loses the ball! Stripped by Malcolm Allen! TURNOVER! (live ball)

[07:23] Team_022 possession (Score: 90-97)
Michael Ginobili attempts a 3Pt. Contested by Lamelo Quickley (4.4 feet, MAN). Michael Ginobili misses. Rebound secured by Scottie Herro.

[07:05] Team_096 possession (Score: 90-97)
Terry Mobley drives to the basket... FOUL! Offensive foul on Terry Mobley! Dirk Markkanen drew the charge! [Team fouls: 4] (Terry Mobley: 1 personal fouls) TURNOVER! (dead ball)

[06:50] Team_022 possession (Score: 90-97)
FOUL! Reach-in foul on Scottie Herro during the drive. [IN THE BONUS! 5 team fouls] Lamelo Dosunmu to the line for 2 free throws. (Scottie Herro: 3 personal fouls)   FT 1/2: GOOD   FT 2/2: GOOD Lamelo Dosunmu makes 2/2 from the line.
Score: 90-99

[06:37] Team_096 possession (Score: 90-99)
FOUL! Shooting foul on Lamelo Dosunmu. Scottie Herro to the line for 2 free throws. [Team fouls: 2] (Lamelo Dosunmu: 2 personal fouls)   FT 1/2: GOOD   FT 2/2: GOOD Scottie Herro makes 2/2 from the line.
Score: 92-99

[06:22] Team_022 possession (Score: 92-99)
Malcolm Allen attempts a 3Pt. Contested by Terry Mobley (5.7 feet, MAN). Malcolm Allen misses. Offensive rebound by Michael Ginobili! Michael Ginobili kicks it out.

[06:07] Team_022 possession (Score: 92-99)
Lamelo Dosunmu attempts a Layup. Contested by Scottie Herro (5.9 feet, ZONE). LAMELO DOSUNMU MAKES IT! Assist: Michael Ginobili
Score: 92-101

[05:49] Team_096 possession (Score: 92-101)
Terry Mobley attempts a 3Pt. Contested by Malcolm Allen (5.2 feet, MAN). Terry Mobley misses. Rebound secured by Michael Ginobili.

[05:36] Team_022 possession (Score: 92-101)
Lamelo Dosunmu attempts a Midrange. Contested by Cole Holiday (4.8 feet, ZONE). Lamelo Dosunmu misses. Rebound secured by Devin Griffin.

[05:24] Team_096 possession (Score: 92-101)
FOUL! Reach-in foul on Dirk Markkanen during the drive. [Team fouls: 3] No free throws, side out. (Dirk Markkanen: 1 personal fouls)

[05:09] Team_096 possession (Score: 92-101)
Lamelo Quickley attempts a Layup. Contested by Dirk Markkanen (4.9 feet, ZONE). Lamelo Quickley misses. Rebound secured by Michael Ginobili.

[04:58] Team_022 possession (Score: 92-101)
Dirk Markkanen attempts a 3Pt. Contested by Devin Griffin (5.0 feet, MAN). Dirk Markkanen misses. Rebound secured by Cole Holiday.

[04:44] Team_096 possession (Score: 92-101)
Devin Griffin drives, picks up Dirk Markkanen. Help arrives from Michael Ginobili! Devin Griffin attempts a Dunk. Contested by Michael Ginobili (5.6 feet, MAN). Devin Griffin misses. Offensive rebound by Devin Griffin! Devin Griffin kicks it out.

[04:25] Team_096 possession (Score: 92-101)
Terry Mobley attempts a 3Pt. Contested by Michael Ginobili (4.5 feet, ZONE). Terry Mobley misses. Rebound secured by Michael Ginobili.

[04:11] Team_022 possession (Score: 92-101)
Lamelo Dosunmu attempts a 3Pt. Wide open! Scottie Herro is 6.0 feet away. [MAN] Lamelo Dosunmu misses. FOUL! Loose ball foul on Devin Griffin during the rebound battle. [IN THE BONUS! 6 team fouls] Dirk Markkanen to the line for 2 free throws. (Devin Griffin: 2 personal fouls)   FT 1/2: GOOD   FT 2/2: MISS Dirk Markkanen makes 1/2 from the line. Rebound secured by Scottie Herro.
Score: 92-102

[03:56] Team_096 possession (Score: 92-102)
Cole Holiday attempts a 3Pt. Contested by Michael Ginobili (4.8 feet, ZONE). Cole Holiday misses. Rebound secured by Michael Ginobili.

[03:39] Team_022 possession (Score: 92-102)
Lamelo Dosunmu attempts a Layup. Wide open! Scottie Herro is 6.1 feet away. [MAN] LAMELO DOSUNMU MAKES IT!
Score: 92-104

[03:27] Team_096 possession (Score: 92-104)
Devin Griffin drives to the basket... Devin Griffin loses the ball! Stripped by Lamelo Dosunmu! TURNOVER! (live ball)

[03:10] Team_022 possession (Score: 92-104)
Lamelo Dosunmu attempts a Midrange. Wide open! Scottie Herro is 6.1 feet away. [ZONE] Lamelo Dosunmu misses. Rebound secured by Scottie Herro.

[02:59] Team_096 possession (Score: 92-104)
Scottie Herro attempts a 3Pt. Contested by Lamelo Dosunmu (5.9 feet, MAN). Scottie Herro misses. Rebound secured by Myles Anthony.

[02:46] Team_022 possession (Score: 92-104)
Dirk Markkanen attempts a 3Pt. Contested by Lamelo Quickley (5.3 feet, ZONE). Dirk Markkanen misses. FOUL! Loose ball foul on Scottie Herro during the rebound battle. [IN THE BONUS! 7 team fouls] Michael Ginobili to the line for 2 free throws. (Scottie Herro: 4 personal fouls)   FT 1/2: GOOD   FT 2/2: MISS Michael Ginobili makes 1/2 from the line. Rebound secured by Cole Holiday.
Score: 92-105

[02:29] Team_096 possession (Score: 92-105)
Lamelo Quickley attempts a 3Pt. Contested by Myles Anthony (5.1 feet, ZONE). Lamelo Quickley misses. Offensive rebound by Scottie Herro! Scottie Herro kicks it out.

[02:13] Team_096 possession (Score: 92-105)
Lamelo Quickley attempts a 3Pt. Contested by Michael Ginobili (4.3 feet, ZONE). Lamelo Quickley misses. Rebound secured by Michael Ginobili.

[01:55] Team_022 possession (Score: 92-105)
Dirk Markkanen attempts a Midrange. Contested by Terry Mobley (6.0 feet, ZONE). DIRK MARKKANEN MAKES IT!
Score: 92-107

[01:37] Team_096 possession (Score: 92-107)
Devin Griffin attempts a 3Pt. Contested by Michael Ginobili (5.0 feet, ZONE). Devin Griffin misses. Rebound secured by Michael Ginobili.

[01:24] Team_022 possession (Score: 92-107)
Michael Ginobili drives, Lamelo Quickley stays with him. Michael Ginobili attempts a Layup. Contested by Lamelo Quickley (5.2 feet, MAN). MICHAEL GINOBILI MAKES IT! Assist: Dirk Markkanen
Score: 92-109

[01:10] Team_096 possession (Score: 92-109)
Scottie Herro drives, Lamelo Dosunmu stays with him. Scottie Herro attempts a Dunk. Wide open! Lamelo Dosunmu is 6.1 feet away. [MAN] Scottie Herro misses. Offensive rebound by Devin Griffin! Devin Griffin kicks it out.

[00:54] Team_096 possession (Score: 92-109)
Devin Griffin attempts a Midrange. Wide open! Lamelo Dosunmu is 6.3 feet away. [ZONE] Devin Griffin misses. Offensive rebound by Devin Griffin! Devin Griffin kicks it out.

[00:41] Team_096 possession (Score: 92-109)
Lamelo Quickley attempts a Layup. Contested by Dirk Markkanen (5.6 feet, ZONE). LAMELO QUICKLEY MAKES IT!
Score: 94-109

[00:29] Team_022 possession (Score: 94-109)
Dirk Markkanen attempts a Midrange. Contested by Cole Holiday (5.0 feet, ZONE). Dirk Markkanen misses. Rebound secured by Scottie Herro.

[00:17] Team_096 possession (Score: 94-109)
FOUL! Holding foul on Malcolm Allen. [Team fouls: 4] No free throws, side out. (Malcolm Allen: 1 personal fouls)

[00:04] Team_096 possession (Score: 94-109)
Lamelo Quickley attempts a 3Pt. Contested by Michael Ginobili (4.7 feet, ZONE). Lamelo Quickley misses. Rebound secured by Michael Ginobili.

================================================================================
                              4TH QUARTER COMPLETE                              
================================================================================

4TH QUARTER SCORE: Team_096 13, Team_022 25

BOX SCORE:
================================================================================

Team_096
--------------------------------------------------------------------------------
Player                MIN  PTS  REB  AST  TO      FG   FG%      3P   3P%
--------------------------------------------------------------------------------
Lamelo Quickley        35    4    0    0   0   2/5    40.0     0/0   0.0
Cole Griffin           27    3    0    0   0   1/1   100.0     0/0   0.0
Terry Mobley           35    2    0    2   0   1/4    25.0     0/0   0.0
Scottie Herro          35    2    6    1   0   1/3    33.3     0/0   0.0
Kyrie Adebayo          27    0    1    0   0   0/0     0.0     0/0   0.0
Devin Griffin          22    0    4    0   0   0/1     0.0     0/0   0.0

TEAM: FG: 6/16 (37.5%), 3PT: 0/9 (0.0%), REB: 11 (4 off, 7 def), AST: 3, TO: 5
TEAM FOULS: 7 [Team_022 in BONUS]


Team_022
--------------------------------------------------------------------------------
Player                MIN  PTS  REB  AST  TO      FG   FG%      3P   3P%
--------------------------------------------------------------------------------
Lamelo Dosunmu         35   12    0    0   0   5/8    62.5     0/0   0.0
Myles Anthony          35    7    2    1   0   3/3   100.0     0/0   0.0
Dirk Markkanen         35    2    1    2   0   1/5    20.0     0/0   0.0
Cole Holiday           22    2    2    0   0   1/2    50.0     0/0   0.0
Michael Ginobili       35    2    9    1   0   1/2    50.0     0/0   0.0
Malcolm Allen          35    0    0    0   0   0/1     0.0     0/0   0.0

TEAM: FG: 10/19 (52.6%), 3PT: 1/7 (14.3%), REB: 14 (4 off, 10 def), AST: 4, TO: 1
TEAM FOULS: 4

================================================================================

================================================================================
                               FULL GAME COMPLETE                               
================================================================================

FINAL SCORE: Team_096 94, Team_022 109

SCORING BY QUARTER:
--------------------------------------------------------------------------------
Team                     Q1     Q2     Q3     Q4    FINAL
--------------------------------------------------------------------------------
Team_096                 27     31     23     13       94
Team_022                 26     20     38     25      109
--------------------------------------------------------------------------------

FULL GAME BOX SCORE:
================================================================================

Team_096
--------------------------------------------------------------------------------
Player                MIN  PTS  REB  AST  TO      FG   FG%      3P   3P%      FT STL BLK
--------------------------------------------------------------------------------
Terry Mobley           35   13    0    6   4   6/14   42.9   2/9    22.2   3/5     0   0
Lamelo Quickley        35    6    0    1   2   3/15   20.0   0/6     0.0   0/0     1   0
Scottie Herro          35    9    9    1   0   5/8    62.5   1/4    25.0   3/4     0   0
Cole Griffin           27    9    2    3   1   3/8    37.5   2/6    33.3   0/0     1   1
Kyrie Adebayo          27   19    8    1   0   5/10   50.0   2/4    50.0   5/7     1   0
Cole Holiday           22   10    2    3   1   4/5    80.0   2/3    66.7   3/3     1   0
Devin Griffin          22    5   10    0   1   5/7    71.4   0/1     0.0   1/2     0   0
Cade Jokic             14    2    0    2   0   1/3    33.3   0/2     0.0   0/0     1   1
Jarrett Markkanen      14    8    6    1   0   1/4    25.0   1/3    33.3   2/2     0   1
Tyler Haliburton       14    8    2    2   0   4/6    66.7   0/0     0.0   2/2     0   0

TEAM: FG: 37/80 (46.2%), 3PT: 10/38 (26.3%), REB: 38 (13 off, 25 def), AST: 20, TO: 9


Team_022
--------------------------------------------------------------------------------
Player                MIN  PTS  REB  AST  TO      FG   FG%      3P   3P%      FT STL BLK
--------------------------------------------------------------------------------
Malcolm Allen          35    2    0    2   2   2/6    33.3   0/4     0.0   0/0     1   0
Michael Ginobili       35   27   17    4   2  10/13   76.9   2/3    66.7   8/9     0   2
Myles Anthony          35   18   12    2   3   8/10   80.0   0/0     0.0   4/4     1   0
Lamelo Dosunmu         35   27    0    1   0  13/17   76.5   2/4    50.0   7/8     1   0
Dirk Markkanen         35   13    8    6   2   5/9    55.6   0/3     0.0   1/2     0   0
DeMar Harden           14   12    0    0   1   3/3   100.0   1/1   100.0   4/4     0   0
Lauri Gobert           14    4    4    0   2   3/6    50.0   0/2     0.0   2/2     0   0
Dejounte Towns         14    2    4    2   0   1/5    20.0   0/4     0.0   0/0     0   0
Kawhi Russell          14    0    2    0   1   0/2     0.0   0/1     0.0   0/0     0   1
Cole Iverson           14    2    0    2   0   1/2    50.0   0/0     0.0   2/2     0   0

TEAM: FG: 47/74 (63.5%), 3PT: 5/22 (22.7%), REB: 47 (7 off, 40 def), AST: 19, TO: 13

================================================================================
