================================================================================
                        FULL GAME - Team_097 vs Team_059                        
================================================================================

================================================================================
                       1ST QUARTER - Team_097 vs Team_059                       
================================================================================

[12:00] Team_097 possession (Score: 0-0)
Evan Brogdon commits a violation (traveling/carry)! TURNOVER! (dead ball)

[11:43] Team_059 possession (Score: 0-0)
Bam Wade drives, picks up Evan Brogdon. Help arrives from Shai Poole! Bam Wade attempts a Dunk. Contested by Shai Poole (5.1 feet, MAN). Bam Wade misses. Rebound secured by Shai Poole.

[11:29] Team_097 possession (Score: 0-0)
Shai Poole drives and kicks out. Tyrese Stewart attempts a 3Pt. Contested by Jarrett Smith (4.5 feet, MAN). TYRESE STEWART MAKES IT! Assist: Evan Brogdon
Score: 3-0

[11:16] Team_059 possession (Score: 3-0)
FOUL! Shooting foul on Shai Poole. Bam Wade to the line for 2 free throws. [Team fouls: 1] (Shai Poole: 1 personal fouls)   FT 1/2: GOOD   FT 2/2: GOOD Bam Wade makes 2/2 from the line.
Score: 3-2

[11:05] Team_097 possession (Score: 3-2)
FOUL! Reach-in foul on Jarrett Smith during the drive. [Team fouls: 1] No free throws, side out. (Jarrett Smith: 1 personal fouls)

[10:47] Team_097 possession (Score: 3-2)
Evan Brogdon attempts a Layup. BLOCKED BY BAM WADE! Ball is loose! Offensive rebound by Tyrese Stewart! Tyrese Stewart kicks it out.

[10:29] Team_097 possession (Score: 3-2)
Anthony Haliburton drives, Jarrett Smith stays with him. Anthony Haliburton attempts a Dunk. Contested by Jarrett Smith (4.9 feet, ZONE). ANTHONY HALIBURTON MAKES IT! Assist: Shai Poole
Score: 5-2

[10:15] Team_059 possession (Score: 5-2)
Nikola Jokic attempts a 3Pt. Contested by Shai Poole (3.5 feet, ZONE). NIKOLA JOKIC MAKES IT! Assist: Blake Tatum
Score: 5-5

[10:01] Team_097 possession (Score: 5-5)
FOUL! Holding foul on John Iverson. [Team fouls: 2] No free throws, side out. (John Iverson: 1 personal fouls)

[09:47] Team_097 possession (Score: 5-5)
Tyrese Stewart attempts a Midrange. Wide open! Nikola Jokic is 6.2 feet away. [ZONE] TYRESE STEWART MAKES IT!
Score: 7-5

[09:30] Team_059 possession (Score: 7-5)
Nikola Jokic attempts a 3Pt. Contested by Anthony Haliburton (3.4 feet, MAN). Nikola Jokic misses. Rebound secured by Anthony Haliburton.

[09:16] Team_097 possession (Score: 7-5)
Shai Poole attempts a 3Pt. Contested by John Iverson (5.9 feet, ZONE). SHAI POOLE MAKES IT! Assist: Evan Brogdon
Score: 10-5

[08:59] Team_059 possession (Score: 10-5)
John Iverson attempts a 3Pt. Contested by Shai Poole (3.5 feet, ZONE). John Iverson misses. Rebound secured by Tyrese Stewart.

[08:47] Team_097 possession (Score: 10-5)
Shai Poole attempts a Midrange. Contested by John Iverson (5.9 feet, MAN). Shai Poole misses. Offensive rebound by Tyrese Stewart! Tyrese Stewart kicks it out.

[08:29] Team_097 possession (Score: 10-5)
FOUL! Shooting foul on John Iverson. Shai Poole to the line for 2 free throws. [Team fouls: 3] (John Iverson: 2 personal fouls)   FT 1/2: GOOD   FT 2/2: MISS Shai Poole makes 1/2 from the line. Offensive rebound by Anthony Haliburton! Anthony Haliburton puts it back in!
Score: 13-5

[08:12] Team_059 possession (Score: 13-5)
Blake Tatum drives, Anthony Haliburton stays with him. Blake Tatum attempts a Dunk. Contested by Anthony Haliburton (3.2 feet, ZONE). Blake Tatum misses. Offensive rebound by Jarrett Smith! Jarrett Smith kicks it out.

[07:54] Team_059 possession (Score: 13-5)
Nikola Jokic throws a bad pass out of bounds! TURNOVER! (dead ball)

[07:39] Team_097 possession (Score: 13-5)
Jrue Haliburton attempts a 3Pt. Contested by Blake Tatum (4.7 feet, MAN). Jrue Haliburton misses. Rebound secured by John Iverson.

[07:23] Team_059 possession (Score: 13-5)
FOUL! Shooting foul on Shai Poole. John Iverson to the line for 3 free throws. [Team fouls: 2] (Shai Poole: 2 personal fouls)   FT 1/3: GOOD   FT 2/3: MISS   FT 3/3: MISS John Iverson makes 1/3 from the line. Rebound secured by Shai Poole.
Score: 13-6

[07:05] Team_097 possession (Score: 13-6)
Jrue Haliburton attempts a Midrange. Contested by Blake Tatum (4.7 feet, ZONE). Jrue Haliburton misses. Rebound secured by John Iverson.

[06:51] Team_059 possession (Score: 13-6)
Blake Tatum attempts a Layup. Contested by Jrue Haliburton (5.1 feet, MAN). BLAKE TATUM MAKES IT! Assist: John Iverson
Score: 13-8

[06:37] Team_097 possession (Score: 13-8)
Jrue Haliburton attempts a Layup. BLOCKED BY BLAKE TATUM! Ball is loose! Offensive rebound by Tyrese Stewart! Tyrese Stewart kicks it out.

[06:20] Team_097 possession (Score: 13-8)
Shai Poole attempts a 3Pt. Contested by Bam Wade (4.3 feet, ZONE). Shai Poole misses. Offensive rebound by Tyrese Stewart! Tyrese Stewart kicks it out.

[06:06] Team_097 possession (Score: 13-8)
FOUL! Reach-in foul on Jarrett Smith during the drive. [Team fouls: 4] No free throws, side out. (Jarrett Smith: 2 personal fouls)

[05:51] Team_097 possession (Score: 13-8)
Jrue Haliburton loses control! Ball rolls out of bounds! TURNOVER! (dead ball)

[05:38] Team_059 possession (Score: 13-8)
Jarrett Smith makes the Layup and draws the foul on Anthony Haliburton! And-1! Jarrett Smith to the line for 1. [Team fouls: 3] (Anthony Haliburton: 1 personal fouls)   FT 1/1: GOOD Jarrett Smith makes 1/1 from the line.
Score: 13-11

[05:19] Team_097 possession (Score: 13-11)
Evan Brogdon attempts a 3Pt. Contested by Bam Wade (4.4 feet, MAN). Evan Brogdon misses. Rebound secured by John Iverson.

[05:07] Team_059 possession (Score: 13-11)
John Iverson attempts a 3Pt. Contested by Shai Poole (3.5 feet, MAN). John Iverson misses. Rebound secured by Tyrese Stewart.

[04:48] Team_097 possession (Score: 13-11)
Tyrese Stewart attempts a Midrange. Contested by Jarrett Smith (5.4 feet, MAN). TYRESE STEWART MAKES IT! Assist: Evan Brogdon
Score: 15-11

[04:30] Team_059 possession (Score: 15-11)
Bam Wade attempts a 3Pt. Contested by Shai Poole (3.9 feet, ZONE). BAM WADE MAKES IT! Assist: Nikola Jokic
Score: 15-14

[04:11] Team_097 possession (Score: 15-14)
Tyrese Stewart attempts a Midrange. Contested by Jarrett Smith (5.4 feet, MAN). TYRESE STEWART MAKES IT! Assist: Evan Brogdon
Score: 17-14

[03:52] Team_059 possession (Score: 17-14)
FOUL! Shooting foul on Jrue Haliburton. Blake Tatum to the line for 2 free throws. [Team fouls: 4] (Jrue Haliburton: 1 personal fouls)   FT 1/2: MISS   FT 2/2: GOOD Blake Tatum makes 1/2 from the line.
Score: 17-15

[03:33] Team_097 possession (Score: 17-15)
Shai Poole drives, John Iverson stays with him. Shai Poole attempts a Layup. Contested by John Iverson (6.0 feet, MAN). Shai Poole misses. Rebound secured by Jarrett Smith.

[03:19] Team_059 possession (Score: 17-15)
Nikola Jokic attempts a 3Pt. Contested by Shai Poole (3.6 feet, ZONE). NIKOLA JOKIC MAKES IT!
Score: 17-18

[03:03] Team_097 possession (Score: 17-18)
Anthony Haliburton attempts a Midrange. Contested by Nikola Jokic (5.9 feet, MAN). ANTHONY HALIBURTON MAKES IT! Assist: Shai Poole
Score: 19-18

[02:50] Team_059 possession (Score: 19-18)
FOUL! Reach-in foul on Anthony Haliburton during the drive. [IN THE BONUS! 5 team fouls] Nikola Jokic to the line for 2 free throws. (Anthony Haliburton: 2 personal fouls)   FT 1/2: GOOD   FT 2/2: GOOD Nikola Jokic makes 2/2 from the line.
Score: 19-20

[02:39] Team_097 possession (Score: 19-20)
Jrue Haliburton attempts a Layup. Contested by Jarrett Smith (5.1 feet, ZONE). Jrue Haliburton misses. Offensive rebound by Anthony Haliburton! Anthony Haliburton kicks it out.

[02:28] Team_097 possession (Score: 19-20)
Jrue Haliburton attempts a 3Pt. Contested by Nikola Jokic (6.0 feet, ZONE). JRUE HALIBURTON MAKES IT! Assist: Evan Brogdon
Score: 22-20

[02:16] Team_059 possession (Score: 22-20)
Nikola Jokic drives, picks up Anthony Haliburton. Help arrives from Jrue Haliburton! Nikola Jokic attempts a Dunk. Contested by Jrue Haliburton (3.7 feet, ZONE). Nikola Jokic misses. Rebound secured by Tyrese Stewart.

[02:01] Team_097 possession (Score: 22-20)
Tyrese Stewart drives, picks up Jarrett Smith. Help arrives from Bam Wade! Tyrese Stewart attempts a Layup. Contested by Bam Wade (5.5 feet, ZONE). Tyrese Stewart misses. FOUL! Loose ball foul on John Iverson during the rebound battle. [IN THE BONUS! 5 team fouls] Tyrese Stewart to the line for 2 free throws. (John Iverson: 3 personal fouls)   FT 1/2: GOOD   FT 2/2: GOOD Tyrese Stewart makes 2/2 from the line.
Score: 24-20

[01:44] Team_059 possession (Score: 24-20)
Blake Tatum attempts a 3Pt. Contested by Jrue Haliburton (5.3 feet, MAN). BLAKE TATUM MAKES IT! Assist: John Iverson
Score: 24-23

[01:32] Team_097 possession (Score: 24-23)
Tyrese Stewart drives to the basket... Tyrese Stewart throws a bad pass! Stolen by Jarrett Smith! TURNOVER! (live ball)

[01:13] Team_059 possession (Score: 24-23)
Nikola Jokic attempts a 3Pt. Contested by Shai Poole (3.9 feet, ZONE). Nikola Jokic misses. Rebound secured by Shai Poole.

[01:04] Team_097 possession (Score: 24-23)
Shai Poole drives and kicks out. Evan Brogdon attempts a Midrange. Contested by Blake Tatum (4.6 feet, ZONE). EVAN BROGDON MAKES IT! Assist: Jrue Haliburton
Score: 26-23

[00:49] Team_059 possession (Score: 26-23)
John Iverson makes the Layup and draws the foul on Jrue Haliburton! And-1! John Iverson to the line for 1. [BONUS: 6 team fouls] (Jrue Haliburton: 2 personal fouls)   FT 1/1: MISS John Iverson makes 0/1 from the line. Offensive rebound by John Iverson! John Iverson kicks it out.
Score: 26-25

[00:38] Team_059 possession (Score: 26-25)
Nikola Jokic drives, Anthony Haliburton stays with him. Nikola Jokic attempts a Layup. Contested by Anthony Haliburton (3.9 feet, ZONE). NIKOLA JOKIC MAKES IT!
Score: 26-27

[00:29] Team_097 possession (Score: 26-27)
Tyrese Stewart makes the Layup and draws the foul on Jarrett Smith! And-1! Tyrese Stewart to the line for 1. [BONUS: 6 team fouls] (Jarrett Smith: 3 personal fouls)   FT 1/1: GOOD Tyrese Stewart makes 1/1 from the line.
Score: 29-27

[00:15] Team_059 possession (Score: 29-27)
John Iverson attempts a 3Pt. Contested by Shai Poole (3.9 feet, ZONE). John Iverson misses. Rebound secured by Shai Poole.

[00:02] Team_097 possession (Score: 29-27)
Tyrese Stewart throws a bad pass out of bounds! TURNOVER! (dead ball)

[00:02] Substitution (Team_097): Evan Brogdon OUT → Gary Carter IN (stamina_rule2)

[00:02] Substitution (Team_097): Jrue Haliburton OUT → Dwyane Ginobili IN (stamina_rule2)

[00:02] Substitution (Team_097): Shai Poole OUT → Miles Dosunmu IN (stamina_rule2)

[00:02] Substitution (Team_097): Anthony Haliburton OUT → Joel Simons IN (stamina_rule2)

[00:02] Substitution (Team_097): Tyrese Stewart OUT → Miles Banchero IN (stamina_rule2)

[00:02] Substitution (Team_059): Bam Wade OUT → Russell Quickley IN (stamina_rule2)

[00:02] Substitution (Team_059): Blake Tatum OUT → Scottie Ginobili IN (stamina_rule2)

[00:02] Substitution (Team_059): John Iverson OUT → Allen Giddey IN (stamina_rule2)

[00:02] Substitution (Team_059): Nikola Jokic OUT → Bones Middleton IN (stamina_rule2)

[00:02] Substitution (Team_059): Jarrett Smith OUT → LeBron Lowry IN (stamina_rule2)

================================================================================
                              1ST QUARTER COMPLETE                              
================================================================================

1ST QUARTER SCORE: Team_097 29, Team_059 27

BOX SCORE:
================================================================================

Team_097
--------------------------------------------------------------------------------
Player                MIN  PTS  REB  AST  TO      FG   FG%      3P   3P%
--------------------------------------------------------------------------------
Tyrese Stewart         12   14    7    0   0   6/6   100.0     0/0   0.0
Anthony Haliburton     12    7    2    0   0   3/3   100.0     0/0   0.0
Shai Poole             12    3    4    2   0   1/2    50.0     0/0   0.0
Jrue Haliburton        12    3    0    1   0   1/3    33.3     0/0   0.0
Evan Brogdon           12    2    0    5   0   1/2    50.0     0/0   0.0

TEAM: FG: 12/16 (75.0%), 3PT: 2/4 (50.0%), REB: 13 (5 off, 8 def), AST: 8, TO: 4
TEAM FOULS: 6 [Team_059 in BONUS]


Team_059
--------------------------------------------------------------------------------
Player                MIN  PTS  REB  AST  TO      FG   FG%      3P   3P%
--------------------------------------------------------------------------------
Nikola Jokic           12   10    0    1   0   4/7    57.1     0/0   0.0
Blake Tatum            12    6    0    1   0   3/3   100.0     0/0   0.0
Bam Wade               12    5    0    0   0   2/3    66.7     0/0   0.0
Jarrett Smith          12    3    2    0   0   1/1   100.0     0/0   0.0
John Iverson           12    0    4    2   0   0/4     0.0     0/0   0.0

TEAM: FG: 10/18 (55.6%), 3PT: 4/10 (40.0%), REB: 6 (2 off, 4 def), AST: 4, TO: 1
TEAM FOULS: 6 [Team_097 in BONUS]

================================================================================

================================================================================
                       2ND QUARTER - Team_097 vs Team_059                       
================================================================================

[12:00] Team_097 possession (Score: 29-27)
Evan Brogdon drives, Bam Wade stays with him. Evan Brogdon attempts a Layup. Contested by Bam Wade (4.7 feet, MAN). Evan Brogdon misses. Rebound secured by Jarrett Smith.

[11:41] Team_059 possession (Score: 29-27)
Bam Wade drives, picks up Evan Brogdon. Help arrives from Shai Poole! Bam Wade attempts a Layup. Contested by Shai Poole (5.4 feet, MAN). BAM WADE MAKES IT! Assist: Jarrett Smith
Score: 29-29

[11:27] Team_097 possession (Score: 29-29)
Shai Poole attempts a Midrange. Contested by Jarrett Smith (5.3 feet, ZONE). Shai Poole misses. Rebound secured by Bam Wade.

[11:11] Team_059 possession (Score: 29-29)
Nikola Jokic makes the Dunk and draws the foul on Jrue Haliburton! And-1! Nikola Jokic to the line for 1. [Team fouls: 1] (Jrue Haliburton: 1 personal fouls)   FT 1/1: GOOD Nikola Jokic makes 1/1 from the line.
Score: 29-32

[11:00] Team_097 possession (Score: 29-32)
Tyrese Stewart makes the Layup and draws the foul on Jarrett Smith! And-1! Tyrese Stewart to the line for 1. [Team fouls: 1] (Jarrett Smith: 1 personal fouls)   FT 1/1: GOOD Tyrese Stewart makes 1/1 from the line.
Score: 32-32

[10:41] Team_059 possession (Score: 32-32)
FOUL! Offensive foul on Bam Wade! Evan Brogdon drew the charge! [Team fouls: 2] (Bam Wade: 1 personal fouls) TURNOVER! (dead ball)

[10:24] Team_097 possession (Score: 32-32)
Tyrese Stewart attempts a 3Pt. Contested by Jarrett Smith (5.6 feet, MAN). Tyrese Stewart misses. Rebound secured by Nikola Jokic.

[10:10] Team_059 possession (Score: 32-32)
Jarrett Smith drives, Anthony Haliburton stays with him. Jarrett Smith attempts a Dunk. Contested by Anthony Haliburton (4.2 feet, MAN). JARRETT SMITH MAKES IT! Assist: Blake Tatum
Score: 32-34

[09:54] Team_097 possession (Score: 32-34)
Jrue Haliburton makes the Layup and draws the foul on Jarrett Smith! And-1! Jrue Haliburton to the line for 1. [Team fouls: 3] (Jarrett Smith: 2 personal fouls)   FT 1/1: GOOD Jrue Haliburton makes 1/1 from the line.
Score: 35-34

[09:38] Team_059 possession (Score: 35-34)
Bam Wade attempts a 3Pt. Contested by Shai Poole (4.4 feet, ZONE). BAM WADE MAKES IT! Assist: Jarrett Smith
Score: 35-37

[09:21] Team_097 possession (Score: 35-37)
Shai Poole drives to the basket... Shai Poole commits a violation (traveling/carry)! TURNOVER! (dead ball)

[09:21] Substitution (Team_097): Evan Brogdon OUT → Gary Carter IN (stamina_rule2)

[09:21] Substitution (Team_097): Jrue Haliburton OUT → Dwyane Ginobili IN (stamina_rule2)

[09:21] Substitution (Team_097): Shai Poole OUT → Miles Dosunmu IN (stamina_rule2)

[09:21] Substitution (Team_097): Anthony Haliburton OUT → Joel Simons IN (stamina_rule2)

[09:21] Substitution (Team_097): Tyrese Stewart OUT → Miles Banchero IN (stamina_rule2)

[09:21] Substitution (Team_059): Bam Wade OUT → Russell Quickley IN (stamina_rule2)

[09:21] Substitution (Team_059): Blake Tatum OUT → Scottie Ginobili IN (stamina_rule2)

[09:21] Substitution (Team_059): John Iverson OUT → Allen Giddey IN (stamina_rule2)

[09:21] Substitution (Team_059): Nikola Jokic OUT → Bones Middleton IN (stamina_rule2)

[09:21] Substitution (Team_059): Jarrett Smith OUT → LeBron Lowry IN (stamina_rule2)

[09:06] Team_059 possession (Score: 35-37)
FOUL! Reach-in foul on Joel Simons during the drive. [Team fouls: 2] No free throws, side out. (Joel Simons: 1 personal fouls)

[08:53] Team_059 possession (Score: 35-37)
Bones Middleton drives, picks up Joel Simons. Help arrives from Dwyane Ginobili! Bones Middleton attempts a Dunk. Contested by Dwyane Ginobili (3.9 feet, MAN). BONES MIDDLETON MAKES IT! Assist: LeBron Lowry
Score: 35-39

[08:37] Team_097 possession (Score: 35-39)
Gary Carter throws a bad pass! Stolen by Russell Quickley! TURNOVER! (live ball)

[08:25] Team_059 possession (Score: 35-39)
LeBron Lowry drives, picks up Joel Simons. Help arrives from Dwyane Ginobili! LeBron Lowry attempts a Layup. Contested by Dwyane Ginobili (3.7 feet, MAN). LeBron Lowry misses. Rebound secured by Miles Banchero.

[08:11] Team_097 possession (Score: 35-39)
Dwyane Ginobili attempts a Midrange. Contested by Russell Quickley (4.3 feet, ZONE). Dwyane Ginobili misses. Rebound secured by LeBron Lowry.

[07:59] Team_059 possession (Score: 35-39)
LeBron Lowry drives and kicks out. Allen Giddey attempts a 3Pt. Contested by Joel Simons (3.6 feet, ZONE). Allen Giddey misses. Rebound secured by Miles Dosunmu.

[07:45] Team_097 possession (Score: 35-39)
Gary Carter makes the Dunk and draws the foul on Russell Quickley! And-1! Gary Carter to the line for 1. [Team fouls: 4] (Russell Quickley: 1 personal fouls)   FT 1/1: GOOD Gary Carter makes 1/1 from the line.
Score: 38-39

[07:31] Team_059 possession (Score: 38-39)
Russell Quickley attempts a 3Pt. Contested by Joel Simons (3.9 feet, ZONE). Russell Quickley misses. Rebound secured by Miles Dosunmu.

[07:15] Team_097 possession (Score: 38-39)
Gary Carter attempts a 3Pt. Contested by Russell Quickley (4.2 feet, ZONE). GARY CARTER MAKES IT! Assist: Dwyane Ginobili
Score: 41-39

[07:01] Team_059 possession (Score: 41-39)
FOUL! Holding foul on Gary Carter. [Team fouls: 3] No free throws, side out. (Gary Carter: 1 personal fouls)

[06:47] Team_059 possession (Score: 41-39)
Russell Quickley attempts a 3Pt. Contested by Joel Simons (3.9 feet, ZONE). Russell Quickley misses. Rebound secured by Miles Dosunmu.

[06:33] Team_097 possession (Score: 41-39)
FOUL! Shooting foul on Bones Middleton. Gary Carter to the line for 2 free throws. [BONUS: 5 team fouls] (Bones Middleton: 1 personal fouls)   FT 1/2: GOOD   FT 2/2: MISS Gary Carter makes 1/2 from the line. Rebound secured by Bones Middleton.
Score: 42-39

[06:19] Team_059 possession (Score: 42-39)
Allen Giddey attempts a Midrange. Contested by Miles Dosunmu (3.7 feet, MAN). Allen Giddey misses. Offensive rebound by Scottie Ginobili! Scottie Ginobili kicks it out.

[06:03] Team_059 possession (Score: 42-39)
Scottie Ginobili attempts a Midrange. Contested by Joel Simons (4.1 feet, ZONE). SCOTTIE GINOBILI MAKES IT!
Score: 42-41

[05:52] Team_097 possession (Score: 42-41)
Dwyane Ginobili throws a bad pass out of bounds! TURNOVER! (dead ball)

[05:37] Team_059 possession (Score: 42-41)
Russell Quickley attempts a 3Pt. Contested by Joel Simons (3.9 feet, ZONE). RUSSELL QUICKLEY MAKES IT!
Score: 42-44

[05:22] Team_097 possession (Score: 42-44)
Joel Simons attempts a Layup. Contested by Bones Middleton (4.7 feet, ZONE). Joel Simons misses. Offensive rebound by Joel Simons! Joel Simons kicks it out.

[05:10] Team_097 possession (Score: 42-44)
FOUL! Holding foul on LeBron Lowry. [IN THE BONUS! 6 team fouls] Miles Banchero to the line for 2 free throws. (LeBron Lowry: 1 personal fouls)   FT 1/2: GOOD   FT 2/2: GOOD Miles Banchero makes 2/2 from the line.
Score: 44-44

[05:00] Team_059 possession (Score: 44-44)
Bones Middleton attempts a Layup. Contested by Joel Simons (3.9 feet, MAN). BONES MIDDLETON MAKES IT! Assist: LeBron Lowry
Score: 44-46

[04:48] Team_097 possession (Score: 44-46)
Joel Simons drives, Bones Middleton stays with him. Joel Simons attempts a Layup. Contested by Bones Middleton (4.7 feet, ZONE). JOEL SIMONS MAKES IT! Assist: Gary Carter
Score: 46-46

[04:36] Team_059 possession (Score: 46-46)
LeBron Lowry attempts a Midrange. Contested by Dwyane Ginobili (4.7 feet, ZONE). LeBron Lowry misses. Rebound secured by Joel Simons.

[04:23] Team_097 possession (Score: 46-46)
Miles Banchero attempts a Layup. Contested by Bones Middleton (4.7 feet, ZONE). Miles Banchero misses. Offensive rebound by Miles Dosunmu! Miles Dosunmu kicks it out.

[04:08] Team_097 possession (Score: 46-46)
Gary Carter drives and kicks out. Gary Carter attempts a 3Pt. Contested by Russell Quickley (4.4 feet, MAN). Gary Carter misses. Rebound secured by LeBron Lowry.

[03:52] Team_059 possession (Score: 46-46)
Russell Quickley attempts a 3Pt. Contested by Gary Carter (5.1 feet, MAN). Russell Quickley misses. Offensive rebound by Bones Middleton! Bones Middleton kicks it out.

[03:38] Team_059 possession (Score: 46-46)
Scottie Ginobili drives to the basket... Scottie Ginobili throws a bad pass out of bounds! TURNOVER! (dead ball)

[03:22] Team_097 possession (Score: 46-46)
Dwyane Ginobili drives, Bones Middleton stays with him. Dwyane Ginobili attempts a Layup. Contested by Bones Middleton (4.4 feet, ZONE). DWYANE GINOBILI MAKES IT! Assist: Miles Dosunmu
Score: 48-46

[03:09] Team_059 possession (Score: 48-46)
Allen Giddey commits a violation (traveling/carry)! TURNOVER! (dead ball)

[02:56] Team_097 possession (Score: 48-46)
Miles Banchero drives and kicks out. Dwyane Ginobili attempts a Midrange. Contested by Scottie Ginobili (4.5 feet, MAN). DWYANE GINOBILI MAKES IT!
Score: 50-46

[02:45] Team_059 possession (Score: 50-46)
Bones Middleton drives and kicks out. Allen Giddey attempts a 3Pt. Contested by Miles Dosunmu (3.8 feet, MAN). Allen Giddey misses. Offensive rebound by Scottie Ginobili! Scottie Ginobili kicks it out.

[02:33] Team_059 possession (Score: 50-46)
FOUL! Holding foul on Gary Carter. [Team fouls: 4] No free throws, side out. (Gary Carter: 2 personal fouls)

[02:15] Team_059 possession (Score: 50-46)
Russell Quickley drives to the basket... Russell Quickley commits a violation (traveling/carry)! TURNOVER! (dead ball)

[01:58] Team_097 possession (Score: 50-46)
Joel Simons attempts a Midrange. Contested by Bones Middleton (4.9 feet, MAN). Joel Simons misses. FOUL! Loose ball foul on Bones Middleton during the rebound battle. [IN THE BONUS! 7 team fouls] Miles Dosunmu to the line for 2 free throws. (Bones Middleton: 2 personal fouls)   FT 1/2: MISS   FT 2/2: GOOD Miles Dosunmu makes 1/2 from the line.
Score: 51-46

[01:42] Team_059 possession (Score: 51-46)
FOUL! Shooting foul on Miles Dosunmu. Scottie Ginobili to the line for 2 free throws. [BONUS: 5 team fouls] (Miles Dosunmu: 1 personal fouls)   FT 1/2: GOOD   FT 2/2: GOOD Scottie Ginobili makes 2/2 from the line.
Score: 51-48

[01:28] Team_097 possession (Score: 51-48)
Gary Carter attempts a Midrange. Contested by Russell Quickley (4.4 feet, ZONE). Gary Carter misses. Rebound secured by LeBron Lowry.

[01:12] Team_059 possession (Score: 51-48)
Scottie Ginobili attempts a Midrange. Contested by Joel Simons (4.2 feet, ZONE). Scottie Ginobili misses. Rebound secured by Joel Simons.

[00:57] Team_097 possession (Score: 51-48)
Miles Dosunmu drives, Bones Middleton stays with him. Miles Dosunmu attempts a Dunk. Contested by Bones Middleton (5.3 feet, ZONE). MILES DOSUNMU MAKES IT!
Score: 53-48

[00:41] Team_059 possession (Score: 53-48)
Scottie Ginobili attempts a 3Pt. Contested by Joel Simons (4.3 feet, ZONE). SCOTTIE GINOBILI MAKES IT! Assist: Allen Giddey
Score: 53-51

[00:28] Team_097 possession (Score: 53-51)
Miles Banchero attempts a Midrange. Contested by LeBron Lowry (5.1 feet, MAN). MILES BANCHERO MAKES IT!
Score: 55-51

[00:18] Team_059 possession (Score: 55-51)
FOUL! Shooting foul on Joel Simons. Allen Giddey to the line for 2 free throws. [BONUS: 6 team fouls] (Joel Simons: 2 personal fouls)   FT 1/2: GOOD   FT 2/2: GOOD Allen Giddey makes 2/2 from the line.
Score: 55-53

[00:01] Team_097 possession (Score: 55-53)
Miles Banchero drives to the basket... Miles Banchero throws a bad pass! Stolen by Bones Middleton! TURNOVER! (live ball)

================================================================================
                              2ND QUARTER COMPLETE                              
================================================================================

2ND QUARTER SCORE: Team_097 26, Team_059 26

BOX SCORE:
================================================================================

Team_097
--------------------------------------------------------------------------------
Player                MIN  PTS  REB  AST  TO      FG   FG%      3P   3P%
--------------------------------------------------------------------------------
Gary Carter             9    6    0    1   0   2/5    40.0     0/0   0.0
Miles Banchero          9    4    1    0   0   2/2   100.0     0/0   0.0
Dwyane Ginobili         9    4    0    1   0   2/3    66.7     0/0   0.0
Tyrese Stewart         15    3    0    0   0   1/2    50.0     0/0   0.0
Jrue Haliburton        15    3    0    0   0   1/1   100.0     0/0   0.0
Miles Dosunmu           9    3    4    1   0   2/2   100.0     0/0   0.0
Joel Simons             9    2    3    0   0   1/1   100.0     0/0   0.0
Evan Brogdon           15    0    0    0   0   0/1     0.0     0/0   0.0
Shai Poole             15    0    0    0   0   0/1     0.0     0/0   0.0

TEAM: FG: 11/18 (61.1%), 3PT: 1/2 (50.0%), REB: 8 (2 off, 6 def), AST: 3, TO: 4
TEAM FOULS: 6 [Team_059 in BONUS]


Team_059
--------------------------------------------------------------------------------
Player                MIN  PTS  REB  AST  TO      FG   FG%      3P   3P%
--------------------------------------------------------------------------------
Scottie Ginobili        9    7    2    0   0   3/4    75.0     0/0   0.0
Bam Wade               15    5    1    0   0   2/2   100.0     0/0   0.0
Bones Middleton         9    4    2    0   0   2/2   100.0     0/0   0.0
Nikola Jokic           15    3    1    0   0   1/1   100.0     0/0   0.0
Russell Quickley        9    3    0    0   0   1/3    33.3     0/0   0.0
Jarrett Smith          15    2    1    2   0   1/1   100.0     0/0   0.0
Allen Giddey            9    2    0    1   0   1/1   100.0     0/0   0.0
Blake Tatum            15    0    0    1   0   0/0     0.0     0/0   0.0
LeBron Lowry            9    0    3    2   0   0/3     0.0     0/0   0.0

TEAM: FG: 11/17 (64.7%), 3PT: 3/5 (60.0%), REB: 10 (3 off, 7 def), AST: 6, TO: 4
TEAM FOULS: 7 [Team_097 in BONUS]

================================================================================

================================================================================
                       3RD QUARTER - Team_097 vs Team_059                       
================================================================================

[12:00] Team_097 possession (Score: 55-53)
Jrue Haliburton makes the Layup and draws the foul on Blake Tatum! And-1! Jrue Haliburton to the line for 1. [Team fouls: 1] (Blake Tatum: 1 personal fouls)   FT 1/1: GOOD Jrue Haliburton makes 1/1 from the line.
Score: 58-53

[11:49] Team_059 possession (Score: 58-53)
Bam Wade attempts a 3Pt. Contested by Shai Poole (3.9 feet, ZONE). BAM WADE MAKES IT! Assist: Jarrett Smith
Score: 58-56

[11:33] Team_097 possession (Score: 58-56)
Anthony Haliburton attempts a Midrange. Contested by Nikola Jokic (5.8 feet, MAN). Anthony Haliburton misses. Rebound secured by Jarrett Smith.

[11:17] Team_059 possession (Score: 58-56)
John Iverson drives to the basket... FOUL! Offensive foul on John Iverson! Anthony Haliburton drew the charge! [Team fouls: 2] (John Iverson: 1 personal fouls) TURNOVER! (dead ball)

[10:58] Team_097 possession (Score: 58-56)
Evan Brogdon attempts a Midrange. Contested by John Iverson (6.0 feet, ZONE). Evan Brogdon misses. Rebound secured by Bam Wade.

[10:45] Team_059 possession (Score: 58-56)
Nikola Jokic throws a bad pass! Stolen by Anthony Haliburton! TURNOVER! (live ball)

[10:30] Team_097 possession (Score: 58-56)
Tyrese Stewart drives, Jarrett Smith stays with him. Tyrese Stewart attempts a Layup. Contested by Jarrett Smith (5.4 feet, ZONE). Tyrese Stewart misses. Offensive rebound by Anthony Haliburton! Anthony Haliburton puts it back in!
Score: 60-56

[10:17] Team_059 possession (Score: 60-56)
Blake Tatum attempts a 3Pt. Contested by Shai Poole (3.3 feet, ZONE). Blake Tatum misses. Rebound secured by Tyrese Stewart.

[10:02] Team_097 possession (Score: 60-56)
Shai Poole attempts a 3Pt. Contested by John Iverson (5.9 feet, MAN). Shai Poole misses. Rebound secured by John Iverson.

[09:47] Team_059 possession (Score: 60-56)
John Iverson attempts a Midrange. Contested by Shai Poole (3.5 feet, ZONE). John Iverson misses. Rebound secured by Shai Poole.

[09:31] Team_097 possession (Score: 60-56)
Shai Poole drives and kicks out. Evan Brogdon attempts a 3Pt. Contested by Bam Wade (3.7 feet, ZONE). Evan Brogdon misses. Offensive rebound by Tyrese Stewart! Tyrese Stewart kicks it out.

[09:17] Team_097 possession (Score: 60-56)
Evan Brogdon attempts a Midrange. Wide open! Nikola Jokic is 6.1 feet away. [ZONE] EVAN BROGDON MAKES IT!
Score: 62-56

[09:04] Team_059 possession (Score: 62-56)
FOUL! Shooting foul on Jrue Haliburton. Nikola Jokic to the line for 2 free throws. [Team fouls: 1] (Jrue Haliburton: 1 personal fouls)   FT 1/2: GOOD   FT 2/2: GOOD Nikola Jokic makes 2/2 from the line.
Score: 62-58

[08:49] Team_097 possession (Score: 62-58)
FOUL! Offensive foul on Jrue Haliburton! Blake Tatum drew the charge! [Team fouls: 2] (Jrue Haliburton: 2 personal fouls) TURNOVER! (dead ball)

[08:31] Team_059 possession (Score: 62-58)
John Iverson attempts a Midrange. Contested by Shai Poole (3.5 feet, MAN). JOHN IVERSON MAKES IT! Assist: Bam Wade
Score: 62-60

[08:18] Team_097 possession (Score: 62-60)
Anthony Haliburton drives, picks up Jarrett Smith. Help arrives from Bam Wade! Anthony Haliburton attempts a Dunk. Contested by Bam Wade (4.9 feet, ZONE). ANTHONY HALIBURTON MAKES IT! Assist: Evan Brogdon
Score: 64-60

[08:04] Team_059 possession (Score: 64-60)
Bam Wade attempts a 3Pt. Contested by Evan Brogdon (5.1 feet, MAN). Bam Wade misses. Rebound secured by Tyrese Stewart.

[07:46] Team_097 possession (Score: 64-60)
FOUL! Reach-in foul on Jarrett Smith during the drive. [Team fouls: 3] No free throws, side out. (Jarrett Smith: 1 personal fouls)

[07:32] Team_097 possession (Score: 64-60)
Tyrese Stewart attempts a Layup. Wide open! Nikola Jokic is 6.2 feet away. [ZONE] TYRESE STEWART MAKES IT!
Score: 66-60

[07:21] Team_059 possession (Score: 66-60)
Bam Wade attempts a 3Pt. Contested by Evan Brogdon (5.1 feet, MAN). Bam Wade misses. Rebound secured by Shai Poole.

[07:05] Team_097 possession (Score: 66-60)
Evan Brogdon attempts a Layup. Contested by Bam Wade (4.4 feet, MAN). EVAN BROGDON MAKES IT! Assist: Jrue Haliburton
Score: 68-60

[06:54] Team_059 possession (Score: 68-60)
Blake Tatum attempts a Midrange. Contested by Jrue Haliburton (5.1 feet, MAN). Blake Tatum misses. Offensive rebound by Jarrett Smith! Jarrett Smith kicks it out.

[06:40] Team_059 possession (Score: 68-60)
FOUL! Holding foul on Shai Poole. [Team fouls: 3] No free throws, side out. (Shai Poole: 1 personal fouls)

[06:21] Team_059 possession (Score: 68-60)
Blake Tatum drives and kicks out. Nikola Jokic attempts a 3Pt. BLOCKED BY JRUE HALIBURTON! Ball deflects out of bounds off Nikola Jokic.

[06:06] Team_097 possession (Score: 68-60)
Tyrese Stewart attempts a Midrange. Wide open! John Iverson is 6.2 feet away. [ZONE] TYRESE STEWART MAKES IT! Assist: Evan Brogdon
Score: 70-60

[05:54] Team_059 possession (Score: 70-60)
Blake Tatum attempts a 3Pt. Contested by Shai Poole (3.3 feet, ZONE). Blake Tatum misses. Rebound secured by Anthony Haliburton.

[05:40] Team_097 possession (Score: 70-60)
FOUL! Shooting foul on Jarrett Smith. Tyrese Stewart to the line for 2 free throws. [Team fouls: 4] (Jarrett Smith: 2 personal fouls)   FT 1/2: GOOD   FT 2/2: GOOD Tyrese Stewart makes 2/2 from the line.
Score: 72-60

[05:23] Team_059 possession (Score: 72-60)
FOUL! Shooting foul on Anthony Haliburton. Nikola Jokic to the line for 3 free throws. [Team fouls: 4] (Anthony Haliburton: 1 personal fouls)   FT 1/3: GOOD   FT 2/3: GOOD   FT 3/3: GOOD Nikola Jokic makes 3/3 from the line.
Score: 72-63

[05:05] Team_097 possession (Score: 72-63)
Anthony Haliburton attempts a Midrange. Contested by Nikola Jokic (5.8 feet, ZONE). Anthony Haliburton misses. Rebound secured by John Iverson.

[04:48] Team_059 possession (Score: 72-63)
FOUL! Offensive foul on Blake Tatum! Jrue Haliburton drew the charge! [Team fouls: 5] (Blake Tatum: 2 personal fouls) TURNOVER! (dead ball)

[04:33] Team_097 possession (Score: 72-63)
Shai Poole attempts a 3Pt. Contested by Bam Wade (4.3 feet, ZONE). SHAI POOLE MAKES IT! Assist: Evan Brogdon
Score: 75-63

[04:16] Team_059 possession (Score: 75-63)
Nikola Jokic attempts a Layup. Contested by Anthony Haliburton (3.5 feet, ZONE). Nikola Jokic misses. Rebound secured by Tyrese Stewart.

[04:01] Team_097 possession (Score: 75-63)
Jrue Haliburton makes the Layup and draws the foul on Blake Tatum! And-1! Jrue Haliburton to the line for 1. [BONUS: 6 team fouls] (Blake Tatum: 3 personal fouls)   FT 1/1: GOOD Jrue Haliburton makes 1/1 from the line.
Score: 78-63

[03:46] Team_059 possession (Score: 78-63)
Nikola Jokic attempts a 3Pt. Contested by Shai Poole (3.6 feet, ZONE). Nikola Jokic misses. Rebound secured by Shai Poole.

[03:30] Team_097 possession (Score: 78-63)
Jrue Haliburton loses the ball! Stripped by Blake Tatum! TURNOVER! (live ball)

[03:17] Team_059 possession (Score: 78-63)
Nikola Jokic drives, Anthony Haliburton stays with him. Nikola Jokic attempts a Dunk. Contested by Anthony Haliburton (3.6 feet, MAN). Nikola Jokic misses. Rebound secured by Tyrese Stewart.

[03:03] Team_097 possession (Score: 78-63)
Jrue Haliburton attempts a 3Pt. Contested by Bam Wade (4.4 feet, ZONE). JRUE HALIBURTON MAKES IT! Assist: Shai Poole
Score: 81-63

[02:49] Team_059 possession (Score: 81-63)
Blake Tatum attempts a 3Pt. Contested by Jrue Haliburton (5.3 feet, MAN). Blake Tatum misses. Rebound secured by Tyrese Stewart.

[02:36] Team_097 possession (Score: 81-63)
Jrue Haliburton attempts a Midrange. Contested by John Iverson (6.0 feet, ZONE). JRUE HALIBURTON MAKES IT! Assist: Evan Brogdon
Score: 83-63

[02:25] Team_059 possession (Score: 83-63)
Blake Tatum attempts a Layup. Contested by Anthony Haliburton (3.5 feet, ZONE). BLAKE TATUM MAKES IT! Assist: John Iverson
Score: 83-65

[02:07] Team_097 possession (Score: 83-65)
Evan Brogdon drives and kicks out. Tyrese Stewart attempts a 3Pt. Contested by Blake Tatum (4.5 feet, ZONE). Tyrese Stewart misses. Rebound secured by Jarrett Smith.

[01:54] Team_059 possession (Score: 83-65)
FOUL! Holding foul on Anthony Haliburton. [IN THE BONUS! 5 team fouls] Nikola Jokic to the line for 2 free throws. (Anthony Haliburton: 2 personal fouls)   FT 1/2: GOOD   FT 2/2: GOOD Nikola Jokic makes 2/2 from the line.
Score: 83-67

[01:39] Team_097 possession (Score: 83-67)
Anthony Haliburton drives to the basket... Anthony Haliburton throws a bad pass! Stolen by Jarrett Smith! TURNOVER! (live ball)

[01:21] Team_059 possession (Score: 83-67)
Blake Tatum drives, Jrue Haliburton stays with him. Blake Tatum attempts a Dunk. Contested by Jrue Haliburton (5.4 feet, MAN). BLAKE TATUM MAKES IT! Assist: Nikola Jokic
Score: 83-69

[01:08] Team_097 possession (Score: 83-69)
Shai Poole attempts a Layup. Wide open! John Iverson is 6.2 feet away. [MAN] SHAI POOLE MAKES IT!
Score: 85-69

[00:58] Team_059 possession (Score: 85-69)
Blake Tatum throws a bad pass! Stolen by Jrue Haliburton! TURNOVER! (live ball)

[00:39] Team_097 possession (Score: 85-69)
Anthony Haliburton drives to the basket... Anthony Haliburton throws a bad pass! Stolen by Nikola Jokic! TURNOVER! (live ball)

[00:24] Team_059 possession (Score: 85-69)
FOUL! Reach-in foul on Anthony Haliburton during the drive. [IN THE BONUS! 6 team fouls] Jarrett Smith to the line for 2 free throws. (Anthony Haliburton: 3 personal fouls)   FT 1/2: GOOD   FT 2/2: GOOD Jarrett Smith makes 2/2 from the line.
Score: 85-71

[00:11] Team_097 possession (Score: 85-71)
Tyrese Stewart attempts a Layup. Contested by Jarrett Smith (5.7 feet, ZONE). TYRESE STEWART MAKES IT! Assist: Anthony Haliburton
Score: 87-71

================================================================================
                              3RD QUARTER COMPLETE                              
================================================================================

3RD QUARTER SCORE: Team_097 32, Team_059 18

BOX SCORE:
================================================================================

Team_097
--------------------------------------------------------------------------------
Player                MIN  PTS  REB  AST  TO      FG   FG%      3P   3P%
--------------------------------------------------------------------------------
Jrue Haliburton        27   11    0    1   0   4/4   100.0     0/0   0.0
Tyrese Stewart         27    8    6    0   0   4/4   100.0     0/0   0.0
Shai Poole             27    5    3    1   0   2/3    66.7     0/0   0.0
Anthony Haliburton     27    4    2    1   0   2/4    50.0     0/0   0.0
Evan Brogdon           27    4    0    4   0   2/4    50.0     0/0   0.0

TEAM: FG: 14/19 (73.7%), 3PT: 2/3 (66.7%), REB: 11 (2 off, 9 def), AST: 7, TO: 4
TEAM FOULS: 6 [Team_059 in BONUS]


Team_059
--------------------------------------------------------------------------------
Player                MIN  PTS  REB  AST  TO      FG   FG%      3P   3P%
--------------------------------------------------------------------------------
Nikola Jokic           27    7    0    1   0   3/6    50.0     0/0   0.0
Blake Tatum            27    4    0    0   0   2/6    33.3     0/0   0.0
Bam Wade               27    3    1    1   0   1/3    33.3     0/0   0.0
Jarrett Smith          27    2    3    1   0   1/1   100.0     0/0   0.0
John Iverson           27    2    2    1   0   1/2    50.0     0/0   0.0

TEAM: FG: 8/18 (44.4%), 3PT: 2/8 (25.0%), REB: 6 (1 off, 5 def), AST: 4, TO: 4
TEAM FOULS: 6 [Team_097 in BONUS]

================================================================================

================================================================================
                       4TH QUARTER - Team_097 vs Team_059                       
================================================================================

[12:00] Team_097 possession (Score: 87-71)
Jrue Haliburton attempts a Layup. Contested by Blake Tatum (4.9 feet, MAN). Jrue Haliburton misses. Rebound secured by Bam Wade.

[11:45] Team_059 possession (Score: 87-71)
Blake Tatum attempts a 3Pt. Contested by Shai Poole (3.6 feet, ZONE). Blake Tatum misses. Rebound secured by Anthony Haliburton.

[11:27] Team_097 possession (Score: 87-71)
Evan Brogdon attempts a 3Pt. Contested by Bam Wade (4.7 feet, MAN). Evan Brogdon misses. FOUL! Loose ball foul on Jarrett Smith during the rebound battle. [Team fouls: 1] No free throws, side out. (Jarrett Smith: 1 personal fouls)

[11:07] Team_097 possession (Score: 87-71)
FOUL! Reach-in foul on Nikola Jokic during the drive. [Team fouls: 2] No free throws, side out. (Nikola Jokic: 1 personal fouls)

[10:48] Team_097 possession (Score: 87-71)
Jrue Haliburton attempts a Midrange. Contested by Blake Tatum (5.0 feet, MAN). JRUE HALIBURTON MAKES IT! Assist: Tyrese Stewart
Score: 89-71

[10:37] Team_059 possession (Score: 89-71)
Jarrett Smith commits a violation (traveling/carry)! TURNOVER! (dead ball)

[10:37] Substitution (Team_097): Evan Brogdon OUT → Gary Carter IN (stamina_rule2)

[10:37] Substitution (Team_097): Jrue Haliburton OUT → Dwyane Ginobili IN (stamina_rule2)

[10:37] Substitution (Team_097): Shai Poole OUT → Miles Dosunmu IN (stamina_rule2)

[10:37] Substitution (Team_097): Anthony Haliburton OUT → Joel Simons IN (stamina_rule2)

[10:37] Substitution (Team_097): Tyrese Stewart OUT → Miles Banchero IN (stamina_rule2)

[10:37] Substitution (Team_059): Bam Wade OUT → Russell Quickley IN (stamina_rule2)

[10:37] Substitution (Team_059): Blake Tatum OUT → Scottie Ginobili IN (stamina_rule2)

[10:37] Substitution (Team_059): John Iverson OUT → Allen Giddey IN (stamina_rule2)

[10:37] Substitution (Team_059): Nikola Jokic OUT → Bones Middleton IN (stamina_rule2)

[10:37] Substitution (Team_059): Jarrett Smith OUT → LeBron Lowry IN (stamina_rule2)

[10:21] Team_097 possession (Score: 89-71)
Miles Banchero drives to the basket... Miles Banchero loses the ball! Stripped by LeBron Lowry! TURNOVER! (live ball)

[10:04] Team_059 possession (Score: 89-71)
Bones Middleton attempts a Layup. Contested by Joel Simons (3.9 feet, MAN). BONES MIDDLETON MAKES IT!
Score: 89-73

[09:52] Team_097 possession (Score: 89-73)
Miles Dosunmu attempts a Midrange. Wide open! Allen Giddey is 7.1 feet away. [MAN] Miles Dosunmu misses. Rebound secured by LeBron Lowry.

[09:36] Team_059 possession (Score: 89-73)
Scottie Ginobili makes the 3Pt and draws the foul on Joel Simons! And-1! Scottie Ginobili to the line for 1. [Team fouls: 1] (Joel Simons: 1 personal fouls)   FT 1/1: GOOD Scottie Ginobili makes 1/1 from the line.
Score: 89-77

[09:24] Team_097 possession (Score: 89-77)
Miles Dosunmu attempts a 3Pt. Contested by Russell Quickley (4.9 feet, ZONE). Miles Dosunmu misses. Rebound secured by Scottie Ginobili.

[09:10] Team_059 possession (Score: 89-77)
LeBron Lowry makes the Dunk and draws the foul on Dwyane Ginobili! And-1! LeBron Lowry to the line for 1. [Team fouls: 2] (Dwyane Ginobili: 1 personal fouls)   FT 1/1: GOOD LeBron Lowry makes 1/1 from the line.
Score: 89-80

[08:56] Team_097 possession (Score: 89-80)
Miles Banchero attempts a Layup. Contested by LeBron Lowry (4.8 feet, MAN). Miles Banchero misses. Rebound secured by Bones Middleton.

[08:37] Team_059 possession (Score: 89-80)
Bones Middleton attempts a 3Pt. Contested by Joel Simons (3.9 feet, ZONE). Bones Middleton misses. Rebound secured by Miles Banchero.

[08:22] Team_097 possession (Score: 89-80)
Dwyane Ginobili makes the Layup and draws the foul on Bones Middleton! And-1! Dwyane Ginobili to the line for 1. [Team fouls: 3] (Bones Middleton: 1 personal fouls)   FT 1/1: GOOD Dwyane Ginobili makes 1/1 from the line.
Score: 92-80

[08:06] Team_059 possession (Score: 92-80)
FOUL! Shooting foul on Joel Simons. Scottie Ginobili to the line for 3 free throws. [Team fouls: 3] (Joel Simons: 2 personal fouls)   FT 1/3: GOOD   FT 2/3: GOOD   FT 3/3: GOOD Scottie Ginobili makes 3/3 from the line.
Score: 92-83

[07:52] Team_097 possession (Score: 92-83)
Miles Dosunmu attempts a 3Pt. Wide open! Allen Giddey is 7.1 feet away. [MAN] Miles Dosunmu misses. Rebound secured by LeBron Lowry.

[07:37] Team_059 possession (Score: 92-83)
LeBron Lowry attempts a Midrange. Contested by Miles Dosunmu (4.0 feet, ZONE). LEBRON LOWRY MAKES IT! Assist: Russell Quickley
Score: 92-85

[07:20] Team_097 possession (Score: 92-85)
Gary Carter attempts a 3Pt. Contested by Bones Middleton (4.3 feet, ZONE). GARY CARTER MAKES IT! Assist: Dwyane Ginobili
Score: 95-85

[07:06] Team_059 possession (Score: 95-85)
LeBron Lowry attempts a Layup. BLOCKED BY DWYANE GINOBILI! Ball goes out off Dwyane Ginobili. LeBron Lowry's ball!

[06:52] Team_059 possession (Score: 95-85)
Russell Quickley attempts a Midrange. BLOCKED BY GARY CARTER! Ball is loose! Rebound secured by Miles Banchero.

[06:40] Team_097 possession (Score: 95-85)
Gary Carter attempts a 3Pt. Contested by Russell Quickley (4.2 feet, ZONE). GARY CARTER MAKES IT!
Score: 98-85

[06:24] Team_059 possession (Score: 98-85)
Scottie Ginobili attempts a Midrange. Contested by Dwyane Ginobili (5.1 feet, ZONE). SCOTTIE GINOBILI MAKES IT! Assist: Allen Giddey
Score: 98-87

[06:08] Team_097 possession (Score: 98-87)
FOUL! Shooting foul on Allen Giddey. Dwyane Ginobili to the line for 2 free throws. [Team fouls: 4] (Allen Giddey: 1 personal fouls)   FT 1/2: GOOD   FT 2/2: GOOD Dwyane Ginobili makes 2/2 from the line.
Score: 100-87

[05:51] Team_059 possession (Score: 100-87)
FOUL! Reach-in foul on Dwyane Ginobili during the drive. [Team fouls: 4] No free throws, side out. (Dwyane Ginobili: 2 personal fouls)

[05:36] Team_059 possession (Score: 100-87)
Bones Middleton attempts a 3Pt. Contested by Joel Simons (3.9 feet, MAN). Bones Middleton misses. Rebound secured by Miles Banchero.

[05:24] Team_097 possession (Score: 100-87)
Joel Simons attempts a Midrange. Contested by Bones Middleton (4.7 feet, MAN). JOEL SIMONS MAKES IT!
Score: 102-87

[05:12] Team_059 possession (Score: 102-87)
LeBron Lowry drives, picks up Joel Simons. Help arrives from Dwyane Ginobili! LeBron Lowry attempts a Dunk. Contested by Dwyane Ginobili (3.7 feet, ZONE). LeBron Lowry misses. Rebound secured by Miles Dosunmu.

[04:57] Team_097 possession (Score: 102-87)
FOUL! Holding foul on LeBron Lowry. [IN THE BONUS! 5 team fouls] Miles Banchero to the line for 2 free throws. (LeBron Lowry: 1 personal fouls)   FT 1/2: GOOD   FT 2/2: GOOD Miles Banchero makes 2/2 from the line.
Score: 104-87

[04:42] Team_059 possession (Score: 104-87)
Russell Quickley attempts a Midrange. Contested by Gary Carter (5.1 feet, MAN). RUSSELL QUICKLEY MAKES IT! Assist: Allen Giddey
Score: 104-89

[04:23] Team_097 possession (Score: 104-89)
Miles Dosunmu attempts a 3Pt. Wide open! Allen Giddey is 7.1 feet away. [MAN] Miles Dosunmu misses. Rebound secured by Bones Middleton.

[04:11] Team_059 possession (Score: 104-89)
FOUL! Reach-in foul on Joel Simons during the drive. [IN THE BONUS! 5 team fouls] Scottie Ginobili to the line for 2 free throws. (Joel Simons: 3 personal fouls)   FT 1/2: GOOD   FT 2/2: GOOD Scottie Ginobili makes 2/2 from the line.
Score: 104-91

[03:57] Team_097 possession (Score: 104-91)
Joel Simons makes the Layup and draws the foul on Bones Middleton! And-1! Joel Simons to the line for 1. [BONUS: 6 team fouls] (Bones Middleton: 2 personal fouls)   FT 1/1: GOOD Joel Simons makes 1/1 from the line.
Score: 107-91

[03:42] Team_059 possession (Score: 107-91)
Russell Quickley attempts a 3Pt. Contested by Joel Simons (3.9 feet, ZONE). RUSSELL QUICKLEY MAKES IT! Assist: LeBron Lowry
Score: 107-94

[03:25] Team_097 possession (Score: 107-94)
Joel Simons drives to the basket... Joel Simons throws a bad pass! Stolen by Bones Middleton! TURNOVER! (live ball)

[03:15] Team_059 possession (Score: 107-94)
FOUL! Shooting foul on Joel Simons. Allen Giddey to the line for 2 free throws. [BONUS: 6 team fouls] (Joel Simons: 4 personal fouls)   FT 1/2: GOOD   FT 2/2: GOOD Allen Giddey makes 2/2 from the line.
Score: 107-96

[03:02] Team_097 possession (Score: 107-96)
Dwyane Ginobili drives and kicks out. FOUL! Shooting foul on Scottie Ginobili. Dwyane Ginobili to the line for 2 free throws. [BONUS: 7 team fouls] (Scottie Ginobili: 1 personal fouls)   FT 1/2: GOOD   FT 2/2: MISS Dwyane Ginobili makes 1/2 from the line. Offensive rebound by Joel Simons! Joel Simons kicks it out.
Score: 108-96

[02:46] Team_097 possession (Score: 108-96)
Miles Banchero attempts a 3Pt. Contested by Russell Quickley (4.7 feet, ZONE). Miles Banchero misses. Rebound secured by Scottie Ginobili.

[02:37] Team_059 possession (Score: 108-96)
Scottie Ginobili attempts a 3Pt. Contested by Joel Simons (4.2 feet, ZONE). Scottie Ginobili misses. Rebound secured by Miles Dosunmu.

[02:22] Team_097 possession (Score: 108-96)
Joel Simons attempts a Midrange. Contested by Bones Middleton (4.9 feet, MAN). JOEL SIMONS MAKES IT!
Score: 110-96

[02:06] Team_059 possession (Score: 110-96)
LeBron Lowry attempts a Layup. Contested by Joel Simons (3.8 feet, MAN). LEBRON LOWRY MAKES IT! Assist: Bones Middleton
Score: 110-98

[01:51] Team_097 possession (Score: 110-98)
Joel Simons attempts a 3Pt. Contested by Bones Middleton (5.0 feet, MAN). Joel Simons misses. Rebound secured by Bones Middleton.

[01:37] Team_059 possession (Score: 110-98)
FOUL! Shooting foul on Joel Simons. LeBron Lowry to the line for 2 free throws. [BONUS: 7 team fouls] (Joel Simons: 5 personal fouls)   FT 1/2: GOOD   FT 2/2: GOOD LeBron Lowry makes 2/2 from the line.
Score: 110-100

[01:24] Team_097 possession (Score: 110-100)
Dwyane Ginobili attempts a 3Pt. Contested by Scottie Ginobili (4.6 feet, MAN). Dwyane Ginobili misses. Rebound secured by Scottie Ginobili.

[01:12] Team_059 possession (Score: 110-100)
LeBron Lowry attempts a Layup. BLOCKED BY JOEL SIMONS! Ball is loose! Offensive rebound by Scottie Ginobili! Scottie Ginobili kicks it out.

[00:56] Team_059 possession (Score: 110-100)
LeBron Lowry drives, Joel Simons stays with him. LeBron Lowry attempts a Layup. Contested by Joel Simons (4.0 feet, MAN). LeBron Lowry misses. Rebound secured by Miles Dosunmu.

[00:38] Team_097 possession (Score: 110-100)
Joel Simons attempts a 3Pt. Contested by Russell Quickley (4.9 feet, ZONE). Joel Simons misses. Rebound secured by Bones Middleton.

[00:21] Team_059 possession (Score: 110-100)
Allen Giddey attempts a 3Pt. Contested by Miles Dosunmu (3.9 feet, MAN). ALLEN GIDDEY MAKES IT! Assist: Scottie Ginobili
Score: 110-103

[00:02] Team_097 possession (Score: 110-103)
Miles Dosunmu attempts a 3Pt. Wide open! Allen Giddey is 7.3 feet away. [MAN] MILES DOSUNMU MAKES IT! Assist: Joel Simons
Score: 113-103

================================================================================
                              4TH QUARTER COMPLETE                              
================================================================================

4TH QUARTER SCORE: Team_097 26, Team_059 32

BOX SCORE:
================================================================================

Team_097
--------------------------------------------------------------------------------
Player                MIN  PTS  REB  AST  TO      FG   FG%      3P   3P%
--------------------------------------------------------------------------------
Joel Simons            20    7    1    1   0   3/5    60.0     0/0   0.0
Gary Carter            20    6    0    0   0   2/2   100.0     0/0   0.0
Dwyane Ginobili        20    5    0    1   0   2/3    66.7     0/0   0.0
Miles Dosunmu          20    3    3    0   0   1/5    20.0     0/0   0.0
Jrue Haliburton        29    2    0    0   0   1/2    50.0     0/0   0.0
Miles Banchero         20    2    3    0   0   1/3    33.3     0/0   0.0
Anthony Haliburton     29    0    1    0   0   0/0     0.0     0/0   0.0
Tyrese Stewart         29    0    1    1   0   0/0     0.0     0/0   0.0

TEAM: FG: 10/20 (50.0%), 3PT: 3/10 (30.0%), REB: 9 (2 off, 7 def), AST: 3, TO: 2
TEAM FOULS: 7 [Team_059 in BONUS]


Team_059
--------------------------------------------------------------------------------
Player                MIN  PTS  REB  AST  TO      FG   FG%      3P   3P%
--------------------------------------------------------------------------------
Scottie Ginobili       20   11    4    1   0   4/5    80.0     0/0   0.0
LeBron Lowry           20    9    2    1   0   4/6    66.7     0/0   0.0
Russell Quickley       20    5    0    1   0   2/3    66.7     0/0   0.0
Allen Giddey           20    5    0    2   0   2/2   100.0     0/0   0.0
Bones Middleton        20    2    4    1   0   1/3    33.3     0/0   0.0
Bam Wade               29    0    1    0   0   0/0     0.0     0/0   0.0
Blake Tatum            29    0    0    0   0   0/1     0.0     0/0   0.0

TEAM: FG: 13/20 (65.0%), 3PT: 4/8 (50.0%), REB: 11 (1 off, 10 def), AST: 6, TO: 1
TEAM FOULS: 7 [Team_097 in BONUS]

================================================================================

================================================================================
                               FULL GAME COMPLETE                               
================================================================================

FINAL SCORE: Team_097 113, Team_059 103

SCORING BY QUARTER:
--------------------------------------------------------------------------------
Team                     Q1     Q2     Q3     Q4    FINAL
--------------------------------------------------------------------------------
Team_097                 29     26     32     26      113
Team_059                 27     26     18     32      103
--------------------------------------------------------------------------------

FULL GAME BOX SCORE:
================================================================================

Team_097
--------------------------------------------------------------------------------
Player                MIN  PTS  REB  AST  TO      FG   FG%      3P   3P%      FT STL BLK
--------------------------------------------------------------------------------
Evan Brogdon           29    6    0    9   1   2/6    33.3   0/1     0.0   0/0     0   0
Jrue Haliburton        29   19    0    2   4   7/10   70.0   2/3    66.7   3/3     1   1
Shai Poole             29    8    7    3   2   6/9    66.7   2/3    66.7   1/2     0   0
Anthony Haliburton     29   11    6    1   1   3/5    60.0   0/0     0.0   0/0     1   0
Tyrese Stewart         29   25   14    1   1  11/12   91.7   0/1     0.0   6/6     0   0
Gary Carter            20   12    0    1   1   4/7    57.1   3/3   100.0   2/3     0   1
Dwyane Ginobili        20    9    0    2   1   3/5    60.0   0/1     0.0   4/5     0   1
Miles Dosunmu          20    6    7    1   1   2/6    33.3   1/4    25.0   1/2     0   0
Joel Simons            20    9    4    1   1   5/7    71.4   0/2     0.0   1/1     0   1
Miles Banchero         20    6    4    0   1   2/4    50.0   0/1     0.0   4/4     0   0

TEAM: FG: 47/73 (64.4%), 3PT: 8/19 (42.1%), REB: 41 (11 off, 30 def), AST: 21, TO: 14


Team_059
--------------------------------------------------------------------------------
Player                MIN  PTS  REB  AST  TO      FG   FG%      3P   3P%      FT STL BLK
--------------------------------------------------------------------------------
Bam Wade               29   13    3    1   1   5/8    62.5   3/5    60.0   2/2     0   1
Blake Tatum            29   10    0    2   2   5/10   50.0   1/5    20.0   1/2     1   1
John Iverson           29    2    6    3   0   1/6    16.7   0/4     0.0   1/4     0   0
Nikola Jokic           29   20    1    2   2   7/13   53.8   3/6    50.0  10/10    1   0
Jarrett Smith          29    7    6    3   2   3/3   100.0   0/0     0.0   3/3     2   0
Russell Quickley       20    8    0    1   1   3/6    50.0   2/4    50.0   0/0     1   0
Scottie Ginobili       20   18    6    1   0   7/9    77.8   3/4    75.0   8/8     0   0
Allen Giddey           20    7    0    3   1   3/3   100.0   1/1   100.0   4/4     0   0
Bones Middleton        20    6    6    1   0   3/5    60.0   0/2     0.0   0/0     2   0
LeBron Lowry           20    9    5    3   1   4/9    44.4   0/0     0.0   3/3     1   0

TEAM: FG: 42/73 (57.5%), 3PT: 13/31 (41.9%), REB: 33 (7 off, 26 def), AST: 20, TO: 10

================================================================================
