================================================================================
                        FULL GAME - Team_010 vs Team_095                        
================================================================================

================================================================================
                       1ST QUARTER - Team_010 vs Team_095                       
================================================================================

[12:00] Team_010 possession (Score: 0-0)
Desmond Antetokounmpo attempts a 3Pt. Contested by Evan Carter (4.0 feet, ZONE). Desmond Antetokounmpo misses. Rebound secured by Shaquille Ball.

[11:42] Team_095 possession (Score: 0-0)
Dejounte Hyland attempts a Midrange. Contested by Michael Turner (4.0 feet, ZONE). DEJOUNTE HYLAND MAKES IT!
Score: 0-2

[11:25] Team_010 possession (Score: 0-2)
Desmond Antetokounmpo attempts a Layup. BLOCKED BY KYRIE MING! Ball is loose! Rebound secured by Dejounte Hyland.

[11:12] Team_095 possession (Score: 0-2)
FOUL! Holding foul on Desmond Antetokounmpo. [Team fouls: 1] No free throws, side out. (Desmond Antetokounmpo: 1 personal fouls)

[10:55] Team_095 possession (Score: 0-2)
FOUL! Shooting foul on Anthony Durant. Immanuel Middleton to the line for 2 free throws. [Team fouls: 2] (Anthony Durant: 1 personal fouls)   FT 1/2: GOOD   FT 2/2: GOOD Immanuel Middleton makes 2/2 from the line.
Score: 0-4

[10:37] Team_010 possession (Score: 0-4)
Desmond Antetokounmpo drives, Immanuel Middleton stays with him. Desmond Antetokounmpo attempts a Layup. Contested by Immanuel Middleton (5.0 feet, ZONE). DESMOND ANTETOKOUNMPO MAKES IT!
Score: 2-4

[10:22] Team_095 possession (Score: 2-4)
Dejounte Hyland attempts a Layup. Contested by Cade Morant (3.9 feet, MAN). Dejounte Hyland misses. Rebound secured by Cade Morant.

[10:06] Team_010 possession (Score: 2-4)
Cade Morant commits a violation (traveling/carry)! TURNOVER! (dead ball)

[09:53] Team_095 possession (Score: 2-4)
Dejounte Hyland attempts a Layup. Contested by Cade Morant (3.9 feet, MAN). Dejounte Hyland misses. Rebound secured by Desmond Antetokounmpo.

[09:41] Team_010 possession (Score: 2-4)
RJ Young attempts a 3Pt. Contested by Evan Carter (3.7 feet, MAN). RJ Young misses. Offensive rebound by Cade Morant! Cade Morant kicks it out.

[09:26] Team_010 possession (Score: 2-4)
RJ Young attempts a 3Pt. Contested by Evan Carter (3.7 feet, ZONE). RJ Young misses. Rebound secured by Evan Carter.

[09:14] Team_095 possession (Score: 2-4)
Dejounte Hyland attempts a 3Pt. Contested by Cade Morant (3.9 feet, ZONE). Dejounte Hyland misses. Rebound secured by Anthony Durant.

[09:03] Team_010 possession (Score: 2-4)
RJ Young drives, Immanuel Middleton stays with him. RJ Young attempts a Dunk. Contested by Immanuel Middleton (4.7 feet, ZONE). RJ YOUNG MAKES IT! Assist: Cade Morant
Score: 4-4

[08:48] Team_095 possession (Score: 4-4)
FOUL! Shooting foul on Cade Morant. Immanuel Middleton to the line for 2 free throws. [Team fouls: 3] (Cade Morant: 1 personal fouls)   FT 1/2: GOOD   FT 2/2: GOOD Immanuel Middleton makes 2/2 from the line.
Score: 4-6

[08:29] Team_010 possession (Score: 4-6)
Anthony Durant attempts a Layup. Contested by Kyrie Ming (5.4 feet, MAN). ANTHONY DURANT MAKES IT!
Score: 6-6

[08:18] Team_095 possession (Score: 6-6)
Immanuel Middleton attempts a 3Pt. Contested by Desmond Antetokounmpo (4.2 feet, MAN). Immanuel Middleton misses. Rebound secured by Desmond Antetokounmpo.

[08:05] Team_010 possession (Score: 6-6)
FOUL! Shooting foul on Shaquille Ball. Desmond Antetokounmpo to the line for 2 free throws. [Team fouls: 1] (Shaquille Ball: 1 personal fouls)   FT 1/2: GOOD   FT 2/2: GOOD Desmond Antetokounmpo makes 2/2 from the line.
Score: 8-6

[07:51] Team_095 possession (Score: 8-6)
Evan Carter attempts a Layup. Contested by RJ Young (4.9 feet, MAN). EVAN CARTER MAKES IT! Assist: Kyrie Ming
Score: 8-8

[07:34] Team_010 possession (Score: 8-8)
FOUL! Shooting foul on Evan Carter. RJ Young to the line for 2 free throws. [Team fouls: 2] (Evan Carter: 1 personal fouls)   FT 1/2: GOOD   FT 2/2: GOOD RJ Young makes 2/2 from the line.
Score: 10-8

[07:21] Team_095 possession (Score: 10-8)
Shaquille Ball attempts a Midrange. Contested by Michael Turner (4.0 feet, MAN). Shaquille Ball misses. Rebound secured by Cade Morant.

[07:08] Team_010 possession (Score: 10-8)
FOUL! Holding foul on Kyrie Ming. [Team fouls: 3] No free throws, side out. (Kyrie Ming: 1 personal fouls)

[06:53] Team_010 possession (Score: 10-8)
FOUL! Holding foul on Evan Carter. [Team fouls: 4] No free throws, side out. (Evan Carter: 2 personal fouls)

[06:39] Team_010 possession (Score: 10-8)
Michael Turner attempts a 3Pt. Contested by Shaquille Ball (4.6 feet, MAN). MICHAEL TURNER MAKES IT! Assist: Anthony Durant
Score: 13-8

[06:29] Team_095 possession (Score: 13-8)
Evan Carter attempts a 3Pt. Contested by RJ Young (4.9 feet, MAN). Evan Carter misses. Offensive rebound by Dejounte Hyland! Dejounte Hyland kicks it out.

[06:13] Team_095 possession (Score: 13-8)
FOUL! Shooting foul on RJ Young. Evan Carter to the line for 2 free throws. [Team fouls: 4] (RJ Young: 1 personal fouls)   FT 1/2: GOOD   FT 2/2: GOOD Evan Carter makes 2/2 from the line.
Score: 13-10

[05:57] Team_010 possession (Score: 13-10)
RJ Young drives to the basket... RJ Young commits a violation (traveling/carry)! TURNOVER! (dead ball)

[05:45] Team_095 possession (Score: 13-10)
Immanuel Middleton attempts a 3Pt. Contested by Desmond Antetokounmpo (4.2 feet, MAN). Immanuel Middleton misses. Rebound secured by Cade Morant.

[05:29] Team_010 possession (Score: 13-10)
Anthony Durant loses control! Ball rolls out of bounds! TURNOVER! (dead ball)

[05:14] Team_095 possession (Score: 13-10)
Shaquille Ball attempts a Midrange. Contested by Desmond Antetokounmpo (4.3 feet, ZONE). Shaquille Ball misses. Rebound secured by Anthony Durant.

[04:58] Team_010 possession (Score: 13-10)
RJ Young loses control! Ball rolls out of bounds! TURNOVER! (dead ball)

[04:43] Team_095 possession (Score: 13-10)
FOUL! Reach-in foul on Cade Morant during the drive. [IN THE BONUS! 5 team fouls] Dejounte Hyland to the line for 2 free throws. (Cade Morant: 2 personal fouls)   FT 1/2: GOOD   FT 2/2: GOOD Dejounte Hyland makes 2/2 from the line.
Score: 13-12

[04:30] Team_010 possession (Score: 13-12)
Cade Morant drives to the basket... Cade Morant loses the ball! Stripped by Immanuel Middleton! TURNOVER! (live ball)

[04:14] Team_095 possession (Score: 13-12)
Dejounte Hyland attempts a 3Pt. Contested by Cade Morant (4.0 feet, ZONE). Dejounte Hyland misses. Rebound secured by Anthony Durant.

[04:04] Team_010 possession (Score: 13-12)
Desmond Antetokounmpo drives and kicks out. Desmond Antetokounmpo attempts a 3Pt. Contested by Evan Carter (3.9 feet, ZONE). DESMOND ANTETOKOUNMPO MAKES IT! Assist: Cade Morant
Score: 16-12

[03:55] Team_095 possession (Score: 16-12)
Kyrie Ming drives and kicks out. Evan Carter attempts a Midrange. Contested by RJ Young (4.8 feet, MAN). Evan Carter misses. Offensive rebound by Dejounte Hyland! Dejounte Hyland kicks it out.

[03:42] Team_095 possession (Score: 16-12)
Dejounte Hyland attempts a 3Pt. Contested by Cade Morant (4.1 feet, ZONE). Dejounte Hyland misses. Rebound secured by Cade Morant.

[03:33] Team_010 possession (Score: 16-12)
FOUL! Shooting foul on Evan Carter. RJ Young to the line for 3 free throws. [BONUS: 5 team fouls] (Evan Carter: 3 personal fouls)   FT 1/3: MISS   FT 2/3: GOOD   FT 3/3: GOOD RJ Young makes 2/3 from the line.
Score: 18-12

[03:19] Team_095 possession (Score: 18-12)
Shaquille Ball throws a bad pass! Stolen by Michael Turner! TURNOVER! (live ball)

[03:05] Team_010 possession (Score: 18-12)
FOUL! Reach-in foul on Immanuel Middleton during the drive. [IN THE BONUS! 6 team fouls] RJ Young to the line for 2 free throws. (Immanuel Middleton: 1 personal fouls)   FT 1/2: GOOD   FT 2/2: MISS RJ Young makes 1/2 from the line. Rebound secured by Dejounte Hyland.
Score: 19-12

[02:48] Team_095 possession (Score: 19-12)
Dejounte Hyland attempts a 3Pt. Contested by Cade Morant (4.2 feet, MAN). DEJOUNTE HYLAND MAKES IT! Assist: Immanuel Middleton
Score: 19-15

[02:34] Team_010 possession (Score: 19-15)
Anthony Durant attempts a Layup. Contested by Kyrie Ming (5.7 feet, MAN). ANTHONY DURANT MAKES IT!
Score: 21-15

[02:23] Team_095 possession (Score: 21-15)
Evan Carter attempts a Layup. Contested by Anthony Durant (4.1 feet, ZONE). EVAN CARTER MAKES IT!
Score: 21-17

[02:07] Team_010 possession (Score: 21-17)
Anthony Durant attempts a 3Pt. Contested by Kyrie Ming (5.7 feet, MAN). ANTHONY DURANT MAKES IT! Assist: Desmond Antetokounmpo
Score: 24-17

[01:57] Team_095 possession (Score: 24-17)
Immanuel Middleton attempts a Layup. Contested by Desmond Antetokounmpo (4.6 feet, MAN). Immanuel Middleton misses. Rebound secured by Michael Turner.

[01:44] Team_010 possession (Score: 24-17)
Michael Turner attempts a 3Pt. Contested by Evan Carter (4.4 feet, ZONE). Michael Turner misses. Offensive rebound by Cade Morant! Cade Morant kicks it out.

[01:33] Team_010 possession (Score: 24-17)
FOUL! Shooting foul on Immanuel Middleton. Desmond Antetokounmpo to the line for 2 free throws. [BONUS: 7 team fouls] (Immanuel Middleton: 2 personal fouls)   FT 1/2: GOOD   FT 2/2: GOOD Desmond Antetokounmpo makes 2/2 from the line.
Score: 26-17

[01:18] Team_095 possession (Score: 26-17)
FOUL! Shooting foul on Anthony Durant. Kyrie Ming to the line for 2 free throws. [BONUS: 6 team fouls] (Anthony Durant: 2 personal fouls)   FT 1/2: MISS   FT 2/2: GOOD Kyrie Ming makes 1/2 from the line.
Score: 26-18

[01:02] Team_010 possession (Score: 26-18)
Desmond Antetokounmpo makes the Layup and draws the foul on Immanuel Middleton! And-1! Desmond Antetokounmpo to the line for 1. [BONUS: 8 team fouls] (Immanuel Middleton: 3 personal fouls)   FT 1/1: GOOD Desmond Antetokounmpo makes 1/1 from the line.
Score: 29-18

[00:52] Team_095 possession (Score: 29-18)
Evan Carter attempts a 3Pt. Contested by RJ Young (5.4 feet, MAN). EVAN CARTER MAKES IT! Assist: Dejounte Hyland
Score: 29-21

[00:40] Team_010 possession (Score: 29-21)
RJ Young makes the Layup and draws the foul on Evan Carter! And-1! RJ Young to the line for 1. [BONUS: 9 team fouls] (Evan Carter: 4 personal fouls)   FT 1/1: GOOD RJ Young makes 1/1 from the line.
Score: 32-21

[00:22] Team_095 possession (Score: 32-21)
Kyrie Ming attempts a Layup. Contested by Anthony Durant (4.3 feet, MAN). KYRIE MING MAKES IT!
Score: 32-23

[00:09] Team_010 possession (Score: 32-23)
FOUL! Shooting foul on Dejounte Hyland. Cade Morant to the line for 2 free throws. [BONUS: 10 team fouls] (Dejounte Hyland: 1 personal fouls)   FT 1/2: GOOD   FT 2/2: GOOD Cade Morant makes 2/2 from the line.
Score: 34-23

================================================================================
                              1ST QUARTER COMPLETE                              
================================================================================

1ST QUARTER SCORE: Team_010 34, Team_095 23

BOX SCORE:
================================================================================

Team_010
--------------------------------------------------------------------------------
Player                MIN  PTS  REB  AST  TO      FG   FG%      3P   3P%
--------------------------------------------------------------------------------
Desmond Antetokounmpo   12   12    2    1   0   5/7    71.4     0/0   0.0
RJ Young               12    9    0    0   0   4/6    66.7     0/0   0.0
Anthony Durant         12    7    3    1   0   3/3   100.0     0/0   0.0
Michael Turner         12    3    1    0   0   1/1   100.0     0/0   0.0
Cade Morant            12    2    6    2   0   1/1   100.0     0/0   0.0

TEAM: FG: 14/18 (77.8%), 3PT: 3/5 (60.0%), REB: 12 (2 off, 10 def), AST: 4, TO: 5
TEAM FOULS: 6 [Team_095 in BONUS]


Team_095
--------------------------------------------------------------------------------
Player                MIN  PTS  REB  AST  TO      FG   FG%      3P   3P%
--------------------------------------------------------------------------------
Evan Carter            12    9    1    0   0   4/4   100.0     0/0   0.0
Dejounte Hyland        12    7    4    1   0   3/8    37.5     0/0   0.0
Immanuel Middleton     12    4    0    1   0   2/5    40.0     0/0   0.0
Kyrie Ming             12    3    0    1   0   2/2   100.0     0/0   0.0
Shaquille Ball         12    0    1    0   0   0/2     0.0     0/0   0.0

TEAM: FG: 11/21 (52.4%), 3PT: 2/7 (28.6%), REB: 6 (2 off, 4 def), AST: 3, TO: 1
TEAM FOULS: 10 [Team_010 in BONUS]

================================================================================

================================================================================
                       2ND QUARTER - Team_010 vs Team_095                       
================================================================================

[12:00] Team_010 possession (Score: 34-23)
Michael Turner attempts a Layup. Contested by Shaquille Ball (4.9 feet, MAN). Michael Turner misses. Rebound secured by Dejounte Hyland.

[11:45] Team_095 possession (Score: 34-23)
Immanuel Middleton throws a bad pass! Stolen by Desmond Antetokounmpo! TURNOVER! (live ball)

[11:31] Team_010 possession (Score: 34-23)
RJ Young attempts a 3Pt. Contested by Evan Carter (4.0 feet, MAN). RJ Young misses. Rebound secured by Evan Carter.

[11:16] Team_095 possession (Score: 34-23)
Immanuel Middleton drives to the basket... Immanuel Middleton throws a bad pass! Stolen by Desmond Antetokounmpo! TURNOVER! (live ball)

[11:06] Team_010 possession (Score: 34-23)
Michael Turner attempts a 3Pt. Contested by Shaquille Ball (4.9 feet, MAN). MICHAEL TURNER MAKES IT!
Score: 37-23

[10:49] Team_095 possession (Score: 37-23)
Kyrie Ming makes the Layup and draws the foul on Anthony Durant! And-1! Kyrie Ming to the line for 1. [Team fouls: 1] (Anthony Durant: 1 personal fouls)   FT 1/1: GOOD Kyrie Ming makes 1/1 from the line.
Score: 37-26

[10:35] Team_010 possession (Score: 37-26)
FOUL! Holding foul on Dejounte Hyland. [Team fouls: 1] No free throws, side out. (Dejounte Hyland: 1 personal fouls)

[10:20] Team_010 possession (Score: 37-26)
Desmond Antetokounmpo attempts a 3Pt. Contested by Shaquille Ball (4.9 feet, ZONE). DESMOND ANTETOKOUNMPO MAKES IT! Assist: Cade Morant
Score: 40-26

[10:07] Team_095 possession (Score: 40-26)
Shaquille Ball drives, picks up Anthony Durant. Help arrives from Cade Morant! Shaquille Ball attempts a Layup. Contested by Cade Morant (4.2 feet, ZONE). Shaquille Ball misses. Rebound secured by Cade Morant.

[09:54] Team_010 possession (Score: 40-26)
Cade Morant attempts a 3Pt. Contested by Evan Carter (4.9 feet, ZONE). Cade Morant misses. FOUL! Loose ball foul on Shaquille Ball during the rebound battle. [Team fouls: 2] No free throws, side out. (Shaquille Ball: 1 personal fouls)

[09:42] Team_010 possession (Score: 40-26)
Michael Turner attempts a 3Pt. Contested by Evan Carter (4.7 feet, ZONE). Michael Turner misses. Rebound secured by Evan Carter.

[09:25] Team_095 possession (Score: 40-26)
Dejounte Hyland drives, Anthony Durant stays with him. Dejounte Hyland attempts a Layup. Contested by Anthony Durant (4.2 feet, ZONE). DEJOUNTE HYLAND MAKES IT! Assist: Shaquille Ball
Score: 40-28

[09:11] Team_010 possession (Score: 40-28)
Anthony Durant attempts a Layup. Wide open! Kyrie Ming is 6.1 feet away. [MAN] ANTHONY DURANT MAKES IT!
Score: 42-28

[08:57] Team_095 possession (Score: 42-28)
Immanuel Middleton loses the ball! Stripped by Desmond Antetokounmpo! TURNOVER! (live ball)

[08:42] Team_010 possession (Score: 42-28)
RJ Young attempts a Layup. Contested by Immanuel Middleton (5.5 feet, ZONE). RJ YOUNG MAKES IT! Assist: Michael Turner
Score: 44-28

[08:27] Team_095 possession (Score: 44-28)
Dejounte Hyland makes the Midrange and draws the foul on Cade Morant! And-1! Dejounte Hyland to the line for 1. [Team fouls: 2] (Cade Morant: 1 personal fouls)   FT 1/1: GOOD Dejounte Hyland makes 1/1 from the line.
Score: 44-31

[08:14] Team_010 possession (Score: 44-31)
RJ Young attempts a 3Pt. Contested by Evan Carter (4.5 feet, MAN). RJ Young misses. Rebound secured by Dejounte Hyland.

[07:55] Team_095 possession (Score: 44-31)
Evan Carter attempts a 3Pt. Contested by RJ Young (5.7 feet, MAN). Evan Carter misses. Rebound secured by Michael Turner.

[07:42] Team_010 possession (Score: 44-31)
Michael Turner attempts a Midrange. Contested by Dejounte Hyland (5.9 feet, ZONE). MICHAEL TURNER MAKES IT!
Score: 46-31

[07:25] Team_095 possession (Score: 46-31)
FOUL! Holding foul on Michael Turner. [Team fouls: 3] No free throws, side out. (Michael Turner: 1 personal fouls)

[07:11] Team_095 possession (Score: 46-31)
Evan Carter attempts a 3Pt. Contested by Cade Morant (5.1 feet, ZONE). Evan Carter misses. Offensive rebound by Evan Carter! Evan Carter kicks it out.

[06:58] Team_095 possession (Score: 46-31)
Kyrie Ming drives and kicks out. Kyrie Ming attempts a 3Pt. Contested by Cade Morant (5.1 feet, ZONE). KYRIE MING MAKES IT! Assist: Dejounte Hyland
Score: 46-34

[06:42] Team_010 possession (Score: 46-34)
RJ Young drives to the basket... FOUL! Offensive foul on RJ Young! Evan Carter drew the charge! [Team fouls: 4] (RJ Young: 1 personal fouls) TURNOVER! (dead ball)

[06:30] Team_095 possession (Score: 46-34)
Shaquille Ball commits a violation (traveling/carry)! TURNOVER! (dead ball)

[06:30] Substitution (Team_010): Cade Morant OUT → Draymond Leonard IN (stamina_rule2)

[06:30] Substitution (Team_010): Michael Turner OUT → Blake Harden IN (stamina_rule2)

[06:30] Substitution (Team_010): RJ Young OUT → Ben Gilgeous-Alexander IN (stamina_rule2)

[06:30] Substitution (Team_010): Desmond Antetokounmpo OUT → Vince Ingram IN (stamina_rule2)

[06:30] Substitution (Team_010): Anthony Durant OUT → Paolo Wade IN (stamina_rule2)

[06:30] Substitution (Team_095): Dejounte Hyland OUT → Kyle Poole IN (stamina_rule2)

[06:30] Substitution (Team_095): Shaquille Ball OUT → Cade Beal IN (stamina_rule2)

[06:30] Substitution (Team_095): Evan Carter OUT → Tobias Wagner IN (stamina_rule2)

[06:30] Substitution (Team_095): Immanuel Middleton OUT → Gary Davis IN (stamina_rule2)

[06:30] Substitution (Team_095): Kyrie Ming OUT → DeMar McCollum IN (stamina_rule2)

[06:15] Team_010 possession (Score: 46-34)
Draymond Leonard attempts a Midrange. Contested by Kyle Poole (5.1 feet, MAN). Draymond Leonard misses. Rebound secured by DeMar McCollum.

[06:02] Team_095 possession (Score: 46-34)
Cade Beal attempts a 3Pt. Contested by Draymond Leonard (4.4 feet, ZONE). CADE BEAL MAKES IT! Assist: Kyle Poole
Score: 46-37

[05:45] Team_010 possession (Score: 46-37)
Vince Ingram attempts a 3Pt. Contested by Cade Beal (5.1 feet, ZONE). Vince Ingram misses. Offensive rebound by Paolo Wade! Paolo Wade kicks it out.

[05:33] Team_010 possession (Score: 46-37)
FOUL! Shooting foul on DeMar McCollum. Vince Ingram to the line for 2 free throws. [Team fouls: 3] (DeMar McCollum: 1 personal fouls)   FT 1/2: GOOD   FT 2/2: GOOD Vince Ingram makes 2/2 from the line.
Score: 48-37

[05:20] Team_095 possession (Score: 48-37)
Tobias Wagner attempts a Midrange. Contested by Vince Ingram (5.8 feet, ZONE). Tobias Wagner misses. Rebound secured by Blake Harden.

[05:06] Team_010 possession (Score: 48-37)
Blake Harden attempts a Layup. Contested by Cade Beal (4.1 feet, MAN). BLAKE HARDEN MAKES IT!
Score: 50-37

[04:54] Team_095 possession (Score: 50-37)
FOUL! Shooting foul on Vince Ingram. Gary Davis to the line for 2 free throws. [BONUS: 5 team fouls] (Vince Ingram: 1 personal fouls)   FT 1/2: MISS   FT 2/2: GOOD Gary Davis makes 1/2 from the line.
Score: 50-38

[04:41] Team_010 possession (Score: 50-38)
Vince Ingram attempts a Layup. Contested by DeMar McCollum (5.6 feet, ZONE). VINCE INGRAM MAKES IT! Assist: Blake Harden
Score: 52-38

[04:23] Team_095 possession (Score: 52-38)
Kyle Poole attempts a Midrange. Contested by Vince Ingram (5.8 feet, ZONE). KYLE POOLE MAKES IT!
Score: 52-40

[04:10] Team_010 possession (Score: 52-40)
Vince Ingram drives to the basket... FOUL! Offensive foul on Vince Ingram! DeMar McCollum drew the charge! [Team fouls: 6] (Vince Ingram: 2 personal fouls) TURNOVER! (dead ball)

[03:55] Team_095 possession (Score: 52-40)
Kyle Poole commits a violation (traveling/carry)! TURNOVER! (dead ball)

[03:42] Team_010 possession (Score: 52-40)
Blake Harden attempts a Layup. Contested by DeMar McCollum (4.6 feet, ZONE). BLAKE HARDEN MAKES IT! Assist: Ben Gilgeous-Alexander
Score: 54-40

[03:33] Team_095 possession (Score: 54-40)
Cade Beal drives and kicks out. Gary Davis attempts a 3Pt. Contested by Vince Ingram (5.4 feet, MAN). Gary Davis misses. Rebound secured by Ben Gilgeous-Alexander.

[03:20] Team_010 possession (Score: 54-40)
Blake Harden makes the Midrange and draws the foul on Gary Davis! And-1! Blake Harden to the line for 1. [Team fouls: 4] (Gary Davis: 1 personal fouls)   FT 1/1: GOOD Blake Harden makes 1/1 from the line.
Score: 57-40

[03:03] Team_095 possession (Score: 57-40)
Kyle Poole drives, Draymond Leonard stays with him. Kyle Poole attempts a Layup. Contested by Draymond Leonard (4.8 feet, MAN). Kyle Poole misses. Rebound secured by Ben Gilgeous-Alexander.

[02:51] Team_010 possession (Score: 57-40)
FOUL! Holding foul on Kyle Poole. [IN THE BONUS! 5 team fouls] Draymond Leonard to the line for 2 free throws. (Kyle Poole: 1 personal fouls)   FT 1/2: GOOD   FT 2/2: GOOD Draymond Leonard makes 2/2 from the line.
Score: 59-40

[02:33] Team_095 possession (Score: 59-40)
Cade Beal attempts a Midrange. Contested by Ben Gilgeous-Alexander (4.5 feet, ZONE). CADE BEAL MAKES IT! Assist: Tobias Wagner
Score: 59-42

[02:17] Team_010 possession (Score: 59-42)
Blake Harden drives, picks up DeMar McCollum. Help arrives from Kyle Poole! Blake Harden attempts a Dunk. Contested by Kyle Poole (4.6 feet, ZONE). BLAKE HARDEN MAKES IT!
Score: 61-42

[02:01] Team_095 possession (Score: 61-42)
Tobias Wagner drives and kicks out. Tobias Wagner attempts a 3Pt. Contested by Ben Gilgeous-Alexander (4.6 feet, MAN). Tobias Wagner misses. Rebound secured by Ben Gilgeous-Alexander.

[01:51] Team_010 possession (Score: 61-42)
Draymond Leonard attempts a 3Pt. Contested by Kyle Poole (5.1 feet, MAN). Draymond Leonard misses. Rebound secured by Tobias Wagner.

[01:32] Team_095 possession (Score: 61-42)
Kyle Poole attempts a 3Pt. Contested by Draymond Leonard (4.8 feet, ZONE). Kyle Poole misses. Rebound secured by Blake Harden.

[01:23] Team_010 possession (Score: 61-42)
Blake Harden attempts a 3Pt. Contested by Cade Beal (4.1 feet, MAN). BLAKE HARDEN MAKES IT!
Score: 64-42

[01:10] Team_095 possession (Score: 64-42)
DeMar McCollum makes the Layup and draws the foul on Paolo Wade! And-1! DeMar McCollum to the line for 1. [BONUS: 7 team fouls] (Paolo Wade: 1 personal fouls)   FT 1/1: GOOD DeMar McCollum makes 1/1 from the line.
Score: 64-45

[00:52] Team_010 possession (Score: 64-45)
Ben Gilgeous-Alexander drives and kicks out. Draymond Leonard makes the Midrange and draws the foul on Cade Beal! And-1! Draymond Leonard to the line for 1. [BONUS: 6 team fouls] (Cade Beal: 1 personal fouls)   FT 1/1: GOOD Draymond Leonard makes 1/1 from the line.
Score: 67-45

[00:37] Team_095 possession (Score: 67-45)
FOUL! Shooting foul on Paolo Wade. DeMar McCollum to the line for 2 free throws. [BONUS: 8 team fouls] (Paolo Wade: 2 personal fouls)   FT 1/2: MISS   FT 2/2: GOOD DeMar McCollum makes 1/2 from the line.
Score: 67-46

[00:23] Team_010 possession (Score: 67-46)
Ben Gilgeous-Alexander drives and kicks out. Ben Gilgeous-Alexander attempts a 3Pt. Contested by Cade Beal (4.4 feet, ZONE). Ben Gilgeous-Alexander misses. Rebound secured by DeMar McCollum.

[00:04] Team_095 possession (Score: 67-46)
Tobias Wagner drives, Paolo Wade stays with him. Tobias Wagner attempts a Dunk. Contested by Paolo Wade (5.5 feet, ZONE). Tobias Wagner misses. FOUL! Loose ball foul on Blake Harden during the rebound battle. [IN THE BONUS! 9 team fouls] DeMar McCollum to the line for 2 free throws. (Blake Harden: 1 personal fouls)   FT 1/2: GOOD   FT 2/2: GOOD DeMar McCollum makes 2/2 from the line.
Score: 67-48

================================================================================
                              2ND QUARTER COMPLETE                              
================================================================================

2ND QUARTER SCORE: Team_010 33, Team_095 25

BOX SCORE:
================================================================================

Team_010
--------------------------------------------------------------------------------
Player                MIN  PTS  REB  AST  TO      FG   FG%      3P   3P%
--------------------------------------------------------------------------------
Blake Harden            6   12    2    1   0   5/5   100.0     0/0   0.0
Michael Turner         18    5    1    1   0   2/4    50.0     0/0   0.0
Draymond Leonard        6    5    0    0   0   2/4    50.0     0/0   0.0
Vince Ingram            6    4    0    0   0   2/2   100.0     0/0   0.0
Desmond Antetokounmpo   18    3    0    0   0   1/1   100.0     0/0   0.0
RJ Young               18    2    0    0   0   1/3    33.3     0/0   0.0
Anthony Durant         18    2    0    0   0   1/1   100.0     0/0   0.0
Cade Morant            18    0    2    1   0   0/0     0.0     0/0   0.0
Paolo Wade              6    0    1    0   0   0/0     0.0     0/0   0.0
Ben Gilgeous-Alexander    6    0    3    1   0   0/1     0.0     0/0   0.0

TEAM: FG: 14/21 (66.7%), 3PT: 3/7 (42.9%), REB: 9 (2 off, 7 def), AST: 4, TO: 2
TEAM FOULS: 9 [Team_095 in BONUS]


Team_095
--------------------------------------------------------------------------------
Player                MIN  PTS  REB  AST  TO      FG   FG%      3P   3P%
--------------------------------------------------------------------------------
Kyrie Ming             18    6    0    0   0   2/2   100.0     0/0   0.0
DeMar McCollum          6    6    2    0   0   3/3   100.0     0/0   0.0
Dejounte Hyland        18    5    2    1   0   2/2   100.0     0/0   0.0
Cade Beal               6    5    0    0   0   2/3    66.7     0/0   0.0
Kyle Poole              6    2    0    1   0   1/3    33.3     0/0   0.0
Gary Davis              6    1    0    0   0   1/1   100.0     0/0   0.0
Evan Carter            18    0    3    0   0   0/1     0.0     0/0   0.0
Shaquille Ball         18    0    0    1   0   0/1     0.0     0/0   0.0
Tobias Wagner           6    0    1    1   0   0/2     0.0     0/0   0.0

TEAM: FG: 11/18 (61.1%), 3PT: 1/3 (33.3%), REB: 8 (1 off, 7 def), AST: 4, TO: 5
TEAM FOULS: 6 [Team_010 in BONUS]

================================================================================

================================================================================
                       3RD QUARTER - Team_010 vs Team_095                       
================================================================================

[12:00] Team_010 possession (Score: 67-48)
Michael Turner attempts a Layup. BLOCKED BY EVAN CARTER! Ball is loose! Rebound secured by Evan Carter.

[11:43] Team_095 possession (Score: 67-48)
FOUL! Holding foul on Anthony Durant. [Team fouls: 1] No free throws, side out. (Anthony Durant: 1 personal fouls)

[11:26] Team_095 possession (Score: 67-48)
Dejounte Hyland attempts a 3Pt. Contested by Cade Morant (3.9 feet, ZONE). Dejounte Hyland misses. Rebound secured by Desmond Antetokounmpo.

[11:16] Team_010 possession (Score: 67-48)
Desmond Antetokounmpo attempts a 3Pt. Contested by Evan Carter (4.0 feet, ZONE). Desmond Antetokounmpo misses. Rebound secured by Dejounte Hyland.

[11:05] Team_095 possession (Score: 67-48)
Evan Carter attempts a 3Pt. Contested by Cade Morant (4.1 feet, ZONE). EVAN CARTER MAKES IT! Assist: Dejounte Hyland
Score: 67-51

[10:53] Team_010 possession (Score: 67-51)
RJ Young attempts a Midrange. Contested by Evan Carter (3.7 feet, MAN). RJ Young misses. Rebound secured by Evan Carter.

[10:41] Team_095 possession (Score: 67-51)
Evan Carter attempts a 3Pt. Contested by Cade Morant (4.1 feet, ZONE). Evan Carter misses. Rebound secured by Desmond Antetokounmpo.

[10:24] Team_010 possession (Score: 67-51)
RJ Young attempts a Midrange. Contested by Shaquille Ball (4.2 feet, ZONE). RJ Young misses. Rebound secured by Evan Carter.

[10:10] Team_095 possession (Score: 67-51)
Dejounte Hyland attempts a 3Pt. Contested by Cade Morant (3.9 feet, ZONE). Dejounte Hyland misses. Rebound secured by Cade Morant.

[09:59] Team_010 possession (Score: 67-51)
Anthony Durant attempts a Midrange. Contested by Kyrie Ming (5.4 feet, MAN). ANTHONY DURANT MAKES IT!
Score: 69-51

[09:44] Team_095 possession (Score: 69-51)
Evan Carter makes the Dunk and draws the foul on Cade Morant! And-1! Evan Carter to the line for 1. [Team fouls: 2] (Cade Morant: 1 personal fouls)   FT 1/1: GOOD Evan Carter makes 1/1 from the line.
Score: 69-54

[09:27] Team_010 possession (Score: 69-54)
Michael Turner attempts a 3Pt. Contested by Evan Carter (4.1 feet, ZONE). Michael Turner misses. Rebound secured by Shaquille Ball.

[09:15] Team_095 possession (Score: 69-54)
Shaquille Ball attempts a 3Pt. Contested by Michael Turner (4.0 feet, MAN). Shaquille Ball misses. Offensive rebound by Dejounte Hyland! Dejounte Hyland kicks it out.

[09:00] Team_095 possession (Score: 69-54)
Dejounte Hyland attempts a 3Pt. Contested by Cade Morant (3.9 feet, MAN). Dejounte Hyland misses. Rebound secured by Cade Morant.

[08:43] Team_010 possession (Score: 69-54)
Michael Turner attempts a 3Pt. Contested by Evan Carter (4.1 feet, ZONE). Michael Turner misses. Offensive rebound by Cade Morant! Cade Morant kicks it out.

[08:30] Team_010 possession (Score: 69-54)
Anthony Durant attempts a 3Pt. Contested by Kyrie Ming (5.4 feet, MAN). Anthony Durant misses. Rebound secured by Evan Carter.

[08:13] Team_095 possession (Score: 69-54)
FOUL! Shooting foul on RJ Young. Evan Carter to the line for 2 free throws. [Team fouls: 3] (RJ Young: 1 personal fouls)   FT 1/2: GOOD   FT 2/2: GOOD Evan Carter makes 2/2 from the line.
Score: 69-56

[08:01] Team_010 possession (Score: 69-56)
FOUL! Shooting foul on Immanuel Middleton. Desmond Antetokounmpo to the line for 2 free throws. [Team fouls: 1] (Immanuel Middleton: 1 personal fouls)   FT 1/2: GOOD   FT 2/2: MISS Desmond Antetokounmpo makes 1/2 from the line. Rebound secured by Dejounte Hyland.
Score: 70-56

[07:45] Team_095 possession (Score: 70-56)
Evan Carter attempts a 3Pt. Contested by RJ Young (4.9 feet, MAN). EVAN CARTER MAKES IT! Assist: Kyrie Ming
Score: 70-59

[07:33] Team_010 possession (Score: 70-59)
FOUL! Shooting foul on Immanuel Middleton. Desmond Antetokounmpo to the line for 2 free throws. [Team fouls: 2] (Immanuel Middleton: 2 personal fouls)   FT 1/2: GOOD   FT 2/2: GOOD Desmond Antetokounmpo makes 2/2 from the line.
Score: 72-59

[07:18] Team_095 possession (Score: 72-59)
Shaquille Ball makes the 3Pt and draws the foul on RJ Young! And-1! Shaquille Ball to the line for 1. [Team fouls: 4] (RJ Young: 2 personal fouls)   FT 1/1: GOOD Shaquille Ball makes 1/1 from the line.
Score: 72-63

[07:01] Team_010 possession (Score: 72-63)
RJ Young attempts a 3Pt. Contested by Evan Carter (3.7 feet, MAN). RJ YOUNG MAKES IT! Assist: Michael Turner
Score: 75-63

[06:49] Team_095 possession (Score: 75-63)
Dejounte Hyland drives to the basket... FOUL! Offensive foul on Dejounte Hyland! Cade Morant drew the charge! [Team fouls: 3] (Dejounte Hyland: 1 personal fouls) TURNOVER! (dead ball)

[06:39] Team_010 possession (Score: 75-63)
Michael Turner throws a bad pass! Stolen by Shaquille Ball! TURNOVER! (live ball)

[06:27] Team_095 possession (Score: 75-63)
Evan Carter attempts a 3Pt. Contested by Cade Morant (4.1 feet, ZONE). EVAN CARTER MAKES IT! Assist: Immanuel Middleton
Score: 75-66

[06:08] Team_010 possession (Score: 75-66)
Cade Morant attempts a Midrange. Contested by Dejounte Hyland (5.4 feet, MAN). Cade Morant misses. Rebound secured by Shaquille Ball.

[05:51] Team_095 possession (Score: 75-66)
Immanuel Middleton attempts a 3Pt. Contested by Cade Morant (3.9 feet, ZONE). Immanuel Middleton misses. Rebound secured by Cade Morant.

[05:32] Team_010 possession (Score: 75-66)
Desmond Antetokounmpo drives, Immanuel Middleton stays with him. Desmond Antetokounmpo attempts a Dunk. Contested by Immanuel Middleton (5.1 feet, ZONE). DESMOND ANTETOKOUNMPO MAKES IT!
Score: 77-66

[05:17] Team_095 possession (Score: 77-66)
Evan Carter drives to the basket... Evan Carter throws a bad pass! Stolen by RJ Young! TURNOVER! (live ball)

[04:59] Team_010 possession (Score: 77-66)
Cade Morant makes the 3Pt and draws the foul on Dejounte Hyland! And-1! Cade Morant to the line for 1. [Team fouls: 4] (Dejounte Hyland: 2 personal fouls)   FT 1/1: GOOD Cade Morant makes 1/1 from the line.
Score: 81-66

[04:46] Team_095 possession (Score: 81-66)
Shaquille Ball attempts a 3Pt. Contested by Cade Morant (4.0 feet, ZONE). Shaquille Ball misses. Rebound secured by Michael Turner.

[04:33] Team_010 possession (Score: 81-66)
Anthony Durant attempts a Midrange. Contested by Kyrie Ming (5.5 feet, MAN). ANTHONY DURANT MAKES IT! Assist: Desmond Antetokounmpo
Score: 83-66

[04:20] Team_095 possession (Score: 83-66)
FOUL! Offensive foul on Shaquille Ball! Michael Turner drew the charge! [Team fouls: 5] (Shaquille Ball: 1 personal fouls) TURNOVER! (dead ball)

[04:06] Team_010 possession (Score: 83-66)
Desmond Antetokounmpo attempts a Midrange. BLOCKED BY IMMANUEL MIDDLETON! Ball is loose! Rebound secured by Shaquille Ball.

[03:54] Team_095 possession (Score: 83-66)
Immanuel Middleton makes the Layup and draws the foul on Anthony Durant! And-1! Immanuel Middleton to the line for 1. [BONUS: 5 team fouls] (Anthony Durant: 2 personal fouls)   FT 1/1: GOOD Immanuel Middleton makes 1/1 from the line.
Score: 83-69

[03:35] Team_010 possession (Score: 83-69)
FOUL! Holding foul on Dejounte Hyland. [IN THE BONUS! 6 team fouls] Cade Morant to the line for 2 free throws. (Dejounte Hyland: 3 personal fouls)   FT 1/2: MISS   FT 2/2: GOOD Cade Morant makes 1/2 from the line.
Score: 84-69

[03:22] Team_095 possession (Score: 84-69)
Immanuel Middleton drives and kicks out. Immanuel Middleton attempts a Midrange. Contested by Desmond Antetokounmpo (4.4 feet, MAN). Immanuel Middleton misses. Rebound secured by Michael Turner.

[03:09] Team_010 possession (Score: 84-69)
Michael Turner attempts a 3Pt. Contested by Immanuel Middleton (5.4 feet, ZONE). Michael Turner misses. Rebound secured by Evan Carter.

[02:52] Team_095 possession (Score: 84-69)
FOUL! Shooting foul on Desmond Antetokounmpo. Immanuel Middleton to the line for 2 free throws. [BONUS: 6 team fouls] (Desmond Antetokounmpo: 1 personal fouls)   FT 1/2: MISS   FT 2/2: GOOD Immanuel Middleton makes 1/2 from the line.
Score: 84-70

[02:33] Team_010 possession (Score: 84-70)
RJ Young loses control! Ball rolls out of bounds! TURNOVER! (dead ball)

[02:33] Substitution (Team_010): Cade Morant OUT → Draymond Leonard IN (stamina_rule2)

[02:33] Substitution (Team_010): RJ Young OUT → Ben Gilgeous-Alexander IN (stamina_rule2)

[02:33] Substitution (Team_010): Desmond Antetokounmpo OUT → Vince Ingram IN (stamina_rule2)

[02:33] Substitution (Team_010): Anthony Durant OUT → Paolo Wade IN (stamina_rule2)

[02:33] Substitution (Team_095): Dejounte Hyland OUT → Kyle Poole IN (stamina_rule2)

[02:33] Substitution (Team_095): Immanuel Middleton OUT → Gary Davis IN (stamina_rule2)

[02:33] Substitution (Team_095): Kyrie Ming OUT → DeMar McCollum IN (stamina_rule2)

[02:17] Team_095 possession (Score: 84-70)
Evan Carter attempts a Midrange. Contested by Vince Ingram (5.6 feet, ZONE). EVAN CARTER MAKES IT!
Score: 84-72

[01:59] Team_010 possession (Score: 84-72)
Draymond Leonard attempts a Midrange. Contested by Kyle Poole (5.1 feet, MAN). Draymond Leonard misses. Rebound secured by Gary Davis.

[01:46] Team_095 possession (Score: 84-72)
Kyle Poole loses the ball! Stripped by Draymond Leonard! TURNOVER! (live ball)

[01:31] Team_010 possession (Score: 84-72)
Michael Turner attempts a 3Pt. Contested by Evan Carter (4.4 feet, ZONE). Michael Turner misses. Rebound secured by Gary Davis.

[01:20] Team_095 possession (Score: 84-72)
Kyle Poole attempts a 3Pt. Contested by Draymond Leonard (4.8 feet, ZONE). Kyle Poole misses. Rebound secured by Ben Gilgeous-Alexander.

[01:06] Team_010 possession (Score: 84-72)
Vince Ingram attempts a Midrange. Wide open! Gary Davis is 6.2 feet away. [MAN] Vince Ingram misses. Rebound secured by DeMar McCollum.

[00:50] Team_095 possession (Score: 84-72)
Kyle Poole attempts a Midrange. Contested by Vince Ingram (5.8 feet, ZONE). KYLE POOLE MAKES IT! Assist: Shaquille Ball
Score: 84-74

[00:40] Team_010 possession (Score: 84-74)
Draymond Leonard attempts a 3Pt. Contested by Evan Carter (4.7 feet, ZONE). Draymond Leonard misses. Rebound secured by Evan Carter.

[00:25] Team_095 possession (Score: 84-74)
Kyle Poole attempts a 3Pt. Contested by Draymond Leonard (4.8 feet, ZONE). Kyle Poole misses. Rebound secured by Ben Gilgeous-Alexander.

[00:11] Team_010 possession (Score: 84-74)
FOUL! Holding foul on DeMar McCollum. [IN THE BONUS! 7 team fouls] Paolo Wade to the line for 2 free throws. (DeMar McCollum: 1 personal fouls)   FT 1/2: MISS   FT 2/2: GOOD Paolo Wade makes 1/2 from the line.
Score: 85-74

================================================================================
                              3RD QUARTER COMPLETE                              
================================================================================

3RD QUARTER SCORE: Team_010 18, Team_095 26

BOX SCORE:
================================================================================

Team_010
--------------------------------------------------------------------------------
Player                MIN  PTS  REB  AST  TO      FG   FG%      3P   3P%
--------------------------------------------------------------------------------
Cade Morant            28    5    4    0   0   2/3    66.7     0/0   0.0
Desmond Antetokounmpo   28    4    2    1   0   2/5    40.0     0/0   0.0
Anthony Durant         28    4    0    0   0   2/3    66.7     0/0   0.0
RJ Young               28    3    0    0   0   1/3    33.3     0/0   0.0
Paolo Wade              9    1    0    0   0   1/1   100.0     0/0   0.0
Michael Turner         30    0    2    1   0   0/4     0.0     0/0   0.0
Draymond Leonard        9    0    0    0   0   0/2     0.0     0/0   0.0
Ben Gilgeous-Alexander    9    0    2    0   0   0/0     0.0     0/0   0.0
Vince Ingram            9    0    0    0   0   0/1     0.0     0/0   0.0

TEAM: FG: 8/22 (36.4%), 3PT: 2/8 (25.0%), REB: 10 (1 off, 9 def), AST: 2, TO: 2
TEAM FOULS: 6 [Team_095 in BONUS]


Team_095
--------------------------------------------------------------------------------
Player                MIN  PTS  REB  AST  TO      FG   FG%      3P   3P%
--------------------------------------------------------------------------------
Evan Carter            30   16    6    0   0   6/7    85.7     0/0   0.0
Shaquille Ball         30    4    3    1   0   1/2    50.0     0/0   0.0
Immanuel Middleton     28    4    0    1   0   2/4    50.0     0/0   0.0
Kyle Poole              9    2    0    0   0   1/3    33.3     0/0   0.0
Dejounte Hyland        28    0    3    1   0   0/3     0.0     0/0   0.0
Kyrie Ming             28    0    0    1   0   0/0     0.0     0/0   0.0
Gary Davis              9    0    2    0   0   0/0     0.0     0/0   0.0
DeMar McCollum          9    0    1    0   0   0/0     0.0     0/0   0.0

TEAM: FG: 10/19 (52.6%), 3PT: 4/12 (33.3%), REB: 15 (1 off, 14 def), AST: 4, TO: 4
TEAM FOULS: 7 [Team_010 in BONUS]

================================================================================

================================================================================
                       4TH QUARTER - Team_010 vs Team_095                       
================================================================================

[12:00] Team_010 possession (Score: 85-74)
Desmond Antetokounmpo attempts a Midrange. Contested by Immanuel Middleton (5.1 feet, MAN). DESMOND ANTETOKOUNMPO MAKES IT! Assist: Michael Turner
Score: 87-74

[11:46] Team_095 possession (Score: 87-74)
Immanuel Middleton makes the Layup and draws the foul on Desmond Antetokounmpo! And-1! Immanuel Middleton to the line for 1. [Team fouls: 1] (Desmond Antetokounmpo: 1 personal fouls)   FT 1/1: GOOD Immanuel Middleton makes 1/1 from the line.
Score: 87-77

[11:31] Team_010 possession (Score: 87-77)
Michael Turner attempts a Midrange. Contested by Shaquille Ball (4.9 feet, MAN). MICHAEL TURNER MAKES IT!
Score: 89-77

[11:20] Team_095 possession (Score: 89-77)
FOUL! Reach-in foul on Anthony Durant during the drive. [Team fouls: 2] No free throws, side out. (Anthony Durant: 1 personal fouls)

[11:06] Team_095 possession (Score: 89-77)
Evan Carter drives to the basket... FOUL! Offensive foul on Evan Carter! Anthony Durant drew the charge! [Team fouls: 1] (Evan Carter: 1 personal fouls) TURNOVER! (dead ball)

[10:51] Team_010 possession (Score: 89-77)
Desmond Antetokounmpo throws a bad pass! Stolen by Immanuel Middleton! TURNOVER! (live ball)

[10:38] Team_095 possession (Score: 89-77)
Immanuel Middleton drives and kicks out. Dejounte Hyland attempts a Midrange. Contested by Cade Morant (4.0 feet, MAN). DEJOUNTE HYLAND MAKES IT! Assist: Shaquille Ball
Score: 89-79

[10:20] Team_010 possession (Score: 89-79)
Anthony Durant drives to the basket... Anthony Durant throws a bad pass out of bounds! TURNOVER! (dead ball)

[10:20] Substitution (Team_010): Michael Turner OUT → Blake Harden IN (stamina_rule2)

[10:20] Substitution (Team_095): Shaquille Ball OUT → Cade Beal IN (stamina_rule2)

[10:20] Substitution (Team_095): Evan Carter OUT → Tobias Wagner IN (stamina_rule2)

[10:09] Team_095 possession (Score: 89-79)
Tobias Wagner attempts a 3Pt. Contested by RJ Young (5.2 feet, MAN). TOBIAS WAGNER MAKES IT! Assist: Kyrie Ming
Score: 89-82

[09:55] Team_010 possession (Score: 89-82)
Blake Harden attempts a Layup. Contested by Cade Beal (4.1 feet, MAN). Blake Harden misses. Rebound secured by Dejounte Hyland.

[09:40] Team_095 possession (Score: 89-82)
FOUL! Reach-in foul on Anthony Durant during the drive. [Team fouls: 3] No free throws, side out. (Anthony Durant: 2 personal fouls)

[09:28] Team_095 possession (Score: 89-82)
Dejounte Hyland attempts a Midrange. Contested by Cade Morant (4.1 feet, MAN). Dejounte Hyland misses. Rebound secured by Anthony Durant.

[09:15] Team_010 possession (Score: 89-82)
Cade Morant attempts a Midrange. Contested by Tobias Wagner (4.2 feet, ZONE). CADE MORANT MAKES IT!
Score: 91-82

[08:57] Team_095 possession (Score: 91-82)
Tobias Wagner attempts a 3Pt. Contested by Cade Morant (4.6 feet, ZONE). Tobias Wagner misses. Offensive rebound by Dejounte Hyland! Dejounte Hyland kicks it out.

[08:43] Team_095 possession (Score: 91-82)
Cade Beal attempts a 3Pt. Contested by Blake Harden (4.6 feet, MAN). Cade Beal misses. Offensive rebound by Dejounte Hyland! Dejounte Hyland kicks it out.

[08:27] Team_095 possession (Score: 91-82)
Dejounte Hyland attempts a 3Pt. Contested by Cade Morant (4.2 feet, MAN). Dejounte Hyland misses. Rebound secured by Anthony Durant.

[08:11] Team_010 possession (Score: 91-82)
RJ Young attempts a Layup. BLOCKED BY TOBIAS WAGNER! Ball is loose! Rebound secured by Cade Beal.

[07:56] Team_095 possession (Score: 91-82)
FOUL! Holding foul on Blake Harden. [Team fouls: 4] No free throws, side out. (Blake Harden: 1 personal fouls)

[07:41] Team_095 possession (Score: 91-82)
Dejounte Hyland attempts a 3Pt. Contested by Cade Morant (4.3 feet, ZONE). Dejounte Hyland misses. Rebound secured by Blake Harden.

[07:26] Team_010 possession (Score: 91-82)
Anthony Durant makes the Dunk and draws the foul on Kyrie Ming! And-1! Anthony Durant to the line for 1. [Team fouls: 2] (Kyrie Ming: 1 personal fouls)   FT 1/1: GOOD Anthony Durant makes 1/1 from the line.
Score: 94-82

[07:10] Team_095 possession (Score: 94-82)
Tobias Wagner attempts a Layup. Contested by Anthony Durant (4.4 feet, ZONE). TOBIAS WAGNER MAKES IT! Assist: Immanuel Middleton
Score: 94-84

[06:56] Team_010 possession (Score: 94-84)
Blake Harden attempts a Layup. BLOCKED BY IMMANUEL MIDDLETON! Ball deflects out of bounds off Blake Harden.

[06:46] Team_095 possession (Score: 94-84)
FOUL! Shooting foul on Blake Harden. Dejounte Hyland to the line for 2 free throws. [BONUS: 5 team fouls] (Blake Harden: 2 personal fouls)   FT 1/2: GOOD   FT 2/2: GOOD Dejounte Hyland makes 2/2 from the line.
Score: 94-86

[06:31] Team_010 possession (Score: 94-86)
Desmond Antetokounmpo attempts a Midrange. Contested by Tobias Wagner (3.8 feet, ZONE). DESMOND ANTETOKOUNMPO MAKES IT!
Score: 96-86

[06:19] Team_095 possession (Score: 96-86)
Cade Beal attempts a 3Pt. Contested by Cade Morant (4.6 feet, ZONE). Cade Beal misses. Offensive rebound by Cade Beal! Cade Beal kicks it out.

[06:02] Team_095 possession (Score: 96-86)
Cade Beal attempts a Midrange. Contested by Anthony Durant (4.2 feet, ZONE). Cade Beal misses. Offensive rebound by Tobias Wagner! Tobias Wagner kicks it out.

[05:51] Team_095 possession (Score: 96-86)
Kyrie Ming attempts a Layup. Contested by Anthony Durant (4.4 feet, ZONE). KYRIE MING MAKES IT! Assist: Tobias Wagner
Score: 96-88

[05:32] Team_010 possession (Score: 96-88)
Desmond Antetokounmpo attempts a 3Pt. Contested by Tobias Wagner (3.8 feet, ZONE). Desmond Antetokounmpo misses. Rebound secured by Tobias Wagner.

[05:18] Team_095 possession (Score: 96-88)
Dejounte Hyland drives and kicks out. Dejounte Hyland makes the Midrange and draws the foul on Desmond Antetokounmpo! And-1! Dejounte Hyland to the line for 1. [BONUS: 6 team fouls] (Desmond Antetokounmpo: 2 personal fouls)   FT 1/1: MISS Dejounte Hyland makes 0/1 from the line. Rebound secured by Blake Harden.
Score: 96-90

[05:02] Team_010 possession (Score: 96-90)
Cade Morant attempts a 3Pt. Contested by Tobias Wagner (4.1 feet, ZONE). Cade Morant misses. Offensive rebound by Anthony Durant! Anthony Durant kicks it out.

[04:47] Team_010 possession (Score: 96-90)
FOUL! Holding foul on Dejounte Hyland. [Team fouls: 3] No free throws, side out. (Dejounte Hyland: 1 personal fouls)

[04:33] Team_010 possession (Score: 96-90)
FOUL! Shooting foul on Dejounte Hyland. Blake Harden to the line for 3 free throws. [Team fouls: 4] (Dejounte Hyland: 2 personal fouls)   FT 1/3: GOOD   FT 2/3: GOOD   FT 3/3: MISS Blake Harden makes 2/3 from the line. Rebound secured by Tobias Wagner.
Score: 98-90

[04:18] Team_095 possession (Score: 98-90)
Dejounte Hyland loses the ball! Stripped by Cade Morant! TURNOVER! (live ball)

[04:06] Team_010 possession (Score: 98-90)
RJ Young throws a bad pass out of bounds! TURNOVER! (dead ball)

[04:06] Substitution (Team_010): Cade Morant OUT → Draymond Leonard IN (stamina_rule2)

[04:06] Substitution (Team_010): RJ Young OUT → Ben Gilgeous-Alexander IN (stamina_rule2)

[04:06] Substitution (Team_010): Desmond Antetokounmpo OUT → Vince Ingram IN (stamina_rule2)

[04:06] Substitution (Team_010): Anthony Durant OUT → Paolo Wade IN (stamina_rule2)

[04:06] Substitution (Team_095): Dejounte Hyland OUT → Kyle Poole IN (stamina_rule2)

[04:06] Substitution (Team_095): Immanuel Middleton OUT → Gary Davis IN (stamina_rule2)

[04:06] Substitution (Team_095): Kyrie Ming OUT → DeMar McCollum IN (stamina_rule2)

[03:50] Team_095 possession (Score: 98-90)
Cade Beal attempts a 3Pt. Contested by Blake Harden (4.6 feet, MAN). CADE BEAL MAKES IT! Assist: Kyle Poole
Score: 98-93

[03:35] Team_010 possession (Score: 98-93)
Vince Ingram drives and kicks out. Draymond Leonard attempts a 3Pt. Contested by Kyle Poole (4.7 feet, MAN). DRAYMOND LEONARD MAKES IT!
Score: 101-93

[03:18] Team_095 possession (Score: 101-93)
Kyle Poole attempts a 3Pt. Contested by Draymond Leonard (4.8 feet, MAN). KYLE POOLE MAKES IT! Assist: Tobias Wagner
Score: 101-96

[02:59] Team_010 possession (Score: 101-96)
Ben Gilgeous-Alexander attempts a Midrange. Contested by Tobias Wagner (4.1 feet, MAN). Ben Gilgeous-Alexander misses. FOUL! Loose ball foul on DeMar McCollum during the rebound battle. [IN THE BONUS! 5 team fouls] Blake Harden to the line for 2 free throws. (DeMar McCollum: 1 personal fouls)   FT 1/2: GOOD   FT 2/2: MISS Blake Harden makes 1/2 from the line. Rebound secured by DeMar McCollum.
Score: 102-96

[02:42] Team_095 possession (Score: 102-96)
FOUL! Shooting foul on Paolo Wade. Tobias Wagner to the line for 2 free throws. [BONUS: 7 team fouls] (Paolo Wade: 1 personal fouls)   FT 1/2: GOOD   FT 2/2: GOOD Tobias Wagner makes 2/2 from the line.
Score: 102-98

[02:31] Team_010 possession (Score: 102-98)
Paolo Wade attempts a Midrange. Contested by Cade Beal (4.6 feet, ZONE). PAOLO WADE MAKES IT! Assist: Blake Harden
Score: 104-98

[02:17] Team_095 possession (Score: 104-98)
DeMar McCollum attempts a 3Pt. Contested by Paolo Wade (5.7 feet, MAN). DeMar McCollum misses. Offensive rebound by Tobias Wagner! Tobias Wagner kicks it out.

[02:03] Team_095 possession (Score: 104-98)
Tobias Wagner attempts a Layup. BLOCKED BY PAOLO WADE! Ball is loose! Rebound secured by Blake Harden.

[01:51] Team_010 possession (Score: 104-98)
Ben Gilgeous-Alexander attempts a Layup. BLOCKED BY DEMAR MCCOLLUM! Ball is loose! Offensive rebound by Blake Harden! Blake Harden kicks it out.

[01:37] Team_010 possession (Score: 104-98)
Blake Harden attempts a Midrange. Contested by Cade Beal (4.2 feet, ZONE). BLAKE HARDEN MAKES IT!
Score: 106-98

[01:26] Team_095 possession (Score: 106-98)
Kyle Poole drives and kicks out. Kyle Poole attempts a 3Pt. Contested by Draymond Leonard (4.4 feet, ZONE). Kyle Poole misses. Rebound secured by Blake Harden.

[01:11] Team_010 possession (Score: 106-98)
Ben Gilgeous-Alexander attempts a 3Pt. Contested by Tobias Wagner (4.3 feet, MAN). Ben Gilgeous-Alexander misses. Rebound secured by Gary Davis.

[00:56] Team_095 possession (Score: 106-98)
Cade Beal loses the ball! Stripped by Blake Harden! TURNOVER! (live ball)

[00:44] Team_010 possession (Score: 106-98)
Vince Ingram drives and kicks out. Vince Ingram attempts a 3Pt. Contested by Cade Beal (4.6 feet, ZONE). Vince Ingram misses. Offensive rebound by Ben Gilgeous-Alexander! Ben Gilgeous-Alexander kicks it out.

[00:31] Team_010 possession (Score: 106-98)
Vince Ingram throws a bad pass out of bounds! TURNOVER! (dead ball)

[00:18] Team_095 possession (Score: 106-98)
FOUL! Reach-in foul on Blake Harden during the drive. [IN THE BONUS! 8 team fouls] Cade Beal to the line for 2 free throws. (Blake Harden: 3 personal fouls)   FT 1/2: GOOD   FT 2/2: GOOD Cade Beal makes 2/2 from the line.
Score: 106-100

[00:03] Team_010 possession (Score: 106-100)
Draymond Leonard drives, DeMar McCollum stays with him. Draymond Leonard attempts a Dunk. Contested by DeMar McCollum (5.3 feet, ZONE). DRAYMOND LEONARD MAKES IT! Assist: Paolo Wade
Score: 108-100

================================================================================
                              4TH QUARTER COMPLETE                              
================================================================================

4TH QUARTER SCORE: Team_010 23, Team_095 26

BOX SCORE:
================================================================================

Team_010
--------------------------------------------------------------------------------
Player                MIN  PTS  REB  AST  TO      FG   FG%      3P   3P%
--------------------------------------------------------------------------------
Draymond Leonard       13    5    0    0   0   2/2   100.0     0/0   0.0
Desmond Antetokounmpo   36    4    0    0   0   2/3    66.7     0/0   0.0
Anthony Durant         36    3    3    0   0   1/1   100.0     0/0   0.0
Michael Turner         32    2    0    1   0   1/1   100.0     0/0   0.0
Blake Harden           17    2    5    1   0   1/4    25.0     0/0   0.0
Cade Morant            36    2    0    0   0   1/1   100.0     0/0   0.0
Paolo Wade             13    2    0    1   0   1/1   100.0     0/0   0.0
RJ Young               36    0    0    0   0   0/1     0.0     0/0   0.0
Ben Gilgeous-Alexander   13    0    1    0   0   0/2     0.0     0/0   0.0
DeMar McCollum         13    0    1    0   0   0/0     0.0     0/0   0.0

TEAM: FG: 9/16 (56.2%), 3PT: 0/3 (0.0%), REB: 10 (4 off, 6 def), AST: 3, TO: 4
TEAM FOULS: 8 [Team_095 in BONUS]


Team_095
--------------------------------------------------------------------------------
Player                MIN  PTS  REB  AST  TO      FG   FG%      3P   3P%
--------------------------------------------------------------------------------
Tobias Wagner          17    7    4    2   0   3/4    75.0     0/0   0.0
Cade Beal              17    5    2    0   0   2/2   100.0     0/0   0.0
Dejounte Hyland        36    4    3    0   0   2/6    33.3     0/0   0.0
Immanuel Middleton     36    3    0    1   0   1/1   100.0     0/0   0.0
Kyle Poole             13    3    0    1   0   1/2    50.0     0/0   0.0
Kyrie Ming             36    2    0    1   0   1/1   100.0     0/0   0.0
Shaquille Ball         32    0    0    1   0   0/0     0.0     0/0   0.0
Gary Davis             13    0    1    0   0   0/0     0.0     0/0   0.0

TEAM: FG: 10/16 (62.5%), 3PT: 3/5 (60.0%), REB: 10 (5 off, 5 def), AST: 6, TO: 3
TEAM FOULS: 5 [Team_010 in BONUS]

================================================================================

================================================================================
                               FULL GAME COMPLETE                               
================================================================================

FINAL SCORE: Team_010 108, Team_095 100

SCORING BY QUARTER:
--------------------------------------------------------------------------------
Team                     Q1     Q2     Q3     Q4    FINAL
--------------------------------------------------------------------------------
Team_010                 34     33     18     23      108
Team_095                 23     25     26     26      100
--------------------------------------------------------------------------------

FULL GAME BOX SCORE:
================================================================================

Team_010
--------------------------------------------------------------------------------
Player                MIN  PTS  REB  AST  TO      FG   FG%      3P   3P%      FT STL BLK
--------------------------------------------------------------------------------
Cade Morant            36    9   12    3   1   3/4    75.0   1/1   100.0   4/5     1   0
RJ Young               36   14    0    0   4   6/13   46.2   2/5    40.0   6/8     1   0
Desmond Antetokounmpo   36   23    4    2   3  10/16   62.5   1/4    25.0   8/9     3   0
Anthony Durant         36   16    6    1   2   7/8    87.5   1/2    50.0   1/1     0   0
Michael Turner         32   10    4    3   1   4/10   40.0   2/6    33.3   0/0     1   0
Blake Harden           17   14    7    2   0   6/9    66.7   1/2    50.0   4/6     1   0
Draymond Leonard       13   10    0    0   0   1/5    20.0   0/2     0.0   3/3     1   0
Ben Gilgeous-Alexander   13    0    6    1   1   1/4    25.0   0/1     0.0   0/0     0   0
Vince Ingram           13    4    0    0   1   3/4    75.0   0/0     0.0   2/2     0   0
Paolo Wade             13    3    1    1   0   1/1   100.0   0/0     0.0   1/2     0   1

TEAM: FG: 45/77 (58.4%), 3PT: 8/23 (34.8%), REB: 41 (9 off, 32 def), AST: 13, TO: 13


Team_095
--------------------------------------------------------------------------------
Player                MIN  PTS  REB  AST  TO      FG   FG%      3P   3P%      FT STL BLK
--------------------------------------------------------------------------------
Dejounte Hyland        36   16   12    3   1   6/18   33.3   1/9    11.1   5/6     0   0
Immanuel Middleton     36   11    0    3   2   6/11   54.5   0/3     0.0   7/8     2   2
Kyrie Ming             36   11    0    3   2   5/5   100.0   0/0     0.0   2/3     0   1
Shaquille Ball         32    4    4    3   4   1/5    20.0   1/2    50.0   1/1     1   0
Evan Carter            32   25   10    0   1  10/12   83.3   4/6    66.7   5/5     0   1
Cade Beal              17   10    2    0   1   4/5    80.0   2/2   100.0   2/2     0   0
Tobias Wagner          17    7    5    3   0   4/7    57.1   1/1   100.0   2/2     0   1
Kyle Poole             13    7    0    2   2   3/8    37.5   1/4    25.0   0/0     0   0
Gary Davis             13    1    3    0   0   1/1   100.0   0/0     0.0   1/2     0   0
DeMar McCollum         13    6    4    0   0   2/2   100.0   0/0     0.0   4/5     0   1

TEAM: FG: 42/74 (56.8%), 3PT: 10/27 (37.0%), REB: 39 (9 off, 30 def), AST: 17, TO: 13

================================================================================
