================================================================================
                        FULL GAME - Team_028 vs Team_075                        
================================================================================

================================================================================
                       1ST QUARTER - Team_028 vs Team_075                       
================================================================================

[12:00] Team_028 possession (Score: 0-0)
Austin Russell attempts a Layup. Contested by Larry McCollum (4.1 feet, MAN). AUSTIN RUSSELL MAKES IT!
Score: 2-0

[11:43] Team_075 possession (Score: 2-0)
Klay Jokic drives, picks up Kawhi Ball. Help arrives from Carmelo Carter! Klay Jokic attempts a Dunk. Contested by Carmelo Carter (4.7 feet, ZONE). KLAY JOKIC MAKES IT! Assist: Larry McCollum
Score: 2-2

[11:26] Team_028 possession (Score: 2-2)
Myles Haliburton attempts a 3Pt. Contested by Myles Barrett (6.0 feet, MAN). Myles Haliburton misses. FOUL! Loose ball foul on Derrick Stewart during the rebound battle. [Team fouls: 1] No free throws, side out. (Derrick Stewart: 1 personal fouls)

[11:12] Team_028 possession (Score: 2-2)
Austin Russell attempts a Midrange. Contested by Kawhi Ingram (3.9 feet, ZONE). Austin Russell misses. Rebound secured by Kawhi Ingram.

[11:00] Team_075 possession (Score: 2-2)
Larry McCollum attempts a 3Pt. Contested by Austin Russell (4.6 feet, ZONE). Larry McCollum misses. Rebound secured by Jimmy Brogdon.

[10:45] Team_028 possession (Score: 2-2)
FOUL! Offensive foul on Austin Russell! Larry McCollum drew the charge! [Team fouls: 1] (Austin Russell: 1 personal fouls) TURNOVER! (dead ball)

[10:29] Team_075 possession (Score: 2-2)
Myles Barrett attempts a 3Pt. Contested by Myles Haliburton (3.9 feet, MAN). Myles Barrett misses. Rebound secured by Carmelo Carter.

[10:17] Team_028 possession (Score: 2-2)
Carmelo Carter attempts a 3Pt. Contested by Kawhi Ingram (4.3 feet, MAN). CARMELO CARTER MAKES IT! Assist: Jimmy Brogdon
Score: 5-2

[10:02] Team_075 possession (Score: 5-2)
Derrick Stewart drives and kicks out. Klay Jokic attempts a 3Pt. Contested by Jimmy Brogdon (4.2 feet, MAN). KLAY JOKIC MAKES IT! Assist: Larry McCollum
Score: 5-5

[09:51] Team_028 possession (Score: 5-5)
Kawhi Ball attempts a 3Pt. Contested by Larry McCollum (4.4 feet, ZONE). Kawhi Ball misses. Offensive rebound by Kawhi Ball! Kawhi Ball kicks it out.

[09:38] Team_028 possession (Score: 5-5)
Jimmy Brogdon attempts a Layup. BLOCKED BY LARRY MCCOLLUM! Ball is loose! Offensive rebound by Jimmy Brogdon! Jimmy Brogdon kicks it out.

[09:28] Team_028 possession (Score: 5-5)
FOUL! Holding foul on Klay Jokic. [Team fouls: 3] No free throws, side out. (Klay Jokic: 1 personal fouls)

[09:17] Team_028 possession (Score: 5-5)
Jimmy Brogdon makes the Layup and draws the foul on Klay Jokic! And-1! Jimmy Brogdon to the line for 1. [Team fouls: 4] (Klay Jokic: 2 personal fouls)   FT 1/1: GOOD Jimmy Brogdon makes 1/1 from the line.
Score: 8-5

[09:06] Team_075 possession (Score: 8-5)
Larry McCollum attempts a 3Pt. Contested by Austin Russell (4.6 feet, ZONE). Larry McCollum misses. Rebound secured by Jimmy Brogdon.

[08:51] Team_028 possession (Score: 8-5)
Austin Russell drives, picks up Larry McCollum. Help arrives from Myles Barrett! Austin Russell attempts a Dunk. Contested by Myles Barrett (4.1 feet, MAN). AUSTIN RUSSELL MAKES IT! Assist: Kawhi Ball
Score: 10-5

[08:34] Team_075 possession (Score: 10-5)
Derrick Stewart drives, Kawhi Ball stays with him. Derrick Stewart attempts a Dunk. Contested by Kawhi Ball (4.2 feet, ZONE). Derrick Stewart misses. Offensive rebound by Kawhi Ingram! Kawhi Ingram kicks it out.

[08:22] Team_075 possession (Score: 10-5)
Klay Jokic attempts a Midrange. Contested by Jimmy Brogdon (4.8 feet, MAN). Klay Jokic misses. Offensive rebound by Derrick Stewart! Derrick Stewart kicks it out.

[08:11] Team_075 possession (Score: 10-5)
FOUL! Shooting foul on Carmelo Carter. Kawhi Ingram to the line for 2 free throws. [Team fouls: 2] (Carmelo Carter: 1 personal fouls)   FT 1/2: GOOD   FT 2/2: GOOD Kawhi Ingram makes 2/2 from the line.
Score: 10-7

[07:55] Team_028 possession (Score: 10-7)
Carmelo Carter attempts a 3Pt. Contested by Kawhi Ingram (4.3 feet, MAN). Carmelo Carter misses. Rebound secured by Klay Jokic.

[07:42] Team_075 possession (Score: 10-7)
Derrick Stewart attempts a Layup. Contested by Kawhi Ball (4.2 feet, ZONE). DERRICK STEWART MAKES IT! Assist: Kawhi Ingram
Score: 10-9

[07:27] Team_028 possession (Score: 10-9)
FOUL! Holding foul on Larry McCollum. [IN THE BONUS! 5 team fouls] Austin Russell to the line for 2 free throws. (Larry McCollum: 1 personal fouls)   FT 1/2: GOOD   FT 2/2: GOOD Austin Russell makes 2/2 from the line.
Score: 12-9

[07:11] Team_075 possession (Score: 12-9)
FOUL! Shooting foul on Myles Haliburton. Myles Barrett to the line for 2 free throws. [Team fouls: 3] (Myles Haliburton: 1 personal fouls)   FT 1/2: MISS   FT 2/2: GOOD Myles Barrett makes 1/2 from the line.
Score: 12-10

[06:56] Team_028 possession (Score: 12-10)
Jimmy Brogdon attempts a Layup. Contested by Klay Jokic (5.9 feet, MAN). Jimmy Brogdon misses. Rebound secured by Derrick Stewart.

[06:45] Team_075 possession (Score: 12-10)
Klay Jokic attempts a Midrange. Contested by Jimmy Brogdon (4.8 feet, MAN). Klay Jokic misses. Offensive rebound by Kawhi Ingram! Kawhi Ingram kicks it out.

[06:30] Team_075 possession (Score: 12-10)
Klay Jokic drives and kicks out. Derrick Stewart attempts a Midrange. Contested by Myles Haliburton (3.6 feet, ZONE). Derrick Stewart misses. Offensive rebound by Derrick Stewart! Derrick Stewart kicks it out.

[06:20] Team_075 possession (Score: 12-10)
Kawhi Ingram attempts a 3Pt. Contested by Austin Russell (4.3 feet, ZONE). Kawhi Ingram misses. Rebound secured by Carmelo Carter.

[06:07] Team_028 possession (Score: 12-10)
Jimmy Brogdon attempts a Layup. Contested by Klay Jokic (5.9 feet, MAN). JIMMY BROGDON MAKES IT!
Score: 14-10

[05:54] Team_075 possession (Score: 14-10)
Larry McCollum drives to the basket... Larry McCollum throws a bad pass! Stolen by Austin Russell! TURNOVER! (live ball)

[05:38] Team_028 possession (Score: 14-10)
Carmelo Carter attempts a Layup. BLOCKED BY KAWHI INGRAM! Ball is loose! Rebound secured by Klay Jokic.

[05:28] Team_075 possession (Score: 14-10)
Klay Jokic makes the Dunk and draws the foul on Jimmy Brogdon! And-1! Klay Jokic to the line for 1. [Team fouls: 4] (Jimmy Brogdon: 1 personal fouls)   FT 1/1: GOOD Klay Jokic makes 1/1 from the line.
Score: 14-13

[05:12] Team_028 possession (Score: 14-13)
Myles Haliburton attempts a 3Pt. Contested by Larry McCollum (4.4 feet, ZONE). Myles Haliburton misses. Rebound secured by Klay Jokic.

[04:55] Team_075 possession (Score: 14-13)
Kawhi Ingram attempts a 3Pt. Contested by Austin Russell (4.3 feet, ZONE). KAWHI INGRAM MAKES IT!
Score: 14-16

[04:41] Team_028 possession (Score: 14-16)
FOUL! Shooting foul on Larry McCollum. Austin Russell to the line for 3 free throws. [BONUS: 6 team fouls] (Larry McCollum: 2 personal fouls)   FT 1/3: GOOD   FT 2/3: GOOD   FT 3/3: GOOD Austin Russell makes 3/3 from the line.
Score: 17-16

[04:29] Team_075 possession (Score: 17-16)
FOUL! Shooting foul on Jimmy Brogdon. Klay Jokic to the line for 2 free throws. [BONUS: 5 team fouls] (Jimmy Brogdon: 2 personal fouls)   FT 1/2: GOOD   FT 2/2: GOOD Klay Jokic makes 2/2 from the line.
Score: 17-18

[04:14] Team_028 possession (Score: 17-18)
Austin Russell drives, Larry McCollum stays with him. Austin Russell attempts a Layup. Contested by Larry McCollum (4.2 feet, MAN). AUSTIN RUSSELL MAKES IT! Assist: Myles Haliburton
Score: 19-18

[03:58] Team_075 possession (Score: 19-18)
Kawhi Ingram attempts a Midrange. Contested by Carmelo Carter (4.4 feet, MAN). KAWHI INGRAM MAKES IT! Assist: Myles Barrett
Score: 19-20

[03:38] Team_028 possession (Score: 19-20)
Austin Russell drives and kicks out. Austin Russell attempts a 3Pt. Contested by Larry McCollum (4.4 feet, ZONE). AUSTIN RUSSELL MAKES IT! Assist: Kawhi Ball
Score: 22-20

[03:21] Team_075 possession (Score: 22-20)
Kawhi Ingram attempts a Midrange. BLOCKED BY MYLES HALIBURTON! Ball is loose! Offensive rebound by Derrick Stewart! Derrick Stewart kicks it out.

[03:11] Team_075 possession (Score: 22-20)
Kawhi Ingram drives and kicks out. Myles Barrett attempts a 3Pt. Contested by Austin Russell (4.7 feet, ZONE). Myles Barrett misses. FOUL! Loose ball foul on Jimmy Brogdon during the rebound battle. [IN THE BONUS! 6 team fouls] Derrick Stewart to the line for 2 free throws. (Jimmy Brogdon: 3 personal fouls)   FT 1/2: GOOD   FT 2/2: GOOD Derrick Stewart makes 2/2 from the line.
Score: 22-22

[02:56] Team_028 possession (Score: 22-22)
Austin Russell attempts a 3Pt. Contested by Larry McCollum (4.4 feet, ZONE). Austin Russell misses. Rebound secured by Derrick Stewart.

[02:42] Team_075 possession (Score: 22-22)
Myles Barrett loses the ball! Stripped by Myles Haliburton! TURNOVER! (live ball)

[02:28] Team_028 possession (Score: 22-22)
Jimmy Brogdon throws a bad pass! Stolen by Klay Jokic! TURNOVER! (live ball)

[02:16] Team_075 possession (Score: 22-22)
Myles Barrett attempts a Midrange. Contested by Myles Haliburton (4.1 feet, MAN). MYLES BARRETT MAKES IT!
Score: 22-24

[02:06] Team_028 possession (Score: 22-24)
FOUL! Reach-in foul on Derrick Stewart during the drive. [IN THE BONUS! 7 team fouls] Kawhi Ball to the line for 2 free throws. (Derrick Stewart: 3 personal fouls)   FT 1/2: MISS   FT 2/2: GOOD Kawhi Ball makes 1/2 from the line.
Score: 23-24

[01:51] Team_075 possession (Score: 23-24)
Derrick Stewart attempts a Midrange. Contested by Austin Russell (4.7 feet, ZONE). Derrick Stewart misses. Rebound secured by Carmelo Carter.

[01:32] Team_028 possession (Score: 23-24)
Jimmy Brogdon attempts a Layup. Contested by Derrick Stewart (5.4 feet, ZONE). JIMMY BROGDON MAKES IT!
Score: 25-24

[01:15] Team_075 possession (Score: 25-24)
Klay Jokic attempts a Layup. Contested by Jimmy Brogdon (5.2 feet, MAN). KLAY JOKIC MAKES IT! Assist: Kawhi Ingram
Score: 25-26

[01:06] Team_028 possession (Score: 25-26)
Myles Haliburton attempts a Midrange. Contested by Derrick Stewart (5.0 feet, ZONE). Myles Haliburton misses. Offensive rebound by Jimmy Brogdon! Jimmy Brogdon kicks it out.

[00:51] Team_028 possession (Score: 25-26)
FOUL! Shooting foul on Derrick Stewart. Kawhi Ball to the line for 2 free throws. [BONUS: 8 team fouls] (Derrick Stewart: 4 personal fouls)   FT 1/2: GOOD   FT 2/2: GOOD Kawhi Ball makes 2/2 from the line.
Score: 27-26

[00:38] Team_075 possession (Score: 27-26)
Derrick Stewart attempts a Midrange. Contested by Kawhi Ball (4.8 feet, MAN). Derrick Stewart misses. Rebound secured by Carmelo Carter.

[00:29] Team_028 possession (Score: 27-26)
Jimmy Brogdon makes the Layup and draws the foul on Derrick Stewart! And-1! Jimmy Brogdon to the line for 1. [BONUS: 9 team fouls] (Derrick Stewart: 5 personal fouls)   FT 1/1: GOOD Jimmy Brogdon makes 1/1 from the line.
Score: 30-26

[00:14] Team_075 possession (Score: 30-26)
Kawhi Ingram attempts a 3Pt. Contested by Carmelo Carter (4.8 feet, MAN). Kawhi Ingram misses. Rebound secured by Jimmy Brogdon.

================================================================================
                              1ST QUARTER COMPLETE                              
================================================================================

1ST QUARTER SCORE: Team_028 30, Team_075 26

BOX SCORE:
================================================================================

Team_028
--------------------------------------------------------------------------------
Player                MIN  PTS  REB  AST  TO      FG   FG%      3P   3P%
--------------------------------------------------------------------------------
Austin Russell         12   14    0    0   0   6/8    75.0     0/0   0.0
Jimmy Brogdon          12   10    6    1   0   4/5    80.0     0/0   0.0
Carmelo Carter         12    3    4    0   0   1/3    33.3     0/0   0.0
Kawhi Ball             12    3    1    2   0   2/2   100.0     0/0   0.0
Myles Haliburton       12    0    0    1   0   0/1     0.0     0/0   0.0

TEAM: FG: 13/19 (68.4%), 3PT: 2/5 (40.0%), REB: 11 (4 off, 7 def), AST: 4, TO: 2
TEAM FOULS: 6 [Team_075 in BONUS]


Team_075
--------------------------------------------------------------------------------
Player                MIN  PTS  REB  AST  TO      FG   FG%      3P   3P%
--------------------------------------------------------------------------------
Klay Jokic             12   12    3    0   0   5/5   100.0     0/0   0.0
Kawhi Ingram           12    7    3    2   0   3/5    60.0     0/0   0.0
Derrick Stewart        12    4    5    0   0   2/4    50.0     0/0   0.0
Myles Barrett          12    3    0    1   0   2/3    66.7     0/0   0.0
Larry McCollum         12    0    0    2   0   0/2     0.0     0/0   0.0

TEAM: FG: 12/19 (63.2%), 3PT: 1/6 (16.7%), REB: 11 (5 off, 6 def), AST: 5, TO: 2
TEAM FOULS: 9 [Team_028 in BONUS]

================================================================================

================================================================================
                       2ND QUARTER - Team_028 vs Team_075                       
================================================================================

[12:00] Team_028 possession (Score: 30-26)
Kawhi Ball attempts a Midrange. Contested by Derrick Stewart (5.0 feet, MAN). Kawhi Ball misses. Rebound secured by Kawhi Ingram.

[11:41] Team_075 possession (Score: 30-26)
Kawhi Ingram attempts a 3Pt. Contested by Carmelo Carter (4.6 feet, ZONE). Kawhi Ingram misses. Rebound secured by Carmelo Carter.

[11:26] Team_028 possession (Score: 30-26)
Carmelo Carter makes the Midrange and draws the foul on Kawhi Ingram! And-1! Carmelo Carter to the line for 1. [Team fouls: 1] (Kawhi Ingram: 1 personal fouls)   FT 1/1: GOOD Carmelo Carter makes 1/1 from the line.
Score: 33-26

[11:11] Team_075 possession (Score: 33-26)
Kawhi Ingram makes the Layup and draws the foul on Carmelo Carter! And-1! Kawhi Ingram to the line for 1. [Team fouls: 1] (Carmelo Carter: 1 personal fouls)   FT 1/1: GOOD Kawhi Ingram makes 1/1 from the line.
Score: 33-29

[10:56] Team_028 possession (Score: 33-29)
Austin Russell attempts a 3Pt. Contested by Larry McCollum (4.6 feet, ZONE). Austin Russell misses. Rebound secured by Kawhi Ingram.

[10:42] Team_075 possession (Score: 33-29)
Derrick Stewart loses the ball! Stripped by Kawhi Ball! TURNOVER! (live ball)

[10:28] Team_028 possession (Score: 33-29)
Kawhi Ball attempts a 3Pt. Contested by Derrick Stewart (5.2 feet, MAN). Kawhi Ball misses. Offensive rebound by Jimmy Brogdon! Jimmy Brogdon kicks it out.

[10:18] Team_028 possession (Score: 33-29)
Jimmy Brogdon drives, Derrick Stewart stays with him. Jimmy Brogdon attempts a Dunk. Contested by Derrick Stewart (5.5 feet, ZONE). JIMMY BROGDON MAKES IT!
Score: 35-29

[10:04] Team_075 possession (Score: 35-29)
Kawhi Ingram attempts a 3Pt. Contested by Carmelo Carter (4.8 feet, MAN). Kawhi Ingram misses. Rebound secured by Jimmy Brogdon.

[09:47] Team_028 possession (Score: 35-29)
Austin Russell attempts a 3Pt. Contested by Larry McCollum (4.7 feet, MAN). Austin Russell misses. Rebound secured by Kawhi Ingram.

[09:35] Team_075 possession (Score: 35-29)
FOUL! Shooting foul on Austin Russell. Larry McCollum to the line for 3 free throws. [Team fouls: 2] (Austin Russell: 1 personal fouls)   FT 1/3: MISS   FT 2/3: GOOD   FT 3/3: GOOD Larry McCollum makes 2/3 from the line.
Score: 35-31

[09:23] Team_028 possession (Score: 35-31)
Austin Russell attempts a 3Pt. Contested by Larry McCollum (4.8 feet, ZONE). Austin Russell misses. Rebound secured by Kawhi Ingram.

[09:09] Team_075 possession (Score: 35-31)
FOUL! Holding foul on Kawhi Ball. [Team fouls: 3] No free throws, side out. (Kawhi Ball: 1 personal fouls)

[08:56] Team_075 possession (Score: 35-31)
Klay Jokic attempts a 3Pt. Contested by Austin Russell (5.5 feet, ZONE). Klay Jokic misses. Rebound secured by Kawhi Ball.

[08:40] Team_028 possession (Score: 35-31)
Myles Haliburton attempts a 3Pt. Contested by Larry McCollum (5.1 feet, ZONE). Myles Haliburton misses. Rebound secured by Kawhi Ingram.

[08:22] Team_075 possession (Score: 35-31)
Klay Jokic drives to the basket... FOUL! Offensive foul on Klay Jokic! Jimmy Brogdon drew the charge! [Team fouls: 2] (Klay Jokic: 1 personal fouls) TURNOVER! (dead ball)

[08:07] Team_028 possession (Score: 35-31)
Jimmy Brogdon drives and kicks out. Kawhi Ball makes the 3Pt and draws the foul on Derrick Stewart! And-1! Kawhi Ball to the line for 1. [Team fouls: 3] (Derrick Stewart: 1 personal fouls)   FT 1/1: GOOD Kawhi Ball makes 1/1 from the line.
Score: 39-31

[07:53] Team_075 possession (Score: 39-31)
Klay Jokic makes the Layup and draws the foul on Kawhi Ball! And-1! Klay Jokic to the line for 1. [Team fouls: 4] (Kawhi Ball: 2 personal fouls)   FT 1/1: GOOD Klay Jokic makes 1/1 from the line.
Score: 39-34

[07:34] Team_028 possession (Score: 39-34)
Austin Russell attempts a 3Pt. Contested by Larry McCollum (5.0 feet, MAN). AUSTIN RUSSELL MAKES IT! Assist: Myles Haliburton
Score: 42-34

[07:18] Team_075 possession (Score: 42-34)
FOUL! Shooting foul on Kawhi Ball. Derrick Stewart to the line for 2 free throws. [BONUS: 5 team fouls] (Kawhi Ball: 3 personal fouls)   FT 1/2: GOOD   FT 2/2: MISS Derrick Stewart makes 1/2 from the line. Rebound secured by Kawhi Ball.
Score: 42-35

[06:59] Team_028 possession (Score: 42-35)
FOUL! Reach-in foul on Derrick Stewart during the drive. [Team fouls: 4] No free throws, side out. (Derrick Stewart: 2 personal fouls)

[06:45] Team_028 possession (Score: 42-35)
FOUL! Holding foul on Klay Jokic. [IN THE BONUS! 5 team fouls] Jimmy Brogdon to the line for 2 free throws. (Klay Jokic: 2 personal fouls)   FT 1/2: GOOD   FT 2/2: MISS Jimmy Brogdon makes 1/2 from the line. Offensive rebound by Jimmy Brogdon! Jimmy Brogdon kicks it out.
Score: 43-35

[06:29] Team_028 possession (Score: 43-35)
Myles Haliburton attempts a 3Pt. Wide open! Myles Barrett is 6.8 feet away. [MAN] MYLES HALIBURTON MAKES IT! Assist: Austin Russell
Score: 46-35

[06:18] Team_075 possession (Score: 46-35)
FOUL! Reach-in foul on Austin Russell during the drive. [IN THE BONUS! 6 team fouls] Larry McCollum to the line for 2 free throws. (Austin Russell: 2 personal fouls)   FT 1/2: GOOD   FT 2/2: GOOD Larry McCollum makes 2/2 from the line.
Score: 46-37

[06:08] Team_028 possession (Score: 46-37)
Carmelo Carter drives, Derrick Stewart stays with him. Carmelo Carter attempts a Dunk. Contested by Derrick Stewart (5.9 feet, ZONE). Carmelo Carter misses. Rebound secured by Kawhi Ingram.

[05:55] Team_075 possession (Score: 46-37)
Kawhi Ingram attempts a 3Pt. Contested by Carmelo Carter (5.3 feet, MAN). Kawhi Ingram misses. Offensive rebound by Derrick Stewart! Derrick Stewart kicks it out.

[05:39] Team_075 possession (Score: 46-37)
Larry McCollum drives and kicks out. Kawhi Ingram attempts a 3Pt. Contested by Austin Russell (5.6 feet, ZONE). Kawhi Ingram misses. Rebound secured by Jimmy Brogdon.

[05:21] Team_028 possession (Score: 46-37)
Carmelo Carter makes the Layup and draws the foul on Derrick Stewart! And-1! Carmelo Carter to the line for 1. [BONUS: 6 team fouls] (Derrick Stewart: 3 personal fouls)   FT 1/1: GOOD Carmelo Carter makes 1/1 from the line.
Score: 49-37

[05:07] Team_075 possession (Score: 49-37)
FOUL! Shooting foul on Austin Russell. Larry McCollum to the line for 2 free throws. [BONUS: 7 team fouls] (Austin Russell: 3 personal fouls)   FT 1/2: GOOD   FT 2/2: MISS Larry McCollum makes 1/2 from the line. Rebound secured by Jimmy Brogdon.
Score: 49-38

[04:49] Team_028 possession (Score: 49-38)
FOUL! Shooting foul on Larry McCollum. Austin Russell to the line for 3 free throws. [BONUS: 7 team fouls] (Larry McCollum: 1 personal fouls)   FT 1/3: GOOD   FT 2/3: GOOD   FT 3/3: GOOD Austin Russell makes 3/3 from the line.
Score: 52-38

[04:32] Team_075 possession (Score: 52-38)
Derrick Stewart drives, Kawhi Ball stays with him. Derrick Stewart attempts a Layup. Contested by Kawhi Ball (5.7 feet, ZONE). Derrick Stewart misses. Rebound secured by Carmelo Carter.

[04:15] Team_028 possession (Score: 52-38)
Myles Haliburton attempts a 3Pt. Contested by Larry McCollum (5.7 feet, ZONE). Myles Haliburton misses. Rebound secured by Klay Jokic.

[04:03] Team_075 possession (Score: 52-38)
Kawhi Ingram throws a bad pass out of bounds! TURNOVER! (dead ball)

[04:03] Substitution (Team_028): Austin Russell OUT → Scottie Ingram IN (stamina_rule2)

[04:03] Substitution (Team_028): Carmelo Carter OUT → Tyrese Quickley IN (stamina_rule2)

[04:03] Substitution (Team_028): Myles Haliburton OUT → Miles Booker IN (stamina_rule2)

[04:03] Substitution (Team_028): Kawhi Ball OUT → Bam Towns IN (stamina_rule2)

[04:03] Substitution (Team_028): Jimmy Brogdon OUT → Collin Bridges IN (stamina_rule2)

[04:03] Substitution (Team_075): Larry McCollum OUT → D'Angelo Anunoby IN (stamina_rule2)

[04:03] Substitution (Team_075): Kawhi Ingram OUT → LeBron Ginobili IN (stamina_rule2)

[04:03] Substitution (Team_075): Myles Barrett OUT → Donovan Paul IN (stamina_rule2)

[04:03] Substitution (Team_075): Derrick Stewart OUT → Collin Duncan IN (stamina_rule2)

[04:03] Substitution (Team_075): Klay Jokic OUT → Kevin Towns IN (stamina_rule2)

[03:45] Team_028 possession (Score: 52-38)
Bam Towns attempts a Midrange. Contested by Collin Duncan (5.7 feet, MAN). BAM TOWNS MAKES IT!
Score: 54-38

[03:28] Team_075 possession (Score: 54-38)
Kevin Towns attempts a Midrange. Contested by Collin Bridges (4.2 feet, MAN). Kevin Towns misses. Offensive rebound by Collin Duncan! Collin Duncan kicks it out.

[03:15] Team_075 possession (Score: 54-38)
Donovan Paul attempts a 3Pt. Wide open! Miles Booker is 6.4 feet away. [MAN] DONOVAN PAUL MAKES IT! Assist: LeBron Ginobili
Score: 54-41

[03:00] Team_028 possession (Score: 54-41)
Collin Bridges attempts a Layup. Contested by Kevin Towns (5.6 feet, MAN). Collin Bridges misses. Offensive rebound by Collin Bridges! Collin Bridges kicks it out.

[02:47] Team_028 possession (Score: 54-41)
Scottie Ingram drives, Kevin Towns stays with him. Scottie Ingram attempts a Layup. Contested by Kevin Towns (5.4 feet, ZONE). Scottie Ingram misses. Offensive rebound by Collin Bridges! Collin Bridges kicks it out.

[02:33] Team_028 possession (Score: 54-41)
Bam Towns attempts a 3Pt. Contested by D'Angelo Anunoby (5.3 feet, ZONE). Bam Towns misses. Rebound secured by Kevin Towns.

[02:16] Team_075 possession (Score: 54-41)
Donovan Paul drives, Miles Booker stays with him. Donovan Paul attempts a Dunk. Wide open! Miles Booker is 6.4 feet away. [MAN] DONOVAN PAUL MAKES IT! Assist: D'Angelo Anunoby
Score: 54-43

[02:01] Team_028 possession (Score: 54-43)
Collin Bridges attempts a Midrange. Contested by Collin Duncan (5.8 feet, ZONE). Collin Bridges misses. Rebound secured by Kevin Towns.

[01:51] Team_075 possession (Score: 54-43)
FOUL! Shooting foul on Collin Bridges. Kevin Towns to the line for 2 free throws. [BONUS: 8 team fouls] (Collin Bridges: 1 personal fouls)   FT 1/2: GOOD   FT 2/2: GOOD Kevin Towns makes 2/2 from the line.
Score: 54-45

[01:35] Team_028 possession (Score: 54-45)
Bam Towns attempts a Layup. BLOCKED BY COLLIN DUNCAN! Ball is loose! Offensive rebound by Bam Towns! Bam Towns kicks it out.

[01:21] Team_028 possession (Score: 54-45)
Tyrese Quickley drives and kicks out. Collin Bridges attempts a Midrange. Contested by Kevin Towns (5.4 feet, MAN). COLLIN BRIDGES MAKES IT!
Score: 56-45

[01:04] Team_075 possession (Score: 56-45)
LeBron Ginobili attempts a 3Pt. Contested by Tyrese Quickley (4.5 feet, MAN). LeBron Ginobili misses. Rebound secured by Tyrese Quickley.

[00:47] Team_028 possession (Score: 56-45)
FOUL! Offensive foul on Collin Bridges! Kevin Towns drew the charge! [Team fouls: 9] (Collin Bridges: 2 personal fouls) TURNOVER! (dead ball)

[00:35] Team_075 possession (Score: 56-45)
Collin Duncan makes the Layup and draws the foul on Collin Bridges! And-1! Collin Duncan to the line for 1. [BONUS: 10 team fouls] (Collin Bridges: 3 personal fouls)   FT 1/1: GOOD Collin Duncan makes 1/1 from the line.
Score: 56-48

[00:18] Team_028 possession (Score: 56-48)
Collin Bridges drives to the basket... Collin Bridges throws a bad pass! Stolen by Kevin Towns! TURNOVER! (live ball)

================================================================================
                              2ND QUARTER COMPLETE                              
================================================================================

2ND QUARTER SCORE: Team_028 26, Team_075 22

BOX SCORE:
================================================================================

Team_028
--------------------------------------------------------------------------------
Player                MIN  PTS  REB  AST  TO      FG   FG%      3P   3P%
--------------------------------------------------------------------------------
Carmelo Carter         20    6    2    0   0   2/3    66.7     0/0   0.0
Austin Russell         20    6    0    1   0   2/5    40.0     0/0   0.0
Kawhi Ball             20    4    2    0   0   1/2    50.0     0/0   0.0
Myles Haliburton       20    3    0    1   0   1/3    33.3     0/0   0.0
Jimmy Brogdon          20    2    5    0   0   1/1   100.0     0/0   0.0
Bam Towns               4    2    1    0   0   1/2    50.0     0/0   0.0
Collin Bridges          4    2    2    0   0   1/2    50.0     0/0   0.0
Tyrese Quickley         4    0    1    0   0   0/0     0.0     0/0   0.0

TEAM: FG: 9/18 (50.0%), 3PT: 3/9 (33.3%), REB: 13 (5 off, 8 def), AST: 2, TO: 2
TEAM FOULS: 10 [Team_075 in BONUS]


Team_075
--------------------------------------------------------------------------------
Player                MIN  PTS  REB  AST  TO      FG   FG%      3P   3P%
--------------------------------------------------------------------------------
Donovan Paul            4    5    0    0   0   2/2   100.0     0/0   0.0
Larry McCollum         20    4    0    0   0   2/4    50.0     0/0   0.0
Kawhi Ingram           20    3    6    0   0   1/3    33.3     0/0   0.0
Klay Jokic             20    3    1    0   0   1/2    50.0     0/0   0.0
Collin Duncan           4    3    1    0   0   1/1   100.0     0/0   0.0
Kevin Towns             4    2    2    0   0   1/1   100.0     0/0   0.0
Derrick Stewart        20    0    1    0   0   0/2     0.0     0/0   0.0
LeBron Ginobili         4    0    0    1   0   0/1     0.0     0/0   0.0
D'Angelo Anunoby        4    0    0    1   0   0/0     0.0     0/0   0.0

TEAM: FG: 8/16 (50.0%), 3PT: 2/6 (33.3%), REB: 11 (2 off, 9 def), AST: 2, TO: 3
TEAM FOULS: 7 [Team_028 in BONUS]

================================================================================

================================================================================
                       3RD QUARTER - Team_028 vs Team_075                       
================================================================================

[12:00] Team_028 possession (Score: 56-48)
Carmelo Carter attempts a 3Pt. Contested by Kawhi Ingram (4.3 feet, MAN). Carmelo Carter misses. Rebound secured by Klay Jokic.

[11:46] Team_075 possession (Score: 56-48)
Klay Jokic drives to the basket... Klay Jokic loses the ball! Stripped by Jimmy Brogdon! TURNOVER! (live ball)

[11:31] Team_028 possession (Score: 56-48)
FOUL! Offensive foul on Myles Haliburton! Myles Barrett drew the charge! [Team fouls: 1] (Myles Haliburton: 1 personal fouls) TURNOVER! (dead ball)

[11:18] Team_075 possession (Score: 56-48)
FOUL! Shooting foul on Jimmy Brogdon. Klay Jokic to the line for 2 free throws. [Team fouls: 2] (Jimmy Brogdon: 1 personal fouls)   FT 1/2: GOOD   FT 2/2: MISS Klay Jokic makes 1/2 from the line. Offensive rebound by Derrick Stewart! Derrick Stewart kicks it out.
Score: 56-49

[11:06] Team_075 possession (Score: 56-49)
Klay Jokic attempts a Midrange. Contested by Kawhi Ball (4.7 feet, ZONE). Klay Jokic misses. Rebound secured by Carmelo Carter.

[10:56] Team_028 possession (Score: 56-49)
Kawhi Ball attempts a 3Pt. Contested by Derrick Stewart (4.7 feet, MAN). Kawhi Ball misses. Rebound secured by Kawhi Ingram.

[10:44] Team_075 possession (Score: 56-49)
Larry McCollum attempts a Midrange. Contested by Austin Russell (4.6 feet, MAN). LARRY MCCOLLUM MAKES IT! Assist: Myles Barrett
Score: 56-51

[10:27] Team_028 possession (Score: 56-51)
Carmelo Carter attempts a 3Pt. Contested by Kawhi Ingram (4.3 feet, MAN). CARMELO CARTER MAKES IT! Assist: Kawhi Ball
Score: 59-51

[10:11] Team_075 possession (Score: 59-51)
FOUL! Holding foul on Jimmy Brogdon. [Team fouls: 3] No free throws, side out. (Jimmy Brogdon: 2 personal fouls)

[09:55] Team_075 possession (Score: 59-51)
Klay Jokic attempts a Midrange. Contested by Carmelo Carter (4.9 feet, ZONE). KLAY JOKIC MAKES IT!
Score: 59-53

[09:35] Team_028 possession (Score: 59-53)
FOUL! Reach-in foul on Derrick Stewart during the drive. [Team fouls: 1] No free throws, side out. (Derrick Stewart: 1 personal fouls)

[09:19] Team_028 possession (Score: 59-53)
Kawhi Ball throws a bad pass! Stolen by Derrick Stewart! TURNOVER! (live ball)

[09:01] Team_075 possession (Score: 59-53)
Myles Barrett attempts a 3Pt. Contested by Myles Haliburton (3.9 feet, MAN). Myles Barrett misses. Rebound secured by Carmelo Carter.

[08:47] Team_028 possession (Score: 59-53)
Myles Haliburton attempts a Midrange. Contested by Myles Barrett (6.0 feet, MAN). MYLES HALIBURTON MAKES IT! Assist: Jimmy Brogdon
Score: 61-53

[08:32] Team_075 possession (Score: 61-53)
Klay Jokic throws a bad pass out of bounds! TURNOVER! (dead ball)

[08:20] Team_028 possession (Score: 61-53)
Myles Haliburton drives, Myles Barrett stays with him. Myles Haliburton attempts a Dunk. Contested by Myles Barrett (6.0 feet, MAN). MYLES HALIBURTON MAKES IT! Assist: Austin Russell
Score: 63-53

[08:07] Team_075 possession (Score: 63-53)
Kawhi Ingram attempts a Midrange. Contested by Carmelo Carter (4.3 feet, MAN). KAWHI INGRAM MAKES IT!
Score: 63-55

[07:48] Team_028 possession (Score: 63-55)
Myles Haliburton drives to the basket... Myles Haliburton throws a bad pass out of bounds! TURNOVER! (dead ball)

[07:38] Team_075 possession (Score: 63-55)
Larry McCollum attempts a Midrange. Contested by Kawhi Ball (4.4 feet, ZONE). Larry McCollum misses. Rebound secured by Jimmy Brogdon.

[07:26] Team_028 possession (Score: 63-55)
Austin Russell throws a bad pass out of bounds! TURNOVER! (dead ball)

[07:10] Team_075 possession (Score: 63-55)
FOUL! Offensive foul on Larry McCollum! Austin Russell drew the charge! [Team fouls: 2] (Larry McCollum: 1 personal fouls) TURNOVER! (dead ball)

[06:54] Team_028 possession (Score: 63-55)
FOUL! Holding foul on Myles Barrett. [Team fouls: 3] No free throws, side out. (Myles Barrett: 1 personal fouls)

[06:42] Team_028 possession (Score: 63-55)
Jimmy Brogdon attempts a 3Pt. Contested by Klay Jokic (5.9 feet, MAN). Jimmy Brogdon misses. Rebound secured by Derrick Stewart.

[06:26] Team_075 possession (Score: 63-55)
Derrick Stewart attempts a Midrange. Contested by Austin Russell (4.4 feet, ZONE). Derrick Stewart misses. Offensive rebound by Kawhi Ingram! Kawhi Ingram kicks it out.

[06:09] Team_075 possession (Score: 63-55)
Myles Barrett attempts a Midrange. Contested by Myles Haliburton (3.9 feet, MAN). Myles Barrett misses. Offensive rebound by Kawhi Ingram! Kawhi Ingram kicks it out.

[05:56] Team_075 possession (Score: 63-55)
Kawhi Ingram attempts a 3Pt. Contested by Carmelo Carter (4.3 feet, MAN). Kawhi Ingram misses. Rebound secured by Jimmy Brogdon.

[05:44] Team_028 possession (Score: 63-55)
Myles Haliburton makes the 3Pt and draws the foul on Larry McCollum! And-1! Myles Haliburton to the line for 1. [Team fouls: 4] (Larry McCollum: 2 personal fouls)   FT 1/1: GOOD Myles Haliburton makes 1/1 from the line.
Score: 67-55

[05:31] Team_075 possession (Score: 67-55)
Derrick Stewart makes the Dunk and draws the foul on Carmelo Carter! And-1! Derrick Stewart to the line for 1. [Team fouls: 4] (Carmelo Carter: 1 personal fouls)   FT 1/1: GOOD Derrick Stewart makes 1/1 from the line.
Score: 67-58

[05:20] Team_028 possession (Score: 67-58)
Carmelo Carter attempts a 3Pt. Contested by Larry McCollum (4.6 feet, ZONE). Carmelo Carter misses. Rebound secured by Derrick Stewart.

[05:07] Team_075 possession (Score: 67-58)
Larry McCollum drives, Austin Russell stays with him. Larry McCollum attempts a Layup. Contested by Austin Russell (4.6 feet, MAN). LARRY MCCOLLUM MAKES IT! Assist: Myles Barrett
Score: 67-60

[04:53] Team_028 possession (Score: 67-60)
Myles Haliburton attempts a Layup. Wide open! Myles Barrett is 6.0 feet away. [MAN] Myles Haliburton misses. Rebound secured by Klay Jokic.

[04:40] Team_075 possession (Score: 67-60)
FOUL! Holding foul on Myles Haliburton. [IN THE BONUS! 5 team fouls] Myles Barrett to the line for 2 free throws. (Myles Haliburton: 2 personal fouls)   FT 1/2: MISS   FT 2/2: MISS Myles Barrett makes 0/2 from the line. Rebound secured by Kawhi Ball.

[04:28] Team_028 possession (Score: 67-60)
Austin Russell attempts a Layup. Contested by Larry McCollum (4.2 feet, MAN). AUSTIN RUSSELL MAKES IT! Assist: Myles Haliburton
Score: 69-60

[04:12] Team_075 possession (Score: 69-60)
FOUL! Offensive foul on Larry McCollum! Austin Russell drew the charge! [Team fouls: 5] (Larry McCollum: 3 personal fouls) TURNOVER! (dead ball)

[04:00] Team_028 possession (Score: 69-60)
Carmelo Carter attempts a Midrange. Contested by Kawhi Ingram (4.5 feet, MAN). CARMELO CARTER MAKES IT!
Score: 71-60

[03:50] Team_075 possession (Score: 71-60)
Klay Jokic drives, Jimmy Brogdon stays with him. Klay Jokic attempts a Dunk. Contested by Jimmy Brogdon (4.9 feet, MAN). KLAY JOKIC MAKES IT! Assist: Derrick Stewart
Score: 71-62

[03:35] Team_028 possession (Score: 71-62)
Austin Russell attempts a 3Pt. Contested by Larry McCollum (4.3 feet, ZONE). Austin Russell misses. Rebound secured by Derrick Stewart.

[03:26] Team_075 possession (Score: 71-62)
Larry McCollum drives and kicks out. Derrick Stewart attempts a Midrange. Contested by Kawhi Ball (4.5 feet, MAN). DERRICK STEWART MAKES IT! Assist: Larry McCollum
Score: 71-64

[03:14] Team_028 possession (Score: 71-64)
Kawhi Ball attempts a 3Pt. Contested by Derrick Stewart (4.9 feet, MAN). Kawhi Ball misses. Offensive rebound by Kawhi Ball! Kawhi Ball kicks it out.

[02:56] Team_028 possession (Score: 71-64)
Jimmy Brogdon attempts a Midrange. Contested by Derrick Stewart (5.2 feet, ZONE). Jimmy Brogdon misses. Rebound secured by Derrick Stewart.

[02:36] Team_075 possession (Score: 71-64)
Klay Jokic attempts a Layup. Contested by Jimmy Brogdon (5.0 feet, MAN). KLAY JOKIC MAKES IT! Assist: Larry McCollum
Score: 71-66

[02:19] Team_028 possession (Score: 71-66)
Carmelo Carter attempts a Midrange. Contested by Kawhi Ingram (4.7 feet, MAN). Carmelo Carter misses. Rebound secured by Klay Jokic.

[02:06] Team_075 possession (Score: 71-66)
Myles Barrett attempts a 3Pt. Contested by Myles Haliburton (4.1 feet, MAN). Myles Barrett misses. Rebound secured by Jimmy Brogdon.

[01:49] Team_028 possession (Score: 71-66)
Jimmy Brogdon attempts a Layup. Wide open! Klay Jokic is 6.1 feet away. [MAN] Jimmy Brogdon misses. Offensive rebound by Jimmy Brogdon! Jimmy Brogdon kicks it out.

[01:34] Team_028 possession (Score: 71-66)
Jimmy Brogdon drives to the basket... Jimmy Brogdon throws a bad pass out of bounds! TURNOVER! (dead ball)

[01:34] Substitution (Team_028): Austin Russell OUT → Scottie Ingram IN (stamina_rule2)

[01:34] Substitution (Team_028): Carmelo Carter OUT → Tyrese Quickley IN (stamina_rule2)

[01:34] Substitution (Team_028): Myles Haliburton OUT → Miles Booker IN (stamina_rule2)

[01:34] Substitution (Team_028): Kawhi Ball OUT → Bam Towns IN (stamina_rule2)

[01:34] Substitution (Team_028): Jimmy Brogdon OUT → Collin Bridges IN (stamina_rule2)

[01:34] Substitution (Team_075): Larry McCollum OUT → D'Angelo Anunoby IN (stamina_rule2)

[01:34] Substitution (Team_075): Kawhi Ingram OUT → LeBron Ginobili IN (stamina_rule2)

[01:34] Substitution (Team_075): Myles Barrett OUT → Donovan Paul IN (stamina_rule2)

[01:34] Substitution (Team_075): Derrick Stewart OUT → Collin Duncan IN (stamina_rule2)

[01:34] Substitution (Team_075): Klay Jokic OUT → Kevin Towns IN (stamina_rule2)

[01:19] Team_075 possession (Score: 71-66)
Donovan Paul drives, Miles Booker stays with him. Donovan Paul attempts a Dunk. Wide open! Miles Booker is 6.4 feet away. [MAN] Donovan Paul misses. Rebound secured by Collin Bridges.

[01:03] Team_028 possession (Score: 71-66)
Scottie Ingram makes the Layup and draws the foul on Kevin Towns! And-1! Scottie Ingram to the line for 1. [BONUS: 6 team fouls] (Kevin Towns: 1 personal fouls)   FT 1/1: GOOD Scottie Ingram makes 1/1 from the line.
Score: 74-66

[00:52] Team_075 possession (Score: 74-66)
FOUL! Reach-in foul on Collin Bridges during the drive. [IN THE BONUS! 6 team fouls] Collin Duncan to the line for 2 free throws. (Collin Bridges: 1 personal fouls)   FT 1/2: MISS   FT 2/2: GOOD Collin Duncan makes 1/2 from the line.
Score: 74-67

[00:35] Team_028 possession (Score: 74-67)
Miles Booker makes the Layup and draws the foul on Kevin Towns! And-1! Miles Booker to the line for 1. [BONUS: 7 team fouls] (Kevin Towns: 2 personal fouls)   FT 1/1: GOOD Miles Booker makes 1/1 from the line.
Score: 77-67

[00:18] Team_075 possession (Score: 77-67)
Collin Duncan attempts a 3Pt. Contested by Scottie Ingram (5.6 feet, ZONE). Collin Duncan misses. Rebound secured by Tyrese Quickley.

[00:06] Team_028 possession (Score: 77-67)
Tyrese Quickley drives, Kevin Towns stays with him. Tyrese Quickley attempts a Layup. Contested by Kevin Towns (5.6 feet, ZONE). Tyrese Quickley misses. Offensive rebound by Bam Towns! Bam Towns kicks it out.

================================================================================
                              3RD QUARTER COMPLETE                              
================================================================================

3RD QUARTER SCORE: Team_028 21, Team_075 19

BOX SCORE:
================================================================================

Team_028
--------------------------------------------------------------------------------
Player                MIN  PTS  REB  AST  TO      FG   FG%      3P   3P%
--------------------------------------------------------------------------------
Myles Haliburton       31    8    0    1   0   3/4    75.0     0/0   0.0
Carmelo Carter         31    5    2    0   0   2/5    40.0     0/0   0.0
Scottie Ingram          5    3    0    0   0   1/1   100.0     0/0   0.0
Miles Booker            5    3    0    0   0   1/1   100.0     0/0   0.0
Austin Russell         31    2    0    1   0   1/2    50.0     0/0   0.0
Kawhi Ball             31    0    2    1   0   0/1     0.0     0/0   0.0
Jimmy Brogdon          31    0    4    1   0   0/2     0.0     0/0   0.0
Collin Bridges          5    0    1    0   0   0/0     0.0     0/0   0.0
Tyrese Quickley         5    0    1    0   0   0/0     0.0     0/0   0.0
Bam Towns               5    0    1    0   0   0/0     0.0     0/0   0.0

TEAM: FG: 8/16 (50.0%), 3PT: 2/7 (28.6%), REB: 11 (3 off, 8 def), AST: 4, TO: 5
TEAM FOULS: 6 [Team_075 in BONUS]


Team_075
--------------------------------------------------------------------------------
Player                MIN  PTS  REB  AST  TO      FG   FG%      3P   3P%
--------------------------------------------------------------------------------
Klay Jokic             31    6    3    0   0   3/4    75.0     0/0   0.0
Derrick Stewart        31    5    5    1   0   2/2   100.0     0/0   0.0
Larry McCollum         31    4    0    2   0   2/3    66.7     0/0   0.0
Kawhi Ingram           31    2    3    0   0   1/2    50.0     0/0   0.0
Collin Duncan           5    1    0    0   0   1/2    50.0     0/0   0.0
Myles Barrett          31    0    0    2   0   0/2     0.0     0/0   0.0
Donovan Paul            5    0    0    0   0   0/1     0.0     0/0   0.0

TEAM: FG: 9/17 (52.9%), 3PT: 0/4 (0.0%), REB: 11 (3 off, 8 def), AST: 5, TO: 4
TEAM FOULS: 7 [Team_028 in BONUS]

================================================================================

================================================================================
                       4TH QUARTER - Team_028 vs Team_075                       
================================================================================

[12:00] Team_028 possession (Score: 77-67)
Carmelo Carter attempts a 3Pt. Contested by Kawhi Ingram (4.5 feet, MAN). CARMELO CARTER MAKES IT! Assist: Myles Haliburton
Score: 80-67

[11:48] Team_075 possession (Score: 80-67)
Larry McCollum attempts a Layup. Contested by Kawhi Ball (4.5 feet, ZONE). LARRY MCCOLLUM MAKES IT! Assist: Derrick Stewart
Score: 80-69

[11:35] Team_028 possession (Score: 80-69)
Kawhi Ball drives to the basket... Kawhi Ball throws a bad pass! Stolen by Derrick Stewart! TURNOVER! (live ball)

[11:19] Team_075 possession (Score: 80-69)
FOUL! Shooting foul on Carmelo Carter. Derrick Stewart to the line for 2 free throws. [Team fouls: 1] (Carmelo Carter: 1 personal fouls)   FT 1/2: GOOD   FT 2/2: GOOD Derrick Stewart makes 2/2 from the line.
Score: 80-71

[11:04] Team_028 possession (Score: 80-71)
Kawhi Ball attempts a 3Pt. Contested by Derrick Stewart (4.9 feet, MAN). Kawhi Ball misses. Rebound secured by Kawhi Ingram.

[10:48] Team_075 possession (Score: 80-71)
Myles Barrett attempts a Midrange. Contested by Myles Haliburton (4.0 feet, MAN). MYLES BARRETT MAKES IT! Assist: Kawhi Ingram
Score: 80-73

[10:31] Team_028 possession (Score: 80-73)
Kawhi Ball attempts a 3Pt. Contested by Larry McCollum (4.7 feet, ZONE). Kawhi Ball misses. Rebound secured by Kawhi Ingram.

[10:18] Team_075 possession (Score: 80-73)
Kawhi Ingram attempts a Midrange. Contested by Carmelo Carter (4.5 feet, MAN). Kawhi Ingram misses. Rebound secured by Kawhi Ball.

[10:07] Team_028 possession (Score: 80-73)
Carmelo Carter attempts a 3Pt. Contested by Kawhi Ingram (4.7 feet, MAN). Carmelo Carter misses. Rebound secured by Derrick Stewart.

[09:52] Team_075 possession (Score: 80-73)
Myles Barrett drives and kicks out. Larry McCollum makes the Midrange and draws the foul on Myles Haliburton! And-1! Larry McCollum to the line for 1. [Team fouls: 2] (Myles Haliburton: 1 personal fouls)   FT 1/1: GOOD Larry McCollum makes 1/1 from the line.
Score: 80-76

[09:39] Team_028 possession (Score: 80-76)
Kawhi Ball drives, Klay Jokic stays with him. Kawhi Ball attempts a Layup. Contested by Klay Jokic (5.8 feet, ZONE). Kawhi Ball misses. Offensive rebound by Kawhi Ball! Kawhi Ball kicks it out.

[09:29] Team_028 possession (Score: 80-76)
FOUL! Shooting foul on Derrick Stewart. Jimmy Brogdon to the line for 2 free throws. [Team fouls: 1] (Derrick Stewart: 1 personal fouls)   FT 1/2: GOOD   FT 2/2: GOOD Jimmy Brogdon makes 2/2 from the line.
Score: 82-76

[09:14] Team_075 possession (Score: 82-76)
Larry McCollum attempts a Midrange. Contested by Kawhi Ball (4.8 feet, ZONE). Larry McCollum misses. Rebound secured by Carmelo Carter.

[09:00] Team_028 possession (Score: 82-76)
Carmelo Carter attempts a 3Pt. Contested by Kawhi Ingram (4.8 feet, MAN). Carmelo Carter misses. Rebound secured by Derrick Stewart.

[08:46] Team_075 possession (Score: 82-76)
Larry McCollum attempts a 3Pt. Contested by Austin Russell (5.0 feet, MAN). Larry McCollum misses. Rebound secured by Carmelo Carter.

[08:30] Team_028 possession (Score: 82-76)
Kawhi Ball drives and kicks out. Kawhi Ball attempts a 3Pt. Contested by Derrick Stewart (5.0 feet, MAN). Kawhi Ball misses. Rebound secured by Derrick Stewart.

[08:15] Team_075 possession (Score: 82-76)
Kawhi Ingram makes the Dunk and draws the foul on Myles Haliburton! And-1! Kawhi Ingram to the line for 1. [Team fouls: 3] (Myles Haliburton: 2 personal fouls)   FT 1/1: GOOD Kawhi Ingram makes 1/1 from the line.
Score: 82-79

[07:58] Team_028 possession (Score: 82-79)
Carmelo Carter makes the Layup and draws the foul on Derrick Stewart! And-1! Carmelo Carter to the line for 1. [Team fouls: 2] (Derrick Stewart: 2 personal fouls)   FT 1/1: GOOD Carmelo Carter makes 1/1 from the line.
Score: 85-79

[07:49] Team_075 possession (Score: 85-79)
Myles Barrett drives, picks up Kawhi Ball. Help arrives from Carmelo Carter! Myles Barrett attempts a Layup. Contested by Carmelo Carter (5.1 feet, ZONE). MYLES BARRETT MAKES IT! Assist: Larry McCollum
Score: 85-81

[07:37] Team_028 possession (Score: 85-81)
Myles Haliburton attempts a 3Pt. Contested by Larry McCollum (4.9 feet, ZONE). Myles Haliburton misses. Rebound secured by Derrick Stewart.

[07:24] Team_075 possession (Score: 85-81)
Derrick Stewart attempts a Midrange. Contested by Carmelo Carter (5.0 feet, ZONE). Derrick Stewart misses. Rebound secured by Kawhi Ball.

[07:05] Team_028 possession (Score: 85-81)
Austin Russell attempts a Midrange. Contested by Klay Jokic (5.8 feet, ZONE). AUSTIN RUSSELL MAKES IT!
Score: 87-81

[06:50] Team_075 possession (Score: 87-81)
Kawhi Ingram attempts a Midrange. Contested by Kawhi Ball (4.9 feet, ZONE). KAWHI INGRAM MAKES IT!
Score: 87-83

[06:34] Team_028 possession (Score: 87-83)
Austin Russell attempts a Layup. Contested by Derrick Stewart (5.1 feet, ZONE). Austin Russell misses. Rebound secured by Klay Jokic.

[06:23] Team_075 possession (Score: 87-83)
FOUL! Shooting foul on Carmelo Carter. Derrick Stewart to the line for 2 free throws. [Team fouls: 4] (Carmelo Carter: 2 personal fouls)   FT 1/2: MISS   FT 2/2: MISS Derrick Stewart makes 0/2 from the line. Offensive rebound by Kawhi Ingram! Kawhi Ingram kicks it out.

[06:09] Team_075 possession (Score: 87-83)
FOUL! Holding foul on Kawhi Ball. [IN THE BONUS! 5 team fouls] Derrick Stewart to the line for 2 free throws. (Kawhi Ball: 1 personal fouls)   FT 1/2: GOOD   FT 2/2: MISS Derrick Stewart makes 1/2 from the line. Offensive rebound by Derrick Stewart! Derrick Stewart kicks it out.
Score: 87-84

[05:56] Team_075 possession (Score: 87-84)
Kawhi Ingram drives to the basket... Kawhi Ingram throws a bad pass! Stolen by Kawhi Ball! TURNOVER! (live ball)

[05:40] Team_028 possession (Score: 87-84)
Kawhi Ball attempts a 3Pt. Contested by Derrick Stewart (5.5 feet, MAN). Kawhi Ball misses. Rebound secured by Derrick Stewart.

[05:29] Team_075 possession (Score: 87-84)
Derrick Stewart attempts a Layup. Contested by Kawhi Ball (5.2 feet, MAN). Derrick Stewart misses. FOUL! Loose ball foul on Carmelo Carter during the rebound battle. [IN THE BONUS! 6 team fouls] Kawhi Ingram to the line for 2 free throws. (Carmelo Carter: 3 personal fouls)   FT 1/2: GOOD   FT 2/2: GOOD Kawhi Ingram makes 2/2 from the line.
Score: 87-86

[05:13] Team_028 possession (Score: 87-86)
FOUL! Holding foul on Klay Jokic. [Team fouls: 3] No free throws, side out. (Klay Jokic: 1 personal fouls)

[05:02] Team_028 possession (Score: 87-86)
Carmelo Carter attempts a Layup. Contested by Kawhi Ingram (5.4 feet, MAN). Carmelo Carter misses. FOUL! Loose ball foul on Kawhi Ingram during the rebound battle. [Team fouls: 4] No free throws, side out. (Kawhi Ingram: 1 personal fouls)

[04:46] Team_028 possession (Score: 87-86)
Carmelo Carter drives, Derrick Stewart stays with him. Carmelo Carter attempts a Layup. Contested by Derrick Stewart (5.8 feet, ZONE). CARMELO CARTER MAKES IT! Assist: Myles Haliburton
Score: 89-86

[04:31] Team_075 possession (Score: 89-86)
Larry McCollum attempts a 3Pt. Contested by Austin Russell (5.4 feet, MAN). Larry McCollum misses. Rebound secured by Carmelo Carter.

[04:11] Team_028 possession (Score: 89-86)
Myles Haliburton attempts a Midrange. Wide open! Klay Jokic is 6.4 feet away. [ZONE] MYLES HALIBURTON MAKES IT! Assist: Jimmy Brogdon
Score: 91-86

[03:58] Team_075 possession (Score: 91-86)
Derrick Stewart drives, Kawhi Ball stays with him. Derrick Stewart attempts a Dunk. Contested by Kawhi Ball (5.4 feet, MAN). Derrick Stewart misses. Offensive rebound by Kawhi Ingram! Kawhi Ingram kicks it out.

[03:44] Team_075 possession (Score: 91-86)
Myles Barrett attempts a Midrange. Contested by Kawhi Ball (5.7 feet, ZONE). MYLES BARRETT MAKES IT!
Score: 91-88

[03:27] Team_028 possession (Score: 91-88)
Austin Russell attempts a 3Pt. Wide open! Myles Barrett is 6.7 feet away. [ZONE] AUSTIN RUSSELL MAKES IT! Assist: Jimmy Brogdon
Score: 94-88

[03:13] Team_075 possession (Score: 94-88)
FOUL! Reach-in foul on Kawhi Ball during the drive. [IN THE BONUS! 7 team fouls] Derrick Stewart to the line for 2 free throws. (Kawhi Ball: 2 personal fouls)   FT 1/2: GOOD   FT 2/2: GOOD Derrick Stewart makes 2/2 from the line.
Score: 94-90

[02:59] Team_028 possession (Score: 94-90)
Myles Haliburton attempts a 3Pt. Contested by Larry McCollum (5.6 feet, ZONE). Myles Haliburton misses. Offensive rebound by Jimmy Brogdon! Jimmy Brogdon kicks it out.

[02:50] Team_028 possession (Score: 94-90)
Kawhi Ball drives to the basket... Kawhi Ball throws a bad pass out of bounds! TURNOVER! (dead ball)

[02:50] Substitution (Team_028): Austin Russell OUT → Scottie Ingram IN (stamina_rule2)

[02:50] Substitution (Team_028): Carmelo Carter OUT → Tyrese Quickley IN (stamina_rule2)

[02:50] Substitution (Team_028): Myles Haliburton OUT → Miles Booker IN (stamina_rule2)

[02:50] Substitution (Team_028): Kawhi Ball OUT → Bam Towns IN (stamina_rule2)

[02:50] Substitution (Team_028): Jimmy Brogdon OUT → Collin Bridges IN (stamina_rule2)

[02:50] Substitution (Team_075): Larry McCollum OUT → D'Angelo Anunoby IN (stamina_rule2)

[02:50] Substitution (Team_075): Kawhi Ingram OUT → LeBron Ginobili IN (stamina_rule2)

[02:50] Substitution (Team_075): Myles Barrett OUT → Donovan Paul IN (stamina_rule2)

[02:50] Substitution (Team_075): Derrick Stewart OUT → Collin Duncan IN (stamina_rule2)

[02:50] Substitution (Team_075): Klay Jokic OUT → Kevin Towns IN (stamina_rule2)

[02:32] Team_075 possession (Score: 94-90)
Kevin Towns drives and kicks out. LeBron Ginobili attempts a Midrange. Contested by Tyrese Quickley (4.4 feet, ZONE). LEBRON GINOBILI MAKES IT!
Score: 94-92

[02:16] Team_028 possession (Score: 94-92)
Bam Towns loses control! Ball rolls out of bounds! TURNOVER! (dead ball)

[02:04] Team_075 possession (Score: 94-92)
Kevin Towns drives to the basket... FOUL! Offensive foul on Kevin Towns! Collin Bridges drew the charge! [Team fouls: 5] (Kevin Towns: 1 personal fouls) TURNOVER! (dead ball)

[01:47] Team_028 possession (Score: 94-92)
Miles Booker attempts a 3Pt. Contested by D'Angelo Anunoby (5.2 feet, ZONE). Miles Booker misses. Offensive rebound by Collin Bridges! Collin Bridges kicks it out.

[01:33] Team_028 possession (Score: 94-92)
Miles Booker throws a bad pass! Stolen by Donovan Paul! TURNOVER! (live ball)

[01:17] Team_075 possession (Score: 94-92)
Donovan Paul attempts a 3Pt. Wide open! Miles Booker is 6.4 feet away. [MAN] DONOVAN PAUL MAKES IT! Assist: Collin Duncan
Score: 94-95

[01:04] Team_028 possession (Score: 94-95)
Bam Towns loses control! Ball rolls out of bounds! TURNOVER! (dead ball)

[00:47] Team_075 possession (Score: 94-95)
Collin Duncan attempts a 3Pt. Contested by Scottie Ingram (5.6 feet, ZONE). Collin Duncan misses. Rebound secured by Bam Towns.

[00:36] Team_028 possession (Score: 94-95)
Collin Bridges drives to the basket... Collin Bridges throws a bad pass out of bounds! TURNOVER! (dead ball)

[00:22] Team_075 possession (Score: 94-95)
FOUL! Shooting foul on Tyrese Quickley. LeBron Ginobili to the line for 2 free throws. [BONUS: 8 team fouls] (Tyrese Quickley: 1 personal fouls)   FT 1/2: GOOD   FT 2/2: GOOD LeBron Ginobili makes 2/2 from the line.
Score: 94-97

[00:09] Team_028 possession (Score: 94-97)
Miles Booker attempts a 3Pt. Contested by D'Angelo Anunoby (5.2 feet, ZONE). Miles Booker misses. Rebound secured by Collin Duncan.

================================================================================
                              4TH QUARTER COMPLETE                              
================================================================================

4TH QUARTER SCORE: Team_028 17, Team_075 30

BOX SCORE:
================================================================================

Team_028
--------------------------------------------------------------------------------
Player                MIN  PTS  REB  AST  TO      FG   FG%      3P   3P%
--------------------------------------------------------------------------------
Carmelo Carter         40    8    3    0   0   3/5    60.0     0/0   0.0
Austin Russell         40    5    0    0   0   2/3    66.7     0/0   0.0
Myles Haliburton       40    2    0    2   0   1/2    50.0     0/0   0.0
Jimmy Brogdon          40    2    1    2   0   1/1   100.0     0/0   0.0
Kawhi Ball             40    0    4    0   0   0/4     0.0     0/0   0.0
Collin Bridges          8    0    1    0   0   0/0     0.0     0/0   0.0
Bam Towns               8    0    1    0   0   0/0     0.0     0/0   0.0
Miles Booker            8    0    0    0   0   0/1     0.0     0/0   0.0

TEAM: FG: 7/16 (43.8%), 3PT: 2/9 (22.2%), REB: 10 (4 off, 6 def), AST: 4, TO: 6
TEAM FOULS: 8 [Team_075 in BONUS]


Team_075
--------------------------------------------------------------------------------
Player                MIN  PTS  REB  AST  TO      FG   FG%      3P   3P%
--------------------------------------------------------------------------------
Kawhi Ingram           40    7    4    1   0   3/4    75.0     0/0   0.0
Myles Barrett          40    6    0    0   0   3/3   100.0     0/0   0.0
Larry McCollum         40    5    0    1   0   2/5    40.0     0/0   0.0
Derrick Stewart        40    4    6    1   0   2/3    66.7     0/0   0.0
LeBron Ginobili         8    4    0    0   0   2/2   100.0     0/0   0.0
Donovan Paul            8    3    0    0   0   1/1   100.0     0/0   0.0
Klay Jokic             40    0    1    0   0   0/0     0.0     0/0   0.0
Collin Duncan           8    0    1    1   0   0/1     0.0     0/0   0.0

TEAM: FG: 13/19 (68.4%), 3PT: 1/4 (25.0%), REB: 12 (3 off, 9 def), AST: 4, TO: 2
TEAM FOULS: 5 [Team_028 in BONUS]

================================================================================

================================================================================
                               FULL GAME COMPLETE                               
================================================================================

FINAL SCORE: Team_028 94, Team_075 97

SCORING BY QUARTER:
--------------------------------------------------------------------------------
Team                     Q1     Q2     Q3     Q4    FINAL
--------------------------------------------------------------------------------
Team_028                 30     26     21     17       94
Team_075                 26     22     19     30       97
--------------------------------------------------------------------------------

FULL GAME BOX SCORE:
================================================================================

Team_028
--------------------------------------------------------------------------------
Player                MIN  PTS  REB  AST  TO      FG   FG%      3P   3P%      FT STL BLK
--------------------------------------------------------------------------------
Austin Russell         40   27    0    2   3  10/17   58.8   4/9    44.4   8/8     1   0
Carmelo Carter         40   22   11    0   0   8/16   50.0   3/8    37.5   3/3     0   0
Myles Haliburton       40   13    0    5   1   5/10   50.0   2/6    33.3   1/1     1   1
Kawhi Ball             40    7    9    3   1   2/8    25.0   0/4     0.0   4/5     2   0
Jimmy Brogdon          40   14   16    4   4   7/10   70.0   0/1     0.0   5/6     1   0
Scottie Ingram          8    3    0    0   1   1/1   100.0   0/0     0.0   1/1     0   0
Tyrese Quickley         8    0    2    0   0   1/1   100.0   0/0     0.0   0/0     0   0
Miles Booker            8    3    0    0   1   1/2    50.0   0/1     0.0   1/1     0   0
Bam Towns               8    2    3    0   2   1/2    50.0   0/1     0.0   0/0     0   0
Collin Bridges          8    2    4    0   2   0/1     0.0   0/0     0.0   0/0     0   0

TEAM: FG: 37/69 (53.6%), 3PT: 9/30 (30.0%), REB: 45 (16 off, 29 def), AST: 14, TO: 15


Team_075
--------------------------------------------------------------------------------
Player                MIN  PTS  REB  AST  TO      FG   FG%      3P   3P%      FT STL BLK
--------------------------------------------------------------------------------
Larry McCollum         40   13    0    5   4   6/14   42.9   1/5    20.0   6/8     0   1
Kawhi Ingram           40   19   16    3   2   8/14   57.1   1/6    16.7   6/6     0   1
Myles Barrett          40    9    0    3   1   6/9    66.7   0/3     0.0   1/4     0   0
Derrick Stewart        40   13   17    2   1   6/11   54.5   0/0     0.0   9/13    2   0
Klay Jokic             40   21    8    0   2   8/10   80.0   0/1     0.0   5/6     1   0
D'Angelo Anunoby        8    0    0    1   0   0/0     0.0   0/0     0.0   0/0     0   0
LeBron Ginobili         8    4    0    1   0   1/2    50.0   0/1     0.0   2/2     0   0
Donovan Paul            8    8    0    0   1   3/4    75.0   2/2   100.0   0/0     1   0
Collin Duncan           8    4    2    1   0   2/4    50.0   0/2     0.0   2/3     0   1
Kevin Towns             8    2    2    0   0   2/2   100.0   0/0     0.0   2/2     1   0

TEAM: FG: 42/71 (59.2%), 3PT: 4/20 (20.0%), REB: 45 (13 off, 32 def), AST: 16, TO: 11

================================================================================
