================================================================================
                        FULL GAME - Team_027 vs Team_050                        
================================================================================

================================================================================
                       1ST QUARTER - Team_027 vs Team_050                       
================================================================================

[12:00] Team_027 possession (Score: 0-0)
FOUL! Holding foul on Collin Bane. [Team fouls: 1] No free throws, side out. (Collin Bane: 1 personal fouls)

[11:50] Team_027 possession (Score: 0-0)
John Russell attempts a Midrange. Contested by Collin Bane (4.9 feet, ZONE). John Russell misses. Rebound secured by Joel Banchero.

[11:33] Team_050 possession (Score: 0-0)
Donovan Trent attempts a Midrange. Contested by John Russell (3.7 feet, MAN). Donovan Trent misses. Rebound secured by John Russell.

[11:18] Team_027 possession (Score: 0-0)
Scottie Harden drives, Collin Bane stays with him. Scottie Harden attempts a Layup. Contested by Collin Bane (4.2 feet, MAN). Scottie Harden misses. Offensive rebound by Bradley Dosunmu! Bradley Dosunmu kicks it out.

[11:00] Team_027 possession (Score: 0-0)
FOUL! Shooting foul on Donovan Trent. John Russell to the line for 2 free throws. [Team fouls: 2] (Donovan Trent: 1 personal fouls)   FT 1/2: GOOD   FT 2/2: GOOD John Russell makes 2/2 from the line.
Score: 2-0

[10:47] Team_050 possession (Score: 2-0)
Donovan Trent drives and kicks out. Collin Bane attempts a 3Pt. Contested by Scottie Harden (4.5 feet, MAN). Collin Bane misses. Rebound secured by Bradley Dosunmu.

[10:28] Team_027 possession (Score: 2-0)
Bradley Dosunmu drives to the basket... Bradley Dosunmu throws a bad pass out of bounds! TURNOVER! (dead ball)

[10:14] Team_050 possession (Score: 2-0)
Donovan Trent attempts a Layup. Contested by John Russell (3.7 feet, ZONE). Donovan Trent misses. Rebound secured by John Russell.

[09:56] Team_027 possession (Score: 2-0)
Scottie Harden attempts a 3Pt. Contested by Giannis LaVine (3.9 feet, ZONE). Scottie Harden misses. Rebound secured by Collin Bane.

[09:37] Team_050 possession (Score: 2-0)
Joel Banchero drives and kicks out. Collin Bane attempts a 3Pt. Contested by Tim Johnson (4.9 feet, ZONE). Collin Bane misses. FOUL! Loose ball foul on Bradley Dosunmu during the rebound battle. [Team fouls: 1] No free throws, side out. (Bradley Dosunmu: 1 personal fouls)

[09:23] Team_050 possession (Score: 2-0)
FOUL! Shooting foul on John Russell. Donovan Trent to the line for 2 free throws. [Team fouls: 2] (John Russell: 1 personal fouls)   FT 1/2: MISS   FT 2/2: GOOD Donovan Trent makes 1/2 from the line.
Score: 2-1

[09:08] Team_027 possession (Score: 2-1)
Bradley Dosunmu attempts a Midrange. Contested by LeBron Bridges (4.3 feet, MAN). Bradley Dosunmu misses. Offensive rebound by John Russell! John Russell's putback is no good. Offensive rebound by John Russell! John Russell kicks it out.

[08:54] Team_027 possession (Score: 2-1)
FOUL! Offensive foul on Tony Doncic! Joel Banchero drew the charge! [Team fouls: 3] (Tony Doncic: 1 personal fouls) TURNOVER! (dead ball)

[08:41] Team_050 possession (Score: 2-1)
Joel Banchero makes the Dunk and draws the foul on Scottie Harden! And-1! Joel Banchero to the line for 1. [Team fouls: 4] (Scottie Harden: 1 personal fouls)   FT 1/1: MISS Joel Banchero makes 0/1 from the line. Rebound secured by Bradley Dosunmu.
Score: 2-3

[08:30] Team_027 possession (Score: 2-3)
Tim Johnson attempts a 3Pt. Contested by Giannis LaVine (4.2 feet, ZONE). Tim Johnson misses. FOUL! Loose ball foul on LeBron Bridges during the rebound battle. [Team fouls: 3] No free throws, side out. (LeBron Bridges: 1 personal fouls)

[08:18] Team_027 possession (Score: 2-3)
Bradley Dosunmu attempts a Midrange. Contested by LeBron Bridges (4.3 feet, MAN). Bradley Dosunmu misses. Rebound secured by Joel Banchero.

[08:00] Team_050 possession (Score: 2-3)
Joel Banchero attempts a 3Pt. Contested by Tim Johnson (4.7 feet, ZONE). Joel Banchero misses. Rebound secured by John Russell.

[07:45] Team_027 possession (Score: 2-3)
Scottie Harden attempts a 3Pt. Contested by Giannis LaVine (3.9 feet, ZONE). Scottie Harden misses. Rebound secured by Collin Bane.

[07:31] Team_050 possession (Score: 2-3)
Giannis LaVine drives, Tim Johnson stays with him. Giannis LaVine attempts a Dunk. Contested by Tim Johnson (5.3 feet, MAN). GIANNIS LAVINE MAKES IT! Assist: Collin Bane
Score: 2-5

[07:13] Team_027 possession (Score: 2-5)
John Russell drives and kicks out. Bradley Dosunmu attempts a 3Pt. Contested by Giannis LaVine (3.9 feet, ZONE). BRADLEY DOSUNMU MAKES IT! Assist: Tony Doncic
Score: 5-5

[06:58] Team_050 possession (Score: 5-5)
LeBron Bridges attempts a 3Pt. Contested by Bradley Dosunmu (4.5 feet, MAN). LEBRON BRIDGES MAKES IT! Assist: Giannis LaVine
Score: 5-8

[06:45] Team_027 possession (Score: 5-8)
Bradley Dosunmu attempts a Midrange. Contested by LeBron Bridges (4.3 feet, MAN). Bradley Dosunmu misses. Rebound secured by LeBron Bridges.

[06:35] Team_050 possession (Score: 5-8)
Donovan Trent attempts a Midrange. Contested by John Russell (3.7 feet, MAN). Donovan Trent misses. Rebound secured by Bradley Dosunmu.

[06:19] Team_027 possession (Score: 5-8)
FOUL! Reach-in foul on Donovan Trent during the drive. [Team fouls: 4] No free throws, side out. (Donovan Trent: 2 personal fouls)

[06:05] Team_027 possession (Score: 5-8)
Tim Johnson makes the Midrange and draws the foul on Giannis LaVine! And-1! Tim Johnson to the line for 1. [BONUS: 5 team fouls] (Giannis LaVine: 1 personal fouls)   FT 1/1: GOOD Tim Johnson makes 1/1 from the line.
Score: 8-8

[05:54] Team_050 possession (Score: 8-8)
Giannis LaVine attempts a 3Pt. Contested by Tim Johnson (5.3 feet, MAN). GIANNIS LAVINE MAKES IT! Assist: Donovan Trent
Score: 8-11

[05:39] Team_027 possession (Score: 8-11)
Tony Doncic attempts a 3Pt. Contested by Joel Banchero (4.4 feet, MAN). TONY DONCIC MAKES IT! Assist: Scottie Harden
Score: 11-11

[05:20] Team_050 possession (Score: 11-11)
Joel Banchero attempts a 3Pt. Contested by Tim Johnson (4.7 feet, ZONE). Joel Banchero misses. Offensive rebound by LeBron Bridges! LeBron Bridges kicks it out.

[05:01] Team_050 possession (Score: 11-11)
Joel Banchero attempts a 3Pt. Contested by Tony Doncic (3.7 feet, MAN). Joel Banchero misses. Rebound secured by John Russell.

[04:44] Team_027 possession (Score: 11-11)
Tim Johnson drives and kicks out. Tony Doncic attempts a 3Pt. Contested by Joel Banchero (4.3 feet, MAN). Tony Doncic misses. Rebound secured by Joel Banchero.

[04:28] Team_050 possession (Score: 11-11)
Collin Bane makes the Layup and draws the foul on John Russell! And-1! Collin Bane to the line for 1. [BONUS: 5 team fouls] (John Russell: 2 personal fouls)   FT 1/1: GOOD Collin Bane makes 1/1 from the line.
Score: 11-14

[04:11] Team_027 possession (Score: 11-14)
John Russell makes the Layup and draws the foul on Donovan Trent! And-1! John Russell to the line for 1. [BONUS: 6 team fouls] (Donovan Trent: 3 personal fouls)   FT 1/1: GOOD John Russell makes 1/1 from the line.
Score: 14-14

[03:59] Team_050 possession (Score: 14-14)
LeBron Bridges makes the Midrange and draws the foul on Bradley Dosunmu! And-1! LeBron Bridges to the line for 1. [BONUS: 6 team fouls] (Bradley Dosunmu: 2 personal fouls)   FT 1/1: GOOD LeBron Bridges makes 1/1 from the line.
Score: 14-17

[03:49] Team_027 possession (Score: 14-17)
FOUL! Reach-in foul on Donovan Trent during the drive. [IN THE BONUS! 7 team fouls] Bradley Dosunmu to the line for 2 free throws. (Donovan Trent: 4 personal fouls)   FT 1/2: GOOD   FT 2/2: MISS Bradley Dosunmu makes 1/2 from the line. Offensive rebound by Bradley Dosunmu! Bradley Dosunmu kicks it out.
Score: 15-17

[03:39] Team_027 possession (Score: 15-17)
Scottie Harden attempts a Midrange. Contested by Collin Bane (4.3 feet, ZONE). Scottie Harden misses. Rebound secured by LeBron Bridges.

[03:28] Team_050 possession (Score: 15-17)
Donovan Trent attempts a Midrange. Contested by Tony Doncic (3.8 feet, ZONE). DONOVAN TRENT MAKES IT!
Score: 15-19

[03:10] Team_027 possession (Score: 15-19)
Tim Johnson drives, picks up Giannis LaVine. Help arrives from Collin Bane! Tim Johnson attempts a Dunk. Contested by Collin Bane (4.3 feet, MAN). TIM JOHNSON MAKES IT!
Score: 17-19

[02:57] Team_050 possession (Score: 17-19)
LeBron Bridges attempts a Layup. Contested by Bradley Dosunmu (4.7 feet, MAN). LEBRON BRIDGES MAKES IT!
Score: 17-21

[02:39] Team_027 possession (Score: 17-21)
Bradley Dosunmu attempts a 3Pt. Contested by LeBron Bridges (4.6 feet, MAN). Bradley Dosunmu misses. Rebound secured by Collin Bane.

[02:20] Team_050 possession (Score: 17-21)
Donovan Trent attempts a Midrange. Contested by Tony Doncic (3.9 feet, ZONE). Donovan Trent misses. Offensive rebound by LeBron Bridges! LeBron Bridges kicks it out.

[02:08] Team_050 possession (Score: 17-21)
Joel Banchero attempts a 3Pt. Contested by Tim Johnson (5.0 feet, ZONE). JOEL BANCHERO MAKES IT! Assist: Donovan Trent
Score: 17-24

[01:52] Team_027 possession (Score: 17-24)
Scottie Harden attempts a 3Pt. Contested by Giannis LaVine (4.2 feet, ZONE). Scottie Harden misses. Offensive rebound by Bradley Dosunmu! Bradley Dosunmu kicks it out.

[01:36] Team_027 possession (Score: 17-24)
John Russell commits a violation (traveling/carry)! TURNOVER! (dead ball)

[01:36] Substitution (Team_027): Tim Johnson OUT → CJ Green IN (stamina_rule2)

[01:36] Substitution (Team_027): Tony Doncic OUT → Dirk Lillard IN (stamina_rule2)

[01:36] Substitution (Team_027): Scottie Harden OUT → Rudy Quickley IN (stamina_rule2)

[01:36] Substitution (Team_027): Bradley Dosunmu OUT → LeBron Russell IN (stamina_rule2)

[01:36] Substitution (Team_027): John Russell OUT → Ben Stewart IN (stamina_rule2)

[01:36] Substitution (Team_050): Giannis LaVine OUT → Damian O'Neal IN (stamina_rule2)

[01:36] Substitution (Team_050): Joel Banchero OUT → Dwyane Towns IN (stamina_rule2)

[01:36] Substitution (Team_050): Collin Bane OUT → Larry Curry IN (stamina_rule2)

[01:36] Substitution (Team_050): LeBron Bridges OUT → Luka Gasol IN (stamina_rule2)

[01:36] Substitution (Team_050): Donovan Trent OUT → Tyler Smith IN (stamina_rule2)

[01:21] Team_050 possession (Score: 17-24)
Tyler Smith drives, picks up LeBron Russell. Help arrives from Dirk Lillard! Tyler Smith attempts a Dunk. Contested by Dirk Lillard (5.8 feet, ZONE). Tyler Smith misses. Rebound secured by Dirk Lillard.

[01:03] Team_027 possession (Score: 17-24)
Dirk Lillard attempts a 3Pt. Contested by Luka Gasol (5.0 feet, ZONE). Dirk Lillard misses. Rebound secured by Tyler Smith.

[00:47] Team_050 possession (Score: 17-24)
Damian O'Neal attempts a Layup. Contested by Ben Stewart (4.8 feet, ZONE). DAMIAN O'NEAL MAKES IT! Assist: Larry Curry
Score: 17-26

[00:32] Team_027 possession (Score: 17-26)
LeBron Russell attempts a Midrange. Contested by Luka Gasol (4.9 feet, ZONE). LeBron Russell misses. Rebound secured by Dwyane Towns.

[00:19] Team_050 possession (Score: 17-26)
FOUL! Reach-in foul on Ben Stewart during the drive. [IN THE BONUS! 7 team fouls] Tyler Smith to the line for 2 free throws. (Ben Stewart: 1 personal fouls)   FT 1/2: GOOD   FT 2/2: MISS Tyler Smith makes 1/2 from the line. Offensive rebound by Larry Curry! Larry Curry kicks it out.
Score: 17-27

[00:01] Team_050 possession (Score: 17-27)
Damian O'Neal attempts a Layup. BLOCKED BY BEN STEWART! Ball goes out off Ben Stewart. Damian O'Neal's ball!

================================================================================
                              1ST QUARTER COMPLETE                              
================================================================================

1ST QUARTER SCORE: Team_027 17, Team_050 27

BOX SCORE:
================================================================================

Team_027
--------------------------------------------------------------------------------
Player                MIN  PTS  REB  AST  TO      FG   FG%      3P   3P%
--------------------------------------------------------------------------------
John Russell           11    5    6    0   0   2/3    66.7     0/0   0.0
Tim Johnson            11    5    0    0   0   2/3    66.7     0/0   0.0
Bradley Dosunmu        11    3    6    0   0   1/4    25.0     0/0   0.0
Tony Doncic            11    3    0    1   0   1/1   100.0     0/0   0.0
Scottie Harden         11    0    0    1   0   0/3     0.0     0/0   0.0
Dirk Lillard            2    0    1    0   0   0/1     0.0     0/0   0.0
LeBron Russell          2    0    0    0   0   0/1     0.0     0/0   0.0

TEAM: FG: 6/16 (37.5%), 3PT: 1/5 (20.0%), REB: 13 (5 off, 8 def), AST: 2, TO: 3
TEAM FOULS: 7 [Team_050 in BONUS]


Team_050
--------------------------------------------------------------------------------
Player                MIN  PTS  REB  AST  TO      FG   FG%      3P   3P%
--------------------------------------------------------------------------------
LeBron Bridges         11    8    5    0   0   3/3   100.0     0/0   0.0
Giannis LaVine         11    5    0    1   0   2/2   100.0     0/0   0.0
Joel Banchero          11    3    3    0   0   1/4    25.0     0/0   0.0
Donovan Trent          11    3    0    2   0   2/6    33.3     0/0   0.0
Collin Bane            11    3    3    1   0   1/1   100.0     0/0   0.0
Damian O'Neal           2    2    0    0   0   1/1   100.0     0/0   0.0
Tyler Smith             2    0    1    0   0   0/1     0.0     0/0   0.0
Larry Curry             2    0    1    1   0   0/0     0.0     0/0   0.0
Dwyane Towns            2    0    1    0   0   0/0     0.0     0/0   0.0

TEAM: FG: 10/18 (55.6%), 3PT: 3/5 (60.0%), REB: 14 (4 off, 10 def), AST: 5, TO: 0
TEAM FOULS: 7 [Team_027 in BONUS]

================================================================================

================================================================================
                       2ND QUARTER - Team_027 vs Team_050                       
================================================================================

[12:00] Team_027 possession (Score: 17-27)
FOUL! Reach-in foul on Donovan Trent during the drive. [Team fouls: 1] No free throws, side out. (Donovan Trent: 1 personal fouls)

[11:44] Team_027 possession (Score: 17-27)
John Russell drives, Donovan Trent stays with him. John Russell attempts a Layup. Contested by Donovan Trent (5.7 feet, MAN). JOHN RUSSELL MAKES IT!
Score: 19-27

[11:29] Team_050 possession (Score: 19-27)
Joel Banchero attempts a 3Pt. Contested by Tony Doncic (3.8 feet, ZONE). JOEL BANCHERO MAKES IT! Assist: Donovan Trent
Score: 19-30

[11:16] Team_027 possession (Score: 19-30)
Tony Doncic attempts a 3Pt. Contested by Collin Bane (4.3 feet, ZONE). TONY DONCIC MAKES IT! Assist: Tim Johnson
Score: 22-30

[10:59] Team_050 possession (Score: 22-30)
FOUL! Reach-in foul on Bradley Dosunmu during the drive. [Team fouls: 1] No free throws, side out. (Bradley Dosunmu: 1 personal fouls)

[10:44] Team_050 possession (Score: 22-30)
FOUL! Holding foul on Tony Doncic. [Team fouls: 2] No free throws, side out. (Tony Doncic: 1 personal fouls)

[10:27] Team_050 possession (Score: 22-30)
Donovan Trent attempts a Layup. Contested by John Russell (3.9 feet, MAN). Donovan Trent misses. Rebound secured by Bradley Dosunmu.

[10:13] Team_027 possession (Score: 22-30)
Scottie Harden throws a bad pass out of bounds! TURNOVER! (dead ball)

[10:13] Substitution (Team_027): Tim Johnson OUT → CJ Green IN (stamina_rule2)

[10:13] Substitution (Team_027): Scottie Harden OUT → Rudy Quickley IN (stamina_rule2)

[10:13] Substitution (Team_027): John Russell OUT → Ben Stewart IN (stamina_rule2)

[10:13] Substitution (Team_050): LeBron Bridges OUT → Luka Gasol IN (stamina_rule2)

[10:13] Substitution (Team_050): Donovan Trent OUT → Tyler Smith IN (stamina_rule2)

[09:57] Team_050 possession (Score: 22-30)
Giannis LaVine attempts a Layup. Contested by Ben Stewart (5.1 feet, ZONE). GIANNIS LAVINE MAKES IT! Assist: Tyler Smith
Score: 22-32

[09:43] Team_027 possession (Score: 22-32)
FOUL! Reach-in foul on Tyler Smith during the drive. [Team fouls: 2] No free throws, side out. (Tyler Smith: 1 personal fouls)

[09:32] Team_027 possession (Score: 22-32)
Bradley Dosunmu attempts a Layup. Contested by Luka Gasol (5.0 feet, MAN). Bradley Dosunmu misses. Rebound secured by Collin Bane.

[09:15] Team_050 possession (Score: 22-32)
Tyler Smith drives, picks up Ben Stewart. Help arrives from Tony Doncic! Tyler Smith attempts a Dunk. Contested by Tony Doncic (5.1 feet, ZONE). Tyler Smith misses. Rebound secured by Bradley Dosunmu.

[09:06] Team_027 possession (Score: 22-32)
Bradley Dosunmu attempts a 3Pt. Contested by Giannis LaVine (4.3 feet, ZONE). BRADLEY DOSUNMU MAKES IT!
Score: 25-32

[08:52] Team_050 possession (Score: 25-32)
Tyler Smith attempts a 3Pt. Contested by Ben Stewart (5.1 feet, MAN). Tyler Smith misses. Rebound secured by Bradley Dosunmu.

[08:40] Team_027 possession (Score: 25-32)
Tony Doncic attempts a Midrange. Contested by Luka Gasol (5.0 feet, ZONE). Tony Doncic misses. Rebound secured by Joel Banchero.

[08:24] Team_050 possession (Score: 25-32)
FOUL! Reach-in foul on Rudy Quickley during the drive. [Team fouls: 3] No free throws, side out. (Rudy Quickley: 1 personal fouls)

[08:12] Team_050 possession (Score: 25-32)
Giannis LaVine attempts a 3Pt. Contested by Bradley Dosunmu (5.2 feet, ZONE). GIANNIS LAVINE MAKES IT!
Score: 25-35

[07:55] Team_027 possession (Score: 25-35)
Tony Doncic attempts a 3Pt. Contested by Giannis LaVine (4.5 feet, ZONE). Tony Doncic misses. Offensive rebound by Bradley Dosunmu! Bradley Dosunmu kicks it out.

[07:37] Team_027 possession (Score: 25-35)
CJ Green attempts a 3Pt. Contested by Giannis LaVine (4.6 feet, MAN). CJ Green misses. Rebound secured by Collin Bane.

[07:22] Team_050 possession (Score: 25-35)
FOUL! Holding foul on Tony Doncic. [Team fouls: 4] No free throws, side out. (Tony Doncic: 2 personal fouls)

[07:06] Team_050 possession (Score: 25-35)
FOUL! Shooting foul on CJ Green. Giannis LaVine to the line for 2 free throws. [BONUS: 5 team fouls] (CJ Green: 1 personal fouls)   FT 1/2: GOOD   FT 2/2: GOOD Giannis LaVine makes 2/2 from the line.
Score: 25-37

[06:50] Team_027 possession (Score: 25-37)
Ben Stewart attempts a 3Pt. Contested by Luka Gasol (4.8 feet, ZONE). Ben Stewart misses. Rebound secured by Collin Bane.

[06:30] Team_050 possession (Score: 25-37)
Joel Banchero attempts a 3Pt. Contested by Rudy Quickley (3.1 feet, ZONE). Joel Banchero misses. Rebound secured by Bradley Dosunmu.

[06:15] Team_027 possession (Score: 25-37)
Ben Stewart drives, picks up Tyler Smith. Help arrives from Joel Banchero! Ben Stewart attempts a Layup. Contested by Joel Banchero (5.1 feet, ZONE). BEN STEWART MAKES IT! Assist: Bradley Dosunmu
Score: 27-37

[06:02] Team_050 possession (Score: 27-37)
FOUL! Reach-in foul on Ben Stewart during the drive. [IN THE BONUS! 6 team fouls] Giannis LaVine to the line for 2 free throws. (Ben Stewart: 1 personal fouls)   FT 1/2: GOOD   FT 2/2: GOOD Giannis LaVine makes 2/2 from the line.
Score: 27-39

[05:47] Team_027 possession (Score: 27-39)
Bradley Dosunmu commits a violation (traveling/carry)! TURNOVER! (dead ball)

[05:47] Substitution (Team_027): Tony Doncic OUT → Dirk Lillard IN (stamina_rule2)

[05:47] Substitution (Team_027): Bradley Dosunmu OUT → LeBron Russell IN (stamina_rule2)

[05:47] Substitution (Team_050): Giannis LaVine OUT → Damian O'Neal IN (stamina_rule2)

[05:47] Substitution (Team_050): Joel Banchero OUT → Dwyane Towns IN (stamina_rule2)

[05:47] Substitution (Team_050): Collin Bane OUT → Larry Curry IN (stamina_rule2)

[05:31] Team_050 possession (Score: 27-39)
Damian O'Neal attempts a 3Pt. Contested by CJ Green (5.2 feet, MAN). Damian O'Neal misses. Rebound secured by Ben Stewart.

[05:21] Team_027 possession (Score: 27-39)
CJ Green attempts a 3Pt. Wide open! Damian O'Neal is 6.5 feet away. [MAN] CJ GREEN MAKES IT!
Score: 30-39

[05:02] Team_050 possession (Score: 30-39)
Tyler Smith attempts a Layup. Contested by Ben Stewart (5.1 feet, MAN). Tyler Smith misses. Rebound secured by Ben Stewart.

[04:47] Team_027 possession (Score: 30-39)
CJ Green attempts a 3Pt. Contested by Luka Gasol (5.1 feet, ZONE). CJ Green misses. Rebound secured by Tyler Smith.

[04:32] Team_050 possession (Score: 30-39)
Dwyane Towns makes the Layup and draws the foul on Dirk Lillard! And-1! Dwyane Towns to the line for 1. [BONUS: 7 team fouls] (Dirk Lillard: 1 personal fouls)   FT 1/1: GOOD Dwyane Towns makes 1/1 from the line.
Score: 30-42

[04:19] Team_027 possession (Score: 30-42)
Dirk Lillard attempts a 3Pt. Contested by Luka Gasol (5.0 feet, ZONE). Dirk Lillard misses. Rebound secured by Larry Curry.

[04:04] Team_050 possession (Score: 30-42)
Damian O'Neal drives to the basket... Damian O'Neal loses control! Ball rolls out of bounds! TURNOVER! (dead ball)

[03:49] Team_027 possession (Score: 30-42)
Rudy Quickley attempts a 3Pt. Contested by Larry Curry (5.3 feet, MAN). RUDY QUICKLEY MAKES IT! Assist: Dirk Lillard
Score: 33-42

[03:37] Team_050 possession (Score: 33-42)
Dwyane Towns attempts a 3Pt. Contested by Dirk Lillard (4.4 feet, MAN). Dwyane Towns misses. Rebound secured by LeBron Russell.

[03:22] Team_027 possession (Score: 33-42)
FOUL! Shooting foul on Luka Gasol. CJ Green to the line for 3 free throws. [Team fouls: 3] (Luka Gasol: 1 personal fouls)   FT 1/3: GOOD   FT 2/3: GOOD   FT 3/3: MISS CJ Green makes 2/3 from the line. Rebound secured by Larry Curry.
Score: 35-42

[03:04] Team_050 possession (Score: 35-42)
Larry Curry throws a bad pass out of bounds! TURNOVER! (dead ball)

[02:50] Team_027 possession (Score: 35-42)
Dirk Lillard loses the ball! Stripped by Dwyane Towns! TURNOVER! (live ball)

[02:35] Team_050 possession (Score: 35-42)
Tyler Smith drives, picks up Ben Stewart. Help arrives from Dirk Lillard! Tyler Smith attempts a Dunk. Contested by Dirk Lillard (5.2 feet, MAN). Tyler Smith misses. Offensive rebound by Larry Curry! Larry Curry kicks it out.

[02:24] Team_050 possession (Score: 35-42)
Damian O'Neal attempts a 3Pt. Contested by Rudy Quickley (3.6 feet, ZONE). Damian O'Neal misses. Offensive rebound by Larry Curry! Larry Curry kicks it out.

[02:14] Team_050 possession (Score: 35-42)
Damian O'Neal loses the ball! Stripped by CJ Green! TURNOVER! (live ball)

[01:56] Team_027 possession (Score: 35-42)
CJ Green attempts a Layup. Wide open! Damian O'Neal is 6.4 feet away. [MAN] CJ GREEN MAKES IT! Assist: Ben Stewart
Score: 37-42

[01:40] Team_050 possession (Score: 37-42)
Tyler Smith attempts a 3Pt. Contested by Rudy Quickley (3.9 feet, ZONE). Tyler Smith misses. Rebound secured by LeBron Russell.

[01:28] Team_027 possession (Score: 37-42)
Dirk Lillard attempts a 3Pt. Contested by Dwyane Towns (4.4 feet, MAN). DIRK LILLARD MAKES IT! Assist: LeBron Russell
Score: 40-42

[01:17] Team_050 possession (Score: 40-42)
Dwyane Towns attempts a 3Pt. Contested by LeBron Russell (5.7 feet, ZONE). DWYANE TOWNS MAKES IT! Assist: Tyler Smith
Score: 40-45

[01:06] Team_027 possession (Score: 40-45)
Ben Stewart drives to the basket... Ben Stewart throws a bad pass! Stolen by Tyler Smith! TURNOVER! (live ball)

[00:54] Team_050 possession (Score: 40-45)
FOUL! Shooting foul on Rudy Quickley. Dwyane Towns to the line for 2 free throws. [BONUS: 8 team fouls] (Rudy Quickley: 2 personal fouls)   FT 1/2: GOOD   FT 2/2: GOOD Dwyane Towns makes 2/2 from the line.
Score: 40-47

[00:38] Team_027 possession (Score: 40-47)
CJ Green attempts a 3Pt. Wide open! Damian O'Neal is 6.4 feet away. [MAN] CJ Green misses. Offensive rebound by Dirk Lillard! Dirk Lillard kicks it out.

[00:23] Team_027 possession (Score: 40-47)
Ben Stewart drives, Tyler Smith stays with him. Ben Stewart attempts a Layup. Contested by Tyler Smith (5.4 feet, ZONE). Ben Stewart misses. Rebound secured by Larry Curry.

[00:10] Team_050 possession (Score: 40-47)
Dwyane Towns attempts a 3Pt. Contested by Rudy Quickley (4.1 feet, ZONE). Dwyane Towns misses. Rebound secured by LeBron Russell.

================================================================================
                              2ND QUARTER COMPLETE                              
================================================================================

2ND QUARTER SCORE: Team_027 23, Team_050 20

BOX SCORE:
================================================================================

Team_027
--------------------------------------------------------------------------------
Player                MIN  PTS  REB  AST  TO      FG   FG%      3P   3P%
--------------------------------------------------------------------------------
CJ Green               12    5    0    0   0   2/5    40.0     0/0   0.0
Tony Doncic            17    3    0    0   0   1/2    50.0     0/0   0.0
Bradley Dosunmu        17    3    5    1   0   1/2    50.0     0/0   0.0
Dirk Lillard            7    3    1    1   0   1/2    50.0     0/0   0.0
Rudy Quickley          12    3    0    0   0   1/1   100.0     0/0   0.0
John Russell           13    2    0    0   0   1/1   100.0     0/0   0.0
Ben Stewart            12    2    2    1   0   1/3    33.3     0/0   0.0
Tim Johnson            13    0    0    1   0   0/0     0.0     0/0   0.0
LeBron Russell          7    0    3    1   0   0/0     0.0     0/0   0.0

TEAM: FG: 8/16 (50.0%), 3PT: 5/10 (50.0%), REB: 11 (2 off, 9 def), AST: 5, TO: 4
TEAM FOULS: 8 [Team_050 in BONUS]


Team_050
--------------------------------------------------------------------------------
Player                MIN  PTS  REB  AST  TO      FG   FG%      3P   3P%
--------------------------------------------------------------------------------
Giannis LaVine         17    9    0    0   0   4/4   100.0     0/0   0.0
Dwyane Towns            7    8    0    0   0   3/5    60.0     0/0   0.0
Joel Banchero          17    3    1    0   0   1/2    50.0     0/0   0.0
Donovan Trent          13    0    0    1   0   0/1     0.0     0/0   0.0
Tyler Smith            12    0    1    2   0   0/4     0.0     0/0   0.0
Collin Bane            17    0    3    0   0   0/0     0.0     0/0   0.0
Damian O'Neal           7    0    0    0   0   0/1     0.0     0/0   0.0
Larry Curry             7    0    5    0   0   0/0     0.0     0/0   0.0

TEAM: FG: 8/17 (47.1%), 3PT: 3/9 (33.3%), REB: 10 (2 off, 8 def), AST: 3, TO: 3
TEAM FOULS: 3

================================================================================

================================================================================
                       3RD QUARTER - Team_027 vs Team_050                       
================================================================================

[12:00] Team_027 possession (Score: 40-47)
Scottie Harden attempts a Midrange. Contested by Collin Bane (4.2 feet, ZONE). SCOTTIE HARDEN MAKES IT!
Score: 42-47

[11:48] Team_050 possession (Score: 42-47)
FOUL! Reach-in foul on Bradley Dosunmu during the drive. [Team fouls: 1] No free throws, side out. (Bradley Dosunmu: 1 personal fouls)

[11:30] Team_050 possession (Score: 42-47)
Giannis LaVine attempts a 3Pt. Contested by Tony Doncic (4.3 feet, ZONE). Giannis LaVine misses. Rebound secured by Tony Doncic.

[11:20] Team_027 possession (Score: 42-47)
FOUL! Offensive foul on Tony Doncic! Joel Banchero drew the charge! [Team fouls: 2] (Tony Doncic: 1 personal fouls) TURNOVER! (dead ball)

[11:08] Team_050 possession (Score: 42-47)
Collin Bane attempts a Midrange. Contested by Scottie Harden (4.7 feet, MAN). Collin Bane misses. Rebound secured by Tony Doncic.

[10:54] Team_027 possession (Score: 42-47)
John Russell attempts a Midrange. Contested by LeBron Bridges (5.0 feet, ZONE). John Russell misses. FOUL! Loose ball foul on LeBron Bridges during the rebound battle. [Team fouls: 1] No free throws, side out. (LeBron Bridges: 1 personal fouls)

[10:40] Team_027 possession (Score: 42-47)
FOUL! Holding foul on Collin Bane. [Team fouls: 2] No free throws, side out. (Collin Bane: 1 personal fouls)

[10:28] Team_027 possession (Score: 42-47)
Bradley Dosunmu drives, LeBron Bridges stays with him. Bradley Dosunmu attempts a Dunk. Contested by LeBron Bridges (4.3 feet, MAN). BRADLEY DOSUNMU MAKES IT!
Score: 44-47

[10:13] Team_050 possession (Score: 44-47)
Joel Banchero drives and kicks out. LeBron Bridges attempts a 3Pt. Contested by Bradley Dosunmu (4.4 feet, MAN). LeBron Bridges misses. Rebound secured by Tony Doncic.

[09:58] Team_027 possession (Score: 44-47)
Tim Johnson attempts a 3Pt. Contested by Giannis LaVine (4.2 feet, MAN). Tim Johnson misses. Rebound secured by Collin Bane.

[09:43] Team_050 possession (Score: 44-47)
Joel Banchero attempts a Layup. Contested by Tony Doncic (3.7 feet, MAN). Joel Banchero misses. Rebound secured by John Russell.

[09:31] Team_027 possession (Score: 44-47)
Tim Johnson attempts a 3Pt. Contested by Giannis LaVine (4.2 feet, ZONE). Tim Johnson misses. Rebound secured by Joel Banchero.

[09:14] Team_050 possession (Score: 44-47)
LeBron Bridges attempts a 3Pt. Contested by Bradley Dosunmu (4.5 feet, ZONE). LeBron Bridges misses. Rebound secured by Bradley Dosunmu.

[09:03] Team_027 possession (Score: 44-47)
FOUL! Holding foul on Joel Banchero. [Team fouls: 3] No free throws, side out. (Joel Banchero: 1 personal fouls)

[08:50] Team_027 possession (Score: 44-47)
Tim Johnson drives and kicks out. Tim Johnson attempts a Midrange. Contested by Joel Banchero (4.3 feet, ZONE). Tim Johnson misses. Offensive rebound by Bradley Dosunmu! Bradley Dosunmu kicks it out.

[08:35] Team_027 possession (Score: 44-47)
FOUL! Shooting foul on Giannis LaVine. Tim Johnson to the line for 2 free throws. [Team fouls: 4] (Giannis LaVine: 1 personal fouls)   FT 1/2: GOOD   FT 2/2: MISS Tim Johnson makes 1/2 from the line. Rebound secured by Joel Banchero.
Score: 45-47

[08:24] Team_050 possession (Score: 45-47)
FOUL! Shooting foul on Scottie Harden. Collin Bane to the line for 2 free throws. [Team fouls: 3] (Scottie Harden: 1 personal fouls)   FT 1/2: MISS   FT 2/2: GOOD Collin Bane makes 1/2 from the line.
Score: 45-48

[08:13] Team_027 possession (Score: 45-48)
Tim Johnson attempts a 3Pt. Contested by Giannis LaVine (4.2 feet, ZONE). Tim Johnson misses. FOUL! Loose ball foul on LeBron Bridges during the rebound battle. [IN THE BONUS! 5 team fouls] John Russell to the line for 2 free throws. (LeBron Bridges: 2 personal fouls)   FT 1/2: GOOD   FT 2/2: GOOD John Russell makes 2/2 from the line.
Score: 47-48

[07:59] Team_050 possession (Score: 47-48)
Collin Bane attempts a 3Pt. Contested by Tim Johnson (5.1 feet, ZONE). Collin Bane misses. Rebound secured by John Russell.

[07:49] Team_027 possession (Score: 47-48)
John Russell makes the 3Pt and draws the foul on Giannis LaVine! And-1! John Russell to the line for 1. [BONUS: 6 team fouls] (Giannis LaVine: 2 personal fouls)   FT 1/1: GOOD John Russell makes 1/1 from the line.
Score: 51-48

[07:31] Team_050 possession (Score: 51-48)
Joel Banchero drives, Tony Doncic stays with him. Joel Banchero attempts a Layup. Contested by Tony Doncic (3.7 feet, MAN). Joel Banchero misses. Rebound secured by Bradley Dosunmu.

[07:19] Team_027 possession (Score: 51-48)
Bradley Dosunmu drives, picks up Donovan Trent. Help arrives from Joel Banchero! Bradley Dosunmu attempts a Dunk. Contested by Joel Banchero (4.9 feet, ZONE). BRADLEY DOSUNMU MAKES IT!
Score: 53-48

[07:02] Team_050 possession (Score: 53-48)
Giannis LaVine attempts a 3Pt. Contested by Tim Johnson (5.3 feet, ZONE). GIANNIS LAVINE MAKES IT! Assist: Donovan Trent
Score: 53-51

[06:49] Team_027 possession (Score: 53-51)
Tim Johnson attempts a 3Pt. Contested by Giannis LaVine (4.2 feet, MAN). TIM JOHNSON MAKES IT! Assist: Scottie Harden
Score: 56-51

[06:33] Team_050 possession (Score: 56-51)
Donovan Trent throws a bad pass! Stolen by John Russell! TURNOVER! (live ball)

[06:20] Team_027 possession (Score: 56-51)
John Russell attempts a Midrange. Contested by LeBron Bridges (5.0 feet, ZONE). John Russell misses. Offensive rebound by Bradley Dosunmu! Bradley Dosunmu kicks it out.

[06:03] Team_027 possession (Score: 56-51)
Tony Doncic attempts a 3Pt. Contested by Joel Banchero (4.4 feet, MAN). Tony Doncic misses. Rebound secured by Collin Bane.

[05:47] Team_050 possession (Score: 56-51)
LeBron Bridges attempts a Midrange. Contested by Bradley Dosunmu (4.5 feet, ZONE). LEBRON BRIDGES MAKES IT! Assist: Joel Banchero
Score: 56-53

[05:30] Team_027 possession (Score: 56-53)
Tony Doncic attempts a 3Pt. Contested by Joel Banchero (4.4 feet, MAN). Tony Doncic misses. Rebound secured by Joel Banchero.

[05:13] Team_050 possession (Score: 56-53)
LeBron Bridges attempts a 3Pt. Contested by Bradley Dosunmu (4.6 feet, MAN). LeBron Bridges misses. Rebound secured by Tony Doncic.

[05:02] Team_027 possession (Score: 56-53)
Bradley Dosunmu drives, picks up Donovan Trent. Help arrives from Joel Banchero! Bradley Dosunmu attempts a Dunk. Contested by Joel Banchero (5.0 feet, ZONE). Bradley Dosunmu misses. Rebound secured by LeBron Bridges.

[04:49] Team_050 possession (Score: 56-53)
LeBron Bridges attempts a Midrange. Contested by Bradley Dosunmu (4.6 feet, ZONE). LEBRON BRIDGES MAKES IT!
Score: 56-55

[04:37] Team_027 possession (Score: 56-55)
Tim Johnson drives to the basket... Tim Johnson commits a violation (traveling/carry)! TURNOVER! (dead ball)

[04:28] Team_050 possession (Score: 56-55)
Collin Bane attempts a Midrange. Contested by Tony Doncic (4.1 feet, ZONE). COLLIN BANE MAKES IT!
Score: 56-57

[04:16] Team_027 possession (Score: 56-57)
Tim Johnson attempts a 3Pt. Contested by Giannis LaVine (4.3 feet, MAN). TIM JOHNSON MAKES IT!
Score: 59-57

[04:02] Team_050 possession (Score: 59-57)
LeBron Bridges attempts a 3Pt. Contested by Bradley Dosunmu (4.7 feet, MAN). LEBRON BRIDGES MAKES IT! Assist: Giannis LaVine
Score: 59-60

[03:47] Team_027 possession (Score: 59-60)
Bradley Dosunmu drives, picks up Donovan Trent. Help arrives from Joel Banchero! Bradley Dosunmu attempts a Dunk. Contested by Joel Banchero (5.1 feet, ZONE). BRADLEY DOSUNMU MAKES IT! Assist: Scottie Harden
Score: 61-60

[03:33] Team_050 possession (Score: 61-60)
Joel Banchero attempts a 3Pt. Contested by Tony Doncic (3.9 feet, MAN). JOEL BANCHERO MAKES IT! Assist: Giannis LaVine
Score: 61-63

[03:18] Team_027 possession (Score: 61-63)
Bradley Dosunmu drives to the basket... Bradley Dosunmu loses control! Ball rolls out of bounds! TURNOVER! (dead ball)

[03:18] Substitution (Team_027): Tim Johnson OUT → CJ Green IN (stamina_rule2)

[03:18] Substitution (Team_027): Scottie Harden OUT → Rudy Quickley IN (stamina_rule2)

[03:18] Substitution (Team_027): John Russell OUT → Ben Stewart IN (stamina_rule2)

[03:18] Substitution (Team_050): LeBron Bridges OUT → Luka Gasol IN (stamina_rule2)

[03:18] Substitution (Team_050): Donovan Trent OUT → Tyler Smith IN (stamina_rule2)

[03:02] Team_050 possession (Score: 61-63)
Tyler Smith attempts a Layup. Contested by Ben Stewart (5.1 feet, ZONE). Tyler Smith misses. Offensive rebound by Joel Banchero! Joel Banchero kicks it out.

[02:53] Team_050 possession (Score: 61-63)
Tyler Smith attempts a Midrange. Contested by Ben Stewart (5.1 feet, MAN). Tyler Smith misses. Offensive rebound by Collin Bane! Collin Bane kicks it out.

[02:41] Team_050 possession (Score: 61-63)
Giannis LaVine attempts a 3Pt. Contested by Rudy Quickley (3.7 feet, ZONE). Giannis LaVine misses. FOUL! Loose ball foul on Ben Stewart during the rebound battle. [Team fouls: 4] No free throws, side out. (Ben Stewart: 1 personal fouls)

[02:25] Team_050 possession (Score: 61-63)
Giannis LaVine drives and kicks out. Joel Banchero attempts a Midrange. Contested by Tony Doncic (4.2 feet, MAN). Joel Banchero misses. Rebound secured by Tony Doncic.

[02:10] Team_027 possession (Score: 61-63)
Rudy Quickley attempts a 3Pt. Contested by Giannis LaVine (4.7 feet, ZONE). RUDY QUICKLEY MAKES IT! Assist: Tony Doncic
Score: 64-63

[01:53] Team_050 possession (Score: 64-63)
Giannis LaVine attempts a 3Pt. Contested by CJ Green (5.4 feet, MAN). Giannis LaVine misses. Rebound secured by Ben Stewart.

[01:36] Team_027 possession (Score: 64-63)
Tony Doncic attempts a 3Pt. Contested by Joel Banchero (4.7 feet, MAN). TONY DONCIC MAKES IT! Assist: CJ Green
Score: 67-63

[01:22] Team_050 possession (Score: 67-63)
Tyler Smith drives, Ben Stewart stays with him. Tyler Smith attempts a Dunk. Contested by Ben Stewart (5.1 feet, ZONE). TYLER SMITH MAKES IT! Assist: Giannis LaVine
Score: 67-65

[01:07] Team_027 possession (Score: 67-65)
FOUL! Holding foul on Luka Gasol. [IN THE BONUS! 7 team fouls] Bradley Dosunmu to the line for 2 free throws. (Luka Gasol: 1 personal fouls)   FT 1/2: GOOD   FT 2/2: GOOD Bradley Dosunmu makes 2/2 from the line.
Score: 69-65

[00:58] Team_050 possession (Score: 69-65)
Joel Banchero attempts a 3Pt. Contested by Tony Doncic (4.2 feet, MAN). Joel Banchero misses. Rebound secured by Bradley Dosunmu.

[00:42] Team_027 possession (Score: 69-65)
Tony Doncic attempts a Midrange. Contested by Joel Banchero (4.8 feet, MAN). Tony Doncic misses. Rebound secured by Collin Bane.

[00:27] Team_050 possession (Score: 69-65)
Giannis LaVine attempts a 3Pt. Contested by Rudy Quickley (3.6 feet, ZONE). Giannis LaVine misses. Rebound secured by Ben Stewart.

[00:08] Team_027 possession (Score: 69-65)
CJ Green drives and kicks out. Rudy Quickley attempts a 3Pt. Contested by Collin Bane (4.7 feet, MAN). Rudy Quickley misses. Rebound secured by Tyler Smith.

================================================================================
                              3RD QUARTER COMPLETE                              
================================================================================

3RD QUARTER SCORE: Team_027 29, Team_050 18

BOX SCORE:
================================================================================

Team_027
--------------------------------------------------------------------------------
Player                MIN  PTS  REB  AST  TO      FG   FG%      3P   3P%
--------------------------------------------------------------------------------
Bradley Dosunmu        29    8    5    0   0   4/5    80.0     0/0   0.0
John Russell           22    6    3    0   0   2/2   100.0     0/0   0.0
Tim Johnson            22    6    0    0   0   2/5    40.0     0/0   0.0
Tony Doncic            29    3    5    1   0   1/4    25.0     0/0   0.0
Rudy Quickley          15    3    0    0   0   1/1   100.0     0/0   0.0
Scottie Harden         22    2    0    2   0   1/1   100.0     0/0   0.0
Ben Stewart            15    0    2    0   0   0/0     0.0     0/0   0.0
CJ Green               15    0    0    1   0   0/1     0.0     0/0   0.0

TEAM: FG: 11/19 (57.9%), 3PT: 6/10 (60.0%), REB: 15 (3 off, 12 def), AST: 4, TO: 3
TEAM FOULS: 4


Team_050
--------------------------------------------------------------------------------
Player                MIN  PTS  REB  AST  TO      FG   FG%      3P   3P%
--------------------------------------------------------------------------------
LeBron Bridges         22    7    1    0   0   3/5    60.0     0/0   0.0
Giannis LaVine         29    3    0    3   0   1/5    20.0     0/0   0.0
Collin Bane            29    3    4    0   0   2/4    50.0     0/0   0.0
Joel Banchero          29    3    5    1   0   1/5    20.0     0/0   0.0
Tyler Smith            15    2    1    0   0   1/1   100.0     0/0   0.0
Donovan Trent          22    0    0    1   0   0/0     0.0     0/0   0.0

TEAM: FG: 8/20 (40.0%), 3PT: 3/10 (30.0%), REB: 11 (3 off, 8 def), AST: 5, TO: 1
TEAM FOULS: 7 [Team_027 in BONUS]

================================================================================

================================================================================
                       4TH QUARTER - Team_027 vs Team_050                       
================================================================================

[12:00] Team_027 possession (Score: 69-65)
Tim Johnson attempts a 3Pt. Contested by Giannis LaVine (4.6 feet, ZONE). Tim Johnson misses. Rebound secured by Collin Bane.

[11:46] Team_050 possession (Score: 69-65)
FOUL! Shooting foul on Scottie Harden. Giannis LaVine to the line for 2 free throws. [Team fouls: 1] (Scottie Harden: 1 personal fouls)   FT 1/2: GOOD   FT 2/2: GOOD Giannis LaVine makes 2/2 from the line.
Score: 69-67

[11:35] Team_027 possession (Score: 69-67)
John Russell attempts a Midrange. Contested by Joel Banchero (5.4 feet, ZONE). John Russell misses. Rebound secured by Collin Bane.

[11:25] Team_050 possession (Score: 69-67)
Donovan Trent drives and kicks out. LeBron Bridges attempts a 3Pt. Contested by Tim Johnson (4.9 feet, ZONE). LeBron Bridges misses. Rebound secured by John Russell.

[11:06] Team_027 possession (Score: 69-67)
Bradley Dosunmu attempts a Midrange. Contested by Donovan Trent (4.9 feet, ZONE). BRADLEY DOSUNMU MAKES IT! Assist: John Russell
Score: 71-67

[10:53] Team_050 possession (Score: 71-67)
Giannis LaVine throws a bad pass out of bounds! TURNOVER! (dead ball)

[10:53] Substitution (Team_027): Tony Doncic OUT → Dirk Lillard IN (stamina_rule2)

[10:53] Substitution (Team_027): Bradley Dosunmu OUT → LeBron Russell IN (stamina_rule2)

[10:53] Substitution (Team_050): Giannis LaVine OUT → Damian O'Neal IN (stamina_rule2)

[10:53] Substitution (Team_050): Joel Banchero OUT → Dwyane Towns IN (stamina_rule2)

[10:53] Substitution (Team_050): Collin Bane OUT → Larry Curry IN (stamina_rule2)

[10:36] Team_027 possession (Score: 71-67)
LeBron Russell attempts a 3Pt. Contested by LeBron Bridges (4.3 feet, MAN). LeBron Russell misses. FOUL! Loose ball foul on Donovan Trent during the rebound battle. [Team fouls: 1] No free throws, side out. (Donovan Trent: 1 personal fouls)

[10:26] Team_027 possession (Score: 71-67)
LeBron Russell attempts a Midrange. Contested by LeBron Bridges (4.4 feet, MAN). LEBRON RUSSELL MAKES IT! Assist: Tim Johnson
Score: 73-67

[10:14] Team_050 possession (Score: 73-67)
Damian O'Neal attempts a 3Pt. Contested by Tim Johnson (5.1 feet, MAN). Damian O'Neal misses. Offensive rebound by LeBron Bridges! LeBron Bridges kicks it out.

[10:00] Team_050 possession (Score: 73-67)
LeBron Bridges drives and kicks out. FOUL! Shooting foul on LeBron Russell. LeBron Bridges to the line for 3 free throws. [Team fouls: 2] (LeBron Russell: 1 personal fouls)   FT 1/3: GOOD   FT 2/3: GOOD   FT 3/3: MISS LeBron Bridges makes 2/3 from the line. Rebound secured by John Russell.
Score: 73-69

[09:46] Team_027 possession (Score: 73-69)
Tim Johnson attempts a 3Pt. Wide open! Damian O'Neal is 6.6 feet away. [MAN] TIM JOHNSON MAKES IT! Assist: Dirk Lillard
Score: 76-69

[09:34] Team_050 possession (Score: 76-69)
LeBron Bridges attempts a Midrange. Contested by Tim Johnson (5.2 feet, ZONE). LeBron Bridges misses. Rebound secured by LeBron Russell.

[09:23] Team_027 possession (Score: 76-69)
LeBron Russell makes the Midrange and draws the foul on LeBron Bridges! And-1! LeBron Russell to the line for 1. [Team fouls: 2] (LeBron Bridges: 1 personal fouls)   FT 1/1: GOOD LeBron Russell makes 1/1 from the line.
Score: 79-69

[09:09] Team_050 possession (Score: 79-69)
Dwyane Towns drives, John Russell stays with him. Dwyane Towns attempts a Layup. Contested by John Russell (4.4 feet, ZONE). DWYANE TOWNS MAKES IT! Assist: LeBron Bridges
Score: 79-71

[08:52] Team_027 possession (Score: 79-71)
FOUL! Holding foul on Larry Curry. [Team fouls: 3] No free throws, side out. (Larry Curry: 1 personal fouls)

[08:36] Team_027 possession (Score: 79-71)
FOUL! Shooting foul on Dwyane Towns. Dirk Lillard to the line for 2 free throws. [Team fouls: 4] (Dwyane Towns: 1 personal fouls)   FT 1/2: GOOD   FT 2/2: GOOD Dirk Lillard makes 2/2 from the line.
Score: 81-71

[08:17] Team_050 possession (Score: 81-71)
Damian O'Neal attempts a 3Pt. Contested by Dirk Lillard (4.2 feet, ZONE). DAMIAN O'NEAL MAKES IT! Assist: Dwyane Towns
Score: 81-74

[08:01] Team_027 possession (Score: 81-74)
FOUL! Reach-in foul on Donovan Trent during the drive. [IN THE BONUS! 5 team fouls] Scottie Harden to the line for 2 free throws. (Donovan Trent: 2 personal fouls)   FT 1/2: GOOD   FT 2/2: MISS Scottie Harden makes 1/2 from the line. Offensive rebound by John Russell! John Russell's putback is no good.
Score: 82-74

[07:45] Team_050 possession (Score: 82-74)
Donovan Trent drives to the basket... Donovan Trent loses the ball! Stripped by John Russell! TURNOVER! (live ball)

[07:36] Team_027 possession (Score: 82-74)
LeBron Russell drives to the basket... LeBron Russell throws a bad pass! Stolen by LeBron Bridges! TURNOVER! (live ball)

[07:20] Team_050 possession (Score: 82-74)
Larry Curry drives, picks up Scottie Harden. Help arrives from Dirk Lillard! Larry Curry attempts a Dunk. Contested by Dirk Lillard (5.1 feet, MAN). Larry Curry misses. Rebound secured by John Russell.

[07:04] Team_027 possession (Score: 82-74)
John Russell attempts a Layup. Wide open! Donovan Trent is 6.0 feet away. [MAN] JOHN RUSSELL MAKES IT! Assist: LeBron Russell
Score: 84-74

[06:50] Team_050 possession (Score: 84-74)
Damian O'Neal attempts a 3Pt. Contested by LeBron Russell (5.5 feet, ZONE). Damian O'Neal misses. Offensive rebound by LeBron Bridges! LeBron Bridges kicks it out.

[06:39] Team_050 possession (Score: 84-74)
Dwyane Towns drives to the basket... Dwyane Towns commits a violation (traveling/carry)! TURNOVER! (dead ball)

[06:39] Substitution (Team_027): Tim Johnson OUT → CJ Green IN (stamina_rule2)

[06:39] Substitution (Team_027): Scottie Harden OUT → Rudy Quickley IN (stamina_rule2)

[06:39] Substitution (Team_027): John Russell OUT → Ben Stewart IN (stamina_rule2)

[06:39] Substitution (Team_050): LeBron Bridges OUT → Luka Gasol IN (stamina_rule2)

[06:39] Substitution (Team_050): Donovan Trent OUT → Tyler Smith IN (stamina_rule2)

[06:25] Team_027 possession (Score: 84-74)
LeBron Russell drives and kicks out. Rudy Quickley attempts a 3Pt. Contested by Larry Curry (4.9 feet, MAN). RUDY QUICKLEY MAKES IT! Assist: Dirk Lillard
Score: 87-74

[06:12] Team_050 possession (Score: 87-74)
Larry Curry attempts a Midrange. Contested by Rudy Quickley (3.4 feet, MAN). LARRY CURRY MAKES IT! Assist: Luka Gasol
Score: 87-76

[05:55] Team_027 possession (Score: 87-76)
FOUL! Holding foul on Larry Curry. [IN THE BONUS! 6 team fouls] Rudy Quickley to the line for 2 free throws. (Larry Curry: 2 personal fouls)   FT 1/2: GOOD   FT 2/2: GOOD Rudy Quickley makes 2/2 from the line.
Score: 89-76

[05:37] Team_050 possession (Score: 89-76)
Larry Curry drives, picks up Rudy Quickley. Help arrives from Dirk Lillard! Larry Curry attempts a Layup. Contested by Dirk Lillard (3.4 feet, MAN). Larry Curry misses. Offensive rebound by Larry Curry! Larry Curry kicks it out.

[05:22] Team_050 possession (Score: 89-76)
Damian O'Neal drives, Ben Stewart stays with him. Damian O'Neal attempts a Layup. Contested by Ben Stewart (4.8 feet, ZONE). Damian O'Neal misses. Rebound secured by Dirk Lillard.

[05:09] Team_027 possession (Score: 89-76)
CJ Green attempts a 3Pt. Wide open! Damian O'Neal is 6.5 feet away. [MAN] CJ GREEN MAKES IT!
Score: 92-76

[04:56] Team_050 possession (Score: 92-76)
Tyler Smith drives to the basket... Tyler Smith commits a violation (traveling/carry)! TURNOVER! (dead ball)

[04:38] Team_027 possession (Score: 92-76)
FOUL! Shooting foul on Luka Gasol. LeBron Russell to the line for 2 free throws. [BONUS: 7 team fouls] (Luka Gasol: 1 personal fouls)   FT 1/2: GOOD   FT 2/2: GOOD LeBron Russell makes 2/2 from the line.
Score: 94-76

[04:20] Team_050 possession (Score: 94-76)
Tyler Smith drives, Ben Stewart stays with him. Tyler Smith attempts a Layup. Contested by Ben Stewart (5.1 feet, MAN). TYLER SMITH MAKES IT! Assist: Dwyane Towns
Score: 94-78

[04:07] Team_027 possession (Score: 94-78)
Dirk Lillard drives, Dwyane Towns stays with him. Dirk Lillard attempts a Dunk. Contested by Dwyane Towns (4.4 feet, MAN). DIRK LILLARD MAKES IT!
Score: 96-78

[03:52] Team_050 possession (Score: 96-78)
Damian O'Neal drives to the basket... FOUL! Offensive foul on Damian O'Neal! CJ Green drew the charge! [Team fouls: 8] (Damian O'Neal: 1 personal fouls) TURNOVER! (dead ball)

[03:39] Team_027 possession (Score: 96-78)
LeBron Russell drives and kicks out. LeBron Russell attempts a Midrange. Wide open! Damian O'Neal is 6.3 feet away. [ZONE] LEBRON RUSSELL MAKES IT!
Score: 98-78

[03:24] Team_050 possession (Score: 98-78)
Tyler Smith attempts a Layup. Contested by Ben Stewart (5.1 feet, MAN). Tyler Smith misses. Rebound secured by Dirk Lillard.

[03:05] Team_027 possession (Score: 98-78)
FOUL! Shooting foul on Larry Curry. Rudy Quickley to the line for 2 free throws. [BONUS: 9 team fouls] (Larry Curry: 3 personal fouls)   FT 1/2: GOOD   FT 2/2: GOOD Rudy Quickley makes 2/2 from the line.
Score: 100-78

[02:46] Team_050 possession (Score: 100-78)
Damian O'Neal attempts a 3Pt. Contested by CJ Green (5.1 feet, MAN). Damian O'Neal misses. Rebound secured by Ben Stewart.

[02:34] Team_027 possession (Score: 100-78)
Dirk Lillard attempts a 3Pt. Contested by Luka Gasol (5.0 feet, ZONE). Dirk Lillard misses. Rebound secured by Luka Gasol.

[02:21] Team_050 possession (Score: 100-78)
Luka Gasol drives, LeBron Russell stays with him. Luka Gasol attempts a Layup. Contested by LeBron Russell (5.6 feet, MAN). Luka Gasol misses. Rebound secured by Ben Stewart.

[02:03] Team_027 possession (Score: 100-78)
Rudy Quickley attempts a Midrange. Contested by Larry Curry (5.5 feet, MAN). Rudy Quickley misses. Rebound secured by Tyler Smith.

[01:44] Team_050 possession (Score: 100-78)
FOUL! Shooting foul on Rudy Quickley. Larry Curry to the line for 2 free throws. [Team fouls: 3] (Rudy Quickley: 1 personal fouls)   FT 1/2: MISS   FT 2/2: GOOD Larry Curry makes 1/2 from the line.
Score: 100-79

[01:33] Team_027 possession (Score: 100-79)
Rudy Quickley attempts a Midrange. Contested by Larry Curry (5.6 feet, ZONE). Rudy Quickley misses. Rebound secured by Luka Gasol.

[01:16] Team_050 possession (Score: 100-79)
Dwyane Towns attempts a 3Pt. Contested by Rudy Quickley (3.5 feet, ZONE). Dwyane Towns misses. Rebound secured by Ben Stewart.

[01:01] Team_027 possession (Score: 100-79)
Rudy Quickley drives, picks up Larry Curry. Help arrives from Dwyane Towns! Rudy Quickley attempts a Layup. Contested by Dwyane Towns (5.6 feet, MAN). RUDY QUICKLEY MAKES IT!
Score: 102-79

[00:47] Team_050 possession (Score: 102-79)
Dwyane Towns attempts a Midrange. Contested by Rudy Quickley (3.5 feet, ZONE). Dwyane Towns misses. FOUL! Loose ball foul on Dirk Lillard during the rebound battle. [Team fouls: 4] No free throws, side out. (Dirk Lillard: 1 personal fouls)

[00:32] Team_050 possession (Score: 102-79)
Dwyane Towns attempts a Midrange. Contested by Dirk Lillard (4.6 feet, MAN). Dwyane Towns misses. Rebound secured by Ben Stewart.

[00:14] Team_027 possession (Score: 102-79)
LeBron Russell drives to the basket... LeBron Russell loses the ball! Stripped by Luka Gasol! TURNOVER! (live ball)

[00:01] Team_050 possession (Score: 102-79)
Dwyane Towns drives and kicks out. Luka Gasol attempts a 3Pt. Contested by LeBron Russell (5.8 feet, MAN). LUKA GASOL MAKES IT! Assist: Larry Curry
Score: 102-82

================================================================================
                              4TH QUARTER COMPLETE                              
================================================================================

4TH QUARTER SCORE: Team_027 33, Team_050 17

BOX SCORE:
================================================================================

Team_027
--------------------------------------------------------------------------------
Player                MIN  PTS  REB  AST  TO      FG   FG%      3P   3P%
--------------------------------------------------------------------------------
LeBron Russell         18    9    1    1   0   4/4   100.0     0/0   0.0
Rudy Quickley          21    9    0    0   0   4/6    66.7     0/0   0.0
Dirk Lillard           18    4    2    2   0   2/3    66.7     0/0   0.0
Tim Johnson            27    3    0    1   0   1/2    50.0     0/0   0.0
CJ Green               21    3    0    0   0   1/1   100.0     0/0   0.0
John Russell           27    2    5    1   0   1/2    50.0     0/0   0.0
Bradley Dosunmu        31    2    0    0   0   1/1   100.0     0/0   0.0
Scottie Harden         27    0    0    0   0   0/1     0.0     0/0   0.0
Ben Stewart            21    0    4    0   0   0/0     0.0     0/0   0.0

TEAM: FG: 14/20 (70.0%), 3PT: 2/4 (50.0%), REB: 11 (1 off, 10 def), AST: 5, TO: 2
TEAM FOULS: 4


Team_050
--------------------------------------------------------------------------------
Player                MIN  PTS  REB  AST  TO      FG   FG%      3P   3P%
--------------------------------------------------------------------------------
Damian O'Neal          18    3    0    0   0   1/3    33.3     0/0   0.0
Larry Curry            18    3    1    1   0   2/3    66.7     0/0   0.0
Luka Gasol             21    3    3    1   0   1/2    50.0     0/0   0.0
Giannis LaVine         31    2    0    0   0   1/1   100.0     0/0   0.0
Dwyane Towns           18    2    0    2   0   1/3    33.3     0/0   0.0
Tyler Smith            21    2    1    0   0   1/2    50.0     0/0   0.0
Collin Bane            31    0    2    0   0   0/0     0.0     0/0   0.0
Donovan Trent          27    0    0    0   0   0/1     0.0     0/0   0.0
LeBron Bridges         27    0    2    1   0   0/2     0.0     0/0   0.0

TEAM: FG: 7/17 (41.2%), 3PT: 1/3 (33.3%), REB: 10 (4 off, 6 def), AST: 5, TO: 5
TEAM FOULS: 9 [Team_027 in BONUS]

================================================================================

================================================================================
                               FULL GAME COMPLETE                               
================================================================================

FINAL SCORE: Team_027 102, Team_050 82

SCORING BY QUARTER:
--------------------------------------------------------------------------------
Team                     Q1     Q2     Q3     Q4    FINAL
--------------------------------------------------------------------------------
Team_027                 17     23     29     33      102
Team_050                 27     20     18     17       82
--------------------------------------------------------------------------------

FULL GAME BOX SCORE:
================================================================================

Team_027
--------------------------------------------------------------------------------
Player                MIN  PTS  REB  AST  TO      FG   FG%      3P   3P%      FT STL BLK
--------------------------------------------------------------------------------
Tony Doncic            31    9    5    2   3   3/7    42.9   3/5    60.0   0/0     0   0
Bradley Dosunmu        31   16   16    1   1   5/10   50.0   1/2    50.0   3/4     0   0
Tim Johnson            27   14    0    2   1   6/11   54.5   4/7    57.1   2/3     0   0
Scottie Harden         27    2    0    3   1   1/5    20.0   0/2     0.0   1/2     0   0
John Russell           27   15   14    1   3   6/8    75.0   1/1   100.0   6/6     2   0
CJ Green               21    8    0    1   2   3/7    42.9   2/5    40.0   2/3     1   0
Rudy Quickley          21   15    0    0   0   4/6    66.7   2/2   100.0   4/4     0   0
Ben Stewart            21    2    8    1   0   1/3    33.3   0/1     0.0   0/0     0   1
Dirk Lillard           18    7    4    3   1   3/6    50.0   1/4    25.0   2/2     0   0
LeBron Russell         18    9    4    2   0   5/6    83.3   0/0     0.0   3/3     0   0

TEAM: FG: 39/71 (54.9%), 3PT: 14/29 (48.3%), REB: 50 (11 off, 39 def), AST: 16, TO: 12


Team_050
--------------------------------------------------------------------------------
Player                MIN  PTS  REB  AST  TO      FG   FG%      3P   3P%      FT STL BLK
--------------------------------------------------------------------------------
Giannis LaVine         31   19    0    4   1   8/12   66.7   3/6    50.0   6/6     0   0
Joel Banchero          31    9    9    1   0   3/11   27.3   3/7    42.9   0/1     0   0
Collin Bane            31    6   12    1   0   3/5    60.0   0/1     0.0   2/3     0   0
LeBron Bridges         27   15    8    1   0   6/10   60.0   2/4    50.0   3/4     1   0
Donovan Trent          27    3    0    4   1   2/8    25.0   0/0     0.0   1/2     0   0
Luka Gasol             21    3    3    1   0   0/1     0.0   0/0     0.0   0/0     1   0
Tyler Smith            21    4    4    2   0   2/8    25.0   0/2     0.0   1/2     1   0
Damian O'Neal          18    5    0    0   4   2/5    40.0   1/3    33.3   0/0     0   0
Dwyane Towns           18   10    1    2   1   5/9    55.6   1/4    25.0   3/3     1   0
Larry Curry            18    3    7    2   2   2/3    66.7   0/0     0.0   1/2     0   0

TEAM: FG: 33/72 (45.8%), 3PT: 10/27 (37.0%), REB: 45 (13 off, 32 def), AST: 18, TO: 9

================================================================================
