================================================================================
                        FULL GAME - Team_082 vs Team_049                        
================================================================================

================================================================================
                       1ST QUARTER - Team_082 vs Team_049                       
================================================================================

[12:00] Team_082 possession (Score: 0-0)
Dwyane O'Neal loses the ball! Stripped by Ja Oladipo! TURNOVER! (live ball)

[11:49] Team_049 possession (Score: 0-0)
Ja Oladipo drives, Dwyane O'Neal stays with him. Ja Oladipo attempts a Layup. Contested by Dwyane O'Neal (3.5 feet, MAN). Ja Oladipo misses. Rebound secured by Dwyane O'Neal.

[11:39] Team_082 possession (Score: 0-0)
Julius Anthony drives and kicks out. FOUL! Shooting foul on Ja Oladipo. Kristaps Fox to the line for 3 free throws. [Team fouls: 1] (Ja Oladipo: 1 personal fouls)   FT 1/3: MISS   FT 2/3: GOOD   FT 3/3: GOOD Kristaps Fox makes 2/3 from the line.
Score: 2-0

[11:23] Team_049 possession (Score: 2-0)
Jimmy Griffin drives to the basket... Jimmy Griffin throws a bad pass out of bounds! TURNOVER! (dead ball)

[11:09] Team_082 possession (Score: 2-0)
Jrue Green makes the Dunk and draws the foul on Ja Oladipo! And-1! Jrue Green to the line for 1. [Team fouls: 2] (Ja Oladipo: 2 personal fouls)   FT 1/1: GOOD Jrue Green makes 1/1 from the line.
Score: 5-0

[10:53] Team_049 possession (Score: 5-0)
Ja Oladipo attempts a 3Pt. Contested by Dwyane O'Neal (3.5 feet, MAN). JA OLADIPO MAKES IT! Assist: De'Aaron Allen
Score: 5-3

[10:40] Team_082 possession (Score: 5-3)
FOUL! Holding foul on Shai Mobley. [Team fouls: 3] No free throws, side out. (Shai Mobley: 1 personal fouls)

[10:27] Team_082 possession (Score: 5-3)
Julius Carter drives to the basket... Julius Carter loses control! Ball rolls out of bounds! TURNOVER! (dead ball)

[10:10] Team_049 possession (Score: 5-3)
Ja Oladipo attempts a 3Pt. Contested by Dwyane O'Neal (3.5 feet, MAN). Ja Oladipo misses. Rebound secured by Julius Carter.

[09:58] Team_082 possession (Score: 5-3)
FOUL! Shooting foul on Shai Bird. Julius Anthony to the line for 2 free throws. [Team fouls: 4] (Shai Bird: 1 personal fouls)   FT 1/2: GOOD   FT 2/2: GOOD Julius Anthony makes 2/2 from the line.
Score: 7-3

[09:46] Team_049 possession (Score: 7-3)
Ja Oladipo attempts a 3Pt. Contested by Dwyane O'Neal (3.5 feet, ZONE). Ja Oladipo misses. Rebound secured by Dwyane O'Neal.

[09:29] Team_082 possession (Score: 7-3)
Julius Anthony attempts a 3Pt. Contested by Shai Bird (4.3 feet, MAN). Julius Anthony misses. Rebound secured by Jimmy Griffin.

[09:13] Team_049 possession (Score: 7-3)
Jimmy Griffin makes the Layup and draws the foul on Jrue Green! And-1! Jimmy Griffin to the line for 1. [Team fouls: 1] (Jrue Green: 1 personal fouls)   FT 1/1: GOOD Jimmy Griffin makes 1/1 from the line.
Score: 7-6

[08:56] Team_082 possession (Score: 7-6)
FOUL! Shooting foul on Ja Oladipo. Jrue Green to the line for 3 free throws. [BONUS: 5 team fouls] (Ja Oladipo: 3 personal fouls)   FT 1/3: GOOD   FT 2/3: GOOD   FT 3/3: GOOD Jrue Green makes 3/3 from the line.
Score: 10-6

[08:41] Team_049 possession (Score: 10-6)
De'Aaron Allen drives and kicks out. Shai Bird attempts a Midrange. Contested by Jrue Green (5.0 feet, ZONE). Shai Bird misses. Offensive rebound by Shai Mobley! Shai Mobley's putback is no good. Rebound secured by Jrue Green.

[08:29] Team_082 possession (Score: 10-6)
Dwyane O'Neal attempts a 3Pt. Contested by Ja Oladipo (4.3 feet, ZONE). Dwyane O'Neal misses. Rebound secured by Jimmy Griffin.

[08:15] Team_049 possession (Score: 10-6)
De'Aaron Allen makes the Dunk and draws the foul on Jrue Green! And-1! De'Aaron Allen to the line for 1. [Team fouls: 2] (Jrue Green: 2 personal fouls)   FT 1/1: GOOD De'Aaron Allen makes 1/1 from the line.
Score: 10-9

[08:04] Team_082 possession (Score: 10-9)
Dwyane O'Neal drives, De'Aaron Allen stays with him. Dwyane O'Neal attempts a Dunk. Contested by De'Aaron Allen (4.3 feet, ZONE). DWYANE O'NEAL MAKES IT! Assist: Julius Carter
Score: 12-9

[07:49] Team_049 possession (Score: 12-9)
Jimmy Griffin loses the ball! Stripped by Kristaps Fox! TURNOVER! (live ball)

[07:32] Team_082 possession (Score: 12-9)
Kristaps Fox attempts a Midrange. Contested by Jimmy Griffin (4.8 feet, MAN). KRISTAPS FOX MAKES IT!
Score: 14-9

[07:23] Team_049 possession (Score: 14-9)
FOUL! Offensive foul on Shai Mobley! Julius Carter drew the charge! [Team fouls: 6] (Shai Mobley: 2 personal fouls) TURNOVER! (dead ball)

[07:12] Team_082 possession (Score: 14-9)
Julius Anthony attempts a 3Pt. Contested by Ja Oladipo (4.6 feet, ZONE). Julius Anthony misses. FOUL! Loose ball foul on Shai Mobley during the rebound battle. [IN THE BONUS! 7 team fouls] Julius Carter to the line for 2 free throws. (Shai Mobley: 3 personal fouls)   FT 1/2: GOOD   FT 2/2: GOOD Julius Carter makes 2/2 from the line.
Score: 16-9

[06:53] Team_049 possession (Score: 16-9)
De'Aaron Allen attempts a Midrange. Contested by Jrue Green (4.9 feet, MAN). DE'AARON ALLEN MAKES IT! Assist: Ja Oladipo
Score: 16-11

[06:39] Team_082 possession (Score: 16-11)
Julius Carter attempts a Midrange. Contested by Ja Oladipo (4.6 feet, ZONE). JULIUS CARTER MAKES IT! Assist: Dwyane O'Neal
Score: 18-11

[06:26] Team_049 possession (Score: 18-11)
Jimmy Griffin drives, Jrue Green stays with him. Jimmy Griffin attempts a Layup. Contested by Jrue Green (5.1 feet, ZONE). JIMMY GRIFFIN MAKES IT! Assist: Shai Bird
Score: 18-13

[06:13] Team_082 possession (Score: 18-13)
FOUL! Reach-in foul on De'Aaron Allen during the drive. [IN THE BONUS! 8 team fouls] Julius Carter to the line for 2 free throws. (De'Aaron Allen: 1 personal fouls)   FT 1/2: GOOD   FT 2/2: GOOD Julius Carter makes 2/2 from the line.
Score: 20-13

[05:59] Team_049 possession (Score: 20-13)
Shai Mobley attempts a Layup. Wide open! Julius Carter is 6.1 feet away. [MAN] SHAI MOBLEY MAKES IT!
Score: 20-15

[05:45] Team_082 possession (Score: 20-15)
Julius Carter attempts a Midrange. Contested by De'Aaron Allen (4.7 feet, ZONE). Julius Carter misses. Rebound secured by Jimmy Griffin.

[05:33] Team_049 possession (Score: 20-15)
Jimmy Griffin attempts a 3Pt. Contested by Dwyane O'Neal (3.3 feet, ZONE). Jimmy Griffin misses. Rebound secured by Dwyane O'Neal.

[05:15] Team_082 possession (Score: 20-15)
Julius Anthony attempts a Midrange. Contested by Shai Bird (4.3 feet, MAN). JULIUS ANTHONY MAKES IT!
Score: 22-15

[05:01] Team_049 possession (Score: 22-15)
De'Aaron Allen loses control! Ball rolls out of bounds! TURNOVER! (dead ball)

[04:47] Team_082 possession (Score: 22-15)
Julius Carter drives, picks up De'Aaron Allen. Help arrives from Ja Oladipo! Julius Carter attempts a Layup. Contested by Ja Oladipo (4.7 feet, ZONE). JULIUS CARTER MAKES IT! Assist: Julius Anthony
Score: 24-15

[04:34] Team_049 possession (Score: 24-15)
Ja Oladipo attempts a 3Pt. Contested by Dwyane O'Neal (3.6 feet, MAN). Ja Oladipo misses. Rebound secured by Julius Carter.

[04:19] Team_082 possession (Score: 24-15)
Jrue Green attempts a Midrange. Contested by De'Aaron Allen (4.6 feet, MAN). Jrue Green misses. Rebound secured by Jimmy Griffin.

[04:05] Team_049 possession (Score: 24-15)
FOUL! Shooting foul on Kristaps Fox. Jimmy Griffin to the line for 2 free throws. [Team fouls: 3] (Kristaps Fox: 1 personal fouls)   FT 1/2: MISS   FT 2/2: GOOD Jimmy Griffin makes 1/2 from the line.
Score: 24-16

[03:53] Team_082 possession (Score: 24-16)
Kristaps Fox attempts a Midrange. Contested by Shai Bird (4.2 feet, ZONE). Kristaps Fox misses. Rebound secured by Shai Mobley.

[03:38] Team_049 possession (Score: 24-16)
Shai Mobley attempts a 3Pt. Wide open! Julius Carter is 6.2 feet away. [MAN] Shai Mobley misses. Rebound secured by Julius Carter.

[03:26] Team_082 possession (Score: 24-16)
Julius Carter drives and kicks out. Kristaps Fox attempts a 3Pt. Contested by Jimmy Griffin (4.9 feet, ZONE). Kristaps Fox misses. Rebound secured by Jimmy Griffin.

[03:13] Team_049 possession (Score: 24-16)
Ja Oladipo attempts a Midrange. Contested by Dwyane O'Neal (3.7 feet, MAN). JA OLADIPO MAKES IT! Assist: De'Aaron Allen
Score: 24-18

[02:59] Team_082 possession (Score: 24-18)
Jrue Green commits a violation (traveling/carry)! TURNOVER! (dead ball)

[02:59] Substitution (Team_082): Julius Anthony OUT → Jordan Rozier IN (stamina_rule2)

[02:59] Substitution (Team_082): Kristaps Fox OUT → Shaquille Griffin IN (stamina_rule2)

[02:59] Substitution (Team_082): Jrue Green OUT → Tony Jokic IN (stamina_rule2)

[02:59] Substitution (Team_082): Julius Carter OUT → D'Angelo Parker IN (stamina_rule2)

[02:59] Substitution (Team_049): Shai Bird OUT → Shaquille Lillard IN (stamina_rule2)

[02:59] Substitution (Team_049): Jimmy Griffin OUT → Desmond Towns IN (stamina_rule2)

[02:44] Team_049 possession (Score: 24-18)
Shai Mobley drives and kicks out. Shaquille Lillard attempts a Midrange. Contested by Shaquille Griffin (4.6 feet, ZONE). SHAQUILLE LILLARD MAKES IT! Assist: De'Aaron Allen
Score: 24-20

[02:28] Team_082 possession (Score: 24-20)
Dwyane O'Neal attempts a 3Pt. Contested by Ja Oladipo (4.6 feet, MAN). Dwyane O'Neal misses. Rebound secured by Shai Mobley.

[02:14] Team_049 possession (Score: 24-20)
Shaquille Lillard attempts a Layup. Contested by D'Angelo Parker (5.2 feet, ZONE). SHAQUILLE LILLARD MAKES IT! Assist: De'Aaron Allen
Score: 24-22

[02:01] Team_082 possession (Score: 24-22)
Tony Jokic loses control! Ball rolls out of bounds! TURNOVER! (dead ball)

[02:01] Substitution (Team_082): Dwyane O'Neal OUT → Kawhi Poole IN (stamina_rule2)

[02:01] Substitution (Team_049): Ja Oladipo OUT → Shai Jordan IN (stamina_rule2)

[02:01] Substitution (Team_049): De'Aaron Allen OUT → Giannis Anunoby IN (stamina_rule2)

[02:01] Substitution (Team_049): Shai Mobley OUT → Miles Jackson IN (stamina_rule2)

[01:49] Team_049 possession (Score: 24-22)
Miles Jackson makes the Layup and draws the foul on D'Angelo Parker! And-1! Miles Jackson to the line for 1. [Team fouls: 4] (D'Angelo Parker: 1 personal fouls)   FT 1/1: GOOD Miles Jackson makes 1/1 from the line.
Score: 24-25

[01:31] Team_082 possession (Score: 24-25)
Jordan Rozier drives, Miles Jackson stays with him. Jordan Rozier attempts a Layup. Contested by Miles Jackson (3.6 feet, ZONE). JORDAN ROZIER MAKES IT! Assist: Shaquille Griffin
Score: 26-25

[01:20] Team_049 possession (Score: 26-25)
Desmond Towns attempts a 3Pt. Contested by Shaquille Griffin (4.8 feet, MAN). Desmond Towns misses. Offensive rebound by Giannis Anunoby! Giannis Anunoby kicks it out.

[01:08] Team_049 possession (Score: 26-25)
Shai Jordan drives and kicks out. Desmond Towns attempts a 3Pt. Contested by Kawhi Poole (5.4 feet, ZONE). Desmond Towns misses. Rebound secured by Tony Jokic.

[00:57] Team_082 possession (Score: 26-25)
Tony Jokic attempts a Midrange. Contested by Giannis Anunoby (4.3 feet, MAN). Tony Jokic misses. Rebound secured by Giannis Anunoby.

[00:42] Team_049 possession (Score: 26-25)
Desmond Towns attempts a Midrange. Wide open! Jordan Rozier is 6.1 feet away. [ZONE] Desmond Towns misses. Rebound secured by Tony Jokic.

[00:26] Team_082 possession (Score: 26-25)
Shaquille Griffin attempts a 3Pt. Contested by Shaquille Lillard (4.5 feet, ZONE). Shaquille Griffin misses. Rebound secured by Miles Jackson.

[00:09] Team_049 possession (Score: 26-25)
Miles Jackson makes the Layup and draws the foul on D'Angelo Parker! And-1! Miles Jackson to the line for 1. [BONUS: 5 team fouls] (D'Angelo Parker: 2 personal fouls)   FT 1/1: GOOD Miles Jackson makes 1/1 from the line.
Score: 26-28

================================================================================
                              1ST QUARTER COMPLETE                              
================================================================================

1ST QUARTER SCORE: Team_082 26, Team_049 28

BOX SCORE:
================================================================================

Team_082
--------------------------------------------------------------------------------
Player                MIN  PTS  REB  AST  TO      FG   FG%      3P   3P%
--------------------------------------------------------------------------------
Julius Carter           9    8    3    1   0   4/6    66.7     0/0   0.0
Jrue Green              9    6    1    0   0   2/3    66.7     0/0   0.0
Kristaps Fox            9    4    0    0   0   2/3    66.7     0/0   0.0
Julius Anthony          9    4    0    1   0   2/3    66.7     0/0   0.0
Dwyane O'Neal          10    2    3    1   0   1/3    33.3     0/0   0.0
Jordan Rozier           3    2    0    0   0   1/1   100.0     0/0   0.0
Shaquille Griffin       3    0    0    1   0   0/1     0.0     0/0   0.0
Tony Jokic              3    0    2    0   0   0/1     0.0     0/0   0.0

TEAM: FG: 12/21 (57.1%), 3PT: 2/6 (33.3%), REB: 8 (0 off, 8 def), AST: 4, TO: 4
TEAM FOULS: 5 [Team_049 in BONUS]


Team_049
--------------------------------------------------------------------------------
Player                MIN  PTS  REB  AST  TO      FG   FG%      3P   3P%
--------------------------------------------------------------------------------
Jimmy Griffin           9    6    5    0   0   3/4    75.0     0/0   0.0
Miles Jackson           2    6    1    0   0   2/2   100.0     0/0   0.0
Ja Oladipo             10    5    0    1   0   2/6    33.3     0/0   0.0
De'Aaron Allen         10    5    0    4   0   2/3    66.7     0/0   0.0
Shaquille Lillard       3    4    0    0   0   2/2   100.0     0/0   0.0
Shai Mobley            10    2    2    0   0   1/2    50.0     0/0   0.0
Shai Bird               9    0    0    1   0   0/0     0.0     0/0   0.0
Giannis Anunoby         2    0    2    0   0   0/0     0.0     0/0   0.0
Shai Jordan             2    0    0    0   0   0/1     0.0     0/0   0.0
Desmond Towns           3    0    0    0   0   0/1     0.0     0/0   0.0

TEAM: FG: 12/21 (57.1%), 3PT: 1/6 (16.7%), REB: 11 (2 off, 9 def), AST: 6, TO: 4
TEAM FOULS: 8 [Team_082 in BONUS]

================================================================================

================================================================================
                       2ND QUARTER - Team_082 vs Team_049                       
================================================================================

[12:00] Team_082 possession (Score: 26-28)
Kristaps Fox attempts a 3Pt. Contested by Jimmy Griffin (4.8 feet, MAN). Kristaps Fox misses. Rebound secured by Shai Mobley.

[11:43] Team_049 possession (Score: 26-28)
Ja Oladipo attempts a Layup. Contested by Dwyane O'Neal (3.6 feet, MAN). JA OLADIPO MAKES IT!
Score: 26-30

[11:28] Team_082 possession (Score: 26-30)
Dwyane O'Neal attempts a 3Pt. Contested by Ja Oladipo (4.4 feet, ZONE). Dwyane O'Neal misses. Offensive rebound by Julius Carter! Julius Carter kicks it out.

[11:13] Team_082 possession (Score: 26-30)
Kristaps Fox attempts a 3Pt. Contested by Ja Oladipo (4.5 feet, ZONE). Kristaps Fox misses. Rebound secured by Shai Mobley.

[11:00] Team_049 possession (Score: 26-30)
Jimmy Griffin drives and kicks out. Jimmy Griffin attempts a Midrange. Contested by Kristaps Fox (4.3 feet, MAN). Jimmy Griffin misses. Offensive rebound by Jimmy Griffin! Jimmy Griffin kicks it out.

[10:41] Team_049 possession (Score: 26-30)
Shai Mobley drives to the basket... Shai Mobley throws a bad pass! Stolen by Jrue Green! TURNOVER! (live ball)

[10:27] Team_082 possession (Score: 26-30)
Kristaps Fox attempts a 3Pt. Contested by Jimmy Griffin (4.9 feet, MAN). Kristaps Fox misses. Rebound secured by Shai Mobley.

[10:15] Team_049 possession (Score: 26-30)
Shai Bird attempts a 3Pt. Contested by Julius Anthony (5.0 feet, MAN). SHAI BIRD MAKES IT! Assist: Jimmy Griffin
Score: 26-33

[10:02] Team_082 possession (Score: 26-33)
Kristaps Fox attempts a 3Pt. Contested by Ja Oladipo (4.6 feet, ZONE). Kristaps Fox misses. Rebound secured by De'Aaron Allen.

[09:50] Team_049 possession (Score: 26-33)
Ja Oladipo attempts a Midrange. Contested by Kristaps Fox (4.6 feet, ZONE). JA OLADIPO MAKES IT!
Score: 26-35

[09:33] Team_082 possession (Score: 26-35)
Jrue Green attempts a 3Pt. Contested by Jimmy Griffin (5.1 feet, ZONE). JRUE GREEN MAKES IT! Assist: Kristaps Fox
Score: 29-35

[09:19] Team_049 possession (Score: 29-35)
De'Aaron Allen drives and kicks out. Ja Oladipo attempts a 3Pt. Contested by Dwyane O'Neal (3.6 feet, ZONE). Ja Oladipo misses. Rebound secured by Dwyane O'Neal.

[09:04] Team_082 possession (Score: 29-35)
Kristaps Fox drives, De'Aaron Allen stays with him. Kristaps Fox attempts a Layup. Contested by De'Aaron Allen (4.7 feet, ZONE). Kristaps Fox misses. Rebound secured by De'Aaron Allen.

[08:52] Team_049 possession (Score: 29-35)
Shai Bird attempts a 3Pt. Contested by Julius Anthony (5.1 feet, MAN). Shai Bird misses. Rebound secured by Jrue Green.

[08:33] Team_082 possession (Score: 29-35)
Kristaps Fox attempts a 3Pt. Contested by Jimmy Griffin (5.0 feet, MAN). Kristaps Fox misses. Offensive rebound by Jrue Green! Jrue Green kicks it out.

[08:19] Team_082 possession (Score: 29-35)
Jrue Green makes the Dunk and draws the foul on Ja Oladipo! And-1! Jrue Green to the line for 1. [Team fouls: 1] (Ja Oladipo: 1 personal fouls)   FT 1/1: GOOD Jrue Green makes 1/1 from the line.
Score: 32-35

[08:05] Team_049 possession (Score: 32-35)
Shai Bird attempts a 3Pt. Contested by Dwyane O'Neal (4.2 feet, ZONE). Shai Bird misses. Rebound secured by Jrue Green.

[07:49] Team_082 possession (Score: 32-35)
Julius Anthony attempts a 3Pt. Contested by Shai Bird (4.7 feet, MAN). Julius Anthony misses. Offensive rebound by Jrue Green! Jrue Green kicks it out.

[07:32] Team_082 possession (Score: 32-35)
Julius Anthony attempts a Layup. BLOCKED BY DE'AARON ALLEN! Ball goes out off De'Aaron Allen. Julius Anthony's ball!

[07:17] Team_082 possession (Score: 32-35)
Kristaps Fox attempts a 3Pt. Contested by Ja Oladipo (4.9 feet, ZONE). Kristaps Fox misses. Offensive rebound by Julius Carter! Julius Carter kicks it out.

[07:00] Team_082 possession (Score: 32-35)
Julius Anthony attempts a Layup. Contested by De'Aaron Allen (5.1 feet, ZONE). JULIUS ANTHONY MAKES IT!
Score: 34-35

[06:49] Team_049 possession (Score: 34-35)
Shai Bird attempts a Midrange. Contested by Kristaps Fox (5.1 feet, ZONE). Shai Bird misses. Rebound secured by Dwyane O'Neal.

[06:32] Team_082 possession (Score: 34-35)
Julius Anthony attempts a Layup. BLOCKED BY SHAI BIRD! Ball deflects out of bounds off Julius Anthony.

[06:18] Team_049 possession (Score: 34-35)
Shai Bird attempts a 3Pt. Contested by Dwyane O'Neal (4.4 feet, ZONE). SHAI BIRD MAKES IT!
Score: 34-38

[06:00] Team_082 possession (Score: 34-38)
Dwyane O'Neal drives, Ja Oladipo stays with him. Dwyane O'Neal attempts a Layup. Contested by Ja Oladipo (4.9 feet, MAN). Dwyane O'Neal misses. Rebound secured by De'Aaron Allen.

[05:45] Team_049 possession (Score: 34-38)
De'Aaron Allen attempts a Midrange. Contested by Jrue Green (5.5 feet, MAN). DE'AARON ALLEN MAKES IT!
Score: 34-40

[05:29] Team_082 possession (Score: 34-40)
Julius Anthony attempts a 3Pt. Contested by Shai Bird (4.9 feet, MAN). Julius Anthony misses. Rebound secured by Shai Mobley.

[05:12] Team_049 possession (Score: 34-40)
Jimmy Griffin attempts a 3Pt. Contested by Dwyane O'Neal (4.2 feet, ZONE). Jimmy Griffin misses. Rebound secured by Julius Carter.

[05:00] Team_082 possession (Score: 34-40)
Jrue Green attempts a 3Pt. Contested by Ja Oladipo (5.3 feet, ZONE). Jrue Green misses. Rebound secured by Jimmy Griffin.

[04:47] Team_049 possession (Score: 34-40)
Shai Bird attempts a 3Pt. Contested by Julius Anthony (5.5 feet, MAN). Shai Bird misses. Rebound secured by Dwyane O'Neal.

[04:31] Team_082 possession (Score: 34-40)
Kristaps Fox attempts a 3Pt. Contested by Jimmy Griffin (5.4 feet, ZONE). Kristaps Fox misses. Rebound secured by De'Aaron Allen.

[04:20] Team_049 possession (Score: 34-40)
Jimmy Griffin attempts a 3Pt. Contested by Kristaps Fox (5.0 feet, MAN). JIMMY GRIFFIN MAKES IT! Assist: De'Aaron Allen
Score: 34-43

[04:06] Team_082 possession (Score: 34-43)
Kristaps Fox attempts a Midrange. Contested by Jimmy Griffin (5.5 feet, MAN). Kristaps Fox misses. Rebound secured by Jimmy Griffin.

[03:51] Team_049 possession (Score: 34-43)
De'Aaron Allen makes the Midrange and draws the foul on Jrue Green! And-1! De'Aaron Allen to the line for 1. [Team fouls: 1] (Jrue Green: 1 personal fouls)   FT 1/1: GOOD De'Aaron Allen makes 1/1 from the line.
Score: 34-46

[03:38] Team_082 possession (Score: 34-46)
Jrue Green makes the Midrange and draws the foul on De'Aaron Allen! And-1! Jrue Green to the line for 1. [Team fouls: 2] (De'Aaron Allen: 1 personal fouls)   FT 1/1: GOOD Jrue Green makes 1/1 from the line.
Score: 37-46

[03:23] Team_049 possession (Score: 37-46)
Ja Oladipo drives, Jrue Green stays with him. Ja Oladipo attempts a Layup. Wide open! Jrue Green is 6.1 feet away. [ZONE] JA OLADIPO MAKES IT!
Score: 37-48

[03:09] Team_082 possession (Score: 37-48)
Dwyane O'Neal throws a bad pass! Stolen by Ja Oladipo! TURNOVER! (live ball)

[02:53] Team_049 possession (Score: 37-48)
Ja Oladipo drives to the basket... Ja Oladipo commits a violation (traveling/carry)! TURNOVER! (dead ball)

[02:53] Substitution (Team_082): Julius Anthony OUT → Jordan Rozier IN (stamina_rule2)

[02:53] Substitution (Team_082): Dwyane O'Neal OUT → Kawhi Poole IN (stamina_rule2)

[02:53] Substitution (Team_082): Kristaps Fox OUT → Shaquille Griffin IN (stamina_rule2)

[02:53] Substitution (Team_082): Jrue Green OUT → Tony Jokic IN (stamina_rule2)

[02:53] Substitution (Team_082): Julius Carter OUT → D'Angelo Parker IN (stamina_rule2)

[02:53] Substitution (Team_049): Shai Bird OUT → Shaquille Lillard IN (stamina_rule2)

[02:53] Substitution (Team_049): Ja Oladipo OUT → Shai Jordan IN (stamina_rule2)

[02:53] Substitution (Team_049): Jimmy Griffin OUT → Desmond Towns IN (stamina_rule2)

[02:53] Substitution (Team_049): De'Aaron Allen OUT → Giannis Anunoby IN (stamina_rule2)

[02:53] Substitution (Team_049): Shai Mobley OUT → Miles Jackson IN (stamina_rule2)

[02:38] Team_082 possession (Score: 37-48)
Tony Jokic attempts a Layup. Contested by Giannis Anunoby (4.3 feet, MAN). TONY JOKIC MAKES IT!
Score: 39-48

[02:23] Team_049 possession (Score: 39-48)
Giannis Anunoby attempts a Layup. Contested by D'Angelo Parker (5.0 feet, ZONE). GIANNIS ANUNOBY MAKES IT! Assist: Shai Jordan
Score: 39-50

[02:08] Team_082 possession (Score: 39-50)
Kawhi Poole attempts a 3Pt. Contested by Shaquille Lillard (5.1 feet, ZONE). KAWHI POOLE MAKES IT! Assist: D'Angelo Parker
Score: 42-50

[01:57] Team_049 possession (Score: 42-50)
Giannis Anunoby attempts a Midrange. Contested by Tony Jokic (5.1 feet, MAN). Giannis Anunoby misses. Rebound secured by Tony Jokic.

[01:43] Team_082 possession (Score: 42-50)
Kawhi Poole attempts a Layup. Wide open! Shai Jordan is 6.7 feet away. [MAN] KAWHI POOLE MAKES IT!
Score: 44-50

[01:29] Team_049 possession (Score: 44-50)
Shaquille Lillard attempts a 3Pt. Contested by Kawhi Poole (5.6 feet, ZONE). SHAQUILLE LILLARD MAKES IT! Assist: Desmond Towns
Score: 44-53

[01:17] Team_082 possession (Score: 44-53)
Kawhi Poole attempts a Layup. Contested by Giannis Anunoby (5.2 feet, ZONE). Kawhi Poole misses. Rebound secured by Miles Jackson.

[01:02] Team_049 possession (Score: 44-53)
Shai Jordan attempts a 3Pt. Contested by Kawhi Poole (5.5 feet, MAN). Shai Jordan misses. FOUL! Loose ball foul on Shaquille Griffin during the rebound battle. [Team fouls: 2] No free throws, side out. (Shaquille Griffin: 1 personal fouls)

[00:43] Team_049 possession (Score: 44-53)
Miles Jackson throws a bad pass! Stolen by D'Angelo Parker! TURNOVER! (live ball)

[00:30] Team_082 possession (Score: 44-53)
Jordan Rozier attempts a 3Pt. Contested by Shaquille Lillard (4.7 feet, ZONE). JORDAN ROZIER MAKES IT! Assist: Shaquille Griffin
Score: 47-53

[00:15] Team_049 possession (Score: 47-53)
Shaquille Lillard attempts a Layup. Contested by D'Angelo Parker (5.2 feet, ZONE). SHAQUILLE LILLARD MAKES IT!
Score: 47-55

[00:03] Team_082 possession (Score: 47-55)
D'Angelo Parker loses the ball! Stripped by Miles Jackson! TURNOVER! (live ball)

================================================================================
                              2ND QUARTER COMPLETE                              
================================================================================

2ND QUARTER SCORE: Team_082 21, Team_049 27

BOX SCORE:
================================================================================

Team_082
--------------------------------------------------------------------------------
Player                MIN  PTS  REB  AST  TO      FG   FG%      3P   3P%
--------------------------------------------------------------------------------
Jrue Green             19    9    4    0   0   3/4    75.0     0/0   0.0
Kawhi Poole             5    5    0    0   0   2/3    66.7     0/0   0.0
Jordan Rozier           6    3    0    0   0   1/1   100.0     0/0   0.0
Julius Anthony         19    2    0    0   0   1/3    33.3     0/0   0.0
Tony Jokic              6    2    1    0   0   1/1   100.0     0/0   0.0
Kristaps Fox           19    0    0    1   0   0/7     0.0     0/0   0.0
Julius Carter          19    0    3    0   0   0/0     0.0     0/0   0.0
Dwyane O'Neal          20    0    3    0   0   0/1     0.0     0/0   0.0
D'Angelo Parker         6    0    0    1   0   0/0     0.0     0/0   0.0
Shaquille Griffin       6    0    0    1   0   0/0     0.0     0/0   0.0

TEAM: FG: 8/20 (40.0%), 3PT: 3/10 (30.0%), REB: 11 (4 off, 7 def), AST: 3, TO: 2
TEAM FOULS: 2


Team_049
--------------------------------------------------------------------------------
Player                MIN  PTS  REB  AST  TO      FG   FG%      3P   3P%
--------------------------------------------------------------------------------
Ja Oladipo             20    6    0    0   0   3/3   100.0     0/0   0.0
Shai Bird              19    6    0    0   0   2/6    33.3     0/0   0.0
De'Aaron Allen         20    5    4    1   0   2/3    66.7     0/0   0.0
Shaquille Lillard       6    5    0    0   0   2/2   100.0     0/0   0.0
Jimmy Griffin          19    3    3    1   0   1/2    50.0     0/0   0.0
Giannis Anunoby         5    2    1    0   0   1/2    50.0     0/0   0.0
Shai Mobley            20    0    4    0   0   0/0     0.0     0/0   0.0
Shai Jordan             5    0    0    1   0   0/0     0.0     0/0   0.0
Desmond Towns           6    0    0    1   0   0/0     0.0     0/0   0.0
Miles Jackson           5    0    1    0   0   0/0     0.0     0/0   0.0

TEAM: FG: 11/18 (61.1%), 3PT: 4/8 (50.0%), REB: 13 (2 off, 11 def), AST: 4, TO: 3
TEAM FOULS: 2

================================================================================

================================================================================
                       3RD QUARTER - Team_082 vs Team_049                       
================================================================================

[12:00] Team_082 possession (Score: 47-55)
Jrue Green attempts a 3Pt. Contested by De'Aaron Allen (4.6 feet, MAN). Jrue Green misses. Rebound secured by Jimmy Griffin.

[11:41] Team_049 possession (Score: 47-55)
Shai Mobley drives and kicks out. Shai Mobley attempts a 3Pt. Contested by Julius Carter (5.8 feet, MAN). Shai Mobley misses. Offensive rebound by Shai Mobley! Shai Mobley puts it back in!
Score: 47-57

[11:23] Team_082 possession (Score: 47-57)
FOUL! Shooting foul on Shai Bird. Julius Anthony to the line for 2 free throws. [Team fouls: 1] (Shai Bird: 1 personal fouls)   FT 1/2: GOOD   FT 2/2: MISS Julius Anthony makes 1/2 from the line. Rebound secured by Shai Mobley.
Score: 48-57

[11:09] Team_049 possession (Score: 48-57)
Shai Mobley commits a violation (traveling/carry)! TURNOVER! (dead ball)

[10:51] Team_082 possession (Score: 48-57)
FOUL! Shooting foul on Jimmy Griffin. Kristaps Fox to the line for 3 free throws. [Team fouls: 2] (Jimmy Griffin: 1 personal fouls)   FT 1/3: GOOD   FT 2/3: GOOD   FT 3/3: GOOD Kristaps Fox makes 3/3 from the line.
Score: 51-57

[10:39] Team_049 possession (Score: 51-57)
Shai Mobley attempts a Layup. Wide open! Julius Carter is 6.1 feet away. [MAN] Shai Mobley misses. Rebound secured by Jrue Green.

[10:23] Team_082 possession (Score: 51-57)
Dwyane O'Neal drives, Shai Mobley stays with him. Dwyane O'Neal attempts a Layup. Contested by Shai Mobley (4.3 feet, ZONE). Dwyane O'Neal misses. Rebound secured by De'Aaron Allen.

[10:09] Team_049 possession (Score: 51-57)
Ja Oladipo attempts a 3Pt. Contested by Dwyane O'Neal (3.5 feet, ZONE). JA OLADIPO MAKES IT!
Score: 51-60

[09:53] Team_082 possession (Score: 51-60)
Kristaps Fox throws a bad pass! Stolen by Jimmy Griffin! TURNOVER! (live ball)

[09:40] Team_049 possession (Score: 51-60)
De'Aaron Allen attempts a 3Pt. Contested by Jrue Green (4.9 feet, MAN). De'Aaron Allen misses. Rebound secured by Jrue Green.

[09:22] Team_082 possession (Score: 51-60)
Julius Anthony attempts a Layup. BLOCKED BY DE'AARON ALLEN! Ball is loose! Offensive rebound by Jrue Green! Jrue Green kicks it out.

[09:07] Team_082 possession (Score: 51-60)
Julius Carter drives to the basket... FOUL! Offensive foul on Julius Carter! De'Aaron Allen drew the charge! [Team fouls: 1] (Julius Carter: 1 personal fouls) TURNOVER! (dead ball)

[08:52] Team_049 possession (Score: 51-60)
De'Aaron Allen drives, Jrue Green stays with him. De'Aaron Allen attempts a Dunk. Contested by Jrue Green (4.9 feet, MAN). DE'AARON ALLEN MAKES IT!
Score: 51-62

[08:41] Team_082 possession (Score: 51-62)
FOUL! Shooting foul on Jimmy Griffin. Kristaps Fox to the line for 2 free throws. [Team fouls: 3] (Jimmy Griffin: 2 personal fouls)   FT 1/2: GOOD   FT 2/2: GOOD Kristaps Fox makes 2/2 from the line.
Score: 53-62

[08:28] Team_049 possession (Score: 53-62)
Ja Oladipo drives to the basket... Ja Oladipo loses control! Ball rolls out of bounds! TURNOVER! (dead ball)

[08:13] Team_082 possession (Score: 53-62)
Kristaps Fox drives to the basket... Kristaps Fox loses control! Ball rolls out of bounds! TURNOVER! (dead ball)

[07:58] Team_049 possession (Score: 53-62)
Shai Bird attempts a Midrange. Contested by Julius Anthony (4.9 feet, MAN). Shai Bird misses. Offensive rebound by Shai Mobley! Shai Mobley puts it back in!
Score: 53-64

[07:39] Team_082 possession (Score: 53-64)
Dwyane O'Neal attempts a Layup. BLOCKED BY JA OLADIPO! Ball deflects out of bounds off Dwyane O'Neal.

[07:23] Team_049 possession (Score: 53-64)
De'Aaron Allen attempts a 3Pt. Contested by Dwyane O'Neal (3.1 feet, ZONE). De'Aaron Allen misses. Offensive rebound by Shai Mobley! Shai Mobley puts it back in!
Score: 53-66

[07:09] Team_082 possession (Score: 53-66)
Kristaps Fox attempts a 3Pt. Contested by Jimmy Griffin (4.8 feet, MAN). Kristaps Fox misses. Rebound secured by Shai Mobley.

[06:49] Team_049 possession (Score: 53-66)
Shai Mobley drives and kicks out. Shai Mobley attempts a Midrange. Contested by Dwyane O'Neal (3.3 feet, ZONE). Shai Mobley misses. Rebound secured by Jrue Green.

[06:34] Team_082 possession (Score: 53-66)
FOUL! Reach-in foul on De'Aaron Allen during the drive. [Team fouls: 4] No free throws, side out. (De'Aaron Allen: 1 personal fouls)

[06:19] Team_082 possession (Score: 53-66)
FOUL! Shooting foul on Shai Mobley. Julius Carter to the line for 2 free throws. [BONUS: 5 team fouls] (Shai Mobley: 1 personal fouls)   FT 1/2: GOOD   FT 2/2: MISS Julius Carter makes 1/2 from the line. Rebound secured by Shai Mobley.
Score: 54-66

[06:03] Team_049 possession (Score: 54-66)
FOUL! Shooting foul on Jrue Green. De'Aaron Allen to the line for 2 free throws. [Team fouls: 2] (Jrue Green: 1 personal fouls)   FT 1/2: GOOD   FT 2/2: GOOD De'Aaron Allen makes 2/2 from the line.
Score: 54-68

[05:49] Team_082 possession (Score: 54-68)
Jrue Green attempts a 3Pt. Contested by De'Aaron Allen (4.6 feet, MAN). JRUE GREEN MAKES IT! Assist: Julius Carter
Score: 57-68

[05:32] Team_049 possession (Score: 57-68)
De'Aaron Allen attempts a 3Pt. Contested by Jrue Green (4.9 feet, MAN). DE'AARON ALLEN MAKES IT! Assist: Shai Mobley
Score: 57-71

[05:19] Team_082 possession (Score: 57-71)
Jrue Green drives, De'Aaron Allen stays with him. Jrue Green attempts a Dunk. Contested by De'Aaron Allen (4.6 feet, MAN). JRUE GREEN MAKES IT! Assist: Julius Carter
Score: 59-71

[05:03] Team_049 possession (Score: 59-71)
Shai Mobley attempts a 3Pt. Contested by Julius Anthony (4.8 feet, ZONE). Shai Mobley misses. Rebound secured by Julius Carter.

[04:45] Team_082 possession (Score: 59-71)
Julius Anthony attempts a 3Pt. Contested by Ja Oladipo (4.6 feet, ZONE). Julius Anthony misses. Rebound secured by Shai Mobley.

[04:31] Team_049 possession (Score: 59-71)
Shai Bird attempts a Layup. BLOCKED BY JULIUS ANTHONY! Ball deflects out of bounds off Shai Bird.

[04:17] Team_082 possession (Score: 59-71)
Dwyane O'Neal loses control! Ball rolls out of bounds! TURNOVER! (dead ball)

[04:05] Team_049 possession (Score: 59-71)
Ja Oladipo attempts a 3Pt. Contested by Dwyane O'Neal (3.6 feet, MAN). Ja Oladipo misses. Rebound secured by Julius Carter.

[03:53] Team_082 possession (Score: 59-71)
Dwyane O'Neal attempts a Midrange. Contested by Ja Oladipo (4.4 feet, MAN). Dwyane O'Neal misses. Offensive rebound by Julius Carter! Julius Carter kicks it out.

[03:34] Team_082 possession (Score: 59-71)
Kristaps Fox makes the Layup and draws the foul on Ja Oladipo! And-1! Kristaps Fox to the line for 1. [BONUS: 6 team fouls] (Ja Oladipo: 1 personal fouls)   FT 1/1: MISS Kristaps Fox makes 0/1 from the line. Rebound secured by Shai Mobley.
Score: 61-71

[03:21] Team_049 possession (Score: 61-71)
De'Aaron Allen attempts a 3Pt. Contested by Dwyane O'Neal (3.2 feet, ZONE). De'Aaron Allen misses. Rebound secured by Julius Carter.

[03:08] Team_082 possession (Score: 61-71)
Julius Anthony makes the Dunk and draws the foul on Jimmy Griffin! And-1! Julius Anthony to the line for 1. [BONUS: 7 team fouls] (Jimmy Griffin: 3 personal fouls)   FT 1/1: GOOD Julius Anthony makes 1/1 from the line.
Score: 64-71

[02:57] Team_049 possession (Score: 64-71)
Shai Bird drives, picks up Julius Anthony. Help arrives from Dwyane O'Neal! Shai Bird attempts a Dunk. Contested by Dwyane O'Neal (5.1 feet, MAN). SHAI BIRD MAKES IT!
Score: 64-73

[02:42] Team_082 possession (Score: 64-73)
FOUL! Shooting foul on Jimmy Griffin. Kristaps Fox to the line for 2 free throws. [BONUS: 8 team fouls] (Jimmy Griffin: 4 personal fouls)   FT 1/2: GOOD   FT 2/2: GOOD Kristaps Fox makes 2/2 from the line.
Score: 66-73

[02:25] Team_049 possession (Score: 66-73)
Shai Bird attempts a Layup. Contested by Jrue Green (5.7 feet, ZONE). SHAI BIRD MAKES IT!
Score: 66-75

[02:07] Team_082 possession (Score: 66-75)
Julius Anthony attempts a 3Pt. Contested by Ja Oladipo (4.8 feet, ZONE). JULIUS ANTHONY MAKES IT! Assist: Dwyane O'Neal
Score: 69-75

[01:51] Team_049 possession (Score: 69-75)
FOUL! Holding foul on Jrue Green. [Team fouls: 3] No free throws, side out. (Jrue Green: 2 personal fouls)

[01:40] Team_049 possession (Score: 69-75)
Ja Oladipo attempts a 3Pt. Contested by Dwyane O'Neal (3.8 feet, ZONE). Ja Oladipo misses. Rebound secured by Jrue Green.

[01:26] Team_082 possession (Score: 69-75)
Jrue Green throws a bad pass! Stolen by De'Aaron Allen! TURNOVER! (live ball)

[01:13] Team_049 possession (Score: 69-75)
Ja Oladipo loses control! Ball rolls out of bounds! TURNOVER! (dead ball)

[01:13] Substitution (Team_082): Julius Anthony OUT → Jordan Rozier IN (stamina_rule2)

[01:13] Substitution (Team_082): Dwyane O'Neal OUT → Kawhi Poole IN (stamina_rule2)

[01:13] Substitution (Team_082): Kristaps Fox OUT → Shaquille Griffin IN (stamina_rule2)

[01:13] Substitution (Team_082): Jrue Green OUT → Tony Jokic IN (stamina_rule2)

[01:13] Substitution (Team_082): Julius Carter OUT → D'Angelo Parker IN (stamina_rule2)

[01:13] Substitution (Team_049): Shai Bird OUT → Shaquille Lillard IN (stamina_rule2)

[01:13] Substitution (Team_049): Ja Oladipo OUT → Shai Jordan IN (stamina_rule2)

[01:13] Substitution (Team_049): Jimmy Griffin OUT → Desmond Towns IN (stamina_rule2)

[01:13] Substitution (Team_049): De'Aaron Allen OUT → Giannis Anunoby IN (stamina_rule2)

[01:13] Substitution (Team_049): Shai Mobley OUT → Miles Jackson IN (stamina_rule2)

[00:59] Team_082 possession (Score: 69-75)
Tony Jokic attempts a Layup. BLOCKED BY MILES JACKSON! Ball is loose! Offensive rebound by Shaquille Griffin! Shaquille Griffin kicks it out.

[00:39] Team_082 possession (Score: 69-75)
D'Angelo Parker throws a bad pass! Stolen by Miles Jackson! TURNOVER! (live ball)

[00:22] Team_049 possession (Score: 69-75)
Miles Jackson drives and kicks out. Miles Jackson attempts a 3Pt. Contested by Kawhi Poole (5.4 feet, ZONE). Miles Jackson misses. Rebound secured by D'Angelo Parker.

[00:09] Team_082 possession (Score: 69-75)
D'Angelo Parker attempts a Layup. Contested by Miles Jackson (3.9 feet, ZONE). D'Angelo Parker misses. Rebound secured by Miles Jackson.

================================================================================
                              3RD QUARTER COMPLETE                              
================================================================================

3RD QUARTER SCORE: Team_082 22, Team_049 20

BOX SCORE:
================================================================================

Team_082
--------------------------------------------------------------------------------
Player                MIN  PTS  REB  AST  TO      FG   FG%      3P   3P%
--------------------------------------------------------------------------------
Kristaps Fox           30    7    0    0   0   3/5    60.0     0/0   0.0
Julius Anthony         30    6    0    0   0   2/4    50.0     0/0   0.0
Jrue Green             30    5    5    0   0   2/3    66.7     0/0   0.0
Dwyane O'Neal          31    0    0    1   0   0/2     0.0     0/0   0.0
Julius Carter          30    0    4    2   0   0/1     0.0     0/0   0.0
Shaquille Griffin       7    0    1    0   0   0/0     0.0     0/0   0.0
D'Angelo Parker         7    0    1    0   0   0/1     0.0     0/0   0.0

TEAM: FG: 7/16 (43.8%), 3PT: 3/6 (50.0%), REB: 11 (3 off, 8 def), AST: 3, TO: 6
TEAM FOULS: 3


Team_049
--------------------------------------------------------------------------------
Player                MIN  PTS  REB  AST  TO      FG   FG%      3P   3P%
--------------------------------------------------------------------------------
De'Aaron Allen         31    7    1    0   0   3/5    60.0     0/0   0.0
Shai Mobley            31    6    8    1   0   3/6    50.0     0/0   0.0
Shai Bird              30    4    0    0   0   2/3    66.7     0/0   0.0
Ja Oladipo             31    3    0    0   0   1/3    33.3     0/0   0.0
Jimmy Griffin          30    0    1    0   0   0/0     0.0     0/0   0.0
Miles Jackson           6    0    1    0   0   0/1     0.0     0/0   0.0

TEAM: FG: 9/18 (50.0%), 3PT: 3/8 (37.5%), REB: 11 (3 off, 8 def), AST: 1, TO: 3
TEAM FOULS: 8 [Team_082 in BONUS]

================================================================================

================================================================================
                       4TH QUARTER - Team_082 vs Team_049                       
================================================================================

[12:00] Team_082 possession (Score: 69-75)
Julius Carter makes the Dunk and draws the foul on Shai Mobley! And-1! Julius Carter to the line for 1. [Team fouls: 1] (Shai Mobley: 1 personal fouls)   FT 1/1: GOOD Julius Carter makes 1/1 from the line.
Score: 72-75

[11:46] Team_049 possession (Score: 72-75)
Jimmy Griffin attempts a Midrange. Contested by Kristaps Fox (4.4 feet, ZONE). JIMMY GRIFFIN MAKES IT! Assist: De'Aaron Allen
Score: 72-77

[11:33] Team_082 possession (Score: 72-77)
Jrue Green attempts a Layup. Contested by De'Aaron Allen (4.7 feet, MAN). Jrue Green misses. Offensive rebound by Julius Carter! Julius Carter kicks it out.

[11:16] Team_082 possession (Score: 72-77)
Kristaps Fox attempts a 3Pt. Contested by Ja Oladipo (4.5 feet, ZONE). Kristaps Fox misses. Rebound secured by Jimmy Griffin.

[11:03] Team_049 possession (Score: 72-77)
Jimmy Griffin drives and kicks out. De'Aaron Allen attempts a 3Pt. Contested by Kristaps Fox (4.4 feet, ZONE). De'Aaron Allen misses. Rebound secured by Jrue Green.

[10:47] Team_082 possession (Score: 72-77)
Dwyane O'Neal attempts a Midrange. Contested by Ja Oladipo (4.5 feet, MAN). Dwyane O'Neal misses. Rebound secured by Shai Mobley.

[10:31] Team_049 possession (Score: 72-77)
Ja Oladipo attempts a Midrange. Contested by Dwyane O'Neal (3.7 feet, MAN). Ja Oladipo misses. Offensive rebound by De'Aaron Allen! De'Aaron Allen kicks it out.

[10:21] Team_049 possession (Score: 72-77)
Ja Oladipo attempts a 3Pt. Contested by Dwyane O'Neal (3.8 feet, MAN). Ja Oladipo misses. Rebound secured by Jrue Green.

[10:05] Team_082 possession (Score: 72-77)
Kristaps Fox attempts a 3Pt. Contested by Jimmy Griffin (5.1 feet, MAN). KRISTAPS FOX MAKES IT! Assist: Julius Anthony
Score: 75-77

[09:49] Team_049 possession (Score: 75-77)
Shai Mobley drives and kicks out. Shai Mobley attempts a Midrange. Wide open! Julius Carter is 6.0 feet away. [MAN] SHAI MOBLEY MAKES IT! Assist: Shai Bird
Score: 75-79

[09:37] Team_082 possession (Score: 75-79)
Jrue Green makes the Layup and draws the foul on De'Aaron Allen! And-1! Jrue Green to the line for 1. [Team fouls: 2] (De'Aaron Allen: 1 personal fouls)   FT 1/1: GOOD Jrue Green makes 1/1 from the line.
Score: 78-79

[09:23] Team_049 possession (Score: 78-79)
Shai Bird attempts a 3Pt. Contested by Julius Anthony (5.3 feet, MAN). Shai Bird misses. Rebound secured by Julius Carter.

[09:07] Team_082 possession (Score: 78-79)
Julius Carter attempts a Layup. Contested by De'Aaron Allen (5.0 feet, ZONE). Julius Carter misses. Rebound secured by Jimmy Griffin.

[08:52] Team_049 possession (Score: 78-79)
Shai Mobley drives and kicks out. Jimmy Griffin attempts a Midrange. Contested by Kristaps Fox (4.7 feet, MAN). Jimmy Griffin misses. Offensive rebound by De'Aaron Allen! De'Aaron Allen kicks it out.

[08:42] Team_049 possession (Score: 78-79)
Ja Oladipo drives, Dwyane O'Neal stays with him. Ja Oladipo attempts a Layup. Contested by Dwyane O'Neal (4.0 feet, MAN). Ja Oladipo misses. Rebound secured by Jrue Green.

[08:25] Team_082 possession (Score: 78-79)
FOUL! Shooting foul on De'Aaron Allen. Jrue Green to the line for 2 free throws. [Team fouls: 3] (De'Aaron Allen: 2 personal fouls)   FT 1/2: GOOD   FT 2/2: GOOD Jrue Green makes 2/2 from the line.
Score: 80-79

[08:13] Team_049 possession (Score: 80-79)
Shai Bird attempts a 3Pt. Contested by Julius Anthony (5.4 feet, MAN). Shai Bird misses. Rebound secured by Julius Carter.

[07:57] Team_082 possession (Score: 80-79)
Julius Carter makes the Midrange and draws the foul on Ja Oladipo! And-1! Julius Carter to the line for 1. [Team fouls: 4] (Ja Oladipo: 1 personal fouls)   FT 1/1: GOOD Julius Carter makes 1/1 from the line.
Score: 83-79

[07:39] Team_049 possession (Score: 83-79)
Jimmy Griffin attempts a 3Pt. Contested by Kristaps Fox (4.8 feet, MAN). Jimmy Griffin misses. Rebound secured by Dwyane O'Neal.

[07:25] Team_082 possession (Score: 83-79)
FOUL! Reach-in foul on De'Aaron Allen during the drive. [IN THE BONUS! 5 team fouls] Julius Carter to the line for 2 free throws. (De'Aaron Allen: 3 personal fouls)   FT 1/2: GOOD   FT 2/2: MISS Julius Carter makes 1/2 from the line. Rebound secured by De'Aaron Allen.
Score: 84-79

[07:15] Team_049 possession (Score: 84-79)
Ja Oladipo attempts a Layup. Wide open! Julius Carter is 6.4 feet away. [ZONE] JA OLADIPO MAKES IT!
Score: 84-81

[06:59] Team_082 possession (Score: 84-81)
Jrue Green attempts a Layup. Contested by De'Aaron Allen (5.1 feet, ZONE). Jrue Green misses. Rebound secured by Shai Mobley.

[06:46] Team_049 possession (Score: 84-81)
FOUL! Holding foul on Julius Carter. [Team fouls: 1] No free throws, side out. (Julius Carter: 1 personal fouls)

[06:32] Team_049 possession (Score: 84-81)
Shai Bird attempts a 3Pt. Contested by Julius Anthony (5.6 feet, MAN). SHAI BIRD MAKES IT! Assist: Ja Oladipo
Score: 84-84

[06:16] Team_082 possession (Score: 84-84)
Dwyane O'Neal attempts a 3Pt. Contested by De'Aaron Allen (4.9 feet, ZONE). Dwyane O'Neal misses. Rebound secured by Shai Mobley.

[06:05] Team_049 possession (Score: 84-84)
De'Aaron Allen drives to the basket... De'Aaron Allen throws a bad pass! Stolen by Jrue Green! TURNOVER! (live ball)

[05:49] Team_082 possession (Score: 84-84)
Julius Anthony attempts a Midrange. Contested by Shai Bird (5.2 feet, MAN). JULIUS ANTHONY MAKES IT!
Score: 86-84

[05:36] Team_049 possession (Score: 86-84)
Shai Bird attempts a Midrange. Contested by Julius Anthony (5.7 feet, MAN). Shai Bird misses. Rebound secured by Dwyane O'Neal.

[05:21] Team_082 possession (Score: 86-84)
Jrue Green loses the ball! Stripped by De'Aaron Allen! TURNOVER! (live ball)

[05:04] Team_049 possession (Score: 86-84)
Ja Oladipo attempts a 3Pt. Contested by Dwyane O'Neal (4.5 feet, MAN). Ja Oladipo misses. FOUL! Loose ball foul on Dwyane O'Neal during the rebound battle. [Team fouls: 2] No free throws, side out. (Dwyane O'Neal: 1 personal fouls)

[04:51] Team_049 possession (Score: 86-84)
Shai Mobley attempts a Midrange. Contested by Kristaps Fox (5.5 feet, ZONE). Shai Mobley misses. Rebound secured by Jrue Green.

[04:35] Team_082 possession (Score: 86-84)
Kristaps Fox makes the Midrange and draws the foul on Jimmy Griffin! And-1! Kristaps Fox to the line for 1. [BONUS: 6 team fouls] (Jimmy Griffin: 1 personal fouls)   FT 1/1: GOOD Kristaps Fox makes 1/1 from the line.
Score: 89-84

[04:17] Team_049 possession (Score: 89-84)
Jimmy Griffin attempts a Midrange. Contested by Kristaps Fox (5.3 feet, MAN). JIMMY GRIFFIN MAKES IT! Assist: Shai Mobley
Score: 89-86

[04:02] Team_082 possession (Score: 89-86)
Julius Carter drives and kicks out. Dwyane O'Neal attempts a 3Pt. Contested by Ja Oladipo (5.4 feet, MAN). Dwyane O'Neal misses. Offensive rebound by Jrue Green! Jrue Green kicks it out.

[03:46] Team_082 possession (Score: 89-86)
Julius Carter attempts a Midrange. Contested by Shai Mobley (5.6 feet, MAN). Julius Carter misses. Rebound secured by Shai Mobley.

[03:27] Team_049 possession (Score: 89-86)
De'Aaron Allen attempts a 3Pt. Contested by Dwyane O'Neal (4.4 feet, ZONE). De'Aaron Allen misses. Rebound secured by Jrue Green.

[03:14] Team_082 possession (Score: 89-86)
Kristaps Fox attempts a Layup. Contested by De'Aaron Allen (5.4 feet, ZONE). KRISTAPS FOX MAKES IT! Assist: Julius Anthony
Score: 91-86

[03:02] Team_049 possession (Score: 91-86)
Shai Mobley attempts a 3Pt. Contested by Dwyane O'Neal (4.8 feet, ZONE). SHAI MOBLEY MAKES IT! Assist: Jimmy Griffin
Score: 91-89

[02:43] Team_082 possession (Score: 91-89)
Kristaps Fox attempts a 3Pt. Contested by Jimmy Griffin (5.9 feet, MAN). Kristaps Fox misses. Rebound secured by Shai Mobley.

[02:32] Team_049 possession (Score: 91-89)
Jimmy Griffin drives and kicks out. De'Aaron Allen attempts a Midrange. Wide open! Jrue Green is 6.5 feet away. [ZONE] De'Aaron Allen misses. Rebound secured by Dwyane O'Neal.

[02:19] Team_082 possession (Score: 91-89)
Julius Anthony attempts a 3Pt. Contested by Shai Bird (5.7 feet, MAN). Julius Anthony misses. Rebound secured by Shai Mobley.

[02:05] Team_049 possession (Score: 91-89)
Shai Mobley attempts a Layup. Wide open! Jrue Green is 6.7 feet away. [ZONE] SHAI MOBLEY MAKES IT! Assist: Shai Bird
Score: 91-91

[01:50] Team_082 possession (Score: 91-91)
Julius Carter attempts a 3Pt. Contested by Shai Mobley (5.8 feet, MAN). Julius Carter misses. Rebound secured by Jimmy Griffin.

[01:35] Team_049 possession (Score: 91-91)
Shai Bird attempts a 3Pt. Wide open! Julius Anthony is 6.2 feet away. [MAN] Shai Bird misses. Rebound secured by Julius Carter.

[01:21] Team_082 possession (Score: 91-91)
Julius Anthony drives, Shai Bird stays with him. Julius Anthony attempts a Layup. Contested by Shai Bird (5.8 feet, MAN). JULIUS ANTHONY MAKES IT! Assist: Kristaps Fox
Score: 93-91

[01:07] Team_049 possession (Score: 93-91)
Ja Oladipo attempts a 3Pt. Contested by Dwyane O'Neal (5.1 feet, ZONE). JA OLADIPO MAKES IT! Assist: De'Aaron Allen
Score: 93-94

[00:51] Team_082 possession (Score: 93-94)
Kristaps Fox attempts a Layup. Contested by Shai Mobley (5.7 feet, ZONE). Kristaps Fox misses. FOUL! Loose ball foul on Jimmy Griffin during the rebound battle. [IN THE BONUS! 7 team fouls] Julius Carter to the line for 2 free throws. (Jimmy Griffin: 2 personal fouls)   FT 1/2: GOOD   FT 2/2: GOOD Julius Carter makes 2/2 from the line.
Score: 95-94

[00:33] Team_049 possession (Score: 95-94)
Shai Bird drives, picks up Jrue Green. Help arrives from Dwyane O'Neal! Shai Bird attempts a Layup. Wide open! Dwyane O'Neal is 6.9 feet away. [ZONE] Shai Bird misses. Offensive rebound by De'Aaron Allen! De'Aaron Allen kicks it out.

[00:18] Team_049 possession (Score: 95-94)
De'Aaron Allen attempts a Midrange. Wide open! Jrue Green is 6.5 feet away. [MAN] DE'AARON ALLEN MAKES IT! Assist: Jimmy Griffin
Score: 95-96

[00:01] Team_082 possession (Score: 95-96)
Kristaps Fox attempts a Layup. Contested by De'Aaron Allen (5.8 feet, ZONE). Kristaps Fox misses. Rebound secured by De'Aaron Allen.

================================================================================
                              4TH QUARTER COMPLETE                              
================================================================================

4TH QUARTER SCORE: Team_082 26, Team_049 21

BOX SCORE:
================================================================================

Team_082
--------------------------------------------------------------------------------
Player                MIN  PTS  REB  AST  TO      FG   FG%      3P   3P%
--------------------------------------------------------------------------------
Julius Carter          42    8    4    0   0   3/7    42.9     0/0   0.0
Kristaps Fox           42    8    0    1   0   3/6    50.0     0/0   0.0
Jrue Green             42    5    6    0   0   2/3    66.7     0/0   0.0
Julius Anthony         42    4    0    2   0   2/3    66.7     0/0   0.0
Dwyane O'Neal          43    0    3    0   0   0/2     0.0     0/0   0.0

TEAM: FG: 10/21 (47.6%), 3PT: 1/6 (16.7%), REB: 13 (2 off, 11 def), AST: 3, TO: 1
TEAM FOULS: 2


Team_049
--------------------------------------------------------------------------------
Player                MIN  PTS  REB  AST  TO      FG   FG%      3P   3P%
--------------------------------------------------------------------------------
Shai Mobley            43    7    7    1   0   3/4    75.0     0/0   0.0
Ja Oladipo             43    5    0    1   0   2/4    50.0     0/0   0.0
Jimmy Griffin          42    4    3    2   0   2/5    40.0     0/0   0.0
Shai Bird              42    3    0    2   0   1/5    20.0     0/0   0.0
De'Aaron Allen         43    2    5    2   0   1/2    50.0     0/0   0.0

TEAM: FG: 9/20 (45.0%), 3PT: 3/9 (33.3%), REB: 15 (4 off, 11 def), AST: 8, TO: 1
TEAM FOULS: 7 [Team_082 in BONUS]

================================================================================

================================================================================
                               FULL GAME COMPLETE                               
================================================================================

FINAL SCORE: Team_082 95, Team_049 96

SCORING BY QUARTER:
--------------------------------------------------------------------------------
Team                     Q1     Q2     Q3     Q4    FINAL
--------------------------------------------------------------------------------
Team_082                 26     21     22     26       95
Team_049                 28     27     20     21       96
--------------------------------------------------------------------------------

FULL GAME BOX SCORE:
================================================================================

Team_082
--------------------------------------------------------------------------------
Player                MIN  PTS  REB  AST  TO      FG   FG%      3P   3P%      FT STL BLK
--------------------------------------------------------------------------------
Dwyane O'Neal          43    2    9    2   3   1/8    12.5   0/3     0.0   0/0     0   0
Julius Anthony         42   16    0    3   0   9/15   60.0   2/6    33.3   4/5     0   1
Kristaps Fox           42   19    0    2   2   8/21   38.1   2/10   20.0  10/12    1   0
Jrue Green             42   25   16    0   3   9/13   69.2   3/5    60.0   9/9     2   0
Julius Carter          42   16   14    3   2   5/12   41.7   0/1     0.0  10/12    0   0
Jordan Rozier           7    5    0    0   0   2/2   100.0   1/1   100.0   0/0     0   0
Shaquille Griffin       7    0    1    2   0   0/1     0.0   0/1     0.0   0/0     0   0
Tony Jokic              7    2    3    0   1   1/2    50.0   0/0     0.0   0/0     0   0
D'Angelo Parker         7    0    1    1   2   0/1     0.0   0/0     0.0   0/0     1   0
Kawhi Poole             6    5    0    0   0   2/3    66.7   1/1   100.0   0/0     0   0

TEAM: FG: 37/78 (47.4%), 3PT: 9/28 (32.1%), REB: 43 (9 off, 34 def), AST: 13, TO: 13


Team_049
--------------------------------------------------------------------------------
Player                MIN  PTS  REB  AST  TO      FG   FG%      3P   3P%      FT STL BLK
--------------------------------------------------------------------------------
Ja Oladipo             43   19    0    2   3   8/16   50.0   3/9    33.3   0/0     2   1
De'Aaron Allen         43   19   10    7   2   9/14   64.3   2/5    40.0   4/4     2   2
Shai Mobley            43   15   21    2   3   6/11   54.5   1/3    33.3   0/0     0   0
Shai Bird              42   13    0    3   0   6/15   40.0   3/9    33.3   0/0     0   1
Jimmy Griffin          42   13   12    3   2   6/11   54.5   1/4    25.0   2/3     1   0
Shaquille Lillard       7    9    0    0   0   3/3   100.0   1/1   100.0   0/0     0   0
Desmond Towns           7    0    0    1   0   0/1     0.0   0/0     0.0   0/0     0   0
Shai Jordan             6    0    0    1   0   0/1     0.0   0/0     0.0   0/0     0   0
Giannis Anunoby         6    2    3    0   0   1/2    50.0   0/0     0.0   0/0     0   0
Miles Jackson           6    6    3    0   1   2/3    66.7   0/0     0.0   2/2     2   1

TEAM: FG: 41/77 (53.2%), 3PT: 11/31 (35.5%), REB: 50 (11 off, 39 def), AST: 19, TO: 11

================================================================================
