================================================================================
                        FULL GAME - Team_066 vs Team_049                        
================================================================================

================================================================================
                       1ST QUARTER - Team_066 vs Team_049                       
================================================================================

[12:00] Team_066 possession (Score: 0-0)
Brandon Reaves drives to the basket... Brandon Reaves throws a bad pass out of bounds! TURNOVER! (dead ball)

[11:47] Team_049 possession (Score: 0-0)
Jimmy Griffin attempts a 3Pt. Contested by Pau Curry (5.5 feet, ZONE). Jimmy Griffin misses. Offensive rebound by Jimmy Griffin! Jimmy Griffin kicks it out.

[11:33] Team_049 possession (Score: 0-0)
Jimmy Griffin attempts a Midrange. Contested by Brandon Reaves (5.1 feet, ZONE). Jimmy Griffin misses. Rebound secured by Kyle Wagner.

[11:17] Team_066 possession (Score: 0-0)
Pau Curry attempts a Midrange. Contested by Ja Oladipo (4.5 feet, MAN). PAU CURRY MAKES IT!
Score: 2-0

[11:01] Team_049 possession (Score: 2-0)
Shai Bird attempts a Layup. Contested by Jimmy Davis (4.4 feet, MAN). Shai Bird misses. Rebound secured by Brandon Reaves.

[10:47] Team_066 possession (Score: 2-0)
Jimmy Davis attempts a 3Pt. Contested by Shai Bird (4.3 feet, MAN). Jimmy Davis misses. Rebound secured by Shai Mobley.

[10:28] Team_049 possession (Score: 2-0)
De'Aaron Allen attempts a Midrange. Contested by Yao Brogdon (4.9 feet, ZONE). De'Aaron Allen misses. Offensive rebound by Jimmy Griffin! Jimmy Griffin kicks it out.

[10:13] Team_049 possession (Score: 2-0)
Shai Mobley attempts a Layup. BLOCKED BY JIMMY DAVIS! Ball deflects out of bounds off Shai Mobley.

[10:00] Team_066 possession (Score: 2-0)
Jimmy Davis attempts a 3Pt. Contested by Ja Oladipo (4.7 feet, ZONE). JIMMY DAVIS MAKES IT! Assist: Kyle Wagner
Score: 5-0

[09:48] Team_049 possession (Score: 5-0)
De'Aaron Allen attempts a Midrange. Contested by Yao Brogdon (4.9 feet, ZONE). DE'AARON ALLEN MAKES IT! Assist: Shai Mobley
Score: 5-2

[09:34] Team_066 possession (Score: 5-2)
Brandon Reaves attempts a 3Pt. Contested by Ja Oladipo (4.7 feet, ZONE). Brandon Reaves misses. Rebound secured by Jimmy Griffin.

[09:18] Team_049 possession (Score: 5-2)
FOUL! Holding foul on Brandon Reaves. [Team fouls: 1] No free throws, side out. (Brandon Reaves: 1 personal fouls)

[09:07] Team_049 possession (Score: 5-2)
Jimmy Griffin attempts a 3Pt. Contested by Brandon Reaves (5.1 feet, MAN). Jimmy Griffin misses. Rebound secured by Brandon Reaves.

[08:56] Team_066 possession (Score: 5-2)
Kyle Wagner drives and kicks out. Jimmy Davis attempts a 3Pt. Contested by Ja Oladipo (4.2 feet, ZONE). Jimmy Davis misses. Rebound secured by Jimmy Griffin.

[08:37] Team_049 possession (Score: 5-2)
FOUL! Shooting foul on Brandon Reaves. Jimmy Griffin to the line for 2 free throws. [Team fouls: 2] (Brandon Reaves: 2 personal fouls)   FT 1/2: MISS   FT 2/2: GOOD Jimmy Griffin makes 1/2 from the line.
Score: 5-3

[08:17] Team_066 possession (Score: 5-3)
Kyle Wagner loses the ball! Stripped by Shai Mobley! TURNOVER! (live ball)

[08:06] Team_049 possession (Score: 5-3)
Ja Oladipo makes the Layup and draws the foul on Jimmy Davis! And-1! Ja Oladipo to the line for 1. [Team fouls: 3] (Jimmy Davis: 1 personal fouls)   FT 1/1: GOOD Ja Oladipo makes 1/1 from the line.
Score: 5-6

[07:48] Team_066 possession (Score: 5-6)
Brandon Reaves drives, De'Aaron Allen stays with him. Brandon Reaves attempts a Dunk. Contested by De'Aaron Allen (4.8 feet, ZONE). BRANDON REAVES MAKES IT!
Score: 7-6

[07:36] Team_049 possession (Score: 7-6)
De'Aaron Allen attempts a 3Pt. Contested by Yao Brogdon (4.9 feet, MAN). DE'AARON ALLEN MAKES IT! Assist: Shai Mobley
Score: 7-9

[07:26] Team_066 possession (Score: 7-9)
FOUL! Holding foul on Ja Oladipo. [Team fouls: 1] No free throws, side out. (Ja Oladipo: 1 personal fouls)

[07:14] Team_066 possession (Score: 7-9)
Yao Brogdon makes the Dunk and draws the foul on Ja Oladipo! And-1! Yao Brogdon to the line for 1. [Team fouls: 2] (Ja Oladipo: 2 personal fouls)   FT 1/1: GOOD Yao Brogdon makes 1/1 from the line.
Score: 10-9

[07:00] Team_049 possession (Score: 10-9)
Shai Bird attempts a 3Pt. Contested by Pau Curry (5.9 feet, ZONE). SHAI BIRD MAKES IT! Assist: Shai Mobley
Score: 10-12

[06:47] Team_066 possession (Score: 10-12)
Jimmy Davis drives and kicks out. Brandon Reaves attempts a Midrange. Contested by Jimmy Griffin (4.7 feet, MAN). Brandon Reaves misses. Rebound secured by Shai Mobley.

[06:34] Team_049 possession (Score: 10-12)
Ja Oladipo drives and kicks out. De'Aaron Allen attempts a Midrange. Contested by Yao Brogdon (5.1 feet, MAN). DE'AARON ALLEN MAKES IT! Assist: Jimmy Griffin
Score: 10-14

[06:16] Team_066 possession (Score: 10-14)
Brandon Reaves attempts a 3Pt. Contested by Jimmy Griffin (5.2 feet, MAN). Brandon Reaves misses. Rebound secured by De'Aaron Allen.

[06:04] Team_049 possession (Score: 10-14)
Shai Mobley attempts a 3Pt. Contested by Pau Curry (5.8 feet, ZONE). Shai Mobley misses. Rebound secured by Brandon Reaves.

[05:49] Team_066 possession (Score: 10-14)
Brandon Reaves attempts a 3Pt. Contested by Jimmy Griffin (5.2 feet, MAN). Brandon Reaves misses. Rebound secured by De'Aaron Allen.

[05:33] Team_049 possession (Score: 10-14)
FOUL! Shooting foul on Kyle Wagner. De'Aaron Allen to the line for 2 free throws. [Team fouls: 4] (Kyle Wagner: 1 personal fouls)   FT 1/2: GOOD   FT 2/2: GOOD De'Aaron Allen makes 2/2 from the line.
Score: 10-16

[05:19] Team_066 possession (Score: 10-16)
Jimmy Davis attempts a 3Pt. Contested by Shai Bird (4.4 feet, MAN). JIMMY DAVIS MAKES IT! Assist: Pau Curry
Score: 13-16

[05:06] Team_049 possession (Score: 13-16)
Jimmy Griffin attempts a 3Pt. Contested by Pau Curry (5.6 feet, ZONE). JIMMY GRIFFIN MAKES IT! Assist: Ja Oladipo
Score: 13-19

[04:54] Team_066 possession (Score: 13-19)
FOUL! Reach-in foul on Jimmy Griffin during the drive. [Team fouls: 3] No free throws, side out. (Jimmy Griffin: 1 personal fouls)

[04:38] Team_066 possession (Score: 13-19)
Jimmy Davis makes the Layup and draws the foul on Shai Bird! And-1! Jimmy Davis to the line for 1. [Team fouls: 4] (Shai Bird: 1 personal fouls)   FT 1/1: GOOD Jimmy Davis makes 1/1 from the line.
Score: 16-19

[04:25] Team_049 possession (Score: 16-19)
Ja Oladipo attempts a 3Pt. Contested by Pau Curry (5.8 feet, MAN). Ja Oladipo misses. Offensive rebound by De'Aaron Allen! De'Aaron Allen kicks it out.

[04:11] Team_049 possession (Score: 16-19)
Shai Mobley drives, Kyle Wagner stays with him. Shai Mobley attempts a Dunk. Contested by Kyle Wagner (4.3 feet, ZONE). Shai Mobley misses. FOUL! Loose ball foul on Brandon Reaves during the rebound battle. [IN THE BONUS! 5 team fouls] De'Aaron Allen to the line for 2 free throws. (Brandon Reaves: 3 personal fouls)   FT 1/2: GOOD   FT 2/2: GOOD De'Aaron Allen makes 2/2 from the line.
Score: 16-21

[04:02] Team_066 possession (Score: 16-21)
Kyle Wagner makes the Layup and draws the foul on Shai Mobley! And-1! Kyle Wagner to the line for 1. [BONUS: 5 team fouls] (Shai Mobley: 1 personal fouls)   FT 1/1: GOOD Kyle Wagner makes 1/1 from the line.
Score: 19-21

[03:46] Team_049 possession (Score: 19-21)
De'Aaron Allen attempts a 3Pt. Contested by Pau Curry (5.5 feet, ZONE). De'Aaron Allen misses. Rebound secured by Brandon Reaves.

[03:35] Team_066 possession (Score: 19-21)
Yao Brogdon attempts a 3Pt. Contested by Ja Oladipo (4.8 feet, ZONE). Yao Brogdon misses. Rebound secured by Shai Mobley.

[03:16] Team_049 possession (Score: 19-21)
FOUL! Shooting foul on Yao Brogdon. Jimmy Griffin to the line for 2 free throws. [BONUS: 6 team fouls] (Yao Brogdon: 1 personal fouls)   FT 1/2: GOOD   FT 2/2: GOOD Jimmy Griffin makes 2/2 from the line.
Score: 19-23

[03:00] Team_066 possession (Score: 19-23)
Brandon Reaves attempts a 3Pt. Contested by Ja Oladipo (4.9 feet, ZONE). BRANDON REAVES MAKES IT! Assist: Pau Curry
Score: 22-23

[02:45] Team_049 possession (Score: 22-23)
Shai Mobley drives, picks up Kyle Wagner. Help arrives from Jimmy Davis! Shai Mobley attempts a Dunk. Contested by Jimmy Davis (4.4 feet, MAN). SHAI MOBLEY MAKES IT! Assist: De'Aaron Allen
Score: 22-25

[02:28] Team_066 possession (Score: 22-25)
Pau Curry attempts a 3Pt. Contested by Ja Oladipo (4.8 feet, MAN). Pau Curry misses. Rebound secured by Jimmy Griffin.

[02:17] Team_049 possession (Score: 22-25)
Ja Oladipo attempts a Midrange. Contested by Pau Curry (6.0 feet, MAN). Ja Oladipo misses. Offensive rebound by Shai Mobley! Shai Mobley's putback is no good. Offensive rebound by Shai Mobley! Shai Mobley kicks it out.

[02:01] Team_049 possession (Score: 22-25)
De'Aaron Allen throws a bad pass out of bounds! TURNOVER! (dead ball)

[02:01] Substitution (Team_066): Jimmy Davis OUT → Pascal Carter IN (stamina_rule2)

[02:01] Substitution (Team_066): Pau Curry OUT → Lauri LaVine IN (stamina_rule2)

[02:01] Substitution (Team_066): Brandon Reaves OUT → Brandon Middleton IN (stamina_rule2)

[02:01] Substitution (Team_066): Yao Brogdon OUT → Cole Morant IN (stamina_rule2)

[02:01] Substitution (Team_066): Kyle Wagner OUT → Donovan Simmons IN (stamina_rule2)

[02:01] Substitution (Team_049): Shai Bird OUT → Shaquille Lillard IN (stamina_rule2)

[02:01] Substitution (Team_049): Ja Oladipo OUT → Shai Jordan IN (stamina_rule2)

[02:01] Substitution (Team_049): Jimmy Griffin OUT → Desmond Towns IN (stamina_rule2)

[02:01] Substitution (Team_049): De'Aaron Allen OUT → Giannis Anunoby IN (stamina_rule2)

[02:01] Substitution (Team_049): Shai Mobley OUT → Miles Jackson IN (stamina_rule2)

[01:50] Team_066 possession (Score: 22-25)
Lauri LaVine drives and kicks out. Lauri LaVine attempts a Midrange. Wide open! Shai Jordan is 6.1 feet away. [MAN] LAURI LAVINE MAKES IT!
Score: 24-25

[01:38] Team_049 possession (Score: 24-25)
Miles Jackson attempts a Layup. Contested by Donovan Simmons (4.9 feet, MAN). MILES JACKSON MAKES IT!
Score: 24-27

[01:27] Team_066 possession (Score: 24-27)
FOUL! Shooting foul on Desmond Towns. Brandon Middleton to the line for 3 free throws. [BONUS: 6 team fouls] (Desmond Towns: 1 personal fouls)   FT 1/3: GOOD   FT 2/3: GOOD   FT 3/3: GOOD Brandon Middleton makes 3/3 from the line.
Score: 27-27

[01:10] Team_049 possession (Score: 27-27)
Giannis Anunoby drives and kicks out. Desmond Towns attempts a Midrange. Contested by Brandon Middleton (5.1 feet, ZONE). Desmond Towns misses. Rebound secured by Lauri LaVine.

[00:57] Team_066 possession (Score: 27-27)
Pascal Carter attempts a Layup. Contested by Giannis Anunoby (4.8 feet, ZONE). Pascal Carter misses. Rebound secured by Shai Jordan.

[00:37] Team_049 possession (Score: 27-27)
Giannis Anunoby drives to the basket... Giannis Anunoby loses control! Ball rolls out of bounds! TURNOVER! (dead ball)

[00:21] Team_066 possession (Score: 27-27)
Cole Morant attempts a 3Pt. Contested by Desmond Towns (5.0 feet, ZONE). COLE MORANT MAKES IT! Assist: Pascal Carter
Score: 30-27

[00:05] Team_049 possession (Score: 30-27)
Miles Jackson drives, Donovan Simmons stays with him. Miles Jackson attempts a Dunk. Contested by Donovan Simmons (4.9 feet, MAN). Miles Jackson misses. Rebound secured by Lauri LaVine.

================================================================================
                              1ST QUARTER COMPLETE                              
================================================================================

1ST QUARTER SCORE: Team_066 30, Team_049 27

BOX SCORE:
================================================================================

Team_066
--------------------------------------------------------------------------------
Player                MIN  PTS  REB  AST  TO      FG   FG%      3P   3P%
--------------------------------------------------------------------------------
Jimmy Davis            10    9    0    0   0   3/5    60.0     0/0   0.0
Brandon Reaves         10    5    4    0   0   2/5    40.0     0/0   0.0
Kyle Wagner            10    3    1    1   0   1/2    50.0     0/0   0.0
Yao Brogdon            10    3    0    0   0   1/2    50.0     0/0   0.0
Brandon Middleton       2    3    0    0   0   1/1   100.0     0/0   0.0
Cole Morant             2    3    0    0   0   1/1   100.0     0/0   0.0
Pau Curry              10    2    0    2   0   1/2    50.0     0/0   0.0
Lauri LaVine            2    2    2    0   0   1/1   100.0     0/0   0.0
Pascal Carter           2    0    0    1   0   0/1     0.0     0/0   0.0

TEAM: FG: 11/20 (55.0%), 3PT: 5/11 (45.5%), REB: 7 (0 off, 7 def), AST: 4, TO: 2
TEAM FOULS: 6 [Team_049 in BONUS]


Team_049
--------------------------------------------------------------------------------
Player                MIN  PTS  REB  AST  TO      FG   FG%      3P   3P%
--------------------------------------------------------------------------------
De'Aaron Allen         10   11    3    1   0   5/6    83.3     0/0   0.0
Jimmy Griffin          10    6    5    1   0   3/5    60.0     0/0   0.0
Shai Bird              10    3    0    0   0   1/2    50.0     0/0   0.0
Ja Oladipo             10    3    0    1   0   1/1   100.0     0/0   0.0
Shai Mobley            10    2    4    3   0   1/3    33.3     0/0   0.0
Miles Jackson           2    2    0    0   0   1/2    50.0     0/0   0.0
Giannis Anunoby         2    0    0    0   0   0/1     0.0     0/0   0.0
Shai Jordan             2    0    1    0   0   0/0     0.0     0/0   0.0

TEAM: FG: 12/20 (60.0%), 3PT: 3/6 (50.0%), REB: 13 (4 off, 9 def), AST: 6, TO: 2
TEAM FOULS: 6 [Team_066 in BONUS]

================================================================================

================================================================================
                       2ND QUARTER - Team_066 vs Team_049                       
================================================================================

[12:00] Team_066 possession (Score: 30-27)
FOUL! Shooting foul on De'Aaron Allen. Jimmy Davis to the line for 2 free throws. [Team fouls: 1] (De'Aaron Allen: 1 personal fouls)   FT 1/2: GOOD   FT 2/2: MISS Jimmy Davis makes 1/2 from the line. Rebound secured by Jimmy Griffin.
Score: 31-27

[11:49] Team_049 possession (Score: 31-27)
Ja Oladipo attempts a 3Pt. Contested by Pau Curry (5.8 feet, ZONE). JA OLADIPO MAKES IT! Assist: De'Aaron Allen
Score: 31-30

[11:39] Team_066 possession (Score: 31-30)
Kyle Wagner throws a bad pass! Stolen by Shai Mobley! TURNOVER! (live ball)

[11:27] Team_049 possession (Score: 31-30)
Shai Bird attempts a Layup. Contested by Jimmy Davis (4.5 feet, MAN). SHAI BIRD MAKES IT! Assist: De'Aaron Allen
Score: 31-32

[11:11] Team_066 possession (Score: 31-32)
Brandon Reaves attempts a 3Pt. Contested by Jimmy Griffin (5.3 feet, MAN). BRANDON REAVES MAKES IT! Assist: Yao Brogdon
Score: 34-32

[10:52] Team_049 possession (Score: 34-32)
FOUL! Offensive foul on De'Aaron Allen! Yao Brogdon drew the charge! [Team fouls: 2] (De'Aaron Allen: 2 personal fouls) TURNOVER! (dead ball)

[10:40] Team_066 possession (Score: 34-32)
Pau Curry attempts a 3Pt. Contested by Ja Oladipo (4.7 feet, MAN). PAU CURRY MAKES IT! Assist: Kyle Wagner
Score: 37-32

[10:25] Team_049 possession (Score: 37-32)
Shai Mobley attempts a 3Pt. Contested by Kyle Wagner (4.4 feet, MAN). Shai Mobley misses. Rebound secured by Kyle Wagner.

[10:14] Team_066 possession (Score: 37-32)
FOUL! Holding foul on Ja Oladipo. [Team fouls: 3] No free throws, side out. (Ja Oladipo: 1 personal fouls)

[09:56] Team_066 possession (Score: 37-32)
FOUL! Offensive foul on Kyle Wagner! Shai Mobley drew the charge! [Team fouls: 1] (Kyle Wagner: 1 personal fouls) TURNOVER! (dead ball)

[09:40] Team_049 possession (Score: 37-32)
Ja Oladipo attempts a 3Pt. Contested by Pau Curry (5.9 feet, ZONE). Ja Oladipo misses. Rebound secured by Kyle Wagner.

[09:26] Team_066 possession (Score: 37-32)
Brandon Reaves attempts a 3Pt. Contested by Jimmy Griffin (5.4 feet, MAN). Brandon Reaves misses. Rebound secured by Jimmy Griffin.

[09:14] Team_049 possession (Score: 37-32)
Jimmy Griffin attempts a 3Pt. Contested by Pau Curry (5.8 feet, ZONE). JIMMY GRIFFIN MAKES IT! Assist: Shai Mobley
Score: 37-35

[08:58] Team_066 possession (Score: 37-35)
FOUL! Reach-in foul on De'Aaron Allen during the drive. [Team fouls: 4] No free throws, side out. (De'Aaron Allen: 3 personal fouls)

[08:48] Team_066 possession (Score: 37-35)
Brandon Reaves makes the Dunk and draws the foul on Jimmy Griffin! And-1! Brandon Reaves to the line for 1. [BONUS: 5 team fouls] (Jimmy Griffin: 1 personal fouls)   FT 1/1: GOOD Brandon Reaves makes 1/1 from the line.
Score: 40-35

[08:36] Team_049 possession (Score: 40-35)
Shai Bird makes the Midrange and draws the foul on Jimmy Davis! And-1! Shai Bird to the line for 1. [Team fouls: 2] (Jimmy Davis: 1 personal fouls)   FT 1/1: GOOD Shai Bird makes 1/1 from the line.
Score: 40-38

[08:21] Team_066 possession (Score: 40-38)
Kyle Wagner attempts a Midrange. Contested by Shai Mobley (4.5 feet, MAN). KYLE WAGNER MAKES IT! Assist: Jimmy Davis
Score: 42-38

[08:08] Team_049 possession (Score: 42-38)
Ja Oladipo drives to the basket... FOUL! Offensive foul on Ja Oladipo! Kyle Wagner drew the charge! [Team fouls: 6] (Ja Oladipo: 2 personal fouls) TURNOVER! (dead ball)

[07:54] Team_066 possession (Score: 42-38)
Yao Brogdon attempts a Midrange. Contested by De'Aaron Allen (5.1 feet, MAN). YAO BROGDON MAKES IT!
Score: 44-38

[07:42] Team_049 possession (Score: 44-38)
Shai Mobley drives and kicks out. De'Aaron Allen attempts a 3Pt. Contested by Pau Curry (6.0 feet, ZONE). De'Aaron Allen misses. Rebound secured by Kyle Wagner.

[07:28] Team_066 possession (Score: 44-38)
Jimmy Davis loses control! Ball rolls out of bounds! TURNOVER! (dead ball)

[07:28] Substitution (Team_066): Jimmy Davis OUT → Pascal Carter IN (stamina_rule2)

[07:28] Substitution (Team_066): Pau Curry OUT → Lauri LaVine IN (stamina_rule2)

[07:28] Substitution (Team_066): Brandon Reaves OUT → Brandon Middleton IN (stamina_rule2)

[07:28] Substitution (Team_066): Yao Brogdon OUT → Cole Morant IN (stamina_rule2)

[07:28] Substitution (Team_066): Kyle Wagner OUT → Donovan Simmons IN (stamina_rule2)

[07:28] Substitution (Team_049): Shai Bird OUT → Shaquille Lillard IN (stamina_rule2)

[07:28] Substitution (Team_049): Ja Oladipo OUT → Shai Jordan IN (stamina_rule2)

[07:28] Substitution (Team_049): Jimmy Griffin OUT → Desmond Towns IN (stamina_rule2)

[07:28] Substitution (Team_049): De'Aaron Allen OUT → Giannis Anunoby IN (stamina_rule2)

[07:28] Substitution (Team_049): Shai Mobley OUT → Miles Jackson IN (stamina_rule2)

[07:14] Team_049 possession (Score: 44-38)
Desmond Towns attempts a 3Pt. Contested by Brandon Middleton (5.2 feet, MAN). Desmond Towns misses. Rebound secured by Brandon Middleton.

[07:01] Team_066 possession (Score: 44-38)
Pascal Carter attempts a Midrange. Contested by Shaquille Lillard (4.7 feet, MAN). PASCAL CARTER MAKES IT! Assist: Lauri LaVine
Score: 46-38

[06:42] Team_049 possession (Score: 46-38)
Shai Jordan attempts a Midrange. Contested by Cole Morant (5.5 feet, ZONE). SHAI JORDAN MAKES IT! Assist: Giannis Anunoby
Score: 46-40

[06:27] Team_066 possession (Score: 46-40)
Cole Morant drives to the basket... Cole Morant loses the ball! Stripped by Giannis Anunoby! TURNOVER! (live ball)

[06:11] Team_049 possession (Score: 46-40)
Miles Jackson attempts a 3Pt. Contested by Donovan Simmons (4.9 feet, MAN). Miles Jackson misses. Rebound secured by Brandon Middleton.

[05:54] Team_066 possession (Score: 46-40)
Donovan Simmons drives, Miles Jackson stays with him. Donovan Simmons attempts a Layup. Contested by Miles Jackson (3.5 feet, ZONE). DONOVAN SIMMONS MAKES IT!
Score: 48-40

[05:38] Team_049 possession (Score: 48-40)
Giannis Anunoby attempts a Midrange. Contested by Cole Morant (5.5 feet, MAN). GIANNIS ANUNOBY MAKES IT! Assist: Desmond Towns
Score: 48-42

[05:20] Team_066 possession (Score: 48-42)
FOUL! Reach-in foul on Miles Jackson during the drive. [IN THE BONUS! 7 team fouls] Lauri LaVine to the line for 2 free throws. (Miles Jackson: 1 personal fouls)   FT 1/2: GOOD   FT 2/2: GOOD Lauri LaVine makes 2/2 from the line.
Score: 50-42

[05:05] Team_049 possession (Score: 50-42)
Miles Jackson drives and kicks out. Miles Jackson attempts a Midrange. Contested by Brandon Middleton (5.1 feet, ZONE). MILES JACKSON MAKES IT! Assist: Giannis Anunoby
Score: 50-44

[04:50] Team_066 possession (Score: 50-44)
Donovan Simmons attempts a 3Pt. Contested by Shaquille Lillard (4.6 feet, ZONE). Donovan Simmons misses. Rebound secured by Shai Jordan.

[04:35] Team_049 possession (Score: 50-44)
Shai Jordan attempts a 3Pt. Contested by Lauri LaVine (4.0 feet, ZONE). Shai Jordan misses. Offensive rebound by Giannis Anunoby! Giannis Anunoby kicks it out.

[04:21] Team_049 possession (Score: 50-44)
Giannis Anunoby attempts a Midrange. Contested by Cole Morant (5.5 feet, MAN). Giannis Anunoby misses. Rebound secured by Lauri LaVine.

[04:03] Team_066 possession (Score: 50-44)
Brandon Middleton attempts a 3Pt. Contested by Shaquille Lillard (4.3 feet, ZONE). BRANDON MIDDLETON MAKES IT! Assist: Donovan Simmons
Score: 53-44

[03:46] Team_049 possession (Score: 53-44)
Miles Jackson makes the Dunk and draws the foul on Donovan Simmons! And-1! Miles Jackson to the line for 1. [Team fouls: 3] (Donovan Simmons: 1 personal fouls)   FT 1/1: GOOD Miles Jackson makes 1/1 from the line.
Score: 53-47

[03:27] Team_066 possession (Score: 53-47)
Donovan Simmons drives to the basket... Donovan Simmons throws a bad pass out of bounds! TURNOVER! (dead ball)

[03:15] Team_049 possession (Score: 53-47)
Miles Jackson drives and kicks out. Giannis Anunoby attempts a 3Pt. Contested by Cole Morant (5.5 feet, MAN). GIANNIS ANUNOBY MAKES IT! Assist: Shaquille Lillard
Score: 53-50

[03:00] Team_066 possession (Score: 53-50)
Lauri LaVine attempts a 3Pt. Wide open! Shai Jordan is 6.3 feet away. [MAN] LAURI LAVINE MAKES IT! Assist: Brandon Middleton
Score: 56-50

[02:48] Team_049 possession (Score: 56-50)
Miles Jackson attempts a Midrange. Contested by Cole Morant (5.5 feet, ZONE). Miles Jackson misses. Rebound secured by Brandon Middleton.

[02:35] Team_066 possession (Score: 56-50)
Lauri LaVine attempts a Layup. Wide open! Shai Jordan is 6.3 feet away. [MAN] LAURI LAVINE MAKES IT!
Score: 58-50

[02:26] Team_049 possession (Score: 58-50)
Shai Jordan attempts a Midrange. Contested by Brandon Middleton (5.2 feet, ZONE). Shai Jordan misses. Offensive rebound by Miles Jackson! Miles Jackson puts it back in!
Score: 58-52

[02:12] Team_066 possession (Score: 58-52)
Cole Morant makes the Midrange and draws the foul on Giannis Anunoby! And-1! Cole Morant to the line for 1. [BONUS: 8 team fouls] (Giannis Anunoby: 1 personal fouls)   FT 1/1: GOOD Cole Morant makes 1/1 from the line.
Score: 61-52

[01:58] Team_049 possession (Score: 61-52)
Desmond Towns attempts a Midrange. Contested by Brandon Middleton (5.2 feet, MAN). Desmond Towns misses. Rebound secured by Brandon Middleton.

[01:43] Team_066 possession (Score: 61-52)
FOUL! Reach-in foul on Miles Jackson during the drive. [IN THE BONUS! 9 team fouls] Donovan Simmons to the line for 2 free throws. (Miles Jackson: 2 personal fouls)   FT 1/2: GOOD   FT 2/2: GOOD Donovan Simmons makes 2/2 from the line.
Score: 63-52

[01:30] Team_049 possession (Score: 63-52)
Miles Jackson attempts a Layup. BLOCKED BY DONOVAN SIMMONS! Ball deflects out of bounds off Miles Jackson.

[01:14] Team_066 possession (Score: 63-52)
Lauri LaVine drives, picks up Shai Jordan. Help arrives from Desmond Towns! Lauri LaVine attempts a Layup. Wide open! Desmond Towns is 6.3 feet away. [MAN] Lauri LaVine misses. Rebound secured by Shai Jordan.

[01:04] Team_049 possession (Score: 63-52)
Shai Jordan attempts a 3Pt. Contested by Lauri LaVine (4.0 feet, ZONE). Shai Jordan misses. Rebound secured by Lauri LaVine.

[00:50] Team_066 possession (Score: 63-52)
Cole Morant attempts a 3Pt. Contested by Giannis Anunoby (5.2 feet, MAN). Cole Morant misses. Rebound secured by Shai Jordan.

[00:36] Team_049 possession (Score: 63-52)
Giannis Anunoby drives to the basket... Giannis Anunoby commits a violation (traveling/carry)! TURNOVER! (dead ball)

[00:23] Team_066 possession (Score: 63-52)
Donovan Simmons drives, Miles Jackson stays with him. Donovan Simmons attempts a Dunk. Contested by Miles Jackson (3.6 feet, MAN). Donovan Simmons misses. Rebound secured by Shai Jordan.

[00:07] Team_049 possession (Score: 63-52)
Desmond Towns drives, Brandon Middleton stays with him. Desmond Towns attempts a Layup. Contested by Brandon Middleton (5.3 feet, MAN). DESMOND TOWNS MAKES IT! Assist: Shaquille Lillard
Score: 63-54

================================================================================
                              2ND QUARTER COMPLETE                              
================================================================================

2ND QUARTER SCORE: Team_066 33, Team_049 27

BOX SCORE:
================================================================================

Team_066
--------------------------------------------------------------------------------
Player                MIN  PTS  REB  AST  TO      FG   FG%      3P   3P%
--------------------------------------------------------------------------------
Lauri LaVine            9    7    2    1   0   3/4    75.0     0/0   0.0
Brandon Reaves         15    6    0    0   0   2/3    66.7     0/0   0.0
Donovan Simmons         9    4    0    1   0   2/4    50.0     0/0   0.0
Pau Curry              15    3    0    0   0   1/1   100.0     0/0   0.0
Brandon Middleton       9    3    4    1   0   1/1   100.0     0/0   0.0
Cole Morant             9    3    0    0   0   1/2    50.0     0/0   0.0
Yao Brogdon            15    2    0    1   0   1/1   100.0     0/0   0.0
Kyle Wagner            15    2    3    1   0   1/1   100.0     0/0   0.0
Pascal Carter           9    2    0    0   0   1/1   100.0     0/0   0.0
Jimmy Davis            15    0    0    1   0   0/1     0.0     0/0   0.0

TEAM: FG: 13/19 (68.4%), 3PT: 4/7 (57.1%), REB: 9 (0 off, 9 def), AST: 6, TO: 5
TEAM FOULS: 3


Team_049
--------------------------------------------------------------------------------
Player                MIN  PTS  REB  AST  TO      FG   FG%      3P   3P%
--------------------------------------------------------------------------------
Miles Jackson           9    7    1    0   0   3/6    50.0     0/0   0.0
Shai Bird              15    5    0    0   0   2/2   100.0     0/0   0.0
Giannis Anunoby         9    5    1    2   0   2/3    66.7     0/0   0.0
Jimmy Griffin          15    3    2    0   0   1/1   100.0     0/0   0.0
Ja Oladipo             15    3    0    0   0   1/2    50.0     0/0   0.0
Desmond Towns           9    2    0    1   0   1/3    33.3     0/0   0.0
Shai Jordan             9    2    4    0   0   1/2    50.0     0/0   0.0
De'Aaron Allen         15    0    0    2   0   0/0     0.0     0/0   0.0
Shai Mobley            15    0    0    1   0   0/2     0.0     0/0   0.0
Shaquille Lillard       9    0    0    2   0   0/0     0.0     0/0   0.0

TEAM: FG: 11/21 (52.4%), 3PT: 2/7 (28.6%), REB: 8 (2 off, 6 def), AST: 8, TO: 3
TEAM FOULS: 9 [Team_066 in BONUS]

================================================================================

================================================================================
                       3RD QUARTER - Team_066 vs Team_049                       
================================================================================

[12:00] Team_066 possession (Score: 63-54)
Yao Brogdon attempts a Midrange. Contested by Ja Oladipo (4.7 feet, ZONE). Yao Brogdon misses. Offensive rebound by Kyle Wagner! Kyle Wagner kicks it out.

[11:50] Team_066 possession (Score: 63-54)
Kyle Wagner attempts a Midrange. Contested by Shai Mobley (4.1 feet, MAN). Kyle Wagner misses. Rebound secured by Shai Mobley.

[11:35] Team_049 possession (Score: 63-54)
Shai Mobley attempts a Midrange. Contested by Kyle Wagner (4.2 feet, MAN). Shai Mobley misses. Rebound secured by Brandon Reaves.

[11:24] Team_066 possession (Score: 63-54)
Brandon Reaves attempts a 3Pt. Contested by Ja Oladipo (4.7 feet, ZONE). Brandon Reaves misses. Offensive rebound by Kyle Wagner! Kyle Wagner kicks it out.

[11:13] Team_066 possession (Score: 63-54)
Yao Brogdon attempts a 3Pt. Contested by De'Aaron Allen (4.7 feet, MAN). Yao Brogdon misses. Rebound secured by Jimmy Griffin.

[11:00] Team_049 possession (Score: 63-54)
Shai Bird attempts a 3Pt. Contested by Pau Curry (5.9 feet, ZONE). Shai Bird misses. Rebound secured by Kyle Wagner.

[10:44] Team_066 possession (Score: 63-54)
Yao Brogdon makes the Dunk and draws the foul on De'Aaron Allen! And-1! Yao Brogdon to the line for 1. [Team fouls: 1] (De'Aaron Allen: 1 personal fouls)   FT 1/1: GOOD Yao Brogdon makes 1/1 from the line.
Score: 66-54

[10:34] Team_049 possession (Score: 66-54)
Jimmy Griffin attempts a 3Pt. Contested by Brandon Reaves (5.1 feet, MAN). Jimmy Griffin misses. Rebound secured by Yao Brogdon.

[10:21] Team_066 possession (Score: 66-54)
Brandon Reaves attempts a Layup. Contested by De'Aaron Allen (4.8 feet, ZONE). BRANDON REAVES MAKES IT!
Score: 68-54

[10:06] Team_049 possession (Score: 68-54)
Jimmy Griffin attempts a 3Pt. Contested by Pau Curry (5.5 feet, ZONE). Jimmy Griffin misses. Rebound secured by Brandon Reaves.

[09:53] Team_066 possession (Score: 68-54)
Jimmy Davis drives and kicks out. Jimmy Davis attempts a Midrange. Contested by Jimmy Griffin (4.7 feet, ZONE). JIMMY DAVIS MAKES IT!
Score: 70-54

[09:40] Team_049 possession (Score: 70-54)
Shai Bird drives to the basket... Shai Bird loses the ball! Stripped by Kyle Wagner! TURNOVER! (live ball)

[09:30] Team_066 possession (Score: 70-54)
Jimmy Davis attempts a 3Pt. Contested by Shai Bird (4.3 feet, MAN). Jimmy Davis misses. Rebound secured by Shai Mobley.

[09:13] Team_049 possession (Score: 70-54)
Ja Oladipo attempts a 3Pt. Contested by Pau Curry (5.7 feet, ZONE). Ja Oladipo misses. Rebound secured by Kyle Wagner.

[09:02] Team_066 possession (Score: 70-54)
Brandon Reaves attempts a 3Pt. Contested by Jimmy Griffin (5.2 feet, MAN). Brandon Reaves misses. Rebound secured by Shai Mobley.

[08:47] Team_049 possession (Score: 70-54)
Ja Oladipo attempts a Layup. Contested by Kyle Wagner (4.1 feet, ZONE). JA OLADIPO MAKES IT!
Score: 70-56

[08:36] Team_066 possession (Score: 70-56)
Pau Curry throws a bad pass! Stolen by Ja Oladipo! TURNOVER! (live ball)

[08:26] Team_049 possession (Score: 70-56)
Ja Oladipo attempts a 3Pt. Contested by Pau Curry (5.7 feet, ZONE). JA OLADIPO MAKES IT! Assist: Jimmy Griffin
Score: 70-59

[08:11] Team_066 possession (Score: 70-59)
FOUL! Reach-in foul on Jimmy Griffin during the drive. [Team fouls: 2] No free throws, side out. (Jimmy Griffin: 1 personal fouls)

[07:54] Team_066 possession (Score: 70-59)
Yao Brogdon attempts a 3Pt. Contested by De'Aaron Allen (4.7 feet, MAN). Yao Brogdon misses. Rebound secured by Jimmy Griffin.

[07:39] Team_049 possession (Score: 70-59)
Shai Mobley attempts a Layup. Contested by Kyle Wagner (4.2 feet, ZONE). SHAI MOBLEY MAKES IT! Assist: Shai Bird
Score: 70-61

[07:26] Team_066 possession (Score: 70-61)
Brandon Reaves throws a bad pass! Stolen by Jimmy Griffin! TURNOVER! (live ball)

[07:14] Team_049 possession (Score: 70-61)
FOUL! Reach-in foul on Kyle Wagner during the drive. [Team fouls: 1] No free throws, side out. (Kyle Wagner: 1 personal fouls)

[07:02] Team_049 possession (Score: 70-61)
FOUL! Reach-in foul on Kyle Wagner during the drive. [Team fouls: 2] No free throws, side out. (Kyle Wagner: 2 personal fouls)

[06:48] Team_049 possession (Score: 70-61)
Jimmy Griffin attempts a 3Pt. Contested by Pau Curry (5.5 feet, ZONE). Jimmy Griffin misses. Rebound secured by Yao Brogdon.

[06:36] Team_066 possession (Score: 70-61)
Kyle Wagner drives, De'Aaron Allen stays with him. Kyle Wagner attempts a Layup. Contested by De'Aaron Allen (4.1 feet, ZONE). KYLE WAGNER MAKES IT!
Score: 72-61

[06:17] Team_049 possession (Score: 72-61)
De'Aaron Allen makes the Midrange and draws the foul on Yao Brogdon! And-1! De'Aaron Allen to the line for 1. [Team fouls: 3] (Yao Brogdon: 1 personal fouls)   FT 1/1: GOOD De'Aaron Allen makes 1/1 from the line.
Score: 72-64

[06:04] Team_066 possession (Score: 72-64)
Jimmy Davis makes the Layup and draws the foul on De'Aaron Allen! And-1! Jimmy Davis to the line for 1. [Team fouls: 3] (De'Aaron Allen: 2 personal fouls)   FT 1/1: GOOD Jimmy Davis makes 1/1 from the line.
Score: 75-64

[05:49] Team_049 possession (Score: 75-64)
Jimmy Griffin attempts a 3Pt. Contested by Pau Curry (5.6 feet, ZONE). JIMMY GRIFFIN MAKES IT!
Score: 75-67

[05:32] Team_066 possession (Score: 75-67)
Yao Brogdon attempts a 3Pt. Contested by Ja Oladipo (4.7 feet, ZONE). Yao Brogdon misses. Rebound secured by De'Aaron Allen.

[05:22] Team_049 possession (Score: 75-67)
Shai Mobley attempts a Layup. BLOCKED BY KYLE WAGNER! Ball is loose! Rebound secured by Kyle Wagner.

[05:05] Team_066 possession (Score: 75-67)
Yao Brogdon attempts a 3Pt. Contested by De'Aaron Allen (4.8 feet, MAN). Yao Brogdon misses. Rebound secured by Jimmy Griffin.

[04:52] Team_049 possession (Score: 75-67)
Jimmy Griffin attempts a 3Pt. Contested by Pau Curry (5.6 feet, ZONE). Jimmy Griffin misses. Offensive rebound by Shai Mobley! Shai Mobley puts it back in!
Score: 75-69

[04:36] Team_066 possession (Score: 75-69)
Jimmy Davis attempts a Midrange. Contested by Shai Bird (4.5 feet, MAN). Jimmy Davis misses. Rebound secured by De'Aaron Allen.

[04:23] Team_049 possession (Score: 75-69)
FOUL! Shooting foul on Kyle Wagner. Shai Bird to the line for 2 free throws. [Team fouls: 4] (Kyle Wagner: 3 personal fouls)   FT 1/2: GOOD   FT 2/2: GOOD Shai Bird makes 2/2 from the line.
Score: 75-71

[04:10] Team_066 possession (Score: 75-71)
Yao Brogdon attempts a Midrange. Contested by De'Aaron Allen (4.8 feet, MAN). Yao Brogdon misses. Rebound secured by Jimmy Griffin.

[03:58] Team_049 possession (Score: 75-71)
Shai Bird attempts a 3Pt. Contested by Jimmy Davis (4.6 feet, MAN). Shai Bird misses. Rebound secured by Kyle Wagner.

[03:45] Team_066 possession (Score: 75-71)
Yao Brogdon attempts a 3Pt. Contested by De'Aaron Allen (4.8 feet, MAN). YAO BROGDON MAKES IT! Assist: Kyle Wagner
Score: 78-71

[03:36] Team_049 possession (Score: 78-71)
Shai Bird drives, Kyle Wagner stays with him. Shai Bird attempts a Dunk. Contested by Kyle Wagner (4.5 feet, ZONE). Shai Bird misses. Offensive rebound by Shai Mobley! Shai Mobley puts it back in!
Score: 78-73

[03:23] Team_066 possession (Score: 78-73)
Yao Brogdon attempts a 3Pt. Contested by De'Aaron Allen (4.9 feet, ZONE). Yao Brogdon misses. Rebound secured by De'Aaron Allen.

[03:11] Team_049 possession (Score: 78-73)
Jimmy Griffin attempts a Layup. Contested by Brandon Reaves (5.3 feet, MAN). JIMMY GRIFFIN MAKES IT!
Score: 78-75

[02:56] Team_066 possession (Score: 78-75)
Yao Brogdon drives to the basket... Yao Brogdon loses the ball! Stripped by De'Aaron Allen! TURNOVER! (live ball)

[02:43] Team_049 possession (Score: 78-75)
Shai Bird attempts a 3Pt. Wide open! Pau Curry is 6.2 feet away. [ZONE] Shai Bird misses. Offensive rebound by De'Aaron Allen! De'Aaron Allen kicks it out.

[02:27] Team_049 possession (Score: 78-75)
Shai Mobley drives, Kyle Wagner stays with him. Shai Mobley attempts a Dunk. Contested by Kyle Wagner (4.5 feet, ZONE). SHAI MOBLEY MAKES IT!
Score: 78-77

[02:12] Team_066 possession (Score: 78-77)
FOUL! Holding foul on Shai Mobley. [Team fouls: 4] No free throws, side out. (Shai Mobley: 1 personal fouls)

[01:56] Team_066 possession (Score: 78-77)
Jimmy Davis attempts a 3Pt. Contested by Ja Oladipo (5.0 feet, ZONE). Jimmy Davis misses. Rebound secured by Jimmy Griffin.

[01:40] Team_049 possession (Score: 78-77)
FOUL! Shooting foul on Kyle Wagner. Jimmy Griffin to the line for 2 free throws. [BONUS: 5 team fouls] (Kyle Wagner: 4 personal fouls)   FT 1/2: GOOD   FT 2/2: GOOD Jimmy Griffin makes 2/2 from the line.
Score: 78-79

[01:30] Team_066 possession (Score: 78-79)
Brandon Reaves attempts a 3Pt. Contested by Ja Oladipo (5.1 feet, ZONE). Brandon Reaves misses. Rebound secured by De'Aaron Allen.

[01:21] Team_049 possession (Score: 78-79)
Shai Bird attempts a 3Pt. Contested by Jimmy Davis (4.9 feet, MAN). Shai Bird misses. Rebound secured by Yao Brogdon.

[01:01] Team_066 possession (Score: 78-79)
Kyle Wagner attempts a Midrange. Contested by Shai Mobley (4.6 feet, MAN). Kyle Wagner misses. Rebound secured by Jimmy Griffin.

[00:47] Team_049 possession (Score: 78-79)
Jimmy Griffin attempts a Midrange. Contested by Brandon Reaves (5.6 feet, MAN). Jimmy Griffin misses. Rebound secured by Kyle Wagner.

[00:29] Team_066 possession (Score: 78-79)
Jimmy Davis attempts a Midrange. Contested by Shai Bird (4.9 feet, MAN). Jimmy Davis misses. Rebound secured by Shai Mobley.

[00:10] Team_049 possession (Score: 78-79)
Shai Bird attempts a 3Pt. Contested by Jimmy Davis (5.0 feet, ZONE). Shai Bird misses. Offensive rebound by De'Aaron Allen! De'Aaron Allen kicks it out.

================================================================================
                              3RD QUARTER COMPLETE                              
================================================================================

3RD QUARTER SCORE: Team_066 15, Team_049 25

BOX SCORE:
================================================================================

Team_066
--------------------------------------------------------------------------------
Player                MIN  PTS  REB  AST  TO      FG   FG%      3P   3P%
--------------------------------------------------------------------------------
Yao Brogdon            27    6    3    0   0   2/8    25.0     0/0   0.0
Jimmy Davis            27    5    0    0   0   2/6    33.3     0/0   0.0
Kyle Wagner            27    2    7    1   0   1/3    33.3     0/0   0.0
Brandon Reaves         27    2    2    0   0   1/3    33.3     0/0   0.0

TEAM: FG: 6/20 (30.0%), 3PT: 1/10 (10.0%), REB: 12 (2 off, 10 def), AST: 1, TO: 3
TEAM FOULS: 5 [Team_049 in BONUS]


Team_049
--------------------------------------------------------------------------------
Player                MIN  PTS  REB  AST  TO      FG   FG%      3P   3P%
--------------------------------------------------------------------------------
Shai Mobley            27    8    6    0   0   4/6    66.7     0/0   0.0
Jimmy Griffin          27    7    6    1   0   3/7    42.9     0/0   0.0
Ja Oladipo             27    5    0    0   0   2/3    66.7     0/0   0.0
De'Aaron Allen         27    3    6    0   0   1/1   100.0     0/0   0.0
Shai Bird              27    2    0    1   0   1/4    25.0     0/0   0.0

TEAM: FG: 11/21 (52.4%), 3PT: 3/10 (30.0%), REB: 18 (4 off, 14 def), AST: 2, TO: 1
TEAM FOULS: 4

================================================================================

================================================================================
                       4TH QUARTER - Team_066 vs Team_049                       
================================================================================

[12:00] Team_066 possession (Score: 78-79)
Jimmy Davis attempts a 3Pt. Contested by Shai Bird (4.7 feet, MAN). Jimmy Davis misses. Rebound secured by De'Aaron Allen.

[11:47] Team_049 possession (Score: 78-79)
Shai Mobley drives, Kyle Wagner stays with him. Shai Mobley attempts a Dunk. Contested by Kyle Wagner (4.5 feet, MAN). SHAI MOBLEY MAKES IT! Assist: De'Aaron Allen
Score: 78-81

[11:37] Team_066 possession (Score: 78-81)
Kyle Wagner attempts a Layup. BLOCKED BY SHAI MOBLEY! Ball is loose! Rebound secured by Jimmy Griffin.

[11:22] Team_049 possession (Score: 78-81)
De'Aaron Allen attempts a 3Pt. Contested by Yao Brogdon (5.4 feet, MAN). De'Aaron Allen misses. Rebound secured by Brandon Reaves.

[11:08] Team_066 possession (Score: 78-81)
Yao Brogdon attempts a 3Pt. Contested by De'Aaron Allen (5.1 feet, ZONE). Yao Brogdon misses. Rebound secured by Shai Mobley.

[10:54] Team_049 possession (Score: 78-81)
Ja Oladipo throws a bad pass! Stolen by Pau Curry! TURNOVER! (live ball)

[10:40] Team_066 possession (Score: 78-81)
Yao Brogdon attempts a 3Pt. Contested by Ja Oladipo (5.1 feet, ZONE). Yao Brogdon misses. Rebound secured by De'Aaron Allen.

[10:29] Team_049 possession (Score: 78-81)
Shai Mobley makes the Midrange and draws the foul on Kyle Wagner! And-1! Shai Mobley to the line for 1. [Team fouls: 1] (Kyle Wagner: 1 personal fouls)   FT 1/1: GOOD Shai Mobley makes 1/1 from the line.
Score: 78-84

[10:14] Team_066 possession (Score: 78-84)
Yao Brogdon attempts a 3Pt. Contested by De'Aaron Allen (5.2 feet, MAN). YAO BROGDON MAKES IT! Assist: Kyle Wagner
Score: 81-84

[10:01] Team_049 possession (Score: 81-84)
Jimmy Griffin attempts a 3Pt. Contested by Brandon Reaves (5.6 feet, MAN). Jimmy Griffin misses. Offensive rebound by De'Aaron Allen! De'Aaron Allen kicks it out.

[09:47] Team_049 possession (Score: 81-84)
Jimmy Griffin attempts a 3Pt. Wide open! Pau Curry is 6.1 feet away. [ZONE] Jimmy Griffin misses. Rebound secured by Brandon Reaves.

[09:34] Team_066 possession (Score: 81-84)
Pau Curry drives, picks up Ja Oladipo. Help arrives from Jimmy Griffin! Pau Curry attempts a Layup. Contested by Jimmy Griffin (5.1 feet, MAN). Pau Curry misses. Rebound secured by Shai Mobley.

[09:21] Team_049 possession (Score: 81-84)
De'Aaron Allen drives, Yao Brogdon stays with him. De'Aaron Allen attempts a Layup. Contested by Yao Brogdon (5.6 feet, MAN). De'Aaron Allen misses. Rebound secured by Brandon Reaves.

[09:12] Team_066 possession (Score: 81-84)
Brandon Reaves attempts a 3Pt. Contested by Jimmy Griffin (5.8 feet, MAN). Brandon Reaves misses. Rebound secured by Jimmy Griffin.

[08:58] Team_049 possession (Score: 81-84)
Ja Oladipo drives, picks up Pau Curry. Help arrives from Jimmy Davis! Ja Oladipo attempts a Dunk. Wide open! Jimmy Davis is 6.3 feet away. [MAN] JA OLADIPO MAKES IT!
Score: 81-86

[08:39] Team_066 possession (Score: 81-86)
Pau Curry attempts a 3Pt. Contested by Jimmy Griffin (5.7 feet, ZONE). Pau Curry misses. Rebound secured by Jimmy Griffin.

[08:26] Team_049 possession (Score: 81-86)
Shai Mobley attempts a Midrange. Contested by Kyle Wagner (5.0 feet, MAN). Shai Mobley misses. Rebound secured by Brandon Reaves.

[08:15] Team_066 possession (Score: 81-86)
Kyle Wagner attempts a Layup. Contested by Shai Mobley (4.9 feet, ZONE). Kyle Wagner misses. Rebound secured by Jimmy Griffin.

[08:05] Team_049 possession (Score: 81-86)
Ja Oladipo drives and kicks out. Shai Bird attempts a 3Pt. Wide open! Pau Curry is 6.4 feet away. [ZONE] Shai Bird misses. Rebound secured by Kyle Wagner.

[07:47] Team_066 possession (Score: 81-86)
Yao Brogdon drives and kicks out. Brandon Reaves attempts a Midrange. Contested by Jimmy Griffin (5.7 feet, MAN). Brandon Reaves misses. Rebound secured by Jimmy Griffin.

[07:33] Team_049 possession (Score: 81-86)
Shai Bird drives, Jimmy Davis stays with him. Shai Bird attempts a Layup. Contested by Jimmy Davis (5.4 feet, MAN). SHAI BIRD MAKES IT! Assist: Shai Mobley
Score: 81-88

[07:19] Team_066 possession (Score: 81-88)
Pau Curry attempts a Layup. BLOCKED BY JA OLADIPO! Ball is loose! Offensive rebound by Kyle Wagner! Kyle Wagner kicks it out.

[07:06] Team_066 possession (Score: 81-88)
Jimmy Davis attempts a 3Pt. Contested by Ja Oladipo (5.6 feet, ZONE). Jimmy Davis misses. Rebound secured by Shai Mobley.

[06:49] Team_049 possession (Score: 81-88)
Shai Mobley drives and kicks out. Shai Mobley attempts a 3Pt. Wide open! Pau Curry is 6.5 feet away. [ZONE] Shai Mobley misses. FOUL! Loose ball foul on Brandon Reaves during the rebound battle. [Team fouls: 2] No free throws, side out. (Brandon Reaves: 1 personal fouls)

[06:33] Team_049 possession (Score: 81-88)
Shai Bird drives, Kyle Wagner stays with him. Shai Bird attempts a Layup. Contested by Kyle Wagner (5.3 feet, ZONE). SHAI BIRD MAKES IT! Assist: Jimmy Griffin
Score: 81-90

[06:18] Team_066 possession (Score: 81-90)
Pau Curry drives, De'Aaron Allen stays with him. Pau Curry attempts a Layup. Contested by De'Aaron Allen (5.5 feet, ZONE). PAU CURRY MAKES IT! Assist: Yao Brogdon
Score: 83-90

[06:03] Team_049 possession (Score: 83-90)
Ja Oladipo attempts a 3Pt. Wide open! Pau Curry is 6.7 feet away. [ZONE] JA OLADIPO MAKES IT! Assist: Jimmy Griffin
Score: 83-93

[05:51] Team_066 possession (Score: 83-93)
Kyle Wagner attempts a 3Pt. Contested by Ja Oladipo (5.3 feet, ZONE). Kyle Wagner misses. Offensive rebound by Kyle Wagner! Kyle Wagner kicks it out.

[05:41] Team_066 possession (Score: 83-93)
Kyle Wagner drives, Shai Mobley stays with him. Kyle Wagner attempts a Layup. Contested by Shai Mobley (5.3 feet, MAN). KYLE WAGNER MAKES IT! Assist: Jimmy Davis
Score: 85-93

[05:28] Team_049 possession (Score: 85-93)
Shai Mobley attempts a 3Pt. Wide open! Pau Curry is 6.8 feet away. [ZONE] Shai Mobley misses. Rebound secured by Brandon Reaves.

[05:17] Team_066 possession (Score: 85-93)
Jimmy Davis drives, picks up De'Aaron Allen. Help arrives from Ja Oladipo! Jimmy Davis attempts a Dunk. Contested by Ja Oladipo (5.7 feet, ZONE). Jimmy Davis misses. Rebound secured by Shai Mobley.

[05:00] Team_049 possession (Score: 85-93)
FOUL! Offensive foul on Shai Bird! Jimmy Davis drew the charge! [Team fouls: 1] (Shai Bird: 1 personal fouls) TURNOVER! (dead ball)

[04:45] Team_066 possession (Score: 85-93)
Pau Curry attempts a Midrange. Contested by Shai Bird (5.7 feet, ZONE). PAU CURRY MAKES IT! Assist: Brandon Reaves
Score: 87-93

[04:35] Team_049 possession (Score: 87-93)
Shai Bird attempts a 3Pt. Contested by Jimmy Davis (5.9 feet, MAN). Shai Bird misses. Rebound secured by Yao Brogdon.

[04:20] Team_066 possession (Score: 87-93)
Kyle Wagner drives and kicks out. Brandon Reaves attempts a 3Pt. Wide open! Jimmy Griffin is 6.3 feet away. [MAN] Brandon Reaves misses. Rebound secured by Jimmy Griffin.

[04:04] Team_049 possession (Score: 87-93)
FOUL! Reach-in foul on Kyle Wagner during the drive. [Team fouls: 3] No free throws, side out. (Kyle Wagner: 2 personal fouls)

[03:50] Team_049 possession (Score: 87-93)
FOUL! Reach-in foul on Yao Brogdon during the drive. [Team fouls: 4] No free throws, side out. (Yao Brogdon: 1 personal fouls)

[03:40] Team_049 possession (Score: 87-93)
De'Aaron Allen attempts a Layup. Contested by Kyle Wagner (5.3 feet, ZONE). De'Aaron Allen misses. Rebound secured by Kyle Wagner.

[03:26] Team_066 possession (Score: 87-93)
Brandon Reaves throws a bad pass out of bounds! TURNOVER! (dead ball)

[03:26] Substitution (Team_066): Jimmy Davis OUT → Pascal Carter IN (stamina_rule2)

[03:26] Substitution (Team_066): Pau Curry OUT → Lauri LaVine IN (stamina_rule2)

[03:26] Substitution (Team_066): Brandon Reaves OUT → Brandon Middleton IN (stamina_rule2)

[03:26] Substitution (Team_066): Yao Brogdon OUT → Cole Morant IN (stamina_rule2)

[03:26] Substitution (Team_066): Kyle Wagner OUT → Donovan Simmons IN (stamina_rule2)

[03:26] Substitution (Team_049): Shai Bird OUT → Shaquille Lillard IN (stamina_rule2)

[03:26] Substitution (Team_049): Ja Oladipo OUT → Shai Jordan IN (stamina_rule2)

[03:26] Substitution (Team_049): Jimmy Griffin OUT → Desmond Towns IN (stamina_rule2)

[03:26] Substitution (Team_049): De'Aaron Allen OUT → Giannis Anunoby IN (stamina_rule2)

[03:26] Substitution (Team_049): Shai Mobley OUT → Miles Jackson IN (stamina_rule2)

[03:09] Team_049 possession (Score: 87-93)
Shai Jordan attempts a 3Pt. Contested by Lauri LaVine (4.0 feet, ZONE). Shai Jordan misses. Rebound secured by Lauri LaVine.

[02:56] Team_066 possession (Score: 87-93)
Lauri LaVine drives, picks up Shai Jordan. Help arrives from Desmond Towns! Lauri LaVine attempts a Layup. Wide open! Desmond Towns is 6.3 feet away. [MAN] Lauri LaVine misses. Rebound secured by Giannis Anunoby.

[02:39] Team_049 possession (Score: 87-93)
Shai Jordan attempts a 3Pt. Contested by Lauri LaVine (4.0 feet, ZONE). Shai Jordan misses. Rebound secured by Lauri LaVine.

[02:23] Team_066 possession (Score: 87-93)
Brandon Middleton makes the Dunk and draws the foul on Shai Jordan! And-1! Brandon Middleton to the line for 1. [Team fouls: 2] (Shai Jordan: 1 personal fouls)   FT 1/1: GOOD Brandon Middleton makes 1/1 from the line.
Score: 90-93

[02:09] Team_049 possession (Score: 90-93)
Desmond Towns attempts a 3Pt. Contested by Cole Morant (5.6 feet, ZONE). Desmond Towns misses. Rebound secured by Donovan Simmons.

[01:57] Team_066 possession (Score: 90-93)
FOUL! Reach-in foul on Desmond Towns during the drive. [Team fouls: 3] No free throws, side out. (Desmond Towns: 1 personal fouls)

[01:42] Team_066 possession (Score: 90-93)
Brandon Middleton attempts a Layup. Contested by Miles Jackson (3.2 feet, ZONE). BRANDON MIDDLETON MAKES IT!
Score: 92-93

[01:29] Team_049 possession (Score: 92-93)
Desmond Towns attempts a Layup. Contested by Donovan Simmons (5.0 feet, ZONE). Desmond Towns misses. Rebound secured by Donovan Simmons.

[01:19] Team_066 possession (Score: 92-93)
Pascal Carter attempts a Midrange. Contested by Desmond Towns (4.7 feet, ZONE). Pascal Carter misses. Rebound secured by Miles Jackson.

[01:03] Team_049 possession (Score: 92-93)
Shaquille Lillard attempts a 3Pt. Contested by Lauri LaVine (4.1 feet, ZONE). Shaquille Lillard misses. Rebound secured by Lauri LaVine.

[00:45] Team_066 possession (Score: 92-93)
Lauri LaVine attempts a 3Pt. Contested by Shaquille Lillard (4.7 feet, ZONE). Lauri LaVine misses. Offensive rebound by Donovan Simmons! Donovan Simmons kicks it out.

[00:31] Team_066 possession (Score: 92-93)
Cole Morant drives to the basket... Cole Morant throws a bad pass! Stolen by Giannis Anunoby! TURNOVER! (live ball)

[00:16] Team_049 possession (Score: 92-93)
Miles Jackson drives and kicks out. Shaquille Lillard attempts a 3Pt. Wide open! Pascal Carter is 6.7 feet away. [MAN] SHAQUILLE LILLARD MAKES IT! Assist: Shai Jordan
Score: 92-96

[00:02] Team_066 possession (Score: 92-96)
Donovan Simmons attempts a Midrange. Contested by Shaquille Lillard (4.6 feet, ZONE). DONOVAN SIMMONS MAKES IT!
Score: 94-96

================================================================================
                              4TH QUARTER COMPLETE                              
================================================================================

4TH QUARTER SCORE: Team_066 16, Team_049 17

BOX SCORE:
================================================================================

Team_066
--------------------------------------------------------------------------------
Player                MIN  PTS  REB  AST  TO      FG   FG%      3P   3P%
--------------------------------------------------------------------------------
Brandon Middleton      13    5    0    0   0   2/2   100.0     0/0   0.0
Pau Curry              36    4    0    0   0   2/4    50.0     0/0   0.0
Yao Brogdon            36    3    1    1   0   1/4    25.0     0/0   0.0
Kyle Wagner            36    2    4    1   0   1/4    25.0     0/0   0.0
Donovan Simmons        13    2    3    0   0   1/1   100.0     0/0   0.0
Jimmy Davis            36    0    0    1   0   0/3     0.0     0/0   0.0
Brandon Reaves         36    0    5    1   0   0/1     0.0     0/0   0.0
Lauri LaVine           13    0    3    0   0   0/1     0.0     0/0   0.0
Pascal Carter          13    0    0    0   0   0/1     0.0     0/0   0.0

TEAM: FG: 7/21 (33.3%), 3PT: 1/7 (14.3%), REB: 16 (3 off, 13 def), AST: 4, TO: 2
TEAM FOULS: 4


Team_049
--------------------------------------------------------------------------------
Player                MIN  PTS  REB  AST  TO      FG   FG%      3P   3P%
--------------------------------------------------------------------------------
Shai Mobley            36    5    4    1   0   2/4    50.0     0/0   0.0
Ja Oladipo             36    5    0    0   0   2/3    66.7     0/0   0.0
Shai Bird              36    4    0    0   0   2/3    66.7     0/0   0.0
Shaquille Lillard      13    3    0    0   0   1/2    50.0     0/0   0.0
De'Aaron Allen         36    0    4    1   0   0/3     0.0     0/0   0.0
Jimmy Griffin          36    0    6    2   0   0/1     0.0     0/0   0.0
Shai Jordan            13    0    0    1   0   0/2     0.0     0/0   0.0
Giannis Anunoby        13    0    1    0   0   0/0     0.0     0/0   0.0
Desmond Towns          13    0    0    0   0   0/2     0.0     0/0   0.0
Miles Jackson          13    0    1    0   0   0/0     0.0     0/0   0.0

TEAM: FG: 7/20 (35.0%), 3PT: 1/9 (11.1%), REB: 16 (2 off, 14 def), AST: 5, TO: 2
TEAM FOULS: 3

================================================================================

================================================================================
                               FULL GAME COMPLETE                               
================================================================================

FINAL SCORE: Team_066 94, Team_049 96

SCORING BY QUARTER:
--------------------------------------------------------------------------------
Team                     Q1     Q2     Q3     Q4    FINAL
--------------------------------------------------------------------------------
Team_066                 30     33     15     16       94
Team_049                 27     27     25     17       96
--------------------------------------------------------------------------------

FULL GAME BOX SCORE:
================================================================================

Team_066
--------------------------------------------------------------------------------
Player                MIN  PTS  REB  AST  TO      FG   FG%      3P   3P%      FT STL BLK
--------------------------------------------------------------------------------
Jimmy Davis            36   14    0    2   2   5/15   33.3   2/7    28.6   3/4     0   1
Pau Curry              36    9    0    2   1   4/7    57.1   1/3    33.3   0/0     1   0
Brandon Reaves         36   13   11    1   2   5/12   41.7   2/9    22.2   1/1     0   0
Yao Brogdon            36   14    4    2   0   5/15   33.3   2/10   20.0   2/2     0   0
Kyle Wagner            36    9   15    4   4   4/10   40.0   0/0     0.0   1/1     1   1
Pascal Carter          13    2    0    1   1   1/3    33.3   0/0     0.0   0/0     0   0
Lauri LaVine           13    9    7    1   1   4/6    66.7   1/1   100.0   2/2     0   0
Brandon Middleton      13   11    4    1   0   4/4   100.0   2/2   100.0   4/4     0   0
Cole Morant            13    6    0    0   1   2/3    66.7   1/2    50.0   1/1     0   0
Donovan Simmons        13    6    3    1   0   3/5    60.0   0/1     0.0   2/2     0   1

TEAM: FG: 37/80 (46.2%), 3PT: 11/35 (31.4%), REB: 44 (5 off, 39 def), AST: 15, TO: 12


Team_049
--------------------------------------------------------------------------------
Player                MIN  PTS  REB  AST  TO      FG   FG%      3P   3P%      FT STL BLK
--------------------------------------------------------------------------------
Shai Bird              36   14    0    1   1   7/12   58.3   1/5    20.0   3/3     0   0
Ja Oladipo             36   16    0    1   3   7/10   70.0   3/5    60.0   1/1     1   1
Jimmy Griffin          36   16   19    4   0   8/15   53.3   4/9    44.4   5/6     1   0
De'Aaron Allen         36   14   13    4   2   4/8    50.0   1/3    33.3   5/5     1   0
Shai Mobley            36   15   14    5   0   6/14   42.9   0/3     0.0   1/1     2   1
Shaquille Lillard      13    3    0    2   0   0/1     0.0   0/1     0.0   0/0     0   0
Shai Jordan            13    2    5    1   1   2/5    40.0   0/3     0.0   0/0     0   0
Desmond Towns          13    2    0    1   0   1/5    20.0   0/2     0.0   0/0     0   0
Giannis Anunoby        13    5    2    2   1   1/3    33.3   0/0     0.0   0/0     2   0
Miles Jackson          13    9    2    0   0   5/9    55.6   0/1     0.0   1/1     0   0

TEAM: FG: 41/82 (50.0%), 3PT: 9/32 (28.1%), REB: 55 (12 off, 43 def), AST: 21, TO: 8

================================================================================
