================================================================================
                        FULL GAME - Team_064 vs Team_034                        
================================================================================

================================================================================
                       1ST QUARTER - Team_064 vs Team_034                       
================================================================================

[12:00] Team_064 possession (Score: 0-0)
Kawhi Irving attempts a 3Pt. Contested by Cole Antetokounmpo (4.4 feet, MAN). Kawhi Irving misses. Rebound secured by Cole Antetokounmpo.

[11:47] Team_034 possession (Score: 0-0)
Anthony Bane attempts a Midrange. Contested by Shai Hyland (5.1 feet, MAN). ANTHONY BANE MAKES IT! Assist: Ben Hyland
Score: 0-2

[11:30] Team_064 possession (Score: 0-2)
Ja Mitchell attempts a Midrange. Contested by Terry Doncic (4.3 feet, ZONE). Ja Mitchell misses. Rebound secured by Terry Doncic.

[11:13] Team_034 possession (Score: 0-2)
Cole Antetokounmpo makes the Layup and draws the foul on Jordan Mitchell! And-1! Cole Antetokounmpo to the line for 1. [Team fouls: 1] (Jordan Mitchell: 1 personal fouls)   FT 1/1: GOOD Cole Antetokounmpo makes 1/1 from the line.
Score: 0-5

[10:59] Team_064 possession (Score: 0-5)
Shai Hyland attempts a 3Pt. Contested by Devin Poole (4.2 feet, ZONE). Shai Hyland misses. Rebound secured by Anthony Bane.

[10:50] Team_034 possession (Score: 0-5)
Terry Doncic attempts a 3Pt. Contested by Ja Mitchell (5.2 feet, ZONE). Terry Doncic misses. Rebound secured by Shai Hyland.

[10:40] Team_064 possession (Score: 0-5)
Shai Hyland throws a bad pass out of bounds! TURNOVER! (dead ball)

[10:25] Team_034 possession (Score: 0-5)
Devin Poole attempts a 3Pt. Contested by Ja Mitchell (5.1 feet, ZONE). Devin Poole misses. Rebound secured by Kawhi Irving.

[10:11] Team_064 possession (Score: 0-5)
Ja Mitchell attempts a 3Pt. Contested by Devin Poole (4.2 feet, MAN). Ja Mitchell misses. Offensive rebound by Kawhi Irving! Kawhi Irving kicks it out.

[09:55] Team_064 possession (Score: 0-5)
Jordan Mitchell attempts a Midrange. Contested by Ben Hyland (3.1 feet, ZONE). Jordan Mitchell misses. Rebound secured by Cole Antetokounmpo.

[09:43] Team_034 possession (Score: 0-5)
Terry Doncic attempts a 3Pt. Contested by Ja Mitchell (5.2 feet, ZONE). Terry Doncic misses. FOUL! Loose ball foul on Shai Hyland during the rebound battle. [Team fouls: 2] No free throws, side out. (Shai Hyland: 1 personal fouls)

[09:24] Team_034 possession (Score: 0-5)
Cole Antetokounmpo drives and kicks out. Ben Hyland attempts a 3Pt. Contested by Ja Mitchell (5.1 feet, ZONE). Ben Hyland misses. Rebound secured by Russell Simons.

[09:09] Team_064 possession (Score: 0-5)
FOUL! Holding foul on Cole Antetokounmpo. [Team fouls: 1] No free throws, side out. (Cole Antetokounmpo: 1 personal fouls)

[08:57] Team_064 possession (Score: 0-5)
Russell Simons attempts a Midrange. Contested by Terry Doncic (4.2 feet, ZONE). Russell Simons misses. Rebound secured by Terry Doncic.

[08:43] Team_034 possession (Score: 0-5)
Ben Hyland attempts a Midrange. Contested by Jordan Mitchell (3.9 feet, ZONE). Ben Hyland misses. Rebound secured by Shai Hyland.

[08:24] Team_064 possession (Score: 0-5)
Shai Hyland attempts a Midrange. Contested by Anthony Bane (5.5 feet, MAN). SHAI HYLAND MAKES IT! Assist: Jordan Mitchell
Score: 2-5

[08:05] Team_034 possession (Score: 2-5)
Terry Doncic makes the Dunk and draws the foul on Russell Simons! And-1! Terry Doncic to the line for 1. [Team fouls: 3] (Russell Simons: 1 personal fouls)   FT 1/1: GOOD Terry Doncic makes 1/1 from the line.
Score: 2-8

[07:52] Team_064 possession (Score: 2-8)
Jordan Mitchell attempts a Layup. Contested by Ben Hyland (3.1 feet, MAN). JORDAN MITCHELL MAKES IT! Assist: Russell Simons
Score: 4-8

[07:36] Team_034 possession (Score: 4-8)
Terry Doncic makes the Midrange and draws the foul on Jordan Mitchell! And-1! Terry Doncic to the line for 1. [Team fouls: 4] (Jordan Mitchell: 2 personal fouls)   FT 1/1: GOOD Terry Doncic makes 1/1 from the line.
Score: 4-11

[07:21] Team_064 possession (Score: 4-11)
Jordan Mitchell attempts a Layup. Contested by Terry Doncic (3.6 feet, ZONE). Jordan Mitchell misses. Offensive rebound by Kawhi Irving! Kawhi Irving kicks it out.

[07:06] Team_064 possession (Score: 4-11)
Russell Simons attempts a Midrange. Contested by Cole Antetokounmpo (4.6 feet, ZONE). RUSSELL SIMONS MAKES IT! Assist: Ja Mitchell
Score: 6-11

[06:50] Team_034 possession (Score: 6-11)
Terry Doncic drives, picks up Russell Simons. Help arrives from Jordan Mitchell! Terry Doncic attempts a Layup. Contested by Jordan Mitchell (3.3 feet, ZONE). TERRY DONCIC MAKES IT! Assist: Devin Poole
Score: 6-13

[06:38] Team_064 possession (Score: 6-13)
Ja Mitchell attempts a Midrange. Contested by Terry Doncic (4.3 feet, ZONE). Ja Mitchell misses. Rebound secured by Cole Antetokounmpo.

[06:22] Team_034 possession (Score: 6-13)
FOUL! Shooting foul on Shai Hyland. Anthony Bane to the line for 2 free throws. [BONUS: 5 team fouls] (Shai Hyland: 2 personal fouls)   FT 1/2: GOOD   FT 2/2: GOOD Anthony Bane makes 2/2 from the line.
Score: 6-15

[06:07] Team_064 possession (Score: 6-15)
Ja Mitchell attempts a Midrange. Contested by Terry Doncic (4.3 feet, ZONE). Ja Mitchell misses. Rebound secured by Terry Doncic.

[05:53] Team_034 possession (Score: 6-15)
Cole Antetokounmpo drives and kicks out. Anthony Bane makes the Midrange and draws the foul on Russell Simons! And-1! Anthony Bane to the line for 1. [BONUS: 6 team fouls] (Russell Simons: 2 personal fouls)   FT 1/1: GOOD Anthony Bane makes 1/1 from the line.
Score: 6-18

[05:41] Team_064 possession (Score: 6-18)
Ja Mitchell drives to the basket... Ja Mitchell commits a violation (traveling/carry)! TURNOVER! (dead ball)

[05:26] Team_034 possession (Score: 6-18)
Anthony Bane attempts a Layup. Contested by Russell Simons (3.4 feet, ZONE). Anthony Bane misses. Rebound secured by Shai Hyland.

[05:16] Team_064 possession (Score: 6-18)
Shai Hyland drives, picks up Anthony Bane. Help arrives from Ben Hyland! Shai Hyland attempts a Dunk. Contested by Ben Hyland (5.5 feet, ZONE). SHAI HYLAND MAKES IT! Assist: Russell Simons
Score: 8-18

[05:05] Team_034 possession (Score: 8-18)
Devin Poole attempts a 3Pt. Contested by Ja Mitchell (5.1 feet, MAN). Devin Poole misses. Rebound secured by Kawhi Irving.

[04:54] Team_064 possession (Score: 8-18)
Shai Hyland attempts a Midrange. Contested by Terry Doncic (4.4 feet, ZONE). Shai Hyland misses. Rebound secured by Terry Doncic.

[04:42] Team_034 possession (Score: 8-18)
Ben Hyland attempts a 3Pt. Contested by Jordan Mitchell (4.0 feet, MAN). BEN HYLAND MAKES IT! Assist: Cole Antetokounmpo
Score: 8-21

[04:31] Team_064 possession (Score: 8-21)
Russell Simons attempts a 3Pt. Contested by Devin Poole (4.1 feet, ZONE). RUSSELL SIMONS MAKES IT! Assist: Kawhi Irving
Score: 11-21

[04:14] Team_034 possession (Score: 11-21)
Devin Poole attempts a 3Pt. Contested by Ja Mitchell (5.2 feet, MAN). Devin Poole misses. Rebound secured by Shai Hyland.

[03:55] Team_064 possession (Score: 11-21)
Russell Simons makes the Layup and draws the foul on Terry Doncic! And-1! Russell Simons to the line for 1. [Team fouls: 2] (Terry Doncic: 1 personal fouls)   FT 1/1: GOOD Russell Simons makes 1/1 from the line.
Score: 14-21

[03:42] Team_034 possession (Score: 14-21)
Cole Antetokounmpo attempts a 3Pt. Contested by Kawhi Irving (4.9 feet, MAN). Cole Antetokounmpo misses. Rebound secured by Shai Hyland.

[03:24] Team_064 possession (Score: 14-21)
Kawhi Irving makes the Midrange and draws the foul on Cole Antetokounmpo! And-1! Kawhi Irving to the line for 1. [Team fouls: 3] (Cole Antetokounmpo: 2 personal fouls)   FT 1/1: GOOD Kawhi Irving makes 1/1 from the line.
Score: 17-21

[03:07] Team_034 possession (Score: 17-21)
Terry Doncic attempts a Midrange. Contested by Jordan Mitchell (4.1 feet, ZONE). Terry Doncic misses. Rebound secured by Russell Simons.

[02:54] Team_064 possession (Score: 17-21)
Ja Mitchell attempts a Midrange. Contested by Ben Hyland (4.0 feet, ZONE). Ja Mitchell misses. Rebound secured by Anthony Bane.

[02:40] Team_034 possession (Score: 17-21)
Anthony Bane attempts a Layup. BLOCKED BY RUSSELL SIMONS! Ball goes out off Russell Simons. Anthony Bane's ball!

[02:24] Team_034 possession (Score: 17-21)
Anthony Bane attempts a Midrange. Contested by Shai Hyland (5.4 feet, MAN). Anthony Bane misses. Rebound secured by Kawhi Irving.

[02:11] Team_064 possession (Score: 17-21)
Jordan Mitchell attempts a Midrange. Contested by Anthony Bane (5.0 feet, ZONE). Jordan Mitchell misses. Rebound secured by Cole Antetokounmpo.

[01:54] Team_034 possession (Score: 17-21)
Devin Poole attempts a 3Pt. Contested by Ja Mitchell (5.4 feet, MAN). Devin Poole misses. Rebound secured by Russell Simons.

[01:41] Team_064 possession (Score: 17-21)
Ja Mitchell attempts a 3Pt. Contested by Devin Poole (4.6 feet, ZONE). Ja Mitchell misses. Rebound secured by Terry Doncic.

[01:25] Team_034 possession (Score: 17-21)
FOUL! Reach-in foul on Russell Simons during the drive. [IN THE BONUS! 7 team fouls] Anthony Bane to the line for 2 free throws. (Russell Simons: 3 personal fouls)   FT 1/2: GOOD   FT 2/2: GOOD Anthony Bane makes 2/2 from the line.
Score: 17-23

[01:11] Team_064 possession (Score: 17-23)
Russell Simons attempts a Layup. Contested by Terry Doncic (4.5 feet, ZONE). Russell Simons misses. Rebound secured by Terry Doncic.

[00:58] Team_034 possession (Score: 17-23)
Terry Doncic attempts a 3Pt. Contested by Russell Simons (3.9 feet, MAN). Terry Doncic misses. Offensive rebound by Anthony Bane! Anthony Bane kicks it out.

[00:45] Team_034 possession (Score: 17-23)
FOUL! Offensive foul on Terry Doncic! Russell Simons drew the charge! [Team fouls: 4] (Terry Doncic: 2 personal fouls) TURNOVER! (dead ball)

[00:34] Team_064 possession (Score: 17-23)
Jordan Mitchell attempts a 3Pt. Contested by Terry Doncic (4.1 feet, ZONE). JORDAN MITCHELL MAKES IT!
Score: 20-23

[00:15] Team_034 possession (Score: 20-23)
Cole Antetokounmpo attempts a 3Pt. Wide open! Ja Mitchell is 6.1 feet away. [ZONE] Cole Antetokounmpo misses. Rebound secured by Russell Simons.

[00:03] Team_064 possession (Score: 20-23)
Jordan Mitchell attempts a 3Pt. Contested by Ben Hyland (3.7 feet, MAN). Jordan Mitchell misses. FOUL! Loose ball foul on Anthony Bane during the rebound battle. [IN THE BONUS! 5 team fouls] Kawhi Irving to the line for 2 free throws. (Anthony Bane: 1 personal fouls)   FT 1/2: GOOD   FT 2/2: GOOD Kawhi Irving makes 2/2 from the line.
Score: 22-23

================================================================================
                              1ST QUARTER COMPLETE                              
================================================================================

1ST QUARTER SCORE: Team_064 22, Team_034 23

BOX SCORE:
================================================================================

Team_064
--------------------------------------------------------------------------------
Player                MIN  PTS  REB  AST  TO      FG   FG%      3P   3P%
--------------------------------------------------------------------------------
Russell Simons         12    8    4    2   0   3/5    60.0     0/0   0.0
Kawhi Irving           12    5    5    1   0   2/3    66.7     0/0   0.0
Jordan Mitchell        12    5    0    1   0   2/4    50.0     0/0   0.0
Shai Hyland            12    4    5    0   0   2/4    50.0     0/0   0.0
Ja Mitchell            12    0    0    1   0   0/5     0.0     0/0   0.0

TEAM: FG: 9/21 (42.9%), 3PT: 3/6 (50.0%), REB: 14 (2 off, 12 def), AST: 5, TO: 2
TEAM FOULS: 7 [Team_034 in BONUS]


Team_034
--------------------------------------------------------------------------------
Player                MIN  PTS  REB  AST  TO      FG   FG%      3P   3P%
--------------------------------------------------------------------------------
Anthony Bane           12    9    4    0   0   4/6    66.7     0/0   0.0
Terry Doncic           12    8    6    0   0   3/5    60.0     0/0   0.0
Cole Antetokounmpo     12    3    4    1   0   1/4    25.0     0/0   0.0
Ben Hyland             12    3    0    1   0   1/2    50.0     0/0   0.0
Devin Poole            12    0    0    1   0   0/4     0.0     0/0   0.0

TEAM: FG: 9/21 (42.9%), 3PT: 1/8 (12.5%), REB: 14 (2 off, 12 def), AST: 3, TO: 1
TEAM FOULS: 5 [Team_064 in BONUS]

================================================================================

================================================================================
                       2ND QUARTER - Team_064 vs Team_034                       
================================================================================

[12:00] Team_064 possession (Score: 22-23)
Shai Hyland attempts a Layup. Contested by Anthony Bane (5.7 feet, MAN). SHAI HYLAND MAKES IT!
Score: 24-23

[11:45] Team_034 possession (Score: 24-23)
FOUL! Holding foul on Jordan Mitchell. [Team fouls: 1] No free throws, side out. (Jordan Mitchell: 1 personal fouls)

[11:31] Team_034 possession (Score: 24-23)
Terry Doncic attempts a 3Pt. Contested by Russell Simons (3.9 feet, MAN). TERRY DONCIC MAKES IT! Assist: Cole Antetokounmpo
Score: 24-26

[11:14] Team_064 possession (Score: 24-26)
Kawhi Irving attempts a Midrange. Contested by Terry Doncic (4.4 feet, ZONE). Kawhi Irving misses. Offensive rebound by Kawhi Irving! Kawhi Irving kicks it out.

[11:02] Team_064 possession (Score: 24-26)
Shai Hyland attempts a 3Pt. Contested by Terry Doncic (4.8 feet, ZONE). Shai Hyland misses. FOUL! Loose ball foul on Anthony Bane during the rebound battle. [Team fouls: 1] No free throws, side out. (Anthony Bane: 1 personal fouls)

[10:50] Team_064 possession (Score: 24-26)
Jordan Mitchell attempts a 3Pt. Contested by Ben Hyland (3.6 feet, MAN). JORDAN MITCHELL MAKES IT! Assist: Shai Hyland
Score: 27-26

[10:31] Team_034 possession (Score: 27-26)
Devin Poole attempts a 3Pt. Contested by Ja Mitchell (5.5 feet, ZONE). Devin Poole misses. Rebound secured by Kawhi Irving.

[10:17] Team_064 possession (Score: 27-26)
Kawhi Irving attempts a 3Pt. Contested by Devin Poole (4.5 feet, ZONE). Kawhi Irving misses. Rebound secured by Anthony Bane.

[10:02] Team_034 possession (Score: 27-26)
Ben Hyland drives to the basket... Ben Hyland commits a violation (traveling/carry)! TURNOVER! (dead ball)

[10:02] Substitution (Team_064): Ja Mitchell OUT → CJ Haliburton IN (stamina_rule2)

[10:02] Substitution (Team_064): Jordan Mitchell OUT → Ja Simmons IN (stamina_rule2)

[10:02] Substitution (Team_064): Kawhi Irving OUT → Tobias Herro IN (stamina_rule2)

[10:02] Substitution (Team_064): Russell Simons OUT → Austin Smith IN (stamina_rule2)

[10:02] Substitution (Team_064): Shai Hyland OUT → Devin Cunningham IN (stamina_rule2)

[10:02] Substitution (Team_034): Devin Poole OUT → Manu Jokic IN (stamina_rule2)

[10:02] Substitution (Team_034): Ben Hyland OUT → Damian Turner IN (stamina_rule2)

[10:02] Substitution (Team_034): Cole Antetokounmpo OUT → Vince Paul IN (stamina_rule2)

[10:02] Substitution (Team_034): Terry Doncic OUT → Nikola Wagner IN (stamina_rule2)

[10:02] Substitution (Team_034): Anthony Bane OUT → Carmelo Anunoby IN (stamina_rule2)

[09:51] Team_064 possession (Score: 27-26)
Tobias Herro attempts a 3Pt. Contested by Vince Paul (3.7 feet, ZONE). Tobias Herro misses. Rebound secured by Carmelo Anunoby.

[09:32] Team_034 possession (Score: 27-26)
Nikola Wagner drives to the basket... Nikola Wagner commits a violation (traveling/carry)! TURNOVER! (dead ball)

[09:17] Team_064 possession (Score: 27-26)
Tobias Herro attempts a Midrange. Contested by Carmelo Anunoby (4.9 feet, ZONE). TOBIAS HERRO MAKES IT!
Score: 29-26

[09:01] Team_034 possession (Score: 29-26)
Vince Paul attempts a 3Pt. Wide open! Tobias Herro is 6.4 feet away. [MAN] VINCE PAUL MAKES IT! Assist: Nikola Wagner
Score: 29-29

[08:48] Team_064 possession (Score: 29-29)
CJ Haliburton throws a bad pass out of bounds! TURNOVER! (dead ball)

[08:31] Team_034 possession (Score: 29-29)
Nikola Wagner attempts a Layup. Contested by Austin Smith (4.7 feet, MAN). Nikola Wagner misses. Rebound secured by Ja Simmons.

[08:15] Team_064 possession (Score: 29-29)
FOUL! Shooting foul on Vince Paul. Devin Cunningham to the line for 3 free throws. [Team fouls: 2] (Vince Paul: 1 personal fouls)   FT 1/3: GOOD   FT 2/3: MISS   FT 3/3: GOOD Devin Cunningham makes 2/3 from the line.
Score: 31-29

[08:01] Team_034 possession (Score: 31-29)
Damian Turner attempts a Midrange. Wide open! Ja Simmons is 6.0 feet away. [MAN] Damian Turner misses. FOUL! Loose ball foul on Austin Smith during the rebound battle. [Team fouls: 2] No free throws, side out. (Austin Smith: 1 personal fouls)

[07:47] Team_034 possession (Score: 31-29)
Carmelo Anunoby makes the Layup and draws the foul on Ja Simmons! And-1! Carmelo Anunoby to the line for 1. [Team fouls: 3] (Ja Simmons: 1 personal fouls)   FT 1/1: GOOD Carmelo Anunoby makes 1/1 from the line.
Score: 31-32

[07:31] Team_064 possession (Score: 31-32)
FOUL! Reach-in foul on Carmelo Anunoby during the drive. [Team fouls: 3] No free throws, side out. (Carmelo Anunoby: 1 personal fouls)

[07:14] Team_064 possession (Score: 31-32)
FOUL! Holding foul on Carmelo Anunoby. [Team fouls: 4] No free throws, side out. (Carmelo Anunoby: 2 personal fouls)

[06:58] Team_064 possession (Score: 31-32)
CJ Haliburton attempts a 3Pt. Contested by Vince Paul (4.5 feet, ZONE). CJ Haliburton misses. Rebound secured by Vince Paul.

[06:49] Team_034 possession (Score: 31-32)
Vince Paul makes the Layup and draws the foul on Tobias Herro! And-1! Vince Paul to the line for 1. [Team fouls: 4] (Tobias Herro: 1 personal fouls)   FT 1/1: GOOD Vince Paul makes 1/1 from the line.
Score: 31-35

[06:33] Team_064 possession (Score: 31-35)
Devin Cunningham attempts a Layup. Contested by Carmelo Anunoby (5.3 feet, MAN). Devin Cunningham misses. Rebound secured by Vince Paul.

[06:18] Team_034 possession (Score: 31-35)
Nikola Wagner drives, Austin Smith stays with him. Nikola Wagner attempts a Dunk. Contested by Austin Smith (4.7 feet, MAN). Nikola Wagner misses. Rebound secured by Austin Smith.

[06:08] Team_064 possession (Score: 31-35)
CJ Haliburton attempts a Layup. Contested by Manu Jokic (5.0 feet, MAN). CJ Haliburton misses. Rebound secured by Carmelo Anunoby.

[05:53] Team_034 possession (Score: 31-35)
Nikola Wagner attempts a 3Pt. Contested by Austin Smith (4.7 feet, MAN). NIKOLA WAGNER MAKES IT! Assist: Vince Paul
Score: 31-38

[05:37] Team_064 possession (Score: 31-38)
FOUL! Holding foul on Vince Paul. [IN THE BONUS! 5 team fouls] Tobias Herro to the line for 2 free throws. (Vince Paul: 2 personal fouls)   FT 1/2: GOOD   FT 2/2: GOOD Tobias Herro makes 2/2 from the line.
Score: 33-38

[05:22] Team_034 possession (Score: 33-38)
Carmelo Anunoby attempts a Midrange. Contested by Devin Cunningham (5.3 feet, MAN). Carmelo Anunoby misses. Rebound secured by Devin Cunningham.

[05:10] Team_064 possession (Score: 33-38)
Austin Smith attempts a Midrange. Contested by Manu Jokic (4.3 feet, ZONE). Austin Smith misses. Offensive rebound by Austin Smith! Austin Smith kicks it out.

[04:59] Team_064 possession (Score: 33-38)
CJ Haliburton attempts a 3Pt. Contested by Vince Paul (4.5 feet, ZONE). CJ Haliburton misses. Rebound secured by Carmelo Anunoby.

[04:44] Team_034 possession (Score: 33-38)
Manu Jokic drives to the basket... Manu Jokic commits a violation (traveling/carry)! TURNOVER! (dead ball)

[04:31] Team_064 possession (Score: 33-38)
Tobias Herro drives and kicks out. Austin Smith attempts a Midrange. Wide open! Nikola Wagner is 6.0 feet away. [ZONE] Austin Smith misses. Rebound secured by Vince Paul.

[04:17] Team_034 possession (Score: 33-38)
Damian Turner makes the Layup and draws the foul on Austin Smith! And-1! Damian Turner to the line for 1. [BONUS: 5 team fouls] (Austin Smith: 2 personal fouls)   FT 1/1: GOOD Damian Turner makes 1/1 from the line.
Score: 33-41

[03:59] Team_064 possession (Score: 33-41)
Tobias Herro attempts a 3Pt. Contested by Vince Paul (3.7 feet, MAN). TOBIAS HERRO MAKES IT! Assist: Austin Smith
Score: 36-41

[03:43] Team_034 possession (Score: 36-41)
Carmelo Anunoby attempts a Midrange. Contested by Ja Simmons (5.7 feet, ZONE). Carmelo Anunoby misses. Offensive rebound by Vince Paul! Vince Paul's putback is no good. Offensive rebound by Carmelo Anunoby! Carmelo Anunoby kicks it out.

[03:27] Team_034 possession (Score: 36-41)
Nikola Wagner attempts a 3Pt. Contested by Austin Smith (4.7 feet, MAN). Nikola Wagner misses. Rebound secured by Devin Cunningham.

[03:11] Team_064 possession (Score: 36-41)
Ja Simmons attempts a 3Pt. Contested by Damian Turner (5.3 feet, MAN). Ja Simmons misses. Offensive rebound by Ja Simmons! Ja Simmons kicks it out.

[02:56] Team_064 possession (Score: 36-41)
Devin Cunningham attempts a Midrange. Contested by Nikola Wagner (5.9 feet, ZONE). Devin Cunningham misses. Rebound secured by Nikola Wagner.

[02:46] Team_034 possession (Score: 36-41)
Vince Paul attempts a Midrange. Contested by Austin Smith (5.0 feet, ZONE). Vince Paul misses. Rebound secured by Austin Smith.

[02:36] Team_064 possession (Score: 36-41)
FOUL! Shooting foul on Carmelo Anunoby. Devin Cunningham to the line for 2 free throws. [BONUS: 6 team fouls] (Carmelo Anunoby: 3 personal fouls)   FT 1/2: GOOD   FT 2/2: GOOD Devin Cunningham makes 2/2 from the line.
Score: 38-41

[02:23] Team_034 possession (Score: 38-41)
Manu Jokic commits a violation (traveling/carry)! TURNOVER! (dead ball)

[02:08] Team_064 possession (Score: 38-41)
Austin Smith makes the Layup and draws the foul on Nikola Wagner! And-1! Austin Smith to the line for 1. [BONUS: 7 team fouls] (Nikola Wagner: 1 personal fouls)   FT 1/1: GOOD Austin Smith makes 1/1 from the line.
Score: 41-41

[01:56] Team_034 possession (Score: 41-41)
Vince Paul attempts a 3Pt. Wide open! Tobias Herro is 6.5 feet away. [ZONE] VINCE PAUL MAKES IT! Assist: Carmelo Anunoby
Score: 41-44

[01:46] Team_064 possession (Score: 41-44)
CJ Haliburton drives to the basket... CJ Haliburton throws a bad pass! Stolen by Manu Jokic! TURNOVER! (live ball)

[01:33] Team_034 possession (Score: 41-44)
FOUL! Shooting foul on Austin Smith. Vince Paul to the line for 3 free throws. [BONUS: 7 team fouls] (Austin Smith: 3 personal fouls)   FT 1/3: MISS   FT 2/3: GOOD   FT 3/3: GOOD Vince Paul makes 2/3 from the line.
Score: 41-46

[01:16] Team_064 possession (Score: 41-46)
Austin Smith drives, picks up Nikola Wagner. Help arrives from Damian Turner! Austin Smith attempts a Dunk. Contested by Damian Turner (5.8 feet, MAN). AUSTIN SMITH MAKES IT! Assist: Tobias Herro
Score: 43-46

[01:02] Team_034 possession (Score: 43-46)
Vince Paul attempts a 3Pt. Contested by Austin Smith (5.1 feet, ZONE). Vince Paul misses. Rebound secured by Austin Smith.

[00:46] Team_064 possession (Score: 43-46)
CJ Haliburton drives, Manu Jokic stays with him. CJ Haliburton attempts a Dunk. Contested by Manu Jokic (5.2 feet, MAN). CJ HALIBURTON MAKES IT! Assist: Ja Simmons
Score: 45-46

[00:28] Team_034 possession (Score: 45-46)
Manu Jokic attempts a Midrange. Contested by Austin Smith (4.9 feet, ZONE). Manu Jokic misses. Rebound secured by Devin Cunningham.

[00:13] Team_064 possession (Score: 45-46)
CJ Haliburton attempts a Layup. Wide open! Carmelo Anunoby is 6.1 feet away. [ZONE] CJ HALIBURTON MAKES IT!
Score: 47-46

[00:02] Team_034 possession (Score: 47-46)
Nikola Wagner drives, Austin Smith stays with him. Nikola Wagner attempts a Dunk. Contested by Austin Smith (5.0 feet, ZONE). NIKOLA WAGNER MAKES IT! Assist: Vince Paul
Score: 47-48

================================================================================
                              2ND QUARTER COMPLETE                              
================================================================================

2ND QUARTER SCORE: Team_064 25, Team_034 25

BOX SCORE:
================================================================================

Team_064
--------------------------------------------------------------------------------
Player                MIN  PTS  REB  AST  TO      FG   FG%      3P   3P%
--------------------------------------------------------------------------------
Tobias Herro           10    7    0    1   0   3/5    60.0     0/0   0.0
Austin Smith           10    5    4    1   0   2/2   100.0     0/0   0.0
Devin Cunningham       10    4    3    0   0   2/4    50.0     0/0   0.0
CJ Haliburton          10    4    0    0   0   2/5    40.0     0/0   0.0
Jordan Mitchell        14    3    0    0   0   1/1   100.0     0/0   0.0
Shai Hyland            14    2    0    1   0   1/1   100.0     0/0   0.0
Kawhi Irving           14    0    2    0   0   0/1     0.0     0/0   0.0
Russell Simons         14    0    1    0   0   0/0     0.0     0/0   0.0
Ja Simmons             10    0    2    1   0   0/0     0.0     0/0   0.0

TEAM: FG: 11/19 (57.9%), 3PT: 3/7 (42.9%), REB: 12 (4 off, 8 def), AST: 4, TO: 2
TEAM FOULS: 7 [Team_034 in BONUS]


Team_034
--------------------------------------------------------------------------------
Player                MIN  PTS  REB  AST  TO      FG   FG%      3P   3P%
--------------------------------------------------------------------------------
Vince Paul             10   11    3    2   0   4/6    66.7     0/0   0.0
Nikola Wagner          10    5    1    1   0   2/5    40.0     0/0   0.0
Terry Doncic           14    3    0    0   0   1/1   100.0     0/0   0.0
Carmelo Anunoby        10    3    5    1   0   1/2    50.0     0/0   0.0
Damian Turner          10    3    0    0   0   1/1   100.0     0/0   0.0
Cole Antetokounmpo     14    0    0    1   0   0/0     0.0     0/0   0.0
Devin Poole            14    0    0    0   0   0/1     0.0     0/0   0.0
Anthony Bane           14    0    1    0   0   0/0     0.0     0/0   0.0
Manu Jokic             10    0    0    0   0   0/1     0.0     0/0   0.0

TEAM: FG: 9/17 (52.9%), 3PT: 5/8 (62.5%), REB: 10 (2 off, 8 def), AST: 5, TO: 4
TEAM FOULS: 7 [Team_064 in BONUS]

================================================================================

================================================================================
                       3RD QUARTER - Team_064 vs Team_034                       
================================================================================

[12:00] Team_064 possession (Score: 47-48)
Shai Hyland attempts a Layup. Contested by Terry Doncic (4.4 feet, ZONE). SHAI HYLAND MAKES IT! Assist: Ja Mitchell
Score: 49-48

[11:44] Team_034 possession (Score: 49-48)
Terry Doncic attempts a 3Pt. Contested by Russell Simons (3.3 feet, MAN). Terry Doncic misses. Offensive rebound by Anthony Bane! Anthony Bane kicks it out.

[11:29] Team_034 possession (Score: 49-48)
FOUL! Shooting foul on Jordan Mitchell. Devin Poole to the line for 2 free throws. [Team fouls: 1] (Jordan Mitchell: 1 personal fouls)   FT 1/2: GOOD   FT 2/2: GOOD Devin Poole makes 2/2 from the line.
Score: 49-50

[11:13] Team_064 possession (Score: 49-50)
Jordan Mitchell attempts a 3Pt. Contested by Devin Poole (3.5 feet, ZONE). Jordan Mitchell misses. Rebound secured by Terry Doncic.

[11:01] Team_034 possession (Score: 49-50)
Anthony Bane drives and kicks out. Ben Hyland attempts a Midrange. Contested by Jordan Mitchell (3.8 feet, MAN). BEN HYLAND MAKES IT! Assist: Terry Doncic
Score: 49-52

[10:46] Team_064 possession (Score: 49-52)
Ja Mitchell attempts a 3Pt. BLOCKED BY DEVIN POOLE! Ball is loose! Rebound secured by Terry Doncic.

[10:34] Team_034 possession (Score: 49-52)
FOUL! Shooting foul on Russell Simons. Terry Doncic to the line for 2 free throws. [Team fouls: 2] (Russell Simons: 1 personal fouls)   FT 1/2: MISS   FT 2/2: MISS Terry Doncic makes 0/2 from the line. FOUL! Loose ball foul on Russell Simons during the free throw rebound! [Team fouls: 3] No free throws, side out. (Russell Simons: 2 personal fouls)

[10:17] Team_034 possession (Score: 49-52)
Ben Hyland attempts a Midrange. Contested by Jordan Mitchell (3.9 feet, ZONE). Ben Hyland misses. Offensive rebound by Terry Doncic! Terry Doncic puts it back in!
Score: 49-54

[10:03] Team_064 possession (Score: 49-54)
Shai Hyland attempts a Layup. Contested by Anthony Bane (5.5 feet, MAN). SHAI HYLAND MAKES IT! Assist: Jordan Mitchell
Score: 51-54

[09:47] Team_034 possession (Score: 51-54)
Devin Poole drives, picks up Russell Simons. Help arrives from Jordan Mitchell! Devin Poole attempts a Dunk. Contested by Jordan Mitchell (3.1 feet, ZONE). Devin Poole misses. Offensive rebound by Terry Doncic! Terry Doncic puts it back in!
Score: 51-56

[09:32] Team_064 possession (Score: 51-56)
Jordan Mitchell attempts a 3Pt. Contested by Ben Hyland (3.1 feet, MAN). Jordan Mitchell misses. Rebound secured by Cole Antetokounmpo.

[09:21] Team_034 possession (Score: 51-56)
Anthony Bane commits a violation (traveling/carry)! TURNOVER! (dead ball)

[09:10] Team_064 possession (Score: 51-56)
Kawhi Irving drives to the basket... Kawhi Irving throws a bad pass! Stolen by Terry Doncic! TURNOVER! (live ball)

[08:58] Team_034 possession (Score: 51-56)
Terry Doncic attempts a 3Pt. Contested by Russell Simons (3.3 feet, MAN). Terry Doncic misses. Rebound secured by Shai Hyland.

[08:44] Team_064 possession (Score: 51-56)
FOUL! Shooting foul on Terry Doncic. Russell Simons to the line for 2 free throws. [Team fouls: 1] (Terry Doncic: 1 personal fouls)   FT 1/2: GOOD   FT 2/2: GOOD Russell Simons makes 2/2 from the line.
Score: 53-56

[08:29] Team_034 possession (Score: 53-56)
Anthony Bane attempts a Layup. Contested by Russell Simons (3.3 feet, ZONE). Anthony Bane misses. Offensive rebound by Anthony Bane! Anthony Bane kicks it out.

[08:19] Team_034 possession (Score: 53-56)
Cole Antetokounmpo attempts a Layup. Contested by Kawhi Irving (4.8 feet, MAN). Cole Antetokounmpo misses. Rebound secured by Shai Hyland.

[08:10] Team_064 possession (Score: 53-56)
FOUL! Shooting foul on Ben Hyland. Shai Hyland to the line for 2 free throws. [Team fouls: 2] (Ben Hyland: 1 personal fouls)   FT 1/2: GOOD   FT 2/2: MISS Shai Hyland makes 1/2 from the line. Rebound secured by Cole Antetokounmpo.
Score: 54-56

[07:57] Team_034 possession (Score: 54-56)
Anthony Bane attempts a Midrange. Contested by Shai Hyland (5.1 feet, MAN). Anthony Bane misses. Offensive rebound by Terry Doncic! Terry Doncic puts it back in!
Score: 54-58

[07:38] Team_064 possession (Score: 54-58)
Ja Mitchell drives, picks up Devin Poole. Help arrives from Ben Hyland! Ja Mitchell attempts a Layup. Contested by Ben Hyland (4.2 feet, MAN). JA MITCHELL MAKES IT! Assist: Kawhi Irving
Score: 56-58

[07:24] Team_034 possession (Score: 56-58)
Devin Poole makes the Layup and draws the foul on Russell Simons! And-1! Devin Poole to the line for 1. [Team fouls: 4] (Russell Simons: 3 personal fouls)   FT 1/1: GOOD Devin Poole makes 1/1 from the line.
Score: 56-61

[07:07] Team_064 possession (Score: 56-61)
Jordan Mitchell loses control! Ball rolls out of bounds! TURNOVER! (dead ball)

[06:50] Team_034 possession (Score: 56-61)
Devin Poole attempts a 3Pt. Contested by Ja Mitchell (5.1 feet, ZONE). DEVIN POOLE MAKES IT! Assist: Terry Doncic
Score: 56-64

[06:35] Team_064 possession (Score: 56-64)
Jordan Mitchell drives and kicks out. Shai Hyland attempts a 3Pt. Contested by Devin Poole (3.9 feet, ZONE). Shai Hyland misses. Rebound secured by Terry Doncic.

[06:24] Team_034 possession (Score: 56-64)
Terry Doncic loses the ball! Stripped by Russell Simons! TURNOVER! (live ball)

[06:09] Team_064 possession (Score: 56-64)
Kawhi Irving drives to the basket... FOUL! Offensive foul on Kawhi Irving! Cole Antetokounmpo drew the charge! [Team fouls: 5] (Kawhi Irving: 1 personal fouls) TURNOVER! (dead ball)

[05:56] Team_034 possession (Score: 56-64)
Cole Antetokounmpo attempts a 3Pt. Contested by Ja Mitchell (5.6 feet, ZONE). Cole Antetokounmpo misses. Offensive rebound by Anthony Bane! Anthony Bane kicks it out.

[05:41] Team_034 possession (Score: 56-64)
Cole Antetokounmpo attempts a 3Pt. Contested by Kawhi Irving (4.8 feet, MAN). COLE ANTETOKOUNMPO MAKES IT! Assist: Devin Poole
Score: 56-67

[05:28] Team_064 possession (Score: 56-67)
Kawhi Irving drives and kicks out. Shai Hyland attempts a 3Pt. Contested by Ben Hyland (3.6 feet, ZONE). SHAI HYLAND MAKES IT! Assist: Kawhi Irving
Score: 59-67

[05:13] Team_034 possession (Score: 59-67)
Cole Antetokounmpo attempts a 3Pt. Contested by Ja Mitchell (5.7 feet, ZONE). COLE ANTETOKOUNMPO MAKES IT! Assist: Devin Poole
Score: 59-70

[05:00] Team_064 possession (Score: 59-70)
Jordan Mitchell makes the Dunk and draws the foul on Terry Doncic! And-1! Jordan Mitchell to the line for 1. [Team fouls: 3] (Terry Doncic: 2 personal fouls)   FT 1/1: GOOD Jordan Mitchell makes 1/1 from the line.
Score: 62-70

[04:46] Team_034 possession (Score: 62-70)
Cole Antetokounmpo drives and kicks out. Anthony Bane attempts a 3Pt. Contested by Shai Hyland (5.1 feet, MAN). Anthony Bane misses. Rebound secured by Kawhi Irving.

[04:32] Team_064 possession (Score: 62-70)
Jordan Mitchell attempts a 3Pt. Contested by Devin Poole (3.6 feet, ZONE). Jordan Mitchell misses. Rebound secured by Cole Antetokounmpo.

[04:21] Team_034 possession (Score: 62-70)
Ben Hyland throws a bad pass! Stolen by Jordan Mitchell! TURNOVER! (live ball)

[04:12] Team_064 possession (Score: 62-70)
Ja Mitchell drives, picks up Devin Poole. Help arrives from Ben Hyland! Ja Mitchell attempts a Dunk. Contested by Ben Hyland (4.3 feet, MAN). JA MITCHELL MAKES IT!
Score: 64-70

[04:02] Team_034 possession (Score: 64-70)
Terry Doncic attempts a 3Pt. Contested by Russell Simons (3.6 feet, MAN). Terry Doncic misses. Rebound secured by Shai Hyland.

[03:47] Team_064 possession (Score: 64-70)
Shai Hyland drives and kicks out. Russell Simons attempts a Midrange. Contested by Terry Doncic (4.2 feet, MAN). Russell Simons misses. Rebound secured by Cole Antetokounmpo.

[03:32] Team_034 possession (Score: 64-70)
FOUL! Shooting foul on Kawhi Irving. Ben Hyland to the line for 2 free throws. [BONUS: 6 team fouls] (Kawhi Irving: 2 personal fouls)   FT 1/2: GOOD   FT 2/2: GOOD Ben Hyland makes 2/2 from the line.
Score: 64-72

[03:14] Team_064 possession (Score: 64-72)
FOUL! Shooting foul on Terry Doncic. Russell Simons to the line for 2 free throws. [Team fouls: 4] (Terry Doncic: 3 personal fouls)   FT 1/2: GOOD   FT 2/2: GOOD Russell Simons makes 2/2 from the line.
Score: 66-72

[02:56] Team_034 possession (Score: 66-72)
Devin Poole makes the Layup and draws the foul on Ja Mitchell! And-1! Devin Poole to the line for 1. [BONUS: 7 team fouls] (Ja Mitchell: 1 personal fouls)   FT 1/1: GOOD Devin Poole makes 1/1 from the line.
Score: 66-75

[02:38] Team_064 possession (Score: 66-75)
Kawhi Irving drives and kicks out. Jordan Mitchell attempts a 3Pt. Contested by Ben Hyland (3.9 feet, MAN). Jordan Mitchell misses. Rebound secured by Cole Antetokounmpo.

[02:24] Team_034 possession (Score: 66-75)
FOUL! Shooting foul on Russell Simons. Devin Poole to the line for 2 free throws. [BONUS: 8 team fouls] (Russell Simons: 4 personal fouls)   FT 1/2: GOOD   FT 2/2: MISS Devin Poole makes 1/2 from the line. Offensive rebound by Anthony Bane! Anthony Bane kicks it out.
Score: 66-76

[02:10] Team_034 possession (Score: 66-76)
Anthony Bane drives, picks up Shai Hyland. Help arrives from Jordan Mitchell! Anthony Bane attempts a Dunk. Contested by Jordan Mitchell (5.4 feet, MAN). Anthony Bane misses. FOUL! Loose ball foul on Kawhi Irving during the rebound battle. [IN THE BONUS! 9 team fouls] Terry Doncic to the line for 2 free throws. (Kawhi Irving: 3 personal fouls)   FT 1/2: GOOD   FT 2/2: GOOD Terry Doncic makes 2/2 from the line.
Score: 66-78

[01:53] Team_064 possession (Score: 66-78)
Shai Hyland attempts a Midrange. Contested by Anthony Bane (5.7 feet, MAN). Shai Hyland misses. Rebound secured by Anthony Bane.

[01:37] Team_034 possession (Score: 66-78)
Ben Hyland attempts a Midrange. Contested by Jordan Mitchell (4.3 feet, MAN). Ben Hyland misses. Rebound secured by Kawhi Irving.

[01:23] Team_064 possession (Score: 66-78)
Ja Mitchell attempts a 3Pt. Contested by Devin Poole (4.6 feet, ZONE). Ja Mitchell misses. Offensive rebound by Russell Simons! Russell Simons kicks it out.

[01:13] Team_064 possession (Score: 66-78)
Shai Hyland attempts a 3Pt. Contested by Devin Poole (4.7 feet, ZONE). Shai Hyland misses. Offensive rebound by Kawhi Irving! Kawhi Irving kicks it out.

[01:00] Team_064 possession (Score: 66-78)
Ja Mitchell attempts a Midrange. Contested by Cole Antetokounmpo (5.1 feet, ZONE). Ja Mitchell misses. Rebound secured by Terry Doncic.

[00:48] Team_034 possession (Score: 66-78)
Ben Hyland attempts a Midrange. Contested by Jordan Mitchell (4.4 feet, ZONE). BEN HYLAND MAKES IT! Assist: Anthony Bane
Score: 66-80

[00:31] Team_064 possession (Score: 66-80)
Ja Mitchell attempts a 3Pt. Contested by Devin Poole (4.7 feet, ZONE). JA MITCHELL MAKES IT! Assist: Shai Hyland
Score: 69-80

[00:16] Team_034 possession (Score: 69-80)
Cole Antetokounmpo drives, Kawhi Irving stays with him. Cole Antetokounmpo attempts a Dunk. Contested by Kawhi Irving (5.2 feet, MAN). COLE ANTETOKOUNMPO MAKES IT! Assist: Terry Doncic
Score: 69-82

[00:07] Team_064 possession (Score: 69-82)
Kawhi Irving attempts a Layup. Contested by Cole Antetokounmpo (4.9 feet, MAN). KAWHI IRVING MAKES IT! Assist: Ja Mitchell
Score: 71-82

================================================================================
                              3RD QUARTER COMPLETE                              
================================================================================

3RD QUARTER SCORE: Team_064 24, Team_034 34

BOX SCORE:
================================================================================

Team_064
--------------------------------------------------------------------------------
Player                MIN  PTS  REB  AST  TO      FG   FG%      3P   3P%
--------------------------------------------------------------------------------
Shai Hyland            26    7    3    1   0   3/6    50.0     0/0   0.0
Ja Mitchell            26    7    0    2   0   3/5    60.0     0/0   0.0
Russell Simons         26    4    1    0   0   2/2   100.0     0/0   0.0
Jordan Mitchell        26    3    0    1   0   1/5    20.0     0/0   0.0
Kawhi Irving           26    2    3    2   0   1/2    50.0     0/0   0.0

TEAM: FG: 10/20 (50.0%), 3PT: 1/5 (20.0%), REB: 7 (2 off, 5 def), AST: 6, TO: 3
TEAM FOULS: 9 [Team_034 in BONUS]


Team_034
--------------------------------------------------------------------------------
Player                MIN  PTS  REB  AST  TO      FG   FG%      3P   3P%
--------------------------------------------------------------------------------
Devin Poole            26   11    0    2   0   4/4   100.0     0/0   0.0
Terry Doncic           26    8    7    3   0   4/6    66.7     0/0   0.0
Cole Antetokounmpo     26    8    5    0   0   3/5    60.0     0/0   0.0
Ben Hyland             26    6    0    0   0   3/4    75.0     0/0   0.0
Anthony Bane           26    0    6    1   0   0/0     0.0     0/0   0.0

TEAM: FG: 14/19 (73.7%), 3PT: 3/5 (60.0%), REB: 18 (8 off, 10 def), AST: 6, TO: 3
TEAM FOULS: 4

================================================================================

================================================================================
                       4TH QUARTER - Team_064 vs Team_034                       
================================================================================

[12:00] Substitution (Team_064): Ja Mitchell OUT (stamina: 66) → CJ Haliburton IN (comeback_detected)

[12:00] Substitution (Team_034): Devin Poole OUT (stamina: 65) → Manu Jokic IN (comeback_detected)

[12:00] Team_064 possession (Score: 71-82)
Shai Hyland attempts a 3Pt. Contested by Ben Hyland (4.2 feet, ZONE). Shai Hyland misses. FOUL! Loose ball foul on Terry Doncic during the rebound battle. [Team fouls: 1] No free throws, side out. (Terry Doncic: 1 personal fouls)

[11:44] Team_064 possession (Score: 71-82)
Kawhi Irving attempts a 3Pt. Contested by Ben Hyland (3.8 feet, ZONE). Kawhi Irving misses. Rebound secured by Cole Antetokounmpo.

[11:27] Team_034 possession (Score: 71-82)
Cole Antetokounmpo attempts a 3Pt. Contested by Russell Simons (4.3 feet, ZONE). Cole Antetokounmpo misses. Rebound secured by Russell Simons.

[11:13] Team_064 possession (Score: 71-82)
Russell Simons drives to the basket... Russell Simons throws a bad pass out of bounds! TURNOVER! (dead ball)

[11:13] Substitution (Team_064): Jordan Mitchell OUT → Ja Simmons IN (stamina_rule2)

[11:13] Substitution (Team_064): Kawhi Irving OUT → Tobias Herro IN (stamina_rule2)

[11:13] Substitution (Team_064): Russell Simons OUT → Austin Smith IN (stamina_rule2)

[11:13] Substitution (Team_064): Shai Hyland OUT → Devin Cunningham IN (stamina_rule2)

[11:13] Substitution (Team_034): Ben Hyland OUT → Damian Turner IN (stamina_rule2)

[11:13] Substitution (Team_034): Cole Antetokounmpo OUT → Vince Paul IN (stamina_rule2)

[11:13] Substitution (Team_034): Terry Doncic OUT → Nikola Wagner IN (stamina_rule2)

[11:13] Substitution (Team_034): Anthony Bane OUT → Carmelo Anunoby IN (stamina_rule2)

[11:01] Team_034 possession (Score: 71-82)
Vince Paul attempts a 3Pt. Contested by Austin Smith (5.0 feet, ZONE). VINCE PAUL MAKES IT! Assist: Manu Jokic
Score: 71-85

[10:52] Team_064 possession (Score: 71-85)
FOUL! Offensive foul on Ja Simmons! Damian Turner drew the charge! [Team fouls: 1] (Ja Simmons: 1 personal fouls) TURNOVER! (dead ball)

[10:40] Team_034 possession (Score: 71-85)
Vince Paul attempts a 3Pt. Wide open! Tobias Herro is 6.4 feet away. [MAN] VINCE PAUL MAKES IT! Assist: Manu Jokic
Score: 71-88

[10:24] Team_064 possession (Score: 71-88)
CJ Haliburton attempts a Midrange. Contested by Manu Jokic (5.0 feet, MAN). CJ HALIBURTON MAKES IT!
Score: 73-88

[10:06] Team_034 possession (Score: 73-88)
Carmelo Anunoby attempts a Layup. Contested by Devin Cunningham (5.3 feet, MAN). CARMELO ANUNOBY MAKES IT! Assist: Nikola Wagner
Score: 73-90

[09:49] Team_064 possession (Score: 73-90)
Austin Smith drives and kicks out. Tobias Herro attempts a 3Pt. Contested by Vince Paul (4.2 feet, ZONE). TOBIAS HERRO MAKES IT!
Score: 76-90

[09:31] Team_034 possession (Score: 76-90)
Manu Jokic attempts a 3Pt. Wide open! CJ Haliburton is 6.0 feet away. [ZONE] Manu Jokic misses. Rebound secured by Devin Cunningham.

[09:13] Team_064 possession (Score: 76-90)
Ja Simmons drives to the basket... Ja Simmons loses control! Ball rolls out of bounds! TURNOVER! (dead ball)

[09:02] Team_034 possession (Score: 76-90)
Vince Paul attempts a 3Pt. Wide open! Tobias Herro is 6.4 feet away. [MAN] Vince Paul misses. Offensive rebound by Vince Paul! Vince Paul puts it back in!
Score: 76-92

[08:47] Team_064 possession (Score: 76-92)
Ja Simmons attempts a 3Pt. Contested by Damian Turner (5.3 feet, MAN). Ja Simmons misses. Rebound secured by Vince Paul.

[08:33] Team_034 possession (Score: 76-92)
Vince Paul attempts a 3Pt. Contested by Austin Smith (5.0 feet, ZONE). Vince Paul misses. Rebound secured by Ja Simmons.

[08:19] Team_064 possession (Score: 76-92)
CJ Haliburton makes the Midrange and draws the foul on Manu Jokic! And-1! CJ Haliburton to the line for 1. [Team fouls: 2] (Manu Jokic: 1 personal fouls)   FT 1/1: GOOD CJ Haliburton makes 1/1 from the line.
Score: 79-92

[08:07] Team_034 possession (Score: 79-92)
FOUL! Holding foul on Tobias Herro. [Team fouls: 2] No free throws, side out. (Tobias Herro: 1 personal fouls)

[07:50] Team_034 possession (Score: 79-92)
Nikola Wagner throws a bad pass out of bounds! TURNOVER! (dead ball)

[07:33] Team_064 possession (Score: 79-92)
Austin Smith throws a bad pass! Stolen by Nikola Wagner! TURNOVER! (live ball)

[07:19] Team_034 possession (Score: 79-92)
Manu Jokic drives and kicks out. Vince Paul attempts a Midrange. Wide open! Tobias Herro is 6.0 feet away. [MAN] Vince Paul misses. Rebound secured by Austin Smith.

[07:06] Team_064 possession (Score: 79-92)
Devin Cunningham throws a bad pass! Stolen by Carmelo Anunoby! TURNOVER! (live ball)

[06:53] Team_034 possession (Score: 79-92)
Damian Turner attempts a Layup. Wide open! Ja Simmons is 6.0 feet away. [MAN] DAMIAN TURNER MAKES IT! Assist: Nikola Wagner
Score: 79-94

[06:39] Team_064 possession (Score: 79-94)
Austin Smith makes the Layup and draws the foul on Carmelo Anunoby! And-1! Austin Smith to the line for 1. [Team fouls: 3] (Carmelo Anunoby: 1 personal fouls)   FT 1/1: GOOD Austin Smith makes 1/1 from the line.
Score: 82-94

[06:22] Team_034 possession (Score: 82-94)
Manu Jokic drives and kicks out. Carmelo Anunoby attempts a 3Pt. Contested by Austin Smith (4.6 feet, ZONE). CARMELO ANUNOBY MAKES IT! Assist: Damian Turner
Score: 82-97

[06:09] Team_064 possession (Score: 82-97)
FOUL! Reach-in foul on Nikola Wagner during the drive. [Team fouls: 4] No free throws, side out. (Nikola Wagner: 1 personal fouls)

[05:53] Team_064 possession (Score: 82-97)
CJ Haliburton attempts a 3Pt. Contested by Vince Paul (4.5 feet, ZONE). CJ HALIBURTON MAKES IT! Assist: Tobias Herro
Score: 85-97

[05:44] Team_034 possession (Score: 85-97)
FOUL! Reach-in foul on Austin Smith during the drive. [Team fouls: 3] No free throws, side out. (Austin Smith: 1 personal fouls)

[05:33] Team_034 possession (Score: 85-97)
Vince Paul attempts a 3Pt. Contested by Austin Smith (5.0 feet, ZONE). VINCE PAUL MAKES IT! Assist: Manu Jokic
Score: 85-100

[05:20] Team_064 possession (Score: 85-100)
Tobias Herro commits a violation (traveling/carry)! TURNOVER! (dead ball)

[05:09] Team_034 possession (Score: 85-100)
Damian Turner drives, picks up Ja Simmons. Help arrives from Tobias Herro! Damian Turner attempts a Dunk. Wide open! Tobias Herro is 6.0 feet away. [MAN] DAMIAN TURNER MAKES IT!
Score: 85-102

[04:54] Team_064 possession (Score: 85-102)
Devin Cunningham attempts a 3Pt. Contested by Vince Paul (4.0 feet, ZONE). Devin Cunningham misses. Rebound secured by Carmelo Anunoby.

[04:36] Team_034 possession (Score: 85-102)
Nikola Wagner attempts a 3Pt. Contested by Austin Smith (4.7 feet, ZONE). Nikola Wagner misses. Rebound secured by Ja Simmons.

[04:18] Team_064 possession (Score: 85-102)
FOUL! Reach-in foul on Manu Jokic during the drive. [IN THE BONUS! 5 team fouls] CJ Haliburton to the line for 2 free throws. (Manu Jokic: 2 personal fouls)   FT 1/2: GOOD   FT 2/2: MISS CJ Haliburton makes 1/2 from the line. Offensive rebound by Austin Smith! Austin Smith kicks it out.
Score: 86-102

[04:01] Team_064 possession (Score: 86-102)
FOUL! Holding foul on Vince Paul. [IN THE BONUS! 6 team fouls] Tobias Herro to the line for 2 free throws. (Vince Paul: 1 personal fouls)   FT 1/2: MISS   FT 2/2: GOOD Tobias Herro makes 1/2 from the line.
Score: 87-102

[03:48] Team_034 possession (Score: 87-102)
Manu Jokic attempts a 3Pt. Contested by Austin Smith (4.7 feet, ZONE). Manu Jokic misses. Rebound secured by Austin Smith.

[03:32] Team_064 possession (Score: 87-102)
Austin Smith makes the Layup and draws the foul on Damian Turner! And-1! Austin Smith to the line for 1. [BONUS: 7 team fouls] (Damian Turner: 1 personal fouls)   FT 1/1: GOOD Austin Smith makes 1/1 from the line.
Score: 90-102

[03:18] Team_034 possession (Score: 90-102)
Carmelo Anunoby throws a bad pass out of bounds! TURNOVER! (dead ball)

[03:03] Team_064 possession (Score: 90-102)
Austin Smith attempts a 3Pt. Contested by Nikola Wagner (5.7 feet, MAN). Austin Smith misses. Rebound secured by Carmelo Anunoby.

[02:49] Team_034 possession (Score: 90-102)
Nikola Wagner drives, Austin Smith stays with him. Nikola Wagner attempts a Dunk. Contested by Austin Smith (4.8 feet, MAN). NIKOLA WAGNER MAKES IT! Assist: Vince Paul
Score: 90-104

[02:35] Team_064 possession (Score: 90-104)
Devin Cunningham attempts a Layup. BLOCKED BY CARMELO ANUNOBY! Ball is loose! Offensive rebound by Ja Simmons! Ja Simmons kicks it out.

[02:23] Team_064 possession (Score: 90-104)
Ja Simmons attempts a 3Pt. Wide open! Nikola Wagner is 6.0 feet away. [ZONE] Ja Simmons misses. Rebound secured by Vince Paul.

[02:06] Team_034 possession (Score: 90-104)
Nikola Wagner attempts a 3Pt. Contested by Austin Smith (4.9 feet, ZONE). Nikola Wagner misses. Rebound secured by Austin Smith.

[01:50] Team_064 possession (Score: 90-104)
Austin Smith drives, Nikola Wagner stays with him. Austin Smith attempts a Dunk. Contested by Nikola Wagner (5.8 feet, MAN). AUSTIN SMITH MAKES IT! Assist: CJ Haliburton
Score: 92-104

[01:34] Team_034 possession (Score: 92-104)
FOUL! Reach-in foul on Ja Simmons during the drive. [Team fouls: 4] No free throws, side out. (Ja Simmons: 2 personal fouls)

[01:19] Team_034 possession (Score: 92-104)
Nikola Wagner attempts a Midrange. Contested by Austin Smith (4.9 feet, MAN). NIKOLA WAGNER MAKES IT! Assist: Carmelo Anunoby
Score: 92-106

[01:05] Team_064 possession (Score: 92-106)
CJ Haliburton attempts a 3Pt. Contested by Vince Paul (4.7 feet, ZONE). CJ Haliburton misses. Rebound secured by Vince Paul.

[00:51] Team_034 possession (Score: 92-106)
Nikola Wagner attempts a Midrange. Contested by Austin Smith (5.0 feet, MAN). Nikola Wagner misses. Rebound secured by Ja Simmons.

[00:35] Team_064 possession (Score: 92-106)
Austin Smith attempts a 3Pt. Contested by Nikola Wagner (5.9 feet, MAN). Austin Smith misses. Offensive rebound by Austin Smith! Austin Smith kicks it out.

[00:20] Team_064 possession (Score: 92-106)
Austin Smith attempts a Layup. Contested by Nikola Wagner (6.0 feet, MAN). Austin Smith misses. Rebound secured by Carmelo Anunoby.

[00:10] Team_034 possession (Score: 92-106)
Damian Turner attempts a Layup. Contested by Austin Smith (5.3 feet, ZONE). Damian Turner misses. Rebound secured by Ja Simmons.

================================================================================
                              4TH QUARTER COMPLETE                              
================================================================================

4TH QUARTER SCORE: Team_064 21, Team_034 24

BOX SCORE:
================================================================================

Team_064
--------------------------------------------------------------------------------
Player                MIN  PTS  REB  AST  TO      FG   FG%      3P   3P%
--------------------------------------------------------------------------------
CJ Haliburton          22    8    0    1   0   3/4    75.0     0/0   0.0
Austin Smith           21    8    5    0   0   3/5    60.0     0/0   0.0
Tobias Herro           21    4    0    1   0   2/2   100.0     0/0   0.0
Kawhi Irving           27    0    1    0   0   0/1     0.0     0/0   0.0
Russell Simons         27    0    1    0   0   0/0     0.0     0/0   0.0
Devin Cunningham       21    0    1    0   0   0/1     0.0     0/0   0.0
Ja Simmons             21    0    5    0   0   0/2     0.0     0/0   0.0

TEAM: FG: 8/15 (53.3%), 3PT: 1/7 (14.3%), REB: 13 (4 off, 9 def), AST: 2, TO: 6
TEAM FOULS: 4


Team_034
--------------------------------------------------------------------------------
Player                MIN  PTS  REB  AST  TO      FG   FG%      3P   3P%
--------------------------------------------------------------------------------
Vince Paul             21   11    4    1   0   4/5    80.0     0/0   0.0
Carmelo Anunoby        21    5    3    1   0   2/2   100.0     0/0   0.0
Nikola Wagner          21    4    0    2   0   2/5    40.0     0/0   0.0
Damian Turner          21    4    0    1   0   2/3    66.7     0/0   0.0
Cole Antetokounmpo     27    0    1    0   0   0/1     0.0     0/0   0.0
Manu Jokic             22    0    0    3   0   0/3     0.0     0/0   0.0

TEAM: FG: 10/19 (52.6%), 3PT: 4/10 (40.0%), REB: 8 (1 off, 7 def), AST: 8, TO: 2
TEAM FOULS: 7 [Team_064 in BONUS]

================================================================================

================================================================================
                               FULL GAME COMPLETE                               
================================================================================

FINAL SCORE: Team_064 92, Team_034 106

SCORING BY QUARTER:
--------------------------------------------------------------------------------
Team                     Q1     Q2     Q3     Q4    FINAL
--------------------------------------------------------------------------------
Team_064                 22     25     24     21       92
Team_034                 23     25     34     24      106
--------------------------------------------------------------------------------

FULL GAME BOX SCORE:
================================================================================

Team_064
--------------------------------------------------------------------------------
Player                MIN  PTS  REB  AST  TO      FG   FG%      3P   3P%      FT STL BLK
--------------------------------------------------------------------------------
Jordan Mitchell        27   11    0    2   3   5/11   45.5   3/6    50.0   1/1     1   0
Kawhi Irving           27    7   11    3   1   3/7    42.9   0/3     0.0   3/3     0   0
Russell Simons         27   12    7    2   0   5/7    71.4   1/1   100.0   5/5     1   1
Shai Hyland            27   13    8    2   2   5/10   50.0   0/1     0.0   1/2     0   0
Ja Mitchell            26    7    0    3   0   3/10   30.0   1/3    33.3   0/0     0   0
CJ Haliburton          22   12    0    1   2   5/9    55.6   1/4    25.0   2/3     0   0
Ja Simmons             21    0    7    1   2   0/2     0.0   0/2     0.0   0/0     0   0
Tobias Herro           21   11    0    2   1   2/4    50.0   1/2    50.0   3/4     0   0
Austin Smith           21   13    9    1   1   6/8    75.0   0/1     0.0   3/3     0   0
Devin Cunningham       21    4    4    0   1   2/5    40.0   1/2    50.0   4/5     0   0

TEAM: FG: 38/75 (50.7%), 3PT: 8/25 (32.0%), REB: 46 (12 off, 34 def), AST: 17, TO: 13


Team_034
--------------------------------------------------------------------------------
Player                MIN  PTS  REB  AST  TO      FG   FG%      3P   3P%      FT STL BLK
--------------------------------------------------------------------------------
Ben Hyland             27    9    0    1   1   4/6    66.7   1/1   100.0   2/2     0   0
Cole Antetokounmpo     27   11   10    2   0   5/11   45.5   2/5    40.0   1/1     0   0
Terry Doncic           27   19   13    3   3   4/8    50.0   1/4    25.0   4/6     1   0
Anthony Bane           27    9   11    1   1   6/8    75.0   0/0     0.0   5/5     0   0
Devin Poole            26   11    0    3   0   5/10   50.0   1/6    16.7   5/6     0   1
Manu Jokic             22    0    0    3   2   1/5    20.0   0/2     0.0   0/0     1   0
Damian Turner          21    7    0    1   1   3/4    75.0   0/0     0.0   1/1     0   0
Vince Paul             21   22    7    3   0   8/11   72.7   7/9    77.8   3/4     0   0
Nikola Wagner          21    9    1    3   1   4/10   40.0   1/4    25.0   0/0     1   0
Carmelo Anunoby        21    8    8    2   1   2/3    66.7   0/0     0.0   1/1     1   1

TEAM: FG: 42/76 (55.3%), 3PT: 13/31 (41.9%), REB: 50 (13 off, 37 def), AST: 22, TO: 10

================================================================================
