================================================================================
                        FULL GAME - Team_007 vs Team_062                        
================================================================================

================================================================================
                       1ST QUARTER - Team_007 vs Team_062                       
================================================================================

[12:00] Team_007 possession (Score: 0-0)
Jaren Dosunmu attempts a 3Pt. Contested by RJ Williamson (4.4 feet, ZONE). Jaren Dosunmu misses. Rebound secured by Michael Hyland.

[11:40] Team_062 possession (Score: 0-0)
Jalen Reaves attempts a Layup. BLOCKED BY JOHN QUICKLEY! Ball is loose! Rebound secured by Bones Siakam.

[11:27] Team_007 possession (Score: 0-0)
John Quickley drives and kicks out. Tobias Johnson attempts a 3Pt. Contested by Chris Bird (4.2 feet, MAN). Tobias Johnson misses. Rebound secured by Michael Hyland.

[11:13] Team_062 possession (Score: 0-0)
Michael Hyland attempts a 3Pt. Contested by Bones Siakam (3.5 feet, MAN). Michael Hyland misses. Rebound secured by John Quickley.

[10:59] Team_007 possession (Score: 0-0)
John Quickley attempts a Layup. Contested by Kawhi Thompson (5.5 feet, MAN). JOHN QUICKLEY MAKES IT! Assist: Tobias Johnson
Score: 2-0

[10:44] Team_062 possession (Score: 2-0)
Chris Bird attempts a 3Pt. Contested by Tobias Johnson (5.0 feet, MAN). Chris Bird misses. Rebound secured by Carmelo Siakam.

[10:31] Team_007 possession (Score: 2-0)
John Quickley drives, picks up Kawhi Thompson. Help arrives from Chris Bird! John Quickley attempts a Dunk. Contested by Chris Bird (5.5 feet, MAN). John Quickley misses. Offensive rebound by Carmelo Siakam! Carmelo Siakam's putback is no good. Rebound secured by Kawhi Thompson.

[10:20] Team_062 possession (Score: 2-0)
FOUL! Offensive foul on Kawhi Thompson! John Quickley drew the charge! [Team fouls: 1] (Kawhi Thompson: 1 personal fouls) TURNOVER! (dead ball)

[10:05] Team_007 possession (Score: 2-0)
FOUL! Holding foul on Kawhi Thompson. [Team fouls: 2] No free throws, side out. (Kawhi Thompson: 2 personal fouls)

[09:49] Team_007 possession (Score: 2-0)
Tobias Johnson attempts a 3Pt. Contested by RJ Williamson (4.7 feet, ZONE). TOBIAS JOHNSON MAKES IT! Assist: Jaren Dosunmu
Score: 5-0

[09:36] Team_062 possession (Score: 5-0)
RJ Williamson throws a bad pass out of bounds! TURNOVER! (dead ball)

[09:22] Team_007 possession (Score: 5-0)
FOUL! Holding foul on Michael Hyland. [Team fouls: 3] No free throws, side out. (Michael Hyland: 1 personal fouls)

[09:10] Team_007 possession (Score: 5-0)
Tobias Johnson drives, picks up Jalen Reaves. Help arrives from Chris Bird! Tobias Johnson attempts a Dunk. Contested by Chris Bird (5.3 feet, ZONE). TOBIAS JOHNSON MAKES IT!
Score: 7-0

[08:55] Team_062 possession (Score: 7-0)
Chris Bird attempts a 3Pt. Contested by Tobias Johnson (5.0 feet, MAN). CHRIS BIRD MAKES IT! Assist: RJ Williamson
Score: 7-3

[08:43] Team_007 possession (Score: 7-3)
Carmelo Siakam attempts a Midrange. Contested by Michael Hyland (5.1 feet, ZONE). Carmelo Siakam misses. Rebound secured by Kawhi Thompson.

[08:28] Team_062 possession (Score: 7-3)
Jalen Reaves attempts a Midrange. Contested by John Quickley (3.2 feet, MAN). Jalen Reaves misses. Offensive rebound by Kawhi Thompson! Kawhi Thompson kicks it out.

[08:12] Team_062 possession (Score: 7-3)
Chris Bird drives, Tobias Johnson stays with him. Chris Bird attempts a Dunk. Contested by Tobias Johnson (5.0 feet, MAN). CHRIS BIRD MAKES IT! Assist: Jalen Reaves
Score: 7-5

[07:59] Team_007 possession (Score: 7-5)
FOUL! Holding foul on Chris Bird. [Team fouls: 4] No free throws, side out. (Chris Bird: 1 personal fouls)

[07:49] Team_007 possession (Score: 7-5)
Bones Siakam drives and kicks out. Tobias Johnson attempts a 3Pt. Contested by Chris Bird (4.2 feet, MAN). Tobias Johnson misses. FOUL! Loose ball foul on Jalen Reaves during the rebound battle. [IN THE BONUS! 5 team fouls] Carmelo Siakam to the line for 2 free throws. (Jalen Reaves: 1 personal fouls)   FT 1/2: GOOD   FT 2/2: GOOD Carmelo Siakam makes 2/2 from the line.
Score: 9-5

[07:32] Team_062 possession (Score: 9-5)
Kawhi Thompson attempts a Layup. Contested by John Quickley (3.0 feet, MAN). KAWHI THOMPSON MAKES IT! Assist: Michael Hyland
Score: 9-7

[07:20] Team_007 possession (Score: 9-7)
Tobias Johnson loses control! Ball rolls out of bounds! TURNOVER! (dead ball)

[07:01] Team_062 possession (Score: 9-7)
Michael Hyland attempts a 3Pt. Contested by Bones Siakam (3.5 feet, MAN). Michael Hyland misses. Rebound secured by Bones Siakam.

[06:46] Team_007 possession (Score: 9-7)
FOUL! Shooting foul on RJ Williamson. Jaren Dosunmu to the line for 3 free throws. [BONUS: 6 team fouls] (RJ Williamson: 1 personal fouls)   FT 1/3: GOOD   FT 2/3: GOOD   FT 3/3: GOOD Jaren Dosunmu makes 3/3 from the line.
Score: 12-7

[06:30] Team_062 possession (Score: 12-7)
Michael Hyland loses the ball! Stripped by Bones Siakam! TURNOVER! (live ball)

[06:18] Team_007 possession (Score: 12-7)
Tobias Johnson drives and kicks out. Jaren Dosunmu attempts a 3Pt. Contested by RJ Williamson (4.4 feet, MAN). Jaren Dosunmu misses. Rebound secured by Michael Hyland.

[06:01] Team_062 possession (Score: 12-7)
FOUL! Holding foul on John Quickley. [Team fouls: 1] No free throws, side out. (John Quickley: 1 personal fouls)

[05:46] Team_062 possession (Score: 12-7)
Kawhi Thompson drives and kicks out. Michael Hyland attempts a 3Pt. Contested by John Quickley (3.0 feet, ZONE). Michael Hyland misses. Rebound secured by John Quickley.

[05:31] Team_007 possession (Score: 12-7)
Carmelo Siakam drives and kicks out. Carmelo Siakam attempts a Midrange. Contested by Kawhi Thompson (4.8 feet, ZONE). Carmelo Siakam misses. Rebound secured by Michael Hyland.

[05:15] Team_062 possession (Score: 12-7)
Jalen Reaves drives to the basket... FOUL! Offensive foul on Jalen Reaves! John Quickley drew the charge! [Team fouls: 7] (Jalen Reaves: 2 personal fouls) TURNOVER! (dead ball)

[05:02] Team_007 possession (Score: 12-7)
Bones Siakam attempts a 3Pt. Contested by Michael Hyland (4.8 feet, MAN). Bones Siakam misses. Offensive rebound by Bones Siakam! Bones Siakam's putback is no good. Rebound secured by Michael Hyland.

[04:46] Team_062 possession (Score: 12-7)
FOUL! Reach-in foul on John Quickley during the drive. [Team fouls: 2] No free throws, side out. (John Quickley: 2 personal fouls)

[04:30] Team_062 possession (Score: 12-7)
Michael Hyland attempts a Layup. Contested by Bones Siakam (3.6 feet, MAN). MICHAEL HYLAND MAKES IT!
Score: 12-9

[04:13] Team_007 possession (Score: 12-9)
Tobias Johnson drives to the basket... Tobias Johnson loses the ball! Stripped by Chris Bird! TURNOVER! (live ball)

[03:54] Team_062 possession (Score: 12-9)
RJ Williamson attempts a 3Pt. Contested by John Quickley (2.9 feet, ZONE). RJ Williamson misses. Rebound secured by John Quickley.

[03:43] Team_007 possession (Score: 12-9)
Carmelo Siakam attempts a Midrange. Contested by Jalen Reaves (5.5 feet, MAN). Carmelo Siakam misses. FOUL! Loose ball foul on Kawhi Thompson during the rebound battle. [IN THE BONUS! 8 team fouls] Carmelo Siakam to the line for 2 free throws. (Kawhi Thompson: 3 personal fouls)   FT 1/2: GOOD   FT 2/2: GOOD Carmelo Siakam makes 2/2 from the line.
Score: 14-9

[03:25] Team_062 possession (Score: 14-9)
Michael Hyland attempts a 3Pt. Contested by John Quickley (3.2 feet, ZONE). Michael Hyland misses. Rebound secured by Bones Siakam.

[03:11] Team_007 possession (Score: 14-9)
Tobias Johnson attempts a Midrange. Contested by Chris Bird (4.7 feet, MAN). Tobias Johnson misses. Rebound secured by Michael Hyland.

[02:55] Team_062 possession (Score: 14-9)
RJ Williamson drives, John Quickley stays with him. RJ Williamson attempts a Layup. Contested by John Quickley (3.0 feet, ZONE). RJ Williamson misses. Rebound secured by Bones Siakam.

[02:41] Team_007 possession (Score: 14-9)
FOUL! Shooting foul on Jalen Reaves. Carmelo Siakam to the line for 2 free throws. [BONUS: 9 team fouls] (Jalen Reaves: 3 personal fouls)   FT 1/2: GOOD   FT 2/2: MISS Carmelo Siakam makes 1/2 from the line. Rebound secured by Jalen Reaves.
Score: 15-9

[02:28] Team_062 possession (Score: 15-9)
FOUL! Reach-in foul on John Quickley during the drive. [Team fouls: 3] No free throws, side out. (John Quickley: 3 personal fouls)

[02:14] Team_062 possession (Score: 15-9)
Jalen Reaves attempts a 3Pt. Contested by John Quickley (3.6 feet, ZONE). Jalen Reaves misses. Offensive rebound by Jalen Reaves! Jalen Reaves kicks it out.

[01:58] Team_062 possession (Score: 15-9)
Jalen Reaves attempts a 3Pt. Contested by John Quickley (3.6 feet, MAN). Jalen Reaves misses. Offensive rebound by Kawhi Thompson! Kawhi Thompson kicks it out.

[01:40] Team_062 possession (Score: 15-9)
Kawhi Thompson attempts a Midrange. Contested by John Quickley (3.5 feet, ZONE). Kawhi Thompson misses. Rebound secured by John Quickley.

[01:25] Team_007 possession (Score: 15-9)
John Quickley attempts a Layup. Contested by Kawhi Thompson (5.8 feet, MAN). JOHN QUICKLEY MAKES IT! Assist: Bones Siakam
Score: 17-9

[01:13] Team_062 possession (Score: 17-9)
Jalen Reaves attempts a Layup. Contested by John Quickley (3.7 feet, ZONE). JALEN REAVES MAKES IT!
Score: 17-11

[00:56] Team_007 possession (Score: 17-11)
Jaren Dosunmu attempts a 3Pt. Contested by RJ Williamson (4.8 feet, ZONE). Jaren Dosunmu misses. Rebound secured by Michael Hyland.

[00:42] Team_062 possession (Score: 17-11)
Kawhi Thompson drives and kicks out. RJ Williamson attempts a 3Pt. Contested by Tobias Johnson (5.2 feet, ZONE). RJ Williamson misses. Rebound secured by Bones Siakam.

[00:32] Team_007 possession (Score: 17-11)
Bones Siakam throws a bad pass out of bounds! TURNOVER! (dead ball)

[00:32] Substitution (Team_007): Tobias Johnson OUT → Wendell Poole IN (stamina_rule2)

[00:32] Substitution (Team_007): Jaren Dosunmu OUT → OG Porzingis IN (stamina_rule2)

[00:32] Substitution (Team_007): Bones Siakam OUT → Gary LaVine IN (stamina_rule2)

[00:32] Substitution (Team_007): John Quickley OUT → Austin Simons IN (stamina_rule2)

[00:32] Substitution (Team_007): Carmelo Siakam OUT → Draymond Harris IN (stamina_rule2)

[00:32] Substitution (Team_062): Chris Bird OUT → Paolo McCollum IN (stamina_rule2)

[00:32] Substitution (Team_062): RJ Williamson OUT → Tony LaVine IN (stamina_rule2)

[00:32] Substitution (Team_062): Michael Hyland OUT → Paul Poole IN (stamina_rule2)

[00:32] Substitution (Team_062): Kawhi Thompson OUT → RJ Wall IN (stamina_rule2)

[00:32] Substitution (Team_062): Jalen Reaves OUT → Devin Young IN (stamina_rule2)

[00:16] Team_062 possession (Score: 17-11)
Devin Young attempts a Layup. Contested by Austin Simons (4.2 feet, ZONE). DEVIN YOUNG MAKES IT! Assist: Paul Poole
Score: 17-13

[00:04] Team_007 possession (Score: 17-13)
OG Porzingis attempts a 3Pt. Contested by Paolo McCollum (5.2 feet, ZONE). OG PORZINGIS MAKES IT! Assist: Austin Simons
Score: 20-13

================================================================================
                              1ST QUARTER COMPLETE                              
================================================================================

1ST QUARTER SCORE: Team_007 20, Team_062 13

BOX SCORE:
================================================================================

Team_007
--------------------------------------------------------------------------------
Player                MIN  PTS  REB  AST  TO      FG   FG%      3P   3P%
--------------------------------------------------------------------------------
Tobias Johnson         12    5    0    1   0   2/4    50.0     0/0   0.0
John Quickley          12    4    4    0   0   2/4    50.0     0/0   0.0
Carmelo Siakam         12    4    1    0   0   2/5    40.0     0/0   0.0
Jaren Dosunmu          12    3    0    1   0   1/3    33.3     0/0   0.0
OG Porzingis            0    3    0    0   0   1/1   100.0     0/0   0.0
Bones Siakam           12    0    5    1   0   0/1     0.0     0/0   0.0
Austin Simons           0    0    0    1   0   0/0     0.0     0/0   0.0

TEAM: FG: 8/18 (44.4%), 3PT: 3/6 (50.0%), REB: 12 (2 off, 10 def), AST: 4, TO: 3
TEAM FOULS: 3


Team_062
--------------------------------------------------------------------------------
Player                MIN  PTS  REB  AST  TO      FG   FG%      3P   3P%
--------------------------------------------------------------------------------
Chris Bird             12    5    0    0   0   2/3    66.7     0/0   0.0
Michael Hyland         12    2    7    1   0   1/4    25.0     0/0   0.0
Jalen Reaves           12    2    2    1   0   1/2    50.0     0/0   0.0
Kawhi Thompson         12    2    4    0   0   1/4    25.0     0/0   0.0
Devin Young             0    2    0    0   0   1/1   100.0     0/0   0.0
RJ Williamson          12    0    0    1   0   0/2     0.0     0/0   0.0
Paul Poole              0    0    0    1   0   0/0     0.0     0/0   0.0

TEAM: FG: 6/16 (37.5%), 3PT: 1/6 (16.7%), REB: 11 (3 off, 8 def), AST: 4, TO: 4
TEAM FOULS: 9 [Team_007 in BONUS]

================================================================================

================================================================================
                       2ND QUARTER - Team_007 vs Team_062                       
================================================================================

[12:00] Substitution (Team_007): Bones Siakam OUT → Gary LaVine IN (stamina_rule2)

[12:00] Substitution (Team_007): John Quickley OUT → Austin Simons IN (stamina_rule2)

[12:00] Substitution (Team_007): Carmelo Siakam OUT → Draymond Harris IN (stamina_rule2)

[12:00] Substitution (Team_062): Jalen Reaves OUT → Devin Young IN (stamina_rule2)

[12:00] Team_007 possession (Score: 20-13)
Jaren Dosunmu drives to the basket... Jaren Dosunmu commits a violation (traveling/carry)! TURNOVER! (dead ball)

[11:43] Team_062 possession (Score: 20-13)
FOUL! Holding foul on Tobias Johnson. [Team fouls: 1] No free throws, side out. (Tobias Johnson: 1 personal fouls)

[11:29] Team_062 possession (Score: 20-13)
Michael Hyland attempts a Midrange. Contested by Austin Simons (3.7 feet, ZONE). Michael Hyland misses. Rebound secured by Gary LaVine.

[11:09] Team_007 possession (Score: 20-13)
Austin Simons loses control! Ball rolls out of bounds! TURNOVER! (dead ball)

[11:09] Substitution (Team_062): Chris Bird OUT → Paolo McCollum IN (stamina_rule2)

[11:09] Substitution (Team_062): RJ Williamson OUT → Tony LaVine IN (stamina_rule2)

[11:09] Substitution (Team_062): Michael Hyland OUT → Paul Poole IN (stamina_rule2)

[11:09] Substitution (Team_062): Kawhi Thompson OUT → RJ Wall IN (stamina_rule2)

[10:52] Team_062 possession (Score: 20-13)
Devin Young attempts a 3Pt. Contested by Jaren Dosunmu (5.1 feet, ZONE). Devin Young misses. Offensive rebound by Devin Young! Devin Young kicks it out.

[10:40] Team_062 possession (Score: 20-13)
Paul Poole throws a bad pass! Stolen by Gary LaVine! TURNOVER! (live ball)

[10:23] Team_007 possession (Score: 20-13)
FOUL! Reach-in foul on RJ Wall during the drive. [Team fouls: 1] No free throws, side out. (RJ Wall: 1 personal fouls)

[10:08] Team_007 possession (Score: 20-13)
Tobias Johnson attempts a 3Pt. Contested by Paolo McCollum (5.8 feet, MAN). TOBIAS JOHNSON MAKES IT! Assist: Gary LaVine
Score: 23-13

[09:58] Team_062 possession (Score: 23-13)
Paolo McCollum drives to the basket... Paolo McCollum throws a bad pass! Stolen by Tobias Johnson! TURNOVER! (live ball)

[09:44] Team_007 possession (Score: 23-13)
Tobias Johnson makes the Dunk and draws the foul on Paolo McCollum! And-1! Tobias Johnson to the line for 1. [Team fouls: 2] (Paolo McCollum: 1 personal fouls)   FT 1/1: GOOD Tobias Johnson makes 1/1 from the line.
Score: 26-13

[09:33] Team_062 possession (Score: 26-13)
FOUL! Holding foul on Austin Simons. [Team fouls: 2] No free throws, side out. (Austin Simons: 1 personal fouls)

[09:19] Team_062 possession (Score: 26-13)
Tony LaVine drives, picks up Austin Simons. Help arrives from Jaren Dosunmu! Tony LaVine attempts a Layup. Contested by Jaren Dosunmu (4.1 feet, ZONE). TONY LAVINE MAKES IT!
Score: 26-15

[09:00] Team_007 possession (Score: 26-15)
FOUL! Reach-in foul on RJ Wall during the drive. [Team fouls: 3] No free throws, side out. (RJ Wall: 2 personal fouls)

[08:46] Team_007 possession (Score: 26-15)
Jaren Dosunmu attempts a 3Pt. Contested by RJ Wall (5.1 feet, ZONE). JAREN DOSUNMU MAKES IT! Assist: Tobias Johnson
Score: 29-15

[08:32] Team_062 possession (Score: 29-15)
Paul Poole attempts a 3Pt. Contested by Jaren Dosunmu (5.0 feet, ZONE). Paul Poole misses. Rebound secured by Gary LaVine.

[08:16] Team_007 possession (Score: 29-15)
Tobias Johnson throws a bad pass! Stolen by Paolo McCollum! TURNOVER! (live ball)

[08:03] Team_062 possession (Score: 29-15)
RJ Wall attempts a 3Pt. Contested by Tobias Johnson (5.3 feet, ZONE). RJ WALL MAKES IT!
Score: 29-18

[07:49] Team_007 possession (Score: 29-18)
Jaren Dosunmu attempts a Midrange. Contested by Tony LaVine (5.8 feet, MAN). Jaren Dosunmu misses. Offensive rebound by Draymond Harris! Draymond Harris kicks it out.

[07:39] Team_007 possession (Score: 29-18)
Gary LaVine commits a violation (traveling/carry)! TURNOVER! (dead ball)

[07:39] Substitution (Team_007): Tobias Johnson OUT → Wendell Poole IN (stamina_rule2)

[07:39] Substitution (Team_007): Jaren Dosunmu OUT → OG Porzingis IN (stamina_rule2)

[07:22] Team_062 possession (Score: 29-18)
Paul Poole attempts a Layup. Contested by Gary LaVine (4.4 feet, MAN). Paul Poole misses. Offensive rebound by RJ Wall! RJ Wall kicks it out.

[07:07] Team_062 possession (Score: 29-18)
FOUL! Offensive foul on Devin Young! Draymond Harris drew the charge! [Team fouls: 4] (Devin Young: 1 personal fouls) TURNOVER! (dead ball)

[06:52] Team_007 possession (Score: 29-18)
Austin Simons attempts a Midrange. Wide open! Tony LaVine is 6.2 feet away. [ZONE] Austin Simons misses. Rebound secured by Paul Poole.

[06:37] Team_062 possession (Score: 29-18)
Paul Poole attempts a Midrange. Contested by Gary LaVine (4.4 feet, ZONE). Paul Poole misses. Rebound secured by Gary LaVine.

[06:25] Team_007 possession (Score: 29-18)
OG Porzingis attempts a Midrange. Contested by RJ Wall (4.8 feet, ZONE). OG Porzingis misses. Rebound secured by Paul Poole.

[06:07] Team_062 possession (Score: 29-18)
Tony LaVine drives, Austin Simons stays with him. Tony LaVine attempts a Layup. Contested by Austin Simons (4.1 feet, ZONE). Tony LaVine misses. Rebound secured by Gary LaVine.

[05:56] Team_007 possession (Score: 29-18)
OG Porzingis attempts a 3Pt. Contested by Paolo McCollum (5.2 feet, ZONE). OG Porzingis misses. Rebound secured by RJ Wall.

[05:41] Team_062 possession (Score: 29-18)
Devin Young attempts a Layup. Contested by Draymond Harris (5.4 feet, MAN). DEVIN YOUNG MAKES IT! Assist: Paolo McCollum
Score: 29-20

[05:27] Team_007 possession (Score: 29-20)
FOUL! Shooting foul on Tony LaVine. OG Porzingis to the line for 2 free throws. [BONUS: 5 team fouls] (Tony LaVine: 1 personal fouls)   FT 1/2: GOOD   FT 2/2: GOOD OG Porzingis makes 2/2 from the line.
Score: 31-20

[05:13] Team_062 possession (Score: 31-20)
FOUL! Shooting foul on Austin Simons. Tony LaVine to the line for 2 free throws. [Team fouls: 3] (Austin Simons: 2 personal fouls)   FT 1/2: GOOD   FT 2/2: GOOD Tony LaVine makes 2/2 from the line.
Score: 31-22

[05:00] Team_007 possession (Score: 31-22)
Austin Simons drives to the basket... Austin Simons throws a bad pass! Stolen by RJ Wall! TURNOVER! (live ball)

[04:47] Team_062 possession (Score: 31-22)
Paul Poole makes the Layup and draws the foul on OG Porzingis! And-1! Paul Poole to the line for 1. [Team fouls: 4] (OG Porzingis: 1 personal fouls)   FT 1/1: GOOD Paul Poole makes 1/1 from the line.
Score: 31-25

[04:31] Team_007 possession (Score: 31-25)
Draymond Harris makes the Midrange and draws the foul on Tony LaVine! And-1! Draymond Harris to the line for 1. [BONUS: 6 team fouls] (Tony LaVine: 2 personal fouls)   FT 1/1: GOOD Draymond Harris makes 1/1 from the line.
Score: 34-25

[04:13] Team_062 possession (Score: 34-25)
Paolo McCollum attempts a 3Pt. Contested by OG Porzingis (4.5 feet, ZONE). Paolo McCollum misses. Rebound secured by Austin Simons.

[03:57] Team_007 possession (Score: 34-25)
Austin Simons makes the Layup and draws the foul on RJ Wall! And-1! Austin Simons to the line for 1. [BONUS: 7 team fouls] (RJ Wall: 3 personal fouls)   FT 1/1: MISS Austin Simons makes 0/1 from the line. Offensive rebound by Draymond Harris! Draymond Harris kicks it out.
Score: 36-25

[03:42] Team_007 possession (Score: 36-25)
Gary LaVine drives, RJ Wall stays with him. Gary LaVine attempts a Dunk. Contested by RJ Wall (5.4 feet, ZONE). GARY LAVINE MAKES IT! Assist: Wendell Poole
Score: 38-25

[03:27] Team_062 possession (Score: 38-25)
Paolo McCollum attempts a 3Pt. Contested by Wendell Poole (5.4 feet, ZONE). PAOLO MCCOLLUM MAKES IT! Assist: Tony LaVine
Score: 38-28

[03:10] Team_007 possession (Score: 38-28)
Gary LaVine drives to the basket... Gary LaVine loses the ball! Stripped by Paul Poole! TURNOVER! (live ball)

[02:58] Team_062 possession (Score: 38-28)
RJ Wall attempts a Midrange. Contested by OG Porzingis (4.1 feet, ZONE). RJ Wall misses. Rebound secured by Austin Simons.

[02:43] Team_007 possession (Score: 38-28)
Wendell Poole drives, RJ Wall stays with him. Wendell Poole attempts a Layup. Contested by RJ Wall (5.6 feet, ZONE). WENDELL POOLE MAKES IT! Assist: Austin Simons
Score: 40-28

[02:28] Team_062 possession (Score: 40-28)
RJ Wall attempts a 3Pt. Contested by OG Porzingis (4.1 feet, ZONE). RJ Wall misses. Rebound secured by Draymond Harris.

[02:14] Team_007 possession (Score: 40-28)
FOUL! Reach-in foul on RJ Wall during the drive. [IN THE BONUS! 8 team fouls] Austin Simons to the line for 2 free throws. (RJ Wall: 4 personal fouls)   FT 1/2: MISS   FT 2/2: GOOD Austin Simons makes 1/2 from the line.
Score: 41-28

[01:59] Team_062 possession (Score: 41-28)
Tony LaVine attempts a Midrange. Contested by OG Porzingis (4.5 feet, MAN). TONY LAVINE MAKES IT!
Score: 41-30

[01:48] Team_007 possession (Score: 41-30)
OG Porzingis attempts a 3Pt. BLOCKED BY PAOLO MCCOLLUM! Ball deflects out of bounds off OG Porzingis.

[01:35] Team_062 possession (Score: 41-30)
FOUL! Holding foul on Wendell Poole. [IN THE BONUS! 5 team fouls] Paolo McCollum to the line for 2 free throws. (Wendell Poole: 1 personal fouls)   FT 1/2: MISS   FT 2/2: GOOD Paolo McCollum makes 1/2 from the line.
Score: 41-31

[01:24] Team_007 possession (Score: 41-31)
Draymond Harris attempts a Midrange. Wide open! Devin Young is 6.4 feet away. [MAN] DRAYMOND HARRIS MAKES IT!
Score: 43-31

[01:08] Team_062 possession (Score: 43-31)
Devin Young attempts a Midrange. Contested by Draymond Harris (5.7 feet, MAN). DEVIN YOUNG MAKES IT! Assist: Tony LaVine
Score: 43-33

[00:56] Team_007 possession (Score: 43-33)
Gary LaVine attempts a Midrange. Wide open! Paul Poole is 6.6 feet away. [MAN] Gary LaVine misses. Rebound secured by Devin Young.

[00:45] Team_062 possession (Score: 43-33)
Devin Young drives to the basket... Devin Young loses control! Ball rolls out of bounds! TURNOVER! (dead ball)

[00:34] Team_007 possession (Score: 43-33)
OG Porzingis attempts a 3Pt. Contested by Tony LaVine (5.9 feet, MAN). OG Porzingis misses. Rebound secured by Paul Poole.

[00:20] Team_062 possession (Score: 43-33)
FOUL! Shooting foul on OG Porzingis. Tony LaVine to the line for 3 free throws. [BONUS: 6 team fouls] (OG Porzingis: 2 personal fouls)   FT 1/3: GOOD   FT 2/3: GOOD   FT 3/3: GOOD Tony LaVine makes 3/3 from the line.
Score: 43-36

[00:07] Team_007 possession (Score: 43-36)
OG Porzingis attempts a 3Pt. Wide open! Tony LaVine is 6.0 feet away. [MAN] OG Porzingis misses. Rebound secured by Devin Young.

================================================================================
                              2ND QUARTER COMPLETE                              
================================================================================

2ND QUARTER SCORE: Team_007 23, Team_062 23

BOX SCORE:
================================================================================

Team_007
--------------------------------------------------------------------------------
Player                MIN  PTS  REB  AST  TO      FG   FG%      3P   3P%
--------------------------------------------------------------------------------
Tobias Johnson         16    6    0    1   0   2/2   100.0     0/0   0.0
Draymond Harris        12    5    3    0   0   2/2   100.0     0/0   0.0
Jaren Dosunmu          16    3    0    0   0   1/1   100.0     0/0   0.0
Gary LaVine            12    2    4    1   0   1/2    50.0     0/0   0.0
OG Porzingis            8    2    0    0   0   1/6    16.7     0/0   0.0
Wendell Poole           8    2    0    1   0   1/1   100.0     0/0   0.0
Austin Simons          12    1    2    1   0   1/2    50.0     0/0   0.0

TEAM: FG: 9/16 (56.2%), 3PT: 2/6 (33.3%), REB: 9 (2 off, 7 def), AST: 4, TO: 6
TEAM FOULS: 6 [Team_062 in BONUS]


Team_062
--------------------------------------------------------------------------------
Player                MIN  PTS  REB  AST  TO      FG   FG%      3P   3P%
--------------------------------------------------------------------------------
Tony LaVine            11    9    0    2   0   4/5    80.0     0/0   0.0
Devin Young            12    4    3    0   0   2/2   100.0     0/0   0.0
Paolo McCollum         11    4    0    1   0   2/3    66.7     0/0   0.0
Paul Poole             11    3    3    0   0   1/3    33.3     0/0   0.0
RJ Wall                11    3    2    0   0   1/3    33.3     0/0   0.0
Michael Hyland         13    0    0    0   0   0/1     0.0     0/0   0.0

TEAM: FG: 10/17 (58.8%), 3PT: 3/6 (50.0%), REB: 8 (2 off, 6 def), AST: 3, TO: 4
TEAM FOULS: 8 [Team_007 in BONUS]

================================================================================

================================================================================
                       3RD QUARTER - Team_007 vs Team_062                       
================================================================================

[12:00] Team_007 possession (Score: 43-36)
John Quickley drives, Kawhi Thompson stays with him. John Quickley attempts a Dunk. Contested by Kawhi Thompson (5.5 feet, MAN). JOHN QUICKLEY MAKES IT! Assist: Tobias Johnson
Score: 45-36

[11:42] Team_062 possession (Score: 45-36)
Chris Bird attempts a 3Pt. Contested by Tobias Johnson (5.0 feet, MAN). Chris Bird misses. Rebound secured by Carmelo Siakam.

[11:26] Team_007 possession (Score: 45-36)
FOUL! Shooting foul on RJ Williamson. Jaren Dosunmu to the line for 3 free throws. [Team fouls: 1] (RJ Williamson: 1 personal fouls)   FT 1/3: GOOD   FT 2/3: GOOD   FT 3/3: MISS Jaren Dosunmu makes 2/3 from the line. Rebound secured by Kawhi Thompson.
Score: 47-36

[11:11] Team_062 possession (Score: 47-36)
Jalen Reaves drives to the basket... Jalen Reaves throws a bad pass! Stolen by John Quickley! TURNOVER! (live ball)

[10:53] Team_007 possession (Score: 47-36)
Carmelo Siakam drives and kicks out. John Quickley attempts a 3Pt. Contested by Kawhi Thompson (4.8 feet, MAN). JOHN QUICKLEY MAKES IT! Assist: Bones Siakam
Score: 50-36

[10:44] Team_062 possession (Score: 50-36)
Jalen Reaves drives and kicks out. Jalen Reaves attempts a 3Pt. Contested by John Quickley (3.0 feet, MAN). Jalen Reaves misses. Offensive rebound by Kawhi Thompson! Kawhi Thompson kicks it out.

[10:28] Team_062 possession (Score: 50-36)
Jalen Reaves attempts a 3Pt. Contested by Bones Siakam (3.8 feet, ZONE). Jalen Reaves misses. Rebound secured by Carmelo Siakam.

[10:18] Team_007 possession (Score: 50-36)
Jaren Dosunmu attempts a 3Pt. Contested by RJ Williamson (4.4 feet, MAN). JAREN DOSUNMU MAKES IT!
Score: 53-36

[10:05] Team_062 possession (Score: 53-36)
Kawhi Thompson attempts a 3Pt. Contested by John Quickley (3.0 feet, ZONE). Kawhi Thompson misses. Offensive rebound by Jalen Reaves! Jalen Reaves's putback is no good. Rebound secured by John Quickley.

[09:53] Team_007 possession (Score: 53-36)
FOUL! Holding foul on Jalen Reaves. [Team fouls: 2] No free throws, side out. (Jalen Reaves: 1 personal fouls)

[09:41] Team_007 possession (Score: 53-36)
Carmelo Siakam drives and kicks out. Tobias Johnson attempts a 3Pt. Contested by Chris Bird (4.2 feet, MAN). TOBIAS JOHNSON MAKES IT! Assist: Jaren Dosunmu
Score: 56-36

[09:25] Team_062 possession (Score: 56-36)
FOUL! Offensive foul on RJ Williamson! Jaren Dosunmu drew the charge! [Team fouls: 3] (RJ Williamson: 2 personal fouls) TURNOVER! (dead ball)

[09:14] Team_007 possession (Score: 56-36)
John Quickley attempts a Layup. BLOCKED BY KAWHI THOMPSON! Ball is loose! Offensive rebound by Bones Siakam! Bones Siakam kicks it out.

[09:01] Team_007 possession (Score: 56-36)
Tobias Johnson commits a violation (traveling/carry)! TURNOVER! (dead ball)

[08:46] Team_062 possession (Score: 56-36)
RJ Williamson attempts a Midrange. Contested by Jaren Dosunmu (4.1 feet, MAN). RJ WILLIAMSON MAKES IT!
Score: 56-38

[08:33] Team_007 possession (Score: 56-38)
FOUL! Shooting foul on Chris Bird. Tobias Johnson to the line for 2 free throws. [BONUS: 5 team fouls] (Chris Bird: 1 personal fouls)   FT 1/2: GOOD   FT 2/2: GOOD Tobias Johnson makes 2/2 from the line.
Score: 58-38

[08:18] Team_062 possession (Score: 58-38)
Jalen Reaves drives, John Quickley stays with him. Jalen Reaves attempts a Layup. Contested by John Quickley (3.2 feet, MAN). Jalen Reaves misses. Rebound secured by John Quickley.

[08:06] Team_007 possession (Score: 58-38)
Carmelo Siakam drives and kicks out. Tobias Johnson attempts a Midrange. Contested by RJ Williamson (4.4 feet, ZONE). TOBIAS JOHNSON MAKES IT!
Score: 60-38

[07:52] Team_062 possession (Score: 60-38)
RJ Williamson attempts a Midrange. Contested by Jaren Dosunmu (4.1 feet, MAN). RJ Williamson misses. Rebound secured by Bones Siakam.

[07:33] Team_007 possession (Score: 60-38)
Jaren Dosunmu attempts a 3Pt. Contested by RJ Williamson (4.4 feet, MAN). Jaren Dosunmu misses. Rebound secured by Jalen Reaves.

[07:20] Team_062 possession (Score: 60-38)
RJ Williamson attempts a 3Pt. Contested by Jaren Dosunmu (4.1 feet, MAN). RJ WILLIAMSON MAKES IT! Assist: Kawhi Thompson
Score: 60-41

[07:07] Team_007 possession (Score: 60-41)
John Quickley attempts a 3Pt. Contested by Chris Bird (4.9 feet, ZONE). John Quickley misses. Rebound secured by Michael Hyland.

[06:49] Team_062 possession (Score: 60-41)
Jalen Reaves makes the Layup and draws the foul on John Quickley! And-1! Jalen Reaves to the line for 1. [Team fouls: 1] (John Quickley: 1 personal fouls)   FT 1/1: GOOD Jalen Reaves makes 1/1 from the line.
Score: 60-44

[06:31] Team_007 possession (Score: 60-44)
John Quickley drives and kicks out. Tobias Johnson attempts a 3Pt. Contested by RJ Williamson (4.4 feet, ZONE). Tobias Johnson misses. Rebound secured by Kawhi Thompson.

[06:18] Team_062 possession (Score: 60-44)
FOUL! Shooting foul on Tobias Johnson. Chris Bird to the line for 2 free throws. [Team fouls: 2] (Tobias Johnson: 1 personal fouls)   FT 1/2: GOOD   FT 2/2: GOOD Chris Bird makes 2/2 from the line.
Score: 60-46

[06:03] Team_007 possession (Score: 60-46)
Bones Siakam drives, picks up Michael Hyland. Help arrives from Chris Bird! Bones Siakam attempts a Dunk. Contested by Chris Bird (4.8 feet, MAN). BONES SIAKAM MAKES IT!
Score: 62-46

[05:53] Team_062 possession (Score: 62-46)
Jalen Reaves attempts a Layup. Contested by John Quickley (3.3 feet, MAN). Jalen Reaves misses. Rebound secured by Carmelo Siakam.

[05:36] Team_007 possession (Score: 62-46)
Jaren Dosunmu attempts a Layup. BLOCKED BY CHRIS BIRD! Ball is loose! Rebound secured by Kawhi Thompson.

[05:23] Team_062 possession (Score: 62-46)
RJ Williamson attempts a 3Pt. Contested by Jaren Dosunmu (4.1 feet, MAN). RJ Williamson misses. Rebound secured by John Quickley.

[05:08] Team_007 possession (Score: 62-46)
Carmelo Siakam attempts a Midrange. Contested by Jalen Reaves (5.4 feet, MAN). Carmelo Siakam misses. Rebound secured by Michael Hyland.

[04:59] Team_062 possession (Score: 62-46)
Michael Hyland loses control! Ball rolls out of bounds! TURNOVER! (dead ball)

[04:44] Team_007 possession (Score: 62-46)
Jaren Dosunmu loses the ball! Stripped by RJ Williamson! TURNOVER! (live ball)

[04:28] Team_062 possession (Score: 62-46)
FOUL! Offensive foul on Kawhi Thompson! John Quickley drew the charge! [Team fouls: 6] (Kawhi Thompson: 2 personal fouls) TURNOVER! (dead ball)

[04:15] Team_007 possession (Score: 62-46)
Tobias Johnson attempts a Midrange. Contested by Chris Bird (4.6 feet, MAN). TOBIAS JOHNSON MAKES IT! Assist: Jaren Dosunmu
Score: 64-46

[04:03] Team_062 possession (Score: 64-46)
Michael Hyland drives and kicks out. Michael Hyland attempts a Midrange. Contested by John Quickley (3.2 feet, ZONE). Michael Hyland misses. Rebound secured by Bones Siakam.

[03:48] Team_007 possession (Score: 64-46)
Bones Siakam attempts a 3Pt. Contested by Michael Hyland (4.9 feet, MAN). Bones Siakam misses. Rebound secured by Jalen Reaves.

[03:37] Team_062 possession (Score: 64-46)
Jalen Reaves attempts a Midrange. Contested by John Quickley (3.5 feet, MAN). JALEN REAVES MAKES IT! Assist: RJ Williamson
Score: 64-48

[03:26] Team_007 possession (Score: 64-48)
Carmelo Siakam attempts a 3Pt. Contested by RJ Williamson (4.9 feet, ZONE). Carmelo Siakam misses. Rebound secured by Kawhi Thompson.

[03:13] Team_062 possession (Score: 64-48)
Jalen Reaves attempts a Layup. Contested by John Quickley (3.5 feet, MAN). Jalen Reaves misses. Rebound secured by Carmelo Siakam.

[02:58] Team_007 possession (Score: 64-48)
John Quickley drives and kicks out. Bones Siakam attempts a 3Pt. Contested by Michael Hyland (4.9 feet, MAN). Bones Siakam misses. FOUL! Loose ball foul on Michael Hyland during the rebound battle. [IN THE BONUS! 7 team fouls] Carmelo Siakam to the line for 2 free throws. (Michael Hyland: 1 personal fouls)   FT 1/2: GOOD   FT 2/2: GOOD Carmelo Siakam makes 2/2 from the line.
Score: 66-48

[02:45] Team_062 possession (Score: 66-48)
Jalen Reaves attempts a 3Pt. Contested by John Quickley (3.6 feet, MAN). Jalen Reaves misses. Rebound secured by Carmelo Siakam.

[02:30] Team_007 possession (Score: 66-48)
Bones Siakam attempts a 3Pt. Contested by Michael Hyland (5.0 feet, ZONE). Bones Siakam misses. Rebound secured by Michael Hyland.

[02:12] Team_062 possession (Score: 66-48)
Chris Bird drives and kicks out. Michael Hyland attempts a 3Pt. Contested by Bones Siakam (4.0 feet, MAN). Michael Hyland misses. FOUL! Loose ball foul on Bones Siakam during the rebound battle. [Team fouls: 3] No free throws, side out. (Bones Siakam: 1 personal fouls)

[01:56] Team_062 possession (Score: 66-48)
RJ Williamson attempts a 3Pt. Contested by Jaren Dosunmu (4.4 feet, MAN). RJ WILLIAMSON MAKES IT! Assist: Kawhi Thompson
Score: 66-51

[01:43] Team_007 possession (Score: 66-51)
Jaren Dosunmu makes the Dunk and draws the foul on RJ Williamson! And-1! Jaren Dosunmu to the line for 1. [BONUS: 8 team fouls] (RJ Williamson: 3 personal fouls)   FT 1/1: GOOD Jaren Dosunmu makes 1/1 from the line.
Score: 69-51

[01:25] Team_062 possession (Score: 69-51)
RJ Williamson attempts a Layup. Contested by Jaren Dosunmu (4.4 feet, MAN). RJ WILLIAMSON MAKES IT!
Score: 69-53

[01:06] Team_007 possession (Score: 69-53)
Jaren Dosunmu drives, Jalen Reaves stays with him. Jaren Dosunmu attempts a Layup. Contested by Jalen Reaves (5.4 feet, ZONE). JAREN DOSUNMU MAKES IT! Assist: Bones Siakam
Score: 71-53

[00:49] Team_062 possession (Score: 71-53)
Chris Bird attempts a Midrange. Contested by Jaren Dosunmu (4.9 feet, ZONE). Chris Bird misses. Rebound secured by Bones Siakam.

[00:33] Team_007 possession (Score: 71-53)
Tobias Johnson attempts a Layup. Contested by Jalen Reaves (5.7 feet, ZONE). TOBIAS JOHNSON MAKES IT! Assist: Bones Siakam
Score: 73-53

[00:20] Team_062 possession (Score: 73-53)
Kawhi Thompson attempts a Layup. Contested by John Quickley (3.7 feet, MAN). KAWHI THOMPSON MAKES IT! Assist: Chris Bird
Score: 73-55

[00:08] Team_007 possession (Score: 73-55)
Jaren Dosunmu drives, Jalen Reaves stays with him. Jaren Dosunmu attempts a Dunk. Contested by Jalen Reaves (5.5 feet, ZONE). Jaren Dosunmu misses. Offensive rebound by Carmelo Siakam! Carmelo Siakam puts it back in!
Score: 75-55

================================================================================
                              3RD QUARTER COMPLETE                              
================================================================================

3RD QUARTER SCORE: Team_007 32, Team_062 19

BOX SCORE:
================================================================================

Team_007
--------------------------------------------------------------------------------
Player                MIN  PTS  REB  AST  TO      FG   FG%      3P   3P%
--------------------------------------------------------------------------------
Tobias Johnson         28   11    0    1   0   5/5   100.0     0/0   0.0
Jaren Dosunmu          28    8    0    2   0   3/6    50.0     0/0   0.0
John Quickley          24    5    3    0   0   2/4    50.0     0/0   0.0
Carmelo Siakam         24    4    6    0   0   2/4    50.0     0/0   0.0
Bones Siakam           24    2    4    3   0   1/3    33.3     0/0   0.0

TEAM: FG: 13/22 (59.1%), 3PT: 1/7 (14.3%), REB: 12 (2 off, 10 def), AST: 6, TO: 2
TEAM FOULS: 3


Team_062
--------------------------------------------------------------------------------
Player                MIN  PTS  REB  AST  TO      FG   FG%      3P   3P%
--------------------------------------------------------------------------------
RJ Williamson          25   10    0    1   0   4/6    66.7     0/0   0.0
Jalen Reaves           24    5    3    0   0   2/7    28.6     0/0   0.0
Chris Bird             25    2    0    1   0   1/3    33.3     0/0   0.0
Kawhi Thompson         25    2    5    2   0   1/2    50.0     0/0   0.0
Michael Hyland         25    0    3    0   0   0/1     0.0     0/0   0.0

TEAM: FG: 8/19 (42.1%), 3PT: 2/7 (28.6%), REB: 12 (3 off, 9 def), AST: 4, TO: 4
TEAM FOULS: 8 [Team_007 in BONUS]

================================================================================

================================================================================
                       4TH QUARTER - Team_007 vs Team_062                       
================================================================================

[12:00] Team_007 possession (Score: 75-55)
Tobias Johnson attempts a Midrange. Contested by Chris Bird (4.8 feet, MAN). Tobias Johnson misses. Offensive rebound by Carmelo Siakam! Carmelo Siakam puts it back in!
Score: 77-55

[11:50] Team_062 possession (Score: 77-55)
Kawhi Thompson attempts a Layup. Contested by John Quickley (3.5 feet, ZONE). Kawhi Thompson misses. Rebound secured by John Quickley.

[11:36] Team_007 possession (Score: 77-55)
Jaren Dosunmu attempts a Layup. Contested by Jalen Reaves (5.3 feet, ZONE). Jaren Dosunmu misses. Rebound secured by Kawhi Thompson.

[11:24] Team_062 possession (Score: 77-55)
Kawhi Thompson attempts a 3Pt. Contested by John Quickley (3.6 feet, ZONE). Kawhi Thompson misses. Rebound secured by Carmelo Siakam.

[11:09] Team_007 possession (Score: 77-55)
Carmelo Siakam makes the Midrange and draws the foul on Kawhi Thompson! And-1! Carmelo Siakam to the line for 1. [Team fouls: 1] (Kawhi Thompson: 1 personal fouls)   FT 1/1: GOOD Carmelo Siakam makes 1/1 from the line.
Score: 80-55

[10:56] Team_062 possession (Score: 80-55)
Kawhi Thompson attempts a 3Pt. Contested by John Quickley (3.7 feet, ZONE). Kawhi Thompson misses. Rebound secured by Carmelo Siakam.

[10:41] Team_007 possession (Score: 80-55)
Tobias Johnson drives and kicks out. Jaren Dosunmu attempts a 3Pt. Contested by RJ Williamson (4.9 feet, MAN). Jaren Dosunmu misses. Rebound secured by Kawhi Thompson.

[10:22] Team_062 possession (Score: 80-55)
Chris Bird attempts a Layup. Contested by John Quickley (3.9 feet, ZONE). CHRIS BIRD MAKES IT!
Score: 80-57

[10:09] Team_007 possession (Score: 80-57)
Tobias Johnson attempts a Layup. BLOCKED BY CHRIS BIRD! Ball is loose! Offensive rebound by Carmelo Siakam! Carmelo Siakam kicks it out.

[09:59] Team_007 possession (Score: 80-57)
Bones Siakam attempts a 3Pt. Contested by RJ Williamson (5.0 feet, ZONE). Bones Siakam misses. Rebound secured by Jalen Reaves.

[09:47] Team_062 possession (Score: 80-57)
RJ Williamson attempts a 3Pt. Contested by Jaren Dosunmu (4.6 feet, MAN). RJ Williamson misses. Rebound secured by Bones Siakam.

[09:29] Team_007 possession (Score: 80-57)
FOUL! Reach-in foul on Chris Bird during the drive. [Team fouls: 2] No free throws, side out. (Chris Bird: 1 personal fouls)

[09:14] Team_007 possession (Score: 80-57)
Jaren Dosunmu loses the ball! Stripped by RJ Williamson! TURNOVER! (live ball)

[09:04] Team_062 possession (Score: 80-57)
RJ Williamson attempts a 3Pt. Contested by John Quickley (3.7 feet, ZONE). RJ Williamson misses. Rebound secured by John Quickley.

[08:48] Team_007 possession (Score: 80-57)
Carmelo Siakam drives, Jalen Reaves stays with him. Carmelo Siakam attempts a Dunk. Contested by Jalen Reaves (6.0 feet, ZONE). Carmelo Siakam misses. Rebound secured by Michael Hyland.

[08:29] Team_062 possession (Score: 80-57)
Chris Bird attempts a 3Pt. Contested by Jaren Dosunmu (5.1 feet, ZONE). CHRIS BIRD MAKES IT! Assist: RJ Williamson
Score: 80-60

[08:13] Team_007 possession (Score: 80-60)
Tobias Johnson attempts a 3Pt. Contested by Chris Bird (5.2 feet, MAN). Tobias Johnson misses. Rebound secured by Jalen Reaves.

[07:55] Team_062 possession (Score: 80-60)
Chris Bird drives, picks up John Quickley. Help arrives from Jaren Dosunmu! Chris Bird attempts a Layup. Contested by Jaren Dosunmu (4.3 feet, ZONE). Chris Bird misses. Offensive rebound by Jalen Reaves! Jalen Reaves kicks it out.

[07:36] Team_062 possession (Score: 80-60)
Kawhi Thompson attempts a Midrange. Contested by Bones Siakam (4.7 feet, ZONE). Kawhi Thompson misses. Rebound secured by Carmelo Siakam.

[07:24] Team_007 possession (Score: 80-60)
Tobias Johnson attempts a Layup. Contested by Chris Bird (5.3 feet, MAN). Tobias Johnson misses. Offensive rebound by Bones Siakam! Bones Siakam kicks it out.

[07:06] Team_007 possession (Score: 80-60)
Tobias Johnson attempts a Layup. Wide open! Jalen Reaves is 6.1 feet away. [ZONE] TOBIAS JOHNSON MAKES IT! Assist: Jaren Dosunmu
Score: 82-60

[06:48] Team_062 possession (Score: 82-60)
Kawhi Thompson drives, John Quickley stays with him. Kawhi Thompson attempts a Layup. Contested by John Quickley (4.3 feet, MAN). KAWHI THOMPSON MAKES IT! Assist: Michael Hyland
Score: 82-62

[06:31] Team_007 possession (Score: 82-62)
Jaren Dosunmu attempts a 3Pt. Contested by Michael Hyland (5.6 feet, ZONE). JAREN DOSUNMU MAKES IT! Assist: Carmelo Siakam
Score: 85-62

[06:15] Team_062 possession (Score: 85-62)
FOUL! Holding foul on Carmelo Siakam. [Team fouls: 1] No free throws, side out. (Carmelo Siakam: 1 personal fouls)

[05:58] Team_062 possession (Score: 85-62)
Chris Bird attempts a 3Pt. Contested by Jaren Dosunmu (5.4 feet, ZONE). Chris Bird misses. Rebound secured by Carmelo Siakam.

[05:42] Team_007 possession (Score: 85-62)
Carmelo Siakam attempts a Layup. Wide open! Jalen Reaves is 6.3 feet away. [MAN] Carmelo Siakam misses. Offensive rebound by Bones Siakam! Bones Siakam kicks it out.

[05:27] Team_007 possession (Score: 85-62)
John Quickley throws a bad pass out of bounds! TURNOVER! (dead ball)

[05:27] Substitution (Team_007): Tobias Johnson OUT → Wendell Poole IN (stamina_rule2)

[05:27] Substitution (Team_007): Jaren Dosunmu OUT → OG Porzingis IN (stamina_rule2)

[05:27] Substitution (Team_007): Bones Siakam OUT → Gary LaVine IN (stamina_rule2)

[05:27] Substitution (Team_007): John Quickley OUT → Austin Simons IN (stamina_rule2)

[05:27] Substitution (Team_007): Carmelo Siakam OUT → Draymond Harris IN (stamina_rule2)

[05:27] Substitution (Team_062): Chris Bird OUT → Paolo McCollum IN (stamina_rule2)

[05:27] Substitution (Team_062): RJ Williamson OUT → Tony LaVine IN (stamina_rule2)

[05:27] Substitution (Team_062): Michael Hyland OUT → Paul Poole IN (stamina_rule2)

[05:27] Substitution (Team_062): Kawhi Thompson OUT → RJ Wall IN (stamina_rule2)

[05:27] Substitution (Team_062): Jalen Reaves OUT → Devin Young IN (stamina_rule2)

[05:09] Team_062 possession (Score: 85-62)
Devin Young drives, picks up Draymond Harris. Help arrives from OG Porzingis! Devin Young attempts a Dunk. Contested by OG Porzingis (5.4 feet, MAN). Devin Young misses. Rebound secured by Gary LaVine.

[04:53] Team_007 possession (Score: 85-62)
Wendell Poole attempts a 3Pt. Contested by Paolo McCollum (5.8 feet, MAN). Wendell Poole misses. Rebound secured by Devin Young.

[04:40] Team_062 possession (Score: 85-62)
Devin Young makes the Layup and draws the foul on OG Porzingis! And-1! Devin Young to the line for 1. [Team fouls: 2] (OG Porzingis: 1 personal fouls)   FT 1/1: GOOD Devin Young makes 1/1 from the line.
Score: 85-65

[04:29] Team_007 possession (Score: 85-65)
Gary LaVine attempts a 3Pt. Contested by Paolo McCollum (5.7 feet, ZONE). Gary LaVine misses. Rebound secured by Devin Young.

[04:13] Team_062 possession (Score: 85-65)
Paolo McCollum attempts a Midrange. Contested by Wendell Poole (5.4 feet, MAN). Paolo McCollum misses. Rebound secured by Draymond Harris.

[03:55] Team_007 possession (Score: 85-65)
Gary LaVine drives, Paul Poole stays with him. Gary LaVine attempts a Layup. Wide open! Paul Poole is 6.4 feet away. [MAN] GARY LAVINE MAKES IT! Assist: Wendell Poole
Score: 87-65

[03:41] Team_062 possession (Score: 87-65)
Tony LaVine drives and kicks out. Tony LaVine attempts a 3Pt. Contested by OG Porzingis (4.3 feet, MAN). Tony LaVine misses. Rebound secured by Gary LaVine.

[03:25] Team_007 possession (Score: 87-65)
Draymond Harris attempts a Layup. Contested by Devin Young (6.0 feet, MAN). DRAYMOND HARRIS MAKES IT!
Score: 89-65

[03:10] Team_062 possession (Score: 89-65)
FOUL! Holding foul on Austin Simons. [Team fouls: 3] No free throws, side out. (Austin Simons: 1 personal fouls)

[02:52] Team_062 possession (Score: 89-65)
Paul Poole attempts a Midrange. Contested by Gary LaVine (4.4 feet, MAN). PAUL POOLE MAKES IT!
Score: 89-67

[02:35] Team_007 possession (Score: 89-67)
Austin Simons attempts a Midrange. Wide open! Paul Poole is 6.7 feet away. [ZONE] Austin Simons misses. Rebound secured by Paul Poole.

[02:19] Team_062 possession (Score: 89-67)
RJ Wall attempts a 3Pt. Contested by OG Porzingis (4.2 feet, ZONE). RJ Wall misses. Rebound secured by Gary LaVine.

[02:03] Team_007 possession (Score: 89-67)
Austin Simons attempts a Midrange. Wide open! Devin Young is 6.3 feet away. [ZONE] Austin Simons misses. Rebound secured by RJ Wall.

[01:51] Team_062 possession (Score: 89-67)
RJ Wall attempts a Midrange. Contested by Austin Simons (3.7 feet, MAN). RJ Wall misses. Rebound secured by Austin Simons.

[01:36] Team_007 possession (Score: 89-67)
Wendell Poole drives, Paolo McCollum stays with him. Wendell Poole attempts a Dunk. Contested by Paolo McCollum (5.8 feet, MAN). WENDELL POOLE MAKES IT! Assist: Austin Simons
Score: 91-67

[01:21] Team_062 possession (Score: 91-67)
FOUL! Reach-in foul on Austin Simons during the drive. [Team fouls: 4] No free throws, side out. (Austin Simons: 2 personal fouls)

[01:06] Team_062 possession (Score: 91-67)
RJ Wall attempts a 3Pt. Contested by Austin Simons (3.7 feet, MAN). RJ WALL MAKES IT! Assist: Paul Poole
Score: 91-70

[00:53] Team_007 possession (Score: 91-70)
Gary LaVine attempts a 3Pt. Contested by Paolo McCollum (5.7 feet, ZONE). Gary LaVine misses. Rebound secured by RJ Wall.

[00:36] Team_062 possession (Score: 91-70)
Paul Poole attempts a 3Pt. Contested by Wendell Poole (5.3 feet, ZONE). Paul Poole misses. Rebound secured by Gary LaVine.

[00:23] Team_007 possession (Score: 91-70)
Gary LaVine attempts a 3Pt. Contested by Paolo McCollum (5.7 feet, ZONE). Gary LaVine misses. Rebound secured by Paul Poole.

[00:11] Team_062 possession (Score: 91-70)
Paolo McCollum attempts a 3Pt. Contested by Wendell Poole (5.4 feet, MAN). PAOLO MCCOLLUM MAKES IT! Assist: Devin Young
Score: 91-73

================================================================================
                              4TH QUARTER COMPLETE                              
================================================================================

4TH QUARTER SCORE: Team_007 16, Team_062 18

BOX SCORE:
================================================================================

Team_007
--------------------------------------------------------------------------------
Player                MIN  PTS  REB  AST  TO      FG   FG%      3P   3P%
--------------------------------------------------------------------------------
Carmelo Siakam         31    5    6    1   0   2/3    66.7     0/0   0.0
Jaren Dosunmu          35    3    0    1   0   1/2    50.0     0/0   0.0
Tobias Johnson         35    2    0    0   0   1/3    33.3     0/0   0.0
Gary LaVine            18    2    4    0   0   1/4    25.0     0/0   0.0
Wendell Poole          13    2    0    1   0   1/2    50.0     0/0   0.0
Draymond Harris        18    2    1    0   0   1/1   100.0     0/0   0.0
John Quickley          31    0    2    0   0   0/0     0.0     0/0   0.0
Bones Siakam           31    0    3    0   0   0/1     0.0     0/0   0.0
Austin Simons          18    0    1    1   0   0/2     0.0     0/0   0.0

TEAM: FG: 7/18 (38.9%), 3PT: 1/7 (14.3%), REB: 17 (4 off, 13 def), AST: 4, TO: 2
TEAM FOULS: 4


Team_062
--------------------------------------------------------------------------------
Player                MIN  PTS  REB  AST  TO      FG   FG%      3P   3P%
--------------------------------------------------------------------------------
Chris Bird             32    5    0    0   0   2/3    66.7     0/0   0.0
Devin Young            18    3    2    1   0   1/2    50.0     0/0   0.0
Paolo McCollum         17    3    0    0   0   1/2    50.0     0/0   0.0
RJ Wall                17    3    2    0   0   1/3    33.3     0/0   0.0
Kawhi Thompson         32    2    2    0   0   1/5    20.0     0/0   0.0
Paul Poole             17    2    2    1   0   1/2    50.0     0/0   0.0
Jalen Reaves           31    0    3    0   0   0/0     0.0     0/0   0.0
RJ Williamson          32    0    0    1   0   0/2     0.0     0/0   0.0
Michael Hyland         32    0    1    1   0   0/0     0.0     0/0   0.0
Tony LaVine            17    0    0    0   0   0/1     0.0     0/0   0.0

TEAM: FG: 7/20 (35.0%), 3PT: 3/10 (30.0%), REB: 12 (1 off, 11 def), AST: 4, TO: 0
TEAM FOULS: 2

================================================================================

================================================================================
                               FULL GAME COMPLETE                               
================================================================================

FINAL SCORE: Team_007 91, Team_062 73

SCORING BY QUARTER:
--------------------------------------------------------------------------------
Team                     Q1     Q2     Q3     Q4    FINAL
--------------------------------------------------------------------------------
Team_007                 20     23     32     16       91
Team_062                 13     23     19     18       73
--------------------------------------------------------------------------------

FULL GAME BOX SCORE:
================================================================================

Team_007
--------------------------------------------------------------------------------
Player                MIN  PTS  REB  AST  TO      FG   FG%      3P   3P%      FT STL BLK
--------------------------------------------------------------------------------
Tobias Johnson         35   24    0    3   3   9/13   69.2   2/3    66.7   3/3     1   0
Jaren Dosunmu          35   17    0    4   3   7/13   53.8   4/8    50.0   6/7     0   0
Bones Siakam           31    2   12    4   2   2/6    33.3   0/4     0.0   0/0     1   0
John Quickley          31    9    9    0   1   4/8    50.0   0/1     0.0   0/0     1   1
Carmelo Siakam         31   13   13    1   0   5/11   45.5   0/1     0.0   8/9     0   0
Gary LaVine            18    4    8    1   1   2/6    33.3   0/3     0.0   0/0     1   0
Austin Simons          18    1    3    3   1   1/4    25.0   0/0     0.0   1/3     0   0
Draymond Harris        18    7    4    0   0   3/3   100.0   0/0     0.0   1/1     0   0
Wendell Poole          13    4    0    2   1   2/3    66.7   0/1     0.0   0/0     0   0
OG Porzingis           13    5    0    0   1   2/7    28.6   1/5    20.0   2/2     0   0

TEAM: FG: 37/74 (50.0%), 3PT: 7/26 (26.9%), REB: 50 (10 off, 40 def), AST: 18, TO: 13


Team_062
--------------------------------------------------------------------------------
Player                MIN  PTS  REB  AST  TO      FG   FG%      3P   3P%      FT STL BLK
--------------------------------------------------------------------------------
Chris Bird             32   12    0    1   1   5/9    55.6   2/5    40.0   2/2     1   2
RJ Williamson          32   10    0    3   2   4/10   40.0   2/6    33.3   0/0     2   0
Michael Hyland         32    2   11    2   2   1/6    16.7   0/3     0.0   0/0     0   0
Kawhi Thompson         32    6   11    2   3   3/11   27.3   0/3     0.0   0/0     0   1
Jalen Reaves           31    7    8    1   0   3/9    33.3   0/2     0.0   1/1     0   0
Devin Young            18    9    5    1   1   4/5    80.0   0/0     0.0   1/1     0   0
Paolo McCollum         17    7    0    1   1   2/4    50.0   2/3    66.7   1/2     1   1
Tony LaVine            17    9    0    2   1   4/6    66.7   1/1   100.0   5/5     0   0
Paul Poole             17    5    5    2   1   2/5    40.0   0/2     0.0   1/1     1   0
RJ Wall                17    6    4    0   0   2/6    33.3   2/4    50.0   0/0     1   0

TEAM: FG: 31/72 (43.1%), 3PT: 9/29 (31.0%), REB: 43 (9 off, 34 def), AST: 15, TO: 12

================================================================================
