================================================================================
                        FULL GAME - Team_007 vs Team_019                        
================================================================================

================================================================================
                       1ST QUARTER - Team_007 vs Team_019                       
================================================================================

[12:00] Team_007 possession (Score: 0-0)
Bones Siakam attempts a 3Pt. Contested by D'Angelo Randle (3.7 feet, ZONE). BONES SIAKAM MAKES IT! Assist: Carmelo Siakam
Score: 3-0

[11:49] Team_019 possession (Score: 3-0)
Tobias Hyland drives and kicks out. Rudy Giddey attempts a Midrange. Contested by Tobias Johnson (4.8 feet, MAN). RUDY GIDDEY MAKES IT!
Score: 3-2

[11:29] Team_007 possession (Score: 3-2)
Bones Siakam drives, D'Angelo Randle stays with him. Bones Siakam attempts a Layup. Contested by D'Angelo Randle (3.7 feet, MAN). BONES SIAKAM MAKES IT!
Score: 5-2

[11:12] Team_019 possession (Score: 5-2)
Tobias Hyland attempts a Layup. BLOCKED BY JOHN QUICKLEY! Ball is loose! Rebound secured by Carmelo Siakam.

[10:57] Team_007 possession (Score: 5-2)
Jaren Dosunmu drives and kicks out. Tobias Johnson attempts a 3Pt. Contested by D'Angelo Randle (3.6 feet, ZONE). Tobias Johnson misses. Rebound secured by DeMar James.

[10:43] Team_019 possession (Score: 5-2)
DeMar James makes the Dunk and draws the foul on John Quickley! And-1! DeMar James to the line for 1. [Team fouls: 1] (John Quickley: 1 personal fouls)   FT 1/1: GOOD DeMar James makes 1/1 from the line.
Score: 5-5

[10:30] Team_007 possession (Score: 5-5)
Jaren Dosunmu attempts a Midrange. Contested by Tobias Hyland (5.6 feet, ZONE). Jaren Dosunmu misses. FOUL! Loose ball foul on D'Angelo Randle during the rebound battle. [Team fouls: 1] No free throws, side out. (D'Angelo Randle: 1 personal fouls)

[10:13] Team_007 possession (Score: 5-5)
Tobias Johnson makes the Dunk and draws the foul on DeMar James! And-1! Tobias Johnson to the line for 1. [Team fouls: 2] (DeMar James: 1 personal fouls)   FT 1/1: GOOD Tobias Johnson makes 1/1 from the line.
Score: 8-5

[09:57] Team_019 possession (Score: 8-5)
Brandon James attempts a Midrange. Contested by Jaren Dosunmu (4.4 feet, MAN). Brandon James misses. Rebound secured by Bones Siakam.

[09:42] Team_007 possession (Score: 8-5)
FOUL! Shooting foul on Rudy Giddey. Tobias Johnson to the line for 2 free throws. [Team fouls: 3] (Rudy Giddey: 1 personal fouls)   FT 1/2: GOOD   FT 2/2: MISS Tobias Johnson makes 1/2 from the line. Offensive rebound by Carmelo Siakam! Carmelo Siakam puts it back in!
Score: 11-5

[09:30] Team_019 possession (Score: 11-5)
Tobias Hyland drives, John Quickley stays with him. Tobias Hyland attempts a Dunk. Contested by John Quickley (3.1 feet, ZONE). TOBIAS HYLAND MAKES IT!
Score: 11-7

[09:20] Team_007 possession (Score: 11-7)
Tobias Johnson attempts a Midrange. Contested by Rudy Giddey (5.7 feet, MAN). TOBIAS JOHNSON MAKES IT! Assist: Jaren Dosunmu
Score: 13-7

[09:05] Team_019 possession (Score: 13-7)
Rudy Giddey drives and kicks out. Tobias Hyland attempts a Midrange. Contested by John Quickley (3.0 feet, MAN). Tobias Hyland misses. Rebound secured by John Quickley.

[08:51] Team_007 possession (Score: 13-7)
FOUL! Shooting foul on DeMar James. Tobias Johnson to the line for 2 free throws. [Team fouls: 4] (DeMar James: 2 personal fouls)   FT 1/2: GOOD   FT 2/2: GOOD Tobias Johnson makes 2/2 from the line.
Score: 15-7

[08:37] Team_019 possession (Score: 15-7)
Tobias Hyland attempts a 3Pt. Contested by John Quickley (3.1 feet, MAN). Tobias Hyland misses. Rebound secured by John Quickley.

[08:19] Team_007 possession (Score: 15-7)
Jaren Dosunmu attempts a Midrange. Contested by Brandon James (5.1 feet, MAN). JAREN DOSUNMU MAKES IT! Assist: Bones Siakam
Score: 17-7

[08:03] Team_019 possession (Score: 17-7)
Brandon James attempts a 3Pt. Contested by John Quickley (3.0 feet, ZONE). Brandon James misses. Rebound secured by Carmelo Siakam.

[07:54] Team_007 possession (Score: 17-7)
Jaren Dosunmu attempts a 3Pt. Contested by Brandon James (5.1 feet, ZONE). Jaren Dosunmu misses. Rebound secured by Tobias Hyland.

[07:45] Team_019 possession (Score: 17-7)
Tobias Hyland attempts a Layup. BLOCKED BY JAREN DOSUNMU! Ball is loose! Offensive rebound by D'Angelo Randle! D'Angelo Randle kicks it out.

[07:31] Team_019 possession (Score: 17-7)
Rudy Giddey attempts a Midrange. Contested by Tobias Johnson (5.0 feet, MAN). RUDY GIDDEY MAKES IT! Assist: Tobias Hyland
Score: 17-9

[07:16] Team_007 possession (Score: 17-9)
Bones Siakam throws a bad pass out of bounds! TURNOVER! (dead ball)

[07:03] Team_019 possession (Score: 17-9)
Brandon James attempts a Layup. Contested by John Quickley (3.0 feet, ZONE). Brandon James misses. Rebound secured by Bones Siakam.

[06:51] Team_007 possession (Score: 17-9)
John Quickley drives, Tobias Hyland stays with him. John Quickley attempts a Layup. Wide open! Tobias Hyland is 6.3 feet away. [ZONE] John Quickley misses. Offensive rebound by Bones Siakam! Bones Siakam puts it back in!
Score: 19-9

[06:33] Team_019 possession (Score: 19-9)
Tobias Hyland drives, John Quickley stays with him. Tobias Hyland attempts a Dunk. Contested by John Quickley (3.1 feet, MAN). Tobias Hyland misses. Rebound secured by Bones Siakam.

[06:20] Team_007 possession (Score: 19-9)
Bones Siakam attempts a 3Pt. Contested by D'Angelo Randle (3.7 feet, ZONE). Bones Siakam misses. Rebound secured by Tobias Hyland.

[06:03] Team_019 possession (Score: 19-9)
Rudy Giddey attempts a Midrange. Contested by Bones Siakam (3.8 feet, ZONE). Rudy Giddey misses. Rebound secured by Bones Siakam.

[05:46] Team_007 possession (Score: 19-9)
John Quickley attempts a Midrange. Wide open! Tobias Hyland is 6.3 feet away. [MAN] JOHN QUICKLEY MAKES IT! Assist: Tobias Johnson
Score: 21-9

[05:30] Team_019 possession (Score: 21-9)
Tobias Hyland attempts a Midrange. Contested by John Quickley (3.1 feet, ZONE). TOBIAS HYLAND MAKES IT! Assist: DeMar James
Score: 21-11

[05:14] Team_007 possession (Score: 21-11)
Bones Siakam attempts a 3Pt. Contested by Tobias Hyland (5.8 feet, ZONE). BONES SIAKAM MAKES IT! Assist: Carmelo Siakam
Score: 24-11

[05:00] Team_019 possession (Score: 24-11)
D'Angelo Randle attempts a 3Pt. Contested by Bones Siakam (3.9 feet, MAN). D'ANGELO RANDLE MAKES IT! Assist: DeMar James
Score: 24-14

[04:45] Team_007 possession (Score: 24-14)
Bones Siakam attempts a Midrange. Contested by D'Angelo Randle (3.8 feet, MAN). BONES SIAKAM MAKES IT! Assist: Tobias Johnson
Score: 26-14

[04:27] Team_019 possession (Score: 26-14)
Rudy Giddey attempts a Midrange. Contested by Tobias Johnson (5.1 feet, MAN). Rudy Giddey misses. Rebound secured by John Quickley.

[04:14] Team_007 possession (Score: 26-14)
Tobias Johnson attempts a Layup. Contested by Rudy Giddey (5.7 feet, MAN). TOBIAS JOHNSON MAKES IT! Assist: John Quickley
Score: 28-14

[04:00] Team_019 possession (Score: 28-14)
Tobias Hyland attempts a 3Pt. Contested by John Quickley (3.2 feet, ZONE). TOBIAS HYLAND MAKES IT! Assist: Brandon James
Score: 28-17

[03:48] Team_007 possession (Score: 28-17)
John Quickley attempts a Midrange. Wide open! Tobias Hyland is 6.4 feet away. [MAN] John Quickley misses. Rebound secured by D'Angelo Randle.

[03:33] Team_019 possession (Score: 28-17)
FOUL! Shooting foul on John Quickley. Tobias Hyland to the line for 2 free throws. [Team fouls: 2] (John Quickley: 2 personal fouls)   FT 1/2: GOOD   FT 2/2: GOOD Tobias Hyland makes 2/2 from the line.
Score: 28-19

[03:17] Team_007 possession (Score: 28-19)
Bones Siakam attempts a 3Pt. Contested by D'Angelo Randle (3.9 feet, ZONE). Bones Siakam misses. Rebound secured by DeMar James.

[03:00] Team_019 possession (Score: 28-19)
Tobias Hyland attempts a 3Pt. Contested by John Quickley (3.3 feet, ZONE). TOBIAS HYLAND MAKES IT! Assist: Rudy Giddey
Score: 28-22

[02:43] Team_007 possession (Score: 28-22)
Jaren Dosunmu loses control! Ball rolls out of bounds! TURNOVER! (dead ball)

[02:43] Substitution (Team_007): Bones Siakam OUT → Gary LaVine IN (stamina_rule2)

[02:43] Substitution (Team_007): John Quickley OUT → Austin Simons IN (stamina_rule2)

[02:43] Substitution (Team_007): Carmelo Siakam OUT → Draymond Harris IN (stamina_rule2)

[02:43] Substitution (Team_019): D'Angelo Randle OUT → Blake LaVine IN (stamina_rule2)

[02:43] Substitution (Team_019): Tobias Hyland OUT → Shai Ingram IN (stamina_rule2)

[02:43] Substitution (Team_019): DeMar James OUT → Tim Jordan IN (stamina_rule2)

[02:25] Team_019 possession (Score: 28-22)
Shai Ingram makes the Midrange and draws the foul on Gary LaVine! And-1! Shai Ingram to the line for 1. [Team fouls: 3] (Gary LaVine: 1 personal fouls)   FT 1/1: GOOD Shai Ingram makes 1/1 from the line.
Score: 28-25

[02:16] Team_007 possession (Score: 28-25)
Tobias Johnson drives and kicks out. Draymond Harris attempts a 3Pt. Contested by Shai Ingram (4.5 feet, MAN). Draymond Harris misses. Rebound secured by Tim Jordan.

[02:01] Team_019 possession (Score: 28-25)
Blake LaVine loses control! Ball rolls out of bounds! TURNOVER! (dead ball)

[02:01] Substitution (Team_007): Tobias Johnson OUT → Wendell Poole IN (stamina_rule2)

[02:01] Substitution (Team_019): Rudy Giddey OUT → Gary Ginobili IN (stamina_rule2)

[02:01] Substitution (Team_019): Brandon James OUT → Jalen Turner IN (stamina_rule2)

[01:46] Team_007 possession (Score: 28-25)
Wendell Poole attempts a Layup. Contested by Shai Ingram (4.8 feet, ZONE). Wendell Poole misses. Rebound secured by Shai Ingram.

[01:32] Team_019 possession (Score: 28-25)
Blake LaVine attempts a 3Pt. Contested by Gary LaVine (4.5 feet, MAN). Blake LaVine misses. Rebound secured by Draymond Harris.

[01:16] Team_007 possession (Score: 28-25)
Jaren Dosunmu drives and kicks out. Jaren Dosunmu attempts a Midrange. Contested by Jalen Turner (3.9 feet, MAN). Jaren Dosunmu misses. Rebound secured by Blake LaVine.

[01:03] Team_019 possession (Score: 28-25)
Gary Ginobili throws a bad pass! Stolen by Wendell Poole! TURNOVER! (live ball)

[00:44] Team_007 possession (Score: 28-25)
Gary LaVine attempts a 3Pt. Contested by Blake LaVine (4.9 feet, ZONE). Gary LaVine misses. Rebound secured by Shai Ingram.

[00:33] Team_019 possession (Score: 28-25)
Gary Ginobili drives, Wendell Poole stays with him. Gary Ginobili attempts a Layup. Contested by Wendell Poole (5.7 feet, MAN). Gary Ginobili misses. Rebound secured by Gary LaVine.

[00:24] Team_007 possession (Score: 28-25)
Austin Simons attempts a 3Pt. Contested by Shai Ingram (4.9 feet, MAN). Austin Simons misses. Rebound secured by Tim Jordan.

[00:09] Team_019 possession (Score: 28-25)
Blake LaVine attempts a Midrange. Contested by Gary LaVine (4.5 feet, MAN). BLAKE LAVINE MAKES IT!
Score: 28-27

================================================================================
                              1ST QUARTER COMPLETE                              
================================================================================

1ST QUARTER SCORE: Team_007 28, Team_019 27

BOX SCORE:
================================================================================

Team_007
--------------------------------------------------------------------------------
Player                MIN  PTS  REB  AST  TO      FG   FG%      3P   3P%
--------------------------------------------------------------------------------
Bones Siakam           10   12    6    1   0   5/7    71.4     0/0   0.0
Tobias Johnson         10    9    0    2   0   4/5    80.0     0/0   0.0
Carmelo Siakam         10    3    2    2   0   1/1   100.0     0/0   0.0
Jaren Dosunmu          12    2    0    1   0   1/4    25.0     0/0   0.0
John Quickley          10    2    3    1   0   1/2    50.0     0/0   0.0
Wendell Poole           2    0    0    0   0   0/1     0.0     0/0   0.0
Draymond Harris         3    0    1    0   0   0/0     0.0     0/0   0.0
Gary LaVine             3    0    1    0   0   0/1     0.0     0/0   0.0
Austin Simons           3    0    0    0   0   0/1     0.0     0/0   0.0

TEAM: FG: 12/22 (54.5%), 3PT: 2/7 (28.6%), REB: 13 (2 off, 11 def), AST: 7, TO: 2
TEAM FOULS: 3


Team_019
--------------------------------------------------------------------------------
Player                MIN  PTS  REB  AST  TO      FG   FG%      3P   3P%
--------------------------------------------------------------------------------
Tobias Hyland          10   12    2    1   0   5/8    62.5     0/0   0.0
Rudy Giddey            10    4    0    1   0   2/5    40.0     0/0   0.0
DeMar James            10    3    2    2   0   1/1   100.0     0/0   0.0
D'Angelo Randle        10    3    2    0   0   1/1   100.0     0/0   0.0
Shai Ingram             3    3    2    0   0   1/1   100.0     0/0   0.0
Blake LaVine            3    2    1    0   0   1/2    50.0     0/0   0.0
Brandon James          10    0    0    1   0   0/3     0.0     0/0   0.0
Tim Jordan              3    0    2    0   0   0/0     0.0     0/0   0.0
Gary Ginobili           2    0    0    0   0   0/1     0.0     0/0   0.0

TEAM: FG: 11/22 (50.0%), 3PT: 3/6 (50.0%), REB: 11 (1 off, 10 def), AST: 5, TO: 2
TEAM FOULS: 4

================================================================================

================================================================================
                       2ND QUARTER - Team_007 vs Team_019                       
================================================================================

[12:00] Team_007 possession (Score: 28-27)
Jaren Dosunmu attempts a 3Pt. Contested by D'Angelo Randle (3.6 feet, ZONE). Jaren Dosunmu misses. Rebound secured by Tobias Hyland.

[11:50] Team_019 possession (Score: 28-27)
DeMar James drives, John Quickley stays with him. DeMar James attempts a Layup. Contested by John Quickley (3.4 feet, ZONE). DeMar James misses. Rebound secured by John Quickley.

[11:40] Team_007 possession (Score: 28-27)
Bones Siakam drives, D'Angelo Randle stays with him. Bones Siakam attempts a Layup. Contested by D'Angelo Randle (3.7 feet, MAN). BONES SIAKAM MAKES IT! Assist: Jaren Dosunmu
Score: 30-27

[11:25] Team_019 possession (Score: 30-27)
Rudy Giddey attempts a Layup. Contested by Tobias Johnson (5.1 feet, MAN). RUDY GIDDEY MAKES IT!
Score: 30-29

[11:07] Team_007 possession (Score: 30-29)
Jaren Dosunmu makes the 3Pt and draws the foul on Tobias Hyland! And-1! Jaren Dosunmu to the line for 1. [Team fouls: 1] (Tobias Hyland: 1 personal fouls)   FT 1/1: GOOD Jaren Dosunmu makes 1/1 from the line.
Score: 34-29

[10:57] Team_019 possession (Score: 34-29)
Tobias Hyland attempts a Midrange. Contested by Bones Siakam (3.7 feet, ZONE). Tobias Hyland misses. Rebound secured by John Quickley.

[10:41] Team_007 possession (Score: 34-29)
John Quickley drives, picks up DeMar James. Help arrives from Brandon James! John Quickley attempts a Layup. Contested by Brandon James (5.0 feet, ZONE). John Quickley misses. Offensive rebound by Carmelo Siakam! Carmelo Siakam puts it back in!
Score: 36-29

[10:25] Team_019 possession (Score: 36-29)
FOUL! Holding foul on John Quickley. [Team fouls: 1] No free throws, side out. (John Quickley: 1 personal fouls)

[10:10] Team_019 possession (Score: 36-29)
FOUL! Shooting foul on Bones Siakam. D'Angelo Randle to the line for 2 free throws. [Team fouls: 2] (Bones Siakam: 1 personal fouls)   FT 1/2: GOOD   FT 2/2: GOOD D'Angelo Randle makes 2/2 from the line.
Score: 36-31

[09:56] Team_007 possession (Score: 36-31)
Jaren Dosunmu attempts a 3Pt. Contested by D'Angelo Randle (3.7 feet, ZONE). Jaren Dosunmu misses. Rebound secured by Tobias Hyland.

[09:37] Team_019 possession (Score: 36-31)
Brandon James throws a bad pass out of bounds! TURNOVER! (dead ball)

[09:37] Substitution (Team_007): Jaren Dosunmu OUT → OG Porzingis IN (stamina_rule2)

[09:37] Substitution (Team_019): Brandon James OUT → Jalen Turner IN (stamina_rule2)

[09:37] Substitution (Team_019): Tobias Hyland OUT → Shai Ingram IN (stamina_rule2)

[09:19] Team_007 possession (Score: 36-31)
Tobias Johnson attempts a 3Pt. Contested by Shai Ingram (4.8 feet, ZONE). Tobias Johnson misses. Rebound secured by D'Angelo Randle.

[09:05] Team_019 possession (Score: 36-31)
DeMar James drives to the basket... DeMar James loses the ball! Stripped by John Quickley! TURNOVER! (live ball)

[08:50] Team_007 possession (Score: 36-31)
Bones Siakam drives to the basket... Bones Siakam throws a bad pass out of bounds! TURNOVER! (dead ball)

[08:50] Substitution (Team_007): Tobias Johnson OUT → Wendell Poole IN (stamina_rule2)

[08:50] Substitution (Team_007): Bones Siakam OUT → Gary LaVine IN (stamina_rule2)

[08:50] Substitution (Team_007): John Quickley OUT → Austin Simons IN (stamina_rule2)

[08:50] Substitution (Team_007): Carmelo Siakam OUT → Draymond Harris IN (stamina_rule2)

[08:50] Substitution (Team_019): Rudy Giddey OUT → Gary Ginobili IN (stamina_rule2)

[08:50] Substitution (Team_019): D'Angelo Randle OUT → Blake LaVine IN (stamina_rule2)

[08:50] Substitution (Team_019): DeMar James OUT → Tim Jordan IN (stamina_rule2)

[08:41] Team_019 possession (Score: 36-31)
Tim Jordan attempts a Layup. Contested by Austin Simons (3.8 feet, ZONE). TIM JORDAN MAKES IT! Assist: Blake LaVine
Score: 36-33

[08:25] Team_007 possession (Score: 36-33)
Gary LaVine attempts a 3Pt. Contested by Blake LaVine (4.9 feet, MAN). Gary LaVine misses. Offensive rebound by Austin Simons! Austin Simons puts it back in!
Score: 38-33

[08:07] Team_019 possession (Score: 38-33)
Jalen Turner attempts a 3Pt. Contested by OG Porzingis (4.5 feet, ZONE). JALEN TURNER MAKES IT! Assist: Shai Ingram
Score: 38-36

[07:54] Team_007 possession (Score: 38-36)
Wendell Poole loses control! Ball rolls out of bounds! TURNOVER! (dead ball)

[07:43] Team_019 possession (Score: 38-36)
Tim Jordan makes the Layup and draws the foul on Draymond Harris! And-1! Tim Jordan to the line for 1. [Team fouls: 3] (Draymond Harris: 1 personal fouls)   FT 1/1: GOOD Tim Jordan makes 1/1 from the line.
Score: 38-39

[07:31] Team_007 possession (Score: 38-39)
FOUL! Holding foul on Gary Ginobili. [Team fouls: 2] No free throws, side out. (Gary Ginobili: 1 personal fouls)

[07:18] Team_007 possession (Score: 38-39)
Draymond Harris attempts a Midrange. Contested by Blake LaVine (4.7 feet, ZONE). Draymond Harris misses. Rebound secured by Shai Ingram.

[07:03] Team_019 possession (Score: 38-39)
Tim Jordan attempts a Layup. Contested by Draymond Harris (5.0 feet, MAN). Tim Jordan misses. Rebound secured by Gary LaVine.

[06:48] Team_007 possession (Score: 38-39)
Gary LaVine drives, Blake LaVine stays with him. Gary LaVine attempts a Layup. Contested by Blake LaVine (4.9 feet, MAN). GARY LAVINE MAKES IT! Assist: Austin Simons
Score: 40-39

[06:37] Team_019 possession (Score: 40-39)
Jalen Turner makes the Midrange and draws the foul on OG Porzingis! And-1! Jalen Turner to the line for 1. [Team fouls: 4] (OG Porzingis: 1 personal fouls)   FT 1/1: GOOD Jalen Turner makes 1/1 from the line.
Score: 40-42

[06:25] Team_007 possession (Score: 40-42)
FOUL! Holding foul on Blake LaVine. [Team fouls: 3] No free throws, side out. (Blake LaVine: 1 personal fouls)

[06:14] Team_007 possession (Score: 40-42)
Austin Simons makes the Layup and draws the foul on Shai Ingram! And-1! Austin Simons to the line for 1. [Team fouls: 4] (Shai Ingram: 1 personal fouls)   FT 1/1: GOOD Austin Simons makes 1/1 from the line.
Score: 43-42

[05:57] Team_019 possession (Score: 43-42)
Jalen Turner attempts a Midrange. Contested by OG Porzingis (4.5 feet, MAN). Jalen Turner misses. Rebound secured by Austin Simons.

[05:42] Team_007 possession (Score: 43-42)
Gary LaVine throws a bad pass out of bounds! TURNOVER! (dead ball)

[05:25] Team_019 possession (Score: 43-42)
Gary Ginobili attempts a 3Pt. Contested by Wendell Poole (5.7 feet, MAN). GARY GINOBILI MAKES IT! Assist: Blake LaVine
Score: 43-45

[05:07] Team_007 possession (Score: 43-45)
Gary LaVine attempts a Layup. Contested by Shai Ingram (4.7 feet, ZONE). GARY LAVINE MAKES IT!
Score: 45-45

[04:53] Team_019 possession (Score: 45-45)
Blake LaVine attempts a Layup. Contested by Gary LaVine (4.5 feet, MAN). BLAKE LAVINE MAKES IT! Assist: Shai Ingram
Score: 45-47

[04:38] Team_007 possession (Score: 45-47)
Gary LaVine attempts a 3Pt. Contested by Blake LaVine (4.9 feet, ZONE). GARY LAVINE MAKES IT! Assist: OG Porzingis
Score: 48-47

[04:24] Team_019 possession (Score: 48-47)
Tim Jordan commits a violation (traveling/carry)! TURNOVER! (dead ball)

[04:07] Team_007 possession (Score: 48-47)
Draymond Harris drives, picks up Shai Ingram. Help arrives from Jalen Turner! Draymond Harris attempts a Dunk. Contested by Jalen Turner (4.6 feet, MAN). DRAYMOND HARRIS MAKES IT! Assist: Gary LaVine
Score: 50-47

[03:54] Team_019 possession (Score: 50-47)
Blake LaVine drives, Austin Simons stays with him. Blake LaVine attempts a Layup. Contested by Austin Simons (3.9 feet, ZONE). BLAKE LAVINE MAKES IT! Assist: Gary Ginobili
Score: 50-49

[03:42] Team_007 possession (Score: 50-49)
OG Porzingis attempts a 3Pt. Contested by Jalen Turner (3.6 feet, MAN). OG Porzingis misses. Rebound secured by Blake LaVine.

[03:27] Team_019 possession (Score: 50-49)
Blake LaVine drives, picks up Gary LaVine. Help arrives from OG Porzingis! Blake LaVine attempts a Dunk. Contested by OG Porzingis (4.5 feet, MAN). BLAKE LAVINE MAKES IT! Assist: Jalen Turner
Score: 50-51

[03:13] Team_007 possession (Score: 50-51)
Wendell Poole drives, Gary Ginobili stays with him. Wendell Poole attempts a Dunk. Wide open! Gary Ginobili is 6.1 feet away. [MAN] WENDELL POOLE MAKES IT! Assist: Gary LaVine
Score: 52-51

[02:58] Team_019 possession (Score: 52-51)
Tim Jordan drives to the basket... Tim Jordan throws a bad pass! Stolen by Austin Simons! TURNOVER! (live ball)

[02:42] Team_007 possession (Score: 52-51)
Austin Simons drives, picks up Shai Ingram. Help arrives from Jalen Turner! Austin Simons attempts a Layup. Contested by Jalen Turner (5.1 feet, ZONE). AUSTIN SIMONS MAKES IT! Assist: Wendell Poole
Score: 54-51

[02:30] Team_019 possession (Score: 54-51)
Jalen Turner attempts a 3Pt. Contested by OG Porzingis (4.5 feet, MAN). Jalen Turner misses. Rebound secured by Draymond Harris.

[02:13] Team_007 possession (Score: 54-51)
Austin Simons drives, Shai Ingram stays with him. Austin Simons attempts a Dunk. Contested by Shai Ingram (5.1 feet, MAN). AUSTIN SIMONS MAKES IT! Assist: Draymond Harris
Score: 56-51

[02:00] Team_019 possession (Score: 56-51)
Blake LaVine commits a violation (traveling/carry)! TURNOVER! (dead ball)

[01:44] Team_007 possession (Score: 56-51)
Gary LaVine attempts a Midrange. Contested by Blake LaVine (5.0 feet, MAN). Gary LaVine misses. Offensive rebound by Austin Simons! Austin Simons puts it back in!
Score: 58-51

[01:25] Team_019 possession (Score: 58-51)
Gary Ginobili attempts a 3Pt. Contested by Wendell Poole (5.8 feet, MAN). Gary Ginobili misses. Rebound secured by Draymond Harris.

[01:08] Team_007 possession (Score: 58-51)
Wendell Poole attempts a 3Pt. Wide open! Gary Ginobili is 6.3 feet away. [MAN] Wendell Poole misses. Offensive rebound by Draymond Harris! Draymond Harris kicks it out.

[00:53] Team_007 possession (Score: 58-51)
Austin Simons drives and kicks out. OG Porzingis attempts a 3Pt. Contested by Jalen Turner (4.2 feet, MAN). OG Porzingis misses. Rebound secured by Blake LaVine.

[00:41] Team_019 possession (Score: 58-51)
Tim Jordan drives, Austin Simons stays with him. Tim Jordan attempts a Dunk. Contested by Austin Simons (4.0 feet, ZONE). TIM JORDAN MAKES IT!
Score: 58-53

[00:24] Team_007 possession (Score: 58-53)
Draymond Harris drives, Shai Ingram stays with him. Draymond Harris attempts a Layup. Contested by Shai Ingram (5.0 feet, ZONE). DRAYMOND HARRIS MAKES IT! Assist: OG Porzingis
Score: 60-53

[00:09] Team_019 possession (Score: 60-53)
Tim Jordan drives and kicks out. Blake LaVine attempts a 3Pt. Contested by Gary LaVine (4.7 feet, MAN). Blake LaVine misses. Offensive rebound by Tim Jordan! Tim Jordan kicks it out.

================================================================================
                              2ND QUARTER COMPLETE                              
================================================================================

2ND QUARTER SCORE: Team_007 32, Team_019 26

BOX SCORE:
================================================================================

Team_007
--------------------------------------------------------------------------------
Player                MIN  PTS  REB  AST  TO      FG   FG%      3P   3P%
--------------------------------------------------------------------------------
Austin Simons          11   11    3    1   0   5/6    83.3     0/0   0.0
Gary LaVine            11    7    1    2   0   3/3   100.0     0/0   0.0
Jaren Dosunmu          15    4    0    1   0   1/3    33.3     0/0   0.0
Draymond Harris        11    4    3    1   0   2/3    66.7     0/0   0.0
Bones Siakam           13    2    0    0   0   1/1   100.0     0/0   0.0
Carmelo Siakam         13    2    1    0   0   1/1   100.0     0/0   0.0
Wendell Poole          11    2    0    1   0   1/1   100.0     0/0   0.0
John Quickley          13    0    2    0   0   0/0     0.0     0/0   0.0
Tobias Johnson         14    0    0    0   0   0/1     0.0     0/0   0.0
OG Porzingis            9    0    0    2   0   0/1     0.0     0/0   0.0

TEAM: FG: 14/20 (70.0%), 3PT: 3/7 (42.9%), REB: 10 (4 off, 6 def), AST: 8, TO: 3
TEAM FOULS: 4


Team_019
--------------------------------------------------------------------------------
Player                MIN  PTS  REB  AST  TO      FG   FG%      3P   3P%
--------------------------------------------------------------------------------
Tim Jordan             11    7    1    0   0   3/4    75.0     0/0   0.0
Blake LaVine           11    6    2    2   0   3/3   100.0     0/0   0.0
Jalen Turner           11    6    0    1   0   2/4    50.0     0/0   0.0
Gary Ginobili          11    3    0    1   0   1/2    50.0     0/0   0.0
Rudy Giddey            14    2    0    0   0   1/1   100.0     0/0   0.0
D'Angelo Randle        13    2    1    0   0   1/1   100.0     0/0   0.0
Tobias Hyland          12    0    2    0   0   0/1     0.0     0/0   0.0
DeMar James            13    0    0    0   0   0/1     0.0     0/0   0.0
Shai Ingram            12    0    1    2   0   0/0     0.0     0/0   0.0

TEAM: FG: 11/17 (64.7%), 3PT: 2/4 (50.0%), REB: 7 (1 off, 6 def), AST: 6, TO: 5
TEAM FOULS: 4

================================================================================

================================================================================
                       3RD QUARTER - Team_007 vs Team_019                       
================================================================================

[12:00] Team_007 possession (Score: 60-53)
Bones Siakam attempts a Midrange. Contested by D'Angelo Randle (3.7 feet, MAN). Bones Siakam misses. Rebound secured by D'Angelo Randle.

[11:45] Team_019 possession (Score: 60-53)
Brandon James attempts a 3Pt. Contested by John Quickley (3.0 feet, ZONE). Brandon James misses. Rebound secured by Bones Siakam.

[11:35] Team_007 possession (Score: 60-53)
John Quickley attempts a Midrange. Contested by Brandon James (5.8 feet, ZONE). John Quickley misses. Rebound secured by DeMar James.

[11:22] Team_019 possession (Score: 60-53)
Brandon James attempts a Layup. BLOCKED BY JOHN QUICKLEY! Ball is loose! Offensive rebound by DeMar James! DeMar James kicks it out.

[11:07] Team_019 possession (Score: 60-53)
FOUL! Shooting foul on John Quickley. DeMar James to the line for 2 free throws. [Team fouls: 1] (John Quickley: 1 personal fouls)   FT 1/2: GOOD   FT 2/2: MISS DeMar James makes 1/2 from the line. Rebound secured by John Quickley.
Score: 60-54

[10:53] Team_007 possession (Score: 60-54)
Tobias Johnson attempts a Layup. Contested by DeMar James (4.6 feet, ZONE). TOBIAS JOHNSON MAKES IT!
Score: 62-54

[10:35] Team_019 possession (Score: 62-54)
D'Angelo Randle attempts a 3Pt. Contested by John Quickley (3.3 feet, ZONE). D'Angelo Randle misses. Rebound secured by Bones Siakam.

[10:17] Team_007 possession (Score: 62-54)
Carmelo Siakam attempts a 3Pt. Contested by D'Angelo Randle (4.0 feet, ZONE). Carmelo Siakam misses. Rebound secured by DeMar James.

[10:04] Team_019 possession (Score: 62-54)
Rudy Giddey attempts a 3Pt. Contested by John Quickley (3.2 feet, ZONE). Rudy Giddey misses. FOUL! Loose ball foul on Bones Siakam during the rebound battle. [Team fouls: 2] No free throws, side out. (Bones Siakam: 1 personal fouls)

[09:46] Team_019 possession (Score: 62-54)
Rudy Giddey attempts a 3Pt. Contested by Tobias Johnson (5.0 feet, MAN). RUDY GIDDEY MAKES IT! Assist: D'Angelo Randle
Score: 62-57

[09:31] Team_007 possession (Score: 62-57)
Tobias Johnson attempts a 3Pt. Contested by Tobias Hyland (6.0 feet, ZONE). Tobias Johnson misses. Rebound secured by D'Angelo Randle.

[09:21] Team_019 possession (Score: 62-57)
FOUL! Holding foul on John Quickley. [Team fouls: 3] No free throws, side out. (John Quickley: 2 personal fouls)

[09:05] Team_019 possession (Score: 62-57)
Brandon James attempts a 3Pt. Contested by Jaren Dosunmu (4.4 feet, MAN). BRANDON JAMES MAKES IT! Assist: DeMar James
Score: 62-60

[08:51] Team_007 possession (Score: 62-60)
Bones Siakam attempts a Layup. Contested by D'Angelo Randle (3.7 feet, MAN). Bones Siakam misses. FOUL! Loose ball foul on D'Angelo Randle during the rebound battle. [Team fouls: 1] No free throws, side out. (D'Angelo Randle: 1 personal fouls)

[08:35] Team_007 possession (Score: 62-60)
Bones Siakam attempts a 3Pt. Contested by D'Angelo Randle (3.7 feet, ZONE). Bones Siakam misses. Rebound secured by DeMar James.

[08:22] Team_019 possession (Score: 62-60)
Tobias Hyland loses control! Ball rolls out of bounds! TURNOVER! (dead ball)

[08:06] Team_007 possession (Score: 62-60)
Jaren Dosunmu drives, DeMar James stays with him. Jaren Dosunmu attempts a Layup. Contested by DeMar James (4.2 feet, ZONE). Jaren Dosunmu misses. Rebound secured by DeMar James.

[07:50] Team_019 possession (Score: 62-60)
Rudy Giddey attempts a 3Pt. Contested by Bones Siakam (3.8 feet, ZONE). RUDY GIDDEY MAKES IT! Assist: DeMar James
Score: 62-63

[07:35] Team_007 possession (Score: 62-63)
Bones Siakam attempts a 3Pt. Contested by D'Angelo Randle (3.7 feet, MAN). Bones Siakam misses. FOUL! Loose ball foul on DeMar James during the rebound battle. [Team fouls: 2] No free throws, side out. (DeMar James: 1 personal fouls)

[07:23] Team_007 possession (Score: 62-63)
FOUL! Shooting foul on D'Angelo Randle. Bones Siakam to the line for 3 free throws. [Team fouls: 3] (D'Angelo Randle: 2 personal fouls)   FT 1/3: GOOD   FT 2/3: GOOD   FT 3/3: MISS Bones Siakam makes 2/3 from the line. FOUL! Loose ball foul on DeMar James during the free throw rebound! [Team fouls: 4] No free throws, side out. (DeMar James: 2 personal fouls)
Score: 64-63

[07:13] Team_007 possession (Score: 64-63)
Bones Siakam commits a violation (traveling/carry)! TURNOVER! (dead ball)

[06:56] Team_019 possession (Score: 64-63)
D'Angelo Randle drives, John Quickley stays with him. D'Angelo Randle attempts a Layup. Contested by John Quickley (3.3 feet, ZONE). D'ANGELO RANDLE MAKES IT!
Score: 64-65

[06:39] Team_007 possession (Score: 64-65)
John Quickley attempts a Midrange. Contested by DeMar James (4.9 feet, ZONE). JOHN QUICKLEY MAKES IT! Assist: Carmelo Siakam
Score: 66-65

[06:21] Team_019 possession (Score: 66-65)
D'Angelo Randle attempts a Midrange. Contested by John Quickley (3.3 feet, ZONE). D'Angelo Randle misses. Rebound secured by Bones Siakam.

[06:10] Team_007 possession (Score: 66-65)
Carmelo Siakam attempts a 3Pt. Contested by DeMar James (4.6 feet, MAN). Carmelo Siakam misses. Offensive rebound by Bones Siakam! Bones Siakam's putback is no good. Rebound secured by DeMar James.

[05:57] Team_019 possession (Score: 66-65)
FOUL! Offensive foul on DeMar James! John Quickley drew the charge! [Team fouls: 5] (DeMar James: 3 personal fouls) TURNOVER! (dead ball)

[05:47] Team_007 possession (Score: 66-65)
Jaren Dosunmu attempts a Layup. Contested by DeMar James (4.2 feet, ZONE). Jaren Dosunmu misses. Rebound secured by DeMar James.

[05:31] Team_019 possession (Score: 66-65)
FOUL! Reach-in foul on John Quickley during the drive. [Team fouls: 4] No free throws, side out. (John Quickley: 3 personal fouls)

[05:18] Team_019 possession (Score: 66-65)
FOUL! Reach-in foul on Jaren Dosunmu during the drive. [IN THE BONUS! 5 team fouls] Brandon James to the line for 2 free throws. (Jaren Dosunmu: 1 personal fouls)   FT 1/2: GOOD   FT 2/2: MISS Brandon James makes 1/2 from the line. Offensive rebound by D'Angelo Randle! D'Angelo Randle puts it back in!
Score: 66-68

[05:04] Team_007 possession (Score: 66-68)
Tobias Johnson attempts a 3Pt. Contested by Rudy Giddey (5.7 feet, MAN). Tobias Johnson misses. Rebound secured by DeMar James.

[04:52] Team_019 possession (Score: 66-68)
DeMar James drives, John Quickley stays with him. DeMar James attempts a Layup. Contested by John Quickley (3.5 feet, MAN). DEMAR JAMES MAKES IT! Assist: Rudy Giddey
Score: 66-70

[04:38] Team_007 possession (Score: 66-70)
Carmelo Siakam drives, DeMar James stays with him. Carmelo Siakam attempts a Dunk. Contested by DeMar James (4.7 feet, MAN). CARMELO SIAKAM MAKES IT! Assist: Tobias Johnson
Score: 68-70

[04:22] Team_019 possession (Score: 68-70)
Brandon James attempts a 3Pt. Contested by Jaren Dosunmu (4.4 feet, MAN). Brandon James misses. Rebound secured by John Quickley.

[04:05] Team_007 possession (Score: 68-70)
Jaren Dosunmu attempts a Midrange. Contested by Brandon James (5.2 feet, MAN). JAREN DOSUNMU MAKES IT!
Score: 70-70

[03:50] Team_019 possession (Score: 70-70)
D'Angelo Randle drives, Bones Siakam stays with him. D'Angelo Randle attempts a Layup. Contested by Bones Siakam (4.0 feet, MAN). D'Angelo Randle misses. Rebound secured by John Quickley.

[03:32] Team_007 possession (Score: 70-70)
Jaren Dosunmu throws a bad pass! Stolen by Brandon James! TURNOVER! (live ball)

[03:19] Team_019 possession (Score: 70-70)
Tobias Hyland makes the Layup and draws the foul on John Quickley! And-1! Tobias Hyland to the line for 1. [BONUS: 6 team fouls] (John Quickley: 4 personal fouls)   FT 1/1: GOOD Tobias Hyland makes 1/1 from the line.
Score: 70-73

[03:03] Team_007 possession (Score: 70-73)
Jaren Dosunmu attempts a 3Pt. Contested by Brandon James (5.3 feet, MAN). Jaren Dosunmu misses. Rebound secured by DeMar James.

[02:45] Team_019 possession (Score: 70-73)
FOUL! Shooting foul on Tobias Johnson. Rudy Giddey to the line for 3 free throws. [BONUS: 7 team fouls] (Tobias Johnson: 1 personal fouls)   FT 1/3: GOOD   FT 2/3: GOOD   FT 3/3: GOOD Rudy Giddey makes 3/3 from the line.
Score: 70-76

[02:30] Team_007 possession (Score: 70-76)
Bones Siakam makes the Layup and draws the foul on D'Angelo Randle! And-1! Bones Siakam to the line for 1. [BONUS: 6 team fouls] (D'Angelo Randle: 3 personal fouls)   FT 1/1: MISS Bones Siakam makes 0/1 from the line. Offensive rebound by Carmelo Siakam! Carmelo Siakam's putback is no good.
Score: 72-76

[02:17] Team_019 possession (Score: 72-76)
Tobias Hyland attempts a Midrange. Contested by John Quickley (3.4 feet, MAN). TOBIAS HYLAND MAKES IT! Assist: D'Angelo Randle
Score: 72-78

[02:00] Team_007 possession (Score: 72-78)
Jaren Dosunmu attempts a Midrange. Contested by Brandon James (5.4 feet, MAN). Jaren Dosunmu misses. Offensive rebound by Carmelo Siakam! Carmelo Siakam puts it back in!
Score: 74-78

[01:43] Team_019 possession (Score: 74-78)
Rudy Giddey drives and kicks out. D'Angelo Randle attempts a Midrange. Contested by Bones Siakam (4.0 feet, MAN). D'ANGELO RANDLE MAKES IT! Assist: Tobias Hyland
Score: 74-80

[01:31] Team_007 possession (Score: 74-80)
John Quickley makes the Layup and draws the foul on DeMar James! And-1! John Quickley to the line for 1. [BONUS: 7 team fouls] (DeMar James: 4 personal fouls)   FT 1/1: MISS John Quickley makes 0/1 from the line. Rebound secured by D'Angelo Randle.
Score: 76-80

[01:13] Team_019 possession (Score: 76-80)
FOUL! Holding foul on John Quickley. [IN THE BONUS! 8 team fouls] Tobias Hyland to the line for 2 free throws. (John Quickley: 5 personal fouls)   FT 1/2: GOOD   FT 2/2: MISS Tobias Hyland makes 1/2 from the line. Rebound secured by Carmelo Siakam.
Score: 76-81

[01:01] Team_007 possession (Score: 76-81)
Jaren Dosunmu drives and kicks out. John Quickley attempts a 3Pt. Wide open! Tobias Hyland is 6.1 feet away. [MAN] JOHN QUICKLEY MAKES IT! Assist: Jaren Dosunmu
Score: 79-81

[00:47] Team_019 possession (Score: 79-81)
DeMar James loses the ball! Stripped by John Quickley! TURNOVER! (live ball)

[00:33] Team_007 possession (Score: 79-81)
Jaren Dosunmu attempts a 3Pt. Contested by D'Angelo Randle (4.1 feet, ZONE). Jaren Dosunmu misses. Offensive rebound by Carmelo Siakam! Carmelo Siakam's putback is no good. Rebound secured by DeMar James.

[00:22] Team_019 possession (Score: 79-81)
Rudy Giddey attempts a Midrange. Contested by Bones Siakam (4.4 feet, ZONE). RUDY GIDDEY MAKES IT! Assist: D'Angelo Randle
Score: 79-83

[00:07] Team_007 possession (Score: 79-83)
FOUL! Reach-in foul on DeMar James during the drive. [IN THE BONUS! 8 team fouls] Carmelo Siakam to the line for 2 free throws. (DeMar James: 5 personal fouls)   FT 1/2: GOOD   FT 2/2: GOOD Carmelo Siakam makes 2/2 from the line.
Score: 81-83

================================================================================
                              3RD QUARTER COMPLETE                              
================================================================================

3RD QUARTER SCORE: Team_007 21, Team_019 30

BOX SCORE:
================================================================================

Team_007
--------------------------------------------------------------------------------
Player                MIN  PTS  REB  AST  TO      FG   FG%      3P   3P%
--------------------------------------------------------------------------------
Carmelo Siakam         25    6    5    1   0   3/5    60.0     0/0   0.0
John Quickley          25    5    3    0   0   2/4    50.0     0/0   0.0
DeMar James            25    2   11    2   0   1/2    50.0     0/0   0.0
Tobias Johnson         26    2    0    1   0   1/3    33.3     0/0   0.0
Jaren Dosunmu          27    2    0    1   0   1/5    20.0     0/0   0.0
Bones Siakam           25    0    4    0   0   0/3     0.0     0/0   0.0

TEAM: FG: 7/20 (35.0%), 3PT: 0/7 (0.0%), REB: 13 (6 off, 7 def), AST: 3, TO: 2
TEAM FOULS: 8 [Team_019 in BONUS]


Team_019
--------------------------------------------------------------------------------
Player                MIN  PTS  REB  AST  TO      FG   FG%      3P   3P%
--------------------------------------------------------------------------------
Rudy Giddey            26   11    0    1   0   4/4   100.0     0/0   0.0
D'Angelo Randle        25    7    3    3   0   3/6    50.0     0/0   0.0
Tobias Hyland          24    5    0    1   0   2/2   100.0     0/0   0.0
Brandon James          25    3    0    0   0   1/3    33.3     0/0   0.0

TEAM: FG: 11/18 (61.1%), 3PT: 4/7 (57.1%), REB: 13 (2 off, 11 def), AST: 7, TO: 3
TEAM FOULS: 8 [Team_007 in BONUS]

================================================================================

================================================================================
                       4TH QUARTER - Team_007 vs Team_019                       
================================================================================

[12:00] Team_007 possession (Score: 81-83)
Bones Siakam attempts a Layup. Contested by D'Angelo Randle (4.0 feet, MAN). Bones Siakam misses. Rebound secured by DeMar James.

[11:46] Team_019 possession (Score: 81-83)
Rudy Giddey attempts a 3Pt. Contested by Tobias Johnson (5.3 feet, MAN). Rudy Giddey misses. Rebound secured by Carmelo Siakam.

[11:34] Team_007 possession (Score: 81-83)
Carmelo Siakam makes the Layup and draws the foul on DeMar James! And-1! Carmelo Siakam to the line for 1. [Team fouls: 1] (DeMar James: 1 personal fouls)   FT 1/1: GOOD Carmelo Siakam makes 1/1 from the line.
Score: 84-83

[11:24] Team_019 possession (Score: 84-83)
Brandon James attempts a 3Pt. Contested by John Quickley (3.6 feet, ZONE). Brandon James misses. Rebound secured by John Quickley.

[11:09] Team_007 possession (Score: 84-83)
Tobias Johnson drives and kicks out. Tobias Johnson attempts a Midrange. Contested by D'Angelo Randle (4.1 feet, ZONE). Tobias Johnson misses. FOUL! Loose ball foul on DeMar James during the rebound battle. [Team fouls: 2] No free throws, side out. (DeMar James: 2 personal fouls)

[10:56] Team_007 possession (Score: 84-83)
Tobias Johnson attempts a 3Pt. Contested by Rudy Giddey (6.0 feet, MAN). Tobias Johnson misses. Offensive rebound by Bones Siakam! Bones Siakam kicks it out.

[10:45] Team_007 possession (Score: 84-83)
John Quickley attempts a Layup. Contested by DeMar James (5.4 feet, ZONE). JOHN QUICKLEY MAKES IT! Assist: Tobias Johnson
Score: 86-83

[10:30] Team_019 possession (Score: 86-83)
DeMar James attempts a Layup. Contested by John Quickley (4.0 feet, MAN). DeMar James misses. Offensive rebound by D'Angelo Randle! D'Angelo Randle kicks it out.

[10:17] Team_019 possession (Score: 86-83)
Brandon James drives to the basket... Brandon James throws a bad pass out of bounds! TURNOVER! (dead ball)

[10:17] Substitution (Team_007): Tobias Johnson OUT → Wendell Poole IN (stamina_rule2)

[10:17] Substitution (Team_007): Jaren Dosunmu OUT → OG Porzingis IN (stamina_rule2)

[10:17] Substitution (Team_007): Bones Siakam OUT → Gary LaVine IN (stamina_rule2)

[10:17] Substitution (Team_007): John Quickley OUT → Austin Simons IN (stamina_rule2)

[10:17] Substitution (Team_007): Carmelo Siakam OUT → Draymond Harris IN (stamina_rule2)

[10:17] Substitution (Team_019): Rudy Giddey OUT → Gary Ginobili IN (stamina_rule2)

[10:17] Substitution (Team_019): Brandon James OUT → Jalen Turner IN (stamina_rule2)

[10:17] Substitution (Team_019): D'Angelo Randle OUT → Blake LaVine IN (stamina_rule2)

[10:17] Substitution (Team_019): Tobias Hyland OUT → Shai Ingram IN (stamina_rule2)

[10:17] Substitution (Team_019): DeMar James OUT → Tim Jordan IN (stamina_rule2)

[10:03] Team_007 possession (Score: 86-83)
Austin Simons attempts a Midrange. Wide open! Tim Jordan is 6.8 feet away. [ZONE] AUSTIN SIMONS MAKES IT!
Score: 88-83

[09:44] Team_019 possession (Score: 88-83)
Blake LaVine drives and kicks out. Tim Jordan attempts a 3Pt. Contested by Draymond Harris (5.0 feet, MAN). Tim Jordan misses. Rebound secured by Gary LaVine.

[09:30] Team_007 possession (Score: 88-83)
Draymond Harris drives and kicks out. Gary LaVine attempts a 3Pt. Contested by Blake LaVine (4.7 feet, ZONE). Gary LaVine misses. Rebound secured by Tim Jordan.

[09:17] Team_019 possession (Score: 88-83)
Jalen Turner attempts a 3Pt. Contested by Austin Simons (4.0 feet, ZONE). Jalen Turner misses. Rebound secured by Draymond Harris.

[09:00] Team_007 possession (Score: 88-83)
Gary LaVine drives, picks up Shai Ingram. Help arrives from Jalen Turner! Gary LaVine attempts a Dunk. Contested by Jalen Turner (4.7 feet, ZONE). GARY LAVINE MAKES IT! Assist: Austin Simons
Score: 90-83

[08:43] Team_019 possession (Score: 90-83)
Blake LaVine attempts a 3Pt. Contested by Wendell Poole (5.4 feet, ZONE). Blake LaVine misses. Offensive rebound by Shai Ingram! Shai Ingram kicks it out.

[08:24] Team_019 possession (Score: 90-83)
Shai Ingram attempts a 3Pt. Contested by OG Porzingis (4.2 feet, ZONE). Shai Ingram misses. Rebound secured by Gary LaVine.

[08:13] Team_007 possession (Score: 90-83)
Draymond Harris attempts a Layup. Contested by Shai Ingram (4.5 feet, MAN). Draymond Harris misses. Rebound secured by Tim Jordan.

[07:59] Team_019 possession (Score: 90-83)
Shai Ingram drives to the basket... Shai Ingram throws a bad pass! Stolen by Austin Simons! TURNOVER! (live ball)

[07:45] Team_007 possession (Score: 90-83)
Austin Simons makes the Layup and draws the foul on Shai Ingram! And-1! Austin Simons to the line for 1. [Team fouls: 3] (Shai Ingram: 1 personal fouls)   FT 1/1: GOOD Austin Simons makes 1/1 from the line.
Score: 93-83

[07:31] Team_019 possession (Score: 93-83)
Tim Jordan drives to the basket... Tim Jordan throws a bad pass out of bounds! TURNOVER! (dead ball)

[07:16] Team_007 possession (Score: 93-83)
Draymond Harris makes the Midrange and draws the foul on Shai Ingram! And-1! Draymond Harris to the line for 1. [Team fouls: 4] (Shai Ingram: 2 personal fouls)   FT 1/1: GOOD Draymond Harris makes 1/1 from the line.
Score: 96-83

[07:04] Team_019 possession (Score: 96-83)
FOUL! Reach-in foul on Austin Simons during the drive. [Team fouls: 1] No free throws, side out. (Austin Simons: 1 personal fouls)

[06:53] Team_019 possession (Score: 96-83)
Blake LaVine drives to the basket... FOUL! Offensive foul on Blake LaVine! Austin Simons drew the charge! [Team fouls: 5] (Blake LaVine: 1 personal fouls) TURNOVER! (dead ball)

[06:41] Team_007 possession (Score: 96-83)
Austin Simons attempts a Layup. Contested by Shai Ingram (4.9 feet, MAN). Austin Simons misses. Rebound secured by Shai Ingram.

[06:27] Team_019 possession (Score: 96-83)
Shai Ingram throws a bad pass out of bounds! TURNOVER! (dead ball)

[06:13] Team_007 possession (Score: 96-83)
Austin Simons attempts a Midrange. Contested by Shai Ingram (4.9 feet, ZONE). AUSTIN SIMONS MAKES IT!
Score: 98-83

[05:57] Team_019 possession (Score: 98-83)
Tim Jordan attempts a 3Pt. Contested by OG Porzingis (4.2 feet, ZONE). Tim Jordan misses. Rebound secured by Draymond Harris.

[05:44] Team_007 possession (Score: 98-83)
FOUL! Offensive foul on Gary LaVine! Blake LaVine drew the charge! [Team fouls: 2] (Gary LaVine: 1 personal fouls) TURNOVER! (dead ball)

[05:33] Team_019 possession (Score: 98-83)
Jalen Turner attempts a Layup. BLOCKED BY AUSTIN SIMONS! Ball is loose! Offensive rebound by Shai Ingram! Shai Ingram kicks it out.

[05:22] Team_019 possession (Score: 98-83)
Blake LaVine attempts a 3Pt. Contested by Gary LaVine (4.5 feet, MAN). Blake LaVine misses. Rebound secured by Austin Simons.

[05:07] Team_007 possession (Score: 98-83)
Draymond Harris attempts a 3Pt. Contested by Blake LaVine (4.7 feet, ZONE). DRAYMOND HARRIS MAKES IT! Assist: OG Porzingis
Score: 101-83

[04:52] Team_019 possession (Score: 101-83)
Shai Ingram throws a bad pass! Stolen by Austin Simons! TURNOVER! (live ball)

[04:40] Team_007 possession (Score: 101-83)
Austin Simons attempts a Layup. Contested by Shai Ingram (4.9 feet, ZONE). AUSTIN SIMONS MAKES IT!
Score: 103-83

[04:22] Team_019 possession (Score: 103-83)
Gary Ginobili makes the Layup and draws the foul on Austin Simons! And-1! Gary Ginobili to the line for 1. [Team fouls: 3] (Austin Simons: 2 personal fouls)   FT 1/1: GOOD Gary Ginobili makes 1/1 from the line.
Score: 103-86

[04:12] Team_007 possession (Score: 103-86)
Austin Simons attempts a 3Pt. Contested by Blake LaVine (5.1 feet, ZONE). Austin Simons misses. Rebound secured by Blake LaVine.

[03:59] Team_019 possession (Score: 103-86)
Blake LaVine drives and kicks out. FOUL! Shooting foul on OG Porzingis. Jalen Turner to the line for 3 free throws. [Team fouls: 4] (OG Porzingis: 1 personal fouls)   FT 1/3: GOOD   FT 2/3: MISS   FT 3/3: GOOD Jalen Turner makes 2/3 from the line.
Score: 103-88

[03:47] Team_007 possession (Score: 103-88)
Austin Simons attempts a 3Pt. Contested by Blake LaVine (5.1 feet, ZONE). Austin Simons misses. Rebound secured by Tim Jordan.

[03:33] Team_019 possession (Score: 103-88)
Jalen Turner attempts a Layup. Contested by OG Porzingis (4.5 feet, MAN). JALEN TURNER MAKES IT! Assist: Gary Ginobili
Score: 103-90

[03:20] Team_007 possession (Score: 103-90)
Wendell Poole attempts a 3Pt. Contested by Blake LaVine (5.0 feet, ZONE). WENDELL POOLE MAKES IT! Assist: Draymond Harris
Score: 106-90

[03:05] Team_019 possession (Score: 106-90)
FOUL! Shooting foul on Draymond Harris. Tim Jordan to the line for 2 free throws. [BONUS: 5 team fouls] (Draymond Harris: 1 personal fouls)   FT 1/2: GOOD   FT 2/2: GOOD Tim Jordan makes 2/2 from the line.
Score: 106-92

[02:48] Team_007 possession (Score: 106-92)
OG Porzingis drives and kicks out. OG Porzingis attempts a Midrange. Contested by Jalen Turner (4.0 feet, MAN). OG PORZINGIS MAKES IT!
Score: 108-92

[02:36] Team_019 possession (Score: 108-92)
Blake LaVine attempts a 3Pt. Contested by Gary LaVine (4.6 feet, MAN). Blake LaVine misses. Rebound secured by Austin Simons.

[02:23] Team_007 possession (Score: 108-92)
Wendell Poole drives and kicks out. Austin Simons makes the Midrange and draws the foul on Blake LaVine! And-1! Austin Simons to the line for 1. [BONUS: 6 team fouls] (Blake LaVine: 2 personal fouls)   FT 1/1: GOOD Austin Simons makes 1/1 from the line.
Score: 111-92

[02:09] Team_019 possession (Score: 111-92)
Jalen Turner attempts a Layup. Contested by OG Porzingis (4.6 feet, MAN). JALEN TURNER MAKES IT! Assist: Blake LaVine
Score: 111-94

[01:54] Team_007 possession (Score: 111-94)
Wendell Poole attempts a Midrange. Contested by Jalen Turner (4.3 feet, ZONE). Wendell Poole misses. Rebound secured by Shai Ingram.

[01:40] Team_019 possession (Score: 111-94)
FOUL! Shooting foul on Austin Simons. Shai Ingram to the line for 2 free throws. [BONUS: 6 team fouls] (Austin Simons: 3 personal fouls)   FT 1/2: MISS   FT 2/2: GOOD Shai Ingram makes 1/2 from the line.
Score: 111-95

[01:22] Team_007 possession (Score: 111-95)
OG Porzingis makes the 3Pt and draws the foul on Blake LaVine! And-1! OG Porzingis to the line for 1. [BONUS: 7 team fouls] (Blake LaVine: 3 personal fouls)   FT 1/1: GOOD OG Porzingis makes 1/1 from the line.
Score: 115-95

[01:09] Team_019 possession (Score: 115-95)
Shai Ingram makes the Dunk and draws the foul on Austin Simons! And-1! Shai Ingram to the line for 1. [BONUS: 7 team fouls] (Austin Simons: 4 personal fouls)   FT 1/1: GOOD Shai Ingram makes 1/1 from the line.
Score: 115-98

[00:55] Team_007 possession (Score: 115-98)
OG Porzingis attempts a Midrange. Contested by Jalen Turner (3.8 feet, ZONE). OG PORZINGIS MAKES IT! Assist: Wendell Poole
Score: 117-98

[00:43] Team_019 possession (Score: 117-98)
Gary Ginobili drives, Wendell Poole stays with him. Gary Ginobili attempts a Layup. Contested by Wendell Poole (5.9 feet, MAN). Gary Ginobili misses. Rebound secured by Gary LaVine.

[00:33] Team_007 possession (Score: 117-98)
FOUL! Shooting foul on Shai Ingram. Draymond Harris to the line for 2 free throws. [BONUS: 8 team fouls] (Shai Ingram: 3 personal fouls)   FT 1/2: GOOD   FT 2/2: GOOD Draymond Harris makes 2/2 from the line.
Score: 119-98

[00:16] Team_019 possession (Score: 119-98)
Jalen Turner attempts a Midrange. Contested by OG Porzingis (4.7 feet, ZONE). JALEN TURNER MAKES IT!
Score: 119-100

================================================================================
                              4TH QUARTER COMPLETE                              
================================================================================

4TH QUARTER SCORE: Team_007 38, Team_019 17

BOX SCORE:
================================================================================

Team_007
--------------------------------------------------------------------------------
Player                MIN  PTS  REB  AST  TO      FG   FG%      3P   3P%
--------------------------------------------------------------------------------
Austin Simons          21   12    2    1   0   5/8    62.5     0/0   0.0
Draymond Harris        21    8    2    1   0   3/5    60.0     0/0   0.0
OG Porzingis           19    8    0    1   0   3/3   100.0     0/0   0.0
Carmelo Siakam         27    3    1    0   0   1/1   100.0     0/0   0.0
Wendell Poole          21    3    0    1   0   1/2    50.0     0/0   0.0
John Quickley          27    2    1    0   0   1/1   100.0     0/0   0.0
Gary LaVine            21    2    3    0   0   1/1   100.0     0/0   0.0
Bones Siakam           27    0    2    0   0   0/1     0.0     0/0   0.0
Tobias Johnson         28    0    0    1   0   0/0     0.0     0/0   0.0

TEAM: FG: 15/22 (68.2%), 3PT: 3/5 (60.0%), REB: 11 (2 off, 9 def), AST: 5, TO: 1
TEAM FOULS: 7 [Team_019 in BONUS]


Team_019
--------------------------------------------------------------------------------
Player                MIN  PTS  REB  AST  TO      FG   FG%      3P   3P%
--------------------------------------------------------------------------------
Jalen Turner           21    8    0    0   0   4/5    80.0     0/0   0.0
Shai Ingram            22    4    4    0   0   2/3    66.7     0/0   0.0
Gary Ginobili          21    3    0    1   0   1/2    50.0     0/0   0.0
Tim Jordan             21    2    3    0   0   1/2    50.0     0/0   0.0
DeMar James            27    0    1    0   0   0/0     0.0     0/0   0.0
Rudy Giddey            28    0    0    0   0   0/1     0.0     0/0   0.0
Brandon James          27    0    0    0   0   0/1     0.0     0/0   0.0
D'Angelo Randle        27    0    1    0   0   0/0     0.0     0/0   0.0
Blake LaVine           21    0    1    1   0   0/3     0.0     0/0   0.0

TEAM: FG: 8/17 (47.1%), 3PT: 0/7 (0.0%), REB: 10 (3 off, 7 def), AST: 2, TO: 6
TEAM FOULS: 8 [Team_007 in BONUS]

================================================================================

================================================================================
                               FULL GAME COMPLETE                               
================================================================================

FINAL SCORE: Team_007 119, Team_019 100

SCORING BY QUARTER:
--------------------------------------------------------------------------------
Team                     Q1     Q2     Q3     Q4    FINAL
--------------------------------------------------------------------------------
Team_007                 28     32     21     38      119
Team_019                 27     26     30     17      100
--------------------------------------------------------------------------------

FULL GAME BOX SCORE:
================================================================================

Team_007
--------------------------------------------------------------------------------
Player                MIN  PTS  REB  AST  TO      FG   FG%      3P   3P%      FT STL BLK
--------------------------------------------------------------------------------
Jaren Dosunmu          29    8    0    3   2   5/14   35.7   1/6    16.7   1/1     0   1
Tobias Johnson         28   11    0    4   0   6/10   60.0   0/3     0.0   4/5     0   0
Bones Siakam           27   14   12    1   2   5/11   45.5   2/5    40.0   2/4     0   0
John Quickley          27    9    9    1   1   5/8    62.5   0/0     0.0   0/1     2   2
Carmelo Siakam         27   14   10    3   0   3/5    60.0   0/2     0.0   3/3     0   0
Gary LaVine            21    9    5    2   2   6/7    85.7   2/3    66.7   0/0     0   0
Austin Simons          21   23    5    2   0   7/12   58.3   0/3     0.0   3/3     3   1
Draymond Harris        21   12    6    2   0   5/8    62.5   1/1   100.0   3/3     0   0
Wendell Poole          21    5    0    2   1   3/5    60.0   1/1   100.0   0/0     1   0
OG Porzingis           19    8    0    3   0   3/4    75.0   1/2    50.0   1/1     0   0

TEAM: FG: 48/84 (57.1%), 3PT: 8/26 (30.8%), REB: 47 (14 off, 33 def), AST: 23, TO: 8


Team_019
--------------------------------------------------------------------------------
Player                MIN  PTS  REB  AST  TO      FG   FG%      3P   3P%      FT STL BLK
--------------------------------------------------------------------------------
Rudy Giddey            28   17    0    2   1   7/11   63.6   3/4    75.0   3/3     0   0
Brandon James          27    3    0    1   1   2/8    25.0   1/5    20.0   1/2     1   0
D'Angelo Randle        27   12    8    3   0   3/6    50.0   1/2    50.0   2/2     0   0
DeMar James            27    5   14    4   2   2/4    50.0   0/0     0.0   2/3     0   0
Tobias Hyland          26   17    4    2   1   8/12   66.7   2/3    66.7   4/5     0   0
Shai Ingram            22    7    7    2   4   3/4    75.0   0/1     0.0   3/4     0   0
Blake LaVine           21    8    4    3   2   5/9    55.6   0/3     0.0   0/0     0   0
Tim Jordan             21    9    6    0   3   4/6    66.7   0/1     0.0   3/3     0   0
Jalen Turner           21   14    0    1   1   5/8    62.5   1/3    33.3   3/4     0   0
Gary Ginobili          21    6    0    2   1   2/5    40.0   1/2    50.0   1/1     0   0

TEAM: FG: 41/74 (55.4%), 3PT: 9/24 (37.5%), REB: 41 (7 off, 34 def), AST: 20, TO: 16

================================================================================
