================================================================================
                        FULL GAME - Team_100 vs Team_013                        
================================================================================

================================================================================
                       1ST QUARTER - Team_100 vs Team_013                       
================================================================================

[12:00] Team_100 possession (Score: 0-0)
Chris Mobley drives, picks up Desmond Ginobili. Help arrives from Pau Mobley! Chris Mobley attempts a Layup. Contested by Pau Mobley (5.1 feet, ZONE). Chris Mobley misses. Rebound secured by Pau Mobley.

[11:48] Team_013 possession (Score: 0-0)
Jayson Morant loses the ball! Stripped by Tyler Griffin! TURNOVER! (live ball)

[11:35] Team_100 possession (Score: 0-0)
Luka Green attempts a Midrange. Contested by Desmond Ginobili (5.0 feet, ZONE). Luka Green misses. Rebound secured by Pau Mobley.

[11:19] Team_013 possession (Score: 0-0)
Pau Mobley attempts a Midrange. Wide open! Manu Ball is 6.0 feet away. [MAN] Pau Mobley misses. Rebound secured by Pau LaVine.

[11:04] Team_100 possession (Score: 0-0)
Pau LaVine drives, Desmond Ginobili stays with him. Pau LaVine attempts a Dunk. Contested by Desmond Ginobili (4.9 feet, MAN). PAU LAVINE MAKES IT! Assist: Tyler Griffin
Score: 2-0

[10:46] Team_013 possession (Score: 2-0)
FOUL! Shooting foul on Manu Ball. Desmond Ginobili to the line for 2 free throws. [Team fouls: 1] (Manu Ball: 1 personal fouls)   FT 1/2: GOOD   FT 2/2: GOOD Desmond Ginobili makes 2/2 from the line.
Score: 2-2

[10:27] Team_100 possession (Score: 2-2)
Chris Mobley drives to the basket... FOUL! Offensive foul on Chris Mobley! Desmond Ginobili drew the charge! [Team fouls: 2] (Chris Mobley: 1 personal fouls) TURNOVER! (dead ball)

[10:17] Team_013 possession (Score: 2-2)
Jayson Morant throws a bad pass out of bounds! TURNOVER! (dead ball)

[10:03] Team_100 possession (Score: 2-2)
FOUL! Shooting foul on Desmond Ginobili. Pau LaVine to the line for 2 free throws. [Team fouls: 1] (Desmond Ginobili: 1 personal fouls)   FT 1/2: GOOD   FT 2/2: GOOD Pau LaVine makes 2/2 from the line.
Score: 4-2

[09:44] Team_013 possession (Score: 4-2)
Desmond Ginobili drives, picks up Pau LaVine. Help arrives from Manu Ball! Desmond Ginobili attempts a Dunk. Contested by Manu Ball (4.8 feet, MAN). DESMOND GINOBILI MAKES IT! Assist: Pau Mobley
Score: 4-4

[09:32] Team_100 possession (Score: 4-4)
Pau LaVine attempts a 3Pt. Contested by Pau Mobley (3.8 feet, ZONE). PAU LAVINE MAKES IT! Assist: Tyler Griffin
Score: 7-4

[09:16] Team_013 possession (Score: 7-4)
Pau Mobley attempts a 3Pt. Wide open! Manu Ball is 6.0 feet away. [MAN] PAU MOBLEY MAKES IT! Assist: Jayson Morant
Score: 7-7

[09:02] Team_100 possession (Score: 7-7)
Chris Mobley attempts a Layup. BLOCKED BY NIKOLA CURRY! Ball is loose! Rebound secured by Desmond Ginobili.

[08:48] Team_013 possession (Score: 7-7)
FOUL! Holding foul on Tyler Griffin. [Team fouls: 3] No free throws, side out. (Tyler Griffin: 1 personal fouls)

[08:29] Team_013 possession (Score: 7-7)
Desmond Ginobili attempts a Midrange. Contested by Pau LaVine (4.8 feet, MAN). Desmond Ginobili misses. Rebound secured by Chris Mobley.

[08:13] Team_100 possession (Score: 7-7)
Pau LaVine drives and kicks out. Luka Green attempts a 3Pt. Contested by Pau Mobley (3.7 feet, ZONE). Luka Green misses. Offensive rebound by Chris Mobley! Chris Mobley kicks it out.

[07:54] Team_100 possession (Score: 7-7)
Pau LaVine drives to the basket... Pau LaVine throws a bad pass! Stolen by Desmond Ginobili! TURNOVER! (live ball)

[07:37] Team_013 possession (Score: 7-7)
Jayson Morant attempts a 3Pt. BLOCKED BY TYLER GRIFFIN! Ball is loose! Rebound secured by Tyler Griffin.

[07:19] Team_100 possession (Score: 7-7)
Chris Mobley drives and kicks out. Chris Mobley attempts a 3Pt. Contested by Manu Smith (4.7 feet, ZONE). Chris Mobley misses. Rebound secured by Nikola Curry.

[07:01] Team_013 possession (Score: 7-7)
FOUL! Holding foul on Luka Green. [Team fouls: 4] No free throws, side out. (Luka Green: 1 personal fouls)

[06:50] Team_013 possession (Score: 7-7)
Pau Mobley attempts a 3Pt. Contested by Luka Green (5.3 feet, ZONE). PAU MOBLEY MAKES IT! Assist: Jayson Morant
Score: 7-10

[06:35] Team_100 possession (Score: 7-10)
Chris Mobley drives, Desmond Ginobili stays with him. Chris Mobley attempts a Layup. Contested by Desmond Ginobili (5.1 feet, ZONE). Chris Mobley misses. Rebound secured by Pau Mobley.

[06:22] Team_013 possession (Score: 7-10)
Jayson Morant attempts a 3Pt. Contested by Tyler Griffin (5.1 feet, MAN). Jayson Morant misses. Rebound secured by Pau LaVine.

[06:11] Team_100 possession (Score: 7-10)
FOUL! Reach-in foul on Nikola Curry during the drive. [Team fouls: 2] No free throws, side out. (Nikola Curry: 1 personal fouls)

[05:55] Team_100 possession (Score: 7-10)
Manu Ball drives, Pau Mobley stays with him. Manu Ball attempts a Dunk. Contested by Pau Mobley (3.7 feet, MAN). MANU BALL MAKES IT! Assist: Tyler Griffin
Score: 9-10

[05:40] Team_013 possession (Score: 9-10)
Manu Smith attempts a Layup. Contested by Pau LaVine (5.0 feet, ZONE). MANU SMITH MAKES IT! Assist: Jayson Morant
Score: 9-12

[05:26] Team_100 possession (Score: 9-12)
Chris Mobley drives to the basket... Chris Mobley throws a bad pass! Stolen by Nikola Curry! TURNOVER! (live ball)

[05:13] Team_013 possession (Score: 9-12)
Jayson Morant attempts a 3Pt. Contested by Luka Green (5.7 feet, ZONE). Jayson Morant misses. Rebound secured by Chris Mobley.

[04:57] Team_100 possession (Score: 9-12)
Pau LaVine drives and kicks out. Tyler Griffin attempts a Midrange. Contested by Pau Mobley (3.7 feet, ZONE). Tyler Griffin misses. Rebound secured by Pau Mobley.

[04:42] Team_013 possession (Score: 9-12)
Manu Smith attempts a Midrange. Contested by Luka Green (5.9 feet, MAN). MANU SMITH MAKES IT!
Score: 9-14

[04:25] Team_100 possession (Score: 9-14)
Luka Green drives and kicks out. Manu Ball attempts a Midrange. Contested by Pau Mobley (3.8 feet, MAN). Manu Ball misses. Offensive rebound by Pau LaVine! Pau LaVine kicks it out.

[04:14] Team_100 possession (Score: 9-14)
Manu Ball drives to the basket... Manu Ball throws a bad pass out of bounds! TURNOVER! (dead ball)

[04:02] Team_013 possession (Score: 9-14)
FOUL! Reach-in foul on Pau LaVine during the drive. [IN THE BONUS! 5 team fouls] Nikola Curry to the line for 2 free throws. (Pau LaVine: 1 personal fouls)   FT 1/2: MISS   FT 2/2: GOOD Nikola Curry makes 1/2 from the line.
Score: 9-15

[03:49] Team_100 possession (Score: 9-15)
Manu Ball drives to the basket... FOUL! Offensive foul on Manu Ball! Desmond Ginobili drew the charge! [Team fouls: 6] (Manu Ball: 2 personal fouls) TURNOVER! (dead ball)

[03:35] Team_013 possession (Score: 9-15)
Nikola Curry attempts a Layup. Contested by Chris Mobley (5.9 feet, MAN). NIKOLA CURRY MAKES IT! Assist: Manu Smith
Score: 9-17

[03:23] Team_100 possession (Score: 9-17)
Chris Mobley drives, Nikola Curry stays with him. Chris Mobley attempts a Dunk. Contested by Nikola Curry (5.4 feet, MAN). CHRIS MOBLEY MAKES IT!
Score: 11-17

[03:05] Team_013 possession (Score: 11-17)
Jayson Morant drives and kicks out. Nikola Curry attempts a 3Pt. Contested by Chris Mobley (5.4 feet, MAN). NIKOLA CURRY MAKES IT! Assist: Manu Smith
Score: 11-20

[02:51] Team_100 possession (Score: 11-20)
FOUL! Holding foul on Desmond Ginobili. [Team fouls: 3] No free throws, side out. (Desmond Ginobili: 2 personal fouls)

[02:38] Team_100 possession (Score: 11-20)
Tyler Griffin attempts a 3Pt. Contested by Pau Mobley (4.1 feet, ZONE). Tyler Griffin misses. Offensive rebound by Pau LaVine! Pau LaVine kicks it out.

[02:22] Team_100 possession (Score: 11-20)
Manu Ball attempts a Layup. BLOCKED BY DESMOND GINOBILI! Ball goes out off Desmond Ginobili. Manu Ball's ball!

[02:06] Team_100 possession (Score: 11-20)
Tyler Griffin attempts a 3Pt. Contested by Jayson Morant (4.5 feet, MAN). TYLER GRIFFIN MAKES IT! Assist: Chris Mobley
Score: 14-20

[01:50] Team_013 possession (Score: 14-20)
Pau Mobley attempts a Layup. Wide open! Manu Ball is 6.3 feet away. [MAN] Pau Mobley misses. Rebound secured by Chris Mobley.

[01:34] Team_100 possession (Score: 14-20)
FOUL! Shooting foul on Pau Mobley. Manu Ball to the line for 2 free throws. [Team fouls: 4] (Pau Mobley: 1 personal fouls)   FT 1/2: MISS   FT 2/2: GOOD Manu Ball makes 1/2 from the line.
Score: 15-20

[01:23] Team_013 possession (Score: 15-20)
Desmond Ginobili drives, picks up Pau LaVine. Help arrives from Manu Ball! Desmond Ginobili attempts a Dunk. Contested by Manu Ball (5.2 feet, MAN). Desmond Ginobili misses. Rebound secured by Pau LaVine.

[01:05] Team_100 possession (Score: 15-20)
Pau LaVine drives and kicks out. Tyler Griffin attempts a Midrange. Contested by Jayson Morant (4.5 feet, MAN). TYLER GRIFFIN MAKES IT! Assist: Chris Mobley
Score: 17-20

[00:52] Team_013 possession (Score: 17-20)
Jayson Morant attempts a 3Pt. Contested by Tyler Griffin (5.5 feet, MAN). JAYSON MORANT MAKES IT! Assist: Pau Mobley
Score: 17-23

[00:36] Team_100 possession (Score: 17-23)
FOUL! Shooting foul on Jayson Morant. Manu Ball to the line for 2 free throws. [BONUS: 5 team fouls] (Jayson Morant: 1 personal fouls)   FT 1/2: GOOD   FT 2/2: GOOD Manu Ball makes 2/2 from the line.
Score: 19-23

[00:20] Team_013 possession (Score: 19-23)
Jayson Morant drives to the basket... Jayson Morant commits a violation (traveling/carry)! TURNOVER! (dead ball)

[00:20] Substitution (Team_100): Luka Green OUT → Dirk Sabonis IN (stamina_rule2)

[00:20] Substitution (Team_100): Manu Ball OUT → Evan Butler IN (stamina_rule2)

[00:20] Substitution (Team_100): Tyler Griffin OUT → Tyrese Wade IN (stamina_rule2)

[00:20] Substitution (Team_100): Pau LaVine OUT → Carmelo Ginobili IN (stamina_rule2)

[00:20] Substitution (Team_100): Chris Mobley OUT → John Rozier IN (stamina_rule2)

[00:20] Substitution (Team_013): Manu Smith OUT → Gary Iverson IN (stamina_rule2)

[00:20] Substitution (Team_013): Pau Mobley OUT → Chris Bryant IN (stamina_rule2)

[00:20] Substitution (Team_013): Jayson Morant OUT → Vince Nowitzki IN (stamina_rule2)

[00:20] Substitution (Team_013): Desmond Ginobili OUT → Dirk Booker IN (stamina_rule2)

[00:20] Substitution (Team_013): Nikola Curry OUT → Jayson Nowitzki IN (stamina_rule2)

[00:07] Team_100 possession (Score: 19-23)
Carmelo Ginobili drives, picks up Dirk Booker. Help arrives from Gary Iverson! Carmelo Ginobili attempts a Layup. Contested by Gary Iverson (5.1 feet, MAN). CARMELO GINOBILI MAKES IT! Assist: John Rozier
Score: 21-23

================================================================================
                              1ST QUARTER COMPLETE                              
================================================================================

1ST QUARTER SCORE: Team_100 21, Team_013 23

BOX SCORE:
================================================================================

Team_100
--------------------------------------------------------------------------------
Player                MIN  PTS  REB  AST  TO      FG   FG%      3P   3P%
--------------------------------------------------------------------------------
Pau LaVine             12    7    5    0   0   3/4    75.0     0/0   0.0
Tyler Griffin          12    5    1    3   0   2/2   100.0     0/0   0.0
Manu Ball              12    5    0    0   0   3/3   100.0     0/0   0.0
Chris Mobley           12    2    4    2   0   1/5    20.0     0/0   0.0
Carmelo Ginobili        0    2    0    0   0   1/1   100.0     0/0   0.0
Luka Green             12    0    0    0   0   0/1     0.0     0/0   0.0
John Rozier             0    0    0    1   0   0/0     0.0     0/0   0.0

TEAM: FG: 10/16 (62.5%), 3PT: 2/2 (100.0%), REB: 10 (3 off, 7 def), AST: 6, TO: 5
TEAM FOULS: 6 [Team_013 in BONUS]


Team_013
--------------------------------------------------------------------------------
Player                MIN  PTS  REB  AST  TO      FG   FG%      3P   3P%
--------------------------------------------------------------------------------
Pau Mobley             12    6    4    2   0   2/4    50.0     0/0   0.0
Nikola Curry           12    6    1    0   0   3/3   100.0     0/0   0.0
Desmond Ginobili       12    4    1    0   0   2/4    50.0     0/0   0.0
Manu Smith             12    4    0    2   0   2/2   100.0     0/0   0.0
Jayson Morant          12    3    0    3   0   1/4    25.0     0/0   0.0

TEAM: FG: 10/17 (58.8%), 3PT: 3/6 (50.0%), REB: 6 (0 off, 6 def), AST: 7, TO: 3
TEAM FOULS: 5 [Team_100 in BONUS]

================================================================================

================================================================================
                       2ND QUARTER - Team_100 vs Team_013                       
================================================================================

[12:00] Team_100 possession (Score: 21-23)
Luka Green attempts a 3Pt. Contested by Manu Smith (5.1 feet, MAN). LUKA GREEN MAKES IT! Assist: Chris Mobley
Score: 24-23

[11:46] Team_013 possession (Score: 24-23)
FOUL! Holding foul on Luka Green. [Team fouls: 1] No free throws, side out. (Luka Green: 1 personal fouls)

[11:34] Team_013 possession (Score: 24-23)
FOUL! Shooting foul on Pau LaVine. Nikola Curry to the line for 2 free throws. [Team fouls: 2] (Pau LaVine: 1 personal fouls)   FT 1/2: MISS   FT 2/2: GOOD Nikola Curry makes 1/2 from the line.
Score: 24-24

[11:20] Team_100 possession (Score: 24-24)
FOUL! Reach-in foul on Desmond Ginobili during the drive. [Team fouls: 1] No free throws, side out. (Desmond Ginobili: 1 personal fouls)

[11:07] Team_100 possession (Score: 24-24)
Luka Green attempts a 3Pt. Contested by Pau Mobley (4.3 feet, ZONE). LUKA GREEN MAKES IT! Assist: Tyler Griffin
Score: 27-24

[10:56] Team_013 possession (Score: 27-24)
FOUL! Shooting foul on Luka Green. Pau Mobley to the line for 3 free throws. [Team fouls: 3] (Luka Green: 2 personal fouls)   FT 1/3: GOOD   FT 2/3: MISS   FT 3/3: GOOD Pau Mobley makes 2/3 from the line.
Score: 27-26

[10:40] Team_100 possession (Score: 27-26)
FOUL! Offensive foul on Pau LaVine! Desmond Ginobili drew the charge! [Team fouls: 4] (Pau LaVine: 2 personal fouls) TURNOVER! (dead ball)

[10:25] Team_013 possession (Score: 27-26)
FOUL! Holding foul on Pau LaVine. [IN THE BONUS! 5 team fouls] Desmond Ginobili to the line for 2 free throws. (Pau LaVine: 3 personal fouls)   FT 1/2: GOOD   FT 2/2: GOOD Desmond Ginobili makes 2/2 from the line.
Score: 27-28

[10:12] Team_100 possession (Score: 27-28)
Luka Green attempts a 3Pt. Contested by Manu Smith (5.2 feet, MAN). Luka Green misses. Rebound secured by Nikola Curry.

[09:56] Team_013 possession (Score: 27-28)
Desmond Ginobili drives and kicks out. Manu Smith attempts a 3Pt. Contested by Luka Green (5.7 feet, ZONE). Manu Smith misses. Offensive rebound by Nikola Curry! Nikola Curry kicks it out.

[09:36] Team_013 possession (Score: 27-28)
Jayson Morant attempts a 3Pt. Contested by Luka Green (5.9 feet, ZONE). Jayson Morant misses. Rebound secured by Tyler Griffin.

[09:22] Team_100 possession (Score: 27-28)
Manu Ball attempts a Layup. Contested by Pau Mobley (4.3 feet, MAN). MANU BALL MAKES IT! Assist: Luka Green
Score: 29-28

[09:07] Team_013 possession (Score: 29-28)
Nikola Curry throws a bad pass out of bounds! TURNOVER! (dead ball)

[09:07] Substitution (Team_100): Luka Green OUT → Dirk Sabonis IN (stamina_rule2)

[09:07] Substitution (Team_100): Manu Ball OUT → Evan Butler IN (stamina_rule2)

[09:07] Substitution (Team_100): Tyler Griffin OUT → Tyrese Wade IN (stamina_rule2)

[09:07] Substitution (Team_100): Pau LaVine OUT → Carmelo Ginobili IN (stamina_rule2)

[09:07] Substitution (Team_100): Chris Mobley OUT → John Rozier IN (stamina_rule2)

[09:07] Substitution (Team_013): Manu Smith OUT → Gary Iverson IN (stamina_rule2)

[09:07] Substitution (Team_013): Pau Mobley OUT → Chris Bryant IN (stamina_rule2)

[09:07] Substitution (Team_013): Jayson Morant OUT → Vince Nowitzki IN (stamina_rule2)

[09:07] Substitution (Team_013): Desmond Ginobili OUT → Dirk Booker IN (stamina_rule2)

[09:07] Substitution (Team_013): Nikola Curry OUT → Jayson Nowitzki IN (stamina_rule2)

[08:48] Team_100 possession (Score: 29-28)
Tyrese Wade drives, picks up Vince Nowitzki. Help arrives from Gary Iverson! Tyrese Wade attempts a Layup. Contested by Gary Iverson (5.6 feet, MAN). TYRESE WADE MAKES IT! Assist: John Rozier
Score: 31-28

[08:35] Team_013 possession (Score: 31-28)
Gary Iverson attempts a Layup. Contested by John Rozier (4.3 feet, ZONE). GARY IVERSON MAKES IT! Assist: Vince Nowitzki
Score: 31-30

[08:24] Team_100 possession (Score: 31-30)
Tyrese Wade attempts a 3Pt. Contested by Chris Bryant (4.2 feet, ZONE). TYRESE WADE MAKES IT! Assist: Carmelo Ginobili
Score: 34-30

[08:10] Team_013 possession (Score: 34-30)
FOUL! Shooting foul on Evan Butler. Chris Bryant to the line for 3 free throws. [BONUS: 6 team fouls] (Evan Butler: 1 personal fouls)   FT 1/3: MISS   FT 2/3: GOOD   FT 3/3: GOOD Chris Bryant makes 2/3 from the line.
Score: 34-32

[08:01] Team_100 possession (Score: 34-32)
John Rozier drives, picks up Jayson Nowitzki. Help arrives from Gary Iverson! John Rozier attempts a Layup. Wide open! Gary Iverson is 7.0 feet away. [ZONE] JOHN ROZIER MAKES IT!
Score: 36-32

[07:45] Team_013 possession (Score: 36-32)
Chris Bryant attempts a Midrange. Contested by Evan Butler (5.3 feet, MAN). Chris Bryant misses. Rebound secured by John Rozier.

[07:29] Team_100 possession (Score: 36-32)
Dirk Sabonis attempts a Midrange. Contested by Gary Iverson (5.0 feet, MAN). Dirk Sabonis misses. Offensive rebound by John Rozier! John Rozier puts it back in!
Score: 38-32

[07:12] Team_013 possession (Score: 38-32)
Gary Iverson attempts a Layup. BLOCKED BY JOHN ROZIER! Ball is loose! Rebound secured by John Rozier.

[06:58] Team_100 possession (Score: 38-32)
Carmelo Ginobili drives and kicks out. Dirk Sabonis attempts a Midrange. Contested by Chris Bryant (4.6 feet, ZONE). DIRK SABONIS MAKES IT! Assist: Tyrese Wade
Score: 40-32

[06:41] Team_013 possession (Score: 40-32)
Jayson Nowitzki drives, John Rozier stays with him. Jayson Nowitzki attempts a Dunk. Contested by John Rozier (4.4 feet, MAN). Jayson Nowitzki misses. FOUL! Loose ball foul on Tyrese Wade during the rebound battle. [IN THE BONUS! 7 team fouls] Dirk Booker to the line for 2 free throws. (Tyrese Wade: 1 personal fouls)   FT 1/2: GOOD   FT 2/2: GOOD Dirk Booker makes 2/2 from the line.
Score: 40-34

[06:25] Team_100 possession (Score: 40-34)
John Rozier drives, Jayson Nowitzki stays with him. John Rozier attempts a Dunk. Wide open! Jayson Nowitzki is 7.0 feet away. [ZONE] JOHN ROZIER MAKES IT!
Score: 42-34

[06:09] Team_013 possession (Score: 42-34)
Jayson Nowitzki throws a bad pass! Stolen by John Rozier! TURNOVER! (live ball)

[05:59] Team_100 possession (Score: 42-34)
John Rozier drives, Dirk Booker stays with him. John Rozier attempts a Layup. Contested by Dirk Booker (5.8 feet, MAN). JOHN ROZIER MAKES IT! Assist: Carmelo Ginobili
Score: 44-34

[05:45] Team_013 possession (Score: 44-34)
FOUL! Reach-in foul on Carmelo Ginobili during the drive. [IN THE BONUS! 8 team fouls] Dirk Booker to the line for 2 free throws. (Carmelo Ginobili: 1 personal fouls)   FT 1/2: GOOD   FT 2/2: MISS Dirk Booker makes 1/2 from the line. Offensive rebound by Dirk Booker! Dirk Booker kicks it out.
Score: 44-35

[05:31] Team_013 possession (Score: 44-35)
Vince Nowitzki attempts a 3Pt. Contested by Tyrese Wade (4.2 feet, ZONE). Vince Nowitzki misses. Rebound secured by Carmelo Ginobili.

[05:17] Team_100 possession (Score: 44-35)
Evan Butler attempts a Layup. Wide open! Jayson Nowitzki is 6.5 feet away. [ZONE] EVAN BUTLER MAKES IT!
Score: 46-35

[05:00] Team_013 possession (Score: 46-35)
FOUL! Reach-in foul on Dirk Sabonis during the drive. [IN THE BONUS! 9 team fouls] Gary Iverson to the line for 2 free throws. (Dirk Sabonis: 1 personal fouls)   FT 1/2: GOOD   FT 2/2: GOOD Gary Iverson makes 2/2 from the line.
Score: 46-37

[04:48] Team_100 possession (Score: 46-37)
Dirk Sabonis attempts a 3Pt. Contested by Gary Iverson (5.0 feet, MAN). Dirk Sabonis misses. Offensive rebound by Carmelo Ginobili! Carmelo Ginobili kicks it out.

[04:32] Team_100 possession (Score: 46-37)
Evan Butler attempts a 3Pt. Contested by Chris Bryant (4.5 feet, MAN). Evan Butler misses. Rebound secured by Dirk Booker.

[04:16] Team_013 possession (Score: 46-37)
FOUL! Offensive foul on Vince Nowitzki! Tyrese Wade drew the charge! [Team fouls: 2] (Vince Nowitzki: 1 personal fouls) TURNOVER! (dead ball)

[03:58] Team_100 possession (Score: 46-37)
Carmelo Ginobili attempts a 3Pt. Contested by Chris Bryant (4.3 feet, ZONE). Carmelo Ginobili misses. FOUL! Loose ball foul on Dirk Booker during the rebound battle. [Team fouls: 3] No free throws, side out. (Dirk Booker: 1 personal fouls)

[03:46] Team_100 possession (Score: 46-37)
Dirk Sabonis attempts a Midrange. Contested by Gary Iverson (5.0 feet, MAN). Dirk Sabonis misses. Rebound secured by Dirk Booker.

[03:36] Team_013 possession (Score: 46-37)
Vince Nowitzki attempts a 3Pt. Contested by Tyrese Wade (4.2 feet, ZONE). VINCE NOWITZKI MAKES IT! Assist: Gary Iverson
Score: 46-40

[03:27] Team_100 possession (Score: 46-40)
Evan Butler attempts a 3Pt. Contested by Chris Bryant (4.5 feet, MAN). EVAN BUTLER MAKES IT! Assist: Carmelo Ginobili
Score: 49-40

[03:11] Team_013 possession (Score: 49-40)
Vince Nowitzki attempts a 3Pt. Contested by Tyrese Wade (4.2 feet, ZONE). Vince Nowitzki misses. Rebound secured by Carmelo Ginobili.

[02:59] Team_100 possession (Score: 49-40)
Tyrese Wade drives, picks up Vince Nowitzki. Help arrives from Gary Iverson! Tyrese Wade attempts a Dunk. Contested by Gary Iverson (5.6 feet, MAN). Tyrese Wade misses. Rebound secured by Dirk Booker.

[02:42] Team_013 possession (Score: 49-40)
Dirk Booker attempts a Midrange. Contested by Tyrese Wade (4.8 feet, ZONE). Dirk Booker misses. FOUL! Loose ball foul on John Rozier during the rebound battle. [IN THE BONUS! 10 team fouls] Dirk Booker to the line for 2 free throws. (John Rozier: 1 personal fouls)   FT 1/2: GOOD   FT 2/2: GOOD Dirk Booker makes 2/2 from the line.
Score: 49-42

[02:30] Team_100 possession (Score: 49-42)
John Rozier attempts a Midrange. Contested by Dirk Booker (5.8 feet, MAN). JOHN ROZIER MAKES IT!
Score: 51-42

[02:16] Team_013 possession (Score: 51-42)
Vince Nowitzki attempts a 3Pt. Contested by Tyrese Wade (4.3 feet, ZONE). Vince Nowitzki misses. Rebound secured by Carmelo Ginobili.

[02:05] Team_100 possession (Score: 51-42)
Tyrese Wade attempts a 3Pt. Contested by Vince Nowitzki (5.7 feet, MAN). Tyrese Wade misses. Rebound secured by Jayson Nowitzki.

[01:52] Team_013 possession (Score: 51-42)
Vince Nowitzki attempts a Midrange. Contested by Tyrese Wade (4.4 feet, MAN). Vince Nowitzki misses. Rebound secured by Tyrese Wade.

[01:38] Team_100 possession (Score: 51-42)
Carmelo Ginobili attempts a Layup. Wide open! Jayson Nowitzki is 6.4 feet away. [ZONE] CARMELO GINOBILI MAKES IT! Assist: Tyrese Wade
Score: 53-42

[01:23] Team_013 possession (Score: 53-42)
FOUL! Holding foul on Evan Butler. [IN THE BONUS! 11 team fouls] Chris Bryant to the line for 2 free throws. (Evan Butler: 2 personal fouls)   FT 1/2: GOOD   FT 2/2: MISS Chris Bryant makes 1/2 from the line. Offensive rebound by Dirk Booker! Dirk Booker kicks it out.
Score: 53-43

[01:05] Team_013 possession (Score: 53-43)
Gary Iverson attempts a 3Pt. Contested by Tyrese Wade (4.5 feet, ZONE). Gary Iverson misses. Offensive rebound by Jayson Nowitzki! Jayson Nowitzki kicks it out.

[00:49] Team_013 possession (Score: 53-43)
Chris Bryant attempts a Midrange. Contested by Evan Butler (5.5 feet, MAN). Chris Bryant misses. FOUL! Loose ball foul on Tyrese Wade during the rebound battle. [IN THE BONUS! 12 team fouls] Jayson Nowitzki to the line for 2 free throws. (Tyrese Wade: 2 personal fouls)   FT 1/2: GOOD   FT 2/2: GOOD Jayson Nowitzki makes 2/2 from the line.
Score: 53-45

[00:34] Team_100 possession (Score: 53-45)
Evan Butler attempts a Midrange. Contested by Chris Bryant (4.6 feet, MAN). EVAN BUTLER MAKES IT!
Score: 55-45

[00:19] Team_013 possession (Score: 55-45)
FOUL! Reach-in foul on John Rozier during the drive. [IN THE BONUS! 13 team fouls] Gary Iverson to the line for 2 free throws. (John Rozier: 2 personal fouls)   FT 1/2: GOOD   FT 2/2: GOOD Gary Iverson makes 2/2 from the line.
Score: 55-47

[00:05] Team_100 possession (Score: 55-47)
Evan Butler attempts a Midrange. Contested by Chris Bryant (4.7 feet, MAN). Evan Butler misses. Rebound secured by Dirk Booker.

================================================================================
                              2ND QUARTER COMPLETE                              
================================================================================

2ND QUARTER SCORE: Team_100 34, Team_013 24

BOX SCORE:
================================================================================

Team_100
--------------------------------------------------------------------------------
Player                MIN  PTS  REB  AST  TO      FG   FG%      3P   3P%
--------------------------------------------------------------------------------
John Rozier             9   10    3    1   0   5/5   100.0     0/0   0.0
Evan Butler             9    7    0    0   0   3/5    60.0     0/0   0.0
Luka Green             15    6    0    1   0   2/3    66.7     0/0   0.0
Tyrese Wade             9    5    1    2   0   2/4    50.0     0/0   0.0
Manu Ball              15    2    0    0   0   1/1   100.0     0/0   0.0
Carmelo Ginobili        9    2    5    3   0   1/1   100.0     0/0   0.0
Dirk Sabonis            9    2    0    0   0   1/2    50.0     0/0   0.0
Chris Mobley           15    0    0    1   0   0/0     0.0     0/0   0.0
Tyler Griffin          15    0    1    1   0   0/0     0.0     0/0   0.0

TEAM: FG: 15/21 (71.4%), 3PT: 4/7 (57.1%), REB: 10 (3 off, 7 def), AST: 9, TO: 1
TEAM FOULS: 13 [Team_013 in BONUS]


Team_013
--------------------------------------------------------------------------------
Player                MIN  PTS  REB  AST  TO      FG   FG%      3P   3P%
--------------------------------------------------------------------------------
Gary Iverson            9    6    0    1   0   3/4    75.0     0/0   0.0
Dirk Booker             9    4    6    0   0   2/2   100.0     0/0   0.0
Vince Nowitzki          9    3    0    1   0   1/5    20.0     0/0   0.0
Pau Mobley             15    2    0    0   0   1/1   100.0     0/0   0.0
Desmond Ginobili       15    2    0    0   0   1/1   100.0     0/0   0.0
Chris Bryant            9    2    0    0   0   1/2    50.0     0/0   0.0
Jayson Nowitzki         9    2    2    0   0   1/1   100.0     0/0   0.0
Nikola Curry           15    1    2    0   0   1/1   100.0     0/0   0.0
Jayson Morant          15    0    0    0   0   0/1     0.0     0/0   0.0

TEAM: FG: 11/18 (61.1%), 3PT: 3/7 (42.9%), REB: 10 (4 off, 6 def), AST: 2, TO: 3
TEAM FOULS: 3

================================================================================

================================================================================
                       3RD QUARTER - Team_100 vs Team_013                       
================================================================================

[12:00] Team_100 possession (Score: 55-47)
Pau LaVine attempts a Midrange. Contested by Pau Mobley (3.8 feet, ZONE). Pau LaVine misses. Rebound secured by Desmond Ginobili.

[11:43] Team_013 possession (Score: 55-47)
FOUL! Shooting foul on Luka Green. Desmond Ginobili to the line for 3 free throws. [Team fouls: 1] (Luka Green: 1 personal fouls)   FT 1/3: GOOD   FT 2/3: GOOD   FT 3/3: GOOD Desmond Ginobili makes 3/3 from the line.
Score: 55-50

[11:30] Team_100 possession (Score: 55-50)
Chris Mobley throws a bad pass out of bounds! TURNOVER! (dead ball)

[11:12] Team_013 possession (Score: 55-50)
Desmond Ginobili attempts a Midrange. Contested by Pau LaVine (4.8 feet, ZONE). Desmond Ginobili misses. Offensive rebound by Desmond Ginobili! Desmond Ginobili kicks it out.

[10:59] Team_013 possession (Score: 55-50)
Nikola Curry attempts a 3Pt. Contested by Chris Mobley (5.7 feet, MAN). Nikola Curry misses. FOUL! Loose ball foul on Pau LaVine during the rebound battle. [Team fouls: 2] No free throws, side out. (Pau LaVine: 1 personal fouls)

[10:48] Team_013 possession (Score: 55-50)
Manu Smith attempts a Layup. Contested by Luka Green (5.9 feet, MAN). MANU SMITH MAKES IT!
Score: 55-52

[10:33] Team_100 possession (Score: 55-52)
Tyler Griffin attempts a 3Pt. Contested by Jayson Morant (4.2 feet, MAN). Tyler Griffin misses. FOUL! Loose ball foul on Pau Mobley during the rebound battle. [Team fouls: 1] No free throws, side out. (Pau Mobley: 1 personal fouls)

[10:19] Team_100 possession (Score: 55-52)
Pau LaVine attempts a Midrange. Contested by Desmond Ginobili (4.9 feet, MAN). Pau LaVine misses. FOUL! Loose ball foul on Desmond Ginobili during the rebound battle. [Team fouls: 2] No free throws, side out. (Desmond Ginobili: 1 personal fouls)

[10:02] Team_100 possession (Score: 55-52)
Manu Ball drives, picks up Pau Mobley. Help arrives from Jayson Morant! Manu Ball attempts a Dunk. Contested by Jayson Morant (3.7 feet, MAN). MANU BALL MAKES IT!
Score: 57-52

[09:49] Team_013 possession (Score: 57-52)
Manu Smith attempts a Layup. BLOCKED BY LUKA GREEN! Ball is loose! Rebound secured by Pau LaVine.

[09:30] Team_100 possession (Score: 57-52)
Chris Mobley makes the Dunk and draws the foul on Desmond Ginobili! And-1! Chris Mobley to the line for 1. [Team fouls: 3] (Desmond Ginobili: 2 personal fouls)   FT 1/1: GOOD Chris Mobley makes 1/1 from the line.
Score: 60-52

[09:11] Team_013 possession (Score: 60-52)
Jayson Morant drives and kicks out. Nikola Curry attempts a Midrange. Contested by Chris Mobley (5.2 feet, MAN). NIKOLA CURRY MAKES IT!
Score: 60-54

[09:00] Team_100 possession (Score: 60-54)
FOUL! Shooting foul on Jayson Morant. Tyler Griffin to the line for 2 free throws. [Team fouls: 4] (Jayson Morant: 1 personal fouls)   FT 1/2: GOOD   FT 2/2: GOOD Tyler Griffin makes 2/2 from the line.
Score: 62-54

[08:47] Team_013 possession (Score: 62-54)
Nikola Curry attempts a 3Pt. Contested by Luka Green (5.9 feet, ZONE). Nikola Curry misses. Rebound secured by Pau LaVine.

[08:31] Team_100 possession (Score: 62-54)
Pau LaVine attempts a Midrange. Contested by Desmond Ginobili (4.9 feet, MAN). Pau LaVine misses. Rebound secured by Nikola Curry.

[08:16] Team_013 possession (Score: 62-54)
Pau Mobley attempts a 3Pt. Wide open! Manu Ball is 6.0 feet away. [MAN] Pau Mobley misses. Rebound secured by Tyler Griffin.

[08:06] Team_100 possession (Score: 62-54)
Pau LaVine drives to the basket... Pau LaVine throws a bad pass! Stolen by Nikola Curry! TURNOVER! (live ball)

[07:47] Team_013 possession (Score: 62-54)
Manu Smith attempts a 3Pt. Contested by Luka Green (5.9 feet, ZONE). Manu Smith misses. Offensive rebound by Nikola Curry! Nikola Curry kicks it out.

[07:33] Team_013 possession (Score: 62-54)
Nikola Curry drives and kicks out. Pau Mobley attempts a 3Pt. Contested by Luka Green (5.4 feet, ZONE). Pau Mobley misses. Rebound secured by Pau LaVine.

[07:18] Team_100 possession (Score: 62-54)
Manu Ball drives and kicks out. Luka Green attempts a 3Pt. Contested by Pau Mobley (3.7 feet, ZONE). Luka Green misses. Offensive rebound by Chris Mobley! Chris Mobley kicks it out.

[07:06] Team_100 possession (Score: 62-54)
Tyler Griffin drives to the basket... Tyler Griffin throws a bad pass! Stolen by Jayson Morant! TURNOVER! (live ball)

[06:47] Team_013 possession (Score: 62-54)
Desmond Ginobili attempts a Layup. Contested by Pau LaVine (4.8 feet, ZONE). Desmond Ginobili misses. Rebound secured by Chris Mobley.

[06:30] Team_100 possession (Score: 62-54)
Chris Mobley loses the ball! Stripped by Nikola Curry! TURNOVER! (live ball)

[06:15] Team_013 possession (Score: 62-54)
Jayson Morant attempts a Midrange. Contested by Tyler Griffin (5.1 feet, MAN). Jayson Morant misses. Rebound secured by Chris Mobley.

[06:04] Team_100 possession (Score: 62-54)
Tyler Griffin drives to the basket... Tyler Griffin loses the ball! Stripped by Jayson Morant! TURNOVER! (live ball)

[05:45] Team_013 possession (Score: 62-54)
Nikola Curry attempts a Midrange. Contested by Chris Mobley (5.7 feet, MAN). NIKOLA CURRY MAKES IT! Assist: Manu Smith
Score: 62-56

[05:34] Team_100 possession (Score: 62-56)
Chris Mobley attempts a Layup. Contested by Desmond Ginobili (5.1 feet, ZONE). CHRIS MOBLEY MAKES IT!
Score: 64-56

[05:20] Team_013 possession (Score: 64-56)
Jayson Morant attempts a 3Pt. Contested by Tyler Griffin (5.1 feet, MAN). Jayson Morant misses. Rebound secured by Pau LaVine.

[05:02] Team_100 possession (Score: 64-56)
Manu Ball attempts a 3Pt. Contested by Pau Mobley (3.7 feet, MAN). Manu Ball misses. Rebound secured by Desmond Ginobili.

[04:43] Team_013 possession (Score: 64-56)
Nikola Curry attempts a Layup. Contested by Chris Mobley (5.8 feet, MAN). NIKOLA CURRY MAKES IT!
Score: 64-58

[04:24] Team_100 possession (Score: 64-58)
Tyler Griffin attempts a 3Pt. Contested by Jayson Morant (4.3 feet, MAN). Tyler Griffin misses. Rebound secured by Desmond Ginobili.

[04:14] Team_013 possession (Score: 64-58)
Nikola Curry attempts a Midrange. Contested by Pau LaVine (5.1 feet, ZONE). NIKOLA CURRY MAKES IT!
Score: 64-60

[03:55] Team_100 possession (Score: 64-60)
Tyler Griffin attempts a 3Pt. Contested by Pau Mobley (4.0 feet, ZONE). TYLER GRIFFIN MAKES IT! Assist: Luka Green
Score: 67-60

[03:42] Team_013 possession (Score: 67-60)
Jayson Morant attempts a Layup. Contested by Pau LaVine (4.9 feet, ZONE). Jayson Morant misses. Rebound secured by Pau LaVine.

[03:28] Team_100 possession (Score: 67-60)
Chris Mobley makes the Layup and draws the foul on Desmond Ginobili! And-1! Chris Mobley to the line for 1. [BONUS: 5 team fouls] (Desmond Ginobili: 3 personal fouls)   FT 1/1: GOOD Chris Mobley makes 1/1 from the line.
Score: 70-60

[03:11] Team_013 possession (Score: 70-60)
FOUL! Holding foul on Luka Green. [Team fouls: 3] No free throws, side out. (Luka Green: 2 personal fouls)

[03:02] Team_013 possession (Score: 70-60)
Manu Smith attempts a 3Pt. Contested by Luka Green (5.9 feet, ZONE). Manu Smith misses. Rebound secured by Pau LaVine.

[02:51] Team_100 possession (Score: 70-60)
Pau LaVine attempts a Midrange. Contested by Desmond Ginobili (5.1 feet, MAN). Pau LaVine misses. Rebound secured by Nikola Curry.

[02:37] Team_013 possession (Score: 70-60)
Jayson Morant attempts a 3Pt. Contested by Luka Green (5.8 feet, ZONE). Jayson Morant misses. Rebound secured by Chris Mobley.

[02:22] Team_100 possession (Score: 70-60)
Chris Mobley attempts a Layup. Contested by Nikola Curry (5.4 feet, MAN). CHRIS MOBLEY MAKES IT! Assist: Pau LaVine
Score: 72-60

[02:09] Team_013 possession (Score: 72-60)
Pau Mobley drives, Manu Ball stays with him. Pau Mobley attempts a Layup. Wide open! Manu Ball is 6.2 feet away. [MAN] PAU MOBLEY MAKES IT!
Score: 72-62

[01:52] Team_100 possession (Score: 72-62)
Tyler Griffin drives, Desmond Ginobili stays with him. Tyler Griffin attempts a Layup. Contested by Desmond Ginobili (5.3 feet, ZONE). TYLER GRIFFIN MAKES IT! Assist: Pau LaVine
Score: 74-62

[01:38] Team_013 possession (Score: 74-62)
Desmond Ginobili attempts a Midrange. Contested by Pau LaVine (5.1 feet, MAN). Desmond Ginobili misses. FOUL! Loose ball foul on Tyler Griffin during the rebound battle. [Team fouls: 4] No free throws, side out. (Tyler Griffin: 1 personal fouls)

[01:27] Team_013 possession (Score: 74-62)
Nikola Curry drives and kicks out. Desmond Ginobili attempts a 3Pt. Contested by Pau LaVine (4.9 feet, MAN). DESMOND GINOBILI MAKES IT! Assist: Manu Smith
Score: 74-65

[01:11] Team_100 possession (Score: 74-65)
Chris Mobley loses the ball! Stripped by Nikola Curry! TURNOVER! (live ball)

[01:00] Team_013 possession (Score: 74-65)
Pau Mobley attempts a 3Pt. Contested by Luka Green (5.6 feet, ZONE). PAU MOBLEY MAKES IT! Assist: Manu Smith
Score: 74-68

[00:46] Team_100 possession (Score: 74-68)
Pau LaVine makes the Dunk and draws the foul on Pau Mobley! And-1! Pau LaVine to the line for 1. [BONUS: 6 team fouls] (Pau Mobley: 2 personal fouls)   FT 1/1: GOOD Pau LaVine makes 1/1 from the line.
Score: 77-68

[00:27] Team_013 possession (Score: 77-68)
FOUL! Reach-in foul on Pau LaVine during the drive. [IN THE BONUS! 5 team fouls] Desmond Ginobili to the line for 2 free throws. (Pau LaVine: 2 personal fouls)   FT 1/2: MISS   FT 2/2: MISS Desmond Ginobili makes 0/2 from the line. FOUL! Loose ball foul on Tyler Griffin during the free throw rebound! [IN THE BONUS! 6 team fouls] Desmond Ginobili to the line for 2 free throws. (Tyler Griffin: 2 personal fouls)   FT 1/2: GOOD   FT 2/2: GOOD Desmond Ginobili makes 2/2 from the line.
Score: 77-70

[00:15] Team_100 possession (Score: 77-70)
Chris Mobley drives to the basket... Chris Mobley throws a bad pass! Stolen by Nikola Curry! TURNOVER! (live ball)

[00:04] Team_013 possession (Score: 77-70)
Desmond Ginobili drives, Pau LaVine stays with him. Desmond Ginobili attempts a Dunk. Contested by Pau LaVine (5.3 feet, ZONE). DESMOND GINOBILI MAKES IT! Assist: Jayson Morant
Score: 77-72

================================================================================
                              3RD QUARTER COMPLETE                              
================================================================================

3RD QUARTER SCORE: Team_100 22, Team_013 25

BOX SCORE:
================================================================================

Team_100
--------------------------------------------------------------------------------
Player                MIN  PTS  REB  AST  TO      FG   FG%      3P   3P%
--------------------------------------------------------------------------------
Chris Mobley           27   10    6    0   0   4/4   100.0     0/0   0.0
Tyler Griffin          27    7    1    0   0   3/4    75.0     0/0   0.0
Pau LaVine             27    3    6    2   0   1/4    25.0     0/0   0.0
Manu Ball              27    2    0    0   0   1/2    50.0     0/0   0.0
Luka Green             27    0    0    1   0   0/0     0.0     0/0   0.0

TEAM: FG: 9/14 (64.3%), 3PT: 1/3 (33.3%), REB: 13 (3 off, 10 def), AST: 3, TO: 7
TEAM FOULS: 6 [Team_013 in BONUS]


Team_013
--------------------------------------------------------------------------------
Player                MIN  PTS  REB  AST  TO      FG   FG%      3P   3P%
--------------------------------------------------------------------------------
Desmond Ginobili       27   10    4    0   0   4/5    80.0     0/0   0.0
Nikola Curry           27    8    5    0   0   4/6    66.7     0/0   0.0
Pau Mobley             27    5    0    0   0   2/3    66.7     0/0   0.0
Manu Smith             27    2    0    3   0   1/3    33.3     0/0   0.0
Jayson Morant          27    0    0    1   0   0/4     0.0     0/0   0.0

TEAM: FG: 11/21 (52.4%), 3PT: 2/7 (28.6%), REB: 9 (4 off, 5 def), AST: 4, TO: 0
TEAM FOULS: 6 [Team_100 in BONUS]

================================================================================

================================================================================
                       4TH QUARTER - Team_100 vs Team_013                       
================================================================================

[12:00] Team_100 possession (Score: 77-72)
Manu Ball attempts a 3Pt. Contested by Pau Mobley (4.0 feet, ZONE). Manu Ball misses. Offensive rebound by Pau LaVine! Pau LaVine kicks it out.

[11:45] Team_100 possession (Score: 77-72)
Pau LaVine attempts a Layup. Contested by Desmond Ginobili (5.2 feet, ZONE). Pau LaVine misses. Rebound secured by Pau Mobley.

[11:28] Team_013 possession (Score: 77-72)
Manu Smith drives, Luka Green stays with him. Manu Smith attempts a Dunk. Wide open! Luka Green is 6.0 feet away. [MAN] Manu Smith misses. Rebound secured by Tyler Griffin.

[11:14] Team_100 possession (Score: 77-72)
Luka Green attempts a 3Pt. Contested by Pau Mobley (4.3 feet, ZONE). Luka Green misses. Rebound secured by Pau Mobley.

[10:57] Team_013 possession (Score: 77-72)
Jayson Morant attempts a 3Pt. Contested by Luka Green (5.9 feet, ZONE). Jayson Morant misses. Rebound secured by Tyler Griffin.

[10:42] Team_100 possession (Score: 77-72)
Pau LaVine attempts a 3Pt. Contested by Desmond Ginobili (5.3 feet, MAN). PAU LAVINE MAKES IT! Assist: Tyler Griffin
Score: 80-72

[10:32] Team_013 possession (Score: 80-72)
Manu Smith attempts a 3Pt. Wide open! Luka Green is 6.1 feet away. [ZONE] Manu Smith misses. Offensive rebound by Desmond Ginobili! Desmond Ginobili kicks it out.

[10:16] Team_013 possession (Score: 80-72)
Pau Mobley throws a bad pass out of bounds! TURNOVER! (dead ball)

[10:16] Substitution (Team_100): Luka Green OUT → Dirk Sabonis IN (stamina_rule2)

[10:16] Substitution (Team_100): Manu Ball OUT → Evan Butler IN (stamina_rule2)

[10:16] Substitution (Team_100): Tyler Griffin OUT → Tyrese Wade IN (stamina_rule2)

[10:16] Substitution (Team_100): Pau LaVine OUT → Carmelo Ginobili IN (stamina_rule2)

[10:16] Substitution (Team_100): Chris Mobley OUT → John Rozier IN (stamina_rule2)

[10:16] Substitution (Team_013): Manu Smith OUT → Gary Iverson IN (stamina_rule2)

[10:16] Substitution (Team_013): Pau Mobley OUT → Chris Bryant IN (stamina_rule2)

[10:16] Substitution (Team_013): Jayson Morant OUT → Vince Nowitzki IN (stamina_rule2)

[10:16] Substitution (Team_013): Desmond Ginobili OUT → Dirk Booker IN (stamina_rule2)

[10:16] Substitution (Team_013): Nikola Curry OUT → Jayson Nowitzki IN (stamina_rule2)

[10:02] Team_100 possession (Score: 80-72)
Carmelo Ginobili attempts a Layup. Contested by Dirk Booker (5.1 feet, MAN). CARMELO GINOBILI MAKES IT! Assist: Evan Butler
Score: 82-72

[09:48] Team_013 possession (Score: 82-72)
Jayson Nowitzki attempts a Midrange. Contested by John Rozier (4.4 feet, MAN). JAYSON NOWITZKI MAKES IT! Assist: Dirk Booker
Score: 82-74

[09:32] Team_100 possession (Score: 82-74)
Carmelo Ginobili attempts a Layup. Contested by Dirk Booker (5.1 feet, MAN). CARMELO GINOBILI MAKES IT!
Score: 84-74

[09:18] Team_013 possession (Score: 84-74)
Dirk Booker attempts a Midrange. Contested by Carmelo Ginobili (5.5 feet, MAN). DIRK BOOKER MAKES IT! Assist: Vince Nowitzki
Score: 84-76

[09:04] Team_100 possession (Score: 84-76)
Dirk Sabonis attempts a 3Pt. Contested by Chris Bryant (4.9 feet, ZONE). DIRK SABONIS MAKES IT! Assist: Carmelo Ginobili
Score: 87-76

[08:48] Team_013 possession (Score: 87-76)
FOUL! Shooting foul on Dirk Sabonis. Chris Bryant to the line for 2 free throws. [Team fouls: 1] (Dirk Sabonis: 1 personal fouls)   FT 1/2: MISS   FT 2/2: GOOD Chris Bryant makes 1/2 from the line.
Score: 87-77

[08:31] Team_100 possession (Score: 87-77)
Evan Butler attempts a 3Pt. Contested by Chris Bryant (4.5 feet, ZONE). EVAN BUTLER MAKES IT! Assist: John Rozier
Score: 90-77

[08:15] Team_013 possession (Score: 90-77)
FOUL! Shooting foul on Carmelo Ginobili. Dirk Booker to the line for 2 free throws. [Team fouls: 2] (Carmelo Ginobili: 1 personal fouls)   FT 1/2: MISS   FT 2/2: GOOD Dirk Booker makes 1/2 from the line.
Score: 90-78

[07:57] Team_100 possession (Score: 90-78)
John Rozier attempts a Midrange. Contested by Dirk Booker (5.8 feet, MAN). John Rozier misses. Offensive rebound by Carmelo Ginobili! Carmelo Ginobili kicks it out.

[07:40] Team_100 possession (Score: 90-78)
Evan Butler drives and kicks out. Tyrese Wade attempts a Midrange. Wide open! Vince Nowitzki is 6.0 feet away. [ZONE] TYRESE WADE MAKES IT!
Score: 92-78

[07:28] Team_013 possession (Score: 92-78)
Gary Iverson attempts a 3Pt. Contested by Tyrese Wade (4.3 feet, ZONE). Gary Iverson misses. Rebound secured by Carmelo Ginobili.

[07:15] Team_100 possession (Score: 92-78)
Dirk Sabonis attempts a Layup. BLOCKED BY GARY IVERSON! Ball is loose! Rebound secured by Jayson Nowitzki.

[07:04] Team_013 possession (Score: 92-78)
Dirk Booker makes the Layup and draws the foul on Carmelo Ginobili! And-1! Dirk Booker to the line for 1. [Team fouls: 3] (Carmelo Ginobili: 2 personal fouls)   FT 1/1: GOOD Dirk Booker makes 1/1 from the line.
Score: 92-81

[06:53] Team_100 possession (Score: 92-81)
John Rozier drives to the basket... John Rozier throws a bad pass out of bounds! TURNOVER! (dead ball)

[06:37] Team_013 possession (Score: 92-81)
Jayson Nowitzki attempts a Midrange. Contested by John Rozier (4.4 feet, MAN). JAYSON NOWITZKI MAKES IT!
Score: 92-83

[06:26] Team_100 possession (Score: 92-83)
John Rozier drives to the basket... John Rozier throws a bad pass! Stolen by Dirk Booker! TURNOVER! (live ball)

[06:11] Team_013 possession (Score: 92-83)
Chris Bryant attempts a 3Pt. Contested by Evan Butler (5.3 feet, MAN). Chris Bryant misses. Rebound secured by John Rozier.

[05:58] Team_100 possession (Score: 92-83)
Carmelo Ginobili attempts a 3Pt. Contested by Dirk Booker (5.1 feet, MAN). Carmelo Ginobili misses. Rebound secured by Chris Bryant.

[05:41] Team_013 possession (Score: 92-83)
Dirk Booker drives, Carmelo Ginobili stays with him. Dirk Booker attempts a Layup. Contested by Carmelo Ginobili (5.5 feet, MAN). Dirk Booker misses. Offensive rebound by Jayson Nowitzki! Jayson Nowitzki kicks it out.

[05:28] Team_013 possession (Score: 92-83)
Dirk Booker attempts a Midrange. BLOCKED BY EVAN BUTLER! Ball goes out off Evan Butler. Dirk Booker's ball!

[05:13] Team_013 possession (Score: 92-83)
Jayson Nowitzki attempts a 3Pt. Contested by Tyrese Wade (4.4 feet, ZONE). JAYSON NOWITZKI MAKES IT! Assist: Chris Bryant
Score: 92-86

[04:59] Team_100 possession (Score: 92-86)
John Rozier drives, Jayson Nowitzki stays with him. John Rozier attempts a Layup. Wide open! Jayson Nowitzki is 7.0 feet away. [ZONE] John Rozier misses. Rebound secured by Chris Bryant.

[04:43] Team_013 possession (Score: 92-86)
Gary Iverson loses control! Ball rolls out of bounds! TURNOVER! (dead ball)

[04:30] Team_100 possession (Score: 92-86)
Carmelo Ginobili attempts a Midrange. Contested by Dirk Booker (5.1 feet, MAN). CARMELO GINOBILI MAKES IT!
Score: 94-86

[04:13] Team_013 possession (Score: 94-86)
Jayson Nowitzki attempts a Midrange. BLOCKED BY JOHN ROZIER! Ball deflects out of bounds off Jayson Nowitzki.

[03:53] Team_100 possession (Score: 94-86)
Tyrese Wade attempts a 3Pt. Contested by Chris Bryant (4.2 feet, ZONE). TYRESE WADE MAKES IT! Assist: Evan Butler
Score: 97-86

[03:38] Team_013 possession (Score: 97-86)
Chris Bryant attempts a Midrange. Contested by Evan Butler (5.3 feet, MAN). CHRIS BRYANT MAKES IT! Assist: Vince Nowitzki
Score: 97-88

[03:27] Team_100 possession (Score: 97-88)
Tyrese Wade drives and kicks out. FOUL! Shooting foul on Dirk Booker. John Rozier to the line for 3 free throws. [Team fouls: 1] (Dirk Booker: 1 personal fouls)   FT 1/3: GOOD   FT 2/3: GOOD   FT 3/3: MISS John Rozier makes 2/3 from the line. Rebound secured by Chris Bryant.
Score: 99-88

[03:13] Team_013 possession (Score: 99-88)
Gary Iverson attempts a 3Pt. Contested by Tyrese Wade (4.4 feet, ZONE). Gary Iverson misses. FOUL! Loose ball foul on Carmelo Ginobili during the rebound battle. [Team fouls: 4] No free throws, side out. (Carmelo Ginobili: 3 personal fouls)

[02:58] Team_013 possession (Score: 99-88)
Gary Iverson attempts a 3Pt. Contested by Tyrese Wade (4.4 feet, ZONE). Gary Iverson misses. Rebound secured by John Rozier.

[02:44] Team_100 possession (Score: 99-88)
John Rozier drives, Dirk Booker stays with him. John Rozier attempts a Dunk. Contested by Dirk Booker (5.8 feet, MAN). JOHN ROZIER MAKES IT!
Score: 101-88

[02:31] Team_013 possession (Score: 101-88)
Gary Iverson attempts a 3Pt. Contested by Tyrese Wade (4.4 feet, ZONE). Gary Iverson misses. Offensive rebound by Dirk Booker! Dirk Booker kicks it out.

[02:15] Team_013 possession (Score: 101-88)
Dirk Booker attempts a Layup. Contested by Carmelo Ginobili (5.6 feet, MAN). DIRK BOOKER MAKES IT!
Score: 101-90

[02:02] Team_100 possession (Score: 101-90)
Dirk Sabonis attempts a Layup. Wide open! Jayson Nowitzki is 7.0 feet away. [ZONE] DIRK SABONIS MAKES IT! Assist: Evan Butler
Score: 103-90

[01:44] Team_013 possession (Score: 103-90)
FOUL! Shooting foul on John Rozier. Jayson Nowitzki to the line for 2 free throws. [BONUS: 5 team fouls] (John Rozier: 1 personal fouls)   FT 1/2: GOOD   FT 2/2: MISS Jayson Nowitzki makes 1/2 from the line. Rebound secured by Carmelo Ginobili.
Score: 103-91

[01:30] Team_100 possession (Score: 103-91)
John Rozier attempts a 3Pt. Contested by Chris Bryant (5.1 feet, ZONE). JOHN ROZIER MAKES IT! Assist: Evan Butler
Score: 106-91

[01:12] Team_013 possession (Score: 106-91)
Dirk Booker attempts a 3Pt. Contested by Carmelo Ginobili (5.7 feet, MAN). Dirk Booker misses. Rebound secured by Carmelo Ginobili.

[01:01] Team_100 possession (Score: 106-91)
Carmelo Ginobili drives, picks up Dirk Booker. Help arrives from Gary Iverson! Carmelo Ginobili attempts a Dunk. Contested by Gary Iverson (5.3 feet, MAN). Carmelo Ginobili misses. Offensive rebound by John Rozier! John Rozier puts it back in!
Score: 108-91

[00:47] Team_013 possession (Score: 108-91)
Dirk Booker attempts a Layup. Contested by Carmelo Ginobili (5.7 feet, MAN). DIRK BOOKER MAKES IT! Assist: Chris Bryant
Score: 108-93

[00:35] Team_100 possession (Score: 108-93)
Carmelo Ginobili drives to the basket... Carmelo Ginobili throws a bad pass out of bounds! TURNOVER! (dead ball)

[00:18] Team_013 possession (Score: 108-93)
Chris Bryant attempts a Midrange. Contested by Carmelo Ginobili (5.8 feet, ZONE). Chris Bryant misses. Rebound secured by Tyrese Wade.

[00:02] Team_100 possession (Score: 108-93)
Dirk Sabonis drives to the basket... Dirk Sabonis loses the ball! Stripped by Gary Iverson! TURNOVER! (live ball)

================================================================================
                              4TH QUARTER COMPLETE                              
================================================================================

4TH QUARTER SCORE: Team_100 31, Team_013 21

BOX SCORE:
================================================================================

Team_100
--------------------------------------------------------------------------------
Player                MIN  PTS  REB  AST  TO      FG   FG%      3P   3P%
--------------------------------------------------------------------------------
John Rozier            19    7    3    1   0   3/4    75.0     0/0   0.0
Carmelo Ginobili       19    6    4    1   0   3/4    75.0     0/0   0.0
Dirk Sabonis           19    5    0    0   0   2/3    66.7     0/0   0.0
Tyrese Wade            19    5    1    0   0   2/3    66.7     0/0   0.0
Pau LaVine             29    3    1    0   0   1/2    50.0     0/0   0.0
Evan Butler            19    3    0    4   0   1/1   100.0     0/0   0.0
Tyler Griffin          29    0    2    1   0   0/0     0.0     0/0   0.0
Luka Green             29    0    0    0   0   0/1     0.0     0/0   0.0

TEAM: FG: 12/18 (66.7%), 3PT: 5/7 (71.4%), REB: 11 (3 off, 8 def), AST: 7, TO: 4
TEAM FOULS: 5 [Team_013 in BONUS]


Team_013
--------------------------------------------------------------------------------
Player                MIN  PTS  REB  AST  TO      FG   FG%      3P   3P%
--------------------------------------------------------------------------------
Dirk Booker            19   10    1    1   0   5/6    83.3     0/0   0.0
Jayson Nowitzki        19    7    3    0   0   3/5    60.0     0/0   0.0
Chris Bryant           19    3    3    2   0   2/4    50.0     0/0   0.0
Pau Mobley             29    0    2    0   0   0/0     0.0     0/0   0.0
Manu Smith             29    0    0    0   0   0/1     0.0     0/0   0.0
Jayson Morant          29    0    0    0   0   0/1     0.0     0/0   0.0
Desmond Ginobili       29    0    1    0   0   0/0     0.0     0/0   0.0
Vince Nowitzki         19    0    0    2   0   0/0     0.0     0/0   0.0
Gary Iverson           19    0    0    0   0   0/2     0.0     0/0   0.0

TEAM: FG: 10/19 (52.6%), 3PT: 1/6 (16.7%), REB: 10 (4 off, 6 def), AST: 5, TO: 2
TEAM FOULS: 1

================================================================================

================================================================================
                               FULL GAME COMPLETE                               
================================================================================

FINAL SCORE: Team_100 108, Team_013 93

SCORING BY QUARTER:
--------------------------------------------------------------------------------
Team                     Q1     Q2     Q3     Q4    FINAL
--------------------------------------------------------------------------------
Team_100                 21     34     22     31      108
Team_013                 23     24     25     21       93
--------------------------------------------------------------------------------

FULL GAME BOX SCORE:
================================================================================

Team_100
--------------------------------------------------------------------------------
Player                MIN  PTS  REB  AST  TO      FG   FG%      3P   3P%      FT STL BLK
--------------------------------------------------------------------------------
Luka Green             29    6    0    2   4   2/5    40.0   2/4    50.0   0/0     0   1
Manu Ball              29    9    0    0   3   5/6    83.3   0/1     0.0   3/4     0   0
Tyler Griffin          29   12    5    5   2   4/5    80.0   2/3    66.7   2/2     1   1
Pau LaVine             29   13   12    2   1   6/11   54.5   2/2   100.0   3/3     0   0
Chris Mobley           29   12   10    3   3   5/9    55.6   0/0     0.0   2/2     0   0
Dirk Sabonis           19    7    0    0   0   3/5    60.0   1/1   100.0   0/0     0   0
Evan Butler            19   10    0    4   0   5/7    71.4   2/3    66.7   0/0     0   1
Tyrese Wade            19   10    2    2   0   3/6    50.0   2/3    66.7   0/0     0   0
Carmelo Ginobili       19   10    9    4   3   7/8    87.5   0/1     0.0   0/0     0   0
John Rozier            19   17    6    3   1   6/7    85.7   1/1   100.0   2/3     1   2

TEAM: FG: 46/69 (66.7%), 3PT: 12/19 (63.2%), REB: 44 (12 off, 32 def), AST: 25, TO: 17


Team_013
--------------------------------------------------------------------------------
Player                MIN  PTS  REB  AST  TO      FG   FG%      3P   3P%      FT STL BLK
--------------------------------------------------------------------------------
Manu Smith             29    6    0    5   1   3/6    50.0   0/1     0.0   0/0     0   0
Pau Mobley             29   13    6    2   1   5/8    62.5   4/5    80.0   2/3     0   0
Jayson Morant          29    3    0    4   2   3/12   25.0   1/8    12.5   0/0     2   0
Desmond Ginobili       29   16    6    0   0   5/8    62.5   1/1   100.0   7/9     1   1
Nikola Curry           29   15    8    0   1   7/9    77.8   0/1     0.0   2/4     5   1
Gary Iverson           19    6    0    1   1   3/6    50.0   0/2     0.0   4/4     1   1
Chris Bryant           19    5    3    2   0   4/7    57.1   1/2    50.0   4/7     0   0
Vince Nowitzki         19    3    0    3   1   1/5    20.0   1/4    25.0   0/0     0   0
Dirk Booker            19   14    7    1   0   6/7    85.7   0/1     0.0   7/9     1   0
Jayson Nowitzki        19    9    5    0   1   4/6    66.7   1/1   100.0   3/4     0   0

TEAM: FG: 42/75 (56.0%), 3PT: 9/26 (34.6%), REB: 35 (12 off, 23 def), AST: 18, TO: 8

================================================================================
