================================================================================
                        FULL GAME - Team_016 vs Team_076                        
================================================================================

================================================================================
                       1ST QUARTER - Team_016 vs Team_076                       
================================================================================

[12:00] Team_016 possession (Score: 0-0)
Giannis Ginobili attempts a 3Pt. Contested by Paul Leonard (5.2 feet, ZONE). Giannis Ginobili misses. Rebound secured by D'Angelo Tatum.

[11:46] Team_076 possession (Score: 0-0)
Dejounte LaVine attempts a 3Pt. Contested by Collin Barnes (3.9 feet, ZONE). DEJOUNTE LAVINE MAKES IT! Assist: Tobias Mitchell
Score: 0-3

[11:28] Team_016 possession (Score: 0-3)
Collin Barnes loses control! Ball rolls out of bounds! TURNOVER! (dead ball)

[11:13] Team_076 possession (Score: 0-3)
Paul Leonard attempts a Layup. Contested by Vince Quickley (4.6 feet, MAN). PAUL LEONARD MAKES IT! Assist: Dejounte LaVine
Score: 0-5

[11:00] Team_016 possession (Score: 0-5)
Vince Quickley attempts a Midrange. Contested by Paul Leonard (4.6 feet, MAN). VINCE QUICKLEY MAKES IT!
Score: 2-5

[10:43] Team_076 possession (Score: 2-5)
FOUL! Offensive foul on D'Angelo Tatum! Vince Duncan drew the charge! [Team fouls: 1] (D'Angelo Tatum: 1 personal fouls) TURNOVER! (dead ball)

[10:31] Team_016 possession (Score: 2-5)
Ben Barrett makes the Layup and draws the foul on Cade Barnes! And-1! Ben Barrett to the line for 1. [Team fouls: 2] (Cade Barnes: 1 personal fouls)   FT 1/1: GOOD Ben Barrett makes 1/1 from the line.
Score: 5-5

[10:14] Team_076 possession (Score: 5-5)
Paul Leonard attempts a 3Pt. Contested by Collin Barnes (4.4 feet, ZONE). Paul Leonard misses. Rebound secured by Vince Quickley.

[10:02] Team_016 possession (Score: 5-5)
Vince Quickley drives, Paul Leonard stays with him. Vince Quickley attempts a Layup. Contested by Paul Leonard (4.6 feet, MAN). Vince Quickley misses. Rebound secured by D'Angelo Tatum.

[09:52] Team_076 possession (Score: 5-5)
Tobias Mitchell attempts a 3Pt. Contested by Collin Barnes (4.4 feet, ZONE). Tobias Mitchell misses. Rebound secured by Ben Barrett.

[09:34] Team_016 possession (Score: 5-5)
Collin Barnes attempts a 3Pt. Contested by Cade Barnes (3.5 feet, ZONE). Collin Barnes misses. Rebound secured by D'Angelo Tatum.

[09:22] Team_076 possession (Score: 5-5)
Dejounte LaVine attempts a 3Pt. Contested by Giannis Ginobili (5.6 feet, ZONE). Dejounte LaVine misses. Rebound secured by Vince Duncan.

[09:09] Team_016 possession (Score: 5-5)
Vince Duncan drives to the basket... Vince Duncan throws a bad pass out of bounds! TURNOVER! (dead ball)

[08:52] Team_076 possession (Score: 5-5)
Paul Leonard attempts a Midrange. Contested by Vince Duncan (3.5 feet, ZONE). Paul Leonard misses. Rebound secured by Vince Duncan.

[08:35] Team_016 possession (Score: 5-5)
Vince Duncan attempts a Midrange. Contested by D'Angelo Tatum (4.1 feet, MAN). VINCE DUNCAN MAKES IT! Assist: Giannis Ginobili
Score: 7-5

[08:24] Team_076 possession (Score: 7-5)
Dejounte LaVine attempts a Layup. Contested by Collin Barnes (3.9 feet, MAN). DEJOUNTE LAVINE MAKES IT!
Score: 7-7

[08:07] Team_016 possession (Score: 7-7)
Ben Barrett attempts a Midrange. Contested by Tobias Mitchell (4.6 feet, ZONE). Ben Barrett misses. Rebound secured by Cade Barnes.

[07:54] Team_076 possession (Score: 7-7)
Paul Leonard attempts a Layup. Contested by Vince Quickley (4.6 feet, MAN). PAUL LEONARD MAKES IT! Assist: Dejounte LaVine
Score: 7-9

[07:43] Team_016 possession (Score: 7-9)
FOUL! Shooting foul on Cade Barnes. Ben Barrett to the line for 3 free throws. [Team fouls: 3] (Cade Barnes: 2 personal fouls)   FT 1/3: GOOD   FT 2/3: GOOD   FT 3/3: GOOD Ben Barrett makes 3/3 from the line.
Score: 10-9

[07:31] Team_076 possession (Score: 10-9)
Cade Barnes makes the Layup and draws the foul on Ben Barrett! And-1! Cade Barnes to the line for 1. [Team fouls: 1] (Ben Barrett: 1 personal fouls)   FT 1/1: GOOD Cade Barnes makes 1/1 from the line.
Score: 10-12

[07:18] Team_016 possession (Score: 10-12)
FOUL! Holding foul on Cade Barnes. [Team fouls: 4] No free throws, side out. (Cade Barnes: 3 personal fouls)

[07:04] Team_016 possession (Score: 10-12)
Giannis Ginobili attempts a Midrange. Contested by Cade Barnes (3.6 feet, ZONE). GIANNIS GINOBILI MAKES IT!
Score: 12-12

[06:48] Team_076 possession (Score: 12-12)
Paul Leonard attempts a Midrange. Contested by Vince Quickley (4.6 feet, ZONE). Paul Leonard misses. Offensive rebound by Cade Barnes! Cade Barnes kicks it out.

[06:29] Team_076 possession (Score: 12-12)
Paul Leonard attempts a 3Pt. Contested by Collin Barnes (4.4 feet, ZONE). Paul Leonard misses. Rebound secured by Vince Duncan.

[06:13] Team_016 possession (Score: 12-12)
Vince Quickley attempts a 3Pt. Contested by Cade Barnes (3.0 feet, ZONE). Vince Quickley misses. Offensive rebound by Vince Duncan! Vince Duncan's putback is no good. Rebound secured by Cade Barnes.

[06:02] Team_076 possession (Score: 12-12)
Dejounte LaVine makes the Layup and draws the foul on Collin Barnes! And-1! Dejounte LaVine to the line for 1. [Team fouls: 2] (Collin Barnes: 1 personal fouls)   FT 1/1: GOOD Dejounte LaVine makes 1/1 from the line.
Score: 12-15

[05:50] Team_016 possession (Score: 12-15)
Collin Barnes drives and kicks out. Vince Quickley attempts a 3Pt. Contested by Paul Leonard (5.1 feet, MAN). VINCE QUICKLEY MAKES IT! Assist: Collin Barnes
Score: 15-15

[05:39] Team_076 possession (Score: 15-15)
Tobias Mitchell drives to the basket... Tobias Mitchell loses control! Ball rolls out of bounds! TURNOVER! (dead ball)

[05:24] Team_016 possession (Score: 15-15)
Ben Barrett attempts a Layup. Contested by Cade Barnes (4.1 feet, ZONE). BEN BARRETT MAKES IT! Assist: Vince Quickley
Score: 17-15

[05:09] Team_076 possession (Score: 17-15)
Cade Barnes attempts a 3Pt. Contested by Collin Barnes (4.3 feet, ZONE). Cade Barnes misses. FOUL! Loose ball foul on Ben Barrett during the rebound battle. [Team fouls: 3] No free throws, side out. (Ben Barrett: 2 personal fouls)

[04:55] Team_076 possession (Score: 17-15)
Dejounte LaVine attempts a 3Pt. Contested by Collin Barnes (4.0 feet, MAN). Dejounte LaVine misses. Offensive rebound by D'Angelo Tatum! D'Angelo Tatum kicks it out.

[04:36] Team_076 possession (Score: 17-15)
Dejounte LaVine attempts a 3Pt. Contested by Collin Barnes (4.0 feet, ZONE). Dejounte LaVine misses. Rebound secured by Vince Duncan.

[04:20] Team_016 possession (Score: 17-15)
Vince Duncan makes the Midrange and draws the foul on D'Angelo Tatum! And-1! Vince Duncan to the line for 1. [BONUS: 5 team fouls] (D'Angelo Tatum: 2 personal fouls)   FT 1/1: GOOD Vince Duncan makes 1/1 from the line.
Score: 20-15

[04:08] Team_076 possession (Score: 20-15)
Cade Barnes attempts a Midrange. Contested by Ben Barrett (3.9 feet, MAN). CADE BARNES MAKES IT!
Score: 20-17

[03:54] Team_016 possession (Score: 20-17)
Vince Quickley attempts a 3Pt. Contested by Paul Leonard (4.7 feet, MAN). Vince Quickley misses. Rebound secured by D'Angelo Tatum.

[03:43] Team_076 possession (Score: 20-17)
Cade Barnes attempts a 3Pt. Contested by Ben Barrett (4.0 feet, MAN). CADE BARNES MAKES IT!
Score: 20-20

[03:28] Team_016 possession (Score: 20-20)
Giannis Ginobili drives, picks up Tobias Mitchell. Help arrives from Dejounte LaVine! Giannis Ginobili attempts a Dunk. Contested by Dejounte LaVine (4.3 feet, MAN). GIANNIS GINOBILI MAKES IT!
Score: 22-20

[03:15] Team_076 possession (Score: 22-20)
Tobias Mitchell makes the Layup and draws the foul on Vince Duncan! And-1! Tobias Mitchell to the line for 1. [Team fouls: 4] (Vince Duncan: 1 personal fouls)   FT 1/1: GOOD Tobias Mitchell makes 1/1 from the line.
Score: 22-23

[02:56] Team_016 possession (Score: 22-23)
Collin Barnes attempts a 3Pt. Contested by Dejounte LaVine (5.0 feet, MAN). Collin Barnes misses. Offensive rebound by Vince Duncan! Vince Duncan kicks it out.

[02:45] Team_016 possession (Score: 22-23)
Collin Barnes attempts a 3Pt. Contested by Cade Barnes (3.8 feet, ZONE). Collin Barnes misses. Rebound secured by Tobias Mitchell.

[02:30] Team_076 possession (Score: 22-23)
Paul Leonard attempts a Midrange. Contested by Vince Quickley (4.7 feet, ZONE). Paul Leonard misses. Rebound secured by Vince Quickley.

[02:14] Team_016 possession (Score: 22-23)
Giannis Ginobili attempts a 3Pt. Contested by Cade Barnes (3.9 feet, ZONE). GIANNIS GINOBILI MAKES IT! Assist: Vince Quickley
Score: 25-23

[01:55] Team_076 possession (Score: 25-23)
Dejounte LaVine attempts a 3Pt. Contested by Ben Barrett (3.9 feet, ZONE). Dejounte LaVine misses. Rebound secured by Vince Quickley.

[01:39] Team_016 possession (Score: 25-23)
Vince Quickley attempts a Midrange. Contested by Paul Leonard (4.9 feet, MAN). VINCE QUICKLEY MAKES IT!
Score: 27-23

[01:25] Team_076 possession (Score: 27-23)
D'Angelo Tatum attempts a Midrange. Contested by Vince Duncan (3.8 feet, MAN). D'ANGELO TATUM MAKES IT! Assist: Paul Leonard
Score: 27-25

[01:10] Team_016 possession (Score: 27-25)
FOUL! Holding foul on Paul Leonard. [IN THE BONUS! 6 team fouls] Vince Quickley to the line for 2 free throws. (Paul Leonard: 1 personal fouls)   FT 1/2: GOOD   FT 2/2: MISS Vince Quickley makes 1/2 from the line. Rebound secured by Tobias Mitchell.
Score: 28-25

[00:57] Team_076 possession (Score: 28-25)
Tobias Mitchell drives, Vince Duncan stays with him. Tobias Mitchell attempts a Dunk. Contested by Vince Duncan (4.0 feet, ZONE). Tobias Mitchell misses. Rebound secured by Vince Quickley.

[00:43] Team_016 possession (Score: 28-25)
Ben Barrett attempts a Midrange. Contested by Cade Barnes (4.5 feet, ZONE). Ben Barrett misses. Rebound secured by D'Angelo Tatum.

[00:30] Team_076 possession (Score: 28-25)
Cade Barnes attempts a 3Pt. Contested by Ben Barrett (4.3 feet, MAN). Cade Barnes misses. Rebound secured by Ben Barrett.

[00:16] Team_016 possession (Score: 28-25)
Vince Duncan drives, picks up Cade Barnes. Help arrives from Tobias Mitchell! Vince Duncan attempts a Dunk. Contested by Tobias Mitchell (4.4 feet, ZONE). VINCE DUNCAN MAKES IT!
Score: 30-25

[00:04] Team_076 possession (Score: 30-25)
FOUL! Holding foul on Ben Barrett. [IN THE BONUS! 5 team fouls] Cade Barnes to the line for 2 free throws. (Ben Barrett: 3 personal fouls)   FT 1/2: GOOD   FT 2/2: MISS Cade Barnes makes 1/2 from the line. Offensive rebound by Cade Barnes! Cade Barnes kicks it out.
Score: 30-26

================================================================================
                              1ST QUARTER COMPLETE                              
================================================================================

1ST QUARTER SCORE: Team_016 30, Team_076 26

BOX SCORE:
================================================================================

Team_016
--------------------------------------------------------------------------------
Player                MIN  PTS  REB  AST  TO      FG   FG%      3P   3P%
--------------------------------------------------------------------------------
Ben Barrett            12    8    2    0   0   3/5    60.0     0/0   0.0
Giannis Ginobili       12    7    0    1   0   3/4    75.0     0/0   0.0
Vince Quickley         12    7    4    2   0   3/6    50.0     0/0   0.0
Vince Duncan           12    7    5    0   0   3/3   100.0     0/0   0.0
Collin Barnes          12    0    0    1   0   0/2     0.0     0/0   0.0

TEAM: FG: 12/21 (57.1%), 3PT: 2/7 (28.6%), REB: 12 (2 off, 10 def), AST: 4, TO: 2
TEAM FOULS: 5 [Team_076 in BONUS]


Team_076
--------------------------------------------------------------------------------
Player                MIN  PTS  REB  AST  TO      FG   FG%      3P   3P%
--------------------------------------------------------------------------------
Dejounte LaVine        12    8    0    2   0   3/6    50.0     0/0   0.0
Cade Barnes            12    8    5    0   0   3/4    75.0     0/0   0.0
Paul Leonard           12    4    0    1   0   2/6    33.3     0/0   0.0
Tobias Mitchell        12    3    2    1   0   1/3    33.3     0/0   0.0
D'Angelo Tatum         12    2    6    0   0   1/1   100.0     0/0   0.0

TEAM: FG: 10/20 (50.0%), 3PT: 2/9 (22.2%), REB: 12 (4 off, 8 def), AST: 4, TO: 2
TEAM FOULS: 6 [Team_016 in BONUS]

================================================================================

================================================================================
                       2ND QUARTER - Team_016 vs Team_076                       
================================================================================

[12:00] Substitution (Team_016): Collin Barnes OUT → Lamelo Herro IN (stamina_rule2)

[12:00] Substitution (Team_016): Ben Barrett OUT → Giannis Doncic IN (stamina_rule2)

[12:00] Substitution (Team_016): Vince Duncan OUT → Trae Barnes IN (stamina_rule2)

[12:00] Substitution (Team_076): Dejounte LaVine OUT → Pascal Lowry IN (stamina_rule2)

[12:00] Substitution (Team_076): Tobias Mitchell OUT → Jalen Poole IN (stamina_rule2)

[12:00] Substitution (Team_076): Paul Leonard OUT → Vince Lowry IN (stamina_rule2)

[12:00] Substitution (Team_076): Cade Barnes OUT → Kevin Nowitzki IN (stamina_rule2)

[12:00] Substitution (Team_076): D'Angelo Tatum OUT → Jordan Doncic IN (stamina_rule2)

[12:00] Team_016 possession (Score: 30-26)
Ben Barrett throws a bad pass out of bounds! TURNOVER! (dead ball)

[11:45] Team_076 possession (Score: 30-26)
Pascal Lowry drives to the basket... Pascal Lowry loses the ball! Stripped by Giannis Doncic! TURNOVER! (live ball)

[11:35] Team_016 possession (Score: 30-26)
Lamelo Herro attempts a 3Pt. Wide open! Pascal Lowry is 6.2 feet away. [MAN] Lamelo Herro misses. Rebound secured by Kevin Nowitzki.

[11:19] Team_076 possession (Score: 30-26)
Kevin Nowitzki attempts a Midrange. Contested by Giannis Doncic (4.0 feet, MAN). Kevin Nowitzki misses. FOUL! Loose ball foul on Vince Quickley during the rebound battle. [Team fouls: 1] No free throws, side out. (Vince Quickley: 1 personal fouls)

[11:05] Team_076 possession (Score: 30-26)
Kevin Nowitzki attempts a Midrange. Wide open! Giannis Ginobili is 6.1 feet away. [ZONE] KEVIN NOWITZKI MAKES IT! Assist: Vince Lowry
Score: 30-28

[10:50] Team_016 possession (Score: 30-28)
Trae Barnes attempts a Midrange. Contested by Jordan Doncic (3.1 feet, MAN). TRAE BARNES MAKES IT! Assist: Lamelo Herro
Score: 32-28

[10:32] Team_076 possession (Score: 32-28)
Vince Lowry drives, picks up Vince Quickley. Help arrives from Lamelo Herro! Vince Lowry attempts a Dunk. Contested by Lamelo Herro (4.5 feet, MAN). Vince Lowry misses. Rebound secured by Vince Quickley.

[10:17] Team_016 possession (Score: 32-28)
Giannis Doncic attempts a Midrange. Contested by Kevin Nowitzki (4.2 feet, MAN). Giannis Doncic misses. Rebound secured by Kevin Nowitzki.

[10:00] Team_076 possession (Score: 32-28)
Kevin Nowitzki attempts a Midrange. Contested by Giannis Doncic (4.0 feet, MAN). KEVIN NOWITZKI MAKES IT! Assist: Jordan Doncic
Score: 32-30

[09:48] Team_016 possession (Score: 32-30)
Lamelo Herro attempts a Layup. Wide open! Pascal Lowry is 6.2 feet away. [MAN] LAMELO HERRO MAKES IT!
Score: 34-30

[09:29] Team_076 possession (Score: 34-30)
Pascal Lowry attempts a Layup. Contested by Lamelo Herro (3.4 feet, MAN). PASCAL LOWRY MAKES IT!
Score: 34-32

[09:15] Team_016 possession (Score: 34-32)
Lamelo Herro drives and kicks out. Giannis Doncic attempts a Midrange. Contested by Kevin Nowitzki (4.2 feet, MAN). Giannis Doncic misses. FOUL! Loose ball foul on Vince Lowry during the rebound battle. [Team fouls: 1] No free throws, side out. (Vince Lowry: 1 personal fouls)

[08:57] Team_016 possession (Score: 34-32)
Trae Barnes attempts a Layup. Contested by Jordan Doncic (3.1 feet, MAN). Trae Barnes misses. Rebound secured by Jordan Doncic.

[08:40] Team_076 possession (Score: 34-32)
Jordan Doncic attempts a 3Pt. Contested by Trae Barnes (5.1 feet, MAN). Jordan Doncic misses. Rebound secured by Lamelo Herro.

[08:26] Team_016 possession (Score: 34-32)
FOUL! Reach-in foul on Vince Lowry during the drive. [Team fouls: 2] No free throws, side out. (Vince Lowry: 2 personal fouls)

[08:13] Team_016 possession (Score: 34-32)
Giannis Ginobili drives and kicks out. FOUL! Shooting foul on Kevin Nowitzki. Giannis Doncic to the line for 2 free throws. [Team fouls: 3] (Kevin Nowitzki: 1 personal fouls)   FT 1/2: GOOD   FT 2/2: GOOD Giannis Doncic makes 2/2 from the line.
Score: 36-32

[07:58] Team_076 possession (Score: 36-32)
FOUL! Holding foul on Vince Quickley. [Team fouls: 2] No free throws, side out. (Vince Quickley: 2 personal fouls)

[07:44] Team_076 possession (Score: 36-32)
Jordan Doncic attempts a 3Pt. Contested by Lamelo Herro (3.2 feet, ZONE). Jordan Doncic misses. Rebound secured by Lamelo Herro.

[07:30] Team_016 possession (Score: 36-32)
Giannis Doncic makes the Layup and draws the foul on Jalen Poole! And-1! Giannis Doncic to the line for 1. [Team fouls: 4] (Jalen Poole: 1 personal fouls)   FT 1/1: GOOD Giannis Doncic makes 1/1 from the line.
Score: 39-32

[07:20] Team_076 possession (Score: 39-32)
Pascal Lowry attempts a Midrange. Contested by Lamelo Herro (3.4 feet, MAN). PASCAL LOWRY MAKES IT! Assist: Jalen Poole
Score: 39-34

[07:06] Team_016 possession (Score: 39-34)
Giannis Ginobili attempts a 3Pt. Contested by Jalen Poole (5.4 feet, MAN). Giannis Ginobili misses. Rebound secured by Jordan Doncic.

[06:54] Team_076 possession (Score: 39-34)
Pascal Lowry attempts a 3Pt. Contested by Lamelo Herro (3.4 feet, ZONE). PASCAL LOWRY MAKES IT!
Score: 39-37

[06:39] Team_016 possession (Score: 39-37)
Lamelo Herro attempts a Midrange. Contested by Kevin Nowitzki (4.2 feet, ZONE). LAMELO HERRO MAKES IT! Assist: Trae Barnes
Score: 41-37

[06:27] Team_076 possession (Score: 41-37)
Vince Lowry attempts a 3Pt. Contested by Lamelo Herro (3.7 feet, ZONE). Vince Lowry misses. Offensive rebound by Jordan Doncic! Jordan Doncic kicks it out.

[06:11] Team_076 possession (Score: 41-37)
Jordan Doncic attempts a Layup. BLOCKED BY TRAE BARNES! Ball is loose! Rebound secured by Giannis Doncic.

[05:56] Team_016 possession (Score: 41-37)
Giannis Ginobili drives, Jalen Poole stays with him. Giannis Ginobili attempts a Layup. Contested by Jalen Poole (5.4 feet, MAN). Giannis Ginobili misses. Rebound secured by Kevin Nowitzki.

[05:41] Team_076 possession (Score: 41-37)
Jalen Poole attempts a Midrange. Wide open! Giannis Ginobili is 6.8 feet away. [ZONE] Jalen Poole misses. Offensive rebound by Jordan Doncic! Jordan Doncic kicks it out.

[05:24] Team_076 possession (Score: 41-37)
Kevin Nowitzki throws a bad pass out of bounds! TURNOVER! (dead ball)

[05:24] Substitution (Team_016): Giannis Ginobili OUT → Immanuel Nowitzki IN (stamina_rule2)

[05:24] Substitution (Team_016): Vince Quickley OUT → Kevin Butler IN (stamina_rule2)

[05:08] Team_016 possession (Score: 41-37)
Giannis Doncic attempts a Midrange. Contested by Jalen Poole (5.4 feet, ZONE). Giannis Doncic misses. Offensive rebound by Giannis Doncic! Giannis Doncic kicks it out.

[04:58] Team_016 possession (Score: 41-37)
Trae Barnes makes the Layup and draws the foul on Jalen Poole! And-1! Trae Barnes to the line for 1. [BONUS: 5 team fouls] (Jalen Poole: 2 personal fouls)   FT 1/1: GOOD Trae Barnes makes 1/1 from the line.
Score: 44-37

[04:46] Team_076 possession (Score: 44-37)
Vince Lowry attempts a Layup. Contested by Kevin Butler (4.3 feet, MAN). Vince Lowry misses. Offensive rebound by Kevin Nowitzki! Kevin Nowitzki kicks it out.

[04:31] Team_076 possession (Score: 44-37)
Vince Lowry attempts a Layup. Contested by Kevin Butler (4.3 feet, MAN). Vince Lowry misses. Rebound secured by Lamelo Herro.

[04:17] Team_016 possession (Score: 44-37)
Trae Barnes attempts a Layup. BLOCKED BY JORDAN DONCIC! Ball is loose! Rebound secured by Jordan Doncic.

[04:01] Team_076 possession (Score: 44-37)
Jordan Doncic drives and kicks out. Jordan Doncic attempts a Midrange. Contested by Trae Barnes (5.8 feet, MAN). Jordan Doncic misses. Offensive rebound by Jordan Doncic! Jordan Doncic kicks it out.

[03:43] Team_076 possession (Score: 44-37)
Pascal Lowry drives, Lamelo Herro stays with him. Pascal Lowry attempts a Dunk. Contested by Lamelo Herro (3.5 feet, MAN). PASCAL LOWRY MAKES IT! Assist: Vince Lowry
Score: 44-39

[03:26] Team_016 possession (Score: 44-39)
Lamelo Herro attempts a 3Pt. Contested by Kevin Nowitzki (4.3 feet, ZONE). Lamelo Herro misses. Rebound secured by Jordan Doncic.

[03:13] Team_076 possession (Score: 44-39)
Vince Lowry drives to the basket... Vince Lowry throws a bad pass out of bounds! TURNOVER! (dead ball)

[03:01] Team_016 possession (Score: 44-39)
Immanuel Nowitzki attempts a Layup. Contested by Jordan Doncic (3.6 feet, ZONE). IMMANUEL NOWITZKI MAKES IT!
Score: 46-39

[02:43] Team_076 possession (Score: 46-39)
Pascal Lowry attempts a 3Pt. Contested by Lamelo Herro (3.6 feet, MAN). PASCAL LOWRY MAKES IT! Assist: Jordan Doncic
Score: 46-42

[02:27] Team_016 possession (Score: 46-42)
Giannis Doncic attempts a 3Pt. Contested by Kevin Nowitzki (4.4 feet, MAN). Giannis Doncic misses. Rebound secured by Vince Lowry.

[02:17] Team_076 possession (Score: 46-42)
Vince Lowry attempts a 3Pt. Contested by Immanuel Nowitzki (4.5 feet, ZONE). VINCE LOWRY MAKES IT! Assist: Jordan Doncic
Score: 46-45

[02:04] Team_016 possession (Score: 46-45)
Lamelo Herro attempts a 3Pt. Wide open! Pascal Lowry is 6.4 feet away. [MAN] LAMELO HERRO MAKES IT! Assist: Immanuel Nowitzki
Score: 49-45

[01:51] Team_076 possession (Score: 49-45)
Jordan Doncic makes the Layup and draws the foul on Trae Barnes! And-1! Jordan Doncic to the line for 1. [Team fouls: 3] (Trae Barnes: 1 personal fouls)   FT 1/1: GOOD Jordan Doncic makes 1/1 from the line.
Score: 49-48

[01:42] Team_016 possession (Score: 49-48)
Kevin Butler attempts a 3Pt. Contested by Vince Lowry (4.3 feet, ZONE). KEVIN BUTLER MAKES IT! Assist: Giannis Doncic
Score: 52-48

[01:26] Team_076 possession (Score: 52-48)
Pascal Lowry attempts a 3Pt. Contested by Kevin Butler (4.0 feet, ZONE). Pascal Lowry misses. Rebound secured by Giannis Doncic.

[01:11] Team_016 possession (Score: 52-48)
Trae Barnes makes the Dunk and draws the foul on Jordan Doncic! And-1! Trae Barnes to the line for 1. [BONUS: 6 team fouls] (Jordan Doncic: 1 personal fouls)   FT 1/1: MISS Trae Barnes makes 0/1 from the line. Rebound secured by Jordan Doncic.
Score: 54-48

[01:00] Team_076 possession (Score: 54-48)
Pascal Lowry makes the Dunk and draws the foul on Lamelo Herro! And-1! Pascal Lowry to the line for 1. [Team fouls: 4] (Lamelo Herro: 1 personal fouls)   FT 1/1: MISS Pascal Lowry makes 0/1 from the line. Offensive rebound by Kevin Nowitzki! Kevin Nowitzki kicks it out.
Score: 54-50

[00:48] Team_076 possession (Score: 54-50)
Pascal Lowry makes the Dunk and draws the foul on Lamelo Herro! And-1! Pascal Lowry to the line for 1. [BONUS: 5 team fouls] (Lamelo Herro: 2 personal fouls)   FT 1/1: GOOD Pascal Lowry makes 1/1 from the line.
Score: 54-53

[00:37] Team_016 possession (Score: 54-53)
Immanuel Nowitzki attempts a 3Pt. Contested by Vince Lowry (4.8 feet, ZONE). IMMANUEL NOWITZKI MAKES IT! Assist: Kevin Butler
Score: 57-53

[00:21] Team_076 possession (Score: 57-53)
Vince Lowry makes the 3Pt and draws the foul on Kevin Butler! And-1! Vince Lowry to the line for 1. [BONUS: 6 team fouls] (Kevin Butler: 1 personal fouls)   FT 1/1: GOOD Vince Lowry makes 1/1 from the line.
Score: 57-57

[00:03] Team_016 possession (Score: 57-57)
Trae Barnes drives and kicks out. Lamelo Herro attempts a Midrange. Wide open! Pascal Lowry is 6.7 feet away. [ZONE] Lamelo Herro misses. Rebound secured by Jordan Doncic.

================================================================================
                              2ND QUARTER COMPLETE                              
================================================================================

2ND QUARTER SCORE: Team_016 27, Team_076 31

BOX SCORE:
================================================================================

Team_016
--------------------------------------------------------------------------------
Player                MIN  PTS  REB  AST  TO      FG   FG%      3P   3P%
--------------------------------------------------------------------------------
Lamelo Herro           12    7    3    1   0   3/5    60.0     0/0   0.0
Trae Barnes            12    5    0    1   0   2/6    33.3     0/0   0.0
Giannis Doncic         12    5    4    1   0   2/4    50.0     0/0   0.0
Immanuel Nowitzki       5    5    0    1   0   2/2   100.0     0/0   0.0
Kevin Butler            5    3    0    1   0   1/1   100.0     0/0   0.0
Vince Quickley         19    0    1    0   0   0/0     0.0     0/0   0.0
Giannis Ginobili       19    0    0    0   0   0/2     0.0     0/0   0.0

TEAM: FG: 10/20 (50.0%), 3PT: 3/7 (42.9%), REB: 8 (2 off, 6 def), AST: 5, TO: 1
TEAM FOULS: 6 [Team_076 in BONUS]


Team_076
--------------------------------------------------------------------------------
Player                MIN  PTS  REB  AST  TO      FG   FG%      3P   3P%
--------------------------------------------------------------------------------
Pascal Lowry           12   15    0    0   0   6/7    85.7     0/0   0.0
Vince Lowry            12    7    1    2   0   2/4    50.0     0/0   0.0
Kevin Nowitzki         12    4    6    0   0   2/2   100.0     0/0   0.0
Jordan Doncic          12    3    9    3   0   1/4    25.0     0/0   0.0
Jalen Poole            12    0    0    1   0   0/0     0.0     0/0   0.0

TEAM: FG: 11/17 (64.7%), 3PT: 4/7 (57.1%), REB: 16 (6 off, 10 def), AST: 6, TO: 3
TEAM FOULS: 6 [Team_016 in BONUS]

================================================================================

================================================================================
                       3RD QUARTER - Team_016 vs Team_076                       
================================================================================

[12:00] Team_016 possession (Score: 57-57)
Vince Quickley drives to the basket... Vince Quickley throws a bad pass! Stolen by Paul Leonard! TURNOVER! (live ball)

[11:45] Team_076 possession (Score: 57-57)
Tobias Mitchell drives and kicks out. D'Angelo Tatum attempts a 3Pt. Contested by Collin Barnes (4.0 feet, ZONE). D'Angelo Tatum misses. Rebound secured by Vince Quickley.

[11:31] Team_016 possession (Score: 57-57)
Collin Barnes attempts a 3Pt. Contested by Dejounte LaVine (4.8 feet, MAN). Collin Barnes misses. Rebound secured by Cade Barnes.

[11:17] Team_076 possession (Score: 57-57)
FOUL! Reach-in foul on Vince Duncan during the drive. [Team fouls: 1] No free throws, side out. (Vince Duncan: 1 personal fouls)

[11:03] Team_076 possession (Score: 57-57)
Tobias Mitchell attempts a 3Pt. Contested by Collin Barnes (4.4 feet, ZONE). Tobias Mitchell misses. Rebound secured by Ben Barrett.

[10:45] Team_016 possession (Score: 57-57)
Vince Quickley drives and kicks out. Vince Quickley attempts a 3Pt. Contested by Paul Leonard (5.1 feet, MAN). Vince Quickley misses. Rebound secured by Tobias Mitchell.

[10:34] Team_076 possession (Score: 57-57)
Cade Barnes makes the Midrange and draws the foul on Vince Quickley! And-1! Cade Barnes to the line for 1. [Team fouls: 2] (Vince Quickley: 1 personal fouls)   FT 1/1: GOOD Cade Barnes makes 1/1 from the line.
Score: 57-60

[10:20] Team_016 possession (Score: 57-60)
FOUL! Shooting foul on Dejounte LaVine. Collin Barnes to the line for 2 free throws. [Team fouls: 1] (Dejounte LaVine: 1 personal fouls)   FT 1/2: GOOD   FT 2/2: GOOD Collin Barnes makes 2/2 from the line.
Score: 59-60

[10:07] Team_076 possession (Score: 59-60)
Cade Barnes drives, Vince Duncan stays with him. Cade Barnes attempts a Layup. Contested by Vince Duncan (3.4 feet, ZONE). CADE BARNES MAKES IT! Assist: Dejounte LaVine
Score: 59-62

[09:53] Team_016 possession (Score: 59-62)
Ben Barrett attempts a Layup. Contested by Cade Barnes (4.0 feet, MAN). BEN BARRETT MAKES IT! Assist: Collin Barnes
Score: 61-62

[09:39] Team_076 possession (Score: 61-62)
Cade Barnes drives, Vince Duncan stays with him. Cade Barnes attempts a Dunk. Contested by Vince Duncan (3.4 feet, ZONE). CADE BARNES MAKES IT!
Score: 61-64

[09:21] Team_016 possession (Score: 61-64)
Ben Barrett attempts a 3Pt. Contested by Cade Barnes (4.0 feet, ZONE). Ben Barrett misses. Rebound secured by Tobias Mitchell.

[09:06] Team_076 possession (Score: 61-64)
Paul Leonard attempts a Midrange. Contested by Vince Quickley (4.6 feet, ZONE). Paul Leonard misses. Rebound secured by Ben Barrett.

[08:54] Team_016 possession (Score: 61-64)
FOUL! Reach-in foul on D'Angelo Tatum during the drive. [Team fouls: 2] No free throws, side out. (D'Angelo Tatum: 1 personal fouls)

[08:43] Team_016 possession (Score: 61-64)
Vince Duncan makes the Dunk and draws the foul on D'Angelo Tatum! And-1! Vince Duncan to the line for 1. [Team fouls: 3] (D'Angelo Tatum: 2 personal fouls)   FT 1/1: GOOD Vince Duncan makes 1/1 from the line.
Score: 64-64

[08:29] Team_076 possession (Score: 64-64)
Cade Barnes attempts a Layup. Contested by Vince Duncan (3.4 feet, ZONE). CADE BARNES MAKES IT! Assist: Tobias Mitchell
Score: 64-66

[08:11] Team_016 possession (Score: 64-66)
FOUL! Holding foul on Paul Leonard. [Team fouls: 4] No free throws, side out. (Paul Leonard: 1 personal fouls)

[07:58] Team_016 possession (Score: 64-66)
Ben Barrett attempts a 3Pt. Contested by Paul Leonard (5.6 feet, ZONE). Ben Barrett misses. Rebound secured by Tobias Mitchell.

[07:42] Team_076 possession (Score: 64-66)
Dejounte LaVine makes the Layup and draws the foul on Vince Duncan! And-1! Dejounte LaVine to the line for 1. [Team fouls: 3] (Vince Duncan: 2 personal fouls)   FT 1/1: MISS Dejounte LaVine makes 0/1 from the line. Rebound secured by Vince Duncan.
Score: 64-68

[07:27] Team_016 possession (Score: 64-68)
Vince Quickley attempts a Layup. Contested by Paul Leonard (4.6 feet, MAN). VINCE QUICKLEY MAKES IT! Assist: Collin Barnes
Score: 66-68

[07:12] Team_076 possession (Score: 66-68)
D'Angelo Tatum attempts a 3Pt. Contested by Vince Duncan (3.4 feet, MAN). D'Angelo Tatum misses. Rebound secured by Vince Quickley.

[06:57] Team_016 possession (Score: 66-68)
Giannis Ginobili attempts a 3Pt. Contested by Cade Barnes (3.6 feet, ZONE). Giannis Ginobili misses. Rebound secured by Cade Barnes.

[06:43] Team_076 possession (Score: 66-68)
Cade Barnes attempts a Midrange. Contested by Ben Barrett (3.8 feet, MAN). Cade Barnes misses. Rebound secured by Vince Quickley.

[06:26] Team_016 possession (Score: 66-68)
Collin Barnes drives to the basket... FOUL! Offensive foul on Collin Barnes! Cade Barnes drew the charge! [Team fouls: 4] (Collin Barnes: 1 personal fouls) TURNOVER! (dead ball)

[06:16] Team_076 possession (Score: 66-68)
Dejounte LaVine attempts a Midrange. Contested by Collin Barnes (3.9 feet, MAN). DEJOUNTE LAVINE MAKES IT!
Score: 66-70

[06:03] Team_016 possession (Score: 66-70)
Vince Quickley attempts a 3Pt. Contested by Cade Barnes (3.0 feet, ZONE). Vince Quickley misses. Offensive rebound by Vince Duncan! Vince Duncan puts it back in!
Score: 68-70

[05:45] Team_076 possession (Score: 68-70)
Dejounte LaVine attempts a Midrange. Contested by Collin Barnes (3.9 feet, MAN). DEJOUNTE LAVINE MAKES IT!
Score: 68-72

[05:32] Team_016 possession (Score: 68-72)
FOUL! Reach-in foul on Cade Barnes during the drive. [IN THE BONUS! 5 team fouls] Ben Barrett to the line for 2 free throws. (Cade Barnes: 1 personal fouls)   FT 1/2: GOOD   FT 2/2: GOOD Ben Barrett makes 2/2 from the line.
Score: 70-72

[05:20] Team_076 possession (Score: 70-72)
Paul Leonard makes the Dunk and draws the foul on Vince Duncan! And-1! Paul Leonard to the line for 1. [BONUS: 5 team fouls] (Vince Duncan: 3 personal fouls)   FT 1/1: GOOD Paul Leonard makes 1/1 from the line.
Score: 70-75

[05:03] Team_016 possession (Score: 70-75)
Vince Duncan attempts a Layup. Contested by D'Angelo Tatum (4.1 feet, MAN). VINCE DUNCAN MAKES IT! Assist: Ben Barrett
Score: 72-75

[04:49] Team_076 possession (Score: 72-75)
Dejounte LaVine attempts a 3Pt. Contested by Collin Barnes (4.0 feet, MAN). DEJOUNTE LAVINE MAKES IT! Assist: Cade Barnes
Score: 72-78

[04:35] Team_016 possession (Score: 72-78)
Vince Duncan drives, picks up D'Angelo Tatum. Help arrives from Tobias Mitchell! Vince Duncan attempts a Dunk. Contested by Tobias Mitchell (4.1 feet, MAN). VINCE DUNCAN MAKES IT!
Score: 74-78

[04:19] Team_076 possession (Score: 74-78)
D'Angelo Tatum attempts a Layup. Contested by Vince Duncan (3.5 feet, MAN). D'ANGELO TATUM MAKES IT! Assist: Paul Leonard
Score: 74-80

[04:05] Team_016 possession (Score: 74-80)
Giannis Ginobili attempts a 3Pt. Contested by Tobias Mitchell (4.3 feet, MAN). GIANNIS GINOBILI MAKES IT! Assist: Vince Duncan
Score: 77-80

[03:53] Team_076 possession (Score: 77-80)
Tobias Mitchell drives, picks up Vince Duncan. Help arrives from Collin Barnes! Tobias Mitchell attempts a Layup. Contested by Collin Barnes (3.7 feet, ZONE). TOBIAS MITCHELL MAKES IT! Assist: Paul Leonard
Score: 77-82

[03:38] Team_016 possession (Score: 77-82)
Vince Duncan attempts a Layup. Contested by D'Angelo Tatum (4.2 feet, MAN). Vince Duncan misses. Rebound secured by Cade Barnes.

[03:23] Team_076 possession (Score: 77-82)
Paul Leonard attempts a 3Pt. Contested by Collin Barnes (4.6 feet, ZONE). Paul Leonard misses. Rebound secured by Vince Duncan.

[03:09] Team_016 possession (Score: 77-82)
FOUL! Reach-in foul on Tobias Mitchell during the drive. [IN THE BONUS! 6 team fouls] Giannis Ginobili to the line for 2 free throws. (Tobias Mitchell: 1 personal fouls)   FT 1/2: GOOD   FT 2/2: GOOD Giannis Ginobili makes 2/2 from the line.
Score: 79-82

[02:58] Team_076 possession (Score: 79-82)
Dejounte LaVine drives to the basket... Dejounte LaVine throws a bad pass! Stolen by Vince Duncan! TURNOVER! (live ball)

[02:44] Team_016 possession (Score: 79-82)
Giannis Ginobili drives and kicks out. Vince Duncan attempts a 3Pt. Contested by Cade Barnes (3.8 feet, ZONE). Vince Duncan misses. Rebound secured by D'Angelo Tatum.

[02:31] Team_076 possession (Score: 79-82)
FOUL! Shooting foul on Vince Quickley. Paul Leonard to the line for 3 free throws. [BONUS: 6 team fouls] (Vince Quickley: 2 personal fouls)   FT 1/3: GOOD   FT 2/3: GOOD   FT 3/3: GOOD Paul Leonard makes 3/3 from the line.
Score: 79-85

[02:18] Team_016 possession (Score: 79-85)
FOUL! Shooting foul on Cade Barnes. Ben Barrett to the line for 2 free throws. [BONUS: 7 team fouls] (Cade Barnes: 2 personal fouls)   FT 1/2: MISS   FT 2/2: GOOD Ben Barrett makes 1/2 from the line.
Score: 80-85

[02:05] Team_076 possession (Score: 80-85)
FOUL! Holding foul on Vince Quickley. [IN THE BONUS! 7 team fouls] Paul Leonard to the line for 2 free throws. (Vince Quickley: 3 personal fouls)   FT 1/2: MISS   FT 2/2: GOOD Paul Leonard makes 1/2 from the line.
Score: 80-86

[01:48] Team_016 possession (Score: 80-86)
FOUL! Offensive foul on Collin Barnes! Dejounte LaVine drew the charge! [Team fouls: 8] (Collin Barnes: 2 personal fouls) TURNOVER! (dead ball)

[01:35] Team_076 possession (Score: 80-86)
Tobias Mitchell attempts a 3Pt. Contested by Collin Barnes (4.8 feet, ZONE). Tobias Mitchell misses. Offensive rebound by Cade Barnes! Cade Barnes kicks it out.

[01:21] Team_076 possession (Score: 80-86)
Dejounte LaVine attempts a Layup. Contested by Collin Barnes (4.4 feet, MAN). DEJOUNTE LAVINE MAKES IT!
Score: 80-88

[01:07] Team_016 possession (Score: 80-88)
Giannis Ginobili attempts a 3Pt. BLOCKED BY PAUL LEONARD! Ball is loose! Rebound secured by D'Angelo Tatum.

[00:48] Team_076 possession (Score: 80-88)
D'Angelo Tatum drives, picks up Vince Duncan. Help arrives from Collin Barnes! D'Angelo Tatum attempts a Dunk. Contested by Collin Barnes (3.9 feet, MAN). D'Angelo Tatum misses. Offensive rebound by Cade Barnes! Cade Barnes kicks it out.

[00:33] Team_076 possession (Score: 80-88)
Dejounte LaVine attempts a Midrange. Contested by Collin Barnes (4.5 feet, MAN). Dejounte LaVine misses. Rebound secured by Vince Duncan.

[00:18] Team_016 possession (Score: 80-88)
Vince Duncan drives and kicks out. Collin Barnes attempts a 3Pt. Contested by Dejounte LaVine (5.3 feet, MAN). COLLIN BARNES MAKES IT! Assist: Ben Barrett
Score: 83-88

[00:03] Team_076 possession (Score: 83-88)
Cade Barnes drives, Vince Duncan stays with him. Cade Barnes attempts a Layup. Contested by Vince Duncan (4.0 feet, ZONE). Cade Barnes misses. Rebound secured by Vince Duncan.

================================================================================
                              3RD QUARTER COMPLETE                              
================================================================================

3RD QUARTER SCORE: Team_016 26, Team_076 31

BOX SCORE:
================================================================================

Team_016
--------------------------------------------------------------------------------
Player                MIN  PTS  REB  AST  TO      FG   FG%      3P   3P%
--------------------------------------------------------------------------------
Vince Duncan           25    9    5    1   0   4/5    80.0     0/0   0.0
Collin Barnes          25    5    0    2   0   2/3    66.7     0/0   0.0
Ben Barrett            25    5    2    2   0   3/5    60.0     0/0   0.0
Giannis Ginobili       31    5    0    0   0   2/5    40.0     0/0   0.0
Vince Quickley         31    2    3    0   0   1/2    50.0     0/0   0.0

TEAM: FG: 12/20 (60.0%), 3PT: 2/7 (28.6%), REB: 10 (1 off, 9 def), AST: 5, TO: 3
TEAM FOULS: 8 [Team_076 in BONUS]


Team_076
--------------------------------------------------------------------------------
Player                MIN  PTS  REB  AST  TO      FG   FG%      3P   3P%
--------------------------------------------------------------------------------
Cade Barnes            25    9    5    1   0   4/6    66.7     0/0   0.0
Dejounte LaVine        25    9    0    1   0   4/6    66.7     0/0   0.0
Paul Leonard           25    7    0    2   0   3/5    60.0     0/0   0.0
Tobias Mitchell        25    2    3    1   0   1/3    33.3     0/0   0.0
D'Angelo Tatum         25    2    2    0   0   1/2    50.0     0/0   0.0

TEAM: FG: 13/22 (59.1%), 3PT: 2/5 (40.0%), REB: 10 (2 off, 8 def), AST: 5, TO: 1
TEAM FOULS: 7 [Team_016 in BONUS]

================================================================================

================================================================================
                       4TH QUARTER - Team_016 vs Team_076                       
================================================================================

[12:00] Substitution (Team_016): Collin Barnes OUT → Lamelo Herro IN (stamina_rule2)

[12:00] Substitution (Team_016): Ben Barrett OUT → Giannis Doncic IN (stamina_rule2)

[12:00] Substitution (Team_016): Vince Duncan OUT → Trae Barnes IN (stamina_rule2)

[12:00] Substitution (Team_076): Dejounte LaVine OUT → Pascal Lowry IN (stamina_rule2)

[12:00] Substitution (Team_076): Tobias Mitchell OUT → Jalen Poole IN (stamina_rule2)

[12:00] Substitution (Team_076): Paul Leonard OUT → Vince Lowry IN (stamina_rule2)

[12:00] Substitution (Team_076): Cade Barnes OUT → Kevin Nowitzki IN (stamina_rule2)

[12:00] Substitution (Team_076): D'Angelo Tatum OUT → Jordan Doncic IN (stamina_rule2)

[12:00] Team_016 possession (Score: 83-88)
Vince Quickley drives to the basket... Vince Quickley commits a violation (traveling/carry)! TURNOVER! (dead ball)

[11:48] Team_076 possession (Score: 83-88)
Vince Lowry attempts a Midrange. Contested by Vince Quickley (4.4 feet, MAN). Vince Lowry misses. Rebound secured by Trae Barnes.

[11:35] Team_016 possession (Score: 83-88)
Giannis Ginobili attempts a Layup. Contested by Kevin Nowitzki (4.3 feet, ZONE). GIANNIS GINOBILI MAKES IT! Assist: Vince Quickley
Score: 85-88

[11:17] Team_076 possession (Score: 85-88)
FOUL! Shooting foul on Giannis Doncic. Jordan Doncic to the line for 2 free throws. [Team fouls: 1] (Giannis Doncic: 1 personal fouls)   FT 1/2: MISS   FT 2/2: GOOD Jordan Doncic makes 1/2 from the line.
Score: 85-89

[11:05] Team_016 possession (Score: 85-89)
Vince Quickley attempts a 3Pt. Contested by Pascal Lowry (5.8 feet, ZONE). Vince Quickley misses. Rebound secured by Jordan Doncic.

[10:52] Team_076 possession (Score: 85-89)
Kevin Nowitzki makes the Layup and draws the foul on Giannis Doncic! And-1! Kevin Nowitzki to the line for 1. [Team fouls: 2] (Giannis Doncic: 2 personal fouls)   FT 1/1: GOOD Kevin Nowitzki makes 1/1 from the line.
Score: 85-92

[10:39] Team_016 possession (Score: 85-92)
Lamelo Herro attempts a Layup. Wide open! Pascal Lowry is 6.2 feet away. [MAN] LAMELO HERRO MAKES IT! Assist: Vince Quickley
Score: 87-92

[10:28] Team_076 possession (Score: 87-92)
Vince Lowry drives to the basket... Vince Lowry commits a violation (traveling/carry)! TURNOVER! (dead ball)

[10:28] Substitution (Team_016): Giannis Ginobili OUT → Immanuel Nowitzki IN (stamina_rule2)

[10:28] Substitution (Team_016): Vince Quickley OUT → Kevin Butler IN (stamina_rule2)

[10:14] Team_016 possession (Score: 87-92)
FOUL! Shooting foul on Jordan Doncic. Immanuel Nowitzki to the line for 2 free throws. [Team fouls: 1] (Jordan Doncic: 1 personal fouls)   FT 1/2: GOOD   FT 2/2: GOOD Immanuel Nowitzki makes 2/2 from the line.
Score: 89-92

[10:00] Team_076 possession (Score: 89-92)
Vince Lowry attempts a Midrange. Contested by Immanuel Nowitzki (4.5 feet, ZONE). Vince Lowry misses. Rebound secured by Lamelo Herro.

[09:45] Team_016 possession (Score: 89-92)
Trae Barnes drives to the basket... Trae Barnes throws a bad pass! Stolen by Jordan Doncic! TURNOVER! (live ball)

[09:35] Team_076 possession (Score: 89-92)
FOUL! Reach-in foul on Giannis Doncic during the drive. [Team fouls: 3] No free throws, side out. (Giannis Doncic: 3 personal fouls)

[09:20] Team_076 possession (Score: 89-92)
Jordan Doncic attempts a Layup. BLOCKED BY GIANNIS DONCIC! Ball is loose! Rebound secured by Giannis Doncic.

[09:04] Team_016 possession (Score: 89-92)
Immanuel Nowitzki attempts a Midrange. Contested by Jordan Doncic (3.4 feet, ZONE). Immanuel Nowitzki misses. FOUL! Loose ball foul on Kevin Nowitzki during the rebound battle. [Team fouls: 2] No free throws, side out. (Kevin Nowitzki: 1 personal fouls)

[08:54] Team_016 possession (Score: 89-92)
Kevin Butler attempts a 3Pt. Contested by Vince Lowry (3.9 feet, MAN). Kevin Butler misses. Rebound secured by Kevin Nowitzki.

[08:38] Team_076 possession (Score: 89-92)
Kevin Nowitzki attempts a Midrange. Contested by Giannis Doncic (4.0 feet, MAN). Kevin Nowitzki misses. Rebound secured by Lamelo Herro.

[08:24] Team_016 possession (Score: 89-92)
Immanuel Nowitzki attempts a Midrange. Contested by Kevin Nowitzki (4.3 feet, ZONE). IMMANUEL NOWITZKI MAKES IT!
Score: 91-92

[08:11] Team_076 possession (Score: 91-92)
Jordan Doncic drives, picks up Giannis Doncic. Help arrives from Lamelo Herro! Jordan Doncic attempts a Layup. Contested by Lamelo Herro (3.2 feet, ZONE). Jordan Doncic misses. Rebound secured by Trae Barnes.

[07:56] Team_016 possession (Score: 91-92)
Lamelo Herro attempts a 3Pt. Wide open! Pascal Lowry is 6.2 feet away. [MAN] LAMELO HERRO MAKES IT! Assist: Giannis Doncic
Score: 94-92

[07:42] Team_076 possession (Score: 94-92)
Vince Lowry attempts a 3Pt. Contested by Kevin Butler (4.3 feet, MAN). Vince Lowry misses. Rebound secured by Trae Barnes.

[07:28] Team_016 possession (Score: 94-92)
Kevin Butler drives, Jordan Doncic stays with him. Kevin Butler attempts a Layup. Contested by Jordan Doncic (3.0 feet, ZONE). KEVIN BUTLER MAKES IT!
Score: 96-92

[07:15] Team_076 possession (Score: 96-92)
Kevin Nowitzki attempts a Layup. BLOCKED BY GIANNIS DONCIC! Ball deflects out of bounds off Kevin Nowitzki.

[06:59] Team_016 possession (Score: 96-92)
Lamelo Herro attempts a 3Pt. Wide open! Pascal Lowry is 6.2 feet away. [MAN] Lamelo Herro misses. Rebound secured by Kevin Nowitzki.

[06:46] Team_076 possession (Score: 96-92)
FOUL! Offensive foul on Pascal Lowry! Lamelo Herro drew the charge! [Team fouls: 3] (Pascal Lowry: 1 personal fouls) TURNOVER! (dead ball)

[06:36] Team_016 possession (Score: 96-92)
Lamelo Herro attempts a Midrange. Wide open! Pascal Lowry is 6.2 feet away. [MAN] Lamelo Herro misses. Offensive rebound by Giannis Doncic! Giannis Doncic kicks it out.

[06:21] Team_016 possession (Score: 96-92)
Trae Barnes throws a bad pass! Stolen by Jordan Doncic! TURNOVER! (live ball)

[06:04] Team_076 possession (Score: 96-92)
Jalen Poole drives to the basket... Jalen Poole loses control! Ball rolls out of bounds! TURNOVER! (dead ball)

[05:48] Team_016 possession (Score: 96-92)
Trae Barnes attempts a 3Pt. Contested by Jordan Doncic (3.1 feet, MAN). Trae Barnes misses. Rebound secured by Vince Lowry.

[05:33] Team_076 possession (Score: 96-92)
Jalen Poole drives, picks up Trae Barnes. Help arrives from Lamelo Herro! Jalen Poole attempts a Layup. Wide open! Lamelo Herro is 6.1 feet away. [ZONE] JALEN POOLE MAKES IT!
Score: 96-94

[05:21] Team_016 possession (Score: 96-94)
Trae Barnes attempts a Midrange. Contested by Vince Lowry (4.0 feet, ZONE). TRAE BARNES MAKES IT! Assist: Lamelo Herro
Score: 98-94

[05:08] Team_076 possession (Score: 98-94)
Jalen Poole attempts a Midrange. Contested by Immanuel Nowitzki (4.9 feet, MAN). Jalen Poole misses. Rebound secured by Lamelo Herro.

[04:57] Team_016 possession (Score: 98-94)
Lamelo Herro attempts a Midrange. Contested by Jalen Poole (5.4 feet, ZONE). Lamelo Herro misses. Offensive rebound by Giannis Doncic! Giannis Doncic kicks it out.

[04:47] Team_016 possession (Score: 98-94)
Lamelo Herro attempts a 3Pt. Wide open! Pascal Lowry is 6.3 feet away. [MAN] Lamelo Herro misses. Rebound secured by Vince Lowry.

[04:31] Team_076 possession (Score: 98-94)
Pascal Lowry attempts a 3Pt. Contested by Lamelo Herro (3.5 feet, MAN). PASCAL LOWRY MAKES IT! Assist: Kevin Nowitzki
Score: 98-97

[04:19] Team_016 possession (Score: 98-97)
Kevin Butler attempts a 3Pt. Contested by Vince Lowry (4.0 feet, MAN). KEVIN BUTLER MAKES IT! Assist: Giannis Doncic
Score: 101-97

[04:03] Team_076 possession (Score: 101-97)
FOUL! Offensive foul on Jalen Poole! Immanuel Nowitzki drew the charge! [Team fouls: 4] (Jalen Poole: 1 personal fouls) TURNOVER! (dead ball)

[03:46] Team_016 possession (Score: 101-97)
Immanuel Nowitzki drives, picks up Jordan Doncic. Help arrives from Jalen Poole! Immanuel Nowitzki attempts a Dunk. Contested by Jalen Poole (3.6 feet, ZONE). Immanuel Nowitzki misses. Rebound secured by Jordan Doncic.

[03:31] Team_076 possession (Score: 101-97)
FOUL! Holding foul on Giannis Doncic. [Team fouls: 4] No free throws, side out. (Giannis Doncic: 4 personal fouls)

[03:18] Team_076 possession (Score: 101-97)
Jalen Poole attempts a 3Pt. Contested by Immanuel Nowitzki (5.0 feet, MAN). JALEN POOLE MAKES IT! Assist: Vince Lowry
Score: 101-100

[03:06] Team_016 possession (Score: 101-100)
Trae Barnes drives to the basket... Trae Barnes throws a bad pass! Stolen by Jordan Doncic! TURNOVER! (live ball)

[02:51] Team_076 possession (Score: 101-100)
Jordan Doncic drives, Trae Barnes stays with him. Jordan Doncic attempts a Layup. Contested by Trae Barnes (5.4 feet, MAN). Jordan Doncic misses. Rebound secured by Giannis Doncic.

[02:34] Team_016 possession (Score: 101-100)
Giannis Doncic drives, Kevin Nowitzki stays with him. Giannis Doncic attempts a Dunk. Contested by Kevin Nowitzki (4.5 feet, MAN). Giannis Doncic misses. Rebound secured by Jordan Doncic.

[02:23] Team_076 possession (Score: 101-100)
Jalen Poole attempts a 3Pt. Contested by Immanuel Nowitzki (5.1 feet, MAN). JALEN POOLE MAKES IT! Assist: Pascal Lowry
Score: 101-103

[02:08] Team_016 possession (Score: 101-103)
FOUL! Reach-in foul on Jordan Doncic during the drive. [IN THE BONUS! 5 team fouls] Trae Barnes to the line for 2 free throws. (Jordan Doncic: 2 personal fouls)   FT 1/2: GOOD   FT 2/2: MISS Trae Barnes makes 1/2 from the line. Rebound secured by Kevin Nowitzki.
Score: 102-103

[01:53] Team_076 possession (Score: 102-103)
Jordan Doncic drives and kicks out. Pascal Lowry attempts a 3Pt. Contested by Lamelo Herro (4.2 feet, MAN). PASCAL LOWRY MAKES IT!
Score: 102-106

[01:37] Team_016 possession (Score: 102-106)
Immanuel Nowitzki drives and kicks out. Kevin Butler attempts a Midrange. Contested by Vince Lowry (4.6 feet, MAN). Kevin Butler misses. Rebound secured by Jordan Doncic.

[01:18] Team_076 possession (Score: 102-106)
Jalen Poole drives, Giannis Doncic stays with him. Jalen Poole attempts a Dunk. Contested by Giannis Doncic (4.4 feet, ZONE). Jalen Poole misses. Rebound secured by Giannis Doncic.

[01:05] Team_016 possession (Score: 102-106)
Kevin Butler attempts a 3Pt. Contested by Vince Lowry (4.4 feet, MAN). Kevin Butler misses. Rebound secured by Kevin Nowitzki.

[00:49] Team_076 possession (Score: 102-106)
Kevin Nowitzki attempts a 3Pt. Contested by Lamelo Herro (4.4 feet, ZONE). Kevin Nowitzki misses. Rebound secured by Trae Barnes.

[00:36] Team_016 possession (Score: 102-106)
Lamelo Herro attempts a 3Pt. Wide open! Pascal Lowry is 6.6 feet away. [MAN] Lamelo Herro misses. Offensive rebound by Giannis Doncic! Giannis Doncic kicks it out.

[00:21] Team_016 possession (Score: 102-106)
Lamelo Herro attempts a 3Pt. Contested by Vince Lowry (4.7 feet, ZONE). LAMELO HERRO MAKES IT! Assist: Kevin Butler
Score: 105-106

[00:05] Team_076 possession (Score: 105-106)
Pascal Lowry attempts a 3Pt. Contested by Lamelo Herro (4.0 feet, MAN). PASCAL LOWRY MAKES IT!
Score: 105-109

================================================================================
                              4TH QUARTER COMPLETE                              
================================================================================

4TH QUARTER SCORE: Team_016 22, Team_076 21

BOX SCORE:
================================================================================

Team_016
--------------------------------------------------------------------------------
Player                MIN  PTS  REB  AST  TO      FG   FG%      3P   3P%
--------------------------------------------------------------------------------
Lamelo Herro           24    8    3    1   0   3/5    60.0     0/0   0.0
Kevin Butler           16    5    0    1   0   2/4    50.0     0/0   0.0
Immanuel Nowitzki      16    4    0    0   0   2/4    50.0     0/0   0.0
Trae Barnes            24    2    5    0   0   1/3    33.3     0/0   0.0
Giannis Ginobili       33    2    0    0   0   1/1   100.0     0/0   0.0
Vince Quickley         33    0    0    2   0   0/1     0.0     0/0   0.0
Giannis Doncic         24    0    6    2   0   0/1     0.0     0/0   0.0

TEAM: FG: 9/19 (47.4%), 3PT: 3/9 (33.3%), REB: 14 (4 off, 10 def), AST: 6, TO: 4
TEAM FOULS: 4


Team_076
--------------------------------------------------------------------------------
Player                MIN  PTS  REB  AST  TO      FG   FG%      3P   3P%
--------------------------------------------------------------------------------
Pascal Lowry           24    9    0    1   0   3/3   100.0     0/0   0.0
Jalen Poole            24    8    0    0   0   3/5    60.0     0/0   0.0
Kevin Nowitzki         24    3    4    1   0   1/4    25.0     0/0   0.0
Jordan Doncic          24    1    4    0   0   1/4    25.0     0/0   0.0
Vince Lowry            24    0    2    1   0   0/3     0.0     0/0   0.0

TEAM: FG: 8/19 (42.1%), 3PT: 4/6 (66.7%), REB: 10 (0 off, 10 def), AST: 3, TO: 4
TEAM FOULS: 5 [Team_016 in BONUS]

================================================================================

================================================================================
                               FULL GAME COMPLETE                               
================================================================================

FINAL SCORE: Team_016 105, Team_076 109

SCORING BY QUARTER:
--------------------------------------------------------------------------------
Team                     Q1     Q2     Q3     Q4    FINAL
--------------------------------------------------------------------------------
Team_016                 30     27     26     22      105
Team_076                 26     31     31     21      109
--------------------------------------------------------------------------------

FULL GAME BOX SCORE:
================================================================================

Team_016
--------------------------------------------------------------------------------
Player                MIN  PTS  REB  AST  TO      FG   FG%      3P   3P%      FT STL BLK
--------------------------------------------------------------------------------
Giannis Ginobili       33   14    0    1   1   7/13   53.8   2/6    33.3   2/2     0   0
Vince Quickley         33    9    8    4   1   4/9    44.4   1/4    25.0   1/2     0   0
Collin Barnes          25    5    0    3   2   2/5    40.0   0/3     0.0   2/2     0   0
Ben Barrett            25   13    4    2   2   6/10   60.0   1/3    33.3   7/8     0   0
Vince Duncan           25   16   10    1   1   7/8    87.5   0/0     0.0   2/2     1   0
Lamelo Herro           24   15    6    2   0   6/10   60.0   3/7    42.9   0/0     0   0
Giannis Doncic         24    5   10    3   0   1/4    25.0   0/1     0.0   3/3     1   2
Trae Barnes            24    7    5    1   1   3/9    33.3   0/1     0.0   2/4     0   1
Immanuel Nowitzki      16    9    0    1   1   4/6    66.7   1/1   100.0   2/2     0   0
Kevin Butler           16    8    0    2   1   3/5    60.0   2/4    50.0   0/0     0   0

TEAM: FG: 43/80 (53.8%), 3PT: 10/30 (33.3%), REB: 44 (9 off, 35 def), AST: 20, TO: 10


Team_076
--------------------------------------------------------------------------------
Player                MIN  PTS  REB  AST  TO      FG   FG%      3P   3P%      FT STL BLK
--------------------------------------------------------------------------------
Dejounte LaVine        25   17    0    3   0   7/12   58.3   2/5    40.0   1/2     0   0
Tobias Mitchell        25    5    5    2   0   2/6    33.3   0/2     0.0   1/1     0   0
Paul Leonard           25   11    0    3   1   4/10   40.0   1/4    25.0   5/6     1   1
Cade Barnes            25   17   10    1   0   7/10   70.0   1/2    50.0   3/4     0   0
D'Angelo Tatum         25    4    8    0   2   2/3    66.7   0/1     0.0   0/0     0   0
Pascal Lowry           24   24    0    1   2   8/9    88.9   4/5    80.0   1/2     0   0
Jalen Poole            24    8    0    1   2   3/5    60.0   2/2   100.0   0/0     0   0
Vince Lowry            24    7    3    3   1   2/7    28.6   2/3    66.7   1/1     0   0
Kevin Nowitzki         24    7   10    1   2   3/6    50.0   0/1     0.0   1/1     0   0
Jordan Doncic          24    4   13    3   0   3/9    33.3   0/2     0.0   2/3     3   1

TEAM: FG: 42/78 (53.8%), 3PT: 12/27 (44.4%), REB: 48 (12 off, 36 def), AST: 18, TO: 10

================================================================================
