================================================================================
                        FULL GAME - Team_038 vs Team_010                        
================================================================================

================================================================================
                       1ST QUARTER - Team_038 vs Team_010                       
================================================================================

[12:00] Team_038 possession (Score: 0-0)
DeMar Harris attempts a 3Pt. Contested by Cade Morant (4.7 feet, ZONE). DEMAR HARRIS MAKES IT! Assist: Rudy Thompson
Score: 3-0

[11:46] Team_010 possession (Score: 3-0)
Desmond Antetokounmpo drives, Tracy LaVine stays with him. Desmond Antetokounmpo attempts a Dunk. Contested by Tracy LaVine (4.0 feet, ZONE). Desmond Antetokounmpo misses. Rebound secured by DeMar Harris.

[11:29] Team_038 possession (Score: 3-0)
Rudy Thompson attempts a 3Pt. Contested by Cade Morant (4.5 feet, MAN). Rudy Thompson misses. Offensive rebound by Luka Barnes! Luka Barnes kicks it out.

[11:13] Team_038 possession (Score: 3-0)
Rudy Thompson attempts a Midrange. Contested by Cade Morant (4.5 feet, MAN). Rudy Thompson misses. Rebound secured by Cade Morant.

[10:57] Team_010 possession (Score: 3-0)
RJ Young drives, DeMar Harris stays with him. RJ Young attempts a Layup. Contested by DeMar Harris (2.9 feet, MAN). RJ YOUNG MAKES IT!
Score: 3-2

[10:42] Team_038 possession (Score: 3-2)
Rudy Thompson attempts a Midrange. Contested by Desmond Antetokounmpo (4.9 feet, ZONE). Rudy Thompson misses. Rebound secured by Cade Morant.

[10:24] Team_010 possession (Score: 3-2)
FOUL! Offensive foul on Anthony Durant! Luka Barnes drew the charge! [Team fouls: 1] (Anthony Durant: 1 personal fouls) TURNOVER! (dead ball)

[10:09] Team_038 possession (Score: 3-2)
Luka Barnes commits a violation (traveling/carry)! TURNOVER! (dead ball)

[09:55] Team_010 possession (Score: 3-2)
RJ Young throws a bad pass! Stolen by DeMar Harris! TURNOVER! (live ball)

[09:40] Team_038 possession (Score: 3-2)
Rudy Thompson makes the Layup and draws the foul on Cade Morant! And-1! Rudy Thompson to the line for 1. [Team fouls: 2] (Cade Morant: 1 personal fouls)   FT 1/1: MISS Rudy Thompson makes 0/1 from the line. Rebound secured by Anthony Durant.
Score: 5-2

[09:27] Team_010 possession (Score: 5-2)
Anthony Durant drives to the basket... FOUL! Offensive foul on Anthony Durant! Tracy LaVine drew the charge! [Team fouls: 3] (Anthony Durant: 2 personal fouls) TURNOVER! (dead ball)

[09:17] Team_038 possession (Score: 5-2)
Tracy LaVine makes the Midrange and draws the foul on Desmond Antetokounmpo! And-1! Tracy LaVine to the line for 1. [Team fouls: 4] (Desmond Antetokounmpo: 1 personal fouls)   FT 1/1: GOOD Tracy LaVine makes 1/1 from the line.
Score: 8-2

[09:04] Team_010 possession (Score: 8-2)
RJ Young attempts a 3Pt. Contested by DeMar Harris (2.9 feet, ZONE). RJ Young misses. Rebound secured by Luka Barnes.

[08:52] Team_038 possession (Score: 8-2)
Tracy LaVine attempts a 3Pt. Contested by Cade Morant (3.7 feet, ZONE). Tracy LaVine misses. Rebound secured by Desmond Antetokounmpo.

[08:36] Team_010 possession (Score: 8-2)
RJ Young attempts a 3Pt. Contested by DeMar Harris (2.9 feet, MAN). RJ Young misses. Rebound secured by Tracy LaVine.

[08:22] Team_038 possession (Score: 8-2)
Tracy LaVine drives and kicks out. Luka Barnes attempts a 3Pt. Contested by Cade Morant (3.9 feet, ZONE). Luka Barnes misses. Rebound secured by Desmond Antetokounmpo.

[08:09] Team_010 possession (Score: 8-2)
Anthony Durant attempts a Midrange. Contested by Luka Barnes (4.6 feet, MAN). Anthony Durant misses. Rebound secured by Tracy LaVine.

[07:54] Team_038 possession (Score: 8-2)
Luka Barnes attempts a 3Pt. Contested by Anthony Durant (3.8 feet, MAN). LUKA BARNES MAKES IT! Assist: Rudy Thompson
Score: 11-2

[07:38] Team_010 possession (Score: 11-2)
Cade Morant makes the Layup and draws the foul on Tracy LaVine! And-1! Cade Morant to the line for 1. [Team fouls: 1] (Tracy LaVine: 1 personal fouls)   FT 1/1: MISS Cade Morant makes 0/1 from the line. Rebound secured by Luka Barnes.
Score: 11-4

[07:24] Team_038 possession (Score: 11-4)
Luka Barnes attempts a 3Pt. Contested by Anthony Durant (3.8 feet, MAN). Luka Barnes misses. Offensive rebound by Luka Barnes! Luka Barnes kicks it out.

[07:11] Team_038 possession (Score: 11-4)
FOUL! Shooting foul on Anthony Durant. Luka Barnes to the line for 2 free throws. [BONUS: 5 team fouls] (Anthony Durant: 3 personal fouls)   FT 1/2: GOOD   FT 2/2: GOOD Luka Barnes makes 2/2 from the line.
Score: 13-4

[06:59] Team_010 possession (Score: 13-4)
Desmond Antetokounmpo drives, Tracy LaVine stays with him. Desmond Antetokounmpo attempts a Dunk. Contested by Tracy LaVine (4.0 feet, ZONE). Desmond Antetokounmpo misses. Rebound secured by DeMar Harris.

[06:44] Team_038 possession (Score: 13-4)
Malcolm Poole attempts a Layup. BLOCKED BY MICHAEL TURNER! Ball is loose! Rebound secured by Cade Morant.

[06:26] Team_010 possession (Score: 13-4)
Cade Morant attempts a 3Pt. Contested by DeMar Harris (3.6 feet, ZONE). Cade Morant misses. Rebound secured by Tracy LaVine.

[06:15] Team_038 possession (Score: 13-4)
Luka Barnes attempts a Layup. BLOCKED BY ANTHONY DURANT! Ball is loose! Offensive rebound by Tracy LaVine! Tracy LaVine kicks it out.

[05:59] Team_038 possession (Score: 13-4)
Rudy Thompson attempts a Midrange. Contested by Anthony Durant (4.1 feet, ZONE). Rudy Thompson misses. Rebound secured by Anthony Durant.

[05:45] Team_010 possession (Score: 13-4)
Michael Turner attempts a Midrange. Contested by Luka Barnes (4.5 feet, ZONE). MICHAEL TURNER MAKES IT! Assist: Anthony Durant
Score: 13-6

[05:34] Team_038 possession (Score: 13-6)
FOUL! Offensive foul on Malcolm Poole! Michael Turner drew the charge! [Team fouls: 2] (Malcolm Poole: 1 personal fouls) TURNOVER! (dead ball)

[05:16] Team_010 possession (Score: 13-6)
Anthony Durant attempts a Midrange. Contested by Luka Barnes (4.6 feet, MAN). Anthony Durant misses. Rebound secured by DeMar Harris.

[04:58] Team_038 possession (Score: 13-6)
DeMar Harris drives and kicks out. DeMar Harris attempts a 3Pt. Contested by RJ Young (4.7 feet, MAN). DeMar Harris misses. Offensive rebound by Tracy LaVine! Tracy LaVine puts it back in!
Score: 15-6

[04:41] Team_010 possession (Score: 15-6)
RJ Young attempts a 3Pt. Contested by DeMar Harris (3.0 feet, ZONE). RJ Young misses. Rebound secured by Luka Barnes.

[04:27] Team_038 possession (Score: 15-6)
Tracy LaVine attempts a Midrange. Contested by Michael Turner (3.9 feet, ZONE). Tracy LaVine misses. Rebound secured by Anthony Durant.

[04:13] Team_010 possession (Score: 15-6)
Michael Turner drives, picks up Malcolm Poole. Help arrives from DeMar Harris! Michael Turner attempts a Dunk. Contested by DeMar Harris (5.2 feet, MAN). Michael Turner misses. Rebound secured by DeMar Harris.

[03:58] Team_038 possession (Score: 15-6)
Tracy LaVine attempts a 3Pt. Contested by Desmond Antetokounmpo (4.2 feet, MAN). TRACY LAVINE MAKES IT! Assist: Malcolm Poole
Score: 18-6

[03:46] Team_010 possession (Score: 18-6)
Michael Turner attempts a Midrange. Contested by DeMar Harris (3.5 feet, ZONE). Michael Turner misses. Rebound secured by Luka Barnes.

[03:30] Team_038 possession (Score: 18-6)
Rudy Thompson attempts a 3Pt. Contested by Cade Morant (4.7 feet, ZONE). Rudy Thompson misses. Rebound secured by Anthony Durant.

[03:16] Team_010 possession (Score: 18-6)
RJ Young drives and kicks out. FOUL! Shooting foul on Tracy LaVine. Desmond Antetokounmpo to the line for 3 free throws. [Team fouls: 3] (Tracy LaVine: 2 personal fouls)   FT 1/3: GOOD   FT 2/3: GOOD   FT 3/3: GOOD Desmond Antetokounmpo makes 3/3 from the line.
Score: 18-9

[03:02] Team_038 possession (Score: 18-9)
Rudy Thompson attempts a Midrange. Contested by Michael Turner (4.8 feet, ZONE). Rudy Thompson misses. Rebound secured by Cade Morant.

[02:47] Team_010 possession (Score: 18-9)
Cade Morant throws a bad pass! Stolen by Rudy Thompson! TURNOVER! (live ball)

[02:33] Team_038 possession (Score: 18-9)
Luka Barnes drives and kicks out. Luka Barnes attempts a Midrange. Contested by Anthony Durant (3.8 feet, MAN). LUKA BARNES MAKES IT!
Score: 20-9

[02:20] Team_010 possession (Score: 20-9)
Anthony Durant drives to the basket... Anthony Durant loses control! Ball rolls out of bounds! TURNOVER! (dead ball)

[02:20] Substitution (Team_038): Rudy Thompson OUT → Jalen Hyland IN (stamina_rule2)

[02:20] Substitution (Team_038): DeMar Harris OUT → Magic Dosunmu IN (stamina_rule2)

[02:20] Substitution (Team_038): Tracy LaVine OUT → Jabari Carter IN (stamina_rule2)

[02:20] Substitution (Team_038): Luka Barnes OUT → Ja Smith IN (stamina_rule2)

[02:20] Substitution (Team_010): Cade Morant OUT → Draymond Leonard IN (stamina_rule2)

[02:20] Substitution (Team_010): Michael Turner OUT → Blake Harden IN (stamina_rule2)

[02:20] Substitution (Team_010): RJ Young OUT → Ben Gilgeous-Alexander IN (stamina_rule2)

[02:20] Substitution (Team_010): Desmond Antetokounmpo OUT → Vince Ingram IN (stamina_rule2)

[02:20] Substitution (Team_010): Anthony Durant OUT → Paolo Wade IN (stamina_rule2)

[02:10] Team_038 possession (Score: 20-9)
Ja Smith attempts a Midrange. Wide open! Paolo Wade is 6.1 feet away. [MAN] Ja Smith misses. Rebound secured by Ben Gilgeous-Alexander.

[01:55] Team_010 possession (Score: 20-9)
Blake Harden attempts a 3Pt. Contested by Malcolm Poole (4.9 feet, MAN). BLAKE HARDEN MAKES IT! Assist: Paolo Wade
Score: 20-12

[01:44] Team_038 possession (Score: 20-12)
FOUL! Reach-in foul on Paolo Wade during the drive. [IN THE BONUS! 7 team fouls] Magic Dosunmu to the line for 2 free throws. (Paolo Wade: 1 personal fouls)   FT 1/2: MISS   FT 2/2: GOOD Magic Dosunmu makes 1/2 from the line.
Score: 21-12

[01:31] Team_010 possession (Score: 21-12)
Paolo Wade drives, picks up Ja Smith. Help arrives from Jalen Hyland! Paolo Wade attempts a Layup. Contested by Jalen Hyland (3.5 feet, MAN). PAOLO WADE MAKES IT! Assist: Draymond Leonard
Score: 21-14

[01:20] Team_038 possession (Score: 21-14)
Jabari Carter attempts a Layup. Contested by Paolo Wade (5.7 feet, ZONE). JABARI CARTER MAKES IT!
Score: 23-14

[01:03] Team_010 possession (Score: 23-14)
Ben Gilgeous-Alexander attempts a Midrange. Contested by Magic Dosunmu (3.4 feet, MAN). Ben Gilgeous-Alexander misses. Offensive rebound by Blake Harden! Blake Harden kicks it out.

[00:49] Team_010 possession (Score: 23-14)
Paolo Wade drives, picks up Ja Smith. Help arrives from Jalen Hyland! Paolo Wade attempts a Dunk. Contested by Jalen Hyland (3.5 feet, MAN). Paolo Wade misses. Offensive rebound by Blake Harden! Blake Harden kicks it out.

[00:36] Team_010 possession (Score: 23-14)
Blake Harden drives, picks up Ja Smith. Help arrives from Jalen Hyland! Blake Harden attempts a Layup. Contested by Jalen Hyland (3.0 feet, ZONE). BLAKE HARDEN MAKES IT! Assist: Ben Gilgeous-Alexander
Score: 23-16

[00:21] Team_038 possession (Score: 23-16)
Ja Smith drives, picks up Paolo Wade. Help arrives from Blake Harden! Ja Smith attempts a Layup. Wide open! Blake Harden is 6.1 feet away. [ZONE] JA SMITH MAKES IT! Assist: Jalen Hyland
Score: 25-16

[00:05] Team_010 possession (Score: 25-16)
Vince Ingram drives to the basket... FOUL! Offensive foul on Vince Ingram! Jabari Carter drew the charge! [Team fouls: 8] (Vince Ingram: 1 personal fouls) TURNOVER! (dead ball)

================================================================================
                              1ST QUARTER COMPLETE                              
================================================================================

1ST QUARTER SCORE: Team_038 25, Team_010 16

BOX SCORE:
================================================================================

Team_038
--------------------------------------------------------------------------------
Player                MIN  PTS  REB  AST  TO      FG   FG%      3P   3P%
--------------------------------------------------------------------------------
Tracy LaVine           10    8    5    0   0   3/6    50.0     0/0   0.0
Luka Barnes            10    7    6    0   0   3/3   100.0     0/0   0.0
DeMar Harris           10    3    4    0   0   1/1   100.0     0/0   0.0
Ja Smith                2    2    0    0   0   1/2    50.0     0/0   0.0
Jabari Carter           2    2    0    0   0   1/1   100.0     0/0   0.0
Magic Dosunmu           2    1    0    0   0   1/1   100.0     0/0   0.0
Rudy Thompson          10    0    0    2   0   0/6     0.0     0/0   0.0
Malcolm Poole          12    0    0    1   0   0/1     0.0     0/0   0.0
Jalen Hyland            2    0    0    1   0   0/0     0.0     0/0   0.0

TEAM: FG: 10/21 (47.6%), 3PT: 3/5 (60.0%), REB: 15 (4 off, 11 def), AST: 4, TO: 2
TEAM FOULS: 3


Team_010
--------------------------------------------------------------------------------
Player                MIN  PTS  REB  AST  TO      FG   FG%      3P   3P%
--------------------------------------------------------------------------------
Blake Harden            2    5    2    0   0   2/2   100.0     0/0   0.0
Desmond Antetokounmpo   10    3    2    0   0   1/3    33.3     0/0   0.0
RJ Young               10    2    0    0   0   1/4    25.0     0/0   0.0
Michael Turner         10    2    0    0   0   1/3    33.3     0/0   0.0
Paolo Wade              2    2    0    1   0   1/1   100.0     0/0   0.0
Cade Morant            10    0    4    0   0   0/2     0.0     0/0   0.0
Anthony Durant         10    0    4    1   0   0/2     0.0     0/0   0.0
Ben Gilgeous-Alexander    2    0    1    1   0   0/0     0.0     0/0   0.0
Draymond Leonard        2    0    0    1   0   0/0     0.0     0/0   0.0

TEAM: FG: 6/17 (35.3%), 3PT: 1/5 (20.0%), REB: 13 (2 off, 11 def), AST: 4, TO: 6
TEAM FOULS: 8 [Team_038 in BONUS]

================================================================================

================================================================================
                       2ND QUARTER - Team_038 vs Team_010                       
================================================================================

[12:00] Team_038 possession (Score: 25-16)
Malcolm Poole attempts a 3Pt. Contested by Michael Turner (3.9 feet, MAN). Malcolm Poole misses. FOUL! Loose ball foul on Cade Morant during the rebound battle. [Team fouls: 1] No free throws, side out. (Cade Morant: 1 personal fouls)

[11:46] Team_038 possession (Score: 25-16)
Tracy LaVine attempts a Midrange. Contested by Desmond Antetokounmpo (4.1 feet, MAN). Tracy LaVine misses. Rebound secured by Cade Morant.

[11:36] Team_010 possession (Score: 25-16)
Cade Morant attempts a Midrange. Contested by Rudy Thompson (4.3 feet, MAN). Cade Morant misses. Rebound secured by DeMar Harris.

[11:24] Team_038 possession (Score: 25-16)
DeMar Harris attempts a 3Pt. Contested by Cade Morant (4.7 feet, ZONE). DeMar Harris misses. FOUL! Loose ball foul on Michael Turner during the rebound battle. [Team fouls: 2] No free throws, side out. (Michael Turner: 1 personal fouls)

[11:10] Team_038 possession (Score: 25-16)
Luka Barnes attempts a Midrange. Contested by Michael Turner (4.4 feet, ZONE). LUKA BARNES MAKES IT! Assist: Rudy Thompson
Score: 27-16

[10:58] Team_010 possession (Score: 27-16)
Anthony Durant attempts a Midrange. Contested by Luka Barnes (4.7 feet, MAN). Anthony Durant misses. Rebound secured by Tracy LaVine.

[10:39] Team_038 possession (Score: 27-16)
Malcolm Poole drives, Michael Turner stays with him. Malcolm Poole attempts a Dunk. Contested by Michael Turner (4.0 feet, MAN). MALCOLM POOLE MAKES IT!
Score: 29-16

[10:26] Team_010 possession (Score: 29-16)
Cade Morant attempts a Midrange. Contested by Rudy Thompson (4.4 feet, MAN). CADE MORANT MAKES IT! Assist: Anthony Durant
Score: 29-18

[10:09] Team_038 possession (Score: 29-18)
Tracy LaVine attempts a 3Pt. Contested by Desmond Antetokounmpo (4.3 feet, MAN). TRACY LAVINE MAKES IT! Assist: DeMar Harris
Score: 32-18

[09:55] Team_010 possession (Score: 32-18)
Michael Turner drives to the basket... FOUL! Offensive foul on Michael Turner! Tracy LaVine drew the charge! [Team fouls: 3] (Michael Turner: 2 personal fouls) TURNOVER! (dead ball)

[09:44] Team_038 possession (Score: 32-18)
DeMar Harris throws a bad pass! Stolen by RJ Young! TURNOVER! (live ball)

[09:29] Team_010 possession (Score: 32-18)
Cade Morant attempts a Midrange. Contested by Rudy Thompson (4.5 feet, MAN). CADE MORANT MAKES IT!
Score: 32-20

[09:15] Team_038 possession (Score: 32-20)
DeMar Harris attempts a Midrange. Contested by RJ Young (5.7 feet, MAN). DEMAR HARRIS MAKES IT! Assist: Rudy Thompson
Score: 34-20

[09:00] Team_010 possession (Score: 34-20)
Anthony Durant attempts a Midrange. Contested by Luka Barnes (4.8 feet, MAN). Anthony Durant misses. Rebound secured by DeMar Harris.

[08:45] Team_038 possession (Score: 34-20)
Malcolm Poole attempts a Midrange. Contested by RJ Young (4.9 feet, ZONE). Malcolm Poole misses. Rebound secured by Michael Turner.

[08:30] Team_010 possession (Score: 34-20)
Anthony Durant drives to the basket... Anthony Durant loses the ball! Stripped by Tracy LaVine! TURNOVER! (live ball)

[08:15] Team_038 possession (Score: 34-20)
DeMar Harris loses control! Ball rolls out of bounds! TURNOVER! (dead ball)

[08:15] Substitution (Team_038): Rudy Thompson OUT → Jalen Hyland IN (stamina_rule2)

[08:15] Substitution (Team_038): Malcolm Poole OUT → Jaren Jokic IN (stamina_rule2)

[08:15] Substitution (Team_038): DeMar Harris OUT → Magic Dosunmu IN (stamina_rule2)

[08:15] Substitution (Team_038): Tracy LaVine OUT → Jabari Carter IN (stamina_rule2)

[08:15] Substitution (Team_038): Luka Barnes OUT → Ja Smith IN (stamina_rule2)

[08:15] Substitution (Team_010): Cade Morant OUT → Draymond Leonard IN (stamina_rule2)

[08:15] Substitution (Team_010): Michael Turner OUT → Blake Harden IN (stamina_rule2)

[08:15] Substitution (Team_010): RJ Young OUT → Ben Gilgeous-Alexander IN (stamina_rule2)

[08:15] Substitution (Team_010): Desmond Antetokounmpo OUT → Vince Ingram IN (stamina_rule2)

[08:15] Substitution (Team_010): Anthony Durant OUT → Paolo Wade IN (stamina_rule2)

[08:03] Team_010 possession (Score: 34-20)
Blake Harden attempts a Layup. Contested by Ja Smith (3.0 feet, ZONE). BLAKE HARDEN MAKES IT! Assist: Ben Gilgeous-Alexander
Score: 34-22

[07:46] Team_038 possession (Score: 34-22)
Ja Smith drives, Paolo Wade stays with him. Ja Smith attempts a Dunk. Wide open! Paolo Wade is 6.1 feet away. [ZONE] JA SMITH MAKES IT! Assist: Magic Dosunmu
Score: 36-22

[07:35] Team_010 possession (Score: 36-22)
Draymond Leonard drives to the basket... Draymond Leonard throws a bad pass out of bounds! TURNOVER! (dead ball)

[07:21] Team_038 possession (Score: 36-22)
Jalen Hyland drives, Draymond Leonard stays with him. Jalen Hyland attempts a Dunk. Contested by Draymond Leonard (4.6 feet, MAN). JALEN HYLAND MAKES IT! Assist: Jabari Carter
Score: 38-22

[07:08] Team_010 possession (Score: 38-22)
Paolo Wade drives to the basket... Paolo Wade throws a bad pass! Stolen by Ja Smith! TURNOVER! (live ball)

[06:54] Team_038 possession (Score: 38-22)
Jalen Hyland attempts a 3Pt. Contested by Draymond Leonard (4.6 feet, ZONE). Jalen Hyland misses. Rebound secured by Ben Gilgeous-Alexander.

[06:35] Team_010 possession (Score: 38-22)
FOUL! Holding foul on Jaren Jokic. [Team fouls: 1] No free throws, side out. (Jaren Jokic: 1 personal fouls)

[06:20] Team_010 possession (Score: 38-22)
Ben Gilgeous-Alexander attempts a Midrange. Contested by Magic Dosunmu (3.4 feet, ZONE). Ben Gilgeous-Alexander misses. Offensive rebound by Blake Harden! Blake Harden kicks it out.

[06:09] Team_010 possession (Score: 38-22)
FOUL! Shooting foul on Jaren Jokic. Blake Harden to the line for 2 free throws. [Team fouls: 2] (Jaren Jokic: 2 personal fouls)   FT 1/2: GOOD   FT 2/2: GOOD Blake Harden makes 2/2 from the line.
Score: 38-24

[05:57] Team_038 possession (Score: 38-24)
Jaren Jokic attempts a 3Pt. Contested by Draymond Leonard (4.1 feet, ZONE). Jaren Jokic misses. Rebound secured by Blake Harden.

[05:46] Team_010 possession (Score: 38-24)
FOUL! Holding foul on Jabari Carter. [Team fouls: 3] No free throws, side out. (Jabari Carter: 1 personal fouls)

[05:33] Team_010 possession (Score: 38-24)
FOUL! Reach-in foul on Ja Smith during the drive. [Team fouls: 4] No free throws, side out. (Ja Smith: 1 personal fouls)

[05:19] Team_010 possession (Score: 38-24)
Paolo Wade attempts a 3Pt. Contested by Jabari Carter (4.3 feet, ZONE). Paolo Wade misses. Rebound secured by Jabari Carter.

[05:04] Team_038 possession (Score: 38-24)
Jaren Jokic attempts a 3Pt. Contested by Blake Harden (4.3 feet, MAN). Jaren Jokic misses. Rebound secured by Blake Harden.

[04:47] Team_010 possession (Score: 38-24)
FOUL! Shooting foul on Jalen Hyland. Blake Harden to the line for 3 free throws. [BONUS: 5 team fouls] (Jalen Hyland: 1 personal fouls)   FT 1/3: GOOD   FT 2/3: GOOD   FT 3/3: GOOD Blake Harden makes 3/3 from the line.
Score: 38-27

[04:33] Team_038 possession (Score: 38-27)
Ja Smith drives, Paolo Wade stays with him. Ja Smith attempts a Dunk. Wide open! Paolo Wade is 6.1 feet away. [MAN] JA SMITH MAKES IT!
Score: 40-27

[04:16] Team_010 possession (Score: 40-27)
Blake Harden attempts a Midrange. Contested by Magic Dosunmu (2.9 feet, ZONE). BLAKE HARDEN MAKES IT! Assist: Ben Gilgeous-Alexander
Score: 40-29

[03:59] Team_038 possession (Score: 40-29)
Ja Smith attempts a Layup. Wide open! Paolo Wade is 6.1 feet away. [MAN] JA SMITH MAKES IT! Assist: Jabari Carter
Score: 42-29

[03:50] Team_010 possession (Score: 42-29)
Ben Gilgeous-Alexander attempts a 3Pt. Contested by Jalen Hyland (4.6 feet, ZONE). Ben Gilgeous-Alexander misses. Rebound secured by Ja Smith.

[03:37] Team_038 possession (Score: 42-29)
Jabari Carter drives, Paolo Wade stays with him. Jabari Carter attempts a Layup. Contested by Paolo Wade (5.7 feet, ZONE). JABARI CARTER MAKES IT! Assist: Jaren Jokic
Score: 44-29

[03:22] Team_010 possession (Score: 44-29)
Draymond Leonard attempts a 3Pt. Contested by Jalen Hyland (4.7 feet, ZONE). Draymond Leonard misses. Rebound secured by Ja Smith.

[03:06] Team_038 possession (Score: 44-29)
Magic Dosunmu attempts a Layup. Contested by Ben Gilgeous-Alexander (4.8 feet, MAN). MAGIC DOSUNMU MAKES IT! Assist: Jaren Jokic
Score: 46-29

[02:51] Team_010 possession (Score: 46-29)
Draymond Leonard attempts a Midrange. Contested by Magic Dosunmu (3.5 feet, ZONE). Draymond Leonard misses. Offensive rebound by Paolo Wade! Paolo Wade kicks it out.

[02:33] Team_010 possession (Score: 46-29)
Ben Gilgeous-Alexander attempts a 3Pt. Contested by Jalen Hyland (4.6 feet, ZONE). BEN GILGEOUS-ALEXANDER MAKES IT! Assist: Draymond Leonard
Score: 46-32

[02:19] Team_038 possession (Score: 46-32)
Ja Smith attempts a Layup. Wide open! Paolo Wade is 6.2 feet away. [ZONE] JA SMITH MAKES IT!
Score: 48-32

[02:02] Team_010 possession (Score: 48-32)
Paolo Wade attempts a Midrange. Contested by Ja Smith (3.6 feet, MAN). Paolo Wade misses. Rebound secured by Jabari Carter.

[01:47] Team_038 possession (Score: 48-32)
Magic Dosunmu attempts a 3Pt. Contested by Ben Gilgeous-Alexander (4.9 feet, MAN). MAGIC DOSUNMU MAKES IT!
Score: 51-32

[01:34] Team_010 possession (Score: 51-32)
Vince Ingram makes the Layup and draws the foul on Ja Smith! And-1! Vince Ingram to the line for 1. [BONUS: 6 team fouls] (Ja Smith: 2 personal fouls)   FT 1/1: GOOD Vince Ingram makes 1/1 from the line.
Score: 51-35

[01:21] Team_038 possession (Score: 51-35)
Jalen Hyland attempts a 3Pt. Contested by Draymond Leonard (4.7 feet, ZONE). JALEN HYLAND MAKES IT! Assist: Jaren Jokic
Score: 54-35

[01:08] Team_010 possession (Score: 54-35)
Blake Harden attempts a 3Pt. Contested by Jaren Jokic (4.8 feet, MAN). BLAKE HARDEN MAKES IT! Assist: Ben Gilgeous-Alexander
Score: 54-38

[00:49] Team_038 possession (Score: 54-38)
Jalen Hyland attempts a 3Pt. Contested by Draymond Leonard (4.7 feet, MAN). Jalen Hyland misses. Rebound secured by Blake Harden.

[00:36] Team_010 possession (Score: 54-38)
Blake Harden attempts a Layup. Contested by Ja Smith (3.3 feet, ZONE). BLAKE HARDEN MAKES IT!
Score: 54-40

[00:20] Team_038 possession (Score: 54-40)
Ja Smith drives to the basket... Ja Smith loses control! Ball rolls out of bounds! TURNOVER! (dead ball)

[00:03] Team_010 possession (Score: 54-40)
Paolo Wade attempts a Layup. Contested by Ja Smith (3.9 feet, MAN). Paolo Wade misses. Rebound secured by Ja Smith.

================================================================================
                              2ND QUARTER COMPLETE                              
================================================================================

2ND QUARTER SCORE: Team_038 29, Team_010 24

BOX SCORE:
================================================================================

Team_038
--------------------------------------------------------------------------------
Player                MIN  PTS  REB  AST  TO      FG   FG%      3P   3P%
--------------------------------------------------------------------------------
Ja Smith               10    8    3    0   0   4/4   100.0     0/0   0.0
Magic Dosunmu          10    5    0    1   0   2/2   100.0     0/0   0.0
Jalen Hyland           10    5    0    0   0   2/4    50.0     0/0   0.0
Tracy LaVine           14    3    1    0   0   1/2    50.0     0/0   0.0
Luka Barnes            14    2    2    0   0   1/1   100.0     0/0   0.0
DeMar Harris           14    2    2    1   0   1/1   100.0     0/0   0.0
Malcolm Poole          16    2    0    0   0   1/2    50.0     0/0   0.0
Jabari Carter          10    2    2    2   0   1/1   100.0     0/0   0.0
Rudy Thompson          14    0    0    2   0   0/0     0.0     0/0   0.0
Jaren Jokic             8    0    0    3   0   0/2     0.0     0/0   0.0

TEAM: FG: 13/19 (68.4%), 3PT: 3/7 (42.9%), REB: 10 (2 off, 8 def), AST: 9, TO: 3
TEAM FOULS: 6 [Team_010 in BONUS]


Team_010
--------------------------------------------------------------------------------
Player                MIN  PTS  REB  AST  TO      FG   FG%      3P   3P%
--------------------------------------------------------------------------------
Blake Harden           10   14    4    0   0   6/6   100.0     0/0   0.0
Cade Morant            14    4    1    0   0   2/3    66.7     0/0   0.0
Ben Gilgeous-Alexander   10    3    1    3   0   1/2    50.0     0/0   0.0
Vince Ingram           10    3    0    0   0   1/1   100.0     0/0   0.0
Anthony Durant         14    0    0    1   0   0/2     0.0     0/0   0.0
Michael Turner         14    0    1    0   0   0/0     0.0     0/0   0.0
Paolo Wade             10    0    1    0   0   0/3     0.0     0/0   0.0
Draymond Leonard       10    0    0    1   0   0/1     0.0     0/0   0.0

TEAM: FG: 10/18 (55.6%), 3PT: 3/6 (50.0%), REB: 8 (2 off, 6 def), AST: 5, TO: 4
TEAM FOULS: 3

================================================================================

================================================================================
                       3RD QUARTER - Team_038 vs Team_010                       
================================================================================

[12:00] Team_038 possession (Score: 54-40)
Tracy LaVine drives to the basket... Tracy LaVine throws a bad pass! Stolen by Desmond Antetokounmpo! TURNOVER! (live ball)

[11:43] Team_010 possession (Score: 54-40)
FOUL! Shooting foul on Malcolm Poole. Desmond Antetokounmpo to the line for 2 free throws. [Team fouls: 1] (Malcolm Poole: 1 personal fouls)   FT 1/2: GOOD   FT 2/2: GOOD Desmond Antetokounmpo makes 2/2 from the line.
Score: 54-42

[11:32] Team_038 possession (Score: 54-42)
Luka Barnes attempts a Midrange. Contested by Anthony Durant (3.8 feet, MAN). Luka Barnes misses. Rebound secured by Desmond Antetokounmpo.

[11:14] Team_010 possession (Score: 54-42)
Cade Morant attempts a 3Pt. Contested by Rudy Thompson (4.3 feet, MAN). Cade Morant misses. Rebound secured by DeMar Harris.

[10:59] Team_038 possession (Score: 54-42)
Luka Barnes attempts a 3Pt. Contested by Anthony Durant (3.8 feet, MAN). Luka Barnes misses. Rebound secured by Cade Morant.

[10:42] Team_010 possession (Score: 54-42)
RJ Young drives and kicks out. Michael Turner attempts a 3Pt. Contested by Malcolm Poole (4.9 feet, MAN). Michael Turner misses. Rebound secured by Tracy LaVine.

[10:27] Team_038 possession (Score: 54-42)
DeMar Harris attempts a 3Pt. Contested by RJ Young (5.5 feet, MAN). DeMar Harris misses. Rebound secured by Cade Morant.

[10:14] Team_010 possession (Score: 54-42)
Anthony Durant attempts a Layup. Contested by Luka Barnes (4.6 feet, MAN). ANTHONY DURANT MAKES IT!
Score: 54-44

[10:02] Team_038 possession (Score: 54-44)
Tracy LaVine attempts a 3Pt. Contested by Cade Morant (3.7 feet, ZONE). Tracy LaVine misses. Rebound secured by Anthony Durant.

[09:46] Team_010 possession (Score: 54-44)
Michael Turner attempts a 3Pt. Contested by DeMar Harris (3.4 feet, ZONE). MICHAEL TURNER MAKES IT! Assist: Anthony Durant
Score: 54-47

[09:32] Team_038 possession (Score: 54-47)
Luka Barnes attempts a Layup. Contested by Anthony Durant (3.8 feet, ZONE). Luka Barnes misses. FOUL! Loose ball foul on Desmond Antetokounmpo during the rebound battle. [Team fouls: 1] No free throws, side out. (Desmond Antetokounmpo: 1 personal fouls)

[09:21] Team_038 possession (Score: 54-47)
Rudy Thompson attempts a Layup. Contested by Anthony Durant (4.1 feet, ZONE). RUDY THOMPSON MAKES IT!
Score: 56-47

[09:05] Team_010 possession (Score: 56-47)
Michael Turner makes the Midrange and draws the foul on Rudy Thompson! And-1! Michael Turner to the line for 1. [Team fouls: 2] (Rudy Thompson: 1 personal fouls)   FT 1/1: GOOD Michael Turner makes 1/1 from the line.
Score: 56-50

[08:48] Team_038 possession (Score: 56-50)
Malcolm Poole attempts a 3Pt. Contested by Michael Turner (3.9 feet, MAN). MALCOLM POOLE MAKES IT! Assist: Luka Barnes
Score: 59-50

[08:34] Team_010 possession (Score: 59-50)
Anthony Durant drives and kicks out. Michael Turner attempts a Midrange. Contested by DeMar Harris (3.1 feet, ZONE). Michael Turner misses. Rebound secured by Tracy LaVine.

[08:17] Team_038 possession (Score: 59-50)
Malcolm Poole attempts a 3Pt. Contested by Desmond Antetokounmpo (4.2 feet, ZONE). Malcolm Poole misses. Offensive rebound by Luka Barnes! Luka Barnes kicks it out.

[08:04] Team_038 possession (Score: 59-50)
Malcolm Poole drives and kicks out. Malcolm Poole attempts a 3Pt. Contested by Michael Turner (4.0 feet, MAN). Malcolm Poole misses. Rebound secured by Anthony Durant.

[07:51] Team_010 possession (Score: 59-50)
RJ Young attempts a 3Pt. Contested by DeMar Harris (2.9 feet, MAN). RJ YOUNG MAKES IT! Assist: Michael Turner
Score: 59-53

[07:39] Team_038 possession (Score: 59-53)
Malcolm Poole attempts a Midrange. Contested by Michael Turner (3.9 feet, ZONE). Malcolm Poole misses. FOUL! Loose ball foul on Cade Morant during the rebound battle. [Team fouls: 2] No free throws, side out. (Cade Morant: 1 personal fouls)

[07:28] Team_038 possession (Score: 59-53)
Rudy Thompson attempts a 3Pt. Contested by Cade Morant (4.5 feet, ZONE). Rudy Thompson misses. Offensive rebound by Luka Barnes! Luka Barnes kicks it out.

[07:15] Team_038 possession (Score: 59-53)
DeMar Harris drives, picks up RJ Young. Help arrives from Cade Morant! DeMar Harris attempts a Dunk. Contested by Cade Morant (5.5 feet, MAN). DEMAR HARRIS MAKES IT! Assist: Luka Barnes
Score: 61-53

[07:02] Team_010 possession (Score: 61-53)
RJ Young drives to the basket... RJ Young loses the ball! Stripped by Tracy LaVine! TURNOVER! (live ball)

[06:46] Team_038 possession (Score: 61-53)
DeMar Harris attempts a 3Pt. Contested by RJ Young (5.5 feet, MAN). DeMar Harris misses. Rebound secured by Anthony Durant.

[06:32] Team_010 possession (Score: 61-53)
FOUL! Offensive foul on Anthony Durant! Luka Barnes drew the charge! [Team fouls: 3] (Anthony Durant: 1 personal fouls) TURNOVER! (dead ball)

[06:17] Team_038 possession (Score: 61-53)
Rudy Thompson makes the Midrange and draws the foul on Cade Morant! And-1! Rudy Thompson to the line for 1. [Team fouls: 4] (Cade Morant: 2 personal fouls)   FT 1/1: GOOD Rudy Thompson makes 1/1 from the line.
Score: 64-53

[06:02] Team_010 possession (Score: 64-53)
Cade Morant drives, picks up Rudy Thompson. Help arrives from DeMar Harris! Cade Morant attempts a Layup. Contested by DeMar Harris (4.3 feet, MAN). Cade Morant misses. Rebound secured by DeMar Harris.

[05:50] Team_038 possession (Score: 64-53)
DeMar Harris attempts a 3Pt. Contested by RJ Young (5.5 feet, MAN). DeMar Harris misses. Rebound secured by Anthony Durant.

[05:36] Team_010 possession (Score: 64-53)
RJ Young attempts a 3Pt. Contested by DeMar Harris (2.9 feet, MAN). RJ Young misses. Rebound secured by DeMar Harris.

[05:20] Team_038 possession (Score: 64-53)
Luka Barnes drives and kicks out. Rudy Thompson attempts a 3Pt. Contested by Cade Morant (3.9 feet, ZONE). Rudy Thompson misses. Rebound secured by Anthony Durant.

[05:07] Team_010 possession (Score: 64-53)
FOUL! Reach-in foul on Malcolm Poole during the drive. [Team fouls: 3] No free throws, side out. (Malcolm Poole: 2 personal fouls)

[04:52] Team_010 possession (Score: 64-53)
RJ Young attempts a Midrange. Contested by DeMar Harris (3.0 feet, MAN). RJ Young misses. Offensive rebound by Cade Morant! Cade Morant kicks it out.

[04:38] Team_010 possession (Score: 64-53)
Desmond Antetokounmpo attempts a 3Pt. Contested by Tracy LaVine (4.1 feet, MAN). Desmond Antetokounmpo misses. Rebound secured by Tracy LaVine.

[04:23] Team_038 possession (Score: 64-53)
Luka Barnes drives and kicks out. DeMar Harris attempts a 3Pt. Contested by Cade Morant (4.0 feet, ZONE). DeMar Harris misses. Rebound secured by Michael Turner.

[04:05] Team_010 possession (Score: 64-53)
Cade Morant drives, Tracy LaVine stays with him. Cade Morant attempts a Dunk. Contested by Tracy LaVine (4.5 feet, ZONE). CADE MORANT MAKES IT! Assist: Anthony Durant
Score: 64-55

[03:50] Team_038 possession (Score: 64-55)
Tracy LaVine attempts a 3Pt. Contested by Cade Morant (3.9 feet, ZONE). Tracy LaVine misses. Rebound secured by Anthony Durant.

[03:35] Team_010 possession (Score: 64-55)
Cade Morant attempts a Layup. Contested by Rudy Thompson (4.4 feet, MAN). CADE MORANT MAKES IT! Assist: Desmond Antetokounmpo
Score: 64-57

[03:22] Team_038 possession (Score: 64-57)
Tracy LaVine attempts a Midrange. Contested by Desmond Antetokounmpo (4.3 feet, MAN). TRACY LAVINE MAKES IT!
Score: 66-57

[03:11] Team_010 possession (Score: 66-57)
Anthony Durant drives to the basket... Anthony Durant throws a bad pass out of bounds! TURNOVER! (dead ball)

[02:54] Team_038 possession (Score: 66-57)
Malcolm Poole attempts a 3Pt. Contested by Cade Morant (4.1 feet, ZONE). MALCOLM POOLE MAKES IT! Assist: DeMar Harris
Score: 69-57

[02:36] Team_010 possession (Score: 69-57)
Michael Turner attempts a 3Pt. Contested by Malcolm Poole (5.3 feet, MAN). Michael Turner misses. Rebound secured by Luka Barnes.

[02:17] Team_038 possession (Score: 69-57)
Tracy LaVine attempts a 3Pt. Contested by Desmond Antetokounmpo (4.4 feet, MAN). Tracy LaVine misses. Offensive rebound by Tracy LaVine! Tracy LaVine kicks it out.

[01:58] Team_038 possession (Score: 69-57)
DeMar Harris attempts a 3Pt. Contested by RJ Young (5.7 feet, MAN). DEMAR HARRIS MAKES IT! Assist: Rudy Thompson
Score: 72-57

[01:43] Team_010 possession (Score: 72-57)
Desmond Antetokounmpo drives to the basket... FOUL! Offensive foul on Desmond Antetokounmpo! Tracy LaVine drew the charge! [Team fouls: 5] (Desmond Antetokounmpo: 2 personal fouls) TURNOVER! (dead ball)

[01:24] Team_038 possession (Score: 72-57)
Tracy LaVine drives, Desmond Antetokounmpo stays with him. Tracy LaVine attempts a Dunk. Contested by Desmond Antetokounmpo (4.4 feet, MAN). Tracy LaVine misses. Rebound secured by Michael Turner.

[01:10] Team_010 possession (Score: 72-57)
Cade Morant attempts a 3Pt. Contested by Rudy Thompson (4.7 feet, MAN). Cade Morant misses. Rebound secured by Luka Barnes.

[00:55] Team_038 possession (Score: 72-57)
FOUL! Shooting foul on Desmond Antetokounmpo. Tracy LaVine to the line for 2 free throws. [BONUS: 6 team fouls] (Desmond Antetokounmpo: 3 personal fouls)   FT 1/2: GOOD   FT 2/2: GOOD Tracy LaVine makes 2/2 from the line.
Score: 74-57

[00:41] Team_010 possession (Score: 74-57)
FOUL! Shooting foul on Tracy LaVine. Anthony Durant to the line for 2 free throws. [Team fouls: 4] (Tracy LaVine: 1 personal fouls)   FT 1/2: GOOD   FT 2/2: GOOD Anthony Durant makes 2/2 from the line.
Score: 74-59

[00:24] Team_038 possession (Score: 74-59)
Tracy LaVine attempts a Layup. BLOCKED BY DESMOND ANTETOKOUNMPO! Ball is loose! Offensive rebound by Tracy LaVine! Tracy LaVine kicks it out.

[00:08] Team_038 possession (Score: 74-59)
Tracy LaVine drives to the basket... Tracy LaVine loses control! Ball rolls out of bounds! TURNOVER! (dead ball)

[00:08] Substitution (Team_038): Rudy Thompson OUT → Jalen Hyland IN (stamina_rule2)

[00:08] Substitution (Team_038): Malcolm Poole OUT → Jaren Jokic IN (stamina_rule2)

[00:08] Substitution (Team_038): DeMar Harris OUT → Magic Dosunmu IN (stamina_rule2)

[00:08] Substitution (Team_038): Tracy LaVine OUT → Jabari Carter IN (stamina_rule2)

[00:08] Substitution (Team_038): Luka Barnes OUT → Ja Smith IN (stamina_rule2)

[00:08] Substitution (Team_010): Cade Morant OUT → Draymond Leonard IN (stamina_rule2)

[00:08] Substitution (Team_010): Michael Turner OUT → Blake Harden IN (stamina_rule2)

[00:08] Substitution (Team_010): RJ Young OUT → Ben Gilgeous-Alexander IN (stamina_rule2)

[00:08] Substitution (Team_010): Desmond Antetokounmpo OUT → Vince Ingram IN (stamina_rule2)

[00:08] Substitution (Team_010): Anthony Durant OUT → Paolo Wade IN (stamina_rule2)

================================================================================
                              3RD QUARTER COMPLETE                              
================================================================================

3RD QUARTER SCORE: Team_038 20, Team_010 19

BOX SCORE:
================================================================================

Team_038
--------------------------------------------------------------------------------
Player                MIN  PTS  REB  AST  TO      FG   FG%      3P   3P%
--------------------------------------------------------------------------------
Malcolm Poole          28    6    0    0   0   2/3    66.7     0/0   0.0
DeMar Harris           26    5    3    1   0   2/5    40.0     0/0   0.0
Rudy Thompson          26    5    0    1   0   2/2   100.0     0/0   0.0
Tracy LaVine           26    4    6    0   0   2/5    40.0     0/0   0.0
Luka Barnes            26    0    5    2   0   0/4     0.0     0/0   0.0

TEAM: FG: 8/19 (42.1%), 3PT: 3/9 (33.3%), REB: 14 (6 off, 8 def), AST: 4, TO: 2
TEAM FOULS: 4


Team_010
--------------------------------------------------------------------------------
Player                MIN  PTS  REB  AST  TO      FG   FG%      3P   3P%
--------------------------------------------------------------------------------
Michael Turner         26    6    2    1   0   2/3    66.7     0/0   0.0
Cade Morant            26    4    3    0   0   2/5    40.0     0/0   0.0
Anthony Durant         26    4    6    2   0   2/3    66.7     0/0   0.0
RJ Young               26    3    0    0   0   1/3    33.3     0/0   0.0
Desmond Antetokounmpo   26    2    1    1   0   1/2    50.0     0/0   0.0

TEAM: FG: 8/16 (50.0%), 3PT: 2/7 (28.6%), REB: 12 (1 off, 11 def), AST: 4, TO: 4
TEAM FOULS: 6 [Team_038 in BONUS]

================================================================================

================================================================================
                       4TH QUARTER - Team_038 vs Team_010                       
================================================================================

[12:00] Team_038 possession (Score: 74-59)
FOUL! Offensive foul on Tracy LaVine! Desmond Antetokounmpo drew the charge! [Team fouls: 1] (Tracy LaVine: 1 personal fouls) TURNOVER! (dead ball)

[11:45] Team_010 possession (Score: 74-59)
FOUL! Holding foul on Rudy Thompson. [Team fouls: 2] No free throws, side out. (Rudy Thompson: 1 personal fouls)

[11:28] Team_010 possession (Score: 74-59)
Michael Turner attempts a 3Pt. Contested by DeMar Harris (3.7 feet, ZONE). Michael Turner misses. Rebound secured by DeMar Harris.

[11:12] Team_038 possession (Score: 74-59)
DeMar Harris attempts a 3Pt. Contested by RJ Young (5.8 feet, MAN). DEMAR HARRIS MAKES IT! Assist: Luka Barnes
Score: 77-59

[10:54] Team_010 possession (Score: 77-59)
Michael Turner attempts a Midrange. Contested by Malcolm Poole (5.4 feet, MAN). Michael Turner misses. Rebound secured by DeMar Harris.

[10:38] Team_038 possession (Score: 77-59)
Tracy LaVine attempts a Layup. Contested by Anthony Durant (3.8 feet, ZONE). Tracy LaVine misses. Rebound secured by Cade Morant.

[10:24] Team_010 possession (Score: 77-59)
Michael Turner drives, Malcolm Poole stays with him. Michael Turner attempts a Dunk. Contested by Malcolm Poole (5.5 feet, MAN). MICHAEL TURNER MAKES IT! Assist: Desmond Antetokounmpo
Score: 77-61

[10:05] Team_038 possession (Score: 77-61)
Luka Barnes attempts a 3Pt. Contested by Anthony Durant (4.3 feet, MAN). LUKA BARNES MAKES IT! Assist: Rudy Thompson
Score: 80-61

[09:52] Team_010 possession (Score: 80-61)
Michael Turner drives to the basket... Michael Turner loses the ball! Stripped by Luka Barnes! TURNOVER! (live ball)

[09:40] Team_038 possession (Score: 80-61)
FOUL! Holding foul on Michael Turner. [Team fouls: 1] No free throws, side out. (Michael Turner: 1 personal fouls)

[09:26] Team_038 possession (Score: 80-61)
Tracy LaVine drives to the basket... Tracy LaVine throws a bad pass out of bounds! TURNOVER! (dead ball)

[09:26] Substitution (Team_038): Rudy Thompson OUT → Jalen Hyland IN (stamina_rule2)

[09:26] Substitution (Team_038): Malcolm Poole OUT → Jaren Jokic IN (stamina_rule2)

[09:26] Substitution (Team_038): DeMar Harris OUT → Magic Dosunmu IN (stamina_rule2)

[09:26] Substitution (Team_038): Tracy LaVine OUT → Jabari Carter IN (stamina_rule2)

[09:26] Substitution (Team_038): Luka Barnes OUT → Ja Smith IN (stamina_rule2)

[09:26] Substitution (Team_010): Cade Morant OUT → Draymond Leonard IN (stamina_rule2)

[09:26] Substitution (Team_010): Michael Turner OUT → Blake Harden IN (stamina_rule2)

[09:26] Substitution (Team_010): RJ Young OUT → Ben Gilgeous-Alexander IN (stamina_rule2)

[09:26] Substitution (Team_010): Desmond Antetokounmpo OUT → Vince Ingram IN (stamina_rule2)

[09:26] Substitution (Team_010): Anthony Durant OUT → Paolo Wade IN (stamina_rule2)

[09:10] Team_010 possession (Score: 80-61)
Paolo Wade attempts a Layup. BLOCKED BY JA SMITH! Ball is loose! Rebound secured by Jabari Carter.

[08:55] Team_038 possession (Score: 80-61)
Jaren Jokic drives and kicks out. Magic Dosunmu attempts a 3Pt. Contested by Draymond Leonard (4.4 feet, ZONE). Magic Dosunmu misses. Rebound secured by Ben Gilgeous-Alexander.

[08:43] Team_010 possession (Score: 80-61)
Ben Gilgeous-Alexander attempts a Midrange. Contested by Magic Dosunmu (3.4 feet, MAN). BEN GILGEOUS-ALEXANDER MAKES IT!
Score: 80-63

[08:25] Team_038 possession (Score: 80-63)
Magic Dosunmu attempts a 3Pt. BLOCKED BY BEN GILGEOUS-ALEXANDER! Ball deflects out of bounds off Magic Dosunmu.

[08:09] Team_010 possession (Score: 80-63)
FOUL! Holding foul on Ja Smith. [Team fouls: 3] No free throws, side out. (Ja Smith: 1 personal fouls)

[07:56] Team_010 possession (Score: 80-63)
Vince Ingram attempts a Midrange. Contested by Jalen Hyland (5.1 feet, ZONE). Vince Ingram misses. Offensive rebound by Blake Harden! Blake Harden kicks it out.

[07:45] Team_010 possession (Score: 80-63)
Ben Gilgeous-Alexander drives and kicks out. Vince Ingram attempts a 3Pt. Contested by Jalen Hyland (4.3 feet, ZONE). VINCE INGRAM MAKES IT! Assist: Ben Gilgeous-Alexander
Score: 80-66

[07:31] Team_038 possession (Score: 80-66)
Jabari Carter throws a bad pass! Stolen by Vince Ingram! TURNOVER! (live ball)

[07:16] Team_010 possession (Score: 80-66)
Draymond Leonard drives to the basket... FOUL! Offensive foul on Draymond Leonard! Ja Smith drew the charge! [Team fouls: 2] (Draymond Leonard: 1 personal fouls) TURNOVER! (dead ball)

[07:05] Team_038 possession (Score: 80-66)
Jaren Jokic attempts a Midrange. Contested by Blake Harden (4.3 feet, ZONE). Jaren Jokic misses. Rebound secured by Ben Gilgeous-Alexander.

[06:50] Team_010 possession (Score: 80-66)
Draymond Leonard drives, Ja Smith stays with him. Draymond Leonard attempts a Layup. Contested by Ja Smith (3.7 feet, ZONE). Draymond Leonard misses. Rebound secured by Jabari Carter.

[06:35] Team_038 possession (Score: 80-66)
Ja Smith attempts a Layup. Wide open! Paolo Wade is 6.1 feet away. [ZONE] Ja Smith misses. FOUL! Loose ball foul on Blake Harden during the rebound battle. [Team fouls: 3] No free throws, side out. (Blake Harden: 1 personal fouls)

[06:24] Team_038 possession (Score: 80-66)
FOUL! Shooting foul on Draymond Leonard. Jalen Hyland to the line for 2 free throws. [Team fouls: 4] (Draymond Leonard: 2 personal fouls)   FT 1/2: GOOD   FT 2/2: GOOD Jalen Hyland makes 2/2 from the line.
Score: 82-66

[06:07] Team_010 possession (Score: 82-66)
FOUL! Reach-in foul on Ja Smith during the drive. [Team fouls: 4] No free throws, side out. (Ja Smith: 2 personal fouls)

[05:51] Team_010 possession (Score: 82-66)
FOUL! Shooting foul on Jalen Hyland. Draymond Leonard to the line for 2 free throws. [BONUS: 5 team fouls] (Jalen Hyland: 1 personal fouls)   FT 1/2: MISS   FT 2/2: GOOD Draymond Leonard makes 1/2 from the line.
Score: 82-67

[05:35] Team_038 possession (Score: 82-67)
Jalen Hyland drives, Draymond Leonard stays with him. Jalen Hyland attempts a Layup. Contested by Draymond Leonard (4.6 feet, MAN). JALEN HYLAND MAKES IT!
Score: 84-67

[05:18] Team_010 possession (Score: 84-67)
FOUL! Holding foul on Jalen Hyland. [IN THE BONUS! 6 team fouls] Draymond Leonard to the line for 2 free throws. (Jalen Hyland: 2 personal fouls)   FT 1/2: GOOD   FT 2/2: MISS Draymond Leonard makes 1/2 from the line. FOUL! Loose ball foul on Ja Smith during the free throw rebound! [IN THE BONUS! 7 team fouls] Blake Harden to the line for 2 free throws. (Ja Smith: 3 personal fouls)   FT 1/2: GOOD   FT 2/2: GOOD Blake Harden makes 2/2 from the line.
Score: 84-70

[05:04] Team_038 possession (Score: 84-70)
Magic Dosunmu makes the Layup and draws the foul on Paolo Wade! And-1! Magic Dosunmu to the line for 1. [BONUS: 5 team fouls] (Paolo Wade: 1 personal fouls)   FT 1/1: GOOD Magic Dosunmu makes 1/1 from the line.
Score: 87-70

[04:48] Team_010 possession (Score: 87-70)
Blake Harden attempts a Midrange. Contested by Jaren Jokic (4.8 feet, MAN). BLAKE HARDEN MAKES IT! Assist: Vince Ingram
Score: 87-72

[04:36] Team_038 possession (Score: 87-72)
Jalen Hyland attempts a 3Pt. Contested by Vince Ingram (5.6 feet, ZONE). Jalen Hyland misses. FOUL! Loose ball foul on Blake Harden during the rebound battle. [IN THE BONUS! 6 team fouls] Ja Smith to the line for 2 free throws. (Blake Harden: 2 personal fouls)   FT 1/2: GOOD   FT 2/2: GOOD Ja Smith makes 2/2 from the line.
Score: 89-72

[04:20] Team_010 possession (Score: 89-72)
FOUL! Reach-in foul on Ja Smith during the drive. [IN THE BONUS! 8 team fouls] Paolo Wade to the line for 2 free throws. (Ja Smith: 4 personal fouls)   FT 1/2: GOOD   FT 2/2: GOOD Paolo Wade makes 2/2 from the line.
Score: 89-74

[04:01] Team_038 possession (Score: 89-74)
FOUL! Shooting foul on Ben Gilgeous-Alexander. Magic Dosunmu to the line for 2 free throws. [BONUS: 7 team fouls] (Ben Gilgeous-Alexander: 1 personal fouls)   FT 1/2: GOOD   FT 2/2: GOOD Magic Dosunmu makes 2/2 from the line.
Score: 91-74

[03:45] Team_010 possession (Score: 91-74)
FOUL! Shooting foul on Ja Smith. Vince Ingram to the line for 2 free throws. [BONUS: 9 team fouls] (Ja Smith: 5 personal fouls)   FT 1/2: GOOD   FT 2/2: GOOD Vince Ingram makes 2/2 from the line.
Score: 91-76

[03:28] Team_038 possession (Score: 91-76)
Magic Dosunmu attempts a 3Pt. Contested by Ben Gilgeous-Alexander (4.8 feet, MAN). MAGIC DOSUNMU MAKES IT! Assist: Jaren Jokic
Score: 94-76

[03:17] Team_010 possession (Score: 94-76)
Paolo Wade throws a bad pass out of bounds! TURNOVER! (dead ball)

[03:06] Team_038 possession (Score: 94-76)
Ja Smith drives and kicks out. Ja Smith attempts a 3Pt. Contested by Draymond Leonard (4.4 feet, ZONE). Ja Smith misses. Rebound secured by Blake Harden.

[02:54] Team_010 possession (Score: 94-76)
FOUL! Shooting foul on Ja Smith. Paolo Wade to the line for 2 free throws. [BONUS: 10 team fouls] (Ja Smith: 6 personal fouls) Ja Smith FOULS OUT!   FT 1/2: GOOD   FT 2/2: GOOD Paolo Wade makes 2/2 from the line.
Score: 94-78

[02:54] Substitution (Team_038): Ja Smith OUT (stamina: 79) → Rudy Thompson IN (foul_out)

[02:44] Team_038 possession (Score: 94-78)
Jabari Carter attempts a Layup. Contested by Paolo Wade (5.7 feet, ZONE). JABARI CARTER MAKES IT!
Score: 96-78

[02:29] Team_010 possession (Score: 96-78)
Paolo Wade attempts a Midrange. Contested by Jabari Carter (4.3 feet, MAN). Paolo Wade misses. Rebound secured by Rudy Thompson.

[02:18] Team_038 possession (Score: 96-78)
FOUL! Offensive foul on Rudy Thompson! Draymond Leonard drew the charge! [Team fouls: 11] (Rudy Thompson: 2 personal fouls) TURNOVER! (dead ball)

[02:03] Team_010 possession (Score: 96-78)
Vince Ingram attempts a Midrange. Contested by Jabari Carter (4.9 feet, MAN). Vince Ingram misses. Rebound secured by Rudy Thompson.

[01:50] Team_038 possession (Score: 96-78)
Jabari Carter drives and kicks out. FOUL! Shooting foul on Draymond Leonard. Jalen Hyland to the line for 3 free throws. [BONUS: 8 team fouls] (Draymond Leonard: 3 personal fouls)   FT 1/3: GOOD   FT 2/3: GOOD   FT 3/3: GOOD Jalen Hyland makes 3/3 from the line.
Score: 99-78

[01:36] Team_010 possession (Score: 99-78)
Ben Gilgeous-Alexander attempts a Midrange. Contested by Jaren Jokic (5.4 feet, ZONE). BEN GILGEOUS-ALEXANDER MAKES IT!
Score: 99-80

[01:22] Team_038 possession (Score: 99-80)
Jalen Hyland drives, Draymond Leonard stays with him. Jalen Hyland attempts a Dunk. Contested by Draymond Leonard (4.7 feet, MAN). JALEN HYLAND MAKES IT!
Score: 101-80

[01:10] Team_010 possession (Score: 101-80)
FOUL! Shooting foul on Jabari Carter. Paolo Wade to the line for 2 free throws. [BONUS: 12 team fouls] (Jabari Carter: 1 personal fouls)   FT 1/2: GOOD   FT 2/2: MISS Paolo Wade makes 1/2 from the line. Rebound secured by Jalen Hyland.
Score: 101-81

[00:53] Team_038 possession (Score: 101-81)
Jalen Hyland attempts a Midrange. Contested by Draymond Leonard (4.7 feet, MAN). Jalen Hyland misses. Rebound secured by Paolo Wade.

[00:36] Team_010 possession (Score: 101-81)
Draymond Leonard attempts a Midrange. Contested by Jalen Hyland (4.9 feet, MAN). Draymond Leonard misses. Rebound secured by Jabari Carter.

[00:26] Team_038 possession (Score: 101-81)
Magic Dosunmu attempts a Midrange. Contested by Vince Ingram (5.9 feet, ZONE). MAGIC DOSUNMU MAKES IT!
Score: 103-81

[00:12] Team_010 possession (Score: 103-81)
Paolo Wade attempts a Midrange. Contested by Jabari Carter (4.5 feet, MAN). Paolo Wade misses. Rebound secured by Jabari Carter.

================================================================================
                              4TH QUARTER COMPLETE                              
================================================================================

4TH QUARTER SCORE: Team_038 29, Team_010 22

BOX SCORE:
================================================================================

Team_038
--------------------------------------------------------------------------------
Player                MIN  PTS  REB  AST  TO      FG   FG%      3P   3P%
--------------------------------------------------------------------------------
Magic Dosunmu          20   10    0    0   0   4/5    80.0     0/0   0.0
Jalen Hyland           20    9    1    0   0   4/5    80.0     0/0   0.0
DeMar Harris           29    3    2    0   0   1/1   100.0     0/0   0.0
Luka Barnes            29    3    0    1   0   1/1   100.0     0/0   0.0
Jabari Carter          20    2    4    0   0   1/1   100.0     0/0   0.0
Ja Smith               17    2    1    0   0   1/2    50.0     0/0   0.0
Tracy LaVine           29    0    0    0   0   0/1     0.0     0/0   0.0
Rudy Thompson          31    0    2    1   0   0/0     0.0     0/0   0.0
Jaren Jokic            17    0    0    1   0   0/2     0.0     0/0   0.0

TEAM: FG: 12/18 (66.7%), 3PT: 4/5 (80.0%), REB: 10 (1 off, 9 def), AST: 3, TO: 4
TEAM FOULS: 12 [Team_010 in BONUS]


Team_010
--------------------------------------------------------------------------------
Player                MIN  PTS  REB  AST  TO      FG   FG%      3P   3P%
--------------------------------------------------------------------------------
Blake Harden           20    5    2    0   0   2/2   100.0     0/0   0.0
Vince Ingram           20    5    0    1   0   2/3    66.7     0/0   0.0
Paolo Wade             20    4    1    0   0   2/6    33.3     0/0   0.0
Ben Gilgeous-Alexander   20    4    2    1   0   2/2   100.0     0/0   0.0
Michael Turner         29    2    0    0   0   1/3    33.3     0/0   0.0
Draymond Leonard       20    1    0    0   0   1/3    33.3     0/0   0.0
Cade Morant            29    0    1    0   0   0/0     0.0     0/0   0.0
Desmond Antetokounmpo   29    0    0    1   0   0/0     0.0     0/0   0.0

TEAM: FG: 10/19 (52.6%), 3PT: 0/1 (0.0%), REB: 6 (1 off, 5 def), AST: 3, TO: 3
TEAM FOULS: 8 [Team_038 in BONUS]

================================================================================

================================================================================
                               FULL GAME COMPLETE                               
================================================================================

FINAL SCORE: Team_038 103, Team_010 81

SCORING BY QUARTER:
--------------------------------------------------------------------------------
Team                     Q1     Q2     Q3     Q4    FINAL
--------------------------------------------------------------------------------
Team_038                 25     29     20     29      103
Team_010                 16     24     19     22       81
--------------------------------------------------------------------------------

FULL GAME BOX SCORE:
================================================================================

Team_038
--------------------------------------------------------------------------------
Player                MIN  PTS  REB  AST  TO      FG   FG%      3P   3P%      FT STL BLK
--------------------------------------------------------------------------------
Rudy Thompson          31    5    2    6   1   2/8    25.0   0/1     0.0   1/2     1   0
Malcolm Poole          31    8    0    1   1   3/6    50.0   2/2   100.0   0/0     0   0
DeMar Harris           29   13   11    2   3   6/9    66.7   3/6    50.0   0/0     1   0
Tracy LaVine           29   15   12    0   2   5/13   38.5   2/5    40.0   3/3     2   0
Luka Barnes            29   12   13    3   2   5/9    55.6   2/3    66.7   2/2     1   0
Jalen Hyland           20   14    1    1   0   6/9    66.7   2/4    50.0   5/5     0   0
Magic Dosunmu          20   16    0    1   0   7/8    87.5   2/3    66.7   4/5     0   0
Jabari Carter          20    6    6    2   2   4/4   100.0   0/0     0.0   0/0     0   0
Jaren Jokic            17    0    0    4   0   0/4     0.0   0/2     0.0   0/0     0   0
Ja Smith               17   12    4    0   0   5/7    71.4   0/0     0.0   2/2     1   1

TEAM: FG: 43/77 (55.8%), 3PT: 13/26 (50.0%), REB: 49 (13 off, 36 def), AST: 20, TO: 11


Team_010
--------------------------------------------------------------------------------
Player                MIN  PTS  REB  AST  TO      FG   FG%      3P   3P%      FT STL BLK
--------------------------------------------------------------------------------
Cade Morant            29    8    9    0   3   4/10   40.0   0/3     0.0   0/1     0   0
Michael Turner         29   10    3    1   2   4/9    44.4   1/3    33.3   1/1     0   1
RJ Young               29    5    0    0   2   3/8    37.5   1/5    20.0   0/0     1   0
Desmond Antetokounmpo   29    5    3    2   2   1/4    25.0   0/1     0.0   5/5     1   1
Anthony Durant         29    4   10    4   3   2/7    28.6   0/0     0.0   2/2     0   1
Draymond Leonard       20    1    0    2   0   1/4    25.0   0/1     0.0   2/4     0   0
Blake Harden           20   24    8    0   0   9/9   100.0   3/3   100.0   5/5     0   0
Ben Gilgeous-Alexander   20    7    4    5   2   4/5    80.0   1/2    50.0   0/0     0   1
Vince Ingram           20    8    0    1   2   2/3    66.7   0/0     0.0   3/3     1   0
Paolo Wade             20    6    2    1   1   3/10   30.0   0/1     0.0   5/6     0   0

TEAM: FG: 34/70 (48.6%), 3PT: 6/19 (31.6%), REB: 39 (6 off, 33 def), AST: 16, TO: 17

================================================================================
