================================================================================
                        FULL GAME - Team_051 vs Team_007                        
================================================================================

================================================================================
                       1ST QUARTER - Team_051 vs Team_007                       
================================================================================

[12:00] Team_051 possession (Score: 0-0)
OG Siakam attempts a Midrange. Contested by Bones Siakam (3.9 feet, ZONE). OG Siakam misses. Rebound secured by Bones Siakam.

[11:46] Team_007 possession (Score: 0-0)
FOUL! Reach-in foul on Franz Simmons during the drive. [Team fouls: 1] No free throws, side out. (Franz Simmons: 1 personal fouls)

[11:33] Team_007 possession (Score: 0-0)
Jaren Dosunmu drives, Franz Simmons stays with him. Jaren Dosunmu attempts a Layup. Contested by Franz Simmons (4.2 feet, ZONE). Jaren Dosunmu misses. Rebound secured by OG Siakam.

[11:22] Team_051 possession (Score: 0-0)
Shaquille Harden drives, picks up John Quickley. Help arrives from Jaren Dosunmu! Shaquille Harden attempts a Layup. Contested by Jaren Dosunmu (3.0 feet, ZONE). Shaquille Harden misses. Rebound secured by Carmelo Siakam.

[11:07] Team_007 possession (Score: 0-0)
Bones Siakam makes the Layup and draws the foul on OG Siakam! And-1! Bones Siakam to the line for 1. [Team fouls: 2] (OG Siakam: 1 personal fouls)   FT 1/1: GOOD Bones Siakam makes 1/1 from the line.
Score: 0-3

[10:48] Team_051 possession (Score: 0-3)
Austin Sexton attempts a Midrange. Contested by Tobias Johnson (4.8 feet, MAN). AUSTIN SEXTON MAKES IT!
Score: 2-3

[10:32] Team_007 possession (Score: 2-3)
Carmelo Siakam attempts a 3Pt. Contested by Austin Sexton (4.8 feet, ZONE). CARMELO SIAKAM MAKES IT! Assist: Tobias Johnson
Score: 2-6

[10:20] Team_051 possession (Score: 2-6)
Franz Simmons attempts a Layup. Contested by John Quickley (3.5 feet, MAN). Franz Simmons misses. Rebound secured by John Quickley.

[10:04] Team_007 possession (Score: 2-6)
Bones Siakam attempts a 3Pt. Contested by Austin Sexton (4.5 feet, ZONE). Bones Siakam misses. Rebound secured by Franz Simmons.

[09:49] Team_051 possession (Score: 2-6)
OG Siakam drives, Bones Siakam stays with him. OG Siakam attempts a Dunk. Contested by Bones Siakam (3.9 feet, MAN). OG Siakam misses. Rebound secured by Carmelo Siakam.

[09:34] Team_007 possession (Score: 2-6)
Jaren Dosunmu attempts a Midrange. Contested by Larry McGrady (4.5 feet, MAN). JAREN DOSUNMU MAKES IT!
Score: 2-8

[09:21] Team_051 possession (Score: 2-8)
Shaquille Harden attempts a Midrange. Contested by Jaren Dosunmu (4.4 feet, ZONE). Shaquille Harden misses. Rebound secured by Bones Siakam.

[09:03] Team_007 possession (Score: 2-8)
John Quickley drives and kicks out. Jaren Dosunmu attempts a 3Pt. Contested by Larry McGrady (4.4 feet, MAN). Jaren Dosunmu misses. Rebound secured by Franz Simmons.

[08:51] Team_051 possession (Score: 2-8)
Franz Simmons drives and kicks out. Shaquille Harden attempts a Midrange. Contested by Jaren Dosunmu (4.4 feet, ZONE). SHAQUILLE HARDEN MAKES IT!
Score: 4-8

[08:40] Team_007 possession (Score: 4-8)
Carmelo Siakam drives, picks up Franz Simmons. Help arrives from Larry McGrady! Carmelo Siakam attempts a Dunk. Contested by Larry McGrady (4.6 feet, ZONE). CARMELO SIAKAM MAKES IT!
Score: 4-10

[08:28] Team_051 possession (Score: 4-10)
Shaquille Harden drives, John Quickley stays with him. Shaquille Harden attempts a Layup. Contested by John Quickley (3.0 feet, ZONE). Shaquille Harden misses. Rebound secured by Bones Siakam.

[08:14] Team_007 possession (Score: 4-10)
Bones Siakam attempts a 3Pt. Contested by OG Siakam (4.0 feet, MAN). Bones Siakam misses. Rebound secured by Franz Simmons.

[07:58] Team_051 possession (Score: 4-10)
FOUL! Shooting foul on John Quickley. Franz Simmons to the line for 2 free throws. [Team fouls: 1] (John Quickley: 1 personal fouls)   FT 1/2: MISS   FT 2/2: GOOD Franz Simmons makes 1/2 from the line.
Score: 5-10

[07:41] Team_007 possession (Score: 5-10)
FOUL! Offensive foul on Bones Siakam! OG Siakam drew the charge! [Team fouls: 2] (Bones Siakam: 1 personal fouls) TURNOVER! (dead ball)

[07:31] Team_051 possession (Score: 5-10)
Austin Sexton attempts a 3Pt. Contested by John Quickley (3.0 feet, ZONE). AUSTIN SEXTON MAKES IT! Assist: Larry McGrady
Score: 8-10

[07:16] Team_007 possession (Score: 8-10)
Bones Siakam attempts a 3Pt. Contested by Austin Sexton (4.5 feet, ZONE). BONES SIAKAM MAKES IT! Assist: Jaren Dosunmu
Score: 8-13

[07:00] Team_051 possession (Score: 8-13)
OG Siakam attempts a 3Pt. Contested by John Quickley (3.3 feet, ZONE). OG Siakam misses. Rebound secured by Bones Siakam.

[06:43] Team_007 possession (Score: 8-13)
Jaren Dosunmu attempts a Layup. Contested by Larry McGrady (4.5 feet, MAN). Jaren Dosunmu misses. Rebound secured by OG Siakam.

[06:30] Team_051 possession (Score: 8-13)
Shaquille Harden attempts a Midrange. Contested by John Quickley (3.0 feet, MAN). SHAQUILLE HARDEN MAKES IT!
Score: 10-13

[06:14] Team_007 possession (Score: 10-13)
Carmelo Siakam drives and kicks out. Jaren Dosunmu attempts a Midrange. Contested by Larry McGrady (4.4 feet, MAN). JAREN DOSUNMU MAKES IT! Assist: Carmelo Siakam
Score: 10-15

[05:59] Team_051 possession (Score: 10-15)
OG Siakam attempts a 3Pt. Contested by John Quickley (3.3 feet, ZONE). OG Siakam misses. Rebound secured by John Quickley.

[05:45] Team_007 possession (Score: 10-15)
Tobias Johnson attempts a 3Pt. Contested by Austin Sexton (4.7 feet, ZONE). Tobias Johnson misses. Rebound secured by Franz Simmons.

[05:28] Team_051 possession (Score: 10-15)
Franz Simmons drives and kicks out. Austin Sexton attempts a 3Pt. Contested by Tobias Johnson (4.8 feet, MAN). AUSTIN SEXTON MAKES IT! Assist: Franz Simmons
Score: 13-15

[05:16] Team_007 possession (Score: 13-15)
Carmelo Siakam drives, Shaquille Harden stays with him. Carmelo Siakam attempts a Dunk. Contested by Shaquille Harden (4.6 feet, MAN). CARMELO SIAKAM MAKES IT! Assist: Jaren Dosunmu
Score: 13-17

[05:00] Team_051 possession (Score: 13-17)
FOUL! Shooting foul on Tobias Johnson. Austin Sexton to the line for 2 free throws. [Team fouls: 3] (Tobias Johnson: 1 personal fouls)   FT 1/2: GOOD   FT 2/2: GOOD Austin Sexton makes 2/2 from the line.
Score: 15-17

[04:47] Team_007 possession (Score: 15-17)
Carmelo Siakam attempts a Dunk. BLOCKED BY SHAQUILLE HARDEN! Ball is loose! Offensive rebound by Carmelo Siakam! Carmelo Siakam kicks it out.

[04:30] Team_007 possession (Score: 15-17)
Tobias Johnson attempts a Midrange. Contested by Larry McGrady (4.9 feet, ZONE). Tobias Johnson misses. Offensive rebound by Bones Siakam! Bones Siakam kicks it out.

[04:19] Team_007 possession (Score: 15-17)
John Quickley attempts a Midrange. Contested by Franz Simmons (4.9 feet, MAN). John Quickley misses. Rebound secured by Franz Simmons.

[04:09] Team_051 possession (Score: 15-17)
OG Siakam attempts a Layup. Contested by Bones Siakam (4.0 feet, MAN). OG SIAKAM MAKES IT! Assist: Austin Sexton
Score: 17-17

[03:57] Team_007 possession (Score: 17-17)
Jaren Dosunmu makes the Midrange and draws the foul on Larry McGrady! And-1! Jaren Dosunmu to the line for 1. [Team fouls: 3] (Larry McGrady: 1 personal fouls)   FT 1/1: GOOD Jaren Dosunmu makes 1/1 from the line.
Score: 17-20

[03:46] Team_051 possession (Score: 17-20)
Larry McGrady attempts a Layup. Contested by Jaren Dosunmu (4.8 feet, MAN). Larry McGrady misses. Rebound secured by Carmelo Siakam.

[03:33] Team_007 possession (Score: 17-20)
Carmelo Siakam drives, Franz Simmons stays with him. Carmelo Siakam attempts a Layup. Contested by Franz Simmons (4.7 feet, ZONE). CARMELO SIAKAM MAKES IT!
Score: 17-22

[03:24] Team_051 possession (Score: 17-22)
Franz Simmons makes the Layup and draws the foul on John Quickley! And-1! Franz Simmons to the line for 1. [Team fouls: 4] (John Quickley: 2 personal fouls)   FT 1/1: MISS Franz Simmons makes 0/1 from the line. Rebound secured by Carmelo Siakam.
Score: 19-22

[03:13] Team_007 possession (Score: 19-22)
Jaren Dosunmu attempts a Midrange. Contested by OG Siakam (4.1 feet, ZONE). Jaren Dosunmu misses. Rebound secured by OG Siakam.

[02:57] Team_051 possession (Score: 19-22)
Larry McGrady attempts a 3Pt. Contested by John Quickley (3.7 feet, ZONE). Larry McGrady misses. Offensive rebound by Franz Simmons! Franz Simmons kicks it out.

[02:40] Team_051 possession (Score: 19-22)
OG Siakam drives, picks up John Quickley. Help arrives from Jaren Dosunmu! OG Siakam attempts a Layup. Contested by Jaren Dosunmu (3.7 feet, ZONE). OG Siakam misses. Rebound secured by Bones Siakam.

[02:30] Team_007 possession (Score: 19-22)
FOUL! Reach-in foul on Shaquille Harden during the drive. [Team fouls: 4] No free throws, side out. (Shaquille Harden: 1 personal fouls)

[02:14] Team_007 possession (Score: 19-22)
Jaren Dosunmu makes the Midrange and draws the foul on Larry McGrady! And-1! Jaren Dosunmu to the line for 1. [BONUS: 5 team fouls] (Larry McGrady: 2 personal fouls)   FT 1/1: GOOD Jaren Dosunmu makes 1/1 from the line.
Score: 19-25

[02:03] Team_051 possession (Score: 19-25)
Larry McGrady attempts a 3Pt. Contested by John Quickley (3.8 feet, ZONE). Larry McGrady misses. Rebound secured by John Quickley.

[01:43] Team_007 possession (Score: 19-25)
Carmelo Siakam drives and kicks out. John Quickley attempts a 3Pt. Contested by Franz Simmons (4.5 feet, MAN). JOHN QUICKLEY MAKES IT! Assist: Bones Siakam
Score: 19-28

[01:29] Team_051 possession (Score: 19-28)
Franz Simmons attempts a Midrange. Contested by John Quickley (4.0 feet, MAN). FRANZ SIMMONS MAKES IT!
Score: 21-28

[01:15] Team_007 possession (Score: 21-28)
Carmelo Siakam attempts a Midrange. Contested by Franz Simmons (4.9 feet, ZONE). CARMELO SIAKAM MAKES IT!
Score: 21-30

[01:05] Team_051 possession (Score: 21-30)
Shaquille Harden drives to the basket... Shaquille Harden throws a bad pass! Stolen by John Quickley! TURNOVER! (live ball)

[00:52] Team_007 possession (Score: 21-30)
FOUL! Reach-in foul on Austin Sexton during the drive. [IN THE BONUS! 6 team fouls] Tobias Johnson to the line for 2 free throws. (Austin Sexton: 1 personal fouls)   FT 1/2: MISS   FT 2/2: GOOD Tobias Johnson makes 1/2 from the line.
Score: 21-31

[00:39] Team_051 possession (Score: 21-31)
Shaquille Harden drives, John Quickley stays with him. Shaquille Harden attempts a Dunk. Contested by John Quickley (3.7 feet, ZONE). SHAQUILLE HARDEN MAKES IT!
Score: 23-31

[00:25] Team_007 possession (Score: 23-31)
Jaren Dosunmu attempts a 3Pt. Contested by Larry McGrady (5.0 feet, MAN). Jaren Dosunmu misses. Rebound secured by Shaquille Harden.

[00:14] Team_051 possession (Score: 23-31)
Larry McGrady attempts a Layup. Contested by Jaren Dosunmu (5.1 feet, MAN). LARRY MCGRADY MAKES IT! Assist: Franz Simmons
Score: 25-31

================================================================================
                              1ST QUARTER COMPLETE                              
================================================================================

1ST QUARTER SCORE: Team_051 25, Team_007 31

BOX SCORE:
================================================================================

Team_051
--------------------------------------------------------------------------------
Player                MIN  PTS  REB  AST  TO      FG   FG%      3P   3P%
--------------------------------------------------------------------------------
Austin Sexton          12   10    0    1   0   4/4   100.0     0/0   0.0
Shaquille Harden       12    6    1    0   0   3/6    50.0     0/0   0.0
Franz Simmons          12    3    6    2   0   2/4    50.0     0/0   0.0
OG Siakam              12    2    3    0   0   1/6    16.7     0/0   0.0
Larry McGrady          12    2    0    1   0   1/3    33.3     0/0   0.0

TEAM: FG: 11/23 (47.8%), 3PT: 1/4 (25.0%), REB: 10 (1 off, 9 def), AST: 4, TO: 1
TEAM FOULS: 6 [Team_007 in BONUS]


Team_007
--------------------------------------------------------------------------------
Player                MIN  PTS  REB  AST  TO      FG   FG%      3P   3P%
--------------------------------------------------------------------------------
Carmelo Siakam         12   11    5    1   0   5/5   100.0     0/0   0.0
Jaren Dosunmu          12   10    0    2   0   4/8    50.0     0/0   0.0
Bones Siakam           12    6    6    1   0   2/4    50.0     0/0   0.0
John Quickley          12    3    3    0   0   1/3    33.3     0/0   0.0
Tobias Johnson         12    1    0    1   0   1/2    50.0     0/0   0.0

TEAM: FG: 13/22 (59.1%), 3PT: 2/6 (33.3%), REB: 14 (2 off, 12 def), AST: 5, TO: 1
TEAM FOULS: 4

================================================================================

================================================================================
                       2ND QUARTER - Team_051 vs Team_007                       
================================================================================

[12:00] Team_051 possession (Score: 25-31)
FOUL! Reach-in foul on John Quickley during the drive. [Team fouls: 1] No free throws, side out. (John Quickley: 1 personal fouls)

[11:44] Team_051 possession (Score: 25-31)
Larry McGrady drives, picks up Jaren Dosunmu. Help arrives from Bones Siakam! Larry McGrady attempts a Layup. Contested by Bones Siakam (4.9 feet, MAN). LARRY MCGRADY MAKES IT!
Score: 27-31

[11:30] Team_007 possession (Score: 27-31)
John Quickley attempts a 3Pt. Contested by Austin Sexton (5.3 feet, ZONE). JOHN QUICKLEY MAKES IT! Assist: Jaren Dosunmu
Score: 27-34

[11:16] Team_051 possession (Score: 27-34)
FOUL! Reach-in foul on John Quickley during the drive. [Team fouls: 2] No free throws, side out. (John Quickley: 2 personal fouls)

[11:03] Team_051 possession (Score: 27-34)
OG Siakam attempts a 3Pt. Contested by John Quickley (3.9 feet, ZONE). OG Siakam misses. Rebound secured by Carmelo Siakam.

[10:49] Team_007 possession (Score: 27-34)
Jaren Dosunmu throws a bad pass out of bounds! TURNOVER! (dead ball)

[10:49] Substitution (Team_051): Austin Sexton OUT → Myles Harden IN (stamina_rule2)

[10:49] Substitution (Team_051): Larry McGrady OUT → Zion Morant IN (stamina_rule2)

[10:49] Substitution (Team_051): OG Siakam OUT → Jrue Carter IN (stamina_rule2)

[10:49] Substitution (Team_051): Franz Simmons OUT → Tobias Jokic IN (stamina_rule2)

[10:49] Substitution (Team_051): Shaquille Harden OUT → Pau Tatum IN (stamina_rule2)

[10:49] Substitution (Team_007): Tobias Johnson OUT → Wendell Poole IN (stamina_rule2)

[10:49] Substitution (Team_007): Jaren Dosunmu OUT → OG Porzingis IN (stamina_rule2)

[10:49] Substitution (Team_007): Bones Siakam OUT → Gary LaVine IN (stamina_rule2)

[10:49] Substitution (Team_007): John Quickley OUT → Austin Simons IN (stamina_rule2)

[10:49] Substitution (Team_007): Carmelo Siakam OUT → Draymond Harris IN (stamina_rule2)

[10:33] Team_051 possession (Score: 27-34)
Tobias Jokic attempts a 3Pt. Contested by Austin Simons (4.0 feet, MAN). Tobias Jokic misses. Rebound secured by Austin Simons.

[10:20] Team_007 possession (Score: 27-34)
FOUL! Reach-in foul on Pau Tatum during the drive. [Team fouls: 1] No free throws, side out. (Pau Tatum: 1 personal fouls)

[10:08] Team_007 possession (Score: 27-34)
Draymond Harris drives and kicks out. Draymond Harris attempts a Midrange. Contested by Pau Tatum (4.3 feet, MAN). Draymond Harris misses. Rebound secured by Pau Tatum.

[09:53] Team_051 possession (Score: 27-34)
FOUL! Shooting foul on OG Porzingis. Pau Tatum to the line for 2 free throws. [Team fouls: 3] (OG Porzingis: 1 personal fouls)   FT 1/2: GOOD   FT 2/2: GOOD Pau Tatum makes 2/2 from the line.
Score: 29-34

[09:43] Team_007 possession (Score: 29-34)
OG Porzingis makes the Layup and draws the foul on Zion Morant! And-1! OG Porzingis to the line for 1. [Team fouls: 2] (Zion Morant: 1 personal fouls)   FT 1/1: GOOD OG Porzingis makes 1/1 from the line.
Score: 29-37

[09:30] Team_051 possession (Score: 29-37)
Tobias Jokic attempts a Layup. BLOCKED BY AUSTIN SIMONS! Ball deflects out of bounds off Tobias Jokic.

[09:19] Team_007 possession (Score: 29-37)
Gary LaVine attempts a Layup. Contested by Jrue Carter (4.8 feet, MAN). Gary LaVine misses. Rebound secured by Pau Tatum.

[09:06] Team_051 possession (Score: 29-37)
Pau Tatum makes the Layup and draws the foul on Draymond Harris! And-1! Pau Tatum to the line for 1. [Team fouls: 4] (Draymond Harris: 1 personal fouls)   FT 1/1: MISS Pau Tatum makes 0/1 from the line. Rebound secured by Draymond Harris.
Score: 31-37

[08:54] Team_007 possession (Score: 31-37)
OG Porzingis attempts a Layup. BLOCKED BY PAU TATUM! Ball deflects out of bounds off OG Porzingis.

[08:38] Team_051 possession (Score: 31-37)
Zion Morant attempts a 3Pt. Contested by Wendell Poole (5.5 feet, ZONE). Zion Morant misses. Rebound secured by Gary LaVine.

[08:22] Team_007 possession (Score: 31-37)
OG Porzingis throws a bad pass! Stolen by Zion Morant! TURNOVER! (live ball)

[08:08] Team_051 possession (Score: 31-37)
FOUL! Shooting foul on OG Porzingis. Myles Harden to the line for 2 free throws. [BONUS: 5 team fouls] (OG Porzingis: 2 personal fouls)   FT 1/2: GOOD   FT 2/2: GOOD Myles Harden makes 2/2 from the line.
Score: 33-37

[07:53] Team_007 possession (Score: 33-37)
OG Porzingis attempts a 3Pt. Contested by Zion Morant (5.2 feet, MAN). OG Porzingis misses. Rebound secured by Myles Harden.

[07:40] Team_051 possession (Score: 33-37)
FOUL! Reach-in foul on Draymond Harris during the drive. [IN THE BONUS! 6 team fouls] Pau Tatum to the line for 2 free throws. (Draymond Harris: 2 personal fouls)   FT 1/2: GOOD   FT 2/2: GOOD Pau Tatum makes 2/2 from the line.
Score: 35-37

[07:28] Team_007 possession (Score: 35-37)
FOUL! Reach-in foul on Jrue Carter during the drive. [Team fouls: 3] No free throws, side out. (Jrue Carter: 1 personal fouls)

[07:16] Team_007 possession (Score: 35-37)
Austin Simons makes the Dunk and draws the foul on Myles Harden! And-1! Austin Simons to the line for 1. [Team fouls: 4] (Myles Harden: 1 personal fouls)   FT 1/1: GOOD Austin Simons makes 1/1 from the line.
Score: 35-40

[07:07] Team_051 possession (Score: 35-40)
Jrue Carter loses control! Ball rolls out of bounds! TURNOVER! (dead ball)

[06:49] Team_007 possession (Score: 35-40)
FOUL! Reach-in foul on Pau Tatum during the drive. [IN THE BONUS! 5 team fouls] Draymond Harris to the line for 2 free throws. (Pau Tatum: 2 personal fouls)   FT 1/2: GOOD   FT 2/2: GOOD Draymond Harris makes 2/2 from the line.
Score: 35-42

[06:33] Team_051 possession (Score: 35-42)
Zion Morant attempts a Layup. Contested by OG Porzingis (4.5 feet, MAN). Zion Morant misses. Rebound secured by Gary LaVine.

[06:16] Team_007 possession (Score: 35-42)
FOUL! Reach-in foul on Pau Tatum during the drive. [IN THE BONUS! 6 team fouls] Gary LaVine to the line for 2 free throws. (Pau Tatum: 3 personal fouls)   FT 1/2: MISS   FT 2/2: MISS Gary LaVine makes 0/2 from the line. Rebound secured by Tobias Jokic.

[06:00] Team_051 possession (Score: 35-42)
Pau Tatum loses control! Ball rolls out of bounds! TURNOVER! (dead ball)

[05:40] Team_007 possession (Score: 35-42)
Gary LaVine attempts a 3Pt. Contested by Myles Harden (4.7 feet, ZONE). GARY LAVINE MAKES IT! Assist: Draymond Harris
Score: 35-45

[05:27] Team_051 possession (Score: 35-45)
Tobias Jokic drives to the basket... Tobias Jokic commits a violation (traveling/carry)! TURNOVER! (dead ball)

[05:11] Team_007 possession (Score: 35-45)
OG Porzingis drives to the basket... OG Porzingis throws a bad pass! Stolen by Zion Morant! TURNOVER! (live ball)

[05:00] Team_051 possession (Score: 35-45)
FOUL! Reach-in foul on Draymond Harris during the drive. [IN THE BONUS! 7 team fouls] Pau Tatum to the line for 2 free throws. (Draymond Harris: 3 personal fouls)   FT 1/2: GOOD   FT 2/2: MISS Pau Tatum makes 1/2 from the line. Rebound secured by Austin Simons.
Score: 36-45

[04:45] Team_007 possession (Score: 36-45)
FOUL! Holding foul on Jrue Carter. [IN THE BONUS! 7 team fouls] Gary LaVine to the line for 2 free throws. (Jrue Carter: 2 personal fouls)   FT 1/2: GOOD   FT 2/2: GOOD Gary LaVine makes 2/2 from the line.
Score: 36-47

[04:33] Team_051 possession (Score: 36-47)
Pau Tatum attempts a 3Pt. Contested by OG Porzingis (4.1 feet, ZONE). Pau Tatum misses. Rebound secured by Gary LaVine.

[04:22] Team_007 possession (Score: 36-47)
OG Porzingis attempts a Layup. Contested by Tobias Jokic (4.9 feet, ZONE). OG Porzingis misses. Offensive rebound by Austin Simons! Austin Simons puts it back in!
Score: 36-49

[04:08] Team_051 possession (Score: 36-49)
Jrue Carter attempts a 3Pt. Contested by Gary LaVine (4.6 feet, MAN). Jrue Carter misses. Rebound secured by Draymond Harris.

[03:54] Team_007 possession (Score: 36-49)
Austin Simons attempts a Midrange. Contested by Tobias Jokic (5.6 feet, MAN). Austin Simons misses. Rebound secured by Myles Harden.

[03:42] Team_051 possession (Score: 36-49)
Tobias Jokic attempts a Midrange. Contested by Austin Simons (4.0 feet, MAN). Tobias Jokic misses. Rebound secured by Draymond Harris.

[03:31] Team_007 possession (Score: 36-49)
Wendell Poole attempts a 3Pt. Contested by Myles Harden (5.0 feet, MAN). Wendell Poole misses. Rebound secured by Pau Tatum.

[03:16] Team_051 possession (Score: 36-49)
Zion Morant attempts a Layup. Contested by OG Porzingis (4.6 feet, MAN). Zion Morant misses. Rebound secured by Draymond Harris.

[03:00] Team_007 possession (Score: 36-49)
Wendell Poole attempts a Midrange. Contested by Tobias Jokic (5.6 feet, ZONE). Wendell Poole misses. Offensive rebound by Austin Simons! Austin Simons's putback is no good. Offensive rebound by Draymond Harris! Draymond Harris kicks it out.

[02:45] Team_007 possession (Score: 36-49)
Gary LaVine makes the Dunk and draws the foul on Myles Harden! And-1! Gary LaVine to the line for 1. [BONUS: 8 team fouls] (Myles Harden: 2 personal fouls)   FT 1/1: MISS Gary LaVine makes 0/1 from the line. Rebound secured by Pau Tatum.
Score: 36-51

[02:30] Team_051 possession (Score: 36-51)
Myles Harden attempts a 3Pt. Contested by OG Porzingis (4.1 feet, ZONE). MYLES HARDEN MAKES IT!
Score: 39-51

[02:14] Team_007 possession (Score: 39-51)
Gary LaVine attempts a 3Pt. Contested by Tobias Jokic (5.6 feet, ZONE). GARY LAVINE MAKES IT! Assist: Austin Simons
Score: 39-54

[02:00] Team_051 possession (Score: 39-54)
Tobias Jokic attempts a 3Pt. Contested by OG Porzingis (4.6 feet, ZONE). Tobias Jokic misses. Offensive rebound by Pau Tatum! Pau Tatum's putback is no good. Rebound secured by Austin Simons.

[01:47] Team_007 possession (Score: 39-54)
Gary LaVine drives and kicks out. Austin Simons attempts a Midrange. Contested by Tobias Jokic (5.5 feet, ZONE). Austin Simons misses. Rebound secured by Tobias Jokic.

[01:34] Team_051 possession (Score: 39-54)
Pau Tatum makes the Midrange and draws the foul on OG Porzingis! And-1! Pau Tatum to the line for 1. [BONUS: 8 team fouls] (OG Porzingis: 3 personal fouls)   FT 1/1: MISS Pau Tatum makes 0/1 from the line. Offensive rebound by Tobias Jokic! Tobias Jokic kicks it out.
Score: 41-54

[01:20] Team_051 possession (Score: 41-54)
Jrue Carter attempts a Midrange. Contested by Gary LaVine (4.9 feet, MAN). Jrue Carter misses. Rebound secured by Draymond Harris.

[01:07] Team_007 possession (Score: 41-54)
Austin Simons attempts a 3Pt. Contested by Tobias Jokic (5.9 feet, MAN). Austin Simons misses. Rebound secured by Pau Tatum.

[00:54] Team_051 possession (Score: 41-54)
Tobias Jokic drives, picks up Austin Simons. Help arrives from OG Porzingis! Tobias Jokic attempts a Layup. Contested by OG Porzingis (4.3 feet, ZONE). Tobias Jokic misses. Rebound secured by Gary LaVine.

[00:43] Team_007 possession (Score: 41-54)
Austin Simons makes the Midrange and draws the foul on Jrue Carter! And-1! Austin Simons to the line for 1. [BONUS: 9 team fouls] (Jrue Carter: 3 personal fouls)   FT 1/1: GOOD Austin Simons makes 1/1 from the line.
Score: 41-57

[00:28] Team_051 possession (Score: 41-57)
Pau Tatum attempts a 3Pt. Contested by OG Porzingis (4.4 feet, ZONE). Pau Tatum misses. Rebound secured by Austin Simons.

[00:14] Team_007 possession (Score: 41-57)
Austin Simons attempts a Midrange. Contested by Tobias Jokic (6.0 feet, MAN). Austin Simons misses. Rebound secured by Myles Harden.

================================================================================
                              2ND QUARTER COMPLETE                              
================================================================================

2ND QUARTER SCORE: Team_051 16, Team_007 26

BOX SCORE:
================================================================================

Team_051
--------------------------------------------------------------------------------
Player                MIN  PTS  REB  AST  TO      FG   FG%      3P   3P%
--------------------------------------------------------------------------------
Myles Harden           11    5    3    0   0   2/2   100.0     0/0   0.0
Pau Tatum              11    4    5    0   0   2/6    33.3     0/0   0.0
Larry McGrady          13    2    0    0   0   1/1   100.0     0/0   0.0
OG Siakam              13    0    0    0   0   0/1     0.0     0/0   0.0
Tobias Jokic           11    0    3    0   0   0/5     0.0     0/0   0.0
Zion Morant            11    0    0    0   0   0/3     0.0     0/0   0.0
Jrue Carter            11    0    0    0   0   0/2     0.0     0/0   0.0

TEAM: FG: 5/20 (25.0%), 3PT: 1/8 (12.5%), REB: 12 (2 off, 10 def), AST: 0, TO: 3
TEAM FOULS: 9 [Team_007 in BONUS]


Team_007
--------------------------------------------------------------------------------
Player                MIN  PTS  REB  AST  TO      FG   FG%      3P   3P%
--------------------------------------------------------------------------------
Austin Simons          11    8    5    1   0   3/6    50.0     0/0   0.0
Gary LaVine            11    8    4    0   0   3/7    42.9     0/0   0.0
John Quickley          13    3    0    0   0   1/1   100.0     0/0   0.0
OG Porzingis           11    3    0    0   0   1/3    33.3     0/0   0.0
Draymond Harris        11    2    6    1   0   1/2    50.0     0/0   0.0
Jaren Dosunmu          13    0    0    1   0   0/0     0.0     0/0   0.0
Carmelo Siakam         13    0    1    0   0   0/0     0.0     0/0   0.0
Wendell Poole          11    0    0    0   0   0/1     0.0     0/0   0.0

TEAM: FG: 9/20 (45.0%), 3PT: 3/6 (50.0%), REB: 15 (2 off, 13 def), AST: 3, TO: 3
TEAM FOULS: 8 [Team_051 in BONUS]

================================================================================

================================================================================
                       3RD QUARTER - Team_051 vs Team_007                       
================================================================================

[12:00] Team_051 possession (Score: 41-57)
Austin Sexton attempts a Layup. BLOCKED BY BONES SIAKAM! Ball is loose! Rebound secured by Carmelo Siakam.

[11:46] Team_007 possession (Score: 41-57)
Carmelo Siakam attempts a Midrange. Contested by Shaquille Harden (4.6 feet, MAN). Carmelo Siakam misses. Rebound secured by Franz Simmons.

[11:33] Team_051 possession (Score: 41-57)
FOUL! Holding foul on Tobias Johnson. [Team fouls: 1] No free throws, side out. (Tobias Johnson: 1 personal fouls)

[11:21] Team_051 possession (Score: 41-57)
Larry McGrady attempts a 3Pt. Contested by John Quickley (3.3 feet, ZONE). LARRY MCGRADY MAKES IT!
Score: 44-57

[11:05] Team_007 possession (Score: 44-57)
Jaren Dosunmu attempts a 3Pt. Contested by Larry McGrady (4.5 feet, MAN). Jaren Dosunmu misses. Rebound secured by Franz Simmons.

[10:49] Team_051 possession (Score: 44-57)
OG Siakam attempts a Midrange. Contested by Bones Siakam (3.9 feet, ZONE). OG SIAKAM MAKES IT! Assist: Franz Simmons
Score: 46-57

[10:31] Team_007 possession (Score: 46-57)
FOUL! Shooting foul on Austin Sexton. Bones Siakam to the line for 3 free throws. [Team fouls: 1] (Austin Sexton: 1 personal fouls)   FT 1/3: GOOD   FT 2/3: MISS   FT 3/3: MISS Bones Siakam makes 1/3 from the line. Rebound secured by Shaquille Harden.
Score: 46-58

[10:17] Team_051 possession (Score: 46-58)
Larry McGrady drives, Jaren Dosunmu stays with him. Larry McGrady attempts a Dunk. Contested by Jaren Dosunmu (4.7 feet, MAN). LARRY MCGRADY MAKES IT! Assist: Austin Sexton
Score: 48-58

[10:03] Team_007 possession (Score: 48-58)
Tobias Johnson attempts a Midrange. Contested by Austin Sexton (4.7 feet, MAN). Tobias Johnson misses. Rebound secured by Shaquille Harden.

[09:50] Team_051 possession (Score: 48-58)
FOUL! Shooting foul on Jaren Dosunmu. Shaquille Harden to the line for 2 free throws. [Team fouls: 2] (Jaren Dosunmu: 1 personal fouls)   FT 1/2: GOOD   FT 2/2: GOOD Shaquille Harden makes 2/2 from the line.
Score: 50-58

[09:34] Team_007 possession (Score: 50-58)
Tobias Johnson attempts a Layup. Contested by Austin Sexton (4.7 feet, MAN). TOBIAS JOHNSON MAKES IT! Assist: Carmelo Siakam
Score: 50-60

[09:18] Team_051 possession (Score: 50-60)
Shaquille Harden attempts a Layup. Contested by John Quickley (3.0 feet, ZONE). Shaquille Harden misses. Rebound secured by John Quickley.

[09:04] Team_007 possession (Score: 50-60)
Tobias Johnson attempts a Midrange. Contested by OG Siakam (4.2 feet, ZONE). TOBIAS JOHNSON MAKES IT! Assist: Jaren Dosunmu
Score: 50-62

[08:51] Team_051 possession (Score: 50-62)
FOUL! Reach-in foul on John Quickley during the drive. [Team fouls: 3] No free throws, side out. (John Quickley: 1 personal fouls)

[08:34] Team_051 possession (Score: 50-62)
Austin Sexton drives to the basket... Austin Sexton throws a bad pass! Stolen by Tobias Johnson! TURNOVER! (live ball)

[08:18] Team_007 possession (Score: 50-62)
Jaren Dosunmu attempts a 3Pt. Contested by Austin Sexton (4.4 feet, ZONE). JAREN DOSUNMU MAKES IT! Assist: Tobias Johnson
Score: 50-65

[08:04] Team_051 possession (Score: 50-65)
FOUL! Shooting foul on John Quickley. Austin Sexton to the line for 2 free throws. [Team fouls: 4] (John Quickley: 2 personal fouls)   FT 1/2: GOOD   FT 2/2: MISS Austin Sexton makes 1/2 from the line. Rebound secured by John Quickley.
Score: 51-65

[07:53] Team_007 possession (Score: 51-65)
Bones Siakam drives to the basket... Bones Siakam throws a bad pass! Stolen by Franz Simmons! TURNOVER! (live ball)

[07:40] Team_051 possession (Score: 51-65)
Franz Simmons attempts a 3Pt. Contested by John Quickley (3.5 feet, MAN). Franz Simmons misses. Rebound secured by John Quickley.

[07:28] Team_007 possession (Score: 51-65)
Bones Siakam drives to the basket... Bones Siakam commits a violation (traveling/carry)! TURNOVER! (dead ball)

[07:14] Team_051 possession (Score: 51-65)
Austin Sexton drives to the basket... Austin Sexton throws a bad pass! Stolen by Tobias Johnson! TURNOVER! (live ball)

[07:02] Team_007 possession (Score: 51-65)
Carmelo Siakam attempts a Layup. Contested by Franz Simmons (4.6 feet, ZONE). Carmelo Siakam misses. Rebound secured by Shaquille Harden.

[06:46] Team_051 possession (Score: 51-65)
OG Siakam attempts a 3Pt. Contested by Bones Siakam (3.9 feet, MAN). OG Siakam misses. Offensive rebound by Shaquille Harden! Shaquille Harden's putback is no good. Rebound secured by John Quickley.

[06:30] Team_007 possession (Score: 51-65)
Jaren Dosunmu attempts a 3Pt. Contested by Austin Sexton (4.4 feet, ZONE). JAREN DOSUNMU MAKES IT! Assist: Carmelo Siakam
Score: 51-68

[06:16] Team_051 possession (Score: 51-68)
Shaquille Harden attempts a Midrange. Contested by Bones Siakam (3.5 feet, ZONE). Shaquille Harden misses. Offensive rebound by Shaquille Harden! Shaquille Harden's putback is no good. Offensive rebound by Shaquille Harden! Shaquille Harden kicks it out.

[06:00] Team_051 possession (Score: 51-68)
Austin Sexton drives, picks up John Quickley. Help arrives from Jaren Dosunmu! Austin Sexton attempts a Dunk. Contested by Jaren Dosunmu (3.0 feet, ZONE). Austin Sexton misses. FOUL! Loose ball foul on Bones Siakam during the rebound battle. [IN THE BONUS! 5 team fouls] Shaquille Harden to the line for 2 free throws. (Bones Siakam: 1 personal fouls)   FT 1/2: GOOD   FT 2/2: GOOD Shaquille Harden makes 2/2 from the line.
Score: 53-68

[05:44] Team_007 possession (Score: 53-68)
John Quickley attempts a 3Pt. Contested by Franz Simmons (4.9 feet, MAN). John Quickley misses. Rebound secured by Franz Simmons.

[05:33] Team_051 possession (Score: 53-68)
Austin Sexton attempts a Layup. Contested by Tobias Johnson (4.8 feet, MAN). AUSTIN SEXTON MAKES IT!
Score: 55-68

[05:19] Team_007 possession (Score: 55-68)
FOUL! Offensive foul on Tobias Johnson! Austin Sexton drew the charge! [Team fouls: 6] (Tobias Johnson: 2 personal fouls) TURNOVER! (dead ball)

[05:03] Team_051 possession (Score: 55-68)
Shaquille Harden attempts a Midrange. BLOCKED BY JOHN QUICKLEY! Ball deflects out of bounds off Shaquille Harden.

[04:50] Team_007 possession (Score: 55-68)
Tobias Johnson attempts a 3Pt. Contested by Austin Sexton (4.7 feet, MAN). Tobias Johnson misses. Rebound secured by OG Siakam.

[04:34] Team_051 possession (Score: 55-68)
Larry McGrady attempts a 3Pt. Contested by Jaren Dosunmu (4.7 feet, MAN). Larry McGrady misses. Rebound secured by Bones Siakam.

[04:20] Team_007 possession (Score: 55-68)
FOUL! Offensive foul on Carmelo Siakam! Shaquille Harden drew the charge! [Team fouls: 7] (Carmelo Siakam: 1 personal fouls) TURNOVER! (dead ball)

[04:04] Team_051 possession (Score: 55-68)
FOUL! Shooting foul on Tobias Johnson. Shaquille Harden to the line for 2 free throws. [BONUS: 8 team fouls] (Tobias Johnson: 3 personal fouls)   FT 1/2: GOOD   FT 2/2: GOOD Shaquille Harden makes 2/2 from the line.
Score: 57-68

[03:50] Team_007 possession (Score: 57-68)
John Quickley attempts a 3Pt. Contested by Austin Sexton (5.1 feet, ZONE). JOHN QUICKLEY MAKES IT! Assist: Carmelo Siakam
Score: 57-71

[03:34] Team_051 possession (Score: 57-71)
Larry McGrady attempts a 3Pt. Contested by Jaren Dosunmu (4.8 feet, MAN). LARRY MCGRADY MAKES IT! Assist: Austin Sexton
Score: 60-71

[03:23] Team_007 possession (Score: 60-71)
Tobias Johnson attempts a 3Pt. Contested by Franz Simmons (4.6 feet, ZONE). TOBIAS JOHNSON MAKES IT! Assist: Bones Siakam
Score: 60-74

[03:07] Team_051 possession (Score: 60-74)
FOUL! Reach-in foul on Tobias Johnson during the drive. [IN THE BONUS! 9 team fouls] Austin Sexton to the line for 2 free throws. (Tobias Johnson: 4 personal fouls)   FT 1/2: GOOD   FT 2/2: MISS Austin Sexton makes 1/2 from the line. Rebound secured by Bones Siakam.
Score: 61-74

[02:55] Team_007 possession (Score: 61-74)
Tobias Johnson attempts a Midrange. Contested by Larry McGrady (5.0 feet, ZONE). TOBIAS JOHNSON MAKES IT! Assist: John Quickley
Score: 61-76

[02:39] Team_051 possession (Score: 61-76)
Shaquille Harden drives to the basket... Shaquille Harden throws a bad pass out of bounds! TURNOVER! (dead ball)

[02:39] Substitution (Team_051): Larry McGrady OUT → Zion Morant IN (stamina_rule2)

[02:39] Substitution (Team_051): OG Siakam OUT → Jrue Carter IN (stamina_rule2)

[02:39] Substitution (Team_007): Bones Siakam OUT → Gary LaVine IN (stamina_rule2)

[02:39] Substitution (Team_007): John Quickley OUT → Austin Simons IN (stamina_rule2)

[02:39] Substitution (Team_007): Carmelo Siakam OUT → Draymond Harris IN (stamina_rule2)

[02:25] Team_007 possession (Score: 61-76)
Draymond Harris drives, Shaquille Harden stays with him. Draymond Harris attempts a Dunk. Contested by Shaquille Harden (4.4 feet, MAN). Draymond Harris misses. Rebound secured by Shaquille Harden.

[02:10] Team_051 possession (Score: 61-76)
Austin Sexton attempts a 3Pt. Contested by Jaren Dosunmu (4.6 feet, ZONE). Austin Sexton misses. Rebound secured by Draymond Harris.

[01:59] Team_007 possession (Score: 61-76)
Austin Simons attempts a 3Pt. Contested by Franz Simmons (4.8 feet, MAN). Austin Simons misses. Rebound secured by Jrue Carter.

[01:45] Team_051 possession (Score: 61-76)
Jrue Carter attempts a 3Pt. Contested by Austin Simons (4.1 feet, ZONE). JRUE CARTER MAKES IT! Assist: Franz Simmons
Score: 64-76

[01:30] Team_007 possession (Score: 64-76)
Gary LaVine attempts a Midrange. Contested by Jrue Carter (4.8 feet, MAN). Gary LaVine misses. Rebound secured by Shaquille Harden.

[01:19] Team_051 possession (Score: 64-76)
Jrue Carter drives to the basket... Jrue Carter loses the ball! Stripped by Austin Simons! TURNOVER! (live ball)

[01:04] Team_007 possession (Score: 64-76)
Jaren Dosunmu attempts a 3Pt. Contested by Austin Sexton (4.7 feet, ZONE). JAREN DOSUNMU MAKES IT! Assist: Tobias Johnson
Score: 64-79

[00:46] Team_051 possession (Score: 64-79)
Shaquille Harden drives, Austin Simons stays with him. Shaquille Harden attempts a Layup. Contested by Austin Simons (3.7 feet, ZONE). SHAQUILLE HARDEN MAKES IT! Assist: Zion Morant
Score: 66-79

[00:34] Team_007 possession (Score: 66-79)
FOUL! Shooting foul on Austin Sexton. Tobias Johnson to the line for 3 free throws. [Team fouls: 2] (Austin Sexton: 2 personal fouls)   FT 1/3: GOOD   FT 2/3: GOOD   FT 3/3: GOOD Tobias Johnson makes 3/3 from the line.
Score: 66-82

[00:18] Team_051 possession (Score: 66-82)
Austin Sexton drives, Austin Simons stays with him. Austin Sexton attempts a Dunk. Contested by Austin Simons (3.7 feet, ZONE). Austin Sexton misses. Rebound secured by Draymond Harris.

[00:01] Team_007 possession (Score: 66-82)
Austin Simons attempts a Layup. Contested by Franz Simmons (5.1 feet, ZONE). AUSTIN SIMONS MAKES IT! Assist: Jaren Dosunmu
Score: 66-84

================================================================================
                              3RD QUARTER COMPLETE                              
================================================================================

3RD QUARTER SCORE: Team_051 25, Team_007 27

BOX SCORE:
================================================================================

Team_051
--------------------------------------------------------------------------------
Player                MIN  PTS  REB  AST  TO      FG   FG%      3P   3P%
--------------------------------------------------------------------------------
Larry McGrady          23    8    0    0   0   3/4    75.0     0/0   0.0
Shaquille Harden       26    8    6    0   0   4/6    66.7     0/0   0.0
Jrue Carter            13    3    1    0   0   1/1   100.0     0/0   0.0
Austin Sexton          26    2    0    2   0   1/6    16.7     0/0   0.0
OG Siakam              23    2    1    0   0   1/2    50.0     0/0   0.0
Franz Simmons          26    0    3    2   0   0/1     0.0     0/0   0.0
Zion Morant            13    0    0    1   0   0/0     0.0     0/0   0.0

TEAM: FG: 10/20 (50.0%), 3PT: 3/7 (42.9%), REB: 12 (2 off, 10 def), AST: 5, TO: 4
TEAM FOULS: 2


Team_007
--------------------------------------------------------------------------------
Player                MIN  PTS  REB  AST  TO      FG   FG%      3P   3P%
--------------------------------------------------------------------------------
Tobias Johnson         26   12    0    2   0   5/7    71.4     0/0   0.0
Jaren Dosunmu          26    9    0    2   0   3/4    75.0     0/0   0.0
John Quickley          23    3    4    1   0   1/2    50.0     0/0   0.0
Austin Simons          13    2    0    0   0   1/2    50.0     0/0   0.0
Carmelo Siakam         23    0    1    3   0   0/2     0.0     0/0   0.0
Bones Siakam           23    0    2    1   0   0/1     0.0     0/0   0.0
Draymond Harris        13    0    2    0   0   0/1     0.0     0/0   0.0
Gary LaVine            13    0    0    0   0   0/1     0.0     0/0   0.0

TEAM: FG: 10/20 (50.0%), 3PT: 6/11 (54.5%), REB: 8 (0 off, 8 def), AST: 9, TO: 4
TEAM FOULS: 9 [Team_051 in BONUS]

================================================================================

================================================================================
                       4TH QUARTER - Team_051 vs Team_007                       
================================================================================

[12:00] Substitution (Team_051): Austin Sexton OUT (stamina: 70) → Myles Harden IN (comeback_detected)

[12:00] Substitution (Team_007): Tobias Johnson OUT (stamina: 70) → Wendell Poole IN (comeback_detected)

[12:00] Team_051 possession (Score: 66-84)
Larry McGrady loses the ball! Stripped by Jaren Dosunmu! TURNOVER! (live ball)

[11:43] Team_007 possession (Score: 66-84)
FOUL! Reach-in foul on Larry McGrady during the drive. [Team fouls: 1] No free throws, side out. (Larry McGrady: 1 personal fouls)

[11:28] Team_007 possession (Score: 66-84)
Jaren Dosunmu throws a bad pass out of bounds! TURNOVER! (dead ball)

[11:28] Substitution (Team_051): Franz Simmons OUT → Tobias Jokic IN (stamina_rule2)

[11:28] Substitution (Team_051): Shaquille Harden OUT → Pau Tatum IN (stamina_rule2)

[11:28] Substitution (Team_007): Jaren Dosunmu OUT → OG Porzingis IN (stamina_rule2)

[11:10] Team_051 possession (Score: 66-84)
Larry McGrady attempts a Midrange. Contested by Wendell Poole (5.5 feet, ZONE). Larry McGrady misses. Offensive rebound by OG Siakam! OG Siakam kicks it out.

[10:56] Team_051 possession (Score: 66-84)
Larry McGrady attempts a Layup. Contested by John Quickley (3.5 feet, ZONE). LARRY MCGRADY MAKES IT!
Score: 68-84

[10:46] Team_007 possession (Score: 68-84)
OG Porzingis drives and kicks out. FOUL! Shooting foul on Tobias Jokic. OG Porzingis to the line for 2 free throws. [Team fouls: 2] (Tobias Jokic: 1 personal fouls)   FT 1/2: GOOD   FT 2/2: GOOD OG Porzingis makes 2/2 from the line.
Score: 68-86

[10:30] Team_051 possession (Score: 68-86)
Pau Tatum drives, John Quickley stays with him. Pau Tatum attempts a Dunk. Contested by John Quickley (3.1 feet, ZONE). PAU TATUM MAKES IT! Assist: Myles Harden
Score: 70-86

[10:18] Team_007 possession (Score: 70-86)
Carmelo Siakam drives and kicks out. John Quickley attempts a Midrange. Contested by Tobias Jokic (5.2 feet, ZONE). John Quickley misses. Rebound secured by OG Siakam.

[10:02] Team_051 possession (Score: 70-86)
Larry McGrady attempts a Midrange. Contested by John Quickley (3.6 feet, ZONE). Larry McGrady misses. Rebound secured by Bones Siakam.

[09:43] Team_007 possession (Score: 70-86)
Wendell Poole attempts a 3Pt. Contested by Myles Harden (4.9 feet, MAN). WENDELL POOLE MAKES IT! Assist: Bones Siakam
Score: 70-89

[09:25] Team_051 possession (Score: 70-89)
Pau Tatum attempts a 3Pt. Contested by John Quickley (3.2 feet, ZONE). Pau Tatum misses. Rebound secured by John Quickley.

[09:11] Team_007 possession (Score: 70-89)
Bones Siakam makes the Layup and draws the foul on Pau Tatum! And-1! Bones Siakam to the line for 1. [Team fouls: 3] (Pau Tatum: 1 personal fouls)   FT 1/1: GOOD Bones Siakam makes 1/1 from the line.
Score: 70-92

[08:58] Team_051 possession (Score: 70-92)
Pau Tatum attempts a Midrange. Contested by John Quickley (3.3 feet, MAN). Pau Tatum misses. Rebound secured by John Quickley.

[08:44] Team_007 possession (Score: 70-92)
FOUL! Reach-in foul on Myles Harden during the drive. [Team fouls: 4] No free throws, side out. (Myles Harden: 1 personal fouls)

[08:30] Team_007 possession (Score: 70-92)
Carmelo Siakam drives, Tobias Jokic stays with him. Carmelo Siakam attempts a Dunk. Contested by Tobias Jokic (5.6 feet, ZONE). Carmelo Siakam misses. Offensive rebound by Bones Siakam! Bones Siakam kicks it out.

[08:17] Team_007 possession (Score: 70-92)
Bones Siakam drives and kicks out. Carmelo Siakam attempts a Midrange. Contested by OG Siakam (4.2 feet, ZONE). Carmelo Siakam misses. Rebound secured by Pau Tatum.

[08:01] Team_051 possession (Score: 70-92)
Tobias Jokic attempts a Layup. Contested by Carmelo Siakam (4.8 feet, ZONE). Tobias Jokic misses. Rebound secured by Carmelo Siakam.

[07:46] Team_007 possession (Score: 70-92)
John Quickley attempts a Midrange. Contested by Tobias Jokic (5.8 feet, MAN). John Quickley misses. Rebound secured by Pau Tatum.

[07:33] Team_051 possession (Score: 70-92)
Myles Harden attempts a 3Pt. Contested by Wendell Poole (5.0 feet, ZONE). Myles Harden misses. Rebound secured by Carmelo Siakam.

[07:17] Team_007 possession (Score: 70-92)
OG Porzingis drives to the basket... FOUL! Offensive foul on OG Porzingis! Larry McGrady drew the charge! [Team fouls: 1] (OG Porzingis: 1 personal fouls) TURNOVER! (dead ball)

[06:59] Team_051 possession (Score: 70-92)
Myles Harden drives, picks up John Quickley. Help arrives from OG Porzingis! Myles Harden attempts a Layup. Contested by OG Porzingis (3.5 feet, ZONE). MYLES HARDEN MAKES IT!
Score: 72-92

[06:48] Team_007 possession (Score: 72-92)
OG Porzingis attempts a Midrange. Contested by Larry McGrady (4.6 feet, MAN). OG PORZINGIS MAKES IT! Assist: Wendell Poole
Score: 72-94

[06:30] Team_051 possession (Score: 72-94)
Pau Tatum attempts a 3Pt. Contested by John Quickley (3.7 feet, MAN). Pau Tatum misses. Rebound secured by Carmelo Siakam.

[06:11] Team_007 possession (Score: 72-94)
Carmelo Siakam attempts a Midrange. Contested by Pau Tatum (4.6 feet, MAN). Carmelo Siakam misses. Rebound secured by Tobias Jokic.

[05:54] Team_051 possession (Score: 72-94)
Tobias Jokic attempts a 3Pt. Contested by John Quickley (4.1 feet, ZONE). TOBIAS JOKIC MAKES IT! Assist: Pau Tatum
Score: 75-94

[05:40] Team_007 possession (Score: 75-94)
Carmelo Siakam drives and kicks out. Bones Siakam attempts a Midrange. Contested by Tobias Jokic (5.2 feet, ZONE). Bones Siakam misses. Rebound secured by Tobias Jokic.

[05:26] Team_051 possession (Score: 75-94)
Tobias Jokic loses the ball! Stripped by John Quickley! TURNOVER! (live ball)

[05:13] Team_007 possession (Score: 75-94)
Carmelo Siakam attempts a Layup. Contested by Pau Tatum (4.5 feet, MAN). CARMELO SIAKAM MAKES IT! Assist: OG Porzingis
Score: 75-96

[04:57] Team_051 possession (Score: 75-96)
Larry McGrady drives, John Quickley stays with him. Larry McGrady attempts a Layup. Contested by John Quickley (4.2 feet, ZONE). LARRY MCGRADY MAKES IT!
Score: 77-96

[04:42] Team_007 possession (Score: 77-96)
Carmelo Siakam drives, Pau Tatum stays with him. Carmelo Siakam attempts a Dunk. Contested by Pau Tatum (4.5 feet, MAN). CARMELO SIAKAM MAKES IT! Assist: Bones Siakam
Score: 77-98

[04:23] Team_051 possession (Score: 77-98)
FOUL! Reach-in foul on Carmelo Siakam during the drive. [Team fouls: 2] No free throws, side out. (Carmelo Siakam: 1 personal fouls)

[04:08] Team_051 possession (Score: 77-98)
Pau Tatum drives, Carmelo Siakam stays with him. Pau Tatum attempts a Layup. Contested by Carmelo Siakam (5.0 feet, MAN). PAU TATUM MAKES IT! Assist: Myles Harden
Score: 79-98

[03:56] Team_007 possession (Score: 79-98)
John Quickley attempts a 3Pt. Contested by Tobias Jokic (5.7 feet, MAN). John Quickley misses. Rebound secured by Myles Harden.

[03:38] Team_051 possession (Score: 79-98)
Larry McGrady attempts a Midrange. Contested by OG Porzingis (4.4 feet, ZONE). Larry McGrady misses. Offensive rebound by Pau Tatum! Pau Tatum puts it back in!
Score: 81-98

[03:26] Team_007 possession (Score: 81-98)
Carmelo Siakam drives to the basket... Carmelo Siakam commits a violation (traveling/carry)! TURNOVER! (dead ball)

[03:26] Substitution (Team_051): Larry McGrady OUT → Zion Morant IN (stamina_rule2)

[03:26] Substitution (Team_051): OG Siakam OUT → Jrue Carter IN (stamina_rule2)

[03:26] Substitution (Team_007): Bones Siakam OUT → Gary LaVine IN (stamina_rule2)

[03:26] Substitution (Team_007): John Quickley OUT → Austin Simons IN (stamina_rule2)

[03:26] Substitution (Team_007): Carmelo Siakam OUT → Draymond Harris IN (stamina_rule2)

[03:12] Team_051 possession (Score: 81-98)
Pau Tatum attempts a Midrange. Contested by Gary LaVine (4.2 feet, ZONE). PAU TATUM MAKES IT!
Score: 83-98

[02:59] Team_007 possession (Score: 83-98)
Gary LaVine attempts a Layup. Contested by Jrue Carter (4.8 feet, MAN). GARY LAVINE MAKES IT!
Score: 83-100

[02:41] Team_051 possession (Score: 83-100)
Jrue Carter attempts a 3Pt. Contested by OG Porzingis (4.6 feet, ZONE). Jrue Carter misses. Rebound secured by Gary LaVine.

[02:25] Team_007 possession (Score: 83-100)
Gary LaVine attempts a Midrange. Contested by Jrue Carter (4.8 feet, MAN). Gary LaVine misses. Offensive rebound by Austin Simons! Austin Simons puts it back in!
Score: 83-102

[02:09] Team_051 possession (Score: 83-102)
Zion Morant attempts a 3Pt. Contested by OG Porzingis (4.7 feet, MAN). Zion Morant misses. Rebound secured by Draymond Harris.

[01:54] Team_007 possession (Score: 83-102)
Draymond Harris attempts a Layup. Contested by Pau Tatum (4.5 feet, ZONE). DRAYMOND HARRIS MAKES IT! Assist: OG Porzingis
Score: 83-104

[01:38] Team_051 possession (Score: 83-104)
Zion Morant attempts a 3Pt. Contested by OG Porzingis (4.7 feet, ZONE). Zion Morant misses. Rebound secured by Draymond Harris.

[01:23] Team_007 possession (Score: 83-104)
OG Porzingis makes the Layup and draws the foul on Pau Tatum! And-1! OG Porzingis to the line for 1. [BONUS: 5 team fouls] (Pau Tatum: 2 personal fouls)   FT 1/1: GOOD OG Porzingis makes 1/1 from the line.
Score: 83-107

[01:10] Team_051 possession (Score: 83-107)
FOUL! Holding foul on Gary LaVine. [Team fouls: 3] No free throws, side out. (Gary LaVine: 1 personal fouls)

[00:55] Team_051 possession (Score: 83-107)
Tobias Jokic attempts a Midrange. Contested by Austin Simons (3.9 feet, MAN). Tobias Jokic misses. Offensive rebound by Tobias Jokic! Tobias Jokic kicks it out.

[00:39] Team_051 possession (Score: 83-107)
Jrue Carter attempts a 3Pt. Contested by Gary LaVine (4.6 feet, MAN). Jrue Carter misses. Offensive rebound by Tobias Jokic! Tobias Jokic kicks it out.

[00:26] Team_051 possession (Score: 83-107)
Tobias Jokic drives to the basket... FOUL! Offensive foul on Tobias Jokic! Austin Simons drew the charge! [Team fouls: 6] (Tobias Jokic: 2 personal fouls) TURNOVER! (dead ball)

[00:12] Team_007 possession (Score: 83-107)
Gary LaVine attempts a 3Pt. Contested by Myles Harden (5.3 feet, ZONE). Gary LaVine misses. Rebound secured by Tobias Jokic.

================================================================================
                              4TH QUARTER COMPLETE                              
================================================================================

4TH QUARTER SCORE: Team_051 17, Team_007 23

BOX SCORE:
================================================================================

Team_051
--------------------------------------------------------------------------------
Player                MIN  PTS  REB  AST  TO      FG   FG%      3P   3P%
--------------------------------------------------------------------------------
Pau Tatum              22    8    3    1   0   4/7    57.1     0/0   0.0
Larry McGrady          32    4    0    0   0   2/3    66.7     0/0   0.0
Tobias Jokic           22    3    5    0   0   1/2    50.0     0/0   0.0
Myles Harden           23    2    1    2   0   1/2    50.0     0/0   0.0
OG Siakam              32    0    2    0   0   0/0     0.0     0/0   0.0
Jrue Carter            16    0    0    0   0   0/1     0.0     0/0   0.0
Zion Morant            16    0    0    0   0   0/2     0.0     0/0   0.0

TEAM: FG: 8/17 (47.1%), 3PT: 1/7 (14.3%), REB: 11 (4 off, 7 def), AST: 3, TO: 3
TEAM FOULS: 6 [Team_007 in BONUS]


Team_007
--------------------------------------------------------------------------------
Player                MIN  PTS  REB  AST  TO      FG   FG%      3P   3P%
--------------------------------------------------------------------------------
OG Porzingis           22    7    0    2   0   3/3   100.0     0/0   0.0
Carmelo Siakam         32    4    3    0   0   2/5    40.0     0/0   0.0
Bones Siakam           32    3    2    2   0   1/2    50.0     0/0   0.0
Wendell Poole          23    3    0    1   0   1/1   100.0     0/0   0.0
Gary LaVine            16    2    1    0   0   1/2    50.0     0/0   0.0
Austin Simons          16    2    1    0   0   1/1   100.0     0/0   0.0
Draymond Harris        16    2    2    0   0   1/1   100.0     0/0   0.0
John Quickley          32    0    2    0   0   0/2     0.0     0/0   0.0

TEAM: FG: 10/17 (58.8%), 3PT: 1/3 (33.3%), REB: 11 (2 off, 9 def), AST: 5, TO: 3
TEAM FOULS: 3

================================================================================

================================================================================
                               FULL GAME COMPLETE                               
================================================================================

FINAL SCORE: Team_051 83, Team_007 107

SCORING BY QUARTER:
--------------------------------------------------------------------------------
Team                     Q1     Q2     Q3     Q4    FINAL
--------------------------------------------------------------------------------
Team_051                 25     16     25     17       83
Team_007                 31     26     27     23      107
--------------------------------------------------------------------------------

FULL GAME BOX SCORE:
================================================================================

Team_051
--------------------------------------------------------------------------------
Player                MIN  PTS  REB  AST  TO      FG   FG%      3P   3P%      FT STL BLK
--------------------------------------------------------------------------------
Larry McGrady          32   16    0    1   1   8/12   66.7   2/4    50.0   0/0     0   0
OG Siakam              32    4    6    0   1   2/9    22.2   0/4     0.0   0/0     0   0
Franz Simmons          27    3    9    4   2   4/7    57.1   0/1     0.0   1/3     1   0
Shaquille Harden       27   14    7    0   0   5/10   50.0   0/0     0.0   6/6     0   1
Austin Sexton          26   12    0    3   2   5/10   50.0   1/2    50.0   4/6     0   0
Myles Harden           23    7    4    2   0   3/4    75.0   1/2    50.0   2/2     0   0
Tobias Jokic           22    3    8    0   1   1/7    14.3   1/3    33.3   0/0     0   0
Pau Tatum              22   12    8    1   1   5/12   41.7   0/4     0.0   5/8     0   1
Zion Morant            16    0    0    1   1   0/5     0.0   0/3     0.0   0/0     2   0
Jrue Carter            16    3    1    0   2   1/4    25.0   1/3    33.3   0/0     0   0

TEAM: FG: 34/80 (42.5%), 3PT: 6/26 (23.1%), REB: 45 (9 off, 36 def), AST: 12, TO: 11


Team_007
--------------------------------------------------------------------------------
Player                MIN  PTS  REB  AST  TO      FG   FG%      3P   3P%      FT STL BLK
--------------------------------------------------------------------------------
Bones Siakam           32    9   10    4   2   3/7    42.9   1/4    25.0   3/5     0   1
John Quickley          32    9    9    1   0   2/7    28.6   2/4    50.0   0/0     2   1
Carmelo Siakam         32   15   10    4   2   9/14   64.3   1/1   100.0   0/0     0   0
Jaren Dosunmu          27   19    0    5   3   6/11   54.5   3/5    60.0   2/2     1   0
Tobias Johnson         26   13    0    3   2   6/9    66.7   2/4    50.0   4/5     2   0
Wendell Poole          23    3    0    1   0   1/2    50.0   1/2    50.0   0/0     0   0
OG Porzingis           22   10    0    2   1   5/7    71.4   0/1     0.0   4/4     0   0
Gary LaVine            16   10    5    0   0   4/10   40.0   2/3    66.7   2/5     0   0
Austin Simons          16   12    6    1   1   3/7    42.9   0/2     0.0   2/2     1   1
Draymond Harris        16    4   10    1   0   2/4    50.0   0/0     0.0   2/2     0   0

TEAM: FG: 42/79 (53.2%), 3PT: 12/26 (46.2%), REB: 48 (6 off, 42 def), AST: 22, TO: 11

================================================================================
