================================================================================
                        FULL GAME - Team_031 vs Team_003                        
================================================================================

================================================================================
                       1ST QUARTER - Team_031 vs Team_003                       
================================================================================

[12:00] Team_031 possession (Score: 0-0)
Shai Durant attempts a 3Pt. Contested by Giannis Turner (2.9 feet, ZONE). Shai Durant misses. Offensive rebound by Immanuel James! Immanuel James's putback is no good. Rebound secured by Rudy Haliburton.

[11:46] Team_003 possession (Score: 0-0)
Giannis Turner attempts a Midrange. Contested by Immanuel James (3.3 feet, MAN). Giannis Turner misses. Offensive rebound by Rudy Haliburton! Rudy Haliburton puts it back in!
Score: 0-2

[11:36] Team_031 possession (Score: 0-2)
Gary Morant attempts a 3Pt. Contested by Giannis Turner (3.4 feet, ZONE). Gary Morant misses. Rebound secured by Giannis Turner.

[11:20] Team_003 possession (Score: 0-2)
Rudy Haliburton attempts a Midrange. BLOCKED BY PAU IRVING! Ball deflects out of bounds off Rudy Haliburton.

[11:04] Team_031 possession (Score: 0-2)
Pau Irving loses the ball! Stripped by Rudy Haliburton! TURNOVER! (live ball)

[10:45] Team_003 possession (Score: 0-2)
Ayo Jackson attempts a Midrange. Contested by Shai Durant (4.2 feet, MAN). Ayo Jackson misses. Rebound secured by Gary Morant.

[10:29] Team_031 possession (Score: 0-2)
FOUL! Holding foul on Nikola Bryant. [Team fouls: 1] No free throws, side out. (Nikola Bryant: 1 personal fouls)

[10:11] Team_031 possession (Score: 0-2)
Luka Sabonis attempts a Midrange. Contested by Giannis Turner (3.4 feet, MAN). Luka Sabonis misses. Rebound secured by Giannis Turner.

[09:54] Team_003 possession (Score: 0-2)
Giannis Turner drives, Immanuel James stays with him. Giannis Turner attempts a Dunk. Contested by Immanuel James (3.3 feet, ZONE). GIANNIS TURNER MAKES IT!
Score: 0-4

[09:39] Team_031 possession (Score: 0-4)
Luka Sabonis attempts a 3Pt. Contested by Giannis Turner (3.4 feet, ZONE). LUKA SABONIS MAKES IT! Assist: Shai Durant
Score: 3-4

[09:24] Team_003 possession (Score: 3-4)
Ayo Jackson drives, Immanuel James stays with him. Ayo Jackson attempts a Layup. Contested by Immanuel James (3.3 feet, ZONE). Ayo Jackson misses. Rebound secured by Luka Sabonis.

[09:08] Team_031 possession (Score: 3-4)
Immanuel James attempts a 3Pt. Contested by Giannis Turner (3.2 feet, MAN). IMMANUEL JAMES MAKES IT! Assist: Luka Sabonis
Score: 6-4

[08:50] Team_003 possession (Score: 6-4)
Giannis Turner attempts a Midrange. Contested by Gary Morant (4.1 feet, ZONE). Giannis Turner misses. Rebound secured by Gary Morant.

[08:34] Team_031 possession (Score: 6-4)
FOUL! Offensive foul on Gary Morant! Nikola Bryant drew the charge! [Team fouls: 1] (Gary Morant: 1 personal fouls) TURNOVER! (dead ball)

[08:17] Team_003 possession (Score: 6-4)
Ayo Jackson attempts a 3Pt. Contested by Shai Durant (4.2 feet, MAN). Ayo Jackson misses. Offensive rebound by Victor O'Neal! Victor O'Neal kicks it out.

[07:59] Team_003 possession (Score: 6-4)
Rudy Haliburton attempts a 3Pt. Contested by Pau Irving (3.6 feet, ZONE). Rudy Haliburton misses. Offensive rebound by Rudy Haliburton! Rudy Haliburton's putback is no good. Rebound secured by Luka Sabonis.

[07:42] Team_031 possession (Score: 6-4)
Shai Durant attempts a Layup. Contested by Giannis Turner (2.9 feet, ZONE). Shai Durant misses. Rebound secured by Victor O'Neal.

[07:27] Team_003 possession (Score: 6-4)
FOUL! Shooting foul on Gary Morant. Nikola Bryant to the line for 2 free throws. [Team fouls: 2] (Gary Morant: 2 personal fouls)   FT 1/2: MISS   FT 2/2: MISS Nikola Bryant makes 0/2 from the line. Rebound secured by Gary Morant.

[07:14] Team_031 possession (Score: 6-4)
FOUL! Shooting foul on Giannis Turner. Pau Irving to the line for 2 free throws. [Team fouls: 2] (Giannis Turner: 1 personal fouls)   FT 1/2: MISS   FT 2/2: GOOD Pau Irving makes 1/2 from the line.
Score: 7-4

[07:02] Team_003 possession (Score: 7-4)
Rudy Haliburton attempts a 3Pt. Contested by Pau Irving (3.6 feet, ZONE). RUDY HALIBURTON MAKES IT! Assist: Ayo Jackson
Score: 7-7

[06:44] Team_031 possession (Score: 7-7)
FOUL! Holding foul on Giannis Turner. [Team fouls: 3] No free throws, side out. (Giannis Turner: 2 personal fouls)

[06:27] Team_031 possession (Score: 7-7)
Gary Morant makes the Layup and draws the foul on Rudy Haliburton! And-1! Gary Morant to the line for 1. [Team fouls: 4] (Rudy Haliburton: 1 personal fouls)   FT 1/1: GOOD Gary Morant makes 1/1 from the line.
Score: 10-7

[06:15] Team_003 possession (Score: 10-7)
Ayo Jackson attempts a 3Pt. Contested by Shai Durant (4.2 feet, MAN). AYO JACKSON MAKES IT! Assist: Nikola Bryant
Score: 10-10

[06:01] Team_031 possession (Score: 10-10)
Gary Morant drives, picks up Giannis Turner. Help arrives from Nikola Bryant! Gary Morant attempts a Dunk. Contested by Nikola Bryant (3.4 feet, ZONE). GARY MORANT MAKES IT! Assist: Luka Sabonis
Score: 12-10

[05:45] Team_003 possession (Score: 12-10)
Rudy Haliburton attempts a Midrange. Contested by Immanuel James (3.1 feet, ZONE). Rudy Haliburton misses. Rebound secured by Immanuel James.

[05:29] Team_031 possession (Score: 12-10)
Immanuel James drives and kicks out. Pau Irving attempts a Midrange. Contested by Rudy Haliburton (3.3 feet, MAN). Pau Irving misses. Rebound secured by Victor O'Neal.

[05:15] Team_003 possession (Score: 12-10)
Ayo Jackson attempts a Layup. Contested by Shai Durant (4.2 feet, MAN). AYO JACKSON MAKES IT! Assist: Victor O'Neal
Score: 12-12

[05:00] Team_031 possession (Score: 12-12)
Luka Sabonis makes the Layup and draws the foul on Nikola Bryant! And-1! Luka Sabonis to the line for 1. [BONUS: 5 team fouls] (Nikola Bryant: 2 personal fouls)   FT 1/1: GOOD Luka Sabonis makes 1/1 from the line.
Score: 15-12

[04:43] Team_003 possession (Score: 15-12)
Nikola Bryant drives, Gary Morant stays with him. Nikola Bryant attempts a Layup. Contested by Gary Morant (4.1 feet, MAN). Nikola Bryant misses. Rebound secured by Gary Morant.

[04:33] Team_031 possession (Score: 15-12)
Shai Durant attempts a 3Pt. Contested by Nikola Bryant (4.2 feet, ZONE). Shai Durant misses. Rebound secured by Giannis Turner.

[04:13] Team_003 possession (Score: 15-12)
Giannis Turner makes the Midrange and draws the foul on Immanuel James! And-1! Giannis Turner to the line for 1. [Team fouls: 3] (Immanuel James: 1 personal fouls)   FT 1/1: GOOD Giannis Turner makes 1/1 from the line.
Score: 15-15

[03:56] Team_031 possession (Score: 15-15)
Shai Durant attempts a Midrange. Contested by Ayo Jackson (5.4 feet, MAN). Shai Durant misses. Rebound secured by Rudy Haliburton.

[03:41] Team_003 possession (Score: 15-15)
Ayo Jackson makes the Layup and draws the foul on Shai Durant! And-1! Ayo Jackson to the line for 1. [Team fouls: 4] (Shai Durant: 1 personal fouls)   FT 1/1: GOOD Ayo Jackson makes 1/1 from the line.
Score: 15-18

[03:23] Team_031 possession (Score: 15-18)
Gary Morant attempts a 3Pt. Contested by Giannis Turner (3.5 feet, ZONE). Gary Morant misses. Rebound secured by Victor O'Neal.

[03:08] Team_003 possession (Score: 15-18)
Victor O'Neal attempts a Midrange. Contested by Gary Morant (3.8 feet, ZONE). VICTOR O'NEAL MAKES IT! Assist: Ayo Jackson
Score: 15-20

[02:53] Team_031 possession (Score: 15-20)
Immanuel James attempts a Midrange. Contested by Nikola Bryant (4.5 feet, ZONE). Immanuel James misses. Offensive rebound by Immanuel James! Immanuel James puts it back in!
Score: 17-20

[02:39] Team_003 possession (Score: 17-20)
FOUL! Reach-in foul on Gary Morant during the drive. [IN THE BONUS! 5 team fouls] Nikola Bryant to the line for 2 free throws. (Gary Morant: 3 personal fouls)   FT 1/2: GOOD   FT 2/2: GOOD Nikola Bryant makes 2/2 from the line.
Score: 17-22

[02:29] Team_031 possession (Score: 17-22)
Immanuel James attempts a 3Pt. Contested by Giannis Turner (3.4 feet, ZONE). Immanuel James misses. Rebound secured by Rudy Haliburton.

[02:12] Team_003 possession (Score: 17-22)
Nikola Bryant throws a bad pass out of bounds! TURNOVER! (dead ball)

[02:12] Substitution (Team_031): Immanuel James OUT → Kobe Randle IN (stamina_rule2)

[02:12] Substitution (Team_031): Luka Sabonis OUT → Jimmy Poole IN (stamina_rule2)

[01:56] Team_031 possession (Score: 17-22)
Shai Durant attempts a 3Pt. Contested by Ayo Jackson (5.6 feet, MAN). Shai Durant misses. Rebound secured by Victor O'Neal.

[01:38] Team_003 possession (Score: 17-22)
Ayo Jackson attempts a 3Pt. Contested by Pau Irving (4.1 feet, ZONE). Ayo Jackson misses. Rebound secured by Jimmy Poole.

[01:23] Team_031 possession (Score: 17-22)
FOUL! Offensive foul on Pau Irving! Rudy Haliburton drew the charge! [Team fouls: 6] (Pau Irving: 1 personal fouls) TURNOVER! (dead ball)

[01:07] Team_003 possession (Score: 17-22)
Victor O'Neal drives, Jimmy Poole stays with him. Victor O'Neal attempts a Layup. Contested by Jimmy Poole (5.6 feet, MAN). VICTOR O'NEAL MAKES IT! Assist: Ayo Jackson
Score: 17-24

[00:49] Team_031 possession (Score: 17-24)
Gary Morant attempts a Midrange. Contested by Nikola Bryant (4.9 feet, MAN). Gary Morant misses. Rebound secured by Rudy Haliburton.

[00:35] Team_003 possession (Score: 17-24)
Victor O'Neal attempts a Layup. Contested by Kobe Randle (4.3 feet, ZONE). Victor O'Neal misses. Rebound secured by Kobe Randle.

[00:22] Team_031 possession (Score: 17-24)
Shai Durant attempts a 3Pt. Contested by Giannis Turner (3.4 feet, ZONE). Shai Durant misses. Rebound secured by Victor O'Neal.

[00:10] Team_003 possession (Score: 17-24)
Rudy Haliburton drives, Pau Irving stays with him. Rudy Haliburton attempts a Layup. Contested by Pau Irving (4.1 feet, MAN). RUDY HALIBURTON MAKES IT! Assist: Ayo Jackson
Score: 17-26

================================================================================
                              1ST QUARTER COMPLETE                              
================================================================================

1ST QUARTER SCORE: Team_031 17, Team_003 26

BOX SCORE:
================================================================================

Team_031
--------------------------------------------------------------------------------
Player                MIN  PTS  REB  AST  TO      FG   FG%      3P   3P%
--------------------------------------------------------------------------------
Luka Sabonis           10    6    2    2   0   2/3    66.7     0/0   0.0
Gary Morant            12    5    4    0   0   2/5    40.0     0/0   0.0
Immanuel James         10    5    2    0   0   2/4    50.0     0/0   0.0
Pau Irving             12    1    0    0   0   1/1   100.0     0/0   0.0
Shai Durant            12    0    0    1   0   0/6     0.0     0/0   0.0
Jimmy Poole             2    0    1    0   0   0/0     0.0     0/0   0.0
Kobe Randle             2    0    1    0   0   0/0     0.0     0/0   0.0

TEAM: FG: 7/19 (36.8%), 3PT: 2/9 (22.2%), REB: 10 (2 off, 8 def), AST: 3, TO: 3
TEAM FOULS: 6 [Team_003 in BONUS]


Team_003
--------------------------------------------------------------------------------
Player                MIN  PTS  REB  AST  TO      FG   FG%      3P   3P%
--------------------------------------------------------------------------------
Ayo Jackson            12    8    0    4   0   3/6    50.0     0/0   0.0
Rudy Haliburton        12    7    5    0   0   3/6    50.0     0/0   0.0
Giannis Turner         12    5    3    0   0   2/3    66.7     0/0   0.0
Victor O'Neal          12    4    6    1   0   2/3    66.7     0/0   0.0
Nikola Bryant          12    2    0    1   0   1/3    33.3     0/0   0.0

TEAM: FG: 11/21 (52.4%), 3PT: 2/4 (50.0%), REB: 14 (3 off, 11 def), AST: 6, TO: 1
TEAM FOULS: 5 [Team_031 in BONUS]

================================================================================

================================================================================
                       2ND QUARTER - Team_031 vs Team_003                       
================================================================================

[12:00] Team_031 possession (Score: 17-26)
Pau Irving attempts a Midrange. Contested by Rudy Haliburton (3.5 feet, MAN). Pau Irving misses. Rebound secured by Victor O'Neal.

[11:45] Team_003 possession (Score: 17-26)
Nikola Bryant drives and kicks out. Victor O'Neal attempts a Midrange. Contested by Pau Irving (3.9 feet, ZONE). Victor O'Neal misses. Rebound secured by Immanuel James.

[11:32] Team_031 possession (Score: 17-26)
Shai Durant attempts a 3Pt. Contested by Ayo Jackson (5.6 feet, MAN). Shai Durant misses. Rebound secured by Victor O'Neal.

[11:20] Team_003 possession (Score: 17-26)
Giannis Turner drives, Immanuel James stays with him. Giannis Turner attempts a Dunk. Contested by Immanuel James (3.4 feet, ZONE). GIANNIS TURNER MAKES IT! Assist: Ayo Jackson
Score: 17-28

[11:02] Team_031 possession (Score: 17-28)
Gary Morant attempts a 3Pt. Wide open! Ayo Jackson is 6.1 feet away. [ZONE] Gary Morant misses. FOUL! Loose ball foul on Victor O'Neal during the rebound battle. [Team fouls: 1] No free throws, side out. (Victor O'Neal: 1 personal fouls)

[10:49] Team_031 possession (Score: 17-28)
Luka Sabonis attempts a 3Pt. Contested by Giannis Turner (3.8 feet, ZONE). Luka Sabonis misses. Rebound secured by Giannis Turner.

[10:39] Team_003 possession (Score: 17-28)
Nikola Bryant attempts a 3Pt. Contested by Gary Morant (4.4 feet, ZONE). Nikola Bryant misses. Rebound secured by Luka Sabonis.

[10:25] Team_031 possession (Score: 17-28)
Immanuel James attempts a Midrange. Contested by Giannis Turner (3.7 feet, MAN). Immanuel James misses. Offensive rebound by Immanuel James! Immanuel James's putback is no good. Rebound secured by Rudy Haliburton.

[10:15] Team_003 possession (Score: 17-28)
Rudy Haliburton drives, Immanuel James stays with him. Rudy Haliburton attempts a Layup. Contested by Immanuel James (3.3 feet, ZONE). RUDY HALIBURTON MAKES IT! Assist: Ayo Jackson
Score: 17-30

[10:02] Team_031 possession (Score: 17-30)
Luka Sabonis drives, Victor O'Neal stays with him. Luka Sabonis attempts a Dunk. Contested by Victor O'Neal (5.3 feet, ZONE). LUKA SABONIS MAKES IT!
Score: 19-30

[09:45] Team_003 possession (Score: 19-30)
Ayo Jackson drives, picks up Immanuel James. Help arrives from Shai Durant! Ayo Jackson attempts a Dunk. Contested by Shai Durant (3.6 feet, ZONE). AYO JACKSON MAKES IT! Assist: Victor O'Neal
Score: 19-32

[09:33] Team_031 possession (Score: 19-32)
Pau Irving attempts a 3Pt. Contested by Giannis Turner (3.4 feet, ZONE). Pau Irving misses. Rebound secured by Giannis Turner.

[09:17] Team_003 possession (Score: 19-32)
Giannis Turner attempts a 3Pt. Contested by Pau Irving (4.4 feet, ZONE). Giannis Turner misses. Rebound secured by Gary Morant.

[09:08] Team_031 possession (Score: 19-32)
Gary Morant attempts a Midrange. Contested by Giannis Turner (4.0 feet, ZONE). Gary Morant misses. Rebound secured by Giannis Turner.

[08:51] Team_003 possession (Score: 19-32)
Rudy Haliburton attempts a Midrange. Contested by Pau Irving (4.3 feet, MAN). RUDY HALIBURTON MAKES IT! Assist: Nikola Bryant
Score: 19-34

[08:38] Team_031 possession (Score: 19-34)
Luka Sabonis attempts a Midrange. Contested by Giannis Turner (4.1 feet, MAN). Luka Sabonis misses. Rebound secured by Victor O'Neal.

[08:26] Team_003 possession (Score: 19-34)
Nikola Bryant attempts a Midrange. Contested by Gary Morant (4.7 feet, MAN). NIKOLA BRYANT MAKES IT!
Score: 19-36

[08:14] Team_031 possession (Score: 19-36)
Immanuel James drives and kicks out. Pau Irving attempts a 3Pt. Contested by Ayo Jackson (6.0 feet, ZONE). Pau Irving misses. Rebound secured by Rudy Haliburton.

[07:56] Team_003 possession (Score: 19-36)
Ayo Jackson attempts a 3Pt. Contested by Shai Durant (4.8 feet, MAN). Ayo Jackson misses. Rebound secured by Luka Sabonis.

[07:40] Team_031 possession (Score: 19-36)
Immanuel James makes the Dunk and draws the foul on Nikola Bryant! And-1! Immanuel James to the line for 1. [Team fouls: 2] (Nikola Bryant: 1 personal fouls)   FT 1/1: GOOD Immanuel James makes 1/1 from the line.
Score: 22-36

[07:23] Team_003 possession (Score: 22-36)
Nikola Bryant throws a bad pass! Stolen by Gary Morant! TURNOVER! (live ball)

[07:08] Team_031 possession (Score: 22-36)
Immanuel James drives and kicks out. Gary Morant attempts a Midrange. Contested by Nikola Bryant (4.9 feet, ZONE). Gary Morant misses. Offensive rebound by Luka Sabonis! Luka Sabonis's putback is no good. Rebound secured by Giannis Turner.

[06:50] Team_003 possession (Score: 22-36)
Victor O'Neal attempts a 3Pt. Contested by Immanuel James (3.7 feet, ZONE). VICTOR O'NEAL MAKES IT!
Score: 22-39

[06:34] Team_031 possession (Score: 22-39)
Gary Morant makes the Midrange and draws the foul on Nikola Bryant! And-1! Gary Morant to the line for 1. [Team fouls: 3] (Nikola Bryant: 2 personal fouls)   FT 1/1: GOOD Gary Morant makes 1/1 from the line.
Score: 25-39

[06:15] Team_003 possession (Score: 25-39)
Rudy Haliburton drives to the basket... Rudy Haliburton throws a bad pass! Stolen by Pau Irving! TURNOVER! (live ball)

[06:05] Team_031 possession (Score: 25-39)
Gary Morant attempts a 3Pt. Contested by Giannis Turner (4.4 feet, ZONE). Gary Morant misses. Rebound secured by Victor O'Neal.

[05:50] Team_003 possession (Score: 25-39)
Giannis Turner attempts a 3Pt. Contested by Immanuel James (4.2 feet, MAN). Giannis Turner misses. Offensive rebound by Victor O'Neal! Victor O'Neal kicks it out.

[05:35] Team_003 possession (Score: 25-39)
Rudy Haliburton attempts a Midrange. Contested by Immanuel James (4.0 feet, ZONE). RUDY HALIBURTON MAKES IT! Assist: Giannis Turner
Score: 25-41

[05:15] Team_031 possession (Score: 25-41)
Gary Morant attempts a 3Pt. Contested by Nikola Bryant (5.5 feet, MAN). Gary Morant misses. Rebound secured by Victor O'Neal.

[04:58] Team_003 possession (Score: 25-41)
Rudy Haliburton attempts a 3Pt. Contested by Pau Irving (4.8 feet, MAN). RUDY HALIBURTON MAKES IT! Assist: Victor O'Neal
Score: 25-44

[04:41] Team_031 possession (Score: 25-44)
Shai Durant loses the ball! Stripped by Ayo Jackson! TURNOVER! (live ball)

[04:28] Team_003 possession (Score: 25-44)
Giannis Turner throws a bad pass! Stolen by Immanuel James! TURNOVER! (live ball)

[04:18] Team_031 possession (Score: 25-44)
Immanuel James attempts a 3Pt. Contested by Giannis Turner (4.6 feet, ZONE). IMMANUEL JAMES MAKES IT! Assist: Pau Irving
Score: 28-44

[04:01] Team_003 possession (Score: 28-44)
Rudy Haliburton attempts a Layup. Contested by Immanuel James (4.3 feet, ZONE). RUDY HALIBURTON MAKES IT!
Score: 28-46

[03:47] Team_031 possession (Score: 28-46)
Gary Morant attempts a 3Pt. Contested by Nikola Bryant (5.7 feet, MAN). GARY MORANT MAKES IT!
Score: 31-46

[03:36] Team_003 possession (Score: 31-46)
Rudy Haliburton drives and kicks out. Victor O'Neal attempts a Midrange. Contested by Gary Morant (5.3 feet, ZONE). Victor O'Neal misses. Offensive rebound by Rudy Haliburton! Rudy Haliburton kicks it out.

[03:22] Team_003 possession (Score: 31-46)
Giannis Turner drives to the basket... Giannis Turner loses control! Ball rolls out of bounds! TURNOVER! (dead ball)

[03:22] Substitution (Team_031): Shai Durant OUT → Kevin Morant IN (stamina_rule2)

[03:22] Substitution (Team_031): Gary Morant OUT → Isaiah Ingram IN (stamina_rule2)

[03:22] Substitution (Team_031): Pau Irving OUT → Miles Stewart IN (stamina_rule2)

[03:22] Substitution (Team_031): Immanuel James OUT → Kobe Randle IN (stamina_rule2)

[03:22] Substitution (Team_031): Luka Sabonis OUT → Jimmy Poole IN (stamina_rule2)

[03:22] Substitution (Team_003): Ayo Jackson OUT → Miles Towns IN (stamina_rule2)

[03:22] Substitution (Team_003): Nikola Bryant OUT → Pau Williamson IN (stamina_rule2)

[03:22] Substitution (Team_003): Rudy Haliburton OUT → Collin Mitchell IN (stamina_rule2)

[03:22] Substitution (Team_003): Giannis Turner OUT → Anfernee Jordan IN (stamina_rule2)

[03:22] Substitution (Team_003): Victor O'Neal OUT → Bam Gilgeous-Alexander IN (stamina_rule2)

[03:11] Team_031 possession (Score: 31-46)
Jimmy Poole drives and kicks out. Jimmy Poole attempts a 3Pt. Contested by Bam Gilgeous-Alexander (3.0 feet, MAN). Jimmy Poole misses. Rebound secured by Anfernee Jordan.

[02:56] Team_003 possession (Score: 31-46)
Anfernee Jordan attempts a Layup. Contested by Kobe Randle (4.3 feet, MAN). Anfernee Jordan misses. FOUL! Loose ball foul on Kobe Randle during the rebound battle. [Team fouls: 1] No free throws, side out. (Kobe Randle: 1 personal fouls)

[02:37] Team_003 possession (Score: 31-46)
Bam Gilgeous-Alexander drives, picks up Kobe Randle. Help arrives from Isaiah Ingram! Bam Gilgeous-Alexander attempts a Layup. Contested by Isaiah Ingram (5.1 feet, ZONE). BAM GILGEOUS-ALEXANDER MAKES IT! Assist: Miles Towns
Score: 31-48

[02:22] Team_031 possession (Score: 31-48)
Miles Stewart attempts a 3Pt. Contested by Miles Towns (5.3 feet, ZONE). Miles Stewart misses. Rebound secured by Collin Mitchell.

[02:10] Team_003 possession (Score: 31-48)
FOUL! Offensive foul on Collin Mitchell! Miles Stewart drew the charge! [Team fouls: 4] (Collin Mitchell: 1 personal fouls) TURNOVER! (dead ball)

[01:56] Team_031 possession (Score: 31-48)
Miles Stewart makes the Layup and draws the foul on Bam Gilgeous-Alexander! And-1! Miles Stewart to the line for 1. [BONUS: 5 team fouls] (Bam Gilgeous-Alexander: 1 personal fouls)   FT 1/1: GOOD Miles Stewart makes 1/1 from the line.
Score: 34-48

[01:42] Team_003 possession (Score: 34-48)
Collin Mitchell attempts a Layup. BLOCKED BY MILES STEWART! Ball goes out off Miles Stewart. Collin Mitchell's ball!

[01:22] Team_003 possession (Score: 34-48)
Pau Williamson attempts a Layup. Contested by Isaiah Ingram (4.2 feet, MAN). PAU WILLIAMSON MAKES IT! Assist: Collin Mitchell
Score: 34-50

[01:07] Team_031 possession (Score: 34-50)
Isaiah Ingram attempts a 3Pt. Contested by Pau Williamson (5.6 feet, MAN). Isaiah Ingram misses. Rebound secured by Collin Mitchell.

[00:48] Team_003 possession (Score: 34-50)
Bam Gilgeous-Alexander drives to the basket... Bam Gilgeous-Alexander loses control! Ball rolls out of bounds! TURNOVER! (dead ball)

[00:32] Team_031 possession (Score: 34-50)
Jimmy Poole attempts a Layup. Contested by Bam Gilgeous-Alexander (2.9 feet, MAN). Jimmy Poole misses. Rebound secured by Anfernee Jordan.

[00:15] Team_003 possession (Score: 34-50)
Pau Williamson attempts a Midrange. Contested by Isaiah Ingram (4.2 feet, MAN). Pau Williamson misses. Rebound secured by Isaiah Ingram.

[00:01] Team_031 possession (Score: 34-50)
Miles Stewart attempts a 3Pt. Contested by Miles Towns (5.3 feet, ZONE). Miles Stewart misses. Rebound secured by Anfernee Jordan.

================================================================================
                              2ND QUARTER COMPLETE                              
================================================================================

2ND QUARTER SCORE: Team_031 17, Team_003 24

BOX SCORE:
================================================================================

Team_031
--------------------------------------------------------------------------------
Player                MIN  PTS  REB  AST  TO      FG   FG%      3P   3P%
--------------------------------------------------------------------------------
Immanuel James         19    6    1    0   0   2/5    40.0     0/0   0.0
Gary Morant            21    6    1    0   0   2/5    40.0     0/0   0.0
Miles Stewart           3    3    0    0   0   1/3    33.3     0/0   0.0
Luka Sabonis           19    2    3    0   0   1/3    33.3     0/0   0.0
Pau Irving             21    0    0    1   0   0/2     0.0     0/0   0.0
Shai Durant            21    0    0    0   0   0/1     0.0     0/0   0.0
Jimmy Poole             6    0    0    0   0   0/2     0.0     0/0   0.0
Isaiah Ingram           3    0    1    0   0   0/1     0.0     0/0   0.0

TEAM: FG: 6/22 (27.3%), 3PT: 2/10 (20.0%), REB: 8 (3 off, 5 def), AST: 1, TO: 1
TEAM FOULS: 1


Team_003
--------------------------------------------------------------------------------
Player                MIN  PTS  REB  AST  TO      FG   FG%      3P   3P%
--------------------------------------------------------------------------------
Rudy Haliburton        21   11    3    0   0   5/5   100.0     0/0   0.0
Victor O'Neal          21    3    6    2   0   1/1   100.0     0/0   0.0
Nikola Bryant          21    2    0    1   0   1/3    33.3     0/0   0.0
Giannis Turner         21    2    4    1   0   1/2    50.0     0/0   0.0
Ayo Jackson            21    2    0    2   0   1/2    50.0     0/0   0.0
Bam Gilgeous-Alexander    3    2    0    0   0   1/1   100.0     0/0   0.0
Pau Williamson          3    2    0    0   0   1/2    50.0     0/0   0.0
Anfernee Jordan         3    0    3    0   0   0/0     0.0     0/0   0.0
Collin Mitchell         3    0    3    1   0   0/0     0.0     0/0   0.0
Miles Towns             3    0    0    1   0   0/0     0.0     0/0   0.0

TEAM: FG: 11/16 (68.8%), 3PT: 2/5 (40.0%), REB: 17 (3 off, 14 def), AST: 8, TO: 6
TEAM FOULS: 5 [Team_031 in BONUS]

================================================================================

================================================================================
                       3RD QUARTER - Team_031 vs Team_003                       
================================================================================

[12:00] Team_031 possession (Score: 34-50)
Shai Durant attempts a 3Pt. Contested by Giannis Turner (2.9 feet, ZONE). SHAI DURANT MAKES IT! Assist: Gary Morant
Score: 37-50

[11:49] Team_003 possession (Score: 37-50)
Nikola Bryant throws a bad pass! Stolen by Gary Morant! TURNOVER! (live ball)

[11:37] Team_031 possession (Score: 37-50)
Gary Morant attempts a Midrange. Contested by Nikola Bryant (4.6 feet, MAN). GARY MORANT MAKES IT! Assist: Immanuel James
Score: 39-50

[11:25] Team_003 possession (Score: 39-50)
Rudy Haliburton makes the Midrange and draws the foul on Shai Durant! And-1! Rudy Haliburton to the line for 1. [Team fouls: 1] (Shai Durant: 1 personal fouls)   FT 1/1: GOOD Rudy Haliburton makes 1/1 from the line.
Score: 39-53

[11:08] Team_031 possession (Score: 39-53)
Gary Morant attempts a Midrange. Contested by Nikola Bryant (4.6 feet, MAN). Gary Morant misses. Rebound secured by Giannis Turner.

[10:52] Team_003 possession (Score: 39-53)
Rudy Haliburton attempts a Midrange. Contested by Immanuel James (3.1 feet, ZONE). RUDY HALIBURTON MAKES IT! Assist: Nikola Bryant
Score: 39-55

[10:36] Team_031 possession (Score: 39-55)
Shai Durant attempts a 3Pt. Contested by Rudy Haliburton (3.4 feet, ZONE). Shai Durant misses. Rebound secured by Victor O'Neal.

[10:20] Team_003 possession (Score: 39-55)
FOUL! Shooting foul on Luka Sabonis. Victor O'Neal to the line for 2 free throws. [Team fouls: 2] (Luka Sabonis: 1 personal fouls)   FT 1/2: GOOD   FT 2/2: GOOD Victor O'Neal makes 2/2 from the line.
Score: 39-57

[10:06] Team_031 possession (Score: 39-57)
Gary Morant throws a bad pass out of bounds! TURNOVER! (dead ball)

[09:50] Team_003 possession (Score: 39-57)
FOUL! Shooting foul on Immanuel James. Giannis Turner to the line for 3 free throws. [Team fouls: 3] (Immanuel James: 1 personal fouls)   FT 1/3: GOOD   FT 2/3: MISS   FT 3/3: GOOD Giannis Turner makes 2/3 from the line.
Score: 39-59

[09:39] Team_031 possession (Score: 39-59)
Luka Sabonis attempts a Midrange. Contested by Giannis Turner (3.4 feet, MAN). Luka Sabonis misses. Rebound secured by Victor O'Neal.

[09:21] Team_003 possession (Score: 39-59)
Nikola Bryant attempts a Layup. Contested by Immanuel James (3.3 feet, ZONE). Nikola Bryant misses. Rebound secured by Luka Sabonis.

[09:03] Team_031 possession (Score: 39-59)
Gary Morant commits a violation (traveling/carry)! TURNOVER! (dead ball)

[08:47] Team_003 possession (Score: 39-59)
FOUL! Reach-in foul on Luka Sabonis during the drive. [Team fouls: 4] No free throws, side out. (Luka Sabonis: 2 personal fouls)

[08:30] Team_003 possession (Score: 39-59)
FOUL! Shooting foul on Immanuel James. Ayo Jackson to the line for 2 free throws. [BONUS: 5 team fouls] (Immanuel James: 2 personal fouls)   FT 1/2: GOOD   FT 2/2: GOOD Ayo Jackson makes 2/2 from the line.
Score: 39-61

[08:13] Team_031 possession (Score: 39-61)
Shai Durant drives, picks up Ayo Jackson. Help arrives from Rudy Haliburton! Shai Durant attempts a Dunk. Contested by Rudy Haliburton (5.4 feet, MAN). Shai Durant misses. Rebound secured by Rudy Haliburton.

[08:00] Team_003 possession (Score: 39-61)
FOUL! Shooting foul on Immanuel James. Victor O'Neal to the line for 2 free throws. [BONUS: 6 team fouls] (Immanuel James: 3 personal fouls)   FT 1/2: GOOD   FT 2/2: GOOD Victor O'Neal makes 2/2 from the line.
Score: 39-63

[07:46] Team_031 possession (Score: 39-63)
Gary Morant attempts a 3Pt. Contested by Nikola Bryant (4.6 feet, ZONE). Gary Morant misses. Rebound secured by Victor O'Neal.

[07:30] Team_003 possession (Score: 39-63)
Rudy Haliburton attempts a Midrange. Contested by Pau Irving (3.6 feet, MAN). Rudy Haliburton misses. FOUL! Loose ball foul on Gary Morant during the rebound battle. [IN THE BONUS! 7 team fouls] Victor O'Neal to the line for 2 free throws. (Gary Morant: 1 personal fouls)   FT 1/2: GOOD   FT 2/2: GOOD Victor O'Neal makes 2/2 from the line.
Score: 39-65

[07:12] Team_031 possession (Score: 39-65)
Gary Morant attempts a 3Pt. Contested by Giannis Turner (3.4 feet, ZONE). Gary Morant misses. Offensive rebound by Luka Sabonis! Luka Sabonis puts it back in!
Score: 41-65

[07:01] Team_003 possession (Score: 41-65)
Rudy Haliburton attempts a 3Pt. Contested by Pau Irving (3.6 feet, ZONE). Rudy Haliburton misses. Rebound secured by Immanuel James.

[06:46] Team_031 possession (Score: 41-65)
Gary Morant attempts a Midrange. Contested by Nikola Bryant (4.6 feet, ZONE). GARY MORANT MAKES IT! Assist: Immanuel James
Score: 43-65

[06:34] Team_003 possession (Score: 43-65)
Nikola Bryant attempts a 3Pt. Contested by Gary Morant (4.0 feet, MAN). NIKOLA BRYANT MAKES IT! Assist: Ayo Jackson
Score: 43-68

[06:17] Team_031 possession (Score: 43-68)
Shai Durant attempts a Midrange. Contested by Ayo Jackson (5.4 feet, MAN). Shai Durant misses. Rebound secured by Rudy Haliburton.

[06:03] Team_003 possession (Score: 43-68)
Giannis Turner attempts a Midrange. Contested by Pau Irving (3.9 feet, ZONE). GIANNIS TURNER MAKES IT! Assist: Ayo Jackson
Score: 43-70

[05:49] Team_031 possession (Score: 43-70)
Gary Morant drives, Giannis Turner stays with him. Gary Morant attempts a Layup. Contested by Giannis Turner (3.4 feet, ZONE). GARY MORANT MAKES IT! Assist: Luka Sabonis
Score: 45-70

[05:34] Team_003 possession (Score: 45-70)
Rudy Haliburton attempts a 3Pt. Contested by Pau Irving (3.6 feet, ZONE). Rudy Haliburton misses. FOUL! Loose ball foul on Gary Morant during the rebound battle. [IN THE BONUS! 8 team fouls] Victor O'Neal to the line for 2 free throws. (Gary Morant: 2 personal fouls)   FT 1/2: GOOD   FT 2/2: GOOD Victor O'Neal makes 2/2 from the line.
Score: 45-72

[05:18] Team_031 possession (Score: 45-72)
Immanuel James drives to the basket... FOUL! Offensive foul on Immanuel James! Giannis Turner drew the charge! [Team fouls: 9] (Immanuel James: 4 personal fouls) TURNOVER! (dead ball)

[05:04] Team_003 possession (Score: 45-72)
Victor O'Neal attempts a Layup. Contested by Luka Sabonis (3.2 feet, MAN). VICTOR O'NEAL MAKES IT!
Score: 45-74

[04:50] Team_031 possession (Score: 45-74)
Luka Sabonis attempts a Midrange. Contested by Giannis Turner (3.4 feet, MAN). Luka Sabonis misses. Rebound secured by Giannis Turner.

[04:33] Team_003 possession (Score: 45-74)
Nikola Bryant attempts a 3Pt. Contested by Pau Irving (3.9 feet, ZONE). Nikola Bryant misses. Rebound secured by Gary Morant.

[04:20] Team_031 possession (Score: 45-74)
Luka Sabonis drives to the basket... Luka Sabonis loses the ball! Stripped by Giannis Turner! TURNOVER! (live ball)

[04:03] Team_003 possession (Score: 45-74)
Victor O'Neal attempts a Layup. Contested by Immanuel James (3.1 feet, ZONE). VICTOR O'NEAL MAKES IT! Assist: Rudy Haliburton
Score: 45-76

[03:48] Team_031 possession (Score: 45-76)
FOUL! Reach-in foul on Giannis Turner during the drive. [Team fouls: 1] No free throws, side out. (Giannis Turner: 1 personal fouls)

[03:31] Team_031 possession (Score: 45-76)
FOUL! Reach-in foul on Rudy Haliburton during the drive. [Team fouls: 2] No free throws, side out. (Rudy Haliburton: 1 personal fouls)

[03:18] Team_031 possession (Score: 45-76)
Shai Durant attempts a 3Pt. Contested by Giannis Turner (3.1 feet, ZONE). SHAI DURANT MAKES IT! Assist: Luka Sabonis
Score: 48-76

[03:00] Team_003 possession (Score: 48-76)
Rudy Haliburton attempts a Midrange. Contested by Pau Irving (3.8 feet, ZONE). Rudy Haliburton misses. Offensive rebound by Rudy Haliburton! Rudy Haliburton kicks it out.

[02:49] Team_003 possession (Score: 48-76)
Nikola Bryant throws a bad pass out of bounds! TURNOVER! (dead ball)

[02:49] Substitution (Team_031): Immanuel James OUT → Kobe Randle IN (stamina_rule2)

[02:49] Substitution (Team_031): Luka Sabonis OUT → Jimmy Poole IN (stamina_rule2)

[02:33] Team_031 possession (Score: 48-76)
Jimmy Poole attempts a 3Pt. Contested by Giannis Turner (3.0 feet, ZONE). Jimmy Poole misses. Rebound secured by Victor O'Neal.

[02:18] Team_003 possession (Score: 48-76)
Ayo Jackson drives to the basket... Ayo Jackson loses control! Ball rolls out of bounds! TURNOVER! (dead ball)

[02:18] Substitution (Team_003): Ayo Jackson OUT → Miles Towns IN (stamina_rule2)

[02:18] Substitution (Team_003): Victor O'Neal OUT → Bam Gilgeous-Alexander IN (stamina_rule2)

[02:01] Team_031 possession (Score: 48-76)
Gary Morant drives and kicks out. Jimmy Poole attempts a 3Pt. Contested by Giannis Turner (3.1 feet, ZONE). Jimmy Poole misses. Rebound secured by Giannis Turner.

[01:48] Team_003 possession (Score: 48-76)
Nikola Bryant attempts a 3Pt. Contested by Gary Morant (4.3 feet, MAN). Nikola Bryant misses. Offensive rebound by Bam Gilgeous-Alexander! Bam Gilgeous-Alexander puts it back in!
Score: 48-78

[01:29] Team_031 possession (Score: 48-78)
FOUL! Holding foul on Giannis Turner. [Team fouls: 3] No free throws, side out. (Giannis Turner: 2 personal fouls)

[01:17] Team_031 possession (Score: 48-78)
FOUL! Shooting foul on Bam Gilgeous-Alexander. Gary Morant to the line for 2 free throws. [Team fouls: 4] (Bam Gilgeous-Alexander: 1 personal fouls)   FT 1/2: GOOD   FT 2/2: GOOD Gary Morant makes 2/2 from the line.
Score: 50-78

[01:00] Team_003 possession (Score: 50-78)
Bam Gilgeous-Alexander loses the ball! Stripped by Jimmy Poole! TURNOVER! (live ball)

[00:48] Team_031 possession (Score: 50-78)
Pau Irving attempts a 3Pt. Contested by Rudy Haliburton (3.7 feet, MAN). Pau Irving misses. Rebound secured by Giannis Turner.

[00:33] Team_003 possession (Score: 50-78)
FOUL! Reach-in foul on Pau Irving during the drive. [IN THE BONUS! 10 team fouls] Rudy Haliburton to the line for 2 free throws. (Pau Irving: 1 personal fouls)   FT 1/2: GOOD   FT 2/2: GOOD Rudy Haliburton makes 2/2 from the line.
Score: 50-80

[00:18] Team_031 possession (Score: 50-80)
Pau Irving drives, Rudy Haliburton stays with him. Pau Irving attempts a Dunk. Contested by Rudy Haliburton (3.7 feet, MAN). PAU IRVING MAKES IT!
Score: 52-80

[00:01] Team_003 possession (Score: 52-80)
Miles Towns drives and kicks out. Nikola Bryant attempts a 3Pt. Contested by Gary Morant (4.3 feet, MAN). NIKOLA BRYANT MAKES IT! Assist: Giannis Turner
Score: 52-83

================================================================================
                              3RD QUARTER COMPLETE                              
================================================================================

3RD QUARTER SCORE: Team_031 18, Team_003 33

BOX SCORE:
================================================================================

Team_031
--------------------------------------------------------------------------------
Player                MIN  PTS  REB  AST  TO      FG   FG%      3P   3P%
--------------------------------------------------------------------------------
Gary Morant            33    8    1    1   0   4/7    57.1     0/0   0.0
Shai Durant            33    6    0    0   0   2/5    40.0     0/0   0.0
Luka Sabonis           28    2    2    2   0   1/3    33.3     0/0   0.0
Pau Irving             33    2    0    0   0   1/2    50.0     0/0   0.0
Immanuel James         28    0    1    2   0   0/0     0.0     0/0   0.0
Jimmy Poole             8    0    0    0   0   0/1     0.0     0/0   0.0

TEAM: FG: 8/18 (44.4%), 3PT: 3/7 (42.9%), REB: 4 (1 off, 3 def), AST: 5, TO: 4
TEAM FOULS: 10 [Team_003 in BONUS]


Team_003
--------------------------------------------------------------------------------
Player                MIN  PTS  REB  AST  TO      FG   FG%      3P   3P%
--------------------------------------------------------------------------------
Victor O'Neal          31   12    4    0   0   6/6   100.0     0/0   0.0
Rudy Haliburton        33    7    3    1   0   3/4    75.0     0/0   0.0
Nikola Bryant          33    6    0    1   0   2/4    50.0     0/0   0.0
Giannis Turner         33    4    4    1   0   2/2   100.0     0/0   0.0
Ayo Jackson            31    2    0    2   0   1/1   100.0     0/0   0.0
Bam Gilgeous-Alexander    6    2    1    0   0   1/1   100.0     0/0   0.0

TEAM: FG: 15/18 (83.3%), 3PT: 4/6 (66.7%), REB: 12 (2 off, 10 def), AST: 5, TO: 4
TEAM FOULS: 4

================================================================================

================================================================================
                       4TH QUARTER - Team_031 vs Team_003                       
================================================================================

[12:00] Substitution (Team_031): Shai Durant OUT (stamina: 70) → Kevin Morant IN (comeback_detected)

[12:00] Substitution (Team_003): Ayo Jackson OUT (stamina: 79) → Miles Towns IN (comeback_detected)

[12:00] Team_031 possession (Score: 52-83)
Kevin Morant attempts a 3Pt. Contested by Miles Towns (5.3 feet, MAN). KEVIN MORANT MAKES IT! Assist: Luka Sabonis
Score: 55-83

[11:47] Team_003 possession (Score: 55-83)
Victor O'Neal drives, Luka Sabonis stays with him. Victor O'Neal attempts a Layup. Contested by Luka Sabonis (3.1 feet, MAN). VICTOR O'NEAL MAKES IT! Assist: Miles Towns
Score: 55-85

[11:36] Team_031 possession (Score: 55-85)
Immanuel James attempts a Midrange. Contested by Giannis Turner (3.6 feet, MAN). Immanuel James misses. Rebound secured by Victor O'Neal.

[11:19] Team_003 possession (Score: 55-85)
Victor O'Neal attempts a Midrange. Contested by Luka Sabonis (3.2 feet, MAN). Victor O'Neal misses. Rebound secured by Luka Sabonis.

[11:04] Team_031 possession (Score: 55-85)
Luka Sabonis drives to the basket... Luka Sabonis throws a bad pass! Stolen by Giannis Turner! TURNOVER! (live ball)

[10:48] Team_003 possession (Score: 55-85)
Giannis Turner attempts a 3Pt. Contested by Immanuel James (3.4 feet, MAN). Giannis Turner misses. Rebound secured by Gary Morant.

[10:34] Team_031 possession (Score: 55-85)
Gary Morant attempts a 3Pt. Contested by Nikola Bryant (5.0 feet, MAN). Gary Morant misses. Rebound secured by Victor O'Neal.

[10:21] Team_003 possession (Score: 55-85)
Rudy Haliburton attempts a 3Pt. Contested by Pau Irving (4.1 feet, MAN). Rudy Haliburton misses. FOUL! Loose ball foul on Gary Morant during the rebound battle. [Team fouls: 1] No free throws, side out. (Gary Morant: 1 personal fouls)

[10:08] Team_003 possession (Score: 55-85)
Nikola Bryant attempts a 3Pt. Contested by Pau Irving (4.4 feet, ZONE). NIKOLA BRYANT MAKES IT! Assist: Giannis Turner
Score: 55-88

[09:53] Team_031 possession (Score: 55-88)
Pau Irving attempts a Midrange. Contested by Miles Towns (5.3 feet, ZONE). PAU IRVING MAKES IT!
Score: 57-88

[09:40] Team_003 possession (Score: 57-88)
Rudy Haliburton makes the Midrange and draws the foul on Pau Irving! And-1! Rudy Haliburton to the line for 1. [Team fouls: 2] (Pau Irving: 1 personal fouls)   FT 1/1: GOOD Rudy Haliburton makes 1/1 from the line.
Score: 57-91

[09:27] Team_031 possession (Score: 57-91)
Immanuel James attempts a Layup. BLOCKED BY GIANNIS TURNER! Ball is loose! Rebound secured by Rudy Haliburton.

[09:14] Team_003 possession (Score: 57-91)
FOUL! Shooting foul on Gary Morant. Victor O'Neal to the line for 2 free throws. [Team fouls: 3] (Gary Morant: 2 personal fouls)   FT 1/2: GOOD   FT 2/2: GOOD Victor O'Neal makes 2/2 from the line.
Score: 57-93

[08:58] Team_031 possession (Score: 57-93)
Pau Irving drives, Rudy Haliburton stays with him. Pau Irving attempts a Layup. Contested by Rudy Haliburton (3.9 feet, MAN). PAU IRVING MAKES IT! Assist: Immanuel James
Score: 59-93

[08:43] Team_003 possession (Score: 59-93)
Victor O'Neal attempts a 3Pt. Contested by Pau Irving (4.3 feet, ZONE). Victor O'Neal misses. Rebound secured by Gary Morant.

[08:28] Team_031 possession (Score: 59-93)
Gary Morant drives to the basket... Gary Morant throws a bad pass! Stolen by Victor O'Neal! TURNOVER! (live ball)

[08:14] Team_003 possession (Score: 59-93)
Rudy Haliburton drives to the basket... Rudy Haliburton loses control! Ball rolls out of bounds! TURNOVER! (dead ball)

[08:14] Substitution (Team_031): Gary Morant OUT → Isaiah Ingram IN (stamina_rule2)

[08:14] Substitution (Team_031): Pau Irving OUT → Miles Stewart IN (stamina_rule2)

[08:14] Substitution (Team_031): Immanuel James OUT → Kobe Randle IN (stamina_rule2)

[08:14] Substitution (Team_031): Luka Sabonis OUT → Jimmy Poole IN (stamina_rule2)

[08:14] Substitution (Team_003): Nikola Bryant OUT → Pau Williamson IN (stamina_rule2)

[08:14] Substitution (Team_003): Rudy Haliburton OUT → Collin Mitchell IN (stamina_rule2)

[08:14] Substitution (Team_003): Giannis Turner OUT → Anfernee Jordan IN (stamina_rule2)

[08:14] Substitution (Team_003): Victor O'Neal OUT → Bam Gilgeous-Alexander IN (stamina_rule2)

[08:02] Team_031 possession (Score: 59-93)
Jimmy Poole drives to the basket... Jimmy Poole throws a bad pass! Stolen by Bam Gilgeous-Alexander! TURNOVER! (live ball)

[07:49] Team_003 possession (Score: 59-93)
Collin Mitchell attempts a 3Pt. Contested by Miles Stewart (5.5 feet, ZONE). Collin Mitchell misses. Rebound secured by Isaiah Ingram.

[07:31] Team_031 possession (Score: 59-93)
Jimmy Poole drives and kicks out. Isaiah Ingram attempts a 3Pt. Contested by Pau Williamson (5.1 feet, MAN). Isaiah Ingram misses. Rebound secured by Bam Gilgeous-Alexander.

[07:17] Team_003 possession (Score: 59-93)
Collin Mitchell attempts a 3Pt. Contested by Miles Stewart (5.5 feet, MAN). Collin Mitchell misses. Rebound secured by Isaiah Ingram.

[07:03] Team_031 possession (Score: 59-93)
Jimmy Poole attempts a Midrange. Contested by Bam Gilgeous-Alexander (2.9 feet, MAN). Jimmy Poole misses. Rebound secured by Bam Gilgeous-Alexander.

[06:47] Team_003 possession (Score: 59-93)
Pau Williamson attempts a 3Pt. Contested by Miles Stewart (5.2 feet, ZONE). Pau Williamson misses. Offensive rebound by Bam Gilgeous-Alexander! Bam Gilgeous-Alexander's putback is no good. Rebound secured by Isaiah Ingram.

[06:34] Team_031 possession (Score: 59-93)
Kevin Morant attempts a Midrange. Contested by Pau Williamson (5.2 feet, ZONE). KEVIN MORANT MAKES IT!
Score: 61-93

[06:21] Team_003 possession (Score: 61-93)
Anfernee Jordan attempts a Midrange. Contested by Miles Stewart (5.2 feet, ZONE). Anfernee Jordan misses. Rebound secured by Jimmy Poole.

[06:07] Team_031 possession (Score: 61-93)
Miles Stewart attempts a Midrange. BLOCKED BY COLLIN MITCHELL! Ball deflects out of bounds off Miles Stewart.

[05:52] Team_003 possession (Score: 61-93)
Anfernee Jordan drives, Kobe Randle stays with him. Anfernee Jordan attempts a Layup. Contested by Kobe Randle (4.3 feet, MAN). ANFERNEE JORDAN MAKES IT! Assist: Bam Gilgeous-Alexander
Score: 61-95

[05:38] Team_031 possession (Score: 61-95)
Kobe Randle drives to the basket... Kobe Randle loses the ball! Stripped by Bam Gilgeous-Alexander! TURNOVER! (live ball)

[05:23] Team_003 possession (Score: 61-95)
Pau Williamson attempts a 3Pt. Contested by Miles Stewart (5.2 feet, ZONE). PAU WILLIAMSON MAKES IT! Assist: Anfernee Jordan
Score: 61-98

[05:09] Team_031 possession (Score: 61-98)
Jimmy Poole makes the Layup and draws the foul on Bam Gilgeous-Alexander! And-1! Jimmy Poole to the line for 1. [Team fouls: 1] (Bam Gilgeous-Alexander: 1 personal fouls)   FT 1/1: MISS Jimmy Poole makes 0/1 from the line. Rebound secured by Collin Mitchell.
Score: 63-98

[04:55] Team_003 possession (Score: 63-98)
FOUL! Holding foul on Kevin Morant. [Team fouls: 4] No free throws, side out. (Kevin Morant: 1 personal fouls)

[04:45] Team_003 possession (Score: 63-98)
Pau Williamson attempts a Layup. Contested by Kobe Randle (4.3 feet, ZONE). Pau Williamson misses. Rebound secured by Isaiah Ingram.

[04:28] Team_031 possession (Score: 63-98)
Jimmy Poole drives and kicks out. Kobe Randle attempts a Midrange. Contested by Anfernee Jordan (4.4 feet, ZONE). Kobe Randle misses. Offensive rebound by Jimmy Poole! Jimmy Poole kicks it out.

[04:16] Team_031 possession (Score: 63-98)
Miles Stewart attempts a 3Pt. Contested by Collin Mitchell (4.1 feet, MAN). Miles Stewart misses. Offensive rebound by Jimmy Poole! Jimmy Poole kicks it out.

[04:00] Team_031 possession (Score: 63-98)
Miles Stewart attempts a Layup. Contested by Collin Mitchell (4.1 feet, MAN). Miles Stewart misses. Offensive rebound by Isaiah Ingram! Isaiah Ingram kicks it out.

[03:43] Team_031 possession (Score: 63-98)
Kobe Randle attempts a 3Pt. Contested by Bam Gilgeous-Alexander (3.6 feet, MAN). KOBE RANDLE MAKES IT!
Score: 66-98

[03:27] Team_003 possession (Score: 66-98)
Collin Mitchell attempts a Midrange. Contested by Kobe Randle (4.6 feet, ZONE). Collin Mitchell misses. Rebound secured by Kobe Randle.

[03:16] Team_031 possession (Score: 66-98)
FOUL! Holding foul on Pau Williamson. [Team fouls: 2] No free throws, side out. (Pau Williamson: 1 personal fouls)

[03:05] Team_031 possession (Score: 66-98)
Miles Stewart attempts a 3Pt. Contested by Miles Towns (5.6 feet, ZONE). Miles Stewart misses. Offensive rebound by Jimmy Poole! Jimmy Poole kicks it out.

[02:52] Team_031 possession (Score: 66-98)
FOUL! Offensive foul on Kobe Randle! Bam Gilgeous-Alexander drew the charge! [Team fouls: 5] (Kobe Randle: 1 personal fouls) TURNOVER! (dead ball)

[02:36] Team_003 possession (Score: 66-98)
Anfernee Jordan attempts a 3Pt. Contested by Miles Stewart (5.2 feet, ZONE). Anfernee Jordan misses. Rebound secured by Kobe Randle.

[02:24] Team_031 possession (Score: 66-98)
Miles Stewart attempts a 3Pt. Contested by Collin Mitchell (4.1 feet, ZONE). Miles Stewart misses. Rebound secured by Bam Gilgeous-Alexander.

[02:13] Team_003 possession (Score: 66-98)
Bam Gilgeous-Alexander drives, Kobe Randle stays with him. Bam Gilgeous-Alexander attempts a Layup. Contested by Kobe Randle (5.2 feet, ZONE). BAM GILGEOUS-ALEXANDER MAKES IT! Assist: Collin Mitchell
Score: 66-100

[01:54] Team_031 possession (Score: 66-100)
Miles Stewart loses control! Ball rolls out of bounds! TURNOVER! (dead ball)

[01:54] Substitution (Team_003): Miles Towns OUT → Ayo Jackson IN (starter_return_rule1)

[01:37] Team_003 possession (Score: 66-100)
Collin Mitchell attempts a Midrange. Contested by Miles Stewart (5.6 feet, MAN). Collin Mitchell misses. Rebound secured by Isaiah Ingram.

[01:22] Team_031 possession (Score: 66-100)
Miles Stewart drives to the basket... Miles Stewart loses control! Ball rolls out of bounds! TURNOVER! (dead ball)

[01:09] Team_003 possession (Score: 66-100)
Bam Gilgeous-Alexander drives, Jimmy Poole stays with him. Bam Gilgeous-Alexander attempts a Dunk. Wide open! Jimmy Poole is 6.5 feet away. [MAN] BAM GILGEOUS-ALEXANDER MAKES IT!
Score: 66-102

[00:50] Team_031 possession (Score: 66-102)
Jimmy Poole attempts a Midrange. Contested by Bam Gilgeous-Alexander (3.1 feet, MAN). Jimmy Poole misses. Rebound secured by Bam Gilgeous-Alexander.

[00:35] Team_003 possession (Score: 66-102)
Anfernee Jordan attempts a Midrange. Contested by Kobe Randle (4.6 feet, MAN). Anfernee Jordan misses. Rebound secured by Kobe Randle.

[00:18] Team_031 possession (Score: 66-102)
Isaiah Ingram attempts a 3Pt. Contested by Pau Williamson (5.6 feet, MAN). Isaiah Ingram misses. Rebound secured by Bam Gilgeous-Alexander.

[00:03] Team_003 possession (Score: 66-102)
Anfernee Jordan attempts a Midrange. Contested by Kobe Randle (4.6 feet, MAN). Anfernee Jordan misses. Rebound secured by Kobe Randle.

================================================================================
                              4TH QUARTER COMPLETE                              
================================================================================

4TH QUARTER SCORE: Team_031 14, Team_003 19

BOX SCORE:
================================================================================

Team_031
--------------------------------------------------------------------------------
Player                MIN  PTS  REB  AST  TO      FG   FG%      3P   3P%
--------------------------------------------------------------------------------
Kevin Morant           16    5    0    0   0   2/2   100.0     0/0   0.0
Pau Irving             37    4    0    0   0   2/2   100.0     0/0   0.0
Kobe Randle            16    3    4    0   0   1/1   100.0     0/0   0.0
Luka Sabonis           32    0    1    1   0   0/0     0.0     0/0   0.0
Immanuel James         32    0    0    1   0   0/2     0.0     0/0   0.0
Gary Morant            37    0    2    0   0   0/1     0.0     0/0   0.0
Isaiah Ingram          12    0    6    0   0   0/1     0.0     0/0   0.0
Jimmy Poole            16    0    4    0   0   0/4     0.0     0/0   0.0
Miles Stewart          12    0    0    0   0   0/2     0.0     0/0   0.0

TEAM: FG: 5/15 (33.3%), 3PT: 2/5 (40.0%), REB: 16 (4 off, 12 def), AST: 2, TO: 7
TEAM FOULS: 5 [Team_003 in BONUS]


Team_003
--------------------------------------------------------------------------------
Player                MIN  PTS  REB  AST  TO      FG   FG%      3P   3P%
--------------------------------------------------------------------------------
Victor O'Neal          35    4    3    0   0   2/4    50.0     0/0   0.0
Bam Gilgeous-Alexander   14    4    5    1   0   2/2   100.0     0/0   0.0
Nikola Bryant          37    3    0    0   0   1/1   100.0     0/0   0.0
Rudy Haliburton        37    3    1    0   0   1/1   100.0     0/0   0.0
Pau Williamson         12    3    0    0   0   1/3    33.3     0/0   0.0
Anfernee Jordan        12    2    0    1   0   1/5    20.0     0/0   0.0
Miles Towns            16    0    0    1   0   0/0     0.0     0/0   0.0
Giannis Turner         37    0    0    1   0   0/1     0.0     0/0   0.0
Collin Mitchell        12    0    1    1   0   0/4     0.0     0/0   0.0

TEAM: FG: 8/21 (38.1%), 3PT: 2/8 (25.0%), REB: 11 (2 off, 9 def), AST: 5, TO: 1
TEAM FOULS: 2

================================================================================

================================================================================
                               FULL GAME COMPLETE                               
================================================================================

FINAL SCORE: Team_031 66, Team_003 102

SCORING BY QUARTER:
--------------------------------------------------------------------------------
Team                     Q1     Q2     Q3     Q4    FINAL
--------------------------------------------------------------------------------
Team_031                 17     17     18     14       66
Team_003                 26     24     33     19      102
--------------------------------------------------------------------------------

FULL GAME BOX SCORE:
================================================================================

Team_031
--------------------------------------------------------------------------------
Player                MIN  PTS  REB  AST  TO      FG   FG%      3P   3P%      FT STL BLK
--------------------------------------------------------------------------------
Gary Morant            37   19    8    1   4   9/19   47.4   2/8    25.0   4/4     2   0
Pau Irving             37    7    0    1   2   4/7    57.1   0/2     0.0   1/2     1   1
Shai Durant            33    6    0    1   2   2/12   16.7   2/8    25.0   0/0     0   0
Immanuel James         32   11    4    3   2   4/11   36.4   2/3    66.7   1/1     1   0
Luka Sabonis           32   10    8    5   0   3/8    37.5   1/2    50.0   1/1     0   0
Kobe Randle            16    3    5    0   1   1/1   100.0   1/1   100.0   0/0     0   0
Jimmy Poole            16    0    5    0   1   0/7     0.0   0/1     0.0   0/1     1   0
Kevin Morant           16    5    0    0   0   2/2   100.0   1/1   100.0   0/0     0   0
Isaiah Ingram          12    0    7    0   2   0/2     0.0   0/2     0.0   0/0     0   0
Miles Stewart          12    3    0    0   1   1/5    20.0   0/3     0.0   1/1     0   1

TEAM: FG: 26/74 (35.1%), 3PT: 9/31 (29.0%), REB: 38 (10 off, 28 def), AST: 11, TO: 15


Team_003
--------------------------------------------------------------------------------
Player                MIN  PTS  REB  AST  TO      FG   FG%      3P   3P%      FT STL BLK
--------------------------------------------------------------------------------
Nikola Bryant          37   13    0    3   4   5/11   45.5   3/5    60.0   2/4     0   0
Rudy Haliburton        37   28   12    1   0  13/17   76.5   3/5    60.0   4/4     1   0
Giannis Turner         37   11   11    3   2   6/9    66.7   1/3    33.3   3/4     2   1
Victor O'Neal          35   23   19    3   1   9/12   75.0   1/2    50.0  10/10    1   0
Ayo Jackson            33   12    0    8   2   5/9    55.6   1/3    33.3   3/3     1   0
Miles Towns            16    0    0    2   1   1/1   100.0   0/0     0.0   0/0     0   0
Bam Gilgeous-Alexander   14    8    6    1   1   3/3   100.0   0/0     0.0   0/0     2   0
Pau Williamson         12    5    0    0   0   2/5    40.0   1/2    50.0   0/0     0   0
Collin Mitchell        12    0    4    2   1   0/4     0.0   0/2     0.0   0/0     0   1
Anfernee Jordan        12    2    3    1   0   1/5    20.0   0/1     0.0   0/0     0   0

TEAM: FG: 45/76 (59.2%), 3PT: 10/23 (43.5%), REB: 54 (10 off, 44 def), AST: 24, TO: 12

================================================================================
