================================================================================
                        FULL GAME - Team_086 vs Team_034                        
================================================================================

================================================================================
                       1ST QUARTER - Team_086 vs Team_034                       
================================================================================

[12:00] Team_086 possession (Score: 0-0)
Anfernee Harris attempts a 3Pt. Contested by Ben Hyland (4.2 feet, MAN). Anfernee Harris misses. Rebound secured by Terry Doncic.

[11:48] Team_034 possession (Score: 0-0)
Ben Hyland attempts a 3Pt. Contested by Anfernee Harris (4.3 feet, MAN). Ben Hyland misses. Rebound secured by Rudy Rose.

[11:36] Team_086 possession (Score: 0-0)
Anfernee Harris attempts a Midrange. Contested by Ben Hyland (4.2 feet, MAN). Anfernee Harris misses. Rebound secured by Anthony Bane.

[11:23] Team_034 possession (Score: 0-0)
Terry Doncic attempts a Layup. Contested by Bones Ginobili (4.8 feet, MAN). TERRY DONCIC MAKES IT!
Score: 0-2

[11:04] Team_086 possession (Score: 0-2)
Anfernee Harris attempts a 3Pt. Contested by Ben Hyland (4.2 feet, MAN). Anfernee Harris misses. Offensive rebound by Rudy Rose! Rudy Rose's putback is no good. Offensive rebound by Rudy Rose! Rudy Rose kicks it out.

[10:47] Team_086 possession (Score: 0-2)
Bones Ginobili attempts a 3Pt. Contested by Devin Poole (4.3 feet, ZONE). Bones Ginobili misses. Rebound secured by Terry Doncic.

[10:29] Team_034 possession (Score: 0-2)
Devin Poole drives to the basket... Devin Poole commits a violation (traveling/carry)! TURNOVER! (dead ball)

[10:12] Team_086 possession (Score: 0-2)
Miles Gobert loses control! Ball rolls out of bounds! TURNOVER! (dead ball)

[09:58] Team_034 possession (Score: 0-2)
Devin Poole loses the ball! Stripped by Lauri Johnson! TURNOVER! (live ball)

[09:44] Team_086 possession (Score: 0-2)
Rudy Rose attempts a Midrange. Contested by Anthony Bane (5.4 feet, MAN). RUDY ROSE MAKES IT! Assist: Miles Gobert
Score: 2-2

[09:31] Team_034 possession (Score: 2-2)
FOUL! Holding foul on Miles Gobert. [Team fouls: 1] No free throws, side out. (Miles Gobert: 1 personal fouls)

[09:19] Team_034 possession (Score: 2-2)
Anthony Bane attempts a Midrange. Contested by Rudy Rose (3.8 feet, MAN). ANTHONY BANE MAKES IT!
Score: 2-4

[09:03] Team_086 possession (Score: 2-4)
Miles Gobert attempts a 3Pt. Contested by Devin Poole (4.1 feet, ZONE). Miles Gobert misses. Rebound secured by Anthony Bane.

[08:49] Team_034 possession (Score: 2-4)
Anthony Bane throws a bad pass out of bounds! TURNOVER! (dead ball)

[08:38] Team_086 possession (Score: 2-4)
Lauri Johnson attempts a Midrange. Contested by Devin Poole (4.1 feet, MAN). LAURI JOHNSON MAKES IT!
Score: 4-4

[08:28] Team_034 possession (Score: 4-4)
Terry Doncic attempts a Midrange. Contested by Bones Ginobili (4.8 feet, MAN). Terry Doncic misses. Rebound secured by Bones Ginobili.

[08:14] Team_086 possession (Score: 4-4)
Bones Ginobili attempts a Midrange. Contested by Cole Antetokounmpo (4.9 feet, ZONE). Bones Ginobili misses. Rebound secured by Terry Doncic.

[08:02] Team_034 possession (Score: 4-4)
Ben Hyland attempts a 3Pt. Contested by Anfernee Harris (4.3 feet, MAN). Ben Hyland misses. Offensive rebound by Terry Doncic! Terry Doncic puts it back in!
Score: 4-6

[07:47] Team_086 possession (Score: 4-6)
Rudy Rose makes the Dunk and draws the foul on Terry Doncic! And-1! Rudy Rose to the line for 1. [Team fouls: 1] (Terry Doncic: 1 personal fouls)   FT 1/1: GOOD Rudy Rose makes 1/1 from the line.
Score: 7-6

[07:32] Team_034 possession (Score: 7-6)
Cole Antetokounmpo attempts a Midrange. Contested by Miles Gobert (4.0 feet, MAN). COLE ANTETOKOUNMPO MAKES IT!
Score: 7-8

[07:21] Team_086 possession (Score: 7-8)
Lauri Johnson attempts a 3Pt. Contested by Devin Poole (4.1 feet, ZONE). Lauri Johnson misses. Rebound secured by Cole Antetokounmpo.

[07:07] Team_034 possession (Score: 7-8)
Anthony Bane drives and kicks out. Cole Antetokounmpo attempts a 3Pt. Contested by Lauri Johnson (4.4 feet, ZONE). Cole Antetokounmpo misses. Offensive rebound by Terry Doncic! Terry Doncic puts it back in!
Score: 7-10

[06:54] Team_086 possession (Score: 7-10)
Miles Gobert drives, Cole Antetokounmpo stays with him. Miles Gobert attempts a Layup. Contested by Cole Antetokounmpo (4.7 feet, MAN). Miles Gobert misses. FOUL! Loose ball foul on Anthony Bane during the rebound battle. [Team fouls: 2] No free throws, side out. (Anthony Bane: 1 personal fouls)

[06:35] Team_086 possession (Score: 7-10)
Rudy Rose attempts a Midrange. Contested by Anthony Bane (5.4 feet, MAN). Rudy Rose misses. Rebound secured by Cole Antetokounmpo.

[06:17] Team_034 possession (Score: 7-10)
Terry Doncic attempts a Midrange. Contested by Miles Gobert (3.6 feet, ZONE). Terry Doncic misses. Offensive rebound by Anthony Bane! Anthony Bane kicks it out.

[06:04] Team_034 possession (Score: 7-10)
Cole Antetokounmpo drives and kicks out. FOUL! Shooting foul on Bones Ginobili. Cole Antetokounmpo to the line for 2 free throws. [Team fouls: 2] (Bones Ginobili: 1 personal fouls)   FT 1/2: GOOD   FT 2/2: GOOD Cole Antetokounmpo makes 2/2 from the line.
Score: 7-12

[05:49] Team_086 possession (Score: 7-12)
Anfernee Harris attempts a 3Pt. Contested by Ben Hyland (4.2 feet, MAN). Anfernee Harris misses. Rebound secured by Terry Doncic.

[05:33] Team_034 possession (Score: 7-12)
Cole Antetokounmpo attempts a 3Pt. Contested by Lauri Johnson (4.9 feet, ZONE). COLE ANTETOKOUNMPO MAKES IT! Assist: Devin Poole
Score: 7-15

[05:15] Team_086 possession (Score: 7-15)
FOUL! Offensive foul on Bones Ginobili! Terry Doncic drew the charge! [Team fouls: 3] (Bones Ginobili: 2 personal fouls) TURNOVER! (dead ball)

[05:02] Team_034 possession (Score: 7-15)
Anthony Bane drives to the basket... Anthony Bane throws a bad pass! Stolen by Rudy Rose! TURNOVER! (live ball)

[04:50] Team_086 possession (Score: 7-15)
Bones Ginobili attempts a 3Pt. Contested by Terry Doncic (4.5 feet, MAN). Bones Ginobili misses. Offensive rebound by Rudy Rose! Rudy Rose's putback is no good. Rebound secured by Anthony Bane.

[04:39] Team_034 possession (Score: 7-15)
Cole Antetokounmpo attempts a 3Pt. Contested by Lauri Johnson (4.9 feet, ZONE). COLE ANTETOKOUNMPO MAKES IT! Assist: Terry Doncic
Score: 7-18

[04:24] Team_086 possession (Score: 7-18)
Rudy Rose attempts a Midrange. Contested by Anthony Bane (5.5 feet, MAN). Rudy Rose misses. Rebound secured by Terry Doncic.

[04:09] Team_034 possession (Score: 7-18)
Ben Hyland attempts a 3Pt. Contested by Lauri Johnson (4.5 feet, ZONE). Ben Hyland misses. Offensive rebound by Terry Doncic! Terry Doncic puts it back in!
Score: 7-20

[03:56] Team_086 possession (Score: 7-20)
Anfernee Harris drives and kicks out. Anfernee Harris attempts a 3Pt. Contested by Cole Antetokounmpo (4.6 feet, ZONE). Anfernee Harris misses. Offensive rebound by Miles Gobert! Miles Gobert kicks it out.

[03:40] Team_086 possession (Score: 7-20)
Anfernee Harris attempts a 3Pt. Contested by Devin Poole (4.7 feet, ZONE). Anfernee Harris misses. Rebound secured by Terry Doncic.

[03:23] Team_034 possession (Score: 7-20)
Cole Antetokounmpo drives and kicks out. FOUL! Shooting foul on Anfernee Harris. Ben Hyland to the line for 2 free throws. [Team fouls: 4] (Anfernee Harris: 1 personal fouls)   FT 1/2: GOOD   FT 2/2: MISS Ben Hyland makes 1/2 from the line. Offensive rebound by Anthony Bane! Anthony Bane kicks it out.
Score: 7-21

[03:13] Team_034 possession (Score: 7-21)
Terry Doncic drives, Bones Ginobili stays with him. Terry Doncic attempts a Dunk. Contested by Bones Ginobili (5.0 feet, MAN). Terry Doncic misses. Offensive rebound by Terry Doncic! Terry Doncic puts it back in!
Score: 7-23

[03:01] Team_086 possession (Score: 7-23)
Rudy Rose throws a bad pass! Stolen by Anthony Bane! TURNOVER! (live ball)

[02:47] Team_034 possession (Score: 7-23)
FOUL! Shooting foul on Rudy Rose. Terry Doncic to the line for 2 free throws. [BONUS: 5 team fouls] (Rudy Rose: 1 personal fouls)   FT 1/2: GOOD   FT 2/2: GOOD Terry Doncic makes 2/2 from the line.
Score: 7-25

[02:34] Team_086 possession (Score: 7-25)
Miles Gobert attempts a 3Pt. Contested by Cole Antetokounmpo (5.0 feet, MAN). Miles Gobert misses. Rebound secured by Cole Antetokounmpo.

[02:24] Team_034 possession (Score: 7-25)
Terry Doncic attempts a Layup. BLOCKED BY BONES GINOBILI! Ball is loose! Rebound secured by Miles Gobert.

[02:13] Team_086 possession (Score: 7-25)
Bones Ginobili attempts a Midrange. Contested by Terry Doncic (4.8 feet, MAN). BONES GINOBILI MAKES IT! Assist: Rudy Rose
Score: 9-25

[01:59] Team_034 possession (Score: 9-25)
Terry Doncic drives, Rudy Rose stays with him. Terry Doncic attempts a Layup. Contested by Rudy Rose (4.1 feet, ZONE). TERRY DONCIC MAKES IT!
Score: 9-27

[01:43] Team_086 possession (Score: 9-27)
Miles Gobert attempts a 3Pt. Contested by Cole Antetokounmpo (5.1 feet, MAN). Miles Gobert misses. FOUL! Loose ball foul on Anthony Bane during the rebound battle. [Team fouls: 3] No free throws, side out. (Anthony Bane: 2 personal fouls)

[01:32] Team_086 possession (Score: 9-27)
Miles Gobert attempts a 3Pt. Contested by Devin Poole (4.6 feet, ZONE). Miles Gobert misses. Rebound secured by Anthony Bane.

[01:14] Team_034 possession (Score: 9-27)
Ben Hyland attempts a 3Pt. Contested by Lauri Johnson (4.8 feet, ZONE). BEN HYLAND MAKES IT! Assist: Devin Poole
Score: 9-30

[00:58] Team_086 possession (Score: 9-30)
FOUL! Shooting foul on Anthony Bane. Rudy Rose to the line for 2 free throws. [Team fouls: 4] (Anthony Bane: 3 personal fouls)   FT 1/2: GOOD   FT 2/2: MISS Rudy Rose makes 1/2 from the line. Rebound secured by Terry Doncic.
Score: 10-30

[00:44] Team_034 possession (Score: 10-30)
Anthony Bane attempts a Midrange. Contested by Rudy Rose (4.2 feet, MAN). Anthony Bane misses. Rebound secured by Miles Gobert.

[00:25] Team_086 possession (Score: 10-30)
Anfernee Harris commits a violation (traveling/carry)! TURNOVER! (dead ball)

[00:25] Substitution (Team_086): Lauri Johnson OUT → Anfernee Green IN (stamina_rule2)

[00:25] Substitution (Team_086): Anfernee Harris OUT → Anthony James IN (stamina_rule2)

[00:25] Substitution (Team_086): Miles Gobert OUT → Franz McGrady IN (stamina_rule2)

[00:25] Substitution (Team_086): Bones Ginobili OUT → Kyle McCollum IN (stamina_rule2)

[00:25] Substitution (Team_086): Rudy Rose OUT → Lamelo Towns IN (stamina_rule2)

[00:25] Substitution (Team_034): Devin Poole OUT → Manu Jokic IN (stamina_rule2)

[00:25] Substitution (Team_034): Ben Hyland OUT → Damian Turner IN (stamina_rule2)

[00:25] Substitution (Team_034): Cole Antetokounmpo OUT → Vince Paul IN (stamina_rule2)

[00:25] Substitution (Team_034): Terry Doncic OUT → Nikola Wagner IN (stamina_rule2)

[00:25] Substitution (Team_034): Anthony Bane OUT → Carmelo Anunoby IN (stamina_rule2)

[00:09] Team_034 possession (Score: 10-30)
Nikola Wagner drives, picks up Kyle McCollum. Help arrives from Anfernee Green! Nikola Wagner attempts a Layup. Contested by Anfernee Green (5.4 feet, MAN). Nikola Wagner misses. Offensive rebound by Vince Paul! Vince Paul puts it back in!
Score: 10-32

================================================================================
                              1ST QUARTER COMPLETE                              
================================================================================

1ST QUARTER SCORE: Team_086 10, Team_034 32

BOX SCORE:
================================================================================

Team_086
--------------------------------------------------------------------------------
Player                MIN  PTS  REB  AST  TO      FG   FG%      3P   3P%
--------------------------------------------------------------------------------
Rudy Rose              12    5    3    1   0   2/5    40.0     0/0   0.0
Bones Ginobili         12    2    1    0   0   1/4    25.0     0/0   0.0
Lauri Johnson          12    2    0    0   0   1/2    50.0     0/0   0.0
Anfernee Harris        12    0    0    0   0   0/4     0.0     0/0   0.0
Miles Gobert           12    0    4    1   0   0/3     0.0     0/0   0.0

TEAM: FG: 4/18 (22.2%), 3PT: 0/9 (0.0%), REB: 9 (5 off, 4 def), AST: 2, TO: 4
TEAM FOULS: 5 [Team_034 in BONUS]


Team_034
--------------------------------------------------------------------------------
Player                MIN  PTS  REB  AST  TO      FG   FG%      3P   3P%
--------------------------------------------------------------------------------
Terry Doncic           12   14   11    1   0   7/9    77.8     0/0   0.0
Cole Antetokounmpo     12   10    3    0   0   4/4   100.0     0/0   0.0
Ben Hyland             12    3    0    0   0   1/2    50.0     0/0   0.0
Anthony Bane           12    2    6    0   0   1/2    50.0     0/0   0.0
Vince Paul              0    2    1    0   0   1/1   100.0     0/0   0.0
Devin Poole            12    0    0    2   0   0/0     0.0     0/0   0.0

TEAM: FG: 14/18 (77.8%), 3PT: 5/6 (83.3%), REB: 20 (7 off, 13 def), AST: 3, TO: 4
TEAM FOULS: 4

================================================================================

================================================================================
                       2ND QUARTER - Team_086 vs Team_034                       
================================================================================

[12:00] Team_086 possession (Score: 10-32)
Bones Ginobili makes the Layup and draws the foul on Terry Doncic! And-1! Bones Ginobili to the line for 1. [Team fouls: 1] (Terry Doncic: 1 personal fouls)   FT 1/1: GOOD Bones Ginobili makes 1/1 from the line.
Score: 13-32

[11:47] Team_034 possession (Score: 13-32)
Cole Antetokounmpo attempts a 3Pt. Contested by Lauri Johnson (5.1 feet, ZONE). Cole Antetokounmpo misses. Rebound secured by Rudy Rose.

[11:32] Team_086 possession (Score: 13-32)
Miles Gobert attempts a 3Pt. Contested by Devin Poole (4.6 feet, ZONE). MILES GOBERT MAKES IT! Assist: Anfernee Harris
Score: 16-32

[11:14] Team_034 possession (Score: 16-32)
Devin Poole throws a bad pass! Stolen by Lauri Johnson! TURNOVER! (live ball)

[10:58] Team_086 possession (Score: 16-32)
Anfernee Harris attempts a 3Pt. Contested by Devin Poole (4.9 feet, ZONE). Anfernee Harris misses. Rebound secured by Anthony Bane.

[10:44] Team_034 possession (Score: 16-32)
Anthony Bane attempts a Layup. Contested by Rudy Rose (4.1 feet, MAN). Anthony Bane misses. Offensive rebound by Anthony Bane! Anthony Bane kicks it out.

[10:32] Team_034 possession (Score: 16-32)
Terry Doncic drives, picks up Bones Ginobili. Help arrives from Anfernee Harris! Terry Doncic attempts a Dunk. Contested by Anfernee Harris (5.2 feet, MAN). Terry Doncic misses. Rebound secured by Miles Gobert.

[10:19] Team_086 possession (Score: 16-32)
Miles Gobert attempts a 3Pt. Contested by Ben Hyland (4.3 feet, ZONE). Miles Gobert misses. Rebound secured by Anthony Bane.

[10:04] Team_034 possession (Score: 16-32)
Devin Poole attempts a 3Pt. Contested by Lauri Johnson (4.7 feet, ZONE). DEVIN POOLE MAKES IT!
Score: 16-35

[09:48] Team_086 possession (Score: 16-35)
Miles Gobert attempts a 3Pt. Contested by Ben Hyland (4.3 feet, ZONE). Miles Gobert misses. Rebound secured by Terry Doncic.

[09:29] Team_034 possession (Score: 16-35)
Cole Antetokounmpo attempts a 3Pt. Contested by Miles Gobert (4.4 feet, MAN). Cole Antetokounmpo misses. Rebound secured by Miles Gobert.

[09:13] Team_086 possession (Score: 16-35)
Lauri Johnson attempts a 3Pt. Contested by Devin Poole (4.9 feet, MAN). Lauri Johnson misses. Rebound secured by Terry Doncic.

[08:59] Team_034 possession (Score: 16-35)
Terry Doncic attempts a Midrange. Contested by Bones Ginobili (5.4 feet, MAN). Terry Doncic misses. Rebound secured by Rudy Rose.

[08:46] Team_086 possession (Score: 16-35)
Lauri Johnson attempts a 3Pt. Contested by Devin Poole (4.9 feet, MAN). Lauri Johnson misses. Rebound secured by Cole Antetokounmpo.

[08:32] Team_034 possession (Score: 16-35)
Anthony Bane drives and kicks out. Devin Poole attempts a 3Pt. Contested by Miles Gobert (4.2 feet, ZONE). Devin Poole misses. Rebound secured by Miles Gobert.

[08:16] Team_086 possession (Score: 16-35)
Anfernee Harris attempts a 3Pt. Contested by Terry Doncic (5.3 feet, ZONE). Anfernee Harris misses. Rebound secured by Terry Doncic.

[08:02] Team_034 possession (Score: 16-35)
Cole Antetokounmpo attempts a 3Pt. Contested by Lauri Johnson (5.4 feet, ZONE). Cole Antetokounmpo misses. Rebound secured by Bones Ginobili.

[07:47] Team_086 possession (Score: 16-35)
Anfernee Harris attempts a Midrange. Contested by Devin Poole (5.3 feet, ZONE). Anfernee Harris misses. Offensive rebound by Miles Gobert! Miles Gobert kicks it out.

[07:33] Team_086 possession (Score: 16-35)
Anfernee Harris attempts a 3Pt. Contested by Devin Poole (5.4 feet, ZONE). Anfernee Harris misses. Rebound secured by Anthony Bane.

[07:17] Team_034 possession (Score: 16-35)
Ben Hyland loses the ball! Stripped by Anfernee Harris! TURNOVER! (live ball)

[07:02] Team_086 possession (Score: 16-35)
Miles Gobert drives, Cole Antetokounmpo stays with him. Miles Gobert attempts a Dunk. Contested by Cole Antetokounmpo (5.5 feet, MAN). MILES GOBERT MAKES IT!
Score: 18-35

[06:46] Team_034 possession (Score: 18-35)
Devin Poole attempts a Midrange. Contested by Anfernee Harris (5.0 feet, ZONE). Devin Poole misses. Rebound secured by Rudy Rose.

[06:32] Team_086 possession (Score: 18-35)
Rudy Rose attempts a Midrange. Contested by Ben Hyland (4.7 feet, ZONE). RUDY ROSE MAKES IT! Assist: Anfernee Harris
Score: 20-35

[06:20] Team_034 possession (Score: 20-35)
Devin Poole attempts a Midrange. BLOCKED BY LAURI JOHNSON! Ball deflects out of bounds off Devin Poole.

[06:10] Team_086 possession (Score: 20-35)
Miles Gobert drives to the basket... Miles Gobert loses the ball! Stripped by Cole Antetokounmpo! TURNOVER! (live ball)

[05:53] Team_034 possession (Score: 20-35)
Devin Poole throws a bad pass out of bounds! TURNOVER! (dead ball)

[05:53] Substitution (Team_086): Lauri Johnson OUT → Anfernee Green IN (stamina_rule2)

[05:53] Substitution (Team_086): Anfernee Harris OUT → Anthony James IN (stamina_rule2)

[05:53] Substitution (Team_086): Miles Gobert OUT → Franz McGrady IN (stamina_rule2)

[05:53] Substitution (Team_086): Bones Ginobili OUT → Kyle McCollum IN (stamina_rule2)

[05:53] Substitution (Team_086): Rudy Rose OUT → Lamelo Towns IN (stamina_rule2)

[05:53] Substitution (Team_034): Devin Poole OUT → Manu Jokic IN (stamina_rule2)

[05:53] Substitution (Team_034): Ben Hyland OUT → Damian Turner IN (stamina_rule2)

[05:53] Substitution (Team_034): Cole Antetokounmpo OUT → Vince Paul IN (stamina_rule2)

[05:53] Substitution (Team_034): Terry Doncic OUT → Nikola Wagner IN (stamina_rule2)

[05:53] Substitution (Team_034): Anthony Bane OUT → Carmelo Anunoby IN (stamina_rule2)

[05:34] Team_086 possession (Score: 20-35)
Kyle McCollum drives to the basket... Kyle McCollum throws a bad pass! Stolen by Nikola Wagner! TURNOVER! (live ball)

[05:23] Team_034 possession (Score: 20-35)
FOUL! Shooting foul on Anfernee Green. Manu Jokic to the line for 2 free throws. [Team fouls: 1] (Anfernee Green: 1 personal fouls)   FT 1/2: GOOD   FT 2/2: MISS Manu Jokic makes 1/2 from the line. Rebound secured by Kyle McCollum.
Score: 20-36

[05:13] Team_086 possession (Score: 20-36)
Franz McGrady attempts a 3Pt. Contested by Vince Paul (4.3 feet, ZONE). Franz McGrady misses. Offensive rebound by Lamelo Towns! Lamelo Towns kicks it out.

[05:02] Team_086 possession (Score: 20-36)
Anfernee Green attempts a 3Pt. Contested by Manu Jokic (5.0 feet, MAN). Anfernee Green misses. Rebound secured by Carmelo Anunoby.

[04:47] Team_034 possession (Score: 20-36)
Nikola Wagner drives, Lamelo Towns stays with him. Nikola Wagner attempts a Layup. Contested by Lamelo Towns (5.5 feet, ZONE). Nikola Wagner misses. Rebound secured by Lamelo Towns.

[04:35] Team_086 possession (Score: 20-36)
Anfernee Green attempts a Midrange. Contested by Manu Jokic (5.0 feet, MAN). Anfernee Green misses. Offensive rebound by Lamelo Towns! Lamelo Towns kicks it out.

[04:20] Team_086 possession (Score: 20-36)
Anfernee Green attempts a 3Pt. Contested by Manu Jokic (5.0 feet, MAN). Anfernee Green misses. Rebound secured by Vince Paul.

[04:06] Team_034 possession (Score: 20-36)
Nikola Wagner makes the Dunk and draws the foul on Lamelo Towns! And-1! Nikola Wagner to the line for 1. [Team fouls: 2] (Lamelo Towns: 1 personal fouls)   FT 1/1: GOOD Nikola Wagner makes 1/1 from the line.
Score: 20-39

[03:52] Team_086 possession (Score: 20-39)
Anthony James attempts a Midrange. Wide open! Nikola Wagner is 6.7 feet away. [ZONE] ANTHONY JAMES MAKES IT! Assist: Kyle McCollum
Score: 22-39

[03:39] Team_034 possession (Score: 22-39)
Damian Turner attempts a 3Pt. Contested by Anthony James (4.5 feet, MAN). Damian Turner misses. Rebound secured by Lamelo Towns.

[03:26] Team_086 possession (Score: 22-39)
Kyle McCollum attempts a Midrange. Wide open! Nikola Wagner is 6.0 feet away. [MAN] KYLE MCCOLLUM MAKES IT! Assist: Anfernee Green
Score: 24-39

[03:13] Team_034 possession (Score: 24-39)
Carmelo Anunoby attempts a Midrange. Contested by Lamelo Towns (5.5 feet, MAN). CARMELO ANUNOBY MAKES IT!
Score: 24-41

[02:59] Team_086 possession (Score: 24-41)
Franz McGrady drives and kicks out. Lamelo Towns attempts a 3Pt. Contested by Carmelo Anunoby (5.4 feet, MAN). Lamelo Towns misses. Rebound secured by Carmelo Anunoby.

[02:45] Team_034 possession (Score: 24-41)
Damian Turner attempts a 3Pt. Contested by Anfernee Green (4.5 feet, ZONE). Damian Turner misses. Rebound secured by Kyle McCollum.

[02:33] Team_086 possession (Score: 24-41)
FOUL! Holding foul on Carmelo Anunoby. [Team fouls: 2] No free throws, side out. (Carmelo Anunoby: 1 personal fouls)

[02:20] Team_086 possession (Score: 24-41)
FOUL! Shooting foul on Nikola Wagner. Kyle McCollum to the line for 2 free throws. [Team fouls: 3] (Nikola Wagner: 1 personal fouls)   FT 1/2: GOOD   FT 2/2: GOOD Kyle McCollum makes 2/2 from the line.
Score: 26-41

[02:00] Team_034 possession (Score: 26-41)
Carmelo Anunoby attempts a 3Pt. Contested by Lamelo Towns (5.5 feet, MAN). Carmelo Anunoby misses. Offensive rebound by Vince Paul! Vince Paul's putback is no good. Offensive rebound by Carmelo Anunoby! Carmelo Anunoby kicks it out.

[01:44] Team_034 possession (Score: 26-41)
Carmelo Anunoby commits a violation (traveling/carry)! TURNOVER! (dead ball)

[01:31] Team_086 possession (Score: 26-41)
Anthony James attempts a 3Pt. Wide open! Damian Turner is 6.1 feet away. [MAN] ANTHONY JAMES MAKES IT! Assist: Kyle McCollum
Score: 29-41

[01:20] Team_034 possession (Score: 29-41)
Manu Jokic drives, picks up Lamelo Towns. Help arrives from Anfernee Green! Manu Jokic attempts a Layup. Contested by Anfernee Green (5.4 feet, ZONE). Manu Jokic misses. Rebound secured by Lamelo Towns.

[01:08] Team_086 possession (Score: 29-41)
Lamelo Towns drives, Carmelo Anunoby stays with him. Lamelo Towns attempts a Layup. Contested by Carmelo Anunoby (5.2 feet, ZONE). LAMELO TOWNS MAKES IT! Assist: Kyle McCollum
Score: 31-41

[00:55] Team_034 possession (Score: 31-41)
Vince Paul drives, picks up Franz McGrady. Help arrives from Anfernee Green! Vince Paul attempts a Dunk. Contested by Anfernee Green (5.3 feet, MAN). Vince Paul misses. Offensive rebound by Vince Paul! Vince Paul puts it back in!
Score: 31-43

[00:42] Team_086 possession (Score: 31-43)
Franz McGrady attempts a Midrange. Contested by Manu Jokic (4.9 feet, ZONE). FRANZ MCGRADY MAKES IT! Assist: Anthony James
Score: 33-43

[00:28] Team_034 possession (Score: 33-43)
FOUL! Shooting foul on Anthony James. Damian Turner to the line for 2 free throws. [Team fouls: 3] (Anthony James: 1 personal fouls)   FT 1/2: GOOD   FT 2/2: MISS Damian Turner makes 1/2 from the line. Rebound secured by Lamelo Towns.
Score: 33-44

[00:14] Team_086 possession (Score: 33-44)
Lamelo Towns attempts a Layup. Contested by Carmelo Anunoby (5.2 feet, MAN). Lamelo Towns misses. Rebound secured by Nikola Wagner.

================================================================================
                              2ND QUARTER COMPLETE                              
================================================================================

2ND QUARTER SCORE: Team_086 23, Team_034 12

BOX SCORE:
================================================================================

Team_086
--------------------------------------------------------------------------------
Player                MIN  PTS  REB  AST  TO      FG   FG%      3P   3P%
--------------------------------------------------------------------------------
Miles Gobert           18    5    4    0   0   2/4    50.0     0/0   0.0
Anthony James           6    5    0    1   0   2/2   100.0     0/0   0.0
Kyle McCollum           6    4    2    3   0   2/2   100.0     0/0   0.0
Bones Ginobili         18    3    1    0   0   1/1   100.0     0/0   0.0
Rudy Rose              18    2    3    0   0   1/1   100.0     0/0   0.0
Lamelo Towns            6    2    6    0   0   1/2    50.0     0/0   0.0
Franz McGrady           6    2    0    0   0   1/2    50.0     0/0   0.0
Anfernee Harris        18    0    0    2   0   0/3     0.0     0/0   0.0
Lauri Johnson          18    0    0    0   0   0/2     0.0     0/0   0.0
Anfernee Green          6    0    0    1   0   0/2     0.0     0/0   0.0

TEAM: FG: 10/21 (47.6%), 3PT: 2/11 (18.2%), REB: 16 (3 off, 13 def), AST: 7, TO: 2
TEAM FOULS: 3


Team_034
--------------------------------------------------------------------------------
Player                MIN  PTS  REB  AST  TO      FG   FG%      3P   3P%
--------------------------------------------------------------------------------
Devin Poole            18    3    0    0   0   1/3    33.3     0/0   0.0
Nikola Wagner           6    3    1    0   0   1/2    50.0     0/0   0.0
Carmelo Anunoby         6    2    3    0   0   1/1   100.0     0/0   0.0
Vince Paul              6    2    2    0   0   1/1   100.0     0/0   0.0
Cole Antetokounmpo     18    0    1    0   0   0/3     0.0     0/0   0.0
Anthony Bane           18    0    4    0   0   0/1     0.0     0/0   0.0
Terry Doncic           18    0    3    0   0   0/2     0.0     0/0   0.0
Manu Jokic              6    0    0    0   0   0/2     0.0     0/0   0.0
Damian Turner           6    0    0    0   0   0/3     0.0     0/0   0.0

TEAM: FG: 4/18 (22.2%), 3PT: 1/6 (16.7%), REB: 14 (3 off, 11 def), AST: 0, TO: 4
TEAM FOULS: 3

================================================================================

================================================================================
                       3RD QUARTER - Team_086 vs Team_034                       
================================================================================

[12:00] Team_086 possession (Score: 33-44)
Rudy Rose drives and kicks out. Anfernee Harris attempts a 3Pt. Contested by Ben Hyland (3.6 feet, MAN). Anfernee Harris misses. Offensive rebound by Miles Gobert! Miles Gobert kicks it out.

[11:50] Team_086 possession (Score: 33-44)
Lauri Johnson attempts a Midrange. Contested by Devin Poole (4.1 feet, MAN). Lauri Johnson misses. Rebound secured by Terry Doncic.

[11:39] Team_034 possession (Score: 33-44)
FOUL! Reach-in foul on Rudy Rose during the drive. [Team fouls: 1] No free throws, side out. (Rudy Rose: 1 personal fouls)

[11:22] Team_034 possession (Score: 33-44)
Devin Poole drives and kicks out. Terry Doncic attempts a Midrange. Contested by Bones Ginobili (4.8 feet, MAN). Terry Doncic misses. Rebound secured by Miles Gobert.

[11:05] Team_086 possession (Score: 33-44)
FOUL! Reach-in foul on Terry Doncic during the drive. [Team fouls: 1] No free throws, side out. (Terry Doncic: 1 personal fouls)

[10:52] Team_086 possession (Score: 33-44)
Anfernee Harris attempts a 3Pt. Contested by Cole Antetokounmpo (5.1 feet, ZONE). Anfernee Harris misses. Offensive rebound by Miles Gobert! Miles Gobert kicks it out.

[10:35] Team_086 possession (Score: 33-44)
FOUL! Reach-in foul on Terry Doncic during the drive. [Team fouls: 2] No free throws, side out. (Terry Doncic: 2 personal fouls)

[10:21] Team_086 possession (Score: 33-44)
FOUL! Shooting foul on Terry Doncic. Bones Ginobili to the line for 2 free throws. [Team fouls: 3] (Terry Doncic: 3 personal fouls)   FT 1/2: MISS   FT 2/2: MISS Bones Ginobili makes 0/2 from the line. Offensive rebound by Rudy Rose! Rudy Rose puts it back in!
Score: 35-44

[10:04] Team_034 possession (Score: 35-44)
Ben Hyland attempts a 3Pt. Contested by Lauri Johnson (4.5 feet, ZONE). Ben Hyland misses. Offensive rebound by Anthony Bane! Anthony Bane kicks it out.

[09:47] Team_034 possession (Score: 35-44)
Anthony Bane throws a bad pass out of bounds! TURNOVER! (dead ball)

[09:35] Team_086 possession (Score: 35-44)
FOUL! Shooting foul on Anthony Bane. Rudy Rose to the line for 2 free throws. [Team fouls: 4] (Anthony Bane: 1 personal fouls)   FT 1/2: GOOD   FT 2/2: GOOD Rudy Rose makes 2/2 from the line.
Score: 37-44

[09:21] Team_034 possession (Score: 37-44)
Devin Poole makes the Layup and draws the foul on Rudy Rose! And-1! Devin Poole to the line for 1. [Team fouls: 2] (Rudy Rose: 2 personal fouls)   FT 1/1: MISS Devin Poole makes 0/1 from the line. Offensive rebound by Anthony Bane! Anthony Bane kicks it out.
Score: 37-46

[09:07] Team_034 possession (Score: 37-46)
Devin Poole attempts a 3Pt. Contested by Miles Gobert (3.4 feet, ZONE). Devin Poole misses. Rebound secured by Bones Ginobili.

[08:51] Team_086 possession (Score: 37-46)
Lauri Johnson attempts a 3Pt. Contested by Devin Poole (4.1 feet, ZONE). LAURI JOHNSON MAKES IT! Assist: Bones Ginobili
Score: 40-46

[08:36] Team_034 possession (Score: 40-46)
Ben Hyland attempts a 3Pt. Contested by Anfernee Harris (4.3 feet, MAN). BEN HYLAND MAKES IT! Assist: Cole Antetokounmpo
Score: 40-49

[08:21] Team_086 possession (Score: 40-49)
FOUL! Shooting foul on Ben Hyland. Bones Ginobili to the line for 2 free throws. [BONUS: 5 team fouls] (Ben Hyland: 1 personal fouls)   FT 1/2: GOOD   FT 2/2: GOOD Bones Ginobili makes 2/2 from the line.
Score: 42-49

[08:06] Team_034 possession (Score: 42-49)
FOUL! Holding foul on Lauri Johnson. [Team fouls: 3] No free throws, side out. (Lauri Johnson: 1 personal fouls)

[07:48] Team_034 possession (Score: 42-49)
Cole Antetokounmpo attempts a 3Pt. Contested by Miles Gobert (4.0 feet, MAN). Cole Antetokounmpo misses. Rebound secured by Bones Ginobili.

[07:34] Team_086 possession (Score: 42-49)
Miles Gobert drives to the basket... Miles Gobert throws a bad pass! Stolen by Terry Doncic! TURNOVER! (live ball)

[07:20] Team_034 possession (Score: 42-49)
Ben Hyland attempts a Midrange. Contested by Anfernee Harris (4.3 feet, MAN). BEN HYLAND MAKES IT! Assist: Cole Antetokounmpo
Score: 42-51

[07:06] Team_086 possession (Score: 42-51)
Bones Ginobili attempts a Midrange. Contested by Terry Doncic (4.5 feet, MAN). Bones Ginobili misses. Rebound secured by Cole Antetokounmpo.

[06:52] Team_034 possession (Score: 42-51)
Cole Antetokounmpo attempts a 3Pt. Contested by Miles Gobert (4.0 feet, MAN). Cole Antetokounmpo misses. Rebound secured by Bones Ginobili.

[06:37] Team_086 possession (Score: 42-51)
Miles Gobert throws a bad pass! Stolen by Cole Antetokounmpo! TURNOVER! (live ball)

[06:26] Team_034 possession (Score: 42-51)
Anthony Bane attempts a Layup. Contested by Rudy Rose (3.8 feet, MAN). ANTHONY BANE MAKES IT!
Score: 42-53

[06:16] Team_086 possession (Score: 42-53)
Bones Ginobili attempts a 3Pt. Contested by Devin Poole (4.3 feet, ZONE). Bones Ginobili misses. Rebound secured by Terry Doncic.

[06:00] Team_034 possession (Score: 42-53)
Cole Antetokounmpo attempts a 3Pt. Contested by Miles Gobert (4.0 feet, MAN). Cole Antetokounmpo misses. Rebound secured by Miles Gobert.

[05:48] Team_086 possession (Score: 42-53)
Miles Gobert attempts a 3Pt. Contested by Devin Poole (4.1 feet, ZONE). Miles Gobert misses. Rebound secured by Cole Antetokounmpo.

[05:32] Team_034 possession (Score: 42-53)
Cole Antetokounmpo attempts a 3Pt. Contested by Miles Gobert (4.0 feet, MAN). Cole Antetokounmpo misses. Rebound secured by Bones Ginobili.

[05:16] Team_086 possession (Score: 42-53)
Lauri Johnson attempts a 3Pt. Contested by Devin Poole (4.2 feet, ZONE). Lauri Johnson misses. Rebound secured by Anthony Bane.

[04:59] Team_034 possession (Score: 42-53)
FOUL! Holding foul on Rudy Rose. [Team fouls: 4] No free throws, side out. (Rudy Rose: 3 personal fouls)

[04:47] Team_034 possession (Score: 42-53)
Terry Doncic attempts a 3Pt. Contested by Bones Ginobili (4.9 feet, ZONE). Terry Doncic misses. Rebound secured by Miles Gobert.

[04:30] Team_086 possession (Score: 42-53)
FOUL! Holding foul on Devin Poole. [IN THE BONUS! 6 team fouls] Lauri Johnson to the line for 2 free throws. (Devin Poole: 1 personal fouls)   FT 1/2: MISS   FT 2/2: GOOD Lauri Johnson makes 1/2 from the line.
Score: 43-53

[04:13] Team_034 possession (Score: 43-53)
Anthony Bane attempts a 3Pt. Contested by Rudy Rose (3.9 feet, MAN). ANTHONY BANE MAKES IT! Assist: Terry Doncic
Score: 43-56

[03:58] Team_086 possession (Score: 43-56)
Rudy Rose attempts a Layup. Contested by Anthony Bane (5.5 feet, MAN). RUDY ROSE MAKES IT! Assist: Anfernee Harris
Score: 45-56

[03:44] Team_034 possession (Score: 45-56)
Devin Poole makes the Layup and draws the foul on Lauri Johnson! And-1! Devin Poole to the line for 1. [BONUS: 5 team fouls] (Lauri Johnson: 2 personal fouls)   FT 1/1: GOOD Devin Poole makes 1/1 from the line.
Score: 45-59

[03:30] Team_086 possession (Score: 45-59)
Miles Gobert attempts a Layup. Contested by Terry Doncic (4.4 feet, ZONE). MILES GOBERT MAKES IT! Assist: Bones Ginobili
Score: 47-59

[03:19] Team_034 possession (Score: 47-59)
Terry Doncic attempts a Layup. Contested by Rudy Rose (3.9 feet, ZONE). TERRY DONCIC MAKES IT! Assist: Ben Hyland
Score: 47-61

[03:05] Team_086 possession (Score: 47-61)
Anfernee Harris attempts a Midrange. Contested by Ben Hyland (4.3 feet, ZONE). Anfernee Harris misses. Rebound secured by Terry Doncic.

[02:46] Team_034 possession (Score: 47-61)
Ben Hyland attempts a Midrange. Contested by Miles Gobert (3.7 feet, ZONE). BEN HYLAND MAKES IT! Assist: Devin Poole
Score: 47-63

[02:31] Team_086 possession (Score: 47-63)
Miles Gobert attempts a Midrange. Contested by Ben Hyland (4.0 feet, ZONE). Miles Gobert misses. Rebound secured by Terry Doncic.

[02:21] Team_034 possession (Score: 47-63)
Terry Doncic drives and kicks out. Cole Antetokounmpo attempts a 3Pt. Contested by Miles Gobert (3.7 feet, MAN). Cole Antetokounmpo misses. Rebound secured by Rudy Rose.

[02:04] Team_086 possession (Score: 47-63)
Anfernee Harris attempts a 3Pt. Contested by Ben Hyland (4.4 feet, MAN). ANFERNEE HARRIS MAKES IT! Assist: Bones Ginobili
Score: 50-63

[01:50] Team_034 possession (Score: 50-63)
Anthony Bane makes the Dunk and draws the foul on Rudy Rose! And-1! Anthony Bane to the line for 1. [BONUS: 6 team fouls] (Rudy Rose: 4 personal fouls)   FT 1/1: GOOD Anthony Bane makes 1/1 from the line.
Score: 50-66

[01:37] Team_086 possession (Score: 50-66)
Rudy Rose attempts a Layup. Contested by Anthony Bane (5.7 feet, MAN). Rudy Rose misses. Rebound secured by Cole Antetokounmpo.

[01:26] Team_034 possession (Score: 50-66)
Ben Hyland drives, picks up Anfernee Harris. Help arrives from Miles Gobert! Ben Hyland attempts a Dunk. Contested by Miles Gobert (4.7 feet, MAN). Ben Hyland misses. Rebound secured by Rudy Rose.

[01:09] Team_086 possession (Score: 50-66)
Miles Gobert drives and kicks out. FOUL! Shooting foul on Devin Poole. Miles Gobert to the line for 3 free throws. [BONUS: 7 team fouls] (Devin Poole: 2 personal fouls)   FT 1/3: GOOD   FT 2/3: GOOD   FT 3/3: GOOD Miles Gobert makes 3/3 from the line.
Score: 53-66

[00:51] Team_034 possession (Score: 53-66)
Anthony Bane drives and kicks out. Anthony Bane attempts a Midrange. Contested by Rudy Rose (4.1 feet, MAN). Anthony Bane misses. Rebound secured by Miles Gobert.

[00:32] Team_086 possession (Score: 53-66)
Miles Gobert attempts a Midrange. Contested by Cole Antetokounmpo (5.2 feet, MAN). Miles Gobert misses. Rebound secured by Anthony Bane.

[00:16] Team_034 possession (Score: 53-66)
Devin Poole attempts a 3Pt. Contested by Lauri Johnson (4.7 feet, MAN). Devin Poole misses. Rebound secured by Bones Ginobili.

[00:04] Team_086 possession (Score: 53-66)
Rudy Rose drives, Terry Doncic stays with him. Rudy Rose attempts a Layup. Contested by Terry Doncic (4.8 feet, ZONE). RUDY ROSE MAKES IT! Assist: Anfernee Harris
Score: 55-66

================================================================================
                              3RD QUARTER COMPLETE                              
================================================================================

3RD QUARTER SCORE: Team_086 22, Team_034 22

BOX SCORE:
================================================================================

Team_086
--------------------------------------------------------------------------------
Player                MIN  PTS  REB  AST  TO      FG   FG%      3P   3P%
--------------------------------------------------------------------------------
Rudy Rose              30    8    2    0   0   4/5    80.0     0/0   0.0
Miles Gobert           30    5    6    0   0   2/5    40.0     0/0   0.0
Lauri Johnson          30    4    0    0   0   2/4    50.0     0/0   0.0
Anfernee Harris        30    3    0    2   0   1/2    50.0     0/0   0.0
Bones Ginobili         30    2    5    3   0   1/3    33.3     0/0   0.0

TEAM: FG: 10/19 (52.6%), 3PT: 2/5 (40.0%), REB: 13 (2 off, 11 def), AST: 5, TO: 2
TEAM FOULS: 6 [Team_034 in BONUS]


Team_034
--------------------------------------------------------------------------------
Player                MIN  PTS  REB  AST  TO      FG   FG%      3P   3P%
--------------------------------------------------------------------------------
Anthony Bane           30    8    4    0   0   3/4    75.0     0/0   0.0
Ben Hyland             30    7    0    1   0   3/4    75.0     0/0   0.0
Devin Poole            30    3    0    1   0   1/4    25.0     0/0   0.0
Terry Doncic           30    2    4    1   0   1/3    33.3     0/0   0.0
Cole Antetokounmpo     30    0    3    2   0   0/4     0.0     0/0   0.0

TEAM: FG: 8/19 (42.1%), 3PT: 2/9 (22.2%), REB: 11 (2 off, 9 def), AST: 5, TO: 1
TEAM FOULS: 7 [Team_086 in BONUS]

================================================================================

================================================================================
                       4TH QUARTER - Team_086 vs Team_034                       
================================================================================

[12:00] Substitution (Team_086): Lauri Johnson OUT (stamina: 70) → Anfernee Green IN (comeback_detected)

[12:00] Substitution (Team_034): Devin Poole OUT (stamina: 67) → Manu Jokic IN (comeback_detected)

[12:00] Team_086 possession (Score: 55-66)
Anfernee Green attempts a Layup. Contested by Terry Doncic (4.6 feet, ZONE). ANFERNEE GREEN MAKES IT!
Score: 57-66

[11:47] Team_034 possession (Score: 57-66)
Anthony Bane drives, Rudy Rose stays with him. Anthony Bane attempts a Dunk. Contested by Rudy Rose (4.1 feet, MAN). Anthony Bane misses. Rebound secured by Rudy Rose.

[11:34] Team_086 possession (Score: 57-66)
Miles Gobert attempts a 3Pt. Contested by Ben Hyland (4.1 feet, ZONE). Miles Gobert misses. Rebound secured by Terry Doncic.

[11:15] Team_034 possession (Score: 57-66)
Terry Doncic attempts a Midrange. Contested by Anfernee Harris (4.7 feet, ZONE). TERRY DONCIC MAKES IT! Assist: Cole Antetokounmpo
Score: 57-68

[11:01] Team_086 possession (Score: 57-68)
Bones Ginobili attempts a 3Pt. Contested by Terry Doncic (4.9 feet, MAN). Bones Ginobili misses. Offensive rebound by Rudy Rose! Rudy Rose puts it back in!
Score: 59-68

[10:51] Team_034 possession (Score: 59-68)
Manu Jokic attempts a 3Pt. Contested by Miles Gobert (4.0 feet, ZONE). Manu Jokic misses. Offensive rebound by Terry Doncic! Terry Doncic puts it back in!
Score: 59-70

[10:39] Team_086 possession (Score: 59-70)
FOUL! Shooting foul on Ben Hyland. Anfernee Harris to the line for 2 free throws. [Team fouls: 1] (Ben Hyland: 1 personal fouls)   FT 1/2: GOOD   FT 2/2: MISS Anfernee Harris makes 1/2 from the line. Rebound secured by Terry Doncic.
Score: 60-70

[10:25] Team_034 possession (Score: 60-70)
Ben Hyland drives, picks up Rudy Rose. Help arrives from Anfernee Green! Ben Hyland attempts a Dunk. Contested by Anfernee Green (4.2 feet, ZONE). BEN HYLAND MAKES IT!
Score: 60-72

[10:10] Team_086 possession (Score: 60-72)
Miles Gobert attempts a Midrange. Contested by Cole Antetokounmpo (5.2 feet, MAN). Miles Gobert misses. Rebound secured by Terry Doncic.

[09:57] Team_034 possession (Score: 60-72)
Cole Antetokounmpo drives, Rudy Rose stays with him. Cole Antetokounmpo attempts a Layup. Contested by Rudy Rose (4.6 feet, ZONE). COLE ANTETOKOUNMPO MAKES IT! Assist: Terry Doncic
Score: 60-74

[09:41] Team_086 possession (Score: 60-74)
Anfernee Green attempts a 3Pt. Contested by Manu Jokic (5.0 feet, MAN). Anfernee Green misses. Rebound secured by Terry Doncic.

[09:28] Team_034 possession (Score: 60-74)
Cole Antetokounmpo attempts a 3Pt. Contested by Anfernee Green (4.4 feet, ZONE). Cole Antetokounmpo misses. Rebound secured by Anfernee Green.

[09:17] Team_086 possession (Score: 60-74)
Miles Gobert drives and kicks out. Anfernee Harris attempts a Midrange. Contested by Terry Doncic (4.8 feet, ZONE). Anfernee Harris misses. Rebound secured by Cole Antetokounmpo.

[09:08] Team_034 possession (Score: 60-74)
Anthony Bane makes the Layup and draws the foul on Rudy Rose! And-1! Anthony Bane to the line for 1. [Team fouls: 1] (Rudy Rose: 1 personal fouls)   FT 1/1: MISS Anthony Bane makes 0/1 from the line. Offensive rebound by Terry Doncic! Terry Doncic kicks it out.
Score: 60-76

[08:52] Team_034 possession (Score: 60-76)
Anthony Bane attempts a Midrange. Contested by Miles Gobert (4.2 feet, ZONE). ANTHONY BANE MAKES IT!
Score: 60-78

[08:39] Team_086 possession (Score: 60-78)
FOUL! Reach-in foul on Terry Doncic during the drive. [Team fouls: 2] No free throws, side out. (Terry Doncic: 1 personal fouls)

[08:27] Team_086 possession (Score: 60-78)
Miles Gobert drives, Terry Doncic stays with him. Miles Gobert attempts a Dunk. Contested by Terry Doncic (5.1 feet, ZONE). MILES GOBERT MAKES IT! Assist: Anfernee Green
Score: 62-78

[08:15] Team_034 possession (Score: 62-78)
Cole Antetokounmpo drives and kicks out. Cole Antetokounmpo attempts a 3Pt. Contested by Miles Gobert (4.3 feet, MAN). Cole Antetokounmpo misses. Rebound secured by Rudy Rose.

[08:04] Team_086 possession (Score: 62-78)
Anfernee Harris attempts a Layup. Contested by Terry Doncic (5.4 feet, ZONE). ANFERNEE HARRIS MAKES IT! Assist: Bones Ginobili
Score: 64-78

[07:54] Team_034 possession (Score: 64-78)
Cole Antetokounmpo attempts a 3Pt. Contested by Anfernee Green (4.4 feet, ZONE). COLE ANTETOKOUNMPO MAKES IT! Assist: Ben Hyland
Score: 64-81

[07:40] Team_086 possession (Score: 64-81)
FOUL! Shooting foul on Terry Doncic. Bones Ginobili to the line for 2 free throws. [Team fouls: 3] (Terry Doncic: 2 personal fouls)   FT 1/2: GOOD   FT 2/2: GOOD Bones Ginobili makes 2/2 from the line.
Score: 66-81

[07:25] Team_034 possession (Score: 66-81)
Ben Hyland attempts a 3Pt. BLOCKED BY ANFERNEE HARRIS! Ball deflects out of bounds off Ben Hyland.

[07:13] Team_086 possession (Score: 66-81)
Bones Ginobili drives, Terry Doncic stays with him. Bones Ginobili attempts a Layup. Contested by Terry Doncic (5.4 feet, ZONE). Bones Ginobili misses. Rebound secured by Terry Doncic.

[06:56] Team_034 possession (Score: 66-81)
Anthony Bane drives and kicks out. Anthony Bane attempts a 3Pt. Contested by Anfernee Green (4.1 feet, ZONE). ANTHONY BANE MAKES IT! Assist: Ben Hyland
Score: 66-84

[06:40] Team_086 possession (Score: 66-84)
Anfernee Green attempts a 3Pt. Contested by Manu Jokic (5.0 feet, MAN). Anfernee Green misses. Offensive rebound by Rudy Rose! Rudy Rose puts it back in!
Score: 68-84

[06:28] Team_034 possession (Score: 68-84)
Terry Doncic attempts a Layup. Contested by Bones Ginobili (5.8 feet, MAN). Terry Doncic misses. FOUL! Loose ball foul on Miles Gobert during the rebound battle. [Team fouls: 2] No free throws, side out. (Miles Gobert: 1 personal fouls)

[06:12] Team_034 possession (Score: 68-84)
Ben Hyland attempts a 3Pt. Contested by Anfernee Harris (5.4 feet, MAN). Ben Hyland misses. Rebound secured by Anfernee Green.

[06:00] Team_086 possession (Score: 68-84)
Miles Gobert attempts a 3Pt. Contested by Manu Jokic (4.8 feet, ZONE). Miles Gobert misses. Rebound secured by Terry Doncic.

[05:47] Team_034 possession (Score: 68-84)
Terry Doncic attempts a 3Pt. Contested by Miles Gobert (4.6 feet, ZONE). Terry Doncic misses. Rebound secured by Anfernee Green.

[05:37] Team_086 possession (Score: 68-84)
Rudy Rose makes the Midrange and draws the foul on Terry Doncic! And-1! Rudy Rose to the line for 1. [Team fouls: 4] (Terry Doncic: 3 personal fouls)   FT 1/1: MISS Rudy Rose makes 0/1 from the line. Offensive rebound by Anfernee Green! Anfernee Green kicks it out.
Score: 70-84

[05:24] Team_086 possession (Score: 70-84)
FOUL! Reach-in foul on Terry Doncic during the drive. [IN THE BONUS! 5 team fouls] Bones Ginobili to the line for 2 free throws. (Terry Doncic: 4 personal fouls)   FT 1/2: GOOD   FT 2/2: GOOD Bones Ginobili makes 2/2 from the line.
Score: 72-84

[05:10] Team_034 possession (Score: 72-84)
Manu Jokic drives, picks up Rudy Rose. Help arrives from Anfernee Green! Manu Jokic attempts a Layup. Contested by Anfernee Green (5.1 feet, ZONE). MANU JOKIC MAKES IT! Assist: Ben Hyland
Score: 72-86

[04:55] Team_086 possession (Score: 72-86)
Miles Gobert drives, Cole Antetokounmpo stays with him. Miles Gobert attempts a Dunk. Contested by Cole Antetokounmpo (6.0 feet, MAN). Miles Gobert misses. Rebound secured by Terry Doncic.

[04:39] Team_034 possession (Score: 72-86)
Anthony Bane attempts a 3Pt. Contested by Rudy Rose (5.0 feet, MAN). Anthony Bane misses. Rebound secured by Anfernee Green.

[04:22] Team_086 possession (Score: 72-86)
Anfernee Harris attempts a 3Pt. Contested by Manu Jokic (5.1 feet, ZONE). Anfernee Harris misses. Rebound secured by Anthony Bane.

[04:09] Team_034 possession (Score: 72-86)
Terry Doncic makes the Dunk and draws the foul on Rudy Rose! And-1! Terry Doncic to the line for 1. [Team fouls: 3] (Rudy Rose: 2 personal fouls)   FT 1/1: GOOD Terry Doncic makes 1/1 from the line.
Score: 72-89

[03:58] Team_086 possession (Score: 72-89)
Rudy Rose throws a bad pass out of bounds! TURNOVER! (dead ball)

[03:58] Substitution (Team_086): Anfernee Harris OUT → Anthony James IN (stamina_rule2)

[03:58] Substitution (Team_086): Miles Gobert OUT → Franz McGrady IN (stamina_rule2)

[03:58] Substitution (Team_086): Bones Ginobili OUT → Kyle McCollum IN (stamina_rule2)

[03:58] Substitution (Team_086): Rudy Rose OUT → Lamelo Towns IN (stamina_rule2)

[03:58] Substitution (Team_034): Ben Hyland OUT → Damian Turner IN (stamina_rule2)

[03:58] Substitution (Team_034): Cole Antetokounmpo OUT → Vince Paul IN (stamina_rule2)

[03:58] Substitution (Team_034): Terry Doncic OUT → Nikola Wagner IN (stamina_rule2)

[03:58] Substitution (Team_034): Anthony Bane OUT → Carmelo Anunoby IN (stamina_rule2)

[03:42] Team_034 possession (Score: 72-89)
Damian Turner drives, picks up Anthony James. Help arrives from Anfernee Green! Damian Turner attempts a Dunk. Contested by Anfernee Green (4.5 feet, MAN). Damian Turner misses. Rebound secured by Kyle McCollum.

[03:27] Team_086 possession (Score: 72-89)
FOUL! Reach-in foul on Nikola Wagner during the drive. [IN THE BONUS! 6 team fouls] Franz McGrady to the line for 2 free throws. (Nikola Wagner: 1 personal fouls)   FT 1/2: GOOD   FT 2/2: MISS Franz McGrady makes 1/2 from the line. Offensive rebound by Anfernee Green! Anfernee Green kicks it out.
Score: 73-89

[03:14] Team_086 possession (Score: 73-89)
Lamelo Towns attempts a Midrange. Contested by Carmelo Anunoby (5.2 feet, MAN). Lamelo Towns misses. Offensive rebound by Anfernee Green! Anfernee Green kicks it out.

[02:55] Team_086 possession (Score: 73-89)
Anfernee Green attempts a 3Pt. Contested by Manu Jokic (5.2 feet, MAN). ANFERNEE GREEN MAKES IT! Assist: Anthony James
Score: 76-89

[02:38] Team_034 possession (Score: 76-89)
Manu Jokic makes the Layup and draws the foul on Anfernee Green! And-1! Manu Jokic to the line for 1. [Team fouls: 4] (Anfernee Green: 1 personal fouls)   FT 1/1: GOOD Manu Jokic makes 1/1 from the line.
Score: 76-92

[02:27] Team_086 possession (Score: 76-92)
Kyle McCollum attempts a Midrange. Wide open! Nikola Wagner is 6.0 feet away. [MAN] Kyle McCollum misses. Rebound secured by Vince Paul.

[02:13] Team_034 possession (Score: 76-92)
Manu Jokic attempts a Midrange. Contested by Anfernee Green (4.5 feet, MAN). MANU JOKIC MAKES IT!
Score: 76-94

[02:00] Team_086 possession (Score: 76-94)
Lamelo Towns drives, picks up Carmelo Anunoby. Help arrives from Damian Turner! Lamelo Towns attempts a Dunk. Contested by Damian Turner (5.2 feet, ZONE). LAMELO TOWNS MAKES IT!
Score: 78-94

[01:46] Team_034 possession (Score: 78-94)
Vince Paul attempts a 3Pt. Contested by Anfernee Green (5.0 feet, ZONE). VINCE PAUL MAKES IT! Assist: Manu Jokic
Score: 78-97

[01:27] Team_086 possession (Score: 78-97)
Anthony James attempts a 3Pt. Wide open! Damian Turner is 6.1 feet away. [MAN] ANTHONY JAMES MAKES IT! Assist: Anfernee Green
Score: 81-97

[01:16] Team_034 possession (Score: 81-97)
Carmelo Anunoby attempts a Midrange. Contested by Lamelo Towns (5.5 feet, MAN). Carmelo Anunoby misses. Offensive rebound by Vince Paul! Vince Paul puts it back in!
Score: 81-99

[01:03] Team_086 possession (Score: 81-99)
Lamelo Towns attempts a Layup. BLOCKED BY CARMELO ANUNOBY! Ball is loose! Rebound secured by Vince Paul.

[00:47] Team_034 possession (Score: 81-99)
Carmelo Anunoby attempts a Midrange. Contested by Lamelo Towns (5.5 feet, MAN). Carmelo Anunoby misses. Rebound secured by Lamelo Towns.

[00:32] Team_086 possession (Score: 81-99)
Kyle McCollum attempts a 3Pt. Contested by Vince Paul (4.2 feet, ZONE). KYLE MCCOLLUM MAKES IT! Assist: Anfernee Green
Score: 84-99

[00:17] Team_034 possession (Score: 84-99)
Manu Jokic attempts a Midrange. Contested by Franz McGrady (4.9 feet, ZONE). Manu Jokic misses. FOUL! Loose ball foul on Lamelo Towns during the rebound battle. [IN THE BONUS! 5 team fouls] Carmelo Anunoby to the line for 2 free throws. (Lamelo Towns: 1 personal fouls)   FT 1/2: GOOD   FT 2/2: GOOD Carmelo Anunoby makes 2/2 from the line.
Score: 84-101

[00:01] Team_086 possession (Score: 84-101)
Kyle McCollum attempts a Midrange. Wide open! Nikola Wagner is 6.0 feet away. [ZONE] Kyle McCollum misses. Rebound secured by Carmelo Anunoby.

================================================================================
                              4TH QUARTER COMPLETE                              
================================================================================

4TH QUARTER SCORE: Team_086 29, Team_034 35

BOX SCORE:
================================================================================

Team_086
--------------------------------------------------------------------------------
Player                MIN  PTS  REB  AST  TO      FG   FG%      3P   3P%
--------------------------------------------------------------------------------
Anfernee Green         18    5    7    3   0   2/3    66.7     0/0   0.0
Rudy Rose              39    4    4    0   0   2/2   100.0     0/0   0.0
Bones Ginobili         39    4    0    1   0   2/3    66.7     0/0   0.0
Kyle McCollum          10    3    1    0   0   1/3    33.3     0/0   0.0
Anthony James          10    3    0    1   0   1/1   100.0     0/0   0.0
Miles Gobert           39    2    0    0   0   1/6    16.7     0/0   0.0
Anfernee Harris        39    2    0    0   0   1/3    33.3     0/0   0.0
Lamelo Towns           10    2    1    0   0   1/2    50.0     0/0   0.0

TEAM: FG: 11/23 (47.8%), 3PT: 5/9 (55.6%), REB: 13 (5 off, 8 def), AST: 5, TO: 1
TEAM FOULS: 5 [Team_034 in BONUS]


Team_034
--------------------------------------------------------------------------------
Player                MIN  PTS  REB  AST  TO      FG   FG%      3P   3P%
--------------------------------------------------------------------------------
Terry Doncic           39    7    9    1   0   3/4    75.0     0/0   0.0
Manu Jokic             18    7    0    1   0   3/3   100.0     0/0   0.0
Anthony Bane           39    5    2    0   0   2/4    50.0     0/0   0.0
Cole Antetokounmpo     39    5    1    1   0   2/4    50.0     0/0   0.0
Vince Paul             10    5    3    0   0   2/2   100.0     0/0   0.0
Ben Hyland             39    2    0    3   0   1/3    33.3     0/0   0.0
Carmelo Anunoby        10    2    1    0   0   1/2    50.0     0/0   0.0
Damian Turner          10    0    0    0   0   0/1     0.0     0/0   0.0

TEAM: FG: 14/23 (60.9%), 3PT: 3/8 (37.5%), REB: 16 (4 off, 12 def), AST: 6, TO: 0
TEAM FOULS: 6 [Team_086 in BONUS]

================================================================================

================================================================================
                               FULL GAME COMPLETE                               
================================================================================

FINAL SCORE: Team_086 84, Team_034 101

SCORING BY QUARTER:
--------------------------------------------------------------------------------
Team                     Q1     Q2     Q3     Q4    FINAL
--------------------------------------------------------------------------------
Team_086                 10     23     22     29       84
Team_034                 32     12     22     35      101
--------------------------------------------------------------------------------

FULL GAME BOX SCORE:
================================================================================

Team_086
--------------------------------------------------------------------------------
Player                MIN  PTS  REB  AST  TO      FG   FG%      3P   3P%      FT STL BLK
--------------------------------------------------------------------------------
Anfernee Harris        39    5    0    4   2   2/12   16.7   1/8    12.5   1/2     1   1
Miles Gobert           39   12   14    1   3   5/18   27.8   1/9    11.1   3/3     0   0
Bones Ginobili         39   11    7    4   1   7/13   53.8   1/4    25.0   7/9     0   1
Rudy Rose              39   19   13    1   2   6/10   60.0   0/0     0.0   4/6     1   0
Lauri Johnson          30    6    0    0   0   2/7    28.6   1/5    20.0   1/2     2   1
Anfernee Green         18    5    7    4   1   3/6    50.0   2/5    40.0   0/0     0   0
Anthony James          10    8    0    2   0   3/3   100.0   2/2   100.0   0/0     0   0
Franz McGrady          10    2    0    0   0   1/2    50.0   0/0     0.0   1/2     0   0
Kyle McCollum          10    7    3    3   0   3/5    60.0   1/1   100.0   2/2     0   0
Lamelo Towns           10    4    7    0   0   2/4    50.0   0/0     0.0   0/0     0   0

TEAM: FG: 35/81 (43.2%), 3PT: 9/34 (26.5%), REB: 51 (15 off, 36 def), AST: 19, TO: 9


Team_034
--------------------------------------------------------------------------------
Player                MIN  PTS  REB  AST  TO      FG   FG%      3P   3P%      FT STL BLK
--------------------------------------------------------------------------------
Ben Hyland             39   12    0    4   1   7/11   63.6   4/7    57.1   1/2     0   0
Cole Antetokounmpo     39   15    8    3   1   6/15   40.0   3/11   27.3   2/2     2   0
Terry Doncic           39   23   27    3   1   7/14   50.0   0/2     0.0   3/3     1   0
Anthony Bane           39   15   16    0   2   7/12   58.3   1/2    50.0   1/2     1   0
Devin Poole            30    6    0    3   3   2/7    28.6   1/3    33.3   1/2     0   0
Manu Jokic             18    7    0    1   0   5/7    71.4   1/1   100.0   2/3     0   0
Damian Turner          10    0    0    0   0   0/4     0.0   0/2     0.0   1/2     0   0
Vince Paul             10    9    6    0   0   2/2   100.0   1/1   100.0   0/0     0   0
Nikola Wagner          10    3    1    0   0   2/3    66.7   0/0     0.0   1/1     1   0
Carmelo Anunoby        10    4    4    0   1   2/3    66.7   0/0     0.0   2/2     0   1

TEAM: FG: 40/78 (51.3%), 3PT: 11/29 (37.9%), REB: 61 (16 off, 45 def), AST: 14, TO: 9

================================================================================
