================================================================================
                        FULL GAME - Team_092 vs Team_034                        
================================================================================

================================================================================
                       1ST QUARTER - Team_092 vs Team_034                       
================================================================================

[12:00] Team_092 possession (Score: 0-0)
Austin Bridges attempts a 3Pt. Contested by Cole Antetokounmpo (4.3 feet, ZONE). Austin Bridges misses. Offensive rebound by Paul James! Paul James kicks it out.

[11:46] Team_092 possession (Score: 0-0)
Immanuel Ingram attempts a Midrange. Contested by Cole Antetokounmpo (4.4 feet, ZONE). IMMANUEL INGRAM MAKES IT!
Score: 2-0

[11:32] Team_034 possession (Score: 2-0)
Anthony Bane attempts a 3Pt. Contested by John Giddey (4.1 feet, ZONE). Anthony Bane misses. Offensive rebound by Anthony Bane! Anthony Bane kicks it out.

[11:21] Team_034 possession (Score: 2-0)
Anthony Bane attempts a Midrange. Contested by Immanuel Ingram (4.1 feet, MAN). ANTHONY BANE MAKES IT! Assist: Cole Antetokounmpo
Score: 2-2

[11:06] Team_092 possession (Score: 2-2)
Paul James attempts a Midrange. Contested by Cole Antetokounmpo (5.2 feet, MAN). Paul James misses. Rebound secured by Cole Antetokounmpo.

[10:48] Team_034 possession (Score: 2-2)
Ben Hyland attempts a Midrange. Contested by Karl Gobert (5.1 feet, ZONE). Ben Hyland misses. FOUL! Loose ball foul on Paul James during the rebound battle. [Team fouls: 1] No free throws, side out. (Paul James: 1 personal fouls)

[10:34] Team_034 possession (Score: 2-2)
Cole Antetokounmpo attempts a 3Pt. Contested by Paul James (5.2 feet, MAN). COLE ANTETOKOUNMPO MAKES IT! Assist: Anthony Bane
Score: 2-5

[10:15] Team_092 possession (Score: 2-5)
Austin Bridges attempts a 3Pt. Contested by Devin Poole (3.7 feet, MAN). AUSTIN BRIDGES MAKES IT! Assist: Karl Gobert
Score: 5-5

[10:00] Team_034 possession (Score: 5-5)
Anthony Bane attempts a 3Pt. Contested by John Giddey (4.1 feet, ZONE). Anthony Bane misses. Rebound secured by John Giddey.

[09:43] Team_092 possession (Score: 5-5)
Austin Bridges attempts a Midrange. Contested by Cole Antetokounmpo (4.3 feet, ZONE). AUSTIN BRIDGES MAKES IT! Assist: John Giddey
Score: 7-5

[09:26] Team_034 possession (Score: 7-5)
Cole Antetokounmpo attempts a 3Pt. Contested by Karl Gobert (5.5 feet, ZONE). Cole Antetokounmpo misses. Offensive rebound by Anthony Bane! Anthony Bane kicks it out.

[09:12] Team_034 possession (Score: 7-5)
Cole Antetokounmpo attempts a 3Pt. Contested by Paul James (5.2 feet, MAN). Cole Antetokounmpo misses. Rebound secured by John Giddey.

[08:57] Team_092 possession (Score: 7-5)
FOUL! Holding foul on Ben Hyland. [Team fouls: 1] No free throws, side out. (Ben Hyland: 1 personal fouls)

[08:44] Team_092 possession (Score: 7-5)
Paul James makes the Layup and draws the foul on Terry Doncic! And-1! Paul James to the line for 1. [Team fouls: 2] (Terry Doncic: 1 personal fouls)   FT 1/1: GOOD Paul James makes 1/1 from the line.
Score: 10-5

[08:30] Team_034 possession (Score: 10-5)
Devin Poole attempts a Midrange. Contested by Austin Bridges (4.3 feet, ZONE). Devin Poole misses. Rebound secured by Paul James.

[08:14] Team_092 possession (Score: 10-5)
Karl Gobert attempts a Layup. Contested by Terry Doncic (3.9 feet, ZONE). KARL GOBERT MAKES IT! Assist: John Giddey
Score: 12-5

[07:57] Team_034 possession (Score: 12-5)
Devin Poole drives and kicks out. Anthony Bane attempts a Midrange. Contested by Immanuel Ingram (4.0 feet, MAN). Anthony Bane misses. Rebound secured by John Giddey.

[07:42] Team_092 possession (Score: 12-5)
Austin Bridges loses the ball! Stripped by Devin Poole! TURNOVER! (live ball)

[07:24] Team_034 possession (Score: 12-5)
Terry Doncic attempts a Midrange. Contested by John Giddey (4.1 feet, MAN). Terry Doncic misses. Rebound secured by Paul James.

[07:12] Team_092 possession (Score: 12-5)
Immanuel Ingram attempts a Midrange. Contested by Terry Doncic (3.9 feet, ZONE). Immanuel Ingram misses. Offensive rebound by Paul James! Paul James kicks it out.

[06:57] Team_092 possession (Score: 12-5)
Paul James attempts a Midrange. Contested by Ben Hyland (4.2 feet, ZONE). Paul James misses. Rebound secured by Terry Doncic.

[06:38] Team_034 possession (Score: 12-5)
Devin Poole attempts a Layup. BLOCKED BY AUSTIN BRIDGES! Ball deflects out of bounds off Devin Poole.

[06:21] Team_092 possession (Score: 12-5)
Austin Bridges attempts a 3Pt. Contested by Devin Poole (3.7 feet, ZONE). Austin Bridges misses. Offensive rebound by Paul James! Paul James kicks it out.

[06:08] Team_092 possession (Score: 12-5)
Austin Bridges attempts a Layup. Contested by Devin Poole (3.7 feet, MAN). AUSTIN BRIDGES MAKES IT! Assist: Paul James
Score: 14-5

[05:52] Team_034 possession (Score: 14-5)
Cole Antetokounmpo attempts a Midrange. Contested by Paul James (5.2 feet, MAN). Cole Antetokounmpo misses. Rebound secured by John Giddey.

[05:42] Team_092 possession (Score: 14-5)
Immanuel Ingram makes the Layup and draws the foul on Ben Hyland! And-1! Immanuel Ingram to the line for 1. [Team fouls: 3] (Ben Hyland: 2 personal fouls)   FT 1/1: GOOD Immanuel Ingram makes 1/1 from the line.
Score: 17-5

[05:30] Team_034 possession (Score: 17-5)
FOUL! Shooting foul on John Giddey. Anthony Bane to the line for 2 free throws. [Team fouls: 2] (John Giddey: 1 personal fouls)   FT 1/2: MISS   FT 2/2: GOOD Anthony Bane makes 1/2 from the line.
Score: 17-6

[05:15] Team_092 possession (Score: 17-6)
Immanuel Ingram drives to the basket... Immanuel Ingram loses the ball! Stripped by Anthony Bane! TURNOVER! (live ball)

[05:05] Team_034 possession (Score: 17-6)
Terry Doncic attempts a Dunk. BLOCKED BY JOHN GIDDEY! Ball is loose! Rebound secured by John Giddey.

[04:54] Team_092 possession (Score: 17-6)
Austin Bridges attempts a 3Pt. Contested by Devin Poole (3.7 feet, MAN). Austin Bridges misses. Rebound secured by Terry Doncic.

[04:41] Team_034 possession (Score: 17-6)
Devin Poole drives and kicks out. Ben Hyland attempts a Midrange. Contested by John Giddey (4.1 feet, ZONE). Ben Hyland misses. Rebound secured by John Giddey.

[04:24] Team_092 possession (Score: 17-6)
Immanuel Ingram drives, picks up Terry Doncic. Help arrives from Ben Hyland! Immanuel Ingram attempts a Layup. Contested by Ben Hyland (4.0 feet, ZONE). IMMANUEL INGRAM MAKES IT!
Score: 19-6

[04:11] Team_034 possession (Score: 19-6)
FOUL! Holding foul on John Giddey. [Team fouls: 3] No free throws, side out. (John Giddey: 2 personal fouls)

[03:57] Team_034 possession (Score: 19-6)
Terry Doncic makes the Dunk and draws the foul on Austin Bridges! And-1! Terry Doncic to the line for 1. [Team fouls: 4] (Austin Bridges: 1 personal fouls)   FT 1/1: GOOD Terry Doncic makes 1/1 from the line.
Score: 19-9

[03:42] Team_092 possession (Score: 19-9)
Immanuel Ingram attempts a Midrange. Contested by Anthony Bane (5.1 feet, MAN). IMMANUEL INGRAM MAKES IT!
Score: 21-9

[03:25] Team_034 possession (Score: 21-9)
Terry Doncic attempts a 3Pt. Contested by John Giddey (4.3 feet, MAN). TERRY DONCIC MAKES IT! Assist: Cole Antetokounmpo
Score: 21-12

[03:10] Team_092 possession (Score: 21-12)
FOUL! Shooting foul on Ben Hyland. Paul James to the line for 2 free throws. [Team fouls: 4] (Ben Hyland: 3 personal fouls)   FT 1/2: MISS   FT 2/2: MISS Paul James makes 0/2 from the line. FOUL! Loose ball foul on Anthony Bane during the free throw rebound! [IN THE BONUS! 5 team fouls] Paul James to the line for 2 free throws. (Anthony Bane: 1 personal fouls)   FT 1/2: GOOD   FT 2/2: GOOD Paul James makes 2/2 from the line.
Score: 23-12

[02:54] Team_034 possession (Score: 23-12)
Cole Antetokounmpo attempts a Midrange. Contested by Paul James (5.3 feet, ZONE). Cole Antetokounmpo misses. Rebound secured by John Giddey.

[02:41] Team_092 possession (Score: 23-12)
Immanuel Ingram drives, Anthony Bane stays with him. Immanuel Ingram attempts a Layup. Contested by Anthony Bane (5.2 feet, ZONE). IMMANUEL INGRAM MAKES IT! Assist: Austin Bridges
Score: 25-12

[02:27] Team_034 possession (Score: 25-12)
Cole Antetokounmpo makes the Layup and draws the foul on Paul James! And-1! Cole Antetokounmpo to the line for 1. [BONUS: 5 team fouls] (Paul James: 2 personal fouls)   FT 1/1: MISS Cole Antetokounmpo makes 0/1 from the line. Offensive rebound by Terry Doncic! Terry Doncic's putback is no good.
Score: 25-14

[02:11] Team_092 possession (Score: 25-14)
Paul James attempts a 3Pt. Contested by Cole Antetokounmpo (5.4 feet, MAN). Paul James misses. Rebound secured by Cole Antetokounmpo.

[02:01] Team_034 possession (Score: 25-14)
Anthony Bane drives, Immanuel Ingram stays with him. Anthony Bane attempts a Layup. Contested by Immanuel Ingram (4.3 feet, MAN). ANTHONY BANE MAKES IT!
Score: 25-16

[01:47] Team_092 possession (Score: 25-16)
Paul James attempts a 3Pt. Contested by Cole Antetokounmpo (5.4 feet, MAN). Paul James misses. Rebound secured by Cole Antetokounmpo.

[01:35] Team_034 possession (Score: 25-16)
Devin Poole attempts a 3Pt. Contested by Karl Gobert (5.2 feet, ZONE). Devin Poole misses. Offensive rebound by Terry Doncic! Terry Doncic puts it back in!
Score: 25-18

[01:24] Team_092 possession (Score: 25-18)
Immanuel Ingram drives, picks up Anthony Bane. Help arrives from Ben Hyland! Immanuel Ingram attempts a Layup. Contested by Ben Hyland (5.3 feet, MAN). IMMANUEL INGRAM MAKES IT! Assist: Austin Bridges
Score: 27-18

[01:09] Team_034 possession (Score: 27-18)
FOUL! Reach-in foul on Karl Gobert during the drive. [IN THE BONUS! 6 team fouls] Ben Hyland to the line for 2 free throws. (Karl Gobert: 1 personal fouls)   FT 1/2: GOOD   FT 2/2: GOOD Ben Hyland makes 2/2 from the line.
Score: 27-20

[00:55] Team_092 possession (Score: 27-20)
Karl Gobert attempts a 3Pt. Contested by Devin Poole (4.3 feet, ZONE). Karl Gobert misses. Rebound secured by Terry Doncic.

[00:45] Team_034 possession (Score: 27-20)
FOUL! Reach-in foul on John Giddey during the drive. [IN THE BONUS! 7 team fouls] Ben Hyland to the line for 2 free throws. (John Giddey: 3 personal fouls)   FT 1/2: GOOD   FT 2/2: MISS Ben Hyland makes 1/2 from the line. Rebound secured by Paul James.
Score: 27-21

[00:31] Team_092 possession (Score: 27-21)
Karl Gobert attempts a 3Pt. Contested by Cole Antetokounmpo (4.8 feet, ZONE). Karl Gobert misses. Rebound secured by Terry Doncic.

[00:17] Team_034 possession (Score: 27-21)
Devin Poole attempts a 3Pt. Contested by Austin Bridges (4.9 feet, MAN). Devin Poole misses. Rebound secured by Paul James.

[00:06] Team_092 possession (Score: 27-21)
FOUL! Holding foul on Devin Poole. [IN THE BONUS! 6 team fouls] Austin Bridges to the line for 2 free throws. (Devin Poole: 1 personal fouls)   FT 1/2: GOOD   FT 2/2: GOOD Austin Bridges makes 2/2 from the line.
Score: 29-21

================================================================================
                              1ST QUARTER COMPLETE                              
================================================================================

1ST QUARTER SCORE: Team_092 29, Team_034 21

BOX SCORE:
================================================================================

Team_092
--------------------------------------------------------------------------------
Player                MIN  PTS  REB  AST  TO      FG   FG%      3P   3P%
--------------------------------------------------------------------------------
Immanuel Ingram        12   13    0    0   0   6/6   100.0     0/0   0.0
Austin Bridges         12    9    0    2   0   4/5    80.0     0/0   0.0
Paul James             12    5    7    1   0   2/6    33.3     0/0   0.0
Karl Gobert            12    2    0    1   0   1/3    33.3     0/0   0.0
John Giddey            12    0    7    2   0   0/0     0.0     0/0   0.0

TEAM: FG: 13/20 (65.0%), 3PT: 1/6 (16.7%), REB: 15 (3 off, 12 def), AST: 6, TO: 2
TEAM FOULS: 7 [Team_034 in BONUS]


Team_034
--------------------------------------------------------------------------------
Player                MIN  PTS  REB  AST  TO      FG   FG%      3P   3P%
--------------------------------------------------------------------------------
Terry Doncic           12    8    6    0   0   3/5    60.0     0/0   0.0
Anthony Bane           12    5    3    1   0   3/4    75.0     0/0   0.0
Cole Antetokounmpo     12    3    3    2   0   1/5    20.0     0/0   0.0
Ben Hyland             12    2    0    0   0   1/2    50.0     0/0   0.0
Devin Poole            12    0    0    0   0   0/5     0.0     0/0   0.0

TEAM: FG: 8/21 (38.1%), 3PT: 3/6 (50.0%), REB: 11 (4 off, 7 def), AST: 3, TO: 0
TEAM FOULS: 6 [Team_092 in BONUS]

================================================================================

================================================================================
                       2ND QUARTER - Team_092 vs Team_034                       
================================================================================

[12:00] Team_092 possession (Score: 29-21)
Karl Gobert attempts a 3Pt. Contested by Devin Poole (4.2 feet, ZONE). Karl Gobert misses. Rebound secured by Anthony Bane.

[11:45] Team_034 possession (Score: 29-21)
FOUL! Shooting foul on Paul James. Terry Doncic to the line for 2 free throws. [Team fouls: 1] (Paul James: 1 personal fouls)   FT 1/2: MISS   FT 2/2: GOOD Terry Doncic makes 1/2 from the line.
Score: 29-22

[11:36] Team_092 possession (Score: 29-22)
Karl Gobert attempts a Midrange. Contested by Ben Hyland (3.8 feet, MAN). Karl Gobert misses. Rebound secured by Terry Doncic.

[11:22] Team_034 possession (Score: 29-22)
Ben Hyland drives, picks up John Giddey. Help arrives from Austin Bridges! Ben Hyland attempts a Layup. Contested by Austin Bridges (4.6 feet, ZONE). BEN HYLAND MAKES IT! Assist: Cole Antetokounmpo
Score: 29-24

[11:05] Team_092 possession (Score: 29-24)
John Giddey attempts a Midrange. Contested by Terry Doncic (4.7 feet, ZONE). John Giddey misses. Rebound secured by Terry Doncic.

[10:54] Team_034 possession (Score: 29-24)
Ben Hyland drives, Immanuel Ingram stays with him. Ben Hyland attempts a Layup. Contested by Immanuel Ingram (4.5 feet, ZONE). BEN HYLAND MAKES IT! Assist: Cole Antetokounmpo
Score: 29-26

[10:43] Team_092 possession (Score: 29-26)
John Giddey drives and kicks out. John Giddey attempts a Midrange. Contested by Ben Hyland (4.1 feet, ZONE). John Giddey misses. Rebound secured by Terry Doncic.

[10:27] Team_034 possession (Score: 29-26)
Cole Antetokounmpo attempts a 3Pt. Contested by Paul James (5.6 feet, MAN). Cole Antetokounmpo misses. Rebound secured by John Giddey.

[10:14] Team_092 possession (Score: 29-26)
Austin Bridges attempts a 3Pt. Contested by Devin Poole (4.4 feet, MAN). Austin Bridges misses. Rebound secured by Cole Antetokounmpo.

[09:58] Team_034 possession (Score: 29-26)
Terry Doncic attempts a 3Pt. Contested by John Giddey (4.7 feet, MAN). Terry Doncic misses. Rebound secured by Paul James.

[09:48] Team_092 possession (Score: 29-26)
FOUL! Shooting foul on Ben Hyland. Karl Gobert to the line for 2 free throws. [Team fouls: 1] (Ben Hyland: 1 personal fouls)   FT 1/2: GOOD   FT 2/2: GOOD Karl Gobert makes 2/2 from the line.
Score: 31-26

[09:29] Team_034 possession (Score: 31-26)
Terry Doncic attempts a Layup. Contested by John Giddey (4.8 feet, ZONE). TERRY DONCIC MAKES IT! Assist: Ben Hyland
Score: 31-28

[09:13] Team_092 possession (Score: 31-28)
Austin Bridges attempts a 3Pt. Contested by Devin Poole (4.5 feet, MAN). AUSTIN BRIDGES MAKES IT! Assist: Paul James
Score: 34-28

[08:59] Team_034 possession (Score: 34-28)
Devin Poole drives, Austin Bridges stays with him. Devin Poole attempts a Dunk. Contested by Austin Bridges (5.1 feet, MAN). Devin Poole misses. Rebound secured by Immanuel Ingram.

[08:48] Team_092 possession (Score: 34-28)
Karl Gobert attempts a Midrange. Contested by Ben Hyland (4.2 feet, MAN). Karl Gobert misses. Rebound secured by Terry Doncic.

[08:31] Team_034 possession (Score: 34-28)
Devin Poole attempts a Midrange. Contested by Karl Gobert (5.6 feet, ZONE). DEVIN POOLE MAKES IT! Assist: Ben Hyland
Score: 34-30

[08:15] Team_092 possession (Score: 34-30)
FOUL! Holding foul on Anthony Bane. [Team fouls: 2] No free throws, side out. (Anthony Bane: 1 personal fouls)

[07:58] Team_092 possession (Score: 34-30)
Paul James attempts a Midrange. Contested by Cole Antetokounmpo (5.9 feet, ZONE). Paul James misses. Rebound secured by Terry Doncic.

[07:42] Team_034 possession (Score: 34-30)
Cole Antetokounmpo drives to the basket... Cole Antetokounmpo throws a bad pass out of bounds! TURNOVER! (dead ball)

[07:42] Substitution (Team_092): Austin Bridges OUT → Bones Giddey IN (stamina_rule2)

[07:42] Substitution (Team_092): Karl Gobert OUT → Shaquille Russell IN (stamina_rule2)

[07:42] Substitution (Team_092): Paul James OUT → Vince Harris IN (stamina_rule2)

[07:42] Substitution (Team_092): John Giddey OUT → Shaquille Paul IN (stamina_rule2)

[07:42] Substitution (Team_092): Immanuel Ingram OUT → Pau Reaves IN (stamina_rule2)

[07:42] Substitution (Team_034): Devin Poole OUT → Manu Jokic IN (stamina_rule2)

[07:42] Substitution (Team_034): Ben Hyland OUT → Damian Turner IN (stamina_rule2)

[07:42] Substitution (Team_034): Cole Antetokounmpo OUT → Vince Paul IN (stamina_rule2)

[07:42] Substitution (Team_034): Terry Doncic OUT → Nikola Wagner IN (stamina_rule2)

[07:42] Substitution (Team_034): Anthony Bane OUT → Carmelo Anunoby IN (stamina_rule2)

[07:29] Team_092 possession (Score: 34-30)
Shaquille Russell drives, Damian Turner stays with him. Shaquille Russell attempts a Layup. Contested by Damian Turner (5.8 feet, MAN). Shaquille Russell misses. Rebound secured by Vince Paul.

[07:17] Team_034 possession (Score: 34-30)
FOUL! Reach-in foul on Pau Reaves during the drive. [Team fouls: 2] No free throws, side out. (Pau Reaves: 1 personal fouls)

[07:00] Team_034 possession (Score: 34-30)
Damian Turner attempts a 3Pt. Contested by Shaquille Russell (4.6 feet, MAN). DAMIAN TURNER MAKES IT! Assist: Manu Jokic
Score: 34-33

[06:44] Team_092 possession (Score: 34-33)
Shaquille Russell attempts a 3Pt. Contested by Vince Paul (4.6 feet, ZONE). Shaquille Russell misses. Rebound secured by Carmelo Anunoby.

[06:27] Team_034 possession (Score: 34-33)
Vince Paul drives and kicks out. Damian Turner attempts a 3Pt. Contested by Shaquille Russell (4.2 feet, MAN). Damian Turner misses. Rebound secured by Pau Reaves.

[06:11] Team_092 possession (Score: 34-33)
FOUL! Reach-in foul on Carmelo Anunoby during the drive. [Team fouls: 3] No free throws, side out. (Carmelo Anunoby: 1 personal fouls)

[06:00] Team_092 possession (Score: 34-33)
Vince Harris attempts a Layup. Contested by Vince Paul (4.2 feet, MAN). Vince Harris misses. Offensive rebound by Shaquille Paul! Shaquille Paul kicks it out.

[05:45] Team_092 possession (Score: 34-33)
Pau Reaves drives, Carmelo Anunoby stays with him. Pau Reaves attempts a Dunk. Contested by Carmelo Anunoby (5.7 feet, ZONE). PAU REAVES MAKES IT!
Score: 36-33

[05:31] Team_034 possession (Score: 36-33)
Damian Turner attempts a Midrange. Contested by Vince Harris (4.5 feet, ZONE). Damian Turner misses. Rebound secured by Shaquille Paul.

[05:18] Team_092 possession (Score: 36-33)
Bones Giddey attempts a Midrange. Contested by Vince Paul (3.8 feet, ZONE). Bones Giddey misses. Rebound secured by Carmelo Anunoby.

[04:58] Team_034 possession (Score: 36-33)
FOUL! Offensive foul on Nikola Wagner! Shaquille Paul drew the charge! [Team fouls: 4] (Nikola Wagner: 1 personal fouls) TURNOVER! (dead ball)

[04:48] Team_092 possession (Score: 36-33)
Shaquille Russell makes the Layup and draws the foul on Carmelo Anunoby! And-1! Shaquille Russell to the line for 1. [BONUS: 5 team fouls] (Carmelo Anunoby: 2 personal fouls)   FT 1/1: GOOD Shaquille Russell makes 1/1 from the line.
Score: 39-33

[04:34] Team_034 possession (Score: 39-33)
Damian Turner makes the Dunk and draws the foul on Pau Reaves! And-1! Damian Turner to the line for 1. [Team fouls: 3] (Pau Reaves: 2 personal fouls)   FT 1/1: GOOD Damian Turner makes 1/1 from the line.
Score: 39-36

[04:21] Team_092 possession (Score: 39-36)
Shaquille Paul attempts a 3Pt. Contested by Vince Paul (4.8 feet, ZONE). Shaquille Paul misses. Rebound secured by Vince Paul.

[04:06] Team_034 possession (Score: 39-36)
Damian Turner commits a violation (traveling/carry)! TURNOVER! (dead ball)

[03:48] Team_092 possession (Score: 39-36)
FOUL! Shooting foul on Damian Turner. Pau Reaves to the line for 2 free throws. [BONUS: 6 team fouls] (Damian Turner: 1 personal fouls)   FT 1/2: MISS   FT 2/2: MISS Pau Reaves makes 0/2 from the line. Rebound secured by Carmelo Anunoby.

[03:35] Team_034 possession (Score: 39-36)
FOUL! Reach-in foul on Pau Reaves during the drive. [Team fouls: 4] No free throws, side out. (Pau Reaves: 3 personal fouls)

[03:21] Team_034 possession (Score: 39-36)
Damian Turner attempts a 3Pt. Contested by Vince Harris (4.5 feet, ZONE). Damian Turner misses. Rebound secured by Shaquille Russell.

[03:04] Team_092 possession (Score: 39-36)
Pau Reaves attempts a Midrange. Contested by Damian Turner (5.7 feet, ZONE). Pau Reaves misses. Rebound secured by Nikola Wagner.

[02:48] Team_034 possession (Score: 39-36)
Damian Turner attempts a 3Pt. Contested by Vince Harris (4.5 feet, ZONE). Damian Turner misses. Rebound secured by Pau Reaves.

[02:39] Team_092 possession (Score: 39-36)
Shaquille Russell attempts a 3Pt. Contested by Damian Turner (5.8 feet, ZONE). SHAQUILLE RUSSELL MAKES IT! Assist: Shaquille Paul
Score: 42-36

[02:28] Team_034 possession (Score: 42-36)
Manu Jokic drives and kicks out. Vince Paul attempts a 3Pt. Contested by Vince Harris (4.1 feet, ZONE). Vince Paul misses. Offensive rebound by Carmelo Anunoby! Carmelo Anunoby kicks it out.

[02:15] Team_034 possession (Score: 42-36)
Damian Turner drives, Pau Reaves stays with him. Damian Turner attempts a Dunk. Contested by Pau Reaves (5.2 feet, ZONE). DAMIAN TURNER MAKES IT! Assist: Vince Paul
Score: 42-38

[02:02] Team_092 possession (Score: 42-38)
Shaquille Russell attempts a 3Pt. Contested by Damian Turner (5.8 feet, MAN). Shaquille Russell misses. Rebound secured by Carmelo Anunoby.

[01:47] Team_034 possession (Score: 42-38)
FOUL! Reach-in foul on Vince Harris during the drive. [IN THE BONUS! 5 team fouls] Vince Paul to the line for 2 free throws. (Vince Harris: 1 personal fouls)   FT 1/2: GOOD   FT 2/2: GOOD Vince Paul makes 2/2 from the line.
Score: 42-40

[01:33] Team_092 possession (Score: 42-40)
Bones Giddey attempts a 3Pt. Contested by Manu Jokic (4.4 feet, MAN). Bones Giddey misses. Rebound secured by Carmelo Anunoby.

[01:19] Team_034 possession (Score: 42-40)
Carmelo Anunoby attempts a 3Pt. Contested by Vince Harris (4.2 feet, ZONE). Carmelo Anunoby misses. Rebound secured by Shaquille Paul.

[01:04] Team_092 possession (Score: 42-40)
Shaquille Russell drives to the basket... FOUL! Offensive foul on Shaquille Russell! Damian Turner drew the charge! [Team fouls: 6] (Shaquille Russell: 1 personal fouls) TURNOVER! (dead ball)

[00:50] Team_034 possession (Score: 42-40)
Damian Turner attempts a 3Pt. Contested by Shaquille Paul (6.0 feet, ZONE). Damian Turner misses. Rebound secured by Pau Reaves.

[00:34] Team_092 possession (Score: 42-40)
Pau Reaves attempts a Layup. BLOCKED BY CARMELO ANUNOBY! Ball deflects out of bounds off Pau Reaves.

[00:18] Team_034 possession (Score: 42-40)
Damian Turner attempts a Layup. Contested by Pau Reaves (5.2 feet, ZONE). DAMIAN TURNER MAKES IT! Assist: Manu Jokic
Score: 42-42

[00:01] Team_092 possession (Score: 42-42)
Vince Harris drives and kicks out. Pau Reaves attempts a 3Pt. Contested by Vince Paul (4.3 feet, ZONE). Pau Reaves misses. Rebound secured by Carmelo Anunoby.

================================================================================
                              2ND QUARTER COMPLETE                              
================================================================================

2ND QUARTER SCORE: Team_092 13, Team_034 21

BOX SCORE:
================================================================================

Team_092
--------------------------------------------------------------------------------
Player                MIN  PTS  REB  AST  TO      FG   FG%      3P   3P%
--------------------------------------------------------------------------------
Shaquille Russell       8    6    1    0   0   2/5    40.0     0/0   0.0
Austin Bridges         17    3    0    0   0   1/2    50.0     0/0   0.0
Karl Gobert            17    2    0    0   0   1/4    25.0     0/0   0.0
Pau Reaves              8    2    3    0   0   1/4    25.0     0/0   0.0
John Giddey            17    0    1    0   0   0/2     0.0     0/0   0.0
Paul James             17    0    1    1   0   0/1     0.0     0/0   0.0
Immanuel Ingram        17    0    1    0   0   0/0     0.0     0/0   0.0
Shaquille Paul          8    0    3    1   0   0/1     0.0     0/0   0.0
Bones Giddey            8    0    0    0   0   0/2     0.0     0/0   0.0
Vince Harris            8    0    0    0   0   0/1     0.0     0/0   0.0

TEAM: FG: 5/22 (22.7%), 3PT: 2/8 (25.0%), REB: 10 (1 off, 9 def), AST: 2, TO: 1
TEAM FOULS: 6 [Team_034 in BONUS]


Team_034
--------------------------------------------------------------------------------
Player                MIN  PTS  REB  AST  TO      FG   FG%      3P   3P%
--------------------------------------------------------------------------------
Damian Turner           8   10    0    0   0   4/8    50.0     0/0   0.0
Ben Hyland             17    4    0    2   0   2/2   100.0     0/0   0.0
Terry Doncic           17    3    5    0   0   2/3    66.7     0/0   0.0
Devin Poole            17    2    0    0   0   1/2    50.0     0/0   0.0
Vince Paul              8    2    2    1   0   1/2    50.0     0/0   0.0
Anthony Bane           17    0    1    0   0   0/0     0.0     0/0   0.0
Cole Antetokounmpo     17    0    1    2   0   0/1     0.0     0/0   0.0
Manu Jokic              8    0    0    2   0   0/0     0.0     0/0   0.0
Carmelo Anunoby         8    0    7    0   0   0/1     0.0     0/0   0.0
Nikola Wagner           8    0    1    0   0   0/0     0.0     0/0   0.0

TEAM: FG: 10/19 (52.6%), 3PT: 1/7 (14.3%), REB: 17 (1 off, 16 def), AST: 7, TO: 3
TEAM FOULS: 6 [Team_092 in BONUS]

================================================================================

================================================================================
                       3RD QUARTER - Team_092 vs Team_034                       
================================================================================

[12:00] Team_092 possession (Score: 42-42)
Paul James drives to the basket... Paul James throws a bad pass out of bounds! TURNOVER! (dead ball)

[11:41] Team_034 possession (Score: 42-42)
Devin Poole drives and kicks out. Devin Poole attempts a 3Pt. Contested by Austin Bridges (4.4 feet, MAN). Devin Poole misses. Rebound secured by Paul James.

[11:27] Team_092 possession (Score: 42-42)
Karl Gobert drives and kicks out. Paul James attempts a 3Pt. Contested by Devin Poole (3.9 feet, ZONE). Paul James misses. Offensive rebound by Paul James! Paul James kicks it out.

[11:12] Team_092 possession (Score: 42-42)
John Giddey makes the Dunk and draws the foul on Ben Hyland! And-1! John Giddey to the line for 1. [Team fouls: 1] (Ben Hyland: 1 personal fouls)   FT 1/1: GOOD John Giddey makes 1/1 from the line.
Score: 45-42

[11:00] Team_034 possession (Score: 45-42)
Anthony Bane drives, Immanuel Ingram stays with him. Anthony Bane attempts a Dunk. Contested by Immanuel Ingram (4.1 feet, MAN). ANTHONY BANE MAKES IT!
Score: 45-44

[10:50] Team_092 possession (Score: 45-44)
Austin Bridges attempts a 3Pt. Contested by Devin Poole (3.7 feet, ZONE). Austin Bridges misses. FOUL! Loose ball foul on Anthony Bane during the rebound battle. [Team fouls: 2] No free throws, side out. (Anthony Bane: 1 personal fouls)

[10:38] Team_092 possession (Score: 45-44)
Immanuel Ingram attempts a Layup. Contested by Terry Doncic (3.9 feet, ZONE). IMMANUEL INGRAM MAKES IT! Assist: John Giddey
Score: 47-44

[10:24] Team_034 possession (Score: 47-44)
Terry Doncic attempts a 3Pt. Contested by Karl Gobert (5.1 feet, ZONE). Terry Doncic misses. Rebound secured by Immanuel Ingram.

[10:09] Team_092 possession (Score: 47-44)
John Giddey drives to the basket... John Giddey commits a violation (traveling/carry)! TURNOVER! (dead ball)

[09:56] Team_034 possession (Score: 47-44)
Ben Hyland attempts a Midrange. Contested by Karl Gobert (5.1 feet, ZONE). Ben Hyland misses. Rebound secured by Immanuel Ingram.

[09:42] Team_092 possession (Score: 47-44)
Immanuel Ingram attempts a Midrange. Contested by Anthony Bane (5.0 feet, MAN). IMMANUEL INGRAM MAKES IT!
Score: 49-44

[09:27] Team_034 possession (Score: 49-44)
Terry Doncic loses control! Ball rolls out of bounds! TURNOVER! (dead ball)

[09:11] Team_092 possession (Score: 49-44)
Paul James attempts a 3Pt. Contested by Cole Antetokounmpo (5.2 feet, MAN). Paul James misses. Rebound secured by Anthony Bane.

[09:00] Team_034 possession (Score: 49-44)
Devin Poole attempts a 3Pt. Contested by John Giddey (3.9 feet, ZONE). DEVIN POOLE MAKES IT! Assist: Cole Antetokounmpo
Score: 49-47

[08:47] Team_092 possession (Score: 49-47)
Immanuel Ingram attempts a Midrange. Contested by Anthony Bane (5.0 feet, MAN). Immanuel Ingram misses. Rebound secured by Terry Doncic.

[08:32] Team_034 possession (Score: 49-47)
FOUL! Shooting foul on Austin Bridges. Cole Antetokounmpo to the line for 2 free throws. [Team fouls: 1] (Austin Bridges: 1 personal fouls)   FT 1/2: GOOD   FT 2/2: GOOD Cole Antetokounmpo makes 2/2 from the line.
Score: 49-49

[08:16] Team_092 possession (Score: 49-49)
Paul James drives, Terry Doncic stays with him. Paul James attempts a Dunk. Contested by Terry Doncic (4.7 feet, ZONE). PAUL JAMES MAKES IT! Assist: Karl Gobert
Score: 51-49

[08:02] Team_034 possession (Score: 51-49)
FOUL! Shooting foul on Immanuel Ingram. Anthony Bane to the line for 2 free throws. [Team fouls: 2] (Immanuel Ingram: 1 personal fouls)   FT 1/2: GOOD   FT 2/2: GOOD Anthony Bane makes 2/2 from the line.
Score: 51-51

[07:49] Team_092 possession (Score: 51-51)
FOUL! Holding foul on Anthony Bane. [Team fouls: 3] No free throws, side out. (Anthony Bane: 2 personal fouls)

[07:36] Team_092 possession (Score: 51-51)
Karl Gobert attempts a 3Pt. Contested by Devin Poole (3.8 feet, ZONE). Karl Gobert misses. Rebound secured by Terry Doncic.

[07:23] Team_034 possession (Score: 51-51)
Cole Antetokounmpo attempts a Midrange. Contested by Karl Gobert (5.5 feet, ZONE). COLE ANTETOKOUNMPO MAKES IT! Assist: Anthony Bane
Score: 51-53

[07:05] Team_092 possession (Score: 51-53)
Paul James loses the ball! Stripped by Cole Antetokounmpo! TURNOVER! (live ball)

[06:51] Team_034 possession (Score: 51-53)
Terry Doncic drives to the basket... Terry Doncic throws a bad pass out of bounds! TURNOVER! (dead ball)

[06:41] Team_092 possession (Score: 51-53)
Karl Gobert attempts a 3Pt. Contested by Devin Poole (3.8 feet, ZONE). KARL GOBERT MAKES IT! Assist: Immanuel Ingram
Score: 54-53

[06:25] Team_034 possession (Score: 54-53)
Devin Poole makes the Layup and draws the foul on Paul James! And-1! Devin Poole to the line for 1. [Team fouls: 3] (Paul James: 1 personal fouls)   FT 1/1: GOOD Devin Poole makes 1/1 from the line.
Score: 54-56

[06:13] Team_092 possession (Score: 54-56)
Austin Bridges attempts a Midrange. Contested by Ben Hyland (3.4 feet, ZONE). Austin Bridges misses. Rebound secured by Cole Antetokounmpo.

[05:59] Team_034 possession (Score: 54-56)
Cole Antetokounmpo attempts a 3Pt. Contested by John Giddey (4.5 feet, ZONE). Cole Antetokounmpo misses. Rebound secured by Paul James.

[05:46] Team_092 possession (Score: 54-56)
John Giddey attempts a Midrange. Contested by Terry Doncic (4.3 feet, MAN). John Giddey misses. Offensive rebound by John Giddey! John Giddey kicks it out.

[05:27] Team_092 possession (Score: 54-56)
Immanuel Ingram drives, Terry Doncic stays with him. Immanuel Ingram attempts a Layup. Contested by Terry Doncic (3.9 feet, ZONE). IMMANUEL INGRAM MAKES IT! Assist: Paul James
Score: 56-56

[05:12] Team_034 possession (Score: 56-56)
Ben Hyland attempts a 3Pt. Contested by John Giddey (4.2 feet, ZONE). Ben Hyland misses. Rebound secured by John Giddey.

[04:55] Team_092 possession (Score: 56-56)
FOUL! Offensive foul on Austin Bridges! Devin Poole drew the charge! [Team fouls: 4] (Austin Bridges: 2 personal fouls) TURNOVER! (dead ball)

[04:39] Team_034 possession (Score: 56-56)
Anthony Bane attempts a Midrange. Contested by Immanuel Ingram (4.2 feet, MAN). Anthony Bane misses. Rebound secured by Paul James.

[04:25] Team_092 possession (Score: 56-56)
John Giddey drives and kicks out. Austin Bridges attempts a 3Pt. Contested by Devin Poole (4.0 feet, MAN). Austin Bridges misses. Rebound secured by Anthony Bane.

[04:09] Team_034 possession (Score: 56-56)
Cole Antetokounmpo attempts a Layup. Contested by John Giddey (4.6 feet, ZONE). COLE ANTETOKOUNMPO MAKES IT! Assist: Terry Doncic
Score: 56-58

[03:54] Team_092 possession (Score: 56-58)
Austin Bridges attempts a Midrange. Contested by Cole Antetokounmpo (4.4 feet, ZONE). Austin Bridges misses. Rebound secured by Terry Doncic.

[03:38] Team_034 possession (Score: 56-58)
Anthony Bane attempts a Midrange. Contested by Immanuel Ingram (4.2 feet, MAN). Anthony Bane misses. Rebound secured by Paul James.

[03:22] Team_092 possession (Score: 56-58)
Immanuel Ingram drives to the basket... FOUL! Offensive foul on Immanuel Ingram! Anthony Bane drew the charge! [Team fouls: 5] (Immanuel Ingram: 2 personal fouls) TURNOVER! (dead ball)

[03:09] Team_034 possession (Score: 56-58)
Devin Poole attempts a Midrange. Contested by Austin Bridges (4.6 feet, MAN). Devin Poole misses. Offensive rebound by Terry Doncic! Terry Doncic puts it back in!
Score: 56-60

[02:53] Team_092 possession (Score: 56-60)
Austin Bridges attempts a Midrange. Contested by Devin Poole (4.0 feet, MAN). Austin Bridges misses. Rebound secured by Cole Antetokounmpo.

[02:38] Team_034 possession (Score: 56-60)
Cole Antetokounmpo attempts a 3Pt. Contested by John Giddey (4.8 feet, ZONE). Cole Antetokounmpo misses. Rebound secured by John Giddey.

[02:24] Team_092 possession (Score: 56-60)
FOUL! Shooting foul on Terry Doncic. John Giddey to the line for 2 free throws. [Team fouls: 4] (Terry Doncic: 1 personal fouls)   FT 1/2: GOOD   FT 2/2: GOOD John Giddey makes 2/2 from the line.
Score: 58-60

[02:08] Team_034 possession (Score: 58-60)
Terry Doncic attempts a Midrange. Contested by Paul James (5.0 feet, ZONE). Terry Doncic misses. Rebound secured by Immanuel Ingram.

[01:53] Team_092 possession (Score: 58-60)
Immanuel Ingram attempts a Layup. Contested by Terry Doncic (4.2 feet, ZONE). IMMANUEL INGRAM MAKES IT! Assist: John Giddey
Score: 60-60

[01:34] Team_034 possession (Score: 60-60)
Terry Doncic attempts a 3Pt. Contested by John Giddey (4.5 feet, MAN). Terry Doncic misses. Rebound secured by John Giddey.

[01:20] Team_092 possession (Score: 60-60)
John Giddey makes the Layup and draws the foul on Terry Doncic! And-1! John Giddey to the line for 1. [BONUS: 5 team fouls] (Terry Doncic: 2 personal fouls)   FT 1/1: GOOD John Giddey makes 1/1 from the line.
Score: 63-60

[01:07] Team_034 possession (Score: 63-60)
Anthony Bane attempts a Midrange. Contested by Paul James (5.1 feet, ZONE). Anthony Bane misses. FOUL! Loose ball foul on Paul James during the rebound battle. [IN THE BONUS! 6 team fouls] Terry Doncic to the line for 2 free throws. (Paul James: 2 personal fouls)   FT 1/2: GOOD   FT 2/2: GOOD Terry Doncic makes 2/2 from the line.
Score: 63-62

[00:57] Team_092 possession (Score: 63-62)
John Giddey drives, Terry Doncic stays with him. John Giddey attempts a Layup. Contested by Terry Doncic (4.7 feet, ZONE). JOHN GIDDEY MAKES IT! Assist: Karl Gobert
Score: 65-62

[00:43] Team_034 possession (Score: 65-62)
Ben Hyland drives and kicks out. Anthony Bane attempts a Midrange. Contested by Karl Gobert (5.5 feet, ZONE). ANTHONY BANE MAKES IT!
Score: 65-64

[00:27] Team_092 possession (Score: 65-64)
Karl Gobert drives, Ben Hyland stays with him. Karl Gobert attempts a Layup. Contested by Ben Hyland (3.9 feet, MAN). KARL GOBERT MAKES IT! Assist: John Giddey
Score: 67-64

[00:13] Team_034 possession (Score: 67-64)
Cole Antetokounmpo attempts a 3Pt. Contested by Paul James (5.6 feet, ZONE). Cole Antetokounmpo misses. Rebound secured by John Giddey.

================================================================================
                              3RD QUARTER COMPLETE                              
================================================================================

3RD QUARTER SCORE: Team_092 25, Team_034 22

BOX SCORE:
================================================================================

Team_092
--------------------------------------------------------------------------------
Player                MIN  PTS  REB  AST  TO      FG   FG%      3P   3P%
--------------------------------------------------------------------------------
John Giddey            29   10    6    3   0   4/5    80.0     0/0   0.0
Immanuel Ingram        29    8    3    1   0   4/5    80.0     0/0   0.0
Karl Gobert            29    5    0    2   0   2/3    66.7     0/0   0.0
Paul James             29    2    5    1   0   1/2    50.0     0/0   0.0
Austin Bridges         29    0    0    0   0   0/3     0.0     0/0   0.0

TEAM: FG: 11/18 (61.1%), 3PT: 1/3 (33.3%), REB: 14 (3 off, 11 def), AST: 7, TO: 5
TEAM FOULS: 6 [Team_034 in BONUS]


Team_034
--------------------------------------------------------------------------------
Player                MIN  PTS  REB  AST  TO      FG   FG%      3P   3P%
--------------------------------------------------------------------------------
Devin Poole            29    6    0    0   0   2/3    66.7     0/0   0.0
Anthony Bane           29    6    2    1   0   3/5    60.0     0/0   0.0
Cole Antetokounmpo     29    6    2    1   0   3/6    50.0     0/0   0.0
Terry Doncic           29    4    4    1   0   2/5    40.0     0/0   0.0
Ben Hyland             29    0    0    0   0   0/2     0.0     0/0   0.0

TEAM: FG: 10/21 (47.6%), 3PT: 1/7 (14.3%), REB: 8 (1 off, 7 def), AST: 3, TO: 2
TEAM FOULS: 5 [Team_092 in BONUS]

================================================================================

================================================================================
                       4TH QUARTER - Team_092 vs Team_034                       
================================================================================

[12:00] Substitution (Team_092): Austin Bridges OUT → Bones Giddey IN (stamina_rule2)

[12:00] Substitution (Team_092): Karl Gobert OUT → Shaquille Russell IN (stamina_rule2)

[12:00] Substitution (Team_092): Paul James OUT → Vince Harris IN (stamina_rule2)

[12:00] Substitution (Team_092): John Giddey OUT → Shaquille Paul IN (stamina_rule2)

[12:00] Substitution (Team_034): Devin Poole OUT → Manu Jokic IN (stamina_rule2)

[12:00] Substitution (Team_034): Ben Hyland OUT → Damian Turner IN (stamina_rule2)

[12:00] Substitution (Team_034): Cole Antetokounmpo OUT → Vince Paul IN (stamina_rule2)

[12:00] Substitution (Team_034): Terry Doncic OUT → Nikola Wagner IN (stamina_rule2)

[12:00] Substitution (Team_034): Anthony Bane OUT → Carmelo Anunoby IN (stamina_rule2)

[12:00] Team_092 possession (Score: 67-64)
Austin Bridges drives to the basket... Austin Bridges loses control! Ball rolls out of bounds! TURNOVER! (dead ball)

[11:47] Team_034 possession (Score: 67-64)
Nikola Wagner drives and kicks out. Manu Jokic attempts a Midrange. Contested by Bones Giddey (5.2 feet, MAN). Manu Jokic misses. Rebound secured by Immanuel Ingram.

[11:32] Team_092 possession (Score: 67-64)
Shaquille Paul drives and kicks out. Bones Giddey attempts a 3Pt. Contested by Manu Jokic (4.7 feet, MAN). Bones Giddey misses. Rebound secured by Vince Paul.

[11:16] Team_034 possession (Score: 67-64)
Damian Turner attempts a 3Pt. Contested by Vince Harris (4.5 feet, ZONE). Damian Turner misses. Rebound secured by Shaquille Russell.

[11:03] Team_092 possession (Score: 67-64)
FOUL! Holding foul on Manu Jokic. [Team fouls: 1] No free throws, side out. (Manu Jokic: 1 personal fouls)

[10:52] Team_092 possession (Score: 67-64)
Immanuel Ingram attempts a Layup. Contested by Carmelo Anunoby (5.2 feet, MAN). IMMANUEL INGRAM MAKES IT!
Score: 69-64

[10:35] Team_034 possession (Score: 69-64)
Nikola Wagner attempts a Midrange. Contested by Shaquille Paul (5.7 feet, MAN). Nikola Wagner misses. Rebound secured by Shaquille Paul.

[10:23] Team_092 possession (Score: 69-64)
Bones Giddey attempts a Layup. Contested by Manu Jokic (4.4 feet, MAN). BONES GIDDEY MAKES IT!
Score: 71-64

[10:04] Team_034 possession (Score: 71-64)
Damian Turner attempts a Midrange. BLOCKED BY SHAQUILLE RUSSELL! Ball is loose! Offensive rebound by Vince Paul! Vince Paul kicks it out.

[09:50] Team_034 possession (Score: 71-64)
FOUL! Holding foul on Shaquille Paul. [Team fouls: 2] No free throws, side out. (Shaquille Paul: 2 personal fouls)

[09:36] Team_034 possession (Score: 71-64)
Vince Paul loses the ball! Stripped by Vince Harris! TURNOVER! (live ball)

[09:22] Team_092 possession (Score: 71-64)
Bones Giddey makes the Midrange and draws the foul on Vince Paul! And-1! Bones Giddey to the line for 1. [Team fouls: 2] (Vince Paul: 1 personal fouls)   FT 1/1: GOOD Bones Giddey makes 1/1 from the line.
Score: 74-64

[09:12] Team_034 possession (Score: 74-64)
Carmelo Anunoby drives, picks up Immanuel Ingram. Help arrives from Shaquille Russell! Carmelo Anunoby attempts a Dunk. Contested by Shaquille Russell (4.8 feet, ZONE). CARMELO ANUNOBY MAKES IT! Assist: Nikola Wagner
Score: 74-66

[08:58] Team_092 possession (Score: 74-66)
Bones Giddey attempts a Midrange. Contested by Nikola Wagner (5.6 feet, ZONE). Bones Giddey misses. Rebound secured by Carmelo Anunoby.

[08:45] Team_034 possession (Score: 74-66)
Manu Jokic attempts a 3Pt. Contested by Vince Harris (4.2 feet, ZONE). Manu Jokic misses. Rebound secured by Shaquille Paul.

[08:33] Team_092 possession (Score: 74-66)
Immanuel Ingram attempts a Midrange. Contested by Vince Paul (4.0 feet, ZONE). Immanuel Ingram misses. Rebound secured by Nikola Wagner.

[08:17] Team_034 possession (Score: 74-66)
Vince Paul attempts a Midrange. Contested by Vince Harris (4.5 feet, MAN). Vince Paul misses. Rebound secured by Immanuel Ingram.

[08:01] Team_092 possession (Score: 74-66)
Shaquille Paul commits a violation (traveling/carry)! TURNOVER! (dead ball)

[08:01] Substitution (Team_092): Immanuel Ingram OUT → Pau Reaves IN (stamina_rule2)

[07:46] Team_034 possession (Score: 74-66)
Manu Jokic drives, Bones Giddey stays with him. Manu Jokic attempts a Dunk. Contested by Bones Giddey (5.2 feet, MAN). MANU JOKIC MAKES IT! Assist: Nikola Wagner
Score: 74-68

[07:36] Team_092 possession (Score: 74-68)
Vince Harris attempts a 3Pt. Contested by Vince Paul (4.2 feet, MAN). Vince Harris misses. Rebound secured by Carmelo Anunoby.

[07:19] Team_034 possession (Score: 74-68)
Damian Turner attempts a 3Pt. Contested by Vince Harris (4.5 feet, ZONE). Damian Turner misses. FOUL! Loose ball foul on Shaquille Paul during the rebound battle. [Team fouls: 3] No free throws, side out. (Shaquille Paul: 3 personal fouls)

[07:09] Team_034 possession (Score: 74-68)
Nikola Wagner drives and kicks out. Nikola Wagner makes the Midrange and draws the foul on Vince Harris! And-1! Nikola Wagner to the line for 1. [Team fouls: 4] (Vince Harris: 1 personal fouls)   FT 1/1: GOOD Nikola Wagner makes 1/1 from the line.
Score: 74-71

[06:52] Team_092 possession (Score: 74-71)
Shaquille Paul drives, Carmelo Anunoby stays with him. Shaquille Paul attempts a Layup. Contested by Carmelo Anunoby (6.0 feet, ZONE). Shaquille Paul misses. Rebound secured by Nikola Wagner.

[06:37] Team_034 possession (Score: 74-71)
Carmelo Anunoby attempts a Midrange. Contested by Pau Reaves (4.9 feet, ZONE). CARMELO ANUNOBY MAKES IT! Assist: Vince Paul
Score: 74-73

[06:22] Team_092 possession (Score: 74-73)
Bones Giddey drives, picks up Carmelo Anunoby. Help arrives from Damian Turner! Bones Giddey attempts a Dunk. Contested by Damian Turner (5.1 feet, ZONE). BONES GIDDEY MAKES IT!
Score: 76-73

[06:07] Team_034 possession (Score: 76-73)
Carmelo Anunoby drives and kicks out. Nikola Wagner attempts a 3Pt. Contested by Shaquille Paul (5.6 feet, ZONE). Nikola Wagner misses. Rebound secured by Shaquille Paul.

[05:55] Team_092 possession (Score: 76-73)
Bones Giddey attempts a Layup. Contested by Carmelo Anunoby (5.1 feet, ZONE). BONES GIDDEY MAKES IT! Assist: Pau Reaves
Score: 78-73

[05:39] Team_034 possession (Score: 78-73)
FOUL! Shooting foul on Bones Giddey. Manu Jokic to the line for 2 free throws. [BONUS: 5 team fouls] (Bones Giddey: 1 personal fouls)   FT 1/2: GOOD   FT 2/2: GOOD Manu Jokic makes 2/2 from the line.
Score: 78-75

[05:27] Team_092 possession (Score: 78-75)
FOUL! Reach-in foul on Carmelo Anunoby during the drive. [Team fouls: 3] No free throws, side out. (Carmelo Anunoby: 1 personal fouls)

[05:11] Team_092 possession (Score: 78-75)
Pau Reaves attempts a Midrange. Contested by Vince Paul (4.5 feet, ZONE). Pau Reaves misses. Offensive rebound by Pau Reaves! Pau Reaves kicks it out.

[04:57] Team_092 possession (Score: 78-75)
Bones Giddey throws a bad pass out of bounds! TURNOVER! (dead ball)

[04:38] Team_034 possession (Score: 78-75)
FOUL! Shooting foul on Pau Reaves. Vince Paul to the line for 2 free throws. [BONUS: 6 team fouls] (Pau Reaves: 1 personal fouls)   FT 1/2: GOOD   FT 2/2: MISS Vince Paul makes 1/2 from the line. Rebound secured by Shaquille Paul.
Score: 78-76

[04:25] Team_092 possession (Score: 78-76)
FOUL! Shooting foul on Vince Paul. Bones Giddey to the line for 3 free throws. [Team fouls: 4] (Vince Paul: 2 personal fouls)   FT 1/3: GOOD   FT 2/3: GOOD   FT 3/3: GOOD Bones Giddey makes 3/3 from the line.
Score: 81-76

[04:11] Team_034 possession (Score: 81-76)
Manu Jokic drives and kicks out. Carmelo Anunoby attempts a Midrange. Contested by Pau Reaves (4.8 feet, MAN). Carmelo Anunoby misses. Rebound secured by Shaquille Paul.

[03:58] Team_092 possession (Score: 81-76)
Pau Reaves attempts a 3Pt. Wide open! Nikola Wagner is 6.4 feet away. [ZONE] PAU REAVES MAKES IT! Assist: Shaquille Russell
Score: 84-76

[03:46] Team_034 possession (Score: 84-76)
Damian Turner throws a bad pass! Stolen by Shaquille Russell! TURNOVER! (live ball)

[03:31] Team_092 possession (Score: 84-76)
Shaquille Paul drives and kicks out. Pau Reaves attempts a Midrange. Contested by Carmelo Anunoby (5.7 feet, MAN). PAU REAVES MAKES IT! Assist: Shaquille Paul
Score: 86-76

[03:17] Team_034 possession (Score: 86-76)
FOUL! Shooting foul on Vince Harris. Vince Paul to the line for 3 free throws. [BONUS: 7 team fouls] (Vince Harris: 2 personal fouls)   FT 1/3: GOOD   FT 2/3: MISS   FT 3/3: MISS Vince Paul makes 1/3 from the line. Rebound secured by Shaquille Paul.
Score: 86-77

[03:00] Team_092 possession (Score: 86-77)
Shaquille Paul drives, Nikola Wagner stays with him. Shaquille Paul attempts a Dunk. Wide open! Nikola Wagner is 6.7 feet away. [MAN] Shaquille Paul misses. Rebound secured by Vince Paul.

[02:46] Team_034 possession (Score: 86-77)
Carmelo Anunoby attempts a 3Pt. Contested by Pau Reaves (4.9 feet, MAN). Carmelo Anunoby misses. Rebound secured by Pau Reaves.

[02:31] Team_092 possession (Score: 86-77)
Bones Giddey attempts a 3Pt. Contested by Manu Jokic (4.6 feet, MAN). Bones Giddey misses. Rebound secured by Nikola Wagner.

[02:18] Team_034 possession (Score: 86-77)
Nikola Wagner attempts a Layup. Contested by Shaquille Paul (5.9 feet, MAN). NIKOLA WAGNER MAKES IT! Assist: Vince Paul
Score: 86-79

[02:03] Team_092 possession (Score: 86-79)
Pau Reaves attempts a Midrange. Contested by Manu Jokic (5.3 feet, ZONE). Pau Reaves misses. Rebound secured by Nikola Wagner.

[01:50] Team_034 possession (Score: 86-79)
Nikola Wagner drives to the basket... Nikola Wagner loses the ball! Stripped by Shaquille Paul! TURNOVER! (live ball)

[01:35] Team_092 possession (Score: 86-79)
Vince Harris attempts a Layup. BLOCKED BY CARMELO ANUNOBY! Ball is loose! Rebound secured by Carmelo Anunoby.

[01:23] Team_034 possession (Score: 86-79)
Carmelo Anunoby attempts a Layup. Contested by Pau Reaves (4.9 feet, ZONE). Carmelo Anunoby misses. Rebound secured by Vince Harris.

[01:09] Team_092 possession (Score: 86-79)
Bones Giddey attempts a Layup. Contested by Manu Jokic (4.7 feet, MAN). BONES GIDDEY MAKES IT!
Score: 88-79

[00:53] Team_034 possession (Score: 88-79)
Nikola Wagner loses control! Ball rolls out of bounds! TURNOVER! (dead ball)

[00:35] Team_092 possession (Score: 88-79)
Shaquille Russell drives, Damian Turner stays with him. Shaquille Russell attempts a Layup. Wide open! Damian Turner is 6.3 feet away. [MAN] SHAQUILLE RUSSELL MAKES IT! Assist: Pau Reaves
Score: 90-79

[00:19] Team_034 possession (Score: 90-79)
Vince Paul loses control! Ball rolls out of bounds! TURNOVER! (dead ball)

[00:05] Team_092 possession (Score: 90-79)
Vince Harris throws a bad pass out of bounds! TURNOVER! (dead ball)

================================================================================
                              4TH QUARTER COMPLETE                              
================================================================================

4TH QUARTER SCORE: Team_092 23, Team_034 15

BOX SCORE:
================================================================================

Team_092
--------------------------------------------------------------------------------
Player                MIN  PTS  REB  AST  TO      FG   FG%      3P   3P%
--------------------------------------------------------------------------------
Bones Giddey           20   14    0    0   0   6/8    75.0     0/0   0.0
Pau Reaves             16    5    2    2   0   2/3    66.7     0/0   0.0
Immanuel Ingram        33    2    2    0   0   1/2    50.0     0/0   0.0
Shaquille Russell      20    2    1    1   0   1/1   100.0     0/0   0.0
Shaquille Paul         20    0    6    1   0   0/3     0.0     0/0   0.0
Vince Harris           20    0    1    0   0   0/2     0.0     0/0   0.0

TEAM: FG: 10/19 (52.6%), 3PT: 2/4 (50.0%), REB: 12 (1 off, 11 def), AST: 4, TO: 4
TEAM FOULS: 7 [Team_034 in BONUS]


Team_034
--------------------------------------------------------------------------------
Player                MIN  PTS  REB  AST  TO      FG   FG%      3P   3P%
--------------------------------------------------------------------------------
Nikola Wagner          20    5    4    2   0   2/4    50.0     0/0   0.0
Carmelo Anunoby        20    4    4    0   0   2/5    40.0     0/0   0.0
Manu Jokic             20    4    0    0   0   2/4    50.0     0/0   0.0
Vince Paul             20    0    3    2   0   0/3     0.0     0/0   0.0
Damian Turner          20    0    0    0   0   0/1     0.0     0/0   0.0

TEAM: FG: 6/17 (35.3%), 3PT: 0/4 (0.0%), REB: 11 (2 off, 9 def), AST: 4, TO: 5
TEAM FOULS: 4

================================================================================

================================================================================
                               FULL GAME COMPLETE                               
================================================================================

FINAL SCORE: Team_092 90, Team_034 79

SCORING BY QUARTER:
--------------------------------------------------------------------------------
Team                     Q1     Q2     Q3     Q4    FINAL
--------------------------------------------------------------------------------
Team_092                 29     13     25     23       90
Team_034                 21     21     22     15       79
--------------------------------------------------------------------------------

FULL GAME BOX SCORE:
================================================================================

Team_092
--------------------------------------------------------------------------------
Player                MIN  PTS  REB  AST  TO      FG   FG%      3P   3P%      FT STL BLK
--------------------------------------------------------------------------------
Immanuel Ingram        33   23    6    1   1  11/13   84.6   0/0     0.0   1/1     0   0
Austin Bridges         29   12    0    2   3   4/9    44.4   2/4    50.0   2/2     0   1
Karl Gobert            29    9    0    3   0   4/10   40.0   1/5    20.0   2/2     0   0
Paul James             29    7   13    3   4   3/9    33.3   0/3     0.0   1/3     0   0
John Giddey            29   10   14    5   0   4/7    57.1   0/0     0.0   4/4     0   1
Bones Giddey           20   14    0    0   1   6/10   60.0   1/3    33.3   4/4     0   0
Shaquille Russell      20    8    2    1   1   3/6    50.0   1/3    33.3   1/1     1   1
Vince Harris           20    0    1    0   1   0/3     0.0   0/1     0.0   0/0     1   0
Shaquille Paul         20    0    9    2   1   1/5    20.0   0/1     0.0   0/0     1   0
Pau Reaves             16    7    5    2   0   2/6    33.3   1/1   100.0   0/2     0   0

TEAM: FG: 39/79 (49.4%), 3PT: 6/21 (28.6%), REB: 51 (8 off, 43 def), AST: 19, TO: 12


Team_034
--------------------------------------------------------------------------------
Player                MIN  PTS  REB  AST  TO      FG   FG%      3P   3P%      FT STL BLK
--------------------------------------------------------------------------------
Devin Poole            29    8    0    0   0   5/12   41.7   2/3    66.7   1/1     1   0
Ben Hyland             29    6    0    2   0   4/7    57.1   0/1     0.0   3/4     0   0
Cole Antetokounmpo     29    9    6    5   1   4/12   33.3   1/6    16.7   2/3     1   0
Terry Doncic           29   15   15    1   1   4/10   40.0   1/4    25.0   4/5     0   0
Anthony Bane           29   11    6    2   1   6/9    66.7   0/1     0.0   3/4     1   0
Manu Jokic             20    4    0    2   0   2/4    50.0   0/1     0.0   2/2     0   0
Damian Turner          20   10    0    0   2   4/9    44.4   1/5    20.0   1/1     0   0
Vince Paul             20    2    5    3   2   1/5    20.0   0/1     0.0   4/7     0   0
Nikola Wagner          20    5    5    2   2   2/4    50.0   0/0     0.0   1/1     0   0
Carmelo Anunoby        20    4   11    0   1   2/6    33.3   0/2     0.0   0/0     0   2

TEAM: FG: 34/78 (43.6%), 3PT: 5/24 (20.8%), REB: 47 (8 off, 39 def), AST: 17, TO: 10

================================================================================
