================================================================================
                        FULL GAME - Team_092 vs Team_024                        
================================================================================

================================================================================
                       1ST QUARTER - Team_092 vs Team_024                       
================================================================================

[12:00] Team_092 possession (Score: 0-0)
Immanuel Ingram attempts a 3Pt. Contested by Zach Fox (3.4 feet, ZONE). Immanuel Ingram misses. Rebound secured by Zach Fox.

[11:48] Team_024 possession (Score: 0-0)
Draymond Towns drives, John Giddey stays with him. Draymond Towns attempts a Layup. Contested by John Giddey (3.6 feet, ZONE). DRAYMOND TOWNS MAKES IT! Assist: Zach Fox
Score: 0-2

[11:34] Team_092 possession (Score: 0-2)
Immanuel Ingram attempts a 3Pt. Contested by Zach Fox (3.4 feet, ZONE). Immanuel Ingram misses. Offensive rebound by John Giddey! John Giddey kicks it out.

[11:16] Team_092 possession (Score: 0-2)
Immanuel Ingram throws a bad pass! Stolen by Anfernee Williamson! TURNOVER! (live ball)

[11:01] Team_024 possession (Score: 0-2)
Zach Fox attempts a 3Pt. BLOCKED BY JOHN GIDDEY! Ball is loose! Offensive rebound by Zach Fox! Zach Fox kicks it out.

[10:44] Team_024 possession (Score: 0-2)
Bradley Allen throws a bad pass! Stolen by Paul James! TURNOVER! (live ball)

[10:35] Team_092 possession (Score: 0-2)
Paul James attempts a 3Pt. Contested by Bradley Allen (4.5 feet, MAN). Paul James misses. Rebound secured by Draymond Towns.

[10:17] Team_024 possession (Score: 0-2)
Zach Fox attempts a Midrange. Contested by John Giddey (4.4 feet, ZONE). ZACH FOX MAKES IT! Assist: Anfernee Williamson
Score: 0-4

[10:01] Team_092 possession (Score: 0-4)
John Giddey attempts a 3Pt. Contested by Zach Fox (3.8 feet, ZONE). John Giddey misses. Offensive rebound by John Giddey! John Giddey kicks it out.

[09:47] Team_092 possession (Score: 0-4)
FOUL! Offensive foul on Paul James! Bradley Allen drew the charge! [Team fouls: 1] (Paul James: 1 personal fouls) TURNOVER! (dead ball)

[09:29] Team_024 possession (Score: 0-4)
Draymond Towns attempts a Midrange. Contested by Immanuel Ingram (3.6 feet, MAN). Draymond Towns misses. Rebound secured by Paul James.

[09:19] Team_092 possession (Score: 0-4)
Austin Bridges makes the Layup and draws the foul on Zach Fox! And-1! Austin Bridges to the line for 1. [Team fouls: 1] (Zach Fox: 1 personal fouls)   FT 1/1: MISS Austin Bridges makes 0/1 from the line. Rebound secured by Anfernee Williamson.
Score: 2-4

[09:05] Team_024 possession (Score: 2-4)
Bradley Allen attempts a 3Pt. Contested by Paul James (4.8 feet, MAN). Bradley Allen misses. Rebound secured by John Giddey.

[08:54] Team_092 possession (Score: 2-4)
Immanuel Ingram attempts a Midrange. Contested by Anfernee Williamson (3.5 feet, MAN). Immanuel Ingram misses. FOUL! Loose ball foul on Anfernee Williamson during the rebound battle. [Team fouls: 2] No free throws, side out. (Anfernee Williamson: 1 personal fouls)

[08:38] Team_092 possession (Score: 2-4)
Paul James attempts a 3Pt. Contested by Bradley Allen (4.5 feet, MAN). Paul James misses. Rebound secured by Anfernee Williamson.

[08:21] Team_024 possession (Score: 2-4)
Bradley Allen drives, Paul James stays with him. Bradley Allen attempts a Layup. Contested by Paul James (4.8 feet, MAN). BRADLEY ALLEN MAKES IT!
Score: 2-6

[08:06] Team_092 possession (Score: 2-6)
Austin Bridges attempts a 3Pt. Contested by Ja Reaves (4.2 feet, ZONE). AUSTIN BRIDGES MAKES IT! Assist: Paul James
Score: 5-6

[07:51] Team_024 possession (Score: 5-6)
Draymond Towns attempts a 3Pt. Contested by Karl Gobert (4.6 feet, ZONE). DRAYMOND TOWNS MAKES IT! Assist: Ja Reaves
Score: 5-9

[07:36] Team_092 possession (Score: 5-9)
FOUL! Shooting foul on Anfernee Williamson. Karl Gobert to the line for 2 free throws. [Team fouls: 3] (Anfernee Williamson: 2 personal fouls)   FT 1/2: GOOD   FT 2/2: GOOD Karl Gobert makes 2/2 from the line.
Score: 7-9

[07:22] Team_024 possession (Score: 7-9)
FOUL! Holding foul on Immanuel Ingram. [Team fouls: 2] No free throws, side out. (Immanuel Ingram: 1 personal fouls)

[07:10] Team_024 possession (Score: 7-9)
Zach Fox attempts a Layup. Contested by Karl Gobert (5.4 feet, MAN). ZACH FOX MAKES IT!
Score: 7-11

[06:56] Team_092 possession (Score: 7-11)
John Giddey attempts a Layup. Contested by Anfernee Williamson (3.9 feet, MAN). JOHN GIDDEY MAKES IT!
Score: 9-11

[06:39] Team_024 possession (Score: 9-11)
Ja Reaves attempts a Midrange. Contested by Paul James (4.9 feet, ZONE). JA REAVES MAKES IT! Assist: Draymond Towns
Score: 9-13

[06:24] Team_092 possession (Score: 9-13)
Immanuel Ingram attempts a Midrange. Contested by Anfernee Williamson (3.5 feet, MAN). IMMANUEL INGRAM MAKES IT!
Score: 11-13

[06:05] Team_024 possession (Score: 11-13)
FOUL! Reach-in foul on Paul James during the drive. [Team fouls: 3] No free throws, side out. (Paul James: 2 personal fouls)

[05:49] Team_024 possession (Score: 11-13)
FOUL! Holding foul on Paul James. [Team fouls: 4] No free throws, side out. (Paul James: 3 personal fouls)

[05:38] Team_024 possession (Score: 11-13)
Bradley Allen attempts a Midrange. Contested by Karl Gobert (5.0 feet, ZONE). Bradley Allen misses. Rebound secured by Immanuel Ingram.

[05:27] Team_092 possession (Score: 11-13)
Paul James attempts a Midrange. Contested by Bradley Allen (4.5 feet, ZONE). PAUL JAMES MAKES IT!
Score: 13-13

[05:10] Team_024 possession (Score: 13-13)
Zach Fox makes the Layup and draws the foul on John Giddey! And-1! Zach Fox to the line for 1. [BONUS: 5 team fouls] (John Giddey: 1 personal fouls)   FT 1/1: GOOD Zach Fox makes 1/1 from the line.
Score: 13-16

[04:58] Team_092 possession (Score: 13-16)
Immanuel Ingram attempts a Layup. BLOCKED BY ANFERNEE WILLIAMSON! Ball is loose! Offensive rebound by John Giddey! John Giddey kicks it out.

[04:41] Team_092 possession (Score: 13-16)
Paul James drives to the basket... Paul James throws a bad pass! Stolen by Anfernee Williamson! TURNOVER! (live ball)

[04:28] Team_024 possession (Score: 13-16)
Bradley Allen attempts a 3Pt. Contested by John Giddey (4.1 feet, ZONE). BRADLEY ALLEN MAKES IT! Assist: Anfernee Williamson
Score: 13-19

[04:10] Team_092 possession (Score: 13-19)
John Giddey drives and kicks out. FOUL! Shooting foul on Anfernee Williamson. Immanuel Ingram to the line for 3 free throws. [Team fouls: 4] (Anfernee Williamson: 3 personal fouls)   FT 1/3: MISS   FT 2/3: GOOD   FT 3/3: GOOD Immanuel Ingram makes 2/3 from the line.
Score: 15-19

[03:55] Team_024 possession (Score: 15-19)
Bradley Allen attempts a 3Pt. Contested by Paul James (4.8 feet, MAN). BRADLEY ALLEN MAKES IT! Assist: Ja Reaves
Score: 15-22

[03:45] Team_092 possession (Score: 15-22)
Austin Bridges attempts a Layup. BLOCKED BY JA REAVES! Ball is loose! Rebound secured by Draymond Towns.

[03:32] Team_024 possession (Score: 15-22)
Bradley Allen attempts a 3Pt. Contested by Paul James (4.9 feet, MAN). BRADLEY ALLEN MAKES IT! Assist: Anfernee Williamson
Score: 15-25

[03:18] Team_092 possession (Score: 15-25)
Paul James attempts a 3Pt. Contested by Bradley Allen (4.6 feet, MAN). Paul James misses. Rebound secured by Anfernee Williamson.

[03:04] Team_024 possession (Score: 15-25)
Ja Reaves attempts a 3Pt. Contested by Austin Bridges (4.8 feet, MAN). Ja Reaves misses. Rebound secured by John Giddey.

[02:51] Team_092 possession (Score: 15-25)
Immanuel Ingram drives, Draymond Towns stays with him. Immanuel Ingram attempts a Layup. Contested by Draymond Towns (3.9 feet, MAN). Immanuel Ingram misses. Rebound secured by Draymond Towns.

[02:32] Team_024 possession (Score: 15-25)
Ja Reaves makes the Layup and draws the foul on Paul James! And-1! Ja Reaves to the line for 1. [BONUS: 6 team fouls] (Paul James: 4 personal fouls)   FT 1/1: GOOD Ja Reaves makes 1/1 from the line.
Score: 15-28

[02:17] Team_092 possession (Score: 15-28)
Paul James drives and kicks out. Immanuel Ingram attempts a Midrange. Contested by Draymond Towns (4.1 feet, MAN). IMMANUEL INGRAM MAKES IT!
Score: 17-28

[02:04] Team_024 possession (Score: 17-28)
Bradley Allen attempts a 3Pt. Contested by Paul James (5.0 feet, MAN). BRADLEY ALLEN MAKES IT! Assist: Ja Reaves
Score: 17-31

[01:54] Team_092 possession (Score: 17-31)
Austin Bridges attempts a 3Pt. Contested by Zach Fox (3.6 feet, ZONE). Austin Bridges misses. Rebound secured by Zach Fox.

[01:39] Team_024 possession (Score: 17-31)
Anfernee Williamson attempts a 3Pt. Contested by John Giddey (4.3 feet, MAN). Anfernee Williamson misses. FOUL! Loose ball foul on Immanuel Ingram during the rebound battle. [IN THE BONUS! 7 team fouls] Zach Fox to the line for 2 free throws. (Immanuel Ingram: 2 personal fouls)   FT 1/2: GOOD   FT 2/2: GOOD Zach Fox makes 2/2 from the line.
Score: 17-33

[01:26] Team_092 possession (Score: 17-33)
Austin Bridges drives to the basket... FOUL! Offensive foul on Austin Bridges! Ja Reaves drew the charge! [Team fouls: 8] (Austin Bridges: 1 personal fouls) TURNOVER! (dead ball)

[01:12] Team_024 possession (Score: 17-33)
Ja Reaves attempts a 3Pt. Contested by Austin Bridges (5.0 feet, MAN). Ja Reaves misses. Rebound secured by John Giddey.

[01:00] Team_092 possession (Score: 17-33)
Austin Bridges attempts a 3Pt. Contested by Ja Reaves (4.6 feet, MAN). AUSTIN BRIDGES MAKES IT! Assist: Immanuel Ingram
Score: 20-33

[00:45] Team_024 possession (Score: 20-33)
Bradley Allen drives, Paul James stays with him. Bradley Allen attempts a Layup. Contested by Paul James (5.1 feet, MAN). BRADLEY ALLEN MAKES IT!
Score: 20-35

[00:32] Team_092 possession (Score: 20-35)
Karl Gobert attempts a 3Pt. Contested by Zach Fox (3.8 feet, ZONE). KARL GOBERT MAKES IT! Assist: Paul James
Score: 23-35

[00:14] Team_024 possession (Score: 23-35)
FOUL! Reach-in foul on Austin Bridges during the drive. [IN THE BONUS! 9 team fouls] Ja Reaves to the line for 2 free throws. (Austin Bridges: 2 personal fouls)   FT 1/2: GOOD   FT 2/2: GOOD Ja Reaves makes 2/2 from the line.
Score: 23-37

================================================================================
                              1ST QUARTER COMPLETE                              
================================================================================

1ST QUARTER SCORE: Team_092 23, Team_024 37

BOX SCORE:
================================================================================

Team_092
--------------------------------------------------------------------------------
Player                MIN  PTS  REB  AST  TO      FG   FG%      3P   3P%
--------------------------------------------------------------------------------
Immanuel Ingram        12    6    1    1   0   3/5    60.0     0/0   0.0
Austin Bridges         12    6    0    0   0   2/5    40.0     0/0   0.0
Karl Gobert            12    5    0    0   0   2/2   100.0     0/0   0.0
John Giddey            12    2    6    0   0   1/1   100.0     0/0   0.0
Paul James             12    2    2    2   0   1/4    25.0     0/0   0.0

TEAM: FG: 9/17 (52.9%), 3PT: 3/8 (37.5%), REB: 9 (4 off, 5 def), AST: 3, TO: 4
TEAM FOULS: 9 [Team_024 in BONUS]


Team_024
--------------------------------------------------------------------------------
Player                MIN  PTS  REB  AST  TO      FG   FG%      3P   3P%
--------------------------------------------------------------------------------
Bradley Allen          12   16    0    0   0   6/8    75.0     0/0   0.0
Zach Fox               12    9    3    1   0   4/4   100.0     0/0   0.0
Ja Reaves              12    7    0    3   0   3/5    60.0     0/0   0.0
Draymond Towns         12    5    3    1   0   2/3    66.7     0/0   0.0
Anfernee Williamson    12    0    3    3   0   0/0     0.0     0/0   0.0

TEAM: FG: 15/20 (75.0%), 3PT: 6/9 (66.7%), REB: 9 (1 off, 8 def), AST: 8, TO: 1
TEAM FOULS: 4

================================================================================

================================================================================
                       2ND QUARTER - Team_092 vs Team_024                       
================================================================================

[12:00] Team_092 possession (Score: 23-37)
Paul James drives and kicks out. Austin Bridges makes the 3Pt and draws the foul on Ja Reaves! And-1! Austin Bridges to the line for 1. [Team fouls: 1] (Ja Reaves: 1 personal fouls)   FT 1/1: GOOD Austin Bridges makes 1/1 from the line.
Score: 27-37

[11:48] Team_024 possession (Score: 27-37)
Draymond Towns attempts a Midrange. Contested by Paul James (4.5 feet, ZONE). DRAYMOND TOWNS MAKES IT!
Score: 27-39

[11:32] Team_092 possession (Score: 27-39)
Karl Gobert attempts a Layup. Contested by Anfernee Williamson (3.9 feet, ZONE). KARL GOBERT MAKES IT!
Score: 29-39

[11:20] Team_024 possession (Score: 29-39)
Ja Reaves attempts a 3Pt. Contested by Austin Bridges (5.0 feet, MAN). Ja Reaves misses. Rebound secured by Immanuel Ingram.

[11:09] Team_092 possession (Score: 29-39)
Karl Gobert attempts a 3Pt. Contested by Zach Fox (3.7 feet, ZONE). Karl Gobert misses. Offensive rebound by Paul James! Paul James kicks it out.

[10:55] Team_092 possession (Score: 29-39)
John Giddey attempts a Layup. Contested by Anfernee Williamson (4.3 feet, MAN). John Giddey misses. Rebound secured by Zach Fox.

[10:39] Team_024 possession (Score: 29-39)
Bradley Allen attempts a 3Pt. Contested by John Giddey (4.6 feet, ZONE). Bradley Allen misses. Rebound secured by John Giddey.

[10:25] Team_092 possession (Score: 29-39)
Paul James attempts a Midrange. Contested by Bradley Allen (4.9 feet, ZONE). PAUL JAMES MAKES IT! Assist: John Giddey
Score: 31-39

[10:09] Team_024 possession (Score: 31-39)
Zach Fox drives and kicks out. Ja Reaves attempts a Midrange. Contested by John Giddey (4.7 feet, ZONE). Ja Reaves misses. Offensive rebound by Draymond Towns! Draymond Towns's putback is no good. Rebound secured by Paul James.

[09:55] Team_092 possession (Score: 31-39)
Austin Bridges drives, Draymond Towns stays with him. Austin Bridges attempts a Layup. Contested by Draymond Towns (4.1 feet, ZONE). AUSTIN BRIDGES MAKES IT!
Score: 33-39

[09:38] Team_024 possession (Score: 33-39)
FOUL! Shooting foul on Karl Gobert. Zach Fox to the line for 2 free throws. [Team fouls: 1] (Karl Gobert: 1 personal fouls)   FT 1/2: GOOD   FT 2/2: GOOD Zach Fox makes 2/2 from the line.
Score: 33-41

[09:23] Team_092 possession (Score: 33-41)
Karl Gobert attempts a Midrange. Contested by Draymond Towns (4.3 feet, ZONE). Karl Gobert misses. Offensive rebound by Paul James! Paul James kicks it out.

[09:08] Team_092 possession (Score: 33-41)
Immanuel Ingram attempts a Layup. Contested by Draymond Towns (4.3 feet, MAN). Immanuel Ingram misses. Rebound secured by Anfernee Williamson.

[08:57] Team_024 possession (Score: 33-41)
Zach Fox attempts a 3Pt. Contested by Paul James (5.6 feet, ZONE). Zach Fox misses. Rebound secured by Paul James.

[08:41] Team_092 possession (Score: 33-41)
John Giddey attempts a 3Pt. Contested by Zach Fox (4.4 feet, ZONE). John Giddey misses. Rebound secured by Draymond Towns.

[08:22] Team_024 possession (Score: 33-41)
Zach Fox attempts a 3Pt. Contested by John Giddey (5.2 feet, ZONE). Zach Fox misses. Rebound secured by John Giddey.

[08:09] Team_092 possession (Score: 33-41)
John Giddey attempts a 3Pt. Contested by Anfernee Williamson (4.7 feet, MAN). John Giddey misses. Rebound secured by Draymond Towns.

[07:56] Team_024 possession (Score: 33-41)
Anfernee Williamson drives, John Giddey stays with him. Anfernee Williamson attempts a Dunk. Contested by John Giddey (4.8 feet, ZONE). Anfernee Williamson misses. Rebound secured by Immanuel Ingram.

[07:46] Team_092 possession (Score: 33-41)
Austin Bridges attempts a Midrange. Contested by Zach Fox (4.1 feet, ZONE). Austin Bridges misses. Rebound secured by Anfernee Williamson.

[07:30] Team_024 possession (Score: 33-41)
Draymond Towns drives, Immanuel Ingram stays with him. Draymond Towns attempts a Layup. Contested by Immanuel Ingram (4.4 feet, MAN). DRAYMOND TOWNS MAKES IT!
Score: 33-43

[07:13] Team_092 possession (Score: 33-43)
Austin Bridges attempts a 3Pt. Contested by Anfernee Williamson (4.4 feet, ZONE). Austin Bridges misses. Rebound secured by Draymond Towns.

[06:58] Team_024 possession (Score: 33-43)
Draymond Towns attempts a Layup. BLOCKED BY IMMANUEL INGRAM! Ball is loose! Offensive rebound by Draymond Towns! Draymond Towns kicks it out.

[06:47] Team_024 possession (Score: 33-43)
Bradley Allen makes the Layup and draws the foul on John Giddey! And-1! Bradley Allen to the line for 1. [Team fouls: 2] (John Giddey: 1 personal fouls)   FT 1/1: GOOD Bradley Allen makes 1/1 from the line.
Score: 33-46

[06:37] Team_092 possession (Score: 33-46)
Karl Gobert drives, picks up Zach Fox. Help arrives from Bradley Allen! Karl Gobert attempts a Layup. Contested by Bradley Allen (4.3 feet, MAN). KARL GOBERT MAKES IT!
Score: 35-46

[06:24] Team_024 possession (Score: 35-46)
FOUL! Reach-in foul on John Giddey during the drive. [Team fouls: 3] No free throws, side out. (John Giddey: 2 personal fouls)

[06:10] Team_024 possession (Score: 35-46)
Draymond Towns attempts a Layup. Contested by John Giddey (4.8 feet, ZONE). DRAYMOND TOWNS MAKES IT! Assist: Anfernee Williamson
Score: 35-48

[05:55] Team_092 possession (Score: 35-48)
John Giddey drives, picks up Anfernee Williamson. Help arrives from Zach Fox! John Giddey attempts a Dunk. Contested by Zach Fox (5.1 feet, ZONE). JOHN GIDDEY MAKES IT!
Score: 37-48

[05:41] Team_024 possession (Score: 37-48)
Bradley Allen drives, picks up Paul James. Help arrives from Austin Bridges! Bradley Allen attempts a Dunk. Contested by Austin Bridges (5.7 feet, MAN). BRADLEY ALLEN MAKES IT! Assist: Anfernee Williamson
Score: 37-50

[05:27] Team_092 possession (Score: 37-50)
Paul James attempts a 3Pt. Contested by Zach Fox (5.2 feet, ZONE). PAUL JAMES MAKES IT! Assist: Austin Bridges
Score: 40-50

[05:10] Team_024 possession (Score: 40-50)
Draymond Towns attempts a Midrange. Contested by Immanuel Ingram (4.7 feet, MAN). Draymond Towns misses. Rebound secured by John Giddey.

[04:57] Team_092 possession (Score: 40-50)
Karl Gobert attempts a Midrange. BLOCKED BY ANFERNEE WILLIAMSON! Ball is loose! Offensive rebound by John Giddey! John Giddey kicks it out.

[04:44] Team_092 possession (Score: 40-50)
FOUL! Reach-in foul on Zach Fox during the drive. [Team fouls: 2] No free throws, side out. (Zach Fox: 1 personal fouls)

[04:31] Team_092 possession (Score: 40-50)
Immanuel Ingram attempts a Midrange. Contested by Anfernee Williamson (5.0 feet, ZONE). Immanuel Ingram misses. Rebound secured by Zach Fox.

[04:14] Team_024 possession (Score: 40-50)
Bradley Allen attempts a 3Pt. Contested by Paul James (5.8 feet, MAN). BRADLEY ALLEN MAKES IT! Assist: Anfernee Williamson
Score: 40-53

[04:00] Team_092 possession (Score: 40-53)
Immanuel Ingram attempts a Midrange. Contested by Draymond Towns (5.2 feet, MAN). Immanuel Ingram misses. Rebound secured by Anfernee Williamson.

[03:51] Team_024 possession (Score: 40-53)
Anfernee Williamson attempts a Midrange. Contested by Immanuel Ingram (5.2 feet, ZONE). Anfernee Williamson misses. Offensive rebound by Zach Fox! Zach Fox kicks it out.

[03:36] Team_024 possession (Score: 40-53)
Anfernee Williamson makes the Layup and draws the foul on John Giddey! And-1! Anfernee Williamson to the line for 1. [Team fouls: 4] (John Giddey: 3 personal fouls)   FT 1/1: GOOD Anfernee Williamson makes 1/1 from the line.
Score: 40-56

[03:23] Team_092 possession (Score: 40-56)
FOUL! Reach-in foul on Draymond Towns during the drive. [Team fouls: 3] No free throws, side out. (Draymond Towns: 1 personal fouls)

[03:07] Team_092 possession (Score: 40-56)
John Giddey attempts a Layup. Contested by Anfernee Williamson (5.5 feet, MAN). JOHN GIDDEY MAKES IT! Assist: Paul James
Score: 42-56

[02:50] Team_024 possession (Score: 42-56)
Ja Reaves attempts a 3Pt. Contested by John Giddey (5.8 feet, ZONE). Ja Reaves misses. Rebound secured by Immanuel Ingram.

[02:36] Team_092 possession (Score: 42-56)
Immanuel Ingram attempts a Midrange. Contested by Bradley Allen (5.3 feet, ZONE). Immanuel Ingram misses. Rebound secured by Draymond Towns.

[02:16] Team_024 possession (Score: 42-56)
Draymond Towns drives, John Giddey stays with him. Draymond Towns attempts a Dunk. Contested by John Giddey (5.5 feet, ZONE). Draymond Towns misses. Rebound secured by Paul James.

[01:59] Team_092 possession (Score: 42-56)
John Giddey attempts a 3Pt. Contested by Anfernee Williamson (5.7 feet, MAN). John Giddey misses. Offensive rebound by Immanuel Ingram! Immanuel Ingram kicks it out.

[01:45] Team_092 possession (Score: 42-56)
Austin Bridges drives and kicks out. Paul James attempts a Midrange. Contested by Anfernee Williamson (5.8 feet, ZONE). Paul James misses. Rebound secured by Anfernee Williamson.

[01:30] Team_024 possession (Score: 42-56)
Bradley Allen attempts a Layup. BLOCKED BY IMMANUEL INGRAM! Ball goes out off Immanuel Ingram. Bradley Allen's ball!

[01:19] Team_024 possession (Score: 42-56)
FOUL! Shooting foul on John Giddey. Anfernee Williamson to the line for 3 free throws. [BONUS: 5 team fouls] (John Giddey: 4 personal fouls)   FT 1/3: GOOD   FT 2/3: MISS   FT 3/3: GOOD Anfernee Williamson makes 2/3 from the line.
Score: 42-58

[01:08] Team_092 possession (Score: 42-58)
Karl Gobert attempts a Midrange. Contested by Zach Fox (5.2 feet, ZONE). Karl Gobert misses. Rebound secured by Anfernee Williamson.

[00:58] Team_024 possession (Score: 42-58)
Bradley Allen attempts a 3Pt. Wide open! John Giddey is 6.1 feet away. [ZONE] Bradley Allen misses. Rebound secured by Immanuel Ingram.

[00:46] Team_092 possession (Score: 42-58)
Paul James drives to the basket... Paul James throws a bad pass out of bounds! TURNOVER! (dead ball)

[00:46] Substitution (Team_092): Austin Bridges OUT → Bones Giddey IN (stamina_rule2)

[00:46] Substitution (Team_092): Karl Gobert OUT → Shaquille Russell IN (stamina_rule2)

[00:46] Substitution (Team_092): Paul James OUT → Vince Harris IN (stamina_rule2)

[00:46] Substitution (Team_092): John Giddey OUT → Shaquille Paul IN (stamina_rule2)

[00:46] Substitution (Team_092): Immanuel Ingram OUT → Pau Reaves IN (stamina_rule2)

[00:46] Substitution (Team_024): Ja Reaves OUT → Victor Simons IN (stamina_rule2)

[00:46] Substitution (Team_024): Zach Fox OUT → Vince Irving IN (stamina_rule2)

[00:46] Substitution (Team_024): Bradley Allen OUT → Zach Durant IN (stamina_rule2)

[00:46] Substitution (Team_024): Anfernee Williamson OUT → Julius Harris IN (stamina_rule2)

[00:46] Substitution (Team_024): Draymond Towns OUT → Terry Rozier IN (stamina_rule2)

[00:28] Team_024 possession (Score: 42-58)
Vince Irving attempts a 3Pt. Contested by Vince Harris (4.2 feet, ZONE). Vince Irving misses. Offensive rebound by Terry Rozier! Terry Rozier's putback is no good. Rebound secured by Shaquille Russell.

[00:18] Team_092 possession (Score: 42-58)
Shaquille Paul attempts a 3Pt. Contested by Julius Harris (5.6 feet, MAN). Shaquille Paul misses. Rebound secured by Julius Harris.

[00:02] Team_024 possession (Score: 42-58)
Julius Harris attempts a Layup. Contested by Shaquille Paul (5.8 feet, MAN). JULIUS HARRIS MAKES IT! Assist: Terry Rozier
Score: 42-60

================================================================================
                              2ND QUARTER COMPLETE                              
================================================================================

2ND QUARTER SCORE: Team_092 19, Team_024 23

BOX SCORE:
================================================================================

Team_092
--------------------------------------------------------------------------------
Player                MIN  PTS  REB  AST  TO      FG   FG%      3P   3P%
--------------------------------------------------------------------------------
Austin Bridges         24    6    0    1   0   2/5    40.0     0/0   0.0
Paul James             24    5    5    1   0   2/2   100.0     0/0   0.0
Karl Gobert            24    4    0    0   0   2/3    66.7     0/0   0.0
John Giddey            24    4    4    1   0   2/5    40.0     0/0   0.0
Immanuel Ingram        24    0    5    0   0   0/4     0.0     0/0   0.0
Shaquille Paul          1    0    0    0   0   0/1     0.0     0/0   0.0

TEAM: FG: 8/20 (40.0%), 3PT: 1/5 (20.0%), REB: 13 (4 off, 9 def), AST: 3, TO: 1
TEAM FOULS: 5 [Team_024 in BONUS]


Team_024
--------------------------------------------------------------------------------
Player                MIN  PTS  REB  AST  TO      FG   FG%      3P   3P%
--------------------------------------------------------------------------------
Bradley Allen          24    8    0    0   0   3/5    60.0     0/0   0.0
Draymond Towns         24    6    5    0   0   3/5    60.0     0/0   0.0
Anfernee Williamson    24    5    5    3   0   2/3    66.7     0/0   0.0
Zach Fox               24    2    3    0   0   1/4    25.0     0/0   0.0
Julius Harris           1    2    1    0   0   1/1   100.0     0/0   0.0
Ja Reaves              24    0    0    0   0   0/2     0.0     0/0   0.0
Vince Irving            1    0    0    0   0   0/1     0.0     0/0   0.0
Shaquille Russell       1    0    1    0   0   0/0     0.0     0/0   0.0
Terry Rozier            1    0    0    1   0   0/0     0.0     0/0   0.0

TEAM: FG: 10/21 (47.6%), 3PT: 2/9 (22.2%), REB: 16 (4 off, 12 def), AST: 4, TO: 0
TEAM FOULS: 3

================================================================================

================================================================================
                       3RD QUARTER - Team_092 vs Team_024                       
================================================================================

[12:00] Team_092 possession (Score: 42-60)
Austin Bridges attempts a 3Pt. Contested by Zach Fox (3.3 feet, ZONE). Austin Bridges misses. Rebound secured by Draymond Towns.

[11:46] Team_024 possession (Score: 42-60)
Zach Fox commits a violation (traveling/carry)! TURNOVER! (dead ball)

[11:34] Team_092 possession (Score: 42-60)
Karl Gobert attempts a Midrange. Contested by Zach Fox (3.4 feet, MAN). KARL GOBERT MAKES IT! Assist: Austin Bridges
Score: 44-60

[11:21] Team_024 possession (Score: 44-60)
Draymond Towns throws a bad pass out of bounds! TURNOVER! (dead ball)

[11:05] Team_092 possession (Score: 44-60)
John Giddey attempts a 3Pt. Contested by Zach Fox (3.8 feet, ZONE). John Giddey misses. Rebound secured by Draymond Towns.

[10:52] Team_024 possession (Score: 44-60)
Bradley Allen attempts a 3Pt. Contested by Paul James (4.8 feet, MAN). Bradley Allen misses. Rebound secured by John Giddey.

[10:36] Team_092 possession (Score: 44-60)
FOUL! Shooting foul on Anfernee Williamson. Austin Bridges to the line for 2 free throws. [Team fouls: 1] (Anfernee Williamson: 1 personal fouls)   FT 1/2: GOOD   FT 2/2: GOOD Austin Bridges makes 2/2 from the line.
Score: 46-60

[10:22] Team_024 possession (Score: 46-60)
Anfernee Williamson attempts a Layup. Contested by John Giddey (3.9 feet, ZONE). Anfernee Williamson misses. Rebound secured by Paul James.

[10:09] Team_092 possession (Score: 46-60)
John Giddey drives, Anfernee Williamson stays with him. John Giddey attempts a Layup. Contested by Anfernee Williamson (3.9 feet, ZONE). JOHN GIDDEY MAKES IT! Assist: Paul James
Score: 48-60

[09:53] Team_024 possession (Score: 48-60)
Anfernee Williamson attempts a Midrange. Contested by John Giddey (3.9 feet, MAN). ANFERNEE WILLIAMSON MAKES IT!
Score: 48-62

[09:37] Team_092 possession (Score: 48-62)
FOUL! Shooting foul on Zach Fox. John Giddey to the line for 2 free throws. [Team fouls: 2] (Zach Fox: 1 personal fouls)   FT 1/2: GOOD   FT 2/2: GOOD John Giddey makes 2/2 from the line.
Score: 50-62

[09:20] Team_024 possession (Score: 50-62)
Zach Fox attempts a Layup. Contested by John Giddey (4.4 feet, ZONE). ZACH FOX MAKES IT! Assist: Ja Reaves
Score: 50-64

[09:06] Team_092 possession (Score: 50-64)
John Giddey drives to the basket... FOUL! Offensive foul on John Giddey! Anfernee Williamson drew the charge! [Team fouls: 1] (John Giddey: 1 personal fouls) TURNOVER! (dead ball)

[08:54] Team_024 possession (Score: 50-64)
Anfernee Williamson loses the ball! Stripped by John Giddey! TURNOVER! (live ball)

[08:36] Team_092 possession (Score: 50-64)
Paul James drives and kicks out. Paul James attempts a 3Pt. Contested by Zach Fox (3.5 feet, ZONE). PAUL JAMES MAKES IT!
Score: 53-64

[08:17] Team_024 possession (Score: 53-64)
Ja Reaves attempts a 3Pt. Contested by Austin Bridges (4.5 feet, ZONE). JA REAVES MAKES IT! Assist: Bradley Allen
Score: 53-67

[08:05] Team_092 possession (Score: 53-67)
John Giddey attempts a 3Pt. Contested by Zach Fox (3.8 feet, ZONE). John Giddey misses. Rebound secured by Anfernee Williamson.

[07:49] Team_024 possession (Score: 53-67)
Draymond Towns attempts a Layup. Contested by Immanuel Ingram (3.6 feet, MAN). Draymond Towns misses. Rebound secured by Immanuel Ingram.

[07:34] Team_092 possession (Score: 53-67)
Karl Gobert attempts a 3Pt. Contested by Zach Fox (3.4 feet, MAN). Karl Gobert misses. Offensive rebound by Paul James! Paul James kicks it out.

[07:18] Team_092 possession (Score: 53-67)
Karl Gobert throws a bad pass! Stolen by Zach Fox! TURNOVER! (live ball)

[07:00] Team_024 possession (Score: 53-67)
Bradley Allen loses the ball! Stripped by Paul James! TURNOVER! (live ball)

[06:40] Team_092 possession (Score: 53-67)
Austin Bridges attempts a 3Pt. Contested by Ja Reaves (4.2 feet, ZONE). AUSTIN BRIDGES MAKES IT! Assist: Immanuel Ingram
Score: 56-67

[06:25] Team_024 possession (Score: 56-67)
Ja Reaves drives and kicks out. Zach Fox attempts a 3Pt. Contested by John Giddey (4.0 feet, ZONE). Zach Fox misses. Rebound secured by John Giddey.

[06:08] Team_092 possession (Score: 56-67)
Austin Bridges attempts a Layup. Contested by Anfernee Williamson (3.4 feet, ZONE). Austin Bridges misses. Rebound secured by Zach Fox.

[05:56] Team_024 possession (Score: 56-67)
Ja Reaves attempts a 3Pt. Contested by John Giddey (4.2 feet, ZONE). Ja Reaves misses. Rebound secured by John Giddey.

[05:43] Team_092 possession (Score: 56-67)
Paul James attempts a Midrange. Contested by Bradley Allen (4.5 feet, MAN). Paul James misses. Offensive rebound by John Giddey! John Giddey kicks it out.

[05:30] Team_092 possession (Score: 56-67)
John Giddey attempts a Layup. Contested by Anfernee Williamson (3.9 feet, MAN). John Giddey misses. Offensive rebound by Paul James! Paul James kicks it out.

[05:16] Team_092 possession (Score: 56-67)
John Giddey drives, picks up Anfernee Williamson. Help arrives from Zach Fox! John Giddey attempts a Dunk. Contested by Zach Fox (3.9 feet, MAN). John Giddey misses. Offensive rebound by Paul James! Paul James kicks it out.

[05:03] Team_092 possession (Score: 56-67)
John Giddey makes the Dunk and draws the foul on Anfernee Williamson! And-1! John Giddey to the line for 1. [Team fouls: 3] (Anfernee Williamson: 2 personal fouls)   FT 1/1: GOOD John Giddey makes 1/1 from the line.
Score: 59-67

[04:53] Team_024 possession (Score: 59-67)
Anfernee Williamson makes the Layup and draws the foul on John Giddey! And-1! Anfernee Williamson to the line for 1. [Team fouls: 2] (John Giddey: 2 personal fouls)   FT 1/1: MISS Anfernee Williamson makes 0/1 from the line. Rebound secured by Paul James.
Score: 59-69

[04:36] Team_092 possession (Score: 59-69)
John Giddey drives, picks up Anfernee Williamson. Help arrives from Zach Fox! John Giddey attempts a Layup. Contested by Zach Fox (3.9 feet, ZONE). John Giddey misses. Offensive rebound by Paul James! Paul James kicks it out.

[04:18] Team_092 possession (Score: 59-69)
Immanuel Ingram attempts a Layup. Contested by Anfernee Williamson (3.6 feet, MAN). Immanuel Ingram misses. Rebound secured by Zach Fox.

[04:06] Team_024 possession (Score: 59-69)
Anfernee Williamson attempts a 3Pt. Contested by John Giddey (4.0 feet, MAN). Anfernee Williamson misses. Rebound secured by Paul James.

[03:53] Team_092 possession (Score: 59-69)
Austin Bridges attempts a 3Pt. Contested by Ja Reaves (4.3 feet, MAN). AUSTIN BRIDGES MAKES IT! Assist: John Giddey
Score: 62-69

[03:41] Team_024 possession (Score: 62-69)
Draymond Towns drives and kicks out. Draymond Towns attempts a 3Pt. Contested by John Giddey (4.2 feet, ZONE). Draymond Towns misses. Rebound secured by Immanuel Ingram.

[03:27] Team_092 possession (Score: 62-69)
Immanuel Ingram drives and kicks out. Karl Gobert attempts a 3Pt. Contested by Zach Fox (3.6 feet, ZONE). Karl Gobert misses. Rebound secured by Anfernee Williamson.

[03:11] Team_024 possession (Score: 62-69)
FOUL! Shooting foul on John Giddey. Zach Fox to the line for 3 free throws. [Team fouls: 3] (John Giddey: 3 personal fouls)   FT 1/3: MISS   FT 2/3: GOOD   FT 3/3: GOOD Zach Fox makes 2/3 from the line.
Score: 62-71

[03:01] Team_092 possession (Score: 62-71)
Karl Gobert loses the ball! Stripped by Zach Fox! TURNOVER! (live ball)

[02:46] Team_024 possession (Score: 62-71)
Anfernee Williamson attempts a Midrange. Contested by Paul James (4.8 feet, ZONE). ANFERNEE WILLIAMSON MAKES IT!
Score: 62-73

[02:32] Team_092 possession (Score: 62-73)
Karl Gobert drives and kicks out. Immanuel Ingram attempts a 3Pt. Contested by Zach Fox (3.7 feet, ZONE). Immanuel Ingram misses. Rebound secured by Anfernee Williamson.

[02:17] Team_024 possession (Score: 62-73)
Ja Reaves makes the Midrange and draws the foul on Austin Bridges! And-1! Ja Reaves to the line for 1. [Team fouls: 4] (Austin Bridges: 1 personal fouls)   FT 1/1: GOOD Ja Reaves makes 1/1 from the line.
Score: 62-76

[02:00] Team_092 possession (Score: 62-76)
Paul James drives and kicks out. Austin Bridges attempts a 3Pt. Contested by Ja Reaves (4.8 feet, MAN). AUSTIN BRIDGES MAKES IT!
Score: 65-76

[01:49] Team_024 possession (Score: 65-76)
Anfernee Williamson makes the Layup and draws the foul on Austin Bridges! And-1! Anfernee Williamson to the line for 1. [BONUS: 5 team fouls] (Austin Bridges: 2 personal fouls)   FT 1/1: GOOD Anfernee Williamson makes 1/1 from the line.
Score: 65-79

[01:36] Team_092 possession (Score: 65-79)
Paul James attempts a Layup. Contested by Bradley Allen (4.8 feet, MAN). Paul James misses. Rebound secured by Draymond Towns.

[01:22] Team_024 possession (Score: 65-79)
Draymond Towns attempts a 3Pt. Contested by Immanuel Ingram (3.9 feet, MAN). DRAYMOND TOWNS MAKES IT! Assist: Bradley Allen
Score: 65-82

[01:06] Team_092 possession (Score: 65-82)
Karl Gobert attempts a Midrange. Contested by Zach Fox (3.7 feet, ZONE). Karl Gobert misses. Offensive rebound by Paul James! Paul James kicks it out.

[00:49] Team_092 possession (Score: 65-82)
John Giddey attempts a 3Pt. Contested by Zach Fox (4.1 feet, ZONE). JOHN GIDDEY MAKES IT! Assist: Paul James
Score: 68-82

[00:38] Team_024 possession (Score: 68-82)
Ja Reaves attempts a 3Pt. Contested by Austin Bridges (5.1 feet, MAN). Ja Reaves misses. Rebound secured by Paul James.

[00:20] Team_092 possession (Score: 68-82)
Austin Bridges drives and kicks out. Karl Gobert attempts a 3Pt. Contested by Zach Fox (4.0 feet, MAN). Karl Gobert misses. Rebound secured by Draymond Towns.

[00:06] Team_024 possession (Score: 68-82)
Zach Fox attempts a Midrange. Contested by Karl Gobert (5.8 feet, ZONE). ZACH FOX MAKES IT! Assist: Bradley Allen
Score: 68-84

================================================================================
                              3RD QUARTER COMPLETE                              
================================================================================

3RD QUARTER SCORE: Team_092 26, Team_024 24

BOX SCORE:
================================================================================

Team_092
--------------------------------------------------------------------------------
Player                MIN  PTS  REB  AST  TO      FG   FG%      3P   3P%
--------------------------------------------------------------------------------
Austin Bridges         36   11    0    1   0   4/7    57.1     0/0   0.0
John Giddey            36   10    4    1   0   4/6    66.7     0/0   0.0
Paul James             36    3    9    2   0   1/2    50.0     0/0   0.0
Karl Gobert            36    2    0    0   0   1/2    50.0     0/0   0.0
Immanuel Ingram        36    0    2    1   0   0/2     0.0     0/0   0.0

TEAM: FG: 10/19 (52.6%), 3PT: 3/6 (50.0%), REB: 15 (6 off, 9 def), AST: 5, TO: 3
TEAM FOULS: 5 [Team_024 in BONUS]


Team_024
--------------------------------------------------------------------------------
Player                MIN  PTS  REB  AST  TO      FG   FG%      3P   3P%
--------------------------------------------------------------------------------
Anfernee Williamson    36    7    3    0   0   3/6    50.0     0/0   0.0
Zach Fox               36    6    2    0   0   3/3   100.0     0/0   0.0
Ja Reaves              36    6    0    1   0   2/5    40.0     0/0   0.0
Draymond Towns         36    3    4    0   0   1/3    33.3     0/0   0.0
Bradley Allen          36    0    0    3   0   0/1     0.0     0/0   0.0

TEAM: FG: 9/18 (50.0%), 3PT: 3/7 (42.9%), REB: 9 (0 off, 9 def), AST: 4, TO: 4
TEAM FOULS: 3

================================================================================

================================================================================
                       4TH QUARTER - Team_092 vs Team_024                       
================================================================================

[12:00] Substitution (Team_092): Austin Bridges OUT (stamina: 66) → Bones Giddey IN (comeback_detected)

[12:00] Substitution (Team_024): Ja Reaves OUT (stamina: 69) → Victor Simons IN (comeback_detected)

[12:00] Team_092 possession (Score: 68-84)
Paul James attempts a Midrange. Contested by Bradley Allen (4.7 feet, MAN). Paul James misses. Rebound secured by Draymond Towns.

[11:47] Team_024 possession (Score: 68-84)
Zach Fox drives, picks up Karl Gobert. Help arrives from Paul James! Zach Fox attempts a Layup. Contested by Paul James (5.7 feet, MAN). Zach Fox misses. Rebound secured by Immanuel Ingram.

[11:32] Team_092 possession (Score: 68-84)
FOUL! Reach-in foul on Anfernee Williamson during the drive. [Team fouls: 1] No free throws, side out. (Anfernee Williamson: 1 personal fouls)

[11:14] Team_092 possession (Score: 68-84)
John Giddey attempts a Midrange. Contested by Bradley Allen (4.4 feet, ZONE). JOHN GIDDEY MAKES IT!
Score: 70-84

[10:56] Team_024 possession (Score: 70-84)
Anfernee Williamson attempts a 3Pt. Contested by John Giddey (4.3 feet, MAN). Anfernee Williamson misses. Rebound secured by Immanuel Ingram.

[10:44] Team_092 possession (Score: 70-84)
Immanuel Ingram attempts a Layup. Contested by Anfernee Williamson (4.0 feet, ZONE). IMMANUEL INGRAM MAKES IT! Assist: John Giddey
Score: 72-84

[10:26] Team_024 possession (Score: 72-84)
Anfernee Williamson makes the Layup and draws the foul on John Giddey! And-1! Anfernee Williamson to the line for 1. [Team fouls: 1] (John Giddey: 1 personal fouls)   FT 1/1: GOOD Anfernee Williamson makes 1/1 from the line.
Score: 72-87

[10:09] Team_092 possession (Score: 72-87)
Karl Gobert attempts a 3Pt. Contested by Zach Fox (3.8 feet, MAN). Karl Gobert misses. Offensive rebound by Paul James! Paul James kicks it out.

[09:52] Team_092 possession (Score: 72-87)
John Giddey commits a violation (traveling/carry)! TURNOVER! (dead ball)

[09:52] Substitution (Team_092): Karl Gobert OUT → Shaquille Russell IN (stamina_rule2)

[09:52] Substitution (Team_092): Paul James OUT → Vince Harris IN (stamina_rule2)

[09:52] Substitution (Team_092): John Giddey OUT → Shaquille Paul IN (stamina_rule2)

[09:52] Substitution (Team_092): Immanuel Ingram OUT → Pau Reaves IN (stamina_rule2)

[09:52] Substitution (Team_024): Zach Fox OUT → Vince Irving IN (stamina_rule2)

[09:52] Substitution (Team_024): Bradley Allen OUT → Zach Durant IN (stamina_rule2)

[09:52] Substitution (Team_024): Anfernee Williamson OUT → Julius Harris IN (stamina_rule2)

[09:52] Substitution (Team_024): Draymond Towns OUT → Terry Rozier IN (stamina_rule2)

[09:39] Team_024 possession (Score: 72-87)
FOUL! Shooting foul on Vince Harris. Zach Durant to the line for 2 free throws. [Team fouls: 2] (Vince Harris: 1 personal fouls)   FT 1/2: GOOD   FT 2/2: GOOD Zach Durant makes 2/2 from the line.
Score: 72-89

[09:24] Team_092 possession (Score: 72-89)
FOUL! Offensive foul on Bones Giddey! Victor Simons drew the charge! [Team fouls: 3] (Bones Giddey: 1 personal fouls) TURNOVER! (dead ball)

[09:05] Team_024 possession (Score: 72-89)
FOUL! Reach-in foul on Pau Reaves during the drive. [Team fouls: 4] No free throws, side out. (Pau Reaves: 1 personal fouls)

[08:51] Team_024 possession (Score: 72-89)
FOUL! Shooting foul on Vince Harris. Zach Durant to the line for 2 free throws. [BONUS: 5 team fouls] (Vince Harris: 2 personal fouls)   FT 1/2: GOOD   FT 2/2: GOOD Zach Durant makes 2/2 from the line.
Score: 72-91

[08:39] Team_092 possession (Score: 72-91)
Shaquille Paul attempts a Midrange. BLOCKED BY TERRY ROZIER! Ball goes out off Terry Rozier. Shaquille Paul's ball!

[08:27] Team_092 possession (Score: 72-91)
Shaquille Paul attempts a Midrange. Contested by Julius Harris (5.6 feet, MAN). SHAQUILLE PAUL MAKES IT!
Score: 74-91

[08:08] Team_024 possession (Score: 74-91)
Julius Harris attempts a Midrange. Contested by Shaquille Paul (5.8 feet, MAN). JULIUS HARRIS MAKES IT!
Score: 74-93

[07:56] Team_092 possession (Score: 74-93)
Vince Harris attempts a Midrange. Contested by Vince Irving (5.0 feet, ZONE). VINCE HARRIS MAKES IT! Assist: Shaquille Paul
Score: 76-93

[07:44] Team_024 possession (Score: 76-93)
Terry Rozier attempts a 3Pt. Contested by Pau Reaves (5.1 feet, MAN). Terry Rozier misses. Rebound secured by Shaquille Russell.

[07:32] Team_092 possession (Score: 76-93)
Bones Giddey drives and kicks out. Pau Reaves attempts a 3Pt. Contested by Terry Rozier (4.0 feet, MAN). PAU REAVES MAKES IT! Assist: Shaquille Paul
Score: 79-93

[07:20] Team_024 possession (Score: 79-93)
Zach Durant attempts a Midrange. Contested by Vince Harris (4.3 feet, MAN). Zach Durant misses. Rebound secured by Shaquille Paul.

[07:07] Team_092 possession (Score: 79-93)
Bones Giddey drives and kicks out. Shaquille Paul attempts a 3Pt. Contested by Victor Simons (3.9 feet, ZONE). Shaquille Paul misses. Offensive rebound by Shaquille Paul! Shaquille Paul kicks it out.

[06:54] Team_092 possession (Score: 79-93)
Bones Giddey drives and kicks out. Shaquille Russell attempts a 3Pt. Contested by Victor Simons (3.9 feet, ZONE). Shaquille Russell misses. Rebound secured by Terry Rozier.

[06:40] Team_024 possession (Score: 79-93)
Vince Irving attempts a Midrange. Contested by Shaquille Paul (5.6 feet, ZONE). VINCE IRVING MAKES IT!
Score: 79-95

[06:29] Team_092 possession (Score: 79-95)
Shaquille Russell attempts a 3Pt. Contested by Vince Irving (5.3 feet, MAN). Shaquille Russell misses. Rebound secured by Zach Durant.

[06:14] Team_024 possession (Score: 79-95)
Vince Irving attempts a 3Pt. Contested by Shaquille Russell (4.2 feet, MAN). Vince Irving misses. Rebound secured by Shaquille Paul.

[06:00] Team_092 possession (Score: 79-95)
Bones Giddey attempts a Layup. Contested by Terry Rozier (3.7 feet, ZONE). BONES GIDDEY MAKES IT!
Score: 81-95

[05:42] Team_024 possession (Score: 81-95)
Victor Simons attempts a Midrange. Contested by Shaquille Paul (5.6 feet, ZONE). Victor Simons misses. Offensive rebound by Julius Harris! Julius Harris kicks it out.

[05:26] Team_024 possession (Score: 81-95)
Zach Durant attempts a 3Pt. Contested by Vince Harris (4.3 feet, ZONE). Zach Durant misses. Rebound secured by Pau Reaves.

[05:13] Team_092 possession (Score: 81-95)
Bones Giddey loses the ball! Stripped by Victor Simons! TURNOVER! (live ball)

[04:58] Team_024 possession (Score: 81-95)
FOUL! Shooting foul on Bones Giddey. Victor Simons to the line for 2 free throws. [BONUS: 6 team fouls] (Bones Giddey: 2 personal fouls)   FT 1/2: GOOD   FT 2/2: GOOD Victor Simons makes 2/2 from the line.
Score: 81-97

[04:41] Team_092 possession (Score: 81-97)
Shaquille Paul drives to the basket... Shaquille Paul loses control! Ball rolls out of bounds! TURNOVER! (dead ball)

[04:22] Team_024 possession (Score: 81-97)
Zach Durant attempts a 3Pt. Contested by Vince Harris (4.3 feet, MAN). Zach Durant misses. FOUL! Loose ball foul on Pau Reaves during the rebound battle. [IN THE BONUS! 7 team fouls] Julius Harris to the line for 2 free throws. (Pau Reaves: 2 personal fouls)   FT 1/2: GOOD   FT 2/2: GOOD Julius Harris makes 2/2 from the line.
Score: 81-99

[04:10] Team_092 possession (Score: 81-99)
Shaquille Paul drives and kicks out. Bones Giddey attempts a Midrange. Contested by Victor Simons (4.0 feet, MAN). BONES GIDDEY MAKES IT! Assist: Shaquille Paul
Score: 83-99

[03:59] Team_024 possession (Score: 83-99)
Zach Durant attempts a 3Pt. Contested by Vince Harris (4.3 feet, ZONE). Zach Durant misses. Rebound secured by Pau Reaves.

[03:42] Team_092 possession (Score: 83-99)
Shaquille Russell attempts a 3Pt. Contested by Vince Irving (5.3 feet, MAN). Shaquille Russell misses. Offensive rebound by Shaquille Paul! Shaquille Paul kicks it out.

[03:27] Team_092 possession (Score: 83-99)
Shaquille Paul drives, Terry Rozier stays with him. Shaquille Paul attempts a Dunk. Contested by Terry Rozier (4.6 feet, ZONE). SHAQUILLE PAUL MAKES IT!
Score: 85-99

[03:10] Team_024 possession (Score: 85-99)
Vince Irving drives and kicks out. Terry Rozier attempts a 3Pt. Contested by Pau Reaves (4.8 feet, MAN). Terry Rozier misses. Rebound secured by Shaquille Paul.

[02:54] Team_092 possession (Score: 85-99)
Pau Reaves makes the 3Pt and draws the foul on Terry Rozier! And-1! Pau Reaves to the line for 1. [Team fouls: 2] (Terry Rozier: 1 personal fouls)   FT 1/1: GOOD Pau Reaves makes 1/1 from the line.
Score: 89-99

[02:42] Team_024 possession (Score: 89-99)
Julius Harris attempts a Layup. BLOCKED BY SHAQUILLE PAUL! Ball is loose! Offensive rebound by Julius Harris! Julius Harris kicks it out.

[02:25] Team_024 possession (Score: 89-99)
Julius Harris attempts a Layup. Contested by Pau Reaves (5.1 feet, ZONE). JULIUS HARRIS MAKES IT! Assist: Vince Irving
Score: 89-101

[02:11] Team_092 possession (Score: 89-101)
FOUL! Holding foul on Terry Rozier. [Team fouls: 3] No free throws, side out. (Terry Rozier: 2 personal fouls)

[01:52] Team_092 possession (Score: 89-101)
Bones Giddey drives to the basket... Bones Giddey loses control! Ball rolls out of bounds! TURNOVER! (dead ball)

[01:40] Team_024 possession (Score: 89-101)
FOUL! Reach-in foul on Vince Harris during the drive. [IN THE BONUS! 8 team fouls] Zach Durant to the line for 2 free throws. (Vince Harris: 3 personal fouls)   FT 1/2: MISS   FT 2/2: GOOD Zach Durant makes 1/2 from the line.
Score: 89-102

[01:26] Team_092 possession (Score: 89-102)
Vince Harris makes the 3Pt and draws the foul on Zach Durant! And-1! Vince Harris to the line for 1. [Team fouls: 4] (Zach Durant: 1 personal fouls)   FT 1/1: GOOD Vince Harris makes 1/1 from the line.
Score: 93-102

[01:14] Team_024 possession (Score: 93-102)
Victor Simons drives, Pau Reaves stays with him. Victor Simons attempts a Layup. Contested by Pau Reaves (5.0 feet, ZONE). VICTOR SIMONS MAKES IT! Assist: Vince Irving
Score: 93-104

[01:03] Team_092 possession (Score: 93-104)
Bones Giddey drives and kicks out. Vince Harris attempts a 3Pt. Contested by Julius Harris (5.1 feet, ZONE). Vince Harris misses. Rebound secured by Julius Harris.

[00:47] Team_024 possession (Score: 93-104)
Julius Harris attempts a 3Pt. Contested by Vince Harris (4.5 feet, ZONE). Julius Harris misses. Rebound secured by Pau Reaves.

[00:32] Team_092 possession (Score: 93-104)
Shaquille Russell makes the Midrange and draws the foul on Vince Irving! And-1! Shaquille Russell to the line for 1. [BONUS: 5 team fouls] (Vince Irving: 1 personal fouls)   FT 1/1: GOOD Shaquille Russell makes 1/1 from the line.
Score: 96-104

[00:22] Team_024 possession (Score: 96-104)
Zach Durant drives to the basket... Zach Durant commits a violation (traveling/carry)! TURNOVER! (dead ball)

[00:07] Team_092 possession (Score: 96-104)
Bones Giddey attempts a Midrange. Contested by Zach Durant (3.2 feet, ZONE). BONES GIDDEY MAKES IT! Assist: Pau Reaves
Score: 98-104

================================================================================
                              4TH QUARTER COMPLETE                              
================================================================================

4TH QUARTER SCORE: Team_092 30, Team_024 20

BOX SCORE:
================================================================================

Team_092
--------------------------------------------------------------------------------
Player                MIN  PTS  REB  AST  TO      FG   FG%      3P   3P%
--------------------------------------------------------------------------------
Pau Reaves             11    7    3    1   0   2/2   100.0     0/0   0.0
Vince Harris           11    6    0    0   0   2/2   100.0     0/0   0.0
Bones Giddey           13    6    0    0   0   3/5    60.0     0/0   0.0
Shaquille Paul         11    4    5    3   0   2/2   100.0     0/0   0.0
Shaquille Russell      11    3    1    0   0   1/2    50.0     0/0   0.0
Immanuel Ingram        38    2    2    0   0   1/1   100.0     0/0   0.0
John Giddey            38    2    0    1   0   1/1   100.0     0/0   0.0
Paul James             38    0    1    0   0   0/1     0.0     0/0   0.0

TEAM: FG: 12/16 (75.0%), 3PT: 2/3 (66.7%), REB: 12 (3 off, 9 def), AST: 5, TO: 5
TEAM FOULS: 8 [Team_024 in BONUS]


Team_024
--------------------------------------------------------------------------------
Player                MIN  PTS  REB  AST  TO      FG   FG%      3P   3P%
--------------------------------------------------------------------------------
Julius Harris          11    6    3    0   0   3/4    75.0     0/0   0.0
Zach Durant            11    5    1    0   0   3/6    50.0     0/0   0.0
Victor Simons          13    4    0    0   0   2/2   100.0     0/0   0.0
Anfernee Williamson    38    3    0    0   0   1/2    50.0     0/0   0.0
Vince Irving           11    2    0    2   0   1/3    33.3     0/0   0.0
Draymond Towns         38    0    1    0   0   0/0     0.0     0/0   0.0
Zach Fox               38    0    0    0   0   0/1     0.0     0/0   0.0
Terry Rozier           11    0    1    0   0   0/1     0.0     0/0   0.0

TEAM: FG: 10/19 (52.6%), 3PT: 1/7 (14.3%), REB: 6 (2 off, 4 def), AST: 2, TO: 1
TEAM FOULS: 5 [Team_092 in BONUS]

================================================================================

================================================================================
                               FULL GAME COMPLETE                               
================================================================================

FINAL SCORE: Team_092 98, Team_024 104

SCORING BY QUARTER:
--------------------------------------------------------------------------------
Team                     Q1     Q2     Q3     Q4    FINAL
--------------------------------------------------------------------------------
Team_092                 23     19     26     30       98
Team_024                 37     23     24     20      104
--------------------------------------------------------------------------------

FULL GAME BOX SCORE:
================================================================================

Team_092
--------------------------------------------------------------------------------
Player                MIN  PTS  REB  AST  TO      FG   FG%      3P   3P%      FT STL BLK
--------------------------------------------------------------------------------
Karl Gobert            38   11    0    0   4   5/7    71.4   1/1   100.0   2/2     0   0
Paul James             38   10   17    5   1   7/12   58.3   1/4    25.0   0/0     2   0
John Giddey            38   18   14    3   1   9/14   64.3   1/5    20.0   3/3     1   1
Immanuel Ingram        38    8   10    2   2   2/10   20.0   0/1     0.0   2/3     0   2
Austin Bridges         36   23    0    2   1   6/15   40.0   4/7    57.1   3/4     0   0
Bones Giddey           13    6    0    0   4   3/5    60.0   0/0     0.0   0/0     0   0
Shaquille Russell      11    3    2    0   0   1/2    50.0   0/1     0.0   1/1     0   0
Vince Harris           11    6    0    0   0   2/2   100.0   1/1   100.0   1/1     0   0
Shaquille Paul         11    4    5    3   0   3/4    75.0   0/1     0.0   0/0     0   1
Pau Reaves             11    7    3    1   0   1/1   100.0   1/1   100.0   1/1     0   0

TEAM: FG: 39/72 (54.2%), 3PT: 9/22 (40.9%), REB: 49 (17 off, 32 def), AST: 16, TO: 13


Team_024
--------------------------------------------------------------------------------
Player                MIN  PTS  REB  AST  TO      FG   FG%      3P   3P%      FT STL BLK
--------------------------------------------------------------------------------
Zach Fox               38   17    8    1   1   7/11   63.6   1/3    33.3   7/8     2   0
Bradley Allen          38   24    0    3   2   9/14   64.3   5/9    55.6   1/1     0   0
Anfernee Williamson    38   15   11    6   1   7/12   58.3   2/4    50.0   5/7     2   2
Draymond Towns         38   14   13    1   1   6/11   54.5   2/2   100.0   0/0     0   0
Ja Reaves              36   13    0    4   0   5/12   41.7   1/7    14.3   4/4     0   1
Victor Simons          13    4    0    0   1   2/2   100.0   0/0     0.0   2/2     1   0
Vince Irving           11    2    0    2   0   1/4    25.0   0/2     0.0   0/0     0   0
Zach Durant            11    5    1    0   0   4/7    57.1   1/3    33.3   5/6     0   0
Julius Harris          11    8    4    0   0   3/4    75.0   0/1     0.0   2/2     0   0
Terry Rozier           11    0    1    1   0   0/1     0.0   0/1     0.0   0/0     0   1

TEAM: FG: 44/78 (56.4%), 3PT: 12/32 (37.5%), REB: 40 (7 off, 33 def), AST: 18, TO: 6

================================================================================
