================================================================================
                        FULL GAME - Team_018 vs Team_096                        
================================================================================

================================================================================
                       1ST QUARTER - Team_018 vs Team_096                       
================================================================================

[12:00] Team_018 possession (Score: 0-0)
Domantas Wall commits a violation (traveling/carry)! TURNOVER! (dead ball)

[11:49] Team_096 possession (Score: 0-0)
Kyrie Adebayo drives, picks up Domantas Wall. Help arrives from Klay Stewart! Kyrie Adebayo attempts a Layup. Contested by Klay Stewart (4.1 feet, MAN). KYRIE ADEBAYO MAKES IT! Assist: Cole Griffin
Score: 0-2

[11:33] Team_018 possession (Score: 0-2)
Allen Markkanen attempts a Layup. Contested by Cole Griffin (3.7 feet, MAN). Allen Markkanen misses. Offensive rebound by Bones Anunoby! Bones Anunoby kicks it out.

[11:18] Team_018 possession (Score: 0-2)
FOUL! Shooting foul on Kyrie Adebayo. Bones Anunoby to the line for 2 free throws. [Team fouls: 1] (Kyrie Adebayo: 1 personal fouls)   FT 1/2: GOOD   FT 2/2: GOOD Bones Anunoby makes 2/2 from the line.
Score: 2-2

[11:06] Team_096 possession (Score: 2-2)
Lamelo Quickley attempts a 3Pt. Contested by Tracy Bryant (2.9 feet, MAN). Lamelo Quickley misses. Rebound secured by Bones Anunoby.

[10:54] Team_018 possession (Score: 2-2)
Klay Stewart throws a bad pass! Stolen by Terry Mobley! TURNOVER! (live ball)

[10:39] Team_096 possession (Score: 2-2)
Terry Mobley makes the Layup and draws the foul on Bones Anunoby! And-1! Terry Mobley to the line for 1. [Team fouls: 1] (Bones Anunoby: 1 personal fouls)   FT 1/1: MISS Terry Mobley makes 0/1 from the line. Rebound secured by Bones Anunoby.
Score: 2-4

[10:25] Team_018 possession (Score: 2-4)
Domantas Wall attempts a 3Pt. Contested by Kyrie Adebayo (4.2 feet, MAN). DOMANTAS WALL MAKES IT! Assist: Klay Stewart
Score: 5-4

[10:16] Team_096 possession (Score: 5-4)
Kyrie Adebayo makes the Layup and draws the foul on Domantas Wall! And-1! Kyrie Adebayo to the line for 1. [Team fouls: 2] (Domantas Wall: 1 personal fouls)   FT 1/1: MISS Kyrie Adebayo makes 0/1 from the line. Rebound secured by Domantas Wall.
Score: 5-6

[10:01] Team_018 possession (Score: 5-6)
Klay Stewart loses control! Ball rolls out of bounds! TURNOVER! (dead ball)

[09:51] Team_096 possession (Score: 5-6)
Terry Mobley drives to the basket... Terry Mobley throws a bad pass! Stolen by Domantas Wall! TURNOVER! (live ball)

[09:41] Team_018 possession (Score: 5-6)
FOUL! Shooting foul on Lamelo Quickley. Tracy Bryant to the line for 2 free throws. [Team fouls: 2] (Lamelo Quickley: 1 personal fouls)   FT 1/2: GOOD   FT 2/2: GOOD Tracy Bryant makes 2/2 from the line.
Score: 7-6

[09:27] Team_096 possession (Score: 7-6)
Lamelo Quickley attempts a 3Pt. Contested by Bones Anunoby (2.8 feet, ZONE). Lamelo Quickley misses. Rebound secured by Bones Anunoby.

[09:14] Team_018 possession (Score: 7-6)
Tracy Bryant drives, Kyrie Adebayo stays with him. Tracy Bryant attempts a Layup. Contested by Kyrie Adebayo (4.3 feet, ZONE). TRACY BRYANT MAKES IT! Assist: Klay Stewart
Score: 9-6

[09:02] Team_096 possession (Score: 9-6)
Terry Mobley attempts a 3Pt. Contested by Klay Stewart (4.2 feet, MAN). Terry Mobley misses. Rebound secured by Allen Markkanen.

[08:45] Team_018 possession (Score: 9-6)
Domantas Wall drives to the basket... FOUL! Offensive foul on Domantas Wall! Kyrie Adebayo drew the charge! [Team fouls: 3] (Domantas Wall: 2 personal fouls) TURNOVER! (dead ball)

[08:29] Team_096 possession (Score: 9-6)
Lamelo Quickley attempts a Layup. Contested by Bones Anunoby (2.8 feet, ZONE). LAMELO QUICKLEY MAKES IT! Assist: Terry Mobley
Score: 9-8

[08:11] Team_018 possession (Score: 9-8)
Allen Markkanen loses the ball! Stripped by Cole Griffin! TURNOVER! (live ball)

[07:57] Team_096 possession (Score: 9-8)
Kyrie Adebayo drives and kicks out. Scottie Herro attempts a 3Pt. Contested by Klay Stewart (4.1 feet, ZONE). Scottie Herro misses. Rebound secured by Domantas Wall.

[07:42] Team_018 possession (Score: 9-8)
Tracy Bryant attempts a Midrange. Contested by Cole Griffin (3.7 feet, ZONE). Tracy Bryant misses. Rebound secured by Cole Griffin.

[07:29] Team_096 possession (Score: 9-8)
Cole Griffin attempts a Layup. Contested by Allen Markkanen (4.1 feet, MAN). COLE GRIFFIN MAKES IT!
Score: 9-10

[07:15] Team_018 possession (Score: 9-10)
Allen Markkanen attempts a 3Pt. Contested by Cole Griffin (3.7 feet, ZONE). Allen Markkanen misses. Rebound secured by Scottie Herro.

[07:02] Team_096 possession (Score: 9-10)
Kyrie Adebayo makes the Layup and draws the foul on Domantas Wall! And-1! Kyrie Adebayo to the line for 1. [Team fouls: 4] (Domantas Wall: 3 personal fouls)   FT 1/1: GOOD Kyrie Adebayo makes 1/1 from the line.
Score: 9-13

[06:51] Team_018 possession (Score: 9-13)
FOUL! Shooting foul on Lamelo Quickley. Bones Anunoby to the line for 2 free throws. [Team fouls: 3] (Lamelo Quickley: 2 personal fouls)   FT 1/2: GOOD   FT 2/2: MISS Bones Anunoby makes 1/2 from the line. Rebound secured by Scottie Herro.
Score: 10-13

[06:40] Team_096 possession (Score: 10-13)
Lamelo Quickley attempts a Midrange. Contested by Allen Markkanen (3.3 feet, ZONE). Lamelo Quickley misses. Offensive rebound by Scottie Herro! Scottie Herro kicks it out.

[06:22] Team_096 possession (Score: 10-13)
Lamelo Quickley attempts a Midrange. Contested by Tracy Bryant (2.9 feet, MAN). LAMELO QUICKLEY MAKES IT! Assist: Cole Griffin
Score: 10-15

[06:04] Team_018 possession (Score: 10-15)
Klay Stewart attempts a 3Pt. Contested by Cole Griffin (3.5 feet, ZONE). Klay Stewart misses. Rebound secured by Kyrie Adebayo.

[05:53] Team_096 possession (Score: 10-15)
Scottie Herro makes the 3Pt and draws the foul on Bones Anunoby! And-1! Scottie Herro to the line for 1. [BONUS: 5 team fouls] (Bones Anunoby: 2 personal fouls)   FT 1/1: GOOD Scottie Herro makes 1/1 from the line.
Score: 10-19

[05:38] Team_018 possession (Score: 10-19)
Bones Anunoby drives and kicks out. Klay Stewart attempts a 3Pt. Contested by Terry Mobley (4.6 feet, MAN). Klay Stewart misses. Offensive rebound by Domantas Wall! Domantas Wall's putback is no good. Rebound secured by Scottie Herro.

[05:23] Team_096 possession (Score: 10-19)
FOUL! Holding foul on Bones Anunoby. [IN THE BONUS! 6 team fouls] Scottie Herro to the line for 2 free throws. (Bones Anunoby: 3 personal fouls)   FT 1/2: GOOD   FT 2/2: MISS Scottie Herro makes 1/2 from the line. Rebound secured by Bones Anunoby.
Score: 10-20

[05:07] Team_018 possession (Score: 10-20)
Tracy Bryant attempts a 3Pt. Contested by Lamelo Quickley (4.3 feet, MAN). TRACY BRYANT MAKES IT!
Score: 13-20

[04:52] Team_096 possession (Score: 13-20)
Kyrie Adebayo throws a bad pass out of bounds! TURNOVER! (dead ball)

[04:35] Team_018 possession (Score: 13-20)
FOUL! Reach-in foul on Terry Mobley during the drive. [Team fouls: 4] No free throws, side out. (Terry Mobley: 1 personal fouls)

[04:24] Team_018 possession (Score: 13-20)
Bones Anunoby attempts a 3Pt. Contested by Cole Griffin (3.7 feet, ZONE). Bones Anunoby misses. Rebound secured by Scottie Herro.

[04:08] Team_096 possession (Score: 13-20)
Cole Griffin attempts a Layup. Contested by Allen Markkanen (4.2 feet, MAN). Cole Griffin misses. Rebound secured by Domantas Wall.

[03:51] Team_018 possession (Score: 13-20)
Tracy Bryant drives to the basket... Tracy Bryant throws a bad pass out of bounds! TURNOVER! (dead ball)

[03:36] Team_096 possession (Score: 13-20)
Kyrie Adebayo throws a bad pass out of bounds! TURNOVER! (dead ball)

[03:36] Substitution (Team_018): Domantas Wall OUT → Julius Jackson IN (stamina_rule2)

[03:21] Team_018 possession (Score: 13-20)
Bones Anunoby attempts a 3Pt. Contested by Scottie Herro (5.5 feet, MAN). Bones Anunoby misses. Rebound secured by Cole Griffin.

[03:05] Team_096 possession (Score: 13-20)
Terry Mobley attempts a 3Pt. Contested by Klay Stewart (4.4 feet, MAN). Terry Mobley misses. Rebound secured by Bones Anunoby.

[02:50] Team_018 possession (Score: 13-20)
Tracy Bryant attempts a Layup. BLOCKED BY KYRIE ADEBAYO! Ball is loose! Offensive rebound by Bones Anunoby! Bones Anunoby kicks it out.

[02:35] Team_018 possession (Score: 13-20)
Bones Anunoby attempts a Midrange. Contested by Scottie Herro (5.5 feet, MAN). Bones Anunoby misses. Rebound secured by Scottie Herro.

[02:23] Team_096 possession (Score: 13-20)
FOUL! Holding foul on Tracy Bryant. [IN THE BONUS! 7 team fouls] Lamelo Quickley to the line for 2 free throws. (Tracy Bryant: 1 personal fouls)   FT 1/2: MISS   FT 2/2: GOOD Lamelo Quickley makes 1/2 from the line.
Score: 13-21

[02:13] Team_018 possession (Score: 13-21)
Bones Anunoby drives and kicks out. Bones Anunoby attempts a Midrange. Contested by Scottie Herro (5.3 feet, MAN). Bones Anunoby misses. Rebound secured by Kyrie Adebayo.

[01:59] Team_096 possession (Score: 13-21)
Cole Griffin drives to the basket... Cole Griffin commits a violation (traveling/carry)! TURNOVER! (dead ball)

[01:59] Substitution (Team_018): Klay Stewart OUT → Michael Simons IN (stamina_rule2)

[01:59] Substitution (Team_018): Tracy Bryant OUT → Miles Herro IN (stamina_rule2)

[01:59] Substitution (Team_018): Bones Anunoby OUT → Shai Wade IN (stamina_rule2)

[01:59] Substitution (Team_096): Terry Mobley OUT → Cade Jokic IN (stamina_rule2)

[01:59] Substitution (Team_096): Lamelo Quickley OUT → Jarrett Markkanen IN (stamina_rule2)

[01:59] Substitution (Team_096): Cole Griffin OUT → Cole Holiday IN (stamina_rule2)

[01:59] Substitution (Team_096): Scottie Herro OUT → Tyler Haliburton IN (stamina_rule2)

[01:59] Substitution (Team_096): Kyrie Adebayo OUT → Devin Griffin IN (stamina_rule2)

[01:45] Team_018 possession (Score: 13-21)
Michael Simons attempts a 3Pt. Contested by Cade Jokic (5.6 feet, ZONE). Michael Simons misses. Offensive rebound by Julius Jackson! Julius Jackson kicks it out.

[01:30] Team_018 possession (Score: 13-21)
Julius Jackson drives, Devin Griffin stays with him. Julius Jackson attempts a Dunk. Contested by Devin Griffin (5.1 feet, ZONE). JULIUS JACKSON MAKES IT!
Score: 15-21

[01:16] Team_096 possession (Score: 15-21)
Cade Jokic attempts a Layup. BLOCKED BY MICHAEL SIMONS! Ball deflects out of bounds off Cade Jokic.

[01:00] Team_018 possession (Score: 15-21)
Michael Simons attempts a 3Pt. Contested by Cade Jokic (5.6 feet, ZONE). Michael Simons misses. Rebound secured by Jarrett Markkanen.

[00:47] Team_096 possession (Score: 15-21)
Devin Griffin drives and kicks out. Tyler Haliburton attempts a Midrange. BLOCKED BY SHAI WADE! Ball deflects out of bounds off Tyler Haliburton.

[00:38] Team_018 possession (Score: 15-21)
Shai Wade makes the Layup and draws the foul on Jarrett Markkanen! And-1! Shai Wade to the line for 1. [BONUS: 5 team fouls] (Jarrett Markkanen: 1 personal fouls)   FT 1/1: GOOD Shai Wade makes 1/1 from the line.
Score: 18-21

[00:20] Team_096 possession (Score: 18-21)
Jarrett Markkanen drives and kicks out. Jarrett Markkanen attempts a 3Pt. Contested by Allen Markkanen (4.3 feet, ZONE). JARRETT MARKKANEN MAKES IT! Assist: Cade Jokic
Score: 18-24

[00:02] Team_018 possession (Score: 18-24)
Julius Jackson attempts a Midrange. Contested by Devin Griffin (5.1 feet, MAN). Julius Jackson misses. Offensive rebound by Julius Jackson! Julius Jackson kicks it out.

================================================================================
                              1ST QUARTER COMPLETE                              
================================================================================

1ST QUARTER SCORE: Team_018 18, Team_096 24

BOX SCORE:
================================================================================

Team_018
--------------------------------------------------------------------------------
Player                MIN  PTS  REB  AST  TO      FG   FG%      3P   3P%
--------------------------------------------------------------------------------
Tracy Bryant           10    7    0    0   0   3/4    75.0     0/0   0.0
Domantas Wall           9    3    3    0   0   1/1   100.0     0/0   0.0
Shai Wade               2    3    0    0   0   1/1   100.0     0/0   0.0
Bones Anunoby          10    2    7    0   0   1/7    14.3     0/0   0.0
Julius Jackson          4    2    2    0   0   1/1   100.0     0/0   0.0
Klay Stewart           10    0    0    2   0   0/1     0.0     0/0   0.0
Allen Markkanen        12    0    1    0   0   0/1     0.0     0/0   0.0
Michael Simons          2    0    0    0   0   0/1     0.0     0/0   0.0

TEAM: FG: 7/17 (41.2%), 3PT: 2/7 (28.6%), REB: 14 (5 off, 9 def), AST: 2, TO: 6
TEAM FOULS: 7 [Team_096 in BONUS]


Team_096
--------------------------------------------------------------------------------
Player                MIN  PTS  REB  AST  TO      FG   FG%      3P   3P%
--------------------------------------------------------------------------------
Kyrie Adebayo          10    5    2    0   0   2/4    50.0     0/0   0.0
Lamelo Quickley        10    5    0    0   0   3/5    60.0     0/0   0.0
Scottie Herro          10    4    6    0   0   1/1   100.0     0/0   0.0
Jarrett Markkanen       2    3    1    0   0   1/1   100.0     0/0   0.0
Cole Griffin           10    2    2    2   0   1/2    50.0     0/0   0.0
Terry Mobley           10    0    0    1   0   0/3     0.0     0/0   0.0
Cade Jokic              2    0    0    1   0   0/1     0.0     0/0   0.0
Devin Griffin           2    0    0    0   0   0/1     0.0     0/0   0.0

TEAM: FG: 8/19 (42.1%), 3PT: 1/5 (20.0%), REB: 10 (1 off, 9 def), AST: 4, TO: 4
TEAM FOULS: 5 [Team_018 in BONUS]

================================================================================

================================================================================
                       2ND QUARTER - Team_018 vs Team_096                       
================================================================================

[12:00] Team_018 possession (Score: 18-24)
Allen Markkanen attempts a Midrange. Contested by Cole Griffin (3.7 feet, ZONE). Allen Markkanen misses. Rebound secured by Cole Griffin.

[11:44] Team_096 possession (Score: 18-24)
Lamelo Quickley attempts a 3Pt. Contested by Klay Stewart (3.7 feet, ZONE). Lamelo Quickley misses. Offensive rebound by Scottie Herro! Scottie Herro kicks it out.

[11:28] Team_096 possession (Score: 18-24)
Scottie Herro attempts a 3Pt. Contested by Bones Anunoby (3.6 feet, MAN). SCOTTIE HERRO MAKES IT! Assist: Terry Mobley
Score: 18-27

[11:13] Team_018 possession (Score: 18-27)
Bones Anunoby drives and kicks out. Tracy Bryant attempts a 3Pt. Contested by Cole Griffin (3.4 feet, ZONE). Tracy Bryant misses. Rebound secured by Scottie Herro.

[11:00] Team_096 possession (Score: 18-27)
Kyrie Adebayo attempts a Midrange. Contested by Allen Markkanen (4.8 feet, ZONE). KYRIE ADEBAYO MAKES IT! Assist: Scottie Herro
Score: 18-29

[10:46] Team_018 possession (Score: 18-29)
Bones Anunoby attempts a 3Pt. Contested by Cole Griffin (3.7 feet, ZONE). Bones Anunoby misses. Rebound secured by Kyrie Adebayo.

[10:35] Team_096 possession (Score: 18-29)
Kyrie Adebayo drives, picks up Domantas Wall. Help arrives from Klay Stewart! Kyrie Adebayo attempts a Layup. Contested by Klay Stewart (4.1 feet, MAN). KYRIE ADEBAYO MAKES IT! Assist: Cole Griffin
Score: 18-31

[10:22] Team_018 possession (Score: 18-31)
Tracy Bryant attempts a 3Pt. Contested by Lamelo Quickley (4.5 feet, MAN). TRACY BRYANT MAKES IT! Assist: Allen Markkanen
Score: 21-31

[10:13] Team_096 possession (Score: 21-31)
Lamelo Quickley drives to the basket... FOUL! Offensive foul on Lamelo Quickley! Tracy Bryant drew the charge! [Team fouls: 1] (Lamelo Quickley: 1 personal fouls) TURNOVER! (dead ball)

[10:01] Team_018 possession (Score: 21-31)
Bones Anunoby attempts a 3Pt. Contested by Scottie Herro (5.5 feet, ZONE). Bones Anunoby misses. Rebound secured by Kyrie Adebayo.

[09:45] Team_096 possession (Score: 21-31)
Scottie Herro drives, picks up Bones Anunoby. Help arrives from Klay Stewart! Scottie Herro attempts a Layup. Contested by Klay Stewart (3.8 feet, MAN). Scottie Herro misses. Rebound secured by Allen Markkanen.

[09:34] Team_018 possession (Score: 21-31)
Klay Stewart attempts a 3Pt. Contested by Terry Mobley (5.0 feet, MAN). Klay Stewart misses. Rebound secured by Cole Griffin.

[09:21] Team_096 possession (Score: 21-31)
Kyrie Adebayo makes the Midrange and draws the foul on Domantas Wall! And-1! Kyrie Adebayo to the line for 1. [Team fouls: 1] (Domantas Wall: 1 personal fouls)   FT 1/1: GOOD Kyrie Adebayo makes 1/1 from the line.
Score: 21-34

[09:08] Team_018 possession (Score: 21-34)
FOUL! Holding foul on Lamelo Quickley. [Team fouls: 2] No free throws, side out. (Lamelo Quickley: 2 personal fouls)

[08:58] Team_018 possession (Score: 21-34)
Bones Anunoby attempts a 3Pt. Contested by Scottie Herro (5.6 feet, MAN). Bones Anunoby misses. Rebound secured by Scottie Herro.

[08:40] Team_096 possession (Score: 21-34)
FOUL! Holding foul on Bones Anunoby. [Team fouls: 2] No free throws, side out. (Bones Anunoby: 1 personal fouls)

[08:27] Team_096 possession (Score: 21-34)
Terry Mobley drives and kicks out. Scottie Herro attempts a 3Pt. Contested by Klay Stewart (4.5 feet, ZONE). Scottie Herro misses. Rebound secured by Domantas Wall.

[08:12] Team_018 possession (Score: 21-34)
Domantas Wall attempts a Midrange. Contested by Cole Griffin (4.0 feet, ZONE). DOMANTAS WALL MAKES IT!
Score: 23-34

[07:52] Team_096 possession (Score: 23-34)
Lamelo Quickley attempts a 3Pt. Contested by Klay Stewart (4.1 feet, ZONE). Lamelo Quickley misses. Rebound secured by Allen Markkanen.

[07:37] Team_018 possession (Score: 23-34)
Allen Markkanen attempts a Midrange. Contested by Lamelo Quickley (4.7 feet, ZONE). ALLEN MARKKANEN MAKES IT!
Score: 25-34

[07:18] Team_096 possession (Score: 25-34)
FOUL! Offensive foul on Cole Griffin! Allen Markkanen drew the charge! [Team fouls: 3] (Cole Griffin: 1 personal fouls) TURNOVER! (dead ball)

[07:07] Team_018 possession (Score: 25-34)
Bones Anunoby attempts a 3Pt. Contested by Scottie Herro (5.8 feet, MAN). Bones Anunoby misses. Rebound secured by Scottie Herro.

[06:54] Team_096 possession (Score: 25-34)
FOUL! Reach-in foul on Domantas Wall during the drive. [Team fouls: 3] No free throws, side out. (Domantas Wall: 2 personal fouls)

[06:37] Team_096 possession (Score: 25-34)
Lamelo Quickley makes the Layup and draws the foul on Tracy Bryant! And-1! Lamelo Quickley to the line for 1. [Team fouls: 4] (Tracy Bryant: 1 personal fouls)   FT 1/1: GOOD Lamelo Quickley makes 1/1 from the line.
Score: 25-37

[06:22] Team_018 possession (Score: 25-37)
Bones Anunoby attempts a Layup. Contested by Kyrie Adebayo (4.8 feet, ZONE). BONES ANUNOBY MAKES IT! Assist: Domantas Wall
Score: 27-37

[06:06] Team_096 possession (Score: 27-37)
FOUL! Holding foul on Domantas Wall. [IN THE BONUS! 5 team fouls] Kyrie Adebayo to the line for 2 free throws. (Domantas Wall: 3 personal fouls)   FT 1/2: MISS   FT 2/2: GOOD Kyrie Adebayo makes 1/2 from the line.
Score: 27-38

[05:49] Team_018 possession (Score: 27-38)
Tracy Bryant attempts a 3Pt. Contested by Lamelo Quickley (5.0 feet, MAN). Tracy Bryant misses. Rebound secured by Scottie Herro.

[05:32] Team_096 possession (Score: 27-38)
Lamelo Quickley loses control! Ball rolls out of bounds! TURNOVER! (dead ball)

[05:32] Substitution (Team_018): Klay Stewart OUT → Michael Simons IN (stamina_rule2)

[05:32] Substitution (Team_018): Tracy Bryant OUT → Miles Herro IN (stamina_rule2)

[05:32] Substitution (Team_018): Allen Markkanen OUT → Austin Antetokounmpo IN (stamina_rule2)

[05:32] Substitution (Team_018): Bones Anunoby OUT → Shai Wade IN (stamina_rule2)

[05:32] Substitution (Team_018): Domantas Wall OUT → Julius Jackson IN (stamina_rule2)

[05:32] Substitution (Team_096): Terry Mobley OUT → Cade Jokic IN (stamina_rule2)

[05:32] Substitution (Team_096): Lamelo Quickley OUT → Jarrett Markkanen IN (stamina_rule2)

[05:32] Substitution (Team_096): Cole Griffin OUT → Cole Holiday IN (stamina_rule2)

[05:32] Substitution (Team_096): Scottie Herro OUT → Tyler Haliburton IN (stamina_rule2)

[05:32] Substitution (Team_096): Kyrie Adebayo OUT → Devin Griffin IN (stamina_rule2)

[05:21] Team_018 possession (Score: 27-38)
FOUL! Holding foul on Cade Jokic. [Team fouls: 4] No free throws, side out. (Cade Jokic: 1 personal fouls)

[05:07] Team_018 possession (Score: 27-38)
Michael Simons attempts a Midrange. Contested by Jarrett Markkanen (4.5 feet, ZONE). Michael Simons misses. Rebound secured by Jarrett Markkanen.

[04:48] Team_096 possession (Score: 27-38)
Devin Griffin attempts a Layup. Contested by Julius Jackson (4.8 feet, ZONE). DEVIN GRIFFIN MAKES IT! Assist: Cole Holiday
Score: 27-40

[04:33] Team_018 possession (Score: 27-40)
FOUL! Reach-in foul on Tyler Haliburton during the drive. [IN THE BONUS! 5 team fouls] Shai Wade to the line for 2 free throws. (Tyler Haliburton: 1 personal fouls)   FT 1/2: GOOD   FT 2/2: MISS Shai Wade makes 1/2 from the line. Offensive rebound by Shai Wade! Shai Wade kicks it out.
Score: 28-40

[04:18] Team_018 possession (Score: 28-40)
Michael Simons drives, picks up Devin Griffin. Help arrives from Jarrett Markkanen! Michael Simons attempts a Dunk. Contested by Jarrett Markkanen (5.0 feet, ZONE). MICHAEL SIMONS MAKES IT! Assist: Shai Wade
Score: 30-40

[04:03] Team_096 possession (Score: 30-40)
Tyler Haliburton drives, Julius Jackson stays with him. Tyler Haliburton attempts a Dunk. Contested by Julius Jackson (4.7 feet, ZONE). TYLER HALIBURTON MAKES IT!
Score: 30-42

[03:49] Team_018 possession (Score: 30-42)
Shai Wade attempts a 3Pt. Contested by Cade Jokic (4.9 feet, ZONE). Shai Wade misses. Rebound secured by Tyler Haliburton.

[03:31] Team_096 possession (Score: 30-42)
Jarrett Markkanen attempts a Midrange. Contested by Miles Herro (5.1 feet, MAN). JARRETT MARKKANEN MAKES IT!
Score: 30-44

[03:16] Team_018 possession (Score: 30-44)
Miles Herro attempts a 3Pt. Contested by Jarrett Markkanen (4.5 feet, MAN). Miles Herro misses. Rebound secured by Devin Griffin.

[03:01] Team_096 possession (Score: 30-44)
Cole Holiday attempts a Layup. Contested by Julius Jackson (5.0 feet, ZONE). COLE HOLIDAY MAKES IT! Assist: Devin Griffin
Score: 30-46

[02:45] Team_018 possession (Score: 30-46)
Julius Jackson attempts a Midrange. Contested by Devin Griffin (5.1 feet, MAN). Julius Jackson misses. Rebound secured by Devin Griffin.

[02:32] Team_096 possession (Score: 30-46)
Cole Holiday attempts a Layup. Contested by Julius Jackson (5.0 feet, ZONE). COLE HOLIDAY MAKES IT!
Score: 30-48

[02:18] Team_018 possession (Score: 30-48)
Austin Antetokounmpo throws a bad pass out of bounds! TURNOVER! (dead ball)

[02:03] Team_096 possession (Score: 30-48)
FOUL! Holding foul on Miles Herro. [IN THE BONUS! 6 team fouls] Jarrett Markkanen to the line for 2 free throws. (Miles Herro: 1 personal fouls)   FT 1/2: GOOD   FT 2/2: GOOD Jarrett Markkanen makes 2/2 from the line.
Score: 30-50

[01:49] Team_018 possession (Score: 30-50)
Austin Antetokounmpo attempts a 3Pt. Contested by Cole Holiday (4.0 feet, MAN). Austin Antetokounmpo misses. Rebound secured by Devin Griffin.

[01:40] Team_096 possession (Score: 30-50)
Jarrett Markkanen attempts a 3Pt. Contested by Miles Herro (5.1 feet, MAN). Jarrett Markkanen misses. Rebound secured by Austin Antetokounmpo.

[01:26] Team_018 possession (Score: 30-50)
Austin Antetokounmpo attempts a 3Pt. Contested by Cole Holiday (4.0 feet, MAN). AUSTIN ANTETOKOUNMPO MAKES IT! Assist: Shai Wade
Score: 33-50

[01:15] Team_096 possession (Score: 33-50)
FOUL! Shooting foul on Michael Simons. Jarrett Markkanen to the line for 3 free throws. [BONUS: 7 team fouls] (Michael Simons: 1 personal fouls)   FT 1/3: GOOD   FT 2/3: GOOD   FT 3/3: GOOD Jarrett Markkanen makes 3/3 from the line.
Score: 33-53

[01:01] Team_018 possession (Score: 33-53)
Austin Antetokounmpo attempts a Layup. Contested by Cole Holiday (4.0 feet, MAN). Austin Antetokounmpo misses. Rebound secured by Tyler Haliburton.

[00:45] Team_096 possession (Score: 33-53)
Cade Jokic attempts a 3Pt. Contested by Michael Simons (5.5 feet, MAN). Cade Jokic misses. Offensive rebound by Tyler Haliburton! Tyler Haliburton kicks it out.

[00:34] Team_096 possession (Score: 33-53)
Tyler Haliburton drives and kicks out. Jarrett Markkanen attempts a 3Pt. Contested by Miles Herro (5.5 feet, MAN). JARRETT MARKKANEN MAKES IT! Assist: Cade Jokic
Score: 33-56

[00:21] Team_018 possession (Score: 33-56)
Miles Herro drives to the basket... Miles Herro commits a violation (traveling/carry)! TURNOVER! (dead ball)

[00:11] Team_096 possession (Score: 33-56)
Tyler Haliburton attempts a 3Pt. Contested by Austin Antetokounmpo (5.3 feet, ZONE). Tyler Haliburton misses. Rebound secured by Julius Jackson.

================================================================================
                              2ND QUARTER COMPLETE                              
================================================================================

2ND QUARTER SCORE: Team_018 15, Team_096 32

BOX SCORE:
================================================================================

Team_018
--------------------------------------------------------------------------------
Player                MIN  PTS  REB  AST  TO      FG   FG%      3P   3P%
--------------------------------------------------------------------------------
Tracy Bryant           17    3    0    0   0   1/2    50.0     0/0   0.0
Austin Antetokounmpo    5    3    1    0   0   1/3    33.3     0/0   0.0
Allen Markkanen        19    2    2    1   0   1/2    50.0     0/0   0.0
Bones Anunoby          17    2    0    0   0   1/6    16.7     0/0   0.0
Domantas Wall          15    2    1    1   0   1/1   100.0     0/0   0.0
Michael Simons          7    2    0    0   0   1/2    50.0     0/0   0.0
Klay Stewart           17    0    0    0   0   0/1     0.0     0/0   0.0
Shai Wade               7    0    1    2   0   0/1     0.0     0/0   0.0
Miles Herro             7    0    0    0   0   0/1     0.0     0/0   0.0
Julius Jackson          9    0    1    0   0   0/1     0.0     0/0   0.0

TEAM: FG: 6/20 (30.0%), 3PT: 2/11 (18.2%), REB: 6 (1 off, 5 def), AST: 4, TO: 2
TEAM FOULS: 7 [Team_096 in BONUS]


Team_096
--------------------------------------------------------------------------------
Player                MIN  PTS  REB  AST  TO      FG   FG%      3P   3P%
--------------------------------------------------------------------------------
Jarrett Markkanen       7   10    1    0   0   4/5    80.0     0/0   0.0
Kyrie Adebayo          17    8    2    0   0   4/4   100.0     0/0   0.0
Cole Holiday            7    4    0    1   0   2/2   100.0     0/0   0.0
Scottie Herro          17    3    5    1   0   1/2    50.0     0/0   0.0
Lamelo Quickley        17    3    0    0   0   1/2    50.0     0/0   0.0
Devin Griffin           7    2    3    1   0   1/1   100.0     0/0   0.0
Tyler Haliburton        7    2    3    0   0   1/2    50.0     0/0   0.0
Cole Griffin           17    0    2    1   0   0/0     0.0     0/0   0.0
Terry Mobley           17    0    0    1   0   0/1     0.0     0/0   0.0
Cade Jokic              7    0    0    1   0   0/0     0.0     0/0   0.0

TEAM: FG: 14/19 (73.7%), 3PT: 2/5 (40.0%), REB: 16 (2 off, 14 def), AST: 6, TO: 3
TEAM FOULS: 5 [Team_018 in BONUS]

================================================================================

================================================================================
                       3RD QUARTER - Team_018 vs Team_096                       
================================================================================

[12:00] Team_018 possession (Score: 33-56)
Klay Stewart loses control! Ball rolls out of bounds! TURNOVER! (dead ball)

[11:47] Team_096 possession (Score: 33-56)
FOUL! Reach-in foul on Domantas Wall during the drive. [Team fouls: 1] No free throws, side out. (Domantas Wall: 1 personal fouls)

[11:33] Team_096 possession (Score: 33-56)
Cole Griffin makes the Dunk and draws the foul on Klay Stewart! And-1! Cole Griffin to the line for 1. [Team fouls: 2] (Klay Stewart: 1 personal fouls)   FT 1/1: GOOD Cole Griffin makes 1/1 from the line.
Score: 33-59

[11:17] Team_018 possession (Score: 33-59)
Tracy Bryant attempts a 3Pt. Contested by Cole Griffin (3.7 feet, ZONE). Tracy Bryant misses. FOUL! Loose ball foul on Cole Griffin during the rebound battle. [Team fouls: 1] No free throws, side out. (Cole Griffin: 1 personal fouls)

[11:02] Team_018 possession (Score: 33-59)
FOUL! Shooting foul on Kyrie Adebayo. Domantas Wall to the line for 2 free throws. [Team fouls: 2] (Kyrie Adebayo: 1 personal fouls)   FT 1/2: MISS   FT 2/2: GOOD Domantas Wall makes 1/2 from the line.
Score: 34-59

[10:47] Team_096 possession (Score: 34-59)
FOUL! Shooting foul on Domantas Wall. Terry Mobley to the line for 2 free throws. [Team fouls: 3] (Domantas Wall: 2 personal fouls)   FT 1/2: MISS   FT 2/2: MISS Terry Mobley makes 0/2 from the line. Rebound secured by Allen Markkanen.

[10:31] Team_018 possession (Score: 34-59)
Allen Markkanen makes the Layup and draws the foul on Kyrie Adebayo! And-1! Allen Markkanen to the line for 1. [Team fouls: 3] (Kyrie Adebayo: 2 personal fouls)   FT 1/1: GOOD Allen Markkanen makes 1/1 from the line.
Score: 37-59

[10:14] Team_096 possession (Score: 37-59)
FOUL! Reach-in foul on Domantas Wall during the drive. [Team fouls: 4] No free throws, side out. (Domantas Wall: 3 personal fouls)

[10:00] Team_096 possession (Score: 37-59)
Lamelo Quickley attempts a 3Pt. Contested by Klay Stewart (3.6 feet, ZONE). Lamelo Quickley misses. Rebound secured by Bones Anunoby.

[09:44] Team_018 possession (Score: 37-59)
Tracy Bryant attempts a Midrange. Contested by Scottie Herro (5.3 feet, ZONE). TRACY BRYANT MAKES IT!
Score: 39-59

[09:30] Team_096 possession (Score: 39-59)
FOUL! Reach-in foul on Domantas Wall during the drive. [IN THE BONUS! 5 team fouls] Kyrie Adebayo to the line for 2 free throws. (Domantas Wall: 4 personal fouls)   FT 1/2: GOOD   FT 2/2: GOOD Kyrie Adebayo makes 2/2 from the line.
Score: 39-61

[09:17] Team_018 possession (Score: 39-61)
Klay Stewart drives and kicks out. Klay Stewart attempts a Midrange. Contested by Cole Griffin (3.3 feet, ZONE). Klay Stewart misses. Rebound secured by Cole Griffin.

[09:07] Team_096 possession (Score: 39-61)
Lamelo Quickley drives and kicks out. Terry Mobley attempts a 3Pt. Contested by Klay Stewart (4.1 feet, ZONE). TERRY MOBLEY MAKES IT! Assist: Lamelo Quickley
Score: 39-64

[08:55] Team_018 possession (Score: 39-64)
Bones Anunoby attempts a 3Pt. Contested by Scottie Herro (5.3 feet, MAN). Bones Anunoby misses. Rebound secured by Kyrie Adebayo.

[08:41] Team_096 possession (Score: 39-64)
Cole Griffin attempts a 3Pt. Contested by Klay Stewart (4.4 feet, ZONE). Cole Griffin misses. FOUL! Loose ball foul on Bones Anunoby during the rebound battle. [IN THE BONUS! 6 team fouls] Scottie Herro to the line for 2 free throws. (Bones Anunoby: 1 personal fouls)   FT 1/2: MISS   FT 2/2: GOOD Scottie Herro makes 1/2 from the line.
Score: 39-65

[08:23] Team_018 possession (Score: 39-65)
Bones Anunoby drives and kicks out. Allen Markkanen attempts a 3Pt. Contested by Terry Mobley (4.5 feet, ZONE). Allen Markkanen misses. Offensive rebound by Bones Anunoby! Bones Anunoby kicks it out.

[08:08] Team_018 possession (Score: 39-65)
Bones Anunoby drives, Kyrie Adebayo stays with him. Bones Anunoby attempts a Layup. Contested by Kyrie Adebayo (4.3 feet, ZONE). BONES ANUNOBY MAKES IT! Assist: Tracy Bryant
Score: 41-65

[07:53] Team_096 possession (Score: 41-65)
Terry Mobley attempts a 3Pt. Contested by Klay Stewart (4.2 feet, MAN). TERRY MOBLEY MAKES IT! Assist: Scottie Herro
Score: 41-68

[07:39] Team_018 possession (Score: 41-68)
Allen Markkanen attempts a Dunk. BLOCKED BY KYRIE ADEBAYO! Ball deflects out of bounds off Allen Markkanen.

[07:25] Team_096 possession (Score: 41-68)
Terry Mobley drives and kicks out. Terry Mobley attempts a 3Pt. Contested by Klay Stewart (4.1 feet, MAN). Terry Mobley misses. Offensive rebound by Scottie Herro! Scottie Herro kicks it out.

[07:13] Team_096 possession (Score: 41-68)
Scottie Herro attempts a 3Pt. Contested by Bones Anunoby (3.4 feet, MAN). Scottie Herro misses. Rebound secured by Bones Anunoby.

[07:02] Team_018 possession (Score: 41-68)
Tracy Bryant drives, picks up Lamelo Quickley. Help arrives from Cole Griffin! Tracy Bryant attempts a Layup. Contested by Cole Griffin (4.3 feet, MAN). TRACY BRYANT MAKES IT!
Score: 43-68

[06:43] Team_096 possession (Score: 43-68)
Terry Mobley drives, picks up Domantas Wall. Help arrives from Klay Stewart! Terry Mobley attempts a Dunk. Contested by Klay Stewart (3.6 feet, ZONE). Terry Mobley misses. Rebound secured by Allen Markkanen.

[06:28] Team_018 possession (Score: 43-68)
FOUL! Shooting foul on Cole Griffin. Allen Markkanen to the line for 2 free throws. [Team fouls: 4] (Cole Griffin: 2 personal fouls)   FT 1/2: GOOD   FT 2/2: GOOD Allen Markkanen makes 2/2 from the line.
Score: 45-68

[06:13] Team_096 possession (Score: 45-68)
Kyrie Adebayo attempts a Midrange. Contested by Domantas Wall (4.1 feet, MAN). KYRIE ADEBAYO MAKES IT!
Score: 45-70

[05:53] Team_018 possession (Score: 45-70)
FOUL! Holding foul on Scottie Herro. [IN THE BONUS! 5 team fouls] Bones Anunoby to the line for 2 free throws. (Scottie Herro: 1 personal fouls)   FT 1/2: GOOD   FT 2/2: GOOD Bones Anunoby makes 2/2 from the line.
Score: 47-70

[05:37] Team_096 possession (Score: 47-70)
Cole Griffin attempts a 3Pt. Contested by Allen Markkanen (4.1 feet, MAN). Cole Griffin misses. Rebound secured by Bones Anunoby.

[05:20] Team_018 possession (Score: 47-70)
Bones Anunoby drives and kicks out. Bones Anunoby attempts a 3Pt. Contested by Scottie Herro (5.0 feet, MAN). Bones Anunoby misses. FOUL! Loose ball foul on Kyrie Adebayo during the rebound battle. [IN THE BONUS! 6 team fouls] Bones Anunoby to the line for 2 free throws. (Kyrie Adebayo: 3 personal fouls)   FT 1/2: GOOD   FT 2/2: GOOD Bones Anunoby makes 2/2 from the line.
Score: 49-70

[05:08] Team_096 possession (Score: 49-70)
Cole Griffin drives, Allen Markkanen stays with him. Cole Griffin attempts a Layup. Contested by Allen Markkanen (4.1 feet, MAN). COLE GRIFFIN MAKES IT!
Score: 49-72

[04:50] Team_018 possession (Score: 49-72)
Tracy Bryant attempts a Layup. Contested by Kyrie Adebayo (4.3 feet, ZONE). TRACY BRYANT MAKES IT! Assist: Klay Stewart
Score: 51-72

[04:36] Team_096 possession (Score: 51-72)
Scottie Herro attempts a 3Pt. Contested by Bones Anunoby (3.5 feet, ZONE). Scottie Herro misses. Offensive rebound by Kyrie Adebayo! Kyrie Adebayo's putback is no good. Rebound secured by Bones Anunoby.

[04:23] Team_018 possession (Score: 51-72)
FOUL! Reach-in foul on Kyrie Adebayo during the drive. [IN THE BONUS! 7 team fouls] Domantas Wall to the line for 2 free throws. (Kyrie Adebayo: 4 personal fouls)   FT 1/2: MISS   FT 2/2: GOOD Domantas Wall makes 1/2 from the line.
Score: 52-72

[04:08] Team_096 possession (Score: 52-72)
Kyrie Adebayo attempts a Layup. Contested by Domantas Wall (4.2 feet, MAN). Kyrie Adebayo misses. Rebound secured by Allen Markkanen.

[03:50] Team_018 possession (Score: 52-72)
Domantas Wall attempts a Midrange. Contested by Kyrie Adebayo (4.3 feet, MAN). Domantas Wall misses. Rebound secured by Scottie Herro.

[03:38] Team_096 possession (Score: 52-72)
Scottie Herro attempts a Midrange. Contested by Bones Anunoby (3.6 feet, MAN). Scottie Herro misses. Rebound secured by Allen Markkanen.

[03:24] Team_018 possession (Score: 52-72)
FOUL! Reach-in foul on Kyrie Adebayo during the drive. [IN THE BONUS! 8 team fouls] Domantas Wall to the line for 2 free throws. (Kyrie Adebayo: 5 personal fouls)   FT 1/2: MISS   FT 2/2: MISS Domantas Wall makes 0/2 from the line. Rebound secured by Kyrie Adebayo.

[03:09] Team_096 possession (Score: 52-72)
Kyrie Adebayo makes the Midrange and draws the foul on Domantas Wall! And-1! Kyrie Adebayo to the line for 1. [BONUS: 7 team fouls] (Domantas Wall: 5 personal fouls)   FT 1/1: GOOD Kyrie Adebayo makes 1/1 from the line.
Score: 52-75

[02:57] Team_018 possession (Score: 52-75)
Domantas Wall attempts a Layup. Contested by Kyrie Adebayo (4.3 feet, MAN). DOMANTAS WALL MAKES IT! Assist: Bones Anunoby
Score: 54-75

[02:41] Team_096 possession (Score: 54-75)
Terry Mobley attempts a 3Pt. Contested by Klay Stewart (4.4 feet, ZONE). Terry Mobley misses. Offensive rebound by Kyrie Adebayo! Kyrie Adebayo puts it back in!
Score: 54-77

[02:25] Team_018 possession (Score: 54-77)
FOUL! Reach-in foul on Kyrie Adebayo during the drive. [IN THE BONUS! 9 team fouls] Bones Anunoby to the line for 2 free throws. (Kyrie Adebayo: 6 personal fouls) Kyrie Adebayo FOULS OUT!   FT 1/2: MISS   FT 2/2: GOOD Bones Anunoby makes 1/2 from the line.
Score: 55-77

[02:25] Substitution (Team_096): Kyrie Adebayo OUT (stamina: 73) → Cade Jokic IN (foul_out)

[02:10] Team_096 possession (Score: 55-77)
Cade Jokic attempts a Midrange. Contested by Tracy Bryant (3.7 feet, ZONE). Cade Jokic misses. Rebound secured by Domantas Wall.

[01:56] Team_018 possession (Score: 55-77)
Allen Markkanen attempts a Midrange. Contested by Cole Griffin (3.9 feet, ZONE). Allen Markkanen misses. Offensive rebound by Domantas Wall! Domantas Wall puts it back in!
Score: 57-77

[01:42] Team_096 possession (Score: 57-77)
Cole Griffin makes the Dunk and draws the foul on Klay Stewart! And-1! Cole Griffin to the line for 1. [BONUS: 8 team fouls] (Klay Stewart: 2 personal fouls)   FT 1/1: GOOD Cole Griffin makes 1/1 from the line.
Score: 57-80

[01:27] Team_018 possession (Score: 57-80)
Domantas Wall drives and kicks out. Bones Anunoby attempts a 3Pt. Contested by Scottie Herro (5.3 feet, MAN). Bones Anunoby misses. Rebound secured by Lamelo Quickley.

[01:10] Team_096 possession (Score: 57-80)
Scottie Herro drives to the basket... Scottie Herro loses the ball! Stripped by Bones Anunoby! TURNOVER! (live ball)

[00:53] Team_018 possession (Score: 57-80)
Allen Markkanen attempts a Midrange. Contested by Scottie Herro (5.7 feet, ZONE). Allen Markkanen misses. Rebound secured by Lamelo Quickley.

[00:38] Team_096 possession (Score: 57-80)
Scottie Herro loses the ball! Stripped by Bones Anunoby! TURNOVER! (live ball)

[00:22] Team_018 possession (Score: 57-80)
Domantas Wall drives, picks up Scottie Herro. Help arrives from Lamelo Quickley! Domantas Wall attempts a Dunk. Contested by Lamelo Quickley (5.6 feet, ZONE). DOMANTAS WALL MAKES IT! Assist: Klay Stewart
Score: 59-80

[00:08] Team_096 possession (Score: 59-80)
FOUL! Shooting foul on Bones Anunoby. Scottie Herro to the line for 3 free throws. [BONUS: 9 team fouls] (Bones Anunoby: 2 personal fouls)   FT 1/3: MISS   FT 2/3: GOOD   FT 3/3: GOOD Scottie Herro makes 2/3 from the line.
Score: 59-82

================================================================================
                              3RD QUARTER COMPLETE                              
================================================================================

3RD QUARTER SCORE: Team_018 26, Team_096 26

BOX SCORE:
================================================================================

Team_018
--------------------------------------------------------------------------------
Player                MIN  PTS  REB  AST  TO      FG   FG%      3P   3P%
--------------------------------------------------------------------------------
Domantas Wall          27    8    2    0   0   5/8    62.5     0/0   0.0
Bones Anunoby          29    7    6    1   0   4/5    80.0     0/0   0.0
Tracy Bryant           29    6    0    1   0   3/3   100.0     0/0   0.0
Allen Markkanen        31    5    4    0   0   2/4    50.0     0/0   0.0
Klay Stewart           29    0    0    2   0   0/1     0.0     0/0   0.0

TEAM: FG: 14/21 (66.7%), 3PT: 0/1 (0.0%), REB: 11 (3 off, 8 def), AST: 4, TO: 1
TEAM FOULS: 9 [Team_096 in BONUS]


Team_096
--------------------------------------------------------------------------------
Player                MIN  PTS  REB  AST  TO      FG   FG%      3P   3P%
--------------------------------------------------------------------------------
Kyrie Adebayo          27    9    3    0   0   4/5    80.0     0/0   0.0
Cole Griffin           29    8    1    0   0   3/4    75.0     0/0   0.0
Terry Mobley           29    6    0    0   0   2/4    50.0     0/0   0.0
Scottie Herro          29    3    2    1   0   2/5    40.0     0/0   0.0
Lamelo Quickley        29    0    2    1   0   0/1     0.0     0/0   0.0
Cade Jokic             10    0    0    0   0   0/1     0.0     0/0   0.0

TEAM: FG: 11/20 (55.0%), 3PT: 4/8 (50.0%), REB: 9 (3 off, 6 def), AST: 2, TO: 2
TEAM FOULS: 9 [Team_018 in BONUS]

================================================================================

================================================================================
                       4TH QUARTER - Team_018 vs Team_096                       
================================================================================

[12:00] Substitution (Team_018): Klay Stewart OUT (stamina: 71) → Michael Simons IN (comeback_detected)

[12:00] Substitution (Team_096): Terry Mobley OUT (stamina: 70) → Cade Jokic IN (comeback_detected)

[12:00] Team_018 possession (Score: 59-82)
Tracy Bryant attempts a Midrange. Contested by Cole Griffin (3.9 feet, ZONE). Tracy Bryant misses. Rebound secured by Cole Griffin.

[11:45] Team_096 possession (Score: 59-82)
Lamelo Quickley attempts a Midrange. Contested by Tracy Bryant (3.2 feet, MAN). Lamelo Quickley misses. Rebound secured by Bones Anunoby.

[11:34] Team_018 possession (Score: 59-82)
Domantas Wall attempts a Midrange. Contested by Lamelo Quickley (4.5 feet, ZONE). DOMANTAS WALL MAKES IT! Assist: Tracy Bryant
Score: 61-82

[11:23] Team_096 possession (Score: 61-82)
Cade Jokic loses control! Ball rolls out of bounds! TURNOVER! (dead ball)

[11:23] Substitution (Team_018): Tracy Bryant OUT → Miles Herro IN (stamina_rule2)

[11:23] Substitution (Team_018): Bones Anunoby OUT → Shai Wade IN (stamina_rule2)

[11:23] Substitution (Team_018): Domantas Wall OUT → Julius Jackson IN (stamina_rule2)

[11:23] Substitution (Team_096): Lamelo Quickley OUT → Jarrett Markkanen IN (stamina_rule2)

[11:23] Substitution (Team_096): Cole Griffin OUT → Cole Holiday IN (stamina_rule2)

[11:23] Substitution (Team_096): Scottie Herro OUT → Tyler Haliburton IN (stamina_rule2)

[11:12] Team_018 possession (Score: 61-82)
Shai Wade drives and kicks out. Michael Simons attempts a Midrange. Contested by Cade Jokic (5.3 feet, MAN). Michael Simons misses. Rebound secured by Jarrett Markkanen.

[11:00] Team_096 possession (Score: 61-82)
Tyler Haliburton attempts a Layup. Contested by Shai Wade (4.9 feet, MAN). Tyler Haliburton misses. Rebound secured by Shai Wade.

[10:46] Team_018 possession (Score: 61-82)
Shai Wade attempts a 3Pt. Contested by Tyler Haliburton (4.6 feet, MAN). Shai Wade misses. Rebound secured by Tyler Haliburton.

[10:29] Team_096 possession (Score: 61-82)
Kyrie Adebayo attempts a Midrange. Contested by Allen Markkanen (4.8 feet, ZONE). Kyrie Adebayo misses. Offensive rebound by Tyler Haliburton! Tyler Haliburton kicks it out.

[10:10] Team_096 possession (Score: 61-82)
Jarrett Markkanen attempts a 3Pt. Contested by Miles Herro (5.1 feet, MAN). JARRETT MARKKANEN MAKES IT! Assist: Tyler Haliburton
Score: 61-85

[09:56] Team_018 possession (Score: 61-85)
Michael Simons drives to the basket... FOUL! Offensive foul on Michael Simons! Kyrie Adebayo drew the charge! [Team fouls: 1] (Michael Simons: 1 personal fouls) TURNOVER! (dead ball)

[09:39] Team_096 possession (Score: 61-85)
Kyrie Adebayo drives and kicks out. Cade Jokic attempts a 3Pt. Contested by Allen Markkanen (4.3 feet, ZONE). CADE JOKIC MAKES IT! Assist: Cole Holiday
Score: 61-88

[09:22] Team_018 possession (Score: 61-88)
Shai Wade makes the Layup and draws the foul on Jarrett Markkanen! And-1! Shai Wade to the line for 1. [Team fouls: 1] (Jarrett Markkanen: 1 personal fouls)   FT 1/1: GOOD Shai Wade makes 1/1 from the line.
Score: 64-88

[09:05] Team_096 possession (Score: 64-88)
Cade Jokic attempts a Midrange. Contested by Michael Simons (5.5 feet, ZONE). Cade Jokic misses. Rebound secured by Allen Markkanen.

[08:50] Team_018 possession (Score: 64-88)
FOUL! Shooting foul on Cade Jokic. Michael Simons to the line for 2 free throws. [Team fouls: 2] (Cade Jokic: 1 personal fouls)   FT 1/2: GOOD   FT 2/2: GOOD Michael Simons makes 2/2 from the line.
Score: 66-88

[08:38] Team_096 possession (Score: 66-88)
Cole Holiday throws a bad pass out of bounds! TURNOVER! (dead ball)

[08:38] Substitution (Team_018): Allen Markkanen OUT → Austin Antetokounmpo IN (stamina_rule2)

[08:24] Team_018 possession (Score: 66-88)
Julius Jackson attempts a Midrange. Contested by Kyrie Adebayo (4.7 feet, MAN). Julius Jackson misses. Rebound secured by Jarrett Markkanen.

[08:14] Team_096 possession (Score: 66-88)
Cade Jokic attempts a 3Pt. Contested by Michael Simons (5.5 feet, MAN). Cade Jokic misses. FOUL! Loose ball foul on Shai Wade during the rebound battle. [Team fouls: 2] No free throws, side out. (Shai Wade: 1 personal fouls)

[08:00] Team_096 possession (Score: 66-88)
Kyrie Adebayo drives, picks up Julius Jackson. Help arrives from Miles Herro! Kyrie Adebayo attempts a Layup. Contested by Miles Herro (5.4 feet, ZONE). KYRIE ADEBAYO MAKES IT! Assist: Tyler Haliburton
Score: 66-90

[07:45] Team_018 possession (Score: 66-90)
Michael Simons attempts a Midrange. Contested by Cade Jokic (5.6 feet, MAN). MICHAEL SIMONS MAKES IT!
Score: 68-90

[07:31] Team_096 possession (Score: 68-90)
Jarrett Markkanen attempts a Midrange. Contested by Shai Wade (4.6 feet, ZONE). Jarrett Markkanen misses. Rebound secured by Shai Wade.

[07:16] Team_018 possession (Score: 68-90)
Miles Herro drives, Kyrie Adebayo stays with him. Miles Herro attempts a Dunk. Contested by Kyrie Adebayo (4.6 feet, ZONE). Miles Herro misses. Rebound secured by Kyrie Adebayo.

[07:02] Team_096 possession (Score: 68-90)
Jarrett Markkanen attempts a Layup. Contested by Julius Jackson (4.4 feet, ZONE). JARRETT MARKKANEN MAKES IT!
Score: 68-92

[06:43] Team_018 possession (Score: 68-92)
Michael Simons drives to the basket... FOUL! Offensive foul on Michael Simons! Kyrie Adebayo drew the charge! [Team fouls: 3] (Michael Simons: 2 personal fouls) TURNOVER! (dead ball)

[06:29] Team_096 possession (Score: 68-92)
Cole Holiday attempts a Layup. Contested by Austin Antetokounmpo (5.6 feet, MAN). COLE HOLIDAY MAKES IT! Assist: Tyler Haliburton
Score: 68-94

[06:18] Team_018 possession (Score: 68-94)
Miles Herro attempts a Midrange. Contested by Jarrett Markkanen (4.5 feet, MAN). MILES HERRO MAKES IT!
Score: 70-94

[06:02] Team_096 possession (Score: 70-94)
Tyler Haliburton drives, picks up Julius Jackson. Help arrives from Miles Herro! Tyler Haliburton attempts a Dunk. Contested by Miles Herro (4.7 feet, ZONE). TYLER HALIBURTON MAKES IT! Assist: Jarrett Markkanen
Score: 70-96

[05:47] Team_018 possession (Score: 70-96)
Miles Herro attempts a Layup. Contested by Jarrett Markkanen (4.5 feet, MAN). Miles Herro misses. FOUL! Loose ball foul on Jarrett Markkanen during the rebound battle. [Team fouls: 3] No free throws, side out. (Jarrett Markkanen: 2 personal fouls)

[05:33] Team_018 possession (Score: 70-96)
Julius Jackson attempts a 3Pt. Contested by Cade Jokic (5.9 feet, ZONE). Julius Jackson misses. Rebound secured by Kyrie Adebayo.

[05:21] Team_096 possession (Score: 70-96)
Cole Holiday attempts a Layup. Contested by Julius Jackson (5.0 feet, ZONE). Cole Holiday misses. Rebound secured by Shai Wade.

[05:07] Team_018 possession (Score: 70-96)
Michael Simons drives to the basket... Michael Simons loses control! Ball rolls out of bounds! TURNOVER! (dead ball)

[05:07] Substitution (Team_096): Kyrie Adebayo OUT → Devin Griffin IN (stamina_rule2)

[04:55] Team_096 possession (Score: 70-96)
FOUL! Shooting foul on Austin Antetokounmpo. Cole Holiday to the line for 3 free throws. [Team fouls: 4] (Austin Antetokounmpo: 1 personal fouls)   FT 1/3: MISS   FT 2/3: GOOD   FT 3/3: GOOD Cole Holiday makes 2/3 from the line.
Score: 70-98

[04:36] Team_018 possession (Score: 70-98)
Austin Antetokounmpo attempts a Layup. Contested by Devin Griffin (4.1 feet, ZONE). AUSTIN ANTETOKOUNMPO MAKES IT!
Score: 72-98

[04:21] Team_096 possession (Score: 72-98)
Jarrett Markkanen attempts a 3Pt. Contested by Miles Herro (5.1 feet, MAN). Jarrett Markkanen misses. Rebound secured by Shai Wade.

[04:07] Team_018 possession (Score: 72-98)
Julius Jackson drives and kicks out. Julius Jackson attempts a 3Pt. Contested by Devin Griffin (4.7 feet, MAN). Julius Jackson misses. Rebound secured by Jarrett Markkanen.

[03:57] Team_096 possession (Score: 72-98)
Cade Jokic attempts a 3Pt. Contested by Michael Simons (5.5 feet, MAN). Cade Jokic misses. Rebound secured by Julius Jackson.

[03:42] Team_018 possession (Score: 72-98)
FOUL! Holding foul on Tyler Haliburton. [Team fouls: 4] No free throws, side out. (Tyler Haliburton: 1 personal fouls)

[03:29] Team_018 possession (Score: 72-98)
Miles Herro attempts a 3Pt. Contested by Jarrett Markkanen (4.6 feet, MAN). Miles Herro misses. Rebound secured by Jarrett Markkanen.

[03:15] Team_096 possession (Score: 72-98)
FOUL! Shooting foul on Austin Antetokounmpo. Jarrett Markkanen to the line for 3 free throws. [BONUS: 5 team fouls] (Austin Antetokounmpo: 2 personal fouls)   FT 1/3: MISS   FT 2/3: GOOD   FT 3/3: GOOD Jarrett Markkanen makes 2/3 from the line.
Score: 72-100

[03:02] Team_018 possession (Score: 72-100)
Austin Antetokounmpo attempts a Midrange. Contested by Cole Holiday (4.2 feet, MAN). AUSTIN ANTETOKOUNMPO MAKES IT!
Score: 74-100

[02:48] Team_096 possession (Score: 74-100)
FOUL! Offensive foul on Jarrett Markkanen! Miles Herro drew the charge! [Team fouls: 5] (Jarrett Markkanen: 3 personal fouls) TURNOVER! (dead ball)

[02:34] Team_018 possession (Score: 74-100)
Michael Simons attempts a 3Pt. Wide open! Cade Jokic is 6.0 feet away. [ZONE] Michael Simons misses. Rebound secured by Devin Griffin.

[02:21] Team_096 possession (Score: 74-100)
Tyler Haliburton attempts a Layup. BLOCKED BY JULIUS JACKSON! Ball is loose! Rebound secured by Austin Antetokounmpo.

[02:01] Team_018 possession (Score: 74-100)
Austin Antetokounmpo attempts a 3Pt. Contested by Cade Jokic (5.3 feet, ZONE). Austin Antetokounmpo misses. Offensive rebound by Julius Jackson! Julius Jackson kicks it out.

[01:44] Team_018 possession (Score: 74-100)
Michael Simons attempts a Midrange. Wide open! Cade Jokic is 6.1 feet away. [MAN] Michael Simons misses. Rebound secured by Tyler Haliburton.

[01:32] Team_096 possession (Score: 74-100)
Cole Holiday attempts a 3Pt. Contested by Michael Simons (5.9 feet, ZONE). Cole Holiday misses. Offensive rebound by Devin Griffin! Devin Griffin kicks it out.

[01:17] Team_096 possession (Score: 74-100)
FOUL! Shooting foul on Shai Wade. Tyler Haliburton to the line for 2 free throws. [BONUS: 6 team fouls] (Shai Wade: 2 personal fouls)   FT 1/2: GOOD   FT 2/2: GOOD Tyler Haliburton makes 2/2 from the line.
Score: 74-102

[01:03] Team_018 possession (Score: 74-102)
Shai Wade makes the Layup and draws the foul on Tyler Haliburton! And-1! Shai Wade to the line for 1. [BONUS: 6 team fouls] (Tyler Haliburton: 2 personal fouls)   FT 1/1: GOOD Shai Wade makes 1/1 from the line.
Score: 77-102

[00:46] Team_096 possession (Score: 77-102)
FOUL! Reach-in foul on Julius Jackson during the drive. [IN THE BONUS! 7 team fouls] Cade Jokic to the line for 2 free throws. (Julius Jackson: 1 personal fouls)   FT 1/2: MISS   FT 2/2: GOOD Cade Jokic makes 1/2 from the line.
Score: 77-103

[00:30] Team_018 possession (Score: 77-103)
Austin Antetokounmpo makes the Dunk and draws the foul on Jarrett Markkanen! And-1! Austin Antetokounmpo to the line for 1. [BONUS: 7 team fouls] (Jarrett Markkanen: 4 personal fouls)   FT 1/1: GOOD Austin Antetokounmpo makes 1/1 from the line.
Score: 80-103

[00:17] Team_096 possession (Score: 80-103)
Devin Griffin attempts a Midrange. Contested by Julius Jackson (5.4 feet, MAN). Devin Griffin misses. Rebound secured by Shai Wade.

[00:05] Team_018 possession (Score: 80-103)
Michael Simons throws a bad pass out of bounds! TURNOVER! (dead ball)

================================================================================
                              4TH QUARTER COMPLETE                              
================================================================================

4TH QUARTER SCORE: Team_018 21, Team_096 21

BOX SCORE:
================================================================================

Team_018
--------------------------------------------------------------------------------
Player                MIN  PTS  REB  AST  TO      FG   FG%      3P   3P%
--------------------------------------------------------------------------------
Austin Antetokounmpo   14    7    1    0   0   3/3   100.0     0/0   0.0
Shai Wade              19    6    5    0   0   2/4    50.0     0/0   0.0
Michael Simons         20    4    0    0   0   2/4    50.0     0/0   0.0
Domantas Wall          28    2    0    0   0   1/1   100.0     0/0   0.0
Miles Herro            19    2    0    0   0   1/3    33.3     0/0   0.0
Tracy Bryant           30    0    0    1   0   0/1     0.0     0/0   0.0
Bones Anunoby          30    0    1    0   0   0/0     0.0     0/0   0.0
Allen Markkanen        35    0    1    0   0   0/0     0.0     0/0   0.0
Julius Jackson         20    0    3    0   0   0/3     0.0     0/0   0.0

TEAM: FG: 9/19 (47.4%), 3PT: 0/4 (0.0%), REB: 11 (2 off, 9 def), AST: 1, TO: 4
TEAM FOULS: 7 [Team_096 in BONUS]


Team_096
--------------------------------------------------------------------------------
Player                MIN  PTS  REB  AST  TO      FG   FG%      3P   3P%
--------------------------------------------------------------------------------
Jarrett Markkanen      19    7    4    1   0   3/5    60.0     0/0   0.0
Tyler Haliburton       19    4    4    3   0   2/4    50.0     0/0   0.0
Cade Jokic             22    4    0    0   0   2/4    50.0     0/0   0.0
Cole Holiday           19    4    0    1   0   2/3    66.7     0/0   0.0
Kyrie Adebayo          34    2    2    0   0   1/1   100.0     0/0   0.0
Cole Griffin           30    0    1    0   0   0/0     0.0     0/0   0.0
Lamelo Quickley        30    0    0    0   0   0/1     0.0     0/0   0.0
Devin Griffin          12    0    2    0   0   0/1     0.0     0/0   0.0

TEAM: FG: 10/19 (52.6%), 3PT: 3/5 (60.0%), REB: 13 (3 off, 10 def), AST: 5, TO: 3
TEAM FOULS: 7 [Team_018 in BONUS]

================================================================================

================================================================================
                               FULL GAME COMPLETE                               
================================================================================

FINAL SCORE: Team_018 80, Team_096 103

SCORING BY QUARTER:
--------------------------------------------------------------------------------
Team                     Q1     Q2     Q3     Q4    FINAL
--------------------------------------------------------------------------------
Team_018                 18     15     26     21       80
Team_096                 24     32     26     21      103
--------------------------------------------------------------------------------

FULL GAME BOX SCORE:
================================================================================

Team_018
--------------------------------------------------------------------------------
Player                MIN  PTS  REB  AST  TO      FG   FG%      3P   3P%      FT STL BLK
--------------------------------------------------------------------------------
Allen Markkanen        35    7    8    1   1   4/8    50.0   0/1     0.0   3/3     0   0
Tracy Bryant           30   16    0    2   0   7/10   70.0   2/3    66.7   2/2     0   0
Bones Anunoby          30   11   14    1   1   5/17   29.4   0/7     0.0   8/10    2   0
Klay Stewart           29    0    0    4   3   0/3     0.0   0/2     0.0   0/0     0   0
Domantas Wall          28   15    6    1   2   7/10   70.0   1/1   100.0   2/6     1   0
Julius Jackson         20    2    6    0   0   1/5    20.0   0/1     0.0   0/0     0   1
Michael Simons         20    6    0    0   2   3/7    42.9   0/2     0.0   2/2     0   1
Miles Herro            19    2    0    0   1   1/4    25.0   0/2     0.0   0/0     0   0
Shai Wade              19    9    6    2   2   3/6    50.0   0/2     0.0   4/5     0   1
Austin Antetokounmpo   14   10    2    0   1   4/6    66.7   1/2    50.0   1/1     0   0

TEAM: FG: 36/77 (46.8%), 3PT: 4/23 (17.4%), REB: 42 (11 off, 31 def), AST: 11, TO: 13


Team_096
--------------------------------------------------------------------------------
Player                MIN  PTS  REB  AST  TO      FG   FG%      3P   3P%      FT STL BLK
--------------------------------------------------------------------------------
Kyrie Adebayo          34   24    9    0   3  10/13   76.9   0/0     0.0   6/8     0   2
Lamelo Quickley        30    8    2    1   2   4/9    44.4   0/4     0.0   2/3     0   0
Cole Griffin           30   10    6    3   2   5/7    71.4   1/2    50.0   2/2     1   0
Scottie Herro          30   10   13    2   2   3/7    42.9   3/5    60.0   5/8     0   0
Terry Mobley           29    6    0    2   0   2/8    25.0   2/4    50.0   0/3     1   0
Cade Jokic             22    4    0    2   1   1/5    20.0   0/1     0.0   1/2     0   0
Jarrett Markkanen      19   20    6    1   1   6/9    66.7   3/5    60.0   7/8     0   0
Cole Holiday           19    8    0    2   1   4/5    80.0   1/1   100.0   2/3     0   0
Tyler Haliburton       19    6    7    3   0   4/7    57.1   0/1     0.0   2/2     0   0
Devin Griffin          12    2    5    1   0   1/3    33.3   0/0     0.0   0/0     0   0

TEAM: FG: 43/77 (55.8%), 3PT: 10/23 (43.5%), REB: 48 (9 off, 39 def), AST: 17, TO: 12

================================================================================
