================================================================================
                        FULL GAME - Team_014 vs Team_058                        
================================================================================

================================================================================
                       1ST QUARTER - Team_014 vs Team_058                       
================================================================================

[12:00] Team_014 possession (Score: 0-0)
Michael Cunningham attempts a 3Pt. Contested by Stephen Haliburton (3.2 feet, ZONE). Michael Cunningham misses. Rebound secured by Bradley Sexton.

[11:46] Team_058 possession (Score: 0-0)
FOUL! Offensive foul on Vince Hyland! Lamelo Simmons drew the charge! [Team fouls: 1] (Vince Hyland: 1 personal fouls) TURNOVER! (dead ball)

[11:29] Team_014 possession (Score: 0-0)
DeMar Adebayo attempts a Midrange. Contested by Stephen Haliburton (3.4 feet, ZONE). DeMar Adebayo misses. Rebound secured by Stephen Haliburton.

[11:15] Team_058 possession (Score: 0-0)
Vince Hyland drives and kicks out. Kyle Westbrook attempts a 3Pt. Contested by Jordan Anunoby (4.7 feet, MAN). Kyle Westbrook misses. Rebound secured by Michael Cunningham.

[10:57] Team_014 possession (Score: 0-0)
Lamelo Simmons attempts a 3Pt. Contested by Bradley Sexton (3.4 feet, ZONE). Lamelo Simmons misses. FOUL! Loose ball foul on Tyrese Doncic during the rebound battle. [Team fouls: 2] No free throws, side out. (Tyrese Doncic: 1 personal fouls)

[10:44] Team_014 possession (Score: 0-0)
DeMar Adebayo attempts a Midrange. Contested by Stephen Haliburton (3.4 feet, MAN). DeMar Adebayo misses. Rebound secured by Bradley Sexton.

[10:29] Team_058 possession (Score: 0-0)
Tyrese Doncic makes the 3Pt and draws the foul on Jordan Anunoby! And-1! Tyrese Doncic to the line for 1. [Team fouls: 1] (Jordan Anunoby: 1 personal fouls)   FT 1/1: GOOD Tyrese Doncic makes 1/1 from the line.
Score: 0-4

[10:17] Team_014 possession (Score: 0-4)
Michael Cunningham attempts a 3Pt. Contested by Bradley Sexton (2.8 feet, MAN). MICHAEL CUNNINGHAM MAKES IT! Assist: Lamelo Simmons
Score: 3-4

[10:02] Team_058 possession (Score: 3-4)
Stephen Haliburton attempts a 3Pt. Contested by DeMar Adebayo (3.3 feet, MAN). Stephen Haliburton misses. Rebound secured by DeMar Adebayo.

[09:48] Team_014 possession (Score: 3-4)
Jordan Anunoby attempts a 3Pt. Contested by Bradley Sexton (3.3 feet, ZONE). Jordan Anunoby misses. Rebound secured by Tyrese Doncic.

[09:34] Team_058 possession (Score: 3-4)
Tyrese Doncic drives, picks up DeMar Adebayo. Help arrives from Michael Cunningham! Tyrese Doncic attempts a Layup. Contested by Michael Cunningham (3.2 feet, ZONE). TYRESE DONCIC MAKES IT!
Score: 3-6

[09:20] Team_014 possession (Score: 3-6)
FOUL! Holding foul on Stephen Haliburton. [Team fouls: 3] No free throws, side out. (Stephen Haliburton: 1 personal fouls)

[09:01] Team_014 possession (Score: 3-6)
Ayo Murray attempts a Layup. Contested by Stephen Haliburton (3.8 feet, ZONE). Ayo Murray misses. Rebound secured by Bradley Sexton.

[08:49] Team_058 possession (Score: 3-6)
Bradley Sexton attempts a 3Pt. Contested by Michael Cunningham (4.3 feet, MAN). Bradley Sexton misses. Rebound secured by DeMar Adebayo.

[08:37] Team_014 possession (Score: 3-6)
DeMar Adebayo attempts a 3Pt. Contested by Stephen Haliburton (3.4 feet, MAN). DeMar Adebayo misses. Rebound secured by Tyrese Doncic.

[08:26] Team_058 possession (Score: 3-6)
Stephen Haliburton attempts a 3Pt. Contested by DeMar Adebayo (3.3 feet, MAN). Stephen Haliburton misses. Offensive rebound by Stephen Haliburton! Stephen Haliburton's putback is no good. Rebound secured by DeMar Adebayo.

[08:16] Team_014 possession (Score: 3-6)
Jordan Anunoby attempts a 3Pt. Contested by Kyle Westbrook (4.3 feet, MAN). Jordan Anunoby misses. Rebound secured by Stephen Haliburton.

[08:04] Team_058 possession (Score: 3-6)
Bradley Sexton drives, DeMar Adebayo stays with him. Bradley Sexton attempts a Layup. Contested by DeMar Adebayo (3.4 feet, ZONE). BRADLEY SEXTON MAKES IT!
Score: 3-8

[07:46] Team_014 possession (Score: 3-8)
DeMar Adebayo throws a bad pass out of bounds! TURNOVER! (dead ball)

[07:33] Team_058 possession (Score: 3-8)
Vince Hyland drives and kicks out. FOUL! Shooting foul on Lamelo Simmons. Vince Hyland to the line for 2 free throws. [Team fouls: 2] (Lamelo Simmons: 1 personal fouls)   FT 1/2: MISS   FT 2/2: MISS Vince Hyland makes 0/2 from the line. Rebound secured by Michael Cunningham.

[07:17] Team_014 possession (Score: 3-8)
DeMar Adebayo attempts a 3Pt. Contested by Stephen Haliburton (3.4 feet, MAN). DeMar Adebayo misses. Rebound secured by Tyrese Doncic.

[07:06] Team_058 possession (Score: 3-8)
Kyle Westbrook drives, picks up Ayo Murray. Help arrives from Michael Cunningham! Kyle Westbrook attempts a Dunk. Contested by Michael Cunningham (5.0 feet, ZONE). KYLE WESTBROOK MAKES IT!
Score: 3-10

[06:51] Team_014 possession (Score: 3-10)
Ayo Murray drives and kicks out. Lamelo Simmons attempts a Midrange. Contested by Vince Hyland (4.5 feet, MAN). LAMELO SIMMONS MAKES IT! Assist: Jordan Anunoby
Score: 5-10

[06:35] Team_058 possession (Score: 5-10)
Vince Hyland attempts a 3Pt. Contested by Lamelo Simmons (4.3 feet, MAN). Vince Hyland misses. FOUL! Loose ball foul on Michael Cunningham during the rebound battle. [Team fouls: 3] No free throws, side out. (Michael Cunningham: 1 personal fouls)

[06:24] Team_058 possession (Score: 5-10)
Stephen Haliburton drives to the basket... Stephen Haliburton loses control! Ball rolls out of bounds! TURNOVER! (dead ball)

[06:09] Team_014 possession (Score: 5-10)
DeMar Adebayo drives, picks up Stephen Haliburton. Help arrives from Bradley Sexton! DeMar Adebayo attempts a Layup. Contested by Bradley Sexton (3.4 feet, MAN). DEMAR ADEBAYO MAKES IT! Assist: Michael Cunningham
Score: 7-10

[05:54] Team_058 possession (Score: 7-10)
Vince Hyland attempts a Midrange. Contested by Lamelo Simmons (4.3 feet, MAN). Vince Hyland misses. Rebound secured by DeMar Adebayo.

[05:39] Team_014 possession (Score: 7-10)
Lamelo Simmons attempts a 3Pt. Contested by Vince Hyland (4.9 feet, MAN). Lamelo Simmons misses. Offensive rebound by DeMar Adebayo! DeMar Adebayo kicks it out.

[05:21] Team_014 possession (Score: 7-10)
Michael Cunningham attempts a 3Pt. Contested by Bradley Sexton (2.8 feet, ZONE). Michael Cunningham misses. Rebound secured by Tyrese Doncic.

[05:02] Team_058 possession (Score: 7-10)
Kyle Westbrook throws a bad pass! Stolen by Jordan Anunoby! TURNOVER! (live ball)

[04:50] Team_014 possession (Score: 7-10)
Ayo Murray drives and kicks out. Michael Cunningham attempts a Midrange. Contested by Bradley Sexton (3.0 feet, MAN). MICHAEL CUNNINGHAM MAKES IT! Assist: Jordan Anunoby
Score: 9-10

[04:36] Team_058 possession (Score: 9-10)
Tyrese Doncic drives, picks up Ayo Murray. Help arrives from Michael Cunningham! Tyrese Doncic attempts a Layup. Contested by Michael Cunningham (4.9 feet, MAN). TYRESE DONCIC MAKES IT!
Score: 9-12

[04:25] Team_014 possession (Score: 9-12)
Ayo Murray drives and kicks out. Ayo Murray attempts a 3Pt. Contested by Tyrese Doncic (4.5 feet, MAN). AYO MURRAY MAKES IT! Assist: Michael Cunningham
Score: 12-12

[04:10] Team_058 possession (Score: 12-12)
FOUL! Shooting foul on Lamelo Simmons. Bradley Sexton to the line for 3 free throws. [Team fouls: 4] (Lamelo Simmons: 2 personal fouls)   FT 1/3: GOOD   FT 2/3: GOOD   FT 3/3: MISS Bradley Sexton makes 2/3 from the line. Offensive rebound by Tyrese Doncic! Tyrese Doncic kicks it out.
Score: 12-14

[03:55] Team_058 possession (Score: 12-14)
Vince Hyland attempts a 3Pt. Contested by Jordan Anunoby (5.1 feet, ZONE). VINCE HYLAND MAKES IT!
Score: 12-17

[03:44] Team_014 possession (Score: 12-17)
Jordan Anunoby commits a violation (traveling/carry)! TURNOVER! (dead ball)

[03:30] Team_058 possession (Score: 12-17)
Vince Hyland attempts a 3Pt. Contested by Lamelo Simmons (4.6 feet, MAN). Vince Hyland misses. Offensive rebound by Tyrese Doncic! Tyrese Doncic kicks it out.

[03:16] Team_058 possession (Score: 12-17)
Bradley Sexton attempts a Midrange. BLOCKED BY MICHAEL CUNNINGHAM! Ball deflects out of bounds off Bradley Sexton.

[02:57] Team_014 possession (Score: 12-17)
Michael Cunningham attempts a 3Pt. Contested by Bradley Sexton (3.0 feet, MAN). Michael Cunningham misses. Offensive rebound by DeMar Adebayo! DeMar Adebayo kicks it out.

[02:40] Team_014 possession (Score: 12-17)
Michael Cunningham attempts a 3Pt. Contested by Bradley Sexton (3.1 feet, MAN). Michael Cunningham misses. Rebound secured by Stephen Haliburton.

[02:29] Team_058 possession (Score: 12-17)
Vince Hyland attempts a Midrange. Contested by DeMar Adebayo (3.7 feet, ZONE). VINCE HYLAND MAKES IT! Assist: Tyrese Doncic
Score: 12-19

[02:16] Team_014 possession (Score: 12-19)
DeMar Adebayo drives, picks up Stephen Haliburton. Help arrives from Bradley Sexton! DeMar Adebayo attempts a Layup. Contested by Bradley Sexton (3.7 feet, MAN). DEMAR ADEBAYO MAKES IT! Assist: Ayo Murray
Score: 14-19

[01:59] Team_058 possession (Score: 14-19)
Bradley Sexton attempts a 3Pt. Contested by Michael Cunningham (4.6 feet, MAN). Bradley Sexton misses. Rebound secured by Ayo Murray.

[01:41] Team_014 possession (Score: 14-19)
Ayo Murray attempts a Midrange. Contested by Tyrese Doncic (5.0 feet, MAN). Ayo Murray misses. Offensive rebound by DeMar Adebayo! DeMar Adebayo kicks it out.

[01:29] Team_014 possession (Score: 14-19)
DeMar Adebayo attempts a 3Pt. Contested by Bradley Sexton (3.3 feet, ZONE). DEMAR ADEBAYO MAKES IT!
Score: 17-19

[01:15] Team_058 possession (Score: 17-19)
Vince Hyland drives to the basket... Vince Hyland throws a bad pass out of bounds! TURNOVER! (dead ball)

[01:15] Substitution (Team_014): Michael Cunningham OUT → Jalen Booker IN (stamina_rule2)

[01:15] Substitution (Team_014): Jordan Anunoby OUT → Bones Quickley IN (stamina_rule2)

[01:15] Substitution (Team_014): Lamelo Simmons OUT → Tracy Westbrook IN (stamina_rule2)

[01:15] Substitution (Team_014): DeMar Adebayo OUT → Nikola James IN (stamina_rule2)

[01:15] Substitution (Team_014): Ayo Murray OUT → Collin Gasol IN (stamina_rule2)

[01:15] Substitution (Team_058): Bradley Sexton OUT → Draymond Williamson IN (stamina_rule2)

[01:15] Substitution (Team_058): Kyle Westbrook OUT → Jordan Ingram IN (stamina_rule2)

[01:15] Substitution (Team_058): Vince Hyland OUT → Pascal Holiday IN (stamina_rule2)

[01:15] Substitution (Team_058): Stephen Haliburton OUT → Shai Lowry IN (stamina_rule2)

[01:15] Substitution (Team_058): Tyrese Doncic OUT → Jarrett Gilgeous-Alexander IN (stamina_rule2)

[01:03] Team_014 possession (Score: 17-19)
Bones Quickley drives to the basket... Bones Quickley throws a bad pass! Stolen by Shai Lowry! TURNOVER! (live ball)

[00:44] Team_058 possession (Score: 17-19)
Shai Lowry attempts a Layup. BLOCKED BY NIKOLA JAMES! Ball deflects out of bounds off Shai Lowry.

[00:29] Team_014 possession (Score: 17-19)
Nikola James makes the Midrange and draws the foul on Shai Lowry! And-1! Nikola James to the line for 1. [Team fouls: 4] (Shai Lowry: 1 personal fouls)   FT 1/1: MISS Nikola James makes 0/1 from the line. Rebound secured by Shai Lowry.
Score: 19-19

[00:12] Team_058 possession (Score: 19-19)
Draymond Williamson attempts a 3Pt. Contested by Jalen Booker (4.7 feet, ZONE). Draymond Williamson misses. Rebound secured by Collin Gasol.

================================================================================
                              1ST QUARTER COMPLETE                              
================================================================================

1ST QUARTER SCORE: Team_014 19, Team_058 19

BOX SCORE:
================================================================================

Team_014
--------------------------------------------------------------------------------
Player                MIN  PTS  REB  AST  TO      FG   FG%      3P   3P%
--------------------------------------------------------------------------------
DeMar Adebayo          11    7    7    0   0   3/7    42.9     0/0   0.0
Michael Cunningham     11    5    2    2   0   2/5    40.0     0/0   0.0
Ayo Murray             11    3    2    1   0   1/2    50.0     0/0   0.0
Lamelo Simmons         11    2    0    1   0   1/1   100.0     0/0   0.0
Jordan Anunoby         11    0    0    2   0   0/2     0.0     0/0   0.0
Nikola James            1    0    0    0   0   0/1     0.0     0/0   0.0
Collin Gasol            1    0    1    0   0   0/0     0.0     0/0   0.0

TEAM: FG: 7/18 (38.9%), 3PT: 2/9 (22.2%), REB: 11 (4 off, 7 def), AST: 6, TO: 3
TEAM FOULS: 4


Team_058
--------------------------------------------------------------------------------
Player                MIN  PTS  REB  AST  TO      FG   FG%      3P   3P%
--------------------------------------------------------------------------------
Tyrese Doncic          11    8    6    1   0   3/3   100.0     0/0   0.0
Vince Hyland           11    5    0    0   0   2/5    40.0     0/0   0.0
Bradley Sexton         11    2    3    0   0   1/4    25.0     0/0   0.0
Kyle Westbrook         11    2    0    0   0   1/1   100.0     0/0   0.0
Stephen Haliburton     11    0    4    0   0   0/2     0.0     0/0   0.0
Shai Lowry              1    0    1    0   0   0/1     0.0     0/0   0.0
Draymond Williamson     1    0    0    0   0   0/1     0.0     0/0   0.0

TEAM: FG: 7/17 (41.2%), 3PT: 2/7 (28.6%), REB: 15 (4 off, 11 def), AST: 1, TO: 4
TEAM FOULS: 4

================================================================================

================================================================================
                       2ND QUARTER - Team_014 vs Team_058                       
================================================================================

[12:00] Team_014 possession (Score: 19-19)
Michael Cunningham attempts a 3Pt. Contested by Bradley Sexton (2.9 feet, ZONE). Michael Cunningham misses. Rebound secured by Bradley Sexton.

[11:43] Team_058 possession (Score: 19-19)
FOUL! Shooting foul on DeMar Adebayo. Bradley Sexton to the line for 2 free throws. [Team fouls: 1] (DeMar Adebayo: 1 personal fouls)   FT 1/2: GOOD   FT 2/2: GOOD Bradley Sexton makes 2/2 from the line.
Score: 19-21

[11:26] Team_014 possession (Score: 19-21)
Michael Cunningham attempts a Midrange. Contested by Bradley Sexton (3.0 feet, ZONE). Michael Cunningham misses. Rebound secured by Bradley Sexton.

[11:12] Team_058 possession (Score: 19-21)
FOUL! Reach-in foul on DeMar Adebayo during the drive. [Team fouls: 2] No free throws, side out. (DeMar Adebayo: 2 personal fouls)

[10:59] Team_058 possession (Score: 19-21)
Vince Hyland attempts a 3Pt. Contested by Lamelo Simmons (4.6 feet, MAN). VINCE HYLAND MAKES IT! Assist: Bradley Sexton
Score: 19-24

[10:46] Team_014 possession (Score: 19-24)
Michael Cunningham drives to the basket... Michael Cunningham commits a violation (traveling/carry)! TURNOVER! (dead ball)

[10:46] Substitution (Team_014): Jordan Anunoby OUT → Bones Quickley IN (stamina_rule2)

[10:46] Substitution (Team_014): Lamelo Simmons OUT → Tracy Westbrook IN (stamina_rule2)

[10:46] Substitution (Team_014): DeMar Adebayo OUT → Nikola James IN (stamina_rule2)

[10:46] Substitution (Team_058): Kyle Westbrook OUT → Jordan Ingram IN (stamina_rule2)

[10:46] Substitution (Team_058): Stephen Haliburton OUT → Shai Lowry IN (stamina_rule2)

[10:32] Team_058 possession (Score: 19-24)
Vince Hyland drives, Tracy Westbrook stays with him. Vince Hyland attempts a Layup. Contested by Tracy Westbrook (5.5 feet, MAN). VINCE HYLAND MAKES IT!
Score: 19-26

[10:18] Team_014 possession (Score: 19-26)
Nikola James throws a bad pass out of bounds! TURNOVER! (dead ball)

[10:18] Substitution (Team_014): Michael Cunningham OUT → Jalen Booker IN (stamina_rule2)

[10:18] Substitution (Team_014): Ayo Murray OUT → Collin Gasol IN (stamina_rule2)

[10:18] Substitution (Team_058): Bradley Sexton OUT → Draymond Williamson IN (stamina_rule2)

[10:18] Substitution (Team_058): Vince Hyland OUT → Pascal Holiday IN (stamina_rule2)

[10:18] Substitution (Team_058): Tyrese Doncic OUT → Jarrett Gilgeous-Alexander IN (stamina_rule2)

[10:05] Team_058 possession (Score: 19-26)
FOUL! Holding foul on Tracy Westbrook. [Team fouls: 3] No free throws, side out. (Tracy Westbrook: 1 personal fouls)

[09:53] Team_058 possession (Score: 19-26)
Pascal Holiday attempts a 3Pt. Contested by Jalen Booker (4.3 feet, ZONE). PASCAL HOLIDAY MAKES IT! Assist: Shai Lowry
Score: 19-29

[09:38] Team_014 possession (Score: 19-29)
FOUL! Shooting foul on Jordan Ingram. Collin Gasol to the line for 2 free throws. [Team fouls: 1] (Jordan Ingram: 1 personal fouls)   FT 1/2: MISS   FT 2/2: GOOD Collin Gasol makes 1/2 from the line.
Score: 20-29

[09:22] Team_058 possession (Score: 20-29)
Pascal Holiday attempts a Layup. Contested by Tracy Westbrook (5.3 feet, MAN). Pascal Holiday misses. Offensive rebound by Pascal Holiday! Pascal Holiday's putback is no good. Rebound secured by Collin Gasol.

[09:10] Team_014 possession (Score: 20-29)
Collin Gasol drives and kicks out. Nikola James attempts a Midrange. Contested by Pascal Holiday (4.6 feet, ZONE). Nikola James misses. Offensive rebound by Nikola James! Nikola James kicks it out.

[08:55] Team_014 possession (Score: 20-29)
Tracy Westbrook attempts a 3Pt. Contested by Pascal Holiday (4.2 feet, MAN). TRACY WESTBROOK MAKES IT! Assist: Bones Quickley
Score: 23-29

[08:39] Team_058 possession (Score: 23-29)
FOUL! Offensive foul on Draymond Williamson! Jalen Booker drew the charge! [Team fouls: 2] (Draymond Williamson: 1 personal fouls) TURNOVER! (dead ball)

[08:25] Team_014 possession (Score: 23-29)
Jalen Booker attempts a 3Pt. Contested by Draymond Williamson (5.3 feet, ZONE). Jalen Booker misses. Rebound secured by Jarrett Gilgeous-Alexander.

[08:10] Team_058 possession (Score: 23-29)
Pascal Holiday drives, Tracy Westbrook stays with him. Pascal Holiday attempts a Dunk. Contested by Tracy Westbrook (5.3 feet, MAN). PASCAL HOLIDAY MAKES IT! Assist: Jarrett Gilgeous-Alexander
Score: 23-31

[07:54] Team_014 possession (Score: 23-31)
Nikola James attempts a Layup. BLOCKED BY SHAI LOWRY! Ball is loose! Rebound secured by Pascal Holiday.

[07:40] Team_058 possession (Score: 23-31)
Draymond Williamson makes the 3Pt and draws the foul on Jalen Booker! And-1! Draymond Williamson to the line for 1. [Team fouls: 4] (Jalen Booker: 1 personal fouls)   FT 1/1: GOOD Draymond Williamson makes 1/1 from the line.
Score: 23-35

[07:29] Team_014 possession (Score: 23-35)
Collin Gasol drives and kicks out. Tracy Westbrook attempts a Midrange. Contested by Pascal Holiday (4.6 feet, ZONE). Tracy Westbrook misses. Rebound secured by Pascal Holiday.

[07:15] Team_058 possession (Score: 23-35)
Jarrett Gilgeous-Alexander makes the Dunk and draws the foul on Jalen Booker! And-1! Jarrett Gilgeous-Alexander to the line for 1. [BONUS: 5 team fouls] (Jalen Booker: 2 personal fouls)   FT 1/1: GOOD Jarrett Gilgeous-Alexander makes 1/1 from the line.
Score: 23-38

[07:04] Team_014 possession (Score: 23-38)
Tracy Westbrook drives, Shai Lowry stays with him. Tracy Westbrook attempts a Dunk. Contested by Shai Lowry (3.7 feet, ZONE). Tracy Westbrook misses. Rebound secured by Shai Lowry.

[06:53] Team_058 possession (Score: 23-38)
Jordan Ingram attempts a 3Pt. Contested by Jalen Booker (4.3 feet, ZONE). Jordan Ingram misses. Rebound secured by Nikola James.

[06:39] Team_014 possession (Score: 23-38)
Collin Gasol attempts a Midrange. Contested by Jarrett Gilgeous-Alexander (5.8 feet, MAN). Collin Gasol misses. Rebound secured by Pascal Holiday.

[06:24] Team_058 possession (Score: 23-38)
Pascal Holiday attempts a 3Pt. Contested by Jalen Booker (4.3 feet, ZONE). Pascal Holiday misses. Offensive rebound by Shai Lowry! Shai Lowry kicks it out.

[06:08] Team_058 possession (Score: 23-38)
Jarrett Gilgeous-Alexander drives, picks up Collin Gasol. Help arrives from Jalen Booker! Jarrett Gilgeous-Alexander attempts a Dunk. Contested by Jalen Booker (5.1 feet, ZONE). Jarrett Gilgeous-Alexander misses. Rebound secured by Nikola James.

[05:53] Team_014 possession (Score: 23-38)
Nikola James attempts a Midrange. Contested by Shai Lowry (4.1 feet, MAN). Nikola James misses. Rebound secured by Pascal Holiday.

[05:39] Team_058 possession (Score: 23-38)
Pascal Holiday attempts a 3Pt. Contested by Jalen Booker (4.3 feet, ZONE). PASCAL HOLIDAY MAKES IT! Assist: Shai Lowry
Score: 23-41

[05:24] Team_014 possession (Score: 23-41)
Bones Quickley throws a bad pass out of bounds! TURNOVER! (dead ball)

[05:13] Team_058 possession (Score: 23-41)
Draymond Williamson attempts a Midrange. Contested by Nikola James (5.6 feet, ZONE). DRAYMOND WILLIAMSON MAKES IT!
Score: 23-43

[04:59] Team_014 possession (Score: 23-43)
Nikola James attempts a Midrange. Contested by Shai Lowry (4.1 feet, MAN). Nikola James misses. Rebound secured by Shai Lowry.

[04:40] Team_058 possession (Score: 23-43)
Draymond Williamson attempts a Midrange. Contested by Jalen Booker (4.7 feet, MAN). Draymond Williamson misses. Offensive rebound by Shai Lowry! Shai Lowry kicks it out.

[04:28] Team_058 possession (Score: 23-43)
Draymond Williamson makes the 3Pt and draws the foul on Bones Quickley! And-1! Draymond Williamson to the line for 1. [BONUS: 6 team fouls] (Bones Quickley: 1 personal fouls)   FT 1/1: GOOD Draymond Williamson makes 1/1 from the line.
Score: 23-47

[04:13] Team_014 possession (Score: 23-47)
Tracy Westbrook attempts a Midrange. Contested by Pascal Holiday (4.3 feet, MAN). Tracy Westbrook misses. Rebound secured by Shai Lowry.

[04:00] Team_058 possession (Score: 23-47)
Jordan Ingram attempts a Layup. Contested by Collin Gasol (5.2 feet, ZONE). Jordan Ingram misses. Rebound secured by Tracy Westbrook.

[03:48] Team_014 possession (Score: 23-47)
Tracy Westbrook drives, Pascal Holiday stays with him. Tracy Westbrook attempts a Layup. Contested by Pascal Holiday (4.3 feet, MAN). TRACY WESTBROOK MAKES IT!
Score: 25-47

[03:31] Team_058 possession (Score: 25-47)
Jarrett Gilgeous-Alexander drives, Collin Gasol stays with him. Jarrett Gilgeous-Alexander attempts a Layup. Contested by Collin Gasol (5.1 feet, ZONE). JARRETT GILGEOUS-ALEXANDER MAKES IT! Assist: Jordan Ingram
Score: 25-49

[03:13] Team_014 possession (Score: 25-49)
Nikola James attempts a 3Pt. Contested by Pascal Holiday (4.7 feet, ZONE). Nikola James misses. Offensive rebound by Nikola James! Nikola James kicks it out.

[03:03] Team_014 possession (Score: 25-49)
Nikola James drives, picks up Shai Lowry. Help arrives from Jordan Ingram! Nikola James attempts a Dunk. Contested by Jordan Ingram (4.3 feet, MAN). Nikola James misses. Offensive rebound by Collin Gasol! Collin Gasol puts it back in!
Score: 27-49

[02:47] Team_058 possession (Score: 27-49)
Pascal Holiday drives, Tracy Westbrook stays with him. Pascal Holiday attempts a Dunk. Contested by Tracy Westbrook (5.5 feet, MAN). PASCAL HOLIDAY MAKES IT!
Score: 27-51

[02:33] Team_014 possession (Score: 27-51)
Bones Quickley drives and kicks out. Bones Quickley attempts a 3Pt. Contested by Draymond Williamson (5.4 feet, ZONE). Bones Quickley misses. Rebound secured by Jarrett Gilgeous-Alexander.

[02:18] Team_058 possession (Score: 27-51)
Draymond Williamson attempts a Layup. Contested by Jalen Booker (4.9 feet, MAN). Draymond Williamson misses. Offensive rebound by Shai Lowry! Shai Lowry kicks it out.

[02:06] Team_058 possession (Score: 27-51)
Pascal Holiday throws a bad pass! Stolen by Tracy Westbrook! TURNOVER! (live ball)

[01:53] Team_014 possession (Score: 27-51)
Nikola James attempts a Layup. Contested by Shai Lowry (4.5 feet, MAN). Nikola James misses. Rebound secured by Shai Lowry.

[01:36] Team_058 possession (Score: 27-51)
FOUL! Reach-in foul on Collin Gasol during the drive. [IN THE BONUS! 7 team fouls] Jarrett Gilgeous-Alexander to the line for 2 free throws. (Collin Gasol: 1 personal fouls)   FT 1/2: GOOD   FT 2/2: GOOD Jarrett Gilgeous-Alexander makes 2/2 from the line.
Score: 27-53

[01:23] Team_014 possession (Score: 27-53)
Jalen Booker attempts a Midrange. Contested by Pascal Holiday (4.9 feet, ZONE). JALEN BOOKER MAKES IT!
Score: 29-53

[01:12] Team_058 possession (Score: 29-53)
Draymond Williamson attempts a 3Pt. Contested by Jalen Booker (5.0 feet, ZONE). Draymond Williamson misses. Rebound secured by Nikola James.

[01:03] Team_014 possession (Score: 29-53)
Collin Gasol attempts a Layup. Wide open! Jarrett Gilgeous-Alexander is 6.1 feet away. [MAN] Collin Gasol misses. FOUL! Loose ball foul on Shai Lowry during the rebound battle. [Team fouls: 3] No free throws, side out. (Shai Lowry: 1 personal fouls)

[00:48] Team_014 possession (Score: 29-53)
Jalen Booker attempts a 3Pt. Contested by Draymond Williamson (5.6 feet, ZONE). Jalen Booker misses. Offensive rebound by Collin Gasol! Collin Gasol puts it back in!
Score: 31-53

[00:33] Team_058 possession (Score: 31-53)
Jordan Ingram attempts a 3Pt. Contested by Bones Quickley (5.8 feet, MAN). JORDAN INGRAM MAKES IT! Assist: Shai Lowry
Score: 31-56

[00:14] Team_014 possession (Score: 31-56)
Tracy Westbrook attempts a 3Pt. Contested by Pascal Holiday (4.6 feet, MAN). TRACY WESTBROOK MAKES IT! Assist: Nikola James
Score: 34-56

================================================================================
                              2ND QUARTER COMPLETE                              
================================================================================

2ND QUARTER SCORE: Team_014 15, Team_058 37

BOX SCORE:
================================================================================

Team_014
--------------------------------------------------------------------------------
Player                MIN  PTS  REB  AST  TO      FG   FG%      3P   3P%
--------------------------------------------------------------------------------
Tracy Westbrook        12    8    1    0   0   3/5    60.0     0/0   0.0
Collin Gasol           11    5    3    0   0   3/5    60.0     0/0   0.0
Jalen Booker           11    2    0    0   0   1/2    50.0     0/0   0.0
Michael Cunningham     13    0    0    0   0   0/2     0.0     0/0   0.0
Nikola James           12    0    6    1   0   0/4     0.0     0/0   0.0
Bones Quickley         12    0    0    1   0   0/1     0.0     0/0   0.0

TEAM: FG: 7/19 (36.8%), 3PT: 3/5 (60.0%), REB: 9 (5 off, 4 def), AST: 2, TO: 3
TEAM FOULS: 7 [Team_058 in BONUS]


Team_058
--------------------------------------------------------------------------------
Player                MIN  PTS  REB  AST  TO      FG   FG%      3P   3P%
--------------------------------------------------------------------------------
Pascal Holiday         11   10    4    0   0   4/5    80.0     0/0   0.0
Draymond Williamson    11   10    0    0   0   3/4    75.0     0/0   0.0
Jarrett Gilgeous-Alexander   11    7    2    1   0   3/4    75.0     0/0   0.0
Vince Hyland           13    5    0    0   0   2/2   100.0     0/0   0.0
Jordan Ingram          12    3    0    1   0   1/3    33.3     0/0   0.0
Bradley Sexton         13    2    2    1   0   1/1   100.0     0/0   0.0
Shai Lowry             12    0    7    3   0   0/0     0.0     0/0   0.0

TEAM: FG: 14/19 (73.7%), 3PT: 6/8 (75.0%), REB: 16 (4 off, 12 def), AST: 6, TO: 2
TEAM FOULS: 3

================================================================================

================================================================================
                       3RD QUARTER - Team_014 vs Team_058                       
================================================================================

[12:00] Team_014 possession (Score: 34-56)
Ayo Murray attempts a Midrange. Contested by Tyrese Doncic (4.7 feet, MAN). Ayo Murray misses. Rebound secured by Tyrese Doncic.

[11:47] Team_058 possession (Score: 34-56)
Bradley Sexton attempts a Layup. Contested by Michael Cunningham (4.3 feet, MAN). BRADLEY SEXTON MAKES IT! Assist: Vince Hyland
Score: 34-58

[11:32] Team_014 possession (Score: 34-58)
DeMar Adebayo makes the Layup and draws the foul on Stephen Haliburton! And-1! DeMar Adebayo to the line for 1. [Team fouls: 1] (Stephen Haliburton: 1 personal fouls)   FT 1/1: GOOD DeMar Adebayo makes 1/1 from the line.
Score: 37-58

[11:20] Team_058 possession (Score: 37-58)
Stephen Haliburton loses control! Ball rolls out of bounds! TURNOVER! (dead ball)

[11:04] Team_014 possession (Score: 37-58)
Ayo Murray attempts a 3Pt. Contested by Bradley Sexton (3.3 feet, ZONE). AYO MURRAY MAKES IT! Assist: Michael Cunningham
Score: 40-58

[10:48] Team_058 possession (Score: 40-58)
Kyle Westbrook attempts a 3Pt. Contested by Jordan Anunoby (4.9 feet, MAN). KYLE WESTBROOK MAKES IT! Assist: Tyrese Doncic
Score: 40-61

[10:34] Team_014 possession (Score: 40-61)
Jordan Anunoby attempts a Midrange. Contested by Stephen Haliburton (3.7 feet, ZONE). JORDAN ANUNOBY MAKES IT! Assist: Ayo Murray
Score: 42-61

[10:22] Team_058 possession (Score: 42-61)
FOUL! Shooting foul on DeMar Adebayo. Stephen Haliburton to the line for 2 free throws. [Team fouls: 1] (DeMar Adebayo: 1 personal fouls)   FT 1/2: GOOD   FT 2/2: GOOD Stephen Haliburton makes 2/2 from the line.
Score: 42-63

[10:06] Team_014 possession (Score: 42-63)
Ayo Murray attempts a Layup. Contested by Tyrese Doncic (4.7 feet, MAN). AYO MURRAY MAKES IT!
Score: 44-63

[09:54] Team_058 possession (Score: 44-63)
Bradley Sexton attempts a 3Pt. Contested by Michael Cunningham (4.3 feet, MAN). Bradley Sexton misses. Offensive rebound by Stephen Haliburton! Stephen Haliburton's putback is no good. Rebound secured by Ayo Murray.

[09:38] Team_014 possession (Score: 44-63)
FOUL! Shooting foul on Bradley Sexton. Michael Cunningham to the line for 2 free throws. [Team fouls: 2] (Bradley Sexton: 1 personal fouls)   FT 1/2: GOOD   FT 2/2: GOOD Michael Cunningham makes 2/2 from the line.
Score: 46-63

[09:23] Team_058 possession (Score: 46-63)
Tyrese Doncic drives to the basket... FOUL! Offensive foul on Tyrese Doncic! DeMar Adebayo drew the charge! [Team fouls: 3] (Tyrese Doncic: 1 personal fouls) TURNOVER! (dead ball)

[09:09] Team_014 possession (Score: 46-63)
DeMar Adebayo drives, Stephen Haliburton stays with him. DeMar Adebayo attempts a Dunk. Contested by Stephen Haliburton (3.4 feet, ZONE). DEMAR ADEBAYO MAKES IT!
Score: 48-63

[08:53] Team_058 possession (Score: 48-63)
Bradley Sexton attempts a 3Pt. Contested by Jordan Anunoby (5.0 feet, ZONE). BRADLEY SEXTON MAKES IT! Assist: Tyrese Doncic
Score: 48-66

[08:36] Team_014 possession (Score: 48-66)
DeMar Adebayo drives, Stephen Haliburton stays with him. DeMar Adebayo attempts a Dunk. Contested by Stephen Haliburton (3.4 feet, MAN). DEMAR ADEBAYO MAKES IT! Assist: Jordan Anunoby
Score: 50-66

[08:20] Team_058 possession (Score: 50-66)
Tyrese Doncic attempts a Midrange. Contested by Jordan Anunoby (4.7 feet, ZONE). Tyrese Doncic misses. Offensive rebound by Tyrese Doncic! Tyrese Doncic kicks it out.

[08:02] Team_058 possession (Score: 50-66)
Bradley Sexton attempts a Layup. Contested by DeMar Adebayo (3.4 feet, ZONE). Bradley Sexton misses. Rebound secured by DeMar Adebayo.

[07:43] Team_014 possession (Score: 50-66)
Lamelo Simmons drives and kicks out. Jordan Anunoby attempts a Midrange. Contested by Vince Hyland (4.5 feet, ZONE). JORDAN ANUNOBY MAKES IT!
Score: 52-66

[07:29] Team_058 possession (Score: 52-66)
Kyle Westbrook attempts a Midrange. Contested by DeMar Adebayo (3.3 feet, ZONE). Kyle Westbrook misses. Rebound secured by DeMar Adebayo.

[07:12] Team_014 possession (Score: 52-66)
DeMar Adebayo drives and kicks out. Ayo Murray attempts a 3Pt. Contested by Kyle Westbrook (4.0 feet, ZONE). Ayo Murray misses. Offensive rebound by Ayo Murray! Ayo Murray kicks it out.

[06:56] Team_014 possession (Score: 52-66)
Jordan Anunoby loses the ball! Stripped by Kyle Westbrook! TURNOVER! (live ball)

[06:37] Team_058 possession (Score: 52-66)
FOUL! Shooting foul on Ayo Murray. Tyrese Doncic to the line for 2 free throws. [Team fouls: 2] (Ayo Murray: 1 personal fouls)   FT 1/2: GOOD   FT 2/2: MISS Tyrese Doncic makes 1/2 from the line. Offensive rebound by Stephen Haliburton! Stephen Haliburton puts it back in!
Score: 52-69

[06:21] Team_014 possession (Score: 52-69)
Michael Cunningham attempts a 3Pt. Contested by Stephen Haliburton (3.2 feet, ZONE). Michael Cunningham misses. Rebound secured by Stephen Haliburton.

[06:07] Team_058 possession (Score: 52-69)
Tyrese Doncic attempts a Layup. BLOCKED BY DEMAR ADEBAYO! Ball deflects out of bounds off Tyrese Doncic.

[05:54] Team_014 possession (Score: 52-69)
Michael Cunningham attempts a 3Pt. Contested by Bradley Sexton (2.8 feet, MAN). Michael Cunningham misses. Offensive rebound by DeMar Adebayo! DeMar Adebayo kicks it out.

[05:38] Team_014 possession (Score: 52-69)
Ayo Murray attempts a Midrange. Contested by Kyle Westbrook (4.3 feet, ZONE). Ayo Murray misses. Rebound secured by Tyrese Doncic.

[05:23] Team_058 possession (Score: 52-69)
Tyrese Doncic drives, DeMar Adebayo stays with him. Tyrese Doncic attempts a Dunk. Contested by DeMar Adebayo (3.2 feet, ZONE). TYRESE DONCIC MAKES IT!
Score: 52-71

[05:10] Team_014 possession (Score: 52-71)
DeMar Adebayo attempts a 3Pt. Contested by Stephen Haliburton (3.4 feet, MAN). DeMar Adebayo misses. Rebound secured by Tyrese Doncic.

[04:55] Team_058 possession (Score: 52-71)
Stephen Haliburton drives, DeMar Adebayo stays with him. Stephen Haliburton attempts a Layup. Contested by DeMar Adebayo (3.3 feet, ZONE). STEPHEN HALIBURTON MAKES IT!
Score: 52-73

[04:44] Team_014 possession (Score: 52-73)
Jordan Anunoby drives, Stephen Haliburton stays with him. Jordan Anunoby attempts a Dunk. Contested by Stephen Haliburton (3.8 feet, ZONE). Jordan Anunoby misses. Offensive rebound by DeMar Adebayo! DeMar Adebayo kicks it out.

[04:30] Team_014 possession (Score: 52-73)
Ayo Murray attempts a Layup. Contested by Tyrese Doncic (4.8 feet, MAN). Ayo Murray misses. Offensive rebound by DeMar Adebayo! DeMar Adebayo kicks it out.

[04:18] Team_014 possession (Score: 52-73)
FOUL! Shooting foul on Vince Hyland. Lamelo Simmons to the line for 2 free throws. [Team fouls: 4] (Vince Hyland: 1 personal fouls)   FT 1/2: GOOD   FT 2/2: MISS Lamelo Simmons makes 1/2 from the line. Offensive rebound by Ayo Murray! Ayo Murray kicks it out.
Score: 53-73

[04:02] Team_014 possession (Score: 53-73)
FOUL! Shooting foul on Kyle Westbrook. Jordan Anunoby to the line for 2 free throws. [BONUS: 5 team fouls] (Kyle Westbrook: 1 personal fouls)   FT 1/2: GOOD   FT 2/2: GOOD Jordan Anunoby makes 2/2 from the line.
Score: 55-73

[03:49] Team_058 possession (Score: 55-73)
Kyle Westbrook drives to the basket... Kyle Westbrook throws a bad pass! Stolen by Jordan Anunoby! TURNOVER! (live ball)

[03:36] Team_014 possession (Score: 55-73)
DeMar Adebayo attempts a Layup. BLOCKED BY STEPHEN HALIBURTON! Ball deflects out of bounds off DeMar Adebayo.

[03:18] Team_058 possession (Score: 55-73)
Vince Hyland attempts a 3Pt. Contested by Jordan Anunoby (5.1 feet, ZONE). Vince Hyland misses. Rebound secured by Ayo Murray.

[03:02] Team_014 possession (Score: 55-73)
FOUL! Shooting foul on Stephen Haliburton. DeMar Adebayo to the line for 3 free throws. [BONUS: 6 team fouls] (Stephen Haliburton: 2 personal fouls)   FT 1/3: GOOD   FT 2/3: MISS   FT 3/3: MISS DeMar Adebayo makes 1/3 from the line. Rebound secured by Stephen Haliburton.
Score: 56-73

[02:47] Team_058 possession (Score: 56-73)
Kyle Westbrook drives, picks up Jordan Anunoby. Help arrives from Michael Cunningham! Kyle Westbrook attempts a Dunk. Contested by Michael Cunningham (5.0 feet, MAN). KYLE WESTBROOK MAKES IT! Assist: Bradley Sexton
Score: 56-75

[02:32] Team_014 possession (Score: 56-75)
Lamelo Simmons attempts a 3Pt. Contested by Vince Hyland (5.0 feet, MAN). LAMELO SIMMONS MAKES IT! Assist: Michael Cunningham
Score: 59-75

[02:16] Team_058 possession (Score: 59-75)
FOUL! Shooting foul on DeMar Adebayo. Stephen Haliburton to the line for 2 free throws. [Team fouls: 3] (DeMar Adebayo: 2 personal fouls)   FT 1/2: GOOD   FT 2/2: GOOD Stephen Haliburton makes 2/2 from the line.
Score: 59-77

[02:03] Team_014 possession (Score: 59-77)
Ayo Murray attempts a Midrange. Contested by Vince Hyland (5.0 feet, ZONE). AYO MURRAY MAKES IT!
Score: 61-77

[01:46] Team_058 possession (Score: 61-77)
Vince Hyland drives to the basket... Vince Hyland throws a bad pass out of bounds! TURNOVER! (dead ball)

[01:46] Substitution (Team_014): Michael Cunningham OUT → Jalen Booker IN (stamina_rule2)

[01:46] Substitution (Team_014): Jordan Anunoby OUT → Bones Quickley IN (stamina_rule2)

[01:46] Substitution (Team_014): Lamelo Simmons OUT → Tracy Westbrook IN (stamina_rule2)

[01:46] Substitution (Team_014): DeMar Adebayo OUT → Nikola James IN (stamina_rule2)

[01:46] Substitution (Team_014): Ayo Murray OUT → Collin Gasol IN (stamina_rule2)

[01:46] Substitution (Team_058): Bradley Sexton OUT → Draymond Williamson IN (stamina_rule2)

[01:46] Substitution (Team_058): Kyle Westbrook OUT → Jordan Ingram IN (stamina_rule2)

[01:46] Substitution (Team_058): Vince Hyland OUT → Pascal Holiday IN (stamina_rule2)

[01:46] Substitution (Team_058): Stephen Haliburton OUT → Shai Lowry IN (stamina_rule2)

[01:46] Substitution (Team_058): Tyrese Doncic OUT → Jarrett Gilgeous-Alexander IN (stamina_rule2)

[01:30] Team_014 possession (Score: 61-77)
Bones Quickley drives and kicks out. Bones Quickley attempts a 3Pt. Contested by Draymond Williamson (5.2 feet, ZONE). Bones Quickley misses. Rebound secured by Shai Lowry.

[01:16] Team_058 possession (Score: 61-77)
Jarrett Gilgeous-Alexander drives, Collin Gasol stays with him. Jarrett Gilgeous-Alexander attempts a Dunk. Contested by Collin Gasol (5.1 feet, ZONE). JARRETT GILGEOUS-ALEXANDER MAKES IT!
Score: 61-79

[01:06] Team_014 possession (Score: 61-79)
FOUL! Shooting foul on Shai Lowry. Collin Gasol to the line for 2 free throws. [BONUS: 7 team fouls] (Shai Lowry: 1 personal fouls)   FT 1/2: MISS   FT 2/2: MISS Collin Gasol makes 0/2 from the line. Rebound secured by Pascal Holiday.

[00:52] Team_058 possession (Score: 61-79)
Pascal Holiday attempts a 3Pt. Contested by Jalen Booker (4.3 feet, ZONE). PASCAL HOLIDAY MAKES IT! Assist: Jarrett Gilgeous-Alexander
Score: 61-82

[00:36] Team_014 possession (Score: 61-82)
FOUL! Shooting foul on Jarrett Gilgeous-Alexander. Collin Gasol to the line for 2 free throws. [BONUS: 8 team fouls] (Jarrett Gilgeous-Alexander: 1 personal fouls)   FT 1/2: GOOD   FT 2/2: GOOD Collin Gasol makes 2/2 from the line.
Score: 63-82

[00:23] Team_058 possession (Score: 63-82)
Jarrett Gilgeous-Alexander attempts a Layup. BLOCKED BY COLLIN GASOL! Ball deflects out of bounds off Jarrett Gilgeous-Alexander.

[00:09] Team_014 possession (Score: 63-82)
Collin Gasol attempts a Midrange. Contested by Jarrett Gilgeous-Alexander (5.8 feet, MAN). Collin Gasol misses. Rebound secured by Shai Lowry.

================================================================================
                              3RD QUARTER COMPLETE                              
================================================================================

3RD QUARTER SCORE: Team_014 29, Team_058 26

BOX SCORE:
================================================================================

Team_014
--------------------------------------------------------------------------------
Player                MIN  PTS  REB  AST  TO      FG   FG%      3P   3P%
--------------------------------------------------------------------------------
Ayo Murray             23    7    4    1   0   3/5    60.0     0/0   0.0
DeMar Adebayo          23    7    5    0   0   3/6    50.0     0/0   0.0
Jordan Anunoby         23    6    0    1   0   3/3   100.0     0/0   0.0
Lamelo Simmons         23    3    0    0   0   1/1   100.0     0/0   0.0
Michael Cunningham     23    2    0    2   0   1/2    50.0     0/0   0.0
Collin Gasol           13    2    0    0   0   1/3    33.3     0/0   0.0
Bones Quickley         13    0    0    0   0   0/1     0.0     0/0   0.0

TEAM: FG: 12/21 (57.1%), 3PT: 2/5 (40.0%), REB: 8 (5 off, 3 def), AST: 4, TO: 1
TEAM FOULS: 3


Team_058
--------------------------------------------------------------------------------
Player                MIN  PTS  REB  AST  TO      FG   FG%      3P   3P%
--------------------------------------------------------------------------------
Stephen Haliburton     23    9    2    0   0   4/4   100.0     0/0   0.0
Bradley Sexton         23    5    0    1   0   2/4    50.0     0/0   0.0
Kyle Westbrook         23    5    0    0   0   2/3    66.7     0/0   0.0
Pascal Holiday         13    3    1    0   0   1/1   100.0     0/0   0.0
Tyrese Doncic          23    2    4    2   0   1/2    50.0     0/0   0.0
Jarrett Gilgeous-Alexander   13    2    0    1   0   1/2    50.0     0/0   0.0
Vince Hyland           23    0    0    1   0   0/1     0.0     0/0   0.0
Shai Lowry             13    0    2    0   0   0/0     0.0     0/0   0.0

TEAM: FG: 11/17 (64.7%), 3PT: 3/5 (60.0%), REB: 10 (2 off, 8 def), AST: 5, TO: 4
TEAM FOULS: 8 [Team_014 in BONUS]

================================================================================

================================================================================
                       4TH QUARTER - Team_014 vs Team_058                       
================================================================================

[12:00] Substitution (Team_014): Michael Cunningham OUT (stamina: 78) → Jalen Booker IN (comeback_detected)

[12:00] Substitution (Team_058): Bradley Sexton OUT (stamina: 78) → Draymond Williamson IN (comeback_detected)

[12:00] Team_014 possession (Score: 63-82)
Jordan Anunoby attempts a 3Pt. Contested by Kyle Westbrook (4.4 feet, ZONE). Jordan Anunoby misses. Rebound secured by Vince Hyland.

[11:49] Team_058 possession (Score: 63-82)
Draymond Williamson makes the Layup and draws the foul on DeMar Adebayo! And-1! Draymond Williamson to the line for 1. [Team fouls: 1] (DeMar Adebayo: 1 personal fouls)   FT 1/1: GOOD Draymond Williamson makes 1/1 from the line.
Score: 63-85

[11:35] Team_014 possession (Score: 63-85)
FOUL! Holding foul on Stephen Haliburton. [Team fouls: 1] No free throws, side out. (Stephen Haliburton: 1 personal fouls)

[11:21] Team_014 possession (Score: 63-85)
Lamelo Simmons attempts a 3Pt. Contested by Kyle Westbrook (4.6 feet, ZONE). Lamelo Simmons misses. Rebound secured by Stephen Haliburton.

[11:08] Team_058 possession (Score: 63-85)
Stephen Haliburton attempts a 3Pt. Contested by Jordan Anunoby (4.9 feet, ZONE). STEPHEN HALIBURTON MAKES IT! Assist: Tyrese Doncic
Score: 63-88

[10:52] Team_014 possession (Score: 63-88)
Jordan Anunoby attempts a 3Pt. Contested by Kyle Westbrook (4.5 feet, MAN). Jordan Anunoby misses. Rebound secured by Stephen Haliburton.

[10:36] Team_058 possession (Score: 63-88)
Draymond Williamson attempts a 3Pt. Contested by Jordan Anunoby (5.3 feet, ZONE). Draymond Williamson misses. Rebound secured by DeMar Adebayo.

[10:21] Team_014 possession (Score: 63-88)
Jordan Anunoby drives, picks up Stephen Haliburton. Help arrives from Kyle Westbrook! Jordan Anunoby attempts a Dunk. Contested by Kyle Westbrook (4.0 feet, ZONE). Jordan Anunoby misses. Rebound secured by Stephen Haliburton.

[10:05] Team_058 possession (Score: 63-88)
Tyrese Doncic commits a violation (traveling/carry)! TURNOVER! (dead ball)

[10:05] Substitution (Team_014): Lamelo Simmons OUT → Tracy Westbrook IN (stamina_rule2)

[10:05] Substitution (Team_058): Kyle Westbrook OUT → Jordan Ingram IN (stamina_rule2)

[10:05] Substitution (Team_058): Stephen Haliburton OUT → Shai Lowry IN (stamina_rule2)

[09:52] Team_014 possession (Score: 63-88)
Jalen Booker attempts a 3Pt. Contested by Draymond Williamson (5.3 feet, MAN). Jalen Booker misses. Rebound secured by Shai Lowry.

[09:38] Team_058 possession (Score: 63-88)
Jordan Ingram throws a bad pass out of bounds! TURNOVER! (dead ball)

[09:38] Substitution (Team_014): Jordan Anunoby OUT → Bones Quickley IN (stamina_rule2)

[09:38] Substitution (Team_014): DeMar Adebayo OUT → Nikola James IN (stamina_rule2)

[09:38] Substitution (Team_014): Ayo Murray OUT → Collin Gasol IN (stamina_rule2)

[09:38] Substitution (Team_058): Tyrese Doncic OUT → Jarrett Gilgeous-Alexander IN (stamina_rule2)

[09:27] Team_014 possession (Score: 63-88)
Tracy Westbrook attempts a 3Pt. Contested by Draymond Williamson (4.9 feet, ZONE). TRACY WESTBROOK MAKES IT! Assist: Jalen Booker
Score: 66-88

[09:14] Team_058 possession (Score: 66-88)
Draymond Williamson drives, picks up Collin Gasol. Help arrives from Jalen Booker! Draymond Williamson attempts a Layup. Contested by Jalen Booker (5.5 feet, ZONE). Draymond Williamson misses. Rebound secured by Collin Gasol.

[08:58] Team_014 possession (Score: 66-88)
Tracy Westbrook attempts a 3Pt. Contested by Vince Hyland (4.5 feet, MAN). Tracy Westbrook misses. FOUL! Loose ball foul on Jarrett Gilgeous-Alexander during the rebound battle. [Team fouls: 2] No free throws, side out. (Jarrett Gilgeous-Alexander: 1 personal fouls)

[08:39] Team_014 possession (Score: 66-88)
Nikola James drives, picks up Shai Lowry. Help arrives from Jordan Ingram! Nikola James attempts a Dunk. Contested by Jordan Ingram (4.1 feet, ZONE). NIKOLA JAMES MAKES IT! Assist: Jalen Booker
Score: 68-88

[08:27] Team_058 possession (Score: 68-88)
Jarrett Gilgeous-Alexander attempts a 3Pt. Contested by Collin Gasol (5.1 feet, MAN). JARRETT GILGEOUS-ALEXANDER MAKES IT! Assist: Vince Hyland
Score: 68-91

[08:14] Team_014 possession (Score: 68-91)
FOUL! Reach-in foul on Draymond Williamson during the drive. [Team fouls: 3] No free throws, side out. (Draymond Williamson: 1 personal fouls)

[07:55] Team_014 possession (Score: 68-91)
Nikola James drives, Shai Lowry stays with him. Nikola James attempts a Dunk. Contested by Shai Lowry (4.1 feet, MAN). Nikola James misses. Rebound secured by Shai Lowry.

[07:43] Team_058 possession (Score: 68-91)
Jarrett Gilgeous-Alexander attempts a 3Pt. Contested by Jalen Booker (4.2 feet, ZONE). JARRETT GILGEOUS-ALEXANDER MAKES IT! Assist: Vince Hyland
Score: 68-94

[07:31] Team_014 possession (Score: 68-94)
Bones Quickley attempts a Layup. Contested by Shai Lowry (3.9 feet, ZONE). BONES QUICKLEY MAKES IT!
Score: 70-94

[07:16] Team_058 possession (Score: 70-94)
Draymond Williamson attempts a Layup. Contested by Collin Gasol (5.5 feet, ZONE). DRAYMOND WILLIAMSON MAKES IT! Assist: Jordan Ingram
Score: 70-96

[07:05] Team_014 possession (Score: 70-96)
Nikola James drives, Shai Lowry stays with him. Nikola James attempts a Dunk. Contested by Shai Lowry (4.1 feet, ZONE). Nikola James misses. Rebound secured by Shai Lowry.

[06:55] Team_058 possession (Score: 70-96)
FOUL! Shooting foul on Nikola James. Shai Lowry to the line for 2 free throws. [Team fouls: 2] (Nikola James: 1 personal fouls)   FT 1/2: GOOD   FT 2/2: GOOD Shai Lowry makes 2/2 from the line.
Score: 70-98

[06:44] Team_014 possession (Score: 70-98)
Collin Gasol attempts a Layup. Contested by Jarrett Gilgeous-Alexander (5.8 feet, MAN). COLLIN GASOL MAKES IT!
Score: 72-98

[06:30] Team_058 possession (Score: 72-98)
Vince Hyland attempts a Layup. Contested by Collin Gasol (5.3 feet, ZONE). VINCE HYLAND MAKES IT! Assist: Draymond Williamson
Score: 72-100

[06:17] Team_014 possession (Score: 72-100)
Collin Gasol commits a violation (traveling/carry)! TURNOVER! (dead ball)

[06:17] Substitution (Team_058): Vince Hyland OUT → Pascal Holiday IN (stamina_rule2)

[06:00] Team_058 possession (Score: 72-100)
Draymond Williamson makes the Layup and draws the foul on Jalen Booker! And-1! Draymond Williamson to the line for 1. [Team fouls: 3] (Jalen Booker: 1 personal fouls)   FT 1/1: GOOD Draymond Williamson makes 1/1 from the line.
Score: 72-103

[05:50] Team_014 possession (Score: 72-103)
Bones Quickley attempts a 3Pt. Contested by Jordan Ingram (5.8 feet, MAN). Bones Quickley misses. Offensive rebound by Collin Gasol! Collin Gasol puts it back in!
Score: 74-103

[05:34] Team_058 possession (Score: 74-103)
Jordan Ingram attempts a 3Pt. Contested by Bones Quickley (5.6 feet, MAN). Jordan Ingram misses. Rebound secured by Tracy Westbrook.

[05:19] Team_014 possession (Score: 74-103)
Nikola James attempts a 3Pt. Contested by Shai Lowry (4.1 feet, MAN). Nikola James misses. Rebound secured by Shai Lowry.

[05:03] Team_058 possession (Score: 74-103)
Pascal Holiday attempts a 3Pt. Contested by Bones Quickley (5.6 feet, ZONE). Pascal Holiday misses. Rebound secured by Nikola James.

[04:51] Team_014 possession (Score: 74-103)
Tracy Westbrook attempts a 3Pt. Contested by Pascal Holiday (4.2 feet, MAN). Tracy Westbrook misses. Rebound secured by Shai Lowry.

[04:38] Team_058 possession (Score: 74-103)
Jarrett Gilgeous-Alexander attempts a Midrange. Contested by Collin Gasol (5.1 feet, MAN). JARRETT GILGEOUS-ALEXANDER MAKES IT!
Score: 74-105

[04:25] Team_014 possession (Score: 74-105)
Tracy Westbrook throws a bad pass! Stolen by Pascal Holiday! TURNOVER! (live ball)

[04:10] Team_058 possession (Score: 74-105)
Draymond Williamson attempts a Midrange. Contested by Nikola James (5.5 feet, ZONE). DRAYMOND WILLIAMSON MAKES IT! Assist: Jarrett Gilgeous-Alexander
Score: 74-107

[03:54] Team_014 possession (Score: 74-107)
Jalen Booker drives and kicks out. Jalen Booker attempts a 3Pt. Contested by Draymond Williamson (5.5 feet, MAN). Jalen Booker misses. Rebound secured by Shai Lowry.

[03:41] Team_058 possession (Score: 74-107)
FOUL! Holding foul on Jalen Booker. [Team fouls: 4] No free throws, side out. (Jalen Booker: 2 personal fouls)

[03:30] Team_058 possession (Score: 74-107)
Shai Lowry attempts a Midrange. Contested by Bones Quickley (5.5 feet, ZONE). Shai Lowry misses. Rebound secured by Collin Gasol.

[03:15] Team_014 possession (Score: 74-107)
Jalen Booker drives, picks up Draymond Williamson. Help arrives from Pascal Holiday! Jalen Booker attempts a Layup. Contested by Pascal Holiday (5.6 feet, MAN). Jalen Booker misses. Offensive rebound by Collin Gasol! Collin Gasol puts it back in!
Score: 76-107

[03:01] Team_058 possession (Score: 76-107)
Shai Lowry attempts a 3Pt. Contested by Bones Quickley (5.5 feet, ZONE). Shai Lowry misses. Rebound secured by Tracy Westbrook.

[02:49] Team_014 possession (Score: 76-107)
Collin Gasol drives and kicks out. Nikola James attempts a 3Pt. Contested by Shai Lowry (4.3 feet, MAN). Nikola James misses. Rebound secured by Jarrett Gilgeous-Alexander.

[02:37] Team_058 possession (Score: 76-107)
Jordan Ingram drives and kicks out. Jarrett Gilgeous-Alexander attempts a 3Pt. Contested by Collin Gasol (5.3 feet, MAN). Jarrett Gilgeous-Alexander misses. Rebound secured by Nikola James.

[02:20] Team_014 possession (Score: 76-107)
Jalen Booker attempts a 3Pt. Contested by Draymond Williamson (5.7 feet, ZONE). Jalen Booker misses. FOUL! Loose ball foul on Pascal Holiday during the rebound battle. [Team fouls: 4] No free throws, side out. (Pascal Holiday: 1 personal fouls)

[02:06] Team_014 possession (Score: 76-107)
FOUL! Holding foul on Draymond Williamson. [IN THE BONUS! 5 team fouls] Jalen Booker to the line for 2 free throws. (Draymond Williamson: 2 personal fouls)   FT 1/2: GOOD   FT 2/2: GOOD Jalen Booker makes 2/2 from the line.
Score: 78-107

[01:54] Team_058 possession (Score: 78-107)
Shai Lowry attempts a Layup. BLOCKED BY NIKOLA JAMES! Ball is loose! Offensive rebound by Shai Lowry! Shai Lowry kicks it out.

[01:39] Team_058 possession (Score: 78-107)
Jarrett Gilgeous-Alexander attempts a 3Pt. Contested by Bones Quickley (5.6 feet, ZONE). JARRETT GILGEOUS-ALEXANDER MAKES IT! Assist: Pascal Holiday
Score: 78-110

[01:27] Team_014 possession (Score: 78-110)
Bones Quickley attempts a Midrange. Wide open! Jordan Ingram is 6.1 feet away. [MAN] BONES QUICKLEY MAKES IT! Assist: Tracy Westbrook
Score: 80-110

[01:18] Team_058 possession (Score: 80-110)
FOUL! Reach-in foul on Jalen Booker during the drive. [IN THE BONUS! 5 team fouls] Draymond Williamson to the line for 2 free throws. (Jalen Booker: 3 personal fouls)   FT 1/2: MISS   FT 2/2: GOOD Draymond Williamson makes 1/2 from the line.
Score: 80-111

[00:58] Team_014 possession (Score: 80-111)
Bones Quickley attempts a 3Pt. Wide open! Jordan Ingram is 6.1 feet away. [MAN] Bones Quickley misses. Rebound secured by Pascal Holiday.

[00:46] Team_058 possession (Score: 80-111)
Draymond Williamson attempts a 3Pt. Contested by Jalen Booker (5.4 feet, MAN). DRAYMOND WILLIAMSON MAKES IT! Assist: Shai Lowry
Score: 80-114

[00:31] Team_014 possession (Score: 80-114)
Nikola James attempts a Midrange. Contested by Shai Lowry (4.7 feet, MAN). Nikola James misses. Rebound secured by Shai Lowry.

[00:14] Team_058 possession (Score: 80-114)
Shai Lowry drives to the basket... Shai Lowry throws a bad pass out of bounds! TURNOVER! (dead ball)

[00:14] Substitution (Team_014): Jalen Booker OUT → Michael Cunningham IN (starter_return_rule1)

[00:14] Substitution (Team_058): Draymond Williamson OUT → Bradley Sexton IN (starter_return_rule1)

================================================================================
                              4TH QUARTER COMPLETE                              
================================================================================

4TH QUARTER SCORE: Team_014 17, Team_058 32

BOX SCORE:
================================================================================

Team_014
--------------------------------------------------------------------------------
Player                MIN  PTS  REB  AST  TO      FG   FG%      3P   3P%
--------------------------------------------------------------------------------
Collin Gasol           22    6    4    0   0   3/4    75.0     0/0   0.0
Bones Quickley         23    4    0    0   0   2/3    66.7     0/0   0.0
Tracy Westbrook        23    3    2    1   0   1/2    50.0     0/0   0.0
Jalen Booker           25    2    0    2   0   1/3    33.3     0/0   0.0
Nikola James           23    2    4    0   0   1/5    20.0     0/0   0.0
Jordan Anunoby         25    0    0    0   0   0/3     0.0     0/0   0.0
Lamelo Simmons         25    0    0    0   0   0/1     0.0     0/0   0.0
DeMar Adebayo          25    0    1    0   0   0/0     0.0     0/0   0.0

TEAM: FG: 8/21 (38.1%), 3PT: 2/9 (22.2%), REB: 11 (4 off, 7 def), AST: 3, TO: 2
TEAM FOULS: 5 [Team_058 in BONUS]


Team_058
--------------------------------------------------------------------------------
Player                MIN  PTS  REB  AST  TO      FG   FG%      3P   3P%
--------------------------------------------------------------------------------
Draymond Williamson    25   14    0    1   0   6/8    75.0     0/0   0.0
Jarrett Gilgeous-Alexander   22   11    1    1   0   4/4   100.0     0/0   0.0
Stephen Haliburton     25    3    3    0   0   1/1   100.0     0/0   0.0
Vince Hyland           29    2    1    2   0   1/1   100.0     0/0   0.0
Shai Lowry             23    2    8    1   0   1/3    33.3     0/0   0.0
Tyrese Doncic          26    0    0    1   0   0/0     0.0     0/0   0.0
Jordan Ingram          23    0    0    1   0   0/2     0.0     0/0   0.0
Pascal Holiday         19    0    1    1   0   0/1     0.0     0/0   0.0

TEAM: FG: 13/20 (65.0%), 3PT: 5/9 (55.6%), REB: 14 (1 off, 13 def), AST: 8, TO: 3
TEAM FOULS: 5 [Team_014 in BONUS]

================================================================================

================================================================================
                               FULL GAME COMPLETE                               
================================================================================

FINAL SCORE: Team_014 80, Team_058 114

SCORING BY QUARTER:
--------------------------------------------------------------------------------
Team                     Q1     Q2     Q3     Q4    FINAL
--------------------------------------------------------------------------------
Team_014                 19     15     29     17       80
Team_058                 19     37     26     32      114
--------------------------------------------------------------------------------

FULL GAME BOX SCORE:
================================================================================

Team_014
--------------------------------------------------------------------------------
Player                MIN  PTS  REB  AST  TO      FG   FG%      3P   3P%      FT STL BLK
--------------------------------------------------------------------------------
Ayo Murray             26   10    6    2   0   6/9    66.7   1/1   100.0   0/0     0   0
Jordan Anunoby         25    6    0    3   2   2/7    28.6   0/4     0.0   2/2     2   0
DeMar Adebayo          25   14   13    0   1   6/13   46.2   1/5    20.0   2/4     0   1
Lamelo Simmons         25    5    0    1   1   2/3    66.7   1/2    50.0   1/2     0   0
Jalen Booker           25    4    0    2   1   3/6    50.0   1/3    33.3   2/2     0   0
Michael Cunningham     23    7    2    4   0   2/8    25.0   1/6    16.7   2/2     0   1
Tracy Westbrook        23   11    3    1   1   4/7    57.1   3/4    75.0   0/0     1   0
Bones Quickley         23    4    0    1   1   3/6    50.0   1/2    50.0   0/0     0   0
Nikola James           23    2   10    1   1   2/11   18.2   0/1     0.0   0/1     0   2
Collin Gasol           22   13    8    0   1   3/8    37.5   0/0     0.0   3/6     0   1

TEAM: FG: 34/79 (43.0%), 3PT: 9/28 (32.1%), REB: 39 (18 off, 21 def), AST: 15, TO: 9


Team_058
--------------------------------------------------------------------------------
Player                MIN  PTS  REB  AST  TO      FG   FG%      3P   3P%      FT STL BLK
--------------------------------------------------------------------------------
Vince Hyland           29   12    1    3   1   5/9    55.6   2/3    66.7   0/2     0   0
Tyrese Doncic          26   10   10    4   2   5/6    83.3   1/1   100.0   2/3     0   0
Kyle Westbrook         25    7    0    0   2   3/4    75.0   1/1   100.0   0/0     1   0
Stephen Haliburton     25   12   10    0   3   4/6    66.7   1/3    33.3   4/4     0   1
Draymond Williamson    25   24    0    1   1   9/13   69.2   3/6    50.0   5/6     0   0
Bradley Sexton         23    9    5    2   1   4/9    44.4   1/4    25.0   4/5     0   0
Jordan Ingram          23    3    0    2   2   1/5    20.0   1/3    33.3   0/0     0   0
Shai Lowry             23    2   18    4   0   1/4    25.0   0/1     0.0   2/2     1   1
Jarrett Gilgeous-Alexander   22   20    3    3   0   8/10   80.0   3/3   100.0   3/3     0   0
Pascal Holiday         19   13    6    1   1   5/7    71.4   3/4    75.0   0/0     1   0

TEAM: FG: 45/73 (61.6%), 3PT: 16/29 (55.2%), REB: 55 (11 off, 44 def), AST: 20, TO: 13

================================================================================
