================================================================================
                        FULL GAME - Team_061 vs Team_043                        
================================================================================

================================================================================
                       1ST QUARTER - Team_061 vs Team_043                       
================================================================================

[12:00] Team_061 possession (Score: 0-0)
Michael Russell drives, Manu Carter stays with him. Michael Russell attempts a Layup. Contested by Manu Carter (4.5 feet, ZONE). MICHAEL RUSSELL MAKES IT!
Score: 2-0

[11:45] Team_043 possession (Score: 2-0)
Dwyane Dosunmu makes the Layup and draws the foul on Draymond Banchero! And-1! Dwyane Dosunmu to the line for 1. [Team fouls: 1] (Draymond Banchero: 1 personal fouls)   FT 1/1: GOOD Dwyane Dosunmu makes 1/1 from the line.
Score: 2-3

[11:29] Team_061 possession (Score: 2-3)
Michael Russell attempts a 3Pt. Contested by D'Angelo Iverson (3.2 feet, MAN). Michael Russell misses. Rebound secured by Manu Carter.

[11:15] Team_043 possession (Score: 2-3)
Manu Carter drives, picks up Draymond Banchero. Help arrives from Jayson Holiday! Manu Carter attempts a Layup. Contested by Jayson Holiday (3.1 feet, ZONE). MANU CARTER MAKES IT! Assist: Dwyane Dosunmu
Score: 2-5

[10:58] Team_061 possession (Score: 2-5)
Michael Russell attempts a 3Pt. Contested by D'Angelo Iverson (3.2 feet, ZONE). Michael Russell misses. Rebound secured by D'Angelo Iverson.

[10:45] Team_043 possession (Score: 2-5)
Malcolm Murray attempts a Midrange. Contested by Brandon Russell (4.0 feet, ZONE). Malcolm Murray misses. Rebound secured by Bam Sexton.

[10:32] Team_061 possession (Score: 2-5)
Jayson Holiday drives to the basket... Jayson Holiday throws a bad pass out of bounds! TURNOVER! (dead ball)

[10:19] Team_043 possession (Score: 2-5)
D'Angelo Iverson attempts a Midrange. Contested by Bam Sexton (4.9 feet, ZONE). D'ANGELO IVERSON MAKES IT! Assist: Dwyane Dosunmu
Score: 2-7

[10:01] Team_061 possession (Score: 2-7)
Draymond Banchero drives, Manu Carter stays with him. Draymond Banchero attempts a Layup. Contested by Manu Carter (4.8 feet, ZONE). Draymond Banchero misses. Rebound secured by Manu Carter.

[09:44] Team_043 possession (Score: 2-7)
Malcolm Murray drives to the basket... Malcolm Murray throws a bad pass! Stolen by Draymond Banchero! TURNOVER! (live ball)

[09:35] Team_061 possession (Score: 2-7)
Brandon Russell attempts a Midrange. Contested by Malcolm Murray (3.9 feet, MAN). Brandon Russell misses. Offensive rebound by Draymond Banchero! Draymond Banchero puts it back in!
Score: 4-7

[09:21] Team_043 possession (Score: 4-7)
FOUL! Reach-in foul on Draymond Banchero during the drive. [Team fouls: 2] No free throws, side out. (Draymond Banchero: 2 personal fouls)

[09:12] Team_043 possession (Score: 4-7)
Magic Durant attempts a Layup. BLOCKED BY JAYSON HOLIDAY! Ball deflects out of bounds off Magic Durant.

[09:00] Team_061 possession (Score: 4-7)
Brandon Russell attempts a Layup. Contested by Malcolm Murray (3.9 feet, MAN). Brandon Russell misses. Rebound secured by Manu Carter.

[08:45] Team_043 possession (Score: 4-7)
Magic Durant throws a bad pass out of bounds! TURNOVER! (dead ball)

[08:28] Team_061 possession (Score: 4-7)
Brandon Russell attempts a Midrange. Contested by Malcolm Murray (3.9 feet, MAN). BRANDON RUSSELL MAKES IT! Assist: Draymond Banchero
Score: 6-7

[08:14] Team_043 possession (Score: 6-7)
D'Angelo Iverson drives to the basket... D'Angelo Iverson throws a bad pass! Stolen by Draymond Banchero! TURNOVER! (live ball)

[07:58] Team_061 possession (Score: 6-7)
Jayson Holiday attempts a 3Pt. Contested by Magic Durant (5.5 feet, MAN). JAYSON HOLIDAY MAKES IT! Assist: Brandon Russell
Score: 9-7

[07:42] Team_043 possession (Score: 9-7)
D'Angelo Iverson attempts a 3Pt. Contested by Michael Russell (3.8 feet, MAN). D'Angelo Iverson misses. FOUL! Loose ball foul on Michael Russell during the rebound battle. [Team fouls: 3] No free throws, side out. (Michael Russell: 1 personal fouls)

[07:27] Team_043 possession (Score: 9-7)
Magic Durant attempts a 3Pt. Contested by Brandon Russell (3.9 feet, ZONE). MAGIC DURANT MAKES IT! Assist: Malcolm Murray
Score: 9-10

[07:08] Team_061 possession (Score: 9-10)
Bam Sexton attempts a Midrange. Contested by Manu Carter (4.6 feet, MAN). Bam Sexton misses. Rebound secured by D'Angelo Iverson.

[06:54] Team_043 possession (Score: 9-10)
Magic Durant attempts a 3Pt. Contested by Jayson Holiday (4.0 feet, MAN). Magic Durant misses. Rebound secured by Bam Sexton.

[06:40] Team_061 possession (Score: 9-10)
Bam Sexton drives and kicks out. Draymond Banchero attempts a 3Pt. Contested by D'Angelo Iverson (2.9 feet, ZONE). DRAYMOND BANCHERO MAKES IT! Assist: Brandon Russell
Score: 12-10

[06:28] Team_043 possession (Score: 12-10)
FOUL! Shooting foul on Draymond Banchero. Dwyane Dosunmu to the line for 2 free throws. [Team fouls: 4] (Draymond Banchero: 3 personal fouls)   FT 1/2: GOOD   FT 2/2: GOOD Dwyane Dosunmu makes 2/2 from the line.
Score: 12-12

[06:15] Team_061 possession (Score: 12-12)
Jayson Holiday commits a violation (traveling/carry)! TURNOVER! (dead ball)

[06:00] Team_043 possession (Score: 12-12)
Magic Durant attempts a Midrange. Contested by Jayson Holiday (4.0 feet, MAN). MAGIC DURANT MAKES IT!
Score: 12-14

[05:49] Team_061 possession (Score: 12-14)
Brandon Russell drives and kicks out. Michael Russell attempts a Midrange. Contested by D'Angelo Iverson (2.9 feet, ZONE). Michael Russell misses. Rebound secured by D'Angelo Iverson.

[05:37] Team_043 possession (Score: 12-14)
FOUL! Shooting foul on Michael Russell. Magic Durant to the line for 2 free throws. [BONUS: 5 team fouls] (Michael Russell: 2 personal fouls)   FT 1/2: GOOD   FT 2/2: GOOD Magic Durant makes 2/2 from the line.
Score: 12-16

[05:24] Team_061 possession (Score: 12-16)
Jayson Holiday attempts a 3Pt. Contested by D'Angelo Iverson (3.3 feet, ZONE). JAYSON HOLIDAY MAKES IT! Assist: Bam Sexton
Score: 15-16

[05:13] Team_043 possession (Score: 15-16)
FOUL! Shooting foul on Draymond Banchero. Dwyane Dosunmu to the line for 2 free throws. [BONUS: 6 team fouls] (Draymond Banchero: 4 personal fouls)   FT 1/2: GOOD   FT 2/2: MISS Dwyane Dosunmu makes 1/2 from the line. Offensive rebound by Manu Carter! Manu Carter kicks it out.
Score: 15-17

[04:57] Team_043 possession (Score: 15-17)
Magic Durant attempts a 3Pt. Contested by Jayson Holiday (4.0 feet, MAN). Magic Durant misses. Offensive rebound by D'Angelo Iverson! D'Angelo Iverson kicks it out.

[04:42] Team_043 possession (Score: 15-17)
D'Angelo Iverson attempts a Midrange. Contested by Michael Russell (3.9 feet, ZONE). D'Angelo Iverson misses. Rebound secured by Draymond Banchero.

[04:26] Team_061 possession (Score: 15-17)
Draymond Banchero drives and kicks out. Jayson Holiday attempts a 3Pt. Contested by Magic Durant (5.2 feet, MAN). JAYSON HOLIDAY MAKES IT! Assist: Bam Sexton
Score: 18-17

[04:08] Team_043 possession (Score: 18-17)
D'Angelo Iverson loses control! Ball rolls out of bounds! TURNOVER! (dead ball)

[03:57] Team_061 possession (Score: 18-17)
Jayson Holiday drives and kicks out. Michael Russell attempts a Midrange. Contested by Manu Carter (4.3 feet, ZONE). Michael Russell misses. Rebound secured by D'Angelo Iverson.

[03:44] Team_043 possession (Score: 18-17)
FOUL! Reach-in foul on Bam Sexton during the drive. [IN THE BONUS! 7 team fouls] Manu Carter to the line for 2 free throws. (Bam Sexton: 1 personal fouls)   FT 1/2: GOOD   FT 2/2: GOOD Manu Carter makes 2/2 from the line.
Score: 18-19

[03:33] Team_061 possession (Score: 18-19)
Draymond Banchero attempts a Layup. Contested by Manu Carter (5.0 feet, MAN). DRAYMOND BANCHERO MAKES IT! Assist: Michael Russell
Score: 20-19

[03:19] Team_043 possession (Score: 20-19)
FOUL! Shooting foul on Draymond Banchero. Manu Carter to the line for 2 free throws. [BONUS: 8 team fouls] (Draymond Banchero: 5 personal fouls)   FT 1/2: GOOD   FT 2/2: GOOD Manu Carter makes 2/2 from the line.
Score: 20-21

[03:03] Team_061 possession (Score: 20-21)
FOUL! Shooting foul on D'Angelo Iverson. Michael Russell to the line for 3 free throws. [Team fouls: 1] (D'Angelo Iverson: 1 personal fouls)   FT 1/3: GOOD   FT 2/3: GOOD   FT 3/3: GOOD Michael Russell makes 3/3 from the line.
Score: 23-21

[02:48] Team_043 possession (Score: 23-21)
Manu Carter attempts a Midrange. Contested by Bam Sexton (5.5 feet, MAN). MANU CARTER MAKES IT! Assist: Malcolm Murray
Score: 23-23

[02:32] Team_061 possession (Score: 23-23)
Michael Russell attempts a Layup. Contested by D'Angelo Iverson (3.4 feet, MAN). MICHAEL RUSSELL MAKES IT! Assist: Bam Sexton
Score: 25-23

[02:17] Team_043 possession (Score: 25-23)
Dwyane Dosunmu drives, Draymond Banchero stays with him. Dwyane Dosunmu attempts a Layup. Contested by Draymond Banchero (2.9 feet, ZONE). Dwyane Dosunmu misses. Rebound secured by Bam Sexton.

[02:02] Team_061 possession (Score: 25-23)
Draymond Banchero attempts a Midrange. Wide open! Magic Durant is 6.1 feet away. [ZONE] DRAYMOND BANCHERO MAKES IT!
Score: 27-23

[01:48] Team_043 possession (Score: 27-23)
Dwyane Dosunmu attempts a Layup. Contested by Draymond Banchero (2.9 feet, MAN). Dwyane Dosunmu misses. Offensive rebound by Manu Carter! Manu Carter kicks it out.

[01:33] Team_043 possession (Score: 27-23)
Dwyane Dosunmu drives and kicks out. Manu Carter attempts a Midrange. BLOCKED BY JAYSON HOLIDAY! Ball is loose! Rebound secured by Bam Sexton.

[01:19] Team_061 possession (Score: 27-23)
Michael Russell attempts a 3Pt. Contested by D'Angelo Iverson (3.6 feet, MAN). Michael Russell misses. Rebound secured by Manu Carter.

[01:07] Team_043 possession (Score: 27-23)
D'Angelo Iverson drives to the basket... D'Angelo Iverson loses the ball! Stripped by Draymond Banchero! TURNOVER! (live ball)

[00:52] Team_061 possession (Score: 27-23)
Michael Russell attempts a 3Pt. Contested by D'Angelo Iverson (3.6 feet, ZONE). Michael Russell misses. Rebound secured by Manu Carter.

[00:38] Team_043 possession (Score: 27-23)
D'Angelo Iverson attempts a Midrange. Contested by Michael Russell (4.3 feet, MAN). D'Angelo Iverson misses. Rebound secured by Bam Sexton.

[00:23] Team_061 possession (Score: 27-23)
Brandon Russell attempts a Midrange. Contested by Malcolm Murray (4.4 feet, MAN). Brandon Russell misses. Rebound secured by Manu Carter.

[00:05] Team_043 possession (Score: 27-23)
D'Angelo Iverson attempts a 3Pt. Contested by Brandon Russell (4.4 feet, ZONE). D'Angelo Iverson misses. Rebound secured by Bam Sexton.

================================================================================
                              1ST QUARTER COMPLETE                              
================================================================================

1ST QUARTER SCORE: Team_061 27, Team_043 23

BOX SCORE:
================================================================================

Team_061
--------------------------------------------------------------------------------
Player                MIN  PTS  REB  AST  TO      FG   FG%      3P   3P%
--------------------------------------------------------------------------------
Draymond Banchero      12    9    2    1   0   4/5    80.0     0/0   0.0
Jayson Holiday         12    9    0    0   0   3/4    75.0     0/0   0.0
Michael Russell        12    7    0    1   0   3/7    42.9     0/0   0.0
Brandon Russell        12    2    0    2   0   1/4    25.0     0/0   0.0
Bam Sexton             12    0    6    3   0   0/1     0.0     0/0   0.0

TEAM: FG: 11/21 (52.4%), 3PT: 3/7 (42.9%), REB: 8 (1 off, 7 def), AST: 7, TO: 2
TEAM FOULS: 8 [Team_043 in BONUS]


Team_043
--------------------------------------------------------------------------------
Player                MIN  PTS  REB  AST  TO      FG   FG%      3P   3P%
--------------------------------------------------------------------------------
Manu Carter            12    8    9    0   0   4/4   100.0     0/0   0.0
Magic Durant           12    7    0    0   0   3/5    60.0     0/0   0.0
Dwyane Dosunmu         12    5    0    2   0   2/4    50.0     0/0   0.0
D'Angelo Iverson       12    2    5    0   0   1/4    25.0     0/0   0.0
Malcolm Murray         12    0    0    2   0   0/1     0.0     0/0   0.0

TEAM: FG: 10/18 (55.6%), 3PT: 1/3 (33.3%), REB: 14 (4 off, 10 def), AST: 4, TO: 5
TEAM FOULS: 1

================================================================================

================================================================================
                       2ND QUARTER - Team_061 vs Team_043                       
================================================================================

[12:00] Team_061 possession (Score: 27-23)
Jayson Holiday attempts a 3Pt. Contested by Malcolm Murray (4.4 feet, ZONE). Jayson Holiday misses. Rebound secured by Manu Carter.

[11:46] Team_043 possession (Score: 27-23)
Manu Carter attempts a Layup. BLOCKED BY DRAYMOND BANCHERO! Ball is loose! Offensive rebound by D'Angelo Iverson! D'Angelo Iverson kicks it out.

[11:36] Team_043 possession (Score: 27-23)
D'Angelo Iverson attempts a 3Pt. Contested by Jayson Holiday (4.4 feet, ZONE). D'Angelo Iverson misses. Rebound secured by Draymond Banchero.

[11:23] Team_061 possession (Score: 27-23)
Brandon Russell attempts a Midrange. Contested by Magic Durant (5.7 feet, ZONE). Brandon Russell misses. Rebound secured by Manu Carter.

[11:07] Team_043 possession (Score: 27-23)
FOUL! Reach-in foul on Draymond Banchero during the drive. [Team fouls: 1] No free throws, side out. (Draymond Banchero: 1 personal fouls)

[10:50] Team_043 possession (Score: 27-23)
Dwyane Dosunmu drives and kicks out. Dwyane Dosunmu attempts a Midrange. Contested by Draymond Banchero (3.1 feet, MAN). DWYANE DOSUNMU MAKES IT!
Score: 27-25

[10:37] Team_061 possession (Score: 27-25)
Bam Sexton attempts a Midrange. Contested by Manu Carter (5.1 feet, ZONE). BAM SEXTON MAKES IT! Assist: Brandon Russell
Score: 29-25

[10:25] Team_043 possession (Score: 29-25)
Magic Durant drives to the basket... Magic Durant loses the ball! Stripped by Jayson Holiday! TURNOVER! (live ball)

[10:11] Team_061 possession (Score: 29-25)
FOUL! Reach-in foul on D'Angelo Iverson during the drive. [Team fouls: 1] No free throws, side out. (D'Angelo Iverson: 1 personal fouls)

[09:56] Team_061 possession (Score: 29-25)
Draymond Banchero loses control! Ball rolls out of bounds! TURNOVER! (dead ball)

[09:56] Substitution (Team_061): Brandon Russell OUT → Evan Rose IN (stamina_rule2)

[09:56] Substitution (Team_061): Jayson Holiday OUT → Gary Fox IN (stamina_rule2)

[09:56] Substitution (Team_061): Michael Russell OUT → Desmond Morant IN (stamina_rule2)

[09:56] Substitution (Team_061): Bam Sexton OUT → Stephen Towns IN (stamina_rule2)

[09:56] Substitution (Team_061): Draymond Banchero OUT → Tim Durant IN (stamina_rule2)

[09:56] Substitution (Team_043): Malcolm Murray OUT → Jabari Holiday IN (stamina_rule2)

[09:56] Substitution (Team_043): Magic Durant OUT → Ben LaVine IN (stamina_rule2)

[09:56] Substitution (Team_043): D'Angelo Iverson OUT → Dirk Herro IN (stamina_rule2)

[09:56] Substitution (Team_043): Manu Carter OUT → Joel Murray IN (stamina_rule2)

[09:56] Substitution (Team_043): Dwyane Dosunmu OUT → Terry Randle IN (stamina_rule2)

[09:43] Team_043 possession (Score: 29-25)
Terry Randle attempts a Layup. Contested by Tim Durant (4.5 feet, ZONE). TERRY RANDLE MAKES IT! Assist: Ben LaVine
Score: 29-27

[09:29] Team_061 possession (Score: 29-27)
Tim Durant drives and kicks out. Stephen Towns attempts a 3Pt. Contested by Dirk Herro (4.0 feet, ZONE). Stephen Towns misses. Rebound secured by Terry Randle.

[09:16] Team_043 possession (Score: 29-27)
Terry Randle attempts a Layup. Contested by Tim Durant (4.5 feet, MAN). TERRY RANDLE MAKES IT! Assist: Jabari Holiday
Score: 29-29

[09:02] Team_061 possession (Score: 29-29)
Evan Rose attempts a Midrange. Contested by Dirk Herro (4.3 feet, ZONE). Evan Rose misses. Offensive rebound by Tim Durant! Tim Durant's putback is no good. Rebound secured by Dirk Herro.

[08:49] Team_043 possession (Score: 29-29)
Dirk Herro drives, Tim Durant stays with him. Dirk Herro attempts a Layup. Contested by Tim Durant (4.4 feet, ZONE). DIRK HERRO MAKES IT!
Score: 29-31

[08:37] Team_061 possession (Score: 29-31)
Evan Rose drives and kicks out. Stephen Towns attempts a 3Pt. Contested by Joel Murray (5.7 feet, MAN). Stephen Towns misses. Offensive rebound by Tim Durant! Tim Durant's putback is no good. Rebound secured by Terry Randle.

[08:27] Team_043 possession (Score: 29-31)
Terry Randle throws a bad pass! Stolen by Tim Durant! TURNOVER! (live ball)

[08:12] Team_061 possession (Score: 29-31)
FOUL! Offensive foul on Evan Rose! Jabari Holiday drew the charge! [Team fouls: 2] (Evan Rose: 1 personal fouls) TURNOVER! (dead ball)

[07:58] Team_043 possession (Score: 29-31)
Joel Murray attempts a Midrange. Contested by Tim Durant (4.5 feet, ZONE). JOEL MURRAY MAKES IT! Assist: Terry Randle
Score: 29-33

[07:42] Team_061 possession (Score: 29-33)
Desmond Morant attempts a Midrange. Wide open! Joel Murray is 6.0 feet away. [ZONE] DESMOND MORANT MAKES IT!
Score: 31-33

[07:28] Team_043 possession (Score: 31-33)
FOUL! Holding foul on Stephen Towns. [Team fouls: 3] No free throws, side out. (Stephen Towns: 1 personal fouls)

[07:16] Team_043 possession (Score: 31-33)
Ben LaVine attempts a Midrange. Wide open! Gary Fox is 6.3 feet away. [MAN] Ben LaVine misses. Rebound secured by Desmond Morant.

[06:58] Team_061 possession (Score: 31-33)
Tim Durant attempts a Layup. Contested by Terry Randle (4.9 feet, ZONE). TIM DURANT MAKES IT! Assist: Desmond Morant
Score: 33-33

[06:41] Team_043 possession (Score: 33-33)
Terry Randle makes the Dunk and draws the foul on Evan Rose! And-1! Terry Randle to the line for 1. [Team fouls: 4] (Evan Rose: 2 personal fouls)   FT 1/1: GOOD Terry Randle makes 1/1 from the line.
Score: 33-36

[06:27] Team_061 possession (Score: 33-36)
Gary Fox attempts a 3Pt. Contested by Ben LaVine (5.2 feet, MAN). GARY FOX MAKES IT! Assist: Tim Durant
Score: 36-36

[06:17] Team_043 possession (Score: 36-36)
Dirk Herro attempts a 3Pt. Contested by Desmond Morant (4.8 feet, MAN). Dirk Herro misses. Rebound secured by Tim Durant.

[06:02] Team_061 possession (Score: 36-36)
Evan Rose attempts a Midrange. Contested by Ben LaVine (5.4 feet, ZONE). Evan Rose misses. Rebound secured by Terry Randle.

[05:47] Team_043 possession (Score: 36-36)
Ben LaVine attempts a Midrange. Wide open! Gary Fox is 6.3 feet away. [MAN] Ben LaVine misses. Rebound secured by Stephen Towns.

[05:34] Team_061 possession (Score: 36-36)
Evan Rose attempts a Midrange. Contested by Joel Murray (6.0 feet, ZONE). Evan Rose misses. Rebound secured by Dirk Herro.

[05:23] Team_043 possession (Score: 36-36)
Dirk Herro attempts a 3Pt. Contested by Desmond Morant (4.8 feet, MAN). Dirk Herro misses. Rebound secured by Tim Durant.

[05:10] Team_061 possession (Score: 36-36)
Tim Durant attempts a Midrange. Contested by Terry Randle (4.9 feet, MAN). Tim Durant misses. Rebound secured by Ben LaVine.

[04:58] Team_043 possession (Score: 36-36)
Dirk Herro attempts a 3Pt. Contested by Desmond Morant (4.8 feet, MAN). DIRK HERRO MAKES IT! Assist: Jabari Holiday
Score: 36-39

[04:46] Team_061 possession (Score: 36-39)
Evan Rose attempts a 3Pt. Contested by Jabari Holiday (4.8 feet, MAN). Evan Rose misses. Rebound secured by Ben LaVine.

[04:30] Team_043 possession (Score: 36-39)
Dirk Herro attempts a Midrange. Contested by Desmond Morant (4.8 feet, MAN). Dirk Herro misses. Rebound secured by Stephen Towns.

[04:10] Team_061 possession (Score: 36-39)
Evan Rose attempts a 3Pt. Contested by Joel Murray (6.0 feet, ZONE). EVAN ROSE MAKES IT! Assist: Stephen Towns
Score: 39-39

[03:55] Team_043 possession (Score: 39-39)
Jabari Holiday attempts a 3Pt. Contested by Desmond Morant (4.9 feet, ZONE). Jabari Holiday misses. FOUL! Loose ball foul on Stephen Towns during the rebound battle. [IN THE BONUS! 5 team fouls] Terry Randle to the line for 2 free throws. (Stephen Towns: 2 personal fouls)   FT 1/2: GOOD   FT 2/2: GOOD Terry Randle makes 2/2 from the line.
Score: 39-41

[03:37] Team_061 possession (Score: 39-41)
Tim Durant attempts a Layup. Contested by Terry Randle (4.9 feet, ZONE). Tim Durant misses. Rebound secured by Dirk Herro.

[03:22] Team_043 possession (Score: 39-41)
Jabari Holiday attempts a Midrange. Wide open! Gary Fox is 6.4 feet away. [ZONE] Jabari Holiday misses. Rebound secured by Tim Durant.

[03:12] Team_061 possession (Score: 39-41)
Gary Fox drives to the basket... Gary Fox loses the ball! Stripped by Ben LaVine! TURNOVER! (live ball)

[02:55] Team_043 possession (Score: 39-41)
Jabari Holiday commits a violation (traveling/carry)! TURNOVER! (dead ball)

[02:41] Team_061 possession (Score: 39-41)
Tim Durant attempts a Layup. BLOCKED BY TERRY RANDLE! Ball is loose! Rebound secured by Terry Randle.

[02:28] Team_043 possession (Score: 39-41)
Dirk Herro drives to the basket... Dirk Herro throws a bad pass out of bounds! TURNOVER! (dead ball)

[02:16] Team_061 possession (Score: 39-41)
Evan Rose attempts a 3Pt. Contested by Jabari Holiday (4.9 feet, MAN). Evan Rose misses. Rebound secured by Dirk Herro.

[02:03] Team_043 possession (Score: 39-41)
Dirk Herro attempts a 3Pt. Contested by Desmond Morant (4.9 feet, MAN). DIRK HERRO MAKES IT! Assist: Terry Randle
Score: 39-44

[01:49] Team_061 possession (Score: 39-44)
Gary Fox attempts a Midrange. Contested by Ben LaVine (5.3 feet, MAN). GARY FOX MAKES IT!
Score: 41-44

[01:36] Team_043 possession (Score: 41-44)
Jabari Holiday attempts a Midrange. BLOCKED BY EVAN ROSE! Ball deflects out of bounds off Jabari Holiday.

[01:23] Team_061 possession (Score: 41-44)
Desmond Morant attempts a Layup. Contested by Terry Randle (4.8 feet, ZONE). Desmond Morant misses. Rebound secured by Dirk Herro.

[01:04] Team_043 possession (Score: 41-44)
Joel Murray makes the 3Pt and draws the foul on Stephen Towns! And-1! Joel Murray to the line for 1. [BONUS: 6 team fouls] (Stephen Towns: 3 personal fouls)   FT 1/1: GOOD Joel Murray makes 1/1 from the line.
Score: 41-48

[00:53] Team_061 possession (Score: 41-48)
Evan Rose drives to the basket... Evan Rose throws a bad pass out of bounds! TURNOVER! (dead ball)

[00:40] Team_043 possession (Score: 41-48)
Ben LaVine drives, Gary Fox stays with him. Ben LaVine attempts a Layup. Wide open! Gary Fox is 6.4 feet away. [MAN] BEN LAVINE MAKES IT! Assist: Dirk Herro
Score: 41-50

[00:28] Team_061 possession (Score: 41-50)
Tim Durant attempts a Layup. Contested by Terry Randle (5.1 feet, ZONE). TIM DURANT MAKES IT!
Score: 43-50

[00:18] Team_043 possession (Score: 43-50)
Joel Murray drives to the basket... Joel Murray loses the ball! Stripped by Tim Durant! TURNOVER! (live ball)

[00:04] Team_061 possession (Score: 43-50)
Tim Durant drives, Terry Randle stays with him. Tim Durant attempts a Layup. Contested by Terry Randle (5.2 feet, ZONE). TIM DURANT MAKES IT! Assist: Gary Fox
Score: 45-50

================================================================================
                              2ND QUARTER COMPLETE                              
================================================================================

2ND QUARTER SCORE: Team_061 18, Team_043 27

BOX SCORE:
================================================================================

Team_061
--------------------------------------------------------------------------------
Player                MIN  PTS  REB  AST  TO      FG   FG%      3P   3P%
--------------------------------------------------------------------------------
Tim Durant             10    6    3    1   0   3/7    42.9     0/0   0.0
Gary Fox               10    5    0    1   0   2/2   100.0     0/0   0.0
Evan Rose              10    3    0    0   0   1/7    14.3     0/0   0.0
Bam Sexton             14    2    0    0   0   1/1   100.0     0/0   0.0
Desmond Morant         10    2    1    1   0   1/2    50.0     0/0   0.0
Jayson Holiday         14    0    0    0   0   0/1     0.0     0/0   0.0
Draymond Banchero      14    0    1    0   0   0/0     0.0     0/0   0.0
Brandon Russell        14    0    0    1   0   0/1     0.0     0/0   0.0
Stephen Towns          10    0    2    1   0   0/0     0.0     0/0   0.0

TEAM: FG: 8/21 (38.1%), 3PT: 2/5 (40.0%), REB: 9 (2 off, 7 def), AST: 5, TO: 4
TEAM FOULS: 6 [Team_043 in BONUS]


Team_043
--------------------------------------------------------------------------------
Player                MIN  PTS  REB  AST  TO      FG   FG%      3P   3P%
--------------------------------------------------------------------------------
Terry Randle           10    9    4    2   0   4/4   100.0     0/0   0.0
Dirk Herro             10    8    5    1   0   3/6    50.0     0/0   0.0
Joel Murray            10    6    0    0   0   2/2   100.0     0/0   0.0
Dwyane Dosunmu         14    2    0    0   0   1/1   100.0     0/0   0.0
Ben LaVine             10    2    2    1   0   1/3    33.3     0/0   0.0
Manu Carter            14    0    2    0   0   0/0     0.0     0/0   0.0
D'Angelo Iverson       14    0    1    0   0   0/1     0.0     0/0   0.0
Jabari Holiday         10    0    0    2   0   0/2     0.0     0/0   0.0

TEAM: FG: 11/19 (57.9%), 3PT: 4/7 (57.1%), REB: 12 (1 off, 11 def), AST: 6, TO: 5
TEAM FOULS: 1

================================================================================

================================================================================
                       3RD QUARTER - Team_061 vs Team_043                       
================================================================================

[12:00] Team_061 possession (Score: 45-50)
Bam Sexton attempts a Layup. Contested by Manu Carter (4.6 feet, ZONE). BAM SEXTON MAKES IT!
Score: 47-50

[11:47] Team_043 possession (Score: 47-50)
D'Angelo Iverson attempts a Layup. BLOCKED BY MICHAEL RUSSELL! Ball goes out off Michael Russell. D'Angelo Iverson's ball!

[11:32] Team_043 possession (Score: 47-50)
Manu Carter attempts a 3Pt. Contested by Brandon Russell (4.4 feet, ZONE). Manu Carter misses. Rebound secured by Bam Sexton.

[11:15] Team_061 possession (Score: 47-50)
Bam Sexton attempts a 3Pt. Contested by Manu Carter (4.6 feet, MAN). Bam Sexton misses. Offensive rebound by Michael Russell! Michael Russell's putback is no good. Offensive rebound by Draymond Banchero! Draymond Banchero kicks it out.

[10:59] Team_061 possession (Score: 47-50)
Michael Russell attempts a 3Pt. Contested by D'Angelo Iverson (3.2 feet, MAN). Michael Russell misses. Offensive rebound by Draymond Banchero! Draymond Banchero's putback is no good. Rebound secured by Manu Carter.

[10:43] Team_043 possession (Score: 47-50)
Malcolm Murray drives, picks up Brandon Russell. Help arrives from Michael Russell! Malcolm Murray attempts a Layup. Contested by Michael Russell (4.0 feet, MAN). Malcolm Murray misses. Offensive rebound by D'Angelo Iverson! D'Angelo Iverson kicks it out.

[10:27] Team_043 possession (Score: 47-50)
FOUL! Shooting foul on Brandon Russell. Malcolm Murray to the line for 3 free throws. [Team fouls: 1] (Brandon Russell: 1 personal fouls)   FT 1/3: GOOD   FT 2/3: GOOD   FT 3/3: MISS Malcolm Murray makes 2/3 from the line. Rebound secured by Bam Sexton.
Score: 47-52

[10:13] Team_061 possession (Score: 47-52)
Bam Sexton attempts a 3Pt. Contested by D'Angelo Iverson (3.4 feet, ZONE). Bam Sexton misses. Rebound secured by Manu Carter.

[10:00] Team_043 possession (Score: 47-52)
Magic Durant attempts a Layup. BLOCKED BY DRAYMOND BANCHERO! Ball is loose! Rebound secured by Michael Russell.

[09:46] Team_061 possession (Score: 47-52)
Draymond Banchero attempts a Midrange. Contested by Manu Carter (4.8 feet, MAN). Draymond Banchero misses. Rebound secured by Manu Carter.

[09:34] Team_043 possession (Score: 47-52)
D'Angelo Iverson attempts a Midrange. Contested by Michael Russell (3.8 feet, MAN). D'ANGELO IVERSON MAKES IT!
Score: 47-54

[09:19] Team_061 possession (Score: 47-54)
Michael Russell attempts a 3Pt. Contested by D'Angelo Iverson (3.2 feet, ZONE). Michael Russell misses. FOUL! Loose ball foul on Manu Carter during the rebound battle. [Team fouls: 1] No free throws, side out. (Manu Carter: 1 personal fouls)

[09:06] Team_061 possession (Score: 47-54)
FOUL! Shooting foul on Manu Carter. Draymond Banchero to the line for 2 free throws. [Team fouls: 2] (Manu Carter: 2 personal fouls)   FT 1/2: GOOD   FT 2/2: GOOD Draymond Banchero makes 2/2 from the line.
Score: 49-54

[08:53] Team_043 possession (Score: 49-54)
FOUL! Holding foul on Bam Sexton. [Team fouls: 2] No free throws, side out. (Bam Sexton: 1 personal fouls)

[08:40] Team_043 possession (Score: 49-54)
Manu Carter loses the ball! Stripped by Bam Sexton! TURNOVER! (live ball)

[08:23] Team_061 possession (Score: 49-54)
FOUL! Shooting foul on Magic Durant. Bam Sexton to the line for 2 free throws. [Team fouls: 3] (Magic Durant: 1 personal fouls)   FT 1/2: MISS   FT 2/2: GOOD Bam Sexton makes 1/2 from the line.
Score: 50-54

[08:10] Team_043 possession (Score: 50-54)
Malcolm Murray drives and kicks out. Malcolm Murray attempts a 3Pt. Contested by Brandon Russell (3.9 feet, ZONE). MALCOLM MURRAY MAKES IT!
Score: 50-57

[07:58] Team_061 possession (Score: 50-57)
Michael Russell attempts a 3Pt. Contested by D'Angelo Iverson (3.2 feet, MAN). Michael Russell misses. Offensive rebound by Michael Russell! Michael Russell puts it back in!
Score: 52-57

[07:43] Team_043 possession (Score: 52-57)
Malcolm Murray attempts a 3Pt. Contested by Brandon Russell (4.0 feet, ZONE). Malcolm Murray misses. Offensive rebound by D'Angelo Iverson! D'Angelo Iverson kicks it out.

[07:31] Team_043 possession (Score: 52-57)
Malcolm Murray attempts a 3Pt. Contested by Brandon Russell (4.0 feet, MAN). MALCOLM MURRAY MAKES IT! Assist: Manu Carter
Score: 52-60

[07:19] Team_061 possession (Score: 52-60)
Jayson Holiday makes the Layup and draws the foul on Manu Carter! And-1! Jayson Holiday to the line for 1. [Team fouls: 4] (Manu Carter: 3 personal fouls)   FT 1/1: GOOD Jayson Holiday makes 1/1 from the line.
Score: 55-60

[07:07] Team_043 possession (Score: 55-60)
FOUL! Reach-in foul on Bam Sexton during the drive. [Team fouls: 3] No free throws, side out. (Bam Sexton: 2 personal fouls)

[06:52] Team_043 possession (Score: 55-60)
Dwyane Dosunmu loses the ball! Stripped by Draymond Banchero! TURNOVER! (live ball)

[06:42] Team_061 possession (Score: 55-60)
FOUL! Reach-in foul on Manu Carter during the drive. [IN THE BONUS! 5 team fouls] Brandon Russell to the line for 2 free throws. (Manu Carter: 4 personal fouls)   FT 1/2: GOOD   FT 2/2: GOOD Brandon Russell makes 2/2 from the line.
Score: 57-60

[06:29] Team_043 possession (Score: 57-60)
Magic Durant attempts a 3Pt. Contested by Jayson Holiday (4.0 feet, MAN). Magic Durant misses. Rebound secured by Michael Russell.

[06:14] Team_061 possession (Score: 57-60)
FOUL! Shooting foul on Magic Durant. Jayson Holiday to the line for 2 free throws. [BONUS: 6 team fouls] (Magic Durant: 2 personal fouls)   FT 1/2: MISS   FT 2/2: GOOD Jayson Holiday makes 1/2 from the line.
Score: 58-60

[06:02] Team_043 possession (Score: 58-60)
Manu Carter attempts a 3Pt. Contested by Bam Sexton (5.4 feet, MAN). MANU CARTER MAKES IT! Assist: Dwyane Dosunmu
Score: 58-63

[05:49] Team_061 possession (Score: 58-63)
Jayson Holiday attempts a 3Pt. Contested by Magic Durant (5.5 feet, MAN). Jayson Holiday misses. Rebound secured by Manu Carter.

[05:34] Team_043 possession (Score: 58-63)
Malcolm Murray attempts a Midrange. Contested by Bam Sexton (5.0 feet, ZONE). Malcolm Murray misses. Offensive rebound by Manu Carter! Manu Carter kicks it out.

[05:20] Team_043 possession (Score: 58-63)
Magic Durant drives, Draymond Banchero stays with him. Magic Durant attempts a Layup. Contested by Draymond Banchero (2.6 feet, ZONE). MAGIC DURANT MAKES IT!
Score: 58-65

[05:10] Team_061 possession (Score: 58-65)
FOUL! Reach-in foul on Malcolm Murray during the drive. [IN THE BONUS! 7 team fouls] Brandon Russell to the line for 2 free throws. (Malcolm Murray: 1 personal fouls)   FT 1/2: GOOD   FT 2/2: GOOD Brandon Russell makes 2/2 from the line.
Score: 60-65

[04:55] Team_043 possession (Score: 60-65)
D'Angelo Iverson attempts a 3Pt. Contested by Brandon Russell (4.0 feet, ZONE). D'ANGELO IVERSON MAKES IT! Assist: Manu Carter
Score: 60-68

[04:38] Team_061 possession (Score: 60-68)
Brandon Russell drives to the basket... Brandon Russell loses the ball! Stripped by Malcolm Murray! TURNOVER! (live ball)

[04:24] Team_043 possession (Score: 60-68)
Malcolm Murray attempts a Midrange. Contested by Brandon Russell (4.0 feet, MAN). Malcolm Murray misses. Rebound secured by Draymond Banchero.

[04:04] Team_061 possession (Score: 60-68)
Bam Sexton attempts a 3Pt. Contested by D'Angelo Iverson (3.5 feet, ZONE). Bam Sexton misses. Offensive rebound by Michael Russell! Michael Russell puts it back in!
Score: 62-68

[03:47] Team_043 possession (Score: 62-68)
Manu Carter drives, Bam Sexton stays with him. Manu Carter attempts a Dunk. Contested by Bam Sexton (5.4 feet, MAN). MANU CARTER MAKES IT! Assist: D'Angelo Iverson
Score: 62-70

[03:31] Team_061 possession (Score: 62-70)
Michael Russell attempts a Midrange. Contested by Dwyane Dosunmu (5.3 feet, ZONE). Michael Russell misses. Rebound secured by D'Angelo Iverson.

[03:19] Team_043 possession (Score: 62-70)
Magic Durant attempts a 3Pt. Contested by Jayson Holiday (4.2 feet, MAN). MAGIC DURANT MAKES IT! Assist: D'Angelo Iverson
Score: 62-73

[03:06] Team_061 possession (Score: 62-73)
Jayson Holiday makes the Dunk and draws the foul on Malcolm Murray! And-1! Jayson Holiday to the line for 1. [BONUS: 8 team fouls] (Malcolm Murray: 2 personal fouls)   FT 1/1: GOOD Jayson Holiday makes 1/1 from the line.
Score: 65-73

[02:51] Team_043 possession (Score: 65-73)
D'Angelo Iverson attempts a 3Pt. Contested by Brandon Russell (4.1 feet, ZONE). D'Angelo Iverson misses. Rebound secured by Michael Russell.

[02:38] Team_061 possession (Score: 65-73)
Bam Sexton makes the Layup and draws the foul on Manu Carter! And-1! Bam Sexton to the line for 1. [BONUS: 9 team fouls] (Manu Carter: 5 personal fouls)   FT 1/1: GOOD Bam Sexton makes 1/1 from the line.
Score: 68-73

[02:23] Team_043 possession (Score: 68-73)
Manu Carter drives, picks up Bam Sexton. Help arrives from Jayson Holiday! Manu Carter attempts a Layup. Contested by Jayson Holiday (5.5 feet, MAN). MANU CARTER MAKES IT! Assist: Dwyane Dosunmu
Score: 68-75

[02:11] Team_061 possession (Score: 68-75)
Jayson Holiday attempts a 3Pt. Contested by Malcolm Murray (4.4 feet, ZONE). JAYSON HOLIDAY MAKES IT! Assist: Draymond Banchero
Score: 71-75

[01:54] Team_043 possession (Score: 71-75)
D'Angelo Iverson attempts a 3Pt. Contested by Michael Russell (4.2 feet, MAN). D'Angelo Iverson misses. Rebound secured by Bam Sexton.

[01:40] Team_061 possession (Score: 71-75)
Draymond Banchero attempts a Midrange. Contested by Manu Carter (5.2 feet, ZONE). Draymond Banchero misses. Rebound secured by Manu Carter.

[01:21] Team_043 possession (Score: 71-75)
Dwyane Dosunmu drives and kicks out. Magic Durant attempts a 3Pt. Contested by Jayson Holiday (4.4 feet, MAN). MAGIC DURANT MAKES IT! Assist: Malcolm Murray
Score: 71-78

[01:08] Team_061 possession (Score: 71-78)
Bam Sexton drives and kicks out. Bam Sexton attempts a 3Pt. Contested by Manu Carter (4.7 feet, MAN). Bam Sexton misses. Rebound secured by Manu Carter.

[00:57] Team_043 possession (Score: 71-78)
Magic Durant drives and kicks out. Dwyane Dosunmu makes the Midrange and draws the foul on Michael Russell! And-1! Dwyane Dosunmu to the line for 1. [Team fouls: 4] (Michael Russell: 1 personal fouls)   FT 1/1: GOOD Dwyane Dosunmu makes 1/1 from the line.
Score: 71-81

[00:42] Team_061 possession (Score: 71-81)
Bam Sexton drives to the basket... Bam Sexton loses the ball! Stripped by Manu Carter! TURNOVER! (live ball)

[00:32] Team_043 possession (Score: 71-81)
FOUL! Reach-in foul on Jayson Holiday during the drive. [IN THE BONUS! 5 team fouls] Magic Durant to the line for 2 free throws. (Jayson Holiday: 1 personal fouls)   FT 1/2: GOOD   FT 2/2: GOOD Magic Durant makes 2/2 from the line.
Score: 71-83

[00:13] Team_061 possession (Score: 71-83)
Draymond Banchero drives, Manu Carter stays with him. Draymond Banchero attempts a Dunk. Contested by Manu Carter (5.4 feet, MAN). Draymond Banchero misses. Rebound secured by D'Angelo Iverson.

[00:02] Team_043 possession (Score: 71-83)
Magic Durant drives to the basket... Magic Durant throws a bad pass out of bounds! TURNOVER! (dead ball)

[00:02] Substitution (Team_061): Brandon Russell OUT → Evan Rose IN (stamina_rule2)

[00:02] Substitution (Team_061): Jayson Holiday OUT → Gary Fox IN (stamina_rule2)

[00:02] Substitution (Team_061): Michael Russell OUT → Desmond Morant IN (stamina_rule2)

[00:02] Substitution (Team_061): Bam Sexton OUT → Stephen Towns IN (stamina_rule2)

[00:02] Substitution (Team_061): Draymond Banchero OUT → Tim Durant IN (stamina_rule2)

[00:02] Substitution (Team_043): Malcolm Murray OUT → Jabari Holiday IN (stamina_rule2)

[00:02] Substitution (Team_043): Magic Durant OUT → Ben LaVine IN (stamina_rule2)

[00:02] Substitution (Team_043): D'Angelo Iverson OUT → Dirk Herro IN (stamina_rule2)

[00:02] Substitution (Team_043): Manu Carter OUT → Joel Murray IN (stamina_rule2)

[00:02] Substitution (Team_043): Dwyane Dosunmu OUT → Terry Randle IN (stamina_rule2)

================================================================================
                              3RD QUARTER COMPLETE                              
================================================================================

3RD QUARTER SCORE: Team_061 26, Team_043 33

BOX SCORE:
================================================================================

Team_061
--------------------------------------------------------------------------------
Player                MIN  PTS  REB  AST  TO      FG   FG%      3P   3P%
--------------------------------------------------------------------------------
Jayson Holiday         27   10    0    0   0   4/5    80.0     0/0   0.0
Bam Sexton             27    6    3    0   0   3/5    60.0     0/0   0.0
Michael Russell        27    4    5    0   0   2/4    50.0     0/0   0.0
Brandon Russell        27    4    0    0   0   2/2   100.0     0/0   0.0
Draymond Banchero      27    2    3    1   0   1/4    25.0     0/0   0.0

TEAM: FG: 12/20 (60.0%), 3PT: 3/6 (50.0%), REB: 12 (5 off, 7 def), AST: 1, TO: 2
TEAM FOULS: 5 [Team_043 in BONUS]


Team_043
--------------------------------------------------------------------------------
Player                MIN  PTS  REB  AST  TO      FG   FG%      3P   3P%
--------------------------------------------------------------------------------
Magic Durant           27   10    0    0   0   4/6    66.7     0/0   0.0
Manu Carter            27    7    7    2   0   3/4    75.0     0/0   0.0
Malcolm Murray         27    6    0    1   0   2/4    50.0     0/0   0.0
D'Angelo Iverson       27    5    4    2   0   2/4    50.0     0/0   0.0
Dwyane Dosunmu         27    3    0    2   0   1/1   100.0     0/0   0.0

TEAM: FG: 12/19 (63.2%), 3PT: 4/9 (44.4%), REB: 10 (3 off, 7 def), AST: 7, TO: 3
TEAM FOULS: 9 [Team_061 in BONUS]

================================================================================

================================================================================
                       4TH QUARTER - Team_061 vs Team_043                       
================================================================================

[12:00] Substitution (Team_061): Brandon Russell OUT (stamina: 71) → Evan Rose IN (comeback_detected)

[12:00] Substitution (Team_043): Malcolm Murray OUT (stamina: 69) → Jabari Holiday IN (comeback_detected)

[12:00] Team_061 possession (Score: 71-83)
Evan Rose attempts a 3Pt. Contested by Jabari Holiday (4.8 feet, MAN). Evan Rose misses. Rebound secured by Dwyane Dosunmu.

[11:50] Team_043 possession (Score: 71-83)
Dwyane Dosunmu attempts a Layup. Contested by Draymond Banchero (2.9 feet, MAN). Dwyane Dosunmu misses. Rebound secured by Michael Russell.

[11:34] Team_061 possession (Score: 71-83)
Jayson Holiday drives, picks up Magic Durant. Help arrives from D'Angelo Iverson! Jayson Holiday attempts a Dunk. Contested by D'Angelo Iverson (5.9 feet, MAN). Jayson Holiday misses. Rebound secured by Dwyane Dosunmu.

[11:16] Team_043 possession (Score: 71-83)
Manu Carter attempts a 3Pt. Contested by Michael Russell (4.6 feet, ZONE). Manu Carter misses. Rebound secured by Michael Russell.

[11:02] Team_061 possession (Score: 71-83)
FOUL! Shooting foul on Manu Carter. Bam Sexton to the line for 2 free throws. [Team fouls: 1] (Manu Carter: 1 personal fouls)   FT 1/2: GOOD   FT 2/2: GOOD Bam Sexton makes 2/2 from the line.
Score: 73-83

[10:45] Team_043 possession (Score: 73-83)
Dwyane Dosunmu attempts a Midrange. Contested by Draymond Banchero (3.1 feet, MAN). Dwyane Dosunmu misses. Rebound secured by Draymond Banchero.

[10:28] Team_061 possession (Score: 73-83)
Michael Russell attempts a 3Pt. Contested by D'Angelo Iverson (3.7 feet, ZONE). Michael Russell misses. Rebound secured by D'Angelo Iverson.

[10:11] Team_043 possession (Score: 73-83)
FOUL! Reach-in foul on Bam Sexton during the drive. [Team fouls: 1] No free throws, side out. (Bam Sexton: 1 personal fouls)

[09:57] Team_043 possession (Score: 73-83)
Jabari Holiday drives and kicks out. Magic Durant attempts a Midrange. Contested by Jayson Holiday (4.6 feet, MAN). MAGIC DURANT MAKES IT! Assist: Manu Carter
Score: 73-85

[09:41] Team_061 possession (Score: 73-85)
FOUL! Holding foul on Manu Carter. [Team fouls: 2] No free throws, side out. (Manu Carter: 2 personal fouls)

[09:27] Team_061 possession (Score: 73-85)
Michael Russell attempts a 3Pt. Contested by D'Angelo Iverson (3.8 feet, MAN). Michael Russell misses. Offensive rebound by Draymond Banchero! Draymond Banchero's putback is no good. Rebound secured by Dwyane Dosunmu.

[09:12] Team_043 possession (Score: 73-85)
Jabari Holiday attempts a Midrange. Contested by Michael Russell (5.0 feet, ZONE). JABARI HOLIDAY MAKES IT!
Score: 73-87

[09:00] Team_061 possession (Score: 73-87)
Draymond Banchero throws a bad pass out of bounds! TURNOVER! (dead ball)

[09:00] Substitution (Team_061): Jayson Holiday OUT → Gary Fox IN (stamina_rule2)

[09:00] Substitution (Team_061): Michael Russell OUT → Desmond Morant IN (stamina_rule2)

[09:00] Substitution (Team_061): Bam Sexton OUT → Stephen Towns IN (stamina_rule2)

[09:00] Substitution (Team_061): Draymond Banchero OUT → Tim Durant IN (stamina_rule2)

[09:00] Substitution (Team_043): Magic Durant OUT → Ben LaVine IN (stamina_rule2)

[09:00] Substitution (Team_043): D'Angelo Iverson OUT → Dirk Herro IN (stamina_rule2)

[09:00] Substitution (Team_043): Manu Carter OUT → Joel Murray IN (stamina_rule2)

[09:00] Substitution (Team_043): Dwyane Dosunmu OUT → Terry Randle IN (stamina_rule2)

[08:49] Team_043 possession (Score: 73-87)
Jabari Holiday drives, Tim Durant stays with him. Jabari Holiday attempts a Dunk. Contested by Tim Durant (4.6 feet, ZONE). JABARI HOLIDAY MAKES IT! Assist: Terry Randle
Score: 73-89

[08:36] Team_061 possession (Score: 73-89)
Desmond Morant attempts a 3Pt. Contested by Dirk Herro (4.3 feet, ZONE). Desmond Morant misses. Rebound secured by Dirk Herro.

[08:17] Team_043 possession (Score: 73-89)
Jabari Holiday attempts a Midrange. Contested by Evan Rose (5.5 feet, MAN). Jabari Holiday misses. Rebound secured by Tim Durant.

[08:00] Team_061 possession (Score: 73-89)
Gary Fox attempts a Midrange. Contested by Ben LaVine (5.2 feet, MAN). GARY FOX MAKES IT! Assist: Tim Durant
Score: 75-89

[07:44] Team_043 possession (Score: 75-89)
Terry Randle makes the 3Pt and draws the foul on Desmond Morant! And-1! Terry Randle to the line for 1. [Team fouls: 2] (Desmond Morant: 1 personal fouls)   FT 1/1: GOOD Terry Randle makes 1/1 from the line.
Score: 75-93

[07:27] Team_061 possession (Score: 75-93)
Gary Fox attempts a 3Pt. Contested by Dirk Herro (4.1 feet, ZONE). Gary Fox misses. Rebound secured by Ben LaVine.

[07:11] Team_043 possession (Score: 75-93)
FOUL! Holding foul on Gary Fox. [Team fouls: 3] No free throws, side out. (Gary Fox: 1 personal fouls)

[06:56] Team_043 possession (Score: 75-93)
Dirk Herro makes the 3Pt and draws the foul on Desmond Morant! And-1! Dirk Herro to the line for 1. [Team fouls: 4] (Desmond Morant: 2 personal fouls)   FT 1/1: MISS Dirk Herro makes 0/1 from the line. Rebound secured by Stephen Towns.
Score: 75-96

[06:43] Team_061 possession (Score: 75-96)
Tim Durant drives, Terry Randle stays with him. Tim Durant attempts a Layup. Contested by Terry Randle (4.9 feet, MAN). TIM DURANT MAKES IT! Assist: Stephen Towns
Score: 77-96

[06:30] Team_043 possession (Score: 77-96)
Dirk Herro drives, Desmond Morant stays with him. Dirk Herro attempts a Layup. Contested by Desmond Morant (4.8 feet, MAN). DIRK HERRO MAKES IT! Assist: Joel Murray
Score: 77-98

[06:13] Team_061 possession (Score: 77-98)
Tim Durant attempts a 3Pt. Contested by Dirk Herro (4.6 feet, ZONE). Tim Durant misses. Offensive rebound by Stephen Towns! Stephen Towns kicks it out.

[05:58] Team_061 possession (Score: 77-98)
FOUL! Shooting foul on Jabari Holiday. Evan Rose to the line for 2 free throws. [Team fouls: 3] (Jabari Holiday: 1 personal fouls)   FT 1/2: MISS   FT 2/2: GOOD Evan Rose makes 1/2 from the line.
Score: 78-98

[05:45] Team_043 possession (Score: 78-98)
Dirk Herro attempts a Layup. Contested by Tim Durant (4.4 feet, ZONE). DIRK HERRO MAKES IT! Assist: Ben LaVine
Score: 78-100

[05:30] Team_061 possession (Score: 78-100)
Evan Rose attempts a 3Pt. Contested by Ben LaVine (5.4 feet, ZONE). EVAN ROSE MAKES IT! Assist: Desmond Morant
Score: 81-100

[05:18] Team_043 possession (Score: 81-100)
Jabari Holiday drives to the basket... Jabari Holiday loses control! Ball rolls out of bounds! TURNOVER! (dead ball)

[05:06] Team_061 possession (Score: 81-100)
Stephen Towns attempts a Midrange. Contested by Ben LaVine (5.4 feet, ZONE). Stephen Towns misses. Rebound secured by Terry Randle.

[04:53] Team_043 possession (Score: 81-100)
FOUL! Reach-in foul on Stephen Towns during the drive. [IN THE BONUS! 5 team fouls] Joel Murray to the line for 2 free throws. (Stephen Towns: 1 personal fouls)   FT 1/2: GOOD   FT 2/2: GOOD Joel Murray makes 2/2 from the line.
Score: 81-102

[04:38] Team_061 possession (Score: 81-102)
Gary Fox attempts a 3Pt. Contested by Dirk Herro (4.1 feet, ZONE). Gary Fox misses. Rebound secured by Dirk Herro.

[04:23] Team_043 possession (Score: 81-102)
Joel Murray attempts a Layup. Contested by Stephen Towns (5.2 feet, MAN). JOEL MURRAY MAKES IT! Assist: Jabari Holiday
Score: 81-104

[04:09] Team_061 possession (Score: 81-104)
Desmond Morant attempts a Midrange. Contested by Dirk Herro (4.3 feet, ZONE). DESMOND MORANT MAKES IT!
Score: 83-104

[03:54] Team_043 possession (Score: 83-104)
Joel Murray attempts a Midrange. Wide open! Gary Fox is 6.2 feet away. [ZONE] Joel Murray misses. Rebound secured by Tim Durant.

[03:37] Team_061 possession (Score: 83-104)
Tim Durant drives and kicks out. Tim Durant attempts a Midrange. Contested by Dirk Herro (4.0 feet, ZONE). Tim Durant misses. Offensive rebound by Stephen Towns! Stephen Towns kicks it out.

[03:23] Team_061 possession (Score: 83-104)
Stephen Towns attempts a 3Pt. Contested by Dirk Herro (4.3 feet, ZONE). STEPHEN TOWNS MAKES IT! Assist: Tim Durant
Score: 86-104

[03:12] Team_043 possession (Score: 86-104)
Terry Randle attempts a 3Pt. Contested by Desmond Morant (4.9 feet, ZONE). TERRY RANDLE MAKES IT! Assist: Ben LaVine
Score: 86-107

[02:59] Team_061 possession (Score: 86-107)
Stephen Towns attempts a 3Pt. Wide open! Joel Murray is 6.0 feet away. [MAN] Stephen Towns misses. Offensive rebound by Tim Durant! Tim Durant puts it back in!
Score: 88-107

[02:46] Team_043 possession (Score: 88-107)
Jabari Holiday attempts a 3Pt. Contested by Desmond Morant (4.9 feet, ZONE). Jabari Holiday misses. FOUL! Loose ball foul on Desmond Morant during the rebound battle. [IN THE BONUS! 6 team fouls] Dirk Herro to the line for 2 free throws. (Desmond Morant: 3 personal fouls)   FT 1/2: GOOD   FT 2/2: GOOD Dirk Herro makes 2/2 from the line.
Score: 88-109

[02:31] Team_061 possession (Score: 88-109)
Desmond Morant drives, Dirk Herro stays with him. Desmond Morant attempts a Dunk. Contested by Dirk Herro (4.3 feet, MAN). DESMOND MORANT MAKES IT! Assist: Tim Durant
Score: 90-109

[02:18] Team_043 possession (Score: 90-109)
Dirk Herro attempts a 3Pt. Contested by Desmond Morant (4.8 feet, MAN). Dirk Herro misses. Rebound secured by Desmond Morant.

[02:03] Team_061 possession (Score: 90-109)
Stephen Towns attempts a 3Pt. Wide open! Joel Murray is 6.0 feet away. [MAN] Stephen Towns misses. Rebound secured by Dirk Herro.

[01:52] Team_043 possession (Score: 90-109)
Terry Randle attempts a 3Pt. Contested by Stephen Towns (5.3 feet, ZONE). Terry Randle misses. Rebound secured by Tim Durant.

[01:38] Team_061 possession (Score: 90-109)
Evan Rose attempts a Layup. Contested by Terry Randle (4.6 feet, ZONE). EVAN ROSE MAKES IT!
Score: 92-109

[01:24] Team_043 possession (Score: 92-109)
Jabari Holiday drives to the basket... Jabari Holiday loses control! Ball rolls out of bounds! TURNOVER! (dead ball)

[01:11] Team_061 possession (Score: 92-109)
Gary Fox drives and kicks out. Desmond Morant attempts a 3Pt. Contested by Dirk Herro (4.1 feet, ZONE). DESMOND MORANT MAKES IT! Assist: Tim Durant
Score: 95-109

[00:54] Team_043 possession (Score: 95-109)
Joel Murray attempts a Midrange. Wide open! Gary Fox is 6.3 feet away. [ZONE] JOEL MURRAY MAKES IT! Assist: Ben LaVine
Score: 95-111

[00:44] Team_061 possession (Score: 95-111)
Stephen Towns attempts a Midrange. Wide open! Joel Murray is 6.1 feet away. [MAN] STEPHEN TOWNS MAKES IT! Assist: Desmond Morant
Score: 97-111

[00:32] Team_043 possession (Score: 97-111)
Joel Murray attempts a Layup. Contested by Tim Durant (4.7 feet, ZONE). JOEL MURRAY MAKES IT!
Score: 97-113

[00:17] Team_061 possession (Score: 97-113)
Stephen Towns drives to the basket... Stephen Towns loses control! Ball rolls out of bounds! TURNOVER! (dead ball)

[00:04] Team_043 possession (Score: 97-113)
FOUL! Shooting foul on Desmond Morant. Ben LaVine to the line for 2 free throws. [BONUS: 7 team fouls] (Desmond Morant: 4 personal fouls)   FT 1/2: MISS   FT 2/2: GOOD Ben LaVine makes 1/2 from the line.
Score: 97-114

================================================================================
                              4TH QUARTER COMPLETE                              
================================================================================

4TH QUARTER SCORE: Team_061 26, Team_043 31

BOX SCORE:
================================================================================

Team_061
--------------------------------------------------------------------------------
Player                MIN  PTS  REB  AST  TO      FG   FG%      3P   3P%
--------------------------------------------------------------------------------
Desmond Morant         19    7    1    2   0   3/4    75.0     0/0   0.0
Evan Rose              22    6    0    0   0   3/4    75.0     0/0   0.0
Stephen Towns          19    5    3    1   0   2/4    50.0     0/0   0.0
Tim Durant             19    4    4    4   0   2/2   100.0     0/0   0.0
Bam Sexton             30    2    0    0   0   1/1   100.0     0/0   0.0
Gary Fox               19    2    0    0   0   1/3    33.3     0/0   0.0
Dwyane Dosunmu         30    0    3    0   0   0/2     0.0     0/0   0.0
Michael Russell        30    0    2    0   0   0/2     0.0     0/0   0.0
Jayson Holiday         30    0    0    0   0   0/1     0.0     0/0   0.0
Draymond Banchero      30    0    1    0   0   0/0     0.0     0/0   0.0

TEAM: FG: 12/21 (57.1%), 3PT: 3/10 (30.0%), REB: 12 (4 off, 8 def), AST: 7, TO: 2
TEAM FOULS: 7 [Team_043 in BONUS]


Team_043
--------------------------------------------------------------------------------
Player                MIN  PTS  REB  AST  TO      FG   FG%      3P   3P%
--------------------------------------------------------------------------------
Joel Murray            19    8    0    1   0   4/5    80.0     0/0   0.0
Terry Randle           19    7    1    1   0   2/3    66.7     0/0   0.0
Dirk Herro             19    6    3    0   0   3/5    60.0     0/0   0.0
Jabari Holiday         22    4    0    1   0   2/3    66.7     0/0   0.0
Magic Durant           30    2    0    0   0   1/1   100.0     0/0   0.0
Ben LaVine             19    1    1    3   0   1/1   100.0     0/0   0.0
Manu Carter            30    0    0    1   0   0/1     0.0     0/0   0.0
D'Angelo Iverson       30    0    1    0   0   0/0     0.0     0/0   0.0

TEAM: FG: 13/21 (61.9%), 3PT: 3/7 (42.9%), REB: 8 (0 off, 8 def), AST: 7, TO: 2
TEAM FOULS: 3

================================================================================

================================================================================
                               FULL GAME COMPLETE                               
================================================================================

FINAL SCORE: Team_061 97, Team_043 114

SCORING BY QUARTER:
--------------------------------------------------------------------------------
Team                     Q1     Q2     Q3     Q4    FINAL
--------------------------------------------------------------------------------
Team_061                 27     18     26     26       97
Team_043                 23     27     33     31      114
--------------------------------------------------------------------------------

FULL GAME BOX SCORE:
================================================================================

Team_061
--------------------------------------------------------------------------------
Player                MIN  PTS  REB  AST  TO      FG   FG%      3P   3P%      FT STL BLK
--------------------------------------------------------------------------------
Jayson Holiday         30   19    0    0   1   6/10   60.0   3/5    60.0   3/4     1   2
Michael Russell        30   11    7    1   0   4/12   33.3   2/9    22.2   3/3     0   1
Bam Sexton             30   10    9    3   1   7/10   70.0   1/2    50.0   4/5     1   0
Draymond Banchero      30   11    7    2   4   4/8    50.0   0/0     0.0   2/2     4   2
Brandon Russell        27    6    0    3   0   4/8    50.0   0/0     0.0   4/4     0   0
Evan Rose              22    9    0    0   2   4/11   36.4   2/5    40.0   1/2     0   1
Gary Fox               19    7    0    1   1   4/6    66.7   1/3    33.3   0/0     0   0
Desmond Morant         19    9    2    3   1   3/5    60.0   0/1     0.0   0/0     0   0
Stephen Towns          19    5    5    2   0   3/5    60.0   2/3    66.7   0/0     0   0
Tim Durant             19   10    7    5   0   4/8    50.0   0/0     0.0   0/0     2   0

TEAM: FG: 43/83 (51.8%), 3PT: 11/28 (39.3%), REB: 41 (12 off, 29 def), AST: 20, TO: 10


Team_043
--------------------------------------------------------------------------------
Player                MIN  PTS  REB  AST  TO      FG   FG%      3P   3P%      FT STL BLK
--------------------------------------------------------------------------------
Magic Durant           30   19    0    0   1   7/11   63.6   2/4    50.0   4/4     0   0
D'Angelo Iverson       30    7   11    2   3   3/9    33.3   1/5    20.0   0/0     0   0
Manu Carter            30   15   18    3   1   7/9    77.8   1/3    33.3   4/4     1   0
Dwyane Dosunmu         30   10    3    4   3   4/8    50.0   0/0     0.0   5/6     0   0
Malcolm Murray         27    6    0    3   1   2/5    40.0   1/2    50.0   2/3     1   0
Jabari Holiday         22    4    0    3   1   5/8    62.5   2/2   100.0   0/0     0   0
Ben LaVine             19    3    3    4   0   2/4    50.0   0/0     0.0   1/2     1   0
Dirk Herro             19   14    8    1   1   5/10   50.0   2/6    33.3   2/3     0   0
Joel Murray            19   14    0    1   1   6/7    85.7   1/1   100.0   3/3     0   0
Terry Randle           19   16    5    3   3   5/6    83.3   2/3    66.7   4/4     0   1

TEAM: FG: 46/77 (59.7%), 3PT: 12/26 (46.2%), REB: 44 (8 off, 36 def), AST: 24, TO: 15

================================================================================
