================================================================================
                        FULL GAME - Team_090 vs Team_051                        
================================================================================

================================================================================
                       1ST QUARTER - Team_090 vs Team_051                       
================================================================================

[12:00] Team_090 possession (Score: 0-0)
Tracy Adebayo attempts a 3Pt. Contested by Austin Sexton (4.2 feet, ZONE). Tracy Adebayo misses. Rebound secured by Shaquille Harden.

[11:46] Team_051 possession (Score: 0-0)
OG Siakam commits a violation (traveling/carry)! TURNOVER! (dead ball)

[11:33] Team_090 possession (Score: 0-0)
Tracy Adebayo drives, picks up Franz Simmons. Help arrives from Larry McGrady! Tracy Adebayo attempts a Dunk. Contested by Larry McGrady (4.0 feet, ZONE). TRACY ADEBAYO MAKES IT! Assist: Larry Bridges
Score: 2-0

[11:22] Team_051 possession (Score: 2-0)
FOUL! Reach-in foul on Gary Brogdon during the drive. [Team fouls: 1] No free throws, side out. (Gary Brogdon: 1 personal fouls)

[11:10] Team_051 possession (Score: 2-0)
Shaquille Harden attempts a Midrange. Contested by Tracy Adebayo (4.7 feet, MAN). SHAQUILLE HARDEN MAKES IT!
Score: 2-2

[10:55] Team_090 possession (Score: 2-2)
Gary Brogdon attempts a 3Pt. Contested by Austin Sexton (4.6 feet, ZONE). GARY BROGDON MAKES IT! Assist: Zach Wall
Score: 5-2

[10:41] Team_051 possession (Score: 5-2)
Austin Sexton throws a bad pass out of bounds! TURNOVER! (dead ball)

[10:29] Team_090 possession (Score: 5-2)
FOUL! Shooting foul on Shaquille Harden. Tracy Adebayo to the line for 2 free throws. [Team fouls: 1] (Shaquille Harden: 1 personal fouls)   FT 1/2: GOOD   FT 2/2: MISS Tracy Adebayo makes 1/2 from the line. FOUL! Loose ball foul on Shaquille Harden during the free throw rebound! [Team fouls: 2] No free throws, side out. (Shaquille Harden: 2 personal fouls)
Score: 6-2

[10:14] Team_090 possession (Score: 6-2)
Larry Bridges attempts a Layup. Contested by Shaquille Harden (4.2 feet, ZONE). LARRY BRIDGES MAKES IT! Assist: Tracy Adebayo
Score: 8-2

[10:00] Team_051 possession (Score: 8-2)
Shaquille Harden attempts a Midrange. Contested by Zach Wall (4.9 feet, ZONE). Shaquille Harden misses. Rebound secured by Tracy Adebayo.

[09:46] Team_090 possession (Score: 8-2)
Gary Brogdon attempts a 3Pt. Contested by Austin Sexton (4.6 feet, ZONE). Gary Brogdon misses. Rebound secured by Shaquille Harden.

[09:31] Team_051 possession (Score: 8-2)
FOUL! Reach-in foul on Derrick Mitchell during the drive. [Team fouls: 2] No free throws, side out. (Derrick Mitchell: 1 personal fouls)

[09:16] Team_051 possession (Score: 8-2)
OG Siakam attempts a 3Pt. Contested by Larry Bridges (5.0 feet, ZONE). OG Siakam misses. Rebound secured by Gary Brogdon.

[08:59] Team_090 possession (Score: 8-2)
Tracy Adebayo drives to the basket... Tracy Adebayo throws a bad pass out of bounds! TURNOVER! (dead ball)

[08:47] Team_051 possession (Score: 8-2)
Franz Simmons attempts a 3Pt. Contested by Gary Brogdon (4.1 feet, MAN). Franz Simmons misses. Offensive rebound by Shaquille Harden! Shaquille Harden puts it back in!
Score: 8-4

[08:32] Team_090 possession (Score: 8-4)
Derrick Mitchell attempts a 3Pt. Contested by Austin Sexton (4.7 feet, ZONE). DERRICK MITCHELL MAKES IT! Assist: Tracy Adebayo
Score: 11-4

[08:18] Team_051 possession (Score: 11-4)
Franz Simmons attempts a 3Pt. Contested by Zach Wall (5.4 feet, ZONE). Franz Simmons misses. Offensive rebound by Shaquille Harden! Shaquille Harden puts it back in!
Score: 11-6

[08:02] Team_090 possession (Score: 11-6)
Gary Brogdon drives, picks up Franz Simmons. Help arrives from Larry McGrady! Gary Brogdon attempts a Dunk. Contested by Larry McGrady (4.4 feet, ZONE). Gary Brogdon misses. Offensive rebound by Tracy Adebayo! Tracy Adebayo kicks it out.

[07:49] Team_090 possession (Score: 11-6)
Larry Bridges attempts a 3Pt. Contested by Larry McGrady (4.5 feet, MAN). Larry Bridges misses. Rebound secured by OG Siakam.

[07:33] Team_051 possession (Score: 11-6)
Franz Simmons makes the Dunk and draws the foul on Gary Brogdon! And-1! Franz Simmons to the line for 1. [Team fouls: 3] (Gary Brogdon: 2 personal fouls)   FT 1/1: GOOD Franz Simmons makes 1/1 from the line.
Score: 11-9

[07:20] Team_090 possession (Score: 11-9)
Tracy Adebayo attempts a Layup. Contested by Shaquille Harden (4.0 feet, MAN). TRACY ADEBAYO MAKES IT! Assist: Zach Wall
Score: 13-9

[07:08] Team_051 possession (Score: 13-9)
Shaquille Harden attempts a Midrange. Contested by Larry Bridges (4.7 feet, ZONE). SHAQUILLE HARDEN MAKES IT! Assist: OG Siakam
Score: 13-11

[06:51] Team_090 possession (Score: 13-11)
Gary Brogdon drives and kicks out. Zach Wall attempts a Midrange. Contested by OG Siakam (3.8 feet, MAN). Zach Wall misses. Offensive rebound by Tracy Adebayo! Tracy Adebayo kicks it out.

[06:39] Team_090 possession (Score: 13-11)
Zach Wall drives, OG Siakam stays with him. Zach Wall attempts a Dunk. Contested by OG Siakam (4.1 feet, MAN). Zach Wall misses. Offensive rebound by Tracy Adebayo! Tracy Adebayo kicks it out.

[06:26] Team_090 possession (Score: 13-11)
Larry Bridges drives, Larry McGrady stays with him. Larry Bridges attempts a Layup. Contested by Larry McGrady (4.5 feet, MAN). Larry Bridges misses. Rebound secured by Franz Simmons.

[06:11] Team_051 possession (Score: 13-11)
Shaquille Harden drives and kicks out. Austin Sexton attempts a 3Pt. Contested by Derrick Mitchell (3.2 feet, MAN). Austin Sexton misses. Offensive rebound by Franz Simmons! Franz Simmons kicks it out.

[06:02] Team_051 possession (Score: 13-11)
Franz Simmons drives, picks up Gary Brogdon. Help arrives from Larry Bridges! Franz Simmons attempts a Dunk. Contested by Larry Bridges (4.1 feet, ZONE). FRANZ SIMMONS MAKES IT!
Score: 13-13

[05:46] Team_090 possession (Score: 13-13)
Gary Brogdon drives and kicks out. Zach Wall attempts a 3Pt. Contested by OG Siakam (3.9 feet, MAN). ZACH WALL MAKES IT! Assist: Tracy Adebayo
Score: 16-13

[05:35] Team_051 possession (Score: 16-13)
Austin Sexton drives, Derrick Mitchell stays with him. Austin Sexton attempts a Layup. Contested by Derrick Mitchell (3.2 feet, MAN). Austin Sexton misses. Offensive rebound by Shaquille Harden! Shaquille Harden puts it back in!
Score: 16-15

[05:24] Team_090 possession (Score: 16-15)
Gary Brogdon attempts a 3Pt. Contested by Austin Sexton (4.6 feet, ZONE). Gary Brogdon misses. Rebound secured by Shaquille Harden.

[05:15] Team_051 possession (Score: 16-15)
Franz Simmons makes the Layup and draws the foul on Gary Brogdon! And-1! Franz Simmons to the line for 1. [Team fouls: 4] (Gary Brogdon: 3 personal fouls)   FT 1/1: GOOD Franz Simmons makes 1/1 from the line.
Score: 16-18

[05:03] Team_090 possession (Score: 16-18)
Zach Wall attempts a 3Pt. Contested by Austin Sexton (4.7 feet, ZONE). Zach Wall misses. Offensive rebound by Zach Wall! Zach Wall kicks it out.

[04:53] Team_090 possession (Score: 16-18)
Gary Brogdon attempts a 3Pt. Contested by Larry McGrady (4.7 feet, ZONE). Gary Brogdon misses. Rebound secured by OG Siakam.

[04:39] Team_051 possession (Score: 16-18)
Franz Simmons makes the Layup and draws the foul on Gary Brogdon! And-1! Franz Simmons to the line for 1. [BONUS: 5 team fouls] (Gary Brogdon: 4 personal fouls)   FT 1/1: GOOD Franz Simmons makes 1/1 from the line.
Score: 16-21

[04:23] Team_090 possession (Score: 16-21)
Zach Wall drives and kicks out. Zach Wall attempts a 3Pt. Contested by OG Siakam (4.0 feet, MAN). ZACH WALL MAKES IT! Assist: Gary Brogdon
Score: 19-21

[04:09] Team_051 possession (Score: 19-21)
FOUL! Reach-in foul on Gary Brogdon during the drive. [IN THE BONUS! 6 team fouls] Austin Sexton to the line for 2 free throws. (Gary Brogdon: 5 personal fouls)   FT 1/2: GOOD   FT 2/2: GOOD Austin Sexton makes 2/2 from the line.
Score: 19-23

[03:56] Team_090 possession (Score: 19-23)
Gary Brogdon drives to the basket... FOUL! Offensive foul on Gary Brogdon! Franz Simmons drew the charge! [Team fouls: 7] (Gary Brogdon: 6 personal fouls) TURNOVER! (dead ball)

[03:43] Team_051 possession (Score: 19-23)
Franz Simmons drives and kicks out. Franz Simmons attempts a 3Pt. Contested by Larry Bridges (4.9 feet, ZONE). Franz Simmons misses. Rebound secured by Zach Wall.

[03:31] Team_090 possession (Score: 19-23)
Zach Wall attempts a Midrange. Contested by OG Siakam (4.4 feet, MAN). Zach Wall misses. Rebound secured by OG Siakam.

[03:21] Team_051 possession (Score: 19-23)
Shaquille Harden drives, Gary Brogdon stays with him. Shaquille Harden attempts a Layup. Contested by Gary Brogdon (4.0 feet, ZONE). SHAQUILLE HARDEN MAKES IT!
Score: 19-25

[03:01] Team_090 possession (Score: 19-25)
Larry Bridges attempts a 3Pt. Contested by Larry McGrady (4.8 feet, MAN). Larry Bridges misses. Rebound secured by Shaquille Harden.

[02:50] Team_051 possession (Score: 19-25)
Larry McGrady attempts a Midrange. Contested by Larry Bridges (5.3 feet, MAN). Larry McGrady misses. Rebound secured by Tracy Adebayo.

[02:37] Team_090 possession (Score: 19-25)
Larry Bridges drives to the basket... FOUL! Offensive foul on Larry Bridges! Larry McGrady drew the charge! [Team fouls: 8] (Larry Bridges: 1 personal fouls) TURNOVER! (dead ball)

[02:25] Team_051 possession (Score: 19-25)
Larry McGrady attempts a Layup. Contested by Larry Bridges (5.3 feet, MAN). Larry McGrady misses. Rebound secured by Zach Wall.

[02:09] Team_090 possession (Score: 19-25)
Gary Brogdon attempts a 3Pt. Contested by Austin Sexton (4.8 feet, ZONE). Gary Brogdon misses. Rebound secured by OG Siakam.

[01:56] Team_051 possession (Score: 19-25)
Franz Simmons drives to the basket... Franz Simmons commits a violation (traveling/carry)! TURNOVER! (dead ball)

[01:56] Substitution (Team_090): Derrick Mitchell OUT → OG Anunoby IN (stamina_rule2)

[01:56] Substitution (Team_090): Larry Bridges OUT → Josh Wall IN (stamina_rule2)

[01:56] Substitution (Team_090): Zach Wall OUT → Russell Smith IN (stamina_rule2)

[01:56] Substitution (Team_090): Gary Brogdon OUT → Derrick Nowitzki IN (stamina_rule2)

[01:56] Substitution (Team_090): Tracy Adebayo OUT → Tobias Tatum IN (stamina_rule2)

[01:56] Substitution (Team_051): Austin Sexton OUT → Myles Harden IN (stamina_rule2)

[01:56] Substitution (Team_051): Larry McGrady OUT → Zion Morant IN (stamina_rule2)

[01:56] Substitution (Team_051): OG Siakam OUT → Jrue Carter IN (stamina_rule2)

[01:56] Substitution (Team_051): Franz Simmons OUT → Tobias Jokic IN (stamina_rule2)

[01:56] Substitution (Team_051): Shaquille Harden OUT → Pau Tatum IN (stamina_rule2)

[01:44] Team_090 possession (Score: 19-25)
OG Anunoby drives and kicks out. Derrick Nowitzki attempts a 3Pt. Contested by Myles Harden (4.6 feet, ZONE). Derrick Nowitzki misses. Rebound secured by Tobias Jokic.

[01:33] Team_051 possession (Score: 19-25)
Myles Harden drives to the basket... FOUL! Offensive foul on Myles Harden! Derrick Nowitzki drew the charge! [Team fouls: 3] (Myles Harden: 1 personal fouls) TURNOVER! (dead ball)

[01:18] Team_090 possession (Score: 19-25)
FOUL! Holding foul on Jrue Carter. [Team fouls: 4] No free throws, side out. (Jrue Carter: 1 personal fouls)

[01:01] Team_090 possession (Score: 19-25)
Russell Smith attempts a Midrange. Contested by Jrue Carter (4.9 feet, MAN). Russell Smith misses. FOUL! Loose ball foul on Pau Tatum during the rebound battle. [IN THE BONUS! 5 team fouls] Tobias Tatum to the line for 2 free throws. (Pau Tatum: 1 personal fouls)   FT 1/2: MISS   FT 2/2: GOOD Tobias Tatum makes 1/2 from the line.
Score: 20-25

[00:46] Team_051 possession (Score: 20-25)
Tobias Jokic attempts a 3Pt. Contested by Derrick Nowitzki (4.5 feet, MAN). Tobias Jokic misses. Rebound secured by Russell Smith.

[00:32] Team_090 possession (Score: 20-25)
Derrick Nowitzki attempts a Layup. Contested by Pau Tatum (3.9 feet, ZONE). DERRICK NOWITZKI MAKES IT! Assist: Josh Wall
Score: 22-25

[00:19] Team_051 possession (Score: 22-25)
Jrue Carter attempts a 3Pt. Contested by Russell Smith (4.6 feet, ZONE). Jrue Carter misses. Rebound secured by Derrick Nowitzki.

================================================================================
                              1ST QUARTER COMPLETE                              
================================================================================

1ST QUARTER SCORE: Team_090 22, Team_051 25

BOX SCORE:
================================================================================

Team_090
--------------------------------------------------------------------------------
Player                MIN  PTS  REB  AST  TO      FG   FG%      3P   3P%
--------------------------------------------------------------------------------
Zach Wall              10    6    3    2   0   2/3    66.7     0/0   0.0
Tracy Adebayo          10    4    5    3   0   2/3    66.7     0/0   0.0
Gary Brogdon           10    3    2    1   0   1/5    20.0     0/0   0.0
Derrick Mitchell       10    3    0    0   0   1/1   100.0     0/0   0.0
Larry Bridges          10    2    0    1   0   1/4    25.0     0/0   0.0
Derrick Nowitzki        2    2    1    0   0   1/1   100.0     0/0   0.0
Tobias Tatum            2    1    0    0   0   1/1   100.0     0/0   0.0
OG Anunoby              2    0    0    0   0   0/1     0.0     0/0   0.0
Russell Smith           2    0    1    0   0   0/0     0.0     0/0   0.0
Josh Wall               2    0    0    1   0   0/0     0.0     0/0   0.0

TEAM: FG: 9/19 (47.4%), 3PT: 2/9 (22.2%), REB: 12 (5 off, 7 def), AST: 8, TO: 3
TEAM FOULS: 8 [Team_051 in BONUS]


Team_051
--------------------------------------------------------------------------------
Player                MIN  PTS  REB  AST  TO      FG   FG%      3P   3P%
--------------------------------------------------------------------------------
Shaquille Harden       10   12    7    0   0   6/7    85.7     0/0   0.0
Franz Simmons          10   11    2    0   0   4/5    80.0     0/0   0.0
Austin Sexton          10    2    0    0   0   1/1   100.0     0/0   0.0
OG Siakam              10    0    4    1   0   0/1     0.0     0/0   0.0
Larry McGrady          10    0    0    0   0   0/2     0.0     0/0   0.0
Tobias Jokic            2    0    1    0   0   0/1     0.0     0/0   0.0
Jrue Carter             2    0    0    0   0   0/1     0.0     0/0   0.0

TEAM: FG: 11/18 (61.1%), 3PT: 2/5 (40.0%), REB: 14 (4 off, 10 def), AST: 1, TO: 4
TEAM FOULS: 5 [Team_090 in BONUS]

================================================================================

================================================================================
                       2ND QUARTER - Team_090 vs Team_051                       
================================================================================

[12:00] Team_090 possession (Score: 22-25)
Gary Brogdon attempts a Midrange. Contested by Franz Simmons (4.4 feet, MAN). Gary Brogdon misses. Rebound secured by OG Siakam.

[11:50] Team_051 possession (Score: 22-25)
Shaquille Harden attempts a Midrange. Contested by Tracy Adebayo (4.9 feet, MAN). Shaquille Harden misses. Rebound secured by Tracy Adebayo.

[11:37] Team_090 possession (Score: 22-25)
FOUL! Reach-in foul on Shaquille Harden during the drive. [Team fouls: 1] No free throws, side out. (Shaquille Harden: 1 personal fouls)

[11:23] Team_090 possession (Score: 22-25)
Larry Bridges attempts a 3Pt. Contested by Larry McGrady (4.7 feet, MAN). LARRY BRIDGES MAKES IT! Assist: Zach Wall
Score: 25-25

[11:10] Team_051 possession (Score: 25-25)
Larry McGrady attempts a 3Pt. Contested by Gary Brogdon (4.2 feet, ZONE). Larry McGrady misses. Rebound secured by Tracy Adebayo.

[10:52] Team_090 possession (Score: 25-25)
Zach Wall attempts a 3Pt. Contested by OG Siakam (4.4 feet, MAN). ZACH WALL MAKES IT!
Score: 28-25

[10:38] Team_051 possession (Score: 28-25)
Larry McGrady drives, picks up Gary Brogdon. Help arrives from Larry Bridges! Larry McGrady attempts a Dunk. Contested by Larry Bridges (4.3 feet, ZONE). Larry McGrady misses. Rebound secured by Gary Brogdon.

[10:29] Team_090 possession (Score: 28-25)
Zach Wall attempts a Layup. Contested by OG Siakam (4.4 feet, MAN). ZACH WALL MAKES IT!
Score: 30-25

[10:11] Team_051 possession (Score: 30-25)
Franz Simmons attempts a Midrange. Contested by Gary Brogdon (4.5 feet, MAN). Franz Simmons misses. Rebound secured by Zach Wall.

[09:56] Team_090 possession (Score: 30-25)
Gary Brogdon attempts a 3Pt. Contested by Franz Simmons (4.6 feet, MAN). Gary Brogdon misses. Rebound secured by Franz Simmons.

[09:44] Team_051 possession (Score: 30-25)
Shaquille Harden attempts a Layup. Contested by Tracy Adebayo (5.1 feet, MAN). SHAQUILLE HARDEN MAKES IT! Assist: Franz Simmons
Score: 30-27

[09:31] Team_090 possession (Score: 30-27)
Zach Wall attempts a 3Pt. Contested by OG Siakam (4.6 feet, MAN). Zach Wall misses. Rebound secured by Franz Simmons.

[09:14] Team_051 possession (Score: 30-27)
Franz Simmons attempts a 3Pt. Contested by Gary Brogdon (4.7 feet, MAN). FRANZ SIMMONS MAKES IT! Assist: Larry McGrady
Score: 30-30

[09:02] Team_090 possession (Score: 30-30)
Derrick Mitchell attempts a 3Pt. Contested by Austin Sexton (5.0 feet, MAN). Derrick Mitchell misses. Rebound secured by Franz Simmons.

[08:47] Team_051 possession (Score: 30-30)
Franz Simmons attempts a Midrange. Contested by Gary Brogdon (4.8 feet, MAN). FRANZ SIMMONS MAKES IT! Assist: Larry McGrady
Score: 30-32

[08:33] Team_090 possession (Score: 30-32)
Zach Wall makes the Layup and draws the foul on OG Siakam! And-1! Zach Wall to the line for 1. [Team fouls: 2] (OG Siakam: 1 personal fouls)   FT 1/1: GOOD Zach Wall makes 1/1 from the line.
Score: 33-32

[08:16] Team_051 possession (Score: 33-32)
Larry McGrady makes the Layup and draws the foul on Larry Bridges! And-1! Larry McGrady to the line for 1. [Team fouls: 1] (Larry Bridges: 1 personal fouls)   FT 1/1: GOOD Larry McGrady makes 1/1 from the line.
Score: 33-35

[08:03] Team_090 possession (Score: 33-35)
Zach Wall drives, OG Siakam stays with him. Zach Wall attempts a Layup. Contested by OG Siakam (4.7 feet, MAN). ZACH WALL MAKES IT! Assist: Tracy Adebayo
Score: 35-35

[07:46] Team_051 possession (Score: 35-35)
FOUL! Shooting foul on Tracy Adebayo. Shaquille Harden to the line for 2 free throws. [Team fouls: 2] (Tracy Adebayo: 1 personal fouls)   FT 1/2: GOOD   FT 2/2: GOOD Shaquille Harden makes 2/2 from the line.
Score: 35-37

[07:32] Team_090 possession (Score: 35-37)
FOUL! Shooting foul on Larry McGrady. Larry Bridges to the line for 2 free throws. [Team fouls: 3] (Larry McGrady: 1 personal fouls)   FT 1/2: GOOD   FT 2/2: GOOD Larry Bridges makes 2/2 from the line.
Score: 37-37

[07:17] Team_051 possession (Score: 37-37)
OG Siakam attempts a 3Pt. Contested by Derrick Mitchell (3.9 feet, ZONE). OG Siakam misses. Rebound secured by Gary Brogdon.

[07:01] Team_090 possession (Score: 37-37)
Gary Brogdon attempts a 3Pt. Contested by Franz Simmons (4.9 feet, MAN). Gary Brogdon misses. Rebound secured by Franz Simmons.

[06:44] Team_051 possession (Score: 37-37)
Larry McGrady drives, picks up Gary Brogdon. Help arrives from Larry Bridges! Larry McGrady attempts a Layup. Contested by Larry Bridges (4.9 feet, ZONE). LARRY MCGRADY MAKES IT! Assist: Franz Simmons
Score: 37-39

[06:33] Team_090 possession (Score: 37-39)
Derrick Mitchell attempts a 3Pt. Contested by Austin Sexton (5.2 feet, ZONE). Derrick Mitchell misses. Rebound secured by Shaquille Harden.

[06:19] Team_051 possession (Score: 37-39)
OG Siakam attempts a Layup. Contested by Zach Wall (5.7 feet, MAN). OG SIAKAM MAKES IT!
Score: 37-41

[06:03] Team_090 possession (Score: 37-41)
Zach Wall attempts a 3Pt. Contested by Austin Sexton (5.3 feet, ZONE). ZACH WALL MAKES IT! Assist: Derrick Mitchell
Score: 40-41

[05:48] Team_051 possession (Score: 40-41)
Shaquille Harden drives and kicks out. Shaquille Harden attempts a Midrange. Contested by Tracy Adebayo (5.8 feet, MAN). SHAQUILLE HARDEN MAKES IT! Assist: Franz Simmons
Score: 40-43

[05:33] Team_090 possession (Score: 40-43)
Zach Wall drives to the basket... Zach Wall throws a bad pass! Stolen by Shaquille Harden! TURNOVER! (live ball)

[05:20] Team_051 possession (Score: 40-43)
OG Siakam drives, picks up Gary Brogdon. Help arrives from Larry Bridges! OG Siakam attempts a Layup. Contested by Larry Bridges (5.1 feet, ZONE). OG SIAKAM MAKES IT! Assist: Shaquille Harden
Score: 40-45

[05:05] Team_090 possession (Score: 40-45)
Gary Brogdon drives, Franz Simmons stays with him. Gary Brogdon attempts a Dunk. Contested by Franz Simmons (5.1 feet, MAN). GARY BROGDON MAKES IT! Assist: Derrick Mitchell
Score: 42-45

[04:50] Team_051 possession (Score: 42-45)
Shaquille Harden throws a bad pass! Stolen by Tracy Adebayo! TURNOVER! (live ball)

[04:36] Team_090 possession (Score: 42-45)
Zach Wall attempts a 3Pt. Contested by OG Siakam (5.2 feet, MAN). Zach Wall misses. Rebound secured by Shaquille Harden.

[04:26] Team_051 possession (Score: 42-45)
OG Siakam drives to the basket... OG Siakam throws a bad pass! Stolen by Zach Wall! TURNOVER! (live ball)

[04:12] Team_090 possession (Score: 42-45)
FOUL! Offensive foul on Zach Wall! OG Siakam drew the charge! [Team fouls: 3] (Zach Wall: 1 personal fouls) TURNOVER! (dead ball)

[03:56] Team_051 possession (Score: 42-45)
FOUL! Holding foul on Tracy Adebayo. [Team fouls: 4] No free throws, side out. (Tracy Adebayo: 2 personal fouls)

[03:41] Team_051 possession (Score: 42-45)
Austin Sexton attempts a Layup. Contested by Derrick Mitchell (4.2 feet, MAN). AUSTIN SEXTON MAKES IT! Assist: Shaquille Harden
Score: 42-47

[03:27] Team_090 possession (Score: 42-47)
Tracy Adebayo drives, Shaquille Harden stays with him. Tracy Adebayo attempts a Layup. Contested by Shaquille Harden (5.1 feet, MAN). Tracy Adebayo misses. Rebound secured by Shaquille Harden.

[03:13] Team_051 possession (Score: 42-47)
FOUL! Shooting foul on Derrick Mitchell. Austin Sexton to the line for 2 free throws. [BONUS: 5 team fouls] (Derrick Mitchell: 1 personal fouls)   FT 1/2: GOOD   FT 2/2: GOOD Austin Sexton makes 2/2 from the line.
Score: 42-49

[02:59] Team_090 possession (Score: 42-49)
Derrick Mitchell attempts a 3Pt. Contested by Austin Sexton (5.7 feet, MAN). DERRICK MITCHELL MAKES IT! Assist: Larry Bridges
Score: 45-49

[02:45] Team_051 possession (Score: 45-49)
Franz Simmons attempts a 3Pt. Contested by Gary Brogdon (5.8 feet, MAN). FRANZ SIMMONS MAKES IT!
Score: 45-52

[02:32] Team_090 possession (Score: 45-52)
FOUL! Holding foul on OG Siakam. [Team fouls: 4] No free throws, side out. (OG Siakam: 2 personal fouls)

[02:19] Team_090 possession (Score: 45-52)
Derrick Mitchell attempts a 3Pt. Contested by Austin Sexton (5.8 feet, ZONE). Derrick Mitchell misses. FOUL! Loose ball foul on OG Siakam during the rebound battle. [IN THE BONUS! 5 team fouls] Tracy Adebayo to the line for 2 free throws. (OG Siakam: 3 personal fouls)   FT 1/2: GOOD   FT 2/2: GOOD Tracy Adebayo makes 2/2 from the line.
Score: 47-52

[02:01] Team_051 possession (Score: 47-52)
Shaquille Harden drives and kicks out. Shaquille Harden attempts a 3Pt. Contested by Derrick Mitchell (4.6 feet, ZONE). Shaquille Harden misses. Rebound secured by Larry Bridges.

[01:44] Team_090 possession (Score: 47-52)
Tracy Adebayo attempts a Layup. Contested by Shaquille Harden (5.4 feet, MAN). TRACY ADEBAYO MAKES IT!
Score: 49-52

[01:31] Team_051 possession (Score: 49-52)
FOUL! Holding foul on Derrick Mitchell. [IN THE BONUS! 6 team fouls] Austin Sexton to the line for 2 free throws. (Derrick Mitchell: 2 personal fouls)   FT 1/2: MISS   FT 2/2: GOOD Austin Sexton makes 1/2 from the line.
Score: 49-53

[01:17] Team_090 possession (Score: 49-53)
Larry Bridges drives to the basket... Larry Bridges loses control! Ball rolls out of bounds! TURNOVER! (dead ball)

[01:17] Substitution (Team_090): Derrick Mitchell OUT → OG Anunoby IN (stamina_rule2)

[01:17] Substitution (Team_090): Larry Bridges OUT → Josh Wall IN (stamina_rule2)

[01:17] Substitution (Team_090): Zach Wall OUT → Russell Smith IN (stamina_rule2)

[01:17] Substitution (Team_090): Gary Brogdon OUT → Derrick Nowitzki IN (stamina_rule2)

[01:17] Substitution (Team_090): Tracy Adebayo OUT → Tobias Tatum IN (stamina_rule2)

[01:17] Substitution (Team_051): Austin Sexton OUT → Myles Harden IN (stamina_rule2)

[01:17] Substitution (Team_051): Larry McGrady OUT → Zion Morant IN (stamina_rule2)

[01:17] Substitution (Team_051): OG Siakam OUT → Jrue Carter IN (stamina_rule2)

[01:17] Substitution (Team_051): Franz Simmons OUT → Tobias Jokic IN (stamina_rule2)

[01:17] Substitution (Team_051): Shaquille Harden OUT → Pau Tatum IN (stamina_rule2)

[01:00] Team_051 possession (Score: 49-53)
Tobias Jokic attempts a 3Pt. Contested by OG Anunoby (5.2 feet, ZONE). Tobias Jokic misses. Rebound secured by Tobias Tatum.

[00:46] Team_090 possession (Score: 49-53)
FOUL! Shooting foul on Zion Morant. Josh Wall to the line for 2 free throws. [BONUS: 6 team fouls] (Zion Morant: 1 personal fouls)   FT 1/2: GOOD   FT 2/2: MISS Josh Wall makes 1/2 from the line. Offensive rebound by Russell Smith! Russell Smith kicks it out.
Score: 50-53

[00:27] Team_090 possession (Score: 50-53)
Tobias Tatum drives to the basket... Tobias Tatum loses the ball! Stripped by Pau Tatum! TURNOVER! (live ball)

[00:12] Team_051 possession (Score: 50-53)
Myles Harden attempts a 3Pt. Contested by OG Anunoby (4.8 feet, MAN). Myles Harden misses. Offensive rebound by Pau Tatum! Pau Tatum puts it back in!
Score: 50-55

================================================================================
                              2ND QUARTER COMPLETE                              
================================================================================

2ND QUARTER SCORE: Team_090 28, Team_051 30

BOX SCORE:
================================================================================

Team_090
--------------------------------------------------------------------------------
Player                MIN  PTS  REB  AST  TO      FG   FG%      3P   3P%
--------------------------------------------------------------------------------
Zach Wall              21   13    1    1   0   5/7    71.4     0/0   0.0
Larry Bridges          21    5    1    1   0   2/2   100.0     0/0   0.0
Tracy Adebayo          21    4    2    1   0   2/3    66.7     0/0   0.0
Derrick Mitchell       21    3    0    2   0   1/3    33.3     0/0   0.0
Gary Brogdon           21    2    2    0   0   1/4    25.0     0/0   0.0
Tobias Tatum            3    0    1    0   0   0/0     0.0     0/0   0.0
Russell Smith           3    0    1    0   0   0/0     0.0     0/0   0.0

TEAM: FG: 11/19 (57.9%), 3PT: 5/11 (45.5%), REB: 8 (1 off, 7 def), AST: 5, TO: 4
TEAM FOULS: 6 [Team_051 in BONUS]


Team_051
--------------------------------------------------------------------------------
Player                MIN  PTS  REB  AST  TO      FG   FG%      3P   3P%
--------------------------------------------------------------------------------
Franz Simmons          21    8    4    3   0   3/4    75.0     0/0   0.0
Shaquille Harden       21    6    3    2   0   3/5    60.0     0/0   0.0
Larry McGrady          21    5    0    2   0   2/4    50.0     0/0   0.0
Austin Sexton          21    5    0    0   0   3/3   100.0     0/0   0.0
OG Siakam              21    4    1    0   0   2/3    66.7     0/0   0.0
Pau Tatum               3    2    1    0   0   1/1   100.0     0/0   0.0
Tobias Jokic            3    0    0    0   0   0/1     0.0     0/0   0.0

TEAM: FG: 14/21 (66.7%), 3PT: 3/6 (50.0%), REB: 9 (1 off, 8 def), AST: 7, TO: 2
TEAM FOULS: 6 [Team_090 in BONUS]

================================================================================

================================================================================
                       3RD QUARTER - Team_090 vs Team_051                       
================================================================================

[12:00] Team_090 possession (Score: 50-55)
Zach Wall drives and kicks out. Larry Bridges attempts a 3Pt. Contested by Austin Sexton (4.4 feet, ZONE). Larry Bridges misses. Rebound secured by OG Siakam.

[11:46] Team_051 possession (Score: 50-55)
Franz Simmons attempts a Layup. Contested by Gary Brogdon (4.1 feet, ZONE). Franz Simmons misses. Rebound secured by Gary Brogdon.

[11:34] Team_090 possession (Score: 50-55)
Derrick Mitchell drives, Franz Simmons stays with him. Derrick Mitchell attempts a Dunk. Contested by Franz Simmons (4.5 feet, ZONE). DERRICK MITCHELL MAKES IT! Assist: Larry Bridges
Score: 52-55

[11:20] Team_051 possession (Score: 52-55)
Austin Sexton attempts a Layup. Contested by Derrick Mitchell (3.2 feet, MAN). AUSTIN SEXTON MAKES IT!
Score: 52-57

[11:06] Team_090 possession (Score: 52-57)
FOUL! Reach-in foul on Franz Simmons during the drive. [Team fouls: 1] No free throws, side out. (Franz Simmons: 1 personal fouls)

[10:49] Team_090 possession (Score: 52-57)
Tracy Adebayo attempts a Midrange. Contested by OG Siakam (3.7 feet, ZONE). TRACY ADEBAYO MAKES IT! Assist: Gary Brogdon
Score: 54-57

[10:33] Team_051 possession (Score: 54-57)
Franz Simmons throws a bad pass! Stolen by Gary Brogdon! TURNOVER! (live ball)

[10:17] Team_090 possession (Score: 54-57)
Larry Bridges attempts a 3Pt. Contested by Larry McGrady (4.5 feet, MAN). Larry Bridges misses. Offensive rebound by Gary Brogdon! Gary Brogdon kicks it out.

[10:05] Team_090 possession (Score: 54-57)
FOUL! Reach-in foul on Franz Simmons during the drive. [Team fouls: 2] No free throws, side out. (Franz Simmons: 2 personal fouls)

[09:51] Team_090 possession (Score: 54-57)
Tracy Adebayo attempts a Midrange. Contested by OG Siakam (3.7 feet, ZONE). Tracy Adebayo misses. Rebound secured by Shaquille Harden.

[09:36] Team_051 possession (Score: 54-57)
Austin Sexton attempts a Midrange. Contested by Larry Bridges (4.8 feet, ZONE). AUSTIN SEXTON MAKES IT! Assist: Shaquille Harden
Score: 54-59

[09:22] Team_090 possession (Score: 54-59)
Larry Bridges attempts a 3Pt. Contested by Austin Sexton (4.4 feet, ZONE). Larry Bridges misses. FOUL! Loose ball foul on Franz Simmons during the rebound battle. [Team fouls: 3] No free throws, side out. (Franz Simmons: 3 personal fouls)

[09:08] Team_090 possession (Score: 54-59)
Larry Bridges drives and kicks out. Zach Wall attempts a Midrange. Contested by OG Siakam (3.8 feet, MAN). ZACH WALL MAKES IT!
Score: 56-59

[08:55] Team_051 possession (Score: 56-59)
Larry McGrady attempts a 3Pt. Contested by Derrick Mitchell (3.5 feet, ZONE). Larry McGrady misses. Rebound secured by Gary Brogdon.

[08:41] Team_090 possession (Score: 56-59)
Gary Brogdon attempts a 3Pt. Contested by Austin Sexton (4.6 feet, ZONE). Gary Brogdon misses. Rebound secured by Shaquille Harden.

[08:27] Team_051 possession (Score: 56-59)
OG Siakam attempts a Midrange. Contested by Gary Brogdon (3.9 feet, ZONE). OG SIAKAM MAKES IT! Assist: Larry McGrady
Score: 56-61

[08:14] Team_090 possession (Score: 56-61)
Larry Bridges drives and kicks out. Larry Bridges attempts a 3Pt. Contested by Larry McGrady (4.4 feet, MAN). Larry Bridges misses. Rebound secured by Shaquille Harden.

[08:00] Team_051 possession (Score: 56-61)
Austin Sexton drives and kicks out. Larry McGrady attempts a 3Pt. Contested by Derrick Mitchell (3.2 feet, ZONE). Larry McGrady misses. Offensive rebound by Shaquille Harden! Shaquille Harden puts it back in!
Score: 56-63

[07:48] Team_090 possession (Score: 56-63)
Larry Bridges attempts a 3Pt. Contested by Larry McGrady (4.5 feet, MAN). Larry Bridges misses. Offensive rebound by Tracy Adebayo! Tracy Adebayo kicks it out.

[07:33] Team_090 possession (Score: 56-63)
Gary Brogdon attempts a 3Pt. Contested by Franz Simmons (4.4 feet, MAN). GARY BROGDON MAKES IT! Assist: Larry Bridges
Score: 59-63

[07:20] Team_051 possession (Score: 59-63)
FOUL! Shooting foul on Larry Bridges. Shaquille Harden to the line for 2 free throws. [Team fouls: 1] (Larry Bridges: 1 personal fouls)   FT 1/2: GOOD   FT 2/2: MISS Shaquille Harden makes 1/2 from the line. Rebound secured by Tracy Adebayo.
Score: 59-64

[07:06] Team_090 possession (Score: 59-64)
Zach Wall attempts a 3Pt. Contested by OG Siakam (4.1 feet, MAN). Zach Wall misses. Offensive rebound by Gary Brogdon! Gary Brogdon kicks it out.

[06:52] Team_090 possession (Score: 59-64)
Tracy Adebayo attempts a Layup. Contested by Franz Simmons (4.0 feet, ZONE). Tracy Adebayo misses. Rebound secured by OG Siakam.

[06:41] Team_051 possession (Score: 59-64)
OG Siakam drives to the basket... OG Siakam loses the ball! Stripped by Gary Brogdon! TURNOVER! (live ball)

[06:24] Team_090 possession (Score: 59-64)
Zach Wall attempts a Midrange. Contested by OG Siakam (4.1 feet, MAN). Zach Wall misses. Offensive rebound by Tracy Adebayo! Tracy Adebayo kicks it out.

[06:09] Team_090 possession (Score: 59-64)
Tracy Adebayo attempts a Midrange. Contested by Shaquille Harden (4.0 feet, MAN). Tracy Adebayo misses. Offensive rebound by Tracy Adebayo! Tracy Adebayo kicks it out.

[05:59] Team_090 possession (Score: 59-64)
Zach Wall attempts a Midrange. Contested by Franz Simmons (4.5 feet, ZONE). Zach Wall misses. Rebound secured by Shaquille Harden.

[05:48] Team_051 possession (Score: 59-64)
Shaquille Harden drives and kicks out. Franz Simmons attempts a Midrange. Contested by Gary Brogdon (3.7 feet, MAN). FRANZ SIMMONS MAKES IT!
Score: 59-66

[05:32] Team_090 possession (Score: 59-66)
Gary Brogdon attempts a Midrange. Contested by Franz Simmons (4.4 feet, MAN). Gary Brogdon misses. Rebound secured by Shaquille Harden.

[05:17] Team_051 possession (Score: 59-66)
Shaquille Harden attempts a Midrange. Contested by Gary Brogdon (3.7 feet, ZONE). Shaquille Harden misses. Offensive rebound by Shaquille Harden! Shaquille Harden's putback is no good. Rebound secured by Tracy Adebayo.

[05:02] Team_090 possession (Score: 59-66)
Gary Brogdon attempts a Midrange. Contested by Franz Simmons (4.4 feet, MAN). GARY BROGDON MAKES IT!
Score: 61-66

[04:47] Team_051 possession (Score: 61-66)
Larry McGrady makes the 3Pt and draws the foul on Derrick Mitchell! And-1! Larry McGrady to the line for 1. [Team fouls: 2] (Derrick Mitchell: 1 personal fouls)   FT 1/1: GOOD Larry McGrady makes 1/1 from the line.
Score: 61-70

[04:31] Team_090 possession (Score: 61-70)
Gary Brogdon attempts a Layup. BLOCKED BY AUSTIN SEXTON! Ball is loose! Rebound secured by Franz Simmons.

[04:16] Team_051 possession (Score: 61-70)
FOUL! Shooting foul on Zach Wall. OG Siakam to the line for 3 free throws. [Team fouls: 3] (Zach Wall: 1 personal fouls)   FT 1/3: GOOD   FT 2/3: GOOD   FT 3/3: GOOD OG Siakam makes 3/3 from the line.
Score: 61-73

[03:58] Team_090 possession (Score: 61-73)
Derrick Mitchell drives, Austin Sexton stays with him. Derrick Mitchell attempts a Layup. Contested by Austin Sexton (4.8 feet, MAN). Derrick Mitchell misses. Rebound secured by Franz Simmons.

[03:47] Team_051 possession (Score: 61-73)
Larry McGrady throws a bad pass out of bounds! TURNOVER! (dead ball)

[03:47] Substitution (Team_090): Gary Brogdon OUT → Derrick Nowitzki IN (stamina_rule2)

[03:31] Team_090 possession (Score: 61-73)
Tracy Adebayo drives to the basket... FOUL! Offensive foul on Tracy Adebayo! Franz Simmons drew the charge! [Team fouls: 4] (Tracy Adebayo: 1 personal fouls) TURNOVER! (dead ball)

[03:18] Team_051 possession (Score: 61-73)
Larry McGrady attempts a Layup. Contested by Derrick Nowitzki (4.6 feet, ZONE). LARRY MCGRADY MAKES IT! Assist: Franz Simmons
Score: 61-75

[03:06] Team_090 possession (Score: 61-75)
Larry Bridges drives and kicks out. Derrick Mitchell attempts a Midrange. Contested by Austin Sexton (4.5 feet, MAN). DERRICK MITCHELL MAKES IT!
Score: 63-75

[02:50] Team_051 possession (Score: 63-75)
FOUL! Reach-in foul on Derrick Nowitzki during the drive. [IN THE BONUS! 5 team fouls] Larry McGrady to the line for 2 free throws. (Derrick Nowitzki: 1 personal fouls)   FT 1/2: GOOD   FT 2/2: GOOD Larry McGrady makes 2/2 from the line.
Score: 63-77

[02:37] Team_090 possession (Score: 63-77)
FOUL! Holding foul on Austin Sexton. [Team fouls: 4] No free throws, side out. (Austin Sexton: 1 personal fouls)

[02:24] Team_090 possession (Score: 63-77)
Larry Bridges attempts a Midrange. Contested by Larry McGrady (4.8 feet, MAN). LARRY BRIDGES MAKES IT!
Score: 65-77

[02:06] Team_051 possession (Score: 65-77)
FOUL! Shooting foul on Derrick Nowitzki. Shaquille Harden to the line for 2 free throws. [BONUS: 6 team fouls] (Derrick Nowitzki: 2 personal fouls)   FT 1/2: GOOD   FT 2/2: MISS Shaquille Harden makes 1/2 from the line. Rebound secured by Tracy Adebayo.
Score: 65-78

[01:51] Team_090 possession (Score: 65-78)
Tracy Adebayo attempts a Midrange. Contested by Shaquille Harden (4.3 feet, MAN). Tracy Adebayo misses. FOUL! Loose ball foul on OG Siakam during the rebound battle. [IN THE BONUS! 5 team fouls] Zach Wall to the line for 2 free throws. (OG Siakam: 1 personal fouls)   FT 1/2: GOOD   FT 2/2: MISS Zach Wall makes 1/2 from the line. Offensive rebound by Tracy Adebayo! Tracy Adebayo kicks it out.
Score: 66-78

[01:39] Team_090 possession (Score: 66-78)
FOUL! Reach-in foul on Franz Simmons during the drive. [IN THE BONUS! 6 team fouls] Derrick Nowitzki to the line for 2 free throws. (Franz Simmons: 4 personal fouls)   FT 1/2: GOOD   FT 2/2: GOOD Derrick Nowitzki makes 2/2 from the line.
Score: 68-78

[01:23] Team_051 possession (Score: 68-78)
Franz Simmons attempts a 3Pt. Contested by Derrick Mitchell (4.0 feet, ZONE). Franz Simmons misses. Rebound secured by Derrick Nowitzki.

[01:07] Team_090 possession (Score: 68-78)
Derrick Nowitzki drives and kicks out. Tracy Adebayo makes the Midrange and draws the foul on Franz Simmons! And-1! Tracy Adebayo to the line for 1. [BONUS: 7 team fouls] (Franz Simmons: 5 personal fouls)   FT 1/1: GOOD Tracy Adebayo makes 1/1 from the line.
Score: 71-78

[00:52] Team_051 possession (Score: 71-78)
Austin Sexton attempts a 3Pt. Contested by Derrick Mitchell (3.6 feet, MAN). Austin Sexton misses. Rebound secured by Zach Wall.

[00:40] Team_090 possession (Score: 71-78)
Larry Bridges attempts a 3Pt. Contested by Austin Sexton (4.8 feet, ZONE). Larry Bridges misses. Rebound secured by Shaquille Harden.

[00:27] Team_051 possession (Score: 71-78)
Shaquille Harden drives and kicks out. Larry McGrady attempts a 3Pt. Contested by Derrick Mitchell (3.7 feet, ZONE). LARRY MCGRADY MAKES IT! Assist: Austin Sexton
Score: 71-81

[00:15] Team_090 possession (Score: 71-81)
Tracy Adebayo drives and kicks out. Derrick Mitchell attempts a Midrange. Contested by Austin Sexton (4.9 feet, MAN). DERRICK MITCHELL MAKES IT! Assist: Zach Wall
Score: 73-81

================================================================================
                              3RD QUARTER COMPLETE                              
================================================================================

3RD QUARTER SCORE: Team_090 23, Team_051 26

BOX SCORE:
================================================================================

Team_090
--------------------------------------------------------------------------------
Player                MIN  PTS  REB  AST  TO      FG   FG%      3P   3P%
--------------------------------------------------------------------------------
Derrick Mitchell       33    6    0    0   0   3/4    75.0     0/0   0.0
Gary Brogdon           30    5    4    1   0   2/5    40.0     0/0   0.0
Tracy Adebayo          33    5    8    0   0   2/4    50.0     0/0   0.0
Zach Wall              33    2    1    1   0   1/3    33.3     0/0   0.0
Larry Bridges          33    2    0    2   0   1/3    33.3     0/0   0.0
Derrick Nowitzki        6    2    1    0   0   1/1   100.0     0/0   0.0

TEAM: FG: 10/20 (50.0%), 3PT: 1/3 (33.3%), REB: 13 (7 off, 6 def), AST: 4, TO: 1
TEAM FOULS: 6 [Team_051 in BONUS]


Team_051
--------------------------------------------------------------------------------
Player                MIN  PTS  REB  AST  TO      FG   FG%      3P   3P%
--------------------------------------------------------------------------------
Larry McGrady          33   11    0    1   0   4/5    80.0     0/0   0.0
OG Siakam              33    5    2    0   0   2/2   100.0     0/0   0.0
Austin Sexton          33    4    0    1   0   2/3    66.7     0/0   0.0
Franz Simmons          33    2    2    1   0   1/3    33.3     0/0   0.0
Shaquille Harden       33    2    7    1   0   1/4    25.0     0/0   0.0

TEAM: FG: 10/17 (58.8%), 3PT: 2/5 (40.0%), REB: 12 (2 off, 10 def), AST: 4, TO: 3
TEAM FOULS: 7 [Team_090 in BONUS]

================================================================================

================================================================================
                       4TH QUARTER - Team_090 vs Team_051                       
================================================================================

[12:00] Team_090 possession (Score: 73-81)
Derrick Mitchell attempts a 3Pt. Contested by Larry McGrady (5.1 feet, ZONE). Derrick Mitchell misses. Rebound secured by Franz Simmons.

[11:44] Team_051 possession (Score: 73-81)
Austin Sexton attempts a Layup. Contested by Derrick Mitchell (3.5 feet, MAN). Austin Sexton misses. Rebound secured by Tracy Adebayo.

[11:25] Team_090 possession (Score: 73-81)
Zach Wall attempts a 3Pt. Contested by Austin Sexton (4.9 feet, ZONE). ZACH WALL MAKES IT! Assist: Tracy Adebayo
Score: 76-81

[11:10] Team_051 possession (Score: 76-81)
Shaquille Harden attempts a 3Pt. Contested by Derrick Mitchell (3.5 feet, ZONE). Shaquille Harden misses. Rebound secured by Zach Wall.

[10:59] Team_090 possession (Score: 76-81)
Tracy Adebayo attempts a Layup. Contested by Shaquille Harden (4.4 feet, MAN). Tracy Adebayo misses. Rebound secured by Shaquille Harden.

[10:46] Team_051 possession (Score: 76-81)
FOUL! Reach-in foul on Gary Brogdon during the drive. [Team fouls: 1] No free throws, side out. (Gary Brogdon: 1 personal fouls)

[10:30] Team_051 possession (Score: 76-81)
Larry McGrady attempts a 3Pt. Contested by Larry Bridges (5.4 feet, MAN). LARRY MCGRADY MAKES IT! Assist: Franz Simmons
Score: 76-84

[10:16] Team_090 possession (Score: 76-84)
Gary Brogdon drives, Franz Simmons stays with him. Gary Brogdon attempts a Dunk. Contested by Franz Simmons (4.9 feet, MAN). Gary Brogdon misses. Rebound secured by OG Siakam.

[10:00] Team_051 possession (Score: 76-84)
OG Siakam drives and kicks out. Shaquille Harden attempts a 3Pt. Contested by Gary Brogdon (3.8 feet, MAN). Shaquille Harden misses. Rebound secured by Tracy Adebayo.

[09:45] Team_090 possession (Score: 76-84)
Tracy Adebayo attempts a Layup. Contested by Franz Simmons (4.5 feet, ZONE). Tracy Adebayo misses. Rebound secured by Shaquille Harden.

[09:31] Team_051 possession (Score: 76-84)
Shaquille Harden attempts a 3Pt. Contested by Gary Brogdon (3.7 feet, ZONE). Shaquille Harden misses. Rebound secured by Tracy Adebayo.

[09:13] Team_090 possession (Score: 76-84)
Larry Bridges attempts a Midrange. Contested by Larry McGrady (5.1 feet, MAN). LARRY BRIDGES MAKES IT! Assist: Gary Brogdon
Score: 78-84

[09:00] Team_051 possession (Score: 78-84)
Franz Simmons attempts a 3Pt. Contested by Gary Brogdon (4.2 feet, ZONE). Franz Simmons misses. FOUL! Loose ball foul on Tracy Adebayo during the rebound battle. [Team fouls: 2] No free throws, side out. (Tracy Adebayo: 1 personal fouls)

[08:45] Team_051 possession (Score: 78-84)
Austin Sexton attempts a 3Pt. Contested by Derrick Mitchell (3.8 feet, MAN). Austin Sexton misses. Rebound secured by Gary Brogdon.

[08:29] Team_090 possession (Score: 78-84)
Larry Bridges attempts a Layup. BLOCKED BY LARRY MCGRADY! Ball deflects out of bounds off Larry Bridges.

[08:15] Team_051 possession (Score: 78-84)
FOUL! Shooting foul on Derrick Mitchell. Austin Sexton to the line for 2 free throws. [Team fouls: 3] (Derrick Mitchell: 1 personal fouls)   FT 1/2: GOOD   FT 2/2: GOOD Austin Sexton makes 2/2 from the line.
Score: 78-86

[08:01] Team_090 possession (Score: 78-86)
Gary Brogdon loses control! Ball rolls out of bounds! TURNOVER! (dead ball)

[08:01] Substitution (Team_090): Derrick Mitchell OUT → OG Anunoby IN (stamina_rule2)

[08:01] Substitution (Team_090): Larry Bridges OUT → Josh Wall IN (stamina_rule2)

[08:01] Substitution (Team_090): Zach Wall OUT → Russell Smith IN (stamina_rule2)

[08:01] Substitution (Team_090): Gary Brogdon OUT → Derrick Nowitzki IN (stamina_rule2)

[08:01] Substitution (Team_090): Tracy Adebayo OUT → Tobias Tatum IN (stamina_rule2)

[08:01] Substitution (Team_051): Austin Sexton OUT → Myles Harden IN (stamina_rule2)

[08:01] Substitution (Team_051): Larry McGrady OUT → Zion Morant IN (stamina_rule2)

[08:01] Substitution (Team_051): OG Siakam OUT → Jrue Carter IN (stamina_rule2)

[08:01] Substitution (Team_051): Franz Simmons OUT → Tobias Jokic IN (stamina_rule2)

[08:01] Substitution (Team_051): Shaquille Harden OUT → Pau Tatum IN (stamina_rule2)

[07:51] Team_051 possession (Score: 78-86)
Jrue Carter attempts a Midrange. Contested by Russell Smith (4.6 feet, MAN). Jrue Carter misses. Offensive rebound by Pau Tatum! Pau Tatum's putback is no good. Rebound secured by Tobias Tatum.

[07:36] Team_090 possession (Score: 78-86)
Derrick Nowitzki drives, picks up Tobias Jokic. Help arrives from Myles Harden! Derrick Nowitzki attempts a Dunk. Contested by Myles Harden (4.8 feet, MAN). DERRICK NOWITZKI MAKES IT!
Score: 80-86

[07:19] Team_051 possession (Score: 80-86)
Myles Harden attempts a 3Pt. Contested by Josh Wall (3.9 feet, ZONE). MYLES HARDEN MAKES IT!
Score: 80-89

[07:02] Team_090 possession (Score: 80-89)
Tobias Tatum attempts a 3Pt. Contested by Myles Harden (5.3 feet, ZONE). Tobias Tatum misses. Rebound secured by Myles Harden.

[06:47] Team_051 possession (Score: 80-89)
Jrue Carter attempts a 3Pt. Contested by Russell Smith (4.6 feet, MAN). JRUE CARTER MAKES IT! Assist: Myles Harden
Score: 80-92

[06:31] Team_090 possession (Score: 80-92)
OG Anunoby attempts a Midrange. Contested by Myles Harden (4.7 feet, ZONE). OG Anunoby misses. Offensive rebound by Russell Smith! Russell Smith kicks it out.

[06:13] Team_090 possession (Score: 80-92)
OG Anunoby drives and kicks out. Derrick Nowitzki attempts a Midrange. Contested by Tobias Jokic (5.2 feet, ZONE). Derrick Nowitzki misses. Offensive rebound by Russell Smith! Russell Smith kicks it out.

[05:55] Team_090 possession (Score: 80-92)
Russell Smith drives and kicks out. Tobias Tatum attempts a 3Pt. Contested by Myles Harden (4.6 feet, ZONE). Tobias Tatum misses. Rebound secured by Pau Tatum.

[05:42] Team_051 possession (Score: 80-92)
Pau Tatum attempts a Dunk. BLOCKED BY TOBIAS TATUM! Ball is loose! Rebound secured by Derrick Nowitzki.

[05:25] Team_090 possession (Score: 80-92)
Josh Wall attempts a Midrange. Contested by Zion Morant (6.0 feet, ZONE). Josh Wall misses. Rebound secured by Myles Harden.

[05:15] Team_051 possession (Score: 80-92)
Jrue Carter drives and kicks out. Myles Harden attempts a Midrange. Contested by Derrick Nowitzki (4.3 feet, ZONE). Myles Harden misses. Rebound secured by Russell Smith.

[05:05] Team_090 possession (Score: 80-92)
Russell Smith drives, Pau Tatum stays with him. Russell Smith attempts a Dunk. Contested by Pau Tatum (4.6 feet, ZONE). RUSSELL SMITH MAKES IT!
Score: 82-92

[04:48] Team_051 possession (Score: 82-92)
FOUL! Holding foul on Tobias Tatum. [Team fouls: 4] No free throws, side out. (Tobias Tatum: 1 personal fouls)

[04:31] Team_051 possession (Score: 82-92)
Tobias Jokic attempts a Layup. Contested by Derrick Nowitzki (4.5 feet, ZONE). TOBIAS JOKIC MAKES IT!
Score: 82-94

[04:13] Team_090 possession (Score: 82-94)
Tobias Tatum attempts a Midrange. Contested by Jrue Carter (5.4 feet, ZONE). Tobias Tatum misses. Rebound secured by Pau Tatum.

[03:56] Team_051 possession (Score: 82-94)
Myles Harden attempts a Layup. Contested by OG Anunoby (4.8 feet, MAN). MYLES HARDEN MAKES IT! Assist: Jrue Carter
Score: 82-96

[03:39] Team_090 possession (Score: 82-96)
Josh Wall attempts a Midrange. Contested by Zion Morant (6.0 feet, MAN). Josh Wall misses. Rebound secured by Tobias Jokic.

[03:26] Team_051 possession (Score: 82-96)
Myles Harden drives and kicks out. Zion Morant attempts a 3Pt. Contested by Josh Wall (4.1 feet, MAN). Zion Morant misses. Offensive rebound by Pau Tatum! Pau Tatum puts it back in!
Score: 82-98

[03:15] Team_090 possession (Score: 82-98)
Josh Wall attempts a Midrange. Contested by Jrue Carter (5.0 feet, ZONE). JOSH WALL MAKES IT!
Score: 84-98

[02:57] Team_051 possession (Score: 84-98)
Pau Tatum attempts a Layup. Contested by Derrick Nowitzki (4.2 feet, ZONE). Pau Tatum misses. Rebound secured by Derrick Nowitzki.

[02:41] Team_090 possession (Score: 84-98)
Josh Wall attempts a Midrange. Contested by Zion Morant (6.0 feet, ZONE). Josh Wall misses. Rebound secured by Pau Tatum.

[02:30] Team_051 possession (Score: 84-98)
Tobias Jokic attempts a Layup. Contested by Derrick Nowitzki (4.6 feet, MAN). Tobias Jokic misses. Rebound secured by Russell Smith.

[02:13] Team_090 possession (Score: 84-98)
Josh Wall attempts a 3Pt. Contested by Zion Morant (6.0 feet, MAN). Josh Wall misses. Rebound secured by Pau Tatum.

[02:01] Team_051 possession (Score: 84-98)
Tobias Jokic attempts a Midrange. Contested by Derrick Nowitzki (4.6 feet, MAN). Tobias Jokic misses. FOUL! Loose ball foul on Russell Smith during the rebound battle. [IN THE BONUS! 5 team fouls] Pau Tatum to the line for 2 free throws. (Russell Smith: 1 personal fouls)   FT 1/2: GOOD   FT 2/2: GOOD Pau Tatum makes 2/2 from the line.
Score: 84-100

[01:50] Team_090 possession (Score: 84-100)
Russell Smith attempts a 3Pt. Contested by Jrue Carter (4.9 feet, MAN). Russell Smith misses. Rebound secured by Tobias Jokic.

[01:37] Team_051 possession (Score: 84-100)
Myles Harden drives and kicks out. Zion Morant attempts a 3Pt. Contested by Russell Smith (4.3 feet, ZONE). Zion Morant misses. Rebound secured by Derrick Nowitzki.

[01:23] Team_090 possession (Score: 84-100)
Derrick Nowitzki attempts a Midrange. Contested by Jrue Carter (4.2 feet, ZONE). DERRICK NOWITZKI MAKES IT!
Score: 86-100

[01:07] Team_051 possession (Score: 86-100)
Jrue Carter drives, Derrick Nowitzki stays with him. Jrue Carter attempts a Layup. Contested by Derrick Nowitzki (4.8 feet, ZONE). Jrue Carter misses. Rebound secured by Tobias Tatum.

[00:48] Team_090 possession (Score: 86-100)
Tobias Tatum drives and kicks out. OG Anunoby attempts a 3Pt. Contested by Myles Harden (4.6 feet, ZONE). OG Anunoby misses. Rebound secured by Pau Tatum.

[00:36] Team_051 possession (Score: 86-100)
Zion Morant drives to the basket... Zion Morant loses control! Ball rolls out of bounds! TURNOVER! (dead ball)

[00:20] Team_090 possession (Score: 86-100)
Derrick Nowitzki attempts a Midrange. Contested by Zion Morant (5.2 feet, ZONE). Derrick Nowitzki misses. Rebound secured by Myles Harden.

[00:01] Team_051 possession (Score: 86-100)
Zion Morant attempts a Midrange. Contested by Josh Wall (4.5 feet, MAN). Zion Morant misses. Rebound secured by Derrick Nowitzki.

================================================================================
                              4TH QUARTER COMPLETE                              
================================================================================

4TH QUARTER SCORE: Team_090 13, Team_051 19

BOX SCORE:
================================================================================

Team_090
--------------------------------------------------------------------------------
Player                MIN  PTS  REB  AST  TO      FG   FG%      3P   3P%
--------------------------------------------------------------------------------
Derrick Nowitzki       14    4    4    0   0   2/3    66.7     0/0   0.0
Zach Wall              37    3    1    0   0   1/1   100.0     0/0   0.0
Larry Bridges          37    2    0    0   0   1/2    50.0     0/0   0.0
Russell Smith          11    2    4    0   0   1/3    33.3     0/0   0.0
Josh Wall              11    2    0    0   0   1/5    20.0     0/0   0.0
Derrick Mitchell       37    0    0    0   0   0/1     0.0     0/0   0.0
Tracy Adebayo          37    0    3    1   0   0/2     0.0     0/0   0.0
Gary Brogdon           34    0    1    1   0   0/1     0.0     0/0   0.0
Tobias Tatum           11    0    2    0   0   0/3     0.0     0/0   0.0

TEAM: FG: 6/21 (28.6%), 3PT: 1/5 (20.0%), REB: 14 (2 off, 12 def), AST: 2, TO: 1
TEAM FOULS: 5 [Team_051 in BONUS]


Team_051
--------------------------------------------------------------------------------
Player                MIN  PTS  REB  AST  TO      FG   FG%      3P   3P%
--------------------------------------------------------------------------------
Myles Harden           11    5    3    1   0   2/3    66.7     0/0   0.0
Pau Tatum              11    4    6    0   0   2/4    50.0     0/0   0.0
Larry McGrady          37    3    0    0   0   1/1   100.0     0/0   0.0
Jrue Carter            11    3    0    1   0   1/4    25.0     0/0   0.0
Austin Sexton          37    2    0    0   0   1/3    33.3     0/0   0.0
Tobias Jokic           11    2    2    0   0   1/2    50.0     0/0   0.0
Franz Simmons          37    0    1    1   0   0/0     0.0     0/0   0.0
Shaquille Harden       37    0    3    0   0   0/2     0.0     0/0   0.0
OG Siakam              37    0    1    0   0   0/1     0.0     0/0   0.0
Zion Morant            11    0    0    0   0   0/1     0.0     0/0   0.0

TEAM: FG: 8/21 (38.1%), 3PT: 3/6 (50.0%), REB: 17 (3 off, 14 def), AST: 3, TO: 1
TEAM FOULS: 0

================================================================================

================================================================================
                               FULL GAME COMPLETE                               
================================================================================

FINAL SCORE: Team_090 86, Team_051 100

SCORING BY QUARTER:
--------------------------------------------------------------------------------
Team                     Q1     Q2     Q3     Q4    FINAL
--------------------------------------------------------------------------------
Team_090                 22     28     23     13       86
Team_051                 25     30     26     19      100
--------------------------------------------------------------------------------

FULL GAME BOX SCORE:
================================================================================

Team_090
--------------------------------------------------------------------------------
Player                MIN  PTS  REB  AST  TO      FG   FG%      3P   3P%      FT STL BLK
--------------------------------------------------------------------------------
Derrick Mitchell       37   12    0    2   2   4/8    50.0   3/6    50.0   0/0     0   0
Larry Bridges          37   11    1    4   1   7/13   53.8   1/4    25.0   2/2     0   0
Zach Wall              37   24    6    4   2   7/12   58.3   3/5    60.0   2/3     1   0
Tracy Adebayo          37   13   18    5   1   5/11   45.5   0/1     0.0   4/5     1   0
Gary Brogdon           34   10    9    3   2   5/16   31.2   2/9    22.2   0/0     2   0
Derrick Nowitzki       14    8    6    0   0   5/6    83.3   0/0     0.0   2/2     0   0
OG Anunoby             11    0    0    0   0   0/1     0.0   0/0     0.0   0/0     0   0
Josh Wall              11    2    0    1   0   1/5    20.0   0/1     0.0   1/2     0   0
Russell Smith          11    2    6    0   1   2/4    50.0   0/1     0.0   0/0     0   0
Tobias Tatum           11    1    3    0   0   0/3     0.0   0/1     0.0   1/2     0   1

TEAM: FG: 36/79 (45.6%), 3PT: 9/28 (32.1%), REB: 47 (15 off, 32 def), AST: 19, TO: 9


Team_051
--------------------------------------------------------------------------------
Player                MIN  PTS  REB  AST  TO      FG   FG%      3P   3P%      FT STL BLK
--------------------------------------------------------------------------------
Austin Sexton          37   13    0    1   1   8/11   72.7   0/2     0.0   7/8     0   1
Larry McGrady          37   19    0    3   1   6/11   54.5   2/4    50.0   4/4     0   1
OG Siakam              37    9    8    1   1   4/7    57.1   1/3    33.3   3/3     0   0
Franz Simmons          37   21    9    5   3   9/13   69.2   4/5    80.0   3/3     0   0
Shaquille Harden       37   20   20    3   2   8/16   50.0   0/2     0.0   4/6     1   0
Myles Harden           11    5    3    1   0   4/5    80.0   2/2   100.0   0/0     0   0
Zion Morant            11    0    0    0   0   0/1     0.0   0/0     0.0   0/0     0   0
Jrue Carter            11    3    0    1   1   1/5    20.0   1/2    50.0   0/0     0   0
Tobias Jokic           11    2    3    0   0   2/5    40.0   0/2     0.0   0/0     0   0
Pau Tatum              11    6    7    0   1   0/2     0.0   0/0     0.0   2/2     1   0

TEAM: FG: 43/77 (55.8%), 3PT: 10/22 (45.5%), REB: 52 (10 off, 42 def), AST: 15, TO: 10

================================================================================
