================================================================================
                        FULL GAME - Team_051 vs Team_063                        
================================================================================

================================================================================
                       1ST QUARTER - Team_051 vs Team_063                       
================================================================================

[12:00] Team_051 possession (Score: 0-0)
Shaquille Harden drives to the basket... Shaquille Harden throws a bad pass! Stolen by Tyler Harris! TURNOVER! (live ball)

[11:48] Team_063 possession (Score: 0-0)
Dirk Reaves attempts a Midrange. Contested by Franz Simmons (4.4 feet, MAN). Dirk Reaves misses. Rebound secured by Shaquille Harden.

[11:33] Team_051 possession (Score: 0-0)
Austin Sexton attempts a Midrange. Contested by Bradley Davis (4.9 feet, MAN). Austin Sexton misses. Rebound secured by Malcolm Quickley.

[11:19] Team_063 possession (Score: 0-0)
Tyler Harris attempts a Midrange. Contested by Larry McGrady (4.4 feet, ZONE). Tyler Harris misses. Rebound secured by Franz Simmons.

[11:01] Team_051 possession (Score: 0-0)
Larry McGrady drives, Malcolm Quickley stays with him. Larry McGrady attempts a Layup. Contested by Malcolm Quickley (3.8 feet, MAN). LARRY MCGRADY MAKES IT! Assist: Shaquille Harden
Score: 2-0

[10:43] Team_063 possession (Score: 2-0)
Dirk Reaves attempts a 3Pt. Contested by Franz Simmons (4.4 feet, MAN). DIRK REAVES MAKES IT! Assist: Terry Reaves
Score: 2-3

[10:27] Team_051 possession (Score: 2-3)
FOUL! Reach-in foul on Terry Reaves during the drive. [Team fouls: 1] No free throws, side out. (Terry Reaves: 1 personal fouls)

[10:13] Team_051 possession (Score: 2-3)
OG Siakam attempts a 3Pt. Contested by Terry Reaves (4.9 feet, MAN). OG Siakam misses. Rebound secured by Dirk Reaves.

[10:00] Team_063 possession (Score: 2-3)
Terry Reaves makes the Dunk and draws the foul on OG Siakam! And-1! Terry Reaves to the line for 1. [Team fouls: 1] (OG Siakam: 1 personal fouls)   FT 1/1: GOOD Terry Reaves makes 1/1 from the line.
Score: 2-6

[09:46] Team_051 possession (Score: 2-6)
Larry McGrady attempts a Layup. BLOCKED BY MALCOLM QUICKLEY! Ball is loose! Rebound secured by Tyler Harris.

[09:30] Team_063 possession (Score: 2-6)
Malcolm Quickley drives, picks up Franz Simmons. Help arrives from Larry McGrady! Malcolm Quickley attempts a Dunk. Contested by Larry McGrady (4.0 feet, ZONE). Malcolm Quickley misses. Rebound secured by Franz Simmons.

[09:17] Team_051 possession (Score: 2-6)
Austin Sexton attempts a 3Pt. Contested by Bradley Davis (4.9 feet, MAN). AUSTIN SEXTON MAKES IT! Assist: Larry McGrady
Score: 5-6

[09:03] Team_063 possession (Score: 5-6)
Dirk Reaves attempts a Midrange. Contested by Franz Simmons (4.4 feet, MAN). Dirk Reaves misses. Rebound secured by Shaquille Harden.

[08:51] Team_051 possession (Score: 5-6)
Shaquille Harden attempts a 3Pt. Contested by Tyler Harris (4.3 feet, MAN). Shaquille Harden misses. Rebound secured by Dirk Reaves.

[08:34] Team_063 possession (Score: 5-6)
FOUL! Holding foul on Shaquille Harden. [Team fouls: 2] No free throws, side out. (Shaquille Harden: 1 personal fouls)

[08:20] Team_063 possession (Score: 5-6)
FOUL! Shooting foul on Austin Sexton. Tyler Harris to the line for 3 free throws. [Team fouls: 3] (Austin Sexton: 1 personal fouls)   FT 1/3: GOOD   FT 2/3: GOOD   FT 3/3: GOOD Tyler Harris makes 3/3 from the line.
Score: 5-9

[08:08] Team_051 possession (Score: 5-9)
OG Siakam attempts a 3Pt. Contested by Malcolm Quickley (3.8 feet, ZONE). OG Siakam misses. Rebound secured by Malcolm Quickley.

[07:58] Team_063 possession (Score: 5-9)
Terry Reaves drives and kicks out. Tyler Harris attempts a 3Pt. Contested by Austin Sexton (4.4 feet, ZONE). Tyler Harris misses. Rebound secured by Shaquille Harden.

[07:44] Team_051 possession (Score: 5-9)
OG Siakam attempts a 3Pt. Contested by Malcolm Quickley (3.8 feet, ZONE). OG Siakam misses. Rebound secured by Tyler Harris.

[07:30] Team_063 possession (Score: 5-9)
Terry Reaves attempts a 3Pt. Contested by Austin Sexton (4.7 feet, ZONE). Terry Reaves misses. Rebound secured by OG Siakam.

[07:15] Team_051 possession (Score: 5-9)
Larry McGrady drives to the basket... Larry McGrady loses control! Ball rolls out of bounds! TURNOVER! (dead ball)

[07:01] Team_063 possession (Score: 5-9)
Dirk Reaves throws a bad pass! Stolen by Franz Simmons! TURNOVER! (live ball)

[06:45] Team_051 possession (Score: 5-9)
Austin Sexton throws a bad pass out of bounds! TURNOVER! (dead ball)

[06:28] Team_063 possession (Score: 5-9)
Terry Reaves drives and kicks out. Tyler Harris attempts a 3Pt. Contested by Austin Sexton (4.4 feet, ZONE). Tyler Harris misses. Rebound secured by Franz Simmons.

[06:12] Team_051 possession (Score: 5-9)
FOUL! Shooting foul on Terry Reaves. OG Siakam to the line for 2 free throws. [Team fouls: 2] (Terry Reaves: 2 personal fouls)   FT 1/2: GOOD   FT 2/2: GOOD OG Siakam makes 2/2 from the line.
Score: 7-9

[05:59] Team_063 possession (Score: 7-9)
Malcolm Quickley drives and kicks out. FOUL! Shooting foul on Franz Simmons. Tyler Harris to the line for 2 free throws. [Team fouls: 4] (Franz Simmons: 1 personal fouls)   FT 1/2: MISS   FT 2/2: GOOD Tyler Harris makes 1/2 from the line.
Score: 7-10

[05:48] Team_051 possession (Score: 7-10)
Franz Simmons throws a bad pass! Stolen by Dirk Reaves! TURNOVER! (live ball)

[05:35] Team_063 possession (Score: 7-10)
FOUL! Holding foul on OG Siakam. [IN THE BONUS! 5 team fouls] Terry Reaves to the line for 2 free throws. (OG Siakam: 2 personal fouls)   FT 1/2: GOOD   FT 2/2: GOOD Terry Reaves makes 2/2 from the line.
Score: 7-12

[05:20] Team_051 possession (Score: 7-12)
Larry McGrady drives, picks up Tyler Harris. Help arrives from Malcolm Quickley! Larry McGrady attempts a Dunk. Contested by Malcolm Quickley (4.7 feet, ZONE). LARRY MCGRADY MAKES IT!
Score: 9-12

[05:04] Team_063 possession (Score: 9-12)
Tyler Harris drives and kicks out. FOUL! Shooting foul on Shaquille Harden. Tyler Harris to the line for 3 free throws. [BONUS: 6 team fouls] (Shaquille Harden: 2 personal fouls)   FT 1/3: GOOD   FT 2/3: GOOD   FT 3/3: GOOD Tyler Harris makes 3/3 from the line.
Score: 9-15

[04:49] Team_051 possession (Score: 9-15)
Franz Simmons drives to the basket... Franz Simmons loses the ball! Stripped by Dirk Reaves! TURNOVER! (live ball)

[04:35] Team_063 possession (Score: 9-15)
Terry Reaves attempts a 3Pt. Contested by Austin Sexton (4.7 feet, ZONE). Terry Reaves misses. FOUL! Loose ball foul on Franz Simmons during the rebound battle. [IN THE BONUS! 7 team fouls] Dirk Reaves to the line for 2 free throws. (Franz Simmons: 2 personal fouls)   FT 1/2: GOOD   FT 2/2: GOOD Dirk Reaves makes 2/2 from the line.
Score: 9-17

[04:23] Team_051 possession (Score: 9-17)
Larry McGrady makes the Layup and draws the foul on Malcolm Quickley! And-1! Larry McGrady to the line for 1. [Team fouls: 3] (Malcolm Quickley: 1 personal fouls)   FT 1/1: GOOD Larry McGrady makes 1/1 from the line.
Score: 12-17

[04:07] Team_063 possession (Score: 12-17)
Tyler Harris drives, picks up Franz Simmons. Help arrives from Austin Sexton! Tyler Harris attempts a Dunk. Contested by Austin Sexton (4.2 feet, ZONE). Tyler Harris misses. Rebound secured by OG Siakam.

[03:55] Team_051 possession (Score: 12-17)
Larry McGrady attempts a Layup. Contested by Malcolm Quickley (3.9 feet, MAN). LARRY MCGRADY MAKES IT! Assist: OG Siakam
Score: 14-17

[03:43] Team_063 possession (Score: 14-17)
Terry Reaves drives, Franz Simmons stays with him. Terry Reaves attempts a Dunk. Contested by Franz Simmons (4.6 feet, ZONE). Terry Reaves misses. Rebound secured by Shaquille Harden.

[03:30] Team_051 possession (Score: 14-17)
FOUL! Shooting foul on Terry Reaves. OG Siakam to the line for 2 free throws. [Team fouls: 4] (Terry Reaves: 3 personal fouls)   FT 1/2: GOOD   FT 2/2: GOOD OG Siakam makes 2/2 from the line.
Score: 16-17

[03:14] Team_063 possession (Score: 16-17)
FOUL! Shooting foul on Larry McGrady. Dirk Reaves to the line for 2 free throws. [BONUS: 8 team fouls] (Larry McGrady: 1 personal fouls)   FT 1/2: MISS   FT 2/2: GOOD Dirk Reaves makes 1/2 from the line.
Score: 16-18

[02:56] Team_051 possession (Score: 16-18)
OG Siakam attempts a 3Pt. Contested by Terry Reaves (5.1 feet, MAN). OG Siakam misses. Rebound secured by Dirk Reaves.

[02:41] Team_063 possession (Score: 16-18)
Terry Reaves attempts a 3Pt. Contested by Austin Sexton (4.8 feet, ZONE). Terry Reaves misses. Offensive rebound by Dirk Reaves! Dirk Reaves kicks it out.

[02:23] Team_063 possession (Score: 16-18)
Tyler Harris attempts a Midrange. Contested by Shaquille Harden (4.4 feet, MAN). Tyler Harris misses. Rebound secured by Franz Simmons.

[02:05] Team_051 possession (Score: 16-18)
Larry McGrady attempts a 3Pt. Contested by Malcolm Quickley (4.1 feet, ZONE). Larry McGrady misses. Offensive rebound by Shaquille Harden! Shaquille Harden's putback is no good. Rebound secured by Malcolm Quickley.

[01:53] Team_063 possession (Score: 16-18)
Malcolm Quickley attempts a 3Pt. Contested by Austin Sexton (4.4 feet, ZONE). Malcolm Quickley misses. Rebound secured by Franz Simmons.

[01:34] Team_051 possession (Score: 16-18)
OG Siakam drives, Tyler Harris stays with him. OG Siakam attempts a Dunk. Contested by Tyler Harris (5.0 feet, ZONE). OG SIAKAM MAKES IT!
Score: 18-18

[01:19] Team_063 possession (Score: 18-18)
Dirk Reaves attempts a Midrange. Contested by Franz Simmons (4.7 feet, MAN). Dirk Reaves misses. Rebound secured by OG Siakam.

[01:01] Team_051 possession (Score: 18-18)
Austin Sexton drives and kicks out. Larry McGrady attempts a 3Pt. Contested by Malcolm Quickley (4.0 feet, MAN). LARRY MCGRADY MAKES IT! Assist: Austin Sexton
Score: 21-18

[00:48] Team_063 possession (Score: 21-18)
Dirk Reaves attempts a 3Pt. Contested by Franz Simmons (4.8 feet, ZONE). Dirk Reaves misses. Rebound secured by Shaquille Harden.

[00:32] Team_051 possession (Score: 21-18)
FOUL! Holding foul on Bradley Davis. [IN THE BONUS! 5 team fouls] Austin Sexton to the line for 2 free throws. (Bradley Davis: 1 personal fouls)   FT 1/2: GOOD   FT 2/2: MISS Austin Sexton makes 1/2 from the line. Rebound secured by Tyler Harris.
Score: 22-18

[00:15] Team_063 possession (Score: 22-18)
Malcolm Quickley attempts a 3Pt. Contested by Franz Simmons (4.4 feet, ZONE). Malcolm Quickley misses. Rebound secured by Shaquille Harden.

================================================================================
                              1ST QUARTER COMPLETE                              
================================================================================

1ST QUARTER SCORE: Team_051 22, Team_063 18

BOX SCORE:
================================================================================

Team_051
--------------------------------------------------------------------------------
Player                MIN  PTS  REB  AST  TO      FG   FG%      3P   3P%
--------------------------------------------------------------------------------
Larry McGrady          12   12    0    1   0   5/7    71.4     0/0   0.0
OG Siakam              12    6    3    1   0   3/7    42.9     0/0   0.0
Austin Sexton          12    3    0    1   0   1/2    50.0     0/0   0.0
Shaquille Harden       12    0    6    1   0   0/1     0.0     0/0   0.0
Franz Simmons          12    0    5    0   0   0/0     0.0     0/0   0.0

TEAM: FG: 9/18 (50.0%), 3PT: 1/7 (14.3%), REB: 15 (1 off, 14 def), AST: 4, TO: 5
TEAM FOULS: 8 [Team_063 in BONUS]


Team_063
--------------------------------------------------------------------------------
Player                MIN  PTS  REB  AST  TO      FG   FG%      3P   3P%
--------------------------------------------------------------------------------
Tyler Harris           12    7    3    0   0   3/6    50.0     0/0   0.0
Dirk Reaves            12    6    4    0   0   3/7    42.9     0/0   0.0
Terry Reaves           12    5    0    1   0   2/6    33.3     0/0   0.0
Malcolm Quickley       12    0    3    0   0   0/3     0.0     0/0   0.0

TEAM: FG: 8/22 (36.4%), 3PT: 3/7 (42.9%), REB: 9 (1 off, 8 def), AST: 1, TO: 1
TEAM FOULS: 5 [Team_051 in BONUS]

================================================================================

================================================================================
                       2ND QUARTER - Team_051 vs Team_063                       
================================================================================

[12:00] Team_051 possession (Score: 22-18)
OG Siakam attempts a 3Pt. Contested by Malcolm Quickley (4.0 feet, ZONE). OG Siakam misses. Rebound secured by Malcolm Quickley.

[11:45] Team_063 possession (Score: 22-18)
Tyler Harris makes the Dunk and draws the foul on Shaquille Harden! And-1! Tyler Harris to the line for 1. [Team fouls: 1] (Shaquille Harden: 1 personal fouls)   FT 1/1: MISS Tyler Harris makes 0/1 from the line. Rebound secured by OG Siakam.
Score: 22-20

[11:31] Team_051 possession (Score: 22-20)
Shaquille Harden drives and kicks out. Shaquille Harden attempts a Midrange. Contested by Tyler Harris (4.8 feet, MAN). SHAQUILLE HARDEN MAKES IT! Assist: Austin Sexton
Score: 24-20

[11:12] Team_063 possession (Score: 24-20)
Dirk Reaves attempts a 3Pt. Contested by Franz Simmons (4.7 feet, MAN). DIRK REAVES MAKES IT! Assist: Tyler Harris
Score: 24-23

[10:57] Team_051 possession (Score: 24-23)
Shaquille Harden loses the ball! Stripped by Tyler Harris! TURNOVER! (live ball)

[10:43] Team_063 possession (Score: 24-23)
Terry Reaves drives to the basket... FOUL! Offensive foul on Terry Reaves! OG Siakam drew the charge! [Team fouls: 1] (Terry Reaves: 1 personal fouls) TURNOVER! (dead ball)

[10:27] Team_051 possession (Score: 24-23)
Austin Sexton attempts a Layup. Contested by Bradley Davis (5.2 feet, MAN). AUSTIN SEXTON MAKES IT! Assist: Larry McGrady
Score: 26-23

[10:13] Team_063 possession (Score: 26-23)
Bradley Davis drives to the basket... FOUL! Offensive foul on Bradley Davis! Austin Sexton drew the charge! [Team fouls: 2] (Bradley Davis: 1 personal fouls) TURNOVER! (dead ball)

[09:54] Team_051 possession (Score: 26-23)
OG Siakam attempts a 3Pt. Contested by Terry Reaves (5.3 feet, MAN). OG Siakam misses. Rebound secured by Dirk Reaves.

[09:38] Team_063 possession (Score: 26-23)
Dirk Reaves commits a violation (traveling/carry)! TURNOVER! (dead ball)

[09:38] Substitution (Team_051): Austin Sexton OUT → Myles Harden IN (stamina_rule2)

[09:38] Substitution (Team_051): Larry McGrady OUT → Zion Morant IN (stamina_rule2)

[09:38] Substitution (Team_051): OG Siakam OUT → Jrue Carter IN (stamina_rule2)

[09:38] Substitution (Team_051): Franz Simmons OUT → Tobias Jokic IN (stamina_rule2)

[09:38] Substitution (Team_051): Shaquille Harden OUT → Pau Tatum IN (stamina_rule2)

[09:38] Substitution (Team_063): Bradley Davis OUT → DeMar Banchero IN (stamina_rule2)

[09:38] Substitution (Team_063): Malcolm Quickley OUT → Cole Durant IN (stamina_rule2)

[09:38] Substitution (Team_063): Terry Reaves OUT → Jaren James IN (stamina_rule2)

[09:38] Substitution (Team_063): Dirk Reaves OUT → Lamelo Ball IN (stamina_rule2)

[09:38] Substitution (Team_063): Tyler Harris OUT → Kyle Green IN (stamina_rule2)

[09:28] Team_051 possession (Score: 26-23)
Zion Morant attempts a 3Pt. Contested by DeMar Banchero (4.2 feet, ZONE). Zion Morant misses. Rebound secured by Cole Durant.

[09:14] Team_063 possession (Score: 26-23)
Cole Durant makes the Dunk and draws the foul on Zion Morant! And-1! Cole Durant to the line for 1. [Team fouls: 2] (Zion Morant: 1 personal fouls)   FT 1/1: GOOD Cole Durant makes 1/1 from the line.
Score: 26-26

[09:00] Team_051 possession (Score: 26-26)
Jrue Carter drives, Kyle Green stays with him. Jrue Carter attempts a Dunk. Contested by Kyle Green (4.7 feet, ZONE). Jrue Carter misses. Rebound secured by Cole Durant.

[08:48] Team_063 possession (Score: 26-26)
DeMar Banchero attempts a 3Pt. Contested by Myles Harden (4.9 feet, MAN). DEMAR BANCHERO MAKES IT! Assist: Cole Durant
Score: 26-29

[08:29] Team_051 possession (Score: 26-29)
Myles Harden throws a bad pass out of bounds! TURNOVER! (dead ball)

[08:14] Team_063 possession (Score: 26-29)
DeMar Banchero attempts a 3Pt. Contested by Myles Harden (4.9 feet, MAN). DeMar Banchero misses. Rebound secured by Myles Harden.

[07:58] Team_051 possession (Score: 26-29)
Pau Tatum drives and kicks out. Jrue Carter attempts a 3Pt. Contested by DeMar Banchero (3.9 feet, ZONE). Jrue Carter misses. Offensive rebound by Pau Tatum! Pau Tatum's putback is no good. Rebound secured by Cole Durant.

[07:43] Team_063 possession (Score: 26-29)
Kyle Green attempts a Midrange. Contested by Pau Tatum (4.3 feet, MAN). Kyle Green misses. Rebound secured by Pau Tatum.

[07:28] Team_051 possession (Score: 26-29)
Myles Harden attempts a 3Pt. Contested by DeMar Banchero (3.7 feet, MAN). MYLES HARDEN MAKES IT! Assist: Zion Morant
Score: 29-29

[07:12] Team_063 possession (Score: 29-29)
Kyle Green drives, Pau Tatum stays with him. Kyle Green attempts a Dunk. Contested by Pau Tatum (4.3 feet, MAN). Kyle Green misses. Rebound secured by Tobias Jokic.

[06:56] Team_051 possession (Score: 29-29)
Zion Morant attempts a 3Pt. Contested by DeMar Banchero (4.2 feet, ZONE). Zion Morant misses. Rebound secured by Lamelo Ball.

[06:45] Team_063 possession (Score: 29-29)
Jaren James attempts a Midrange. Contested by Tobias Jokic (5.3 feet, ZONE). JAREN JAMES MAKES IT! Assist: Lamelo Ball
Score: 29-31

[06:34] Team_051 possession (Score: 29-31)
Jrue Carter drives and kicks out. Myles Harden attempts a 3Pt. Contested by DeMar Banchero (3.9 feet, MAN). Myles Harden misses. Offensive rebound by Tobias Jokic! Tobias Jokic kicks it out.

[06:15] Team_051 possession (Score: 29-31)
Tobias Jokic attempts a 3Pt. Contested by DeMar Banchero (4.1 feet, ZONE). Tobias Jokic misses. Rebound secured by Cole Durant.

[06:02] Team_063 possession (Score: 29-31)
Kyle Green attempts a 3Pt. Contested by Myles Harden (4.6 feet, ZONE). Kyle Green misses. Rebound secured by Pau Tatum.

[05:51] Team_051 possession (Score: 29-31)
Tobias Jokic attempts a Midrange. Contested by Lamelo Ball (4.9 feet, MAN). Tobias Jokic misses. Rebound secured by Cole Durant.

[05:37] Team_063 possession (Score: 29-31)
Cole Durant drives and kicks out. Lamelo Ball attempts a 3Pt. Contested by Tobias Jokic (5.2 feet, MAN). Lamelo Ball misses. Rebound secured by Tobias Jokic.

[05:18] Team_051 possession (Score: 29-31)
Jrue Carter attempts a 3Pt. Contested by Jaren James (4.2 feet, MAN). Jrue Carter misses. Rebound secured by Cole Durant.

[05:04] Team_063 possession (Score: 29-31)
Cole Durant throws a bad pass out of bounds! TURNOVER! (dead ball)

[04:49] Team_051 possession (Score: 29-31)
Tobias Jokic attempts a Midrange. Contested by Lamelo Ball (4.9 feet, MAN). Tobias Jokic misses. Rebound secured by Lamelo Ball.

[04:31] Team_063 possession (Score: 29-31)
Kyle Green drives and kicks out. DeMar Banchero attempts a Midrange. Contested by Zion Morant (5.6 feet, ZONE). DEMAR BANCHERO MAKES IT! Assist: Lamelo Ball
Score: 29-33

[04:17] Team_051 possession (Score: 29-33)
Myles Harden commits a violation (traveling/carry)! TURNOVER! (dead ball)

[04:04] Team_063 possession (Score: 29-33)
FOUL! Offensive foul on Lamelo Ball! Tobias Jokic drew the charge! [Team fouls: 3] (Lamelo Ball: 1 personal fouls) TURNOVER! (dead ball)

[03:47] Team_051 possession (Score: 29-33)
Myles Harden attempts a 3Pt. Contested by DeMar Banchero (3.7 feet, MAN). Myles Harden misses. Rebound secured by Cole Durant.

[03:35] Team_063 possession (Score: 29-33)
Kyle Green attempts a Midrange. Contested by Zion Morant (5.6 feet, ZONE). Kyle Green misses. Offensive rebound by Lamelo Ball! Lamelo Ball kicks it out.

[03:19] Team_063 possession (Score: 29-33)
Lamelo Ball attempts a 3Pt. Contested by Tobias Jokic (5.5 feet, MAN). Lamelo Ball misses. Rebound secured by Pau Tatum.

[03:04] Team_051 possession (Score: 29-33)
FOUL! Shooting foul on Jaren James. Jrue Carter to the line for 2 free throws. [Team fouls: 4] (Jaren James: 1 personal fouls)   FT 1/2: GOOD   FT 2/2: GOOD Jrue Carter makes 2/2 from the line.
Score: 31-33

[02:55] Team_063 possession (Score: 31-33)
Kyle Green drives, Pau Tatum stays with him. Kyle Green attempts a Dunk. Contested by Pau Tatum (4.3 feet, ZONE). Kyle Green misses. Rebound secured by Myles Harden.

[02:39] Team_051 possession (Score: 31-33)
Tobias Jokic drives, picks up Kyle Green. Help arrives from Cole Durant! Tobias Jokic attempts a Dunk. Contested by Cole Durant (4.6 feet, ZONE). TOBIAS JOKIC MAKES IT! Assist: Pau Tatum
Score: 33-33

[02:27] Team_063 possession (Score: 33-33)
Kyle Green attempts a 3Pt. Contested by Myles Harden (4.7 feet, ZONE). Kyle Green misses. Rebound secured by Pau Tatum.

[02:11] Team_051 possession (Score: 33-33)
Jrue Carter attempts a Layup. Contested by Kyle Green (4.7 feet, ZONE). JRUE CARTER MAKES IT! Assist: Pau Tatum
Score: 35-33

[01:56] Team_063 possession (Score: 35-33)
Cole Durant attempts a 3Pt. Contested by Zion Morant (6.0 feet, MAN). Cole Durant misses. Offensive rebound by Lamelo Ball! Lamelo Ball kicks it out.

[01:39] Team_063 possession (Score: 35-33)
DeMar Banchero attempts a 3Pt. Contested by Jrue Carter (5.1 feet, ZONE). DEMAR BANCHERO MAKES IT! Assist: Cole Durant
Score: 35-36

[01:30] Team_051 possession (Score: 35-36)
Jrue Carter throws a bad pass out of bounds! TURNOVER! (dead ball)

[01:16] Team_063 possession (Score: 35-36)
DeMar Banchero throws a bad pass out of bounds! TURNOVER! (dead ball)

[01:00] Team_051 possession (Score: 35-36)
FOUL! Holding foul on Jaren James. [IN THE BONUS! 5 team fouls] Jrue Carter to the line for 2 free throws. (Jaren James: 2 personal fouls)   FT 1/2: GOOD   FT 2/2: GOOD Jrue Carter makes 2/2 from the line.
Score: 37-36

[00:48] Team_063 possession (Score: 37-36)
Jaren James attempts a Midrange. Contested by Tobias Jokic (5.5 feet, ZONE). JAREN JAMES MAKES IT!
Score: 37-38

[00:35] Team_051 possession (Score: 37-38)
Myles Harden drives and kicks out. Jrue Carter attempts a Midrange. Contested by Jaren James (4.2 feet, MAN). Jrue Carter misses. Rebound secured by Cole Durant.

[00:21] Team_063 possession (Score: 37-38)
DeMar Banchero attempts a Midrange. Contested by Myles Harden (5.2 feet, MAN). DeMar Banchero misses. Rebound secured by Pau Tatum.

[00:02] Team_051 possession (Score: 37-38)
FOUL! Holding foul on DeMar Banchero. [IN THE BONUS! 6 team fouls] Myles Harden to the line for 2 free throws. (DeMar Banchero: 1 personal fouls)   FT 1/2: GOOD   FT 2/2: GOOD Myles Harden makes 2/2 from the line.
Score: 39-38

================================================================================
                              2ND QUARTER COMPLETE                              
================================================================================

2ND QUARTER SCORE: Team_051 17, Team_063 20

BOX SCORE:
================================================================================

Team_051
--------------------------------------------------------------------------------
Player                MIN  PTS  REB  AST  TO      FG   FG%      3P   3P%
--------------------------------------------------------------------------------
Jrue Carter            10    6    0    0   0   3/5    60.0     0/0   0.0
Myles Harden           10    5    2    0   0   2/4    50.0     0/0   0.0
Shaquille Harden       15    2    0    0   0   1/1   100.0     0/0   0.0
Austin Sexton          15    2    0    1   0   1/1   100.0     0/0   0.0
Tobias Jokic           10    2    3    0   0   1/4    25.0     0/0   0.0
OG Siakam              15    0    1    0   0   0/2     0.0     0/0   0.0
Larry McGrady          15    0    0    1   0   0/0     0.0     0/0   0.0
Zion Morant            10    0    0    1   0   0/2     0.0     0/0   0.0
Pau Tatum              10    0    5    2   0   0/1     0.0     0/0   0.0

TEAM: FG: 8/20 (40.0%), 3PT: 1/8 (12.5%), REB: 12 (2 off, 10 def), AST: 5, TO: 4
TEAM FOULS: 2


Team_063
--------------------------------------------------------------------------------
Player                MIN  PTS  REB  AST  TO      FG   FG%      3P   3P%
--------------------------------------------------------------------------------
DeMar Banchero         10    8    0    0   0   3/5    60.0     0/0   0.0
Jaren James            10    4    0    0   0   2/2   100.0     0/0   0.0
Dirk Reaves            15    3    1    0   0   1/1   100.0     0/0   0.0
Cole Durant            10    3    8    2   0   1/2    50.0     0/0   0.0
Malcolm Quickley       15    0    1    0   0   0/0     0.0     0/0   0.0
Tyler Harris           15    0    0    1   0   0/1     0.0     0/0   0.0
Kyle Green             10    0    0    0   0   0/5     0.0     0/0   0.0
Lamelo Ball            10    0    4    2   0   0/1     0.0     0/0   0.0

TEAM: FG: 7/17 (41.2%), 3PT: 3/7 (42.9%), REB: 13 (2 off, 11 def), AST: 5, TO: 6
TEAM FOULS: 6 [Team_051 in BONUS]

================================================================================

================================================================================
                       3RD QUARTER - Team_051 vs Team_063                       
================================================================================

[12:00] Team_051 possession (Score: 39-38)
Larry McGrady drives, picks up Malcolm Quickley. Help arrives from Bradley Davis! Larry McGrady attempts a Layup. Contested by Bradley Davis (3.8 feet, MAN). Larry McGrady misses. Rebound secured by Dirk Reaves.

[11:45] Team_063 possession (Score: 39-38)
Dirk Reaves attempts a Midrange. Contested by Franz Simmons (4.4 feet, MAN). DIRK REAVES MAKES IT! Assist: Bradley Davis
Score: 39-40

[11:28] Team_051 possession (Score: 39-40)
Austin Sexton attempts a 3Pt. Contested by Malcolm Quickley (3.5 feet, ZONE). Austin Sexton misses. Rebound secured by Malcolm Quickley.

[11:15] Team_063 possession (Score: 39-40)
FOUL! Shooting foul on Shaquille Harden. Tyler Harris to the line for 2 free throws. [Team fouls: 1] (Shaquille Harden: 1 personal fouls)   FT 1/2: MISS   FT 2/2: GOOD Tyler Harris makes 1/2 from the line.
Score: 39-41

[10:58] Team_051 possession (Score: 39-41)
OG Siakam attempts a 3Pt. Contested by Malcolm Quickley (3.8 feet, ZONE). OG Siakam misses. Offensive rebound by Shaquille Harden! Shaquille Harden's putback is no good. Rebound secured by Dirk Reaves.

[10:43] Team_063 possession (Score: 39-41)
Terry Reaves attempts a 3Pt. Contested by Austin Sexton (4.7 feet, ZONE). Terry Reaves misses. Rebound secured by Franz Simmons.

[10:28] Team_051 possession (Score: 39-41)
OG Siakam drives, Terry Reaves stays with him. OG Siakam attempts a Dunk. Contested by Terry Reaves (4.9 feet, MAN). OG SIAKAM MAKES IT! Assist: Franz Simmons
Score: 41-41

[10:11] Team_063 possession (Score: 41-41)
Malcolm Quickley attempts a 3Pt. Contested by Austin Sexton (4.2 feet, ZONE). MALCOLM QUICKLEY MAKES IT! Assist: Tyler Harris
Score: 41-44

[09:56] Team_051 possession (Score: 41-44)
Larry McGrady attempts a 3Pt. Contested by Malcolm Quickley (3.8 feet, ZONE). Larry McGrady misses. Offensive rebound by Shaquille Harden! Shaquille Harden puts it back in!
Score: 43-44

[09:41] Team_063 possession (Score: 43-44)
Terry Reaves attempts a 3Pt. Contested by OG Siakam (4.1 feet, MAN). Terry Reaves misses. FOUL! Loose ball foul on Shaquille Harden during the rebound battle. [Team fouls: 2] No free throws, side out. (Shaquille Harden: 2 personal fouls)

[09:23] Team_063 possession (Score: 43-44)
Dirk Reaves attempts a Midrange. Contested by Franz Simmons (4.4 feet, MAN). Dirk Reaves misses. Rebound secured by OG Siakam.

[09:09] Team_051 possession (Score: 43-44)
Austin Sexton throws a bad pass! Stolen by Bradley Davis! TURNOVER! (live ball)

[08:51] Team_063 possession (Score: 43-44)
Malcolm Quickley attempts a Midrange. Contested by Larry McGrady (4.2 feet, MAN). MALCOLM QUICKLEY MAKES IT! Assist: Dirk Reaves
Score: 43-46

[08:38] Team_051 possession (Score: 43-46)
Larry McGrady drives, Tyler Harris stays with him. Larry McGrady attempts a Layup. Contested by Tyler Harris (4.7 feet, ZONE). LARRY MCGRADY MAKES IT! Assist: OG Siakam
Score: 45-46

[08:26] Team_063 possession (Score: 45-46)
Dirk Reaves makes the Dunk and draws the foul on Larry McGrady! And-1! Dirk Reaves to the line for 1. [Team fouls: 3] (Larry McGrady: 1 personal fouls)   FT 1/1: GOOD Dirk Reaves makes 1/1 from the line.
Score: 45-49

[08:11] Team_051 possession (Score: 45-49)
Austin Sexton attempts a 3Pt. Contested by Bradley Davis (4.9 feet, MAN). Austin Sexton misses. Rebound secured by Tyler Harris.

[07:57] Team_063 possession (Score: 45-49)
Malcolm Quickley attempts a 3Pt. Contested by Larry McGrady (4.2 feet, MAN). Malcolm Quickley misses. Offensive rebound by Tyler Harris! Tyler Harris's putback is no good. Offensive rebound by Tyler Harris! Tyler Harris kicks it out.

[07:48] Team_063 possession (Score: 45-49)
FOUL! Shooting foul on Larry McGrady. Malcolm Quickley to the line for 2 free throws. [Team fouls: 4] (Larry McGrady: 2 personal fouls)   FT 1/2: GOOD   FT 2/2: GOOD Malcolm Quickley makes 2/2 from the line.
Score: 45-51

[07:28] Team_051 possession (Score: 45-51)
Larry McGrady throws a bad pass out of bounds! TURNOVER! (dead ball)

[07:18] Team_063 possession (Score: 45-51)
Terry Reaves attempts a 3Pt. Contested by OG Siakam (4.1 feet, MAN). Terry Reaves misses. Rebound secured by OG Siakam.

[07:03] Team_051 possession (Score: 45-51)
Austin Sexton attempts a 3Pt. Contested by Malcolm Quickley (3.5 feet, ZONE). Austin Sexton misses. Rebound secured by Dirk Reaves.

[06:44] Team_063 possession (Score: 45-51)
FOUL! Shooting foul on OG Siakam. Terry Reaves to the line for 3 free throws. [BONUS: 5 team fouls] (OG Siakam: 1 personal fouls)   FT 1/3: GOOD   FT 2/3: GOOD   FT 3/3: MISS Terry Reaves makes 2/3 from the line. Offensive rebound by Dirk Reaves! Dirk Reaves puts it back in!
Score: 45-55

[06:27] Team_051 possession (Score: 45-55)
OG Siakam attempts a 3Pt. Contested by Terry Reaves (4.9 feet, MAN). OG Siakam misses. Rebound secured by Tyler Harris.

[06:13] Team_063 possession (Score: 45-55)
Dirk Reaves attempts a 3Pt. Contested by Austin Sexton (4.6 feet, ZONE). DIRK REAVES MAKES IT! Assist: Terry Reaves
Score: 45-58

[05:56] Team_051 possession (Score: 45-58)
Austin Sexton loses control! Ball rolls out of bounds! TURNOVER! (dead ball)

[05:43] Team_063 possession (Score: 45-58)
Dirk Reaves attempts a Layup. Contested by Franz Simmons (4.4 feet, MAN). DIRK REAVES MAKES IT! Assist: Bradley Davis
Score: 45-60

[05:25] Team_051 possession (Score: 45-60)
FOUL! Holding foul on Malcolm Quickley. [Team fouls: 1] No free throws, side out. (Malcolm Quickley: 1 personal fouls)

[05:12] Team_051 possession (Score: 45-60)
Shaquille Harden attempts a Midrange. Contested by Terry Reaves (4.6 feet, ZONE). Shaquille Harden misses. Rebound secured by Tyler Harris.

[04:55] Team_063 possession (Score: 45-60)
Tyler Harris throws a bad pass out of bounds! TURNOVER! (dead ball)

[04:39] Team_051 possession (Score: 45-60)
Larry McGrady drives, picks up Malcolm Quickley. Help arrives from Bradley Davis! Larry McGrady attempts a Dunk. Contested by Bradley Davis (3.8 feet, MAN). LARRY MCGRADY MAKES IT!
Score: 47-60

[04:26] Team_063 possession (Score: 47-60)
Dirk Reaves drives to the basket... Dirk Reaves loses control! Ball rolls out of bounds! TURNOVER! (dead ball)

[04:10] Team_051 possession (Score: 47-60)
FOUL! Shooting foul on Dirk Reaves. Franz Simmons to the line for 2 free throws. [Team fouls: 2] (Dirk Reaves: 1 personal fouls)   FT 1/2: GOOD   FT 2/2: MISS Franz Simmons makes 1/2 from the line. Rebound secured by Tyler Harris.
Score: 48-60

[03:50] Team_063 possession (Score: 48-60)
Terry Reaves attempts a Midrange. Contested by Larry McGrady (4.8 feet, ZONE). TERRY REAVES MAKES IT!
Score: 48-62

[03:35] Team_051 possession (Score: 48-62)
OG Siakam attempts a Midrange. Contested by Malcolm Quickley (3.9 feet, ZONE). OG Siakam misses. Rebound secured by Tyler Harris.

[03:23] Team_063 possession (Score: 48-62)
Malcolm Quickley attempts a 3Pt. Contested by Larry McGrady (4.4 feet, MAN). MALCOLM QUICKLEY MAKES IT! Assist: Bradley Davis
Score: 48-65

[03:09] Team_051 possession (Score: 48-65)
Franz Simmons loses the ball! Stripped by Dirk Reaves! TURNOVER! (live ball)

[02:56] Team_063 possession (Score: 48-65)
Malcolm Quickley attempts a 3Pt. Contested by Austin Sexton (4.3 feet, ZONE). Malcolm Quickley misses. Rebound secured by Shaquille Harden.

[02:40] Team_051 possession (Score: 48-65)
Shaquille Harden attempts a Midrange. Contested by Bradley Davis (5.0 feet, ZONE). Shaquille Harden misses. Offensive rebound by Shaquille Harden! Shaquille Harden puts it back in!
Score: 50-65

[02:24] Team_063 possession (Score: 50-65)
Dirk Reaves attempts a Layup. Contested by Shaquille Harden (4.6 feet, ZONE). Dirk Reaves misses. Rebound secured by OG Siakam.

[02:11] Team_051 possession (Score: 50-65)
FOUL! Holding foul on Tyler Harris. [Team fouls: 3] No free throws, side out. (Tyler Harris: 1 personal fouls)

[01:52] Team_051 possession (Score: 50-65)
OG Siakam drives to the basket... OG Siakam throws a bad pass! Stolen by Terry Reaves! TURNOVER! (live ball)

[01:39] Team_063 possession (Score: 50-65)
Bradley Davis attempts a 3Pt. Contested by Austin Sexton (4.8 feet, ZONE). Bradley Davis misses. Rebound secured by Franz Simmons.

[01:28] Team_051 possession (Score: 50-65)
Austin Sexton attempts a 3Pt. Contested by Malcolm Quickley (3.8 feet, ZONE). Austin Sexton misses. Rebound secured by Tyler Harris.

[01:16] Team_063 possession (Score: 50-65)
Malcolm Quickley drives to the basket... Malcolm Quickley throws a bad pass out of bounds! TURNOVER! (dead ball)

[01:16] Substitution (Team_051): Austin Sexton OUT → Myles Harden IN (stamina_rule2)

[01:16] Substitution (Team_051): Larry McGrady OUT → Zion Morant IN (stamina_rule2)

[01:16] Substitution (Team_051): OG Siakam OUT → Jrue Carter IN (stamina_rule2)

[01:16] Substitution (Team_051): Franz Simmons OUT → Tobias Jokic IN (stamina_rule2)

[01:16] Substitution (Team_051): Shaquille Harden OUT → Pau Tatum IN (stamina_rule2)

[01:16] Substitution (Team_063): Bradley Davis OUT → DeMar Banchero IN (stamina_rule2)

[01:16] Substitution (Team_063): Malcolm Quickley OUT → Cole Durant IN (stamina_rule2)

[01:16] Substitution (Team_063): Terry Reaves OUT → Jaren James IN (stamina_rule2)

[01:16] Substitution (Team_063): Dirk Reaves OUT → Lamelo Ball IN (stamina_rule2)

[01:16] Substitution (Team_063): Tyler Harris OUT → Kyle Green IN (stamina_rule2)

[01:06] Team_051 possession (Score: 50-65)
Pau Tatum drives to the basket... Pau Tatum throws a bad pass! Stolen by Kyle Green! TURNOVER! (live ball)

[00:50] Team_063 possession (Score: 50-65)
Lamelo Ball drives to the basket... FOUL! Offensive foul on Lamelo Ball! Tobias Jokic drew the charge! [Team fouls: 4] (Lamelo Ball: 1 personal fouls) TURNOVER! (dead ball)

[00:35] Team_051 possession (Score: 50-65)
Jrue Carter attempts a 3Pt. Contested by DeMar Banchero (4.2 feet, ZONE). Jrue Carter misses. Rebound secured by Lamelo Ball.

[00:23] Team_063 possession (Score: 50-65)
DeMar Banchero makes the Layup and draws the foul on Pau Tatum! And-1! DeMar Banchero to the line for 1. [BONUS: 6 team fouls] (Pau Tatum: 1 personal fouls)   FT 1/1: GOOD DeMar Banchero makes 1/1 from the line.
Score: 50-68

[00:04] Team_051 possession (Score: 50-68)
Myles Harden attempts a 3Pt. Contested by DeMar Banchero (3.7 feet, ZONE). MYLES HARDEN MAKES IT! Assist: Tobias Jokic
Score: 53-68

================================================================================
                              3RD QUARTER COMPLETE                              
================================================================================

3RD QUARTER SCORE: Team_051 14, Team_063 30

BOX SCORE:
================================================================================

Team_051
--------------------------------------------------------------------------------
Player                MIN  PTS  REB  AST  TO      FG   FG%      3P   3P%
--------------------------------------------------------------------------------
Larry McGrady          25    4    0    0   0   2/3    66.7     0/0   0.0
Shaquille Harden       25    4    3    0   0   2/3    66.7     0/0   0.0
Myles Harden           11    3    0    0   0   1/1   100.0     0/0   0.0
OG Siakam              25    2    3    1   0   1/4    25.0     0/0   0.0
Austin Sexton          25    0    0    0   0   0/4     0.0     0/0   0.0
Franz Simmons          25    0    2    1   0   0/1     0.0     0/0   0.0
Jrue Carter            11    0    0    0   0   0/1     0.0     0/0   0.0
Tobias Jokic           11    0    0    1   0   0/0     0.0     0/0   0.0

TEAM: FG: 6/17 (35.3%), 3PT: 2/9 (22.2%), REB: 9 (3 off, 6 def), AST: 3, TO: 6
TEAM FOULS: 6 [Team_063 in BONUS]


Team_063
--------------------------------------------------------------------------------
Player                MIN  PTS  REB  AST  TO      FG   FG%      3P   3P%
--------------------------------------------------------------------------------
Dirk Reaves            25   14    4    1   0   5/7    71.4     0/0   0.0
Malcolm Quickley       25   10    1    0   0   4/5    80.0     0/0   0.0
DeMar Banchero         11    3    0    0   0   1/1   100.0     0/0   0.0
Terry Reaves           25    2    0    1   0   1/3    33.3     0/0   0.0
Tyler Harris           25    1    7    1   0   1/1   100.0     0/0   0.0
Bradley Davis          25    0    0    3   0   0/1     0.0     0/0   0.0
Lamelo Ball            11    0    1    0   0   0/0     0.0     0/0   0.0

TEAM: FG: 12/18 (66.7%), 3PT: 4/8 (50.0%), REB: 12 (2 off, 10 def), AST: 6, TO: 4
TEAM FOULS: 4

================================================================================

================================================================================
                       4TH QUARTER - Team_051 vs Team_063                       
================================================================================

[12:00] Substitution (Team_051): Austin Sexton OUT (stamina: 77) → Myles Harden IN (comeback_detected)

[12:00] Substitution (Team_063): Bradley Davis OUT (stamina: 76) → DeMar Banchero IN (comeback_detected)

[12:00] Team_051 possession (Score: 53-68)
OG Siakam attempts a 3Pt. Contested by DeMar Banchero (4.2 feet, ZONE). OG Siakam misses. Rebound secured by Dirk Reaves.

[11:42] Team_063 possession (Score: 53-68)
Tyler Harris makes the Layup and draws the foul on Franz Simmons! And-1! Tyler Harris to the line for 1. [Team fouls: 1] (Franz Simmons: 1 personal fouls)   FT 1/1: GOOD Tyler Harris makes 1/1 from the line.
Score: 53-71

[11:28] Team_051 possession (Score: 53-71)
OG Siakam attempts a 3Pt. Contested by DeMar Banchero (4.2 feet, ZONE). OG Siakam misses. Rebound secured by Malcolm Quickley.

[11:11] Team_063 possession (Score: 53-71)
DeMar Banchero makes the 3Pt and draws the foul on Myles Harden! And-1! DeMar Banchero to the line for 1. [Team fouls: 2] (Myles Harden: 1 personal fouls)   FT 1/1: MISS DeMar Banchero makes 0/1 from the line. Offensive rebound by Tyler Harris! Tyler Harris's putback is no good.
Score: 53-74

[11:00] Team_051 possession (Score: 53-74)
Myles Harden attempts a 3Pt. Contested by DeMar Banchero (3.7 feet, MAN). Myles Harden misses. Rebound secured by Malcolm Quickley.

[10:46] Team_063 possession (Score: 53-74)
Tyler Harris drives to the basket... Tyler Harris loses control! Ball rolls out of bounds! TURNOVER! (dead ball)

[10:46] Substitution (Team_051): OG Siakam OUT → Jrue Carter IN (stamina_rule2)

[10:46] Substitution (Team_063): Dirk Reaves OUT → Lamelo Ball IN (stamina_rule2)

[10:46] Substitution (Team_063): Tyler Harris OUT → Kyle Green IN (stamina_rule2)

[10:31] Team_051 possession (Score: 53-74)
Larry McGrady commits a violation (traveling/carry)! TURNOVER! (dead ball)

[10:31] Substitution (Team_051): Larry McGrady OUT → Zion Morant IN (stamina_rule2)

[10:31] Substitution (Team_063): Terry Reaves OUT → Jaren James IN (stamina_rule2)

[10:12] Team_063 possession (Score: 53-74)
Jaren James attempts a 3Pt. Contested by Myles Harden (4.7 feet, ZONE). Jaren James misses. Rebound secured by Myles Harden.

[09:58] Team_051 possession (Score: 53-74)
Myles Harden attempts a 3Pt. Contested by DeMar Banchero (3.7 feet, ZONE). Myles Harden misses. Offensive rebound by Franz Simmons! Franz Simmons kicks it out.

[09:41] Team_051 possession (Score: 53-74)
FOUL! Reach-in foul on Kyle Green during the drive. [Team fouls: 1] No free throws, side out. (Kyle Green: 1 personal fouls)

[09:26] Team_051 possession (Score: 53-74)
Franz Simmons drives, picks up Kyle Green. Help arrives from Malcolm Quickley! Franz Simmons attempts a Dunk. Contested by Malcolm Quickley (4.8 feet, ZONE). FRANZ SIMMONS MAKES IT! Assist: Myles Harden
Score: 55-74

[09:12] Team_063 possession (Score: 55-74)
DeMar Banchero attempts a Midrange. Contested by Zion Morant (5.9 feet, ZONE). DeMar Banchero misses. Rebound secured by Franz Simmons.

[08:54] Team_051 possession (Score: 55-74)
Zion Morant attempts a 3Pt. Contested by Malcolm Quickley (4.2 feet, MAN). Zion Morant misses. Rebound secured by Lamelo Ball.

[08:37] Team_063 possession (Score: 55-74)
Malcolm Quickley attempts a 3Pt. Contested by Zion Morant (5.3 feet, MAN). Malcolm Quickley misses. Rebound secured by Shaquille Harden.

[08:19] Team_051 possession (Score: 55-74)
Franz Simmons drives and kicks out. Franz Simmons attempts a 3Pt. Contested by Lamelo Ball (4.7 feet, MAN). Franz Simmons misses. Rebound secured by Malcolm Quickley.

[08:05] Team_063 possession (Score: 55-74)
Lamelo Ball attempts a 3Pt. Contested by Jrue Carter (4.9 feet, ZONE). Lamelo Ball misses. Rebound secured by Shaquille Harden.

[07:46] Team_051 possession (Score: 55-74)
Franz Simmons attempts a 3Pt. Contested by Lamelo Ball (5.1 feet, MAN). Franz Simmons misses. Rebound secured by Lamelo Ball.

[07:33] Team_063 possession (Score: 55-74)
FOUL! Shooting foul on Zion Morant. Malcolm Quickley to the line for 2 free throws. [Team fouls: 3] (Zion Morant: 1 personal fouls)   FT 1/2: MISS   FT 2/2: GOOD Malcolm Quickley makes 1/2 from the line.
Score: 55-75

[07:21] Team_051 possession (Score: 55-75)
Myles Harden attempts a 3Pt. Contested by DeMar Banchero (3.7 feet, MAN). MYLES HARDEN MAKES IT! Assist: Franz Simmons
Score: 58-75

[07:02] Team_063 possession (Score: 58-75)
Kyle Green drives, Shaquille Harden stays with him. Kyle Green attempts a Dunk. Contested by Shaquille Harden (4.9 feet, ZONE). Kyle Green misses. Rebound secured by Myles Harden.

[06:43] Team_051 possession (Score: 58-75)
Jrue Carter attempts a Midrange. Contested by Jaren James (4.2 feet, ZONE). JRUE CARTER MAKES IT!
Score: 60-75

[06:30] Team_063 possession (Score: 60-75)
FOUL! Shooting foul on Zion Morant. Malcolm Quickley to the line for 3 free throws. [Team fouls: 4] (Zion Morant: 2 personal fouls)   FT 1/3: MISS   FT 2/3: GOOD   FT 3/3: GOOD Malcolm Quickley makes 2/3 from the line.
Score: 60-77

[06:15] Team_051 possession (Score: 60-77)
Jrue Carter attempts a 3Pt. Contested by Malcolm Quickley (4.6 feet, ZONE). Jrue Carter misses. FOUL! Loose ball foul on Lamelo Ball during the rebound battle. [Team fouls: 2] No free throws, side out. (Lamelo Ball: 1 personal fouls)

[05:58] Team_051 possession (Score: 60-77)
Myles Harden attempts a 3Pt. Contested by DeMar Banchero (3.7 feet, ZONE). Myles Harden misses. Rebound secured by Kyle Green.

[05:42] Team_063 possession (Score: 60-77)
Malcolm Quickley drives to the basket... FOUL! Offensive foul on Malcolm Quickley! Zion Morant drew the charge! [Team fouls: 3] (Malcolm Quickley: 1 personal fouls) TURNOVER! (dead ball)

[05:25] Team_051 possession (Score: 60-77)
Myles Harden drives and kicks out. Zion Morant attempts a 3Pt. Contested by DeMar Banchero (3.9 feet, ZONE). ZION MORANT MAKES IT! Assist: Shaquille Harden
Score: 63-77

[05:13] Team_063 possession (Score: 63-77)
Malcolm Quickley attempts a Layup. BLOCKED BY FRANZ SIMMONS! Ball is loose! Rebound secured by Myles Harden.

[04:59] Team_051 possession (Score: 63-77)
Franz Simmons attempts a Midrange. Contested by Jaren James (4.2 feet, ZONE). FRANZ SIMMONS MAKES IT! Assist: Zion Morant
Score: 65-77

[04:43] Team_063 possession (Score: 65-77)
Jaren James attempts a 3Pt. Contested by Jrue Carter (4.8 feet, MAN). JAREN JAMES MAKES IT! Assist: Lamelo Ball
Score: 65-80

[04:28] Team_051 possession (Score: 65-80)
Myles Harden attempts a 3Pt. Contested by DeMar Banchero (3.8 feet, MAN). Myles Harden misses. FOUL! Loose ball foul on Kyle Green during the rebound battle. [Team fouls: 4] No free throws, side out. (Kyle Green: 2 personal fouls)

[04:14] Team_051 possession (Score: 65-80)
FOUL! Shooting foul on Kyle Green. Shaquille Harden to the line for 2 free throws. [BONUS: 5 team fouls] (Kyle Green: 3 personal fouls)   FT 1/2: GOOD   FT 2/2: GOOD Shaquille Harden makes 2/2 from the line.
Score: 67-80

[04:03] Team_063 possession (Score: 67-80)
Lamelo Ball drives, Franz Simmons stays with him. Lamelo Ball attempts a Layup. Contested by Franz Simmons (5.5 feet, MAN). LAMELO BALL MAKES IT! Assist: Jaren James
Score: 67-82

[03:48] Team_051 possession (Score: 67-82)
FOUL! Shooting foul on DeMar Banchero. Myles Harden to the line for 3 free throws. [BONUS: 6 team fouls] (DeMar Banchero: 1 personal fouls)   FT 1/3: GOOD   FT 2/3: GOOD   FT 3/3: GOOD Myles Harden makes 3/3 from the line.
Score: 70-82

[03:34] Team_063 possession (Score: 70-82)
FOUL! Shooting foul on Franz Simmons. Lamelo Ball to the line for 2 free throws. [BONUS: 5 team fouls] (Franz Simmons: 2 personal fouls)   FT 1/2: MISS   FT 2/2: MISS Lamelo Ball makes 0/2 from the line. Rebound secured by Franz Simmons.

[03:19] Team_051 possession (Score: 70-82)
Franz Simmons attempts a Midrange. Contested by Lamelo Ball (5.0 feet, MAN). Franz Simmons misses. Rebound secured by Lamelo Ball.

[03:09] Team_063 possession (Score: 70-82)
Kyle Green drives, Shaquille Harden stays with him. Kyle Green attempts a Dunk. Contested by Shaquille Harden (5.4 feet, MAN). KYLE GREEN MAKES IT!
Score: 70-84

[02:57] Team_051 possession (Score: 70-84)
Shaquille Harden attempts a Layup. Contested by Kyle Green (4.3 feet, MAN). SHAQUILLE HARDEN MAKES IT! Assist: Myles Harden
Score: 72-84

[02:44] Team_063 possession (Score: 72-84)
Lamelo Ball loses the ball! Stripped by Franz Simmons! TURNOVER! (live ball)

[02:25] Team_051 possession (Score: 72-84)
Jrue Carter attempts a 3Pt. Contested by DeMar Banchero (4.5 feet, ZONE). JRUE CARTER MAKES IT! Assist: Myles Harden
Score: 75-84

[02:11] Team_063 possession (Score: 75-84)
Jaren James attempts a Midrange. Contested by Jrue Carter (4.9 feet, MAN). Jaren James misses. FOUL! Loose ball foul on Franz Simmons during the rebound battle. [IN THE BONUS! 6 team fouls] Kyle Green to the line for 2 free throws. (Franz Simmons: 3 personal fouls)   FT 1/2: GOOD   FT 2/2: GOOD Kyle Green makes 2/2 from the line.
Score: 75-86

[01:56] Team_051 possession (Score: 75-86)
Zion Morant attempts a 3Pt. Contested by Malcolm Quickley (5.3 feet, MAN). ZION MORANT MAKES IT! Assist: Jrue Carter
Score: 78-86

[01:44] Team_063 possession (Score: 78-86)
Lamelo Ball attempts a Layup. Contested by Franz Simmons (5.8 feet, MAN). Lamelo Ball misses. Offensive rebound by Kyle Green! Kyle Green's putback is no good. Rebound secured by Jrue Carter.

[01:29] Team_051 possession (Score: 78-86)
Myles Harden drives, DeMar Banchero stays with him. Myles Harden attempts a Layup. Contested by DeMar Banchero (4.1 feet, MAN). Myles Harden misses. Rebound secured by Lamelo Ball.

[01:14] Team_063 possession (Score: 78-86)
Kyle Green attempts a Midrange. Contested by Myles Harden (5.2 feet, ZONE). Kyle Green misses. Rebound secured by Franz Simmons.

[00:58] Team_051 possession (Score: 78-86)
Myles Harden attempts a Layup. Contested by DeMar Banchero (4.1 feet, MAN). MYLES HARDEN MAKES IT! Assist: Franz Simmons
Score: 80-86

[00:45] Team_063 possession (Score: 80-86)
FOUL! Shooting foul on Shaquille Harden. Kyle Green to the line for 2 free throws. [BONUS: 7 team fouls] (Shaquille Harden: 1 personal fouls)   FT 1/2: GOOD   FT 2/2: GOOD Kyle Green makes 2/2 from the line.
Score: 80-88

[00:35] Team_051 possession (Score: 80-88)
FOUL! Shooting foul on Lamelo Ball. Franz Simmons to the line for 3 free throws. [BONUS: 7 team fouls] (Lamelo Ball: 2 personal fouls)   FT 1/3: GOOD   FT 2/3: GOOD   FT 3/3: GOOD Franz Simmons makes 3/3 from the line.
Score: 83-88

[00:19] Team_063 possession (Score: 83-88)
Malcolm Quickley drives, Zion Morant stays with him. Malcolm Quickley attempts a Dunk. Contested by Zion Morant (5.5 feet, MAN). MALCOLM QUICKLEY MAKES IT! Assist: Lamelo Ball
Score: 83-90

[00:03] Team_051 possession (Score: 83-90)
Franz Simmons attempts a Layup. Contested by Lamelo Ball (5.3 feet, MAN). FRANZ SIMMONS MAKES IT! Assist: Zion Morant
Score: 85-90

================================================================================
                              4TH QUARTER COMPLETE                              
================================================================================

4TH QUARTER SCORE: Team_051 32, Team_063 22

BOX SCORE:
================================================================================

Team_051
--------------------------------------------------------------------------------
Player                MIN  PTS  REB  AST  TO      FG   FG%      3P   3P%
--------------------------------------------------------------------------------
Franz Simmons          38    9    5    2   0   4/7    57.1     0/0   0.0
Myles Harden           23    8    3    3   0   3/6    50.0     0/0   0.0
Zion Morant            21    6    0    2   0   2/3    66.7     0/0   0.0
Shaquille Harden       38    4    3    1   0   2/2   100.0     0/0   0.0
Tyler Harris           27    3    1    0   0   1/1   100.0     0/0   0.0
OG Siakam              27    0    0    0   0   0/2     0.0     0/0   0.0

TEAM: FG: 13/22 (59.1%), 3PT: 5/11 (45.5%), REB: 12 (3 off, 9 def), AST: 9, TO: 1
TEAM FOULS: 7 [Team_063 in BONUS]


Team_063
--------------------------------------------------------------------------------
Player                MIN  PTS  REB  AST  TO      FG   FG%      3P   3P%
--------------------------------------------------------------------------------
Kyle Green             22    6    1    0   0   3/5    60.0     0/0   0.0
Malcolm Quickley       38    5    3    0   0   3/5    60.0     0/0   0.0
Jrue Carter            22    5    1    1   0   2/2   100.0     0/0   0.0
Jaren James            21    3    0    1   0   1/2    50.0     0/0   0.0
Lamelo Ball            22    2    4    2   0   1/4    25.0     0/0   0.0
Dirk Reaves            27    0    1    0   0   0/0     0.0     0/0   0.0
DeMar Banchero         23    0    0    0   0   0/2     0.0     0/0   0.0

TEAM: FG: 9/19 (47.4%), 3PT: 2/6 (33.3%), REB: 10 (1 off, 9 def), AST: 3, TO: 3
TEAM FOULS: 7 [Team_051 in BONUS]

================================================================================

================================================================================
                               FULL GAME COMPLETE                               
================================================================================

FINAL SCORE: Team_051 85, Team_063 90

SCORING BY QUARTER:
--------------------------------------------------------------------------------
Team                     Q1     Q2     Q3     Q4    FINAL
--------------------------------------------------------------------------------
Team_051                 22     17     14     32       85
Team_063                 18     20     30     22       90
--------------------------------------------------------------------------------

FULL GAME BOX SCORE:
================================================================================

Team_051
--------------------------------------------------------------------------------
Player                MIN  PTS  REB  AST  TO      FG   FG%      3P   3P%      FT STL BLK
--------------------------------------------------------------------------------
Franz Simmons          38    9   12    3   2   4/8    50.0   1/2    50.0   4/5     2   1
Shaquille Harden       38   10   12    2   3   4/6    66.7   0/1     0.0   2/2     0   0
Larry McGrady          27   16    0    2   3   7/10   70.0   1/2    50.0   1/1     0   0
OG Siakam              27    8    7    2   1   4/15   26.7   0/10    0.0   4/4     0   0
Austin Sexton          25    5    0    2   3   3/8    37.5   1/5    20.0   1/2     0   0
Myles Harden           23   16    5    3   3   6/11   54.5   4/7    57.1   5/5     0   0
Jrue Carter            22   11    1    1   1   4/7    57.1   1/3    33.3   4/4     0   0
Zion Morant            21    6    0    3   0   1/4    25.0   1/4    25.0   0/0     0   0
Tobias Jokic           11    2    3    1   0   1/4    25.0   0/1     0.0   0/0     0   0
Pau Tatum              11    0    5    2   0   0/1     0.0   0/0     0.0   0/0     0   0

TEAM: FG: 36/77 (46.8%), 3PT: 9/35 (25.7%), REB: 48 (9 off, 39 def), AST: 21, TO: 16


Team_063
--------------------------------------------------------------------------------
Player                MIN  PTS  REB  AST  TO      FG   FG%      3P   3P%      FT STL BLK
--------------------------------------------------------------------------------
Malcolm Quickley       38   15    8    0   2   8/14   57.1   3/7    42.9   5/7     0   1
Terry Reaves           27    7    0    2   0   4/10   40.0   2/5    40.0   5/6     1   0
Dirk Reaves            27   23   11    1   2   7/13   53.8   3/4    75.0   4/5     3   0
Tyler Harris           27   11   11    2   3   4/8    50.0   1/1   100.0   9/12    2   0
Bradley Davis          25    0    0    3   1   0/1     0.0   0/1     0.0   0/0     1   0
DeMar Banchero         23   11    0    0   2   3/7    42.9   2/4    50.0   1/2     0   0
Lamelo Ball            22    2    9    4   3   1/5    20.0   0/2     0.0   0/2     0   0
Kyle Green             22    6    1    0   0   3/10   30.0   0/2     0.0   4/4     1   0
Jaren James            21    7    0    1   0   4/5    80.0   1/2    50.0   0/0     0   0
Cole Durant            11    3    8    2   1   1/2    50.0   0/0     0.0   1/1     0   0

TEAM: FG: 36/76 (47.4%), 3PT: 12/28 (42.9%), REB: 44 (6 off, 38 def), AST: 15, TO: 14

================================================================================
