================================================================================
                        FULL GAME - Team_078 vs Team_079                        
================================================================================

================================================================================
                       1ST QUARTER - Team_078 vs Team_079                       
================================================================================

[12:00] Team_078 possession (Score: 0-0)
Ben Ginobili attempts a 3Pt. Contested by Trae Durant (3.4 feet, ZONE). Ben Ginobili misses. Rebound secured by Donovan Randle.

[11:49] Team_079 possession (Score: 0-0)
Bam Randle attempts a 3Pt. Contested by Isaiah Simmons (2.9 feet, MAN). Bam Randle misses. Rebound secured by Ben Ginobili.

[11:36] Team_078 possession (Score: 0-0)
Jabari Barnes drives to the basket... FOUL! Offensive foul on Jabari Barnes! Khris Embiid drew the charge! [Team fouls: 1] (Jabari Barnes: 1 personal fouls) TURNOVER! (dead ball)

[11:19] Team_079 possession (Score: 0-0)
Miles Ming drives to the basket... Miles Ming commits a violation (traveling/carry)! TURNOVER! (dead ball)

[11:04] Team_078 possession (Score: 0-0)
Jabari Barnes attempts a 3Pt. Contested by Trae Durant (3.5 feet, ZONE). Jabari Barnes misses. FOUL! Loose ball foul on Donovan Randle during the rebound battle. [Team fouls: 1] No free throws, side out. (Donovan Randle: 1 personal fouls)

[10:52] Team_078 possession (Score: 0-0)
Jabari Barnes attempts a Midrange. Contested by Khris Embiid (4.9 feet, MAN). Jabari Barnes misses. Rebound secured by Bam Randle.

[10:36] Team_079 possession (Score: 0-0)
Bam Randle drives, Isaiah Simmons stays with him. Bam Randle attempts a Dunk. Contested by Isaiah Simmons (2.9 feet, MAN). BAM RANDLE MAKES IT!
Score: 0-2

[10:23] Team_078 possession (Score: 0-2)
FOUL! Shooting foul on Donovan Randle. Jabari Barrett to the line for 2 free throws. [Team fouls: 2] (Donovan Randle: 2 personal fouls)   FT 1/2: GOOD   FT 2/2: GOOD Jabari Barrett makes 2/2 from the line.
Score: 2-2

[10:11] Team_079 possession (Score: 2-2)
FOUL! Shooting foul on Ben Ginobili. Trae Durant to the line for 2 free throws. [Team fouls: 2] (Ben Ginobili: 1 personal fouls)   FT 1/2: GOOD   FT 2/2: MISS Trae Durant makes 1/2 from the line. Rebound secured by Jabari Barrett.
Score: 2-3

[10:01] Team_078 possession (Score: 2-3)
Isaiah Simmons attempts a Midrange. Contested by Miles Ming (4.3 feet, ZONE). Isaiah Simmons misses. Rebound secured by Bam Randle.

[09:48] Team_079 possession (Score: 2-3)
Donovan Randle makes the Layup and draws the foul on Jabari Barrett! And-1! Donovan Randle to the line for 1. [Team fouls: 3] (Jabari Barrett: 1 personal fouls)   FT 1/1: GOOD Donovan Randle makes 1/1 from the line.
Score: 2-6

[09:31] Team_078 possession (Score: 2-6)
Isaiah Simmons attempts a Midrange. Contested by Bam Randle (4.4 feet, MAN). ISAIAH SIMMONS MAKES IT!
Score: 4-6

[09:18] Team_079 possession (Score: 4-6)
FOUL! Holding foul on Ben Ginobili. [Team fouls: 4] No free throws, side out. (Ben Ginobili: 2 personal fouls)

[09:00] Team_079 possession (Score: 4-6)
Miles Ming attempts a Midrange. Contested by Kyrie Carter (4.0 feet, MAN). Miles Ming misses. Offensive rebound by Donovan Randle! Donovan Randle kicks it out.

[08:45] Team_079 possession (Score: 4-6)
Trae Durant attempts a 3Pt. Contested by Kyrie Carter (3.6 feet, ZONE). Trae Durant misses. Rebound secured by Isaiah Simmons.

[08:28] Team_078 possession (Score: 4-6)
Jabari Barnes drives and kicks out. Kyrie Carter attempts a Midrange. Contested by Miles Ming (4.1 feet, MAN). Kyrie Carter misses. Rebound secured by Bam Randle.

[08:13] Team_079 possession (Score: 4-6)
Miles Ming attempts a 3Pt. Contested by Kyrie Carter (4.0 feet, MAN). Miles Ming misses. Rebound secured by Ben Ginobili.

[08:02] Team_078 possession (Score: 4-6)
Jabari Barnes drives and kicks out. Jabari Barnes attempts a Midrange. Contested by Miles Ming (4.1 feet, ZONE). Jabari Barnes misses. Rebound secured by Trae Durant.

[07:48] Team_079 possession (Score: 4-6)
Donovan Randle makes the Layup and draws the foul on Jabari Barrett! And-1! Donovan Randle to the line for 1. [BONUS: 5 team fouls] (Jabari Barrett: 2 personal fouls)   FT 1/1: GOOD Donovan Randle makes 1/1 from the line.
Score: 4-9

[07:32] Team_078 possession (Score: 4-9)
Isaiah Simmons makes the Layup and draws the foul on Trae Durant! And-1! Isaiah Simmons to the line for 1. [Team fouls: 3] (Trae Durant: 1 personal fouls)   FT 1/1: GOOD Isaiah Simmons makes 1/1 from the line.
Score: 7-9

[07:18] Team_079 possession (Score: 7-9)
Donovan Randle attempts a 3Pt. Contested by Isaiah Simmons (3.2 feet, ZONE). DONOVAN RANDLE MAKES IT! Assist: Miles Ming
Score: 7-12

[07:04] Team_078 possession (Score: 7-12)
Kyrie Carter attempts a 3Pt. Contested by Trae Durant (2.9 feet, ZONE). Kyrie Carter misses. Rebound secured by Donovan Randle.

[06:53] Team_079 possession (Score: 7-12)
Trae Durant makes the Layup and draws the foul on Ben Ginobili! And-1! Trae Durant to the line for 1. [BONUS: 6 team fouls] (Ben Ginobili: 3 personal fouls)   FT 1/1: GOOD Trae Durant makes 1/1 from the line.
Score: 7-15

[06:36] Team_078 possession (Score: 7-15)
Jabari Barnes drives and kicks out. Isaiah Simmons attempts a 3Pt. Contested by Miles Ming (4.1 feet, ZONE). ISAIAH SIMMONS MAKES IT! Assist: Kyrie Carter
Score: 10-15

[06:19] Team_079 possession (Score: 10-15)
Donovan Randle drives to the basket... FOUL! Offensive foul on Donovan Randle! Jabari Barrett drew the charge! [Team fouls: 4] (Donovan Randle: 3 personal fouls) TURNOVER! (dead ball)

[06:02] Team_078 possession (Score: 10-15)
Ben Ginobili attempts a 3Pt. Contested by Trae Durant (3.4 feet, MAN). Ben Ginobili misses. Rebound secured by Trae Durant.

[05:53] Team_079 possession (Score: 10-15)
Khris Embiid attempts a 3Pt. Contested by Isaiah Simmons (3.3 feet, ZONE). Khris Embiid misses. Rebound secured by Jabari Barrett.

[05:43] Team_078 possession (Score: 10-15)
Ben Ginobili attempts a 3Pt. Contested by Trae Durant (3.4 feet, ZONE). BEN GINOBILI MAKES IT! Assist: Jabari Barrett
Score: 13-15

[05:27] Team_079 possession (Score: 13-15)
Khris Embiid attempts a 3Pt. Contested by Isaiah Simmons (3.3 feet, ZONE). Khris Embiid misses. Rebound secured by Isaiah Simmons.

[05:09] Team_078 possession (Score: 13-15)
Ben Ginobili drives, Trae Durant stays with him. Ben Ginobili attempts a Layup. Contested by Trae Durant (3.4 feet, ZONE). Ben Ginobili misses. Rebound secured by Bam Randle.

[04:58] Team_079 possession (Score: 13-15)
Miles Ming attempts a Midrange. Contested by Kyrie Carter (4.0 feet, MAN). MILES MING MAKES IT!
Score: 13-17

[04:42] Team_078 possession (Score: 13-17)
Isaiah Simmons attempts a 3Pt. Contested by Bam Randle (4.5 feet, MAN). Isaiah Simmons misses. FOUL! Loose ball foul on Bam Randle during the rebound battle. [IN THE BONUS! 5 team fouls] Isaiah Simmons to the line for 2 free throws. (Bam Randle: 1 personal fouls)   FT 1/2: MISS   FT 2/2: GOOD Isaiah Simmons makes 1/2 from the line.
Score: 14-17

[04:29] Team_079 possession (Score: 14-17)
Bam Randle attempts a Midrange. Contested by Isaiah Simmons (3.0 feet, MAN). Bam Randle misses. Rebound secured by Jabari Barrett.

[04:13] Team_078 possession (Score: 14-17)
Jabari Barrett attempts a Midrange. Contested by Bam Randle (4.3 feet, ZONE). Jabari Barrett misses. Rebound secured by Donovan Randle.

[03:58] Team_079 possession (Score: 14-17)
Trae Durant attempts a 3Pt. Contested by Ben Ginobili (4.6 feet, MAN). Trae Durant misses. Rebound secured by Ben Ginobili.

[03:42] Team_078 possession (Score: 14-17)
Jabari Barrett attempts a Layup. Contested by Donovan Randle (4.4 feet, MAN). JABARI BARRETT MAKES IT!
Score: 16-17

[03:28] Team_079 possession (Score: 16-17)
Khris Embiid drives and kicks out. Trae Durant attempts a 3Pt. Contested by Isaiah Simmons (3.2 feet, ZONE). Trae Durant misses. Rebound secured by Jabari Barrett.

[03:11] Team_078 possession (Score: 16-17)
Jabari Barnes attempts a Layup. Contested by Khris Embiid (5.0 feet, MAN). JABARI BARNES MAKES IT! Assist: Kyrie Carter
Score: 18-17

[02:57] Team_079 possession (Score: 18-17)
Bam Randle attempts a 3Pt. Contested by Isaiah Simmons (3.1 feet, MAN). Bam Randle misses. Rebound secured by Isaiah Simmons.

[02:46] Team_078 possession (Score: 18-17)
Isaiah Simmons attempts a 3Pt. Contested by Khris Embiid (4.9 feet, ZONE). ISAIAH SIMMONS MAKES IT! Assist: Ben Ginobili
Score: 21-17

[02:29] Team_079 possession (Score: 21-17)
Trae Durant attempts a Layup. Contested by Ben Ginobili (4.7 feet, MAN). TRAE DURANT MAKES IT! Assist: Khris Embiid
Score: 21-19

[02:19] Team_078 possession (Score: 21-19)
Kyrie Carter drives, Trae Durant stays with him. Kyrie Carter attempts a Layup. Contested by Trae Durant (3.2 feet, ZONE). KYRIE CARTER MAKES IT!
Score: 23-19

[02:02] Team_079 possession (Score: 23-19)
Miles Ming attempts a Midrange. Contested by Isaiah Simmons (3.6 feet, ZONE). MILES MING MAKES IT!
Score: 23-21

[01:48] Team_078 possession (Score: 23-21)
Jabari Barrett attempts a Midrange. Contested by Miles Ming (4.4 feet, ZONE). Jabari Barrett misses. Rebound secured by Bam Randle.

[01:32] Team_079 possession (Score: 23-21)
Miles Ming attempts a 3Pt. Contested by Kyrie Carter (4.4 feet, MAN). Miles Ming misses. Rebound secured by Jabari Barrett.

[01:14] Team_078 possession (Score: 23-21)
Jabari Barrett attempts a Midrange. Contested by Donovan Randle (4.6 feet, MAN). JABARI BARRETT MAKES IT!
Score: 25-21

[01:00] Team_079 possession (Score: 25-21)
Khris Embiid throws a bad pass! Stolen by Jabari Barnes! TURNOVER! (live ball)

[00:48] Team_078 possession (Score: 25-21)
Isaiah Simmons drives and kicks out. Isaiah Simmons attempts a 3Pt. Contested by Bam Randle (4.7 feet, MAN). Isaiah Simmons misses. Rebound secured by Bam Randle.

[00:33] Team_079 possession (Score: 25-21)
Donovan Randle drives, Jabari Barrett stays with him. Donovan Randle attempts a Dunk. Contested by Jabari Barrett (5.3 feet, MAN). DONOVAN RANDLE MAKES IT! Assist: Miles Ming
Score: 25-23

[00:17] Team_078 possession (Score: 25-23)
FOUL! Holding foul on Trae Durant. [IN THE BONUS! 6 team fouls] Ben Ginobili to the line for 2 free throws. (Trae Durant: 2 personal fouls)   FT 1/2: GOOD   FT 2/2: GOOD Ben Ginobili makes 2/2 from the line.
Score: 27-23

================================================================================
                              1ST QUARTER COMPLETE                              
================================================================================

1ST QUARTER SCORE: Team_078 27, Team_079 23

BOX SCORE:
================================================================================

Team_078
--------------------------------------------------------------------------------
Player                MIN  PTS  REB  AST  TO      FG   FG%      3P   3P%
--------------------------------------------------------------------------------
Isaiah Simmons         12   12    4    0   0   5/7    71.4     0/0   0.0
Jabari Barrett         12    6    5    1   0   3/5    60.0     0/0   0.0
Ben Ginobili           12    5    3    1   0   2/5    40.0     0/0   0.0
Jabari Barnes          12    2    0    0   0   1/4    25.0     0/0   0.0
Kyrie Carter           12    2    0    2   0   1/2    50.0     0/0   0.0

TEAM: FG: 12/23 (52.2%), 3PT: 3/6 (50.0%), REB: 12 (1 off, 11 def), AST: 4, TO: 1
TEAM FOULS: 6 [Team_079 in BONUS]


Team_079
--------------------------------------------------------------------------------
Player                MIN  PTS  REB  AST  TO      FG   FG%      3P   3P%
--------------------------------------------------------------------------------
Donovan Randle         12   11    4    0   0   4/4   100.0     0/0   0.0
Trae Durant            12    5    2    0   0   2/5    40.0     0/0   0.0
Miles Ming             12    4    0    2   0   2/4    50.0     0/0   0.0
Bam Randle             12    2    6    0   0   1/4    25.0     0/0   0.0
Khris Embiid           12    0    0    1   0   0/3     0.0     0/0   0.0

TEAM: FG: 9/20 (45.0%), 3PT: 1/9 (11.1%), REB: 12 (1 off, 11 def), AST: 3, TO: 3
TEAM FOULS: 6 [Team_078 in BONUS]

================================================================================

================================================================================
                       2ND QUARTER - Team_078 vs Team_079                       
================================================================================

[12:00] Team_078 possession (Score: 27-23)
Jabari Barnes attempts a Midrange. Contested by Khris Embiid (5.1 feet, MAN). Jabari Barnes misses. Offensive rebound by Isaiah Simmons! Isaiah Simmons's putback is no good. Rebound secured by Trae Durant.

[11:49] Team_079 possession (Score: 27-23)
Trae Durant attempts a Layup. Contested by Ben Ginobili (4.8 feet, ZONE). TRAE DURANT MAKES IT! Assist: Donovan Randle
Score: 27-25

[11:34] Team_078 possession (Score: 27-25)
FOUL! Shooting foul on Khris Embiid. Jabari Barnes to the line for 2 free throws. [Team fouls: 1] (Khris Embiid: 1 personal fouls)   FT 1/2: GOOD   FT 2/2: GOOD Jabari Barnes makes 2/2 from the line.
Score: 29-25

[11:20] Team_079 possession (Score: 29-25)
Trae Durant drives, picks up Ben Ginobili. Help arrives from Kyrie Carter! Trae Durant attempts a Dunk. Contested by Kyrie Carter (4.9 feet, MAN). TRAE DURANT MAKES IT!
Score: 29-27

[11:04] Team_078 possession (Score: 29-27)
Jabari Barrett attempts a Layup. Contested by Donovan Randle (4.6 feet, MAN). JABARI BARRETT MAKES IT! Assist: Kyrie Carter
Score: 31-27

[10:48] Team_079 possession (Score: 31-27)
Bam Randle makes the Layup and draws the foul on Kyrie Carter! And-1! Bam Randle to the line for 1. [Team fouls: 1] (Kyrie Carter: 1 personal fouls)   FT 1/1: GOOD Bam Randle makes 1/1 from the line.
Score: 31-30

[10:32] Team_078 possession (Score: 31-30)
Ben Ginobili drives, picks up Trae Durant. Help arrives from Miles Ming! Ben Ginobili attempts a Layup. Contested by Miles Ming (3.7 feet, MAN). BEN GINOBILI MAKES IT!
Score: 33-30

[10:18] Team_079 possession (Score: 33-30)
Khris Embiid attempts a 3Pt. Contested by Jabari Barnes (4.8 feet, MAN). KHRIS EMBIID MAKES IT! Assist: Donovan Randle
Score: 33-33

[10:06] Team_078 possession (Score: 33-33)
Isaiah Simmons makes the Layup and draws the foul on Bam Randle! And-1! Isaiah Simmons to the line for 1. [Team fouls: 2] (Bam Randle: 1 personal fouls)   FT 1/1: MISS Isaiah Simmons makes 0/1 from the line. Rebound secured by Donovan Randle.
Score: 35-33

[09:49] Team_079 possession (Score: 35-33)
Khris Embiid attempts a 3Pt. Contested by Jabari Barnes (4.8 feet, MAN). Khris Embiid misses. Offensive rebound by Donovan Randle! Donovan Randle kicks it out.

[09:37] Team_079 possession (Score: 35-33)
Bam Randle attempts a 3Pt. Contested by Isaiah Simmons (3.5 feet, ZONE). BAM RANDLE MAKES IT! Assist: Donovan Randle
Score: 35-36

[09:20] Team_078 possession (Score: 35-36)
Kyrie Carter makes the Dunk and draws the foul on Khris Embiid! And-1! Kyrie Carter to the line for 1. [Team fouls: 3] (Khris Embiid: 2 personal fouls)   FT 1/1: GOOD Kyrie Carter makes 1/1 from the line.
Score: 38-36

[09:05] Team_079 possession (Score: 38-36)
Khris Embiid attempts a 3Pt. Contested by Isaiah Simmons (4.0 feet, ZONE). Khris Embiid misses. Rebound secured by Isaiah Simmons.

[08:50] Team_078 possession (Score: 38-36)
Isaiah Simmons attempts a 3Pt. Contested by Trae Durant (3.8 feet, ZONE). Isaiah Simmons misses. Rebound secured by Donovan Randle.

[08:36] Team_079 possession (Score: 38-36)
Bam Randle attempts a Midrange. Contested by Ben Ginobili (5.2 feet, ZONE). BAM RANDLE MAKES IT!
Score: 38-38

[08:22] Team_078 possession (Score: 38-38)
Jabari Barrett drives, picks up Trae Durant. Help arrives from Miles Ming! Jabari Barrett attempts a Dunk. Contested by Miles Ming (3.7 feet, ZONE). JABARI BARRETT MAKES IT!
Score: 40-38

[08:06] Team_079 possession (Score: 40-38)
Donovan Randle attempts a 3Pt. Contested by Jabari Barrett (5.5 feet, MAN). Donovan Randle misses. Offensive rebound by Donovan Randle! Donovan Randle kicks it out.

[07:50] Team_079 possession (Score: 40-38)
Miles Ming attempts a 3Pt. Contested by Isaiah Simmons (4.1 feet, ZONE). MILES MING MAKES IT! Assist: Bam Randle
Score: 40-41

[07:35] Team_078 possession (Score: 40-41)
Jabari Barnes attempts a Layup. BLOCKED BY KHRIS EMBIID! Ball is loose! Rebound secured by Donovan Randle.

[07:19] Team_079 possession (Score: 40-41)
Khris Embiid makes the Dunk and draws the foul on Jabari Barrett! And-1! Khris Embiid to the line for 1. [Team fouls: 2] (Jabari Barrett: 1 personal fouls)   FT 1/1: GOOD Khris Embiid makes 1/1 from the line.
Score: 40-44

[07:06] Team_078 possession (Score: 40-44)
Jabari Barnes attempts a 3Pt. Contested by Khris Embiid (5.6 feet, MAN). JABARI BARNES MAKES IT! Assist: Kyrie Carter
Score: 43-44

[06:53] Team_079 possession (Score: 43-44)
Trae Durant makes the Layup and draws the foul on Ben Ginobili! And-1! Trae Durant to the line for 1. [Team fouls: 3] (Ben Ginobili: 1 personal fouls)   FT 1/1: GOOD Trae Durant makes 1/1 from the line.
Score: 43-47

[06:38] Team_078 possession (Score: 43-47)
Ben Ginobili drives and kicks out. Jabari Barnes attempts a 3Pt. Contested by Khris Embiid (5.4 feet, ZONE). Jabari Barnes misses. Offensive rebound by Isaiah Simmons! Isaiah Simmons kicks it out.

[06:26] Team_078 possession (Score: 43-47)
Jabari Barnes drives, picks up Khris Embiid. Help arrives from Miles Ming! Jabari Barnes attempts a Layup. Contested by Miles Ming (5.6 feet, MAN). JABARI BARNES MAKES IT! Assist: Isaiah Simmons
Score: 45-47

[06:15] Team_079 possession (Score: 45-47)
Khris Embiid drives and kicks out. FOUL! Shooting foul on Isaiah Simmons. Miles Ming to the line for 2 free throws. [Team fouls: 4] (Isaiah Simmons: 1 personal fouls)   FT 1/2: MISS   FT 2/2: GOOD Miles Ming makes 1/2 from the line.
Score: 45-48

[06:02] Team_078 possession (Score: 45-48)
Ben Ginobili drives and kicks out. Jabari Barnes attempts a Midrange. Contested by Khris Embiid (5.5 feet, MAN). Jabari Barnes misses. Rebound secured by Donovan Randle.

[05:47] Team_079 possession (Score: 45-48)
Khris Embiid drives, Jabari Barrett stays with him. Khris Embiid attempts a Dunk. Wide open! Jabari Barrett is 6.0 feet away. [ZONE] KHRIS EMBIID MAKES IT!
Score: 45-50

[05:33] Team_078 possession (Score: 45-50)
Jabari Barrett attempts a Midrange. Contested by Bam Randle (5.3 feet, ZONE). JABARI BARRETT MAKES IT!
Score: 47-50

[05:16] Team_079 possession (Score: 47-50)
FOUL! Shooting foul on Jabari Barrett. Miles Ming to the line for 2 free throws. [BONUS: 5 team fouls] (Jabari Barrett: 2 personal fouls)   FT 1/2: GOOD   FT 2/2: GOOD Miles Ming makes 2/2 from the line.
Score: 47-52

[04:57] Team_078 possession (Score: 47-52)
Jabari Barrett attempts a Midrange. Contested by Donovan Randle (5.5 feet, MAN). Jabari Barrett misses. Rebound secured by Trae Durant.

[04:39] Team_079 possession (Score: 47-52)
Donovan Randle attempts a Layup. Contested by Jabari Barrett (6.0 feet, MAN). Donovan Randle misses. Rebound secured by Jabari Barrett.

[04:22] Team_078 possession (Score: 47-52)
Isaiah Simmons attempts a Layup. BLOCKED BY BAM RANDLE! Ball goes out off Bam Randle. Isaiah Simmons's ball!

[04:09] Team_078 possession (Score: 47-52)
Jabari Barnes drives to the basket... Jabari Barnes loses the ball! Stripped by Khris Embiid! TURNOVER! (live ball)

[03:53] Team_079 possession (Score: 47-52)
Khris Embiid attempts a 3Pt. Contested by Isaiah Simmons (4.8 feet, ZONE). KHRIS EMBIID MAKES IT! Assist: Miles Ming
Score: 47-55

[03:35] Team_078 possession (Score: 47-55)
Jabari Barrett attempts a Layup. Contested by Donovan Randle (5.7 feet, MAN). Jabari Barrett misses. Rebound secured by Bam Randle.

[03:20] Team_079 possession (Score: 47-55)
Miles Ming drives and kicks out. Khris Embiid attempts a Midrange. Contested by Isaiah Simmons (4.9 feet, ZONE). Khris Embiid misses. Offensive rebound by Donovan Randle! Donovan Randle kicks it out.

[03:05] Team_079 possession (Score: 47-55)
Donovan Randle attempts a Midrange. Wide open! Ben Ginobili is 6.1 feet away. [ZONE] Donovan Randle misses. Rebound secured by Isaiah Simmons.

[02:54] Team_078 possession (Score: 47-55)
Jabari Barnes attempts a Midrange. Wide open! Khris Embiid is 6.0 feet away. [MAN] Jabari Barnes misses. Offensive rebound by Isaiah Simmons! Isaiah Simmons kicks it out.

[02:37] Team_078 possession (Score: 47-55)
Jabari Barnes drives, Trae Durant stays with him. Jabari Barnes attempts a Dunk. Contested by Trae Durant (4.7 feet, ZONE). Jabari Barnes misses. Rebound secured by Donovan Randle.

[02:22] Team_079 possession (Score: 47-55)
Miles Ming attempts a 3Pt. Contested by Kyrie Carter (5.5 feet, MAN). MILES MING MAKES IT! Assist: Khris Embiid
Score: 47-58

[02:03] Team_078 possession (Score: 47-58)
Kyrie Carter attempts a 3Pt. Contested by Miles Ming (5.6 feet, ZONE). Kyrie Carter misses. Rebound secured by Donovan Randle.

[01:49] Team_079 possession (Score: 47-58)
Donovan Randle drives, picks up Jabari Barrett. Help arrives from Kyrie Carter! Donovan Randle attempts a Dunk. Wide open! Kyrie Carter is 6.4 feet away. [ZONE] Donovan Randle misses. Rebound secured by Isaiah Simmons.

[01:33] Team_078 possession (Score: 47-58)
Ben Ginobili drives to the basket... FOUL! Offensive foul on Ben Ginobili! Trae Durant drew the charge! [Team fouls: 6] (Ben Ginobili: 2 personal fouls) TURNOVER! (dead ball)

[01:20] Team_079 possession (Score: 47-58)
Miles Ming attempts a 3Pt. Contested by Kyrie Carter (5.7 feet, ZONE). Miles Ming misses. Rebound secured by Jabari Barrett.

[01:05] Team_078 possession (Score: 47-58)
Ben Ginobili attempts a Midrange. Wide open! Miles Ming is 6.1 feet away. [ZONE] BEN GINOBILI MAKES IT! Assist: Kyrie Carter
Score: 49-58

[00:50] Team_079 possession (Score: 49-58)
Bam Randle attempts a Midrange. Contested by Isaiah Simmons (5.0 feet, ZONE). Bam Randle misses. Offensive rebound by Trae Durant! Trae Durant kicks it out.

[00:35] Team_079 possession (Score: 49-58)
Donovan Randle attempts a Layup. Wide open! Jabari Barrett is 6.5 feet away. [MAN] Donovan Randle misses. Rebound secured by Jabari Barrett.

[00:20] Team_078 possession (Score: 49-58)
FOUL! Shooting foul on Trae Durant. Jabari Barrett to the line for 2 free throws. [Team fouls: 4] (Trae Durant: 1 personal fouls)   FT 1/2: GOOD   FT 2/2: GOOD Jabari Barrett makes 2/2 from the line.
Score: 51-58

[00:04] Team_079 possession (Score: 51-58)
Trae Durant attempts a 3Pt. Contested by Isaiah Simmons (5.1 feet, ZONE). Trae Durant misses. Offensive rebound by Trae Durant! Trae Durant kicks it out.

================================================================================
                              2ND QUARTER COMPLETE                              
================================================================================

2ND QUARTER SCORE: Team_078 24, Team_079 35

BOX SCORE:
================================================================================

Team_078
--------------------------------------------------------------------------------
Player                MIN  PTS  REB  AST  TO      FG   FG%      3P   3P%
--------------------------------------------------------------------------------
Jabari Barrett         24    8    3    0   0   4/6    66.7     0/0   0.0
Jabari Barnes          24    7    0    0   0   3/6    50.0     0/0   0.0
Ben Ginobili           24    4    0    0   0   2/3    66.7     0/0   0.0
Kyrie Carter           24    3    0    3   0   1/2    50.0     0/0   0.0
Isaiah Simmons         24    0    5    1   0   0/2     0.0     0/0   0.0

TEAM: FG: 10/19 (52.6%), 3PT: 1/3 (33.3%), REB: 9 (3 off, 6 def), AST: 4, TO: 2
TEAM FOULS: 6 [Team_079 in BONUS]


Team_079
--------------------------------------------------------------------------------
Player                MIN  PTS  REB  AST  TO      FG   FG%      3P   3P%
--------------------------------------------------------------------------------
Khris Embiid           24   11    0    1   0   4/5    80.0     0/0   0.0
Miles Ming             24    9    0    1   0   4/5    80.0     0/0   0.0
Bam Randle             24    8    1    1   0   3/3   100.0     0/0   0.0
Trae Durant            24    7    4    0   0   3/3   100.0     0/0   0.0
Donovan Randle         24    0    9    3   0   0/4     0.0     0/0   0.0

TEAM: FG: 14/20 (70.0%), 3PT: 5/7 (71.4%), REB: 13 (5 off, 8 def), AST: 6, TO: 0
TEAM FOULS: 4

================================================================================

================================================================================
                       3RD QUARTER - Team_078 vs Team_079                       
================================================================================

[12:00] Team_078 possession (Score: 51-58)
FOUL! Shooting foul on Trae Durant. Ben Ginobili to the line for 2 free throws. [Team fouls: 1] (Trae Durant: 1 personal fouls)   FT 1/2: GOOD   FT 2/2: GOOD Ben Ginobili makes 2/2 from the line.
Score: 53-58

[11:45] Team_079 possession (Score: 53-58)
Miles Ming drives and kicks out. Trae Durant attempts a 3Pt. Contested by Isaiah Simmons (3.0 feet, ZONE). Trae Durant misses. Rebound secured by Isaiah Simmons.

[11:30] Team_078 possession (Score: 53-58)
Kyrie Carter loses control! Ball rolls out of bounds! TURNOVER! (dead ball)

[11:17] Team_079 possession (Score: 53-58)
Khris Embiid attempts a Midrange. Contested by Jabari Barnes (4.1 feet, MAN). Khris Embiid misses. Offensive rebound by Donovan Randle! Donovan Randle kicks it out.

[11:04] Team_079 possession (Score: 53-58)
FOUL! Reach-in foul on Jabari Barrett during the drive. [Team fouls: 1] No free throws, side out. (Jabari Barrett: 1 personal fouls)

[10:51] Team_079 possession (Score: 53-58)
Trae Durant attempts a 3Pt. Contested by Isaiah Simmons (2.9 feet, ZONE). Trae Durant misses. Rebound secured by Jabari Barrett.

[10:32] Team_078 possession (Score: 53-58)
Ben Ginobili attempts a 3Pt. Contested by Trae Durant (3.4 feet, MAN). Ben Ginobili misses. Offensive rebound by Jabari Barrett! Jabari Barrett kicks it out.

[10:14] Team_078 possession (Score: 53-58)
Isaiah Simmons drives, picks up Trae Durant. Help arrives from Miles Ming! Isaiah Simmons attempts a Layup. Contested by Miles Ming (3.2 feet, ZONE). ISAIAH SIMMONS MAKES IT! Assist: Jabari Barnes
Score: 55-58

[09:58] Team_079 possession (Score: 55-58)
Bam Randle attempts a Layup. BLOCKED BY KYRIE CARTER! Ball is loose! Rebound secured by Isaiah Simmons.

[09:43] Team_078 possession (Score: 55-58)
Jabari Barnes attempts a Midrange. Contested by Miles Ming (4.5 feet, ZONE). Jabari Barnes misses. FOUL! Loose ball foul on Trae Durant during the rebound battle. [Team fouls: 2] No free throws, side out. (Trae Durant: 2 personal fouls)

[09:26] Team_078 possession (Score: 55-58)
Ben Ginobili attempts a Layup. Contested by Trae Durant (3.4 feet, MAN). Ben Ginobili misses. Offensive rebound by Jabari Barrett! Jabari Barrett kicks it out.

[09:13] Team_078 possession (Score: 55-58)
Isaiah Simmons attempts a 3Pt. Contested by Trae Durant (3.2 feet, ZONE). ISAIAH SIMMONS MAKES IT! Assist: Jabari Barrett
Score: 58-58

[08:57] Team_079 possession (Score: 58-58)
Miles Ming makes the Layup and draws the foul on Kyrie Carter! And-1! Miles Ming to the line for 1. [Team fouls: 2] (Kyrie Carter: 1 personal fouls)   FT 1/1: GOOD Miles Ming makes 1/1 from the line.
Score: 58-61

[08:44] Team_078 possession (Score: 58-61)
Ben Ginobili attempts a Midrange. Contested by Trae Durant (3.4 feet, MAN). BEN GINOBILI MAKES IT! Assist: Kyrie Carter
Score: 60-61

[08:32] Team_079 possession (Score: 60-61)
Khris Embiid drives to the basket... Khris Embiid loses the ball! Stripped by Jabari Barnes! TURNOVER! (live ball)

[08:14] Team_078 possession (Score: 60-61)
Kyrie Carter attempts a 3Pt. Contested by Miles Ming (4.0 feet, MAN). Kyrie Carter misses. Offensive rebound by Jabari Barrett! Jabari Barrett kicks it out.

[07:59] Team_078 possession (Score: 60-61)
Kyrie Carter loses control! Ball rolls out of bounds! TURNOVER! (dead ball)

[07:45] Team_079 possession (Score: 60-61)
Bam Randle drives to the basket... Bam Randle throws a bad pass! Stolen by Isaiah Simmons! TURNOVER! (live ball)

[07:30] Team_078 possession (Score: 60-61)
Isaiah Simmons attempts a 3Pt. Contested by Bam Randle (4.4 feet, MAN). Isaiah Simmons misses. Rebound secured by Trae Durant.

[07:10] Team_079 possession (Score: 60-61)
Donovan Randle attempts a Layup. Contested by Jabari Barrett (4.8 feet, MAN). DONOVAN RANDLE MAKES IT! Assist: Miles Ming
Score: 60-63

[06:56] Team_078 possession (Score: 60-63)
Kyrie Carter attempts a 3Pt. Contested by Miles Ming (4.0 feet, MAN). KYRIE CARTER MAKES IT! Assist: Isaiah Simmons
Score: 63-63

[06:39] Team_079 possession (Score: 63-63)
Bam Randle makes the Midrange and draws the foul on Isaiah Simmons! And-1! Bam Randle to the line for 1. [Team fouls: 3] (Isaiah Simmons: 1 personal fouls)   FT 1/1: GOOD Bam Randle makes 1/1 from the line.
Score: 63-66

[06:27] Team_078 possession (Score: 63-66)
FOUL! Reach-in foul on Bam Randle during the drive. [Team fouls: 3] No free throws, side out. (Bam Randle: 1 personal fouls)

[06:16] Team_078 possession (Score: 63-66)
Ben Ginobili attempts a 3Pt. Contested by Trae Durant (3.4 feet, MAN). Ben Ginobili misses. Rebound secured by Donovan Randle.

[06:04] Team_079 possession (Score: 63-66)
Trae Durant drives and kicks out. Bam Randle attempts a Midrange. Contested by Isaiah Simmons (3.0 feet, ZONE). BAM RANDLE MAKES IT! Assist: Miles Ming
Score: 63-68

[05:46] Team_078 possession (Score: 63-68)
Kyrie Carter attempts a Midrange. Contested by Miles Ming (4.0 feet, MAN). Kyrie Carter misses. Rebound secured by Bam Randle.

[05:31] Team_079 possession (Score: 63-68)
Donovan Randle attempts a Midrange. Contested by Isaiah Simmons (3.2 feet, ZONE). Donovan Randle misses. Rebound secured by Isaiah Simmons.

[05:11] Team_078 possession (Score: 63-68)
FOUL! Shooting foul on Khris Embiid. Kyrie Carter to the line for 2 free throws. [Team fouls: 4] (Khris Embiid: 1 personal fouls)   FT 1/2: GOOD   FT 2/2: MISS Kyrie Carter makes 1/2 from the line. Rebound secured by Trae Durant.
Score: 64-68

[04:58] Team_079 possession (Score: 64-68)
Khris Embiid drives to the basket... Khris Embiid throws a bad pass! Stolen by Jabari Barnes! TURNOVER! (live ball)

[04:39] Team_078 possession (Score: 64-68)
Jabari Barnes loses control! Ball rolls out of bounds! TURNOVER! (dead ball)

[04:24] Team_079 possession (Score: 64-68)
Donovan Randle attempts a Midrange. Contested by Jabari Barrett (4.8 feet, MAN). DONOVAN RANDLE MAKES IT!
Score: 64-70

[04:07] Team_078 possession (Score: 64-70)
Jabari Barnes attempts a 3Pt. Contested by Khris Embiid (4.9 feet, MAN). Jabari Barnes misses. Offensive rebound by Isaiah Simmons! Isaiah Simmons's putback is no good. Rebound secured by Trae Durant.

[03:52] Team_079 possession (Score: 64-70)
Bam Randle drives and kicks out. Khris Embiid attempts a 3Pt. Contested by Jabari Barnes (4.0 feet, MAN). KHRIS EMBIID MAKES IT!
Score: 64-73

[03:39] Team_078 possession (Score: 64-73)
Jabari Barnes makes the Layup and draws the foul on Khris Embiid! And-1! Jabari Barnes to the line for 1. [BONUS: 5 team fouls] (Khris Embiid: 2 personal fouls)   FT 1/1: GOOD Jabari Barnes makes 1/1 from the line.
Score: 67-73

[03:23] Team_079 possession (Score: 67-73)
Trae Durant drives, Ben Ginobili stays with him. Trae Durant attempts a Layup. Contested by Ben Ginobili (4.6 feet, ZONE). TRAE DURANT MAKES IT! Assist: Khris Embiid
Score: 67-75

[03:07] Team_078 possession (Score: 67-75)
Ben Ginobili loses the ball! Stripped by Trae Durant! TURNOVER! (live ball)

[02:49] Team_079 possession (Score: 67-75)
Donovan Randle drives to the basket... FOUL! Offensive foul on Donovan Randle! Jabari Barrett drew the charge! [Team fouls: 6] (Donovan Randle: 1 personal fouls) TURNOVER! (dead ball)

[02:31] Team_078 possession (Score: 67-75)
FOUL! Reach-in foul on Miles Ming during the drive. [IN THE BONUS! 7 team fouls] Kyrie Carter to the line for 2 free throws. (Miles Ming: 1 personal fouls)   FT 1/2: GOOD   FT 2/2: GOOD Kyrie Carter makes 2/2 from the line.
Score: 69-75

[02:12] Team_079 possession (Score: 69-75)
Bam Randle drives and kicks out. Khris Embiid attempts a Midrange. Contested by Ben Ginobili (4.9 feet, ZONE). Khris Embiid misses. Rebound secured by Ben Ginobili.

[01:59] Team_078 possession (Score: 69-75)
Jabari Barnes attempts a Layup. BLOCKED BY TRAE DURANT! Ball is loose! Rebound secured by Donovan Randle.

[01:46] Team_079 possession (Score: 69-75)
Miles Ming attempts a Layup. Contested by Jabari Barrett (5.1 feet, ZONE). Miles Ming misses. Rebound secured by Ben Ginobili.

[01:30] Team_078 possession (Score: 69-75)
Isaiah Simmons attempts a 3Pt. Contested by Trae Durant (3.5 feet, ZONE). ISAIAH SIMMONS MAKES IT! Assist: Jabari Barrett
Score: 72-75

[01:16] Team_079 possession (Score: 72-75)
FOUL! Offensive foul on Donovan Randle! Jabari Barrett drew the charge! [Team fouls: 8] (Donovan Randle: 2 personal fouls) TURNOVER! (dead ball)

[01:01] Team_078 possession (Score: 72-75)
Jabari Barnes attempts a 3Pt. Contested by Khris Embiid (5.1 feet, MAN). JABARI BARNES MAKES IT! Assist: Jabari Barrett
Score: 75-75

[00:46] Team_079 possession (Score: 75-75)
Donovan Randle attempts a Layup. Contested by Jabari Barrett (5.2 feet, ZONE). DONOVAN RANDLE MAKES IT! Assist: Khris Embiid
Score: 75-77

[00:34] Team_078 possession (Score: 75-77)
Jabari Barrett attempts a Midrange. Contested by Donovan Randle (4.6 feet, MAN). Jabari Barrett misses. Offensive rebound by Jabari Barrett! Jabari Barrett kicks it out.

[00:20] Team_078 possession (Score: 75-77)
FOUL! Shooting foul on Trae Durant. Jabari Barnes to the line for 3 free throws. [BONUS: 9 team fouls] (Trae Durant: 3 personal fouls)   FT 1/3: GOOD   FT 2/3: GOOD   FT 3/3: MISS Jabari Barnes makes 2/3 from the line. Rebound secured by Donovan Randle.
Score: 77-77

[00:09] Team_079 possession (Score: 77-77)
Miles Ming attempts a 3Pt. Contested by Isaiah Simmons (3.7 feet, ZONE). MILES MING MAKES IT! Assist: Khris Embiid
Score: 77-80

================================================================================
                              3RD QUARTER COMPLETE                              
================================================================================

3RD QUARTER SCORE: Team_078 26, Team_079 22

BOX SCORE:
================================================================================

Team_078
--------------------------------------------------------------------------------
Player                MIN  PTS  REB  AST  TO      FG   FG%      3P   3P%
--------------------------------------------------------------------------------
Isaiah Simmons         36    8    4    1   0   3/4    75.0     0/0   0.0
Jabari Barnes          36    6    0    1   0   2/5    40.0     0/0   0.0
Kyrie Carter           36    5    0    1   0   2/4    50.0     0/0   0.0
Ben Ginobili           36    4    2    0   0   2/3    66.7     0/0   0.0
Jabari Barrett         36    0    5    3   0   0/0     0.0     0/0   0.0

TEAM: FG: 9/16 (56.2%), 3PT: 4/8 (50.0%), REB: 12 (6 off, 6 def), AST: 6, TO: 4
TEAM FOULS: 3


Team_079
--------------------------------------------------------------------------------
Player                MIN  PTS  REB  AST  TO      FG   FG%      3P   3P%
--------------------------------------------------------------------------------
Miles Ming             36    6    0    2   0   2/4    50.0     0/0   0.0
Donovan Randle         36    6    4    0   0   3/4    75.0     0/0   0.0
Bam Randle             36    5    1    0   0   2/4    50.0     0/0   0.0
Khris Embiid           36    3    0    3   0   1/1   100.0     0/0   0.0
Trae Durant            36    2    3    0   0   1/2    50.0     0/0   0.0

TEAM: FG: 9/15 (60.0%), 3PT: 1/2 (50.0%), REB: 7 (1 off, 6 def), AST: 5, TO: 5
TEAM FOULS: 9 [Team_078 in BONUS]

================================================================================

================================================================================
                       4TH QUARTER - Team_078 vs Team_079                       
================================================================================

[12:00] Substitution (Team_078): Jabari Barnes OUT → Magic Barrett IN (stamina_rule2)

[12:00] Substitution (Team_078): Kyrie Carter OUT → Damian Allen IN (stamina_rule2)

[12:00] Substitution (Team_078): Isaiah Simmons OUT → Malcolm Randle IN (stamina_rule2)

[12:00] Substitution (Team_078): Ben Ginobili OUT → Paul Ming IN (stamina_rule2)

[12:00] Substitution (Team_078): Jabari Barrett OUT → Draymond Irving IN (stamina_rule2)

[12:00] Substitution (Team_079): Miles Ming OUT → Karl Ingram IN (stamina_rule2)

[12:00] Substitution (Team_079): Bam Randle OUT → Anthony Wade IN (stamina_rule2)

[12:00] Substitution (Team_079): Donovan Randle OUT → James LaVine IN (stamina_rule2)

[12:00] Team_078 possession (Score: 77-80)
Jabari Barnes drives to the basket... Jabari Barnes throws a bad pass out of bounds! TURNOVER! (dead ball)

[11:42] Team_079 possession (Score: 77-80)
Khris Embiid attempts a 3Pt. Contested by Damian Allen (5.1 feet, ZONE). Khris Embiid misses. Rebound secured by Paul Ming.

[11:27] Team_078 possession (Score: 77-80)
Damian Allen drives and kicks out. Paul Ming attempts a Midrange. Contested by Trae Durant (3.3 feet, ZONE). Paul Ming misses. Rebound secured by James LaVine.

[11:12] Team_079 possession (Score: 77-80)
FOUL! Reach-in foul on Paul Ming during the drive. [Team fouls: 1] No free throws, side out. (Paul Ming: 1 personal fouls)

[11:02] Team_079 possession (Score: 77-80)
FOUL! Shooting foul on Paul Ming. Anthony Wade to the line for 2 free throws. [Team fouls: 2] (Paul Ming: 2 personal fouls)   FT 1/2: GOOD   FT 2/2: GOOD Anthony Wade makes 2/2 from the line.
Score: 77-82

[10:46] Team_078 possession (Score: 77-82)
Paul Ming attempts a Midrange. Contested by Trae Durant (3.4 feet, MAN). Paul Ming misses. Rebound secured by James LaVine.

[10:30] Team_079 possession (Score: 77-82)
Karl Ingram attempts a 3Pt. Contested by Damian Allen (5.0 feet, MAN). KARL INGRAM MAKES IT! Assist: Anthony Wade
Score: 77-85

[10:18] Team_078 possession (Score: 77-85)
Draymond Irving attempts a Midrange. Contested by James LaVine (4.5 feet, MAN). Draymond Irving misses. FOUL! Loose ball foul on Anthony Wade during the rebound battle. [Team fouls: 1] No free throws, side out. (Anthony Wade: 1 personal fouls)

[10:07] Team_078 possession (Score: 77-85)
Damian Allen drives, Trae Durant stays with him. Damian Allen attempts a Dunk. Contested by Trae Durant (3.6 feet, ZONE). DAMIAN ALLEN MAKES IT! Assist: Magic Barrett
Score: 79-85

[09:54] Team_079 possession (Score: 79-85)
FOUL! Shooting foul on Paul Ming. Trae Durant to the line for 2 free throws. [Team fouls: 3] (Paul Ming: 3 personal fouls)   FT 1/2: GOOD   FT 2/2: MISS Trae Durant makes 1/2 from the line. Rebound secured by Malcolm Randle.
Score: 79-86

[09:40] Team_078 possession (Score: 79-86)
Malcolm Randle commits a violation (traveling/carry)! TURNOVER! (dead ball)

[09:40] Substitution (Team_079): Khris Embiid OUT → Evan Mobley IN (stamina_rule2)

[09:40] Substitution (Team_079): Trae Durant OUT → Kobe Curry IN (stamina_rule2)

[09:26] Team_079 possession (Score: 79-86)
Karl Ingram attempts a 3Pt. Contested by Damian Allen (5.0 feet, ZONE). Karl Ingram misses. Rebound secured by Draymond Irving.

[09:11] Team_078 possession (Score: 79-86)
Magic Barrett attempts a Midrange. Contested by Evan Mobley (5.0 feet, MAN). MAGIC BARRETT MAKES IT! Assist: Draymond Irving
Score: 81-86

[08:58] Team_079 possession (Score: 81-86)
James LaVine drives, Paul Ming stays with him. James LaVine attempts a Dunk. Contested by Paul Ming (4.4 feet, ZONE). James LaVine misses. Rebound secured by Malcolm Randle.

[08:44] Team_078 possession (Score: 81-86)
Damian Allen drives and kicks out. Draymond Irving attempts a 3Pt. Contested by James LaVine (4.2 feet, MAN). Draymond Irving misses. Rebound secured by James LaVine.

[08:31] Team_079 possession (Score: 81-86)
Kobe Curry attempts a Midrange. Contested by Damian Allen (5.0 feet, ZONE). KOBE CURRY MAKES IT! Assist: Karl Ingram
Score: 81-88

[08:17] Team_078 possession (Score: 81-88)
FOUL! Holding foul on Anthony Wade. [Team fouls: 2] No free throws, side out. (Anthony Wade: 2 personal fouls)

[08:01] Team_078 possession (Score: 81-88)
Paul Ming makes the Dunk and draws the foul on Kobe Curry! And-1! Paul Ming to the line for 1. [Team fouls: 3] (Kobe Curry: 1 personal fouls)   FT 1/1: GOOD Paul Ming makes 1/1 from the line.
Score: 84-88

[07:50] Team_079 possession (Score: 84-88)
Anthony Wade attempts a Midrange. Contested by Paul Ming (4.4 feet, ZONE). ANTHONY WADE MAKES IT! Assist: Kobe Curry
Score: 84-90

[07:38] Team_078 possession (Score: 84-90)
Damian Allen drives, picks up Karl Ingram. Help arrives from Anthony Wade! Damian Allen attempts a Layup. Contested by Anthony Wade (5.4 feet, MAN). DAMIAN ALLEN MAKES IT! Assist: Magic Barrett
Score: 86-90

[07:20] Team_079 possession (Score: 86-90)
Evan Mobley attempts a Midrange. Contested by Damian Allen (5.4 feet, ZONE). EVAN MOBLEY MAKES IT!
Score: 86-92

[07:09] Team_078 possession (Score: 86-92)
Malcolm Randle attempts a 3Pt. Contested by Evan Mobley (4.7 feet, ZONE). Malcolm Randle misses. Rebound secured by James LaVine.

[06:54] Team_079 possession (Score: 86-92)
Anthony Wade loses control! Ball rolls out of bounds! TURNOVER! (dead ball)

[06:35] Team_078 possession (Score: 86-92)
Paul Ming attempts a 3Pt. Contested by Kobe Curry (4.6 feet, MAN). Paul Ming misses. Rebound secured by James LaVine.

[06:20] Team_079 possession (Score: 86-92)
Karl Ingram attempts a Layup. Contested by Draymond Irving (5.5 feet, ZONE). Karl Ingram misses. Rebound secured by Draymond Irving.

[06:08] Team_078 possession (Score: 86-92)
Damian Allen attempts a Midrange. Contested by Karl Ingram (5.4 feet, MAN). Damian Allen misses. FOUL! Loose ball foul on Kobe Curry during the rebound battle. [Team fouls: 4] No free throws, side out. (Kobe Curry: 2 personal fouls)

[05:55] Team_078 possession (Score: 86-92)
Paul Ming attempts a Midrange. Contested by Kobe Curry (4.6 feet, MAN). Paul Ming misses. Offensive rebound by Draymond Irving! Draymond Irving kicks it out.

[05:43] Team_078 possession (Score: 86-92)
Damian Allen attempts a 3Pt. Contested by Karl Ingram (5.4 feet, MAN). Damian Allen misses. FOUL! Loose ball foul on Anthony Wade during the rebound battle. [IN THE BONUS! 5 team fouls] Paul Ming to the line for 2 free throws. (Anthony Wade: 3 personal fouls)   FT 1/2: GOOD   FT 2/2: GOOD Paul Ming makes 2/2 from the line.
Score: 88-92

[05:29] Team_079 possession (Score: 88-92)
FOUL! Offensive foul on Anthony Wade! Malcolm Randle drew the charge! [Team fouls: 6] (Anthony Wade: 4 personal fouls) TURNOVER! (dead ball)

[05:11] Team_078 possession (Score: 88-92)
Draymond Irving attempts a Layup. Contested by James LaVine (4.5 feet, ZONE). DRAYMOND IRVING MAKES IT!
Score: 90-92

[04:53] Team_079 possession (Score: 90-92)
Karl Ingram attempts a 3Pt. Contested by Damian Allen (5.0 feet, MAN). Karl Ingram misses. Offensive rebound by James LaVine! James LaVine's putback is no good. Rebound secured by Malcolm Randle.

[04:41] Team_078 possession (Score: 90-92)
Magic Barrett attempts a 3Pt. Contested by Evan Mobley (5.0 feet, MAN). MAGIC BARRETT MAKES IT! Assist: Paul Ming
Score: 93-92

[04:25] Team_079 possession (Score: 93-92)
Karl Ingram attempts a 3Pt. Contested by Damian Allen (5.1 feet, MAN). Karl Ingram misses. Rebound secured by Draymond Irving.

[04:09] Team_078 possession (Score: 93-92)
Damian Allen drives to the basket... Damian Allen throws a bad pass out of bounds! TURNOVER! (dead ball)

[03:50] Team_079 possession (Score: 93-92)
Kobe Curry drives to the basket... Kobe Curry loses control! Ball rolls out of bounds! TURNOVER! (dead ball)

[03:38] Team_078 possession (Score: 93-92)
Paul Ming drives, James LaVine stays with him. Paul Ming attempts a Layup. Contested by James LaVine (4.3 feet, ZONE). PAUL MING MAKES IT!
Score: 95-92

[03:23] Team_079 possession (Score: 95-92)
FOUL! Shooting foul on Magic Barrett. Evan Mobley to the line for 2 free throws. [Team fouls: 4] (Magic Barrett: 1 personal fouls)   FT 1/2: GOOD   FT 2/2: GOOD Evan Mobley makes 2/2 from the line.
Score: 95-94

[03:07] Team_078 possession (Score: 95-94)
Malcolm Randle throws a bad pass! Stolen by Anthony Wade! TURNOVER! (live ball)

[02:52] Team_079 possession (Score: 95-94)
Evan Mobley attempts a 3Pt. Contested by Magic Barrett (5.6 feet, MAN). Evan Mobley misses. Offensive rebound by James LaVine! James LaVine puts it back in!
Score: 95-96

[02:34] Team_078 possession (Score: 95-96)
Damian Allen makes the Midrange and draws the foul on Karl Ingram! And-1! Damian Allen to the line for 1. [BONUS: 7 team fouls] (Karl Ingram: 1 personal fouls)   FT 1/1: GOOD Damian Allen makes 1/1 from the line.
Score: 98-96

[02:21] Team_079 possession (Score: 98-96)
FOUL! Holding foul on Draymond Irving. [IN THE BONUS! 5 team fouls] James LaVine to the line for 2 free throws. (Draymond Irving: 1 personal fouls)   FT 1/2: GOOD   FT 2/2: GOOD James LaVine makes 2/2 from the line.
Score: 98-98

[02:06] Team_078 possession (Score: 98-98)
Paul Ming commits a violation (traveling/carry)! TURNOVER! (dead ball)

[01:49] Team_079 possession (Score: 98-98)
Anthony Wade attempts a Layup. Contested by Malcolm Randle (4.6 feet, MAN). Anthony Wade misses. Rebound secured by Draymond Irving.

[01:37] Team_078 possession (Score: 98-98)
Paul Ming attempts a Midrange. Contested by Karl Ingram (5.6 feet, ZONE). PAUL MING MAKES IT! Assist: Malcolm Randle
Score: 100-98

[01:25] Team_079 possession (Score: 100-98)
FOUL! Offensive foul on James LaVine! Draymond Irving drew the charge! [Team fouls: 8] (James LaVine: 1 personal fouls) TURNOVER! (dead ball)

[01:13] Team_078 possession (Score: 100-98)
Draymond Irving attempts a Layup. Contested by James LaVine (4.9 feet, ZONE). DRAYMOND IRVING MAKES IT! Assist: Damian Allen
Score: 102-98

[00:57] Team_079 possession (Score: 102-98)
Evan Mobley attempts a 3Pt. Contested by Magic Barrett (5.8 feet, MAN). Evan Mobley misses. Rebound secured by Paul Ming.

[00:41] Team_078 possession (Score: 102-98)
FOUL! Reach-in foul on James LaVine during the drive. [IN THE BONUS! 9 team fouls] Damian Allen to the line for 2 free throws. (James LaVine: 2 personal fouls)   FT 1/2: GOOD   FT 2/2: GOOD Damian Allen makes 2/2 from the line.
Score: 104-98

[00:26] Team_079 possession (Score: 104-98)
James LaVine drives, Paul Ming stays with him. James LaVine attempts a Layup. Contested by Paul Ming (4.9 feet, ZONE). JAMES LAVINE MAKES IT! Assist: Evan Mobley
Score: 104-100

[00:14] Team_078 possession (Score: 104-100)
Magic Barrett attempts a 3Pt. Contested by Evan Mobley (5.2 feet, ZONE). Magic Barrett misses. Offensive rebound by Paul Ming! Paul Ming kicks it out.

================================================================================
                              4TH QUARTER COMPLETE                              
================================================================================

4TH QUARTER SCORE: Team_078 27, Team_079 20

BOX SCORE:
================================================================================

Team_078
--------------------------------------------------------------------------------
Player                MIN  PTS  REB  AST  TO      FG   FG%      3P   3P%
--------------------------------------------------------------------------------
Paul Ming              12    9    4    1   0   4/6    66.7     0/0   0.0
Damian Allen           12    9    0    1   0   4/6    66.7     0/0   0.0
Magic Barrett          12    5    0    2   0   2/2   100.0     0/0   0.0
Draymond Irving        12    4    6    1   0   2/2   100.0     0/0   0.0
Malcolm Randle         12    0    3    1   0   0/1     0.0     0/0   0.0

TEAM: FG: 12/17 (70.6%), 3PT: 2/4 (50.0%), REB: 12 (4 off, 8 def), AST: 6, TO: 5
TEAM FOULS: 5 [Team_079 in BONUS]


Team_079
--------------------------------------------------------------------------------
Player                MIN  PTS  REB  AST  TO      FG   FG%      3P   3P%
--------------------------------------------------------------------------------
James LaVine           12    6    6    0   0   3/4    75.0     0/0   0.0
Anthony Wade           12    4    0    1   0   2/3    66.7     0/0   0.0
Evan Mobley             9    4    0    1   0   2/3    66.7     0/0   0.0
Karl Ingram            12    3    0    1   0   1/5    20.0     0/0   0.0
Kobe Curry              9    2    0    1   0   1/1   100.0     0/0   0.0
Khris Embiid           39    0    0    0   0   0/1     0.0     0/0   0.0
Trae Durant            39    0    0    0   0   0/1     0.0     0/0   0.0

TEAM: FG: 9/18 (50.0%), 3PT: 2/7 (28.6%), REB: 7 (2 off, 5 def), AST: 4, TO: 4
TEAM FOULS: 9 [Team_078 in BONUS]

================================================================================

================================================================================
                               FULL GAME COMPLETE                               
================================================================================

FINAL SCORE: Team_078 104, Team_079 100

SCORING BY QUARTER:
--------------------------------------------------------------------------------
Team                     Q1     Q2     Q3     Q4    FINAL
--------------------------------------------------------------------------------
Team_078                 27     24     26     27      104
Team_079                 23     35     22     20      100
--------------------------------------------------------------------------------

FULL GAME BOX SCORE:
================================================================================

Team_078
--------------------------------------------------------------------------------
Player                MIN  PTS  REB  AST  TO      FG   FG%      3P   3P%      FT STL BLK
--------------------------------------------------------------------------------
Jabari Barnes          37   15    0    1   2   7/16   43.8   2/4    50.0   5/6     3   0
Kyrie Carter           37   10    0    6   2   4/8    50.0   1/3    33.3   4/5     0   1
Isaiah Simmons         37   20   13    2   1   7/12   58.3   4/6    66.7   2/4     1   0
Ben Ginobili           37   13    5    1   3   5/10   50.0   1/4    25.0   4/4     0   0
Jabari Barrett         37   14   13    4   0   7/11   63.6   0/0     0.0   4/4     0   0
Magic Barrett          12    5    0    2   0   2/2   100.0   1/1   100.0   0/0     0   0
Damian Allen           12    9    0    1   0   5/7    71.4   1/1   100.0   3/3     0   0
Malcolm Randle         12    0    3    1   2   0/1     0.0   0/1     0.0   0/0     0   0
Paul Ming              12    9    4    1   1   3/5    60.0   0/1     0.0   3/3     0   0
Draymond Irving        12    4    6    1   1   2/2   100.0   0/0     0.0   0/0     0   0

TEAM: FG: 43/75 (57.3%), 3PT: 10/21 (47.6%), REB: 45 (14 off, 31 def), AST: 20, TO: 12


Team_079
--------------------------------------------------------------------------------
Player                MIN  PTS  REB  AST  TO      FG   FG%      3P   3P%      FT STL BLK
--------------------------------------------------------------------------------
Khris Embiid           39   14    0    5   2   5/10   50.0   2/6    33.3   1/1     1   1
Trae Durant            39   14    9    0   0   7/12   58.3   0/3     0.0   4/6     1   1
Miles Ming             37   19    0    5   3   7/12   58.3   3/6    50.0   4/5     0   0
Bam Randle             37   15    8    1   1   6/11   54.5   1/3    33.3   2/2     0   1
Donovan Randle         37   17   17    3   2   7/12   58.3   1/1   100.0   2/2     0   0
Karl Ingram            12    3    0    1   1   1/5    20.0   1/4    25.0   0/0     0   0
Anthony Wade           12    4    0    1   2   2/3    66.7   0/0     0.0   2/2     1   0
James LaVine           12    6    6    0   1   1/2    50.0   0/0     0.0   2/2     0   0
Evan Mobley             9    4    0    1   0   3/4    75.0   1/2    50.0   2/2     0   0
Kobe Curry              9    2    0    1   0   1/1   100.0   0/0     0.0   0/0     0   0

TEAM: FG: 41/73 (56.2%), 3PT: 9/25 (36.0%), REB: 39 (9 off, 30 def), AST: 18, TO: 12

================================================================================
