================================================================================
                        FULL GAME - Team_021 vs Team_067                        
================================================================================

================================================================================
                       1ST QUARTER - Team_021 vs Team_067                       
================================================================================

[12:00] Team_021 possession (Score: 0-0)
Karl Bridges attempts a Layup. Contested by Desmond Simmons (3.7 feet, MAN). KARL BRIDGES MAKES IT! Assist: Kyrie Wagner
Score: 2-0

[11:48] Team_067 possession (Score: 2-0)
Malcolm Westbrook attempts a 3Pt. Contested by Zach Carter (4.4 feet, MAN). Malcolm Westbrook misses. FOUL! Loose ball foul on Anthony Oladipo during the rebound battle. [Team fouls: 1] No free throws, side out. (Anthony Oladipo: 1 personal fouls)

[11:36] Team_067 possession (Score: 2-0)
FOUL! Shooting foul on Zach Carter. Malcolm Westbrook to the line for 2 free throws. [Team fouls: 2] (Zach Carter: 1 personal fouls)   FT 1/2: GOOD   FT 2/2: MISS Malcolm Westbrook makes 1/2 from the line. Rebound secured by Kyrie Leonard.
Score: 2-1

[11:22] Team_021 possession (Score: 2-1)
Karl Bridges attempts a 3Pt. Contested by Desmond Simmons (3.7 feet, MAN). Karl Bridges misses. Rebound secured by Malcolm Westbrook.

[11:08] Team_067 possession (Score: 2-1)
FOUL! Shooting foul on Zach Carter. Desmond Simmons to the line for 2 free throws. [Team fouls: 3] (Zach Carter: 2 personal fouls)   FT 1/2: GOOD   FT 2/2: MISS Desmond Simmons makes 1/2 from the line. Rebound secured by Zach Carter.
Score: 2-2

[10:48] Team_021 possession (Score: 2-2)
Kyrie Leonard drives, picks up Manu Reaves. Help arrives from Desmond Simmons! Kyrie Leonard attempts a Dunk. Contested by Desmond Simmons (3.7 feet, MAN). KYRIE LEONARD MAKES IT! Assist: Karl Bridges
Score: 4-2

[10:38] Team_067 possession (Score: 4-2)
Desmond Simmons drives, Zach Carter stays with him. Desmond Simmons attempts a Layup. Contested by Zach Carter (4.2 feet, ZONE). DESMOND SIMMONS MAKES IT! Assist: Wendell Antetokounmpo
Score: 4-4

[10:23] Team_021 possession (Score: 4-4)
Anthony Oladipo attempts a 3Pt. Contested by Wendell Antetokounmpo (4.4 feet, MAN). Anthony Oladipo misses. Rebound secured by Desmond Simmons.

[10:09] Team_067 possession (Score: 4-4)
FOUL! Reach-in foul on Zach Carter during the drive. [Team fouls: 4] No free throws, side out. (Zach Carter: 3 personal fouls)

[10:00] Team_067 possession (Score: 4-4)
Manu Reaves attempts a Midrange. Contested by Kyrie Leonard (5.0 feet, MAN). MANU REAVES MAKES IT! Assist: Wendell Antetokounmpo
Score: 4-6

[09:50] Team_021 possession (Score: 4-6)
Karl Bridges attempts a 3Pt. Contested by Desmond Simmons (3.7 feet, MAN). Karl Bridges misses. Rebound secured by Malcolm Westbrook.

[09:35] Team_067 possession (Score: 4-6)
Ben Ball loses control! Ball rolls out of bounds! TURNOVER! (dead ball)

[09:20] Team_021 possession (Score: 4-6)
Anthony Oladipo attempts a Midrange. Contested by Wendell Antetokounmpo (4.4 feet, MAN). Anthony Oladipo misses. Rebound secured by Desmond Simmons.

[09:05] Team_067 possession (Score: 4-6)
Ben Ball drives and kicks out. Desmond Simmons attempts a 3Pt. Contested by Kyrie Wagner (4.0 feet, ZONE). DESMOND SIMMONS MAKES IT! Assist: Manu Reaves
Score: 4-9

[08:49] Team_021 possession (Score: 4-9)
Kyrie Leonard attempts a Midrange. Contested by Manu Reaves (3.7 feet, MAN). KYRIE LEONARD MAKES IT! Assist: Zach Carter
Score: 6-9

[08:39] Team_067 possession (Score: 6-9)
Malcolm Westbrook drives, Zach Carter stays with him. Malcolm Westbrook attempts a Layup. Contested by Zach Carter (4.4 feet, ZONE). Malcolm Westbrook misses. Offensive rebound by Malcolm Westbrook! Malcolm Westbrook's putback is no good. Rebound secured by Kyrie Leonard.

[08:25] Team_021 possession (Score: 6-9)
Zach Carter attempts a Midrange. Contested by Malcolm Westbrook (4.4 feet, MAN). Zach Carter misses. Rebound secured by Wendell Antetokounmpo.

[08:12] Team_067 possession (Score: 6-9)
Manu Reaves attempts a Midrange. Contested by Karl Bridges (6.0 feet, ZONE). MANU REAVES MAKES IT! Assist: Wendell Antetokounmpo
Score: 6-11

[07:56] Team_021 possession (Score: 6-11)
Kyrie Wagner attempts a Midrange. Contested by Ben Ball (3.9 feet, ZONE). KYRIE WAGNER MAKES IT!
Score: 8-11

[07:44] Team_067 possession (Score: 8-11)
Ben Ball drives to the basket... Ben Ball commits a violation (traveling/carry)! TURNOVER! (dead ball)

[07:30] Team_021 possession (Score: 8-11)
FOUL! Reach-in foul on Desmond Simmons during the drive. [Team fouls: 1] No free throws, side out. (Desmond Simmons: 1 personal fouls)

[07:15] Team_021 possession (Score: 8-11)
Karl Bridges attempts a 3Pt. Contested by Desmond Simmons (3.7 feet, MAN). Karl Bridges misses. Rebound secured by Desmond Simmons.

[07:03] Team_067 possession (Score: 8-11)
Desmond Simmons attempts a 3Pt. Contested by Karl Bridges (5.8 feet, MAN). Desmond Simmons misses. Rebound secured by Kyrie Leonard.

[06:48] Team_021 possession (Score: 8-11)
Anthony Oladipo attempts a 3Pt. Contested by Desmond Simmons (3.7 feet, ZONE). Anthony Oladipo misses. Rebound secured by Desmond Simmons.

[06:36] Team_067 possession (Score: 8-11)
Ben Ball drives to the basket... Ben Ball throws a bad pass! Stolen by Zach Carter! TURNOVER! (live ball)

[06:18] Team_021 possession (Score: 8-11)
FOUL! Holding foul on Malcolm Westbrook. [Team fouls: 2] No free throws, side out. (Malcolm Westbrook: 1 personal fouls)

[06:08] Team_021 possession (Score: 8-11)
Kyrie Leonard attempts a Midrange. Contested by Desmond Simmons (3.6 feet, ZONE). Kyrie Leonard misses. Rebound secured by Wendell Antetokounmpo.

[05:54] Team_067 possession (Score: 8-11)
FOUL! Reach-in foul on Karl Bridges during the drive. [IN THE BONUS! 5 team fouls] Desmond Simmons to the line for 2 free throws. (Karl Bridges: 1 personal fouls)   FT 1/2: GOOD   FT 2/2: GOOD Desmond Simmons makes 2/2 from the line.
Score: 8-13

[05:39] Team_021 possession (Score: 8-13)
Anthony Oladipo drives, Wendell Antetokounmpo stays with him. Anthony Oladipo attempts a Dunk. Contested by Wendell Antetokounmpo (4.4 feet, MAN). ANTHONY OLADIPO MAKES IT! Assist: Kyrie Leonard
Score: 10-13

[05:21] Team_067 possession (Score: 10-13)
Malcolm Westbrook attempts a 3Pt. Contested by Zach Carter (4.4 feet, MAN). Malcolm Westbrook misses. Rebound secured by Zach Carter.

[05:07] Team_021 possession (Score: 10-13)
FOUL! Shooting foul on Malcolm Westbrook. Kyrie Leonard to the line for 2 free throws. [Team fouls: 3] (Malcolm Westbrook: 2 personal fouls)   FT 1/2: GOOD   FT 2/2: GOOD Kyrie Leonard makes 2/2 from the line.
Score: 12-13

[04:50] Team_067 possession (Score: 12-13)
FOUL! Offensive foul on Ben Ball! Kyrie Wagner drew the charge! [Team fouls: 4] (Ben Ball: 1 personal fouls) TURNOVER! (dead ball)

[04:35] Team_021 possession (Score: 12-13)
Karl Bridges attempts a Layup. Contested by Malcolm Westbrook (4.0 feet, ZONE). KARL BRIDGES MAKES IT! Assist: Anthony Oladipo
Score: 14-13

[04:20] Team_067 possession (Score: 14-13)
Wendell Antetokounmpo attempts a 3Pt. Contested by Kyrie Wagner (4.4 feet, ZONE). Wendell Antetokounmpo misses. Rebound secured by Anthony Oladipo.

[04:10] Team_021 possession (Score: 14-13)
FOUL! Holding foul on Manu Reaves. [IN THE BONUS! 5 team fouls] Kyrie Leonard to the line for 2 free throws. (Manu Reaves: 1 personal fouls)   FT 1/2: GOOD   FT 2/2: GOOD Kyrie Leonard makes 2/2 from the line.
Score: 16-13

[04:00] Team_067 possession (Score: 16-13)
FOUL! Reach-in foul on Kyrie Wagner during the drive. [IN THE BONUS! 6 team fouls] Ben Ball to the line for 2 free throws. (Kyrie Wagner: 1 personal fouls)   FT 1/2: GOOD   FT 2/2: GOOD Ben Ball makes 2/2 from the line.
Score: 16-15

[03:46] Team_021 possession (Score: 16-15)
FOUL! Reach-in foul on Manu Reaves during the drive. [IN THE BONUS! 6 team fouls] Kyrie Leonard to the line for 2 free throws. (Manu Reaves: 2 personal fouls)   FT 1/2: GOOD   FT 2/2: GOOD Kyrie Leonard makes 2/2 from the line.
Score: 18-15

[03:31] Team_067 possession (Score: 18-15)
Desmond Simmons drives and kicks out. Desmond Simmons attempts a Midrange. Contested by Karl Bridges (5.7 feet, ZONE). DESMOND SIMMONS MAKES IT! Assist: Wendell Antetokounmpo
Score: 18-17

[03:16] Team_021 possession (Score: 18-17)
Zach Carter drives, Malcolm Westbrook stays with him. Zach Carter attempts a Layup. Contested by Malcolm Westbrook (4.6 feet, ZONE). ZACH CARTER MAKES IT! Assist: Anthony Oladipo
Score: 20-17

[03:02] Team_067 possession (Score: 20-17)
Wendell Antetokounmpo drives to the basket... Wendell Antetokounmpo loses the ball! Stripped by Zach Carter! TURNOVER! (live ball)

[02:51] Team_021 possession (Score: 20-17)
Karl Bridges attempts a 3Pt. Contested by Desmond Simmons (3.9 feet, ZONE). KARL BRIDGES MAKES IT! Assist: Kyrie Wagner
Score: 23-17

[02:36] Team_067 possession (Score: 23-17)
Malcolm Westbrook attempts a Midrange. Contested by Zach Carter (4.6 feet, MAN). MALCOLM WESTBROOK MAKES IT!
Score: 23-19

[02:20] Team_021 possession (Score: 23-19)
Kyrie Leonard attempts a Layup. Contested by Malcolm Westbrook (4.2 feet, ZONE). KYRIE LEONARD MAKES IT! Assist: Kyrie Wagner
Score: 25-19

[02:07] Team_067 possession (Score: 25-19)
Wendell Antetokounmpo attempts a 3Pt. Contested by Anthony Oladipo (5.2 feet, MAN). Wendell Antetokounmpo misses. Rebound secured by Kyrie Leonard.

[01:54] Team_021 possession (Score: 25-19)
Zach Carter drives to the basket... Zach Carter commits a violation (traveling/carry)! TURNOVER! (dead ball)

[01:54] Substitution (Team_021): Kyrie Leonard OUT → Joel LaVine IN (stamina_rule2)

[01:54] Substitution (Team_021): Anthony Oladipo OUT → Victor Mitchell IN (stamina_rule2)

[01:54] Substitution (Team_021): Karl Bridges OUT → Paul Allen IN (stamina_rule2)

[01:54] Substitution (Team_021): Kyrie Wagner OUT → Vince George IN (stamina_rule2)

[01:54] Substitution (Team_021): Zach Carter OUT → Magic Ingram IN (stamina_rule2)

[01:54] Substitution (Team_067): Manu Reaves OUT → James Rozier IN (stamina_rule2)

[01:54] Substitution (Team_067): Wendell Antetokounmpo OUT → Anfernee Wagner IN (stamina_rule2)

[01:54] Substitution (Team_067): Desmond Simmons OUT → Kyle Leonard IN (stamina_rule2)

[01:54] Substitution (Team_067): Ben Ball OUT → Kristaps Davis IN (stamina_rule2)

[01:54] Substitution (Team_067): Malcolm Westbrook OUT → Zach DeRozan IN (stamina_rule2)

[01:38] Team_067 possession (Score: 25-19)
Anfernee Wagner attempts a 3Pt. Contested by Victor Mitchell (4.0 feet, MAN). Anfernee Wagner misses. Offensive rebound by Kristaps Davis! Kristaps Davis puts it back in!
Score: 25-21

[01:19] Team_021 possession (Score: 25-21)
FOUL! Shooting foul on Anfernee Wagner. Magic Ingram to the line for 3 free throws. [BONUS: 7 team fouls] (Anfernee Wagner: 1 personal fouls)   FT 1/3: MISS   FT 2/3: GOOD   FT 3/3: GOOD Magic Ingram makes 2/3 from the line.
Score: 27-21

[01:02] Team_067 possession (Score: 27-21)
Kyle Leonard drives and kicks out. Zach DeRozan attempts a Midrange. Contested by Magic Ingram (5.0 feet, MAN). Zach DeRozan misses. Offensive rebound by Kristaps Davis! Kristaps Davis's putback is no good. Rebound secured by Vince George.

[00:47] Team_021 possession (Score: 27-21)
Paul Allen drives to the basket... Paul Allen loses the ball! Stripped by Kristaps Davis! TURNOVER! (live ball)

[00:35] Team_067 possession (Score: 27-21)
Anfernee Wagner attempts a Midrange. Contested by Victor Mitchell (4.0 feet, MAN). Anfernee Wagner misses. Rebound secured by Victor Mitchell.

[00:20] Team_021 possession (Score: 27-21)
Vince George attempts a Layup. Contested by Kristaps Davis (4.2 feet, MAN). Vince George misses. Rebound secured by Anfernee Wagner.

[00:06] Team_067 possession (Score: 27-21)
James Rozier attempts a 3Pt. Contested by Victor Mitchell (4.2 feet, ZONE). James Rozier misses. Rebound secured by Magic Ingram.

================================================================================
                              1ST QUARTER COMPLETE                              
================================================================================

1ST QUARTER SCORE: Team_021 27, Team_067 21

BOX SCORE:
================================================================================

Team_021
--------------------------------------------------------------------------------
Player                MIN  PTS  REB  AST  TO      FG   FG%      3P   3P%
--------------------------------------------------------------------------------
Kyrie Leonard          10   12    4    1   0   6/7    85.7     0/0   0.0
Karl Bridges           10    7    0    1   0   3/6    50.0     0/0   0.0
Kyrie Wagner           10    2    0    3   0   1/1   100.0     0/0   0.0
Zach Carter            10    2    2    1   0   1/2    50.0     0/0   0.0
Anthony Oladipo        10    2    1    2   0   1/4    25.0     0/0   0.0
Magic Ingram            2    2    1    0   0   1/1   100.0     0/0   0.0
Vince George            2    0    1    0   0   0/1     0.0     0/0   0.0
Victor Mitchell         2    0    1    0   0   0/0     0.0     0/0   0.0

TEAM: FG: 13/22 (59.1%), 3PT: 2/7 (28.6%), REB: 8 (0 off, 8 def), AST: 8, TO: 2
TEAM FOULS: 6 [Team_067 in BONUS]


Team_067
--------------------------------------------------------------------------------
Player                MIN  PTS  REB  AST  TO      FG   FG%      3P   3P%
--------------------------------------------------------------------------------
Desmond Simmons        10    9    4    0   0   4/6    66.7     0/0   0.0
Manu Reaves            10    4    0    1   0   2/2   100.0     0/0   0.0
Malcolm Westbrook      10    2    3    0   0   1/4    25.0     0/0   0.0
Ben Ball               10    2    0    0   0   1/1   100.0     0/0   0.0
Kristaps Davis          2    2    1    0   0   1/1   100.0     0/0   0.0
Wendell Antetokounmpo   10    0    2    4   0   0/2     0.0     0/0   0.0
Kyle Leonard            2    0    0    0   0   0/1     0.0     0/0   0.0
Anfernee Wagner         2    0    1    0   0   0/1     0.0     0/0   0.0
James Rozier            2    0    0    0   0   0/1     0.0     0/0   0.0

TEAM: FG: 9/19 (47.4%), 3PT: 1/6 (16.7%), REB: 13 (4 off, 9 def), AST: 5, TO: 5
TEAM FOULS: 7 [Team_021 in BONUS]

================================================================================

================================================================================
                       2ND QUARTER - Team_021 vs Team_067                       
================================================================================

[12:00] Team_021 possession (Score: 27-21)
Zach Carter throws a bad pass! Stolen by Malcolm Westbrook! TURNOVER! (live ball)

[11:49] Team_067 possession (Score: 27-21)
Desmond Simmons attempts a Midrange. Contested by Karl Bridges (5.8 feet, MAN). DESMOND SIMMONS MAKES IT!
Score: 27-23

[11:33] Team_021 possession (Score: 27-23)
Zach Carter drives to the basket... Zach Carter throws a bad pass out of bounds! TURNOVER! (dead ball)

[11:13] Team_067 possession (Score: 27-23)
Desmond Simmons attempts a 3Pt. Contested by Kyrie Wagner (4.3 feet, ZONE). DESMOND SIMMONS MAKES IT! Assist: Wendell Antetokounmpo
Score: 27-26

[10:54] Team_021 possession (Score: 27-26)
Kyrie Leonard attempts a Midrange. Contested by Manu Reaves (4.0 feet, MAN). Kyrie Leonard misses. Rebound secured by Desmond Simmons.

[10:42] Team_067 possession (Score: 27-26)
Desmond Simmons attempts a 3Pt. Contested by Kyrie Wagner (4.4 feet, ZONE). Desmond Simmons misses. Rebound secured by Anthony Oladipo.

[10:30] Team_021 possession (Score: 27-26)
Karl Bridges attempts a 3Pt. Contested by Desmond Simmons (3.8 feet, MAN). Karl Bridges misses. Rebound secured by Manu Reaves.

[10:21] Team_067 possession (Score: 27-26)
Manu Reaves drives, picks up Kyrie Leonard. Help arrives from Anthony Oladipo! Manu Reaves attempts a Layup. Contested by Anthony Oladipo (5.1 feet, MAN). MANU REAVES MAKES IT! Assist: Malcolm Westbrook
Score: 27-28

[10:01] Team_021 possession (Score: 27-28)
Kyrie Wagner drives, Ben Ball stays with him. Kyrie Wagner attempts a Layup. Contested by Ben Ball (4.2 feet, MAN). Kyrie Wagner misses. Rebound secured by Malcolm Westbrook.

[09:43] Team_067 possession (Score: 27-28)
FOUL! Reach-in foul on Zach Carter during the drive. [Team fouls: 1] No free throws, side out. (Zach Carter: 1 personal fouls)

[09:26] Team_067 possession (Score: 27-28)
Malcolm Westbrook drives and kicks out. Desmond Simmons attempts a 3Pt. Contested by Karl Bridges (5.8 feet, MAN). Desmond Simmons misses. Rebound secured by Anthony Oladipo.

[09:12] Team_021 possession (Score: 27-28)
Karl Bridges drives to the basket... Karl Bridges loses the ball! Stripped by Malcolm Westbrook! TURNOVER! (live ball)

[09:02] Team_067 possession (Score: 27-28)
Manu Reaves attempts a 3Pt. Contested by Kyrie Wagner (4.7 feet, ZONE). MANU REAVES MAKES IT! Assist: Desmond Simmons
Score: 27-31

[08:51] Team_021 possession (Score: 27-31)
Zach Carter makes the Layup and draws the foul on Wendell Antetokounmpo! And-1! Zach Carter to the line for 1. [Team fouls: 1] (Wendell Antetokounmpo: 1 personal fouls)   FT 1/1: GOOD Zach Carter makes 1/1 from the line.
Score: 30-31

[08:41] Team_067 possession (Score: 30-31)
Malcolm Westbrook attempts a 3Pt. Contested by Kyrie Wagner (4.7 feet, ZONE). Malcolm Westbrook misses. Rebound secured by Anthony Oladipo.

[08:29] Team_021 possession (Score: 30-31)
Kyrie Wagner attempts a 3Pt. Contested by Ben Ball (4.4 feet, MAN). KYRIE WAGNER MAKES IT! Assist: Anthony Oladipo
Score: 33-31

[08:19] Team_067 possession (Score: 33-31)
Manu Reaves attempts a Midrange. Contested by Kyrie Leonard (5.3 feet, MAN). Manu Reaves misses. FOUL! Loose ball foul on Zach Carter during the rebound battle. [Team fouls: 2] No free throws, side out. (Zach Carter: 2 personal fouls)

[08:04] Team_067 possession (Score: 33-31)
FOUL! Reach-in foul on Karl Bridges during the drive. [Team fouls: 3] No free throws, side out. (Karl Bridges: 1 personal fouls)

[07:49] Team_067 possession (Score: 33-31)
Ben Ball attempts a 3Pt. Contested by Kyrie Wagner (5.3 feet, MAN). Ben Ball misses. Rebound secured by Zach Carter.

[07:32] Team_021 possession (Score: 33-31)
Karl Bridges drives, picks up Desmond Simmons. Help arrives from Wendell Antetokounmpo! Karl Bridges attempts a Layup. Contested by Wendell Antetokounmpo (4.1 feet, MAN). Karl Bridges misses. Rebound secured by Malcolm Westbrook.

[07:18] Team_067 possession (Score: 33-31)
Malcolm Westbrook throws a bad pass out of bounds! TURNOVER! (dead ball)

[07:18] Substitution (Team_021): Kyrie Leonard OUT → Joel LaVine IN (stamina_rule2)

[07:18] Substitution (Team_021): Anthony Oladipo OUT → Victor Mitchell IN (stamina_rule2)

[07:18] Substitution (Team_021): Karl Bridges OUT → Paul Allen IN (stamina_rule2)

[07:18] Substitution (Team_021): Kyrie Wagner OUT → Vince George IN (stamina_rule2)

[07:18] Substitution (Team_021): Zach Carter OUT → Magic Ingram IN (stamina_rule2)

[07:18] Substitution (Team_067): Manu Reaves OUT → James Rozier IN (stamina_rule2)

[07:18] Substitution (Team_067): Wendell Antetokounmpo OUT → Anfernee Wagner IN (stamina_rule2)

[07:18] Substitution (Team_067): Desmond Simmons OUT → Kyle Leonard IN (stamina_rule2)

[07:18] Substitution (Team_067): Ben Ball OUT → Kristaps Davis IN (stamina_rule2)

[07:18] Substitution (Team_067): Malcolm Westbrook OUT → Zach DeRozan IN (stamina_rule2)

[07:05] Team_021 possession (Score: 33-31)
Paul Allen attempts a 3Pt. Contested by Kyle Leonard (3.9 feet, MAN). Paul Allen misses. Rebound secured by Kristaps Davis.

[06:49] Team_067 possession (Score: 33-31)
Zach DeRozan attempts a Midrange. Contested by Magic Ingram (5.0 feet, MAN). Zach DeRozan misses. Rebound secured by Victor Mitchell.

[06:33] Team_021 possession (Score: 33-31)
Joel LaVine makes the Dunk and draws the foul on Kristaps Davis! And-1! Joel LaVine to the line for 1. [Team fouls: 2] (Kristaps Davis: 1 personal fouls)   FT 1/1: GOOD Joel LaVine makes 1/1 from the line.
Score: 36-31

[06:18] Team_067 possession (Score: 36-31)
Kristaps Davis attempts a 3Pt. Contested by Victor Mitchell (4.9 feet, ZONE). KRISTAPS DAVIS MAKES IT! Assist: James Rozier
Score: 36-34

[06:00] Team_021 possession (Score: 36-34)
Magic Ingram attempts a Midrange. Contested by Zach DeRozan (5.4 feet, MAN). Magic Ingram misses. Rebound secured by Zach DeRozan.

[05:45] Team_067 possession (Score: 36-34)
Kristaps Davis attempts a Layup. Contested by Magic Ingram (5.7 feet, ZONE). Kristaps Davis misses. Rebound secured by Magic Ingram.

[05:31] Team_021 possession (Score: 36-34)
FOUL! Shooting foul on James Rozier. Joel LaVine to the line for 2 free throws. [Team fouls: 3] (James Rozier: 1 personal fouls)   FT 1/2: GOOD   FT 2/2: MISS Joel LaVine makes 1/2 from the line. Rebound secured by Anfernee Wagner.
Score: 37-34

[05:16] Team_067 possession (Score: 37-34)
James Rozier makes the Layup and draws the foul on Magic Ingram! And-1! James Rozier to the line for 1. [Team fouls: 4] (Magic Ingram: 1 personal fouls)   FT 1/1: GOOD James Rozier makes 1/1 from the line.
Score: 37-37

[05:05] Team_021 possession (Score: 37-37)
Victor Mitchell drives, picks up Anfernee Wagner. Help arrives from James Rozier! Victor Mitchell attempts a Dunk. Contested by James Rozier (3.6 feet, MAN). Victor Mitchell misses. Offensive rebound by Magic Ingram! Magic Ingram kicks it out.

[04:51] Team_021 possession (Score: 37-37)
Magic Ingram drives to the basket... Magic Ingram throws a bad pass! Stolen by Kristaps Davis! TURNOVER! (live ball)

[04:33] Team_067 possession (Score: 37-37)
Anfernee Wagner attempts a Midrange. Contested by Paul Allen (5.7 feet, ZONE). ANFERNEE WAGNER MAKES IT!
Score: 37-39

[04:15] Team_021 possession (Score: 37-39)
Paul Allen drives, picks up Kristaps Davis. Help arrives from James Rozier! Paul Allen attempts a Dunk. Contested by James Rozier (4.5 feet, ZONE). PAUL ALLEN MAKES IT! Assist: Victor Mitchell
Score: 39-39

[04:02] Team_067 possession (Score: 39-39)
James Rozier drives, picks up Joel LaVine. Help arrives from Victor Mitchell! James Rozier attempts a Layup. Contested by Victor Mitchell (5.9 feet, MAN). JAMES ROZIER MAKES IT! Assist: Kristaps Davis
Score: 39-41

[03:50] Team_021 possession (Score: 39-41)
Victor Mitchell attempts a Midrange. Contested by Anfernee Wagner (3.6 feet, MAN). Victor Mitchell misses. Offensive rebound by Magic Ingram! Magic Ingram kicks it out.

[03:37] Team_021 possession (Score: 39-41)
Vince George drives and kicks out. Joel LaVine attempts a 3Pt. Contested by Anfernee Wagner (3.7 feet, ZONE). Joel LaVine misses. Rebound secured by Zach DeRozan.

[03:20] Team_067 possession (Score: 39-41)
Kyle Leonard attempts a 3Pt. Contested by Victor Mitchell (4.6 feet, ZONE). Kyle Leonard misses. Offensive rebound by Kristaps Davis! Kristaps Davis's putback is no good. Rebound secured by Vince George.

[03:05] Team_021 possession (Score: 39-41)
Joel LaVine drives and kicks out. Paul Allen attempts a 3Pt. Contested by Anfernee Wagner (3.7 feet, ZONE). Paul Allen misses. Rebound secured by Anfernee Wagner.

[02:55] Team_067 possession (Score: 39-41)
Zach DeRozan drives to the basket... Zach DeRozan commits a violation (traveling/carry)! TURNOVER! (dead ball)

[02:44] Team_021 possession (Score: 39-41)
Paul Allen drives and kicks out. Vince George attempts a Midrange. Contested by Kristaps Davis (4.3 feet, MAN). VINCE GEORGE MAKES IT! Assist: Joel LaVine
Score: 41-41

[02:28] Team_067 possession (Score: 41-41)
Anfernee Wagner drives and kicks out. James Rozier attempts a 3Pt. Contested by Joel LaVine (5.9 feet, MAN). James Rozier misses. Rebound secured by Vince George.

[02:13] Team_021 possession (Score: 41-41)
Vince George makes the Dunk and draws the foul on James Rozier! And-1! Vince George to the line for 1. [Team fouls: 4] (James Rozier: 2 personal fouls)   FT 1/1: MISS Vince George makes 0/1 from the line. Rebound secured by Anfernee Wagner.
Score: 43-41

[01:55] Team_067 possession (Score: 43-41)
Kyle Leonard drives, picks up Paul Allen. Help arrives from Victor Mitchell! Kyle Leonard attempts a Dunk. Wide open! Victor Mitchell is 6.3 feet away. [MAN] Kyle Leonard misses. Offensive rebound by Kristaps Davis! Kristaps Davis puts it back in!
Score: 43-43

[01:37] Team_021 possession (Score: 43-43)
Vince George drives and kicks out. Victor Mitchell attempts a Midrange. Contested by Anfernee Wagner (3.7 feet, MAN). Victor Mitchell misses. Rebound secured by Zach DeRozan.

[01:23] Team_067 possession (Score: 43-43)
Kristaps Davis drives to the basket... Kristaps Davis throws a bad pass! Stolen by Vince George! TURNOVER! (live ball)

[01:09] Team_021 possession (Score: 43-43)
Paul Allen attempts a 3Pt. Contested by Anfernee Wagner (3.9 feet, ZONE). PAUL ALLEN MAKES IT!
Score: 46-43

[00:53] Team_067 possession (Score: 46-43)
Kristaps Davis drives, Magic Ingram stays with him. Kristaps Davis attempts a Layup. Contested by Magic Ingram (5.8 feet, ZONE). KRISTAPS DAVIS MAKES IT! Assist: James Rozier
Score: 46-45

[00:38] Team_021 possession (Score: 46-45)
Magic Ingram drives to the basket... Magic Ingram loses control! Ball rolls out of bounds! TURNOVER! (dead ball)

[00:26] Team_067 possession (Score: 46-45)
Kyle Leonard attempts a 3Pt. Wide open! Paul Allen is 6.3 feet away. [MAN] Kyle Leonard misses. Rebound secured by Victor Mitchell.

[00:12] Team_021 possession (Score: 46-45)
Vince George attempts a Midrange. Contested by Anfernee Wagner (3.6 feet, ZONE). Vince George misses. Rebound secured by Zach DeRozan.

================================================================================
                              2ND QUARTER COMPLETE                              
================================================================================

2ND QUARTER SCORE: Team_021 19, Team_067 24

BOX SCORE:
================================================================================

Team_021
--------------------------------------------------------------------------------
Player                MIN  PTS  REB  AST  TO      FG   FG%      3P   3P%
--------------------------------------------------------------------------------
Paul Allen              9    5    0    0   0   2/3    66.7     0/0   0.0
Kyrie Wagner           15    3    0    0   0   1/2    50.0     0/0   0.0
Zach Carter            15    3    1    0   0   1/1   100.0     0/0   0.0
Joel LaVine             9    3    0    1   0   1/3    33.3     0/0   0.0
Vince George            9    2    2    0   0   1/5    20.0     0/0   0.0
Kyrie Leonard          15    0    0    0   0   0/1     0.0     0/0   0.0
Anthony Oladipo        15    0    3    1   0   0/0     0.0     0/0   0.0
Karl Bridges           15    0    0    0   0   0/2     0.0     0/0   0.0
Victor Mitchell         9    0    2    1   0   0/0     0.0     0/0   0.0
Magic Ingram            9    0    3    0   0   0/1     0.0     0/0   0.0

TEAM: FG: 6/18 (33.3%), 3PT: 2/4 (50.0%), REB: 10 (2 off, 8 def), AST: 3, TO: 5
TEAM FOULS: 4


Team_067
--------------------------------------------------------------------------------
Player                MIN  PTS  REB  AST  TO      FG   FG%      3P   3P%
--------------------------------------------------------------------------------
Kristaps Davis          9    7    2    1   0   3/4    75.0     0/0   0.0
Desmond Simmons        15    5    1    1   0   2/3    66.7     0/0   0.0
Manu Reaves            15    5    1    0   0   2/2   100.0     0/0   0.0
James Rozier            9    5    0    2   0   2/2   100.0     0/0   0.0
Anfernee Wagner         9    2    3    0   0   1/2    50.0     0/0   0.0
Wendell Antetokounmpo   15    0    0    1   0   0/0     0.0     0/0   0.0
Malcolm Westbrook      15    0    3    1   0   0/2     0.0     0/0   0.0
Ben Ball               15    0    0    0   0   0/1     0.0     0/0   0.0
Zach DeRozan            9    0    4    0   0   0/1     0.0     0/0   0.0
Kyle Leonard            9    0    0    0   0   0/2     0.0     0/0   0.0

TEAM: FG: 10/19 (52.6%), 3PT: 3/8 (37.5%), REB: 15 (3 off, 12 def), AST: 6, TO: 3
TEAM FOULS: 4

================================================================================

================================================================================
                       3RD QUARTER - Team_021 vs Team_067                       
================================================================================

[12:00] Team_021 possession (Score: 46-45)
FOUL! Offensive foul on Kyrie Leonard! Manu Reaves drew the charge! [Team fouls: 1] (Kyrie Leonard: 1 personal fouls) TURNOVER! (dead ball)

[11:49] Team_067 possession (Score: 46-45)
Desmond Simmons drives and kicks out. FOUL! Shooting foul on Anthony Oladipo. Wendell Antetokounmpo to the line for 2 free throws. [Team fouls: 2] (Anthony Oladipo: 1 personal fouls)   FT 1/2: GOOD   FT 2/2: MISS Wendell Antetokounmpo makes 1/2 from the line. Offensive rebound by Desmond Simmons! Desmond Simmons kicks it out.
Score: 46-46

[11:33] Team_067 possession (Score: 46-46)
Wendell Antetokounmpo attempts a 3Pt. Contested by Karl Bridges (5.9 feet, ZONE). Wendell Antetokounmpo misses. Rebound secured by Zach Carter.

[11:22] Team_021 possession (Score: 46-46)
Kyrie Leonard attempts a 3Pt. Contested by Manu Reaves (3.7 feet, MAN). Kyrie Leonard misses. Offensive rebound by Zach Carter! Zach Carter kicks it out.

[11:10] Team_021 possession (Score: 46-46)
Kyrie Wagner attempts a Layup. Contested by Ben Ball (3.9 feet, MAN). KYRIE WAGNER MAKES IT! Assist: Zach Carter
Score: 48-46

[11:00] Team_067 possession (Score: 48-46)
Wendell Antetokounmpo drives, picks up Anthony Oladipo. Help arrives from Kyrie Leonard! Wendell Antetokounmpo attempts a Layup. Contested by Kyrie Leonard (5.0 feet, MAN). WENDELL ANTETOKOUNMPO MAKES IT!
Score: 48-48

[10:45] Team_021 possession (Score: 48-48)
FOUL! Reach-in foul on Malcolm Westbrook during the drive. [Team fouls: 1] No free throws, side out. (Malcolm Westbrook: 1 personal fouls)

[10:33] Team_021 possession (Score: 48-48)
Kyrie Leonard drives, Malcolm Westbrook stays with him. Kyrie Leonard attempts a Layup. Contested by Malcolm Westbrook (3.8 feet, ZONE). Kyrie Leonard misses. Rebound secured by Malcolm Westbrook.

[10:15] Team_067 possession (Score: 48-48)
Ben Ball drives, Zach Carter stays with him. Ben Ball attempts a Layup. Contested by Zach Carter (4.9 feet, ZONE). BEN BALL MAKES IT! Assist: Manu Reaves
Score: 48-50

[10:00] Team_021 possession (Score: 48-50)
Anthony Oladipo attempts a 3Pt. Contested by Wendell Antetokounmpo (4.4 feet, ZONE). Anthony Oladipo misses. Rebound secured by Desmond Simmons.

[09:44] Team_067 possession (Score: 48-50)
Ben Ball attempts a Layup. BLOCKED BY ZACH CARTER! Ball deflects out of bounds off Ben Ball.

[09:30] Team_021 possession (Score: 48-50)
Kyrie Leonard makes the Layup and draws the foul on Manu Reaves! And-1! Kyrie Leonard to the line for 1. [Team fouls: 2] (Manu Reaves: 1 personal fouls)   FT 1/1: GOOD Kyrie Leonard makes 1/1 from the line.
Score: 51-50

[09:15] Team_067 possession (Score: 51-50)
Desmond Simmons makes the Layup and draws the foul on Karl Bridges! And-1! Desmond Simmons to the line for 1. [Team fouls: 3] (Karl Bridges: 1 personal fouls)   FT 1/1: GOOD Desmond Simmons makes 1/1 from the line.
Score: 51-53

[09:02] Team_021 possession (Score: 51-53)
Zach Carter attempts a Midrange. Contested by Wendell Antetokounmpo (4.8 feet, ZONE). Zach Carter misses. Offensive rebound by Kyrie Leonard! Kyrie Leonard kicks it out.

[08:46] Team_021 possession (Score: 51-53)
FOUL! Shooting foul on Desmond Simmons. Kyrie Leonard to the line for 3 free throws. [Team fouls: 3] (Desmond Simmons: 1 personal fouls)   FT 1/3: GOOD   FT 2/3: GOOD   FT 3/3: MISS Kyrie Leonard makes 2/3 from the line. Rebound secured by Malcolm Westbrook.
Score: 53-53

[08:32] Team_067 possession (Score: 53-53)
Ben Ball drives and kicks out. Wendell Antetokounmpo attempts a 3Pt. Contested by Kyrie Wagner (4.0 feet, ZONE). WENDELL ANTETOKOUNMPO MAKES IT! Assist: Malcolm Westbrook
Score: 53-56

[08:15] Team_021 possession (Score: 53-56)
Karl Bridges attempts a 3Pt. Contested by Desmond Simmons (3.7 feet, MAN). Karl Bridges misses. Rebound secured by Wendell Antetokounmpo.

[08:03] Team_067 possession (Score: 53-56)
FOUL! Reach-in foul on Kyrie Wagner during the drive. [Team fouls: 4] No free throws, side out. (Kyrie Wagner: 1 personal fouls)

[07:50] Team_067 possession (Score: 53-56)
Ben Ball attempts a Layup. Contested by Kyrie Wagner (4.9 feet, MAN). BEN BALL MAKES IT! Assist: Malcolm Westbrook
Score: 53-58

[07:34] Team_021 possession (Score: 53-58)
Kyrie Wagner attempts a Layup. Contested by Ben Ball (3.9 feet, MAN). Kyrie Wagner misses. Offensive rebound by Kyrie Leonard! Kyrie Leonard kicks it out.

[07:20] Team_021 possession (Score: 53-58)
Zach Carter drives to the basket... FOUL! Offensive foul on Zach Carter! Malcolm Westbrook drew the charge! [Team fouls: 5] (Zach Carter: 1 personal fouls) TURNOVER! (dead ball)

[07:08] Team_067 possession (Score: 53-58)
Desmond Simmons attempts a 3Pt. Contested by Kyrie Wagner (4.2 feet, ZONE). Desmond Simmons misses. Rebound secured by Zach Carter.

[06:54] Team_021 possession (Score: 53-58)
Zach Carter drives, Malcolm Westbrook stays with him. Zach Carter attempts a Layup. Contested by Malcolm Westbrook (4.4 feet, MAN). Zach Carter misses. Rebound secured by Malcolm Westbrook.

[06:40] Team_067 possession (Score: 53-58)
Ben Ball drives to the basket... Ben Ball throws a bad pass out of bounds! TURNOVER! (dead ball)

[06:20] Team_021 possession (Score: 53-58)
Kyrie Wagner attempts a Midrange. Contested by Ben Ball (3.9 feet, MAN). KYRIE WAGNER MAKES IT!
Score: 55-58

[06:07] Team_067 possession (Score: 55-58)
Ben Ball makes the Midrange and draws the foul on Kyrie Leonard! And-1! Ben Ball to the line for 1. [BONUS: 6 team fouls] (Kyrie Leonard: 2 personal fouls)   FT 1/1: MISS Ben Ball makes 0/1 from the line. Rebound secured by Anthony Oladipo.
Score: 55-60

[05:53] Team_021 possession (Score: 55-60)
FOUL! Reach-in foul on Malcolm Westbrook during the drive. [Team fouls: 4] No free throws, side out. (Malcolm Westbrook: 2 personal fouls)

[05:41] Team_021 possession (Score: 55-60)
Karl Bridges makes the Midrange and draws the foul on Desmond Simmons! And-1! Karl Bridges to the line for 1. [BONUS: 5 team fouls] (Desmond Simmons: 2 personal fouls)   FT 1/1: MISS Karl Bridges makes 0/1 from the line. Rebound secured by Wendell Antetokounmpo.
Score: 57-60

[05:27] Team_067 possession (Score: 57-60)
Malcolm Westbrook attempts a Layup. Contested by Zach Carter (4.4 feet, ZONE). MALCOLM WESTBROOK MAKES IT!
Score: 57-62

[05:14] Team_021 possession (Score: 57-62)
Zach Carter attempts a Layup. Contested by Malcolm Westbrook (4.4 feet, ZONE). ZACH CARTER MAKES IT! Assist: Kyrie Leonard
Score: 59-62

[05:03] Team_067 possession (Score: 59-62)
FOUL! Reach-in foul on Zach Carter during the drive. [IN THE BONUS! 7 team fouls] Ben Ball to the line for 2 free throws. (Zach Carter: 2 personal fouls)   FT 1/2: GOOD   FT 2/2: MISS Ben Ball makes 1/2 from the line. Rebound secured by Kyrie Leonard.
Score: 59-63

[04:52] Team_021 possession (Score: 59-63)
Zach Carter attempts a Midrange. Contested by Wendell Antetokounmpo (4.9 feet, ZONE). Zach Carter misses. Offensive rebound by Zach Carter! Zach Carter kicks it out.

[04:37] Team_021 possession (Score: 59-63)
Karl Bridges attempts a 3Pt. Contested by Manu Reaves (3.9 feet, ZONE). KARL BRIDGES MAKES IT! Assist: Zach Carter
Score: 62-63

[04:19] Team_067 possession (Score: 62-63)
FOUL! Shooting foul on Anthony Oladipo. Manu Reaves to the line for 2 free throws. [BONUS: 8 team fouls] (Anthony Oladipo: 2 personal fouls)   FT 1/2: GOOD   FT 2/2: GOOD Manu Reaves makes 2/2 from the line.
Score: 62-65

[04:05] Team_021 possession (Score: 62-65)
Kyrie Wagner attempts a 3Pt. Contested by Desmond Simmons (3.9 feet, ZONE). Kyrie Wagner misses. Offensive rebound by Kyrie Leonard! Kyrie Leonard kicks it out.

[03:49] Team_021 possession (Score: 62-65)
Zach Carter drives to the basket... Zach Carter loses control! Ball rolls out of bounds! TURNOVER! (dead ball)

[03:34] Team_067 possession (Score: 62-65)
Malcolm Westbrook attempts a Layup. Contested by Zach Carter (4.5 feet, MAN). Malcolm Westbrook misses. Offensive rebound by Malcolm Westbrook! Malcolm Westbrook puts it back in!
Score: 62-67

[03:15] Team_021 possession (Score: 62-67)
Kyrie Leonard attempts a 3Pt. Contested by Desmond Simmons (3.8 feet, ZONE). Kyrie Leonard misses. Rebound secured by Manu Reaves.

[03:00] Team_067 possession (Score: 62-67)
Wendell Antetokounmpo attempts a Layup. Contested by Zach Carter (4.5 feet, ZONE). WENDELL ANTETOKOUNMPO MAKES IT! Assist: Manu Reaves
Score: 62-69

[02:48] Team_021 possession (Score: 62-69)
Anthony Oladipo attempts a 3Pt. Contested by Desmond Simmons (3.9 feet, ZONE). Anthony Oladipo misses. Rebound secured by Desmond Simmons.

[02:34] Team_067 possession (Score: 62-69)
FOUL! Reach-in foul on Zach Carter during the drive. [IN THE BONUS! 9 team fouls] Manu Reaves to the line for 2 free throws. (Zach Carter: 3 personal fouls)   FT 1/2: MISS   FT 2/2: GOOD Manu Reaves makes 1/2 from the line.
Score: 62-70

[02:24] Team_021 possession (Score: 62-70)
Zach Carter attempts a Midrange. Contested by Malcolm Westbrook (4.7 feet, MAN). Zach Carter misses. FOUL! Loose ball foul on Malcolm Westbrook during the rebound battle. [IN THE BONUS! 6 team fouls] Kyrie Leonard to the line for 2 free throws. (Malcolm Westbrook: 3 personal fouls)   FT 1/2: MISS   FT 2/2: GOOD Kyrie Leonard makes 1/2 from the line.
Score: 63-70

[02:09] Team_067 possession (Score: 63-70)
Ben Ball drives, picks up Kyrie Wagner. Help arrives from Kyrie Leonard! Ben Ball attempts a Layup. Contested by Kyrie Leonard (5.1 feet, MAN). BEN BALL MAKES IT! Assist: Malcolm Westbrook
Score: 63-72

[01:54] Team_021 possession (Score: 63-72)
Karl Bridges attempts a Midrange. Contested by Wendell Antetokounmpo (4.8 feet, ZONE). Karl Bridges misses. Rebound secured by Malcolm Westbrook.

[01:38] Team_067 possession (Score: 63-72)
Manu Reaves attempts a Midrange. Contested by Anthony Oladipo (5.3 feet, ZONE). Manu Reaves misses. Rebound secured by Zach Carter.

[01:23] Team_021 possession (Score: 63-72)
FOUL! Shooting foul on Malcolm Westbrook. Kyrie Leonard to the line for 2 free throws. [BONUS: 7 team fouls] (Malcolm Westbrook: 4 personal fouls)   FT 1/2: GOOD   FT 2/2: MISS Kyrie Leonard makes 1/2 from the line. Rebound secured by Desmond Simmons.
Score: 64-72

[01:06] Team_067 possession (Score: 64-72)
Wendell Antetokounmpo attempts a Midrange. Contested by Anthony Oladipo (5.3 feet, MAN). WENDELL ANTETOKOUNMPO MAKES IT!
Score: 64-74

[00:52] Team_021 possession (Score: 64-74)
Kyrie Wagner drives to the basket... FOUL! Offensive foul on Kyrie Wagner! Ben Ball drew the charge! [Team fouls: 10] (Kyrie Wagner: 2 personal fouls) TURNOVER! (dead ball)

[00:38] Team_067 possession (Score: 64-74)
Manu Reaves throws a bad pass out of bounds! TURNOVER! (dead ball)

[00:38] Substitution (Team_021): Kyrie Leonard OUT → Joel LaVine IN (stamina_rule2)

[00:38] Substitution (Team_021): Anthony Oladipo OUT → Victor Mitchell IN (stamina_rule2)

[00:38] Substitution (Team_021): Karl Bridges OUT → Paul Allen IN (stamina_rule2)

[00:38] Substitution (Team_021): Kyrie Wagner OUT → Vince George IN (stamina_rule2)

[00:38] Substitution (Team_021): Zach Carter OUT → Magic Ingram IN (stamina_rule2)

[00:38] Substitution (Team_067): Manu Reaves OUT → James Rozier IN (stamina_rule2)

[00:38] Substitution (Team_067): Wendell Antetokounmpo OUT → Anfernee Wagner IN (stamina_rule2)

[00:38] Substitution (Team_067): Desmond Simmons OUT → Kyle Leonard IN (stamina_rule2)

[00:38] Substitution (Team_067): Ben Ball OUT → Kristaps Davis IN (stamina_rule2)

[00:38] Substitution (Team_067): Malcolm Westbrook OUT → Zach DeRozan IN (stamina_rule2)

[00:25] Team_021 possession (Score: 64-74)
FOUL! Holding foul on Zach DeRozan. [IN THE BONUS! 8 team fouls] Magic Ingram to the line for 2 free throws. (Zach DeRozan: 1 personal fouls)   FT 1/2: GOOD   FT 2/2: GOOD Magic Ingram makes 2/2 from the line.
Score: 66-74

[00:08] Team_067 possession (Score: 66-74)
Anfernee Wagner attempts a 3Pt. Contested by Victor Mitchell (4.0 feet, MAN). Anfernee Wagner misses. Rebound secured by Magic Ingram.

================================================================================
                              3RD QUARTER COMPLETE                              
================================================================================

3RD QUARTER SCORE: Team_021 20, Team_067 29

BOX SCORE:
================================================================================

Team_021
--------------------------------------------------------------------------------
Player                MIN  PTS  REB  AST  TO      FG   FG%      3P   3P%
--------------------------------------------------------------------------------
Kyrie Wagner           27    4    0    0   0   2/2   100.0     0/0   0.0
Kyrie Leonard          27    4    4    1   0   2/6    33.3     0/0   0.0
Karl Bridges           27    3    0    0   0   1/4    25.0     0/0   0.0
Zach Carter            27    2    5    2   0   1/2    50.0     0/0   0.0
Magic Ingram            9    2    1    0   0   1/1   100.0     0/0   0.0
Anthony Oladipo        27    0    1    0   0   0/2     0.0     0/0   0.0

TEAM: FG: 7/17 (41.2%), 3PT: 1/6 (16.7%), REB: 11 (5 off, 6 def), AST: 3, TO: 4
TEAM FOULS: 10 [Team_067 in BONUS]


Team_067
--------------------------------------------------------------------------------
Player                MIN  PTS  REB  AST  TO      FG   FG%      3P   3P%
--------------------------------------------------------------------------------
Wendell Antetokounmpo   27    9    2    0   0   4/5    80.0     0/0   0.0
Ben Ball               27    6    0    0   0   3/6    50.0     0/0   0.0
Malcolm Westbrook      27    4    5    3   0   2/2   100.0     0/0   0.0
Desmond Simmons        27    3    4    0   0   1/2    50.0     0/0   0.0
Manu Reaves            27    3    1    2   0   2/3    66.7     0/0   0.0
Anfernee Wagner         9    0    0    0   0   0/1     0.0     0/0   0.0

TEAM: FG: 12/19 (63.2%), 3PT: 0/3 (0.0%), REB: 12 (2 off, 10 def), AST: 5, TO: 2
TEAM FOULS: 8 [Team_021 in BONUS]

================================================================================

================================================================================
                       4TH QUARTER - Team_021 vs Team_067                       
================================================================================

[12:00] Team_021 possession (Score: 66-74)
Kyrie Wagner drives and kicks out. Zach Carter attempts a 3Pt. Contested by Malcolm Westbrook (4.3 feet, MAN). Zach Carter misses. Rebound secured by Manu Reaves.

[11:46] Team_067 possession (Score: 66-74)
Manu Reaves drives, Zach Carter stays with him. Manu Reaves attempts a Dunk. Contested by Zach Carter (4.6 feet, ZONE). MANU REAVES MAKES IT!
Score: 66-76

[11:29] Team_021 possession (Score: 66-76)
Kyrie Wagner drives, Ben Ball stays with him. Kyrie Wagner attempts a Dunk. Contested by Ben Ball (4.2 feet, MAN). KYRIE WAGNER MAKES IT! Assist: Kyrie Leonard
Score: 68-76

[11:13] Team_067 possession (Score: 68-76)
Wendell Antetokounmpo attempts a 3Pt. Contested by Anthony Oladipo (5.2 feet, MAN). Wendell Antetokounmpo misses. Rebound secured by Anthony Oladipo.

[11:00] Team_021 possession (Score: 68-76)
Kyrie Leonard makes the Midrange and draws the foul on Ben Ball! And-1! Kyrie Leonard to the line for 1. [Team fouls: 1] (Ben Ball: 1 personal fouls)   FT 1/1: GOOD Kyrie Leonard makes 1/1 from the line.
Score: 71-76

[10:45] Team_067 possession (Score: 71-76)
Desmond Simmons drives and kicks out. Malcolm Westbrook attempts a Midrange. Contested by Zach Carter (4.4 feet, ZONE). Malcolm Westbrook misses. Rebound secured by Kyrie Leonard.

[10:32] Team_021 possession (Score: 71-76)
Karl Bridges attempts a 3Pt. Contested by Ben Ball (4.2 feet, ZONE). Karl Bridges misses. Rebound secured by Manu Reaves.

[10:16] Team_067 possession (Score: 71-76)
Manu Reaves attempts a 3Pt. Contested by Kyrie Wagner (4.8 feet, ZONE). Manu Reaves misses. Rebound secured by Zach Carter.

[10:01] Team_021 possession (Score: 71-76)
Anthony Oladipo drives, picks up Malcolm Westbrook. Help arrives from Wendell Antetokounmpo! Anthony Oladipo attempts a Dunk. Contested by Wendell Antetokounmpo (4.4 feet, ZONE). Anthony Oladipo misses. Offensive rebound by Kyrie Leonard! Kyrie Leonard kicks it out.

[09:48] Team_021 possession (Score: 71-76)
Kyrie Leonard drives, picks up Malcolm Westbrook. Help arrives from Wendell Antetokounmpo! Kyrie Leonard attempts a Layup. Contested by Wendell Antetokounmpo (4.4 feet, ZONE). Kyrie Leonard misses. Rebound secured by Malcolm Westbrook.

[09:33] Team_067 possession (Score: 71-76)
Ben Ball attempts a Layup. Contested by Zach Carter (5.3 feet, ZONE). Ben Ball misses. Rebound secured by Anthony Oladipo.

[09:18] Team_021 possession (Score: 71-76)
Kyrie Leonard drives, Manu Reaves stays with him. Kyrie Leonard attempts a Dunk. Contested by Manu Reaves (4.4 feet, MAN). Kyrie Leonard misses. Rebound secured by Manu Reaves.

[09:00] Team_067 possession (Score: 71-76)
Ben Ball drives, Kyrie Wagner stays with him. Ben Ball attempts a Layup. Contested by Kyrie Wagner (5.4 feet, MAN). BEN BALL MAKES IT!
Score: 71-78

[08:43] Team_021 possession (Score: 71-78)
Kyrie Leonard attempts a 3Pt. Contested by Manu Reaves (4.4 feet, MAN). KYRIE LEONARD MAKES IT! Assist: Karl Bridges
Score: 74-78

[08:24] Team_067 possession (Score: 74-78)
Ben Ball attempts a 3Pt. Contested by Kyrie Wagner (5.4 feet, MAN). Ben Ball misses. Rebound secured by Kyrie Leonard.

[08:14] Team_021 possession (Score: 74-78)
Karl Bridges drives to the basket... Karl Bridges throws a bad pass! Stolen by Desmond Simmons! TURNOVER! (live ball)

[08:02] Team_067 possession (Score: 74-78)
Wendell Antetokounmpo attempts a 3Pt. Contested by Anthony Oladipo (5.5 feet, ZONE). WENDELL ANTETOKOUNMPO MAKES IT!
Score: 74-81

[07:51] Team_021 possession (Score: 74-81)
Kyrie Leonard attempts a Midrange. BLOCKED BY MANU REAVES! Ball deflects out of bounds off Kyrie Leonard.

[07:38] Team_067 possession (Score: 74-81)
FOUL! Shooting foul on Anthony Oladipo. Wendell Antetokounmpo to the line for 2 free throws. [Team fouls: 1] (Anthony Oladipo: 1 personal fouls)   FT 1/2: GOOD   FT 2/2: GOOD Wendell Antetokounmpo makes 2/2 from the line.
Score: 74-83

[07:25] Team_021 possession (Score: 74-83)
Kyrie Leonard attempts a Midrange. Contested by Manu Reaves (4.7 feet, MAN). KYRIE LEONARD MAKES IT! Assist: Zach Carter
Score: 76-83

[07:08] Team_067 possession (Score: 76-83)
Manu Reaves attempts a 3Pt. Contested by Kyrie Wagner (5.1 feet, ZONE). Manu Reaves misses. Offensive rebound by Malcolm Westbrook! Malcolm Westbrook kicks it out.

[06:52] Team_067 possession (Score: 76-83)
Manu Reaves makes the Layup and draws the foul on Anthony Oladipo! And-1! Manu Reaves to the line for 1. [Team fouls: 2] (Anthony Oladipo: 2 personal fouls)   FT 1/1: GOOD Manu Reaves makes 1/1 from the line.
Score: 76-86

[06:34] Team_021 possession (Score: 76-86)
FOUL! Reach-in foul on Malcolm Westbrook during the drive. [Team fouls: 2] No free throws, side out. (Malcolm Westbrook: 1 personal fouls)

[06:21] Team_021 possession (Score: 76-86)
Zach Carter drives and kicks out. Anthony Oladipo attempts a 3Pt. Contested by Wendell Antetokounmpo (5.7 feet, MAN). Anthony Oladipo misses. Offensive rebound by Zach Carter! Zach Carter kicks it out.

[06:07] Team_021 possession (Score: 76-86)
Kyrie Wagner attempts a 3Pt. Contested by Ben Ball (4.9 feet, MAN). Kyrie Wagner misses. Rebound secured by Malcolm Westbrook.

[05:49] Team_067 possession (Score: 76-86)
Manu Reaves attempts a 3Pt. Contested by Kyrie Leonard (5.7 feet, MAN). Manu Reaves misses. Offensive rebound by Desmond Simmons! Desmond Simmons kicks it out.

[05:33] Team_067 possession (Score: 76-86)
Wendell Antetokounmpo attempts a Midrange. Contested by Anthony Oladipo (5.7 feet, MAN). WENDELL ANTETOKOUNMPO MAKES IT! Assist: Desmond Simmons
Score: 76-88

[05:17] Team_021 possession (Score: 76-88)
Kyrie Leonard drives to the basket... Kyrie Leonard throws a bad pass! Stolen by Manu Reaves! TURNOVER! (live ball)

[05:04] Team_067 possession (Score: 76-88)
FOUL! Shooting foul on Kyrie Wagner. Ben Ball to the line for 2 free throws. [Team fouls: 3] (Kyrie Wagner: 1 personal fouls)   FT 1/2: MISS   FT 2/2: MISS Ben Ball makes 0/2 from the line. Rebound secured by Anthony Oladipo.

[04:53] Team_021 possession (Score: 76-88)
Anthony Oladipo attempts a 3Pt. Contested by Wendell Antetokounmpo (5.7 feet, MAN). Anthony Oladipo misses. Rebound secured by Malcolm Westbrook.

[04:36] Team_067 possession (Score: 76-88)
Ben Ball attempts a 3Pt. Contested by Kyrie Wagner (5.9 feet, ZONE). Ben Ball misses. Rebound secured by Anthony Oladipo.

[04:23] Team_021 possession (Score: 76-88)
Kyrie Leonard attempts a 3Pt. Contested by Desmond Simmons (4.6 feet, ZONE). Kyrie Leonard misses. Rebound secured by Ben Ball.

[04:13] Team_067 possession (Score: 76-88)
Manu Reaves attempts a Layup. BLOCKED BY ZACH CARTER! Ball is loose! Offensive rebound by Desmond Simmons! Desmond Simmons kicks it out.

[04:04] Team_067 possession (Score: 76-88)
Ben Ball attempts a Layup. Contested by Zach Carter (5.9 feet, ZONE). Ben Ball misses. Rebound secured by Anthony Oladipo.

[03:49] Team_021 possession (Score: 76-88)
Kyrie Leonard drives, Manu Reaves stays with him. Kyrie Leonard attempts a Layup. Contested by Manu Reaves (5.3 feet, MAN). KYRIE LEONARD MAKES IT!
Score: 78-88

[03:32] Team_067 possession (Score: 78-88)
Manu Reaves drives and kicks out. Malcolm Westbrook attempts a Midrange. Wide open! Karl Bridges is 6.8 feet away. [ZONE] Malcolm Westbrook misses. Rebound secured by Zach Carter.

[03:19] Team_021 possession (Score: 78-88)
Karl Bridges drives and kicks out. Zach Carter attempts a 3Pt. Contested by Manu Reaves (5.7 feet, ZONE). Zach Carter misses. Offensive rebound by Zach Carter! Zach Carter kicks it out.

[03:05] Team_021 possession (Score: 78-88)
Karl Bridges attempts a Layup. Contested by Malcolm Westbrook (5.4 feet, ZONE). Karl Bridges misses. Offensive rebound by Kyrie Leonard! Kyrie Leonard kicks it out.

[02:50] Team_021 possession (Score: 78-88)
Zach Carter attempts a Layup. Contested by Malcolm Westbrook (5.8 feet, ZONE). ZACH CARTER MAKES IT!
Score: 80-88

[02:36] Team_067 possession (Score: 80-88)
Ben Ball attempts a Layup. Wide open! Kyrie Wagner is 6.2 feet away. [MAN] BEN BALL MAKES IT!
Score: 80-90

[02:21] Team_021 possession (Score: 80-90)
Anthony Oladipo attempts a 3Pt. Wide open! Wendell Antetokounmpo is 6.2 feet away. [MAN] ANTHONY OLADIPO MAKES IT! Assist: Karl Bridges
Score: 83-90

[02:07] Team_067 possession (Score: 83-90)
Desmond Simmons attempts a Midrange. Wide open! Anthony Oladipo is 6.1 feet away. [ZONE] DESMOND SIMMONS MAKES IT! Assist: Manu Reaves
Score: 83-92

[01:52] Team_021 possession (Score: 83-92)
Anthony Oladipo attempts a Midrange. Wide open! Wendell Antetokounmpo is 6.3 feet away. [MAN] Anthony Oladipo misses. Rebound secured by Ben Ball.

[01:41] Team_067 possession (Score: 83-92)
Ben Ball attempts a Midrange. Wide open! Karl Bridges is 7.4 feet away. [ZONE] BEN BALL MAKES IT!
Score: 83-94

[01:27] Team_021 possession (Score: 83-94)
Karl Bridges drives, Desmond Simmons stays with him. Karl Bridges attempts a Dunk. Contested by Desmond Simmons (5.1 feet, MAN). Karl Bridges misses. Rebound secured by Malcolm Westbrook.

[01:10] Team_067 possession (Score: 83-94)
Wendell Antetokounmpo attempts a Midrange. Wide open! Anthony Oladipo is 6.3 feet away. [MAN] Wendell Antetokounmpo misses. Rebound secured by Zach Carter.

[00:54] Team_021 possession (Score: 83-94)
Anthony Oladipo commits a violation (traveling/carry)! TURNOVER! (dead ball)

[00:54] Substitution (Team_021): Kyrie Leonard OUT → Joel LaVine IN (stamina_rule2)

[00:54] Substitution (Team_021): Anthony Oladipo OUT → Victor Mitchell IN (stamina_rule2)

[00:54] Substitution (Team_021): Karl Bridges OUT → Paul Allen IN (stamina_rule2)

[00:54] Substitution (Team_021): Kyrie Wagner OUT → Vince George IN (stamina_rule2)

[00:54] Substitution (Team_021): Zach Carter OUT → Magic Ingram IN (stamina_rule2)

[00:54] Substitution (Team_067): Manu Reaves OUT → James Rozier IN (stamina_rule2)

[00:54] Substitution (Team_067): Wendell Antetokounmpo OUT → Anfernee Wagner IN (stamina_rule2)

[00:54] Substitution (Team_067): Desmond Simmons OUT → Kyle Leonard IN (stamina_rule2)

[00:54] Substitution (Team_067): Ben Ball OUT → Kristaps Davis IN (stamina_rule2)

[00:54] Substitution (Team_067): Malcolm Westbrook OUT → Zach DeRozan IN (stamina_rule2)

[00:38] Team_067 possession (Score: 83-94)
Zach DeRozan attempts a Layup. Contested by Magic Ingram (5.0 feet, ZONE). ZACH DEROZAN MAKES IT! Assist: Kristaps Davis
Score: 83-96

[00:19] Team_021 possession (Score: 83-96)
Joel LaVine drives to the basket... Joel LaVine loses control! Ball rolls out of bounds! TURNOVER! (dead ball)

[00:03] Team_067 possession (Score: 83-96)
Kyle Leonard drives, picks up Paul Allen. Help arrives from Victor Mitchell! Kyle Leonard attempts a Layup. Wide open! Victor Mitchell is 6.3 feet away. [MAN] Kyle Leonard misses. Rebound secured by Magic Ingram.

================================================================================
                              4TH QUARTER COMPLETE                              
================================================================================

4TH QUARTER SCORE: Team_021 17, Team_067 22

BOX SCORE:
================================================================================

Team_021
--------------------------------------------------------------------------------
Player                MIN  PTS  REB  AST  TO      FG   FG%      3P   3P%
--------------------------------------------------------------------------------
Kyrie Leonard          38   10    4    1   0   4/8    50.0     0/0   0.0
Anthony Oladipo        38    3    5    0   0   1/3    33.3     0/0   0.0
Kyrie Wagner           38    2    0    0   0   1/3    33.3     0/0   0.0
Zach Carter            38    2    5    1   0   1/1   100.0     0/0   0.0
Karl Bridges           38    0    0    2   0   0/2     0.0     0/0   0.0
Magic Ingram           10    0    1    0   0   0/0     0.0     0/0   0.0

TEAM: FG: 7/17 (41.2%), 3PT: 2/6 (33.3%), REB: 15 (4 off, 11 def), AST: 4, TO: 4
TEAM FOULS: 3


Team_067
--------------------------------------------------------------------------------
Player                MIN  PTS  REB  AST  TO      FG   FG%      3P   3P%
--------------------------------------------------------------------------------
Wendell Antetokounmpo   38    7    0    0   0   3/5    60.0     0/0   0.0
Ben Ball               38    6    2    0   0   3/8    37.5     0/0   0.0
Manu Reaves            38    5    3    1   0   2/4    50.0     0/0   0.0
Desmond Simmons        38    2    2    1   0   1/2    50.0     0/0   0.0
Zach DeRozan           10    2    0    0   0   1/1   100.0     0/0   0.0
Malcolm Westbrook      38    0    5    0   0   0/0     0.0     0/0   0.0
Kristaps Davis         10    0    0    1   0   0/0     0.0     0/0   0.0
Kyle Leonard           10    0    0    0   0   0/1     0.0     0/0   0.0

TEAM: FG: 10/21 (47.6%), 3PT: 1/5 (20.0%), REB: 12 (3 off, 9 def), AST: 3, TO: 0
TEAM FOULS: 2

================================================================================

================================================================================
                               FULL GAME COMPLETE                               
================================================================================

FINAL SCORE: Team_021 83, Team_067 96

SCORING BY QUARTER:
--------------------------------------------------------------------------------
Team                     Q1     Q2     Q3     Q4    FINAL
--------------------------------------------------------------------------------
Team_021                 27     19     20     17       83
Team_067                 21     24     29     22       96
--------------------------------------------------------------------------------

FULL GAME BOX SCORE:
================================================================================

Team_021
--------------------------------------------------------------------------------
Player                MIN  PTS  REB  AST  TO      FG   FG%      3P   3P%      FT STL BLK
--------------------------------------------------------------------------------
Kyrie Leonard          38   26   12    3   3  10/20   50.0   1/4    25.0  12/15    0   0
Anthony Oladipo        38    5   10    3   2   2/9    22.2   1/6    16.7   0/0     0   0
Karl Bridges           38   10    0    3   2   4/14   28.6   2/8    25.0   0/1     0   0
Kyrie Wagner           38   11    0    3   1   5/8    62.5   1/2    50.0   0/0     0   0
Zach Carter            38    9   13    4   3   5/7    71.4   0/0     0.0   1/1     2   2
Joel LaVine            10    3    0    1   0   1/3    33.3   0/0     0.0   2/3     0   0
Victor Mitchell        10    0    3    1   0   0/0     0.0   0/0     0.0   0/0     0   0
Paul Allen             10    5    0    0   2   3/4    75.0   1/2    50.0   0/0     0   0
Vince George           10    2    3    0   2   0/5     0.0   0/0     0.0   0/1     1   0
Magic Ingram           10    4    6    0   0   1/2    50.0   1/1   100.0   4/5     0   0

TEAM: FG: 33/74 (44.6%), 3PT: 7/23 (30.4%), REB: 44 (11 off, 33 def), AST: 18, TO: 15


Team_067
--------------------------------------------------------------------------------
Player                MIN  PTS  REB  AST  TO      FG   FG%      3P   3P%      FT STL BLK
--------------------------------------------------------------------------------
Manu Reaves            38   17    5    4   1   8/11   72.7   1/2    50.0   4/5     1   1
Wendell Antetokounmpo   38   16    4    5   2   6/11   54.5   1/5    20.0   3/4     0   0
Desmond Simmons        38   19   11    2   0   7/12   58.3   1/4    25.0   4/5     1   0
Ben Ball               38   14    2    0   4   9/18   50.0   0/3     0.0   3/7     0   0
Malcolm Westbrook      38    6   16    4   1   3/8    37.5   0/2     0.0   1/2     2   0
James Rozier           10    5    0    2   1   2/3    66.7   0/1     0.0   1/1     0   0
Anfernee Wagner        10    2    4    0   1   2/5    40.0   1/2    50.0   0/0     0   0
Kyle Leonard           10    0    0    0   0   1/5    20.0   0/2     0.0   0/0     0   0
Kristaps Davis         10    9    3    2   0   2/3    66.7   1/1   100.0   0/0     2   0
Zach DeRozan           10    2    4    0   0   1/2    50.0   0/0     0.0   0/0     0   0

TEAM: FG: 41/78 (52.6%), 3PT: 5/22 (22.7%), REB: 52 (12 off, 40 def), AST: 19, TO: 10

================================================================================
