================================================================================
                        FULL GAME - Team_064 vs Team_017                        
================================================================================

================================================================================
                       1ST QUARTER - Team_064 vs Team_017                       
================================================================================

[12:00] Team_064 possession (Score: 0-0)
Ja Mitchell attempts a 3Pt. Contested by Desmond Reaves (4.3 feet, ZONE). JA MITCHELL MAKES IT! Assist: Shai Hyland
Score: 3-0

[11:40] Team_017 possession (Score: 3-0)
Tony Smith drives and kicks out. Tony Smith attempts a Midrange. Contested by Kawhi Irving (4.3 feet, MAN). TONY SMITH MAKES IT!
Score: 3-2

[11:28] Team_064 possession (Score: 3-2)
FOUL! Holding foul on Kyrie Middleton. [Team fouls: 1] No free throws, side out. (Kyrie Middleton: 1 personal fouls)

[11:13] Team_064 possession (Score: 3-2)
Russell Simons throws a bad pass out of bounds! TURNOVER! (dead ball)

[10:57] Team_017 possession (Score: 3-2)
Tony Smith attempts a 3Pt. Contested by Ja Mitchell (5.7 feet, ZONE). Tony Smith misses. Rebound secured by Russell Simons.

[10:40] Team_064 possession (Score: 3-2)
Ja Mitchell drives and kicks out. Shai Hyland attempts a 3Pt. Contested by Bam Williamson (4.0 feet, MAN). Shai Hyland misses. Rebound secured by Kyrie Middleton.

[10:28] Team_017 possession (Score: 3-2)
Kyrie Middleton attempts a Midrange. Contested by Kawhi Irving (4.6 feet, ZONE). KYRIE MIDDLETON MAKES IT!
Score: 3-4

[10:13] Team_064 possession (Score: 3-4)
Shai Hyland attempts a 3Pt. Contested by Desmond Reaves (4.4 feet, ZONE). Shai Hyland misses. FOUL! Loose ball foul on Bam Williamson during the rebound battle. [Team fouls: 2] No free throws, side out. (Bam Williamson: 1 personal fouls)

[09:55] Team_064 possession (Score: 3-4)
FOUL! Reach-in foul on Bam Williamson during the drive. [Team fouls: 3] No free throws, side out. (Bam Williamson: 2 personal fouls)

[09:36] Team_064 possession (Score: 3-4)
Kawhi Irving loses the ball! Stripped by Tony Smith! TURNOVER! (live ball)

[09:25] Team_017 possession (Score: 3-4)
Tony Smith attempts a 3Pt. Contested by Kawhi Irving (4.9 feet, MAN). TONY SMITH MAKES IT! Assist: Kyrie Middleton
Score: 3-7

[09:10] Team_064 possession (Score: 3-7)
Ja Mitchell drives to the basket... Ja Mitchell throws a bad pass out of bounds! TURNOVER! (dead ball)

[08:52] Team_017 possession (Score: 3-7)
Tony Smith attempts a 3Pt. Contested by Kawhi Irving (4.9 feet, MAN). Tony Smith misses. Offensive rebound by Bam Williamson! Bam Williamson's putback is no good. Offensive rebound by Bam Williamson! Bam Williamson kicks it out.

[08:38] Team_017 possession (Score: 3-7)
Desmond Reaves attempts a Layup. BLOCKED BY RUSSELL SIMONS! Ball deflects out of bounds off Desmond Reaves.

[08:27] Team_064 possession (Score: 3-7)
Shai Hyland attempts a Midrange. Contested by Bam Williamson (4.4 feet, MAN). SHAI HYLAND MAKES IT!
Score: 5-7

[08:11] Team_017 possession (Score: 5-7)
Kyrie Middleton attempts a Layup. Contested by Russell Simons (3.6 feet, MAN). KYRIE MIDDLETON MAKES IT! Assist: Bam Williamson
Score: 5-9

[07:54] Team_064 possession (Score: 5-9)
Jordan Mitchell drives, Vince Banchero stays with him. Jordan Mitchell attempts a Layup. Contested by Vince Banchero (3.6 feet, MAN). Jordan Mitchell misses. Rebound secured by Bam Williamson.

[07:42] Team_017 possession (Score: 5-9)
FOUL! Shooting foul on Jordan Mitchell. Kyrie Middleton to the line for 2 free throws. [Team fouls: 2] (Jordan Mitchell: 1 personal fouls)   FT 1/2: MISS   FT 2/2: MISS Kyrie Middleton makes 0/2 from the line. Rebound secured by Russell Simons.

[07:29] Team_064 possession (Score: 5-9)
Shai Hyland drives, picks up Bam Williamson. Help arrives from Vince Banchero! Shai Hyland attempts a Layup. Contested by Vince Banchero (4.4 feet, MAN). Shai Hyland misses. Rebound secured by Bam Williamson.

[07:13] Team_017 possession (Score: 5-9)
Desmond Reaves attempts a Midrange. Contested by Ja Mitchell (5.6 feet, MAN). DESMOND REAVES MAKES IT!
Score: 5-11

[07:00] Team_064 possession (Score: 5-11)
Kawhi Irving drives and kicks out. Ja Mitchell attempts a 3Pt. Contested by Desmond Reaves (4.0 feet, MAN). JA MITCHELL MAKES IT! Assist: Shai Hyland
Score: 8-11

[06:45] Team_017 possession (Score: 8-11)
FOUL! Reach-in foul on Russell Simons during the drive. [Team fouls: 3] No free throws, side out. (Russell Simons: 1 personal fouls)

[06:34] Team_017 possession (Score: 8-11)
Desmond Reaves drives, picks up Ja Mitchell. Help arrives from Jordan Mitchell! Desmond Reaves attempts a Layup. Contested by Jordan Mitchell (5.6 feet, MAN). Desmond Reaves misses. Offensive rebound by Kyrie Middleton! Kyrie Middleton kicks it out.

[06:19] Team_017 possession (Score: 8-11)
Tony Smith attempts a 3Pt. Contested by Ja Mitchell (5.7 feet, ZONE). Tony Smith misses. Offensive rebound by Kyrie Middleton! Kyrie Middleton kicks it out.

[06:02] Team_017 possession (Score: 8-11)
Kyrie Middleton drives and kicks out. Desmond Reaves attempts a Midrange. Contested by Jordan Mitchell (3.8 feet, ZONE). Desmond Reaves misses. Rebound secured by Russell Simons.

[05:48] Team_064 possession (Score: 8-11)
Jordan Mitchell attempts a 3Pt. Contested by Desmond Reaves (3.6 feet, ZONE). Jordan Mitchell misses. Rebound secured by Tony Smith.

[05:33] Team_017 possession (Score: 8-11)
Vince Banchero attempts a Midrange. BLOCKED BY JORDAN MITCHELL! Ball deflects out of bounds off Vince Banchero.

[05:21] Team_064 possession (Score: 8-11)
Jordan Mitchell attempts a 3Pt. Contested by Vince Banchero (3.6 feet, MAN). Jordan Mitchell misses. Rebound secured by Kyrie Middleton.

[05:04] Team_017 possession (Score: 8-11)
Vince Banchero attempts a 3Pt. Contested by Jordan Mitchell (3.8 feet, MAN). Vince Banchero misses. Rebound secured by Russell Simons.

[04:52] Team_064 possession (Score: 8-11)
Ja Mitchell attempts a 3Pt. Contested by Tony Smith (3.0 feet, ZONE). Ja Mitchell misses. Rebound secured by Kyrie Middleton.

[04:42] Team_017 possession (Score: 8-11)
Bam Williamson attempts a 3Pt. Contested by Shai Hyland (5.8 feet, MAN). Bam Williamson misses. Rebound secured by Russell Simons.

[04:27] Team_064 possession (Score: 8-11)
FOUL! Shooting foul on Vince Banchero. Jordan Mitchell to the line for 2 free throws. [Team fouls: 4] (Vince Banchero: 1 personal fouls)   FT 1/2: GOOD   FT 2/2: GOOD Jordan Mitchell makes 2/2 from the line.
Score: 10-11

[04:13] Team_017 possession (Score: 10-11)
Kyrie Middleton drives and kicks out. Tony Smith attempts a Midrange. Contested by Kawhi Irving (4.4 feet, MAN). Tony Smith misses. Rebound secured by Kawhi Irving.

[03:58] Team_064 possession (Score: 10-11)
Shai Hyland attempts a Midrange. Contested by Bam Williamson (4.5 feet, MAN). Shai Hyland misses. Offensive rebound by Kawhi Irving! Kawhi Irving kicks it out.

[03:44] Team_064 possession (Score: 10-11)
FOUL! Shooting foul on Tony Smith. Kawhi Irving to the line for 2 free throws. [BONUS: 5 team fouls] (Tony Smith: 1 personal fouls)   FT 1/2: MISS   FT 2/2: GOOD Kawhi Irving makes 1/2 from the line.
Score: 11-11

[03:28] Team_017 possession (Score: 11-11)
Bam Williamson drives, Russell Simons stays with him. Bam Williamson attempts a Layup. Contested by Russell Simons (4.2 feet, ZONE). BAM WILLIAMSON MAKES IT!
Score: 11-13

[03:09] Team_064 possession (Score: 11-13)
Ja Mitchell attempts a Layup. Contested by Bam Williamson (4.5 feet, ZONE). JA MITCHELL MAKES IT! Assist: Kawhi Irving
Score: 13-13

[02:52] Team_017 possession (Score: 13-13)
Bam Williamson attempts a Midrange. Contested by Shai Hyland (5.9 feet, MAN). BAM WILLIAMSON MAKES IT! Assist: Desmond Reaves
Score: 13-15

[02:38] Team_064 possession (Score: 13-15)
Ja Mitchell makes the Layup and draws the foul on Desmond Reaves! And-1! Ja Mitchell to the line for 1. [BONUS: 6 team fouls] (Desmond Reaves: 1 personal fouls)   FT 1/1: GOOD Ja Mitchell makes 1/1 from the line.
Score: 16-15

[02:24] Team_017 possession (Score: 16-15)
Desmond Reaves attempts a Midrange. Contested by Ja Mitchell (5.8 feet, MAN). Desmond Reaves misses. Offensive rebound by Kyrie Middleton! Kyrie Middleton kicks it out.

[02:11] Team_017 possession (Score: 16-15)
Desmond Reaves drives, Russell Simons stays with him. Desmond Reaves attempts a Layup. Contested by Russell Simons (4.1 feet, ZONE). Desmond Reaves misses. Rebound secured by Russell Simons.

[01:56] Team_064 possession (Score: 16-15)
FOUL! Holding foul on Vince Banchero. [IN THE BONUS! 7 team fouls] Jordan Mitchell to the line for 2 free throws. (Vince Banchero: 2 personal fouls)   FT 1/2: MISS   FT 2/2: GOOD Jordan Mitchell makes 1/2 from the line.
Score: 17-15

[01:40] Team_017 possession (Score: 17-15)
Kyrie Middleton drives to the basket... Kyrie Middleton loses the ball! Stripped by Russell Simons! TURNOVER! (live ball)

[01:28] Team_064 possession (Score: 17-15)
Kawhi Irving attempts a 3Pt. Contested by Desmond Reaves (4.3 feet, ZONE). KAWHI IRVING MAKES IT! Assist: Ja Mitchell
Score: 20-15

[01:16] Team_017 possession (Score: 20-15)
Tony Smith drives and kicks out. Bam Williamson attempts a 3Pt. Contested by Shai Hyland (5.5 feet, MAN). Bam Williamson misses. Rebound secured by Russell Simons.

[00:59] Team_064 possession (Score: 20-15)
FOUL! Shooting foul on Bam Williamson. Jordan Mitchell to the line for 2 free throws. [BONUS: 8 team fouls] (Bam Williamson: 3 personal fouls)   FT 1/2: GOOD   FT 2/2: MISS Jordan Mitchell makes 1/2 from the line. Rebound secured by Kyrie Middleton.
Score: 21-15

[00:40] Team_017 possession (Score: 21-15)
Vince Banchero attempts a Midrange. Contested by Jordan Mitchell (4.3 feet, MAN). Vince Banchero misses. Rebound secured by Shai Hyland.

[00:26] Team_064 possession (Score: 21-15)
FOUL! Offensive foul on Shai Hyland! Bam Williamson drew the charge! [Team fouls: 4] (Shai Hyland: 2 personal fouls) TURNOVER! (dead ball)

[00:11] Team_017 possession (Score: 21-15)
Vince Banchero attempts a 3Pt. Contested by Ja Mitchell (5.6 feet, ZONE). VINCE BANCHERO MAKES IT! Assist: Tony Smith
Score: 21-18

================================================================================
                              1ST QUARTER COMPLETE                              
================================================================================

1ST QUARTER SCORE: Team_064 21, Team_017 18

BOX SCORE:
================================================================================

Team_064
--------------------------------------------------------------------------------
Player                MIN  PTS  REB  AST  TO      FG   FG%      3P   3P%
--------------------------------------------------------------------------------
Ja Mitchell            12   11    0    1   0   4/6    66.7     0/0   0.0
Kawhi Irving           12    4    3    1   0   2/2   100.0     0/0   0.0
Jordan Mitchell        12    3    0    0   0   2/6    33.3     0/0   0.0
Shai Hyland            12    2    1    2   0   1/2    50.0     0/0   0.0
Russell Simons         12    0    7    0   0   0/0     0.0     0/0   0.0

TEAM: FG: 9/16 (56.2%), 3PT: 2/5 (40.0%), REB: 11 (2 off, 9 def), AST: 4, TO: 4
TEAM FOULS: 4


Team_017
--------------------------------------------------------------------------------
Player                MIN  PTS  REB  AST  TO      FG   FG%      3P   3P%
--------------------------------------------------------------------------------
Tony Smith             12    5    1    1   0   2/4    50.0     0/0   0.0
Kyrie Middleton        12    4    7    1   0   2/5    40.0     0/0   0.0
Bam Williamson         12    4    3    1   0   2/3    66.7     0/0   0.0
Vince Banchero         12    3    0    0   0   1/4    25.0     0/0   0.0
Desmond Reaves         12    2    0    1   0   1/3    33.3     0/0   0.0

TEAM: FG: 8/19 (42.1%), 3PT: 2/5 (40.0%), REB: 11 (4 off, 7 def), AST: 4, TO: 1
TEAM FOULS: 8 [Team_064 in BONUS]

================================================================================

================================================================================
                       2ND QUARTER - Team_064 vs Team_017                       
================================================================================

[12:00] Team_064 possession (Score: 21-18)
Shai Hyland attempts a 3Pt. Contested by Bam Williamson (4.7 feet, MAN). Shai Hyland misses. Rebound secured by Bam Williamson.

[11:42] Team_017 possession (Score: 21-18)
Tony Smith attempts a 3Pt. Contested by Kawhi Irving (5.1 feet, MAN). TONY SMITH MAKES IT! Assist: Bam Williamson
Score: 21-21

[11:28] Team_064 possession (Score: 21-21)
Ja Mitchell drives to the basket... Ja Mitchell throws a bad pass! Stolen by Desmond Reaves! TURNOVER! (live ball)

[11:13] Team_017 possession (Score: 21-21)
Bam Williamson drives, Shai Hyland stays with him. Bam Williamson attempts a Layup. Wide open! Shai Hyland is 6.1 feet away. [MAN] Bam Williamson misses. Rebound secured by Kawhi Irving.

[11:02] Team_064 possession (Score: 21-21)
Shai Hyland drives, Bam Williamson stays with him. Shai Hyland attempts a Layup. Contested by Bam Williamson (4.8 feet, MAN). Shai Hyland misses. Rebound secured by Tony Smith.

[10:49] Team_017 possession (Score: 21-21)
Desmond Reaves makes the Layup and draws the foul on Ja Mitchell! And-1! Desmond Reaves to the line for 1. [Team fouls: 1] (Ja Mitchell: 1 personal fouls)   FT 1/1: GOOD Desmond Reaves makes 1/1 from the line.
Score: 21-24

[10:33] Team_064 possession (Score: 21-24)
Russell Simons attempts a 3Pt. Contested by Vince Banchero (4.5 feet, ZONE). RUSSELL SIMONS MAKES IT! Assist: Shai Hyland
Score: 24-24

[10:19] Team_017 possession (Score: 24-24)
Bam Williamson drives, Russell Simons stays with him. Bam Williamson attempts a Layup. Contested by Russell Simons (4.6 feet, ZONE). BAM WILLIAMSON MAKES IT! Assist: Kyrie Middleton
Score: 24-26

[10:06] Team_064 possession (Score: 24-26)
Ja Mitchell attempts a 3Pt. Contested by Desmond Reaves (4.8 feet, MAN). Ja Mitchell misses. Rebound secured by Kyrie Middleton.

[09:52] Team_017 possession (Score: 24-26)
Desmond Reaves attempts a 3Pt. Wide open! Ja Mitchell is 6.1 feet away. [ZONE] DESMOND REAVES MAKES IT! Assist: Tony Smith
Score: 24-29

[09:35] Team_064 possession (Score: 24-29)
FOUL! Holding foul on Vince Banchero. [Team fouls: 1] No free throws, side out. (Vince Banchero: 1 personal fouls)

[09:25] Team_064 possession (Score: 24-29)
Kawhi Irving drives, picks up Tony Smith. Help arrives from Vince Banchero! Kawhi Irving attempts a Layup. Contested by Vince Banchero (3.3 feet, MAN). KAWHI IRVING MAKES IT!
Score: 26-29

[09:10] Team_017 possession (Score: 26-29)
FOUL! Reach-in foul on Shai Hyland during the drive. [Team fouls: 2] No free throws, side out. (Shai Hyland: 1 personal fouls)

[08:58] Team_017 possession (Score: 26-29)
Desmond Reaves attempts a Midrange. Wide open! Ja Mitchell is 6.2 feet away. [MAN] Desmond Reaves misses. Rebound secured by Jordan Mitchell.

[08:42] Team_064 possession (Score: 26-29)
FOUL! Reach-in foul on Bam Williamson during the drive. [Team fouls: 2] No free throws, side out. (Bam Williamson: 1 personal fouls)

[08:26] Team_064 possession (Score: 26-29)
Jordan Mitchell drives, picks up Vince Banchero. Help arrives from Tony Smith! Jordan Mitchell attempts a Dunk. Contested by Tony Smith (4.3 feet, MAN). JORDAN MITCHELL MAKES IT! Assist: Shai Hyland
Score: 28-29

[08:12] Team_017 possession (Score: 28-29)
Vince Banchero drives, picks up Shai Hyland. Help arrives from Jordan Mitchell! Vince Banchero attempts a Layup. Contested by Jordan Mitchell (5.8 feet, ZONE). VINCE BANCHERO MAKES IT!
Score: 28-31

[07:57] Team_064 possession (Score: 28-31)
Kawhi Irving attempts a Layup. BLOCKED BY BAM WILLIAMSON! Ball is loose! Rebound secured by Kyrie Middleton.

[07:44] Team_017 possession (Score: 28-31)
Vince Banchero attempts a 3Pt. Contested by Jordan Mitchell (4.7 feet, MAN). Vince Banchero misses. Offensive rebound by Kyrie Middleton! Kyrie Middleton kicks it out.

[07:31] Team_017 possession (Score: 28-31)
Bam Williamson loses the ball! Stripped by Shai Hyland! TURNOVER! (live ball)

[07:14] Team_064 possession (Score: 28-31)
FOUL! Shooting foul on Vince Banchero. Shai Hyland to the line for 2 free throws. [Team fouls: 3] (Vince Banchero: 2 personal fouls)   FT 1/2: GOOD   FT 2/2: GOOD Shai Hyland makes 2/2 from the line.
Score: 30-31

[06:58] Team_017 possession (Score: 30-31)
Tony Smith attempts a 3Pt. Wide open! Ja Mitchell is 6.5 feet away. [ZONE] Tony Smith misses. Offensive rebound by Bam Williamson! Bam Williamson kicks it out.

[06:43] Team_017 possession (Score: 30-31)
Kyrie Middleton makes the Layup and draws the foul on Russell Simons! And-1! Kyrie Middleton to the line for 1. [Team fouls: 3] (Russell Simons: 1 personal fouls)   FT 1/1: GOOD Kyrie Middleton makes 1/1 from the line.
Score: 30-34

[06:27] Team_064 possession (Score: 30-34)
Kawhi Irving attempts a 3Pt. Contested by Tony Smith (3.7 feet, MAN). Kawhi Irving misses. Offensive rebound by Kawhi Irving! Kawhi Irving kicks it out.

[06:12] Team_064 possession (Score: 30-34)
Kawhi Irving attempts a 3Pt. Contested by Tony Smith (3.8 feet, ZONE). Kawhi Irving misses. Offensive rebound by Russell Simons! Russell Simons kicks it out.

[05:56] Team_064 possession (Score: 30-34)
Ja Mitchell attempts a 3Pt. Contested by Desmond Reaves (5.3 feet, MAN). Ja Mitchell misses. Rebound secured by Kyrie Middleton.

[05:42] Team_017 possession (Score: 30-34)
Bam Williamson attempts a Layup. Wide open! Shai Hyland is 6.7 feet away. [MAN] BAM WILLIAMSON MAKES IT!
Score: 30-36

[05:26] Team_064 possession (Score: 30-36)
Shai Hyland attempts a Midrange. Contested by Bam Williamson (5.5 feet, MAN). Shai Hyland misses. Offensive rebound by Kawhi Irving! Kawhi Irving kicks it out.

[05:16] Team_064 possession (Score: 30-36)
Jordan Mitchell attempts a 3Pt. Contested by Vince Banchero (4.7 feet, MAN). JORDAN MITCHELL MAKES IT! Assist: Ja Mitchell
Score: 33-36

[04:58] Team_017 possession (Score: 33-36)
Tony Smith drives to the basket... Tony Smith loses the ball! Stripped by Kawhi Irving! TURNOVER! (live ball)

[04:39] Team_064 possession (Score: 33-36)
Ja Mitchell attempts a 3Pt. Contested by Tony Smith (4.3 feet, ZONE). JA MITCHELL MAKES IT! Assist: Kawhi Irving
Score: 36-36

[04:25] Team_017 possession (Score: 36-36)
Kyrie Middleton drives and kicks out. Tony Smith attempts a 3Pt. Wide open! Ja Mitchell is 6.5 feet away. [ZONE] Tony Smith misses. Rebound secured by Kawhi Irving.

[04:08] Team_064 possession (Score: 36-36)
Russell Simons attempts a 3Pt. Contested by Tony Smith (4.2 feet, ZONE). Russell Simons misses. Rebound secured by Kyrie Middleton.

[03:54] Team_017 possession (Score: 36-36)
Tony Smith drives and kicks out. Vince Banchero attempts a 3Pt. Wide open! Ja Mitchell is 6.6 feet away. [ZONE] VINCE BANCHERO MAKES IT! Assist: Kyrie Middleton
Score: 36-39

[03:39] Team_064 possession (Score: 36-39)
Shai Hyland attempts a 3Pt. Contested by Bam Williamson (5.7 feet, MAN). Shai Hyland misses. FOUL! Loose ball foul on Kyrie Middleton during the rebound battle. [Team fouls: 4] No free throws, side out. (Kyrie Middleton: 1 personal fouls)

[03:27] Team_064 possession (Score: 36-39)
Kawhi Irving attempts a 3Pt. Contested by Tony Smith (4.2 feet, MAN). Kawhi Irving misses. Rebound secured by Kyrie Middleton.

[03:17] Team_017 possession (Score: 36-39)
FOUL! Holding foul on Ja Mitchell. [Team fouls: 4] No free throws, side out. (Ja Mitchell: 2 personal fouls)

[03:01] Team_017 possession (Score: 36-39)
Kyrie Middleton makes the Layup and draws the foul on Russell Simons! And-1! Kyrie Middleton to the line for 1. [BONUS: 5 team fouls] (Russell Simons: 2 personal fouls)   FT 1/1: GOOD Kyrie Middleton makes 1/1 from the line.
Score: 36-42

[02:47] Team_064 possession (Score: 36-42)
Jordan Mitchell attempts a Midrange. Contested by Kyrie Middleton (5.9 feet, ZONE). Jordan Mitchell misses. Offensive rebound by Russell Simons! Russell Simons kicks it out.

[02:36] Team_064 possession (Score: 36-42)
Shai Hyland attempts a 3Pt. Contested by Bam Williamson (5.9 feet, MAN). Shai Hyland misses. Rebound secured by Bam Williamson.

[02:18] Team_017 possession (Score: 36-42)
Tony Smith attempts a Midrange. Contested by Jordan Mitchell (6.0 feet, ZONE). TONY SMITH MAKES IT! Assist: Bam Williamson
Score: 36-44

[02:01] Team_064 possession (Score: 36-44)
Russell Simons attempts a Midrange. Wide open! Kyrie Middleton is 6.4 feet away. [MAN] Russell Simons misses. FOUL! Loose ball foul on Bam Williamson during the rebound battle. [IN THE BONUS! 5 team fouls] Russell Simons to the line for 2 free throws. (Bam Williamson: 2 personal fouls)   FT 1/2: GOOD   FT 2/2: GOOD Russell Simons makes 2/2 from the line.
Score: 38-44

[01:51] Team_017 possession (Score: 38-44)
FOUL! Holding foul on Kawhi Irving. [IN THE BONUS! 6 team fouls] Tony Smith to the line for 2 free throws. (Kawhi Irving: 1 personal fouls)   FT 1/2: GOOD   FT 2/2: GOOD Tony Smith makes 2/2 from the line.
Score: 38-46

[01:41] Team_064 possession (Score: 38-46)
Ja Mitchell drives to the basket... Ja Mitchell commits a violation (traveling/carry)! TURNOVER! (dead ball)

[01:41] Substitution (Team_064): Ja Mitchell OUT → CJ Haliburton IN (stamina_rule2)

[01:41] Substitution (Team_064): Jordan Mitchell OUT → Ja Simmons IN (stamina_rule2)

[01:41] Substitution (Team_064): Kawhi Irving OUT → Tobias Herro IN (stamina_rule2)

[01:41] Substitution (Team_064): Russell Simons OUT → Austin Smith IN (stamina_rule2)

[01:41] Substitution (Team_064): Shai Hyland OUT → Devin Cunningham IN (stamina_rule2)

[01:41] Substitution (Team_017): Desmond Reaves OUT → Blake Reaves IN (stamina_rule2)

[01:41] Substitution (Team_017): Vince Banchero OUT → Tobias Bridges IN (stamina_rule2)

[01:41] Substitution (Team_017): Tony Smith OUT → Shaquille Stewart IN (stamina_rule2)

[01:41] Substitution (Team_017): Kyrie Middleton OUT → Ja Stewart IN (stamina_rule2)

[01:41] Substitution (Team_017): Bam Williamson OUT → Klay Holiday IN (stamina_rule2)

[01:28] Team_017 possession (Score: 38-46)
Klay Holiday attempts a Midrange. Contested by Devin Cunningham (5.4 feet, MAN). KLAY HOLIDAY MAKES IT!
Score: 38-48

[01:16] Team_064 possession (Score: 38-48)
Ja Simmons drives, picks up Klay Holiday. Help arrives from Tobias Bridges! Ja Simmons attempts a Layup. Contested by Tobias Bridges (4.9 feet, ZONE). Ja Simmons misses. Rebound secured by Klay Holiday.

[01:04] Team_017 possession (Score: 38-48)
Klay Holiday attempts a Midrange. Contested by Devin Cunningham (5.4 feet, MAN). Klay Holiday misses. Rebound secured by Austin Smith.

[00:50] Team_064 possession (Score: 38-48)
Austin Smith attempts a Layup. Contested by Ja Stewart (4.3 feet, MAN). AUSTIN SMITH MAKES IT!
Score: 40-48

[00:39] Team_017 possession (Score: 40-48)
Ja Stewart attempts a Midrange. Contested by Austin Smith (4.2 feet, ZONE). JA STEWART MAKES IT!
Score: 40-50

[00:28] Team_064 possession (Score: 40-50)
CJ Haliburton attempts a 3Pt. Contested by Blake Reaves (5.5 feet, MAN). CJ Haliburton misses. Offensive rebound by Austin Smith! Austin Smith kicks it out.

[00:11] Team_064 possession (Score: 40-50)
Austin Smith attempts a 3Pt. Contested by Ja Stewart (4.3 feet, MAN). Austin Smith misses. Rebound secured by Ja Stewart.

================================================================================
                              2ND QUARTER COMPLETE                              
================================================================================

2ND QUARTER SCORE: Team_064 19, Team_017 32

BOX SCORE:
================================================================================

Team_064
--------------------------------------------------------------------------------
Player                MIN  PTS  REB  AST  TO      FG   FG%      3P   3P%
--------------------------------------------------------------------------------
Russell Simons         23    5    3    0   0   2/3    66.7     0/0   0.0
Jordan Mitchell        23    5    1    0   0   2/2   100.0     0/0   0.0
Ja Mitchell            23    3    0    1   0   1/3    33.3     0/0   0.0
Shai Hyland            23    2    0    2   0   1/4    25.0     0/0   0.0
Kawhi Irving           23    2    4    1   0   1/3    33.3     0/0   0.0
Austin Smith            2    2    2    0   0   1/2    50.0     0/0   0.0
Ja Simmons              2    0    0    0   0   0/1     0.0     0/0   0.0

TEAM: FG: 8/18 (44.4%), 3PT: 3/10 (30.0%), REB: 10 (6 off, 4 def), AST: 4, TO: 2
TEAM FOULS: 6 [Team_017 in BONUS]


Team_017
--------------------------------------------------------------------------------
Player                MIN  PTS  REB  AST  TO      FG   FG%      3P   3P%
--------------------------------------------------------------------------------
Tony Smith             23    7    1    1   0   3/3   100.0     0/0   0.0
Desmond Reaves         23    6    0    0   0   2/3    66.7     0/0   0.0
Kyrie Middleton        23    6    6    2   0   2/3    66.7     0/0   0.0
Vince Banchero         23    5    0    0   0   2/2   100.0     0/0   0.0
Bam Williamson         23    4    3    2   0   2/3    66.7     0/0   0.0
Klay Holiday            2    2    1    0   0   1/2    50.0     0/0   0.0
Ja Stewart              2    2    1    0   0   1/1   100.0     0/0   0.0

TEAM: FG: 13/17 (76.5%), 3PT: 2/2 (100.0%), REB: 12 (2 off, 10 def), AST: 5, TO: 2
TEAM FOULS: 5 [Team_064 in BONUS]

================================================================================

================================================================================
                       3RD QUARTER - Team_064 vs Team_017                       
================================================================================

[12:00] Team_064 possession (Score: 40-50)
Kawhi Irving attempts a 3Pt. Contested by Desmond Reaves (3.9 feet, ZONE). Kawhi Irving misses. Rebound secured by Kyrie Middleton.

[11:50] Team_017 possession (Score: 40-50)
Bam Williamson makes the Layup and draws the foul on Jordan Mitchell! And-1! Bam Williamson to the line for 1. [Team fouls: 1] (Jordan Mitchell: 1 personal fouls)   FT 1/1: GOOD Bam Williamson makes 1/1 from the line.
Score: 40-53

[11:35] Team_064 possession (Score: 40-53)
FOUL! Shooting foul on Vince Banchero. Jordan Mitchell to the line for 3 free throws. [Team fouls: 1] (Vince Banchero: 1 personal fouls)   FT 1/3: GOOD   FT 2/3: MISS   FT 3/3: GOOD Jordan Mitchell makes 2/3 from the line.
Score: 42-53

[11:21] Team_017 possession (Score: 42-53)
Bam Williamson attempts a Midrange. Contested by Shai Hyland (5.7 feet, MAN). Bam Williamson misses. Rebound secured by Kawhi Irving.

[11:07] Team_064 possession (Score: 42-53)
FOUL! Shooting foul on Kyrie Middleton. Russell Simons to the line for 2 free throws. [Team fouls: 2] (Kyrie Middleton: 1 personal fouls)   FT 1/2: GOOD   FT 2/2: MISS Russell Simons makes 1/2 from the line. Rebound secured by Bam Williamson.
Score: 43-53

[10:52] Team_017 possession (Score: 43-53)
Bam Williamson attempts a 3Pt. Contested by Ja Mitchell (5.9 feet, ZONE). Bam Williamson misses. Rebound secured by Shai Hyland.

[10:43] Team_064 possession (Score: 43-53)
Kawhi Irving drives and kicks out. Ja Mitchell attempts a 3Pt. Contested by Desmond Reaves (4.0 feet, ZONE). Ja Mitchell misses. Rebound secured by Bam Williamson.

[10:30] Team_017 possession (Score: 43-53)
Kyrie Middleton attempts a 3Pt. Contested by Ja Mitchell (5.5 feet, ZONE). KYRIE MIDDLETON MAKES IT! Assist: Tony Smith
Score: 43-56

[10:16] Team_064 possession (Score: 43-56)
Kawhi Irving attempts a 3Pt. Contested by Tony Smith (2.6 feet, MAN). Kawhi Irving misses. Rebound secured by Bam Williamson.

[10:00] Team_017 possession (Score: 43-56)
Bam Williamson attempts a Layup. Contested by Russell Simons (4.0 feet, ZONE). BAM WILLIAMSON MAKES IT!
Score: 43-58

[09:46] Team_064 possession (Score: 43-58)
Ja Mitchell attempts a Layup. Contested by Desmond Reaves (4.3 feet, MAN). Ja Mitchell misses. FOUL! Loose ball foul on Tony Smith during the rebound battle. [Team fouls: 3] No free throws, side out. (Tony Smith: 1 personal fouls)

[09:30] Team_064 possession (Score: 43-58)
Shai Hyland attempts a 3Pt. Contested by Desmond Reaves (4.4 feet, ZONE). Shai Hyland misses. Rebound secured by Kyrie Middleton.

[09:11] Team_017 possession (Score: 43-58)
Desmond Reaves attempts a 3Pt. Contested by Ja Mitchell (5.6 feet, ZONE). DESMOND REAVES MAKES IT! Assist: Vince Banchero
Score: 43-61

[08:57] Team_064 possession (Score: 43-61)
Ja Mitchell attempts a Midrange. Contested by Desmond Reaves (4.3 feet, MAN). Ja Mitchell misses. Rebound secured by Tony Smith.

[08:43] Team_017 possession (Score: 43-61)
Bam Williamson drives, Shai Hyland stays with him. Bam Williamson attempts a Dunk. Contested by Shai Hyland (5.7 feet, MAN). BAM WILLIAMSON MAKES IT! Assist: Vince Banchero
Score: 43-63

[08:31] Team_064 possession (Score: 43-63)
Shai Hyland drives and kicks out. Shai Hyland attempts a 3Pt. Contested by Desmond Reaves (4.0 feet, ZONE). Shai Hyland misses. Rebound secured by Bam Williamson.

[08:16] Team_017 possession (Score: 43-63)
Desmond Reaves drives, Russell Simons stays with him. Desmond Reaves attempts a Layup. Contested by Russell Simons (3.7 feet, ZONE). Desmond Reaves misses. Rebound secured by Russell Simons.

[08:02] Team_064 possession (Score: 43-63)
Ja Mitchell attempts a Layup. Contested by Desmond Reaves (4.3 feet, MAN). JA MITCHELL MAKES IT!
Score: 45-63

[07:45] Team_017 possession (Score: 45-63)
Tony Smith attempts a 3Pt. Contested by Ja Mitchell (5.7 feet, ZONE). Tony Smith misses. Rebound secured by Russell Simons.

[07:32] Team_064 possession (Score: 45-63)
Ja Mitchell attempts a 3Pt. Contested by Desmond Reaves (4.3 feet, ZONE). Ja Mitchell misses. Rebound secured by Bam Williamson.

[07:16] Team_017 possession (Score: 45-63)
Desmond Reaves attempts a Midrange. Contested by Ja Mitchell (5.6 feet, MAN). Desmond Reaves misses. Rebound secured by Kawhi Irving.

[06:59] Team_064 possession (Score: 45-63)
Russell Simons attempts a 3Pt. Contested by Kyrie Middleton (5.1 feet, MAN). Russell Simons misses. Rebound secured by Tony Smith.

[06:46] Team_017 possession (Score: 45-63)
FOUL! Holding foul on Shai Hyland. [Team fouls: 2] No free throws, side out. (Shai Hyland: 1 personal fouls)

[06:30] Team_017 possession (Score: 45-63)
Kyrie Middleton attempts a Midrange. Contested by Jordan Mitchell (4.2 feet, ZONE). Kyrie Middleton misses. Rebound secured by Russell Simons.

[06:14] Team_064 possession (Score: 45-63)
Ja Mitchell drives, Desmond Reaves stays with him. Ja Mitchell attempts a Layup. Contested by Desmond Reaves (4.3 feet, MAN). JA MITCHELL MAKES IT! Assist: Jordan Mitchell
Score: 47-63

[05:57] Team_017 possession (Score: 47-63)
Bam Williamson attempts a Midrange. Contested by Shai Hyland (5.7 feet, MAN). Bam Williamson misses. Offensive rebound by Bam Williamson! Bam Williamson puts it back in!
Score: 47-65

[05:40] Team_064 possession (Score: 47-65)
Kawhi Irving attempts a 3Pt. Contested by Desmond Reaves (3.9 feet, ZONE). KAWHI IRVING MAKES IT! Assist: Jordan Mitchell
Score: 50-65

[05:24] Team_017 possession (Score: 50-65)
Vince Banchero attempts a 3Pt. Contested by Ja Mitchell (5.1 feet, ZONE). VINCE BANCHERO MAKES IT! Assist: Tony Smith
Score: 50-68

[05:09] Team_064 possession (Score: 50-68)
Russell Simons drives, Kyrie Middleton stays with him. Russell Simons attempts a Layup. Contested by Kyrie Middleton (5.1 feet, MAN). RUSSELL SIMONS MAKES IT! Assist: Shai Hyland
Score: 52-68

[04:58] Team_017 possession (Score: 52-68)
Kyrie Middleton attempts a 3Pt. Contested by Russell Simons (3.6 feet, MAN). Kyrie Middleton misses. Rebound secured by Russell Simons.

[04:46] Team_064 possession (Score: 52-68)
FOUL! Holding foul on Tony Smith. [Team fouls: 4] No free throws, side out. (Tony Smith: 2 personal fouls)

[04:33] Team_064 possession (Score: 52-68)
Jordan Mitchell drives and kicks out. Shai Hyland attempts a Midrange. Contested by Vince Banchero (4.1 feet, ZONE). Shai Hyland misses. Rebound secured by Bam Williamson.

[04:19] Team_017 possession (Score: 52-68)
FOUL! Shooting foul on Ja Mitchell. Desmond Reaves to the line for 2 free throws. [Team fouls: 3] (Ja Mitchell: 1 personal fouls)   FT 1/2: GOOD   FT 2/2: GOOD Desmond Reaves makes 2/2 from the line.
Score: 52-70

[04:09] Team_064 possession (Score: 52-70)
FOUL! Offensive foul on Ja Mitchell! Desmond Reaves drew the charge! [Team fouls: 4] (Ja Mitchell: 2 personal fouls) TURNOVER! (dead ball)

[03:54] Team_017 possession (Score: 52-70)
Bam Williamson attempts a Midrange. Contested by Shai Hyland (5.9 feet, ZONE). BAM WILLIAMSON MAKES IT!
Score: 52-72

[03:36] Team_064 possession (Score: 52-72)
FOUL! Reach-in foul on Vince Banchero during the drive. [IN THE BONUS! 5 team fouls] Jordan Mitchell to the line for 2 free throws. (Vince Banchero: 2 personal fouls)   FT 1/2: GOOD   FT 2/2: MISS Jordan Mitchell makes 1/2 from the line. Offensive rebound by Kawhi Irving! Kawhi Irving kicks it out.
Score: 53-72

[03:23] Team_064 possession (Score: 53-72)
Russell Simons drives to the basket... Russell Simons throws a bad pass! Stolen by Bam Williamson! TURNOVER! (live ball)

[03:06] Team_017 possession (Score: 53-72)
Desmond Reaves attempts a 3Pt. Contested by Ja Mitchell (5.8 feet, ZONE). Desmond Reaves misses. Rebound secured by Kawhi Irving.

[02:52] Team_064 possession (Score: 53-72)
FOUL! Shooting foul on Desmond Reaves. Ja Mitchell to the line for 2 free throws. [BONUS: 6 team fouls] (Desmond Reaves: 1 personal fouls)   FT 1/2: GOOD   FT 2/2: GOOD Ja Mitchell makes 2/2 from the line.
Score: 55-72

[02:39] Team_017 possession (Score: 55-72)
Kyrie Middleton attempts a Midrange. Contested by Russell Simons (3.9 feet, ZONE). Kyrie Middleton misses. Rebound secured by Shai Hyland.

[02:24] Team_064 possession (Score: 55-72)
Shai Hyland drives, Bam Williamson stays with him. Shai Hyland attempts a Dunk. Contested by Bam Williamson (4.6 feet, MAN). SHAI HYLAND MAKES IT! Assist: Russell Simons
Score: 57-72

[02:13] Team_017 possession (Score: 57-72)
Tony Smith drives, picks up Russell Simons. Help arrives from Jordan Mitchell! Tony Smith attempts a Layup. Contested by Jordan Mitchell (4.2 feet, ZONE). TONY SMITH MAKES IT! Assist: Kyrie Middleton
Score: 57-74

[01:58] Team_064 possession (Score: 57-74)
Kawhi Irving attempts a 3Pt. Contested by Tony Smith (3.0 feet, MAN). KAWHI IRVING MAKES IT! Assist: Shai Hyland
Score: 60-74

[01:43] Team_017 possession (Score: 60-74)
Bam Williamson attempts a Layup. Wide open! Shai Hyland is 6.1 feet away. [MAN] BAM WILLIAMSON MAKES IT! Assist: Vince Banchero
Score: 60-76

[01:31] Team_064 possession (Score: 60-76)
Kawhi Irving attempts a Midrange. Contested by Tony Smith (3.0 feet, MAN). KAWHI IRVING MAKES IT! Assist: Jordan Mitchell
Score: 62-76

[01:19] Team_017 possession (Score: 62-76)
Bam Williamson attempts a Midrange. Wide open! Shai Hyland is 6.1 feet away. [MAN] BAM WILLIAMSON MAKES IT! Assist: Tony Smith
Score: 62-78

[01:02] Team_064 possession (Score: 62-78)
FOUL! Reach-in foul on Bam Williamson during the drive. [IN THE BONUS! 7 team fouls] Russell Simons to the line for 2 free throws. (Bam Williamson: 1 personal fouls)   FT 1/2: MISS   FT 2/2: MISS Russell Simons makes 0/2 from the line. Rebound secured by Bam Williamson.

[00:47] Team_017 possession (Score: 62-78)
Bam Williamson attempts a 3Pt. Wide open! Shai Hyland is 6.2 feet away. [MAN] Bam Williamson misses. Offensive rebound by Kyrie Middleton! Kyrie Middleton kicks it out.

[00:33] Team_017 possession (Score: 62-78)
Bam Williamson throws a bad pass! Stolen by Shai Hyland! TURNOVER! (live ball)

[00:22] Team_064 possession (Score: 62-78)
FOUL! Shooting foul on Kyrie Middleton. Russell Simons to the line for 2 free throws. [BONUS: 8 team fouls] (Kyrie Middleton: 2 personal fouls)   FT 1/2: GOOD   FT 2/2: GOOD Russell Simons makes 2/2 from the line.
Score: 64-78

[00:08] Team_017 possession (Score: 64-78)
Desmond Reaves attempts a Layup. Contested by Russell Simons (4.4 feet, ZONE). DESMOND REAVES MAKES IT!
Score: 64-80

================================================================================
                              3RD QUARTER COMPLETE                              
================================================================================

3RD QUARTER SCORE: Team_064 24, Team_017 30

BOX SCORE:
================================================================================

Team_064
--------------------------------------------------------------------------------
Player                MIN  PTS  REB  AST  TO      FG   FG%      3P   3P%
--------------------------------------------------------------------------------
Kawhi Irving           35    8    4    0   0   3/6    50.0     0/0   0.0
Ja Mitchell            35    6    0    0   0   3/5    60.0     0/0   0.0
Russell Simons         35    4    5    1   0   2/5    40.0     0/0   0.0
Jordan Mitchell        35    2    0    3   0   1/2    50.0     0/0   0.0
Shai Hyland            35    2    2    2   0   1/3    33.3     0/0   0.0

TEAM: FG: 10/21 (47.6%), 3PT: 3/8 (37.5%), REB: 11 (2 off, 9 def), AST: 6, TO: 2
TEAM FOULS: 4


Team_017
--------------------------------------------------------------------------------
Player                MIN  PTS  REB  AST  TO      FG   FG%      3P   3P%
--------------------------------------------------------------------------------
Bam Williamson         35   15    8    0   0   7/9    77.8     0/0   0.0
Desmond Reaves         35    7    0    0   0   3/6    50.0     0/0   0.0
Kyrie Middleton        35    3    3    1   0   1/4    25.0     0/0   0.0
Vince Banchero         35    3    0    3   0   1/1   100.0     0/0   0.0
Tony Smith             35    2    2    3   0   1/2    50.0     0/0   0.0

TEAM: FG: 13/22 (59.1%), 3PT: 3/7 (42.9%), REB: 13 (2 off, 11 def), AST: 7, TO: 1
TEAM FOULS: 8 [Team_064 in BONUS]

================================================================================

================================================================================
                       4TH QUARTER - Team_064 vs Team_017                       
================================================================================

[12:00] Substitution (Team_064): Ja Mitchell OUT (stamina: 67) → CJ Haliburton IN (comeback_detected)

[12:00] Substitution (Team_017): Desmond Reaves OUT (stamina: 68) → Blake Reaves IN (comeback_detected)

[12:00] Team_064 possession (Score: 64-80)
FOUL! Holding foul on Bam Williamson. [Team fouls: 1] No free throws, side out. (Bam Williamson: 1 personal fouls)

[11:48] Team_064 possession (Score: 64-80)
FOUL! Holding foul on Blake Reaves. [Team fouls: 2] No free throws, side out. (Blake Reaves: 1 personal fouls)

[11:35] Team_064 possession (Score: 64-80)
Jordan Mitchell attempts a 3Pt. Contested by Vince Banchero (3.9 feet, MAN). Jordan Mitchell misses. Rebound secured by Tony Smith.

[11:19] Team_017 possession (Score: 64-80)
Tony Smith attempts a 3Pt. Contested by Kawhi Irving (5.2 feet, MAN). Tony Smith misses. Rebound secured by Russell Simons.

[11:06] Team_064 possession (Score: 64-80)
Kawhi Irving attempts a 3Pt. Contested by Tony Smith (3.1 feet, MAN). Kawhi Irving misses. Rebound secured by Bam Williamson.

[10:53] Team_017 possession (Score: 64-80)
Vince Banchero makes the Layup and draws the foul on Jordan Mitchell! And-1! Vince Banchero to the line for 1. [Team fouls: 1] (Jordan Mitchell: 1 personal fouls)   FT 1/1: MISS Vince Banchero makes 0/1 from the line. Rebound secured by Shai Hyland.
Score: 64-82

[10:40] Team_064 possession (Score: 64-82)
Shai Hyland drives, Bam Williamson stays with him. Shai Hyland attempts a Dunk. Contested by Bam Williamson (4.9 feet, MAN). Shai Hyland misses. Rebound secured by Tony Smith.

[10:27] Team_017 possession (Score: 64-82)
Kyrie Middleton attempts a 3Pt. Contested by Russell Simons (4.3 feet, ZONE). Kyrie Middleton misses. Rebound secured by Russell Simons.

[10:14] Team_064 possession (Score: 64-82)
CJ Haliburton attempts a 3Pt. Contested by Blake Reaves (5.5 feet, MAN). CJ Haliburton misses. Rebound secured by Tony Smith.

[10:03] Team_017 possession (Score: 64-82)
Vince Banchero attempts a Midrange. Contested by Jordan Mitchell (4.4 feet, ZONE). Vince Banchero misses. Rebound secured by Jordan Mitchell.

[09:46] Team_064 possession (Score: 64-82)
Russell Simons attempts a 3Pt. Contested by Tony Smith (3.5 feet, ZONE). Russell Simons misses. Rebound secured by Kyrie Middleton.

[09:33] Team_017 possession (Score: 64-82)
Vince Banchero drives, Jordan Mitchell stays with him. Vince Banchero attempts a Dunk. Contested by Jordan Mitchell (4.5 feet, MAN). VINCE BANCHERO MAKES IT! Assist: Bam Williamson
Score: 64-84

[09:18] Team_064 possession (Score: 64-84)
Kawhi Irving attempts a 3Pt. Contested by Kyrie Middleton (5.4 feet, ZONE). Kawhi Irving misses. Rebound secured by Kyrie Middleton.

[09:02] Team_017 possession (Score: 64-84)
Tony Smith attempts a Layup. Contested by Russell Simons (4.7 feet, ZONE). TONY SMITH MAKES IT! Assist: Kyrie Middleton
Score: 64-86

[08:46] Team_064 possession (Score: 64-86)
Kawhi Irving attempts a 3Pt. Contested by Tony Smith (3.4 feet, MAN). Kawhi Irving misses. Rebound secured by Kyrie Middleton.

[08:27] Team_017 possession (Score: 64-86)
Tony Smith attempts a 3Pt. Contested by Jordan Mitchell (5.2 feet, ZONE). TONY SMITH MAKES IT! Assist: Blake Reaves
Score: 64-89

[08:11] Team_064 possession (Score: 64-89)
FOUL! Holding foul on Blake Reaves. [Team fouls: 3] No free throws, side out. (Blake Reaves: 2 personal fouls)

[08:00] Team_064 possession (Score: 64-89)
Russell Simons attempts a 3Pt. Contested by Kyrie Middleton (5.7 feet, MAN). Russell Simons misses. Offensive rebound by Kawhi Irving! Kawhi Irving kicks it out.

[07:42] Team_064 possession (Score: 64-89)
Russell Simons attempts a Midrange. Contested by Kyrie Middleton (5.8 feet, MAN). Russell Simons misses. Offensive rebound by Kawhi Irving! Kawhi Irving kicks it out.

[07:27] Team_064 possession (Score: 64-89)
Jordan Mitchell attempts a 3Pt. BLOCKED BY VINCE BANCHERO! Ball is loose! Rebound secured by Kyrie Middleton.

[07:09] Team_017 possession (Score: 64-89)
Blake Reaves attempts a 3Pt. Contested by CJ Haliburton (5.9 feet, MAN). BLAKE REAVES MAKES IT! Assist: Vince Banchero
Score: 64-92

[06:54] Team_064 possession (Score: 64-92)
Russell Simons drives to the basket... Russell Simons loses control! Ball rolls out of bounds! TURNOVER! (dead ball)

[06:54] Substitution (Team_064): Jordan Mitchell OUT → Ja Simmons IN (stamina_rule2)

[06:54] Substitution (Team_064): Kawhi Irving OUT → Tobias Herro IN (stamina_rule2)

[06:54] Substitution (Team_064): Russell Simons OUT → Austin Smith IN (stamina_rule2)

[06:54] Substitution (Team_064): Shai Hyland OUT → Devin Cunningham IN (stamina_rule2)

[06:54] Substitution (Team_017): Vince Banchero OUT → Tobias Bridges IN (stamina_rule2)

[06:54] Substitution (Team_017): Tony Smith OUT → Shaquille Stewart IN (stamina_rule2)

[06:54] Substitution (Team_017): Kyrie Middleton OUT → Ja Stewart IN (stamina_rule2)

[06:54] Substitution (Team_017): Bam Williamson OUT → Klay Holiday IN (stamina_rule2)

[06:43] Team_017 possession (Score: 64-92)
Blake Reaves makes the Layup and draws the foul on CJ Haliburton! And-1! Blake Reaves to the line for 1. [Team fouls: 2] (CJ Haliburton: 1 personal fouls)   FT 1/1: GOOD Blake Reaves makes 1/1 from the line.
Score: 64-95

[06:26] Team_064 possession (Score: 64-95)
CJ Haliburton attempts a 3Pt. Contested by Blake Reaves (5.5 feet, MAN). CJ HALIBURTON MAKES IT! Assist: Ja Simmons
Score: 67-95

[06:12] Team_017 possession (Score: 67-95)
Ja Stewart drives, picks up Austin Smith. Help arrives from Ja Simmons! Ja Stewart attempts a Layup. Contested by Ja Simmons (4.2 feet, MAN). JA STEWART MAKES IT! Assist: Shaquille Stewart
Score: 67-97

[05:58] Team_064 possession (Score: 67-97)
Austin Smith drives, picks up Ja Stewart. Help arrives from Tobias Bridges! Austin Smith attempts a Dunk. Contested by Tobias Bridges (4.3 feet, ZONE). AUSTIN SMITH MAKES IT! Assist: Devin Cunningham
Score: 69-97

[05:44] Team_017 possession (Score: 69-97)
FOUL! Offensive foul on Blake Reaves! CJ Haliburton drew the charge! [Team fouls: 4] (Blake Reaves: 3 personal fouls) TURNOVER! (dead ball)

[05:29] Team_064 possession (Score: 69-97)
Ja Simmons drives and kicks out. Tobias Herro attempts a 3Pt. Contested by Tobias Bridges (4.0 feet, ZONE). TOBIAS HERRO MAKES IT! Assist: Ja Simmons
Score: 72-97

[05:14] Team_017 possession (Score: 72-97)
Klay Holiday attempts a Midrange. Contested by Austin Smith (4.8 feet, ZONE). KLAY HOLIDAY MAKES IT! Assist: Shaquille Stewart
Score: 72-99

[05:01] Team_064 possession (Score: 72-99)
Austin Smith drives to the basket... Austin Smith throws a bad pass out of bounds! TURNOVER! (dead ball)

[04:45] Team_017 possession (Score: 72-99)
Tobias Bridges attempts a 3Pt. Contested by Ja Simmons (5.7 feet, MAN). Tobias Bridges misses. Rebound secured by Ja Simmons.

[04:29] Team_064 possession (Score: 72-99)
CJ Haliburton attempts a 3Pt. Contested by Blake Reaves (5.6 feet, MAN). CJ Haliburton misses. Rebound secured by Klay Holiday.

[04:18] Team_017 possession (Score: 72-99)
Shaquille Stewart attempts a 3Pt. Contested by Austin Smith (4.9 feet, ZONE). Shaquille Stewart misses. FOUL! Loose ball foul on Devin Cunningham during the rebound battle. [Team fouls: 3] No free throws, side out. (Devin Cunningham: 1 personal fouls)

[04:02] Team_017 possession (Score: 72-99)
FOUL! Holding foul on Tobias Herro. [Team fouls: 4] No free throws, side out. (Tobias Herro: 1 personal fouls)

[03:51] Team_017 possession (Score: 72-99)
Tobias Bridges attempts a 3Pt. Contested by Ja Simmons (5.7 feet, MAN). Tobias Bridges misses. Rebound secured by Austin Smith.

[03:37] Team_064 possession (Score: 72-99)
Austin Smith makes the Dunk and draws the foul on Ja Stewart! And-1! Austin Smith to the line for 1. [BONUS: 5 team fouls] (Ja Stewart: 1 personal fouls)   FT 1/1: GOOD Austin Smith makes 1/1 from the line.
Score: 75-99

[03:22] Team_017 possession (Score: 75-99)
Blake Reaves attempts a 3Pt. Contested by Austin Smith (4.5 feet, ZONE). Blake Reaves misses. Rebound secured by Ja Simmons.

[03:08] Team_064 possession (Score: 75-99)
CJ Haliburton attempts a 3Pt. Contested by Tobias Bridges (4.3 feet, ZONE). CJ Haliburton misses. Rebound secured by Ja Stewart.

[02:56] Team_017 possession (Score: 75-99)
Klay Holiday attempts a 3Pt. Contested by Ja Simmons (5.8 feet, ZONE). KLAY HOLIDAY MAKES IT! Assist: Tobias Bridges
Score: 75-102

[02:45] Team_064 possession (Score: 75-102)
Austin Smith drives, picks up Ja Stewart. Help arrives from Tobias Bridges! Austin Smith attempts a Dunk. Contested by Tobias Bridges (4.3 feet, ZONE). Austin Smith misses. Rebound secured by Klay Holiday.

[02:34] Team_017 possession (Score: 75-102)
Shaquille Stewart attempts a 3Pt. Wide open! Tobias Herro is 6.4 feet away. [ZONE] Shaquille Stewart misses. Offensive rebound by Ja Stewart! Ja Stewart kicks it out.

[02:19] Team_017 possession (Score: 75-102)
Blake Reaves attempts a Layup. Wide open! CJ Haliburton is 6.2 feet away. [MAN] BLAKE REAVES MAKES IT! Assist: Tobias Bridges
Score: 75-104

[02:04] Team_064 possession (Score: 75-104)
Austin Smith attempts a 3Pt. Contested by Ja Stewart (4.3 feet, MAN). Austin Smith misses. Rebound secured by Klay Holiday.

[01:54] Team_017 possession (Score: 75-104)
Blake Reaves throws a bad pass! Stolen by CJ Haliburton! TURNOVER! (live ball)

[01:41] Team_064 possession (Score: 75-104)
Ja Simmons drives and kicks out. CJ Haliburton attempts a 3Pt. Contested by Tobias Bridges (4.0 feet, ZONE). CJ Haliburton misses. Rebound secured by Ja Stewart.

[01:25] Team_017 possession (Score: 75-104)
Shaquille Stewart drives and kicks out. Shaquille Stewart attempts a 3Pt. Contested by Austin Smith (4.6 feet, ZONE). Shaquille Stewart misses. Rebound secured by Austin Smith.

[01:10] Team_064 possession (Score: 75-104)
FOUL! Shooting foul on Ja Stewart. Ja Simmons to the line for 3 free throws. [BONUS: 6 team fouls] (Ja Stewart: 2 personal fouls)   FT 1/3: GOOD   FT 2/3: MISS   FT 3/3: MISS Ja Simmons makes 1/3 from the line. Offensive rebound by Ja Simmons! Ja Simmons kicks it out.
Score: 76-104

[00:57] Team_064 possession (Score: 76-104)
Ja Simmons attempts a 3Pt. Contested by Tobias Bridges (3.9 feet, ZONE). Ja Simmons misses. Rebound secured by Shaquille Stewart.

[00:41] Team_017 possession (Score: 76-104)
Blake Reaves attempts a 3Pt. Wide open! CJ Haliburton is 6.3 feet away. [MAN] Blake Reaves misses. Rebound secured by Ja Simmons.

[00:25] Team_064 possession (Score: 76-104)
Ja Simmons attempts a 3Pt. Contested by Tobias Bridges (3.9 feet, MAN). JA SIMMONS MAKES IT! Assist: Austin Smith
Score: 79-104

[00:11] Team_017 possession (Score: 79-104)
Shaquille Stewart drives, Tobias Herro stays with him. Shaquille Stewart attempts a Layup. Wide open! Tobias Herro is 6.4 feet away. [MAN] Shaquille Stewart misses. Offensive rebound by Ja Stewart! Ja Stewart kicks it out.

================================================================================
                              4TH QUARTER COMPLETE                              
================================================================================

4TH QUARTER SCORE: Team_064 15, Team_017 24

BOX SCORE:
================================================================================

Team_064
--------------------------------------------------------------------------------
Player                MIN  PTS  REB  AST  TO      FG   FG%      3P   3P%
--------------------------------------------------------------------------------
Austin Smith            8    5    2    1   0   2/4    50.0     0/0   0.0
CJ Haliburton          14    3    0    0   0   1/4    25.0     0/0   0.0
Ja Simmons              8    3    4    2   0   1/3    33.3     0/0   0.0
Tobias Herro            8    3    0    0   0   1/1   100.0     0/0   0.0
Jordan Mitchell        40    0    1    0   0   0/2     0.0     0/0   0.0
Russell Simons         40    0    2    0   0   0/1     0.0     0/0   0.0
Kawhi Irving           40    0    2    0   0   0/3     0.0     0/0   0.0
Shai Hyland            40    0    1    0   0   0/1     0.0     0/0   0.0
Devin Cunningham        8    0    0    1   0   0/0     0.0     0/0   0.0

TEAM: FG: 5/19 (26.3%), 3PT: 2/13 (15.4%), REB: 12 (3 off, 9 def), AST: 4, TO: 2
TEAM FOULS: 4


Team_017
--------------------------------------------------------------------------------
Player                MIN  PTS  REB  AST  TO      FG   FG%      3P   3P%
--------------------------------------------------------------------------------
Blake Reaves           14    8    0    1   0   3/5    60.0     0/0   0.0
Tony Smith             40    5    3    0   0   2/3    66.7     0/0   0.0
Klay Holiday            8    5    3    0   0   2/2   100.0     0/0   0.0
Vince Banchero         40    2    0    1   0   1/3    33.3     0/0   0.0
Ja Stewart              8    2    4    0   0   1/1   100.0     0/0   0.0
Bam Williamson         40    0    1    1   0   0/0     0.0     0/0   0.0
Kyrie Middleton        40    0    4    1   0   0/1     0.0     0/0   0.0
Shaquille Stewart       8    0    2    2   0   0/1     0.0     0/0   0.0
Tobias Bridges          8    0    0    2   0   0/2     0.0     0/0   0.0

TEAM: FG: 9/18 (50.0%), 3PT: 3/9 (33.3%), REB: 17 (3 off, 14 def), AST: 8, TO: 2
TEAM FOULS: 6 [Team_064 in BONUS]

================================================================================

================================================================================
                               FULL GAME COMPLETE                               
================================================================================

FINAL SCORE: Team_064 79, Team_017 104

SCORING BY QUARTER:
--------------------------------------------------------------------------------
Team                     Q1     Q2     Q3     Q4    FINAL
--------------------------------------------------------------------------------
Team_064                 21     19     24     15       79
Team_017                 18     32     30     24      104
--------------------------------------------------------------------------------

FULL GAME BOX SCORE:
================================================================================

Team_064
--------------------------------------------------------------------------------
Player                MIN  PTS  REB  AST  TO      FG   FG%      3P   3P%      FT STL BLK
--------------------------------------------------------------------------------
Jordan Mitchell        40   10    2    3   1   4/11   36.4   2/6    33.3   7/11    0   1
Kawhi Irving           40   14   13    2   1   7/15   46.7   3/9    33.3   1/2     1   0
Russell Simons         40    9   17    1   2   4/9    44.4   1/4    25.0   5/8     1   1
Shai Hyland            40    6    4    6   3   3/10   30.0   0/3     0.0   2/2     2   0
Ja Mitchell            35   20    0    2   1   7/13   53.8   2/6    33.3   3/3     0   0
CJ Haliburton          14    3    0    0   2   1/4    25.0   1/4    25.0   0/0     1   0
Ja Simmons              8    3    4    2   0   2/5    40.0   1/2    50.0   1/3     0   0
Tobias Herro            8    3    0    0   0   0/0     0.0   0/0     0.0   0/0     0   0
Austin Smith            8    7    4    1   0   3/6    50.0   0/2     0.0   1/1     0   0
Devin Cunningham        8    0    0    1   0   0/0     0.0   0/0     0.0   0/0     0   0

TEAM: FG: 32/74 (43.2%), 3PT: 10/36 (27.8%), REB: 44 (13 off, 31 def), AST: 18, TO: 10


Team_017
--------------------------------------------------------------------------------
Player                MIN  PTS  REB  AST  TO      FG   FG%      3P   3P%      FT STL BLK
--------------------------------------------------------------------------------
Vince Banchero         40   13    0    4   0   4/9    44.4   2/3    66.7   0/1     0   1
Tony Smith             40   19    7    5   1   8/12   66.7   3/6    50.0   2/2     1   0
Kyrie Middleton        40   13   20    5   0   5/13   38.5   1/3    33.3   2/4     0   0
Bam Williamson         40   23   15    4   2  11/15   73.3   0/2     0.0   1/1     1   1
Desmond Reaves         35   15    0    1   1   6/12   50.0   2/3    66.7   3/3     1   0
Blake Reaves           14    8    0    1   2   3/5    60.0   1/3    33.3   1/1     0   0
Tobias Bridges          8    0    0    2   0   0/2     0.0   0/2     0.0   0/0     0   0
Shaquille Stewart       8    0    2    2   0   0/1     0.0   0/0     0.0   0/0     0   0
Ja Stewart              8    4    5    0   0   2/2   100.0   0/0     0.0   0/0     0   0
Klay Holiday            8    7    4    0   0   3/4    75.0   1/1   100.0   0/0     0   0

TEAM: FG: 43/76 (56.6%), 3PT: 10/23 (43.5%), REB: 53 (11 off, 42 def), AST: 24, TO: 6

================================================================================
