================================================================================
                        FULL GAME - Team_005 vs Team_028                        
================================================================================

================================================================================
                       1ST QUARTER - Team_005 vs Team_028                       
================================================================================

[12:00] Team_005 possession (Score: 0-0)
Derrick Allen attempts a Layup. Contested by Myles Haliburton (4.0 feet, MAN). DERRICK ALLEN MAKES IT!
Score: 2-0

[11:41] Team_028 possession (Score: 2-0)
Austin Russell attempts a 3Pt. Contested by Brandon George (5.0 feet, MAN). Austin Russell misses. Rebound secured by Derrick Allen.

[11:23] Team_005 possession (Score: 2-0)
Jalen Rozier drives to the basket... Jalen Rozier throws a bad pass out of bounds! TURNOVER! (dead ball)

[11:10] Team_028 possession (Score: 2-0)
Myles Haliburton attempts a Layup. Contested by Derrick Allen (4.3 feet, MAN). MYLES HALIBURTON MAKES IT! Assist: Carmelo Carter
Score: 2-2

[10:51] Team_005 possession (Score: 2-2)
Anthony Rozier attempts a Midrange. Contested by Kawhi Ball (4.3 feet, ZONE). Anthony Rozier misses. Rebound secured by Kawhi Ball.

[10:41] Team_028 possession (Score: 2-2)
FOUL! Offensive foul on Jimmy Brogdon! Cade Markkanen drew the charge! [Team fouls: 1] (Jimmy Brogdon: 1 personal fouls) TURNOVER! (dead ball)

[10:26] Team_005 possession (Score: 2-2)
Brandon George attempts a 3Pt. Contested by Austin Russell (4.6 feet, MAN). Brandon George misses. Rebound secured by Carmelo Carter.

[10:11] Team_028 possession (Score: 2-2)
Myles Haliburton attempts a Midrange. Contested by Anthony Rozier (4.7 feet, ZONE). MYLES HALIBURTON MAKES IT! Assist: Austin Russell
Score: 2-4

[09:55] Team_005 possession (Score: 2-4)
FOUL! Shooting foul on Kawhi Ball. Cade Markkanen to the line for 2 free throws. [Team fouls: 2] (Kawhi Ball: 1 personal fouls)   FT 1/2: GOOD   FT 2/2: GOOD Cade Markkanen makes 2/2 from the line.
Score: 4-4

[09:43] Team_028 possession (Score: 4-4)
Myles Haliburton attempts a 3Pt. Contested by Derrick Allen (4.3 feet, MAN). MYLES HALIBURTON MAKES IT! Assist: Austin Russell
Score: 4-7

[09:32] Team_005 possession (Score: 4-7)
Cade Markkanen drives, Jimmy Brogdon stays with him. Cade Markkanen attempts a Dunk. Contested by Jimmy Brogdon (4.1 feet, MAN). CADE MARKKANEN MAKES IT!
Score: 6-7

[09:14] Team_028 possession (Score: 6-7)
Myles Haliburton commits a violation (traveling/carry)! TURNOVER! (dead ball)

[08:59] Team_005 possession (Score: 6-7)
Anthony Rozier attempts a Layup. Contested by Carmelo Carter (4.5 feet, MAN). ANTHONY ROZIER MAKES IT! Assist: Brandon George
Score: 8-7

[08:47] Team_028 possession (Score: 8-7)
Austin Russell drives to the basket... Austin Russell loses control! Ball rolls out of bounds! TURNOVER! (dead ball)

[08:30] Team_005 possession (Score: 8-7)
Jalen Rozier attempts a Layup. Contested by Kawhi Ball (4.5 feet, ZONE). Jalen Rozier misses. Rebound secured by Kawhi Ball.

[08:16] Team_028 possession (Score: 8-7)
Austin Russell drives, Brandon George stays with him. Austin Russell attempts a Layup. Contested by Brandon George (5.0 feet, MAN). AUSTIN RUSSELL MAKES IT! Assist: Kawhi Ball
Score: 8-9

[08:01] Team_005 possession (Score: 8-9)
Jalen Rozier attempts a 3Pt. Contested by Austin Russell (4.8 feet, ZONE). Jalen Rozier misses. Rebound secured by Carmelo Carter.

[07:51] Team_028 possession (Score: 8-9)
Austin Russell attempts a 3Pt. Contested by Brandon George (5.0 feet, MAN). AUSTIN RUSSELL MAKES IT! Assist: Carmelo Carter
Score: 8-12

[07:40] Team_005 possession (Score: 8-12)
Cade Markkanen loses control! Ball rolls out of bounds! TURNOVER! (dead ball)

[07:26] Team_028 possession (Score: 8-12)
Jimmy Brogdon throws a bad pass! Stolen by Cade Markkanen! TURNOVER! (live ball)

[07:11] Team_005 possession (Score: 8-12)
Jalen Rozier attempts a Midrange. Contested by Myles Haliburton (3.9 feet, ZONE). Jalen Rozier misses. Rebound secured by Jimmy Brogdon.

[06:59] Team_028 possession (Score: 8-12)
Austin Russell drives and kicks out. FOUL! Shooting foul on Cade Markkanen. Jimmy Brogdon to the line for 2 free throws. [Team fouls: 1] (Cade Markkanen: 1 personal fouls)   FT 1/2: GOOD   FT 2/2: GOOD Jimmy Brogdon makes 2/2 from the line.
Score: 8-14

[06:43] Team_005 possession (Score: 8-14)
Derrick Allen drives and kicks out. Jalen Rozier attempts a 3Pt. Contested by Kawhi Ball (4.2 feet, MAN). Jalen Rozier misses. Rebound secured by Kawhi Ball.

[06:29] Team_028 possession (Score: 8-14)
FOUL! Reach-in foul on Cade Markkanen during the drive. [Team fouls: 2] No free throws, side out. (Cade Markkanen: 2 personal fouls)

[06:12] Team_028 possession (Score: 8-14)
Carmelo Carter attempts a Midrange. Contested by Anthony Rozier (4.9 feet, MAN). CARMELO CARTER MAKES IT! Assist: Kawhi Ball
Score: 8-16

[05:54] Team_005 possession (Score: 8-16)
Cade Markkanen drives to the basket... Cade Markkanen throws a bad pass out of bounds! TURNOVER! (dead ball)

[05:40] Team_028 possession (Score: 8-16)
Carmelo Carter attempts a 3Pt. Contested by Derrick Allen (4.6 feet, ZONE). Carmelo Carter misses. Rebound secured by Cade Markkanen.

[05:24] Team_005 possession (Score: 8-16)
Cade Markkanen attempts a Midrange. BLOCKED BY CARMELO CARTER! Ball deflects out of bounds off Cade Markkanen.

[05:11] Team_028 possession (Score: 8-16)
Austin Russell drives, picks up Brandon George. Help arrives from Anthony Rozier! Austin Russell attempts a Layup. Contested by Anthony Rozier (5.1 feet, MAN). AUSTIN RUSSELL MAKES IT! Assist: Jimmy Brogdon
Score: 8-18

[04:54] Team_005 possession (Score: 8-18)
Derrick Allen attempts a 3Pt. Contested by Myles Haliburton (4.0 feet, MAN). DERRICK ALLEN MAKES IT! Assist: Anthony Rozier
Score: 11-18

[04:39] Team_028 possession (Score: 11-18)
Myles Haliburton drives to the basket... Myles Haliburton loses the ball! Stripped by Cade Markkanen! TURNOVER! (live ball)

[04:22] Team_005 possession (Score: 11-18)
Derrick Allen attempts a 3Pt. Contested by Austin Russell (4.9 feet, ZONE). Derrick Allen misses. Rebound secured by Carmelo Carter.

[04:10] Team_028 possession (Score: 11-18)
Austin Russell attempts a Midrange. Contested by Anthony Rozier (4.6 feet, ZONE). Austin Russell misses. Rebound secured by Jalen Rozier.

[03:55] Team_005 possession (Score: 11-18)
FOUL! Holding foul on Kawhi Ball. [Team fouls: 3] No free throws, side out. (Kawhi Ball: 2 personal fouls)

[03:43] Team_005 possession (Score: 11-18)
Jalen Rozier drives to the basket... Jalen Rozier loses control! Ball rolls out of bounds! TURNOVER! (dead ball)

[03:27] Team_028 possession (Score: 11-18)
Austin Russell attempts a 3Pt. Contested by Brandon George (5.2 feet, MAN). AUSTIN RUSSELL MAKES IT! Assist: Kawhi Ball
Score: 11-21

[03:12] Team_005 possession (Score: 11-21)
Jalen Rozier drives and kicks out. Anthony Rozier attempts a 3Pt. Contested by Carmelo Carter (4.6 feet, MAN). Anthony Rozier misses. Rebound secured by Kawhi Ball.

[02:59] Team_028 possession (Score: 11-21)
FOUL! Shooting foul on Anthony Rozier. Carmelo Carter to the line for 3 free throws. [Team fouls: 3] (Anthony Rozier: 1 personal fouls)   FT 1/3: MISS   FT 2/3: GOOD   FT 3/3: GOOD Carmelo Carter makes 2/3 from the line.
Score: 11-23

[02:45] Team_005 possession (Score: 11-23)
Brandon George attempts a 3Pt. Contested by Austin Russell (4.8 feet, MAN). Brandon George misses. Rebound secured by Jimmy Brogdon.

[02:33] Team_028 possession (Score: 11-23)
Kawhi Ball attempts a Midrange. Contested by Jalen Rozier (5.3 feet, MAN). Kawhi Ball misses. Offensive rebound by Jimmy Brogdon! Jimmy Brogdon kicks it out.

[02:21] Team_028 possession (Score: 11-23)
FOUL! Holding foul on Brandon George. [Team fouls: 4] No free throws, side out. (Brandon George: 1 personal fouls)

[02:10] Team_028 possession (Score: 11-23)
Kawhi Ball attempts a 3Pt. Contested by Anthony Rozier (5.1 feet, ZONE). Kawhi Ball misses. Rebound secured by Cade Markkanen.

[01:56] Team_005 possession (Score: 11-23)
Cade Markkanen attempts a Midrange. Contested by Jimmy Brogdon (4.4 feet, MAN). CADE MARKKANEN MAKES IT! Assist: Derrick Allen
Score: 13-23

[01:43] Team_028 possession (Score: 13-23)
Jimmy Brogdon attempts a 3Pt. Contested by Derrick Allen (5.0 feet, ZONE). Jimmy Brogdon misses. Rebound secured by Cade Markkanen.

[01:27] Team_005 possession (Score: 13-23)
Cade Markkanen makes the Dunk and draws the foul on Kawhi Ball! And-1! Cade Markkanen to the line for 1. [Team fouls: 4] (Kawhi Ball: 3 personal fouls)   FT 1/1: GOOD Cade Markkanen makes 1/1 from the line.
Score: 16-23

[01:11] Team_028 possession (Score: 16-23)
FOUL! Shooting foul on Anthony Rozier. Austin Russell to the line for 2 free throws. [BONUS: 5 team fouls] (Anthony Rozier: 2 personal fouls)   FT 1/2: GOOD   FT 2/2: GOOD Austin Russell makes 2/2 from the line.
Score: 16-25

[00:59] Team_005 possession (Score: 16-25)
Jalen Rozier attempts a Midrange. Contested by Myles Haliburton (4.3 feet, ZONE). JALEN ROZIER MAKES IT! Assist: Anthony Rozier
Score: 18-25

[00:48] Team_028 possession (Score: 18-25)
Austin Russell drives and kicks out. Myles Haliburton attempts a 3Pt. Contested by Derrick Allen (4.7 feet, MAN). Myles Haliburton misses. Rebound secured by Cade Markkanen.

[00:32] Team_005 possession (Score: 18-25)
Jalen Rozier attempts a 3Pt. Contested by Austin Russell (5.2 feet, ZONE). JALEN ROZIER MAKES IT! Assist: Anthony Rozier
Score: 21-25

[00:18] Team_028 possession (Score: 21-25)
Kawhi Ball attempts a 3Pt. Contested by Jalen Rozier (5.5 feet, MAN). Kawhi Ball misses. Rebound secured by Derrick Allen.

[00:03] Team_005 possession (Score: 21-25)
Anthony Rozier makes the Dunk and draws the foul on Carmelo Carter! And-1! Anthony Rozier to the line for 1. [BONUS: 5 team fouls] (Carmelo Carter: 1 personal fouls)   FT 1/1: MISS Anthony Rozier makes 0/1 from the line. Rebound secured by Kawhi Ball.
Score: 23-25

================================================================================
                              1ST QUARTER COMPLETE                              
================================================================================

1ST QUARTER SCORE: Team_005 23, Team_028 25

BOX SCORE:
================================================================================

Team_005
--------------------------------------------------------------------------------
Player                MIN  PTS  REB  AST  TO      FG   FG%      3P   3P%
--------------------------------------------------------------------------------
Cade Markkanen         12    9    4    0   0   4/5    80.0     0/0   0.0
Derrick Allen          12    5    2    1   0   2/4    50.0     0/0   0.0
Jalen Rozier           12    5    1    0   0   2/6    33.3     0/0   0.0
Anthony Rozier         12    2    0    3   0   1/3    33.3     0/0   0.0
Brandon George         12    0    0    1   0   0/2     0.0     0/0   0.0

TEAM: FG: 9/20 (45.0%), 3PT: 2/6 (33.3%), REB: 7 (0 off, 7 def), AST: 5, TO: 4
TEAM FOULS: 5 [Team_028 in BONUS]


Team_028
--------------------------------------------------------------------------------
Player                MIN  PTS  REB  AST  TO      FG   FG%      3P   3P%
--------------------------------------------------------------------------------
Austin Russell         12   12    0    2   0   5/8    62.5     0/0   0.0
Myles Haliburton       12    7    0    0   0   3/3   100.0     0/0   0.0
Carmelo Carter         12    4    3    2   0   2/3    66.7     0/0   0.0
Jimmy Brogdon          12    2    3    1   0   1/2    50.0     0/0   0.0
Kawhi Ball             12    0    5    3   0   0/2     0.0     0/0   0.0

TEAM: FG: 11/18 (61.1%), 3PT: 4/9 (44.4%), REB: 11 (1 off, 10 def), AST: 8, TO: 5
TEAM FOULS: 5 [Team_005 in BONUS]

================================================================================

================================================================================
                       2ND QUARTER - Team_005 vs Team_028                       
================================================================================

[12:00] Team_005 possession (Score: 23-25)
Jalen Rozier drives, picks up Kawhi Ball. Help arrives from Carmelo Carter! Jalen Rozier attempts a Dunk. Contested by Carmelo Carter (4.9 feet, ZONE). JALEN ROZIER MAKES IT!
Score: 25-25

[11:45] Team_028 possession (Score: 25-25)
Carmelo Carter drives, picks up Anthony Rozier. Help arrives from Derrick Allen! Carmelo Carter attempts a Layup. Contested by Derrick Allen (5.3 feet, MAN). Carmelo Carter misses. Rebound secured by Cade Markkanen.

[11:34] Team_005 possession (Score: 25-25)
Cade Markkanen attempts a Midrange. Contested by Jimmy Brogdon (4.5 feet, MAN). CADE MARKKANEN MAKES IT! Assist: Derrick Allen
Score: 27-25

[11:17] Team_028 possession (Score: 27-25)
Austin Russell drives to the basket... Austin Russell loses control! Ball rolls out of bounds! TURNOVER! (dead ball)

[11:17] Substitution (Team_005): Brandon George OUT → Blake O'Neal IN (stamina_rule2)

[11:17] Substitution (Team_005): Anthony Rozier OUT → Draymond Smith IN (stamina_rule2)

[11:17] Substitution (Team_005): Derrick Allen OUT → Lauri Wade IN (stamina_rule2)

[11:17] Substitution (Team_005): Jalen Rozier OUT → Isaiah Durant IN (stamina_rule2)

[11:17] Substitution (Team_005): Cade Markkanen OUT → Zion Parker IN (stamina_rule2)

[11:17] Substitution (Team_028): Austin Russell OUT → Scottie Ingram IN (stamina_rule2)

[11:17] Substitution (Team_028): Carmelo Carter OUT → Tyrese Quickley IN (stamina_rule2)

[11:17] Substitution (Team_028): Myles Haliburton OUT → Miles Booker IN (stamina_rule2)

[11:17] Substitution (Team_028): Kawhi Ball OUT → Bam Towns IN (stamina_rule2)

[11:17] Substitution (Team_028): Jimmy Brogdon OUT → Collin Bridges IN (stamina_rule2)

[10:59] Team_005 possession (Score: 27-25)
Lauri Wade attempts a 3Pt. Contested by Scottie Ingram (5.6 feet, ZONE). Lauri Wade misses. Rebound secured by Tyrese Quickley.

[10:45] Team_028 possession (Score: 27-25)
Tyrese Quickley throws a bad pass out of bounds! TURNOVER! (dead ball)

[10:28] Team_005 possession (Score: 27-25)
Draymond Smith throws a bad pass out of bounds! TURNOVER! (dead ball)

[10:17] Team_028 possession (Score: 27-25)
Tyrese Quickley drives and kicks out. Miles Booker attempts a 3Pt. Contested by Blake O'Neal (4.1 feet, ZONE). Miles Booker misses. Rebound secured by Zion Parker.

[10:03] Team_005 possession (Score: 27-25)
Draymond Smith attempts a 3Pt. Contested by Tyrese Quickley (4.2 feet, ZONE). DRAYMOND SMITH MAKES IT! Assist: Blake O'Neal
Score: 30-25

[09:50] Team_028 possession (Score: 30-25)
Miles Booker drives and kicks out. Scottie Ingram attempts a 3Pt. Contested by Lauri Wade (5.0 feet, ZONE). Scottie Ingram misses. Rebound secured by Draymond Smith.

[09:35] Team_005 possession (Score: 30-25)
Blake O'Neal attempts a 3Pt. Contested by Scottie Ingram (5.9 feet, ZONE). Blake O'Neal misses. Offensive rebound by Zion Parker! Zion Parker puts it back in!
Score: 32-25

[09:19] Team_028 possession (Score: 32-25)
FOUL! Shooting foul on Zion Parker. Collin Bridges to the line for 2 free throws. [Team fouls: 1] (Zion Parker: 1 personal fouls)   FT 1/2: GOOD   FT 2/2: GOOD Collin Bridges makes 2/2 from the line.
Score: 32-27

[09:03] Team_005 possession (Score: 32-27)
FOUL! Offensive foul on Isaiah Durant! Collin Bridges drew the charge! [Team fouls: 2] (Isaiah Durant: 1 personal fouls) TURNOVER! (dead ball)

[08:51] Team_028 possession (Score: 32-27)
Scottie Ingram attempts a 3Pt. Contested by Blake O'Neal (4.1 feet, MAN). Scottie Ingram misses. Rebound secured by Zion Parker.

[08:38] Team_005 possession (Score: 32-27)
Zion Parker attempts a Layup. Contested by Collin Bridges (3.8 feet, MAN). ZION PARKER MAKES IT! Assist: Blake O'Neal
Score: 34-27

[08:21] Team_028 possession (Score: 34-27)
Collin Bridges attempts a Midrange. Contested by Zion Parker (4.2 feet, MAN). COLLIN BRIDGES MAKES IT!
Score: 34-29

[08:05] Team_005 possession (Score: 34-29)
Zion Parker drives and kicks out. Zion Parker attempts a 3Pt. Contested by Scottie Ingram (5.5 feet, ZONE). Zion Parker misses. Offensive rebound by Zion Parker! Zion Parker puts it back in!
Score: 36-29

[07:49] Team_028 possession (Score: 36-29)
Scottie Ingram attempts a Layup. Contested by Blake O'Neal (4.1 feet, MAN). SCOTTIE INGRAM MAKES IT! Assist: Miles Booker
Score: 36-31

[07:35] Team_005 possession (Score: 36-31)
FOUL! Reach-in foul on Bam Towns during the drive. [Team fouls: 1] No free throws, side out. (Bam Towns: 1 personal fouls)

[07:18] Team_005 possession (Score: 36-31)
Blake O'Neal makes the Layup and draws the foul on Collin Bridges! And-1! Blake O'Neal to the line for 1. [Team fouls: 2] (Collin Bridges: 1 personal fouls)   FT 1/1: GOOD Blake O'Neal makes 1/1 from the line.
Score: 39-31

[07:05] Team_028 possession (Score: 39-31)
Scottie Ingram attempts a 3Pt. Contested by Blake O'Neal (4.1 feet, ZONE). Scottie Ingram misses. Rebound secured by Zion Parker.

[06:50] Team_005 possession (Score: 39-31)
Blake O'Neal attempts a Midrange. Contested by Scottie Ingram (5.9 feet, MAN). BLAKE O'NEAL MAKES IT! Assist: Draymond Smith
Score: 41-31

[06:33] Team_028 possession (Score: 41-31)
Collin Bridges attempts a Midrange. Contested by Lauri Wade (5.3 feet, ZONE). Collin Bridges misses. Offensive rebound by Collin Bridges! Collin Bridges kicks it out.

[06:15] Team_028 possession (Score: 41-31)
FOUL! Reach-in foul on Lauri Wade during the drive. [Team fouls: 3] No free throws, side out. (Lauri Wade: 1 personal fouls)

[05:58] Team_028 possession (Score: 41-31)
Tyrese Quickley attempts a 3Pt. Contested by Draymond Smith (4.5 feet, MAN). Tyrese Quickley misses. Offensive rebound by Bam Towns! Bam Towns kicks it out.

[05:44] Team_028 possession (Score: 41-31)
Collin Bridges attempts a Layup. BLOCKED BY ZION PARKER! Ball is loose! Rebound secured by Draymond Smith.

[05:29] Team_005 possession (Score: 41-31)
Blake O'Neal attempts a 3Pt. Contested by Scottie Ingram (5.9 feet, ZONE). BLAKE O'NEAL MAKES IT! Assist: Zion Parker
Score: 44-31

[05:18] Team_028 possession (Score: 44-31)
Collin Bridges drives and kicks out. Miles Booker attempts a Midrange. Contested by Lauri Wade (5.0 feet, MAN). MILES BOOKER MAKES IT!
Score: 44-33

[05:07] Team_005 possession (Score: 44-33)
FOUL! Offensive foul on Draymond Smith! Tyrese Quickley drew the charge! [Team fouls: 4] (Draymond Smith: 1 personal fouls) TURNOVER! (dead ball)

[04:55] Team_028 possession (Score: 44-33)
Collin Bridges attempts a Layup. Contested by Zion Parker (4.2 feet, MAN). COLLIN BRIDGES MAKES IT!
Score: 44-35

[04:39] Team_005 possession (Score: 44-35)
FOUL! Reach-in foul on Collin Bridges during the drive. [Team fouls: 3] No free throws, side out. (Collin Bridges: 2 personal fouls)

[04:27] Team_005 possession (Score: 44-35)
Isaiah Durant attempts a 3Pt. Contested by Scottie Ingram (5.8 feet, ZONE). Isaiah Durant misses. Rebound secured by Bam Towns.

[04:10] Team_028 possession (Score: 44-35)
Scottie Ingram attempts a 3Pt. Contested by Blake O'Neal (4.1 feet, MAN). Scottie Ingram misses. FOUL! Loose ball foul on Draymond Smith during the rebound battle. [IN THE BONUS! 5 team fouls] Bam Towns to the line for 2 free throws. (Draymond Smith: 2 personal fouls)   FT 1/2: GOOD   FT 2/2: GOOD Bam Towns makes 2/2 from the line.
Score: 44-37

[03:52] Team_005 possession (Score: 44-37)
Blake O'Neal drives, Scottie Ingram stays with him. Blake O'Neal attempts a Dunk. Contested by Scottie Ingram (5.9 feet, MAN). Blake O'Neal misses. Offensive rebound by Draymond Smith! Draymond Smith kicks it out.

[03:36] Team_005 possession (Score: 44-37)
Isaiah Durant attempts a Layup. Contested by Bam Towns (5.4 feet, ZONE). Isaiah Durant misses. Rebound secured by Bam Towns.

[03:20] Team_028 possession (Score: 44-37)
FOUL! Shooting foul on Isaiah Durant. Bam Towns to the line for 2 free throws. [BONUS: 6 team fouls] (Isaiah Durant: 2 personal fouls)   FT 1/2: MISS   FT 2/2: GOOD Bam Towns makes 1/2 from the line.
Score: 44-38

[03:05] Team_005 possession (Score: 44-38)
FOUL! Reach-in foul on Scottie Ingram during the drive. [Team fouls: 4] No free throws, side out. (Scottie Ingram: 1 personal fouls)

[02:51] Team_005 possession (Score: 44-38)
Lauri Wade attempts a 3Pt. Wide open! Miles Booker is 6.0 feet away. [MAN] Lauri Wade misses. Rebound secured by Tyrese Quickley.

[02:36] Team_028 possession (Score: 44-38)
Bam Towns drives and kicks out. Tyrese Quickley attempts a 3Pt. Contested by Draymond Smith (4.4 feet, MAN). TYRESE QUICKLEY MAKES IT! Assist: Miles Booker
Score: 44-41

[02:20] Team_005 possession (Score: 44-41)
Isaiah Durant drives and kicks out. Draymond Smith attempts a Midrange. Contested by Tyrese Quickley (4.6 feet, MAN). Draymond Smith misses. Rebound secured by Collin Bridges.

[02:06] Team_028 possession (Score: 44-41)
Bam Towns attempts a Midrange. Contested by Isaiah Durant (4.6 feet, MAN). Bam Towns misses. Rebound secured by Draymond Smith.

[01:51] Team_005 possession (Score: 44-41)
FOUL! Shooting foul on Tyrese Quickley. Draymond Smith to the line for 2 free throws. [BONUS: 5 team fouls] (Tyrese Quickley: 1 personal fouls)   FT 1/2: GOOD   FT 2/2: MISS Draymond Smith makes 1/2 from the line. Rebound secured by Tyrese Quickley.
Score: 45-41

[01:40] Team_028 possession (Score: 45-41)
Bam Towns attempts a 3Pt. Contested by Isaiah Durant (4.6 feet, MAN). Bam Towns misses. Offensive rebound by Bam Towns! Bam Towns kicks it out.

[01:30] Team_028 possession (Score: 45-41)
FOUL! Reach-in foul on Draymond Smith during the drive. [IN THE BONUS! 7 team fouls] Tyrese Quickley to the line for 2 free throws. (Draymond Smith: 3 personal fouls)   FT 1/2: GOOD   FT 2/2: GOOD Tyrese Quickley makes 2/2 from the line.
Score: 45-43

[01:13] Team_005 possession (Score: 45-43)
Isaiah Durant attempts a Layup. Contested by Collin Bridges (4.3 feet, ZONE). ISAIAH DURANT MAKES IT! Assist: Zion Parker
Score: 47-43

[00:59] Team_028 possession (Score: 47-43)
FOUL! Holding foul on Draymond Smith. [IN THE BONUS! 8 team fouls] Tyrese Quickley to the line for 2 free throws. (Draymond Smith: 4 personal fouls)   FT 1/2: GOOD   FT 2/2: GOOD Tyrese Quickley makes 2/2 from the line.
Score: 47-45

[00:48] Team_005 possession (Score: 47-45)
Zion Parker drives and kicks out. FOUL! Shooting foul on Collin Bridges. Zion Parker to the line for 2 free throws. [BONUS: 6 team fouls] (Collin Bridges: 3 personal fouls)   FT 1/2: MISS   FT 2/2: GOOD Zion Parker makes 1/2 from the line.
Score: 48-45

[00:33] Team_028 possession (Score: 48-45)
Tyrese Quickley attempts a 3Pt. Contested by Draymond Smith (4.8 feet, MAN). Tyrese Quickley misses. Rebound secured by Lauri Wade.

[00:19] Team_005 possession (Score: 48-45)
Zion Parker attempts a Midrange. Contested by Bam Towns (5.4 feet, ZONE). Zion Parker misses. Rebound secured by Bam Towns.

[00:07] Team_028 possession (Score: 48-45)
Bam Towns drives, Zion Parker stays with him. Bam Towns attempts a Layup. Contested by Zion Parker (4.5 feet, ZONE). BAM TOWNS MAKES IT! Assist: Tyrese Quickley
Score: 48-47

================================================================================
                              2ND QUARTER COMPLETE                              
================================================================================

2ND QUARTER SCORE: Team_005 25, Team_028 22

BOX SCORE:
================================================================================

Team_005
--------------------------------------------------------------------------------
Player                MIN  PTS  REB  AST  TO      FG   FG%      3P   3P%
--------------------------------------------------------------------------------
Blake O'Neal           11    8    0    2   0   3/3   100.0     0/0   0.0
Zion Parker            11    7    5    2   0   4/5    80.0     0/0   0.0
Draymond Smith         11    3    4    1   0   1/2    50.0     0/0   0.0
Jalen Rozier           13    2    0    0   0   1/1   100.0     0/0   0.0
Cade Markkanen         13    2    1    0   0   1/1   100.0     0/0   0.0
Isaiah Durant          11    2    0    0   0   1/4    25.0     0/0   0.0
Derrick Allen          13    0    0    1   0   0/0     0.0     0/0   0.0
Lauri Wade             11    0    1    0   0   0/2     0.0     0/0   0.0

TEAM: FG: 11/18 (61.1%), 3PT: 3/6 (50.0%), REB: 11 (3 off, 8 def), AST: 6, TO: 3
TEAM FOULS: 8 [Team_028 in BONUS]


Team_028
--------------------------------------------------------------------------------
Player                MIN  PTS  REB  AST  TO      FG   FG%      3P   3P%
--------------------------------------------------------------------------------
Tyrese Quickley        11    7    3    1   0   3/5    60.0     0/0   0.0
Collin Bridges         11    6    2    0   0   3/4    75.0     0/0   0.0
Bam Towns              11    5    5    0   0   3/4    75.0     0/0   0.0
Miles Booker           11    2    0    2   0   1/2    50.0     0/0   0.0
Scottie Ingram         11    2    0    0   0   1/3    33.3     0/0   0.0
Carmelo Carter         13    0    0    0   0   0/1     0.0     0/0   0.0

TEAM: FG: 11/19 (57.9%), 3PT: 1/4 (25.0%), REB: 10 (3 off, 7 def), AST: 3, TO: 2
TEAM FOULS: 6 [Team_005 in BONUS]

================================================================================

================================================================================
                       3RD QUARTER - Team_005 vs Team_028                       
================================================================================

[12:00] Team_005 possession (Score: 48-47)
FOUL! Shooting foul on Carmelo Carter. Cade Markkanen to the line for 2 free throws. [Team fouls: 1] (Carmelo Carter: 1 personal fouls)   FT 1/2: GOOD   FT 2/2: GOOD Cade Markkanen makes 2/2 from the line.
Score: 50-47

[11:43] Team_028 possession (Score: 50-47)
Jimmy Brogdon drives and kicks out. Kawhi Ball attempts a Midrange. Contested by Cade Markkanen (3.2 feet, MAN). Kawhi Ball misses. Rebound secured by Cade Markkanen.

[11:26] Team_005 possession (Score: 50-47)
Derrick Allen attempts a 3Pt. Contested by Austin Russell (4.8 feet, ZONE). DERRICK ALLEN MAKES IT! Assist: Brandon George
Score: 53-47

[11:12] Team_028 possession (Score: 53-47)
Jimmy Brogdon attempts a Layup. Contested by Cade Markkanen (3.8 feet, MAN). Jimmy Brogdon misses. Rebound secured by Derrick Allen.

[10:57] Team_005 possession (Score: 53-47)
Derrick Allen attempts a 3Pt. Contested by Austin Russell (4.8 feet, ZONE). Derrick Allen misses. Rebound secured by Jimmy Brogdon.

[10:40] Team_028 possession (Score: 53-47)
Austin Russell attempts a 3Pt. Contested by Brandon George (5.0 feet, MAN). Austin Russell misses. Offensive rebound by Jimmy Brogdon! Jimmy Brogdon kicks it out.

[10:22] Team_028 possession (Score: 53-47)
Myles Haliburton attempts a 3Pt. Contested by Derrick Allen (4.3 feet, ZONE). Myles Haliburton misses. Rebound secured by Cade Markkanen.

[10:05] Team_005 possession (Score: 53-47)
Derrick Allen attempts a Midrange. Contested by Kawhi Ball (4.6 feet, ZONE). Derrick Allen misses. FOUL! Loose ball foul on Kawhi Ball during the rebound battle. [Team fouls: 2] No free throws, side out. (Kawhi Ball: 1 personal fouls)

[09:50] Team_005 possession (Score: 53-47)
FOUL! Holding foul on Carmelo Carter. [Team fouls: 3] No free throws, side out. (Carmelo Carter: 2 personal fouls)

[09:32] Team_005 possession (Score: 53-47)
Derrick Allen drives and kicks out. Anthony Rozier attempts a Midrange. Contested by Carmelo Carter (4.4 feet, MAN). Anthony Rozier misses. Rebound secured by Kawhi Ball.

[09:14] Team_028 possession (Score: 53-47)
Kawhi Ball attempts a 3Pt. Contested by Cade Markkanen (3.4 feet, MAN). Kawhi Ball misses. Offensive rebound by Jimmy Brogdon! Jimmy Brogdon kicks it out.

[08:59] Team_028 possession (Score: 53-47)
Kawhi Ball drives and kicks out. Carmelo Carter attempts a Midrange. Contested by Brandon George (5.1 feet, ZONE). Carmelo Carter misses. Rebound secured by Cade Markkanen.

[08:47] Team_005 possession (Score: 53-47)
Jalen Rozier drives to the basket... Jalen Rozier throws a bad pass! Stolen by Kawhi Ball! TURNOVER! (live ball)

[08:38] Team_028 possession (Score: 53-47)
FOUL! Reach-in foul on Cade Markkanen during the drive. [Team fouls: 1] No free throws, side out. (Cade Markkanen: 1 personal fouls)

[08:24] Team_028 possession (Score: 53-47)
Carmelo Carter drives and kicks out. Myles Haliburton attempts a 3Pt. Contested by Derrick Allen (4.2 feet, ZONE). Myles Haliburton misses. Offensive rebound by Kawhi Ball! Kawhi Ball kicks it out.

[08:09] Team_028 possession (Score: 53-47)
Myles Haliburton attempts a Midrange. Contested by Derrick Allen (4.3 feet, ZONE). Myles Haliburton misses. Rebound secured by Cade Markkanen.

[07:56] Team_005 possession (Score: 53-47)
Anthony Rozier attempts a Layup. BLOCKED BY KAWHI BALL! Ball deflects out of bounds off Anthony Rozier.

[07:42] Team_028 possession (Score: 53-47)
Kawhi Ball drives to the basket... FOUL! Offensive foul on Kawhi Ball! Cade Markkanen drew the charge! [Team fouls: 4] (Kawhi Ball: 2 personal fouls) TURNOVER! (dead ball)

[07:28] Team_005 possession (Score: 53-47)
Cade Markkanen drives, picks up Jimmy Brogdon. Help arrives from Carmelo Carter! Cade Markkanen attempts a Dunk. Contested by Carmelo Carter (4.1 feet, MAN). CADE MARKKANEN MAKES IT!
Score: 55-47

[07:18] Team_028 possession (Score: 55-47)
Jimmy Brogdon drives, picks up Cade Markkanen. Help arrives from Anthony Rozier! Jimmy Brogdon attempts a Layup. Contested by Anthony Rozier (3.8 feet, MAN). JIMMY BROGDON MAKES IT! Assist: Austin Russell
Score: 55-49

[07:02] Team_005 possession (Score: 55-49)
Cade Markkanen drives to the basket... Cade Markkanen loses control! Ball rolls out of bounds! TURNOVER! (dead ball)

[06:43] Team_028 possession (Score: 55-49)
Austin Russell attempts a 3Pt. Contested by Brandon George (5.0 feet, MAN). Austin Russell misses. Offensive rebound by Kawhi Ball! Kawhi Ball kicks it out.

[06:27] Team_028 possession (Score: 55-49)
Kawhi Ball attempts a Midrange. Contested by Jalen Rozier (5.1 feet, ZONE). Kawhi Ball misses. Offensive rebound by Jimmy Brogdon! Jimmy Brogdon kicks it out.

[06:14] Team_028 possession (Score: 55-49)
Austin Russell drives to the basket... Austin Russell throws a bad pass! Stolen by Cade Markkanen! TURNOVER! (live ball)

[05:57] Team_005 possession (Score: 55-49)
FOUL! Shooting foul on Kawhi Ball. Jalen Rozier to the line for 2 free throws. [BONUS: 5 team fouls] (Kawhi Ball: 3 personal fouls)   FT 1/2: GOOD   FT 2/2: GOOD Jalen Rozier makes 2/2 from the line.
Score: 57-49

[05:46] Team_028 possession (Score: 57-49)
Carmelo Carter attempts a 3Pt. Contested by Anthony Rozier (4.9 feet, MAN). Carmelo Carter misses. FOUL! Loose ball foul on Derrick Allen during the rebound battle. [Team fouls: 2] No free throws, side out. (Derrick Allen: 1 personal fouls)

[05:28] Team_028 possession (Score: 57-49)
Austin Russell attempts a Midrange. Contested by Derrick Allen (4.1 feet, ZONE). AUSTIN RUSSELL MAKES IT! Assist: Jimmy Brogdon
Score: 57-51

[05:10] Team_005 possession (Score: 57-51)
FOUL! Offensive foul on Jalen Rozier! Kawhi Ball drew the charge! [Team fouls: 3] (Jalen Rozier: 1 personal fouls) TURNOVER! (dead ball)

[04:59] Team_028 possession (Score: 57-51)
Myles Haliburton attempts a 3Pt. Contested by Derrick Allen (4.3 feet, MAN). Myles Haliburton misses. Offensive rebound by Kawhi Ball! Kawhi Ball kicks it out.

[04:44] Team_028 possession (Score: 57-51)
Kawhi Ball makes the Layup and draws the foul on Cade Markkanen! And-1! Kawhi Ball to the line for 1. [Team fouls: 4] (Cade Markkanen: 2 personal fouls)   FT 1/1: GOOD Kawhi Ball makes 1/1 from the line.
Score: 57-54

[04:30] Team_005 possession (Score: 57-54)
Jalen Rozier attempts a 3Pt. Contested by Austin Russell (4.8 feet, ZONE). JALEN ROZIER MAKES IT! Assist: Anthony Rozier
Score: 60-54

[04:14] Team_028 possession (Score: 60-54)
Austin Russell drives and kicks out. FOUL! Shooting foul on Anthony Rozier. Carmelo Carter to the line for 2 free throws. [BONUS: 5 team fouls] (Anthony Rozier: 1 personal fouls)   FT 1/2: GOOD   FT 2/2: GOOD Carmelo Carter makes 2/2 from the line.
Score: 60-56

[04:00] Team_005 possession (Score: 60-56)
Anthony Rozier makes the Midrange and draws the foul on Carmelo Carter! And-1! Anthony Rozier to the line for 1. [BONUS: 6 team fouls] (Carmelo Carter: 3 personal fouls)   FT 1/1: GOOD Anthony Rozier makes 1/1 from the line.
Score: 63-56

[03:45] Team_028 possession (Score: 63-56)
Austin Russell makes the Layup and draws the foul on Cade Markkanen! And-1! Austin Russell to the line for 1. [BONUS: 6 team fouls] (Cade Markkanen: 3 personal fouls)   FT 1/1: GOOD Austin Russell makes 1/1 from the line.
Score: 63-59

[03:30] Team_005 possession (Score: 63-59)
Derrick Allen drives to the basket... Derrick Allen commits a violation (traveling/carry)! TURNOVER! (dead ball)

[03:18] Team_028 possession (Score: 63-59)
Jimmy Brogdon attempts a Midrange. Contested by Jalen Rozier (5.5 feet, ZONE). JIMMY BROGDON MAKES IT! Assist: Kawhi Ball
Score: 63-61

[03:01] Team_005 possession (Score: 63-61)
Anthony Rozier attempts a 3Pt. Contested by Austin Russell (4.6 feet, ZONE). Anthony Rozier misses. Rebound secured by Carmelo Carter.

[02:47] Team_028 possession (Score: 63-61)
Austin Russell attempts a Layup. BLOCKED BY CADE MARKKANEN! Ball deflects out of bounds off Austin Russell.

[02:32] Team_005 possession (Score: 63-61)
FOUL! Shooting foul on Myles Haliburton. Derrick Allen to the line for 2 free throws. [BONUS: 7 team fouls] (Myles Haliburton: 1 personal fouls)   FT 1/2: MISS   FT 2/2: GOOD Derrick Allen makes 1/2 from the line.
Score: 64-61

[02:19] Team_028 possession (Score: 64-61)
Jimmy Brogdon drives to the basket... Jimmy Brogdon throws a bad pass! Stolen by Cade Markkanen! TURNOVER! (live ball)

[02:05] Team_005 possession (Score: 64-61)
Anthony Rozier makes the Layup and draws the foul on Carmelo Carter! And-1! Anthony Rozier to the line for 1. [BONUS: 8 team fouls] (Carmelo Carter: 4 personal fouls)   FT 1/1: GOOD Anthony Rozier makes 1/1 from the line.
Score: 67-61

[01:52] Team_028 possession (Score: 67-61)
Myles Haliburton attempts a 3Pt. Contested by Derrick Allen (4.6 feet, ZONE). MYLES HALIBURTON MAKES IT! Assist: Carmelo Carter
Score: 67-64

[01:34] Team_005 possession (Score: 67-64)
Anthony Rozier attempts a 3Pt. Contested by Austin Russell (4.8 feet, ZONE). Anthony Rozier misses. Rebound secured by Kawhi Ball.

[01:20] Team_028 possession (Score: 67-64)
Kawhi Ball attempts a 3Pt. Contested by Jalen Rozier (5.4 feet, MAN). Kawhi Ball misses. Rebound secured by Cade Markkanen.

[01:06] Team_005 possession (Score: 67-64)
Jalen Rozier attempts a 3Pt. Contested by Kawhi Ball (5.0 feet, MAN). Jalen Rozier misses. Rebound secured by Carmelo Carter.

[00:52] Team_028 possession (Score: 67-64)
Carmelo Carter attempts a 3Pt. Contested by Derrick Allen (4.9 feet, ZONE). CARMELO CARTER MAKES IT!
Score: 67-67

[00:37] Team_005 possession (Score: 67-67)
Anthony Rozier attempts a 3Pt. Contested by Austin Russell (4.9 feet, ZONE). ANTHONY ROZIER MAKES IT! Assist: Jalen Rozier
Score: 70-67

[00:26] Team_028 possession (Score: 70-67)
Carmelo Carter attempts a Midrange. Contested by Anthony Rozier (5.4 feet, MAN). CARMELO CARTER MAKES IT! Assist: Kawhi Ball
Score: 70-69

[00:15] Team_005 possession (Score: 70-69)
Jalen Rozier drives, Kawhi Ball stays with him. Jalen Rozier attempts a Dunk. Contested by Kawhi Ball (5.1 feet, ZONE). JALEN ROZIER MAKES IT! Assist: Brandon George
Score: 72-69

[00:02] Team_028 possession (Score: 72-69)
FOUL! Shooting foul on Jalen Rozier. Kawhi Ball to the line for 2 free throws. [BONUS: 7 team fouls] (Jalen Rozier: 2 personal fouls)   FT 1/2: GOOD   FT 2/2: GOOD Kawhi Ball makes 2/2 from the line.
Score: 72-71

================================================================================
                              3RD QUARTER COMPLETE                              
================================================================================

3RD QUARTER SCORE: Team_005 24, Team_028 24

BOX SCORE:
================================================================================

Team_005
--------------------------------------------------------------------------------
Player                MIN  PTS  REB  AST  TO      FG   FG%      3P   3P%
--------------------------------------------------------------------------------
Anthony Rozier         25    9    0    1   0   3/6    50.0     0/0   0.0
Jalen Rozier           25    7    0    1   0   3/4    75.0     0/0   0.0
Cade Markkanen         25    4    6    0   0   2/2   100.0     0/0   0.0
Derrick Allen          25    4    1    0   0   2/4    50.0     0/0   0.0
Brandon George         25    0    0    2   0   0/0     0.0     0/0   0.0

TEAM: FG: 10/16 (62.5%), 3PT: 3/7 (42.9%), REB: 7 (1 off, 6 def), AST: 4, TO: 4
TEAM FOULS: 7 [Team_028 in BONUS]


Team_028
--------------------------------------------------------------------------------
Player                MIN  PTS  REB  AST  TO      FG   FG%      3P   3P%
--------------------------------------------------------------------------------
Carmelo Carter         25    7    2    1   0   3/3   100.0     0/0   0.0
Kawhi Ball             25    5    6    2   0   2/4    50.0     0/0   0.0
Austin Russell         25    5    0    1   0   2/3    66.7     0/0   0.0
Jimmy Brogdon          25    4    4    1   0   2/4    50.0     0/0   0.0
Myles Haliburton       25    3    0    0   0   1/3    33.3     0/0   0.0

TEAM: FG: 10/17 (58.8%), 3PT: 2/4 (50.0%), REB: 12 (7 off, 5 def), AST: 5, TO: 3
TEAM FOULS: 8 [Team_005 in BONUS]

================================================================================

================================================================================
                       4TH QUARTER - Team_005 vs Team_028                       
================================================================================

[12:00] Team_005 possession (Score: 72-71)
Jalen Rozier drives to the basket... Jalen Rozier throws a bad pass! Stolen by Jimmy Brogdon! TURNOVER! (live ball)

[11:45] Team_028 possession (Score: 72-71)
Carmelo Carter attempts a 3Pt. Contested by Derrick Allen (4.8 feet, ZONE). Carmelo Carter misses. Rebound secured by Cade Markkanen.

[11:30] Team_005 possession (Score: 72-71)
Jalen Rozier attempts a 3Pt. Contested by Kawhi Ball (5.0 feet, MAN). Jalen Rozier misses. Rebound secured by Carmelo Carter.

[11:11] Team_028 possession (Score: 72-71)
Austin Russell attempts a 3Pt. Contested by Derrick Allen (4.4 feet, ZONE). Austin Russell misses. Rebound secured by Cade Markkanen.

[10:58] Team_005 possession (Score: 72-71)
Anthony Rozier attempts a 3Pt. Contested by Austin Russell (4.8 feet, ZONE). ANTHONY ROZIER MAKES IT! Assist: Derrick Allen
Score: 75-71

[10:44] Team_028 possession (Score: 75-71)
Jimmy Brogdon attempts a Midrange. Contested by Cade Markkanen (4.4 feet, MAN). Jimmy Brogdon misses. Rebound secured by Derrick Allen.

[10:33] Team_005 possession (Score: 75-71)
Cade Markkanen drives to the basket... Cade Markkanen throws a bad pass! Stolen by Kawhi Ball! TURNOVER! (live ball)

[10:21] Team_028 possession (Score: 75-71)
Jimmy Brogdon attempts a Midrange. Contested by Cade Markkanen (4.4 feet, MAN). Jimmy Brogdon misses. Offensive rebound by Kawhi Ball! Kawhi Ball kicks it out.

[10:07] Team_028 possession (Score: 75-71)
Kawhi Ball makes the Layup and draws the foul on Jalen Rozier! And-1! Kawhi Ball to the line for 1. [Team fouls: 1] (Jalen Rozier: 1 personal fouls)   FT 1/1: GOOD Kawhi Ball makes 1/1 from the line.
Score: 75-74

[09:54] Team_005 possession (Score: 75-74)
FOUL! Shooting foul on Austin Russell. Brandon George to the line for 3 free throws. [Team fouls: 1] (Austin Russell: 1 personal fouls)   FT 1/3: GOOD   FT 2/3: GOOD   FT 3/3: GOOD Brandon George makes 3/3 from the line.
Score: 78-74

[09:44] Team_028 possession (Score: 78-74)
FOUL! Reach-in foul on Brandon George during the drive. [Team fouls: 2] No free throws, side out. (Brandon George: 1 personal fouls)

[09:28] Team_028 possession (Score: 78-74)
FOUL! Shooting foul on Anthony Rozier. Carmelo Carter to the line for 3 free throws. [Team fouls: 3] (Anthony Rozier: 1 personal fouls)   FT 1/3: GOOD   FT 2/3: GOOD   FT 3/3: GOOD Carmelo Carter makes 3/3 from the line.
Score: 78-77

[09:13] Team_005 possession (Score: 78-77)
Jalen Rozier throws a bad pass out of bounds! TURNOVER! (dead ball)

[09:13] Substitution (Team_005): Brandon George OUT → Blake O'Neal IN (stamina_rule2)

[09:13] Substitution (Team_005): Anthony Rozier OUT → Draymond Smith IN (stamina_rule2)

[09:13] Substitution (Team_005): Derrick Allen OUT → Lauri Wade IN (stamina_rule2)

[09:13] Substitution (Team_005): Jalen Rozier OUT → Isaiah Durant IN (stamina_rule2)

[09:13] Substitution (Team_005): Cade Markkanen OUT → Zion Parker IN (stamina_rule2)

[09:13] Substitution (Team_028): Austin Russell OUT → Scottie Ingram IN (stamina_rule2)

[09:13] Substitution (Team_028): Carmelo Carter OUT → Tyrese Quickley IN (stamina_rule2)

[09:13] Substitution (Team_028): Myles Haliburton OUT → Miles Booker IN (stamina_rule2)

[09:13] Substitution (Team_028): Kawhi Ball OUT → Bam Towns IN (stamina_rule2)

[09:13] Substitution (Team_028): Jimmy Brogdon OUT → Collin Bridges IN (stamina_rule2)

[08:56] Team_028 possession (Score: 78-77)
Bam Towns drives to the basket... FOUL! Offensive foul on Bam Towns! Isaiah Durant drew the charge! [Team fouls: 2] (Bam Towns: 1 personal fouls) TURNOVER! (dead ball)

[08:39] Team_005 possession (Score: 78-77)
Zion Parker drives, Collin Bridges stays with him. Zion Parker attempts a Layup. Contested by Collin Bridges (3.8 feet, MAN). Zion Parker misses. Rebound secured by Collin Bridges.

[08:26] Team_028 possession (Score: 78-77)
Collin Bridges drives and kicks out. Scottie Ingram attempts a 3Pt. Contested by Blake O'Neal (4.1 feet, ZONE). Scottie Ingram misses. Rebound secured by Zion Parker.

[08:11] Team_005 possession (Score: 78-77)
FOUL! Shooting foul on Miles Booker. Lauri Wade to the line for 2 free throws. [Team fouls: 3] (Miles Booker: 1 personal fouls)   FT 1/2: GOOD   FT 2/2: GOOD Lauri Wade makes 2/2 from the line.
Score: 80-77

[07:55] Team_028 possession (Score: 80-77)
Miles Booker throws a bad pass out of bounds! TURNOVER! (dead ball)

[07:43] Team_005 possession (Score: 80-77)
Blake O'Neal attempts a Midrange. Contested by Bam Towns (5.5 feet, ZONE). Blake O'Neal misses. Rebound secured by Bam Towns.

[07:30] Team_028 possession (Score: 80-77)
Tyrese Quickley attempts a Layup. Contested by Draymond Smith (4.5 feet, MAN). Tyrese Quickley misses. Rebound secured by Draymond Smith.

[07:21] Team_005 possession (Score: 80-77)
Draymond Smith makes the Dunk and draws the foul on Collin Bridges! And-1! Draymond Smith to the line for 1. [Team fouls: 4] (Collin Bridges: 1 personal fouls)   FT 1/1: GOOD Draymond Smith makes 1/1 from the line.
Score: 83-77

[07:08] Team_028 possession (Score: 83-77)
FOUL! Offensive foul on Scottie Ingram! Blake O'Neal drew the charge! [Team fouls: 5] (Scottie Ingram: 1 personal fouls) TURNOVER! (dead ball)

[06:58] Team_005 possession (Score: 83-77)
Isaiah Durant drives to the basket... Isaiah Durant throws a bad pass out of bounds! TURNOVER! (dead ball)

[06:45] Team_028 possession (Score: 83-77)
FOUL! Holding foul on Draymond Smith. [Team fouls: 4] No free throws, side out. (Draymond Smith: 1 personal fouls)

[06:35] Team_028 possession (Score: 83-77)
Scottie Ingram attempts a Midrange. Contested by Blake O'Neal (4.1 feet, MAN). SCOTTIE INGRAM MAKES IT!
Score: 83-79

[06:22] Team_005 possession (Score: 83-79)
Zion Parker attempts a Midrange. Contested by Collin Bridges (3.8 feet, MAN). Zion Parker misses. Rebound secured by Tyrese Quickley.

[06:12] Team_028 possession (Score: 83-79)
Bam Towns throws a bad pass out of bounds! TURNOVER! (dead ball)

[05:55] Team_005 possession (Score: 83-79)
Draymond Smith throws a bad pass! Stolen by Tyrese Quickley! TURNOVER! (live ball)

[05:44] Team_028 possession (Score: 83-79)
FOUL! Reach-in foul on Zion Parker during the drive. [IN THE BONUS! 5 team fouls] Miles Booker to the line for 2 free throws. (Zion Parker: 1 personal fouls)   FT 1/2: GOOD   FT 2/2: GOOD Miles Booker makes 2/2 from the line.
Score: 83-81

[05:28] Team_005 possession (Score: 83-81)
Isaiah Durant drives, Collin Bridges stays with him. Isaiah Durant attempts a Dunk. Contested by Collin Bridges (4.0 feet, ZONE). ISAIAH DURANT MAKES IT! Assist: Zion Parker
Score: 85-81

[05:08] Team_028 possession (Score: 85-81)
Bam Towns attempts a 3Pt. Contested by Draymond Smith (4.3 feet, ZONE). Bam Towns misses. Rebound secured by Zion Parker.

[04:53] Team_005 possession (Score: 85-81)
Blake O'Neal attempts a 3Pt. Contested by Scottie Ingram (5.9 feet, MAN). Blake O'Neal misses. Offensive rebound by Zion Parker! Zion Parker puts it back in!
Score: 87-81

[04:38] Team_028 possession (Score: 87-81)
Collin Bridges attempts a Midrange. Contested by Zion Parker (4.2 feet, MAN). COLLIN BRIDGES MAKES IT!
Score: 87-83

[04:25] Team_005 possession (Score: 87-83)
FOUL! Shooting foul on Tyrese Quickley. Draymond Smith to the line for 3 free throws. [BONUS: 6 team fouls] (Tyrese Quickley: 1 personal fouls)   FT 1/3: GOOD   FT 2/3: GOOD   FT 3/3: GOOD Draymond Smith makes 3/3 from the line.
Score: 90-83

[04:08] Team_028 possession (Score: 90-83)
Scottie Ingram attempts a 3Pt. Contested by Blake O'Neal (4.1 feet, ZONE). Scottie Ingram misses. Rebound secured by Zion Parker.

[03:55] Team_005 possession (Score: 90-83)
Lauri Wade attempts a 3Pt. Contested by Miles Booker (5.9 feet, MAN). Lauri Wade misses. FOUL! Loose ball foul on Collin Bridges during the rebound battle. [IN THE BONUS! 7 team fouls] Zion Parker to the line for 2 free throws. (Collin Bridges: 2 personal fouls)   FT 1/2: GOOD   FT 2/2: GOOD Zion Parker makes 2/2 from the line.
Score: 92-83

[03:40] Team_028 possession (Score: 92-83)
Collin Bridges attempts a 3Pt. Contested by Zion Parker (4.2 feet, MAN). Collin Bridges misses. Rebound secured by Zion Parker.

[03:23] Team_005 possession (Score: 92-83)
FOUL! Holding foul on Scottie Ingram. [IN THE BONUS! 8 team fouls] Blake O'Neal to the line for 2 free throws. (Scottie Ingram: 2 personal fouls)   FT 1/2: GOOD   FT 2/2: GOOD Blake O'Neal makes 2/2 from the line.
Score: 94-83

[03:09] Team_028 possession (Score: 94-83)
Miles Booker attempts a Midrange. Contested by Isaiah Durant (4.3 feet, ZONE). MILES BOOKER MAKES IT!
Score: 94-85

[02:53] Team_005 possession (Score: 94-85)
Zion Parker attempts a Midrange. Contested by Tyrese Quickley (4.4 feet, ZONE). ZION PARKER MAKES IT! Assist: Isaiah Durant
Score: 96-85

[02:41] Team_028 possession (Score: 96-85)
Bam Towns drives and kicks out. Miles Booker attempts a Midrange. Contested by Lauri Wade (5.1 feet, MAN). Miles Booker misses. Offensive rebound by Bam Towns! Bam Towns kicks it out.

[02:27] Team_028 possession (Score: 96-85)
Miles Booker attempts a Midrange. Contested by Lauri Wade (5.0 feet, ZONE). MILES BOOKER MAKES IT! Assist: Collin Bridges
Score: 96-87

[02:10] Team_005 possession (Score: 96-87)
Zion Parker drives and kicks out. Blake O'Neal attempts a 3Pt. Contested by Miles Booker (5.9 feet, ZONE). BLAKE O'NEAL MAKES IT! Assist: Draymond Smith
Score: 99-87

[01:58] Team_028 possession (Score: 99-87)
Tyrese Quickley loses control! Ball rolls out of bounds! TURNOVER! (dead ball)

[01:45] Team_005 possession (Score: 99-87)
Zion Parker drives and kicks out. Isaiah Durant attempts a 3Pt. Contested by Collin Bridges (3.9 feet, MAN). Isaiah Durant misses. Rebound secured by Collin Bridges.

[01:30] Team_028 possession (Score: 99-87)
Tyrese Quickley attempts a 3Pt. Contested by Draymond Smith (4.6 feet, MAN). Tyrese Quickley misses. Rebound secured by Zion Parker.

[01:19] Team_005 possession (Score: 99-87)
Lauri Wade attempts a 3Pt. Wide open! Miles Booker is 6.0 feet away. [MAN] LAURI WADE MAKES IT! Assist: Blake O'Neal
Score: 102-87

[01:08] Team_028 possession (Score: 102-87)
Scottie Ingram attempts a Midrange. Contested by Blake O'Neal (4.2 feet, ZONE). Scottie Ingram misses. Rebound secured by Draymond Smith.

[00:50] Team_005 possession (Score: 102-87)
Lauri Wade attempts a 3Pt. Contested by Scottie Ingram (5.7 feet, ZONE). LAURI WADE MAKES IT! Assist: Blake O'Neal
Score: 105-87

[00:33] Team_028 possession (Score: 105-87)
Collin Bridges attempts a Midrange. Contested by Lauri Wade (5.4 feet, ZONE). Collin Bridges misses. Rebound secured by Draymond Smith.

[00:18] Team_005 possession (Score: 105-87)
Draymond Smith attempts a 3Pt. Contested by Tyrese Quickley (4.4 feet, ZONE). Draymond Smith misses. Rebound secured by Tyrese Quickley.

[00:09] Team_028 possession (Score: 105-87)
Miles Booker drives, picks up Isaiah Durant. Help arrives from Blake O'Neal! Miles Booker attempts a Layup. Contested by Blake O'Neal (4.5 feet, ZONE). MILES BOOKER MAKES IT! Assist: Scottie Ingram
Score: 105-89

================================================================================
                              4TH QUARTER COMPLETE                              
================================================================================

4TH QUARTER SCORE: Team_005 33, Team_028 18

BOX SCORE:
================================================================================

Team_005
--------------------------------------------------------------------------------
Player                MIN  PTS  REB  AST  TO      FG   FG%      3P   3P%
--------------------------------------------------------------------------------
Lauri Wade             20    8    0    0   0   3/3   100.0     0/0   0.0
Zion Parker            20    6    6    1   0   3/6    50.0     0/0   0.0
Draymond Smith         20    6    3    1   0   2/3    66.7     0/0   0.0
Blake O'Neal           20    5    0    2   0   2/3    66.7     0/0   0.0
Anthony Rozier         29    3    0    0   0   1/1   100.0     0/0   0.0
Brandon George         29    3    0    0   0   1/1   100.0     0/0   0.0
Isaiah Durant          20    2    0    1   0   1/1   100.0     0/0   0.0
Cade Markkanen         29    0    2    0   0   0/0     0.0     0/0   0.0
Jalen Rozier           29    0    0    0   0   0/1     0.0     0/0   0.0
Derrick Allen          29    0    1    1   0   0/0     0.0     0/0   0.0

TEAM: FG: 13/19 (68.4%), 3PT: 7/9 (77.8%), REB: 12 (1 off, 11 def), AST: 6, TO: 5
TEAM FOULS: 5 [Team_028 in BONUS]


Team_028
--------------------------------------------------------------------------------
Player                MIN  PTS  REB  AST  TO      FG   FG%      3P   3P%
--------------------------------------------------------------------------------
Miles Booker           20    8    0    0   0   4/4   100.0     0/0   0.0
Carmelo Carter         29    3    1    0   0   1/2    50.0     0/0   0.0
Kawhi Ball             29    3    1    0   0   1/1   100.0     0/0   0.0
Collin Bridges         20    2    2    1   0   1/4    25.0     0/0   0.0
Scottie Ingram         20    2    0    1   0   1/3    33.3     0/0   0.0
Austin Russell         29    0    0    0   0   0/1     0.0     0/0   0.0
Jimmy Brogdon          29    0    0    0   0   0/1     0.0     0/0   0.0
Bam Towns              20    0    2    0   0   0/1     0.0     0/0   0.0
Tyrese Quickley        20    0    2    0   0   0/2     0.0     0/0   0.0

TEAM: FG: 8/19 (42.1%), 3PT: 1/7 (14.3%), REB: 8 (2 off, 6 def), AST: 2, TO: 5
TEAM FOULS: 8 [Team_005 in BONUS]

================================================================================

================================================================================
                               FULL GAME COMPLETE                               
================================================================================

FINAL SCORE: Team_005 105, Team_028 89

SCORING BY QUARTER:
--------------------------------------------------------------------------------
Team                     Q1     Q2     Q3     Q4    FINAL
--------------------------------------------------------------------------------
Team_005                 23     25     24     33      105
Team_028                 25     22     24     18       89
--------------------------------------------------------------------------------

FULL GAME BOX SCORE:
================================================================================

Team_005
--------------------------------------------------------------------------------
Player                MIN  PTS  REB  AST  TO      FG   FG%      3P   3P%      FT STL BLK
--------------------------------------------------------------------------------
Brandon George         29    3    0    3   2   1/3    33.3   1/3    33.3   3/3     0   0
Anthony Rozier         29   14    0    4   0   5/10   50.0   2/4    50.0   2/3     0   0
Derrick Allen          29    9    4    3   3   4/8    50.0   2/4    50.0   1/2     0   0
Jalen Rozier           29   14    1    1   3   6/12   50.0   2/5    40.0   2/2     0   0
Cade Markkanen         29   15   13    0   3   7/8    87.5   0/0     0.0   5/5     4   1
Blake O'Neal           20   13    0    4   1   5/6    83.3   3/3   100.0   3/3     0   0
Draymond Smith         20    9    7    2   3   3/5    60.0   2/3    66.7   5/6     0   0
Lauri Wade             20    8    1    0   0   4/6    66.7   3/5    60.0   2/2     0   0
Isaiah Durant          20    4    0    1   1   2/5    40.0   0/1     0.0   0/0     0   0
Zion Parker            20   13   11    3   0   5/9    55.6   0/0     0.0   3/4     0   1

TEAM: FG: 43/73 (58.9%), 3PT: 15/28 (53.6%), REB: 37 (5 off, 32 def), AST: 21, TO: 16


Team_028
--------------------------------------------------------------------------------
Player                MIN  PTS  REB  AST  TO      FG   FG%      3P   3P%      FT STL BLK
--------------------------------------------------------------------------------
Austin Russell         29   17    0    3   0   9/14   64.3   2/4    50.0   3/3     0   0
Carmelo Carter         29   14    6    3   2   5/8    62.5   3/5    60.0   7/8     0   1
Myles Haliburton       29   10    0    0   3   4/6    66.7   2/3    66.7   0/0     0   0
Kawhi Ball             29    8   12    5   2   3/7    42.9   0/3     0.0   4/4     2   1
Jimmy Brogdon          29    6    7    2   2   2/6    33.3   0/1     0.0   2/2     1   0
Scottie Ingram         20    4    0    1   1   3/7    42.9   1/4    25.0   0/0     0   0
Tyrese Quickley        20    7    5    1   3   1/5    20.0   0/2     0.0   4/4     1   0
Miles Booker           20   10    0    2   1   4/5    80.0   0/0     0.0   2/2     0   0
Bam Towns              20    5    7    0   1   3/5    60.0   0/1     0.0   3/4     0   0
Collin Bridges         20    8    4    1   0   5/9    55.6   0/1     0.0   2/2     0   0

TEAM: FG: 40/73 (54.8%), 3PT: 8/24 (33.3%), REB: 41 (13 off, 28 def), AST: 18, TO: 15

================================================================================
