================================================================================
                        FULL GAME - Team_046 vs Team_036                        
================================================================================

================================================================================
                       1ST QUARTER - Team_046 vs Team_036                       
================================================================================

[12:00] Team_046 possession (Score: 0-0)
Lauri Carter drives, picks up Kobe Simmons. Help arrives from Giannis Booker! Lauri Carter attempts a Dunk. Contested by Giannis Booker (3.7 feet, ZONE). LAURI CARTER MAKES IT!
Score: 2-0

[11:45] Team_036 possession (Score: 2-0)
Terry Durant drives, Kevin Allen stays with him. Terry Durant attempts a Layup. Contested by Kevin Allen (5.1 feet, ZONE). TERRY DURANT MAKES IT!
Score: 2-2

[11:35] Team_046 possession (Score: 2-2)
Victor Nowitzki drives and kicks out. Kevin Allen attempts a Midrange. Contested by Terry Durant (4.4 feet, ZONE). KEVIN ALLEN MAKES IT!
Score: 4-2

[11:16] Team_036 possession (Score: 4-2)
Michael Westbrook attempts a 3Pt. Contested by Lauri Carter (3.7 feet, ZONE). Michael Westbrook misses. Rebound secured by Kevin Allen.

[11:01] Team_046 possession (Score: 4-2)
Lauri Carter attempts a Layup. Contested by Anthony Poole (5.1 feet, MAN). LAURI CARTER MAKES IT! Assist: D'Angelo O'Neal
Score: 6-2

[10:50] Team_036 possession (Score: 6-2)
Anthony Poole attempts a Layup. Contested by Kevin Allen (5.4 feet, ZONE). Anthony Poole misses. Rebound secured by Cade Wall.

[10:34] Team_046 possession (Score: 6-2)
FOUL! Reach-in foul on Kobe Simmons during the drive. [Team fouls: 1] No free throws, side out. (Kobe Simmons: 1 personal fouls)

[10:16] Team_046 possession (Score: 6-2)
D'Angelo O'Neal throws a bad pass out of bounds! TURNOVER! (dead ball)

[10:00] Team_036 possession (Score: 6-2)
FOUL! Shooting foul on Kevin Allen. Giannis Booker to the line for 2 free throws. [Team fouls: 1] (Kevin Allen: 1 personal fouls)   FT 1/2: MISS   FT 2/2: GOOD Giannis Booker makes 1/2 from the line.
Score: 6-3

[09:45] Team_046 possession (Score: 6-3)
FOUL! Holding foul on Anthony Poole. [Team fouls: 2] No free throws, side out. (Anthony Poole: 1 personal fouls)

[09:32] Team_046 possession (Score: 6-3)
Cade Wall drives and kicks out. Victor Nowitzki attempts a 3Pt. Contested by Michael Westbrook (4.6 feet, ZONE). VICTOR NOWITZKI MAKES IT! Assist: Cade Wall
Score: 9-3

[09:14] Team_036 possession (Score: 9-3)
Anthony Poole attempts a 3Pt. Contested by Lauri Carter (4.0 feet, ZONE). Anthony Poole misses. Offensive rebound by Kobe Simmons! Kobe Simmons's putback is no good. Rebound secured by Kevin Allen.

[08:57] Team_046 possession (Score: 9-3)
D'Angelo O'Neal attempts a 3Pt. Contested by Michael Westbrook (4.9 feet, ZONE). D'Angelo O'Neal misses. Rebound secured by Giannis Booker.

[08:42] Team_036 possession (Score: 9-3)
Terry Durant makes the Layup and draws the foul on Kevin Allen! And-1! Terry Durant to the line for 1. [Team fouls: 2] (Kevin Allen: 2 personal fouls)   FT 1/1: GOOD Terry Durant makes 1/1 from the line.
Score: 9-6

[08:26] Team_046 possession (Score: 9-6)
Lauri Carter attempts a Midrange. Contested by Giannis Booker (4.7 feet, ZONE). Lauri Carter misses. Rebound secured by Giannis Booker.

[08:11] Team_036 possession (Score: 9-6)
Anthony Poole attempts a 3Pt. Contested by Lauri Carter (4.0 feet, MAN). Anthony Poole misses. FOUL! Loose ball foul on Cade Wall during the rebound battle. [Team fouls: 3] No free throws, side out. (Cade Wall: 1 personal fouls)

[07:55] Team_036 possession (Score: 9-6)
Terry Durant attempts a Layup. Contested by Cade Wall (4.2 feet, MAN). Terry Durant misses. Rebound secured by Cade Wall.

[07:42] Team_046 possession (Score: 9-6)
D'Angelo O'Neal attempts a 3Pt. Contested by Michael Westbrook (4.9 feet, MAN). D'Angelo O'Neal misses. Rebound secured by Kobe Simmons.

[07:27] Team_036 possession (Score: 9-6)
Anthony Poole attempts a 3Pt. Contested by Cade Wall (4.5 feet, ZONE). Anthony Poole misses. Rebound secured by Cade Wall.

[07:10] Team_046 possession (Score: 9-6)
Victor Nowitzki attempts a 3Pt. Contested by Michael Westbrook (4.8 feet, ZONE). Victor Nowitzki misses. Rebound secured by Terry Durant.

[06:52] Team_036 possession (Score: 9-6)
FOUL! Holding foul on Cade Wall. [Team fouls: 4] No free throws, side out. (Cade Wall: 2 personal fouls)

[06:40] Team_036 possession (Score: 9-6)
Terry Durant drives and kicks out. Kobe Simmons attempts a 3Pt. Contested by Lauri Carter (3.2 feet, ZONE). Kobe Simmons misses. Rebound secured by Cade Wall.

[06:28] Team_046 possession (Score: 9-6)
Cade Wall loses control! Ball rolls out of bounds! TURNOVER! (dead ball)

[06:15] Team_036 possession (Score: 9-6)
Terry Durant makes the Dunk and draws the foul on Cade Wall! And-1! Terry Durant to the line for 1. [BONUS: 5 team fouls] (Cade Wall: 3 personal fouls)   FT 1/1: GOOD Terry Durant makes 1/1 from the line.
Score: 9-9

[06:00] Team_046 possession (Score: 9-9)
Kevin Allen drives and kicks out. Lauri Carter attempts a 3Pt. Contested by Michael Westbrook (4.6 feet, ZONE). Lauri Carter misses. Rebound secured by Terry Durant.

[05:46] Team_036 possession (Score: 9-9)
Terry Durant attempts a Midrange. Contested by Cade Wall (4.2 feet, ZONE). TERRY DURANT MAKES IT! Assist: Michael Westbrook
Score: 9-11

[05:32] Team_046 possession (Score: 9-11)
Cade Wall drives and kicks out. D'Angelo O'Neal attempts a 3Pt. Contested by Michael Westbrook (4.6 feet, ZONE). D'Angelo O'Neal misses. Rebound secured by Kobe Simmons.

[05:17] Team_036 possession (Score: 9-11)
Kobe Simmons drives, picks up Kevin Allen. Help arrives from D'Angelo O'Neal! Kobe Simmons attempts a Layup. Contested by D'Angelo O'Neal (5.1 feet, ZONE). KOBE SIMMONS MAKES IT! Assist: Anthony Poole
Score: 9-13

[05:05] Team_046 possession (Score: 9-13)
Victor Nowitzki attempts a Midrange. Contested by Giannis Booker (4.7 feet, MAN). Victor Nowitzki misses. Offensive rebound by Cade Wall! Cade Wall kicks it out.

[04:50] Team_046 possession (Score: 9-13)
Victor Nowitzki makes the Layup and draws the foul on Anthony Poole! And-1! Victor Nowitzki to the line for 1. [Team fouls: 3] (Anthony Poole: 2 personal fouls)   FT 1/1: GOOD Victor Nowitzki makes 1/1 from the line.
Score: 12-13

[04:37] Team_036 possession (Score: 12-13)
Terry Durant drives and kicks out. Giannis Booker attempts a 3Pt. Contested by Lauri Carter (3.3 feet, ZONE). GIANNIS BOOKER MAKES IT! Assist: Michael Westbrook
Score: 12-16

[04:25] Team_046 possession (Score: 12-16)
Cade Wall attempts a 3Pt. Contested by Michael Westbrook (5.3 feet, ZONE). Cade Wall misses. Offensive rebound by Kevin Allen! Kevin Allen kicks it out.

[04:11] Team_046 possession (Score: 12-16)
Cade Wall attempts a Layup. BLOCKED BY TERRY DURANT! Ball deflects out of bounds off Cade Wall.

[03:55] Team_036 possession (Score: 12-16)
Giannis Booker attempts a 3Pt. Contested by Lauri Carter (3.7 feet, ZONE). Giannis Booker misses. Rebound secured by Cade Wall.

[03:41] Team_046 possession (Score: 12-16)
Lauri Carter attempts a 3Pt. Contested by Giannis Booker (4.8 feet, ZONE). Lauri Carter misses. Rebound secured by Terry Durant.

[03:22] Team_036 possession (Score: 12-16)
Anthony Poole attempts a 3Pt. Contested by Lauri Carter (4.1 feet, ZONE). ANTHONY POOLE MAKES IT! Assist: Kobe Simmons
Score: 12-19

[03:08] Team_046 possession (Score: 12-19)
D'Angelo O'Neal attempts a Layup. Contested by Kobe Simmons (3.9 feet, ZONE). D'ANGELO O'NEAL MAKES IT! Assist: Victor Nowitzki
Score: 14-19

[02:56] Team_036 possession (Score: 14-19)
Terry Durant drives and kicks out. Anthony Poole attempts a Midrange. Contested by Cade Wall (4.0 feet, ZONE). Anthony Poole misses. Rebound secured by Cade Wall.

[02:39] Team_046 possession (Score: 14-19)
Lauri Carter drives and kicks out. Lauri Carter attempts a 3Pt. Contested by Michael Westbrook (4.9 feet, ZONE). Lauri Carter misses. Rebound secured by Giannis Booker.

[02:24] Team_036 possession (Score: 14-19)
FOUL! Holding foul on Cade Wall. [IN THE BONUS! 6 team fouls] Terry Durant to the line for 2 free throws. (Cade Wall: 4 personal fouls)   FT 1/2: MISS   FT 2/2: GOOD Terry Durant makes 1/2 from the line.
Score: 14-20

[02:10] Team_046 possession (Score: 14-20)
D'Angelo O'Neal attempts a Layup. Contested by Kobe Simmons (4.0 feet, ZONE). D'Angelo O'Neal misses. Rebound secured by Giannis Booker.

[01:56] Team_036 possession (Score: 14-20)
Kobe Simmons attempts a Midrange. Contested by Lauri Carter (3.9 feet, ZONE). KOBE SIMMONS MAKES IT! Assist: Anthony Poole
Score: 14-22

[01:43] Team_046 possession (Score: 14-22)
Cade Wall attempts a Layup. BLOCKED BY KOBE SIMMONS! Ball is loose! Rebound secured by Kobe Simmons.

[01:25] Team_036 possession (Score: 14-22)
Michael Westbrook attempts a Layup. Contested by D'Angelo O'Neal (4.9 feet, MAN). Michael Westbrook misses. Rebound secured by Kevin Allen.

[01:10] Team_046 possession (Score: 14-22)
FOUL! Shooting foul on Anthony Poole. Lauri Carter to the line for 2 free throws. [Team fouls: 4] (Anthony Poole: 3 personal fouls)   FT 1/2: MISS   FT 2/2: GOOD Lauri Carter makes 1/2 from the line.
Score: 15-22

[00:56] Team_036 possession (Score: 15-22)
Michael Westbrook attempts a 3Pt. Contested by D'Angelo O'Neal (5.0 feet, MAN). MICHAEL WESTBROOK MAKES IT! Assist: Giannis Booker
Score: 15-25

[00:39] Team_046 possession (Score: 15-25)
D'Angelo O'Neal loses control! Ball rolls out of bounds! TURNOVER! (dead ball)

[00:39] Substitution (Team_046): D'Angelo O'Neal OUT → Collin Butler IN (stamina_rule2)

[00:39] Substitution (Team_046): Victor Nowitzki OUT → Manu Dosunmu IN (stamina_rule2)

[00:39] Substitution (Team_046): Lauri Carter OUT → Josh Barrett IN (stamina_rule2)

[00:39] Substitution (Team_046): Cade Wall OUT → Chris LaVine IN (stamina_rule2)

[00:39] Substitution (Team_046): Kevin Allen OUT → Paul DeRozan IN (stamina_rule2)

[00:39] Substitution (Team_036): Michael Westbrook OUT → Dirk Anunoby IN (stamina_rule2)

[00:39] Substitution (Team_036): Giannis Booker OUT → Tobias Fox IN (stamina_rule2)

[00:39] Substitution (Team_036): Anthony Poole OUT → Pascal Antetokounmpo IN (stamina_rule2)

[00:39] Substitution (Team_036): Terry Durant OUT → Devin Simmons IN (stamina_rule2)

[00:39] Substitution (Team_036): Kobe Simmons OUT → Bradley Murray IN (stamina_rule2)

[00:23] Team_036 possession (Score: 15-25)
Devin Simmons attempts a Midrange. Contested by Chris LaVine (4.0 feet, MAN). Devin Simmons misses. Rebound secured by Paul DeRozan.

[00:09] Team_046 possession (Score: 15-25)
Chris LaVine attempts a Midrange. Contested by Devin Simmons (5.7 feet, MAN). Chris LaVine misses. Rebound secured by Pascal Antetokounmpo.

================================================================================
                              1ST QUARTER COMPLETE                              
================================================================================

1ST QUARTER SCORE: Team_046 15, Team_036 25

BOX SCORE:
================================================================================

Team_046
--------------------------------------------------------------------------------
Player                MIN  PTS  REB  AST  TO      FG   FG%      3P   3P%
--------------------------------------------------------------------------------
Victor Nowitzki        12    6    0    1   0   2/3    66.7     0/0   0.0
Lauri Carter           12    5    0    0   0   3/6    50.0     0/0   0.0
Kevin Allen            12    2    4    0   0   1/2    50.0     0/0   0.0
D'Angelo O'Neal        12    2    0    1   0   1/4    25.0     0/0   0.0
Cade Wall              12    0    7    1   0   0/3     0.0     0/0   0.0
Paul DeRozan            0    0    1    0   0   0/0     0.0     0/0   0.0
Chris LaVine            0    0    0    0   0   0/1     0.0     0/0   0.0

TEAM: FG: 7/19 (36.8%), 3PT: 0/4 (0.0%), REB: 11 (2 off, 9 def), AST: 3, TO: 3
TEAM FOULS: 6 [Team_036 in BONUS]


Team_036
--------------------------------------------------------------------------------
Player                MIN  PTS  REB  AST  TO      FG   FG%      3P   3P%
--------------------------------------------------------------------------------
Terry Durant           12   11    3    0   0   5/8    62.5     0/0   0.0
Giannis Booker         12    4    4    1   0   2/3    66.7     0/0   0.0
Kobe Simmons           12    4    4    1   0   2/2   100.0     0/0   0.0
Michael Westbrook      12    3    0    2   0   1/3    33.3     0/0   0.0
Anthony Poole          12    3    0    2   0   1/4    25.0     0/0   0.0
Devin Simmons           0    0    0    0   0   0/1     0.0     0/0   0.0
Pascal Antetokounmpo    0    0    1    0   0   0/0     0.0     0/0   0.0

TEAM: FG: 11/21 (52.4%), 3PT: 2/6 (33.3%), REB: 13 (2 off, 11 def), AST: 6, TO: 0
TEAM FOULS: 4

================================================================================

================================================================================
                       2ND QUARTER - Team_046 vs Team_036                       
================================================================================

[12:00] Team_046 possession (Score: 15-25)
D'Angelo O'Neal attempts a 3Pt. Contested by Terry Durant (4.8 feet, ZONE). D'Angelo O'Neal misses. Rebound secured by Giannis Booker.

[11:49] Team_036 possession (Score: 15-25)
FOUL! Shooting foul on Kevin Allen. Anthony Poole to the line for 2 free throws. [Team fouls: 1] (Kevin Allen: 1 personal fouls)   FT 1/2: GOOD   FT 2/2: MISS Anthony Poole makes 1/2 from the line. Rebound secured by Kevin Allen.
Score: 15-26

[11:34] Team_046 possession (Score: 15-26)
Victor Nowitzki attempts a 3Pt. Contested by Giannis Booker (4.8 feet, MAN). VICTOR NOWITZKI MAKES IT! Assist: D'Angelo O'Neal
Score: 18-26

[11:20] Team_036 possession (Score: 18-26)
Terry Durant drives, Kevin Allen stays with him. Terry Durant attempts a Layup. Contested by Kevin Allen (5.4 feet, ZONE). TERRY DURANT MAKES IT!
Score: 18-28

[11:07] Team_046 possession (Score: 18-28)
Lauri Carter attempts a 3Pt. Contested by Michael Westbrook (5.1 feet, ZONE). Lauri Carter misses. Rebound secured by Giannis Booker.

[10:57] Team_036 possession (Score: 18-28)
Anthony Poole drives to the basket... Anthony Poole throws a bad pass! Stolen by Kevin Allen! TURNOVER! (live ball)

[10:40] Team_046 possession (Score: 18-28)
Kevin Allen drives, Kobe Simmons stays with him. Kevin Allen attempts a Layup. Contested by Kobe Simmons (4.1 feet, MAN). KEVIN ALLEN MAKES IT!
Score: 20-28

[10:29] Team_036 possession (Score: 20-28)
Kobe Simmons attempts a Midrange. Contested by Cade Wall (4.6 feet, ZONE). KOBE SIMMONS MAKES IT! Assist: Giannis Booker
Score: 20-30

[10:11] Team_046 possession (Score: 20-30)
Kevin Allen drives to the basket... Kevin Allen throws a bad pass! Stolen by Kobe Simmons! TURNOVER! (live ball)

[09:56] Team_036 possession (Score: 20-30)
FOUL! Shooting foul on Cade Wall. Terry Durant to the line for 2 free throws. [Team fouls: 2] (Cade Wall: 1 personal fouls)   FT 1/2: GOOD   FT 2/2: GOOD Terry Durant makes 2/2 from the line.
Score: 20-32

[09:46] Team_046 possession (Score: 20-32)
Victor Nowitzki attempts a 3Pt. Contested by Michael Westbrook (5.2 feet, ZONE). VICTOR NOWITZKI MAKES IT! Assist: D'Angelo O'Neal
Score: 23-32

[09:34] Team_036 possession (Score: 23-32)
FOUL! Shooting foul on Lauri Carter. Anthony Poole to the line for 2 free throws. [Team fouls: 3] (Lauri Carter: 1 personal fouls)   FT 1/2: MISS   FT 2/2: GOOD Anthony Poole makes 1/2 from the line.
Score: 23-33

[09:17] Team_046 possession (Score: 23-33)
FOUL! Holding foul on Giannis Booker. [Team fouls: 1] No free throws, side out. (Giannis Booker: 1 personal fouls)

[09:00] Team_046 possession (Score: 23-33)
Lauri Carter makes the Layup and draws the foul on Giannis Booker! And-1! Lauri Carter to the line for 1. [Team fouls: 2] (Giannis Booker: 2 personal fouls)   FT 1/1: GOOD Lauri Carter makes 1/1 from the line.
Score: 26-33

[08:47] Team_036 possession (Score: 26-33)
Terry Durant makes the Midrange and draws the foul on Cade Wall! And-1! Terry Durant to the line for 1. [Team fouls: 4] (Cade Wall: 2 personal fouls)   FT 1/1: GOOD Terry Durant makes 1/1 from the line.
Score: 26-36

[08:35] Team_046 possession (Score: 26-36)
Kevin Allen drives to the basket... Kevin Allen loses control! Ball rolls out of bounds! TURNOVER! (dead ball)

[08:35] Substitution (Team_046): D'Angelo O'Neal OUT → Collin Butler IN (stamina_rule2)

[08:35] Substitution (Team_046): Victor Nowitzki OUT → Manu Dosunmu IN (stamina_rule2)

[08:35] Substitution (Team_046): Lauri Carter OUT → Josh Barrett IN (stamina_rule2)

[08:35] Substitution (Team_046): Cade Wall OUT → Chris LaVine IN (stamina_rule2)

[08:35] Substitution (Team_046): Kevin Allen OUT → Paul DeRozan IN (stamina_rule2)

[08:35] Substitution (Team_036): Michael Westbrook OUT → Dirk Anunoby IN (stamina_rule2)

[08:35] Substitution (Team_036): Giannis Booker OUT → Tobias Fox IN (stamina_rule2)

[08:35] Substitution (Team_036): Anthony Poole OUT → Pascal Antetokounmpo IN (stamina_rule2)

[08:35] Substitution (Team_036): Terry Durant OUT → Devin Simmons IN (stamina_rule2)

[08:35] Substitution (Team_036): Kobe Simmons OUT → Bradley Murray IN (stamina_rule2)

[08:18] Team_036 possession (Score: 26-36)
Dirk Anunoby attempts a Midrange. Contested by Collin Butler (4.3 feet, MAN). DIRK ANUNOBY MAKES IT! Assist: Tobias Fox
Score: 26-38

[08:07] Team_046 possession (Score: 26-38)
Collin Butler attempts a 3Pt. Contested by Tobias Fox (4.8 feet, ZONE). COLLIN BUTLER MAKES IT! Assist: Paul DeRozan
Score: 29-38

[07:53] Team_036 possession (Score: 29-38)
FOUL! Reach-in foul on Chris LaVine during the drive. [IN THE BONUS! 5 team fouls] Devin Simmons to the line for 2 free throws. (Chris LaVine: 1 personal fouls)   FT 1/2: MISS   FT 2/2: MISS Devin Simmons makes 0/2 from the line. Rebound secured by Paul DeRozan.

[07:39] Team_046 possession (Score: 29-38)
Manu Dosunmu attempts a 3Pt. Contested by Tobias Fox (5.1 feet, MAN). Manu Dosunmu misses. Offensive rebound by Chris LaVine! Chris LaVine kicks it out.

[07:23] Team_046 possession (Score: 29-38)
Collin Butler attempts a 3Pt. Contested by Dirk Anunoby (5.8 feet, MAN). Collin Butler misses. Rebound secured by Devin Simmons.

[07:04] Team_036 possession (Score: 29-38)
Pascal Antetokounmpo drives, Josh Barrett stays with him. Pascal Antetokounmpo attempts a Layup. Contested by Josh Barrett (5.1 feet, MAN). Pascal Antetokounmpo misses. FOUL! Loose ball foul on Paul DeRozan during the rebound battle. [IN THE BONUS! 6 team fouls] Bradley Murray to the line for 2 free throws. (Paul DeRozan: 1 personal fouls)   FT 1/2: GOOD   FT 2/2: GOOD Bradley Murray makes 2/2 from the line.
Score: 29-40

[06:53] Team_046 possession (Score: 29-40)
Collin Butler drives, picks up Devin Simmons. Help arrives from Dirk Anunoby! Collin Butler attempts a Layup. Contested by Dirk Anunoby (5.5 feet, ZONE). COLLIN BUTLER MAKES IT!
Score: 31-40

[06:39] Team_036 possession (Score: 31-40)
FOUL! Holding foul on Chris LaVine. [IN THE BONUS! 7 team fouls] Devin Simmons to the line for 2 free throws. (Chris LaVine: 2 personal fouls)   FT 1/2: GOOD   FT 2/2: MISS Devin Simmons makes 1/2 from the line. Rebound secured by Chris LaVine.
Score: 31-41

[06:24] Team_046 possession (Score: 31-41)
Josh Barrett drives, picks up Bradley Murray. Help arrives from Dirk Anunoby! Josh Barrett attempts a Layup. Contested by Dirk Anunoby (4.7 feet, ZONE). Josh Barrett misses. Rebound secured by Devin Simmons.

[06:11] Team_036 possession (Score: 31-41)
Pascal Antetokounmpo attempts a 3Pt. Contested by Collin Butler (4.1 feet, ZONE). Pascal Antetokounmpo misses. Rebound secured by Manu Dosunmu.

[05:53] Team_046 possession (Score: 31-41)
Josh Barrett makes the Layup and draws the foul on Devin Simmons! And-1! Josh Barrett to the line for 1. [Team fouls: 3] (Devin Simmons: 1 personal fouls)   FT 1/1: GOOD Josh Barrett makes 1/1 from the line.
Score: 34-41

[05:42] Team_036 possession (Score: 34-41)
FOUL! Shooting foul on Chris LaVine. Bradley Murray to the line for 2 free throws. [BONUS: 8 team fouls] (Chris LaVine: 3 personal fouls)   FT 1/2: MISS   FT 2/2: GOOD Bradley Murray makes 1/2 from the line.
Score: 34-42

[05:29] Team_046 possession (Score: 34-42)
Josh Barrett attempts a 3Pt. Contested by Tobias Fox (4.6 feet, ZONE). Josh Barrett misses. Rebound secured by Devin Simmons.

[05:17] Team_036 possession (Score: 34-42)
Tobias Fox drives to the basket... Tobias Fox commits a violation (traveling/carry)! TURNOVER! (dead ball)

[05:04] Team_046 possession (Score: 34-42)
Josh Barrett drives, Devin Simmons stays with him. Josh Barrett attempts a Layup. Contested by Devin Simmons (5.3 feet, ZONE). JOSH BARRETT MAKES IT! Assist: Collin Butler
Score: 36-42

[04:52] Team_036 possession (Score: 36-42)
Dirk Anunoby attempts a Midrange. BLOCKED BY COLLIN BUTLER! Ball goes out off Collin Butler. Dirk Anunoby's ball!

[04:39] Team_036 possession (Score: 36-42)
Tobias Fox attempts a 3Pt. Contested by Manu Dosunmu (5.1 feet, MAN). TOBIAS FOX MAKES IT! Assist: Dirk Anunoby
Score: 36-45

[04:22] Team_046 possession (Score: 36-45)
Paul DeRozan drives to the basket... FOUL! Offensive foul on Paul DeRozan! Bradley Murray drew the charge! [Team fouls: 9] (Paul DeRozan: 2 personal fouls) TURNOVER! (dead ball)

[04:06] Team_036 possession (Score: 36-45)
Tobias Fox drives, Chris LaVine stays with him. Tobias Fox attempts a Layup. Contested by Chris LaVine (4.3 feet, ZONE). TOBIAS FOX MAKES IT! Assist: Dirk Anunoby
Score: 36-47

[03:54] Team_046 possession (Score: 36-47)
FOUL! Shooting foul on Bradley Murray. Paul DeRozan to the line for 2 free throws. [Team fouls: 4] (Bradley Murray: 1 personal fouls)   FT 1/2: GOOD   FT 2/2: GOOD Paul DeRozan makes 2/2 from the line.
Score: 38-47

[03:42] Team_036 possession (Score: 38-47)
Tobias Fox attempts a Midrange. Contested by Paul DeRozan (5.3 feet, ZONE). Tobias Fox misses. Rebound secured by Paul DeRozan.

[03:23] Team_046 possession (Score: 38-47)
FOUL! Reach-in foul on Devin Simmons during the drive. [IN THE BONUS! 5 team fouls] Josh Barrett to the line for 2 free throws. (Devin Simmons: 2 personal fouls)   FT 1/2: GOOD   FT 2/2: GOOD Josh Barrett makes 2/2 from the line.
Score: 40-47

[03:09] Team_036 possession (Score: 40-47)
Bradley Murray drives, Chris LaVine stays with him. Bradley Murray attempts a Dunk. Contested by Chris LaVine (3.8 feet, MAN). BRADLEY MURRAY MAKES IT!
Score: 40-49

[02:53] Team_046 possession (Score: 40-49)
Paul DeRozan drives and kicks out. Collin Butler attempts a 3Pt. Contested by Pascal Antetokounmpo (4.8 feet, ZONE). Collin Butler misses. Rebound secured by Pascal Antetokounmpo.

[02:36] Team_036 possession (Score: 40-49)
Bradley Murray makes the Dunk and draws the foul on Manu Dosunmu! And-1! Bradley Murray to the line for 1. [BONUS: 10 team fouls] (Manu Dosunmu: 1 personal fouls)   FT 1/1: GOOD Bradley Murray makes 1/1 from the line.
Score: 40-52

[02:23] Team_046 possession (Score: 40-52)
Collin Butler drives and kicks out. FOUL! Shooting foul on Bradley Murray. Paul DeRozan to the line for 3 free throws. [BONUS: 6 team fouls] (Bradley Murray: 2 personal fouls)   FT 1/3: GOOD   FT 2/3: MISS   FT 3/3: GOOD Paul DeRozan makes 2/3 from the line.
Score: 42-52

[02:09] Team_036 possession (Score: 42-52)
Devin Simmons drives, picks up Chris LaVine. Help arrives from Manu Dosunmu! Devin Simmons attempts a Dunk. Contested by Manu Dosunmu (4.0 feet, ZONE). DEVIN SIMMONS MAKES IT!
Score: 42-54

[01:54] Team_046 possession (Score: 42-54)
Manu Dosunmu attempts a 3Pt. Contested by Devin Simmons (5.8 feet, ZONE). MANU DOSUNMU MAKES IT! Assist: Paul DeRozan
Score: 45-54

[01:37] Team_036 possession (Score: 45-54)
Pascal Antetokounmpo drives and kicks out. Tobias Fox attempts a 3Pt. Contested by Collin Butler (3.9 feet, ZONE). Tobias Fox misses. FOUL! Loose ball foul on Manu Dosunmu during the rebound battle. [IN THE BONUS! 11 team fouls] Devin Simmons to the line for 2 free throws. (Manu Dosunmu: 2 personal fouls)   FT 1/2: GOOD   FT 2/2: GOOD Devin Simmons makes 2/2 from the line.
Score: 45-56

[01:22] Team_046 possession (Score: 45-56)
Manu Dosunmu attempts a 3Pt. Contested by Tobias Fox (5.1 feet, MAN). MANU DOSUNMU MAKES IT!
Score: 48-56

[01:11] Team_036 possession (Score: 48-56)
Dirk Anunoby attempts a Midrange. Contested by Collin Butler (4.4 feet, MAN). Dirk Anunoby misses. Rebound secured by Paul DeRozan.

[00:58] Team_046 possession (Score: 48-56)
Chris LaVine attempts a Midrange. Contested by Devin Simmons (5.8 feet, MAN). CHRIS LAVINE MAKES IT!
Score: 50-56

[00:41] Team_036 possession (Score: 50-56)
Tobias Fox attempts a 3Pt. Contested by Collin Butler (4.4 feet, ZONE). TOBIAS FOX MAKES IT!
Score: 50-59

[00:27] Team_046 possession (Score: 50-59)
Paul DeRozan drives and kicks out. Paul DeRozan attempts a 3Pt. Contested by Tobias Fox (4.7 feet, ZONE). PAUL DEROZAN MAKES IT! Assist: Josh Barrett
Score: 53-59

[00:13] Team_036 possession (Score: 53-59)
Devin Simmons attempts a Midrange. Contested by Chris LaVine (4.2 feet, MAN). DEVIN SIMMONS MAKES IT! Assist: Bradley Murray
Score: 53-61

[00:01] Team_046 possession (Score: 53-61)
Paul DeRozan drives and kicks out. Paul DeRozan attempts a 3Pt. Contested by Bradley Murray (4.8 feet, MAN). Paul DeRozan misses. Rebound secured by Pascal Antetokounmpo.

================================================================================
                              2ND QUARTER COMPLETE                              
================================================================================

2ND QUARTER SCORE: Team_046 38, Team_036 36

BOX SCORE:
================================================================================

Team_046
--------------------------------------------------------------------------------
Player                MIN  PTS  REB  AST  TO      FG   FG%      3P   3P%
--------------------------------------------------------------------------------
Paul DeRozan            9    7    3    2   0   3/5    60.0     0/0   0.0
Josh Barrett            9    7    0    1   0   3/5    60.0     0/0   0.0
Victor Nowitzki        15    6    0    0   0   2/2   100.0     0/0   0.0
Manu Dosunmu            9    6    1    0   0   2/2   100.0     0/0   0.0
Collin Butler           9    5    0    1   0   2/3    66.7     0/0   0.0
Lauri Carter           15    3    0    0   0   1/2    50.0     0/0   0.0
Kevin Allen            15    2    1    0   0   1/1   100.0     0/0   0.0
Chris LaVine            9    2    2    0   0   1/1   100.0     0/0   0.0
D'Angelo O'Neal        15    0    0    2   0   0/1     0.0     0/0   0.0

TEAM: FG: 15/22 (68.2%), 3PT: 5/9 (55.6%), REB: 7 (1 off, 6 def), AST: 6, TO: 3
TEAM FOULS: 11 [Team_036 in BONUS]


Team_036
--------------------------------------------------------------------------------
Player                MIN  PTS  REB  AST  TO      FG   FG%      3P   3P%
--------------------------------------------------------------------------------
Tobias Fox              9    8    0    1   0   3/4    75.0     0/0   0.0
Bradley Murray          9    8    0    1   0   4/4   100.0     0/0   0.0
Terry Durant           15    7    0    0   0   3/3   100.0     0/0   0.0
Devin Simmons           9    6    3    0   0   3/4    75.0     0/0   0.0
Kobe Simmons           15    2    0    0   0   1/1   100.0     0/0   0.0
Dirk Anunoby            9    2    0    2   0   1/2    50.0     0/0   0.0
Anthony Poole          15    1    0    0   0   1/2    50.0     0/0   0.0
Giannis Booker         15    0    2    1   0   0/0     0.0     0/0   0.0
Pascal Antetokounmpo    9    0    2    0   0   0/1     0.0     0/0   0.0

TEAM: FG: 16/22 (72.7%), 3PT: 2/3 (66.7%), REB: 7 (0 off, 7 def), AST: 5, TO: 2
TEAM FOULS: 6 [Team_046 in BONUS]

================================================================================

================================================================================
                       3RD QUARTER - Team_046 vs Team_036                       
================================================================================

[12:00] Team_046 possession (Score: 53-61)
Cade Wall attempts a 3Pt. Contested by Terry Durant (5.1 feet, MAN). Cade Wall misses. Rebound secured by Kobe Simmons.

[11:45] Team_036 possession (Score: 53-61)
Anthony Poole attempts a Midrange. Contested by Lauri Carter (4.0 feet, MAN). ANTHONY POOLE MAKES IT! Assist: Kobe Simmons
Score: 53-63

[11:27] Team_046 possession (Score: 53-63)
D'Angelo O'Neal drives and kicks out. Cade Wall attempts a 3Pt. Contested by Michael Westbrook (4.6 feet, ZONE). Cade Wall misses. Rebound secured by Terry Durant.

[11:08] Team_036 possession (Score: 53-63)
Anthony Poole attempts a Midrange. Contested by Lauri Carter (4.0 feet, MAN). Anthony Poole misses. Offensive rebound by Kobe Simmons! Kobe Simmons's putback is no good. Offensive rebound by Terry Durant! Terry Durant kicks it out.

[10:53] Team_036 possession (Score: 53-63)
Anthony Poole attempts a 3Pt. Contested by Lauri Carter (4.0 feet, MAN). Anthony Poole misses. Rebound secured by Lauri Carter.

[10:41] Team_046 possession (Score: 53-63)
Cade Wall drives to the basket... FOUL! Offensive foul on Cade Wall! Terry Durant drew the charge! [Team fouls: 2] (Cade Wall: 1 personal fouls) TURNOVER! (dead ball)

[10:26] Team_036 possession (Score: 53-63)
Giannis Booker attempts a Midrange. Contested by Cade Wall (4.1 feet, ZONE). Giannis Booker misses. Rebound secured by Cade Wall.

[10:13] Team_046 possession (Score: 53-63)
Cade Wall attempts a 3Pt. Contested by Michael Westbrook (5.3 feet, ZONE). Cade Wall misses. Rebound secured by Giannis Booker.

[09:57] Team_036 possession (Score: 53-63)
Terry Durant drives, picks up Cade Wall. Help arrives from D'Angelo O'Neal! Terry Durant attempts a Layup. Contested by D'Angelo O'Neal (4.2 feet, MAN). TERRY DURANT MAKES IT! Assist: Kobe Simmons
Score: 53-65

[09:43] Team_046 possession (Score: 53-65)
Lauri Carter attempts a 3Pt. Contested by Anthony Poole (5.1 feet, MAN). Lauri Carter misses. Rebound secured by Kobe Simmons.

[09:26] Team_036 possession (Score: 53-65)
Terry Durant throws a bad pass! Stolen by Cade Wall! TURNOVER! (live ball)

[09:17] Team_046 possession (Score: 53-65)
D'Angelo O'Neal drives to the basket... D'Angelo O'Neal throws a bad pass! Stolen by Michael Westbrook! TURNOVER! (live ball)

[09:00] Team_036 possession (Score: 53-65)
Kobe Simmons drives, picks up Kevin Allen. Help arrives from D'Angelo O'Neal! Kobe Simmons attempts a Layup. Contested by D'Angelo O'Neal (5.0 feet, MAN). KOBE SIMMONS MAKES IT! Assist: Giannis Booker
Score: 53-67

[08:43] Team_046 possession (Score: 53-67)
Victor Nowitzki drives and kicks out. FOUL! Shooting foul on Anthony Poole. Lauri Carter to the line for 2 free throws. [Team fouls: 1] (Anthony Poole: 1 personal fouls)   FT 1/2: GOOD   FT 2/2: GOOD Lauri Carter makes 2/2 from the line.
Score: 55-67

[08:29] Team_036 possession (Score: 55-67)
FOUL! Reach-in foul on D'Angelo O'Neal during the drive. [Team fouls: 3] No free throws, side out. (D'Angelo O'Neal: 1 personal fouls)

[08:17] Team_036 possession (Score: 55-67)
Michael Westbrook attempts a 3Pt. Contested by Lauri Carter (3.7 feet, ZONE). Michael Westbrook misses. Rebound secured by Cade Wall.

[08:01] Team_046 possession (Score: 55-67)
Cade Wall throws a bad pass out of bounds! TURNOVER! (dead ball)

[07:50] Team_036 possession (Score: 55-67)
Giannis Booker drives, Kevin Allen stays with him. Giannis Booker attempts a Layup. Contested by Kevin Allen (5.0 feet, ZONE). GIANNIS BOOKER MAKES IT! Assist: Anthony Poole
Score: 55-69

[07:35] Team_046 possession (Score: 55-69)
Cade Wall drives, Kobe Simmons stays with him. Cade Wall attempts a Layup. Contested by Kobe Simmons (4.1 feet, ZONE). Cade Wall misses. Rebound secured by Kobe Simmons.

[07:19] Team_036 possession (Score: 55-69)
Giannis Booker attempts a 3Pt. Contested by Victor Nowitzki (5.9 feet, MAN). Giannis Booker misses. Rebound secured by Cade Wall.

[07:03] Team_046 possession (Score: 55-69)
Lauri Carter attempts a 3Pt. Contested by Anthony Poole (5.1 feet, MAN). Lauri Carter misses. Rebound secured by Giannis Booker.

[06:52] Team_036 possession (Score: 55-69)
Giannis Booker drives, Victor Nowitzki stays with him. Giannis Booker attempts a Dunk. Contested by Victor Nowitzki (5.9 feet, MAN). GIANNIS BOOKER MAKES IT!
Score: 55-71

[06:37] Team_046 possession (Score: 55-71)
Kevin Allen attempts a 3Pt. Contested by Michael Westbrook (4.9 feet, ZONE). Kevin Allen misses. Rebound secured by Giannis Booker.

[06:23] Team_036 possession (Score: 55-71)
Terry Durant attempts a Midrange. Contested by Cade Wall (4.2 feet, MAN). Terry Durant misses. Rebound secured by Kevin Allen.

[06:06] Team_046 possession (Score: 55-71)
Lauri Carter attempts a Layup. Contested by Anthony Poole (5.1 feet, MAN). Lauri Carter misses. Offensive rebound by Kevin Allen! Kevin Allen kicks it out.

[05:49] Team_046 possession (Score: 55-71)
D'Angelo O'Neal drives, picks up Kobe Simmons. Help arrives from Giannis Booker! D'Angelo O'Neal attempts a Dunk. Contested by Giannis Booker (3.7 feet, ZONE). D'Angelo O'Neal misses. Rebound secured by Terry Durant.

[05:31] Team_036 possession (Score: 55-71)
Giannis Booker attempts a 3Pt. Contested by Lauri Carter (3.6 feet, ZONE). Giannis Booker misses. Offensive rebound by Kobe Simmons! Kobe Simmons's putback is no good. Offensive rebound by Kobe Simmons! Kobe Simmons kicks it out.

[05:15] Team_036 possession (Score: 55-71)
Giannis Booker attempts a Layup. BLOCKED BY D'ANGELO O'NEAL! Ball goes out off D'Angelo O'Neal. Giannis Booker's ball!

[05:02] Team_036 possession (Score: 55-71)
Terry Durant drives, Cade Wall stays with him. Terry Durant attempts a Layup. Contested by Cade Wall (4.2 feet, MAN). TERRY DURANT MAKES IT! Assist: Kobe Simmons
Score: 55-73

[04:47] Team_046 possession (Score: 55-73)
Lauri Carter attempts a Midrange. Contested by Giannis Booker (4.7 feet, ZONE). Lauri Carter misses. Rebound secured by Terry Durant.

[04:35] Team_036 possession (Score: 55-73)
Giannis Booker attempts a 3Pt. Contested by Lauri Carter (3.7 feet, ZONE). Giannis Booker misses. Rebound secured by Kevin Allen.

[04:23] Team_046 possession (Score: 55-73)
Victor Nowitzki drives and kicks out. FOUL! Shooting foul on Giannis Booker. Victor Nowitzki to the line for 2 free throws. [Team fouls: 2] (Giannis Booker: 1 personal fouls)   FT 1/2: GOOD   FT 2/2: GOOD Victor Nowitzki makes 2/2 from the line.
Score: 57-73

[04:10] Team_036 possession (Score: 57-73)
Anthony Poole drives to the basket... Anthony Poole throws a bad pass out of bounds! TURNOVER! (dead ball)

[04:00] Team_046 possession (Score: 57-73)
Kevin Allen attempts a Layup. BLOCKED BY GIANNIS BOOKER! Ball is loose! Rebound secured by Kobe Simmons.

[03:45] Team_036 possession (Score: 57-73)
FOUL! Shooting foul on Cade Wall. Terry Durant to the line for 2 free throws. [Team fouls: 4] (Cade Wall: 2 personal fouls)   FT 1/2: GOOD   FT 2/2: MISS Terry Durant makes 1/2 from the line. Rebound secured by Kevin Allen.
Score: 57-74

[03:35] Team_046 possession (Score: 57-74)
FOUL! Shooting foul on Giannis Booker. Victor Nowitzki to the line for 2 free throws. [Team fouls: 3] (Giannis Booker: 2 personal fouls)   FT 1/2: GOOD   FT 2/2: GOOD Victor Nowitzki makes 2/2 from the line.
Score: 59-74

[03:17] Team_036 possession (Score: 59-74)
Giannis Booker commits a violation (traveling/carry)! TURNOVER! (dead ball)

[03:17] Substitution (Team_046): Kevin Allen OUT → Paul DeRozan IN (stamina_rule2)

[03:04] Team_046 possession (Score: 59-74)
Lauri Carter drives and kicks out. Victor Nowitzki attempts a 3Pt. Contested by Giannis Booker (4.7 feet, MAN). VICTOR NOWITZKI MAKES IT! Assist: Paul DeRozan
Score: 62-74

[02:52] Team_036 possession (Score: 62-74)
Anthony Poole attempts a 3Pt. Contested by Lauri Carter (4.2 feet, ZONE). Anthony Poole misses. Rebound secured by Paul DeRozan.

[02:38] Team_046 possession (Score: 62-74)
D'Angelo O'Neal attempts a 3Pt. Contested by Giannis Booker (4.9 feet, ZONE). D'ANGELO O'NEAL MAKES IT!
Score: 65-74

[02:24] Team_036 possession (Score: 65-74)
FOUL! Reach-in foul on Cade Wall during the drive. [IN THE BONUS! 5 team fouls] Terry Durant to the line for 2 free throws. (Cade Wall: 3 personal fouls)   FT 1/2: GOOD   FT 2/2: GOOD Terry Durant makes 2/2 from the line.
Score: 65-76

[02:09] Team_046 possession (Score: 65-76)
Victor Nowitzki attempts a 3Pt. Contested by Michael Westbrook (5.0 feet, ZONE). Victor Nowitzki misses. Offensive rebound by Cade Wall! Cade Wall kicks it out.

[01:53] Team_046 possession (Score: 65-76)
Paul DeRozan drives, picks up Kobe Simmons. Help arrives from Giannis Booker! Paul DeRozan attempts a Dunk. Contested by Giannis Booker (3.9 feet, MAN). PAUL DEROZAN MAKES IT! Assist: Lauri Carter
Score: 67-76

[01:42] Team_036 possession (Score: 67-76)
Michael Westbrook attempts a Midrange. Contested by D'Angelo O'Neal (4.9 feet, MAN). MICHAEL WESTBROOK MAKES IT! Assist: Kobe Simmons
Score: 67-78

[01:26] Team_046 possession (Score: 67-78)
Victor Nowitzki attempts a 3Pt. Contested by Michael Westbrook (5.1 feet, ZONE). VICTOR NOWITZKI MAKES IT! Assist: Paul DeRozan
Score: 70-78

[01:12] Team_036 possession (Score: 70-78)
Giannis Booker attempts a Midrange. Wide open! Victor Nowitzki is 6.2 feet away. [MAN] GIANNIS BOOKER MAKES IT! Assist: Kobe Simmons
Score: 70-80

[01:00] Team_046 possession (Score: 70-80)
D'Angelo O'Neal attempts a 3Pt. Contested by Michael Westbrook (5.2 feet, MAN). D'Angelo O'Neal misses. Rebound secured by Terry Durant.

[00:48] Team_036 possession (Score: 70-80)
Michael Westbrook attempts a 3Pt. Contested by Lauri Carter (4.2 feet, ZONE). Michael Westbrook misses. Rebound secured by Lauri Carter.

[00:31] Team_046 possession (Score: 70-80)
Victor Nowitzki attempts a 3Pt. Contested by Michael Westbrook (5.2 feet, ZONE). Victor Nowitzki misses. Rebound secured by Terry Durant.

[00:13] Team_036 possession (Score: 70-80)
Michael Westbrook attempts a 3Pt. Contested by D'Angelo O'Neal (5.1 feet, MAN). Michael Westbrook misses. Rebound secured by Cade Wall.

================================================================================
                              3RD QUARTER COMPLETE                              
================================================================================

3RD QUARTER SCORE: Team_046 17, Team_036 19

BOX SCORE:
================================================================================

Team_046
--------------------------------------------------------------------------------
Player                MIN  PTS  REB  AST  TO      FG   FG%      3P   3P%
--------------------------------------------------------------------------------
Victor Nowitzki        27   10    0    0   0   4/5    80.0     0/0   0.0
D'Angelo O'Neal        27    3    0    0   0   1/4    25.0     0/0   0.0
Lauri Carter           27    2    2    1   0   1/4    25.0     0/0   0.0
Paul DeRozan           12    2    1    2   0   1/1   100.0     0/0   0.0
Cade Wall              27    0    5    0   0   0/3     0.0     0/0   0.0
Kevin Allen            24    0    4    0   0   0/2     0.0     0/0   0.0

TEAM: FG: 7/19 (36.8%), 3PT: 2/9 (22.2%), REB: 12 (2 off, 10 def), AST: 3, TO: 3
TEAM FOULS: 5 [Team_036 in BONUS]


Team_036
--------------------------------------------------------------------------------
Player                MIN  PTS  REB  AST  TO      FG   FG%      3P   3P%
--------------------------------------------------------------------------------
Terry Durant           27    6    6    0   0   3/5    60.0     0/0   0.0
Giannis Booker         27    6    3    1   0   3/6    50.0     0/0   0.0
Kobe Simmons           27    2    5    5   0   1/1   100.0     0/0   0.0
Anthony Poole          27    2    0    1   0   1/3    33.3     0/0   0.0
Michael Westbrook      27    2    0    0   0   1/4    25.0     0/0   0.0

TEAM: FG: 9/19 (47.4%), 3PT: 0/7 (0.0%), REB: 14 (2 off, 12 def), AST: 7, TO: 3
TEAM FOULS: 3

================================================================================

================================================================================
                       4TH QUARTER - Team_046 vs Team_036                       
================================================================================

[12:00] Substitution (Team_046): D'Angelo O'Neal OUT (stamina: 68) → Collin Butler IN (comeback_detected)

[12:00] Substitution (Team_036): Michael Westbrook OUT (stamina: 70) → Dirk Anunoby IN (comeback_detected)

[12:00] Team_046 possession (Score: 70-80)
Collin Butler drives, Dirk Anunoby stays with him. Collin Butler attempts a Dunk. Contested by Dirk Anunoby (5.8 feet, MAN). COLLIN BUTLER MAKES IT! Assist: Victor Nowitzki
Score: 72-80

[11:44] Team_036 possession (Score: 72-80)
Anthony Poole attempts a 3Pt. Contested by Lauri Carter (4.3 feet, MAN). ANTHONY POOLE MAKES IT! Assist: Terry Durant
Score: 72-83

[11:27] Team_046 possession (Score: 72-83)
Cade Wall attempts a Midrange. Contested by Terry Durant (5.4 feet, MAN). Cade Wall misses. Rebound secured by Kobe Simmons.

[11:12] Team_036 possession (Score: 72-83)
Giannis Booker attempts a 3Pt. Contested by Collin Butler (4.2 feet, ZONE). GIANNIS BOOKER MAKES IT! Assist: Anthony Poole
Score: 72-86

[10:55] Team_046 possession (Score: 72-86)
Kevin Allen drives, picks up Kobe Simmons. Help arrives from Giannis Booker! Kevin Allen attempts a Dunk. Contested by Giannis Booker (4.3 feet, ZONE). KEVIN ALLEN MAKES IT!
Score: 74-86

[10:38] Team_036 possession (Score: 74-86)
Dirk Anunoby attempts a 3Pt. Contested by Collin Butler (4.3 feet, MAN). Dirk Anunoby misses. Rebound secured by Kevin Allen.

[10:21] Team_046 possession (Score: 74-86)
Victor Nowitzki attempts a 3Pt. Contested by Giannis Booker (5.0 feet, ZONE). VICTOR NOWITZKI MAKES IT! Assist: Lauri Carter
Score: 77-86

[10:05] Team_036 possession (Score: 77-86)
Terry Durant drives, Cade Wall stays with him. Terry Durant attempts a Layup. Contested by Cade Wall (4.8 feet, MAN). TERRY DURANT MAKES IT! Assist: Anthony Poole
Score: 77-88

[09:54] Team_046 possession (Score: 77-88)
Kevin Allen attempts a Midrange. Contested by Kobe Simmons (4.4 feet, ZONE). Kevin Allen misses. Offensive rebound by Kevin Allen! Kevin Allen kicks it out.

[09:40] Team_046 possession (Score: 77-88)
Cade Wall attempts a Midrange. Contested by Terry Durant (5.5 feet, MAN). CADE WALL MAKES IT!
Score: 79-88

[09:25] Team_036 possession (Score: 79-88)
Dirk Anunoby attempts a 3Pt. Contested by Collin Butler (4.3 feet, MAN). Dirk Anunoby misses. Rebound secured by Collin Butler.

[09:09] Team_046 possession (Score: 79-88)
Collin Butler attempts a 3Pt. Contested by Giannis Booker (5.4 feet, ZONE). Collin Butler misses. Rebound secured by Kobe Simmons.

[08:56] Team_036 possession (Score: 79-88)
Kobe Simmons attempts a Dunk. BLOCKED BY COLLIN BUTLER! Ball is loose! Rebound secured by Kevin Allen.

[08:40] Team_046 possession (Score: 79-88)
Collin Butler attempts a Midrange. Contested by Giannis Booker (5.4 feet, ZONE). COLLIN BUTLER MAKES IT! Assist: Victor Nowitzki
Score: 81-88

[08:25] Team_036 possession (Score: 81-88)
Anthony Poole attempts a Midrange. Contested by Lauri Carter (4.7 feet, ZONE). ANTHONY POOLE MAKES IT!
Score: 81-90

[08:13] Team_046 possession (Score: 81-90)
FOUL! Holding foul on Dirk Anunoby. [Team fouls: 1] No free throws, side out. (Dirk Anunoby: 1 personal fouls)

[08:02] Team_046 possession (Score: 81-90)
Victor Nowitzki throws a bad pass! Stolen by Giannis Booker! TURNOVER! (live ball)

[07:47] Team_036 possession (Score: 81-90)
Terry Durant loses the ball! Stripped by Cade Wall! TURNOVER! (live ball)

[07:28] Team_046 possession (Score: 81-90)
Victor Nowitzki attempts a Layup. Contested by Giannis Booker (5.3 feet, MAN). Victor Nowitzki misses. FOUL! Loose ball foul on Terry Durant during the rebound battle. [Team fouls: 2] No free throws, side out. (Terry Durant: 1 personal fouls)

[07:10] Team_046 possession (Score: 81-90)
Victor Nowitzki attempts a 3Pt. Contested by Giannis Booker (5.3 feet, MAN). Victor Nowitzki misses. Rebound secured by Kobe Simmons.

[06:57] Team_036 possession (Score: 81-90)
Giannis Booker attempts a 3Pt. Contested by Collin Butler (4.1 feet, ZONE). Giannis Booker misses. Offensive rebound by Terry Durant! Terry Durant kicks it out.

[06:44] Team_036 possession (Score: 81-90)
Terry Durant attempts a Layup. Contested by Kevin Allen (5.4 feet, ZONE). Terry Durant misses. Rebound secured by Kevin Allen.

[06:33] Team_046 possession (Score: 81-90)
Collin Butler drives and kicks out. Lauri Carter attempts a 3Pt. Contested by Dirk Anunoby (5.5 feet, ZONE). Lauri Carter misses. Offensive rebound by Cade Wall! Cade Wall kicks it out.

[06:20] Team_046 possession (Score: 81-90)
Victor Nowitzki drives, Giannis Booker stays with him. Victor Nowitzki attempts a Dunk. Contested by Giannis Booker (5.4 feet, MAN). VICTOR NOWITZKI MAKES IT!
Score: 83-90

[06:03] Team_036 possession (Score: 83-90)
Dirk Anunoby attempts a 3Pt. Contested by Collin Butler (4.3 feet, MAN). Dirk Anunoby misses. Rebound secured by Kevin Allen.

[05:51] Team_046 possession (Score: 83-90)
Collin Butler attempts a Layup. Contested by Dirk Anunoby (5.8 feet, MAN). COLLIN BUTLER MAKES IT! Assist: Cade Wall
Score: 85-90

[05:40] Team_036 possession (Score: 85-90)
Dirk Anunoby attempts a Midrange. Contested by Cade Wall (5.6 feet, ZONE). Dirk Anunoby misses. Offensive rebound by Kobe Simmons! Kobe Simmons's putback is no good. Offensive rebound by Kobe Simmons! Kobe Simmons kicks it out.

[05:23] Team_036 possession (Score: 85-90)
Dirk Anunoby drives, Collin Butler stays with him. Dirk Anunoby attempts a Dunk. Contested by Collin Butler (4.3 feet, MAN). DIRK ANUNOBY MAKES IT! Assist: Giannis Booker
Score: 85-92

[05:05] Team_046 possession (Score: 85-92)
Victor Nowitzki makes the Layup and draws the foul on Terry Durant! And-1! Victor Nowitzki to the line for 1. [Team fouls: 3] (Terry Durant: 2 personal fouls)   FT 1/1: GOOD Victor Nowitzki makes 1/1 from the line.
Score: 88-92

[04:52] Team_036 possession (Score: 88-92)
Dirk Anunoby attempts a Layup. BLOCKED BY COLLIN BUTLER! Ball deflects out of bounds off Dirk Anunoby.

[04:38] Team_046 possession (Score: 88-92)
FOUL! Holding foul on Kobe Simmons. [Team fouls: 4] No free throws, side out. (Kobe Simmons: 1 personal fouls)

[04:21] Team_046 possession (Score: 88-92)
FOUL! Shooting foul on Giannis Booker. Victor Nowitzki to the line for 2 free throws. [BONUS: 5 team fouls] (Giannis Booker: 1 personal fouls)   FT 1/2: GOOD   FT 2/2: GOOD Victor Nowitzki makes 2/2 from the line.
Score: 90-92

[04:08] Team_036 possession (Score: 90-92)
Terry Durant attempts a 3Pt. Contested by Collin Butler (4.1 feet, ZONE). Terry Durant misses. Rebound secured by Kevin Allen.

[03:54] Team_046 possession (Score: 90-92)
Kevin Allen makes the Midrange and draws the foul on Kobe Simmons! And-1! Kevin Allen to the line for 1. [BONUS: 6 team fouls] (Kobe Simmons: 2 personal fouls)   FT 1/1: GOOD Kevin Allen makes 1/1 from the line.
Score: 93-92

[03:37] Team_036 possession (Score: 93-92)
FOUL! Shooting foul on Cade Wall. Terry Durant to the line for 2 free throws. [Team fouls: 2] (Cade Wall: 2 personal fouls)   FT 1/2: GOOD   FT 2/2: GOOD Terry Durant makes 2/2 from the line.
Score: 93-94

[03:25] Team_046 possession (Score: 93-94)
Collin Butler drives, Kobe Simmons stays with him. Collin Butler attempts a Layup. Contested by Kobe Simmons (5.6 feet, ZONE). COLLIN BUTLER MAKES IT! Assist: Kevin Allen
Score: 95-94

[03:13] Team_036 possession (Score: 95-94)
Dirk Anunoby attempts a 3Pt. Contested by Collin Butler (4.5 feet, MAN). Dirk Anunoby misses. Offensive rebound by Terry Durant! Terry Durant kicks it out.

[02:59] Team_036 possession (Score: 95-94)
Anthony Poole attempts a 3Pt. Contested by Collin Butler (4.5 feet, ZONE). Anthony Poole misses. Rebound secured by Collin Butler.

[02:47] Team_046 possession (Score: 95-94)
Cade Wall attempts a Midrange. Wide open! Anthony Poole is 6.5 feet away. [ZONE] CADE WALL MAKES IT! Assist: Lauri Carter
Score: 97-94

[02:34] Team_036 possession (Score: 97-94)
Terry Durant attempts a 3Pt. Contested by Cade Wall (5.9 feet, MAN). TERRY DURANT MAKES IT! Assist: Giannis Booker
Score: 97-97

[02:23] Team_046 possession (Score: 97-97)
Lauri Carter attempts a 3Pt. Wide open! Anthony Poole is 6.3 feet away. [MAN] Lauri Carter misses. Rebound secured by Dirk Anunoby.

[02:11] Team_036 possession (Score: 97-97)
Anthony Poole attempts a Midrange. Contested by Lauri Carter (5.6 feet, MAN). ANTHONY POOLE MAKES IT! Assist: Dirk Anunoby
Score: 97-99

[02:00] Team_046 possession (Score: 97-99)
Victor Nowitzki attempts a Layup. Contested by Kobe Simmons (5.5 feet, ZONE). VICTOR NOWITZKI MAKES IT! Assist: Kevin Allen
Score: 99-99

[01:44] Team_036 possession (Score: 99-99)
Giannis Booker attempts a 3Pt. Contested by Collin Butler (4.4 feet, ZONE). Giannis Booker misses. Rebound secured by Collin Butler.

[01:31] Team_046 possession (Score: 99-99)
Collin Butler attempts a 3Pt. Wide open! Dirk Anunoby is 6.1 feet away. [ZONE] Collin Butler misses. Rebound secured by Kobe Simmons.

[01:17] Team_036 possession (Score: 99-99)
Kobe Simmons attempts a Midrange. Wide open! Kevin Allen is 6.1 feet away. [MAN] KOBE SIMMONS MAKES IT!
Score: 99-101

[01:07] Team_046 possession (Score: 99-101)
Cade Wall attempts a 3Pt. Wide open! Dirk Anunoby is 6.1 feet away. [ZONE] Cade Wall misses. Rebound secured by Terry Durant.

[00:52] Team_036 possession (Score: 99-101)
Terry Durant drives, picks up Cade Wall. Help arrives from Collin Butler! Terry Durant attempts a Dunk. Wide open! Collin Butler is 6.2 feet away. [MAN] Terry Durant misses. Rebound secured by Collin Butler.

[00:39] Team_046 possession (Score: 99-101)
Kevin Allen attempts a Layup. Contested by Kobe Simmons (6.0 feet, MAN). Kevin Allen misses. Rebound secured by Kobe Simmons.

[00:23] Team_036 possession (Score: 99-101)
Anthony Poole attempts a 3Pt. Wide open! Cade Wall is 6.5 feet away. [ZONE] ANTHONY POOLE MAKES IT! Assist: Giannis Booker
Score: 99-104

[00:11] Team_046 possession (Score: 99-104)
Kevin Allen attempts a Layup. Wide open! Kobe Simmons is 6.1 feet away. [MAN] KEVIN ALLEN MAKES IT! Assist: Lauri Carter
Score: 101-104

================================================================================
                              4TH QUARTER COMPLETE                              
================================================================================

4TH QUARTER SCORE: Team_046 31, Team_036 24

BOX SCORE:
================================================================================

Team_046
--------------------------------------------------------------------------------
Player                MIN  PTS  REB  AST  TO      FG   FG%      3P   3P%
--------------------------------------------------------------------------------
Victor Nowitzki        39   12    0    2   0   5/6    83.3     0/0   0.0
Collin Butler          21    8    4    0   0   4/6    66.7     0/0   0.0
Kevin Allen            36    7    7    2   0   3/4    75.0     0/0   0.0
Cade Wall              39    4    1    1   0   2/4    50.0     0/0   0.0
Lauri Carter           39    0    0    3   0   0/1     0.0     0/0   0.0

TEAM: FG: 14/21 (66.7%), 3PT: 1/6 (16.7%), REB: 12 (3 off, 9 def), AST: 8, TO: 1
TEAM FOULS: 2


Team_036
--------------------------------------------------------------------------------
Player                MIN  PTS  REB  AST  TO      FG   FG%      3P   3P%
--------------------------------------------------------------------------------
Anthony Poole          39   10    0    2   0   4/5    80.0     0/0   0.0
Terry Durant           39    7    3    1   0   3/6    50.0     0/0   0.0
Giannis Booker         39    3    0    3   0   1/2    50.0     0/0   0.0
Kobe Simmons           39    2    6    0   0   1/2    50.0     0/0   0.0
Dirk Anunoby           21    2    1    1   0   1/5    20.0     0/0   0.0

TEAM: FG: 10/20 (50.0%), 3PT: 4/10 (40.0%), REB: 10 (3 off, 7 def), AST: 7, TO: 1
TEAM FOULS: 6 [Team_046 in BONUS]

================================================================================

================================================================================
                               FULL GAME COMPLETE                               
================================================================================

FINAL SCORE: Team_046 101, Team_036 104

SCORING BY QUARTER:
--------------------------------------------------------------------------------
Team                     Q1     Q2     Q3     Q4    FINAL
--------------------------------------------------------------------------------
Team_046                 15     38     17     31      101
Team_036                 25     36     19     24      104
--------------------------------------------------------------------------------

FULL GAME BOX SCORE:
================================================================================

Team_046
--------------------------------------------------------------------------------
Player                MIN  PTS  REB  AST  TO      FG   FG%      3P   3P%      FT STL BLK
--------------------------------------------------------------------------------
Victor Nowitzki        39   34    0    3   3  13/16   81.2   4/7    57.1   8/8     0   0
Lauri Carter           39   10    2    4   1   5/13   38.5   0/5     0.0   4/5     0   0
Cade Wall              39    4   13    2   2   3/11   27.3   0/3     0.0   0/0     2   0
Kevin Allen            36   11   16    2   1   4/8    50.0   0/1     0.0   1/1     1   0
D'Angelo O'Neal        27    5    0    3   2   2/9    22.2   1/5    20.0   0/0     0   1
Collin Butler          21   13    4    1   0   7/10   70.0   1/4    25.0   0/0     0   3
Paul DeRozan           12    9    5    4   0   3/5    60.0   0/0     0.0   4/5     0   0
Manu Dosunmu            9    6    1    0   0   2/2   100.0   2/2   100.0   0/0     0   0
Josh Barrett            9    7    0    1   0   3/5    60.0   0/1     0.0   3/3     0   0
Chris LaVine            9    2    2    0   1   1/2    50.0   0/0     0.0   0/0     0   0

TEAM: FG: 43/81 (53.1%), 3PT: 8/28 (28.6%), REB: 42 (8 off, 34 def), AST: 20, TO: 10


Team_036
--------------------------------------------------------------------------------
Player                MIN  PTS  REB  AST  TO      FG   FG%      3P   3P%      FT STL BLK
--------------------------------------------------------------------------------
Giannis Booker         39   13    9    6   1   5/10   50.0   1/5    20.0   1/2     1   1
Anthony Poole          39   16    0    5   1   7/14   50.0   3/8    37.5   2/4     0   0
Terry Durant           39   31   12    1   2  14/22   63.6   1/2    50.0  11/13    0   1
Kobe Simmons           39   10   15    6   1   5/6    83.3   0/0     0.0   0/0     1   1
Michael Westbrook      27    5    0    2   0   2/7    28.6   1/5    20.0   0/0     1   0
Dirk Anunoby           21    4    1    3   0   2/7    28.6   0/3     0.0   0/0     0   0
Tobias Fox              9    8    0    1   1   3/4    75.0   2/2   100.0   0/0     0   0
Pascal Antetokounmpo    9    0    3    0   0   2/3    66.7   0/1     0.0   0/0     0   0
Devin Simmons           9    6    3    0   0   2/4    50.0   0/0     0.0   3/6     0   0
Bradley Murray          9    8    0    1   0   3/3   100.0   0/0     0.0   4/5     0   0

TEAM: FG: 46/82 (56.1%), 3PT: 8/26 (30.8%), REB: 44 (7 off, 37 def), AST: 25, TO: 6

================================================================================
