================================================================================
                        FULL GAME - Team_052 vs Team_081                        
================================================================================

================================================================================
                       1ST QUARTER - Team_052 vs Team_081                       
================================================================================

[12:00] Team_052 possession (Score: 0-0)
Bones Morant drives, Vince Adebayo stays with him. Bones Morant attempts a Dunk. Contested by Vince Adebayo (3.9 feet, MAN). BONES MORANT MAKES IT! Assist: Josh Durant
Score: 2-0

[11:46] Team_081 possession (Score: 2-0)
Vince Adebayo attempts a 3Pt. Contested by Bones Morant (3.6 feet, ZONE). Vince Adebayo misses. Offensive rebound by Bradley Sabonis! Bradley Sabonis kicks it out.

[11:31] Team_081 possession (Score: 2-0)
FOUL! Reach-in foul on James Paul during the drive. [Team fouls: 1] No free throws, side out. (James Paul: 1 personal fouls)

[11:15] Team_081 possession (Score: 2-0)
Bradley Sabonis attempts a 3Pt. Contested by James Paul (3.3 feet, MAN). Bradley Sabonis misses. Rebound secured by James Paul.

[11:06] Team_052 possession (Score: 2-0)
Bones Morant attempts a 3Pt. Contested by Vince Adebayo (3.9 feet, MAN). Bones Morant misses. Rebound secured by Bradley Sabonis.

[10:53] Team_081 possession (Score: 2-0)
FOUL! Holding foul on Bones Morant. [Team fouls: 2] No free throws, side out. (Bones Morant: 1 personal fouls)

[10:43] Team_081 possession (Score: 2-0)
Bradley Leonard loses control! Ball rolls out of bounds! TURNOVER! (dead ball)

[10:28] Team_052 possession (Score: 2-0)
Josh Durant attempts a 3Pt. Contested by Bradley Leonard (3.5 feet, MAN). Josh Durant misses. Rebound secured by Bradley Sabonis.

[10:14] Team_081 possession (Score: 2-0)
FOUL! Shooting foul on Carmelo Middleton. Franz Antetokounmpo to the line for 2 free throws. [Team fouls: 3] (Carmelo Middleton: 1 personal fouls)   FT 1/2: GOOD   FT 2/2: MISS Franz Antetokounmpo makes 1/2 from the line. Rebound secured by Carmelo Middleton.
Score: 2-1

[10:00] Team_052 possession (Score: 2-1)
Carmelo Middleton attempts a Midrange. Contested by Franz Antetokounmpo (4.6 feet, MAN). CARMELO MIDDLETON MAKES IT!
Score: 4-1

[09:45] Team_081 possession (Score: 4-1)
Julius Durant attempts a 3Pt. Contested by Bones Morant (3.7 feet, ZONE). Julius Durant misses. Rebound secured by Bones Morant.

[09:32] Team_052 possession (Score: 4-1)
James Paul attempts a 3Pt. Contested by Vince Adebayo (3.8 feet, ZONE). James Paul misses. Rebound secured by Vince Adebayo.

[09:17] Team_081 possession (Score: 4-1)
Bradley Leonard attempts a 3Pt. Contested by Josh Durant (3.4 feet, MAN). BRADLEY LEONARD MAKES IT! Assist: Julius Durant
Score: 4-4

[09:01] Team_052 possession (Score: 4-4)
Bones Morant attempts a Layup. Contested by Franz Antetokounmpo (4.7 feet, ZONE). BONES MORANT MAKES IT! Assist: Carmelo Middleton
Score: 6-4

[08:47] Team_081 possession (Score: 6-4)
Franz Antetokounmpo drives, James Paul stays with him. Franz Antetokounmpo attempts a Dunk. Contested by James Paul (3.5 feet, ZONE). FRANZ ANTETOKOUNMPO MAKES IT! Assist: Julius Durant
Score: 6-6

[08:29] Team_052 possession (Score: 6-6)
Bones Morant attempts a 3Pt. Contested by Bradley Leonard (4.1 feet, ZONE). Bones Morant misses. Rebound secured by Franz Antetokounmpo.

[08:15] Team_081 possession (Score: 6-6)
Julius Durant drives to the basket... Julius Durant throws a bad pass! Stolen by Gary Gasol! TURNOVER! (live ball)

[08:04] Team_052 possession (Score: 6-6)
James Paul attempts a Layup. Contested by Bradley Sabonis (4.4 feet, MAN). JAMES PAUL MAKES IT! Assist: Gary Gasol
Score: 8-6

[07:50] Team_081 possession (Score: 8-6)
Bradley Leonard attempts a 3Pt. Contested by Josh Durant (3.4 feet, MAN). Bradley Leonard misses. Rebound secured by James Paul.

[07:38] Team_052 possession (Score: 8-6)
Josh Durant attempts a 3Pt. Contested by Vince Adebayo (3.2 feet, ZONE). Josh Durant misses. Rebound secured by Franz Antetokounmpo.

[07:22] Team_081 possession (Score: 8-6)
Franz Antetokounmpo attempts a Midrange. Contested by Carmelo Middleton (4.4 feet, MAN). Franz Antetokounmpo misses. Rebound secured by Carmelo Middleton.

[07:06] Team_052 possession (Score: 8-6)
Gary Gasol attempts a Midrange. Contested by Vince Adebayo (3.9 feet, ZONE). Gary Gasol misses. Rebound secured by Franz Antetokounmpo.

[06:50] Team_081 possession (Score: 8-6)
Vince Adebayo drives to the basket... Vince Adebayo throws a bad pass! Stolen by Bones Morant! TURNOVER! (live ball)

[06:36] Team_052 possession (Score: 8-6)
James Paul drives and kicks out. Josh Durant attempts a 3Pt. Contested by Bradley Leonard (3.7 feet, MAN). Josh Durant misses. Rebound secured by Vince Adebayo.

[06:26] Team_081 possession (Score: 8-6)
FOUL! Shooting foul on Josh Durant. Bradley Leonard to the line for 2 free throws. [Team fouls: 4] (Josh Durant: 1 personal fouls)   FT 1/2: GOOD   FT 2/2: GOOD Bradley Leonard makes 2/2 from the line.
Score: 8-8

[06:12] Team_052 possession (Score: 8-8)
Carmelo Middleton drives, Franz Antetokounmpo stays with him. Carmelo Middleton attempts a Dunk. Contested by Franz Antetokounmpo (4.6 feet, ZONE). Carmelo Middleton misses. Rebound secured by Franz Antetokounmpo.

[06:01] Team_081 possession (Score: 8-8)
Bradley Leonard attempts a 3Pt. Contested by Bones Morant (3.8 feet, ZONE). Bradley Leonard misses. Offensive rebound by Franz Antetokounmpo! Franz Antetokounmpo's putback is no good. Rebound secured by Bones Morant.

[05:47] Team_052 possession (Score: 8-8)
Gary Gasol attempts a Midrange. Contested by Julius Durant (4.5 feet, MAN). GARY GASOL MAKES IT! Assist: Josh Durant
Score: 10-8

[05:35] Team_081 possession (Score: 10-8)
Julius Durant drives to the basket... FOUL! Offensive foul on Julius Durant! James Paul drew the charge! [Team fouls: 1] (Julius Durant: 1 personal fouls) TURNOVER! (dead ball)

[05:18] Team_052 possession (Score: 10-8)
Josh Durant attempts a 3Pt. Contested by Bradley Leonard (3.5 feet, MAN). Josh Durant misses. FOUL! Loose ball foul on Vince Adebayo during the rebound battle. [Team fouls: 2] No free throws, side out. (Vince Adebayo: 1 personal fouls)

[05:07] Team_052 possession (Score: 10-8)
Josh Durant drives and kicks out. Bones Morant attempts a Midrange. Contested by Vince Adebayo (3.5 feet, MAN). Bones Morant misses. FOUL! Loose ball foul on Franz Antetokounmpo during the rebound battle. [Team fouls: 3] No free throws, side out. (Franz Antetokounmpo: 1 personal fouls)

[04:50] Team_052 possession (Score: 10-8)
Carmelo Middleton attempts a Midrange. Contested by Franz Antetokounmpo (4.7 feet, MAN). Carmelo Middleton misses. FOUL! Loose ball foul on Bradley Sabonis during the rebound battle. [Team fouls: 4] No free throws, side out. (Bradley Sabonis: 1 personal fouls)

[04:36] Team_052 possession (Score: 10-8)
FOUL! Reach-in foul on Franz Antetokounmpo during the drive. [IN THE BONUS! 5 team fouls] Carmelo Middleton to the line for 2 free throws. (Franz Antetokounmpo: 2 personal fouls)   FT 1/2: GOOD   FT 2/2: GOOD Carmelo Middleton makes 2/2 from the line.
Score: 12-8

[04:20] Team_081 possession (Score: 12-8)
FOUL! Shooting foul on Carmelo Middleton. Franz Antetokounmpo to the line for 2 free throws. [BONUS: 5 team fouls] (Carmelo Middleton: 2 personal fouls)   FT 1/2: GOOD   FT 2/2: GOOD Franz Antetokounmpo makes 2/2 from the line.
Score: 12-10

[04:05] Team_052 possession (Score: 12-10)
FOUL! Shooting foul on Bradley Leonard. Josh Durant to the line for 3 free throws. [BONUS: 6 team fouls] (Bradley Leonard: 1 personal fouls)   FT 1/3: GOOD   FT 2/3: GOOD   FT 3/3: GOOD Josh Durant makes 3/3 from the line.
Score: 15-10

[03:49] Team_081 possession (Score: 15-10)
Bradley Sabonis attempts a 3Pt. Contested by James Paul (3.4 feet, ZONE). Bradley Sabonis misses. Rebound secured by Carmelo Middleton.

[03:32] Team_052 possession (Score: 15-10)
James Paul attempts a Midrange. Contested by Vince Adebayo (4.0 feet, ZONE). James Paul misses. Offensive rebound by Bones Morant! Bones Morant kicks it out.

[03:16] Team_052 possession (Score: 15-10)
FOUL! Shooting foul on Franz Antetokounmpo. Josh Durant to the line for 2 free throws. [BONUS: 7 team fouls] (Franz Antetokounmpo: 3 personal fouls)   FT 1/2: GOOD   FT 2/2: MISS Josh Durant makes 1/2 from the line. Offensive rebound by Bones Morant! Bones Morant kicks it out.
Score: 16-10

[03:05] Team_052 possession (Score: 16-10)
Josh Durant drives and kicks out. Gary Gasol attempts a 3Pt. Contested by Bradley Leonard (3.9 feet, ZONE). Gary Gasol misses. Rebound secured by Bradley Sabonis.

[02:49] Team_081 possession (Score: 16-10)
Bradley Leonard drives and kicks out. Vince Adebayo attempts a 3Pt. Contested by Bones Morant (3.8 feet, ZONE). VINCE ADEBAYO MAKES IT! Assist: Bradley Sabonis
Score: 16-13

[02:36] Team_052 possession (Score: 16-13)
Gary Gasol loses control! Ball rolls out of bounds! TURNOVER! (dead ball)

[02:36] Substitution (Team_052): Gary Gasol OUT → Jimmy Doncic IN (stamina_rule2)

[02:36] Substitution (Team_052): Carmelo Middleton OUT → Carmelo Beal IN (stamina_rule2)

[02:36] Substitution (Team_081): Vince Adebayo OUT → Larry Adebayo IN (stamina_rule2)

[02:36] Substitution (Team_081): Franz Antetokounmpo OUT → D'Angelo Markkanen IN (stamina_rule2)

[02:18] Team_081 possession (Score: 16-13)
Bradley Leonard attempts a Layup. Contested by Josh Durant (3.7 feet, MAN). BRADLEY LEONARD MAKES IT!
Score: 16-15

[02:02] Team_052 possession (Score: 16-15)
Carmelo Beal attempts a Midrange. Contested by Bradley Sabonis (4.1 feet, ZONE). Carmelo Beal misses. Rebound secured by Larry Adebayo.

[01:50] Team_081 possession (Score: 16-15)
Bradley Leonard attempts a Midrange. Contested by Josh Durant (3.7 feet, ZONE). Bradley Leonard misses. Offensive rebound by Larry Adebayo! Larry Adebayo kicks it out.

[01:37] Team_081 possession (Score: 16-15)
Larry Adebayo attempts a Midrange. Contested by Bones Morant (3.9 feet, ZONE). Larry Adebayo misses. Rebound secured by James Paul.

[01:23] Team_052 possession (Score: 16-15)
James Paul attempts a 3Pt. Contested by Bradley Sabonis (4.7 feet, MAN). James Paul misses. Rebound secured by D'Angelo Markkanen.

[01:09] Team_081 possession (Score: 16-15)
Bradley Sabonis attempts a Midrange. Contested by Bones Morant (3.9 feet, ZONE). Bradley Sabonis misses. Offensive rebound by Bradley Sabonis! Bradley Sabonis kicks it out.

[00:51] Team_081 possession (Score: 16-15)
Larry Adebayo attempts a Midrange. Contested by Bones Morant (4.0 feet, ZONE). LARRY ADEBAYO MAKES IT!
Score: 16-17

[00:39] Team_052 possession (Score: 16-17)
Josh Durant attempts a Layup. Contested by Bradley Sabonis (4.3 feet, ZONE). Josh Durant misses. Rebound secured by Larry Adebayo.

[00:26] Team_081 possession (Score: 16-17)
FOUL! Shooting foul on Jimmy Doncic. Julius Durant to the line for 2 free throws. [BONUS: 6 team fouls] (Jimmy Doncic: 1 personal fouls)   FT 1/2: GOOD   FT 2/2: GOOD Julius Durant makes 2/2 from the line.
Score: 16-19

[00:07] Team_052 possession (Score: 16-19)
FOUL! Holding foul on Larry Adebayo. [IN THE BONUS! 8 team fouls] Bones Morant to the line for 2 free throws. (Larry Adebayo: 1 personal fouls)   FT 1/2: GOOD   FT 2/2: MISS Bones Morant makes 1/2 from the line. Rebound secured by D'Angelo Markkanen.
Score: 17-19

================================================================================
                              1ST QUARTER COMPLETE                              
================================================================================

1ST QUARTER SCORE: Team_052 17, Team_081 19

BOX SCORE:
================================================================================

Team_052
--------------------------------------------------------------------------------
Player                MIN  PTS  REB  AST  TO      FG   FG%      3P   3P%
--------------------------------------------------------------------------------
Bones Morant           12    4    5    0   0   2/4    50.0     0/0   0.0
Carmelo Middleton      10    4    3    1   0   2/3    66.7     0/0   0.0
Josh Durant            12    3    0    2   0   1/5    20.0     0/0   0.0
James Paul             12    2    5    0   0   1/4    25.0     0/0   0.0
Gary Gasol             10    2    0    1   0   1/2    50.0     0/0   0.0
Carmelo Beal            2    0    0    0   0   0/1     0.0     0/0   0.0

TEAM: FG: 7/20 (35.0%), 3PT: 1/7 (14.3%), REB: 12 (5 off, 7 def), AST: 4, TO: 1
TEAM FOULS: 6 [Team_081 in BONUS]


Team_081
--------------------------------------------------------------------------------
Player                MIN  PTS  REB  AST  TO      FG   FG%      3P   3P%
--------------------------------------------------------------------------------
Bradley Leonard        12    7    0    0   0   3/5    60.0     0/0   0.0
Franz Antetokounmpo    10    4    4    0   0   2/4    50.0     0/0   0.0
Vince Adebayo          10    3    2    0   0   1/1   100.0     0/0   0.0
Julius Durant          12    2    0    2   0   1/2    50.0     0/0   0.0
Larry Adebayo           2    2    3    0   0   1/2    50.0     0/0   0.0
Bradley Sabonis        12    0    5    1   0   0/2     0.0     0/0   0.0
D'Angelo Markkanen      2    0    2    0   0   0/0     0.0     0/0   0.0

TEAM: FG: 8/16 (50.0%), 3PT: 1/6 (16.7%), REB: 17 (4 off, 13 def), AST: 3, TO: 4
TEAM FOULS: 8 [Team_052 in BONUS]

================================================================================

================================================================================
                       2ND QUARTER - Team_052 vs Team_081                       
================================================================================

[12:00] Team_052 possession (Score: 17-19)
James Paul attempts a 3Pt. Contested by Bradley Sabonis (4.6 feet, ZONE). James Paul misses. Rebound secured by Franz Antetokounmpo.

[11:44] Team_081 possession (Score: 17-19)
Julius Durant makes the 3Pt and draws the foul on Gary Gasol! And-1! Julius Durant to the line for 1. [Team fouls: 1] (Gary Gasol: 1 personal fouls)   FT 1/1: GOOD Julius Durant makes 1/1 from the line.
Score: 17-23

[11:29] Team_052 possession (Score: 17-23)
Gary Gasol attempts a 3Pt. Contested by Julius Durant (4.9 feet, MAN). Gary Gasol misses. Rebound secured by Bradley Sabonis.

[11:17] Team_081 possession (Score: 17-23)
Bradley Sabonis makes the Dunk and draws the foul on Gary Gasol! And-1! Bradley Sabonis to the line for 1. [Team fouls: 2] (Gary Gasol: 2 personal fouls)   FT 1/1: GOOD Bradley Sabonis makes 1/1 from the line.
Score: 17-26

[10:59] Team_052 possession (Score: 17-26)
Bones Morant attempts a Layup. Contested by Franz Antetokounmpo (4.7 feet, ZONE). BONES MORANT MAKES IT!
Score: 19-26

[10:43] Team_081 possession (Score: 19-26)
Julius Durant drives, James Paul stays with him. Julius Durant attempts a Layup. Contested by James Paul (3.9 feet, ZONE). JULIUS DURANT MAKES IT!
Score: 19-28

[10:27] Team_052 possession (Score: 19-28)
Gary Gasol attempts a 3Pt. Contested by Julius Durant (5.0 feet, MAN). Gary Gasol misses. Offensive rebound by Carmelo Middleton! Carmelo Middleton kicks it out.

[10:15] Team_052 possession (Score: 19-28)
FOUL! Shooting foul on Franz Antetokounmpo. Bones Morant to the line for 2 free throws. [Team fouls: 1] (Franz Antetokounmpo: 1 personal fouls)   FT 1/2: GOOD   FT 2/2: GOOD Bones Morant makes 2/2 from the line.
Score: 21-28

[09:59] Team_081 possession (Score: 21-28)
Vince Adebayo attempts a 3Pt. Contested by Bones Morant (4.2 feet, MAN). Vince Adebayo misses. FOUL! Loose ball foul on James Paul during the rebound battle. [Team fouls: 3] No free throws, side out. (James Paul: 1 personal fouls)

[09:47] Team_081 possession (Score: 21-28)
FOUL! Shooting foul on Josh Durant. Bradley Leonard to the line for 2 free throws. [Team fouls: 4] (Josh Durant: 1 personal fouls)   FT 1/2: GOOD   FT 2/2: GOOD Bradley Leonard makes 2/2 from the line.
Score: 21-30

[09:30] Team_052 possession (Score: 21-30)
Josh Durant attempts a Midrange. Contested by Vince Adebayo (3.5 feet, ZONE). JOSH DURANT MAKES IT! Assist: Carmelo Middleton
Score: 23-30

[09:17] Team_081 possession (Score: 23-30)
Bradley Leonard attempts a Layup. Contested by James Paul (4.2 feet, ZONE). BRADLEY LEONARD MAKES IT!
Score: 23-32

[09:04] Team_052 possession (Score: 23-32)
Gary Gasol attempts a 3Pt. Contested by Vince Adebayo (4.2 feet, ZONE). Gary Gasol misses. FOUL! Loose ball foul on Bradley Sabonis during the rebound battle. [Team fouls: 2] No free throws, side out. (Bradley Sabonis: 1 personal fouls)

[08:49] Team_052 possession (Score: 23-32)
Bones Morant attempts a 3Pt. Contested by Bradley Leonard (4.7 feet, ZONE). BONES MORANT MAKES IT! Assist: Carmelo Middleton
Score: 26-32

[08:34] Team_081 possession (Score: 26-32)
Bradley Sabonis attempts a 3Pt. Contested by James Paul (4.0 feet, MAN). Bradley Sabonis misses. Rebound secured by Carmelo Middleton.

[08:20] Team_052 possession (Score: 26-32)
Carmelo Middleton attempts a Layup. Contested by Franz Antetokounmpo (4.9 feet, MAN). CARMELO MIDDLETON MAKES IT!
Score: 28-32

[08:09] Team_081 possession (Score: 28-32)
Vince Adebayo makes the Dunk and draws the foul on James Paul! And-1! Vince Adebayo to the line for 1. [BONUS: 5 team fouls] (James Paul: 2 personal fouls)   FT 1/1: MISS Vince Adebayo makes 0/1 from the line. Rebound secured by James Paul.
Score: 28-34

[07:53] Team_052 possession (Score: 28-34)
James Paul attempts a Layup. BLOCKED BY BRADLEY SABONIS! Ball deflects out of bounds off James Paul.

[07:39] Team_081 possession (Score: 28-34)
Julius Durant drives, James Paul stays with him. Julius Durant attempts a Layup. Contested by James Paul (4.4 feet, ZONE). JULIUS DURANT MAKES IT! Assist: Franz Antetokounmpo
Score: 28-36

[07:25] Team_052 possession (Score: 28-36)
Carmelo Middleton attempts a 3Pt. Contested by Vince Adebayo (4.3 feet, ZONE). CARMELO MIDDLETON MAKES IT! Assist: Josh Durant
Score: 31-36

[07:06] Team_081 possession (Score: 31-36)
Bradley Sabonis drives, James Paul stays with him. Bradley Sabonis attempts a Layup. Contested by James Paul (4.3 feet, ZONE). BRADLEY SABONIS MAKES IT! Assist: Vince Adebayo
Score: 31-38

[06:55] Team_052 possession (Score: 31-38)
FOUL! Reach-in foul on Franz Antetokounmpo during the drive. [Team fouls: 3] No free throws, side out. (Franz Antetokounmpo: 2 personal fouls)

[06:44] Team_052 possession (Score: 31-38)
James Paul makes the Layup and draws the foul on Bradley Sabonis! And-1! James Paul to the line for 1. [Team fouls: 4] (Bradley Sabonis: 2 personal fouls)   FT 1/1: GOOD James Paul makes 1/1 from the line.
Score: 34-38

[06:28] Team_081 possession (Score: 34-38)
Bradley Leonard attempts a Layup. Contested by Carmelo Middleton (5.0 feet, ZONE). Bradley Leonard misses. Offensive rebound by Franz Antetokounmpo! Franz Antetokounmpo's putback is no good. Rebound secured by Bones Morant.

[06:12] Team_052 possession (Score: 34-38)
Gary Gasol drives and kicks out. Carmelo Middleton attempts a Midrange. Contested by Franz Antetokounmpo (4.9 feet, MAN). Carmelo Middleton misses. Rebound secured by Franz Antetokounmpo.

[05:59] Team_081 possession (Score: 34-38)
FOUL! Shooting foul on Gary Gasol. Bradley Leonard to the line for 3 free throws. [BONUS: 6 team fouls] (Gary Gasol: 3 personal fouls)   FT 1/3: MISS   FT 2/3: MISS   FT 3/3: GOOD Bradley Leonard makes 1/3 from the line.
Score: 34-39

[05:44] Team_052 possession (Score: 34-39)
FOUL! Offensive foul on Carmelo Middleton! Franz Antetokounmpo drew the charge! [Team fouls: 7] (Carmelo Middleton: 1 personal fouls) TURNOVER! (dead ball)

[05:29] Team_081 possession (Score: 34-39)
Vince Adebayo attempts a Layup. BLOCKED BY BONES MORANT! Ball is loose! Rebound secured by James Paul.

[05:16] Team_052 possession (Score: 34-39)
Josh Durant attempts a Layup. Contested by Bradley Leonard (4.7 feet, MAN). Josh Durant misses. Rebound secured by Bradley Sabonis.

[05:02] Team_081 possession (Score: 34-39)
FOUL! Reach-in foul on Carmelo Middleton during the drive. [IN THE BONUS! 8 team fouls] Bradley Leonard to the line for 2 free throws. (Carmelo Middleton: 2 personal fouls)   FT 1/2: GOOD   FT 2/2: GOOD Bradley Leonard makes 2/2 from the line.
Score: 34-41

[04:46] Team_052 possession (Score: 34-41)
James Paul drives, Bradley Sabonis stays with him. James Paul attempts a Layup. Contested by Bradley Sabonis (5.5 feet, MAN). James Paul misses. Rebound secured by Bradley Sabonis.

[04:30] Team_081 possession (Score: 34-41)
Bradley Sabonis drives, James Paul stays with him. Bradley Sabonis attempts a Layup. Contested by James Paul (4.7 feet, MAN). Bradley Sabonis misses. Rebound secured by Carmelo Middleton.

[04:17] Team_052 possession (Score: 34-41)
Carmelo Middleton makes the Midrange and draws the foul on Franz Antetokounmpo! And-1! Carmelo Middleton to the line for 1. [BONUS: 5 team fouls] (Franz Antetokounmpo: 3 personal fouls)   FT 1/1: MISS Carmelo Middleton makes 0/1 from the line. Rebound secured by Vince Adebayo.
Score: 36-41

[04:05] Team_081 possession (Score: 36-41)
Bradley Sabonis drives, picks up James Paul. Help arrives from Gary Gasol! Bradley Sabonis attempts a Dunk. Contested by Gary Gasol (4.7 feet, ZONE). Bradley Sabonis misses. Rebound secured by Bones Morant.

[03:49] Team_052 possession (Score: 36-41)
FOUL! Holding foul on Julius Durant. [IN THE BONUS! 6 team fouls] Gary Gasol to the line for 2 free throws. (Julius Durant: 1 personal fouls)   FT 1/2: GOOD   FT 2/2: GOOD Gary Gasol makes 2/2 from the line.
Score: 38-41

[03:34] Team_081 possession (Score: 38-41)
FOUL! Reach-in foul on Carmelo Middleton during the drive. [IN THE BONUS! 9 team fouls] Franz Antetokounmpo to the line for 2 free throws. (Carmelo Middleton: 3 personal fouls)   FT 1/2: MISS   FT 2/2: MISS Franz Antetokounmpo makes 0/2 from the line. Rebound secured by Bones Morant.

[03:22] Team_052 possession (Score: 38-41)
Carmelo Middleton attempts a Layup. Contested by Franz Antetokounmpo (5.5 feet, MAN). CARMELO MIDDLETON MAKES IT!
Score: 40-41

[03:11] Team_081 possession (Score: 40-41)
Bradley Leonard throws a bad pass out of bounds! TURNOVER! (dead ball)

[03:11] Substitution (Team_052): Gary Gasol OUT → Jimmy Doncic IN (stamina_rule2)

[03:11] Substitution (Team_052): Josh Durant OUT → Carmelo Giddey IN (stamina_rule2)

[03:11] Substitution (Team_052): Bones Morant OUT → Donovan Stewart IN (stamina_rule2)

[03:11] Substitution (Team_052): James Paul OUT → Jalen Haliburton IN (stamina_rule2)

[03:11] Substitution (Team_052): Carmelo Middleton OUT → Carmelo Beal IN (stamina_rule2)

[03:11] Substitution (Team_081): Julius Durant OUT → Dejounte Bane IN (stamina_rule2)

[03:11] Substitution (Team_081): Bradley Leonard OUT → Lamelo Wade IN (stamina_rule2)

[03:11] Substitution (Team_081): Vince Adebayo OUT → Larry Adebayo IN (stamina_rule2)

[03:11] Substitution (Team_081): Bradley Sabonis OUT → Chris Holiday IN (stamina_rule2)

[03:11] Substitution (Team_081): Franz Antetokounmpo OUT → D'Angelo Markkanen IN (stamina_rule2)

[02:57] Team_052 possession (Score: 40-41)
Carmelo Giddey attempts a Layup. BLOCKED BY LAMELO WADE! Ball is loose! Rebound secured by Chris Holiday.

[02:41] Team_081 possession (Score: 40-41)
D'Angelo Markkanen attempts a Midrange. Contested by Jimmy Doncic (4.9 feet, ZONE). D'Angelo Markkanen misses. Offensive rebound by Chris Holiday! Chris Holiday kicks it out.

[02:26] Team_081 possession (Score: 40-41)
Chris Holiday attempts a 3Pt. Contested by Jalen Haliburton (4.6 feet, MAN). CHRIS HOLIDAY MAKES IT! Assist: Larry Adebayo
Score: 40-44

[02:11] Team_052 possession (Score: 40-44)
Donovan Stewart attempts a Midrange. Contested by Larry Adebayo (5.4 feet, MAN). Donovan Stewart misses. Offensive rebound by Carmelo Beal! Carmelo Beal kicks it out.

[01:59] Team_052 possession (Score: 40-44)
Jimmy Doncic attempts a 3Pt. Contested by Chris Holiday (4.1 feet, ZONE). Jimmy Doncic misses. Rebound secured by Lamelo Wade.

[01:49] Team_081 possession (Score: 40-44)
FOUL! Offensive foul on D'Angelo Markkanen! Carmelo Beal drew the charge! [Team fouls: 7] (D'Angelo Markkanen: 1 personal fouls) TURNOVER! (dead ball)

[01:35] Team_052 possession (Score: 40-44)
Jalen Haliburton drives to the basket... FOUL! Offensive foul on Jalen Haliburton! Chris Holiday drew the charge! [Team fouls: 10] (Jalen Haliburton: 1 personal fouls) TURNOVER! (dead ball)

[01:18] Team_081 possession (Score: 40-44)
Dejounte Bane attempts a Midrange. Contested by Jimmy Doncic (4.9 feet, MAN). Dejounte Bane misses. Rebound secured by Jalen Haliburton.

[01:02] Team_052 possession (Score: 40-44)
Carmelo Beal attempts a Midrange. Contested by Chris Holiday (4.1 feet, MAN). Carmelo Beal misses. Rebound secured by Chris Holiday.

[00:48] Team_081 possession (Score: 40-44)
Chris Holiday drives to the basket... Chris Holiday throws a bad pass out of bounds! TURNOVER! (dead ball)

[00:35] Team_052 possession (Score: 40-44)
Carmelo Beal attempts a Midrange. Contested by Chris Holiday (4.1 feet, MAN). CARMELO BEAL MAKES IT! Assist: Donovan Stewart
Score: 42-44

[00:20] Team_081 possession (Score: 42-44)
Lamelo Wade attempts a 3Pt. Contested by Carmelo Giddey (4.5 feet, MAN). Lamelo Wade misses. Rebound secured by Jalen Haliburton.

[00:09] Team_052 possession (Score: 42-44)
Donovan Stewart drives to the basket... Donovan Stewart loses the ball! Stripped by Larry Adebayo! TURNOVER! (live ball)

================================================================================
                              2ND QUARTER COMPLETE                              
================================================================================

2ND QUARTER SCORE: Team_052 25, Team_081 25

BOX SCORE:
================================================================================

Team_052
--------------------------------------------------------------------------------
Player                MIN  PTS  REB  AST  TO      FG   FG%      3P   3P%
--------------------------------------------------------------------------------
Bones Morant           21    7    3    0   0   3/3   100.0     0/0   0.0
Carmelo Middleton      19    7    3    2   0   3/4    75.0     0/0   0.0
James Paul             21    3    3    0   0   1/4    25.0     0/0   0.0
Gary Gasol             19    2    0    0   0   1/3    33.3     0/0   0.0
Josh Durant            21    2    0    1   0   1/2    50.0     0/0   0.0
Carmelo Beal            5    2    1    0   0   1/2    50.0     0/0   0.0
Carmelo Giddey          3    0    0    0   0   0/1     0.0     0/0   0.0
Jimmy Doncic            5    0    0    0   0   0/1     0.0     0/0   0.0
Jalen Haliburton        3    0    2    0   0   0/0     0.0     0/0   0.0
Donovan Stewart         3    0    0    1   0   0/0     0.0     0/0   0.0

TEAM: FG: 10/20 (50.0%), 3PT: 2/5 (40.0%), REB: 11 (3 off, 8 def), AST: 4, TO: 3
TEAM FOULS: 10 [Team_081 in BONUS]


Team_081
--------------------------------------------------------------------------------
Player                MIN  PTS  REB  AST  TO      FG   FG%      3P   3P%
--------------------------------------------------------------------------------
Julius Durant          21    8    0    0   0   3/3   100.0     0/0   0.0
Bradley Leonard        21    7    0    0   0   4/5    80.0     0/0   0.0
Bradley Sabonis        21    5    3    0   0   2/5    40.0     0/0   0.0
Chris Holiday           3    3    3    0   0   1/1   100.0     0/0   0.0
Franz Antetokounmpo    19    0    2    1   0   0/1     0.0     0/0   0.0
Vince Adebayo          19    0    2    1   0   0/2     0.0     0/0   0.0
Larry Adebayo           5    0    0    1   0   0/0     0.0     0/0   0.0
Lamelo Wade             3    0    1    0   0   0/1     0.0     0/0   0.0
Dejounte Bane           3    0    0    0   0   0/1     0.0     0/0   0.0

TEAM: FG: 10/19 (52.6%), 3PT: 3/5 (60.0%), REB: 12 (3 off, 9 def), AST: 3, TO: 3
TEAM FOULS: 7 [Team_052 in BONUS]

================================================================================

================================================================================
                       3RD QUARTER - Team_052 vs Team_081                       
================================================================================

[12:00] Team_052 possession (Score: 42-44)
Carmelo Middleton attempts a 3Pt. Contested by Vince Adebayo (3.8 feet, ZONE). CARMELO MIDDLETON MAKES IT! Assist: Gary Gasol
Score: 45-44

[11:43] Team_081 possession (Score: 45-44)
Julius Durant attempts a 3Pt. Contested by Bones Morant (3.7 feet, ZONE). Julius Durant misses. Offensive rebound by Franz Antetokounmpo! Franz Antetokounmpo puts it back in!
Score: 45-46

[11:29] Team_052 possession (Score: 45-46)
Josh Durant drives to the basket... Josh Durant throws a bad pass! Stolen by Franz Antetokounmpo! TURNOVER! (live ball)

[11:14] Team_081 possession (Score: 45-46)
Vince Adebayo attempts a 3Pt. Contested by Bones Morant (3.6 feet, ZONE). Vince Adebayo misses. Rebound secured by James Paul.

[10:57] Team_052 possession (Score: 45-46)
Bones Morant drives, Vince Adebayo stays with him. Bones Morant attempts a Dunk. Contested by Vince Adebayo (3.9 feet, MAN). BONES MORANT MAKES IT!
Score: 47-46

[10:42] Team_081 possession (Score: 47-46)
Julius Durant throws a bad pass out of bounds! TURNOVER! (dead ball)

[10:26] Team_052 possession (Score: 47-46)
Josh Durant makes the Layup and draws the foul on Franz Antetokounmpo! And-1! Josh Durant to the line for 1. [Team fouls: 1] (Franz Antetokounmpo: 1 personal fouls)   FT 1/1: GOOD Josh Durant makes 1/1 from the line.
Score: 50-46

[10:14] Team_081 possession (Score: 50-46)
Franz Antetokounmpo attempts a Midrange. Contested by Bones Morant (3.7 feet, ZONE). Franz Antetokounmpo misses. Rebound secured by James Paul.

[10:01] Team_052 possession (Score: 50-46)
Josh Durant drives and kicks out. Gary Gasol attempts a 3Pt. Contested by Julius Durant (4.0 feet, MAN). GARY GASOL MAKES IT! Assist: Bones Morant
Score: 53-46

[09:48] Team_081 possession (Score: 53-46)
Bradley Leonard attempts a 3Pt. Contested by Josh Durant (3.4 feet, MAN). BRADLEY LEONARD MAKES IT! Assist: Bradley Sabonis
Score: 53-49

[09:30] Team_052 possession (Score: 53-49)
Josh Durant attempts a Midrange. BLOCKED BY BRADLEY LEONARD! Ball is loose! Rebound secured by Vince Adebayo.

[09:15] Team_081 possession (Score: 53-49)
Vince Adebayo attempts a Midrange. Contested by Bones Morant (3.6 feet, MAN). Vince Adebayo misses. Rebound secured by Bones Morant.

[09:01] Team_052 possession (Score: 53-49)
Gary Gasol commits a violation (traveling/carry)! TURNOVER! (dead ball)

[08:42] Team_081 possession (Score: 53-49)
FOUL! Holding foul on James Paul. [Team fouls: 1] No free throws, side out. (James Paul: 1 personal fouls)

[08:25] Team_081 possession (Score: 53-49)
Bradley Sabonis drives and kicks out. Franz Antetokounmpo attempts a Midrange. Contested by Carmelo Middleton (4.3 feet, MAN). Franz Antetokounmpo misses. Rebound secured by Bones Morant.

[08:16] Team_052 possession (Score: 53-49)
James Paul attempts a Midrange. Contested by Bradley Sabonis (4.4 feet, MAN). JAMES PAUL MAKES IT!
Score: 55-49

[08:01] Team_081 possession (Score: 55-49)
Julius Durant throws a bad pass out of bounds! TURNOVER! (dead ball)

[07:45] Team_052 possession (Score: 55-49)
Bones Morant makes the Layup and draws the foul on Franz Antetokounmpo! And-1! Bones Morant to the line for 1. [Team fouls: 2] (Franz Antetokounmpo: 2 personal fouls)   FT 1/1: GOOD Bones Morant makes 1/1 from the line.
Score: 58-49

[07:31] Team_081 possession (Score: 58-49)
Franz Antetokounmpo drives to the basket... Franz Antetokounmpo commits a violation (traveling/carry)! TURNOVER! (dead ball)

[07:18] Team_052 possession (Score: 58-49)
James Paul attempts a 3Pt. Contested by Bradley Sabonis (4.4 feet, MAN). James Paul misses. Rebound secured by Vince Adebayo.

[06:59] Team_081 possession (Score: 58-49)
Franz Antetokounmpo attempts a Midrange. Contested by Carmelo Middleton (4.4 feet, MAN). Franz Antetokounmpo misses. Rebound secured by James Paul.

[06:45] Team_052 possession (Score: 58-49)
Carmelo Middleton attempts a 3Pt. Contested by Bradley Leonard (4.1 feet, ZONE). Carmelo Middleton misses. Rebound secured by Vince Adebayo.

[06:30] Team_081 possession (Score: 58-49)
Bradley Sabonis drives and kicks out. FOUL! Shooting foul on Bones Morant. Vince Adebayo to the line for 3 free throws. [Team fouls: 2] (Bones Morant: 1 personal fouls)   FT 1/3: GOOD   FT 2/3: MISS   FT 3/3: MISS Vince Adebayo makes 1/3 from the line. Offensive rebound by Franz Antetokounmpo! Franz Antetokounmpo puts it back in!
Score: 58-52

[06:16] Team_052 possession (Score: 58-52)
FOUL! Holding foul on Franz Antetokounmpo. [Team fouls: 3] No free throws, side out. (Franz Antetokounmpo: 3 personal fouls)

[06:04] Team_052 possession (Score: 58-52)
Carmelo Middleton attempts a Midrange. Contested by Franz Antetokounmpo (4.6 feet, MAN). Carmelo Middleton misses. Offensive rebound by James Paul! James Paul's putback is no good. Rebound secured by Vince Adebayo.

[05:47] Team_081 possession (Score: 58-52)
Vince Adebayo drives to the basket... FOUL! Offensive foul on Vince Adebayo! James Paul drew the charge! [Team fouls: 4] (Vince Adebayo: 1 personal fouls) TURNOVER! (dead ball)

[05:32] Team_052 possession (Score: 58-52)
Carmelo Middleton makes the Layup and draws the foul on Franz Antetokounmpo! And-1! Carmelo Middleton to the line for 1. [BONUS: 5 team fouls] (Franz Antetokounmpo: 4 personal fouls)   FT 1/1: GOOD Carmelo Middleton makes 1/1 from the line.
Score: 61-52

[05:16] Team_081 possession (Score: 61-52)
Franz Antetokounmpo attempts a Midrange. Contested by Carmelo Middleton (4.4 feet, MAN). Franz Antetokounmpo misses. Offensive rebound by Franz Antetokounmpo! Franz Antetokounmpo puts it back in!
Score: 61-54

[05:00] Team_052 possession (Score: 61-54)
Bones Morant attempts a 3Pt. Contested by Vince Adebayo (3.9 feet, MAN). BONES MORANT MAKES IT! Assist: Gary Gasol
Score: 64-54

[04:46] Team_081 possession (Score: 64-54)
Bradley Sabonis drives and kicks out. Vince Adebayo attempts a Midrange. Contested by James Paul (3.4 feet, ZONE). VINCE ADEBAYO MAKES IT! Assist: Julius Durant
Score: 64-56

[04:31] Team_052 possession (Score: 64-56)
James Paul drives and kicks out. James Paul attempts a 3Pt. Contested by Bradley Sabonis (4.0 feet, MAN). James Paul misses. Rebound secured by Bradley Sabonis.

[04:18] Team_081 possession (Score: 64-56)
Bradley Sabonis attempts a Midrange. Contested by Josh Durant (3.2 feet, ZONE). BRADLEY SABONIS MAKES IT! Assist: Franz Antetokounmpo
Score: 64-58

[04:02] Team_052 possession (Score: 64-58)
Gary Gasol attempts a Midrange. Contested by Bradley Leonard (4.2 feet, ZONE). Gary Gasol misses. Rebound secured by Bradley Sabonis.

[03:48] Team_081 possession (Score: 64-58)
Julius Durant attempts a 3Pt. Contested by Gary Gasol (4.0 feet, MAN). Julius Durant misses. Rebound secured by James Paul.

[03:37] Team_052 possession (Score: 64-58)
Josh Durant attempts a Layup. Contested by Bradley Leonard (3.6 feet, MAN). JOSH DURANT MAKES IT! Assist: Carmelo Middleton
Score: 66-58

[03:23] Team_081 possession (Score: 66-58)
Franz Antetokounmpo drives and kicks out. Bradley Sabonis attempts a 3Pt. Contested by James Paul (3.6 feet, MAN). Bradley Sabonis misses. Rebound secured by Carmelo Middleton.

[03:05] Team_052 possession (Score: 66-58)
James Paul attempts a Midrange. Contested by Bradley Sabonis (4.5 feet, MAN). James Paul misses. Rebound secured by Franz Antetokounmpo.

[02:48] Team_081 possession (Score: 66-58)
Julius Durant attempts a 3Pt. Contested by Gary Gasol (4.1 feet, MAN). Julius Durant misses. Rebound secured by Carmelo Middleton.

[02:35] Team_052 possession (Score: 66-58)
Gary Gasol attempts a Layup. Contested by Franz Antetokounmpo (4.9 feet, ZONE). GARY GASOL MAKES IT! Assist: Josh Durant
Score: 68-58

[02:20] Team_081 possession (Score: 68-58)
Franz Antetokounmpo drives, James Paul stays with him. Franz Antetokounmpo attempts a Dunk. Contested by James Paul (3.8 feet, ZONE). FRANZ ANTETOKOUNMPO MAKES IT! Assist: Vince Adebayo
Score: 68-60

[02:06] Team_052 possession (Score: 68-60)
Gary Gasol makes the Layup and draws the foul on Bradley Leonard! And-1! Gary Gasol to the line for 1. [BONUS: 6 team fouls] (Bradley Leonard: 1 personal fouls)   FT 1/1: GOOD Gary Gasol makes 1/1 from the line.
Score: 71-60

[01:54] Team_081 possession (Score: 71-60)
FOUL! Reach-in foul on Carmelo Middleton during the drive. [Team fouls: 3] No free throws, side out. (Carmelo Middleton: 1 personal fouls)

[01:40] Team_081 possession (Score: 71-60)
FOUL! Shooting foul on Josh Durant. Bradley Leonard to the line for 3 free throws. [Team fouls: 4] (Josh Durant: 1 personal fouls)   FT 1/3: GOOD   FT 2/3: MISS   FT 3/3: GOOD Bradley Leonard makes 2/3 from the line.
Score: 71-62

[01:24] Team_052 possession (Score: 71-62)
Bones Morant attempts a 3Pt. Contested by Vince Adebayo (4.3 feet, MAN). Bones Morant misses. Rebound secured by Bradley Sabonis.

[01:10] Team_081 possession (Score: 71-62)
Julius Durant loses control! Ball rolls out of bounds! TURNOVER! (dead ball)

[01:10] Substitution (Team_052): Gary Gasol OUT → Jimmy Doncic IN (stamina_rule2)

[01:10] Substitution (Team_052): Josh Durant OUT → Carmelo Giddey IN (stamina_rule2)

[01:10] Substitution (Team_052): Bones Morant OUT → Donovan Stewart IN (stamina_rule2)

[01:10] Substitution (Team_052): James Paul OUT → Jalen Haliburton IN (stamina_rule2)

[01:10] Substitution (Team_052): Carmelo Middleton OUT → Carmelo Beal IN (stamina_rule2)

[01:10] Substitution (Team_081): Julius Durant OUT → Dejounte Bane IN (stamina_rule2)

[01:10] Substitution (Team_081): Bradley Leonard OUT → Lamelo Wade IN (stamina_rule2)

[01:10] Substitution (Team_081): Vince Adebayo OUT → Larry Adebayo IN (stamina_rule2)

[01:10] Substitution (Team_081): Bradley Sabonis OUT → Chris Holiday IN (stamina_rule2)

[01:10] Substitution (Team_081): Franz Antetokounmpo OUT → D'Angelo Markkanen IN (stamina_rule2)

[00:58] Team_052 possession (Score: 71-62)
Carmelo Beal drives and kicks out. Jimmy Doncic attempts a Midrange. Contested by Larry Adebayo (5.3 feet, ZONE). Jimmy Doncic misses. Rebound secured by Lamelo Wade.

[00:44] Team_081 possession (Score: 71-62)
Larry Adebayo drives, Donovan Stewart stays with him. Larry Adebayo attempts a Layup. Contested by Donovan Stewart (4.7 feet, MAN). Larry Adebayo misses. FOUL! Loose ball foul on Carmelo Beal during the rebound battle. [IN THE BONUS! 5 team fouls] Chris Holiday to the line for 2 free throws. (Carmelo Beal: 1 personal fouls)   FT 1/2: GOOD   FT 2/2: GOOD Chris Holiday makes 2/2 from the line.
Score: 71-64

[00:32] Team_052 possession (Score: 71-64)
FOUL! Shooting foul on Lamelo Wade. Carmelo Giddey to the line for 3 free throws. [BONUS: 7 team fouls] (Lamelo Wade: 1 personal fouls)   FT 1/3: GOOD   FT 2/3: MISS   FT 3/3: GOOD Carmelo Giddey makes 2/3 from the line.
Score: 73-64

[00:16] Team_081 possession (Score: 73-64)
Chris Holiday attempts a Midrange. Contested by Jalen Haliburton (4.6 feet, MAN). CHRIS HOLIDAY MAKES IT! Assist: Dejounte Bane
Score: 73-66

[00:03] Team_052 possession (Score: 73-66)
Carmelo Beal drives, Chris Holiday stays with him. Carmelo Beal attempts a Dunk. Contested by Chris Holiday (4.1 feet, MAN). CARMELO BEAL MAKES IT! Assist: Carmelo Giddey
Score: 75-66

================================================================================
                              3RD QUARTER COMPLETE                              
================================================================================

3RD QUARTER SCORE: Team_052 33, Team_081 22

BOX SCORE:
================================================================================

Team_052
--------------------------------------------------------------------------------
Player                MIN  PTS  REB  AST  TO      FG   FG%      3P   3P%
--------------------------------------------------------------------------------
Gary Gasol             30    8    0    2   0   3/4    75.0     0/0   0.0
Bones Morant           32    8    2    1   0   3/4    75.0     0/0   0.0
Carmelo Middleton      30    6    2    1   0   2/4    50.0     0/0   0.0
Josh Durant            32    5    0    1   0   2/3    66.7     0/0   0.0
James Paul             32    2    4    0   0   1/4    25.0     0/0   0.0
Carmelo Beal            7    2    0    0   0   1/2    50.0     0/0   0.0
Carmelo Giddey          4    2    0    1   0   1/1   100.0     0/0   0.0

TEAM: FG: 13/22 (59.1%), 3PT: 3/6 (50.0%), REB: 9 (1 off, 8 def), AST: 6, TO: 2
TEAM FOULS: 5 [Team_081 in BONUS]


Team_081
--------------------------------------------------------------------------------
Player                MIN  PTS  REB  AST  TO      FG   FG%      3P   3P%
--------------------------------------------------------------------------------
Franz Antetokounmpo    30    9    3    1   0   4/7    57.1     0/0   0.0
Bradley Leonard        32    5    0    0   0   2/2   100.0     0/0   0.0
Chris Holiday           4    4    0    0   0   2/2   100.0     0/0   0.0
Vince Adebayo          30    2    4    1   0   1/3    33.3     0/0   0.0
Bradley Sabonis        32    2    3    1   0   1/2    50.0     0/0   0.0
Julius Durant          32    0    0    1   0   0/2     0.0     0/0   0.0
Lamelo Wade             4    0    1    0   0   0/0     0.0     0/0   0.0
Dejounte Bane           4    0    0    1   0   0/0     0.0     0/0   0.0

TEAM: FG: 10/18 (55.6%), 3PT: 3/6 (50.0%), REB: 10 (2 off, 8 def), AST: 5, TO: 5
TEAM FOULS: 7 [Team_052 in BONUS]

================================================================================

================================================================================
                       4TH QUARTER - Team_052 vs Team_081                       
================================================================================

[12:00] Team_052 possession (Score: 75-66)
FOUL! Reach-in foul on Bradley Leonard during the drive. [Team fouls: 1] No free throws, side out. (Bradley Leonard: 1 personal fouls)

[11:47] Team_052 possession (Score: 75-66)
FOUL! Shooting foul on Bradley Sabonis. James Paul to the line for 2 free throws. [Team fouls: 2] (Bradley Sabonis: 1 personal fouls)   FT 1/2: GOOD   FT 2/2: GOOD James Paul makes 2/2 from the line.
Score: 77-66

[11:34] Team_081 possession (Score: 77-66)
Bradley Sabonis drives, picks up James Paul. Help arrives from Josh Durant! Bradley Sabonis attempts a Layup. Contested by Josh Durant (3.4 feet, MAN). BRADLEY SABONIS MAKES IT! Assist: Bradley Leonard
Score: 77-68

[11:23] Team_052 possession (Score: 77-68)
Carmelo Middleton attempts a Layup. Contested by Franz Antetokounmpo (4.8 feet, MAN). Carmelo Middleton misses. Rebound secured by Bradley Sabonis.

[11:08] Team_081 possession (Score: 77-68)
FOUL! Holding foul on Carmelo Middleton. [Team fouls: 1] No free throws, side out. (Carmelo Middleton: 1 personal fouls)

[10:55] Team_081 possession (Score: 77-68)
Vince Adebayo attempts a 3Pt. Contested by Bones Morant (3.8 feet, ZONE). Vince Adebayo misses. Rebound secured by Bones Morant.

[10:39] Team_052 possession (Score: 77-68)
Gary Gasol drives, picks up Julius Durant. Help arrives from Vince Adebayo! Gary Gasol attempts a Dunk. Contested by Vince Adebayo (4.7 feet, MAN). GARY GASOL MAKES IT! Assist: James Paul
Score: 79-68

[10:23] Team_081 possession (Score: 79-68)
Franz Antetokounmpo attempts a Midrange. Contested by Carmelo Middleton (4.7 feet, MAN). FRANZ ANTETOKOUNMPO MAKES IT! Assist: Vince Adebayo
Score: 79-70

[10:08] Team_052 possession (Score: 79-70)
James Paul attempts a 3Pt. Contested by Bradley Leonard (4.3 feet, ZONE). JAMES PAUL MAKES IT! Assist: Gary Gasol
Score: 82-70

[09:57] Team_081 possession (Score: 82-70)
FOUL! Reach-in foul on Bones Morant during the drive. [Team fouls: 2] No free throws, side out. (Bones Morant: 1 personal fouls)

[09:42] Team_081 possession (Score: 82-70)
Bradley Sabonis attempts a 3Pt. Contested by Gary Gasol (4.0 feet, ZONE). Bradley Sabonis misses. FOUL! Loose ball foul on Bones Morant during the rebound battle. [Team fouls: 3] No free throws, side out. (Bones Morant: 2 personal fouls)

[09:29] Team_081 possession (Score: 82-70)
Bradley Leonard attempts a Midrange. Contested by Josh Durant (3.8 feet, ZONE). Bradley Leonard misses. Rebound secured by James Paul.

[09:18] Team_052 possession (Score: 82-70)
Gary Gasol attempts a Midrange. Contested by Julius Durant (4.8 feet, MAN). Gary Gasol misses. Offensive rebound by Bones Morant! Bones Morant kicks it out.

[09:02] Team_052 possession (Score: 82-70)
Gary Gasol attempts a Midrange. Contested by Julius Durant (4.9 feet, MAN). Gary Gasol misses. Rebound secured by Vince Adebayo.

[08:49] Team_081 possession (Score: 82-70)
Vince Adebayo attempts a 3Pt. Contested by Bones Morant (4.0 feet, MAN). Vince Adebayo misses. Offensive rebound by Franz Antetokounmpo! Franz Antetokounmpo puts it back in!
Score: 82-72

[08:37] Team_052 possession (Score: 82-72)
Carmelo Middleton makes the Layup and draws the foul on Franz Antetokounmpo! And-1! Carmelo Middleton to the line for 1. [Team fouls: 3] (Franz Antetokounmpo: 1 personal fouls)   FT 1/1: GOOD Carmelo Middleton makes 1/1 from the line.
Score: 85-72

[08:23] Team_081 possession (Score: 85-72)
Vince Adebayo attempts a Midrange. Contested by Bones Morant (4.1 feet, MAN). Vince Adebayo misses. Rebound secured by Carmelo Middleton.

[08:04] Team_052 possession (Score: 85-72)
Gary Gasol attempts a 3Pt. Contested by Julius Durant (5.0 feet, ZONE). Gary Gasol misses. Offensive rebound by Bones Morant! Bones Morant kicks it out.

[07:48] Team_052 possession (Score: 85-72)
Gary Gasol attempts a Midrange. Contested by Julius Durant (5.0 feet, MAN). GARY GASOL MAKES IT! Assist: Bones Morant
Score: 87-72

[07:32] Team_081 possession (Score: 87-72)
Franz Antetokounmpo makes the Layup and draws the foul on Josh Durant! And-1! Franz Antetokounmpo to the line for 1. [Team fouls: 4] (Josh Durant: 1 personal fouls)   FT 1/1: GOOD Franz Antetokounmpo makes 1/1 from the line.
Score: 87-75

[07:17] Team_052 possession (Score: 87-75)
James Paul attempts a Layup. BLOCKED BY BRADLEY SABONIS! Ball is loose! Rebound secured by Bradley Sabonis.

[07:04] Team_081 possession (Score: 87-75)
Vince Adebayo attempts a 3Pt. Contested by Bones Morant (4.2 feet, MAN). Vince Adebayo misses. Rebound secured by Carmelo Middleton.

[06:51] Team_052 possession (Score: 87-75)
Gary Gasol attempts a 3Pt. Contested by Julius Durant (5.1 feet, MAN). GARY GASOL MAKES IT! Assist: Josh Durant
Score: 90-75

[06:35] Team_081 possession (Score: 90-75)
Vince Adebayo attempts a Layup. Contested by Bones Morant (4.3 feet, MAN). Vince Adebayo misses. Offensive rebound by Franz Antetokounmpo! Franz Antetokounmpo's putback is no good. Rebound secured by James Paul.

[06:17] Team_052 possession (Score: 90-75)
Josh Durant drives and kicks out. Carmelo Middleton attempts a 3Pt. Contested by Bradley Leonard (4.5 feet, ZONE). Carmelo Middleton misses. Rebound secured by Franz Antetokounmpo.

[06:01] Team_081 possession (Score: 90-75)
Vince Adebayo attempts a Midrange. Contested by James Paul (4.2 feet, ZONE). VINCE ADEBAYO MAKES IT!
Score: 90-77

[05:47] Team_052 possession (Score: 90-77)
Gary Gasol attempts a 3Pt. Contested by Julius Durant (5.2 feet, MAN). Gary Gasol misses. Rebound secured by Vince Adebayo.

[05:32] Team_081 possession (Score: 90-77)
Vince Adebayo drives and kicks out. Bradley Sabonis attempts a 3Pt. Contested by James Paul (4.4 feet, MAN). Bradley Sabonis misses. Offensive rebound by Bradley Sabonis! Bradley Sabonis kicks it out.

[05:19] Team_081 possession (Score: 90-77)
Bradley Sabonis drives to the basket... Bradley Sabonis throws a bad pass out of bounds! TURNOVER! (dead ball)

[05:19] Substitution (Team_052): Gary Gasol OUT → Jimmy Doncic IN (stamina_rule2)

[05:19] Substitution (Team_052): Josh Durant OUT → Carmelo Giddey IN (stamina_rule2)

[05:19] Substitution (Team_052): Bones Morant OUT → Donovan Stewart IN (stamina_rule2)

[05:19] Substitution (Team_052): James Paul OUT → Jalen Haliburton IN (stamina_rule2)

[05:19] Substitution (Team_052): Carmelo Middleton OUT → Carmelo Beal IN (stamina_rule2)

[05:19] Substitution (Team_081): Julius Durant OUT → Dejounte Bane IN (stamina_rule2)

[05:19] Substitution (Team_081): Bradley Leonard OUT → Lamelo Wade IN (stamina_rule2)

[05:19] Substitution (Team_081): Vince Adebayo OUT → Larry Adebayo IN (stamina_rule2)

[05:19] Substitution (Team_081): Bradley Sabonis OUT → Chris Holiday IN (stamina_rule2)

[05:19] Substitution (Team_081): Franz Antetokounmpo OUT → D'Angelo Markkanen IN (stamina_rule2)

[05:05] Team_052 possession (Score: 90-77)
FOUL! Offensive foul on Jalen Haliburton! Chris Holiday drew the charge! [Team fouls: 5] (Jalen Haliburton: 1 personal fouls) TURNOVER! (dead ball)

[04:53] Team_081 possession (Score: 90-77)
Chris Holiday attempts a Midrange. Contested by Jalen Haliburton (4.6 feet, MAN). Chris Holiday misses. Rebound secured by Donovan Stewart.

[04:37] Team_052 possession (Score: 90-77)
Jimmy Doncic drives to the basket... Jimmy Doncic commits a violation (traveling/carry)! TURNOVER! (dead ball)

[04:25] Team_081 possession (Score: 90-77)
Lamelo Wade attempts a 3Pt. Contested by Carmelo Giddey (4.5 feet, MAN). Lamelo Wade misses. Rebound secured by Carmelo Beal.

[04:08] Team_052 possession (Score: 90-77)
Carmelo Giddey throws a bad pass out of bounds! TURNOVER! (dead ball)

[03:56] Team_081 possession (Score: 90-77)
D'Angelo Markkanen attempts a 3Pt. Contested by Donovan Stewart (4.9 feet, ZONE). D'Angelo Markkanen misses. Offensive rebound by Chris Holiday! Chris Holiday kicks it out.

[03:41] Team_081 possession (Score: 90-77)
Chris Holiday attempts a Midrange. Contested by Jalen Haliburton (4.6 feet, MAN). Chris Holiday misses. Rebound secured by Carmelo Beal.

[03:27] Team_052 possession (Score: 90-77)
Jimmy Doncic attempts a Midrange. Contested by Chris Holiday (4.1 feet, ZONE). JIMMY DONCIC MAKES IT! Assist: Carmelo Giddey
Score: 92-77

[03:10] Team_081 possession (Score: 92-77)
Larry Adebayo commits a violation (traveling/carry)! TURNOVER! (dead ball)

[02:55] Team_052 possession (Score: 92-77)
Jimmy Doncic attempts a 3Pt. Contested by Dejounte Bane (5.3 feet, MAN). JIMMY DONCIC MAKES IT! Assist: Carmelo Beal
Score: 95-77

[02:39] Team_081 possession (Score: 95-77)
Dejounte Bane attempts a Midrange. Contested by Donovan Stewart (5.0 feet, ZONE). Dejounte Bane misses. Offensive rebound by Lamelo Wade! Lamelo Wade kicks it out.

[02:24] Team_081 possession (Score: 95-77)
D'Angelo Markkanen makes the Layup and draws the foul on Carmelo Beal! And-1! D'Angelo Markkanen to the line for 1. [BONUS: 6 team fouls] (Carmelo Beal: 1 personal fouls)   FT 1/1: GOOD D'Angelo Markkanen makes 1/1 from the line.
Score: 95-80

[02:06] Team_052 possession (Score: 95-80)
Jalen Haliburton drives, Chris Holiday stays with him. Jalen Haliburton attempts a Layup. Contested by Chris Holiday (4.4 feet, ZONE). Jalen Haliburton misses. Offensive rebound by Carmelo Beal! Carmelo Beal kicks it out.

[01:52] Team_052 possession (Score: 95-80)
Carmelo Beal drives and kicks out. Jalen Haliburton attempts a Midrange. Contested by Chris Holiday (4.3 feet, MAN). JALEN HALIBURTON MAKES IT!
Score: 97-80

[01:36] Team_081 possession (Score: 97-80)
Larry Adebayo attempts a Midrange. Contested by Donovan Stewart (4.7 feet, MAN). LARRY ADEBAYO MAKES IT! Assist: Chris Holiday
Score: 97-82

[01:21] Team_052 possession (Score: 97-82)
Carmelo Giddey attempts a 3Pt. Contested by Chris Holiday (4.9 feet, ZONE). Carmelo Giddey misses. Rebound secured by Lamelo Wade.

[01:02] Team_081 possession (Score: 97-82)
Lamelo Wade attempts a Midrange. Contested by Carmelo Giddey (4.5 feet, ZONE). LAMELO WADE MAKES IT!
Score: 97-84

[00:47] Team_052 possession (Score: 97-84)
Jimmy Doncic attempts a Layup. Contested by Dejounte Bane (5.3 feet, MAN). JIMMY DONCIC MAKES IT! Assist: Donovan Stewart
Score: 99-84

[00:31] Team_081 possession (Score: 99-84)
Lamelo Wade drives to the basket... Lamelo Wade throws a bad pass! Stolen by Carmelo Giddey! TURNOVER! (live ball)

[00:17] Team_052 possession (Score: 99-84)
Jalen Haliburton attempts a Midrange. Contested by Chris Holiday (4.4 feet, ZONE). Jalen Haliburton misses. Rebound secured by Chris Holiday.

[00:03] Team_081 possession (Score: 99-84)
Larry Adebayo drives and kicks out. D'Angelo Markkanen attempts a 3Pt. Contested by Jalen Haliburton (4.5 feet, ZONE). D'Angelo Markkanen misses. Rebound secured by Carmelo Beal.

================================================================================
                              4TH QUARTER COMPLETE                              
================================================================================

4TH QUARTER SCORE: Team_052 24, Team_081 18

BOX SCORE:
================================================================================

Team_052
--------------------------------------------------------------------------------
Player                MIN  PTS  REB  AST  TO      FG   FG%      3P   3P%
--------------------------------------------------------------------------------
Gary Gasol             37    7    0    1   0   3/5    60.0     0/0   0.0
Jimmy Doncic           12    7    0    0   0   3/3   100.0     0/0   0.0
Carmelo Middleton      37    3    2    0   0   1/2    50.0     0/0   0.0
Jalen Haliburton       10    2    0    0   0   1/2    50.0     0/0   0.0
Bones Morant           39    0    3    1   0   0/0     0.0     0/0   0.0
Josh Durant            39    0    0    1   0   0/1     0.0     0/0   0.0
Donovan Stewart        10    0    1    1   0   0/0     0.0     0/0   0.0
Carmelo Beal           12    0    4    1   0   0/0     0.0     0/0   0.0
Carmelo Giddey         10    0    0    1   0   0/1     0.0     0/0   0.0

TEAM: FG: 10/17 (58.8%), 3PT: 3/5 (60.0%), REB: 11 (3 off, 8 def), AST: 7, TO: 3
TEAM FOULS: 6 [Team_081 in BONUS]


Team_081
--------------------------------------------------------------------------------
Player                MIN  PTS  REB  AST  TO      FG   FG%      3P   3P%
--------------------------------------------------------------------------------
Franz Antetokounmpo    37    7    3    0   0   3/3   100.0     0/0   0.0
James Paul             39    5    2    1   0   2/3    66.7     0/0   0.0
D'Angelo Markkanen     12    3    0    0   0   1/1   100.0     0/0   0.0
Bradley Sabonis        39    2    3    0   0   1/1   100.0     0/0   0.0
Vince Adebayo          37    2    2    1   0   1/5    20.0     0/0   0.0
Lamelo Wade            10    2    2    0   0   1/2    50.0     0/0   0.0
Larry Adebayo          12    2    0    0   0   1/2    50.0     0/0   0.0
Bradley Leonard        39    0    0    1   0   0/1     0.0     0/0   0.0
Chris Holiday          10    0    2    1   0   0/2     0.0     0/0   0.0

TEAM: FG: 8/17 (47.1%), 3PT: 1/4 (25.0%), REB: 13 (6 off, 7 def), AST: 3, TO: 3
TEAM FOULS: 3

================================================================================

================================================================================
                               FULL GAME COMPLETE                               
================================================================================

FINAL SCORE: Team_052 99, Team_081 84

SCORING BY QUARTER:
--------------------------------------------------------------------------------
Team                     Q1     Q2     Q3     Q4    FINAL
--------------------------------------------------------------------------------
Team_052                 17     25     33     24       99
Team_081                 19     25     22     18       84
--------------------------------------------------------------------------------

FULL GAME BOX SCORE:
================================================================================

Team_052
--------------------------------------------------------------------------------
Player                MIN  PTS  REB  AST  TO      FG   FG%      3P   3P%      FT STL BLK
--------------------------------------------------------------------------------
Josh Durant            39   10    0    5   1   5/12   41.7   1/3    33.3   5/6     0   0
Bones Morant           39   19   13    2   0   8/11   72.7   2/5    40.0   4/5     1   1
James Paul             39   12   14    1   0   5/15   33.3   1/5    20.0   3/3     0   0
Gary Gasol             37   19    0    4   2   6/12   50.0   1/3    33.3   3/3     1   0
Carmelo Middleton      37   20   10    4   1   8/13   61.5   2/3    66.7   4/5     0   0
Jimmy Doncic           12    7    0    0   1   3/4    75.0   1/2    50.0   0/0     0   0
Carmelo Beal           12    4    5    1   1   3/6    50.0   0/0     0.0   0/0     0   0
Carmelo Giddey         10    2    0    2   2   1/3    33.3   1/2    50.0   2/3     1   0
Donovan Stewart        10    0    1    2   0   0/0     0.0   0/0     0.0   0/0     0   0
Jalen Haliburton       10    2    2    0   1   0/1     0.0   0/0     0.0   0/0     0   0

TEAM: FG: 40/79 (50.6%), 3PT: 9/23 (39.1%), REB: 43 (12 off, 31 def), AST: 21, TO: 9


Team_081
--------------------------------------------------------------------------------
Player                MIN  PTS  REB  AST  TO      FG   FG%      3P   3P%      FT STL BLK
--------------------------------------------------------------------------------
Julius Durant          39   10    0    3   4   5/8    62.5   2/5    40.0   3/3     0   0
Bradley Leonard        39   19    0    1   3  10/14   71.4   4/6    66.7   9/12    0   1
Bradley Sabonis        39    9   14    2   2   6/12   50.0   0/3     0.0   1/1     0   2
Vince Adebayo          37    7   10    3   1   2/10   20.0   1/4    25.0   1/4     0   0
Franz Antetokounmpo    37   20   13    2   1   6/12   50.0   0/0     0.0   4/7     1   0
Larry Adebayo          12    4    3    1   1   3/5    60.0   0/0     0.0   0/0     1   0
D'Angelo Markkanen     12    3    2    0   2   1/1   100.0   0/0     0.0   1/1     0   0
Dejounte Bane          10    0    0    1   0   0/1     0.0   0/0     0.0   0/0     0   0
Lamelo Wade            10    2    4    0   1   1/3    33.3   0/2     0.0   0/0     0   1
Chris Holiday          10    7    5    1   0   2/4    50.0   1/1   100.0   2/2     0   0

TEAM: FG: 36/70 (51.4%), 3PT: 8/21 (38.1%), REB: 52 (15 off, 37 def), AST: 14, TO: 15

================================================================================
