================================================================================
                        FULL GAME - Team_020 vs Team_027                        
================================================================================

================================================================================
                       1ST QUARTER - Team_020 vs Team_027                       
================================================================================

[12:00] Team_020 possession (Score: 0-0)
James Cunningham makes the 3Pt and draws the foul on Tony Doncic! And-1! James Cunningham to the line for 1. [Team fouls: 1] (Tony Doncic: 1 personal fouls)   FT 1/1: GOOD James Cunningham makes 1/1 from the line.
Score: 4-0

[11:42] Team_027 possession (Score: 4-0)
Scottie Harden attempts a 3Pt. Contested by Bam Leonard (2.4 feet, ZONE). Scottie Harden misses. Rebound secured by Terry Simons.

[11:27] Team_020 possession (Score: 4-0)
Terry Simons attempts a 3Pt. Contested by Tim Johnson (5.5 feet, ZONE). TERRY SIMONS MAKES IT! Assist: Bam Leonard
Score: 7-0

[11:13] Team_027 possession (Score: 7-0)
Bradley Dosunmu attempts a 3Pt. Contested by Bam Leonard (2.4 feet, ZONE). Bradley Dosunmu misses. Offensive rebound by Bradley Dosunmu! Bradley Dosunmu kicks it out.

[10:57] Team_027 possession (Score: 7-0)
FOUL! Shooting foul on James Cunningham. John Russell to the line for 2 free throws. [Team fouls: 1] (James Cunningham: 1 personal fouls)   FT 1/2: GOOD   FT 2/2: GOOD John Russell makes 2/2 from the line.
Score: 7-2

[10:45] Team_020 possession (Score: 7-2)
Jarrett McCollum attempts a 3Pt. Contested by Tim Johnson (5.0 feet, MAN). Jarrett McCollum misses. Rebound secured by Tony Doncic.

[10:32] Team_027 possession (Score: 7-2)
Tony Doncic attempts a Layup. Contested by James Cunningham (5.1 feet, MAN). TONY DONCIC MAKES IT!
Score: 7-4

[10:16] Team_020 possession (Score: 7-4)
Terry Simons attempts a Layup. Contested by John Russell (4.5 feet, ZONE). TERRY SIMONS MAKES IT! Assist: Bam Leonard
Score: 9-4

[10:04] Team_027 possession (Score: 9-4)
Scottie Harden attempts a 3Pt. Contested by Terry Simons (4.3 feet, MAN). Scottie Harden misses. Rebound secured by Terry Simons.

[09:50] Team_020 possession (Score: 9-4)
Jarrett McCollum drives and kicks out. Trae Curry attempts a Midrange. Contested by John Russell (3.9 feet, MAN). Trae Curry misses. Rebound secured by Bradley Dosunmu.

[09:35] Team_027 possession (Score: 9-4)
Tony Doncic attempts a Layup. Contested by James Cunningham (5.1 feet, MAN). TONY DONCIC MAKES IT! Assist: John Russell
Score: 9-6

[09:23] Team_020 possession (Score: 9-6)
James Cunningham attempts a 3Pt. Contested by Tony Doncic (4.2 feet, MAN). James Cunningham misses. Rebound secured by John Russell.

[09:10] Team_027 possession (Score: 9-6)
Scottie Harden loses control! Ball rolls out of bounds! TURNOVER! (dead ball)

[08:58] Team_020 possession (Score: 9-6)
FOUL! Holding foul on Scottie Harden. [Team fouls: 2] No free throws, side out. (Scottie Harden: 1 personal fouls)

[08:41] Team_020 possession (Score: 9-6)
Jarrett McCollum drives, Tim Johnson stays with him. Jarrett McCollum attempts a Dunk. Contested by Tim Johnson (5.0 feet, MAN). JARRETT MCCOLLUM MAKES IT! Assist: Trae Curry
Score: 11-6

[08:22] Team_027 possession (Score: 11-6)
John Russell makes the Layup and draws the foul on Trae Curry! And-1! John Russell to the line for 1. [Team fouls: 2] (Trae Curry: 1 personal fouls)   FT 1/1: GOOD John Russell makes 1/1 from the line.
Score: 11-9

[08:08] Team_020 possession (Score: 11-9)
Trae Curry attempts a Layup. Contested by John Russell (4.3 feet, ZONE). TRAE CURRY MAKES IT! Assist: Bam Leonard
Score: 13-9

[07:54] Team_027 possession (Score: 13-9)
Scottie Harden attempts a Midrange. Contested by Bam Leonard (2.4 feet, ZONE). Scottie Harden misses. Rebound secured by Bam Leonard.

[07:39] Team_020 possession (Score: 13-9)
James Cunningham attempts a 3Pt. Contested by Tim Johnson (5.2 feet, ZONE). James Cunningham misses. Rebound secured by John Russell.

[07:28] Team_027 possession (Score: 13-9)
Tim Johnson drives and kicks out. Tony Doncic attempts a 3Pt. Contested by Bam Leonard (2.3 feet, ZONE). Tony Doncic misses. Rebound secured by Terry Simons.

[07:11] Team_020 possession (Score: 13-9)
Bam Leonard attempts a 3Pt. Contested by Tim Johnson (5.2 feet, ZONE). BAM LEONARD MAKES IT! Assist: James Cunningham
Score: 16-9

[06:59] Team_027 possession (Score: 16-9)
Tony Doncic attempts a 3Pt. Contested by James Cunningham (5.1 feet, MAN). TONY DONCIC MAKES IT! Assist: Scottie Harden
Score: 16-12

[06:44] Team_020 possession (Score: 16-12)
Trae Curry makes the Dunk and draws the foul on John Russell! And-1! Trae Curry to the line for 1. [Team fouls: 3] (John Russell: 1 personal fouls)   FT 1/1: GOOD Trae Curry makes 1/1 from the line.
Score: 19-12

[06:31] Team_027 possession (Score: 19-12)
John Russell attempts a 3Pt. Contested by Bam Leonard (3.1 feet, MAN). John Russell misses. Rebound secured by Trae Curry.

[06:15] Team_020 possession (Score: 19-12)
Trae Curry attempts a Layup. Contested by Bradley Dosunmu (4.8 feet, ZONE). TRAE CURRY MAKES IT!
Score: 21-12

[05:57] Team_027 possession (Score: 21-12)
Bradley Dosunmu attempts a Layup. Contested by Bam Leonard (2.4 feet, ZONE). Bradley Dosunmu misses. Offensive rebound by John Russell! John Russell puts it back in!
Score: 21-14

[05:42] Team_020 possession (Score: 21-14)
FOUL! Reach-in foul on Bradley Dosunmu during the drive. [Team fouls: 4] No free throws, side out. (Bradley Dosunmu: 1 personal fouls)

[05:28] Team_020 possession (Score: 21-14)
Terry Simons attempts a 3Pt. Contested by Tony Doncic (4.6 feet, ZONE). Terry Simons misses. FOUL! Loose ball foul on John Russell during the rebound battle. [IN THE BONUS! 5 team fouls] Trae Curry to the line for 2 free throws. (John Russell: 2 personal fouls)   FT 1/2: GOOD   FT 2/2: GOOD Trae Curry makes 2/2 from the line.
Score: 23-14

[05:11] Team_027 possession (Score: 23-14)
Tony Doncic attempts a 3Pt. Contested by James Cunningham (5.1 feet, MAN). Tony Doncic misses. Rebound secured by Trae Curry.

[04:58] Team_020 possession (Score: 23-14)
James Cunningham attempts a 3Pt. Contested by Tim Johnson (5.2 feet, ZONE). James Cunningham misses. Offensive rebound by Bam Leonard! Bam Leonard puts it back in!
Score: 25-14

[04:44] Team_027 possession (Score: 25-14)
Scottie Harden attempts a Layup. Contested by Terry Simons (4.3 feet, MAN). Scottie Harden misses. Rebound secured by Trae Curry.

[04:33] Team_020 possession (Score: 25-14)
FOUL! Shooting foul on Bradley Dosunmu. Bam Leonard to the line for 2 free throws. [BONUS: 6 team fouls] (Bradley Dosunmu: 2 personal fouls)   FT 1/2: MISS   FT 2/2: GOOD Bam Leonard makes 1/2 from the line.
Score: 26-14

[04:22] Team_027 possession (Score: 26-14)
FOUL! Shooting foul on Bam Leonard. John Russell to the line for 3 free throws. [Team fouls: 3] (Bam Leonard: 1 personal fouls)   FT 1/3: GOOD   FT 2/3: MISS   FT 3/3: GOOD John Russell makes 2/3 from the line.
Score: 26-16

[04:06] Team_020 possession (Score: 26-16)
James Cunningham attempts a 3Pt. Contested by Tim Johnson (5.3 feet, ZONE). James Cunningham misses. Rebound secured by Tony Doncic.

[03:55] Team_027 possession (Score: 26-16)
Tim Johnson attempts a 3Pt. Contested by Jarrett McCollum (4.8 feet, ZONE). Tim Johnson misses. Rebound secured by Bam Leonard.

[03:39] Team_020 possession (Score: 26-16)
Terry Simons makes the Layup and draws the foul on Tony Doncic! And-1! Terry Simons to the line for 1. [BONUS: 7 team fouls] (Tony Doncic: 2 personal fouls)   FT 1/1: GOOD Terry Simons makes 1/1 from the line.
Score: 29-16

[03:28] Team_027 possession (Score: 29-16)
Scottie Harden attempts a Midrange. Contested by James Cunningham (5.2 feet, ZONE). Scottie Harden misses. Offensive rebound by Bradley Dosunmu! Bradley Dosunmu kicks it out.

[03:14] Team_027 possession (Score: 29-16)
John Russell attempts a Dunk. BLOCKED BY TRAE CURRY! Ball deflects out of bounds off John Russell.

[03:02] Team_020 possession (Score: 29-16)
Jarrett McCollum attempts a 3Pt. Contested by Tim Johnson (5.2 feet, ZONE). Jarrett McCollum misses. FOUL! Loose ball foul on Tony Doncic during the rebound battle. [IN THE BONUS! 8 team fouls] Bam Leonard to the line for 2 free throws. (Tony Doncic: 3 personal fouls)   FT 1/2: GOOD   FT 2/2: MISS Bam Leonard makes 1/2 from the line. Rebound secured by Bradley Dosunmu.
Score: 30-16

[02:48] Team_027 possession (Score: 30-16)
Scottie Harden drives, Terry Simons stays with him. Scottie Harden attempts a Layup. Contested by Terry Simons (4.5 feet, MAN). Scottie Harden misses. Rebound secured by Trae Curry.

[02:32] Team_020 possession (Score: 30-16)
Bam Leonard drives to the basket... Bam Leonard throws a bad pass! Stolen by Bradley Dosunmu! TURNOVER! (live ball)

[02:16] Team_027 possession (Score: 30-16)
Tony Doncic attempts a Midrange. Contested by Bam Leonard (2.8 feet, ZONE). TONY DONCIC MAKES IT! Assist: John Russell
Score: 30-18

[02:02] Team_020 possession (Score: 30-18)
Bam Leonard drives, Bradley Dosunmu stays with him. Bam Leonard attempts a Layup. Contested by Bradley Dosunmu (4.9 feet, MAN). Bam Leonard misses. Rebound secured by John Russell.

[01:49] Team_027 possession (Score: 30-18)
Tim Johnson attempts a Layup. BLOCKED BY TRAE CURRY! Ball is loose! Offensive rebound by John Russell! John Russell kicks it out.

[01:34] Team_027 possession (Score: 30-18)
Bradley Dosunmu attempts a Midrange. Contested by Trae Curry (5.1 feet, ZONE). Bradley Dosunmu misses. Rebound secured by Bam Leonard.

[01:20] Team_020 possession (Score: 30-18)
FOUL! Shooting foul on Tim Johnson. Jarrett McCollum to the line for 3 free throws. [BONUS: 9 team fouls] (Tim Johnson: 1 personal fouls)   FT 1/3: GOOD   FT 2/3: MISS   FT 3/3: GOOD Jarrett McCollum makes 2/3 from the line.
Score: 32-18

[01:03] Team_027 possession (Score: 32-18)
Bradley Dosunmu makes the Layup and draws the foul on Bam Leonard! And-1! Bradley Dosunmu to the line for 1. [Team fouls: 4] (Bam Leonard: 2 personal fouls)   FT 1/1: GOOD Bradley Dosunmu makes 1/1 from the line.
Score: 32-21

[00:46] Team_020 possession (Score: 32-21)
James Cunningham attempts a 3Pt. Contested by Tim Johnson (5.6 feet, ZONE). James Cunningham misses. FOUL! Loose ball foul on Tony Doncic during the rebound battle. [IN THE BONUS! 10 team fouls] Trae Curry to the line for 2 free throws. (Tony Doncic: 4 personal fouls)   FT 1/2: MISS   FT 2/2: GOOD Trae Curry makes 1/2 from the line.
Score: 33-21

[00:32] Team_027 possession (Score: 33-21)
Scottie Harden attempts a Midrange. Contested by Terry Simons (4.8 feet, MAN). Scottie Harden misses. Rebound secured by Bam Leonard.

[00:19] Team_020 possession (Score: 33-21)
Jarrett McCollum commits a violation (traveling/carry)! TURNOVER! (dead ball)

[00:19] Substitution (Team_020): Jarrett McCollum OUT → Franz Doncic IN (stamina_rule2)

[00:19] Substitution (Team_020): James Cunningham OUT → Stephen Parker IN (stamina_rule2)

[00:19] Substitution (Team_020): Terry Simons OUT → Victor Holiday IN (stamina_rule2)

[00:19] Substitution (Team_020): Bam Leonard OUT → Cole Barnes IN (stamina_rule2)

[00:19] Substitution (Team_020): Trae Curry OUT → Miles Siakam IN (stamina_rule2)

[00:19] Substitution (Team_027): Tim Johnson OUT → CJ Green IN (stamina_rule2)

[00:19] Substitution (Team_027): Tony Doncic OUT → Dirk Lillard IN (stamina_rule2)

[00:19] Substitution (Team_027): Scottie Harden OUT → Rudy Quickley IN (stamina_rule2)

[00:19] Substitution (Team_027): Bradley Dosunmu OUT → LeBron Russell IN (stamina_rule2)

[00:19] Substitution (Team_027): John Russell OUT → Ben Stewart IN (stamina_rule2)

[00:07] Team_027 possession (Score: 33-21)
LeBron Russell drives, picks up Cole Barnes. Help arrives from Franz Doncic! LeBron Russell attempts a Layup. Contested by Franz Doncic (5.0 feet, MAN). LEBRON RUSSELL MAKES IT!
Score: 33-23

================================================================================
                              1ST QUARTER COMPLETE                              
================================================================================

1ST QUARTER SCORE: Team_020 33, Team_027 23

BOX SCORE:
================================================================================

Team_020
--------------------------------------------------------------------------------
Player                MIN  PTS  REB  AST  TO      FG   FG%      3P   3P%
--------------------------------------------------------------------------------
Trae Curry             12   10    4    1   0   5/5   100.0     0/0   0.0
Terry Simons           12    8    3    0   0   3/3   100.0     0/0   0.0
Bam Leonard            12    6    5    3   0   3/4    75.0     0/0   0.0
James Cunningham       12    4    0    1   0   1/4    25.0     0/0   0.0
Jarrett McCollum       12    4    0    0   0   2/5    40.0     0/0   0.0

TEAM: FG: 14/21 (66.7%), 3PT: 7/12 (58.3%), REB: 13 (2 off, 11 def), AST: 5, TO: 2
TEAM FOULS: 4


Team_027
--------------------------------------------------------------------------------
Player                MIN  PTS  REB  AST  TO      FG   FG%      3P   3P%
--------------------------------------------------------------------------------
John Russell           12    9    5    2   0   4/6    66.7     0/0   0.0
Tony Doncic            12    9    2    0   0   4/5    80.0     0/0   0.0
Bradley Dosunmu        12    3    4    0   0   1/2    50.0     0/0   0.0
LeBron Russell          0    2    0    0   0   1/1   100.0     0/0   0.0
Scottie Harden         12    0    0    1   0   0/6     0.0     0/0   0.0
Tim Johnson            12    0    0    0   0   0/2     0.0     0/0   0.0

TEAM: FG: 10/22 (45.5%), 3PT: 2/7 (28.6%), REB: 10 (4 off, 6 def), AST: 3, TO: 1
TEAM FOULS: 10 [Team_020 in BONUS]

================================================================================

================================================================================
                       2ND QUARTER - Team_020 vs Team_027                       
================================================================================

[12:00] Team_020 possession (Score: 33-23)
Jarrett McCollum attempts a Midrange. Contested by Tim Johnson (5.3 feet, ZONE). Jarrett McCollum misses. Rebound secured by John Russell.

[11:42] Team_027 possession (Score: 33-23)
Tim Johnson drives, Trae Curry stays with him. Tim Johnson attempts a Dunk. Contested by Trae Curry (5.2 feet, ZONE). TIM JOHNSON MAKES IT! Assist: Bradley Dosunmu
Score: 33-25

[11:26] Team_020 possession (Score: 33-25)
Bam Leonard drives to the basket... Bam Leonard commits a violation (traveling/carry)! TURNOVER! (dead ball)

[11:26] Substitution (Team_020): Jarrett McCollum OUT → Franz Doncic IN (stamina_rule2)

[11:26] Substitution (Team_020): James Cunningham OUT → Stephen Parker IN (stamina_rule2)

[11:26] Substitution (Team_020): Terry Simons OUT → Victor Holiday IN (stamina_rule2)

[11:26] Substitution (Team_020): Bam Leonard OUT → Cole Barnes IN (stamina_rule2)

[11:26] Substitution (Team_020): Trae Curry OUT → Miles Siakam IN (stamina_rule2)

[11:26] Substitution (Team_027): Tim Johnson OUT → CJ Green IN (stamina_rule2)

[11:26] Substitution (Team_027): Tony Doncic OUT → Dirk Lillard IN (stamina_rule2)

[11:26] Substitution (Team_027): Scottie Harden OUT → Rudy Quickley IN (stamina_rule2)

[11:26] Substitution (Team_027): Bradley Dosunmu OUT → LeBron Russell IN (stamina_rule2)

[11:26] Substitution (Team_027): John Russell OUT → Ben Stewart IN (stamina_rule2)

[11:06] Team_027 possession (Score: 33-25)
LeBron Russell attempts a 3Pt. Contested by Stephen Parker (5.4 feet, ZONE). LEBRON RUSSELL MAKES IT! Assist: Rudy Quickley
Score: 33-28

[10:53] Team_020 possession (Score: 33-28)
Cole Barnes makes the Midrange and draws the foul on Dirk Lillard! And-1! Cole Barnes to the line for 1. [Team fouls: 1] (Dirk Lillard: 1 personal fouls)   FT 1/1: GOOD Cole Barnes makes 1/1 from the line.
Score: 36-28

[10:40] Team_027 possession (Score: 36-28)
FOUL! Holding foul on Franz Doncic. [Team fouls: 1] No free throws, side out. (Franz Doncic: 1 personal fouls)

[10:24] Team_027 possession (Score: 36-28)
Rudy Quickley drives, picks up Miles Siakam. Help arrives from Franz Doncic! Rudy Quickley attempts a Dunk. Contested by Franz Doncic (4.4 feet, ZONE). Rudy Quickley misses. FOUL! Loose ball foul on Cole Barnes during the rebound battle. [Team fouls: 2] No free throws, side out. (Cole Barnes: 1 personal fouls)

[10:12] Team_027 possession (Score: 36-28)
CJ Green attempts a Midrange. Contested by Franz Doncic (4.1 feet, MAN). CJ Green misses. Offensive rebound by Ben Stewart! Ben Stewart puts it back in!
Score: 36-30

[09:59] Team_020 possession (Score: 36-30)
Cole Barnes attempts a Layup. Contested by Ben Stewart (4.8 feet, ZONE). COLE BARNES MAKES IT!
Score: 38-30

[09:47] Team_027 possession (Score: 38-30)
FOUL! Shooting foul on Stephen Parker. LeBron Russell to the line for 3 free throws. [Team fouls: 3] (Stephen Parker: 1 personal fouls)   FT 1/3: MISS   FT 2/3: GOOD   FT 3/3: GOOD LeBron Russell makes 2/3 from the line.
Score: 38-32

[09:34] Team_020 possession (Score: 38-32)
Franz Doncic attempts a Layup. Contested by Ben Stewart (4.3 feet, ZONE). FRANZ DONCIC MAKES IT! Assist: Miles Siakam
Score: 40-32

[09:22] Team_027 possession (Score: 40-32)
Dirk Lillard makes the Dunk and draws the foul on Franz Doncic! And-1! Dirk Lillard to the line for 1. [Team fouls: 4] (Franz Doncic: 2 personal fouls)   FT 1/1: MISS Dirk Lillard makes 0/1 from the line. Rebound secured by Cole Barnes.
Score: 40-34

[09:11] Team_020 possession (Score: 40-34)
Stephen Parker attempts a Layup. Contested by Ben Stewart (4.8 feet, ZONE). STEPHEN PARKER MAKES IT!
Score: 42-34

[09:00] Team_027 possession (Score: 42-34)
LeBron Russell attempts a 3Pt. Contested by Stephen Parker (5.4 feet, ZONE). LeBron Russell misses. Rebound secured by Miles Siakam.

[08:49] Team_020 possession (Score: 42-34)
FOUL! Shooting foul on Dirk Lillard. Miles Siakam to the line for 2 free throws. [Team fouls: 2] (Dirk Lillard: 2 personal fouls)   FT 1/2: GOOD   FT 2/2: GOOD Miles Siakam makes 2/2 from the line.
Score: 44-34

[08:40] Team_027 possession (Score: 44-34)
Rudy Quickley attempts a Midrange. Contested by Victor Holiday (4.7 feet, MAN). RUDY QUICKLEY MAKES IT! Assist: LeBron Russell
Score: 44-36

[08:25] Team_020 possession (Score: 44-36)
Cole Barnes attempts a Layup. Contested by Ben Stewart (4.8 feet, ZONE). Cole Barnes misses. Rebound secured by Dirk Lillard.

[08:15] Team_027 possession (Score: 44-36)
FOUL! Shooting foul on Miles Siakam. CJ Green to the line for 2 free throws. [BONUS: 5 team fouls] (Miles Siakam: 1 personal fouls)   FT 1/2: GOOD   FT 2/2: MISS CJ Green makes 1/2 from the line. Rebound secured by Cole Barnes.
Score: 44-37

[07:58] Team_020 possession (Score: 44-37)
Miles Siakam drives, Ben Stewart stays with him. Miles Siakam attempts a Dunk. Contested by Ben Stewart (4.9 feet, ZONE). Miles Siakam misses. Rebound secured by Dirk Lillard.

[07:45] Team_027 possession (Score: 44-37)
FOUL! Offensive foul on LeBron Russell! Cole Barnes drew the charge! [Team fouls: 3] (LeBron Russell: 1 personal fouls) TURNOVER! (dead ball)

[07:29] Team_020 possession (Score: 44-37)
Cole Barnes attempts a Layup. Contested by Ben Stewart (4.8 feet, ZONE). COLE BARNES MAKES IT!
Score: 46-37

[07:17] Team_027 possession (Score: 46-37)
Dirk Lillard attempts a 3Pt. Contested by Stephen Parker (5.5 feet, MAN). Dirk Lillard misses. Rebound secured by Miles Siakam.

[07:03] Team_020 possession (Score: 46-37)
Cole Barnes attempts a Layup. Contested by LeBron Russell (5.5 feet, MAN). Cole Barnes misses. Rebound secured by Dirk Lillard.

[06:45] Team_027 possession (Score: 46-37)
Dirk Lillard attempts a 3Pt. Contested by Stephen Parker (5.5 feet, MAN). Dirk Lillard misses. Rebound secured by Cole Barnes.

[06:35] Team_020 possession (Score: 46-37)
Cole Barnes attempts a Midrange. Contested by Dirk Lillard (4.2 feet, ZONE). Cole Barnes misses. Rebound secured by LeBron Russell.

[06:20] Team_027 possession (Score: 46-37)
CJ Green attempts a Midrange. Contested by Cole Barnes (5.1 feet, ZONE). CJ Green misses. Rebound secured by Victor Holiday.

[06:05] Team_020 possession (Score: 46-37)
Cole Barnes drives, LeBron Russell stays with him. Cole Barnes attempts a Dunk. Contested by LeBron Russell (5.5 feet, MAN). COLE BARNES MAKES IT! Assist: Stephen Parker
Score: 48-37

[05:50] Team_027 possession (Score: 48-37)
LeBron Russell attempts a 3Pt. Contested by Cole Barnes (5.0 feet, MAN). LEBRON RUSSELL MAKES IT! Assist: CJ Green
Score: 48-40

[05:33] Team_020 possession (Score: 48-40)
Victor Holiday drives and kicks out. Victor Holiday attempts a Midrange. BLOCKED BY DIRK LILLARD! Ball deflects out of bounds off Victor Holiday.

[05:18] Team_027 possession (Score: 48-40)
CJ Green attempts a 3Pt. Contested by Franz Doncic (4.1 feet, MAN). CJ GREEN MAKES IT! Assist: LeBron Russell
Score: 48-43

[05:05] Team_020 possession (Score: 48-43)
Franz Doncic drives and kicks out. Cole Barnes attempts a 3Pt. Contested by LeBron Russell (5.5 feet, MAN). Cole Barnes misses. Rebound secured by Ben Stewart.

[04:48] Team_027 possession (Score: 48-43)
FOUL! Shooting foul on Victor Holiday. Rudy Quickley to the line for 2 free throws. [BONUS: 6 team fouls] (Victor Holiday: 1 personal fouls)   FT 1/2: GOOD   FT 2/2: GOOD Rudy Quickley makes 2/2 from the line.
Score: 48-45

[04:31] Team_020 possession (Score: 48-45)
Franz Doncic attempts a 3Pt. Contested by LeBron Russell (5.1 feet, ZONE). Franz Doncic misses. Rebound secured by Ben Stewart.

[04:17] Team_027 possession (Score: 48-45)
FOUL! Shooting foul on Stephen Parker. Dirk Lillard to the line for 3 free throws. [BONUS: 7 team fouls] (Stephen Parker: 2 personal fouls)   FT 1/3: GOOD   FT 2/3: GOOD   FT 3/3: GOOD Dirk Lillard makes 3/3 from the line.
Score: 48-48

[04:03] Team_020 possession (Score: 48-48)
FOUL! Shooting foul on LeBron Russell. Cole Barnes to the line for 2 free throws. [Team fouls: 4] (LeBron Russell: 2 personal fouls)   FT 1/2: GOOD   FT 2/2: MISS Cole Barnes makes 1/2 from the line. Rebound secured by LeBron Russell.
Score: 49-48

[03:50] Team_027 possession (Score: 49-48)
FOUL! Reach-in foul on Victor Holiday during the drive. [IN THE BONUS! 8 team fouls] Rudy Quickley to the line for 2 free throws. (Victor Holiday: 2 personal fouls)   FT 1/2: GOOD   FT 2/2: GOOD Rudy Quickley makes 2/2 from the line.
Score: 49-50

[03:39] Team_020 possession (Score: 49-50)
Victor Holiday attempts a 3Pt. Contested by Rudy Quickley (3.9 feet, ZONE). VICTOR HOLIDAY MAKES IT! Assist: Franz Doncic
Score: 52-50

[03:28] Team_027 possession (Score: 52-50)
LeBron Russell attempts a 3Pt. Contested by Cole Barnes (5.1 feet, MAN). LeBron Russell misses. Rebound secured by Cole Barnes.

[03:15] Team_020 possession (Score: 52-50)
Stephen Parker attempts a Midrange. Contested by LeBron Russell (5.8 feet, ZONE). STEPHEN PARKER MAKES IT! Assist: Miles Siakam
Score: 54-50

[02:59] Team_027 possession (Score: 54-50)
Ben Stewart attempts a Layup. Contested by Miles Siakam (4.2 feet, MAN). Ben Stewart misses. Rebound secured by Cole Barnes.

[02:45] Team_020 possession (Score: 54-50)
Franz Doncic attempts a 3Pt. Contested by Rudy Quickley (3.2 feet, ZONE). Franz Doncic misses. Rebound secured by Ben Stewart.

[02:29] Team_027 possession (Score: 54-50)
Ben Stewart attempts a Layup. Contested by Miles Siakam (4.2 feet, ZONE). Ben Stewart misses. Rebound secured by Miles Siakam.

[02:12] Team_020 possession (Score: 54-50)
Victor Holiday makes the Layup and draws the foul on Ben Stewart! And-1! Victor Holiday to the line for 1. [BONUS: 5 team fouls] (Ben Stewart: 1 personal fouls)   FT 1/1: GOOD Victor Holiday makes 1/1 from the line.
Score: 57-50

[01:53] Team_027 possession (Score: 57-50)
LeBron Russell drives to the basket... LeBron Russell throws a bad pass! Stolen by Miles Siakam! TURNOVER! (live ball)

[01:39] Team_020 possession (Score: 57-50)
FOUL! Reach-in foul on Dirk Lillard during the drive. [IN THE BONUS! 6 team fouls] Stephen Parker to the line for 2 free throws. (Dirk Lillard: 3 personal fouls)   FT 1/2: MISS   FT 2/2: MISS Stephen Parker makes 0/2 from the line. Rebound secured by Ben Stewart.

[01:22] Team_027 possession (Score: 57-50)
LeBron Russell attempts a Layup. BLOCKED BY COLE BARNES! Ball is loose! Rebound secured by Cole Barnes.

[01:05] Team_020 possession (Score: 57-50)
Stephen Parker attempts a Layup. Contested by Ben Stewart (5.1 feet, ZONE). Stephen Parker misses. Rebound secured by Dirk Lillard.

[00:50] Team_027 possession (Score: 57-50)
Dirk Lillard attempts a 3Pt. Contested by Stephen Parker (5.8 feet, MAN). DIRK LILLARD MAKES IT! Assist: LeBron Russell
Score: 57-53

[00:34] Team_020 possession (Score: 57-53)
Stephen Parker attempts a 3Pt. Contested by Dirk Lillard (4.7 feet, MAN). Stephen Parker misses. Rebound secured by LeBron Russell.

[00:19] Team_027 possession (Score: 57-53)
Ben Stewart attempts a 3Pt. Contested by Stephen Parker (5.7 feet, ZONE). BEN STEWART MAKES IT!
Score: 57-56

[00:08] Team_020 possession (Score: 57-56)
Victor Holiday attempts a 3Pt. Contested by CJ Green (5.9 feet, ZONE). Victor Holiday misses. Rebound secured by Ben Stewart.

================================================================================
                              2ND QUARTER COMPLETE                              
================================================================================

2ND QUARTER SCORE: Team_020 24, Team_027 33

BOX SCORE:
================================================================================

Team_020
--------------------------------------------------------------------------------
Player                MIN  PTS  REB  AST  TO      FG   FG%      3P   3P%
--------------------------------------------------------------------------------
Cole Barnes            11    9    6    0   0   4/8    50.0     0/0   0.0
Victor Holiday         11    6    1    0   0   2/4    50.0     0/0   0.0
Stephen Parker         11    4    0    1   0   2/5    40.0     0/0   0.0
Franz Doncic           11    2    0    1   0   1/4    25.0     0/0   0.0
Miles Siakam           11    2    3    2   0   1/2    50.0     0/0   0.0
Jarrett McCollum       13    0    0    0   0   0/1     0.0     0/0   0.0

TEAM: FG: 10/24 (41.7%), 3PT: 1/5 (20.0%), REB: 10 (0 off, 10 def), AST: 4, TO: 1
TEAM FOULS: 8 [Team_027 in BONUS]


Team_027
--------------------------------------------------------------------------------
Player                MIN  PTS  REB  AST  TO      FG   FG%      3P   3P%
--------------------------------------------------------------------------------
LeBron Russell         11    8    3    3   0   3/6    50.0     0/0   0.0
Rudy Quickley          11    6    0    1   0   3/3   100.0     0/0   0.0
Dirk Lillard           11    6    5    0   0   2/5    40.0     0/0   0.0
Ben Stewart            11    5    6    0   0   2/4    50.0     0/0   0.0
CJ Green               11    3    0    1   0   1/3    33.3     0/0   0.0
Tim Johnson            13    2    0    0   0   1/1   100.0     0/0   0.0
John Russell           13    0    1    0   0   0/0     0.0     0/0   0.0
Bradley Dosunmu        13    0    0    1   0   0/0     0.0     0/0   0.0

TEAM: FG: 12/22 (54.5%), 3PT: 7/11 (63.6%), REB: 15 (2 off, 13 def), AST: 6, TO: 2
TEAM FOULS: 6 [Team_020 in BONUS]

================================================================================

================================================================================
                       3RD QUARTER - Team_020 vs Team_027                       
================================================================================

[12:00] Team_020 possession (Score: 57-56)
FOUL! Shooting foul on John Russell. Trae Curry to the line for 2 free throws. [Team fouls: 1] (John Russell: 1 personal fouls)   FT 1/2: GOOD   FT 2/2: MISS Trae Curry makes 1/2 from the line. Rebound secured by Bradley Dosunmu.
Score: 58-56

[11:44] Team_027 possession (Score: 58-56)
Scottie Harden attempts a Layup. Contested by Trae Curry (4.7 feet, ZONE). Scottie Harden misses. Rebound secured by Trae Curry.

[11:27] Team_020 possession (Score: 58-56)
James Cunningham attempts a 3Pt. Contested by Tim Johnson (5.2 feet, ZONE). James Cunningham misses. Rebound secured by John Russell.

[11:13] Team_027 possession (Score: 58-56)
Bradley Dosunmu attempts a Layup. BLOCKED BY BAM LEONARD! Ball is loose! Offensive rebound by John Russell! John Russell kicks it out.

[11:00] Team_027 possession (Score: 58-56)
Scottie Harden drives to the basket... Scottie Harden loses the ball! Stripped by Trae Curry! TURNOVER! (live ball)

[10:46] Team_020 possession (Score: 58-56)
Terry Simons attempts a Layup. Contested by John Russell (4.5 feet, ZONE). TERRY SIMONS MAKES IT! Assist: Jarrett McCollum
Score: 60-56

[10:34] Team_027 possession (Score: 60-56)
John Russell attempts a Midrange. BLOCKED BY BAM LEONARD! Ball is loose! Offensive rebound by Bradley Dosunmu! Bradley Dosunmu kicks it out.

[10:19] Team_027 possession (Score: 60-56)
John Russell drives to the basket... John Russell loses the ball! Stripped by Bam Leonard! TURNOVER! (live ball)

[10:04] Team_020 possession (Score: 60-56)
Terry Simons attempts a Midrange. Contested by Scottie Harden (5.2 feet, MAN). Terry Simons misses. Offensive rebound by Bam Leonard! Bam Leonard's putback is no good. Rebound secured by Bradley Dosunmu.

[09:50] Team_027 possession (Score: 60-56)
Bradley Dosunmu attempts a Midrange. Contested by James Cunningham (5.0 feet, ZONE). Bradley Dosunmu misses. Rebound secured by Bam Leonard.

[09:37] Team_020 possession (Score: 60-56)
Terry Simons drives and kicks out. Trae Curry attempts a 3Pt. Contested by Tim Johnson (4.9 feet, ZONE). Trae Curry misses. Offensive rebound by Trae Curry! Trae Curry puts it back in!
Score: 62-56

[09:24] Team_027 possession (Score: 62-56)
Tim Johnson drives to the basket... FOUL! Offensive foul on Tim Johnson! Jarrett McCollum drew the charge! [Team fouls: 2] (Tim Johnson: 1 personal fouls) TURNOVER! (dead ball)

[09:10] Team_020 possession (Score: 62-56)
Bam Leonard attempts a 3Pt. Contested by Tim Johnson (5.2 feet, ZONE). Bam Leonard misses. Rebound secured by Bradley Dosunmu.

[08:54] Team_027 possession (Score: 62-56)
Tony Doncic loses the ball! Stripped by James Cunningham! TURNOVER! (live ball)

[08:39] Team_020 possession (Score: 62-56)
FOUL! Shooting foul on John Russell. Terry Simons to the line for 2 free throws. [Team fouls: 3] (John Russell: 2 personal fouls)   FT 1/2: GOOD   FT 2/2: GOOD Terry Simons makes 2/2 from the line.
Score: 64-56

[08:23] Team_027 possession (Score: 64-56)
Scottie Harden drives, picks up Trae Curry. Help arrives from Jarrett McCollum! Scottie Harden attempts a Dunk. Contested by Jarrett McCollum (4.7 feet, ZONE). Scottie Harden misses. Rebound secured by Bam Leonard.

[08:10] Team_020 possession (Score: 64-56)
FOUL! Shooting foul on Bradley Dosunmu. Bam Leonard to the line for 2 free throws. [Team fouls: 4] (Bradley Dosunmu: 1 personal fouls)   FT 1/2: MISS   FT 2/2: GOOD Bam Leonard makes 1/2 from the line.
Score: 65-56

[07:57] Team_027 possession (Score: 65-56)
Tony Doncic drives, James Cunningham stays with him. Tony Doncic attempts a Dunk. Contested by James Cunningham (5.1 feet, MAN). TONY DONCIC MAKES IT! Assist: Bradley Dosunmu
Score: 65-58

[07:41] Team_020 possession (Score: 65-58)
Jarrett McCollum drives to the basket... FOUL! Offensive foul on Jarrett McCollum! Tim Johnson drew the charge! [Team fouls: 1] (Jarrett McCollum: 1 personal fouls) TURNOVER! (dead ball)

[07:31] Team_027 possession (Score: 65-58)
Bradley Dosunmu drives and kicks out. Tim Johnson attempts a Midrange. Contested by Jarrett McCollum (4.4 feet, MAN). Tim Johnson misses. Rebound secured by Bam Leonard.

[07:12] Team_020 possession (Score: 65-58)
Bam Leonard attempts a Midrange. Contested by Scottie Harden (4.8 feet, ZONE). Bam Leonard misses. Rebound secured by Tony Doncic.

[06:53] Team_027 possession (Score: 65-58)
Tim Johnson attempts a 3Pt. Contested by Jarrett McCollum (4.7 feet, MAN). TIM JOHNSON MAKES IT! Assist: John Russell
Score: 65-61

[06:39] Team_020 possession (Score: 65-61)
Terry Simons attempts a 3Pt. Contested by Scottie Harden (5.2 feet, ZONE). Terry Simons misses. Rebound secured by Bradley Dosunmu.

[06:25] Team_027 possession (Score: 65-61)
FOUL! Holding foul on Bam Leonard. [Team fouls: 2] No free throws, side out. (Bam Leonard: 1 personal fouls)

[06:09] Team_027 possession (Score: 65-61)
John Russell attempts a 3Pt. Contested by James Cunningham (5.8 feet, ZONE). John Russell misses. Rebound secured by Trae Curry.

[05:57] Team_020 possession (Score: 65-61)
Bam Leonard makes the Dunk and draws the foul on John Russell! And-1! Bam Leonard to the line for 1. [BONUS: 5 team fouls] (John Russell: 3 personal fouls)   FT 1/1: MISS Bam Leonard makes 0/1 from the line. Rebound secured by Bradley Dosunmu.
Score: 67-61

[05:40] Team_027 possession (Score: 67-61)
Bradley Dosunmu attempts a Layup. Contested by Trae Curry (4.7 feet, ZONE). Bradley Dosunmu misses. Rebound secured by Bam Leonard.

[05:21] Team_020 possession (Score: 67-61)
James Cunningham drives and kicks out. FOUL! Shooting foul on John Russell. Trae Curry to the line for 2 free throws. [BONUS: 6 team fouls] (John Russell: 4 personal fouls)   FT 1/2: GOOD   FT 2/2: GOOD Trae Curry makes 2/2 from the line.
Score: 69-61

[05:04] Team_027 possession (Score: 69-61)
John Russell drives and kicks out. Scottie Harden attempts a 3Pt. Contested by Bam Leonard (2.3 feet, ZONE). Scottie Harden misses. Offensive rebound by Bradley Dosunmu! Bradley Dosunmu kicks it out.

[04:45] Team_027 possession (Score: 69-61)
Tony Doncic attempts a 3Pt. Contested by James Cunningham (5.1 feet, MAN). Tony Doncic misses. Rebound secured by Trae Curry.

[04:34] Team_020 possession (Score: 69-61)
Jarrett McCollum throws a bad pass! Stolen by Tim Johnson! TURNOVER! (live ball)

[04:20] Team_027 possession (Score: 69-61)
Tim Johnson drives, Trae Curry stays with him. Tim Johnson attempts a Dunk. Contested by Trae Curry (5.0 feet, ZONE). Tim Johnson misses. Offensive rebound by John Russell! John Russell's putback is no good. Rebound secured by Terry Simons.

[04:05] Team_020 possession (Score: 69-61)
Terry Simons drives to the basket... Terry Simons loses the ball! Stripped by John Russell! TURNOVER! (live ball)

[03:46] Team_027 possession (Score: 69-61)
Scottie Harden attempts a 3Pt. Contested by Bam Leonard (2.5 feet, ZONE). Scottie Harden misses. Rebound secured by Trae Curry.

[03:27] Team_020 possession (Score: 69-61)
James Cunningham attempts a 3Pt. Contested by Tim Johnson (5.3 feet, ZONE). James Cunningham misses. Rebound secured by Bradley Dosunmu.

[03:12] Team_027 possession (Score: 69-61)
Bradley Dosunmu drives, Trae Curry stays with him. Bradley Dosunmu attempts a Dunk. Contested by Trae Curry (4.9 feet, ZONE). Bradley Dosunmu misses. Rebound secured by Trae Curry.

[02:59] Team_020 possession (Score: 69-61)
FOUL! Reach-in foul on Bradley Dosunmu during the drive. [IN THE BONUS! 7 team fouls] Bam Leonard to the line for 2 free throws. (Bradley Dosunmu: 2 personal fouls)   FT 1/2: GOOD   FT 2/2: GOOD Bam Leonard makes 2/2 from the line.
Score: 71-61

[02:48] Team_027 possession (Score: 71-61)
FOUL! Shooting foul on Terry Simons. Tony Doncic to the line for 2 free throws. [Team fouls: 3] (Terry Simons: 1 personal fouls)   FT 1/2: GOOD   FT 2/2: MISS Tony Doncic makes 1/2 from the line. Offensive rebound by Bradley Dosunmu! Bradley Dosunmu kicks it out.
Score: 71-62

[02:34] Team_027 possession (Score: 71-62)
John Russell drives and kicks out. Tony Doncic attempts a Midrange. Contested by James Cunningham (5.2 feet, MAN). Tony Doncic misses. Rebound secured by Trae Curry.

[02:20] Team_020 possession (Score: 71-62)
Terry Simons attempts a 3Pt. Contested by Tim Johnson (5.8 feet, ZONE). Terry Simons misses. Rebound secured by Tony Doncic.

[02:02] Team_027 possession (Score: 71-62)
Tony Doncic attempts a Layup. Contested by James Cunningham (5.3 feet, MAN). Tony Doncic misses. Offensive rebound by Bradley Dosunmu! Bradley Dosunmu kicks it out.

[01:47] Team_027 possession (Score: 71-62)
Tony Doncic attempts a Midrange. Contested by Bam Leonard (2.8 feet, ZONE). Tony Doncic misses. Rebound secured by Terry Simons.

[01:30] Team_020 possession (Score: 71-62)
Bam Leonard attempts a 3Pt. Contested by Tim Johnson (5.5 feet, ZONE). Bam Leonard misses. Rebound secured by Tony Doncic.

[01:16] Team_027 possession (Score: 71-62)
John Russell attempts a Layup. Contested by Bam Leonard (3.5 feet, MAN). John Russell misses. Rebound secured by Bam Leonard.

[01:03] Team_020 possession (Score: 71-62)
Jarrett McCollum drives, John Russell stays with him. Jarrett McCollum attempts a Layup. Contested by John Russell (4.5 feet, ZONE). JARRETT MCCOLLUM MAKES IT! Assist: Bam Leonard
Score: 73-62

[00:48] Team_027 possession (Score: 73-62)
Tony Doncic attempts a Midrange. Contested by James Cunningham (5.4 feet, ZONE). Tony Doncic misses. Rebound secured by Bam Leonard.

[00:34] Team_020 possession (Score: 73-62)
James Cunningham attempts a 3Pt. Contested by Tony Doncic (4.6 feet, MAN). JAMES CUNNINGHAM MAKES IT! Assist: Jarrett McCollum
Score: 76-62

[00:19] Team_027 possession (Score: 76-62)
Tim Johnson attempts a Midrange. Contested by Jarrett McCollum (5.1 feet, MAN). Tim Johnson misses. Rebound secured by Trae Curry.

[00:06] Team_020 possession (Score: 76-62)
FOUL! Shooting foul on John Russell. Jarrett McCollum to the line for 2 free throws. [BONUS: 8 team fouls] (John Russell: 5 personal fouls)   FT 1/2: GOOD   FT 2/2: MISS Jarrett McCollum makes 1/2 from the line. Rebound secured by Bradley Dosunmu.
Score: 77-62

================================================================================
                              3RD QUARTER COMPLETE                              
================================================================================

3RD QUARTER SCORE: Team_020 20, Team_027 6

BOX SCORE:
================================================================================

Team_020
--------------------------------------------------------------------------------
Player                MIN  PTS  REB  AST  TO      FG   FG%      3P   3P%
--------------------------------------------------------------------------------
Trae Curry             25    4    8    0   0   2/3    66.7     0/0   0.0
Terry Simons           25    4    2    0   0   2/5    40.0     0/0   0.0
James Cunningham       25    3    0    0   0   1/3    33.3     0/0   0.0
Bam Leonard            25    3    6    1   0   2/6    33.3     0/0   0.0
Jarrett McCollum       25    2    0    2   0   1/2    50.0     0/0   0.0

TEAM: FG: 8/19 (42.1%), 3PT: 1/7 (14.3%), REB: 16 (2 off, 14 def), AST: 3, TO: 3
TEAM FOULS: 3


Team_027
--------------------------------------------------------------------------------
Player                MIN  PTS  REB  AST  TO      FG   FG%      3P   3P%
--------------------------------------------------------------------------------
Tim Johnson            25    3    0    0   0   1/3    33.3     0/0   0.0
Tony Doncic            25    2    3    0   0   1/4    25.0     0/0   0.0
Bradley Dosunmu        25    0   11    1   0   0/4     0.0     0/0   0.0
Scottie Harden         25    0    0    0   0   0/3     0.0     0/0   0.0
John Russell           25    0    2    1   0   0/3     0.0     0/0   0.0

TEAM: FG: 2/17 (11.8%), 3PT: 1/4 (25.0%), REB: 16 (6 off, 10 def), AST: 2, TO: 4
TEAM FOULS: 8 [Team_020 in BONUS]

================================================================================

================================================================================
                       4TH QUARTER - Team_020 vs Team_027                       
================================================================================

[12:00] Team_020 possession (Score: 77-62)
FOUL! Holding foul on John Russell. [Team fouls: 1] No free throws, side out. (John Russell: 1 personal fouls)

[11:49] Team_020 possession (Score: 77-62)
Terry Simons attempts a Layup. Contested by John Russell (4.9 feet, ZONE). TERRY SIMONS MAKES IT! Assist: Jarrett McCollum
Score: 79-62

[11:35] Team_027 possession (Score: 79-62)
Tim Johnson attempts a Layup. Contested by Jarrett McCollum (5.0 feet, MAN). TIM JOHNSON MAKES IT! Assist: John Russell
Score: 79-64

[11:25] Team_020 possession (Score: 79-64)
Bam Leonard drives, John Russell stays with him. Bam Leonard attempts a Layup. Contested by John Russell (4.6 feet, ZONE). Bam Leonard misses. Offensive rebound by Bam Leonard! Bam Leonard puts it back in!
Score: 81-64

[11:12] Team_027 possession (Score: 81-64)
Tim Johnson drives to the basket... Tim Johnson throws a bad pass! Stolen by Jarrett McCollum! TURNOVER! (live ball)

[10:53] Team_020 possession (Score: 81-64)
Bam Leonard attempts a Midrange. Contested by Tony Doncic (4.5 feet, ZONE). Bam Leonard misses. Rebound secured by Tony Doncic.

[10:40] Team_027 possession (Score: 81-64)
Tony Doncic drives and kicks out. Scottie Harden attempts a Midrange. Contested by Bam Leonard (3.0 feet, ZONE). Scottie Harden misses. Rebound secured by Trae Curry.

[10:23] Team_020 possession (Score: 81-64)
FOUL! Shooting foul on Bradley Dosunmu. Bam Leonard to the line for 2 free throws. [Team fouls: 2] (Bradley Dosunmu: 1 personal fouls)   FT 1/2: GOOD   FT 2/2: GOOD Bam Leonard makes 2/2 from the line.
Score: 83-64

[10:09] Team_027 possession (Score: 83-64)
Bradley Dosunmu attempts a Layup. BLOCKED BY JARRETT MCCOLLUM! Ball goes out off Jarrett McCollum. Bradley Dosunmu's ball!

[09:55] Team_027 possession (Score: 83-64)
Scottie Harden attempts a 3Pt. Contested by Terry Simons (4.8 feet, MAN). SCOTTIE HARDEN MAKES IT! Assist: Tony Doncic
Score: 83-67

[09:41] Team_020 possession (Score: 83-67)
FOUL! Shooting foul on Tim Johnson. Jarrett McCollum to the line for 3 free throws. [Team fouls: 3] (Tim Johnson: 1 personal fouls)   FT 1/3: MISS   FT 2/3: GOOD   FT 3/3: GOOD Jarrett McCollum makes 2/3 from the line.
Score: 85-67

[09:27] Team_027 possession (Score: 85-67)
FOUL! Reach-in foul on Trae Curry during the drive. [Team fouls: 1] No free throws, side out. (Trae Curry: 1 personal fouls)

[09:12] Team_027 possession (Score: 85-67)
Tim Johnson attempts a 3Pt. Contested by Bam Leonard (3.4 feet, ZONE). Tim Johnson misses. Rebound secured by Terry Simons.

[09:01] Team_020 possession (Score: 85-67)
FOUL! Shooting foul on John Russell. Jarrett McCollum to the line for 2 free throws. [Team fouls: 4] (John Russell: 2 personal fouls)   FT 1/2: GOOD   FT 2/2: MISS Jarrett McCollum makes 1/2 from the line. Rebound secured by John Russell.
Score: 86-67

[08:48] Team_027 possession (Score: 86-67)
FOUL! Holding foul on James Cunningham. [Team fouls: 2] No free throws, side out. (James Cunningham: 1 personal fouls)

[08:38] Team_027 possession (Score: 86-67)
Scottie Harden attempts a 3Pt. Contested by Terry Simons (5.0 feet, MAN). Scottie Harden misses. Rebound secured by Bam Leonard.

[08:18] Team_020 possession (Score: 86-67)
Trae Curry makes the Layup and draws the foul on John Russell! And-1! Trae Curry to the line for 1. [BONUS: 5 team fouls] (John Russell: 3 personal fouls)   FT 1/1: GOOD Trae Curry makes 1/1 from the line.
Score: 89-67

[08:07] Team_027 possession (Score: 89-67)
Bradley Dosunmu drives and kicks out. Tim Johnson attempts a 3Pt. Contested by Jarrett McCollum (5.3 feet, MAN). Tim Johnson misses. Rebound secured by Bam Leonard.

[07:52] Team_020 possession (Score: 89-67)
FOUL! Offensive foul on Jarrett McCollum! Tim Johnson drew the charge! [Team fouls: 3] (Jarrett McCollum: 1 personal fouls) TURNOVER! (dead ball)

[07:40] Team_027 possession (Score: 89-67)
John Russell attempts a Layup. BLOCKED BY BAM LEONARD! Ball is loose! Offensive rebound by John Russell! John Russell kicks it out.

[07:27] Team_027 possession (Score: 89-67)
FOUL! Shooting foul on Bam Leonard. Bradley Dosunmu to the line for 3 free throws. [Team fouls: 4] (Bam Leonard: 1 personal fouls)   FT 1/3: GOOD   FT 2/3: GOOD   FT 3/3: GOOD Bradley Dosunmu makes 3/3 from the line.
Score: 89-70

[07:17] Team_020 possession (Score: 89-70)
FOUL! Reach-in foul on John Russell during the drive. [IN THE BONUS! 6 team fouls] Trae Curry to the line for 2 free throws. (John Russell: 4 personal fouls)   FT 1/2: GOOD   FT 2/2: GOOD Trae Curry makes 2/2 from the line.
Score: 91-70

[07:00] Team_027 possession (Score: 91-70)
Bradley Dosunmu drives, Trae Curry stays with him. Bradley Dosunmu attempts a Dunk. Contested by Trae Curry (5.7 feet, ZONE). Bradley Dosunmu misses. Rebound secured by Terry Simons.

[06:43] Team_020 possession (Score: 91-70)
FOUL! Holding foul on Bradley Dosunmu. [IN THE BONUS! 7 team fouls] Bam Leonard to the line for 2 free throws. (Bradley Dosunmu: 2 personal fouls)   FT 1/2: GOOD   FT 2/2: MISS Bam Leonard makes 1/2 from the line. Offensive rebound by Trae Curry! Trae Curry kicks it out.
Score: 92-70

[06:34] Team_020 possession (Score: 92-70)
Trae Curry attempts a Midrange. Contested by Bradley Dosunmu (5.6 feet, ZONE). Trae Curry misses. FOUL! Loose ball foul on Bradley Dosunmu during the rebound battle. [IN THE BONUS! 8 team fouls] Bam Leonard to the line for 2 free throws. (Bradley Dosunmu: 3 personal fouls)   FT 1/2: GOOD   FT 2/2: MISS Bam Leonard makes 1/2 from the line. Rebound secured by Bradley Dosunmu.
Score: 93-70

[06:23] Team_027 possession (Score: 93-70)
Bradley Dosunmu loses the ball! Stripped by Bam Leonard! TURNOVER! (live ball)

[06:09] Team_020 possession (Score: 93-70)
FOUL! Holding foul on Bradley Dosunmu. [IN THE BONUS! 9 team fouls] Bam Leonard to the line for 2 free throws. (Bradley Dosunmu: 4 personal fouls)   FT 1/2: MISS   FT 2/2: GOOD Bam Leonard makes 1/2 from the line.
Score: 94-70

[05:54] Team_027 possession (Score: 94-70)
Bradley Dosunmu attempts a 3Pt. Contested by Bam Leonard (3.9 feet, ZONE). Bradley Dosunmu misses. Rebound secured by Bam Leonard.

[05:42] Team_020 possession (Score: 94-70)
Terry Simons makes the Midrange and draws the foul on Scottie Harden! And-1! Terry Simons to the line for 1. [BONUS: 10 team fouls] (Scottie Harden: 1 personal fouls)   FT 1/1: GOOD Terry Simons makes 1/1 from the line.
Score: 97-70

[05:29] Team_027 possession (Score: 97-70)
Tim Johnson attempts a 3Pt. Contested by Bam Leonard (4.1 feet, ZONE). Tim Johnson misses. Rebound secured by Trae Curry.

[05:19] Team_020 possession (Score: 97-70)
James Cunningham attempts a 3Pt. Contested by Tony Doncic (5.2 feet, MAN). James Cunningham misses. Rebound secured by John Russell.

[05:03] Team_027 possession (Score: 97-70)
Bradley Dosunmu attempts a Midrange. Contested by Bam Leonard (4.1 feet, MAN). BRADLEY DOSUNMU MAKES IT! Assist: Tim Johnson
Score: 97-72

[04:47] Team_020 possession (Score: 97-72)
FOUL! Holding foul on Bradley Dosunmu. [IN THE BONUS! 11 team fouls] Bam Leonard to the line for 2 free throws. (Bradley Dosunmu: 5 personal fouls)   FT 1/2: GOOD   FT 2/2: MISS Bam Leonard makes 1/2 from the line. Offensive rebound by Bam Leonard! Bam Leonard kicks it out.
Score: 98-72

[04:34] Team_020 possession (Score: 98-72)
James Cunningham attempts a 3Pt. Contested by Bradley Dosunmu (5.8 feet, ZONE). JAMES CUNNINGHAM MAKES IT! Assist: Trae Curry
Score: 101-72

[04:16] Team_027 possession (Score: 101-72)
Tim Johnson throws a bad pass out of bounds! TURNOVER! (dead ball)

[04:16] Substitution (Team_020): Jarrett McCollum OUT → Franz Doncic IN (stamina_rule2)

[04:16] Substitution (Team_020): James Cunningham OUT → Stephen Parker IN (stamina_rule2)

[04:16] Substitution (Team_020): Terry Simons OUT → Victor Holiday IN (stamina_rule2)

[04:16] Substitution (Team_020): Bam Leonard OUT → Cole Barnes IN (stamina_rule2)

[04:16] Substitution (Team_020): Trae Curry OUT → Miles Siakam IN (stamina_rule2)

[04:16] Substitution (Team_027): Tim Johnson OUT → CJ Green IN (stamina_rule2)

[04:16] Substitution (Team_027): Tony Doncic OUT → Dirk Lillard IN (stamina_rule2)

[04:16] Substitution (Team_027): Scottie Harden OUT → Rudy Quickley IN (stamina_rule2)

[04:16] Substitution (Team_027): Bradley Dosunmu OUT → LeBron Russell IN (stamina_rule2)

[04:16] Substitution (Team_027): John Russell OUT → Ben Stewart IN (stamina_rule2)

[03:56] Team_020 possession (Score: 101-72)
Franz Doncic attempts a 3Pt. Contested by CJ Green (4.7 feet, ZONE). Franz Doncic misses. Offensive rebound by Miles Siakam! Miles Siakam kicks it out.

[03:45] Team_020 possession (Score: 101-72)
Cole Barnes drives and kicks out. Franz Doncic attempts a 3Pt. Contested by CJ Green (5.1 feet, MAN). Franz Doncic misses. Offensive rebound by Cole Barnes! Cole Barnes kicks it out.

[03:27] Team_020 possession (Score: 101-72)
Cole Barnes attempts a Midrange. Contested by Dirk Lillard (4.2 feet, ZONE). Cole Barnes misses. Rebound secured by Ben Stewart.

[03:10] Team_027 possession (Score: 101-72)
Rudy Quickley drives, Miles Siakam stays with him. Rudy Quickley attempts a Layup. Contested by Miles Siakam (4.4 feet, ZONE). Rudy Quickley misses. Rebound secured by Miles Siakam.

[02:53] Team_020 possession (Score: 101-72)
FOUL! Holding foul on Rudy Quickley. [IN THE BONUS! 12 team fouls] Victor Holiday to the line for 2 free throws. (Rudy Quickley: 1 personal fouls)   FT 1/2: GOOD   FT 2/2: MISS Victor Holiday makes 1/2 from the line. Rebound secured by LeBron Russell.
Score: 102-72

[02:35] Team_027 possession (Score: 102-72)
CJ Green attempts a 3Pt. Contested by Franz Doncic (4.1 feet, MAN). CJ Green misses. Rebound secured by Miles Siakam.

[02:15] Team_020 possession (Score: 102-72)
Miles Siakam attempts a Midrange. Contested by Ben Stewart (4.9 feet, MAN). Miles Siakam misses. Rebound secured by Dirk Lillard.

[02:02] Team_027 possession (Score: 102-72)
LeBron Russell makes the Layup and draws the foul on Miles Siakam! And-1! LeBron Russell to the line for 1. [BONUS: 5 team fouls] (Miles Siakam: 1 personal fouls)   FT 1/1: MISS LeBron Russell makes 0/1 from the line. Rebound secured by Miles Siakam.
Score: 102-74

[01:45] Team_020 possession (Score: 102-74)
Cole Barnes drives, picks up LeBron Russell. Help arrives from Dirk Lillard! Cole Barnes attempts a Layup. Contested by Dirk Lillard (5.5 feet, MAN). Cole Barnes misses. Rebound secured by Dirk Lillard.

[01:31] Team_027 possession (Score: 102-74)
Rudy Quickley attempts a 3Pt. Contested by Victor Holiday (4.7 feet, MAN). RUDY QUICKLEY MAKES IT! Assist: CJ Green
Score: 102-77

[01:20] Team_020 possession (Score: 102-77)
Victor Holiday attempts a 3Pt. Contested by Rudy Quickley (3.8 feet, ZONE). Victor Holiday misses. Rebound secured by Ben Stewart.

[01:04] Team_027 possession (Score: 102-77)
CJ Green drives, picks up Miles Siakam. Help arrives from Franz Doncic! CJ Green attempts a Dunk. Contested by Franz Doncic (4.1 feet, ZONE). CJ Green misses. Rebound secured by Cole Barnes.

[00:51] Team_020 possession (Score: 102-77)
Victor Holiday attempts a 3Pt. Contested by Rudy Quickley (3.8 feet, ZONE). Victor Holiday misses. Offensive rebound by Miles Siakam! Miles Siakam kicks it out.

[00:42] Team_020 possession (Score: 102-77)
FOUL! Shooting foul on Ben Stewart. Stephen Parker to the line for 2 free throws. [BONUS: 13 team fouls] (Ben Stewart: 1 personal fouls)   FT 1/2: GOOD   FT 2/2: MISS Stephen Parker makes 1/2 from the line. Rebound secured by Ben Stewart.
Score: 103-77

[00:26] Team_027 possession (Score: 103-77)
Ben Stewart drives to the basket... Ben Stewart loses control! Ball rolls out of bounds! TURNOVER! (dead ball)

[00:07] Team_020 possession (Score: 103-77)
Franz Doncic attempts a 3Pt. Contested by CJ Green (4.7 feet, MAN). FRANZ DONCIC MAKES IT! Assist: Cole Barnes
Score: 106-77

================================================================================
                              4TH QUARTER COMPLETE                              
================================================================================

4TH QUARTER SCORE: Team_020 29, Team_027 15

BOX SCORE:
================================================================================

Team_020
--------------------------------------------------------------------------------
Player                MIN  PTS  REB  AST  TO      FG   FG%      3P   3P%
--------------------------------------------------------------------------------
Terry Simons           33    5    2    0   0   2/2   100.0     0/0   0.0
Bam Leonard            33    5    5    0   0   3/4    75.0     0/0   0.0
Trae Curry             33    5    3    1   0   2/3    66.7     0/0   0.0
James Cunningham       33    3    0    0   0   1/2    50.0     0/0   0.0
Franz Doncic           16    3    0    0   0   1/1   100.0     0/0   0.0
Jarrett McCollum       33    2    0    1   0   1/2    50.0     0/0   0.0
Miles Siakam           16    0    5    0   0   0/1     0.0     0/0   0.0
Cole Barnes            16    0    2    1   0   0/2     0.0     0/0   0.0
Victor Holiday         16    0    0    0   0   0/1     0.0     0/0   0.0
Stephen Parker         16    0    0    0   0   0/1     0.0     0/0   0.0

TEAM: FG: 10/20 (50.0%), 3PT: 3/5 (60.0%), REB: 18 (7 off, 11 def), AST: 3, TO: 1
TEAM FOULS: 5 [Team_027 in BONUS]


Team_027
--------------------------------------------------------------------------------
Player                MIN  PTS  REB  AST  TO      FG   FG%      3P   3P%
--------------------------------------------------------------------------------
Bradley Dosunmu        33    5    1    0   0   2/5    40.0     0/0   0.0
Scottie Harden         33    3    0    0   0   1/2    50.0     0/0   0.0
Rudy Quickley          16    3    0    0   0   1/2    50.0     0/0   0.0
Tim Johnson            33    2    0    1   0   1/3    33.3     0/0   0.0
John Russell           33    0    3    1   0   0/0     0.0     0/0   0.0
Tony Doncic            33    0    1    1   0   0/1     0.0     0/0   0.0
Ben Stewart            16    0    3    0   0   0/0     0.0     0/0   0.0
LeBron Russell         16    0    1    0   0   0/1     0.0     0/0   0.0
CJ Green               16    0    0    1   0   0/2     0.0     0/0   0.0
Dirk Lillard           16    0    2    0   0   0/0     0.0     0/0   0.0

TEAM: FG: 5/16 (31.2%), 3PT: 3/8 (37.5%), REB: 10 (1 off, 9 def), AST: 4, TO: 4
TEAM FOULS: 13 [Team_020 in BONUS]

================================================================================

================================================================================
                               FULL GAME COMPLETE                               
================================================================================

FINAL SCORE: Team_020 106, Team_027 77

SCORING BY QUARTER:
--------------------------------------------------------------------------------
Team                     Q1     Q2     Q3     Q4    FINAL
--------------------------------------------------------------------------------
Team_020                 33     24     20     29      106
Team_027                 23     33      6     15       77
--------------------------------------------------------------------------------

FULL GAME BOX SCORE:
================================================================================

Team_020
--------------------------------------------------------------------------------
Player                MIN  PTS  REB  AST  TO      FG   FG%      3P   3P%      FT STL BLK
--------------------------------------------------------------------------------
Jarrett McCollum       33    8    0    3   3   4/10   40.0   2/4    50.0   6/10    1   1
James Cunningham       33   10    0    1   1   6/12   50.0   5/11   45.5   1/1     1   0
Terry Simons           33   17    7    0   1   9/12   75.0   2/4    50.0   4/4     0   0
Bam Leonard            33   14   16    4   1   6/12   50.0   1/3    33.3  11/19    2   3
Trae Curry             33   19   15    2   1   5/7    71.4   0/0     0.0  10/12    1   2
Franz Doncic           16    5    0    1   0   2/5    40.0   1/3    33.3   0/0     0   0
Stephen Parker         16    4    0    1   0   2/6    33.3   0/1     0.0   1/4     0   0
Victor Holiday         16    6    1    0   0   2/5    40.0   1/3    33.3   2/3     0   0
Cole Barnes            16    9    8    1   0   4/10   40.0   0/0     0.0   2/3     0   1
Miles Siakam           16    2    8    2   0   1/3    33.3   0/0     0.0   2/2     1   0

TEAM: FG: 42/84 (50.0%), 3PT: 12/29 (41.4%), REB: 57 (11 off, 46 def), AST: 15, TO: 7


Team_027
--------------------------------------------------------------------------------
Player                MIN  PTS  REB  AST  TO      FG   FG%      3P   3P%      FT STL BLK
--------------------------------------------------------------------------------
Tim Johnson            33    7    0    1   2   3/9    33.3   1/4    25.0   0/0     1   0
Tony Doncic            33   11    6    1   2   5/10   50.0   1/3    33.3   1/2     0   0
Scottie Harden         33    3    0    1   1   1/11    9.1   1/5    20.0   0/0     0   0
Bradley Dosunmu        33    8   16    2   2   4/12   33.3   1/2    50.0   4/4     1   0
John Russell           33    9   11    4   1   3/8    37.5   1/3    33.3   5/6     1   0
CJ Green               16    3    0    2   0   2/6    33.3   1/2    50.0   1/2     0   0
Dirk Lillard           16    6    7    0   1   2/5    40.0   2/4    50.0   3/4     0   1
Rudy Quickley          16    9    0    1   0   4/5    80.0   1/1   100.0   4/4     0   0
LeBron Russell         16   10    4    3   2   4/8    50.0   3/5    60.0   2/4     0   0
Ben Stewart            16    5    9    0   0   1/3    33.3   1/1   100.0   0/0     0   0

TEAM: FG: 29/77 (37.7%), 3PT: 13/30 (43.3%), REB: 51 (13 off, 38 def), AST: 15, TO: 11

================================================================================
