================================================================================
                        FULL GAME - Team_092 vs Team_060                        
================================================================================

================================================================================
                       1ST QUARTER - Team_092 vs Team_060                       
================================================================================

[12:00] Team_092 possession (Score: 0-0)
Paul James attempts a Midrange. Contested by Julius Green (4.4 feet, ZONE). PAUL JAMES MAKES IT! Assist: John Giddey
Score: 2-0

[11:45] Team_060 possession (Score: 2-0)
Joel Morant attempts a Midrange. Contested by Austin Bridges (4.1 feet, MAN). JOEL MORANT MAKES IT!
Score: 2-2

[11:34] Team_092 possession (Score: 2-2)
John Giddey attempts a 3Pt. Contested by Julius Green (4.0 feet, ZONE). JOHN GIDDEY MAKES IT! Assist: Karl Gobert
Score: 5-2

[11:18] Team_060 possession (Score: 5-2)
Larry Westbrook drives, John Giddey stays with him. Larry Westbrook attempts a Layup. Contested by John Giddey (4.5 feet, MAN). Larry Westbrook misses. FOUL! Loose ball foul on John Giddey during the rebound battle. [Team fouls: 1] No free throws, side out. (John Giddey: 1 personal fouls)

[11:05] Team_060 possession (Score: 5-2)
Joel Morant attempts a 3Pt. Contested by Austin Bridges (4.1 feet, MAN). JOEL MORANT MAKES IT! Assist: Jaren George
Score: 5-5

[10:52] Team_092 possession (Score: 5-5)
FOUL! Shooting foul on Joel Morant. Austin Bridges to the line for 2 free throws. [Team fouls: 1] (Joel Morant: 1 personal fouls)   FT 1/2: GOOD   FT 2/2: GOOD Austin Bridges makes 2/2 from the line.
Score: 7-5

[10:40] Team_060 possession (Score: 7-5)
Julius Green attempts a 3Pt. Contested by Karl Gobert (4.8 feet, MAN). JULIUS GREEN MAKES IT! Assist: Immanuel Ming
Score: 7-8

[10:22] Team_092 possession (Score: 7-8)
John Giddey attempts a Midrange. Contested by Larry Westbrook (4.9 feet, MAN). John Giddey misses. Rebound secured by Jaren George.

[10:02] Team_060 possession (Score: 7-8)
Immanuel Ming attempts a 3Pt. Contested by Paul James (4.7 feet, MAN). Immanuel Ming misses. Rebound secured by Immanuel Ingram.

[09:43] Team_092 possession (Score: 7-8)
Immanuel Ingram attempts a Layup. Contested by Jaren George (5.0 feet, ZONE). Immanuel Ingram misses. Rebound secured by Jaren George.

[09:28] Team_060 possession (Score: 7-8)
Julius Green attempts a 3Pt. BLOCKED BY KARL GOBERT! Ball is loose! Rebound secured by Immanuel Ingram.

[09:16] Team_092 possession (Score: 7-8)
FOUL! Shooting foul on Jaren George. Immanuel Ingram to the line for 2 free throws. [Team fouls: 2] (Jaren George: 1 personal fouls)   FT 1/2: GOOD   FT 2/2: GOOD Immanuel Ingram makes 2/2 from the line.
Score: 9-8

[09:02] Team_060 possession (Score: 9-8)
Immanuel Ming attempts a 3Pt. Contested by Paul James (4.7 feet, MAN). Immanuel Ming misses. Rebound secured by John Giddey.

[08:43] Team_092 possession (Score: 9-8)
Karl Gobert attempts a 3Pt. Contested by Julius Green (3.6 feet, ZONE). KARL GOBERT MAKES IT! Assist: Austin Bridges
Score: 12-8

[08:24] Team_060 possession (Score: 12-8)
Immanuel Ming attempts a 3Pt. BLOCKED BY JOHN GIDDEY! Ball is loose! Rebound secured by John Giddey.

[08:12] Team_092 possession (Score: 12-8)
John Giddey attempts a 3Pt. Contested by Larry Westbrook (4.9 feet, MAN). John Giddey misses. Offensive rebound by Paul James! Paul James kicks it out.

[07:56] Team_092 possession (Score: 12-8)
Immanuel Ingram attempts a Layup. Contested by Jaren George (5.0 feet, MAN). IMMANUEL INGRAM MAKES IT!
Score: 14-8

[07:42] Team_060 possession (Score: 14-8)
Joel Morant attempts a Layup. Contested by Austin Bridges (4.1 feet, MAN). Joel Morant misses. Rebound secured by John Giddey.

[07:29] Team_092 possession (Score: 14-8)
Immanuel Ingram attempts a Layup. Contested by Jaren George (5.0 feet, MAN). IMMANUEL INGRAM MAKES IT! Assist: Karl Gobert
Score: 16-8

[07:12] Team_060 possession (Score: 16-8)
Julius Green attempts a 3Pt. Contested by Paul James (4.6 feet, ZONE). JULIUS GREEN MAKES IT! Assist: Larry Westbrook
Score: 16-11

[06:59] Team_092 possession (Score: 16-11)
Immanuel Ingram attempts a Layup. Contested by Jaren George (5.0 feet, ZONE). IMMANUEL INGRAM MAKES IT!
Score: 18-11

[06:41] Team_060 possession (Score: 18-11)
Jaren George drives, John Giddey stays with him. Jaren George attempts a Layup. Contested by John Giddey (4.2 feet, ZONE). Jaren George misses. Rebound secured by Immanuel Ingram.

[06:27] Team_092 possession (Score: 18-11)
Immanuel Ingram drives, picks up Larry Westbrook. Help arrives from Julius Green! Immanuel Ingram attempts a Layup. Contested by Julius Green (4.5 feet, ZONE). IMMANUEL INGRAM MAKES IT!
Score: 20-11

[06:10] Team_060 possession (Score: 20-11)
Joel Morant attempts a 3Pt. Contested by John Giddey (3.7 feet, ZONE). Joel Morant misses. Rebound secured by Immanuel Ingram.

[05:56] Team_092 possession (Score: 20-11)
Paul James attempts a Midrange. Contested by Immanuel Ming (4.3 feet, MAN). Paul James misses. Rebound secured by Immanuel Ming.

[05:42] Team_060 possession (Score: 20-11)
Jaren George makes the Layup and draws the foul on Austin Bridges! And-1! Jaren George to the line for 1. [Team fouls: 2] (Austin Bridges: 1 personal fouls)   FT 1/1: GOOD Jaren George makes 1/1 from the line.
Score: 20-14

[05:29] Team_092 possession (Score: 20-14)
Karl Gobert attempts a Midrange. Contested by Larry Westbrook (4.5 feet, ZONE). Karl Gobert misses. Offensive rebound by John Giddey! John Giddey kicks it out.

[05:12] Team_092 possession (Score: 20-14)
Paul James commits a violation (traveling/carry)! TURNOVER! (dead ball)

[04:56] Team_060 possession (Score: 20-14)
FOUL! Holding foul on Immanuel Ingram. [Team fouls: 3] No free throws, side out. (Immanuel Ingram: 1 personal fouls)

[04:40] Team_060 possession (Score: 20-14)
Joel Morant attempts a 3Pt. Contested by John Giddey (3.8 feet, ZONE). Joel Morant misses. Offensive rebound by Jaren George! Jaren George puts it back in!
Score: 20-16

[04:26] Team_092 possession (Score: 20-16)
FOUL! Shooting foul on Julius Green. John Giddey to the line for 3 free throws. [Team fouls: 3] (Julius Green: 1 personal fouls)   FT 1/3: GOOD   FT 2/3: GOOD   FT 3/3: GOOD John Giddey makes 3/3 from the line.
Score: 23-16

[04:16] Team_060 possession (Score: 23-16)
Immanuel Ming drives, John Giddey stays with him. Immanuel Ming attempts a Dunk. Contested by John Giddey (4.1 feet, ZONE). IMMANUEL MING MAKES IT! Assist: Larry Westbrook
Score: 23-18

[04:02] Team_092 possession (Score: 23-18)
Karl Gobert drives to the basket... Karl Gobert loses control! Ball rolls out of bounds! TURNOVER! (dead ball)

[03:48] Team_060 possession (Score: 23-18)
Joel Morant attempts a 3Pt. Contested by John Giddey (3.9 feet, ZONE). Joel Morant misses. Offensive rebound by Jaren George! Jaren George puts it back in!
Score: 23-20

[03:35] Team_092 possession (Score: 23-20)
Immanuel Ingram drives, picks up Jaren George. Help arrives from Julius Green! Immanuel Ingram attempts a Layup. Contested by Julius Green (5.2 feet, MAN). IMMANUEL INGRAM MAKES IT! Assist: John Giddey
Score: 25-20

[03:23] Team_060 possession (Score: 25-20)
Immanuel Ming attempts a Midrange. Contested by Paul James (4.8 feet, MAN). IMMANUEL MING MAKES IT! Assist: Julius Green
Score: 25-22

[03:07] Team_092 possession (Score: 25-22)
Austin Bridges attempts a 3Pt. Contested by Julius Green (3.7 feet, ZONE). AUSTIN BRIDGES MAKES IT! Assist: Immanuel Ingram
Score: 28-22

[02:55] Team_060 possession (Score: 28-22)
Jaren George drives, John Giddey stays with him. Jaren George attempts a Layup. Contested by John Giddey (4.4 feet, ZONE). JAREN GEORGE MAKES IT! Assist: Larry Westbrook
Score: 28-24

[02:45] Team_092 possession (Score: 28-24)
FOUL! Reach-in foul on Jaren George during the drive. [Team fouls: 4] No free throws, side out. (Jaren George: 2 personal fouls)

[02:31] Team_092 possession (Score: 28-24)
Paul James throws a bad pass! Stolen by Immanuel Ming! TURNOVER! (live ball)

[02:18] Team_060 possession (Score: 28-24)
Jaren George attempts a 3Pt. Contested by John Giddey (4.5 feet, ZONE). JAREN GEORGE MAKES IT! Assist: Joel Morant
Score: 28-27

[02:02] Team_092 possession (Score: 28-27)
Karl Gobert attempts a Layup. BLOCKED BY LARRY WESTBROOK! Ball is loose! Offensive rebound by Paul James! Paul James kicks it out.

[01:50] Team_092 possession (Score: 28-27)
FOUL! Offensive foul on Paul James! Immanuel Ming drew the charge! [Team fouls: 4] (Paul James: 1 personal fouls) TURNOVER! (dead ball)

[01:41] Team_060 possession (Score: 28-27)
Jaren George drives, Immanuel Ingram stays with him. Jaren George attempts a Dunk. Contested by Immanuel Ingram (4.4 feet, MAN). JAREN GEORGE MAKES IT! Assist: Julius Green
Score: 28-29

[01:25] Team_092 possession (Score: 28-29)
Immanuel Ingram drives, Jaren George stays with him. Immanuel Ingram attempts a Layup. Contested by Jaren George (5.5 feet, ZONE). IMMANUEL INGRAM MAKES IT! Assist: Paul James
Score: 30-29

[01:12] Team_060 possession (Score: 30-29)
FOUL! Holding foul on Karl Gobert. [IN THE BONUS! 5 team fouls] Julius Green to the line for 2 free throws. (Karl Gobert: 1 personal fouls)   FT 1/2: GOOD   FT 2/2: MISS Julius Green makes 1/2 from the line. Rebound secured by Immanuel Ingram.
Score: 30-30

[01:01] Team_092 possession (Score: 30-30)
John Giddey attempts a Midrange. Contested by Julius Green (4.4 feet, ZONE). John Giddey misses. Rebound secured by Immanuel Ming.

[00:46] Team_060 possession (Score: 30-30)
Julius Green attempts a 3Pt. Contested by Karl Gobert (5.3 feet, MAN). Julius Green misses. Offensive rebound by Jaren George! Jaren George puts it back in!
Score: 30-32

[00:32] Team_092 possession (Score: 30-32)
Paul James attempts a Midrange. Contested by Immanuel Ming (4.7 feet, MAN). PAUL JAMES MAKES IT! Assist: Karl Gobert
Score: 32-32

[00:14] Team_060 possession (Score: 32-32)
Joel Morant attempts a Midrange. Contested by Austin Bridges (4.7 feet, MAN). JOEL MORANT MAKES IT! Assist: Larry Westbrook
Score: 32-34

[00:04] Team_092 possession (Score: 32-34)
Karl Gobert attempts a 3Pt. Contested by Julius Green (4.2 feet, ZONE). Karl Gobert misses. FOUL! Loose ball foul on Larry Westbrook during the rebound battle. [IN THE BONUS! 5 team fouls] John Giddey to the line for 2 free throws. (Larry Westbrook: 1 personal fouls)   FT 1/2: GOOD   FT 2/2: MISS John Giddey makes 1/2 from the line. Rebound secured by Immanuel Ming.
Score: 33-34

================================================================================
                              1ST QUARTER COMPLETE                              
================================================================================

1ST QUARTER SCORE: Team_092 33, Team_060 34

BOX SCORE:
================================================================================

Team_092
--------------------------------------------------------------------------------
Player                MIN  PTS  REB  AST  TO      FG   FG%      3P   3P%
--------------------------------------------------------------------------------
Immanuel Ingram        12   14    5    1   0   7/8    87.5     0/0   0.0
John Giddey            12    6    4    2   0   2/4    50.0     0/0   0.0
Austin Bridges         12    5    0    1   0   2/2   100.0     0/0   0.0
Paul James             12    4    2    1   0   2/3    66.7     0/0   0.0
Immanuel Ming          12    4    3    1   0   2/5    40.0     0/0   0.0
Karl Gobert            12    3    0    3   0   1/2    50.0     0/0   0.0

TEAM: FG: 14/19 (73.7%), 3PT: 4/5 (80.0%), REB: 12 (4 off, 8 def), AST: 8, TO: 4
TEAM FOULS: 5 [Team_060 in BONUS]


Team_060
--------------------------------------------------------------------------------
Player                MIN  PTS  REB  AST  TO      FG   FG%      3P   3P%
--------------------------------------------------------------------------------
Jaren George           12   16    6    1   0   7/8    87.5     0/0   0.0
Joel Morant            12    7    0    1   0   3/5    60.0     0/0   0.0
Julius Green           12    6    0    2   0   2/3    66.7     0/0   0.0
Larry Westbrook        12    0    0    4   0   0/0     0.0     0/0   0.0

TEAM: FG: 14/22 (63.6%), 3PT: 7/12 (58.3%), REB: 8 (4 off, 4 def), AST: 9, TO: 0
TEAM FOULS: 5 [Team_092 in BONUS]

================================================================================

================================================================================
                       2ND QUARTER - Team_092 vs Team_060                       
================================================================================

[12:00] Team_092 possession (Score: 33-34)
Austin Bridges attempts a 3Pt. Contested by Joel Morant (5.4 feet, MAN). Austin Bridges misses. Rebound secured by Immanuel Ming.

[11:46] Team_060 possession (Score: 33-34)
Julius Green drives, picks up Karl Gobert. Help arrives from Paul James! Julius Green attempts a Layup. Contested by Paul James (5.2 feet, MAN). Julius Green misses. Rebound secured by Paul James.

[11:28] Team_092 possession (Score: 33-34)
John Giddey makes the Layup and draws the foul on Larry Westbrook! And-1! John Giddey to the line for 1. [Team fouls: 1] (Larry Westbrook: 1 personal fouls)   FT 1/1: GOOD John Giddey makes 1/1 from the line.
Score: 36-34

[11:13] Team_060 possession (Score: 36-34)
Jaren George makes the Layup and draws the foul on John Giddey! And-1! Jaren George to the line for 1. [Team fouls: 1] (John Giddey: 1 personal fouls)   FT 1/1: GOOD Jaren George makes 1/1 from the line.
Score: 36-37

[10:58] Team_092 possession (Score: 36-37)
FOUL! Reach-in foul on Immanuel Ming during the drive. [Team fouls: 2] No free throws, side out. (Immanuel Ming: 1 personal fouls)

[10:44] Team_092 possession (Score: 36-37)
Paul James drives to the basket... Paul James throws a bad pass out of bounds! TURNOVER! (dead ball)

[10:44] Substitution (Team_092): Austin Bridges OUT → Bones Giddey IN (stamina_rule2)

[10:44] Substitution (Team_092): Karl Gobert OUT → Shaquille Russell IN (stamina_rule2)

[10:44] Substitution (Team_092): Paul James OUT → Vince Harris IN (stamina_rule2)

[10:44] Substitution (Team_092): John Giddey OUT → Shaquille Paul IN (stamina_rule2)

[10:44] Substitution (Team_092): Immanuel Ingram OUT → Pau Reaves IN (stamina_rule2)

[10:44] Substitution (Team_060): Joel Morant OUT → Domantas Barnes IN (stamina_rule2)

[10:44] Substitution (Team_060): Julius Green OUT → Rudy Ginobili IN (stamina_rule2)

[10:44] Substitution (Team_060): Immanuel Ming OUT → Jarrett Wagner IN (stamina_rule2)

[10:44] Substitution (Team_060): Larry Westbrook OUT → Yao Tatum IN (stamina_rule2)

[10:44] Substitution (Team_060): Jaren George OUT → Klay Haliburton IN (stamina_rule2)

[10:32] Team_060 possession (Score: 36-37)
Yao Tatum drives, Shaquille Paul stays with him. Yao Tatum attempts a Dunk. Contested by Shaquille Paul (5.6 feet, MAN). Yao Tatum misses. Rebound secured by Shaquille Russell.

[10:19] Team_092 possession (Score: 36-37)
Vince Harris attempts a Layup. Contested by Jarrett Wagner (4.9 feet, MAN). Vince Harris misses. Rebound secured by Rudy Ginobili.

[10:01] Team_060 possession (Score: 36-37)
Yao Tatum attempts a Midrange. Contested by Shaquille Paul (5.6 feet, MAN). Yao Tatum misses. Offensive rebound by Domantas Barnes! Domantas Barnes kicks it out.

[09:48] Team_060 possession (Score: 36-37)
Yao Tatum attempts a 3Pt. Contested by Shaquille Paul (5.6 feet, MAN). Yao Tatum misses. Offensive rebound by Domantas Barnes! Domantas Barnes kicks it out.

[09:30] Team_060 possession (Score: 36-37)
Rudy Ginobili attempts a 3Pt. Contested by Vince Harris (4.4 feet, ZONE). Rudy Ginobili misses. Offensive rebound by Klay Haliburton! Klay Haliburton puts it back in!
Score: 36-39

[09:17] Team_092 possession (Score: 36-39)
Vince Harris attempts a 3Pt. Contested by Domantas Barnes (4.6 feet, ZONE). Vince Harris misses. Offensive rebound by Pau Reaves! Pau Reaves kicks it out.

[09:03] Team_092 possession (Score: 36-39)
Pau Reaves drives, Klay Haliburton stays with him. Pau Reaves attempts a Dunk. Contested by Klay Haliburton (4.5 feet, ZONE). PAU REAVES MAKES IT! Assist: Vince Harris
Score: 38-39

[08:51] Team_060 possession (Score: 38-39)
Jarrett Wagner attempts a 3Pt. Contested by Shaquille Paul (5.7 feet, ZONE). Jarrett Wagner misses. Rebound secured by Shaquille Paul.

[08:36] Team_092 possession (Score: 38-39)
Shaquille Russell attempts a Layup. BLOCKED BY RUDY GINOBILI! Ball deflects out of bounds off Shaquille Russell.

[08:20] Team_060 possession (Score: 38-39)
Klay Haliburton attempts a Layup. Contested by Pau Reaves (5.1 feet, MAN). Klay Haliburton misses. Rebound secured by Pau Reaves.

[08:03] Team_092 possession (Score: 38-39)
Pau Reaves drives, Klay Haliburton stays with him. Pau Reaves attempts a Layup. Contested by Klay Haliburton (4.5 feet, MAN). Pau Reaves misses. Rebound secured by Rudy Ginobili.

[07:49] Team_060 possession (Score: 38-39)
Jarrett Wagner drives and kicks out. Klay Haliburton attempts a Midrange. Contested by Pau Reaves (4.8 feet, MAN). Klay Haliburton misses. Rebound secured by Shaquille Paul.

[07:36] Team_092 possession (Score: 38-39)
Bones Giddey throws a bad pass out of bounds! TURNOVER! (dead ball)

[07:23] Team_060 possession (Score: 38-39)
FOUL! Reach-in foul on Pau Reaves during the drive. [Team fouls: 2] No free throws, side out. (Pau Reaves: 1 personal fouls)

[07:10] Team_060 possession (Score: 38-39)
Yao Tatum drives, Shaquille Paul stays with him. Yao Tatum attempts a Layup. Contested by Shaquille Paul (5.6 feet, ZONE). YAO TATUM MAKES IT! Assist: Rudy Ginobili
Score: 38-41

[06:56] Team_092 possession (Score: 38-41)
FOUL! Shooting foul on Klay Haliburton. Vince Harris to the line for 2 free throws. [Team fouls: 3] (Klay Haliburton: 1 personal fouls)   FT 1/2: MISS   FT 2/2: GOOD Vince Harris makes 1/2 from the line.
Score: 39-41

[06:41] Team_060 possession (Score: 39-41)
Klay Haliburton loses the ball! Stripped by Pau Reaves! TURNOVER! (live ball)

[06:26] Team_092 possession (Score: 39-41)
Vince Harris attempts a 3Pt. Contested by Jarrett Wagner (4.9 feet, MAN). Vince Harris misses. Offensive rebound by Pau Reaves! Pau Reaves kicks it out.

[06:16] Team_092 possession (Score: 39-41)
Shaquille Paul attempts a Midrange. Contested by Jarrett Wagner (5.4 feet, ZONE). SHAQUILLE PAUL MAKES IT! Assist: Bones Giddey
Score: 41-41

[05:59] Team_060 possession (Score: 41-41)
Rudy Ginobili drives, Pau Reaves stays with him. Rudy Ginobili attempts a Layup. Contested by Pau Reaves (5.1 feet, ZONE). RUDY GINOBILI MAKES IT! Assist: Yao Tatum
Score: 41-43

[05:46] Team_092 possession (Score: 41-43)
Shaquille Russell drives and kicks out. Shaquille Paul attempts a Midrange. Contested by Yao Tatum (5.2 feet, MAN). Shaquille Paul misses. Rebound secured by Rudy Ginobili.

[05:31] Team_060 possession (Score: 41-43)
Klay Haliburton drives and kicks out. Domantas Barnes attempts a Midrange. Contested by Bones Giddey (5.2 feet, MAN). Domantas Barnes misses. Offensive rebound by Klay Haliburton! Klay Haliburton's putback is no good. Offensive rebound by Klay Haliburton! Klay Haliburton kicks it out.

[05:20] Team_060 possession (Score: 41-43)
Domantas Barnes drives to the basket... Domantas Barnes throws a bad pass! Stolen by Pau Reaves! TURNOVER! (live ball)

[05:04] Team_092 possession (Score: 41-43)
Pau Reaves attempts a 3Pt. Contested by Rudy Ginobili (4.6 feet, ZONE). Pau Reaves misses. Rebound secured by Rudy Ginobili.

[04:52] Team_060 possession (Score: 41-43)
Rudy Ginobili attempts a 3Pt. Contested by Shaquille Russell (4.5 feet, MAN). RUDY GINOBILI MAKES IT!
Score: 41-46

[04:40] Team_092 possession (Score: 41-46)
Vince Harris makes the Dunk and draws the foul on Domantas Barnes! And-1! Vince Harris to the line for 1. [Team fouls: 4] (Domantas Barnes: 1 personal fouls)   FT 1/1: GOOD Vince Harris makes 1/1 from the line.
Score: 44-46

[04:23] Team_060 possession (Score: 44-46)
Yao Tatum attempts a 3Pt. Contested by Shaquille Russell (4.2 feet, ZONE). Yao Tatum misses. Offensive rebound by Domantas Barnes! Domantas Barnes kicks it out.

[04:10] Team_060 possession (Score: 44-46)
Rudy Ginobili attempts a Midrange. Contested by Vince Harris (4.4 feet, ZONE). Rudy Ginobili misses. Rebound secured by Shaquille Russell.

[03:55] Team_092 possession (Score: 44-46)
Vince Harris attempts a 3Pt. Contested by Domantas Barnes (4.6 feet, ZONE). Vince Harris misses. Offensive rebound by Pau Reaves! Pau Reaves kicks it out.

[03:40] Team_092 possession (Score: 44-46)
Shaquille Paul attempts a 3Pt. Contested by Domantas Barnes (5.2 feet, ZONE). SHAQUILLE PAUL MAKES IT! Assist: Vince Harris
Score: 47-46

[03:29] Team_060 possession (Score: 47-46)
Rudy Ginobili attempts a 3Pt. Contested by Vince Harris (4.4 feet, ZONE). Rudy Ginobili misses. Offensive rebound by Domantas Barnes! Domantas Barnes kicks it out.

[03:15] Team_060 possession (Score: 47-46)
Domantas Barnes makes the Layup and draws the foul on Bones Giddey! And-1! Domantas Barnes to the line for 1. [Team fouls: 3] (Bones Giddey: 1 personal fouls)   FT 1/1: GOOD Domantas Barnes makes 1/1 from the line.
Score: 47-49

[03:01] Team_092 possession (Score: 47-49)
Shaquille Russell makes the Layup and draws the foul on Rudy Ginobili! And-1! Shaquille Russell to the line for 1. [BONUS: 5 team fouls] (Rudy Ginobili: 1 personal fouls)   FT 1/1: GOOD Shaquille Russell makes 1/1 from the line.
Score: 50-49

[02:50] Team_060 possession (Score: 50-49)
Yao Tatum attempts a Midrange. Contested by Shaquille Paul (5.7 feet, ZONE). YAO TATUM MAKES IT! Assist: Klay Haliburton
Score: 50-51

[02:37] Team_092 possession (Score: 50-51)
Bones Giddey attempts a 3Pt. Contested by Domantas Barnes (4.3 feet, ZONE). BONES GIDDEY MAKES IT! Assist: Shaquille Russell
Score: 53-51

[02:17] Team_060 possession (Score: 53-51)
Yao Tatum attempts a Midrange. Contested by Vince Harris (4.3 feet, ZONE). Yao Tatum misses. FOUL! Loose ball foul on Shaquille Paul during the rebound battle. [Team fouls: 4] No free throws, side out. (Shaquille Paul: 1 personal fouls)

[02:01] Team_060 possession (Score: 53-51)
Jarrett Wagner attempts a 3Pt. Contested by Vince Harris (4.4 feet, MAN). Jarrett Wagner misses. Rebound secured by Pau Reaves.

[01:42] Team_092 possession (Score: 53-51)
Bones Giddey attempts a 3Pt. Contested by Domantas Barnes (4.4 feet, MAN). Bones Giddey misses. Rebound secured by Klay Haliburton.

[01:29] Team_060 possession (Score: 53-51)
Rudy Ginobili attempts a 3Pt. Contested by Vince Harris (4.6 feet, ZONE). RUDY GINOBILI MAKES IT! Assist: Klay Haliburton
Score: 53-54

[01:18] Team_092 possession (Score: 53-54)
Shaquille Paul loses the ball! Stripped by Yao Tatum! TURNOVER! (live ball)

[01:03] Team_060 possession (Score: 53-54)
FOUL! Holding foul on Bones Giddey. [IN THE BONUS! 5 team fouls] Domantas Barnes to the line for 2 free throws. (Bones Giddey: 2 personal fouls)   FT 1/2: MISS   FT 2/2: GOOD Domantas Barnes makes 1/2 from the line.
Score: 53-55

[00:51] Team_092 possession (Score: 53-55)
Pau Reaves attempts a 3Pt. Contested by Klay Haliburton (4.8 feet, MAN). Pau Reaves misses. Rebound secured by Rudy Ginobili.

[00:40] Team_060 possession (Score: 53-55)
Yao Tatum attempts a 3Pt. Contested by Shaquille Russell (4.6 feet, ZONE). Yao Tatum misses. Rebound secured by Vince Harris.

[00:26] Team_092 possession (Score: 53-55)
Bones Giddey attempts a 3Pt. Contested by Domantas Barnes (4.5 feet, ZONE). Bones Giddey misses. Rebound secured by Klay Haliburton.

[00:10] Team_060 possession (Score: 53-55)
Rudy Ginobili attempts a 3Pt. Contested by Vince Harris (4.8 feet, ZONE). Rudy Ginobili misses. FOUL! Loose ball foul on Shaquille Paul during the rebound battle. [IN THE BONUS! 6 team fouls] Klay Haliburton to the line for 2 free throws. (Shaquille Paul: 2 personal fouls)   FT 1/2: MISS   FT 2/2: MISS Klay Haliburton makes 0/2 from the line. Rebound secured by Pau Reaves.

================================================================================
                              2ND QUARTER COMPLETE                              
================================================================================

2ND QUARTER SCORE: Team_092 20, Team_060 21

BOX SCORE:
================================================================================

Team_092
--------------------------------------------------------------------------------
Player                MIN  PTS  REB  AST  TO      FG   FG%      3P   3P%
--------------------------------------------------------------------------------
Shaquille Paul         11    5    2    0   0   2/2   100.0     0/0   0.0
Vince Harris           11    4    1    2   0   2/3    66.7     0/0   0.0
John Giddey            14    3    0    0   0   1/1   100.0     0/0   0.0
Shaquille Russell      11    3    2    1   0   1/3    33.3     0/0   0.0
Bones Giddey           11    3    0    1   0   1/3    33.3     0/0   0.0
Austin Bridges         14    0    0    0   0   0/1     0.0     0/0   0.0
Paul James             14    0    1    0   0   0/0     0.0     0/0   0.0

TEAM: FG: 8/17 (47.1%), 3PT: 2/7 (28.6%), REB: 11 (3 off, 8 def), AST: 4, TO: 3
TEAM FOULS: 6 [Team_060 in BONUS]


Team_060
--------------------------------------------------------------------------------
Player                MIN  PTS  REB  AST  TO      FG   FG%      3P   3P%
--------------------------------------------------------------------------------
Rudy Ginobili          11    8    5    1   0   3/5    60.0     0/0   0.0
Yao Tatum              11    4    0    1   0   2/4    50.0     0/0   0.0
Domantas Barnes        11    4    4    0   0   2/2   100.0     0/0   0.0
Jaren George           14    3    0    0   0   1/1   100.0     0/0   0.0
Klay Haliburton        11    2    5    2   0   1/2    50.0     0/0   0.0
Pau Reaves             11    2    6    0   0   1/4    25.0     0/0   0.0
Immanuel Ming          14    0    1    0   0   0/0     0.0     0/0   0.0
Julius Green           14    0    0    0   0   0/1     0.0     0/0   0.0
Jarrett Wagner         11    0    0    0   0   0/3     0.0     0/0   0.0

TEAM: FG: 9/18 (50.0%), 3PT: 3/7 (42.9%), REB: 16 (8 off, 8 def), AST: 4, TO: 2
TEAM FOULS: 5 [Team_092 in BONUS]

================================================================================

================================================================================
                       3RD QUARTER - Team_092 vs Team_060                       
================================================================================

[12:00] Team_092 possession (Score: 53-55)
Karl Gobert throws a bad pass! Stolen by Julius Green! TURNOVER! (live ball)

[11:48] Team_060 possession (Score: 53-55)
Immanuel Ming attempts a Layup. Contested by Paul James (4.7 feet, MAN). Immanuel Ming misses. Rebound secured by Immanuel Ingram.

[11:35] Team_092 possession (Score: 53-55)
Austin Bridges attempts a 3Pt. Contested by Joel Morant (5.0 feet, MAN). Austin Bridges misses. Rebound secured by Larry Westbrook.

[11:23] Team_060 possession (Score: 53-55)
Julius Green attempts a Midrange. Contested by Karl Gobert (4.8 feet, MAN). Julius Green misses. Offensive rebound by Immanuel Ming! Immanuel Ming kicks it out.

[11:10] Team_060 possession (Score: 53-55)
Julius Green attempts a 3Pt. Contested by Karl Gobert (4.8 feet, MAN). JULIUS GREEN MAKES IT! Assist: Joel Morant
Score: 53-58

[10:56] Team_092 possession (Score: 53-58)
Immanuel Ingram attempts a Midrange. Contested by Julius Green (3.6 feet, ZONE). IMMANUEL INGRAM MAKES IT! Assist: Austin Bridges
Score: 55-58

[10:44] Team_060 possession (Score: 55-58)
Joel Morant attempts a 3Pt. Contested by Austin Bridges (4.1 feet, MAN). JOEL MORANT MAKES IT! Assist: Immanuel Ming
Score: 55-61

[10:32] Team_092 possession (Score: 55-61)
Paul James attempts a 3Pt. Contested by Immanuel Ming (4.3 feet, MAN). Paul James misses. Offensive rebound by John Giddey! John Giddey kicks it out.

[10:19] Team_092 possession (Score: 55-61)
Karl Gobert attempts a Layup. Contested by Jaren George (5.1 feet, ZONE). KARL GOBERT MAKES IT!
Score: 57-61

[10:06] Team_060 possession (Score: 57-61)
Julius Green drives, picks up Karl Gobert. Help arrives from Paul James! Julius Green attempts a Layup. Contested by Paul James (4.8 feet, MAN). Julius Green misses. Offensive rebound by Immanuel Ming! Immanuel Ming kicks it out.

[09:53] Team_060 possession (Score: 57-61)
Jaren George attempts a Midrange. Contested by Immanuel Ingram (4.2 feet, MAN). Jaren George misses. Rebound secured by Paul James.

[09:39] Team_092 possession (Score: 57-61)
John Giddey drives and kicks out. Karl Gobert attempts a 3Pt. Contested by Julius Green (3.8 feet, ZONE). KARL GOBERT MAKES IT! Assist: Immanuel Ingram
Score: 60-61

[09:22] Team_060 possession (Score: 60-61)
Jaren George attempts a Midrange. Contested by John Giddey (4.2 feet, ZONE). Jaren George misses. Rebound secured by John Giddey.

[09:07] Team_092 possession (Score: 60-61)
Austin Bridges drives and kicks out. Austin Bridges attempts a Midrange. Contested by Joel Morant (5.2 feet, MAN). Austin Bridges misses. Rebound secured by Immanuel Ming.

[08:55] Team_060 possession (Score: 60-61)
Larry Westbrook attempts a Midrange. Contested by Karl Gobert (5.5 feet, ZONE). LARRY WESTBROOK MAKES IT! Assist: Joel Morant
Score: 60-63

[08:40] Team_092 possession (Score: 60-63)
Karl Gobert throws a bad pass out of bounds! TURNOVER! (dead ball)

[08:25] Team_060 possession (Score: 60-63)
FOUL! Shooting foul on John Giddey. Larry Westbrook to the line for 2 free throws. [Team fouls: 1] (John Giddey: 1 personal fouls)   FT 1/2: GOOD   FT 2/2: GOOD Larry Westbrook makes 2/2 from the line.
Score: 60-65

[08:09] Team_092 possession (Score: 60-65)
Paul James attempts a 3Pt. Contested by Immanuel Ming (4.3 feet, MAN). Paul James misses. FOUL! Loose ball foul on Jaren George during the rebound battle. [Team fouls: 1] No free throws, side out. (Jaren George: 1 personal fouls)

[07:59] Team_092 possession (Score: 60-65)
Immanuel Ingram drives to the basket... Immanuel Ingram throws a bad pass out of bounds! TURNOVER! (dead ball)

[07:45] Team_060 possession (Score: 60-65)
Julius Green attempts a Layup. Contested by John Giddey (3.8 feet, ZONE). Julius Green misses. Rebound secured by John Giddey.

[07:32] Team_092 possession (Score: 60-65)
FOUL! Offensive foul on Immanuel Ingram! Jaren George drew the charge! [Team fouls: 2] (Immanuel Ingram: 1 personal fouls) TURNOVER! (dead ball)

[07:18] Team_060 possession (Score: 60-65)
Larry Westbrook drives and kicks out. Julius Green attempts a 3Pt. Contested by Karl Gobert (5.0 feet, MAN). Julius Green misses. Rebound secured by Immanuel Ingram.

[07:02] Team_092 possession (Score: 60-65)
John Giddey attempts a Midrange. Contested by Larry Westbrook (4.9 feet, MAN). John Giddey misses. Rebound secured by Larry Westbrook.

[06:50] Team_060 possession (Score: 60-65)
Jaren George makes the Layup and draws the foul on Immanuel Ingram! And-1! Jaren George to the line for 1. [Team fouls: 3] (Immanuel Ingram: 2 personal fouls)   FT 1/1: GOOD Jaren George makes 1/1 from the line.
Score: 60-68

[06:36] Team_092 possession (Score: 60-68)
Karl Gobert makes the 3Pt and draws the foul on Larry Westbrook! And-1! Karl Gobert to the line for 1. [Team fouls: 2] (Larry Westbrook: 1 personal fouls)   FT 1/1: GOOD Karl Gobert makes 1/1 from the line.
Score: 64-68

[06:26] Team_060 possession (Score: 64-68)
Jaren George attempts a 3Pt. Contested by John Giddey (4.2 feet, ZONE). JAREN GEORGE MAKES IT! Assist: Immanuel Ming
Score: 64-71

[06:13] Team_092 possession (Score: 64-71)
Immanuel Ingram attempts a Midrange. Contested by Immanuel Ming (3.5 feet, ZONE). Immanuel Ingram misses. Offensive rebound by Paul James! Paul James kicks it out.

[05:57] Team_092 possession (Score: 64-71)
Karl Gobert drives to the basket... Karl Gobert loses the ball! Stripped by Julius Green! TURNOVER! (live ball)

[05:39] Team_060 possession (Score: 64-71)
Julius Green attempts a 3Pt. Contested by John Giddey (3.9 feet, ZONE). JULIUS GREEN MAKES IT! Assist: Larry Westbrook
Score: 64-74

[05:22] Team_092 possession (Score: 64-74)
Austin Bridges attempts a Midrange. Contested by Larry Westbrook (4.4 feet, ZONE). AUSTIN BRIDGES MAKES IT!
Score: 66-74

[05:08] Team_060 possession (Score: 66-74)
Immanuel Ming attempts a Midrange. Contested by Immanuel Ingram (4.0 feet, ZONE). Immanuel Ming misses. Offensive rebound by Jaren George! Jaren George puts it back in!
Score: 66-76

[04:51] Team_092 possession (Score: 66-76)
Austin Bridges drives to the basket... FOUL! Offensive foul on Austin Bridges! Joel Morant drew the charge! [Team fouls: 4] (Austin Bridges: 1 personal fouls) TURNOVER! (dead ball)

[04:35] Team_060 possession (Score: 66-76)
Julius Green attempts a 3Pt. Contested by Karl Gobert (4.9 feet, MAN). JULIUS GREEN MAKES IT! Assist: Jaren George
Score: 66-79

[04:21] Team_092 possession (Score: 66-79)
John Giddey attempts a 3Pt. Contested by Immanuel Ming (4.0 feet, ZONE). John Giddey misses. Rebound secured by Jaren George.

[04:04] Team_060 possession (Score: 66-79)
FOUL! Shooting foul on Austin Bridges. Joel Morant to the line for 2 free throws. [BONUS: 5 team fouls] (Austin Bridges: 2 personal fouls)   FT 1/2: GOOD   FT 2/2: MISS Joel Morant makes 1/2 from the line. Rebound secured by John Giddey.
Score: 66-80

[03:50] Team_092 possession (Score: 66-80)
Karl Gobert attempts a 3Pt. Contested by Julius Green (3.8 feet, ZONE). Karl Gobert misses. Rebound secured by Larry Westbrook.

[03:33] Team_060 possession (Score: 66-80)
Larry Westbrook throws a bad pass out of bounds! TURNOVER! (dead ball)

[03:33] Substitution (Team_060): Joel Morant OUT → Domantas Barnes IN (stamina_rule2)

[03:33] Substitution (Team_060): Larry Westbrook OUT → Yao Tatum IN (stamina_rule2)

[03:33] Substitution (Team_060): Jaren George OUT → Klay Haliburton IN (stamina_rule2)

[03:19] Team_092 possession (Score: 66-80)
Karl Gobert attempts a Layup. Contested by Julius Green (3.8 feet, MAN). Karl Gobert misses. Rebound secured by Klay Haliburton.

[03:08] Team_060 possession (Score: 66-80)
Immanuel Ming attempts a 3Pt. Contested by Paul James (4.9 feet, MAN). Immanuel Ming misses. Rebound secured by Paul James.

[02:58] Team_092 possession (Score: 66-80)
Immanuel Ingram attempts a 3Pt. Contested by Klay Haliburton (4.1 feet, MAN). Immanuel Ingram misses. Rebound secured by Domantas Barnes.

[02:47] Team_060 possession (Score: 66-80)
Domantas Barnes attempts a 3Pt. Contested by John Giddey (4.3 feet, ZONE). DOMANTAS BARNES MAKES IT! Assist: Julius Green
Score: 66-83

[02:28] Team_092 possession (Score: 66-83)
Karl Gobert makes the Layup and draws the foul on Julius Green! And-1! Karl Gobert to the line for 1. [Team fouls: 3] (Julius Green: 1 personal fouls)   FT 1/1: GOOD Karl Gobert makes 1/1 from the line.
Score: 69-83

[02:10] Team_060 possession (Score: 69-83)
Immanuel Ming attempts a 3Pt. Contested by Paul James (5.0 feet, ZONE). Immanuel Ming misses. Rebound secured by Paul James.

[01:58] Team_092 possession (Score: 69-83)
Immanuel Ingram drives, picks up Klay Haliburton. Help arrives from Julius Green! Immanuel Ingram attempts a Layup. Contested by Julius Green (4.1 feet, ZONE). Immanuel Ingram misses. Rebound secured by Immanuel Ming.

[01:44] Team_060 possession (Score: 69-83)
Klay Haliburton attempts a Layup. Contested by John Giddey (4.8 feet, ZONE). KLAY HALIBURTON MAKES IT!
Score: 69-85

[01:31] Team_092 possession (Score: 69-85)
Paul James drives, picks up Klay Haliburton. Help arrives from Julius Green! Paul James attempts a Dunk. Contested by Julius Green (4.8 feet, ZONE). PAUL JAMES MAKES IT!
Score: 71-85

[01:15] Team_060 possession (Score: 71-85)
Domantas Barnes attempts a Layup. Contested by Austin Bridges (4.9 feet, MAN). Domantas Barnes misses. Rebound secured by Paul James.

[01:03] Team_092 possession (Score: 71-85)
Immanuel Ingram drives and kicks out. John Giddey attempts a Midrange. Contested by Yao Tatum (5.2 feet, MAN). John Giddey misses. Rebound secured by Immanuel Ming.

[00:49] Team_060 possession (Score: 71-85)
Julius Green drives to the basket... Julius Green throws a bad pass! Stolen by John Giddey! TURNOVER! (live ball)

[00:39] Team_092 possession (Score: 71-85)
FOUL! Shooting foul on Immanuel Ming. Paul James to the line for 3 free throws. [Team fouls: 4] (Immanuel Ming: 1 personal fouls)   FT 1/3: GOOD   FT 2/3: MISS   FT 3/3: GOOD Paul James makes 2/3 from the line.
Score: 73-85

[00:25] Team_060 possession (Score: 73-85)
Domantas Barnes attempts a 3Pt. Contested by Paul James (5.2 feet, ZONE). DOMANTAS BARNES MAKES IT! Assist: Immanuel Ming
Score: 73-88

[00:07] Team_092 possession (Score: 73-88)
Paul James attempts a Layup. BLOCKED BY KLAY HALIBURTON! Ball deflects out of bounds off Paul James.

================================================================================
                              3RD QUARTER COMPLETE                              
================================================================================

3RD QUARTER SCORE: Team_092 20, Team_060 33

BOX SCORE:
================================================================================

Team_092
--------------------------------------------------------------------------------
Player                MIN  PTS  REB  AST  TO      FG   FG%      3P   3P%
--------------------------------------------------------------------------------
Karl Gobert            26   12    0    0   0   4/6    66.7     0/0   0.0
Paul James             26    4    6    0   0   2/3    66.7     0/0   0.0
Immanuel Ingram        26    2    2    1   0   1/4    25.0     0/0   0.0
Austin Bridges         26    2    0    1   0   1/3    33.3     0/0   0.0
John Giddey            26    0    4    0   0   0/2     0.0     0/0   0.0

TEAM: FG: 8/18 (44.4%), 3PT: 2/6 (33.3%), REB: 12 (3 off, 9 def), AST: 2, TO: 6
TEAM FOULS: 5 [Team_060 in BONUS]


Team_060
--------------------------------------------------------------------------------
Player                MIN  PTS  REB  AST  TO      FG   FG%      3P   3P%
--------------------------------------------------------------------------------
Julius Green           26    9    0    1   0   3/4    75.0     0/0   0.0
Jaren George           22    8    2    1   0   3/5    60.0     0/0   0.0
Domantas Barnes        14    6    1    0   0   2/3    66.7     0/0   0.0
Larry Westbrook        22    4    3    1   0   2/3    66.7     0/0   0.0
Joel Morant            22    3    0    2   0   1/2    50.0     0/0   0.0
Klay Haliburton        14    2    1    0   0   1/1   100.0     0/0   0.0
Immanuel Ming          26    0    5    3   0   0/3     0.0     0/0   0.0

TEAM: FG: 12/21 (57.1%), 3PT: 7/9 (77.8%), REB: 12 (3 off, 9 def), AST: 8, TO: 2
TEAM FOULS: 4

================================================================================

================================================================================
                       4TH QUARTER - Team_092 vs Team_060                       
================================================================================

[12:00] Substitution (Team_092): Austin Bridges OUT (stamina: 65) → Bones Giddey IN (comeback_detected)

[12:00] Substitution (Team_060): Joel Morant OUT (stamina: 81) → Domantas Barnes IN (comeback_detected)

[12:00] Team_092 possession (Score: 73-88)
Paul James drives and kicks out. Immanuel Ingram attempts a 3Pt. Contested by Domantas Barnes (4.6 feet, ZONE). IMMANUEL INGRAM MAKES IT! Assist: Karl Gobert
Score: 76-88

[11:46] Team_060 possession (Score: 76-88)
Jaren George throws a bad pass out of bounds! TURNOVER! (dead ball)

[11:46] Substitution (Team_092): Karl Gobert OUT → Shaquille Russell IN (stamina_rule2)

[11:46] Substitution (Team_092): Paul James OUT → Vince Harris IN (stamina_rule2)

[11:46] Substitution (Team_092): John Giddey OUT → Shaquille Paul IN (stamina_rule2)

[11:46] Substitution (Team_092): Immanuel Ingram OUT → Pau Reaves IN (stamina_rule2)

[11:46] Substitution (Team_060): Julius Green OUT → Rudy Ginobili IN (stamina_rule2)

[11:46] Substitution (Team_060): Immanuel Ming OUT → Jarrett Wagner IN (stamina_rule2)

[11:34] Team_092 possession (Score: 76-88)
Vince Harris attempts a 3Pt. Contested by Domantas Barnes (4.6 feet, ZONE). Vince Harris misses. Rebound secured by Larry Westbrook.

[11:14] Team_060 possession (Score: 76-88)
Domantas Barnes attempts a Layup. BLOCKED BY PAU REAVES! Ball goes out off Pau Reaves. Domantas Barnes's ball!

[11:01] Team_060 possession (Score: 76-88)
Rudy Ginobili attempts a 3Pt. Contested by Shaquille Russell (4.5 feet, MAN). Rudy Ginobili misses. Rebound secured by Shaquille Russell.

[10:50] Team_092 possession (Score: 76-88)
Shaquille Paul attempts a Layup. Contested by Larry Westbrook (5.2 feet, MAN). SHAQUILLE PAUL MAKES IT!
Score: 78-88

[10:37] Team_060 possession (Score: 78-88)
Jarrett Wagner attempts a Midrange. Contested by Shaquille Paul (5.7 feet, ZONE). Jarrett Wagner misses. Rebound secured by Shaquille Russell.

[10:20] Team_092 possession (Score: 78-88)
Shaquille Paul attempts a Midrange. Contested by Larry Westbrook (5.3 feet, ZONE). Shaquille Paul misses. Rebound secured by Domantas Barnes.

[10:03] Team_060 possession (Score: 78-88)
Rudy Ginobili drives and kicks out. Jaren George attempts a 3Pt. Contested by Vince Harris (4.1 feet, ZONE). Jaren George misses. Offensive rebound by Larry Westbrook! Larry Westbrook kicks it out.

[09:51] Team_060 possession (Score: 78-88)
Domantas Barnes attempts a 3Pt. Contested by Vince Harris (4.1 feet, ZONE). Domantas Barnes misses. Rebound secured by Shaquille Paul.

[09:37] Team_092 possession (Score: 78-88)
Bones Giddey attempts a 3Pt. Contested by Domantas Barnes (4.2 feet, ZONE). Bones Giddey misses. Rebound secured by Larry Westbrook.

[09:25] Team_060 possession (Score: 78-88)
Jaren George attempts a Layup. Contested by Pau Reaves (4.9 feet, MAN). Jaren George misses. Rebound secured by Pau Reaves.

[09:12] Team_092 possession (Score: 78-88)
Pau Reaves attempts a Midrange. Contested by Jaren George (5.7 feet, MAN). PAU REAVES MAKES IT! Assist: Shaquille Russell
Score: 80-88

[09:01] Team_060 possession (Score: 80-88)
Rudy Ginobili drives and kicks out. Larry Westbrook attempts a Midrange. Contested by Shaquille Paul (5.6 feet, MAN). Larry Westbrook misses. Rebound secured by Shaquille Russell.

[08:46] Team_092 possession (Score: 80-88)
Shaquille Paul attempts a 3Pt. Contested by Larry Westbrook (5.5 feet, MAN). Shaquille Paul misses. Rebound secured by Larry Westbrook.

[08:30] Team_060 possession (Score: 80-88)
Jaren George attempts a Midrange. Contested by Vince Harris (4.2 feet, ZONE). JAREN GEORGE MAKES IT! Assist: Domantas Barnes
Score: 80-90

[08:11] Team_092 possession (Score: 80-90)
Shaquille Paul attempts a Midrange. Contested by Larry Westbrook (5.5 feet, MAN). Shaquille Paul misses. Rebound secured by Domantas Barnes.

[07:59] Team_060 possession (Score: 80-90)
Jaren George attempts a 3Pt. Contested by Vince Harris (4.2 feet, ZONE). Jaren George misses. Rebound secured by Shaquille Paul.

[07:44] Team_092 possession (Score: 80-90)
Vince Harris drives, Jarrett Wagner stays with him. Vince Harris attempts a Layup. Contested by Jarrett Wagner (4.9 feet, MAN). Vince Harris misses. Offensive rebound by Pau Reaves! Pau Reaves kicks it out.

[07:35] Team_092 possession (Score: 80-90)
Pau Reaves drives and kicks out. Shaquille Paul attempts a 3Pt. Contested by Larry Westbrook (5.1 feet, ZONE). Shaquille Paul misses. Rebound secured by Domantas Barnes.

[07:23] Team_060 possession (Score: 80-90)
Jarrett Wagner attempts a Midrange. Contested by Vince Harris (4.3 feet, MAN). Jarrett Wagner misses. Offensive rebound by Jaren George! Jaren George puts it back in!
Score: 80-92

[07:06] Team_092 possession (Score: 80-92)
Pau Reaves attempts a 3Pt. Contested by Jaren George (5.9 feet, MAN). Pau Reaves misses. Rebound secured by Jaren George.

[06:52] Team_060 possession (Score: 80-92)
Jaren George drives and kicks out. Larry Westbrook attempts a 3Pt. Contested by Shaquille Paul (5.6 feet, MAN). Larry Westbrook misses. Offensive rebound by Domantas Barnes! Domantas Barnes kicks it out.

[06:39] Team_060 possession (Score: 80-92)
Jaren George attempts a Midrange. Contested by Vince Harris (4.2 feet, ZONE). JAREN GEORGE MAKES IT!
Score: 80-94

[06:22] Team_092 possession (Score: 80-94)
Shaquille Russell attempts a 3Pt. Contested by Domantas Barnes (5.1 feet, ZONE). Shaquille Russell misses. Offensive rebound by Shaquille Paul! Shaquille Paul kicks it out.

[06:06] Team_092 possession (Score: 80-94)
Bones Giddey drives, picks up Jaren George. Help arrives from Domantas Barnes! Bones Giddey attempts a Dunk. Contested by Domantas Barnes (5.4 feet, ZONE). BONES GIDDEY MAKES IT! Assist: Vince Harris
Score: 82-94

[05:49] Team_060 possession (Score: 82-94)
Larry Westbrook attempts a Midrange. Contested by Shaquille Paul (5.9 feet, ZONE). LARRY WESTBROOK MAKES IT! Assist: Domantas Barnes
Score: 82-96

[05:35] Team_092 possession (Score: 82-96)
FOUL! Reach-in foul on Jaren George during the drive. [Team fouls: 1] No free throws, side out. (Jaren George: 1 personal fouls)

[05:20] Team_092 possession (Score: 82-96)
Shaquille Paul drives, Larry Westbrook stays with him. Shaquille Paul attempts a Dunk. Contested by Larry Westbrook (5.9 feet, MAN). SHAQUILLE PAUL MAKES IT!
Score: 84-96

[05:03] Team_060 possession (Score: 84-96)
Larry Westbrook attempts a Layup. Contested by Shaquille Paul (5.9 feet, MAN). LARRY WESTBROOK MAKES IT! Assist: Rudy Ginobili
Score: 84-98

[04:49] Team_092 possession (Score: 84-98)
FOUL! Reach-in foul on Jaren George during the drive. [Team fouls: 2] No free throws, side out. (Jaren George: 2 personal fouls)

[04:35] Team_092 possession (Score: 84-98)
Shaquille Russell attempts a Midrange. Contested by Rudy Ginobili (4.8 feet, MAN). SHAQUILLE RUSSELL MAKES IT! Assist: Shaquille Paul
Score: 86-98

[04:17] Team_060 possession (Score: 86-98)
Larry Westbrook drives, Pau Reaves stays with him. Larry Westbrook attempts a Layup. Contested by Pau Reaves (5.2 feet, ZONE). Larry Westbrook misses. Rebound secured by Pau Reaves.

[04:03] Team_092 possession (Score: 86-98)
Vince Harris makes the Midrange and draws the foul on Jarrett Wagner! And-1! Vince Harris to the line for 1. [Team fouls: 3] (Jarrett Wagner: 1 personal fouls)   FT 1/1: GOOD Vince Harris makes 1/1 from the line.
Score: 89-98

[03:48] Team_060 possession (Score: 89-98)
Rudy Ginobili drives, picks up Pau Reaves. Help arrives from Shaquille Russell! Rudy Ginobili attempts a Dunk. Contested by Shaquille Russell (5.2 feet, ZONE). Rudy Ginobili misses. Rebound secured by Shaquille Russell.

[03:32] Team_092 possession (Score: 89-98)
Shaquille Russell attempts a Layup. Wide open! Larry Westbrook is 6.0 feet away. [ZONE] SHAQUILLE RUSSELL MAKES IT! Assist: Bones Giddey
Score: 91-98

[03:15] Team_060 possession (Score: 91-98)
Domantas Barnes attempts a 3Pt. Contested by Bones Giddey (5.3 feet, MAN). Domantas Barnes misses. Rebound secured by Shaquille Paul.

[02:57] Team_092 possession (Score: 91-98)
Shaquille Paul attempts a Midrange. Wide open! Larry Westbrook is 6.3 feet away. [MAN] SHAQUILLE PAUL MAKES IT!
Score: 93-98

[02:42] Team_060 possession (Score: 93-98)
Rudy Ginobili drives to the basket... Rudy Ginobili throws a bad pass! Stolen by Shaquille Russell! TURNOVER! (live ball)

[02:29] Team_092 possession (Score: 93-98)
Vince Harris attempts a Layup. Contested by Jarrett Wagner (5.1 feet, MAN). Vince Harris misses. Rebound secured by Rudy Ginobili.

[02:15] Team_060 possession (Score: 93-98)
Larry Westbrook attempts a Layup. Wide open! Shaquille Paul is 6.0 feet away. [ZONE] LARRY WESTBROOK MAKES IT! Assist: Rudy Ginobili
Score: 93-100

[01:58] Team_092 possession (Score: 93-100)
FOUL! Offensive foul on Vince Harris! Jarrett Wagner drew the charge! [Team fouls: 1] (Vince Harris: 1 personal fouls) TURNOVER! (dead ball)

[01:40] Team_060 possession (Score: 93-100)
Jarrett Wagner attempts a 3Pt. Contested by Vince Harris (4.5 feet, MAN). Jarrett Wagner misses. Offensive rebound by Domantas Barnes! Domantas Barnes kicks it out.

[01:24] Team_060 possession (Score: 93-100)
Rudy Ginobili attempts a 3Pt. Contested by Vince Harris (4.7 feet, ZONE). Rudy Ginobili misses. FOUL! Loose ball foul on Vince Harris during the rebound battle. [Team fouls: 2] No free throws, side out. (Vince Harris: 2 personal fouls)

[01:05] Team_060 possession (Score: 93-100)
Jaren George attempts a Layup. Contested by Pau Reaves (5.1 feet, ZONE). Jaren George misses. FOUL! Loose ball foul on Shaquille Paul during the rebound battle. [Team fouls: 3] No free throws, side out. (Shaquille Paul: 1 personal fouls)

[00:50] Team_060 possession (Score: 93-100)
FOUL! Reach-in foul on Pau Reaves during the drive. [Team fouls: 4] No free throws, side out. (Pau Reaves: 1 personal fouls)

[00:37] Team_060 possession (Score: 93-100)
Larry Westbrook attempts a Layup. Wide open! Shaquille Paul is 6.1 feet away. [MAN] LARRY WESTBROOK MAKES IT!
Score: 93-102

[00:23] Team_092 possession (Score: 93-102)
Bones Giddey drives, picks up Domantas Barnes. Help arrives from Rudy Ginobili! Bones Giddey attempts a Layup. Contested by Rudy Ginobili (5.0 feet, MAN). BONES GIDDEY MAKES IT! Assist: Vince Harris
Score: 95-102

[00:06] Team_060 possession (Score: 95-102)
Rudy Ginobili attempts a 3Pt. Contested by Shaquille Russell (4.9 feet, MAN). Rudy Ginobili misses. Offensive rebound by Rudy Ginobili! Rudy Ginobili kicks it out.

================================================================================
                              4TH QUARTER COMPLETE                              
================================================================================

4TH QUARTER SCORE: Team_092 22, Team_060 14

BOX SCORE:
================================================================================

Team_092
--------------------------------------------------------------------------------
Player                MIN  PTS  REB  AST  TO      FG   FG%      3P   3P%
--------------------------------------------------------------------------------
Shaquille Paul         22    6    4    1   0   3/6    50.0     0/0   0.0
Shaquille Russell      22    4    4    1   0   2/2   100.0     0/0   0.0
Bones Giddey           23    4    0    1   0   2/3    66.7     0/0   0.0
Immanuel Ingram        26    3    0    0   0   1/1   100.0     0/0   0.0
Vince Harris           22    3    0    2   0   1/3    33.3     0/0   0.0
Pau Reaves             22    2    3    0   0   1/3    33.3     0/0   0.0
Karl Gobert            26    0    0    1   0   0/0     0.0     0/0   0.0

TEAM: FG: 10/18 (55.6%), 3PT: 0/4 (0.0%), REB: 11 (2 off, 9 def), AST: 6, TO: 1
TEAM FOULS: 4


Team_060
--------------------------------------------------------------------------------
Player                MIN  PTS  REB  AST  TO      FG   FG%      3P   3P%
--------------------------------------------------------------------------------
Larry Westbrook        34    8    4    0   0   4/5    80.0     0/0   0.0
Jaren George           34    6    2    0   0   3/5    60.0     0/0   0.0
Rudy Ginobili          22    0    4    2   0   0/3     0.0     0/0   0.0
Jarrett Wagner         22    0    0    0   0   0/1     0.0     0/0   0.0
Domantas Barnes        26    0    5    2   0   0/2     0.0     0/0   0.0

TEAM: FG: 7/16 (43.8%), 3PT: 0/4 (0.0%), REB: 15 (7 off, 8 def), AST: 4, TO: 2
TEAM FOULS: 3

================================================================================

================================================================================
                               FULL GAME COMPLETE                               
================================================================================

FINAL SCORE: Team_092 95, Team_060 102

SCORING BY QUARTER:
--------------------------------------------------------------------------------
Team                     Q1     Q2     Q3     Q4    FINAL
--------------------------------------------------------------------------------
Team_092                 33     20     20     22       95
Team_060                 34     21     33     14      102
--------------------------------------------------------------------------------

FULL GAME BOX SCORE:
================================================================================

Team_092
--------------------------------------------------------------------------------
Player                MIN  PTS  REB  AST  TO      FG   FG%      3P   3P%      FT STL BLK
--------------------------------------------------------------------------------
Karl Gobert            26   15    0    4   3   4/7    57.1   2/4    50.0   2/2     0   1
Paul James             26    8    9    1   3   5/7    71.4   1/1   100.0   2/3     0   0
John Giddey            26    9    8    2   3   4/8    50.0   2/3    66.7   5/6     1   1
Immanuel Ingram        26   19    7    2   1   8/12   66.7   0/1     0.0   2/2     0   0
Austin Bridges         26    7    0    2   1   3/6    50.0   1/3    33.3   2/2     0   0
Bones Giddey           23    7    0    2   1   3/6    50.0   1/4    25.0   0/0     0   0
Shaquille Russell      22    7    6    2   0   3/5    60.0   0/0     0.0   1/1     1   0
Vince Harris           22    7    1    4   1   3/6    50.0   0/1     0.0   3/4     0   0
Shaquille Paul         22   11    6    1   1   5/8    62.5   1/2    50.0   0/0     0   0
Pau Reaves             22    4    9    0   0   2/7    28.6   0/3     0.0   0/0     2   1

TEAM: FG: 40/72 (55.6%), 3PT: 8/22 (36.4%), REB: 46 (12 off, 34 def), AST: 20, TO: 14


Team_060
--------------------------------------------------------------------------------
Player                MIN  PTS  REB  AST  TO      FG   FG%      3P   3P%      FT STL BLK
--------------------------------------------------------------------------------
Larry Westbrook        34   12    7    5   1   6/8    75.0   0/0     0.0   2/2     0   1
Jaren George           34   33   10    2   1   9/14   64.3   2/3    66.7   3/3     0   0
Domantas Barnes        26   10   10    2   0   3/6    50.0   2/4    50.0   2/3     0   0
Julius Green           26   15    0    3   0   6/9    66.7   6/7    85.7   1/2     2   0
Immanuel Ming          26    4    9    4   0   3/9    33.3   0/5     0.0   0/0     1   0
Rudy Ginobili          22    8    9    3   1   4/9    44.4   3/5    60.0   0/0     0   1
Jarrett Wagner         22    0    0    0   1   1/5    20.0   0/2     0.0   0/0     0   0
Joel Morant            22   10    0    3   0   6/9    66.7   4/5    80.0   1/2     0   0
Yao Tatum              14    4    0    1   0   2/4    50.0   0/1     0.0   0/0     1   0
Klay Haliburton        14    4    6    2   2   1/2    50.0   0/0     0.0   0/2     0   1

TEAM: FG: 42/77 (54.5%), 3PT: 17/32 (53.1%), REB: 51 (22 off, 29 def), AST: 25, TO: 6

================================================================================
