================================================================================
                        FULL GAME - Team_011 vs Team_027                        
================================================================================

================================================================================
                       1ST QUARTER - Team_011 vs Team_027                       
================================================================================

[12:00] Team_011 possession (Score: 0-0)
Magic Tatum attempts a 3Pt. Contested by Tim Johnson (5.1 feet, MAN). Magic Tatum misses. FOUL! Loose ball foul on John Russell during the rebound battle. [Team fouls: 1] No free throws, side out. (John Russell: 1 personal fouls)

[11:45] Team_011 possession (Score: 0-0)
FOUL! Reach-in foul on Scottie Harden during the drive. [Team fouls: 2] No free throws, side out. (Scottie Harden: 1 personal fouls)

[11:30] Team_011 possession (Score: 0-0)
Magic Tatum attempts a Layup. Contested by John Russell (4.1 feet, ZONE). MAGIC TATUM MAKES IT! Assist: Pau Barnes
Score: 2-0

[11:16] Team_027 possession (Score: 2-0)
Scottie Harden attempts a 3Pt. Contested by Magic Tatum (3.5 feet, ZONE). Scottie Harden misses. Rebound secured by Michael Carter.

[10:59] Team_011 possession (Score: 2-0)
Pau Barnes attempts a Midrange. Contested by Bradley Dosunmu (5.0 feet, MAN). Pau Barnes misses. FOUL! Loose ball foul on Bradley Dosunmu during the rebound battle. [Team fouls: 3] No free throws, side out. (Bradley Dosunmu: 1 personal fouls)

[10:40] Team_011 possession (Score: 2-0)
Magic Tatum attempts a Midrange. Contested by Tim Johnson (5.1 feet, MAN). Magic Tatum misses. Rebound secured by Tony Doncic.

[10:26] Team_027 possession (Score: 2-0)
John Russell drives and kicks out. Scottie Harden attempts a Midrange. Contested by Michael Carter (4.1 feet, MAN). Scottie Harden misses. Rebound secured by Pau Barnes.

[10:08] Team_011 possession (Score: 2-0)
Evan George drives, picks up John Russell. Help arrives from Tony Doncic! Evan George attempts a Dunk. Contested by Tony Doncic (4.2 feet, ZONE). Evan George misses. Rebound secured by John Russell.

[09:54] Team_027 possession (Score: 2-0)
Scottie Harden drives to the basket... Scottie Harden throws a bad pass! Stolen by Michael Carter! TURNOVER! (live ball)

[09:42] Team_011 possession (Score: 2-0)
FOUL! Offensive foul on Magic Tatum! Tim Johnson drew the charge! [Team fouls: 1] (Magic Tatum: 1 personal fouls) TURNOVER! (dead ball)

[09:24] Team_027 possession (Score: 2-0)
Bradley Dosunmu drives and kicks out. Scottie Harden attempts a 3Pt. Contested by Magic Tatum (3.4 feet, ZONE). Scottie Harden misses. Rebound secured by Evan George.

[09:11] Team_011 possession (Score: 2-0)
Trae Tatum makes the Layup and draws the foul on Tony Doncic! And-1! Trae Tatum to the line for 1. [Team fouls: 4] (Tony Doncic: 1 personal fouls)   FT 1/1: MISS Trae Tatum makes 0/1 from the line. Offensive rebound by Pau Barnes! Pau Barnes puts it back in!
Score: 6-0

[08:52] Team_027 possession (Score: 6-0)
Tony Doncic drives, picks up Trae Tatum. Help arrives from Magic Tatum! Tony Doncic attempts a Layup. Contested by Magic Tatum (4.7 feet, MAN). TONY DONCIC MAKES IT! Assist: Tim Johnson
Score: 6-2

[08:37] Team_011 possession (Score: 6-2)
Evan George attempts a 3Pt. Contested by Bradley Dosunmu (4.7 feet, ZONE). Evan George misses. Rebound secured by John Russell.

[08:20] Team_027 possession (Score: 6-2)
Tim Johnson attempts a 3Pt. Contested by Magic Tatum (3.7 feet, MAN). Tim Johnson misses. Rebound secured by Evan George.

[08:07] Team_011 possession (Score: 6-2)
Michael Carter attempts a Layup. Contested by Scottie Harden (4.4 feet, MAN). Michael Carter misses. Offensive rebound by Pau Barnes! Pau Barnes puts it back in!
Score: 8-2

[07:51] Team_027 possession (Score: 8-2)
Tim Johnson attempts a 3Pt. Contested by Magic Tatum (3.7 feet, MAN). Tim Johnson misses. Offensive rebound by John Russell! John Russell puts it back in!
Score: 8-4

[07:37] Team_011 possession (Score: 8-4)
Michael Carter attempts a Layup. BLOCKED BY TONY DONCIC! Ball is loose! Rebound secured by John Russell.

[07:18] Team_027 possession (Score: 8-4)
Bradley Dosunmu attempts a 3Pt. Contested by Pau Barnes (3.0 feet, MAN). Bradley Dosunmu misses. Offensive rebound by John Russell! John Russell puts it back in!
Score: 8-6

[07:00] Team_011 possession (Score: 8-6)
Evan George attempts a Midrange. Contested by John Russell (4.2 feet, MAN). Evan George misses. Offensive rebound by Evan George! Evan George puts it back in!
Score: 10-6

[06:41] Team_027 possession (Score: 10-6)
John Russell drives and kicks out. John Russell attempts a 3Pt. Contested by Magic Tatum (3.4 feet, ZONE). John Russell misses. Rebound secured by Pau Barnes.

[06:29] Team_011 possession (Score: 10-6)
Evan George attempts a Layup. Contested by John Russell (4.2 feet, ZONE). Evan George misses. Rebound secured by John Russell.

[06:13] Team_027 possession (Score: 10-6)
Bradley Dosunmu attempts a 3Pt. Contested by Magic Tatum (3.5 feet, ZONE). Bradley Dosunmu misses. Rebound secured by Pau Barnes.

[06:00] Team_011 possession (Score: 10-6)
Evan George attempts a Layup. Contested by John Russell (4.2 feet, MAN). Evan George misses. Offensive rebound by Pau Barnes! Pau Barnes's putback is no good. Offensive rebound by Pau Barnes! Pau Barnes kicks it out.

[05:44] Team_011 possession (Score: 10-6)
FOUL! Reach-in foul on John Russell during the drive. [IN THE BONUS! 5 team fouls] Michael Carter to the line for 2 free throws. (John Russell: 2 personal fouls)   FT 1/2: GOOD   FT 2/2: GOOD Michael Carter makes 2/2 from the line.
Score: 12-6

[05:29] Team_027 possession (Score: 12-6)
FOUL! Reach-in foul on Pau Barnes during the drive. [Team fouls: 2] No free throws, side out. (Pau Barnes: 1 personal fouls)

[05:18] Team_027 possession (Score: 12-6)
Tony Doncic drives to the basket... Tony Doncic loses the ball! Stripped by Pau Barnes! TURNOVER! (live ball)

[05:02] Team_011 possession (Score: 12-6)
Pau Barnes commits a violation (traveling/carry)! TURNOVER! (dead ball)

[04:49] Team_027 possession (Score: 12-6)
FOUL! Holding foul on Pau Barnes. [Team fouls: 3] No free throws, side out. (Pau Barnes: 2 personal fouls)

[04:35] Team_027 possession (Score: 12-6)
Bradley Dosunmu drives to the basket... FOUL! Offensive foul on Bradley Dosunmu! Pau Barnes drew the charge! [Team fouls: 6] (Bradley Dosunmu: 2 personal fouls) TURNOVER! (dead ball)

[04:23] Team_011 possession (Score: 12-6)
FOUL! Reach-in foul on John Russell during the drive. [IN THE BONUS! 7 team fouls] Trae Tatum to the line for 2 free throws. (John Russell: 3 personal fouls)   FT 1/2: GOOD   FT 2/2: GOOD Trae Tatum makes 2/2 from the line.
Score: 14-6

[04:13] Team_027 possession (Score: 14-6)
Scottie Harden attempts a Midrange. Contested by Pau Barnes (3.1 feet, ZONE). Scottie Harden misses. Rebound secured by Pau Barnes.

[04:00] Team_011 possession (Score: 14-6)
Michael Carter drives to the basket... Michael Carter loses the ball! Stripped by Scottie Harden! TURNOVER! (live ball)

[03:47] Team_027 possession (Score: 14-6)
Bradley Dosunmu makes the Layup and draws the foul on Pau Barnes! And-1! Bradley Dosunmu to the line for 1. [Team fouls: 4] (Pau Barnes: 3 personal fouls)   FT 1/1: GOOD Bradley Dosunmu makes 1/1 from the line.
Score: 14-9

[03:36] Team_011 possession (Score: 14-9)
Trae Tatum attempts a Midrange. Contested by Tony Doncic (3.9 feet, MAN). TRAE TATUM MAKES IT!
Score: 16-9

[03:22] Team_027 possession (Score: 16-9)
FOUL! Reach-in foul on Pau Barnes during the drive. [IN THE BONUS! 5 team fouls] Bradley Dosunmu to the line for 2 free throws. (Pau Barnes: 4 personal fouls)   FT 1/2: GOOD   FT 2/2: GOOD Bradley Dosunmu makes 2/2 from the line.
Score: 16-11

[03:11] Team_011 possession (Score: 16-11)
Trae Tatum attempts a 3Pt. Contested by Bradley Dosunmu (4.5 feet, ZONE). TRAE TATUM MAKES IT! Assist: Michael Carter
Score: 19-11

[02:58] Team_027 possession (Score: 19-11)
FOUL! Offensive foul on Scottie Harden! Michael Carter drew the charge! [Team fouls: 8] (Scottie Harden: 2 personal fouls) TURNOVER! (dead ball)

[02:43] Team_011 possession (Score: 19-11)
Magic Tatum attempts a 3Pt. Contested by Tim Johnson (5.3 feet, ZONE). Magic Tatum misses. Rebound secured by Bradley Dosunmu.

[02:32] Team_027 possession (Score: 19-11)
Scottie Harden throws a bad pass! Stolen by Michael Carter! TURNOVER! (live ball)

[02:18] Team_011 possession (Score: 19-11)
FOUL! Holding foul on Tim Johnson. [IN THE BONUS! 9 team fouls] Magic Tatum to the line for 2 free throws. (Tim Johnson: 1 personal fouls)   FT 1/2: MISS   FT 2/2: GOOD Magic Tatum makes 1/2 from the line.
Score: 20-11

[02:01] Team_027 possession (Score: 20-11)
Bradley Dosunmu attempts a Layup. Contested by Pau Barnes (3.4 feet, MAN). BRADLEY DOSUNMU MAKES IT!
Score: 20-13

[01:47] Team_011 possession (Score: 20-13)
Trae Tatum drives, Tony Doncic stays with him. Trae Tatum attempts a Layup. Contested by Tony Doncic (4.1 feet, MAN). Trae Tatum misses. Rebound secured by John Russell.

[01:33] Team_027 possession (Score: 20-13)
Scottie Harden attempts a 3Pt. Contested by Magic Tatum (3.8 feet, ZONE). SCOTTIE HARDEN MAKES IT!
Score: 20-16

[01:15] Team_011 possession (Score: 20-16)
Pau Barnes attempts a 3Pt. Contested by Bradley Dosunmu (5.3 feet, MAN). PAU BARNES MAKES IT! Assist: Trae Tatum
Score: 23-16

[00:57] Team_027 possession (Score: 23-16)
Tony Doncic makes the Dunk and draws the foul on Magic Tatum! And-1! Tony Doncic to the line for 1. [BONUS: 6 team fouls] (Magic Tatum: 2 personal fouls)   FT 1/1: GOOD Tony Doncic makes 1/1 from the line.
Score: 23-19

[00:45] Team_011 possession (Score: 23-19)
FOUL! Reach-in foul on Bradley Dosunmu during the drive. [IN THE BONUS! 10 team fouls] Pau Barnes to the line for 2 free throws. (Bradley Dosunmu: 3 personal fouls)   FT 1/2: GOOD   FT 2/2: GOOD Pau Barnes makes 2/2 from the line.
Score: 25-19

[00:30] Team_027 possession (Score: 25-19)
Tony Doncic attempts a Midrange. Contested by Michael Carter (4.7 feet, ZONE). TONY DONCIC MAKES IT! Assist: Bradley Dosunmu
Score: 25-21

[00:13] Team_011 possession (Score: 25-21)
Pau Barnes drives, picks up John Russell. Help arrives from Tony Doncic! Pau Barnes attempts a Layup. Contested by Tony Doncic (5.1 feet, ZONE). Pau Barnes misses. Offensive rebound by Evan George! Evan George puts it back in!
Score: 27-21

================================================================================
                              1ST QUARTER COMPLETE                              
================================================================================

1ST QUARTER SCORE: Team_011 27, Team_027 21

BOX SCORE:
================================================================================

Team_011
--------------------------------------------------------------------------------
Player                MIN  PTS  REB  AST  TO      FG   FG%      3P   3P%
--------------------------------------------------------------------------------
Pau Barnes             12   11    7    1   0   4/4   100.0     0/0   0.0
Trae Tatum             12    7    0    1   0   3/4    75.0     0/0   0.0
Evan George            12    4    5    0   0   2/5    40.0     0/0   0.0
Magic Tatum            12    3    0    0   0   2/4    50.0     0/0   0.0
Michael Carter         12    2    1    1   0   1/2    50.0     0/0   0.0

TEAM: FG: 12/19 (63.2%), 3PT: 2/4 (50.0%), REB: 13 (6 off, 7 def), AST: 3, TO: 3
TEAM FOULS: 6 [Team_027 in BONUS]


Team_027
--------------------------------------------------------------------------------
Player                MIN  PTS  REB  AST  TO      FG   FG%      3P   3P%
--------------------------------------------------------------------------------
Tony Doncic            12    7    1    0   0   3/3   100.0     0/0   0.0
Bradley Dosunmu        12    7    1    1   0   3/5    60.0     0/0   0.0
John Russell           12    4    7    0   0   2/4    50.0     0/0   0.0
Scottie Harden         12    3    0    0   0   1/3    33.3     0/0   0.0
Tim Johnson            12    0    0    1   0   0/1     0.0     0/0   0.0

TEAM: FG: 9/16 (56.2%), 3PT: 3/6 (50.0%), REB: 9 (2 off, 7 def), AST: 2, TO: 5
TEAM FOULS: 10 [Team_011 in BONUS]

================================================================================

================================================================================
                       2ND QUARTER - Team_011 vs Team_027                       
================================================================================

[12:00] Team_011 possession (Score: 27-21)
Michael Carter drives and kicks out. Michael Carter attempts a 3Pt. Contested by Scottie Harden (4.8 feet, MAN). Michael Carter misses. Rebound secured by Bradley Dosunmu.

[11:46] Team_027 possession (Score: 27-21)
John Russell makes the Layup and draws the foul on Magic Tatum! And-1! John Russell to the line for 1. [Team fouls: 1] (Magic Tatum: 1 personal fouls)   FT 1/1: GOOD John Russell makes 1/1 from the line.
Score: 27-24

[11:33] Team_011 possession (Score: 27-24)
Trae Tatum attempts a Layup. Contested by John Russell (4.2 feet, ZONE). Trae Tatum misses. Rebound secured by Tony Doncic.

[11:15] Team_027 possession (Score: 27-24)
Tim Johnson attempts a Layup. BLOCKED BY MAGIC TATUM! Ball is loose! Rebound secured by Evan George.

[11:00] Team_011 possession (Score: 27-24)
Magic Tatum attempts a Layup. BLOCKED BY JOHN RUSSELL! Ball goes out off John Russell. Magic Tatum's ball!

[10:46] Team_011 possession (Score: 27-24)
FOUL! Shooting foul on Bradley Dosunmu. Pau Barnes to the line for 2 free throws. [Team fouls: 1] (Bradley Dosunmu: 1 personal fouls)   FT 1/2: GOOD   FT 2/2: MISS Pau Barnes makes 1/2 from the line. FOUL! Loose ball foul on John Russell during the free throw rebound! [Team fouls: 2] No free throws, side out. (John Russell: 1 personal fouls)
Score: 28-24

[10:30] Team_011 possession (Score: 28-24)
Michael Carter attempts a 3Pt. Contested by Scottie Harden (4.9 feet, MAN). Michael Carter misses. Offensive rebound by Pau Barnes! Pau Barnes kicks it out.

[10:14] Team_011 possession (Score: 28-24)
Evan George attempts a Midrange. Contested by John Russell (4.7 feet, MAN). EVAN GEORGE MAKES IT!
Score: 30-24

[10:00] Team_027 possession (Score: 30-24)
Bradley Dosunmu drives and kicks out. Scottie Harden attempts a 3Pt. Contested by Michael Carter (4.7 feet, MAN). SCOTTIE HARDEN MAKES IT! Assist: Tim Johnson
Score: 30-27

[09:43] Team_011 possession (Score: 30-27)
Magic Tatum attempts a Layup. Contested by Tim Johnson (5.6 feet, MAN). Magic Tatum misses. Rebound secured by John Russell.

[09:24] Team_027 possession (Score: 30-27)
FOUL! Holding foul on Pau Barnes. [Team fouls: 2] No free throws, side out. (Pau Barnes: 1 personal fouls)

[09:09] Team_027 possession (Score: 30-27)
Tony Doncic drives and kicks out. Tony Doncic attempts a 3Pt. Contested by Trae Tatum (5.3 feet, MAN). TONY DONCIC MAKES IT! Assist: Tim Johnson
Score: 30-30

[08:55] Team_011 possession (Score: 30-30)
Magic Tatum drives to the basket... Magic Tatum throws a bad pass out of bounds! TURNOVER! (dead ball)

[08:55] Substitution (Team_011): Magic Tatum OUT → Shai Leonard IN (stamina_rule2)

[08:55] Substitution (Team_011): Trae Tatum OUT → De'Aaron George IN (stamina_rule2)

[08:55] Substitution (Team_011): Michael Carter OUT → Tyrese Nowitzki IN (stamina_rule2)

[08:55] Substitution (Team_011): Pau Barnes OUT → Russell Davis IN (stamina_rule2)

[08:55] Substitution (Team_011): Evan George OUT → Pau Towns IN (stamina_rule2)

[08:55] Substitution (Team_027): Tim Johnson OUT → CJ Green IN (stamina_rule2)

[08:55] Substitution (Team_027): Tony Doncic OUT → Dirk Lillard IN (stamina_rule2)

[08:55] Substitution (Team_027): Scottie Harden OUT → Rudy Quickley IN (stamina_rule2)

[08:55] Substitution (Team_027): Bradley Dosunmu OUT → LeBron Russell IN (stamina_rule2)

[08:55] Substitution (Team_027): John Russell OUT → Ben Stewart IN (stamina_rule2)

[08:45] Team_027 possession (Score: 30-30)
Rudy Quickley attempts a 3Pt. Contested by Shai Leonard (4.8 feet, ZONE). Rudy Quickley misses. Rebound secured by Tyrese Nowitzki.

[08:31] Team_011 possession (Score: 30-30)
Pau Towns throws a bad pass! Stolen by Ben Stewart! TURNOVER! (live ball)

[08:16] Team_027 possession (Score: 30-30)
Dirk Lillard attempts a Layup. BLOCKED BY RUSSELL DAVIS! Ball goes out off Russell Davis. Dirk Lillard's ball!

[08:02] Team_027 possession (Score: 30-30)
FOUL! Holding foul on Pau Towns. [Team fouls: 3] No free throws, side out. (Pau Towns: 1 personal fouls)

[07:44] Team_027 possession (Score: 30-30)
LeBron Russell attempts a Midrange. Contested by Russell Davis (3.8 feet, MAN). LeBron Russell misses. FOUL! Loose ball foul on Tyrese Nowitzki during the rebound battle. [Team fouls: 4] No free throws, side out. (Tyrese Nowitzki: 1 personal fouls)

[07:33] Team_027 possession (Score: 30-30)
LeBron Russell attempts a Layup. Contested by Russell Davis (3.8 feet, MAN). LEBRON RUSSELL MAKES IT! Assist: Ben Stewart
Score: 30-32

[07:17] Team_011 possession (Score: 30-32)
Pau Towns drives to the basket... Pau Towns commits a violation (traveling/carry)! TURNOVER! (dead ball)

[07:02] Team_027 possession (Score: 30-32)
FOUL! Holding foul on Shai Leonard. [IN THE BONUS! 5 team fouls] CJ Green to the line for 2 free throws. (Shai Leonard: 1 personal fouls)   FT 1/2: GOOD   FT 2/2: GOOD CJ Green makes 2/2 from the line.
Score: 30-34

[06:50] Team_011 possession (Score: 30-34)
Shai Leonard attempts a 3Pt. Contested by Rudy Quickley (3.4 feet, ZONE). Shai Leonard misses. Rebound secured by Ben Stewart.

[06:35] Team_027 possession (Score: 30-34)
Rudy Quickley attempts a Midrange. Contested by Tyrese Nowitzki (5.1 feet, MAN). Rudy Quickley misses. Rebound secured by Russell Davis.

[06:21] Team_011 possession (Score: 30-34)
Tyrese Nowitzki drives to the basket... Tyrese Nowitzki loses control! Ball rolls out of bounds! TURNOVER! (dead ball)

[06:07] Team_027 possession (Score: 30-34)
LeBron Russell attempts a Midrange. Contested by De'Aaron George (4.8 feet, ZONE). LEBRON RUSSELL MAKES IT!
Score: 30-36

[05:51] Team_011 possession (Score: 30-36)
Shai Leonard attempts a 3Pt. Contested by CJ Green (5.1 feet, MAN). Shai Leonard misses. Rebound secured by LeBron Russell.

[05:37] Team_027 possession (Score: 30-36)
Dirk Lillard attempts a Midrange. Contested by Tyrese Nowitzki (4.7 feet, ZONE). DIRK LILLARD MAKES IT! Assist: LeBron Russell
Score: 30-38

[05:24] Team_011 possession (Score: 30-38)
Russell Davis makes the Midrange and draws the foul on LeBron Russell! And-1! Russell Davis to the line for 1. [Team fouls: 3] (LeBron Russell: 1 personal fouls)   FT 1/1: GOOD Russell Davis makes 1/1 from the line.
Score: 33-38

[05:09] Team_027 possession (Score: 33-38)
LeBron Russell attempts a Midrange. Contested by Shai Leonard (4.3 feet, ZONE). LEBRON RUSSELL MAKES IT!
Score: 33-40

[04:53] Team_011 possession (Score: 33-40)
Russell Davis attempts a 3Pt. Contested by LeBron Russell (5.1 feet, ZONE). Russell Davis misses. Offensive rebound by Tyrese Nowitzki! Tyrese Nowitzki kicks it out.

[04:40] Team_011 possession (Score: 33-40)
Russell Davis attempts a Midrange. Contested by LeBron Russell (5.1 feet, MAN). Russell Davis misses. Rebound secured by Ben Stewart.

[04:23] Team_027 possession (Score: 33-40)
CJ Green drives to the basket... CJ Green loses control! Ball rolls out of bounds! TURNOVER! (dead ball)

[04:05] Team_011 possession (Score: 33-40)
Pau Towns attempts a Midrange. Contested by LeBron Russell (5.4 feet, ZONE). Pau Towns misses. Rebound secured by LeBron Russell.

[03:55] Team_027 possession (Score: 33-40)
Dirk Lillard drives to the basket... Dirk Lillard loses control! Ball rolls out of bounds! TURNOVER! (dead ball)

[03:42] Team_011 possession (Score: 33-40)
Tyrese Nowitzki attempts a 3Pt. Contested by Rudy Quickley (3.3 feet, ZONE). Tyrese Nowitzki misses. Rebound secured by LeBron Russell.

[03:28] Team_027 possession (Score: 33-40)
LeBron Russell attempts a Midrange. Contested by Shai Leonard (4.3 feet, ZONE). LeBron Russell misses. Rebound secured by Pau Towns.

[03:16] Team_011 possession (Score: 33-40)
Tyrese Nowitzki attempts a 3Pt. Contested by Rudy Quickley (3.3 feet, MAN). TYRESE NOWITZKI MAKES IT! Assist: Shai Leonard
Score: 36-40

[03:01] Team_027 possession (Score: 36-40)
LeBron Russell attempts a Layup. Contested by Russell Davis (3.8 feet, MAN). LEBRON RUSSELL MAKES IT! Assist: Dirk Lillard
Score: 36-42

[02:49] Team_011 possession (Score: 36-42)
Russell Davis attempts a 3Pt. Contested by Rudy Quickley (2.9 feet, ZONE). Russell Davis misses. Rebound secured by Ben Stewart.

[02:34] Team_027 possession (Score: 36-42)
Rudy Quickley attempts a Midrange. Contested by Tyrese Nowitzki (5.1 feet, MAN). RUDY QUICKLEY MAKES IT!
Score: 36-44

[02:19] Team_011 possession (Score: 36-44)
FOUL! Offensive foul on Russell Davis! LeBron Russell drew the charge! [Team fouls: 6] (Russell Davis: 1 personal fouls) TURNOVER! (dead ball)

[02:00] Team_027 possession (Score: 36-44)
LeBron Russell attempts a 3Pt. Contested by Shai Leonard (4.3 feet, ZONE). LeBron Russell misses. Offensive rebound by Ben Stewart! Ben Stewart puts it back in!
Score: 36-46

[01:49] Team_011 possession (Score: 36-46)
Russell Davis throws a bad pass out of bounds! TURNOVER! (dead ball)

[01:38] Team_027 possession (Score: 36-46)
Rudy Quickley drives and kicks out. CJ Green attempts a Midrange. Contested by Shai Leonard (4.4 feet, MAN). CJ Green misses. Rebound secured by Pau Towns.

[01:22] Team_011 possession (Score: 36-46)
Shai Leonard drives, picks up CJ Green. Help arrives from Dirk Lillard! Shai Leonard attempts a Dunk. Contested by Dirk Lillard (5.2 feet, MAN). SHAI LEONARD MAKES IT! Assist: Tyrese Nowitzki
Score: 38-46

[01:08] Team_027 possession (Score: 38-46)
Dirk Lillard drives and kicks out. FOUL! Shooting foul on Shai Leonard. CJ Green to the line for 3 free throws. [BONUS: 7 team fouls] (Shai Leonard: 2 personal fouls)   FT 1/3: GOOD   FT 2/3: GOOD   FT 3/3: MISS CJ Green makes 2/3 from the line. Rebound secured by Russell Davis.
Score: 38-48

[00:53] Team_011 possession (Score: 38-48)
Pau Towns throws a bad pass out of bounds! TURNOVER! (dead ball)

[00:34] Team_027 possession (Score: 38-48)
Rudy Quickley attempts a 3Pt. Contested by Tyrese Nowitzki (5.2 feet, MAN). Rudy Quickley misses. Rebound secured by Tyrese Nowitzki.

[00:18] Team_011 possession (Score: 38-48)
Pau Towns drives and kicks out. De'Aaron George attempts a Midrange. Contested by LeBron Russell (5.6 feet, ZONE). De'Aaron George misses. FOUL! Loose ball foul on Ben Stewart during the rebound battle. [Team fouls: 4] No free throws, side out. (Ben Stewart: 1 personal fouls)

[00:03] Team_011 possession (Score: 38-48)
Pau Towns drives, picks up Ben Stewart. Help arrives from Dirk Lillard! Pau Towns attempts a Dunk. Contested by Dirk Lillard (4.8 feet, MAN). Pau Towns misses. Offensive rebound by Pau Towns! Pau Towns kicks it out.

================================================================================
                              2ND QUARTER COMPLETE                              
================================================================================

2ND QUARTER SCORE: Team_011 11, Team_027 27

BOX SCORE:
================================================================================

Team_011
--------------------------------------------------------------------------------
Player                MIN  PTS  REB  AST  TO      FG   FG%      3P   3P%
--------------------------------------------------------------------------------
Tyrese Nowitzki         9    3    3    1   0   1/2    50.0     0/0   0.0
Russell Davis           9    3    2    0   0   1/3    33.3     0/0   0.0
Evan George            15    2    1    0   0   1/1   100.0     0/0   0.0
Shai Leonard            9    2    0    1   0   1/3    33.3     0/0   0.0
Michael Carter         15    0    0    0   0   0/1     0.0     0/0   0.0
Trae Tatum             15    0    0    0   0   0/1     0.0     0/0   0.0
Pau Barnes             15    0    2    0   0   0/0     0.0     0/0   0.0
Magic Tatum            15    0    0    0   0   0/1     0.0     0/0   0.0
Pau Towns               9    0    4    0   0   0/1     0.0     0/0   0.0

TEAM: FG: 4/13 (30.8%), 3PT: 1/5 (20.0%), REB: 12 (5 off, 7 def), AST: 2, TO: 7
TEAM FOULS: 7 [Team_027 in BONUS]


Team_027
--------------------------------------------------------------------------------
Player                MIN  PTS  REB  AST  TO      FG   FG%      3P   3P%
--------------------------------------------------------------------------------
LeBron Russell          9    8    3    1   0   4/5    80.0     0/0   0.0
John Russell           15    3    1    0   0   1/1   100.0     0/0   0.0
Tony Doncic            15    3    1    0   0   1/1   100.0     0/0   0.0
Scottie Harden         15    3    0    0   0   1/1   100.0     0/0   0.0
Rudy Quickley           9    2    0    0   0   1/5    20.0     0/0   0.0
Dirk Lillard            9    2    1    1   0   1/2    50.0     0/0   0.0
Ben Stewart             9    2    4    1   0   1/1   100.0     0/0   0.0
CJ Green                9    2    0    0   0   1/1   100.0     0/0   0.0
Bradley Dosunmu        15    0    1    0   0   0/0     0.0     0/0   0.0
Tim Johnson            15    0    0    2   0   0/1     0.0     0/0   0.0

TEAM: FG: 11/18 (61.1%), 3PT: 1/3 (33.3%), REB: 11 (2 off, 9 def), AST: 5, TO: 2
TEAM FOULS: 4

================================================================================

================================================================================
                       3RD QUARTER - Team_011 vs Team_027                       
================================================================================

[12:00] Team_011 possession (Score: 38-48)
Evan George attempts a Midrange. Contested by Scottie Harden (4.8 feet, ZONE). EVAN GEORGE MAKES IT! Assist: Magic Tatum
Score: 40-48

[11:44] Team_027 possession (Score: 40-48)
Tim Johnson drives to the basket... Tim Johnson loses the ball! Stripped by Magic Tatum! TURNOVER! (live ball)

[11:28] Team_011 possession (Score: 40-48)
Evan George attempts a 3Pt. Contested by Tim Johnson (5.2 feet, ZONE). Evan George misses. Rebound secured by Tony Doncic.

[11:13] Team_027 possession (Score: 40-48)
Tim Johnson attempts a 3Pt. Contested by Magic Tatum (3.7 feet, MAN). Tim Johnson misses. Rebound secured by Evan George.

[11:00] Team_011 possession (Score: 40-48)
Pau Barnes makes the Layup and draws the foul on John Russell! And-1! Pau Barnes to the line for 1. [Team fouls: 1] (John Russell: 1 personal fouls)   FT 1/1: GOOD Pau Barnes makes 1/1 from the line.
Score: 43-48

[10:47] Team_027 possession (Score: 43-48)
John Russell drives, Pau Barnes stays with him. John Russell attempts a Layup. Contested by Pau Barnes (3.7 feet, MAN). John Russell misses. Rebound secured by Evan George.

[10:36] Team_011 possession (Score: 43-48)
Trae Tatum drives and kicks out. Magic Tatum attempts a Midrange. Contested by Bradley Dosunmu (4.4 feet, ZONE). MAGIC TATUM MAKES IT! Assist: Pau Barnes
Score: 45-48

[10:20] Team_027 possession (Score: 45-48)
Tony Doncic attempts a 3Pt. Contested by Trae Tatum (4.7 feet, MAN). Tony Doncic misses. Rebound secured by Evan George.

[10:07] Team_011 possession (Score: 45-48)
Pau Barnes attempts a Layup. Contested by John Russell (4.6 feet, ZONE). PAU BARNES MAKES IT! Assist: Magic Tatum
Score: 47-48

[09:56] Team_027 possession (Score: 47-48)
Bradley Dosunmu attempts a Layup. Contested by Pau Barnes (3.0 feet, ZONE). Bradley Dosunmu misses. FOUL! Loose ball foul on Evan George during the rebound battle. [Team fouls: 1] No free throws, side out. (Evan George: 1 personal fouls)

[09:44] Team_027 possession (Score: 47-48)
Tim Johnson drives to the basket... Tim Johnson throws a bad pass out of bounds! TURNOVER! (dead ball)

[09:28] Team_011 possession (Score: 47-48)
Evan George drives, picks up John Russell. Help arrives from Tony Doncic! Evan George attempts a Dunk. Contested by Tony Doncic (4.2 feet, ZONE). EVAN GEORGE MAKES IT! Assist: Pau Barnes
Score: 49-48

[09:17] Team_027 possession (Score: 49-48)
Bradley Dosunmu attempts a 3Pt. Contested by Pau Barnes (3.0 feet, MAN). Bradley Dosunmu misses. Rebound secured by Pau Barnes.

[09:02] Team_011 possession (Score: 49-48)
Trae Tatum throws a bad pass out of bounds! TURNOVER! (dead ball)

[08:51] Team_027 possession (Score: 49-48)
FOUL! Holding foul on Pau Barnes. [Team fouls: 2] No free throws, side out. (Pau Barnes: 1 personal fouls)

[08:34] Team_027 possession (Score: 49-48)
Tony Doncic attempts a 3Pt. Contested by Trae Tatum (4.7 feet, MAN). Tony Doncic misses. Rebound secured by Pau Barnes.

[08:15] Team_011 possession (Score: 49-48)
Evan George drives and kicks out. Trae Tatum attempts a 3Pt. Contested by Tony Doncic (3.9 feet, MAN). TRAE TATUM MAKES IT! Assist: Magic Tatum
Score: 52-48

[07:56] Team_027 possession (Score: 52-48)
Scottie Harden attempts a 3Pt. Contested by Magic Tatum (3.5 feet, ZONE). Scottie Harden misses. Rebound secured by Pau Barnes.

[07:39] Team_011 possession (Score: 52-48)
Magic Tatum throws a bad pass! Stolen by Tim Johnson! TURNOVER! (live ball)

[07:27] Team_027 possession (Score: 52-48)
Bradley Dosunmu attempts a 3Pt. Contested by Pau Barnes (3.0 feet, MAN). Bradley Dosunmu misses. Offensive rebound by John Russell! John Russell puts it back in!
Score: 52-50

[07:12] Team_011 possession (Score: 52-50)
Michael Carter attempts a 3Pt. Contested by Scottie Harden (4.4 feet, MAN). MICHAEL CARTER MAKES IT! Assist: Pau Barnes
Score: 55-50

[06:56] Team_027 possession (Score: 55-50)
Tony Doncic loses the ball! Stripped by Trae Tatum! TURNOVER! (live ball)

[06:45] Team_011 possession (Score: 55-50)
Michael Carter attempts a Midrange. Contested by Tony Doncic (3.8 feet, ZONE). MICHAEL CARTER MAKES IT!
Score: 57-50

[06:31] Team_027 possession (Score: 57-50)
Bradley Dosunmu attempts a Layup. Contested by Pau Barnes (3.0 feet, MAN). Bradley Dosunmu misses. Rebound secured by Evan George.

[06:17] Team_011 possession (Score: 57-50)
Michael Carter commits a violation (traveling/carry)! TURNOVER! (dead ball)

[06:00] Team_027 possession (Score: 57-50)
Tim Johnson attempts a Layup. BLOCKED BY MAGIC TATUM! Ball is loose! Rebound secured by Evan George.

[05:50] Team_011 possession (Score: 57-50)
Evan George attempts a Midrange. Contested by Bradley Dosunmu (4.7 feet, ZONE). EVAN GEORGE MAKES IT!
Score: 59-50

[05:35] Team_027 possession (Score: 59-50)
Tim Johnson attempts a 3Pt. Contested by Magic Tatum (3.7 feet, ZONE). Tim Johnson misses. Offensive rebound by John Russell! John Russell's putback is no good. Rebound secured by Michael Carter.

[05:21] Team_011 possession (Score: 59-50)
Magic Tatum attempts a 3Pt. Contested by Tim Johnson (5.1 feet, MAN). Magic Tatum misses. Offensive rebound by Evan George! Evan George's putback is no good. Offensive rebound by Evan George! Evan George kicks it out.

[05:08] Team_011 possession (Score: 59-50)
FOUL! Reach-in foul on John Russell during the drive. [Team fouls: 2] No free throws, side out. (John Russell: 2 personal fouls)

[04:50] Team_011 possession (Score: 59-50)
Michael Carter attempts a 3Pt. Contested by Scottie Harden (4.5 feet, MAN). Michael Carter misses. Rebound secured by Bradley Dosunmu.

[04:37] Team_027 possession (Score: 59-50)
Scottie Harden attempts a 3Pt. Contested by Trae Tatum (4.7 feet, ZONE). Scottie Harden misses. Rebound secured by Pau Barnes.

[04:20] Team_011 possession (Score: 59-50)
Evan George attempts a Midrange. Contested by Scottie Harden (4.9 feet, ZONE). EVAN GEORGE MAKES IT!
Score: 61-50

[04:04] Team_027 possession (Score: 61-50)
John Russell drives and kicks out. John Russell attempts a Midrange. Contested by Michael Carter (4.3 feet, ZONE). John Russell misses. Rebound secured by Pau Barnes.

[03:50] Team_011 possession (Score: 61-50)
Trae Tatum drives to the basket... Trae Tatum loses control! Ball rolls out of bounds! TURNOVER! (dead ball)

[03:32] Team_027 possession (Score: 61-50)
FOUL! Holding foul on Pau Barnes. [Team fouls: 3] No free throws, side out. (Pau Barnes: 2 personal fouls)

[03:23] Team_027 possession (Score: 61-50)
Scottie Harden drives to the basket... Scottie Harden loses the ball! Stripped by Michael Carter! TURNOVER! (live ball)

[03:07] Team_011 possession (Score: 61-50)
Pau Barnes makes the Dunk and draws the foul on Tony Doncic! And-1! Pau Barnes to the line for 1. [Team fouls: 3] (Tony Doncic: 1 personal fouls)   FT 1/1: MISS Pau Barnes makes 0/1 from the line. Rebound secured by Bradley Dosunmu.
Score: 63-50

[02:54] Team_027 possession (Score: 63-50)
Tony Doncic attempts a 3Pt. Contested by Trae Tatum (5.0 feet, MAN). TONY DONCIC MAKES IT! Assist: Tim Johnson
Score: 63-53

[02:40] Team_011 possession (Score: 63-53)
Evan George drives and kicks out. Pau Barnes attempts a Midrange. Contested by Scottie Harden (4.8 feet, ZONE). Pau Barnes misses. Offensive rebound by Evan George! Evan George puts it back in!
Score: 65-53

[02:21] Team_027 possession (Score: 65-53)
Bradley Dosunmu drives, picks up Pau Barnes. Help arrives from Magic Tatum! Bradley Dosunmu attempts a Layup. Contested by Magic Tatum (3.4 feet, ZONE). BRADLEY DOSUNMU MAKES IT! Assist: Tony Doncic
Score: 65-55

[02:10] Team_011 possession (Score: 65-55)
FOUL! Offensive foul on Pau Barnes! Bradley Dosunmu drew the charge! [Team fouls: 4] (Pau Barnes: 3 personal fouls) TURNOVER! (dead ball)

[01:58] Team_027 possession (Score: 65-55)
Tony Doncic attempts a 3Pt. Contested by Trae Tatum (5.1 feet, MAN). TONY DONCIC MAKES IT! Assist: Bradley Dosunmu
Score: 65-58

[01:42] Team_011 possession (Score: 65-58)
Evan George drives, picks up John Russell. Help arrives from Tony Doncic! Evan George attempts a Layup. Contested by Tony Doncic (4.6 feet, ZONE). Evan George misses. Rebound secured by Tony Doncic.

[01:29] Team_027 possession (Score: 65-58)
Bradley Dosunmu drives, picks up Pau Barnes. Help arrives from Magic Tatum! Bradley Dosunmu attempts a Layup. Contested by Magic Tatum (3.5 feet, MAN). Bradley Dosunmu misses. Offensive rebound by Bradley Dosunmu! Bradley Dosunmu kicks it out.

[01:12] Team_027 possession (Score: 65-58)
FOUL! Reach-in foul on Trae Tatum during the drive. [IN THE BONUS! 5 team fouls] Tony Doncic to the line for 2 free throws. (Trae Tatum: 1 personal fouls)   FT 1/2: GOOD   FT 2/2: GOOD Tony Doncic makes 2/2 from the line.
Score: 65-60

[01:00] Team_011 possession (Score: 65-60)
FOUL! Reach-in foul on Scottie Harden during the drive. [Team fouls: 4] No free throws, side out. (Scottie Harden: 1 personal fouls)

[00:47] Team_011 possession (Score: 65-60)
Pau Barnes drives and kicks out. Evan George attempts a 3Pt. Contested by Tim Johnson (5.4 feet, ZONE). EVAN GEORGE MAKES IT! Assist: Trae Tatum
Score: 68-60

[00:32] Team_027 possession (Score: 68-60)
Tim Johnson attempts a Layup. BLOCKED BY PAU BARNES! Ball is loose! Rebound secured by Pau Barnes.

[00:19] Team_011 possession (Score: 68-60)
Magic Tatum attempts a Midrange. Contested by Tony Doncic (4.5 feet, ZONE). Magic Tatum misses. Rebound secured by John Russell.

[00:06] Team_027 possession (Score: 68-60)
FOUL! Holding foul on Pau Barnes. [IN THE BONUS! 6 team fouls] John Russell to the line for 2 free throws. (Pau Barnes: 4 personal fouls)   FT 1/2: GOOD   FT 2/2: GOOD John Russell makes 2/2 from the line.
Score: 68-62

================================================================================
                              3RD QUARTER COMPLETE                              
================================================================================

3RD QUARTER SCORE: Team_011 30, Team_027 14

BOX SCORE:
================================================================================

Team_011
--------------------------------------------------------------------------------
Player                MIN  PTS  REB  AST  TO      FG   FG%      3P   3P%
--------------------------------------------------------------------------------
Evan George            27   13    7    0   0   6/8    75.0     0/0   0.0
Pau Barnes             27    5    6    3   0   2/3    66.7     0/0   0.0
Michael Carter         27    5    1    0   0   2/3    66.7     0/0   0.0
Trae Tatum             27    3    0    1   0   1/1   100.0     0/0   0.0
Magic Tatum            27    2    0    3   0   1/2    50.0     0/0   0.0

TEAM: FG: 12/17 (70.6%), 3PT: 1/3 (33.3%), REB: 13 (2 off, 11 def), AST: 7, TO: 5
TEAM FOULS: 6 [Team_027 in BONUS]


Team_027
--------------------------------------------------------------------------------
Player                MIN  PTS  REB  AST  TO      FG   FG%      3P   3P%
--------------------------------------------------------------------------------
Tony Doncic            27    8    2    1   0   3/5    60.0     0/0   0.0
John Russell           27    4    2    0   0   2/4    50.0     0/0   0.0
Bradley Dosunmu        27    2    4    1   0   1/3    33.3     0/0   0.0
Tim Johnson            27    0    0    1   0   0/4     0.0     0/0   0.0
Scottie Harden         27    0    0    0   0   0/2     0.0     0/0   0.0

TEAM: FG: 6/18 (33.3%), 3PT: 3/10 (30.0%), REB: 9 (4 off, 5 def), AST: 3, TO: 4
TEAM FOULS: 4

================================================================================

================================================================================
                       4TH QUARTER - Team_011 vs Team_027                       
================================================================================

[12:00] Team_011 possession (Score: 68-62)
Michael Carter attempts a Layup. BLOCKED BY SCOTTIE HARDEN! Ball is loose! Rebound secured by John Russell.

[11:47] Team_027 possession (Score: 68-62)
Bradley Dosunmu drives and kicks out. Tim Johnson attempts a Midrange. Contested by Magic Tatum (3.8 feet, MAN). Tim Johnson misses. Rebound secured by Michael Carter.

[11:32] Team_011 possession (Score: 68-62)
Evan George makes the Layup and draws the foul on John Russell! And-1! Evan George to the line for 1. [Team fouls: 1] (John Russell: 1 personal fouls)   FT 1/1: GOOD Evan George makes 1/1 from the line.
Score: 71-62

[11:16] Team_027 possession (Score: 71-62)
Tony Doncic attempts a 3Pt. Contested by Magic Tatum (3.9 feet, ZONE). Tony Doncic misses. Rebound secured by Michael Carter.

[10:58] Team_011 possession (Score: 71-62)
Michael Carter attempts a 3Pt. Contested by Tim Johnson (5.2 feet, ZONE). Michael Carter misses. Rebound secured by Bradley Dosunmu.

[10:45] Team_027 possession (Score: 71-62)
Scottie Harden attempts a 3Pt. Contested by Magic Tatum (3.9 feet, ZONE). Scottie Harden misses. Rebound secured by Michael Carter.

[10:31] Team_011 possession (Score: 71-62)
Michael Carter drives to the basket... Michael Carter loses the ball! Stripped by Scottie Harden! TURNOVER! (live ball)

[10:15] Team_027 possession (Score: 71-62)
Scottie Harden loses the ball! Stripped by Michael Carter! TURNOVER! (live ball)

[10:00] Team_011 possession (Score: 71-62)
Trae Tatum attempts a Midrange. Contested by Tony Doncic (4.3 feet, MAN). Trae Tatum misses. Rebound secured by Bradley Dosunmu.

[09:47] Team_027 possession (Score: 71-62)
FOUL! Reach-in foul on Pau Barnes during the drive. [Team fouls: 1] No free throws, side out. (Pau Barnes: 1 personal fouls)

[09:35] Team_027 possession (Score: 71-62)
Bradley Dosunmu throws a bad pass out of bounds! TURNOVER! (dead ball)

[09:35] Substitution (Team_011): Magic Tatum OUT → Shai Leonard IN (stamina_rule2)

[09:35] Substitution (Team_011): Trae Tatum OUT → De'Aaron George IN (stamina_rule2)

[09:35] Substitution (Team_011): Michael Carter OUT → Tyrese Nowitzki IN (stamina_rule2)

[09:35] Substitution (Team_011): Pau Barnes OUT → Russell Davis IN (stamina_rule2)

[09:35] Substitution (Team_011): Evan George OUT → Pau Towns IN (stamina_rule2)

[09:35] Substitution (Team_027): Tim Johnson OUT → CJ Green IN (stamina_rule2)

[09:35] Substitution (Team_027): Tony Doncic OUT → Dirk Lillard IN (stamina_rule2)

[09:35] Substitution (Team_027): Scottie Harden OUT → Rudy Quickley IN (stamina_rule2)

[09:35] Substitution (Team_027): Bradley Dosunmu OUT → LeBron Russell IN (stamina_rule2)

[09:35] Substitution (Team_027): John Russell OUT → Ben Stewart IN (stamina_rule2)

[09:24] Team_011 possession (Score: 71-62)
De'Aaron George attempts a 3Pt. Contested by Rudy Quickley (3.6 feet, ZONE). De'Aaron George misses. Offensive rebound by Pau Towns! Pau Towns kicks it out.

[09:14] Team_011 possession (Score: 71-62)
Russell Davis attempts a Midrange. Contested by Rudy Quickley (2.9 feet, ZONE). Russell Davis misses. Rebound secured by Dirk Lillard.

[09:00] Team_027 possession (Score: 71-62)
Rudy Quickley attempts a 3Pt. Contested by Shai Leonard (4.8 feet, ZONE). RUDY QUICKLEY MAKES IT! Assist: Dirk Lillard
Score: 71-65

[08:48] Team_011 possession (Score: 71-65)
FOUL! Reach-in foul on Ben Stewart during the drive. [Team fouls: 2] No free throws, side out. (Ben Stewart: 1 personal fouls)

[08:33] Team_011 possession (Score: 71-65)
Pau Towns drives and kicks out. FOUL! Shooting foul on Rudy Quickley. Pau Towns to the line for 2 free throws. [Team fouls: 3] (Rudy Quickley: 1 personal fouls)   FT 1/2: GOOD   FT 2/2: GOOD Pau Towns makes 2/2 from the line.
Score: 73-65

[08:19] Team_027 possession (Score: 73-65)
LeBron Russell attempts a 3Pt. Contested by Russell Davis (3.8 feet, MAN). LeBron Russell misses. Rebound secured by Russell Davis.

[08:04] Team_011 possession (Score: 73-65)
Russell Davis attempts a Midrange. Contested by LeBron Russell (5.1 feet, MAN). Russell Davis misses. Rebound secured by LeBron Russell.

[07:49] Team_027 possession (Score: 73-65)
CJ Green attempts a Midrange. Contested by Shai Leonard (4.5 feet, MAN). CJ Green misses. Rebound secured by Tyrese Nowitzki.

[07:37] Team_011 possession (Score: 73-65)
De'Aaron George attempts a 3Pt. Contested by Rudy Quickley (3.6 feet, ZONE). De'Aaron George misses. Rebound secured by Ben Stewart.

[07:20] Team_027 possession (Score: 73-65)
Rudy Quickley attempts a 3Pt. Contested by Tyrese Nowitzki (5.1 feet, MAN). Rudy Quickley misses. Rebound secured by Russell Davis.

[07:05] Team_011 possession (Score: 73-65)
Pau Towns attempts a Midrange. Contested by Ben Stewart (4.6 feet, MAN). Pau Towns misses. Rebound secured by Dirk Lillard.

[06:49] Team_027 possession (Score: 73-65)
Ben Stewart attempts a Midrange. Contested by Russell Davis (3.7 feet, ZONE). BEN STEWART MAKES IT! Assist: Dirk Lillard
Score: 73-67

[06:39] Team_011 possession (Score: 73-67)
Shai Leonard attempts a 3Pt. Contested by Rudy Quickley (3.4 feet, ZONE). SHAI LEONARD MAKES IT! Assist: Tyrese Nowitzki
Score: 76-67

[06:22] Team_027 possession (Score: 76-67)
Dirk Lillard makes the Layup and draws the foul on De'Aaron George! And-1! Dirk Lillard to the line for 1. [Team fouls: 2] (De'Aaron George: 1 personal fouls)   FT 1/1: GOOD Dirk Lillard makes 1/1 from the line.
Score: 76-70

[06:03] Team_011 possession (Score: 76-70)
Tyrese Nowitzki attempts a 3Pt. Contested by Rudy Quickley (3.3 feet, MAN). Tyrese Nowitzki misses. Rebound secured by LeBron Russell.

[05:48] Team_027 possession (Score: 76-70)
CJ Green attempts a 3Pt. Contested by Shai Leonard (4.5 feet, MAN). CJ Green misses. Rebound secured by Pau Towns.

[05:35] Team_011 possession (Score: 76-70)
Russell Davis drives to the basket... Russell Davis throws a bad pass! Stolen by LeBron Russell! TURNOVER! (live ball)

[05:20] Team_027 possession (Score: 76-70)
Dirk Lillard drives to the basket... Dirk Lillard throws a bad pass! Stolen by Russell Davis! TURNOVER! (live ball)

[05:03] Team_011 possession (Score: 76-70)
Russell Davis drives, Ben Stewart stays with him. Russell Davis attempts a Dunk. Contested by Ben Stewart (4.3 feet, ZONE). Russell Davis misses. Offensive rebound by Pau Towns! Pau Towns kicks it out.

[04:44] Team_011 possession (Score: 76-70)
Pau Towns makes the Layup and draws the foul on Ben Stewart! And-1! Pau Towns to the line for 1. [Team fouls: 4] (Ben Stewart: 2 personal fouls)   FT 1/1: GOOD Pau Towns makes 1/1 from the line.
Score: 79-70

[04:34] Team_027 possession (Score: 79-70)
LeBron Russell attempts a 3Pt. Contested by Russell Davis (3.8 feet, MAN). LEBRON RUSSELL MAKES IT! Assist: CJ Green
Score: 79-73

[04:19] Team_011 possession (Score: 79-73)
Pau Towns drives to the basket... FOUL! Offensive foul on Pau Towns! Ben Stewart drew the charge! [Team fouls: 3] (Pau Towns: 1 personal fouls) TURNOVER! (dead ball)

[04:02] Team_027 possession (Score: 79-73)
CJ Green attempts a 3Pt. Contested by Shai Leonard (4.5 feet, MAN). CJ Green misses. Rebound secured by Pau Towns.

[03:48] Team_011 possession (Score: 79-73)
De'Aaron George attempts a 3Pt. Contested by Dirk Lillard (4.4 feet, MAN). De'Aaron George misses. Rebound secured by Dirk Lillard.

[03:36] Team_027 possession (Score: 79-73)
Dirk Lillard attempts a 3Pt. Contested by De'Aaron George (4.8 feet, MAN). Dirk Lillard misses. Offensive rebound by Dirk Lillard! Dirk Lillard kicks it out.

[03:25] Team_027 possession (Score: 79-73)
LeBron Russell attempts a 3Pt. Contested by Shai Leonard (4.3 feet, ZONE). LeBron Russell misses. FOUL! Loose ball foul on Tyrese Nowitzki during the rebound battle. [Team fouls: 4] No free throws, side out. (Tyrese Nowitzki: 1 personal fouls)

[03:11] Team_027 possession (Score: 79-73)
CJ Green attempts a 3Pt. Contested by Shai Leonard (4.5 feet, ZONE). CJ Green misses. Rebound secured by Russell Davis.

[03:01] Team_011 possession (Score: 79-73)
Tyrese Nowitzki attempts a 3Pt. Contested by Rudy Quickley (3.3 feet, ZONE). Tyrese Nowitzki misses. FOUL! Loose ball foul on Dirk Lillard during the rebound battle. [IN THE BONUS! 5 team fouls] Tyrese Nowitzki to the line for 2 free throws. (Dirk Lillard: 1 personal fouls)   FT 1/2: GOOD   FT 2/2: GOOD Tyrese Nowitzki makes 2/2 from the line.
Score: 81-73

[02:48] Team_027 possession (Score: 81-73)
LeBron Russell loses the ball! Stripped by Russell Davis! TURNOVER! (live ball)

[02:31] Team_011 possession (Score: 81-73)
Shai Leonard attempts a Midrange. Contested by Dirk Lillard (4.2 feet, ZONE). Shai Leonard misses. FOUL! Loose ball foul on Dirk Lillard during the rebound battle. [IN THE BONUS! 6 team fouls] Pau Towns to the line for 2 free throws. (Dirk Lillard: 2 personal fouls)   FT 1/2: MISS   FT 2/2: MISS Pau Towns makes 0/2 from the line. Offensive rebound by Tyrese Nowitzki! Tyrese Nowitzki kicks it out.

[02:17] Team_011 possession (Score: 81-73)
De'Aaron George attempts a Midrange. Contested by Dirk Lillard (4.5 feet, ZONE). De'Aaron George misses. Offensive rebound by Pau Towns! Pau Towns kicks it out.

[02:03] Team_011 possession (Score: 81-73)
Shai Leonard attempts a Midrange. Contested by CJ Green (5.2 feet, MAN). SHAI LEONARD MAKES IT!
Score: 83-73

[01:49] Team_027 possession (Score: 83-73)
CJ Green attempts a 3Pt. Contested by Shai Leonard (4.5 feet, ZONE). CJ Green misses. Rebound secured by Pau Towns.

[01:36] Team_011 possession (Score: 83-73)
FOUL! Offensive foul on Pau Towns! Ben Stewart drew the charge! [Team fouls: 5] (Pau Towns: 2 personal fouls) TURNOVER! (dead ball)

[01:20] Team_027 possession (Score: 83-73)
Dirk Lillard makes the 3Pt and draws the foul on De'Aaron George! And-1! Dirk Lillard to the line for 1. [BONUS: 6 team fouls] (De'Aaron George: 2 personal fouls)   FT 1/1: GOOD Dirk Lillard makes 1/1 from the line.
Score: 83-77

[01:09] Team_011 possession (Score: 83-77)
Pau Towns drives to the basket... FOUL! Offensive foul on Pau Towns! Ben Stewart drew the charge! [Team fouls: 7] (Pau Towns: 3 personal fouls) TURNOVER! (dead ball)

[00:54] Team_027 possession (Score: 83-77)
Dirk Lillard attempts a 3Pt. Contested by Shai Leonard (4.5 feet, ZONE). Dirk Lillard misses. Rebound secured by Tyrese Nowitzki.

[00:39] Team_011 possession (Score: 83-77)
Russell Davis attempts a 3Pt. Contested by Rudy Quickley (3.2 feet, ZONE). Russell Davis misses. Offensive rebound by Russell Davis! Russell Davis kicks it out.

[00:26] Team_011 possession (Score: 83-77)
Shai Leonard attempts a 3Pt. Contested by CJ Green (5.3 feet, MAN). Shai Leonard misses. Rebound secured by Dirk Lillard.

[00:14] Team_027 possession (Score: 83-77)
FOUL! Shooting foul on Pau Towns. CJ Green to the line for 2 free throws. [BONUS: 8 team fouls] (Pau Towns: 4 personal fouls)   FT 1/2: GOOD   FT 2/2: GOOD CJ Green makes 2/2 from the line.
Score: 83-79

[00:02] Team_011 possession (Score: 83-79)
Pau Towns attempts a Layup. BLOCKED BY BEN STEWART! Ball is loose! Rebound secured by Dirk Lillard.

================================================================================
                              4TH QUARTER COMPLETE                              
================================================================================

4TH QUARTER SCORE: Team_011 15, Team_027 17

BOX SCORE:
================================================================================

Team_011
--------------------------------------------------------------------------------
Player                MIN  PTS  REB  AST  TO      FG   FG%      3P   3P%
--------------------------------------------------------------------------------
Pau Towns              19    5    6    0   0   2/4    50.0     0/0   0.0
Shai Leonard           19    5    0    0   0   2/3    66.7     0/0   0.0
Evan George            30    3    0    0   0   1/1   100.0     0/0   0.0
Tyrese Nowitzki        19    2    3    1   0   1/2    50.0     0/0   0.0
Michael Carter         30    0    3    0   0   0/2     0.0     0/0   0.0
Trae Tatum             30    0    0    0   0   0/1     0.0     0/0   0.0
Russell Davis          19    0    4    0   0   0/2     0.0     0/0   0.0
De'Aaron George        19    0    0    0   0   0/2     0.0     0/0   0.0

TEAM: FG: 6/17 (35.3%), 3PT: 2/7 (28.6%), REB: 16 (5 off, 11 def), AST: 1, TO: 5
TEAM FOULS: 8 [Team_027 in BONUS]


Team_027
--------------------------------------------------------------------------------
Player                MIN  PTS  REB  AST  TO      FG   FG%      3P   3P%
--------------------------------------------------------------------------------
Dirk Lillard           19    7    7    2   0   2/3    66.7     0/0   0.0
Rudy Quickley          19    3    0    0   0   1/2    50.0     0/0   0.0
LeBron Russell         19    3    2    0   0   1/2    50.0     0/0   0.0
CJ Green               19    2    0    1   0   1/6    16.7     0/0   0.0
Ben Stewart            19    2    1    0   0   1/1   100.0     0/0   0.0
John Russell           30    0    1    0   0   0/0     0.0     0/0   0.0
Bradley Dosunmu        30    0    2    0   0   0/1     0.0     0/0   0.0
Tony Doncic            30    0    0    0   0   0/1     0.0     0/0   0.0
Scottie Harden         30    0    0    0   0   0/1     0.0     0/0   0.0

TEAM: FG: 6/17 (35.3%), 3PT: 3/12 (25.0%), REB: 13 (2 off, 11 def), AST: 3, TO: 4
TEAM FOULS: 6 [Team_011 in BONUS]

================================================================================

================================================================================
                               FULL GAME COMPLETE                               
================================================================================

FINAL SCORE: Team_011 83, Team_027 79

SCORING BY QUARTER:
--------------------------------------------------------------------------------
Team                     Q1     Q2     Q3     Q4    FINAL
--------------------------------------------------------------------------------
Team_011                 27     11     30     15       83
Team_027                 21     27     14     17       79
--------------------------------------------------------------------------------

FULL GAME BOX SCORE:
================================================================================

Team_011
--------------------------------------------------------------------------------
Player                MIN  PTS  REB  AST  TO      FG   FG%      3P   3P%      FT STL BLK
--------------------------------------------------------------------------------
Magic Tatum            30    5    0    3   2   1/5    20.0   0/1     0.0   1/2     1   2
Trae Tatum             30   10    0    2   2   5/8    62.5   1/1   100.0   2/3     1   0
Michael Carter         30    7    5    1   1   4/9    44.4   1/3    33.3   2/2     4   0
Pau Barnes             30   16   16    4   4   6/7    85.7   1/1   100.0   4/6     1   1
Evan George            30   22   13    0   1   9/14   64.3   0/2     0.0   1/1     0   0
Shai Leonard           19    7    0    1   1   3/6    50.0   1/4    25.0   0/0     0   0
De'Aaron George        19    0    0    0   0   0/2     0.0   0/2     0.0   0/0     0   0
Tyrese Nowitzki        19    5    6    2   1   2/4    50.0   2/4    50.0   2/2     0   0
Russell Davis          19    3    6    0   4   1/5    20.0   0/1     0.0   1/1     2   1
Pau Towns              19    5   10    0   4   2/5    40.0   0/0     0.0   3/5     0   0

TEAM: FG: 34/66 (51.5%), 3PT: 6/19 (31.6%), REB: 54 (18 off, 36 def), AST: 13, TO: 20


Team_027
--------------------------------------------------------------------------------
Player                MIN  PTS  REB  AST  TO      FG   FG%      3P   3P%      FT STL BLK
--------------------------------------------------------------------------------
Tim Johnson            30    0    0    4   0   1/7    14.3   1/4    25.0   0/0     1   0
Tony Doncic            30   18    4    1   3   7/10   70.0   2/5    40.0   3/3     0   1
Scottie Harden         30    6    0    0   4   1/6    16.7   1/5    20.0   0/0     2   1
Bradley Dosunmu        30    9    8    2   4   7/12   58.3   2/4    50.0   3/3     0   0
John Russell           30   11   11    0   0   1/5    20.0   0/0     0.0   3/3     0   1
CJ Green               19    4    0    1   0   1/6    16.7   0/4     0.0   6/7     0   0
Dirk Lillard           19    9    8    3   1   3/5    60.0   1/2    50.0   2/2     0   0
Rudy Quickley          19    5    0    0   1   2/7    28.6   1/4    25.0   0/0     0   0
LeBron Russell         19   11    5    1   2   6/8    75.0   2/3    66.7   0/0     1   0
Ben Stewart            19    4    5    1   0   1/1   100.0   0/0     0.0   0/0     1   1

TEAM: FG: 32/69 (46.4%), 3PT: 10/31 (32.3%), REB: 42 (10 off, 32 def), AST: 13, TO: 15

================================================================================
