================================================================================
                        FULL GAME - Team_098 vs Team_026                        
================================================================================

================================================================================
                       1ST QUARTER - Team_098 vs Team_026                       
================================================================================

[12:00] Team_098 possession (Score: 0-0)
FOUL! Shooting foul on Immanuel Hyland. Nikola Rose to the line for 2 free throws. [Team fouls: 1] (Immanuel Hyland: 1 personal fouls)   FT 1/2: GOOD   FT 2/2: MISS Nikola Rose makes 1/2 from the line. Offensive rebound by Pascal Lillard! Pascal Lillard kicks it out.
Score: 1-0

[11:47] Team_098 possession (Score: 1-0)
Malcolm Tatum drives, picks up Kobe Booker. Help arrives from Immanuel Hyland! Malcolm Tatum attempts a Dunk. Contested by Immanuel Hyland (4.4 feet, ZONE). MALCOLM TATUM MAKES IT! Assist: Derrick Durant
Score: 3-0

[11:33] Team_026 possession (Score: 3-0)
Kobe Booker drives to the basket... Kobe Booker throws a bad pass! Stolen by Derrick Durant! TURNOVER! (live ball)

[11:20] Team_098 possession (Score: 3-0)
Derrick Durant drives and kicks out. FOUL! Shooting foul on Kobe Booker. Derrick Durant to the line for 3 free throws. [Team fouls: 2] (Kobe Booker: 1 personal fouls)   FT 1/3: GOOD   FT 2/3: GOOD   FT 3/3: MISS Derrick Durant makes 2/3 from the line. Rebound secured by Immanuel Hyland.
Score: 5-0

[11:06] Team_026 possession (Score: 5-0)
Kobe Booker drives, picks up Pascal Lillard. Help arrives from Nikola Rose! Kobe Booker attempts a Dunk. Contested by Nikola Rose (4.3 feet, ZONE). KOBE BOOKER MAKES IT! Assist: Shaquille Trent
Score: 5-2

[10:51] Team_098 possession (Score: 5-2)
Pascal Lillard drives and kicks out. Nikola Rose attempts a Midrange. Contested by Klay Giddey (5.5 feet, ZONE). Nikola Rose misses. Rebound secured by Immanuel Hyland.

[10:34] Team_026 possession (Score: 5-2)
Kobe Booker throws a bad pass! Stolen by Derrick Durant! TURNOVER! (live ball)

[10:23] Team_098 possession (Score: 5-2)
Pascal Lillard drives, Kobe Booker stays with him. Pascal Lillard attempts a Dunk. Contested by Kobe Booker (4.8 feet, ZONE). Pascal Lillard misses. Rebound secured by Immanuel Hyland.

[10:10] Team_026 possession (Score: 5-2)
Shaquille Trent attempts a 3Pt. Contested by Pascal Lillard (3.9 feet, MAN). SHAQUILLE TRENT MAKES IT! Assist: Klay Giddey
Score: 5-5

[09:55] Team_098 possession (Score: 5-5)
Pascal Lillard drives, picks up Shaquille Trent. Help arrives from Immanuel Hyland! Pascal Lillard attempts a Dunk. Wide open! Immanuel Hyland is 6.2 feet away. [MAN] PASCAL LILLARD MAKES IT! Assist: Malcolm Tatum
Score: 7-5

[09:36] Team_026 possession (Score: 7-5)
Kobe Booker makes the Dunk and draws the foul on Pascal Lillard! And-1! Kobe Booker to the line for 1. [Team fouls: 1] (Pascal Lillard: 1 personal fouls)   FT 1/1: MISS Kobe Booker makes 0/1 from the line. Rebound secured by Nikola Rose.
Score: 7-7

[09:25] Team_098 possession (Score: 7-7)
Blake Murray attempts a 3Pt. Contested by Immanuel Hyland (4.2 feet, ZONE). BLAKE MURRAY MAKES IT!
Score: 10-7

[09:10] Team_026 possession (Score: 10-7)
Immanuel Hyland attempts a 3Pt. Contested by Blake Murray (4.6 feet, ZONE). Immanuel Hyland misses. Rebound secured by Nikola Rose.

[08:58] Team_098 possession (Score: 10-7)
Blake Murray attempts a 3Pt. Contested by Wendell Gasol (4.8 feet, ZONE). Blake Murray misses. Rebound secured by Kobe Booker.

[08:45] Team_026 possession (Score: 10-7)
Immanuel Hyland attempts a 3Pt. Contested by Nikola Rose (3.3 feet, ZONE). IMMANUEL HYLAND MAKES IT! Assist: Wendell Gasol
Score: 10-10

[08:27] Team_098 possession (Score: 10-10)
Blake Murray attempts a Layup. Contested by Kobe Booker (4.4 feet, ZONE). BLAKE MURRAY MAKES IT!
Score: 12-10

[08:15] Team_026 possession (Score: 12-10)
Immanuel Hyland attempts a 3Pt. Contested by Nikola Rose (3.3 feet, ZONE). Immanuel Hyland misses. Rebound secured by Nikola Rose.

[08:00] Team_098 possession (Score: 12-10)
Derrick Durant attempts a Midrange. BLOCKED BY KOBE BOOKER! Ball is loose! Rebound secured by Kobe Booker.

[07:46] Team_026 possession (Score: 12-10)
Klay Giddey attempts a Layup. Contested by Pascal Lillard (4.0 feet, ZONE). Klay Giddey misses. Rebound secured by Pascal Lillard.

[07:32] Team_098 possession (Score: 12-10)
Malcolm Tatum attempts a Layup. Contested by Kobe Booker (4.4 feet, ZONE). Malcolm Tatum misses. Rebound secured by Immanuel Hyland.

[07:18] Team_026 possession (Score: 12-10)
Wendell Gasol attempts a Midrange. Contested by Malcolm Tatum (4.3 feet, MAN). Wendell Gasol misses. Rebound secured by Pascal Lillard.

[07:06] Team_098 possession (Score: 12-10)
Blake Murray attempts a 3Pt. Contested by Immanuel Hyland (4.2 feet, ZONE). Blake Murray misses. Offensive rebound by Derrick Durant! Derrick Durant puts it back in!
Score: 14-10

[06:51] Team_026 possession (Score: 14-10)
Klay Giddey attempts a Layup. BLOCKED BY PASCAL LILLARD! Ball is loose! Offensive rebound by Kobe Booker! Kobe Booker kicks it out.

[06:41] Team_026 possession (Score: 14-10)
Kobe Booker attempts a Midrange. Contested by Nikola Rose (3.4 feet, ZONE). Kobe Booker misses. Rebound secured by Nikola Rose.

[06:29] Team_098 possession (Score: 14-10)
Nikola Rose attempts a 3Pt. Contested by Immanuel Hyland (4.3 feet, MAN). Nikola Rose misses. Rebound secured by Kobe Booker.

[06:13] Team_026 possession (Score: 14-10)
FOUL! Reach-in foul on Blake Murray during the drive. [Team fouls: 3] No free throws, side out. (Blake Murray: 1 personal fouls)

[05:58] Team_026 possession (Score: 14-10)
FOUL! Holding foul on Malcolm Tatum. [Team fouls: 4] No free throws, side out. (Malcolm Tatum: 1 personal fouls)

[05:38] Team_026 possession (Score: 14-10)
FOUL! Shooting foul on Nikola Rose. Wendell Gasol to the line for 3 free throws. [BONUS: 5 team fouls] (Nikola Rose: 1 personal fouls)   FT 1/3: GOOD   FT 2/3: GOOD   FT 3/3: GOOD Wendell Gasol makes 3/3 from the line.
Score: 14-13

[05:22] Team_098 possession (Score: 14-13)
Derrick Durant drives and kicks out. Pascal Lillard attempts a 3Pt. Contested by Shaquille Trent (5.6 feet, MAN). Pascal Lillard misses. Rebound secured by Kobe Booker.

[05:04] Team_026 possession (Score: 14-13)
Wendell Gasol attempts a 3Pt. Contested by Malcolm Tatum (4.3 feet, MAN). WENDELL GASOL MAKES IT! Assist: Shaquille Trent
Score: 14-16

[04:50] Team_098 possession (Score: 14-16)
Pascal Lillard attempts a Midrange. Wide open! Shaquille Trent is 6.2 feet away. [MAN] Pascal Lillard misses. Rebound secured by Shaquille Trent.

[04:37] Team_026 possession (Score: 14-16)
Shaquille Trent attempts a 3Pt. Contested by Nikola Rose (3.1 feet, ZONE). Shaquille Trent misses. Rebound secured by Pascal Lillard.

[04:25] Team_098 possession (Score: 14-16)
FOUL! Holding foul on Kobe Booker. [Team fouls: 3] No free throws, side out. (Kobe Booker: 2 personal fouls)

[04:10] Team_098 possession (Score: 14-16)
Malcolm Tatum attempts a Layup. Contested by Wendell Gasol (4.9 feet, MAN). MALCOLM TATUM MAKES IT! Assist: Nikola Rose
Score: 16-16

[04:00] Team_026 possession (Score: 16-16)
Immanuel Hyland attempts a Layup. BLOCKED BY BLAKE MURRAY! Ball is loose! Offensive rebound by Shaquille Trent! Shaquille Trent kicks it out.

[03:46] Team_026 possession (Score: 16-16)
Immanuel Hyland drives, Nikola Rose stays with him. Immanuel Hyland attempts a Dunk. Contested by Nikola Rose (3.4 feet, MAN). IMMANUEL HYLAND MAKES IT! Assist: Shaquille Trent
Score: 16-18

[03:28] Team_098 possession (Score: 16-18)
Nikola Rose drives and kicks out. FOUL! Shooting foul on Kobe Booker. Derrick Durant to the line for 3 free throws. [Team fouls: 4] (Kobe Booker: 3 personal fouls)   FT 1/3: GOOD   FT 2/3: MISS   FT 3/3: GOOD Derrick Durant makes 2/3 from the line.
Score: 18-18

[03:15] Team_026 possession (Score: 18-18)
Klay Giddey attempts a 3Pt. Contested by Nikola Rose (3.3 feet, ZONE). KLAY GIDDEY MAKES IT! Assist: Kobe Booker
Score: 18-21

[02:59] Team_098 possession (Score: 18-21)
Pascal Lillard drives, picks up Kobe Booker. Help arrives from Immanuel Hyland! Pascal Lillard attempts a Dunk. Contested by Immanuel Hyland (5.0 feet, ZONE). Pascal Lillard misses. Offensive rebound by Derrick Durant! Derrick Durant's putback is no good. Offensive rebound by Pascal Lillard! Pascal Lillard kicks it out.

[02:42] Team_098 possession (Score: 18-21)
FOUL! Shooting foul on Kobe Booker. Derrick Durant to the line for 2 free throws. [BONUS: 5 team fouls] (Kobe Booker: 4 personal fouls)   FT 1/2: GOOD   FT 2/2: MISS Derrick Durant makes 1/2 from the line. Rebound secured by Immanuel Hyland.
Score: 19-21

[02:24] Team_026 possession (Score: 19-21)
Kobe Booker attempts a Midrange. Contested by Blake Murray (5.0 feet, ZONE). Kobe Booker misses. Rebound secured by Nikola Rose.

[02:11] Team_098 possession (Score: 19-21)
Nikola Rose attempts a Midrange. Wide open! Shaquille Trent is 6.2 feet away. [ZONE] Nikola Rose misses. Rebound secured by Immanuel Hyland.

[01:52] Team_026 possession (Score: 19-21)
Immanuel Hyland drives to the basket... Immanuel Hyland throws a bad pass out of bounds! TURNOVER! (dead ball)

[01:52] Substitution (Team_098): Malcolm Tatum OUT → Tracy Rose IN (stamina_rule2)

[01:52] Substitution (Team_098): Nikola Rose OUT → Dirk McCollum IN (stamina_rule2)

[01:52] Substitution (Team_098): Blake Murray OUT → Kristaps Iverson IN (stamina_rule2)

[01:52] Substitution (Team_098): Pascal Lillard OUT → Manu Jordan IN (stamina_rule2)

[01:52] Substitution (Team_098): Derrick Durant OUT → Russell McGrady IN (stamina_rule2)

[01:52] Substitution (Team_026): Wendell Gasol OUT → Myles Tatum IN (stamina_rule2)

[01:52] Substitution (Team_026): Immanuel Hyland OUT → Karl Barrett IN (stamina_rule2)

[01:52] Substitution (Team_026): Klay Giddey OUT → Josh Simons IN (stamina_rule2)

[01:52] Substitution (Team_026): Shaquille Trent OUT → Damian Doncic IN (stamina_rule2)

[01:52] Substitution (Team_026): Kobe Booker OUT → Dirk Randle IN (stamina_rule2)

[01:36] Team_098 possession (Score: 19-21)
Dirk McCollum drives to the basket... Dirk McCollum loses the ball! Stripped by Karl Barrett! TURNOVER! (live ball)

[01:19] Team_026 possession (Score: 19-21)
Myles Tatum attempts a 3Pt. Contested by Tracy Rose (3.1 feet, MAN). Myles Tatum misses. Rebound secured by Russell McGrady.

[01:04] Team_098 possession (Score: 19-21)
Dirk McCollum drives, picks up Karl Barrett. Help arrives from Josh Simons! Dirk McCollum attempts a Dunk. Contested by Josh Simons (4.8 feet, MAN). DIRK MCCOLLUM MAKES IT! Assist: Tracy Rose
Score: 21-21

[00:50] Team_026 possession (Score: 21-21)
Josh Simons attempts a 3Pt. Contested by Kristaps Iverson (3.8 feet, MAN). Josh Simons misses. Rebound secured by Kristaps Iverson.

[00:31] Team_098 possession (Score: 21-21)
Dirk McCollum attempts a 3Pt. Contested by Karl Barrett (4.8 feet, MAN). Dirk McCollum misses. Rebound secured by Josh Simons.

[00:20] Team_026 possession (Score: 21-21)
FOUL! Holding foul on Dirk McCollum. [IN THE BONUS! 7 team fouls] Karl Barrett to the line for 2 free throws. (Dirk McCollum: 1 personal fouls)   FT 1/2: GOOD   FT 2/2: GOOD Karl Barrett makes 2/2 from the line.
Score: 21-23

[00:05] Team_098 possession (Score: 21-23)
Dirk McCollum attempts a 3Pt. Contested by Karl Barrett (4.8 feet, MAN). Dirk McCollum misses. Rebound secured by Josh Simons.

================================================================================
                              1ST QUARTER COMPLETE                              
================================================================================

1ST QUARTER SCORE: Team_098 21, Team_026 23

BOX SCORE:
================================================================================

Team_098
--------------------------------------------------------------------------------
Player                MIN  PTS  REB  AST  TO      FG   FG%      3P   3P%
--------------------------------------------------------------------------------
Blake Murray           10    5    0    0   0   2/3    66.7     0/0   0.0
Malcolm Tatum          10    4    0    1   0   2/3    66.7     0/0   0.0
Derrick Durant         10    4    1    1   0   2/6    33.3     0/0   0.0
Pascal Lillard         10    2    5    0   0   1/4    25.0     0/0   0.0
Dirk McCollum           2    2    0    0   0   1/3    33.3     0/0   0.0
Nikola Rose            10    0    5    1   0   0/2     0.0     0/0   0.0
Russell McGrady         2    0    1    0   0   0/0     0.0     0/0   0.0
Tracy Rose              2    0    0    1   0   0/0     0.0     0/0   0.0
Kristaps Iverson        2    0    1    0   0   0/0     0.0     0/0   0.0

TEAM: FG: 8/21 (38.1%), 3PT: 2/6 (33.3%), REB: 13 (3 off, 10 def), AST: 4, TO: 1
TEAM FOULS: 7 [Team_026 in BONUS]


Team_026
--------------------------------------------------------------------------------
Player                MIN  PTS  REB  AST  TO      FG   FG%      3P   3P%
--------------------------------------------------------------------------------
Wendell Gasol          10    6    0    1   0   2/3    66.7     0/0   0.0
Immanuel Hyland        10    5    6    0   0   2/4    50.0     0/0   0.0
Shaquille Trent        10    3    2    3   0   1/2    50.0     0/0   0.0
Klay Giddey            10    3    0    1   0   1/2    50.0     0/0   0.0
Kobe Booker            10    2    5    1   0   1/4    25.0     0/0   0.0
Karl Barrett            2    2    0    0   0   1/1   100.0     0/0   0.0
Myles Tatum             2    0    0    0   0   0/1     0.0     0/0   0.0
Josh Simons             2    0    2    0   0   0/1     0.0     0/0   0.0

TEAM: FG: 8/18 (44.4%), 3PT: 5/10 (50.0%), REB: 15 (2 off, 13 def), AST: 6, TO: 3
TEAM FOULS: 5 [Team_098 in BONUS]

================================================================================

================================================================================
                       2ND QUARTER - Team_098 vs Team_026                       
================================================================================

[12:00] Team_098 possession (Score: 21-23)
Derrick Durant drives to the basket... Derrick Durant loses control! Ball rolls out of bounds! TURNOVER! (dead ball)

[11:46] Team_026 possession (Score: 21-23)
FOUL! Shooting foul on Nikola Rose. Wendell Gasol to the line for 2 free throws. [Team fouls: 1] (Nikola Rose: 1 personal fouls)   FT 1/2: GOOD   FT 2/2: GOOD Wendell Gasol makes 2/2 from the line.
Score: 21-25

[11:29] Team_098 possession (Score: 21-25)
Malcolm Tatum drives and kicks out. Pascal Lillard attempts a Midrange. Contested by Shaquille Trent (5.7 feet, MAN). PASCAL LILLARD MAKES IT!
Score: 23-25

[11:16] Team_026 possession (Score: 23-25)
Shaquille Trent drives to the basket... Shaquille Trent loses the ball! Stripped by Pascal Lillard! TURNOVER! (live ball)

[11:01] Team_098 possession (Score: 23-25)
Nikola Rose attempts a Layup. Contested by Immanuel Hyland (4.5 feet, MAN). NIKOLA ROSE MAKES IT! Assist: Blake Murray
Score: 25-25

[10:51] Team_026 possession (Score: 25-25)
Wendell Gasol attempts a 3Pt. Contested by Malcolm Tatum (4.4 feet, MAN). WENDELL GASOL MAKES IT! Assist: Kobe Booker
Score: 25-28

[10:34] Team_098 possession (Score: 25-28)
Blake Murray makes the Layup and draws the foul on Klay Giddey! And-1! Blake Murray to the line for 1. [Team fouls: 1] (Klay Giddey: 1 personal fouls)   FT 1/1: GOOD Blake Murray makes 1/1 from the line.
Score: 28-28

[10:18] Team_026 possession (Score: 28-28)
Shaquille Trent attempts a 3Pt. Contested by Nikola Rose (3.2 feet, ZONE). Shaquille Trent misses. Rebound secured by Pascal Lillard.

[10:03] Team_098 possession (Score: 28-28)
Nikola Rose attempts a Midrange. Contested by Immanuel Hyland (4.6 feet, ZONE). Nikola Rose misses. Rebound secured by Immanuel Hyland.

[09:48] Team_026 possession (Score: 28-28)
Klay Giddey attempts a 3Pt. Contested by Blake Murray (4.7 feet, MAN). KLAY GIDDEY MAKES IT! Assist: Kobe Booker
Score: 28-31

[09:33] Team_098 possession (Score: 28-31)
Pascal Lillard attempts a Midrange. Wide open! Shaquille Trent is 6.4 feet away. [MAN] PASCAL LILLARD MAKES IT!
Score: 30-31

[09:19] Team_026 possession (Score: 30-31)
Kobe Booker attempts a Midrange. Contested by Derrick Durant (4.9 feet, MAN). KOBE BOOKER MAKES IT!
Score: 30-33

[09:02] Team_098 possession (Score: 30-33)
Malcolm Tatum attempts a 3Pt. Contested by Immanuel Hyland (4.6 feet, ZONE). Malcolm Tatum misses. Offensive rebound by Derrick Durant! Derrick Durant puts it back in!
Score: 32-33

[08:52] Team_026 possession (Score: 32-33)
Wendell Gasol drives and kicks out. Wendell Gasol attempts a Midrange. Contested by Malcolm Tatum (4.3 feet, MAN). Wendell Gasol misses. Rebound secured by Pascal Lillard.

[08:40] Team_098 possession (Score: 32-33)
Malcolm Tatum attempts a Midrange. Contested by Wendell Gasol (5.1 feet, MAN). Malcolm Tatum misses. Rebound secured by Immanuel Hyland.

[08:23] Team_026 possession (Score: 32-33)
Shaquille Trent drives and kicks out. Shaquille Trent attempts a Midrange. Contested by Pascal Lillard (4.5 feet, MAN). Shaquille Trent misses. Rebound secured by Pascal Lillard.

[08:04] Team_098 possession (Score: 32-33)
Malcolm Tatum attempts a 3Pt. Contested by Wendell Gasol (5.1 feet, MAN). Malcolm Tatum misses. Rebound secured by Shaquille Trent.

[07:49] Team_026 possession (Score: 32-33)
FOUL! Shooting foul on Pascal Lillard. Wendell Gasol to the line for 2 free throws. [Team fouls: 2] (Pascal Lillard: 1 personal fouls)   FT 1/2: GOOD   FT 2/2: GOOD Wendell Gasol makes 2/2 from the line.
Score: 32-35

[07:32] Team_098 possession (Score: 32-35)
Nikola Rose attempts a 3Pt. Contested by Immanuel Hyland (4.9 feet, MAN). NIKOLA ROSE MAKES IT! Assist: Blake Murray
Score: 35-35

[07:20] Team_026 possession (Score: 35-35)
Kobe Booker attempts a Midrange. Contested by Derrick Durant (5.2 feet, MAN). KOBE BOOKER MAKES IT! Assist: Immanuel Hyland
Score: 35-37

[07:11] Team_098 possession (Score: 35-37)
Nikola Rose loses the ball! Stripped by Immanuel Hyland! TURNOVER! (live ball)

[06:57] Team_026 possession (Score: 35-37)
Immanuel Hyland attempts a Layup. Contested by Nikola Rose (3.8 feet, MAN). IMMANUEL HYLAND MAKES IT!
Score: 35-39

[06:41] Team_098 possession (Score: 35-39)
Derrick Durant drives, Kobe Booker stays with him. Derrick Durant attempts a Dunk. Contested by Kobe Booker (5.0 feet, MAN). DERRICK DURANT MAKES IT!
Score: 37-39

[06:26] Team_026 possession (Score: 37-39)
FOUL! Shooting foul on Blake Murray. Klay Giddey to the line for 3 free throws. [Team fouls: 3] (Blake Murray: 1 personal fouls)   FT 1/3: GOOD   FT 2/3: GOOD   FT 3/3: GOOD Klay Giddey makes 3/3 from the line.
Score: 37-42

[06:12] Team_098 possession (Score: 37-42)
FOUL! Reach-in foul on Immanuel Hyland during the drive. [Team fouls: 2] No free throws, side out. (Immanuel Hyland: 1 personal fouls)

[05:55] Team_098 possession (Score: 37-42)
Malcolm Tatum attempts a 3Pt. Contested by Immanuel Hyland (5.0 feet, ZONE). Malcolm Tatum misses. Rebound secured by Shaquille Trent.

[05:44] Team_026 possession (Score: 37-42)
Klay Giddey attempts a 3Pt. Contested by Blake Murray (5.2 feet, MAN). Klay Giddey misses. FOUL! Loose ball foul on Pascal Lillard during the rebound battle. [Team fouls: 4] No free throws, side out. (Pascal Lillard: 2 personal fouls)

[05:31] Team_026 possession (Score: 37-42)
Wendell Gasol drives and kicks out. Klay Giddey attempts a 3Pt. Contested by Blake Murray (5.4 feet, MAN). Klay Giddey misses. Rebound secured by Nikola Rose.

[05:20] Team_098 possession (Score: 37-42)
Blake Murray drives and kicks out. Derrick Durant attempts a Midrange. Contested by Immanuel Hyland (5.0 feet, ZONE). DERRICK DURANT MAKES IT!
Score: 39-42

[05:08] Team_026 possession (Score: 39-42)
Kobe Booker attempts a Midrange. Contested by Derrick Durant (5.5 feet, MAN). Kobe Booker misses. Offensive rebound by Kobe Booker! Kobe Booker kicks it out.

[04:56] Team_026 possession (Score: 39-42)
Immanuel Hyland attempts a 3Pt. Contested by Nikola Rose (4.1 feet, ZONE). IMMANUEL HYLAND MAKES IT! Assist: Klay Giddey
Score: 39-45

[04:44] Team_098 possession (Score: 39-45)
FOUL! Holding foul on Klay Giddey. [Team fouls: 3] No free throws, side out. (Klay Giddey: 2 personal fouls)

[04:32] Team_098 possession (Score: 39-45)
Nikola Rose attempts a 3Pt. Contested by Immanuel Hyland (5.3 feet, MAN). Nikola Rose misses. Rebound secured by Shaquille Trent.

[04:20] Team_026 possession (Score: 39-45)
FOUL! Holding foul on Blake Murray. [IN THE BONUS! 5 team fouls] Klay Giddey to the line for 2 free throws. (Blake Murray: 2 personal fouls)   FT 1/2: GOOD   FT 2/2: GOOD Klay Giddey makes 2/2 from the line.
Score: 39-47

[04:09] Team_098 possession (Score: 39-47)
Pascal Lillard attempts a 3Pt. Contested by Immanuel Hyland (5.6 feet, ZONE). Pascal Lillard misses. FOUL! Loose ball foul on Immanuel Hyland during the rebound battle. [Team fouls: 4] No free throws, side out. (Immanuel Hyland: 2 personal fouls)

[03:54] Team_098 possession (Score: 39-47)
Nikola Rose attempts a 3Pt. Contested by Immanuel Hyland (5.4 feet, ZONE). NIKOLA ROSE MAKES IT! Assist: Pascal Lillard
Score: 42-47

[03:44] Team_026 possession (Score: 42-47)
Shaquille Trent drives, Pascal Lillard stays with him. Shaquille Trent attempts a Dunk. Contested by Pascal Lillard (4.9 feet, MAN). SHAQUILLE TRENT MAKES IT! Assist: Immanuel Hyland
Score: 42-49

[03:30] Team_098 possession (Score: 42-49)
Derrick Durant drives, Kobe Booker stays with him. Derrick Durant attempts a Layup. Contested by Kobe Booker (5.5 feet, ZONE). DERRICK DURANT MAKES IT! Assist: Nikola Rose
Score: 44-49

[03:20] Team_026 possession (Score: 44-49)
Klay Giddey makes the Layup and draws the foul on Pascal Lillard! And-1! Klay Giddey to the line for 1. [BONUS: 6 team fouls] (Pascal Lillard: 3 personal fouls)   FT 1/1: GOOD Klay Giddey makes 1/1 from the line.
Score: 44-52

[03:07] Team_098 possession (Score: 44-52)
Malcolm Tatum drives, Wendell Gasol stays with him. Malcolm Tatum attempts a Dunk. Contested by Wendell Gasol (5.8 feet, MAN). MALCOLM TATUM MAKES IT! Assist: Pascal Lillard
Score: 46-52

[02:54] Team_026 possession (Score: 46-52)
Kobe Booker drives to the basket... FOUL! Offensive foul on Kobe Booker! Pascal Lillard drew the charge! [Team fouls: 5] (Kobe Booker: 1 personal fouls) TURNOVER! (dead ball)

[02:41] Team_098 possession (Score: 46-52)
Blake Murray attempts a Layup. BLOCKED BY IMMANUEL HYLAND! Ball deflects out of bounds off Blake Murray.

[02:24] Team_026 possession (Score: 46-52)
FOUL! Reach-in foul on Pascal Lillard during the drive. [IN THE BONUS! 7 team fouls] Shaquille Trent to the line for 2 free throws. (Pascal Lillard: 4 personal fouls)   FT 1/2: GOOD   FT 2/2: GOOD Shaquille Trent makes 2/2 from the line.
Score: 46-54

[02:10] Team_098 possession (Score: 46-54)
Blake Murray drives, Klay Giddey stays with him. Blake Murray attempts a Layup. Wide open! Klay Giddey is 6.7 feet away. [MAN] Blake Murray misses. Offensive rebound by Pascal Lillard! Pascal Lillard kicks it out.

[01:53] Team_098 possession (Score: 46-54)
Nikola Rose attempts a Layup. Contested by Immanuel Hyland (5.8 feet, MAN). NIKOLA ROSE MAKES IT! Assist: Malcolm Tatum
Score: 48-54

[01:42] Team_026 possession (Score: 48-54)
Wendell Gasol attempts a Midrange. Contested by Malcolm Tatum (5.6 feet, MAN). Wendell Gasol misses. Rebound secured by Pascal Lillard.

[01:27] Team_098 possession (Score: 48-54)
Malcolm Tatum attempts a Midrange. Contested by Immanuel Hyland (5.7 feet, ZONE). MALCOLM TATUM MAKES IT! Assist: Pascal Lillard
Score: 50-54

[01:15] Team_026 possession (Score: 50-54)
Immanuel Hyland attempts a 3Pt. Wide open! Blake Murray is 6.1 feet away. [ZONE] Immanuel Hyland misses. Rebound secured by Derrick Durant.

[00:57] Team_098 possession (Score: 50-54)
Malcolm Tatum attempts a 3Pt. Contested by Immanuel Hyland (5.8 feet, ZONE). Malcolm Tatum misses. Rebound secured by Shaquille Trent.

[00:41] Team_026 possession (Score: 50-54)
Kobe Booker attempts a Midrange. Contested by Pascal Lillard (5.7 feet, ZONE). KOBE BOOKER MAKES IT!
Score: 50-56

[00:24] Team_098 possession (Score: 50-56)
Pascal Lillard drives, picks up Shaquille Trent. Help arrives from Immanuel Hyland! Pascal Lillard attempts a Dunk. Wide open! Immanuel Hyland is 7.4 feet away. [MAN] Pascal Lillard misses. Rebound secured by Kobe Booker.

[00:08] Team_026 possession (Score: 50-56)
Immanuel Hyland attempts a 3Pt. Contested by Nikola Rose (4.9 feet, ZONE). Immanuel Hyland misses. Rebound secured by Derrick Durant.

================================================================================
                              2ND QUARTER COMPLETE                              
================================================================================

2ND QUARTER SCORE: Team_098 29, Team_026 33

BOX SCORE:
================================================================================

Team_098
--------------------------------------------------------------------------------
Player                MIN  PTS  REB  AST  TO      FG   FG%      3P   3P%
--------------------------------------------------------------------------------
Nikola Rose            22   10    1    1   0   4/6    66.7     0/0   0.0
Derrick Durant         22    8    4    0   0   4/4   100.0     0/0   0.0
Pascal Lillard         22    4    5    3   0   2/3    66.7     0/0   0.0
Malcolm Tatum          22    4    0    1   0   2/6    33.3     0/0   0.0
Blake Murray           22    3    0    2   0   1/2    50.0     0/0   0.0

TEAM: FG: 13/21 (61.9%), 3PT: 3/7 (42.9%), REB: 10 (3 off, 7 def), AST: 7, TO: 2
TEAM FOULS: 7 [Team_026 in BONUS]


Team_026
--------------------------------------------------------------------------------
Player                MIN  PTS  REB  AST  TO      FG   FG%      3P   3P%
--------------------------------------------------------------------------------
Klay Giddey            22   11    0    1   0   4/4   100.0     0/0   0.0
Wendell Gasol          22    7    0    0   0   3/6    50.0     0/0   0.0
Kobe Booker            22    6    3    2   0   3/3   100.0     0/0   0.0
Immanuel Hyland        22    5    2    2   0   2/4    50.0     0/0   0.0
Shaquille Trent        22    4    4    0   0   2/4    50.0     0/0   0.0

TEAM: FG: 14/21 (66.7%), 3PT: 4/7 (57.1%), REB: 9 (2 off, 7 def), AST: 5, TO: 2
TEAM FOULS: 5 [Team_098 in BONUS]

================================================================================

================================================================================
                       3RD QUARTER - Team_098 vs Team_026                       
================================================================================

[12:00] Team_098 possession (Score: 50-56)
Blake Murray attempts a 3Pt. Contested by Immanuel Hyland (4.2 feet, ZONE). Blake Murray misses. Rebound secured by Shaquille Trent.

[11:46] Team_026 possession (Score: 50-56)
Klay Giddey attempts a Midrange. Contested by Blake Murray (4.4 feet, MAN). Klay Giddey misses. Rebound secured by Derrick Durant.

[11:32] Team_098 possession (Score: 50-56)
Blake Murray drives and kicks out. Nikola Rose attempts a 3Pt. Contested by Immanuel Hyland (4.0 feet, ZONE). Nikola Rose misses. Rebound secured by Immanuel Hyland.

[11:17] Team_026 possession (Score: 50-56)
Kobe Booker attempts a Layup. Contested by Derrick Durant (4.6 feet, MAN). KOBE BOOKER MAKES IT! Assist: Wendell Gasol
Score: 50-58

[11:04] Team_098 possession (Score: 50-58)
Blake Murray drives and kicks out. Malcolm Tatum attempts a Midrange. Contested by Klay Giddey (5.5 feet, ZONE). MALCOLM TATUM MAKES IT! Assist: Pascal Lillard
Score: 52-58

[10:52] Team_026 possession (Score: 52-58)
Kobe Booker attempts a Midrange. Contested by Blake Murray (4.7 feet, ZONE). Kobe Booker misses. Rebound secured by Pascal Lillard.

[10:34] Team_098 possession (Score: 52-58)
Derrick Durant drives, picks up Shaquille Trent. Help arrives from Immanuel Hyland! Derrick Durant attempts a Dunk. Contested by Immanuel Hyland (5.8 feet, ZONE). DERRICK DURANT MAKES IT!
Score: 54-58

[10:17] Team_026 possession (Score: 54-58)
FOUL! Shooting foul on Nikola Rose. Shaquille Trent to the line for 2 free throws. [Team fouls: 1] (Nikola Rose: 1 personal fouls)   FT 1/2: GOOD   FT 2/2: GOOD Shaquille Trent makes 2/2 from the line.
Score: 54-60

[10:07] Team_098 possession (Score: 54-60)
FOUL! Offensive foul on Nikola Rose! Immanuel Hyland drew the charge! [Team fouls: 2] (Nikola Rose: 2 personal fouls) TURNOVER! (dead ball)

[09:55] Team_026 possession (Score: 54-60)
FOUL! Holding foul on Blake Murray. [Team fouls: 3] No free throws, side out. (Blake Murray: 1 personal fouls)

[09:41] Team_026 possession (Score: 54-60)
Wendell Gasol attempts a 3Pt. Contested by Malcolm Tatum (4.3 feet, MAN). WENDELL GASOL MAKES IT! Assist: Kobe Booker
Score: 54-63

[09:27] Team_098 possession (Score: 54-63)
Pascal Lillard attempts a Layup. Wide open! Shaquille Trent is 6.2 feet away. [MAN] PASCAL LILLARD MAKES IT! Assist: Nikola Rose
Score: 56-63

[09:13] Team_026 possession (Score: 56-63)
Shaquille Trent drives, Pascal Lillard stays with him. Shaquille Trent attempts a Dunk. Contested by Pascal Lillard (3.9 feet, MAN). Shaquille Trent misses. Rebound secured by Nikola Rose.

[08:59] Team_098 possession (Score: 56-63)
Pascal Lillard attempts a Layup. Contested by Kobe Booker (4.8 feet, ZONE). PASCAL LILLARD MAKES IT!
Score: 58-63

[08:41] Team_026 possession (Score: 58-63)
Wendell Gasol attempts a Midrange. Contested by Malcolm Tatum (4.3 feet, MAN). WENDELL GASOL MAKES IT!
Score: 58-65

[08:29] Team_098 possession (Score: 58-65)
Derrick Durant attempts a Layup. Contested by Kobe Booker (4.4 feet, ZONE). DERRICK DURANT MAKES IT!
Score: 60-65

[08:18] Team_026 possession (Score: 60-65)
Shaquille Trent attempts a Midrange. Contested by Pascal Lillard (3.9 feet, MAN). Shaquille Trent misses. Offensive rebound by Kobe Booker! Kobe Booker kicks it out.

[08:06] Team_026 possession (Score: 60-65)
Klay Giddey attempts a Midrange. Contested by Pascal Lillard (4.0 feet, ZONE). Klay Giddey misses. Rebound secured by Derrick Durant.

[07:51] Team_098 possession (Score: 60-65)
Pascal Lillard attempts a 3Pt. Contested by Immanuel Hyland (4.5 feet, ZONE). Pascal Lillard misses. Rebound secured by Immanuel Hyland.

[07:41] Team_026 possession (Score: 60-65)
Immanuel Hyland attempts a Midrange. Contested by Nikola Rose (3.3 feet, MAN). Immanuel Hyland misses. FOUL! Loose ball foul on Nikola Rose during the rebound battle. [Team fouls: 4] No free throws, side out. (Nikola Rose: 3 personal fouls)

[07:24] Team_026 possession (Score: 60-65)
FOUL! Shooting foul on Blake Murray. Shaquille Trent to the line for 2 free throws. [BONUS: 5 team fouls] (Blake Murray: 2 personal fouls)   FT 1/2: MISS   FT 2/2: GOOD Shaquille Trent makes 1/2 from the line.
Score: 60-66

[07:10] Team_098 possession (Score: 60-66)
FOUL! Holding foul on Klay Giddey. [Team fouls: 1] No free throws, side out. (Klay Giddey: 1 personal fouls)

[06:55] Team_098 possession (Score: 60-66)
FOUL! Holding foul on Wendell Gasol. [Team fouls: 2] No free throws, side out. (Wendell Gasol: 1 personal fouls)

[06:37] Team_098 possession (Score: 60-66)
Malcolm Tatum commits a violation (traveling/carry)! TURNOVER! (dead ball)

[06:22] Team_026 possession (Score: 60-66)
Kobe Booker drives, Pascal Lillard stays with him. Kobe Booker attempts a Layup. Contested by Pascal Lillard (4.3 feet, ZONE). Kobe Booker misses. Rebound secured by Pascal Lillard.

[06:10] Team_098 possession (Score: 60-66)
Malcolm Tatum drives and kicks out. Malcolm Tatum attempts a 3Pt. Contested by Wendell Gasol (4.6 feet, MAN). Malcolm Tatum misses. Offensive rebound by Derrick Durant! Derrick Durant puts it back in!
Score: 62-66

[05:50] Team_026 possession (Score: 62-66)
FOUL! Holding foul on Derrick Durant. [IN THE BONUS! 6 team fouls] Kobe Booker to the line for 2 free throws. (Derrick Durant: 1 personal fouls)   FT 1/2: MISS   FT 2/2: MISS Kobe Booker makes 0/2 from the line. Rebound secured by Pascal Lillard.

[05:37] Team_098 possession (Score: 62-66)
Pascal Lillard drives and kicks out. Pascal Lillard attempts a 3Pt. Contested by Immanuel Hyland (4.0 feet, ZONE). Pascal Lillard misses. Rebound secured by Kobe Booker.

[05:23] Team_026 possession (Score: 62-66)
Shaquille Trent drives and kicks out. Wendell Gasol attempts a Midrange. Contested by Blake Murray (4.5 feet, ZONE). WENDELL GASOL MAKES IT! Assist: Klay Giddey
Score: 62-68

[05:12] Team_098 possession (Score: 62-68)
Blake Murray attempts a Layup. Contested by Kobe Booker (4.4 feet, ZONE). BLAKE MURRAY MAKES IT! Assist: Pascal Lillard
Score: 64-68

[04:55] Team_026 possession (Score: 64-68)
Kobe Booker drives to the basket... Kobe Booker loses the ball! Stripped by Pascal Lillard! TURNOVER! (live ball)

[04:38] Team_098 possession (Score: 64-68)
Pascal Lillard attempts a 3Pt. Contested by Immanuel Hyland (4.6 feet, ZONE). Pascal Lillard misses. Rebound secured by Shaquille Trent.

[04:23] Team_026 possession (Score: 64-68)
Klay Giddey attempts a 3Pt. Contested by Nikola Rose (3.2 feet, ZONE). Klay Giddey misses. Rebound secured by Derrick Durant.

[04:13] Team_098 possession (Score: 64-68)
Derrick Durant attempts a 3Pt. Contested by Immanuel Hyland (4.3 feet, ZONE). DERRICK DURANT MAKES IT! Assist: Blake Murray
Score: 67-68

[03:59] Team_026 possession (Score: 67-68)
Shaquille Trent attempts a 3Pt. Contested by Nikola Rose (3.1 feet, ZONE). Shaquille Trent misses. Rebound secured by Nikola Rose.

[03:47] Team_098 possession (Score: 67-68)
Pascal Lillard attempts a Layup. Contested by Kobe Booker (4.9 feet, ZONE). PASCAL LILLARD MAKES IT!
Score: 69-68

[03:35] Team_026 possession (Score: 69-68)
Shaquille Trent drives, Pascal Lillard stays with him. Shaquille Trent attempts a Dunk. Contested by Pascal Lillard (4.0 feet, MAN). Shaquille Trent misses. Offensive rebound by Kobe Booker! Kobe Booker kicks it out.

[03:21] Team_026 possession (Score: 69-68)
Klay Giddey drives to the basket... Klay Giddey throws a bad pass! Stolen by Pascal Lillard! TURNOVER! (live ball)

[03:05] Team_098 possession (Score: 69-68)
Malcolm Tatum attempts a Midrange. Contested by Shaquille Trent (6.0 feet, ZONE). Malcolm Tatum misses. Rebound secured by Shaquille Trent.

[02:49] Team_026 possession (Score: 69-68)
Wendell Gasol attempts a 3Pt. Contested by Nikola Rose (3.7 feet, ZONE). Wendell Gasol misses. Rebound secured by Pascal Lillard.

[02:34] Team_098 possession (Score: 69-68)
Blake Murray attempts a 3Pt. Contested by Klay Giddey (5.9 feet, MAN). Blake Murray misses. Rebound secured by Shaquille Trent.

[02:20] Team_026 possession (Score: 69-68)
Shaquille Trent attempts a Midrange. Contested by Pascal Lillard (4.2 feet, MAN). Shaquille Trent misses. Offensive rebound by Kobe Booker! Kobe Booker kicks it out.

[02:06] Team_026 possession (Score: 69-68)
Kobe Booker attempts a Layup. Contested by Pascal Lillard (4.6 feet, ZONE). KOBE BOOKER MAKES IT! Assist: Wendell Gasol
Score: 69-70

[01:49] Team_098 possession (Score: 69-70)
Blake Murray attempts a 3Pt. Contested by Klay Giddey (5.9 feet, MAN). Blake Murray misses. Rebound secured by Kobe Booker.

[01:36] Team_026 possession (Score: 69-70)
Immanuel Hyland attempts a 3Pt. Contested by Nikola Rose (3.6 feet, MAN). IMMANUEL HYLAND MAKES IT! Assist: Shaquille Trent
Score: 69-73

[01:21] Team_098 possession (Score: 69-73)
Pascal Lillard attempts a 3Pt. Wide open! Klay Giddey is 6.3 feet away. [ZONE] Pascal Lillard misses. FOUL! Loose ball foul on Kobe Booker during the rebound battle. [Team fouls: 3] No free throws, side out. (Kobe Booker: 1 personal fouls)

[01:01] Team_098 possession (Score: 69-73)
Pascal Lillard drives, Shaquille Trent stays with him. Pascal Lillard attempts a Dunk. Wide open! Shaquille Trent is 6.5 feet away. [MAN] PASCAL LILLARD MAKES IT! Assist: Blake Murray
Score: 71-73

[00:44] Team_026 possession (Score: 71-73)
Immanuel Hyland attempts a 3Pt. Contested by Nikola Rose (3.7 feet, MAN). Immanuel Hyland misses. Rebound secured by Pascal Lillard.

[00:28] Team_098 possession (Score: 71-73)
Blake Murray drives, picks up Klay Giddey. Help arrives from Immanuel Hyland! Blake Murray attempts a Dunk. Wide open! Immanuel Hyland is 6.0 feet away. [MAN] BLAKE MURRAY MAKES IT! Assist: Malcolm Tatum
Score: 73-73

[00:12] Team_026 possession (Score: 73-73)
Shaquille Trent attempts a 3Pt. Contested by Nikola Rose (3.5 feet, ZONE). Shaquille Trent misses. Rebound secured by Derrick Durant.

================================================================================
                              3RD QUARTER COMPLETE                              
================================================================================

3RD QUARTER SCORE: Team_098 23, Team_026 17

BOX SCORE:
================================================================================

Team_098
--------------------------------------------------------------------------------
Player                MIN  PTS  REB  AST  TO      FG   FG%      3P   3P%
--------------------------------------------------------------------------------
Derrick Durant         35    9    6    0   0   4/4   100.0     0/0   0.0
Pascal Lillard         35    8    5    2   0   4/7    57.1     0/0   0.0
Blake Murray           35    4    0    2   0   2/6    33.3     0/0   0.0
Malcolm Tatum          35    2    0    1   0   1/2    50.0     0/0   0.0
Nikola Rose            35    0    2    1   0   0/0     0.0     0/0   0.0

TEAM: FG: 11/19 (57.9%), 3PT: 1/6 (16.7%), REB: 13 (2 off, 11 def), AST: 6, TO: 2
TEAM FOULS: 6 [Team_026 in BONUS]


Team_026
--------------------------------------------------------------------------------
Player                MIN  PTS  REB  AST  TO      FG   FG%      3P   3P%
--------------------------------------------------------------------------------
Wendell Gasol          35    7    0    2   0   3/4    75.0     0/0   0.0
Kobe Booker            35    4    5    1   0   2/4    50.0     0/0   0.0
Shaquille Trent        35    3    5    1   0   2/5    40.0     0/0   0.0
Immanuel Hyland        35    3    2    0   0   1/2    50.0     0/0   0.0
Klay Giddey            35    0    0    1   0   0/3     0.0     0/0   0.0

TEAM: FG: 8/19 (42.1%), 3PT: 2/7 (28.6%), REB: 12 (4 off, 8 def), AST: 5, TO: 2
TEAM FOULS: 3

================================================================================

================================================================================
                       4TH QUARTER - Team_098 vs Team_026                       
================================================================================

[12:00] Team_098 possession (Score: 73-73)
Nikola Rose attempts a Midrange. Contested by Immanuel Hyland (4.6 feet, MAN). NIKOLA ROSE MAKES IT! Assist: Pascal Lillard
Score: 75-73

[11:44] Team_026 possession (Score: 75-73)
Wendell Gasol attempts a 3Pt. Contested by Nikola Rose (3.8 feet, ZONE). Wendell Gasol misses. Rebound secured by Derrick Durant.

[11:29] Team_098 possession (Score: 75-73)
Blake Murray attempts a Midrange. BLOCKED BY KLAY GIDDEY! Ball goes out off Klay Giddey. Blake Murray's ball!

[11:15] Team_098 possession (Score: 75-73)
Derrick Durant attempts a 3Pt. Contested by Immanuel Hyland (4.6 feet, ZONE). Derrick Durant misses. Rebound secured by Kobe Booker.

[11:01] Team_026 possession (Score: 75-73)
FOUL! Shooting foul on Nikola Rose. Shaquille Trent to the line for 3 free throws. [Team fouls: 1] (Nikola Rose: 1 personal fouls)   FT 1/3: GOOD   FT 2/3: GOOD   FT 3/3: GOOD Shaquille Trent makes 3/3 from the line.
Score: 75-76

[10:45] Team_098 possession (Score: 75-76)
Pascal Lillard drives to the basket... Pascal Lillard throws a bad pass! Stolen by Shaquille Trent! TURNOVER! (live ball)

[10:32] Team_026 possession (Score: 75-76)
Wendell Gasol throws a bad pass! Stolen by Malcolm Tatum! TURNOVER! (live ball)

[10:16] Team_098 possession (Score: 75-76)
Blake Murray attempts a 3Pt. Wide open! Klay Giddey is 6.0 feet away. [MAN] BLAKE MURRAY MAKES IT! Assist: Derrick Durant
Score: 78-76

[09:59] Team_026 possession (Score: 78-76)
Wendell Gasol attempts a 3Pt. Contested by Malcolm Tatum (4.8 feet, MAN). Wendell Gasol misses. Rebound secured by Pascal Lillard.

[09:48] Team_098 possession (Score: 78-76)
Malcolm Tatum attempts a Midrange. Wide open! Shaquille Trent is 6.2 feet away. [ZONE] Malcolm Tatum misses. Rebound secured by Shaquille Trent.

[09:35] Team_026 possession (Score: 78-76)
Wendell Gasol attempts a 3Pt. Contested by Blake Murray (5.4 feet, ZONE). Wendell Gasol misses. Offensive rebound by Shaquille Trent! Shaquille Trent kicks it out.

[09:20] Team_026 possession (Score: 78-76)
Immanuel Hyland attempts a 3Pt. Contested by Nikola Rose (3.9 feet, ZONE). Immanuel Hyland misses. FOUL! Loose ball foul on Nikola Rose during the rebound battle. [Team fouls: 2] No free throws, side out. (Nikola Rose: 2 personal fouls)

[09:05] Team_026 possession (Score: 78-76)
Kobe Booker makes the Layup and draws the foul on Pascal Lillard! And-1! Kobe Booker to the line for 1. [Team fouls: 3] (Pascal Lillard: 1 personal fouls)   FT 1/1: MISS Kobe Booker makes 0/1 from the line. Rebound secured by Nikola Rose.
Score: 78-78

[08:49] Team_098 possession (Score: 78-78)
Malcolm Tatum attempts a Midrange. Contested by Wendell Gasol (5.3 feet, MAN). MALCOLM TATUM MAKES IT! Assist: Blake Murray
Score: 80-78

[08:37] Team_026 possession (Score: 80-78)
Immanuel Hyland attempts a 3Pt. Contested by Pascal Lillard (4.8 feet, ZONE). IMMANUEL HYLAND MAKES IT! Assist: Shaquille Trent
Score: 80-81

[08:22] Team_098 possession (Score: 80-81)
Derrick Durant makes the Midrange and draws the foul on Kobe Booker! And-1! Derrick Durant to the line for 1. [Team fouls: 1] (Kobe Booker: 1 personal fouls)   FT 1/1: GOOD Derrick Durant makes 1/1 from the line.
Score: 83-81

[08:08] Team_026 possession (Score: 83-81)
Kobe Booker attempts a 3Pt. Contested by Derrick Durant (5.4 feet, MAN). Kobe Booker misses. Offensive rebound by Kobe Booker! Kobe Booker kicks it out.

[07:56] Team_026 possession (Score: 83-81)
Wendell Gasol drives, picks up Pascal Lillard. Help arrives from Nikola Rose! Wendell Gasol attempts a Dunk. Contested by Nikola Rose (5.1 feet, ZONE). WENDELL GASOL MAKES IT!
Score: 83-83

[07:41] Team_098 possession (Score: 83-83)
Pascal Lillard attempts a Midrange. Wide open! Shaquille Trent is 6.8 feet away. [MAN] PASCAL LILLARD MAKES IT!
Score: 85-83

[07:27] Team_026 possession (Score: 85-83)
Kobe Booker attempts a Layup. BLOCKED BY DERRICK DURANT! Ball is loose! Rebound secured by Pascal Lillard.

[07:18] Team_098 possession (Score: 85-83)
Pascal Lillard attempts a Layup. Wide open! Shaquille Trent is 6.8 feet away. [MAN] PASCAL LILLARD MAKES IT!
Score: 87-83

[07:03] Team_026 possession (Score: 87-83)
FOUL! Offensive foul on Immanuel Hyland! Nikola Rose drew the charge! [Team fouls: 2] (Immanuel Hyland: 1 personal fouls) TURNOVER! (dead ball)

[06:46] Team_098 possession (Score: 87-83)
Derrick Durant commits a violation (traveling/carry)! TURNOVER! (dead ball)

[06:46] Substitution (Team_098): Malcolm Tatum OUT → Tracy Rose IN (stamina_rule2)

[06:46] Substitution (Team_098): Nikola Rose OUT → Dirk McCollum IN (stamina_rule2)

[06:46] Substitution (Team_098): Blake Murray OUT → Kristaps Iverson IN (stamina_rule2)

[06:46] Substitution (Team_098): Pascal Lillard OUT → Manu Jordan IN (stamina_rule2)

[06:46] Substitution (Team_098): Derrick Durant OUT → Russell McGrady IN (stamina_rule2)

[06:46] Substitution (Team_026): Wendell Gasol OUT → Myles Tatum IN (stamina_rule2)

[06:46] Substitution (Team_026): Immanuel Hyland OUT → Karl Barrett IN (stamina_rule2)

[06:46] Substitution (Team_026): Klay Giddey OUT → Josh Simons IN (stamina_rule2)

[06:46] Substitution (Team_026): Shaquille Trent OUT → Damian Doncic IN (stamina_rule2)

[06:46] Substitution (Team_026): Kobe Booker OUT → Dirk Randle IN (stamina_rule2)

[06:33] Team_026 possession (Score: 87-83)
Damian Doncic attempts a 3Pt. Contested by Dirk McCollum (3.9 feet, ZONE). Damian Doncic misses. Rebound secured by Manu Jordan.

[06:17] Team_098 possession (Score: 87-83)
Russell McGrady attempts a Midrange. Wide open! Dirk Randle is 6.1 feet away. [MAN] RUSSELL MCGRADY MAKES IT! Assist: Manu Jordan
Score: 89-83

[05:59] Team_026 possession (Score: 89-83)
Josh Simons attempts a 3Pt. Contested by Dirk McCollum (4.0 feet, ZONE). Josh Simons misses. Rebound secured by Manu Jordan.

[05:46] Team_098 possession (Score: 89-83)
Dirk McCollum drives, Karl Barrett stays with him. Dirk McCollum attempts a Layup. Contested by Karl Barrett (4.8 feet, MAN). Dirk McCollum misses. FOUL! Loose ball foul on Damian Doncic during the rebound battle. [Team fouls: 3] No free throws, side out. (Damian Doncic: 1 personal fouls)

[05:34] Team_098 possession (Score: 89-83)
Russell McGrady attempts a Layup. Wide open! Dirk Randle is 6.1 feet away. [MAN] RUSSELL MCGRADY MAKES IT! Assist: Kristaps Iverson
Score: 91-83

[05:18] Team_026 possession (Score: 91-83)
Karl Barrett attempts a Midrange. Contested by Manu Jordan (4.8 feet, ZONE). KARL BARRETT MAKES IT! Assist: Myles Tatum
Score: 91-85

[05:04] Team_098 possession (Score: 91-85)
Kristaps Iverson attempts a Layup. Contested by Damian Doncic (5.7 feet, ZONE). Kristaps Iverson misses. Offensive rebound by Russell McGrady! Russell McGrady puts it back in!
Score: 93-85

[04:51] Team_026 possession (Score: 93-85)
Josh Simons attempts a 3Pt. Contested by Dirk McCollum (4.0 feet, ZONE). Josh Simons misses. Offensive rebound by Josh Simons! Josh Simons kicks it out.

[04:36] Team_026 possession (Score: 93-85)
Myles Tatum throws a bad pass! Stolen by Tracy Rose! TURNOVER! (live ball)

[04:21] Team_098 possession (Score: 93-85)
Dirk McCollum attempts a Layup. BLOCKED BY KARL BARRETT! Ball is loose! Rebound secured by Josh Simons.

[04:07] Team_026 possession (Score: 93-85)
FOUL! Shooting foul on Dirk McCollum. Karl Barrett to the line for 2 free throws. [Team fouls: 4] (Dirk McCollum: 1 personal fouls)   FT 1/2: GOOD   FT 2/2: GOOD Karl Barrett makes 2/2 from the line.
Score: 93-87

[03:51] Team_098 possession (Score: 93-87)
Manu Jordan drives, picks up Damian Doncic. Help arrives from Karl Barrett! Manu Jordan attempts a Layup. Contested by Karl Barrett (5.8 feet, MAN). Manu Jordan misses. Rebound secured by Josh Simons.

[03:35] Team_026 possession (Score: 93-87)
FOUL! Shooting foul on Russell McGrady. Dirk Randle to the line for 2 free throws. [BONUS: 5 team fouls] (Russell McGrady: 1 personal fouls)   FT 1/2: GOOD   FT 2/2: MISS Dirk Randle makes 1/2 from the line. Rebound secured by Manu Jordan.
Score: 93-88

[03:20] Team_098 possession (Score: 93-88)
Manu Jordan attempts a Layup. Contested by Damian Doncic (5.8 feet, MAN). MANU JORDAN MAKES IT! Assist: Russell McGrady
Score: 95-88

[03:06] Team_026 possession (Score: 95-88)
Karl Barrett attempts a 3Pt. Contested by Dirk McCollum (4.2 feet, ZONE). Karl Barrett misses. Rebound secured by Russell McGrady.

[02:52] Team_098 possession (Score: 95-88)
Kristaps Iverson attempts a 3Pt. Contested by Josh Simons (5.2 feet, MAN). KRISTAPS IVERSON MAKES IT! Assist: Tracy Rose
Score: 98-88

[02:38] Team_026 possession (Score: 98-88)
Karl Barrett drives and kicks out. Dirk Randle attempts a Midrange. BLOCKED BY RUSSELL MCGRADY! Ball is loose! Rebound secured by Kristaps Iverson.

[02:24] Team_098 possession (Score: 98-88)
Dirk McCollum attempts a 3Pt. Contested by Karl Barrett (4.8 feet, ZONE). Dirk McCollum misses. Rebound secured by Damian Doncic.

[02:14] Team_026 possession (Score: 98-88)
Damian Doncic throws a bad pass! Stolen by Manu Jordan! TURNOVER! (live ball)

[02:03] Team_098 possession (Score: 98-88)
Kristaps Iverson attempts a 3Pt. Contested by Josh Simons (5.2 feet, MAN). Kristaps Iverson misses. Rebound secured by Karl Barrett.

[01:49] Team_026 possession (Score: 98-88)
Josh Simons attempts a 3Pt. Contested by Kristaps Iverson (3.8 feet, MAN). Josh Simons misses. Rebound secured by Manu Jordan.

[01:32] Team_098 possession (Score: 98-88)
Kristaps Iverson attempts a 3Pt. Contested by Josh Simons (5.2 feet, MAN). KRISTAPS IVERSON MAKES IT! Assist: Tracy Rose
Score: 101-88

[01:19] Team_026 possession (Score: 101-88)
FOUL! Holding foul on Kristaps Iverson. [IN THE BONUS! 6 team fouls] Josh Simons to the line for 2 free throws. (Kristaps Iverson: 1 personal fouls)   FT 1/2: GOOD   FT 2/2: GOOD Josh Simons makes 2/2 from the line.
Score: 101-90

[01:06] Team_098 possession (Score: 101-90)
Tracy Rose attempts a 3Pt. Contested by Karl Barrett (4.8 feet, ZONE). Tracy Rose misses. Rebound secured by Damian Doncic.

[00:55] Team_026 possession (Score: 101-90)
Dirk Randle attempts a Layup. Contested by Russell McGrady (4.2 feet, ZONE). DIRK RANDLE MAKES IT! Assist: Karl Barrett
Score: 101-92

[00:42] Team_098 possession (Score: 101-92)
Kristaps Iverson drives and kicks out. Kristaps Iverson attempts a Midrange. Contested by Josh Simons (5.1 feet, MAN). Kristaps Iverson misses. Offensive rebound by Russell McGrady! Russell McGrady puts it back in!
Score: 103-92

[00:27] Team_026 possession (Score: 103-92)
FOUL! Reach-in foul on Russell McGrady during the drive. [IN THE BONUS! 7 team fouls] Dirk Randle to the line for 2 free throws. (Russell McGrady: 2 personal fouls)   FT 1/2: GOOD   FT 2/2: GOOD Dirk Randle makes 2/2 from the line.
Score: 103-94

[00:14] Team_098 possession (Score: 103-94)
Manu Jordan attempts a Layup. Contested by Damian Doncic (5.8 feet, MAN). MANU JORDAN MAKES IT! Assist: Russell McGrady
Score: 105-94

[00:02] Team_026 possession (Score: 105-94)
Myles Tatum attempts a 3Pt. Contested by Dirk McCollum (4.0 feet, ZONE). MYLES TATUM MAKES IT! Assist: Damian Doncic
Score: 105-97

================================================================================
                              4TH QUARTER COMPLETE                              
================================================================================

4TH QUARTER SCORE: Team_098 32, Team_026 24

BOX SCORE:
================================================================================

Team_098
--------------------------------------------------------------------------------
Player                MIN  PTS  REB  AST  TO      FG   FG%      3P   3P%
--------------------------------------------------------------------------------
Russell McGrady         8    8    3    2   0   4/4   100.0     0/0   0.0
Kristaps Iverson        8    6    2    1   0   2/3    66.7     0/0   0.0
Pascal Lillard         40    4    2    1   0   2/2   100.0     0/0   0.0
Manu Jordan             8    4    4    1   0   2/3    66.7     0/0   0.0
Derrick Durant         40    3    1    1   0   1/2    50.0     0/0   0.0
Blake Murray           40    3    0    1   0   1/1   100.0     0/0   0.0
Nikola Rose            40    2    1    0   0   1/1   100.0     0/0   0.0
Malcolm Tatum          40    2    0    0   0   1/2    50.0     0/0   0.0
Dirk McCollum           8    0    0    0   0   0/2     0.0     0/0   0.0
Tracy Rose              8    0    0    2   0   0/1     0.0     0/0   0.0

TEAM: FG: 14/21 (66.7%), 3PT: 3/7 (42.9%), REB: 13 (3 off, 10 def), AST: 9, TO: 2
TEAM FOULS: 7 [Team_026 in BONUS]


Team_026
--------------------------------------------------------------------------------
Player                MIN  PTS  REB  AST  TO      FG   FG%      3P   3P%
--------------------------------------------------------------------------------
Karl Barrett            8    4    1    1   0   2/4    50.0     0/0   0.0
Dirk Randle             8    4    0    0   0   2/3    66.7     0/0   0.0
Shaquille Trent        40    3    2    1   0   1/1   100.0     0/0   0.0
Immanuel Hyland        40    3    0    0   0   1/1   100.0     0/0   0.0
Myles Tatum             8    3    0    1   0   1/1   100.0     0/0   0.0
Wendell Gasol          40    2    0    0   0   1/3    33.3     0/0   0.0
Josh Simons             8    2    3    0   0   1/3    33.3     0/0   0.0
Kobe Booker            40    0    3    0   0   0/2     0.0     0/0   0.0
Damian Doncic           8    0    2    1   0   0/1     0.0     0/0   0.0

TEAM: FG: 9/19 (47.4%), 3PT: 3/9 (33.3%), REB: 11 (4 off, 7 def), AST: 4, TO: 4
TEAM FOULS: 3

================================================================================

================================================================================
                               FULL GAME COMPLETE                               
================================================================================

FINAL SCORE: Team_098 105, Team_026 97

SCORING BY QUARTER:
--------------------------------------------------------------------------------
Team                     Q1     Q2     Q3     Q4    FINAL
--------------------------------------------------------------------------------
Team_098                 21     29     23     32      105
Team_026                 23     33     17     24       97
--------------------------------------------------------------------------------

FULL GAME BOX SCORE:
================================================================================

Team_098
--------------------------------------------------------------------------------
Player                MIN  PTS  REB  AST  TO      FG   FG%      3P   3P%      FT STL BLK
--------------------------------------------------------------------------------
Malcolm Tatum          40   12    0    3   1   8/15   53.3   1/4    25.0   0/0     1   0
Nikola Rose            40   12    9    3   3   6/10   60.0   2/4    50.0   1/2     0   0
Blake Murray           40   15    0    5   0   9/15   60.0   3/7    42.9   1/1     0   1
Pascal Lillard         40   18   17    6   0   8/15   53.3   0/2     0.0   0/0     3   1
Derrick Durant         40   24   12    2   2   6/11   54.5   1/2    50.0   6/9     2   1
Tracy Rose              8    0    0    3   0   0/1     0.0   0/1     0.0   0/0     1   0
Dirk McCollum           8    2    0    0   0   1/5    20.0   0/3     0.0   0/0     0   0
Kristaps Iverson        8    6    3    1   0   4/5    80.0   2/3    66.7   0/0     0   0
Manu Jordan             8    4    4    1   1   2/3    66.7   0/0     0.0   0/0     1   0
Russell McGrady         8    8    4    2   0   2/2   100.0   0/0     0.0   0/0     0   1

TEAM: FG: 46/82 (56.1%), 3PT: 9/26 (34.6%), REB: 49 (11 off, 38 def), AST: 26, TO: 7


Team_026
--------------------------------------------------------------------------------
Player                MIN  PTS  REB  AST  TO      FG   FG%      3P   3P%      FT STL BLK
--------------------------------------------------------------------------------
Wendell Gasol          40   22    0    3   3   8/15   53.3   4/7    57.1   7/7     0   0
Immanuel Hyland        40   16   10    2   3   6/11   54.5   4/9    44.4   0/0     1   1
Klay Giddey            40   14    0    3   0   4/8    50.0   3/4    75.0   6/6     0   1
Shaquille Trent        40   13   13    5   0   7/13   53.8   2/6    33.3   8/9     1   0
Kobe Booker            40   12   16    4   3   6/13   46.2   0/0     0.0   0/4     0   1
Myles Tatum             8    3    0    1   1   1/2    50.0   1/2    50.0   0/0     0   0
Karl Barrett            8    6    1    1   0   2/4    50.0   0/1     0.0   4/4     1   1
Josh Simons             8    2    5    0   0   0/3     0.0   0/3     0.0   2/2     0   0
Damian Doncic           8    0    2    1   1   0/1     0.0   0/1     0.0   0/0     0   0
Dirk Randle             8    4    0    0   0   2/3    66.7   0/0     0.0   3/4     0   0

TEAM: FG: 39/77 (50.6%), 3PT: 14/33 (42.4%), REB: 47 (12 off, 35 def), AST: 20, TO: 11

================================================================================
