================================================================================
                        FULL GAME - Team_068 vs Team_019                        
================================================================================

================================================================================
                       1ST QUARTER - Team_068 vs Team_019                       
================================================================================

[12:00] Team_068 possession (Score: 0-0)
FOUL! Offensive foul on Jaren Johnson! D'Angelo Randle drew the charge! [Team fouls: 1] (Jaren Johnson: 1 personal fouls) TURNOVER! (dead ball)

[11:44] Team_019 possession (Score: 0-0)
Tobias Hyland attempts a Layup. Contested by Gary Simons (3.2 feet, ZONE). Tobias Hyland misses. Rebound secured by Nikola Ginobili.

[11:31] Team_068 possession (Score: 0-0)
Nikola Ginobili attempts a Layup. Contested by DeMar James (4.3 feet, ZONE). Nikola Ginobili misses. Rebound secured by Tobias Hyland.

[11:12] Team_019 possession (Score: 0-0)
Tobias Hyland makes the Dunk and draws the foul on Malcolm Herro! And-1! Tobias Hyland to the line for 1. [Team fouls: 2] (Malcolm Herro: 1 personal fouls)   FT 1/1: GOOD Tobias Hyland makes 1/1 from the line.
Score: 0-3

[10:56] Team_068 possession (Score: 0-3)
FOUL! Shooting foul on D'Angelo Randle. Jaren Johnson to the line for 2 free throws. [Team fouls: 1] (D'Angelo Randle: 1 personal fouls)   FT 1/2: GOOD   FT 2/2: MISS Jaren Johnson makes 1/2 from the line. Rebound secured by DeMar James.
Score: 1-3

[10:40] Team_019 possession (Score: 1-3)
DeMar James attempts a Midrange. Contested by Malcolm Herro (4.6 feet, ZONE). DeMar James misses. Rebound secured by Jaren Johnson.

[10:29] Team_068 possession (Score: 1-3)
Gary Simons drives and kicks out. Zion Anunoby attempts a 3Pt. Contested by D'Angelo Randle (3.6 feet, ZONE). ZION ANUNOBY MAKES IT! Assist: Jaren Johnson
Score: 4-3

[10:16] Team_019 possession (Score: 4-3)
Rudy Giddey attempts a 3Pt. Contested by Zion Anunoby (4.6 feet, MAN). Rudy Giddey misses. Rebound secured by Jaren Johnson.

[10:01] Team_068 possession (Score: 4-3)
Zion Anunoby attempts a 3Pt. Contested by D'Angelo Randle (4.0 feet, ZONE). ZION ANUNOBY MAKES IT! Assist: Gary Simons
Score: 7-3

[09:50] Team_019 possession (Score: 7-3)
Tobias Hyland attempts a Layup. Contested by Gary Simons (3.2 feet, ZONE). TOBIAS HYLAND MAKES IT!
Score: 7-5

[09:37] Team_068 possession (Score: 7-5)
FOUL! Holding foul on Rudy Giddey. [Team fouls: 2] No free throws, side out. (Rudy Giddey: 1 personal fouls)

[09:25] Team_068 possession (Score: 7-5)
FOUL! Reach-in foul on Brandon James during the drive. [Team fouls: 3] No free throws, side out. (Brandon James: 1 personal fouls)

[09:08] Team_068 possession (Score: 7-5)
Nikola Ginobili attempts a Midrange. Contested by Rudy Giddey (5.4 feet, ZONE). NIKOLA GINOBILI MAKES IT! Assist: Malcolm Herro
Score: 9-5

[08:53] Team_019 possession (Score: 9-5)
Brandon James attempts a Layup. Contested by Malcolm Herro (4.2 feet, MAN). BRANDON JAMES MAKES IT!
Score: 9-7

[08:38] Team_068 possession (Score: 9-7)
Jaren Johnson attempts a 3Pt. Contested by D'Angelo Randle (4.1 feet, MAN). Jaren Johnson misses. Rebound secured by DeMar James.

[08:22] Team_019 possession (Score: 9-7)
DeMar James makes the Layup and draws the foul on Gary Simons! And-1! DeMar James to the line for 1. [Team fouls: 3] (Gary Simons: 1 personal fouls)   FT 1/1: GOOD DeMar James makes 1/1 from the line.
Score: 9-10

[08:07] Team_068 possession (Score: 9-10)
Gary Simons makes the Layup and draws the foul on DeMar James! And-1! Gary Simons to the line for 1. [Team fouls: 4] (DeMar James: 1 personal fouls)   FT 1/1: GOOD Gary Simons makes 1/1 from the line.
Score: 12-10

[07:49] Team_019 possession (Score: 12-10)
Brandon James drives to the basket... Brandon James throws a bad pass! Stolen by Gary Simons! TURNOVER! (live ball)

[07:30] Team_068 possession (Score: 12-10)
Zion Anunoby attempts a 3Pt. Contested by D'Angelo Randle (4.0 feet, ZONE). Zion Anunoby misses. Offensive rebound by Jaren Johnson! Jaren Johnson kicks it out.

[07:11] Team_068 possession (Score: 12-10)
Zion Anunoby drives, picks up DeMar James. Help arrives from Brandon James! Zion Anunoby attempts a Dunk. Contested by Brandon James (4.6 feet, ZONE). ZION ANUNOBY MAKES IT! Assist: Jaren Johnson
Score: 14-10

[06:58] Team_019 possession (Score: 14-10)
DeMar James drives to the basket... DeMar James commits a violation (traveling/carry)! TURNOVER! (dead ball)

[06:46] Team_068 possession (Score: 14-10)
Gary Simons attempts a Midrange. Wide open! Tobias Hyland is 6.4 feet away. [MAN] Gary Simons misses. Rebound secured by Tobias Hyland.

[06:33] Team_019 possession (Score: 14-10)
Brandon James attempts a Midrange. Contested by Malcolm Herro (4.2 feet, MAN). Brandon James misses. Rebound secured by Nikola Ginobili.

[06:19] Team_068 possession (Score: 14-10)
Jaren Johnson attempts a Midrange. Wide open! Tobias Hyland is 6.1 feet away. [ZONE] Jaren Johnson misses. Rebound secured by DeMar James.

[06:04] Team_019 possession (Score: 14-10)
Brandon James throws a bad pass! Stolen by Malcolm Herro! TURNOVER! (live ball)

[05:52] Team_068 possession (Score: 14-10)
FOUL! Reach-in foul on Rudy Giddey during the drive. [IN THE BONUS! 5 team fouls] Zion Anunoby to the line for 2 free throws. (Rudy Giddey: 2 personal fouls)   FT 1/2: GOOD   FT 2/2: GOOD Zion Anunoby makes 2/2 from the line.
Score: 16-10

[05:33] Team_019 possession (Score: 16-10)
DeMar James makes the Midrange and draws the foul on Nikola Ginobili! And-1! DeMar James to the line for 1. [Team fouls: 4] (Nikola Ginobili: 1 personal fouls)   FT 1/1: GOOD DeMar James makes 1/1 from the line.
Score: 16-13

[05:18] Team_068 possession (Score: 16-13)
Jaren Johnson attempts a 3Pt. Contested by D'Angelo Randle (4.1 feet, ZONE). Jaren Johnson misses. Offensive rebound by Jaren Johnson! Jaren Johnson kicks it out.

[05:03] Team_068 possession (Score: 16-13)
Zion Anunoby attempts a Layup. Contested by Rudy Giddey (5.7 feet, MAN). Zion Anunoby misses. Rebound secured by DeMar James.

[04:53] Team_019 possession (Score: 16-13)
FOUL! Shooting foul on Malcolm Herro. D'Angelo Randle to the line for 2 free throws. [BONUS: 5 team fouls] (Malcolm Herro: 2 personal fouls)   FT 1/2: GOOD   FT 2/2: GOOD D'Angelo Randle makes 2/2 from the line.
Score: 16-15

[04:38] Team_068 possession (Score: 16-15)
Gary Simons drives, picks up Tobias Hyland. Help arrives from Brandon James! Gary Simons attempts a Dunk. Wide open! Brandon James is 6.5 feet away. [MAN] GARY SIMONS MAKES IT! Assist: Zion Anunoby
Score: 18-15

[04:24] Team_019 possession (Score: 18-15)
DeMar James attempts a Layup. BLOCKED BY GARY SIMONS! Ball is loose! Rebound secured by Gary Simons.

[04:09] Team_068 possession (Score: 18-15)
Nikola Ginobili drives and kicks out. Nikola Ginobili attempts a 3Pt. Contested by DeMar James (4.3 feet, MAN). Nikola Ginobili misses. Rebound secured by D'Angelo Randle.

[03:55] Team_019 possession (Score: 18-15)
D'Angelo Randle attempts a 3Pt. Contested by Zion Anunoby (4.7 feet, ZONE). D'Angelo Randle misses. Offensive rebound by DeMar James! DeMar James puts it back in!
Score: 18-17

[03:41] Team_068 possession (Score: 18-17)
FOUL! Offensive foul on Malcolm Herro! Brandon James drew the charge! [Team fouls: 6] (Malcolm Herro: 3 personal fouls) TURNOVER! (dead ball)

[03:29] Team_019 possession (Score: 18-17)
Tobias Hyland drives, Gary Simons stays with him. Tobias Hyland attempts a Dunk. Contested by Gary Simons (3.4 feet, MAN). TOBIAS HYLAND MAKES IT!
Score: 18-19

[03:11] Team_068 possession (Score: 18-19)
Nikola Ginobili drives, picks up DeMar James. Help arrives from Brandon James! Nikola Ginobili attempts a Dunk. Contested by Brandon James (4.5 feet, ZONE). NIKOLA GINOBILI MAKES IT! Assist: Malcolm Herro
Score: 20-19

[02:53] Team_019 possession (Score: 20-19)
D'Angelo Randle drives, picks up Jaren Johnson. Help arrives from Malcolm Herro! D'Angelo Randle attempts a Layup. Contested by Malcolm Herro (4.0 feet, MAN). D'Angelo Randle misses. Offensive rebound by D'Angelo Randle! D'Angelo Randle kicks it out.

[02:37] Team_019 possession (Score: 20-19)
Brandon James drives to the basket... Brandon James throws a bad pass! Stolen by Gary Simons! TURNOVER! (live ball)

[02:26] Team_068 possession (Score: 20-19)
Malcolm Herro attempts a 3Pt. Contested by Brandon James (5.3 feet, MAN). Malcolm Herro misses. Rebound secured by DeMar James.

[02:12] Team_019 possession (Score: 20-19)
Brandon James drives to the basket... Brandon James throws a bad pass out of bounds! TURNOVER! (dead ball)

[02:12] Substitution (Team_068): Malcolm Herro OUT → Ja Banchero IN (stamina_rule2)

[02:12] Substitution (Team_068): Jaren Johnson OUT → Miles Murray IN (stamina_rule2)

[02:12] Substitution (Team_068): Gary Simons OUT → Jarrett Oladipo IN (stamina_rule2)

[02:12] Substitution (Team_068): Nikola Ginobili OUT → Franz Curry IN (stamina_rule2)

[02:12] Substitution (Team_019): Rudy Giddey OUT → Gary Ginobili IN (stamina_rule2)

[02:12] Substitution (Team_019): Brandon James OUT → Jalen Turner IN (stamina_rule2)

[02:12] Substitution (Team_019): D'Angelo Randle OUT → Blake LaVine IN (stamina_rule2)

[02:12] Substitution (Team_019): Tobias Hyland OUT → Shai Ingram IN (stamina_rule2)

[02:12] Substitution (Team_019): DeMar James OUT → Tim Jordan IN (stamina_rule2)

[01:54] Team_068 possession (Score: 20-19)
Jarrett Oladipo attempts a 3Pt. Contested by Blake LaVine (5.1 feet, ZONE). Jarrett Oladipo misses. FOUL! Loose ball foul on Tim Jordan during the rebound battle. [IN THE BONUS! 6 team fouls] Franz Curry to the line for 2 free throws. (Tim Jordan: 1 personal fouls)   FT 1/2: GOOD   FT 2/2: MISS Franz Curry makes 1/2 from the line. Rebound secured by Tim Jordan.
Score: 21-19

[01:37] Team_019 possession (Score: 21-19)
Blake LaVine attempts a Midrange. Contested by Miles Murray (4.1 feet, MAN). Blake LaVine misses. Rebound secured by Jarrett Oladipo.

[01:20] Team_068 possession (Score: 21-19)
FOUL! Reach-in foul on Shai Ingram during the drive. [IN THE BONUS! 7 team fouls] Franz Curry to the line for 2 free throws. (Shai Ingram: 1 personal fouls)   FT 1/2: GOOD   FT 2/2: GOOD Franz Curry makes 2/2 from the line.
Score: 23-19

[01:08] Team_019 possession (Score: 23-19)
Gary Ginobili attempts a 3Pt. Contested by Zion Anunoby (5.2 feet, MAN). Gary Ginobili misses. Rebound secured by Jarrett Oladipo.

[00:52] Team_068 possession (Score: 23-19)
Franz Curry makes the Dunk and draws the foul on Jalen Turner! And-1! Franz Curry to the line for 1. [BONUS: 8 team fouls] (Jalen Turner: 1 personal fouls)   FT 1/1: GOOD Franz Curry makes 1/1 from the line.
Score: 26-19

[00:37] Team_019 possession (Score: 26-19)
Jalen Turner drives and kicks out. Shai Ingram attempts a 3Pt. Contested by Jarrett Oladipo (3.8 feet, MAN). Shai Ingram misses. Rebound secured by Ja Banchero.

[00:21] Team_068 possession (Score: 26-19)
Miles Murray attempts a 3Pt. Contested by Blake LaVine (4.9 feet, MAN). MILES MURRAY MAKES IT! Assist: Franz Curry
Score: 29-19

[00:07] Team_019 possession (Score: 29-19)
Blake LaVine attempts a 3Pt. Contested by Miles Murray (4.1 feet, MAN). Blake LaVine misses. Rebound secured by Ja Banchero.

================================================================================
                              1ST QUARTER COMPLETE                              
================================================================================

1ST QUARTER SCORE: Team_068 29, Team_019 19

BOX SCORE:
================================================================================

Team_068
--------------------------------------------------------------------------------
Player                MIN  PTS  REB  AST  TO      FG   FG%      3P   3P%
--------------------------------------------------------------------------------
Zion Anunoby           12   10    0    1   0   4/5    80.0     0/0   0.0
Gary Simons            10    5    1    1   0   2/3    66.7     0/0   0.0
Franz Curry             2    5    0    1   0   2/2   100.0     0/0   0.0
Nikola Ginobili        10    4    2    0   0   2/4    50.0     0/0   0.0
Miles Murray            2    3    0    0   0   1/1   100.0     0/0   0.0
Jaren Johnson          10    0    4    2   0   0/3     0.0     0/0   0.0
Malcolm Herro          10    0    0    2   0   0/1     0.0     0/0   0.0
Jarrett Oladipo         2    0    2    0   0   0/1     0.0     0/0   0.0
Tim Jordan              2    0    1    0   0   0/0     0.0     0/0   0.0
Ja Banchero             2    0    2    0   0   0/0     0.0     0/0   0.0

TEAM: FG: 11/20 (55.0%), 3PT: 2/5 (40.0%), REB: 12 (3 off, 9 def), AST: 7, TO: 2
TEAM FOULS: 6 [Team_019 in BONUS]


Team_019
--------------------------------------------------------------------------------
Player                MIN  PTS  REB  AST  TO      FG   FG%      3P   3P%
--------------------------------------------------------------------------------
DeMar James            10    8    6    0   0   3/5    60.0     0/0   0.0
Tobias Hyland          10    7    2    0   0   3/4    75.0     0/0   0.0
Brandon James          10    2    0    0   0   1/2    50.0     0/0   0.0
D'Angelo Randle        10    2    2    0   0   1/1   100.0     0/0   0.0
Rudy Giddey            10    0    0    0   0   0/1     0.0     0/0   0.0
Blake LaVine            2    0    0    0   0   0/2     0.0     0/0   0.0
Gary Ginobili           2    0    0    0   0   0/1     0.0     0/0   0.0
Jalen Turner            2    0    0    0   0   0/1     0.0     0/0   0.0

TEAM: FG: 8/17 (47.1%), 3PT: 1/4 (25.0%), REB: 10 (2 off, 8 def), AST: 0, TO: 5
TEAM FOULS: 8 [Team_068 in BONUS]

================================================================================

================================================================================
                       2ND QUARTER - Team_068 vs Team_019                       
================================================================================

[12:00] Team_068 possession (Score: 29-19)
Zion Anunoby attempts a 3Pt. Contested by Rudy Giddey (5.7 feet, MAN). Zion Anunoby misses. Offensive rebound by Jaren Johnson! Jaren Johnson kicks it out.

[11:47] Team_068 possession (Score: 29-19)
FOUL! Reach-in foul on DeMar James during the drive. [Team fouls: 1] No free throws, side out. (DeMar James: 1 personal fouls)

[11:32] Team_068 possession (Score: 29-19)
Malcolm Herro drives to the basket... Malcolm Herro loses the ball! Stripped by Brandon James! TURNOVER! (live ball)

[11:19] Team_019 possession (Score: 29-19)
DeMar James drives, Gary Simons stays with him. DeMar James attempts a Dunk. Contested by Gary Simons (3.7 feet, ZONE). DEMAR JAMES MAKES IT!
Score: 29-21

[11:03] Team_068 possession (Score: 29-21)
FOUL! Reach-in foul on DeMar James during the drive. [Team fouls: 2] No free throws, side out. (DeMar James: 2 personal fouls)

[10:49] Team_068 possession (Score: 29-21)
Gary Simons loses control! Ball rolls out of bounds! TURNOVER! (dead ball)

[10:49] Substitution (Team_068): Zion Anunoby OUT → Cole Anthony IN (stamina_rule2)

[10:37] Team_019 possession (Score: 29-21)
DeMar James commits a violation (traveling/carry)! TURNOVER! (dead ball)

[10:24] Team_068 possession (Score: 29-21)
Gary Simons attempts a 3Pt. Wide open! Tobias Hyland is 6.6 feet away. [MAN] Gary Simons misses. Rebound secured by DeMar James.

[10:13] Team_019 possession (Score: 29-21)
FOUL! Shooting foul on Gary Simons. Tobias Hyland to the line for 3 free throws. [Team fouls: 1] (Gary Simons: 1 personal fouls)   FT 1/3: GOOD   FT 2/3: GOOD   FT 3/3: MISS Tobias Hyland makes 2/3 from the line. Rebound secured by Gary Simons.
Score: 29-23

[09:59] Team_068 possession (Score: 29-23)
Nikola Ginobili attempts a Midrange. Contested by DeMar James (4.5 feet, MAN). NIKOLA GINOBILI MAKES IT!
Score: 31-23

[09:45] Team_019 possession (Score: 31-23)
Tobias Hyland attempts a 3Pt. Contested by Gary Simons (3.5 feet, MAN). Tobias Hyland misses. Rebound secured by Gary Simons.

[09:26] Team_068 possession (Score: 31-23)
FOUL! Holding foul on DeMar James. [Team fouls: 3] No free throws, side out. (DeMar James: 3 personal fouls)

[09:13] Team_068 possession (Score: 31-23)
FOUL! Shooting foul on D'Angelo Randle. Jaren Johnson to the line for 3 free throws. [Team fouls: 4] (D'Angelo Randle: 1 personal fouls)   FT 1/3: GOOD   FT 2/3: GOOD   FT 3/3: GOOD Jaren Johnson makes 3/3 from the line.
Score: 34-23

[08:53] Team_019 possession (Score: 34-23)
Rudy Giddey attempts a Layup. Contested by Cole Anthony (4.9 feet, MAN). RUDY GIDDEY MAKES IT! Assist: Tobias Hyland
Score: 34-25

[08:38] Team_068 possession (Score: 34-25)
Malcolm Herro attempts a Midrange. Contested by Brandon James (5.4 feet, MAN). Malcolm Herro misses. Offensive rebound by Nikola Ginobili! Nikola Ginobili puts it back in!
Score: 36-25

[08:22] Team_019 possession (Score: 36-25)
Rudy Giddey attempts a 3Pt. Contested by Malcolm Herro (4.8 feet, ZONE). RUDY GIDDEY MAKES IT! Assist: D'Angelo Randle
Score: 36-28

[08:08] Team_068 possession (Score: 36-28)
Malcolm Herro drives and kicks out. Gary Simons attempts a 3Pt. Wide open! Tobias Hyland is 6.1 feet away. [MAN] Gary Simons misses. Rebound secured by D'Angelo Randle.

[07:55] Team_019 possession (Score: 36-28)
Brandon James attempts a 3Pt. Contested by Malcolm Herro (4.6 feet, MAN). Brandon James misses. Offensive rebound by DeMar James! DeMar James kicks it out.

[07:38] Team_019 possession (Score: 36-28)
Brandon James loses the ball! Stripped by Malcolm Herro! TURNOVER! (live ball)

[07:25] Team_068 possession (Score: 36-28)
Malcolm Herro attempts a 3Pt. Contested by Rudy Giddey (5.7 feet, ZONE). MALCOLM HERRO MAKES IT! Assist: Jaren Johnson
Score: 39-28

[07:12] Team_019 possession (Score: 39-28)
Brandon James attempts a 3Pt. Contested by Malcolm Herro (4.7 feet, MAN). Brandon James misses. Rebound secured by Gary Simons.

[06:58] Team_068 possession (Score: 39-28)
Nikola Ginobili attempts a Layup. BLOCKED BY DEMAR JAMES! Ball is loose! Rebound secured by DeMar James.

[06:39] Team_019 possession (Score: 39-28)
Tobias Hyland attempts a 3Pt. Contested by Malcolm Herro (4.8 feet, ZONE). Tobias Hyland misses. Rebound secured by Nikola Ginobili.

[06:26] Team_068 possession (Score: 39-28)
Nikola Ginobili attempts a Layup. Contested by DeMar James (4.9 feet, ZONE). NIKOLA GINOBILI MAKES IT! Assist: Jaren Johnson
Score: 41-28

[06:13] Team_019 possession (Score: 41-28)
Brandon James attempts a 3Pt. Contested by Jaren Johnson (4.2 feet, ZONE). BRANDON JAMES MAKES IT! Assist: DeMar James
Score: 41-31

[05:57] Team_068 possession (Score: 41-31)
Cole Anthony attempts a Midrange. Contested by Brandon James (5.6 feet, ZONE). Cole Anthony misses. Offensive rebound by Jaren Johnson! Jaren Johnson kicks it out.

[05:46] Team_068 possession (Score: 41-31)
Jaren Johnson makes the Layup and draws the foul on DeMar James! And-1! Jaren Johnson to the line for 1. [BONUS: 5 team fouls] (DeMar James: 4 personal fouls)   FT 1/1: GOOD Jaren Johnson makes 1/1 from the line.
Score: 44-31

[05:28] Team_019 possession (Score: 44-31)
Brandon James loses control! Ball rolls out of bounds! TURNOVER! (dead ball)

[05:28] Substitution (Team_068): Malcolm Herro OUT → Ja Banchero IN (stamina_rule2)

[05:28] Substitution (Team_068): Jaren Johnson OUT → Miles Murray IN (stamina_rule2)

[05:28] Substitution (Team_068): Gary Simons OUT → Jarrett Oladipo IN (stamina_rule2)

[05:28] Substitution (Team_068): Nikola Ginobili OUT → Franz Curry IN (stamina_rule2)

[05:28] Substitution (Team_019): Rudy Giddey OUT → Gary Ginobili IN (stamina_rule2)

[05:28] Substitution (Team_019): Brandon James OUT → Jalen Turner IN (stamina_rule2)

[05:28] Substitution (Team_019): D'Angelo Randle OUT → Blake LaVine IN (stamina_rule2)

[05:28] Substitution (Team_019): Tobias Hyland OUT → Shai Ingram IN (stamina_rule2)

[05:28] Substitution (Team_019): DeMar James OUT → Tim Jordan IN (stamina_rule2)

[05:15] Team_068 possession (Score: 44-31)
Cole Anthony makes the Midrange and draws the foul on Gary Ginobili! And-1! Cole Anthony to the line for 1. [BONUS: 6 team fouls] (Gary Ginobili: 1 personal fouls)   FT 1/1: GOOD Cole Anthony makes 1/1 from the line.
Score: 47-31

[05:01] Team_019 possession (Score: 47-31)
Jalen Turner attempts a Layup. Contested by Ja Banchero (5.4 feet, MAN). JALEN TURNER MAKES IT!
Score: 47-33

[04:51] Team_068 possession (Score: 47-33)
Cole Anthony attempts a 3Pt. Contested by Gary Ginobili (5.7 feet, MAN). COLE ANTHONY MAKES IT! Assist: Jarrett Oladipo
Score: 50-33

[04:39] Team_019 possession (Score: 50-33)
Blake LaVine attempts a 3Pt. Contested by Miles Murray (4.1 feet, MAN). Blake LaVine misses. Rebound secured by Ja Banchero.

[04:27] Team_068 possession (Score: 50-33)
Franz Curry attempts a 3Pt. Contested by Shai Ingram (5.0 feet, MAN). Franz Curry misses. Offensive rebound by Jarrett Oladipo! Jarrett Oladipo kicks it out.

[04:14] Team_068 possession (Score: 50-33)
FOUL! Shooting foul on Jalen Turner. Ja Banchero to the line for 3 free throws. [BONUS: 7 team fouls] (Jalen Turner: 1 personal fouls)   FT 1/3: GOOD   FT 2/3: MISS   FT 3/3: GOOD Ja Banchero makes 2/3 from the line.
Score: 52-33

[03:58] Team_019 possession (Score: 52-33)
Jalen Turner attempts a 3Pt. Contested by Ja Banchero (5.4 feet, MAN). JALEN TURNER MAKES IT! Assist: Blake LaVine
Score: 52-36

[03:44] Team_068 possession (Score: 52-36)
Franz Curry attempts a Layup. Wide open! Tim Jordan is 7.0 feet away. [ZONE] FRANZ CURRY MAKES IT! Assist: Miles Murray
Score: 54-36

[03:32] Team_019 possession (Score: 54-36)
Tim Jordan attempts a 3Pt. Contested by Franz Curry (4.3 feet, MAN). TIM JORDAN MAKES IT! Assist: Blake LaVine
Score: 54-39

[03:14] Team_068 possession (Score: 54-39)
Jarrett Oladipo drives, picks up Shai Ingram. Help arrives from Jalen Turner! Jarrett Oladipo attempts a Dunk. Contested by Jalen Turner (4.9 feet, MAN). JARRETT OLADIPO MAKES IT! Assist: Cole Anthony
Score: 56-39

[03:03] Team_019 possession (Score: 56-39)
FOUL! Shooting foul on Miles Murray. Blake LaVine to the line for 2 free throws. [Team fouls: 2] (Miles Murray: 1 personal fouls)   FT 1/2: GOOD   FT 2/2: GOOD Blake LaVine makes 2/2 from the line.
Score: 56-41

[02:52] Team_068 possession (Score: 56-41)
Jarrett Oladipo attempts a Layup. Contested by Shai Ingram (4.9 feet, MAN). JARRETT OLADIPO MAKES IT! Assist: Ja Banchero
Score: 58-41

[02:34] Team_019 possession (Score: 58-41)
Jalen Turner drives and kicks out. Tim Jordan attempts a 3Pt. Contested by Ja Banchero (5.1 feet, ZONE). TIM JORDAN MAKES IT! Assist: Jalen Turner
Score: 58-44

[02:24] Team_068 possession (Score: 58-44)
FOUL! Reach-in foul on Blake LaVine during the drive. [IN THE BONUS! 8 team fouls] Miles Murray to the line for 2 free throws. (Blake LaVine: 1 personal fouls)   FT 1/2: GOOD   FT 2/2: GOOD Miles Murray makes 2/2 from the line.
Score: 60-44

[02:12] Team_019 possession (Score: 60-44)
Gary Ginobili attempts a 3Pt. Contested by Cole Anthony (5.4 feet, MAN). Gary Ginobili misses. Rebound secured by Jarrett Oladipo.

[02:02] Team_068 possession (Score: 60-44)
Cole Anthony drives, Shai Ingram stays with him. Cole Anthony attempts a Dunk. Contested by Shai Ingram (4.4 feet, ZONE). Cole Anthony misses. Rebound secured by Tim Jordan.

[01:48] Team_019 possession (Score: 60-44)
FOUL! Reach-in foul on Franz Curry during the drive. [Team fouls: 3] No free throws, side out. (Franz Curry: 1 personal fouls)

[01:32] Team_019 possession (Score: 60-44)
FOUL! Reach-in foul on Ja Banchero during the drive. [Team fouls: 4] No free throws, side out. (Ja Banchero: 1 personal fouls)

[01:19] Team_019 possession (Score: 60-44)
FOUL! Shooting foul on Franz Curry. Tim Jordan to the line for 2 free throws. [BONUS: 5 team fouls] (Franz Curry: 2 personal fouls)   FT 1/2: MISS   FT 2/2: GOOD Tim Jordan makes 1/2 from the line.
Score: 60-45

[01:04] Team_068 possession (Score: 60-45)
Franz Curry attempts a Midrange. Contested by Blake LaVine (5.2 feet, ZONE). FRANZ CURRY MAKES IT!
Score: 62-45

[00:49] Team_019 possession (Score: 62-45)
Jalen Turner drives, Franz Curry stays with him. Jalen Turner attempts a Dunk. Contested by Franz Curry (4.6 feet, ZONE). Jalen Turner misses. Offensive rebound by Tim Jordan! Tim Jordan kicks it out.

[00:36] Team_019 possession (Score: 62-45)
Shai Ingram makes the Dunk and draws the foul on Jarrett Oladipo! And-1! Shai Ingram to the line for 1. [BONUS: 6 team fouls] (Jarrett Oladipo: 1 personal fouls)   FT 1/1: GOOD Shai Ingram makes 1/1 from the line.
Score: 62-48

[00:21] Team_068 possession (Score: 62-48)
FOUL! Holding foul on Gary Ginobili. [IN THE BONUS! 9 team fouls] Cole Anthony to the line for 2 free throws. (Gary Ginobili: 2 personal fouls)   FT 1/2: GOOD   FT 2/2: GOOD Cole Anthony makes 2/2 from the line.
Score: 64-48

[00:07] Team_019 possession (Score: 64-48)
Gary Ginobili drives, picks up Cole Anthony. Help arrives from Miles Murray! Gary Ginobili attempts a Dunk. Contested by Miles Murray (5.6 feet, MAN). Gary Ginobili misses. Offensive rebound by Shai Ingram! Shai Ingram kicks it out.

================================================================================
                              2ND QUARTER COMPLETE                              
================================================================================

2ND QUARTER SCORE: Team_068 35, Team_019 29

BOX SCORE:
================================================================================

Team_068
--------------------------------------------------------------------------------
Player                MIN  PTS  REB  AST  TO      FG   FG%      3P   3P%
--------------------------------------------------------------------------------
Cole Anthony           11    8    0    1   0   3/4    75.0     0/0   0.0
Jaren Johnson          17    6    2    2   0   2/2   100.0     0/0   0.0
Nikola Ginobili        17    6    2    0   0   3/4    75.0     0/0   0.0
Jarrett Oladipo         7    4    2    1   0   2/2   100.0     0/0   0.0
Franz Curry             7    4    0    0   0   2/2   100.0     0/0   0.0
Malcolm Herro          17    3    0    0   0   1/2    50.0     0/0   0.0
Ja Banchero             7    2    1    1   0   1/1   100.0     0/0   0.0
Miles Murray            7    2    0    1   0   1/1   100.0     0/0   0.0
Gary Simons            17    0    3    0   0   0/1     0.0     0/0   0.0

TEAM: FG: 15/19 (78.9%), 3PT: 4/5 (80.0%), REB: 10 (4 off, 6 def), AST: 6, TO: 2
TEAM FOULS: 6 [Team_019 in BONUS]


Team_019
--------------------------------------------------------------------------------
Player                MIN  PTS  REB  AST  TO      FG   FG%      3P   3P%
--------------------------------------------------------------------------------
Tim Jordan              7    7    2    0   0   3/3   100.0     0/0   0.0
Rudy Giddey            17    5    0    0   0   2/2   100.0     0/0   0.0
Jalen Turner            7    5    0    1   0   2/2   100.0     0/0   0.0
Brandon James          17    3    0    0   0   1/2    50.0     0/0   0.0
Shai Ingram             7    3    1    0   0   1/1   100.0     0/0   0.0
DeMar James            17    2    3    1   0   1/1   100.0     0/0   0.0
Blake LaVine            7    2    0    2   0   1/2    50.0     0/0   0.0
Tobias Hyland          17    0    0    1   0   0/3     0.0     0/0   0.0
D'Angelo Randle        17    0    1    1   0   0/0     0.0     0/0   0.0
Gary Ginobili           7    0    0    0   0   0/1     0.0     0/0   0.0

TEAM: FG: 11/17 (64.7%), 3PT: 4/10 (40.0%), REB: 7 (3 off, 4 def), AST: 6, TO: 3
TEAM FOULS: 9 [Team_068 in BONUS]

================================================================================

================================================================================
                       3RD QUARTER - Team_068 vs Team_019                       
================================================================================

[12:00] Team_068 possession (Score: 64-48)
Nikola Ginobili loses control! Ball rolls out of bounds! TURNOVER! (dead ball)

[11:46] Team_019 possession (Score: 64-48)
Rudy Giddey drives and kicks out. DeMar James attempts a Midrange. Contested by Nikola Ginobili (4.0 feet, MAN). DeMar James misses. Rebound secured by Jaren Johnson.

[11:34] Team_068 possession (Score: 64-48)
Malcolm Herro attempts a 3Pt. Contested by Brandon James (5.1 feet, ZONE). Malcolm Herro misses. Rebound secured by DeMar James.

[11:15] Team_019 possession (Score: 64-48)
DeMar James attempts a Layup. BLOCKED BY GARY SIMONS! Ball is loose! Offensive rebound by DeMar James! DeMar James kicks it out.

[11:00] Team_019 possession (Score: 64-48)
Brandon James attempts a 3Pt. Contested by Zion Anunoby (4.4 feet, ZONE). BRANDON JAMES MAKES IT! Assist: Tobias Hyland
Score: 64-51

[10:50] Team_068 possession (Score: 64-51)
Malcolm Herro attempts a Layup. Contested by Brandon James (5.1 feet, MAN). MALCOLM HERRO MAKES IT!
Score: 66-51

[10:34] Team_019 possession (Score: 66-51)
DeMar James drives and kicks out. FOUL! Shooting foul on Malcolm Herro. Brandon James to the line for 2 free throws. [Team fouls: 1] (Malcolm Herro: 1 personal fouls)   FT 1/2: GOOD   FT 2/2: GOOD Brandon James makes 2/2 from the line.
Score: 66-53

[10:15] Team_068 possession (Score: 66-53)
Zion Anunoby attempts a 3Pt. Contested by Rudy Giddey (5.7 feet, MAN). ZION ANUNOBY MAKES IT!
Score: 69-53

[10:04] Team_019 possession (Score: 69-53)
Rudy Giddey attempts a 3Pt. Contested by Zion Anunoby (4.6 feet, MAN). Rudy Giddey misses. Rebound secured by Jaren Johnson.

[09:52] Team_068 possession (Score: 69-53)
Jaren Johnson drives, DeMar James stays with him. Jaren Johnson attempts a Dunk. Contested by DeMar James (4.7 feet, ZONE). Jaren Johnson misses. Rebound secured by D'Angelo Randle.

[09:35] Team_019 possession (Score: 69-53)
Rudy Giddey attempts a 3Pt. Contested by Zion Anunoby (4.6 feet, ZONE). RUDY GIDDEY MAKES IT! Assist: Tobias Hyland
Score: 69-56

[09:23] Team_068 possession (Score: 69-56)
Zion Anunoby attempts a 3Pt. Contested by D'Angelo Randle (4.0 feet, ZONE). Zion Anunoby misses. Rebound secured by D'Angelo Randle.

[09:13] Team_019 possession (Score: 69-56)
Tobias Hyland attempts a Layup. BLOCKED BY GARY SIMONS! Ball deflects out of bounds off Tobias Hyland.

[09:01] Team_068 possession (Score: 69-56)
Gary Simons attempts a Midrange. Wide open! Tobias Hyland is 6.4 feet away. [MAN] GARY SIMONS MAKES IT! Assist: Malcolm Herro
Score: 71-56

[08:48] Team_019 possession (Score: 71-56)
Tobias Hyland drives and kicks out. Rudy Giddey attempts a 3Pt. Contested by Zion Anunoby (4.4 feet, MAN). Rudy Giddey misses. Rebound secured by Nikola Ginobili.

[08:35] Team_068 possession (Score: 71-56)
Malcolm Herro attempts a 3Pt. Contested by Tobias Hyland (5.6 feet, ZONE). MALCOLM HERRO MAKES IT! Assist: Gary Simons
Score: 74-56

[08:25] Team_019 possession (Score: 74-56)
Brandon James attempts a Midrange. Contested by Jaren Johnson (3.6 feet, ZONE). Brandon James misses. Rebound secured by Nikola Ginobili.

[08:12] Team_068 possession (Score: 74-56)
Gary Simons attempts a Layup. Contested by DeMar James (5.0 feet, ZONE). GARY SIMONS MAKES IT!
Score: 76-56

[07:59] Team_019 possession (Score: 76-56)
Tobias Hyland attempts a Layup. Contested by Gary Simons (3.2 feet, MAN). TOBIAS HYLAND MAKES IT! Assist: Rudy Giddey
Score: 76-58

[07:44] Team_068 possession (Score: 76-58)
Gary Simons drives to the basket... FOUL! Offensive foul on Gary Simons! Tobias Hyland drew the charge! [Team fouls: 2] (Gary Simons: 1 personal fouls) TURNOVER! (dead ball)

[07:31] Team_019 possession (Score: 76-58)
DeMar James attempts a Midrange. Contested by Malcolm Herro (4.6 feet, ZONE). DeMar James misses. Offensive rebound by DeMar James! DeMar James puts it back in!
Score: 76-60

[07:15] Team_068 possession (Score: 76-60)
Jaren Johnson attempts a 3Pt. Wide open! Tobias Hyland is 6.1 feet away. [ZONE] Jaren Johnson misses. Rebound secured by Tobias Hyland.

[07:06] Team_019 possession (Score: 76-60)
Rudy Giddey attempts a 3Pt. Contested by Zion Anunoby (4.6 feet, MAN). Rudy Giddey misses. Rebound secured by Nikola Ginobili.

[06:54] Team_068 possession (Score: 76-60)
Zion Anunoby drives, DeMar James stays with him. Zion Anunoby attempts a Layup. Contested by DeMar James (4.6 feet, ZONE). ZION ANUNOBY MAKES IT!
Score: 78-60

[06:39] Team_019 possession (Score: 78-60)
Rudy Giddey drives, picks up Gary Simons. Help arrives from Malcolm Herro! Rudy Giddey attempts a Dunk. Contested by Malcolm Herro (3.4 feet, ZONE). Rudy Giddey misses. Rebound secured by Nikola Ginobili.

[06:22] Team_068 possession (Score: 78-60)
Zion Anunoby attempts a Midrange. Contested by Rudy Giddey (5.7 feet, MAN). ZION ANUNOBY MAKES IT!
Score: 80-60

[06:06] Team_019 possession (Score: 80-60)
FOUL! Shooting foul on Nikola Ginobili. DeMar James to the line for 2 free throws. [Team fouls: 3] (Nikola Ginobili: 1 personal fouls)   FT 1/2: MISS   FT 2/2: MISS DeMar James makes 0/2 from the line. Rebound secured by Gary Simons.

[05:53] Team_068 possession (Score: 80-60)
Jaren Johnson attempts a 3Pt. Contested by D'Angelo Randle (4.1 feet, MAN). Jaren Johnson misses. Rebound secured by Tobias Hyland.

[05:40] Team_019 possession (Score: 80-60)
DeMar James makes the Layup and draws the foul on Nikola Ginobili! And-1! DeMar James to the line for 1. [Team fouls: 4] (Nikola Ginobili: 2 personal fouls)   FT 1/1: MISS DeMar James makes 0/1 from the line. Rebound secured by Nikola Ginobili.
Score: 80-62

[05:29] Team_068 possession (Score: 80-62)
Malcolm Herro attempts a 3Pt. Contested by Brandon James (5.1 feet, MAN). MALCOLM HERRO MAKES IT! Assist: Jaren Johnson
Score: 83-62

[05:17] Team_019 possession (Score: 83-62)
DeMar James drives, Nikola Ginobili stays with him. DeMar James attempts a Dunk. Contested by Nikola Ginobili (4.5 feet, MAN). DeMar James misses. Rebound secured by Jaren Johnson.

[04:59] Team_068 possession (Score: 83-62)
Nikola Ginobili drives to the basket... Nikola Ginobili loses control! Ball rolls out of bounds! TURNOVER! (dead ball)

[04:45] Team_019 possession (Score: 83-62)
Rudy Giddey attempts a 3Pt. Contested by Zion Anunoby (4.6 feet, MAN). Rudy Giddey misses. Offensive rebound by DeMar James! DeMar James puts it back in!
Score: 83-64

[04:31] Team_068 possession (Score: 83-64)
Jaren Johnson attempts a 3Pt. Contested by D'Angelo Randle (4.2 feet, MAN). Jaren Johnson misses. Rebound secured by Tobias Hyland.

[04:16] Team_019 possession (Score: 83-64)
Tobias Hyland attempts a Layup. Contested by Gary Simons (3.4 feet, ZONE). TOBIAS HYLAND MAKES IT!
Score: 83-66

[03:58] Team_068 possession (Score: 83-66)
FOUL! Holding foul on Rudy Giddey. [Team fouls: 1] No free throws, side out. (Rudy Giddey: 1 personal fouls)

[03:43] Team_068 possession (Score: 83-66)
Zion Anunoby attempts a 3Pt. Contested by Rudy Giddey (5.8 feet, MAN). ZION ANUNOBY MAKES IT! Assist: Nikola Ginobili
Score: 86-66

[03:29] Team_019 possession (Score: 86-66)
D'Angelo Randle attempts a 3Pt. Contested by Zion Anunoby (4.7 feet, ZONE). D'Angelo Randle misses. Rebound secured by Jaren Johnson.

[03:16] Team_068 possession (Score: 86-66)
Jaren Johnson attempts a 3Pt. Contested by D'Angelo Randle (4.3 feet, MAN). Jaren Johnson misses. Rebound secured by Tobias Hyland.

[03:03] Team_019 possession (Score: 86-66)
Brandon James attempts a 3Pt. Contested by Zion Anunoby (4.6 feet, ZONE). Brandon James misses. Rebound secured by Gary Simons.

[02:45] Team_068 possession (Score: 86-66)
Gary Simons drives, picks up DeMar James. Help arrives from Brandon James! Gary Simons attempts a Layup. Contested by Brandon James (5.3 feet, ZONE). Gary Simons misses. Offensive rebound by Nikola Ginobili! Nikola Ginobili's putback is no good. Rebound secured by Tobias Hyland.

[02:30] Team_019 possession (Score: 86-66)
DeMar James drives, picks up Gary Simons. Help arrives from Malcolm Herro! DeMar James attempts a Layup. Contested by Malcolm Herro (3.9 feet, ZONE). DEMAR JAMES MAKES IT!
Score: 86-68

[02:17] Team_068 possession (Score: 86-68)
Zion Anunoby drives and kicks out. Jaren Johnson attempts a Midrange. Contested by D'Angelo Randle (4.0 feet, MAN). JAREN JOHNSON MAKES IT!
Score: 88-68

[01:59] Team_019 possession (Score: 88-68)
Brandon James attempts a Layup. BLOCKED BY MALCOLM HERRO! Ball deflects out of bounds off Brandon James.

[01:43] Team_068 possession (Score: 88-68)
Zion Anunoby attempts a 3Pt. Contested by D'Angelo Randle (4.4 feet, ZONE). ZION ANUNOBY MAKES IT! Assist: Gary Simons
Score: 91-68

[01:28] Team_019 possession (Score: 91-68)
Tobias Hyland attempts a 3Pt. Contested by Gary Simons (3.7 feet, MAN). Tobias Hyland misses. Rebound secured by Jaren Johnson.

[01:17] Team_068 possession (Score: 91-68)
Gary Simons attempts a Midrange. Contested by D'Angelo Randle (4.8 feet, ZONE). Gary Simons misses. Rebound secured by D'Angelo Randle.

[01:03] Team_019 possession (Score: 91-68)
DeMar James drives, picks up Nikola Ginobili. Help arrives from Malcolm Herro! DeMar James attempts a Layup. Contested by Malcolm Herro (5.0 feet, MAN). DEMAR JAMES MAKES IT! Assist: D'Angelo Randle
Score: 91-70

[00:47] Team_068 possession (Score: 91-70)
Gary Simons attempts a 3Pt. Contested by D'Angelo Randle (4.9 feet, ZONE). Gary Simons misses. Rebound secured by DeMar James.

[00:31] Team_019 possession (Score: 91-70)
D'Angelo Randle attempts a Layup. Contested by Gary Simons (4.0 feet, ZONE). D'ANGELO RANDLE MAKES IT! Assist: Tobias Hyland
Score: 91-72

[00:17] Team_068 possession (Score: 91-72)
Gary Simons attempts a Midrange. Wide open! Tobias Hyland is 6.9 feet away. [ZONE] GARY SIMONS MAKES IT! Assist: Malcolm Herro
Score: 93-72

================================================================================
                              3RD QUARTER COMPLETE                              
================================================================================

3RD QUARTER SCORE: Team_068 29, Team_019 24

BOX SCORE:
================================================================================

Team_068
--------------------------------------------------------------------------------
Player                MIN  PTS  REB  AST  TO      FG   FG%      3P   3P%
--------------------------------------------------------------------------------
Zion Anunoby           26   13    0    0   0   5/6    83.3     0/0   0.0
Malcolm Herro          29    8    0    2   0   3/4    75.0     0/0   0.0
Gary Simons            29    6    2    2   0   3/6    50.0     0/0   0.0
Jaren Johnson          29    2    5    1   0   1/6    16.7     0/0   0.0
Nikola Ginobili        29    0    5    1   0   0/0     0.0     0/0   0.0

TEAM: FG: 12/22 (54.5%), 3PT: 5/12 (41.7%), REB: 13 (1 off, 12 def), AST: 6, TO: 3
TEAM FOULS: 4


Team_019
--------------------------------------------------------------------------------
Player                MIN  PTS  REB  AST  TO      FG   FG%      3P   3P%
--------------------------------------------------------------------------------
DeMar James            29    8    5    0   0   4/7    57.1     0/0   0.0
Brandon James          29    5    0    0   0   2/5    40.0     0/0   0.0
Tobias Hyland          29    4    5    3   0   2/5    40.0     0/0   0.0
Rudy Giddey            29    3    0    1   0   1/5    20.0     0/0   0.0
D'Angelo Randle        29    2    3    1   0   1/2    50.0     0/0   0.0

TEAM: FG: 10/24 (41.7%), 3PT: 3/8 (37.5%), REB: 12 (3 off, 9 def), AST: 5, TO: 0
TEAM FOULS: 1

================================================================================

================================================================================
                       4TH QUARTER - Team_068 vs Team_019                       
================================================================================

[12:00] Team_068 possession (Score: 93-72)
Gary Simons attempts a Midrange. Wide open! Tobias Hyland is 6.7 feet away. [MAN] GARY SIMONS MAKES IT!
Score: 95-72

[11:47] Team_019 possession (Score: 95-72)
FOUL! Holding foul on Jaren Johnson. [Team fouls: 1] No free throws, side out. (Jaren Johnson: 1 personal fouls)

[11:33] Team_019 possession (Score: 95-72)
DeMar James drives, picks up Gary Simons. Help arrives from Malcolm Herro! DeMar James attempts a Dunk. Contested by Malcolm Herro (4.0 feet, ZONE). DEMAR JAMES MAKES IT! Assist: D'Angelo Randle
Score: 95-74

[11:16] Team_068 possession (Score: 95-74)
Malcolm Herro drives to the basket... Malcolm Herro commits a violation (traveling/carry)! TURNOVER! (dead ball)

[11:16] Substitution (Team_068): Zion Anunoby OUT → Cole Anthony IN (stamina_rule2)

[11:16] Substitution (Team_068): Malcolm Herro OUT → Ja Banchero IN (stamina_rule2)

[11:16] Substitution (Team_068): Jaren Johnson OUT → Miles Murray IN (stamina_rule2)

[11:16] Substitution (Team_068): Gary Simons OUT → Jarrett Oladipo IN (stamina_rule2)

[11:16] Substitution (Team_068): Nikola Ginobili OUT → Franz Curry IN (stamina_rule2)

[11:16] Substitution (Team_019): Rudy Giddey OUT → Gary Ginobili IN (stamina_rule2)

[11:16] Substitution (Team_019): Brandon James OUT → Jalen Turner IN (stamina_rule2)

[11:16] Substitution (Team_019): D'Angelo Randle OUT → Blake LaVine IN (stamina_rule2)

[11:16] Substitution (Team_019): Tobias Hyland OUT → Shai Ingram IN (stamina_rule2)

[11:16] Substitution (Team_019): DeMar James OUT → Tim Jordan IN (stamina_rule2)

[11:00] Team_019 possession (Score: 95-74)
Jalen Turner commits a violation (traveling/carry)! TURNOVER! (dead ball)

[10:47] Team_068 possession (Score: 95-74)
FOUL! Holding foul on Shai Ingram. [Team fouls: 1] No free throws, side out. (Shai Ingram: 1 personal fouls)

[10:31] Team_068 possession (Score: 95-74)
FOUL! Holding foul on Shai Ingram. [Team fouls: 2] No free throws, side out. (Shai Ingram: 2 personal fouls)

[10:18] Team_068 possession (Score: 95-74)
Cole Anthony attempts a Midrange. Contested by Blake LaVine (4.6 feet, ZONE). COLE ANTHONY MAKES IT!
Score: 97-74

[10:00] Team_019 possession (Score: 97-74)
Jalen Turner attempts a 3Pt. Contested by Ja Banchero (5.4 feet, MAN). JALEN TURNER MAKES IT! Assist: Gary Ginobili
Score: 97-77

[09:49] Team_068 possession (Score: 97-77)
Franz Curry attempts a Midrange. Contested by Shai Ingram (5.0 feet, ZONE). Franz Curry misses. Offensive rebound by Franz Curry! Franz Curry puts it back in!
Score: 99-77

[09:34] Team_019 possession (Score: 99-77)
Jalen Turner throws a bad pass out of bounds! TURNOVER! (dead ball)

[09:20] Team_068 possession (Score: 99-77)
Jarrett Oladipo attempts a Layup. Contested by Shai Ingram (4.9 feet, ZONE). JARRETT OLADIPO MAKES IT! Assist: Cole Anthony
Score: 101-77

[09:07] Team_019 possession (Score: 101-77)
Gary Ginobili attempts a 3Pt. Contested by Cole Anthony (5.2 feet, ZONE). GARY GINOBILI MAKES IT! Assist: Jalen Turner
Score: 101-80

[08:48] Team_068 possession (Score: 101-80)
FOUL! Holding foul on Shai Ingram. [Team fouls: 3] No free throws, side out. (Shai Ingram: 3 personal fouls)

[08:32] Team_068 possession (Score: 101-80)
Ja Banchero attempts a 3Pt. Contested by Blake LaVine (4.9 feet, ZONE). Ja Banchero misses. Rebound secured by Blake LaVine.

[08:13] Team_019 possession (Score: 101-80)
FOUL! Offensive foul on Tim Jordan! Franz Curry drew the charge! [Team fouls: 4] (Tim Jordan: 1 personal fouls) TURNOVER! (dead ball)

[07:57] Team_068 possession (Score: 101-80)
FOUL! Reach-in foul on Shai Ingram during the drive. [IN THE BONUS! 5 team fouls] Franz Curry to the line for 2 free throws. (Shai Ingram: 4 personal fouls)   FT 1/2: GOOD   FT 2/2: GOOD Franz Curry makes 2/2 from the line.
Score: 103-80

[07:39] Team_019 possession (Score: 103-80)
Shai Ingram attempts a 3Pt. Contested by Ja Banchero (5.1 feet, ZONE). Shai Ingram misses. Rebound secured by Jarrett Oladipo.

[07:24] Team_068 possession (Score: 103-80)
Miles Murray attempts a 3Pt. Contested by Blake LaVine (4.9 feet, ZONE). Miles Murray misses. Rebound secured by Blake LaVine.

[07:07] Team_019 possession (Score: 103-80)
Shai Ingram drives, Jarrett Oladipo stays with him. Shai Ingram attempts a Layup. Contested by Jarrett Oladipo (3.8 feet, MAN). SHAI INGRAM MAKES IT! Assist: Tim Jordan
Score: 103-82

[06:48] Team_068 possession (Score: 103-82)
Franz Curry attempts a 3Pt. Contested by Blake LaVine (5.2 feet, ZONE). Franz Curry misses. Rebound secured by Shai Ingram.

[06:38] Team_019 possession (Score: 103-82)
Tim Jordan drives and kicks out. Gary Ginobili attempts a 3Pt. Contested by Ja Banchero (5.1 feet, ZONE). Gary Ginobili misses. Rebound secured by Ja Banchero.

[06:24] Team_068 possession (Score: 103-82)
Jarrett Oladipo throws a bad pass! Stolen by Shai Ingram! TURNOVER! (live ball)

[06:12] Team_019 possession (Score: 103-82)
Shai Ingram attempts a Midrange. Contested by Ja Banchero (5.1 feet, ZONE). Shai Ingram misses. Rebound secured by Ja Banchero.

[06:01] Team_068 possession (Score: 103-82)
Cole Anthony attempts a Midrange. Contested by Shai Ingram (4.4 feet, ZONE). Cole Anthony misses. Rebound secured by Blake LaVine.

[05:51] Team_019 possession (Score: 103-82)
FOUL! Shooting foul on Jarrett Oladipo. Shai Ingram to the line for 2 free throws. [Team fouls: 2] (Jarrett Oladipo: 1 personal fouls)   FT 1/2: MISS   FT 2/2: GOOD Shai Ingram makes 1/2 from the line.
Score: 103-83

[05:37] Team_068 possession (Score: 103-83)
Franz Curry attempts a Dunk. BLOCKED BY SHAI INGRAM! Ball is loose! Rebound secured by Shai Ingram.

[05:27] Team_019 possession (Score: 103-83)
Tim Jordan attempts a Midrange. Contested by Franz Curry (4.3 feet, MAN). Tim Jordan misses. Rebound secured by Ja Banchero.

[05:10] Team_068 possession (Score: 103-83)
Franz Curry drives to the basket... FOUL! Offensive foul on Franz Curry! Shai Ingram drew the charge! [Team fouls: 3] (Franz Curry: 1 personal fouls) TURNOVER! (dead ball)

[04:57] Team_019 possession (Score: 103-83)
Shai Ingram makes the Dunk and draws the foul on Franz Curry! And-1! Shai Ingram to the line for 1. [Team fouls: 4] (Franz Curry: 2 personal fouls)   FT 1/1: GOOD Shai Ingram makes 1/1 from the line.
Score: 103-86

[04:39] Team_068 possession (Score: 103-86)
Ja Banchero attempts a Midrange. Contested by Jalen Turner (4.1 feet, MAN). Ja Banchero misses. Offensive rebound by Jarrett Oladipo! Jarrett Oladipo kicks it out.

[04:27] Team_068 possession (Score: 103-86)
Franz Curry drives, picks up Shai Ingram. Help arrives from Jalen Turner! Franz Curry attempts a Layup. Contested by Jalen Turner (5.0 feet, MAN). Franz Curry misses. Rebound secured by Blake LaVine.

[04:12] Team_019 possession (Score: 103-86)
Jalen Turner attempts a Midrange. Contested by Ja Banchero (5.4 feet, MAN). Jalen Turner misses. Rebound secured by Jarrett Oladipo.

[04:00] Team_068 possession (Score: 103-86)
Ja Banchero attempts a 3Pt. Contested by Blake LaVine (4.9 feet, ZONE). Ja Banchero misses. FOUL! Loose ball foul on Blake LaVine during the rebound battle. [IN THE BONUS! 6 team fouls] Franz Curry to the line for 2 free throws. (Blake LaVine: 1 personal fouls)   FT 1/2: GOOD   FT 2/2: MISS Franz Curry makes 1/2 from the line. Rebound secured by Tim Jordan.
Score: 104-86

[03:42] Team_019 possession (Score: 104-86)
Gary Ginobili attempts a 3Pt. Contested by Cole Anthony (5.2 feet, MAN). GARY GINOBILI MAKES IT! Assist: Jalen Turner
Score: 104-89

[03:28] Team_068 possession (Score: 104-89)
Cole Anthony makes the Layup and draws the foul on Gary Ginobili! And-1! Cole Anthony to the line for 1. [BONUS: 7 team fouls] (Gary Ginobili: 1 personal fouls)   FT 1/1: GOOD Cole Anthony makes 1/1 from the line.
Score: 107-89

[03:12] Team_019 possession (Score: 107-89)
Gary Ginobili attempts a 3Pt. Contested by Ja Banchero (5.7 feet, ZONE). GARY GINOBILI MAKES IT! Assist: Blake LaVine
Score: 107-92

[03:00] Team_068 possession (Score: 107-92)
Ja Banchero attempts a Midrange. Contested by Jalen Turner (4.1 feet, ZONE). JA BANCHERO MAKES IT!
Score: 109-92

[02:50] Team_019 possession (Score: 109-92)
Shai Ingram attempts a Midrange. Contested by Jarrett Oladipo (4.0 feet, MAN). Shai Ingram misses. Rebound secured by Ja Banchero.

[02:39] Team_068 possession (Score: 109-92)
Jarrett Oladipo drives to the basket... Jarrett Oladipo loses control! Ball rolls out of bounds! TURNOVER! (dead ball)

[02:22] Team_019 possession (Score: 109-92)
Jalen Turner attempts a Layup. BLOCKED BY FRANZ CURRY! Ball is loose! Offensive rebound by Tim Jordan! Tim Jordan kicks it out.

[02:08] Team_019 possession (Score: 109-92)
Tim Jordan drives to the basket... Tim Jordan throws a bad pass out of bounds! TURNOVER! (dead ball)

[01:55] Team_068 possession (Score: 109-92)
Ja Banchero drives, picks up Shai Ingram. Help arrives from Jalen Turner! Ja Banchero attempts a Dunk. Contested by Jalen Turner (4.9 feet, ZONE). JA BANCHERO MAKES IT!
Score: 111-92

[01:38] Team_019 possession (Score: 111-92)
Gary Ginobili attempts a 3Pt. Contested by Cole Anthony (5.4 feet, MAN). Gary Ginobili misses. Rebound secured by Franz Curry.

[01:28] Team_068 possession (Score: 111-92)
Franz Curry attempts a Layup. Contested by Shai Ingram (5.3 feet, MAN). FRANZ CURRY MAKES IT!
Score: 113-92

[01:12] Team_019 possession (Score: 113-92)
Shai Ingram attempts a 3Pt. Contested by Jarrett Oladipo (4.1 feet, MAN). Shai Ingram misses. Rebound secured by Jarrett Oladipo.

[00:58] Team_068 possession (Score: 113-92)
Cole Anthony drives, Gary Ginobili stays with him. Cole Anthony attempts a Dunk. Wide open! Gary Ginobili is 6.0 feet away. [MAN] COLE ANTHONY MAKES IT! Assist: Miles Murray
Score: 115-92

[00:41] Team_019 possession (Score: 115-92)
FOUL! Shooting foul on Ja Banchero. Blake LaVine to the line for 3 free throws. [BONUS: 5 team fouls] (Ja Banchero: 1 personal fouls)   FT 1/3: GOOD   FT 2/3: MISS   FT 3/3: GOOD Blake LaVine makes 2/3 from the line.
Score: 115-94

[00:24] Team_068 possession (Score: 115-94)
Miles Murray attempts a Midrange. Contested by Jalen Turner (4.4 feet, ZONE). MILES MURRAY MAKES IT!
Score: 117-94

[00:13] Team_019 possession (Score: 117-94)
Blake LaVine attempts a Midrange. Contested by Ja Banchero (5.6 feet, ZONE). Blake LaVine misses. Rebound secured by Franz Curry.

================================================================================
                              4TH QUARTER COMPLETE                              
================================================================================

4TH QUARTER SCORE: Team_068 24, Team_019 22

BOX SCORE:
================================================================================

Team_068
--------------------------------------------------------------------------------
Player                MIN  PTS  REB  AST  TO      FG   FG%      3P   3P%
--------------------------------------------------------------------------------
Cole Anthony           22    7    0    1   0   3/4    75.0     0/0   0.0
Franz Curry            18    6    3    0   0   3/6    50.0     0/0   0.0
Ja Banchero            18    4    4    0   0   2/4    50.0     0/0   0.0
Gary Simons            30    2    0    0   0   1/1   100.0     0/0   0.0
Jarrett Oladipo        18    2    4    0   0   1/1   100.0     0/0   0.0
Miles Murray           18    2    0    1   0   1/2    50.0     0/0   0.0

TEAM: FG: 11/18 (61.1%), 3PT: 0/4 (0.0%), REB: 12 (3 off, 9 def), AST: 2, TO: 4
TEAM FOULS: 5 [Team_019 in BONUS]


Team_019
--------------------------------------------------------------------------------
Player                MIN  PTS  REB  AST  TO      FG   FG%      3P   3P%
--------------------------------------------------------------------------------
Gary Ginobili          18    9    0    1   0   3/4    75.0     0/0   0.0
Shai Ingram            18    6    2    0   0   3/7    42.9     0/0   0.0
Jalen Turner           18    3    0    2   0   1/2    50.0     0/0   0.0
DeMar James            30    2    0    0   0   1/1   100.0     0/0   0.0
Blake LaVine           18    2    4    1   0   1/2    50.0     0/0   0.0
D'Angelo Randle        30    0    0    1   0   0/0     0.0     0/0   0.0
Tim Jordan             18    0    2    1   0   0/2     0.0     0/0   0.0

TEAM: FG: 9/18 (50.0%), 3PT: 5/8 (62.5%), REB: 7 (1 off, 6 def), AST: 6, TO: 4
TEAM FOULS: 7 [Team_068 in BONUS]

================================================================================

================================================================================
                               FULL GAME COMPLETE                               
================================================================================

FINAL SCORE: Team_068 117, Team_019 94

SCORING BY QUARTER:
--------------------------------------------------------------------------------
Team                     Q1     Q2     Q3     Q4    FINAL
--------------------------------------------------------------------------------
Team_068                 29     35     29     24      117
Team_019                 19     29     24     22       94
--------------------------------------------------------------------------------

FULL GAME BOX SCORE:
================================================================================

Team_068
--------------------------------------------------------------------------------
Player                MIN  PTS  REB  AST  TO      FG   FG%      3P   3P%      FT STL BLK
--------------------------------------------------------------------------------
Malcolm Herro          30   11    0    4   3   5/8    62.5   3/5    60.0   0/0     2   1
Jaren Johnson          30    8   11    5   1   2/10   20.0   1/6    16.7   5/6     0   0
Gary Simons            30   13    6    3   1   7/12   58.3   0/2     0.0   1/1     2   3
Nikola Ginobili        30   10    9    1   2   4/7    57.1   0/0     0.0   0/0     0   0
Zion Anunoby           27   23    0    1   1   9/11   81.8   4/5    80.0   2/2     0   0
Cole Anthony           22   15    0    2   0   5/7    71.4   1/1   100.0   4/4     0   0
Ja Banchero            18    6    7    1   1   3/5    60.0   1/3    33.3   2/3     0   0
Miles Murray           18    7    0    2   0   3/4    75.0   1/2    50.0   2/2     0   0
Jarrett Oladipo        18    6    8    1   2   3/4    75.0   0/1     0.0   0/0     0   0
Franz Curry            18   15    3    1   0   7/10   70.0   0/1     0.0   7/9     0   1

TEAM: FG: 49/79 (62.0%), 3PT: 11/26 (42.3%), REB: 47 (11 off, 36 def), AST: 21, TO: 11


Team_019
--------------------------------------------------------------------------------
Player                MIN  PTS  REB  AST  TO      FG   FG%      3P   3P%      FT STL BLK
--------------------------------------------------------------------------------
Rudy Giddey            30    8    0    1   0   4/9    44.4   3/6    50.0   0/0     0   0
Brandon James          30   10    0    0   3   3/8    37.5   2/4    50.0   2/2     1   0
D'Angelo Randle        30    4    6    3   1   3/4    75.0   1/2    50.0   2/2     0   0
Tobias Hyland          30   11    7    4   2   5/12   41.7   0/4     0.0   3/4     0   0
DeMar James            30   20   14    1   2   8/13   61.5   0/0     0.0   2/5     0   1
Gary Ginobili          18    9    0    1   0   3/6    50.0   3/6    50.0   0/0     0   0
Jalen Turner           18    8    0    3   2   4/6    66.7   2/2   100.0   0/0     0   0
Blake LaVine           18    4    4    3   1   2/6    33.3   1/3    33.3   4/5     0   0
Shai Ingram            18    9    3    0   0   4/8    50.0   0/2     0.0   3/4     1   1
Tim Jordan             18    7    5    1   1   2/4    50.0   1/1   100.0   1/2     0   0

TEAM: FG: 38/76 (50.0%), 3PT: 13/30 (43.3%), REB: 36 (9 off, 27 def), AST: 17, TO: 12

================================================================================
