================================================================================
                        FULL GAME - Team_035 vs Team_033                        
================================================================================

================================================================================
                       1ST QUARTER - Team_035 vs Team_033                       
================================================================================

[12:00] Team_035 possession (Score: 0-0)
Gary Johnson attempts a 3Pt. Contested by Chris Anunoby (4.3 feet, ZONE). Gary Johnson misses. Rebound secured by Desmond DeRozan.

[11:47] Team_033 possession (Score: 0-0)
Joel Green attempts a 3Pt. Contested by Domantas Green (4.9 feet, MAN). Joel Green misses. Rebound secured by Dwyane Johnson.

[11:33] Team_035 possession (Score: 0-0)
Domantas Green throws a bad pass out of bounds! TURNOVER! (dead ball)

[11:19] Team_033 possession (Score: 0-0)
Chris Anunoby drives and kicks out. Chris Anunoby attempts a Midrange. Contested by Gary Johnson (3.8 feet, ZONE). Chris Anunoby misses. Rebound secured by Magic Westbrook.

[11:05] Team_035 possession (Score: 0-0)
Domantas Green attempts a Midrange. Contested by Joel Green (4.7 feet, MAN). Domantas Green misses. Offensive rebound by Dwyane Johnson! Dwyane Johnson's putback is no good. Offensive rebound by Magic Westbrook! Magic Westbrook kicks it out.

[10:53] Team_035 possession (Score: 0-0)
Shaquille Ginobili attempts a 3Pt. Contested by Chris Anunoby (3.7 feet, MAN). Shaquille Ginobili misses. Rebound secured by Desmond DeRozan.

[10:36] Team_033 possession (Score: 0-0)
Bradley Simmons makes the Dunk and draws the foul on Magic Westbrook! And-1! Bradley Simmons to the line for 1. [Team fouls: 1] (Magic Westbrook: 1 personal fouls)   FT 1/1: GOOD Bradley Simmons makes 1/1 from the line.
Score: 0-3

[10:23] Team_035 possession (Score: 0-3)
Magic Westbrook attempts a 3Pt. Contested by Joel Green (4.7 feet, ZONE). Magic Westbrook misses. Rebound secured by Bradley Simmons.

[10:09] Team_033 possession (Score: 0-3)
Desmond DeRozan drives, Dwyane Johnson stays with him. Desmond DeRozan attempts a Dunk. Contested by Dwyane Johnson (3.9 feet, ZONE). DESMOND DEROZAN MAKES IT!
Score: 0-5

[09:56] Team_035 possession (Score: 0-5)
Domantas Green drives, Bradley Simmons stays with him. Domantas Green attempts a Layup. Contested by Bradley Simmons (3.4 feet, ZONE). Domantas Green misses. Rebound secured by Cade Randle.

[09:43] Team_033 possession (Score: 0-5)
FOUL! Reach-in foul on Dwyane Johnson during the drive. [Team fouls: 2] No free throws, side out. (Dwyane Johnson: 1 personal fouls)

[09:30] Team_033 possession (Score: 0-5)
Joel Green loses the ball! Stripped by Domantas Green! TURNOVER! (live ball)

[09:15] Team_035 possession (Score: 0-5)
Magic Westbrook drives and kicks out. Dwyane Johnson attempts a Midrange. Contested by Chris Anunoby (3.8 feet, ZONE). Dwyane Johnson misses. Rebound secured by Bradley Simmons.

[09:01] Team_033 possession (Score: 0-5)
Bradley Simmons attempts a Layup. Contested by Dwyane Johnson (3.8 feet, ZONE). BRADLEY SIMMONS MAKES IT! Assist: Joel Green
Score: 0-7

[08:48] Team_035 possession (Score: 0-7)
Domantas Green makes the Midrange and draws the foul on Joel Green! And-1! Domantas Green to the line for 1. [Team fouls: 1] (Joel Green: 1 personal fouls)   FT 1/1: GOOD Domantas Green makes 1/1 from the line.
Score: 3-7

[08:35] Team_033 possession (Score: 3-7)
Cade Randle attempts a Midrange. Contested by Gary Johnson (4.3 feet, MAN). CADE RANDLE MAKES IT!
Score: 3-9

[08:23] Team_035 possession (Score: 3-9)
Gary Johnson makes the Layup and draws the foul on Cade Randle! And-1! Gary Johnson to the line for 1. [Team fouls: 2] (Cade Randle: 1 personal fouls)   FT 1/1: GOOD Gary Johnson makes 1/1 from the line.
Score: 6-9

[08:10] Team_033 possession (Score: 6-9)
Cade Randle attempts a 3Pt. Contested by Gary Johnson (4.3 feet, MAN). Cade Randle misses. Offensive rebound by Desmond DeRozan! Desmond DeRozan kicks it out.

[07:56] Team_033 possession (Score: 6-9)
Bradley Simmons drives, picks up Dwyane Johnson. Help arrives from Domantas Green! Bradley Simmons attempts a Layup. Contested by Domantas Green (3.8 feet, ZONE). BRADLEY SIMMONS MAKES IT! Assist: Joel Green
Score: 6-11

[07:39] Team_035 possession (Score: 6-11)
Magic Westbrook attempts a Midrange. Contested by Chris Anunoby (4.3 feet, ZONE). Magic Westbrook misses. Rebound secured by Desmond DeRozan.

[07:20] Team_033 possession (Score: 6-11)
Joel Green loses the ball! Stripped by Domantas Green! TURNOVER! (live ball)

[07:06] Team_035 possession (Score: 6-11)
FOUL! Offensive foul on Shaquille Ginobili! Chris Anunoby drew the charge! [Team fouls: 3] (Shaquille Ginobili: 1 personal fouls) TURNOVER! (dead ball)

[06:55] Team_033 possession (Score: 6-11)
Cade Randle makes the Layup and draws the foul on Domantas Green! And-1! Cade Randle to the line for 1. [Team fouls: 4] (Domantas Green: 1 personal fouls)   FT 1/1: GOOD Cade Randle makes 1/1 from the line.
Score: 6-14

[06:44] Team_035 possession (Score: 6-14)
Magic Westbrook drives to the basket... Magic Westbrook loses the ball! Stripped by Bradley Simmons! TURNOVER! (live ball)

[06:25] Team_033 possession (Score: 6-14)
Cade Randle attempts a 3Pt. Contested by Shaquille Ginobili (4.5 feet, ZONE). Cade Randle misses. Rebound secured by Dwyane Johnson.

[06:11] Team_035 possession (Score: 6-14)
Dwyane Johnson attempts a Layup. Contested by Desmond DeRozan (4.7 feet, MAN). Dwyane Johnson misses. Rebound secured by Desmond DeRozan.

[05:55] Team_033 possession (Score: 6-14)
Cade Randle attempts a 3Pt. Contested by Gary Johnson (4.3 feet, MAN). Cade Randle misses. Rebound secured by Dwyane Johnson.

[05:38] Team_035 possession (Score: 6-14)
Domantas Green attempts a 3Pt. Contested by Joel Green (4.7 feet, MAN). DOMANTAS GREEN MAKES IT! Assist: Shaquille Ginobili
Score: 9-14

[05:24] Team_033 possession (Score: 9-14)
Cade Randle attempts a Midrange. BLOCKED BY GARY JOHNSON! Ball is loose! Rebound secured by Magic Westbrook.

[05:10] Team_035 possession (Score: 9-14)
FOUL! Shooting foul on Chris Anunoby. Dwyane Johnson to the line for 2 free throws. [Team fouls: 3] (Chris Anunoby: 1 personal fouls)   FT 1/2: GOOD   FT 2/2: GOOD Dwyane Johnson makes 2/2 from the line.
Score: 11-14

[04:55] Team_033 possession (Score: 11-14)
Bradley Simmons attempts a Layup. Contested by Magic Westbrook (4.3 feet, MAN). BRADLEY SIMMONS MAKES IT! Assist: Joel Green
Score: 11-16

[04:40] Team_035 possession (Score: 11-16)
Magic Westbrook attempts a Midrange. Contested by Desmond DeRozan (5.3 feet, ZONE). Magic Westbrook misses. Rebound secured by Bradley Simmons.

[04:26] Team_033 possession (Score: 11-16)
Desmond DeRozan drives and kicks out. Joel Green attempts a 3Pt. Contested by Domantas Green (4.6 feet, MAN). Joel Green misses. Rebound secured by Dwyane Johnson.

[04:12] Team_035 possession (Score: 11-16)
Magic Westbrook attempts a Midrange. Contested by Joel Green (4.8 feet, ZONE). MAGIC WESTBROOK MAKES IT!
Score: 13-16

[03:54] Team_033 possession (Score: 13-16)
Joel Green loses the ball! Stripped by Domantas Green! TURNOVER! (live ball)

[03:37] Team_035 possession (Score: 13-16)
Shaquille Ginobili attempts a 3Pt. Contested by Chris Anunoby (3.9 feet, MAN). Shaquille Ginobili misses. Offensive rebound by Magic Westbrook! Magic Westbrook kicks it out.

[03:21] Team_035 possession (Score: 13-16)
Shaquille Ginobili drives, Bradley Simmons stays with him. Shaquille Ginobili attempts a Dunk. Contested by Bradley Simmons (3.1 feet, ZONE). Shaquille Ginobili misses. Rebound secured by Desmond DeRozan.

[03:04] Team_033 possession (Score: 13-16)
Chris Anunoby commits a violation (traveling/carry)! TURNOVER! (dead ball)

[03:04] Substitution (Team_035): Magic Westbrook OUT → John Durant IN (stamina_rule2)

[03:04] Substitution (Team_033): Desmond DeRozan OUT → Zion Adebayo IN (stamina_rule2)

[02:51] Team_035 possession (Score: 13-16)
FOUL! Shooting foul on Joel Green. Domantas Green to the line for 2 free throws. [Team fouls: 4] (Joel Green: 2 personal fouls)   FT 1/2: GOOD   FT 2/2: GOOD Domantas Green makes 2/2 from the line.
Score: 15-16

[02:39] Team_033 possession (Score: 15-16)
Chris Anunoby loses the ball! Stripped by Shaquille Ginobili! TURNOVER! (live ball)

[02:20] Team_035 possession (Score: 15-16)
Dwyane Johnson attempts a Layup. BLOCKED BY ZION ADEBAYO! Ball is loose! Rebound secured by Cade Randle.

[02:07] Team_033 possession (Score: 15-16)
Bradley Simmons attempts a Midrange. Contested by Gary Johnson (3.9 feet, ZONE). BRADLEY SIMMONS MAKES IT! Assist: Cade Randle
Score: 15-18

[01:53] Team_035 possession (Score: 15-18)
FOUL! Reach-in foul on Bradley Simmons during the drive. [IN THE BONUS! 5 team fouls] Gary Johnson to the line for 2 free throws. (Bradley Simmons: 1 personal fouls)   FT 1/2: GOOD   FT 2/2: GOOD Gary Johnson makes 2/2 from the line.
Score: 17-18

[01:35] Team_033 possession (Score: 17-18)
Cade Randle makes the Layup and draws the foul on Dwyane Johnson! And-1! Cade Randle to the line for 1. [BONUS: 5 team fouls] (Dwyane Johnson: 2 personal fouls)   FT 1/1: GOOD Cade Randle makes 1/1 from the line.
Score: 17-21

[01:25] Team_035 possession (Score: 17-21)
Shaquille Ginobili drives and kicks out. John Durant attempts a 3Pt. Contested by Chris Anunoby (4.3 feet, ZONE). JOHN DURANT MAKES IT! Assist: Dwyane Johnson
Score: 20-21

[01:06] Team_033 possession (Score: 20-21)
Cade Randle loses the ball! Stripped by Gary Johnson! TURNOVER! (live ball)

[00:49] Team_035 possession (Score: 20-21)
FOUL! Holding foul on Cade Randle. [IN THE BONUS! 6 team fouls] Gary Johnson to the line for 2 free throws. (Cade Randle: 2 personal fouls)   FT 1/2: GOOD   FT 2/2: GOOD Gary Johnson makes 2/2 from the line.
Score: 22-21

[00:35] Team_033 possession (Score: 22-21)
Bradley Simmons attempts a Midrange. Contested by John Durant (4.2 feet, MAN). BRADLEY SIMMONS MAKES IT! Assist: Joel Green
Score: 22-23

[00:20] Team_035 possession (Score: 22-23)
Gary Johnson drives, Cade Randle stays with him. Gary Johnson attempts a Dunk. Contested by Cade Randle (3.9 feet, MAN). GARY JOHNSON MAKES IT! Assist: Dwyane Johnson
Score: 24-23

[00:07] Team_033 possession (Score: 24-23)
Cade Randle attempts a 3Pt. Contested by Gary Johnson (4.7 feet, MAN). Cade Randle misses. Rebound secured by Gary Johnson.

================================================================================
                              1ST QUARTER COMPLETE                              
================================================================================

1ST QUARTER SCORE: Team_035 24, Team_033 23

BOX SCORE:
================================================================================

Team_035
--------------------------------------------------------------------------------
Player                MIN  PTS  REB  AST  TO      FG   FG%      3P   3P%
--------------------------------------------------------------------------------
Gary Johnson           12    9    1    0   0   4/5    80.0     0/0   0.0
Domantas Green         12    8    0    0   0   3/4    75.0     0/0   0.0
John Durant             3    3    0    0   0   1/1   100.0     0/0   0.0
Dwyane Johnson         12    2    4    2   0   1/3    33.3     0/0   0.0
Magic Westbrook         9    2    4    0   0   1/5    20.0     0/0   0.0
Shaquille Ginobili     12    0    0    1   0   0/2     0.0     0/0   0.0

TEAM: FG: 10/20 (50.0%), 3PT: 1/4 (25.0%), REB: 9 (2 off, 7 def), AST: 3, TO: 3
TEAM FOULS: 5 [Team_033 in BONUS]


Team_033
--------------------------------------------------------------------------------
Player                MIN  PTS  REB  AST  TO      FG   FG%      3P   3P%
--------------------------------------------------------------------------------
Bradley Simmons        12   13    3    0   0   6/6   100.0     0/0   0.0
Cade Randle            12    8    2    1   0   3/7    42.9     0/0   0.0
Desmond DeRozan         9    2    6    0   0   1/2    50.0     0/0   0.0
Joel Green             12    0    0    4   0   0/1     0.0     0/0   0.0
Chris Anunoby          12    0    0    0   0   0/1     0.0     0/0   0.0

TEAM: FG: 10/17 (58.8%), 3PT: 0/4 (0.0%), REB: 11 (1 off, 10 def), AST: 5, TO: 6
TEAM FOULS: 6 [Team_035 in BONUS]

================================================================================

================================================================================
                       2ND QUARTER - Team_035 vs Team_033                       
================================================================================

[12:00] Team_035 possession (Score: 24-23)
FOUL! Offensive foul on Gary Johnson! Cade Randle drew the charge! [Team fouls: 1] (Gary Johnson: 1 personal fouls) TURNOVER! (dead ball)

[11:48] Team_033 possession (Score: 24-23)
Joel Green attempts a 3Pt. Contested by Domantas Green (5.2 feet, MAN). JOEL GREEN MAKES IT! Assist: Desmond DeRozan
Score: 24-26

[11:35] Team_035 possession (Score: 24-26)
Dwyane Johnson drives, Desmond DeRozan stays with him. Dwyane Johnson attempts a Dunk. Contested by Desmond DeRozan (4.7 feet, MAN). DWYANE JOHNSON MAKES IT! Assist: Shaquille Ginobili
Score: 26-26

[11:24] Team_033 possession (Score: 26-26)
Bradley Simmons attempts a Layup. BLOCKED BY DOMANTAS GREEN! Ball is loose! Rebound secured by Dwyane Johnson.

[11:09] Team_035 possession (Score: 26-26)
Magic Westbrook drives to the basket... Magic Westbrook throws a bad pass out of bounds! TURNOVER! (dead ball)

[11:09] Substitution (Team_035): Domantas Green OUT → CJ LaVine IN (stamina_rule2)

[11:09] Substitution (Team_035): Shaquille Ginobili OUT → Cole George IN (stamina_rule2)

[11:09] Substitution (Team_035): Gary Johnson OUT → Malcolm Turner IN (stamina_rule2)

[11:09] Substitution (Team_035): Dwyane Johnson OUT → Tobias Jordan IN (stamina_rule2)

[11:09] Substitution (Team_033): Joel Green OUT → Ben Anthony IN (stamina_rule2)

[11:09] Substitution (Team_033): Chris Anunoby OUT → Manu Irving IN (stamina_rule2)

[11:09] Substitution (Team_033): Cade Randle OUT → Terry Jokic IN (stamina_rule2)

[11:09] Substitution (Team_033): Bradley Simmons OUT → Tim Griffin IN (stamina_rule2)

[10:51] Team_033 possession (Score: 26-26)
Desmond DeRozan attempts a 3Pt. Contested by Tobias Jordan (4.4 feet, MAN). Desmond DeRozan misses. Rebound secured by Cole George.

[10:36] Team_035 possession (Score: 26-26)
CJ LaVine attempts a Midrange. Contested by Ben Anthony (4.9 feet, MAN). CJ LaVine misses. Rebound secured by Desmond DeRozan.

[10:23] Team_033 possession (Score: 26-26)
Manu Irving drives, Magic Westbrook stays with him. Manu Irving attempts a Dunk. Contested by Magic Westbrook (4.5 feet, ZONE). MANU IRVING MAKES IT!
Score: 26-28

[10:10] Team_035 possession (Score: 26-28)
Malcolm Turner attempts a 3Pt. Contested by Terry Jokic (4.4 feet, MAN). Malcolm Turner misses. Rebound secured by Desmond DeRozan.

[09:53] Team_033 possession (Score: 26-28)
Manu Irving attempts a 3Pt. Contested by CJ LaVine (4.3 feet, ZONE). Manu Irving misses. Rebound secured by Cole George.

[09:34] Team_035 possession (Score: 26-28)
Magic Westbrook drives, Tim Griffin stays with him. Magic Westbrook attempts a Dunk. Contested by Tim Griffin (5.3 feet, ZONE). Magic Westbrook misses. Rebound secured by Terry Jokic.

[09:21] Team_033 possession (Score: 26-28)
Ben Anthony drives, CJ LaVine stays with him. Ben Anthony attempts a Layup. Contested by CJ LaVine (4.7 feet, MAN). BEN ANTHONY MAKES IT! Assist: Desmond DeRozan
Score: 26-30

[09:08] Team_035 possession (Score: 26-30)
Cole George throws a bad pass! Stolen by Manu Irving! TURNOVER! (live ball)

[08:50] Team_033 possession (Score: 26-30)
Desmond DeRozan attempts a 3Pt. Contested by CJ LaVine (4.2 feet, ZONE). Desmond DeRozan misses. Rebound secured by Magic Westbrook.

[08:39] Team_035 possession (Score: 26-30)
Cole George makes the Layup and draws the foul on Manu Irving! And-1! Cole George to the line for 1. [Team fouls: 1] (Manu Irving: 1 personal fouls)   FT 1/1: GOOD Cole George makes 1/1 from the line.
Score: 29-30

[08:24] Team_033 possession (Score: 29-30)
Manu Irving drives and kicks out. Ben Anthony attempts a Midrange. Contested by CJ LaVine (4.2 feet, MAN). Ben Anthony misses. Rebound secured by Tobias Jordan.

[08:11] Team_035 possession (Score: 29-30)
FOUL! Shooting foul on Tim Griffin. Magic Westbrook to the line for 2 free throws. [Team fouls: 2] (Tim Griffin: 1 personal fouls)   FT 1/2: GOOD   FT 2/2: GOOD Magic Westbrook makes 2/2 from the line.
Score: 31-30

[07:58] Team_033 possession (Score: 31-30)
Desmond DeRozan attempts a Midrange. Contested by Tobias Jordan (4.3 feet, MAN). Desmond DeRozan misses. Rebound secured by Cole George.

[07:46] Team_035 possession (Score: 31-30)
FOUL! Holding foul on Ben Anthony. [Team fouls: 3] No free throws, side out. (Ben Anthony: 1 personal fouls)

[07:33] Team_035 possession (Score: 31-30)
Cole George loses control! Ball rolls out of bounds! TURNOVER! (dead ball)

[07:33] Substitution (Team_035): Magic Westbrook OUT → John Durant IN (stamina_rule2)

[07:33] Substitution (Team_033): Desmond DeRozan OUT → Zion Adebayo IN (stamina_rule2)

[07:17] Team_033 possession (Score: 31-30)
Manu Irving attempts a 3Pt. Contested by CJ LaVine (4.3 feet, ZONE). Manu Irving misses. Rebound secured by Tobias Jordan.

[07:05] Team_035 possession (Score: 31-30)
Tobias Jordan attempts a Layup. Contested by Zion Adebayo (4.2 feet, MAN). TOBIAS JORDAN MAKES IT! Assist: Cole George
Score: 33-30

[06:50] Team_033 possession (Score: 33-30)
Ben Anthony attempts a 3Pt. Contested by CJ LaVine (4.7 feet, MAN). Ben Anthony misses. Offensive rebound by Tim Griffin! Tim Griffin puts it back in!
Score: 33-32

[06:31] Team_035 possession (Score: 33-32)
Cole George drives and kicks out. Tobias Jordan attempts a 3Pt. Contested by Ben Anthony (4.8 feet, ZONE). Tobias Jordan misses. Rebound secured by Terry Jokic.

[06:17] Team_033 possession (Score: 33-32)
Zion Adebayo attempts a Midrange. Contested by Cole George (3.7 feet, ZONE). Zion Adebayo misses. Offensive rebound by Terry Jokic! Terry Jokic kicks it out.

[06:04] Team_033 possession (Score: 33-32)
Manu Irving drives and kicks out. Zion Adebayo attempts a Midrange. Contested by Tobias Jordan (4.3 feet, ZONE). Zion Adebayo misses. Rebound secured by John Durant.

[05:49] Team_035 possession (Score: 33-32)
Tobias Jordan attempts a 3Pt. Contested by Ben Anthony (4.5 feet, ZONE). Tobias Jordan misses. Rebound secured by Tim Griffin.

[05:37] Team_033 possession (Score: 33-32)
Tim Griffin attempts a Midrange. Contested by Cole George (3.6 feet, ZONE). TIM GRIFFIN MAKES IT! Assist: Terry Jokic
Score: 33-34

[05:22] Team_035 possession (Score: 33-34)
John Durant drives, Zion Adebayo stays with him. John Durant attempts a Dunk. Contested by Zion Adebayo (4.4 feet, ZONE). John Durant misses. Rebound secured by Tim Griffin.

[05:10] Team_033 possession (Score: 33-34)
Terry Jokic attempts a 3Pt. Contested by Malcolm Turner (5.2 feet, MAN). Terry Jokic misses. Rebound secured by Tobias Jordan.

[04:51] Team_035 possession (Score: 33-34)
Tobias Jordan drives, Tim Griffin stays with him. Tobias Jordan attempts a Layup. Contested by Tim Griffin (4.6 feet, ZONE). TOBIAS JORDAN MAKES IT!
Score: 35-34

[04:32] Team_033 possession (Score: 35-34)
Tim Griffin drives and kicks out. Manu Irving attempts a 3Pt. Contested by CJ LaVine (4.2 feet, ZONE). MANU IRVING MAKES IT! Assist: Terry Jokic
Score: 35-37

[04:15] Team_035 possession (Score: 35-37)
John Durant makes the Layup and draws the foul on Zion Adebayo! And-1! John Durant to the line for 1. [Team fouls: 4] (Zion Adebayo: 1 personal fouls)   FT 1/1: GOOD John Durant makes 1/1 from the line.
Score: 38-37

[04:02] Team_033 possession (Score: 38-37)
Ben Anthony attempts a 3Pt. Contested by Cole George (4.1 feet, ZONE). BEN ANTHONY MAKES IT! Assist: Zion Adebayo
Score: 38-40

[03:43] Team_035 possession (Score: 38-40)
CJ LaVine drives to the basket... CJ LaVine loses control! Ball rolls out of bounds! TURNOVER! (dead ball)

[03:28] Team_033 possession (Score: 38-40)
Ben Anthony attempts a Midrange. Contested by CJ LaVine (4.7 feet, MAN). BEN ANTHONY MAKES IT! Assist: Manu Irving
Score: 38-42

[03:13] Team_035 possession (Score: 38-42)
Tobias Jordan attempts a Midrange. Contested by Zion Adebayo (4.2 feet, MAN). Tobias Jordan misses. Rebound secured by Terry Jokic.

[02:57] Team_033 possession (Score: 38-42)
Terry Jokic drives to the basket... Terry Jokic loses the ball! Stripped by Malcolm Turner! TURNOVER! (live ball)

[02:43] Team_035 possession (Score: 38-42)
Cole George attempts a Layup. Contested by Manu Irving (5.2 feet, MAN). Cole George misses. Offensive rebound by John Durant! John Durant kicks it out.

[02:29] Team_035 possession (Score: 38-42)
John Durant makes the Layup and draws the foul on Manu Irving! And-1! John Durant to the line for 1. [BONUS: 5 team fouls] (Manu Irving: 2 personal fouls)   FT 1/1: GOOD John Durant makes 1/1 from the line.
Score: 41-42

[02:18] Team_033 possession (Score: 41-42)
Terry Jokic attempts a Layup. Contested by John Durant (4.7 feet, ZONE). Terry Jokic misses. Rebound secured by Tobias Jordan.

[02:05] Team_035 possession (Score: 41-42)
Tobias Jordan attempts a Midrange. Contested by Manu Irving (4.6 feet, ZONE). Tobias Jordan misses. Rebound secured by Tim Griffin.

[01:48] Team_033 possession (Score: 41-42)
Terry Jokic attempts a Midrange. Contested by Cole George (4.2 feet, ZONE). TERRY JOKIC MAKES IT! Assist: Manu Irving
Score: 41-44

[01:34] Team_035 possession (Score: 41-44)
Malcolm Turner attempts a 3Pt. Contested by Zion Adebayo (5.0 feet, ZONE). Malcolm Turner misses. Rebound secured by Tim Griffin.

[01:22] Team_033 possession (Score: 41-44)
FOUL! Reach-in foul on Cole George during the drive. [Team fouls: 2] No free throws, side out. (Cole George: 1 personal fouls)

[01:03] Team_033 possession (Score: 41-44)
Ben Anthony attempts a 3Pt. Contested by CJ LaVine (4.9 feet, ZONE). Ben Anthony misses. Offensive rebound by Zion Adebayo! Zion Adebayo kicks it out.

[00:50] Team_033 possession (Score: 41-44)
Manu Irving attempts a 3Pt. Contested by Cole George (4.0 feet, MAN). Manu Irving misses. Rebound secured by Cole George.

[00:35] Team_035 possession (Score: 41-44)
Tobias Jordan attempts a 3Pt. Contested by Zion Adebayo (4.3 feet, MAN). Tobias Jordan misses. Rebound secured by Terry Jokic.

[00:21] Team_033 possession (Score: 41-44)
Zion Adebayo drives, John Durant stays with him. Zion Adebayo attempts a Dunk. Contested by John Durant (4.6 feet, ZONE). Zion Adebayo misses. Rebound secured by John Durant.

[00:03] Team_035 possession (Score: 41-44)
Tobias Jordan attempts a Midrange. Contested by Zion Adebayo (4.4 feet, MAN). Tobias Jordan misses. Offensive rebound by Tobias Jordan! Tobias Jordan kicks it out.

================================================================================
                              2ND QUARTER COMPLETE                              
================================================================================

2ND QUARTER SCORE: Team_035 17, Team_033 21

BOX SCORE:
================================================================================

Team_035
--------------------------------------------------------------------------------
Player                MIN  PTS  REB  AST  TO      FG   FG%      3P   3P%
--------------------------------------------------------------------------------
John Durant            10    6    3    0   0   2/3    66.7     0/0   0.0
Tobias Jordan          11    4    5    0   0   2/6    33.3     0/0   0.0
Cole George            11    3    4    1   0   1/2    50.0     0/0   0.0
Dwyane Johnson         13    2    1    0   0   1/1   100.0     0/0   0.0
Magic Westbrook        14    2    1    0   0   1/2    50.0     0/0   0.0
Shaquille Ginobili     13    0    0    1   0   0/0     0.0     0/0   0.0
CJ LaVine              11    0    0    0   0   0/1     0.0     0/0   0.0
Malcolm Turner         11    0    0    0   0   0/2     0.0     0/0   0.0

TEAM: FG: 7/17 (41.2%), 3PT: 0/4 (0.0%), REB: 14 (2 off, 12 def), AST: 2, TO: 5
TEAM FOULS: 2


Team_033
--------------------------------------------------------------------------------
Player                MIN  PTS  REB  AST  TO      FG   FG%      3P   3P%
--------------------------------------------------------------------------------
Ben Anthony            11    7    0    0   0   3/3   100.0     0/0   0.0
Manu Irving            11    5    0    2   0   2/7    28.6     0/0   0.0
Tim Griffin            11    4    5    0   0   2/2   100.0     0/0   0.0
Joel Green             13    3    0    0   0   1/1   100.0     0/0   0.0
Terry Jokic            11    2    5    2   0   1/3    33.3     0/0   0.0
Desmond DeRozan        14    0    2    2   0   0/3     0.0     0/0   0.0
Bradley Simmons        13    0    0    0   0   0/1     0.0     0/0   0.0
Zion Adebayo           10    0    1    1   0   0/1     0.0     0/0   0.0

TEAM: FG: 9/21 (42.9%), 3PT: 3/9 (33.3%), REB: 13 (3 off, 10 def), AST: 7, TO: 1
TEAM FOULS: 5 [Team_035 in BONUS]

================================================================================

================================================================================
                       3RD QUARTER - Team_035 vs Team_033                       
================================================================================

[12:00] Team_035 possession (Score: 41-44)
FOUL! Holding foul on Cade Randle. [Team fouls: 1] No free throws, side out. (Cade Randle: 1 personal fouls)

[11:42] Team_035 possession (Score: 41-44)
Dwyane Johnson attempts a 3Pt. Contested by Joel Green (4.2 feet, ZONE). Dwyane Johnson misses. Rebound secured by Desmond DeRozan.

[11:27] Team_033 possession (Score: 41-44)
Bradley Simmons drives, Magic Westbrook stays with him. Bradley Simmons attempts a Layup. Contested by Magic Westbrook (4.2 feet, MAN). BRADLEY SIMMONS MAKES IT! Assist: Cade Randle
Score: 41-46

[11:18] Team_035 possession (Score: 41-46)
Domantas Green attempts a 3Pt. Contested by Joel Green (4.7 feet, ZONE). DOMANTAS GREEN MAKES IT! Assist: Magic Westbrook
Score: 44-46

[11:04] Team_033 possession (Score: 44-46)
Joel Green attempts a 3Pt. Contested by Shaquille Ginobili (4.3 feet, ZONE). Joel Green misses. Rebound secured by Gary Johnson.

[10:51] Team_035 possession (Score: 44-46)
Shaquille Ginobili drives and kicks out. FOUL! Shooting foul on Desmond DeRozan. Dwyane Johnson to the line for 2 free throws. [Team fouls: 2] (Desmond DeRozan: 1 personal fouls)   FT 1/2: GOOD   FT 2/2: GOOD Dwyane Johnson makes 2/2 from the line.
Score: 46-46

[10:40] Team_033 possession (Score: 46-46)
FOUL! Shooting foul on Dwyane Johnson. Bradley Simmons to the line for 2 free throws. [Team fouls: 1] (Dwyane Johnson: 1 personal fouls)   FT 1/2: GOOD   FT 2/2: MISS Bradley Simmons makes 1/2 from the line. Rebound secured by Dwyane Johnson.
Score: 46-47

[10:23] Team_035 possession (Score: 46-47)
FOUL! Shooting foul on Bradley Simmons. Shaquille Ginobili to the line for 2 free throws. [Team fouls: 3] (Bradley Simmons: 1 personal fouls)   FT 1/2: MISS   FT 2/2: GOOD Shaquille Ginobili makes 1/2 from the line.
Score: 47-47

[10:06] Team_033 possession (Score: 47-47)
Cade Randle attempts a 3Pt. Contested by Shaquille Ginobili (4.5 feet, ZONE). Cade Randle misses. Offensive rebound by Desmond DeRozan! Desmond DeRozan kicks it out.

[09:51] Team_033 possession (Score: 47-47)
Joel Green attempts a 3Pt. BLOCKED BY SHAQUILLE GINOBILI! Ball is loose! Offensive rebound by Desmond DeRozan! Desmond DeRozan kicks it out.

[09:38] Team_033 possession (Score: 47-47)
Cade Randle attempts a 3Pt. Contested by Shaquille Ginobili (4.5 feet, ZONE). Cade Randle misses. FOUL! Loose ball foul on Gary Johnson during the rebound battle. [Team fouls: 2] No free throws, side out. (Gary Johnson: 1 personal fouls)

[09:21] Team_033 possession (Score: 47-47)
FOUL! Reach-in foul on Domantas Green during the drive. [Team fouls: 3] No free throws, side out. (Domantas Green: 1 personal fouls)

[09:05] Team_033 possession (Score: 47-47)
Cade Randle attempts a Midrange. Contested by Magic Westbrook (4.8 feet, ZONE). Cade Randle misses. FOUL! Loose ball foul on Gary Johnson during the rebound battle. [Team fouls: 4] No free throws, side out. (Gary Johnson: 2 personal fouls)

[08:51] Team_033 possession (Score: 47-47)
Desmond DeRozan drives and kicks out. Bradley Simmons attempts a 3Pt. Contested by Magic Westbrook (4.3 feet, MAN). Bradley Simmons misses. FOUL! Loose ball foul on Magic Westbrook during the rebound battle. [IN THE BONUS! 5 team fouls] Bradley Simmons to the line for 2 free throws. (Magic Westbrook: 1 personal fouls)   FT 1/2: GOOD   FT 2/2: GOOD Bradley Simmons makes 2/2 from the line.
Score: 47-49

[08:34] Team_035 possession (Score: 47-49)
Magic Westbrook makes the Dunk and draws the foul on Bradley Simmons! And-1! Magic Westbrook to the line for 1. [Team fouls: 4] (Bradley Simmons: 2 personal fouls)   FT 1/1: GOOD Magic Westbrook makes 1/1 from the line.
Score: 50-49

[08:21] Team_033 possession (Score: 50-49)
Chris Anunoby attempts a 3Pt. Contested by Shaquille Ginobili (3.9 feet, MAN). Chris Anunoby misses. Rebound secured by Magic Westbrook.

[08:07] Team_035 possession (Score: 50-49)
Dwyane Johnson makes the Layup and draws the foul on Desmond DeRozan! And-1! Dwyane Johnson to the line for 1. [BONUS: 5 team fouls] (Desmond DeRozan: 2 personal fouls)   FT 1/1: GOOD Dwyane Johnson makes 1/1 from the line.
Score: 53-49

[07:52] Team_033 possession (Score: 53-49)
Chris Anunoby attempts a 3Pt. Contested by Shaquille Ginobili (3.9 feet, ZONE). Chris Anunoby misses. Rebound secured by Magic Westbrook.

[07:43] Team_035 possession (Score: 53-49)
Magic Westbrook drives and kicks out. Dwyane Johnson attempts a 3Pt. Contested by Joel Green (4.3 feet, ZONE). DWYANE JOHNSON MAKES IT! Assist: Domantas Green
Score: 56-49

[07:28] Team_033 possession (Score: 56-49)
Chris Anunoby attempts a Midrange. Contested by Shaquille Ginobili (3.9 feet, MAN). CHRIS ANUNOBY MAKES IT!
Score: 56-51

[07:14] Team_035 possession (Score: 56-51)
Domantas Green attempts a 3Pt. Contested by Joel Green (4.7 feet, ZONE). Domantas Green misses. Rebound secured by Cade Randle.

[06:57] Team_033 possession (Score: 56-51)
Chris Anunoby attempts a 3Pt. Contested by Shaquille Ginobili (3.9 feet, ZONE). Chris Anunoby misses. Rebound secured by Dwyane Johnson.

[06:46] Team_035 possession (Score: 56-51)
Gary Johnson throws a bad pass! Stolen by Cade Randle! TURNOVER! (live ball)

[06:35] Team_033 possession (Score: 56-51)
FOUL! Holding foul on Domantas Green. [IN THE BONUS! 6 team fouls] Joel Green to the line for 2 free throws. (Domantas Green: 2 personal fouls)   FT 1/2: GOOD   FT 2/2: GOOD Joel Green makes 2/2 from the line.
Score: 56-53

[06:20] Team_035 possession (Score: 56-53)
FOUL! Reach-in foul on Joel Green during the drive. [IN THE BONUS! 6 team fouls] Domantas Green to the line for 2 free throws. (Joel Green: 1 personal fouls)   FT 1/2: MISS   FT 2/2: GOOD Domantas Green makes 1/2 from the line.
Score: 57-53

[06:05] Team_033 possession (Score: 57-53)
Cade Randle attempts a 3Pt. Contested by Shaquille Ginobili (4.5 feet, ZONE). Cade Randle misses. FOUL! Loose ball foul on Gary Johnson during the rebound battle. [IN THE BONUS! 7 team fouls] Desmond DeRozan to the line for 2 free throws. (Gary Johnson: 3 personal fouls)   FT 1/2: GOOD   FT 2/2: MISS Desmond DeRozan makes 1/2 from the line. Rebound secured by Dwyane Johnson.
Score: 57-54

[05:53] Team_035 possession (Score: 57-54)
Dwyane Johnson loses control! Ball rolls out of bounds! TURNOVER! (dead ball)

[05:37] Team_033 possession (Score: 57-54)
Chris Anunoby attempts a Midrange. Contested by Shaquille Ginobili (3.9 feet, MAN). Chris Anunoby misses. Offensive rebound by Bradley Simmons! Bradley Simmons's putback is no good. Offensive rebound by Desmond DeRozan! Desmond DeRozan kicks it out.

[05:23] Team_033 possession (Score: 57-54)
Bradley Simmons attempts a 3Pt. Contested by Magic Westbrook (4.2 feet, MAN). BRADLEY SIMMONS MAKES IT! Assist: Desmond DeRozan
Score: 57-57

[05:08] Team_035 possession (Score: 57-57)
Gary Johnson attempts a Layup. Contested by Cade Randle (3.5 feet, MAN). GARY JOHNSON MAKES IT! Assist: Magic Westbrook
Score: 59-57

[04:52] Team_033 possession (Score: 59-57)
Desmond DeRozan drives to the basket... FOUL! Offensive foul on Desmond DeRozan! Dwyane Johnson drew the charge! [Team fouls: 7] (Desmond DeRozan: 3 personal fouls) TURNOVER! (dead ball)

[04:38] Team_035 possession (Score: 59-57)
Dwyane Johnson drives, Bradley Simmons stays with him. Dwyane Johnson attempts a Dunk. Contested by Bradley Simmons (3.0 feet, ZONE). DWYANE JOHNSON MAKES IT! Assist: Gary Johnson
Score: 61-57

[04:24] Team_033 possession (Score: 61-57)
Bradley Simmons drives to the basket... Bradley Simmons throws a bad pass out of bounds! TURNOVER! (dead ball)

[04:10] Team_035 possession (Score: 61-57)
Magic Westbrook drives to the basket... FOUL! Offensive foul on Magic Westbrook! Bradley Simmons drew the charge! [Team fouls: 8] (Magic Westbrook: 2 personal fouls) TURNOVER! (dead ball)

[03:55] Team_033 possession (Score: 61-57)
FOUL! Shooting foul on Dwyane Johnson. Cade Randle to the line for 2 free throws. [BONUS: 9 team fouls] (Dwyane Johnson: 2 personal fouls)   FT 1/2: GOOD   FT 2/2: MISS Cade Randle makes 1/2 from the line. FOUL! Loose ball foul on Gary Johnson during the free throw rebound! [IN THE BONUS! 10 team fouls] Bradley Simmons to the line for 2 free throws. (Gary Johnson: 4 personal fouls)   FT 1/2: GOOD   FT 2/2: GOOD Bradley Simmons makes 2/2 from the line.
Score: 61-60

[03:36] Team_035 possession (Score: 61-60)
Dwyane Johnson makes the Layup and draws the foul on Bradley Simmons! And-1! Dwyane Johnson to the line for 1. [BONUS: 8 team fouls] (Bradley Simmons: 3 personal fouls)   FT 1/1: GOOD Dwyane Johnson makes 1/1 from the line.
Score: 64-60

[03:24] Team_033 possession (Score: 64-60)
Joel Green attempts a 3Pt. Contested by Domantas Green (5.0 feet, MAN). Joel Green misses. Rebound secured by Gary Johnson.

[03:08] Team_035 possession (Score: 64-60)
Dwyane Johnson drives, Desmond DeRozan stays with him. Dwyane Johnson attempts a Dunk. Contested by Desmond DeRozan (4.9 feet, MAN). DWYANE JOHNSON MAKES IT!
Score: 66-60

[02:53] Team_033 possession (Score: 66-60)
Bradley Simmons drives and kicks out. Chris Anunoby attempts a 3Pt. Contested by Shaquille Ginobili (4.1 feet, ZONE). CHRIS ANUNOBY MAKES IT! Assist: Desmond DeRozan
Score: 66-63

[02:42] Team_035 possession (Score: 66-63)
FOUL! Holding foul on Bradley Simmons. [IN THE BONUS! 9 team fouls] Magic Westbrook to the line for 2 free throws. (Bradley Simmons: 4 personal fouls)   FT 1/2: GOOD   FT 2/2: GOOD Magic Westbrook makes 2/2 from the line.
Score: 68-63

[02:31] Team_033 possession (Score: 68-63)
Desmond DeRozan loses the ball! Stripped by Dwyane Johnson! TURNOVER! (live ball)

[02:17] Team_035 possession (Score: 68-63)
Shaquille Ginobili attempts a Layup. Contested by Bradley Simmons (3.2 feet, ZONE). Shaquille Ginobili misses. Offensive rebound by Magic Westbrook! Magic Westbrook kicks it out.

[02:01] Team_035 possession (Score: 68-63)
Gary Johnson attempts a Midrange. Contested by Desmond DeRozan (5.6 feet, ZONE). Gary Johnson misses. Rebound secured by Cade Randle.

[01:46] Team_033 possession (Score: 68-63)
Joel Green attempts a Midrange. Contested by Shaquille Ginobili (4.5 feet, ZONE). JOEL GREEN MAKES IT!
Score: 68-65

[01:31] Team_035 possession (Score: 68-65)
Domantas Green attempts a 3Pt. Contested by Joel Green (5.0 feet, ZONE). Domantas Green misses. Rebound secured by Bradley Simmons.

[01:19] Team_033 possession (Score: 68-65)
Desmond DeRozan drives and kicks out. Joel Green attempts a 3Pt. Contested by Domantas Green (5.0 feet, MAN). JOEL GREEN MAKES IT! Assist: Bradley Simmons
Score: 68-68

[01:02] Team_035 possession (Score: 68-68)
Gary Johnson attempts a 3Pt. Contested by Cade Randle (3.9 feet, MAN). Gary Johnson misses. Rebound secured by Bradley Simmons.

[00:45] Team_033 possession (Score: 68-68)
Cade Randle attempts a 3Pt. Contested by Gary Johnson (4.7 feet, MAN). CADE RANDLE MAKES IT!
Score: 68-71

[00:28] Team_035 possession (Score: 68-71)
Gary Johnson makes the Layup and draws the foul on Bradley Simmons! And-1! Gary Johnson to the line for 1. [BONUS: 10 team fouls] (Bradley Simmons: 5 personal fouls)   FT 1/1: GOOD Gary Johnson makes 1/1 from the line.
Score: 71-71

[00:15] Team_033 possession (Score: 71-71)
Chris Anunoby drives, Dwyane Johnson stays with him. Chris Anunoby attempts a Dunk. Contested by Dwyane Johnson (4.3 feet, ZONE). CHRIS ANUNOBY MAKES IT! Assist: Cade Randle
Score: 71-73

[00:04] Team_035 possession (Score: 71-73)
FOUL! Offensive foul on Dwyane Johnson! Desmond DeRozan drew the charge! [Team fouls: 11] (Dwyane Johnson: 3 personal fouls) TURNOVER! (dead ball)

================================================================================
                              3RD QUARTER COMPLETE                              
================================================================================

3RD QUARTER SCORE: Team_035 30, Team_033 29

BOX SCORE:
================================================================================

Team_035
--------------------------------------------------------------------------------
Player                MIN  PTS  REB  AST  TO      FG   FG%      3P   3P%
--------------------------------------------------------------------------------
Dwyane Johnson         25   15    3    0   0   6/7    85.7     0/0   0.0
Magic Westbrook        26    5    3    2   0   2/2   100.0     0/0   0.0
Gary Johnson           25    5    2    1   0   2/4    50.0     0/0   0.0
Domantas Green         25    4    0    1   0   2/4    50.0     0/0   0.0
Shaquille Ginobili     25    1    0    0   0   1/1   100.0     0/0   0.0

TEAM: FG: 13/18 (72.2%), 3PT: 1/5 (20.0%), REB: 7 (1 off, 6 def), AST: 4, TO: 4
TEAM FOULS: 11 [Team_033 in BONUS]


Team_033
--------------------------------------------------------------------------------
Player                MIN  PTS  REB  AST  TO      FG   FG%      3P   3P%
--------------------------------------------------------------------------------
Bradley Simmons        25   10    2    1   0   4/5    80.0     0/0   0.0
Joel Green             25    7    0    0   0   3/5    60.0     0/0   0.0
Chris Anunoby          25    7    0    0   0   3/6    50.0     0/0   0.0
Cade Randle            25    3    2    2   0   1/2    50.0     0/0   0.0
Desmond DeRozan        26    0    6    2   0   0/0     0.0     0/0   0.0

TEAM: FG: 11/18 (61.1%), 3PT: 2/8 (25.0%), REB: 11 (6 off, 5 def), AST: 5, TO: 3
TEAM FOULS: 10 [Team_035 in BONUS]

================================================================================

================================================================================
                       4TH QUARTER - Team_035 vs Team_033                       
================================================================================

[12:00] Team_035 possession (Score: 71-73)
Magic Westbrook attempts a Layup. Contested by Bradley Simmons (3.8 feet, MAN). Magic Westbrook misses. Rebound secured by Desmond DeRozan.

[11:48] Team_033 possession (Score: 71-73)
Desmond DeRozan attempts a Layup. Contested by Dwyane Johnson (4.2 feet, MAN). Desmond DeRozan misses. Rebound secured by Magic Westbrook.

[11:32] Team_035 possession (Score: 71-73)
Gary Johnson drives and kicks out. Gary Johnson attempts a 3Pt. Contested by Joel Green (4.7 feet, ZONE). GARY JOHNSON MAKES IT! Assist: Magic Westbrook
Score: 74-73

[11:20] Team_033 possession (Score: 74-73)
Chris Anunoby attempts a Layup. Contested by Dwyane Johnson (4.2 feet, ZONE). CHRIS ANUNOBY MAKES IT!
Score: 74-75

[11:09] Team_035 possession (Score: 74-75)
Magic Westbrook attempts a Midrange. Contested by Bradley Simmons (4.0 feet, MAN). MAGIC WESTBROOK MAKES IT! Assist: Shaquille Ginobili
Score: 76-75

[10:52] Team_033 possession (Score: 76-75)
Desmond DeRozan attempts a 3Pt. Contested by Shaquille Ginobili (4.3 feet, ZONE). DESMOND DEROZAN MAKES IT! Assist: Bradley Simmons
Score: 76-78

[10:40] Team_035 possession (Score: 76-78)
Dwyane Johnson attempts a Midrange. Contested by Desmond DeRozan (5.2 feet, MAN). Dwyane Johnson misses. Rebound secured by Desmond DeRozan.

[10:25] Team_033 possession (Score: 76-78)
Desmond DeRozan drives and kicks out. Joel Green attempts a 3Pt. Contested by Shaquille Ginobili (4.5 feet, ZONE). Joel Green misses. Rebound secured by Magic Westbrook.

[10:13] Team_035 possession (Score: 76-78)
Magic Westbrook drives, picks up Bradley Simmons. Help arrives from Chris Anunoby! Magic Westbrook attempts a Dunk. Contested by Chris Anunoby (4.1 feet, MAN). Magic Westbrook misses. Rebound secured by Bradley Simmons.

[10:00] Team_033 possession (Score: 76-78)
Joel Green attempts a Midrange. Contested by Domantas Green (5.4 feet, MAN). JOEL GREEN MAKES IT! Assist: Bradley Simmons
Score: 76-80

[09:47] Team_035 possession (Score: 76-80)
Domantas Green drives, Bradley Simmons stays with him. Domantas Green attempts a Layup. Contested by Bradley Simmons (4.1 feet, ZONE). DOMANTAS GREEN MAKES IT! Assist: Gary Johnson
Score: 78-80

[09:33] Team_033 possession (Score: 78-80)
Cade Randle attempts a 3Pt. Contested by Shaquille Ginobili (5.0 feet, ZONE). CADE RANDLE MAKES IT! Assist: Joel Green
Score: 78-83

[09:19] Team_035 possession (Score: 78-83)
Dwyane Johnson attempts a 3Pt. Contested by Desmond DeRozan (5.4 feet, MAN). Dwyane Johnson misses. Offensive rebound by Magic Westbrook! Magic Westbrook kicks it out.

[09:04] Team_035 possession (Score: 78-83)
Domantas Green attempts a Midrange. Contested by Joel Green (5.3 feet, MAN). DOMANTAS GREEN MAKES IT! Assist: Gary Johnson
Score: 80-83

[08:47] Team_033 possession (Score: 80-83)
FOUL! Reach-in foul on Dwyane Johnson during the drive. [Team fouls: 1] No free throws, side out. (Dwyane Johnson: 1 personal fouls)

[08:34] Team_033 possession (Score: 80-83)
Desmond DeRozan attempts a Layup. BLOCKED BY DWYANE JOHNSON! Ball is loose! Rebound secured by Magic Westbrook.

[08:19] Team_035 possession (Score: 80-83)
Shaquille Ginobili attempts a 3Pt. Contested by Chris Anunoby (4.6 feet, MAN). SHAQUILLE GINOBILI MAKES IT! Assist: Domantas Green
Score: 83-83

[08:07] Team_033 possession (Score: 83-83)
Chris Anunoby drives, picks up Dwyane Johnson. Help arrives from Domantas Green! Chris Anunoby attempts a Layup. Contested by Domantas Green (4.6 feet, ZONE). Chris Anunoby misses. Offensive rebound by Cade Randle! Cade Randle's putback is no good. Rebound secured by Magic Westbrook.

[07:54] Team_035 possession (Score: 83-83)
Domantas Green drives and kicks out. Domantas Green attempts a Midrange. BLOCKED BY JOEL GREEN! Ball is loose! Rebound secured by Bradley Simmons.

[07:39] Team_033 possession (Score: 83-83)
Bradley Simmons makes the Layup and draws the foul on Domantas Green! And-1! Bradley Simmons to the line for 1. [Team fouls: 2] (Domantas Green: 1 personal fouls)   FT 1/1: GOOD Bradley Simmons makes 1/1 from the line.
Score: 83-86

[07:25] Team_035 possession (Score: 83-86)
Magic Westbrook attempts a Midrange. Contested by Bradley Simmons (4.5 feet, MAN). Magic Westbrook misses. Offensive rebound by Gary Johnson! Gary Johnson kicks it out.

[07:11] Team_035 possession (Score: 83-86)
Domantas Green drives and kicks out. Dwyane Johnson attempts a 3Pt. Contested by Desmond DeRozan (5.9 feet, MAN). Dwyane Johnson misses. Offensive rebound by Gary Johnson! Gary Johnson kicks it out.

[07:00] Team_035 possession (Score: 83-86)
Dwyane Johnson attempts a 3Pt. Contested by Cade Randle (3.8 feet, ZONE). Dwyane Johnson misses. FOUL! Loose ball foul on Cade Randle during the rebound battle. [Team fouls: 1] No free throws, side out. (Cade Randle: 1 personal fouls)

[06:48] Team_035 possession (Score: 83-86)
Magic Westbrook drives and kicks out. Magic Westbrook attempts a Midrange. Contested by Chris Anunoby (5.1 feet, ZONE). Magic Westbrook misses. Rebound secured by Cade Randle.

[06:35] Team_033 possession (Score: 83-86)
Cade Randle throws a bad pass out of bounds! TURNOVER! (dead ball)

[06:35] Substitution (Team_035): Domantas Green OUT → CJ LaVine IN (stamina_rule2)

[06:35] Substitution (Team_035): Shaquille Ginobili OUT → Cole George IN (stamina_rule2)

[06:35] Substitution (Team_035): Gary Johnson OUT → Malcolm Turner IN (stamina_rule2)

[06:35] Substitution (Team_035): Dwyane Johnson OUT → Tobias Jordan IN (stamina_rule2)

[06:35] Substitution (Team_035): Magic Westbrook OUT → John Durant IN (stamina_rule2)

[06:35] Substitution (Team_033): Joel Green OUT → Ben Anthony IN (stamina_rule2)

[06:35] Substitution (Team_033): Chris Anunoby OUT → Manu Irving IN (stamina_rule2)

[06:35] Substitution (Team_033): Cade Randle OUT → Terry Jokic IN (stamina_rule2)

[06:35] Substitution (Team_033): Desmond DeRozan OUT → Zion Adebayo IN (stamina_rule2)

[06:35] Substitution (Team_033): Bradley Simmons OUT → Tim Griffin IN (stamina_rule2)

[06:21] Team_035 possession (Score: 83-86)
CJ LaVine attempts a Layup. Contested by Tim Griffin (5.0 feet, ZONE). CJ LAVINE MAKES IT!
Score: 85-86

[06:05] Team_033 possession (Score: 85-86)
Ben Anthony attempts a Midrange. Contested by CJ LaVine (4.7 feet, MAN). Ben Anthony misses. Rebound secured by Tobias Jordan.

[05:55] Team_035 possession (Score: 85-86)
John Durant attempts a 3Pt. Contested by Ben Anthony (4.7 feet, ZONE). John Durant misses. Offensive rebound by Tobias Jordan! Tobias Jordan kicks it out.

[05:39] Team_035 possession (Score: 85-86)
Tobias Jordan attempts a Midrange. Contested by Manu Irving (4.4 feet, ZONE). Tobias Jordan misses. Rebound secured by Tim Griffin.

[05:30] Team_033 possession (Score: 85-86)
Ben Anthony attempts a Midrange. Contested by Malcolm Turner (5.3 feet, ZONE). BEN ANTHONY MAKES IT!
Score: 85-88

[05:20] Team_035 possession (Score: 85-88)
FOUL! Holding foul on Ben Anthony. [Team fouls: 2] No free throws, side out. (Ben Anthony: 1 personal fouls)

[05:08] Team_035 possession (Score: 85-88)
John Durant drives and kicks out. Cole George attempts a 3Pt. Contested by Ben Anthony (4.8 feet, ZONE). Cole George misses. Rebound secured by Zion Adebayo.

[04:58] Team_033 possession (Score: 85-88)
Ben Anthony loses the ball! Stripped by CJ LaVine! TURNOVER! (live ball)

[04:43] Team_035 possession (Score: 85-88)
Tobias Jordan attempts a Layup. Contested by Zion Adebayo (4.2 feet, MAN). Tobias Jordan misses. Rebound secured by Terry Jokic.

[04:28] Team_033 possession (Score: 85-88)
FOUL! Shooting foul on Malcolm Turner. Terry Jokic to the line for 2 free throws. [Team fouls: 3] (Malcolm Turner: 1 personal fouls)   FT 1/2: GOOD   FT 2/2: GOOD Terry Jokic makes 2/2 from the line.
Score: 85-90

[04:10] Team_035 possession (Score: 85-90)
Malcolm Turner drives, Zion Adebayo stays with him. Malcolm Turner attempts a Dunk. Contested by Zion Adebayo (5.0 feet, ZONE). MALCOLM TURNER MAKES IT! Assist: Tobias Jordan
Score: 87-90

[03:56] Team_033 possession (Score: 87-90)
Zion Adebayo drives and kicks out. Zion Adebayo attempts a Midrange. Contested by Tobias Jordan (4.3 feet, MAN). ZION ADEBAYO MAKES IT!
Score: 87-92

[03:42] Team_035 possession (Score: 87-92)
CJ LaVine attempts a Midrange. Contested by Manu Irving (4.8 feet, ZONE). CJ LAVINE MAKES IT! Assist: Tobias Jordan
Score: 89-92

[03:28] Team_033 possession (Score: 89-92)
Ben Anthony attempts a 3Pt. Contested by CJ LaVine (4.7 feet, ZONE). Ben Anthony misses. Rebound secured by John Durant.

[03:14] Team_035 possession (Score: 89-92)
Malcolm Turner drives and kicks out. Malcolm Turner attempts a Midrange. Contested by Manu Irving (4.7 feet, ZONE). Malcolm Turner misses. Rebound secured by Tim Griffin.

[03:01] Team_033 possession (Score: 89-92)
Terry Jokic attempts a Layup. Contested by John Durant (4.7 feet, ZONE). TERRY JOKIC MAKES IT! Assist: Manu Irving
Score: 89-94

[02:45] Team_035 possession (Score: 89-94)
FOUL! Shooting foul on Zion Adebayo. Malcolm Turner to the line for 2 free throws. [Team fouls: 3] (Zion Adebayo: 1 personal fouls)   FT 1/2: GOOD   FT 2/2: GOOD Malcolm Turner makes 2/2 from the line.
Score: 91-94

[02:35] Team_033 possession (Score: 91-94)
FOUL! Reach-in foul on John Durant during the drive. [Team fouls: 4] No free throws, side out. (John Durant: 1 personal fouls)

[02:19] Team_033 possession (Score: 91-94)
Terry Jokic drives and kicks out. Ben Anthony attempts a 3Pt. Contested by CJ LaVine (4.2 feet, MAN). BEN ANTHONY MAKES IT! Assist: Terry Jokic
Score: 91-97

[02:04] Team_035 possession (Score: 91-97)
Malcolm Turner attempts a Midrange. Contested by Terry Jokic (4.4 feet, MAN). MALCOLM TURNER MAKES IT! Assist: CJ LaVine
Score: 93-97

[01:47] Team_033 possession (Score: 93-97)
FOUL! Reach-in foul on Tobias Jordan during the drive. [IN THE BONUS! 5 team fouls] Zion Adebayo to the line for 2 free throws. (Tobias Jordan: 1 personal fouls)   FT 1/2: GOOD   FT 2/2: GOOD Zion Adebayo makes 2/2 from the line.
Score: 93-99

[01:34] Team_035 possession (Score: 93-99)
CJ LaVine drives and kicks out. FOUL! Shooting foul on Manu Irving. Malcolm Turner to the line for 2 free throws. [Team fouls: 4] (Manu Irving: 1 personal fouls)   FT 1/2: MISS   FT 2/2: GOOD Malcolm Turner makes 1/2 from the line.
Score: 94-99

[01:20] Team_033 possession (Score: 94-99)
Ben Anthony attempts a 3Pt. Contested by CJ LaVine (4.7 feet, MAN). Ben Anthony misses. Offensive rebound by Tim Griffin! Tim Griffin puts it back in!
Score: 94-101

[01:06] Team_035 possession (Score: 94-101)
Cole George attempts a 3Pt. Contested by Manu Irving (5.0 feet, MAN). Cole George misses. Rebound secured by Zion Adebayo.

[00:49] Team_033 possession (Score: 94-101)
Ben Anthony attempts a 3Pt. Contested by CJ LaVine (4.7 feet, MAN). Ben Anthony misses. Rebound secured by Cole George.

[00:38] Team_035 possession (Score: 94-101)
Tobias Jordan attempts a 3Pt. Contested by Ben Anthony (4.5 feet, ZONE). Tobias Jordan misses. Rebound secured by Tim Griffin.

[00:24] Team_033 possession (Score: 94-101)
Terry Jokic attempts a 3Pt. Contested by Malcolm Turner (5.3 feet, MAN). Terry Jokic misses. Rebound secured by John Durant.

[00:09] Team_035 possession (Score: 94-101)
John Durant drives, picks up Tim Griffin. Help arrives from Manu Irving! John Durant attempts a Dunk. Contested by Manu Irving (4.8 feet, MAN). John Durant misses. Rebound secured by Zion Adebayo.

================================================================================
                              4TH QUARTER COMPLETE                              
================================================================================

4TH QUARTER SCORE: Team_035 23, Team_033 28

BOX SCORE:
================================================================================

Team_035
--------------------------------------------------------------------------------
Player                MIN  PTS  REB  AST  TO      FG   FG%      3P   3P%
--------------------------------------------------------------------------------
Malcolm Turner         17    7    0    0   0   4/5    80.0     0/0   0.0
Domantas Green         31    4    0    1   0   2/3    66.7     0/0   0.0
CJ LaVine              17    4    0    1   0   2/2   100.0     0/0   0.0
Gary Johnson           31    3    2    2   0   1/1   100.0     0/0   0.0
Shaquille Ginobili     31    3    0    1   0   1/1   100.0     0/0   0.0
Magic Westbrook        32    2    5    1   0   1/4    25.0     0/0   0.0
Dwyane Johnson         31    0    1    0   0   0/1     0.0     0/0   0.0
Tobias Jordan          17    0    2    2   0   0/3     0.0     0/0   0.0
John Durant            17    0    2    0   0   0/2     0.0     0/0   0.0
Cole George            17    0    1    0   0   0/1     0.0     0/0   0.0

TEAM: FG: 11/23 (47.8%), 3PT: 1/3 (33.3%), REB: 12 (5 off, 7 def), AST: 8, TO: 0
TEAM FOULS: 5 [Team_033 in BONUS]


Team_033
--------------------------------------------------------------------------------
Player                MIN  PTS  REB  AST  TO      FG   FG%      3P   3P%
--------------------------------------------------------------------------------
Ben Anthony            17    5    0    0   0   2/5    40.0     0/0   0.0
Zion Adebayo           17    4    3    0   0   2/2   100.0     0/0   0.0
Terry Jokic            17    4    1    1   0   2/3    66.7     0/0   0.0
Desmond DeRozan        32    3    2    0   0   1/4    25.0     0/0   0.0
Bradley Simmons        31    3    2    2   0   1/1   100.0     0/0   0.0
Cade Randle            31    3    1    0   0   1/1   100.0     0/0   0.0
Chris Anunoby          31    2    0    0   0   1/2    50.0     0/0   0.0
Joel Green             31    2    0    1   0   1/1   100.0     0/0   0.0
Tim Griffin            17    2    4    0   0   1/1   100.0     0/0   0.0
Manu Irving            17    0    0    1   0   0/0     0.0     0/0   0.0

TEAM: FG: 12/20 (60.0%), 3PT: 3/6 (50.0%), REB: 14 (2 off, 12 def), AST: 5, TO: 2
TEAM FOULS: 4

================================================================================

================================================================================
                               FULL GAME COMPLETE                               
================================================================================

FINAL SCORE: Team_035 94, Team_033 101

SCORING BY QUARTER:
--------------------------------------------------------------------------------
Team                     Q1     Q2     Q3     Q4    FINAL
--------------------------------------------------------------------------------
Team_035                 24     17     30     23       94
Team_033                 23     21     29     28      101
--------------------------------------------------------------------------------

FULL GAME BOX SCORE:
================================================================================

Team_035
--------------------------------------------------------------------------------
Player                MIN  PTS  REB  AST  TO      FG   FG%      3P   3P%      FT STL BLK
--------------------------------------------------------------------------------
Magic Westbrook        32   11   13    3   0   5/13   38.5   0/1     0.0   5/5     0   0
Domantas Green         31   16    0    2   2   7/11   63.6   2/4    50.0   4/5     3   1
Shaquille Ginobili     31    4    0    3   1   4/6    66.7   1/2    50.0   1/2     1   1
Gary Johnson           31   17    5    3   3   6/9    66.7   0/2     0.0   6/6     1   1
Dwyane Johnson         31   19    9    2   3   6/10   60.0   0/1     0.0   6/6     1   1
CJ LaVine              17    4    0    1   0   3/4    75.0   0/0     0.0   0/0     1   0
Cole George            17    3    5    1   2   1/3    33.3   0/1     0.0   1/1     0   0
Malcolm Turner         17    7    0    0   0   3/6    50.0   0/2     0.0   3/4     1   0
Tobias Jordan          17    4    7    2   0   2/9    22.2   0/3     0.0   0/0     0   0
John Durant            17    9    5    0   1   2/5    40.0   0/0     0.0   2/2     0   0

TEAM: FG: 41/78 (52.6%), 3PT: 3/16 (18.8%), REB: 42 (10 off, 32 def), AST: 17, TO: 12


Team_033
--------------------------------------------------------------------------------
Player                MIN  PTS  REB  AST  TO      FG   FG%      3P   3P%      FT STL BLK
--------------------------------------------------------------------------------
Desmond DeRozan        32    5   16    4   1   4/11   36.4   1/3    33.3   1/2     0   0
Joel Green             31   12    0    5   4   3/6    50.0   1/4    25.0   2/2     0   1
Chris Anunoby          31    9    0    0   3   3/8    37.5   0/3     0.0   0/0     0   0
Cade Randle            31   14    5    3   2   6/11   54.5   2/6    33.3   3/4     1   0
Bradley Simmons        31   26    7    3   0  10/12   83.3   1/1   100.0   5/6     1   0
Ben Anthony            17   12    0    0   2   6/9    66.7   3/5    60.0   0/0     0   0
Manu Irving            17    5    0    3   0   1/6    16.7   0/3     0.0   0/0     1   0
Terry Jokic            17    6    6    3   0   4/7    57.1   0/2     0.0   2/2     0   0
Tim Griffin            17    6    9    0   0   2/2   100.0   0/0     0.0   0/0     0   0
Zion Adebayo           17    4    4    1   0   2/3    66.7   0/0     0.0   2/2     0   1

TEAM: FG: 42/76 (55.3%), 3PT: 8/27 (29.6%), REB: 49 (12 off, 37 def), AST: 22, TO: 12

================================================================================
