================================================================================
                        FULL GAME - Team_097 vs Team_045                        
================================================================================

================================================================================
                       1ST QUARTER - Team_097 vs Team_045                       
================================================================================

[12:00] Team_097 possession (Score: 0-0)
Jrue Haliburton attempts a 3Pt. Contested by Cole Simons (3.7 feet, MAN). Jrue Haliburton misses. Rebound secured by DeMar Turner.

[11:46] Team_045 possession (Score: 0-0)
DeMar Turner drives, Tyrese Stewart stays with him. DeMar Turner attempts a Dunk. Contested by Tyrese Stewart (5.6 feet, ZONE). DEMAR TURNER MAKES IT! Assist: Trae Russell
Score: 0-2

[11:32] Team_097 possession (Score: 0-2)
FOUL! Holding foul on Zion Butler. [Team fouls: 1] No free throws, side out. (Zion Butler: 1 personal fouls)

[11:20] Team_097 possession (Score: 0-2)
Shai Poole attempts a Layup. Contested by Zion Butler (3.8 feet, ZONE). SHAI POOLE MAKES IT!
Score: 2-2

[11:09] Team_045 possession (Score: 2-2)
FOUL! Holding foul on Evan Brogdon. [Team fouls: 1] No free throws, side out. (Evan Brogdon: 1 personal fouls)

[10:56] Team_045 possession (Score: 2-2)
Zion Butler drives, Anthony Haliburton stays with him. Zion Butler attempts a Layup. Contested by Anthony Haliburton (3.6 feet, MAN). ZION BUTLER MAKES IT!
Score: 2-4

[10:39] Team_097 possession (Score: 2-4)
Tyrese Stewart attempts a Midrange. Contested by Zion Butler (4.1 feet, MAN). Tyrese Stewart misses. Rebound secured by Zion Butler.

[10:22] Team_045 possession (Score: 2-4)
Trae Russell attempts a 3Pt. Contested by Jrue Haliburton (5.7 feet, MAN). Trae Russell misses. Offensive rebound by Zion Butler! Zion Butler's putback is no good. Offensive rebound by Zion Butler! Zion Butler kicks it out.

[10:08] Team_045 possession (Score: 2-4)
Zion Butler drives and kicks out. DeMar Turner attempts a Midrange. Contested by Jrue Haliburton (5.2 feet, ZONE). DeMar Turner misses. Rebound secured by Anthony Haliburton.

[09:53] Team_097 possession (Score: 2-4)
Evan Brogdon attempts a Layup. Contested by Rudy Antetokounmpo (5.1 feet, MAN). Evan Brogdon misses. Rebound secured by Cole Simons.

[09:35] Team_045 possession (Score: 2-4)
Cole Simons attempts a Midrange. Contested by Jrue Haliburton (5.8 feet, ZONE). COLE SIMONS MAKES IT!
Score: 2-6

[09:18] Team_097 possession (Score: 2-6)
Evan Brogdon attempts a 3Pt. Contested by Rudy Antetokounmpo (5.1 feet, MAN). EVAN BROGDON MAKES IT!
Score: 5-6

[09:00] Team_045 possession (Score: 5-6)
DeMar Turner drives, picks up Anthony Haliburton. Help arrives from Jrue Haliburton! DeMar Turner attempts a Layup. Contested by Jrue Haliburton (3.6 feet, ZONE). DEMAR TURNER MAKES IT! Assist: Trae Russell
Score: 5-8

[08:48] Team_097 possession (Score: 5-8)
Tyrese Stewart drives and kicks out. Evan Brogdon attempts a Midrange. Contested by DeMar Turner (4.9 feet, ZONE). Evan Brogdon misses. Offensive rebound by Anthony Haliburton! Anthony Haliburton puts it back in!
Score: 7-8

[08:32] Team_045 possession (Score: 7-8)
DeMar Turner makes the Layup and draws the foul on Anthony Haliburton! And-1! DeMar Turner to the line for 1. [Team fouls: 2] (Anthony Haliburton: 1 personal fouls)   FT 1/1: GOOD DeMar Turner makes 1/1 from the line.
Score: 7-11

[08:19] Team_097 possession (Score: 7-11)
Shai Poole attempts a Midrange. Contested by Cole Simons (3.8 feet, ZONE). Shai Poole misses. Offensive rebound by Tyrese Stewart! Tyrese Stewart kicks it out.

[08:01] Team_097 possession (Score: 7-11)
Jrue Haliburton attempts a 3Pt. Contested by Cole Simons (3.7 feet, ZONE). Jrue Haliburton misses. Offensive rebound by Tyrese Stewart! Tyrese Stewart kicks it out.

[07:43] Team_097 possession (Score: 7-11)
Tyrese Stewart attempts a Midrange. Contested by Cole Simons (4.1 feet, ZONE). Tyrese Stewart misses. Rebound secured by Zion Butler.

[07:30] Team_045 possession (Score: 7-11)
Cole Simons attempts a 3Pt. Contested by Shai Poole (4.0 feet, MAN). Cole Simons misses. Rebound secured by Tyrese Stewart.

[07:15] Team_097 possession (Score: 7-11)
Shai Poole attempts a 3Pt. Contested by Cole Simons (3.8 feet, ZONE). Shai Poole misses. Rebound secured by Zion Butler.

[07:05] Team_045 possession (Score: 7-11)
Zion Butler attempts a Midrange. Contested by Anthony Haliburton (3.6 feet, MAN). Zion Butler misses. Rebound secured by Anthony Haliburton.

[06:52] Team_097 possession (Score: 7-11)
Anthony Haliburton attempts a Layup. Contested by Zion Butler (3.7 feet, MAN). ANTHONY HALIBURTON MAKES IT!
Score: 9-11

[06:37] Team_045 possession (Score: 9-11)
Zion Butler drives to the basket... Zion Butler commits a violation (traveling/carry)! TURNOVER! (dead ball)

[06:22] Team_097 possession (Score: 9-11)
Jrue Haliburton attempts a Midrange. Contested by Cole Simons (3.7 feet, MAN). JRUE HALIBURTON MAKES IT!
Score: 11-11

[06:12] Team_045 possession (Score: 11-11)
Zion Butler attempts a 3Pt. Contested by Anthony Haliburton (3.6 feet, MAN). Zion Butler misses. Rebound secured by Anthony Haliburton.

[05:57] Team_097 possession (Score: 11-11)
Shai Poole drives and kicks out. FOUL! Shooting foul on Cole Simons. Shai Poole to the line for 2 free throws. [Team fouls: 2] (Cole Simons: 1 personal fouls)   FT 1/2: MISS   FT 2/2: GOOD Shai Poole makes 1/2 from the line.
Score: 12-11

[05:45] Team_045 possession (Score: 12-11)
Rudy Antetokounmpo drives, picks up Anthony Haliburton. Help arrives from Jrue Haliburton! Rudy Antetokounmpo attempts a Dunk. Contested by Jrue Haliburton (3.7 feet, ZONE). RUDY ANTETOKOUNMPO MAKES IT! Assist: Zion Butler
Score: 12-13

[05:33] Team_097 possession (Score: 12-13)
Anthony Haliburton drives and kicks out. Jrue Haliburton attempts a 3Pt. Contested by Cole Simons (3.3 feet, ZONE). Jrue Haliburton misses. Rebound secured by Zion Butler.

[05:15] Team_045 possession (Score: 12-13)
FOUL! Shooting foul on Evan Brogdon. Rudy Antetokounmpo to the line for 3 free throws. [Team fouls: 3] (Evan Brogdon: 2 personal fouls)   FT 1/3: GOOD   FT 2/3: MISS   FT 3/3: GOOD Rudy Antetokounmpo makes 2/3 from the line.
Score: 12-15

[04:56] Team_097 possession (Score: 12-15)
Evan Brogdon drives and kicks out. Evan Brogdon makes the Midrange and draws the foul on Rudy Antetokounmpo! And-1! Evan Brogdon to the line for 1. [Team fouls: 3] (Rudy Antetokounmpo: 1 personal fouls)   FT 1/1: GOOD Evan Brogdon makes 1/1 from the line.
Score: 15-15

[04:41] Team_045 possession (Score: 15-15)
Trae Russell attempts a Midrange. Contested by Jrue Haliburton (5.8 feet, MAN). Trae Russell misses. Offensive rebound by DeMar Turner! DeMar Turner kicks it out.

[04:28] Team_045 possession (Score: 15-15)
Zion Butler attempts a Layup. Contested by Anthony Haliburton (3.7 feet, MAN). ZION BUTLER MAKES IT! Assist: Trae Russell
Score: 15-17

[04:16] Team_097 possession (Score: 15-17)
Tyrese Stewart drives to the basket... FOUL! Offensive foul on Tyrese Stewart! Zion Butler drew the charge! [Team fouls: 4] (Tyrese Stewart: 1 personal fouls) TURNOVER! (dead ball)

[04:04] Team_045 possession (Score: 15-17)
Cole Simons attempts a 3Pt. Contested by Shai Poole (4.1 feet, MAN). Cole Simons misses. Offensive rebound by Zion Butler! Zion Butler puts it back in!
Score: 15-19

[03:52] Team_097 possession (Score: 15-19)
Jrue Haliburton attempts a 3Pt. Contested by Cole Simons (3.9 feet, MAN). Jrue Haliburton misses. Rebound secured by Cole Simons.

[03:36] Team_045 possession (Score: 15-19)
Zion Butler attempts a Midrange. Contested by Anthony Haliburton (3.7 feet, MAN). ZION BUTLER MAKES IT! Assist: Cole Simons
Score: 15-21

[03:18] Team_097 possession (Score: 15-21)
Anthony Haliburton drives, Zion Butler stays with him. Anthony Haliburton attempts a Dunk. Contested by Zion Butler (4.0 feet, ZONE). ANTHONY HALIBURTON MAKES IT!
Score: 17-21

[03:03] Team_045 possession (Score: 17-21)
Cole Simons drives and kicks out. DeMar Turner attempts a Midrange. Contested by Jrue Haliburton (5.3 feet, ZONE). DEMAR TURNER MAKES IT! Assist: Zion Butler
Score: 17-23

[02:47] Team_097 possession (Score: 17-23)
FOUL! Holding foul on Rudy Antetokounmpo. [Team fouls: 4] No free throws, side out. (Rudy Antetokounmpo: 2 personal fouls)

[02:34] Team_097 possession (Score: 17-23)
Shai Poole attempts a Midrange. Contested by Cole Simons (4.1 feet, MAN). Shai Poole misses. Offensive rebound by Anthony Haliburton! Anthony Haliburton kicks it out.

[02:20] Team_097 possession (Score: 17-23)
Jrue Haliburton attempts a Layup. BLOCKED BY COLE SIMONS! Ball goes out off Cole Simons. Jrue Haliburton's ball!

[02:06] Team_097 possession (Score: 17-23)
FOUL! Shooting foul on Zion Butler. Tyrese Stewart to the line for 2 free throws. [BONUS: 5 team fouls] (Zion Butler: 2 personal fouls)   FT 1/2: GOOD   FT 2/2: MISS Tyrese Stewart makes 1/2 from the line. Offensive rebound by Anthony Haliburton! Anthony Haliburton kicks it out.
Score: 18-23

[01:53] Team_097 possession (Score: 18-23)
Evan Brogdon drives to the basket... Evan Brogdon throws a bad pass out of bounds! TURNOVER! (dead ball)

[01:53] Substitution (Team_097): Evan Brogdon OUT → Gary Carter IN (stamina_rule2)

[01:53] Substitution (Team_097): Jrue Haliburton OUT → Dwyane Ginobili IN (stamina_rule2)

[01:53] Substitution (Team_097): Shai Poole OUT → Miles Dosunmu IN (stamina_rule2)

[01:53] Substitution (Team_097): Anthony Haliburton OUT → Joel Simons IN (stamina_rule2)

[01:53] Substitution (Team_097): Tyrese Stewart OUT → Miles Banchero IN (stamina_rule2)

[01:53] Substitution (Team_045): Rudy Antetokounmpo OUT → John Wagner IN (stamina_rule2)

[01:53] Substitution (Team_045): Trae Russell OUT → Julius James IN (stamina_rule2)

[01:53] Substitution (Team_045): Cole Simons OUT → Gary Towns IN (stamina_rule2)

[01:53] Substitution (Team_045): DeMar Turner OUT → Tim Sexton IN (stamina_rule2)

[01:53] Substitution (Team_045): Zion Butler OUT → Stephen Paul IN (stamina_rule2)

[01:35] Team_045 possession (Score: 18-23)
Stephen Paul drives, Joel Simons stays with him. Stephen Paul attempts a Layup. Contested by Joel Simons (3.5 feet, MAN). Stephen Paul misses. Rebound secured by Miles Banchero.

[01:20] Team_097 possession (Score: 18-23)
Dwyane Ginobili attempts a Layup. Contested by Julius James (3.9 feet, MAN). Dwyane Ginobili misses. Rebound secured by Julius James.

[01:07] Team_045 possession (Score: 18-23)
Julius James attempts a 3Pt. Contested by Joel Simons (3.7 feet, ZONE). Julius James misses. Rebound secured by Miles Dosunmu.

[00:53] Team_097 possession (Score: 18-23)
Dwyane Ginobili attempts a Layup. Contested by Stephen Paul (4.4 feet, ZONE). DWYANE GINOBILI MAKES IT!
Score: 20-23

[00:40] Team_045 possession (Score: 20-23)
FOUL! Shooting foul on Joel Simons. Stephen Paul to the line for 2 free throws. [BONUS: 5 team fouls] (Joel Simons: 1 personal fouls)   FT 1/2: GOOD   FT 2/2: GOOD Stephen Paul makes 2/2 from the line.
Score: 20-25

[00:23] Team_097 possession (Score: 20-25)
Joel Simons attempts a 3Pt. Contested by John Wagner (4.3 feet, ZONE). Joel Simons misses. Rebound secured by Julius James.

[00:13] Team_045 possession (Score: 20-25)
Julius James drives and kicks out. Tim Sexton attempts a 3Pt. Contested by Joel Simons (3.6 feet, MAN). Tim Sexton misses. Rebound secured by Miles Dosunmu.

[00:01] Team_097 possession (Score: 20-25)
Miles Dosunmu attempts a Midrange. Contested by Gary Towns (5.5 feet, MAN). MILES DOSUNMU MAKES IT!
Score: 22-25

================================================================================
                              1ST QUARTER COMPLETE                              
================================================================================

1ST QUARTER SCORE: Team_097 22, Team_045 25

BOX SCORE:
================================================================================

Team_097
--------------------------------------------------------------------------------
Player                MIN  PTS  REB  AST  TO      FG   FG%      3P   3P%
--------------------------------------------------------------------------------
Anthony Haliburton     10    6    6    0   0   3/4    75.0     0/0   0.0
Evan Brogdon           10    6    0    0   0   2/3    66.7     0/0   0.0
Shai Poole             10    3    0    0   0   2/3    66.7     0/0   0.0
Jrue Haliburton        10    2    0    0   0   1/3    33.3     0/0   0.0
Dwyane Ginobili         2    2    0    0   0   1/2    50.0     0/0   0.0
Miles Dosunmu           2    2    2    0   0   1/1   100.0     0/0   0.0
Tyrese Stewart         10    0    3    0   0   0/2     0.0     0/0   0.0
Miles Banchero          2    0    1    0   0   0/0     0.0     0/0   0.0
Joel Simons             2    0    0    0   0   0/1     0.0     0/0   0.0

TEAM: FG: 10/19 (52.6%), 3PT: 1/5 (20.0%), REB: 12 (5 off, 7 def), AST: 0, TO: 2
TEAM FOULS: 5 [Team_045 in BONUS]


Team_045
--------------------------------------------------------------------------------
Player                MIN  PTS  REB  AST  TO      FG   FG%      3P   3P%
--------------------------------------------------------------------------------
DeMar Turner           10    9    2    0   0   4/4   100.0     0/0   0.0
Zion Butler            10    8    6    2   0   4/7    57.1     0/0   0.0
Rudy Antetokounmpo     10    4    0    0   0   2/2   100.0     0/0   0.0
Cole Simons            10    2    2    1   0   1/2    50.0     0/0   0.0
Stephen Paul            2    2    0    0   0   1/2    50.0     0/0   0.0
Trae Russell           10    0    0    3   0   0/0     0.0     0/0   0.0
Julius James            2    0    2    0   0   0/2     0.0     0/0   0.0

TEAM: FG: 12/19 (63.2%), 3PT: 2/5 (40.0%), REB: 12 (3 off, 9 def), AST: 6, TO: 1
TEAM FOULS: 5 [Team_097 in BONUS]

================================================================================

================================================================================
                       2ND QUARTER - Team_097 vs Team_045                       
================================================================================

[12:00] Team_097 possession (Score: 22-25)
Anthony Haliburton drives, Zion Butler stays with him. Anthony Haliburton attempts a Layup. Contested by Zion Butler (3.9 feet, ZONE). ANTHONY HALIBURTON MAKES IT! Assist: Evan Brogdon
Score: 24-25

[11:45] Team_045 possession (Score: 24-25)
Cole Simons attempts a 3Pt. Contested by Shai Poole (4.1 feet, MAN). Cole Simons misses. Rebound secured by Anthony Haliburton.

[11:33] Team_097 possession (Score: 24-25)
Evan Brogdon attempts a 3Pt. Contested by Rudy Antetokounmpo (5.2 feet, MAN). Evan Brogdon misses. FOUL! Loose ball foul on Zion Butler during the rebound battle. [Team fouls: 1] No free throws, side out. (Zion Butler: 1 personal fouls)

[11:20] Team_097 possession (Score: 24-25)
Jrue Haliburton attempts a Midrange. Contested by Cole Simons (3.9 feet, MAN). Jrue Haliburton misses. Rebound secured by Cole Simons.

[11:09] Team_045 possession (Score: 24-25)
Rudy Antetokounmpo attempts a Midrange. Contested by Evan Brogdon (5.2 feet, MAN). RUDY ANTETOKOUNMPO MAKES IT! Assist: Trae Russell
Score: 24-27

[10:54] Team_097 possession (Score: 24-27)
Jrue Haliburton commits a violation (traveling/carry)! TURNOVER! (dead ball)

[10:54] Substitution (Team_045): Zion Butler OUT → Stephen Paul IN (stamina_rule2)

[10:45] Team_045 possession (Score: 24-27)
Trae Russell attempts a Layup. Contested by Anthony Haliburton (4.0 feet, ZONE). TRAE RUSSELL MAKES IT! Assist: DeMar Turner
Score: 24-29

[10:30] Team_097 possession (Score: 24-29)
Anthony Haliburton attempts a 3Pt. Contested by DeMar Turner (5.5 feet, MAN). ANTHONY HALIBURTON MAKES IT! Assist: Evan Brogdon
Score: 27-29

[10:18] Team_045 possession (Score: 27-29)
Trae Russell makes the Layup and draws the foul on Jrue Haliburton! And-1! Trae Russell to the line for 1. [Team fouls: 1] (Jrue Haliburton: 1 personal fouls)   FT 1/1: GOOD Trae Russell makes 1/1 from the line.
Score: 27-32

[10:02] Team_097 possession (Score: 27-32)
FOUL! Holding foul on Cole Simons. [Team fouls: 2] No free throws, side out. (Cole Simons: 1 personal fouls)

[09:50] Team_097 possession (Score: 27-32)
Evan Brogdon attempts a 3Pt. Contested by Cole Simons (4.3 feet, ZONE). EVAN BROGDON MAKES IT! Assist: Jrue Haliburton
Score: 30-32

[09:37] Team_045 possession (Score: 30-32)
FOUL! Shooting foul on Anthony Haliburton. Cole Simons to the line for 2 free throws. [Team fouls: 2] (Anthony Haliburton: 1 personal fouls)   FT 1/2: GOOD   FT 2/2: GOOD Cole Simons makes 2/2 from the line.
Score: 30-34

[09:22] Team_097 possession (Score: 30-34)
Tyrese Stewart attempts a Midrange. Contested by Stephen Paul (5.3 feet, MAN). Tyrese Stewart misses. Rebound secured by Cole Simons.

[09:09] Team_045 possession (Score: 30-34)
DeMar Turner attempts a Midrange. Contested by Tyrese Stewart (5.9 feet, ZONE). DeMar Turner misses. Offensive rebound by Stephen Paul! Stephen Paul's putback is no good. Rebound secured by Anthony Haliburton.

[08:56] Team_097 possession (Score: 30-34)
Tyrese Stewart attempts a Layup. Contested by Stephen Paul (5.3 feet, MAN). TYRESE STEWART MAKES IT!
Score: 32-34

[08:41] Team_045 possession (Score: 32-34)
Cole Simons attempts a 3Pt. Contested by Shai Poole (4.4 feet, MAN). Cole Simons misses. Rebound secured by Anthony Haliburton.

[08:24] Team_097 possession (Score: 32-34)
Evan Brogdon attempts a 3Pt. Contested by Cole Simons (4.5 feet, ZONE). Evan Brogdon misses. Rebound secured by Stephen Paul.

[08:14] Team_045 possession (Score: 32-34)
DeMar Turner attempts a Layup. BLOCKED BY ANTHONY HALIBURTON! Ball is loose! Rebound secured by Tyrese Stewart.

[08:00] Team_097 possession (Score: 32-34)
Shai Poole drives and kicks out. Jrue Haliburton attempts a 3Pt. Contested by Cole Simons (3.9 feet, MAN). Jrue Haliburton misses. Rebound secured by Cole Simons.

[07:45] Team_045 possession (Score: 32-34)
Trae Russell loses control! Ball rolls out of bounds! TURNOVER! (dead ball)

[07:45] Substitution (Team_097): Evan Brogdon OUT → Gary Carter IN (stamina_rule2)

[07:45] Substitution (Team_097): Jrue Haliburton OUT → Dwyane Ginobili IN (stamina_rule2)

[07:45] Substitution (Team_097): Shai Poole OUT → Miles Dosunmu IN (stamina_rule2)

[07:45] Substitution (Team_097): Anthony Haliburton OUT → Joel Simons IN (stamina_rule2)

[07:45] Substitution (Team_097): Tyrese Stewart OUT → Miles Banchero IN (stamina_rule2)

[07:45] Substitution (Team_045): Rudy Antetokounmpo OUT → John Wagner IN (stamina_rule2)

[07:45] Substitution (Team_045): Trae Russell OUT → Julius James IN (stamina_rule2)

[07:45] Substitution (Team_045): Cole Simons OUT → Gary Towns IN (stamina_rule2)

[07:45] Substitution (Team_045): DeMar Turner OUT → Tim Sexton IN (stamina_rule2)

[07:32] Team_097 possession (Score: 32-34)
Gary Carter attempts a Midrange. Contested by John Wagner (3.9 feet, MAN). GARY CARTER MAKES IT!
Score: 34-34

[07:16] Team_045 possession (Score: 34-34)
John Wagner attempts a Layup. Contested by Miles Banchero (5.0 feet, ZONE). JOHN WAGNER MAKES IT! Assist: Tim Sexton
Score: 34-36

[07:04] Team_097 possession (Score: 34-36)
Gary Carter attempts a 3Pt. Contested by John Wagner (3.9 feet, MAN). GARY CARTER MAKES IT! Assist: Miles Banchero
Score: 37-36

[06:47] Team_045 possession (Score: 37-36)
FOUL! Shooting foul on Miles Dosunmu. John Wagner to the line for 2 free throws. [Team fouls: 3] (Miles Dosunmu: 1 personal fouls)   FT 1/2: GOOD   FT 2/2: GOOD John Wagner makes 2/2 from the line.
Score: 37-38

[06:36] Team_097 possession (Score: 37-38)
Joel Simons attempts a Midrange. Contested by Julius James (4.2 feet, ZONE). Joel Simons misses. Rebound secured by Stephen Paul.

[06:22] Team_045 possession (Score: 37-38)
Stephen Paul makes the Layup and draws the foul on Joel Simons! And-1! Stephen Paul to the line for 1. [Team fouls: 4] (Joel Simons: 1 personal fouls)   FT 1/1: MISS Stephen Paul makes 0/1 from the line. Rebound secured by Miles Dosunmu.
Score: 37-40

[06:06] Team_097 possession (Score: 37-40)
Miles Banchero attempts a Layup. Contested by Stephen Paul (4.6 feet, ZONE). MILES BANCHERO MAKES IT!
Score: 39-40

[05:52] Team_045 possession (Score: 39-40)
FOUL! Holding foul on Joel Simons. [IN THE BONUS! 5 team fouls] Stephen Paul to the line for 2 free throws. (Joel Simons: 2 personal fouls)   FT 1/2: GOOD   FT 2/2: GOOD Stephen Paul makes 2/2 from the line.
Score: 39-42

[05:39] Team_097 possession (Score: 39-42)
Gary Carter attempts a 3Pt. Contested by Tim Sexton (4.4 feet, ZONE). GARY CARTER MAKES IT! Assist: Joel Simons
Score: 42-42

[05:23] Team_045 possession (Score: 42-42)
Gary Towns attempts a 3Pt. Contested by Joel Simons (3.4 feet, ZONE). GARY TOWNS MAKES IT! Assist: Stephen Paul
Score: 42-45

[05:09] Team_097 possession (Score: 42-45)
FOUL! Shooting foul on John Wagner. Gary Carter to the line for 2 free throws. [Team fouls: 3] (John Wagner: 1 personal fouls)   FT 1/2: GOOD   FT 2/2: GOOD Gary Carter makes 2/2 from the line.
Score: 44-45

[04:54] Team_045 possession (Score: 44-45)
Gary Towns attempts a 3Pt. Contested by Miles Dosunmu (3.6 feet, MAN). Gary Towns misses. Rebound secured by Miles Banchero.

[04:43] Team_097 possession (Score: 44-45)
Miles Banchero drives to the basket... Miles Banchero throws a bad pass! Stolen by Stephen Paul! TURNOVER! (live ball)

[04:25] Team_045 possession (Score: 44-45)
Gary Towns attempts a 3Pt. Contested by Joel Simons (3.4 feet, ZONE). GARY TOWNS MAKES IT! Assist: Tim Sexton
Score: 44-48

[04:09] Team_097 possession (Score: 44-48)
Miles Dosunmu attempts a Layup. Contested by Gary Towns (5.5 feet, MAN). Miles Dosunmu misses. Rebound secured by Stephen Paul.

[03:56] Team_045 possession (Score: 44-48)
Julius James drives, Dwyane Ginobili stays with him. Julius James attempts a Layup. Contested by Dwyane Ginobili (4.8 feet, MAN). Julius James misses. Rebound secured by Miles Dosunmu.

[03:38] Team_097 possession (Score: 44-48)
Miles Dosunmu attempts a 3Pt. Contested by Gary Towns (5.5 feet, MAN). Miles Dosunmu misses. Rebound secured by Tim Sexton.

[03:23] Team_045 possession (Score: 44-48)
Tim Sexton attempts a Layup. Contested by Joel Simons (4.0 feet, ZONE). TIM SEXTON MAKES IT!
Score: 44-50

[03:11] Team_097 possession (Score: 44-50)
Miles Banchero makes the Layup and draws the foul on Tim Sexton! And-1! Miles Banchero to the line for 1. [Team fouls: 4] (Tim Sexton: 1 personal fouls)   FT 1/1: GOOD Miles Banchero makes 1/1 from the line.
Score: 47-50

[02:57] Team_045 possession (Score: 47-50)
Stephen Paul attempts a Midrange. Contested by Joel Simons (3.4 feet, MAN). STEPHEN PAUL MAKES IT! Assist: Tim Sexton
Score: 47-52

[02:48] Team_097 possession (Score: 47-52)
Dwyane Ginobili drives, Tim Sexton stays with him. Dwyane Ginobili attempts a Layup. Contested by Tim Sexton (4.5 feet, ZONE). DWYANE GINOBILI MAKES IT! Assist: Miles Dosunmu
Score: 49-52

[02:31] Team_045 possession (Score: 49-52)
Tim Sexton attempts a Midrange. Contested by Dwyane Ginobili (5.0 feet, ZONE). TIM SEXTON MAKES IT! Assist: Gary Towns
Score: 49-54

[02:18] Team_097 possession (Score: 49-54)
Joel Simons attempts a 3Pt. Contested by John Wagner (4.3 feet, ZONE). JOEL SIMONS MAKES IT! Assist: Miles Dosunmu
Score: 52-54

[02:04] Team_045 possession (Score: 52-54)
Stephen Paul attempts a Layup. Contested by Joel Simons (3.4 feet, ZONE). STEPHEN PAUL MAKES IT! Assist: Tim Sexton
Score: 52-56

[01:54] Team_097 possession (Score: 52-56)
FOUL! Holding foul on John Wagner. [IN THE BONUS! 5 team fouls] Gary Carter to the line for 2 free throws. (John Wagner: 2 personal fouls)   FT 1/2: GOOD   FT 2/2: GOOD Gary Carter makes 2/2 from the line.
Score: 54-56

[01:44] Team_045 possession (Score: 54-56)
Stephen Paul attempts a Midrange. Contested by Dwyane Ginobili (4.5 feet, ZONE). Stephen Paul misses. Rebound secured by Miles Banchero.

[01:33] Team_097 possession (Score: 54-56)
Gary Carter attempts a Layup. Contested by John Wagner (4.0 feet, MAN). Gary Carter misses. Rebound secured by Stephen Paul.

[01:19] Team_045 possession (Score: 54-56)
John Wagner attempts a 3Pt. Contested by Gary Carter (4.9 feet, MAN). John Wagner misses. Offensive rebound by Tim Sexton! Tim Sexton kicks it out.

[01:05] Team_045 possession (Score: 54-56)
Tim Sexton drives to the basket... Tim Sexton throws a bad pass out of bounds! TURNOVER! (dead ball)

[00:53] Team_097 possession (Score: 54-56)
Dwyane Ginobili attempts a Layup. Contested by Julius James (4.0 feet, MAN). Dwyane Ginobili misses. Rebound secured by Stephen Paul.

[00:42] Team_045 possession (Score: 54-56)
Tim Sexton throws a bad pass! Stolen by Joel Simons! TURNOVER! (live ball)

[00:26] Team_097 possession (Score: 54-56)
Dwyane Ginobili attempts a 3Pt. Contested by Julius James (4.0 feet, MAN). Dwyane Ginobili misses. Rebound secured by Stephen Paul.

[00:09] Team_045 possession (Score: 54-56)
Gary Towns attempts a 3Pt. Contested by Joel Simons (3.6 feet, ZONE). Gary Towns misses. Rebound secured by Miles Banchero.

================================================================================
                              2ND QUARTER COMPLETE                              
================================================================================

2ND QUARTER SCORE: Team_097 32, Team_045 31

BOX SCORE:
================================================================================

Team_097
--------------------------------------------------------------------------------
Player                MIN  PTS  REB  AST  TO      FG   FG%      3P   3P%
--------------------------------------------------------------------------------
Gary Carter             9   12    0    0   0   5/6    83.3     0/0   0.0
Anthony Haliburton     15    5    3    0   0   2/2   100.0     0/0   0.0
Miles Banchero          9    5    3    1   0   2/2   100.0     0/0   0.0
Evan Brogdon           15    3    0    2   0   1/2    50.0     0/0   0.0
Joel Simons             9    3    0    1   0   1/2    50.0     0/0   0.0
Tyrese Stewart         15    2    2    0   0   1/2    50.0     0/0   0.0
Dwyane Ginobili         9    2    0    0   0   1/3    33.3     0/0   0.0
Jrue Haliburton        15    0    0    1   0   0/1     0.0     0/0   0.0
Shai Poole             15    0    0    0   0   0/1     0.0     0/0   0.0
Miles Dosunmu           9    0    2    2   0   0/2     0.0     0/0   0.0

TEAM: FG: 13/23 (56.5%), 3PT: 5/8 (62.5%), REB: 9 (1 off, 8 def), AST: 7, TO: 2
TEAM FOULS: 5 [Team_045 in BONUS]


Team_045
--------------------------------------------------------------------------------
Player                MIN  PTS  REB  AST  TO      FG   FG%      3P   3P%
--------------------------------------------------------------------------------
Stephen Paul           13    6    6    1   0   3/5    60.0     0/0   0.0
Gary Towns              9    6    0    1   0   2/4    50.0     0/0   0.0
Trae Russell           15    5    0    1   0   2/2   100.0     0/0   0.0
John Wagner             9    4    0    0   0   2/2   100.0     0/0   0.0
Tim Sexton              9    4    2    4   0   2/2   100.0     0/0   0.0
Cole Simons            15    2    3    0   0   1/3    33.3     0/0   0.0
Rudy Antetokounmpo     15    2    0    0   0   1/1   100.0     0/0   0.0
DeMar Turner           15    0    0    1   0   0/2     0.0     0/0   0.0
Julius James            9    0    0    0   0   0/1     0.0     0/0   0.0

TEAM: FG: 13/22 (59.1%), 3PT: 2/6 (33.3%), REB: 12 (2 off, 10 def), AST: 8, TO: 3
TEAM FOULS: 5 [Team_097 in BONUS]

================================================================================

================================================================================
                       3RD QUARTER - Team_097 vs Team_045                       
================================================================================

[12:00] Team_097 possession (Score: 54-56)
Jrue Haliburton drives, Zion Butler stays with him. Jrue Haliburton attempts a Dunk. Contested by Zion Butler (3.7 feet, ZONE). JRUE HALIBURTON MAKES IT!
Score: 56-56

[11:46] Team_045 possession (Score: 56-56)
Cole Simons attempts a 3Pt. Contested by Shai Poole (4.0 feet, MAN). Cole Simons misses. Rebound secured by Tyrese Stewart.

[11:37] Team_097 possession (Score: 56-56)
Tyrese Stewart drives, Zion Butler stays with him. Tyrese Stewart attempts a Layup. Contested by Zion Butler (4.1 feet, ZONE). Tyrese Stewart misses. Rebound secured by DeMar Turner.

[11:24] Team_045 possession (Score: 56-56)
Trae Russell attempts a 3Pt. Contested by Jrue Haliburton (5.7 feet, MAN). TRAE RUSSELL MAKES IT! Assist: DeMar Turner
Score: 56-59

[11:10] Team_097 possession (Score: 56-59)
FOUL! Shooting foul on Rudy Antetokounmpo. Evan Brogdon to the line for 3 free throws. [Team fouls: 1] (Rudy Antetokounmpo: 1 personal fouls)   FT 1/3: GOOD   FT 2/3: GOOD   FT 3/3: GOOD Evan Brogdon makes 3/3 from the line.
Score: 59-59

[10:55] Team_045 possession (Score: 59-59)
Trae Russell attempts a Midrange. Contested by Jrue Haliburton (5.7 feet, ZONE). Trae Russell misses. Rebound secured by Tyrese Stewart.

[10:41] Team_097 possession (Score: 59-59)
Jrue Haliburton attempts a Midrange. Contested by Trae Russell (5.8 feet, ZONE). Jrue Haliburton misses. Rebound secured by Zion Butler.

[10:23] Team_045 possession (Score: 59-59)
Rudy Antetokounmpo drives to the basket... Rudy Antetokounmpo throws a bad pass! Stolen by Anthony Haliburton! TURNOVER! (live ball)

[10:09] Team_097 possession (Score: 59-59)
Shai Poole attempts a 3Pt. Contested by Cole Simons (3.8 feet, MAN). SHAI POOLE MAKES IT! Assist: Evan Brogdon
Score: 62-59

[09:50] Team_045 possession (Score: 62-59)
FOUL! Reach-in foul on Shai Poole during the drive. [Team fouls: 1] No free throws, side out. (Shai Poole: 1 personal fouls)

[09:32] Team_045 possession (Score: 62-59)
FOUL! Holding foul on Evan Brogdon. [Team fouls: 2] No free throws, side out. (Evan Brogdon: 1 personal fouls)

[09:17] Team_045 possession (Score: 62-59)
Cole Simons attempts a 3Pt. Contested by Shai Poole (4.0 feet, ZONE). Cole Simons misses. Rebound secured by Shai Poole.

[09:04] Team_097 possession (Score: 62-59)
Jrue Haliburton attempts a Layup. Contested by Zion Butler (3.7 feet, ZONE). Jrue Haliburton misses. Offensive rebound by Anthony Haliburton! Anthony Haliburton puts it back in!
Score: 64-59

[08:52] Team_045 possession (Score: 64-59)
Trae Russell attempts a Midrange. Contested by Evan Brogdon (5.2 feet, ZONE). Trae Russell misses. Rebound secured by Shai Poole.

[08:37] Team_097 possession (Score: 64-59)
Tyrese Stewart drives, Zion Butler stays with him. Tyrese Stewart attempts a Layup. Contested by Zion Butler (4.1 feet, MAN). TYRESE STEWART MAKES IT!
Score: 66-59

[08:23] Team_045 possession (Score: 66-59)
Cole Simons attempts a 3Pt. Contested by Shai Poole (4.0 feet, ZONE). Cole Simons misses. Rebound secured by Shai Poole.

[08:09] Team_097 possession (Score: 66-59)
Shai Poole attempts a 3Pt. Contested by Cole Simons (3.8 feet, MAN). Shai Poole misses. Offensive rebound by Anthony Haliburton! Anthony Haliburton puts it back in!
Score: 68-59

[07:55] Team_045 possession (Score: 68-59)
DeMar Turner attempts a Midrange. Contested by Anthony Haliburton (3.6 feet, MAN). DeMar Turner misses. Rebound secured by Tyrese Stewart.

[07:41] Team_097 possession (Score: 68-59)
Jrue Haliburton attempts a 3Pt. Contested by Cole Simons (3.7 feet, MAN). Jrue Haliburton misses. Rebound secured by Zion Butler.

[07:24] Team_045 possession (Score: 68-59)
Cole Simons attempts a Layup. Contested by Shai Poole (4.0 feet, MAN). Cole Simons misses. Rebound secured by Tyrese Stewart.

[07:09] Team_097 possession (Score: 68-59)
Jrue Haliburton drives to the basket... Jrue Haliburton loses the ball! Stripped by Zion Butler! TURNOVER! (live ball)

[06:56] Team_045 possession (Score: 68-59)
DeMar Turner drives to the basket... DeMar Turner throws a bad pass out of bounds! TURNOVER! (dead ball)

[06:46] Team_097 possession (Score: 68-59)
Tyrese Stewart drives and kicks out. Evan Brogdon attempts a 3Pt. Contested by Rudy Antetokounmpo (4.4 feet, MAN). EVAN BROGDON MAKES IT! Assist: Jrue Haliburton
Score: 71-59

[06:33] Team_045 possession (Score: 71-59)
Rudy Antetokounmpo attempts a Layup. Contested by Evan Brogdon (5.0 feet, MAN). RUDY ANTETOKOUNMPO MAKES IT! Assist: Zion Butler
Score: 71-61

[06:21] Team_097 possession (Score: 71-61)
FOUL! Holding foul on Zion Butler. [Team fouls: 2] No free throws, side out. (Zion Butler: 1 personal fouls)

[06:07] Team_097 possession (Score: 71-61)
Shai Poole attempts a 3Pt. Contested by Cole Simons (3.8 feet, MAN). Shai Poole misses. Rebound secured by Zion Butler.

[05:51] Team_045 possession (Score: 71-61)
Cole Simons drives, picks up Anthony Haliburton. Help arrives from Jrue Haliburton! Cole Simons attempts a Dunk. Contested by Jrue Haliburton (3.9 feet, ZONE). COLE SIMONS MAKES IT! Assist: Trae Russell
Score: 71-63

[05:36] Team_097 possession (Score: 71-63)
Shai Poole attempts a 3Pt. Contested by Cole Simons (3.9 feet, MAN). Shai Poole misses. Rebound secured by DeMar Turner.

[05:24] Team_045 possession (Score: 71-63)
Trae Russell attempts a Midrange. Contested by Shai Poole (3.9 feet, ZONE). TRAE RUSSELL MAKES IT!
Score: 71-65

[05:13] Team_097 possession (Score: 71-65)
FOUL! Shooting foul on Cole Simons. Jrue Haliburton to the line for 2 free throws. [Team fouls: 3] (Cole Simons: 1 personal fouls)   FT 1/2: GOOD   FT 2/2: GOOD Jrue Haliburton makes 2/2 from the line.
Score: 73-65

[04:56] Team_045 possession (Score: 73-65)
Rudy Antetokounmpo attempts a 3Pt. Contested by Evan Brogdon (5.1 feet, MAN). Rudy Antetokounmpo misses. Rebound secured by Anthony Haliburton.

[04:40] Team_097 possession (Score: 73-65)
Jrue Haliburton loses the ball! Stripped by Cole Simons! TURNOVER! (live ball)

[04:25] Team_045 possession (Score: 73-65)
FOUL! Shooting foul on Jrue Haliburton. Trae Russell to the line for 3 free throws. [Team fouls: 3] (Jrue Haliburton: 1 personal fouls)   FT 1/3: GOOD   FT 2/3: GOOD   FT 3/3: GOOD Trae Russell makes 3/3 from the line.
Score: 73-68

[04:12] Team_097 possession (Score: 73-68)
Jrue Haliburton attempts a Midrange. Contested by Cole Simons (3.9 feet, ZONE). Jrue Haliburton misses. Rebound secured by Zion Butler.

[03:57] Team_045 possession (Score: 73-68)
FOUL! Shooting foul on Anthony Haliburton. Zion Butler to the line for 2 free throws. [Team fouls: 4] (Anthony Haliburton: 1 personal fouls)   FT 1/2: GOOD   FT 2/2: GOOD Zion Butler makes 2/2 from the line.
Score: 73-70

[03:43] Team_097 possession (Score: 73-70)
FOUL! Reach-in foul on Zion Butler during the drive. [Team fouls: 4] No free throws, side out. (Zion Butler: 2 personal fouls)

[03:27] Team_097 possession (Score: 73-70)
Tyrese Stewart makes the Layup and draws the foul on Rudy Antetokounmpo! And-1! Tyrese Stewart to the line for 1. [BONUS: 5 team fouls] (Rudy Antetokounmpo: 2 personal fouls)   FT 1/1: GOOD Tyrese Stewart makes 1/1 from the line.
Score: 76-70

[03:17] Team_045 possession (Score: 76-70)
Zion Butler drives to the basket... FOUL! Offensive foul on Zion Butler! Anthony Haliburton drew the charge! [Team fouls: 6] (Zion Butler: 3 personal fouls) TURNOVER! (dead ball)

[03:01] Team_097 possession (Score: 76-70)
Tyrese Stewart attempts a Midrange. Contested by Zion Butler (4.5 feet, MAN). Tyrese Stewart misses. Offensive rebound by Tyrese Stewart! Tyrese Stewart kicks it out.

[02:43] Team_097 possession (Score: 76-70)
Shai Poole attempts a Midrange. Wide open! Trae Russell is 6.1 feet away. [ZONE] Shai Poole misses. Rebound secured by DeMar Turner.

[02:26] Team_045 possession (Score: 76-70)
Zion Butler attempts a Midrange. Contested by Anthony Haliburton (3.9 feet, MAN). Zion Butler misses. Rebound secured by Tyrese Stewart.

[02:11] Team_097 possession (Score: 76-70)
Anthony Haliburton drives and kicks out. Evan Brogdon attempts a 3Pt. Contested by Rudy Antetokounmpo (4.7 feet, ZONE). Evan Brogdon misses. Rebound secured by Zion Butler.

[01:59] Team_045 possession (Score: 76-70)
Cole Simons attempts a 3Pt. Contested by Shai Poole (4.3 feet, MAN). COLE SIMONS MAKES IT! Assist: Trae Russell
Score: 76-73

[01:43] Team_097 possession (Score: 76-73)
Jrue Haliburton attempts a 3Pt. Contested by Cole Simons (4.1 feet, MAN). Jrue Haliburton misses. Rebound secured by Zion Butler.

[01:32] Team_045 possession (Score: 76-73)
Zion Butler attempts a Midrange. Contested by Anthony Haliburton (4.0 feet, ZONE). Zion Butler misses. Rebound secured by Anthony Haliburton.

[01:16] Team_097 possession (Score: 76-73)
Shai Poole drives and kicks out. Jrue Haliburton attempts a 3Pt. Contested by Cole Simons (3.8 feet, ZONE). Jrue Haliburton misses. Offensive rebound by Tyrese Stewart! Tyrese Stewart kicks it out.

[00:57] Team_097 possession (Score: 76-73)
Jrue Haliburton drives and kicks out. Anthony Haliburton attempts a 3Pt. Contested by DeMar Turner (5.3 feet, MAN). Anthony Haliburton misses. Rebound secured by Zion Butler.

[00:37] Team_045 possession (Score: 76-73)
DeMar Turner drives, Anthony Haliburton stays with him. DeMar Turner attempts a Dunk. Contested by Anthony Haliburton (4.1 feet, ZONE). DeMar Turner misses. Offensive rebound by DeMar Turner! DeMar Turner kicks it out.

[00:23] Team_045 possession (Score: 76-73)
Zion Butler attempts a Midrange. Contested by Anthony Haliburton (4.1 feet, MAN). Zion Butler misses. Rebound secured by Tyrese Stewart.

[00:09] Team_097 possession (Score: 76-73)
Jrue Haliburton throws a bad pass! Stolen by Cole Simons! TURNOVER! (live ball)

================================================================================
                              3RD QUARTER COMPLETE                              
================================================================================

3RD QUARTER SCORE: Team_097 22, Team_045 17

BOX SCORE:
================================================================================

Team_097
--------------------------------------------------------------------------------
Player                MIN  PTS  REB  AST  TO      FG   FG%      3P   3P%
--------------------------------------------------------------------------------
Evan Brogdon           27    6    0    1   0   2/2   100.0     0/0   0.0
Tyrese Stewart         27    5    8    0   0   2/3    66.7     0/0   0.0
Jrue Haliburton        27    4    0    1   0   2/7    28.6     0/0   0.0
Anthony Haliburton     27    4    4    0   0   2/3    66.7     0/0   0.0
Shai Poole             27    3    3    0   0   1/4    25.0     0/0   0.0

TEAM: FG: 9/19 (47.4%), 3PT: 3/7 (42.9%), REB: 15 (4 off, 11 def), AST: 2, TO: 3
TEAM FOULS: 4


Team_045
--------------------------------------------------------------------------------
Player                MIN  PTS  REB  AST  TO      FG   FG%      3P   3P%
--------------------------------------------------------------------------------
Trae Russell           27    8    0    2   0   3/5    60.0     0/0   0.0
Cole Simons            27    5    0    0   0   2/6    33.3     0/0   0.0
Zion Butler            24    2    7    1   0   1/4    25.0     0/0   0.0
Rudy Antetokounmpo     27    2    0    0   0   1/2    50.0     0/0   0.0
DeMar Turner           27    0    4    1   0   0/1     0.0     0/0   0.0

TEAM: FG: 7/18 (38.9%), 3PT: 3/7 (42.9%), REB: 11 (1 off, 10 def), AST: 4, TO: 3
TEAM FOULS: 6 [Team_097 in BONUS]

================================================================================

================================================================================
                       4TH QUARTER - Team_097 vs Team_045                       
================================================================================

[12:00] Team_097 possession (Score: 76-73)
FOUL! Shooting foul on Cole Simons. Jrue Haliburton to the line for 2 free throws. [Team fouls: 1] (Cole Simons: 1 personal fouls)   FT 1/2: GOOD   FT 2/2: GOOD Jrue Haliburton makes 2/2 from the line.
Score: 78-73

[11:49] Team_045 possession (Score: 78-73)
Trae Russell attempts a Midrange. Contested by Jrue Haliburton (5.9 feet, MAN). Trae Russell misses. FOUL! Loose ball foul on Shai Poole during the rebound battle. [Team fouls: 1] No free throws, side out. (Shai Poole: 1 personal fouls)

[11:33] Team_045 possession (Score: 78-73)
Cole Simons drives, picks up Anthony Haliburton. Help arrives from Jrue Haliburton! Cole Simons attempts a Dunk. Contested by Jrue Haliburton (4.3 feet, ZONE). COLE SIMONS MAKES IT! Assist: Trae Russell
Score: 78-75

[11:16] Team_097 possession (Score: 78-75)
Tyrese Stewart drives to the basket... Tyrese Stewart loses the ball! Stripped by Zion Butler! TURNOVER! (live ball)

[11:01] Team_045 possession (Score: 78-75)
Rudy Antetokounmpo drives, picks up Evan Brogdon. Help arrives from Shai Poole! Rudy Antetokounmpo attempts a Dunk. Contested by Shai Poole (5.4 feet, MAN). Rudy Antetokounmpo misses. Rebound secured by Shai Poole.

[10:47] Team_097 possession (Score: 78-75)
Anthony Haliburton drives and kicks out. Anthony Haliburton attempts a Midrange. Contested by DeMar Turner (5.3 feet, ZONE). ANTHONY HALIBURTON MAKES IT! Assist: Shai Poole
Score: 80-75

[10:32] Team_045 possession (Score: 80-75)
DeMar Turner drives and kicks out. Rudy Antetokounmpo attempts a 3Pt. Contested by Evan Brogdon (5.1 feet, MAN). Rudy Antetokounmpo misses. Rebound secured by Anthony Haliburton.

[10:20] Team_097 possession (Score: 80-75)
Jrue Haliburton attempts a 3Pt. Contested by Cole Simons (4.3 feet, MAN). Jrue Haliburton misses. Rebound secured by Cole Simons.

[10:05] Team_045 possession (Score: 80-75)
Trae Russell attempts a Midrange. Wide open! Jrue Haliburton is 6.0 feet away. [MAN] Trae Russell misses. Rebound secured by Shai Poole.

[09:52] Team_097 possession (Score: 80-75)
Evan Brogdon attempts a 3Pt. Contested by DeMar Turner (6.0 feet, ZONE). Evan Brogdon misses. Offensive rebound by Anthony Haliburton! Anthony Haliburton kicks it out.

[09:39] Team_097 possession (Score: 80-75)
Shai Poole attempts a Midrange. Contested by Cole Simons (4.5 feet, MAN). SHAI POOLE MAKES IT!
Score: 82-75

[09:25] Team_045 possession (Score: 82-75)
Cole Simons attempts a 3Pt. Contested by Shai Poole (4.6 feet, MAN). COLE SIMONS MAKES IT! Assist: Zion Butler
Score: 82-78

[09:13] Team_097 possession (Score: 82-78)
Tyrese Stewart attempts a Midrange. Contested by Zion Butler (5.0 feet, MAN). Tyrese Stewart misses. Rebound secured by Zion Butler.

[08:58] Team_045 possession (Score: 82-78)
Rudy Antetokounmpo drives and kicks out. Rudy Antetokounmpo attempts a 3Pt. Contested by Evan Brogdon (5.4 feet, MAN). Rudy Antetokounmpo misses. Rebound secured by Anthony Haliburton.

[08:39] Team_097 possession (Score: 82-78)
Shai Poole attempts a 3Pt. Contested by Cole Simons (4.6 feet, MAN). Shai Poole misses. Rebound secured by DeMar Turner.

[08:28] Team_045 possession (Score: 82-78)
Rudy Antetokounmpo attempts a 3Pt. Contested by Shai Poole (4.5 feet, ZONE). Rudy Antetokounmpo misses. Rebound secured by Tyrese Stewart.

[08:17] Team_097 possession (Score: 82-78)
Jrue Haliburton attempts a 3Pt. Wide open! Trae Russell is 6.4 feet away. [MAN] JRUE HALIBURTON MAKES IT! Assist: Anthony Haliburton
Score: 85-78

[08:04] Team_045 possession (Score: 85-78)
Cole Simons drives to the basket... FOUL! Offensive foul on Cole Simons! Shai Poole drew the charge! [Team fouls: 2] (Cole Simons: 2 personal fouls) TURNOVER! (dead ball)

[07:47] Team_097 possession (Score: 85-78)
Jrue Haliburton attempts a Midrange. Wide open! Trae Russell is 6.5 feet away. [MAN] JRUE HALIBURTON MAKES IT! Assist: Evan Brogdon
Score: 87-78

[07:33] Team_045 possession (Score: 87-78)
Trae Russell attempts a Midrange. Wide open! Jrue Haliburton is 6.3 feet away. [MAN] TRAE RUSSELL MAKES IT!
Score: 87-80

[07:17] Team_097 possession (Score: 87-80)
Evan Brogdon drives to the basket... Evan Brogdon loses the ball! Stripped by Zion Butler! TURNOVER! (live ball)

[07:04] Team_045 possession (Score: 87-80)
DeMar Turner attempts a Midrange. Contested by Anthony Haliburton (4.6 feet, MAN). DeMar Turner misses. Rebound secured by Anthony Haliburton.

[06:48] Team_097 possession (Score: 87-80)
Evan Brogdon attempts a Midrange. Contested by Rudy Antetokounmpo (5.8 feet, MAN). Evan Brogdon misses. Offensive rebound by Anthony Haliburton! Anthony Haliburton kicks it out.

[06:32] Team_097 possession (Score: 87-80)
Shai Poole attempts a Midrange. Contested by Cole Simons (5.0 feet, MAN). SHAI POOLE MAKES IT!
Score: 89-80

[06:20] Team_045 possession (Score: 89-80)
DeMar Turner attempts a 3Pt. Wide open! Jrue Haliburton is 6.2 feet away. [ZONE] DeMar Turner misses. Rebound secured by Anthony Haliburton.

[06:05] Team_097 possession (Score: 89-80)
Shai Poole attempts a 3Pt. Contested by Cole Simons (5.0 feet, ZONE). Shai Poole misses. Rebound secured by DeMar Turner.

[05:49] Team_045 possession (Score: 89-80)
Trae Russell throws a bad pass out of bounds! TURNOVER! (dead ball)

[05:49] Substitution (Team_097): Evan Brogdon OUT → Gary Carter IN (stamina_rule2)

[05:49] Substitution (Team_097): Jrue Haliburton OUT → Dwyane Ginobili IN (stamina_rule2)

[05:49] Substitution (Team_097): Shai Poole OUT → Miles Dosunmu IN (stamina_rule2)

[05:49] Substitution (Team_097): Anthony Haliburton OUT → Joel Simons IN (stamina_rule2)

[05:49] Substitution (Team_097): Tyrese Stewart OUT → Miles Banchero IN (stamina_rule2)

[05:49] Substitution (Team_045): Rudy Antetokounmpo OUT → John Wagner IN (stamina_rule2)

[05:49] Substitution (Team_045): Trae Russell OUT → Julius James IN (stamina_rule2)

[05:49] Substitution (Team_045): Cole Simons OUT → Gary Towns IN (stamina_rule2)

[05:49] Substitution (Team_045): DeMar Turner OUT → Tim Sexton IN (stamina_rule2)

[05:49] Substitution (Team_045): Zion Butler OUT → Stephen Paul IN (stamina_rule2)

[05:34] Team_097 possession (Score: 89-80)
Gary Carter attempts a Midrange. Contested by John Wagner (3.9 feet, MAN). Gary Carter misses. Rebound secured by Stephen Paul.

[05:21] Team_045 possession (Score: 89-80)
FOUL! Holding foul on Gary Carter. [Team fouls: 2] No free throws, side out. (Gary Carter: 1 personal fouls)

[05:07] Team_045 possession (Score: 89-80)
Stephen Paul attempts a Layup. Contested by Joel Simons (3.5 feet, MAN). Stephen Paul misses. Offensive rebound by Tim Sexton! Tim Sexton kicks it out.

[04:55] Team_045 possession (Score: 89-80)
Julius James drives to the basket... Julius James loses control! Ball rolls out of bounds! TURNOVER! (dead ball)

[04:40] Team_097 possession (Score: 89-80)
FOUL! Holding foul on Tim Sexton. [Team fouls: 3] No free throws, side out. (Tim Sexton: 1 personal fouls)

[04:28] Team_097 possession (Score: 89-80)
FOUL! Holding foul on Julius James. [Team fouls: 4] No free throws, side out. (Julius James: 1 personal fouls)

[04:15] Team_097 possession (Score: 89-80)
Joel Simons attempts a 3Pt. Contested by Gary Towns (5.2 feet, ZONE). Joel Simons misses. Rebound secured by Tim Sexton.

[04:05] Team_045 possession (Score: 89-80)
FOUL! Shooting foul on Joel Simons. Stephen Paul to the line for 2 free throws. [Team fouls: 3] (Joel Simons: 1 personal fouls)   FT 1/2: GOOD   FT 2/2: MISS Stephen Paul makes 1/2 from the line. Rebound secured by Miles Banchero.
Score: 89-81

[03:51] Team_097 possession (Score: 89-81)
Joel Simons drives, picks up Tim Sexton. Help arrives from Julius James! Joel Simons attempts a Layup. Contested by Julius James (4.8 feet, MAN). JOEL SIMONS MAKES IT!
Score: 91-81

[03:35] Team_045 possession (Score: 91-81)
Gary Towns attempts a 3Pt. Contested by Dwyane Ginobili (4.4 feet, ZONE). Gary Towns misses. Rebound secured by Joel Simons.

[03:20] Team_097 possession (Score: 91-81)
Joel Simons attempts a Layup. Contested by Stephen Paul (4.7 feet, ZONE). JOEL SIMONS MAKES IT! Assist: Miles Dosunmu
Score: 93-81

[03:07] Team_045 possession (Score: 93-81)
FOUL! Holding foul on Dwyane Ginobili. [Team fouls: 4] No free throws, side out. (Dwyane Ginobili: 1 personal fouls)

[02:49] Team_045 possession (Score: 93-81)
FOUL! Reach-in foul on Joel Simons during the drive. [IN THE BONUS! 5 team fouls] Stephen Paul to the line for 2 free throws. (Joel Simons: 2 personal fouls)   FT 1/2: GOOD   FT 2/2: GOOD Stephen Paul makes 2/2 from the line.
Score: 93-83

[02:32] Team_097 possession (Score: 93-83)
Gary Carter attempts a 3Pt. Contested by John Wagner (3.9 feet, MAN). Gary Carter misses. Rebound secured by Julius James.

[02:17] Team_045 possession (Score: 93-83)
Julius James attempts a 3Pt. Contested by Joel Simons (3.7 feet, ZONE). Julius James misses. Offensive rebound by Julius James! Julius James kicks it out.

[02:05] Team_045 possession (Score: 93-83)
Tim Sexton attempts a 3Pt. Contested by Joel Simons (4.0 feet, ZONE). Tim Sexton misses. Rebound secured by Miles Banchero.

[01:50] Team_097 possession (Score: 93-83)
Miles Dosunmu attempts a 3Pt. Contested by John Wagner (4.6 feet, ZONE). MILES DOSUNMU MAKES IT! Assist: Dwyane Ginobili
Score: 96-83

[01:35] Team_045 possession (Score: 96-83)
John Wagner attempts a 3Pt. Contested by Gary Carter (4.9 feet, MAN). John Wagner misses. Rebound secured by Miles Dosunmu.

[01:24] Team_097 possession (Score: 96-83)
Miles Dosunmu attempts a 3Pt. Contested by Gary Towns (5.5 feet, MAN). Miles Dosunmu misses. Rebound secured by Julius James.

[01:13] Team_045 possession (Score: 96-83)
Stephen Paul drives, picks up Joel Simons. Help arrives from Dwyane Ginobili! Stephen Paul attempts a Dunk. Contested by Dwyane Ginobili (3.5 feet, MAN). Stephen Paul misses. FOUL! Loose ball foul on Miles Banchero during the rebound battle. [IN THE BONUS! 6 team fouls] Julius James to the line for 2 free throws. (Miles Banchero: 1 personal fouls)   FT 1/2: GOOD   FT 2/2: GOOD Julius James makes 2/2 from the line.
Score: 96-85

[00:56] Team_097 possession (Score: 96-85)
Dwyane Ginobili attempts a 3Pt. Contested by John Wagner (4.0 feet, ZONE). Dwyane Ginobili misses. Offensive rebound by Miles Dosunmu! Miles Dosunmu kicks it out.

[00:41] Team_097 possession (Score: 96-85)
Joel Simons attempts a 3Pt. Contested by Tim Sexton (4.8 feet, MAN). Joel Simons misses. Offensive rebound by Joel Simons! Joel Simons kicks it out.

[00:26] Team_097 possession (Score: 96-85)
Gary Carter attempts a 3Pt. Contested by Tim Sexton (4.4 feet, ZONE). GARY CARTER MAKES IT! Assist: Miles Dosunmu
Score: 99-85

[00:08] Team_045 possession (Score: 99-85)
Tim Sexton attempts a Midrange. Contested by Joel Simons (4.0 feet, MAN). Tim Sexton misses. Rebound secured by Joel Simons.

================================================================================
                              4TH QUARTER COMPLETE                              
================================================================================

4TH QUARTER SCORE: Team_097 23, Team_045 12

BOX SCORE:
================================================================================

Team_097
--------------------------------------------------------------------------------
Player                MIN  PTS  REB  AST  TO      FG   FG%      3P   3P%
--------------------------------------------------------------------------------
Jrue Haliburton        33    7    0    0   0   3/4    75.0     0/0   0.0
Shai Poole             33    4    2    1   0   2/4    50.0     0/0   0.0
Joel Simons            15    4    3    0   0   2/3    66.7     0/0   0.0
Gary Carter            15    3    0    0   0   1/3    33.3     0/0   0.0
Miles Dosunmu          15    3    2    2   0   1/2    50.0     0/0   0.0
Anthony Haliburton     33    2    6    1   0   1/1   100.0     0/0   0.0
Tyrese Stewart         33    0    1    0   0   0/1     0.0     0/0   0.0
Evan Brogdon           33    0    0    1   0   0/0     0.0     0/0   0.0
Miles Banchero         15    0    2    0   0   0/0     0.0     0/0   0.0
Dwyane Ginobili        15    0    0    1   0   0/0     0.0     0/0   0.0

TEAM: FG: 10/18 (55.6%), 3PT: 3/9 (33.3%), REB: 16 (4 off, 12 def), AST: 6, TO: 2
TEAM FOULS: 6 [Team_045 in BONUS]


Team_045
--------------------------------------------------------------------------------
Player                MIN  PTS  REB  AST  TO      FG   FG%      3P   3P%
--------------------------------------------------------------------------------
Cole Simons            33    5    1    0   0   2/2   100.0     0/0   0.0
Trae Russell           33    2    0    1   0   1/2    50.0     0/0   0.0
Stephen Paul           18    2    1    0   0   1/2    50.0     0/0   0.0
Julius James           15    2    3    0   0   1/1   100.0     0/0   0.0
Zion Butler            30    0    2    1   0   0/0     0.0     0/0   0.0
Rudy Antetokounmpo     33    0    0    0   0   0/3     0.0     0/0   0.0
DeMar Turner           33    0    2    0   0   0/3     0.0     0/0   0.0
Tim Sexton             15    0    2    0   0   0/2     0.0     0/0   0.0
Gary Towns             15    0    0    0   0   0/1     0.0     0/0   0.0
John Wagner            15    0    0    0   0   0/1     0.0     0/0   0.0

TEAM: FG: 5/17 (29.4%), 3PT: 1/6 (16.7%), REB: 11 (3 off, 8 def), AST: 2, TO: 3
TEAM FOULS: 4

================================================================================

================================================================================
                               FULL GAME COMPLETE                               
================================================================================

FINAL SCORE: Team_097 99, Team_045 85

SCORING BY QUARTER:
--------------------------------------------------------------------------------
Team                     Q1     Q2     Q3     Q4    FINAL
--------------------------------------------------------------------------------
Team_097                 22     32     22     23       99
Team_045                 25     31     17     12       85
--------------------------------------------------------------------------------

FULL GAME BOX SCORE:
================================================================================

Team_097
--------------------------------------------------------------------------------
Player                MIN  PTS  REB  AST  TO      FG   FG%      3P   3P%      FT STL BLK
--------------------------------------------------------------------------------
Evan Brogdon           33   15    0    4   1   4/6    66.7   3/4    75.0   4/4     0   0
Jrue Haliburton        33   13    0    2   4   7/16   43.8   1/6    16.7   4/4     0   0
Shai Poole             33   10    5    1   1   6/13   46.2   2/7    28.6   1/2     0   0
Anthony Haliburton     33   17   19    1   2   5/7    71.4   1/1   100.0   0/0     1   1
Tyrese Stewart         33    7   14    0   0   5/10   50.0   0/0     0.0   2/3     0   0
Gary Carter            15   15    0    0   1   5/8    62.5   3/4    75.0   4/4     0   0
Dwyane Ginobili        15    4    0    1   0   2/5    40.0   0/1     0.0   0/0     0   0
Miles Dosunmu          15    5    6    4   0   2/5    40.0   1/3    33.3   0/0     0   0
Joel Simons            15    7    3    1   0   3/6    50.0   1/3    33.3   0/0     1   0
Miles Banchero         15    5    6    1   0   2/2   100.0   0/0     0.0   1/1     0   0

TEAM: FG: 42/79 (53.2%), 3PT: 12/29 (41.4%), REB: 52 (14 off, 38 def), AST: 15, TO: 9


Team_045
--------------------------------------------------------------------------------
Player                MIN  PTS  REB  AST  TO      FG   FG%      3P   3P%      FT STL BLK
--------------------------------------------------------------------------------
Rudy Antetokounmpo     33    8    0    0   0   4/8    50.0   1/3    33.3   2/3     0   0
Trae Russell           33   15    0    7   4   6/9    66.7   2/2   100.0   4/4     0   0
Cole Simons            33   14    6    1   1   8/15   53.3   3/9    33.3   2/2     2   1
DeMar Turner           33    9    8    2   2   3/9    33.3   0/1     0.0   1/1     0   0
Zion Butler            30   10   15    4   0   4/10   40.0   0/1     0.0   2/2     3   0
Stephen Paul           18   10    7    1   0   5/9    55.6   0/0     0.0   7/9     1   0
John Wagner            15    4    0    0   0   2/3    66.7   0/1     0.0   2/2     0   0
Julius James           15    2    5    0   0   0/3     0.0   0/1     0.0   2/2     0   0
Gary Towns             15    6    0    1   2   2/5    40.0   2/5    40.0   0/0     0   0
Tim Sexton             15    4    4    4   1   2/4    50.0   0/1     0.0   0/0     0   0

TEAM: FG: 37/76 (48.7%), 3PT: 8/24 (33.3%), REB: 46 (9 off, 37 def), AST: 20, TO: 10

================================================================================
