================================================================================
                        FULL GAME - Team_037 vs Team_056                        
================================================================================

================================================================================
                       1ST QUARTER - Team_037 vs Team_056                       
================================================================================

[12:00] Team_037 possession (Score: 0-0)
Giannis Middleton attempts a 3Pt. Contested by Giannis Jokic (4.7 feet, ZONE). GIANNIS MIDDLETON MAKES IT! Assist: Jarrett Tatum
Score: 3-0

[11:50] Team_056 possession (Score: 3-0)
Giannis Jokic attempts a 3Pt. Contested by RJ Mitchell (5.0 feet, MAN). Giannis Jokic misses. FOUL! Loose ball foul on Collin Young during the rebound battle. [Team fouls: 1] No free throws, side out. (Collin Young: 1 personal fouls)

[11:35] Team_056 possession (Score: 3-0)
Yao Poole drives to the basket... FOUL! Offensive foul on Yao Poole! Collin Young drew the charge! [Team fouls: 1] (Yao Poole: 1 personal fouls) TURNOVER! (dead ball)

[11:19] Team_037 possession (Score: 3-0)
Collin Young drives, Yao Poole stays with him. Collin Young attempts a Layup. Contested by Yao Poole (4.1 feet, MAN). COLLIN YOUNG MAKES IT!
Score: 5-0

[11:07] Team_056 possession (Score: 5-0)
Yao Poole drives and kicks out. Giannis Jokic attempts a Midrange. Contested by Scottie Jackson (3.6 feet, ZONE). Giannis Jokic misses. Offensive rebound by Jrue Lillard! Jrue Lillard puts it back in!
Score: 5-2

[10:55] Team_037 possession (Score: 5-2)
Collin Young attempts a Layup. Contested by Yao Poole (4.1 feet, MAN). COLLIN YOUNG MAKES IT! Assist: RJ Mitchell
Score: 7-2

[10:37] Team_056 possession (Score: 7-2)
Magic Russell attempts a 3Pt. Contested by Scottie Jackson (4.0 feet, ZONE). MAGIC RUSSELL MAKES IT! Assist: Yao Poole
Score: 7-5

[10:19] Team_037 possession (Score: 7-5)
Collin Young attempts a Midrange. Contested by Yao Poole (4.1 feet, MAN). Collin Young misses. Offensive rebound by Scottie Jackson! Scottie Jackson's putback is no good. Rebound secured by Tony Carter.

[10:05] Team_056 possession (Score: 7-5)
Giannis Jokic throws a bad pass out of bounds! TURNOVER! (dead ball)

[09:48] Team_037 possession (Score: 7-5)
Giannis Middleton drives, Jrue Lillard stays with him. Giannis Middleton attempts a Dunk. Contested by Jrue Lillard (4.2 feet, ZONE). GIANNIS MIDDLETON MAKES IT! Assist: Jarrett Tatum
Score: 9-5

[09:29] Team_056 possession (Score: 9-5)
Jrue Lillard drives and kicks out. Magic Russell attempts a 3Pt. Contested by Scottie Jackson (3.6 feet, ZONE). Magic Russell misses. Rebound secured by Collin Young.

[09:15] Team_037 possession (Score: 9-5)
Scottie Jackson attempts a Midrange. Wide open! Magic Russell is 6.1 feet away. [ZONE] SCOTTIE JACKSON MAKES IT!
Score: 11-5

[09:01] Team_056 possession (Score: 11-5)
Jrue Lillard attempts a 3Pt. Contested by Scottie Jackson (4.2 feet, ZONE). Jrue Lillard misses. Offensive rebound by Yao Poole! Yao Poole kicks it out.

[08:51] Team_056 possession (Score: 11-5)
Tony Carter attempts a 3Pt. Contested by Jarrett Tatum (4.6 feet, MAN). Tony Carter misses. Rebound secured by Collin Young.

[08:36] Team_037 possession (Score: 11-5)
Collin Young drives and kicks out. Scottie Jackson attempts a 3Pt. Contested by Magic Russell (5.5 feet, ZONE). Scottie Jackson misses. Rebound secured by Tony Carter.

[08:25] Team_056 possession (Score: 11-5)
Giannis Jokic attempts a Midrange. Contested by Giannis Middleton (4.4 feet, ZONE). GIANNIS JOKIC MAKES IT! Assist: Magic Russell
Score: 11-7

[08:09] Team_037 possession (Score: 11-7)
RJ Mitchell drives, Jrue Lillard stays with him. RJ Mitchell attempts a Layup. Contested by Jrue Lillard (4.0 feet, ZONE). RJ MITCHELL MAKES IT!
Score: 13-7

[07:54] Team_056 possession (Score: 13-7)
Magic Russell attempts a Midrange. Contested by Giannis Middleton (4.4 feet, ZONE). Magic Russell misses. Rebound secured by Collin Young.

[07:37] Team_037 possession (Score: 13-7)
Giannis Middleton drives and kicks out. Giannis Middleton attempts a 3Pt. Contested by Giannis Jokic (4.3 feet, ZONE). Giannis Middleton misses. Offensive rebound by Collin Young! Collin Young's putback is no good. Offensive rebound by Collin Young! Collin Young kicks it out.

[07:23] Team_037 possession (Score: 13-7)
Giannis Middleton attempts a 3Pt. Contested by Giannis Jokic (4.7 feet, ZONE). GIANNIS MIDDLETON MAKES IT! Assist: RJ Mitchell
Score: 16-7

[07:04] Team_056 possession (Score: 16-7)
Giannis Jokic drives to the basket... Giannis Jokic throws a bad pass! Stolen by RJ Mitchell! TURNOVER! (live ball)

[06:46] Team_037 possession (Score: 16-7)
Collin Young attempts a Midrange. Contested by Tony Carter (4.2 feet, ZONE). COLLIN YOUNG MAKES IT! Assist: Jarrett Tatum
Score: 18-7

[06:34] Team_056 possession (Score: 18-7)
Tony Carter attempts a 3Pt. Contested by Jarrett Tatum (4.6 feet, MAN). Tony Carter misses. Rebound secured by Collin Young.

[06:19] Team_037 possession (Score: 18-7)
Scottie Jackson attempts a 3Pt. Contested by Giannis Jokic (4.9 feet, ZONE). SCOTTIE JACKSON MAKES IT! Assist: Collin Young
Score: 21-7

[06:07] Team_056 possession (Score: 21-7)
FOUL! Shooting foul on Jarrett Tatum. Tony Carter to the line for 3 free throws. [Team fouls: 2] (Jarrett Tatum: 1 personal fouls)   FT 1/3: GOOD   FT 2/3: GOOD   FT 3/3: GOOD Tony Carter makes 3/3 from the line.
Score: 21-10

[05:55] Team_037 possession (Score: 21-10)
RJ Mitchell attempts a 3Pt. Contested by Giannis Jokic (4.5 feet, MAN). RJ Mitchell misses. Rebound secured by Jrue Lillard.

[05:42] Team_056 possession (Score: 21-10)
Tony Carter makes the Midrange and draws the foul on Jarrett Tatum! And-1! Tony Carter to the line for 1. [Team fouls: 3] (Jarrett Tatum: 2 personal fouls)   FT 1/1: GOOD Tony Carter makes 1/1 from the line.
Score: 21-13

[05:27] Team_037 possession (Score: 21-13)
RJ Mitchell drives to the basket... RJ Mitchell loses the ball! Stripped by Yao Poole! TURNOVER! (live ball)

[05:09] Team_056 possession (Score: 21-13)
Jrue Lillard attempts a 3Pt. Contested by Scottie Jackson (4.2 feet, ZONE). Jrue Lillard misses. Rebound secured by Jarrett Tatum.

[04:52] Team_037 possession (Score: 21-13)
Scottie Jackson makes the Dunk and draws the foul on Jrue Lillard! And-1! Scottie Jackson to the line for 1. [Team fouls: 2] (Jrue Lillard: 1 personal fouls)   FT 1/1: GOOD Scottie Jackson makes 1/1 from the line.
Score: 24-13

[04:34] Team_056 possession (Score: 24-13)
Jrue Lillard drives, Scottie Jackson stays with him. Jrue Lillard attempts a Layup. Contested by Scottie Jackson (4.2 feet, ZONE). Jrue Lillard misses. Rebound secured by Collin Young.

[04:20] Team_037 possession (Score: 24-13)
Scottie Jackson attempts a 3Pt. Contested by Giannis Jokic (4.9 feet, ZONE). Scottie Jackson misses. Rebound secured by Yao Poole.

[04:05] Team_056 possession (Score: 24-13)
Giannis Jokic drives and kicks out. Magic Russell attempts a 3Pt. Contested by Scottie Jackson (3.6 feet, ZONE). Magic Russell misses. Rebound secured by Jarrett Tatum.

[03:50] Team_037 possession (Score: 24-13)
RJ Mitchell attempts a 3Pt. Contested by Giannis Jokic (4.6 feet, ZONE). RJ Mitchell misses. Rebound secured by Yao Poole.

[03:34] Team_056 possession (Score: 24-13)
Jrue Lillard attempts a Layup. BLOCKED BY SCOTTIE JACKSON! Ball goes out off Scottie Jackson. Jrue Lillard's ball!

[03:21] Team_056 possession (Score: 24-13)
Jrue Lillard attempts a 3Pt. Contested by Scottie Jackson (4.3 feet, MAN). JRUE LILLARD MAKES IT!
Score: 24-16

[03:03] Team_037 possession (Score: 24-16)
RJ Mitchell drives, Jrue Lillard stays with him. RJ Mitchell attempts a Dunk. Contested by Jrue Lillard (4.2 feet, ZONE). RJ MITCHELL MAKES IT! Assist: Collin Young
Score: 26-16

[02:50] Team_056 possession (Score: 26-16)
Magic Russell throws a bad pass! Stolen by Giannis Middleton! TURNOVER! (live ball)

[02:37] Team_037 possession (Score: 26-16)
Jarrett Tatum attempts a 3Pt. Contested by Giannis Jokic (4.7 feet, ZONE). Jarrett Tatum misses. Rebound secured by Tony Carter.

[02:23] Team_056 possession (Score: 26-16)
Magic Russell drives and kicks out. Tony Carter attempts a Midrange. Contested by Collin Young (4.3 feet, ZONE). Tony Carter misses. Offensive rebound by Yao Poole! Yao Poole kicks it out.

[02:12] Team_056 possession (Score: 26-16)
FOUL! Shooting foul on Giannis Middleton. Giannis Jokic to the line for 2 free throws. [Team fouls: 4] (Giannis Middleton: 1 personal fouls)   FT 1/2: GOOD   FT 2/2: GOOD Giannis Jokic makes 2/2 from the line.
Score: 26-18

[02:01] Team_037 possession (Score: 26-18)
Collin Young drives to the basket... Collin Young loses control! Ball rolls out of bounds! TURNOVER! (dead ball)

[02:01] Substitution (Team_037): RJ Mitchell OUT → Jarrett Randle IN (stamina_rule2)

[02:01] Substitution (Team_037): Jarrett Tatum OUT → Julius Bird IN (stamina_rule2)

[02:01] Substitution (Team_037): Collin Young OUT → Wendell Herro IN (stamina_rule2)

[02:01] Substitution (Team_056): Giannis Jokic OUT → De'Aaron Murray IN (stamina_rule2)

[02:01] Substitution (Team_056): Magic Russell OUT → Damian Barrett IN (stamina_rule2)

[02:01] Substitution (Team_056): Tony Carter OUT → CJ Anthony IN (stamina_rule2)

[02:01] Substitution (Team_056): Jrue Lillard OUT → RJ Johnson IN (stamina_rule2)

[02:01] Substitution (Team_056): Yao Poole OUT → Derrick Bane IN (stamina_rule2)

[01:47] Team_056 possession (Score: 26-18)
Damian Barrett attempts a 3Pt. Contested by Scottie Jackson (4.1 feet, ZONE). Damian Barrett misses. Offensive rebound by RJ Johnson! RJ Johnson kicks it out.

[01:28] Team_056 possession (Score: 26-18)
RJ Johnson attempts a 3Pt. Contested by Jarrett Randle (3.9 feet, ZONE). RJ Johnson misses. Rebound secured by Scottie Jackson.

[01:17] Team_037 possession (Score: 26-18)
Giannis Middleton attempts a Midrange. Contested by RJ Johnson (4.7 feet, ZONE). Giannis Middleton misses. Rebound secured by CJ Anthony.

[01:05] Team_056 possession (Score: 26-18)
Derrick Bane makes the Dunk and draws the foul on Scottie Jackson! And-1! Derrick Bane to the line for 1. [BONUS: 5 team fouls] (Scottie Jackson: 1 personal fouls)   FT 1/1: GOOD Derrick Bane makes 1/1 from the line.
Score: 26-21

[00:52] Team_037 possession (Score: 26-21)
Julius Bird attempts a 3Pt. Contested by CJ Anthony (4.6 feet, MAN). Julius Bird misses. Rebound secured by CJ Anthony.

[00:40] Team_056 possession (Score: 26-21)
RJ Johnson attempts a 3Pt. Contested by Scottie Jackson (4.1 feet, MAN). RJ Johnson misses. Rebound secured by Scottie Jackson.

[00:21] Team_037 possession (Score: 26-21)
Wendell Herro drives to the basket... Wendell Herro loses the ball! Stripped by Derrick Bane! TURNOVER! (live ball)

[00:02] Team_056 possession (Score: 26-21)
Damian Barrett throws a bad pass! Stolen by Giannis Middleton! TURNOVER! (live ball)

================================================================================
                              1ST QUARTER COMPLETE                              
================================================================================

1ST QUARTER SCORE: Team_037 26, Team_056 21

BOX SCORE:
================================================================================

Team_037
--------------------------------------------------------------------------------
Player                MIN  PTS  REB  AST  TO      FG   FG%      3P   3P%
--------------------------------------------------------------------------------
Giannis Middleton      12    8    0    0   0   3/4    75.0     0/0   0.0
Scottie Jackson        12    8    2    0   0   3/4    75.0     0/0   0.0
Collin Young           10    6    6    2   0   3/5    60.0     0/0   0.0
RJ Mitchell            10    4    0    2   0   2/4    50.0     0/0   0.0
Jarrett Tatum          10    0    2    3   0   0/1     0.0     0/0   0.0
Julius Bird             2    0    0    0   0   0/1     0.0     0/0   0.0

TEAM: FG: 11/19 (57.9%), 3PT: 3/8 (37.5%), REB: 11 (2 off, 9 def), AST: 7, TO: 3
TEAM FOULS: 5 [Team_056 in BONUS]


Team_056
--------------------------------------------------------------------------------
Player                MIN  PTS  REB  AST  TO      FG   FG%      3P   3P%
--------------------------------------------------------------------------------
Tony Carter            10    6    3    0   0   2/4    50.0     0/0   0.0
Jrue Lillard           10    5    2    0   0   2/5    40.0     0/0   0.0
Giannis Jokic          10    4    0    0   0   2/3    66.7     0/0   0.0
Magic Russell          10    3    0    1   0   1/2    50.0     0/0   0.0
Derrick Bane            2    3    0    0   0   1/1   100.0     0/0   0.0
Yao Poole              10    0    5    1   0   0/0     0.0     0/0   0.0
RJ Johnson              2    0    1    0   0   0/2     0.0     0/0   0.0
CJ Anthony              2    0    2    0   0   0/0     0.0     0/0   0.0

TEAM: FG: 8/17 (47.1%), 3PT: 3/8 (37.5%), REB: 12 (5 off, 7 def), AST: 2, TO: 5
TEAM FOULS: 2

================================================================================

================================================================================
                       2ND QUARTER - Team_037 vs Team_056                       
================================================================================

[12:00] Team_037 possession (Score: 26-21)
Collin Young drives and kicks out. Collin Young attempts a 3Pt. Contested by Yao Poole (4.1 feet, MAN). Collin Young misses. FOUL! Loose ball foul on Tony Carter during the rebound battle. [Team fouls: 1] No free throws, side out. (Tony Carter: 1 personal fouls)

[11:49] Team_037 possession (Score: 26-21)
Jarrett Tatum makes the Layup and draws the foul on Jrue Lillard! And-1! Jarrett Tatum to the line for 1. [Team fouls: 2] (Jrue Lillard: 1 personal fouls)   FT 1/1: GOOD Jarrett Tatum makes 1/1 from the line.
Score: 29-21

[11:40] Team_056 possession (Score: 29-21)
Magic Russell attempts a 3Pt. Contested by Jarrett Tatum (4.4 feet, ZONE). Magic Russell misses. Rebound secured by Collin Young.

[11:28] Team_037 possession (Score: 29-21)
Scottie Jackson attempts a Layup. BLOCKED BY JRUE LILLARD! Ball deflects out of bounds off Scottie Jackson.

[11:10] Team_056 possession (Score: 29-21)
Tony Carter makes the Dunk and draws the foul on Giannis Middleton! And-1! Tony Carter to the line for 1. [Team fouls: 1] (Giannis Middleton: 1 personal fouls)   FT 1/1: GOOD Tony Carter makes 1/1 from the line.
Score: 29-24

[10:55] Team_037 possession (Score: 29-24)
Scottie Jackson drives to the basket... Scottie Jackson throws a bad pass! Stolen by Jrue Lillard! TURNOVER! (live ball)

[10:45] Team_056 possession (Score: 29-24)
Giannis Jokic attempts a Midrange. Contested by RJ Mitchell (5.1 feet, MAN). Giannis Jokic misses. Rebound secured by Jarrett Tatum.

[10:30] Team_037 possession (Score: 29-24)
Giannis Middleton attempts a 3Pt. Wide open! Magic Russell is 6.0 feet away. [MAN] Giannis Middleton misses. Offensive rebound by Scottie Jackson! Scottie Jackson kicks it out.

[10:12] Team_037 possession (Score: 29-24)
Scottie Jackson drives and kicks out. Scottie Jackson attempts a 3Pt. Contested by Giannis Jokic (4.5 feet, ZONE). SCOTTIE JACKSON MAKES IT! Assist: Jarrett Tatum
Score: 32-24

[09:55] Team_056 possession (Score: 32-24)
Magic Russell attempts a 3Pt. Contested by Giannis Middleton (4.9 feet, MAN). Magic Russell misses. Rebound secured by Scottie Jackson.

[09:40] Team_037 possession (Score: 32-24)
RJ Mitchell attempts a 3Pt. Contested by Giannis Jokic (4.8 feet, MAN). RJ Mitchell misses. FOUL! Loose ball foul on Tony Carter during the rebound battle. [Team fouls: 3] No free throws, side out. (Tony Carter: 2 personal fouls)

[09:27] Team_037 possession (Score: 32-24)
Collin Young attempts a Midrange. Contested by Yao Poole (4.5 feet, MAN). Collin Young misses. Rebound secured by Yao Poole.

[09:11] Team_056 possession (Score: 32-24)
Giannis Jokic drives and kicks out. Giannis Jokic attempts a Midrange. Contested by Scottie Jackson (4.2 feet, ZONE). Giannis Jokic misses. Offensive rebound by Yao Poole! Yao Poole kicks it out.

[08:57] Team_056 possession (Score: 32-24)
Magic Russell attempts a 3Pt. Contested by Jarrett Tatum (4.6 feet, ZONE). Magic Russell misses. Offensive rebound by Jrue Lillard! Jrue Lillard's putback is no good. Rebound secured by Scottie Jackson.

[08:40] Team_037 possession (Score: 32-24)
Scottie Jackson makes the Layup and draws the foul on Jrue Lillard! And-1! Scottie Jackson to the line for 1. [Team fouls: 4] (Jrue Lillard: 2 personal fouls)   FT 1/1: GOOD Scottie Jackson makes 1/1 from the line.
Score: 35-24

[08:23] Team_056 possession (Score: 35-24)
Magic Russell drives, Giannis Middleton stays with him. Magic Russell attempts a Layup. Contested by Giannis Middleton (5.0 feet, MAN). Magic Russell misses. Offensive rebound by Jrue Lillard! Jrue Lillard puts it back in!
Score: 35-26

[08:10] Team_037 possession (Score: 35-26)
RJ Mitchell attempts a 3Pt. Contested by Giannis Jokic (4.9 feet, MAN). RJ Mitchell misses. Rebound secured by Tony Carter.

[07:59] Team_056 possession (Score: 35-26)
Magic Russell makes the Layup and draws the foul on Giannis Middleton! And-1! Magic Russell to the line for 1. [Team fouls: 2] (Giannis Middleton: 2 personal fouls)   FT 1/1: GOOD Magic Russell makes 1/1 from the line.
Score: 35-29

[07:43] Team_037 possession (Score: 35-29)
Giannis Middleton attempts a Midrange. Wide open! Magic Russell is 6.3 feet away. [MAN] Giannis Middleton misses. Rebound secured by Yao Poole.

[07:28] Team_056 possession (Score: 35-29)
FOUL! Reach-in foul on Scottie Jackson during the drive. [Team fouls: 3] No free throws, side out. (Scottie Jackson: 1 personal fouls)

[07:12] Team_056 possession (Score: 35-29)
Jrue Lillard attempts a Midrange. Contested by Scottie Jackson (5.0 feet, MAN). Jrue Lillard misses. Rebound secured by Jarrett Tatum.

[06:58] Team_037 possession (Score: 35-29)
Giannis Middleton attempts a 3Pt. Wide open! Magic Russell is 6.3 feet away. [MAN] Giannis Middleton misses. Rebound secured by Tony Carter.

[06:42] Team_056 possession (Score: 35-29)
Magic Russell attempts a 3Pt. Contested by Giannis Middleton (5.2 feet, MAN). Magic Russell misses. Rebound secured by Collin Young.

[06:32] Team_037 possession (Score: 35-29)
Collin Young drives, Yao Poole stays with him. Collin Young attempts a Layup. Contested by Yao Poole (4.9 feet, MAN). Collin Young misses. Rebound secured by Yao Poole.

[06:18] Team_056 possession (Score: 35-29)
FOUL! Reach-in foul on Scottie Jackson during the drive. [Team fouls: 4] No free throws, side out. (Scottie Jackson: 2 personal fouls)

[06:05] Team_056 possession (Score: 35-29)
Yao Poole attempts a Midrange. Contested by Collin Young (4.5 feet, MAN). Yao Poole misses. Rebound secured by Collin Young.

[05:52] Team_037 possession (Score: 35-29)
Collin Young attempts a 3Pt. Contested by Yao Poole (5.0 feet, MAN). Collin Young misses. Rebound secured by Tony Carter.

[05:37] Team_056 possession (Score: 35-29)
Yao Poole drives, Collin Young stays with him. Yao Poole attempts a Layup. Contested by Collin Young (4.6 feet, MAN). Yao Poole misses. Rebound secured by Collin Young.

[05:19] Team_037 possession (Score: 35-29)
Jarrett Tatum attempts a Midrange. Contested by Jrue Lillard (4.8 feet, ZONE). Jarrett Tatum misses. Rebound secured by Jrue Lillard.

[05:06] Team_056 possession (Score: 35-29)
Magic Russell attempts a Midrange. Contested by Scottie Jackson (5.1 feet, ZONE). MAGIC RUSSELL MAKES IT!
Score: 35-31

[04:55] Team_037 possession (Score: 35-31)
Jarrett Tatum drives and kicks out. Collin Young attempts a Midrange. Contested by Tony Carter (5.1 feet, ZONE). Collin Young misses. Rebound secured by Yao Poole.

[04:40] Team_056 possession (Score: 35-31)
Yao Poole attempts a Midrange. Contested by Collin Young (4.7 feet, MAN). Yao Poole misses. FOUL! Loose ball foul on Scottie Jackson during the rebound battle. [IN THE BONUS! 5 team fouls] Jrue Lillard to the line for 2 free throws. (Scottie Jackson: 3 personal fouls)   FT 1/2: GOOD   FT 2/2: MISS Jrue Lillard makes 1/2 from the line. Offensive rebound by Yao Poole! Yao Poole kicks it out.
Score: 35-32

[04:23] Team_056 possession (Score: 35-32)
Yao Poole attempts a 3Pt. Contested by Collin Young (4.8 feet, MAN). Yao Poole misses. Rebound secured by Collin Young.

[04:09] Team_037 possession (Score: 35-32)
Giannis Middleton drives to the basket... Giannis Middleton throws a bad pass out of bounds! TURNOVER! (dead ball)

[04:09] Substitution (Team_037): RJ Mitchell OUT → Jarrett Randle IN (stamina_rule2)

[04:09] Substitution (Team_037): Giannis Middleton OUT → Collin Trent IN (stamina_rule2)

[04:09] Substitution (Team_037): Jarrett Tatum OUT → Julius Bird IN (stamina_rule2)

[04:09] Substitution (Team_037): Scottie Jackson OUT → Russell Anthony IN (stamina_rule2)

[04:09] Substitution (Team_037): Collin Young OUT → Wendell Herro IN (stamina_rule2)

[04:09] Substitution (Team_056): Giannis Jokic OUT → De'Aaron Murray IN (stamina_rule2)

[04:09] Substitution (Team_056): Magic Russell OUT → Damian Barrett IN (stamina_rule2)

[04:09] Substitution (Team_056): Tony Carter OUT → CJ Anthony IN (stamina_rule2)

[04:09] Substitution (Team_056): Jrue Lillard OUT → RJ Johnson IN (stamina_rule2)

[04:09] Substitution (Team_056): Yao Poole OUT → Derrick Bane IN (stamina_rule2)

[03:52] Team_056 possession (Score: 35-32)
De'Aaron Murray attempts a 3Pt. Contested by Jarrett Randle (4.0 feet, MAN). De'Aaron Murray misses. Rebound secured by Russell Anthony.

[03:36] Team_037 possession (Score: 35-32)
Julius Bird attempts a 3Pt. Wide open! De'Aaron Murray is 6.3 feet away. [ZONE] Julius Bird misses. Rebound secured by RJ Johnson.

[03:23] Team_056 possession (Score: 35-32)
De'Aaron Murray attempts a Midrange. Contested by Wendell Herro (5.9 feet, ZONE). De'Aaron Murray misses. Rebound secured by Julius Bird.

[03:08] Team_037 possession (Score: 35-32)
Collin Trent attempts a 3Pt. Wide open! De'Aaron Murray is 6.2 feet away. [ZONE] Collin Trent misses. Rebound secured by CJ Anthony.

[02:57] Team_056 possession (Score: 35-32)
De'Aaron Murray attempts a 3Pt. Contested by Jarrett Randle (4.0 feet, ZONE). De'Aaron Murray misses. Rebound secured by Russell Anthony.

[02:44] Team_037 possession (Score: 35-32)
Russell Anthony makes the Midrange and draws the foul on CJ Anthony! And-1! Russell Anthony to the line for 1. [BONUS: 5 team fouls] (CJ Anthony: 1 personal fouls)   FT 1/1: GOOD Russell Anthony makes 1/1 from the line.
Score: 38-32

[02:30] Team_056 possession (Score: 38-32)
RJ Johnson attempts a Layup. BLOCKED BY RUSSELL ANTHONY! Ball is loose! Offensive rebound by CJ Anthony! CJ Anthony kicks it out.

[02:17] Team_056 possession (Score: 38-32)
CJ Anthony attempts a 3Pt. Contested by Jarrett Randle (3.8 feet, ZONE). CJ ANTHONY MAKES IT! Assist: De'Aaron Murray
Score: 38-35

[02:06] Team_037 possession (Score: 38-35)
Julius Bird attempts a Midrange. Contested by Damian Barrett (6.0 feet, ZONE). Julius Bird misses. Rebound secured by RJ Johnson.

[01:52] Team_056 possession (Score: 38-35)
Damian Barrett attempts a 3Pt. Contested by Collin Trent (5.8 feet, MAN). Damian Barrett misses. Offensive rebound by CJ Anthony! CJ Anthony kicks it out.

[01:40] Team_056 possession (Score: 38-35)
Derrick Bane drives to the basket... Derrick Bane loses the ball! Stripped by Russell Anthony! TURNOVER! (live ball)

[01:23] Team_037 possession (Score: 38-35)
Collin Trent drives, Damian Barrett stays with him. Collin Trent attempts a Layup. Contested by Damian Barrett (5.9 feet, MAN). COLLIN TRENT MAKES IT! Assist: Russell Anthony
Score: 40-35

[01:09] Team_056 possession (Score: 40-35)
De'Aaron Murray attempts a Midrange. Contested by Jarrett Randle (4.0 feet, MAN). De'Aaron Murray misses. Rebound secured by Julius Bird.

[00:57] Team_037 possession (Score: 40-35)
Jarrett Randle attempts a 3Pt. Contested by CJ Anthony (4.4 feet, ZONE). Jarrett Randle misses. Rebound secured by RJ Johnson.

[00:42] Team_056 possession (Score: 40-35)
CJ Anthony makes the Dunk and draws the foul on Russell Anthony! And-1! CJ Anthony to the line for 1. [BONUS: 6 team fouls] (Russell Anthony: 1 personal fouls)   FT 1/1: MISS CJ Anthony makes 0/1 from the line. Offensive rebound by CJ Anthony! CJ Anthony kicks it out.
Score: 40-37

[00:29] Team_056 possession (Score: 40-37)
Derrick Bane drives and kicks out. CJ Anthony attempts a 3Pt. Contested by Jarrett Randle (3.8 feet, ZONE). CJ Anthony misses. Rebound secured by Russell Anthony.

[00:11] Team_037 possession (Score: 40-37)
Wendell Herro attempts a Midrange. Contested by Derrick Bane (5.8 feet, MAN). WENDELL HERRO MAKES IT!
Score: 42-37

================================================================================
                              2ND QUARTER COMPLETE                              
================================================================================

2ND QUARTER SCORE: Team_037 16, Team_056 16

BOX SCORE:
================================================================================

Team_037
--------------------------------------------------------------------------------
Player                MIN  PTS  REB  AST  TO      FG   FG%      3P   3P%
--------------------------------------------------------------------------------
Scottie Jackson        20    6    4    0   0   2/3    66.7     0/0   0.0
Jarrett Tatum          18    3    2    1   0   1/3    33.3     0/0   0.0
Russell Anthony         4    3    3    1   0   1/1   100.0     0/0   0.0
Collin Trent            4    2    0    0   0   1/2    50.0     0/0   0.0
Wendell Herro           6    2    0    0   0   1/1   100.0     0/0   0.0
Collin Young           18    0    6    0   0   0/3     0.0     0/0   0.0
RJ Mitchell            18    0    0    0   0   0/1     0.0     0/0   0.0
Giannis Middleton      20    0    0    0   0   0/2     0.0     0/0   0.0
Julius Bird             6    0    2    0   0   0/2     0.0     0/0   0.0
Jarrett Randle          6    0    0    0   0   0/1     0.0     0/0   0.0

TEAM: FG: 6/19 (31.6%), 3PT: 0/6 (0.0%), REB: 16 (3 off, 13 def), AST: 2, TO: 2
TEAM FOULS: 6 [Team_056 in BONUS]


Team_056
--------------------------------------------------------------------------------
Player                MIN  PTS  REB  AST  TO      FG   FG%      3P   3P%
--------------------------------------------------------------------------------
Magic Russell          18    5    0    0   0   2/6    33.3     0/0   0.0
Tony Carter            18    3    3    0   0   1/1   100.0     0/0   0.0
CJ Anthony              6    3    4    0   0   1/1   100.0     0/0   0.0
Jrue Lillard           18    2    2    0   0   1/2    50.0     0/0   0.0
Giannis Jokic          18    0    0    0   0   0/1     0.0     0/0   0.0
Yao Poole              18    0    6    0   0   0/3     0.0     0/0   0.0
De'Aaron Murray         6    0    0    1   0   0/4     0.0     0/0   0.0
RJ Johnson              6    0    3    0   0   0/0     0.0     0/0   0.0
Derrick Bane            6    0    0    0   0   0/1     0.0     0/0   0.0

TEAM: FG: 5/19 (26.3%), 3PT: 1/8 (12.5%), REB: 19 (7 off, 12 def), AST: 1, TO: 1
TEAM FOULS: 5 [Team_037 in BONUS]

================================================================================

================================================================================
                       3RD QUARTER - Team_037 vs Team_056                       
================================================================================

[12:00] Team_037 possession (Score: 42-37)
Jarrett Tatum attempts a Midrange. Contested by Tony Carter (4.3 feet, MAN). JARRETT TATUM MAKES IT! Assist: Collin Young
Score: 44-37

[11:50] Team_056 possession (Score: 44-37)
Jrue Lillard attempts a 3Pt. Contested by Scottie Jackson (4.2 feet, ZONE). Jrue Lillard misses. Rebound secured by Jarrett Tatum.

[11:35] Team_037 possession (Score: 44-37)
Giannis Middleton attempts a 3Pt. Contested by Giannis Jokic (4.7 feet, ZONE). Giannis Middleton misses. Rebound secured by Yao Poole.

[11:23] Team_056 possession (Score: 44-37)
Yao Poole attempts a Midrange. Contested by Collin Young (3.7 feet, MAN). Yao Poole misses. Offensive rebound by Jrue Lillard! Jrue Lillard puts it back in!
Score: 44-39

[11:05] Team_037 possession (Score: 44-39)
Collin Young attempts a Midrange. Contested by Jrue Lillard (3.8 feet, ZONE). Collin Young misses. Rebound secured by Yao Poole.

[10:52] Team_056 possession (Score: 44-39)
Jrue Lillard attempts a Midrange. Contested by Scottie Jackson (4.2 feet, MAN). Jrue Lillard misses. Rebound secured by Scottie Jackson.

[10:40] Team_037 possession (Score: 44-39)
RJ Mitchell attempts a 3Pt. Contested by Giannis Jokic (4.5 feet, MAN). RJ Mitchell misses. Rebound secured by Jrue Lillard.

[10:25] Team_056 possession (Score: 44-39)
Jrue Lillard attempts a Midrange. Contested by Giannis Middleton (4.7 feet, ZONE). Jrue Lillard misses. Offensive rebound by Jrue Lillard! Jrue Lillard puts it back in!
Score: 44-41

[10:05] Team_037 possession (Score: 44-41)
Scottie Jackson attempts a 3Pt. Contested by Jrue Lillard (4.4 feet, MAN). Scottie Jackson misses. Rebound secured by Tony Carter.

[09:50] Team_056 possession (Score: 44-41)
FOUL! Shooting foul on Jarrett Tatum. Tony Carter to the line for 2 free throws. [Team fouls: 1] (Jarrett Tatum: 1 personal fouls)   FT 1/2: GOOD   FT 2/2: MISS Tony Carter makes 1/2 from the line. Rebound secured by Jarrett Tatum.
Score: 44-42

[09:33] Team_037 possession (Score: 44-42)
Collin Young makes the Layup and draws the foul on Yao Poole! And-1! Collin Young to the line for 1. [Team fouls: 1] (Yao Poole: 1 personal fouls)   FT 1/1: MISS Collin Young makes 0/1 from the line. Offensive rebound by Scottie Jackson! Scottie Jackson puts it back in!
Score: 48-42

[09:20] Team_056 possession (Score: 48-42)
Magic Russell attempts a 3Pt. Contested by Giannis Middleton (4.4 feet, MAN). Magic Russell misses. Rebound secured by Collin Young.

[09:03] Team_037 possession (Score: 48-42)
Jarrett Tatum drives and kicks out. Scottie Jackson attempts a 3Pt. Contested by Giannis Jokic (4.3 feet, ZONE). Scottie Jackson misses. Rebound secured by Tony Carter.

[08:48] Team_056 possession (Score: 48-42)
Giannis Jokic attempts a 3Pt. Contested by Scottie Jackson (4.0 feet, ZONE). GIANNIS JOKIC MAKES IT! Assist: Tony Carter
Score: 48-45

[08:39] Team_037 possession (Score: 48-45)
Jarrett Tatum attempts a 3Pt. Contested by Giannis Jokic (4.5 feet, ZONE). JARRETT TATUM MAKES IT! Assist: Collin Young
Score: 51-45

[08:25] Team_056 possession (Score: 51-45)
Magic Russell attempts a Layup. Contested by Giannis Middleton (4.4 feet, MAN). MAGIC RUSSELL MAKES IT!
Score: 51-47

[08:11] Team_037 possession (Score: 51-47)
RJ Mitchell attempts a Midrange. Contested by Giannis Jokic (4.5 feet, MAN). RJ Mitchell misses. Rebound secured by Tony Carter.

[07:53] Team_056 possession (Score: 51-47)
Jrue Lillard attempts a Layup. Contested by Scottie Jackson (4.2 feet, ZONE). Jrue Lillard misses. Rebound secured by Collin Young.

[07:39] Team_037 possession (Score: 51-47)
Collin Young makes the Layup and draws the foul on Yao Poole! And-1! Collin Young to the line for 1. [Team fouls: 2] (Yao Poole: 2 personal fouls)   FT 1/1: GOOD Collin Young makes 1/1 from the line.
Score: 54-47

[07:22] Team_056 possession (Score: 54-47)
Yao Poole attempts a Layup. Contested by Collin Young (3.7 feet, MAN). Yao Poole misses. Offensive rebound by Yao Poole! Yao Poole kicks it out.

[07:06] Team_056 possession (Score: 54-47)
Giannis Jokic attempts a Layup. Contested by RJ Mitchell (5.0 feet, MAN). GIANNIS JOKIC MAKES IT!
Score: 54-49

[06:54] Team_037 possession (Score: 54-49)
RJ Mitchell attempts a 3Pt. Contested by Giannis Jokic (4.5 feet, MAN). RJ Mitchell misses. Rebound secured by Yao Poole.

[06:38] Team_056 possession (Score: 54-49)
Yao Poole makes the Layup and draws the foul on Collin Young! And-1! Yao Poole to the line for 1. [Team fouls: 2] (Collin Young: 1 personal fouls)   FT 1/1: GOOD Yao Poole makes 1/1 from the line.
Score: 54-52

[06:24] Team_037 possession (Score: 54-52)
FOUL! Shooting foul on Magic Russell. Giannis Middleton to the line for 2 free throws. [Team fouls: 3] (Magic Russell: 1 personal fouls)   FT 1/2: GOOD   FT 2/2: MISS Giannis Middleton makes 1/2 from the line. FOUL! Loose ball foul on Tony Carter during the free throw rebound! [Team fouls: 4] No free throws, side out. (Tony Carter: 1 personal fouls)
Score: 55-52

[06:11] Team_037 possession (Score: 55-52)
RJ Mitchell attempts a 3Pt. Contested by Giannis Jokic (4.5 feet, MAN). RJ MITCHELL MAKES IT! Assist: Collin Young
Score: 58-52

[05:59] Team_056 possession (Score: 58-52)
Jrue Lillard drives, Scottie Jackson stays with him. Jrue Lillard attempts a Dunk. Contested by Scottie Jackson (4.2 feet, ZONE). JRUE LILLARD MAKES IT! Assist: Giannis Jokic
Score: 58-54

[05:48] Team_037 possession (Score: 58-54)
Scottie Jackson drives, Jrue Lillard stays with him. Scottie Jackson attempts a Dunk. Contested by Jrue Lillard (4.4 feet, ZONE). SCOTTIE JACKSON MAKES IT! Assist: Collin Young
Score: 60-54

[05:31] Team_056 possession (Score: 60-54)
Magic Russell makes the Layup and draws the foul on Giannis Middleton! And-1! Magic Russell to the line for 1. [Team fouls: 3] (Giannis Middleton: 1 personal fouls)   FT 1/1: GOOD Magic Russell makes 1/1 from the line.
Score: 60-57

[05:16] Team_037 possession (Score: 60-57)
RJ Mitchell makes the Layup and draws the foul on Jrue Lillard! And-1! RJ Mitchell to the line for 1. [BONUS: 5 team fouls] (Jrue Lillard: 1 personal fouls)   FT 1/1: GOOD RJ Mitchell makes 1/1 from the line.
Score: 63-57

[05:06] Team_056 possession (Score: 63-57)
Magic Russell attempts a 3Pt. Contested by Giannis Middleton (4.4 feet, MAN). Magic Russell misses. Offensive rebound by Jrue Lillard! Jrue Lillard's putback is no good. Rebound secured by Collin Young.

[04:52] Team_037 possession (Score: 63-57)
Jarrett Tatum makes the Dunk and draws the foul on Giannis Jokic! And-1! Jarrett Tatum to the line for 1. [BONUS: 6 team fouls] (Giannis Jokic: 1 personal fouls)   FT 1/1: GOOD Jarrett Tatum makes 1/1 from the line.
Score: 66-57

[04:36] Team_056 possession (Score: 66-57)
Giannis Jokic attempts a Layup. Contested by Collin Young (4.5 feet, ZONE). GIANNIS JOKIC MAKES IT!
Score: 66-59

[04:21] Team_037 possession (Score: 66-59)
Collin Young makes the Dunk and draws the foul on Yao Poole! And-1! Collin Young to the line for 1. [BONUS: 7 team fouls] (Yao Poole: 3 personal fouls)   FT 1/1: GOOD Collin Young makes 1/1 from the line.
Score: 69-59

[04:10] Team_056 possession (Score: 69-59)
FOUL! Shooting foul on Jarrett Tatum. Tony Carter to the line for 3 free throws. [Team fouls: 4] (Jarrett Tatum: 2 personal fouls)   FT 1/3: GOOD   FT 2/3: GOOD   FT 3/3: GOOD Tony Carter makes 3/3 from the line.
Score: 69-62

[03:53] Team_037 possession (Score: 69-62)
Jarrett Tatum attempts a 3Pt. Contested by Giannis Jokic (4.6 feet, ZONE). Jarrett Tatum misses. Rebound secured by Tony Carter.

[03:41] Team_056 possession (Score: 69-62)
Tony Carter attempts a 3Pt. Contested by Scottie Jackson (4.4 feet, ZONE). TONY CARTER MAKES IT! Assist: Giannis Jokic
Score: 69-65

[03:26] Team_037 possession (Score: 69-65)
Jarrett Tatum attempts a 3Pt. Contested by Giannis Jokic (4.7 feet, ZONE). JARRETT TATUM MAKES IT! Assist: Collin Young
Score: 72-65

[03:10] Team_056 possession (Score: 72-65)
Magic Russell attempts a 3Pt. Contested by Scottie Jackson (4.1 feet, ZONE). MAGIC RUSSELL MAKES IT! Assist: Giannis Jokic
Score: 72-68

[02:57] Team_037 possession (Score: 72-68)
RJ Mitchell makes the Layup and draws the foul on Giannis Jokic! And-1! RJ Mitchell to the line for 1. [BONUS: 8 team fouls] (Giannis Jokic: 2 personal fouls)   FT 1/1: MISS RJ Mitchell makes 0/1 from the line. Offensive rebound by Scottie Jackson! Scottie Jackson puts it back in!
Score: 76-68

[02:42] Team_056 possession (Score: 76-68)
Tony Carter attempts a 3Pt. Contested by Scottie Jackson (4.4 feet, ZONE). TONY CARTER MAKES IT! Assist: Yao Poole
Score: 76-71

[02:31] Team_037 possession (Score: 76-71)
Jarrett Tatum drives and kicks out. Jarrett Tatum attempts a 3Pt. Contested by Tony Carter (4.4 feet, MAN). Jarrett Tatum misses. Rebound secured by Jrue Lillard.

[02:15] Team_056 possession (Score: 76-71)
Giannis Jokic attempts a Midrange. Contested by Scottie Jackson (4.2 feet, ZONE). Giannis Jokic misses. Rebound secured by Jarrett Tatum.

[02:00] Team_037 possession (Score: 76-71)
Jarrett Tatum attempts a Midrange. Contested by Yao Poole (4.7 feet, ZONE). Jarrett Tatum misses. Rebound secured by Tony Carter.

[01:43] Team_056 possession (Score: 76-71)
Jrue Lillard attempts a Midrange. Contested by Scottie Jackson (4.5 feet, MAN). Jrue Lillard misses. Rebound secured by Scottie Jackson.

[01:32] Team_037 possession (Score: 76-71)
Collin Young attempts a Midrange. Contested by Yao Poole (4.6 feet, MAN). Collin Young misses. Rebound secured by Yao Poole.

[01:17] Team_056 possession (Score: 76-71)
FOUL! Shooting foul on Scottie Jackson. Jrue Lillard to the line for 2 free throws. [BONUS: 5 team fouls] (Scottie Jackson: 1 personal fouls)   FT 1/2: GOOD   FT 2/2: GOOD Jrue Lillard makes 2/2 from the line.
Score: 76-73

[01:01] Team_037 possession (Score: 76-73)
Scottie Jackson attempts a 3Pt. Contested by Giannis Jokic (5.3 feet, ZONE). Scottie Jackson misses. Rebound secured by Tony Carter.

[00:46] Team_056 possession (Score: 76-73)
Jrue Lillard attempts a 3Pt. Contested by Scottie Jackson (4.6 feet, ZONE). Jrue Lillard misses. Offensive rebound by Jrue Lillard! Jrue Lillard puts it back in!
Score: 76-75

[00:35] Team_037 possession (Score: 76-75)
Jarrett Tatum drives and kicks out. Scottie Jackson attempts a 3Pt. Contested by Jrue Lillard (4.4 feet, MAN). Scottie Jackson misses. Rebound secured by Jrue Lillard.

[00:16] Team_056 possession (Score: 76-75)
Giannis Jokic attempts a 3Pt. Contested by RJ Mitchell (5.4 feet, MAN). Giannis Jokic misses. Rebound secured by Scottie Jackson.

[00:04] Team_037 possession (Score: 76-75)
Scottie Jackson throws a bad pass! Stolen by Jrue Lillard! TURNOVER! (live ball)

================================================================================
                              3RD QUARTER COMPLETE                              
================================================================================

3RD QUARTER SCORE: Team_037 34, Team_056 38

BOX SCORE:
================================================================================

Team_037
--------------------------------------------------------------------------------
Player                MIN  PTS  REB  AST  TO      FG   FG%      3P   3P%
--------------------------------------------------------------------------------
Jarrett Tatum          30   11    3    0   0   4/9    44.4     0/0   0.0
Scottie Jackson        33   10    4    0   0   3/5    60.0     0/0   0.0
Collin Young           30    6    3    5   0   2/4    50.0     0/0   0.0
RJ Mitchell            30    6    0    0   0   2/5    40.0     0/0   0.0
Giannis Middleton      33    0    0    0   0   0/1     0.0     0/0   0.0

TEAM: FG: 11/24 (45.8%), 3PT: 3/9 (33.3%), REB: 9 (1 off, 8 def), AST: 5, TO: 1
TEAM FOULS: 5 [Team_056 in BONUS]


Team_056
--------------------------------------------------------------------------------
Player                MIN  PTS  REB  AST  TO      FG   FG%      3P   3P%
--------------------------------------------------------------------------------
Jrue Lillard           30   10    6    0   0   5/9    55.6     0/0   0.0
Tony Carter            30    9    6    1   0   3/4    75.0     0/0   0.0
Magic Russell          30    8    0    0   0   3/5    60.0     0/0   0.0
Giannis Jokic          30    7    0    3   0   3/5    60.0     0/0   0.0
Yao Poole              30    3    5    1   0   1/1   100.0     0/0   0.0

TEAM: FG: 15/24 (62.5%), 3PT: 6/10 (60.0%), REB: 18 (5 off, 13 def), AST: 5, TO: 0
TEAM FOULS: 8 [Team_037 in BONUS]

================================================================================

================================================================================
                       4TH QUARTER - Team_037 vs Team_056                       
================================================================================

[12:00] Team_037 possession (Score: 76-75)
Giannis Middleton attempts a 3Pt. Contested by Giannis Jokic (5.0 feet, ZONE). GIANNIS MIDDLETON MAKES IT! Assist: RJ Mitchell
Score: 79-75

[11:45] Team_056 possession (Score: 79-75)
Jrue Lillard drives and kicks out. Jrue Lillard attempts a 3Pt. Contested by RJ Mitchell (5.0 feet, ZONE). Jrue Lillard misses. Offensive rebound by Yao Poole! Yao Poole kicks it out.

[11:29] Team_056 possession (Score: 79-75)
Tony Carter drives, Jarrett Tatum stays with him. Tony Carter attempts a Dunk. Contested by Jarrett Tatum (5.0 feet, MAN). TONY CARTER MAKES IT! Assist: Giannis Jokic
Score: 79-77

[11:11] Team_037 possession (Score: 79-77)
RJ Mitchell attempts a Midrange. Wide open! Magic Russell is 6.1 feet away. [ZONE] RJ MITCHELL MAKES IT!
Score: 81-77

[10:57] Team_056 possession (Score: 81-77)
Giannis Jokic attempts a Layup. Contested by Scottie Jackson (4.3 feet, ZONE). GIANNIS JOKIC MAKES IT!
Score: 81-79

[10:45] Team_037 possession (Score: 81-79)
RJ Mitchell makes the Midrange and draws the foul on Tony Carter! And-1! RJ Mitchell to the line for 1. [Team fouls: 1] (Tony Carter: 1 personal fouls)   FT 1/1: MISS RJ Mitchell makes 0/1 from the line. Rebound secured by Yao Poole.
Score: 83-79

[10:31] Team_056 possession (Score: 83-79)
Yao Poole attempts a Midrange. Contested by Scottie Jackson (3.7 feet, ZONE). Yao Poole misses. Rebound secured by Collin Young.

[10:16] Team_037 possession (Score: 83-79)
Giannis Middleton attempts a 3Pt. Contested by Giannis Jokic (5.2 feet, ZONE). Giannis Middleton misses. Rebound secured by Jrue Lillard.

[09:58] Team_056 possession (Score: 83-79)
Jrue Lillard makes the Midrange and draws the foul on Scottie Jackson! And-1! Jrue Lillard to the line for 1. [Team fouls: 1] (Scottie Jackson: 1 personal fouls)   FT 1/1: GOOD Jrue Lillard makes 1/1 from the line.
Score: 83-82

[09:48] Team_037 possession (Score: 83-82)
Collin Young attempts a Layup. Contested by Jrue Lillard (4.4 feet, ZONE). COLLIN YOUNG MAKES IT! Assist: RJ Mitchell
Score: 85-82

[09:33] Team_056 possession (Score: 85-82)
Giannis Jokic attempts a Midrange. Contested by Jarrett Tatum (4.9 feet, ZONE). Giannis Jokic misses. Rebound secured by Collin Young.

[09:19] Team_037 possession (Score: 85-82)
Scottie Jackson drives and kicks out. Collin Young attempts a 3Pt. Contested by Giannis Jokic (5.1 feet, ZONE). COLLIN YOUNG MAKES IT!
Score: 88-82

[09:07] Team_056 possession (Score: 88-82)
FOUL! Shooting foul on Giannis Middleton. Magic Russell to the line for 2 free throws. [Team fouls: 2] (Giannis Middleton: 1 personal fouls)   FT 1/2: GOOD   FT 2/2: GOOD Magic Russell makes 2/2 from the line.
Score: 88-84

[08:50] Team_037 possession (Score: 88-84)
Collin Young attempts a Midrange. Contested by Jrue Lillard (4.6 feet, ZONE). Collin Young misses. Rebound secured by Jrue Lillard.

[08:35] Team_056 possession (Score: 88-84)
FOUL! Holding foul on Scottie Jackson. [Team fouls: 3] No free throws, side out. (Scottie Jackson: 2 personal fouls)

[08:18] Team_056 possession (Score: 88-84)
Jrue Lillard makes the Layup and draws the foul on Scottie Jackson! And-1! Jrue Lillard to the line for 1. [Team fouls: 4] (Scottie Jackson: 3 personal fouls)   FT 1/1: GOOD Jrue Lillard makes 1/1 from the line.
Score: 88-87

[08:08] Team_037 possession (Score: 88-87)
RJ Mitchell attempts a Midrange. Contested by Giannis Jokic (5.3 feet, MAN). RJ MITCHELL MAKES IT!
Score: 90-87

[07:52] Team_056 possession (Score: 90-87)
Magic Russell attempts a Layup. Contested by Giannis Middleton (5.0 feet, MAN). MAGIC RUSSELL MAKES IT!
Score: 90-89

[07:39] Team_037 possession (Score: 90-89)
RJ Mitchell attempts a Midrange. Contested by Giannis Jokic (5.4 feet, MAN). RJ MITCHELL MAKES IT!
Score: 92-89

[07:22] Team_056 possession (Score: 92-89)
Tony Carter attempts a Layup. Contested by Collin Young (5.6 feet, ZONE). TONY CARTER MAKES IT! Assist: Yao Poole
Score: 92-91

[07:06] Team_037 possession (Score: 92-91)
FOUL! Shooting foul on Tony Carter. Jarrett Tatum to the line for 3 free throws. [Team fouls: 2] (Tony Carter: 2 personal fouls)   FT 1/3: GOOD   FT 2/3: GOOD   FT 3/3: GOOD Jarrett Tatum makes 3/3 from the line.
Score: 95-91

[06:53] Team_056 possession (Score: 95-91)
Magic Russell attempts a Midrange. Contested by Giannis Middleton (5.1 feet, MAN). Magic Russell misses. Rebound secured by Scottie Jackson.

[06:36] Team_037 possession (Score: 95-91)
RJ Mitchell attempts a 3Pt. Contested by Giannis Jokic (5.5 feet, MAN). RJ MITCHELL MAKES IT! Assist: Jarrett Tatum
Score: 98-91

[06:22] Team_056 possession (Score: 98-91)
Yao Poole drives to the basket... Yao Poole throws a bad pass! Stolen by Scottie Jackson! TURNOVER! (live ball)

[06:11] Team_037 possession (Score: 98-91)
Collin Young attempts a Layup. Contested by Yao Poole (5.4 feet, MAN). Collin Young misses. Rebound secured by Yao Poole.

[05:52] Team_056 possession (Score: 98-91)
FOUL! Shooting foul on Collin Young. Yao Poole to the line for 2 free throws. [BONUS: 5 team fouls] (Collin Young: 1 personal fouls)   FT 1/2: GOOD   FT 2/2: MISS Yao Poole makes 1/2 from the line. Rebound secured by Jarrett Tatum.
Score: 98-92

[05:38] Team_037 possession (Score: 98-92)
Collin Young attempts a Layup. Contested by Jrue Lillard (5.0 feet, ZONE). COLLIN YOUNG MAKES IT! Assist: Giannis Middleton
Score: 100-92

[05:21] Team_056 possession (Score: 100-92)
Magic Russell attempts a Midrange. Contested by Jarrett Tatum (5.4 feet, ZONE). Magic Russell misses. Rebound secured by Jarrett Tatum.

[05:06] Team_037 possession (Score: 100-92)
Jarrett Tatum drives, picks up Tony Carter. Help arrives from Giannis Jokic! Jarrett Tatum attempts a Dunk. Contested by Giannis Jokic (5.4 feet, MAN). JARRETT TATUM MAKES IT! Assist: Collin Young
Score: 102-92

[04:56] Team_056 possession (Score: 102-92)
Jrue Lillard attempts a Midrange. Contested by Collin Young (5.9 feet, ZONE). JRUE LILLARD MAKES IT!
Score: 102-94

[04:47] Team_037 possession (Score: 102-94)
Jarrett Tatum attempts a 3Pt. Contested by Tony Carter (5.5 feet, MAN). Jarrett Tatum misses. Rebound secured by Yao Poole.

[04:31] Team_056 possession (Score: 102-94)
Jrue Lillard attempts a Layup. Contested by Scottie Jackson (5.3 feet, MAN). JRUE LILLARD MAKES IT! Assist: Tony Carter
Score: 102-96

[04:17] Team_037 possession (Score: 102-96)
Giannis Middleton attempts a 3Pt. Wide open! Magic Russell is 7.1 feet away. [MAN] GIANNIS MIDDLETON MAKES IT! Assist: Scottie Jackson
Score: 105-96

[04:04] Team_056 possession (Score: 105-96)
Magic Russell drives, Scottie Jackson stays with him. Magic Russell attempts a Dunk. Contested by Scottie Jackson (5.1 feet, ZONE). MAGIC RUSSELL MAKES IT! Assist: Giannis Jokic
Score: 105-98

[03:52] Team_037 possession (Score: 105-98)
FOUL! Reach-in foul on Jrue Lillard during the drive. [Team fouls: 3] No free throws, side out. (Jrue Lillard: 1 personal fouls)

[03:37] Team_037 possession (Score: 105-98)
Giannis Middleton attempts a 3Pt. Wide open! Magic Russell is 7.1 feet away. [MAN] Giannis Middleton misses. Rebound secured by Jrue Lillard.

[03:24] Team_056 possession (Score: 105-98)
FOUL! Shooting foul on Collin Young. Yao Poole to the line for 2 free throws. [BONUS: 6 team fouls] (Collin Young: 2 personal fouls)   FT 1/2: GOOD   FT 2/2: GOOD Yao Poole makes 2/2 from the line.
Score: 105-100

[03:11] Team_037 possession (Score: 105-100)
RJ Mitchell attempts a 3Pt. Wide open! Giannis Jokic is 6.0 feet away. [MAN] RJ MITCHELL MAKES IT!
Score: 108-100

[02:58] Team_056 possession (Score: 108-100)
Tony Carter attempts a 3Pt. Wide open! Jarrett Tatum is 6.0 feet away. [MAN] Tony Carter misses. Rebound secured by Collin Young.

[02:41] Team_037 possession (Score: 108-100)
Jarrett Tatum makes the Layup and draws the foul on Jrue Lillard! And-1! Jarrett Tatum to the line for 1. [Team fouls: 4] (Jrue Lillard: 2 personal fouls)   FT 1/1: GOOD Jarrett Tatum makes 1/1 from the line.
Score: 111-100

[02:31] Team_056 possession (Score: 111-100)
Jrue Lillard attempts a 3Pt. Contested by Giannis Middleton (5.9 feet, ZONE). Jrue Lillard misses. Rebound secured by Scottie Jackson.

[02:16] Team_037 possession (Score: 111-100)
RJ Mitchell attempts a Midrange. Contested by Tony Carter (5.9 feet, ZONE). RJ Mitchell misses. Rebound secured by Tony Carter.

[02:01] Team_056 possession (Score: 111-100)
Tony Carter attempts a 3Pt. Contested by Scottie Jackson (5.7 feet, ZONE). Tony Carter misses. Rebound secured by Scottie Jackson.

[01:44] Team_037 possession (Score: 111-100)
FOUL! Shooting foul on Tony Carter. Jarrett Tatum to the line for 2 free throws. [BONUS: 5 team fouls] (Tony Carter: 3 personal fouls)   FT 1/2: GOOD   FT 2/2: MISS Jarrett Tatum makes 1/2 from the line. Offensive rebound by Scottie Jackson! Scottie Jackson kicks it out.
Score: 112-100

[01:26] Team_037 possession (Score: 112-100)
FOUL! Offensive foul on Scottie Jackson! Jrue Lillard drew the charge! [Team fouls: 7] (Scottie Jackson: 4 personal fouls) TURNOVER! (dead ball)

[01:12] Team_056 possession (Score: 112-100)
Giannis Jokic attempts a 3Pt. Wide open! RJ Mitchell is 6.5 feet away. [MAN] GIANNIS JOKIC MAKES IT! Assist: Yao Poole
Score: 112-103

[00:57] Team_037 possession (Score: 112-103)
Collin Young attempts a 3Pt. Contested by Tony Carter (5.9 feet, ZONE). COLLIN YOUNG MAKES IT!
Score: 115-103

[00:42] Team_056 possession (Score: 115-103)
Jrue Lillard throws a bad pass! Stolen by Scottie Jackson! TURNOVER! (live ball)

[00:26] Team_037 possession (Score: 115-103)
FOUL! Reach-in foul on Jrue Lillard during the drive. [IN THE BONUS! 6 team fouls] Scottie Jackson to the line for 2 free throws. (Jrue Lillard: 3 personal fouls)   FT 1/2: GOOD   FT 2/2: GOOD Scottie Jackson makes 2/2 from the line.
Score: 117-103

[00:12] Team_056 possession (Score: 117-103)
Yao Poole loses the ball! Stripped by Collin Young! TURNOVER! (live ball)

================================================================================
                              4TH QUARTER COMPLETE                              
================================================================================

4TH QUARTER SCORE: Team_037 41, Team_056 28

BOX SCORE:
================================================================================

Team_037
--------------------------------------------------------------------------------
Player                MIN  PTS  REB  AST  TO      FG   FG%      3P   3P%
--------------------------------------------------------------------------------
RJ Mitchell            43   12    0    2   0   5/7    71.4     0/0   0.0
Collin Young           43   10    3    1   0   4/6    66.7     0/0   0.0
Jarrett Tatum          43    8    2    1   0   3/4    75.0     0/0   0.0
Giannis Middleton      45    6    0    1   0   2/4    50.0     0/0   0.0
Scottie Jackson        45    2    4    1   0   1/1   100.0     0/0   0.0

TEAM: FG: 15/22 (68.2%), 3PT: 6/9 (66.7%), REB: 9 (1 off, 8 def), AST: 6, TO: 1
TEAM FOULS: 7 [Team_056 in BONUS]


Team_056
--------------------------------------------------------------------------------
Player                MIN  PTS  REB  AST  TO      FG   FG%      3P   3P%
--------------------------------------------------------------------------------
Jrue Lillard           43   10    3    0   0   4/5    80.0     0/0   0.0
Magic Russell          43    6    0    0   0   3/5    60.0     0/0   0.0
Giannis Jokic          43    5    0    2   0   2/3    66.7     0/0   0.0
Tony Carter            43    4    1    1   0   2/4    50.0     0/0   0.0
Yao Poole              43    2    4    2   0   1/3    33.3     0/0   0.0

TEAM: FG: 12/20 (60.0%), 3PT: 1/4 (25.0%), REB: 8 (1 off, 7 def), AST: 5, TO: 3
TEAM FOULS: 6 [Team_037 in BONUS]

================================================================================

================================================================================
                               FULL GAME COMPLETE                               
================================================================================

FINAL SCORE: Team_037 117, Team_056 103

SCORING BY QUARTER:
--------------------------------------------------------------------------------
Team                     Q1     Q2     Q3     Q4    FINAL
--------------------------------------------------------------------------------
Team_037                 26     16     34     41      117
Team_056                 21     16     38     28      103
--------------------------------------------------------------------------------

FULL GAME BOX SCORE:
================================================================================

Team_037
--------------------------------------------------------------------------------
Player                MIN  PTS  REB  AST  TO      FG   FG%      3P   3P%      FT STL BLK
--------------------------------------------------------------------------------
Giannis Middleton      45   14    0    1   1   5/11   45.5   4/8    50.0   1/2     2   0
Scottie Jackson        45   26   16    1   3   8/12   66.7   1/4    25.0   4/4     2   1
RJ Mitchell            43   22    0    4   1  10/18   55.6   3/8    37.5   1/3     1   0
Jarrett Tatum          43   22    9    5   0   8/17   47.1   3/6    50.0   7/8     0   0
Collin Young           43   22   18    8   1   9/18   50.0   1/2    50.0   2/3     1   0
Jarrett Randle          6    0    0    0   1   0/1     0.0   0/1     0.0   0/0     0   0
Julius Bird             6    0    2    0   0   0/3     0.0   0/2     0.0   0/0     0   0
Wendell Herro           6    2    0    0   0   1/1   100.0   0/0     0.0   0/0     0   0
Collin Trent            4    2    0    0   0   1/2    50.0   0/1     0.0   0/0     0   0
Russell Anthony         4    3    3    1   0   1/1   100.0   0/0     0.0   1/1     1   1

TEAM: FG: 43/84 (51.2%), 3PT: 12/32 (37.5%), REB: 45 (7 off, 38 def), AST: 20, TO: 7


Team_056
--------------------------------------------------------------------------------
Player                MIN  PTS  REB  AST  TO      FG   FG%      3P   3P%      FT STL BLK
--------------------------------------------------------------------------------
Giannis Jokic          43   16    0    5   2   7/12   58.3   2/3    66.7   2/2     0   0
Magic Russell          43   22    0    1   1  10/19   52.6   2/8    25.0   4/4     0   0
Tony Carter            43   22   13    2   1   8/13   61.5   4/8    50.0   9/10    0   0
Jrue Lillard           43   27   13    0   1   9/18   50.0   2/5    40.0   5/6     2   1
Yao Poole              43    5   20    4   2   4/9    44.4   0/1     0.0   4/5     1   0
De'Aaron Murray         6    0    0    1   1   0/4     0.0   0/2     0.0   0/0     0   0
Damian Barrett          6    0    0    0   1   0/0     0.0   0/0     0.0   0/0     0   0
CJ Anthony              6    3    6    0   0   1/1   100.0   1/1   100.0   0/1     0   0
RJ Johnson              6    0    4    0   0   0/2     0.0   0/2     0.0   0/0     0   0
Derrick Bane            6    3    0    0   0   1/2    50.0   0/0     0.0   1/1     1   0

TEAM: FG: 40/80 (50.0%), 3PT: 11/30 (36.7%), REB: 57 (18 off, 39 def), AST: 13, TO: 9

================================================================================
