================================================================================
                        FULL GAME - Team_024 vs Team_096                        
================================================================================

================================================================================
                       1ST QUARTER - Team_024 vs Team_096                       
================================================================================

[12:00] Team_024 possession (Score: 0-0)
Bradley Allen attempts a 3Pt. Contested by Cole Griffin (3.3 feet, MAN). Bradley Allen misses. Rebound secured by Kyrie Adebayo.

[11:49] Team_096 possession (Score: 0-0)
Lamelo Quickley attempts a Midrange. Contested by Zach Fox (3.0 feet, MAN). Lamelo Quickley misses. Rebound secured by Anfernee Williamson.

[11:35] Team_024 possession (Score: 0-0)
Anfernee Williamson drives and kicks out. Bradley Allen attempts a Midrange. Contested by Cole Griffin (3.3 feet, MAN). Bradley Allen misses. Rebound secured by Scottie Herro.

[11:20] Team_096 possession (Score: 0-0)
Cole Griffin attempts a 3Pt. Contested by Zach Fox (3.8 feet, ZONE). Cole Griffin misses. Rebound secured by Zach Fox.

[11:02] Team_024 possession (Score: 0-0)
Anfernee Williamson attempts a Midrange. Contested by Scottie Herro (4.8 feet, MAN). ANFERNEE WILLIAMSON MAKES IT!
Score: 2-0

[10:48] Team_096 possession (Score: 2-0)
FOUL! Holding foul on Ja Reaves. [Team fouls: 1] No free throws, side out. (Ja Reaves: 1 personal fouls)

[10:37] Team_096 possession (Score: 2-0)
Terry Mobley drives to the basket... Terry Mobley throws a bad pass out of bounds! TURNOVER! (dead ball)

[10:18] Team_024 possession (Score: 2-0)
Bradley Allen attempts a Midrange. Contested by Lamelo Quickley (4.0 feet, ZONE). BRADLEY ALLEN MAKES IT!
Score: 4-0

[10:03] Team_096 possession (Score: 4-0)
Lamelo Quickley attempts a 3Pt. Contested by Zach Fox (3.0 feet, MAN). LAMELO QUICKLEY MAKES IT! Assist: Terry Mobley
Score: 4-3

[09:44] Team_024 possession (Score: 4-3)
Draymond Towns loses control! Ball rolls out of bounds! TURNOVER! (dead ball)

[09:24] Team_096 possession (Score: 4-3)
Kyrie Adebayo loses the ball! Stripped by Anfernee Williamson! TURNOVER! (live ball)

[09:08] Team_024 possession (Score: 4-3)
Draymond Towns makes the Dunk and draws the foul on Lamelo Quickley! And-1! Draymond Towns to the line for 1. [Team fouls: 1] (Lamelo Quickley: 1 personal fouls)   FT 1/1: GOOD Draymond Towns makes 1/1 from the line.
Score: 7-3

[08:57] Team_096 possession (Score: 7-3)
FOUL! Holding foul on Zach Fox. [Team fouls: 2] No free throws, side out. (Zach Fox: 1 personal fouls)

[08:39] Team_096 possession (Score: 7-3)
Kyrie Adebayo drives, Anfernee Williamson stays with him. Kyrie Adebayo attempts a Layup. Contested by Anfernee Williamson (4.3 feet, ZONE). Kyrie Adebayo misses. Offensive rebound by Scottie Herro! Scottie Herro kicks it out.

[08:27] Team_096 possession (Score: 7-3)
Cole Griffin attempts a 3Pt. Contested by Zach Fox (3.8 feet, ZONE). Cole Griffin misses. Rebound secured by Zach Fox.

[08:12] Team_024 possession (Score: 7-3)
Ja Reaves attempts a 3Pt. Contested by Scottie Herro (5.1 feet, ZONE). JA REAVES MAKES IT! Assist: Draymond Towns
Score: 10-3

[07:56] Team_096 possession (Score: 10-3)
Cole Griffin attempts a Midrange. Contested by Bradley Allen (4.1 feet, MAN). Cole Griffin misses. Rebound secured by Anfernee Williamson.

[07:43] Team_024 possession (Score: 10-3)
FOUL! Holding foul on Kyrie Adebayo. [Team fouls: 2] No free throws, side out. (Kyrie Adebayo: 1 personal fouls)

[07:28] Team_024 possession (Score: 10-3)
Ja Reaves attempts a 3Pt. Contested by Cole Griffin (3.5 feet, ZONE). Ja Reaves misses. Rebound secured by Scottie Herro.

[07:09] Team_096 possession (Score: 10-3)
Kyrie Adebayo drives to the basket... Kyrie Adebayo loses control! Ball rolls out of bounds! TURNOVER! (dead ball)

[06:54] Team_024 possession (Score: 10-3)
Bradley Allen attempts a 3Pt. Contested by Cole Griffin (3.3 feet, ZONE). Bradley Allen misses. Offensive rebound by Draymond Towns! Draymond Towns's putback is no good. Offensive rebound by Zach Fox! Zach Fox kicks it out.

[06:35] Team_024 possession (Score: 10-3)
Bradley Allen attempts a 3Pt. Contested by Cole Griffin (3.3 feet, MAN). Bradley Allen misses. Offensive rebound by Draymond Towns! Draymond Towns puts it back in!
Score: 12-3

[06:21] Team_096 possession (Score: 12-3)
Lamelo Quickley drives and kicks out. Kyrie Adebayo attempts a Midrange. Contested by Zach Fox (3.5 feet, ZONE). Kyrie Adebayo misses. Rebound secured by Draymond Towns.

[06:08] Team_024 possession (Score: 12-3)
Bradley Allen attempts a 3Pt. Contested by Cole Griffin (3.3 feet, MAN). BRADLEY ALLEN MAKES IT! Assist: Anfernee Williamson
Score: 15-3

[05:58] Team_096 possession (Score: 15-3)
Scottie Herro attempts a Midrange. Contested by Bradley Allen (4.0 feet, ZONE). SCOTTIE HERRO MAKES IT!
Score: 15-5

[05:41] Team_024 possession (Score: 15-5)
Ja Reaves attempts a 3Pt. Contested by Scottie Herro (5.1 feet, ZONE). Ja Reaves misses. Rebound secured by Kyrie Adebayo.

[05:29] Team_096 possession (Score: 15-5)
Lamelo Quickley makes the Layup and draws the foul on Zach Fox! And-1! Lamelo Quickley to the line for 1. [Team fouls: 3] (Zach Fox: 2 personal fouls)   FT 1/1: GOOD Lamelo Quickley makes 1/1 from the line.
Score: 15-8

[05:15] Team_024 possession (Score: 15-8)
Anfernee Williamson attempts a 3Pt. Contested by Cole Griffin (3.2 feet, ZONE). Anfernee Williamson misses. Rebound secured by Scottie Herro.

[05:01] Team_096 possession (Score: 15-8)
Kyrie Adebayo attempts a Midrange. Contested by Anfernee Williamson (4.3 feet, MAN). Kyrie Adebayo misses. FOUL! Loose ball foul on Anfernee Williamson during the rebound battle. [Team fouls: 4] No free throws, side out. (Anfernee Williamson: 1 personal fouls)

[04:43] Team_096 possession (Score: 15-8)
Cole Griffin attempts a 3Pt. Contested by Bradley Allen (4.2 feet, MAN). Cole Griffin misses. Rebound secured by Draymond Towns.

[04:28] Team_024 possession (Score: 15-8)
Draymond Towns attempts a Layup. Contested by Kyrie Adebayo (3.5 feet, ZONE). Draymond Towns misses. Rebound secured by Scottie Herro.

[04:14] Team_096 possession (Score: 15-8)
Kyrie Adebayo attempts a Layup. Contested by Anfernee Williamson (4.4 feet, ZONE). KYRIE ADEBAYO MAKES IT!
Score: 15-10

[03:56] Team_024 possession (Score: 15-10)
Ja Reaves attempts a 3Pt. Contested by Lamelo Quickley (4.2 feet, ZONE). Ja Reaves misses. Rebound secured by Scottie Herro.

[03:46] Team_096 possession (Score: 15-10)
FOUL! Shooting foul on Zach Fox. Kyrie Adebayo to the line for 3 free throws. [BONUS: 5 team fouls] (Zach Fox: 3 personal fouls)   FT 1/3: MISS   FT 2/3: GOOD   FT 3/3: GOOD Kyrie Adebayo makes 2/3 from the line.
Score: 15-12

[03:31] Team_024 possession (Score: 15-12)
FOUL! Reach-in foul on Lamelo Quickley during the drive. [Team fouls: 3] No free throws, side out. (Lamelo Quickley: 2 personal fouls)

[03:16] Team_024 possession (Score: 15-12)
FOUL! Reach-in foul on Cole Griffin during the drive. [Team fouls: 4] No free throws, side out. (Cole Griffin: 1 personal fouls)

[03:04] Team_024 possession (Score: 15-12)
Bradley Allen attempts a 3Pt. Contested by Cole Griffin (3.5 feet, ZONE). Bradley Allen misses. Rebound secured by Scottie Herro.

[02:45] Team_096 possession (Score: 15-12)
Lamelo Quickley drives and kicks out. Scottie Herro attempts a 3Pt. Contested by Anfernee Williamson (3.9 feet, MAN). Scottie Herro misses. Rebound secured by Zach Fox.

[02:27] Team_024 possession (Score: 15-12)
Draymond Towns attempts a Layup. Contested by Kyrie Adebayo (3.7 feet, MAN). DRAYMOND TOWNS MAKES IT! Assist: Ja Reaves
Score: 17-12

[02:10] Team_096 possession (Score: 17-12)
Cole Griffin attempts a Layup. Contested by Anfernee Williamson (4.2 feet, ZONE). COLE GRIFFIN MAKES IT! Assist: Lamelo Quickley
Score: 17-14

[01:52] Team_024 possession (Score: 17-14)
Ja Reaves attempts a Layup. Contested by Terry Mobley (4.9 feet, MAN). JA REAVES MAKES IT!
Score: 19-14

[01:35] Team_096 possession (Score: 19-14)
Kyrie Adebayo drives, Anfernee Williamson stays with him. Kyrie Adebayo attempts a Layup. Contested by Anfernee Williamson (4.6 feet, ZONE). Kyrie Adebayo misses. Rebound secured by Anfernee Williamson.

[01:26] Team_024 possession (Score: 19-14)
Bradley Allen attempts a Midrange. Contested by Terry Mobley (4.9 feet, ZONE). BRADLEY ALLEN MAKES IT! Assist: Zach Fox
Score: 21-14

[01:10] Team_096 possession (Score: 21-14)
Terry Mobley makes the Dunk and draws the foul on Anfernee Williamson! And-1! Terry Mobley to the line for 1. [BONUS: 6 team fouls] (Anfernee Williamson: 2 personal fouls)   FT 1/1: GOOD Terry Mobley makes 1/1 from the line.
Score: 21-17

[00:51] Team_024 possession (Score: 21-17)
FOUL! Holding foul on Cole Griffin. [IN THE BONUS! 5 team fouls] Bradley Allen to the line for 2 free throws. (Cole Griffin: 2 personal fouls)   FT 1/2: GOOD   FT 2/2: GOOD Bradley Allen makes 2/2 from the line.
Score: 23-17

[00:37] Team_096 possession (Score: 23-17)
Kyrie Adebayo attempts a Layup. Contested by Draymond Towns (4.8 feet, MAN). KYRIE ADEBAYO MAKES IT! Assist: Terry Mobley
Score: 23-19

[00:22] Team_024 possession (Score: 23-19)
Bradley Allen throws a bad pass out of bounds! TURNOVER! (dead ball)

[00:22] Substitution (Team_024): Ja Reaves OUT → Victor Simons IN (stamina_rule2)

[00:22] Substitution (Team_024): Zach Fox OUT → Vince Irving IN (stamina_rule2)

[00:22] Substitution (Team_024): Bradley Allen OUT → Zach Durant IN (stamina_rule2)

[00:22] Substitution (Team_024): Anfernee Williamson OUT → Julius Harris IN (stamina_rule2)

[00:22] Substitution (Team_024): Draymond Towns OUT → Terry Rozier IN (stamina_rule2)

[00:22] Substitution (Team_096): Terry Mobley OUT → Cade Jokic IN (stamina_rule2)

[00:22] Substitution (Team_096): Lamelo Quickley OUT → Jarrett Markkanen IN (stamina_rule2)

[00:22] Substitution (Team_096): Cole Griffin OUT → Cole Holiday IN (stamina_rule2)

[00:22] Substitution (Team_096): Scottie Herro OUT → Tyler Haliburton IN (stamina_rule2)

[00:22] Substitution (Team_096): Kyrie Adebayo OUT → Devin Griffin IN (stamina_rule2)

[00:09] Team_096 possession (Score: 23-19)
FOUL! Holding foul on Zach Durant. [IN THE BONUS! 7 team fouls] Cole Holiday to the line for 2 free throws. (Zach Durant: 1 personal fouls)   FT 1/2: GOOD   FT 2/2: MISS Cole Holiday makes 1/2 from the line. Rebound secured by Julius Harris.
Score: 23-20

================================================================================
                              1ST QUARTER COMPLETE                              
================================================================================

1ST QUARTER SCORE: Team_024 23, Team_096 20

BOX SCORE:
================================================================================

Team_024
--------------------------------------------------------------------------------
Player                MIN  PTS  REB  AST  TO      FG   FG%      3P   3P%
--------------------------------------------------------------------------------
Bradley Allen          12    9    0    0   0   4/6    66.7     0/0   0.0
Draymond Towns         12    7    3    1   0   3/4    75.0     0/0   0.0
Ja Reaves              12    5    0    1   0   2/5    40.0     0/0   0.0
Anfernee Williamson    12    2    3    1   0   1/3    33.3     0/0   0.0
Zach Fox               12    0    4    1   0   0/0     0.0     0/0   0.0
Julius Harris           0    0    1    0   0   0/0     0.0     0/0   0.0

TEAM: FG: 10/18 (55.6%), 3PT: 3/9 (33.3%), REB: 11 (2 off, 9 def), AST: 4, TO: 2
TEAM FOULS: 7 [Team_096 in BONUS]


Team_096
--------------------------------------------------------------------------------
Player                MIN  PTS  REB  AST  TO      FG   FG%      3P   3P%
--------------------------------------------------------------------------------
Kyrie Adebayo          12    6    3    0   0   3/4    75.0     0/0   0.0
Lamelo Quickley        12    6    0    1   0   2/5    40.0     0/0   0.0
Terry Mobley           12    3    0    2   0   1/1   100.0     0/0   0.0
Scottie Herro          12    2    7    0   0   1/1   100.0     0/0   0.0
Cole Griffin           12    2    0    0   0   1/5    20.0     0/0   0.0

TEAM: FG: 8/17 (47.1%), 3PT: 2/5 (40.0%), REB: 10 (2 off, 8 def), AST: 3, TO: 3
TEAM FOULS: 5 [Team_024 in BONUS]

================================================================================

================================================================================
                       2ND QUARTER - Team_024 vs Team_096                       
================================================================================

[12:00] Team_024 possession (Score: 23-20)
FOUL! Shooting foul on Cole Griffin. Bradley Allen to the line for 3 free throws. [Team fouls: 1] (Cole Griffin: 1 personal fouls)   FT 1/3: GOOD   FT 2/3: GOOD   FT 3/3: MISS Bradley Allen makes 2/3 from the line. Rebound secured by Kyrie Adebayo.
Score: 25-20

[11:42] Team_096 possession (Score: 25-20)
Kyrie Adebayo makes the Midrange and draws the foul on Draymond Towns! And-1! Kyrie Adebayo to the line for 1. [Team fouls: 1] (Draymond Towns: 1 personal fouls)   FT 1/1: MISS Kyrie Adebayo makes 0/1 from the line. Rebound secured by Anfernee Williamson.
Score: 25-22

[11:31] Team_024 possession (Score: 25-22)
Anfernee Williamson attempts a Layup. BLOCKED BY SCOTTIE HERRO! Ball deflects out of bounds off Anfernee Williamson.

[11:16] Team_096 possession (Score: 25-22)
FOUL! Holding foul on Bradley Allen. [Team fouls: 2] No free throws, side out. (Bradley Allen: 1 personal fouls)

[11:04] Team_096 possession (Score: 25-22)
Kyrie Adebayo attempts a Midrange. Contested by Draymond Towns (4.8 feet, MAN). KYRIE ADEBAYO MAKES IT! Assist: Terry Mobley
Score: 25-24

[10:50] Team_024 possession (Score: 25-24)
Bradley Allen attempts a 3Pt. Contested by Cole Griffin (3.6 feet, ZONE). Bradley Allen misses. Rebound secured by Scottie Herro.

[10:36] Team_096 possession (Score: 25-24)
Cole Griffin attempts a 3Pt. Contested by Zach Fox (4.1 feet, ZONE). Cole Griffin misses. Offensive rebound by Kyrie Adebayo! Kyrie Adebayo puts it back in!
Score: 25-26

[10:19] Team_024 possession (Score: 25-26)
Draymond Towns drives, Kyrie Adebayo stays with him. Draymond Towns attempts a Dunk. Contested by Kyrie Adebayo (3.8 feet, ZONE). DRAYMOND TOWNS MAKES IT! Assist: Zach Fox
Score: 27-26

[10:03] Team_096 possession (Score: 27-26)
Terry Mobley drives, Ja Reaves stays with him. Terry Mobley attempts a Layup. Contested by Ja Reaves (5.0 feet, MAN). Terry Mobley misses. Rebound secured by Draymond Towns.

[09:45] Team_024 possession (Score: 27-26)
Ja Reaves attempts a Midrange. Contested by Terry Mobley (5.1 feet, MAN). JA REAVES MAKES IT!
Score: 29-26

[09:31] Team_096 possession (Score: 29-26)
Terry Mobley throws a bad pass! Stolen by Ja Reaves! TURNOVER! (live ball)

[09:14] Team_024 possession (Score: 29-26)
Bradley Allen makes the Layup and draws the foul on Cole Griffin! And-1! Bradley Allen to the line for 1. [Team fouls: 2] (Cole Griffin: 2 personal fouls)   FT 1/1: GOOD Bradley Allen makes 1/1 from the line.
Score: 32-26

[09:00] Team_096 possession (Score: 32-26)
Kyrie Adebayo attempts a Layup. BLOCKED BY ANFERNEE WILLIAMSON! Ball is loose! Rebound secured by Draymond Towns.

[08:50] Team_024 possession (Score: 32-26)
Draymond Towns drives to the basket... Draymond Towns throws a bad pass out of bounds! TURNOVER! (dead ball)

[08:50] Substitution (Team_024): Ja Reaves OUT → Victor Simons IN (stamina_rule2)

[08:50] Substitution (Team_024): Zach Fox OUT → Vince Irving IN (stamina_rule2)

[08:50] Substitution (Team_024): Bradley Allen OUT → Zach Durant IN (stamina_rule2)

[08:50] Substitution (Team_024): Anfernee Williamson OUT → Julius Harris IN (stamina_rule2)

[08:50] Substitution (Team_024): Draymond Towns OUT → Terry Rozier IN (stamina_rule2)

[08:50] Substitution (Team_096): Terry Mobley OUT → Cade Jokic IN (stamina_rule2)

[08:50] Substitution (Team_096): Lamelo Quickley OUT → Jarrett Markkanen IN (stamina_rule2)

[08:50] Substitution (Team_096): Cole Griffin OUT → Cole Holiday IN (stamina_rule2)

[08:50] Substitution (Team_096): Scottie Herro OUT → Tyler Haliburton IN (stamina_rule2)

[08:50] Substitution (Team_096): Kyrie Adebayo OUT → Devin Griffin IN (stamina_rule2)

[08:32] Team_096 possession (Score: 32-26)
Jarrett Markkanen attempts a 3Pt. Contested by Vince Irving (4.6 feet, MAN). Jarrett Markkanen misses. Rebound secured by Zach Durant.

[08:17] Team_024 possession (Score: 32-26)
Zach Durant attempts a 3Pt. Contested by Cole Holiday (4.8 feet, MAN). ZACH DURANT MAKES IT! Assist: Terry Rozier
Score: 35-26

[08:02] Team_096 possession (Score: 35-26)
FOUL! Reach-in foul on Julius Harris during the drive. [Team fouls: 3] No free throws, side out. (Julius Harris: 1 personal fouls)

[07:45] Team_096 possession (Score: 35-26)
FOUL! Offensive foul on Cade Jokic! Victor Simons drew the charge! [Team fouls: 3] (Cade Jokic: 1 personal fouls) TURNOVER! (dead ball)

[07:28] Team_024 possession (Score: 35-26)
Vince Irving drives to the basket... FOUL! Offensive foul on Vince Irving! Devin Griffin drew the charge! [Team fouls: 4] (Vince Irving: 1 personal fouls) TURNOVER! (dead ball)

[07:12] Team_096 possession (Score: 35-26)
FOUL! Shooting foul on Terry Rozier. Devin Griffin to the line for 3 free throws. [BONUS: 5 team fouls] (Terry Rozier: 1 personal fouls)   FT 1/3: GOOD   FT 2/3: MISS   FT 3/3: GOOD Devin Griffin makes 2/3 from the line.
Score: 35-28

[06:56] Team_024 possession (Score: 35-28)
Vince Irving attempts a 3Pt. Contested by Cade Jokic (5.4 feet, ZONE). Vince Irving misses. Offensive rebound by Terry Rozier! Terry Rozier puts it back in!
Score: 37-28

[06:42] Team_096 possession (Score: 37-28)
Tyler Haliburton attempts a Midrange. Contested by Julius Harris (4.9 feet, ZONE). Tyler Haliburton misses. Rebound secured by Zach Durant.

[06:28] Team_024 possession (Score: 37-28)
Julius Harris drives, Devin Griffin stays with him. Julius Harris attempts a Dunk. Contested by Devin Griffin (4.9 feet, ZONE). Julius Harris misses. Offensive rebound by Terry Rozier! Terry Rozier puts it back in!
Score: 39-28

[06:11] Team_096 possession (Score: 39-28)
Cade Jokic attempts a Midrange. Contested by Victor Simons (4.0 feet, MAN). Cade Jokic misses. Rebound secured by Terry Rozier.

[05:59] Team_024 possession (Score: 39-28)
Victor Simons attempts a 3Pt. Contested by Cade Jokic (5.4 feet, ZONE). Victor Simons misses. Rebound secured by Jarrett Markkanen.

[05:46] Team_096 possession (Score: 39-28)
Cole Holiday attempts a Layup. Contested by Terry Rozier (4.3 feet, ZONE). COLE HOLIDAY MAKES IT!
Score: 39-30

[05:29] Team_024 possession (Score: 39-30)
Terry Rozier attempts a Midrange. Contested by Devin Griffin (5.0 feet, MAN). Terry Rozier misses. Rebound secured by Tyler Haliburton.

[05:16] Team_096 possession (Score: 39-30)
Devin Griffin attempts a 3Pt. Contested by Victor Simons (4.0 feet, ZONE). DEVIN GRIFFIN MAKES IT! Assist: Cole Holiday
Score: 39-33

[05:05] Team_024 possession (Score: 39-33)
Julius Harris attempts a 3Pt. Contested by Jarrett Markkanen (4.4 feet, ZONE). Julius Harris misses. Rebound secured by Devin Griffin.

[04:49] Team_096 possession (Score: 39-33)
Devin Griffin drives, Terry Rozier stays with him. Devin Griffin attempts a Dunk. Contested by Terry Rozier (4.1 feet, MAN). DEVIN GRIFFIN MAKES IT!
Score: 39-35

[04:34] Team_024 possession (Score: 39-35)
Victor Simons attempts a 3Pt. Contested by Cade Jokic (5.4 feet, ZONE). Victor Simons misses. FOUL! Loose ball foul on Devin Griffin during the rebound battle. [Team fouls: 4] No free throws, side out. (Devin Griffin: 1 personal fouls)

[04:15] Team_024 possession (Score: 39-35)
Vince Irving attempts a 3Pt. Contested by Jarrett Markkanen (4.3 feet, MAN). Vince Irving misses. Offensive rebound by Julius Harris! Julius Harris kicks it out.

[04:02] Team_024 possession (Score: 39-35)
FOUL! Shooting foul on Tyler Haliburton. Zach Durant to the line for 2 free throws. [BONUS: 5 team fouls] (Tyler Haliburton: 1 personal fouls)   FT 1/2: GOOD   FT 2/2: GOOD Zach Durant makes 2/2 from the line.
Score: 41-35

[03:48] Team_096 possession (Score: 41-35)
Jarrett Markkanen attempts a Layup. Contested by Terry Rozier (3.7 feet, ZONE). Jarrett Markkanen misses. Rebound secured by Julius Harris.

[03:31] Team_024 possession (Score: 41-35)
Victor Simons drives and kicks out. Vince Irving attempts a Midrange. Contested by Jarrett Markkanen (4.2 feet, MAN). Vince Irving misses. Offensive rebound by Julius Harris! Julius Harris kicks it out.

[03:11] Team_024 possession (Score: 41-35)
Julius Harris attempts a Layup. Contested by Devin Griffin (4.9 feet, ZONE). Julius Harris misses. FOUL! Loose ball foul on Jarrett Markkanen during the rebound battle. [IN THE BONUS! 6 team fouls] Terry Rozier to the line for 2 free throws. (Jarrett Markkanen: 1 personal fouls)   FT 1/2: MISS   FT 2/2: GOOD Terry Rozier makes 1/2 from the line.
Score: 42-35

[02:58] Team_096 possession (Score: 42-35)
FOUL! Shooting foul on Terry Rozier. Tyler Haliburton to the line for 2 free throws. [BONUS: 6 team fouls] (Terry Rozier: 2 personal fouls)   FT 1/2: GOOD   FT 2/2: GOOD Tyler Haliburton makes 2/2 from the line.
Score: 42-37

[02:44] Team_024 possession (Score: 42-37)
Vince Irving attempts a 3Pt. Contested by Cade Jokic (5.4 feet, ZONE). Vince Irving misses. Rebound secured by Jarrett Markkanen.

[02:26] Team_096 possession (Score: 42-37)
Cole Holiday attempts a 3Pt. Contested by Victor Simons (4.2 feet, ZONE). Cole Holiday misses. Rebound secured by Julius Harris.

[02:10] Team_024 possession (Score: 42-37)
Vince Irving attempts a Midrange. Contested by Jarrett Markkanen (4.3 feet, ZONE). Vince Irving misses. Rebound secured by Jarrett Markkanen.

[01:58] Team_096 possession (Score: 42-37)
Devin Griffin attempts a Layup. BLOCKED BY TERRY ROZIER! Ball is loose! Offensive rebound by Devin Griffin! Devin Griffin kicks it out.

[01:42] Team_096 possession (Score: 42-37)
Jarrett Markkanen attempts a 3Pt. Contested by Vince Irving (4.6 feet, MAN). Jarrett Markkanen misses. Rebound secured by Zach Durant.

[01:28] Team_024 possession (Score: 42-37)
Victor Simons attempts a 3Pt. Contested by Cade Jokic (5.4 feet, MAN). Victor Simons misses. FOUL! Loose ball foul on Devin Griffin during the rebound battle. [IN THE BONUS! 7 team fouls] Julius Harris to the line for 2 free throws. (Devin Griffin: 2 personal fouls)   FT 1/2: GOOD   FT 2/2: GOOD Julius Harris makes 2/2 from the line.
Score: 44-37

[01:12] Team_096 possession (Score: 44-37)
Cole Holiday attempts a 3Pt. Contested by Zach Durant (3.6 feet, MAN). Cole Holiday misses. Offensive rebound by Devin Griffin! Devin Griffin kicks it out.

[00:58] Team_096 possession (Score: 44-37)
Tyler Haliburton attempts a 3Pt. Contested by Julius Harris (5.0 feet, MAN). Tyler Haliburton misses. Rebound secured by Julius Harris.

[00:45] Team_024 possession (Score: 44-37)
Julius Harris drives, Devin Griffin stays with him. Julius Harris attempts a Layup. Contested by Devin Griffin (5.0 feet, ZONE). Julius Harris misses. Rebound secured by Jarrett Markkanen.

[00:33] Team_096 possession (Score: 44-37)
Tyler Haliburton attempts a Layup. Contested by Julius Harris (5.0 feet, MAN). TYLER HALIBURTON MAKES IT! Assist: Jarrett Markkanen
Score: 44-39

[00:23] Team_024 possession (Score: 44-39)
FOUL! Holding foul on Devin Griffin. [IN THE BONUS! 8 team fouls] Terry Rozier to the line for 2 free throws. (Devin Griffin: 3 personal fouls)   FT 1/2: GOOD   FT 2/2: GOOD Terry Rozier makes 2/2 from the line.
Score: 46-39

[00:09] Team_096 possession (Score: 46-39)
Tyler Haliburton drives and kicks out. Cole Holiday attempts a Midrange. Contested by Zach Durant (3.4 feet, MAN). Cole Holiday misses. Rebound secured by Julius Harris.

================================================================================
                              2ND QUARTER COMPLETE                              
================================================================================

2ND QUARTER SCORE: Team_024 23, Team_096 19

BOX SCORE:
================================================================================

Team_024
--------------------------------------------------------------------------------
Player                MIN  PTS  REB  AST  TO      FG   FG%      3P   3P%
--------------------------------------------------------------------------------
Terry Rozier            9    7    3    1   0   4/5    80.0     0/0   0.0
Zach Durant             9    5    3    0   0   2/2   100.0     0/0   0.0
Bradley Allen          15    3    0    0   0   1/3    33.3     0/0   0.0
Draymond Towns         15    2    2    0   0   1/1   100.0     0/0   0.0
Ja Reaves              15    2    0    0   0   1/1   100.0     0/0   0.0
Julius Harris           9    2    7    0   0   1/3    33.3     0/0   0.0
Anfernee Williamson    15    0    1    0   0   0/1     0.0     0/0   0.0
Zach Fox               15    0    0    1   0   0/0     0.0     0/0   0.0
Victor Simons           9    0    0    0   0   0/1     0.0     0/0   0.0
Vince Irving            9    0    0    0   0   0/2     0.0     0/0   0.0

TEAM: FG: 10/19 (52.6%), 3PT: 3/8 (37.5%), REB: 16 (5 off, 11 def), AST: 2, TO: 2
TEAM FOULS: 6 [Team_096 in BONUS]


Team_096
--------------------------------------------------------------------------------
Player                MIN  PTS  REB  AST  TO      FG   FG%      3P   3P%
--------------------------------------------------------------------------------
Devin Griffin           9    7    3    0   0   3/3   100.0     0/0   0.0
Kyrie Adebayo          15    4    2    0   0   2/4    50.0     0/0   0.0
Tyler Haliburton        9    4    1    0   0   2/5    40.0     0/0   0.0
Cole Holiday            9    2    0    1   0   1/2    50.0     0/0   0.0
Terry Mobley           15    0    0    1   0   0/1     0.0     0/0   0.0
Scottie Herro          15    0    1    0   0   0/0     0.0     0/0   0.0
Jarrett Markkanen       9    0    4    1   0   0/3     0.0     0/0   0.0
Cade Jokic              9    0    0    0   0   0/1     0.0     0/0   0.0

TEAM: FG: 8/19 (42.1%), 3PT: 3/7 (42.9%), REB: 11 (3 off, 8 def), AST: 3, TO: 2
TEAM FOULS: 8 [Team_024 in BONUS]

================================================================================

================================================================================
                       3RD QUARTER - Team_024 vs Team_096                       
================================================================================

[12:00] Team_024 possession (Score: 46-39)
Draymond Towns attempts a 3Pt. Contested by Cole Griffin (2.9 feet, ZONE). Draymond Towns misses. Offensive rebound by Draymond Towns! Draymond Towns puts it back in!
Score: 48-39

[11:46] Team_096 possession (Score: 48-39)
Lamelo Quickley attempts a Layup. Contested by Anfernee Williamson (3.1 feet, ZONE). Lamelo Quickley misses. Offensive rebound by Scottie Herro! Scottie Herro kicks it out.

[11:35] Team_096 possession (Score: 48-39)
Lamelo Quickley attempts a Midrange. Contested by Draymond Towns (3.3 feet, ZONE). Lamelo Quickley misses. Rebound secured by Zach Fox.

[11:20] Team_024 possession (Score: 48-39)
Draymond Towns drives, Kyrie Adebayo stays with him. Draymond Towns attempts a Layup. Contested by Kyrie Adebayo (3.5 feet, MAN). DRAYMOND TOWNS MAKES IT! Assist: Anfernee Williamson
Score: 50-39

[11:09] Team_096 possession (Score: 50-39)
FOUL! Reach-in foul on Anfernee Williamson during the drive. [Team fouls: 1] No free throws, side out. (Anfernee Williamson: 1 personal fouls)

[10:54] Team_096 possession (Score: 50-39)
Terry Mobley attempts a 3Pt. Contested by Ja Reaves (4.6 feet, MAN). Terry Mobley misses. Rebound secured by Zach Fox.

[10:39] Team_024 possession (Score: 50-39)
FOUL! Holding foul on Terry Mobley. [Team fouls: 1] No free throws, side out. (Terry Mobley: 1 personal fouls)

[10:25] Team_024 possession (Score: 50-39)
FOUL! Holding foul on Kyrie Adebayo. [Team fouls: 2] No free throws, side out. (Kyrie Adebayo: 1 personal fouls)

[10:12] Team_024 possession (Score: 50-39)
Zach Fox attempts a 3Pt. Contested by Cole Griffin (3.7 feet, ZONE). Zach Fox misses. Rebound secured by Scottie Herro.

[10:00] Team_096 possession (Score: 50-39)
Terry Mobley drives to the basket... Terry Mobley throws a bad pass! Stolen by Ja Reaves! TURNOVER! (live ball)

[09:49] Team_024 possession (Score: 50-39)
Anfernee Williamson attempts a Midrange. Contested by Scottie Herro (4.8 feet, ZONE). Anfernee Williamson misses. Rebound secured by Scottie Herro.

[09:38] Team_096 possession (Score: 50-39)
Lamelo Quickley attempts a Midrange. Contested by Bradley Allen (3.4 feet, ZONE). LAMELO QUICKLEY MAKES IT! Assist: Terry Mobley
Score: 50-41

[09:23] Team_024 possession (Score: 50-41)
Anfernee Williamson makes the Layup and draws the foul on Scottie Herro! And-1! Anfernee Williamson to the line for 1. [Team fouls: 3] (Scottie Herro: 1 personal fouls)   FT 1/1: GOOD Anfernee Williamson makes 1/1 from the line.
Score: 53-41

[09:05] Team_096 possession (Score: 53-41)
Lamelo Quickley attempts a Midrange. Contested by Zach Fox (3.0 feet, MAN). Lamelo Quickley misses. Offensive rebound by Scottie Herro! Scottie Herro kicks it out.

[08:48] Team_096 possession (Score: 53-41)
FOUL! Holding foul on Anfernee Williamson. [Team fouls: 2] No free throws, side out. (Anfernee Williamson: 2 personal fouls)

[08:35] Team_096 possession (Score: 53-41)
Scottie Herro drives to the basket... Scottie Herro throws a bad pass out of bounds! TURNOVER! (dead ball)

[08:20] Team_024 possession (Score: 53-41)
Bradley Allen attempts a 3Pt. Contested by Cole Griffin (3.3 feet, ZONE). BRADLEY ALLEN MAKES IT! Assist: Zach Fox
Score: 56-41

[08:07] Team_096 possession (Score: 56-41)
Terry Mobley attempts a Layup. Contested by Anfernee Williamson (3.8 feet, ZONE). Terry Mobley misses. Offensive rebound by Scottie Herro! Scottie Herro kicks it out.

[07:55] Team_096 possession (Score: 56-41)
Kyrie Adebayo attempts a Midrange. Contested by Anfernee Williamson (4.3 feet, MAN). Kyrie Adebayo misses. Rebound secured by Anfernee Williamson.

[07:46] Team_024 possession (Score: 56-41)
FOUL! Shooting foul on Terry Mobley. Ja Reaves to the line for 2 free throws. [Team fouls: 4] (Terry Mobley: 2 personal fouls)   FT 1/2: GOOD   FT 2/2: GOOD Ja Reaves makes 2/2 from the line.
Score: 58-41

[07:32] Team_096 possession (Score: 58-41)
Cole Griffin attempts a 3Pt. Contested by Zach Fox (3.8 feet, ZONE). COLE GRIFFIN MAKES IT! Assist: Lamelo Quickley
Score: 58-44

[07:20] Team_024 possession (Score: 58-44)
Anfernee Williamson attempts a Midrange. Contested by Scottie Herro (4.8 feet, ZONE). ANFERNEE WILLIAMSON MAKES IT! Assist: Zach Fox
Score: 60-44

[07:01] Team_096 possession (Score: 60-44)
Scottie Herro attempts a Layup. Contested by Anfernee Williamson (3.7 feet, MAN). Scottie Herro misses. Rebound secured by Zach Fox.

[06:50] Team_024 possession (Score: 60-44)
Ja Reaves attempts a Midrange. Contested by Terry Mobley (4.7 feet, MAN). Ja Reaves misses. Offensive rebound by Draymond Towns! Draymond Towns's putback is no good. Rebound secured by Cole Griffin.

[06:35] Team_096 possession (Score: 60-44)
Kyrie Adebayo attempts a Midrange. Contested by Anfernee Williamson (4.3 feet, MAN). KYRIE ADEBAYO MAKES IT! Assist: Cole Griffin
Score: 60-46

[06:18] Team_024 possession (Score: 60-46)
Zach Fox attempts a Midrange. Contested by Lamelo Quickley (4.3 feet, MAN). Zach Fox misses. Rebound secured by Scottie Herro.

[06:06] Team_096 possession (Score: 60-46)
Terry Mobley drives and kicks out. Scottie Herro attempts a 3Pt. BLOCKED BY ANFERNEE WILLIAMSON! Ball deflects out of bounds off Scottie Herro.

[05:52] Team_024 possession (Score: 60-46)
Ja Reaves drives, Terry Mobley stays with him. Ja Reaves attempts a Layup. Contested by Terry Mobley (4.7 feet, MAN). JA REAVES MAKES IT! Assist: Anfernee Williamson
Score: 62-46

[05:41] Team_096 possession (Score: 62-46)
Lamelo Quickley attempts a Midrange. Contested by Zach Fox (3.0 feet, MAN). Lamelo Quickley misses. Rebound secured by Draymond Towns.

[05:27] Team_024 possession (Score: 62-46)
Anfernee Williamson makes the Layup and draws the foul on Kyrie Adebayo! And-1! Anfernee Williamson to the line for 1. [BONUS: 5 team fouls] (Kyrie Adebayo: 2 personal fouls)   FT 1/1: GOOD Anfernee Williamson makes 1/1 from the line.
Score: 65-46

[05:10] Team_096 possession (Score: 65-46)
Cole Griffin attempts a Layup. Contested by Anfernee Williamson (4.0 feet, ZONE). COLE GRIFFIN MAKES IT!
Score: 65-48

[04:56] Team_024 possession (Score: 65-48)
Ja Reaves drives to the basket... Ja Reaves throws a bad pass out of bounds! TURNOVER! (dead ball)

[04:38] Team_096 possession (Score: 65-48)
Lamelo Quickley makes the Midrange and draws the foul on Zach Fox! And-1! Lamelo Quickley to the line for 1. [Team fouls: 3] (Zach Fox: 1 personal fouls)   FT 1/1: MISS Lamelo Quickley makes 0/1 from the line. Rebound secured by Draymond Towns.
Score: 65-50

[04:24] Team_024 possession (Score: 65-50)
Anfernee Williamson attempts a Midrange. Contested by Lamelo Quickley (3.9 feet, ZONE). ANFERNEE WILLIAMSON MAKES IT! Assist: Draymond Towns
Score: 67-50

[04:06] Team_096 possession (Score: 67-50)
Terry Mobley attempts a 3Pt. Contested by Zach Fox (3.7 feet, ZONE). TERRY MOBLEY MAKES IT! Assist: Scottie Herro
Score: 67-53

[03:53] Team_024 possession (Score: 67-53)
Zach Fox makes the Layup and draws the foul on Kyrie Adebayo! And-1! Zach Fox to the line for 1. [BONUS: 6 team fouls] (Kyrie Adebayo: 3 personal fouls)   FT 1/1: GOOD Zach Fox makes 1/1 from the line.
Score: 70-53

[03:36] Team_096 possession (Score: 70-53)
Kyrie Adebayo attempts a Midrange. Contested by Draymond Towns (4.6 feet, MAN). Kyrie Adebayo misses. Rebound secured by Anfernee Williamson.

[03:18] Team_024 possession (Score: 70-53)
Ja Reaves throws a bad pass! Stolen by Terry Mobley! TURNOVER! (live ball)

[03:04] Team_096 possession (Score: 70-53)
Scottie Herro attempts a 3Pt. Contested by Zach Fox (3.8 feet, ZONE). Scottie Herro misses. Rebound secured by Draymond Towns.

[02:54] Team_024 possession (Score: 70-53)
FOUL! Reach-in foul on Kyrie Adebayo during the drive. [IN THE BONUS! 7 team fouls] Ja Reaves to the line for 2 free throws. (Kyrie Adebayo: 4 personal fouls)   FT 1/2: GOOD   FT 2/2: GOOD Ja Reaves makes 2/2 from the line.
Score: 72-53

[02:43] Team_096 possession (Score: 72-53)
Cole Griffin attempts a 3Pt. Contested by Anfernee Williamson (4.2 feet, ZONE). Cole Griffin misses. Rebound secured by Anfernee Williamson.

[02:31] Team_024 possession (Score: 72-53)
Bradley Allen attempts a Midrange. Contested by Cole Griffin (3.6 feet, ZONE). Bradley Allen misses. Rebound secured by Scottie Herro.

[02:15] Team_096 possession (Score: 72-53)
Terry Mobley attempts a 3Pt. Contested by Zach Fox (3.9 feet, ZONE). Terry Mobley misses. Rebound secured by Anfernee Williamson.

[02:04] Team_024 possession (Score: 72-53)
Bradley Allen attempts a Midrange. Contested by Cole Griffin (3.6 feet, MAN). Bradley Allen misses. Rebound secured by Cole Griffin.

[01:50] Team_096 possession (Score: 72-53)
Kyrie Adebayo drives and kicks out. Cole Griffin attempts a 3Pt. Contested by Zach Fox (3.9 feet, ZONE). Cole Griffin misses. Offensive rebound by Kyrie Adebayo! Kyrie Adebayo puts it back in!
Score: 72-55

[01:36] Team_024 possession (Score: 72-55)
FOUL! Offensive foul on Ja Reaves! Terry Mobley drew the charge! [Team fouls: 4] (Ja Reaves: 1 personal fouls) TURNOVER! (dead ball)

[01:21] Team_096 possession (Score: 72-55)
Scottie Herro attempts a 3Pt. Contested by Bradley Allen (4.3 feet, ZONE). Scottie Herro misses. Rebound secured by Zach Fox.

[01:02] Team_024 possession (Score: 72-55)
Zach Fox drives to the basket... Zach Fox throws a bad pass! Stolen by Lamelo Quickley! TURNOVER! (live ball)

[00:49] Team_096 possession (Score: 72-55)
FOUL! Holding foul on Ja Reaves. [IN THE BONUS! 5 team fouls] Terry Mobley to the line for 2 free throws. (Ja Reaves: 2 personal fouls)   FT 1/2: GOOD   FT 2/2: GOOD Terry Mobley makes 2/2 from the line.
Score: 72-57

[00:35] Team_024 possession (Score: 72-57)
Anfernee Williamson attempts a 3Pt. Contested by Scottie Herro (5.3 feet, MAN). ANFERNEE WILLIAMSON MAKES IT! Assist: Bradley Allen
Score: 75-57

[00:23] Team_096 possession (Score: 75-57)
Terry Mobley attempts a Midrange. Contested by Ja Reaves (5.1 feet, MAN). Terry Mobley misses. Rebound secured by Anfernee Williamson.

[00:08] Team_024 possession (Score: 75-57)
Draymond Towns drives and kicks out. Draymond Towns attempts a Midrange. Contested by Kyrie Adebayo (4.5 feet, MAN). DRAYMOND TOWNS MAKES IT! Assist: Bradley Allen
Score: 77-57

================================================================================
                              3RD QUARTER COMPLETE                              
================================================================================

3RD QUARTER SCORE: Team_024 31, Team_096 18

BOX SCORE:
================================================================================

Team_024
--------------------------------------------------------------------------------
Player                MIN  PTS  REB  AST  TO      FG   FG%      3P   3P%
--------------------------------------------------------------------------------
Anfernee Williamson    27   13    5    2   0   5/6    83.3     0/0   0.0
Draymond Towns         27    6    4    1   0   3/3   100.0     0/0   0.0
Ja Reaves              27    6    0    0   0   3/4    75.0     0/0   0.0
Zach Fox               27    3    4    2   0   1/3    33.3     0/0   0.0
Bradley Allen          27    3    0    2   0   1/3    33.3     0/0   0.0

TEAM: FG: 13/19 (68.4%), 3PT: 3/4 (75.0%), REB: 14 (2 off, 12 def), AST: 7, TO: 4
TEAM FOULS: 5 [Team_096 in BONUS]


Team_096
--------------------------------------------------------------------------------
Player                MIN  PTS  REB  AST  TO      FG   FG%      3P   3P%
--------------------------------------------------------------------------------
Terry Mobley           27    5    0    1   0   2/6    33.3     0/0   0.0
Cole Griffin           27    5    2    1   0   2/3    66.7     0/0   0.0
Kyrie Adebayo          27    4    1    0   0   2/4    50.0     0/0   0.0
Lamelo Quickley        27    2    0    1   0   1/4    25.0     0/0   0.0
Scottie Herro          27    0    7    1   0   0/3     0.0     0/0   0.0

TEAM: FG: 7/20 (35.0%), 3PT: 2/7 (28.6%), REB: 9 (4 off, 5 def), AST: 4, TO: 2
TEAM FOULS: 7 [Team_024 in BONUS]

================================================================================

================================================================================
                       4TH QUARTER - Team_024 vs Team_096                       
================================================================================

[12:00] Substitution (Team_024): Ja Reaves OUT → Victor Simons IN (stamina_rule2)

[12:00] Substitution (Team_024): Zach Fox OUT → Vince Irving IN (stamina_rule2)

[12:00] Substitution (Team_024): Bradley Allen OUT → Zach Durant IN (stamina_rule2)

[12:00] Substitution (Team_024): Anfernee Williamson OUT → Julius Harris IN (stamina_rule2)

[12:00] Substitution (Team_024): Draymond Towns OUT → Terry Rozier IN (stamina_rule2)

[12:00] Substitution (Team_096): Terry Mobley OUT → Cade Jokic IN (stamina_rule2)

[12:00] Substitution (Team_096): Lamelo Quickley OUT → Jarrett Markkanen IN (stamina_rule2)

[12:00] Substitution (Team_096): Cole Griffin OUT → Cole Holiday IN (stamina_rule2)

[12:00] Substitution (Team_096): Scottie Herro OUT → Tyler Haliburton IN (stamina_rule2)

[12:00] Substitution (Team_096): Kyrie Adebayo OUT → Devin Griffin IN (stamina_rule2)

[12:00] Team_024 possession (Score: 77-57)
Zach Fox throws a bad pass out of bounds! TURNOVER! (dead ball)

[11:46] Team_096 possession (Score: 77-57)
Devin Griffin attempts a 3Pt. Contested by Victor Simons (4.0 feet, ZONE). DEVIN GRIFFIN MAKES IT! Assist: Tyler Haliburton
Score: 77-60

[11:33] Team_024 possession (Score: 77-60)
FOUL! Offensive foul on Victor Simons! Cade Jokic drew the charge! [Team fouls: 1] (Victor Simons: 1 personal fouls) TURNOVER! (dead ball)

[11:14] Team_096 possession (Score: 77-60)
Devin Griffin attempts a Midrange. Contested by Terry Rozier (4.1 feet, MAN). Devin Griffin misses. Offensive rebound by Devin Griffin! Devin Griffin kicks it out.

[10:55] Team_096 possession (Score: 77-60)
Tyler Haliburton drives, Terry Rozier stays with him. Tyler Haliburton attempts a Dunk. Contested by Terry Rozier (4.0 feet, ZONE). TYLER HALIBURTON MAKES IT!
Score: 77-62

[10:40] Team_024 possession (Score: 77-62)
Julius Harris attempts a 3Pt. Contested by Tyler Haliburton (5.3 feet, MAN). JULIUS HARRIS MAKES IT! Assist: Zach Durant
Score: 80-62

[10:20] Team_096 possession (Score: 80-62)
Devin Griffin attempts a Midrange. Contested by Terry Rozier (4.1 feet, MAN). Devin Griffin misses. Rebound secured by Julius Harris.

[10:08] Team_024 possession (Score: 80-62)
Vince Irving drives and kicks out. Zach Durant attempts a Midrange. Contested by Tyler Haliburton (5.1 feet, ZONE). ZACH DURANT MAKES IT! Assist: Terry Rozier
Score: 82-62

[09:57] Team_096 possession (Score: 82-62)
Cade Jokic attempts a 3Pt. Contested by Julius Harris (5.0 feet, ZONE). CADE JOKIC MAKES IT! Assist: Devin Griffin
Score: 82-65

[09:40] Team_024 possession (Score: 82-65)
Vince Irving throws a bad pass out of bounds! TURNOVER! (dead ball)

[09:28] Team_096 possession (Score: 82-65)
Cole Holiday drives, picks up Zach Durant. Help arrives from Vince Irving! Cole Holiday attempts a Dunk. Contested by Vince Irving (3.5 feet, MAN). COLE HOLIDAY MAKES IT! Assist: Tyler Haliburton
Score: 82-67

[09:14] Team_024 possession (Score: 82-67)
Victor Simons attempts a 3Pt. Contested by Cade Jokic (5.4 feet, ZONE). Victor Simons misses. Rebound secured by Jarrett Markkanen.

[08:57] Team_096 possession (Score: 82-67)
FOUL! Reach-in foul on Terry Rozier during the drive. [Team fouls: 2] No free throws, side out. (Terry Rozier: 1 personal fouls)

[08:41] Team_096 possession (Score: 82-67)
Jarrett Markkanen loses the ball! Stripped by Vince Irving! TURNOVER! (live ball)

[08:29] Team_024 possession (Score: 82-67)
Julius Harris attempts a Layup. Contested by Devin Griffin (4.9 feet, ZONE). Julius Harris misses. Rebound secured by Tyler Haliburton.

[08:13] Team_096 possession (Score: 82-67)
Tyler Haliburton attempts a 3Pt. Contested by Julius Harris (4.9 feet, MAN). Tyler Haliburton misses. Offensive rebound by Devin Griffin! Devin Griffin kicks it out.

[07:55] Team_096 possession (Score: 82-67)
Devin Griffin drives and kicks out. Cade Jokic attempts a 3Pt. Contested by Victor Simons (3.9 feet, ZONE). Cade Jokic misses. Offensive rebound by Devin Griffin! Devin Griffin kicks it out.

[07:38] Team_096 possession (Score: 82-67)
Tyler Haliburton attempts a Midrange. Contested by Julius Harris (4.9 feet, MAN). Tyler Haliburton misses. Rebound secured by Terry Rozier.

[07:19] Team_024 possession (Score: 82-67)
Vince Irving attempts a 3Pt. Contested by Jarrett Markkanen (4.3 feet, MAN). Vince Irving misses. Rebound secured by Jarrett Markkanen.

[07:04] Team_096 possession (Score: 82-67)
FOUL! Holding foul on Victor Simons. [Team fouls: 3] No free throws, side out. (Victor Simons: 2 personal fouls)

[06:48] Team_096 possession (Score: 82-67)
Cole Holiday drives to the basket... Cole Holiday loses the ball! Stripped by Terry Rozier! TURNOVER! (live ball)

[06:34] Team_024 possession (Score: 82-67)
Terry Rozier attempts a Midrange. Contested by Devin Griffin (5.0 feet, MAN). Terry Rozier misses. FOUL! Loose ball foul on Devin Griffin during the rebound battle. [Team fouls: 1] No free throws, side out. (Devin Griffin: 1 personal fouls)

[06:22] Team_024 possession (Score: 82-67)
Terry Rozier loses control! Ball rolls out of bounds! TURNOVER! (dead ball)

[06:06] Team_096 possession (Score: 82-67)
Cole Holiday attempts a 3Pt. Contested by Victor Simons (4.2 feet, ZONE). Cole Holiday misses. Rebound secured by Terry Rozier.

[05:48] Team_024 possession (Score: 82-67)
FOUL! Reach-in foul on Devin Griffin during the drive. [Team fouls: 2] No free throws, side out. (Devin Griffin: 2 personal fouls)

[05:33] Team_024 possession (Score: 82-67)
Victor Simons makes the Midrange and draws the foul on Cade Jokic! And-1! Victor Simons to the line for 1. [Team fouls: 3] (Cade Jokic: 1 personal fouls)   FT 1/1: GOOD Victor Simons makes 1/1 from the line.
Score: 85-67

[05:16] Team_096 possession (Score: 85-67)
Tyler Haliburton attempts a Midrange. Contested by Julius Harris (4.9 feet, MAN). TYLER HALIBURTON MAKES IT!
Score: 85-69

[04:59] Team_024 possession (Score: 85-69)
FOUL! Reach-in foul on Devin Griffin during the drive. [Team fouls: 4] No free throws, side out. (Devin Griffin: 3 personal fouls)

[04:47] Team_024 possession (Score: 85-69)
Vince Irving attempts a 3Pt. Contested by Cade Jokic (5.4 feet, ZONE). VINCE IRVING MAKES IT! Assist: Zach Durant
Score: 88-69

[04:33] Team_096 possession (Score: 88-69)
Devin Griffin attempts a 3Pt. Contested by Terry Rozier (4.1 feet, MAN). Devin Griffin misses. Rebound secured by Terry Rozier.

[04:15] Team_024 possession (Score: 88-69)
Vince Irving drives, Jarrett Markkanen stays with him. Vince Irving attempts a Dunk. Contested by Jarrett Markkanen (4.3 feet, MAN). Vince Irving misses. Rebound secured by Tyler Haliburton.

[03:59] Team_096 possession (Score: 88-69)
Cade Jokic attempts a Midrange. Contested by Victor Simons (4.0 feet, MAN). CADE JOKIC MAKES IT!
Score: 88-71

[03:45] Team_024 possession (Score: 88-71)
Victor Simons throws a bad pass! Stolen by Cade Jokic! TURNOVER! (live ball)

[03:33] Team_096 possession (Score: 88-71)
Cade Jokic makes the Dunk and draws the foul on Julius Harris! And-1! Cade Jokic to the line for 1. [Team fouls: 4] (Julius Harris: 1 personal fouls)   FT 1/1: MISS Cade Jokic makes 0/1 from the line. Rebound secured by Julius Harris.
Score: 88-73

[03:20] Team_024 possession (Score: 88-73)
Zach Durant attempts a Layup. BLOCKED BY DEVIN GRIFFIN! Ball goes out off Devin Griffin. Zach Durant's ball!

[03:01] Team_024 possession (Score: 88-73)
Terry Rozier attempts a Layup. Contested by Devin Griffin (5.1 feet, ZONE). TERRY ROZIER MAKES IT! Assist: Vince Irving
Score: 90-73

[02:47] Team_096 possession (Score: 90-73)
FOUL! Reach-in foul on Terry Rozier during the drive. [IN THE BONUS! 5 team fouls] Devin Griffin to the line for 2 free throws. (Terry Rozier: 2 personal fouls)   FT 1/2: GOOD   FT 2/2: GOOD Devin Griffin makes 2/2 from the line.
Score: 90-75

[02:36] Team_024 possession (Score: 90-75)
Terry Rozier attempts a Midrange. Contested by Devin Griffin (5.2 feet, MAN). Terry Rozier misses. Rebound secured by Tyler Haliburton.

[02:18] Team_096 possession (Score: 90-75)
FOUL! Holding foul on Julius Harris. [IN THE BONUS! 6 team fouls] Tyler Haliburton to the line for 2 free throws. (Julius Harris: 2 personal fouls)   FT 1/2: GOOD   FT 2/2: GOOD Tyler Haliburton makes 2/2 from the line.
Score: 90-77

[01:58] Team_024 possession (Score: 90-77)
Julius Harris attempts a Layup. Contested by Tyler Haliburton (5.5 feet, MAN). Julius Harris misses. Offensive rebound by Julius Harris! Julius Harris kicks it out.

[01:45] Team_024 possession (Score: 90-77)
Zach Durant attempts a Layup. Contested by Cole Holiday (5.0 feet, MAN). ZACH DURANT MAKES IT! Assist: Terry Rozier
Score: 92-77

[01:34] Team_096 possession (Score: 92-77)
Tyler Haliburton attempts a Layup. Contested by Julius Harris (5.1 feet, MAN). TYLER HALIBURTON MAKES IT! Assist: Cole Holiday
Score: 92-79

[01:18] Team_024 possession (Score: 92-79)
Vince Irving attempts a Layup. BLOCKED BY JARRETT MARKKANEN! Ball is loose! Rebound secured by Jarrett Markkanen.

[01:05] Team_096 possession (Score: 92-79)
Cade Jokic drives to the basket... Cade Jokic commits a violation (traveling/carry)! TURNOVER! (dead ball)

[00:48] Team_024 possession (Score: 92-79)
Terry Rozier attempts a Midrange. Contested by Devin Griffin (5.4 feet, MAN). Terry Rozier misses. Rebound secured by Jarrett Markkanen.

[00:34] Team_096 possession (Score: 92-79)
Devin Griffin attempts a Midrange. Contested by Terry Rozier (4.5 feet, MAN). Devin Griffin misses. Rebound secured by Zach Durant.

[00:16] Team_024 possession (Score: 92-79)
Zach Durant attempts a 3Pt. Contested by Cade Jokic (5.8 feet, ZONE). Zach Durant misses. Rebound secured by Jarrett Markkanen.

[00:03] Team_096 possession (Score: 92-79)
Jarrett Markkanen attempts a Midrange. Contested by Vince Irving (5.0 feet, MAN). JARRETT MARKKANEN MAKES IT! Assist: Tyler Haliburton
Score: 92-81

================================================================================
                              4TH QUARTER COMPLETE                              
================================================================================

4TH QUARTER SCORE: Team_024 15, Team_096 24

BOX SCORE:
================================================================================

Team_024
--------------------------------------------------------------------------------
Player                MIN  PTS  REB  AST  TO      FG   FG%      3P   3P%
--------------------------------------------------------------------------------
Zach Durant            21    4    1    2   0   2/3    66.7     0/0   0.0
Julius Harris          21    3    4    0   0   1/2    50.0     0/0   0.0
Victor Simons          21    3    0    0   0   1/2    50.0     0/0   0.0
Vince Irving           21    3    0    1   0   1/4    25.0     0/0   0.0
Terry Rozier           21    2    3    2   0   1/3    33.3     0/0   0.0

TEAM: FG: 6/14 (42.9%), 3PT: 2/5 (40.0%), REB: 8 (2 off, 6 def), AST: 5, TO: 5
TEAM FOULS: 6 [Team_096 in BONUS]


Team_096
--------------------------------------------------------------------------------
Player                MIN  PTS  REB  AST  TO      FG   FG%      3P   3P%
--------------------------------------------------------------------------------
Tyler Haliburton       21    8    3    3   0   4/5    80.0     0/0   0.0
Devin Griffin          21    5    3    1   0   2/5    40.0     0/0   0.0
Cade Jokic             21    5    0    0   0   2/3    66.7     0/0   0.0
Cole Holiday           21    2    0    1   0   1/2    50.0     0/0   0.0
Jarrett Markkanen      21    2    5    0   0   1/1   100.0     0/0   0.0

TEAM: FG: 10/16 (62.5%), 3PT: 2/4 (50.0%), REB: 11 (3 off, 8 def), AST: 5, TO: 3
TEAM FOULS: 4

================================================================================

================================================================================
                               FULL GAME COMPLETE                               
================================================================================

FINAL SCORE: Team_024 92, Team_096 81

SCORING BY QUARTER:
--------------------------------------------------------------------------------
Team                     Q1     Q2     Q3     Q4    FINAL
--------------------------------------------------------------------------------
Team_024                 23     23     31     15       92
Team_096                 20     19     18     24       81
--------------------------------------------------------------------------------

FULL GAME BOX SCORE:
================================================================================

Team_024
--------------------------------------------------------------------------------
Player                MIN  PTS  REB  AST  TO      FG   FG%      3P   3P%      FT STL BLK
--------------------------------------------------------------------------------
Ja Reaves              28   13    0    1   2   6/10   60.0   1/4    25.0   4/4     2   0
Zach Fox               28    3    8    4   3   1/3    33.3   0/1     0.0   1/1     0   0
Bradley Allen          28   15    0    2   2   6/12   50.0   3/7    42.9   5/6     0   0
Anfernee Williamson    28   15    9    3   0   6/10   60.0   1/2    50.0   2/2     1   2
Draymond Towns         28   15    9    2   1   6/7    85.7   1/1   100.0   1/1     0   0
Victor Simons          21    3    0    0   2   2/4    50.0   1/3    33.3   1/1     0   0
Vince Irving           21    3    0    1   2   3/8    37.5   2/4    50.0   0/0     1   0
Zach Durant            21    9    4    2   0   3/4    75.0   1/2    50.0   2/2     0   0
Julius Harris          21    5   12    0   0   3/6    50.0   1/2    50.0   2/2     0   0
Terry Rozier           21    9    6    3   1   1/4    25.0   0/0     0.0   3/4     1   1

TEAM: FG: 39/70 (55.7%), 3PT: 11/26 (42.3%), REB: 49 (11 off, 38 def), AST: 18, TO: 13


Team_096
--------------------------------------------------------------------------------
Player                MIN  PTS  REB  AST  TO      FG   FG%      3P   3P%      FT STL BLK
--------------------------------------------------------------------------------
Terry Mobley           28    8    0    4   4   2/7    28.6   1/3    33.3   3/3     1   0
Lamelo Quickley        28    8    0    2   0   3/9    33.3   1/1   100.0   1/2     1   0
Cole Griffin           28    7    2    1   0   4/9    44.4   2/6    33.3   0/0     0   0
Scottie Herro          28    2   15    1   1   1/4    25.0   0/2     0.0   0/0     0   1
Kyrie Adebayo          28   14    6    0   1   6/11   54.5   1/1   100.0   2/4     0   0
Cade Jokic             21    5    0    0   1   2/4    50.0   1/1   100.0   0/1     1   0
Jarrett Markkanen      21    2    9    1   1   1/4    25.0   0/2     0.0   0/0     0   1
Cole Holiday           21    4    0    2   1   2/4    50.0   0/2     0.0   1/2     0   0
Tyler Haliburton       21   12    4    3   1   5/9    55.6   0/1     0.0   4/4     0   0
Devin Griffin          21   12    6    1   0   5/8    62.5   3/4    75.0   4/5     0   1

TEAM: FG: 33/72 (45.8%), 3PT: 9/23 (39.1%), REB: 41 (12 off, 29 def), AST: 15, TO: 10

================================================================================
