================================================================================
                        FULL GAME - Team_023 vs Team_019                        
================================================================================

================================================================================
                       1ST QUARTER - Team_023 vs Team_019                       
================================================================================

[12:00] Team_023 possession (Score: 0-0)
Kyle Paul attempts a Midrange. Contested by D'Angelo Randle (3.9 feet, MAN). Kyle Paul misses. Rebound secured by Tobias Hyland.

[11:45] Team_019 possession (Score: 0-0)
Rudy Giddey attempts a 3Pt. Contested by Kyle Paul (3.0 feet, ZONE). RUDY GIDDEY MAKES IT! Assist: Brandon James
Score: 0-3

[11:30] Team_023 possession (Score: 0-3)
Collin Ginobili attempts a 3Pt. Contested by Brandon James (5.6 feet, MAN). COLLIN GINOBILI MAKES IT! Assist: Trae Ingram
Score: 3-3

[11:17] Team_019 possession (Score: 3-3)
Brandon James attempts a Midrange. Contested by Collin Ginobili (4.9 feet, MAN). Brandon James misses. Rebound secured by Josh Morant.

[11:02] Team_023 possession (Score: 3-3)
Kyle Paul loses the ball! Stripped by D'Angelo Randle! TURNOVER! (live ball)

[10:49] Team_019 possession (Score: 3-3)
Brandon James attempts a 3Pt. Contested by Kyle Paul (2.8 feet, ZONE). Brandon James misses. Rebound secured by Kyle Paul.

[10:34] Team_023 possession (Score: 3-3)
Trae Ingram attempts a Midrange. Contested by Tobias Hyland (5.6 feet, ZONE). Trae Ingram misses. Offensive rebound by Tim Bane! Tim Bane's putback is no good. Offensive rebound by Tim Bane! Tim Bane kicks it out.

[10:23] Team_023 possession (Score: 3-3)
Trae Ingram attempts a Midrange. Contested by Rudy Giddey (5.3 feet, MAN). Trae Ingram misses. Rebound secured by D'Angelo Randle.

[10:07] Team_019 possession (Score: 3-3)
DeMar James attempts a 3Pt. Contested by Tim Bane (4.2 feet, MAN). DeMar James misses. Rebound secured by Kyle Paul.

[09:51] Team_023 possession (Score: 3-3)
FOUL! Shooting foul on D'Angelo Randle. Trae Ingram to the line for 2 free throws. [Team fouls: 2] (D'Angelo Randle: 2 personal fouls)   FT 1/2: GOOD   FT 2/2: GOOD Trae Ingram makes 2/2 from the line.
Score: 5-3

[09:37] Team_019 possession (Score: 5-3)
Rudy Giddey drives to the basket... Rudy Giddey throws a bad pass! Stolen by Josh Morant! TURNOVER! (live ball)

[09:24] Team_023 possession (Score: 5-3)
Josh Morant attempts a 3Pt. Contested by D'Angelo Randle (3.8 feet, ZONE). Josh Morant misses. Offensive rebound by Tim Bane! Tim Bane's putback is no good. Rebound secured by D'Angelo Randle.

[09:12] Team_019 possession (Score: 5-3)
FOUL! Shooting foul on Tim Bane. DeMar James to the line for 2 free throws. [Team fouls: 1] (Tim Bane: 1 personal fouls)   FT 1/2: GOOD   FT 2/2: GOOD DeMar James makes 2/2 from the line.
Score: 5-5

[08:56] Team_023 possession (Score: 5-5)
Josh Morant throws a bad pass out of bounds! TURNOVER! (dead ball)

[08:44] Team_019 possession (Score: 5-5)
Brandon James attempts a Midrange. Contested by Collin Ginobili (4.9 feet, MAN). Brandon James misses. Offensive rebound by D'Angelo Randle! D'Angelo Randle puts it back in!
Score: 5-7

[08:28] Team_023 possession (Score: 5-7)
Trae Ingram drives, DeMar James stays with him. Trae Ingram attempts a Layup. Contested by DeMar James (4.2 feet, ZONE). Trae Ingram misses. Rebound secured by D'Angelo Randle.

[08:14] Team_019 possession (Score: 5-7)
DeMar James attempts a Midrange. Contested by Collin Ginobili (5.2 feet, ZONE). DEMAR JAMES MAKES IT! Assist: Tobias Hyland
Score: 5-9

[07:57] Team_023 possession (Score: 5-9)
Collin Ginobili makes the Layup and draws the foul on Brandon James! And-1! Collin Ginobili to the line for 1. [Team fouls: 3] (Brandon James: 1 personal fouls)   FT 1/1: GOOD Collin Ginobili makes 1/1 from the line.
Score: 8-9

[07:45] Team_019 possession (Score: 8-9)
D'Angelo Randle attempts a Layup. Contested by Tim Bane (4.1 feet, ZONE). D'ANGELO RANDLE MAKES IT! Assist: Brandon James
Score: 8-11

[07:29] Team_023 possession (Score: 8-11)
Collin Ginobili throws a bad pass out of bounds! TURNOVER! (dead ball)

[07:12] Team_019 possession (Score: 8-11)
D'Angelo Randle attempts a Midrange. Contested by Kyle Paul (3.0 feet, MAN). D'Angelo Randle misses. Rebound secured by Tim Bane.

[06:59] Team_023 possession (Score: 8-11)
Josh Morant attempts a 3Pt. Contested by D'Angelo Randle (3.8 feet, ZONE). JOSH MORANT MAKES IT! Assist: Collin Ginobili
Score: 11-11

[06:49] Team_019 possession (Score: 11-11)
Rudy Giddey attempts a Midrange. Contested by Trae Ingram (3.6 feet, MAN). RUDY GIDDEY MAKES IT! Assist: D'Angelo Randle
Score: 11-13

[06:34] Team_023 possession (Score: 11-13)
FOUL! Reach-in foul on DeMar James during the drive. [Team fouls: 4] No free throws, side out. (DeMar James: 1 personal fouls)

[06:20] Team_023 possession (Score: 11-13)
Tim Bane drives and kicks out. FOUL! Shooting foul on Rudy Giddey. Collin Ginobili to the line for 2 free throws. [BONUS: 5 team fouls] (Rudy Giddey: 1 personal fouls)   FT 1/2: MISS   FT 2/2: MISS Collin Ginobili makes 0/2 from the line. Rebound secured by DeMar James.

[06:07] Team_019 possession (Score: 11-13)
Rudy Giddey loses control! Ball rolls out of bounds! TURNOVER! (dead ball)

[05:52] Team_023 possession (Score: 11-13)
FOUL! Reach-in foul on DeMar James during the drive. [IN THE BONUS! 6 team fouls] Tim Bane to the line for 2 free throws. (DeMar James: 2 personal fouls)   FT 1/2: GOOD   FT 2/2: GOOD Tim Bane makes 2/2 from the line.
Score: 13-13

[05:36] Team_019 possession (Score: 13-13)
Rudy Giddey drives, picks up Tim Bane. Help arrives from Trae Ingram! Rudy Giddey attempts a Layup. Contested by Trae Ingram (4.1 feet, ZONE). Rudy Giddey misses. Rebound secured by Tim Bane.

[05:21] Team_023 possession (Score: 13-13)
Kyle Paul attempts a Layup. Contested by D'Angelo Randle (4.0 feet, MAN). KYLE PAUL MAKES IT!
Score: 15-13

[05:12] Team_019 possession (Score: 15-13)
FOUL! Reach-in foul on Tim Bane during the drive. [Team fouls: 2] No free throws, side out. (Tim Bane: 2 personal fouls)

[04:58] Team_019 possession (Score: 15-13)
DeMar James attempts a Midrange. Contested by Josh Morant (4.5 feet, ZONE). DEMAR JAMES MAKES IT!
Score: 15-15

[04:43] Team_023 possession (Score: 15-15)
Trae Ingram makes the Layup and draws the foul on DeMar James! And-1! Trae Ingram to the line for 1. [BONUS: 7 team fouls] (DeMar James: 3 personal fouls)   FT 1/1: MISS Trae Ingram makes 0/1 from the line. Rebound secured by Tobias Hyland.
Score: 17-15

[04:24] Team_019 possession (Score: 17-15)
Brandon James drives, Collin Ginobili stays with him. Brandon James attempts a Layup. Contested by Collin Ginobili (5.0 feet, MAN). BRANDON JAMES MAKES IT! Assist: D'Angelo Randle
Score: 17-17

[04:10] Team_023 possession (Score: 17-17)
Tim Bane attempts a Layup. Contested by DeMar James (4.8 feet, MAN). TIM BANE MAKES IT!
Score: 19-17

[03:54] Team_019 possession (Score: 19-17)
D'Angelo Randle drives to the basket... D'Angelo Randle commits a violation (traveling/carry)! TURNOVER! (dead ball)

[03:40] Team_023 possession (Score: 19-17)
FOUL! Holding foul on Rudy Giddey. [IN THE BONUS! 8 team fouls] Trae Ingram to the line for 2 free throws. (Rudy Giddey: 2 personal fouls)   FT 1/2: GOOD   FT 2/2: GOOD Trae Ingram makes 2/2 from the line.
Score: 21-17

[03:29] Team_019 possession (Score: 21-17)
Brandon James throws a bad pass! Stolen by Collin Ginobili! TURNOVER! (live ball)

[03:13] Team_023 possession (Score: 21-17)
Tim Bane makes the Layup and draws the foul on DeMar James! And-1! Tim Bane to the line for 1. [BONUS: 9 team fouls] (DeMar James: 4 personal fouls)   FT 1/1: GOOD Tim Bane makes 1/1 from the line.
Score: 24-17

[02:57] Team_019 possession (Score: 24-17)
DeMar James loses the ball! Stripped by Tim Bane! TURNOVER! (live ball)

[02:42] Team_023 possession (Score: 24-17)
Tim Bane attempts a Midrange. Contested by DeMar James (4.9 feet, ZONE). Tim Bane misses. Rebound secured by Tobias Hyland.

[02:30] Team_019 possession (Score: 24-17)
D'Angelo Randle attempts a Layup. Contested by Tim Bane (4.4 feet, ZONE). D'ANGELO RANDLE MAKES IT!
Score: 24-19

[02:19] Team_023 possession (Score: 24-19)
FOUL! Reach-in foul on DeMar James during the drive. [IN THE BONUS! 10 team fouls] Collin Ginobili to the line for 2 free throws. (DeMar James: 5 personal fouls)   FT 1/2: GOOD   FT 2/2: MISS Collin Ginobili makes 1/2 from the line. Rebound secured by DeMar James.
Score: 25-19

[02:09] Team_019 possession (Score: 25-19)
Rudy Giddey drives, Tim Bane stays with him. Rudy Giddey attempts a Layup. Contested by Tim Bane (4.4 feet, ZONE). Rudy Giddey misses. Rebound secured by Josh Morant.

[01:57] Team_023 possession (Score: 25-19)
Collin Ginobili attempts a 3Pt. Contested by Brandon James (5.9 feet, MAN). Collin Ginobili misses. Rebound secured by DeMar James.

[01:39] Team_019 possession (Score: 25-19)
D'Angelo Randle attempts a Layup. Contested by Kyle Paul (3.5 feet, MAN). D'ANGELO RANDLE MAKES IT! Assist: Brandon James
Score: 25-21

[01:26] Team_023 possession (Score: 25-21)
Josh Morant attempts a Midrange. Wide open! Tobias Hyland is 6.2 feet away. [ZONE] JOSH MORANT MAKES IT! Assist: Collin Ginobili
Score: 27-21

[01:13] Team_019 possession (Score: 27-21)
DeMar James attempts a Layup. Contested by Tim Bane (4.7 feet, ZONE). DEMAR JAMES MAKES IT!
Score: 27-23

[00:56] Team_023 possession (Score: 27-23)
Trae Ingram attempts a 3Pt. Contested by Rudy Giddey (5.6 feet, MAN). TRAE INGRAM MAKES IT! Assist: Kyle Paul
Score: 30-23

[00:44] Team_019 possession (Score: 30-23)
Brandon James attempts a 3Pt. Contested by Trae Ingram (3.9 feet, ZONE). Brandon James misses. Rebound secured by Josh Morant.

[00:28] Team_023 possession (Score: 30-23)
Trae Ingram attempts a 3Pt. Contested by Rudy Giddey (5.6 feet, MAN). Trae Ingram misses. Rebound secured by DeMar James.

[00:14] Team_019 possession (Score: 30-23)
Brandon James attempts a 3Pt. Contested by Collin Ginobili (5.3 feet, MAN). Brandon James misses. Rebound secured by Tim Bane.

================================================================================
                              1ST QUARTER COMPLETE                              
================================================================================

1ST QUARTER SCORE: Team_023 30, Team_019 23

BOX SCORE:
================================================================================

Team_023
--------------------------------------------------------------------------------
Player                MIN  PTS  REB  AST  TO      FG   FG%      3P   3P%
--------------------------------------------------------------------------------
Trae Ingram            12    7    0    1   0   3/7    42.9     0/0   0.0
Tim Bane               12    7    4    0   0   3/5    60.0     0/0   0.0
Collin Ginobili        12    6    0    2   0   2/4    50.0     0/0   0.0
Josh Morant            12    5    3    0   0   2/3    66.7     0/0   0.0
Kyle Paul              12    2    2    1   0   1/2    50.0     0/0   0.0

TEAM: FG: 11/21 (52.4%), 3PT: 3/6 (50.0%), REB: 10 (2 off, 8 def), AST: 4, TO: 3
TEAM FOULS: 2


Team_019
--------------------------------------------------------------------------------
Player                MIN  PTS  REB  AST  TO      FG   FG%      3P   3P%
--------------------------------------------------------------------------------
D'Angelo Randle        12    8    4    2   0   4/5    80.0     0/0   0.0
DeMar James            12    8    4    0   0   4/5    80.0     0/0   0.0
Rudy Giddey            12    5    0    0   0   2/4    50.0     0/0   0.0
Brandon James          12    2    0    3   0   1/5    20.0     0/0   0.0
Tobias Hyland          12    0    3    1   0   0/0     0.0     0/0   0.0

TEAM: FG: 11/19 (57.9%), 3PT: 1/5 (20.0%), REB: 10 (1 off, 9 def), AST: 6, TO: 5
TEAM FOULS: 10 [Team_023 in BONUS]

================================================================================

================================================================================
                       2ND QUARTER - Team_023 vs Team_019                       
================================================================================

[12:00] Team_023 possession (Score: 30-23)
Tim Bane attempts a 3Pt. Contested by DeMar James (5.0 feet, MAN). TIM BANE MAKES IT! Assist: Kyle Paul
Score: 33-23

[11:49] Team_019 possession (Score: 33-23)
Tobias Hyland throws a bad pass! Stolen by Josh Morant! TURNOVER! (live ball)

[11:35] Team_023 possession (Score: 33-23)
Collin Ginobili drives, Brandon James stays with him. Collin Ginobili attempts a Layup. Contested by Brandon James (5.9 feet, MAN). COLLIN GINOBILI MAKES IT!
Score: 35-23

[11:16] Team_019 possession (Score: 35-23)
DeMar James makes the Layup and draws the foul on Tim Bane! And-1! DeMar James to the line for 1. [Team fouls: 1] (Tim Bane: 1 personal fouls)   FT 1/1: GOOD DeMar James makes 1/1 from the line.
Score: 35-26

[11:02] Team_023 possession (Score: 35-26)
Tim Bane makes the Dunk and draws the foul on Brandon James! And-1! Tim Bane to the line for 1. [Team fouls: 1] (Brandon James: 1 personal fouls)   FT 1/1: GOOD Tim Bane makes 1/1 from the line.
Score: 38-26

[10:51] Team_019 possession (Score: 38-26)
DeMar James drives to the basket... FOUL! Offensive foul on DeMar James! Tim Bane drew the charge! [Team fouls: 2] (DeMar James: 1 personal fouls) TURNOVER! (dead ball)

[10:36] Team_023 possession (Score: 38-26)
Josh Morant attempts a Layup. BLOCKED BY DEMAR JAMES! Ball goes out off DeMar James. Josh Morant's ball!

[10:20] Team_023 possession (Score: 38-26)
Tim Bane drives, picks up DeMar James. Help arrives from Brandon James! Tim Bane attempts a Dunk. Contested by Brandon James (5.2 feet, ZONE). TIM BANE MAKES IT! Assist: Kyle Paul
Score: 40-26

[10:04] Team_019 possession (Score: 40-26)
Tobias Hyland attempts a Layup. Contested by Josh Morant (4.6 feet, MAN). TOBIAS HYLAND MAKES IT! Assist: Rudy Giddey
Score: 40-28

[09:49] Team_023 possession (Score: 40-28)
Trae Ingram attempts a 3Pt. Contested by D'Angelo Randle (4.2 feet, ZONE). Trae Ingram misses. Rebound secured by DeMar James.

[09:35] Team_019 possession (Score: 40-28)
Brandon James attempts a 3Pt. Contested by Collin Ginobili (5.4 feet, MAN). Brandon James misses. Rebound secured by Josh Morant.

[09:22] Team_023 possession (Score: 40-28)
FOUL! Holding foul on Brandon James. [Team fouls: 3] No free throws, side out. (Brandon James: 2 personal fouls)

[09:07] Team_023 possession (Score: 40-28)
Trae Ingram commits a violation (traveling/carry)! TURNOVER! (dead ball)

[09:07] Substitution (Team_023): Trae Ingram OUT → Tracy Anthony IN (stamina_rule2)

[09:07] Substitution (Team_023): Collin Ginobili OUT → Magic Booker IN (stamina_rule2)

[09:07] Substitution (Team_023): Kyle Paul OUT → Gary Westbrook IN (stamina_rule2)

[09:07] Substitution (Team_023): Josh Morant OUT → Evan Parker IN (stamina_rule2)

[09:07] Substitution (Team_023): Tim Bane OUT → Vince Gasol IN (stamina_rule2)

[09:07] Substitution (Team_019): Rudy Giddey OUT → Gary Ginobili IN (stamina_rule2)

[09:07] Substitution (Team_019): Brandon James OUT → Jalen Turner IN (stamina_rule2)

[09:07] Substitution (Team_019): D'Angelo Randle OUT → Blake LaVine IN (stamina_rule2)

[09:07] Substitution (Team_019): Tobias Hyland OUT → Shai Ingram IN (stamina_rule2)

[09:07] Substitution (Team_019): DeMar James OUT → Tim Jordan IN (stamina_rule2)

[08:52] Team_019 possession (Score: 40-28)
Tim Jordan attempts a 3Pt. Contested by Tracy Anthony (3.6 feet, ZONE). TIM JORDAN MAKES IT! Assist: Blake LaVine
Score: 40-31

[08:38] Team_023 possession (Score: 40-31)
Magic Booker attempts a 3Pt. Contested by Jalen Turner (3.7 feet, MAN). Magic Booker misses. Rebound secured by Tim Jordan.

[08:24] Team_019 possession (Score: 40-31)
Blake LaVine attempts a 3Pt. Contested by Tracy Anthony (3.7 feet, ZONE). Blake LaVine misses. Rebound secured by Vince Gasol.

[08:12] Team_023 possession (Score: 40-31)
Magic Booker attempts a 3Pt. Contested by Jalen Turner (3.7 feet, MAN). MAGIC BOOKER MAKES IT! Assist: Vince Gasol
Score: 43-31

[07:57] Team_019 possession (Score: 43-31)
Tim Jordan attempts a Midrange. Contested by Vince Gasol (3.6 feet, MAN). Tim Jordan misses. Rebound secured by Vince Gasol.

[07:38] Team_023 possession (Score: 43-31)
Magic Booker drives to the basket... Magic Booker throws a bad pass out of bounds! TURNOVER! (dead ball)

[07:21] Team_019 possession (Score: 43-31)
FOUL! Shooting foul on Evan Parker. Shai Ingram to the line for 3 free throws. [Team fouls: 2] (Evan Parker: 1 personal fouls)   FT 1/3: GOOD   FT 2/3: GOOD   FT 3/3: GOOD Shai Ingram makes 3/3 from the line.
Score: 43-34

[07:07] Team_023 possession (Score: 43-34)
Tracy Anthony attempts a 3Pt. Contested by Gary Ginobili (5.9 feet, MAN). TRACY ANTHONY MAKES IT! Assist: Magic Booker
Score: 46-34

[06:49] Team_019 possession (Score: 46-34)
Tim Jordan drives, Vince Gasol stays with him. Tim Jordan attempts a Layup. Contested by Vince Gasol (3.6 feet, ZONE). Tim Jordan misses. Offensive rebound by Shai Ingram! Shai Ingram kicks it out.

[06:35] Team_019 possession (Score: 46-34)
Blake LaVine attempts a 3Pt. Contested by Gary Westbrook (4.0 feet, MAN). BLAKE LAVINE MAKES IT! Assist: Shai Ingram
Score: 46-37

[06:25] Team_023 possession (Score: 46-37)
Evan Parker drives, picks up Shai Ingram. Help arrives from Jalen Turner! Evan Parker attempts a Layup. Contested by Jalen Turner (4.6 feet, ZONE). EVAN PARKER MAKES IT! Assist: Tracy Anthony
Score: 48-37

[06:10] Team_019 possession (Score: 48-37)
FOUL! Holding foul on Tracy Anthony. [Team fouls: 3] No free throws, side out. (Tracy Anthony: 1 personal fouls)

[05:52] Team_019 possession (Score: 48-37)
Shai Ingram drives to the basket... FOUL! Offensive foul on Shai Ingram! Vince Gasol drew the charge! [Team fouls: 4] (Shai Ingram: 1 personal fouls) TURNOVER! (dead ball)

[05:35] Team_023 possession (Score: 48-37)
Magic Booker attempts a 3Pt. Contested by Jalen Turner (3.7 feet, MAN). Magic Booker misses. Rebound secured by Tim Jordan.

[05:22] Team_019 possession (Score: 48-37)
Shai Ingram attempts a 3Pt. Contested by Gary Westbrook (3.9 feet, ZONE). SHAI INGRAM MAKES IT! Assist: Tim Jordan
Score: 48-40

[05:07] Team_023 possession (Score: 48-40)
Gary Westbrook drives, picks up Shai Ingram. Help arrives from Jalen Turner! Gary Westbrook attempts a Dunk. Contested by Jalen Turner (4.9 feet, ZONE). GARY WESTBROOK MAKES IT! Assist: Magic Booker
Score: 50-40

[04:50] Team_019 possession (Score: 50-40)
Shai Ingram attempts a Midrange. BLOCKED BY EVAN PARKER! Ball deflects out of bounds off Shai Ingram.

[04:35] Team_023 possession (Score: 50-40)
Magic Booker drives, Shai Ingram stays with him. Magic Booker attempts a Layup. Contested by Shai Ingram (4.3 feet, ZONE). MAGIC BOOKER MAKES IT!
Score: 52-40

[04:21] Team_019 possession (Score: 52-40)
Blake LaVine drives and kicks out. Jalen Turner attempts a 3Pt. Contested by Tracy Anthony (3.6 feet, ZONE). Jalen Turner misses. Rebound secured by Gary Westbrook.

[04:05] Team_023 possession (Score: 52-40)
Evan Parker attempts a Layup. Contested by Shai Ingram (4.6 feet, MAN). EVAN PARKER MAKES IT! Assist: Tracy Anthony
Score: 54-40

[03:52] Team_019 possession (Score: 54-40)
Blake LaVine drives, Gary Westbrook stays with him. Blake LaVine attempts a Layup. Contested by Gary Westbrook (4.0 feet, MAN). BLAKE LAVINE MAKES IT! Assist: Shai Ingram
Score: 54-42

[03:39] Team_023 possession (Score: 54-42)
Tracy Anthony attempts a 3Pt. Contested by Blake LaVine (4.8 feet, ZONE). TRACY ANTHONY MAKES IT! Assist: Evan Parker
Score: 57-42

[03:25] Team_019 possession (Score: 57-42)
Blake LaVine attempts a 3Pt. Contested by Tracy Anthony (3.7 feet, ZONE). Blake LaVine misses. Rebound secured by Gary Westbrook.

[03:14] Team_023 possession (Score: 57-42)
Gary Westbrook attempts a Midrange. Contested by Blake LaVine (5.0 feet, MAN). Gary Westbrook misses. Rebound secured by Shai Ingram.

[02:58] Team_019 possession (Score: 57-42)
Tim Jordan attempts a Midrange. Contested by Gary Westbrook (3.9 feet, ZONE). TIM JORDAN MAKES IT!
Score: 57-44

[02:46] Team_023 possession (Score: 57-44)
Tracy Anthony drives to the basket... FOUL! Offensive foul on Tracy Anthony! Shai Ingram drew the charge! [Team fouls: 4] (Tracy Anthony: 2 personal fouls) TURNOVER! (dead ball)

[02:33] Team_019 possession (Score: 57-44)
Gary Ginobili attempts a Midrange. Contested by Magic Booker (4.8 feet, ZONE). Gary Ginobili misses. Rebound secured by Evan Parker.

[02:19] Team_023 possession (Score: 57-44)
Magic Booker attempts a Midrange. Contested by Jalen Turner (3.7 feet, MAN). MAGIC BOOKER MAKES IT! Assist: Vince Gasol
Score: 59-44

[02:09] Team_019 possession (Score: 59-44)
Jalen Turner attempts a Midrange. Contested by Evan Parker (3.3 feet, ZONE). Jalen Turner misses. Offensive rebound by Tim Jordan! Tim Jordan kicks it out.

[01:51] Team_019 possession (Score: 59-44)
Tim Jordan drives, Vince Gasol stays with him. Tim Jordan attempts a Dunk. Contested by Vince Gasol (3.6 feet, ZONE). Tim Jordan misses. Offensive rebound by Tim Jordan! Tim Jordan kicks it out.

[01:35] Team_019 possession (Score: 59-44)
Tim Jordan attempts a 3Pt. Contested by Magic Booker (4.3 feet, ZONE). TIM JORDAN MAKES IT! Assist: Blake LaVine
Score: 59-47

[01:20] Team_023 possession (Score: 59-47)
Magic Booker attempts a 3Pt. Contested by Blake LaVine (4.5 feet, ZONE). Magic Booker misses. Rebound secured by Blake LaVine.

[01:06] Team_019 possession (Score: 59-47)
Jalen Turner attempts a Midrange. Contested by Gary Westbrook (4.2 feet, ZONE). Jalen Turner misses. Offensive rebound by Tim Jordan! Tim Jordan kicks it out.

[00:55] Team_019 possession (Score: 59-47)
Gary Ginobili attempts a 3Pt. Contested by Tracy Anthony (4.2 feet, MAN). Gary Ginobili misses. FOUL! Loose ball foul on Evan Parker during the rebound battle. [IN THE BONUS! 5 team fouls] Shai Ingram to the line for 2 free throws. (Evan Parker: 2 personal fouls)   FT 1/2: GOOD   FT 2/2: MISS Shai Ingram makes 1/2 from the line. Rebound secured by Gary Westbrook.
Score: 59-48

[00:45] Team_023 possession (Score: 59-48)
Gary Westbrook attempts a 3Pt. Contested by Blake LaVine (5.1 feet, MAN). GARY WESTBROOK MAKES IT! Assist: Magic Booker
Score: 62-48

[00:26] Team_019 possession (Score: 62-48)
Jalen Turner attempts a Midrange. Contested by Magic Booker (4.6 feet, MAN). JALEN TURNER MAKES IT!
Score: 62-50

[00:12] Team_023 possession (Score: 62-50)
FOUL! Shooting foul on Shai Ingram. Vince Gasol to the line for 2 free throws. [BONUS: 5 team fouls] (Shai Ingram: 2 personal fouls)   FT 1/2: GOOD   FT 2/2: GOOD Vince Gasol makes 2/2 from the line.
Score: 64-50

================================================================================
                              2ND QUARTER COMPLETE                              
================================================================================

2ND QUARTER SCORE: Team_023 34, Team_019 27

BOX SCORE:
================================================================================

Team_023
--------------------------------------------------------------------------------
Player                MIN  PTS  REB  AST  TO      FG   FG%      3P   3P%
--------------------------------------------------------------------------------
Tim Bane               15    8    0    0   0   3/3   100.0     0/0   0.0
Magic Booker            9    7    0    3   0   3/6    50.0     0/0   0.0
Tracy Anthony           9    6    0    2   0   2/2   100.0     0/0   0.0
Gary Westbrook          9    5    3    0   0   2/3    66.7     0/0   0.0
Evan Parker             9    4    1    1   0   2/2   100.0     0/0   0.0
Collin Ginobili        15    2    0    0   0   1/1   100.0     0/0   0.0
Vince Gasol             9    2    2    2   0   1/1   100.0     0/0   0.0
Kyle Paul              15    0    0    2   0   0/0     0.0     0/0   0.0
Trae Ingram            15    0    0    0   0   0/1     0.0     0/0   0.0
Josh Morant            15    0    1    0   0   0/0     0.0     0/0   0.0

TEAM: FG: 14/19 (73.7%), 3PT: 5/9 (55.6%), REB: 6 (0 off, 6 def), AST: 10, TO: 3
TEAM FOULS: 5 [Team_019 in BONUS]


Team_019
--------------------------------------------------------------------------------
Player                MIN  PTS  REB  AST  TO      FG   FG%      3P   3P%
--------------------------------------------------------------------------------
Tim Jordan              9    8    5    1   0   3/4    75.0     0/0   0.0
Shai Ingram             9    6    2    2   0   2/3    66.7     0/0   0.0
Blake LaVine            9    5    1    2   0   2/5    40.0     0/0   0.0
DeMar James            15    3    1    0   0   1/1   100.0     0/0   0.0
Tobias Hyland          15    2    0    0   0   1/1   100.0     0/0   0.0
Jalen Turner            9    2    0    0   0   1/1   100.0     0/0   0.0
Rudy Giddey            15    0    0    1   0   0/0     0.0     0/0   0.0
Brandon James          15    0    0    0   0   0/1     0.0     0/0   0.0
Gary Ginobili           9    0    0    0   0   0/2     0.0     0/0   0.0

TEAM: FG: 10/18 (55.6%), 3PT: 5/9 (55.6%), REB: 10 (5 off, 5 def), AST: 6, TO: 3
TEAM FOULS: 5 [Team_023 in BONUS]

================================================================================

================================================================================
                       3RD QUARTER - Team_023 vs Team_019                       
================================================================================

[12:00] Team_023 possession (Score: 64-50)
Trae Ingram attempts a Midrange. Contested by Rudy Giddey (5.3 feet, MAN). TRAE INGRAM MAKES IT! Assist: Collin Ginobili
Score: 66-50

[11:48] Team_019 possession (Score: 66-50)
Brandon James attempts a Midrange. Contested by Kyle Paul (2.8 feet, ZONE). Brandon James misses. Rebound secured by Kyle Paul.

[11:33] Team_023 possession (Score: 66-50)
Tim Bane drives and kicks out. FOUL! Shooting foul on Brandon James. Collin Ginobili to the line for 2 free throws. [Team fouls: 1] (Brandon James: 1 personal fouls)   FT 1/2: GOOD   FT 2/2: GOOD Collin Ginobili makes 2/2 from the line.
Score: 68-50

[11:19] Team_019 possession (Score: 68-50)
DeMar James attempts a Layup. Contested by Tim Bane (4.2 feet, ZONE). DeMar James misses. Rebound secured by Josh Morant.

[11:02] Team_023 possession (Score: 68-50)
Trae Ingram attempts a 3Pt. Contested by D'Angelo Randle (3.5 feet, ZONE). Trae Ingram misses. Rebound secured by Tobias Hyland.

[10:44] Team_019 possession (Score: 68-50)
Rudy Giddey drives and kicks out. Brandon James attempts a Midrange. Contested by Collin Ginobili (4.9 feet, MAN). Brandon James misses. Rebound secured by Josh Morant.

[10:30] Team_023 possession (Score: 68-50)
Tim Bane attempts a Midrange. Contested by DeMar James (4.6 feet, MAN). Tim Bane misses. Rebound secured by DeMar James.

[10:19] Team_019 possession (Score: 68-50)
Tobias Hyland attempts a Midrange. Contested by Josh Morant (4.1 feet, ZONE). TOBIAS HYLAND MAKES IT! Assist: Brandon James
Score: 68-52

[10:04] Team_023 possession (Score: 68-52)
Trae Ingram drives, Rudy Giddey stays with him. Trae Ingram attempts a Layup. Contested by Rudy Giddey (5.3 feet, MAN). Trae Ingram misses. Rebound secured by Tobias Hyland.

[09:49] Team_019 possession (Score: 68-52)
FOUL! Offensive foul on Brandon James! Collin Ginobili drew the charge! [Team fouls: 2] (Brandon James: 2 personal fouls) TURNOVER! (dead ball)

[09:35] Team_023 possession (Score: 68-52)
Tim Bane drives to the basket... Tim Bane loses the ball! Stripped by DeMar James! TURNOVER! (live ball)

[09:18] Team_019 possession (Score: 68-52)
D'Angelo Randle attempts a Layup. Contested by Tim Bane (4.1 feet, ZONE). D'Angelo Randle misses. Rebound secured by Josh Morant.

[09:02] Team_023 possession (Score: 68-52)
Trae Ingram drives, DeMar James stays with him. Trae Ingram attempts a Dunk. Contested by DeMar James (4.2 feet, ZONE). TRAE INGRAM MAKES IT! Assist: Kyle Paul
Score: 70-52

[08:43] Team_019 possession (Score: 70-52)
Brandon James attempts a 3Pt. Contested by Collin Ginobili (4.9 feet, MAN). Brandon James misses. Rebound secured by Tim Bane.

[08:27] Team_023 possession (Score: 70-52)
Collin Ginobili attempts a Layup. Contested by DeMar James (4.7 feet, ZONE). Collin Ginobili misses. Offensive rebound by Josh Morant! Josh Morant kicks it out.

[08:11] Team_023 possession (Score: 70-52)
Kyle Paul drives, DeMar James stays with him. Kyle Paul attempts a Layup. Contested by DeMar James (4.6 feet, ZONE). Kyle Paul misses. Rebound secured by DeMar James.

[07:51] Team_019 possession (Score: 70-52)
D'Angelo Randle makes the Layup and draws the foul on Josh Morant! And-1! D'Angelo Randle to the line for 1. [Team fouls: 1] (Josh Morant: 1 personal fouls)   FT 1/1: GOOD D'Angelo Randle makes 1/1 from the line.
Score: 70-55

[07:37] Team_023 possession (Score: 70-55)
Kyle Paul attempts a Midrange. Contested by D'Angelo Randle (3.9 feet, MAN). KYLE PAUL MAKES IT! Assist: Josh Morant
Score: 72-55

[07:23] Team_019 possession (Score: 72-55)
FOUL! Shooting foul on Josh Morant. Tobias Hyland to the line for 2 free throws. [Team fouls: 2] (Josh Morant: 2 personal fouls)   FT 1/2: MISS   FT 2/2: GOOD Tobias Hyland makes 1/2 from the line.
Score: 72-56

[07:12] Team_023 possession (Score: 72-56)
Tim Bane attempts a Midrange. Contested by Brandon James (5.5 feet, ZONE). TIM BANE MAKES IT! Assist: Kyle Paul
Score: 74-56

[06:57] Team_019 possession (Score: 74-56)
FOUL! Shooting foul on Josh Morant. DeMar James to the line for 2 free throws. [Team fouls: 3] (Josh Morant: 3 personal fouls)   FT 1/2: GOOD   FT 2/2: GOOD DeMar James makes 2/2 from the line.
Score: 74-58

[06:44] Team_023 possession (Score: 74-58)
Tim Bane attempts a Layup. Contested by DeMar James (4.6 feet, MAN). TIM BANE MAKES IT!
Score: 76-58

[06:33] Team_019 possession (Score: 76-58)
Tobias Hyland drives and kicks out. Brandon James attempts a 3Pt. Contested by Kyle Paul (2.8 feet, ZONE). Brandon James misses. Rebound secured by Tim Bane.

[06:17] Team_023 possession (Score: 76-58)
Tim Bane attempts a Layup. Contested by DeMar James (4.6 feet, ZONE). TIM BANE MAKES IT! Assist: Collin Ginobili
Score: 78-58

[06:05] Team_019 possession (Score: 78-58)
FOUL! Holding foul on Tim Bane. [Team fouls: 4] No free throws, side out. (Tim Bane: 1 personal fouls)

[05:51] Team_019 possession (Score: 78-58)
Rudy Giddey attempts a Midrange. Contested by Trae Ingram (3.6 feet, MAN). Rudy Giddey misses. Rebound secured by Kyle Paul.

[05:39] Team_023 possession (Score: 78-58)
FOUL! Holding foul on Rudy Giddey. [Team fouls: 3] No free throws, side out. (Rudy Giddey: 1 personal fouls)

[05:29] Team_023 possession (Score: 78-58)
Collin Ginobili attempts a 3Pt. Contested by Brandon James (5.6 feet, MAN). Collin Ginobili misses. Rebound secured by D'Angelo Randle.

[05:15] Team_019 possession (Score: 78-58)
Brandon James drives to the basket... Brandon James commits a violation (traveling/carry)! TURNOVER! (dead ball)

[04:58] Team_023 possession (Score: 78-58)
Josh Morant attempts a Midrange. Contested by Tobias Hyland (5.9 feet, MAN). Josh Morant misses. Offensive rebound by Tim Bane! Tim Bane puts it back in!
Score: 80-58

[04:44] Team_019 possession (Score: 80-58)
Brandon James attempts a Layup. Contested by Tim Bane (3.9 feet, ZONE). BRANDON JAMES MAKES IT! Assist: Tobias Hyland
Score: 80-60

[04:26] Team_023 possession (Score: 80-60)
Kyle Paul throws a bad pass out of bounds! TURNOVER! (dead ball)

[04:16] Team_019 possession (Score: 80-60)
Brandon James attempts a Layup. Contested by Collin Ginobili (5.0 feet, MAN). Brandon James misses. Offensive rebound by D'Angelo Randle! D'Angelo Randle kicks it out.

[04:06] Team_019 possession (Score: 80-60)
DeMar James throws a bad pass out of bounds! TURNOVER! (dead ball)

[03:47] Team_023 possession (Score: 80-60)
Tim Bane throws a bad pass out of bounds! TURNOVER! (dead ball)

[03:30] Team_019 possession (Score: 80-60)
DeMar James drives, Tim Bane stays with him. DeMar James attempts a Layup. Contested by Tim Bane (4.4 feet, MAN). DeMar James misses. Rebound secured by Josh Morant.

[03:15] Team_023 possession (Score: 80-60)
Trae Ingram attempts a 3Pt. Contested by Rudy Giddey (5.4 feet, MAN). Trae Ingram misses. Rebound secured by DeMar James.

[02:59] Team_019 possession (Score: 80-60)
Brandon James attempts a Midrange. Contested by Collin Ginobili (5.0 feet, MAN). BRANDON JAMES MAKES IT! Assist: Tobias Hyland
Score: 80-62

[02:48] Team_023 possession (Score: 80-62)
Josh Morant attempts a Layup. Wide open! Tobias Hyland is 6.0 feet away. [ZONE] JOSH MORANT MAKES IT!
Score: 82-62

[02:35] Team_019 possession (Score: 82-62)
DeMar James drives and kicks out. Rudy Giddey attempts a 3Pt. Contested by Kyle Paul (3.1 feet, ZONE). Rudy Giddey misses. Rebound secured by Josh Morant.

[02:23] Team_023 possession (Score: 82-62)
FOUL! Shooting foul on DeMar James. Collin Ginobili to the line for 2 free throws. [Team fouls: 4] (DeMar James: 1 personal fouls)   FT 1/2: MISS   FT 2/2: GOOD Collin Ginobili makes 1/2 from the line.
Score: 83-62

[02:10] Team_019 possession (Score: 83-62)
Brandon James makes the Layup and draws the foul on Tim Bane! And-1! Brandon James to the line for 1. [BONUS: 5 team fouls] (Tim Bane: 2 personal fouls)   FT 1/1: GOOD Brandon James makes 1/1 from the line.
Score: 83-65

[01:51] Team_023 possession (Score: 83-65)
Trae Ingram attempts a Midrange. Contested by Rudy Giddey (5.5 feet, MAN). TRAE INGRAM MAKES IT! Assist: Tim Bane
Score: 85-65

[01:37] Team_019 possession (Score: 85-65)
Brandon James attempts a 3Pt. Contested by Collin Ginobili (5.2 feet, MAN). BRANDON JAMES MAKES IT! Assist: DeMar James
Score: 85-68

[01:22] Team_023 possession (Score: 85-68)
Josh Morant attempts a 3Pt. Wide open! Tobias Hyland is 6.2 feet away. [MAN] JOSH MORANT MAKES IT! Assist: Tim Bane
Score: 88-68

[01:06] Team_019 possession (Score: 88-68)
Brandon James attempts a Midrange. Contested by Kyle Paul (3.3 feet, ZONE). BRANDON JAMES MAKES IT!
Score: 88-70

[00:50] Team_023 possession (Score: 88-70)
Collin Ginobili attempts a Layup. Contested by Brandon James (5.9 feet, MAN). Collin Ginobili misses. Rebound secured by DeMar James.

[00:40] Team_019 possession (Score: 88-70)
Brandon James attempts a Layup. Contested by Collin Ginobili (5.3 feet, MAN). BRANDON JAMES MAKES IT!
Score: 88-72

[00:26] Team_023 possession (Score: 88-72)
Tim Bane attempts a Midrange. Wide open! Tobias Hyland is 6.5 feet away. [ZONE] Tim Bane misses. Rebound secured by DeMar James.

[00:12] Team_019 possession (Score: 88-72)
Rudy Giddey attempts a Layup. Contested by Tim Bane (4.6 feet, ZONE). Rudy Giddey misses. Rebound secured by Kyle Paul.

[00:01] Team_023 possession (Score: 88-72)
Josh Morant drives and kicks out. Collin Ginobili attempts a Midrange. Wide open! Tobias Hyland is 6.2 feet away. [ZONE] COLLIN GINOBILI MAKES IT! Assist: Kyle Paul
Score: 90-72

================================================================================
                              3RD QUARTER COMPLETE                              
================================================================================

3RD QUARTER SCORE: Team_023 26, Team_019 22

BOX SCORE:
================================================================================

Team_023
--------------------------------------------------------------------------------
Player                MIN  PTS  REB  AST  TO      FG   FG%      3P   3P%
--------------------------------------------------------------------------------
Tim Bane               27    8    3    2   0   4/6    66.7     0/0   0.0
Trae Ingram            27    6    0    0   0   3/6    50.0     0/0   0.0
Collin Ginobili        27    5    0    2   0   3/5    60.0     0/0   0.0
Josh Morant            27    5    6    1   0   2/2   100.0     0/0   0.0
Kyle Paul              27    2    3    3   0   1/2    50.0     0/0   0.0

TEAM: FG: 13/21 (61.9%), 3PT: 1/4 (25.0%), REB: 12 (2 off, 10 def), AST: 8, TO: 3
TEAM FOULS: 5 [Team_019 in BONUS]


Team_019
--------------------------------------------------------------------------------
Player                MIN  PTS  REB  AST  TO      FG   FG%      3P   3P%
--------------------------------------------------------------------------------
Brandon James          27   14    0    1   0   6/8    75.0     0/0   0.0
Tobias Hyland          27    3    2    2   0   2/3    66.7     0/0   0.0
D'Angelo Randle        27    3    2    0   0   1/2    50.0     0/0   0.0
DeMar James            27    2    5    1   0   1/4    25.0     0/0   0.0
Rudy Giddey            27    0    0    0   0   0/3     0.0     0/0   0.0

TEAM: FG: 10/20 (50.0%), 3PT: 1/2 (50.0%), REB: 9 (1 off, 8 def), AST: 4, TO: 3
TEAM FOULS: 4

================================================================================

================================================================================
                       4TH QUARTER - Team_023 vs Team_019                       
================================================================================

[12:00] Team_023 possession (Score: 90-72)
Collin Ginobili attempts a Midrange. Contested by Brandon James (5.9 feet, ZONE). Collin Ginobili misses. Offensive rebound by Tim Bane! Tim Bane puts it back in!
Score: 92-72

[11:46] Team_019 possession (Score: 92-72)
DeMar James drives, picks up Tim Bane. Help arrives from Trae Ingram! DeMar James attempts a Dunk. Contested by Trae Ingram (4.6 feet, ZONE). DEMAR JAMES MAKES IT!
Score: 92-74

[11:28] Team_023 possession (Score: 92-74)
FOUL! Holding foul on DeMar James. [Team fouls: 1] No free throws, side out. (DeMar James: 1 personal fouls)

[11:16] Team_023 possession (Score: 92-74)
Collin Ginobili attempts a 3Pt. Contested by D'Angelo Randle (4.5 feet, ZONE). Collin Ginobili misses. Offensive rebound by Josh Morant! Josh Morant kicks it out.

[11:05] Team_023 possession (Score: 92-74)
Trae Ingram drives, picks up Rudy Giddey. Help arrives from D'Angelo Randle! Trae Ingram attempts a Dunk. Contested by D'Angelo Randle (5.6 feet, MAN). TRAE INGRAM MAKES IT! Assist: Tim Bane
Score: 94-74

[10:50] Team_019 possession (Score: 94-74)
Rudy Giddey throws a bad pass! Stolen by Trae Ingram! TURNOVER! (live ball)

[10:38] Team_023 possession (Score: 94-74)
Trae Ingram attempts a 3Pt. Contested by Rudy Giddey (5.6 feet, MAN). TRAE INGRAM MAKES IT! Assist: Josh Morant
Score: 97-74

[10:24] Team_019 possession (Score: 97-74)
Tobias Hyland attempts a Layup. BLOCKED BY TIM BANE! Ball is loose! Rebound secured by Josh Morant.

[10:08] Team_023 possession (Score: 97-74)
Josh Morant drives and kicks out. Josh Morant attempts a 3Pt. Contested by D'Angelo Randle (4.3 feet, ZONE). Josh Morant misses. Rebound secured by DeMar James.

[09:55] Team_019 possession (Score: 97-74)
D'Angelo Randle drives, picks up Tim Bane. Help arrives from Trae Ingram! D'Angelo Randle attempts a Layup. Contested by Trae Ingram (4.7 feet, ZONE). D'Angelo Randle misses. Rebound secured by Josh Morant.

[09:43] Team_023 possession (Score: 97-74)
Collin Ginobili attempts a 3Pt. Contested by D'Angelo Randle (4.8 feet, ZONE). Collin Ginobili misses. Rebound secured by Tobias Hyland.

[09:29] Team_019 possession (Score: 97-74)
Tobias Hyland attempts a 3Pt. Contested by Trae Ingram (4.1 feet, ZONE). Tobias Hyland misses. Rebound secured by Josh Morant.

[09:14] Team_023 possession (Score: 97-74)
Trae Ingram attempts a Midrange. Contested by Rudy Giddey (5.8 feet, MAN). TRAE INGRAM MAKES IT!
Score: 99-74

[08:56] Team_019 possession (Score: 99-74)
Brandon James drives to the basket... FOUL! Offensive foul on Brandon James! Collin Ginobili drew the charge! [Team fouls: 2] (Brandon James: 1 personal fouls) TURNOVER! (dead ball)

[08:41] Team_023 possession (Score: 99-74)
Kyle Paul drives, picks up D'Angelo Randle. Help arrives from Brandon James! Kyle Paul attempts a Layup. Contested by Brandon James (4.7 feet, MAN). KYLE PAUL MAKES IT!
Score: 101-74

[08:25] Team_019 possession (Score: 101-74)
FOUL! Reach-in foul on Tim Bane during the drive. [Team fouls: 1] No free throws, side out. (Tim Bane: 1 personal fouls)

[08:12] Team_019 possession (Score: 101-74)
Brandon James drives, Collin Ginobili stays with him. Brandon James attempts a Dunk. Contested by Collin Ginobili (5.5 feet, MAN). BRANDON JAMES MAKES IT! Assist: Tobias Hyland
Score: 101-76

[07:59] Team_023 possession (Score: 101-76)
Collin Ginobili attempts a 3Pt. Wide open! Brandon James is 6.2 feet away. [MAN] Collin Ginobili misses. Rebound secured by D'Angelo Randle.

[07:44] Team_019 possession (Score: 101-76)
D'Angelo Randle attempts a 3Pt. Contested by Trae Ingram (4.5 feet, ZONE). D'Angelo Randle misses. Rebound secured by Tim Bane.

[07:30] Team_023 possession (Score: 101-76)
Collin Ginobili drives and kicks out. Kyle Paul attempts a Midrange. Contested by Brandon James (6.0 feet, ZONE). Kyle Paul misses. Rebound secured by D'Angelo Randle.

[07:15] Team_019 possession (Score: 101-76)
DeMar James drives, picks up Tim Bane. Help arrives from Trae Ingram! DeMar James attempts a Dunk. Contested by Trae Ingram (5.2 feet, MAN). DEMAR JAMES MAKES IT! Assist: Rudy Giddey
Score: 101-78

[07:03] Team_023 possession (Score: 101-78)
Josh Morant attempts a Layup. Contested by DeMar James (5.4 feet, ZONE). Josh Morant misses. Offensive rebound by Tim Bane! Tim Bane kicks it out.

[06:50] Team_023 possession (Score: 101-78)
Trae Ingram attempts a 3Pt. Wide open! Rudy Giddey is 6.0 feet away. [MAN] Trae Ingram misses. Rebound secured by Tobias Hyland.

[06:37] Team_019 possession (Score: 101-78)
FOUL! Shooting foul on Trae Ingram. D'Angelo Randle to the line for 2 free throws. [Team fouls: 2] (Trae Ingram: 1 personal fouls)   FT 1/2: GOOD   FT 2/2: GOOD D'Angelo Randle makes 2/2 from the line.
Score: 101-80

[06:25] Team_023 possession (Score: 101-80)
FOUL! Reach-in foul on DeMar James during the drive. [Team fouls: 3] No free throws, side out. (DeMar James: 2 personal fouls)

[06:08] Team_023 possession (Score: 101-80)
Tim Bane drives, DeMar James stays with him. Tim Bane attempts a Layup. Contested by DeMar James (5.8 feet, ZONE). TIM BANE MAKES IT!
Score: 103-80

[05:53] Team_019 possession (Score: 103-80)
D'Angelo Randle attempts a 3Pt. Contested by Kyle Paul (4.4 feet, MAN). D'ANGELO RANDLE MAKES IT! Assist: Rudy Giddey
Score: 103-83

[05:39] Team_023 possession (Score: 103-83)
Tim Bane attempts a Layup. Contested by DeMar James (5.8 feet, MAN). Tim Bane misses. FOUL! Loose ball foul on DeMar James during the rebound battle. [Team fouls: 4] No free throws, side out. (DeMar James: 3 personal fouls)

[05:28] Team_023 possession (Score: 103-83)
Josh Morant attempts a Layup. Wide open! Tobias Hyland is 6.9 feet away. [MAN] JOSH MORANT MAKES IT! Assist: Collin Ginobili
Score: 105-83

[05:11] Team_019 possession (Score: 105-83)
Tobias Hyland attempts a Midrange. Contested by Josh Morant (5.2 feet, MAN). TOBIAS HYLAND MAKES IT!
Score: 105-85

[04:58] Team_023 possession (Score: 105-85)
Kyle Paul makes the Dunk and draws the foul on DeMar James! And-1! Kyle Paul to the line for 1. [BONUS: 5 team fouls] (DeMar James: 4 personal fouls)   FT 1/1: GOOD Kyle Paul makes 1/1 from the line.
Score: 108-85

[04:43] Team_019 possession (Score: 108-85)
D'Angelo Randle attempts a 3Pt. Contested by Kyle Paul (4.6 feet, MAN). D'Angelo Randle misses. Rebound secured by Tim Bane.

[04:31] Team_023 possession (Score: 108-85)
Tim Bane attempts a Layup. Wide open! DeMar James is 6.0 feet away. [MAN] TIM BANE MAKES IT! Assist: Josh Morant
Score: 110-85

[04:14] Team_019 possession (Score: 110-85)
DeMar James makes the Layup and draws the foul on Tim Bane! And-1! DeMar James to the line for 1. [Team fouls: 3] (Tim Bane: 2 personal fouls)   FT 1/1: MISS DeMar James makes 0/1 from the line. Rebound secured by Kyle Paul.
Score: 110-87

[03:57] Team_023 possession (Score: 110-87)
Josh Morant drives to the basket... FOUL! Offensive foul on Josh Morant! Tobias Hyland drew the charge! [Team fouls: 4] (Josh Morant: 1 personal fouls) TURNOVER! (dead ball)

[03:45] Team_019 possession (Score: 110-87)
Rudy Giddey drives to the basket... Rudy Giddey loses control! Ball rolls out of bounds! TURNOVER! (dead ball)

[03:45] Substitution (Team_023): Trae Ingram OUT → Tracy Anthony IN (stamina_rule2)

[03:45] Substitution (Team_023): Collin Ginobili OUT → Magic Booker IN (stamina_rule2)

[03:45] Substitution (Team_023): Kyle Paul OUT → Gary Westbrook IN (stamina_rule2)

[03:45] Substitution (Team_023): Josh Morant OUT → Evan Parker IN (stamina_rule2)

[03:45] Substitution (Team_023): Tim Bane OUT → Vince Gasol IN (stamina_rule2)

[03:45] Substitution (Team_019): Rudy Giddey OUT → Gary Ginobili IN (stamina_rule2)

[03:45] Substitution (Team_019): Brandon James OUT → Jalen Turner IN (stamina_rule2)

[03:45] Substitution (Team_019): D'Angelo Randle OUT → Blake LaVine IN (stamina_rule2)

[03:45] Substitution (Team_019): Tobias Hyland OUT → Shai Ingram IN (stamina_rule2)

[03:45] Substitution (Team_019): DeMar James OUT → Tim Jordan IN (stamina_rule2)

[03:35] Team_023 possession (Score: 110-87)
Magic Booker drives and kicks out. Magic Booker attempts a 3Pt. Contested by Blake LaVine (4.7 feet, ZONE). Magic Booker misses. Offensive rebound by Evan Parker! Evan Parker puts it back in!
Score: 112-87

[03:18] Team_019 possession (Score: 112-87)
FOUL! Shooting foul on Vince Gasol. Tim Jordan to the line for 2 free throws. [BONUS: 5 team fouls] (Vince Gasol: 1 personal fouls)   FT 1/2: GOOD   FT 2/2: MISS Tim Jordan makes 1/2 from the line. Rebound secured by Evan Parker.
Score: 112-88

[03:03] Team_023 possession (Score: 112-88)
Evan Parker attempts a 3Pt. Contested by Blake LaVine (4.8 feet, ZONE). EVAN PARKER MAKES IT! Assist: Tracy Anthony
Score: 115-88

[02:50] Team_019 possession (Score: 115-88)
Gary Ginobili attempts a Midrange. Contested by Tracy Anthony (4.1 feet, MAN). GARY GINOBILI MAKES IT! Assist: Shai Ingram
Score: 115-90

[02:31] Team_023 possession (Score: 115-90)
Evan Parker attempts a 3Pt. Contested by Blake LaVine (4.8 feet, ZONE). Evan Parker misses. Rebound secured by Shai Ingram.

[02:19] Team_019 possession (Score: 115-90)
Shai Ingram attempts a Midrange. Contested by Evan Parker (3.0 feet, MAN). Shai Ingram misses. Offensive rebound by Shai Ingram! Shai Ingram kicks it out.

[02:08] Team_019 possession (Score: 115-90)
Tim Jordan attempts a Midrange. Contested by Vince Gasol (3.6 feet, MAN). TIM JORDAN MAKES IT!
Score: 115-92

[01:53] Team_023 possession (Score: 115-92)
Tracy Anthony attempts a 3Pt. Contested by Gary Ginobili (5.9 feet, MAN). Tracy Anthony misses. Rebound secured by Shai Ingram.

[01:38] Team_019 possession (Score: 115-92)
Jalen Turner drives, Magic Booker stays with him. Jalen Turner attempts a Dunk. Contested by Magic Booker (4.5 feet, MAN). JALEN TURNER MAKES IT!
Score: 115-94

[01:26] Team_023 possession (Score: 115-94)
Evan Parker attempts a Midrange. Contested by Jalen Turner (4.0 feet, ZONE). EVAN PARKER MAKES IT! Assist: Tracy Anthony
Score: 117-94

[01:10] Team_019 possession (Score: 117-94)
Blake LaVine drives and kicks out. Jalen Turner attempts a 3Pt. Contested by Tracy Anthony (3.6 feet, ZONE). Jalen Turner misses. FOUL! Loose ball foul on Gary Westbrook during the rebound battle. [IN THE BONUS! 6 team fouls] Shai Ingram to the line for 2 free throws. (Gary Westbrook: 1 personal fouls)   FT 1/2: GOOD   FT 2/2: MISS Shai Ingram makes 1/2 from the line. Rebound secured by Vince Gasol.
Score: 117-95

[00:56] Team_023 possession (Score: 117-95)
Gary Westbrook drives and kicks out. Vince Gasol attempts a 3Pt. Contested by Shai Ingram (4.5 feet, MAN). Vince Gasol misses. Rebound secured by Shai Ingram.

[00:43] Team_019 possession (Score: 117-95)
Jalen Turner drives and kicks out. Shai Ingram attempts a Midrange. Contested by Evan Parker (3.0 feet, MAN). Shai Ingram misses. Rebound secured by Evan Parker.

[00:27] Team_023 possession (Score: 117-95)
Vince Gasol drives to the basket... Vince Gasol loses the ball! Stripped by Shai Ingram! TURNOVER! (live ball)

[00:16] Team_019 possession (Score: 117-95)
Tim Jordan makes the Midrange and draws the foul on Evan Parker! And-1! Tim Jordan to the line for 1. [BONUS: 7 team fouls] (Evan Parker: 1 personal fouls)   FT 1/1: MISS Tim Jordan makes 0/1 from the line. Rebound secured by Evan Parker.
Score: 117-97

[00:04] Team_023 possession (Score: 117-97)
Gary Westbrook attempts a 3Pt. Contested by Blake LaVine (5.0 feet, MAN). Gary Westbrook misses. Rebound secured by Blake LaVine.

================================================================================
                              4TH QUARTER COMPLETE                              
================================================================================

4TH QUARTER SCORE: Team_023 27, Team_019 25

BOX SCORE:
================================================================================

Team_023
--------------------------------------------------------------------------------
Player                MIN  PTS  REB  AST  TO      FG   FG%      3P   3P%
--------------------------------------------------------------------------------
Trae Ingram            36    7    0    0   0   3/4    75.0     0/0   0.0
Evan Parker            13    7    4    0   0   3/4    75.0     0/0   0.0
Tim Bane               36    6    4    1   0   3/3   100.0     0/0   0.0
Kyle Paul              36    5    1    0   0   2/2   100.0     0/0   0.0
Josh Morant            36    2    5    2   0   1/2    50.0     0/0   0.0
Collin Ginobili        36    0    0    1   0   0/3     0.0     0/0   0.0
Tracy Anthony          13    0    0    2   0   0/1     0.0     0/0   0.0
Gary Westbrook         13    0    0    0   0   0/2     0.0     0/0   0.0

TEAM: FG: 12/21 (57.1%), 3PT: 2/8 (25.0%), REB: 14 (5 off, 9 def), AST: 6, TO: 2
TEAM FOULS: 7 [Team_019 in BONUS]


Team_019
--------------------------------------------------------------------------------
Player                MIN  PTS  REB  AST  TO      FG   FG%      3P   3P%
--------------------------------------------------------------------------------
D'Angelo Randle        36    5    2    0   0   2/5    40.0     0/0   0.0
DeMar James            36    4    1    0   0   2/3    66.7     0/0   0.0
Tobias Hyland          36    2    2    1   0   1/3    33.3     0/0   0.0
Brandon James          36    2    0    0   0   1/1   100.0     0/0   0.0
Tim Jordan             13    2    0    0   0   1/3    33.3     0/0   0.0
Gary Ginobili          13    2    0    0   0   1/1   100.0     0/0   0.0
Jalen Turner           13    2    0    0   0   1/2    50.0     0/0   0.0
Rudy Giddey            36    0    0    2   0   0/0     0.0     0/0   0.0
Shai Ingram            13    0    4    1   0   0/0     0.0     0/0   0.0
Blake LaVine           13    0    1    0   0   0/1     0.0     0/0   0.0
Vince Gasol            13    0    1    0   0   0/0     0.0     0/0   0.0

TEAM: FG: 9/19 (47.4%), 3PT: 1/4 (25.0%), REB: 11 (2 off, 9 def), AST: 4, TO: 3
TEAM FOULS: 5 [Team_023 in BONUS]

================================================================================

================================================================================
                               FULL GAME COMPLETE                               
================================================================================

FINAL SCORE: Team_023 117, Team_019 97

SCORING BY QUARTER:
--------------------------------------------------------------------------------
Team                     Q1     Q2     Q3     Q4    FINAL
--------------------------------------------------------------------------------
Team_023                 30     34     26     27      117
Team_019                 23     27     22     25       97
--------------------------------------------------------------------------------

FULL GAME BOX SCORE:
================================================================================

Team_023
--------------------------------------------------------------------------------
Player                MIN  PTS  REB  AST  TO      FG   FG%      3P   3P%      FT STL BLK
--------------------------------------------------------------------------------
Trae Ingram            36   20    0    1   1   8/17   47.1   2/7    28.6   4/5     1   0
Collin Ginobili        36   13    0    5   1   5/12   41.7   1/5    20.0   5/9     1   0
Kyle Paul              36    9    6    6   4   4/6    66.7   0/0     0.0   1/1     0   0
Josh Morant            36   12   15    3   1   7/9    77.8   2/3    66.7   0/0     2   0
Tim Bane               36   29   11    3   1  12/16   75.0   1/1   100.0   4/4     1   1
Tracy Anthony          13    6    0    4   0   2/3    66.7   2/3    66.7   0/0     0   0
Magic Booker           13    7    0    3   1   4/7    57.1   1/4    25.0   0/0     0   0
Gary Westbrook         13    5    3    0   0   2/5    40.0   1/2    50.0   0/0     0   0
Evan Parker            13   11    5    1   2   4/5    80.0   1/2    50.0   0/0     0   1
Vince Gasol            13    2    3    2   0   1/1   100.0   0/0     0.0   2/2     0   0

TEAM: FG: 50/82 (61.0%), 3PT: 11/27 (40.7%), REB: 42 (9 off, 33 def), AST: 28, TO: 11


Team_019
--------------------------------------------------------------------------------
Player                MIN  PTS  REB  AST  TO      FG   FG%      3P   3P%      FT STL BLK
--------------------------------------------------------------------------------
Rudy Giddey            36    5    0    3   4   2/7    28.6   1/1   100.0   0/0     0   0
Brandon James          36   18    0    4   2   9/16   56.2   1/6    16.7   1/1     0   0
D'Angelo Randle        36   16    8    2   2   6/11   54.5   1/3    33.3   3/3     1   0
Tobias Hyland          36    7    7    4   1   4/7    57.1   0/1     0.0   1/2     0   0
DeMar James            36   17   11    1   4   8/13   61.5   0/1     0.0   5/6     1   1
Gary Ginobili          13    2    0    0   0   1/3    33.3   0/1     0.0   0/0     0   0
Jalen Turner           13    4    0    0   1   2/3    66.7   0/0     0.0   0/0     0   0
Blake LaVine           13    5    2    2   0   2/6    33.3   1/3    33.3   0/0     0   0
Shai Ingram            13    6    6    3   0   2/3    66.7   2/2   100.0   5/7     1   0
Tim Jordan             13   10    5    1   0   4/7    57.1   2/2   100.0   1/3     0   0

TEAM: FG: 40/76 (52.6%), 3PT: 8/20 (40.0%), REB: 40 (9 off, 31 def), AST: 20, TO: 14

================================================================================
