================================================================================
                        FULL GAME - Team_094 vs Team_003                        
================================================================================

================================================================================
                       1ST QUARTER - Team_094 vs Team_003                       
================================================================================

[12:00] Team_094 possession (Score: 0-0)
Kobe Wagner drives, Giannis Turner stays with him. Kobe Wagner attempts a Dunk. Contested by Giannis Turner (3.2 feet, ZONE). Kobe Wagner misses. Rebound secured by Victor O'Neal.

[11:45] Team_003 possession (Score: 0-0)
Rudy Haliburton attempts a 3Pt. Contested by Kobe Wagner (4.2 feet, MAN). Rudy Haliburton misses. Rebound secured by Kobe Bryant.

[11:27] Team_094 possession (Score: 0-0)
Kobe Bryant drives and kicks out. Tim Russell attempts a Midrange. Contested by Giannis Turner (2.8 feet, MAN). TIM RUSSELL MAKES IT!
Score: 2-0

[11:08] Team_003 possession (Score: 2-0)
Victor O'Neal drives and kicks out. Rudy Haliburton attempts a 3Pt. Contested by Kobe Wagner (4.1 feet, MAN). Rudy Haliburton misses. Rebound secured by Kobe Bryant.

[10:57] Team_094 possession (Score: 2-0)
Tim Russell attempts a Layup. Contested by Giannis Turner (3.0 feet, ZONE). TIM RUSSELL MAKES IT!
Score: 4-0

[10:46] Team_003 possession (Score: 4-0)
Ayo Jackson drives and kicks out. Nikola Bryant attempts a 3Pt. Contested by Lauri Thompson (4.8 feet, ZONE). Nikola Bryant misses. Offensive rebound by Rudy Haliburton! Rudy Haliburton puts it back in!
Score: 4-2

[10:35] Team_094 possession (Score: 4-2)
Lauri Thompson attempts a 3Pt. Contested by Nikola Bryant (4.4 feet, ZONE). Lauri Thompson misses. Rebound secured by Giannis Turner.

[10:20] Team_003 possession (Score: 4-2)
Victor O'Neal makes the Layup and draws the foul on Kobe Bryant! And-1! Victor O'Neal to the line for 1. [Team fouls: 1] (Kobe Bryant: 1 personal fouls)   FT 1/1: GOOD Victor O'Neal makes 1/1 from the line.
Score: 4-5

[10:06] Team_094 possession (Score: 4-5)
Lauri Thompson attempts a Layup. BLOCKED BY GIANNIS TURNER! Ball deflects out of bounds off Lauri Thompson.

[09:51] Team_003 possession (Score: 4-5)
Ayo Jackson throws a bad pass! Stolen by Terry Ingram! TURNOVER! (live ball)

[09:32] Team_094 possession (Score: 4-5)
Tim Russell makes the Layup and draws the foul on Giannis Turner! And-1! Tim Russell to the line for 1. [Team fouls: 1] (Giannis Turner: 1 personal fouls)   FT 1/1: MISS Tim Russell makes 0/1 from the line. Offensive rebound by Tim Russell! Tim Russell kicks it out.
Score: 6-5

[09:16] Team_094 possession (Score: 6-5)
Kobe Bryant drives and kicks out. Tim Russell attempts a 3Pt. Contested by Nikola Bryant (4.0 feet, ZONE). Tim Russell misses. Rebound secured by Rudy Haliburton.

[09:02] Team_003 possession (Score: 6-5)
Rudy Haliburton attempts a 3Pt. Contested by Kobe Wagner (4.2 feet, MAN). Rudy Haliburton misses. Offensive rebound by Rudy Haliburton! Rudy Haliburton's putback is no good. Offensive rebound by Rudy Haliburton! Rudy Haliburton kicks it out.

[08:46] Team_003 possession (Score: 6-5)
Rudy Haliburton drives, Kobe Wagner stays with him. Rudy Haliburton attempts a Layup. Contested by Kobe Wagner (4.2 feet, MAN). RUDY HALIBURTON MAKES IT! Assist: Nikola Bryant
Score: 6-7

[08:31] Team_094 possession (Score: 6-7)
Terry Ingram loses the ball! Stripped by Ayo Jackson! TURNOVER! (live ball)

[08:21] Team_003 possession (Score: 6-7)
Victor O'Neal drives to the basket... Victor O'Neal throws a bad pass! Stolen by Tim Russell! TURNOVER! (live ball)

[08:04] Team_094 possession (Score: 6-7)
FOUL! Holding foul on Rudy Haliburton. [Team fouls: 2] No free throws, side out. (Rudy Haliburton: 1 personal fouls)

[07:53] Team_094 possession (Score: 6-7)
FOUL! Reach-in foul on Giannis Turner during the drive. [Team fouls: 3] No free throws, side out. (Giannis Turner: 2 personal fouls)

[07:43] Team_094 possession (Score: 6-7)
FOUL! Reach-in foul on Giannis Turner during the drive. [Team fouls: 4] No free throws, side out. (Giannis Turner: 3 personal fouls)

[07:33] Team_094 possession (Score: 6-7)
Kobe Bryant attempts a Layup. Contested by Giannis Turner (3.0 feet, MAN). Kobe Bryant misses. Rebound secured by Victor O'Neal.

[07:20] Team_003 possession (Score: 6-7)
Ayo Jackson attempts a 3Pt. Contested by Terry Ingram (5.0 feet, MAN). Ayo Jackson misses. Rebound secured by Kobe Bryant.

[07:06] Team_094 possession (Score: 6-7)
Terry Ingram makes the Midrange and draws the foul on Ayo Jackson! And-1! Terry Ingram to the line for 1. [BONUS: 5 team fouls] (Ayo Jackson: 1 personal fouls)   FT 1/1: MISS Terry Ingram makes 0/1 from the line. Rebound secured by Victor O'Neal.
Score: 8-7

[06:51] Team_003 possession (Score: 8-7)
Ayo Jackson attempts a Midrange. Contested by Terry Ingram (5.0 feet, MAN). AYO JACKSON MAKES IT!
Score: 8-9

[06:36] Team_094 possession (Score: 8-9)
Tim Russell attempts a Midrange. Contested by Nikola Bryant (4.2 feet, ZONE). Tim Russell misses. Rebound secured by Rudy Haliburton.

[06:18] Team_003 possession (Score: 8-9)
Giannis Turner attempts a Midrange. Contested by Tim Russell (5.1 feet, MAN). Giannis Turner misses. Rebound secured by Kobe Wagner.

[06:05] Team_094 possession (Score: 8-9)
Kobe Wagner drives to the basket... FOUL! Offensive foul on Kobe Wagner! Rudy Haliburton drew the charge! [Team fouls: 2] (Kobe Wagner: 1 personal fouls) TURNOVER! (dead ball)

[05:48] Team_003 possession (Score: 8-9)
Victor O'Neal throws a bad pass! Stolen by Kobe Bryant! TURNOVER! (live ball)

[05:32] Team_094 possession (Score: 8-9)
Lauri Thompson drives, picks up Nikola Bryant. Help arrives from Rudy Haliburton! Lauri Thompson attempts a Layup. Contested by Rudy Haliburton (4.4 feet, MAN). LAURI THOMPSON MAKES IT! Assist: Kobe Wagner
Score: 10-9

[05:19] Team_003 possession (Score: 10-9)
Victor O'Neal attempts a Midrange. Contested by Lauri Thompson (4.8 feet, ZONE). Victor O'Neal misses. Rebound secured by Tim Russell.

[05:02] Team_094 possession (Score: 10-9)
Lauri Thompson attempts a Midrange. Contested by Nikola Bryant (4.4 feet, MAN). LAURI THOMPSON MAKES IT! Assist: Kobe Wagner
Score: 12-9

[04:47] Team_003 possession (Score: 12-9)
Victor O'Neal attempts a Midrange. Contested by Kobe Bryant (5.0 feet, MAN). Victor O'Neal misses. Rebound secured by Tim Russell.

[04:34] Team_094 possession (Score: 12-9)
Tim Russell drives, Giannis Turner stays with him. Tim Russell attempts a Dunk. Contested by Giannis Turner (3.0 feet, ZONE). TIM RUSSELL MAKES IT! Assist: Lauri Thompson
Score: 14-9

[04:22] Team_003 possession (Score: 14-9)
Victor O'Neal attempts a Midrange. Contested by Kobe Bryant (5.0 feet, MAN). Victor O'Neal misses. Offensive rebound by Rudy Haliburton! Rudy Haliburton puts it back in!
Score: 14-11

[04:06] Team_094 possession (Score: 14-11)
FOUL! Holding foul on Rudy Haliburton. [IN THE BONUS! 6 team fouls] Kobe Wagner to the line for 2 free throws. (Rudy Haliburton: 2 personal fouls)   FT 1/2: GOOD   FT 2/2: GOOD Kobe Wagner makes 2/2 from the line.
Score: 16-11

[03:48] Team_003 possession (Score: 16-11)
Victor O'Neal attempts a Layup. BLOCKED BY KOBE BRYANT! Ball is loose! Rebound secured by Kobe Bryant.

[03:37] Team_094 possession (Score: 16-11)
Terry Ingram drives, Giannis Turner stays with him. Terry Ingram attempts a Dunk. Contested by Giannis Turner (3.3 feet, ZONE). Terry Ingram misses. Rebound secured by Rudy Haliburton.

[03:23] Team_003 possession (Score: 16-11)
Victor O'Neal attempts a Layup. Contested by Kobe Bryant (5.1 feet, MAN). Victor O'Neal misses. Rebound secured by Kobe Bryant.

[03:10] Team_094 possession (Score: 16-11)
Kobe Bryant attempts a Midrange. Contested by Victor O'Neal (4.6 feet, ZONE). Kobe Bryant misses. Rebound secured by Giannis Turner.

[02:57] Team_003 possession (Score: 16-11)
Rudy Haliburton drives, picks up Kobe Wagner. Help arrives from Lauri Thompson! Rudy Haliburton attempts a Dunk. Contested by Lauri Thompson (4.4 feet, MAN). RUDY HALIBURTON MAKES IT!
Score: 16-13

[02:45] Team_094 possession (Score: 16-13)
Kobe Wagner loses control! Ball rolls out of bounds! TURNOVER! (dead ball)

[02:45] Substitution (Team_094): Terry Ingram OUT → Shaquille Bryant IN (stamina_rule2)

[02:45] Substitution (Team_003): Ayo Jackson OUT → Miles Towns IN (stamina_rule2)

[02:45] Substitution (Team_003): Victor O'Neal OUT → Bam Gilgeous-Alexander IN (stamina_rule2)

[02:30] Team_003 possession (Score: 16-13)
Nikola Bryant throws a bad pass! Stolen by Lauri Thompson! TURNOVER! (live ball)

[02:20] Team_094 possession (Score: 16-13)
Lauri Thompson attempts a Layup. BLOCKED BY BAM GILGEOUS-ALEXANDER! Ball is loose! Rebound secured by Rudy Haliburton.

[02:08] Team_003 possession (Score: 16-13)
Rudy Haliburton drives, picks up Tim Russell. Help arrives from Lauri Thompson! Rudy Haliburton attempts a Dunk. Contested by Lauri Thompson (5.1 feet, ZONE). RUDY HALIBURTON MAKES IT! Assist: Giannis Turner
Score: 16-15

[01:53] Team_094 possession (Score: 16-15)
Kobe Wagner loses control! Ball rolls out of bounds! TURNOVER! (dead ball)

[01:53] Substitution (Team_094): Lauri Thompson OUT → Kevin Rozier IN (stamina_rule2)

[01:53] Substitution (Team_094): Kobe Wagner OUT → Ayo Gasol IN (stamina_rule2)

[01:53] Substitution (Team_094): Tim Russell OUT → Domantas Haliburton IN (stamina_rule2)

[01:53] Substitution (Team_094): Kobe Bryant OUT → Isaiah Quickley IN (stamina_rule2)

[01:53] Substitution (Team_003): Nikola Bryant OUT → Pau Williamson IN (stamina_rule2)

[01:53] Substitution (Team_003): Rudy Haliburton OUT → Collin Mitchell IN (stamina_rule2)

[01:53] Substitution (Team_003): Giannis Turner OUT → Anfernee Jordan IN (stamina_rule2)

[01:35] Team_003 possession (Score: 16-15)
Collin Mitchell drives, picks up Isaiah Quickley. Help arrives from Kevin Rozier! Collin Mitchell attempts a Layup. Wide open! Kevin Rozier is 6.3 feet away. [ZONE] Collin Mitchell misses. Rebound secured by Ayo Gasol.

[01:25] Team_094 possession (Score: 16-15)
Ayo Gasol drives and kicks out. Isaiah Quickley attempts a 3Pt. Contested by Bam Gilgeous-Alexander (3.0 feet, MAN). Isaiah Quickley misses. Rebound secured by Bam Gilgeous-Alexander.

[01:11] Team_003 possession (Score: 16-15)
Collin Mitchell attempts a 3Pt. Wide open! Domantas Haliburton is 6.0 feet away. [ZONE] Collin Mitchell misses. Rebound secured by Isaiah Quickley.

[00:51] Team_094 possession (Score: 16-15)
Domantas Haliburton makes the Midrange and draws the foul on Bam Gilgeous-Alexander! And-1! Domantas Haliburton to the line for 1. [BONUS: 7 team fouls] (Bam Gilgeous-Alexander: 1 personal fouls)   FT 1/1: GOOD Domantas Haliburton makes 1/1 from the line.
Score: 19-15

[00:35] Team_003 possession (Score: 19-15)
Collin Mitchell attempts a Midrange. Contested by Ayo Gasol (5.1 feet, MAN). Collin Mitchell misses. Offensive rebound by Bam Gilgeous-Alexander! Bam Gilgeous-Alexander's putback is no good. Rebound secured by Isaiah Quickley.

[00:18] Team_094 possession (Score: 19-15)
Ayo Gasol attempts a 3Pt. Contested by Miles Towns (5.6 feet, ZONE). Ayo Gasol misses. Rebound secured by Anfernee Jordan.

[00:03] Team_003 possession (Score: 19-15)
Collin Mitchell makes the Layup and draws the foul on Ayo Gasol! And-1! Collin Mitchell to the line for 1. [Team fouls: 3] (Ayo Gasol: 1 personal fouls)   FT 1/1: GOOD Collin Mitchell makes 1/1 from the line.
Score: 19-18

================================================================================
                              1ST QUARTER COMPLETE                              
================================================================================

1ST QUARTER SCORE: Team_094 19, Team_003 18

BOX SCORE:
================================================================================

Team_094
--------------------------------------------------------------------------------
Player                MIN  PTS  REB  AST  TO      FG   FG%      3P   3P%
--------------------------------------------------------------------------------
Tim Russell            10    6    3    0   0   3/4    75.0     0/0   0.0
Lauri Thompson         10    4    0    1   0   2/5    40.0     0/0   0.0
Domantas Haliburton     2    3    0    0   0   1/1   100.0     0/0   0.0
Kobe Wagner            10    2    1    2   0   1/2    50.0     0/0   0.0
Kobe Bryant            10    0    5    0   0   0/3     0.0     0/0   0.0
Terry Ingram           10    0    0    0   0   0/2     0.0     0/0   0.0
Ayo Gasol               2    0    1    0   0   0/2     0.0     0/0   0.0

TEAM: FG: 7/19 (36.8%), 3PT: 0/2 (0.0%), REB: 11 (1 off, 10 def), AST: 3, TO: 4
TEAM FOULS: 3


Team_003
--------------------------------------------------------------------------------
Player                MIN  PTS  REB  AST  TO      FG   FG%      3P   3P%
--------------------------------------------------------------------------------
Rudy Haliburton        10   10    7    0   0   5/6    83.3     0/0   0.0
Victor O'Neal          10    3    3    0   0   1/6    16.7     0/0   0.0
Collin Mitchell         2    3    0    0   0   1/4    25.0     0/0   0.0
Ayo Jackson            10    2    0    0   0   1/2    50.0     0/0   0.0
Giannis Turner         10    0    2    1   0   0/1     0.0     0/0   0.0
Nikola Bryant          10    0    0    1   0   0/0     0.0     0/0   0.0
Bam Gilgeous-Alexander    3    0    1    0   0   0/0     0.0     0/0   0.0
Isaiah Quickley         2    0    2    0   0   0/0     0.0     0/0   0.0
Anfernee Jordan         2    0    1    0   0   0/0     0.0     0/0   0.0

TEAM: FG: 8/19 (42.1%), 3PT: 0/3 (0.0%), REB: 15 (4 off, 11 def), AST: 2, TO: 4
TEAM FOULS: 7 [Team_094 in BONUS]

================================================================================

================================================================================
                       2ND QUARTER - Team_094 vs Team_003                       
================================================================================

[12:00] Team_094 possession (Score: 19-18)
Kobe Bryant attempts a Layup. Contested by Giannis Turner (3.1 feet, ZONE). Kobe Bryant misses. Offensive rebound by Tim Russell! Tim Russell kicks it out.

[11:47] Team_094 possession (Score: 19-18)
Tim Russell attempts a 3Pt. Contested by Giannis Turner (3.0 feet, MAN). Tim Russell misses. Offensive rebound by Tim Russell! Tim Russell kicks it out.

[11:37] Team_094 possession (Score: 19-18)
Lauri Thompson loses the ball! Stripped by Nikola Bryant! TURNOVER! (live ball)

[11:17] Team_003 possession (Score: 19-18)
Victor O'Neal drives and kicks out. Nikola Bryant attempts a 3Pt. Contested by Kobe Wagner (4.2 feet, ZONE). Nikola Bryant misses. Rebound secured by Kobe Bryant.

[11:05] Team_094 possession (Score: 19-18)
Kobe Wagner attempts a 3Pt. Contested by Giannis Turner (3.4 feet, ZONE). Kobe Wagner misses. Rebound secured by Giannis Turner.

[10:50] Team_003 possession (Score: 19-18)
Nikola Bryant attempts a Midrange. Contested by Lauri Thompson (5.2 feet, MAN). Nikola Bryant misses. Rebound secured by Tim Russell.

[10:37] Team_094 possession (Score: 19-18)
Terry Ingram drives, Victor O'Neal stays with him. Terry Ingram attempts a Layup. Contested by Victor O'Neal (4.6 feet, ZONE). TERRY INGRAM MAKES IT!
Score: 21-18

[10:21] Team_003 possession (Score: 21-18)
Giannis Turner drives and kicks out. Nikola Bryant attempts a 3Pt. Contested by Lauri Thompson (5.0 feet, MAN). NIKOLA BRYANT MAKES IT! Assist: Ayo Jackson
Score: 21-21

[10:07] Team_094 possession (Score: 21-21)
Terry Ingram attempts a 3Pt. Contested by Ayo Jackson (5.7 feet, MAN). TERRY INGRAM MAKES IT! Assist: Lauri Thompson
Score: 24-21

[09:51] Team_003 possession (Score: 24-21)
Nikola Bryant drives and kicks out. Nikola Bryant attempts a 3Pt. Contested by Lauri Thompson (5.1 feet, MAN). Nikola Bryant misses. FOUL! Loose ball foul on Kobe Wagner during the rebound battle. [Team fouls: 1] No free throws, side out. (Kobe Wagner: 1 personal fouls)

[09:33] Team_003 possession (Score: 24-21)
Giannis Turner attempts a Midrange. Contested by Tim Russell (5.3 feet, MAN). GIANNIS TURNER MAKES IT!
Score: 24-23

[09:14] Team_094 possession (Score: 24-23)
Terry Ingram attempts a Midrange. Contested by Nikola Bryant (4.6 feet, ZONE). TERRY INGRAM MAKES IT! Assist: Lauri Thompson
Score: 26-23

[09:02] Team_003 possession (Score: 26-23)
Ayo Jackson attempts a 3Pt. Contested by Terry Ingram (5.3 feet, MAN). Ayo Jackson misses. Rebound secured by Kobe Wagner.

[08:48] Team_094 possession (Score: 26-23)
FOUL! Shooting foul on Giannis Turner. Tim Russell to the line for 2 free throws. [Team fouls: 1] (Giannis Turner: 1 personal fouls)   FT 1/2: GOOD   FT 2/2: MISS Tim Russell makes 1/2 from the line. Offensive rebound by Kobe Bryant! Kobe Bryant puts it back in!
Score: 29-23

[08:37] Team_003 possession (Score: 29-23)
Nikola Bryant drives to the basket... Nikola Bryant throws a bad pass out of bounds! TURNOVER! (dead ball)

[08:37] Substitution (Team_094): Terry Ingram OUT → Shaquille Bryant IN (stamina_rule2)

[08:37] Substitution (Team_094): Lauri Thompson OUT → Kevin Rozier IN (stamina_rule2)

[08:37] Substitution (Team_094): Kobe Wagner OUT → Ayo Gasol IN (stamina_rule2)

[08:37] Substitution (Team_094): Tim Russell OUT → Domantas Haliburton IN (stamina_rule2)

[08:37] Substitution (Team_094): Kobe Bryant OUT → Isaiah Quickley IN (stamina_rule2)

[08:37] Substitution (Team_003): Ayo Jackson OUT → Miles Towns IN (stamina_rule2)

[08:37] Substitution (Team_003): Nikola Bryant OUT → Pau Williamson IN (stamina_rule2)

[08:37] Substitution (Team_003): Rudy Haliburton OUT → Collin Mitchell IN (stamina_rule2)

[08:37] Substitution (Team_003): Giannis Turner OUT → Anfernee Jordan IN (stamina_rule2)

[08:37] Substitution (Team_003): Victor O'Neal OUT → Bam Gilgeous-Alexander IN (stamina_rule2)

[08:20] Team_094 possession (Score: 29-23)
Shaquille Bryant attempts a 3Pt. Contested by Miles Towns (4.9 feet, ZONE). Shaquille Bryant misses. Rebound secured by Collin Mitchell.

[08:03] Team_003 possession (Score: 29-23)
FOUL! Holding foul on Shaquille Bryant. [Team fouls: 2] No free throws, side out. (Shaquille Bryant: 1 personal fouls)

[07:44] Team_003 possession (Score: 29-23)
Miles Towns drives to the basket... Miles Towns commits a violation (traveling/carry)! TURNOVER! (dead ball)

[07:32] Team_094 possession (Score: 29-23)
Shaquille Bryant attempts a Midrange. BLOCKED BY PAU WILLIAMSON! Ball is loose! Rebound secured by Anfernee Jordan.

[07:16] Team_003 possession (Score: 29-23)
Miles Towns attempts a 3Pt. Contested by Shaquille Bryant (5.2 feet, ZONE). Miles Towns misses. FOUL! Loose ball foul on Ayo Gasol during the rebound battle. [Team fouls: 3] No free throws, side out. (Ayo Gasol: 1 personal fouls)

[06:58] Team_003 possession (Score: 29-23)
Anfernee Jordan attempts a Midrange. Contested by Domantas Haliburton (5.7 feet, ZONE). Anfernee Jordan misses. Offensive rebound by Bam Gilgeous-Alexander! Bam Gilgeous-Alexander's putback is no good. Rebound secured by Isaiah Quickley.

[06:43] Team_094 possession (Score: 29-23)
Kevin Rozier drives, Pau Williamson stays with him. Kevin Rozier attempts a Layup. Contested by Pau Williamson (5.6 feet, MAN). Kevin Rozier misses. Rebound secured by Collin Mitchell.

[06:32] Team_003 possession (Score: 29-23)
Bam Gilgeous-Alexander drives, Isaiah Quickley stays with him. Bam Gilgeous-Alexander attempts a Dunk. Wide open! Isaiah Quickley is 6.8 feet away. [ZONE] BAM GILGEOUS-ALEXANDER MAKES IT! Assist: Miles Towns
Score: 29-25

[06:16] Team_094 possession (Score: 29-25)
Shaquille Bryant attempts a 3Pt. Contested by Miles Towns (4.9 feet, ZONE). Shaquille Bryant misses. Rebound secured by Anfernee Jordan.

[06:02] Team_003 possession (Score: 29-25)
Bam Gilgeous-Alexander attempts a Layup. Wide open! Isaiah Quickley is 6.8 feet away. [MAN] BAM GILGEOUS-ALEXANDER MAKES IT!
Score: 29-27

[05:50] Team_094 possession (Score: 29-27)
Isaiah Quickley drives, Bam Gilgeous-Alexander stays with him. Isaiah Quickley attempts a Dunk. Contested by Bam Gilgeous-Alexander (3.3 feet, MAN). ISAIAH QUICKLEY MAKES IT!
Score: 31-27

[05:32] Team_003 possession (Score: 31-27)
Collin Mitchell attempts a Midrange. Contested by Ayo Gasol (5.1 feet, MAN). Collin Mitchell misses. Rebound secured by Ayo Gasol.

[05:17] Team_094 possession (Score: 31-27)
Domantas Haliburton drives, Bam Gilgeous-Alexander stays with him. Domantas Haliburton attempts a Dunk. Contested by Bam Gilgeous-Alexander (3.1 feet, ZONE). DOMANTAS HALIBURTON MAKES IT! Assist: Ayo Gasol
Score: 33-27

[05:05] Team_003 possession (Score: 33-27)
Anfernee Jordan attempts a Midrange. Contested by Kevin Rozier (4.9 feet, ZONE). Anfernee Jordan misses. Rebound secured by Domantas Haliburton.

[04:51] Team_094 possession (Score: 33-27)
FOUL! Holding foul on Miles Towns. [Team fouls: 2] No free throws, side out. (Miles Towns: 1 personal fouls)

[04:37] Team_094 possession (Score: 33-27)
Ayo Gasol attempts a Midrange. Contested by Collin Mitchell (4.4 feet, ZONE). AYO GASOL MAKES IT! Assist: Isaiah Quickley
Score: 35-27

[04:17] Team_003 possession (Score: 35-27)
Pau Williamson drives and kicks out. Miles Towns attempts a 3Pt. Contested by Domantas Haliburton (5.8 feet, ZONE). Miles Towns misses. Rebound secured by Domantas Haliburton.

[04:03] Team_094 possession (Score: 35-27)
Shaquille Bryant throws a bad pass! Stolen by Miles Towns! TURNOVER! (live ball)

[03:50] Team_003 possession (Score: 35-27)
FOUL! Holding foul on Domantas Haliburton. [Team fouls: 4] No free throws, side out. (Domantas Haliburton: 1 personal fouls)

[03:40] Team_003 possession (Score: 35-27)
Collin Mitchell drives and kicks out. Pau Williamson attempts a 3Pt. Contested by Kevin Rozier (5.0 feet, MAN). Pau Williamson misses. Rebound secured by Isaiah Quickley.

[03:29] Team_094 possession (Score: 35-27)
Shaquille Bryant drives and kicks out. Domantas Haliburton attempts a Midrange. Contested by Bam Gilgeous-Alexander (3.0 feet, MAN). DOMANTAS HALIBURTON MAKES IT!
Score: 37-27

[03:17] Team_003 possession (Score: 37-27)
Collin Mitchell attempts a 3Pt. Wide open! Domantas Haliburton is 6.0 feet away. [ZONE] Collin Mitchell misses. Rebound secured by Domantas Haliburton.

[03:03] Team_094 possession (Score: 37-27)
Isaiah Quickley attempts a Layup. Contested by Bam Gilgeous-Alexander (3.3 feet, ZONE). Isaiah Quickley misses. Rebound secured by Collin Mitchell.

[02:44] Team_003 possession (Score: 37-27)
Miles Towns attempts a 3Pt. Contested by Shaquille Bryant (5.3 feet, MAN). Miles Towns misses. FOUL! Loose ball foul on Ayo Gasol during the rebound battle. [IN THE BONUS! 5 team fouls] Collin Mitchell to the line for 2 free throws. (Ayo Gasol: 2 personal fouls)   FT 1/2: GOOD   FT 2/2: MISS Collin Mitchell makes 1/2 from the line. Rebound secured by Domantas Haliburton.
Score: 37-28

[02:33] Team_094 possession (Score: 37-28)
Kevin Rozier drives, picks up Pau Williamson. Help arrives from Collin Mitchell! Kevin Rozier attempts a Dunk. Contested by Collin Mitchell (5.6 feet, MAN). Kevin Rozier misses. Offensive rebound by Isaiah Quickley! Isaiah Quickley kicks it out.

[02:14] Team_094 possession (Score: 37-28)
Domantas Haliburton attempts a 3Pt. Contested by Miles Towns (5.4 feet, ZONE). Domantas Haliburton misses. Rebound secured by Collin Mitchell.

[01:56] Team_003 possession (Score: 37-28)
Pau Williamson drives and kicks out. Pau Williamson attempts a 3Pt. Contested by Domantas Haliburton (5.9 feet, ZONE). PAU WILLIAMSON MAKES IT! Assist: Bam Gilgeous-Alexander
Score: 37-31

[01:41] Team_094 possession (Score: 37-31)
Domantas Haliburton drives, picks up Bam Gilgeous-Alexander. Help arrives from Pau Williamson! Domantas Haliburton attempts a Layup. Contested by Pau Williamson (3.2 feet, MAN). DOMANTAS HALIBURTON MAKES IT!
Score: 39-31

[01:25] Team_003 possession (Score: 39-31)
Collin Mitchell attempts a 3Pt. Wide open! Domantas Haliburton is 6.1 feet away. [ZONE] Collin Mitchell misses. Rebound secured by Ayo Gasol.

[01:08] Team_094 possession (Score: 39-31)
Ayo Gasol attempts a 3Pt. Contested by Miles Towns (5.6 feet, ZONE). Ayo Gasol misses. Rebound secured by Bam Gilgeous-Alexander.

[00:53] Team_003 possession (Score: 39-31)
Pau Williamson drives to the basket... Pau Williamson throws a bad pass out of bounds! TURNOVER! (dead ball)

[00:36] Team_094 possession (Score: 39-31)
Shaquille Bryant attempts a 3Pt. Contested by Miles Towns (5.1 feet, ZONE). Shaquille Bryant misses. Rebound secured by Anfernee Jordan.

[00:23] Team_003 possession (Score: 39-31)
Miles Towns makes the Layup and draws the foul on Shaquille Bryant! And-1! Miles Towns to the line for 1. [BONUS: 6 team fouls] (Shaquille Bryant: 2 personal fouls)   FT 1/1: GOOD Miles Towns makes 1/1 from the line.
Score: 39-34

[00:12] Team_094 possession (Score: 39-34)
Domantas Haliburton attempts a 3Pt. Contested by Pau Williamson (5.4 feet, ZONE). DOMANTAS HALIBURTON MAKES IT!
Score: 42-34

================================================================================
                              2ND QUARTER COMPLETE                              
================================================================================

2ND QUARTER SCORE: Team_094 23, Team_003 16

BOX SCORE:
================================================================================

Team_094
--------------------------------------------------------------------------------
Player                MIN  PTS  REB  AST  TO      FG   FG%      3P   3P%
--------------------------------------------------------------------------------
Domantas Haliburton    10    9    4    0   0   4/5    80.0     0/0   0.0
Terry Ingram           13    7    0    0   0   3/3   100.0     0/0   0.0
Kobe Bryant            14    3    1    0   0   1/1   100.0     0/0   0.0
Isaiah Quickley        10    2    3    1   0   1/2    50.0     0/0   0.0
Ayo Gasol              10    2    2    1   0   1/2    50.0     0/0   0.0
Tim Russell            14    0    3    0   0   0/0     0.0     0/0   0.0
Kobe Wagner            14    0    1    0   0   0/1     0.0     0/0   0.0
Lauri Thompson         14    0    0    2   0   0/0     0.0     0/0   0.0
Shaquille Bryant       11    0    0    0   0   0/4     0.0     0/0   0.0
Kevin Rozier           10    0    0    0   0   0/1     0.0     0/0   0.0

TEAM: FG: 10/19 (52.6%), 3PT: 2/8 (25.0%), REB: 12 (3 off, 9 def), AST: 4, TO: 2
TEAM FOULS: 6 [Team_003 in BONUS]


Team_003
--------------------------------------------------------------------------------
Player                MIN  PTS  REB  AST  TO      FG   FG%      3P   3P%
--------------------------------------------------------------------------------
Bam Gilgeous-Alexander   11    4    1    1   0   2/2   100.0     0/0   0.0
Nikola Bryant          14    3    0    0   0   1/2    50.0     0/0   0.0
Miles Towns            11    3    0    1   0   1/2    50.0     0/0   0.0
Pau Williamson         10    3    0    0   0   1/2    50.0     0/0   0.0
Giannis Turner         14    2    1    0   0   1/1   100.0     0/0   0.0
Victor O'Neal          13    0    1    0   0   0/1     0.0     0/0   0.0
Ayo Jackson            13    0    0    1   0   0/1     0.0     0/0   0.0
Collin Mitchell        10    0    5    0   0   0/4     0.0     0/0   0.0
Anfernee Jordan        10    0    3    0   0   0/2     0.0     0/0   0.0

TEAM: FG: 6/17 (35.3%), 3PT: 0/4 (0.0%), REB: 13 (4 off, 9 def), AST: 3, TO: 3
TEAM FOULS: 2

================================================================================

================================================================================
                       3RD QUARTER - Team_094 vs Team_003                       
================================================================================

[12:00] Team_094 possession (Score: 42-34)
Lauri Thompson attempts a 3Pt. Contested by Nikola Bryant (4.4 feet, MAN). Lauri Thompson misses. Rebound secured by Rudy Haliburton.

[11:43] Team_003 possession (Score: 42-34)
Rudy Haliburton attempts a 3Pt. Contested by Kobe Wagner (4.2 feet, ZONE). Rudy Haliburton misses. Rebound secured by Kobe Bryant.

[11:27] Team_094 possession (Score: 42-34)
Tim Russell attempts a 3Pt. Contested by Giannis Turner (3.0 feet, ZONE). Tim Russell misses. Rebound secured by Rudy Haliburton.

[11:11] Team_003 possession (Score: 42-34)
Nikola Bryant attempts a Midrange. Contested by Lauri Thompson (5.1 feet, MAN). Nikola Bryant misses. Rebound secured by Tim Russell.

[11:01] Team_094 possession (Score: 42-34)
Kobe Bryant attempts a Layup. Contested by Giannis Turner (3.0 feet, ZONE). Kobe Bryant misses. Rebound secured by Victor O'Neal.

[10:47] Team_003 possession (Score: 42-34)
Ayo Jackson attempts a Layup. Contested by Tim Russell (5.1 feet, ZONE). Ayo Jackson misses. Rebound secured by Kobe Wagner.

[10:34] Team_094 possession (Score: 42-34)
FOUL! Reach-in foul on Giannis Turner during the drive. [Team fouls: 1] No free throws, side out. (Giannis Turner: 1 personal fouls)

[10:17] Team_094 possession (Score: 42-34)
Kobe Bryant drives, Giannis Turner stays with him. Kobe Bryant attempts a Dunk. Contested by Giannis Turner (3.0 feet, MAN). Kobe Bryant misses. Rebound secured by Victor O'Neal.

[10:06] Team_003 possession (Score: 42-34)
Victor O'Neal drives to the basket... FOUL! Offensive foul on Victor O'Neal! Tim Russell drew the charge! [Team fouls: 2] (Victor O'Neal: 1 personal fouls) TURNOVER! (dead ball)

[09:54] Team_094 possession (Score: 42-34)
Tim Russell attempts a 3Pt. Contested by Giannis Turner (3.0 feet, MAN). Tim Russell misses. Rebound secured by Rudy Haliburton.

[09:36] Team_003 possession (Score: 42-34)
Giannis Turner attempts a 3Pt. Contested by Tim Russell (5.1 feet, MAN). GIANNIS TURNER MAKES IT! Assist: Ayo Jackson
Score: 42-37

[09:23] Team_094 possession (Score: 42-37)
Kobe Wagner drives, Rudy Haliburton stays with him. Kobe Wagner attempts a Dunk. Contested by Rudy Haliburton (3.7 feet, MAN). KOBE WAGNER MAKES IT! Assist: Terry Ingram
Score: 44-37

[09:06] Team_003 possession (Score: 44-37)
Ayo Jackson attempts a Midrange. Contested by Terry Ingram (5.0 feet, MAN). Ayo Jackson misses. Rebound secured by Kobe Bryant.

[08:53] Team_094 possession (Score: 44-37)
Terry Ingram drives, picks up Giannis Turner. Help arrives from Nikola Bryant! Terry Ingram attempts a Dunk. Contested by Nikola Bryant (3.1 feet, ZONE). TERRY INGRAM MAKES IT! Assist: Lauri Thompson
Score: 46-37

[08:39] Team_003 possession (Score: 46-37)
Ayo Jackson attempts a Layup. Contested by Terry Ingram (5.0 feet, MAN). AYO JACKSON MAKES IT! Assist: Rudy Haliburton
Score: 46-39

[08:24] Team_094 possession (Score: 46-39)
Terry Ingram throws a bad pass! Stolen by Ayo Jackson! TURNOVER! (live ball)

[08:11] Team_003 possession (Score: 46-39)
Ayo Jackson attempts a 3Pt. Contested by Terry Ingram (5.0 feet, MAN). Ayo Jackson misses. Rebound secured by Kobe Bryant.

[07:54] Team_094 possession (Score: 46-39)
Tim Russell makes the Midrange and draws the foul on Rudy Haliburton! And-1! Tim Russell to the line for 1. [Team fouls: 3] (Rudy Haliburton: 1 personal fouls)   FT 1/1: MISS Tim Russell makes 0/1 from the line. Offensive rebound by Tim Russell! Tim Russell kicks it out.
Score: 48-39

[07:38] Team_094 possession (Score: 48-39)
FOUL! Shooting foul on Giannis Turner. Kobe Wagner to the line for 3 free throws. [Team fouls: 4] (Giannis Turner: 2 personal fouls)   FT 1/3: GOOD   FT 2/3: GOOD   FT 3/3: MISS Kobe Wagner makes 2/3 from the line. Rebound secured by Victor O'Neal.
Score: 50-39

[07:26] Team_003 possession (Score: 50-39)
Giannis Turner drives and kicks out. Giannis Turner attempts a 3Pt. Contested by Kobe Wagner (4.1 feet, ZONE). Giannis Turner misses. Rebound secured by Kobe Wagner.

[07:08] Team_094 possession (Score: 50-39)
Kobe Wagner attempts a 3Pt. Contested by Rudy Haliburton (3.7 feet, MAN). Kobe Wagner misses. Rebound secured by Giannis Turner.

[06:54] Team_003 possession (Score: 50-39)
Nikola Bryant attempts a 3Pt. Contested by Kobe Wagner (4.4 feet, ZONE). Nikola Bryant misses. Rebound secured by Kobe Wagner.

[06:37] Team_094 possession (Score: 50-39)
Kobe Wagner drives and kicks out. Lauri Thompson attempts a Midrange. Contested by Nikola Bryant (4.0 feet, MAN). Lauri Thompson misses. Rebound secured by Victor O'Neal.

[06:23] Team_003 possession (Score: 50-39)
Giannis Turner attempts a 3Pt. Contested by Tim Russell (5.1 feet, MAN). Giannis Turner misses. Rebound secured by Kobe Wagner.

[06:08] Team_094 possession (Score: 50-39)
Tim Russell makes the Dunk and draws the foul on Nikola Bryant! And-1! Tim Russell to the line for 1. [BONUS: 5 team fouls] (Nikola Bryant: 1 personal fouls)   FT 1/1: GOOD Tim Russell makes 1/1 from the line.
Score: 53-39

[05:54] Team_003 possession (Score: 53-39)
Rudy Haliburton makes the Midrange and draws the foul on Kobe Wagner! And-1! Rudy Haliburton to the line for 1. [Team fouls: 1] (Kobe Wagner: 1 personal fouls)   FT 1/1: GOOD Rudy Haliburton makes 1/1 from the line.
Score: 53-42

[05:41] Team_094 possession (Score: 53-42)
Terry Ingram attempts a 3Pt. Contested by Ayo Jackson (5.6 feet, MAN). Terry Ingram misses. Offensive rebound by Kobe Bryant! Kobe Bryant's putback is no good. Rebound secured by Victor O'Neal.

[05:30] Team_003 possession (Score: 53-42)
Giannis Turner makes the Dunk and draws the foul on Tim Russell! And-1! Giannis Turner to the line for 1. [Team fouls: 2] (Tim Russell: 1 personal fouls)   FT 1/1: GOOD Giannis Turner makes 1/1 from the line.
Score: 53-45

[05:11] Team_094 possession (Score: 53-45)
Kobe Wagner drives, picks up Rudy Haliburton. Help arrives from Nikola Bryant! Kobe Wagner attempts a Dunk. Contested by Nikola Bryant (3.7 feet, MAN). KOBE WAGNER MAKES IT! Assist: Tim Russell
Score: 55-45

[04:51] Team_003 possession (Score: 55-45)
Giannis Turner attempts a 3Pt. Contested by Kobe Wagner (4.4 feet, ZONE). Giannis Turner misses. Rebound secured by Tim Russell.

[04:38] Team_094 possession (Score: 55-45)
Kobe Bryant attempts a Midrange. Contested by Giannis Turner (3.1 feet, MAN). KOBE BRYANT MAKES IT!
Score: 57-45

[04:21] Team_003 possession (Score: 57-45)
Victor O'Neal attempts a Layup. Contested by Tim Russell (4.8 feet, ZONE). VICTOR O'NEAL MAKES IT! Assist: Rudy Haliburton
Score: 57-47

[04:05] Team_094 possession (Score: 57-47)
Kobe Wagner attempts a Midrange. Contested by Rudy Haliburton (3.8 feet, MAN). KOBE WAGNER MAKES IT! Assist: Terry Ingram
Score: 59-47

[03:54] Team_003 possession (Score: 59-47)
Nikola Bryant attempts a 3Pt. Contested by Kobe Wagner (4.5 feet, ZONE). NIKOLA BRYANT MAKES IT! Assist: Ayo Jackson
Score: 59-50

[03:42] Team_094 possession (Score: 59-50)
Lauri Thompson drives and kicks out. Terry Ingram attempts a Midrange. Contested by Ayo Jackson (5.4 feet, MAN). Terry Ingram misses. Rebound secured by Victor O'Neal.

[03:28] Team_003 possession (Score: 59-50)
Nikola Bryant attempts a Layup. Contested by Tim Russell (5.2 feet, ZONE). NIKOLA BRYANT MAKES IT! Assist: Rudy Haliburton
Score: 59-52

[03:15] Team_094 possession (Score: 59-52)
Kobe Bryant attempts a 3Pt. Contested by Giannis Turner (3.2 feet, ZONE). Kobe Bryant misses. Rebound secured by Rudy Haliburton.

[02:57] Team_003 possession (Score: 59-52)
Victor O'Neal attempts a Midrange. Contested by Terry Ingram (4.9 feet, ZONE). Victor O'Neal misses. Rebound secured by Kobe Bryant.

[02:44] Team_094 possession (Score: 59-52)
Lauri Thompson attempts a 3Pt. Contested by Nikola Bryant (4.6 feet, MAN). Lauri Thompson misses. Rebound secured by Rudy Haliburton.

[02:25] Team_003 possession (Score: 59-52)
Giannis Turner attempts a Midrange. Contested by Tim Russell (5.3 feet, MAN). Giannis Turner misses. Rebound secured by Tim Russell.

[02:11] Team_094 possession (Score: 59-52)
Kobe Bryant drives to the basket... Kobe Bryant throws a bad pass out of bounds! TURNOVER! (dead ball)

[02:11] Substitution (Team_094): Terry Ingram OUT → Shaquille Bryant IN (stamina_rule2)

[02:11] Substitution (Team_094): Lauri Thompson OUT → Kevin Rozier IN (stamina_rule2)

[02:11] Substitution (Team_094): Kobe Wagner OUT → Ayo Gasol IN (stamina_rule2)

[02:11] Substitution (Team_094): Tim Russell OUT → Domantas Haliburton IN (stamina_rule2)

[02:11] Substitution (Team_003): Ayo Jackson OUT → Miles Towns IN (stamina_rule2)

[02:11] Substitution (Team_003): Nikola Bryant OUT → Pau Williamson IN (stamina_rule2)

[02:11] Substitution (Team_003): Giannis Turner OUT → Anfernee Jordan IN (stamina_rule2)

[02:11] Substitution (Team_003): Victor O'Neal OUT → Bam Gilgeous-Alexander IN (stamina_rule2)

[01:58] Team_003 possession (Score: 59-52)
Anfernee Jordan makes the Dunk and draws the foul on Domantas Haliburton! And-1! Anfernee Jordan to the line for 1. [Team fouls: 3] (Domantas Haliburton: 1 personal fouls)   FT 1/1: GOOD Anfernee Jordan makes 1/1 from the line.
Score: 59-55

[01:47] Team_094 possession (Score: 59-55)
Shaquille Bryant drives and kicks out. Kevin Rozier attempts a Midrange. Contested by Pau Williamson (5.1 feet, MAN). Kevin Rozier misses. Rebound secured by Anfernee Jordan.

[01:33] Team_003 possession (Score: 59-55)
Anfernee Jordan attempts a 3Pt. Contested by Domantas Haliburton (5.7 feet, ZONE). Anfernee Jordan misses. Rebound secured by Ayo Gasol.

[01:17] Team_094 possession (Score: 59-55)
Ayo Gasol attempts a 3Pt. Contested by Rudy Haliburton (3.9 feet, MAN). Ayo Gasol misses. Offensive rebound by Domantas Haliburton! Domantas Haliburton kicks it out.

[01:04] Team_094 possession (Score: 59-55)
Kobe Bryant drives to the basket... Kobe Bryant throws a bad pass! Stolen by Bam Gilgeous-Alexander! TURNOVER! (live ball)

[00:54] Team_003 possession (Score: 59-55)
Bam Gilgeous-Alexander makes the Dunk and draws the foul on Kevin Rozier! And-1! Bam Gilgeous-Alexander to the line for 1. [Team fouls: 4] (Kevin Rozier: 1 personal fouls)   FT 1/1: GOOD Bam Gilgeous-Alexander makes 1/1 from the line.
Score: 59-58

[00:38] Team_094 possession (Score: 59-58)
Ayo Gasol attempts a Layup. Contested by Bam Gilgeous-Alexander (3.3 feet, ZONE). Ayo Gasol misses. Rebound secured by Rudy Haliburton.

[00:24] Team_003 possession (Score: 59-58)
Bam Gilgeous-Alexander attempts a Layup. Wide open! Kobe Bryant is 6.1 feet away. [MAN] BAM GILGEOUS-ALEXANDER MAKES IT!
Score: 59-60

[00:08] Team_094 possession (Score: 59-60)
FOUL! Offensive foul on Kevin Rozier! Pau Williamson drew the charge! [Team fouls: 5] (Kevin Rozier: 2 personal fouls) TURNOVER! (dead ball)

================================================================================
                              3RD QUARTER COMPLETE                              
================================================================================

3RD QUARTER SCORE: Team_094 17, Team_003 26

BOX SCORE:
================================================================================

Team_094
--------------------------------------------------------------------------------
Player                MIN  PTS  REB  AST  TO      FG   FG%      3P   3P%
--------------------------------------------------------------------------------
Kobe Wagner            24    6    4    0   0   3/6    50.0     0/0   0.0
Tim Russell            24    3    4    1   0   1/3    33.3     0/0   0.0
Kobe Bryant            26    2    4    0   0   1/4    25.0     0/0   0.0
Terry Ingram           23    2    0    2   0   1/2    50.0     0/0   0.0
Lauri Thompson         24    0    0    1   0   0/3     0.0     0/0   0.0
Shaquille Bryant       13    0    0    0   0   0/1     0.0     0/0   0.0
Ayo Gasol              12    0    1    0   0   0/1     0.0     0/0   0.0
Domantas Haliburton    12    0    1    0   0   0/0     0.0     0/0   0.0

TEAM: FG: 6/20 (30.0%), 3PT: 0/8 (0.0%), REB: 15 (3 off, 12 def), AST: 4, TO: 4
TEAM FOULS: 5 [Team_003 in BONUS]


Team_003
--------------------------------------------------------------------------------
Player                MIN  PTS  REB  AST  TO      FG   FG%      3P   3P%
--------------------------------------------------------------------------------
Giannis Turner         24    6    1    0   0   2/6    33.3     0/0   0.0
Nikola Bryant          24    5    0    0   0   2/4    50.0     0/0   0.0
Bam Gilgeous-Alexander   13    5    0    0   0   2/2   100.0     0/0   0.0
Rudy Haliburton        26    3    6    3   0   1/2    50.0     0/0   0.0
Anfernee Jordan        12    3    1    0   0   1/2    50.0     0/0   0.0
Victor O'Neal          23    2    6    0   0   1/2    50.0     0/0   0.0
Ayo Jackson            23    2    0    2   0   1/4    25.0     0/0   0.0

TEAM: FG: 10/22 (45.5%), 3PT: 2/8 (25.0%), REB: 13 (0 off, 13 def), AST: 5, TO: 1
TEAM FOULS: 5 [Team_094 in BONUS]

================================================================================

================================================================================
                       4TH QUARTER - Team_094 vs Team_003                       
================================================================================

[12:00] Team_094 possession (Score: 59-60)
FOUL! Shooting foul on Nikola Bryant. Lauri Thompson to the line for 3 free throws. [Team fouls: 1] (Nikola Bryant: 1 personal fouls)   FT 1/3: GOOD   FT 2/3: GOOD   FT 3/3: GOOD Lauri Thompson makes 3/3 from the line.
Score: 62-60

[11:46] Team_003 possession (Score: 62-60)
Victor O'Neal drives, picks up Tim Russell. Help arrives from Lauri Thompson! Victor O'Neal attempts a Layup. Contested by Lauri Thompson (4.8 feet, ZONE). Victor O'Neal misses. Rebound secured by Kobe Bryant.

[11:34] Team_094 possession (Score: 62-60)
Tim Russell drives to the basket... FOUL! Offensive foul on Tim Russell! Giannis Turner drew the charge! [Team fouls: 1] (Tim Russell: 1 personal fouls) TURNOVER! (dead ball)

[11:15] Team_003 possession (Score: 62-60)
Victor O'Neal attempts a Layup. Contested by Tim Russell (4.8 feet, ZONE). VICTOR O'NEAL MAKES IT! Assist: Rudy Haliburton
Score: 62-62

[10:59] Team_094 possession (Score: 62-62)
Kobe Bryant throws a bad pass out of bounds! TURNOVER! (dead ball)

[10:59] Substitution (Team_094): Kobe Bryant OUT → Isaiah Quickley IN (stamina_rule2)

[10:59] Substitution (Team_003): Rudy Haliburton OUT → Collin Mitchell IN (stamina_rule2)

[10:46] Team_003 possession (Score: 62-62)
Collin Mitchell attempts a Midrange. Contested by Kobe Wagner (4.4 feet, MAN). Collin Mitchell misses. Rebound secured by Isaiah Quickley.

[10:34] Team_094 possession (Score: 62-62)
Isaiah Quickley attempts a Midrange. Contested by Giannis Turner (3.2 feet, MAN). Isaiah Quickley misses. Rebound secured by Collin Mitchell.

[10:24] Team_003 possession (Score: 62-62)
Ayo Jackson drives, picks up Terry Ingram. Help arrives from Kobe Wagner! Ayo Jackson attempts a Dunk. Contested by Kobe Wagner (5.2 feet, MAN). AYO JACKSON MAKES IT!
Score: 62-64

[10:09] Team_094 possession (Score: 62-64)
FOUL! Reach-in foul on Giannis Turner during the drive. [Team fouls: 2] No free throws, side out. (Giannis Turner: 1 personal fouls)

[09:57] Team_094 possession (Score: 62-64)
Tim Russell attempts a Layup. Contested by Giannis Turner (3.2 feet, MAN). TIM RUSSELL MAKES IT!
Score: 64-64

[09:43] Team_003 possession (Score: 64-64)
Victor O'Neal makes the Midrange and draws the foul on Tim Russell! And-1! Victor O'Neal to the line for 1. [Team fouls: 2] (Tim Russell: 2 personal fouls)   FT 1/1: GOOD Victor O'Neal makes 1/1 from the line.
Score: 64-67

[09:29] Team_094 possession (Score: 64-67)
FOUL! Shooting foul on Giannis Turner. Tim Russell to the line for 2 free throws. [Team fouls: 3] (Giannis Turner: 2 personal fouls)   FT 1/2: MISS   FT 2/2: GOOD Tim Russell makes 1/2 from the line.
Score: 65-67

[09:17] Team_003 possession (Score: 65-67)
Giannis Turner drives, picks up Tim Russell. Help arrives from Lauri Thompson! Giannis Turner attempts a Layup. Contested by Lauri Thompson (5.3 feet, ZONE). GIANNIS TURNER MAKES IT! Assist: Nikola Bryant
Score: 65-69

[09:01] Team_094 possession (Score: 65-69)
Tim Russell drives and kicks out. Tim Russell attempts a 3Pt. Contested by Giannis Turner (3.2 feet, MAN). Tim Russell misses. Rebound secured by Giannis Turner.

[08:43] Team_003 possession (Score: 65-69)
Giannis Turner attempts a 3Pt. Contested by Tim Russell (5.4 feet, MAN). Giannis Turner misses. Rebound secured by Isaiah Quickley.

[08:24] Team_094 possession (Score: 65-69)
Kobe Wagner attempts a Midrange. Contested by Collin Mitchell (4.4 feet, MAN). KOBE WAGNER MAKES IT!
Score: 67-69

[08:11] Team_003 possession (Score: 67-69)
FOUL! Shooting foul on Tim Russell. Giannis Turner to the line for 2 free throws. [Team fouls: 3] (Tim Russell: 3 personal fouls)   FT 1/2: GOOD   FT 2/2: GOOD Giannis Turner makes 2/2 from the line.
Score: 67-71

[07:59] Team_094 possession (Score: 67-71)
Lauri Thompson attempts a Layup. Contested by Nikola Bryant (4.7 feet, MAN). LAURI THOMPSON MAKES IT! Assist: Tim Russell
Score: 69-71

[07:42] Team_003 possession (Score: 69-71)
Giannis Turner throws a bad pass! Stolen by Tim Russell! TURNOVER! (live ball)

[07:25] Team_094 possession (Score: 69-71)
FOUL! Shooting foul on Nikola Bryant. Lauri Thompson to the line for 3 free throws. [Team fouls: 4] (Nikola Bryant: 2 personal fouls)   FT 1/3: GOOD   FT 2/3: GOOD   FT 3/3: GOOD Lauri Thompson makes 3/3 from the line.
Score: 72-71

[07:11] Team_003 possession (Score: 72-71)
Ayo Jackson attempts a 3Pt. Contested by Kobe Wagner (4.8 feet, ZONE). Ayo Jackson misses. Rebound secured by Tim Russell.

[06:56] Team_094 possession (Score: 72-71)
Terry Ingram attempts a 3Pt. Contested by Giannis Turner (3.7 feet, ZONE). Terry Ingram misses. Rebound secured by Collin Mitchell.

[06:42] Team_003 possession (Score: 72-71)
Victor O'Neal attempts a Layup. BLOCKED BY LAURI THOMPSON! Ball is loose! Rebound secured by Isaiah Quickley.

[06:24] Team_094 possession (Score: 72-71)
FOUL! Offensive foul on Terry Ingram! Ayo Jackson drew the charge! [Team fouls: 4] (Terry Ingram: 1 personal fouls) TURNOVER! (dead ball)

[06:13] Team_003 possession (Score: 72-71)
Nikola Bryant drives to the basket... Nikola Bryant throws a bad pass out of bounds! TURNOVER! (dead ball)

[06:13] Substitution (Team_094): Terry Ingram OUT → Shaquille Bryant IN (stamina_rule2)

[06:13] Substitution (Team_094): Lauri Thompson OUT → Kevin Rozier IN (stamina_rule2)

[06:13] Substitution (Team_094): Kobe Wagner OUT → Ayo Gasol IN (stamina_rule2)

[06:13] Substitution (Team_094): Tim Russell OUT → Domantas Haliburton IN (stamina_rule2)

[06:13] Substitution (Team_003): Ayo Jackson OUT → Miles Towns IN (stamina_rule2)

[06:13] Substitution (Team_003): Nikola Bryant OUT → Pau Williamson IN (stamina_rule2)

[06:13] Substitution (Team_003): Giannis Turner OUT → Anfernee Jordan IN (stamina_rule2)

[06:13] Substitution (Team_003): Victor O'Neal OUT → Bam Gilgeous-Alexander IN (stamina_rule2)

[05:55] Team_094 possession (Score: 72-71)
Kevin Rozier attempts a Midrange. Contested by Miles Towns (5.8 feet, ZONE). Kevin Rozier misses. Rebound secured by Collin Mitchell.

[05:39] Team_003 possession (Score: 72-71)
Miles Towns attempts a 3Pt. Contested by Domantas Haliburton (5.7 feet, ZONE). Miles Towns misses. Rebound secured by Domantas Haliburton.

[05:21] Team_094 possession (Score: 72-71)
Kevin Rozier attempts a 3Pt. Contested by Miles Towns (5.8 feet, ZONE). Kevin Rozier misses. Rebound secured by Anfernee Jordan.

[05:11] Team_003 possession (Score: 72-71)
Pau Williamson attempts a 3Pt. Contested by Kevin Rozier (4.9 feet, MAN). PAU WILLIAMSON MAKES IT! Assist: Miles Towns
Score: 72-74

[04:55] Team_094 possession (Score: 72-74)
FOUL! Shooting foul on Pau Williamson. Isaiah Quickley to the line for 2 free throws. [BONUS: 5 team fouls] (Pau Williamson: 1 personal fouls)   FT 1/2: GOOD   FT 2/2: MISS Isaiah Quickley makes 1/2 from the line. Rebound secured by Collin Mitchell.
Score: 73-74

[04:40] Team_003 possession (Score: 73-74)
Collin Mitchell drives and kicks out. Anfernee Jordan attempts a 3Pt. Contested by Domantas Haliburton (5.8 feet, MAN). Anfernee Jordan misses. Rebound secured by Domantas Haliburton.

[04:21] Team_094 possession (Score: 73-74)
Domantas Haliburton attempts a 3Pt. Contested by Anfernee Jordan (4.5 feet, ZONE). Domantas Haliburton misses. Offensive rebound by Domantas Haliburton! Domantas Haliburton kicks it out.

[04:08] Team_094 possession (Score: 73-74)
Ayo Gasol attempts a 3Pt. Contested by Miles Towns (5.6 feet, ZONE). Ayo Gasol misses. Offensive rebound by Isaiah Quickley! Isaiah Quickley kicks it out.

[03:53] Team_094 possession (Score: 73-74)
Kevin Rozier attempts a Midrange. Contested by Collin Mitchell (4.6 feet, ZONE). KEVIN ROZIER MAKES IT!
Score: 75-74

[03:38] Team_003 possession (Score: 75-74)
Anfernee Jordan attempts a 3Pt. Contested by Domantas Haliburton (5.7 feet, ZONE). Anfernee Jordan misses. Rebound secured by Isaiah Quickley.

[03:22] Team_094 possession (Score: 75-74)
Isaiah Quickley attempts a Midrange. Contested by Miles Towns (5.5 feet, ZONE). ISAIAH QUICKLEY MAKES IT!
Score: 77-74

[03:08] Team_003 possession (Score: 77-74)
Collin Mitchell loses control! Ball rolls out of bounds! TURNOVER! (dead ball)

[02:55] Team_094 possession (Score: 77-74)
Ayo Gasol drives, picks up Bam Gilgeous-Alexander. Help arrives from Pau Williamson! Ayo Gasol attempts a Dunk. Contested by Pau Williamson (3.3 feet, ZONE). AYO GASOL MAKES IT! Assist: Kevin Rozier
Score: 79-74

[02:40] Team_003 possession (Score: 79-74)
Collin Mitchell drives and kicks out. Bam Gilgeous-Alexander attempts a 3Pt. Contested by Domantas Haliburton (5.8 feet, ZONE). BAM GILGEOUS-ALEXANDER MAKES IT! Assist: Miles Towns
Score: 79-77

[02:26] Team_094 possession (Score: 79-77)
FOUL! Shooting foul on Pau Williamson. Kevin Rozier to the line for 3 free throws. [BONUS: 6 team fouls] (Pau Williamson: 2 personal fouls)   FT 1/3: GOOD   FT 2/3: GOOD   FT 3/3: GOOD Kevin Rozier makes 3/3 from the line.
Score: 82-77

[02:14] Team_003 possession (Score: 82-77)
Collin Mitchell attempts a 3Pt. Wide open! Domantas Haliburton is 6.0 feet away. [ZONE] COLLIN MITCHELL MAKES IT! Assist: Pau Williamson
Score: 82-80

[02:01] Team_094 possession (Score: 82-80)
Ayo Gasol attempts a 3Pt. Contested by Miles Towns (5.6 feet, ZONE). Ayo Gasol misses. Rebound secured by Bam Gilgeous-Alexander.

[01:46] Team_003 possession (Score: 82-80)
Pau Williamson drives, Kevin Rozier stays with him. Pau Williamson attempts a Dunk. Contested by Kevin Rozier (4.9 feet, MAN). PAU WILLIAMSON MAKES IT! Assist: Miles Towns
Score: 82-82

[01:33] Team_094 possession (Score: 82-82)
Domantas Haliburton attempts a Layup. Contested by Bam Gilgeous-Alexander (3.1 feet, ZONE). Domantas Haliburton misses. Rebound secured by Anfernee Jordan.

[01:23] Team_003 possession (Score: 82-82)
Anfernee Jordan attempts a Midrange. Contested by Domantas Haliburton (5.7 feet, MAN). ANFERNEE JORDAN MAKES IT!
Score: 82-84

[01:10] Team_094 possession (Score: 82-84)
Shaquille Bryant attempts a 3Pt. Contested by Miles Towns (4.9 feet, ZONE). SHAQUILLE BRYANT MAKES IT! Assist: Kevin Rozier
Score: 85-84

[00:56] Team_003 possession (Score: 85-84)
Bam Gilgeous-Alexander drives to the basket... Bam Gilgeous-Alexander throws a bad pass out of bounds! TURNOVER! (dead ball)

[00:41] Team_094 possession (Score: 85-84)
Ayo Gasol drives and kicks out. Isaiah Quickley attempts a 3Pt. Contested by Bam Gilgeous-Alexander (3.0 feet, MAN). Isaiah Quickley misses. Rebound secured by Collin Mitchell.

[00:26] Team_003 possession (Score: 85-84)
Miles Towns attempts a Layup. BLOCKED BY KEVIN ROZIER! Ball deflects out of bounds off Miles Towns.

[00:11] Team_094 possession (Score: 85-84)
Shaquille Bryant attempts a 3Pt. Contested by Miles Towns (4.9 feet, MAN). Shaquille Bryant misses. Offensive rebound by Domantas Haliburton! Domantas Haliburton kicks it out.

================================================================================
                              4TH QUARTER COMPLETE                              
================================================================================

4TH QUARTER SCORE: Team_094 26, Team_003 24

BOX SCORE:
================================================================================

Team_094
--------------------------------------------------------------------------------
Player                MIN  PTS  REB  AST  TO      FG   FG%      3P   3P%
--------------------------------------------------------------------------------
Lauri Thompson         30    8    0    0   0   3/3   100.0     0/0   0.0
Kevin Rozier           18    5    0    2   0   2/4    50.0     0/0   0.0
Tim Russell            30    3    1    1   0   2/3    66.7     0/0   0.0
Shaquille Bryant       19    3    0    0   0   1/1   100.0     0/0   0.0
Isaiah Quickley        21    2    5    0   0   1/3    33.3     0/0   0.0
Kobe Wagner            30    2    0    0   0   1/1   100.0     0/0   0.0
Ayo Gasol              18    2    0    0   0   1/3    33.3     0/0   0.0
Kobe Bryant            27    0    1    0   0   0/0     0.0     0/0   0.0
Terry Ingram           29    0    0    0   0   0/1     0.0     0/0   0.0
Domantas Haliburton    18    0    4    0   0   0/1     0.0     0/0   0.0

TEAM: FG: 11/20 (55.0%), 3PT: 4/7 (57.1%), REB: 11 (3 off, 8 def), AST: 3, TO: 3
TEAM FOULS: 4


Team_003
--------------------------------------------------------------------------------
Player                MIN  PTS  REB  AST  TO      FG   FG%      3P   3P%
--------------------------------------------------------------------------------
Victor O'Neal          29    5    0    0   0   2/4    50.0     0/0   0.0
Pau Williamson         18    5    0    1   0   2/2   100.0     0/0   0.0
Giannis Turner         30    4    1    0   0   2/3    66.7     0/0   0.0
Collin Mitchell        21    3    5    0   0   1/3    33.3     0/0   0.0
Bam Gilgeous-Alexander   19    3    1    0   0   1/1   100.0     0/0   0.0
Ayo Jackson            29    2    0    0   0   1/2    50.0     0/0   0.0
Anfernee Jordan        18    2    2    0   0   1/2    50.0     0/0   0.0
Rudy Haliburton        27    0    0    1   0   0/0     0.0     0/0   0.0
Nikola Bryant          30    0    0    1   0   0/0     0.0     0/0   0.0
Miles Towns            19    0    0    3   0   0/2     0.0     0/0   0.0

TEAM: FG: 10/19 (52.6%), 3PT: 2/6 (33.3%), REB: 9 (0 off, 9 def), AST: 6, TO: 4
TEAM FOULS: 6 [Team_094 in BONUS]

================================================================================

================================================================================
                               FULL GAME COMPLETE                               
================================================================================

FINAL SCORE: Team_094 85, Team_003 84

SCORING BY QUARTER:
--------------------------------------------------------------------------------
Team                     Q1     Q2     Q3     Q4    FINAL
--------------------------------------------------------------------------------
Team_094                 19     23     17     26       85
Team_003                 18     16     26     24       84
--------------------------------------------------------------------------------

FULL GAME BOX SCORE:
================================================================================

Team_094
--------------------------------------------------------------------------------
Player                MIN  PTS  REB  AST  TO      FG   FG%      3P   3P%      FT STL BLK
--------------------------------------------------------------------------------
Lauri Thompson         30   12    0    4   1   5/11   45.5   2/5    40.0   6/6     1   1
Kobe Wagner            30   10    6    2   2   4/9    44.4   0/3     0.0   4/5     0   0
Tim Russell            30   12   11    2   2   6/10   60.0   0/2     0.0   3/7     2   0
Terry Ingram           29    9    0    2   3   4/8    50.0   1/3    33.3   0/1     1   0
Kobe Bryant            27    5   12    0   2   2/8    25.0   0/1     0.0   0/0     1   1
Isaiah Quickley        21    4   10    1   0   2/5    40.0   0/0     0.0   1/2     0   0
Shaquille Bryant       19    3    0    0   1   2/7    28.6   1/4    25.0   0/0     0   0
Kevin Rozier           18    5    0    2   1   2/5    40.0   1/2    50.0   3/3     0   1
Ayo Gasol              18    4    4    1   0   2/8    25.0   0/3     0.0   0/0     0   0
Domantas Haliburton    18   12    9    0   1   4/6    66.7   1/2    50.0   1/1     0   0

TEAM: FG: 34/78 (43.6%), 3PT: 6/25 (24.0%), REB: 49 (10 off, 39 def), AST: 14, TO: 13


Team_003
--------------------------------------------------------------------------------
Player                MIN  PTS  REB  AST  TO      FG   FG%      3P   3P%      FT STL BLK
--------------------------------------------------------------------------------
Nikola Bryant          30    8    0    2   1   2/5    40.0   1/2    50.0   0/0     1   0
Giannis Turner         30   12    5    1   2   6/12   50.0   1/4    25.0   3/3     0   1
Ayo Jackson            29    6    0    3   1   4/10   40.0   0/4     0.0   0/0     2   0
Victor O'Neal          29   10   10    0   3   5/14   35.7   0/0     0.0   2/2     0   0
Rudy Haliburton        27   13   13    4   1   4/6    66.7   0/2     0.0   1/1     0   0
Collin Mitchell        21    6   10    0   1   3/12   25.0   1/4    25.0   2/3     0   0
Miles Towns            19    3    0    4   1   1/4    25.0   0/2     0.0   1/1     1   0
Bam Gilgeous-Alexander   19   12    3    1   1   4/4   100.0   0/0     0.0   1/1     1   1
Pau Williamson         18    8    0    1   0   3/4    75.0   1/1   100.0   0/0     0   1
Anfernee Jordan        18    5    7    0   1   2/6    33.3   0/2     0.0   1/1     0   0

TEAM: FG: 34/77 (44.2%), 3PT: 4/21 (19.0%), REB: 50 (8 off, 42 def), AST: 16, TO: 12

================================================================================
