================================================================================
                        FULL GAME - Team_012 vs Team_037                        
================================================================================

================================================================================
                       1ST QUARTER - Team_012 vs Team_037                       
================================================================================

[12:00] Team_012 possession (Score: 0-0)
Shaquille Booker attempts a Layup. Contested by Jarrett Tatum (3.9 feet, MAN). Shaquille Booker misses. Rebound secured by Collin Young.

[11:43] Team_037 possession (Score: 0-0)
RJ Mitchell drives, Paolo Durant stays with him. RJ Mitchell attempts a Dunk. Contested by Paolo Durant (3.7 feet, ZONE). RJ Mitchell misses. Rebound secured by Ayo McGrady.

[11:27] Team_012 possession (Score: 0-0)
Pascal Herro drives and kicks out. Ayo McGrady attempts a Midrange. Contested by Collin Young (4.0 feet, MAN). Ayo McGrady misses. Offensive rebound by RJ Nowitzki! RJ Nowitzki kicks it out.

[11:17] Team_012 possession (Score: 0-0)
Ayo McGrady attempts a Layup. Contested by Collin Young (3.9 feet, MAN). Ayo McGrady misses. Offensive rebound by Paolo Durant! Paolo Durant puts it back in!
Score: 2-0

[11:06] Team_037 possession (Score: 2-0)
Jarrett Tatum drives, Paolo Durant stays with him. Jarrett Tatum attempts a Dunk. Contested by Paolo Durant (3.7 feet, ZONE). JARRETT TATUM MAKES IT! Assist: Scottie Jackson
Score: 2-2

[10:48] Team_012 possession (Score: 2-2)
Paolo Durant attempts a Midrange. Contested by Scottie Jackson (3.7 feet, MAN). Paolo Durant misses. Offensive rebound by Paolo Durant! Paolo Durant's putback is no good. Rebound secured by Scottie Jackson.

[10:33] Team_037 possession (Score: 2-2)
RJ Mitchell attempts a Midrange. Contested by Pascal Herro (5.1 feet, MAN). RJ Mitchell misses. Rebound secured by RJ Nowitzki.

[10:20] Team_012 possession (Score: 2-2)
Shaquille Booker drives to the basket... Shaquille Booker loses the ball! Stripped by Jarrett Tatum! TURNOVER! (live ball)

[10:07] Team_037 possession (Score: 2-2)
Giannis Middleton attempts a Layup. BLOCKED BY PASCAL HERRO! Ball deflects out of bounds off Giannis Middleton.

[09:51] Team_012 possession (Score: 2-2)
FOUL! Reach-in foul on Jarrett Tatum during the drive. [Team fouls: 1] No free throws, side out. (Jarrett Tatum: 1 personal fouls)

[09:40] Team_012 possession (Score: 2-2)
Pascal Herro attempts a 3Pt. Contested by RJ Mitchell (5.2 feet, MAN). Pascal Herro misses. Rebound secured by Scottie Jackson.

[09:27] Team_037 possession (Score: 2-2)
Scottie Jackson attempts a 3Pt. Contested by RJ Nowitzki (4.0 feet, ZONE). Scottie Jackson misses. Offensive rebound by Scottie Jackson! Scottie Jackson puts it back in!
Score: 2-4

[09:14] Team_012 possession (Score: 2-4)
Pascal Herro attempts a 3Pt. Contested by RJ Mitchell (5.2 feet, MAN). Pascal Herro misses. Rebound secured by Jarrett Tatum.

[08:59] Team_037 possession (Score: 2-4)
Scottie Jackson attempts a Layup. BLOCKED BY PAOLO DURANT! Ball is loose! Rebound secured by Paolo Durant.

[08:47] Team_012 possession (Score: 2-4)
RJ Nowitzki attempts a 3Pt. Contested by Scottie Jackson (3.9 feet, ZONE). RJ NOWITZKI MAKES IT! Assist: Pascal Herro
Score: 5-4

[08:35] Team_037 possession (Score: 5-4)
RJ Mitchell attempts a 3Pt. Contested by RJ Nowitzki (3.6 feet, ZONE). RJ Mitchell misses. Rebound secured by RJ Nowitzki.

[08:21] Team_012 possession (Score: 5-4)
RJ Nowitzki attempts a 3Pt. Contested by Giannis Middleton (4.3 feet, MAN). RJ NOWITZKI MAKES IT! Assist: Ayo McGrady
Score: 8-4

[08:07] Team_037 possession (Score: 8-4)
Collin Young drives, Ayo McGrady stays with him. Collin Young attempts a Dunk. Contested by Ayo McGrady (4.3 feet, MAN). COLLIN YOUNG MAKES IT! Assist: Jarrett Tatum
Score: 8-6

[07:54] Team_012 possession (Score: 8-6)
RJ Nowitzki attempts a Layup. BLOCKED BY SCOTTIE JACKSON! Ball is loose! Rebound secured by Collin Young.

[07:39] Team_037 possession (Score: 8-6)
Jarrett Tatum drives, Shaquille Booker stays with him. Jarrett Tatum attempts a Layup. Contested by Shaquille Booker (4.2 feet, MAN). Jarrett Tatum misses. FOUL! Loose ball foul on Ayo McGrady during the rebound battle. [Team fouls: 1] No free throws, side out. (Ayo McGrady: 1 personal fouls)

[07:24] Team_037 possession (Score: 8-6)
Scottie Jackson attempts a Midrange. Contested by Shaquille Booker (4.5 feet, ZONE). Scottie Jackson misses. Rebound secured by Ayo McGrady.

[07:06] Team_012 possession (Score: 8-6)
Shaquille Booker drives and kicks out. FOUL! Shooting foul on Scottie Jackson. RJ Nowitzki to the line for 3 free throws. [Team fouls: 2] (Scottie Jackson: 1 personal fouls)   FT 1/3: GOOD   FT 2/3: GOOD   FT 3/3: MISS RJ Nowitzki makes 2/3 from the line. Rebound secured by Scottie Jackson.
Score: 10-6

[06:54] Team_037 possession (Score: 10-6)
RJ Mitchell drives to the basket... RJ Mitchell throws a bad pass out of bounds! TURNOVER! (dead ball)

[06:41] Team_012 possession (Score: 10-6)
FOUL! Reach-in foul on Giannis Middleton during the drive. [Team fouls: 3] No free throws, side out. (Giannis Middleton: 1 personal fouls)

[06:29] Team_012 possession (Score: 10-6)
Paolo Durant attempts a 3Pt. Contested by Scottie Jackson (3.7 feet, ZONE). Paolo Durant misses. Rebound secured by Jarrett Tatum.

[06:18] Team_037 possession (Score: 10-6)
Giannis Middleton attempts a 3Pt. Contested by RJ Nowitzki (3.8 feet, MAN). GIANNIS MIDDLETON MAKES IT! Assist: Jarrett Tatum
Score: 10-9

[06:03] Team_012 possession (Score: 10-9)
FOUL! Holding foul on Scottie Jackson. [Team fouls: 4] No free throws, side out. (Scottie Jackson: 2 personal fouls)

[05:47] Team_012 possession (Score: 10-9)
Paolo Durant attempts a Midrange. Contested by Scottie Jackson (3.7 feet, MAN). PAOLO DURANT MAKES IT!
Score: 12-9

[05:28] Team_037 possession (Score: 12-9)
Scottie Jackson attempts a 3Pt. Contested by Paolo Durant (4.1 feet, MAN). SCOTTIE JACKSON MAKES IT! Assist: RJ Mitchell
Score: 12-12

[05:17] Team_012 possession (Score: 12-12)
Shaquille Booker attempts a Midrange. Contested by Jarrett Tatum (3.9 feet, ZONE). Shaquille Booker misses. Rebound secured by Scottie Jackson.

[05:02] Team_037 possession (Score: 12-12)
FOUL! Reach-in foul on Paolo Durant during the drive. [Team fouls: 2] No free throws, side out. (Paolo Durant: 1 personal fouls)

[04:46] Team_037 possession (Score: 12-12)
Giannis Middleton attempts a Midrange. Contested by Paolo Durant (4.0 feet, ZONE). Giannis Middleton misses. Offensive rebound by Collin Young! Collin Young puts it back in!
Score: 12-14

[04:27] Team_012 possession (Score: 12-14)
Shaquille Booker drives and kicks out. Shaquille Booker attempts a Midrange. Contested by Jarrett Tatum (4.0 feet, MAN). SHAQUILLE BOOKER MAKES IT!
Score: 14-14

[04:16] Team_037 possession (Score: 14-14)
RJ Mitchell drives to the basket... RJ Mitchell commits a violation (traveling/carry)! TURNOVER! (dead ball)

[04:03] Team_012 possession (Score: 14-14)
Pascal Herro attempts a 3Pt. Contested by RJ Mitchell (5.3 feet, MAN). Pascal Herro misses. Rebound secured by Collin Young.

[03:50] Team_037 possession (Score: 14-14)
Scottie Jackson attempts a 3Pt. Contested by RJ Nowitzki (4.1 feet, ZONE). Scottie Jackson misses. Rebound secured by Paolo Durant.

[03:36] Team_012 possession (Score: 14-14)
RJ Nowitzki attempts a Layup. Contested by Scottie Jackson (4.0 feet, ZONE). RJ Nowitzki misses. Offensive rebound by RJ Nowitzki! RJ Nowitzki kicks it out.

[03:22] Team_012 possession (Score: 14-14)
Paolo Durant attempts a Layup. BLOCKED BY SCOTTIE JACKSON! Ball is loose! Offensive rebound by RJ Nowitzki! RJ Nowitzki kicks it out.

[03:07] Team_012 possession (Score: 14-14)
Shaquille Booker attempts a 3Pt. Contested by Jarrett Tatum (4.1 feet, MAN). SHAQUILLE BOOKER MAKES IT! Assist: Paolo Durant
Score: 17-14

[02:53] Team_037 possession (Score: 17-14)
Collin Young drives, Ayo McGrady stays with him. Collin Young attempts a Layup. Contested by Ayo McGrady (4.5 feet, MAN). COLLIN YOUNG MAKES IT! Assist: Giannis Middleton
Score: 17-16

[02:40] Team_012 possession (Score: 17-16)
RJ Nowitzki attempts a 3Pt. Contested by Scottie Jackson (4.1 feet, ZONE). RJ Nowitzki misses. Rebound secured by Collin Young.

[02:24] Team_037 possession (Score: 17-16)
Giannis Middleton drives and kicks out. Jarrett Tatum attempts a Midrange. Contested by Shaquille Booker (4.3 feet, ZONE). Jarrett Tatum misses. Rebound secured by RJ Nowitzki.

[02:08] Team_012 possession (Score: 17-16)
Pascal Herro attempts a 3Pt. Contested by Scottie Jackson (4.4 feet, ZONE). Pascal Herro misses. Rebound secured by Scottie Jackson.

[01:52] Team_037 possession (Score: 17-16)
Giannis Middleton attempts a 3Pt. Contested by RJ Nowitzki (4.1 feet, ZONE). Giannis Middleton misses. Rebound secured by Ayo McGrady.

[01:38] Team_012 possession (Score: 17-16)
RJ Nowitzki drives and kicks out. Paolo Durant attempts a 3Pt. Contested by Scottie Jackson (3.9 feet, ZONE). Paolo Durant misses. Rebound secured by Scottie Jackson.

[01:23] Team_037 possession (Score: 17-16)
Giannis Middleton throws a bad pass! Stolen by RJ Nowitzki! TURNOVER! (live ball)

[01:08] Team_012 possession (Score: 17-16)
FOUL! Holding foul on Scottie Jackson. [IN THE BONUS! 5 team fouls] Paolo Durant to the line for 2 free throws. (Scottie Jackson: 3 personal fouls)   FT 1/2: GOOD   FT 2/2: GOOD Paolo Durant makes 2/2 from the line.
Score: 19-16

[00:54] Team_037 possession (Score: 19-16)
Giannis Middleton attempts a Layup. BLOCKED BY PASCAL HERRO! Ball is loose! Rebound secured by RJ Nowitzki.

[00:37] Team_012 possession (Score: 19-16)
Paolo Durant attempts a Layup. Contested by Scottie Jackson (4.1 feet, MAN). Paolo Durant misses. Rebound secured by Collin Young.

[00:27] Team_037 possession (Score: 19-16)
Collin Young drives, Ayo McGrady stays with him. Collin Young attempts a Layup. Contested by Ayo McGrady (4.8 feet, MAN). COLLIN YOUNG MAKES IT! Assist: RJ Mitchell
Score: 19-18

[00:12] Team_012 possession (Score: 19-18)
Shaquille Booker attempts a 3Pt. Contested by Scottie Jackson (4.0 feet, ZONE). Shaquille Booker misses. Rebound secured by Collin Young.

[00:01] Team_037 possession (Score: 19-18)
Jarrett Tatum attempts a 3Pt. Contested by Shaquille Booker (4.7 feet, MAN). JARRETT TATUM MAKES IT! Assist: Scottie Jackson
Score: 19-21

================================================================================
                              1ST QUARTER COMPLETE                              
================================================================================

1ST QUARTER SCORE: Team_012 19, Team_037 21

BOX SCORE:
================================================================================

Team_012
--------------------------------------------------------------------------------
Player                MIN  PTS  REB  AST  TO      FG   FG%      3P   3P%
--------------------------------------------------------------------------------
RJ Nowitzki            12    6    7    0   0   2/5    40.0     0/0   0.0
Paolo Durant           12    6    3    1   0   3/6    50.0     0/0   0.0
Shaquille Booker       12    5    0    0   0   2/6    33.3     0/0   0.0
Ayo McGrady            12    0    3    1   0   0/0     0.0     0/0   0.0
Pascal Herro           12    0    0    1   0   0/4     0.0     0/0   0.0

TEAM: FG: 7/21 (33.3%), 3PT: 3/10 (30.0%), REB: 14 (5 off, 9 def), AST: 3, TO: 1
TEAM FOULS: 2


Team_037
--------------------------------------------------------------------------------
Player                MIN  PTS  REB  AST  TO      FG   FG%      3P   3P%
--------------------------------------------------------------------------------
Collin Young           12    8    8    0   0   4/4   100.0     0/0   0.0
Jarrett Tatum          12    5    2    2   0   2/2   100.0     0/0   0.0
Scottie Jackson        12    5    7    2   0   2/5    40.0     0/0   0.0
Giannis Middleton      12    3    0    1   0   1/5    20.0     0/0   0.0
RJ Mitchell            12    0    0    2   0   0/3     0.0     0/0   0.0

TEAM: FG: 9/19 (47.4%), 3PT: 4/7 (57.1%), REB: 16 (3 off, 13 def), AST: 7, TO: 3
TEAM FOULS: 5 [Team_012 in BONUS]

================================================================================

================================================================================
                       2ND QUARTER - Team_012 vs Team_037                       
================================================================================

[12:00] Team_012 possession (Score: 19-21)
RJ Nowitzki attempts a Midrange. Contested by RJ Mitchell (5.2 feet, ZONE). RJ Nowitzki misses. Offensive rebound by RJ Nowitzki! RJ Nowitzki kicks it out.

[11:47] Team_012 possession (Score: 19-21)
RJ Nowitzki attempts a 3Pt. Contested by RJ Mitchell (5.2 feet, ZONE). RJ NOWITZKI MAKES IT! Assist: Paolo Durant
Score: 22-21

[11:32] Team_037 possession (Score: 22-21)
Collin Young attempts a Midrange. Contested by Ayo McGrady (4.6 feet, MAN). Collin Young misses. Rebound secured by Ayo McGrady.

[11:20] Team_012 possession (Score: 22-21)
RJ Nowitzki attempts a 3Pt. Contested by Scottie Jackson (4.2 feet, ZONE). RJ NOWITZKI MAKES IT! Assist: Ayo McGrady
Score: 25-21

[11:08] Team_037 possession (Score: 25-21)
Jarrett Tatum attempts a 3Pt. Contested by Pascal Herro (5.6 feet, ZONE). Jarrett Tatum misses. Rebound secured by Ayo McGrady.

[10:55] Team_012 possession (Score: 25-21)
RJ Nowitzki attempts a 3Pt. Contested by Giannis Middleton (4.7 feet, MAN). RJ Nowitzki misses. Rebound secured by Collin Young.

[10:39] Team_037 possession (Score: 25-21)
RJ Mitchell attempts a 3Pt. Contested by Pascal Herro (5.6 feet, MAN). RJ MITCHELL MAKES IT! Assist: Jarrett Tatum
Score: 25-24

[10:26] Team_012 possession (Score: 25-24)
Shaquille Booker attempts a Layup. BLOCKED BY SCOTTIE JACKSON! Ball is loose! Offensive rebound by Paolo Durant! Paolo Durant kicks it out.

[10:12] Team_012 possession (Score: 25-24)
FOUL! Shooting foul on Collin Young. Ayo McGrady to the line for 2 free throws. [Team fouls: 1] (Collin Young: 1 personal fouls)   FT 1/2: MISS   FT 2/2: GOOD Ayo McGrady makes 1/2 from the line.
Score: 26-24

[09:56] Team_037 possession (Score: 26-24)
Collin Young makes the Layup and draws the foul on Ayo McGrady! And-1! Collin Young to the line for 1. [Team fouls: 1] (Ayo McGrady: 1 personal fouls)   FT 1/1: GOOD Collin Young makes 1/1 from the line.
Score: 26-27

[09:42] Team_012 possession (Score: 26-27)
Pascal Herro attempts a 3Pt. Contested by RJ Mitchell (5.6 feet, MAN). Pascal Herro misses. Rebound secured by Collin Young.

[09:24] Team_037 possession (Score: 26-27)
Giannis Middleton attempts a Midrange. Contested by Shaquille Booker (5.0 feet, ZONE). Giannis Middleton misses. Rebound secured by Ayo McGrady.

[09:12] Team_012 possession (Score: 26-27)
Pascal Herro throws a bad pass! Stolen by RJ Mitchell! TURNOVER! (live ball)

[08:57] Team_037 possession (Score: 26-27)
Giannis Middleton attempts a Layup. Contested by RJ Nowitzki (4.5 feet, MAN). Giannis Middleton misses. Rebound secured by Ayo McGrady.

[08:39] Team_012 possession (Score: 26-27)
RJ Nowitzki drives to the basket... RJ Nowitzki commits a violation (traveling/carry)! TURNOVER! (dead ball)

[08:39] Substitution (Team_012): Pascal Herro OUT → Desmond Irving IN (stamina_rule2)

[08:39] Substitution (Team_012): RJ Nowitzki OUT → Jalen Barnes IN (stamina_rule2)

[08:39] Substitution (Team_012): Shaquille Booker OUT → Domantas Bird IN (stamina_rule2)

[08:39] Substitution (Team_012): Paolo Durant OUT → Jimmy Quickley IN (stamina_rule2)

[08:39] Substitution (Team_012): Ayo McGrady OUT → Karl Young IN (stamina_rule2)

[08:39] Substitution (Team_037): RJ Mitchell OUT → Jarrett Randle IN (stamina_rule2)

[08:39] Substitution (Team_037): Giannis Middleton OUT → Collin Trent IN (stamina_rule2)

[08:39] Substitution (Team_037): Jarrett Tatum OUT → Julius Bird IN (stamina_rule2)

[08:39] Substitution (Team_037): Scottie Jackson OUT → Russell Anthony IN (stamina_rule2)

[08:39] Substitution (Team_037): Collin Young OUT → Wendell Herro IN (stamina_rule2)

[08:23] Team_037 possession (Score: 26-27)
Wendell Herro attempts a Layup. Contested by Jimmy Quickley (5.2 feet, ZONE). Wendell Herro misses. Offensive rebound by Russell Anthony! Russell Anthony puts it back in!
Score: 26-29

[08:09] Team_012 possession (Score: 26-29)
Domantas Bird drives, picks up Julius Bird. Help arrives from Collin Trent! Domantas Bird attempts a Dunk. Contested by Collin Trent (4.4 feet, MAN). Domantas Bird misses. Rebound secured by Wendell Herro.

[07:54] Team_037 possession (Score: 26-29)
Collin Trent attempts a Layup. Contested by Jalen Barnes (5.6 feet, MAN). COLLIN TRENT MAKES IT! Assist: Julius Bird
Score: 26-31

[07:44] Team_012 possession (Score: 26-31)
Karl Young attempts a Layup. Contested by Russell Anthony (3.9 feet, MAN). KARL YOUNG MAKES IT! Assist: Domantas Bird
Score: 28-31

[07:32] Team_037 possession (Score: 28-31)
Jarrett Randle makes the Dunk and draws the foul on Jimmy Quickley! And-1! Jarrett Randle to the line for 1. [Team fouls: 2] (Jimmy Quickley: 1 personal fouls)   FT 1/1: GOOD Jarrett Randle makes 1/1 from the line.
Score: 28-34

[07:17] Team_012 possession (Score: 28-34)
Karl Young drives and kicks out. FOUL! Shooting foul on Russell Anthony. Karl Young to the line for 2 free throws. [Team fouls: 2] (Russell Anthony: 1 personal fouls)   FT 1/2: GOOD   FT 2/2: GOOD Karl Young makes 2/2 from the line.
Score: 30-34

[07:01] Team_037 possession (Score: 30-34)
FOUL! Shooting foul on Jalen Barnes. Collin Trent to the line for 2 free throws. [Team fouls: 3] (Jalen Barnes: 1 personal fouls)   FT 1/2: GOOD   FT 2/2: GOOD Collin Trent makes 2/2 from the line.
Score: 30-36

[06:49] Team_012 possession (Score: 30-36)
Jimmy Quickley drives to the basket... Jimmy Quickley loses the ball! Stripped by Russell Anthony! TURNOVER! (live ball)

[06:32] Team_037 possession (Score: 30-36)
Jarrett Randle attempts a Midrange. Contested by Domantas Bird (5.3 feet, ZONE). Jarrett Randle misses. Rebound secured by Karl Young.

[06:16] Team_012 possession (Score: 30-36)
Karl Young throws a bad pass! Stolen by Russell Anthony! TURNOVER! (live ball)

[06:05] Team_037 possession (Score: 30-36)
Collin Trent drives to the basket... FOUL! Offensive foul on Collin Trent! Jimmy Quickley drew the charge! [Team fouls: 3] (Collin Trent: 1 personal fouls) TURNOVER! (dead ball)

[05:52] Team_012 possession (Score: 30-36)
Domantas Bird attempts a 3Pt. Contested by Julius Bird (4.4 feet, MAN). Domantas Bird misses. Rebound secured by Wendell Herro.

[05:37] Team_037 possession (Score: 30-36)
Wendell Herro throws a bad pass! Stolen by Karl Young! TURNOVER! (live ball)

[05:20] Team_012 possession (Score: 30-36)
Desmond Irving attempts a 3Pt. Contested by Russell Anthony (3.9 feet, ZONE). DESMOND IRVING MAKES IT! Assist: Jimmy Quickley
Score: 33-36

[05:02] Team_037 possession (Score: 33-36)
FOUL! Shooting foul on Desmond Irving. Jarrett Randle to the line for 2 free throws. [Team fouls: 4] (Desmond Irving: 1 personal fouls)   FT 1/2: GOOD   FT 2/2: GOOD Jarrett Randle makes 2/2 from the line.
Score: 33-38

[04:48] Team_012 possession (Score: 33-38)
Desmond Irving drives, picks up Jarrett Randle. Help arrives from Collin Trent! Desmond Irving attempts a Layup. Contested by Collin Trent (4.0 feet, MAN). Desmond Irving misses. FOUL! Loose ball foul on Russell Anthony during the rebound battle. [Team fouls: 4] No free throws, side out. (Russell Anthony: 2 personal fouls)

[04:35] Team_012 possession (Score: 33-38)
Jalen Barnes makes the Layup and draws the foul on Russell Anthony! And-1! Jalen Barnes to the line for 1. [BONUS: 5 team fouls] (Russell Anthony: 3 personal fouls)   FT 1/1: GOOD Jalen Barnes makes 1/1 from the line.
Score: 36-38

[04:21] Team_037 possession (Score: 36-38)
Collin Trent drives, picks up Jimmy Quickley. Help arrives from Jalen Barnes! Collin Trent attempts a Dunk. Contested by Jalen Barnes (5.2 feet, ZONE). Collin Trent misses. Rebound secured by Karl Young.

[04:07] Team_012 possession (Score: 36-38)
Karl Young makes the Dunk and draws the foul on Collin Trent! And-1! Karl Young to the line for 1. [BONUS: 6 team fouls] (Collin Trent: 2 personal fouls)   FT 1/1: GOOD Karl Young makes 1/1 from the line.
Score: 39-38

[03:55] Team_037 possession (Score: 39-38)
Wendell Herro attempts a 3Pt. Contested by Karl Young (4.1 feet, MAN). Wendell Herro misses. Rebound secured by Jalen Barnes.

[03:43] Team_012 possession (Score: 39-38)
FOUL! Reach-in foul on Julius Bird during the drive. [IN THE BONUS! 7 team fouls] Domantas Bird to the line for 2 free throws. (Julius Bird: 1 personal fouls)   FT 1/2: MISS   FT 2/2: GOOD Domantas Bird makes 1/2 from the line.
Score: 40-38

[03:32] Team_037 possession (Score: 40-38)
Jarrett Randle drives to the basket... Jarrett Randle loses the ball! Stripped by Desmond Irving! TURNOVER! (live ball)

[03:20] Team_012 possession (Score: 40-38)
Jalen Barnes attempts a 3Pt. Contested by Jarrett Randle (3.9 feet, ZONE). Jalen Barnes misses. Rebound secured by Russell Anthony.

[03:05] Team_037 possession (Score: 40-38)
Russell Anthony drives, Jimmy Quickley stays with him. Russell Anthony attempts a Layup. Contested by Jimmy Quickley (5.2 feet, MAN). RUSSELL ANTHONY MAKES IT! Assist: Julius Bird
Score: 40-40

[02:49] Team_012 possession (Score: 40-40)
Jalen Barnes makes the Dunk and draws the foul on Collin Trent! And-1! Jalen Barnes to the line for 1. [BONUS: 8 team fouls] (Collin Trent: 3 personal fouls)   FT 1/1: GOOD Jalen Barnes makes 1/1 from the line.
Score: 43-40

[02:36] Team_037 possession (Score: 43-40)
Jarrett Randle attempts a Midrange. Contested by Jalen Barnes (5.4 feet, ZONE). Jarrett Randle misses. Offensive rebound by Julius Bird! Julius Bird kicks it out.

[02:19] Team_037 possession (Score: 43-40)
Julius Bird attempts a 3Pt. Contested by Desmond Irving (4.9 feet, ZONE). JULIUS BIRD MAKES IT! Assist: Russell Anthony
Score: 43-43

[02:06] Team_012 possession (Score: 43-43)
Karl Young attempts a Layup. BLOCKED BY RUSSELL ANTHONY! Ball is loose! Offensive rebound by Karl Young! Karl Young kicks it out.

[01:51] Team_012 possession (Score: 43-43)
Domantas Bird attempts a 3Pt. Contested by Julius Bird (4.4 feet, MAN). Domantas Bird misses. Rebound secured by Wendell Herro.

[01:37] Team_037 possession (Score: 43-43)
Russell Anthony attempts a Layup. Contested by Jimmy Quickley (5.3 feet, MAN). RUSSELL ANTHONY MAKES IT! Assist: Julius Bird
Score: 43-45

[01:20] Team_012 possession (Score: 43-45)
Desmond Irving attempts a Layup. Contested by Jarrett Randle (4.0 feet, MAN). DESMOND IRVING MAKES IT! Assist: Jimmy Quickley
Score: 45-45

[01:03] Team_037 possession (Score: 45-45)
Julius Bird attempts a 3Pt. Contested by Desmond Irving (5.0 feet, ZONE). Julius Bird misses. Rebound secured by Karl Young.

[00:51] Team_012 possession (Score: 45-45)
FOUL! Shooting foul on Jarrett Randle. Desmond Irving to the line for 2 free throws. [BONUS: 9 team fouls] (Jarrett Randle: 1 personal fouls)   FT 1/2: MISS   FT 2/2: GOOD Desmond Irving makes 1/2 from the line.
Score: 46-45

[00:38] Team_037 possession (Score: 46-45)
Russell Anthony makes the Layup and draws the foul on Jimmy Quickley! And-1! Russell Anthony to the line for 1. [BONUS: 5 team fouls] (Jimmy Quickley: 2 personal fouls)   FT 1/1: GOOD Russell Anthony makes 1/1 from the line.
Score: 46-48

[00:23] Team_012 possession (Score: 46-48)
Domantas Bird attempts a 3Pt. Contested by Russell Anthony (3.8 feet, ZONE). DOMANTAS BIRD MAKES IT! Assist: Jalen Barnes
Score: 49-48

[00:07] Team_037 possession (Score: 49-48)
Wendell Herro drives, Karl Young stays with him. Wendell Herro attempts a Dunk. Contested by Karl Young (4.3 feet, MAN). Wendell Herro misses. Rebound secured by Karl Young.

================================================================================
                              2ND QUARTER COMPLETE                              
================================================================================

2ND QUARTER SCORE: Team_012 30, Team_037 27

BOX SCORE:
================================================================================

Team_012
--------------------------------------------------------------------------------
Player                MIN  PTS  REB  AST  TO      FG   FG%      3P   3P%
--------------------------------------------------------------------------------
Karl Young              9    7    5    0   0   3/3   100.0     0/0   0.0
RJ Nowitzki            16    6    1    0   0   2/3    66.7     0/0   0.0
Desmond Irving          9    6    0    0   0   3/3   100.0     0/0   0.0
Jalen Barnes            9    6    1    1   0   2/3    66.7     0/0   0.0
Domantas Bird           9    4    0    1   0   2/5    40.0     0/0   0.0
Ayo McGrady            16    1    4    1   0   1/1   100.0     0/0   0.0
Paolo Durant           16    0    1    1   0   0/0     0.0     0/0   0.0
Pascal Herro           16    0    0    0   0   0/1     0.0     0/0   0.0
Jimmy Quickley          9    0    1    2   0   0/0     0.0     0/0   0.0

TEAM: FG: 13/19 (68.4%), 3PT: 4/9 (44.4%), REB: 13 (4 off, 9 def), AST: 6, TO: 4
TEAM FOULS: 5 [Team_037 in BONUS]


Team_037
--------------------------------------------------------------------------------
Player                MIN  PTS  REB  AST  TO      FG   FG%      3P   3P%
--------------------------------------------------------------------------------
Russell Anthony         9    9    2    1   0   4/4   100.0     0/0   0.0
Jarrett Randle          9    5    0    0   0   2/3    66.7     0/0   0.0
Collin Trent            9    4    0    0   0   2/3    66.7     0/0   0.0
Collin Young           16    3    2    0   0   1/2    50.0     0/0   0.0
RJ Mitchell            16    3    0    0   0   1/1   100.0     0/0   0.0
Julius Bird             9    3    1    3   0   1/2    50.0     0/0   0.0
Jarrett Tatum          16    0    0    1   0   0/1     0.0     0/0   0.0
Giannis Middleton      16    0    0    0   0   0/2     0.0     0/0   0.0
Wendell Herro           9    0    3    0   0   0/2     0.0     0/0   0.0

TEAM: FG: 11/20 (55.0%), 3PT: 2/5 (40.0%), REB: 8 (2 off, 6 def), AST: 5, TO: 3
TEAM FOULS: 9 [Team_012 in BONUS]

================================================================================

================================================================================
                       3RD QUARTER - Team_012 vs Team_037                       
================================================================================

[12:00] Team_012 possession (Score: 49-48)
Paolo Durant attempts a Midrange. Contested by Scottie Jackson (3.7 feet, MAN). PAOLO DURANT MAKES IT!
Score: 51-48

[11:51] Team_037 possession (Score: 51-48)
Collin Young attempts a Layup. Contested by Paolo Durant (3.6 feet, ZONE). COLLIN YOUNG MAKES IT! Assist: Jarrett Tatum
Score: 51-50

[11:32] Team_012 possession (Score: 51-50)
RJ Nowitzki attempts a 3Pt. Contested by Scottie Jackson (3.9 feet, ZONE). RJ NOWITZKI MAKES IT! Assist: Pascal Herro
Score: 54-50

[11:16] Team_037 possession (Score: 54-50)
Scottie Jackson attempts a Midrange. Contested by RJ Nowitzki (4.0 feet, ZONE). Scottie Jackson misses. Rebound secured by RJ Nowitzki.

[11:02] Team_012 possession (Score: 54-50)
RJ Nowitzki makes the Layup and draws the foul on Giannis Middleton! And-1! RJ Nowitzki to the line for 1. [Team fouls: 1] (Giannis Middleton: 1 personal fouls)   FT 1/1: GOOD RJ Nowitzki makes 1/1 from the line.
Score: 57-50

[10:43] Team_037 possession (Score: 57-50)
Scottie Jackson drives, Paolo Durant stays with him. Scottie Jackson attempts a Layup. Contested by Paolo Durant (4.1 feet, ZONE). SCOTTIE JACKSON MAKES IT! Assist: Jarrett Tatum
Score: 57-52

[10:29] Team_012 possession (Score: 57-52)
Shaquille Booker attempts a Midrange. Contested by Jarrett Tatum (3.9 feet, MAN). Shaquille Booker misses. Rebound secured by Jarrett Tatum.

[10:13] Team_037 possession (Score: 57-52)
Scottie Jackson attempts a 3Pt. Contested by Pascal Herro (5.5 feet, ZONE). Scottie Jackson misses. Rebound secured by RJ Nowitzki.

[10:02] Team_012 possession (Score: 57-52)
Paolo Durant attempts a 3Pt. Contested by Giannis Middleton (4.1 feet, ZONE). Paolo Durant misses. Rebound secured by Collin Young.

[09:50] Team_037 possession (Score: 57-52)
Giannis Middleton attempts a 3Pt. Contested by RJ Nowitzki (3.8 feet, MAN). GIANNIS MIDDLETON MAKES IT! Assist: Scottie Jackson
Score: 57-55

[09:37] Team_012 possession (Score: 57-55)
Ayo McGrady drives and kicks out. Pascal Herro attempts a 3Pt. Contested by Scottie Jackson (3.6 feet, ZONE). Pascal Herro misses. Rebound secured by Collin Young.

[09:22] Team_037 possession (Score: 57-55)
Jarrett Tatum attempts a 3Pt. Contested by Shaquille Booker (4.2 feet, MAN). Jarrett Tatum misses. Rebound secured by Ayo McGrady.

[09:07] Team_012 possession (Score: 57-55)
FOUL! Shooting foul on RJ Mitchell. Pascal Herro to the line for 2 free throws. [Team fouls: 2] (RJ Mitchell: 1 personal fouls)   FT 1/2: GOOD   FT 2/2: MISS Pascal Herro makes 1/2 from the line. Rebound secured by Jarrett Tatum.
Score: 58-55

[08:53] Team_037 possession (Score: 58-55)
Collin Young drives, Paolo Durant stays with him. Collin Young attempts a Dunk. Contested by Paolo Durant (3.6 feet, ZONE). COLLIN YOUNG MAKES IT! Assist: Jarrett Tatum
Score: 58-57

[08:39] Team_012 possession (Score: 58-57)
Pascal Herro drives and kicks out. Shaquille Booker attempts a Midrange. Contested by Scottie Jackson (3.6 feet, ZONE). Shaquille Booker misses. Rebound secured by Collin Young.

[08:22] Team_037 possession (Score: 58-57)
RJ Mitchell attempts a 3Pt. Contested by RJ Nowitzki (3.6 feet, ZONE). RJ Mitchell misses. Rebound secured by Paolo Durant.

[08:07] Team_012 possession (Score: 58-57)
Ayo McGrady makes the Midrange and draws the foul on Collin Young! And-1! Ayo McGrady to the line for 1. [Team fouls: 3] (Collin Young: 1 personal fouls)   FT 1/1: GOOD Ayo McGrady makes 1/1 from the line.
Score: 61-57

[07:54] Team_037 possession (Score: 61-57)
Giannis Middleton attempts a 3Pt. Contested by RJ Nowitzki (3.8 feet, ZONE). Giannis Middleton misses. Rebound secured by Paolo Durant.

[07:40] Team_012 possession (Score: 61-57)
Pascal Herro drives and kicks out. Paolo Durant attempts a 3Pt. Contested by Scottie Jackson (3.6 feet, MAN). Paolo Durant misses. Rebound secured by Collin Young.

[07:27] Team_037 possession (Score: 61-57)
Jarrett Tatum attempts a 3Pt. Contested by RJ Nowitzki (3.6 feet, ZONE). JARRETT TATUM MAKES IT! Assist: RJ Mitchell
Score: 61-60

[07:12] Team_012 possession (Score: 61-60)
FOUL! Reach-in foul on RJ Mitchell during the drive. [Team fouls: 4] No free throws, side out. (RJ Mitchell: 2 personal fouls)

[07:03] Team_012 possession (Score: 61-60)
RJ Nowitzki attempts a 3Pt. Contested by Scottie Jackson (3.9 feet, ZONE). RJ NOWITZKI MAKES IT! Assist: Shaquille Booker
Score: 64-60

[06:46] Team_037 possession (Score: 64-60)
Giannis Middleton attempts a 3Pt. Contested by RJ Nowitzki (3.8 feet, ZONE). GIANNIS MIDDLETON MAKES IT! Assist: RJ Mitchell
Score: 64-63

[06:34] Team_012 possession (Score: 64-63)
FOUL! Shooting foul on Scottie Jackson. Shaquille Booker to the line for 2 free throws. [BONUS: 5 team fouls] (Scottie Jackson: 1 personal fouls)   FT 1/2: MISS   FT 2/2: GOOD Shaquille Booker makes 1/2 from the line.
Score: 65-63

[06:20] Team_037 possession (Score: 65-63)
Collin Young drives to the basket... Collin Young loses control! Ball rolls out of bounds! TURNOVER! (dead ball)

[06:08] Team_012 possession (Score: 65-63)
RJ Nowitzki attempts a 3Pt. Contested by Giannis Middleton (4.3 feet, MAN). RJ Nowitzki misses. Rebound secured by Scottie Jackson.

[05:55] Team_037 possession (Score: 65-63)
Giannis Middleton drives and kicks out. Scottie Jackson makes the Midrange and draws the foul on Paolo Durant! And-1! Scottie Jackson to the line for 1. [Team fouls: 1] (Paolo Durant: 1 personal fouls)   FT 1/1: GOOD Scottie Jackson makes 1/1 from the line.
Score: 65-66

[05:44] Team_012 possession (Score: 65-66)
Shaquille Booker attempts a 3Pt. Contested by Jarrett Tatum (3.9 feet, MAN). Shaquille Booker misses. Rebound secured by Scottie Jackson.

[05:28] Team_037 possession (Score: 65-66)
Scottie Jackson attempts a 3Pt. Contested by RJ Nowitzki (4.0 feet, ZONE). SCOTTIE JACKSON MAKES IT! Assist: Giannis Middleton
Score: 65-69

[05:11] Team_012 possession (Score: 65-69)
Pascal Herro drives and kicks out. Pascal Herro attempts a Midrange. Contested by Scottie Jackson (3.6 feet, ZONE). Pascal Herro misses. Offensive rebound by Paolo Durant! Paolo Durant puts it back in!
Score: 67-69

[04:56] Team_037 possession (Score: 67-69)
FOUL! Holding foul on Shaquille Booker. [Team fouls: 2] No free throws, side out. (Shaquille Booker: 1 personal fouls)

[04:44] Team_037 possession (Score: 67-69)
Collin Young loses the ball! Stripped by Ayo McGrady! TURNOVER! (live ball)

[04:31] Team_012 possession (Score: 67-69)
FOUL! Reach-in foul on Scottie Jackson during the drive. [IN THE BONUS! 6 team fouls] Shaquille Booker to the line for 2 free throws. (Scottie Jackson: 2 personal fouls)   FT 1/2: GOOD   FT 2/2: GOOD Shaquille Booker makes 2/2 from the line.
Score: 69-69

[04:19] Team_037 possession (Score: 69-69)
Jarrett Tatum attempts a 3Pt. Contested by RJ Nowitzki (3.7 feet, ZONE). Jarrett Tatum misses. Rebound secured by Paolo Durant.

[04:05] Team_012 possession (Score: 69-69)
FOUL! Shooting foul on Collin Young. Ayo McGrady to the line for 2 free throws. [BONUS: 7 team fouls] (Collin Young: 2 personal fouls)   FT 1/2: GOOD   FT 2/2: GOOD Ayo McGrady makes 2/2 from the line.
Score: 71-69

[03:51] Team_037 possession (Score: 71-69)
FOUL! Holding foul on Shaquille Booker. [Team fouls: 3] No free throws, side out. (Shaquille Booker: 2 personal fouls)

[03:35] Team_037 possession (Score: 71-69)
Giannis Middleton drives, picks up Ayo McGrady. Help arrives from RJ Nowitzki! Giannis Middleton attempts a Layup. Contested by RJ Nowitzki (4.8 feet, ZONE). Giannis Middleton misses. Offensive rebound by Collin Young! Collin Young puts it back in!
Score: 71-71

[03:22] Team_012 possession (Score: 71-71)
FOUL! Holding foul on Giannis Middleton. [IN THE BONUS! 8 team fouls] RJ Nowitzki to the line for 2 free throws. (Giannis Middleton: 2 personal fouls)   FT 1/2: GOOD   FT 2/2: MISS RJ Nowitzki makes 1/2 from the line. FOUL! Loose ball foul on Collin Young during the free throw rebound! [IN THE BONUS! 9 team fouls] Paolo Durant to the line for 2 free throws. (Collin Young: 3 personal fouls)   FT 1/2: MISS   FT 2/2: GOOD Paolo Durant makes 1/2 from the line.
Score: 73-71

[03:10] Team_037 possession (Score: 73-71)
Collin Young drives to the basket... Collin Young throws a bad pass! Stolen by Paolo Durant! TURNOVER! (live ball)

[02:56] Team_012 possession (Score: 73-71)
Shaquille Booker makes the Midrange and draws the foul on Jarrett Tatum! And-1! Shaquille Booker to the line for 1. [BONUS: 10 team fouls] (Jarrett Tatum: 1 personal fouls)   FT 1/1: MISS Shaquille Booker makes 0/1 from the line. Rebound secured by Collin Young.
Score: 75-71

[02:43] Team_037 possession (Score: 75-71)
Scottie Jackson drives and kicks out. Giannis Middleton attempts a 3Pt. Contested by RJ Nowitzki (3.7 feet, ZONE). Giannis Middleton misses. Rebound secured by Paolo Durant.

[02:24] Team_012 possession (Score: 75-71)
Ayo McGrady attempts a Midrange. Contested by Scottie Jackson (3.8 feet, ZONE). Ayo McGrady misses. Rebound secured by Jarrett Tatum.

[02:09] Team_037 possession (Score: 75-71)
RJ Mitchell attempts a 3Pt. Contested by Pascal Herro (5.4 feet, MAN). RJ Mitchell misses. Rebound secured by Ayo McGrady.

[01:54] Team_012 possession (Score: 75-71)
Shaquille Booker throws a bad pass! Stolen by Jarrett Tatum! TURNOVER! (live ball)

[01:40] Team_037 possession (Score: 75-71)
Jarrett Tatum attempts a Midrange. Contested by Shaquille Booker (4.5 feet, MAN). Jarrett Tatum misses. Rebound secured by RJ Nowitzki.

[01:25] Team_012 possession (Score: 75-71)
RJ Nowitzki attempts a 3Pt. Contested by Giannis Middleton (4.6 feet, ZONE). RJ Nowitzki misses. Rebound secured by Scottie Jackson.

[01:13] Team_037 possession (Score: 75-71)
Giannis Middleton attempts a 3Pt. Contested by RJ Nowitzki (4.2 feet, ZONE). Giannis Middleton misses. Offensive rebound by Collin Young! Collin Young puts it back in!
Score: 75-73

[00:56] Team_012 possession (Score: 75-73)
Paolo Durant attempts a 3Pt. Contested by Scottie Jackson (4.1 feet, ZONE). Paolo Durant misses. Rebound secured by Jarrett Tatum.

[00:45] Team_037 possession (Score: 75-73)
Giannis Middleton throws a bad pass! Stolen by RJ Nowitzki! TURNOVER! (live ball)

[00:34] Team_012 possession (Score: 75-73)
Ayo McGrady attempts a Layup. Contested by Scottie Jackson (4.0 feet, ZONE). AYO MCGRADY MAKES IT! Assist: Paolo Durant
Score: 77-73

[00:20] Team_037 possession (Score: 77-73)
Giannis Middleton attempts a 3Pt. Contested by RJ Nowitzki (4.3 feet, MAN). Giannis Middleton misses. Rebound secured by Paolo Durant.

[00:09] Team_012 possession (Score: 77-73)
Pascal Herro attempts a 3Pt. Contested by RJ Mitchell (5.6 feet, MAN). PASCAL HERRO MAKES IT! Assist: Shaquille Booker
Score: 80-73

================================================================================
                              3RD QUARTER COMPLETE                              
================================================================================

3RD QUARTER SCORE: Team_012 31, Team_037 25

BOX SCORE:
================================================================================

Team_012
--------------------------------------------------------------------------------
Player                MIN  PTS  REB  AST  TO      FG   FG%      3P   3P%
--------------------------------------------------------------------------------
RJ Nowitzki            28    9    3    0   0   3/5    60.0     0/0   0.0
Ayo McGrady            28    7    2    0   0   3/5    60.0     0/0   0.0
Paolo Durant           28    6    6    1   0   3/5    60.0     0/0   0.0
Pascal Herro           28    3    0    1   0   1/4    25.0     0/0   0.0
Shaquille Booker       28    3    0    2   0   2/5    40.0     0/0   0.0

TEAM: FG: 12/24 (50.0%), 3PT: 3/8 (37.5%), REB: 11 (1 off, 10 def), AST: 4, TO: 1
TEAM FOULS: 3


Team_037
--------------------------------------------------------------------------------
Player                MIN  PTS  REB  AST  TO      FG   FG%      3P   3P%
--------------------------------------------------------------------------------
Collin Young           28    8    7    0   0   4/4   100.0     0/0   0.0
Scottie Jackson        28    8    3    1   0   3/6    50.0     0/0   0.0
Giannis Middleton      28    6    0    1   0   2/4    50.0     0/0   0.0
Jarrett Tatum          28    3    4    3   0   1/4    25.0     0/0   0.0
RJ Mitchell            28    0    0    2   0   0/2     0.0     0/0   0.0

TEAM: FG: 10/20 (50.0%), 3PT: 5/12 (41.7%), REB: 14 (2 off, 12 def), AST: 7, TO: 4
TEAM FOULS: 10 [Team_012 in BONUS]

================================================================================

================================================================================
                       4TH QUARTER - Team_012 vs Team_037                       
================================================================================

[12:00] Team_012 possession (Score: 80-73)
Paolo Durant attempts a Layup. Contested by Scottie Jackson (4.0 feet, MAN). PAOLO DURANT MAKES IT!
Score: 82-73

[11:47] Team_037 possession (Score: 82-73)
FOUL! Shooting foul on Ayo McGrady. Collin Young to the line for 2 free throws. [Team fouls: 1] (Ayo McGrady: 1 personal fouls)   FT 1/2: GOOD   FT 2/2: GOOD Collin Young makes 2/2 from the line.
Score: 82-75

[11:38] Team_012 possession (Score: 82-75)
RJ Nowitzki drives, Scottie Jackson stays with him. RJ Nowitzki attempts a Layup. Contested by Scottie Jackson (4.2 feet, ZONE). RJ NOWITZKI MAKES IT!
Score: 84-75

[11:21] Team_037 possession (Score: 84-75)
Collin Young attempts a Layup. Contested by Paolo Durant (4.0 feet, ZONE). COLLIN YOUNG MAKES IT! Assist: RJ Mitchell
Score: 84-77

[11:06] Team_012 possession (Score: 84-77)
Pascal Herro attempts a Midrange. Contested by RJ Mitchell (5.5 feet, MAN). Pascal Herro misses. Offensive rebound by Paolo Durant! Paolo Durant's putback is no good. Rebound secured by Scottie Jackson.

[10:50] Team_037 possession (Score: 84-77)
Scottie Jackson attempts a 3Pt. Contested by Paolo Durant (4.5 feet, MAN). Scottie Jackson misses. Rebound secured by Paolo Durant.

[10:39] Team_012 possession (Score: 84-77)
FOUL! Offensive foul on Ayo McGrady! Collin Young drew the charge! [Team fouls: 2] (Ayo McGrady: 2 personal fouls) TURNOVER! (dead ball)

[10:25] Team_037 possession (Score: 84-77)
Jarrett Tatum drives, Shaquille Booker stays with him. Jarrett Tatum attempts a Dunk. Contested by Shaquille Booker (4.7 feet, MAN). JARRETT TATUM MAKES IT!
Score: 84-79

[10:07] Team_012 possession (Score: 84-79)
Pascal Herro attempts a 3Pt. Contested by RJ Mitchell (5.6 feet, MAN). Pascal Herro misses. Offensive rebound by RJ Nowitzki! RJ Nowitzki kicks it out.

[09:51] Team_012 possession (Score: 84-79)
Shaquille Booker attempts a Layup. Contested by Jarrett Tatum (4.5 feet, MAN). Shaquille Booker misses. Rebound secured by Scottie Jackson.

[09:37] Team_037 possession (Score: 84-79)
Jarrett Tatum attempts a Midrange. Contested by Shaquille Booker (4.8 feet, MAN). JARRETT TATUM MAKES IT! Assist: Scottie Jackson
Score: 84-81

[09:24] Team_012 possession (Score: 84-81)
FOUL! Holding foul on RJ Mitchell. [Team fouls: 1] No free throws, side out. (RJ Mitchell: 1 personal fouls)

[09:08] Team_012 possession (Score: 84-81)
Paolo Durant attempts a 3Pt. Contested by Scottie Jackson (4.3 feet, MAN). Paolo Durant misses. Rebound secured by Scottie Jackson.

[08:51] Team_037 possession (Score: 84-81)
Giannis Middleton drives and kicks out. Giannis Middleton attempts a 3Pt. Contested by RJ Nowitzki (4.3 feet, MAN). GIANNIS MIDDLETON MAKES IT! Assist: RJ Mitchell
Score: 84-84

[08:38] Team_012 possession (Score: 84-84)
Paolo Durant makes the Layup and draws the foul on Scottie Jackson! And-1! Paolo Durant to the line for 1. [Team fouls: 2] (Scottie Jackson: 1 personal fouls)   FT 1/1: GOOD Paolo Durant makes 1/1 from the line.
Score: 87-84

[08:26] Team_037 possession (Score: 87-84)
Collin Young makes the Midrange and draws the foul on Paolo Durant! And-1! Collin Young to the line for 1. [Team fouls: 3] (Paolo Durant: 1 personal fouls)   FT 1/1: GOOD Collin Young makes 1/1 from the line.
Score: 87-87

[08:10] Team_012 possession (Score: 87-87)
FOUL! Shooting foul on RJ Mitchell. Pascal Herro to the line for 2 free throws. [Team fouls: 3] (RJ Mitchell: 2 personal fouls)   FT 1/2: MISS   FT 2/2: GOOD Pascal Herro makes 1/2 from the line.
Score: 88-87

[07:51] Team_037 possession (Score: 88-87)
Giannis Middleton makes the Dunk and draws the foul on RJ Nowitzki! And-1! Giannis Middleton to the line for 1. [Team fouls: 4] (RJ Nowitzki: 1 personal fouls)   FT 1/1: GOOD Giannis Middleton makes 1/1 from the line.
Score: 88-90

[07:32] Team_012 possession (Score: 88-90)
RJ Nowitzki attempts a 3Pt. Contested by RJ Mitchell (5.7 feet, ZONE). RJ Nowitzki misses. Rebound secured by Scottie Jackson.

[07:19] Team_037 possession (Score: 88-90)
Collin Young attempts a Layup. Contested by Paolo Durant (4.5 feet, ZONE). Collin Young misses. Rebound secured by Paolo Durant.

[07:04] Team_012 possession (Score: 88-90)
Pascal Herro attempts a 3Pt. Contested by Scottie Jackson (4.9 feet, ZONE). PASCAL HERRO MAKES IT! Assist: Ayo McGrady
Score: 91-90

[06:50] Team_037 possession (Score: 91-90)
Scottie Jackson drives, Paolo Durant stays with him. Scottie Jackson attempts a Layup. Contested by Paolo Durant (5.0 feet, MAN). SCOTTIE JACKSON MAKES IT! Assist: RJ Mitchell
Score: 91-92

[06:35] Team_012 possession (Score: 91-92)
Ayo McGrady drives, picks up Scottie Jackson. Help arrives from Giannis Middleton! Ayo McGrady attempts a Layup. Contested by Giannis Middleton (4.5 feet, ZONE). AYO MCGRADY MAKES IT!
Score: 93-92

[06:23] Team_037 possession (Score: 93-92)
Scottie Jackson attempts a 3Pt. Contested by Paolo Durant (5.1 feet, MAN). SCOTTIE JACKSON MAKES IT! Assist: RJ Mitchell
Score: 93-95

[06:13] Team_012 possession (Score: 93-95)
Paolo Durant attempts a Layup. Contested by Scottie Jackson (4.7 feet, MAN). PAOLO DURANT MAKES IT!
Score: 95-95

[05:54] Team_037 possession (Score: 95-95)
Collin Young drives, picks up Ayo McGrady. Help arrives from RJ Nowitzki! Collin Young attempts a Layup. Contested by RJ Nowitzki (5.3 feet, MAN). COLLIN YOUNG MAKES IT! Assist: Giannis Middleton
Score: 95-97

[05:42] Team_012 possession (Score: 95-97)
Pascal Herro attempts a 3Pt. Contested by Scottie Jackson (5.1 feet, ZONE). PASCAL HERRO MAKES IT! Assist: Paolo Durant
Score: 98-97

[05:28] Team_037 possession (Score: 98-97)
Jarrett Tatum loses the ball! Stripped by Shaquille Booker! TURNOVER! (live ball)

[05:14] Team_012 possession (Score: 98-97)
RJ Nowitzki attempts a Layup. Contested by Scottie Jackson (5.0 feet, ZONE). RJ NOWITZKI MAKES IT!
Score: 100-97

[05:02] Team_037 possession (Score: 100-97)
RJ Mitchell drives and kicks out. Giannis Middleton attempts a Midrange. Contested by RJ Nowitzki (4.9 feet, MAN). Giannis Middleton misses. Rebound secured by Paolo Durant.

[04:51] Team_012 possession (Score: 100-97)
Ayo McGrady throws a bad pass out of bounds! TURNOVER! (dead ball)

[04:51] Substitution (Team_012): Pascal Herro OUT → Desmond Irving IN (stamina_rule2)

[04:51] Substitution (Team_012): RJ Nowitzki OUT → Jalen Barnes IN (stamina_rule2)

[04:51] Substitution (Team_012): Shaquille Booker OUT → Domantas Bird IN (stamina_rule2)

[04:51] Substitution (Team_012): Paolo Durant OUT → Jimmy Quickley IN (stamina_rule2)

[04:51] Substitution (Team_012): Ayo McGrady OUT → Karl Young IN (stamina_rule2)

[04:51] Substitution (Team_037): RJ Mitchell OUT → Jarrett Randle IN (stamina_rule2)

[04:51] Substitution (Team_037): Giannis Middleton OUT → Collin Trent IN (stamina_rule2)

[04:51] Substitution (Team_037): Jarrett Tatum OUT → Julius Bird IN (stamina_rule2)

[04:51] Substitution (Team_037): Scottie Jackson OUT → Russell Anthony IN (stamina_rule2)

[04:51] Substitution (Team_037): Collin Young OUT → Wendell Herro IN (stamina_rule2)

[04:33] Team_037 possession (Score: 100-97)
Jarrett Randle attempts a Midrange. Contested by Jalen Barnes (5.4 feet, ZONE). Jarrett Randle misses. Rebound secured by Jalen Barnes.

[04:20] Team_012 possession (Score: 100-97)
Jalen Barnes commits a violation (traveling/carry)! TURNOVER! (dead ball)

[04:03] Team_037 possession (Score: 100-97)
Collin Trent attempts a 3Pt. BLOCKED BY JIMMY QUICKLEY! Ball is loose! Rebound secured by Jimmy Quickley.

[03:52] Team_012 possession (Score: 100-97)
Jalen Barnes attempts a Midrange. Contested by Wendell Herro (5.8 feet, ZONE). JALEN BARNES MAKES IT!
Score: 102-97

[03:37] Team_037 possession (Score: 102-97)
Wendell Herro drives, Karl Young stays with him. Wendell Herro attempts a Layup. Contested by Karl Young (4.1 feet, MAN). WENDELL HERRO MAKES IT! Assist: Jarrett Randle
Score: 102-99

[03:22] Team_012 possession (Score: 102-99)
Domantas Bird attempts a Layup. Contested by Julius Bird (4.4 feet, MAN). DOMANTAS BIRD MAKES IT! Assist: Karl Young
Score: 104-99

[03:08] Team_037 possession (Score: 104-99)
Collin Trent attempts a 3Pt. Contested by Jimmy Quickley (5.2 feet, ZONE). Collin Trent misses. Rebound secured by Karl Young.

[02:57] Team_012 possession (Score: 104-99)
FOUL! Shooting foul on Wendell Herro. Desmond Irving to the line for 2 free throws. [Team fouls: 4] (Wendell Herro: 1 personal fouls)   FT 1/2: GOOD   FT 2/2: MISS Desmond Irving makes 1/2 from the line. Rebound secured by Julius Bird.
Score: 105-99

[02:44] Team_037 possession (Score: 105-99)
Collin Trent attempts a Layup. Contested by Jimmy Quickley (5.2 feet, ZONE). COLLIN TRENT MAKES IT!
Score: 105-101

[02:27] Team_012 possession (Score: 105-101)
Jimmy Quickley attempts a 3Pt. Contested by Jarrett Randle (4.1 feet, ZONE). Jimmy Quickley misses. Offensive rebound by Jimmy Quickley! Jimmy Quickley kicks it out.

[02:13] Team_012 possession (Score: 105-101)
Desmond Irving attempts a 3Pt. Contested by Jarrett Randle (4.0 feet, ZONE). Desmond Irving misses. Rebound secured by Russell Anthony.

[01:58] Team_037 possession (Score: 105-101)
Collin Trent attempts a 3Pt. Contested by Desmond Irving (4.8 feet, ZONE). Collin Trent misses. Rebound secured by Jimmy Quickley.

[01:43] Team_012 possession (Score: 105-101)
Domantas Bird attempts a Midrange. Contested by Julius Bird (4.4 feet, MAN). Domantas Bird misses. Rebound secured by Julius Bird.

[01:27] Team_037 possession (Score: 105-101)
Collin Trent drives and kicks out. Julius Bird attempts a 3Pt. Contested by Desmond Irving (4.5 feet, ZONE). Julius Bird misses. Rebound secured by Jalen Barnes.

[01:12] Team_012 possession (Score: 105-101)
Jalen Barnes attempts a 3Pt. Contested by Collin Trent (5.7 feet, MAN). Jalen Barnes misses. Rebound secured by Julius Bird.

[00:55] Team_037 possession (Score: 105-101)
FOUL! Reach-in foul on Jimmy Quickley during the drive. [IN THE BONUS! 5 team fouls] Wendell Herro to the line for 2 free throws. (Jimmy Quickley: 1 personal fouls)   FT 1/2: MISS   FT 2/2: GOOD Wendell Herro makes 1/2 from the line.
Score: 105-102

[00:40] Team_012 possession (Score: 105-102)
Desmond Irving attempts a Midrange. Contested by Jarrett Randle (4.0 feet, MAN). DESMOND IRVING MAKES IT! Assist: Domantas Bird
Score: 107-102

[00:26] Team_037 possession (Score: 107-102)
Jarrett Randle attempts a Midrange. Contested by Domantas Bird (5.3 feet, ZONE). JARRETT RANDLE MAKES IT! Assist: Julius Bird
Score: 107-104

[00:15] Team_012 possession (Score: 107-104)
Jalen Barnes attempts a Midrange. Contested by Collin Trent (5.7 feet, ZONE). Jalen Barnes misses. Rebound secured by Wendell Herro.

[00:01] Team_037 possession (Score: 107-104)
Julius Bird drives, Domantas Bird stays with him. Julius Bird attempts a Dunk. Contested by Domantas Bird (5.6 feet, MAN). Julius Bird misses. Rebound secured by Jimmy Quickley.

================================================================================
                              4TH QUARTER COMPLETE                              
================================================================================

4TH QUARTER SCORE: Team_012 27, Team_037 31

BOX SCORE:
================================================================================

Team_012
--------------------------------------------------------------------------------
Player                MIN  PTS  REB  AST  TO      FG   FG%      3P   3P%
--------------------------------------------------------------------------------
Paolo Durant           35    7    3    1   0   3/4    75.0     0/0   0.0
Pascal Herro           35    7    0    0   0   3/4    75.0     0/0   0.0
RJ Nowitzki            35    4    1    0   0   2/3    66.7     0/0   0.0
Ayo McGrady            35    2    0    1   0   1/1   100.0     0/0   0.0
Jalen Barnes           13    2    2    0   0   1/3    33.3     0/0   0.0
Domantas Bird          13    2    0    1   0   1/2    50.0     0/0   0.0
Desmond Irving         13    2    0    0   0   1/3    33.3     0/0   0.0
Shaquille Booker       35    0    0    0   0   0/1     0.0     0/0   0.0
Jimmy Quickley         13    0    4    0   0   0/0     0.0     0/0   0.0
Karl Young             13    0    1    1   0   0/0     0.0     0/0   0.0

TEAM: FG: 12/21 (57.1%), 3PT: 2/6 (33.3%), REB: 12 (3 off, 9 def), AST: 4, TO: 3
TEAM FOULS: 5 [Team_037 in BONUS]


Team_037
--------------------------------------------------------------------------------
Player                MIN  PTS  REB  AST  TO      FG   FG%      3P   3P%
--------------------------------------------------------------------------------
Collin Young           35    9    0    0   0   4/5    80.0     0/0   0.0
Giannis Middleton      35    6    0    1   0   2/2   100.0     0/0   0.0
Scottie Jackson        35    5    4    1   0   2/3    66.7     0/0   0.0
Jarrett Tatum          35    4    0    0   0   2/2   100.0     0/0   0.0
Wendell Herro          13    3    1    0   0   2/2   100.0     0/0   0.0
Jarrett Randle         13    2    0    1   0   1/2    50.0     0/0   0.0
Collin Trent           13    2    0    0   0   1/5    20.0     0/0   0.0
RJ Mitchell            35    0    0    4   0   0/1     0.0     0/0   0.0
Julius Bird            13    0    3    1   0   0/1     0.0     0/0   0.0
Russell Anthony        13    0    1    0   0   0/0     0.0     0/0   0.0

TEAM: FG: 14/23 (60.9%), 3PT: 1/5 (20.0%), REB: 8 (0 off, 8 def), AST: 8, TO: 1
TEAM FOULS: 4

================================================================================

================================================================================
                               FULL GAME COMPLETE                               
================================================================================

FINAL SCORE: Team_012 107, Team_037 104

SCORING BY QUARTER:
--------------------------------------------------------------------------------
Team                     Q1     Q2     Q3     Q4    FINAL
--------------------------------------------------------------------------------
Team_012                 19     30     31     27      107
Team_037                 21     27     25     31      104
--------------------------------------------------------------------------------

FULL GAME BOX SCORE:
================================================================================

Team_012
--------------------------------------------------------------------------------
Player                MIN  PTS  REB  AST  TO      FG   FG%      3P   3P%      FT STL BLK
--------------------------------------------------------------------------------
Pascal Herro           35   10    0    2   1   5/14   35.7   3/8    37.5   2/4     0   2
RJ Nowitzki            35   25   12    0   0   9/16   56.2   6/11   54.5   4/6     2   0
Shaquille Booker       35    8    0    2   1   4/12   33.3   1/3    33.3   3/5     1   0
Paolo Durant           35   19   13    4   2   5/11   45.5   0/4     0.0   3/3     1   1
Ayo McGrady            35   10    9    3   2   6/8    75.0   0/0     0.0   4/5     1   0
Desmond Irving         13    8    0    0   1   4/6    66.7   1/2    50.0   2/4     1   0
Jalen Barnes           13    8    3    1   1   3/6    50.0   0/2     0.0   2/2     0   0
Domantas Bird          13    6    0    2   0   3/7    42.9   1/3    33.3   1/2     0   0
Jimmy Quickley         13    0    5    2   0   0/0     0.0   0/0     0.0   0/0     0   1
Karl Young             13    7    6    1   1   3/3   100.0   0/0     0.0   3/3     1   0

TEAM: FG: 44/85 (51.8%), 3PT: 12/33 (36.4%), REB: 50 (13 off, 37 def), AST: 17, TO: 9


Team_037
--------------------------------------------------------------------------------
Player                MIN  PTS  REB  AST  TO      FG   FG%      3P   3P%      FT STL BLK
--------------------------------------------------------------------------------
RJ Mitchell            35    3    0    8   2   1/7    14.3   1/4    25.0   0/0     1   0
Giannis Middleton      35   15    0    3   3   9/17   52.9   4/7    57.1   1/1     0   0
Jarrett Tatum          35   12    6    6   2   5/9    55.6   2/5    40.0   0/0     2   0
Scottie Jackson        35   18   14    4   0   6/13   46.2   4/7    57.1   1/1     0   3
Collin Young           35   28   17    0   1  10/12   83.3   0/0     0.0   4/4     0   0
Jarrett Randle         13    7    0    1   0   3/5    60.0   0/0     0.0   3/3     0   0
Collin Trent           13    6    0    0   1   3/8    37.5   0/3     0.0   2/2     0   0
Julius Bird            13    3    4    4   0   1/3    33.3   1/2    50.0   0/0     0   0
Russell Anthony        13    9    3    1   0   3/3   100.0   0/0     0.0   1/1     2   1
Wendell Herro          13    3    4    0   2   3/5    60.0   0/1     0.0   1/2     0   0

TEAM: FG: 44/82 (53.7%), 3PT: 12/29 (41.4%), REB: 46 (7 off, 39 def), AST: 27, TO: 11

================================================================================
