================================================================================
                        FULL GAME - Team_038 vs Team_040                        
================================================================================

================================================================================
                       1ST QUARTER - Team_038 vs Team_040                       
================================================================================

[12:00] Team_038 possession (Score: 0-0)
Rudy Thompson attempts a Layup. Contested by Bam Gobert (4.5 feet, ZONE). RUDY THOMPSON MAKES IT! Assist: Luka Barnes
Score: 2-0

[11:47] Team_040 possession (Score: 2-0)
Shaquille Bane drives to the basket... Shaquille Bane throws a bad pass! Stolen by Malcolm Poole! TURNOVER! (live ball)

[11:38] Team_038 possession (Score: 2-0)
DeMar Harris attempts a Midrange. Wide open! Dirk Johnson is 6.6 feet away. [ZONE] DeMar Harris misses. Rebound secured by Shaquille Bane.

[11:23] Team_040 possession (Score: 2-0)
FOUL! Reach-in foul on Malcolm Poole during the drive. [Team fouls: 1] No free throws, side out. (Malcolm Poole: 1 personal fouls)

[11:06] Team_040 possession (Score: 2-0)
Ayo Rose attempts a Layup. BLOCKED BY TRACY LAVINE! Ball is loose! Rebound secured by Tracy LaVine.

[10:51] Team_038 possession (Score: 2-0)
Rudy Thompson attempts a 3Pt. Contested by Ayo Rose (5.2 feet, ZONE). Rudy Thompson misses. Rebound secured by Shaquille Bane.

[10:40] Team_040 possession (Score: 2-0)
FOUL! Reach-in foul on Rudy Thompson during the drive. [Team fouls: 2] No free throws, side out. (Rudy Thompson: 1 personal fouls)

[10:24] Team_040 possession (Score: 2-0)
Ayo Rose drives, Tracy LaVine stays with him. Ayo Rose attempts a Dunk. Contested by Tracy LaVine (4.5 feet, ZONE). AYO ROSE MAKES IT! Assist: Bam Gobert
Score: 2-2

[10:12] Team_038 possession (Score: 2-2)
FOUL! Reach-in foul on Bam Gobert during the drive. [Team fouls: 1] No free throws, side out. (Bam Gobert: 1 personal fouls)

[09:54] Team_038 possession (Score: 2-2)
DeMar Harris attempts a Midrange. Wide open! Dirk Johnson is 6.6 feet away. [ZONE] DEMAR HARRIS MAKES IT!
Score: 4-2

[09:40] Team_040 possession (Score: 4-2)
Bam Gobert makes the Layup and draws the foul on Luka Barnes! And-1! Bam Gobert to the line for 1. [Team fouls: 3] (Luka Barnes: 1 personal fouls)   FT 1/1: GOOD Bam Gobert makes 1/1 from the line.
Score: 4-5

[09:26] Team_038 possession (Score: 4-5)
Tracy LaVine attempts a Midrange. Contested by Dirk Johnson (5.7 feet, MAN). Tracy LaVine misses. Rebound secured by Shaquille Bane.

[09:09] Team_040 possession (Score: 4-5)
Bam Gobert drives and kicks out. Bam Gobert attempts a Midrange. Contested by Luka Barnes (4.3 feet, MAN). Bam Gobert misses. Rebound secured by DeMar Harris.

[08:57] Team_038 possession (Score: 4-5)
Malcolm Poole attempts a 3Pt. Contested by Shaquille Bane (4.6 feet, MAN). Malcolm Poole misses. Rebound secured by Dirk Johnson.

[08:39] Team_040 possession (Score: 4-5)
Carmelo Murray attempts a 3Pt. Contested by DeMar Harris (3.4 feet, MAN). Carmelo Murray misses. Rebound secured by Tracy LaVine.

[08:23] Team_038 possession (Score: 4-5)
Malcolm Poole drives to the basket... Malcolm Poole throws a bad pass out of bounds! TURNOVER! (dead ball)

[08:12] Team_040 possession (Score: 4-5)
Ayo Rose attempts a Midrange. Contested by Rudy Thompson (4.5 feet, MAN). AYO ROSE MAKES IT! Assist: Shaquille Bane
Score: 4-7

[07:58] Team_038 possession (Score: 4-7)
FOUL! Reach-in foul on Ayo Rose during the drive. [Team fouls: 2] No free throws, side out. (Ayo Rose: 1 personal fouls)

[07:46] Team_038 possession (Score: 4-7)
Tracy LaVine makes the Layup and draws the foul on Dirk Johnson! And-1! Tracy LaVine to the line for 1. [Team fouls: 3] (Dirk Johnson: 1 personal fouls)   FT 1/1: MISS Tracy LaVine makes 0/1 from the line. Offensive rebound by Tracy LaVine! Tracy LaVine's putback is no good.
Score: 6-7

[07:36] Team_040 possession (Score: 6-7)
FOUL! Holding foul on Tracy LaVine. [Team fouls: 4] No free throws, side out. (Tracy LaVine: 1 personal fouls)

[07:21] Team_040 possession (Score: 6-7)
Bam Gobert attempts a Layup. Contested by Luka Barnes (4.5 feet, MAN). Bam Gobert misses. Rebound secured by Luka Barnes.

[07:03] Team_038 possession (Score: 6-7)
Luka Barnes attempts a Midrange. Contested by Shaquille Bane (5.0 feet, ZONE). Luka Barnes misses. Rebound secured by Bam Gobert.

[06:47] Team_040 possession (Score: 6-7)
Carmelo Murray makes the Dunk and draws the foul on DeMar Harris! And-1! Carmelo Murray to the line for 1. [BONUS: 5 team fouls] (DeMar Harris: 1 personal fouls)   FT 1/1: GOOD Carmelo Murray makes 1/1 from the line.
Score: 6-10

[06:36] Team_038 possession (Score: 6-10)
Tracy LaVine drives and kicks out. Rudy Thompson attempts a 3Pt. Contested by Ayo Rose (4.6 feet, MAN). RUDY THOMPSON MAKES IT! Assist: Malcolm Poole
Score: 9-10

[06:23] Team_040 possession (Score: 9-10)
Ayo Rose attempts a 3Pt. Contested by DeMar Harris (3.7 feet, ZONE). Ayo Rose misses. Rebound secured by Luka Barnes.

[06:08] Team_038 possession (Score: 9-10)
FOUL! Holding foul on Ayo Rose. [Team fouls: 4] No free throws, side out. (Ayo Rose: 2 personal fouls)

[05:56] Team_038 possession (Score: 9-10)
FOUL! Holding foul on Carmelo Murray. [IN THE BONUS! 5 team fouls] DeMar Harris to the line for 2 free throws. (Carmelo Murray: 1 personal fouls)   FT 1/2: MISS   FT 2/2: GOOD DeMar Harris makes 1/2 from the line.
Score: 10-10

[05:41] Team_040 possession (Score: 10-10)
Bam Gobert attempts a Midrange. Contested by Luka Barnes (4.5 feet, MAN). Bam Gobert misses. FOUL! Loose ball foul on Luka Barnes during the rebound battle. [IN THE BONUS! 6 team fouls] Dirk Johnson to the line for 2 free throws. (Luka Barnes: 2 personal fouls)   FT 1/2: MISS   FT 2/2: GOOD Dirk Johnson makes 1/2 from the line.
Score: 10-11

[05:23] Team_038 possession (Score: 10-11)
Rudy Thompson drives, picks up Ayo Rose. Help arrives from Shaquille Bane! Rudy Thompson attempts a Layup. Contested by Shaquille Bane (5.2 feet, MAN). RUDY THOMPSON MAKES IT! Assist: Malcolm Poole
Score: 12-11

[05:05] Team_040 possession (Score: 12-11)
Ayo Rose attempts a Midrange. Contested by Rudy Thompson (4.5 feet, MAN). Ayo Rose misses. Rebound secured by Tracy LaVine.

[04:48] Team_038 possession (Score: 12-11)
Rudy Thompson drives to the basket... Rudy Thompson throws a bad pass! Stolen by Ayo Rose! TURNOVER! (live ball)

[04:37] Team_040 possession (Score: 12-11)
Ayo Rose attempts a 3Pt. Contested by Rudy Thompson (4.5 feet, MAN). AYO ROSE MAKES IT! Assist: Dirk Johnson
Score: 12-14

[04:24] Team_038 possession (Score: 12-14)
Tracy LaVine attempts a Layup. Contested by Dirk Johnson (5.8 feet, MAN). Tracy LaVine misses. Rebound secured by Bam Gobert.

[04:13] Team_040 possession (Score: 12-14)
Bam Gobert attempts a Midrange. Contested by Luka Barnes (4.6 feet, MAN). Bam Gobert misses. FOUL! Loose ball foul on Luka Barnes during the rebound battle. [IN THE BONUS! 7 team fouls] Dirk Johnson to the line for 2 free throws. (Luka Barnes: 3 personal fouls)   FT 1/2: GOOD   FT 2/2: GOOD Dirk Johnson makes 2/2 from the line.
Score: 12-16

[04:01] Team_038 possession (Score: 12-16)
Rudy Thompson attempts a 3Pt. Contested by Ayo Rose (5.3 feet, ZONE). Rudy Thompson misses. Rebound secured by Shaquille Bane.

[03:44] Team_040 possession (Score: 12-16)
FOUL! Offensive foul on Carmelo Murray! DeMar Harris drew the charge! [Team fouls: 6] (Carmelo Murray: 2 personal fouls) TURNOVER! (dead ball)

[03:31] Team_038 possession (Score: 12-16)
Malcolm Poole drives and kicks out. Rudy Thompson attempts a 3Pt. Contested by Ayo Rose (4.8 feet, MAN). Rudy Thompson misses. Rebound secured by Bam Gobert.

[03:18] Team_040 possession (Score: 12-16)
Carmelo Murray loses control! Ball rolls out of bounds! TURNOVER! (dead ball)

[03:02] Team_038 possession (Score: 12-16)
FOUL! Shooting foul on Carmelo Murray. Rudy Thompson to the line for 2 free throws. [BONUS: 7 team fouls] (Carmelo Murray: 3 personal fouls)   FT 1/2: GOOD   FT 2/2: GOOD Rudy Thompson makes 2/2 from the line.
Score: 14-16

[02:51] Team_040 possession (Score: 14-16)
Ayo Rose attempts a 3Pt. Contested by Rudy Thompson (4.7 feet, MAN). AYO ROSE MAKES IT! Assist: Carmelo Murray
Score: 14-19

[02:33] Team_038 possession (Score: 14-19)
FOUL! Reach-in foul on Bam Gobert during the drive. [IN THE BONUS! 8 team fouls] Luka Barnes to the line for 2 free throws. (Bam Gobert: 2 personal fouls)   FT 1/2: GOOD   FT 2/2: GOOD Luka Barnes makes 2/2 from the line.
Score: 16-19

[02:14] Team_040 possession (Score: 16-19)
Carmelo Murray attempts a Midrange. Contested by Tracy LaVine (4.5 feet, ZONE). CARMELO MURRAY MAKES IT!
Score: 16-21

[01:56] Team_038 possession (Score: 16-21)
Rudy Thompson attempts a Layup. Contested by Ayo Rose (5.5 feet, MAN). RUDY THOMPSON MAKES IT!
Score: 18-21

[01:42] Team_040 possession (Score: 18-21)
Carmelo Murray drives and kicks out. Bam Gobert attempts a Midrange. Contested by Luka Barnes (4.6 feet, MAN). Bam Gobert misses. Rebound secured by Tracy LaVine.

[01:28] Team_038 possession (Score: 18-21)
Malcolm Poole drives, picks up Shaquille Bane. Help arrives from Carmelo Murray! Malcolm Poole attempts a Dunk. Contested by Carmelo Murray (4.9 feet, MAN). Malcolm Poole misses. Rebound secured by Bam Gobert.

[01:11] Team_040 possession (Score: 18-21)
Bam Gobert attempts a Layup. Contested by Luka Barnes (4.9 feet, MAN). BAM GOBERT MAKES IT! Assist: Ayo Rose
Score: 18-23

[00:56] Team_038 possession (Score: 18-23)
FOUL! Offensive foul on Malcolm Poole! Shaquille Bane drew the charge! [Team fouls: 8] (Malcolm Poole: 2 personal fouls) TURNOVER! (dead ball)

[00:41] Team_040 possession (Score: 18-23)
Bam Gobert attempts a 3Pt. Contested by DeMar Harris (3.9 feet, ZONE). BAM GOBERT MAKES IT! Assist: Dirk Johnson
Score: 18-26

[00:28] Team_038 possession (Score: 18-26)
DeMar Harris drives and kicks out. DeMar Harris attempts a 3Pt. Contested by Ayo Rose (5.1 feet, ZONE). DeMar Harris misses. Rebound secured by Dirk Johnson.

[00:14] Team_040 possession (Score: 18-26)
Shaquille Bane attempts a Layup. Contested by Luka Barnes (5.2 feet, ZONE). SHAQUILLE BANE MAKES IT!
Score: 18-28

[00:01] Team_038 possession (Score: 18-28)
Rudy Thompson attempts a 3Pt. Contested by Ayo Rose (5.7 feet, ZONE). Rudy Thompson misses. Rebound secured by Dirk Johnson.

================================================================================
                              1ST QUARTER COMPLETE                              
================================================================================

1ST QUARTER SCORE: Team_038 18, Team_040 28

BOX SCORE:
================================================================================

Team_038
--------------------------------------------------------------------------------
Player                MIN  PTS  REB  AST  TO      FG   FG%      3P   3P%
--------------------------------------------------------------------------------
Rudy Thompson          12   11    0    0   0   5/8    62.5     0/0   0.0
DeMar Harris           12    3    1    0   0   2/4    50.0     0/0   0.0
Luka Barnes            12    2    2    1   0   1/2    50.0     0/0   0.0
Tracy LaVine           12    0    5    0   0   0/3     0.0     0/0   0.0
Malcolm Poole          12    0    0    2   0   0/3     0.0     0/0   0.0

TEAM: FG: 8/20 (40.0%), 3PT: 0/4 (0.0%), REB: 7 (0 off, 7 def), AST: 3, TO: 3
TEAM FOULS: 8 [Team_040 in BONUS]


Team_040
--------------------------------------------------------------------------------
Player                MIN  PTS  REB  AST  TO      FG   FG%      3P   3P%
--------------------------------------------------------------------------------
Ayo Rose               12   10    0    1   0   4/7    57.1     0/0   0.0
Bam Gobert             12    8    4    1   0   3/5    60.0     0/0   0.0
Carmelo Murray         12    5    0    1   0   2/4    50.0     0/0   0.0
Dirk Johnson           12    3    3    2   0   2/2   100.0     0/0   0.0
Shaquille Bane         12    2    4    1   0   1/1   100.0     0/0   0.0

TEAM: FG: 12/19 (63.2%), 3PT: 3/5 (60.0%), REB: 12 (0 off, 12 def), AST: 6, TO: 3
TEAM FOULS: 8 [Team_038 in BONUS]

================================================================================

================================================================================
                       2ND QUARTER - Team_038 vs Team_040                       
================================================================================

[12:00] Team_038 possession (Score: 18-28)
Rudy Thompson drives, picks up Bam Gobert. Help arrives from Shaquille Bane! Rudy Thompson attempts a Layup. Contested by Shaquille Bane (4.8 feet, ZONE). RUDY THOMPSON MAKES IT! Assist: Luka Barnes
Score: 20-28

[11:45] Team_040 possession (Score: 20-28)
Ayo Rose attempts a 3Pt. Contested by DeMar Harris (4.1 feet, ZONE). Ayo Rose misses. Rebound secured by Tracy LaVine.

[11:30] Team_038 possession (Score: 20-28)
Luka Barnes attempts a Layup. Contested by Bam Gobert (4.6 feet, MAN). Luka Barnes misses. Offensive rebound by Tracy LaVine! Tracy LaVine kicks it out.

[11:18] Team_038 possession (Score: 20-28)
DeMar Harris drives and kicks out. Malcolm Poole attempts a 3Pt. Contested by Ayo Rose (5.1 feet, ZONE). MALCOLM POOLE MAKES IT! Assist: Tracy LaVine
Score: 23-28

[11:00] Team_040 possession (Score: 23-28)
Shaquille Bane makes the Layup and draws the foul on Malcolm Poole! And-1! Shaquille Bane to the line for 1. [Team fouls: 1] (Malcolm Poole: 1 personal fouls)   FT 1/1: GOOD Shaquille Bane makes 1/1 from the line.
Score: 23-31

[10:50] Team_038 possession (Score: 23-31)
Rudy Thompson attempts a Midrange. Contested by Ayo Rose (5.6 feet, MAN). Rudy Thompson misses. Rebound secured by Bam Gobert.

[10:37] Team_040 possession (Score: 23-31)
Shaquille Bane attempts a 3Pt. Contested by DeMar Harris (4.1 feet, ZONE). Shaquille Bane misses. Rebound secured by Tracy LaVine.

[10:24] Team_038 possession (Score: 23-31)
Tracy LaVine drives to the basket... Tracy LaVine loses control! Ball rolls out of bounds! TURNOVER! (dead ball)

[10:24] Substitution (Team_038): Rudy Thompson OUT → Jalen Hyland IN (stamina_rule2)

[10:24] Substitution (Team_038): Malcolm Poole OUT → Jaren Jokic IN (stamina_rule2)

[10:24] Substitution (Team_038): DeMar Harris OUT → Magic Dosunmu IN (stamina_rule2)

[10:24] Substitution (Team_038): Tracy LaVine OUT → Jabari Carter IN (stamina_rule2)

[10:24] Substitution (Team_038): Luka Barnes OUT → Ja Smith IN (stamina_rule2)

[10:24] Substitution (Team_040): Ayo Rose OUT → Cole O'Neal IN (stamina_rule2)

[10:24] Substitution (Team_040): Shaquille Bane OUT → Tracy Middleton IN (stamina_rule2)

[10:24] Substitution (Team_040): Carmelo Murray OUT → Klay Leonard IN (stamina_rule2)

[10:24] Substitution (Team_040): Dirk Johnson OUT → RJ Curry IN (stamina_rule2)

[10:24] Substitution (Team_040): Bam Gobert OUT → Josh Banchero IN (stamina_rule2)

[10:09] Team_040 possession (Score: 23-31)
RJ Curry attempts a 3Pt. Contested by Jalen Hyland (4.1 feet, ZONE). RJ Curry misses. Offensive rebound by Josh Banchero! Josh Banchero kicks it out.

[09:57] Team_040 possession (Score: 23-31)
Cole O'Neal drives, Jalen Hyland stays with him. Cole O'Neal attempts a Dunk. Contested by Jalen Hyland (4.3 feet, MAN). COLE O'NEAL MAKES IT! Assist: RJ Curry
Score: 23-33

[09:45] Team_038 possession (Score: 23-33)
Jalen Hyland attempts a Midrange. Wide open! Cole O'Neal is 6.7 feet away. [ZONE] JALEN HYLAND MAKES IT!
Score: 25-33

[09:31] Team_040 possession (Score: 25-33)
Klay Leonard throws a bad pass! Stolen by Magic Dosunmu! TURNOVER! (live ball)

[09:20] Team_038 possession (Score: 25-33)
Jabari Carter attempts a 3Pt. Contested by RJ Curry (5.4 feet, ZONE). JABARI CARTER MAKES IT! Assist: Jaren Jokic
Score: 28-33

[09:00] Team_040 possession (Score: 28-33)
Tracy Middleton attempts a Midrange. Contested by Jaren Jokic (5.3 feet, MAN). Tracy Middleton misses. Rebound secured by Jabari Carter.

[08:46] Team_038 possession (Score: 28-33)
Magic Dosunmu attempts a 3Pt. Contested by RJ Curry (5.1 feet, ZONE). Magic Dosunmu misses. Offensive rebound by Ja Smith! Ja Smith's putback is no good. Offensive rebound by Jabari Carter! Jabari Carter kicks it out.

[08:34] Team_038 possession (Score: 28-33)
Ja Smith attempts a Layup. Wide open! Josh Banchero is 6.8 feet away. [ZONE] JA SMITH MAKES IT! Assist: Magic Dosunmu
Score: 30-33

[08:17] Team_040 possession (Score: 30-33)
Klay Leonard attempts a Midrange. Contested by Jabari Carter (3.9 feet, ZONE). Klay Leonard misses. Offensive rebound by Josh Banchero! Josh Banchero kicks it out.

[08:04] Team_040 possession (Score: 30-33)
Josh Banchero drives to the basket... Josh Banchero loses control! Ball rolls out of bounds! TURNOVER! (dead ball)

[07:48] Team_038 possession (Score: 30-33)
Magic Dosunmu attempts a 3Pt. Contested by Klay Leonard (5.2 feet, MAN). Magic Dosunmu misses. Rebound secured by Josh Banchero.

[07:33] Team_040 possession (Score: 30-33)
Cole O'Neal attempts a Midrange. Contested by Jalen Hyland (4.3 feet, MAN). Cole O'Neal misses. Rebound secured by Jabari Carter.

[07:20] Team_038 possession (Score: 30-33)
Jalen Hyland attempts a Layup. Wide open! Josh Banchero is 6.0 feet away. [ZONE] JALEN HYLAND MAKES IT! Assist: Magic Dosunmu
Score: 32-33

[07:05] Team_040 possession (Score: 32-33)
RJ Curry drives, picks up Jabari Carter. Help arrives from Jalen Hyland! RJ Curry attempts a Layup. Contested by Jalen Hyland (3.9 feet, MAN). RJ Curry misses. Offensive rebound by RJ Curry! RJ Curry kicks it out.

[06:47] Team_040 possession (Score: 32-33)
FOUL! Shooting foul on Jalen Hyland. Tracy Middleton to the line for 2 free throws. [Team fouls: 2] (Jalen Hyland: 1 personal fouls)   FT 1/2: GOOD   FT 2/2: MISS Tracy Middleton makes 1/2 from the line. Rebound secured by Jalen Hyland.
Score: 32-34

[06:33] Team_038 possession (Score: 32-34)
Magic Dosunmu attempts a 3Pt. Contested by RJ Curry (5.1 feet, ZONE). Magic Dosunmu misses. Rebound secured by Klay Leonard.

[06:18] Team_040 possession (Score: 32-34)
Tracy Middleton attempts a Midrange. Contested by Jaren Jokic (5.3 feet, MAN). TRACY MIDDLETON MAKES IT! Assist: Klay Leonard
Score: 32-36

[06:05] Team_038 possession (Score: 32-36)
Magic Dosunmu attempts a 3Pt. Contested by Klay Leonard (5.2 feet, MAN). Magic Dosunmu misses. Offensive rebound by Jabari Carter! Jabari Carter puts it back in!
Score: 34-36

[05:53] Team_040 possession (Score: 34-36)
Cole O'Neal attempts a 3Pt. Contested by Jalen Hyland (4.3 feet, MAN). Cole O'Neal misses. Rebound secured by Jabari Carter.

[05:35] Team_038 possession (Score: 34-36)
Jabari Carter attempts a 3Pt. Contested by RJ Curry (5.4 feet, MAN). Jabari Carter misses. Rebound secured by Klay Leonard.

[05:20] Team_040 possession (Score: 34-36)
Tracy Middleton attempts a 3Pt. Contested by Jaren Jokic (5.3 feet, MAN). Tracy Middleton misses. FOUL! Loose ball foul on Ja Smith during the rebound battle. [Team fouls: 3] No free throws, side out. (Ja Smith: 1 personal fouls)

[05:05] Team_040 possession (Score: 34-36)
RJ Curry drives and kicks out. Tracy Middleton attempts a 3Pt. Contested by Jaren Jokic (5.1 feet, MAN). TRACY MIDDLETON MAKES IT! Assist: Cole O'Neal
Score: 34-39

[04:50] Team_038 possession (Score: 34-39)
FOUL! Shooting foul on Klay Leonard. Magic Dosunmu to the line for 2 free throws. [Team fouls: 1] (Klay Leonard: 1 personal fouls)   FT 1/2: GOOD   FT 2/2: GOOD Magic Dosunmu makes 2/2 from the line.
Score: 36-39

[04:35] Team_040 possession (Score: 36-39)
Klay Leonard attempts a Midrange. Contested by Magic Dosunmu (3.0 feet, MAN). Klay Leonard misses. Offensive rebound by RJ Curry! RJ Curry kicks it out.

[04:20] Team_040 possession (Score: 36-39)
RJ Curry drives, Ja Smith stays with him. RJ Curry attempts a Dunk. Contested by Ja Smith (3.1 feet, ZONE). RJ CURRY MAKES IT! Assist: Cole O'Neal
Score: 36-41

[04:02] Team_038 possession (Score: 36-41)
FOUL! Offensive foul on Magic Dosunmu! Klay Leonard drew the charge! [Team fouls: 4] (Magic Dosunmu: 1 personal fouls) TURNOVER! (dead ball)

[03:48] Team_040 possession (Score: 36-41)
RJ Curry drives to the basket... RJ Curry commits a violation (traveling/carry)! TURNOVER! (dead ball)

[03:28] Team_038 possession (Score: 36-41)
Jalen Hyland attempts a Layup. Wide open! Cole O'Neal is 6.6 feet away. [MAN] JALEN HYLAND MAKES IT!
Score: 38-41

[03:12] Team_040 possession (Score: 38-41)
Klay Leonard attempts a 3Pt. Contested by Jalen Hyland (4.2 feet, ZONE). KLAY LEONARD MAKES IT! Assist: RJ Curry
Score: 38-44

[02:57] Team_038 possession (Score: 38-44)
Jaren Jokic attempts a Midrange. Contested by Klay Leonard (4.6 feet, ZONE). Jaren Jokic misses. Rebound secured by Josh Banchero.

[02:43] Team_040 possession (Score: 38-44)
Josh Banchero makes the Layup and draws the foul on Ja Smith! And-1! Josh Banchero to the line for 1. [BONUS: 5 team fouls] (Ja Smith: 2 personal fouls)   FT 1/1: GOOD Josh Banchero makes 1/1 from the line.
Score: 38-47

[02:33] Team_038 possession (Score: 38-47)
FOUL! Holding foul on Tracy Middleton. [Team fouls: 2] No free throws, side out. (Tracy Middleton: 1 personal fouls)

[02:18] Team_038 possession (Score: 38-47)
FOUL! Shooting foul on Josh Banchero. Jabari Carter to the line for 2 free throws. [Team fouls: 3] (Josh Banchero: 1 personal fouls)   FT 1/2: MISS   FT 2/2: GOOD Jabari Carter makes 1/2 from the line.
Score: 39-47

[02:05] Team_040 possession (Score: 39-47)
Josh Banchero drives to the basket... Josh Banchero commits a violation (traveling/carry)! TURNOVER! (dead ball)

[01:50] Team_038 possession (Score: 39-47)
Ja Smith attempts a Midrange. Wide open! Josh Banchero is 6.9 feet away. [MAN] JA SMITH MAKES IT! Assist: Jabari Carter
Score: 41-47

[01:39] Team_040 possession (Score: 41-47)
Josh Banchero drives, picks up Ja Smith. Help arrives from Jalen Hyland! Josh Banchero attempts a Dunk. Contested by Jalen Hyland (4.0 feet, MAN). Josh Banchero misses. Rebound secured by Jabari Carter.

[01:22] Team_038 possession (Score: 41-47)
Jaren Jokic drives, Tracy Middleton stays with him. Jaren Jokic attempts a Dunk. Contested by Tracy Middleton (5.7 feet, MAN). JAREN JOKIC MAKES IT! Assist: Magic Dosunmu
Score: 43-47

[01:12] Team_040 possession (Score: 43-47)
Klay Leonard attempts a Layup. Contested by Magic Dosunmu (3.1 feet, MAN). Klay Leonard misses. Rebound secured by Jalen Hyland.

[00:55] Team_038 possession (Score: 43-47)
Jalen Hyland drives, Cole O'Neal stays with him. Jalen Hyland attempts a Dunk. Wide open! Cole O'Neal is 6.8 feet away. [MAN] Jalen Hyland misses. Rebound secured by Josh Banchero.

[00:45] Team_040 possession (Score: 43-47)
RJ Curry loses control! Ball rolls out of bounds! TURNOVER! (dead ball)

[00:30] Team_038 possession (Score: 43-47)
Jaren Jokic attempts a 3Pt. Contested by RJ Curry (4.8 feet, ZONE). Jaren Jokic misses. Rebound secured by RJ Curry.

[00:18] Team_040 possession (Score: 43-47)
Tracy Middleton drives, picks up Ja Smith. Help arrives from Jalen Hyland! Tracy Middleton attempts a Dunk. Contested by Jalen Hyland (3.9 feet, ZONE). TRACY MIDDLETON MAKES IT!
Score: 43-49

[00:02] Team_038 possession (Score: 43-49)
Magic Dosunmu attempts a 3Pt. Contested by Klay Leonard (5.5 feet, MAN). Magic Dosunmu misses. Rebound secured by RJ Curry.

================================================================================
                              2ND QUARTER COMPLETE                              
================================================================================

2ND QUARTER SCORE: Team_038 25, Team_040 21

BOX SCORE:
================================================================================

Team_038
--------------------------------------------------------------------------------
Player                MIN  PTS  REB  AST  TO      FG   FG%      3P   3P%
--------------------------------------------------------------------------------
Jalen Hyland           10    6    2    0   0   3/4    75.0     0/0   0.0
Jabari Carter          10    6    6    1   0   3/4    75.0     0/0   0.0
Ja Smith               10    4    0    0   0   2/2   100.0     0/0   0.0
Malcolm Poole          14    3    0    0   0   1/1   100.0     0/0   0.0
Rudy Thompson          14    2    0    0   0   1/2    50.0     0/0   0.0
Jaren Jokic            10    2    0    1   0   1/3    33.3     0/0   0.0
Magic Dosunmu          10    2    0    3   0   1/4    25.0     0/0   0.0
Luka Barnes            14    0    0    1   0   0/0     0.0     0/0   0.0
Tracy LaVine           14    0    3    1   0   0/0     0.0     0/0   0.0

TEAM: FG: 12/20 (60.0%), 3PT: 2/7 (28.6%), REB: 11 (3 off, 8 def), AST: 7, TO: 2
TEAM FOULS: 5 [Team_040 in BONUS]


Team_040
--------------------------------------------------------------------------------
Player                MIN  PTS  REB  AST  TO      FG   FG%      3P   3P%
--------------------------------------------------------------------------------
Tracy Middleton        10    7    0    0   0   3/5    60.0     0/0   0.0
Shaquille Bane         14    3    0    0   0   1/2    50.0     0/0   0.0
Josh Banchero          10    3    6    0   0   1/2    50.0     0/0   0.0
Klay Leonard           10    3    2    1   0   1/2    50.0     0/0   0.0
Cole O'Neal            10    2    0    2   0   1/3    33.3     0/0   0.0
RJ Curry               10    2    4    2   0   1/1   100.0     0/0   0.0
Ayo Rose               14    0    0    0   0   0/1     0.0     0/0   0.0
Bam Gobert             14    0    1    0   0   0/0     0.0     0/0   0.0

TEAM: FG: 8/16 (50.0%), 3PT: 1/4 (25.0%), REB: 13 (5 off, 8 def), AST: 5, TO: 5
TEAM FOULS: 3

================================================================================

================================================================================
                       3RD QUARTER - Team_038 vs Team_040                       
================================================================================

[12:00] Team_038 possession (Score: 43-49)
Malcolm Poole attempts a Layup. Contested by Bam Gobert (3.8 feet, ZONE). MALCOLM POOLE MAKES IT! Assist: DeMar Harris
Score: 45-49

[11:43] Team_040 possession (Score: 45-49)
Carmelo Murray attempts a Midrange. Contested by Malcolm Poole (5.2 feet, ZONE). Carmelo Murray misses. Rebound secured by DeMar Harris.

[11:27] Team_038 possession (Score: 45-49)
Tracy LaVine drives, Dirk Johnson stays with him. Tracy LaVine attempts a Dunk. Contested by Dirk Johnson (5.7 feet, MAN). TRACY LAVINE MAKES IT! Assist: Luka Barnes
Score: 47-49

[11:11] Team_040 possession (Score: 47-49)
Dirk Johnson attempts a Midrange. Contested by Tracy LaVine (4.1 feet, MAN). Dirk Johnson misses. Rebound secured by Luka Barnes.

[10:56] Team_038 possession (Score: 47-49)
Luka Barnes drives to the basket... Luka Barnes commits a violation (traveling/carry)! TURNOVER! (dead ball)

[10:46] Team_040 possession (Score: 47-49)
Shaquille Bane attempts a 3Pt. Contested by Malcolm Poole (5.4 feet, MAN). Shaquille Bane misses. Rebound secured by Luka Barnes.

[10:33] Team_038 possession (Score: 47-49)
DeMar Harris attempts a Dunk. BLOCKED BY BAM GOBERT! Ball is loose! Offensive rebound by Tracy LaVine! Tracy LaVine kicks it out.

[10:17] Team_038 possession (Score: 47-49)
Tracy LaVine loses the ball! Stripped by Dirk Johnson! TURNOVER! (live ball)

[10:03] Team_040 possession (Score: 47-49)
Carmelo Murray attempts a Midrange. Contested by DeMar Harris (3.4 feet, MAN). CARMELO MURRAY MAKES IT!
Score: 47-51

[09:47] Team_038 possession (Score: 47-51)
DeMar Harris attempts a 3Pt. Contested by Carmelo Murray (5.2 feet, MAN). DeMar Harris misses. Rebound secured by Dirk Johnson.

[09:33] Team_040 possession (Score: 47-51)
Ayo Rose drives, Tracy LaVine stays with him. Ayo Rose attempts a Dunk. Contested by Tracy LaVine (4.5 feet, ZONE). Ayo Rose misses. Offensive rebound by Bam Gobert! Bam Gobert kicks it out.

[09:18] Team_040 possession (Score: 47-51)
Ayo Rose attempts a 3Pt. Contested by DeMar Harris (3.7 feet, ZONE). Ayo Rose misses. Rebound secured by Tracy LaVine.

[09:07] Team_038 possession (Score: 47-51)
Malcolm Poole drives to the basket... FOUL! Offensive foul on Malcolm Poole! Bam Gobert drew the charge! [Team fouls: 1] (Malcolm Poole: 1 personal fouls) TURNOVER! (dead ball)

[08:55] Team_040 possession (Score: 47-51)
Shaquille Bane attempts a Midrange. Contested by Malcolm Poole (5.4 feet, MAN). Shaquille Bane misses. Rebound secured by Luka Barnes.

[08:42] Team_038 possession (Score: 47-51)
Malcolm Poole attempts a Layup. BLOCKED BY BAM GOBERT! Ball is loose! Rebound secured by Bam Gobert.

[08:30] Team_040 possession (Score: 47-51)
Dirk Johnson attempts a Layup. Contested by Tracy LaVine (4.1 feet, ZONE). DIRK JOHNSON MAKES IT! Assist: Bam Gobert
Score: 47-53

[08:18] Team_038 possession (Score: 47-53)
Rudy Thompson drives, picks up Bam Gobert. Help arrives from Shaquille Bane! Rudy Thompson attempts a Dunk. Contested by Shaquille Bane (4.5 feet, ZONE). Rudy Thompson misses. Rebound secured by Dirk Johnson.

[08:04] Team_040 possession (Score: 47-53)
Dirk Johnson attempts a 3Pt. Contested by DeMar Harris (3.3 feet, ZONE). Dirk Johnson misses. Offensive rebound by Bam Gobert! Bam Gobert kicks it out.

[07:53] Team_040 possession (Score: 47-53)
Bam Gobert attempts a Layup. Contested by Luka Barnes (4.5 feet, MAN). BAM GOBERT MAKES IT! Assist: Dirk Johnson
Score: 47-55

[07:39] Team_038 possession (Score: 47-55)
FOUL! Holding foul on Ayo Rose. [Team fouls: 1] No free throws, side out. (Ayo Rose: 1 personal fouls)

[07:25] Team_038 possession (Score: 47-55)
Rudy Thompson attempts a Midrange. Contested by Ayo Rose (5.2 feet, MAN). Rudy Thompson misses. Offensive rebound by Tracy LaVine! Tracy LaVine puts it back in!
Score: 49-55

[07:11] Team_040 possession (Score: 49-55)
Shaquille Bane drives to the basket... Shaquille Bane throws a bad pass out of bounds! TURNOVER! (dead ball)

[06:56] Team_038 possession (Score: 49-55)
FOUL! Holding foul on Dirk Johnson. [Team fouls: 2] No free throws, side out. (Dirk Johnson: 1 personal fouls)

[06:43] Team_038 possession (Score: 49-55)
Tracy LaVine loses the ball! Stripped by Dirk Johnson! TURNOVER! (live ball)

[06:28] Team_040 possession (Score: 49-55)
Shaquille Bane attempts a 3Pt. Contested by Malcolm Poole (5.4 feet, MAN). Shaquille Bane misses. Rebound secured by Luka Barnes.

[06:13] Team_038 possession (Score: 49-55)
Tracy LaVine drives and kicks out. DeMar Harris attempts a Midrange. Contested by Ayo Rose (4.6 feet, ZONE). DEMAR HARRIS MAKES IT!
Score: 51-55

[05:59] Team_040 possession (Score: 51-55)
Ayo Rose drives to the basket... Ayo Rose throws a bad pass! Stolen by Rudy Thompson! TURNOVER! (live ball)

[05:46] Team_038 possession (Score: 51-55)
Luka Barnes makes the Layup and draws the foul on Bam Gobert! And-1! Luka Barnes to the line for 1. [Team fouls: 3] (Bam Gobert: 1 personal fouls)   FT 1/1: GOOD Luka Barnes makes 1/1 from the line.
Score: 54-55

[05:33] Team_040 possession (Score: 54-55)
Shaquille Bane attempts a 3Pt. Contested by DeMar Harris (3.6 feet, ZONE). Shaquille Bane misses. Rebound secured by Luka Barnes.

[05:18] Team_038 possession (Score: 54-55)
DeMar Harris attempts a 3Pt. Contested by Ayo Rose (5.4 feet, ZONE). DEMAR HARRIS MAKES IT!
Score: 57-55

[05:03] Team_040 possession (Score: 57-55)
Dirk Johnson attempts a Layup. Contested by Tracy LaVine (4.1 feet, MAN). DIRK JOHNSON MAKES IT!
Score: 57-57

[04:51] Team_038 possession (Score: 57-57)
DeMar Harris attempts a 3Pt. Contested by Carmelo Murray (5.3 feet, MAN). DEMAR HARRIS MAKES IT! Assist: Tracy LaVine
Score: 60-57

[04:38] Team_040 possession (Score: 60-57)
Shaquille Bane throws a bad pass! Stolen by Malcolm Poole! TURNOVER! (live ball)

[04:22] Team_038 possession (Score: 60-57)
DeMar Harris attempts a 3Pt. Contested by Carmelo Murray (5.3 feet, MAN). DEMAR HARRIS MAKES IT! Assist: Luka Barnes
Score: 63-57

[04:10] Team_040 possession (Score: 63-57)
Shaquille Bane attempts a 3Pt. Contested by Malcolm Poole (5.4 feet, MAN). Shaquille Bane misses. Rebound secured by Tracy LaVine.

[03:56] Team_038 possession (Score: 63-57)
Tracy LaVine drives and kicks out. Luka Barnes attempts a 3Pt. Contested by Ayo Rose (4.8 feet, ZONE). Luka Barnes misses. Rebound secured by Dirk Johnson.

[03:38] Team_040 possession (Score: 63-57)
Bam Gobert attempts a Dunk. BLOCKED BY LUKA BARNES! Ball is loose! Rebound secured by DeMar Harris.

[03:25] Team_038 possession (Score: 63-57)
FOUL! Reach-in foul on Bam Gobert during the drive. [Team fouls: 4] No free throws, side out. (Bam Gobert: 2 personal fouls)

[03:11] Team_038 possession (Score: 63-57)
Rudy Thompson drives, Ayo Rose stays with him. Rudy Thompson attempts a Layup. Contested by Ayo Rose (5.4 feet, MAN). Rudy Thompson misses. Rebound secured by Bam Gobert.

[02:59] Team_040 possession (Score: 63-57)
Dirk Johnson attempts a 3Pt. Contested by Tracy LaVine (4.3 feet, MAN). DIRK JOHNSON MAKES IT! Assist: Shaquille Bane
Score: 63-60

[02:47] Team_038 possession (Score: 63-60)
FOUL! Shooting foul on Ayo Rose. Rudy Thompson to the line for 2 free throws. [BONUS: 5 team fouls] (Ayo Rose: 2 personal fouls)   FT 1/2: MISS   FT 2/2: MISS Rudy Thompson makes 0/2 from the line. Rebound secured by Shaquille Bane.

[02:33] Team_040 possession (Score: 63-60)
Bam Gobert attempts a 3Pt. Contested by DeMar Harris (3.7 feet, ZONE). Bam Gobert misses. Offensive rebound by Dirk Johnson! Dirk Johnson kicks it out.

[02:17] Team_040 possession (Score: 63-60)
Carmelo Murray drives to the basket... Carmelo Murray throws a bad pass out of bounds! TURNOVER! (dead ball)

[02:17] Substitution (Team_038): Rudy Thompson OUT → Jalen Hyland IN (stamina_rule2)

[02:17] Substitution (Team_038): Malcolm Poole OUT → Jaren Jokic IN (stamina_rule2)

[02:17] Substitution (Team_038): DeMar Harris OUT → Magic Dosunmu IN (stamina_rule2)

[02:17] Substitution (Team_038): Tracy LaVine OUT → Jabari Carter IN (stamina_rule2)

[02:17] Substitution (Team_038): Luka Barnes OUT → Ja Smith IN (stamina_rule2)

[02:17] Substitution (Team_040): Ayo Rose OUT → Cole O'Neal IN (stamina_rule2)

[02:17] Substitution (Team_040): Shaquille Bane OUT → Tracy Middleton IN (stamina_rule2)

[02:17] Substitution (Team_040): Carmelo Murray OUT → Klay Leonard IN (stamina_rule2)

[02:17] Substitution (Team_040): Dirk Johnson OUT → RJ Curry IN (stamina_rule2)

[02:17] Substitution (Team_040): Bam Gobert OUT → Josh Banchero IN (stamina_rule2)

[02:00] Team_038 possession (Score: 63-60)
Jabari Carter attempts a Layup. Contested by RJ Curry (5.4 feet, MAN). Jabari Carter misses. Rebound secured by Josh Banchero.

[01:45] Team_040 possession (Score: 63-60)
Cole O'Neal attempts a 3Pt. Contested by Jalen Hyland (4.3 feet, MAN). COLE O'NEAL MAKES IT! Assist: RJ Curry
Score: 63-63

[01:32] Team_038 possession (Score: 63-63)
Ja Smith drives, Josh Banchero stays with him. Ja Smith attempts a Layup. Wide open! Josh Banchero is 6.8 feet away. [MAN] JA SMITH MAKES IT!
Score: 65-63

[01:17] Team_040 possession (Score: 65-63)
Josh Banchero drives and kicks out. Tracy Middleton makes the 3Pt and draws the foul on Jalen Hyland! And-1! Tracy Middleton to the line for 1. [Team fouls: 2] (Jalen Hyland: 1 personal fouls)   FT 1/1: GOOD Tracy Middleton makes 1/1 from the line.
Score: 65-67

[01:02] Team_038 possession (Score: 65-67)
FOUL! Offensive foul on Jabari Carter! RJ Curry drew the charge! [Team fouls: 3] (Jabari Carter: 1 personal fouls) TURNOVER! (dead ball)

[00:47] Team_040 possession (Score: 65-67)
Josh Banchero attempts a Midrange. Contested by Ja Smith (3.7 feet, MAN). Josh Banchero misses. Rebound secured by Jalen Hyland.

[00:35] Team_038 possession (Score: 65-67)
Magic Dosunmu drives and kicks out. Jalen Hyland attempts a 3Pt. Wide open! Cole O'Neal is 6.5 feet away. [MAN] Jalen Hyland misses. Offensive rebound by Ja Smith! Ja Smith's putback is no good. Rebound secured by Klay Leonard.

[00:24] Team_040 possession (Score: 65-67)
Tracy Middleton attempts a 3Pt. Contested by Jalen Hyland (4.5 feet, ZONE). Tracy Middleton misses. Rebound secured by Jabari Carter.

[00:06] Team_038 possession (Score: 65-67)
FOUL! Shooting foul on Klay Leonard. Magic Dosunmu to the line for 3 free throws. [BONUS: 6 team fouls] (Klay Leonard: 1 personal fouls)   FT 1/3: GOOD   FT 2/3: GOOD   FT 3/3: GOOD Magic Dosunmu makes 3/3 from the line.
Score: 68-67

================================================================================
                              3RD QUARTER COMPLETE                              
================================================================================

3RD QUARTER SCORE: Team_038 25, Team_040 18

BOX SCORE:
================================================================================

Team_038
--------------------------------------------------------------------------------
Player                MIN  PTS  REB  AST  TO      FG   FG%      3P   3P%
--------------------------------------------------------------------------------
DeMar Harris           24   11    2    1   0   4/5    80.0     0/0   0.0
Tracy LaVine           24    4    4    1   0   2/3    66.7     0/0   0.0
Luka Barnes            24    3    5    2   0   1/1   100.0     0/0   0.0
Magic Dosunmu          13    3    0    0   0   1/2    50.0     0/0   0.0
Malcolm Poole          24    2    0    0   0   1/2    50.0     0/0   0.0
Ja Smith               13    2    0    0   0   1/1   100.0     0/0   0.0
Rudy Thompson          24    0    0    0   0   0/3     0.0     0/0   0.0
Jabari Carter          13    0    1    0   0   0/1     0.0     0/0   0.0
Jalen Hyland           13    0    1    0   0   0/0     0.0     0/0   0.0
Klay Leonard           13    0    1    0   0   0/0     0.0     0/0   0.0

TEAM: FG: 10/18 (55.6%), 3PT: 4/5 (80.0%), REB: 14 (3 off, 11 def), AST: 4, TO: 5
TEAM FOULS: 3


Team_040
--------------------------------------------------------------------------------
Player                MIN  PTS  REB  AST  TO      FG   FG%      3P   3P%
--------------------------------------------------------------------------------
Dirk Johnson           24    7    4    1   0   3/4    75.0     0/0   0.0
Tracy Middleton        13    4    0    0   0   1/2    50.0     0/0   0.0
Cole O'Neal            13    3    0    0   0   1/1   100.0     0/0   0.0
Carmelo Murray         24    2    0    0   0   1/2    50.0     0/0   0.0
Bam Gobert             24    2    4    1   0   1/2    50.0     0/0   0.0
Shaquille Bane         24    0    1    1   0   0/5     0.0     0/0   0.0
Ayo Rose               24    0    0    0   0   0/1     0.0     0/0   0.0
Josh Banchero          13    0    1    0   0   0/1     0.0     0/0   0.0
RJ Curry               13    0    0    1   0   0/0     0.0     0/0   0.0

TEAM: FG: 7/18 (38.9%), 3PT: 2/8 (25.0%), REB: 10 (3 off, 7 def), AST: 4, TO: 4
TEAM FOULS: 6 [Team_038 in BONUS]

================================================================================

================================================================================
                       4TH QUARTER - Team_038 vs Team_040                       
================================================================================

[12:00] Team_038 possession (Score: 68-67)
Rudy Thompson drives, picks up Ayo Rose. Help arrives from Shaquille Bane! Rudy Thompson attempts a Layup. Contested by Shaquille Bane (5.3 feet, MAN). RUDY THOMPSON MAKES IT! Assist: DeMar Harris
Score: 70-67

[11:46] Team_040 possession (Score: 70-67)
Carmelo Murray attempts a 3Pt. Contested by DeMar Harris (3.4 feet, ZONE). Carmelo Murray misses. Rebound secured by Luka Barnes.

[11:29] Team_038 possession (Score: 70-67)
Malcolm Poole drives and kicks out. Malcolm Poole attempts a 3Pt. Contested by Ayo Rose (4.7 feet, ZONE). Malcolm Poole misses. FOUL! Loose ball foul on Dirk Johnson during the rebound battle. [Team fouls: 1] No free throws, side out. (Dirk Johnson: 1 personal fouls)

[11:14] Team_038 possession (Score: 70-67)
Tracy LaVine drives and kicks out. Rudy Thompson attempts a Midrange. Contested by Ayo Rose (4.7 feet, MAN). RUDY THOMPSON MAKES IT! Assist: DeMar Harris
Score: 72-67

[11:03] Team_040 possession (Score: 72-67)
Dirk Johnson makes the Layup and draws the foul on Tracy LaVine! And-1! Dirk Johnson to the line for 1. [Team fouls: 1] (Tracy LaVine: 1 personal fouls)   FT 1/1: GOOD Dirk Johnson makes 1/1 from the line.
Score: 72-70

[10:47] Team_038 possession (Score: 72-70)
Luka Barnes drives, Bam Gobert stays with him. Luka Barnes attempts a Layup. Contested by Bam Gobert (4.3 feet, MAN). Luka Barnes misses. Rebound secured by Dirk Johnson.

[10:31] Team_040 possession (Score: 72-70)
Dirk Johnson makes the Layup and draws the foul on Malcolm Poole! And-1! Dirk Johnson to the line for 1. [Team fouls: 2] (Malcolm Poole: 1 personal fouls)   FT 1/1: GOOD Dirk Johnson makes 1/1 from the line.
Score: 72-73

[10:16] Team_038 possession (Score: 72-73)
Tracy LaVine attempts a 3Pt. Contested by Ayo Rose (4.6 feet, ZONE). Tracy LaVine misses. Rebound secured by Shaquille Bane.

[09:56] Team_040 possession (Score: 72-73)
Bam Gobert drives to the basket... Bam Gobert throws a bad pass! Stolen by Luka Barnes! TURNOVER! (live ball)

[09:43] Team_038 possession (Score: 72-73)
Tracy LaVine attempts a Midrange. Contested by Ayo Rose (4.7 feet, ZONE). TRACY LAVINE MAKES IT! Assist: Rudy Thompson
Score: 74-73

[09:29] Team_040 possession (Score: 74-73)
Ayo Rose attempts a 3Pt. Contested by Rudy Thompson (4.7 feet, MAN). Ayo Rose misses. Rebound secured by Luka Barnes.

[09:15] Team_038 possession (Score: 74-73)
FOUL! Shooting foul on Bam Gobert. Luka Barnes to the line for 3 free throws. [Team fouls: 2] (Bam Gobert: 1 personal fouls)   FT 1/3: GOOD   FT 2/3: GOOD   FT 3/3: GOOD Luka Barnes makes 3/3 from the line.
Score: 77-73

[09:01] Team_040 possession (Score: 77-73)
Shaquille Bane attempts a 3Pt. Contested by Malcolm Poole (5.5 feet, MAN). Shaquille Bane misses. Rebound secured by Tracy LaVine.

[08:50] Team_038 possession (Score: 77-73)
Luka Barnes drives, Bam Gobert stays with him. Luka Barnes attempts a Dunk. Contested by Bam Gobert (4.5 feet, MAN). Luka Barnes misses. Rebound secured by Dirk Johnson.

[08:34] Team_040 possession (Score: 77-73)
Ayo Rose attempts a 3Pt. Contested by Rudy Thompson (4.8 feet, MAN). Ayo Rose misses. Rebound secured by DeMar Harris.

[08:19] Team_038 possession (Score: 77-73)
Luka Barnes attempts a Midrange. Wide open! Dirk Johnson is 6.4 feet away. [ZONE] LUKA BARNES MAKES IT!
Score: 79-73

[08:04] Team_040 possession (Score: 79-73)
Carmelo Murray attempts a Midrange. Contested by DeMar Harris (3.8 feet, ZONE). Carmelo Murray misses. Rebound secured by DeMar Harris.

[07:50] Team_038 possession (Score: 79-73)
Luka Barnes loses the ball! Stripped by Bam Gobert! TURNOVER! (live ball)

[07:35] Team_040 possession (Score: 79-73)
FOUL! Holding foul on Rudy Thompson. [Team fouls: 3] No free throws, side out. (Rudy Thompson: 1 personal fouls)

[07:22] Team_040 possession (Score: 79-73)
Bam Gobert loses the ball! Stripped by Luka Barnes! TURNOVER! (live ball)

[07:09] Team_038 possession (Score: 79-73)
DeMar Harris attempts a Midrange. Contested by Carmelo Murray (5.7 feet, MAN). DeMar Harris misses. Offensive rebound by Tracy LaVine! Tracy LaVine kicks it out.

[06:55] Team_038 possession (Score: 79-73)
DeMar Harris makes the Layup and draws the foul on Carmelo Murray! And-1! DeMar Harris to the line for 1. [Team fouls: 3] (Carmelo Murray: 1 personal fouls)   FT 1/1: GOOD DeMar Harris makes 1/1 from the line.
Score: 82-73

[06:38] Team_040 possession (Score: 82-73)
Ayo Rose drives to the basket... FOUL! Offensive foul on Ayo Rose! Tracy LaVine drew the charge! [Team fouls: 4] (Ayo Rose: 1 personal fouls) TURNOVER! (dead ball)

[06:25] Team_038 possession (Score: 82-73)
FOUL! Shooting foul on Shaquille Bane. Malcolm Poole to the line for 2 free throws. [BONUS: 5 team fouls] (Shaquille Bane: 1 personal fouls)   FT 1/2: GOOD   FT 2/2: GOOD Malcolm Poole makes 2/2 from the line.
Score: 84-73

[06:10] Team_040 possession (Score: 84-73)
Carmelo Murray attempts a 3Pt. Contested by DeMar Harris (4.1 feet, ZONE). Carmelo Murray misses. Rebound secured by Tracy LaVine.

[05:54] Team_038 possession (Score: 84-73)
FOUL! Offensive foul on DeMar Harris! Carmelo Murray drew the charge! [Team fouls: 4] (DeMar Harris: 1 personal fouls) TURNOVER! (dead ball)

[05:38] Team_040 possession (Score: 84-73)
Shaquille Bane drives and kicks out. Ayo Rose attempts a 3Pt. Contested by Rudy Thompson (4.6 feet, MAN). Ayo Rose misses. Rebound secured by Luka Barnes.

[05:21] Team_038 possession (Score: 84-73)
Rudy Thompson attempts a 3Pt. Contested by Ayo Rose (5.9 feet, ZONE). Rudy Thompson misses. Rebound secured by Shaquille Bane.

[05:09] Team_040 possession (Score: 84-73)
Carmelo Murray attempts a 3Pt. Contested by DeMar Harris (4.2 feet, ZONE). Carmelo Murray misses. Rebound secured by Tracy LaVine.

[04:57] Team_038 possession (Score: 84-73)
FOUL! Shooting foul on Shaquille Bane. Luka Barnes to the line for 2 free throws. [BONUS: 6 team fouls] (Shaquille Bane: 2 personal fouls)   FT 1/2: GOOD   FT 2/2: GOOD Luka Barnes makes 2/2 from the line.
Score: 86-73

[04:40] Team_040 possession (Score: 86-73)
Ayo Rose attempts a Midrange. Contested by Rudy Thompson (5.2 feet, MAN). AYO ROSE MAKES IT! Assist: Carmelo Murray
Score: 86-75

[04:28] Team_038 possession (Score: 86-75)
Tracy LaVine attempts a Midrange. Wide open! Dirk Johnson is 6.4 feet away. [MAN] Tracy LaVine misses. Rebound secured by Bam Gobert.

[04:13] Team_040 possession (Score: 86-75)
Bam Gobert attempts a Midrange. Contested by Luka Barnes (5.3 feet, MAN). Bam Gobert misses. Offensive rebound by Dirk Johnson! Dirk Johnson kicks it out.

[03:58] Team_040 possession (Score: 86-75)
Carmelo Murray attempts a Layup. Contested by Tracy LaVine (5.1 feet, ZONE). Carmelo Murray misses. Rebound secured by DeMar Harris.

[03:43] Team_038 possession (Score: 86-75)
Tracy LaVine attempts a Midrange. Wide open! Dirk Johnson is 6.4 feet away. [ZONE] Tracy LaVine misses. Rebound secured by Shaquille Bane.

[03:26] Team_040 possession (Score: 86-75)
Dirk Johnson makes the Midrange and draws the foul on Luka Barnes! And-1! Dirk Johnson to the line for 1. [BONUS: 5 team fouls] (Luka Barnes: 1 personal fouls)   FT 1/1: GOOD Dirk Johnson makes 1/1 from the line.
Score: 86-78

[03:12] Team_038 possession (Score: 86-78)
Malcolm Poole attempts a 3Pt. Contested by Ayo Rose (5.6 feet, ZONE). Malcolm Poole misses. Offensive rebound by Luka Barnes! Luka Barnes kicks it out.

[02:59] Team_038 possession (Score: 86-78)
DeMar Harris attempts a 3Pt. Wide open! Carmelo Murray is 6.1 feet away. [MAN] DeMar Harris misses. Offensive rebound by Luka Barnes! Luka Barnes kicks it out.

[02:44] Team_038 possession (Score: 86-78)
Luka Barnes attempts a 3Pt. Contested by Shaquille Bane (5.9 feet, ZONE). Luka Barnes misses. Rebound secured by Bam Gobert.

[02:30] Team_040 possession (Score: 86-78)
Bam Gobert attempts a 3Pt. Contested by Rudy Thompson (5.2 feet, ZONE). BAM GOBERT MAKES IT! Assist: Ayo Rose
Score: 86-81

[02:10] Team_038 possession (Score: 86-81)
FOUL! Holding foul on Bam Gobert. [IN THE BONUS! 7 team fouls] Luka Barnes to the line for 2 free throws. (Bam Gobert: 2 personal fouls)   FT 1/2: GOOD   FT 2/2: GOOD Luka Barnes makes 2/2 from the line.
Score: 88-81

[01:54] Team_040 possession (Score: 88-81)
Ayo Rose attempts a 3Pt. Contested by Rudy Thompson (5.6 feet, MAN). Ayo Rose misses. Rebound secured by Tracy LaVine.

[01:39] Team_038 possession (Score: 88-81)
Rudy Thompson attempts a 3Pt. Wide open! Ayo Rose is 6.4 feet away. [MAN] Rudy Thompson misses. Rebound secured by Bam Gobert.

[01:28] Team_040 possession (Score: 88-81)
Dirk Johnson attempts a Midrange. Contested by Tracy LaVine (5.4 feet, MAN). DIRK JOHNSON MAKES IT!
Score: 88-83

[01:15] Team_038 possession (Score: 88-83)
Rudy Thompson attempts a 3Pt. Wide open! Ayo Rose is 6.4 feet away. [ZONE] Rudy Thompson misses. Rebound secured by Dirk Johnson.

[00:58] Team_040 possession (Score: 88-83)
Ayo Rose attempts a 3Pt. Contested by DeMar Harris (5.1 feet, ZONE). Ayo Rose misses. Rebound secured by Tracy LaVine.

[00:42] Team_038 possession (Score: 88-83)
Malcolm Poole attempts a 3Pt. Contested by Ayo Rose (6.0 feet, ZONE). Malcolm Poole misses. Offensive rebound by Luka Barnes! Luka Barnes kicks it out.

[00:28] Team_038 possession (Score: 88-83)
Rudy Thompson attempts a 3Pt. Wide open! Shaquille Bane is 6.4 feet away. [ZONE] Rudy Thompson misses. FOUL! Loose ball foul on Bam Gobert during the rebound battle. [IN THE BONUS! 8 team fouls] Luka Barnes to the line for 2 free throws. (Bam Gobert: 3 personal fouls)   FT 1/2: GOOD   FT 2/2: MISS Luka Barnes makes 1/2 from the line. Rebound secured by Shaquille Bane.
Score: 89-83

[00:16] Team_040 possession (Score: 89-83)
Shaquille Bane attempts a 3Pt. Wide open! Malcolm Poole is 6.4 feet away. [MAN] Shaquille Bane misses. Offensive rebound by Bam Gobert! Bam Gobert kicks it out.

[00:03] Team_040 possession (Score: 89-83)
FOUL! Shooting foul on Malcolm Poole. Bam Gobert to the line for 2 free throws. [BONUS: 6 team fouls] (Malcolm Poole: 2 personal fouls)   FT 1/2: GOOD   FT 2/2: GOOD Bam Gobert makes 2/2 from the line.
Score: 89-85

================================================================================
                              4TH QUARTER COMPLETE                              
================================================================================

4TH QUARTER SCORE: Team_038 21, Team_040 18

BOX SCORE:
================================================================================

Team_038
--------------------------------------------------------------------------------
Player                MIN  PTS  REB  AST  TO      FG   FG%      3P   3P%
--------------------------------------------------------------------------------
Luka Barnes            36    9    7    0   0   4/7    57.1     0/0   0.0
Rudy Thompson          36    4    0    1   0   2/6    33.3     0/0   0.0
DeMar Harris           36    3    3    2   0   1/1   100.0     0/0   0.0
Tracy LaVine           36    2    6    0   0   1/4    25.0     0/0   0.0
Malcolm Poole          36    2    0    0   0   1/1   100.0     0/0   0.0
Shaquille Bane         36    0    4    0   0   0/2     0.0     0/0   0.0

TEAM: FG: 9/19 (47.4%), 3PT: 1/7 (14.3%), REB: 17 (6 off, 11 def), AST: 3, TO: 2
TEAM FOULS: 6 [Team_040 in BONUS]


Team_040
--------------------------------------------------------------------------------
Player                MIN  PTS  REB  AST  TO      FG   FG%      3P   3P%
--------------------------------------------------------------------------------
Dirk Johnson           36   11    4    0   0   4/4   100.0     0/0   0.0
Bam Gobert             36    5    4    0   0   2/2   100.0     0/0   0.0
Ayo Rose               36    2    0    1   0   1/5    20.0     0/0   0.0
Carmelo Murray         36    0    0    1   0   0/5     0.0     0/0   0.0

TEAM: FG: 7/18 (38.9%), 3PT: 1/9 (11.1%), REB: 11 (2 off, 9 def), AST: 2, TO: 3
TEAM FOULS: 8 [Team_038 in BONUS]

================================================================================

================================================================================
                               FULL GAME COMPLETE                               
================================================================================

FINAL SCORE: Team_038 89, Team_040 85

SCORING BY QUARTER:
--------------------------------------------------------------------------------
Team                     Q1     Q2     Q3     Q4    FINAL
--------------------------------------------------------------------------------
Team_038                 18     25     25     21       89
Team_040                 28     21     18     18       85
--------------------------------------------------------------------------------

FULL GAME BOX SCORE:
================================================================================

Team_038
--------------------------------------------------------------------------------
Player                MIN  PTS  REB  AST  TO      FG   FG%      3P   3P%      FT STL BLK
--------------------------------------------------------------------------------
Rudy Thompson          36   17    0    1   0   7/18   38.9   0/7     0.0   2/4     1   0
Malcolm Poole          36    7    0    2   3   2/6    33.3   0/1     0.0   2/2     2   0
DeMar Harris           36   17    6    3   2   6/9    66.7   3/4    75.0   2/3     0   0
Tracy LaVine           36    6   18    2   3   5/12   41.7   0/1     0.0   0/1     0   1
Luka Barnes            36   14   14    4   2   5/9    55.6   1/2    50.0  11/12    2   1
Jalen Hyland           13    6    3    0   0   3/4    75.0   0/0     0.0   0/0     0   0
Jaren Jokic            13    2    0    1   0   1/3    33.3   0/1     0.0   0/0     0   0
Magic Dosunmu          13    5    0    3   1   3/7    42.9   2/5    40.0   5/5     1   0
Jabari Carter          13    6    7    1   1   2/4    50.0   1/2    50.0   1/2     0   0
Ja Smith               13    6    0    0   0   3/3   100.0   0/0     0.0   0/0     0   0

TEAM: FG: 39/77 (50.6%), 3PT: 7/23 (30.4%), REB: 49 (12 off, 37 def), AST: 17, TO: 12


Team_040
--------------------------------------------------------------------------------
Player                MIN  PTS  REB  AST  TO      FG   FG%      3P   3P%      FT STL BLK
--------------------------------------------------------------------------------
Ayo Rose               36   12    0    2   0   5/14   35.7   2/9    22.2   0/0     1   0
Shaquille Bane         36    5    9    2   2   2/10   20.0   0/6     0.0   1/1     0   0
Carmelo Murray         36    7    0    2   5   3/11   27.3   0/4     0.0   1/1     0   0
Dirk Johnson           36   21   11    3   1   7/8    87.5   1/1   100.0   6/7     2   0
Bam Gobert             36   15   13    2   2   8/11   72.7   2/2   100.0   3/3     1   2
Cole O'Neal            13    5    0    2   2   2/4    50.0   1/2    50.0   0/0     0   0
Tracy Middleton        13   11    0    0   0   2/5    40.0   0/1     0.0   2/3     0   0
Klay Leonard           13    3    3    1   1   1/2    50.0   1/1   100.0   0/0     0   0
RJ Curry               13    2    4    3   2   2/2   100.0   0/0     0.0   0/0     0   0
Josh Banchero          13    3    7    0   0   2/4    50.0   0/0     0.0   1/1     0   0

TEAM: FG: 34/71 (47.9%), 3PT: 7/26 (26.9%), REB: 46 (10 off, 36 def), AST: 17, TO: 15

================================================================================
