================================================================================
                        FULL GAME - Team_022 vs Team_006                        
================================================================================

================================================================================
                       1ST QUARTER - Team_022 vs Team_006                       
================================================================================

[12:00] Team_022 possession (Score: 0-0)
Michael Ginobili makes the Midrange and draws the foul on Ja Butler! And-1! Michael Ginobili to the line for 1. [Team fouls: 1] (Ja Butler: 1 personal fouls)   FT 1/1: MISS Michael Ginobili makes 0/1 from the line. Rebound secured by Bradley Gobert.
Score: 2-0

[11:45] Team_006 possession (Score: 2-0)
Jayson Young attempts a 3Pt. Contested by Myles Anthony (4.8 feet, MAN). Jayson Young misses. Rebound secured by Michael Ginobili.

[11:32] Team_022 possession (Score: 2-0)
Dirk Markkanen attempts a Dunk. BLOCKED BY BRADLEY GOBERT! Ball is loose! Rebound secured by Shai Westbrook.

[11:19] Team_006 possession (Score: 2-0)
Bradley Gobert attempts a Layup. Contested by Dirk Markkanen (4.5 feet, ZONE). BRADLEY GOBERT MAKES IT! Assist: Shai Westbrook
Score: 2-2

[10:59] Team_022 possession (Score: 2-2)
Myles Anthony attempts a 3Pt. Contested by Jayson Young (4.8 feet, MAN). MYLES ANTHONY MAKES IT!
Score: 5-2

[10:45] Team_006 possession (Score: 5-2)
FOUL! Holding foul on Dirk Markkanen. [Team fouls: 1] No free throws, side out. (Dirk Markkanen: 1 personal fouls)

[10:27] Team_006 possession (Score: 5-2)
Shai Westbrook drives, picks up Malcolm Allen. Help arrives from Michael Ginobili! Shai Westbrook attempts a Layup. Contested by Michael Ginobili (4.4 feet, MAN). Shai Westbrook misses. Rebound secured by Myles Anthony.

[10:16] Team_022 possession (Score: 5-2)
Dirk Markkanen attempts a 3Pt. Contested by Shai Westbrook (4.3 feet, ZONE). Dirk Markkanen misses. Offensive rebound by Michael Ginobili! Michael Ginobili kicks it out.

[10:01] Team_022 possession (Score: 5-2)
Lamelo Dosunmu attempts a 3Pt. Contested by Ja Butler (3.3 feet, MAN). Lamelo Dosunmu misses. Rebound secured by Shai Westbrook.

[09:46] Team_006 possession (Score: 5-2)
Bradley Gobert makes the Layup and draws the foul on Dirk Markkanen! And-1! Bradley Gobert to the line for 1. [Team fouls: 2] (Dirk Markkanen: 2 personal fouls)   FT 1/1: GOOD Bradley Gobert makes 1/1 from the line.
Score: 5-5

[09:32] Team_022 possession (Score: 5-5)
Dirk Markkanen drives and kicks out. Michael Ginobili attempts a 3Pt. Contested by Shai Westbrook (3.8 feet, ZONE). MICHAEL GINOBILI MAKES IT! Assist: Malcolm Allen
Score: 8-5

[09:20] Team_006 possession (Score: 8-5)
Bradley Gobert drives, picks up Dirk Markkanen. Help arrives from Michael Ginobili! Bradley Gobert attempts a Layup. Contested by Michael Ginobili (4.5 feet, ZONE). BRADLEY GOBERT MAKES IT! Assist: Ja Butler
Score: 8-7

[09:08] Team_022 possession (Score: 8-7)
Dirk Markkanen attempts a Midrange. Contested by Jayson Young (5.1 feet, ZONE). Dirk Markkanen misses. Offensive rebound by Michael Ginobili! Michael Ginobili kicks it out.

[08:57] Team_022 possession (Score: 8-7)
Lamelo Dosunmu throws a bad pass out of bounds! TURNOVER! (dead ball)

[08:46] Team_006 possession (Score: 8-7)
FOUL! Offensive foul on Jayson Young! Myles Anthony drew the charge! [Team fouls: 2] (Jayson Young: 1 personal fouls) TURNOVER! (dead ball)

[08:29] Team_022 possession (Score: 8-7)
Michael Ginobili attempts a 3Pt. Contested by Shai Westbrook (3.9 feet, ZONE). Michael Ginobili misses. FOUL! Loose ball foul on Shai Westbrook during the rebound battle. [Team fouls: 3] No free throws, side out. (Shai Westbrook: 1 personal fouls)

[08:13] Team_022 possession (Score: 8-7)
Dirk Markkanen attempts a Midrange. Contested by Jayson Young (5.1 feet, ZONE). DIRK MARKKANEN MAKES IT! Assist: Lamelo Dosunmu
Score: 10-7

[08:00] Team_006 possession (Score: 10-7)
Franz Wagner attempts a Midrange. Contested by Michael Ginobili (3.6 feet, ZONE). Franz Wagner misses. Rebound secured by Dirk Markkanen.

[07:47] Team_022 possession (Score: 10-7)
Dirk Markkanen drives, Bradley Gobert stays with him. Dirk Markkanen attempts a Layup. Contested by Bradley Gobert (3.3 feet, MAN). DIRK MARKKANEN MAKES IT! Assist: Malcolm Allen
Score: 12-7

[07:31] Team_006 possession (Score: 12-7)
Shai Westbrook attempts a 3Pt. Contested by Malcolm Allen (4.4 feet, MAN). Shai Westbrook misses. Rebound secured by Dirk Markkanen.

[07:12] Team_022 possession (Score: 12-7)
Malcolm Allen drives to the basket... Malcolm Allen throws a bad pass! Stolen by Bradley Gobert! TURNOVER! (live ball)

[06:59] Team_006 possession (Score: 12-7)
Franz Wagner attempts a 3Pt. Contested by Michael Ginobili (3.6 feet, MAN). Franz Wagner misses. FOUL! Loose ball foul on Michael Ginobili during the rebound battle. [Team fouls: 3] No free throws, side out. (Michael Ginobili: 1 personal fouls)

[06:45] Team_006 possession (Score: 12-7)
Jayson Young attempts a 3Pt. Contested by Myles Anthony (4.8 feet, MAN). Jayson Young misses. Rebound secured by Dirk Markkanen.

[06:31] Team_022 possession (Score: 12-7)
Dirk Markkanen makes the Dunk and draws the foul on Bradley Gobert! And-1! Dirk Markkanen to the line for 1. [Team fouls: 4] (Bradley Gobert: 1 personal fouls)   FT 1/1: GOOD Dirk Markkanen makes 1/1 from the line.
Score: 15-7

[06:16] Team_006 possession (Score: 15-7)
FOUL! Reach-in foul on Myles Anthony during the drive. [Team fouls: 4] No free throws, side out. (Myles Anthony: 1 personal fouls)

[06:05] Team_006 possession (Score: 15-7)
Bradley Gobert makes the Layup and draws the foul on Dirk Markkanen! And-1! Bradley Gobert to the line for 1. [BONUS: 5 team fouls] (Dirk Markkanen: 3 personal fouls)   FT 1/1: GOOD Bradley Gobert makes 1/1 from the line.
Score: 15-10

[05:52] Team_022 possession (Score: 15-10)
Lamelo Dosunmu drives to the basket... Lamelo Dosunmu throws a bad pass out of bounds! TURNOVER! (dead ball)

[05:41] Team_006 possession (Score: 15-10)
FOUL! Shooting foul on Dirk Markkanen. Bradley Gobert to the line for 2 free throws. [BONUS: 6 team fouls] (Dirk Markkanen: 4 personal fouls)   FT 1/2: GOOD   FT 2/2: GOOD Bradley Gobert makes 2/2 from the line.
Score: 15-12

[05:25] Team_022 possession (Score: 15-12)
Lamelo Dosunmu drives, Ja Butler stays with him. Lamelo Dosunmu attempts a Dunk. Contested by Ja Butler (3.3 feet, ZONE). Lamelo Dosunmu misses. Rebound secured by Ja Butler.

[05:13] Team_006 possession (Score: 15-12)
Jayson Young attempts a 3Pt. Contested by Michael Ginobili (3.9 feet, ZONE). Jayson Young misses. Rebound secured by Dirk Markkanen.

[05:04] Team_022 possession (Score: 15-12)
FOUL! Holding foul on Bradley Gobert. [IN THE BONUS! 5 team fouls] Dirk Markkanen to the line for 2 free throws. (Bradley Gobert: 2 personal fouls)   FT 1/2: GOOD   FT 2/2: MISS Dirk Markkanen makes 1/2 from the line. Offensive rebound by Michael Ginobili! Michael Ginobili kicks it out.
Score: 16-12

[04:50] Team_022 possession (Score: 16-12)
FOUL! Shooting foul on Shai Westbrook. Malcolm Allen to the line for 3 free throws. [BONUS: 6 team fouls] (Shai Westbrook: 2 personal fouls)   FT 1/3: GOOD   FT 2/3: MISS   FT 3/3: MISS Malcolm Allen makes 1/3 from the line. Rebound secured by Bradley Gobert.
Score: 17-12

[04:37] Team_006 possession (Score: 17-12)
Shai Westbrook drives to the basket... Shai Westbrook throws a bad pass! Stolen by Malcolm Allen! TURNOVER! (live ball)

[04:24] Team_022 possession (Score: 17-12)
FOUL! Holding foul on Shai Westbrook. [IN THE BONUS! 7 team fouls] Malcolm Allen to the line for 2 free throws. (Shai Westbrook: 3 personal fouls)   FT 1/2: MISS   FT 2/2: GOOD Malcolm Allen makes 1/2 from the line.
Score: 18-12

[04:14] Team_006 possession (Score: 18-12)
Ja Butler drives, Dirk Markkanen stays with him. Ja Butler attempts a Layup. Contested by Dirk Markkanen (4.9 feet, ZONE). JA BUTLER MAKES IT! Assist: Jayson Young
Score: 18-14

[04:02] Team_022 possession (Score: 18-14)
Lamelo Dosunmu attempts a Midrange. Contested by Ja Butler (3.5 feet, MAN). LAMELO DOSUNMU MAKES IT! Assist: Malcolm Allen
Score: 20-14

[03:48] Team_006 possession (Score: 20-14)
Jayson Young attempts a 3Pt. Contested by Myles Anthony (5.0 feet, MAN). Jayson Young misses. Rebound secured by Dirk Markkanen.

[03:31] Team_022 possession (Score: 20-14)
Myles Anthony attempts a 3Pt. Contested by Jayson Young (4.9 feet, MAN). Myles Anthony misses. Rebound secured by Ja Butler.

[03:18] Team_006 possession (Score: 20-14)
Jayson Young attempts a Layup. BLOCKED BY MYLES ANTHONY! Ball deflects out of bounds off Jayson Young.

[03:01] Team_022 possession (Score: 20-14)
FOUL! Reach-in foul on Bradley Gobert during the drive. [IN THE BONUS! 8 team fouls] Lamelo Dosunmu to the line for 2 free throws. (Bradley Gobert: 3 personal fouls)   FT 1/2: GOOD   FT 2/2: GOOD Lamelo Dosunmu makes 2/2 from the line.
Score: 22-14

[02:46] Team_006 possession (Score: 22-14)
Franz Wagner attempts a Midrange. Contested by Michael Ginobili (3.9 feet, MAN). Franz Wagner misses. Offensive rebound by Bradley Gobert! Bradley Gobert kicks it out.

[02:28] Team_006 possession (Score: 22-14)
Jayson Young attempts a Midrange. Contested by Myles Anthony (5.1 feet, MAN). Jayson Young misses. Rebound secured by Michael Ginobili.

[02:15] Team_022 possession (Score: 22-14)
Dirk Markkanen attempts a Layup. Contested by Bradley Gobert (3.7 feet, ZONE). DIRK MARKKANEN MAKES IT! Assist: Myles Anthony
Score: 24-14

[01:59] Team_006 possession (Score: 24-14)
Franz Wagner throws a bad pass out of bounds! TURNOVER! (dead ball)

[01:59] Substitution (Team_022): Malcolm Allen OUT → DeMar Harden IN (stamina_rule2)

[01:59] Substitution (Team_022): Michael Ginobili OUT → Lauri Gobert IN (stamina_rule2)

[01:59] Substitution (Team_022): Myles Anthony OUT → Dejounte Towns IN (stamina_rule2)

[01:59] Substitution (Team_022): Lamelo Dosunmu OUT → Kawhi Russell IN (stamina_rule2)

[01:59] Substitution (Team_022): Dirk Markkanen OUT → Cole Iverson IN (stamina_rule2)

[01:59] Substitution (Team_006): Shai Westbrook OUT → Miles Harris IN (stamina_rule2)

[01:59] Substitution (Team_006): Franz Wagner OUT → Lamelo Westbrook IN (stamina_rule2)

[01:59] Substitution (Team_006): Jayson Young OUT → Vince Sabonis IN (stamina_rule2)

[01:59] Substitution (Team_006): Ja Butler OUT → Cade Ball IN (stamina_rule2)

[01:59] Substitution (Team_006): Bradley Gobert OUT → Shaquille Sexton IN (stamina_rule2)

[01:43] Team_022 possession (Score: 24-14)
DeMar Harden attempts a 3Pt. Contested by Miles Harris (5.2 feet, MAN). DeMar Harden misses. Rebound secured by Vince Sabonis.

[01:28] Team_006 possession (Score: 24-14)
Shaquille Sexton attempts a Layup. Contested by Cole Iverson (5.1 feet, MAN). SHAQUILLE SEXTON MAKES IT!
Score: 24-16

[01:12] Team_022 possession (Score: 24-16)
DeMar Harden makes the Layup and draws the foul on Miles Harris! And-1! DeMar Harden to the line for 1. [BONUS: 9 team fouls] (Miles Harris: 1 personal fouls)   FT 1/1: GOOD DeMar Harden makes 1/1 from the line.
Score: 27-16

[00:56] Team_006 possession (Score: 27-16)
Miles Harris attempts a Midrange. Contested by Kawhi Russell (4.1 feet, ZONE). Miles Harris misses. Rebound secured by Kawhi Russell.

[00:45] Team_022 possession (Score: 27-16)
Kawhi Russell drives, Cade Ball stays with him. Kawhi Russell attempts a Dunk. Contested by Cade Ball (4.5 feet, ZONE). KAWHI RUSSELL MAKES IT! Assist: Lauri Gobert
Score: 29-16

[00:29] Team_006 possession (Score: 29-16)
FOUL! Holding foul on DeMar Harden. [IN THE BONUS! 7 team fouls] Miles Harris to the line for 2 free throws. (DeMar Harden: 1 personal fouls)   FT 1/2: GOOD   FT 2/2: GOOD Miles Harris makes 2/2 from the line.
Score: 29-18

[00:11] Team_022 possession (Score: 29-18)
Dejounte Towns attempts a 3Pt. Contested by Vince Sabonis (4.8 feet, MAN). Dejounte Towns misses. Offensive rebound by Lauri Gobert! Lauri Gobert kicks it out.

================================================================================
                              1ST QUARTER COMPLETE                              
================================================================================

1ST QUARTER SCORE: Team_022 29, Team_006 18

BOX SCORE:
================================================================================

Team_022
--------------------------------------------------------------------------------
Player                MIN  PTS  REB  AST  TO      FG   FG%      3P   3P%
--------------------------------------------------------------------------------
Dirk Markkanen         10    9    6    0   0   4/5    80.0     0/0   0.0
Lamelo Dosunmu         10    4    0    1   0   2/4    50.0     0/0   0.0
Michael Ginobili       10    3    5    0   0   1/2    50.0     0/0   0.0
Myles Anthony          10    3    1    1   0   1/2    50.0     0/0   0.0
DeMar Harden            2    3    0    0   0   1/2    50.0     0/0   0.0
Kawhi Russell           2    2    1    0   0   1/1   100.0     0/0   0.0
Malcolm Allen          10    1    0    3   0   1/2    50.0     0/0   0.0
Lauri Gobert            2    0    1    1   0   0/0     0.0     0/0   0.0

TEAM: FG: 11/18 (61.1%), 3PT: 1/5 (20.0%), REB: 14 (5 off, 9 def), AST: 6, TO: 3
TEAM FOULS: 7 [Team_006 in BONUS]


Team_006
--------------------------------------------------------------------------------
Player                MIN  PTS  REB  AST  TO      FG   FG%      3P   3P%
--------------------------------------------------------------------------------
Bradley Gobert         10   12    4    0   0   5/5   100.0     0/0   0.0
Ja Butler              10    2    2    1   0   1/1   100.0     0/0   0.0
Shaquille Sexton        2    2    0    0   0   1/1   100.0     0/0   0.0
Miles Harris            2    2    0    0   0   1/2    50.0     0/0   0.0
Jayson Young           10    0    0    1   0   0/6     0.0     0/0   0.0
Shai Westbrook         10    0    2    1   0   0/2     0.0     0/0   0.0
Franz Wagner           10    0    0    0   0   0/1     0.0     0/0   0.0
Vince Sabonis           2    0    1    0   0   0/0     0.0     0/0   0.0

TEAM: FG: 8/18 (44.4%), 3PT: 0/5 (0.0%), REB: 9 (2 off, 7 def), AST: 3, TO: 3
TEAM FOULS: 9 [Team_022 in BONUS]

================================================================================

================================================================================
                       2ND QUARTER - Team_022 vs Team_006                       
================================================================================

[12:00] Team_022 possession (Score: 29-18)
Lamelo Dosunmu attempts a 3Pt. Contested by Shai Westbrook (4.3 feet, ZONE). Lamelo Dosunmu misses. Rebound secured by Bradley Gobert.

[11:44] Team_006 possession (Score: 29-18)
Franz Wagner makes the Layup and draws the foul on Dirk Markkanen! And-1! Franz Wagner to the line for 1. [Team fouls: 1] (Dirk Markkanen: 1 personal fouls)   FT 1/1: MISS Franz Wagner makes 0/1 from the line. Offensive rebound by Ja Butler! Ja Butler's putback is no good.
Score: 29-20

[11:34] Team_022 possession (Score: 29-20)
Dirk Markkanen attempts a Layup. Contested by Bradley Gobert (3.4 feet, ZONE). DIRK MARKKANEN MAKES IT! Assist: Myles Anthony
Score: 31-20

[11:21] Team_006 possession (Score: 31-20)
Bradley Gobert drives and kicks out. Shai Westbrook attempts a 3Pt. Contested by Michael Ginobili (3.6 feet, ZONE). Shai Westbrook misses. Rebound secured by Myles Anthony.

[11:10] Team_022 possession (Score: 31-20)
Lamelo Dosunmu attempts a Midrange. Contested by Franz Wagner (5.4 feet, ZONE). Lamelo Dosunmu misses. Rebound secured by Shai Westbrook.

[11:01] Team_006 possession (Score: 31-20)
Jayson Young attempts a Layup. Contested by Myles Anthony (5.0 feet, MAN). Jayson Young misses. Rebound secured by Michael Ginobili.

[10:45] Team_022 possession (Score: 31-20)
Michael Ginobili makes the 3Pt and draws the foul on Franz Wagner! And-1! Michael Ginobili to the line for 1. [Team fouls: 1] (Franz Wagner: 1 personal fouls)   FT 1/1: GOOD Michael Ginobili makes 1/1 from the line.
Score: 35-20

[10:28] Team_006 possession (Score: 35-20)
Bradley Gobert attempts a Layup. BLOCKED BY MICHAEL GINOBILI! Ball goes out off Michael Ginobili. Bradley Gobert's ball!

[10:13] Team_006 possession (Score: 35-20)
Ja Butler drives and kicks out. Ja Butler attempts a Midrange. Contested by Michael Ginobili (3.8 feet, ZONE). Ja Butler misses. Rebound secured by Michael Ginobili.

[09:57] Team_022 possession (Score: 35-20)
FOUL! Holding foul on Shai Westbrook. [Team fouls: 2] No free throws, side out. (Shai Westbrook: 1 personal fouls)

[09:43] Team_022 possession (Score: 35-20)
Dirk Markkanen loses the ball! Stripped by Bradley Gobert! TURNOVER! (live ball)

[09:31] Team_006 possession (Score: 35-20)
Jayson Young drives and kicks out. Ja Butler attempts a 3Pt. Contested by Lamelo Dosunmu (5.1 feet, MAN). JA BUTLER MAKES IT! Assist: Bradley Gobert
Score: 35-23

[09:14] Team_022 possession (Score: 35-23)
Lamelo Dosunmu drives to the basket... FOUL! Offensive foul on Lamelo Dosunmu! Ja Butler drew the charge! [Team fouls: 2] (Lamelo Dosunmu: 1 personal fouls) TURNOVER! (dead ball)

[08:57] Team_006 possession (Score: 35-23)
Bradley Gobert drives and kicks out. Ja Butler attempts a Midrange. Contested by Michael Ginobili (4.0 feet, ZONE). Ja Butler misses. FOUL! Loose ball foul on Myles Anthony during the rebound battle. [Team fouls: 3] No free throws, side out. (Myles Anthony: 1 personal fouls)

[08:42] Team_006 possession (Score: 35-23)
Franz Wagner attempts a Midrange. Contested by Lamelo Dosunmu (5.2 feet, ZONE). FRANZ WAGNER MAKES IT! Assist: Jayson Young
Score: 35-25

[08:27] Team_022 possession (Score: 35-25)
Myles Anthony drives, Jayson Young stays with him. Myles Anthony attempts a Layup. Contested by Jayson Young (5.1 feet, MAN). Myles Anthony misses. Rebound secured by Ja Butler.

[08:10] Team_006 possession (Score: 35-25)
Bradley Gobert attempts a 3Pt. Contested by Michael Ginobili (3.9 feet, ZONE). Bradley Gobert misses. Rebound secured by Michael Ginobili.

[07:52] Team_022 possession (Score: 35-25)
Lamelo Dosunmu attempts a Midrange. Contested by Ja Butler (3.9 feet, ZONE). Lamelo Dosunmu misses. Rebound secured by Bradley Gobert.

[07:35] Team_006 possession (Score: 35-25)
Ja Butler attempts a Midrange. Contested by Lamelo Dosunmu (5.4 feet, ZONE). Ja Butler misses. Rebound secured by Michael Ginobili.

[07:21] Team_022 possession (Score: 35-25)
Myles Anthony drives, Jayson Young stays with him. Myles Anthony attempts a Layup. Contested by Jayson Young (5.2 feet, MAN). Myles Anthony misses. Offensive rebound by Dirk Markkanen! Dirk Markkanen's putback is no good. Offensive rebound by Dirk Markkanen! Dirk Markkanen kicks it out.

[07:10] Team_022 possession (Score: 35-25)
Malcolm Allen attempts a Midrange. BLOCKED BY SHAI WESTBROOK! Ball is loose! Rebound secured by Bradley Gobert.

[06:55] Team_006 possession (Score: 35-25)
Shai Westbrook attempts a 3Pt. Contested by Michael Ginobili (4.2 feet, ZONE). Shai Westbrook misses. Rebound secured by Dirk Markkanen.

[06:44] Team_022 possession (Score: 35-25)
Malcolm Allen drives, Shai Westbrook stays with him. Malcolm Allen attempts a Dunk. Contested by Shai Westbrook (5.0 feet, MAN). Malcolm Allen misses. Rebound secured by Shai Westbrook.

[06:30] Team_006 possession (Score: 35-25)
Shai Westbrook drives to the basket... Shai Westbrook loses the ball! Stripped by Lamelo Dosunmu! TURNOVER! (live ball)

[06:16] Team_022 possession (Score: 35-25)
Lamelo Dosunmu attempts a Midrange. Contested by Ja Butler (4.1 feet, MAN). Lamelo Dosunmu misses. Rebound secured by Shai Westbrook.

[06:03] Team_006 possession (Score: 35-25)
Jayson Young drives to the basket... Jayson Young throws a bad pass out of bounds! TURNOVER! (dead ball)

[06:03] Substitution (Team_022): Malcolm Allen OUT → DeMar Harden IN (stamina_rule2)

[06:03] Substitution (Team_022): Michael Ginobili OUT → Lauri Gobert IN (stamina_rule2)

[06:03] Substitution (Team_022): Myles Anthony OUT → Dejounte Towns IN (stamina_rule2)

[06:03] Substitution (Team_022): Lamelo Dosunmu OUT → Kawhi Russell IN (stamina_rule2)

[06:03] Substitution (Team_022): Dirk Markkanen OUT → Cole Iverson IN (stamina_rule2)

[06:03] Substitution (Team_006): Shai Westbrook OUT → Miles Harris IN (stamina_rule2)

[06:03] Substitution (Team_006): Franz Wagner OUT → Lamelo Westbrook IN (stamina_rule2)

[06:03] Substitution (Team_006): Jayson Young OUT → Vince Sabonis IN (stamina_rule2)

[06:03] Substitution (Team_006): Ja Butler OUT → Cade Ball IN (stamina_rule2)

[06:03] Substitution (Team_006): Bradley Gobert OUT → Shaquille Sexton IN (stamina_rule2)

[05:49] Team_022 possession (Score: 35-25)
DeMar Harden attempts a 3Pt. Contested by Miles Harris (5.2 feet, MAN). DeMar Harden misses. Rebound secured by Cade Ball.

[05:36] Team_006 possession (Score: 35-25)
FOUL! Reach-in foul on DeMar Harden during the drive. [Team fouls: 4] No free throws, side out. (DeMar Harden: 1 personal fouls)

[05:19] Team_006 possession (Score: 35-25)
Miles Harris attempts a Midrange. Contested by Kawhi Russell (4.1 feet, ZONE). Miles Harris misses. Rebound secured by Dejounte Towns.

[05:04] Team_022 possession (Score: 35-25)
Dejounte Towns attempts a 3Pt. Contested by Vince Sabonis (4.8 feet, ZONE). Dejounte Towns misses. Rebound secured by Shaquille Sexton.

[04:49] Team_006 possession (Score: 35-25)
Cade Ball attempts a Layup. Contested by Kawhi Russell (4.0 feet, MAN). Cade Ball misses. Rebound secured by Kawhi Russell.

[04:37] Team_022 possession (Score: 35-25)
DeMar Harden drives and kicks out. Cole Iverson attempts a Midrange. Contested by Shaquille Sexton (5.3 feet, MAN). COLE IVERSON MAKES IT! Assist: Kawhi Russell
Score: 37-25

[04:22] Team_006 possession (Score: 37-25)
FOUL! Reach-in foul on Cole Iverson during the drive. [IN THE BONUS! 5 team fouls] Shaquille Sexton to the line for 2 free throws. (Cole Iverson: 1 personal fouls)   FT 1/2: GOOD   FT 2/2: MISS Shaquille Sexton makes 1/2 from the line. Rebound secured by Lauri Gobert.
Score: 37-26

[04:06] Team_022 possession (Score: 37-26)
Lauri Gobert attempts a Midrange. Contested by Lamelo Westbrook (3.6 feet, ZONE). Lauri Gobert misses. Offensive rebound by Dejounte Towns! Dejounte Towns kicks it out.

[03:51] Team_022 possession (Score: 37-26)
DeMar Harden attempts a 3Pt. Contested by Miles Harris (5.2 feet, MAN). DeMar Harden misses. Rebound secured by Shaquille Sexton.

[03:37] Team_006 possession (Score: 37-26)
FOUL! Shooting foul on Dejounte Towns. Lamelo Westbrook to the line for 2 free throws. [BONUS: 6 team fouls] (Dejounte Towns: 1 personal fouls)   FT 1/2: MISS   FT 2/2: GOOD Lamelo Westbrook makes 1/2 from the line.
Score: 37-27

[03:19] Team_022 possession (Score: 37-27)
FOUL! Offensive foul on Kawhi Russell! Cade Ball drew the charge! [Team fouls: 7] (Kawhi Russell: 1 personal fouls) TURNOVER! (dead ball)

[03:00] Team_006 possession (Score: 37-27)
Miles Harris drives, Kawhi Russell stays with him. Miles Harris attempts a Layup. Contested by Kawhi Russell (4.1 feet, ZONE). Miles Harris misses. Rebound secured by Kawhi Russell.

[02:47] Team_022 possession (Score: 37-27)
DeMar Harden attempts a 3Pt. Contested by Lamelo Westbrook (3.6 feet, ZONE). DeMar Harden misses. Rebound secured by Cade Ball.

[02:30] Team_006 possession (Score: 37-27)
Cade Ball attempts a Layup. BLOCKED BY KAWHI RUSSELL! Ball deflects out of bounds off Cade Ball.

[02:10] Team_022 possession (Score: 37-27)
Lauri Gobert attempts a Layup. Contested by Shaquille Sexton (5.3 feet, ZONE). LAURI GOBERT MAKES IT! Assist: Dejounte Towns
Score: 39-27

[01:57] Team_006 possession (Score: 39-27)
Miles Harris attempts a 3Pt. Contested by DeMar Harden (5.4 feet, MAN). MILES HARRIS MAKES IT! Assist: Cade Ball
Score: 39-30

[01:41] Team_022 possession (Score: 39-30)
Lauri Gobert attempts a 3Pt. Contested by Lamelo Westbrook (3.6 feet, ZONE). LAURI GOBERT MAKES IT! Assist: Kawhi Russell
Score: 42-30

[01:29] Team_006 possession (Score: 42-30)
Cade Ball attempts a 3Pt. Contested by DeMar Harden (5.3 feet, ZONE). Cade Ball misses. Rebound secured by Lauri Gobert.

[01:15] Team_022 possession (Score: 42-30)
DeMar Harden drives, picks up Cade Ball. Help arrives from Lamelo Westbrook! DeMar Harden attempts a Layup. Contested by Lamelo Westbrook (4.2 feet, ZONE). DeMar Harden misses. Offensive rebound by Dejounte Towns! Dejounte Towns kicks it out.

[00:59] Team_022 possession (Score: 42-30)
Dejounte Towns loses the ball! Stripped by Vince Sabonis! TURNOVER! (live ball)

[00:45] Team_006 possession (Score: 42-30)
Miles Harris drives and kicks out. Miles Harris attempts a Midrange. Contested by DeMar Harden (5.4 feet, MAN). MILES HARRIS MAKES IT!
Score: 42-32

[00:27] Team_022 possession (Score: 42-32)
Dejounte Towns attempts a Midrange. Contested by Vince Sabonis (4.8 feet, ZONE). DEJOUNTE TOWNS MAKES IT!
Score: 44-32

[00:14] Team_006 possession (Score: 44-32)
Shaquille Sexton commits a violation (traveling/carry)! TURNOVER! (dead ball)

[00:01] Team_022 possession (Score: 44-32)
FOUL! Reach-in foul on Lamelo Westbrook during the drive. [Team fouls: 4] No free throws, side out. (Lamelo Westbrook: 1 personal fouls)

================================================================================
                              2ND QUARTER COMPLETE                              
================================================================================

2ND QUARTER SCORE: Team_022 15, Team_006 14

BOX SCORE:
================================================================================

Team_022
--------------------------------------------------------------------------------
Player                MIN  PTS  REB  AST  TO      FG   FG%      3P   3P%
--------------------------------------------------------------------------------
Lauri Gobert            8    5    2    0   0   2/2   100.0     0/0   0.0
Michael Ginobili       16    4    4    0   0   1/1   100.0     0/0   0.0
Dirk Markkanen         16    2    2    0   0   1/1   100.0     0/0   0.0
Dejounte Towns          8    2    3    1   0   1/2    50.0     0/0   0.0
Cole Iverson            8    2    0    0   0   1/1   100.0     0/0   0.0
Lamelo Dosunmu         16    0    0    0   0   0/4     0.0     0/0   0.0
Myles Anthony          16    0    1    1   0   0/1     0.0     0/0   0.0
Malcolm Allen          16    0    0    0   0   0/2     0.0     0/0   0.0
DeMar Harden            8    0    0    0   0   0/3     0.0     0/0   0.0
Kawhi Russell           8    0    2    2   0   0/0     0.0     0/0   0.0

TEAM: FG: 6/17 (35.3%), 3PT: 2/7 (28.6%), REB: 15 (3 off, 12 def), AST: 4, TO: 4
TEAM FOULS: 7 [Team_006 in BONUS]


Team_006
--------------------------------------------------------------------------------
Player                MIN  PTS  REB  AST  TO      FG   FG%      3P   3P%
--------------------------------------------------------------------------------
Miles Harris            8    5    0    0   0   2/4    50.0     0/0   0.0
Ja Butler              16    3    2    0   0   1/3    33.3     0/0   0.0
Franz Wagner           16    2    0    0   0   1/2    50.0     0/0   0.0
Lamelo Westbrook        8    1    0    0   0   1/1   100.0     0/0   0.0
Bradley Gobert         16    0    4    1   0   0/2     0.0     0/0   0.0
Shai Westbrook         16    0    3    0   0   0/1     0.0     0/0   0.0
Jayson Young           16    0    0    1   0   0/1     0.0     0/0   0.0
Cade Ball               8    0    2    1   0   0/3     0.0     0/0   0.0
Shaquille Sexton        8    0    2    0   0   0/1     0.0     0/0   0.0

TEAM: FG: 5/18 (27.8%), 3PT: 1/4 (25.0%), REB: 12 (1 off, 11 def), AST: 3, TO: 3
TEAM FOULS: 4

================================================================================

================================================================================
                       3RD QUARTER - Team_022 vs Team_006                       
================================================================================

[12:00] Team_022 possession (Score: 44-32)
Myles Anthony makes the Layup and draws the foul on Jayson Young! And-1! Myles Anthony to the line for 1. [Team fouls: 1] (Jayson Young: 1 personal fouls)   FT 1/1: GOOD Myles Anthony makes 1/1 from the line.
Score: 47-32

[11:48] Team_006 possession (Score: 47-32)
Ja Butler attempts a Layup. Contested by Lamelo Dosunmu (4.8 feet, MAN). JA BUTLER MAKES IT! Assist: Bradley Gobert
Score: 47-34

[11:39] Team_022 possession (Score: 47-34)
Malcolm Allen makes the 3Pt and draws the foul on Shai Westbrook! And-1! Malcolm Allen to the line for 1. [Team fouls: 2] (Shai Westbrook: 1 personal fouls)   FT 1/1: MISS Malcolm Allen makes 0/1 from the line. Rebound secured by Shai Westbrook.
Score: 50-34

[11:26] Team_006 possession (Score: 50-34)
Jayson Young attempts a 3Pt. Contested by Myles Anthony (4.8 feet, MAN). Jayson Young misses. Rebound secured by Michael Ginobili.

[11:11] Team_022 possession (Score: 50-34)
Lamelo Dosunmu attempts a 3Pt. Contested by Shai Westbrook (4.2 feet, ZONE). Lamelo Dosunmu misses. Rebound secured by Shai Westbrook.

[10:54] Team_006 possession (Score: 50-34)
Ja Butler drives and kicks out. Shai Westbrook attempts a 3Pt. Contested by Malcolm Allen (4.4 feet, MAN). Shai Westbrook misses. Rebound secured by Michael Ginobili.

[10:41] Team_022 possession (Score: 50-34)
Malcolm Allen attempts a 3Pt. Contested by Shai Westbrook (4.5 feet, MAN). MALCOLM ALLEN MAKES IT! Assist: Lamelo Dosunmu
Score: 53-34

[10:23] Team_006 possession (Score: 53-34)
Bradley Gobert attempts a Layup. Contested by Dirk Markkanen (4.5 feet, ZONE). BRADLEY GOBERT MAKES IT! Assist: Jayson Young
Score: 53-36

[10:13] Team_022 possession (Score: 53-36)
Myles Anthony drives and kicks out. Lamelo Dosunmu attempts a Midrange. BLOCKED BY JA BUTLER! Ball deflects out of bounds off Lamelo Dosunmu.

[10:04] Team_006 possession (Score: 53-36)
Jayson Young drives and kicks out. Franz Wagner attempts a 3Pt. Contested by Michael Ginobili (3.5 feet, ZONE). Franz Wagner misses. Rebound secured by Myles Anthony.

[09:48] Team_022 possession (Score: 53-36)
Malcolm Allen drives and kicks out. Michael Ginobili attempts a 3Pt. Contested by Shai Westbrook (3.8 feet, ZONE). MICHAEL GINOBILI MAKES IT!
Score: 56-36

[09:36] Team_006 possession (Score: 56-36)
FOUL! Holding foul on Dirk Markkanen. [Team fouls: 1] No free throws, side out. (Dirk Markkanen: 1 personal fouls)

[09:24] Team_006 possession (Score: 56-36)
Shai Westbrook attempts a Midrange. Contested by Michael Ginobili (3.5 feet, ZONE). Shai Westbrook misses. Offensive rebound by Ja Butler! Ja Butler puts it back in!
Score: 56-38

[09:12] Team_022 possession (Score: 56-38)
Lamelo Dosunmu throws a bad pass! Stolen by Ja Butler! TURNOVER! (live ball)

[09:02] Team_006 possession (Score: 56-38)
Bradley Gobert makes the Dunk and draws the foul on Michael Ginobili! And-1! Bradley Gobert to the line for 1. [Team fouls: 2] (Michael Ginobili: 1 personal fouls)   FT 1/1: GOOD Bradley Gobert makes 1/1 from the line.
Score: 56-41

[08:46] Team_022 possession (Score: 56-41)
FOUL! Reach-in foul on Bradley Gobert during the drive. [Team fouls: 3] No free throws, side out. (Bradley Gobert: 1 personal fouls)

[08:28] Team_022 possession (Score: 56-41)
Myles Anthony drives, Bradley Gobert stays with him. Myles Anthony attempts a Dunk. Contested by Bradley Gobert (3.0 feet, ZONE). MYLES ANTHONY MAKES IT! Assist: Dirk Markkanen
Score: 58-41

[08:12] Team_006 possession (Score: 58-41)
Jayson Young attempts a 3Pt. Contested by Michael Ginobili (3.9 feet, ZONE). Jayson Young misses. Offensive rebound by Bradley Gobert! Bradley Gobert kicks it out.

[07:59] Team_006 possession (Score: 58-41)
Shai Westbrook drives and kicks out. Shai Westbrook attempts a 3Pt. Contested by Malcolm Allen (4.4 feet, MAN). Shai Westbrook misses. FOUL! Loose ball foul on Dirk Markkanen during the rebound battle. [Team fouls: 3] No free throws, side out. (Dirk Markkanen: 2 personal fouls)

[07:43] Team_006 possession (Score: 58-41)
Shai Westbrook attempts a 3Pt. Contested by Malcolm Allen (4.4 feet, MAN). SHAI WESTBROOK MAKES IT! Assist: Ja Butler
Score: 58-44

[07:28] Team_022 possession (Score: 58-44)
Michael Ginobili attempts a Midrange. Contested by Franz Wagner (4.9 feet, MAN). Michael Ginobili misses. Rebound secured by Shai Westbrook.

[07:15] Team_006 possession (Score: 58-44)
FOUL! Offensive foul on Franz Wagner! Michael Ginobili drew the charge! [Team fouls: 4] (Franz Wagner: 1 personal fouls) TURNOVER! (dead ball)

[07:01] Team_022 possession (Score: 58-44)
Malcolm Allen attempts a 3Pt. Contested by Shai Westbrook (4.5 feet, MAN). Malcolm Allen misses. Offensive rebound by Dirk Markkanen! Dirk Markkanen puts it back in!
Score: 60-44

[06:48] Team_006 possession (Score: 60-44)
FOUL! Shooting foul on Lamelo Dosunmu. Shai Westbrook to the line for 3 free throws. [Team fouls: 4] (Lamelo Dosunmu: 1 personal fouls)   FT 1/3: GOOD   FT 2/3: GOOD   FT 3/3: GOOD Shai Westbrook makes 3/3 from the line.
Score: 60-47

[06:33] Team_022 possession (Score: 60-47)
Michael Ginobili attempts a 3Pt. Contested by Franz Wagner (4.9 feet, ZONE). Michael Ginobili misses. Rebound secured by Shai Westbrook.

[06:18] Team_006 possession (Score: 60-47)
Franz Wagner attempts a 3Pt. Contested by Michael Ginobili (3.6 feet, MAN). FRANZ WAGNER MAKES IT! Assist: Ja Butler
Score: 60-50

[06:08] Team_022 possession (Score: 60-50)
FOUL! Shooting foul on Bradley Gobert. Lamelo Dosunmu to the line for 2 free throws. [BONUS: 5 team fouls] (Bradley Gobert: 2 personal fouls)   FT 1/2: GOOD   FT 2/2: GOOD Lamelo Dosunmu makes 2/2 from the line.
Score: 62-50

[05:51] Team_006 possession (Score: 62-50)
FOUL! Shooting foul on Michael Ginobili. Shai Westbrook to the line for 2 free throws. [BONUS: 5 team fouls] (Michael Ginobili: 2 personal fouls)   FT 1/2: GOOD   FT 2/2: GOOD Shai Westbrook makes 2/2 from the line.
Score: 62-52

[05:34] Team_022 possession (Score: 62-52)
Dirk Markkanen makes the Midrange and draws the foul on Bradley Gobert! And-1! Dirk Markkanen to the line for 1. [BONUS: 6 team fouls] (Bradley Gobert: 3 personal fouls)   FT 1/1: GOOD Dirk Markkanen makes 1/1 from the line.
Score: 65-52

[05:24] Team_006 possession (Score: 65-52)
Shai Westbrook drives, Dirk Markkanen stays with him. Shai Westbrook attempts a Layup. Contested by Dirk Markkanen (4.6 feet, ZONE). Shai Westbrook misses. Rebound secured by Dirk Markkanen.

[05:08] Team_022 possession (Score: 65-52)
Lamelo Dosunmu drives and kicks out. Michael Ginobili attempts a 3Pt. Contested by Franz Wagner (4.9 feet, MAN). Michael Ginobili misses. Offensive rebound by Dirk Markkanen! Dirk Markkanen puts it back in!
Score: 67-52

[04:55] Team_006 possession (Score: 67-52)
Shai Westbrook attempts a Midrange. Contested by Michael Ginobili (3.6 feet, ZONE). Shai Westbrook misses. Rebound secured by Myles Anthony.

[04:43] Team_022 possession (Score: 67-52)
Myles Anthony attempts a 3Pt. Contested by Jayson Young (4.8 feet, MAN). Myles Anthony misses. Rebound secured by Shai Westbrook.

[04:28] Team_006 possession (Score: 67-52)
Franz Wagner attempts a Midrange. Contested by Myles Anthony (4.7 feet, ZONE). Franz Wagner misses. Rebound secured by Myles Anthony.

[04:14] Team_022 possession (Score: 67-52)
Myles Anthony attempts a Midrange. Contested by Jayson Young (4.8 feet, MAN). MYLES ANTHONY MAKES IT! Assist: Lamelo Dosunmu
Score: 69-52

[03:56] Team_006 possession (Score: 69-52)
FOUL! Shooting foul on Dirk Markkanen. Bradley Gobert to the line for 2 free throws. [BONUS: 6 team fouls] (Dirk Markkanen: 3 personal fouls)   FT 1/2: GOOD   FT 2/2: MISS Bradley Gobert makes 1/2 from the line. Rebound secured by Myles Anthony.
Score: 69-53

[03:40] Team_022 possession (Score: 69-53)
Dirk Markkanen attempts a Layup. Contested by Bradley Gobert (3.5 feet, MAN). DIRK MARKKANEN MAKES IT! Assist: Malcolm Allen
Score: 71-53

[03:24] Team_006 possession (Score: 71-53)
Shai Westbrook attempts a 3Pt. Contested by Malcolm Allen (4.6 feet, MAN). Shai Westbrook misses. Rebound secured by Myles Anthony.

[03:10] Team_022 possession (Score: 71-53)
Michael Ginobili attempts a Layup. Contested by Bradley Gobert (3.2 feet, ZONE). MICHAEL GINOBILI MAKES IT!
Score: 73-53

[02:59] Team_006 possession (Score: 73-53)
Jayson Young throws a bad pass out of bounds! TURNOVER! (dead ball)

[02:59] Substitution (Team_022): Malcolm Allen OUT → DeMar Harden IN (stamina_rule2)

[02:59] Substitution (Team_022): Myles Anthony OUT → Dejounte Towns IN (stamina_rule2)

[02:59] Substitution (Team_022): Lamelo Dosunmu OUT → Kawhi Russell IN (stamina_rule2)

[02:59] Substitution (Team_022): Dirk Markkanen OUT → Cole Iverson IN (stamina_rule2)

[02:59] Substitution (Team_006): Franz Wagner OUT → Lamelo Westbrook IN (stamina_rule2)

[02:59] Substitution (Team_006): Ja Butler OUT → Cade Ball IN (stamina_rule2)

[02:59] Substitution (Team_006): Bradley Gobert OUT → Shaquille Sexton IN (stamina_rule2)

[02:42] Team_022 possession (Score: 73-53)
Michael Ginobili attempts a Layup. Contested by Lamelo Westbrook (3.6 feet, MAN). MICHAEL GINOBILI MAKES IT! Assist: Cole Iverson
Score: 75-53

[02:28] Team_006 possession (Score: 75-53)
FOUL! Holding foul on DeMar Harden. [IN THE BONUS! 7 team fouls] Shai Westbrook to the line for 2 free throws. (DeMar Harden: 1 personal fouls)   FT 1/2: GOOD   FT 2/2: GOOD Shai Westbrook makes 2/2 from the line.
Score: 75-55

[02:13] Team_022 possession (Score: 75-55)
Cole Iverson drives to the basket... Cole Iverson throws a bad pass out of bounds! TURNOVER! (dead ball)

[02:13] Substitution (Team_022): Michael Ginobili OUT → Lauri Gobert IN (stamina_rule2)

[02:13] Substitution (Team_006): Shai Westbrook OUT → Miles Harris IN (stamina_rule2)

[02:13] Substitution (Team_006): Jayson Young OUT → Vince Sabonis IN (stamina_rule2)

[01:56] Team_006 possession (Score: 75-55)
Miles Harris drives to the basket... Miles Harris commits a violation (traveling/carry)! TURNOVER! (dead ball)

[01:42] Team_022 possession (Score: 75-55)
Kawhi Russell drives and kicks out. Lauri Gobert attempts a 3Pt. Contested by Lamelo Westbrook (3.6 feet, MAN). LAURI GOBERT MAKES IT! Assist: DeMar Harden
Score: 78-55

[01:28] Team_006 possession (Score: 78-55)
Lamelo Westbrook throws a bad pass out of bounds! TURNOVER! (dead ball)

[01:17] Team_022 possession (Score: 78-55)
Lauri Gobert attempts a Midrange. Contested by Lamelo Westbrook (3.6 feet, MAN). Lauri Gobert misses. Rebound secured by Vince Sabonis.

[01:03] Team_006 possession (Score: 78-55)
Cade Ball makes the Layup and draws the foul on Kawhi Russell! And-1! Cade Ball to the line for 1. [BONUS: 8 team fouls] (Kawhi Russell: 1 personal fouls)   FT 1/1: GOOD Cade Ball makes 1/1 from the line.
Score: 78-58

[00:52] Team_022 possession (Score: 78-58)
Dejounte Towns attempts a 3Pt. Contested by Lamelo Westbrook (3.7 feet, ZONE). DEJOUNTE TOWNS MAKES IT! Assist: Kawhi Russell
Score: 81-58

[00:40] Team_006 possession (Score: 81-58)
Lamelo Westbrook attempts a Midrange. Contested by Lauri Gobert (4.6 feet, MAN). LAMELO WESTBROOK MAKES IT!
Score: 81-60

[00:23] Team_022 possession (Score: 81-60)
Lauri Gobert attempts a 3Pt. Contested by Lamelo Westbrook (3.6 feet, MAN). Lauri Gobert misses. Rebound secured by Vince Sabonis.

[00:08] Team_006 possession (Score: 81-60)
Cade Ball attempts a 3Pt. Contested by Dejounte Towns (4.4 feet, ZONE). Cade Ball misses. Rebound secured by Dejounte Towns.

================================================================================
                              3RD QUARTER COMPLETE                              
================================================================================

3RD QUARTER SCORE: Team_022 37, Team_006 28

BOX SCORE:
================================================================================

Team_022
--------------------------------------------------------------------------------
Player                MIN  PTS  REB  AST  TO      FG   FG%      3P   3P%
--------------------------------------------------------------------------------
Dirk Markkanen         26    9    3    1   0   4/4   100.0     0/0   0.0
Myles Anthony          26    7    5    0   0   3/5    60.0     0/0   0.0
Michael Ginobili       27    7    2    0   0   3/5    60.0     0/0   0.0
Malcolm Allen          26    3    0    1   0   1/2    50.0     0/0   0.0
Lauri Gobert           10    3    0    0   0   1/3    33.3     0/0   0.0
Dejounte Towns         11    3    1    0   0   1/1   100.0     0/0   0.0
Lamelo Dosunmu         26    2    0    2   0   1/2    50.0     0/0   0.0
Cole Iverson           11    0    0    1   0   0/0     0.0     0/0   0.0
DeMar Harden           11    0    0    1   0   0/0     0.0     0/0   0.0
Kawhi Russell          11    0    0    1   0   0/0     0.0     0/0   0.0

TEAM: FG: 14/22 (63.6%), 3PT: 3/8 (37.5%), REB: 11 (2 off, 9 def), AST: 7, TO: 2
TEAM FOULS: 8 [Team_006 in BONUS]


Team_006
--------------------------------------------------------------------------------
Player                MIN  PTS  REB  AST  TO      FG   FG%      3P   3P%
--------------------------------------------------------------------------------
Shai Westbrook         27   10    5    0   0   4/7    57.1     0/0   0.0
Bradley Gobert         26    5    2    1   0   2/3    66.7     0/0   0.0
Ja Butler              26    4    1    2   0   2/3    66.7     0/0   0.0
Franz Wagner           26    3    0    0   0   1/2    50.0     0/0   0.0
Cade Ball              11    3    0    0   0   1/2    50.0     0/0   0.0
Lamelo Westbrook       11    2    0    0   0   1/1   100.0     0/0   0.0
Jayson Young           27    0    0    1   0   0/2     0.0     0/0   0.0
Vince Sabonis          10    0    2    0   0   0/0     0.0     0/0   0.0

TEAM: FG: 11/20 (55.0%), 3PT: 3/6 (50.0%), REB: 10 (3 off, 7 def), AST: 4, TO: 4
TEAM FOULS: 6 [Team_022 in BONUS]

================================================================================

================================================================================
                       4TH QUARTER - Team_022 vs Team_006                       
================================================================================

[12:00] Team_022 possession (Score: 81-60)
FOUL! Shooting foul on Bradley Gobert. Malcolm Allen to the line for 2 free throws. [Team fouls: 1] (Bradley Gobert: 1 personal fouls)   FT 1/2: GOOD   FT 2/2: GOOD Malcolm Allen makes 2/2 from the line.
Score: 83-60

[11:45] Team_006 possession (Score: 83-60)
FOUL! Shooting foul on Myles Anthony. Bradley Gobert to the line for 2 free throws. [Team fouls: 1] (Myles Anthony: 1 personal fouls)   FT 1/2: GOOD   FT 2/2: GOOD Bradley Gobert makes 2/2 from the line.
Score: 83-62

[11:29] Team_022 possession (Score: 83-62)
Myles Anthony attempts a 3Pt. Contested by Jayson Young (4.8 feet, MAN). MYLES ANTHONY MAKES IT! Assist: Malcolm Allen
Score: 86-62

[11:16] Team_006 possession (Score: 86-62)
Franz Wagner attempts a 3Pt. Contested by Michael Ginobili (3.7 feet, ZONE). Franz Wagner misses. Rebound secured by Dirk Markkanen.

[11:00] Team_022 possession (Score: 86-62)
Michael Ginobili throws a bad pass! Stolen by Franz Wagner! TURNOVER! (live ball)

[10:45] Team_006 possession (Score: 86-62)
FOUL! Shooting foul on Michael Ginobili. Bradley Gobert to the line for 2 free throws. [Team fouls: 2] (Michael Ginobili: 1 personal fouls)   FT 1/2: GOOD   FT 2/2: GOOD Bradley Gobert makes 2/2 from the line.
Score: 86-64

[10:30] Team_022 possession (Score: 86-64)
Michael Ginobili drives, Franz Wagner stays with him. Michael Ginobili attempts a Dunk. Contested by Franz Wagner (5.0 feet, MAN). MICHAEL GINOBILI MAKES IT! Assist: Lamelo Dosunmu
Score: 88-64

[10:15] Team_006 possession (Score: 88-64)
Jayson Young attempts a 3Pt. Contested by Myles Anthony (4.9 feet, MAN). JAYSON YOUNG MAKES IT! Assist: Shai Westbrook
Score: 88-67

[10:00] Team_022 possession (Score: 88-67)
Michael Ginobili drives and kicks out. Malcolm Allen attempts a Midrange. Contested by Ja Butler (3.1 feet, ZONE). Malcolm Allen misses. Offensive rebound by Michael Ginobili! Michael Ginobili kicks it out.

[09:44] Team_022 possession (Score: 88-67)
FOUL! Holding foul on Jayson Young. [Team fouls: 2] No free throws, side out. (Jayson Young: 1 personal fouls)

[09:29] Team_022 possession (Score: 88-67)
Lamelo Dosunmu drives and kicks out. Lamelo Dosunmu attempts a Midrange. Contested by Ja Butler (3.1 feet, ZONE). Lamelo Dosunmu misses. Rebound secured by Ja Butler.

[09:13] Team_006 possession (Score: 88-67)
Franz Wagner makes the Dunk and draws the foul on Michael Ginobili! And-1! Franz Wagner to the line for 1. [Team fouls: 3] (Michael Ginobili: 2 personal fouls)   FT 1/1: GOOD Franz Wagner makes 1/1 from the line.
Score: 88-70

[08:59] Team_022 possession (Score: 88-70)
Lamelo Dosunmu attempts a Layup. Contested by Ja Butler (3.6 feet, MAN). LAMELO DOSUNMU MAKES IT!
Score: 90-70

[08:48] Team_006 possession (Score: 90-70)
Bradley Gobert attempts a 3Pt. Contested by Michael Ginobili (3.8 feet, ZONE). BRADLEY GOBERT MAKES IT! Assist: Shai Westbrook
Score: 90-73

[08:29] Team_022 possession (Score: 90-73)
Malcolm Allen attempts a 3Pt. Contested by Shai Westbrook (4.8 feet, MAN). Malcolm Allen misses. Rebound secured by Ja Butler.

[08:15] Team_006 possession (Score: 90-73)
Bradley Gobert makes the Layup and draws the foul on Michael Ginobili! And-1! Bradley Gobert to the line for 1. [Team fouls: 4] (Michael Ginobili: 3 personal fouls)   FT 1/1: GOOD Bradley Gobert makes 1/1 from the line.
Score: 90-76

[08:01] Team_022 possession (Score: 90-76)
Michael Ginobili attempts a 3Pt. Contested by Franz Wagner (5.2 feet, MAN). Michael Ginobili misses. Rebound secured by Ja Butler.

[07:46] Team_006 possession (Score: 90-76)
Franz Wagner attempts a 3Pt. Contested by Michael Ginobili (4.1 feet, ZONE). Franz Wagner misses. Rebound secured by Myles Anthony.

[07:32] Team_022 possession (Score: 90-76)
Dirk Markkanen drives to the basket... Dirk Markkanen loses control! Ball rolls out of bounds! TURNOVER! (dead ball)

[07:32] Substitution (Team_022): Malcolm Allen OUT → DeMar Harden IN (stamina_rule2)

[07:32] Substitution (Team_022): Michael Ginobili OUT → Lauri Gobert IN (stamina_rule2)

[07:32] Substitution (Team_022): Myles Anthony OUT → Dejounte Towns IN (stamina_rule2)

[07:32] Substitution (Team_022): Lamelo Dosunmu OUT → Kawhi Russell IN (stamina_rule2)

[07:32] Substitution (Team_022): Dirk Markkanen OUT → Cole Iverson IN (stamina_rule2)

[07:32] Substitution (Team_006): Shai Westbrook OUT → Miles Harris IN (stamina_rule2)

[07:32] Substitution (Team_006): Franz Wagner OUT → Lamelo Westbrook IN (stamina_rule2)

[07:32] Substitution (Team_006): Jayson Young OUT → Vince Sabonis IN (stamina_rule2)

[07:32] Substitution (Team_006): Ja Butler OUT → Cade Ball IN (stamina_rule2)

[07:32] Substitution (Team_006): Bradley Gobert OUT → Shaquille Sexton IN (stamina_rule2)

[07:19] Team_006 possession (Score: 90-76)
Cade Ball attempts a Layup. Contested by Kawhi Russell (4.0 feet, ZONE). CADE BALL MAKES IT! Assist: Miles Harris
Score: 90-78

[07:04] Team_022 possession (Score: 90-78)
Dejounte Towns attempts a Midrange. Contested by Cade Ball (4.3 feet, ZONE). Dejounte Towns misses. Offensive rebound by Lauri Gobert! Lauri Gobert kicks it out.

[06:48] Team_022 possession (Score: 90-78)
Cole Iverson attempts a Layup. BLOCKED BY SHAQUILLE SEXTON! Ball is loose! Offensive rebound by Dejounte Towns! Dejounte Towns kicks it out.

[06:31] Team_022 possession (Score: 90-78)
DeMar Harden attempts a Midrange. Contested by Lamelo Westbrook (3.6 feet, ZONE). DEMAR HARDEN MAKES IT!
Score: 92-78

[06:17] Team_006 possession (Score: 92-78)
Lamelo Westbrook attempts a Midrange. Contested by Lauri Gobert (4.6 feet, ZONE). LAMELO WESTBROOK MAKES IT!
Score: 92-80

[06:06] Team_022 possession (Score: 92-80)
FOUL! Reach-in foul on Cade Ball during the drive. [Team fouls: 3] No free throws, side out. (Cade Ball: 1 personal fouls)

[05:57] Team_022 possession (Score: 92-80)
Lauri Gobert drives, Lamelo Westbrook stays with him. Lauri Gobert attempts a Dunk. Contested by Lamelo Westbrook (3.6 feet, MAN). Lauri Gobert misses. Rebound secured by Vince Sabonis.

[05:45] Team_006 possession (Score: 92-80)
Miles Harris attempts a 3Pt. Contested by DeMar Harden (5.4 feet, MAN). Miles Harris misses. Offensive rebound by Cade Ball! Cade Ball kicks it out.

[05:33] Team_006 possession (Score: 92-80)
Shaquille Sexton attempts a Layup. Contested by Kawhi Russell (4.0 feet, ZONE). SHAQUILLE SEXTON MAKES IT!
Score: 92-82

[05:22] Team_022 possession (Score: 92-82)
Lauri Gobert attempts a 3Pt. Contested by Lamelo Westbrook (3.6 feet, ZONE). Lauri Gobert misses. Rebound secured by Shaquille Sexton.

[05:13] Team_006 possession (Score: 92-82)
Shaquille Sexton attempts a Midrange. Contested by Cole Iverson (5.1 feet, MAN). SHAQUILLE SEXTON MAKES IT!
Score: 92-84

[04:58] Team_022 possession (Score: 92-84)
DeMar Harden drives, picks up Miles Harris. Help arrives from Lamelo Westbrook! DeMar Harden attempts a Dunk. Contested by Lamelo Westbrook (5.2 feet, MAN). DEMAR HARDEN MAKES IT!
Score: 94-84

[04:45] Team_006 possession (Score: 94-84)
Vince Sabonis attempts a 3Pt. Contested by Dejounte Towns (4.4 feet, MAN). Vince Sabonis misses. Rebound secured by Lauri Gobert.

[04:34] Team_022 possession (Score: 94-84)
DeMar Harden makes the Layup and draws the foul on Cade Ball! And-1! DeMar Harden to the line for 1. [Team fouls: 4] (Cade Ball: 2 personal fouls)   FT 1/1: GOOD DeMar Harden makes 1/1 from the line.
Score: 97-84

[04:20] Team_006 possession (Score: 97-84)
Lamelo Westbrook attempts a 3Pt. Contested by Lauri Gobert (4.6 feet, MAN). Lamelo Westbrook misses. Offensive rebound by Shaquille Sexton! Shaquille Sexton kicks it out.

[04:04] Team_006 possession (Score: 97-84)
Vince Sabonis attempts a Midrange. Contested by Kawhi Russell (4.0 feet, ZONE). Vince Sabonis misses. Rebound secured by Lauri Gobert.

[03:48] Team_022 possession (Score: 97-84)
Lauri Gobert attempts a 3Pt. Contested by Lamelo Westbrook (3.6 feet, ZONE). Lauri Gobert misses. Rebound secured by Cade Ball.

[03:32] Team_006 possession (Score: 97-84)
Vince Sabonis attempts a 3Pt. Contested by Dejounte Towns (4.4 feet, MAN). Vince Sabonis misses. FOUL! Loose ball foul on Kawhi Russell during the rebound battle. [IN THE BONUS! 5 team fouls] Shaquille Sexton to the line for 2 free throws. (Kawhi Russell: 1 personal fouls)   FT 1/2: GOOD   FT 2/2: GOOD Shaquille Sexton makes 2/2 from the line.
Score: 97-86

[03:21] Team_022 possession (Score: 97-86)
Dejounte Towns attempts a Midrange. Contested by Vince Sabonis (4.8 feet, MAN). DEJOUNTE TOWNS MAKES IT!
Score: 99-86

[03:07] Team_006 possession (Score: 99-86)
Miles Harris attempts a Layup. Contested by DeMar Harden (5.4 feet, MAN). MILES HARRIS MAKES IT! Assist: Cade Ball
Score: 99-88

[02:49] Team_022 possession (Score: 99-88)
FOUL! Reach-in foul on Cade Ball during the drive. [IN THE BONUS! 5 team fouls] Kawhi Russell to the line for 2 free throws. (Cade Ball: 3 personal fouls)   FT 1/2: GOOD   FT 2/2: GOOD Kawhi Russell makes 2/2 from the line.
Score: 101-88

[02:37] Team_006 possession (Score: 101-88)
Lamelo Westbrook attempts a 3Pt. Contested by Kawhi Russell (4.2 feet, ZONE). Lamelo Westbrook misses. Rebound secured by Dejounte Towns.

[02:19] Team_022 possession (Score: 101-88)
Lauri Gobert drives, Cade Ball stays with him. Lauri Gobert attempts a Layup. Contested by Cade Ball (4.3 feet, ZONE). Lauri Gobert misses. Offensive rebound by Dejounte Towns! Dejounte Towns kicks it out.

[02:08] Team_022 possession (Score: 101-88)
Lauri Gobert attempts a Midrange. Contested by Lamelo Westbrook (3.6 feet, MAN). LAURI GOBERT MAKES IT!
Score: 103-88

[01:54] Team_006 possession (Score: 103-88)
Lamelo Westbrook attempts a 3Pt. Contested by Lauri Gobert (4.6 feet, MAN). LAMELO WESTBROOK MAKES IT! Assist: Miles Harris
Score: 103-91

[01:39] Team_022 possession (Score: 103-91)
Lauri Gobert attempts a 3Pt. Contested by Lamelo Westbrook (3.6 feet, ZONE). Lauri Gobert misses. Rebound secured by Shaquille Sexton.

[01:20] Team_006 possession (Score: 103-91)
FOUL! Shooting foul on Kawhi Russell. Cade Ball to the line for 2 free throws. [BONUS: 6 team fouls] (Kawhi Russell: 2 personal fouls)   FT 1/2: GOOD   FT 2/2: GOOD Cade Ball makes 2/2 from the line.
Score: 103-93

[01:05] Team_022 possession (Score: 103-93)
Lauri Gobert attempts a 3Pt. Contested by Lamelo Westbrook (3.7 feet, ZONE). Lauri Gobert misses. Rebound secured by Shaquille Sexton.

[00:50] Team_006 possession (Score: 103-93)
Lamelo Westbrook attempts a 3Pt. Contested by Lauri Gobert (4.7 feet, MAN). Lamelo Westbrook misses. Offensive rebound by Shaquille Sexton! Shaquille Sexton kicks it out.

[00:34] Team_006 possession (Score: 103-93)
FOUL! Reach-in foul on Kawhi Russell during the drive. [IN THE BONUS! 7 team fouls] Shaquille Sexton to the line for 2 free throws. (Kawhi Russell: 3 personal fouls)   FT 1/2: MISS   FT 2/2: MISS Shaquille Sexton makes 0/2 from the line. Offensive rebound by Cade Ball! Cade Ball kicks it out.

[00:21] Team_006 possession (Score: 103-93)
Cade Ball makes the Layup and draws the foul on Kawhi Russell! And-1! Cade Ball to the line for 1. [BONUS: 8 team fouls] (Kawhi Russell: 4 personal fouls)   FT 1/1: GOOD Cade Ball makes 1/1 from the line.
Score: 103-96

[00:06] Team_022 possession (Score: 103-96)
Lauri Gobert makes the Midrange and draws the foul on Cade Ball! And-1! Lauri Gobert to the line for 1. [BONUS: 6 team fouls] (Cade Ball: 4 personal fouls)   FT 1/1: MISS Lauri Gobert makes 0/1 from the line. Rebound secured by Vince Sabonis.
Score: 105-96

================================================================================
                              4TH QUARTER COMPLETE                              
================================================================================

4TH QUARTER SCORE: Team_022 24, Team_006 36

BOX SCORE:
================================================================================

Team_022
--------------------------------------------------------------------------------
Player                MIN  PTS  REB  AST  TO      FG   FG%      3P   3P%
--------------------------------------------------------------------------------
DeMar Harden           18    7    0    0   0   3/3   100.0     0/0   0.0
Myles Anthony          30    3    1    0   0   1/1   100.0     0/0   0.0
Malcolm Allen          30    2    0    1   0   1/2    50.0     0/0   0.0
Michael Ginobili       31    2    1    0   0   1/2    50.0     0/0   0.0
Lamelo Dosunmu         30    2    0    1   0   1/2    50.0     0/0   0.0
Lauri Gobert           17    2    3    0   0   1/7    14.3     0/0   0.0
Dejounte Towns         18    2    3    0   0   1/1   100.0     0/0   0.0
Kawhi Russell          18    2    0    0   0   1/1   100.0     0/0   0.0
Dirk Markkanen         30    0    1    0   0   0/0     0.0     0/0   0.0

TEAM: FG: 10/19 (52.6%), 3PT: 1/7 (14.3%), REB: 9 (4 off, 5 def), AST: 2, TO: 2
TEAM FOULS: 8 [Team_006 in BONUS]


Team_006
--------------------------------------------------------------------------------
Player                MIN  PTS  REB  AST  TO      FG   FG%      3P   3P%
--------------------------------------------------------------------------------
Bradley Gobert         30   10    0    0   0   4/4   100.0     0/0   0.0
Cade Ball              18    7    3    1   0   3/3   100.0     0/0   0.0
Shaquille Sexton       18    6    5    0   0   3/3   100.0     0/0   0.0
Lamelo Westbrook       18    5    0    0   0   2/3    66.7     0/0   0.0
Franz Wagner           30    3    0    0   0   1/3    33.3     0/0   0.0
Jayson Young           31    3    0    0   0   1/1   100.0     0/0   0.0
Miles Harris           17    2    0    2   0   1/1   100.0     0/0   0.0
Shai Westbrook         31    0    0    2   0   0/0     0.0     0/0   0.0
Ja Butler              30    0    3    0   0   0/0     0.0     0/0   0.0
Vince Sabonis          17    0    2    0   0   0/2     0.0     0/0   0.0

TEAM: FG: 15/20 (75.0%), 3PT: 4/8 (50.0%), REB: 13 (4 off, 9 def), AST: 5, TO: 0
TEAM FOULS: 6 [Team_022 in BONUS]

================================================================================

================================================================================
                               FULL GAME COMPLETE                               
================================================================================

FINAL SCORE: Team_022 105, Team_006 96

SCORING BY QUARTER:
--------------------------------------------------------------------------------
Team                     Q1     Q2     Q3     Q4    FINAL
--------------------------------------------------------------------------------
Team_022                 29     15     37     24      105
Team_006                 18     14     28     36       96
--------------------------------------------------------------------------------

FULL GAME BOX SCORE:
================================================================================

Team_022
--------------------------------------------------------------------------------
Player                MIN  PTS  REB  AST  TO      FG   FG%      3P   3P%      FT STL BLK
--------------------------------------------------------------------------------
Michael Ginobili       31   16   12    0   2   4/8    50.0   1/3    33.3   1/2     0   1
Malcolm Allen          30    6    0    5   0   4/9    44.4   2/5    40.0   4/8     1   0
Myles Anthony          30   13    8    2   2   5/9    55.6   2/4    50.0   1/1     0   1
Lamelo Dosunmu         30    8    0    4   4   5/13   38.5   0/3     0.0   4/4     1   0
Dirk Markkanen         30   20   12    1   1   8/9    88.9   0/0     0.0   3/4     0   0
DeMar Harden           18   10    0    1   0   5/9    55.6   0/4     0.0   2/2     0   0
Dejounte Towns         18    7    7    1   1   3/4    75.0   1/2    50.0   0/0     0   0
Kawhi Russell          18    4    3    3   1   3/3   100.0   0/0     0.0   2/2     0   1
Cole Iverson           18    2    0    1   0   0/0     0.0   0/0     0.0   0/0     0   0
Lauri Gobert           17   10    6    1   0   3/11   27.3   1/6    16.7   0/1     0   0

TEAM: FG: 41/76 (53.9%), 3PT: 7/27 (25.9%), REB: 49 (14 off, 35 def), AST: 19, TO: 11


Team_006
--------------------------------------------------------------------------------
Player                MIN  PTS  REB  AST  TO      FG   FG%      3P   3P%      FT STL BLK
--------------------------------------------------------------------------------
Shai Westbrook         31   10   10    3   0   4/10   40.0   2/5    40.0   7/7     0   1
Jayson Young           31    3    0    3   2   2/11   18.2   1/6    16.7   0/0     0   0
Franz Wagner           30    8    0    0   2   3/8    37.5   1/3    33.3   1/2     1   0
Ja Butler              30    9    8    3   1   2/5    40.0   0/0     0.0   0/0     1   1
Bradley Gobert         30   27   10    2   2  11/14   78.6   1/2    50.0  11/12    2   1
Lamelo Westbrook       18    8    0    0   1   4/5    80.0   1/2    50.0   1/2     0   0
Cade Ball              18   10    5    2   0   4/8    50.0   0/2     0.0   4/4     0   0
Shaquille Sexton       18    8    7    0   1   3/4    75.0   0/0     0.0   3/6     0   1
Miles Harris           17    9    0    2   0   3/6    50.0   1/1   100.0   2/2     0   0
Vince Sabonis          17    0    5    0   1   1/3    33.3   1/2    50.0   0/0     1   0

TEAM: FG: 39/76 (51.3%), 3PT: 8/23 (34.8%), REB: 44 (10 off, 34 def), AST: 15, TO: 10

================================================================================
