================================================================================
                        FULL GAME - Team_082 vs Team_015                        
================================================================================

================================================================================
                       1ST QUARTER - Team_082 vs Team_015                       
================================================================================

[12:00] Team_082 possession (Score: 0-0)
FOUL! Shooting foul on Manu Anthony. Julius Carter to the line for 3 free throws. [Team fouls: 1] (Manu Anthony: 1 personal fouls)   FT 1/3: GOOD   FT 2/3: GOOD   FT 3/3: MISS Julius Carter makes 2/3 from the line. Offensive rebound by Jrue Green! Jrue Green kicks it out.
Score: 2-0

[11:48] Team_082 possession (Score: 2-0)
Dwyane O'Neal attempts a 3Pt. Contested by Manu Anthony (3.7 feet, ZONE). DWYANE O'NEAL MAKES IT! Assist: Julius Carter
Score: 5-0

[11:34] Team_015 possession (Score: 5-0)
FOUL! Shooting foul on Jrue Green. Trae Turner to the line for 2 free throws. [Team fouls: 1] (Jrue Green: 1 personal fouls)   FT 1/2: GOOD   FT 2/2: GOOD Trae Turner makes 2/2 from the line.
Score: 5-2

[11:21] Team_082 possession (Score: 5-2)
Julius Anthony attempts a Layup. Contested by Manu Anthony (4.0 feet, MAN). Julius Anthony misses. Rebound secured by Michael Simmons.

[11:06] Team_015 possession (Score: 5-2)
CJ Banchero attempts a Midrange. Contested by Dwyane O'Neal (3.1 feet, ZONE). CJ BANCHERO MAKES IT!
Score: 5-4

[10:52] Team_082 possession (Score: 5-4)
Julius Carter attempts a 3Pt. Contested by Manu Anthony (4.0 feet, ZONE). Julius Carter misses. Offensive rebound by Julius Carter! Julius Carter kicks it out.

[10:35] Team_082 possession (Score: 5-4)
Dwyane O'Neal drives and kicks out. Kristaps Fox attempts a Midrange. Contested by CJ Banchero (4.2 feet, MAN). KRISTAPS FOX MAKES IT!
Score: 7-4

[10:18] Team_015 possession (Score: 7-4)
CJ Banchero attempts a 3Pt. Contested by Dwyane O'Neal (3.1 feet, ZONE). CJ Banchero misses. Rebound secured by Dwyane O'Neal.

[10:02] Team_082 possession (Score: 7-4)
FOUL! Shooting foul on Manu Anthony. Kristaps Fox to the line for 3 free throws. [Team fouls: 2] (Manu Anthony: 2 personal fouls)   FT 1/3: GOOD   FT 2/3: GOOD   FT 3/3: GOOD Kristaps Fox makes 3/3 from the line.
Score: 10-4

[09:49] Team_015 possession (Score: 10-4)
Michael Simmons attempts a Midrange. Contested by Dwyane O'Neal (3.3 feet, MAN). MICHAEL SIMMONS MAKES IT!
Score: 10-6

[09:38] Team_082 possession (Score: 10-6)
Julius Anthony attempts a 3Pt. Contested by Manu Anthony (4.0 feet, MAN). JULIUS ANTHONY MAKES IT! Assist: Dwyane O'Neal
Score: 13-6

[09:21] Team_015 possession (Score: 13-6)
Trae Turner throws a bad pass! Stolen by Julius Carter! TURNOVER! (live ball)

[09:07] Team_082 possession (Score: 13-6)
Kristaps Fox throws a bad pass out of bounds! TURNOVER! (dead ball)

[08:54] Team_015 possession (Score: 13-6)
Manu Anthony attempts a 3Pt. Contested by Julius Anthony (4.8 feet, MAN). MANU ANTHONY MAKES IT! Assist: Scottie Gasol
Score: 13-9

[08:36] Team_082 possession (Score: 13-9)
Julius Anthony makes the Layup and draws the foul on Scottie Gasol! And-1! Julius Anthony to the line for 1. [Team fouls: 3] (Scottie Gasol: 1 personal fouls)   FT 1/1: GOOD Julius Anthony makes 1/1 from the line.
Score: 16-9

[08:23] Team_015 possession (Score: 16-9)
Scottie Gasol attempts a Midrange. Contested by Jrue Green (5.1 feet, MAN). Scottie Gasol misses. Offensive rebound by CJ Banchero! CJ Banchero's putback is no good. Rebound secured by Dwyane O'Neal.

[08:08] Team_082 possession (Score: 16-9)
FOUL! Holding foul on Trae Turner. [Team fouls: 4] No free throws, side out. (Trae Turner: 1 personal fouls)

[07:51] Team_082 possession (Score: 16-9)
Julius Anthony attempts a Midrange. Contested by Manu Anthony (4.0 feet, MAN). JULIUS ANTHONY MAKES IT! Assist: Kristaps Fox
Score: 18-9

[07:33] Team_015 possession (Score: 18-9)
FOUL! Offensive foul on Trae Turner! Julius Carter drew the charge! [Team fouls: 5] (Trae Turner: 2 personal fouls) TURNOVER! (dead ball)

[07:18] Team_082 possession (Score: 18-9)
Dwyane O'Neal throws a bad pass out of bounds! TURNOVER! (dead ball)

[07:03] Team_015 possession (Score: 18-9)
Trae Turner makes the Layup and draws the foul on Julius Carter! And-1! Trae Turner to the line for 1. [Team fouls: 2] (Julius Carter: 1 personal fouls)   FT 1/1: MISS Trae Turner makes 0/1 from the line. Rebound secured by Dwyane O'Neal.
Score: 18-11

[06:46] Team_082 possession (Score: 18-11)
Julius Carter drives, Scottie Gasol stays with him. Julius Carter attempts a Dunk. Contested by Scottie Gasol (3.8 feet, ZONE). Julius Carter misses. FOUL! Loose ball foul on Trae Turner during the rebound battle. [IN THE BONUS! 6 team fouls] Jrue Green to the line for 2 free throws. (Trae Turner: 3 personal fouls)   FT 1/2: GOOD   FT 2/2: MISS Jrue Green makes 1/2 from the line. Rebound secured by CJ Banchero.
Score: 19-11

[06:28] Team_015 possession (Score: 19-11)
Manu Anthony attempts a Midrange. Contested by Julius Anthony (4.8 feet, MAN). Manu Anthony misses. Rebound secured by Jrue Green.

[06:10] Team_082 possession (Score: 19-11)
Julius Anthony drives to the basket... FOUL! Offensive foul on Julius Anthony! Manu Anthony drew the charge! [Team fouls: 3] (Julius Anthony: 1 personal fouls) TURNOVER! (dead ball)

[05:57] Team_015 possession (Score: 19-11)
CJ Banchero makes the Layup and draws the foul on Jrue Green! And-1! CJ Banchero to the line for 1. [Team fouls: 4] (Jrue Green: 2 personal fouls)   FT 1/1: GOOD CJ Banchero makes 1/1 from the line.
Score: 19-14

[05:42] Team_082 possession (Score: 19-14)
Julius Carter drives and kicks out. Dwyane O'Neal attempts a Midrange. Contested by CJ Banchero (4.2 feet, ZONE). DWYANE O'NEAL MAKES IT!
Score: 21-14

[05:31] Team_015 possession (Score: 21-14)
Michael Simmons drives and kicks out. FOUL! Shooting foul on Julius Anthony. Manu Anthony to the line for 3 free throws. [BONUS: 5 team fouls] (Julius Anthony: 2 personal fouls)   FT 1/3: MISS   FT 2/3: GOOD   FT 3/3: MISS Manu Anthony makes 1/3 from the line. Rebound secured by Dwyane O'Neal.
Score: 21-15

[05:17] Team_082 possession (Score: 21-15)
Jrue Green attempts a Layup. Contested by Scottie Gasol (3.7 feet, ZONE). JRUE GREEN MAKES IT! Assist: Dwyane O'Neal
Score: 23-15

[04:59] Team_015 possession (Score: 23-15)
CJ Banchero attempts a 3Pt. Contested by Dwyane O'Neal (3.1 feet, ZONE). CJ Banchero misses. Rebound secured by Jrue Green.

[04:46] Team_082 possession (Score: 23-15)
Kristaps Fox makes the Layup and draws the foul on Michael Simmons! And-1! Kristaps Fox to the line for 1. [BONUS: 7 team fouls] (Michael Simmons: 1 personal fouls)   FT 1/1: GOOD Kristaps Fox makes 1/1 from the line.
Score: 26-15

[04:31] Team_015 possession (Score: 26-15)
Manu Anthony attempts a Midrange. Contested by Kristaps Fox (4.6 feet, ZONE). Manu Anthony misses. Rebound secured by Julius Carter.

[04:15] Team_082 possession (Score: 26-15)
Julius Anthony attempts a 3Pt. Contested by Manu Anthony (4.0 feet, MAN). Julius Anthony misses. Rebound secured by CJ Banchero.

[04:02] Team_015 possession (Score: 26-15)
Manu Anthony attempts a 3Pt. Contested by Julius Anthony (4.9 feet, MAN). Manu Anthony misses. Rebound secured by Dwyane O'Neal.

[03:49] Team_082 possession (Score: 26-15)
FOUL! Shooting foul on Manu Anthony. Kristaps Fox to the line for 3 free throws. [BONUS: 8 team fouls] (Manu Anthony: 3 personal fouls)   FT 1/3: GOOD   FT 2/3: GOOD   FT 3/3: GOOD Kristaps Fox makes 3/3 from the line.
Score: 29-15

[03:37] Team_015 possession (Score: 29-15)
Scottie Gasol attempts a Midrange. Contested by Jrue Green (5.2 feet, MAN). SCOTTIE GASOL MAKES IT! Assist: Michael Simmons
Score: 29-17

[03:21] Team_082 possession (Score: 29-17)
Kristaps Fox attempts a 3Pt. Contested by CJ Banchero (4.5 feet, MAN). Kristaps Fox misses. Rebound secured by CJ Banchero.

[03:06] Team_015 possession (Score: 29-17)
Michael Simmons throws a bad pass! Stolen by Dwyane O'Neal! TURNOVER! (live ball)

[02:51] Team_082 possession (Score: 29-17)
Dwyane O'Neal attempts a Midrange. Contested by Michael Simmons (3.6 feet, MAN). DWYANE O'NEAL MAKES IT!
Score: 31-17

[02:35] Team_015 possession (Score: 31-17)
CJ Banchero attempts a Layup. Contested by Kristaps Fox (4.3 feet, MAN). CJ BANCHERO MAKES IT! Assist: Manu Anthony
Score: 31-19

[02:24] Team_082 possession (Score: 31-19)
Julius Anthony attempts a 3Pt. Contested by Manu Anthony (4.2 feet, MAN). Julius Anthony misses. Rebound secured by Trae Turner.

[02:09] Team_015 possession (Score: 31-19)
Manu Anthony attempts a Layup. Contested by Jrue Green (5.6 feet, ZONE). MANU ANTHONY MAKES IT!
Score: 31-21

[01:50] Team_082 possession (Score: 31-21)
Dwyane O'Neal attempts a 3Pt. Contested by Michael Simmons (3.7 feet, MAN). DWYANE O'NEAL MAKES IT! Assist: Kristaps Fox
Score: 34-21

[01:35] Team_015 possession (Score: 34-21)
Scottie Gasol drives to the basket... Scottie Gasol loses control! Ball rolls out of bounds! TURNOVER! (dead ball)

[01:35] Substitution (Team_082): Julius Anthony OUT → Jordan Rozier IN (stamina_rule2)

[01:35] Substitution (Team_082): Dwyane O'Neal OUT → Kawhi Poole IN (stamina_rule2)

[01:35] Substitution (Team_082): Kristaps Fox OUT → Shaquille Griffin IN (stamina_rule2)

[01:35] Substitution (Team_082): Jrue Green OUT → Tony Jokic IN (stamina_rule2)

[01:35] Substitution (Team_082): Julius Carter OUT → D'Angelo Parker IN (stamina_rule2)

[01:35] Substitution (Team_015): Manu Anthony OUT → Dwyane Sabonis IN (stamina_rule2)

[01:35] Substitution (Team_015): Michael Simmons OUT → Paolo Jokic IN (stamina_rule2)

[01:35] Substitution (Team_015): CJ Banchero OUT → Magic Wagner IN (stamina_rule2)

[01:35] Substitution (Team_015): Scottie Gasol OUT → Rudy Paul IN (stamina_rule2)

[01:35] Substitution (Team_015): Trae Turner OUT → Allen Curry IN (stamina_rule2)

[01:17] Team_082 possession (Score: 34-21)
Shaquille Griffin attempts a 3Pt. Contested by Rudy Paul (3.2 feet, ZONE). Shaquille Griffin misses. FOUL! Loose ball foul on Magic Wagner during the rebound battle. [IN THE BONUS! 9 team fouls] Tony Jokic to the line for 2 free throws. (Magic Wagner: 1 personal fouls)   FT 1/2: GOOD   FT 2/2: GOOD Tony Jokic makes 2/2 from the line.
Score: 36-21

[00:58] Team_015 possession (Score: 36-21)
Paolo Jokic attempts a 3Pt. Contested by Kawhi Poole (6.0 feet, MAN). Paolo Jokic misses. Offensive rebound by Allen Curry! Allen Curry puts it back in!
Score: 36-23

[00:45] Team_082 possession (Score: 36-23)
Shaquille Griffin drives, Rudy Paul stays with him. Shaquille Griffin attempts a Dunk. Contested by Rudy Paul (3.2 feet, ZONE). SHAQUILLE GRIFFIN MAKES IT! Assist: Jordan Rozier
Score: 38-23

[00:30] Team_015 possession (Score: 38-23)
Dwyane Sabonis attempts a 3Pt. Contested by Tony Jokic (5.3 feet, ZONE). Dwyane Sabonis misses. Offensive rebound by Rudy Paul! Rudy Paul puts it back in!
Score: 38-25

[00:12] Team_082 possession (Score: 38-25)
Shaquille Griffin attempts a Midrange. Contested by Magic Wagner (5.3 feet, ZONE). Shaquille Griffin misses. Rebound secured by Magic Wagner.

================================================================================
                              1ST QUARTER COMPLETE                              
================================================================================

1ST QUARTER SCORE: Team_082 38, Team_015 25

BOX SCORE:
================================================================================

Team_082
--------------------------------------------------------------------------------
Player                MIN  PTS  REB  AST  TO      FG   FG%      3P   3P%
--------------------------------------------------------------------------------
Kristaps Fox           11   11    0    2   0   4/5    80.0     0/0   0.0
Dwyane O'Neal          11   10    5    2   0   4/4   100.0     0/0   0.0
Julius Anthony         11    8    0    0   0   3/6    50.0     0/0   0.0
Jrue Green             11    2    3    0   0   1/1   100.0     0/0   0.0
Tony Jokic              1    2    0    0   0   1/1   100.0     0/0   0.0
Shaquille Griffin       1    2    0    0   0   1/2    50.0     0/0   0.0
Julius Carter          11    0    2    1   0   0/1     0.0     0/0   0.0
Jordan Rozier           1    0    0    1   0   0/0     0.0     0/0   0.0

TEAM: FG: 14/20 (70.0%), 3PT: 6/9 (66.7%), REB: 10 (3 off, 7 def), AST: 6, TO: 3
TEAM FOULS: 5 [Team_015 in BONUS]


Team_015
--------------------------------------------------------------------------------
Player                MIN  PTS  REB  AST  TO      FG   FG%      3P   3P%
--------------------------------------------------------------------------------
CJ Banchero            11    7    3    0   0   3/5    60.0     0/0   0.0
Manu Anthony           11    5    0    1   0   2/5    40.0     0/0   0.0
Trae Turner            11    2    1    0   0   1/2    50.0     0/0   0.0
Michael Simmons        11    2    1    1   0   1/2    50.0     0/0   0.0
Scottie Gasol          11    2    0    1   0   1/2    50.0     0/0   0.0
Allen Curry             1    2    1    0   0   1/1   100.0     0/0   0.0
Rudy Paul               1    2    1    0   0   1/1   100.0     0/0   0.0
Magic Wagner            1    0    1    0   0   0/0     0.0     0/0   0.0

TEAM: FG: 10/18 (55.6%), 3PT: 3/6 (50.0%), REB: 8 (3 off, 5 def), AST: 3, TO: 4
TEAM FOULS: 9 [Team_082 in BONUS]

================================================================================

================================================================================
                       2ND QUARTER - Team_082 vs Team_015                       
================================================================================

[12:00] Team_082 possession (Score: 38-25)
Julius Carter drives and kicks out. Dwyane O'Neal attempts a Midrange. Contested by Michael Simmons (3.4 feet, MAN). Dwyane O'Neal misses. Rebound secured by Michael Simmons.

[11:46] Team_015 possession (Score: 38-25)
FOUL! Reach-in foul on Julius Anthony during the drive. [Team fouls: 1] No free throws, side out. (Julius Anthony: 1 personal fouls)

[11:29] Team_015 possession (Score: 38-25)
FOUL! Holding foul on Julius Anthony. [Team fouls: 2] No free throws, side out. (Julius Anthony: 2 personal fouls)

[11:17] Team_015 possession (Score: 38-25)
Scottie Gasol attempts a Midrange. Contested by Jrue Green (5.3 feet, MAN). Scottie Gasol misses. FOUL! Loose ball foul on Dwyane O'Neal during the rebound battle. [Team fouls: 3] No free throws, side out. (Dwyane O'Neal: 1 personal fouls)

[11:06] Team_015 possession (Score: 38-25)
FOUL! Shooting foul on Julius Anthony. Manu Anthony to the line for 2 free throws. [Team fouls: 4] (Julius Anthony: 3 personal fouls)   FT 1/2: GOOD   FT 2/2: GOOD Manu Anthony makes 2/2 from the line.
Score: 38-27

[10:51] Team_082 possession (Score: 38-27)
Jrue Green attempts a Midrange. Contested by Scottie Gasol (3.9 feet, MAN). JRUE GREEN MAKES IT! Assist: Julius Carter
Score: 40-27

[10:33] Team_015 possession (Score: 40-27)
Scottie Gasol attempts a Midrange. Contested by Kristaps Fox (4.5 feet, ZONE). SCOTTIE GASOL MAKES IT!
Score: 40-29

[10:14] Team_082 possession (Score: 40-29)
Jrue Green drives, Scottie Gasol stays with him. Jrue Green attempts a Layup. Contested by Scottie Gasol (4.0 feet, MAN). Jrue Green misses. Rebound secured by Michael Simmons.

[09:58] Team_015 possession (Score: 40-29)
Manu Anthony attempts a 3Pt. Contested by Dwyane O'Neal (3.8 feet, ZONE). Manu Anthony misses. Rebound secured by Jrue Green.

[09:46] Team_082 possession (Score: 40-29)
Julius Carter drives, Trae Turner stays with him. Julius Carter attempts a Dunk. Contested by Trae Turner (4.4 feet, MAN). Julius Carter misses. Offensive rebound by Jrue Green! Jrue Green kicks it out.

[09:32] Team_082 possession (Score: 40-29)
Jrue Green attempts a Midrange. Contested by Scottie Gasol (4.1 feet, ZONE). Jrue Green misses. Rebound secured by Michael Simmons.

[09:19] Team_015 possession (Score: 40-29)
Scottie Gasol drives to the basket... Scottie Gasol loses control! Ball rolls out of bounds! TURNOVER! (dead ball)

[09:19] Substitution (Team_082): Julius Anthony OUT → Jordan Rozier IN (stamina_rule2)

[09:19] Substitution (Team_082): Dwyane O'Neal OUT → Kawhi Poole IN (stamina_rule2)

[09:19] Substitution (Team_082): Kristaps Fox OUT → Shaquille Griffin IN (stamina_rule2)

[09:19] Substitution (Team_082): Jrue Green OUT → Tony Jokic IN (stamina_rule2)

[09:19] Substitution (Team_082): Julius Carter OUT → D'Angelo Parker IN (stamina_rule2)

[09:19] Substitution (Team_015): Manu Anthony OUT → Dwyane Sabonis IN (stamina_rule2)

[09:19] Substitution (Team_015): Michael Simmons OUT → Paolo Jokic IN (stamina_rule2)

[09:19] Substitution (Team_015): CJ Banchero OUT → Magic Wagner IN (stamina_rule2)

[09:19] Substitution (Team_015): Scottie Gasol OUT → Rudy Paul IN (stamina_rule2)

[09:19] Substitution (Team_015): Trae Turner OUT → Allen Curry IN (stamina_rule2)

[09:01] Team_082 possession (Score: 40-29)
Kawhi Poole drives and kicks out. Jordan Rozier attempts a 3Pt. Contested by Dwyane Sabonis (4.8 feet, MAN). Jordan Rozier misses. Rebound secured by Rudy Paul.

[08:49] Team_015 possession (Score: 40-29)
Allen Curry attempts a Midrange. BLOCKED BY TONY JOKIC! Ball deflects out of bounds off Allen Curry.

[08:37] Team_082 possession (Score: 40-29)
Jordan Rozier throws a bad pass! Stolen by Dwyane Sabonis! TURNOVER! (live ball)

[08:24] Team_015 possession (Score: 40-29)
Magic Wagner drives to the basket... Magic Wagner throws a bad pass out of bounds! TURNOVER! (dead ball)

[08:09] Team_082 possession (Score: 40-29)
Tony Jokic attempts a Layup. BLOCKED BY RUDY PAUL! Ball is loose! Rebound secured by Allen Curry.

[07:54] Team_015 possession (Score: 40-29)
Dwyane Sabonis attempts a Layup. Wide open! Jordan Rozier is 6.2 feet away. [MAN] Dwyane Sabonis misses. Offensive rebound by Allen Curry! Allen Curry's putback is no good. Rebound secured by D'Angelo Parker.

[07:38] Team_082 possession (Score: 40-29)
Kawhi Poole attempts a 3Pt. Contested by Rudy Paul (3.8 feet, ZONE). Kawhi Poole misses. FOUL! Loose ball foul on Magic Wagner during the rebound battle. [Team fouls: 1] No free throws, side out. (Magic Wagner: 1 personal fouls)

[07:25] Team_082 possession (Score: 40-29)
D'Angelo Parker drives, Rudy Paul stays with him. D'Angelo Parker attempts a Dunk. Contested by Rudy Paul (3.7 feet, ZONE). D'Angelo Parker misses. Rebound secured by Magic Wagner.

[07:12] Team_015 possession (Score: 40-29)
Dwyane Sabonis drives, picks up D'Angelo Parker. Help arrives from Kawhi Poole! Dwyane Sabonis attempts a Layup. Contested by Kawhi Poole (5.2 feet, ZONE). Dwyane Sabonis misses. Offensive rebound by Allen Curry! Allen Curry puts it back in!
Score: 40-31

[06:57] Team_082 possession (Score: 40-31)
Shaquille Griffin attempts a 3Pt. Contested by Rudy Paul (3.2 feet, ZONE). SHAQUILLE GRIFFIN MAKES IT! Assist: Jordan Rozier
Score: 43-31

[06:44] Team_015 possession (Score: 43-31)
FOUL! Offensive foul on Paolo Jokic! Kawhi Poole drew the charge! [Team fouls: 2] (Paolo Jokic: 1 personal fouls) TURNOVER! (dead ball)

[06:32] Team_082 possession (Score: 43-31)
FOUL! Reach-in foul on Dwyane Sabonis during the drive. [Team fouls: 3] No free throws, side out. (Dwyane Sabonis: 1 personal fouls)

[06:14] Team_082 possession (Score: 43-31)
Jordan Rozier attempts a 3Pt. Contested by Dwyane Sabonis (5.0 feet, MAN). Jordan Rozier misses. Rebound secured by Rudy Paul.

[05:59] Team_015 possession (Score: 43-31)
Dwyane Sabonis attempts a Midrange. Contested by Tony Jokic (5.3 feet, ZONE). Dwyane Sabonis misses. Offensive rebound by Rudy Paul! Rudy Paul's putback is no good. Offensive rebound by Allen Curry! Allen Curry kicks it out.

[05:44] Team_015 possession (Score: 43-31)
Dwyane Sabonis attempts a Midrange. Wide open! Jordan Rozier is 6.2 feet away. [MAN] DWYANE SABONIS MAKES IT! Assist: Magic Wagner
Score: 43-33

[05:33] Team_082 possession (Score: 43-33)
Shaquille Griffin attempts a Midrange. Contested by Rudy Paul (3.2 feet, ZONE). Shaquille Griffin misses. Rebound secured by Magic Wagner.

[05:16] Team_015 possession (Score: 43-33)
Allen Curry drives, D'Angelo Parker stays with him. Allen Curry attempts a Layup. Contested by D'Angelo Parker (5.4 feet, ZONE). Allen Curry misses. Rebound secured by D'Angelo Parker.

[04:57] Team_082 possession (Score: 43-33)
Kawhi Poole drives, Rudy Paul stays with him. Kawhi Poole attempts a Dunk. Contested by Rudy Paul (3.8 feet, ZONE). KAWHI POOLE MAKES IT!
Score: 45-33

[04:37] Team_015 possession (Score: 45-33)
Allen Curry throws a bad pass! Stolen by D'Angelo Parker! TURNOVER! (live ball)

[04:21] Team_082 possession (Score: 45-33)
Shaquille Griffin attempts a Midrange. Contested by Magic Wagner (5.3 feet, MAN). Shaquille Griffin misses. Rebound secured by Allen Curry.

[04:06] Team_015 possession (Score: 45-33)
Allen Curry attempts a Layup. Contested by D'Angelo Parker (5.4 feet, MAN). ALLEN CURRY MAKES IT!
Score: 45-35

[03:48] Team_082 possession (Score: 45-35)
Tony Jokic drives, Rudy Paul stays with him. Tony Jokic attempts a Dunk. Contested by Rudy Paul (3.0 feet, MAN). Tony Jokic misses. Rebound secured by Rudy Paul.

[03:34] Team_015 possession (Score: 45-35)
Allen Curry makes the Layup and draws the foul on D'Angelo Parker! And-1! Allen Curry to the line for 1. [BONUS: 5 team fouls] (D'Angelo Parker: 1 personal fouls)   FT 1/1: GOOD Allen Curry makes 1/1 from the line.
Score: 45-38

[03:22] Team_082 possession (Score: 45-38)
Shaquille Griffin attempts a Layup. BLOCKED BY MAGIC WAGNER! Ball is loose! Offensive rebound by Tony Jokic! Tony Jokic kicks it out.

[03:11] Team_082 possession (Score: 45-38)
Shaquille Griffin makes the Midrange and draws the foul on Magic Wagner! And-1! Shaquille Griffin to the line for 1. [Team fouls: 4] (Magic Wagner: 2 personal fouls)   FT 1/1: GOOD Shaquille Griffin makes 1/1 from the line.
Score: 48-38

[02:59] Team_015 possession (Score: 48-38)
Rudy Paul makes the Dunk and draws the foul on Tony Jokic! And-1! Rudy Paul to the line for 1. [BONUS: 6 team fouls] (Tony Jokic: 1 personal fouls)   FT 1/1: GOOD Rudy Paul makes 1/1 from the line.
Score: 48-41

[02:48] Team_082 possession (Score: 48-41)
FOUL! Shooting foul on Dwyane Sabonis. Tony Jokic to the line for 2 free throws. [BONUS: 5 team fouls] (Dwyane Sabonis: 2 personal fouls)   FT 1/2: MISS   FT 2/2: GOOD Tony Jokic makes 1/2 from the line.
Score: 49-41

[02:35] Team_015 possession (Score: 49-41)
Paolo Jokic drives, Kawhi Poole stays with him. Paolo Jokic attempts a Layup. Wide open! Kawhi Poole is 6.0 feet away. [MAN] PAOLO JOKIC MAKES IT!
Score: 49-43

[02:22] Team_082 possession (Score: 49-43)
Jordan Rozier makes the Midrange and draws the foul on Dwyane Sabonis! And-1! Jordan Rozier to the line for 1. [BONUS: 6 team fouls] (Dwyane Sabonis: 3 personal fouls)   FT 1/1: GOOD Jordan Rozier makes 1/1 from the line.
Score: 52-43

[02:08] Team_015 possession (Score: 52-43)
FOUL! Shooting foul on D'Angelo Parker. Allen Curry to the line for 2 free throws. [BONUS: 7 team fouls] (D'Angelo Parker: 2 personal fouls)   FT 1/2: MISS   FT 2/2: GOOD Allen Curry makes 1/2 from the line.
Score: 52-44

[01:56] Team_082 possession (Score: 52-44)
Kawhi Poole throws a bad pass! Stolen by Paolo Jokic! TURNOVER! (live ball)

[01:42] Team_015 possession (Score: 52-44)
Allen Curry attempts a 3Pt. Contested by Kawhi Poole (5.9 feet, ZONE). ALLEN CURRY MAKES IT! Assist: Paolo Jokic
Score: 52-47

[01:27] Team_082 possession (Score: 52-47)
Jordan Rozier attempts a Layup. Contested by Dwyane Sabonis (5.1 feet, MAN). Jordan Rozier misses. Rebound secured by Magic Wagner.

[01:09] Team_015 possession (Score: 52-47)
Dwyane Sabonis drives, Jordan Rozier stays with him. Dwyane Sabonis attempts a Layup. Wide open! Jordan Rozier is 6.4 feet away. [MAN] DWYANE SABONIS MAKES IT! Assist: Allen Curry
Score: 52-49

[00:53] Team_082 possession (Score: 52-49)
Tony Jokic attempts a Midrange. Contested by Rudy Paul (3.2 feet, MAN). Tony Jokic misses. Offensive rebound by D'Angelo Parker! D'Angelo Parker kicks it out.

[00:36] Team_082 possession (Score: 52-49)
D'Angelo Parker drives to the basket... D'Angelo Parker throws a bad pass out of bounds! TURNOVER! (dead ball)

[00:25] Team_015 possession (Score: 52-49)
Allen Curry attempts a Layup. BLOCKED BY D'ANGELO PARKER! Ball deflects out of bounds off Allen Curry.

[00:14] Team_082 possession (Score: 52-49)
Tony Jokic attempts a 3Pt. Contested by Rudy Paul (3.3 feet, MAN). Tony Jokic misses. Rebound secured by Allen Curry.

[00:02] Team_015 possession (Score: 52-49)
Paolo Jokic makes the Layup and draws the foul on Kawhi Poole! And-1! Paolo Jokic to the line for 1. [BONUS: 8 team fouls] (Kawhi Poole: 1 personal fouls)   FT 1/1: MISS Paolo Jokic makes 0/1 from the line. Rebound secured by Shaquille Griffin.
Score: 52-51

================================================================================
                              2ND QUARTER COMPLETE                              
================================================================================

2ND QUARTER SCORE: Team_082 14, Team_015 26

BOX SCORE:
================================================================================

Team_082
--------------------------------------------------------------------------------
Player                MIN  PTS  REB  AST  TO      FG   FG%      3P   3P%
--------------------------------------------------------------------------------
Shaquille Griffin      11    6    2    0   0   2/4    50.0     0/0   0.0
Jordan Rozier          11    3    0    1   0   1/3    33.3     0/0   0.0
Jrue Green             14    2    2    0   0   1/3    33.3     0/0   0.0
Kawhi Poole            11    2    0    0   0   1/2    50.0     0/0   0.0
Tony Jokic             11    1    1    0   0   1/4    25.0     0/0   0.0
Julius Carter          14    0    0    1   0   0/1     0.0     0/0   0.0
D'Angelo Parker        11    0    3    0   0   0/1     0.0     0/0   0.0

TEAM: FG: 6/18 (33.3%), 3PT: 1/3 (33.3%), REB: 7 (4 off, 3 def), AST: 2, TO: 3
TEAM FOULS: 8 [Team_015 in BONUS]


Team_015
--------------------------------------------------------------------------------
Player                MIN  PTS  REB  AST  TO      FG   FG%      3P   3P%
--------------------------------------------------------------------------------
Allen Curry            11   11    5    1   0   5/8    62.5     0/0   0.0
Dwyane Sabonis         11    4    0    0   0   2/3    66.7     0/0   0.0
Rudy Paul              11    3    3    0   0   1/1   100.0     0/0   0.0
Manu Anthony           14    2    0    0   0   1/2    50.0     0/0   0.0
Scottie Gasol          14    2    0    0   0   1/1   100.0     0/0   0.0
Paolo Jokic            11    2    0    1   0   1/2    50.0     0/0   0.0
Michael Simmons        14    0    3    0   0   0/0     0.0     0/0   0.0
CJ Banchero            14    0    1    0   0   0/0     0.0     0/0   0.0
Magic Wagner           11    0    3    1   0   0/0     0.0     0/0   0.0

TEAM: FG: 11/17 (64.7%), 3PT: 1/2 (50.0%), REB: 16 (4 off, 12 def), AST: 3, TO: 4
TEAM FOULS: 6 [Team_082 in BONUS]

================================================================================

================================================================================
                       3RD QUARTER - Team_082 vs Team_015                       
================================================================================

[12:00] Team_082 possession (Score: 52-51)
FOUL! Reach-in foul on CJ Banchero during the drive. [Team fouls: 1] No free throws, side out. (CJ Banchero: 1 personal fouls)

[11:46] Team_082 possession (Score: 52-51)
FOUL! Reach-in foul on Scottie Gasol during the drive. [Team fouls: 2] No free throws, side out. (Scottie Gasol: 1 personal fouls)

[11:35] Team_082 possession (Score: 52-51)
Julius Anthony throws a bad pass! Stolen by Manu Anthony! TURNOVER! (live ball)

[11:22] Team_015 possession (Score: 52-51)
Scottie Gasol attempts a 3Pt. Contested by Dwyane O'Neal (3.3 feet, ZONE). Scottie Gasol misses. FOUL! Loose ball foul on Dwyane O'Neal during the rebound battle. [Team fouls: 1] No free throws, side out. (Dwyane O'Neal: 1 personal fouls)

[11:12] Team_015 possession (Score: 52-51)
Manu Anthony drives and kicks out. Trae Turner attempts a 3Pt. Contested by Julius Carter (5.8 feet, MAN). Trae Turner misses. Rebound secured by Jrue Green.

[10:58] Team_082 possession (Score: 52-51)
Dwyane O'Neal attempts a Layup. Contested by Michael Simmons (3.4 feet, MAN). DWYANE O'NEAL MAKES IT! Assist: Jrue Green
Score: 54-51

[10:42] Team_015 possession (Score: 54-51)
Manu Anthony attempts a Midrange. Contested by Julius Anthony (4.8 feet, MAN). Manu Anthony misses. Rebound secured by Jrue Green.

[10:29] Team_082 possession (Score: 54-51)
Dwyane O'Neal attempts a 3Pt. Contested by Michael Simmons (3.4 feet, MAN). Dwyane O'Neal misses. Rebound secured by Trae Turner.

[10:11] Team_015 possession (Score: 54-51)
CJ Banchero attempts a Midrange. Contested by Kristaps Fox (4.0 feet, MAN). CJ Banchero misses. Rebound secured by Dwyane O'Neal.

[09:58] Team_082 possession (Score: 54-51)
Kristaps Fox attempts a 3Pt. Contested by CJ Banchero (4.3 feet, MAN). Kristaps Fox misses. FOUL! Loose ball foul on Trae Turner during the rebound battle. [Team fouls: 3] No free throws, side out. (Trae Turner: 1 personal fouls)

[09:40] Team_082 possession (Score: 54-51)
Jrue Green attempts a 3Pt. Contested by Michael Simmons (3.6 feet, ZONE). Jrue Green misses. Rebound secured by Trae Turner.

[09:24] Team_015 possession (Score: 54-51)
Scottie Gasol commits a violation (traveling/carry)! TURNOVER! (dead ball)

[09:10] Team_082 possession (Score: 54-51)
Julius Anthony attempts a Layup. Contested by Manu Anthony (4.0 feet, MAN). JULIUS ANTHONY MAKES IT!
Score: 56-51

[08:57] Team_015 possession (Score: 56-51)
CJ Banchero attempts a 3Pt. Contested by Kristaps Fox (4.0 feet, MAN). CJ Banchero misses. Rebound secured by Jrue Green.

[08:41] Team_082 possession (Score: 56-51)
FOUL! Shooting foul on Michael Simmons. Dwyane O'Neal to the line for 2 free throws. [Team fouls: 4] (Michael Simmons: 1 personal fouls)   FT 1/2: GOOD   FT 2/2: GOOD Dwyane O'Neal makes 2/2 from the line.
Score: 58-51

[08:26] Team_015 possession (Score: 58-51)
CJ Banchero attempts a 3Pt. Contested by Dwyane O'Neal (3.1 feet, ZONE). CJ Banchero misses. Rebound secured by Jrue Green.

[08:14] Team_082 possession (Score: 58-51)
Kristaps Fox attempts a Midrange. Contested by CJ Banchero (4.3 feet, MAN). Kristaps Fox misses. Offensive rebound by Jrue Green! Jrue Green kicks it out.

[07:59] Team_082 possession (Score: 58-51)
Dwyane O'Neal attempts a Midrange. Contested by Michael Simmons (3.4 feet, MAN). DWYANE O'NEAL MAKES IT!
Score: 60-51

[07:45] Team_015 possession (Score: 60-51)
Scottie Gasol attempts a Midrange. Contested by Dwyane O'Neal (3.3 feet, ZONE). SCOTTIE GASOL MAKES IT!
Score: 60-53

[07:34] Team_082 possession (Score: 60-53)
Julius Carter attempts a Layup. Contested by Scottie Gasol (3.8 feet, ZONE). Julius Carter misses. Rebound secured by Trae Turner.

[07:14] Team_015 possession (Score: 60-53)
Trae Turner drives, Jrue Green stays with him. Trae Turner attempts a Dunk. Contested by Jrue Green (5.2 feet, ZONE). Trae Turner misses. Offensive rebound by CJ Banchero! CJ Banchero puts it back in!
Score: 60-55

[07:03] Team_082 possession (Score: 60-55)
Kristaps Fox attempts a 3Pt. Contested by CJ Banchero (4.3 feet, MAN). KRISTAPS FOX MAKES IT! Assist: Julius Carter
Score: 63-55

[06:47] Team_015 possession (Score: 63-55)
Manu Anthony drives, Julius Anthony stays with him. Manu Anthony attempts a Dunk. Contested by Julius Anthony (4.8 feet, MAN). MANU ANTHONY MAKES IT! Assist: Trae Turner
Score: 63-57

[06:29] Team_082 possession (Score: 63-57)
Dwyane O'Neal drives, Michael Simmons stays with him. Dwyane O'Neal attempts a Layup. Contested by Michael Simmons (3.4 feet, MAN). DWYANE O'NEAL MAKES IT! Assist: Julius Anthony
Score: 65-57

[06:16] Team_015 possession (Score: 65-57)
Scottie Gasol attempts a 3Pt. Contested by Jrue Green (5.1 feet, MAN). Scottie Gasol misses. Offensive rebound by CJ Banchero! CJ Banchero's putback is no good. Offensive rebound by CJ Banchero! CJ Banchero kicks it out.

[06:01] Team_015 possession (Score: 65-57)
CJ Banchero attempts a 3Pt. Contested by Kristaps Fox (4.0 feet, MAN). CJ Banchero misses. Rebound secured by Julius Carter.

[05:47] Team_082 possession (Score: 65-57)
Kristaps Fox attempts a 3Pt. Contested by Manu Anthony (3.8 feet, ZONE). Kristaps Fox misses. Rebound secured by CJ Banchero.

[05:31] Team_015 possession (Score: 65-57)
CJ Banchero attempts a 3Pt. Contested by Julius Anthony (4.3 feet, ZONE). CJ BANCHERO MAKES IT! Assist: Manu Anthony
Score: 65-60

[05:19] Team_082 possession (Score: 65-60)
FOUL! Reach-in foul on Trae Turner during the drive. [IN THE BONUS! 5 team fouls] Julius Anthony to the line for 2 free throws. (Trae Turner: 2 personal fouls)   FT 1/2: GOOD   FT 2/2: GOOD Julius Anthony makes 2/2 from the line.
Score: 67-60

[05:04] Team_015 possession (Score: 67-60)
Manu Anthony drives and kicks out. Michael Simmons attempts a 3Pt. Contested by Dwyane O'Neal (3.3 feet, MAN). Michael Simmons misses. Rebound secured by Dwyane O'Neal.

[04:49] Team_082 possession (Score: 67-60)
Julius Anthony attempts a 3Pt. Contested by Manu Anthony (4.0 feet, MAN). Julius Anthony misses. Rebound secured by Trae Turner.

[04:31] Team_015 possession (Score: 67-60)
Michael Simmons attempts a Midrange. Contested by Dwyane O'Neal (3.4 feet, MAN). MICHAEL SIMMONS MAKES IT! Assist: Trae Turner
Score: 67-62

[04:14] Team_082 possession (Score: 67-62)
Jrue Green attempts a Layup. Contested by Scottie Gasol (3.8 feet, ZONE). JRUE GREEN MAKES IT! Assist: Julius Anthony
Score: 69-62

[04:01] Team_015 possession (Score: 69-62)
Michael Simmons attempts a Layup. Contested by Dwyane O'Neal (3.4 feet, MAN). MICHAEL SIMMONS MAKES IT! Assist: Scottie Gasol
Score: 69-64

[03:47] Team_082 possession (Score: 69-64)
Dwyane O'Neal makes the Dunk and draws the foul on Scottie Gasol! And-1! Dwyane O'Neal to the line for 1. [BONUS: 6 team fouls] (Scottie Gasol: 2 personal fouls)   FT 1/1: GOOD Dwyane O'Neal makes 1/1 from the line.
Score: 72-64

[03:33] Team_015 possession (Score: 72-64)
Trae Turner attempts a 3Pt. Contested by Dwyane O'Neal (3.6 feet, ZONE). Trae Turner misses. Rebound secured by Jrue Green.

[03:20] Team_082 possession (Score: 72-64)
Julius Anthony attempts a 3Pt. Contested by Manu Anthony (4.1 feet, ZONE). JULIUS ANTHONY MAKES IT! Assist: Julius Carter
Score: 75-64

[03:07] Team_015 possession (Score: 75-64)
Trae Turner drives to the basket... Trae Turner throws a bad pass out of bounds! TURNOVER! (dead ball)

[03:07] Substitution (Team_082): Jrue Green OUT → Tony Jokic IN (stamina_rule2)

[03:07] Substitution (Team_015): Trae Turner OUT → Allen Curry IN (stamina_rule2)

[02:48] Team_082 possession (Score: 75-64)
FOUL! Reach-in foul on Michael Simmons during the drive. [IN THE BONUS! 7 team fouls] Dwyane O'Neal to the line for 2 free throws. (Michael Simmons: 2 personal fouls)   FT 1/2: GOOD   FT 2/2: GOOD Dwyane O'Neal makes 2/2 from the line.
Score: 77-64

[02:33] Team_015 possession (Score: 77-64)
Scottie Gasol drives and kicks out. Michael Simmons attempts a Midrange. Contested by Tony Jokic (5.1 feet, ZONE). MICHAEL SIMMONS MAKES IT!
Score: 77-66

[02:17] Team_082 possession (Score: 77-66)
Tony Jokic attempts a 3Pt. Contested by Scottie Gasol (3.5 feet, MAN). Tony Jokic misses. Offensive rebound by Julius Carter! Julius Carter kicks it out.

[02:08] Team_082 possession (Score: 77-66)
Kristaps Fox attempts a 3Pt. Contested by CJ Banchero (4.6 feet, MAN). Kristaps Fox misses. Offensive rebound by Julius Carter! Julius Carter kicks it out.

[01:57] Team_082 possession (Score: 77-66)
FOUL! Shooting foul on Scottie Gasol. Kristaps Fox to the line for 2 free throws. [BONUS: 8 team fouls] (Scottie Gasol: 3 personal fouls)   FT 1/2: GOOD   FT 2/2: MISS Kristaps Fox makes 1/2 from the line. Rebound secured by CJ Banchero.
Score: 78-66

[01:38] Team_015 possession (Score: 78-66)
Manu Anthony attempts a Midrange. Contested by Tony Jokic (5.3 feet, ZONE). MANU ANTHONY MAKES IT!
Score: 78-68

[01:23] Team_082 possession (Score: 78-68)
Tony Jokic makes the Layup and draws the foul on Scottie Gasol! And-1! Tony Jokic to the line for 1. [BONUS: 9 team fouls] (Scottie Gasol: 4 personal fouls)   FT 1/1: GOOD Tony Jokic makes 1/1 from the line.
Score: 81-68

[01:11] Team_015 possession (Score: 81-68)
Michael Simmons attempts a 3Pt. Contested by Dwyane O'Neal (3.7 feet, MAN). MICHAEL SIMMONS MAKES IT! Assist: Scottie Gasol
Score: 81-71

[00:57] Team_082 possession (Score: 81-71)
Julius Anthony attempts a 3Pt. Contested by Manu Anthony (4.4 feet, MAN). Julius Anthony misses. Rebound secured by CJ Banchero.

[00:42] Team_015 possession (Score: 81-71)
Manu Anthony attempts a Midrange. Contested by Dwyane O'Neal (4.0 feet, ZONE). MANU ANTHONY MAKES IT!
Score: 81-73

[00:26] Team_082 possession (Score: 81-73)
Dwyane O'Neal drives to the basket... Dwyane O'Neal throws a bad pass out of bounds! TURNOVER! (dead ball)

[00:26] Substitution (Team_082): Julius Anthony OUT → Jordan Rozier IN (stamina_rule2)

[00:26] Substitution (Team_082): Dwyane O'Neal OUT → Kawhi Poole IN (stamina_rule2)

[00:26] Substitution (Team_082): Kristaps Fox OUT → Shaquille Griffin IN (stamina_rule2)

[00:26] Substitution (Team_082): Julius Carter OUT → D'Angelo Parker IN (stamina_rule2)

[00:26] Substitution (Team_015): Manu Anthony OUT → Dwyane Sabonis IN (stamina_rule2)

[00:26] Substitution (Team_015): Michael Simmons OUT → Paolo Jokic IN (stamina_rule2)

[00:26] Substitution (Team_015): CJ Banchero OUT → Magic Wagner IN (stamina_rule2)

[00:26] Substitution (Team_015): Scottie Gasol OUT → Rudy Paul IN (stamina_rule2)

[00:13] Team_015 possession (Score: 81-73)
Allen Curry attempts a Layup. Contested by D'Angelo Parker (5.4 feet, ZONE). Allen Curry misses. Offensive rebound by Allen Curry! Allen Curry puts it back in!
Score: 81-75

================================================================================
                              3RD QUARTER COMPLETE                              
================================================================================

3RD QUARTER SCORE: Team_082 29, Team_015 24

BOX SCORE:
================================================================================

Team_082
--------------------------------------------------------------------------------
Player                MIN  PTS  REB  AST  TO      FG   FG%      3P   3P%
--------------------------------------------------------------------------------
Dwyane O'Neal          25   13    2    0   0   6/7    85.7     0/0   0.0
Julius Anthony         25    7    0    2   0   3/5    60.0     0/0   0.0
Kristaps Fox           25    3    0    0   0   1/3    33.3     0/0   0.0
Tony Jokic             13    3    0    0   0   1/1   100.0     0/0   0.0
Jrue Green             23    2    7    1   0   1/2    50.0     0/0   0.0
Julius Carter          25    0    3    2   0   0/1     0.0     0/0   0.0

TEAM: FG: 12/19 (63.2%), 3PT: 2/7 (28.6%), REB: 12 (4 off, 8 def), AST: 5, TO: 2
TEAM FOULS: 1


Team_015
--------------------------------------------------------------------------------
Player                MIN  PTS  REB  AST  TO      FG   FG%      3P   3P%
--------------------------------------------------------------------------------
Michael Simmons        25    9    0    0   0   4/4   100.0     0/0   0.0
Manu Anthony           25    6    0    1   0   3/6    50.0     0/0   0.0
CJ Banchero            25    5    6    0   0   2/6    33.3     0/0   0.0
Scottie Gasol          25    2    0    2   0   1/1   100.0     0/0   0.0
Allen Curry            13    2    1    0   0   1/1   100.0     0/0   0.0
Trae Turner            23    0    4    2   0   0/1     0.0     0/0   0.0

TEAM: FG: 11/19 (57.9%), 3PT: 2/6 (33.3%), REB: 11 (4 off, 7 def), AST: 5, TO: 2
TEAM FOULS: 9 [Team_082 in BONUS]

================================================================================

================================================================================
                       4TH QUARTER - Team_082 vs Team_015                       
================================================================================

[12:00] Team_082 possession (Score: 81-75)
Kristaps Fox makes the Layup and draws the foul on CJ Banchero! And-1! Kristaps Fox to the line for 1. [Team fouls: 1] (CJ Banchero: 1 personal fouls)   FT 1/1: GOOD Kristaps Fox makes 1/1 from the line.
Score: 84-75

[11:44] Team_015 possession (Score: 84-75)
Michael Simmons attempts a 3Pt. Contested by Dwyane O'Neal (3.6 feet, ZONE). MICHAEL SIMMONS MAKES IT! Assist: CJ Banchero
Score: 84-78

[11:28] Team_082 possession (Score: 84-78)
Julius Carter drives and kicks out. Jrue Green attempts a Midrange. Contested by Scottie Gasol (3.8 feet, MAN). Jrue Green misses. Rebound secured by Trae Turner.

[11:11] Team_015 possession (Score: 84-78)
Trae Turner attempts a 3Pt. Wide open! Julius Carter is 6.2 feet away. [MAN] TRAE TURNER MAKES IT!
Score: 84-81

[10:57] Team_082 possession (Score: 84-81)
Julius Carter attempts a 3Pt. Contested by Trae Turner (4.0 feet, MAN). Julius Carter misses. Offensive rebound by Jrue Green! Jrue Green kicks it out.

[10:42] Team_082 possession (Score: 84-81)
Jrue Green attempts a 3Pt. Contested by Manu Anthony (4.3 feet, ZONE). Jrue Green misses. Offensive rebound by Jrue Green! Jrue Green kicks it out.

[10:29] Team_082 possession (Score: 84-81)
Julius Carter attempts a 3Pt. Contested by Manu Anthony (4.4 feet, ZONE). Julius Carter misses. Rebound secured by CJ Banchero.

[10:17] Team_015 possession (Score: 84-81)
CJ Banchero drives and kicks out. Scottie Gasol attempts a 3Pt. Contested by Julius Anthony (5.0 feet, ZONE). Scottie Gasol misses. Rebound secured by Dwyane O'Neal.

[10:01] Team_082 possession (Score: 84-81)
Julius Carter attempts a 3Pt. Contested by Manu Anthony (4.4 feet, ZONE). Julius Carter misses. Rebound secured by Michael Simmons.

[09:51] Team_015 possession (Score: 84-81)
CJ Banchero drives, Jrue Green stays with him. CJ Banchero attempts a Dunk. Contested by Jrue Green (5.0 feet, ZONE). CJ BANCHERO MAKES IT! Assist: Trae Turner
Score: 84-83

[09:36] Team_082 possession (Score: 84-83)
Jrue Green attempts a Layup. BLOCKED BY SCOTTIE GASOL! Ball is loose! Rebound secured by Trae Turner.

[09:20] Team_015 possession (Score: 84-83)
FOUL! Shooting foul on Jrue Green. Trae Turner to the line for 2 free throws. [Team fouls: 1] (Jrue Green: 1 personal fouls)   FT 1/2: MISS   FT 2/2: MISS Trae Turner makes 0/2 from the line. Rebound secured by Julius Carter.

[09:09] Team_082 possession (Score: 84-83)
FOUL! Shooting foul on Manu Anthony. Dwyane O'Neal to the line for 3 free throws. [Team fouls: 2] (Manu Anthony: 1 personal fouls)   FT 1/3: GOOD   FT 2/3: GOOD   FT 3/3: MISS Dwyane O'Neal makes 2/3 from the line. Rebound secured by CJ Banchero.
Score: 86-83

[08:53] Team_015 possession (Score: 86-83)
Manu Anthony makes the Layup and draws the foul on Julius Carter! And-1! Manu Anthony to the line for 1. [Team fouls: 2] (Julius Carter: 1 personal fouls)   FT 1/1: GOOD Manu Anthony makes 1/1 from the line.
Score: 86-86

[08:40] Team_082 possession (Score: 86-86)
FOUL! Reach-in foul on Trae Turner during the drive. [Team fouls: 3] No free throws, side out. (Trae Turner: 1 personal fouls)

[08:26] Team_082 possession (Score: 86-86)
FOUL! Reach-in foul on Trae Turner during the drive. [Team fouls: 4] No free throws, side out. (Trae Turner: 2 personal fouls)

[08:11] Team_082 possession (Score: 86-86)
Julius Anthony drives to the basket... Julius Anthony throws a bad pass! Stolen by Trae Turner! TURNOVER! (live ball)

[07:54] Team_015 possession (Score: 86-86)
Michael Simmons attempts a 3Pt. Contested by Dwyane O'Neal (4.1 feet, MAN). Michael Simmons misses. Rebound secured by Dwyane O'Neal.

[07:43] Team_082 possession (Score: 86-86)
Jrue Green attempts a Midrange. Contested by Michael Simmons (4.5 feet, ZONE). Jrue Green misses. Rebound secured by Trae Turner.

[07:30] Team_015 possession (Score: 86-86)
CJ Banchero loses control! Ball rolls out of bounds! TURNOVER! (dead ball)

[07:30] Substitution (Team_082): Julius Anthony OUT → Jordan Rozier IN (stamina_rule2)

[07:30] Substitution (Team_082): Dwyane O'Neal OUT → Kawhi Poole IN (stamina_rule2)

[07:30] Substitution (Team_082): Kristaps Fox OUT → Shaquille Griffin IN (stamina_rule2)

[07:30] Substitution (Team_082): Jrue Green OUT → Tony Jokic IN (stamina_rule2)

[07:30] Substitution (Team_082): Julius Carter OUT → D'Angelo Parker IN (stamina_rule2)

[07:30] Substitution (Team_015): Manu Anthony OUT → Dwyane Sabonis IN (stamina_rule2)

[07:30] Substitution (Team_015): Michael Simmons OUT → Paolo Jokic IN (stamina_rule2)

[07:30] Substitution (Team_015): CJ Banchero OUT → Magic Wagner IN (stamina_rule2)

[07:30] Substitution (Team_015): Scottie Gasol OUT → Rudy Paul IN (stamina_rule2)

[07:30] Substitution (Team_015): Trae Turner OUT → Allen Curry IN (stamina_rule2)

[07:17] Team_082 possession (Score: 86-86)
D'Angelo Parker attempts a Midrange. Contested by Rudy Paul (3.7 feet, MAN). D'Angelo Parker misses. Rebound secured by Rudy Paul.

[07:02] Team_015 possession (Score: 86-86)
Allen Curry attempts a 3Pt. Contested by Tony Jokic (5.5 feet, ZONE). ALLEN CURRY MAKES IT! Assist: Paolo Jokic
Score: 86-89

[06:50] Team_082 possession (Score: 86-89)
Kawhi Poole attempts a Midrange. Wide open! Paolo Jokic is 6.2 feet away. [MAN] KAWHI POOLE MAKES IT! Assist: D'Angelo Parker
Score: 88-89

[06:35] Team_015 possession (Score: 88-89)
Paolo Jokic attempts a Midrange. Contested by Kawhi Poole (6.0 feet, MAN). PAOLO JOKIC MAKES IT! Assist: Magic Wagner
Score: 88-91

[06:17] Team_082 possession (Score: 88-91)
D'Angelo Parker drives to the basket... D'Angelo Parker commits a violation (traveling/carry)! TURNOVER! (dead ball)

[06:06] Team_015 possession (Score: 88-91)
Allen Curry drives and kicks out. Allen Curry attempts a 3Pt. Contested by Kawhi Poole (5.4 feet, ZONE). Allen Curry misses. Rebound secured by Shaquille Griffin.

[05:55] Team_082 possession (Score: 88-91)
FOUL! Shooting foul on Rudy Paul. Kawhi Poole to the line for 3 free throws. [BONUS: 5 team fouls] (Rudy Paul: 1 personal fouls)   FT 1/3: MISS   FT 2/3: MISS   FT 3/3: MISS Kawhi Poole makes 0/3 from the line. Rebound secured by Rudy Paul.

[05:43] Team_015 possession (Score: 88-91)
Dwyane Sabonis drives and kicks out. Paolo Jokic attempts a 3Pt. Contested by Kawhi Poole (5.4 feet, MAN). Paolo Jokic misses. FOUL! Loose ball foul on D'Angelo Parker during the rebound battle. [Team fouls: 3] No free throws, side out. (D'Angelo Parker: 1 personal fouls)

[05:28] Team_015 possession (Score: 88-91)
Dwyane Sabonis drives, Jordan Rozier stays with him. Dwyane Sabonis attempts a Dunk. Wide open! Jordan Rozier is 6.2 feet away. [MAN] Dwyane Sabonis misses. Rebound secured by Tony Jokic.

[05:17] Team_082 possession (Score: 88-91)
FOUL! Holding foul on Paolo Jokic. [IN THE BONUS! 6 team fouls] Kawhi Poole to the line for 2 free throws. (Paolo Jokic: 1 personal fouls)   FT 1/2: GOOD   FT 2/2: MISS Kawhi Poole makes 1/2 from the line. Rebound secured by Rudy Paul.
Score: 89-91

[05:03] Team_015 possession (Score: 89-91)
Allen Curry attempts a Midrange. Contested by D'Angelo Parker (5.4 feet, MAN). ALLEN CURRY MAKES IT!
Score: 89-93

[04:48] Team_082 possession (Score: 89-93)
Jordan Rozier makes the Layup and draws the foul on Rudy Paul! And-1! Jordan Rozier to the line for 1. [BONUS: 7 team fouls] (Rudy Paul: 2 personal fouls)   FT 1/1: GOOD Jordan Rozier makes 1/1 from the line.
Score: 92-93

[04:32] Team_015 possession (Score: 92-93)
FOUL! Shooting foul on Shaquille Griffin. Allen Curry to the line for 2 free throws. [Team fouls: 4] (Shaquille Griffin: 1 personal fouls)   FT 1/2: GOOD   FT 2/2: GOOD Allen Curry makes 2/2 from the line.
Score: 92-95

[04:21] Team_082 possession (Score: 92-95)
Kawhi Poole attempts a 3Pt. Contested by Rudy Paul (3.8 feet, ZONE). Kawhi Poole misses. Rebound secured by Allen Curry.

[04:10] Team_015 possession (Score: 92-95)
Allen Curry drives to the basket... Allen Curry loses the ball! Stripped by D'Angelo Parker! TURNOVER! (live ball)

[03:59] Team_082 possession (Score: 92-95)
Tony Jokic drives, Rudy Paul stays with him. Tony Jokic attempts a Dunk. Contested by Rudy Paul (3.0 feet, MAN). TONY JOKIC MAKES IT!
Score: 94-95

[03:45] Team_015 possession (Score: 94-95)
Allen Curry attempts a 3Pt. Contested by D'Angelo Parker (5.4 feet, MAN). Allen Curry misses. Rebound secured by Shaquille Griffin.

[03:31] Team_082 possession (Score: 94-95)
FOUL! Shooting foul on Rudy Paul. D'Angelo Parker to the line for 2 free throws. [BONUS: 8 team fouls] (Rudy Paul: 3 personal fouls)   FT 1/2: GOOD   FT 2/2: GOOD D'Angelo Parker makes 2/2 from the line.
Score: 96-95

[03:21] Team_015 possession (Score: 96-95)
Allen Curry attempts a 3Pt. Contested by Shaquille Griffin (5.0 feet, ZONE). Allen Curry misses. Rebound secured by D'Angelo Parker.

[03:05] Team_082 possession (Score: 96-95)
D'Angelo Parker drives, picks up Rudy Paul. Help arrives from Dwyane Sabonis! D'Angelo Parker attempts a Layup. Contested by Dwyane Sabonis (3.7 feet, MAN). D'Angelo Parker misses. Rebound secured by Magic Wagner.

[02:48] Team_015 possession (Score: 96-95)
FOUL! Reach-in foul on D'Angelo Parker during the drive. [IN THE BONUS! 5 team fouls] Allen Curry to the line for 2 free throws. (D'Angelo Parker: 2 personal fouls)   FT 1/2: GOOD   FT 2/2: MISS Allen Curry makes 1/2 from the line. Rebound secured by D'Angelo Parker.
Score: 96-96

[02:32] Team_082 possession (Score: 96-96)
D'Angelo Parker drives, picks up Rudy Paul. Help arrives from Dwyane Sabonis! D'Angelo Parker attempts a Layup. Contested by Dwyane Sabonis (3.7 feet, ZONE). D'ANGELO PARKER MAKES IT! Assist: Shaquille Griffin
Score: 98-96

[02:23] Team_015 possession (Score: 98-96)
Magic Wagner attempts a 3Pt. Contested by Shaquille Griffin (4.6 feet, MAN). Magic Wagner misses. Rebound secured by Shaquille Griffin.

[02:08] Team_082 possession (Score: 98-96)
Jordan Rozier attempts a 3Pt. Contested by Magic Wagner (5.5 feet, ZONE). Jordan Rozier misses. Rebound secured by Magic Wagner.

[01:51] Team_015 possession (Score: 98-96)
Rudy Paul drives, picks up Tony Jokic. Help arrives from Kawhi Poole! Rudy Paul attempts a Layup. Contested by Kawhi Poole (5.6 feet, MAN). RUDY PAUL MAKES IT! Assist: Magic Wagner
Score: 98-98

[01:35] Team_082 possession (Score: 98-98)
D'Angelo Parker attempts a Midrange. Contested by Rudy Paul (3.7 feet, MAN). D'Angelo Parker misses. Offensive rebound by Tony Jokic! Tony Jokic kicks it out.

[01:19] Team_082 possession (Score: 98-98)
D'Angelo Parker attempts a Layup. Contested by Rudy Paul (3.7 feet, MAN). D'ANGELO PARKER MAKES IT! Assist: Tony Jokic
Score: 100-98

[01:05] Team_015 possession (Score: 100-98)
Magic Wagner attempts a Midrange. Contested by Tony Jokic (5.2 feet, ZONE). MAGIC WAGNER MAKES IT!
Score: 100-100

[00:52] Team_082 possession (Score: 100-100)
Jordan Rozier drives, Rudy Paul stays with him. Jordan Rozier attempts a Layup. Contested by Rudy Paul (3.4 feet, ZONE). Jordan Rozier misses. Rebound secured by Allen Curry.

[00:37] Team_015 possession (Score: 100-100)
Magic Wagner attempts a 3Pt. Contested by Shaquille Griffin (4.7 feet, MAN). Magic Wagner misses. Rebound secured by Shaquille Griffin.

[00:24] Team_082 possession (Score: 100-100)
Shaquille Griffin attempts a 3Pt. Contested by Rudy Paul (3.3 feet, ZONE). Shaquille Griffin misses. Rebound secured by Rudy Paul.

[00:09] Team_015 possession (Score: 100-100)
Dwyane Sabonis loses the ball! Stripped by Jordan Rozier! TURNOVER! (live ball)

================================================================================
                              4TH QUARTER COMPLETE                              
================================================================================

4TH QUARTER SCORE: Team_082 19, Team_015 25

BOX SCORE:
================================================================================

Team_082
--------------------------------------------------------------------------------
Player                MIN  PTS  REB  AST  TO      FG   FG%      3P   3P%
--------------------------------------------------------------------------------
D'Angelo Parker        18    6    2    1   0   3/5    60.0     0/0   0.0
Kristaps Fox           30    3    0    0   0   1/1   100.0     0/0   0.0
Jordan Rozier          18    3    0    0   0   1/3    33.3     0/0   0.0
Kawhi Poole            18    2    0    0   0   1/3    33.3     0/0   0.0
Tony Jokic             21    2    2    1   0   1/1   100.0     0/0   0.0
Julius Carter          30    0    1    0   0   0/3     0.0     0/0   0.0
Jrue Green             28    0    2    0   0   0/2     0.0     0/0   0.0
Dwyane O'Neal          30    0    2    0   0   0/1     0.0     0/0   0.0
Shaquille Griffin      18    0    4    1   0   0/1     0.0     0/0   0.0

TEAM: FG: 7/21 (33.3%), 3PT: 0/7 (0.0%), REB: 13 (3 off, 10 def), AST: 3, TO: 2
TEAM FOULS: 5 [Team_015 in BONUS]


Team_015
--------------------------------------------------------------------------------
Player                MIN  PTS  REB  AST  TO      FG   FG%      3P   3P%
--------------------------------------------------------------------------------
Allen Curry            21    7    3    0   0   3/7    42.9     0/0   0.0
Michael Simmons        30    3    1    0   0   1/2    50.0     0/0   0.0
Trae Turner            28    3    3    1   0   1/2    50.0     0/0   0.0
Manu Anthony           30    3    0    0   0   1/1   100.0     0/0   0.0
CJ Banchero            30    2    2    1   0   1/2    50.0     0/0   0.0
Rudy Paul              18    2    4    0   0   1/1   100.0     0/0   0.0
Paolo Jokic            18    2    0    1   0   1/1   100.0     0/0   0.0
Magic Wagner           18    2    2    2   0   1/3    33.3     0/0   0.0
Dwyane Sabonis         18    0    0    0   0   0/1     0.0     0/0   0.0

TEAM: FG: 10/20 (50.0%), 3PT: 3/8 (37.5%), REB: 15 (1 off, 14 def), AST: 5, TO: 3
TEAM FOULS: 8 [Team_082 in BONUS]

================================================================================

================================================================================
                               FULL GAME COMPLETE                               
================================================================================

FINAL SCORE: Team_082 100, Team_015 100

SCORING BY QUARTER:
--------------------------------------------------------------------------------
Team                     Q1     Q2     Q3     Q4    FINAL
--------------------------------------------------------------------------------
Team_082                 38     14     29     19      100
Team_015                 25     26     24     25      100
--------------------------------------------------------------------------------

FULL GAME BOX SCORE:
================================================================================

Team_082
--------------------------------------------------------------------------------
Player                MIN  PTS  REB  AST  TO      FG   FG%      3P   3P%      FT STL BLK
--------------------------------------------------------------------------------
Julius Anthony         30   15    0    2   1   6/11   54.5   2/6    33.3   3/3     0   0
Dwyane O'Neal          30   23    9    2   2  10/12   83.3   2/4    50.0   7/8     1   0
Kristaps Fox           30   17    0    2   3   5/8    62.5   3/5    60.0   9/10    0   0
Julius Carter          30    0    6    4   0   1/7    14.3   0/2     0.0   2/3     1   0
Jrue Green             28    6   14    1   0   3/8    37.5   0/1     0.0   1/2     0   0
Tony Jokic             21    8    3    1   1   3/6    50.0   0/1     0.0   4/5     0   1
Jordan Rozier          18    6    0    2   1   2/6    33.3   0/2     0.0   2/2     1   0
Kawhi Poole            18    4    0    0   1   2/5    40.0   0/2     0.0   1/5     0   0
Shaquille Griffin      18    8    6    1   1   4/8    50.0   2/3    66.7   1/1     0   0
D'Angelo Parker        18    6    5    1   0   3/6    50.0   0/0     0.0   2/2     2   1

TEAM: FG: 39/78 (50.0%), 3PT: 9/26 (34.6%), REB: 42 (14 off, 28 def), AST: 16, TO: 10


Team_015
--------------------------------------------------------------------------------
Player                MIN  PTS  REB  AST  TO      FG   FG%      3P   3P%      FT STL BLK
--------------------------------------------------------------------------------
Manu Anthony           30   16    0    2   0   7/14   50.0   1/3    33.3   4/6     1   0
Michael Simmons        30   14    5    1   2   5/7    71.4   2/3    66.7   0/0     0   0
CJ Banchero            30   14   12    1   2   5/12   41.7   1/6    16.7   1/1     0   0
Scottie Gasol          30    6    0    3   2   4/5    80.0   0/0     0.0   0/0     0   1
Trae Turner            28    5    8    3   2   3/6    50.0   1/2    50.0   2/5     1   0
Allen Curry            21   22   10    1   1   8/15   53.3   2/4    50.0   5/7     0   0
Dwyane Sabonis         18    4    0    0   2   4/6    66.7   1/1   100.0   0/0     1   0
Paolo Jokic            18    4    0    2   2   3/4    75.0   1/1   100.0   0/1     1   0
Magic Wagner           18    2    6    3   0   1/3    33.3   0/2     0.0   0/0     0   1
Rudy Paul              18    7    8    0   0   2/2   100.0   0/0     0.0   1/1     0   1

TEAM: FG: 42/74 (56.8%), 3PT: 9/22 (40.9%), REB: 50 (12 off, 38 def), AST: 16, TO: 13

================================================================================
