================================================================================
                        FULL GAME - Team_090 vs Team_035                        
================================================================================

================================================================================
                       1ST QUARTER - Team_090 vs Team_035                       
================================================================================

[12:00] Team_090 possession (Score: 0-0)
Gary Brogdon attempts a Layup. Contested by Dwyane Johnson (4.1 feet, MAN). GARY BROGDON MAKES IT! Assist: Derrick Mitchell
Score: 2-0

[11:44] Team_035 possession (Score: 2-0)
Gary Johnson attempts a 3Pt. Contested by Zach Wall (5.5 feet, MAN). Gary Johnson misses. Rebound secured by Tracy Adebayo.

[11:31] Team_090 possession (Score: 2-0)
Zach Wall attempts a 3Pt. Contested by Shaquille Ginobili (4.2 feet, ZONE). Zach Wall misses. Rebound secured by Magic Westbrook.

[11:13] Team_035 possession (Score: 2-0)
Domantas Green attempts a 3Pt. Contested by Derrick Mitchell (3.6 feet, ZONE). Domantas Green misses. Rebound secured by Tracy Adebayo.

[11:00] Team_090 possession (Score: 2-0)
FOUL! Reach-in foul on Shaquille Ginobili during the drive. [Team fouls: 1] No free throws, side out. (Shaquille Ginobili: 1 personal fouls)

[10:45] Team_090 possession (Score: 2-0)
FOUL! Holding foul on Gary Johnson. [Team fouls: 2] No free throws, side out. (Gary Johnson: 1 personal fouls)

[10:33] Team_090 possession (Score: 2-0)
Gary Brogdon attempts a Midrange. Contested by Dwyane Johnson (4.1 feet, MAN). Gary Brogdon misses. Rebound secured by Dwyane Johnson.

[10:18] Team_035 possession (Score: 2-0)
Domantas Green loses the ball! Stripped by Derrick Mitchell! TURNOVER! (live ball)

[10:02] Team_090 possession (Score: 2-0)
Derrick Mitchell drives, Dwyane Johnson stays with him. Derrick Mitchell attempts a Layup. Contested by Dwyane Johnson (4.2 feet, ZONE). Derrick Mitchell misses. Offensive rebound by Tracy Adebayo! Tracy Adebayo kicks it out.

[09:52] Team_090 possession (Score: 2-0)
Larry Bridges attempts a 3Pt. Contested by Shaquille Ginobili (4.0 feet, ZONE). Larry Bridges misses. Rebound secured by Magic Westbrook.

[09:35] Team_035 possession (Score: 2-0)
Gary Johnson makes the Layup and draws the foul on Larry Bridges! And-1! Gary Johnson to the line for 1. [Team fouls: 1] (Larry Bridges: 1 personal fouls)   FT 1/1: MISS Gary Johnson makes 0/1 from the line. Rebound secured by Tracy Adebayo.
Score: 2-2

[09:23] Team_090 possession (Score: 2-2)
Tracy Adebayo attempts a Midrange. BLOCKED BY MAGIC WESTBROOK! Ball is loose! Rebound secured by Gary Johnson.

[09:10] Team_035 possession (Score: 2-2)
Gary Johnson attempts a 3Pt. Contested by Zach Wall (5.5 feet, MAN). GARY JOHNSON MAKES IT! Assist: Domantas Green
Score: 2-5

[09:00] Team_090 possession (Score: 2-5)
FOUL! Shooting foul on Magic Westbrook. Tracy Adebayo to the line for 2 free throws. [Team fouls: 3] (Magic Westbrook: 1 personal fouls)   FT 1/2: GOOD   FT 2/2: GOOD Tracy Adebayo makes 2/2 from the line.
Score: 4-5

[08:46] Team_035 possession (Score: 4-5)
Dwyane Johnson drives to the basket... FOUL! Offensive foul on Dwyane Johnson! Gary Brogdon drew the charge! [Team fouls: 4] (Dwyane Johnson: 1 personal fouls) TURNOVER! (dead ball)

[08:28] Team_090 possession (Score: 4-5)
Tracy Adebayo attempts a 3Pt. Contested by Shaquille Ginobili (3.8 feet, ZONE). TRACY ADEBAYO MAKES IT!
Score: 7-5

[08:11] Team_035 possession (Score: 7-5)
Dwyane Johnson drives, picks up Gary Brogdon. Help arrives from Larry Bridges! Dwyane Johnson attempts a Layup. Contested by Larry Bridges (3.5 feet, ZONE). DWYANE JOHNSON MAKES IT! Assist: Gary Johnson
Score: 7-7

[07:59] Team_090 possession (Score: 7-7)
Tracy Adebayo attempts a Layup. Contested by Dwyane Johnson (3.7 feet, ZONE). TRACY ADEBAYO MAKES IT!
Score: 9-7

[07:45] Team_035 possession (Score: 9-7)
Gary Johnson attempts a 3Pt. Contested by Zach Wall (5.5 feet, ZONE). Gary Johnson misses. Rebound secured by Gary Brogdon.

[07:29] Team_090 possession (Score: 9-7)
Zach Wall attempts a Layup. Contested by Gary Johnson (4.1 feet, MAN). ZACH WALL MAKES IT!
Score: 11-7

[07:12] Team_035 possession (Score: 11-7)
Domantas Green makes the 3Pt and draws the foul on Derrick Mitchell! And-1! Domantas Green to the line for 1. [Team fouls: 2] (Derrick Mitchell: 1 personal fouls)   FT 1/1: GOOD Domantas Green makes 1/1 from the line.
Score: 11-11

[06:57] Team_090 possession (Score: 11-11)
Larry Bridges makes the Layup and draws the foul on Domantas Green! And-1! Larry Bridges to the line for 1. [BONUS: 5 team fouls] (Domantas Green: 1 personal fouls)   FT 1/1: MISS Larry Bridges makes 0/1 from the line. Rebound secured by Gary Johnson.
Score: 13-11

[06:42] Team_035 possession (Score: 13-11)
Domantas Green loses the ball! Stripped by Derrick Mitchell! TURNOVER! (live ball)

[06:27] Team_090 possession (Score: 13-11)
Larry Bridges attempts a 3Pt. Contested by Shaquille Ginobili (4.0 feet, ZONE). Larry Bridges misses. Rebound secured by Gary Johnson.

[06:16] Team_035 possession (Score: 13-11)
Gary Johnson attempts a Midrange. Contested by Zach Wall (5.5 feet, MAN). Gary Johnson misses. Offensive rebound by Dwyane Johnson! Dwyane Johnson puts it back in!
Score: 13-13

[05:59] Team_090 possession (Score: 13-13)
FOUL! Shooting foul on Gary Johnson. Zach Wall to the line for 3 free throws. [BONUS: 6 team fouls] (Gary Johnson: 2 personal fouls)   FT 1/3: GOOD   FT 2/3: GOOD   FT 3/3: GOOD Zach Wall makes 3/3 from the line.
Score: 16-13

[05:42] Team_035 possession (Score: 16-13)
Gary Johnson drives, Zach Wall stays with him. Gary Johnson attempts a Layup. Contested by Zach Wall (5.5 feet, MAN). Gary Johnson misses. Rebound secured by Gary Brogdon.

[05:29] Team_090 possession (Score: 16-13)
Larry Bridges attempts a 3Pt. Contested by Shaquille Ginobili (4.0 feet, MAN). Larry Bridges misses. FOUL! Loose ball foul on Gary Johnson during the rebound battle. [IN THE BONUS! 7 team fouls] Tracy Adebayo to the line for 2 free throws. (Gary Johnson: 3 personal fouls)   FT 1/2: GOOD   FT 2/2: GOOD Tracy Adebayo makes 2/2 from the line.
Score: 18-13

[05:13] Team_035 possession (Score: 18-13)
FOUL! Shooting foul on Derrick Mitchell. Dwyane Johnson to the line for 2 free throws. [Team fouls: 3] (Derrick Mitchell: 2 personal fouls)   FT 1/2: GOOD   FT 2/2: GOOD Dwyane Johnson makes 2/2 from the line.
Score: 18-15

[04:57] Team_090 possession (Score: 18-15)
Gary Brogdon attempts a Midrange. Contested by Shaquille Ginobili (4.1 feet, ZONE). Gary Brogdon misses. Rebound secured by Magic Westbrook.

[04:47] Team_035 possession (Score: 18-15)
Dwyane Johnson attempts a 3Pt. Contested by Gary Brogdon (3.6 feet, MAN). Dwyane Johnson misses. Rebound secured by Zach Wall.

[04:30] Team_090 possession (Score: 18-15)
Gary Brogdon drives and kicks out. Zach Wall attempts a Midrange. Contested by Gary Johnson (3.8 feet, MAN). ZACH WALL MAKES IT!
Score: 20-15

[04:14] Team_035 possession (Score: 20-15)
Gary Johnson attempts a Midrange. Contested by Zach Wall (5.5 feet, ZONE). Gary Johnson misses. Offensive rebound by Magic Westbrook! Magic Westbrook kicks it out.

[03:59] Team_035 possession (Score: 20-15)
Shaquille Ginobili drives and kicks out. Gary Johnson attempts a Midrange. Contested by Zach Wall (5.0 feet, MAN). GARY JOHNSON MAKES IT!
Score: 20-17

[03:50] Team_090 possession (Score: 20-17)
Zach Wall drives, Gary Johnson stays with him. Zach Wall attempts a Layup. Contested by Gary Johnson (4.1 feet, MAN). ZACH WALL MAKES IT!
Score: 22-17

[03:37] Team_035 possession (Score: 22-17)
Dwyane Johnson attempts a 3Pt. Contested by Derrick Mitchell (3.2 feet, ZONE). Dwyane Johnson misses. Rebound secured by Tracy Adebayo.

[03:24] Team_090 possession (Score: 22-17)
Zach Wall drives, Gary Johnson stays with him. Zach Wall attempts a Dunk. Contested by Gary Johnson (4.2 feet, MAN). ZACH WALL MAKES IT!
Score: 24-17

[03:12] Team_035 possession (Score: 24-17)
Magic Westbrook makes the Layup and draws the foul on Gary Brogdon! And-1! Magic Westbrook to the line for 1. [Team fouls: 4] (Gary Brogdon: 1 personal fouls)   FT 1/1: MISS Magic Westbrook makes 0/1 from the line. Rebound secured by Tracy Adebayo.
Score: 24-19

[02:56] Team_090 possession (Score: 24-19)
FOUL! Shooting foul on Gary Johnson. Zach Wall to the line for 2 free throws. [BONUS: 8 team fouls] (Gary Johnson: 4 personal fouls)   FT 1/2: GOOD   FT 2/2: GOOD Zach Wall makes 2/2 from the line.
Score: 26-19

[02:43] Team_035 possession (Score: 26-19)
Gary Johnson drives to the basket... Gary Johnson loses the ball! Stripped by Zach Wall! TURNOVER! (live ball)

[02:29] Team_090 possession (Score: 26-19)
FOUL! Reach-in foul on Magic Westbrook during the drive. [IN THE BONUS! 9 team fouls] Tracy Adebayo to the line for 2 free throws. (Magic Westbrook: 2 personal fouls)   FT 1/2: GOOD   FT 2/2: MISS Tracy Adebayo makes 1/2 from the line. Rebound secured by Magic Westbrook.
Score: 27-19

[02:16] Team_035 possession (Score: 27-19)
FOUL! Shooting foul on Zach Wall. Gary Johnson to the line for 2 free throws. [BONUS: 5 team fouls] (Zach Wall: 1 personal fouls)   FT 1/2: GOOD   FT 2/2: GOOD Gary Johnson makes 2/2 from the line.
Score: 27-21

[02:03] Team_090 possession (Score: 27-21)
Zach Wall attempts a 3Pt. Contested by Gary Johnson (4.3 feet, MAN). ZACH WALL MAKES IT! Assist: Larry Bridges
Score: 30-21

[01:48] Team_035 possession (Score: 30-21)
Magic Westbrook makes the Layup and draws the foul on Gary Brogdon! And-1! Magic Westbrook to the line for 1. [BONUS: 6 team fouls] (Gary Brogdon: 2 personal fouls)   FT 1/1: MISS Magic Westbrook makes 0/1 from the line. Offensive rebound by Magic Westbrook! Magic Westbrook kicks it out.
Score: 30-23

[01:34] Team_035 possession (Score: 30-23)
Dwyane Johnson attempts a 3Pt. Contested by Derrick Mitchell (3.4 feet, ZONE). Dwyane Johnson misses. Rebound secured by Tracy Adebayo.

[01:17] Team_090 possession (Score: 30-23)
Derrick Mitchell attempts a Midrange. Contested by Shaquille Ginobili (4.6 feet, ZONE). DERRICK MITCHELL MAKES IT!
Score: 32-23

[00:58] Team_035 possession (Score: 32-23)
Magic Westbrook drives, Tracy Adebayo stays with him. Magic Westbrook attempts a Dunk. Contested by Tracy Adebayo (5.6 feet, MAN). MAGIC WESTBROOK MAKES IT!
Score: 32-25

[00:43] Team_090 possession (Score: 32-25)
Tracy Adebayo makes the Dunk and draws the foul on Magic Westbrook! And-1! Tracy Adebayo to the line for 1. [BONUS: 10 team fouls] (Magic Westbrook: 3 personal fouls)   FT 1/1: GOOD Tracy Adebayo makes 1/1 from the line.
Score: 35-25

[00:27] Team_035 possession (Score: 35-25)
Gary Johnson attempts a Midrange. Contested by Zach Wall (5.7 feet, MAN). GARY JOHNSON MAKES IT! Assist: Shaquille Ginobili
Score: 35-27

[00:15] Team_090 possession (Score: 35-27)
Derrick Mitchell attempts a 3Pt. Contested by Shaquille Ginobili (4.7 feet, ZONE). Derrick Mitchell misses. Rebound secured by Magic Westbrook.

================================================================================
                              1ST QUARTER COMPLETE                              
================================================================================

1ST QUARTER SCORE: Team_090 35, Team_035 27

BOX SCORE:
================================================================================

Team_090
--------------------------------------------------------------------------------
Player                MIN  PTS  REB  AST  TO      FG   FG%      3P   3P%
--------------------------------------------------------------------------------
Zach Wall              12   16    1    0   0   7/8    87.5     0/0   0.0
Tracy Adebayo          12   12    7    0   0   5/7    71.4     0/0   0.0
Gary Brogdon           12    2    2    0   0   1/3    33.3     0/0   0.0
Derrick Mitchell       12    2    0    1   0   1/2    50.0     0/0   0.0
Larry Bridges          12    0    0    1   0   0/3     0.0     0/0   0.0

TEAM: FG: 14/23 (60.9%), 3PT: 4/8 (50.0%), REB: 10 (1 off, 9 def), AST: 2, TO: 0
TEAM FOULS: 6 [Team_035 in BONUS]


Team_035
--------------------------------------------------------------------------------
Player                MIN  PTS  REB  AST  TO      FG   FG%      3P   3P%
--------------------------------------------------------------------------------
Gary Johnson           12    9    3    1   0   4/8    50.0     0/0   0.0
Dwyane Johnson         12    6    2    0   0   3/6    50.0     0/0   0.0
Domantas Green         12    4    0    1   0   1/2    50.0     0/0   0.0
Magic Westbrook        12    2    7    0   0   1/2    50.0     0/0   0.0
Shaquille Ginobili     12    0    0    1   0   0/0     0.0     0/0   0.0

TEAM: FG: 9/18 (50.0%), 3PT: 2/8 (25.0%), REB: 12 (3 off, 9 def), AST: 3, TO: 4
TEAM FOULS: 10 [Team_090 in BONUS]

================================================================================

================================================================================
                       2ND QUARTER - Team_090 vs Team_035                       
================================================================================

[12:00] Team_090 possession (Score: 35-27)
Gary Brogdon drives, Magic Westbrook stays with him. Gary Brogdon attempts a Layup. Contested by Magic Westbrook (4.8 feet, ZONE). GARY BROGDON MAKES IT! Assist: Larry Bridges
Score: 37-27

[11:49] Team_035 possession (Score: 37-27)
Gary Johnson loses the ball! Stripped by Zach Wall! TURNOVER! (live ball)

[11:36] Team_090 possession (Score: 37-27)
Derrick Mitchell drives to the basket... Derrick Mitchell throws a bad pass out of bounds! TURNOVER! (dead ball)

[11:36] Substitution (Team_090): Larry Bridges OUT → Josh Wall IN (stamina_rule2)

[11:36] Substitution (Team_090): Zach Wall OUT → Russell Smith IN (stamina_rule2)

[11:36] Substitution (Team_090): Gary Brogdon OUT → Derrick Nowitzki IN (stamina_rule2)

[11:36] Substitution (Team_090): Tracy Adebayo OUT → Tobias Tatum IN (stamina_rule2)

[11:36] Substitution (Team_035): Domantas Green OUT → CJ LaVine IN (stamina_rule2)

[11:36] Substitution (Team_035): Shaquille Ginobili OUT → Cole George IN (stamina_rule2)

[11:36] Substitution (Team_035): Gary Johnson OUT → Malcolm Turner IN (stamina_rule2)

[11:36] Substitution (Team_035): Dwyane Johnson OUT → Tobias Jordan IN (stamina_rule2)

[11:36] Substitution (Team_035): Magic Westbrook OUT → John Durant IN (stamina_rule2)

[11:20] Team_035 possession (Score: 37-27)
Tobias Jordan attempts a Midrange. Contested by Derrick Nowitzki (4.1 feet, MAN). TOBIAS JORDAN MAKES IT!
Score: 37-29

[11:04] Team_090 possession (Score: 37-29)
Derrick Mitchell makes the Dunk and draws the foul on CJ LaVine! And-1! Derrick Mitchell to the line for 1. [Team fouls: 1] (CJ LaVine: 1 personal fouls)   FT 1/1: GOOD Derrick Mitchell makes 1/1 from the line.
Score: 40-29

[10:50] Team_035 possession (Score: 40-29)
Malcolm Turner attempts a 3Pt. Contested by Russell Smith (4.9 feet, MAN). Malcolm Turner misses. Rebound secured by Derrick Nowitzki.

[10:36] Team_090 possession (Score: 40-29)
Josh Wall drives, Cole George stays with him. Josh Wall attempts a Dunk. Contested by Cole George (3.9 feet, MAN). Josh Wall misses. Offensive rebound by Tobias Tatum! Tobias Tatum kicks it out.

[10:24] Team_090 possession (Score: 40-29)
FOUL! Shooting foul on Tobias Jordan. Derrick Nowitzki to the line for 2 free throws. [Team fouls: 2] (Tobias Jordan: 1 personal fouls)   FT 1/2: GOOD   FT 2/2: MISS Derrick Nowitzki makes 1/2 from the line. Rebound secured by Tobias Jordan.
Score: 41-29

[10:06] Team_035 possession (Score: 41-29)
John Durant attempts a Midrange. Contested by Tobias Tatum (4.6 feet, MAN). JOHN DURANT MAKES IT! Assist: Malcolm Turner
Score: 41-31

[09:52] Team_090 possession (Score: 41-31)
Derrick Nowitzki drives to the basket... Derrick Nowitzki commits a violation (traveling/carry)! TURNOVER! (dead ball)

[09:52] Substitution (Team_090): Derrick Mitchell OUT → OG Anunoby IN (stamina_rule2)

[09:41] Team_035 possession (Score: 41-31)
Tobias Jordan attempts a Midrange. Contested by Derrick Nowitzki (4.1 feet, ZONE). TOBIAS JORDAN MAKES IT! Assist: Cole George
Score: 41-33

[09:26] Team_090 possession (Score: 41-33)
OG Anunoby attempts a Layup. Contested by John Durant (4.4 feet, ZONE). OG ANUNOBY MAKES IT!
Score: 43-33

[09:10] Team_035 possession (Score: 43-33)
John Durant attempts a Midrange. Contested by Tobias Tatum (4.6 feet, MAN). JOHN DURANT MAKES IT!
Score: 43-35

[08:55] Team_090 possession (Score: 43-35)
OG Anunoby attempts a 3Pt. Contested by CJ LaVine (4.3 feet, ZONE). OG Anunoby misses. Rebound secured by John Durant.

[08:44] Team_035 possession (Score: 43-35)
Tobias Jordan drives and kicks out. Tobias Jordan attempts a 3Pt. Contested by Derrick Nowitzki (4.3 feet, MAN). Tobias Jordan misses. Rebound secured by Derrick Nowitzki.

[08:31] Team_090 possession (Score: 43-35)
Josh Wall drives, Cole George stays with him. Josh Wall attempts a Dunk. Contested by Cole George (3.9 feet, MAN). JOSH WALL MAKES IT! Assist: Tobias Tatum
Score: 45-35

[08:20] Team_035 possession (Score: 45-35)
Tobias Jordan drives, picks up Derrick Nowitzki. Help arrives from Josh Wall! Tobias Jordan attempts a Dunk. Contested by Josh Wall (4.1 feet, MAN). TOBIAS JORDAN MAKES IT!
Score: 45-37

[08:10] Team_090 possession (Score: 45-37)
OG Anunoby attempts a Layup. Contested by John Durant (4.4 feet, ZONE). OG ANUNOBY MAKES IT! Assist: Tobias Tatum
Score: 47-37

[07:57] Team_035 possession (Score: 47-37)
CJ LaVine makes the 3Pt and draws the foul on OG Anunoby! And-1! CJ LaVine to the line for 1. [Team fouls: 1] (OG Anunoby: 1 personal fouls)   FT 1/1: GOOD CJ LaVine makes 1/1 from the line.
Score: 47-41

[07:45] Team_090 possession (Score: 47-41)
Derrick Nowitzki attempts a Midrange. Contested by Malcolm Turner (4.4 feet, ZONE). DERRICK NOWITZKI MAKES IT!
Score: 49-41

[07:34] Team_035 possession (Score: 49-41)
Malcolm Turner attempts a 3Pt. Contested by Russell Smith (4.9 feet, ZONE). Malcolm Turner misses. Rebound secured by Derrick Nowitzki.

[07:19] Team_090 possession (Score: 49-41)
OG Anunoby drives, picks up CJ LaVine. Help arrives from Cole George! OG Anunoby attempts a Dunk. Contested by Cole George (4.3 feet, MAN). OG Anunoby misses. Rebound secured by John Durant.

[07:05] Team_035 possession (Score: 49-41)
John Durant attempts a Midrange. Contested by Tobias Tatum (4.6 feet, MAN). John Durant misses. Rebound secured by Tobias Tatum.

[06:46] Team_090 possession (Score: 49-41)
FOUL! Shooting foul on John Durant. Tobias Tatum to the line for 2 free throws. [Team fouls: 3] (John Durant: 1 personal fouls)   FT 1/2: GOOD   FT 2/2: GOOD Tobias Tatum makes 2/2 from the line.
Score: 51-41

[06:30] Team_035 possession (Score: 51-41)
John Durant attempts a 3Pt. Contested by Tobias Tatum (4.6 feet, MAN). John Durant misses. Offensive rebound by John Durant! John Durant kicks it out.

[06:17] Team_035 possession (Score: 51-41)
Tobias Jordan attempts a 3Pt. Contested by OG Anunoby (4.8 feet, ZONE). Tobias Jordan misses. Offensive rebound by John Durant! John Durant kicks it out.

[06:06] Team_035 possession (Score: 51-41)
Cole George attempts a 3Pt. Contested by OG Anunoby (5.4 feet, ZONE). Cole George misses. Rebound secured by Tobias Tatum.

[05:50] Team_090 possession (Score: 51-41)
Russell Smith makes the Dunk and draws the foul on John Durant! And-1! Russell Smith to the line for 1. [Team fouls: 4] (John Durant: 2 personal fouls)   FT 1/1: GOOD Russell Smith makes 1/1 from the line.
Score: 54-41

[05:33] Team_035 possession (Score: 54-41)
FOUL! Shooting foul on Derrick Nowitzki. CJ LaVine to the line for 2 free throws. [Team fouls: 2] (Derrick Nowitzki: 1 personal fouls)   FT 1/2: MISS   FT 2/2: GOOD CJ LaVine makes 1/2 from the line.
Score: 54-42

[05:14] Team_090 possession (Score: 54-42)
Russell Smith drives and kicks out. Tobias Tatum attempts a 3Pt. Contested by CJ LaVine (4.2 feet, ZONE). Tobias Tatum misses. Rebound secured by Tobias Jordan.

[04:57] Team_035 possession (Score: 54-42)
Malcolm Turner attempts a 3Pt. Contested by Russell Smith (4.9 feet, ZONE). Malcolm Turner misses. Rebound secured by Russell Smith.

[04:48] Team_090 possession (Score: 54-42)
Russell Smith drives, John Durant stays with him. Russell Smith attempts a Layup. Contested by John Durant (4.6 feet, ZONE). RUSSELL SMITH MAKES IT! Assist: Tobias Tatum
Score: 56-42

[04:30] Team_035 possession (Score: 56-42)
John Durant attempts a Layup. Contested by Tobias Tatum (4.6 feet, MAN). John Durant misses. Rebound secured by Tobias Tatum.

[04:15] Team_090 possession (Score: 56-42)
Tobias Tatum attempts a 3Pt. Contested by CJ LaVine (5.0 feet, ZONE). Tobias Tatum misses. Rebound secured by Tobias Jordan.

[04:02] Team_035 possession (Score: 56-42)
Tobias Jordan attempts a Midrange. Contested by Russell Smith (4.2 feet, ZONE). TOBIAS JORDAN MAKES IT!
Score: 56-44

[03:43] Team_090 possession (Score: 56-44)
Derrick Nowitzki attempts a 3Pt. Contested by Tobias Jordan (4.1 feet, MAN). DERRICK NOWITZKI MAKES IT! Assist: Russell Smith
Score: 59-44

[03:30] Team_035 possession (Score: 59-44)
Tobias Jordan attempts a Midrange. Contested by Derrick Nowitzki (4.2 feet, MAN). TOBIAS JORDAN MAKES IT! Assist: John Durant
Score: 59-46

[03:14] Team_090 possession (Score: 59-46)
Russell Smith drives and kicks out. Russell Smith attempts a Midrange. Contested by Tobias Jordan (4.5 feet, ZONE). Russell Smith misses. Rebound secured by Tobias Jordan.

[02:59] Team_035 possession (Score: 59-46)
FOUL! Offensive foul on CJ LaVine! OG Anunoby drew the charge! [Team fouls: 5] (CJ LaVine: 2 personal fouls) TURNOVER! (dead ball)

[02:44] Team_090 possession (Score: 59-46)
Josh Wall drives to the basket... Josh Wall throws a bad pass! Stolen by John Durant! TURNOVER! (live ball)

[02:30] Team_035 possession (Score: 59-46)
Cole George attempts a 3Pt. Contested by Josh Wall (4.7 feet, MAN). Cole George misses. Rebound secured by Tobias Tatum.

[02:17] Team_090 possession (Score: 59-46)
Russell Smith drives and kicks out. Derrick Nowitzki attempts a 3Pt. Contested by CJ LaVine (4.4 feet, ZONE). Derrick Nowitzki misses. Rebound secured by John Durant.

[02:07] Team_035 possession (Score: 59-46)
CJ LaVine attempts a Midrange. Contested by OG Anunoby (5.3 feet, MAN). CJ LaVine misses. Rebound secured by Derrick Nowitzki.

[01:51] Team_090 possession (Score: 59-46)
Tobias Tatum attempts a Layup. Contested by John Durant (5.3 feet, MAN). Tobias Tatum misses. Rebound secured by John Durant.

[01:33] Team_035 possession (Score: 59-46)
John Durant attempts a Layup. Contested by Derrick Nowitzki (4.6 feet, ZONE). John Durant misses. Offensive rebound by John Durant! John Durant kicks it out.

[01:21] Team_035 possession (Score: 59-46)
Malcolm Turner attempts a 3Pt. Contested by Russell Smith (5.2 feet, ZONE). Malcolm Turner misses. Rebound secured by Russell Smith.

[01:06] Team_090 possession (Score: 59-46)
Derrick Nowitzki attempts a Midrange. Contested by Tobias Jordan (4.4 feet, MAN). DERRICK NOWITZKI MAKES IT! Assist: Tobias Tatum
Score: 61-46

[00:53] Team_035 possession (Score: 61-46)
CJ LaVine commits a violation (traveling/carry)! TURNOVER! (dead ball)

[00:37] Team_090 possession (Score: 61-46)
Tobias Tatum throws a bad pass! Stolen by John Durant! TURNOVER! (live ball)

[00:20] Team_035 possession (Score: 61-46)
Cole George drives, Tobias Tatum stays with him. Cole George attempts a Layup. Contested by Tobias Tatum (5.3 feet, ZONE). COLE GEORGE MAKES IT!
Score: 61-48

[00:10] Team_090 possession (Score: 61-48)
Derrick Nowitzki attempts a 3Pt. Contested by CJ LaVine (4.2 feet, ZONE). DERRICK NOWITZKI MAKES IT! Assist: OG Anunoby
Score: 64-48

================================================================================
                              2ND QUARTER COMPLETE                              
================================================================================

2ND QUARTER SCORE: Team_090 29, Team_035 21

BOX SCORE:
================================================================================

Team_090
--------------------------------------------------------------------------------
Player                MIN  PTS  REB  AST  TO      FG   FG%      3P   3P%
--------------------------------------------------------------------------------
Derrick Nowitzki       11   10    4    0   0   4/5    80.0     0/0   0.0
Russell Smith          11    5    2    1   0   2/5    40.0     0/0   0.0
OG Anunoby             10    4    0    1   0   2/4    50.0     0/0   0.0
Derrick Mitchell       14    3    0    0   0   1/1   100.0     0/0   0.0
Gary Brogdon           13    2    0    0   0   1/1   100.0     0/0   0.0
Tobias Tatum           11    2    5    4   0   1/3    33.3     0/0   0.0
Josh Wall              11    2    0    0   0   1/1   100.0     0/0   0.0
Larry Bridges          13    0    0    1   0   0/0     0.0     0/0   0.0

TEAM: FG: 12/20 (60.0%), 3PT: 2/4 (50.0%), REB: 11 (1 off, 10 def), AST: 7, TO: 4
TEAM FOULS: 2


Team_035
--------------------------------------------------------------------------------
Player                MIN  PTS  REB  AST  TO      FG   FG%      3P   3P%
--------------------------------------------------------------------------------
Tobias Jordan          11   10    4    0   0   5/6    83.3     0/0   0.0
CJ LaVine              11    5    0    0   0   2/3    66.7     0/0   0.0
John Durant            11    4    7    1   0   2/4    50.0     0/0   0.0
Cole George            11    2    0    1   0   1/3    33.3     0/0   0.0
Malcolm Turner         11    0    0    1   0   0/4     0.0     0/0   0.0

TEAM: FG: 10/20 (50.0%), 3PT: 1/7 (14.3%), REB: 11 (3 off, 8 def), AST: 3, TO: 3
TEAM FOULS: 5 [Team_090 in BONUS]

================================================================================

================================================================================
                       3RD QUARTER - Team_090 vs Team_035                       
================================================================================

[12:00] Team_090 possession (Score: 64-48)
Gary Brogdon attempts a Layup. Contested by Dwyane Johnson (4.1 feet, ZONE). GARY BROGDON MAKES IT! Assist: Zach Wall
Score: 66-48

[11:47] Team_035 possession (Score: 66-48)
Gary Johnson drives to the basket... Gary Johnson throws a bad pass! Stolen by Gary Brogdon! TURNOVER! (live ball)

[11:36] Team_090 possession (Score: 66-48)
Gary Brogdon drives, Dwyane Johnson stays with him. Gary Brogdon attempts a Layup. Contested by Dwyane Johnson (4.1 feet, MAN). GARY BROGDON MAKES IT! Assist: Zach Wall
Score: 68-48

[11:20] Team_035 possession (Score: 68-48)
Shaquille Ginobili attempts a 3Pt. Contested by Larry Bridges (4.6 feet, MAN). SHAQUILLE GINOBILI MAKES IT! Assist: Magic Westbrook
Score: 68-51

[11:04] Team_090 possession (Score: 68-51)
Tracy Adebayo drives, picks up Dwyane Johnson. Help arrives from Domantas Green! Tracy Adebayo attempts a Layup. Contested by Domantas Green (3.7 feet, ZONE). TRACY ADEBAYO MAKES IT! Assist: Derrick Mitchell
Score: 70-51

[10:46] Team_035 possession (Score: 70-51)
Domantas Green attempts a 3Pt. Contested by Derrick Mitchell (3.6 feet, MAN). DOMANTAS GREEN MAKES IT! Assist: Shaquille Ginobili
Score: 70-54

[10:27] Team_090 possession (Score: 70-54)
Tracy Adebayo commits a violation (traveling/carry)! TURNOVER! (dead ball)

[10:11] Team_035 possession (Score: 70-54)
FOUL! Holding foul on Tracy Adebayo. [Team fouls: 1] No free throws, side out. (Tracy Adebayo: 1 personal fouls)

[09:57] Team_035 possession (Score: 70-54)
Dwyane Johnson drives to the basket... Dwyane Johnson loses the ball! Stripped by Gary Brogdon! TURNOVER! (live ball)

[09:45] Team_090 possession (Score: 70-54)
Tracy Adebayo makes the Dunk and draws the foul on Magic Westbrook! And-1! Tracy Adebayo to the line for 1. [Team fouls: 1] (Magic Westbrook: 1 personal fouls)   FT 1/1: GOOD Tracy Adebayo makes 1/1 from the line.
Score: 73-54

[09:31] Team_035 possession (Score: 73-54)
Dwyane Johnson drives to the basket... Dwyane Johnson throws a bad pass! Stolen by Gary Brogdon! TURNOVER! (live ball)

[09:20] Team_090 possession (Score: 73-54)
Zach Wall attempts a 3Pt. Contested by Shaquille Ginobili (4.2 feet, ZONE). Zach Wall misses. Rebound secured by Dwyane Johnson.

[09:03] Team_035 possession (Score: 73-54)
Domantas Green drives and kicks out. Shaquille Ginobili attempts a 3Pt. Contested by Larry Bridges (4.7 feet, MAN). Shaquille Ginobili misses. Rebound secured by Gary Brogdon.

[08:49] Team_090 possession (Score: 73-54)
Zach Wall attempts a 3Pt. Contested by Shaquille Ginobili (4.2 feet, ZONE). Zach Wall misses. Rebound secured by Magic Westbrook.

[08:36] Team_035 possession (Score: 73-54)
Dwyane Johnson drives to the basket... Dwyane Johnson commits a violation (traveling/carry)! TURNOVER! (dead ball)

[08:24] Team_090 possession (Score: 73-54)
Derrick Mitchell throws a bad pass out of bounds! TURNOVER! (dead ball)

[08:09] Team_035 possession (Score: 73-54)
Dwyane Johnson drives, Gary Brogdon stays with him. Dwyane Johnson attempts a Layup. Contested by Gary Brogdon (3.5 feet, ZONE). Dwyane Johnson misses. Rebound secured by Zach Wall.

[07:56] Team_090 possession (Score: 73-54)
FOUL! Shooting foul on Dwyane Johnson. Gary Brogdon to the line for 2 free throws. [Team fouls: 2] (Dwyane Johnson: 1 personal fouls)   FT 1/2: GOOD   FT 2/2: GOOD Gary Brogdon makes 2/2 from the line.
Score: 75-54

[07:39] Team_035 possession (Score: 75-54)
Shaquille Ginobili attempts a Layup. Contested by Gary Brogdon (3.4 feet, ZONE). Shaquille Ginobili misses. Rebound secured by Gary Brogdon.

[07:25] Team_090 possession (Score: 75-54)
Larry Bridges attempts a Midrange. Contested by Shaquille Ginobili (4.0 feet, MAN). LARRY BRIDGES MAKES IT!
Score: 77-54

[07:12] Team_035 possession (Score: 77-54)
Domantas Green drives and kicks out. Gary Johnson attempts a Midrange. Contested by Zach Wall (5.0 feet, ZONE). GARY JOHNSON MAKES IT!
Score: 77-56

[06:56] Team_090 possession (Score: 77-56)
Zach Wall drives and kicks out. Zach Wall attempts a Midrange. Contested by Gary Johnson (3.8 feet, ZONE). ZACH WALL MAKES IT!
Score: 79-56

[06:44] Team_035 possession (Score: 79-56)
FOUL! Holding foul on Larry Bridges. [Team fouls: 2] No free throws, side out. (Larry Bridges: 1 personal fouls)

[06:34] Team_035 possession (Score: 79-56)
Gary Johnson attempts a Midrange. Contested by Zach Wall (5.5 feet, MAN). GARY JOHNSON MAKES IT!
Score: 79-58

[06:24] Team_090 possession (Score: 79-58)
Gary Brogdon makes the Layup and draws the foul on Dwyane Johnson! And-1! Gary Brogdon to the line for 1. [Team fouls: 3] (Dwyane Johnson: 2 personal fouls)   FT 1/1: GOOD Gary Brogdon makes 1/1 from the line.
Score: 82-58

[06:08] Team_035 possession (Score: 82-58)
Dwyane Johnson drives and kicks out. Magic Westbrook attempts a 3Pt. Contested by Derrick Mitchell (3.2 feet, ZONE). Magic Westbrook misses. Rebound secured by Zach Wall.

[05:59] Team_090 possession (Score: 82-58)
Zach Wall attempts a 3Pt. Contested by Shaquille Ginobili (4.2 feet, ZONE). ZACH WALL MAKES IT! Assist: Gary Brogdon
Score: 85-58

[05:46] Team_035 possession (Score: 85-58)
Domantas Green attempts a Midrange. Contested by Derrick Mitchell (3.6 feet, MAN). Domantas Green misses. Rebound secured by Tracy Adebayo.

[05:36] Team_090 possession (Score: 85-58)
Derrick Mitchell attempts a 3Pt. Contested by Domantas Green (4.9 feet, MAN). DERRICK MITCHELL MAKES IT! Assist: Zach Wall
Score: 88-58

[05:20] Team_035 possession (Score: 88-58)
Shaquille Ginobili makes the Layup and draws the foul on Gary Brogdon! And-1! Shaquille Ginobili to the line for 1. [Team fouls: 3] (Gary Brogdon: 1 personal fouls)   FT 1/1: GOOD Shaquille Ginobili makes 1/1 from the line.
Score: 88-61

[05:05] Team_090 possession (Score: 88-61)
Tracy Adebayo attempts a Midrange. Contested by Shaquille Ginobili (3.8 feet, ZONE). TRACY ADEBAYO MAKES IT! Assist: Zach Wall
Score: 90-61

[04:46] Team_035 possession (Score: 90-61)
Dwyane Johnson drives and kicks out. Dwyane Johnson attempts a 3Pt. Contested by Gary Brogdon (3.8 feet, MAN). Dwyane Johnson misses. Rebound secured by Tracy Adebayo.

[04:35] Team_090 possession (Score: 90-61)
Zach Wall makes the Dunk and draws the foul on Gary Johnson! And-1! Zach Wall to the line for 1. [Team fouls: 4] (Gary Johnson: 1 personal fouls)   FT 1/1: GOOD Zach Wall makes 1/1 from the line.
Score: 93-61

[04:20] Team_035 possession (Score: 93-61)
Shaquille Ginobili drives to the basket... FOUL! Offensive foul on Shaquille Ginobili! Gary Brogdon drew the charge! [Team fouls: 5] (Shaquille Ginobili: 1 personal fouls) TURNOVER! (dead ball)

[04:05] Team_090 possession (Score: 93-61)
Zach Wall drives, Gary Johnson stays with him. Zach Wall attempts a Layup. Contested by Gary Johnson (4.1 feet, MAN). Zach Wall misses. Rebound secured by Gary Johnson.

[03:52] Team_035 possession (Score: 93-61)
Domantas Green attempts a 3Pt. Contested by Derrick Mitchell (3.7 feet, ZONE). Domantas Green misses. Rebound secured by Tracy Adebayo.

[03:36] Team_090 possession (Score: 93-61)
Zach Wall attempts a Midrange. Contested by Gary Johnson (4.2 feet, MAN). ZACH WALL MAKES IT!
Score: 95-61

[03:26] Team_035 possession (Score: 95-61)
Magic Westbrook attempts a Midrange. Contested by Gary Brogdon (4.3 feet, ZONE). Magic Westbrook misses. Rebound secured by Tracy Adebayo.

[03:11] Team_090 possession (Score: 95-61)
Zach Wall attempts a 3Pt. Contested by Gary Johnson (4.2 feet, MAN). ZACH WALL MAKES IT! Assist: Gary Brogdon
Score: 98-61

[02:55] Team_035 possession (Score: 98-61)
Shaquille Ginobili drives to the basket... FOUL! Offensive foul on Shaquille Ginobili! Gary Brogdon drew the charge! [Team fouls: 6] (Shaquille Ginobili: 2 personal fouls) TURNOVER! (dead ball)

[02:42] Team_090 possession (Score: 98-61)
FOUL! Reach-in foul on Gary Johnson during the drive. [IN THE BONUS! 7 team fouls] Zach Wall to the line for 2 free throws. (Gary Johnson: 2 personal fouls)   FT 1/2: GOOD   FT 2/2: GOOD Zach Wall makes 2/2 from the line.
Score: 100-61

[02:28] Team_035 possession (Score: 100-61)
Shaquille Ginobili attempts a 3Pt. Contested by Derrick Mitchell (3.3 feet, ZONE). Shaquille Ginobili misses. Rebound secured by Zach Wall.

[02:14] Team_090 possession (Score: 100-61)
Larry Bridges drives and kicks out. Derrick Mitchell attempts a 3Pt. Contested by Shaquille Ginobili (4.2 feet, ZONE). Derrick Mitchell misses. Rebound secured by Magic Westbrook.

[01:59] Team_035 possession (Score: 100-61)
Magic Westbrook throws a bad pass out of bounds! TURNOVER! (dead ball)

[01:59] Substitution (Team_090): Derrick Mitchell OUT → OG Anunoby IN (stamina_rule2)

[01:59] Substitution (Team_090): Larry Bridges OUT → Josh Wall IN (stamina_rule2)

[01:59] Substitution (Team_090): Zach Wall OUT → Russell Smith IN (stamina_rule2)

[01:59] Substitution (Team_090): Gary Brogdon OUT → Derrick Nowitzki IN (stamina_rule2)

[01:59] Substitution (Team_090): Tracy Adebayo OUT → Tobias Tatum IN (stamina_rule2)

[01:59] Substitution (Team_035): Domantas Green OUT → CJ LaVine IN (stamina_rule2)

[01:59] Substitution (Team_035): Shaquille Ginobili OUT → Cole George IN (stamina_rule2)

[01:59] Substitution (Team_035): Gary Johnson OUT → Malcolm Turner IN (stamina_rule2)

[01:59] Substitution (Team_035): Dwyane Johnson OUT → Tobias Jordan IN (stamina_rule2)

[01:59] Substitution (Team_035): Magic Westbrook OUT → John Durant IN (stamina_rule2)

[01:44] Team_090 possession (Score: 100-61)
Tobias Tatum drives and kicks out. Josh Wall attempts a Midrange. Contested by Cole George (3.5 feet, MAN). Josh Wall misses. Rebound secured by Cole George.

[01:29] Team_035 possession (Score: 100-61)
Malcolm Turner attempts a 3Pt. Contested by Russell Smith (4.9 feet, MAN). Malcolm Turner misses. Rebound secured by Tobias Tatum.

[01:15] Team_090 possession (Score: 100-61)
Josh Wall attempts a Midrange. Contested by Malcolm Turner (5.2 feet, ZONE). Josh Wall misses. Rebound secured by Tobias Jordan.

[01:04] Team_035 possession (Score: 100-61)
Malcolm Turner attempts a 3Pt. Contested by Russell Smith (4.9 feet, MAN). Malcolm Turner misses. Offensive rebound by John Durant! John Durant kicks it out.

[00:49] Team_035 possession (Score: 100-61)
Cole George attempts a Midrange. Contested by OG Anunoby (5.4 feet, ZONE). Cole George misses. Rebound secured by Tobias Tatum.

[00:39] Team_090 possession (Score: 100-61)
FOUL! Holding foul on John Durant. [IN THE BONUS! 8 team fouls] Tobias Tatum to the line for 2 free throws. (John Durant: 1 personal fouls)   FT 1/2: MISS   FT 2/2: GOOD Tobias Tatum makes 1/2 from the line.
Score: 101-61

[00:24] Team_035 possession (Score: 101-61)
CJ LaVine drives to the basket... CJ LaVine throws a bad pass! Stolen by Tobias Tatum! TURNOVER! (live ball)

[00:08] Team_090 possession (Score: 101-61)
FOUL! Shooting foul on John Durant. Tobias Tatum to the line for 2 free throws. [BONUS: 9 team fouls] (John Durant: 2 personal fouls)   FT 1/2: MISS   FT 2/2: MISS Tobias Tatum makes 0/2 from the line. Rebound secured by Tobias Jordan.

================================================================================
                              3RD QUARTER COMPLETE                              
================================================================================

3RD QUARTER SCORE: Team_090 37, Team_035 13

BOX SCORE:
================================================================================

Team_090
--------------------------------------------------------------------------------
Player                MIN  PTS  REB  AST  TO      FG   FG%      3P   3P%
--------------------------------------------------------------------------------
Zach Wall              23   15    3    4   0   6/9    66.7     0/0   0.0
Gary Brogdon           23    9    2    2   0   4/4   100.0     0/0   0.0
Tracy Adebayo          23    7    4    0   0   3/3   100.0     0/0   0.0
Derrick Mitchell       25    3    0    1   0   1/1   100.0     0/0   0.0
Larry Bridges          23    2    0    0   0   1/2    50.0     0/0   0.0
Tobias Tatum           13    1    2    0   0   1/3    33.3     0/0   0.0
Josh Wall              13    0    0    0   0   0/1     0.0     0/0   0.0

TEAM: FG: 16/23 (69.6%), 3PT: 3/5 (60.0%), REB: 11 (0 off, 11 def), AST: 7, TO: 2
TEAM FOULS: 3


Team_035
--------------------------------------------------------------------------------
Player                MIN  PTS  REB  AST  TO      FG   FG%      3P   3P%
--------------------------------------------------------------------------------
Shaquille Ginobili     23    6    0    1   0   2/4    50.0     0/0   0.0
Gary Johnson           23    4    1    0   0   2/2   100.0     0/0   0.0
Domantas Green         23    3    0    0   0   1/4    25.0     0/0   0.0
Magic Westbrook        23    0    2    1   0   0/1     0.0     0/0   0.0
Dwyane Johnson         23    0    1    0   0   0/3     0.0     0/0   0.0
Cole George            13    0    1    0   0   0/1     0.0     0/0   0.0
Malcolm Turner         13    0    0    0   0   0/1     0.0     0/0   0.0
Tobias Jordan          13    0    2    0   0   0/0     0.0     0/0   0.0
John Durant            13    0    1    0   0   0/0     0.0     0/0   0.0

TEAM: FG: 5/16 (31.2%), 3PT: 2/5 (40.0%), REB: 8 (1 off, 7 def), AST: 2, TO: 8
TEAM FOULS: 9 [Team_090 in BONUS]

================================================================================

================================================================================
                       4TH QUARTER - Team_090 vs Team_035                       
================================================================================

[12:00] Team_090 possession (Score: 101-61)
Gary Brogdon throws a bad pass out of bounds! TURNOVER! (dead ball)

[11:44] Team_035 possession (Score: 101-61)
Dwyane Johnson attempts a Midrange. Contested by Gary Brogdon (3.7 feet, MAN). Dwyane Johnson misses. FOUL! Loose ball foul on Gary Brogdon during the rebound battle. [Team fouls: 1] No free throws, side out. (Gary Brogdon: 1 personal fouls)

[11:28] Team_035 possession (Score: 101-61)
Dwyane Johnson makes the Layup and draws the foul on Gary Brogdon! And-1! Dwyane Johnson to the line for 1. [Team fouls: 2] (Gary Brogdon: 2 personal fouls)   FT 1/1: GOOD Dwyane Johnson makes 1/1 from the line.
Score: 101-64

[11:12] Team_090 possession (Score: 101-64)
Gary Brogdon attempts a 3Pt. Contested by Dwyane Johnson (4.2 feet, MAN). Gary Brogdon misses. Rebound secured by Magic Westbrook.

[11:00] Team_035 possession (Score: 101-64)
Shaquille Ginobili attempts a Layup. BLOCKED BY LARRY BRIDGES! Ball is loose! Rebound secured by Tracy Adebayo.

[10:46] Team_090 possession (Score: 101-64)
Larry Bridges attempts a Layup. Contested by Dwyane Johnson (4.1 feet, ZONE). LARRY BRIDGES MAKES IT! Assist: Tracy Adebayo
Score: 103-64

[10:30] Team_035 possession (Score: 103-64)
Dwyane Johnson attempts a 3Pt. Contested by Gary Brogdon (3.9 feet, MAN). Dwyane Johnson misses. Offensive rebound by Dwyane Johnson! Dwyane Johnson's putback is no good. Rebound secured by Gary Brogdon.

[10:18] Team_090 possession (Score: 103-64)
Larry Bridges attempts a Layup. Contested by Magic Westbrook (4.6 feet, ZONE). LARRY BRIDGES MAKES IT! Assist: Gary Brogdon
Score: 105-64

[10:02] Team_035 possession (Score: 105-64)
Dwyane Johnson attempts a Midrange. Contested by Gary Brogdon (3.9 feet, MAN). DWYANE JOHNSON MAKES IT!
Score: 105-66

[09:44] Team_090 possession (Score: 105-66)
Derrick Mitchell attempts a Midrange. Contested by Domantas Green (5.1 feet, MAN). DERRICK MITCHELL MAKES IT!
Score: 107-66

[09:26] Team_035 possession (Score: 107-66)
Gary Johnson attempts a 3Pt. Contested by Derrick Mitchell (3.9 feet, ZONE). Gary Johnson misses. Offensive rebound by Dwyane Johnson! Dwyane Johnson puts it back in!
Score: 107-68

[09:10] Team_090 possession (Score: 107-68)
FOUL! Shooting foul on Domantas Green. Zach Wall to the line for 3 free throws. [Team fouls: 1] (Domantas Green: 1 personal fouls)   FT 1/3: GOOD   FT 2/3: GOOD   FT 3/3: GOOD Zach Wall makes 3/3 from the line.
Score: 110-68

[08:53] Team_035 possession (Score: 110-68)
FOUL! Shooting foul on Tracy Adebayo. Shaquille Ginobili to the line for 2 free throws. [Team fouls: 3] (Tracy Adebayo: 1 personal fouls)   FT 1/2: GOOD   FT 2/2: GOOD Shaquille Ginobili makes 2/2 from the line.
Score: 110-70

[08:37] Team_090 possession (Score: 110-70)
Tracy Adebayo drives, Magic Westbrook stays with him. Tracy Adebayo attempts a Layup. Contested by Magic Westbrook (4.5 feet, MAN). Tracy Adebayo misses. Offensive rebound by Zach Wall! Zach Wall kicks it out.

[08:22] Team_090 possession (Score: 110-70)
Gary Brogdon drives and kicks out. Gary Brogdon attempts a Midrange. Contested by Dwyane Johnson (4.3 feet, MAN). Gary Brogdon misses. Rebound secured by Gary Johnson.

[08:07] Team_035 possession (Score: 110-70)
Dwyane Johnson drives, Gary Brogdon stays with him. Dwyane Johnson attempts a Layup. Contested by Gary Brogdon (4.2 feet, MAN). DWYANE JOHNSON MAKES IT! Assist: Shaquille Ginobili
Score: 110-72

[07:53] Team_090 possession (Score: 110-72)
Gary Brogdon attempts a 3Pt. Contested by Dwyane Johnson (4.5 feet, MAN). Gary Brogdon misses. Rebound secured by Gary Johnson.

[07:36] Team_035 possession (Score: 110-72)
FOUL! Reach-in foul on Gary Brogdon during the drive. [Team fouls: 4] No free throws, side out. (Gary Brogdon: 3 personal fouls)

[07:22] Team_035 possession (Score: 110-72)
Dwyane Johnson attempts a 3Pt. Contested by Derrick Mitchell (3.5 feet, ZONE). Dwyane Johnson misses. Offensive rebound by Magic Westbrook! Magic Westbrook kicks it out.

[07:09] Team_035 possession (Score: 110-72)
Magic Westbrook drives, Gary Brogdon stays with him. Magic Westbrook attempts a Dunk. Contested by Gary Brogdon (4.8 feet, ZONE). MAGIC WESTBROOK MAKES IT! Assist: Gary Johnson
Score: 110-74

[06:49] Team_090 possession (Score: 110-74)
Larry Bridges attempts a 3Pt. Contested by Shaquille Ginobili (4.5 feet, MAN). Larry Bridges misses. Rebound secured by Gary Johnson.

[06:34] Team_035 possession (Score: 110-74)
Gary Johnson attempts a Layup. BLOCKED BY LARRY BRIDGES! Ball deflects out of bounds off Gary Johnson.

[06:20] Team_090 possession (Score: 110-74)
Larry Bridges attempts a 3Pt. Contested by Shaquille Ginobili (4.6 feet, MAN). Larry Bridges misses. Rebound secured by Dwyane Johnson.

[06:07] Team_035 possession (Score: 110-74)
Dwyane Johnson attempts a Midrange. Contested by Gary Brogdon (4.5 feet, MAN). Dwyane Johnson misses. Offensive rebound by Magic Westbrook! Magic Westbrook kicks it out.

[05:57] Team_035 possession (Score: 110-74)
FOUL! Shooting foul on Derrick Mitchell. Domantas Green to the line for 2 free throws. [BONUS: 5 team fouls] (Derrick Mitchell: 1 personal fouls)   FT 1/2: MISS   FT 2/2: GOOD Domantas Green makes 1/2 from the line.
Score: 110-75

[05:42] Team_090 possession (Score: 110-75)
Gary Brogdon makes the Dunk and draws the foul on Domantas Green! And-1! Gary Brogdon to the line for 1. [Team fouls: 2] (Domantas Green: 2 personal fouls)   FT 1/1: GOOD Gary Brogdon makes 1/1 from the line.
Score: 113-75

[05:24] Team_035 possession (Score: 113-75)
Shaquille Ginobili attempts a 3Pt. Contested by Larry Bridges (5.2 feet, MAN). Shaquille Ginobili misses. Rebound secured by Tracy Adebayo.

[05:12] Team_090 possession (Score: 113-75)
FOUL! Shooting foul on Dwyane Johnson. Gary Brogdon to the line for 2 free throws. [Team fouls: 3] (Dwyane Johnson: 1 personal fouls)   FT 1/2: GOOD   FT 2/2: MISS Gary Brogdon makes 1/2 from the line. Rebound secured by Gary Johnson.
Score: 114-75

[04:59] Team_035 possession (Score: 114-75)
Gary Johnson drives to the basket... Gary Johnson throws a bad pass! Stolen by Gary Brogdon! TURNOVER! (live ball)

[04:46] Team_090 possession (Score: 114-75)
Tracy Adebayo drives, picks up Magic Westbrook. Help arrives from Domantas Green! Tracy Adebayo attempts a Dunk. Contested by Domantas Green (5.1 feet, MAN). TRACY ADEBAYO MAKES IT! Assist: Larry Bridges
Score: 116-75

[04:31] Team_035 possession (Score: 116-75)
Domantas Green attempts a 3Pt. Contested by Derrick Mitchell (4.3 feet, ZONE). Domantas Green misses. Rebound secured by Zach Wall.

[04:18] Team_090 possession (Score: 116-75)
Zach Wall attempts a 3Pt. Contested by Shaquille Ginobili (5.1 feet, ZONE). Zach Wall misses. Rebound secured by Dwyane Johnson.

[04:06] Team_035 possession (Score: 116-75)
Shaquille Ginobili attempts a Midrange. Contested by Larry Bridges (5.4 feet, MAN). SHAQUILLE GINOBILI MAKES IT! Assist: Domantas Green
Score: 116-77

[03:55] Team_090 possession (Score: 116-77)
FOUL! Reach-in foul on Magic Westbrook during the drive. [Team fouls: 4] No free throws, side out. (Magic Westbrook: 1 personal fouls)

[03:40] Team_090 possession (Score: 116-77)
FOUL! Reach-in foul on Gary Johnson during the drive. [IN THE BONUS! 5 team fouls] Zach Wall to the line for 2 free throws. (Gary Johnson: 1 personal fouls)   FT 1/2: GOOD   FT 2/2: GOOD Zach Wall makes 2/2 from the line.
Score: 118-77

[03:26] Team_035 possession (Score: 118-77)
Dwyane Johnson drives and kicks out. Gary Johnson attempts a Midrange. Contested by Derrick Mitchell (4.3 feet, ZONE). GARY JOHNSON MAKES IT!
Score: 118-79

[03:13] Team_090 possession (Score: 118-79)
Tracy Adebayo attempts a Layup. Contested by Dwyane Johnson (4.8 feet, ZONE). TRACY ADEBAYO MAKES IT! Assist: Gary Brogdon
Score: 120-79

[03:01] Team_035 possession (Score: 120-79)
Dwyane Johnson attempts a Midrange. Contested by Gary Brogdon (5.1 feet, ZONE). Dwyane Johnson misses. Rebound secured by Gary Brogdon.

[02:47] Team_090 possession (Score: 120-79)
Derrick Mitchell attempts a Layup. Contested by Dwyane Johnson (5.3 feet, ZONE). Derrick Mitchell misses. Rebound secured by Gary Johnson.

[02:37] Team_035 possession (Score: 120-79)
Magic Westbrook drives, Tracy Adebayo stays with him. Magic Westbrook attempts a Layup. Wide open! Tracy Adebayo is 6.4 feet away. [MAN] Magic Westbrook misses. Rebound secured by Tracy Adebayo.

[02:21] Team_090 possession (Score: 120-79)
Tracy Adebayo attempts a 3Pt. Contested by Magic Westbrook (5.5 feet, MAN). Tracy Adebayo misses. Rebound secured by Magic Westbrook.

[02:05] Team_035 possession (Score: 120-79)
Magic Westbrook drives and kicks out. Shaquille Ginobili attempts a 3Pt. Contested by Larry Bridges (6.0 feet, MAN). SHAQUILLE GINOBILI MAKES IT! Assist: Domantas Green
Score: 120-82

[01:49] Team_090 possession (Score: 120-82)
Derrick Mitchell attempts a 3Pt. Contested by Shaquille Ginobili (5.5 feet, ZONE). DERRICK MITCHELL MAKES IT! Assist: Larry Bridges
Score: 123-82

[01:32] Team_035 possession (Score: 123-82)
FOUL! Holding foul on Gary Brogdon. [IN THE BONUS! 6 team fouls] Dwyane Johnson to the line for 2 free throws. (Gary Brogdon: 4 personal fouls)   FT 1/2: MISS   FT 2/2: GOOD Dwyane Johnson makes 1/2 from the line.
Score: 123-83

[01:14] Team_090 possession (Score: 123-83)
Gary Brogdon attempts a Layup. Contested by Dwyane Johnson (5.3 feet, ZONE). Gary Brogdon misses. Rebound secured by Magic Westbrook.

[01:01] Team_035 possession (Score: 123-83)
Magic Westbrook attempts a Layup. Wide open! Tracy Adebayo is 6.6 feet away. [MAN] MAGIC WESTBROOK MAKES IT! Assist: Shaquille Ginobili
Score: 123-85

[00:46] Team_090 possession (Score: 123-85)
Zach Wall attempts a 3Pt. Contested by Gary Johnson (5.3 feet, MAN). ZACH WALL MAKES IT!
Score: 126-85

[00:29] Team_035 possession (Score: 126-85)
Dwyane Johnson attempts a Midrange. Contested by Derrick Mitchell (4.5 feet, ZONE). Dwyane Johnson misses. Rebound secured by Larry Bridges.

[00:12] Team_090 possession (Score: 126-85)
Derrick Mitchell loses control! Ball rolls out of bounds! TURNOVER! (dead ball)

[00:12] Substitution (Team_090): Derrick Mitchell OUT → OG Anunoby IN (stamina_rule2)

[00:12] Substitution (Team_090): Larry Bridges OUT → Josh Wall IN (stamina_rule2)

[00:12] Substitution (Team_090): Zach Wall OUT → Russell Smith IN (stamina_rule2)

[00:12] Substitution (Team_090): Gary Brogdon OUT → Derrick Nowitzki IN (stamina_rule2)

[00:12] Substitution (Team_090): Tracy Adebayo OUT → Tobias Tatum IN (stamina_rule2)

[00:12] Substitution (Team_035): Domantas Green OUT → CJ LaVine IN (stamina_rule2)

[00:12] Substitution (Team_035): Shaquille Ginobili OUT → Cole George IN (stamina_rule2)

[00:12] Substitution (Team_035): Gary Johnson OUT → Malcolm Turner IN (stamina_rule2)

[00:12] Substitution (Team_035): Dwyane Johnson OUT → Tobias Jordan IN (stamina_rule2)

[00:12] Substitution (Team_035): Magic Westbrook OUT → John Durant IN (stamina_rule2)

================================================================================
                              4TH QUARTER COMPLETE                              
================================================================================

4TH QUARTER SCORE: Team_090 25, Team_035 24

BOX SCORE:
================================================================================

Team_090
--------------------------------------------------------------------------------
Player                MIN  PTS  REB  AST  TO      FG   FG%      3P   3P%
--------------------------------------------------------------------------------
Zach Wall              35    8    2    0   0   3/4    75.0     0/0   0.0
Derrick Mitchell       37    5    0    0   0   2/3    66.7     0/0   0.0
Tracy Adebayo          35    4    3    1   0   2/3    66.7     0/0   0.0
Larry Bridges          35    4    1    2   0   2/4    50.0     0/0   0.0
Gary Brogdon           35    3    2    2   0   1/6    16.7     0/0   0.0

TEAM: FG: 10/20 (50.0%), 3PT: 3/9 (33.3%), REB: 7 (1 off, 6 def), AST: 5, TO: 2
TEAM FOULS: 6 [Team_035 in BONUS]


Team_035
--------------------------------------------------------------------------------
Player                MIN  PTS  REB  AST  TO      FG   FG%      3P   3P%
--------------------------------------------------------------------------------
Dwyane Johnson         35   10    4    0   0   5/8    62.5     0/0   0.0
Shaquille Ginobili     35    7    0    2   0   3/5    60.0     0/0   0.0
Magic Westbrook        35    4    5    0   0   2/3    66.7     0/0   0.0
Gary Johnson           35    2    5    1   0   1/2    50.0     0/0   0.0
Domantas Green         35    1    0    2   0   1/2    50.0     0/0   0.0

TEAM: FG: 12/20 (60.0%), 3PT: 1/4 (25.0%), REB: 15 (5 off, 10 def), AST: 5, TO: 1
TEAM FOULS: 5 [Team_090 in BONUS]

================================================================================

================================================================================
                               FULL GAME COMPLETE                               
================================================================================

FINAL SCORE: Team_090 126, Team_035 85

SCORING BY QUARTER:
--------------------------------------------------------------------------------
Team                     Q1     Q2     Q3     Q4    FINAL
--------------------------------------------------------------------------------
Team_090                 35     29     37     25      126
Team_035                 27     21     13     24       85
--------------------------------------------------------------------------------

FULL GAME BOX SCORE:
================================================================================

Team_090
--------------------------------------------------------------------------------
Player                MIN  PTS  REB  AST  TO      FG   FG%      3P   3P%      FT STL BLK
--------------------------------------------------------------------------------
Derrick Mitchell       37   13    0    2   3   5/7    71.4   2/3    66.7   1/1     2   0
Larry Bridges          35    6    1    4   0   4/10   40.0   1/5    20.0   0/1     0   2
Zach Wall              35   39    6    4   1  15/20   75.0   6/10   60.0  13/13    2   0
Gary Brogdon           35   16    6    4   1   8/15   53.3   0/2     0.0   5/6     4   0
Tracy Adebayo          35   23   14    1   1   9/12   75.0   1/2    50.0   7/8     0   0
Josh Wall              13    2    0    0   0   1/2    50.0   0/0     0.0   0/0     0   0
Russell Smith          13    5    2    1   0   2/5    40.0   0/0     0.0   1/1     0   0
Derrick Nowitzki       13   10    4    0   0   4/5    80.0   2/2   100.0   1/2     0   0
Tobias Tatum           13    3    7    4   1   1/5    20.0   0/1     0.0   3/6     1   0
OG Anunoby             12    4    0    1   1   2/4    50.0   0/1     0.0   0/0     0   0

TEAM: FG: 52/86 (60.5%), 3PT: 12/26 (46.2%), REB: 39 (3 off, 36 def), AST: 21, TO: 8


Team_035
--------------------------------------------------------------------------------
Player                MIN  PTS  REB  AST  TO      FG   FG%      3P   3P%      FT STL BLK
--------------------------------------------------------------------------------
Domantas Green         35    8    0    3   5   4/9    44.4   2/5    40.0   2/3     0   0
Shaquille Ginobili     35   13    0    4   1   5/9    55.6   1/3    33.3   3/3     0   0
Gary Johnson           35   15    9    2   5   6/11   54.5   2/4    50.0   2/3     0   0
Dwyane Johnson         35   16    7    0   0   6/15   40.0   0/4     0.0   4/5     0   0
Magic Westbrook        35    6   14    1   2   4/7    57.1   0/0     0.0   0/2     0   1
CJ LaVine              13    5    0    0   3   2/3    66.7   1/1   100.0   2/3     0   0
Cole George            13    2    1    1   0   1/4    25.0   0/2     0.0   0/0     0   0
Malcolm Turner         13    0    0    1   0   0/5     0.0   0/5     0.0   0/0     0   0
Tobias Jordan          13   10    6    0   0   5/6    83.3   0/0     0.0   0/0     0   0
John Durant            13    4    8    1   0   2/4    50.0   0/0     0.0   0/0     2   0

TEAM: FG: 36/74 (48.6%), 3PT: 6/24 (25.0%), REB: 46 (12 off, 34 def), AST: 13, TO: 16

================================================================================
