================================================================================
                        FULL GAME - Team_020 vs Team_043                        
================================================================================

================================================================================
                       1ST QUARTER - Team_020 vs Team_043                       
================================================================================

[12:00] Team_020 possession (Score: 0-0)
Jarrett McCollum drives, Malcolm Murray stays with him. Jarrett McCollum attempts a Layup. Contested by Malcolm Murray (3.8 feet, MAN). JARRETT MCCOLLUM MAKES IT! Assist: Bam Leonard
Score: 2-0

[11:44] Team_043 possession (Score: 2-0)
FOUL! Holding foul on Bam Leonard. [Team fouls: 1] No free throws, side out. (Bam Leonard: 1 personal fouls)

[11:32] Team_043 possession (Score: 2-0)
Manu Carter attempts a 3Pt. Contested by Bam Leonard (2.8 feet, MAN). Manu Carter misses. Rebound secured by Trae Curry.

[11:14] Team_020 possession (Score: 2-0)
Terry Simons commits a violation (traveling/carry)! TURNOVER! (dead ball)

[11:02] Team_043 possession (Score: 2-0)
Malcolm Murray drives and kicks out. Magic Durant attempts a 3Pt. Contested by Bam Leonard (2.3 feet, ZONE). Magic Durant misses. Rebound secured by Terry Simons.

[10:48] Team_020 possession (Score: 2-0)
James Cunningham attempts a Midrange. Contested by Magic Durant (5.4 feet, MAN). JAMES CUNNINGHAM MAKES IT! Assist: Bam Leonard
Score: 4-0

[10:32] Team_043 possession (Score: 4-0)
D'Angelo Iverson attempts a Layup. Contested by Terry Simons (4.3 feet, MAN). D'Angelo Iverson misses. Rebound secured by Terry Simons.

[10:19] Team_020 possession (Score: 4-0)
Trae Curry commits a violation (traveling/carry)! TURNOVER! (dead ball)

[10:04] Team_043 possession (Score: 4-0)
Manu Carter attempts a 3Pt. Contested by Bam Leonard (2.8 feet, ZONE). Manu Carter misses. FOUL! Loose ball foul on Bam Leonard during the rebound battle. [Team fouls: 2] No free throws, side out. (Bam Leonard: 2 personal fouls)

[09:48] Team_043 possession (Score: 4-0)
Manu Carter attempts a Layup. Contested by Trae Curry (5.1 feet, ZONE). MANU CARTER MAKES IT! Assist: Dwyane Dosunmu
Score: 4-2

[09:35] Team_020 possession (Score: 4-2)
Bam Leonard drives to the basket... FOUL! Offensive foul on Bam Leonard! Manu Carter drew the charge! [Team fouls: 3] (Bam Leonard: 3 personal fouls) TURNOVER! (dead ball)

[09:24] Team_043 possession (Score: 4-2)
Dwyane Dosunmu drives and kicks out. Dwyane Dosunmu attempts a 3Pt. Contested by Bam Leonard (2.3 feet, ZONE). Dwyane Dosunmu misses. Rebound secured by Bam Leonard.

[09:08] Team_020 possession (Score: 4-2)
Bam Leonard loses the ball! Stripped by Manu Carter! TURNOVER! (live ball)

[08:51] Team_043 possession (Score: 4-2)
D'Angelo Iverson makes the Midrange and draws the foul on Bam Leonard! And-1! D'Angelo Iverson to the line for 1. [Team fouls: 4] (Bam Leonard: 4 personal fouls)   FT 1/1: GOOD D'Angelo Iverson makes 1/1 from the line.
Score: 4-5

[08:40] Team_020 possession (Score: 4-5)
Jarrett McCollum drives and kicks out. Jarrett McCollum attempts a 3Pt. Contested by D'Angelo Iverson (2.9 feet, ZONE). Jarrett McCollum misses. Rebound secured by Dwyane Dosunmu.

[08:23] Team_043 possession (Score: 4-5)
Dwyane Dosunmu makes the Layup and draws the foul on Trae Curry! And-1! Dwyane Dosunmu to the line for 1. [BONUS: 5 team fouls] (Trae Curry: 1 personal fouls)   FT 1/1: MISS Dwyane Dosunmu makes 0/1 from the line. Rebound secured by Terry Simons.
Score: 4-7

[08:05] Team_020 possession (Score: 4-7)
Trae Curry attempts a Midrange. Contested by Manu Carter (4.6 feet, MAN). TRAE CURRY MAKES IT!
Score: 6-7

[07:50] Team_043 possession (Score: 6-7)
Dwyane Dosunmu attempts a 3Pt. Contested by Bam Leonard (2.3 feet, ZONE). Dwyane Dosunmu misses. Rebound secured by Bam Leonard.

[07:36] Team_020 possession (Score: 6-7)
Trae Curry attempts a Midrange. Contested by Manu Carter (4.6 feet, MAN). TRAE CURRY MAKES IT! Assist: Terry Simons
Score: 8-7

[07:22] Team_043 possession (Score: 8-7)
Malcolm Murray attempts a 3Pt. Contested by Bam Leonard (2.4 feet, ZONE). Malcolm Murray misses. FOUL! Loose ball foul on Trae Curry during the rebound battle. [IN THE BONUS! 6 team fouls] Manu Carter to the line for 2 free throws. (Trae Curry: 2 personal fouls)   FT 1/2: GOOD   FT 2/2: GOOD Manu Carter makes 2/2 from the line.
Score: 8-9

[07:08] Team_020 possession (Score: 8-9)
Terry Simons attempts a Midrange. Contested by Manu Carter (4.8 feet, ZONE). TERRY SIMONS MAKES IT! Assist: James Cunningham
Score: 10-9

[06:52] Team_043 possession (Score: 10-9)
Magic Durant makes the 3Pt and draws the foul on Bam Leonard! And-1! Magic Durant to the line for 1. [BONUS: 7 team fouls] (Bam Leonard: 5 personal fouls)   FT 1/1: GOOD Magic Durant makes 1/1 from the line.
Score: 10-13

[06:36] Team_020 possession (Score: 10-13)
James Cunningham makes the Dunk and draws the foul on Malcolm Murray! And-1! James Cunningham to the line for 1. [Team fouls: 1] (Malcolm Murray: 1 personal fouls)   FT 1/1: GOOD James Cunningham makes 1/1 from the line.
Score: 13-13

[06:21] Team_043 possession (Score: 13-13)
Manu Carter attempts a Midrange. Contested by Bam Leonard (2.8 feet, ZONE). MANU CARTER MAKES IT! Assist: Malcolm Murray
Score: 13-15

[06:10] Team_020 possession (Score: 13-15)
Jarrett McCollum attempts a 3Pt. Contested by Malcolm Murray (3.8 feet, MAN). Jarrett McCollum misses. Rebound secured by Dwyane Dosunmu.

[06:00] Team_043 possession (Score: 13-15)
FOUL! Reach-in foul on Trae Curry during the drive. [IN THE BONUS! 8 team fouls] Manu Carter to the line for 2 free throws. (Trae Curry: 3 personal fouls)   FT 1/2: GOOD   FT 2/2: GOOD Manu Carter makes 2/2 from the line.
Score: 13-17

[05:41] Team_020 possession (Score: 13-17)
Jarrett McCollum attempts a 3Pt. Contested by D'Angelo Iverson (3.0 feet, ZONE). Jarrett McCollum misses. Offensive rebound by Bam Leonard! Bam Leonard's putback is no good. Rebound secured by Manu Carter.

[05:24] Team_043 possession (Score: 13-17)
D'Angelo Iverson attempts a 3Pt. Contested by Bam Leonard (2.4 feet, ZONE). D'Angelo Iverson misses. Rebound secured by Bam Leonard.

[05:11] Team_020 possession (Score: 13-17)
Terry Simons attempts a Layup. Contested by D'Angelo Iverson (3.6 feet, MAN). TERRY SIMONS MAKES IT! Assist: Bam Leonard
Score: 15-17

[04:58] Team_043 possession (Score: 15-17)
FOUL! Shooting foul on Bam Leonard. Manu Carter to the line for 2 free throws. [BONUS: 9 team fouls] (Bam Leonard: 6 personal fouls) Bam Leonard FOULS OUT!   FT 1/2: GOOD   FT 2/2: GOOD Manu Carter makes 2/2 from the line.
Score: 15-19

[04:58] Substitution (Team_020): Bam Leonard OUT (stamina: 77) → Franz Doncic IN (foul_out)

[04:40] Team_020 possession (Score: 15-19)
Trae Curry drives to the basket... FOUL! Offensive foul on Trae Curry! Manu Carter drew the charge! [Team fouls: 10] (Trae Curry: 4 personal fouls) TURNOVER! (dead ball)

[04:25] Team_043 possession (Score: 15-19)
Manu Carter drives, picks up Trae Curry. Help arrives from Jarrett McCollum! Manu Carter attempts a Dunk. Contested by Jarrett McCollum (5.2 feet, MAN). MANU CARTER MAKES IT!
Score: 15-21

[04:12] Team_020 possession (Score: 15-21)
Jarrett McCollum attempts a 3Pt. Contested by Malcolm Murray (3.9 feet, MAN). Jarrett McCollum misses. Rebound secured by D'Angelo Iverson.

[03:58] Team_043 possession (Score: 15-21)
Dwyane Dosunmu attempts a Midrange. Contested by Trae Curry (4.8 feet, MAN). Dwyane Dosunmu misses. Rebound secured by Terry Simons.

[03:45] Team_020 possession (Score: 15-21)
James Cunningham attempts a Midrange. Contested by Magic Durant (5.5 feet, MAN). JAMES CUNNINGHAM MAKES IT! Assist: Jarrett McCollum
Score: 17-21

[03:30] Team_043 possession (Score: 17-21)
Magic Durant attempts a 3Pt. Contested by James Cunningham (5.1 feet, MAN). Magic Durant misses. Rebound secured by Terry Simons.

[03:19] Team_020 possession (Score: 17-21)
Trae Curry drives, Manu Carter stays with him. Trae Curry attempts a Layup. Contested by Manu Carter (4.8 feet, ZONE). TRAE CURRY MAKES IT! Assist: Franz Doncic
Score: 19-21

[03:01] Team_043 possession (Score: 19-21)
Dwyane Dosunmu drives, Trae Curry stays with him. Dwyane Dosunmu attempts a Layup. Contested by Trae Curry (4.9 feet, ZONE). DWYANE DOSUNMU MAKES IT! Assist: Manu Carter
Score: 19-23

[02:49] Team_020 possession (Score: 19-23)
Franz Doncic drives, Manu Carter stays with him. Franz Doncic attempts a Layup. Contested by Manu Carter (4.0 feet, ZONE). FRANZ DONCIC MAKES IT! Assist: James Cunningham
Score: 21-23

[02:39] Team_043 possession (Score: 21-23)
Manu Carter attempts a Midrange. Contested by Terry Simons (4.9 feet, ZONE). Manu Carter misses. Rebound secured by Trae Curry.

[02:25] Team_020 possession (Score: 21-23)
Franz Doncic attempts a 3Pt. Contested by Malcolm Murray (3.6 feet, MAN). Franz Doncic misses. Rebound secured by Dwyane Dosunmu.

[02:12] Team_043 possession (Score: 21-23)
Malcolm Murray drives to the basket... FOUL! Offensive foul on Malcolm Murray! Trae Curry drew the charge! [Team fouls: 2] (Malcolm Murray: 2 personal fouls) TURNOVER! (dead ball)

[02:00] Team_020 possession (Score: 21-23)
Trae Curry attempts a 3Pt. Contested by Manu Carter (4.9 feet, MAN). Trae Curry misses. Rebound secured by Manu Carter.

[01:45] Team_043 possession (Score: 21-23)
FOUL! Offensive foul on Dwyane Dosunmu! Trae Curry drew the charge! [Team fouls: 3] (Dwyane Dosunmu: 1 personal fouls) TURNOVER! (dead ball)

[01:30] Team_020 possession (Score: 21-23)
James Cunningham drives and kicks out. James Cunningham attempts a 3Pt. Contested by D'Angelo Iverson (3.3 feet, ZONE). James Cunningham misses. Offensive rebound by Terry Simons! Terry Simons kicks it out.

[01:16] Team_020 possession (Score: 21-23)
Franz Doncic drives, Malcolm Murray stays with him. Franz Doncic attempts a Dunk. Contested by Malcolm Murray (3.7 feet, MAN). FRANZ DONCIC MAKES IT! Assist: Jarrett McCollum
Score: 23-23

[01:03] Team_043 possession (Score: 23-23)
FOUL! Shooting foul on James Cunningham. Magic Durant to the line for 2 free throws. [BONUS: 11 team fouls] (James Cunningham: 1 personal fouls)   FT 1/2: GOOD   FT 2/2: GOOD Magic Durant makes 2/2 from the line.
Score: 23-25

[00:49] Team_020 possession (Score: 23-25)
Jarrett McCollum attempts a 3Pt. Contested by Malcolm Murray (4.2 feet, MAN). Jarrett McCollum misses. Rebound secured by Manu Carter.

[00:31] Team_043 possession (Score: 23-25)
Malcolm Murray attempts a 3Pt. Contested by Franz Doncic (3.9 feet, MAN). Malcolm Murray misses. Offensive rebound by D'Angelo Iverson! D'Angelo Iverson kicks it out.

[00:12] Team_043 possession (Score: 23-25)
Manu Carter attempts a 3Pt. Contested by Franz Doncic (4.3 feet, ZONE). Manu Carter misses. Rebound secured by Terry Simons.

================================================================================
                              1ST QUARTER COMPLETE                              
================================================================================

1ST QUARTER SCORE: Team_020 23, Team_043 25

BOX SCORE:
================================================================================

Team_020
--------------------------------------------------------------------------------
Player                MIN  PTS  REB  AST  TO      FG   FG%      3P   3P%
--------------------------------------------------------------------------------
James Cunningham       12    7    0    2   0   3/3   100.0     0/0   0.0
Trae Curry             12    6    2    0   0   3/4    75.0     0/0   0.0
Terry Simons           12    4    7    1   0   2/2   100.0     0/0   0.0
Franz Doncic            5    4    0    1   0   2/3    66.7     0/0   0.0
Jarrett McCollum       12    2    0    2   0   1/6    16.7     0/0   0.0
Bam Leonard             7    0    3    3   0   0/0     0.0     0/0   0.0

TEAM: FG: 11/18 (61.1%), 3PT: 0/6 (0.0%), REB: 13 (2 off, 11 def), AST: 9, TO: 5
TEAM FOULS: 11 [Team_043 in BONUS]


Team_043
--------------------------------------------------------------------------------
Player                MIN  PTS  REB  AST  TO      FG   FG%      3P   3P%
--------------------------------------------------------------------------------
Manu Carter            12   12    3    1   0   6/9    66.7     0/0   0.0
Magic Durant           12    6    0    0   0   2/3    66.7     0/0   0.0
D'Angelo Iverson       12    3    3    0   0   1/3    33.3     0/0   0.0
Dwyane Dosunmu         12    2    3    1   0   1/5    20.0     0/0   0.0
Malcolm Murray         12    0    0    1   0   0/1     0.0     0/0   0.0

TEAM: FG: 10/21 (47.6%), 3PT: 2/7 (28.6%), REB: 8 (2 off, 6 def), AST: 3, TO: 2
TEAM FOULS: 3

================================================================================

================================================================================
                       2ND QUARTER - Team_020 vs Team_043                       
================================================================================

[12:00] Team_020 possession (Score: 23-25)
FOUL! Shooting foul on Malcolm Murray. Terry Simons to the line for 2 free throws. [Team fouls: 1] (Malcolm Murray: 1 personal fouls)   FT 1/2: GOOD   FT 2/2: GOOD Terry Simons makes 2/2 from the line.
Score: 25-25

[11:45] Team_043 possession (Score: 25-25)
Manu Carter attempts a Layup. BLOCKED BY BAM LEONARD! Ball deflects out of bounds off Manu Carter.

[11:30] Team_020 possession (Score: 25-25)
Jarrett McCollum attempts a Layup. Contested by Malcolm Murray (4.1 feet, MAN). Jarrett McCollum misses. Rebound secured by Dwyane Dosunmu.

[11:19] Team_043 possession (Score: 25-25)
D'Angelo Iverson attempts a 3Pt. Contested by Terry Simons (4.7 feet, MAN). D'ANGELO IVERSON MAKES IT! Assist: Malcolm Murray
Score: 25-28

[11:04] Team_020 possession (Score: 25-28)
Jarrett McCollum attempts a 3Pt. Contested by Malcolm Murray (4.2 feet, MAN). Jarrett McCollum misses. Rebound secured by Dwyane Dosunmu.

[10:47] Team_043 possession (Score: 25-28)
Malcolm Murray attempts a 3Pt. Contested by Jarrett McCollum (4.9 feet, MAN). MALCOLM MURRAY MAKES IT! Assist: Dwyane Dosunmu
Score: 25-31

[10:28] Team_020 possession (Score: 25-31)
Bam Leonard attempts a Layup. Contested by Manu Carter (5.1 feet, MAN). BAM LEONARD MAKES IT!
Score: 27-31

[10:15] Team_043 possession (Score: 27-31)
FOUL! Shooting foul on Bam Leonard. Manu Carter to the line for 2 free throws. [Team fouls: 1] (Bam Leonard: 1 personal fouls)   FT 1/2: GOOD   FT 2/2: GOOD Manu Carter makes 2/2 from the line.
Score: 27-33

[10:00] Team_020 possession (Score: 27-33)
Terry Simons attempts a 3Pt. Contested by D'Angelo Iverson (4.0 feet, MAN). Terry Simons misses. Offensive rebound by Trae Curry! Trae Curry puts it back in!
Score: 29-33

[09:45] Team_043 possession (Score: 29-33)
FOUL! Shooting foul on Trae Curry. Manu Carter to the line for 2 free throws. [Team fouls: 2] (Trae Curry: 1 personal fouls)   FT 1/2: MISS   FT 2/2: GOOD Manu Carter makes 1/2 from the line.
Score: 29-34

[09:34] Team_020 possession (Score: 29-34)
FOUL! Holding foul on D'Angelo Iverson. [Team fouls: 2] No free throws, side out. (D'Angelo Iverson: 1 personal fouls)

[09:18] Team_020 possession (Score: 29-34)
James Cunningham attempts a Midrange. Contested by Magic Durant (6.0 feet, MAN). JAMES CUNNINGHAM MAKES IT! Assist: Terry Simons
Score: 31-34

[09:05] Team_043 possession (Score: 31-34)
D'Angelo Iverson attempts a Midrange. Contested by Terry Simons (5.0 feet, ZONE). D'Angelo Iverson misses. Rebound secured by Bam Leonard.

[08:52] Team_020 possession (Score: 31-34)
James Cunningham attempts a Midrange. Wide open! Magic Durant is 6.1 feet away. [ZONE] James Cunningham misses. FOUL! Loose ball foul on Manu Carter during the rebound battle. [Team fouls: 3] No free throws, side out. (Manu Carter: 1 personal fouls)

[08:40] Team_020 possession (Score: 31-34)
Trae Curry attempts a Midrange. Contested by Manu Carter (5.3 feet, MAN). TRAE CURRY MAKES IT!
Score: 33-34

[08:26] Team_043 possession (Score: 33-34)
Manu Carter attempts a Midrange. Contested by Bam Leonard (2.7 feet, MAN). Manu Carter misses. Rebound secured by Bam Leonard.

[08:10] Team_020 possession (Score: 33-34)
Bam Leonard attempts a Midrange. Contested by Manu Carter (5.4 feet, MAN). Bam Leonard misses. Offensive rebound by Trae Curry! Trae Curry kicks it out.

[07:54] Team_020 possession (Score: 33-34)
Bam Leonard drives and kicks out. FOUL! Shooting foul on Malcolm Murray. Jarrett McCollum to the line for 2 free throws. [Team fouls: 4] (Malcolm Murray: 2 personal fouls)   FT 1/2: GOOD   FT 2/2: MISS Jarrett McCollum makes 1/2 from the line. Rebound secured by D'Angelo Iverson.
Score: 34-34

[07:37] Team_043 possession (Score: 34-34)
Manu Carter makes the Layup and draws the foul on Bam Leonard! And-1! Manu Carter to the line for 1. [Team fouls: 3] (Bam Leonard: 2 personal fouls)   FT 1/1: GOOD Manu Carter makes 1/1 from the line.
Score: 34-37

[07:24] Team_020 possession (Score: 34-37)
Jarrett McCollum attempts a Layup. Contested by Manu Carter (5.2 feet, ZONE). Jarrett McCollum misses. Rebound secured by Dwyane Dosunmu.

[07:07] Team_043 possession (Score: 34-37)
Dwyane Dosunmu drives, picks up Bam Leonard. Help arrives from Jarrett McCollum! Dwyane Dosunmu attempts a Layup. Contested by Jarrett McCollum (2.5 feet, ZONE). Dwyane Dosunmu misses. Rebound secured by Bam Leonard.

[06:55] Team_020 possession (Score: 34-37)
Bam Leonard attempts a Midrange. Contested by D'Angelo Iverson (4.3 feet, ZONE). BAM LEONARD MAKES IT! Assist: Trae Curry
Score: 36-37

[06:41] Team_043 possession (Score: 36-37)
Malcolm Murray drives and kicks out. Malcolm Murray attempts a Midrange. Contested by Bam Leonard (2.6 feet, ZONE). MALCOLM MURRAY MAKES IT!
Score: 36-39

[06:28] Team_020 possession (Score: 36-39)
Jarrett McCollum attempts a Midrange. Contested by D'Angelo Iverson (4.0 feet, ZONE). Jarrett McCollum misses. Rebound secured by Dwyane Dosunmu.

[06:13] Team_043 possession (Score: 36-39)
Magic Durant attempts a 3Pt. Contested by James Cunningham (5.8 feet, MAN). MAGIC DURANT MAKES IT! Assist: Dwyane Dosunmu
Score: 36-42

[05:57] Team_020 possession (Score: 36-42)
Jarrett McCollum attempts a Layup. Contested by Manu Carter (5.4 feet, ZONE). JARRETT MCCOLLUM MAKES IT! Assist: Bam Leonard
Score: 38-42

[05:44] Team_043 possession (Score: 38-42)
Magic Durant attempts a 3Pt. Contested by Bam Leonard (2.6 feet, ZONE). Magic Durant misses. Rebound secured by Trae Curry.

[05:31] Team_020 possession (Score: 38-42)
James Cunningham attempts a Midrange. Contested by Manu Carter (5.6 feet, ZONE). James Cunningham misses. Rebound secured by Manu Carter.

[05:18] Team_043 possession (Score: 38-42)
FOUL! Reach-in foul on Bam Leonard during the drive. [Team fouls: 4] No free throws, side out. (Bam Leonard: 3 personal fouls)

[05:05] Team_043 possession (Score: 38-42)
Malcolm Murray drives to the basket... Malcolm Murray loses control! Ball rolls out of bounds! TURNOVER! (dead ball)

[05:05] Substitution (Team_020): Jarrett McCollum OUT → Franz Doncic IN (stamina_rule2)

[05:05] Substitution (Team_020): James Cunningham OUT → Stephen Parker IN (stamina_rule2)

[05:05] Substitution (Team_020): Terry Simons OUT → Victor Holiday IN (stamina_rule2)

[05:05] Substitution (Team_020): Bam Leonard OUT → Cole Barnes IN (stamina_rule2)

[05:05] Substitution (Team_020): Trae Curry OUT → Miles Siakam IN (stamina_rule2)

[05:05] Substitution (Team_043): Malcolm Murray OUT → Jabari Holiday IN (stamina_rule2)

[05:05] Substitution (Team_043): Magic Durant OUT → Ben LaVine IN (stamina_rule2)

[05:05] Substitution (Team_043): D'Angelo Iverson OUT → Dirk Herro IN (stamina_rule2)

[05:05] Substitution (Team_043): Manu Carter OUT → Joel Murray IN (stamina_rule2)

[05:05] Substitution (Team_043): Dwyane Dosunmu OUT → Terry Randle IN (stamina_rule2)

[04:47] Team_020 possession (Score: 38-42)
Cole Barnes attempts a Layup. Contested by Terry Randle (4.4 feet, ZONE). COLE BARNES MAKES IT! Assist: Stephen Parker
Score: 40-42

[04:30] Team_043 possession (Score: 40-42)
Dirk Herro attempts a 3Pt. Contested by Victor Holiday (4.5 feet, MAN). Dirk Herro misses. Offensive rebound by Dirk Herro! Dirk Herro's putback is no good. Offensive rebound by Dirk Herro! Dirk Herro kicks it out.

[04:17] Team_043 possession (Score: 40-42)
Joel Murray drives to the basket... Joel Murray throws a bad pass! Stolen by Miles Siakam! TURNOVER! (live ball)

[04:01] Team_020 possession (Score: 40-42)
Victor Holiday attempts a Layup. Contested by Dirk Herro (4.4 feet, MAN). Victor Holiday misses. FOUL! Loose ball foul on Ben LaVine during the rebound battle. [IN THE BONUS! 5 team fouls] Miles Siakam to the line for 2 free throws. (Ben LaVine: 1 personal fouls)   FT 1/2: GOOD   FT 2/2: GOOD Miles Siakam makes 2/2 from the line.
Score: 42-42

[03:49] Team_043 possession (Score: 42-42)
Terry Randle attempts a 3Pt. Contested by Stephen Parker (5.8 feet, ZONE). Terry Randle misses. Rebound secured by Miles Siakam.

[03:37] Team_020 possession (Score: 42-42)
Stephen Parker drives, picks up Ben LaVine. Help arrives from Dirk Herro! Stephen Parker attempts a Dunk. Contested by Dirk Herro (5.3 feet, MAN). STEPHEN PARKER MAKES IT! Assist: Franz Doncic
Score: 44-42

[03:21] Team_043 possession (Score: 44-42)
Terry Randle attempts a Layup. Contested by Miles Siakam (4.4 feet, ZONE). TERRY RANDLE MAKES IT!
Score: 44-44

[03:07] Team_020 possession (Score: 44-44)
Victor Holiday attempts a Layup. BLOCKED BY TERRY RANDLE! Ball is loose! Rebound secured by Terry Randle.

[02:56] Team_043 possession (Score: 44-44)
Joel Murray attempts a Midrange. Contested by Victor Holiday (4.5 feet, ZONE). Joel Murray misses. Rebound secured by Cole Barnes.

[02:37] Team_020 possession (Score: 44-44)
Franz Doncic attempts a 3Pt. Contested by Jabari Holiday (4.1 feet, ZONE). FRANZ DONCIC MAKES IT! Assist: Miles Siakam
Score: 47-44

[02:22] Team_043 possession (Score: 47-44)
Jabari Holiday attempts a 3Pt. Contested by Franz Doncic (4.4 feet, ZONE). Jabari Holiday misses. Rebound secured by Cole Barnes.

[02:09] Team_020 possession (Score: 47-44)
Franz Doncic throws a bad pass out of bounds! TURNOVER! (dead ball)

[01:52] Team_043 possession (Score: 47-44)
Ben LaVine drives, Miles Siakam stays with him. Ben LaVine attempts a Dunk. Contested by Miles Siakam (4.3 feet, ZONE). BEN LAVINE MAKES IT! Assist: Joel Murray
Score: 47-46

[01:38] Team_020 possession (Score: 47-46)
Franz Doncic attempts a Midrange. Contested by Jabari Holiday (4.1 feet, MAN). Franz Doncic misses. FOUL! Loose ball foul on Ben LaVine during the rebound battle. [IN THE BONUS! 6 team fouls] Cole Barnes to the line for 2 free throws. (Ben LaVine: 2 personal fouls)   FT 1/2: GOOD   FT 2/2: GOOD Cole Barnes makes 2/2 from the line.
Score: 49-46

[01:25] Team_043 possession (Score: 49-46)
Jabari Holiday loses control! Ball rolls out of bounds! TURNOVER! (dead ball)

[01:08] Team_020 possession (Score: 49-46)
Cole Barnes attempts a Layup. BLOCKED BY BEN LAVINE! Ball is loose! Rebound secured by Ben LaVine.

[00:53] Team_043 possession (Score: 49-46)
FOUL! Reach-in foul on Miles Siakam during the drive. [IN THE BONUS! 5 team fouls] Terry Randle to the line for 2 free throws. (Miles Siakam: 1 personal fouls)   FT 1/2: GOOD   FT 2/2: GOOD Terry Randle makes 2/2 from the line.
Score: 49-48

[00:43] Team_020 possession (Score: 49-48)
FOUL! Holding foul on Terry Randle. [IN THE BONUS! 7 team fouls] Miles Siakam to the line for 2 free throws. (Terry Randle: 1 personal fouls)   FT 1/2: GOOD   FT 2/2: GOOD Miles Siakam makes 2/2 from the line.
Score: 51-48

[00:27] Team_043 possession (Score: 51-48)
Dirk Herro attempts a 3Pt. Contested by Stephen Parker (5.7 feet, ZONE). Dirk Herro misses. Rebound secured by Miles Siakam.

[00:14] Team_020 possession (Score: 51-48)
Stephen Parker attempts a 3Pt. Contested by Ben LaVine (5.3 feet, MAN). Stephen Parker misses. Rebound secured by Terry Randle.

================================================================================
                              2ND QUARTER COMPLETE                              
================================================================================

2ND QUARTER SCORE: Team_020 28, Team_043 23

BOX SCORE:
================================================================================

Team_020
--------------------------------------------------------------------------------
Player                MIN  PTS  REB  AST  TO      FG   FG%      3P   3P%
--------------------------------------------------------------------------------
Bam Leonard            15    4    3    1   0   2/3    66.7     0/0   0.0
Trae Curry             19    4    4    1   0   2/2   100.0     0/0   0.0
Cole Barnes             5    4    2    0   0   2/3    66.7     0/0   0.0
Miles Siakam            5    4    2    1   0   2/2   100.0     0/0   0.0
Franz Doncic           10    3    0    1   0   1/1   100.0     0/0   0.0
Terry Simons           19    2    0    1   0   1/1   100.0     0/0   0.0
Jarrett McCollum       19    2    0    0   0   1/5    20.0     0/0   0.0
James Cunningham       19    2    0    0   0   1/2    50.0     0/0   0.0
Stephen Parker          5    2    0    1   0   1/2    50.0     0/0   0.0
Victor Holiday          5    0    0    0   0   0/1     0.0     0/0   0.0

TEAM: FG: 13/22 (59.1%), 3PT: 2/4 (50.0%), REB: 11 (3 off, 8 def), AST: 6, TO: 1
TEAM FOULS: 5 [Team_043 in BONUS]


Team_043
--------------------------------------------------------------------------------
Player                MIN  PTS  REB  AST  TO      FG   FG%      3P   3P%
--------------------------------------------------------------------------------
Manu Carter            19    6    1    0   0   3/5    60.0     0/0   0.0
Malcolm Murray         19    5    0    1   0   2/2   100.0     0/0   0.0
Terry Randle            5    4    2    0   0   2/3    66.7     0/0   0.0
D'Angelo Iverson       19    3    1    0   0   1/2    50.0     0/0   0.0
Magic Durant           19    3    0    0   0   1/2    50.0     0/0   0.0
Ben LaVine              5    2    1    0   0   1/1   100.0     0/0   0.0
Dwyane Dosunmu         19    0    4    2   0   0/1     0.0     0/0   0.0
Dirk Herro              5    0    1    0   0   0/1     0.0     0/0   0.0
Joel Murray             5    0    0    1   0   0/1     0.0     0/0   0.0
Jabari Holiday          5    0    0    0   0   0/1     0.0     0/0   0.0

TEAM: FG: 10/19 (52.6%), 3PT: 3/7 (42.9%), REB: 10 (1 off, 9 def), AST: 4, TO: 3
TEAM FOULS: 7 [Team_020 in BONUS]

================================================================================

================================================================================
                       3RD QUARTER - Team_020 vs Team_043                       
================================================================================

[12:00] Team_020 possession (Score: 51-48)
FOUL! Offensive foul on Bam Leonard! Manu Carter drew the charge! [Team fouls: 1] (Bam Leonard: 1 personal fouls) TURNOVER! (dead ball)

[11:45] Team_043 possession (Score: 51-48)
Manu Carter attempts a 3Pt. Contested by Bam Leonard (2.8 feet, ZONE). Manu Carter misses. Rebound secured by Trae Curry.

[11:30] Team_020 possession (Score: 51-48)
FOUL! Reach-in foul on Manu Carter during the drive. [Team fouls: 1] No free throws, side out. (Manu Carter: 1 personal fouls)

[11:15] Team_020 possession (Score: 51-48)
James Cunningham drives and kicks out. Terry Simons attempts a Midrange. Contested by Magic Durant (5.1 feet, ZONE). Terry Simons misses. Offensive rebound by Bam Leonard! Bam Leonard's putback is no good. Rebound secured by D'Angelo Iverson.

[11:00] Team_043 possession (Score: 51-48)
D'Angelo Iverson attempts a Layup. Contested by Terry Simons (4.3 feet, MAN). D'Angelo Iverson misses. Rebound secured by Trae Curry.

[10:49] Team_020 possession (Score: 51-48)
Bam Leonard makes the Layup and draws the foul on Manu Carter! And-1! Bam Leonard to the line for 1. [Team fouls: 2] (Manu Carter: 2 personal fouls)   FT 1/1: MISS Bam Leonard makes 0/1 from the line. Offensive rebound by Trae Curry! Trae Curry puts it back in!
Score: 55-48

[10:38] Team_043 possession (Score: 55-48)
D'Angelo Iverson attempts a 3Pt. Contested by Terry Simons (4.3 feet, MAN). D'Angelo Iverson misses. FOUL! Loose ball foul on Terry Simons during the rebound battle. [Team fouls: 2] No free throws, side out. (Terry Simons: 1 personal fouls)

[10:25] Team_043 possession (Score: 55-48)
D'Angelo Iverson attempts a 3Pt. Contested by Bam Leonard (2.4 feet, ZONE). D'Angelo Iverson misses. Rebound secured by Bam Leonard.

[10:11] Team_020 possession (Score: 55-48)
Terry Simons attempts a 3Pt. Contested by D'Angelo Iverson (3.6 feet, ZONE). Terry Simons misses. Offensive rebound by Bam Leonard! Bam Leonard puts it back in!
Score: 57-48

[09:59] Team_043 possession (Score: 57-48)
Malcolm Murray drives to the basket... Malcolm Murray loses control! Ball rolls out of bounds! TURNOVER! (dead ball)

[09:45] Team_020 possession (Score: 57-48)
Terry Simons attempts a 3Pt. Contested by D'Angelo Iverson (3.6 feet, ZONE). Terry Simons misses. Rebound secured by Dwyane Dosunmu.

[09:30] Team_043 possession (Score: 57-48)
Manu Carter drives, picks up Bam Leonard. Help arrives from Jarrett McCollum! Manu Carter attempts a Layup. Contested by Jarrett McCollum (2.8 feet, MAN). Manu Carter misses. Rebound secured by Terry Simons.

[09:15] Team_020 possession (Score: 57-48)
Terry Simons attempts a Layup. BLOCKED BY D'ANGELO IVERSON! Ball is loose! Offensive rebound by Trae Curry! Trae Curry kicks it out.

[09:04] Team_020 possession (Score: 57-48)
James Cunningham attempts a 3Pt. Contested by D'Angelo Iverson (3.2 feet, ZONE). James Cunningham misses. Offensive rebound by Bam Leonard! Bam Leonard puts it back in!
Score: 59-48

[08:50] Team_043 possession (Score: 59-48)
D'Angelo Iverson attempts a Layup. Contested by Terry Simons (4.3 feet, MAN). D'ANGELO IVERSON MAKES IT! Assist: Manu Carter
Score: 59-50

[08:36] Team_020 possession (Score: 59-50)
FOUL! Shooting foul on Manu Carter. Trae Curry to the line for 2 free throws. [Team fouls: 4] (Manu Carter: 4 personal fouls)   FT 1/2: GOOD   FT 2/2: GOOD Trae Curry makes 2/2 from the line.
Score: 61-50

[08:18] Team_043 possession (Score: 61-50)
Manu Carter attempts a 3Pt. Contested by Bam Leonard (2.8 feet, ZONE). Manu Carter misses. Rebound secured by Bam Leonard.

[08:06] Team_020 possession (Score: 61-50)
FOUL! Holding foul on Malcolm Murray. [IN THE BONUS! 5 team fouls] Jarrett McCollum to the line for 2 free throws. (Malcolm Murray: 1 personal fouls)   FT 1/2: GOOD   FT 2/2: GOOD Jarrett McCollum makes 2/2 from the line.
Score: 63-50

[07:48] Team_043 possession (Score: 63-50)
D'Angelo Iverson attempts a 3Pt. Contested by Terry Simons (4.3 feet, MAN). D'Angelo Iverson misses. Rebound secured by Bam Leonard.

[07:32] Team_020 possession (Score: 63-50)
Jarrett McCollum attempts a Layup. BLOCKED BY MALCOLM MURRAY! Ball is loose! Rebound secured by D'Angelo Iverson.

[07:18] Team_043 possession (Score: 63-50)
Magic Durant attempts a Midrange. Contested by James Cunningham (5.0 feet, MAN). Magic Durant misses. Rebound secured by Terry Simons.

[07:05] Team_020 possession (Score: 63-50)
FOUL! Holding foul on Malcolm Murray. [IN THE BONUS! 6 team fouls] Jarrett McCollum to the line for 2 free throws. (Malcolm Murray: 2 personal fouls)   FT 1/2: GOOD   FT 2/2: GOOD Jarrett McCollum makes 2/2 from the line.
Score: 65-50

[06:49] Team_043 possession (Score: 65-50)
Magic Durant attempts a 3Pt. Contested by James Cunningham (5.0 feet, MAN). Magic Durant misses. FOUL! Loose ball foul on Trae Curry during the rebound battle. [Team fouls: 3] No free throws, side out. (Trae Curry: 1 personal fouls)

[06:37] Team_043 possession (Score: 65-50)
D'Angelo Iverson attempts a 3Pt. Contested by Jarrett McCollum (4.4 feet, ZONE). D'Angelo Iverson misses. Rebound secured by Bam Leonard.

[06:22] Team_020 possession (Score: 65-50)
Trae Curry drives, Dwyane Dosunmu stays with him. Trae Curry attempts a Layup. Contested by Dwyane Dosunmu (5.2 feet, ZONE). TRAE CURRY MAKES IT! Assist: Bam Leonard
Score: 67-50

[06:02] Team_043 possession (Score: 67-50)
Malcolm Murray attempts a Layup. BLOCKED BY TERRY SIMONS! Ball is loose! Offensive rebound by D'Angelo Iverson! D'Angelo Iverson kicks it out.

[05:50] Team_043 possession (Score: 67-50)
FOUL! Holding foul on Bam Leonard. [Team fouls: 4] No free throws, side out. (Bam Leonard: 2 personal fouls)

[05:33] Team_043 possession (Score: 67-50)
Dwyane Dosunmu drives, Bam Leonard stays with him. Dwyane Dosunmu attempts a Dunk. Contested by Bam Leonard (2.3 feet, MAN). DWYANE DOSUNMU MAKES IT! Assist: Malcolm Murray
Score: 67-52

[05:19] Team_020 possession (Score: 67-52)
Terry Simons attempts a Midrange. Contested by D'Angelo Iverson (3.6 feet, ZONE). Terry Simons misses. Offensive rebound by Trae Curry! Trae Curry puts it back in!
Score: 69-52

[05:04] Team_043 possession (Score: 69-52)
D'Angelo Iverson attempts a Midrange. Contested by Bam Leonard (2.4 feet, ZONE). D'Angelo Iverson misses. Rebound secured by Bam Leonard.

[04:46] Team_020 possession (Score: 69-52)
Jarrett McCollum attempts a 3Pt. Contested by Malcolm Murray (3.9 feet, MAN). Jarrett McCollum misses. Rebound secured by Dwyane Dosunmu.

[04:29] Team_043 possession (Score: 69-52)
Dwyane Dosunmu attempts a Midrange. Contested by Bam Leonard (2.4 feet, ZONE). DWYANE DOSUNMU MAKES IT! Assist: Malcolm Murray
Score: 69-54

[04:14] Team_020 possession (Score: 69-54)
James Cunningham attempts a 3Pt. Contested by Magic Durant (5.5 feet, MAN). James Cunningham misses. Rebound secured by Dwyane Dosunmu.

[04:00] Team_043 possession (Score: 69-54)
Malcolm Murray drives to the basket... Malcolm Murray throws a bad pass! Stolen by Trae Curry! TURNOVER! (live ball)

[03:42] Team_020 possession (Score: 69-54)
Terry Simons attempts a 3Pt. Contested by D'Angelo Iverson (3.6 feet, ZONE). Terry Simons misses. Rebound secured by Dwyane Dosunmu.

[03:32] Team_043 possession (Score: 69-54)
Malcolm Murray drives, Jarrett McCollum stays with him. Malcolm Murray attempts a Dunk. Contested by Jarrett McCollum (4.6 feet, MAN). Malcolm Murray misses. Rebound secured by Trae Curry.

[03:19] Team_020 possession (Score: 69-54)
FOUL! Holding foul on Manu Carter. [IN THE BONUS! 7 team fouls] Trae Curry to the line for 2 free throws. (Manu Carter: 5 personal fouls)   FT 1/2: GOOD   FT 2/2: GOOD Trae Curry makes 2/2 from the line.
Score: 71-54

[03:04] Team_043 possession (Score: 71-54)
Malcolm Murray attempts a Layup. Contested by Trae Curry (4.9 feet, ZONE). MALCOLM MURRAY MAKES IT! Assist: Magic Durant
Score: 71-56

[02:50] Team_020 possession (Score: 71-56)
Trae Curry attempts a 3Pt. Contested by Manu Carter (4.8 feet, MAN). Trae Curry misses. Rebound secured by Dwyane Dosunmu.

[02:33] Team_043 possession (Score: 71-56)
Magic Durant attempts a 3Pt. Contested by Bam Leonard (2.6 feet, ZONE). Magic Durant misses. Rebound secured by Trae Curry.

[02:19] Team_020 possession (Score: 71-56)
Terry Simons attempts a 3Pt. Contested by D'Angelo Iverson (3.8 feet, MAN). TERRY SIMONS MAKES IT! Assist: James Cunningham
Score: 74-56

[02:08] Team_043 possession (Score: 74-56)
Manu Carter attempts a 3Pt. Contested by Bam Leonard (3.2 feet, MAN). Manu Carter misses. FOUL! Loose ball foul on Terry Simons during the rebound battle. [IN THE BONUS! 5 team fouls] Manu Carter to the line for 2 free throws. (Terry Simons: 2 personal fouls)   FT 1/2: GOOD   FT 2/2: GOOD Manu Carter makes 2/2 from the line.
Score: 74-58

[01:55] Team_020 possession (Score: 74-58)
James Cunningham drives and kicks out. Terry Simons attempts a Midrange. Contested by D'Angelo Iverson (3.2 feet, MAN). TERRY SIMONS MAKES IT! Assist: Trae Curry
Score: 76-58

[01:39] Team_043 possession (Score: 76-58)
Malcolm Murray drives, Trae Curry stays with him. Malcolm Murray attempts a Layup. Contested by Trae Curry (5.1 feet, ZONE). MALCOLM MURRAY MAKES IT! Assist: D'Angelo Iverson
Score: 76-60

[01:27] Team_020 possession (Score: 76-60)
Terry Simons drives to the basket... Terry Simons loses the ball! Stripped by Manu Carter! TURNOVER! (live ball)

[01:12] Team_043 possession (Score: 76-60)
Dwyane Dosunmu attempts a 3Pt. Contested by Jarrett McCollum (4.8 feet, ZONE). Dwyane Dosunmu misses. Rebound secured by Trae Curry.

[00:56] Team_020 possession (Score: 76-60)
Jarrett McCollum attempts a 3Pt. Contested by D'Angelo Iverson (3.4 feet, ZONE). Jarrett McCollum misses. Rebound secured by Manu Carter.

[00:38] Team_043 possession (Score: 76-60)
Dwyane Dosunmu attempts a 3Pt. Contested by Bam Leonard (3.0 feet, MAN). Dwyane Dosunmu misses. Rebound secured by Bam Leonard.

[00:28] Team_020 possession (Score: 76-60)
Terry Simons attempts a Midrange. Contested by D'Angelo Iverson (4.0 feet, MAN). TERRY SIMONS MAKES IT! Assist: Jarrett McCollum
Score: 78-60

[00:19] Team_043 possession (Score: 78-60)
Magic Durant attempts a 3Pt. Contested by James Cunningham (5.4 feet, MAN). Magic Durant misses. Rebound secured by Bam Leonard.

[00:04] Team_020 possession (Score: 78-60)
James Cunningham drives, Magic Durant stays with him. James Cunningham attempts a Layup. Contested by Magic Durant (5.9 feet, MAN). JAMES CUNNINGHAM MAKES IT!
Score: 80-60

================================================================================
                              3RD QUARTER COMPLETE                              
================================================================================

3RD QUARTER SCORE: Team_020 29, Team_043 12

BOX SCORE:
================================================================================

Team_020
--------------------------------------------------------------------------------
Player                MIN  PTS  REB  AST  TO      FG   FG%      3P   3P%
--------------------------------------------------------------------------------
Trae Curry             31   12    7    1   0   5/6    83.3     0/0   0.0
Terry Simons           31    7    2    0   0   3/5    60.0     0/0   0.0
Bam Leonard            27    4    9    1   0   2/2   100.0     0/0   0.0
Jarrett McCollum       31    4    0    1   0   2/5    40.0     0/0   0.0
James Cunningham       31    2    0    1   0   1/3    33.3     0/0   0.0

TEAM: FG: 13/21 (61.9%), 3PT: 3/9 (33.3%), REB: 19 (5 off, 14 def), AST: 4, TO: 2
TEAM FOULS: 5 [Team_043 in BONUS]


Team_043
--------------------------------------------------------------------------------
Player                MIN  PTS  REB  AST  TO      FG   FG%      3P   3P%
--------------------------------------------------------------------------------
Dwyane Dosunmu         31    4    5    0   0   2/4    50.0     0/0   0.0
Malcolm Murray         31    4    0    2   0   2/3    66.7     0/0   0.0
Manu Carter            31    2    1    1   0   1/4    25.0     0/0   0.0
D'Angelo Iverson       31    2    5    1   0   1/6    16.7     0/0   0.0
Magic Durant           31    0    0    1   0   0/3     0.0     0/0   0.0

TEAM: FG: 6/20 (30.0%), 3PT: 1/10 (10.0%), REB: 10 (3 off, 7 def), AST: 5, TO: 2
TEAM FOULS: 7 [Team_020 in BONUS]

================================================================================

================================================================================
                       4TH QUARTER - Team_020 vs Team_043                       
================================================================================

[12:00] Team_020 possession (Score: 80-60)
FOUL! Shooting foul on D'Angelo Iverson. Terry Simons to the line for 2 free throws. [Team fouls: 1] (D'Angelo Iverson: 1 personal fouls)   FT 1/2: GOOD   FT 2/2: GOOD Terry Simons makes 2/2 from the line.
Score: 82-60

[11:48] Team_043 possession (Score: 82-60)
Magic Durant attempts a Layup. BLOCKED BY JARRETT MCCOLLUM! Ball goes out off Jarrett McCollum. Magic Durant's ball!

[11:32] Team_043 possession (Score: 82-60)
D'Angelo Iverson attempts a Midrange. Contested by Terry Simons (4.7 feet, MAN). D'Angelo Iverson misses. Rebound secured by Bam Leonard.

[11:22] Team_020 possession (Score: 82-60)
Terry Simons attempts a Midrange. Contested by Manu Carter (5.2 feet, ZONE). Terry Simons misses. Rebound secured by Manu Carter.

[11:05] Team_043 possession (Score: 82-60)
FOUL! Reach-in foul on Trae Curry during the drive. [Team fouls: 1] No free throws, side out. (Trae Curry: 1 personal fouls)

[10:51] Team_043 possession (Score: 82-60)
D'Angelo Iverson attempts a 3Pt. Contested by Terry Simons (4.8 feet, MAN). D'Angelo Iverson misses. Rebound secured by Trae Curry.

[10:39] Team_020 possession (Score: 82-60)
Trae Curry drives, Manu Carter stays with him. Trae Curry attempts a Dunk. Contested by Manu Carter (5.1 feet, ZONE). Trae Curry misses. Rebound secured by Manu Carter.

[10:20] Team_043 possession (Score: 82-60)
Dwyane Dosunmu attempts a 3Pt. Contested by Terry Simons (4.8 feet, ZONE). DWYANE DOSUNMU MAKES IT! Assist: Manu Carter
Score: 82-63

[10:10] Team_020 possession (Score: 82-63)
Jarrett McCollum drives, Malcolm Murray stays with him. Jarrett McCollum attempts a Layup. Contested by Malcolm Murray (4.3 feet, MAN). Jarrett McCollum misses. Offensive rebound by Bam Leonard! Bam Leonard puts it back in!
Score: 84-63

[09:55] Team_043 possession (Score: 84-63)
Magic Durant attempts a Midrange. Contested by James Cunningham (5.4 feet, ZONE). Magic Durant misses. Rebound secured by Bam Leonard.

[09:41] Team_020 possession (Score: 84-63)
Trae Curry attempts a Layup. Contested by Manu Carter (5.2 feet, ZONE). Trae Curry misses. Rebound secured by D'Angelo Iverson.

[09:27] Team_043 possession (Score: 84-63)
D'Angelo Iverson attempts a Midrange. Contested by Jarrett McCollum (5.1 feet, ZONE). D'ANGELO IVERSON MAKES IT!
Score: 84-65

[09:14] Team_020 possession (Score: 84-65)
James Cunningham attempts a Midrange. Wide open! Magic Durant is 6.0 feet away. [MAN] James Cunningham misses. Offensive rebound by Bam Leonard! Bam Leonard puts it back in!
Score: 86-65

[08:58] Team_043 possession (Score: 86-65)
Dwyane Dosunmu throws a bad pass! Stolen by Bam Leonard! TURNOVER! (live ball)

[08:44] Team_020 possession (Score: 86-65)
Terry Simons drives to the basket... Terry Simons loses the ball! Stripped by D'Angelo Iverson! TURNOVER! (live ball)

[08:29] Team_043 possession (Score: 86-65)
Dwyane Dosunmu attempts a Midrange. Contested by James Cunningham (5.6 feet, ZONE). DWYANE DOSUNMU MAKES IT!
Score: 86-67

[08:17] Team_020 possession (Score: 86-67)
FOUL! Offensive foul on Terry Simons! D'Angelo Iverson drew the charge! [Team fouls: 2] (Terry Simons: 1 personal fouls) TURNOVER! (dead ball)

[08:05] Team_043 possession (Score: 86-67)
Manu Carter attempts a 3Pt. Contested by Bam Leonard (3.9 feet, ZONE). Manu Carter misses. Rebound secured by Bam Leonard.

[07:49] Team_020 possession (Score: 86-67)
Trae Curry attempts a 3Pt. Contested by D'Angelo Iverson (4.1 feet, ZONE). Trae Curry misses. Rebound secured by D'Angelo Iverson.

[07:34] Team_043 possession (Score: 86-67)
Dwyane Dosunmu attempts a 3Pt. Contested by Bam Leonard (3.5 feet, ZONE). Dwyane Dosunmu misses. Rebound secured by Trae Curry.

[07:16] Team_020 possession (Score: 86-67)
Terry Simons attempts a Layup. BLOCKED BY MANU CARTER! Ball is loose! Rebound secured by Manu Carter.

[07:07] Team_043 possession (Score: 86-67)
Malcolm Murray attempts a Midrange. Contested by Jarrett McCollum (5.4 feet, MAN). Malcolm Murray misses. Rebound secured by Trae Curry.

[06:53] Team_020 possession (Score: 86-67)
James Cunningham throws a bad pass out of bounds! TURNOVER! (dead ball)

[06:53] Substitution (Team_020): Jarrett McCollum OUT → Franz Doncic IN (stamina_rule2)

[06:53] Substitution (Team_020): James Cunningham OUT → Stephen Parker IN (stamina_rule2)

[06:53] Substitution (Team_020): Terry Simons OUT → Victor Holiday IN (stamina_rule2)

[06:53] Substitution (Team_020): Bam Leonard OUT → Cole Barnes IN (stamina_rule2)

[06:53] Substitution (Team_020): Trae Curry OUT → Miles Siakam IN (stamina_rule2)

[06:53] Substitution (Team_043): Malcolm Murray OUT → Jabari Holiday IN (stamina_rule2)

[06:53] Substitution (Team_043): Magic Durant OUT → Ben LaVine IN (stamina_rule2)

[06:53] Substitution (Team_043): D'Angelo Iverson OUT → Dirk Herro IN (stamina_rule2)

[06:53] Substitution (Team_043): Manu Carter OUT → Joel Murray IN (stamina_rule2)

[06:53] Substitution (Team_043): Dwyane Dosunmu OUT → Terry Randle IN (stamina_rule2)

[06:38] Team_043 possession (Score: 86-67)
Ben LaVine attempts a 3Pt. Contested by Stephen Parker (5.8 feet, MAN). Ben LaVine misses. Rebound secured by Miles Siakam.

[06:23] Team_020 possession (Score: 86-67)
Victor Holiday makes the Dunk and draws the foul on Terry Randle! And-1! Victor Holiday to the line for 1. [Team fouls: 2] (Terry Randle: 1 personal fouls)   FT 1/1: GOOD Victor Holiday makes 1/1 from the line.
Score: 89-67

[06:12] Team_043 possession (Score: 89-67)
Terry Randle drives and kicks out. Ben LaVine attempts a 3Pt. Contested by Victor Holiday (4.2 feet, ZONE). Ben LaVine misses. Rebound secured by Victor Holiday.

[06:00] Team_020 possession (Score: 89-67)
Miles Siakam attempts a Layup. Contested by Terry Randle (4.5 feet, MAN). Miles Siakam misses. Rebound secured by Terry Randle.

[05:46] Team_043 possession (Score: 89-67)
Terry Randle makes the Layup and draws the foul on Miles Siakam! And-1! Terry Randle to the line for 1. [Team fouls: 3] (Miles Siakam: 1 personal fouls)   FT 1/1: GOOD Terry Randle makes 1/1 from the line.
Score: 89-70

[05:34] Team_020 possession (Score: 89-70)
Cole Barnes throws a bad pass! Stolen by Joel Murray! TURNOVER! (live ball)

[05:24] Team_043 possession (Score: 89-70)
Joel Murray attempts a 3Pt. Contested by Cole Barnes (5.3 feet, MAN). Joel Murray misses. Rebound secured by Miles Siakam.

[05:04] Team_020 possession (Score: 89-70)
Franz Doncic drives and kicks out. Franz Doncic attempts a 3Pt. Contested by Jabari Holiday (4.5 feet, MAN). FRANZ DONCIC MAKES IT! Assist: Miles Siakam
Score: 92-70

[04:53] Team_043 possession (Score: 92-70)
Jabari Holiday drives, picks up Miles Siakam. Help arrives from Franz Doncic! Jabari Holiday attempts a Layup. Contested by Franz Doncic (4.4 feet, ZONE). Jabari Holiday misses. Rebound secured by Victor Holiday.

[04:38] Team_020 possession (Score: 92-70)
Franz Doncic drives and kicks out. Miles Siakam attempts a 3Pt. Contested by Dirk Herro (4.0 feet, ZONE). Miles Siakam misses. Rebound secured by Dirk Herro.

[04:22] Team_043 possession (Score: 92-70)
Jabari Holiday attempts a Midrange. Contested by Cole Barnes (5.4 feet, ZONE). Jabari Holiday misses. Rebound secured by Miles Siakam.

[04:08] Team_020 possession (Score: 92-70)
Stephen Parker attempts a Layup. BLOCKED BY BEN LAVINE! Ball is loose! Rebound secured by Ben LaVine.

[03:54] Team_043 possession (Score: 92-70)
Jabari Holiday drives to the basket... Jabari Holiday throws a bad pass out of bounds! TURNOVER! (dead ball)

[03:40] Team_020 possession (Score: 92-70)
FOUL! Reach-in foul on Joel Murray during the drive. [Team fouls: 3] No free throws, side out. (Joel Murray: 1 personal fouls)

[03:21] Team_020 possession (Score: 92-70)
Cole Barnes attempts a Midrange. Contested by Joel Murray (5.8 feet, MAN). COLE BARNES MAKES IT! Assist: Victor Holiday
Score: 94-70

[03:05] Team_043 possession (Score: 94-70)
Dirk Herro attempts a 3Pt. Contested by Stephen Parker (5.7 feet, ZONE). Dirk Herro misses. Rebound secured by Cole Barnes.

[02:53] Team_020 possession (Score: 94-70)
Miles Siakam attempts a Layup. Contested by Joel Murray (5.9 feet, ZONE). Miles Siakam misses. Rebound secured by Ben LaVine.

[02:35] Team_043 possession (Score: 94-70)
Dirk Herro attempts a Layup. Contested by Miles Siakam (4.3 feet, ZONE). Dirk Herro misses. FOUL! Loose ball foul on Victor Holiday during the rebound battle. [Team fouls: 4] No free throws, side out. (Victor Holiday: 1 personal fouls)

[02:21] Team_043 possession (Score: 94-70)
Dirk Herro drives, Miles Siakam stays with him. Dirk Herro attempts a Layup. Contested by Miles Siakam (4.3 feet, ZONE). DIRK HERRO MAKES IT! Assist: Jabari Holiday
Score: 94-72

[02:06] Team_020 possession (Score: 94-72)
Miles Siakam drives and kicks out. Miles Siakam attempts a 3Pt. Contested by Dirk Herro (4.0 feet, ZONE). Miles Siakam misses. Rebound secured by Terry Randle.

[01:52] Team_043 possession (Score: 94-72)
Joel Murray drives to the basket... Joel Murray throws a bad pass out of bounds! TURNOVER! (dead ball)

[01:37] Team_020 possession (Score: 94-72)
FOUL! Holding foul on Dirk Herro. [Team fouls: 4] No free throws, side out. (Dirk Herro: 1 personal fouls)

[01:20] Team_020 possession (Score: 94-72)
Miles Siakam attempts a 3Pt. Contested by Terry Randle (4.5 feet, MAN). Miles Siakam misses. Offensive rebound by Miles Siakam! Miles Siakam kicks it out.

[01:05] Team_020 possession (Score: 94-72)
Miles Siakam attempts a Midrange. Contested by Terry Randle (4.5 feet, MAN). MILES SIAKAM MAKES IT! Assist: Stephen Parker
Score: 96-72

[00:50] Team_043 possession (Score: 96-72)
Dirk Herro drives, Victor Holiday stays with him. Dirk Herro attempts a Layup. Contested by Victor Holiday (4.5 feet, MAN). DIRK HERRO MAKES IT! Assist: Terry Randle
Score: 96-74

[00:35] Team_020 possession (Score: 96-74)
Franz Doncic drives and kicks out. Stephen Parker attempts a 3Pt. Contested by Dirk Herro (4.0 feet, ZONE). Stephen Parker misses. Rebound secured by Terry Randle.

[00:22] Team_043 possession (Score: 96-74)
Dirk Herro attempts a 3Pt. Contested by Victor Holiday (4.5 feet, MAN). Dirk Herro misses. Rebound secured by Victor Holiday.

[00:07] Team_020 possession (Score: 96-74)
Stephen Parker attempts a Layup. Contested by Terry Randle (4.5 feet, ZONE). STEPHEN PARKER MAKES IT! Assist: Cole Barnes
Score: 98-74

================================================================================
                              4TH QUARTER COMPLETE                              
================================================================================

4TH QUARTER SCORE: Team_020 18, Team_043 14

BOX SCORE:
================================================================================

Team_020
--------------------------------------------------------------------------------
Player                MIN  PTS  REB  AST  TO      FG   FG%      3P   3P%
--------------------------------------------------------------------------------
Bam Leonard            32    4    5    0   0   2/2   100.0     0/0   0.0
Victor Holiday         12    3    3    1   0   1/1   100.0     0/0   0.0
Franz Doncic           16    3    0    0   0   1/3    33.3     0/0   0.0
Terry Simons           37    2    0    0   0   1/3    33.3     0/0   0.0
Miles Siakam           12    2    4    1   0   1/4    25.0     0/0   0.0
Stephen Parker         12    2    0    1   0   1/2    50.0     0/0   0.0
Cole Barnes            12    2    1    1   0   1/1   100.0     0/0   0.0
Trae Curry             37    0    3    0   0   0/3     0.0     0/0   0.0

TEAM: FG: 8/19 (42.1%), 3PT: 0/1 (0.0%), REB: 16 (3 off, 13 def), AST: 4, TO: 4
TEAM FOULS: 4


Team_043
--------------------------------------------------------------------------------
Player                MIN  PTS  REB  AST  TO      FG   FG%      3P   3P%
--------------------------------------------------------------------------------
Dwyane Dosunmu         37    5    0    0   0   2/3    66.7     0/0   0.0
Dirk Herro             12    4    1    0   0   2/4    50.0     0/0   0.0
Terry Randle           12    3    4    1   0   1/2    50.0     0/0   0.0
D'Angelo Iverson       37    2    2    0   0   1/3    33.3     0/0   0.0
Manu Carter            37    0    3    1   0   0/1     0.0     0/0   0.0
Magic Durant           37    0    0    0   0   0/1     0.0     0/0   0.0
Malcolm Murray         37    0    0    0   0   0/1     0.0     0/0   0.0
Ben LaVine             12    0    2    0   0   0/1     0.0     0/0   0.0
Joel Murray            12    0    0    0   0   0/1     0.0     0/0   0.0
Jabari Holiday         12    0    0    1   0   0/2     0.0     0/0   0.0

TEAM: FG: 6/19 (31.6%), 3PT: 1/8 (12.5%), REB: 12 (1 off, 11 def), AST: 3, TO: 3
TEAM FOULS: 4

================================================================================

================================================================================
                               FULL GAME COMPLETE                               
================================================================================

FINAL SCORE: Team_020 98, Team_043 74

SCORING BY QUARTER:
--------------------------------------------------------------------------------
Team                     Q1     Q2     Q3     Q4    FINAL
--------------------------------------------------------------------------------
Team_020                 23     28     29     18       98
Team_043                 25     23     12     14       74
--------------------------------------------------------------------------------

FULL GAME BOX SCORE:
================================================================================

Team_020
--------------------------------------------------------------------------------
Player                MIN  PTS  REB  AST  TO      FG   FG%      3P   3P%      FT STL BLK
--------------------------------------------------------------------------------
Jarrett McCollum       37    8    0    3   0   3/15   20.0   0/7     0.0   5/6     0   1
James Cunningham       37   11    0    3   1   8/11   72.7   1/2    50.0   1/1     0   0
Terry Simons           37   15    9    2   3   9/13   69.2   3/5    60.0   4/4     0   1
Trae Curry             37   22   17    2   3   6/11   54.5   0/3     0.0   4/4     1   0
Bam Leonard            32   12   20    5   3   3/4    75.0   0/0     0.0   0/1     1   1
Franz Doncic           16   10    0    2   1   5/8    62.5   1/2    50.0   0/0     0   0
Stephen Parker         12    4    0    2   0   2/4    50.0   0/1     0.0   0/0     0   0
Victor Holiday         12    3    3    1   0   2/3    66.7   0/0     0.0   1/1     0   0
Cole Barnes            12    6    3    1   1   2/3    66.7   0/0     0.0   2/2     0   0
Miles Siakam           12    6    6    2   0   1/4    25.0   0/0     0.0   4/4     1   0

TEAM: FG: 45/80 (56.2%), 3PT: 5/20 (25.0%), REB: 59 (13 off, 46 def), AST: 23, TO: 12


Team_043
--------------------------------------------------------------------------------
Player                MIN  PTS  REB  AST  TO      FG   FG%      3P   3P%      FT STL BLK
--------------------------------------------------------------------------------
Malcolm Murray         37    9    0    4   1   5/8    62.5   2/2   100.0   0/0     0   1
Magic Durant           37    9    0    1   1   3/9    33.3   2/6    33.3   3/3     0   0
D'Angelo Iverson       37   10   11    1   0   4/14   28.6   1/6    16.7   1/1     1   1
Manu Carter            37   20    8    3   2   9/18   50.0   1/6    16.7  12/13    2   1
Dwyane Dosunmu         37   11   12    3   2   5/13   38.5   1/5    20.0   0/1     0   0
Jabari Holiday         12    0    0    1   2   0/3     0.0   0/1     0.0   0/0     0   0
Ben LaVine             12    2    3    0   2   1/2    50.0   0/1     0.0   0/0     0   2
Dirk Herro             12    4    2    0   0   2/5    40.0   0/3     0.0   0/0     0   0
Joel Murray            12    0    0    1   0   0/2     0.0   0/1     0.0   0/0     1   0
Terry Randle           12    7    6    1   0   3/5    60.0   0/1     0.0   3/3     0   1

TEAM: FG: 32/79 (40.5%), 3PT: 7/32 (21.9%), REB: 40 (7 off, 33 def), AST: 15, TO: 10

================================================================================
