================================================================================
                        FULL GAME - Team_034 vs Team_067                        
================================================================================

================================================================================
                       1ST QUARTER - Team_034 vs Team_067                       
================================================================================

[12:00] Team_034 possession (Score: 0-0)
Ben Hyland attempts a Midrange. Contested by Ben Ball (3.9 feet, ZONE). BEN HYLAND MAKES IT!
Score: 2-0

[11:47] Team_067 possession (Score: 2-0)
Manu Reaves attempts a 3Pt. Contested by Devin Poole (4.3 feet, MAN). Manu Reaves misses. Offensive rebound by Malcolm Westbrook! Malcolm Westbrook puts it back in!
Score: 2-2

[11:33] Team_034 possession (Score: 2-2)
FOUL! Holding foul on Desmond Simmons. [Team fouls: 1] No free throws, side out. (Desmond Simmons: 1 personal fouls)

[11:19] Team_034 possession (Score: 2-2)
Ben Hyland attempts a 3Pt. Contested by Wendell Antetokounmpo (4.5 feet, MAN). Ben Hyland misses. Rebound secured by Malcolm Westbrook.

[11:04] Team_067 possession (Score: 2-2)
Manu Reaves attempts a 3Pt. Contested by Devin Poole (4.3 feet, MAN). MANU REAVES MAKES IT!
Score: 2-5

[10:47] Team_034 possession (Score: 2-5)
Devin Poole drives and kicks out. Ben Hyland attempts a 3Pt. Contested by Wendell Antetokounmpo (4.4 feet, MAN). Ben Hyland misses. Rebound secured by Desmond Simmons.

[10:31] Team_067 possession (Score: 2-5)
FOUL! Shooting foul on Cole Antetokounmpo. Desmond Simmons to the line for 2 free throws. [Team fouls: 1] (Cole Antetokounmpo: 1 personal fouls)   FT 1/2: GOOD   FT 2/2: GOOD Desmond Simmons makes 2/2 from the line.
Score: 2-7

[10:14] Team_034 possession (Score: 2-7)
Anthony Bane drives and kicks out. Devin Poole attempts a 3Pt. Contested by Desmond Simmons (3.8 feet, ZONE). Devin Poole misses. Rebound secured by Malcolm Westbrook.

[10:01] Team_067 possession (Score: 2-7)
Ben Ball attempts a Midrange. Contested by Terry Doncic (4.9 feet, ZONE). BEN BALL MAKES IT!
Score: 2-9

[09:43] Team_034 possession (Score: 2-9)
Devin Poole attempts a 3Pt. Contested by Manu Reaves (3.8 feet, MAN). Devin Poole misses. Rebound secured by Desmond Simmons.

[09:29] Team_067 possession (Score: 2-9)
Wendell Antetokounmpo drives and kicks out. Manu Reaves attempts a Midrange. Contested by Ben Hyland (3.6 feet, ZONE). Manu Reaves misses. Offensive rebound by Desmond Simmons! Desmond Simmons kicks it out.

[09:16] Team_067 possession (Score: 2-9)
Manu Reaves attempts a Midrange. Contested by Ben Hyland (4.0 feet, ZONE). MANU REAVES MAKES IT!
Score: 2-11

[09:04] Team_034 possession (Score: 2-11)
Ben Hyland attempts a 3Pt. Contested by Desmond Simmons (3.9 feet, ZONE). Ben Hyland misses. Rebound secured by Malcolm Westbrook.

[08:49] Team_067 possession (Score: 2-11)
Manu Reaves drives to the basket... Manu Reaves loses control! Ball rolls out of bounds! TURNOVER! (dead ball)

[08:33] Team_034 possession (Score: 2-11)
Ben Hyland attempts a 3Pt. Contested by Desmond Simmons (3.9 feet, ZONE). Ben Hyland misses. Rebound secured by Malcolm Westbrook.

[08:23] Team_067 possession (Score: 2-11)
Desmond Simmons attempts a 3Pt. Contested by Devin Poole (4.1 feet, ZONE). Desmond Simmons misses. Offensive rebound by Malcolm Westbrook! Malcolm Westbrook puts it back in!
Score: 2-13

[08:09] Team_034 possession (Score: 2-13)
Terry Doncic drives and kicks out. Terry Doncic attempts a Midrange. Contested by Wendell Antetokounmpo (4.4 feet, ZONE). Terry Doncic misses. Rebound secured by Wendell Antetokounmpo.

[07:56] Team_067 possession (Score: 2-13)
Ben Ball makes the Midrange and draws the foul on Terry Doncic! And-1! Ben Ball to the line for 1. [Team fouls: 2] (Terry Doncic: 1 personal fouls)   FT 1/1: GOOD Ben Ball makes 1/1 from the line.
Score: 2-16

[07:43] Team_034 possession (Score: 2-16)
Cole Antetokounmpo attempts a 3Pt. Contested by Desmond Simmons (4.3 feet, ZONE). Cole Antetokounmpo misses. Rebound secured by Wendell Antetokounmpo.

[07:31] Team_067 possession (Score: 2-16)
Wendell Antetokounmpo attempts a 3Pt. Contested by Devin Poole (4.3 feet, ZONE). Wendell Antetokounmpo misses. Offensive rebound by Desmond Simmons! Desmond Simmons kicks it out.

[07:15] Team_067 possession (Score: 2-16)
Desmond Simmons attempts a Midrange. Contested by Cole Antetokounmpo (4.7 feet, MAN). Desmond Simmons misses. Rebound secured by Cole Antetokounmpo.

[07:00] Team_034 possession (Score: 2-16)
Ben Hyland commits a violation (traveling/carry)! TURNOVER! (dead ball)

[06:51] Team_067 possession (Score: 2-16)
Manu Reaves drives, Devin Poole stays with him. Manu Reaves attempts a Layup. Contested by Devin Poole (4.3 feet, MAN). MANU REAVES MAKES IT! Assist: Wendell Antetokounmpo
Score: 2-18

[06:37] Team_034 possession (Score: 2-18)
Devin Poole attempts a Midrange. Contested by Manu Reaves (3.8 feet, MAN). DEVIN POOLE MAKES IT! Assist: Cole Antetokounmpo
Score: 4-18

[06:22] Team_067 possession (Score: 4-18)
Malcolm Westbrook attempts a Midrange. Contested by Anthony Bane (5.5 feet, MAN). Malcolm Westbrook misses. Offensive rebound by Desmond Simmons! Desmond Simmons kicks it out.

[06:06] Team_067 possession (Score: 4-18)
Malcolm Westbrook drives to the basket... Malcolm Westbrook loses control! Ball rolls out of bounds! TURNOVER! (dead ball)

[05:54] Team_034 possession (Score: 4-18)
Terry Doncic attempts a Dunk. BLOCKED BY MALCOLM WESTBROOK! Ball is loose! Rebound secured by Malcolm Westbrook.

[05:39] Team_067 possession (Score: 4-18)
FOUL! Shooting foul on Anthony Bane. Malcolm Westbrook to the line for 2 free throws. [Team fouls: 3] (Anthony Bane: 1 personal fouls)   FT 1/2: MISS   FT 2/2: GOOD Malcolm Westbrook makes 1/2 from the line.
Score: 4-19

[05:27] Team_034 possession (Score: 4-19)
Anthony Bane attempts a Midrange. Contested by Wendell Antetokounmpo (4.6 feet, ZONE). Anthony Bane misses. Rebound secured by Malcolm Westbrook.

[05:09] Team_067 possession (Score: 4-19)
Ben Ball drives to the basket... Ben Ball commits a violation (traveling/carry)! TURNOVER! (dead ball)

[04:56] Team_034 possession (Score: 4-19)
Devin Poole drives and kicks out. Devin Poole attempts a 3Pt. Contested by Manu Reaves (4.0 feet, MAN). Devin Poole misses. Rebound secured by Wendell Antetokounmpo.

[04:42] Team_067 possession (Score: 4-19)
Ben Ball drives, picks up Terry Doncic. Help arrives from Ben Hyland! Ben Ball attempts a Layup. Contested by Ben Hyland (5.0 feet, ZONE). BEN BALL MAKES IT! Assist: Malcolm Westbrook
Score: 4-21

[04:26] Team_034 possession (Score: 4-21)
Devin Poole attempts a 3Pt. Contested by Manu Reaves (3.9 feet, MAN). Devin Poole misses. Rebound secured by Desmond Simmons.

[04:15] Team_067 possession (Score: 4-21)
Manu Reaves attempts a Layup. Contested by Devin Poole (4.4 feet, MAN). MANU REAVES MAKES IT!
Score: 4-23

[04:00] Team_034 possession (Score: 4-23)
Anthony Bane drives and kicks out. Ben Hyland attempts a 3Pt. Contested by Desmond Simmons (3.9 feet, ZONE). Ben Hyland misses. Rebound secured by Desmond Simmons.

[03:46] Team_067 possession (Score: 4-23)
Ben Ball drives, picks up Terry Doncic. Help arrives from Ben Hyland! Ben Ball attempts a Layup. Contested by Ben Hyland (5.1 feet, MAN). BEN BALL MAKES IT! Assist: Desmond Simmons
Score: 4-25

[03:31] Team_034 possession (Score: 4-25)
Cole Antetokounmpo attempts a 3Pt. Contested by Ben Ball (4.5 feet, ZONE). Cole Antetokounmpo misses. Rebound secured by Desmond Simmons.

[03:14] Team_067 possession (Score: 4-25)
Ben Ball drives and kicks out. Malcolm Westbrook attempts a 3Pt. Contested by Devin Poole (4.2 feet, ZONE). Malcolm Westbrook misses. Rebound secured by Cole Antetokounmpo.

[02:56] Team_034 possession (Score: 4-25)
Devin Poole makes the Layup and draws the foul on Manu Reaves! And-1! Devin Poole to the line for 1. [Team fouls: 2] (Manu Reaves: 1 personal fouls)   FT 1/1: MISS Devin Poole makes 0/1 from the line. Rebound secured by Malcolm Westbrook.
Score: 6-25

[02:42] Team_067 possession (Score: 6-25)
Wendell Antetokounmpo attempts a 3Pt. Contested by Devin Poole (4.5 feet, ZONE). WENDELL ANTETOKOUNMPO MAKES IT! Assist: Manu Reaves
Score: 6-28

[02:29] Team_034 possession (Score: 6-28)
Cole Antetokounmpo attempts a 3Pt. Contested by Desmond Simmons (4.4 feet, MAN). Cole Antetokounmpo misses. FOUL! Loose ball foul on Desmond Simmons during the rebound battle. [Team fouls: 3] No free throws, side out. (Desmond Simmons: 2 personal fouls)

[02:11] Team_034 possession (Score: 6-28)
Anthony Bane attempts a Layup. Contested by Malcolm Westbrook (4.4 feet, ZONE). Anthony Bane misses. Rebound secured by Malcolm Westbrook.

[01:56] Team_067 possession (Score: 6-28)
Desmond Simmons drives, Cole Antetokounmpo stays with him. Desmond Simmons attempts a Layup. Contested by Cole Antetokounmpo (5.0 feet, MAN). DESMOND SIMMONS MAKES IT!
Score: 6-30

[01:40] Team_034 possession (Score: 6-30)
Devin Poole drives to the basket... Devin Poole throws a bad pass! Stolen by Ben Ball! TURNOVER! (live ball)

[01:27] Team_067 possession (Score: 6-30)
Wendell Antetokounmpo makes the Layup and draws the foul on Ben Hyland! And-1! Wendell Antetokounmpo to the line for 1. [Team fouls: 4] (Ben Hyland: 1 personal fouls)   FT 1/1: GOOD Wendell Antetokounmpo makes 1/1 from the line.
Score: 6-33

[01:12] Team_034 possession (Score: 6-33)
Ben Hyland attempts a 3Pt. Contested by Wendell Antetokounmpo (5.0 feet, MAN). BEN HYLAND MAKES IT! Assist: Devin Poole
Score: 9-33

[00:55] Team_067 possession (Score: 9-33)
Malcolm Westbrook attempts a 3Pt. Contested by Anthony Bane (5.8 feet, MAN). Malcolm Westbrook misses. Offensive rebound by Desmond Simmons! Desmond Simmons kicks it out.

[00:38] Team_067 possession (Score: 9-33)
Ben Ball drives and kicks out. Malcolm Westbrook attempts a Midrange. Contested by Terry Doncic (4.6 feet, ZONE). Malcolm Westbrook misses. Offensive rebound by Desmond Simmons! Desmond Simmons kicks it out.

[00:26] Team_067 possession (Score: 9-33)
Wendell Antetokounmpo attempts a Midrange. Contested by Ben Hyland (4.4 feet, MAN). WENDELL ANTETOKOUNMPO MAKES IT!
Score: 9-35

[00:14] Team_034 possession (Score: 9-35)
Anthony Bane attempts a 3Pt. Contested by Malcolm Westbrook (4.6 feet, MAN). ANTHONY BANE MAKES IT! Assist: Ben Hyland
Score: 12-35

================================================================================
                              1ST QUARTER COMPLETE                              
================================================================================

1ST QUARTER SCORE: Team_034 12, Team_067 35

BOX SCORE:
================================================================================

Team_034
--------------------------------------------------------------------------------
Player                MIN  PTS  REB  AST  TO      FG   FG%      3P   3P%
--------------------------------------------------------------------------------
Ben Hyland             12    5    0    1   0   2/5    40.0     0/0   0.0
Anthony Bane           12    3    1    0   0   1/5    20.0     0/0   0.0
Devin Poole            12    2    0    1   0   1/6    16.7     0/0   0.0
Terry Doncic           12    0    0    0   0   0/2     0.0     0/0   0.0
Cole Antetokounmpo     12    0    2    1   0   0/2     0.0     0/0   0.0

TEAM: FG: 4/20 (20.0%), 3PT: 2/9 (22.2%), REB: 3 (1 off, 2 def), AST: 3, TO: 2
TEAM FOULS: 4


Team_067
--------------------------------------------------------------------------------
Player                MIN  PTS  REB  AST  TO      FG   FG%      3P   3P%
--------------------------------------------------------------------------------
Manu Reaves            12    9    0    1   0   4/4   100.0     0/0   0.0
Ben Ball               12    9    0    0   0   4/5    80.0     0/0   0.0
Wendell Antetokounmpo   12    8    3    1   0   3/3   100.0     0/0   0.0
Malcolm Westbrook      12    5   10    1   0   3/3   100.0     0/0   0.0
Desmond Simmons        12    4   10    1   0   2/3    66.7     0/0   0.0

TEAM: FG: 16/18 (88.9%), 3PT: 4/4 (100.0%), REB: 23 (7 off, 16 def), AST: 4, TO: 3
TEAM FOULS: 3

================================================================================

================================================================================
                       2ND QUARTER - Team_034 vs Team_067                       
================================================================================

[12:00] Team_034 possession (Score: 12-35)
Cole Antetokounmpo attempts a 3Pt. Contested by Desmond Simmons (4.4 feet, MAN). Cole Antetokounmpo misses. Rebound secured by Malcolm Westbrook.

[11:46] Team_067 possession (Score: 12-35)
Ben Ball attempts a Midrange. Contested by Terry Doncic (5.2 feet, MAN). Ben Ball misses. Offensive rebound by Malcolm Westbrook! Malcolm Westbrook puts it back in!
Score: 12-37

[11:33] Team_034 possession (Score: 12-37)
Anthony Bane drives and kicks out. Terry Doncic makes the 3Pt and draws the foul on Ben Ball! And-1! Terry Doncic to the line for 1. [Team fouls: 1] (Ben Ball: 1 personal fouls)   FT 1/1: GOOD Terry Doncic makes 1/1 from the line.
Score: 16-37

[11:18] Team_067 possession (Score: 16-37)
Ben Ball attempts a Layup. Contested by Terry Doncic (5.3 feet, MAN). BEN BALL MAKES IT! Assist: Desmond Simmons
Score: 16-39

[11:01] Team_034 possession (Score: 16-39)
Cole Antetokounmpo makes the Layup and draws the foul on Malcolm Westbrook! And-1! Cole Antetokounmpo to the line for 1. [Team fouls: 2] (Malcolm Westbrook: 1 personal fouls)   FT 1/1: GOOD Cole Antetokounmpo makes 1/1 from the line.
Score: 19-39

[10:45] Team_067 possession (Score: 19-39)
Malcolm Westbrook drives to the basket... Malcolm Westbrook throws a bad pass out of bounds! TURNOVER! (dead ball)

[10:45] Substitution (Team_034): Devin Poole OUT → Manu Jokic IN (stamina_rule2)

[10:45] Substitution (Team_034): Ben Hyland OUT → Damian Turner IN (stamina_rule2)

[10:45] Substitution (Team_034): Cole Antetokounmpo OUT → Vince Paul IN (stamina_rule2)

[10:45] Substitution (Team_034): Terry Doncic OUT → Nikola Wagner IN (stamina_rule2)

[10:45] Substitution (Team_034): Anthony Bane OUT → Carmelo Anunoby IN (stamina_rule2)

[10:45] Substitution (Team_067): Manu Reaves OUT → James Rozier IN (stamina_rule2)

[10:45] Substitution (Team_067): Wendell Antetokounmpo OUT → Anfernee Wagner IN (stamina_rule2)

[10:45] Substitution (Team_067): Desmond Simmons OUT → Kyle Leonard IN (stamina_rule2)

[10:45] Substitution (Team_067): Ben Ball OUT → Kristaps Davis IN (stamina_rule2)

[10:45] Substitution (Team_067): Malcolm Westbrook OUT → Zach DeRozan IN (stamina_rule2)

[10:28] Team_034 possession (Score: 19-39)
Damian Turner attempts a 3Pt. Contested by Anfernee Wagner (4.1 feet, ZONE). DAMIAN TURNER MAKES IT! Assist: Nikola Wagner
Score: 22-39

[10:09] Team_067 possession (Score: 22-39)
FOUL! Holding foul on Manu Jokic. [Team fouls: 1] No free throws, side out. (Manu Jokic: 1 personal fouls)

[09:59] Team_067 possession (Score: 22-39)
Kyle Leonard attempts a Layup. Contested by Vince Paul (4.6 feet, MAN). KYLE LEONARD MAKES IT!
Score: 22-41

[09:41] Team_034 possession (Score: 22-41)
Carmelo Anunoby makes the Layup and draws the foul on Kristaps Davis! And-1! Carmelo Anunoby to the line for 1. [Team fouls: 3] (Kristaps Davis: 1 personal fouls)   FT 1/1: GOOD Carmelo Anunoby makes 1/1 from the line.
Score: 25-41

[09:26] Team_067 possession (Score: 25-41)
Kristaps Davis makes the Layup and draws the foul on Carmelo Anunoby! And-1! Kristaps Davis to the line for 1. [Team fouls: 2] (Carmelo Anunoby: 1 personal fouls)   FT 1/1: GOOD Kristaps Davis makes 1/1 from the line.
Score: 25-44

[09:12] Team_034 possession (Score: 25-44)
Damian Turner attempts a 3Pt. Contested by Kristaps Davis (4.7 feet, ZONE). Damian Turner misses. Offensive rebound by Vince Paul! Vince Paul puts it back in!
Score: 27-44

[09:00] Team_067 possession (Score: 27-44)
Kyle Leonard drives and kicks out. Kyle Leonard attempts a 3Pt. Contested by Vince Paul (4.2 feet, MAN). Kyle Leonard misses. Rebound secured by Nikola Wagner.

[08:50] Team_034 possession (Score: 27-44)
Vince Paul attempts a 3Pt. Contested by Anfernee Wagner (4.1 feet, ZONE). VINCE PAUL MAKES IT! Assist: Nikola Wagner
Score: 30-44

[08:37] Team_067 possession (Score: 30-44)
Zach DeRozan drives, Carmelo Anunoby stays with him. Zach DeRozan attempts a Layup. Contested by Carmelo Anunoby (5.4 feet, ZONE). Zach DeRozan misses. Rebound secured by Carmelo Anunoby.

[08:20] Team_034 possession (Score: 30-44)
FOUL! Reach-in foul on Kristaps Davis during the drive. [Team fouls: 4] No free throws, side out. (Kristaps Davis: 2 personal fouls)

[08:05] Team_034 possession (Score: 30-44)
Vince Paul drives, Kristaps Davis stays with him. Vince Paul attempts a Dunk. Contested by Kristaps Davis (4.7 feet, ZONE). VINCE PAUL MAKES IT! Assist: Carmelo Anunoby
Score: 32-44

[07:51] Team_067 possession (Score: 32-44)
Zach DeRozan drives and kicks out. Kyle Leonard attempts a 3Pt. Contested by Vince Paul (4.2 feet, ZONE). KYLE LEONARD MAKES IT! Assist: Zach DeRozan
Score: 32-47

[07:34] Team_034 possession (Score: 32-47)
Carmelo Anunoby attempts a Midrange. Contested by Zach DeRozan (5.4 feet, MAN). Carmelo Anunoby misses. Rebound secured by Anfernee Wagner.

[07:20] Team_067 possession (Score: 32-47)
Kristaps Davis attempts a Midrange. Wide open! Nikola Wagner is 6.7 feet away. [MAN] KRISTAPS DAVIS MAKES IT! Assist: Zach DeRozan
Score: 32-49

[07:03] Team_034 possession (Score: 32-49)
Nikola Wagner attempts a 3Pt. Contested by Kristaps Davis (4.4 feet, MAN). NIKOLA WAGNER MAKES IT! Assist: Damian Turner
Score: 35-49

[06:48] Team_067 possession (Score: 35-49)
Anfernee Wagner attempts a 3Pt. Contested by Damian Turner (5.2 feet, MAN). Anfernee Wagner misses. Offensive rebound by Zach DeRozan! Zach DeRozan kicks it out.

[06:30] Team_067 possession (Score: 35-49)
Kyle Leonard makes the Midrange and draws the foul on Vince Paul! And-1! Kyle Leonard to the line for 1. [Team fouls: 3] (Vince Paul: 1 personal fouls)   FT 1/1: GOOD Kyle Leonard makes 1/1 from the line.
Score: 35-52

[06:13] Team_034 possession (Score: 35-52)
Damian Turner attempts a Midrange. Contested by Kristaps Davis (4.7 feet, ZONE). Damian Turner misses. Rebound secured by Anfernee Wagner.

[06:00] Team_067 possession (Score: 35-52)
Zach DeRozan attempts a Layup. Contested by Carmelo Anunoby (5.4 feet, ZONE). Zach DeRozan misses. Offensive rebound by Kristaps Davis! Kristaps Davis's putback is no good. Rebound secured by Carmelo Anunoby.

[05:41] Team_034 possession (Score: 35-52)
Manu Jokic attempts a 3Pt. Contested by Anfernee Wagner (3.7 feet, ZONE). Manu Jokic misses. Offensive rebound by Carmelo Anunoby! Carmelo Anunoby kicks it out.

[05:27] Team_034 possession (Score: 35-52)
Vince Paul attempts a Layup. Contested by Kyle Leonard (4.1 feet, MAN). VINCE PAUL MAKES IT! Assist: Damian Turner
Score: 37-52

[05:12] Team_067 possession (Score: 37-52)
Zach DeRozan drives, Carmelo Anunoby stays with him. Zach DeRozan attempts a Layup. Contested by Carmelo Anunoby (5.4 feet, ZONE). Zach DeRozan misses. Rebound secured by Vince Paul.

[04:54] Team_034 possession (Score: 37-52)
Manu Jokic attempts a 3Pt. Contested by James Rozier (4.1 feet, MAN). Manu Jokic misses. Offensive rebound by Carmelo Anunoby! Carmelo Anunoby kicks it out.

[04:40] Team_034 possession (Score: 37-52)
Nikola Wagner attempts a 3Pt. Contested by Anfernee Wagner (3.8 feet, ZONE). Nikola Wagner misses. Rebound secured by Kristaps Davis.

[04:24] Team_067 possession (Score: 37-52)
FOUL! Shooting foul on Vince Paul. Kyle Leonard to the line for 2 free throws. [Team fouls: 4] (Vince Paul: 2 personal fouls)   FT 1/2: GOOD   FT 2/2: GOOD Kyle Leonard makes 2/2 from the line.
Score: 37-54

[04:09] Team_034 possession (Score: 37-54)
Damian Turner attempts a 3Pt. Contested by Anfernee Wagner (4.1 feet, ZONE). DAMIAN TURNER MAKES IT! Assist: Manu Jokic
Score: 40-54

[03:50] Team_067 possession (Score: 40-54)
Anfernee Wagner attempts a 3Pt. Contested by Vince Paul (4.0 feet, ZONE). Anfernee Wagner misses. FOUL! Loose ball foul on Vince Paul during the rebound battle. [IN THE BONUS! 5 team fouls] Zach DeRozan to the line for 2 free throws. (Vince Paul: 3 personal fouls)   FT 1/2: GOOD   FT 2/2: MISS Zach DeRozan makes 1/2 from the line. Rebound secured by Carmelo Anunoby.
Score: 40-55

[03:35] Team_034 possession (Score: 40-55)
Damian Turner attempts a 3Pt. Contested by Anfernee Wagner (4.1 feet, MAN). Damian Turner misses. Rebound secured by Anfernee Wagner.

[03:22] Team_067 possession (Score: 40-55)
Kristaps Davis throws a bad pass out of bounds! TURNOVER! (dead ball)

[03:03] Team_034 possession (Score: 40-55)
Manu Jokic throws a bad pass! Stolen by James Rozier! TURNOVER! (live ball)

[02:49] Team_067 possession (Score: 40-55)
James Rozier attempts a Layup. Contested by Manu Jokic (4.8 feet, MAN). James Rozier misses. Offensive rebound by Zach DeRozan! Zach DeRozan kicks it out.

[02:33] Team_067 possession (Score: 40-55)
FOUL! Shooting foul on Vince Paul. Kyle Leonard to the line for 3 free throws. [BONUS: 6 team fouls] (Vince Paul: 4 personal fouls)   FT 1/3: GOOD   FT 2/3: GOOD   FT 3/3: GOOD Kyle Leonard makes 3/3 from the line.
Score: 40-58

[02:20] Team_034 possession (Score: 40-58)
Nikola Wagner attempts a 3Pt. Contested by Kristaps Davis (4.5 feet, MAN). Nikola Wagner misses. Rebound secured by Zach DeRozan.

[02:03] Team_067 possession (Score: 40-58)
James Rozier attempts a 3Pt. Contested by Manu Jokic (4.8 feet, MAN). James Rozier misses. Rebound secured by Vince Paul.

[01:49] Team_034 possession (Score: 40-58)
Vince Paul attempts a 3Pt. Contested by Kyle Leonard (4.2 feet, MAN). VINCE PAUL MAKES IT! Assist: Manu Jokic
Score: 43-58

[01:36] Team_067 possession (Score: 43-58)
Anfernee Wagner attempts a 3Pt. Contested by Vince Paul (4.2 feet, ZONE). Anfernee Wagner misses. Rebound secured by Vince Paul.

[01:24] Team_034 possession (Score: 43-58)
Carmelo Anunoby drives to the basket... FOUL! Offensive foul on Carmelo Anunoby! Zach DeRozan drew the charge! [Team fouls: 7] (Carmelo Anunoby: 2 personal fouls) TURNOVER! (dead ball)

[01:12] Team_067 possession (Score: 43-58)
James Rozier drives, Manu Jokic stays with him. James Rozier attempts a Layup. Contested by Manu Jokic (4.9 feet, MAN). JAMES ROZIER MAKES IT! Assist: Kristaps Davis
Score: 43-60

[00:58] Team_034 possession (Score: 43-60)
Manu Jokic attempts a 3Pt. Contested by Anfernee Wagner (4.0 feet, ZONE). Manu Jokic misses. Rebound secured by Anfernee Wagner.

[00:44] Team_067 possession (Score: 43-60)
Kyle Leonard loses the ball! Stripped by Vince Paul! TURNOVER! (live ball)

[00:27] Team_034 possession (Score: 43-60)
FOUL! Holding foul on Kyle Leonard. [IN THE BONUS! 5 team fouls] Vince Paul to the line for 2 free throws. (Kyle Leonard: 1 personal fouls)   FT 1/2: MISS   FT 2/2: MISS Vince Paul makes 0/2 from the line. Rebound secured by Anfernee Wagner.

[00:09] Team_067 possession (Score: 43-60)
James Rozier attempts a 3Pt. Contested by Manu Jokic (5.0 feet, MAN). James Rozier misses. Rebound secured by Nikola Wagner.

================================================================================
                              2ND QUARTER COMPLETE                              
================================================================================

2ND QUARTER SCORE: Team_034 31, Team_067 25

BOX SCORE:
================================================================================

Team_034
--------------------------------------------------------------------------------
Player                MIN  PTS  REB  AST  TO      FG   FG%      3P   3P%
--------------------------------------------------------------------------------
Vince Paul             11   12    4    0   0   5/5   100.0     0/0   0.0
Damian Turner          11    6    0    2   0   2/4    50.0     0/0   0.0
Terry Doncic           14    4    0    0   0   1/1   100.0     0/0   0.0
Cole Antetokounmpo     14    3    0    0   0   1/2    50.0     0/0   0.0
Nikola Wagner          11    3    2    2   0   1/3    33.3     0/0   0.0
Manu Jokic             11    0    0    2   0   0/1     0.0     0/0   0.0

TEAM: FG: 11/19 (57.9%), 3PT: 6/11 (54.5%), REB: 9 (3 off, 6 def), AST: 7, TO: 2
TEAM FOULS: 7 [Team_067 in BONUS]


Team_067
--------------------------------------------------------------------------------
Player                MIN  PTS  REB  AST  TO      FG   FG%      3P   3P%
--------------------------------------------------------------------------------
Kyle Leonard           11   13    0    0   0   5/6    83.3     0/0   0.0
Kristaps Davis         11    5    1    1   0   2/2   100.0     0/0   0.0
Carmelo Anunoby        11    3    5    1   0   1/2    50.0     0/0   0.0
Malcolm Westbrook      14    2    2    0   0   1/1   100.0     0/0   0.0
Ben Ball               14    2    0    0   0   1/1   100.0     0/0   0.0
James Rozier           11    2    0    0   0   1/3    33.3     0/0   0.0
Desmond Simmons        14    0    0    1   0   0/0     0.0     0/0   0.0
Zach DeRozan           11    0    3    2   0   0/3     0.0     0/0   0.0
Anfernee Wagner        11    0    5    0   0   0/2     0.0     0/0   0.0

TEAM: FG: 10/18 (55.6%), 3PT: 1/5 (20.0%), REB: 13 (5 off, 8 def), AST: 4, TO: 3
TEAM FOULS: 5 [Team_034 in BONUS]

================================================================================

================================================================================
                       3RD QUARTER - Team_034 vs Team_067                       
================================================================================

[12:00] Team_034 possession (Score: 43-60)
FOUL! Reach-in foul on Ben Ball during the drive. [Team fouls: 1] No free throws, side out. (Ben Ball: 1 personal fouls)

[11:49] Team_034 possession (Score: 43-60)
Terry Doncic drives to the basket... Terry Doncic throws a bad pass! Stolen by Malcolm Westbrook! TURNOVER! (live ball)

[11:35] Team_067 possession (Score: 43-60)
Ben Ball drives, Terry Doncic stays with him. Ben Ball attempts a Dunk. Contested by Terry Doncic (4.9 feet, MAN). BEN BALL MAKES IT! Assist: Manu Reaves
Score: 43-62

[11:22] Team_034 possession (Score: 43-62)
Ben Hyland attempts a 3Pt. Contested by Wendell Antetokounmpo (4.5 feet, MAN). BEN HYLAND MAKES IT! Assist: Cole Antetokounmpo
Score: 46-62

[11:09] Team_067 possession (Score: 46-62)
Ben Ball drives and kicks out. Malcolm Westbrook attempts a 3Pt. Contested by Devin Poole (3.9 feet, ZONE). Malcolm Westbrook misses. Rebound secured by Terry Doncic.

[10:56] Team_034 possession (Score: 46-62)
Devin Poole attempts a Layup. Contested by Manu Reaves (3.8 feet, MAN). Devin Poole misses. Rebound secured by Wendell Antetokounmpo.

[10:39] Team_067 possession (Score: 46-62)
Wendell Antetokounmpo attempts a 3Pt. Contested by Devin Poole (4.3 feet, ZONE). Wendell Antetokounmpo misses. Rebound secured by Terry Doncic.

[10:21] Team_034 possession (Score: 46-62)
Anthony Bane drives, Malcolm Westbrook stays with him. Anthony Bane attempts a Dunk. Contested by Malcolm Westbrook (4.1 feet, MAN). ANTHONY BANE MAKES IT!
Score: 48-62

[10:04] Team_067 possession (Score: 48-62)
Ben Ball drives, Terry Doncic stays with him. Ben Ball attempts a Layup. Contested by Terry Doncic (4.9 feet, ZONE). BEN BALL MAKES IT!
Score: 48-64

[09:50] Team_034 possession (Score: 48-64)
Cole Antetokounmpo attempts a 3Pt. Contested by Desmond Simmons (4.3 feet, MAN). Cole Antetokounmpo misses. FOUL! Loose ball foul on Wendell Antetokounmpo during the rebound battle. [Team fouls: 2] No free throws, side out. (Wendell Antetokounmpo: 1 personal fouls)

[09:37] Team_034 possession (Score: 48-64)
Ben Hyland attempts a Midrange. Contested by Desmond Simmons (3.9 feet, ZONE). Ben Hyland misses. Rebound secured by Malcolm Westbrook.

[09:22] Team_067 possession (Score: 48-64)
Ben Ball attempts a Midrange. Contested by Terry Doncic (4.9 feet, ZONE). Ben Ball misses. Rebound secured by Anthony Bane.

[09:05] Team_034 possession (Score: 48-64)
Anthony Bane attempts a Layup. Contested by Ben Ball (3.9 feet, ZONE). Anthony Bane misses. Offensive rebound by Anthony Bane! Anthony Bane kicks it out.

[08:49] Team_034 possession (Score: 48-64)
Cole Antetokounmpo attempts a Midrange. Contested by Desmond Simmons (4.3 feet, MAN). Cole Antetokounmpo misses. Rebound secured by Wendell Antetokounmpo.

[08:35] Team_067 possession (Score: 48-64)
Wendell Antetokounmpo drives, Ben Hyland stays with him. Wendell Antetokounmpo attempts a Dunk. Contested by Ben Hyland (4.0 feet, MAN). Wendell Antetokounmpo misses. Rebound secured by Cole Antetokounmpo.

[08:23] Team_034 possession (Score: 48-64)
Devin Poole attempts a 3Pt. Contested by Desmond Simmons (3.7 feet, ZONE). Devin Poole misses. FOUL! Loose ball foul on Malcolm Westbrook during the rebound battle. [Team fouls: 3] No free throws, side out. (Malcolm Westbrook: 1 personal fouls)

[08:05] Team_034 possession (Score: 48-64)
Anthony Bane attempts a Midrange. Contested by Malcolm Westbrook (4.1 feet, MAN). Anthony Bane misses. Rebound secured by Desmond Simmons.

[07:50] Team_067 possession (Score: 48-64)
FOUL! Shooting foul on Terry Doncic. Ben Ball to the line for 2 free throws. [Team fouls: 1] (Terry Doncic: 1 personal fouls)   FT 1/2: GOOD   FT 2/2: GOOD Ben Ball makes 2/2 from the line.
Score: 48-66

[07:38] Team_034 possession (Score: 48-66)
Terry Doncic attempts a 3Pt. Contested by Manu Reaves (4.0 feet, ZONE). Terry Doncic misses. Rebound secured by Malcolm Westbrook.

[07:24] Team_067 possession (Score: 48-66)
FOUL! Offensive foul on Wendell Antetokounmpo! Ben Hyland drew the charge! [Team fouls: 4] (Wendell Antetokounmpo: 2 personal fouls) TURNOVER! (dead ball)

[07:08] Team_034 possession (Score: 48-66)
Anthony Bane drives, picks up Malcolm Westbrook. Help arrives from Wendell Antetokounmpo! Anthony Bane attempts a Dunk. Contested by Wendell Antetokounmpo (4.1 feet, MAN). ANTHONY BANE MAKES IT!
Score: 50-66

[06:55] Team_067 possession (Score: 50-66)
Wendell Antetokounmpo attempts a Layup. BLOCKED BY BEN HYLAND! Ball is loose! Offensive rebound by Desmond Simmons! Desmond Simmons kicks it out.

[06:37] Team_067 possession (Score: 50-66)
Wendell Antetokounmpo attempts a 3Pt. Contested by Devin Poole (4.3 feet, ZONE). Wendell Antetokounmpo misses. Rebound secured by Terry Doncic.

[06:26] Team_034 possession (Score: 50-66)
Devin Poole attempts a 3Pt. Contested by Manu Reaves (3.8 feet, MAN). Devin Poole misses. Offensive rebound by Terry Doncic! Terry Doncic puts it back in!
Score: 52-66

[06:12] Team_067 possession (Score: 52-66)
Ben Ball attempts a 3Pt. Contested by Devin Poole (4.8 feet, ZONE). BEN BALL MAKES IT! Assist: Malcolm Westbrook
Score: 52-69

[05:59] Team_034 possession (Score: 52-69)
Terry Doncic attempts a Midrange. Contested by Desmond Simmons (3.9 feet, ZONE). Terry Doncic misses. Rebound secured by Wendell Antetokounmpo.

[05:40] Team_067 possession (Score: 52-69)
Desmond Simmons drives and kicks out. Desmond Simmons attempts a 3Pt. Contested by Cole Antetokounmpo (4.5 feet, MAN). DESMOND SIMMONS MAKES IT! Assist: Wendell Antetokounmpo
Score: 52-72

[05:27] Team_034 possession (Score: 52-72)
Terry Doncic attempts a 3Pt. Contested by Desmond Simmons (3.9 feet, ZONE). Terry Doncic misses. Rebound secured by Malcolm Westbrook.

[05:16] Team_067 possession (Score: 52-72)
FOUL! Shooting foul on Terry Doncic. Manu Reaves to the line for 2 free throws. [Team fouls: 3] (Terry Doncic: 2 personal fouls)   FT 1/2: GOOD   FT 2/2: GOOD Manu Reaves makes 2/2 from the line.
Score: 52-74

[05:01] Team_034 possession (Score: 52-74)
Anthony Bane makes the Layup and draws the foul on Malcolm Westbrook! And-1! Anthony Bane to the line for 1. [BONUS: 5 team fouls] (Malcolm Westbrook: 2 personal fouls)   FT 1/1: GOOD Anthony Bane makes 1/1 from the line.
Score: 55-74

[04:52] Team_067 possession (Score: 55-74)
Wendell Antetokounmpo attempts a Midrange. Contested by Ben Hyland (4.0 feet, MAN). Wendell Antetokounmpo misses. Rebound secured by Anthony Bane.

[04:40] Team_034 possession (Score: 55-74)
FOUL! Holding foul on Malcolm Westbrook. [IN THE BONUS! 6 team fouls] Anthony Bane to the line for 2 free throws. (Malcolm Westbrook: 3 personal fouls)   FT 1/2: GOOD   FT 2/2: GOOD Anthony Bane makes 2/2 from the line.
Score: 57-74

[04:23] Team_067 possession (Score: 57-74)
Desmond Simmons makes the Layup and draws the foul on Terry Doncic! And-1! Desmond Simmons to the line for 1. [Team fouls: 4] (Terry Doncic: 3 personal fouls)   FT 1/1: GOOD Desmond Simmons makes 1/1 from the line.
Score: 57-77

[04:08] Team_034 possession (Score: 57-77)
Devin Poole drives, Malcolm Westbrook stays with him. Devin Poole attempts a Layup. Contested by Malcolm Westbrook (4.0 feet, ZONE). Devin Poole misses. Offensive rebound by Terry Doncic! Terry Doncic's putback is no good. Offensive rebound by Anthony Bane! Anthony Bane kicks it out.

[03:54] Team_034 possession (Score: 57-77)
FOUL! Shooting foul on Manu Reaves. Devin Poole to the line for 3 free throws. [BONUS: 8 team fouls] (Manu Reaves: 1 personal fouls)   FT 1/3: GOOD   FT 2/3: GOOD   FT 3/3: MISS Devin Poole makes 2/3 from the line. Rebound secured by Desmond Simmons.
Score: 59-77

[03:37] Team_067 possession (Score: 59-77)
Malcolm Westbrook attempts a Layup. Contested by Anthony Bane (5.6 feet, MAN). MALCOLM WESTBROOK MAKES IT! Assist: Desmond Simmons
Score: 59-79

[03:22] Team_034 possession (Score: 59-79)
FOUL! Reach-in foul on Malcolm Westbrook during the drive. [IN THE BONUS! 9 team fouls] Devin Poole to the line for 2 free throws. (Malcolm Westbrook: 4 personal fouls)   FT 1/2: GOOD   FT 2/2: GOOD Devin Poole makes 2/2 from the line.
Score: 61-79

[03:06] Team_067 possession (Score: 61-79)
FOUL! Holding foul on Devin Poole. [IN THE BONUS! 5 team fouls] Manu Reaves to the line for 2 free throws. (Devin Poole: 1 personal fouls)   FT 1/2: GOOD   FT 2/2: GOOD Manu Reaves makes 2/2 from the line.
Score: 61-81

[02:50] Team_034 possession (Score: 61-81)
Terry Doncic makes the Layup and draws the foul on Ben Ball! And-1! Terry Doncic to the line for 1. [BONUS: 10 team fouls] (Ben Ball: 2 personal fouls)   FT 1/1: GOOD Terry Doncic makes 1/1 from the line.
Score: 64-81

[02:37] Team_067 possession (Score: 64-81)
Manu Reaves attempts a 3Pt. Contested by Devin Poole (4.6 feet, ZONE). MANU REAVES MAKES IT! Assist: Wendell Antetokounmpo
Score: 64-84

[02:23] Team_034 possession (Score: 64-84)
Cole Antetokounmpo attempts a Midrange. Contested by Desmond Simmons (4.4 feet, MAN). COLE ANTETOKOUNMPO MAKES IT!
Score: 66-84

[02:07] Team_067 possession (Score: 66-84)
Ben Ball attempts a Midrange. Wide open! Anthony Bane is 6.2 feet away. [ZONE] BEN BALL MAKES IT!
Score: 66-86

[01:55] Team_034 possession (Score: 66-86)
FOUL! Holding foul on Manu Reaves. [IN THE BONUS! 11 team fouls] Devin Poole to the line for 2 free throws. (Manu Reaves: 2 personal fouls)   FT 1/2: GOOD   FT 2/2: MISS Devin Poole makes 1/2 from the line. Rebound secured by Manu Reaves.
Score: 67-86

[01:42] Team_067 possession (Score: 67-86)
Manu Reaves makes the Layup and draws the foul on Anthony Bane! And-1! Manu Reaves to the line for 1. [BONUS: 6 team fouls] (Anthony Bane: 2 personal fouls)   FT 1/1: GOOD Manu Reaves makes 1/1 from the line.
Score: 67-89

[01:28] Team_034 possession (Score: 67-89)
Devin Poole attempts a 3Pt. Contested by Manu Reaves (4.2 feet, MAN). DEVIN POOLE MAKES IT!
Score: 70-89

[01:12] Team_067 possession (Score: 70-89)
Wendell Antetokounmpo drives to the basket... Wendell Antetokounmpo throws a bad pass! Stolen by Ben Hyland! TURNOVER! (live ball)

[00:56] Team_034 possession (Score: 70-89)
FOUL! Reach-in foul on Malcolm Westbrook during the drive. [IN THE BONUS! 12 team fouls] Anthony Bane to the line for 2 free throws. (Malcolm Westbrook: 5 personal fouls)   FT 1/2: MISS   FT 2/2: GOOD Anthony Bane makes 1/2 from the line.
Score: 71-89

[00:46] Team_067 possession (Score: 71-89)
Malcolm Westbrook drives and kicks out. Ben Ball attempts a 3Pt. Contested by Terry Doncic (4.6 feet, MAN). Ben Ball misses. Rebound secured by Terry Doncic.

[00:30] Team_034 possession (Score: 71-89)
Ben Hyland attempts a Midrange. Contested by Ben Ball (4.4 feet, ZONE). Ben Hyland misses. Rebound secured by Desmond Simmons.

[00:15] Team_067 possession (Score: 71-89)
FOUL! Shooting foul on Cole Antetokounmpo. Desmond Simmons to the line for 2 free throws. [BONUS: 7 team fouls] (Cole Antetokounmpo: 1 personal fouls)   FT 1/2: GOOD   FT 2/2: GOOD Desmond Simmons makes 2/2 from the line.
Score: 71-91

[00:02] Team_034 possession (Score: 71-91)
Ben Hyland attempts a 3Pt. Contested by Ben Ball (4.5 feet, ZONE). BEN HYLAND MAKES IT!
Score: 74-91

================================================================================
                              3RD QUARTER COMPLETE                              
================================================================================

3RD QUARTER SCORE: Team_034 31, Team_067 31

BOX SCORE:
================================================================================

Team_034
--------------------------------------------------------------------------------
Player                MIN  PTS  REB  AST  TO      FG   FG%      3P   3P%
--------------------------------------------------------------------------------
Anthony Bane           26   10    6    0   0   5/6    83.3     0/0   0.0
Ben Hyland             26    6    0    0   0   2/4    50.0     0/0   0.0
Terry Doncic           26    5    5    0   0   2/5    40.0     0/0   0.0
Devin Poole            26    5    0    0   0   2/4    50.0     0/0   0.0
Cole Antetokounmpo     26    2    1    1   0   1/2    50.0     0/0   0.0

TEAM: FG: 12/22 (54.5%), 3PT: 4/7 (57.1%), REB: 12 (5 off, 7 def), AST: 1, TO: 1
TEAM FOULS: 7 [Team_067 in BONUS]


Team_067
--------------------------------------------------------------------------------
Player                MIN  PTS  REB  AST  TO      FG   FG%      3P   3P%
--------------------------------------------------------------------------------
Ben Ball               26   11    0    0   0   5/7    71.4     0/0   0.0
Manu Reaves            26   10    1    1   0   4/4   100.0     0/0   0.0
Desmond Simmons        26    8    4    1   0   3/3   100.0     0/0   0.0
Malcolm Westbrook      26    2    3    1   0   1/2    50.0     0/0   0.0
Wendell Antetokounmpo   26    0    3    2   0   0/4     0.0     0/0   0.0

TEAM: FG: 13/20 (65.0%), 3PT: 2/4 (50.0%), REB: 11 (1 off, 10 def), AST: 5, TO: 2
TEAM FOULS: 12 [Team_034 in BONUS]

================================================================================

================================================================================
                       4TH QUARTER - Team_034 vs Team_067                       
================================================================================

[12:00] Substitution (Team_034): Devin Poole OUT (stamina: 66) → Manu Jokic IN (comeback_detected)

[12:00] Substitution (Team_067): Manu Reaves OUT (stamina: 67) → James Rozier IN (comeback_detected)

[12:00] Team_034 possession (Score: 74-91)
Ben Hyland attempts a 3Pt. Contested by Wendell Antetokounmpo (4.9 feet, MAN). Ben Hyland misses. Rebound secured by Malcolm Westbrook.

[11:45] Team_067 possession (Score: 74-91)
Wendell Antetokounmpo attempts a 3Pt. Contested by Ben Hyland (4.2 feet, ZONE). Wendell Antetokounmpo misses. Rebound secured by Anthony Bane.

[11:28] Team_034 possession (Score: 74-91)
Manu Jokic attempts a Midrange. Contested by Ben Ball (4.4 feet, ZONE). Manu Jokic misses. Rebound secured by Desmond Simmons.

[11:14] Team_067 possession (Score: 74-91)
FOUL! Shooting foul on Anthony Bane. Malcolm Westbrook to the line for 2 free throws. [Team fouls: 1] (Anthony Bane: 1 personal fouls)   FT 1/2: GOOD   FT 2/2: GOOD Malcolm Westbrook makes 2/2 from the line.
Score: 74-93

[10:57] Team_034 possession (Score: 74-93)
Manu Jokic attempts a 3Pt. Contested by Desmond Simmons (4.2 feet, ZONE). Manu Jokic misses. Offensive rebound by Terry Doncic! Terry Doncic puts it back in!
Score: 76-93

[10:44] Team_067 possession (Score: 76-93)
Malcolm Westbrook attempts a Layup. BLOCKED BY TERRY DONCIC! Ball is loose! Rebound secured by Cole Antetokounmpo.

[10:29] Team_034 possession (Score: 76-93)
Ben Hyland attempts a Layup. Contested by Malcolm Westbrook (4.6 feet, ZONE). BEN HYLAND MAKES IT! Assist: Cole Antetokounmpo
Score: 78-93

[10:14] Team_067 possession (Score: 78-93)
Malcolm Westbrook attempts a Midrange. Contested by Anthony Bane (5.9 feet, MAN). Malcolm Westbrook misses. Offensive rebound by James Rozier! James Rozier kicks it out.

[09:59] Team_067 possession (Score: 78-93)
FOUL! Holding foul on Cole Antetokounmpo. [Team fouls: 2] No free throws, side out. (Cole Antetokounmpo: 1 personal fouls)

[09:45] Team_067 possession (Score: 78-93)
Desmond Simmons attempts a 3Pt. Contested by Ben Hyland (4.3 feet, ZONE). Desmond Simmons misses. Rebound secured by Cole Antetokounmpo.

[09:30] Team_034 possession (Score: 78-93)
Ben Hyland attempts a Layup. BLOCKED BY WENDELL ANTETOKOUNMPO! Ball is loose! Rebound secured by Malcolm Westbrook.

[09:14] Team_067 possession (Score: 78-93)
Ben Ball drives and kicks out. Ben Ball attempts a 3Pt. Contested by Ben Hyland (4.3 feet, ZONE). BEN BALL MAKES IT! Assist: Wendell Antetokounmpo
Score: 78-96

[08:57] Team_034 possession (Score: 78-96)
Anthony Bane attempts a Layup. Contested by Malcolm Westbrook (4.8 feet, ZONE). Anthony Bane misses. Rebound secured by Desmond Simmons.

[08:44] Team_067 possession (Score: 78-96)
Malcolm Westbrook attempts a Midrange. Wide open! Anthony Bane is 6.0 feet away. [MAN] Malcolm Westbrook misses. Rebound secured by Cole Antetokounmpo.

[08:27] Team_034 possession (Score: 78-96)
Ben Hyland attempts a Midrange. Contested by James Rozier (4.0 feet, ZONE). BEN HYLAND MAKES IT!
Score: 80-96

[08:11] Team_067 possession (Score: 80-96)
Desmond Simmons makes the Layup and draws the foul on Cole Antetokounmpo! And-1! Desmond Simmons to the line for 1. [Team fouls: 3] (Cole Antetokounmpo: 2 personal fouls)   FT 1/1: GOOD Desmond Simmons makes 1/1 from the line.
Score: 80-99

[07:58] Team_034 possession (Score: 80-99)
Ben Hyland drives and kicks out. Anthony Bane attempts a Midrange. Contested by Ben Ball (4.8 feet, ZONE). ANTHONY BANE MAKES IT!
Score: 82-99

[07:41] Team_067 possession (Score: 82-99)
Ben Ball drives, Terry Doncic stays with him. Ben Ball attempts a Dunk. Contested by Terry Doncic (5.7 feet, MAN). BEN BALL MAKES IT! Assist: Wendell Antetokounmpo
Score: 82-101

[07:24] Team_034 possession (Score: 82-101)
Manu Jokic loses the ball! Stripped by James Rozier! TURNOVER! (live ball)

[07:11] Team_067 possession (Score: 82-101)
James Rozier attempts a 3Pt. Contested by Manu Jokic (4.8 feet, MAN). James Rozier misses. Rebound secured by Terry Doncic.

[06:54] Team_034 possession (Score: 82-101)
Anthony Bane attempts a Midrange. Contested by Malcolm Westbrook (5.0 feet, MAN). ANTHONY BANE MAKES IT!
Score: 84-101

[06:37] Team_067 possession (Score: 84-101)
Wendell Antetokounmpo drives and kicks out. Ben Ball attempts a 3Pt. Contested by Terry Doncic (5.2 feet, MAN). BEN BALL MAKES IT! Assist: Wendell Antetokounmpo
Score: 84-104

[06:23] Team_034 possession (Score: 84-104)
Ben Hyland attempts a 3Pt. Contested by Wendell Antetokounmpo (5.7 feet, MAN). BEN HYLAND MAKES IT! Assist: Manu Jokic
Score: 87-104

[06:09] Team_067 possession (Score: 87-104)
Ben Ball attempts a Midrange. Wide open! Cole Antetokounmpo is 6.2 feet away. [ZONE] BEN BALL MAKES IT!
Score: 87-106

[05:53] Team_034 possession (Score: 87-106)
Cole Antetokounmpo attempts a Midrange. Contested by Desmond Simmons (5.0 feet, MAN). COLE ANTETOKOUNMPO MAKES IT!
Score: 89-106

[05:42] Team_067 possession (Score: 89-106)
FOUL! Holding foul on Cole Antetokounmpo. [Team fouls: 4] No free throws, side out. (Cole Antetokounmpo: 3 personal fouls)

[05:30] Team_067 possession (Score: 89-106)
Desmond Simmons attempts a 3Pt. Contested by Cole Antetokounmpo (5.8 feet, MAN). Desmond Simmons misses. Offensive rebound by Malcolm Westbrook! Malcolm Westbrook kicks it out.

[05:16] Team_067 possession (Score: 89-106)
FOUL! Shooting foul on Cole Antetokounmpo. Desmond Simmons to the line for 3 free throws. [BONUS: 5 team fouls] (Cole Antetokounmpo: 4 personal fouls)   FT 1/3: GOOD   FT 2/3: GOOD   FT 3/3: GOOD Desmond Simmons makes 3/3 from the line.
Score: 89-109

[05:01] Team_034 possession (Score: 89-109)
Manu Jokic attempts a 3Pt. Contested by James Rozier (4.1 feet, MAN). Manu Jokic misses. Offensive rebound by Terry Doncic! Terry Doncic kicks it out.

[04:44] Team_034 possession (Score: 89-109)
FOUL! Holding foul on Wendell Antetokounmpo. [Team fouls: 1] No free throws, side out. (Wendell Antetokounmpo: 1 personal fouls)

[04:32] Team_034 possession (Score: 89-109)
Ben Hyland attempts a Midrange. Contested by Wendell Antetokounmpo (6.0 feet, MAN). Ben Hyland misses. Rebound secured by Desmond Simmons.

[04:22] Team_067 possession (Score: 89-109)
Ben Ball drives, Terry Doncic stays with him. Ben Ball attempts a Layup. Wide open! Terry Doncic is 6.1 feet away. [ZONE] BEN BALL MAKES IT! Assist: Malcolm Westbrook
Score: 89-111

[04:10] Team_034 possession (Score: 89-111)
Ben Hyland drives and kicks out. Manu Jokic attempts a 3Pt. Contested by James Rozier (4.1 feet, ZONE). MANU JOKIC MAKES IT! Assist: Cole Antetokounmpo
Score: 92-111

[03:53] Team_067 possession (Score: 92-111)
Malcolm Westbrook attempts a Midrange. Wide open! Anthony Bane is 6.5 feet away. [MAN] Malcolm Westbrook misses. Offensive rebound by James Rozier! James Rozier kicks it out.

[03:38] Team_067 possession (Score: 92-111)
James Rozier attempts a Midrange. Contested by Ben Hyland (5.2 feet, ZONE). James Rozier misses. Offensive rebound by James Rozier! James Rozier kicks it out.

[03:21] Team_067 possession (Score: 92-111)
Desmond Simmons attempts a Midrange. Wide open! Cole Antetokounmpo is 6.1 feet away. [MAN] Desmond Simmons misses. Rebound secured by Anthony Bane.

[03:04] Team_034 possession (Score: 92-111)
Cole Antetokounmpo attempts a 3Pt. Contested by Desmond Simmons (5.4 feet, ZONE). COLE ANTETOKOUNMPO MAKES IT!
Score: 95-111

[02:49] Team_067 possession (Score: 95-111)
Wendell Antetokounmpo attempts a 3Pt. Contested by Ben Hyland (5.3 feet, MAN). Wendell Antetokounmpo misses. Rebound secured by Terry Doncic.

[02:34] Team_034 possession (Score: 95-111)
Terry Doncic attempts a Midrange. Contested by Ben Ball (5.6 feet, MAN). TERRY DONCIC MAKES IT!
Score: 97-111

[02:20] Team_067 possession (Score: 97-111)
Ben Ball attempts a 3Pt. Contested by Ben Hyland (5.8 feet, ZONE). Ben Ball misses. Rebound secured by Anthony Bane.

[02:06] Team_034 possession (Score: 97-111)
Ben Hyland attempts a 3Pt. Wide open! Wendell Antetokounmpo is 6.4 feet away. [MAN] Ben Hyland misses. Rebound secured by Malcolm Westbrook.

[01:55] Team_067 possession (Score: 97-111)
Desmond Simmons drives to the basket... Desmond Simmons loses control! Ball rolls out of bounds! TURNOVER! (dead ball)

[01:55] Substitution (Team_034): Ben Hyland OUT → Damian Turner IN (stamina_rule2)

[01:55] Substitution (Team_034): Cole Antetokounmpo OUT → Vince Paul IN (stamina_rule2)

[01:55] Substitution (Team_034): Terry Doncic OUT → Nikola Wagner IN (stamina_rule2)

[01:55] Substitution (Team_034): Anthony Bane OUT → Carmelo Anunoby IN (stamina_rule2)

[01:55] Substitution (Team_067): Wendell Antetokounmpo OUT → Anfernee Wagner IN (stamina_rule2)

[01:55] Substitution (Team_067): Desmond Simmons OUT → Kyle Leonard IN (stamina_rule2)

[01:55] Substitution (Team_067): Ben Ball OUT → Kristaps Davis IN (stamina_rule2)

[01:55] Substitution (Team_067): Malcolm Westbrook OUT → Zach DeRozan IN (stamina_rule2)

[01:41] Team_034 possession (Score: 97-111)
Damian Turner attempts a 3Pt. Contested by Anfernee Wagner (4.1 feet, MAN). Damian Turner misses. Rebound secured by Kristaps Davis.

[01:25] Team_067 possession (Score: 97-111)
Kristaps Davis attempts a 3Pt. Contested by Vince Paul (4.9 feet, ZONE). KRISTAPS DAVIS MAKES IT! Assist: Zach DeRozan
Score: 97-114

[01:10] Team_034 possession (Score: 97-114)
Damian Turner attempts a Layup. Contested by Anfernee Wagner (4.1 feet, MAN). DAMIAN TURNER MAKES IT! Assist: Carmelo Anunoby
Score: 99-114

[00:59] Team_067 possession (Score: 99-114)
Kristaps Davis attempts a Midrange. Wide open! Nikola Wagner is 6.7 feet away. [MAN] Kristaps Davis misses. Rebound secured by Nikola Wagner.

[00:42] Team_034 possession (Score: 99-114)
Manu Jokic attempts a Layup. Contested by Kristaps Davis (4.3 feet, ZONE). MANU JOKIC MAKES IT!
Score: 101-114

[00:32] Team_067 possession (Score: 101-114)
Anfernee Wagner drives, Damian Turner stays with him. Anfernee Wagner attempts a Dunk. Contested by Damian Turner (5.2 feet, MAN). ANFERNEE WAGNER MAKES IT! Assist: Zach DeRozan
Score: 101-116

[00:22] Team_034 possession (Score: 101-116)
Nikola Wagner throws a bad pass! Stolen by Kristaps Davis! TURNOVER! (live ball)

[00:07] Team_067 possession (Score: 101-116)
James Rozier attempts a 3Pt. Contested by Vince Paul (4.2 feet, ZONE). James Rozier misses. Rebound secured by Nikola Wagner.

================================================================================
                              4TH QUARTER COMPLETE                              
================================================================================

4TH QUARTER SCORE: Team_034 27, Team_067 25

BOX SCORE:
================================================================================

Team_034
--------------------------------------------------------------------------------
Player                MIN  PTS  REB  AST  TO      FG   FG%      3P   3P%
--------------------------------------------------------------------------------
Ben Hyland             36    7    0    0   0   3/7    42.9     0/0   0.0
Manu Jokic             23    5    0    1   0   2/3    66.7     0/0   0.0
Cole Antetokounmpo     36    5    3    2   0   2/2   100.0     0/0   0.0
Anthony Bane           36    4    3    0   0   2/3    66.7     0/0   0.0
Terry Doncic           36    4    4    0   0   2/2   100.0     0/0   0.0
Damian Turner          12    2    0    0   0   1/2    50.0     0/0   0.0
Carmelo Anunoby        12    0    0    1   0   0/0     0.0     0/0   0.0
Nikola Wagner          12    0    2    0   0   0/0     0.0     0/0   0.0

TEAM: FG: 12/19 (63.2%), 3PT: 3/6 (50.0%), REB: 12 (2 off, 10 def), AST: 4, TO: 2
TEAM FOULS: 5 [Team_067 in BONUS]


Team_067
--------------------------------------------------------------------------------
Player                MIN  PTS  REB  AST  TO      FG   FG%      3P   3P%
--------------------------------------------------------------------------------
Ben Ball               36   12    0    0   0   5/6    83.3     0/0   0.0
Desmond Simmons        36    6    3    0   0   2/4    50.0     0/0   0.0
Kristaps Davis         12    3    1    0   0   1/2    50.0     0/0   0.0
Malcolm Westbrook      36    2    4    1   0   1/3    33.3     0/0   0.0
Anfernee Wagner        12    2    0    0   0   1/1   100.0     0/0   0.0
Wendell Antetokounmpo   36    0    0    3   0   0/2     0.0     0/0   0.0
James Rozier           23    0    3    0   0   0/2     0.0     0/0   0.0
Zach DeRozan           12    0    0    2   0   0/0     0.0     0/0   0.0

TEAM: FG: 10/20 (50.0%), 3PT: 2/8 (25.0%), REB: 11 (4 off, 7 def), AST: 6, TO: 1
TEAM FOULS: 1

================================================================================

================================================================================
                               FULL GAME COMPLETE                               
================================================================================

FINAL SCORE: Team_034 101, Team_067 116

SCORING BY QUARTER:
--------------------------------------------------------------------------------
Team                     Q1     Q2     Q3     Q4    FINAL
--------------------------------------------------------------------------------
Team_034                 12     31     31     27      101
Team_067                 35     25     31     25      116
--------------------------------------------------------------------------------

FULL GAME BOX SCORE:
================================================================================

Team_034
--------------------------------------------------------------------------------
Player                MIN  PTS  REB  AST  TO      FG   FG%      3P   3P%      FT STL BLK
--------------------------------------------------------------------------------
Ben Hyland             36   18    0    1   2   9/18   50.0   4/9    44.4   0/0     1   1
Cole Antetokounmpo     36   10    6    4   1   4/8    50.0   1/4    25.0   1/1     0   0
Terry Doncic           36   13    9    0   0   2/7    28.6   0/2     0.0   2/2     0   1
Anthony Bane           36   17   10    0   0   7/13   53.8   1/1   100.0   4/5     0   0
Devin Poole            26    7    0    1   0   4/11   36.4   2/5    40.0   5/8     0   0
Manu Jokic             23    5    0    3   3   2/4    50.0   1/2    50.0   0/0     0   0
Damian Turner          12    8    0    2   0   4/7    57.1   3/5    60.0   0/0     0   0
Vince Paul             12   12    4    0   0   4/4   100.0   2/2   100.0   0/2     1   0
Nikola Wagner          12    3    4    2   1   1/3    33.3   1/3    33.3   0/0     0   0
Carmelo Anunoby        12    3    5    2   0   1/2    50.0   0/0     0.0   1/1     0   0

TEAM: FG: 39/80 (48.8%), 3PT: 15/33 (45.5%), REB: 36 (11 off, 25 def), AST: 15, TO: 7


Team_067
--------------------------------------------------------------------------------
Player                MIN  PTS  REB  AST  TO      FG   FG%      3P   3P%      FT STL BLK
--------------------------------------------------------------------------------
Wendell Antetokounmpo   36    8    6    6   1   4/10   40.0   1/5    20.0   1/1     0   1
Desmond Simmons        36   18   17    3   1   8/11   72.7   2/3    66.7   9/9     0   0
Ben Ball               36   34    0    0   2  15/19   78.9   1/2    50.0   3/3     1   0
Malcolm Westbrook      36   11   19    3   2   3/6    50.0   0/0     0.0   3/4     1   1
Manu Reaves            26   19    1    2   1   8/8   100.0   3/3   100.0   5/5     0   0
James Rozier           23    2    3    0   0   1/5    20.0   0/4     0.0   0/0     2   0
Anfernee Wagner        12    2    5    0   0   1/3    33.3   0/2     0.0   0/0     0   0
Kyle Leonard           12   13    0    0   1   4/5    80.0   1/1   100.0   6/6     0   0
Kristaps Davis         12    8    2    1   1   3/4    75.0   1/1   100.0   1/1     1   0
Zach DeRozan           12    0    3    4   0   1/4    25.0   0/0     0.0   1/2     0   0

TEAM: FG: 49/76 (64.5%), 3PT: 9/21 (42.9%), REB: 58 (17 off, 41 def), AST: 19, TO: 9

================================================================================
