================================================================================
                        FULL GAME - Team_070 vs Team_058                        
================================================================================

================================================================================
                       1ST QUARTER - Team_070 vs Team_058                       
================================================================================

[12:00] Team_070 possession (Score: 0-0)
John Hyland attempts a 3Pt. Contested by Vince Hyland (4.4 feet, MAN). John Hyland misses. Rebound secured by Stephen Haliburton.

[11:44] Team_058 possession (Score: 0-0)
Bradley Sexton attempts a Layup. BLOCKED BY JABARI PAUL! Ball deflects out of bounds off Bradley Sexton.

[11:30] Team_070 possession (Score: 0-0)
LeBron Barnes attempts a 3Pt. Contested by Kyle Westbrook (4.5 feet, MAN). LEBRON BARNES MAKES IT! Assist: Jabari Paul
Score: 3-0

[11:17] Team_058 possession (Score: 3-0)
Kyle Westbrook attempts a Midrange. BLOCKED BY JOHN HYLAND! Ball is loose! Rebound secured by LeBron Barnes.

[11:03] Team_070 possession (Score: 3-0)
Khris Bryant drives to the basket... Khris Bryant throws a bad pass! Stolen by Stephen Haliburton! TURNOVER! (live ball)

[10:49] Team_058 possession (Score: 3-0)
Stephen Haliburton attempts a Layup. BLOCKED BY LEBRON BARNES! Ball deflects out of bounds off Stephen Haliburton.

[10:33] Team_070 possession (Score: 3-0)
Jabari Paul attempts a 3Pt. Contested by Bradley Sexton (3.7 feet, ZONE). Jabari Paul misses. FOUL! Loose ball foul on Tyrese Doncic during the rebound battle. [Team fouls: 1] No free throws, side out. (Tyrese Doncic: 1 personal fouls)

[10:18] Team_070 possession (Score: 3-0)
Cole Gasol attempts a Midrange. Contested by Bradley Sexton (3.2 feet, MAN). Cole Gasol misses. Rebound secured by Tyrese Doncic.

[09:58] Team_058 possession (Score: 3-0)
Vince Hyland makes the Layup and draws the foul on John Hyland! And-1! Vince Hyland to the line for 1. [Team fouls: 1] (John Hyland: 1 personal fouls)   FT 1/1: GOOD Vince Hyland makes 1/1 from the line.
Score: 3-3

[09:44] Team_070 possession (Score: 3-3)
LeBron Barnes attempts a 3Pt. Contested by Stephen Haliburton (3.9 feet, ZONE). LeBron Barnes misses. Rebound secured by Stephen Haliburton.

[09:33] Team_058 possession (Score: 3-3)
FOUL! Shooting foul on Khris Bryant. Stephen Haliburton to the line for 2 free throws. [Team fouls: 2] (Khris Bryant: 1 personal fouls)   FT 1/2: GOOD   FT 2/2: GOOD Stephen Haliburton makes 2/2 from the line.
Score: 3-5

[09:19] Team_070 possession (Score: 3-5)
Jabari Paul makes the Layup and draws the foul on Tyrese Doncic! And-1! Jabari Paul to the line for 1. [Team fouls: 2] (Tyrese Doncic: 2 personal fouls)   FT 1/1: GOOD Jabari Paul makes 1/1 from the line.
Score: 6-5

[09:00] Team_058 possession (Score: 6-5)
Vince Hyland attempts a 3Pt. Contested by John Hyland (4.8 feet, MAN). VINCE HYLAND MAKES IT! Assist: Tyrese Doncic
Score: 6-8

[08:44] Team_070 possession (Score: 6-8)
FOUL! Reach-in foul on Kyle Westbrook during the drive. [Team fouls: 3] No free throws, side out. (Kyle Westbrook: 1 personal fouls)

[08:30] Team_070 possession (Score: 6-8)
Cole Gasol attempts a 3Pt. Contested by Bradley Sexton (3.2 feet, MAN). Cole Gasol misses. Rebound secured by Bradley Sexton.

[08:20] Team_058 possession (Score: 6-8)
FOUL! Offensive foul on Tyrese Doncic! Khris Bryant drew the charge! [Team fouls: 4] (Tyrese Doncic: 3 personal fouls) TURNOVER! (dead ball)

[08:05] Team_070 possession (Score: 6-8)
LeBron Barnes attempts a 3Pt. Contested by Vince Hyland (4.9 feet, ZONE). LeBron Barnes misses. Rebound secured by Bradley Sexton.

[07:47] Team_058 possession (Score: 6-8)
Tyrese Doncic drives and kicks out. Vince Hyland attempts a Midrange. Contested by Khris Bryant (2.4 feet, ZONE). VINCE HYLAND MAKES IT!
Score: 6-10

[07:27] Team_070 possession (Score: 6-10)
Jabari Paul drives and kicks out. John Hyland attempts a 3Pt. Contested by Bradley Sexton (3.0 feet, ZONE). John Hyland misses. Rebound secured by Tyrese Doncic.

[07:16] Team_058 possession (Score: 6-10)
FOUL! Reach-in foul on Khris Bryant during the drive. [Team fouls: 3] No free throws, side out. (Khris Bryant: 2 personal fouls)

[07:01] Team_058 possession (Score: 6-10)
Kyle Westbrook attempts a 3Pt. Contested by LeBron Barnes (3.7 feet, MAN). Kyle Westbrook misses. Offensive rebound by Tyrese Doncic! Tyrese Doncic kicks it out.

[06:41] Team_058 possession (Score: 6-10)
Vince Hyland drives, picks up John Hyland. Help arrives from LeBron Barnes! Vince Hyland attempts a Dunk. Contested by LeBron Barnes (4.8 feet, MAN). Vince Hyland misses. Rebound secured by Jabari Paul.

[06:28] Team_070 possession (Score: 6-10)
Khris Bryant attempts a 3Pt. Contested by Stephen Haliburton (3.3 feet, MAN). Khris Bryant misses. Offensive rebound by LeBron Barnes! LeBron Barnes kicks it out.

[06:14] Team_070 possession (Score: 6-10)
Khris Bryant drives, Stephen Haliburton stays with him. Khris Bryant attempts a Layup. Contested by Stephen Haliburton (3.3 feet, MAN). KHRIS BRYANT MAKES IT! Assist: Jabari Paul
Score: 8-10

[06:00] Team_058 possession (Score: 8-10)
Bradley Sexton attempts a 3Pt. Contested by Cole Gasol (5.6 feet, MAN). Bradley Sexton misses. Rebound secured by LeBron Barnes.

[05:44] Team_070 possession (Score: 8-10)
Cole Gasol attempts a Midrange. Contested by Bradley Sexton (3.2 feet, MAN). COLE GASOL MAKES IT!
Score: 10-10

[05:28] Team_058 possession (Score: 10-10)
Bradley Sexton attempts a Midrange. Contested by Khris Bryant (2.7 feet, ZONE). BRADLEY SEXTON MAKES IT!
Score: 10-12

[05:11] Team_070 possession (Score: 10-12)
John Hyland attempts a 3Pt. Contested by Vince Hyland (4.4 feet, MAN). John Hyland misses. Rebound secured by Stephen Haliburton.

[04:57] Team_058 possession (Score: 10-12)
Stephen Haliburton attempts a Layup. BLOCKED BY KHRIS BRYANT! Ball deflects out of bounds off Stephen Haliburton.

[04:43] Team_070 possession (Score: 10-12)
John Hyland attempts a Layup. Contested by Vince Hyland (4.5 feet, MAN). John Hyland misses. Rebound secured by Stephen Haliburton.

[04:27] Team_058 possession (Score: 10-12)
Bradley Sexton drives and kicks out. Kyle Westbrook attempts a Midrange. Contested by LeBron Barnes (3.6 feet, MAN). KYLE WESTBROOK MAKES IT! Assist: Stephen Haliburton
Score: 10-14

[04:14] Team_070 possession (Score: 10-14)
Cole Gasol attempts a Midrange. Contested by Bradley Sexton (3.2 feet, ZONE). COLE GASOL MAKES IT! Assist: LeBron Barnes
Score: 12-14

[03:58] Team_058 possession (Score: 12-14)
Vince Hyland drives and kicks out. Stephen Haliburton attempts a Midrange. Contested by Khris Bryant (2.5 feet, MAN). Stephen Haliburton misses. Offensive rebound by Stephen Haliburton! Stephen Haliburton puts it back in!
Score: 12-16

[03:46] Team_070 possession (Score: 12-16)
FOUL! Shooting foul on Bradley Sexton. Jabari Paul to the line for 2 free throws. [BONUS: 5 team fouls] (Bradley Sexton: 1 personal fouls)   FT 1/2: GOOD   FT 2/2: GOOD Jabari Paul makes 2/2 from the line.
Score: 14-16

[03:34] Team_058 possession (Score: 14-16)
Bradley Sexton makes the Layup and draws the foul on Cole Gasol! And-1! Bradley Sexton to the line for 1. [Team fouls: 4] (Cole Gasol: 1 personal fouls)   FT 1/1: GOOD Bradley Sexton makes 1/1 from the line.
Score: 14-19

[03:21] Team_070 possession (Score: 14-19)
FOUL! Shooting foul on Stephen Haliburton. Khris Bryant to the line for 2 free throws. [BONUS: 6 team fouls] (Stephen Haliburton: 1 personal fouls)   FT 1/2: GOOD   FT 2/2: GOOD Khris Bryant makes 2/2 from the line.
Score: 16-19

[03:10] Team_058 possession (Score: 16-19)
Kyle Westbrook attempts a 3Pt. Contested by Khris Bryant (2.8 feet, ZONE). Kyle Westbrook misses. Rebound secured by LeBron Barnes.

[02:54] Team_070 possession (Score: 16-19)
LeBron Barnes attempts a Midrange. Contested by Kyle Westbrook (4.7 feet, MAN). LEBRON BARNES MAKES IT! Assist: Khris Bryant
Score: 18-19

[02:40] Team_058 possession (Score: 18-19)
Vince Hyland attempts a 3Pt. Contested by Cole Gasol (5.7 feet, ZONE). Vince Hyland misses. Rebound secured by Khris Bryant.

[02:24] Team_070 possession (Score: 18-19)
Cole Gasol attempts a Midrange. Contested by Bradley Sexton (3.4 feet, MAN). COLE GASOL MAKES IT! Assist: LeBron Barnes
Score: 20-19

[02:12] Team_058 possession (Score: 20-19)
FOUL! Holding foul on John Hyland. [IN THE BONUS! 5 team fouls] Vince Hyland to the line for 2 free throws. (John Hyland: 2 personal fouls)   FT 1/2: GOOD   FT 2/2: MISS Vince Hyland makes 1/2 from the line. Rebound secured by LeBron Barnes.
Score: 20-20

[01:59] Team_070 possession (Score: 20-20)
LeBron Barnes attempts a 3Pt. Contested by Bradley Sexton (3.7 feet, ZONE). LeBron Barnes misses. Rebound secured by Tyrese Doncic.

[01:44] Team_058 possession (Score: 20-20)
Tyrese Doncic drives to the basket... Tyrese Doncic throws a bad pass! Stolen by Khris Bryant! TURNOVER! (live ball)

[01:27] Team_070 possession (Score: 20-20)
Jabari Paul drives to the basket... Jabari Paul loses the ball! Stripped by Tyrese Doncic! TURNOVER! (live ball)

[01:10] Team_058 possession (Score: 20-20)
Bradley Sexton attempts a 3Pt. Contested by Khris Bryant (3.2 feet, ZONE). Bradley Sexton misses. Rebound secured by Khris Bryant.

[00:55] Team_070 possession (Score: 20-20)
Cole Gasol drives, picks up Stephen Haliburton. Help arrives from Bradley Sexton! Cole Gasol attempts a Layup. Contested by Bradley Sexton (4.1 feet, ZONE). Cole Gasol misses. Rebound secured by Stephen Haliburton.

[00:38] Team_058 possession (Score: 20-20)
Kyle Westbrook attempts a Midrange. Contested by LeBron Barnes (4.1 feet, MAN). Kyle Westbrook misses. Rebound secured by Jabari Paul.

[00:22] Team_070 possession (Score: 20-20)
LeBron Barnes attempts a Layup. Contested by Kyle Westbrook (5.0 feet, MAN). LEBRON BARNES MAKES IT! Assist: Cole Gasol
Score: 22-20

[00:10] Team_058 possession (Score: 22-20)
FOUL! Shooting foul on LeBron Barnes. Kyle Westbrook to the line for 3 free throws. [BONUS: 6 team fouls] (LeBron Barnes: 1 personal fouls)   FT 1/3: GOOD   FT 2/3: GOOD   FT 3/3: MISS Kyle Westbrook makes 2/3 from the line. Rebound secured by Jabari Paul.
Score: 22-22

================================================================================
                              1ST QUARTER COMPLETE                              
================================================================================

1ST QUARTER SCORE: Team_070 22, Team_058 22

BOX SCORE:
================================================================================

Team_070
--------------------------------------------------------------------------------
Player                MIN  PTS  REB  AST  TO      FG   FG%      3P   3P%
--------------------------------------------------------------------------------
LeBron Barnes          12    7    5    2   0   3/6    50.0     0/0   0.0
Cole Gasol             12    6    0    1   0   3/6    50.0     0/0   0.0
Jabari Paul            12    5    3    2   0   2/3    66.7     0/0   0.0
Khris Bryant           12    4    3    1   0   2/2   100.0     0/0   0.0
John Hyland            12    0    0    0   0   0/3     0.0     0/0   0.0

TEAM: FG: 10/20 (50.0%), 3PT: 1/7 (14.3%), REB: 11 (2 off, 9 def), AST: 6, TO: 2
TEAM FOULS: 6 [Team_058 in BONUS]


Team_058
--------------------------------------------------------------------------------
Player                MIN  PTS  REB  AST  TO      FG   FG%      3P   3P%
--------------------------------------------------------------------------------
Vince Hyland           12    8    0    0   0   3/5    60.0     0/0   0.0
Bradley Sexton         12    5    2    0   0   2/5    40.0     0/0   0.0
Stephen Haliburton     12    4    6    1   0   2/4    50.0     0/0   0.0
Kyle Westbrook         12    2    0    0   0   1/5    20.0     0/0   0.0
Tyrese Doncic          12    0    4    1   0   0/0     0.0     0/0   0.0

TEAM: FG: 8/20 (40.0%), 3PT: 1/6 (16.7%), REB: 12 (2 off, 10 def), AST: 2, TO: 2
TEAM FOULS: 6 [Team_070 in BONUS]

================================================================================

================================================================================
                       2ND QUARTER - Team_070 vs Team_058                       
================================================================================

[12:00] Team_070 possession (Score: 22-22)
Jabari Paul attempts a 3Pt. Contested by Bradley Sexton (4.0 feet, ZONE). Jabari Paul misses. Rebound secured by Tyrese Doncic.

[11:44] Team_058 possession (Score: 22-22)
Vince Hyland attempts a 3Pt. Contested by Khris Bryant (3.1 feet, ZONE). Vince Hyland misses. Rebound secured by Jabari Paul.

[11:30] Team_070 possession (Score: 22-22)
John Hyland attempts a 3Pt. Contested by Vince Hyland (4.7 feet, MAN). John Hyland misses. Rebound secured by Bradley Sexton.

[11:19] Team_058 possession (Score: 22-22)
Vince Hyland loses the ball! Stripped by John Hyland! TURNOVER! (live ball)

[11:04] Team_070 possession (Score: 22-22)
John Hyland attempts a Midrange. Contested by Vince Hyland (4.7 feet, MAN). JOHN HYLAND MAKES IT!
Score: 24-22

[10:48] Team_058 possession (Score: 24-22)
Vince Hyland attempts a Layup. BLOCKED BY KHRIS BRYANT! Ball is loose! Rebound secured by Jabari Paul.

[10:32] Team_070 possession (Score: 24-22)
Jabari Paul drives, picks up Stephen Haliburton. Help arrives from Bradley Sexton! Jabari Paul attempts a Dunk. Contested by Bradley Sexton (4.7 feet, ZONE). Jabari Paul misses. Rebound secured by Stephen Haliburton.

[10:16] Team_058 possession (Score: 24-22)
Vince Hyland drives, picks up Khris Bryant. Help arrives from LeBron Barnes! Vince Hyland attempts a Dunk. Contested by LeBron Barnes (3.3 feet, ZONE). Vince Hyland misses. Rebound secured by Jabari Paul.

[09:59] Team_070 possession (Score: 24-22)
Cole Gasol attempts a Midrange. Contested by Kyle Westbrook (4.8 feet, ZONE). Cole Gasol misses. Rebound secured by Stephen Haliburton.

[09:47] Team_058 possession (Score: 24-22)
FOUL! Shooting foul on Khris Bryant. Tyrese Doncic to the line for 2 free throws. [Team fouls: 1] (Khris Bryant: 1 personal fouls)   FT 1/2: GOOD   FT 2/2: GOOD Tyrese Doncic makes 2/2 from the line.
Score: 24-24

[09:29] Team_070 possession (Score: 24-24)
Khris Bryant drives, Stephen Haliburton stays with him. Khris Bryant attempts a Layup. Contested by Stephen Haliburton (4.0 feet, MAN). KHRIS BRYANT MAKES IT!
Score: 26-24

[09:13] Team_058 possession (Score: 26-24)
Stephen Haliburton attempts a Midrange. Contested by Khris Bryant (3.3 feet, ZONE). STEPHEN HALIBURTON MAKES IT!
Score: 26-26

[08:59] Team_070 possession (Score: 26-26)
Jabari Paul attempts a Layup. Contested by Stephen Haliburton (4.9 feet, ZONE). JABARI PAUL MAKES IT! Assist: Cole Gasol
Score: 28-26

[08:48] Team_058 possession (Score: 28-26)
Bradley Sexton makes the Dunk and draws the foul on LeBron Barnes! And-1! Bradley Sexton to the line for 1. [Team fouls: 2] (LeBron Barnes: 1 personal fouls)   FT 1/1: GOOD Bradley Sexton makes 1/1 from the line.
Score: 28-29

[08:31] Team_070 possession (Score: 28-29)
Khris Bryant attempts a Midrange. Contested by Kyle Westbrook (4.7 feet, ZONE). Khris Bryant misses. Offensive rebound by Khris Bryant! Khris Bryant puts it back in!
Score: 30-29

[08:17] Team_058 possession (Score: 30-29)
Stephen Haliburton attempts a Layup. Contested by Khris Bryant (3.4 feet, MAN). Stephen Haliburton misses. Rebound secured by LeBron Barnes.

[08:02] Team_070 possession (Score: 30-29)
John Hyland attempts a Layup. Contested by Stephen Haliburton (4.3 feet, ZONE). John Hyland misses. Rebound secured by Stephen Haliburton.

[07:49] Team_058 possession (Score: 30-29)
Stephen Haliburton attempts a Midrange. Contested by Khris Bryant (3.5 feet, ZONE). Stephen Haliburton misses. Rebound secured by LeBron Barnes.

[07:38] Team_070 possession (Score: 30-29)
Jabari Paul makes the Layup and draws the foul on Tyrese Doncic! And-1! Jabari Paul to the line for 1. [Team fouls: 1] (Tyrese Doncic: 1 personal fouls)   FT 1/1: GOOD Jabari Paul makes 1/1 from the line.
Score: 33-29

[07:18] Team_058 possession (Score: 33-29)
Kyle Westbrook drives and kicks out. Kyle Westbrook attempts a Midrange. BLOCKED BY JOHN HYLAND! Ball goes out off John Hyland. Kyle Westbrook's ball!

[07:02] Team_058 possession (Score: 33-29)
Stephen Haliburton makes the Layup and draws the foul on Khris Bryant! And-1! Stephen Haliburton to the line for 1. [Team fouls: 3] (Khris Bryant: 2 personal fouls)   FT 1/1: GOOD Stephen Haliburton makes 1/1 from the line.
Score: 33-32

[06:47] Team_070 possession (Score: 33-32)
Cole Gasol attempts a 3Pt. Contested by Bradley Sexton (4.2 feet, MAN). COLE GASOL MAKES IT! Assist: Jabari Paul
Score: 36-32

[06:29] Team_058 possession (Score: 36-32)
Kyle Westbrook commits a violation (traveling/carry)! TURNOVER! (dead ball)

[06:29] Substitution (Team_070): Cole Gasol OUT → Paul Quickley IN (stamina_rule2)

[06:29] Substitution (Team_070): LeBron Barnes OUT → Allen Quickley IN (stamina_rule2)

[06:29] Substitution (Team_070): John Hyland OUT → D'Angelo McGrady IN (stamina_rule2)

[06:29] Substitution (Team_070): Khris Bryant OUT → Luka Gobert IN (stamina_rule2)

[06:29] Substitution (Team_070): Jabari Paul OUT → Russell Morant IN (stamina_rule2)

[06:29] Substitution (Team_058): Bradley Sexton OUT → Draymond Williamson IN (stamina_rule2)

[06:29] Substitution (Team_058): Kyle Westbrook OUT → Jordan Ingram IN (stamina_rule2)

[06:29] Substitution (Team_058): Vince Hyland OUT → Pascal Holiday IN (stamina_rule2)

[06:29] Substitution (Team_058): Stephen Haliburton OUT → Shai Lowry IN (stamina_rule2)

[06:29] Substitution (Team_058): Tyrese Doncic OUT → Jarrett Gilgeous-Alexander IN (stamina_rule2)

[06:13] Team_070 possession (Score: 36-32)
Paul Quickley attempts a 3Pt. Contested by Draymond Williamson (5.1 feet, MAN). Paul Quickley misses. Rebound secured by Shai Lowry.

[05:58] Team_058 possession (Score: 36-32)
Shai Lowry drives, Luka Gobert stays with him. Shai Lowry attempts a Layup. Contested by Luka Gobert (4.7 feet, MAN). Shai Lowry misses. Rebound secured by Russell Morant.

[05:45] Team_070 possession (Score: 36-32)
Luka Gobert drives, Shai Lowry stays with him. Luka Gobert attempts a Dunk. Contested by Shai Lowry (4.1 feet, MAN). LUKA GOBERT MAKES IT! Assist: Paul Quickley
Score: 38-32

[05:34] Team_058 possession (Score: 38-32)
FOUL! Offensive foul on Jordan Ingram! Allen Quickley drew the charge! [Team fouls: 2] (Jordan Ingram: 1 personal fouls) TURNOVER! (dead ball)

[05:21] Team_070 possession (Score: 38-32)
Paul Quickley attempts a Midrange. Contested by Jordan Ingram (5.8 feet, ZONE). Paul Quickley misses. Rebound secured by Jarrett Gilgeous-Alexander.

[05:08] Team_058 possession (Score: 38-32)
Jarrett Gilgeous-Alexander drives and kicks out. Shai Lowry attempts a 3Pt. Contested by Paul Quickley (4.3 feet, ZONE). SHAI LOWRY MAKES IT! Assist: Jarrett Gilgeous-Alexander
Score: 38-35

[04:59] Team_070 possession (Score: 38-35)
Paul Quickley drives, picks up Draymond Williamson. Help arrives from Pascal Holiday! Paul Quickley attempts a Dunk. Contested by Pascal Holiday (5.1 feet, MAN). PAUL QUICKLEY MAKES IT! Assist: Russell Morant
Score: 40-35

[04:49] Team_058 possession (Score: 40-35)
Pascal Holiday attempts a 3Pt. Contested by D'Angelo McGrady (5.7 feet, MAN). Pascal Holiday misses. Offensive rebound by Pascal Holiday! Pascal Holiday's putback is no good. Rebound secured by D'Angelo McGrady.

[04:34] Team_070 possession (Score: 40-35)
FOUL! Shooting foul on Shai Lowry. Paul Quickley to the line for 2 free throws. [Team fouls: 3] (Shai Lowry: 1 personal fouls)   FT 1/2: MISS   FT 2/2: GOOD Paul Quickley makes 1/2 from the line.
Score: 41-35

[04:23] Team_058 possession (Score: 41-35)
Pascal Holiday attempts a 3Pt. Contested by D'Angelo McGrady (5.7 feet, MAN). Pascal Holiday misses. Rebound secured by Luka Gobert.

[04:07] Team_070 possession (Score: 41-35)
Allen Quickley attempts a Midrange. Wide open! Jordan Ingram is 6.0 feet away. [MAN] Allen Quickley misses. Rebound secured by Shai Lowry.

[03:56] Team_058 possession (Score: 41-35)
Pascal Holiday attempts a 3Pt. Contested by Paul Quickley (4.4 feet, ZONE). Pascal Holiday misses. Offensive rebound by Shai Lowry! Shai Lowry kicks it out.

[03:45] Team_058 possession (Score: 41-35)
FOUL! Reach-in foul on Russell Morant during the drive. [Team fouls: 4] No free throws, side out. (Russell Morant: 1 personal fouls)

[03:31] Team_058 possession (Score: 41-35)
Jarrett Gilgeous-Alexander attempts a Midrange. Contested by D'Angelo McGrady (5.6 feet, ZONE). JARRETT GILGEOUS-ALEXANDER MAKES IT! Assist: Shai Lowry
Score: 41-37

[03:18] Team_070 possession (Score: 41-37)
Luka Gobert drives and kicks out. Russell Morant attempts a 3Pt. Contested by Jarrett Gilgeous-Alexander (5.3 feet, MAN). Russell Morant misses. Rebound secured by Shai Lowry.

[03:02] Team_058 possession (Score: 41-37)
Pascal Holiday attempts a 3Pt. Contested by D'Angelo McGrady (5.7 feet, MAN). Pascal Holiday misses. Rebound secured by Russell Morant.

[02:50] Team_070 possession (Score: 41-37)
Paul Quickley attempts a Midrange. Contested by Jordan Ingram (5.8 feet, ZONE). PAUL QUICKLEY MAKES IT! Assist: Russell Morant
Score: 43-37

[02:35] Team_058 possession (Score: 43-37)
Draymond Williamson drives to the basket... Draymond Williamson throws a bad pass! Stolen by Luka Gobert! TURNOVER! (live ball)

[02:18] Team_070 possession (Score: 43-37)
Luka Gobert makes the Layup and draws the foul on Shai Lowry! And-1! Luka Gobert to the line for 1. [Team fouls: 4] (Shai Lowry: 2 personal fouls)   FT 1/1: GOOD Luka Gobert makes 1/1 from the line.
Score: 46-37

[02:02] Team_058 possession (Score: 46-37)
Jarrett Gilgeous-Alexander attempts a Midrange. Contested by Paul Quickley (4.3 feet, ZONE). Jarrett Gilgeous-Alexander misses. Rebound secured by Russell Morant.

[01:45] Team_070 possession (Score: 46-37)
Paul Quickley attempts a 3Pt. Contested by Draymond Williamson (5.1 feet, MAN). Paul Quickley misses. Rebound secured by Shai Lowry.

[01:33] Team_058 possession (Score: 46-37)
FOUL! Shooting foul on D'Angelo McGrady. Pascal Holiday to the line for 2 free throws. [BONUS: 5 team fouls] (D'Angelo McGrady: 1 personal fouls)   FT 1/2: GOOD   FT 2/2: GOOD Pascal Holiday makes 2/2 from the line.
Score: 46-39

[01:16] Team_070 possession (Score: 46-39)
Luka Gobert drives to the basket... Luka Gobert loses the ball! Stripped by Shai Lowry! TURNOVER! (live ball)

[01:01] Team_058 possession (Score: 46-39)
Jordan Ingram attempts a Midrange. Contested by Allen Quickley (5.2 feet, MAN). Jordan Ingram misses. Rebound secured by D'Angelo McGrady.

[00:47] Team_070 possession (Score: 46-39)
Luka Gobert drives, picks up Shai Lowry. Help arrives from Jordan Ingram! Luka Gobert attempts a Layup. Contested by Jordan Ingram (4.1 feet, MAN). LUKA GOBERT MAKES IT!
Score: 48-39

[00:32] Team_058 possession (Score: 48-39)
Draymond Williamson attempts a 3Pt. Wide open! D'Angelo McGrady is 6.0 feet away. [ZONE] Draymond Williamson misses. Offensive rebound by Shai Lowry! Shai Lowry kicks it out.

[00:17] Team_058 possession (Score: 48-39)
Draymond Williamson loses the ball! Stripped by Paul Quickley! TURNOVER! (live ball)

[00:02] Team_070 possession (Score: 48-39)
Paul Quickley drives, Shai Lowry stays with him. Paul Quickley attempts a Dunk. Contested by Shai Lowry (4.0 feet, ZONE). PAUL QUICKLEY MAKES IT! Assist: D'Angelo McGrady
Score: 50-39

================================================================================
                              2ND QUARTER COMPLETE                              
================================================================================

2ND QUARTER SCORE: Team_070 28, Team_058 17

BOX SCORE:
================================================================================

Team_070
--------------------------------------------------------------------------------
Player                MIN  PTS  REB  AST  TO      FG   FG%      3P   3P%
--------------------------------------------------------------------------------
Paul Quickley           6    7    0    1   0   4/7    57.1     0/0   0.0
Luka Gobert             6    7    1    0   0   3/4    75.0     0/0   0.0
Jabari Paul            18    5    3    1   0   2/4    50.0     0/0   0.0
Khris Bryant           18    4    1    0   0   2/2   100.0     0/0   0.0
Cole Gasol             18    3    0    1   0   1/2    50.0     0/0   0.0
John Hyland            18    2    0    0   0   1/3    33.3     0/0   0.0
LeBron Barnes          18    0    2    0   0   0/0     0.0     0/0   0.0
Russell Morant          6    0    3    2   0   0/0     0.0     0/0   0.0
D'Angelo McGrady        6    0    2    1   0   0/0     0.0     0/0   0.0
Allen Quickley          6    0    0    0   0   0/1     0.0     0/0   0.0

TEAM: FG: 13/23 (56.5%), 3PT: 1/5 (20.0%), REB: 11 (1 off, 10 def), AST: 6, TO: 1
TEAM FOULS: 5 [Team_058 in BONUS]


Team_058
--------------------------------------------------------------------------------
Player                MIN  PTS  REB  AST  TO      FG   FG%      3P   3P%
--------------------------------------------------------------------------------
Stephen Haliburton     18    5    3    0   0   2/4    50.0     0/0   0.0
Bradley Sexton         18    3    1    0   0   1/1   100.0     0/0   0.0
Shai Lowry              6    3    6    1   0   1/2    50.0     0/0   0.0
Tyrese Doncic          18    2    1    0   0   1/1   100.0     0/0   0.0
Jarrett Gilgeous-Alexander    6    2    1    1   0   1/2    50.0     0/0   0.0
Pascal Holiday          6    2    0    0   0   1/4    25.0     0/0   0.0
Vince Hyland           18    0    0    0   0   0/3     0.0     0/0   0.0
Jordan Ingram           6    0    0    0   0   0/1     0.0     0/0   0.0

TEAM: FG: 7/18 (38.9%), 3PT: 0/4 (0.0%), REB: 13 (3 off, 10 def), AST: 2, TO: 5
TEAM FOULS: 4

================================================================================

================================================================================
                       3RD QUARTER - Team_070 vs Team_058                       
================================================================================

[12:00] Team_070 possession (Score: 50-39)
John Hyland attempts a 3Pt. Contested by Kyle Westbrook (4.0 feet, ZONE). John Hyland misses. Rebound secured by Bradley Sexton.

[11:45] Team_058 possession (Score: 50-39)
Vince Hyland makes the Layup and draws the foul on John Hyland! And-1! Vince Hyland to the line for 1. [Team fouls: 1] (John Hyland: 1 personal fouls)   FT 1/1: GOOD Vince Hyland makes 1/1 from the line.
Score: 50-42

[11:32] Team_070 possession (Score: 50-42)
John Hyland drives to the basket... John Hyland throws a bad pass! Stolen by Stephen Haliburton! TURNOVER! (live ball)

[11:20] Team_058 possession (Score: 50-42)
Vince Hyland drives and kicks out. Stephen Haliburton attempts a Midrange. Contested by Khris Bryant (2.4 feet, MAN). STEPHEN HALIBURTON MAKES IT! Assist: Kyle Westbrook
Score: 50-44

[11:06] Team_070 possession (Score: 50-44)
Jabari Paul drives and kicks out. Khris Bryant attempts a Midrange. Contested by Stephen Haliburton (3.4 feet, MAN). Khris Bryant misses. Rebound secured by Stephen Haliburton.

[10:52] Team_058 possession (Score: 50-44)
Stephen Haliburton attempts a 3Pt. Contested by Khris Bryant (2.6 feet, MAN). Stephen Haliburton misses. Rebound secured by Khris Bryant.

[10:40] Team_070 possession (Score: 50-44)
FOUL! Offensive foul on Cole Gasol! Bradley Sexton drew the charge! [Team fouls: 2] (Cole Gasol: 1 personal fouls) TURNOVER! (dead ball)

[10:27] Team_058 possession (Score: 50-44)
Stephen Haliburton makes the Midrange and draws the foul on LeBron Barnes! And-1! Stephen Haliburton to the line for 1. [Team fouls: 3] (LeBron Barnes: 1 personal fouls)   FT 1/1: GOOD Stephen Haliburton makes 1/1 from the line.
Score: 50-47

[10:12] Team_070 possession (Score: 50-47)
John Hyland attempts a Layup. Contested by Stephen Haliburton (3.4 feet, ZONE). John Hyland misses. FOUL! Loose ball foul on Tyrese Doncic during the rebound battle. [Team fouls: 1] No free throws, side out. (Tyrese Doncic: 1 personal fouls)

[09:57] Team_070 possession (Score: 50-47)
Khris Bryant attempts a Midrange. Contested by Stephen Haliburton (3.3 feet, MAN). KHRIS BRYANT MAKES IT! Assist: Cole Gasol
Score: 52-47

[09:41] Team_058 possession (Score: 52-47)
Tyrese Doncic drives to the basket... Tyrese Doncic loses control! Ball rolls out of bounds! TURNOVER! (dead ball)

[09:23] Team_070 possession (Score: 52-47)
John Hyland attempts a Layup. BLOCKED BY VINCE HYLAND! Ball is loose! Rebound secured by Bradley Sexton.

[09:06] Team_058 possession (Score: 52-47)
Stephen Haliburton drives and kicks out. Kyle Westbrook attempts a 3Pt. Contested by Khris Bryant (2.4 feet, ZONE). Kyle Westbrook misses. Offensive rebound by Tyrese Doncic! Tyrese Doncic kicks it out.

[08:55] Team_058 possession (Score: 52-47)
Vince Hyland drives and kicks out. Bradley Sexton attempts a Midrange. Contested by Jabari Paul (4.4 feet, ZONE). BRADLEY SEXTON MAKES IT! Assist: Tyrese Doncic
Score: 52-49

[08:40] Team_070 possession (Score: 52-49)
FOUL! Shooting foul on Vince Hyland. John Hyland to the line for 2 free throws. [Team fouls: 2] (Vince Hyland: 1 personal fouls)   FT 1/2: GOOD   FT 2/2: GOOD John Hyland makes 2/2 from the line.
Score: 54-49

[08:24] Team_058 possession (Score: 54-49)
Tyrese Doncic commits a violation (traveling/carry)! TURNOVER! (dead ball)

[08:10] Team_070 possession (Score: 54-49)
John Hyland attempts a 3Pt. Contested by Bradley Sexton (2.9 feet, ZONE). John Hyland misses. Offensive rebound by Khris Bryant! Khris Bryant puts it back in!
Score: 56-49

[07:58] Team_058 possession (Score: 56-49)
Bradley Sexton loses control! Ball rolls out of bounds! TURNOVER! (dead ball)

[07:44] Team_070 possession (Score: 56-49)
Khris Bryant attempts a Layup. Contested by Stephen Haliburton (3.3 feet, MAN). KHRIS BRYANT MAKES IT! Assist: John Hyland
Score: 58-49

[07:27] Team_058 possession (Score: 58-49)
Stephen Haliburton attempts a 3Pt. Contested by Khris Bryant (2.6 feet, ZONE). Stephen Haliburton misses. Offensive rebound by Stephen Haliburton! Stephen Haliburton's putback is no good. Rebound secured by LeBron Barnes.

[07:15] Team_070 possession (Score: 58-49)
FOUL! Reach-in foul on Tyrese Doncic during the drive. [Team fouls: 3] No free throws, side out. (Tyrese Doncic: 2 personal fouls)

[06:59] Team_070 possession (Score: 58-49)
FOUL! Reach-in foul on Kyle Westbrook during the drive. [Team fouls: 4] No free throws, side out. (Kyle Westbrook: 1 personal fouls)

[06:44] Team_070 possession (Score: 58-49)
Khris Bryant attempts a 3Pt. Contested by Vince Hyland (4.4 feet, ZONE). KHRIS BRYANT MAKES IT! Assist: Cole Gasol
Score: 61-49

[06:27] Team_058 possession (Score: 61-49)
Tyrese Doncic drives to the basket... FOUL! Offensive foul on Tyrese Doncic! Khris Bryant drew the charge! [Team fouls: 5] (Tyrese Doncic: 3 personal fouls) TURNOVER! (dead ball)

[06:14] Team_070 possession (Score: 61-49)
John Hyland drives, Vince Hyland stays with him. John Hyland attempts a Dunk. Contested by Vince Hyland (4.4 feet, MAN). JOHN HYLAND MAKES IT! Assist: Cole Gasol
Score: 63-49

[05:56] Team_058 possession (Score: 63-49)
Bradley Sexton drives to the basket... Bradley Sexton throws a bad pass out of bounds! TURNOVER! (dead ball)

[05:44] Team_070 possession (Score: 63-49)
Cole Gasol drives, Stephen Haliburton stays with him. Cole Gasol attempts a Dunk. Contested by Stephen Haliburton (3.6 feet, ZONE). COLE GASOL MAKES IT! Assist: LeBron Barnes
Score: 65-49

[05:30] Team_058 possession (Score: 65-49)
Bradley Sexton drives to the basket... Bradley Sexton throws a bad pass! Stolen by Khris Bryant! TURNOVER! (live ball)

[05:14] Team_070 possession (Score: 65-49)
John Hyland attempts a 3Pt. Contested by Vince Hyland (4.4 feet, MAN). JOHN HYLAND MAKES IT! Assist: LeBron Barnes
Score: 68-49

[04:59] Team_058 possession (Score: 68-49)
Kyle Westbrook loses control! Ball rolls out of bounds! TURNOVER! (dead ball)

[04:47] Team_070 possession (Score: 68-49)
FOUL! Offensive foul on Jabari Paul! Tyrese Doncic drew the charge! [Team fouls: 4] (Jabari Paul: 1 personal fouls) TURNOVER! (dead ball)

[04:33] Team_058 possession (Score: 68-49)
FOUL! Shooting foul on John Hyland. Vince Hyland to the line for 2 free throws. [BONUS: 5 team fouls] (John Hyland: 2 personal fouls)   FT 1/2: MISS   FT 2/2: GOOD Vince Hyland makes 1/2 from the line.
Score: 68-50

[04:14] Team_070 possession (Score: 68-50)
FOUL! Reach-in foul on Tyrese Doncic during the drive. [IN THE BONUS! 6 team fouls] Jabari Paul to the line for 2 free throws. (Tyrese Doncic: 4 personal fouls)   FT 1/2: GOOD   FT 2/2: GOOD Jabari Paul makes 2/2 from the line.
Score: 70-50

[04:02] Team_058 possession (Score: 70-50)
Bradley Sexton attempts a 3Pt. Contested by Khris Bryant (2.9 feet, ZONE). BRADLEY SEXTON MAKES IT! Assist: Vince Hyland
Score: 70-53

[03:50] Team_070 possession (Score: 70-53)
Cole Gasol attempts a 3Pt. Contested by Bradley Sexton (3.3 feet, ZONE). Cole Gasol misses. FOUL! Loose ball foul on Bradley Sexton during the rebound battle. [IN THE BONUS! 7 team fouls] LeBron Barnes to the line for 2 free throws. (Bradley Sexton: 1 personal fouls)   FT 1/2: GOOD   FT 2/2: GOOD LeBron Barnes makes 2/2 from the line.
Score: 72-53

[03:38] Team_058 possession (Score: 72-53)
Bradley Sexton drives and kicks out. Bradley Sexton attempts a 3Pt. Contested by Khris Bryant (2.6 feet, ZONE). Bradley Sexton misses. Rebound secured by Jabari Paul.

[03:28] Team_070 possession (Score: 72-53)
Jabari Paul makes the Layup and draws the foul on Bradley Sexton! And-1! Jabari Paul to the line for 1. [BONUS: 8 team fouls] (Bradley Sexton: 2 personal fouls)   FT 1/1: GOOD Jabari Paul makes 1/1 from the line.
Score: 75-53

[03:10] Team_058 possession (Score: 75-53)
Bradley Sexton attempts a 3Pt. Contested by Khris Bryant (3.0 feet, ZONE). Bradley Sexton misses. Rebound secured by LeBron Barnes.

[02:55] Team_070 possession (Score: 75-53)
Khris Bryant drives and kicks out. LeBron Barnes attempts a 3Pt. Contested by Bradley Sexton (3.2 feet, ZONE). LEBRON BARNES MAKES IT! Assist: John Hyland
Score: 78-53

[02:39] Team_058 possession (Score: 78-53)
FOUL! Offensive foul on Stephen Haliburton! Khris Bryant drew the charge! [Team fouls: 9] (Stephen Haliburton: 1 personal fouls) TURNOVER! (dead ball)

[02:20] Team_070 possession (Score: 78-53)
John Hyland attempts a 3Pt. Contested by Vince Hyland (4.6 feet, MAN). JOHN HYLAND MAKES IT! Assist: Cole Gasol
Score: 81-53

[02:07] Team_058 possession (Score: 81-53)
FOUL! Holding foul on LeBron Barnes. [IN THE BONUS! 6 team fouls] Kyle Westbrook to the line for 2 free throws. (LeBron Barnes: 2 personal fouls)   FT 1/2: GOOD   FT 2/2: GOOD Kyle Westbrook makes 2/2 from the line.
Score: 81-55

[01:53] Team_070 possession (Score: 81-55)
Khris Bryant attempts a Midrange. Contested by Vince Hyland (4.6 feet, ZONE). KHRIS BRYANT MAKES IT! Assist: Jabari Paul
Score: 83-55

[01:36] Team_058 possession (Score: 83-55)
Vince Hyland makes the Dunk and draws the foul on LeBron Barnes! And-1! Vince Hyland to the line for 1. [BONUS: 7 team fouls] (LeBron Barnes: 3 personal fouls)   FT 1/1: GOOD Vince Hyland makes 1/1 from the line.
Score: 83-58

[01:19] Team_070 possession (Score: 83-58)
FOUL! Shooting foul on Kyle Westbrook. LeBron Barnes to the line for 2 free throws. [BONUS: 10 team fouls] (Kyle Westbrook: 2 personal fouls)   FT 1/2: GOOD   FT 2/2: GOOD LeBron Barnes makes 2/2 from the line.
Score: 85-58

[01:03] Team_058 possession (Score: 85-58)
Tyrese Doncic attempts a Layup. BLOCKED BY KHRIS BRYANT! Ball is loose! Offensive rebound by Stephen Haliburton! Stephen Haliburton kicks it out.

[00:49] Team_058 possession (Score: 85-58)
Tyrese Doncic drives, Khris Bryant stays with him. Tyrese Doncic attempts a Dunk. Contested by Khris Bryant (3.0 feet, ZONE). TYRESE DONCIC MAKES IT! Assist: Bradley Sexton
Score: 85-60

[00:33] Team_070 possession (Score: 85-60)
Cole Gasol drives, Stephen Haliburton stays with him. Cole Gasol attempts a Dunk. Contested by Stephen Haliburton (4.2 feet, ZONE). COLE GASOL MAKES IT!
Score: 87-60

[00:21] Team_058 possession (Score: 87-60)
Vince Hyland attempts a 3Pt. Contested by Khris Bryant (3.3 feet, ZONE). Vince Hyland misses. Rebound secured by Khris Bryant.

[00:07] Team_070 possession (Score: 87-60)
Khris Bryant attempts a Layup. Contested by Stephen Haliburton (3.9 feet, ZONE). Khris Bryant misses. Rebound secured by Stephen Haliburton.

================================================================================
                              3RD QUARTER COMPLETE                              
================================================================================

3RD QUARTER SCORE: Team_070 37, Team_058 21

BOX SCORE:
================================================================================

Team_070
--------------------------------------------------------------------------------
Player                MIN  PTS  REB  AST  TO      FG   FG%      3P   3P%
--------------------------------------------------------------------------------
Khris Bryant           30   11    4    0   0   5/6    83.3     0/0   0.0
John Hyland            30   10    0    2   0   4/6    66.7     0/0   0.0
LeBron Barnes          30    7    2    2   0   3/3   100.0     0/0   0.0
Jabari Paul            30    5    1    1   0   2/3    66.7     0/0   0.0
Cole Gasol             30    4    0    4   0   2/2   100.0     0/0   0.0

TEAM: FG: 16/20 (80.0%), 3PT: 5/6 (83.3%), REB: 6 (2 off, 4 def), AST: 9, TO: 3
TEAM FOULS: 7 [Team_058 in BONUS]


Team_058
--------------------------------------------------------------------------------
Player                MIN  PTS  REB  AST  TO      FG   FG%      3P   3P%
--------------------------------------------------------------------------------
Vince Hyland           30    7    0    1   0   3/4    75.0     0/0   0.0
Bradley Sexton         30    5    2    1   0   2/4    50.0     0/0   0.0
Stephen Haliburton     30    5    3    0   0   2/4    50.0     0/0   0.0
Kyle Westbrook         30    2    0    1   0   1/1   100.0     0/0   0.0
Tyrese Doncic          30    2    1    1   0   1/1   100.0     0/0   0.0

TEAM: FG: 9/14 (64.3%), 3PT: 1/5 (20.0%), REB: 7 (3 off, 4 def), AST: 4, TO: 8
TEAM FOULS: 10 [Team_070 in BONUS]

================================================================================

================================================================================
                       4TH QUARTER - Team_070 vs Team_058                       
================================================================================

[12:00] Substitution (Team_070): Cole Gasol OUT → Paul Quickley IN (stamina_rule2)

[12:00] Substitution (Team_070): LeBron Barnes OUT → Allen Quickley IN (stamina_rule2)

[12:00] Substitution (Team_070): Khris Bryant OUT → Luka Gobert IN (stamina_rule2)

[12:00] Substitution (Team_070): Jabari Paul OUT → Russell Morant IN (stamina_rule2)

[12:00] Substitution (Team_058): Bradley Sexton OUT → Draymond Williamson IN (stamina_rule2)

[12:00] Substitution (Team_058): Kyle Westbrook OUT → Jordan Ingram IN (stamina_rule2)

[12:00] Substitution (Team_058): Vince Hyland OUT → Pascal Holiday IN (stamina_rule2)

[12:00] Substitution (Team_058): Stephen Haliburton OUT → Shai Lowry IN (stamina_rule2)

[12:00] Substitution (Team_058): Tyrese Doncic OUT → Jarrett Gilgeous-Alexander IN (stamina_rule2)

[12:00] Team_070 possession (Score: 87-60)
Cole Gasol loses control! Ball rolls out of bounds! TURNOVER! (dead ball)

[11:50] Team_058 possession (Score: 87-60)
Jarrett Gilgeous-Alexander drives and kicks out. Pascal Holiday attempts a Midrange. BLOCKED BY JOHN HYLAND! Ball is loose! Rebound secured by Russell Morant.

[11:35] Team_070 possession (Score: 87-60)
Allen Quickley throws a bad pass out of bounds! TURNOVER! (dead ball)

[11:35] Substitution (Team_070): John Hyland OUT → D'Angelo McGrady IN (stamina_rule2)

[11:16] Team_058 possession (Score: 87-60)
Jarrett Gilgeous-Alexander attempts a Midrange. Contested by Russell Morant (3.7 feet, MAN). Jarrett Gilgeous-Alexander misses. Rebound secured by D'Angelo McGrady.

[11:02] Team_070 possession (Score: 87-60)
Luka Gobert drives, picks up Shai Lowry. Help arrives from Jordan Ingram! Luka Gobert attempts a Dunk. Contested by Jordan Ingram (4.1 feet, ZONE). LUKA GOBERT MAKES IT! Assist: D'Angelo McGrady
Score: 89-60

[10:48] Team_058 possession (Score: 89-60)
Shai Lowry attempts a 3Pt. Contested by Luka Gobert (4.7 feet, MAN). Shai Lowry misses. Rebound secured by Russell Morant.

[10:30] Team_070 possession (Score: 89-60)
FOUL! Reach-in foul on Shai Lowry during the drive. [Team fouls: 1] No free throws, side out. (Shai Lowry: 1 personal fouls)

[10:12] Team_070 possession (Score: 89-60)
D'Angelo McGrady attempts a Midrange. Contested by Pascal Holiday (4.6 feet, MAN). D'Angelo McGrady misses. Rebound secured by Pascal Holiday.

[09:53] Team_058 possession (Score: 89-60)
Jarrett Gilgeous-Alexander drives and kicks out. Shai Lowry makes the Midrange and draws the foul on Luka Gobert! And-1! Shai Lowry to the line for 1. [Team fouls: 1] (Luka Gobert: 1 personal fouls)   FT 1/1: GOOD Shai Lowry makes 1/1 from the line.
Score: 89-63

[09:40] Team_070 possession (Score: 89-63)
D'Angelo McGrady attempts a 3Pt. Contested by Pascal Holiday (4.6 feet, MAN). D'Angelo McGrady misses. Rebound secured by Pascal Holiday.

[09:24] Team_058 possession (Score: 89-63)
Shai Lowry attempts a 3Pt. Contested by Paul Quickley (4.2 feet, ZONE). SHAI LOWRY MAKES IT! Assist: Jarrett Gilgeous-Alexander
Score: 89-66

[09:07] Team_070 possession (Score: 89-66)
Luka Gobert attempts a Layup. Contested by Shai Lowry (4.1 feet, MAN). LUKA GOBERT MAKES IT! Assist: Allen Quickley
Score: 91-66

[08:54] Team_058 possession (Score: 91-66)
Shai Lowry attempts a Midrange. Contested by Luka Gobert (4.7 feet, MAN). Shai Lowry misses. Offensive rebound by Pascal Holiday! Pascal Holiday puts it back in!
Score: 91-68

[08:38] Team_070 possession (Score: 91-68)
Paul Quickley attempts a Midrange. Contested by Pascal Holiday (4.5 feet, ZONE). Paul Quickley misses. Offensive rebound by Russell Morant! Russell Morant's putback is no good. Rebound secured by Shai Lowry.

[08:22] Team_058 possession (Score: 91-68)
Draymond Williamson attempts a 3Pt. Contested by Paul Quickley (4.8 feet, ZONE). Draymond Williamson misses. Rebound secured by D'Angelo McGrady.

[08:08] Team_070 possession (Score: 91-68)
Allen Quickley attempts a 3Pt. Contested by Draymond Williamson (5.3 feet, ZONE). ALLEN QUICKLEY MAKES IT! Assist: D'Angelo McGrady
Score: 94-68

[07:50] Team_058 possession (Score: 94-68)
FOUL! Holding foul on Paul Quickley. [Team fouls: 2] No free throws, side out. (Paul Quickley: 1 personal fouls)

[07:34] Team_058 possession (Score: 94-68)
Jordan Ingram drives and kicks out. Pascal Holiday attempts a 3Pt. Contested by D'Angelo McGrady (5.6 feet, MAN). Pascal Holiday misses. Rebound secured by D'Angelo McGrady.

[07:22] Team_070 possession (Score: 94-68)
Paul Quickley drives to the basket... Paul Quickley throws a bad pass out of bounds! TURNOVER! (dead ball)

[07:06] Team_058 possession (Score: 94-68)
Draymond Williamson drives and kicks out. Jarrett Gilgeous-Alexander attempts a 3Pt. Contested by Russell Morant (3.7 feet, MAN). Jarrett Gilgeous-Alexander misses. Rebound secured by Luka Gobert.

[06:53] Team_070 possession (Score: 94-68)
Paul Quickley attempts a 3Pt. Contested by Draymond Williamson (5.1 feet, ZONE). Paul Quickley misses. Rebound secured by Shai Lowry.

[06:39] Team_058 possession (Score: 94-68)
FOUL! Shooting foul on Russell Morant. Draymond Williamson to the line for 2 free throws. [Team fouls: 3] (Russell Morant: 1 personal fouls)   FT 1/2: MISS   FT 2/2: GOOD Draymond Williamson makes 1/2 from the line.
Score: 94-69

[06:27] Team_070 possession (Score: 94-69)
D'Angelo McGrady attempts a Midrange. Contested by Pascal Holiday (4.6 feet, MAN). D'ANGELO MCGRADY MAKES IT! Assist: Paul Quickley
Score: 96-69

[06:13] Team_058 possession (Score: 96-69)
FOUL! Shooting foul on Russell Morant. Jarrett Gilgeous-Alexander to the line for 2 free throws. [Team fouls: 4] (Russell Morant: 2 personal fouls)   FT 1/2: GOOD   FT 2/2: GOOD Jarrett Gilgeous-Alexander makes 2/2 from the line.
Score: 96-71

[05:59] Team_070 possession (Score: 96-71)
FOUL! Shooting foul on Pascal Holiday. Paul Quickley to the line for 2 free throws. [Team fouls: 2] (Pascal Holiday: 1 personal fouls)   FT 1/2: GOOD   FT 2/2: MISS Paul Quickley makes 1/2 from the line. Offensive rebound by Luka Gobert! Luka Gobert kicks it out.
Score: 97-71

[05:45] Team_070 possession (Score: 97-71)
Russell Morant drives and kicks out. Russell Morant attempts a 3Pt. Contested by Jarrett Gilgeous-Alexander (5.3 feet, MAN). Russell Morant misses. Rebound secured by Jarrett Gilgeous-Alexander.

[05:27] Team_058 possession (Score: 97-71)
Jordan Ingram attempts a Midrange. Contested by Allen Quickley (5.2 feet, ZONE). Jordan Ingram misses. Offensive rebound by Shai Lowry! Shai Lowry kicks it out.

[05:12] Team_058 possession (Score: 97-71)
Pascal Holiday makes the 3Pt and draws the foul on Paul Quickley! And-1! Pascal Holiday to the line for 1. [BONUS: 5 team fouls] (Paul Quickley: 2 personal fouls)   FT 1/1: GOOD Pascal Holiday makes 1/1 from the line.
Score: 97-75

[05:02] Team_070 possession (Score: 97-75)
Paul Quickley attempts a Midrange. Contested by Draymond Williamson (5.1 feet, MAN). Paul Quickley misses. Rebound secured by Jarrett Gilgeous-Alexander.

[04:47] Team_058 possession (Score: 97-75)
Pascal Holiday attempts a Layup. Contested by D'Angelo McGrady (5.7 feet, MAN). PASCAL HOLIDAY MAKES IT!
Score: 97-77

[04:33] Team_070 possession (Score: 97-77)
Russell Morant drives, Jarrett Gilgeous-Alexander stays with him. Russell Morant attempts a Dunk. Contested by Jarrett Gilgeous-Alexander (5.5 feet, MAN). RUSSELL MORANT MAKES IT! Assist: Allen Quickley
Score: 99-77

[04:18] Team_058 possession (Score: 99-77)
Draymond Williamson throws a bad pass out of bounds! TURNOVER! (dead ball)

[04:04] Team_070 possession (Score: 99-77)
Luka Gobert drives and kicks out. D'Angelo McGrady attempts a Midrange. Contested by Draymond Williamson (5.3 feet, ZONE). D'ANGELO MCGRADY MAKES IT! Assist: Allen Quickley
Score: 101-77

[03:50] Team_058 possession (Score: 101-77)
Jordan Ingram attempts a Midrange. Contested by Allen Quickley (5.4 feet, ZONE). JORDAN INGRAM MAKES IT! Assist: Pascal Holiday
Score: 101-79

[03:32] Team_070 possession (Score: 101-79)
D'Angelo McGrady drives, Shai Lowry stays with him. D'Angelo McGrady attempts a Dunk. Contested by Shai Lowry (4.2 feet, ZONE). D'ANGELO MCGRADY MAKES IT! Assist: Luka Gobert
Score: 103-79

[03:16] Team_058 possession (Score: 103-79)
Jordan Ingram attempts a 3Pt. Contested by Paul Quickley (4.5 feet, ZONE). Jordan Ingram misses. Offensive rebound by Pascal Holiday! Pascal Holiday puts it back in!
Score: 103-81

[03:00] Team_070 possession (Score: 103-81)
Allen Quickley drives, Shai Lowry stays with him. Allen Quickley attempts a Layup. Contested by Shai Lowry (4.3 feet, ZONE). ALLEN QUICKLEY MAKES IT! Assist: Luka Gobert
Score: 105-81

[02:46] Team_058 possession (Score: 105-81)
Pascal Holiday attempts a Layup. BLOCKED BY D'ANGELO MCGRADY! Ball is loose! Rebound secured by D'Angelo McGrady.

[02:27] Team_070 possession (Score: 105-81)
Allen Quickley attempts a 3Pt. Contested by Draymond Williamson (5.4 feet, ZONE). ALLEN QUICKLEY MAKES IT! Assist: Paul Quickley
Score: 108-81

[02:12] Team_058 possession (Score: 108-81)
Jordan Ingram attempts a 3Pt. Contested by Paul Quickley (4.6 feet, ZONE). JORDAN INGRAM MAKES IT!
Score: 108-84

[01:58] Team_070 possession (Score: 108-84)
D'Angelo McGrady attempts a 3Pt. Contested by Draymond Williamson (5.5 feet, ZONE). D'Angelo McGrady misses. Rebound secured by Jarrett Gilgeous-Alexander.

[01:45] Team_058 possession (Score: 108-84)
Pascal Holiday attempts a 3Pt. Contested by Paul Quickley (4.7 feet, ZONE). Pascal Holiday misses. Offensive rebound by Shai Lowry! Shai Lowry kicks it out.

[01:30] Team_058 possession (Score: 108-84)
Pascal Holiday attempts a 3Pt. Contested by Paul Quickley (4.7 feet, ZONE). Pascal Holiday misses. Rebound secured by D'Angelo McGrady.

[01:19] Team_070 possession (Score: 108-84)
D'Angelo McGrady attempts a 3Pt. Contested by Shai Lowry (4.5 feet, ZONE). D'Angelo McGrady misses. Rebound secured by Pascal Holiday.

[01:03] Team_058 possession (Score: 108-84)
Pascal Holiday drives, picks up D'Angelo McGrady. Help arrives from Paul Quickley! Pascal Holiday attempts a Dunk. Contested by Paul Quickley (5.9 feet, MAN). PASCAL HOLIDAY MAKES IT! Assist: Jarrett Gilgeous-Alexander
Score: 108-86

[00:48] Team_070 possession (Score: 108-86)
Allen Quickley attempts a Layup. Contested by Shai Lowry (4.5 feet, ZONE). ALLEN QUICKLEY MAKES IT! Assist: D'Angelo McGrady
Score: 110-86

[00:29] Team_058 possession (Score: 110-86)
Jordan Ingram drives and kicks out. Draymond Williamson attempts a 3Pt. Contested by Paul Quickley (4.8 feet, MAN). Draymond Williamson misses. Rebound secured by Russell Morant.

[00:18] Team_070 possession (Score: 110-86)
Russell Morant attempts a Layup. Contested by Jarrett Gilgeous-Alexander (5.9 feet, MAN). Russell Morant misses. Rebound secured by Jarrett Gilgeous-Alexander.

[00:03] Team_058 possession (Score: 110-86)
Shai Lowry attempts a 3Pt. Contested by Paul Quickley (4.7 feet, ZONE). SHAI LOWRY MAKES IT! Assist: Jarrett Gilgeous-Alexander
Score: 110-89

================================================================================
                              4TH QUARTER COMPLETE                              
================================================================================

4TH QUARTER SCORE: Team_070 23, Team_058 29

BOX SCORE:
================================================================================

Team_070
--------------------------------------------------------------------------------
Player                MIN  PTS  REB  AST  TO      FG   FG%      3P   3P%
--------------------------------------------------------------------------------
Allen Quickley         19   10    0    3   0   4/4   100.0     0/0   0.0
D'Angelo McGrady       18    6    5    3   0   3/7    42.9     0/0   0.0
Luka Gobert            19    4    2    2   0   2/2   100.0     0/0   0.0
Russell Morant         19    2    3    0   0   1/3    33.3     0/0   0.0
Paul Quickley          19    0    0    2   0   0/3     0.0     0/0   0.0

TEAM: FG: 10/19 (52.6%), 3PT: 2/6 (33.3%), REB: 11 (2 off, 9 def), AST: 10, TO: 3
TEAM FOULS: 5 [Team_058 in BONUS]


Team_058
--------------------------------------------------------------------------------
Player                MIN  PTS  REB  AST  TO      FG   FG%      3P   3P%
--------------------------------------------------------------------------------
Pascal Holiday         19   12    5    1   0   5/7    71.4     0/0   0.0
Shai Lowry             19    9    4    0   0   3/4    75.0     0/0   0.0
Jordan Ingram          19    5    0    0   0   2/4    50.0     0/0   0.0
Jarrett Gilgeous-Alexander   19    2    4    3   0   1/3    33.3     0/0   0.0
Draymond Williamson    19    1    0    0   0   1/3    33.3     0/0   0.0

TEAM: FG: 12/21 (57.1%), 3PT: 5/8 (62.5%), REB: 12 (4 off, 8 def), AST: 4, TO: 1
TEAM FOULS: 2

================================================================================

================================================================================
                               FULL GAME COMPLETE                               
================================================================================

FINAL SCORE: Team_070 110, Team_058 89

SCORING BY QUARTER:
--------------------------------------------------------------------------------
Team                     Q1     Q2     Q3     Q4    FINAL
--------------------------------------------------------------------------------
Team_070                 22     28     37     23      110
Team_058                 22     17     21     29       89
--------------------------------------------------------------------------------

FULL GAME BOX SCORE:
================================================================================

Team_070
--------------------------------------------------------------------------------
Player                MIN  PTS  REB  AST  TO      FG   FG%      3P   3P%      FT STL BLK
--------------------------------------------------------------------------------
John Hyland            31   12    0    2   0   6/13   46.2   3/7    42.9   2/2     1   3
Cole Gasol             30   13    0    6   2   7/11   63.6   2/3    66.7   0/0     0   0
LeBron Barnes          30   14    9    4   1   4/7    57.1   1/4    25.0   4/4     0   1
Khris Bryant           30   19    8    1   0   9/10   90.0   1/1   100.0   2/2     2   3
Jabari Paul            30   15    7    4   3   6/10   60.0   0/1     0.0   7/7     0   1
Paul Quickley          19    7    0    3   0   4/10   40.0   0/3     0.0   2/4     1   0
Allen Quickley         19   10    0    3   1   4/5    80.0   2/2   100.0   0/0     0   0
Luka Gobert            19   11    3    2   1   6/7    85.7   0/0     0.0   1/1     1   0
Russell Morant         19    2    6    2   1   1/3    33.3   0/0     0.0   0/0     0   0
D'Angelo McGrady       18    6    7    4   0   2/6    33.3   0/3     0.0   0/0     0   1

TEAM: FG: 49/82 (59.8%), 3PT: 9/24 (37.5%), REB: 39 (7 off, 32 def), AST: 31, TO: 9


Team_058
--------------------------------------------------------------------------------
Player                MIN  PTS  REB  AST  TO      FG   FG%      3P   3P%      FT STL BLK
--------------------------------------------------------------------------------
Bradley Sexton         30   13    5    1   1   5/10   50.0   1/4    25.0   2/2     0   0
Kyle Westbrook         30    4    0    1   3   0/4     0.0   0/2     0.0   4/5     0   0
Vince Hyland           30   15    0    1   1   8/14   57.1   1/4    25.0   5/7     0   1
Stephen Haliburton     30   14   12    1   4   4/10   40.0   0/2     0.0   4/4     2   0
Tyrese Doncic          30    4    6    2   3   3/3   100.0   0/0     0.0   2/2     1   0
Draymond Williamson    19    1    0    0   2   1/3    33.3   0/1     0.0   1/2     0   0
Jordan Ingram          19    5    0    0   1   3/6    50.0   2/2   100.0   0/0     0   0
Pascal Holiday         19   14    5    1   0   4/9    44.4   1/5    20.0   3/3     0   0
Shai Lowry             19   12   10    1   0   3/5    60.0   2/3    66.7   1/1     1   0
Jarrett Gilgeous-Alexander   19    4    5    4   1   4/7    57.1   0/0     0.0   2/2     0   0

TEAM: FG: 36/73 (49.3%), 3PT: 7/23 (30.4%), REB: 44 (12 off, 32 def), AST: 12, TO: 16

================================================================================
