================================================================================
                        FULL GAME - Team_051 vs Team_046                        
================================================================================

================================================================================
                       1ST QUARTER - Team_051 vs Team_046                       
================================================================================

[12:00] Team_051 possession (Score: 0-0)
FOUL! Shooting foul on D'Angelo O'Neal. Austin Sexton to the line for 3 free throws. [Team fouls: 1] (D'Angelo O'Neal: 1 personal fouls)   FT 1/3: GOOD   FT 2/3: GOOD   FT 3/3: GOOD Austin Sexton makes 3/3 from the line.
Score: 3-0

[11:49] Team_046 possession (Score: 3-0)
Cade Wall attempts a Layup. Contested by Franz Simmons (4.8 feet, MAN). Cade Wall misses. Rebound secured by Shaquille Harden.

[11:34] Team_051 possession (Score: 3-0)
Franz Simmons attempts a 3Pt. Contested by Cade Wall (4.2 feet, MAN). Franz Simmons misses. Rebound secured by Kevin Allen.

[11:23] Team_046 possession (Score: 3-0)
D'Angelo O'Neal attempts a Midrange. Contested by Austin Sexton (4.6 feet, MAN). D'ANGELO O'NEAL MAKES IT! Assist: Victor Nowitzki
Score: 3-2

[11:06] Team_051 possession (Score: 3-2)
OG Siakam makes the Layup and draws the foul on Kevin Allen! And-1! OG Siakam to the line for 1. [Team fouls: 2] (Kevin Allen: 1 personal fouls)   FT 1/1: GOOD OG Siakam makes 1/1 from the line.
Score: 6-2

[10:53] Team_046 possession (Score: 6-2)
Victor Nowitzki attempts a 3Pt. Contested by Austin Sexton (4.5 feet, ZONE). Victor Nowitzki misses. Rebound secured by OG Siakam.

[10:38] Team_051 possession (Score: 6-2)
Austin Sexton attempts a 3Pt. Contested by Lauri Carter (3.3 feet, ZONE). Austin Sexton misses. Rebound secured by Cade Wall.

[10:26] Team_046 possession (Score: 6-2)
Cade Wall attempts a Midrange. Contested by Franz Simmons (4.8 feet, MAN). Cade Wall misses. Offensive rebound by Cade Wall! Cade Wall kicks it out.

[10:10] Team_046 possession (Score: 6-2)
Victor Nowitzki attempts a 3Pt. Contested by Austin Sexton (4.5 feet, ZONE). VICTOR NOWITZKI MAKES IT! Assist: Lauri Carter
Score: 6-5

[09:57] Team_051 possession (Score: 6-5)
OG Siakam throws a bad pass! Stolen by Lauri Carter! TURNOVER! (live ball)

[09:44] Team_046 possession (Score: 6-5)
Kevin Allen attempts a Layup. Contested by Shaquille Harden (4.5 feet, MAN). KEVIN ALLEN MAKES IT!
Score: 6-7

[09:28] Team_051 possession (Score: 6-7)
OG Siakam attempts a 3Pt. Contested by Lauri Carter (3.5 feet, ZONE). OG SIAKAM MAKES IT! Assist: Austin Sexton
Score: 9-7

[09:12] Team_046 possession (Score: 9-7)
Victor Nowitzki attempts a 3Pt. Contested by Larry McGrady (4.6 feet, MAN). Victor Nowitzki misses. Rebound secured by OG Siakam.

[08:56] Team_051 possession (Score: 9-7)
FOUL! Holding foul on Cade Wall. [Team fouls: 3] No free throws, side out. (Cade Wall: 1 personal fouls)

[08:45] Team_051 possession (Score: 9-7)
Shaquille Harden drives, Cade Wall stays with him. Shaquille Harden attempts a Dunk. Contested by Cade Wall (3.7 feet, ZONE). Shaquille Harden misses. Rebound secured by Kevin Allen.

[08:28] Team_046 possession (Score: 9-7)
Lauri Carter attempts a Midrange. Contested by OG Siakam (4.0 feet, MAN). Lauri Carter misses. FOUL! Loose ball foul on Franz Simmons during the rebound battle. [Team fouls: 1] No free throws, side out. (Franz Simmons: 1 personal fouls)

[08:18] Team_046 possession (Score: 9-7)
Lauri Carter attempts a 3Pt. Contested by OG Siakam (4.0 feet, MAN). Lauri Carter misses. Rebound secured by OG Siakam.

[08:05] Team_051 possession (Score: 9-7)
Shaquille Harden drives, Kevin Allen stays with him. Shaquille Harden attempts a Layup. Contested by Kevin Allen (4.6 feet, MAN). Shaquille Harden misses. Offensive rebound by Franz Simmons! Franz Simmons kicks it out.

[07:49] Team_051 possession (Score: 9-7)
Shaquille Harden attempts a Midrange. Contested by Cade Wall (3.7 feet, ZONE). Shaquille Harden misses. Offensive rebound by Franz Simmons! Franz Simmons kicks it out.

[07:33] Team_051 possession (Score: 9-7)
Austin Sexton attempts a 3Pt. Contested by Lauri Carter (3.3 feet, ZONE). Austin Sexton misses. Rebound secured by Kevin Allen.

[07:18] Team_046 possession (Score: 9-7)
D'Angelo O'Neal drives and kicks out. Lauri Carter attempts a Midrange. Contested by OG Siakam (3.8 feet, MAN). LAURI CARTER MAKES IT! Assist: D'Angelo O'Neal
Score: 9-9

[07:05] Team_051 possession (Score: 9-9)
Larry McGrady attempts a Midrange. Contested by Victor Nowitzki (5.8 feet, ZONE). Larry McGrady misses. Rebound secured by Lauri Carter.

[06:51] Team_046 possession (Score: 9-9)
FOUL! Holding foul on Austin Sexton. [Team fouls: 2] No free throws, side out. (Austin Sexton: 1 personal fouls)

[06:36] Team_046 possession (Score: 9-9)
Kevin Allen attempts a 3Pt. Contested by Austin Sexton (4.7 feet, ZONE). Kevin Allen misses. Rebound secured by OG Siakam.

[06:22] Team_051 possession (Score: 9-9)
OG Siakam attempts a Midrange. Contested by Cade Wall (4.0 feet, ZONE). OG Siakam misses. Rebound secured by Kevin Allen.

[06:13] Team_046 possession (Score: 9-9)
Lauri Carter attempts a 3Pt. Contested by OG Siakam (4.0 feet, MAN). LAURI CARTER MAKES IT! Assist: D'Angelo O'Neal
Score: 9-12

[05:55] Team_051 possession (Score: 9-12)
Larry McGrady drives, Kevin Allen stays with him. Larry McGrady attempts a Dunk. Contested by Kevin Allen (5.0 feet, ZONE). Larry McGrady misses. Rebound secured by Kevin Allen.

[05:40] Team_046 possession (Score: 9-12)
Kevin Allen attempts a Midrange. Contested by Shaquille Harden (4.5 feet, MAN). KEVIN ALLEN MAKES IT! Assist: D'Angelo O'Neal
Score: 9-14

[05:24] Team_051 possession (Score: 9-14)
FOUL! Holding foul on Cade Wall. [Team fouls: 4] No free throws, side out. (Cade Wall: 2 personal fouls)

[05:09] Team_051 possession (Score: 9-14)
Larry McGrady makes the Layup and draws the foul on Kevin Allen! And-1! Larry McGrady to the line for 1. [BONUS: 5 team fouls] (Kevin Allen: 2 personal fouls)   FT 1/1: GOOD Larry McGrady makes 1/1 from the line.
Score: 12-14

[04:57] Team_046 possession (Score: 12-14)
Kevin Allen drives to the basket... Kevin Allen loses the ball! Stripped by Franz Simmons! TURNOVER! (live ball)

[04:40] Team_051 possession (Score: 12-14)
Franz Simmons drives, Cade Wall stays with him. Franz Simmons attempts a Layup. Contested by Cade Wall (4.3 feet, MAN). FRANZ SIMMONS MAKES IT!
Score: 14-14

[04:22] Team_046 possession (Score: 14-14)
D'Angelo O'Neal drives to the basket... D'Angelo O'Neal loses control! Ball rolls out of bounds! TURNOVER! (dead ball)

[04:10] Team_051 possession (Score: 14-14)
Austin Sexton drives and kicks out. Larry McGrady attempts a 3Pt. Contested by Victor Nowitzki (5.6 feet, MAN). Larry McGrady misses. Rebound secured by Kevin Allen.

[03:56] Team_046 possession (Score: 14-14)
Victor Nowitzki attempts a 3Pt. Contested by Larry McGrady (4.7 feet, MAN). VICTOR NOWITZKI MAKES IT! Assist: Lauri Carter
Score: 14-17

[03:43] Team_051 possession (Score: 14-17)
FOUL! Shooting foul on Lauri Carter. OG Siakam to the line for 3 free throws. [BONUS: 6 team fouls] (Lauri Carter: 1 personal fouls)   FT 1/3: GOOD   FT 2/3: GOOD   FT 3/3: GOOD OG Siakam makes 3/3 from the line.
Score: 17-17

[03:29] Team_046 possession (Score: 17-17)
Victor Nowitzki attempts a 3Pt. Contested by Austin Sexton (4.6 feet, ZONE). Victor Nowitzki misses. Offensive rebound by Kevin Allen! Kevin Allen kicks it out.

[03:13] Team_046 possession (Score: 17-17)
D'Angelo O'Neal attempts a 3Pt. Contested by Franz Simmons (4.6 feet, ZONE). D'Angelo O'Neal misses. Offensive rebound by Kevin Allen! Kevin Allen kicks it out.

[02:57] Team_046 possession (Score: 17-17)
Kevin Allen makes the Midrange and draws the foul on Larry McGrady! And-1! Kevin Allen to the line for 1. [Team fouls: 3] (Larry McGrady: 1 personal fouls)   FT 1/1: GOOD Kevin Allen makes 1/1 from the line.
Score: 17-20

[02:46] Team_051 possession (Score: 17-20)
Larry McGrady attempts a 3Pt. Contested by Victor Nowitzki (6.0 feet, MAN). LARRY MCGRADY MAKES IT! Assist: Austin Sexton
Score: 20-20

[02:36] Team_046 possession (Score: 20-20)
FOUL! Reach-in foul on OG Siakam during the drive. [Team fouls: 4] No free throws, side out. (OG Siakam: 1 personal fouls)

[02:18] Team_046 possession (Score: 20-20)
D'Angelo O'Neal attempts a 3Pt. Contested by Austin Sexton (4.8 feet, MAN). D'ANGELO O'NEAL MAKES IT! Assist: Victor Nowitzki
Score: 20-23

[02:08] Team_051 possession (Score: 20-23)
Shaquille Harden makes the Dunk and draws the foul on D'Angelo O'Neal! And-1! Shaquille Harden to the line for 1. [BONUS: 7 team fouls] (D'Angelo O'Neal: 2 personal fouls)   FT 1/1: GOOD Shaquille Harden makes 1/1 from the line.
Score: 23-23

[01:56] Team_046 possession (Score: 23-23)
FOUL! Holding foul on Shaquille Harden. [IN THE BONUS! 5 team fouls] Kevin Allen to the line for 2 free throws. (Shaquille Harden: 1 personal fouls)   FT 1/2: GOOD   FT 2/2: GOOD Kevin Allen makes 2/2 from the line.
Score: 23-25

[01:41] Team_051 possession (Score: 23-25)
OG Siakam drives to the basket... OG Siakam loses the ball! Stripped by Cade Wall! TURNOVER! (live ball)

[01:24] Team_046 possession (Score: 23-25)
Lauri Carter attempts a 3Pt. Contested by Larry McGrady (5.0 feet, ZONE). LAURI CARTER MAKES IT! Assist: Cade Wall
Score: 23-28

[01:08] Team_051 possession (Score: 23-28)
Austin Sexton attempts a 3Pt. Contested by D'Angelo O'Neal (4.6 feet, MAN). AUSTIN SEXTON MAKES IT! Assist: Shaquille Harden
Score: 26-28

[00:49] Team_046 possession (Score: 26-28)
FOUL! Shooting foul on OG Siakam. D'Angelo O'Neal to the line for 2 free throws. [BONUS: 6 team fouls] (OG Siakam: 2 personal fouls)   FT 1/2: GOOD   FT 2/2: GOOD D'Angelo O'Neal makes 2/2 from the line.
Score: 26-30

[00:31] Team_051 possession (Score: 26-30)
Larry McGrady attempts a 3Pt. Wide open! Victor Nowitzki is 6.2 feet away. [MAN] Larry McGrady misses. Rebound secured by Cade Wall.

[00:15] Team_046 possession (Score: 26-30)
D'Angelo O'Neal drives, Austin Sexton stays with him. D'Angelo O'Neal attempts a Layup. Contested by Austin Sexton (5.0 feet, MAN). D'Angelo O'Neal misses. Offensive rebound by Cade Wall! Cade Wall kicks it out.

================================================================================
                              1ST QUARTER COMPLETE                              
================================================================================

1ST QUARTER SCORE: Team_051 26, Team_046 30

BOX SCORE:
================================================================================

Team_051
--------------------------------------------------------------------------------
Player                MIN  PTS  REB  AST  TO      FG   FG%      3P   3P%
--------------------------------------------------------------------------------
OG Siakam              12    9    4    0   0   3/4    75.0     0/0   0.0
Austin Sexton          12    6    0    2   0   2/5    40.0     0/0   0.0
Larry McGrady          12    6    0    0   0   2/5    40.0     0/0   0.0
Shaquille Harden       12    3    1    1   0   1/2    50.0     0/0   0.0
Franz Simmons          12    2    2    0   0   1/2    50.0     0/0   0.0

TEAM: FG: 9/18 (50.0%), 3PT: 5/9 (55.6%), REB: 7 (2 off, 5 def), AST: 3, TO: 2
TEAM FOULS: 6 [Team_046 in BONUS]


Team_046
--------------------------------------------------------------------------------
Player                MIN  PTS  REB  AST  TO      FG   FG%      3P   3P%
--------------------------------------------------------------------------------
Kevin Allen            12    9    9    0   0   4/5    80.0     0/0   0.0
Lauri Carter           12    8    1    2   0   3/4    75.0     0/0   0.0
D'Angelo O'Neal        12    7    0    3   0   3/3   100.0     0/0   0.0
Victor Nowitzki        12    6    0    2   0   2/4    50.0     0/0   0.0
Cade Wall              12    0    4    1   0   0/1     0.0     0/0   0.0

TEAM: FG: 12/17 (70.6%), 3PT: 5/9 (55.6%), REB: 14 (5 off, 9 def), AST: 8, TO: 2
TEAM FOULS: 7 [Team_051 in BONUS]

================================================================================

================================================================================
                       2ND QUARTER - Team_051 vs Team_046                       
================================================================================

[12:00] Team_051 possession (Score: 26-30)
OG Siakam attempts a 3Pt. Contested by Lauri Carter (3.8 feet, MAN). OG Siakam misses. Rebound secured by Kevin Allen.

[11:46] Team_046 possession (Score: 26-30)
D'Angelo O'Neal attempts a 3Pt. Contested by Austin Sexton (4.8 feet, MAN). D'Angelo O'Neal misses. Rebound secured by Shaquille Harden.

[11:33] Team_051 possession (Score: 26-30)
Shaquille Harden loses the ball! Stripped by Kevin Allen! TURNOVER! (live ball)

[11:22] Team_046 possession (Score: 26-30)
Cade Wall drives, picks up Franz Simmons. Help arrives from Austin Sexton! Cade Wall attempts a Dunk. Contested by Austin Sexton (5.1 feet, ZONE). Cade Wall misses. Rebound secured by Franz Simmons.

[11:11] Team_051 possession (Score: 26-30)
Larry McGrady attempts a Midrange. Wide open! Victor Nowitzki is 6.1 feet away. [ZONE] LARRY MCGRADY MAKES IT!
Score: 28-30

[10:55] Team_046 possession (Score: 28-30)
Kevin Allen attempts a Layup. Contested by Shaquille Harden (4.8 feet, MAN). Kevin Allen misses. Rebound secured by Shaquille Harden.

[10:39] Team_051 possession (Score: 28-30)
Larry McGrady attempts a 3Pt. Wide open! Victor Nowitzki is 6.2 feet away. [MAN] LARRY MCGRADY MAKES IT! Assist: Franz Simmons
Score: 31-30

[10:28] Team_046 possession (Score: 31-30)
FOUL! Shooting foul on Austin Sexton. Victor Nowitzki to the line for 3 free throws. [Team fouls: 1] (Austin Sexton: 1 personal fouls)   FT 1/3: GOOD   FT 2/3: MISS   FT 3/3: GOOD Victor Nowitzki makes 2/3 from the line.
Score: 31-32

[10:12] Team_051 possession (Score: 31-32)
Franz Simmons drives, Kevin Allen stays with him. Franz Simmons attempts a Layup. Contested by Kevin Allen (5.7 feet, ZONE). FRANZ SIMMONS MAKES IT! Assist: Larry McGrady
Score: 33-32

[09:57] Team_046 possession (Score: 33-32)
Victor Nowitzki attempts a 3Pt. Contested by Austin Sexton (4.9 feet, ZONE). Victor Nowitzki misses. Rebound secured by Franz Simmons.

[09:42] Team_051 possession (Score: 33-32)
Franz Simmons attempts a Midrange. Contested by Lauri Carter (4.3 feet, ZONE). FRANZ SIMMONS MAKES IT!
Score: 35-32

[09:26] Team_046 possession (Score: 35-32)
Cade Wall attempts a 3Pt. Contested by Franz Simmons (5.3 feet, MAN). Cade Wall misses. Rebound secured by OG Siakam.

[09:15] Team_051 possession (Score: 35-32)
Austin Sexton attempts a Layup. Contested by Kevin Allen (5.4 feet, ZONE). AUSTIN SEXTON MAKES IT! Assist: Franz Simmons
Score: 37-32

[08:58] Team_046 possession (Score: 37-32)
Cade Wall attempts a Layup. Contested by Franz Simmons (5.3 feet, ZONE). Cade Wall misses. Rebound secured by Shaquille Harden.

[08:40] Team_051 possession (Score: 37-32)
Shaquille Harden attempts a Layup. Contested by Kevin Allen (5.4 feet, MAN). Shaquille Harden misses. Rebound secured by Cade Wall.

[08:25] Team_046 possession (Score: 37-32)
D'Angelo O'Neal attempts a 3Pt. Contested by Austin Sexton (5.1 feet, ZONE). D'Angelo O'Neal misses. Rebound secured by Shaquille Harden.

[08:15] Team_051 possession (Score: 37-32)
FOUL! Reach-in foul on Kevin Allen during the drive. [Team fouls: 1] No free throws, side out. (Kevin Allen: 1 personal fouls)

[08:00] Team_051 possession (Score: 37-32)
Austin Sexton drives to the basket... Austin Sexton loses control! Ball rolls out of bounds! TURNOVER! (dead ball)

[08:00] Substitution (Team_051): Austin Sexton OUT → Myles Harden IN (stamina_rule2)

[08:00] Substitution (Team_051): Larry McGrady OUT → Zion Morant IN (stamina_rule2)

[08:00] Substitution (Team_051): OG Siakam OUT → Jrue Carter IN (stamina_rule2)

[08:00] Substitution (Team_051): Franz Simmons OUT → Tobias Jokic IN (stamina_rule2)

[08:00] Substitution (Team_051): Shaquille Harden OUT → Pau Tatum IN (stamina_rule2)

[08:00] Substitution (Team_046): D'Angelo O'Neal OUT → Collin Butler IN (stamina_rule2)

[08:00] Substitution (Team_046): Victor Nowitzki OUT → Manu Dosunmu IN (stamina_rule2)

[08:00] Substitution (Team_046): Lauri Carter OUT → Josh Barrett IN (stamina_rule2)

[08:00] Substitution (Team_046): Cade Wall OUT → Chris LaVine IN (stamina_rule2)

[08:00] Substitution (Team_046): Kevin Allen OUT → Paul DeRozan IN (stamina_rule2)

[07:49] Team_046 possession (Score: 37-32)
Chris LaVine attempts a 3Pt. Contested by Myles Harden (5.0 feet, ZONE). Chris LaVine misses. Rebound secured by Tobias Jokic.

[07:38] Team_051 possession (Score: 37-32)
Tobias Jokic attempts a Layup. Contested by Chris LaVine (4.1 feet, MAN). Tobias Jokic misses. Rebound secured by Chris LaVine.

[07:27] Team_046 possession (Score: 37-32)
Josh Barrett attempts a Midrange. Contested by Tobias Jokic (5.3 feet, ZONE). JOSH BARRETT MAKES IT!
Score: 37-34

[07:12] Team_051 possession (Score: 37-34)
Pau Tatum attempts a Midrange. Contested by Chris LaVine (3.7 feet, MAN). Pau Tatum misses. Offensive rebound by Tobias Jokic! Tobias Jokic kicks it out.

[07:00] Team_051 possession (Score: 37-34)
Myles Harden attempts a 3Pt. Contested by Collin Butler (3.6 feet, MAN). Myles Harden misses. Rebound secured by Manu Dosunmu.

[06:45] Team_046 possession (Score: 37-34)
Manu Dosunmu drives and kicks out. Collin Butler attempts a Midrange. Contested by Myles Harden (4.6 feet, MAN). Collin Butler misses. Rebound secured by Tobias Jokic.

[06:28] Team_051 possession (Score: 37-34)
Myles Harden throws a bad pass! Stolen by Collin Butler! TURNOVER! (live ball)

[06:11] Team_046 possession (Score: 37-34)
Manu Dosunmu attempts a Layup. Wide open! Zion Morant is 6.1 feet away. [MAN] Manu Dosunmu misses. Rebound secured by Myles Harden.

[06:00] Team_051 possession (Score: 37-34)
FOUL! Reach-in foul on Manu Dosunmu during the drive. [Team fouls: 2] No free throws, side out. (Manu Dosunmu: 1 personal fouls)

[05:47] Team_051 possession (Score: 37-34)
Myles Harden loses the ball! Stripped by Collin Butler! TURNOVER! (live ball)

[05:30] Team_046 possession (Score: 37-34)
Collin Butler makes the Midrange and draws the foul on Myles Harden! And-1! Collin Butler to the line for 1. [Team fouls: 2] (Myles Harden: 1 personal fouls)   FT 1/1: GOOD Collin Butler makes 1/1 from the line.
Score: 37-37

[05:16] Team_051 possession (Score: 37-37)
Zion Morant attempts a 3Pt. Contested by Manu Dosunmu (5.0 feet, MAN). ZION MORANT MAKES IT! Assist: Tobias Jokic
Score: 40-37

[05:03] Team_046 possession (Score: 40-37)
Chris LaVine attempts a Midrange. Contested by Tobias Jokic (5.7 feet, MAN). Chris LaVine misses. Rebound secured by Pau Tatum.

[04:48] Team_051 possession (Score: 40-37)
Pau Tatum makes the Layup and draws the foul on Chris LaVine! And-1! Pau Tatum to the line for 1. [Team fouls: 3] (Chris LaVine: 1 personal fouls)   FT 1/1: GOOD Pau Tatum makes 1/1 from the line.
Score: 43-37

[04:33] Team_046 possession (Score: 43-37)
Chris LaVine drives to the basket... Chris LaVine loses control! Ball rolls out of bounds! TURNOVER! (dead ball)

[04:16] Team_051 possession (Score: 43-37)
Myles Harden attempts a Midrange. Contested by Collin Butler (3.6 feet, MAN). Myles Harden misses. Rebound secured by Paul DeRozan.

[03:57] Team_046 possession (Score: 43-37)
Manu Dosunmu attempts a Midrange. Contested by Tobias Jokic (5.8 feet, ZONE). MANU DOSUNMU MAKES IT!
Score: 43-39

[03:44] Team_051 possession (Score: 43-39)
Pau Tatum loses control! Ball rolls out of bounds! TURNOVER! (dead ball)

[03:29] Team_046 possession (Score: 43-39)
Josh Barrett loses control! Ball rolls out of bounds! TURNOVER! (dead ball)

[03:14] Team_051 possession (Score: 43-39)
FOUL! Reach-in foul on Chris LaVine during the drive. [Team fouls: 4] No free throws, side out. (Chris LaVine: 2 personal fouls)

[02:57] Team_051 possession (Score: 43-39)
Zion Morant attempts a 3Pt. Contested by Collin Butler (4.1 feet, ZONE). Zion Morant misses. FOUL! Loose ball foul on Manu Dosunmu during the rebound battle. [IN THE BONUS! 5 team fouls] Pau Tatum to the line for 2 free throws. (Manu Dosunmu: 2 personal fouls)   FT 1/2: GOOD   FT 2/2: GOOD Pau Tatum makes 2/2 from the line.
Score: 45-39

[02:41] Team_046 possession (Score: 45-39)
Chris LaVine drives to the basket... Chris LaVine throws a bad pass out of bounds! TURNOVER! (dead ball)

[02:29] Team_051 possession (Score: 45-39)
Myles Harden attempts a 3Pt. Contested by Collin Butler (3.6 feet, MAN). MYLES HARDEN MAKES IT! Assist: Pau Tatum
Score: 48-39

[02:15] Team_046 possession (Score: 48-39)
Paul DeRozan attempts a Layup. BLOCKED BY PAU TATUM! Ball is loose! Offensive rebound by Paul DeRozan! Paul DeRozan kicks it out.

[02:02] Team_046 possession (Score: 48-39)
Collin Butler makes the Layup and draws the foul on Jrue Carter! And-1! Collin Butler to the line for 1. [Team fouls: 3] (Jrue Carter: 1 personal fouls)   FT 1/1: GOOD Collin Butler makes 1/1 from the line.
Score: 48-42

[01:48] Team_051 possession (Score: 48-42)
Tobias Jokic drives, Chris LaVine stays with him. Tobias Jokic attempts a Layup. Contested by Chris LaVine (4.1 feet, ZONE). Tobias Jokic misses. Rebound secured by Paul DeRozan.

[01:31] Team_046 possession (Score: 48-42)
Chris LaVine attempts a Midrange. Contested by Tobias Jokic (5.7 feet, MAN). Chris LaVine misses. Rebound secured by Pau Tatum.

[01:18] Team_051 possession (Score: 48-42)
FOUL! Offensive foul on Zion Morant! Manu Dosunmu drew the charge! [Team fouls: 4] (Zion Morant: 1 personal fouls) TURNOVER! (dead ball)

[01:00] Team_046 possession (Score: 48-42)
Chris LaVine drives to the basket... Chris LaVine loses the ball! Stripped by Tobias Jokic! TURNOVER! (live ball)

[00:42] Team_051 possession (Score: 48-42)
Tobias Jokic makes the Layup and draws the foul on Chris LaVine! And-1! Tobias Jokic to the line for 1. [BONUS: 6 team fouls] (Chris LaVine: 3 personal fouls)   FT 1/1: MISS Tobias Jokic makes 0/1 from the line. Rebound secured by Chris LaVine.
Score: 50-42

[00:28] Team_046 possession (Score: 50-42)
Josh Barrett drives to the basket... Josh Barrett commits a violation (traveling/carry)! TURNOVER! (dead ball)

[00:17] Team_051 possession (Score: 50-42)
Zion Morant attempts a 3Pt. Contested by Manu Dosunmu (5.2 feet, ZONE). Zion Morant misses. Rebound secured by Paul DeRozan.

[00:04] Team_046 possession (Score: 50-42)
FOUL! Shooting foul on Pau Tatum. Paul DeRozan to the line for 2 free throws. [BONUS: 5 team fouls] (Pau Tatum: 1 personal fouls)   FT 1/2: GOOD   FT 2/2: GOOD Paul DeRozan makes 2/2 from the line.
Score: 50-44

================================================================================
                              2ND QUARTER COMPLETE                              
================================================================================

2ND QUARTER SCORE: Team_051 24, Team_046 14

BOX SCORE:
================================================================================

Team_051
--------------------------------------------------------------------------------
Player                MIN  PTS  REB  AST  TO      FG   FG%      3P   3P%
--------------------------------------------------------------------------------
Larry McGrady          16    5    0    1   0   2/2   100.0     0/0   0.0
Pau Tatum               8    5    2    1   0   2/2   100.0     0/0   0.0
Franz Simmons          16    4    2    2   0   2/2   100.0     0/0   0.0
Myles Harden            8    3    1    0   0   1/3    33.3     0/0   0.0
Zion Morant             8    3    0    0   0   1/2    50.0     0/0   0.0
Austin Sexton          16    2    0    0   0   1/1   100.0     0/0   0.0
OG Siakam              16    0    1    0   0   0/1     0.0     0/0   0.0
Shaquille Harden       16    0    4    0   0   0/1     0.0     0/0   0.0
Tobias Jokic            8    0    3    1   0   0/3     0.0     0/0   0.0

TEAM: FG: 9/17 (52.9%), 3PT: 4/7 (57.1%), REB: 13 (1 off, 12 def), AST: 5, TO: 6
TEAM FOULS: 5 [Team_046 in BONUS]


Team_046
--------------------------------------------------------------------------------
Player                MIN  PTS  REB  AST  TO      FG   FG%      3P   3P%
--------------------------------------------------------------------------------
Collin Butler           8    6    0    0   0   2/2   100.0     0/0   0.0
Victor Nowitzki        16    2    0    0   0   1/2    50.0     0/0   0.0
Josh Barrett            8    2    0    0   0   1/1   100.0     0/0   0.0
Manu Dosunmu            8    2    1    0   0   1/3    33.3     0/0   0.0
Paul DeRozan            8    2    4    0   0   1/1   100.0     0/0   0.0
Kevin Allen            16    0    1    0   0   0/1     0.0     0/0   0.0
D'Angelo O'Neal        16    0    0    0   0   0/2     0.0     0/0   0.0
Cade Wall              16    0    1    0   0   0/3     0.0     0/0   0.0
Chris LaVine            8    0    2    0   0   0/3     0.0     0/0   0.0

TEAM: FG: 6/18 (33.3%), 3PT: 1/6 (16.7%), REB: 9 (1 off, 8 def), AST: 0, TO: 5
TEAM FOULS: 6 [Team_051 in BONUS]

================================================================================

================================================================================
                       3RD QUARTER - Team_051 vs Team_046                       
================================================================================

[12:00] Team_051 possession (Score: 50-44)
FOUL! Shooting foul on Lauri Carter. OG Siakam to the line for 3 free throws. [Team fouls: 1] (Lauri Carter: 1 personal fouls)   FT 1/3: GOOD   FT 2/3: GOOD   FT 3/3: GOOD OG Siakam makes 3/3 from the line.
Score: 53-44

[11:46] Team_046 possession (Score: 53-44)
Cade Wall makes the Layup and draws the foul on Franz Simmons! And-1! Cade Wall to the line for 1. [Team fouls: 1] (Franz Simmons: 1 personal fouls)   FT 1/1: GOOD Cade Wall makes 1/1 from the line.
Score: 53-47

[11:35] Team_051 possession (Score: 53-47)
Austin Sexton attempts a 3Pt. Contested by D'Angelo O'Neal (4.1 feet, MAN). Austin Sexton misses. Rebound secured by Cade Wall.

[11:18] Team_046 possession (Score: 53-47)
Victor Nowitzki attempts a 3Pt. Contested by Austin Sexton (4.5 feet, ZONE). VICTOR NOWITZKI MAKES IT! Assist: Cade Wall
Score: 53-50

[11:06] Team_051 possession (Score: 53-50)
Larry McGrady attempts a Midrange. Contested by Lauri Carter (3.6 feet, ZONE). Larry McGrady misses. Rebound secured by Lauri Carter.

[10:47] Team_046 possession (Score: 53-50)
Cade Wall loses control! Ball rolls out of bounds! TURNOVER! (dead ball)

[10:31] Team_051 possession (Score: 53-50)
OG Siakam attempts a Layup. BLOCKED BY KEVIN ALLEN! Ball is loose! Offensive rebound by Franz Simmons! Franz Simmons kicks it out.

[10:12] Team_051 possession (Score: 53-50)
FOUL! Shooting foul on Lauri Carter. Larry McGrady to the line for 2 free throws. [Team fouls: 2] (Lauri Carter: 2 personal fouls)   FT 1/2: GOOD   FT 2/2: MISS Larry McGrady makes 1/2 from the line. Rebound secured by Kevin Allen.
Score: 54-50

[09:56] Team_046 possession (Score: 54-50)
D'Angelo O'Neal attempts a 3Pt. Contested by OG Siakam (4.1 feet, ZONE). D'Angelo O'Neal misses. Rebound secured by Franz Simmons.

[09:38] Team_051 possession (Score: 54-50)
Shaquille Harden attempts a Midrange. Contested by D'Angelo O'Neal (4.0 feet, ZONE). SHAQUILLE HARDEN MAKES IT! Assist: Larry McGrady
Score: 56-50

[09:23] Team_046 possession (Score: 56-50)
Lauri Carter attempts a 3Pt. Contested by OG Siakam (4.0 feet, MAN). Lauri Carter misses. FOUL! Loose ball foul on OG Siakam during the rebound battle. [Team fouls: 2] No free throws, side out. (OG Siakam: 1 personal fouls)

[09:07] Team_046 possession (Score: 56-50)
D'Angelo O'Neal attempts a 3Pt. Contested by Austin Sexton (4.6 feet, MAN). D'Angelo O'Neal misses. Rebound secured by Franz Simmons.

[08:50] Team_051 possession (Score: 56-50)
FOUL! Shooting foul on Lauri Carter. Larry McGrady to the line for 2 free throws. [Team fouls: 3] (Lauri Carter: 3 personal fouls)   FT 1/2: GOOD   FT 2/2: GOOD Larry McGrady makes 2/2 from the line.
Score: 58-50

[08:37] Team_046 possession (Score: 58-50)
Victor Nowitzki drives, picks up Larry McGrady. Help arrives from OG Siakam! Victor Nowitzki attempts a Dunk. Contested by OG Siakam (4.6 feet, MAN). Victor Nowitzki misses. Offensive rebound by Kevin Allen! Kevin Allen kicks it out.

[08:20] Team_046 possession (Score: 58-50)
Victor Nowitzki attempts a Midrange. Contested by Larry McGrady (4.6 feet, ZONE). VICTOR NOWITZKI MAKES IT!
Score: 58-52

[08:06] Team_051 possession (Score: 58-52)
FOUL! Reach-in foul on Victor Nowitzki during the drive. [Team fouls: 4] No free throws, side out. (Victor Nowitzki: 1 personal fouls)

[07:48] Team_051 possession (Score: 58-52)
Shaquille Harden attempts a Midrange. Contested by Kevin Allen (4.6 feet, MAN). Shaquille Harden misses. Rebound secured by Cade Wall.

[07:35] Team_046 possession (Score: 58-52)
Cade Wall attempts a Midrange. Contested by OG Siakam (4.5 feet, ZONE). CADE WALL MAKES IT!
Score: 58-54

[07:16] Team_051 possession (Score: 58-54)
Austin Sexton attempts a 3Pt. Contested by Lauri Carter (3.3 feet, ZONE). Austin Sexton misses. Rebound secured by Kevin Allen.

[07:02] Team_046 possession (Score: 58-54)
Cade Wall attempts a Layup. Contested by Franz Simmons (4.8 feet, MAN). Cade Wall misses. Rebound secured by Shaquille Harden.

[06:47] Team_051 possession (Score: 58-54)
Larry McGrady attempts a 3Pt. Contested by Lauri Carter (3.6 feet, ZONE). LARRY MCGRADY MAKES IT! Assist: Austin Sexton
Score: 61-54

[06:33] Team_046 possession (Score: 61-54)
Kevin Allen attempts a Layup. BLOCKED BY FRANZ SIMMONS! Ball deflects out of bounds off Kevin Allen.

[06:24] Team_051 possession (Score: 61-54)
FOUL! Shooting foul on Lauri Carter. OG Siakam to the line for 2 free throws. [BONUS: 5 team fouls] (Lauri Carter: 4 personal fouls)   FT 1/2: GOOD   FT 2/2: MISS OG Siakam makes 1/2 from the line. Rebound secured by Cade Wall.
Score: 62-54

[06:10] Team_046 possession (Score: 62-54)
Lauri Carter attempts a 3Pt. Contested by Austin Sexton (4.6 feet, ZONE). Lauri Carter misses. Rebound secured by OG Siakam.

[05:51] Team_051 possession (Score: 62-54)
Larry McGrady attempts a 3Pt. Contested by Lauri Carter (3.6 feet, ZONE). LARRY MCGRADY MAKES IT! Assist: OG Siakam
Score: 65-54

[05:39] Team_046 possession (Score: 65-54)
D'Angelo O'Neal makes the Midrange and draws the foul on Larry McGrady! And-1! D'Angelo O'Neal to the line for 1. [Team fouls: 3] (Larry McGrady: 1 personal fouls)   FT 1/1: GOOD D'Angelo O'Neal makes 1/1 from the line.
Score: 65-57

[05:25] Team_051 possession (Score: 65-57)
Austin Sexton attempts a 3Pt. Contested by Lauri Carter (3.3 feet, ZONE). Austin Sexton misses. Rebound secured by Cade Wall.

[05:11] Team_046 possession (Score: 65-57)
Victor Nowitzki attempts a 3Pt. Contested by OG Siakam (4.0 feet, ZONE). Victor Nowitzki misses. Rebound secured by Shaquille Harden.

[04:53] Team_051 possession (Score: 65-57)
OG Siakam drives and kicks out. Larry McGrady attempts a 3Pt. Contested by Victor Nowitzki (5.5 feet, MAN). Larry McGrady misses. Rebound secured by Lauri Carter.

[04:42] Team_046 possession (Score: 65-57)
Kevin Allen makes the Layup and draws the foul on Larry McGrady! And-1! Kevin Allen to the line for 1. [Team fouls: 4] (Larry McGrady: 2 personal fouls)   FT 1/1: GOOD Kevin Allen makes 1/1 from the line.
Score: 65-60

[04:30] Team_051 possession (Score: 65-60)
Larry McGrady attempts a Midrange. Contested by Victor Nowitzki (5.9 feet, MAN). LARRY MCGRADY MAKES IT! Assist: Austin Sexton
Score: 67-60

[04:16] Team_046 possession (Score: 67-60)
D'Angelo O'Neal drives to the basket... D'Angelo O'Neal throws a bad pass out of bounds! TURNOVER! (dead ball)

[04:00] Team_051 possession (Score: 67-60)
OG Siakam attempts a Layup. Contested by Kevin Allen (5.0 feet, ZONE). OG SIAKAM MAKES IT! Assist: Shaquille Harden
Score: 69-60

[03:42] Team_046 possession (Score: 69-60)
D'Angelo O'Neal attempts a 3Pt. Contested by OG Siakam (4.2 feet, ZONE). D'Angelo O'Neal misses. Offensive rebound by Cade Wall! Cade Wall kicks it out.

[03:29] Team_046 possession (Score: 69-60)
Kevin Allen attempts a Layup. Contested by Franz Simmons (4.6 feet, ZONE). Kevin Allen misses. Rebound secured by Shaquille Harden.

[03:17] Team_051 possession (Score: 69-60)
FOUL! Reach-in foul on Kevin Allen during the drive. [IN THE BONUS! 6 team fouls] Austin Sexton to the line for 2 free throws. (Kevin Allen: 1 personal fouls)   FT 1/2: GOOD   FT 2/2: GOOD Austin Sexton makes 2/2 from the line.
Score: 71-60

[03:01] Team_046 possession (Score: 71-60)
D'Angelo O'Neal attempts a 3Pt. Contested by Austin Sexton (4.7 feet, ZONE). D'ANGELO O'NEAL MAKES IT! Assist: Kevin Allen
Score: 71-63

[02:48] Team_051 possession (Score: 71-63)
Austin Sexton drives, picks up D'Angelo O'Neal. Help arrives from Lauri Carter! Austin Sexton attempts a Dunk. Contested by Lauri Carter (4.3 feet, MAN). Austin Sexton misses. Rebound secured by Cade Wall.

[02:38] Team_046 possession (Score: 71-63)
FOUL! Shooting foul on Shaquille Harden. Kevin Allen to the line for 2 free throws. [BONUS: 5 team fouls] (Shaquille Harden: 1 personal fouls)   FT 1/2: MISS   FT 2/2: GOOD Kevin Allen makes 1/2 from the line.
Score: 71-64

[02:19] Team_051 possession (Score: 71-64)
Austin Sexton attempts a Midrange. Contested by Lauri Carter (3.5 feet, ZONE). AUSTIN SEXTON MAKES IT! Assist: Shaquille Harden
Score: 73-64

[02:05] Team_046 possession (Score: 73-64)
Kevin Allen attempts a 3Pt. Contested by Shaquille Harden (4.7 feet, MAN). Kevin Allen misses. Offensive rebound by Lauri Carter! Lauri Carter kicks it out.

[01:49] Team_046 possession (Score: 73-64)
Victor Nowitzki attempts a 3Pt. Contested by Austin Sexton (4.7 feet, ZONE). Victor Nowitzki misses. Offensive rebound by Cade Wall! Cade Wall kicks it out.

[01:37] Team_046 possession (Score: 73-64)
FOUL! Reach-in foul on Franz Simmons during the drive. [IN THE BONUS! 6 team fouls] Lauri Carter to the line for 2 free throws. (Franz Simmons: 2 personal fouls)   FT 1/2: MISS   FT 2/2: GOOD Lauri Carter makes 1/2 from the line.
Score: 73-65

[01:25] Team_051 possession (Score: 73-65)
Franz Simmons makes the Dunk and draws the foul on Cade Wall! And-1! Franz Simmons to the line for 1. [BONUS: 7 team fouls] (Cade Wall: 1 personal fouls)   FT 1/1: MISS Franz Simmons makes 0/1 from the line. Rebound secured by Cade Wall.
Score: 75-65

[01:12] Team_046 possession (Score: 75-65)
Kevin Allen attempts a 3Pt. Contested by Austin Sexton (4.9 feet, ZONE). Kevin Allen misses. Rebound secured by Franz Simmons.

[00:59] Team_051 possession (Score: 75-65)
Franz Simmons attempts a Midrange. Contested by D'Angelo O'Neal (5.0 feet, ZONE). FRANZ SIMMONS MAKES IT!
Score: 77-65

[00:40] Team_046 possession (Score: 77-65)
Lauri Carter attempts a 3Pt. Contested by Austin Sexton (4.9 feet, ZONE). Lauri Carter misses. Rebound secured by Franz Simmons.

[00:24] Team_051 possession (Score: 77-65)
Austin Sexton attempts a 3Pt. Contested by Lauri Carter (3.7 feet, ZONE). Austin Sexton misses. Rebound secured by Lauri Carter.

[00:14] Team_046 possession (Score: 77-65)
D'Angelo O'Neal attempts a Layup. Contested by Franz Simmons (4.8 feet, ZONE). D'ANGELO O'NEAL MAKES IT! Assist: Lauri Carter
Score: 77-67

[00:02] Team_051 possession (Score: 77-67)
FOUL! Shooting foul on Kevin Allen. Shaquille Harden to the line for 2 free throws. [BONUS: 8 team fouls] (Kevin Allen: 2 personal fouls)   FT 1/2: MISS   FT 2/2: GOOD Shaquille Harden makes 1/2 from the line.
Score: 78-67

================================================================================
                              3RD QUARTER COMPLETE                              
================================================================================

3RD QUARTER SCORE: Team_051 28, Team_046 23

BOX SCORE:
================================================================================

Team_051
--------------------------------------------------------------------------------
Player                MIN  PTS  REB  AST  TO      FG   FG%      3P   3P%
--------------------------------------------------------------------------------
Larry McGrady          28   10    0    1   0   4/6    66.7     0/0   0.0
OG Siakam              28    5    1    1   0   2/4    50.0     0/0   0.0
Austin Sexton          28    4    0    2   0   2/7    28.6     0/0   0.0
Shaquille Harden       28    3    3    2   0   2/3    66.7     0/0   0.0
Franz Simmons          28    2    5    0   0   1/2    50.0     0/0   0.0

TEAM: FG: 11/22 (50.0%), 3PT: 3/7 (42.9%), REB: 9 (1 off, 8 def), AST: 6, TO: 0
TEAM FOULS: 6 [Team_046 in BONUS]


Team_046
--------------------------------------------------------------------------------
Player                MIN  PTS  REB  AST  TO      FG   FG%      3P   3P%
--------------------------------------------------------------------------------
D'Angelo O'Neal        28    8    0    0   0   3/5    60.0     0/0   0.0
Cade Wall              28    5    8    1   0   2/3    66.7     0/0   0.0
Victor Nowitzki        28    5    0    0   0   2/3    66.7     0/0   0.0
Kevin Allen            28    4    4    1   0   2/5    40.0     0/0   0.0
Lauri Carter           28    1    4    1   0   1/3    33.3     0/0   0.0

TEAM: FG: 10/19 (52.6%), 3PT: 2/8 (25.0%), REB: 16 (5 off, 11 def), AST: 3, TO: 2
TEAM FOULS: 8 [Team_051 in BONUS]

================================================================================

================================================================================
                       4TH QUARTER - Team_051 vs Team_046                       
================================================================================

[12:00] Team_051 possession (Score: 78-67)
Shaquille Harden makes the Layup and draws the foul on Kevin Allen! And-1! Shaquille Harden to the line for 1. [Team fouls: 1] (Kevin Allen: 1 personal fouls)   FT 1/1: MISS Shaquille Harden makes 0/1 from the line. Rebound secured by Lauri Carter.
Score: 80-67

[11:43] Team_046 possession (Score: 80-67)
Lauri Carter attempts a 3Pt. Contested by Austin Sexton (4.8 feet, ZONE). LAURI CARTER MAKES IT!
Score: 80-70

[11:28] Team_051 possession (Score: 80-70)
Larry McGrady drives, Victor Nowitzki stays with him. Larry McGrady attempts a Layup. Wide open! Victor Nowitzki is 6.1 feet away. [MAN] LARRY MCGRADY MAKES IT!
Score: 82-70

[11:16] Team_046 possession (Score: 82-70)
Kevin Allen attempts a Layup. BLOCKED BY SHAQUILLE HARDEN! Ball deflects out of bounds off Kevin Allen.

[11:02] Team_051 possession (Score: 82-70)
OG Siakam attempts a 3Pt. Contested by Lauri Carter (3.9 feet, ZONE). OG Siakam misses. Rebound secured by Kevin Allen.

[10:49] Team_046 possession (Score: 82-70)
Lauri Carter attempts a 3Pt. Contested by Austin Sexton (4.9 feet, ZONE). LAURI CARTER MAKES IT! Assist: Victor Nowitzki
Score: 82-73

[10:31] Team_051 possession (Score: 82-73)
FOUL! Reach-in foul on Kevin Allen during the drive. [Team fouls: 2] No free throws, side out. (Kevin Allen: 2 personal fouls)

[10:17] Team_051 possession (Score: 82-73)
Austin Sexton drives, Kevin Allen stays with him. Austin Sexton attempts a Layup. Contested by Kevin Allen (5.2 feet, ZONE). AUSTIN SEXTON MAKES IT! Assist: Shaquille Harden
Score: 84-73

[10:04] Team_046 possession (Score: 84-73)
Victor Nowitzki throws a bad pass out of bounds! TURNOVER! (dead ball)

[10:04] Substitution (Team_051): Austin Sexton OUT → Myles Harden IN (stamina_rule2)

[10:04] Substitution (Team_051): Larry McGrady OUT → Zion Morant IN (stamina_rule2)

[10:04] Substitution (Team_051): OG Siakam OUT → Jrue Carter IN (stamina_rule2)

[10:04] Substitution (Team_051): Franz Simmons OUT → Tobias Jokic IN (stamina_rule2)

[10:04] Substitution (Team_051): Shaquille Harden OUT → Pau Tatum IN (stamina_rule2)

[10:04] Substitution (Team_046): D'Angelo O'Neal OUT → Collin Butler IN (stamina_rule2)

[10:04] Substitution (Team_046): Victor Nowitzki OUT → Manu Dosunmu IN (stamina_rule2)

[10:04] Substitution (Team_046): Lauri Carter OUT → Josh Barrett IN (stamina_rule2)

[10:04] Substitution (Team_046): Cade Wall OUT → Chris LaVine IN (stamina_rule2)

[10:04] Substitution (Team_046): Kevin Allen OUT → Paul DeRozan IN (stamina_rule2)

[09:46] Team_051 possession (Score: 84-73)
Zion Morant attempts a Layup. Contested by Manu Dosunmu (5.0 feet, MAN). ZION MORANT MAKES IT! Assist: Jrue Carter
Score: 86-73

[09:32] Team_046 possession (Score: 86-73)
Paul DeRozan drives and kicks out. Paul DeRozan attempts a Midrange. Contested by Pau Tatum (4.3 feet, MAN). Paul DeRozan misses. Rebound secured by Tobias Jokic.

[09:17] Team_051 possession (Score: 86-73)
Tobias Jokic drives to the basket... Tobias Jokic loses control! Ball rolls out of bounds! TURNOVER! (dead ball)

[09:03] Team_046 possession (Score: 86-73)
Manu Dosunmu drives to the basket... Manu Dosunmu commits a violation (traveling/carry)! TURNOVER! (dead ball)

[08:50] Team_051 possession (Score: 86-73)
Jrue Carter drives, Chris LaVine stays with him. Jrue Carter attempts a Dunk. Contested by Chris LaVine (4.2 feet, ZONE). Jrue Carter misses. Rebound secured by Manu Dosunmu.

[08:35] Team_046 possession (Score: 86-73)
FOUL! Shooting foul on Pau Tatum. Paul DeRozan to the line for 2 free throws. [Team fouls: 1] (Pau Tatum: 1 personal fouls)   FT 1/2: GOOD   FT 2/2: GOOD Paul DeRozan makes 2/2 from the line.
Score: 86-75

[08:20] Team_051 possession (Score: 86-75)
Pau Tatum makes the Dunk and draws the foul on Chris LaVine! And-1! Pau Tatum to the line for 1. [Team fouls: 3] (Chris LaVine: 1 personal fouls)   FT 1/1: GOOD Pau Tatum makes 1/1 from the line.
Score: 89-75

[08:05] Team_046 possession (Score: 89-75)
Chris LaVine attempts a Midrange. Contested by Myles Harden (5.0 feet, ZONE). CHRIS LAVINE MAKES IT! Assist: Manu Dosunmu
Score: 89-77

[07:45] Team_051 possession (Score: 89-77)
FOUL! Shooting foul on Chris LaVine. Myles Harden to the line for 2 free throws. [Team fouls: 4] (Chris LaVine: 2 personal fouls)   FT 1/2: GOOD   FT 2/2: GOOD Myles Harden makes 2/2 from the line.
Score: 91-77

[07:31] Team_046 possession (Score: 91-77)
Collin Butler attempts a 3Pt. Contested by Myles Harden (4.9 feet, MAN). Collin Butler misses. Rebound secured by Pau Tatum.

[07:17] Team_051 possession (Score: 91-77)
Myles Harden attempts a 3Pt. Contested by Collin Butler (3.6 feet, MAN). MYLES HARDEN MAKES IT! Assist: Jrue Carter
Score: 94-77

[07:02] Team_046 possession (Score: 94-77)
Paul DeRozan attempts a Midrange. Contested by Tobias Jokic (5.2 feet, ZONE). Paul DeRozan misses. FOUL! Loose ball foul on Myles Harden during the rebound battle. [Team fouls: 2] No free throws, side out. (Myles Harden: 1 personal fouls)

[06:46] Team_046 possession (Score: 94-77)
Josh Barrett attempts a 3Pt. Contested by Myles Harden (4.7 feet, ZONE). Josh Barrett misses. Rebound secured by Myles Harden.

[06:34] Team_051 possession (Score: 94-77)
Tobias Jokic attempts a 3Pt. Contested by Collin Butler (4.1 feet, ZONE). Tobias Jokic misses. Offensive rebound by Pau Tatum! Pau Tatum puts it back in!
Score: 96-77

[06:20] Team_046 possession (Score: 96-77)
Manu Dosunmu attempts a 3Pt. Contested by Myles Harden (5.2 feet, ZONE). Manu Dosunmu misses. Rebound secured by Pau Tatum.

[06:07] Team_051 possession (Score: 96-77)
Myles Harden attempts a 3Pt. Contested by Collin Butler (3.6 feet, MAN). Myles Harden misses. Rebound secured by Manu Dosunmu.

[05:53] Team_046 possession (Score: 96-77)
FOUL! Offensive foul on Paul DeRozan! Pau Tatum drew the charge! [Team fouls: 5] (Paul DeRozan: 1 personal fouls) TURNOVER! (dead ball)

[05:38] Team_051 possession (Score: 96-77)
Tobias Jokic attempts a 3Pt. Contested by Chris LaVine (4.1 feet, ZONE). Tobias Jokic misses. Rebound secured by Manu Dosunmu.

[05:26] Team_046 possession (Score: 96-77)
Josh Barrett drives and kicks out. Josh Barrett attempts a 3Pt. Contested by Jrue Carter (4.6 feet, MAN). JOSH BARRETT MAKES IT! Assist: Paul DeRozan
Score: 96-80

[05:15] Team_051 possession (Score: 96-80)
Pau Tatum attempts a Layup. Contested by Chris LaVine (3.7 feet, MAN). Pau Tatum misses. Offensive rebound by Pau Tatum! Pau Tatum puts it back in!
Score: 98-80

[04:58] Team_046 possession (Score: 98-80)
Josh Barrett drives, Pau Tatum stays with him. Josh Barrett attempts a Dunk. Contested by Pau Tatum (4.4 feet, ZONE). Josh Barrett misses. Offensive rebound by Paul DeRozan! Paul DeRozan puts it back in!
Score: 98-82

[04:42] Team_051 possession (Score: 98-82)
Myles Harden makes the Layup and draws the foul on Paul DeRozan! And-1! Myles Harden to the line for 1. [BONUS: 6 team fouls] (Paul DeRozan: 2 personal fouls)   FT 1/1: GOOD Myles Harden makes 1/1 from the line.
Score: 101-82

[04:26] Team_046 possession (Score: 101-82)
Collin Butler attempts a 3Pt. Contested by Myles Harden (4.9 feet, ZONE). Collin Butler misses. Rebound secured by Myles Harden.

[04:14] Team_051 possession (Score: 101-82)
Zion Morant drives, Chris LaVine stays with him. Zion Morant attempts a Layup. Contested by Chris LaVine (4.2 feet, ZONE). Zion Morant misses. Rebound secured by Chris LaVine.

[03:58] Team_046 possession (Score: 101-82)
Manu Dosunmu drives, picks up Zion Morant. Help arrives from Jrue Carter! Manu Dosunmu attempts a Dunk. Wide open! Jrue Carter is 6.1 feet away. [MAN] MANU DOSUNMU MAKES IT! Assist: Paul DeRozan
Score: 101-84

[03:40] Team_051 possession (Score: 101-84)
Pau Tatum attempts a Midrange. Contested by Chris LaVine (3.7 feet, MAN). PAU TATUM MAKES IT! Assist: Jrue Carter
Score: 103-84

[03:22] Team_046 possession (Score: 103-84)
FOUL! Reach-in foul on Myles Harden during the drive. [Team fouls: 3] No free throws, side out. (Myles Harden: 2 personal fouls)

[03:13] Team_046 possession (Score: 103-84)
Manu Dosunmu makes the Dunk and draws the foul on Pau Tatum! And-1! Manu Dosunmu to the line for 1. [Team fouls: 4] (Pau Tatum: 2 personal fouls)   FT 1/1: GOOD Manu Dosunmu makes 1/1 from the line.
Score: 103-87

[02:56] Team_051 possession (Score: 103-87)
Pau Tatum drives and kicks out. FOUL! Shooting foul on Manu Dosunmu. Pau Tatum to the line for 2 free throws. [BONUS: 7 team fouls] (Manu Dosunmu: 1 personal fouls)   FT 1/2: GOOD   FT 2/2: GOOD Pau Tatum makes 2/2 from the line.
Score: 105-87

[02:41] Team_046 possession (Score: 105-87)
Chris LaVine drives, Tobias Jokic stays with him. Chris LaVine attempts a Dunk. Contested by Tobias Jokic (5.7 feet, MAN). Chris LaVine misses. Offensive rebound by Chris LaVine! Chris LaVine kicks it out.

[02:26] Team_046 possession (Score: 105-87)
Collin Butler makes the Layup and draws the foul on Myles Harden! And-1! Collin Butler to the line for 1. [BONUS: 5 team fouls] (Myles Harden: 3 personal fouls)   FT 1/1: MISS Collin Butler makes 0/1 from the line. Rebound secured by Tobias Jokic.
Score: 105-89

[02:16] Team_051 possession (Score: 105-89)
Myles Harden attempts a 3Pt. Contested by Collin Butler (3.7 feet, MAN). Myles Harden misses. Rebound secured by Chris LaVine.

[02:03] Team_046 possession (Score: 105-89)
Manu Dosunmu attempts a Layup. BLOCKED BY PAU TATUM! Ball is loose! Rebound secured by Myles Harden.

[01:49] Team_051 possession (Score: 105-89)
Zion Morant drives, picks up Chris LaVine. Help arrives from Manu Dosunmu! Zion Morant attempts a Layup. Contested by Manu Dosunmu (4.3 feet, ZONE). ZION MORANT MAKES IT! Assist: Pau Tatum
Score: 107-89

[01:34] Team_046 possession (Score: 107-89)
Paul DeRozan makes the Layup and draws the foul on Pau Tatum! And-1! Paul DeRozan to the line for 1. [BONUS: 6 team fouls] (Pau Tatum: 3 personal fouls)   FT 1/1: MISS Paul DeRozan makes 0/1 from the line. Offensive rebound by Paul DeRozan! Paul DeRozan puts it back in!
Score: 107-93

[01:18] Team_051 possession (Score: 107-93)
Jrue Carter attempts a 3Pt. Contested by Collin Butler (4.3 feet, ZONE). Jrue Carter misses. Rebound secured by Chris LaVine.

[00:59] Team_046 possession (Score: 107-93)
Manu Dosunmu attempts a Midrange. Wide open! Zion Morant is 6.2 feet away. [MAN] MANU DOSUNMU MAKES IT! Assist: Josh Barrett
Score: 107-95

[00:44] Team_051 possession (Score: 107-95)
Jrue Carter makes the 3Pt and draws the foul on Collin Butler! And-1! Jrue Carter to the line for 1. [BONUS: 8 team fouls] (Collin Butler: 1 personal fouls)   FT 1/1: GOOD Jrue Carter makes 1/1 from the line.
Score: 111-95

[00:29] Team_046 possession (Score: 111-95)
Josh Barrett drives, Pau Tatum stays with him. Josh Barrett attempts a Layup. Contested by Pau Tatum (4.6 feet, ZONE). JOSH BARRETT MAKES IT!
Score: 111-97

[00:14] Team_051 possession (Score: 111-97)
Tobias Jokic drives to the basket... FOUL! Offensive foul on Tobias Jokic! Chris LaVine drew the charge! [Team fouls: 7] (Tobias Jokic: 1 personal fouls) TURNOVER! (dead ball)

================================================================================
                              4TH QUARTER COMPLETE                              
================================================================================

4TH QUARTER SCORE: Team_051 33, Team_046 30

BOX SCORE:
================================================================================

Team_051
--------------------------------------------------------------------------------
Player                MIN  PTS  REB  AST  TO      FG   FG%      3P   3P%
--------------------------------------------------------------------------------
Pau Tatum              18   11    4    1   0   5/5   100.0     0/0   0.0
Myles Harden           18    8    3    0   0   3/5    60.0     0/0   0.0
Zion Morant            18    4    0    0   0   2/3    66.7     0/0   0.0
Jrue Carter            18    4    0    3   0   1/3    33.3     0/0   0.0
Larry McGrady          31    2    0    0   0   1/1   100.0     0/0   0.0
Austin Sexton          31    2    0    0   0   1/1   100.0     0/0   0.0
Shaquille Harden       31    0    0    1   0   0/1     0.0     0/0   0.0
OG Siakam              31    0    0    0   0   0/1     0.0     0/0   0.0
Tobias Jokic           18    0    2    0   0   0/1     0.0     0/0   0.0

TEAM: FG: 13/21 (61.9%), 3PT: 3/8 (37.5%), REB: 9 (2 off, 7 def), AST: 5, TO: 2
TEAM FOULS: 7 [Team_046 in BONUS]


Team_046
--------------------------------------------------------------------------------
Player                MIN  PTS  REB  AST  TO      FG   FG%      3P   3P%
--------------------------------------------------------------------------------
Paul DeRozan           18    8    1    2   0   3/4    75.0     0/0   0.0
Manu Dosunmu           18    7    3    1   0   3/5    60.0     0/0   0.0
Lauri Carter           31    6    1    0   0   2/2   100.0     0/0   0.0
Josh Barrett           18    5    0    1   0   2/3    66.7     0/0   0.0
Chris LaVine           18    2    5    0   0   1/1   100.0     0/0   0.0
Kevin Allen            31    0    1    0   0   0/1     0.0     0/0   0.0
Victor Nowitzki        31    0    0    1   0   0/0     0.0     0/0   0.0
Collin Butler          18    0    0    0   0   0/3     0.0     0/0   0.0

TEAM: FG: 11/19 (57.9%), 3PT: 2/6 (33.3%), REB: 11 (3 off, 8 def), AST: 5, TO: 3
TEAM FOULS: 8 [Team_051 in BONUS]

================================================================================

================================================================================
                               FULL GAME COMPLETE                               
================================================================================

FINAL SCORE: Team_051 111, Team_046 97

SCORING BY QUARTER:
--------------------------------------------------------------------------------
Team                     Q1     Q2     Q3     Q4    FINAL
--------------------------------------------------------------------------------
Team_051                 26     24     28     33      111
Team_046                 30     14     23     30       97
--------------------------------------------------------------------------------

FULL GAME BOX SCORE:
================================================================================

Team_051
--------------------------------------------------------------------------------
Player                MIN  PTS  REB  AST  TO      FG   FG%      3P   3P%      FT STL BLK
--------------------------------------------------------------------------------
Austin Sexton          31   14    0    4   0   6/14   42.9   2/8    25.0   5/5     0   0
Larry McGrady          31   23    0    2   0   9/14   64.3   4/5    80.0   4/5     0   0
OG Siakam              31   14    6    1   2   5/10   50.0   3/5    60.0   8/9     0   0
Franz Simmons          31    8    9    2   0   4/6    66.7   0/1     0.0   0/1     1   1
Shaquille Harden       31    6    8    4   2   3/7    42.9   0/0     0.0   2/4     0   1
Myles Harden           18   11    4    0   2   4/8    50.0   2/5    40.0   3/3     0   0
Zion Morant            18    7    0    0   2   4/6    66.7   2/3    66.7   0/0     0   0
Jrue Carter            18    4    0    3   0   1/3    33.3   1/2    50.0   1/1     0   0
Tobias Jokic           18    0    5    1   1   1/5    20.0   1/2    50.0   0/1     1   0
Pau Tatum              18   16    6    2   1   5/5   100.0   0/0     0.0   6/6     0   2

TEAM: FG: 42/78 (53.8%), 3PT: 15/31 (48.4%), REB: 38 (6 off, 32 def), AST: 19, TO: 10


Team_046
--------------------------------------------------------------------------------
Player                MIN  PTS  REB  AST  TO      FG   FG%      3P   3P%      FT STL BLK
--------------------------------------------------------------------------------
D'Angelo O'Neal        31   15    0    3   1   7/11   63.6   2/6    33.3   3/3     0   0
Victor Nowitzki        31   13    0    3   1   5/9    55.6   4/8    50.0   2/3     0   0
Lauri Carter           31   15    6    3   0   5/8    62.5   4/7    57.1   1/2     1   0
Cade Wall              31    5   13    2   2   2/7    28.6   0/1     0.0   1/1     1   0
Kevin Allen            31   13   15    1   1   5/11   45.5   0/2     0.0   5/6     1   1
Collin Butler          18    6    0    0   2   2/5    40.0   0/2     0.0   2/3     2   0
Manu Dosunmu           18    9    4    1   0   4/8    50.0   0/1     0.0   1/1     0   0
Josh Barrett           18    7    0    1   2   4/5    80.0   0/1     0.0   0/0     0   0
Chris LaVine           18    2    7    0   0   1/4    25.0   0/1     0.0   0/0     0   0
Paul DeRozan           18   10    6    2   3   3/4    75.0   0/0     0.0   4/5     0   0

TEAM: FG: 39/73 (53.4%), 3PT: 10/29 (34.5%), REB: 50 (14 off, 36 def), AST: 16, TO: 12

================================================================================
