================================================================================
                        FULL GAME - Team_061 vs Team_090                        
================================================================================

================================================================================
                       1ST QUARTER - Team_061 vs Team_090                       
================================================================================

[12:00] Team_061 possession (Score: 0-0)
Jayson Holiday attempts a Layup. Contested by Gary Brogdon (4.0 feet, ZONE). Jayson Holiday misses. Rebound secured by Zach Wall.

[11:43] Team_090 possession (Score: 0-0)
Derrick Mitchell makes the 3Pt and draws the foul on Brandon Russell! And-1! Derrick Mitchell to the line for 1. [Team fouls: 1] (Brandon Russell: 1 personal fouls)   FT 1/1: GOOD Derrick Mitchell makes 1/1 from the line.
Score: 0-4

[11:29] Team_061 possession (Score: 0-4)
Bam Sexton attempts a Midrange. Contested by Larry Bridges (5.2 feet, ZONE). BAM SEXTON MAKES IT! Assist: Draymond Banchero
Score: 2-4

[11:15] Team_090 possession (Score: 2-4)
Zach Wall attempts a 3Pt. Contested by Brandon Russell (4.2 feet, ZONE). Zach Wall misses. Offensive rebound by Tracy Adebayo! Tracy Adebayo kicks it out.

[10:57] Team_090 possession (Score: 2-4)
Larry Bridges attempts a 3Pt. Contested by Brandon Russell (3.9 feet, ZONE). Larry Bridges misses. Offensive rebound by Tracy Adebayo! Tracy Adebayo kicks it out.

[10:44] Team_090 possession (Score: 2-4)
Zach Wall attempts a 3Pt. Contested by Michael Russell (4.0 feet, MAN). ZACH WALL MAKES IT!
Score: 2-7

[10:31] Team_061 possession (Score: 2-7)
Jayson Holiday attempts a Layup. BLOCKED BY LARRY BRIDGES! Ball is loose! Rebound secured by Zach Wall.

[10:22] Team_090 possession (Score: 2-7)
Larry Bridges attempts a 3Pt. Contested by Jayson Holiday (4.0 feet, MAN). Larry Bridges misses. Rebound secured by Bam Sexton.

[10:07] Team_061 possession (Score: 2-7)
Michael Russell attempts a 3Pt. Contested by Zach Wall (5.3 feet, MAN). Michael Russell misses. FOUL! Loose ball foul on Zach Wall during the rebound battle. [Team fouls: 1] No free throws, side out. (Zach Wall: 1 personal fouls)

[09:49] Team_061 possession (Score: 2-7)
Draymond Banchero drives and kicks out. Draymond Banchero attempts a 3Pt. Contested by Derrick Mitchell (3.2 feet, ZONE). Draymond Banchero misses. Rebound secured by Gary Brogdon.

[09:38] Team_090 possession (Score: 2-7)
Zach Wall drives and kicks out. FOUL! Shooting foul on Jayson Holiday. Derrick Mitchell to the line for 2 free throws. [Team fouls: 2] (Jayson Holiday: 1 personal fouls)   FT 1/2: MISS   FT 2/2: MISS Derrick Mitchell makes 0/2 from the line. Offensive rebound by Tracy Adebayo! Tracy Adebayo kicks it out.

[09:24] Team_090 possession (Score: 2-7)
Larry Bridges drives and kicks out. Zach Wall attempts a Midrange. Contested by Michael Russell (3.7 feet, MAN). Zach Wall misses. Rebound secured by Draymond Banchero.

[09:12] Team_061 possession (Score: 2-7)
Jayson Holiday drives to the basket... Jayson Holiday loses the ball! Stripped by Gary Brogdon! TURNOVER! (live ball)

[08:57] Team_090 possession (Score: 2-7)
Gary Brogdon drives, Bam Sexton stays with him. Gary Brogdon attempts a Layup. Contested by Bam Sexton (5.1 feet, MAN). GARY BROGDON MAKES IT! Assist: Tracy Adebayo
Score: 2-9

[08:46] Team_061 possession (Score: 2-9)
Michael Russell drives, Zach Wall stays with him. Michael Russell attempts a Dunk. Contested by Zach Wall (5.3 feet, MAN). MICHAEL RUSSELL MAKES IT!
Score: 4-9

[08:32] Team_090 possession (Score: 4-9)
Larry Bridges attempts a Midrange. Contested by Jayson Holiday (4.0 feet, MAN). Larry Bridges misses. Rebound secured by Draymond Banchero.

[08:13] Team_061 possession (Score: 4-9)
Bam Sexton attempts a Midrange. Contested by Zach Wall (5.4 feet, ZONE). Bam Sexton misses. Rebound secured by Gary Brogdon.

[07:57] Team_090 possession (Score: 4-9)
Larry Bridges attempts a 3Pt. Contested by Jayson Holiday (4.0 feet, MAN). LARRY BRIDGES MAKES IT! Assist: Derrick Mitchell
Score: 4-12

[07:38] Team_061 possession (Score: 4-12)
FOUL! Shooting foul on Tracy Adebayo. Draymond Banchero to the line for 2 free throws. [Team fouls: 2] (Tracy Adebayo: 1 personal fouls)   FT 1/2: GOOD   FT 2/2: GOOD Draymond Banchero makes 2/2 from the line.
Score: 6-12

[07:24] Team_090 possession (Score: 6-12)
FOUL! Shooting foul on Michael Russell. Zach Wall to the line for 3 free throws. [Team fouls: 3] (Michael Russell: 1 personal fouls)   FT 1/3: MISS   FT 2/3: GOOD   FT 3/3: MISS Zach Wall makes 1/3 from the line. Rebound secured by Michael Russell.
Score: 6-13

[07:11] Team_061 possession (Score: 6-13)
FOUL! Holding foul on Zach Wall. [Team fouls: 3] No free throws, side out. (Zach Wall: 2 personal fouls)

[06:57] Team_061 possession (Score: 6-13)
Michael Russell drives and kicks out. FOUL! Shooting foul on Larry Bridges. Brandon Russell to the line for 2 free throws. [Team fouls: 4] (Larry Bridges: 1 personal fouls)   FT 1/2: MISS   FT 2/2: GOOD Brandon Russell makes 1/2 from the line.
Score: 7-13

[06:44] Team_090 possession (Score: 7-13)
Derrick Mitchell attempts a 3Pt. Contested by Brandon Russell (4.2 feet, MAN). Derrick Mitchell misses. Rebound secured by Draymond Banchero.

[06:25] Team_061 possession (Score: 7-13)
Jayson Holiday attempts a Midrange. Contested by Larry Bridges (5.2 feet, ZONE). JAYSON HOLIDAY MAKES IT! Assist: Bam Sexton
Score: 9-13

[06:06] Team_090 possession (Score: 9-13)
Gary Brogdon drives, picks up Bam Sexton. Help arrives from Jayson Holiday! Gary Brogdon attempts a Layup. Contested by Jayson Holiday (5.1 feet, MAN). GARY BROGDON MAKES IT! Assist: Derrick Mitchell
Score: 9-15

[05:51] Team_061 possession (Score: 9-15)
Bam Sexton drives and kicks out. Jayson Holiday attempts a 3Pt. Contested by Derrick Mitchell (3.2 feet, ZONE). Jayson Holiday misses. Rebound secured by Zach Wall.

[05:40] Team_090 possession (Score: 9-15)
Larry Bridges drives, Bam Sexton stays with him. Larry Bridges attempts a Layup. Contested by Bam Sexton (4.9 feet, ZONE). LARRY BRIDGES MAKES IT!
Score: 9-17

[05:26] Team_061 possession (Score: 9-17)
Brandon Russell attempts a 3Pt. Contested by Derrick Mitchell (3.4 feet, ZONE). Brandon Russell misses. Rebound secured by Zach Wall.

[05:09] Team_090 possession (Score: 9-17)
FOUL! Offensive foul on Gary Brogdon! Bam Sexton drew the charge! [Team fouls: 5] (Gary Brogdon: 1 personal fouls) TURNOVER! (dead ball)

[04:51] Team_061 possession (Score: 9-17)
Brandon Russell drives, picks up Gary Brogdon. Help arrives from Larry Bridges! Brandon Russell attempts a Layup. Contested by Larry Bridges (3.9 feet, ZONE). BRANDON RUSSELL MAKES IT!
Score: 11-17

[04:34] Team_090 possession (Score: 11-17)
Tracy Adebayo attempts a Midrange. Contested by Draymond Banchero (2.4 feet, MAN). TRACY ADEBAYO MAKES IT! Assist: Derrick Mitchell
Score: 11-19

[04:22] Team_061 possession (Score: 11-19)
Draymond Banchero makes the Layup and draws the foul on Tracy Adebayo! And-1! Draymond Banchero to the line for 1. [BONUS: 6 team fouls] (Tracy Adebayo: 2 personal fouls)   FT 1/1: MISS Draymond Banchero makes 0/1 from the line. Rebound secured by Tracy Adebayo.
Score: 13-19

[04:08] Team_090 possession (Score: 13-19)
FOUL! Reach-in foul on Draymond Banchero during the drive. [Team fouls: 4] No free throws, side out. (Draymond Banchero: 1 personal fouls)

[03:51] Team_090 possession (Score: 13-19)
Larry Bridges attempts a Layup. BLOCKED BY DRAYMOND BANCHERO! Ball is loose! Rebound secured by Michael Russell.

[03:37] Team_061 possession (Score: 13-19)
Jayson Holiday attempts a 3Pt. Contested by Derrick Mitchell (3.7 feet, ZONE). Jayson Holiday misses. Rebound secured by Tracy Adebayo.

[03:23] Team_090 possession (Score: 13-19)
Zach Wall attempts a 3Pt. Contested by Michael Russell (4.2 feet, MAN). Zach Wall misses. Offensive rebound by Tracy Adebayo! Tracy Adebayo kicks it out.

[03:11] Team_090 possession (Score: 13-19)
Larry Bridges attempts a Midrange. Contested by Jayson Holiday (4.2 feet, MAN). Larry Bridges misses. Rebound secured by Bam Sexton.

[02:58] Team_061 possession (Score: 13-19)
Michael Russell drives to the basket... Michael Russell throws a bad pass! Stolen by Zach Wall! TURNOVER! (live ball)

[02:47] Team_090 possession (Score: 13-19)
Larry Bridges attempts a 3Pt. Contested by Jayson Holiday (4.2 feet, MAN). Larry Bridges misses. Rebound secured by Michael Russell.

[02:35] Team_061 possession (Score: 13-19)
Bam Sexton drives, Gary Brogdon stays with him. Bam Sexton attempts a Dunk. Contested by Gary Brogdon (4.5 feet, ZONE). BAM SEXTON MAKES IT! Assist: Michael Russell
Score: 15-19

[02:18] Team_090 possession (Score: 15-19)
FOUL! Reach-in foul on Bam Sexton during the drive. [IN THE BONUS! 5 team fouls] Larry Bridges to the line for 2 free throws. (Bam Sexton: 1 personal fouls)   FT 1/2: GOOD   FT 2/2: GOOD Larry Bridges makes 2/2 from the line.
Score: 15-21

[02:05] Team_061 possession (Score: 15-21)
Michael Russell attempts a 3Pt. Contested by Zach Wall (5.4 feet, MAN). MICHAEL RUSSELL MAKES IT! Assist: Draymond Banchero
Score: 18-21

[01:48] Team_090 possession (Score: 18-21)
Derrick Mitchell attempts a Layup. Contested by Brandon Russell (4.4 feet, MAN). DERRICK MITCHELL MAKES IT! Assist: Zach Wall
Score: 18-23

[01:34] Team_061 possession (Score: 18-23)
Bam Sexton attempts a 3Pt. Contested by Derrick Mitchell (3.9 feet, ZONE). Bam Sexton misses. Rebound secured by Gary Brogdon.

[01:18] Team_090 possession (Score: 18-23)
Derrick Mitchell attempts a Midrange. Contested by Jayson Holiday (4.7 feet, ZONE). DERRICK MITCHELL MAKES IT! Assist: Larry Bridges
Score: 18-25

[01:02] Team_061 possession (Score: 18-25)
Bam Sexton attempts a Midrange. Contested by Gary Brogdon (4.7 feet, ZONE). Bam Sexton misses. Rebound secured by Zach Wall.

[00:47] Team_090 possession (Score: 18-25)
Derrick Mitchell attempts a 3Pt. Contested by Brandon Russell (4.5 feet, ZONE). Derrick Mitchell misses. Rebound secured by Michael Russell.

[00:32] Team_061 possession (Score: 18-25)
Draymond Banchero drives to the basket... FOUL! Offensive foul on Draymond Banchero! Tracy Adebayo drew the charge! [Team fouls: 6] (Draymond Banchero: 2 personal fouls) TURNOVER! (dead ball)

[00:16] Team_090 possession (Score: 18-25)
FOUL! Reach-in foul on Draymond Banchero during the drive. [IN THE BONUS! 7 team fouls] Zach Wall to the line for 2 free throws. (Draymond Banchero: 3 personal fouls)   FT 1/2: GOOD   FT 2/2: MISS Zach Wall makes 1/2 from the line. Offensive rebound by Zach Wall! Zach Wall kicks it out.
Score: 18-26

[00:01] Team_090 possession (Score: 18-26)
Gary Brogdon attempts a 3Pt. Contested by Bam Sexton (5.3 feet, MAN). Gary Brogdon misses. Rebound secured by Michael Russell.

================================================================================
                              1ST QUARTER COMPLETE                              
================================================================================

1ST QUARTER SCORE: Team_061 18, Team_090 26

BOX SCORE:
================================================================================

Team_061
--------------------------------------------------------------------------------
Player                MIN  PTS  REB  AST  TO      FG   FG%      3P   3P%
--------------------------------------------------------------------------------
Michael Russell        12    5    6    1   0   2/2   100.0     0/0   0.0
Bam Sexton             12    4    2    1   0   2/6    33.3     0/0   0.0
Brandon Russell        12    3    0    0   0   2/3    66.7     0/0   0.0
Jayson Holiday         12    2    0    0   0   1/4    25.0     0/0   0.0
Draymond Banchero      12    2    3    2   0   1/3    33.3     0/0   0.0

TEAM: FG: 8/18 (44.4%), 3PT: 1/4 (25.0%), REB: 11 (1 off, 10 def), AST: 4, TO: 3
TEAM FOULS: 7 [Team_090 in BONUS]


Team_090
--------------------------------------------------------------------------------
Player                MIN  PTS  REB  AST  TO      FG   FG%      3P   3P%
--------------------------------------------------------------------------------
Derrick Mitchell       12    8    0    3   0   3/5    60.0     0/0   0.0
Larry Bridges          12    7    0    1   0   3/9    33.3     0/0   0.0
Gary Brogdon           12    4    3    0   0   2/3    66.7     0/0   0.0
Zach Wall              12    3    6    1   0   1/2    50.0     0/0   0.0
Tracy Adebayo          12    2    6    1   0   1/1   100.0     0/0   0.0

TEAM: FG: 10/20 (50.0%), 3PT: 3/9 (33.3%), REB: 15 (5 off, 10 def), AST: 6, TO: 1
TEAM FOULS: 6 [Team_061 in BONUS]

================================================================================

================================================================================
                       2ND QUARTER - Team_061 vs Team_090                       
================================================================================

[12:00] Team_061 possession (Score: 18-26)
Draymond Banchero attempts a Midrange. Contested by Tracy Adebayo (5.8 feet, MAN). Draymond Banchero misses. Rebound secured by Gary Brogdon.

[11:48] Team_090 possession (Score: 18-26)
Tracy Adebayo attempts a Layup. Contested by Draymond Banchero (2.7 feet, MAN). TRACY ADEBAYO MAKES IT!
Score: 18-28

[11:36] Team_061 possession (Score: 18-28)
Jayson Holiday attempts a 3Pt. Contested by Larry Bridges (5.4 feet, MAN). Jayson Holiday misses. Rebound secured by Gary Brogdon.

[11:25] Team_090 possession (Score: 18-28)
Zach Wall attempts a 3Pt. Contested by Brandon Russell (4.4 feet, ZONE). Zach Wall misses. Rebound secured by Michael Russell.

[11:13] Team_061 possession (Score: 18-28)
Brandon Russell drives and kicks out. Bam Sexton attempts a 3Pt. Contested by Gary Brogdon (4.3 feet, MAN). Bam Sexton misses. Rebound secured by Zach Wall.

[11:01] Team_090 possession (Score: 18-28)
Gary Brogdon commits a violation (traveling/carry)! TURNOVER! (dead ball)

[11:01] Substitution (Team_061): Brandon Russell OUT → Evan Rose IN (stamina_rule2)

[11:01] Substitution (Team_061): Jayson Holiday OUT → Gary Fox IN (stamina_rule2)

[11:01] Substitution (Team_061): Michael Russell OUT → Desmond Morant IN (stamina_rule2)

[11:01] Substitution (Team_061): Bam Sexton OUT → Stephen Towns IN (stamina_rule2)

[11:01] Substitution (Team_061): Draymond Banchero OUT → Tim Durant IN (stamina_rule2)

[11:01] Substitution (Team_090): Derrick Mitchell OUT → OG Anunoby IN (stamina_rule2)

[11:01] Substitution (Team_090): Larry Bridges OUT → Josh Wall IN (stamina_rule2)

[11:01] Substitution (Team_090): Zach Wall OUT → Russell Smith IN (stamina_rule2)

[11:01] Substitution (Team_090): Gary Brogdon OUT → Derrick Nowitzki IN (stamina_rule2)

[11:01] Substitution (Team_090): Tracy Adebayo OUT → Tobias Tatum IN (stamina_rule2)

[10:48] Team_061 possession (Score: 18-28)
Evan Rose attempts a 3Pt. Contested by OG Anunoby (5.3 feet, MAN). EVAN ROSE MAKES IT! Assist: Tim Durant
Score: 21-28

[10:35] Team_090 possession (Score: 21-28)
Tobias Tatum attempts a 3Pt. Contested by Tim Durant (4.9 feet, MAN). Tobias Tatum misses. Rebound secured by Tim Durant.

[10:16] Team_061 possession (Score: 21-28)
FOUL! Holding foul on Russell Smith. [Team fouls: 1] No free throws, side out. (Russell Smith: 1 personal fouls)

[10:04] Team_061 possession (Score: 21-28)
Evan Rose attempts a Midrange. Contested by Josh Wall (4.4 feet, ZONE). Evan Rose misses. Rebound secured by Tobias Tatum.

[09:48] Team_090 possession (Score: 21-28)
FOUL! Holding foul on Tim Durant. [Team fouls: 1] No free throws, side out. (Tim Durant: 1 personal fouls)

[09:33] Team_090 possession (Score: 21-28)
Russell Smith attempts a 3Pt. Contested by Desmond Morant (4.7 feet, ZONE). Russell Smith misses. Rebound secured by Tim Durant.

[09:19] Team_061 possession (Score: 21-28)
Tim Durant drives and kicks out. Tim Durant attempts a 3Pt. Contested by Russell Smith (4.3 feet, ZONE). TIM DURANT MAKES IT! Assist: Evan Rose
Score: 24-28

[09:08] Team_090 possession (Score: 24-28)
Derrick Nowitzki drives, picks up Stephen Towns. Help arrives from Evan Rose! Derrick Nowitzki attempts a Layup. Contested by Evan Rose (4.4 feet, MAN). Derrick Nowitzki misses. Rebound secured by Tim Durant.

[08:56] Team_061 possession (Score: 24-28)
Desmond Morant attempts a Midrange. Contested by Josh Wall (4.4 feet, ZONE). DESMOND MORANT MAKES IT!
Score: 26-28

[08:37] Team_090 possession (Score: 26-28)
OG Anunoby attempts a Layup. Contested by Evan Rose (5.1 feet, MAN). OG ANUNOBY MAKES IT! Assist: Tobias Tatum
Score: 26-30

[08:22] Team_061 possession (Score: 26-30)
Tim Durant drives, Tobias Tatum stays with him. Tim Durant attempts a Layup. Contested by Tobias Tatum (5.2 feet, ZONE). TIM DURANT MAKES IT!
Score: 28-30

[08:10] Team_090 possession (Score: 28-30)
Tobias Tatum throws a bad pass out of bounds! TURNOVER! (dead ball)

[07:55] Team_061 possession (Score: 28-30)
FOUL! Reach-in foul on Tobias Tatum during the drive. [Team fouls: 2] No free throws, side out. (Tobias Tatum: 1 personal fouls)

[07:37] Team_061 possession (Score: 28-30)
Desmond Morant attempts a 3Pt. Contested by Josh Wall (4.4 feet, ZONE). DESMOND MORANT MAKES IT! Assist: Tim Durant
Score: 31-30

[07:24] Team_090 possession (Score: 31-30)
Josh Wall drives and kicks out. Tobias Tatum attempts a 3Pt. Contested by Desmond Morant (4.5 feet, ZONE). TOBIAS TATUM MAKES IT! Assist: OG Anunoby
Score: 31-33

[07:08] Team_061 possession (Score: 31-33)
Gary Fox attempts a 3Pt. Contested by Russell Smith (4.4 feet, ZONE). Gary Fox misses. Offensive rebound by Stephen Towns! Stephen Towns kicks it out.

[06:53] Team_061 possession (Score: 31-33)
Gary Fox drives, Josh Wall stays with him. Gary Fox attempts a Dunk. Contested by Josh Wall (4.2 feet, MAN). GARY FOX MAKES IT! Assist: Stephen Towns
Score: 33-33

[06:39] Team_090 possession (Score: 33-33)
OG Anunoby drives, picks up Tim Durant. Help arrives from Evan Rose! OG Anunoby attempts a Dunk. Contested by Evan Rose (4.2 feet, ZONE). OG ANUNOBY MAKES IT! Assist: Josh Wall
Score: 33-35

[06:21] Team_061 possession (Score: 33-35)
Stephen Towns attempts a 3Pt. Contested by Derrick Nowitzki (4.6 feet, MAN). Stephen Towns misses. Offensive rebound by Tim Durant! Tim Durant puts it back in!
Score: 35-35

[06:03] Team_090 possession (Score: 35-35)
Josh Wall attempts a Midrange. Wide open! Gary Fox is 6.3 feet away. [MAN] Josh Wall misses. Rebound secured by Stephen Towns.

[05:48] Team_061 possession (Score: 35-35)
Gary Fox drives, picks up Josh Wall. Help arrives from Russell Smith! Gary Fox attempts a Dunk. Contested by Russell Smith (4.2 feet, MAN). Gary Fox misses. Rebound secured by Russell Smith.

[05:31] Team_090 possession (Score: 35-35)
Tobias Tatum drives and kicks out. Russell Smith attempts a 3Pt. Contested by Desmond Morant (4.5 feet, MAN). Russell Smith misses. Rebound secured by Stephen Towns.

[05:12] Team_061 possession (Score: 35-35)
Evan Rose drives to the basket... FOUL! Offensive foul on Evan Rose! Derrick Nowitzki drew the charge! [Team fouls: 2] (Evan Rose: 1 personal fouls) TURNOVER! (dead ball)

[04:53] Team_090 possession (Score: 35-35)
Russell Smith attempts a 3Pt. Contested by Desmond Morant (4.7 feet, ZONE). Russell Smith misses. Rebound secured by Stephen Towns.

[04:36] Team_061 possession (Score: 35-35)
Tim Durant drives to the basket... FOUL! Offensive foul on Tim Durant! Tobias Tatum drew the charge! [Team fouls: 3] (Tim Durant: 2 personal fouls) TURNOVER! (dead ball)

[04:26] Team_090 possession (Score: 35-35)
Josh Wall drives, Gary Fox stays with him. Josh Wall attempts a Dunk. Wide open! Gary Fox is 6.3 feet away. [MAN] Josh Wall misses. Rebound secured by Desmond Morant.

[04:14] Team_061 possession (Score: 35-35)
Gary Fox attempts a Layup. Contested by Josh Wall (4.2 feet, MAN). Gary Fox misses. Offensive rebound by Tim Durant! Tim Durant's putback is no good. Rebound secured by Derrick Nowitzki.

[03:58] Team_090 possession (Score: 35-35)
Tobias Tatum makes the Layup and draws the foul on Tim Durant! And-1! Tobias Tatum to the line for 1. [Team fouls: 4] (Tim Durant: 3 personal fouls)   FT 1/1: GOOD Tobias Tatum makes 1/1 from the line.
Score: 35-38

[03:40] Team_061 possession (Score: 35-38)
Evan Rose makes the Layup and draws the foul on OG Anunoby! And-1! Evan Rose to the line for 1. [Team fouls: 3] (OG Anunoby: 1 personal fouls)   FT 1/1: GOOD Evan Rose makes 1/1 from the line.
Score: 38-38

[03:28] Team_090 possession (Score: 38-38)
Russell Smith attempts a Layup. Contested by Tim Durant (4.5 feet, ZONE). Russell Smith misses. Offensive rebound by Russell Smith! Russell Smith kicks it out.

[03:10] Team_090 possession (Score: 38-38)
Derrick Nowitzki throws a bad pass! Stolen by Stephen Towns! TURNOVER! (live ball)

[02:51] Team_061 possession (Score: 38-38)
Stephen Towns drives, Tobias Tatum stays with him. Stephen Towns attempts a Dunk. Contested by Tobias Tatum (5.0 feet, ZONE). Stephen Towns misses. Rebound secured by Russell Smith.

[02:33] Team_090 possession (Score: 38-38)
Josh Wall drives and kicks out. Russell Smith attempts a Midrange. Contested by Desmond Morant (4.6 feet, MAN). Russell Smith misses. Offensive rebound by Tobias Tatum! Tobias Tatum kicks it out.

[02:18] Team_090 possession (Score: 38-38)
OG Anunoby attempts a 3Pt. Contested by Desmond Morant (4.6 feet, ZONE). OG Anunoby misses. Offensive rebound by Tobias Tatum! Tobias Tatum kicks it out.

[02:03] Team_090 possession (Score: 38-38)
FOUL! Offensive foul on Russell Smith! Desmond Morant drew the charge! [Team fouls: 4] (Russell Smith: 2 personal fouls) TURNOVER! (dead ball)

[01:50] Team_061 possession (Score: 38-38)
Tim Durant attempts a 3Pt. Contested by Josh Wall (4.9 feet, ZONE). Tim Durant misses. Offensive rebound by Stephen Towns! Stephen Towns kicks it out.

[01:35] Team_061 possession (Score: 38-38)
Desmond Morant attempts a 3Pt. Contested by Russell Smith (4.8 feet, ZONE). DESMOND MORANT MAKES IT! Assist: Evan Rose
Score: 41-38

[01:19] Team_090 possession (Score: 41-38)
OG Anunoby attempts a 3Pt. Contested by Desmond Morant (4.7 feet, ZONE). OG Anunoby misses. Offensive rebound by Tobias Tatum! Tobias Tatum kicks it out.

[01:05] Team_090 possession (Score: 41-38)
Russell Smith attempts a 3Pt. Contested by Desmond Morant (5.0 feet, MAN). Russell Smith misses. Rebound secured by Stephen Towns.

[00:47] Team_061 possession (Score: 41-38)
Gary Fox attempts a 3Pt. Contested by Russell Smith (4.7 feet, ZONE). GARY FOX MAKES IT!
Score: 44-38

[00:33] Team_090 possession (Score: 44-38)
Tobias Tatum drives and kicks out. Josh Wall attempts a 3Pt. Contested by Desmond Morant (4.8 feet, ZONE). JOSH WALL MAKES IT! Assist: Russell Smith
Score: 44-41

[00:17] Team_061 possession (Score: 44-41)
Tim Durant throws a bad pass out of bounds! TURNOVER! (dead ball)

[00:01] Team_090 possession (Score: 44-41)
Russell Smith makes the 3Pt and draws the foul on Desmond Morant! And-1! Russell Smith to the line for 1. [BONUS: 5 team fouls] (Desmond Morant: 1 personal fouls)   FT 1/1: GOOD Russell Smith makes 1/1 from the line.
Score: 44-45

================================================================================
                              2ND QUARTER COMPLETE                              
================================================================================

2ND QUARTER SCORE: Team_061 26, Team_090 19

BOX SCORE:
================================================================================

Team_061
--------------------------------------------------------------------------------
Player                MIN  PTS  REB  AST  TO      FG   FG%      3P   3P%
--------------------------------------------------------------------------------
Desmond Morant         11    8    1    0   0   3/3   100.0     0/0   0.0
Tim Durant             11    7    4    2   0   3/3   100.0     0/0   0.0
Evan Rose              11    6    0    2   0   2/3    66.7     0/0   0.0
Gary Fox               11    5    0    0   0   2/4    50.0     0/0   0.0
Draymond Banchero      13    0    0    0   0   0/1     0.0     0/0   0.0
Jayson Holiday         13    0    0    0   0   0/1     0.0     0/0   0.0
Michael Russell        13    0    1    0   0   0/0     0.0     0/0   0.0
Brandon Russell        13    0    0    0   0   0/1     0.0     0/0   0.0
Derrick Nowitzki       11    0    1    0   0   0/1     0.0     0/0   0.0
Stephen Towns          11    0    6    1   0   0/1     0.0     0/0   0.0

TEAM: FG: 10/17 (58.8%), 3PT: 5/6 (83.3%), REB: 13 (4 off, 9 def), AST: 5, TO: 3
TEAM FOULS: 5 [Team_090 in BONUS]


Team_090
--------------------------------------------------------------------------------
Player                MIN  PTS  REB  AST  TO      FG   FG%      3P   3P%
--------------------------------------------------------------------------------
Tobias Tatum           11    6    4    1   0   2/4    50.0     0/0   0.0
Russell Smith          11    4    3    1   0   1/4    25.0     0/0   0.0
OG Anunoby             11    4    0    1   0   2/2   100.0     0/0   0.0
Josh Wall              11    3    0    1   0   1/3    33.3     0/0   0.0
Tracy Adebayo          13    2    0    0   0   1/1   100.0     0/0   0.0
Gary Brogdon           13    0    2    0   0   0/0     0.0     0/0   0.0
Zach Wall              13    0    1    0   0   0/1     0.0     0/0   0.0

TEAM: FG: 7/16 (43.8%), 3PT: 1/6 (16.7%), REB: 10 (4 off, 6 def), AST: 4, TO: 4
TEAM FOULS: 4

================================================================================

================================================================================
                       3RD QUARTER - Team_061 vs Team_090                       
================================================================================

[12:00] Team_061 possession (Score: 44-45)
Brandon Russell attempts a Midrange. Contested by Derrick Mitchell (3.4 feet, MAN). Brandon Russell misses. Rebound secured by Gary Brogdon.

[11:43] Team_090 possession (Score: 44-45)
Gary Brogdon attempts a 3Pt. Contested by Bam Sexton (5.1 feet, MAN). Gary Brogdon misses. Offensive rebound by Tracy Adebayo! Tracy Adebayo kicks it out.

[11:28] Team_090 possession (Score: 44-45)
Derrick Mitchell drives, picks up Draymond Banchero. Help arrives from Jayson Holiday! Derrick Mitchell attempts a Dunk. Contested by Jayson Holiday (2.9 feet, ZONE). DERRICK MITCHELL MAKES IT! Assist: Tracy Adebayo
Score: 44-47

[11:12] Team_061 possession (Score: 44-47)
Draymond Banchero attempts a Layup. Contested by Gary Brogdon (4.3 feet, ZONE). Draymond Banchero misses. Rebound secured by Zach Wall.

[10:59] Team_090 possession (Score: 44-47)
Larry Bridges drives to the basket... Larry Bridges loses the ball! Stripped by Jayson Holiday! TURNOVER! (live ball)

[10:45] Team_061 possession (Score: 44-47)
Bam Sexton attempts a Layup. Contested by Gary Brogdon (4.1 feet, ZONE). Bam Sexton misses. Rebound secured by Zach Wall.

[10:31] Team_090 possession (Score: 44-47)
Tracy Adebayo attempts a Midrange. Contested by Draymond Banchero (2.4 feet, MAN). Tracy Adebayo misses. Rebound secured by Bam Sexton.

[10:17] Team_061 possession (Score: 44-47)
Bam Sexton drives, Gary Brogdon stays with him. Bam Sexton attempts a Layup. Contested by Gary Brogdon (4.1 feet, MAN). BAM SEXTON MAKES IT! Assist: Michael Russell
Score: 46-47

[10:02] Team_090 possession (Score: 46-47)
Zach Wall attempts a Layup. Contested by Draymond Banchero (2.9 feet, ZONE). ZACH WALL MAKES IT!
Score: 46-49

[09:51] Team_061 possession (Score: 46-49)
Draymond Banchero drives, Gary Brogdon stays with him. Draymond Banchero attempts a Layup. Contested by Gary Brogdon (4.3 feet, ZONE). DRAYMOND BANCHERO MAKES IT! Assist: Bam Sexton
Score: 48-49

[09:35] Team_090 possession (Score: 48-49)
Zach Wall loses the ball! Stripped by Michael Russell! TURNOVER! (live ball)

[09:21] Team_061 possession (Score: 48-49)
FOUL! Shooting foul on Zach Wall. Michael Russell to the line for 3 free throws. [Team fouls: 1] (Zach Wall: 1 personal fouls)   FT 1/3: MISS   FT 2/3: GOOD   FT 3/3: GOOD Michael Russell makes 2/3 from the line.
Score: 50-49

[09:10] Team_090 possession (Score: 50-49)
Tracy Adebayo makes the Layup and draws the foul on Draymond Banchero! And-1! Tracy Adebayo to the line for 1. [Team fouls: 1] (Draymond Banchero: 1 personal fouls)   FT 1/1: GOOD Tracy Adebayo makes 1/1 from the line.
Score: 50-52

[08:58] Team_061 possession (Score: 50-52)
FOUL! Reach-in foul on Larry Bridges during the drive. [Team fouls: 2] No free throws, side out. (Larry Bridges: 1 personal fouls)

[08:40] Team_061 possession (Score: 50-52)
Michael Russell drives, Gary Brogdon stays with him. Michael Russell attempts a Dunk. Contested by Gary Brogdon (3.9 feet, ZONE). Michael Russell misses. Rebound secured by Gary Brogdon.

[08:27] Team_090 possession (Score: 50-52)
Zach Wall throws a bad pass out of bounds! TURNOVER! (dead ball)

[08:13] Team_061 possession (Score: 50-52)
FOUL! Shooting foul on Gary Brogdon. Brandon Russell to the line for 2 free throws. [Team fouls: 3] (Gary Brogdon: 1 personal fouls)   FT 1/2: GOOD   FT 2/2: GOOD Brandon Russell makes 2/2 from the line.
Score: 52-52

[07:58] Team_090 possession (Score: 52-52)
Gary Brogdon attempts a 3Pt. Contested by Brandon Russell (4.1 feet, ZONE). GARY BROGDON MAKES IT! Assist: Zach Wall
Score: 52-55

[07:42] Team_061 possession (Score: 52-55)
Bam Sexton attempts a Midrange. Contested by Gary Brogdon (4.1 feet, ZONE). Bam Sexton misses. Rebound secured by Zach Wall.

[07:25] Team_090 possession (Score: 52-55)
FOUL! Reach-in foul on Jayson Holiday during the drive. [Team fouls: 2] No free throws, side out. (Jayson Holiday: 1 personal fouls)

[07:05] Team_090 possession (Score: 52-55)
Zach Wall attempts a 3Pt. Contested by Michael Russell (4.0 feet, ZONE). Zach Wall misses. Rebound secured by Bam Sexton.

[06:54] Team_061 possession (Score: 52-55)
Draymond Banchero drives, Tracy Adebayo stays with him. Draymond Banchero attempts a Dunk. Contested by Tracy Adebayo (5.4 feet, MAN). DRAYMOND BANCHERO MAKES IT!
Score: 54-55

[06:40] Team_090 possession (Score: 54-55)
Zach Wall attempts a 3Pt. BLOCKED BY MICHAEL RUSSELL! Ball is loose! Offensive rebound by Tracy Adebayo! Tracy Adebayo kicks it out.

[06:25] Team_090 possession (Score: 54-55)
Zach Wall attempts a Layup. BLOCKED BY DRAYMOND BANCHERO! Ball deflects out of bounds off Zach Wall.

[06:07] Team_061 possession (Score: 54-55)
Michael Russell attempts a 3Pt. Contested by Zach Wall (5.3 feet, ZONE). MICHAEL RUSSELL MAKES IT! Assist: Draymond Banchero
Score: 57-55

[05:51] Team_090 possession (Score: 57-55)
Tracy Adebayo makes the Dunk and draws the foul on Draymond Banchero! And-1! Tracy Adebayo to the line for 1. [Team fouls: 3] (Draymond Banchero: 2 personal fouls)   FT 1/1: GOOD Tracy Adebayo makes 1/1 from the line.
Score: 57-58

[05:37] Team_061 possession (Score: 57-58)
Bam Sexton makes the Dunk and draws the foul on Gary Brogdon! And-1! Bam Sexton to the line for 1. [Team fouls: 4] (Gary Brogdon: 2 personal fouls)   FT 1/1: MISS Bam Sexton makes 0/1 from the line. Rebound secured by Tracy Adebayo.
Score: 59-58

[05:26] Team_090 possession (Score: 59-58)
Larry Bridges drives to the basket... Larry Bridges throws a bad pass! Stolen by Jayson Holiday! TURNOVER! (live ball)

[05:17] Team_061 possession (Score: 59-58)
FOUL! Holding foul on Zach Wall. [IN THE BONUS! 5 team fouls] Michael Russell to the line for 2 free throws. (Zach Wall: 2 personal fouls)   FT 1/2: MISS   FT 2/2: MISS Michael Russell makes 0/2 from the line. Rebound secured by Tracy Adebayo.

[04:58] Team_090 possession (Score: 59-58)
Larry Bridges attempts a 3Pt. Contested by Jayson Holiday (4.1 feet, MAN). Larry Bridges misses. Rebound secured by Draymond Banchero.

[04:46] Team_061 possession (Score: 59-58)
Michael Russell attempts a 3Pt. Contested by Zach Wall (5.3 feet, MAN). Michael Russell misses. Rebound secured by Zach Wall.

[04:34] Team_090 possession (Score: 59-58)
Tracy Adebayo attempts a Midrange. Contested by Michael Russell (3.6 feet, ZONE). Tracy Adebayo misses. Rebound secured by Michael Russell.

[04:16] Team_061 possession (Score: 59-58)
Draymond Banchero attempts a Layup. Contested by Tracy Adebayo (5.6 feet, MAN). DRAYMOND BANCHERO MAKES IT! Assist: Michael Russell
Score: 61-58

[03:57] Team_090 possession (Score: 61-58)
Derrick Mitchell attempts a Midrange. Contested by Jayson Holiday (4.4 feet, ZONE). Derrick Mitchell misses. Offensive rebound by Zach Wall! Zach Wall kicks it out.

[03:38] Team_090 possession (Score: 61-58)
Derrick Mitchell drives and kicks out. Derrick Mitchell attempts a Midrange. Contested by Jayson Holiday (4.1 feet, ZONE). Derrick Mitchell misses. Rebound secured by Michael Russell.

[03:27] Team_061 possession (Score: 61-58)
Jayson Holiday drives, picks up Tracy Adebayo. Help arrives from Larry Bridges! Jayson Holiday attempts a Layup. Contested by Larry Bridges (5.3 feet, ZONE). JAYSON HOLIDAY MAKES IT! Assist: Brandon Russell
Score: 63-58

[03:13] Team_090 possession (Score: 63-58)
Derrick Mitchell drives, Draymond Banchero stays with him. Derrick Mitchell attempts a Layup. Contested by Draymond Banchero (3.0 feet, ZONE). Derrick Mitchell misses. Rebound secured by Bam Sexton.

[03:00] Team_061 possession (Score: 63-58)
Jayson Holiday attempts a 3Pt. Contested by Larry Bridges (5.3 feet, MAN). Jayson Holiday misses. Rebound secured by Tracy Adebayo.

[02:43] Team_090 possession (Score: 63-58)
Derrick Mitchell attempts a 3Pt. Contested by Brandon Russell (4.3 feet, MAN). Derrick Mitchell misses. Rebound secured by Draymond Banchero.

[02:30] Team_061 possession (Score: 63-58)
FOUL! Shooting foul on Gary Brogdon. Bam Sexton to the line for 2 free throws. [BONUS: 6 team fouls] (Gary Brogdon: 3 personal fouls)   FT 1/2: GOOD   FT 2/2: GOOD Bam Sexton makes 2/2 from the line.
Score: 65-58

[02:16] Team_090 possession (Score: 65-58)
Derrick Mitchell attempts a 3Pt. Contested by Brandon Russell (4.4 feet, MAN). Derrick Mitchell misses. Offensive rebound by Tracy Adebayo! Tracy Adebayo kicks it out.

[02:02] Team_090 possession (Score: 65-58)
Gary Brogdon attempts a Midrange. Contested by Bam Sexton (5.2 feet, MAN). Gary Brogdon misses. Offensive rebound by Zach Wall! Zach Wall kicks it out.

[01:43] Team_090 possession (Score: 65-58)
Gary Brogdon attempts a 3Pt. Contested by Michael Russell (4.3 feet, ZONE). Gary Brogdon misses. Rebound secured by Draymond Banchero.

[01:30] Team_061 possession (Score: 65-58)
Jayson Holiday attempts a 3Pt. Contested by Larry Bridges (5.4 feet, MAN). JAYSON HOLIDAY MAKES IT! Assist: Draymond Banchero
Score: 68-58

[01:15] Team_090 possession (Score: 68-58)
Derrick Mitchell attempts a 3Pt. Contested by Brandon Russell (4.5 feet, MAN). Derrick Mitchell misses. Offensive rebound by Tracy Adebayo! Tracy Adebayo kicks it out.

[00:59] Team_090 possession (Score: 68-58)
Zach Wall attempts a 3Pt. Contested by Michael Russell (4.4 feet, MAN). Zach Wall misses. Offensive rebound by Tracy Adebayo! Tracy Adebayo kicks it out.

[00:43] Team_090 possession (Score: 68-58)
Larry Bridges attempts a 3Pt. Contested by Brandon Russell (4.3 feet, ZONE). Larry Bridges misses. Rebound secured by Michael Russell.

[00:27] Team_061 possession (Score: 68-58)
Draymond Banchero attempts a 3Pt. Contested by Tracy Adebayo (5.9 feet, MAN). Draymond Banchero misses. Rebound secured by Gary Brogdon.

[00:16] Team_090 possession (Score: 68-58)
Gary Brogdon attempts a Layup. BLOCKED BY DRAYMOND BANCHERO! Ball goes out off Draymond Banchero. Gary Brogdon's ball!

================================================================================
                              3RD QUARTER COMPLETE                              
================================================================================

3RD QUARTER SCORE: Team_061 24, Team_090 13

BOX SCORE:
================================================================================

Team_061
--------------------------------------------------------------------------------
Player                MIN  PTS  REB  AST  TO      FG   FG%      3P   3P%
--------------------------------------------------------------------------------
Draymond Banchero      25    6    3    2   0   3/5    60.0     0/0   0.0
Michael Russell        25    5    3    2   0   2/4    50.0     0/0   0.0
Jayson Holiday         25    5    0    0   0   2/3    66.7     0/0   0.0
Bam Sexton             25    4    3    1   0   2/5    40.0     0/0   0.0
Brandon Russell        25    2    0    1   0   1/2    50.0     0/0   0.0

TEAM: FG: 10/20 (50.0%), 3PT: 3/6 (50.0%), REB: 9 (0 off, 9 def), AST: 6, TO: 0
TEAM FOULS: 3


Team_090
--------------------------------------------------------------------------------
Player                MIN  PTS  REB  AST  TO      FG   FG%      3P   3P%
--------------------------------------------------------------------------------
Tracy Adebayo          25    6    8    1   0   2/4    50.0     0/0   0.0
Gary Brogdon           25    3    3    0   0   1/2    50.0     0/0   0.0
Derrick Mitchell       25    2    0    0   0   1/4    25.0     0/0   0.0
Zach Wall              25    2    6    1   0   1/3    33.3     0/0   0.0
Larry Bridges          25    0    0    0   0   0/2     0.0     0/0   0.0

TEAM: FG: 5/15 (33.3%), 3PT: 1/6 (16.7%), REB: 17 (7 off, 10 def), AST: 2, TO: 4
TEAM FOULS: 6 [Team_061 in BONUS]

================================================================================

================================================================================
                       4TH QUARTER - Team_061 vs Team_090                       
================================================================================

[12:00] Team_061 possession (Score: 68-58)
Jayson Holiday attempts a 3Pt. Contested by Larry Bridges (5.3 feet, MAN). JAYSON HOLIDAY MAKES IT! Assist: Bam Sexton
Score: 71-58

[11:44] Team_090 possession (Score: 71-58)
Zach Wall attempts a 3Pt. Contested by Michael Russell (4.3 feet, MAN). Zach Wall misses. Rebound secured by Bam Sexton.

[11:30] Team_061 possession (Score: 71-58)
Bam Sexton attempts a 3Pt. Contested by Derrick Mitchell (3.9 feet, ZONE). Bam Sexton misses. Offensive rebound by Draymond Banchero! Draymond Banchero puts it back in!
Score: 73-58

[11:16] Team_090 possession (Score: 73-58)
FOUL! Offensive foul on Zach Wall! Michael Russell drew the charge! [Team fouls: 1] (Zach Wall: 1 personal fouls) TURNOVER! (dead ball)

[11:02] Team_061 possession (Score: 73-58)
Bam Sexton drives and kicks out. FOUL! Shooting foul on Gary Brogdon. Bam Sexton to the line for 2 free throws. [Team fouls: 2] (Gary Brogdon: 1 personal fouls)   FT 1/2: GOOD   FT 2/2: MISS Bam Sexton makes 1/2 from the line. Offensive rebound by Michael Russell! Michael Russell's putback is no good.
Score: 74-58

[10:46] Team_090 possession (Score: 74-58)
FOUL! Reach-in foul on Jayson Holiday during the drive. [Team fouls: 1] No free throws, side out. (Jayson Holiday: 1 personal fouls)

[10:33] Team_090 possession (Score: 74-58)
Larry Bridges attempts a Midrange. Contested by Jayson Holiday (4.5 feet, MAN). LARRY BRIDGES MAKES IT!
Score: 74-60

[10:17] Team_061 possession (Score: 74-60)
Michael Russell makes the Layup and draws the foul on Zach Wall! And-1! Michael Russell to the line for 1. [Team fouls: 3] (Zach Wall: 2 personal fouls)   FT 1/1: GOOD Michael Russell makes 1/1 from the line.
Score: 77-60

[10:01] Team_090 possession (Score: 77-60)
Derrick Mitchell attempts a 3Pt. Contested by Brandon Russell (4.6 feet, ZONE). DERRICK MITCHELL MAKES IT! Assist: Gary Brogdon
Score: 77-63

[09:47] Team_061 possession (Score: 77-63)
Michael Russell drives and kicks out. Draymond Banchero attempts a Midrange. Contested by Gary Brogdon (4.5 feet, ZONE). DRAYMOND BANCHERO MAKES IT! Assist: Jayson Holiday
Score: 79-63

[09:33] Team_090 possession (Score: 79-63)
Larry Bridges attempts a Layup. Contested by Draymond Banchero (3.2 feet, ZONE). Larry Bridges misses. Rebound secured by Michael Russell.

[09:23] Team_061 possession (Score: 79-63)
Brandon Russell attempts a Midrange. Contested by Zach Wall (5.5 feet, ZONE). Brandon Russell misses. Offensive rebound by Michael Russell! Michael Russell kicks it out.

[09:04] Team_061 possession (Score: 79-63)
Brandon Russell attempts a 3Pt. Contested by Derrick Mitchell (3.9 feet, ZONE). Brandon Russell misses. Rebound secured by Tracy Adebayo.

[08:47] Team_090 possession (Score: 79-63)
Tracy Adebayo drives to the basket... Tracy Adebayo loses the ball! Stripped by Draymond Banchero! TURNOVER! (live ball)

[08:34] Team_061 possession (Score: 79-63)
Michael Russell attempts a Layup. Contested by Zach Wall (5.6 feet, MAN). Michael Russell misses. Rebound secured by Tracy Adebayo.

[08:22] Team_090 possession (Score: 79-63)
Gary Brogdon drives, Bam Sexton stays with him. Gary Brogdon attempts a Layup. Contested by Bam Sexton (5.5 feet, MAN). Gary Brogdon misses. Rebound secured by Draymond Banchero.

[08:06] Team_061 possession (Score: 79-63)
Brandon Russell attempts a 3Pt. Contested by Derrick Mitchell (4.0 feet, ZONE). Brandon Russell misses. Rebound secured by Gary Brogdon.

[07:56] Team_090 possession (Score: 79-63)
Derrick Mitchell attempts a 3Pt. Contested by Brandon Russell (4.8 feet, MAN). Derrick Mitchell misses. Rebound secured by Draymond Banchero.

[07:41] Team_061 possession (Score: 79-63)
Draymond Banchero drives to the basket... Draymond Banchero loses control! Ball rolls out of bounds! TURNOVER! (dead ball)

[07:41] Substitution (Team_061): Brandon Russell OUT → Evan Rose IN (stamina_rule2)

[07:41] Substitution (Team_061): Jayson Holiday OUT → Gary Fox IN (stamina_rule2)

[07:41] Substitution (Team_061): Michael Russell OUT → Desmond Morant IN (stamina_rule2)

[07:41] Substitution (Team_061): Bam Sexton OUT → Stephen Towns IN (stamina_rule2)

[07:41] Substitution (Team_061): Draymond Banchero OUT → Tim Durant IN (stamina_rule2)

[07:41] Substitution (Team_090): Derrick Mitchell OUT → OG Anunoby IN (stamina_rule2)

[07:41] Substitution (Team_090): Larry Bridges OUT → Josh Wall IN (stamina_rule2)

[07:41] Substitution (Team_090): Zach Wall OUT → Russell Smith IN (stamina_rule2)

[07:41] Substitution (Team_090): Gary Brogdon OUT → Derrick Nowitzki IN (stamina_rule2)

[07:41] Substitution (Team_090): Tracy Adebayo OUT → Tobias Tatum IN (stamina_rule2)

[07:29] Team_090 possession (Score: 79-63)
Josh Wall attempts a 3Pt. Wide open! Gary Fox is 6.3 feet away. [MAN] JOSH WALL MAKES IT!
Score: 79-66

[07:16] Team_061 possession (Score: 79-66)
Tim Durant attempts a Midrange. Contested by Tobias Tatum (5.2 feet, MAN). Tim Durant misses. Rebound secured by Russell Smith.

[07:06] Team_090 possession (Score: 79-66)
Josh Wall attempts a 3Pt. Wide open! Gary Fox is 6.3 feet away. [MAN] Josh Wall misses. Rebound secured by Stephen Towns.

[06:48] Team_061 possession (Score: 79-66)
Tim Durant drives, Derrick Nowitzki stays with him. Tim Durant attempts a Dunk. Contested by Derrick Nowitzki (4.9 feet, ZONE). TIM DURANT MAKES IT! Assist: Desmond Morant
Score: 81-66

[06:31] Team_090 possession (Score: 81-66)
Josh Wall attempts a 3Pt. Wide open! Gary Fox is 6.3 feet away. [MAN] Josh Wall misses. Rebound secured by Desmond Morant.

[06:14] Team_061 possession (Score: 81-66)
Stephen Towns makes the Layup and draws the foul on Josh Wall! And-1! Stephen Towns to the line for 1. [Team fouls: 4] (Josh Wall: 1 personal fouls)   FT 1/1: GOOD Stephen Towns makes 1/1 from the line.
Score: 84-66

[06:03] Team_090 possession (Score: 84-66)
OG Anunoby drives, Evan Rose stays with him. OG Anunoby attempts a Layup. Contested by Evan Rose (5.1 feet, MAN). OG ANUNOBY MAKES IT!
Score: 84-68

[05:48] Team_061 possession (Score: 84-68)
Desmond Morant drives to the basket... Desmond Morant throws a bad pass! Stolen by Russell Smith! TURNOVER! (live ball)

[05:34] Team_090 possession (Score: 84-68)
OG Anunoby makes the Midrange and draws the foul on Evan Rose! And-1! OG Anunoby to the line for 1. [Team fouls: 2] (Evan Rose: 1 personal fouls)   FT 1/1: GOOD OG Anunoby makes 1/1 from the line.
Score: 84-71

[05:20] Team_061 possession (Score: 84-71)
Desmond Morant makes the Layup and draws the foul on Derrick Nowitzki! And-1! Desmond Morant to the line for 1. [BONUS: 5 team fouls] (Derrick Nowitzki: 1 personal fouls)   FT 1/1: GOOD Desmond Morant makes 1/1 from the line.
Score: 87-71

[05:05] Team_090 possession (Score: 87-71)
FOUL! Shooting foul on Tim Durant. Derrick Nowitzki to the line for 2 free throws. [Team fouls: 3] (Tim Durant: 1 personal fouls)   FT 1/2: GOOD   FT 2/2: GOOD Derrick Nowitzki makes 2/2 from the line.
Score: 87-73

[04:46] Team_061 possession (Score: 87-73)
Tim Durant drives and kicks out. Desmond Morant attempts a Midrange. BLOCKED BY RUSSELL SMITH! Ball is loose! Rebound secured by Tobias Tatum.

[04:33] Team_090 possession (Score: 87-73)
Derrick Nowitzki attempts a Layup. Contested by Stephen Towns (4.4 feet, MAN). Derrick Nowitzki misses. Rebound secured by Stephen Towns.

[04:21] Team_061 possession (Score: 87-73)
FOUL! Shooting foul on Russell Smith. Tim Durant to the line for 3 free throws. [BONUS: 6 team fouls] (Russell Smith: 1 personal fouls)   FT 1/3: GOOD   FT 2/3: GOOD   FT 3/3: GOOD Tim Durant makes 3/3 from the line.
Score: 90-73

[04:10] Team_090 possession (Score: 90-73)
Derrick Nowitzki attempts a Midrange. Contested by Desmond Morant (4.1 feet, ZONE). DERRICK NOWITZKI MAKES IT!
Score: 90-75

[03:59] Team_061 possession (Score: 90-75)
Evan Rose makes the Layup and draws the foul on Josh Wall! And-1! Evan Rose to the line for 1. [BONUS: 7 team fouls] (Josh Wall: 2 personal fouls)   FT 1/1: GOOD Evan Rose makes 1/1 from the line.
Score: 93-75

[03:49] Team_090 possession (Score: 93-75)
Derrick Nowitzki attempts a 3Pt. Contested by Stephen Towns (4.4 feet, MAN). DERRICK NOWITZKI MAKES IT!
Score: 93-78

[03:36] Team_061 possession (Score: 93-78)
Gary Fox attempts a 3Pt. Contested by Russell Smith (4.4 feet, ZONE). GARY FOX MAKES IT! Assist: Desmond Morant
Score: 96-78

[03:21] Team_090 possession (Score: 96-78)
Josh Wall drives and kicks out. OG Anunoby attempts a Midrange. Contested by Evan Rose (5.0 feet, MAN). OG ANUNOBY MAKES IT! Assist: Josh Wall
Score: 96-80

[03:07] Team_061 possession (Score: 96-80)
Evan Rose attempts a Midrange. Contested by OG Anunoby (5.3 feet, MAN). Evan Rose misses. Rebound secured by Derrick Nowitzki.

[02:52] Team_090 possession (Score: 96-80)
Russell Smith drives and kicks out. Derrick Nowitzki attempts a Midrange. Contested by Stephen Towns (4.8 feet, MAN). Derrick Nowitzki misses. Rebound secured by Stephen Towns.

[02:36] Team_061 possession (Score: 96-80)
Desmond Morant makes the Dunk and draws the foul on Derrick Nowitzki! And-1! Desmond Morant to the line for 1. [BONUS: 8 team fouls] (Derrick Nowitzki: 2 personal fouls)   FT 1/1: GOOD Desmond Morant makes 1/1 from the line.
Score: 99-80

[02:24] Team_090 possession (Score: 99-80)
FOUL! Reach-in foul on Evan Rose during the drive. [Team fouls: 4] No free throws, side out. (Evan Rose: 2 personal fouls)

[02:13] Team_090 possession (Score: 99-80)
Tobias Tatum drives to the basket... FOUL! Offensive foul on Tobias Tatum! Tim Durant drew the charge! [Team fouls: 9] (Tobias Tatum: 1 personal fouls) TURNOVER! (dead ball)

[01:56] Team_061 possession (Score: 99-80)
Gary Fox attempts a 3Pt. Contested by Russell Smith (4.4 feet, ZONE). GARY FOX MAKES IT! Assist: Stephen Towns
Score: 102-80

[01:42] Team_090 possession (Score: 102-80)
Derrick Nowitzki drives to the basket... Derrick Nowitzki throws a bad pass! Stolen by Stephen Towns! TURNOVER! (live ball)

[01:25] Team_061 possession (Score: 102-80)
Gary Fox attempts a Layup. Contested by Josh Wall (4.2 feet, MAN). GARY FOX MAKES IT! Assist: Tim Durant
Score: 104-80

[01:08] Team_090 possession (Score: 104-80)
Tobias Tatum attempts a Layup. Contested by Tim Durant (4.9 feet, MAN). Tobias Tatum misses. Offensive rebound by Russell Smith! Russell Smith kicks it out.

[00:51] Team_090 possession (Score: 104-80)
Derrick Nowitzki drives to the basket... Derrick Nowitzki commits a violation (traveling/carry)! TURNOVER! (dead ball)

[00:37] Team_061 possession (Score: 104-80)
Gary Fox drives and kicks out. Tim Durant attempts a 3Pt. Contested by Tobias Tatum (4.7 feet, MAN). Tim Durant misses. Rebound secured by Russell Smith.

[00:25] Team_090 possession (Score: 104-80)
Josh Wall drives, picks up Gary Fox. Help arrives from Desmond Morant! Josh Wall attempts a Dunk. Wide open! Desmond Morant is 6.3 feet away. [MAN] JOSH WALL MAKES IT!
Score: 104-82

[00:09] Team_061 possession (Score: 104-82)
Desmond Morant drives, Russell Smith stays with him. Desmond Morant attempts a Layup. Contested by Russell Smith (4.7 feet, MAN). DESMOND MORANT MAKES IT! Assist: Evan Rose
Score: 106-82

================================================================================
                              4TH QUARTER COMPLETE                              
================================================================================

4TH QUARTER SCORE: Team_061 38, Team_090 24

BOX SCORE:
================================================================================

Team_061
--------------------------------------------------------------------------------
Player                MIN  PTS  REB  AST  TO      FG   FG%      3P   3P%
--------------------------------------------------------------------------------
Desmond Morant         19    8    1    2   0   3/3   100.0     0/0   0.0
Gary Fox               19    8    0    0   0   3/4    75.0     0/0   0.0
Tim Durant             19    5    0    1   0   2/4    50.0     0/0   0.0
Draymond Banchero      30    4    3    0   0   2/2   100.0     0/0   0.0
Jayson Holiday         30    3    0    1   0   1/1   100.0     0/0   0.0
Michael Russell        30    3    3    0   0   1/2    50.0     0/0   0.0
Stephen Towns          19    3    3    1   0   1/1   100.0     0/0   0.0
Evan Rose              19    3    0    1   0   1/2    50.0     0/0   0.0
Bam Sexton             30    0    1    1   0   0/1     0.0     0/0   0.0
Brandon Russell        30    0    0    0   0   0/2     0.0     0/0   0.0

TEAM: FG: 14/22 (63.6%), 3PT: 5/7 (71.4%), REB: 10 (2 off, 8 def), AST: 7, TO: 2
TEAM FOULS: 4


Team_090
--------------------------------------------------------------------------------
Player                MIN  PTS  REB  AST  TO      FG   FG%      3P   3P%
--------------------------------------------------------------------------------
OG Anunoby             19    7    0    0   0   3/3   100.0     0/0   0.0
Derrick Nowitzki       19    7    1    0   0   3/4    75.0     0/0   0.0
Josh Wall              19    5    0    1   0   2/4    50.0     0/0   0.0
Derrick Mitchell       30    3    0    0   0   1/2    50.0     0/0   0.0
Larry Bridges          30    2    0    0   0   1/2    50.0     0/0   0.0
Zach Wall              30    0    0    0   0   0/1     0.0     0/0   0.0
Gary Brogdon           30    0    1    1   0   0/1     0.0     0/0   0.0
Tracy Adebayo          30    0    2    0   0   0/0     0.0     0/0   0.0
Russell Smith          19    0    3    0   0   0/1     0.0     0/0   0.0
Tobias Tatum           19    0    1    0   0   0/0     0.0     0/0   0.0

TEAM: FG: 10/18 (55.6%), 3PT: 3/7 (42.9%), REB: 9 (1 off, 8 def), AST: 2, TO: 5
TEAM FOULS: 9 [Team_061 in BONUS]

================================================================================

================================================================================
                               FULL GAME COMPLETE                               
================================================================================

FINAL SCORE: Team_061 106, Team_090 82

SCORING BY QUARTER:
--------------------------------------------------------------------------------
Team                     Q1     Q2     Q3     Q4    FINAL
--------------------------------------------------------------------------------
Team_061                 18     26     24     38      106
Team_090                 26     19     13     24       82
--------------------------------------------------------------------------------

FULL GAME BOX SCORE:
================================================================================

Team_061
--------------------------------------------------------------------------------
Player                MIN  PTS  REB  AST  TO      FG   FG%      3P   3P%      FT STL BLK
--------------------------------------------------------------------------------
Brandon Russell        30    5    0    1   0   2/7    28.6   0/3     0.0   3/4     0   0
Jayson Holiday         30   10    0    1   1   4/9    44.4   2/5    40.0   0/0     2   0
Michael Russell        30   13   13    3   0   7/10   70.0   3/4    75.0   3/6     1   1
Bam Sexton             30    8    6    3   0   5/13   38.5   1/2    50.0   3/5     0   0
Draymond Banchero      30   12    9    4   3   4/9    44.4   0/1     0.0   2/3     1   3
Evan Rose              19    9    0    3   1   3/5    60.0   1/1   100.0   2/2     0   0
Gary Fox               19   13    0    0   1   5/8    62.5   3/3   100.0   0/0     0   0
Desmond Morant         19   16    2    2   1   6/6   100.0   2/2   100.0   2/2     0   0
Stephen Towns          19    3    9    2   0   2/3    66.7   1/1   100.0   1/1     2   0
Tim Durant             19   12    4    3   1   4/6    66.7   1/1   100.0   3/3     0   0

TEAM: FG: 42/77 (54.5%), 3PT: 14/23 (60.9%), REB: 43 (7 off, 36 def), AST: 22, TO: 8


Team_090
--------------------------------------------------------------------------------
Player                MIN  PTS  REB  AST  TO      FG   FG%      3P   3P%      FT STL BLK
--------------------------------------------------------------------------------
Derrick Mitchell       30   13    0    3   0   5/11   45.5   2/6    33.3   1/3     0   0
Larry Bridges          30    9    0    1   0   4/13   30.8   1/5    20.0   2/2     0   1
Zach Wall              30    5   13    2   4   2/7    28.6   1/5    20.0   2/5     1   0
Gary Brogdon           30    7    9    1   2   3/6    50.0   1/3    33.3   0/0     1   0
Tracy Adebayo          30   10   16    2   2   4/6    66.7   0/0     0.0   2/2     0   0
OG Anunoby             19   11    0    1   1   4/4   100.0   0/0     0.0   1/1     0   0
Josh Wall              19    8    0    2   0   4/8    50.0   1/3    33.3   0/0     0   0
Russell Smith          19    4    6    1   1   1/5    20.0   1/4    25.0   1/1     1   1
Derrick Nowitzki       19    7    2    0   3   3/5    60.0   1/1   100.0   2/2     0   0
Tobias Tatum           19    6    5    1   1   2/4    50.0   0/1     0.0   1/1     0   0

TEAM: FG: 32/69 (46.4%), 3PT: 8/28 (28.6%), REB: 51 (17 off, 34 def), AST: 14, TO: 14

================================================================================
