================================================================================
                        FULL GAME - Team_052 vs Team_091                        
================================================================================

================================================================================
                       1ST QUARTER - Team_052 vs Team_091                       
================================================================================

[12:00] Team_052 possession (Score: 0-0)
Carmelo Middleton attempts a Layup. BLOCKED BY KYRIE ROZIER! Ball is loose! Rebound secured by Kevin Simons.

[11:47] Team_091 possession (Score: 0-0)
Rudy Bridges attempts a 3Pt. Contested by Bones Morant (3.7 feet, MAN). Rudy Bridges misses. Offensive rebound by Kevin Simons! Kevin Simons puts it back in!
Score: 0-2

[11:34] Team_052 possession (Score: 0-2)
FOUL! Shooting foul on Kyrie Rozier. Josh Durant to the line for 2 free throws. [Team fouls: 1] (Kyrie Rozier: 1 personal fouls)   FT 1/2: GOOD   FT 2/2: GOOD Josh Durant makes 2/2 from the line.
Score: 2-2

[11:15] Team_091 possession (Score: 2-2)
Isaiah Siakam attempts a Midrange. Contested by Josh Durant (3.6 feet, MAN). Isaiah Siakam misses. Offensive rebound by Rudy Bridges! Rudy Bridges kicks it out.

[11:00] Team_091 possession (Score: 2-2)
D'Angelo Ingram attempts a Midrange. Contested by James Paul (4.4 feet, MAN). D'Angelo Ingram misses. Rebound secured by Carmelo Middleton.

[10:46] Team_052 possession (Score: 2-2)
Josh Durant attempts a 3Pt. Contested by Isaiah Siakam (5.4 feet, MAN). JOSH DURANT MAKES IT!
Score: 5-2

[10:32] Team_091 possession (Score: 5-2)
FOUL! Holding foul on Bones Morant. [Team fouls: 1] No free throws, side out. (Bones Morant: 1 personal fouls)

[10:15] Team_091 possession (Score: 5-2)
Kyrie Rozier drives to the basket... Kyrie Rozier throws a bad pass out of bounds! TURNOVER! (dead ball)

[10:00] Team_052 possession (Score: 5-2)
Josh Durant throws a bad pass! Stolen by Isaiah Siakam! TURNOVER! (live ball)

[09:45] Team_091 possession (Score: 5-2)
Isaiah Siakam drives, picks up Josh Durant. Help arrives from Bones Morant! Isaiah Siakam attempts a Dunk. Contested by Bones Morant (3.6 feet, MAN). Isaiah Siakam misses. Rebound secured by Carmelo Middleton.

[09:34] Team_052 possession (Score: 5-2)
Bones Morant attempts a 3Pt. Contested by Rudy Bridges (4.8 feet, MAN). BONES MORANT MAKES IT!
Score: 8-2

[09:19] Team_091 possession (Score: 8-2)
Kyrie Rozier attempts a 3Pt. Contested by Gary Gasol (3.9 feet, MAN). Kyrie Rozier misses. Rebound secured by James Paul.

[09:04] Team_052 possession (Score: 8-2)
Josh Durant drives, Isaiah Siakam stays with him. Josh Durant attempts a Dunk. Contested by Isaiah Siakam (5.4 feet, MAN). JOSH DURANT MAKES IT! Assist: Bones Morant
Score: 10-2

[08:50] Team_091 possession (Score: 10-2)
D'Angelo Ingram attempts a 3Pt. Contested by James Paul (4.4 feet, MAN). D'Angelo Ingram misses. Rebound secured by Carmelo Middleton.

[08:39] Team_052 possession (Score: 10-2)
Carmelo Middleton commits a violation (traveling/carry)! TURNOVER! (dead ball)

[08:22] Team_091 possession (Score: 10-2)
Isaiah Siakam attempts a Midrange. Contested by Josh Durant (3.6 feet, MAN). Isaiah Siakam misses. Rebound secured by James Paul.

[08:08] Team_052 possession (Score: 10-2)
Bones Morant drives, Rudy Bridges stays with him. Bones Morant attempts a Dunk. Contested by Rudy Bridges (4.8 feet, MAN). BONES MORANT MAKES IT! Assist: James Paul
Score: 12-2

[07:55] Team_091 possession (Score: 12-2)
Kevin Simons attempts a Midrange. Contested by Bones Morant (4.0 feet, ZONE). KEVIN SIMONS MAKES IT! Assist: Rudy Bridges
Score: 12-4

[07:39] Team_052 possession (Score: 12-4)
James Paul attempts a Midrange. Contested by D'Angelo Ingram (5.0 feet, MAN). JAMES PAUL MAKES IT!
Score: 14-4

[07:26] Team_091 possession (Score: 14-4)
Isaiah Siakam drives and kicks out. Rudy Bridges attempts a 3Pt. Contested by Bones Morant (3.6 feet, ZONE). Rudy Bridges misses. Offensive rebound by Rudy Bridges! Rudy Bridges kicks it out.

[07:13] Team_091 possession (Score: 14-4)
D'Angelo Ingram attempts a Layup. Contested by James Paul (4.4 feet, MAN). D'ANGELO INGRAM MAKES IT!
Score: 14-6

[06:57] Team_052 possession (Score: 14-6)
Carmelo Middleton drives, Kevin Simons stays with him. Carmelo Middleton attempts a Dunk. Contested by Kevin Simons (3.9 feet, MAN). Carmelo Middleton misses. Offensive rebound by Bones Morant! Bones Morant kicks it out.

[06:45] Team_052 possession (Score: 14-6)
Josh Durant attempts a Layup. Contested by Isaiah Siakam (5.4 feet, MAN). JOSH DURANT MAKES IT! Assist: Carmelo Middleton
Score: 16-6

[06:32] Team_091 possession (Score: 16-6)
Kyrie Rozier attempts a 3Pt. Contested by Bones Morant (3.7 feet, ZONE). Kyrie Rozier misses. Rebound secured by Carmelo Middleton.

[06:23] Team_052 possession (Score: 16-6)
Bones Morant attempts a 3Pt. Contested by Kyrie Rozier (4.5 feet, ZONE). BONES MORANT MAKES IT! Assist: James Paul
Score: 19-6

[06:07] Team_091 possession (Score: 19-6)
D'Angelo Ingram attempts a Layup. Contested by James Paul (4.4 feet, ZONE). D'ANGELO INGRAM MAKES IT!
Score: 19-8

[05:51] Team_052 possession (Score: 19-8)
James Paul attempts a 3Pt. Contested by Kyrie Rozier (4.4 feet, ZONE). James Paul misses. Rebound secured by Kyrie Rozier.

[05:37] Team_091 possession (Score: 19-8)
Rudy Bridges attempts a Midrange. Contested by Josh Durant (3.4 feet, ZONE). Rudy Bridges misses. Rebound secured by James Paul.

[05:23] Team_052 possession (Score: 19-8)
Carmelo Middleton drives, Kevin Simons stays with him. Carmelo Middleton attempts a Layup. Contested by Kevin Simons (4.0 feet, ZONE). Carmelo Middleton misses. Rebound secured by Kyrie Rozier.

[05:10] Team_091 possession (Score: 19-8)
FOUL! Reach-in foul on James Paul during the drive. [Team fouls: 2] No free throws, side out. (James Paul: 1 personal fouls)

[04:53] Team_091 possession (Score: 19-8)
Kevin Simons attempts a Midrange. Contested by Carmelo Middleton (4.8 feet, MAN). Kevin Simons misses. Rebound secured by Bones Morant.

[04:42] Team_052 possession (Score: 19-8)
Carmelo Middleton attempts a 3Pt. Contested by Kyrie Rozier (4.4 feet, ZONE). Carmelo Middleton misses. Offensive rebound by James Paul! James Paul puts it back in!
Score: 21-8

[04:24] Team_091 possession (Score: 21-8)
Kevin Simons attempts a Layup. Contested by James Paul (3.9 feet, ZONE). KEVIN SIMONS MAKES IT! Assist: D'Angelo Ingram
Score: 21-10

[04:10] Team_052 possession (Score: 21-10)
Bones Morant attempts a Midrange. Wide open! Isaiah Siakam is 6.2 feet away. [ZONE] BONES MORANT MAKES IT! Assist: Gary Gasol
Score: 23-10

[04:00] Team_091 possession (Score: 23-10)
Rudy Bridges attempts a Layup. Contested by James Paul (3.6 feet, ZONE). RUDY BRIDGES MAKES IT!
Score: 23-12

[03:47] Team_052 possession (Score: 23-12)
FOUL! Shooting foul on Kevin Simons. James Paul to the line for 2 free throws. [Team fouls: 2] (Kevin Simons: 1 personal fouls)   FT 1/2: GOOD   FT 2/2: GOOD James Paul makes 2/2 from the line.
Score: 25-12

[03:28] Team_091 possession (Score: 25-12)
Isaiah Siakam attempts a 3Pt. Contested by Bones Morant (4.0 feet, ZONE). Isaiah Siakam misses. Rebound secured by Bones Morant.

[03:11] Team_052 possession (Score: 25-12)
Gary Gasol attempts a 3Pt. Contested by Kyrie Rozier (4.6 feet, MAN). Gary Gasol misses. Rebound secured by Rudy Bridges.

[02:53] Team_091 possession (Score: 25-12)
Kevin Simons drives and kicks out. D'Angelo Ingram attempts a 3Pt. Contested by Bones Morant (3.8 feet, ZONE). D'Angelo Ingram misses. Rebound secured by Carmelo Middleton.

[02:40] Team_052 possession (Score: 25-12)
James Paul attempts a Midrange. Contested by D'Angelo Ingram (5.2 feet, MAN). James Paul misses. Rebound secured by Rudy Bridges.

[02:21] Team_091 possession (Score: 25-12)
Isaiah Siakam attempts a Layup. Contested by Carmelo Middleton (4.9 feet, ZONE). ISAIAH SIAKAM MAKES IT!
Score: 25-14

[02:05] Team_052 possession (Score: 25-14)
Carmelo Middleton makes the Layup and draws the foul on Kevin Simons! And-1! Carmelo Middleton to the line for 1. [Team fouls: 3] (Kevin Simons: 2 personal fouls)   FT 1/1: GOOD Carmelo Middleton makes 1/1 from the line.
Score: 28-14

[01:45] Team_091 possession (Score: 28-14)
Kevin Simons attempts a Midrange. Contested by Carmelo Middleton (5.0 feet, MAN). Kevin Simons misses. Rebound secured by James Paul.

[01:31] Team_052 possession (Score: 28-14)
FOUL! Shooting foul on Kevin Simons. Bones Morant to the line for 2 free throws. [Team fouls: 4] (Kevin Simons: 3 personal fouls)   FT 1/2: GOOD   FT 2/2: GOOD Bones Morant makes 2/2 from the line.
Score: 30-14

[01:16] Team_091 possession (Score: 30-14)
FOUL! Reach-in foul on James Paul during the drive. [Team fouls: 3] No free throws, side out. (James Paul: 2 personal fouls)

[00:57] Team_091 possession (Score: 30-14)
Kevin Simons drives, picks up Carmelo Middleton. Help arrives from Josh Durant! Kevin Simons attempts a Dunk. Contested by Josh Durant (5.1 feet, MAN). KEVIN SIMONS MAKES IT!
Score: 30-16

[00:43] Team_052 possession (Score: 30-16)
Gary Gasol attempts a 3Pt. Contested by Kyrie Rozier (4.8 feet, MAN). Gary Gasol misses. Rebound secured by Rudy Bridges.

[00:30] Team_091 possession (Score: 30-16)
Isaiah Siakam attempts a 3Pt. Contested by Josh Durant (4.0 feet, MAN). Isaiah Siakam misses. Rebound secured by Carmelo Middleton.

[00:12] Team_052 possession (Score: 30-16)
Gary Gasol drives to the basket... Gary Gasol loses the ball! Stripped by Kyrie Rozier! TURNOVER! (live ball)

================================================================================
                              1ST QUARTER COMPLETE                              
================================================================================

1ST QUARTER SCORE: Team_052 30, Team_091 16

BOX SCORE:
================================================================================

Team_052
--------------------------------------------------------------------------------
Player                MIN  PTS  REB  AST  TO      FG   FG%      3P   3P%
--------------------------------------------------------------------------------
Bones Morant           12   12    3    1   0   5/5   100.0     0/0   0.0
Josh Durant            12    9    0    0   0   4/4   100.0     0/0   0.0
James Paul             12    6    5    2   0   3/5    60.0     0/0   0.0
Carmelo Middleton      12    3    6    1   0   1/3    33.3     0/0   0.0
Gary Gasol             12    0    0    1   0   0/2     0.0     0/0   0.0

TEAM: FG: 13/19 (68.4%), 3PT: 4/7 (57.1%), REB: 14 (2 off, 12 def), AST: 5, TO: 3
TEAM FOULS: 3


Team_091
--------------------------------------------------------------------------------
Player                MIN  PTS  REB  AST  TO      FG   FG%      3P   3P%
--------------------------------------------------------------------------------
Kevin Simons           12    8    2    0   0   4/7    57.1     0/0   0.0
D'Angelo Ingram        12    4    0    1   0   2/4    50.0     0/0   0.0
Rudy Bridges           12    2    5    1   0   1/2    50.0     0/0   0.0
Isaiah Siakam          12    2    0    0   0   1/5    20.0     0/0   0.0
Kyrie Rozier           12    0    2    0   0   0/2     0.0     0/0   0.0

TEAM: FG: 8/20 (40.0%), 3PT: 1/6 (16.7%), REB: 9 (3 off, 6 def), AST: 2, TO: 1
TEAM FOULS: 4

================================================================================

================================================================================
                       2ND QUARTER - Team_052 vs Team_091                       
================================================================================

[12:00] Team_052 possession (Score: 30-16)
Carmelo Middleton attempts a Midrange. Contested by Kevin Simons (4.2 feet, MAN). CARMELO MIDDLETON MAKES IT! Assist: James Paul
Score: 32-16

[11:46] Team_091 possession (Score: 32-16)
Rudy Bridges attempts a 3Pt. Contested by Bones Morant (3.9 feet, MAN). Rudy Bridges misses. Rebound secured by Carmelo Middleton.

[11:35] Team_052 possession (Score: 32-16)
Carmelo Middleton drives, picks up Kevin Simons. Help arrives from Kyrie Rozier! Carmelo Middleton attempts a Layup. Contested by Kyrie Rozier (4.3 feet, MAN). Carmelo Middleton misses. Rebound secured by Rudy Bridges.

[11:20] Team_091 possession (Score: 32-16)
Isaiah Siakam drives and kicks out. Isaiah Siakam attempts a 3Pt. Contested by Josh Durant (3.6 feet, MAN). Isaiah Siakam misses. Offensive rebound by Kevin Simons! Kevin Simons puts it back in!
Score: 32-18

[11:08] Team_052 possession (Score: 32-18)
Carmelo Middleton attempts a 3Pt. Contested by Kevin Simons (4.3 feet, MAN). Carmelo Middleton misses. Rebound secured by Kevin Simons.

[10:53] Team_091 possession (Score: 32-18)
Rudy Bridges attempts a Layup. Contested by James Paul (3.9 feet, ZONE). RUDY BRIDGES MAKES IT! Assist: Kyrie Rozier
Score: 32-20

[10:42] Team_052 possession (Score: 32-20)
FOUL! Reach-in foul on D'Angelo Ingram during the drive. [Team fouls: 1] No free throws, side out. (D'Angelo Ingram: 1 personal fouls)

[10:28] Team_052 possession (Score: 32-20)
Josh Durant attempts a 3Pt. Contested by Isaiah Siakam (5.9 feet, MAN). JOSH DURANT MAKES IT! Assist: Bones Morant
Score: 35-20

[10:16] Team_091 possession (Score: 35-20)
D'Angelo Ingram attempts a Layup. Contested by James Paul (4.8 feet, ZONE). D'Angelo Ingram misses. Rebound secured by Carmelo Middleton.

[10:03] Team_052 possession (Score: 35-20)
Carmelo Middleton attempts a Layup. Contested by Kevin Simons (4.5 feet, MAN). CARMELO MIDDLETON MAKES IT!
Score: 37-20

[09:49] Team_091 possession (Score: 37-20)
Kyrie Rozier attempts a 3Pt. Contested by Gary Gasol (4.5 feet, MAN). Kyrie Rozier misses. Rebound secured by Carmelo Middleton.

[09:35] Team_052 possession (Score: 37-20)
Gary Gasol attempts a Midrange. Wide open! Isaiah Siakam is 6.6 feet away. [ZONE] GARY GASOL MAKES IT! Assist: James Paul
Score: 39-20

[09:20] Team_091 possession (Score: 39-20)
FOUL! Shooting foul on Bones Morant. Kyrie Rozier to the line for 3 free throws. [Team fouls: 1] (Bones Morant: 1 personal fouls)   FT 1/3: GOOD   FT 2/3: GOOD   FT 3/3: GOOD Kyrie Rozier makes 3/3 from the line.
Score: 39-23

[09:06] Team_052 possession (Score: 39-23)
Josh Durant attempts a 3Pt. Contested by Kyrie Rozier (4.4 feet, ZONE). Josh Durant misses. FOUL! Loose ball foul on Kevin Simons during the rebound battle. [Team fouls: 2] No free throws, side out. (Kevin Simons: 1 personal fouls)

[08:49] Team_052 possession (Score: 39-23)
Josh Durant attempts a 3Pt. Contested by Kyrie Rozier (4.4 feet, ZONE). Josh Durant misses. Rebound secured by Kevin Simons.

[08:32] Team_091 possession (Score: 39-23)
Kyrie Rozier attempts a Midrange. Contested by Bones Morant (4.4 feet, ZONE). Kyrie Rozier misses. Rebound secured by James Paul.

[08:18] Team_052 possession (Score: 39-23)
Josh Durant drives, picks up Kevin Simons. Help arrives from Kyrie Rozier! Josh Durant attempts a Layup. Contested by Kyrie Rozier (4.2 feet, ZONE). Josh Durant misses. Rebound secured by Kyrie Rozier.

[07:59] Team_091 possession (Score: 39-23)
Kevin Simons makes the Dunk and draws the foul on Josh Durant! And-1! Kevin Simons to the line for 1. [Team fouls: 2] (Josh Durant: 1 personal fouls)   FT 1/1: GOOD Kevin Simons makes 1/1 from the line.
Score: 39-26

[07:44] Team_052 possession (Score: 39-26)
James Paul drives, picks up D'Angelo Ingram. Help arrives from Kyrie Rozier! James Paul attempts a Layup. Contested by Kyrie Rozier (5.7 feet, MAN). James Paul misses. Rebound secured by Kevin Simons.

[07:33] Team_091 possession (Score: 39-26)
D'Angelo Ingram attempts a Midrange. Contested by James Paul (5.1 feet, MAN). D'ANGELO INGRAM MAKES IT!
Score: 39-28

[07:18] Team_052 possession (Score: 39-28)
Josh Durant drives, picks up Isaiah Siakam. Help arrives from Rudy Bridges! Josh Durant attempts a Dunk. Wide open! Rudy Bridges is 6.3 feet away. [MAN] JOSH DURANT MAKES IT!
Score: 41-28

[07:07] Team_091 possession (Score: 41-28)
FOUL! Holding foul on James Paul. [Team fouls: 3] No free throws, side out. (James Paul: 1 personal fouls)

[06:51] Team_091 possession (Score: 41-28)
FOUL! Shooting foul on Carmelo Middleton. Kevin Simons to the line for 2 free throws. [Team fouls: 4] (Carmelo Middleton: 1 personal fouls)   FT 1/2: GOOD   FT 2/2: GOOD Kevin Simons makes 2/2 from the line.
Score: 41-30

[06:35] Team_052 possession (Score: 41-30)
Josh Durant drives, picks up Kevin Simons. Help arrives from Kyrie Rozier! Josh Durant attempts a Layup. Contested by Kyrie Rozier (4.5 feet, ZONE). JOSH DURANT MAKES IT!
Score: 43-30

[06:20] Team_091 possession (Score: 43-30)
FOUL! Reach-in foul on James Paul during the drive. [IN THE BONUS! 5 team fouls] D'Angelo Ingram to the line for 2 free throws. (James Paul: 2 personal fouls)   FT 1/2: MISS   FT 2/2: GOOD D'Angelo Ingram makes 1/2 from the line.
Score: 43-31

[06:04] Team_052 possession (Score: 43-31)
Josh Durant attempts a Midrange. Wide open! Isaiah Siakam is 6.4 feet away. [MAN] JOSH DURANT MAKES IT!
Score: 45-31

[05:49] Team_091 possession (Score: 45-31)
Rudy Bridges drives to the basket... Rudy Bridges commits a violation (traveling/carry)! TURNOVER! (dead ball)

[05:49] Substitution (Team_052): Gary Gasol OUT → Jimmy Doncic IN (stamina_rule2)

[05:49] Substitution (Team_052): Josh Durant OUT → Carmelo Giddey IN (stamina_rule2)

[05:49] Substitution (Team_052): Bones Morant OUT → Donovan Stewart IN (stamina_rule2)

[05:49] Substitution (Team_052): James Paul OUT → Jalen Haliburton IN (stamina_rule2)

[05:49] Substitution (Team_052): Carmelo Middleton OUT → Carmelo Beal IN (stamina_rule2)

[05:49] Substitution (Team_091): Kyrie Rozier OUT → Karl Morant IN (stamina_rule2)

[05:49] Substitution (Team_091): Isaiah Siakam OUT → Julius Barnes IN (stamina_rule2)

[05:49] Substitution (Team_091): Rudy Bridges OUT → Tim Antetokounmpo IN (stamina_rule2)

[05:49] Substitution (Team_091): D'Angelo Ingram OUT → Zion Mitchell IN (stamina_rule2)

[05:49] Substitution (Team_091): Kevin Simons OUT → Ja George IN (stamina_rule2)

[05:31] Team_052 possession (Score: 45-31)
Carmelo Beal makes the Layup and draws the foul on Zion Mitchell! And-1! Carmelo Beal to the line for 1. [Team fouls: 3] (Zion Mitchell: 1 personal fouls)   FT 1/1: GOOD Carmelo Beal makes 1/1 from the line.
Score: 48-31

[05:19] Team_091 possession (Score: 48-31)
Tim Antetokounmpo attempts a Midrange. Contested by Carmelo Giddey (4.7 feet, ZONE). TIM ANTETOKOUNMPO MAKES IT!
Score: 48-33

[05:08] Team_052 possession (Score: 48-33)
Carmelo Giddey drives and kicks out. Jimmy Doncic attempts a Midrange. Contested by Tim Antetokounmpo (5.4 feet, ZONE). Jimmy Doncic misses. Rebound secured by Zion Mitchell.

[04:56] Team_091 possession (Score: 48-33)
Julius Barnes drives to the basket... Julius Barnes throws a bad pass! Stolen by Carmelo Giddey! TURNOVER! (live ball)

[04:45] Team_052 possession (Score: 48-33)
Jalen Haliburton attempts a 3Pt. Contested by Karl Morant (5.0 feet, ZONE). Jalen Haliburton misses. Rebound secured by Zion Mitchell.

[04:29] Team_091 possession (Score: 48-33)
Tim Antetokounmpo attempts a 3Pt. Contested by Donovan Stewart (4.9 feet, MAN). TIM ANTETOKOUNMPO MAKES IT! Assist: Julius Barnes
Score: 48-36

[04:16] Team_052 possession (Score: 48-36)
Jalen Haliburton drives, Zion Mitchell stays with him. Jalen Haliburton attempts a Dunk. Contested by Zion Mitchell (5.1 feet, MAN). JALEN HALIBURTON MAKES IT! Assist: Jimmy Doncic
Score: 50-36

[04:02] Team_091 possession (Score: 50-36)
Ja George drives, Carmelo Beal stays with him. Ja George attempts a Dunk. Contested by Carmelo Beal (3.6 feet, MAN). JA GEORGE MAKES IT!
Score: 50-38

[03:46] Team_052 possession (Score: 50-38)
FOUL! Shooting foul on Ja George. Carmelo Beal to the line for 2 free throws. [Team fouls: 4] (Ja George: 1 personal fouls)   FT 1/2: GOOD   FT 2/2: GOOD Carmelo Beal makes 2/2 from the line.
Score: 52-38

[03:31] Team_091 possession (Score: 52-38)
FOUL! Shooting foul on Jalen Haliburton. Tim Antetokounmpo to the line for 2 free throws. [BONUS: 6 team fouls] (Jalen Haliburton: 1 personal fouls)   FT 1/2: GOOD   FT 2/2: GOOD Tim Antetokounmpo makes 2/2 from the line.
Score: 52-40

[03:17] Team_052 possession (Score: 52-40)
Jalen Haliburton drives and kicks out. Jimmy Doncic attempts a 3Pt. Contested by Zion Mitchell (4.9 feet, ZONE). Jimmy Doncic misses. Rebound secured by Ja George.

[03:02] Team_091 possession (Score: 52-40)
Zion Mitchell attempts a 3Pt. Contested by Jalen Haliburton (4.7 feet, MAN). ZION MITCHELL MAKES IT! Assist: Julius Barnes
Score: 52-43

[02:51] Team_052 possession (Score: 52-43)
Jimmy Doncic attempts a 3Pt. Contested by Karl Morant (4.7 feet, ZONE). Jimmy Doncic misses. Rebound secured by Ja George.

[02:33] Team_091 possession (Score: 52-43)
Zion Mitchell attempts a 3Pt. Contested by Jimmy Doncic (4.9 feet, ZONE). Zion Mitchell misses. Rebound secured by Carmelo Beal.

[02:18] Team_052 possession (Score: 52-43)
Carmelo Giddey makes the 3Pt and draws the foul on Julius Barnes! And-1! Carmelo Giddey to the line for 1. [BONUS: 5 team fouls] (Julius Barnes: 1 personal fouls)   FT 1/1: GOOD Carmelo Giddey makes 1/1 from the line.
Score: 56-43

[02:07] Team_091 possession (Score: 56-43)
Zion Mitchell attempts a Midrange. Contested by Jimmy Doncic (4.9 feet, ZONE). Zion Mitchell misses. Rebound secured by Carmelo Beal.

[01:51] Team_052 possession (Score: 56-43)
Carmelo Beal attempts a Midrange. Contested by Tim Antetokounmpo (5.2 feet, ZONE). CARMELO BEAL MAKES IT! Assist: Carmelo Giddey
Score: 58-43

[01:32] Team_091 possession (Score: 58-43)
Tim Antetokounmpo drives, picks up Donovan Stewart. Help arrives from Carmelo Giddey! Tim Antetokounmpo attempts a Layup. Contested by Carmelo Giddey (4.9 feet, MAN). TIM ANTETOKOUNMPO MAKES IT! Assist: Karl Morant
Score: 58-45

[01:16] Team_052 possession (Score: 58-45)
Donovan Stewart attempts a Layup. Contested by Zion Mitchell (5.0 feet, ZONE). Donovan Stewart misses. Rebound secured by Tim Antetokounmpo.

[00:58] Team_091 possession (Score: 58-45)
Julius Barnes attempts a Layup. Contested by Carmelo Beal (3.5 feet, ZONE). JULIUS BARNES MAKES IT! Assist: Tim Antetokounmpo
Score: 58-47

[00:41] Team_052 possession (Score: 58-47)
Carmelo Beal drives and kicks out. Carmelo Beal attempts a 3Pt. Contested by Karl Morant (4.9 feet, ZONE). CARMELO BEAL MAKES IT! Assist: Carmelo Giddey
Score: 61-47

[00:27] Team_091 possession (Score: 61-47)
Karl Morant attempts a 3Pt. Contested by Jimmy Doncic (5.0 feet, MAN). Karl Morant misses. Rebound secured by Carmelo Beal.

[00:16] Team_052 possession (Score: 61-47)
Carmelo Giddey attempts a 3Pt. Contested by Karl Morant (5.5 feet, ZONE). Carmelo Giddey misses. Rebound secured by Zion Mitchell.

================================================================================
                              2ND QUARTER COMPLETE                              
================================================================================

2ND QUARTER SCORE: Team_052 31, Team_091 31

BOX SCORE:
================================================================================

Team_052
--------------------------------------------------------------------------------
Player                MIN  PTS  REB  AST  TO      FG   FG%      3P   3P%
--------------------------------------------------------------------------------
Carmelo Beal            6   10    3    0   0   4/4   100.0     0/0   0.0
Josh Durant            19    9    0    0   0   4/6    66.7     0/0   0.0
Carmelo Middleton      19    4    3    0   0   2/4    50.0     0/0   0.0
Carmelo Giddey          6    4    0    2   0   1/3    33.3     0/0   0.0
Gary Gasol             19    2    0    0   0   1/1   100.0     0/0   0.0
Jalen Haliburton        6    2    0    0   0   1/3    33.3     0/0   0.0
James Paul             19    0    2    2   0   0/1     0.0     0/0   0.0
Bones Morant           19    0    0    1   0   0/0     0.0     0/0   0.0
Jimmy Doncic            6    0    0    1   0   0/1     0.0     0/0   0.0
Donovan Stewart         6    0    0    0   0   0/1     0.0     0/0   0.0

TEAM: FG: 13/24 (54.2%), 3PT: 2/7 (28.6%), REB: 8 (1 off, 7 def), AST: 6, TO: 0
TEAM FOULS: 6 [Team_091 in BONUS]


Team_091
--------------------------------------------------------------------------------
Player                MIN  PTS  REB  AST  TO      FG   FG%      3P   3P%
--------------------------------------------------------------------------------
Tim Antetokounmpo       6    9    1    1   0   4/4   100.0     0/0   0.0
Kevin Simons           19    7    4    0   0   3/3   100.0     0/0   0.0
Kyrie Rozier           19    3    1    1   0   1/3    33.3     0/0   0.0
D'Angelo Ingram        19    3    0    0   0   2/3    66.7     0/0   0.0
Zion Mitchell           6    3    3    0   0   1/3    33.3     0/0   0.0
Rudy Bridges           19    2    1    0   0   1/2    50.0     0/0   0.0
Julius Barnes           6    2    0    2   0   1/1   100.0     0/0   0.0
Ja George               6    2    2    0   0   1/1   100.0     0/0   0.0
Karl Morant             6    0    0    1   0   0/1     0.0     0/0   0.0

TEAM: FG: 14/21 (66.7%), 3PT: 3/7 (42.9%), REB: 12 (1 off, 11 def), AST: 5, TO: 2
TEAM FOULS: 5 [Team_052 in BONUS]

================================================================================

================================================================================
                       3RD QUARTER - Team_052 vs Team_091                       
================================================================================

[12:00] Team_052 possession (Score: 61-47)
FOUL! Reach-in foul on Kevin Simons during the drive. [Team fouls: 1] No free throws, side out. (Kevin Simons: 1 personal fouls)

[11:45] Team_052 possession (Score: 61-47)
Gary Gasol attempts a Midrange. Contested by Rudy Bridges (4.8 feet, ZONE). Gary Gasol misses. Rebound secured by Rudy Bridges.

[11:33] Team_091 possession (Score: 61-47)
Isaiah Siakam drives, James Paul stays with him. Isaiah Siakam attempts a Layup. Contested by James Paul (3.8 feet, ZONE). ISAIAH SIAKAM MAKES IT!
Score: 61-49

[11:18] Team_052 possession (Score: 61-49)
Josh Durant makes the Layup and draws the foul on Rudy Bridges! And-1! Josh Durant to the line for 1. [Team fouls: 2] (Rudy Bridges: 1 personal fouls)   FT 1/1: GOOD Josh Durant makes 1/1 from the line.
Score: 64-49

[10:59] Team_091 possession (Score: 64-49)
Kevin Simons commits a violation (traveling/carry)! TURNOVER! (dead ball)

[10:45] Team_052 possession (Score: 64-49)
Josh Durant attempts a 3Pt. Contested by Kyrie Rozier (3.9 feet, ZONE). JOSH DURANT MAKES IT! Assist: James Paul
Score: 67-49

[10:34] Team_091 possession (Score: 67-49)
Isaiah Siakam drives, Josh Durant stays with him. Isaiah Siakam attempts a Layup. Contested by Josh Durant (3.6 feet, MAN). ISAIAH SIAKAM MAKES IT!
Score: 67-51

[10:24] Team_052 possession (Score: 67-51)
Gary Gasol drives, Kevin Simons stays with him. Gary Gasol attempts a Dunk. Contested by Kevin Simons (4.0 feet, ZONE). GARY GASOL MAKES IT! Assist: James Paul
Score: 69-51

[10:12] Team_091 possession (Score: 69-51)
D'Angelo Ingram attempts a Midrange. Contested by Bones Morant (4.6 feet, ZONE). D'Angelo Ingram misses. Offensive rebound by Rudy Bridges! Rudy Bridges kicks it out.

[09:56] Team_091 possession (Score: 69-51)
Isaiah Siakam drives, Josh Durant stays with him. Isaiah Siakam attempts a Layup. Contested by Josh Durant (3.6 feet, MAN). ISAIAH SIAKAM MAKES IT! Assist: Kyrie Rozier
Score: 69-53

[09:42] Team_052 possession (Score: 69-53)
Bones Morant attempts a Midrange. Wide open! Isaiah Siakam is 6.1 feet away. [ZONE] Bones Morant misses. Rebound secured by Rudy Bridges.

[09:29] Team_091 possession (Score: 69-53)
FOUL! Holding foul on Gary Gasol. [Team fouls: 1] No free throws, side out. (Gary Gasol: 1 personal fouls)

[09:16] Team_091 possession (Score: 69-53)
D'Angelo Ingram attempts a Midrange. Contested by James Paul (4.4 feet, MAN). D'Angelo Ingram misses. Rebound secured by Bones Morant.

[09:04] Team_052 possession (Score: 69-53)
Josh Durant attempts a 3Pt. Contested by Kyrie Rozier (3.9 feet, ZONE). Josh Durant misses. FOUL! Loose ball foul on Kevin Simons during the rebound battle. [Team fouls: 3] No free throws, side out. (Kevin Simons: 2 personal fouls)

[08:50] Team_052 possession (Score: 69-53)
Josh Durant attempts a 3Pt. Contested by D'Angelo Ingram (4.5 feet, ZONE). Josh Durant misses. Rebound secured by Rudy Bridges.

[08:40] Team_091 possession (Score: 69-53)
Kevin Simons drives and kicks out. Isaiah Siakam attempts a Midrange. Contested by Josh Durant (3.3 feet, MAN). ISAIAH SIAKAM MAKES IT!
Score: 69-55

[08:26] Team_052 possession (Score: 69-55)
Carmelo Middleton attempts a Layup. Contested by Kevin Simons (3.9 feet, ZONE). CARMELO MIDDLETON MAKES IT! Assist: Bones Morant
Score: 71-55

[08:15] Team_091 possession (Score: 71-55)
Rudy Bridges drives and kicks out. FOUL! Shooting foul on Josh Durant. Isaiah Siakam to the line for 2 free throws. [Team fouls: 2] (Josh Durant: 1 personal fouls)   FT 1/2: GOOD   FT 2/2: GOOD Isaiah Siakam makes 2/2 from the line.
Score: 71-57

[08:02] Team_052 possession (Score: 71-57)
James Paul attempts a Layup. Contested by Kevin Simons (3.9 feet, ZONE). JAMES PAUL MAKES IT! Assist: Josh Durant
Score: 73-57

[07:50] Team_091 possession (Score: 73-57)
D'Angelo Ingram attempts a 3Pt. Contested by James Paul (4.4 feet, MAN). D'Angelo Ingram misses. Rebound secured by Carmelo Middleton.

[07:34] Team_052 possession (Score: 73-57)
Gary Gasol attempts a 3Pt. Contested by Kyrie Rozier (4.5 feet, ZONE). GARY GASOL MAKES IT! Assist: James Paul
Score: 76-57

[07:18] Team_091 possession (Score: 76-57)
Kyrie Rozier attempts a 3Pt. BLOCKED BY GARY GASOL! Ball is loose! Rebound secured by Bones Morant.

[07:07] Team_052 possession (Score: 76-57)
James Paul drives and kicks out. Bones Morant attempts a 3Pt. Contested by Kyrie Rozier (4.1 feet, ZONE). Bones Morant misses. Rebound secured by Kyrie Rozier.

[06:49] Team_091 possession (Score: 76-57)
FOUL! Shooting foul on Gary Gasol. Kyrie Rozier to the line for 3 free throws. [Team fouls: 3] (Gary Gasol: 2 personal fouls)   FT 1/3: GOOD   FT 2/3: GOOD   FT 3/3: GOOD Kyrie Rozier makes 3/3 from the line.
Score: 76-60

[06:32] Team_052 possession (Score: 76-60)
Bones Morant attempts a 3Pt. BLOCKED BY RUDY BRIDGES! Ball is loose! Rebound secured by Kyrie Rozier.

[06:16] Team_091 possession (Score: 76-60)
Isaiah Siakam attempts a 3Pt. Contested by Josh Durant (3.6 feet, MAN). Isaiah Siakam misses. Rebound secured by James Paul.

[06:03] Team_052 possession (Score: 76-60)
Gary Gasol attempts a 3Pt. Contested by Kyrie Rozier (4.5 feet, ZONE). Gary Gasol misses. FOUL! Loose ball foul on Kevin Simons during the rebound battle. [Team fouls: 4] No free throws, side out. (Kevin Simons: 3 personal fouls)

[05:46] Team_052 possession (Score: 76-60)
Josh Durant makes the Dunk and draws the foul on Rudy Bridges! And-1! Josh Durant to the line for 1. [BONUS: 5 team fouls] (Rudy Bridges: 2 personal fouls)   FT 1/1: GOOD Josh Durant makes 1/1 from the line.
Score: 79-60

[05:33] Team_091 possession (Score: 79-60)
Kyrie Rozier drives, Gary Gasol stays with him. Kyrie Rozier attempts a Dunk. Contested by Gary Gasol (3.9 feet, MAN). KYRIE ROZIER MAKES IT!
Score: 79-62

[05:21] Team_052 possession (Score: 79-62)
Josh Durant attempts a 3Pt. Contested by Kyrie Rozier (3.9 feet, ZONE). JOSH DURANT MAKES IT! Assist: Carmelo Middleton
Score: 82-62

[05:07] Team_091 possession (Score: 82-62)
Rudy Bridges drives, Bones Morant stays with him. Rudy Bridges attempts a Dunk. Contested by Bones Morant (3.7 feet, MAN). RUDY BRIDGES MAKES IT! Assist: Kyrie Rozier
Score: 82-64

[04:52] Team_052 possession (Score: 82-64)
Gary Gasol attempts a 3Pt. Wide open! Isaiah Siakam is 6.2 feet away. [ZONE] Gary Gasol misses. Rebound secured by Kevin Simons.

[04:34] Team_091 possession (Score: 82-64)
Isaiah Siakam attempts a 3Pt. Contested by Josh Durant (3.7 feet, MAN). Isaiah Siakam misses. Rebound secured by Carmelo Middleton.

[04:19] Team_052 possession (Score: 82-64)
James Paul attempts a Midrange. Contested by D'Angelo Ingram (5.1 feet, MAN). James Paul misses. Offensive rebound by James Paul! James Paul puts it back in!
Score: 84-64

[04:03] Team_091 possession (Score: 84-64)
D'Angelo Ingram drives and kicks out. Kyrie Rozier attempts a 3Pt. Contested by Gary Gasol (3.9 feet, MAN). Kyrie Rozier misses. Rebound secured by Carmelo Middleton.

[03:52] Team_052 possession (Score: 84-64)
Josh Durant attempts a 3Pt. Contested by Kyrie Rozier (4.0 feet, ZONE). Josh Durant misses. Rebound secured by Rudy Bridges.

[03:38] Team_091 possession (Score: 84-64)
Isaiah Siakam attempts a Midrange. Contested by Josh Durant (3.7 feet, ZONE). ISAIAH SIAKAM MAKES IT!
Score: 84-66

[03:20] Team_052 possession (Score: 84-66)
Bones Morant attempts a 3Pt. Contested by Rudy Bridges (4.9 feet, MAN). Bones Morant misses. Rebound secured by Kevin Simons.

[03:05] Team_091 possession (Score: 84-66)
Kevin Simons attempts a 3Pt. Contested by Bones Morant (4.2 feet, ZONE). Kevin Simons misses. Rebound secured by James Paul.

[02:52] Team_052 possession (Score: 84-66)
Josh Durant throws a bad pass out of bounds! TURNOVER! (dead ball)

[02:52] Substitution (Team_052): Carmelo Middleton OUT → Carmelo Beal IN (stamina_rule2)

[02:52] Substitution (Team_091): Isaiah Siakam OUT → Julius Barnes IN (stamina_rule2)

[02:52] Substitution (Team_091): Kevin Simons OUT → Ja George IN (stamina_rule2)

[02:41] Team_091 possession (Score: 84-66)
Julius Barnes drives and kicks out. Rudy Bridges attempts a 3Pt. Contested by Bones Morant (3.9 feet, MAN). Rudy Bridges misses. Rebound secured by Carmelo Beal.

[02:25] Team_052 possession (Score: 84-66)
James Paul attempts a 3Pt. Contested by D'Angelo Ingram (5.3 feet, MAN). James Paul misses. Offensive rebound by James Paul! James Paul's putback is no good. Rebound secured by Rudy Bridges.

[02:13] Team_091 possession (Score: 84-66)
Rudy Bridges attempts a 3Pt. Contested by Bones Morant (4.0 feet, ZONE). Rudy Bridges misses. Offensive rebound by Ja George! Ja George kicks it out.

[01:57] Team_091 possession (Score: 84-66)
FOUL! Shooting foul on Josh Durant. D'Angelo Ingram to the line for 2 free throws. [Team fouls: 4] (Josh Durant: 2 personal fouls)   FT 1/2: GOOD   FT 2/2: MISS D'Angelo Ingram makes 1/2 from the line. Rebound secured by Carmelo Beal.
Score: 84-67

[01:45] Team_052 possession (Score: 84-67)
Josh Durant drives to the basket... Josh Durant loses the ball! Stripped by Julius Barnes! TURNOVER! (live ball)

[01:32] Team_091 possession (Score: 84-67)
Rudy Bridges drives and kicks out. Rudy Bridges attempts a 3Pt. Contested by Bones Morant (4.0 feet, ZONE). Rudy Bridges misses. Rebound secured by Carmelo Beal.

[01:15] Team_052 possession (Score: 84-67)
Josh Durant attempts a 3Pt. Contested by Kyrie Rozier (4.2 feet, ZONE). JOSH DURANT MAKES IT! Assist: Gary Gasol
Score: 87-67

[00:58] Team_091 possession (Score: 87-67)
Ja George drives and kicks out. D'Angelo Ingram attempts a 3Pt. Contested by James Paul (3.9 feet, MAN). D'Angelo Ingram misses. Rebound secured by James Paul.

[00:41] Team_052 possession (Score: 87-67)
James Paul drives and kicks out. James Paul makes the 3Pt and draws the foul on D'Angelo Ingram! And-1! James Paul to the line for 1. [BONUS: 6 team fouls] (D'Angelo Ingram: 1 personal fouls)   FT 1/1: GOOD James Paul makes 1/1 from the line.
Score: 91-67

[00:31] Team_091 possession (Score: 91-67)
Kyrie Rozier drives and kicks out. FOUL! Shooting foul on James Paul. D'Angelo Ingram to the line for 2 free throws. [BONUS: 5 team fouls] (James Paul: 1 personal fouls)   FT 1/2: GOOD   FT 2/2: GOOD D'Angelo Ingram makes 2/2 from the line.
Score: 91-69

[00:18] Team_052 possession (Score: 91-69)
Bones Morant drives, picks up Ja George. Help arrives from Kyrie Rozier! Bones Morant attempts a Dunk. Contested by Kyrie Rozier (5.0 feet, ZONE). BONES MORANT MAKES IT! Assist: Josh Durant
Score: 93-69

[00:04] Team_091 possession (Score: 93-69)
Rudy Bridges drives to the basket... Rudy Bridges loses the ball! Stripped by James Paul! TURNOVER! (live ball)

================================================================================
                              3RD QUARTER COMPLETE                              
================================================================================

3RD QUARTER SCORE: Team_052 32, Team_091 22

BOX SCORE:
================================================================================

Team_052
--------------------------------------------------------------------------------
Player                MIN  PTS  REB  AST  TO      FG   FG%      3P   3P%
--------------------------------------------------------------------------------
Josh Durant            31   15    0    2   0   5/7    71.4     0/0   0.0
James Paul             31    8    6    3   0   3/5    60.0     0/0   0.0
Gary Gasol             31    5    0    1   0   2/4    50.0     0/0   0.0
Bones Morant           31    2    2    1   0   1/4    25.0     0/0   0.0
Carmelo Middleton      28    2    3    1   0   1/1   100.0     0/0   0.0
Carmelo Beal            8    0    3    0   0   0/0     0.0     0/0   0.0

TEAM: FG: 12/21 (57.1%), 3PT: 4/10 (40.0%), REB: 15 (4 off, 11 def), AST: 8, TO: 2
TEAM FOULS: 5 [Team_091 in BONUS]


Team_091
--------------------------------------------------------------------------------
Player                MIN  PTS  REB  AST  TO      FG   FG%      3P   3P%
--------------------------------------------------------------------------------
Isaiah Siakam          28   12    0    0   0   6/8    75.0     0/0   0.0
Kyrie Rozier           31    5    2    2   0   2/3    66.7     0/0   0.0
Rudy Bridges           31    2    6    0   0   1/2    50.0     0/0   0.0
D'Angelo Ingram        31    2    0    0   0   1/5    20.0     0/0   0.0
Kevin Simons           28    0    2    0   0   0/1     0.0     0/0   0.0
Julius Barnes           8    0    0    0   0   0/1     0.0     0/0   0.0
Ja George               8    0    1    0   0   0/1     0.0     0/0   0.0

TEAM: FG: 10/21 (47.6%), 3PT: 1/6 (16.7%), REB: 10 (2 off, 8 def), AST: 2, TO: 2
TEAM FOULS: 6 [Team_052 in BONUS]

================================================================================

================================================================================
                       4TH QUARTER - Team_052 vs Team_091                       
================================================================================

[12:00] Team_052 possession (Score: 93-69)
Bones Morant attempts a 3Pt. Contested by D'Angelo Ingram (5.4 feet, ZONE). Bones Morant misses. Rebound secured by Rudy Bridges.

[11:44] Team_091 possession (Score: 93-69)
D'Angelo Ingram attempts a Layup. Contested by James Paul (4.7 feet, ZONE). D'Angelo Ingram misses. Offensive rebound by Rudy Bridges! Rudy Bridges kicks it out.

[11:29] Team_091 possession (Score: 93-69)
Isaiah Siakam attempts a 3Pt. Contested by Bones Morant (4.3 feet, ZONE). ISAIAH SIAKAM MAKES IT! Assist: Kevin Simons
Score: 93-72

[11:11] Team_052 possession (Score: 93-72)
Josh Durant attempts a Midrange. Contested by Isaiah Siakam (5.5 feet, MAN). Josh Durant misses. Rebound secured by Rudy Bridges.

[10:58] Team_091 possession (Score: 93-72)
Rudy Bridges attempts a Layup. Contested by James Paul (3.9 feet, ZONE). Rudy Bridges misses. Rebound secured by James Paul.

[10:41] Team_052 possession (Score: 93-72)
James Paul attempts a 3Pt. Contested by Kyrie Rozier (4.8 feet, ZONE). JAMES PAUL MAKES IT! Assist: Gary Gasol
Score: 96-72

[10:28] Team_091 possession (Score: 96-72)
Rudy Bridges drives and kicks out. Kevin Simons attempts a 3Pt. Contested by Bones Morant (4.1 feet, ZONE). Kevin Simons misses. Rebound secured by Carmelo Middleton.

[10:15] Team_052 possession (Score: 96-72)
Carmelo Middleton attempts a Layup. Contested by Kevin Simons (4.0 feet, ZONE). Carmelo Middleton misses. Offensive rebound by James Paul! James Paul puts it back in!
Score: 98-72

[10:04] Team_091 possession (Score: 98-72)
Isaiah Siakam attempts a 3Pt. Contested by Josh Durant (4.2 feet, MAN). Isaiah Siakam misses. Rebound secured by Bones Morant.

[09:47] Team_052 possession (Score: 98-72)
James Paul attempts a Midrange. Contested by D'Angelo Ingram (5.5 feet, ZONE). James Paul misses. Rebound secured by Rudy Bridges.

[09:33] Team_091 possession (Score: 98-72)
Rudy Bridges makes the Layup and draws the foul on James Paul! And-1! Rudy Bridges to the line for 1. [Team fouls: 1] (James Paul: 1 personal fouls)   FT 1/1: GOOD Rudy Bridges makes 1/1 from the line.
Score: 98-75

[09:18] Team_052 possession (Score: 98-75)
James Paul throws a bad pass out of bounds! TURNOVER! (dead ball)

[09:18] Substitution (Team_052): Gary Gasol OUT → Jimmy Doncic IN (stamina_rule2)

[09:18] Substitution (Team_052): Josh Durant OUT → Carmelo Giddey IN (stamina_rule2)

[09:18] Substitution (Team_052): Bones Morant OUT → Donovan Stewart IN (stamina_rule2)

[09:18] Substitution (Team_052): James Paul OUT → Jalen Haliburton IN (stamina_rule2)

[09:18] Substitution (Team_091): Kyrie Rozier OUT → Karl Morant IN (stamina_rule2)

[09:18] Substitution (Team_091): Isaiah Siakam OUT → Julius Barnes IN (stamina_rule2)

[09:18] Substitution (Team_091): Rudy Bridges OUT → Tim Antetokounmpo IN (stamina_rule2)

[09:18] Substitution (Team_091): D'Angelo Ingram OUT → Zion Mitchell IN (stamina_rule2)

[09:05] Team_091 possession (Score: 98-75)
Julius Barnes attempts a Midrange. Contested by Carmelo Giddey (4.6 feet, MAN). Julius Barnes misses. Rebound secured by Carmelo Middleton.

[08:51] Team_052 possession (Score: 98-75)
Carmelo Giddey attempts a 3Pt. Contested by Karl Morant (5.5 feet, ZONE). Carmelo Giddey misses. Rebound secured by Tim Antetokounmpo.

[08:39] Team_091 possession (Score: 98-75)
FOUL! Offensive foul on Zion Mitchell! Jalen Haliburton drew the charge! [Team fouls: 1] (Zion Mitchell: 1 personal fouls) TURNOVER! (dead ball)

[08:27] Team_052 possession (Score: 98-75)
FOUL! Holding foul on Karl Morant. [Team fouls: 2] No free throws, side out. (Karl Morant: 1 personal fouls)

[08:14] Team_052 possession (Score: 98-75)
Carmelo Giddey drives and kicks out. Carmelo Giddey attempts a 3Pt. Contested by Karl Morant (4.9 feet, ZONE). Carmelo Giddey misses. Rebound secured by Tim Antetokounmpo.

[08:00] Team_091 possession (Score: 98-75)
Tim Antetokounmpo attempts a Midrange. Contested by Jimmy Doncic (4.9 feet, ZONE). TIM ANTETOKOUNMPO MAKES IT! Assist: Kevin Simons
Score: 98-77

[07:43] Team_052 possession (Score: 98-77)
Jalen Haliburton drives, picks up Zion Mitchell. Help arrives from Karl Morant! Jalen Haliburton attempts a Layup. Contested by Karl Morant (5.1 feet, MAN). JALEN HALIBURTON MAKES IT! Assist: Carmelo Giddey
Score: 100-77

[07:27] Team_091 possession (Score: 100-77)
Tim Antetokounmpo attempts a Midrange. Contested by Carmelo Giddey (4.7 feet, ZONE). TIM ANTETOKOUNMPO MAKES IT! Assist: Zion Mitchell
Score: 100-79

[07:11] Team_052 possession (Score: 100-79)
Jalen Haliburton attempts a Midrange. Contested by Kevin Simons (4.3 feet, ZONE). Jalen Haliburton misses. Rebound secured by Kevin Simons.

[06:53] Team_091 possession (Score: 100-79)
Zion Mitchell attempts a Layup. Contested by Jalen Haliburton (4.7 feet, ZONE). Zion Mitchell misses. Rebound secured by Carmelo Middleton.

[06:35] Team_052 possession (Score: 100-79)
Jimmy Doncic attempts a Midrange. Contested by Karl Morant (4.7 feet, MAN). Jimmy Doncic misses. Offensive rebound by Donovan Stewart! Donovan Stewart kicks it out.

[06:22] Team_052 possession (Score: 100-79)
Donovan Stewart attempts a 3Pt. Contested by Julius Barnes (5.1 feet, ZONE). Donovan Stewart misses. Rebound secured by Kevin Simons.

[06:06] Team_091 possession (Score: 100-79)
Zion Mitchell attempts a 3Pt. Contested by Donovan Stewart (5.0 feet, ZONE). Zion Mitchell misses. Rebound secured by Jalen Haliburton.

[05:55] Team_052 possession (Score: 100-79)
Donovan Stewart attempts a 3Pt. Contested by Tim Antetokounmpo (5.6 feet, MAN). Donovan Stewart misses. Rebound secured by Kevin Simons.

[05:37] Team_091 possession (Score: 100-79)
Kevin Simons drives, picks up Jalen Haliburton. Help arrives from Carmelo Giddey! Kevin Simons attempts a Dunk. Contested by Carmelo Giddey (4.8 feet, ZONE). KEVIN SIMONS MAKES IT! Assist: Karl Morant
Score: 100-81

[05:25] Team_052 possession (Score: 100-81)
Donovan Stewart attempts a 3Pt. Contested by Tim Antetokounmpo (5.6 feet, MAN). Donovan Stewart misses. Rebound secured by Zion Mitchell.

[05:13] Team_091 possession (Score: 100-81)
Tim Antetokounmpo drives, Donovan Stewart stays with him. Tim Antetokounmpo attempts a Layup. Contested by Donovan Stewart (4.9 feet, MAN). TIM ANTETOKOUNMPO MAKES IT! Assist: Kevin Simons
Score: 100-83

[05:01] Team_052 possession (Score: 100-83)
Jimmy Doncic drives to the basket... Jimmy Doncic throws a bad pass! Stolen by Karl Morant! TURNOVER! (live ball)

[04:45] Team_091 possession (Score: 100-83)
FOUL! Holding foul on Jalen Haliburton. [Team fouls: 2] No free throws, side out. (Jalen Haliburton: 1 personal fouls)

[04:34] Team_091 possession (Score: 100-83)
Julius Barnes drives, Carmelo Giddey stays with him. Julius Barnes attempts a Layup. Contested by Carmelo Giddey (4.6 feet, MAN). JULIUS BARNES MAKES IT! Assist: Tim Antetokounmpo
Score: 100-85

[04:23] Team_052 possession (Score: 100-85)
Carmelo Middleton drives to the basket... Carmelo Middleton throws a bad pass out of bounds! TURNOVER! (dead ball)

[04:23] Substitution (Team_052): Carmelo Middleton OUT → Carmelo Beal IN (stamina_rule2)

[04:23] Substitution (Team_091): Kevin Simons OUT → Ja George IN (stamina_rule2)

[04:08] Team_091 possession (Score: 100-85)
Tim Antetokounmpo makes the Midrange and draws the foul on Carmelo Giddey! And-1! Tim Antetokounmpo to the line for 1. [Team fouls: 3] (Carmelo Giddey: 1 personal fouls)   FT 1/1: MISS Tim Antetokounmpo makes 0/1 from the line. FOUL! Loose ball foul on Donovan Stewart during the free throw rebound! [Team fouls: 4] No free throws, side out. (Donovan Stewart: 1 personal fouls)
Score: 100-87

[03:53] Team_091 possession (Score: 100-87)
Tim Antetokounmpo attempts a 3Pt. Contested by Donovan Stewart (4.9 feet, MAN). Tim Antetokounmpo misses. Rebound secured by Jalen Haliburton.

[03:38] Team_052 possession (Score: 100-87)
Jimmy Doncic attempts a 3Pt. Contested by Karl Morant (4.7 feet, ZONE). Jimmy Doncic misses. Rebound secured by Tim Antetokounmpo.

[03:24] Team_091 possession (Score: 100-87)
Tim Antetokounmpo attempts a Layup. Contested by Carmelo Beal (3.6 feet, ZONE). Tim Antetokounmpo misses. Rebound secured by Carmelo Beal.

[03:09] Team_052 possession (Score: 100-87)
Jimmy Doncic attempts a Midrange. Contested by Julius Barnes (4.9 feet, ZONE). JIMMY DONCIC MAKES IT!
Score: 102-87

[02:53] Team_091 possession (Score: 102-87)
Zion Mitchell drives, picks up Carmelo Beal. Help arrives from Carmelo Giddey! Zion Mitchell attempts a Layup. Contested by Carmelo Giddey (3.7 feet, ZONE). ZION MITCHELL MAKES IT! Assist: Karl Morant
Score: 102-89

[02:39] Team_052 possession (Score: 102-89)
Carmelo Beal makes the Midrange and draws the foul on Ja George! And-1! Carmelo Beal to the line for 1. [Team fouls: 3] (Ja George: 1 personal fouls)   FT 1/1: GOOD Carmelo Beal makes 1/1 from the line.
Score: 105-89

[02:19] Team_091 possession (Score: 105-89)
FOUL! Reach-in foul on Jalen Haliburton during the drive. [IN THE BONUS! 5 team fouls] Zion Mitchell to the line for 2 free throws. (Jalen Haliburton: 2 personal fouls)   FT 1/2: GOOD   FT 2/2: GOOD Zion Mitchell makes 2/2 from the line.
Score: 105-91

[02:06] Team_052 possession (Score: 105-91)
Jimmy Doncic attempts a Midrange. Contested by Karl Morant (4.8 feet, MAN). Jimmy Doncic misses. Rebound secured by Zion Mitchell.

[01:52] Team_091 possession (Score: 105-91)
Ja George attempts a Midrange. Contested by Carmelo Beal (3.6 feet, MAN). Ja George misses. Rebound secured by Jalen Haliburton.

[01:36] Team_052 possession (Score: 105-91)
Carmelo Beal attempts a Midrange. Contested by Karl Morant (4.7 feet, ZONE). Carmelo Beal misses. Rebound secured by Tim Antetokounmpo.

[01:22] Team_091 possession (Score: 105-91)
Karl Morant attempts a Midrange. Contested by Jimmy Doncic (5.1 feet, MAN). KARL MORANT MAKES IT!
Score: 105-93

[01:06] Team_052 possession (Score: 105-93)
FOUL! Reach-in foul on Ja George during the drive. [Team fouls: 4] No free throws, side out. (Ja George: 2 personal fouls)

[00:49] Team_052 possession (Score: 105-93)
Carmelo Giddey attempts a 3Pt. Contested by Karl Morant (5.6 feet, ZONE). Carmelo Giddey misses. Rebound secured by Ja George.

[00:33] Team_091 possession (Score: 105-93)
Julius Barnes drives, picks up Carmelo Beal. Help arrives from Carmelo Giddey! Julius Barnes attempts a Layup. Contested by Carmelo Giddey (3.4 feet, ZONE). JULIUS BARNES MAKES IT!
Score: 105-95

[00:17] Team_052 possession (Score: 105-95)
Donovan Stewart attempts a Midrange. Contested by Zion Mitchell (5.2 feet, ZONE). Donovan Stewart misses. Rebound secured by Tim Antetokounmpo.

[00:01] Team_091 possession (Score: 105-95)
Tim Antetokounmpo attempts a Midrange. Contested by Donovan Stewart (5.1 feet, MAN). Tim Antetokounmpo misses. Rebound secured by Jalen Haliburton.

================================================================================
                              4TH QUARTER COMPLETE                              
================================================================================

4TH QUARTER SCORE: Team_052 12, Team_091 26

BOX SCORE:
================================================================================

Team_052
--------------------------------------------------------------------------------
Player                MIN  PTS  REB  AST  TO      FG   FG%      3P   3P%
--------------------------------------------------------------------------------
James Paul             34    5    2    0   0   2/3    66.7     0/0   0.0
Carmelo Beal           13    3    1    0   0   1/2    50.0     0/0   0.0
Jalen Haliburton       15    2    4    0   0   1/2    50.0     0/0   0.0
Jimmy Doncic           15    2    0    0   0   1/3    33.3     0/0   0.0
Bones Morant           34    0    1    0   0   0/1     0.0     0/0   0.0
Josh Durant            34    0    0    0   0   0/1     0.0     0/0   0.0
Gary Gasol             34    0    0    1   0   0/0     0.0     0/0   0.0
Carmelo Middleton      36    0    3    0   0   0/0     0.0     0/0   0.0
Carmelo Giddey         15    0    0    1   0   0/3     0.0     0/0   0.0
Donovan Stewart        15    0    1    0   0   0/4     0.0     0/0   0.0

TEAM: FG: 5/19 (26.3%), 3PT: 1/8 (12.5%), REB: 12 (2 off, 10 def), AST: 2, TO: 3
TEAM FOULS: 5 [Team_091 in BONUS]


Team_091
--------------------------------------------------------------------------------
Player                MIN  PTS  REB  AST  TO      FG   FG%      3P   3P%
--------------------------------------------------------------------------------
Tim Antetokounmpo      15    6    5    1   0   3/6    50.0     0/0   0.0
Julius Barnes          18    4    0    0   0   2/3    66.7     0/0   0.0
Zion Mitchell          15    4    3    1   0   2/4    50.0     0/0   0.0
Rudy Bridges           34    3    4    0   0   1/3    33.3     0/0   0.0
Isaiah Siakam          31    3    0    0   0   1/2    50.0     0/0   0.0
Kevin Simons           36    2    3    3   0   1/1   100.0     0/0   0.0
Karl Morant            15    2    0    2   0   1/1   100.0     0/0   0.0
Ja George              13    0    1    0   0   0/1     0.0     0/0   0.0

TEAM: FG: 11/21 (52.4%), 3PT: 1/4 (25.0%), REB: 16 (2 off, 14 def), AST: 7, TO: 1
TEAM FOULS: 4

================================================================================

================================================================================
                               FULL GAME COMPLETE                               
================================================================================

FINAL SCORE: Team_052 105, Team_091 95

SCORING BY QUARTER:
--------------------------------------------------------------------------------
Team                     Q1     Q2     Q3     Q4    FINAL
--------------------------------------------------------------------------------
Team_052                 30     31     32     12      105
Team_091                 16     31     22     26       95
--------------------------------------------------------------------------------

FULL GAME BOX SCORE:
================================================================================

Team_052
--------------------------------------------------------------------------------
Player                MIN  PTS  REB  AST  TO      FG   FG%      3P   3P%      FT STL BLK
--------------------------------------------------------------------------------
Carmelo Middleton      36    9   15    2   1   6/10   60.0   1/2    50.0   1/1     0   0
Gary Gasol             34    7    0    3   0   3/7    42.9   1/4    25.0   0/0     0   1
Josh Durant            34   33    0    2   3  13/18   72.2   5/8    62.5   4/4     0   0
Bones Morant           34   14    6    3   0   6/10   60.0   2/5    40.0   2/2     0   0
James Paul             34   19   15    7   2   6/12   50.0   1/3    33.3   3/3     1   0
Jimmy Doncic           15    2    0    1   0   1/4    25.0   0/2     0.0   0/0     0   0
Carmelo Giddey         15    4    0    3   1   1/6    16.7   1/4    25.0   1/1     1   0
Donovan Stewart        15    0    1    0   0   0/5     0.0   0/3     0.0   0/0     0   0
Jalen Haliburton       15    4    4    0   1   2/5    40.0   0/1     0.0   0/0     0   0
Carmelo Beal           13   13    7    0   0   5/6    83.3   0/0     0.0   4/4     0   0

TEAM: FG: 43/83 (51.8%), 3PT: 11/32 (34.4%), REB: 49 (9 off, 40 def), AST: 21, TO: 8


Team_091
--------------------------------------------------------------------------------
Player                MIN  PTS  REB  AST  TO      FG   FG%      3P   3P%      FT STL BLK
--------------------------------------------------------------------------------
Kevin Simons           36   17   11    3   2   7/11   63.6   0/1     0.0   3/3     0   0
Kyrie Rozier           34    8    5    3   0   4/9    44.4   2/6    33.3   6/6     1   1
Rudy Bridges           34    9   16    1   0   6/11   54.5   1/2    50.0   1/1     0   1
D'Angelo Ingram        34    9    0    1   2   4/11   36.4   0/2     0.0   4/6     0   0
Isaiah Siakam          31   17    0    0   0   7/14   50.0   1/6    16.7   2/2     1   0
Julius Barnes          18    6    0    2   0   3/5    60.0   0/0     0.0   0/0     1   0
Karl Morant            15    2    0    3   0   1/2    50.0   0/1     0.0   0/0     1   0
Tim Antetokounmpo      15   15    6    2   0   7/10   70.0   1/2    50.0   2/3     0   0
Zion Mitchell          15    7    6    1   1   3/7    42.9   1/3    33.3   2/2     0   0
Ja George              13    2    4    0   1   1/3    33.3   0/0     0.0   0/0     0   0

TEAM: FG: 43/83 (51.8%), 3PT: 6/23 (26.1%), REB: 47 (8 off, 39 def), AST: 16, TO: 6

================================================================================
