================================================================================
                        FULL GAME - Team_050 vs Team_066                        
================================================================================

================================================================================
                       1ST QUARTER - Team_050 vs Team_066                       
================================================================================

[12:00] Team_050 possession (Score: 0-0)
Collin Bane attempts a Midrange. Contested by Kyle Wagner (4.1 feet, ZONE). COLLIN BANE MAKES IT! Assist: LeBron Bridges
Score: 2-0

[11:50] Team_066 possession (Score: 2-0)
Yao Brogdon attempts a 3Pt. Contested by LeBron Bridges (4.6 feet, MAN). Yao Brogdon misses. Rebound secured by Joel Banchero.

[11:37] Team_050 possession (Score: 2-0)
Collin Bane drives and kicks out. Giannis LaVine attempts a Midrange. Contested by Jimmy Davis (3.9 feet, MAN). GIANNIS LAVINE MAKES IT!
Score: 4-0

[11:21] Team_066 possession (Score: 4-0)
Kyle Wagner attempts a Midrange. Contested by Donovan Trent (4.7 feet, MAN). KYLE WAGNER MAKES IT!
Score: 4-2

[11:04] Team_050 possession (Score: 4-2)
Donovan Trent attempts a Midrange. Contested by Brandon Reaves (4.9 feet, ZONE). Donovan Trent misses. Rebound secured by Yao Brogdon.

[10:51] Team_066 possession (Score: 4-2)
Yao Brogdon attempts a Midrange. Contested by LeBron Bridges (4.6 feet, MAN). YAO BROGDON MAKES IT!
Score: 4-4

[10:42] Team_050 possession (Score: 4-4)
FOUL! Reach-in foul on Yao Brogdon during the drive. [Team fouls: 1] No free throws, side out. (Yao Brogdon: 1 personal fouls)

[10:30] Team_050 possession (Score: 4-4)
FOUL! Holding foul on Pau Curry. [Team fouls: 2] No free throws, side out. (Pau Curry: 1 personal fouls)

[10:17] Team_050 possession (Score: 4-4)
LeBron Bridges drives to the basket... FOUL! Offensive foul on LeBron Bridges! Kyle Wagner drew the charge! [Team fouls: 1] (LeBron Bridges: 1 personal fouls) TURNOVER! (dead ball)

[09:59] Team_066 possession (Score: 4-4)
Kyle Wagner attempts a Midrange. Contested by Donovan Trent (4.7 feet, MAN). Kyle Wagner misses. Rebound secured by Collin Bane.

[09:44] Team_050 possession (Score: 4-4)
FOUL! Reach-in foul on Yao Brogdon during the drive. [Team fouls: 3] No free throws, side out. (Yao Brogdon: 2 personal fouls)

[09:27] Team_050 possession (Score: 4-4)
FOUL! Shooting foul on Brandon Reaves. Giannis LaVine to the line for 3 free throws. [Team fouls: 4] (Brandon Reaves: 1 personal fouls)   FT 1/3: GOOD   FT 2/3: GOOD   FT 3/3: GOOD Giannis LaVine makes 3/3 from the line.
Score: 7-4

[09:14] Team_066 possession (Score: 7-4)
FOUL! Offensive foul on Brandon Reaves! Collin Bane drew the charge! [Team fouls: 5] (Brandon Reaves: 2 personal fouls) TURNOVER! (dead ball)

[08:55] Team_050 possession (Score: 7-4)
LeBron Bridges attempts a 3Pt. Contested by Yao Brogdon (5.3 feet, MAN). LeBron Bridges misses. Rebound secured by Brandon Reaves.

[08:38] Team_066 possession (Score: 7-4)
Yao Brogdon attempts a Midrange. Contested by Joel Banchero (4.7 feet, ZONE). YAO BROGDON MAKES IT! Assist: Jimmy Davis
Score: 7-6

[08:21] Team_050 possession (Score: 7-6)
LeBron Bridges attempts a Midrange. Contested by Yao Brogdon (5.3 feet, MAN). LEBRON BRIDGES MAKES IT!
Score: 9-6

[08:09] Team_066 possession (Score: 9-6)
Yao Brogdon attempts a Layup. Contested by LeBron Bridges (4.6 feet, MAN). Yao Brogdon misses. Rebound secured by Joel Banchero.

[07:58] Team_050 possession (Score: 9-6)
Collin Bane attempts a 3Pt. Contested by Pau Curry (5.7 feet, ZONE). Collin Bane misses. Rebound secured by Kyle Wagner.

[07:44] Team_066 possession (Score: 9-6)
Yao Brogdon attempts a Layup. Contested by LeBron Bridges (4.6 feet, MAN). YAO BROGDON MAKES IT!
Score: 9-8

[07:31] Team_050 possession (Score: 9-8)
FOUL! Holding foul on Jimmy Davis. [IN THE BONUS! 6 team fouls] Giannis LaVine to the line for 2 free throws. (Jimmy Davis: 1 personal fouls)   FT 1/2: GOOD   FT 2/2: MISS Giannis LaVine makes 1/2 from the line. Offensive rebound by Collin Bane! Collin Bane kicks it out.
Score: 10-8

[07:15] Team_050 possession (Score: 10-8)
Giannis LaVine makes the Layup and draws the foul on Kyle Wagner! And-1! Giannis LaVine to the line for 1. [BONUS: 7 team fouls] (Kyle Wagner: 1 personal fouls)   FT 1/1: GOOD Giannis LaVine makes 1/1 from the line.
Score: 13-8

[07:03] Team_066 possession (Score: 13-8)
Kyle Wagner drives to the basket... Kyle Wagner loses the ball! Stripped by Donovan Trent! TURNOVER! (live ball)

[06:47] Team_050 possession (Score: 13-8)
Giannis LaVine attempts a 3Pt. Contested by Jimmy Davis (4.4 feet, MAN). Giannis LaVine misses. Rebound secured by Brandon Reaves.

[06:34] Team_066 possession (Score: 13-8)
Pau Curry attempts a 3Pt. Contested by Giannis LaVine (4.1 feet, ZONE). Pau Curry misses. Rebound secured by Collin Bane.

[06:21] Team_050 possession (Score: 13-8)
Joel Banchero makes the Layup and draws the foul on Jimmy Davis! And-1! Joel Banchero to the line for 1. [BONUS: 8 team fouls] (Jimmy Davis: 2 personal fouls)   FT 1/1: GOOD Joel Banchero makes 1/1 from the line.
Score: 16-8

[06:07] Team_066 possession (Score: 16-8)
Yao Brogdon attempts a Layup. Contested by LeBron Bridges (4.6 feet, MAN). Yao Brogdon misses. Rebound secured by Collin Bane.

[05:54] Team_050 possession (Score: 16-8)
Joel Banchero drives and kicks out. Giannis LaVine attempts a 3Pt. Contested by Pau Curry (5.5 feet, ZONE). Giannis LaVine misses. Offensive rebound by Collin Bane! Collin Bane kicks it out.

[05:40] Team_050 possession (Score: 16-8)
LeBron Bridges attempts a 3Pt. Contested by Pau Curry (5.7 feet, ZONE). LeBron Bridges misses. Rebound secured by Kyle Wagner.

[05:28] Team_066 possession (Score: 16-8)
Yao Brogdon attempts a 3Pt. Contested by LeBron Bridges (4.7 feet, MAN). Yao Brogdon misses. Rebound secured by Joel Banchero.

[05:08] Team_050 possession (Score: 16-8)
Donovan Trent drives and kicks out. LeBron Bridges attempts a 3Pt. Contested by Pau Curry (5.5 feet, ZONE). LeBron Bridges misses. Rebound secured by Yao Brogdon.

[04:58] Team_066 possession (Score: 16-8)
Kyle Wagner attempts a Midrange. Contested by Donovan Trent (4.8 feet, MAN). Kyle Wagner misses. Rebound secured by Collin Bane.

[04:43] Team_050 possession (Score: 16-8)
Joel Banchero drives, Pau Curry stays with him. Joel Banchero attempts a Layup. Contested by Pau Curry (5.4 feet, MAN). JOEL BANCHERO MAKES IT! Assist: LeBron Bridges
Score: 18-8

[04:28] Team_066 possession (Score: 18-8)
Pau Curry attempts a Midrange. Contested by Collin Bane (4.4 feet, ZONE). Pau Curry misses. Offensive rebound by Yao Brogdon! Yao Brogdon kicks it out.

[04:11] Team_066 possession (Score: 18-8)
Kyle Wagner drives, Donovan Trent stays with him. Kyle Wagner attempts a Dunk. Contested by Donovan Trent (4.8 feet, ZONE). KYLE WAGNER MAKES IT! Assist: Brandon Reaves
Score: 18-10

[03:55] Team_050 possession (Score: 18-10)
Giannis LaVine makes the 3Pt and draws the foul on Jimmy Davis! And-1! Giannis LaVine to the line for 1. [BONUS: 9 team fouls] (Jimmy Davis: 3 personal fouls)   FT 1/1: GOOD Giannis LaVine makes 1/1 from the line.
Score: 22-10

[03:38] Team_066 possession (Score: 22-10)
Jimmy Davis attempts a 3Pt. Contested by Giannis LaVine (4.5 feet, ZONE). Jimmy Davis misses. Offensive rebound by Kyle Wagner! Kyle Wagner kicks it out.

[03:22] Team_066 possession (Score: 22-10)
Brandon Reaves drives, Donovan Trent stays with him. Brandon Reaves attempts a Layup. Contested by Donovan Trent (5.5 feet, ZONE). BRANDON REAVES MAKES IT! Assist: Jimmy Davis
Score: 22-12

[03:04] Team_050 possession (Score: 22-12)
Joel Banchero makes the 3Pt and draws the foul on Pau Curry! And-1! Joel Banchero to the line for 1. [BONUS: 10 team fouls] (Pau Curry: 2 personal fouls)   FT 1/1: GOOD Joel Banchero makes 1/1 from the line.
Score: 26-12

[02:51] Team_066 possession (Score: 26-12)
Yao Brogdon makes the 3Pt and draws the foul on LeBron Bridges! And-1! Yao Brogdon to the line for 1. [Team fouls: 2] (LeBron Bridges: 2 personal fouls)   FT 1/1: GOOD Yao Brogdon makes 1/1 from the line.
Score: 26-16

[02:40] Team_050 possession (Score: 26-16)
Giannis LaVine drives to the basket... Giannis LaVine throws a bad pass out of bounds! TURNOVER! (dead ball)

[02:40] Substitution (Team_050): Giannis LaVine OUT → Damian O'Neal IN (stamina_rule2)

[02:40] Substitution (Team_050): LeBron Bridges OUT → Luka Gasol IN (stamina_rule2)

[02:40] Substitution (Team_050): Donovan Trent OUT → Tyler Smith IN (stamina_rule2)

[02:40] Substitution (Team_066): Jimmy Davis OUT → Pascal Carter IN (stamina_rule2)

[02:40] Substitution (Team_066): Pau Curry OUT → Lauri LaVine IN (stamina_rule2)

[02:40] Substitution (Team_066): Yao Brogdon OUT → Cole Morant IN (stamina_rule2)

[02:25] Team_066 possession (Score: 26-16)
Pascal Carter drives, Damian O'Neal stays with him. Pascal Carter attempts a Layup. Wide open! Damian O'Neal is 6.5 feet away. [MAN] PASCAL CARTER MAKES IT! Assist: Cole Morant
Score: 26-18

[02:13] Team_050 possession (Score: 26-18)
Collin Bane attempts a 3Pt. Contested by Lauri LaVine (4.0 feet, ZONE). Collin Bane misses. Rebound secured by Lauri LaVine.

[02:00] Team_066 possession (Score: 26-18)
Kyle Wagner attempts a 3Pt. Contested by Joel Banchero (4.4 feet, ZONE). KYLE WAGNER MAKES IT!
Score: 26-21

[01:50] Team_050 possession (Score: 26-21)
Collin Bane attempts a 3Pt. Contested by Brandon Reaves (5.5 feet, MAN). Collin Bane misses. Rebound secured by Kyle Wagner.

[01:37] Team_066 possession (Score: 26-21)
Kyle Wagner attempts a 3Pt. Contested by Joel Banchero (4.5 feet, ZONE). Kyle Wagner misses. Rebound secured by Tyler Smith.

[01:20] Team_050 possession (Score: 26-21)
Tyler Smith attempts a Midrange. Contested by Lauri LaVine (4.3 feet, ZONE). Tyler Smith misses. Rebound secured by Lauri LaVine.

[01:07] Team_066 possession (Score: 26-21)
Brandon Reaves attempts a 3Pt. Contested by Joel Banchero (5.1 feet, ZONE). BRANDON REAVES MAKES IT! Assist: Lauri LaVine
Score: 26-24

[00:51] Team_050 possession (Score: 26-24)
FOUL! Shooting foul on Cole Morant. Collin Bane to the line for 2 free throws. [BONUS: 11 team fouls] (Cole Morant: 1 personal fouls)   FT 1/2: GOOD   FT 2/2: MISS Collin Bane makes 1/2 from the line. FOUL! Loose ball foul on Brandon Reaves during the free throw rebound! [IN THE BONUS! 12 team fouls] Collin Bane to the line for 2 free throws. (Brandon Reaves: 3 personal fouls)   FT 1/2: GOOD   FT 2/2: GOOD Collin Bane makes 2/2 from the line.
Score: 29-24

[00:36] Team_066 possession (Score: 29-24)
Pascal Carter attempts a 3Pt. Wide open! Damian O'Neal is 6.5 feet away. [MAN] PASCAL CARTER MAKES IT!
Score: 29-27

[00:22] Team_050 possession (Score: 29-27)
Collin Bane attempts a 3Pt. Contested by Brandon Reaves (5.7 feet, MAN). Collin Bane misses. Offensive rebound by Tyler Smith! Tyler Smith kicks it out.

[00:09] Team_050 possession (Score: 29-27)
Tyler Smith drives, Kyle Wagner stays with him. Tyler Smith attempts a Layup. Contested by Kyle Wagner (4.9 feet, ZONE). TYLER SMITH MAKES IT!
Score: 31-27

================================================================================
                              1ST QUARTER COMPLETE                              
================================================================================

1ST QUARTER SCORE: Team_050 31, Team_066 27

BOX SCORE:
================================================================================

Team_050
--------------------------------------------------------------------------------
Player                MIN  PTS  REB  AST  TO      FG   FG%      3P   3P%
--------------------------------------------------------------------------------
Giannis LaVine         10   12    0    0   0   4/5    80.0     0/0   0.0
Joel Banchero          12    9    3    0   0   3/3   100.0     0/0   0.0
Collin Bane            12    5    6    0   0   2/5    40.0     0/0   0.0
LeBron Bridges         10    2    0    2   0   1/3    33.3     0/0   0.0
Tyler Smith             3    2    2    0   0   1/2    50.0     0/0   0.0
Donovan Trent          10    0    0    0   0   0/2     0.0     0/0   0.0

TEAM: FG: 11/20 (55.0%), 3PT: 3/9 (33.3%), REB: 11 (3 off, 8 def), AST: 2, TO: 2
TEAM FOULS: 2


Team_066
--------------------------------------------------------------------------------
Player                MIN  PTS  REB  AST  TO      FG   FG%      3P   3P%
--------------------------------------------------------------------------------
Yao Brogdon            10   10    3    0   0   4/8    50.0     0/0   0.0
Kyle Wagner            12    7    4    0   0   3/6    50.0     0/0   0.0
Brandon Reaves         12    5    2    1   0   2/2   100.0     0/0   0.0
Pascal Carter           3    5    0    0   0   2/2   100.0     0/0   0.0
Jimmy Davis            10    0    0    2   0   0/0     0.0     0/0   0.0
Pau Curry              10    0    0    0   0   0/1     0.0     0/0   0.0
Cole Morant             3    0    0    1   0   0/0     0.0     0/0   0.0
Lauri LaVine            3    0    2    1   0   0/0     0.0     0/0   0.0

TEAM: FG: 11/19 (57.9%), 3PT: 4/8 (50.0%), REB: 11 (2 off, 9 def), AST: 5, TO: 2
TEAM FOULS: 12 [Team_050 in BONUS]

================================================================================

================================================================================
                       2ND QUARTER - Team_050 vs Team_066                       
================================================================================

[12:00] Team_050 possession (Score: 31-27)
LeBron Bridges attempts a Midrange. Contested by Yao Brogdon (5.3 feet, MAN). LEBRON BRIDGES MAKES IT!
Score: 33-27

[11:49] Team_066 possession (Score: 33-27)
Kyle Wagner attempts a Midrange. Contested by Joel Banchero (4.4 feet, ZONE). KYLE WAGNER MAKES IT!
Score: 33-29

[11:35] Team_050 possession (Score: 33-29)
Donovan Trent attempts a 3Pt. Contested by Pau Curry (5.3 feet, ZONE). Donovan Trent misses. Rebound secured by Kyle Wagner.

[11:18] Team_066 possession (Score: 33-29)
Brandon Reaves attempts a 3Pt. Contested by Giannis LaVine (4.3 feet, ZONE). Brandon Reaves misses. Rebound secured by LeBron Bridges.

[11:05] Team_050 possession (Score: 33-29)
FOUL! Shooting foul on Yao Brogdon. LeBron Bridges to the line for 2 free throws. [Team fouls: 1] (Yao Brogdon: 1 personal fouls)   FT 1/2: MISS   FT 2/2: GOOD LeBron Bridges makes 1/2 from the line.
Score: 34-29

[10:51] Team_066 possession (Score: 34-29)
FOUL! Shooting foul on Joel Banchero. Pau Curry to the line for 2 free throws. [Team fouls: 1] (Joel Banchero: 1 personal fouls)   FT 1/2: GOOD   FT 2/2: MISS Pau Curry makes 1/2 from the line. FOUL! Loose ball foul on Collin Bane during the free throw rebound! [Team fouls: 2] No free throws, side out. (Collin Bane: 1 personal fouls)
Score: 34-30

[10:36] Team_066 possession (Score: 34-30)
FOUL! Reach-in foul on Donovan Trent during the drive. [Team fouls: 3] No free throws, side out. (Donovan Trent: 1 personal fouls)

[10:21] Team_066 possession (Score: 34-30)
FOUL! Reach-in foul on Donovan Trent during the drive. [Team fouls: 4] No free throws, side out. (Donovan Trent: 2 personal fouls)

[10:08] Team_066 possession (Score: 34-30)
Brandon Reaves attempts a 3Pt. Contested by Giannis LaVine (4.4 feet, ZONE). BRANDON REAVES MAKES IT! Assist: Jimmy Davis
Score: 34-33

[09:54] Team_050 possession (Score: 34-33)
Collin Bane attempts a Layup. Contested by Brandon Reaves (5.7 feet, MAN). Collin Bane misses. Offensive rebound by LeBron Bridges! LeBron Bridges kicks it out.

[09:39] Team_050 possession (Score: 34-33)
LeBron Bridges drives to the basket... LeBron Bridges commits a violation (traveling/carry)! TURNOVER! (dead ball)

[09:39] Substitution (Team_050): Joel Banchero OUT → Dwyane Towns IN (stamina_rule2)

[09:39] Substitution (Team_050): Collin Bane OUT → Larry Curry IN (stamina_rule2)

[09:39] Substitution (Team_050): LeBron Bridges OUT → Luka Gasol IN (stamina_rule2)

[09:39] Substitution (Team_050): Donovan Trent OUT → Tyler Smith IN (stamina_rule2)

[09:39] Substitution (Team_066): Jimmy Davis OUT → Pascal Carter IN (stamina_rule2)

[09:39] Substitution (Team_066): Brandon Reaves OUT → Brandon Middleton IN (stamina_rule2)

[09:39] Substitution (Team_066): Kyle Wagner OUT → Donovan Simmons IN (stamina_rule2)

[09:23] Team_066 possession (Score: 34-33)
Pascal Carter attempts a 3Pt. Contested by Giannis LaVine (4.3 feet, MAN). Pascal Carter misses. Rebound secured by Tyler Smith.

[09:07] Team_050 possession (Score: 34-33)
Tyler Smith attempts a Midrange. Contested by Donovan Simmons (5.3 feet, MAN). Tyler Smith misses. Rebound secured by Brandon Middleton.

[08:50] Team_066 possession (Score: 34-33)
Pascal Carter throws a bad pass! Stolen by Giannis LaVine! TURNOVER! (live ball)

[08:32] Team_050 possession (Score: 34-33)
FOUL! Reach-in foul on Donovan Simmons during the drive. [Team fouls: 2] No free throws, side out. (Donovan Simmons: 1 personal fouls)

[08:16] Team_050 possession (Score: 34-33)
Luka Gasol attempts a Midrange. Contested by Brandon Middleton (5.1 feet, ZONE). LUKA GASOL MAKES IT!
Score: 36-33

[08:06] Team_066 possession (Score: 36-33)
Yao Brogdon drives, picks up Luka Gasol. Help arrives from Dwyane Towns! Yao Brogdon attempts a Dunk. Contested by Dwyane Towns (5.3 feet, MAN). YAO BROGDON MAKES IT! Assist: Donovan Simmons
Score: 36-35

[07:56] Team_050 possession (Score: 36-35)
Tyler Smith attempts a Midrange. Contested by Donovan Simmons (5.3 feet, MAN). Tyler Smith misses. Rebound secured by Donovan Simmons.

[07:37] Team_066 possession (Score: 36-35)
FOUL! Shooting foul on Tyler Smith. Donovan Simmons to the line for 2 free throws. [BONUS: 5 team fouls] (Tyler Smith: 1 personal fouls)   FT 1/2: MISS   FT 2/2: GOOD Donovan Simmons makes 1/2 from the line.
Score: 36-36

[07:20] Team_050 possession (Score: 36-36)
Tyler Smith drives and kicks out. Luka Gasol attempts a Midrange. Contested by Yao Brogdon (5.6 feet, MAN). Luka Gasol misses. Rebound secured by Brandon Middleton.

[07:08] Team_066 possession (Score: 36-36)
FOUL! Holding foul on Giannis LaVine. [IN THE BONUS! 6 team fouls] Pascal Carter to the line for 2 free throws. (Giannis LaVine: 1 personal fouls)   FT 1/2: GOOD   FT 2/2: GOOD Pascal Carter makes 2/2 from the line.
Score: 36-38

[06:54] Team_050 possession (Score: 36-38)
FOUL! Shooting foul on Brandon Middleton. Giannis LaVine to the line for 2 free throws. [Team fouls: 3] (Brandon Middleton: 1 personal fouls)   FT 1/2: MISS   FT 2/2: GOOD Giannis LaVine makes 1/2 from the line.
Score: 37-38

[06:43] Team_066 possession (Score: 37-38)
Pau Curry attempts a 3Pt. Contested by Dwyane Towns (4.5 feet, MAN). Pau Curry misses. Rebound secured by Larry Curry.

[06:25] Team_050 possession (Score: 37-38)
Larry Curry commits a violation (traveling/carry)! TURNOVER! (dead ball)

[06:25] Substitution (Team_050): Giannis LaVine OUT → Damian O'Neal IN (stamina_rule2)

[06:25] Substitution (Team_066): Pau Curry OUT → Lauri LaVine IN (stamina_rule2)

[06:25] Substitution (Team_066): Yao Brogdon OUT → Cole Morant IN (stamina_rule2)

[06:11] Team_066 possession (Score: 37-38)
Donovan Simmons drives and kicks out. Brandon Middleton attempts a 3Pt. Wide open! Damian O'Neal is 6.3 feet away. [ZONE] BRANDON MIDDLETON MAKES IT! Assist: Donovan Simmons
Score: 37-41

[05:56] Team_050 possession (Score: 37-41)
Dwyane Towns drives and kicks out. Dwyane Towns makes the 3Pt and draws the foul on Lauri LaVine! And-1! Dwyane Towns to the line for 1. [Team fouls: 4] (Lauri LaVine: 1 personal fouls)   FT 1/1: GOOD Dwyane Towns makes 1/1 from the line.
Score: 41-41

[05:44] Team_066 possession (Score: 41-41)
Cole Morant attempts a 3Pt. Contested by Luka Gasol (5.5 feet, ZONE). Cole Morant misses. Rebound secured by Larry Curry.

[05:29] Team_050 possession (Score: 41-41)
Dwyane Towns loses control! Ball rolls out of bounds! TURNOVER! (dead ball)

[05:19] Team_066 possession (Score: 41-41)
Cole Morant drives and kicks out. Pascal Carter attempts a 3Pt. Contested by Luka Gasol (4.9 feet, ZONE). Pascal Carter misses. Offensive rebound by Donovan Simmons! Donovan Simmons kicks it out.

[05:04] Team_066 possession (Score: 41-41)
Donovan Simmons attempts a 3Pt. Contested by Tyler Smith (5.2 feet, MAN). Donovan Simmons misses. Rebound secured by Larry Curry.

[04:54] Team_050 possession (Score: 41-41)
Luka Gasol attempts a 3Pt. Contested by Cole Morant (5.5 feet, ZONE). Luka Gasol misses. Rebound secured by Donovan Simmons.

[04:41] Team_066 possession (Score: 41-41)
Donovan Simmons attempts a Layup. Contested by Tyler Smith (5.2 feet, MAN). DONOVAN SIMMONS MAKES IT! Assist: Brandon Middleton
Score: 41-43

[04:25] Team_050 possession (Score: 41-43)
Tyler Smith attempts a 3Pt. Contested by Brandon Middleton (5.5 feet, ZONE). Tyler Smith misses. Rebound secured by Donovan Simmons.

[04:11] Team_066 possession (Score: 41-43)
Lauri LaVine attempts a 3Pt. Contested by Luka Gasol (5.1 feet, ZONE). Lauri LaVine misses. Rebound secured by Tyler Smith.

[03:56] Team_050 possession (Score: 41-43)
FOUL! Holding foul on Brandon Middleton. [IN THE BONUS! 5 team fouls] Larry Curry to the line for 2 free throws. (Brandon Middleton: 2 personal fouls)   FT 1/2: GOOD   FT 2/2: MISS Larry Curry makes 1/2 from the line. Rebound secured by Lauri LaVine.
Score: 42-43

[03:42] Team_066 possession (Score: 42-43)
Pascal Carter attempts a 3Pt. Wide open! Damian O'Neal is 6.4 feet away. [MAN] PASCAL CARTER MAKES IT!
Score: 42-46

[03:29] Team_050 possession (Score: 42-46)
Larry Curry attempts a 3Pt. Contested by Cole Morant (5.6 feet, ZONE). Larry Curry misses. Rebound secured by Lauri LaVine.

[03:17] Team_066 possession (Score: 42-46)
Brandon Middleton attempts a 3Pt. Contested by Larry Curry (4.6 feet, MAN). BRANDON MIDDLETON MAKES IT! Assist: Pascal Carter
Score: 42-49

[03:03] Team_050 possession (Score: 42-49)
Larry Curry attempts a 3Pt. Contested by Lauri LaVine (4.0 feet, ZONE). Larry Curry misses. Rebound secured by Lauri LaVine.

[02:51] Team_066 possession (Score: 42-49)
FOUL! Offensive foul on Donovan Simmons! Tyler Smith drew the charge! [Team fouls: 6] (Donovan Simmons: 2 personal fouls) TURNOVER! (dead ball)

[02:39] Team_050 possession (Score: 42-49)
Dwyane Towns attempts a 3Pt. Contested by Lauri LaVine (4.1 feet, ZONE). Dwyane Towns misses. Rebound secured by Donovan Simmons.

[02:21] Team_066 possession (Score: 42-49)
Brandon Middleton attempts a 3Pt. Contested by Luka Gasol (4.9 feet, ZONE). Brandon Middleton misses. Rebound secured by Larry Curry.

[02:08] Team_050 possession (Score: 42-49)
Tyler Smith attempts a Midrange. Contested by Donovan Simmons (5.3 feet, MAN). Tyler Smith misses. Rebound secured by Donovan Simmons.

[01:48] Team_066 possession (Score: 42-49)
FOUL! Reach-in foul on Luka Gasol during the drive. [IN THE BONUS! 7 team fouls] Cole Morant to the line for 2 free throws. (Luka Gasol: 1 personal fouls)   FT 1/2: GOOD   FT 2/2: GOOD Cole Morant makes 2/2 from the line.
Score: 42-51

[01:35] Team_050 possession (Score: 42-51)
Luka Gasol drives to the basket... Luka Gasol throws a bad pass! Stolen by Cole Morant! TURNOVER! (live ball)

[01:24] Team_066 possession (Score: 42-51)
Donovan Simmons drives, Tyler Smith stays with him. Donovan Simmons attempts a Dunk. Contested by Tyler Smith (5.5 feet, MAN). DONOVAN SIMMONS MAKES IT! Assist: Lauri LaVine
Score: 42-53

[01:10] Team_050 possession (Score: 42-53)
Tyler Smith attempts a Midrange. Contested by Cole Morant (5.8 feet, ZONE). Tyler Smith misses. Rebound secured by Donovan Simmons.

[00:57] Team_066 possession (Score: 42-53)
Brandon Middleton attempts a 3Pt. Contested by Larry Curry (4.8 feet, MAN). Brandon Middleton misses. Rebound secured by Larry Curry.

[00:44] Team_050 possession (Score: 42-53)
FOUL! Shooting foul on Brandon Middleton. Dwyane Towns to the line for 2 free throws. [BONUS: 7 team fouls] (Brandon Middleton: 3 personal fouls)   FT 1/2: GOOD   FT 2/2: MISS Dwyane Towns makes 1/2 from the line. Rebound secured by Donovan Simmons.
Score: 43-53

[00:31] Team_066 possession (Score: 43-53)
Pascal Carter attempts a 3Pt. Contested by Luka Gasol (5.5 feet, ZONE). Pascal Carter misses. Rebound secured by Tyler Smith.

[00:12] Team_050 possession (Score: 43-53)
Dwyane Towns attempts a 3Pt. Contested by Lauri LaVine (4.2 feet, ZONE). DWYANE TOWNS MAKES IT! Assist: Luka Gasol
Score: 46-53

[00:02] Team_066 possession (Score: 46-53)
Lauri LaVine attempts a 3Pt. Contested by Luka Gasol (5.6 feet, ZONE). Lauri LaVine misses. Offensive rebound by Lauri LaVine! Lauri LaVine kicks it out.

================================================================================
                              2ND QUARTER COMPLETE                              
================================================================================

2ND QUARTER SCORE: Team_050 15, Team_066 26

BOX SCORE:
================================================================================

Team_050
--------------------------------------------------------------------------------
Player                MIN  PTS  REB  AST  TO      FG   FG%      3P   3P%
--------------------------------------------------------------------------------
Dwyane Towns           10    7    0    0   0   2/4    50.0     0/0   0.0
LeBron Bridges         12    3    2    0   0   2/2   100.0     0/0   0.0
Luka Gasol             12    2    0    1   0   1/2    50.0     0/0   0.0
Giannis LaVine         15    1    0    0   0   1/1   100.0     0/0   0.0
Donovan Trent          12    0    0    0   0   0/1     0.0     0/0   0.0
Tyler Smith            12    0    3    0   0   0/6     0.0     0/0   0.0
Larry Curry            10    0    5    0   0   0/2     0.0     0/0   0.0

TEAM: FG: 6/19 (31.6%), 3PT: 1/7 (14.3%), REB: 10 (1 off, 9 def), AST: 1, TO: 4
TEAM FOULS: 7 [Team_066 in BONUS]


Team_066
--------------------------------------------------------------------------------
Player                MIN  PTS  REB  AST  TO      FG   FG%      3P   3P%
--------------------------------------------------------------------------------
Brandon Middleton      10    6    2    1   0   2/4    50.0     0/0   0.0
Pascal Carter          12    5    0    1   0   2/4    50.0     0/0   0.0
Donovan Simmons        10    5    8    2   0   3/4    75.0     0/0   0.0
Brandon Reaves         15    3    0    0   0   1/2    50.0     0/0   0.0
Kyle Wagner            15    2    2    0   0   1/1   100.0     0/0   0.0
Yao Brogdon            15    2    0    0   0   1/1   100.0     0/0   0.0
Cole Morant             9    2    0    0   0   1/2    50.0     0/0   0.0
Jimmy Davis            12    0    0    1   0   0/0     0.0     0/0   0.0
Pau Curry              15    0    0    0   0   0/1     0.0     0/0   0.0
Lauri LaVine            9    0    4    1   0   0/1     0.0     0/0   0.0

TEAM: FG: 11/20 (55.0%), 3PT: 3/12 (25.0%), REB: 16 (3 off, 13 def), AST: 6, TO: 2
TEAM FOULS: 7 [Team_050 in BONUS]

================================================================================

================================================================================
                       3RD QUARTER - Team_050 vs Team_066                       
================================================================================

[12:00] Team_050 possession (Score: 46-53)
Giannis LaVine drives to the basket... Giannis LaVine throws a bad pass! Stolen by Jimmy Davis! TURNOVER! (live ball)

[11:45] Team_066 possession (Score: 46-53)
Brandon Reaves attempts a 3Pt. Contested by Collin Bane (4.6 feet, ZONE). Brandon Reaves misses. FOUL! Loose ball foul on LeBron Bridges during the rebound battle. [Team fouls: 1] No free throws, side out. (LeBron Bridges: 1 personal fouls)

[11:30] Team_066 possession (Score: 46-53)
Pau Curry attempts a 3Pt. Contested by Joel Banchero (4.6 feet, MAN). PAU CURRY MAKES IT! Assist: Yao Brogdon
Score: 46-56

[11:19] Team_050 possession (Score: 46-56)
LeBron Bridges attempts a Layup. Contested by Yao Brogdon (5.3 feet, MAN). LeBron Bridges misses. Rebound secured by Kyle Wagner.

[11:05] Team_066 possession (Score: 46-56)
Pau Curry throws a bad pass! Stolen by Joel Banchero! TURNOVER! (live ball)

[10:50] Team_050 possession (Score: 46-56)
FOUL! Holding foul on Kyle Wagner. [Team fouls: 1] No free throws, side out. (Kyle Wagner: 1 personal fouls)

[10:36] Team_050 possession (Score: 46-56)
Giannis LaVine attempts a 3Pt. Contested by Jimmy Davis (4.4 feet, MAN). Giannis LaVine misses. Rebound secured by Yao Brogdon.

[10:18] Team_066 possession (Score: 46-56)
Pau Curry makes the Midrange and draws the foul on Joel Banchero! And-1! Pau Curry to the line for 1. [Team fouls: 2] (Joel Banchero: 1 personal fouls)   FT 1/1: GOOD Pau Curry makes 1/1 from the line.
Score: 46-59

[10:03] Team_050 possession (Score: 46-59)
LeBron Bridges attempts a 3Pt. Contested by Yao Brogdon (5.3 feet, MAN). LeBron Bridges misses. Offensive rebound by LeBron Bridges! LeBron Bridges kicks it out.

[09:48] Team_050 possession (Score: 46-59)
Joel Banchero attempts a 3Pt. Contested by Pau Curry (5.3 feet, MAN). Joel Banchero misses. Rebound secured by Yao Brogdon.

[09:39] Team_066 possession (Score: 46-59)
Kyle Wagner drives, Donovan Trent stays with him. Kyle Wagner attempts a Dunk. Contested by Donovan Trent (4.7 feet, ZONE). Kyle Wagner misses. Rebound secured by Joel Banchero.

[09:24] Team_050 possession (Score: 46-59)
Collin Bane attempts a Layup. BLOCKED BY BRANDON REAVES! Ball is loose! Rebound secured by Yao Brogdon.

[09:10] Team_066 possession (Score: 46-59)
Jimmy Davis attempts a 3Pt. Contested by Giannis LaVine (4.3 feet, MAN). Jimmy Davis misses. Rebound secured by LeBron Bridges.

[08:56] Team_050 possession (Score: 46-59)
Collin Bane drives and kicks out. Collin Bane makes the Midrange and draws the foul on Yao Brogdon! And-1! Collin Bane to the line for 1. [Team fouls: 2] (Yao Brogdon: 1 personal fouls)   FT 1/1: GOOD Collin Bane makes 1/1 from the line.
Score: 49-59

[08:42] Team_066 possession (Score: 49-59)
Pau Curry attempts a 3Pt. Contested by Giannis LaVine (4.1 feet, ZONE). Pau Curry misses. Rebound secured by Collin Bane.

[08:26] Team_050 possession (Score: 49-59)
Joel Banchero attempts a 3Pt. Contested by Pau Curry (5.3 feet, ZONE). JOEL BANCHERO MAKES IT! Assist: Collin Bane
Score: 52-59

[08:11] Team_066 possession (Score: 52-59)
Kyle Wagner attempts a Layup. Contested by Donovan Trent (4.7 feet, ZONE). Kyle Wagner misses. Rebound secured by Joel Banchero.

[07:56] Team_050 possession (Score: 52-59)
Joel Banchero drives, Kyle Wagner stays with him. Joel Banchero attempts a Layup. Contested by Kyle Wagner (3.7 feet, ZONE). Joel Banchero misses. Rebound secured by Kyle Wagner.

[07:40] Team_066 possession (Score: 52-59)
Pau Curry attempts a 3Pt. Contested by Joel Banchero (4.6 feet, ZONE). PAU CURRY MAKES IT! Assist: Jimmy Davis
Score: 52-62

[07:29] Team_050 possession (Score: 52-62)
Collin Bane drives and kicks out. Joel Banchero attempts a 3Pt. Contested by Pau Curry (5.5 feet, ZONE). Joel Banchero misses. Rebound secured by Kyle Wagner.

[07:16] Team_066 possession (Score: 52-62)
Brandon Reaves drives, Collin Bane stays with him. Brandon Reaves attempts a Layup. Contested by Collin Bane (4.6 feet, MAN). Brandon Reaves misses. Rebound secured by Joel Banchero.

[07:01] Team_050 possession (Score: 52-62)
Donovan Trent attempts a Midrange. Contested by Yao Brogdon (4.9 feet, ZONE). Donovan Trent misses. Offensive rebound by LeBron Bridges! LeBron Bridges kicks it out.

[06:48] Team_050 possession (Score: 52-62)
Giannis LaVine attempts a Midrange. Contested by Pau Curry (5.9 feet, ZONE). GIANNIS LAVINE MAKES IT! Assist: Joel Banchero
Score: 54-62

[06:29] Team_066 possession (Score: 54-62)
Jimmy Davis attempts a 3Pt. Contested by Giannis LaVine (4.3 feet, MAN). Jimmy Davis misses. Rebound secured by LeBron Bridges.

[06:14] Team_050 possession (Score: 54-62)
Giannis LaVine throws a bad pass! Stolen by Jimmy Davis! TURNOVER! (live ball)

[05:58] Team_066 possession (Score: 54-62)
Kyle Wagner drives, Donovan Trent stays with him. Kyle Wagner attempts a Layup. Contested by Donovan Trent (4.7 feet, MAN). Kyle Wagner misses. Offensive rebound by Yao Brogdon! Yao Brogdon kicks it out.

[05:46] Team_066 possession (Score: 54-62)
Yao Brogdon drives, Donovan Trent stays with him. Yao Brogdon attempts a Dunk. Contested by Donovan Trent (5.3 feet, ZONE). YAO BROGDON MAKES IT! Assist: Brandon Reaves
Score: 54-64

[05:31] Team_050 possession (Score: 54-64)
Donovan Trent attempts a 3Pt. Contested by Pau Curry (5.3 feet, ZONE). DONOVAN TRENT MAKES IT! Assist: Collin Bane
Score: 57-64

[05:18] Team_066 possession (Score: 57-64)
Brandon Reaves attempts a 3Pt. Contested by Giannis LaVine (4.4 feet, ZONE). Brandon Reaves misses. Offensive rebound by Yao Brogdon! Yao Brogdon kicks it out.

[05:01] Team_066 possession (Score: 57-64)
Brandon Reaves attempts a Layup. Contested by Collin Bane (4.6 feet, MAN). BRANDON REAVES MAKES IT!
Score: 57-66

[04:46] Team_050 possession (Score: 57-66)
Donovan Trent attempts a Midrange. Contested by Kyle Wagner (3.7 feet, MAN). DONOVAN TRENT MAKES IT!
Score: 59-66

[04:34] Team_066 possession (Score: 59-66)
FOUL! Reach-in foul on Donovan Trent during the drive. [Team fouls: 3] No free throws, side out. (Donovan Trent: 1 personal fouls)

[04:20] Team_066 possession (Score: 59-66)
Jimmy Davis attempts a 3Pt. Contested by Giannis LaVine (4.4 feet, ZONE). Jimmy Davis misses. Rebound secured by LeBron Bridges.

[04:05] Team_050 possession (Score: 59-66)
LeBron Bridges drives and kicks out. Joel Banchero attempts a Midrange. Contested by Pau Curry (5.6 feet, MAN). Joel Banchero misses. Rebound secured by Brandon Reaves.

[03:49] Team_066 possession (Score: 59-66)
Pau Curry attempts a Midrange. Contested by Joel Banchero (4.6 feet, ZONE). PAU CURRY MAKES IT!
Score: 59-68

[03:35] Team_050 possession (Score: 59-68)
Joel Banchero drives and kicks out. Joel Banchero attempts a 3Pt. Contested by Pau Curry (5.6 feet, MAN). Joel Banchero misses. Rebound secured by Brandon Reaves.

[03:24] Team_066 possession (Score: 59-68)
Jimmy Davis drives to the basket... Jimmy Davis loses the ball! Stripped by Donovan Trent! TURNOVER! (live ball)

[03:06] Team_050 possession (Score: 59-68)
FOUL! Reach-in foul on Kyle Wagner during the drive. [Team fouls: 3] No free throws, side out. (Kyle Wagner: 2 personal fouls)

[02:56] Team_050 possession (Score: 59-68)
Giannis LaVine attempts a 3Pt. Contested by Jimmy Davis (4.6 feet, MAN). Giannis LaVine misses. Rebound secured by Yao Brogdon.

[02:40] Team_066 possession (Score: 59-68)
Jimmy Davis drives, Donovan Trent stays with him. Jimmy Davis attempts a Dunk. Contested by Donovan Trent (5.5 feet, ZONE). Jimmy Davis misses. Offensive rebound by Kyle Wagner! Kyle Wagner kicks it out.

[02:27] Team_066 possession (Score: 59-68)
FOUL! Reach-in foul on Donovan Trent during the drive. [Team fouls: 4] No free throws, side out. (Donovan Trent: 2 personal fouls)

[02:14] Team_066 possession (Score: 59-68)
Pau Curry attempts a 3Pt. Contested by Giannis LaVine (4.4 feet, ZONE). Pau Curry misses. Rebound secured by Joel Banchero.

[02:00] Team_050 possession (Score: 59-68)
Donovan Trent attempts a Layup. Contested by Kyle Wagner (4.0 feet, ZONE). DONOVAN TRENT MAKES IT! Assist: LeBron Bridges
Score: 61-68

[01:47] Team_066 possession (Score: 61-68)
Kyle Wagner drives, picks up Donovan Trent. Help arrives from Joel Banchero! Kyle Wagner attempts a Layup. Contested by Joel Banchero (5.1 feet, MAN). KYLE WAGNER MAKES IT! Assist: Brandon Reaves
Score: 61-70

[01:31] Team_050 possession (Score: 61-70)
Joel Banchero attempts a Layup. Contested by Kyle Wagner (4.1 feet, ZONE). JOEL BANCHERO MAKES IT!
Score: 63-70

[01:22] Team_066 possession (Score: 63-70)
Jimmy Davis attempts a 3Pt. Contested by Giannis LaVine (4.7 feet, MAN). Jimmy Davis misses. Rebound secured by Collin Bane.

[01:09] Team_050 possession (Score: 63-70)
Donovan Trent drives, Kyle Wagner stays with him. Donovan Trent attempts a Layup. Contested by Kyle Wagner (4.1 feet, MAN). DONOVAN TRENT MAKES IT!
Score: 65-70

[00:57] Team_066 possession (Score: 65-70)
Pau Curry attempts a 3Pt. Contested by Giannis LaVine (4.6 feet, ZONE). Pau Curry misses. Rebound secured by LeBron Bridges.

[00:41] Team_050 possession (Score: 65-70)
Donovan Trent drives to the basket... Donovan Trent throws a bad pass! Stolen by Kyle Wagner! TURNOVER! (live ball)

[00:27] Team_066 possession (Score: 65-70)
FOUL! Reach-in foul on Donovan Trent during the drive. [IN THE BONUS! 5 team fouls] Jimmy Davis to the line for 2 free throws. (Donovan Trent: 3 personal fouls)   FT 1/2: GOOD   FT 2/2: GOOD Jimmy Davis makes 2/2 from the line.
Score: 65-72

[00:09] Team_050 possession (Score: 65-72)
Giannis LaVine makes the Dunk and draws the foul on Kyle Wagner! And-1! Giannis LaVine to the line for 1. [Team fouls: 4] (Kyle Wagner: 3 personal fouls)   FT 1/1: GOOD Giannis LaVine makes 1/1 from the line.
Score: 68-72

================================================================================
                              3RD QUARTER COMPLETE                              
================================================================================

3RD QUARTER SCORE: Team_050 22, Team_066 19

BOX SCORE:
================================================================================

Team_050
--------------------------------------------------------------------------------
Player                MIN  PTS  REB  AST  TO      FG   FG%      3P   3P%
--------------------------------------------------------------------------------
Donovan Trent          24    9    0    0   0   4/4   100.0     0/0   0.0
Giannis LaVine         28    5    0    0   0   2/4    50.0     0/0   0.0
Joel Banchero          27    5    4    1   0   2/5    40.0     0/0   0.0
Collin Bane            27    3    2    2   0   1/3    33.3     0/0   0.0
LeBron Bridges         24    0    6    1   0   0/2     0.0     0/0   0.0

TEAM: FG: 9/18 (50.0%), 3PT: 2/5 (40.0%), REB: 12 (2 off, 10 def), AST: 4, TO: 3
TEAM FOULS: 5 [Team_066 in BONUS]


Team_066
--------------------------------------------------------------------------------
Player                MIN  PTS  REB  AST  TO      FG   FG%      3P   3P%
--------------------------------------------------------------------------------
Pau Curry              28   11    0    0   0   4/7    57.1     0/0   0.0
Yao Brogdon            28    2    7    1   0   1/1   100.0     0/0   0.0
Kyle Wagner            27    2    4    0   0   1/3    33.3     0/0   0.0
Jimmy Davis            24    2    0    1   0   1/5    20.0     0/0   0.0
Brandon Reaves         27    2    2    2   0   1/2    50.0     0/0   0.0

TEAM: FG: 8/18 (44.4%), 3PT: 2/9 (22.2%), REB: 13 (4 off, 9 def), AST: 4, TO: 2
TEAM FOULS: 4

================================================================================

================================================================================
                       4TH QUARTER - Team_050 vs Team_066                       
================================================================================

[12:00] Team_050 possession (Score: 68-72)
Joel Banchero makes the Midrange and draws the foul on Pau Curry! And-1! Joel Banchero to the line for 1. [Team fouls: 1] (Pau Curry: 1 personal fouls)   FT 1/1: GOOD Joel Banchero makes 1/1 from the line.
Score: 71-72

[11:44] Team_066 possession (Score: 71-72)
Kyle Wagner drives, picks up Donovan Trent. Help arrives from Joel Banchero! Kyle Wagner attempts a Layup. Contested by Joel Banchero (5.1 feet, ZONE). Kyle Wagner misses. Rebound secured by Collin Bane.

[11:30] Team_050 possession (Score: 71-72)
Giannis LaVine attempts a 3Pt. Contested by Jimmy Davis (4.8 feet, MAN). Giannis LaVine misses. Rebound secured by Yao Brogdon.

[11:14] Team_066 possession (Score: 71-72)
Kyle Wagner attempts a 3Pt. Contested by Donovan Trent (5.1 feet, MAN). Kyle Wagner misses. Offensive rebound by Kyle Wagner! Kyle Wagner kicks it out.

[11:00] Team_066 possession (Score: 71-72)
Brandon Reaves makes the Midrange and draws the foul on Joel Banchero! And-1! Brandon Reaves to the line for 1. [Team fouls: 1] (Joel Banchero: 1 personal fouls)   FT 1/1: GOOD Brandon Reaves makes 1/1 from the line.
Score: 71-75

[10:47] Team_050 possession (Score: 71-75)
Collin Bane attempts a 3Pt. Wide open! Pau Curry is 6.0 feet away. [ZONE] Collin Bane misses. Rebound secured by Brandon Reaves.

[10:31] Team_066 possession (Score: 71-75)
Yao Brogdon attempts a Midrange. Contested by LeBron Bridges (5.2 feet, MAN). Yao Brogdon misses. Rebound secured by LeBron Bridges.

[10:21] Team_050 possession (Score: 71-75)
FOUL! Holding foul on Jimmy Davis. [Team fouls: 2] No free throws, side out. (Jimmy Davis: 1 personal fouls)

[10:07] Team_050 possession (Score: 71-75)
FOUL! Holding foul on Yao Brogdon. [Team fouls: 3] No free throws, side out. (Yao Brogdon: 1 personal fouls)

[09:50] Team_050 possession (Score: 71-75)
Collin Bane attempts a 3Pt. Wide open! Pau Curry is 6.1 feet away. [ZONE] Collin Bane misses. FOUL! Loose ball foul on Yao Brogdon during the rebound battle. [Team fouls: 4] No free throws, side out. (Yao Brogdon: 2 personal fouls)

[09:39] Team_050 possession (Score: 71-75)
Giannis LaVine throws a bad pass out of bounds! TURNOVER! (dead ball)

[09:39] Substitution (Team_050): Giannis LaVine OUT → Damian O'Neal IN (stamina_rule2)

[09:39] Substitution (Team_050): Joel Banchero OUT → Dwyane Towns IN (stamina_rule2)

[09:39] Substitution (Team_050): Collin Bane OUT → Larry Curry IN (stamina_rule2)

[09:39] Substitution (Team_050): LeBron Bridges OUT → Luka Gasol IN (stamina_rule2)

[09:39] Substitution (Team_050): Donovan Trent OUT → Tyler Smith IN (stamina_rule2)

[09:39] Substitution (Team_066): Jimmy Davis OUT → Pascal Carter IN (stamina_rule2)

[09:39] Substitution (Team_066): Pau Curry OUT → Lauri LaVine IN (stamina_rule2)

[09:39] Substitution (Team_066): Brandon Reaves OUT → Brandon Middleton IN (stamina_rule2)

[09:39] Substitution (Team_066): Yao Brogdon OUT → Cole Morant IN (stamina_rule2)

[09:39] Substitution (Team_066): Kyle Wagner OUT → Donovan Simmons IN (stamina_rule2)

[09:25] Team_066 possession (Score: 71-75)
FOUL! Shooting foul on Luka Gasol. Pascal Carter to the line for 3 free throws. [Team fouls: 2] (Luka Gasol: 1 personal fouls)   FT 1/3: GOOD   FT 2/3: GOOD   FT 3/3: GOOD Pascal Carter makes 3/3 from the line.
Score: 71-78

[09:10] Team_050 possession (Score: 71-78)
Tyler Smith drives and kicks out. FOUL! Shooting foul on Cole Morant. Damian O'Neal to the line for 2 free throws. [BONUS: 5 team fouls] (Cole Morant: 1 personal fouls)   FT 1/2: MISS   FT 2/2: GOOD Damian O'Neal makes 1/2 from the line.
Score: 72-78

[08:58] Team_066 possession (Score: 72-78)
FOUL! Shooting foul on Larry Curry. Brandon Middleton to the line for 2 free throws. [Team fouls: 3] (Larry Curry: 1 personal fouls)   FT 1/2: GOOD   FT 2/2: MISS Brandon Middleton makes 1/2 from the line. Rebound secured by Larry Curry.
Score: 72-79

[08:44] Team_050 possession (Score: 72-79)
FOUL! Holding foul on Cole Morant. [IN THE BONUS! 6 team fouls] Luka Gasol to the line for 2 free throws. (Cole Morant: 2 personal fouls)   FT 1/2: MISS   FT 2/2: GOOD Luka Gasol makes 1/2 from the line.
Score: 73-79

[08:29] Team_066 possession (Score: 73-79)
Cole Morant attempts a Layup. Contested by Luka Gasol (5.5 feet, MAN). COLE MORANT MAKES IT!
Score: 73-81

[08:15] Team_050 possession (Score: 73-81)
Dwyane Towns loses the ball! Stripped by Lauri LaVine! TURNOVER! (live ball)

[08:01] Team_066 possession (Score: 73-81)
Cole Morant attempts a 3Pt. Contested by Luka Gasol (5.5 feet, ZONE). Cole Morant misses. Rebound secured by Larry Curry.

[07:46] Team_050 possession (Score: 73-81)
Damian O'Neal attempts a Midrange. Wide open! Pascal Carter is 6.8 feet away. [MAN] Damian O'Neal misses. Rebound secured by Lauri LaVine.

[07:31] Team_066 possession (Score: 73-81)
Lauri LaVine commits a violation (traveling/carry)! TURNOVER! (dead ball)

[07:18] Team_050 possession (Score: 73-81)
FOUL! Reach-in foul on Donovan Simmons during the drive. [IN THE BONUS! 7 team fouls] Tyler Smith to the line for 2 free throws. (Donovan Simmons: 1 personal fouls)   FT 1/2: GOOD   FT 2/2: GOOD Tyler Smith makes 2/2 from the line.
Score: 75-81

[07:04] Team_066 possession (Score: 75-81)
FOUL! Shooting foul on Larry Curry. Brandon Middleton to the line for 2 free throws. [Team fouls: 4] (Larry Curry: 2 personal fouls)   FT 1/2: GOOD   FT 2/2: MISS Brandon Middleton makes 1/2 from the line. Rebound secured by Dwyane Towns.
Score: 75-82

[06:47] Team_050 possession (Score: 75-82)
Damian O'Neal attempts a Layup. BLOCKED BY DONOVAN SIMMONS! Ball deflects out of bounds off Damian O'Neal.

[06:29] Team_066 possession (Score: 75-82)
Pascal Carter attempts a 3Pt. Contested by Luka Gasol (5.1 feet, ZONE). Pascal Carter misses. Rebound secured by Tyler Smith.

[06:16] Team_050 possession (Score: 75-82)
FOUL! Offensive foul on Dwyane Towns! Lauri LaVine drew the charge! [Team fouls: 5] (Dwyane Towns: 1 personal fouls) TURNOVER! (dead ball)

[06:03] Team_066 possession (Score: 75-82)
Lauri LaVine attempts a 3Pt. Contested by Dwyane Towns (4.4 feet, MAN). LAURI LAVINE MAKES IT! Assist: Donovan Simmons
Score: 75-85

[05:46] Team_050 possession (Score: 75-85)
Larry Curry attempts a Layup. BLOCKED BY DONOVAN SIMMONS! Ball is loose! Offensive rebound by Tyler Smith! Tyler Smith kicks it out.

[05:36] Team_050 possession (Score: 75-85)
Larry Curry attempts a Layup. Contested by Brandon Middleton (5.2 feet, MAN). LARRY CURRY MAKES IT! Assist: Tyler Smith
Score: 77-85

[05:18] Team_066 possession (Score: 77-85)
Donovan Simmons drives and kicks out. Brandon Middleton attempts a 3Pt. Contested by Larry Curry (4.9 feet, MAN). BRANDON MIDDLETON MAKES IT! Assist: Donovan Simmons
Score: 77-88

[04:59] Team_050 possession (Score: 77-88)
Damian O'Neal attempts a Layup. Wide open! Pascal Carter is 6.8 feet away. [MAN] DAMIAN O'NEAL MAKES IT!
Score: 79-88

[04:46] Team_066 possession (Score: 79-88)
Brandon Middleton attempts a Layup. Contested by Larry Curry (4.6 feet, MAN). Brandon Middleton misses. Rebound secured by Tyler Smith.

[04:31] Team_050 possession (Score: 79-88)
Dwyane Towns attempts a 3Pt. Contested by Brandon Middleton (5.3 feet, ZONE). Dwyane Towns misses. Rebound secured by Lauri LaVine.

[04:17] Team_066 possession (Score: 79-88)
Cole Morant drives, Luka Gasol stays with him. Cole Morant attempts a Dunk. Contested by Luka Gasol (5.5 feet, MAN). Cole Morant misses. Rebound secured by Larry Curry.

[04:08] Team_050 possession (Score: 79-88)
Luka Gasol attempts a Midrange. Contested by Cole Morant (5.5 feet, MAN). Luka Gasol misses. Rebound secured by Lauri LaVine.

[03:57] Team_066 possession (Score: 79-88)
Donovan Simmons drives and kicks out. Donovan Simmons attempts a Midrange. Contested by Tyler Smith (5.2 feet, MAN). DONOVAN SIMMONS MAKES IT! Assist: Cole Morant
Score: 79-90

[03:38] Team_050 possession (Score: 79-90)
Luka Gasol attempts a Layup. Contested by Cole Morant (5.5 feet, ZONE). LUKA GASOL MAKES IT!
Score: 81-90

[03:25] Team_066 possession (Score: 81-90)
Cole Morant attempts a Layup. Contested by Tyler Smith (5.7 feet, ZONE). Cole Morant misses. Rebound secured by Tyler Smith.

[03:13] Team_050 possession (Score: 81-90)
FOUL! Holding foul on Donovan Simmons. [IN THE BONUS! 8 team fouls] Tyler Smith to the line for 2 free throws. (Donovan Simmons: 2 personal fouls)   FT 1/2: GOOD   FT 2/2: GOOD Tyler Smith makes 2/2 from the line.
Score: 83-90

[02:57] Team_066 possession (Score: 83-90)
Donovan Simmons drives to the basket... Donovan Simmons throws a bad pass! Stolen by Tyler Smith! TURNOVER! (live ball)

[02:43] Team_050 possession (Score: 83-90)
Tyler Smith attempts a Layup. Contested by Donovan Simmons (5.3 feet, ZONE). Tyler Smith misses. Rebound secured by Lauri LaVine.

[02:30] Team_066 possession (Score: 83-90)
FOUL! Shooting foul on Dwyane Towns. Lauri LaVine to the line for 2 free throws. [BONUS: 6 team fouls] (Dwyane Towns: 2 personal fouls)   FT 1/2: GOOD   FT 2/2: GOOD Lauri LaVine makes 2/2 from the line.
Score: 83-92

[02:15] Team_050 possession (Score: 83-92)
Damian O'Neal attempts a 3Pt. Wide open! Pascal Carter is 6.8 feet away. [MAN] Damian O'Neal misses. Rebound secured by Brandon Middleton.

[02:02] Team_066 possession (Score: 83-92)
Cole Morant attempts a 3Pt. Contested by Luka Gasol (5.5 feet, MAN). Cole Morant misses. Rebound secured by Tyler Smith.

[01:47] Team_050 possession (Score: 83-92)
Luka Gasol attempts a Midrange. Contested by Cole Morant (5.5 feet, MAN). Luka Gasol misses. Rebound secured by Donovan Simmons.

[01:34] Team_066 possession (Score: 83-92)
Donovan Simmons drives and kicks out. Brandon Middleton attempts a 3Pt. Contested by Luka Gasol (5.1 feet, ZONE). Brandon Middleton misses. Offensive rebound by Donovan Simmons! Donovan Simmons kicks it out.

[01:19] Team_066 possession (Score: 83-92)
Lauri LaVine attempts a 3Pt. Contested by Dwyane Towns (4.5 feet, MAN). Lauri LaVine misses. Rebound secured by Tyler Smith.

[01:03] Team_050 possession (Score: 83-92)
Tyler Smith drives, picks up Donovan Simmons. Help arrives from Lauri LaVine! Tyler Smith attempts a Layup. Contested by Lauri LaVine (5.4 feet, ZONE). TYLER SMITH MAKES IT! Assist: Damian O'Neal
Score: 85-92

[00:50] Team_066 possession (Score: 85-92)
Pascal Carter drives to the basket... Pascal Carter throws a bad pass! Stolen by Tyler Smith! TURNOVER! (live ball)

[00:32] Team_050 possession (Score: 85-92)
Luka Gasol drives, picks up Donovan Simmons. Help arrives from Lauri LaVine! Luka Gasol attempts a Layup. Contested by Lauri LaVine (5.1 feet, ZONE). LUKA GASOL MAKES IT! Assist: Dwyane Towns
Score: 87-92

[00:17] Team_066 possession (Score: 87-92)
Donovan Simmons attempts a Layup. Contested by Tyler Smith (5.4 feet, ZONE). Donovan Simmons misses. Rebound secured by Dwyane Towns.

[00:06] Team_050 possession (Score: 87-92)
Tyler Smith attempts a Layup. Contested by Donovan Simmons (5.5 feet, ZONE). TYLER SMITH MAKES IT! Assist: Larry Curry
Score: 89-92

================================================================================
                              4TH QUARTER COMPLETE                              
================================================================================

4TH QUARTER SCORE: Team_050 21, Team_066 20

BOX SCORE:
================================================================================

Team_050
--------------------------------------------------------------------------------
Player                MIN  PTS  REB  AST  TO      FG   FG%      3P   3P%
--------------------------------------------------------------------------------
Tyler Smith            22    8    6    1   0   4/5    80.0     0/0   0.0
Luka Gasol             22    5    0    0   0   3/5    60.0     0/0   0.0
Joel Banchero          29    3    0    0   0   1/1   100.0     0/0   0.0
Damian O'Neal          18    3    0    1   0   2/5    40.0     0/0   0.0
Larry Curry            19    2    3    1   0   1/1   100.0     0/0   0.0
Collin Bane            29    0    1    0   0   0/1     0.0     0/0   0.0
Giannis LaVine         30    0    0    0   0   0/1     0.0     0/0   0.0
LeBron Bridges         27    0    2    0   0   0/0     0.0     0/0   0.0
Dwyane Towns           19    0    2    1   0   0/1     0.0     0/0   0.0

TEAM: FG: 11/20 (55.0%), 3PT: 0/4 (0.0%), REB: 14 (2 off, 12 def), AST: 4, TO: 3
TEAM FOULS: 6 [Team_066 in BONUS]


Team_066
--------------------------------------------------------------------------------
Player                MIN  PTS  REB  AST  TO      FG   FG%      3P   3P%
--------------------------------------------------------------------------------
Lauri LaVine           18    5    4    0   0   2/3    66.7     0/0   0.0
Brandon Reaves         29    3    1    0   0   1/1   100.0     0/0   0.0
Pascal Carter          22    3    0    0   0   1/2    50.0     0/0   0.0
Brandon Middleton      19    3    1    0   0   1/4    25.0     0/0   0.0
Cole Morant            18    2    0    1   0   1/5    20.0     0/0   0.0
Donovan Simmons        19    2    2    2   0   1/2    50.0     0/0   0.0
Kyle Wagner            29    0    1    0   0   0/1     0.0     0/0   0.0
Yao Brogdon            30    0    1    0   0   0/1     0.0     0/0   0.0

TEAM: FG: 7/19 (36.8%), 3PT: 2/6 (33.3%), REB: 10 (2 off, 8 def), AST: 3, TO: 3
TEAM FOULS: 8 [Team_050 in BONUS]

================================================================================

================================================================================
                               FULL GAME COMPLETE                               
================================================================================

FINAL SCORE: Team_050 89, Team_066 92

SCORING BY QUARTER:
--------------------------------------------------------------------------------
Team                     Q1     Q2     Q3     Q4    FINAL
--------------------------------------------------------------------------------
Team_050                 31     15     22     21       89
Team_066                 27     26     19     20       92
--------------------------------------------------------------------------------

FULL GAME BOX SCORE:
================================================================================

Team_050
--------------------------------------------------------------------------------
Player                MIN  PTS  REB  AST  TO      FG   FG%      3P   3P%      FT STL BLK
--------------------------------------------------------------------------------
Giannis LaVine         30   18    0    0   2   6/10   60.0   2/6    33.3   8/10    1   0
Joel Banchero          29   17    7    1   2   6/9    66.7   2/3    66.7   3/3     1   0
Collin Bane            29    8    9    2   1   4/10   40.0   0/4     0.0   2/3     0   0
LeBron Bridges         27    5   10    3   2   3/7    42.9   0/2     0.0   1/2     0   0
Donovan Trent          27    9    0    0   0   4/7    57.1   1/2    50.0   0/0     2   0
Luka Gasol             22    7    0    1   0   3/6    50.0   0/1     0.0   1/2     0   0
Tyler Smith            22   10   11    1   1   5/13   38.5   0/1     0.0   4/4     2   0
Dwyane Towns           19    7    2    1   3   2/5    40.0   1/3    33.3   2/3     0   0
Larry Curry            19    2    8    1   1   1/3    33.3   0/2     0.0   1/2     0   0
Damian O'Neal          18    3    0    1   0   1/4    25.0   0/1     0.0   1/2     0   0

TEAM: FG: 37/77 (48.1%), 3PT: 6/25 (24.0%), REB: 47 (8 off, 39 def), AST: 11, TO: 12


Team_066
--------------------------------------------------------------------------------
Player                MIN  PTS  REB  AST  TO      FG   FG%      3P   3P%      FT STL BLK
--------------------------------------------------------------------------------
Pau Curry              30   11    0    0   1   4/9    44.4   2/7    28.6   2/3     0   0
Yao Brogdon            30   14   11    1   0   6/11   54.5   1/3    33.3   1/1     0   0
Brandon Reaves         29   13    5    3   1   5/7    71.4   2/3    66.7   1/1     0   1
Kyle Wagner            29   11   11    0   0   5/11   45.5   1/2    50.0   0/0     1   0
Jimmy Davis            27    2    0    4   2   1/5    20.0   0/4     0.0   2/2     2   0
Pascal Carter          22   13    0    1   1   4/7    57.1   3/6    50.0   5/5     0   0
Brandon Middleton      19    9    3    1   0   1/6    16.7   1/3    33.3   2/4     0   0
Donovan Simmons        19    7   10    4   1   6/8    75.0   0/1     0.0   1/2     0   2
Lauri LaVine           18    5   10    2   2   2/4    50.0   1/3    33.3   2/2     1   0
Cole Morant            18    4    0    2   1   2/7    28.6   0/3     0.0   2/2     1   0

TEAM: FG: 37/76 (48.7%), 3PT: 11/35 (31.4%), REB: 50 (11 off, 39 def), AST: 18, TO: 9

================================================================================
