================================================================================
                        FULL GAME - Team_090 vs Team_065                        
================================================================================

================================================================================
                       1ST QUARTER - Team_090 vs Team_065                       
================================================================================

[12:00] Team_090 possession (Score: 0-0)
Gary Brogdon attempts a Layup. Contested by Russell Wade (3.3 feet, ZONE). Gary Brogdon misses. Rebound secured by Russell Wade.

[11:50] Team_065 possession (Score: 0-0)
Russell Wade attempts a Midrange. Contested by Gary Brogdon (3.7 feet, MAN). RUSSELL WADE MAKES IT! Assist: Karl Booker
Score: 0-2

[11:36] Team_090 possession (Score: 0-2)
Derrick Mitchell attempts a 3Pt. Contested by RJ Harden (4.2 feet, ZONE). Derrick Mitchell misses. Rebound secured by Manu McGrady.

[11:18] Team_065 possession (Score: 0-2)
Paul Williamson attempts a Layup. BLOCKED BY GARY BROGDON! Ball is loose! Rebound secured by Zach Wall.

[11:03] Team_090 possession (Score: 0-2)
Derrick Mitchell attempts a Midrange. Contested by RJ Harden (4.2 feet, MAN). DERRICK MITCHELL MAKES IT! Assist: Gary Brogdon
Score: 2-2

[10:52] Team_065 possession (Score: 2-2)
Karl Booker makes the Midrange and draws the foul on Tracy Adebayo! And-1! Karl Booker to the line for 1. [Team fouls: 1] (Tracy Adebayo: 1 personal fouls)   FT 1/1: GOOD Karl Booker makes 1/1 from the line.
Score: 2-5

[10:40] Team_090 possession (Score: 2-5)
Tracy Adebayo drives to the basket... FOUL! Offensive foul on Tracy Adebayo! Russell Wade drew the charge! [Team fouls: 2] (Tracy Adebayo: 2 personal fouls) TURNOVER! (dead ball)

[10:25] Team_065 possession (Score: 2-5)
Manu McGrady attempts a 3Pt. Contested by Zach Wall (4.9 feet, MAN). Manu McGrady misses. Rebound secured by Zach Wall.

[10:07] Team_090 possession (Score: 2-5)
FOUL! Shooting foul on Manu McGrady. Zach Wall to the line for 2 free throws. [Team fouls: 1] (Manu McGrady: 1 personal fouls)   FT 1/2: GOOD   FT 2/2: GOOD Zach Wall makes 2/2 from the line.
Score: 4-5

[09:52] Team_065 possession (Score: 4-5)
RJ Harden attempts a 3Pt. Contested by Derrick Mitchell (3.7 feet, ZONE). RJ Harden misses. Rebound secured by Gary Brogdon.

[09:39] Team_090 possession (Score: 4-5)
FOUL! Offensive foul on Derrick Mitchell! RJ Harden drew the charge! [Team fouls: 3] (Derrick Mitchell: 1 personal fouls) TURNOVER! (dead ball)

[09:21] Team_065 possession (Score: 4-5)
Russell Wade attempts a 3Pt. Contested by Gary Brogdon (3.7 feet, MAN). RUSSELL WADE MAKES IT! Assist: Paul Williamson
Score: 4-8

[09:08] Team_090 possession (Score: 4-8)
Derrick Mitchell attempts a Layup. Contested by RJ Harden (4.2 feet, MAN). DERRICK MITCHELL MAKES IT!
Score: 6-8

[08:53] Team_065 possession (Score: 6-8)
Paul Williamson attempts a 3Pt. Contested by Larry Bridges (4.9 feet, MAN). PAUL WILLIAMSON MAKES IT! Assist: Manu McGrady
Score: 6-11

[08:36] Team_090 possession (Score: 6-11)
Zach Wall drives, Russell Wade stays with him. Zach Wall attempts a Dunk. Contested by Russell Wade (3.3 feet, ZONE). ZACH WALL MAKES IT!
Score: 8-11

[08:22] Team_065 possession (Score: 8-11)
Paul Williamson makes the Layup and draws the foul on Gary Brogdon! And-1! Paul Williamson to the line for 1. [Team fouls: 4] (Gary Brogdon: 1 personal fouls)   FT 1/1: GOOD Paul Williamson makes 1/1 from the line.
Score: 8-14

[08:09] Team_090 possession (Score: 8-14)
Zach Wall attempts a 3Pt. Contested by RJ Harden (4.1 feet, ZONE). Zach Wall misses. Rebound secured by Manu McGrady.

[07:53] Team_065 possession (Score: 8-14)
Manu McGrady attempts a 3Pt. Contested by Derrick Mitchell (3.2 feet, ZONE). Manu McGrady misses. Offensive rebound by Manu McGrady! Manu McGrady kicks it out.

[07:37] Team_065 possession (Score: 8-14)
Russell Wade drives and kicks out. RJ Harden attempts a 3Pt. Contested by Derrick Mitchell (3.2 feet, ZONE). RJ Harden misses. Rebound secured by Tracy Adebayo.

[07:21] Team_090 possession (Score: 8-14)
Tracy Adebayo attempts a 3Pt. Contested by Russell Wade (2.9 feet, MAN). Tracy Adebayo misses. Offensive rebound by Gary Brogdon! Gary Brogdon kicks it out.

[07:06] Team_090 possession (Score: 8-14)
Zach Wall attempts a 3Pt. Contested by Manu McGrady (4.8 feet, MAN). ZACH WALL MAKES IT! Assist: Derrick Mitchell
Score: 11-14

[06:53] Team_065 possession (Score: 11-14)
Paul Williamson attempts a 3Pt. Contested by Larry Bridges (4.9 feet, MAN). Paul Williamson misses. Rebound secured by Gary Brogdon.

[06:39] Team_090 possession (Score: 11-14)
Derrick Mitchell attempts a Midrange. Contested by Manu McGrady (4.9 feet, ZONE). Derrick Mitchell misses. Rebound secured by Russell Wade.

[06:24] Team_065 possession (Score: 11-14)
FOUL! Offensive foul on Russell Wade! Gary Brogdon drew the charge! [Team fouls: 2] (Russell Wade: 1 personal fouls) TURNOVER! (dead ball)

[06:05] Team_090 possession (Score: 11-14)
Tracy Adebayo attempts a Midrange. Contested by Russell Wade (2.9 feet, MAN). Tracy Adebayo misses. Rebound secured by RJ Harden.

[05:51] Team_065 possession (Score: 11-14)
Manu McGrady drives, picks up Gary Brogdon. Help arrives from Larry Bridges! Manu McGrady attempts a Dunk. Contested by Larry Bridges (3.6 feet, ZONE). Manu McGrady misses. Rebound secured by Tracy Adebayo.

[05:41] Team_090 possession (Score: 11-14)
Derrick Mitchell attempts a 3Pt. Contested by RJ Harden (4.2 feet, MAN). Derrick Mitchell misses. Rebound secured by RJ Harden.

[05:30] Team_065 possession (Score: 11-14)
Russell Wade drives and kicks out. Karl Booker attempts a 3Pt. Contested by Tracy Adebayo (4.8 feet, MAN). KARL BOOKER MAKES IT! Assist: Paul Williamson
Score: 11-17

[05:13] Team_090 possession (Score: 11-17)
Zach Wall attempts a Midrange. Contested by Manu McGrady (4.8 feet, ZONE). ZACH WALL MAKES IT! Assist: Gary Brogdon
Score: 13-17

[04:59] Team_065 possession (Score: 13-17)
Manu McGrady drives and kicks out. Russell Wade attempts a 3Pt. Contested by Gary Brogdon (3.7 feet, MAN). Russell Wade misses. Rebound secured by Tracy Adebayo.

[04:42] Team_090 possession (Score: 13-17)
Gary Brogdon throws a bad pass out of bounds! TURNOVER! (dead ball)

[04:29] Team_065 possession (Score: 13-17)
Manu McGrady attempts a Layup. Contested by Zach Wall (4.9 feet, MAN). MANU MCGRADY MAKES IT! Assist: RJ Harden
Score: 13-19

[04:14] Team_090 possession (Score: 13-19)
Larry Bridges drives to the basket... FOUL! Offensive foul on Larry Bridges! Russell Wade drew the charge! [Team fouls: 5] (Larry Bridges: 1 personal fouls) TURNOVER! (dead ball)

[03:58] Team_065 possession (Score: 13-19)
FOUL! Reach-in foul on Gary Brogdon during the drive. [IN THE BONUS! 6 team fouls] Karl Booker to the line for 2 free throws. (Gary Brogdon: 2 personal fouls)   FT 1/2: GOOD   FT 2/2: GOOD Karl Booker makes 2/2 from the line.
Score: 13-21

[03:39] Team_090 possession (Score: 13-21)
FOUL! Shooting foul on Russell Wade. Derrick Mitchell to the line for 2 free throws. [Team fouls: 3] (Russell Wade: 2 personal fouls)   FT 1/2: GOOD   FT 2/2: GOOD Derrick Mitchell makes 2/2 from the line.
Score: 15-21

[03:28] Team_065 possession (Score: 15-21)
Karl Booker attempts a Midrange. Contested by Gary Brogdon (3.9 feet, ZONE). Karl Booker misses. Rebound secured by Tracy Adebayo.

[03:09] Team_090 possession (Score: 15-21)
Larry Bridges attempts a Midrange. Contested by Paul Williamson (3.6 feet, MAN). Larry Bridges misses. Rebound secured by RJ Harden.

[02:54] Team_065 possession (Score: 15-21)
Manu McGrady attempts a 3Pt. Contested by Derrick Mitchell (3.3 feet, ZONE). Manu McGrady misses. Rebound secured by Gary Brogdon.

[02:40] Team_090 possession (Score: 15-21)
Gary Brogdon drives, Russell Wade stays with him. Gary Brogdon attempts a Layup. Contested by Russell Wade (3.4 feet, ZONE). Gary Brogdon misses. Offensive rebound by Zach Wall! Zach Wall kicks it out.

[02:25] Team_090 possession (Score: 15-21)
Derrick Mitchell attempts a Layup. Contested by RJ Harden (4.4 feet, MAN). DERRICK MITCHELL MAKES IT! Assist: Zach Wall
Score: 17-21

[02:09] Team_065 possession (Score: 17-21)
FOUL! Shooting foul on Larry Bridges. Russell Wade to the line for 2 free throws. [BONUS: 7 team fouls] (Larry Bridges: 2 personal fouls)   FT 1/2: GOOD   FT 2/2: GOOD Russell Wade makes 2/2 from the line.
Score: 17-23

[01:52] Team_090 possession (Score: 17-23)
FOUL! Shooting foul on Paul Williamson. Tracy Adebayo to the line for 2 free throws. [Team fouls: 4] (Paul Williamson: 1 personal fouls)   FT 1/2: GOOD   FT 2/2: GOOD Tracy Adebayo makes 2/2 from the line.
Score: 19-23

[01:35] Team_065 possession (Score: 19-23)
Russell Wade drives and kicks out. Paul Williamson attempts a 3Pt. Contested by Derrick Mitchell (3.5 feet, ZONE). Paul Williamson misses. Offensive rebound by Russell Wade! Russell Wade puts it back in!
Score: 19-25

[01:24] Team_090 possession (Score: 19-25)
Gary Brogdon attempts a 3Pt. Contested by Russell Wade (3.5 feet, MAN). Gary Brogdon misses. Rebound secured by Manu McGrady.

[01:12] Team_065 possession (Score: 19-25)
Russell Wade attempts a Layup. Contested by Gary Brogdon (4.2 feet, ZONE). RUSSELL WADE MAKES IT!
Score: 19-27

[00:53] Team_090 possession (Score: 19-27)
Derrick Mitchell makes the Layup and draws the foul on RJ Harden! And-1! Derrick Mitchell to the line for 1. [BONUS: 5 team fouls] (RJ Harden: 1 personal fouls)   FT 1/1: GOOD Derrick Mitchell makes 1/1 from the line.
Score: 22-27

[00:40] Team_065 possession (Score: 22-27)
Russell Wade drives, Gary Brogdon stays with him. Russell Wade attempts a Layup. Contested by Gary Brogdon (4.3 feet, ZONE). RUSSELL WADE MAKES IT! Assist: RJ Harden
Score: 22-29

[00:24] Team_090 possession (Score: 22-29)
FOUL! Reach-in foul on RJ Harden during the drive. [IN THE BONUS! 6 team fouls] Derrick Mitchell to the line for 2 free throws. (RJ Harden: 2 personal fouls)   FT 1/2: GOOD   FT 2/2: GOOD Derrick Mitchell makes 2/2 from the line.
Score: 24-29

[00:09] Team_065 possession (Score: 24-29)
Paul Williamson makes the Layup and draws the foul on Larry Bridges! And-1! Paul Williamson to the line for 1. [BONUS: 8 team fouls] (Larry Bridges: 3 personal fouls)   FT 1/1: GOOD Paul Williamson makes 1/1 from the line.
Score: 24-32

================================================================================
                              1ST QUARTER COMPLETE                              
================================================================================

1ST QUARTER SCORE: Team_090 24, Team_065 32

BOX SCORE:
================================================================================

Team_090
--------------------------------------------------------------------------------
Player                MIN  PTS  REB  AST  TO      FG   FG%      3P   3P%
--------------------------------------------------------------------------------
Derrick Mitchell       12   13    0    1   0   6/9    66.7     0/0   0.0
Zach Wall              12    9    3    1   0   4/5    80.0     0/0   0.0
Tracy Adebayo          12    2    4    0   0   1/2    50.0     0/0   0.0
Gary Brogdon           12    0    4    2   0   0/2     0.0     0/0   0.0
Larry Bridges          12    0    0    0   0   0/1     0.0     0/0   0.0

TEAM: FG: 11/19 (57.9%), 3PT: 1/5 (20.0%), REB: 11 (2 off, 9 def), AST: 4, TO: 4
TEAM FOULS: 8 [Team_065 in BONUS]


Team_065
--------------------------------------------------------------------------------
Player                MIN  PTS  REB  AST  TO      FG   FG%      3P   3P%
--------------------------------------------------------------------------------
Russell Wade           12   13    3    0   0   6/7    85.7     0/0   0.0
Paul Williamson        12    9    0    2   0   3/5    60.0     0/0   0.0
Karl Booker            12    8    0    1   0   3/4    75.0     0/0   0.0
Manu McGrady           12    2    4    1   0   1/5    20.0     0/0   0.0
RJ Harden              12    0    3    2   0   0/1     0.0     0/0   0.0

TEAM: FG: 13/22 (59.1%), 3PT: 2/6 (33.3%), REB: 10 (2 off, 8 def), AST: 6, TO: 1
TEAM FOULS: 6 [Team_090 in BONUS]

================================================================================

================================================================================
                       2ND QUARTER - Team_090 vs Team_065                       
================================================================================

[12:00] Team_090 possession (Score: 24-32)
Zach Wall attempts a Layup. Contested by Manu McGrady (5.1 feet, MAN). ZACH WALL MAKES IT!
Score: 26-32

[11:49] Team_065 possession (Score: 26-32)
Manu McGrady drives and kicks out. RJ Harden attempts a Midrange. Contested by Derrick Mitchell (3.5 feet, MAN). RJ Harden misses. Rebound secured by Gary Brogdon.

[11:38] Team_090 possession (Score: 26-32)
Larry Bridges attempts a Midrange. Contested by Paul Williamson (3.7 feet, MAN). LARRY BRIDGES MAKES IT! Assist: Gary Brogdon
Score: 28-32

[11:24] Team_065 possession (Score: 28-32)
Karl Booker makes the Layup and draws the foul on Tracy Adebayo! And-1! Karl Booker to the line for 1. [Team fouls: 1] (Tracy Adebayo: 1 personal fouls)   FT 1/1: GOOD Karl Booker makes 1/1 from the line.
Score: 28-35

[11:09] Team_090 possession (Score: 28-35)
FOUL! Offensive foul on Tracy Adebayo! Russell Wade drew the charge! [Team fouls: 2] (Tracy Adebayo: 2 personal fouls) TURNOVER! (dead ball)

[10:56] Team_065 possession (Score: 28-35)
Russell Wade attempts a 3Pt. Contested by Gary Brogdon (4.3 feet, MAN). Russell Wade misses. Rebound secured by Tracy Adebayo.

[10:41] Team_090 possession (Score: 28-35)
Derrick Mitchell drives, RJ Harden stays with him. Derrick Mitchell attempts a Dunk. Contested by RJ Harden (4.5 feet, MAN). DERRICK MITCHELL MAKES IT!
Score: 30-35

[10:25] Team_065 possession (Score: 30-35)
Karl Booker makes the Dunk and draws the foul on Larry Bridges! And-1! Karl Booker to the line for 1. [Team fouls: 3] (Larry Bridges: 1 personal fouls)   FT 1/1: GOOD Karl Booker makes 1/1 from the line.
Score: 30-38

[10:12] Team_090 possession (Score: 30-38)
Tracy Adebayo drives to the basket... Tracy Adebayo loses the ball! Stripped by Russell Wade! TURNOVER! (live ball)

[09:58] Team_065 possession (Score: 30-38)
Manu McGrady attempts a 3Pt. Contested by Derrick Mitchell (3.6 feet, ZONE). Manu McGrady misses. Rebound secured by Tracy Adebayo.

[09:42] Team_090 possession (Score: 30-38)
Derrick Mitchell attempts a Layup. Contested by RJ Harden (4.7 feet, MAN). DERRICK MITCHELL MAKES IT! Assist: Zach Wall
Score: 32-38

[09:27] Team_065 possession (Score: 32-38)
Paul Williamson attempts a 3Pt. Contested by Derrick Mitchell (3.8 feet, ZONE). Paul Williamson misses. Rebound secured by Gary Brogdon.

[09:17] Team_090 possession (Score: 32-38)
Larry Bridges attempts a Layup. Contested by Russell Wade (3.7 feet, ZONE). LARRY BRIDGES MAKES IT! Assist: Tracy Adebayo
Score: 34-38

[09:04] Team_065 possession (Score: 34-38)
Paul Williamson attempts a 3Pt. Contested by Derrick Mitchell (3.9 feet, ZONE). Paul Williamson misses. Rebound secured by Gary Brogdon.

[08:49] Team_090 possession (Score: 34-38)
Tracy Adebayo attempts a Midrange. Contested by Paul Williamson (3.9 feet, ZONE). Tracy Adebayo misses. Rebound secured by Manu McGrady.

[08:34] Team_065 possession (Score: 34-38)
RJ Harden attempts a Midrange. Contested by Derrick Mitchell (4.2 feet, MAN). RJ HARDEN MAKES IT! Assist: Russell Wade
Score: 34-40

[08:15] Team_090 possession (Score: 34-40)
Zach Wall attempts a 3Pt. Contested by Manu McGrady (5.5 feet, MAN). Zach Wall misses. Rebound secured by Manu McGrady.

[08:00] Team_065 possession (Score: 34-40)
Russell Wade attempts a 3Pt. Contested by Derrick Mitchell (3.9 feet, ZONE). Russell Wade misses. Rebound secured by Zach Wall.

[07:41] Team_090 possession (Score: 34-40)
Larry Bridges throws a bad pass! Stolen by Paul Williamson! TURNOVER! (live ball)

[07:23] Team_065 possession (Score: 34-40)
Paul Williamson attempts a Layup. Contested by Larry Bridges (5.5 feet, MAN). PAUL WILLIAMSON MAKES IT! Assist: Karl Booker
Score: 34-42

[07:06] Team_090 possession (Score: 34-42)
Zach Wall attempts a 3Pt. Contested by RJ Harden (4.9 feet, ZONE). ZACH WALL MAKES IT! Assist: Derrick Mitchell
Score: 37-42

[06:49] Team_065 possession (Score: 37-42)
Russell Wade drives, Gary Brogdon stays with him. Russell Wade attempts a Dunk. Contested by Gary Brogdon (5.0 feet, MAN). RUSSELL WADE MAKES IT! Assist: Manu McGrady
Score: 37-44

[06:35] Team_090 possession (Score: 37-44)
Gary Brogdon attempts a 3Pt. Contested by Russell Wade (4.1 feet, MAN). Gary Brogdon misses. Rebound secured by Manu McGrady.

[06:21] Team_065 possession (Score: 37-44)
Russell Wade attempts a Layup. Contested by Gary Brogdon (5.0 feet, ZONE). RUSSELL WADE MAKES IT!
Score: 37-46

[06:04] Team_090 possession (Score: 37-46)
Derrick Mitchell attempts a Midrange. Contested by RJ Harden (5.1 feet, MAN). Derrick Mitchell misses. Rebound secured by Manu McGrady.

[05:50] Team_065 possession (Score: 37-46)
FOUL! Holding foul on Zach Wall. [Team fouls: 4] No free throws, side out. (Zach Wall: 1 personal fouls)

[05:36] Team_065 possession (Score: 37-46)
RJ Harden attempts a 3Pt. Contested by Derrick Mitchell (4.5 feet, MAN). RJ HARDEN MAKES IT! Assist: Karl Booker
Score: 37-49

[05:24] Team_090 possession (Score: 37-49)
Derrick Mitchell attempts a 3Pt. Contested by RJ Harden (5.2 feet, MAN). Derrick Mitchell misses. Rebound secured by RJ Harden.

[05:11] Team_065 possession (Score: 37-49)
Paul Williamson attempts a 3Pt. Contested by Derrick Mitchell (4.3 feet, ZONE). PAUL WILLIAMSON MAKES IT! Assist: Russell Wade
Score: 37-52

[04:56] Team_090 possession (Score: 37-52)
Derrick Mitchell attempts a Layup. Contested by RJ Harden (5.2 feet, MAN). DERRICK MITCHELL MAKES IT! Assist: Tracy Adebayo
Score: 39-52

[04:40] Team_065 possession (Score: 39-52)
Paul Williamson throws a bad pass! Stolen by Larry Bridges! TURNOVER! (live ball)

[04:30] Team_090 possession (Score: 39-52)
Derrick Mitchell attempts a Midrange. Contested by Manu McGrady (5.9 feet, ZONE). Derrick Mitchell misses. Rebound secured by Russell Wade.

[04:20] Team_065 possession (Score: 39-52)
Russell Wade attempts a Midrange. Contested by Gary Brogdon (5.4 feet, MAN). Russell Wade misses. Offensive rebound by Russell Wade! Russell Wade kicks it out.

[04:08] Team_065 possession (Score: 39-52)
Paul Williamson attempts a 3Pt. Contested by Derrick Mitchell (4.5 feet, ZONE). Paul Williamson misses. Rebound secured by Larry Bridges.

[03:51] Team_090 possession (Score: 39-52)
Zach Wall attempts a Midrange. Contested by Manu McGrady (6.0 feet, MAN). Zach Wall misses. Rebound secured by RJ Harden.

[03:41] Team_065 possession (Score: 39-52)
RJ Harden attempts a Midrange. Contested by Derrick Mitchell (4.8 feet, MAN). RJ Harden misses. Offensive rebound by Russell Wade! Russell Wade kicks it out.

[03:26] Team_065 possession (Score: 39-52)
Russell Wade commits a violation (traveling/carry)! TURNOVER! (dead ball)

[03:26] Substitution (Team_090): Derrick Mitchell OUT → OG Anunoby IN (stamina_rule2)

[03:26] Substitution (Team_090): Larry Bridges OUT → Josh Wall IN (stamina_rule2)

[03:26] Substitution (Team_090): Zach Wall OUT → Russell Smith IN (stamina_rule2)

[03:26] Substitution (Team_090): Gary Brogdon OUT → Derrick Nowitzki IN (stamina_rule2)

[03:26] Substitution (Team_090): Tracy Adebayo OUT → Tobias Tatum IN (stamina_rule2)

[03:26] Substitution (Team_065): RJ Harden OUT → Paul Curry IN (stamina_rule2)

[03:26] Substitution (Team_065): Paul Williamson OUT → Derrick Poole IN (stamina_rule2)

[03:26] Substitution (Team_065): Manu McGrady OUT → D'Angelo Porzingis IN (stamina_rule2)

[03:26] Substitution (Team_065): Russell Wade OUT → Karl Leonard IN (stamina_rule2)

[03:26] Substitution (Team_065): Karl Booker OUT → Vince Mobley IN (stamina_rule2)

[03:14] Team_090 possession (Score: 39-52)
Russell Smith attempts a 3Pt. Contested by D'Angelo Porzingis (4.6 feet, MAN). Russell Smith misses. Rebound secured by Vince Mobley.

[02:58] Team_065 possession (Score: 39-52)
D'Angelo Porzingis drives, Russell Smith stays with him. D'Angelo Porzingis attempts a Layup. Contested by Russell Smith (4.5 feet, MAN). D'ANGELO PORZINGIS MAKES IT!
Score: 39-54

[02:44] Team_090 possession (Score: 39-54)
Tobias Tatum drives, Vince Mobley stays with him. Tobias Tatum attempts a Dunk. Contested by Vince Mobley (4.9 feet, MAN). Tobias Tatum misses. Rebound secured by D'Angelo Porzingis.

[02:34] Team_065 possession (Score: 39-54)
D'Angelo Porzingis attempts a Midrange. Contested by Russell Smith (4.5 feet, MAN). D'Angelo Porzingis misses. Rebound secured by Derrick Nowitzki.

[02:19] Team_090 possession (Score: 39-54)
Derrick Nowitzki attempts a 3Pt. Contested by Paul Curry (4.5 feet, ZONE). Derrick Nowitzki misses. Rebound secured by D'Angelo Porzingis.

[02:01] Team_065 possession (Score: 39-54)
Karl Leonard attempts a 3Pt. Contested by Derrick Nowitzki (4.7 feet, MAN). Karl Leonard misses. Rebound secured by Russell Smith.

[01:51] Team_090 possession (Score: 39-54)
Derrick Nowitzki drives to the basket... FOUL! Offensive foul on Derrick Nowitzki! Karl Leonard drew the charge! [Team fouls: 5] (Derrick Nowitzki: 1 personal fouls) TURNOVER! (dead ball)

[01:36] Team_065 possession (Score: 39-54)
Derrick Poole attempts a 3Pt. Contested by Russell Smith (4.4 feet, ZONE). DERRICK POOLE MAKES IT! Assist: Karl Leonard
Score: 39-57

[01:21] Team_090 possession (Score: 39-57)
Josh Wall drives and kicks out. Russell Smith attempts a 3Pt. Contested by D'Angelo Porzingis (4.3 feet, MAN). Russell Smith misses. FOUL! Loose ball foul on Vince Mobley during the rebound battle. [Team fouls: 1] No free throws, side out. (Vince Mobley: 1 personal fouls)

[01:10] Team_090 possession (Score: 39-57)
Tobias Tatum drives to the basket... FOUL! Offensive foul on Tobias Tatum! Vince Mobley drew the charge! [Team fouls: 6] (Tobias Tatum: 1 personal fouls) TURNOVER! (dead ball)

[00:53] Team_065 possession (Score: 39-57)
Derrick Poole attempts a 3Pt. Contested by Josh Wall (4.2 feet, ZONE). Derrick Poole misses. Rebound secured by Tobias Tatum.

[00:41] Team_090 possession (Score: 39-57)
Derrick Nowitzki makes the Dunk and draws the foul on Vince Mobley! And-1! Derrick Nowitzki to the line for 1. [Team fouls: 2] (Vince Mobley: 2 personal fouls)   FT 1/1: GOOD Derrick Nowitzki makes 1/1 from the line.
Score: 42-57

[00:26] Team_065 possession (Score: 42-57)
Vince Mobley attempts a Midrange. Contested by Russell Smith (4.3 feet, ZONE). Vince Mobley misses. Offensive rebound by D'Angelo Porzingis! D'Angelo Porzingis kicks it out.

[00:10] Team_065 possession (Score: 42-57)
Vince Mobley drives, picks up Tobias Tatum. Help arrives from Josh Wall! Vince Mobley attempts a Layup. Contested by Josh Wall (4.6 feet, MAN). VINCE MOBLEY MAKES IT! Assist: Paul Curry
Score: 42-59

================================================================================
                              2ND QUARTER COMPLETE                              
================================================================================

2ND QUARTER SCORE: Team_090 18, Team_065 27

BOX SCORE:
================================================================================

Team_090
--------------------------------------------------------------------------------
Player                MIN  PTS  REB  AST  TO      FG   FG%      3P   3P%
--------------------------------------------------------------------------------
Derrick Mitchell       21    6    0    1   0   3/6    50.0     0/0   0.0
Zach Wall              21    5    1    1   0   2/4    50.0     0/0   0.0
Larry Bridges          21    4    1    0   0   2/2   100.0     0/0   0.0
Derrick Nowitzki        3    3    1    0   0   1/2    50.0     0/0   0.0
Gary Brogdon           21    0    3    1   0   0/1     0.0     0/0   0.0
Tracy Adebayo          21    0    2    2   0   0/1     0.0     0/0   0.0
Russell Smith           3    0    1    0   0   0/1     0.0     0/0   0.0
Tobias Tatum            3    0    2    0   0   0/1     0.0     0/0   0.0

TEAM: FG: 8/18 (44.4%), 3PT: 1/6 (16.7%), REB: 11 (1 off, 10 def), AST: 5, TO: 5
TEAM FOULS: 6 [Team_065 in BONUS]


Team_065
--------------------------------------------------------------------------------
Player                MIN  PTS  REB  AST  TO      FG   FG%      3P   3P%
--------------------------------------------------------------------------------
Karl Booker            21    6    0    2   0   2/2   100.0     0/0   0.0
Paul Williamson        21    5    0    0   0   2/5    40.0     0/0   0.0
RJ Harden              21    5    2    0   0   2/2   100.0     0/0   0.0
Russell Wade           21    4    3    2   0   2/4    50.0     0/0   0.0
Derrick Poole           3    3    0    0   0   1/2    50.0     0/0   0.0
Vince Mobley            3    2    1    0   0   1/1   100.0     0/0   0.0
D'Angelo Porzingis      3    2    3    0   0   1/2    50.0     0/0   0.0
Manu McGrady           21    0    4    1   0   0/2     0.0     0/0   0.0
Karl Leonard            3    0    0    1   0   0/1     0.0     0/0   0.0
Paul Curry              3    0    0    1   0   0/0     0.0     0/0   0.0

TEAM: FG: 11/21 (52.4%), 3PT: 3/11 (27.3%), REB: 13 (3 off, 10 def), AST: 7, TO: 2
TEAM FOULS: 2

================================================================================

================================================================================
                       3RD QUARTER - Team_090 vs Team_065                       
================================================================================

[12:00] Team_090 possession (Score: 42-59)
FOUL! Shooting foul on Paul Williamson. Zach Wall to the line for 2 free throws. [Team fouls: 1] (Paul Williamson: 1 personal fouls)   FT 1/2: GOOD   FT 2/2: GOOD Zach Wall makes 2/2 from the line.
Score: 44-59

[11:49] Team_065 possession (Score: 44-59)
Manu McGrady drives, Zach Wall stays with him. Manu McGrady attempts a Dunk. Contested by Zach Wall (4.9 feet, MAN). MANU MCGRADY MAKES IT! Assist: RJ Harden
Score: 44-61

[11:34] Team_090 possession (Score: 44-61)
Derrick Mitchell attempts a 3Pt. Contested by RJ Harden (4.2 feet, ZONE). Derrick Mitchell misses. Offensive rebound by Gary Brogdon! Gary Brogdon kicks it out.

[11:16] Team_090 possession (Score: 44-61)
FOUL! Shooting foul on Russell Wade. Derrick Mitchell to the line for 2 free throws. [Team fouls: 2] (Russell Wade: 1 personal fouls)   FT 1/2: GOOD   FT 2/2: GOOD Derrick Mitchell makes 2/2 from the line.
Score: 46-61

[11:03] Team_065 possession (Score: 46-61)
RJ Harden attempts a 3Pt. Contested by Derrick Mitchell (3.7 feet, ZONE). RJ Harden misses. Rebound secured by Tracy Adebayo.

[10:53] Team_090 possession (Score: 46-61)
Derrick Mitchell attempts a Midrange. Contested by RJ Harden (4.2 feet, ZONE). DERRICK MITCHELL MAKES IT! Assist: Larry Bridges
Score: 48-61

[10:42] Team_065 possession (Score: 48-61)
RJ Harden makes the 3Pt and draws the foul on Derrick Mitchell! And-1! RJ Harden to the line for 1. [Team fouls: 1] (Derrick Mitchell: 1 personal fouls)   FT 1/1: GOOD RJ Harden makes 1/1 from the line.
Score: 48-65

[10:31] Team_090 possession (Score: 48-65)
FOUL! Reach-in foul on Russell Wade during the drive. [Team fouls: 3] No free throws, side out. (Russell Wade: 2 personal fouls)

[10:17] Team_090 possession (Score: 48-65)
Derrick Mitchell attempts a 3Pt. Contested by RJ Harden (4.2 feet, ZONE). Derrick Mitchell misses. FOUL! Loose ball foul on RJ Harden during the rebound battle. [Team fouls: 4] No free throws, side out. (RJ Harden: 1 personal fouls)

[10:03] Team_090 possession (Score: 48-65)
FOUL! Shooting foul on RJ Harden. Larry Bridges to the line for 3 free throws. [BONUS: 5 team fouls] (RJ Harden: 2 personal fouls)   FT 1/3: GOOD   FT 2/3: GOOD   FT 3/3: MISS Larry Bridges makes 2/3 from the line. Rebound secured by Manu McGrady.
Score: 50-65

[09:45] Team_065 possession (Score: 50-65)
Manu McGrady drives to the basket... Manu McGrady throws a bad pass! Stolen by Zach Wall! TURNOVER! (live ball)

[09:33] Team_090 possession (Score: 50-65)
Tracy Adebayo throws a bad pass out of bounds! TURNOVER! (dead ball)

[09:21] Team_065 possession (Score: 50-65)
Paul Williamson makes the 3Pt and draws the foul on Zach Wall! And-1! Paul Williamson to the line for 1. [Team fouls: 2] (Zach Wall: 1 personal fouls)   FT 1/1: GOOD Paul Williamson makes 1/1 from the line.
Score: 50-69

[09:06] Team_090 possession (Score: 50-69)
Zach Wall attempts a 3Pt. Contested by Manu McGrady (4.8 feet, MAN). Zach Wall misses. Rebound secured by Manu McGrady.

[08:52] Team_065 possession (Score: 50-69)
Manu McGrady makes the Midrange and draws the foul on Zach Wall! And-1! Manu McGrady to the line for 1. [Team fouls: 3] (Zach Wall: 2 personal fouls)   FT 1/1: GOOD Manu McGrady makes 1/1 from the line.
Score: 50-72

[08:37] Team_090 possession (Score: 50-72)
Tracy Adebayo makes the Layup and draws the foul on Russell Wade! And-1! Tracy Adebayo to the line for 1. [BONUS: 6 team fouls] (Russell Wade: 3 personal fouls)   FT 1/1: GOOD Tracy Adebayo makes 1/1 from the line.
Score: 53-72

[08:23] Team_065 possession (Score: 53-72)
RJ Harden attempts a Midrange. Contested by Zach Wall (5.4 feet, ZONE). RJ Harden misses. Rebound secured by Tracy Adebayo.

[08:08] Team_090 possession (Score: 53-72)
FOUL! Holding foul on Russell Wade. [IN THE BONUS! 7 team fouls] Gary Brogdon to the line for 2 free throws. (Russell Wade: 4 personal fouls)   FT 1/2: GOOD   FT 2/2: GOOD Gary Brogdon makes 2/2 from the line.
Score: 55-72

[07:53] Team_065 possession (Score: 55-72)
Russell Wade drives to the basket... FOUL! Offensive foul on Russell Wade! Tracy Adebayo drew the charge! [Team fouls: 8] (Russell Wade: 5 personal fouls) TURNOVER! (dead ball)

[07:38] Team_090 possession (Score: 55-72)
Derrick Mitchell drives and kicks out. Zach Wall attempts a 3Pt. Contested by RJ Harden (3.9 feet, ZONE). Zach Wall misses. Rebound secured by RJ Harden.

[07:25] Team_065 possession (Score: 55-72)
Manu McGrady attempts a 3Pt. Contested by Gary Brogdon (3.6 feet, ZONE). Manu McGrady misses. Rebound secured by Zach Wall.

[07:11] Team_090 possession (Score: 55-72)
Gary Brogdon loses control! Ball rolls out of bounds! TURNOVER! (dead ball)

[07:00] Team_065 possession (Score: 55-72)
Russell Wade drives, picks up Gary Brogdon. Help arrives from Larry Bridges! Russell Wade attempts a Layup. Contested by Larry Bridges (3.7 feet, ZONE). Russell Wade misses. Rebound secured by Zach Wall.

[06:43] Team_090 possession (Score: 55-72)
Tracy Adebayo makes the Dunk and draws the foul on Paul Williamson! And-1! Tracy Adebayo to the line for 1. [BONUS: 9 team fouls] (Paul Williamson: 2 personal fouls)   FT 1/1: GOOD Tracy Adebayo makes 1/1 from the line.
Score: 58-72

[06:29] Team_065 possession (Score: 58-72)
Karl Booker drives and kicks out. RJ Harden attempts a 3Pt. Contested by Derrick Mitchell (3.2 feet, MAN). RJ Harden misses. Rebound secured by Zach Wall.

[06:14] Team_090 possession (Score: 58-72)
Gary Brogdon attempts a 3Pt. Contested by RJ Harden (4.1 feet, ZONE). Gary Brogdon misses. Rebound secured by RJ Harden.

[06:02] Team_065 possession (Score: 58-72)
RJ Harden attempts a Midrange. Contested by Gary Brogdon (4.1 feet, ZONE). RJ Harden misses. Rebound secured by Zach Wall.

[05:51] Team_090 possession (Score: 58-72)
Tracy Adebayo attempts a Midrange. Contested by Russell Wade (2.9 feet, MAN). Tracy Adebayo misses. Rebound secured by Manu McGrady.

[05:40] Team_065 possession (Score: 58-72)
Russell Wade attempts a 3Pt. Contested by Gary Brogdon (3.7 feet, MAN). RUSSELL WADE MAKES IT! Assist: RJ Harden
Score: 58-75

[05:25] Team_090 possession (Score: 58-75)
Gary Brogdon drives, Russell Wade stays with him. Gary Brogdon attempts a Dunk. Contested by Russell Wade (3.2 feet, ZONE). GARY BROGDON MAKES IT! Assist: Derrick Mitchell
Score: 60-75

[05:13] Team_065 possession (Score: 60-75)
FOUL! Reach-in foul on Gary Brogdon during the drive. [Team fouls: 4] No free throws, side out. (Gary Brogdon: 1 personal fouls)

[04:56] Team_065 possession (Score: 60-75)
RJ Harden drives and kicks out. Manu McGrady attempts a 3Pt. Contested by Gary Brogdon (3.8 feet, ZONE). Manu McGrady misses. Rebound secured by Zach Wall.

[04:40] Team_090 possession (Score: 60-75)
Zach Wall attempts a 3Pt. Contested by Manu McGrady (4.9 feet, MAN). Zach Wall misses. FOUL! Loose ball foul on Russell Wade during the rebound battle. [IN THE BONUS! 10 team fouls] Zach Wall to the line for 2 free throws. (Russell Wade: 6 personal fouls) Russell Wade FOULS OUT!   FT 1/2: GOOD   FT 2/2: MISS Zach Wall makes 1/2 from the line. Rebound secured by Manu McGrady.
Score: 61-75

[04:40] Substitution (Team_065): Russell Wade OUT (stamina: 78) → Paul Curry IN (foul_out)

[04:24] Team_065 possession (Score: 61-75)
FOUL! Reach-in foul on Gary Brogdon during the drive. [IN THE BONUS! 5 team fouls] Karl Booker to the line for 2 free throws. (Gary Brogdon: 2 personal fouls)   FT 1/2: GOOD   FT 2/2: MISS Karl Booker makes 1/2 from the line. Rebound secured by Zach Wall.
Score: 61-76

[04:11] Team_090 possession (Score: 61-76)
Gary Brogdon attempts a 3Pt. Contested by Karl Booker (5.0 feet, MAN). Gary Brogdon misses. Offensive rebound by Zach Wall! Zach Wall kicks it out.

[03:56] Team_090 possession (Score: 61-76)
Larry Bridges attempts a 3Pt. Contested by RJ Harden (4.0 feet, ZONE). Larry Bridges misses. Offensive rebound by Zach Wall! Zach Wall kicks it out.

[03:44] Team_090 possession (Score: 61-76)
Derrick Mitchell drives, picks up RJ Harden. Help arrives from Manu McGrady! Derrick Mitchell attempts a Layup. Contested by Manu McGrady (4.3 feet, MAN). DERRICK MITCHELL MAKES IT!
Score: 63-76

[03:33] Team_065 possession (Score: 63-76)
Karl Booker attempts a Layup. Contested by Gary Brogdon (3.9 feet, ZONE). Karl Booker misses. Rebound secured by Gary Brogdon.

[03:15] Team_090 possession (Score: 63-76)
Derrick Mitchell drives, picks up Karl Booker. Help arrives from Paul Williamson! Derrick Mitchell attempts a Dunk. Contested by Paul Williamson (5.2 feet, ZONE). Derrick Mitchell misses. Rebound secured by Karl Booker.

[03:00] Team_065 possession (Score: 63-76)
Paul Curry attempts a Midrange. Contested by Derrick Mitchell (3.8 feet, MAN). PAUL CURRY MAKES IT! Assist: Karl Booker
Score: 63-78

[02:46] Team_090 possession (Score: 63-78)
Zach Wall attempts a 3Pt. Contested by Manu McGrady (5.1 feet, MAN). Zach Wall misses. Rebound secured by Karl Booker.

[02:34] Team_065 possession (Score: 63-78)
RJ Harden drives, picks up Gary Brogdon. Help arrives from Larry Bridges! RJ Harden attempts a Dunk. Contested by Larry Bridges (4.5 feet, ZONE). RJ HARDEN MAKES IT! Assist: Paul Williamson
Score: 63-80

[02:17] Team_090 possession (Score: 63-80)
FOUL! Shooting foul on Karl Booker. Derrick Mitchell to the line for 2 free throws. [BONUS: 11 team fouls] (Karl Booker: 1 personal fouls)   FT 1/2: MISS   FT 2/2: GOOD Derrick Mitchell makes 1/2 from the line.
Score: 64-80

[02:03] Team_065 possession (Score: 64-80)
Paul Williamson attempts a Midrange. Contested by Gary Brogdon (4.3 feet, ZONE). PAUL WILLIAMSON MAKES IT!
Score: 64-82

[01:48] Team_090 possession (Score: 64-82)
Larry Bridges drives and kicks out. Gary Brogdon attempts a 3Pt. Contested by RJ Harden (4.2 feet, ZONE). Gary Brogdon misses. Rebound secured by RJ Harden.

[01:34] Team_065 possession (Score: 64-82)
Manu McGrady attempts a 3Pt. Contested by Derrick Mitchell (3.5 feet, ZONE). Manu McGrady misses. Rebound secured by Gary Brogdon.

[01:23] Team_090 possession (Score: 64-82)
Tracy Adebayo attempts a 3Pt. Contested by RJ Harden (4.1 feet, ZONE). Tracy Adebayo misses. Offensive rebound by Zach Wall! Zach Wall kicks it out.

[01:08] Team_090 possession (Score: 64-82)
Gary Brogdon attempts a Midrange. Contested by Karl Booker (5.3 feet, MAN). Gary Brogdon misses. Rebound secured by RJ Harden.

[00:52] Team_065 possession (Score: 64-82)
Karl Booker makes the Layup and draws the foul on Gary Brogdon! And-1! Karl Booker to the line for 1. [BONUS: 6 team fouls] (Gary Brogdon: 3 personal fouls)   FT 1/1: GOOD Karl Booker makes 1/1 from the line.
Score: 64-85

[00:42] Team_090 possession (Score: 64-85)
Larry Bridges attempts a 3Pt. Contested by Paul Williamson (3.9 feet, MAN). LARRY BRIDGES MAKES IT! Assist: Gary Brogdon
Score: 67-85

[00:33] Team_065 possession (Score: 67-85)
Paul Curry attempts a 3Pt. Contested by Derrick Mitchell (4.1 feet, ZONE). PAUL CURRY MAKES IT! Assist: RJ Harden
Score: 67-88

[00:21] Team_090 possession (Score: 67-88)
Tracy Adebayo drives, Karl Booker stays with him. Tracy Adebayo attempts a Dunk. Contested by Karl Booker (5.0 feet, MAN). TRACY ADEBAYO MAKES IT! Assist: Derrick Mitchell
Score: 69-88

[00:04] Team_065 possession (Score: 69-88)
Karl Booker attempts a Midrange. Contested by Tracy Adebayo (5.4 feet, MAN). Karl Booker misses. Rebound secured by Gary Brogdon.

================================================================================
                              3RD QUARTER COMPLETE                              
================================================================================

3RD QUARTER SCORE: Team_090 27, Team_065 29

BOX SCORE:
================================================================================

Team_090
--------------------------------------------------------------------------------
Player                MIN  PTS  REB  AST  TO      FG   FG%      3P   3P%
--------------------------------------------------------------------------------
Tracy Adebayo          33    8    2    0   0   3/4    75.0     0/0   0.0
Derrick Mitchell       33    7    0    2   0   4/6    66.7     0/0   0.0
Gary Brogdon           33    4    5    1   0   2/4    50.0     0/0   0.0
Larry Bridges          33    3    0    1   0   1/3    33.3     0/0   0.0
Zach Wall              33    2    9    0   0   1/4    25.0     0/0   0.0

TEAM: FG: 11/21 (52.4%), 3PT: 1/6 (16.7%), REB: 17 (6 off, 11 def), AST: 4, TO: 2
TEAM FOULS: 6 [Team_065 in BONUS]


Team_065
--------------------------------------------------------------------------------
Player                MIN  PTS  REB  AST  TO      FG   FG%      3P   3P%
--------------------------------------------------------------------------------
RJ Harden              33    6    4    3   0   2/6    33.3     0/0   0.0
Paul Williamson        33    6    0    1   0   2/2   100.0     0/0   0.0
Manu McGrady           33    5    4    0   0   2/4    50.0     0/0   0.0
Paul Curry              8    5    0    0   0   2/2   100.0     0/0   0.0
Russell Wade           28    3    0    0   0   1/2    50.0     0/0   0.0
Karl Booker            33    3    2    1   0   1/5    20.0     0/0   0.0

TEAM: FG: 10/21 (47.6%), 3PT: 4/7 (57.1%), REB: 9 (0 off, 9 def), AST: 5, TO: 2
TEAM FOULS: 11 [Team_090 in BONUS]

================================================================================

================================================================================
                       4TH QUARTER - Team_090 vs Team_065                       
================================================================================

[12:00] Substitution (Team_090): Derrick Mitchell OUT (stamina: 71) → OG Anunoby IN (comeback_detected)

[12:00] Substitution (Team_065): RJ Harden OUT (stamina: 69) → Paul Curry IN (comeback_detected)

[12:00] Team_090 possession (Score: 69-88)
FOUL! Holding foul on Russell Wade. [Team fouls: 1] No free throws, side out. (Russell Wade: 1 personal fouls)

[11:46] Team_090 possession (Score: 69-88)
Zach Wall attempts a Layup. Contested by Russell Wade (3.3 feet, ZONE). Zach Wall misses. Offensive rebound by Tracy Adebayo! Tracy Adebayo kicks it out.

[11:31] Team_090 possession (Score: 69-88)
FOUL! Holding foul on Paul Curry. [Team fouls: 2] No free throws, side out. (Paul Curry: 1 personal fouls)

[11:19] Team_090 possession (Score: 69-88)
Larry Bridges makes the Midrange and draws the foul on Paul Williamson! And-1! Larry Bridges to the line for 1. [Team fouls: 3] (Paul Williamson: 1 personal fouls)   FT 1/1: GOOD Larry Bridges makes 1/1 from the line.
Score: 72-88

[11:09] Team_065 possession (Score: 72-88)
Manu McGrady attempts a 3Pt. Contested by Zach Wall (5.2 feet, ZONE). MANU MCGRADY MAKES IT! Assist: Russell Wade
Score: 72-91

[10:58] Team_090 possession (Score: 72-91)
FOUL! Reach-in foul on Paul Williamson during the drive. [Team fouls: 4] No free throws, side out. (Paul Williamson: 2 personal fouls)

[10:49] Team_090 possession (Score: 72-91)
Gary Brogdon attempts a 3Pt. Contested by Russell Wade (3.1 feet, ZONE). Gary Brogdon misses. Rebound secured by Manu McGrady.

[10:36] Team_065 possession (Score: 72-91)
Manu McGrady attempts a Midrange. Contested by Gary Brogdon (4.4 feet, ZONE). Manu McGrady misses. Offensive rebound by Manu McGrady! Manu McGrady kicks it out.

[10:22] Team_065 possession (Score: 72-91)
Russell Wade attempts a Midrange. Contested by Gary Brogdon (4.6 feet, MAN). Russell Wade misses. FOUL! Loose ball foul on Zach Wall during the rebound battle. [Team fouls: 1] No free throws, side out. (Zach Wall: 1 personal fouls)

[10:05] Team_065 possession (Score: 72-91)
Russell Wade attempts a Layup. BLOCKED BY GARY BROGDON! Ball is loose! Rebound secured by Gary Brogdon.

[09:50] Team_090 possession (Score: 72-91)
Gary Brogdon drives to the basket... Gary Brogdon loses the ball! Stripped by Russell Wade! TURNOVER! (live ball)

[09:37] Team_065 possession (Score: 72-91)
Paul Curry makes the Midrange and draws the foul on OG Anunoby! And-1! Paul Curry to the line for 1. [Team fouls: 2] (OG Anunoby: 1 personal fouls)   FT 1/1: GOOD Paul Curry makes 1/1 from the line.
Score: 72-94

[09:24] Team_090 possession (Score: 72-94)
Gary Brogdon attempts a 3Pt. Contested by Russell Wade (3.1 feet, MAN). Gary Brogdon misses. FOUL! Loose ball foul on Manu McGrady during the rebound battle. [IN THE BONUS! 5 team fouls] Tracy Adebayo to the line for 2 free throws. (Manu McGrady: 1 personal fouls)   FT 1/2: GOOD   FT 2/2: GOOD Tracy Adebayo makes 2/2 from the line.
Score: 74-94

[09:12] Team_065 possession (Score: 74-94)
FOUL! Reach-in foul on Gary Brogdon during the drive. [Team fouls: 3] No free throws, side out. (Gary Brogdon: 1 personal fouls)

[08:59] Team_065 possession (Score: 74-94)
Manu McGrady makes the Midrange and draws the foul on Larry Bridges! And-1! Manu McGrady to the line for 1. [Team fouls: 4] (Larry Bridges: 1 personal fouls)   FT 1/1: GOOD Manu McGrady makes 1/1 from the line.
Score: 74-97

[08:45] Team_090 possession (Score: 74-97)
OG Anunoby attempts a 3Pt. Contested by Paul Curry (5.0 feet, MAN). OG Anunoby misses. Offensive rebound by Zach Wall! Zach Wall kicks it out.

[08:36] Team_090 possession (Score: 74-97)
Larry Bridges attempts a Midrange. Contested by Paul Williamson (4.3 feet, MAN). Larry Bridges misses. Rebound secured by Manu McGrady.

[08:22] Team_065 possession (Score: 74-97)
Karl Booker loses control! Ball rolls out of bounds! TURNOVER! (dead ball)

[08:22] Substitution (Team_090): Larry Bridges OUT → Josh Wall IN (stamina_rule2)

[08:22] Substitution (Team_090): Zach Wall OUT → Russell Smith IN (stamina_rule2)

[08:22] Substitution (Team_090): Gary Brogdon OUT → Derrick Nowitzki IN (stamina_rule2)

[08:22] Substitution (Team_090): Tracy Adebayo OUT → Tobias Tatum IN (stamina_rule2)

[08:22] Substitution (Team_065): Paul Williamson OUT → Derrick Poole IN (stamina_rule2)

[08:22] Substitution (Team_065): Manu McGrady OUT → D'Angelo Porzingis IN (stamina_rule2)

[08:22] Substitution (Team_065): Karl Booker OUT → Vince Mobley IN (stamina_rule2)

[08:09] Team_090 possession (Score: 74-97)
Tobias Tatum throws a bad pass out of bounds! TURNOVER! (dead ball)

[07:56] Team_065 possession (Score: 74-97)
Vince Mobley drives, Tobias Tatum stays with him. Vince Mobley attempts a Layup. Contested by Tobias Tatum (4.6 feet, MAN). VINCE MOBLEY MAKES IT! Assist: Derrick Poole
Score: 74-99

[07:42] Team_090 possession (Score: 74-99)
Tobias Tatum attempts a Layup. Contested by Vince Mobley (4.9 feet, MAN). TOBIAS TATUM MAKES IT! Assist: Josh Wall
Score: 76-99

[07:26] Team_065 possession (Score: 76-99)
Russell Wade throws a bad pass out of bounds! TURNOVER! (dead ball)

[07:14] Team_090 possession (Score: 76-99)
Josh Wall attempts a 3Pt. Contested by Derrick Poole (5.4 feet, MAN). Josh Wall misses. Rebound secured by Russell Wade.

[06:58] Team_065 possession (Score: 76-99)
Vince Mobley attempts a Layup. BLOCKED BY TOBIAS TATUM! Ball is loose! Rebound secured by Tobias Tatum.

[06:41] Team_090 possession (Score: 76-99)
Derrick Nowitzki attempts a 3Pt. Contested by D'Angelo Porzingis (3.9 feet, ZONE). Derrick Nowitzki misses. Offensive rebound by Tobias Tatum! Tobias Tatum kicks it out.

[06:24] Team_090 possession (Score: 76-99)
Tobias Tatum attempts a Midrange. Contested by D'Angelo Porzingis (5.0 feet, ZONE). Tobias Tatum misses. Rebound secured by Russell Wade.

[06:11] Team_065 possession (Score: 76-99)
Russell Wade attempts a Midrange. Contested by Russell Smith (4.4 feet, ZONE). Russell Wade misses. Rebound secured by Russell Smith.

[05:55] Team_090 possession (Score: 76-99)
OG Anunoby attempts a 3Pt. Contested by Russell Wade (3.5 feet, ZONE). OG Anunoby misses. Rebound secured by D'Angelo Porzingis.

[05:42] Team_065 possession (Score: 76-99)
Derrick Poole drives and kicks out. Russell Wade attempts a 3Pt. Contested by Russell Smith (4.3 feet, ZONE). Russell Wade misses. Rebound secured by Tobias Tatum.

[05:25] Team_090 possession (Score: 76-99)
Russell Smith attempts a 3Pt. Contested by D'Angelo Porzingis (4.6 feet, MAN). RUSSELL SMITH MAKES IT!
Score: 79-99

[05:11] Team_065 possession (Score: 79-99)
FOUL! Reach-in foul on Derrick Nowitzki during the drive. [IN THE BONUS! 5 team fouls] Russell Wade to the line for 2 free throws. (Derrick Nowitzki: 1 personal fouls)   FT 1/2: GOOD   FT 2/2: MISS Russell Wade makes 1/2 from the line. Rebound secured by Derrick Nowitzki.
Score: 79-100

[04:58] Team_090 possession (Score: 79-100)
Josh Wall attempts a 3Pt. Contested by Russell Wade (4.0 feet, ZONE). JOSH WALL MAKES IT! Assist: Derrick Nowitzki
Score: 82-100

[04:42] Team_065 possession (Score: 82-100)
Russell Wade drives and kicks out. Russell Wade attempts a 3Pt. Contested by Russell Smith (4.3 feet, ZONE). RUSSELL WADE MAKES IT! Assist: D'Angelo Porzingis
Score: 82-103

[04:30] Team_090 possession (Score: 82-103)
Russell Smith attempts a Layup. BLOCKED BY D'ANGELO PORZINGIS! Ball deflects out of bounds off Russell Smith.

[04:14] Team_065 possession (Score: 82-103)
Derrick Poole attempts a 3Pt. Contested by Josh Wall (4.2 feet, MAN). Derrick Poole misses. Rebound secured by Tobias Tatum.

[04:00] Team_090 possession (Score: 82-103)
Josh Wall attempts a 3Pt. Contested by Derrick Poole (5.4 feet, MAN). Josh Wall misses. Offensive rebound by Russell Smith! Russell Smith kicks it out.

[03:45] Team_090 possession (Score: 82-103)
Derrick Nowitzki drives, Russell Wade stays with him. Derrick Nowitzki attempts a Layup. Contested by Russell Wade (3.3 feet, ZONE). DERRICK NOWITZKI MAKES IT! Assist: Tobias Tatum
Score: 84-103

[03:34] Team_065 possession (Score: 84-103)
D'Angelo Porzingis attempts a Midrange. Contested by Tobias Tatum (4.8 feet, ZONE). D'Angelo Porzingis misses. Offensive rebound by Vince Mobley! Vince Mobley's putback is no good. Rebound secured by Russell Smith.

[03:17] Team_090 possession (Score: 84-103)
Russell Smith attempts a Midrange. Contested by Derrick Poole (5.3 feet, ZONE). RUSSELL SMITH MAKES IT!
Score: 86-103

[03:00] Team_065 possession (Score: 86-103)
D'Angelo Porzingis drives, Russell Smith stays with him. D'Angelo Porzingis attempts a Dunk. Contested by Russell Smith (4.5 feet, MAN). D'ANGELO PORZINGIS MAKES IT!
Score: 86-105

[02:45] Team_090 possession (Score: 86-105)
FOUL! Shooting foul on Vince Mobley. Tobias Tatum to the line for 2 free throws. [BONUS: 6 team fouls] (Vince Mobley: 1 personal fouls)   FT 1/2: GOOD   FT 2/2: MISS Tobias Tatum makes 1/2 from the line. Offensive rebound by Tobias Tatum! Tobias Tatum kicks it out.
Score: 87-105

[02:27] Team_090 possession (Score: 87-105)
OG Anunoby attempts a Layup. Contested by Paul Curry (5.6 feet, MAN). OG ANUNOBY MAKES IT! Assist: Josh Wall
Score: 89-105

[02:08] Team_065 possession (Score: 89-105)
Derrick Poole makes the Layup and draws the foul on Josh Wall! And-1! Derrick Poole to the line for 1. [BONUS: 6 team fouls] (Josh Wall: 1 personal fouls)   FT 1/1: GOOD Derrick Poole makes 1/1 from the line.
Score: 89-108

[01:54] Team_090 possession (Score: 89-108)
Derrick Nowitzki commits a violation (traveling/carry)! TURNOVER! (dead ball)

[01:54] Substitution (Team_065): Russell Wade OUT → Karl Leonard IN (stamina_rule2)

[01:35] Team_065 possession (Score: 89-108)
Vince Mobley throws a bad pass out of bounds! TURNOVER! (dead ball)

[01:19] Team_090 possession (Score: 89-108)
Derrick Nowitzki attempts a 3Pt. Contested by Karl Leonard (4.1 feet, MAN). Derrick Nowitzki misses. FOUL! Loose ball foul on Vince Mobley during the rebound battle. [IN THE BONUS! 7 team fouls] Tobias Tatum to the line for 2 free throws. (Vince Mobley: 2 personal fouls)   FT 1/2: GOOD   FT 2/2: GOOD Tobias Tatum makes 2/2 from the line.
Score: 91-108

[01:06] Team_065 possession (Score: 91-108)
Vince Mobley attempts a Midrange. Contested by Tobias Tatum (4.6 feet, MAN). Vince Mobley misses. Offensive rebound by D'Angelo Porzingis! D'Angelo Porzingis kicks it out.

[00:54] Team_065 possession (Score: 91-108)
Derrick Poole attempts a 3Pt. Contested by Josh Wall (4.2 feet, MAN). Derrick Poole misses. Rebound secured by Derrick Nowitzki.

[00:36] Team_090 possession (Score: 91-108)
FOUL! Reach-in foul on Vince Mobley during the drive. [IN THE BONUS! 8 team fouls] OG Anunoby to the line for 2 free throws. (Vince Mobley: 3 personal fouls)   FT 1/2: GOOD   FT 2/2: GOOD OG Anunoby makes 2/2 from the line.
Score: 93-108

[00:24] Team_065 possession (Score: 93-108)
Vince Mobley makes the Dunk and draws the foul on Josh Wall! And-1! Vince Mobley to the line for 1. [BONUS: 7 team fouls] (Josh Wall: 2 personal fouls)   FT 1/1: GOOD Vince Mobley makes 1/1 from the line.
Score: 93-111

[00:07] Team_090 possession (Score: 93-111)
Russell Smith attempts a Midrange. Contested by D'Angelo Porzingis (4.6 feet, MAN). Russell Smith misses. Rebound secured by Karl Leonard.

================================================================================
                              4TH QUARTER COMPLETE                              
================================================================================

4TH QUARTER SCORE: Team_090 24, Team_065 23

BOX SCORE:
================================================================================

Team_090
--------------------------------------------------------------------------------
Player                MIN  PTS  REB  AST  TO      FG   FG%      3P   3P%
--------------------------------------------------------------------------------
Russell Smith          12    5    3    0   0   2/4    50.0     0/0   0.0
Tobias Tatum           12    4    5    1   0   2/3    66.7     0/0   0.0
OG Anunoby             15    4    0    0   0   2/3    66.7     0/0   0.0
Larry Bridges          37    3    0    0   0   1/2    50.0     0/0   0.0
Josh Wall              12    3    0    2   0   1/2    50.0     0/0   0.0
Tracy Adebayo          37    2    1    0   0   1/1   100.0     0/0   0.0
Derrick Nowitzki       12    2    2    1   0   1/1   100.0     0/0   0.0
Gary Brogdon           37    0    1    0   0   0/1     0.0     0/0   0.0
Zach Wall              37    0    1    0   0   0/0     0.0     0/0   0.0

TEAM: FG: 10/17 (58.8%), 3PT: 4/7 (57.1%), REB: 12 (5 off, 7 def), AST: 4, TO: 3
TEAM FOULS: 7 [Team_065 in BONUS]


Team_065
--------------------------------------------------------------------------------
Player                MIN  PTS  REB  AST  TO      FG   FG%      3P   3P%
--------------------------------------------------------------------------------
Manu McGrady           37    6    4    0   0   2/2   100.0     0/0   0.0
Vince Mobley           12    5    0    0   0   2/3    66.7     0/0   0.0
Russell Wade           39    3    2    1   0   1/4    25.0     0/0   0.0
Paul Curry             20    3    0    0   0   1/1   100.0     0/0   0.0
Derrick Poole          12    3    0    1   0   1/4    25.0     0/0   0.0
D'Angelo Porzingis     12    2    2    1   0   1/2    50.0     0/0   0.0
Karl Leonard            5    0    1    0   0   0/0     0.0     0/0   0.0

TEAM: FG: 8/16 (50.0%), 3PT: 1/3 (33.3%), REB: 10 (4 off, 6 def), AST: 3, TO: 3
TEAM FOULS: 8 [Team_090 in BONUS]

================================================================================

================================================================================
                               FULL GAME COMPLETE                               
================================================================================

FINAL SCORE: Team_090 93, Team_065 111

SCORING BY QUARTER:
--------------------------------------------------------------------------------
Team                     Q1     Q2     Q3     Q4    FINAL
--------------------------------------------------------------------------------
Team_090                 24     18     27     24       93
Team_065                 32     27     29     23      111
--------------------------------------------------------------------------------

FULL GAME BOX SCORE:
================================================================================

Team_090
--------------------------------------------------------------------------------
Player                MIN  PTS  REB  AST  TO      FG   FG%      3P   3P%      FT STL BLK
--------------------------------------------------------------------------------
Larry Bridges          37   10    1    1   1   4/8    50.0   1/2    50.0   3/4     1   0
Zach Wall              37   16   14    2   1   7/13   53.8   2/7    28.6   5/6     1   0
Gary Brogdon           37    4   13    4   4   2/8    25.0   1/5    20.0   2/2     0   2
Tracy Adebayo          37   12    9    2   2   4/7    57.1   0/0     0.0   6/6     0   0
Derrick Mitchell       33   26    0    4   2  13/21   61.9   0/3     0.0   8/9     0   0
OG Anunoby             15    4    0    0   1   2/3    66.7   0/1     0.0   2/2     0   0
Josh Wall              12    3    0    2   0   1/2    50.0   1/2    50.0   0/0     0   0
Russell Smith          12    5    4    0   1   2/5    40.0   1/2    50.0   0/0     0   0
Derrick Nowitzki       12    5    3    1   1   3/4    75.0   1/2    50.0   1/1     0   0
Tobias Tatum           12    4    7    1   1   1/3    33.3   0/0     0.0   3/4     0   1

TEAM: FG: 40/75 (53.3%), 3PT: 7/24 (29.2%), REB: 51 (14 off, 37 def), AST: 17, TO: 14


Team_065
--------------------------------------------------------------------------------
Player                MIN  PTS  REB  AST  TO      FG   FG%      3P   3P%      FT STL BLK
--------------------------------------------------------------------------------
Russell Wade           39   23    8    3   3  11/18   61.1   2/4    50.0   3/4     2   0
Paul Williamson        37   20    0    3   1   7/12   58.3   3/7    42.9   3/3     1   0
Manu McGrady           37   13   16    2   0   5/13   38.5   1/6    16.7   2/2     0   0
Karl Booker            37   17    2    4   2   5/10   50.0   0/0     0.0   7/8     0   0
RJ Harden              33   11    9    5   1   4/9    44.4   2/4    50.0   1/1     0   0
Paul Curry             20    8    0    1   0   3/3   100.0   1/1   100.0   1/1     0   0
Derrick Poole          12    6    0    1   0   2/6    33.3   1/4    25.0   1/1     0   0
D'Angelo Porzingis     12    4    5    1   0   2/4    50.0   0/0     0.0   0/0     0   1
Vince Mobley           12    7    1    0   1   3/4    75.0   0/0     0.0   1/1     0   0
Karl Leonard            5    0    1    1   0   0/1     0.0   0/1     0.0   0/0     0   0

TEAM: FG: 42/80 (52.5%), 3PT: 10/27 (37.0%), REB: 42 (9 off, 33 def), AST: 21, TO: 8

================================================================================
