================================================================================
                        FULL GAME - Team_099 vs Team_012                        
================================================================================

================================================================================
                       1ST QUARTER - Team_099 vs Team_012                       
================================================================================

[12:00] Team_099 possession (Score: 0-0)
Vince Lillard throws a bad pass! Stolen by Paolo Durant! TURNOVER! (live ball)

[11:46] Team_012 possession (Score: 0-0)
Pascal Herro attempts a 3Pt. Contested by Ayo Barrett (4.3 feet, ZONE). Pascal Herro misses. Rebound secured by Vince Lillard.

[11:34] Team_099 possession (Score: 0-0)
FOUL! Reach-in foul on Paolo Durant during the drive. [Team fouls: 1] No free throws, side out. (Paolo Durant: 1 personal fouls)

[11:20] Team_099 possession (Score: 0-0)
Damian Ginobili attempts a Layup. Contested by Paolo Durant (3.7 feet, ZONE). Damian Ginobili misses. Rebound secured by RJ Nowitzki.

[11:05] Team_012 possession (Score: 0-0)
Ayo McGrady attempts a Layup. BLOCKED BY VINCE LILLARD! Ball deflects out of bounds off Ayo McGrady.

[10:50] Team_099 possession (Score: 0-0)
Larry Wade drives and kicks out. Larry Wade attempts a 3Pt. Contested by RJ Nowitzki (3.4 feet, ZONE). Larry Wade misses. Rebound secured by RJ Nowitzki.

[10:33] Team_012 possession (Score: 0-0)
Ayo McGrady makes the Dunk and draws the foul on Vince Lillard! And-1! Ayo McGrady to the line for 1. [Team fouls: 1] (Vince Lillard: 1 personal fouls)   FT 1/1: GOOD Ayo McGrady makes 1/1 from the line.
Score: 0-3

[10:21] Team_099 possession (Score: 0-3)
Larry Wade makes the Layup and draws the foul on Ayo McGrady! And-1! Larry Wade to the line for 1. [Team fouls: 2] (Ayo McGrady: 1 personal fouls)   FT 1/1: MISS Larry Wade makes 0/1 from the line. Rebound secured by Ayo McGrady.
Score: 2-3

[10:05] Team_012 possession (Score: 2-3)
Ayo McGrady drives and kicks out. Paolo Durant attempts a 3Pt. Contested by Vince Lillard (2.5 feet, MAN). Paolo Durant misses. Rebound secured by Larry Wade.

[09:54] Team_099 possession (Score: 2-3)
FOUL! Holding foul on Pascal Herro. [Team fouls: 3] No free throws, side out. (Pascal Herro: 1 personal fouls)

[09:38] Team_099 possession (Score: 2-3)
FOUL! Holding foul on Pascal Herro. [Team fouls: 4] No free throws, side out. (Pascal Herro: 2 personal fouls)

[09:24] Team_099 possession (Score: 2-3)
FOUL! Shooting foul on Paolo Durant. Larry James to the line for 2 free throws. [BONUS: 5 team fouls] (Paolo Durant: 2 personal fouls)   FT 1/2: GOOD   FT 2/2: GOOD Larry James makes 2/2 from the line.
Score: 4-3

[09:12] Team_012 possession (Score: 4-3)
Shaquille Booker attempts a Layup. BLOCKED BY VINCE LILLARD! Ball deflects out of bounds off Shaquille Booker.

[08:57] Team_099 possession (Score: 4-3)
Ayo Barrett attempts a 3Pt. Contested by Pascal Herro (5.1 feet, MAN). AYO BARRETT MAKES IT! Assist: Vince Lillard
Score: 7-3

[08:46] Team_012 possession (Score: 7-3)
RJ Nowitzki attempts a 3Pt. Contested by Larry James (5.4 feet, MAN). RJ Nowitzki misses. Offensive rebound by Paolo Durant! Paolo Durant's putback is no good. Rebound secured by Damian Ginobili.

[08:34] Team_099 possession (Score: 7-3)
Vince Lillard attempts a Layup. Contested by Paolo Durant (3.6 feet, ZONE). VINCE LILLARD MAKES IT!
Score: 9-3

[08:22] Team_012 possession (Score: 9-3)
FOUL! Shooting foul on Larry Wade. Ayo McGrady to the line for 2 free throws. [Team fouls: 2] (Larry Wade: 1 personal fouls)   FT 1/2: GOOD   FT 2/2: GOOD Ayo McGrady makes 2/2 from the line.
Score: 9-5

[08:05] Team_099 possession (Score: 9-5)
Larry James attempts a Midrange. Contested by RJ Nowitzki (3.5 feet, MAN). Larry James misses. Rebound secured by Paolo Durant.

[07:51] Team_012 possession (Score: 9-5)
RJ Nowitzki drives, Vince Lillard stays with him. RJ Nowitzki attempts a Dunk. Contested by Vince Lillard (2.8 feet, ZONE). RJ NOWITZKI MAKES IT! Assist: Shaquille Booker
Score: 9-7

[07:38] Team_099 possession (Score: 9-7)
Larry James attempts a 3Pt. Contested by RJ Nowitzki (3.5 feet, ZONE). LARRY JAMES MAKES IT! Assist: Ayo Barrett
Score: 12-7

[07:25] Team_012 possession (Score: 12-7)
FOUL! Reach-in foul on Larry Wade during the drive. [Team fouls: 3] No free throws, side out. (Larry Wade: 2 personal fouls)

[07:08] Team_012 possession (Score: 12-7)
Ayo McGrady attempts a Layup. BLOCKED BY VINCE LILLARD! Ball is loose! Rebound secured by Damian Ginobili.

[06:51] Team_099 possession (Score: 12-7)
Larry James attempts a 3Pt. Contested by RJ Nowitzki (3.5 feet, MAN). Larry James misses. Offensive rebound by Vince Lillard! Vince Lillard's putback is no good. Rebound secured by RJ Nowitzki.

[06:36] Team_012 possession (Score: 12-7)
RJ Nowitzki attempts a 3Pt. Contested by Ayo Barrett (4.1 feet, ZONE). RJ Nowitzki misses. Rebound secured by Vince Lillard.

[06:18] Team_099 possession (Score: 12-7)
Damian Ginobili makes the Dunk and draws the foul on Shaquille Booker! And-1! Damian Ginobili to the line for 1. [BONUS: 6 team fouls] (Shaquille Booker: 1 personal fouls)   FT 1/1: GOOD Damian Ginobili makes 1/1 from the line.
Score: 15-7

[06:06] Team_012 possession (Score: 15-7)
Ayo McGrady attempts a Layup. Contested by Larry Wade (4.2 feet, MAN). AYO MCGRADY MAKES IT! Assist: Shaquille Booker
Score: 15-9

[05:56] Team_099 possession (Score: 15-9)
FOUL! Shooting foul on Pascal Herro. Ayo Barrett to the line for 2 free throws. [BONUS: 7 team fouls] (Pascal Herro: 3 personal fouls)   FT 1/2: GOOD   FT 2/2: GOOD Ayo Barrett makes 2/2 from the line.
Score: 17-9

[05:44] Team_012 possession (Score: 17-9)
RJ Nowitzki attempts a Layup. Contested by Vince Lillard (2.8 feet, ZONE). RJ Nowitzki misses. Rebound secured by Larry Wade.

[05:33] Team_099 possession (Score: 17-9)
Larry Wade attempts a Midrange. Contested by Ayo McGrady (4.6 feet, MAN). Larry Wade misses. Rebound secured by Ayo McGrady.

[05:17] Team_012 possession (Score: 17-9)
Pascal Herro attempts a 3Pt. Contested by Larry James (5.6 feet, ZONE). Pascal Herro misses. Rebound secured by Damian Ginobili.

[05:05] Team_099 possession (Score: 17-9)
Ayo Barrett attempts a Midrange. Contested by Paolo Durant (3.7 feet, ZONE). Ayo Barrett misses. Offensive rebound by Larry Wade! Larry Wade's putback is no good. Rebound secured by RJ Nowitzki.

[04:48] Team_012 possession (Score: 17-9)
Pascal Herro attempts a 3Pt. Contested by Ayo Barrett (4.3 feet, MAN). PASCAL HERRO MAKES IT! Assist: Ayo McGrady
Score: 17-12

[04:30] Team_099 possession (Score: 17-12)
Ayo Barrett attempts a Midrange. Contested by Pascal Herro (5.2 feet, MAN). AYO BARRETT MAKES IT!
Score: 19-12

[04:20] Team_012 possession (Score: 19-12)
Pascal Herro attempts a 3Pt. Contested by Vince Lillard (3.2 feet, ZONE). Pascal Herro misses. Rebound secured by Damian Ginobili.

[04:06] Team_099 possession (Score: 19-12)
FOUL! Offensive foul on Larry James! RJ Nowitzki drew the charge! [Team fouls: 4] (Larry James: 1 personal fouls) TURNOVER! (dead ball)

[03:50] Team_012 possession (Score: 19-12)
FOUL! Reach-in foul on Larry Wade during the drive. [IN THE BONUS! 5 team fouls] Ayo McGrady to the line for 2 free throws. (Larry Wade: 3 personal fouls)   FT 1/2: GOOD   FT 2/2: MISS Ayo McGrady makes 1/2 from the line. Offensive rebound by RJ Nowitzki! RJ Nowitzki kicks it out.
Score: 19-13

[03:33] Team_012 possession (Score: 19-13)
RJ Nowitzki attempts a Midrange. Contested by Damian Ginobili (4.0 feet, ZONE). RJ Nowitzki misses. Offensive rebound by Paolo Durant! Paolo Durant puts it back in!
Score: 19-15

[03:23] Team_099 possession (Score: 19-15)
Ayo Barrett attempts a Layup. Contested by Paolo Durant (3.9 feet, ZONE). Ayo Barrett misses. Offensive rebound by Vince Lillard! Vince Lillard's putback is no good. Rebound secured by Ayo McGrady.

[03:10] Team_012 possession (Score: 19-15)
Paolo Durant attempts a Layup. Contested by Vince Lillard (2.9 feet, MAN). Paolo Durant misses. Rebound secured by Vince Lillard.

[02:57] Team_099 possession (Score: 19-15)
FOUL! Shooting foul on RJ Nowitzki. Larry James to the line for 2 free throws. [BONUS: 8 team fouls] (RJ Nowitzki: 1 personal fouls)   FT 1/2: GOOD   FT 2/2: GOOD Larry James makes 2/2 from the line.
Score: 21-15

[02:45] Team_012 possession (Score: 21-15)
Shaquille Booker attempts a 3Pt. Contested by Damian Ginobili (3.8 feet, MAN). Shaquille Booker misses. Rebound secured by Damian Ginobili.

[02:34] Team_099 possession (Score: 21-15)
Ayo Barrett attempts a Midrange. Contested by RJ Nowitzki (3.9 feet, ZONE). Ayo Barrett misses. Offensive rebound by Larry Wade! Larry Wade kicks it out.

[02:21] Team_099 possession (Score: 21-15)
Ayo Barrett attempts a Layup. Contested by Paolo Durant (4.0 feet, ZONE). AYO BARRETT MAKES IT! Assist: Larry James
Score: 23-15

[02:10] Team_012 possession (Score: 23-15)
Paolo Durant attempts a Midrange. Contested by Larry James (5.4 feet, ZONE). Paolo Durant misses. Rebound secured by Larry Wade.

[01:57] Team_099 possession (Score: 23-15)
Larry Wade throws a bad pass! Stolen by Ayo McGrady! TURNOVER! (live ball)

[01:41] Team_012 possession (Score: 23-15)
RJ Nowitzki attempts a 3Pt. Contested by Ayo Barrett (4.4 feet, ZONE). RJ NOWITZKI MAKES IT! Assist: Pascal Herro
Score: 23-18

[01:26] Team_099 possession (Score: 23-18)
Vince Lillard makes the Layup and draws the foul on Paolo Durant! And-1! Vince Lillard to the line for 1. [BONUS: 9 team fouls] (Paolo Durant: 3 personal fouls)   FT 1/1: GOOD Vince Lillard makes 1/1 from the line.
Score: 26-18

[01:12] Team_012 possession (Score: 26-18)
Pascal Herro attempts a 3Pt. Contested by Ayo Barrett (4.6 feet, ZONE). Pascal Herro misses. Rebound secured by Larry Wade.

[01:00] Team_099 possession (Score: 26-18)
Larry Wade attempts a 3Pt. Contested by Ayo McGrady (5.0 feet, MAN). Larry Wade misses. Rebound secured by Paolo Durant.

[00:45] Team_012 possession (Score: 26-18)
Shaquille Booker loses the ball! Stripped by Damian Ginobili! TURNOVER! (live ball)

[00:33] Team_099 possession (Score: 26-18)
Ayo Barrett loses the ball! Stripped by Pascal Herro! TURNOVER! (live ball)

[00:17] Team_012 possession (Score: 26-18)
RJ Nowitzki attempts a 3Pt. Contested by Damian Ginobili (4.4 feet, ZONE). RJ Nowitzki misses. Rebound secured by Vince Lillard.

[00:01] Team_099 possession (Score: 26-18)
Larry Wade attempts a Midrange. Contested by Ayo McGrady (5.1 feet, MAN). LARRY WADE MAKES IT! Assist: Vince Lillard
Score: 28-18

================================================================================
                              1ST QUARTER COMPLETE                              
================================================================================

1ST QUARTER SCORE: Team_099 28, Team_012 18

BOX SCORE:
================================================================================

Team_099
--------------------------------------------------------------------------------
Player                MIN  PTS  REB  AST  TO      FG   FG%      3P   3P%
--------------------------------------------------------------------------------
Ayo Barrett            12    9    0    1   0   4/6    66.7     0/0   0.0
Ayo McGrady            12    7    3    1   0   3/6    50.0     0/0   0.0
Larry James            12    7    0    1   0   3/5    60.0     0/0   0.0
Vince Lillard          12    5    4    2   0   2/2   100.0     0/0   0.0
Damian Ginobili        12    3    5    0   0   1/2    50.0     0/0   0.0
Larry Wade             12    2    5    0   0   1/5    20.0     0/0   0.0

TEAM: FG: 11/20 (55.0%), 3PT: 2/4 (50.0%), REB: 16 (4 off, 12 def), AST: 4, TO: 4
TEAM FOULS: 5 [Team_012 in BONUS]


Team_012
--------------------------------------------------------------------------------
Player                MIN  PTS  REB  AST  TO      FG   FG%      3P   3P%
--------------------------------------------------------------------------------
RJ Nowitzki            12    5    5    0   0   2/6    33.3     0/0   0.0
Pascal Herro           12    3    0    1   0   1/5    20.0     0/0   0.0
Paolo Durant           12    2    3    0   0   1/3    33.3     0/0   0.0
Shaquille Booker       12    0    0    2   0   0/2     0.0     0/0   0.0

TEAM: FG: 7/22 (31.8%), 3PT: 2/10 (20.0%), REB: 9 (3 off, 6 def), AST: 4, TO: 1
TEAM FOULS: 9 [Team_099 in BONUS]

================================================================================

================================================================================
                       2ND QUARTER - Team_099 vs Team_012                       
================================================================================

[12:00] Team_099 possession (Score: 28-18)
Larry Wade drives, Ayo McGrady stays with him. Larry Wade attempts a Layup. Contested by Ayo McGrady (4.9 feet, MAN). LARRY WADE MAKES IT! Assist: Damian Ginobili
Score: 30-18

[11:47] Team_012 possession (Score: 30-18)
RJ Nowitzki drives and kicks out. Pascal Herro attempts a Midrange. Contested by Ayo Barrett (4.1 feet, MAN). Pascal Herro misses. Rebound secured by Damian Ginobili.

[11:33] Team_099 possession (Score: 30-18)
Damian Ginobili drives and kicks out. Damian Ginobili attempts a 3Pt. Contested by RJ Nowitzki (3.9 feet, ZONE). Damian Ginobili misses. Rebound secured by Paolo Durant.

[11:17] Team_012 possession (Score: 30-18)
Paolo Durant attempts a Midrange. Contested by Vince Lillard (3.2 feet, MAN). Paolo Durant misses. Rebound secured by Vince Lillard.

[11:01] Team_099 possession (Score: 30-18)
FOUL! Shooting foul on Ayo McGrady. Larry Wade to the line for 2 free throws. [Team fouls: 1] (Ayo McGrady: 1 personal fouls)   FT 1/2: GOOD   FT 2/2: GOOD Larry Wade makes 2/2 from the line.
Score: 32-18

[10:46] Team_012 possession (Score: 32-18)
Shaquille Booker attempts a 3Pt. BLOCKED BY DAMIAN GINOBILI! Ball is loose! Rebound secured by Larry Wade.

[10:33] Team_099 possession (Score: 32-18)
FOUL! Reach-in foul on Pascal Herro during the drive. [Team fouls: 2] No free throws, side out. (Pascal Herro: 1 personal fouls)

[10:22] Team_099 possession (Score: 32-18)
Larry Wade drives, picks up Paolo Durant. Help arrives from RJ Nowitzki! Larry Wade attempts a Dunk. Contested by RJ Nowitzki (4.4 feet, ZONE). LARRY WADE MAKES IT!
Score: 34-18

[10:06] Team_012 possession (Score: 34-18)
Shaquille Booker attempts a 3Pt. Contested by Damian Ginobili (4.1 feet, MAN). Shaquille Booker misses. Rebound secured by Vince Lillard.

[09:50] Team_099 possession (Score: 34-18)
Larry Wade drives and kicks out. Larry James attempts a Midrange. Contested by RJ Nowitzki (4.1 feet, MAN). Larry James misses. Rebound secured by RJ Nowitzki.

[09:36] Team_012 possession (Score: 34-18)
Paolo Durant drives and kicks out. Ayo McGrady attempts a Midrange. Contested by Larry Wade (5.0 feet, MAN). AYO MCGRADY MAKES IT!
Score: 34-20

[09:21] Team_099 possession (Score: 34-20)
FOUL! Reach-in foul on Paolo Durant during the drive. [Team fouls: 3] No free throws, side out. (Paolo Durant: 1 personal fouls)

[09:09] Team_099 possession (Score: 34-20)
Larry Wade attempts a Midrange. Contested by RJ Nowitzki (4.4 feet, ZONE). LARRY WADE MAKES IT! Assist: Vince Lillard
Score: 36-20

[08:54] Team_012 possession (Score: 36-20)
RJ Nowitzki attempts a Midrange. Contested by Larry James (5.9 feet, MAN). RJ Nowitzki misses. Rebound secured by Vince Lillard.

[08:42] Team_099 possession (Score: 36-20)
Ayo Barrett attempts a 3Pt. Contested by Pascal Herro (5.9 feet, MAN). Ayo Barrett misses. Rebound secured by Paolo Durant.

[08:28] Team_012 possession (Score: 36-20)
FOUL! Offensive foul on Pascal Herro! Ayo Barrett drew the charge! [Team fouls: 4] (Pascal Herro: 2 personal fouls) TURNOVER! (dead ball)

[08:18] Team_099 possession (Score: 36-20)
Ayo Barrett throws a bad pass! Stolen by Pascal Herro! TURNOVER! (live ball)

[08:01] Team_012 possession (Score: 36-20)
Paolo Durant drives, Vince Lillard stays with him. Paolo Durant attempts a Layup. Contested by Vince Lillard (3.8 feet, MAN). PAOLO DURANT MAKES IT! Assist: Pascal Herro
Score: 36-22

[07:50] Team_099 possession (Score: 36-22)
Damian Ginobili drives, Paolo Durant stays with him. Damian Ginobili attempts a Dunk. Contested by Paolo Durant (4.6 feet, ZONE). DAMIAN GINOBILI MAKES IT!
Score: 38-22

[07:40] Team_012 possession (Score: 38-22)
Ayo McGrady drives, Larry Wade stays with him. Ayo McGrady attempts a Layup. Contested by Larry Wade (5.2 feet, MAN). Ayo McGrady misses. Rebound secured by Larry Wade.

[07:26] Team_099 possession (Score: 38-22)
Ayo Barrett attempts a 3Pt. Contested by RJ Nowitzki (4.6 feet, ZONE). Ayo Barrett misses. FOUL! Loose ball foul on Paolo Durant during the rebound battle. [IN THE BONUS! 5 team fouls] Vince Lillard to the line for 2 free throws. (Paolo Durant: 2 personal fouls)   FT 1/2: GOOD   FT 2/2: MISS Vince Lillard makes 1/2 from the line. Offensive rebound by Larry Wade! Larry Wade kicks it out.
Score: 39-22

[07:12] Team_099 possession (Score: 39-22)
Damian Ginobili makes the Midrange and draws the foul on Shaquille Booker! And-1! Damian Ginobili to the line for 1. [BONUS: 6 team fouls] (Shaquille Booker: 1 personal fouls)   FT 1/1: GOOD Damian Ginobili makes 1/1 from the line.
Score: 42-22

[06:58] Team_012 possession (Score: 42-22)
FOUL! Offensive foul on Paolo Durant! Vince Lillard drew the charge! [Team fouls: 7] (Paolo Durant: 3 personal fouls) TURNOVER! (dead ball)

[06:44] Team_099 possession (Score: 42-22)
Damian Ginobili attempts a 3Pt. Contested by Shaquille Booker (5.2 feet, MAN). DAMIAN GINOBILI MAKES IT! Assist: Ayo Barrett
Score: 45-22

[06:28] Team_012 possession (Score: 45-22)
Shaquille Booker drives and kicks out. Paolo Durant attempts a Midrange. Contested by Vince Lillard (4.1 feet, MAN). PAOLO DURANT MAKES IT!
Score: 45-24

[06:12] Team_099 possession (Score: 45-24)
Damian Ginobili attempts a Layup. BLOCKED BY RJ NOWITZKI! Ball deflects out of bounds off Damian Ginobili.

[06:00] Team_012 possession (Score: 45-24)
Ayo McGrady drives, Vince Lillard stays with him. Ayo McGrady attempts a Dunk. Contested by Vince Lillard (4.1 feet, ZONE). Ayo McGrady misses. Rebound secured by Larry Wade.

[05:47] Team_099 possession (Score: 45-24)
Damian Ginobili drives and kicks out. Larry Wade attempts a 3Pt. Contested by RJ Nowitzki (4.9 feet, ZONE). Larry Wade misses. Rebound secured by Paolo Durant.

[05:32] Team_012 possession (Score: 45-24)
FOUL! Shooting foul on Damian Ginobili. Paolo Durant to the line for 2 free throws. [Team fouls: 1] (Damian Ginobili: 1 personal fouls)   FT 1/2: GOOD   FT 2/2: GOOD Paolo Durant makes 2/2 from the line.
Score: 45-26

[05:20] Team_099 possession (Score: 45-26)
Larry James attempts a Midrange. Contested by RJ Nowitzki (4.9 feet, MAN). Larry James misses. Rebound secured by Paolo Durant.

[05:07] Team_012 possession (Score: 45-26)
Pascal Herro attempts a Layup. BLOCKED BY VINCE LILLARD! Ball is loose! Rebound secured by Vince Lillard.

[04:55] Team_099 possession (Score: 45-26)
Larry Wade attempts a Midrange. Contested by Ayo McGrady (5.8 feet, MAN). LARRY WADE MAKES IT!
Score: 47-26

[04:42] Team_012 possession (Score: 47-26)
Pascal Herro drives, picks up Ayo Barrett. Help arrives from Damian Ginobili! Pascal Herro attempts a Layup. Contested by Damian Ginobili (5.4 feet, MAN). PASCAL HERRO MAKES IT!
Score: 47-28

[04:25] Team_099 possession (Score: 47-28)
Ayo Barrett attempts a 3Pt. Contested by RJ Nowitzki (5.1 feet, ZONE). Ayo Barrett misses. Rebound secured by Paolo Durant.

[04:14] Team_012 possession (Score: 47-28)
Shaquille Booker attempts a Midrange. Contested by Damian Ginobili (5.0 feet, MAN). Shaquille Booker misses. Offensive rebound by Paolo Durant! Paolo Durant kicks it out.

[04:03] Team_012 possession (Score: 47-28)
RJ Nowitzki drives, Larry James stays with him. RJ Nowitzki attempts a Layup. Wide open! Larry James is 6.4 feet away. [MAN] RJ NOWITZKI MAKES IT! Assist: Paolo Durant
Score: 47-30

[03:50] Team_099 possession (Score: 47-30)
Ayo Barrett attempts a Midrange. Wide open! Pascal Herro is 6.6 feet away. [MAN] AYO BARRETT MAKES IT! Assist: Larry Wade
Score: 49-30

[03:38] Team_012 possession (Score: 49-30)
Paolo Durant attempts a Midrange. Contested by Vince Lillard (4.7 feet, MAN). PAOLO DURANT MAKES IT!
Score: 49-32

[03:26] Team_099 possession (Score: 49-32)
Ayo Barrett attempts a 3Pt. Wide open! Pascal Herro is 6.7 feet away. [MAN] Ayo Barrett misses. Rebound secured by Ayo McGrady.

[03:14] Team_012 possession (Score: 49-32)
Shaquille Booker attempts a Layup. Contested by Vince Lillard (4.7 feet, ZONE). SHAQUILLE BOOKER MAKES IT! Assist: Ayo McGrady
Score: 49-34

[02:58] Team_099 possession (Score: 49-34)
FOUL! Offensive foul on Vince Lillard! Paolo Durant drew the charge! [Team fouls: 2] (Vince Lillard: 1 personal fouls) TURNOVER! (dead ball)

[02:42] Team_012 possession (Score: 49-34)
RJ Nowitzki drives, Larry James stays with him. RJ Nowitzki attempts a Layup. Wide open! Larry James is 6.6 feet away. [MAN] RJ NOWITZKI MAKES IT!
Score: 49-36

[02:28] Team_099 possession (Score: 49-36)
Damian Ginobili attempts a 3Pt. Contested by Shaquille Booker (5.9 feet, ZONE). DAMIAN GINOBILI MAKES IT! Assist: Vince Lillard
Score: 52-36

[02:16] Team_012 possession (Score: 52-36)
RJ Nowitzki attempts a 3Pt. Contested by Ayo Barrett (5.6 feet, ZONE). RJ Nowitzki misses. Offensive rebound by Paolo Durant! Paolo Durant kicks it out.

[02:00] Team_012 possession (Score: 52-36)
Shaquille Booker attempts a 3Pt. Contested by Ayo Barrett (5.4 feet, ZONE). SHAQUILLE BOOKER MAKES IT! Assist: RJ Nowitzki
Score: 52-39

[01:43] Team_099 possession (Score: 52-39)
Larry Wade drives, Ayo McGrady stays with him. Larry Wade attempts a Layup. Wide open! Ayo McGrady is 6.2 feet away. [MAN] LARRY WADE MAKES IT! Assist: Larry James
Score: 54-39

[01:29] Team_012 possession (Score: 54-39)
Paolo Durant drives, Vince Lillard stays with him. Paolo Durant attempts a Dunk. Contested by Vince Lillard (5.2 feet, MAN). Paolo Durant misses. Offensive rebound by Paolo Durant! Paolo Durant kicks it out.

[01:18] Team_012 possession (Score: 54-39)
RJ Nowitzki attempts a 3Pt. Wide open! Larry James is 6.8 feet away. [MAN] RJ Nowitzki misses. Rebound secured by Larry Wade.

[01:00] Team_099 possession (Score: 54-39)
FOUL! Shooting foul on Paolo Durant. Larry Wade to the line for 2 free throws. [BONUS: 8 team fouls] (Paolo Durant: 4 personal fouls)   FT 1/2: GOOD   FT 2/2: GOOD Larry Wade makes 2/2 from the line.
Score: 56-39

[00:42] Team_012 possession (Score: 56-39)
Ayo McGrady makes the Layup and draws the foul on Vince Lillard! And-1! Ayo McGrady to the line for 1. [Team fouls: 3] (Vince Lillard: 2 personal fouls)   FT 1/1: GOOD Ayo McGrady makes 1/1 from the line.
Score: 56-42

[00:30] Team_099 possession (Score: 56-42)
FOUL! Shooting foul on RJ Nowitzki. Vince Lillard to the line for 3 free throws. [BONUS: 9 team fouls] (RJ Nowitzki: 1 personal fouls)   FT 1/3: GOOD   FT 2/3: GOOD   FT 3/3: GOOD Vince Lillard makes 3/3 from the line.
Score: 59-42

[00:18] Team_012 possession (Score: 59-42)
RJ Nowitzki drives, Vince Lillard stays with him. RJ Nowitzki attempts a Dunk. Contested by Vince Lillard (5.5 feet, ZONE). RJ NOWITZKI MAKES IT! Assist: Ayo McGrady
Score: 59-44

================================================================================
                              2ND QUARTER COMPLETE                              
================================================================================

2ND QUARTER SCORE: Team_099 31, Team_012 26

BOX SCORE:
================================================================================

Team_099
--------------------------------------------------------------------------------
Player                MIN  PTS  REB  AST  TO      FG   FG%      3P   3P%
--------------------------------------------------------------------------------
Larry Wade             24   14    5    1   0   7/8    87.5     0/0   0.0
Damian Ginobili        24   11    1    1   0   4/7    57.1     0/0   0.0
Vince Lillard          24    3    4    2   0   1/1   100.0     0/0   0.0
Ayo Barrett            24    2    0    1   0   1/4    25.0     0/0   0.0
Larry James            24    0    0    1   0   0/1     0.0     0/0   0.0

TEAM: FG: 13/21 (61.9%), 3PT: 3/6 (50.0%), REB: 10 (1 off, 9 def), AST: 6, TO: 2
TEAM FOULS: 3


Team_012
--------------------------------------------------------------------------------
Player                MIN  PTS  REB  AST  TO      FG   FG%      3P   3P%
--------------------------------------------------------------------------------
Paolo Durant           24    8    8    1   0   4/5    80.0     0/0   0.0
RJ Nowitzki            24    6    1    1   0   3/6    50.0     0/0   0.0
Shaquille Booker       24    5    0    0   0   2/4    50.0     0/0   0.0
Ayo McGrady            24    5    1    2   0   2/4    50.0     0/0   0.0
Pascal Herro           24    2    0    1   0   1/2    50.0     0/0   0.0

TEAM: FG: 12/21 (57.1%), 3PT: 1/4 (25.0%), REB: 10 (3 off, 7 def), AST: 5, TO: 2
TEAM FOULS: 9 [Team_099 in BONUS]

================================================================================

================================================================================
                       3RD QUARTER - Team_099 vs Team_012                       
================================================================================

[12:00] Team_099 possession (Score: 59-44)
FOUL! Offensive foul on Vince Lillard! Paolo Durant drew the charge! [Team fouls: 1] (Vince Lillard: 1 personal fouls) TURNOVER! (dead ball)

[11:44] Team_012 possession (Score: 59-44)
Paolo Durant drives to the basket... Paolo Durant loses control! Ball rolls out of bounds! TURNOVER! (dead ball)

[11:28] Team_099 possession (Score: 59-44)
FOUL! Reach-in foul on Paolo Durant during the drive. [Team fouls: 1] No free throws, side out. (Paolo Durant: 1 personal fouls)

[11:13] Team_099 possession (Score: 59-44)
Larry James drives, Paolo Durant stays with him. Larry James attempts a Layup. Contested by Paolo Durant (3.6 feet, ZONE). LARRY JAMES MAKES IT! Assist: Vince Lillard
Score: 61-44

[10:55] Team_012 possession (Score: 61-44)
FOUL! Shooting foul on Ayo Barrett. Paolo Durant to the line for 3 free throws. [Team fouls: 2] (Ayo Barrett: 1 personal fouls)   FT 1/3: GOOD   FT 2/3: GOOD   FT 3/3: GOOD Paolo Durant makes 3/3 from the line.
Score: 61-47

[10:39] Team_099 possession (Score: 61-47)
Damian Ginobili drives to the basket... Damian Ginobili commits a violation (traveling/carry)! TURNOVER! (dead ball)

[10:29] Team_012 possession (Score: 61-47)
RJ Nowitzki attempts a 3Pt. Contested by Ayo Barrett (4.1 feet, ZONE). RJ NOWITZKI MAKES IT! Assist: Shaquille Booker
Score: 61-50

[10:11] Team_099 possession (Score: 61-50)
Vince Lillard attempts a Midrange. Contested by Paolo Durant (3.6 feet, MAN). Vince Lillard misses. Rebound secured by Ayo McGrady.

[09:55] Team_012 possession (Score: 61-50)
Paolo Durant drives to the basket... Paolo Durant throws a bad pass! Stolen by Vince Lillard! TURNOVER! (live ball)

[09:42] Team_099 possession (Score: 61-50)
Vince Lillard attempts a Midrange. Contested by Paolo Durant (3.6 feet, MAN). Vince Lillard misses. Rebound secured by Ayo McGrady.

[09:32] Team_012 possession (Score: 61-50)
RJ Nowitzki attempts a Midrange. Contested by Larry James (5.4 feet, MAN). RJ NOWITZKI MAKES IT!
Score: 61-52

[09:22] Team_099 possession (Score: 61-52)
Larry James attempts a 3Pt. Contested by Shaquille Booker (4.1 feet, ZONE). LARRY JAMES MAKES IT! Assist: Larry Wade
Score: 64-52

[09:08] Team_012 possession (Score: 64-52)
RJ Nowitzki attempts a Layup. Contested by Larry Wade (4.5 feet, ZONE). RJ Nowitzki misses. Rebound secured by Damian Ginobili.

[08:54] Team_099 possession (Score: 64-52)
FOUL! Shooting foul on RJ Nowitzki. Larry Wade to the line for 3 free throws. [Team fouls: 2] (RJ Nowitzki: 1 personal fouls)   FT 1/3: GOOD   FT 2/3: GOOD   FT 3/3: GOOD Larry Wade makes 3/3 from the line.
Score: 67-52

[08:38] Team_012 possession (Score: 67-52)
Ayo McGrady attempts a Layup. Contested by Larry Wade (4.2 feet, MAN). AYO MCGRADY MAKES IT! Assist: Shaquille Booker
Score: 67-54

[08:26] Team_099 possession (Score: 67-54)
Larry James attempts a 3Pt. Contested by RJ Nowitzki (3.5 feet, ZONE). LARRY JAMES MAKES IT! Assist: Vince Lillard
Score: 70-54

[08:14] Team_012 possession (Score: 70-54)
RJ Nowitzki drives and kicks out. Shaquille Booker attempts a Midrange. Contested by Damian Ginobili (3.5 feet, MAN). SHAQUILLE BOOKER MAKES IT!
Score: 70-56

[07:56] Team_099 possession (Score: 70-56)
Damian Ginobili drives, Shaquille Booker stays with him. Damian Ginobili attempts a Dunk. Contested by Shaquille Booker (4.2 feet, MAN). DAMIAN GINOBILI MAKES IT! Assist: Vince Lillard
Score: 72-56

[07:37] Team_012 possession (Score: 72-56)
Paolo Durant drives, Vince Lillard stays with him. Paolo Durant attempts a Dunk. Contested by Vince Lillard (2.6 feet, MAN). Paolo Durant misses. Rebound secured by Larry Wade.

[07:18] Team_099 possession (Score: 72-56)
FOUL! Reach-in foul on Ayo McGrady during the drive. [Team fouls: 3] No free throws, side out. (Ayo McGrady: 1 personal fouls)

[07:04] Team_099 possession (Score: 72-56)
Damian Ginobili attempts a Layup. Contested by Shaquille Booker (4.2 feet, MAN). DAMIAN GINOBILI MAKES IT!
Score: 74-56

[06:51] Team_012 possession (Score: 74-56)
Ayo McGrady drives and kicks out. Paolo Durant attempts a Midrange. Contested by Ayo Barrett (3.7 feet, ZONE). Paolo Durant misses. Rebound secured by Larry Wade.

[06:37] Team_099 possession (Score: 74-56)
FOUL! Shooting foul on Paolo Durant. Vince Lillard to the line for 2 free throws. [Team fouls: 4] (Paolo Durant: 2 personal fouls)   FT 1/2: GOOD   FT 2/2: GOOD Vince Lillard makes 2/2 from the line.
Score: 76-56

[06:20] Team_012 possession (Score: 76-56)
RJ Nowitzki attempts a Midrange. Contested by Damian Ginobili (3.9 feet, ZONE). RJ Nowitzki misses. FOUL! Loose ball foul on Larry Wade during the rebound battle. [Team fouls: 3] No free throws, side out. (Larry Wade: 1 personal fouls)

[06:02] Team_012 possession (Score: 76-56)
Paolo Durant attempts a Layup. BLOCKED BY VINCE LILLARD! Ball is loose! Rebound secured by Damian Ginobili.

[05:51] Team_099 possession (Score: 76-56)
Damian Ginobili attempts a Midrange. Contested by RJ Nowitzki (3.6 feet, ZONE). Damian Ginobili misses. Offensive rebound by Larry Wade! Larry Wade puts it back in!
Score: 78-56

[05:38] Team_012 possession (Score: 78-56)
Paolo Durant drives and kicks out. Pascal Herro attempts a Midrange. Contested by Larry James (5.1 feet, ZONE). Pascal Herro misses. Rebound secured by Vince Lillard.

[05:22] Team_099 possession (Score: 78-56)
Larry Wade attempts a 3Pt. Contested by RJ Nowitzki (3.7 feet, ZONE). Larry Wade misses. Offensive rebound by Vince Lillard! Vince Lillard's putback is no good. Rebound secured by RJ Nowitzki.

[05:07] Team_012 possession (Score: 78-56)
Ayo McGrady drives, picks up Vince Lillard. Help arrives from Ayo Barrett! Ayo McGrady attempts a Dunk. Contested by Ayo Barrett (2.5 feet, ZONE). AYO MCGRADY MAKES IT! Assist: Paolo Durant
Score: 78-58

[04:52] Team_099 possession (Score: 78-58)
Vince Lillard attempts a Layup. Contested by Paolo Durant (3.6 feet, ZONE). VINCE LILLARD MAKES IT! Assist: Larry James
Score: 80-58

[04:37] Team_012 possession (Score: 80-58)
Ayo McGrady attempts a Midrange. Contested by Larry Wade (4.3 feet, MAN). AYO MCGRADY MAKES IT! Assist: RJ Nowitzki
Score: 80-60

[04:24] Team_099 possession (Score: 80-60)
Vince Lillard attempts a 3Pt. Contested by RJ Nowitzki (3.5 feet, ZONE). Vince Lillard misses. Offensive rebound by Vince Lillard! Vince Lillard's putback is no good. Rebound secured by Paolo Durant.

[04:08] Team_012 possession (Score: 80-60)
FOUL! Offensive foul on Shaquille Booker! Damian Ginobili drew the charge! [Team fouls: 5] (Shaquille Booker: 1 personal fouls) TURNOVER! (dead ball)

[03:55] Team_099 possession (Score: 80-60)
Ayo Barrett attempts a Layup. Contested by Pascal Herro (5.2 feet, MAN). Ayo Barrett misses. Rebound secured by Paolo Durant.

[03:43] Team_012 possession (Score: 80-60)
Paolo Durant attempts a Midrange. BLOCKED BY VINCE LILLARD! Ball deflects out of bounds off Paolo Durant.

[03:33] Team_099 possession (Score: 80-60)
Vince Lillard drives to the basket... Vince Lillard loses the ball! Stripped by Paolo Durant! TURNOVER! (live ball)

[03:17] Team_012 possession (Score: 80-60)
Paolo Durant makes the Midrange and draws the foul on Vince Lillard! And-1! Paolo Durant to the line for 1. [Team fouls: 4] (Vince Lillard: 2 personal fouls)   FT 1/1: GOOD Paolo Durant makes 1/1 from the line.
Score: 80-63

[03:05] Team_099 possession (Score: 80-63)
FOUL! Holding foul on RJ Nowitzki. [IN THE BONUS! 6 team fouls] Larry James to the line for 2 free throws. (RJ Nowitzki: 2 personal fouls)   FT 1/2: GOOD   FT 2/2: GOOD Larry James makes 2/2 from the line.
Score: 82-63

[02:54] Team_012 possession (Score: 82-63)
Ayo McGrady attempts a Midrange. Contested by Larry Wade (4.4 feet, MAN). Ayo McGrady misses. Rebound secured by Larry Wade.

[02:41] Team_099 possession (Score: 82-63)
FOUL! Shooting foul on Paolo Durant. Ayo Barrett to the line for 2 free throws. [BONUS: 7 team fouls] (Paolo Durant: 3 personal fouls)   FT 1/2: GOOD   FT 2/2: GOOD Ayo Barrett makes 2/2 from the line.
Score: 84-63

[02:24] Team_012 possession (Score: 84-63)
RJ Nowitzki makes the 3Pt and draws the foul on Vince Lillard! And-1! RJ Nowitzki to the line for 1. [BONUS: 5 team fouls] (Vince Lillard: 3 personal fouls)   FT 1/1: GOOD RJ Nowitzki makes 1/1 from the line.
Score: 84-67

[02:12] Team_099 possession (Score: 84-67)
Vince Lillard drives, Paolo Durant stays with him. Vince Lillard attempts a Layup. Contested by Paolo Durant (3.9 feet, ZONE). Vince Lillard misses. Offensive rebound by Larry Wade! Larry Wade kicks it out.

[01:53] Team_099 possession (Score: 84-67)
Larry James attempts a 3Pt. Contested by RJ Nowitzki (3.8 feet, MAN). Larry James misses. Rebound secured by RJ Nowitzki.

[01:42] Team_012 possession (Score: 84-67)
Shaquille Booker attempts a Midrange. Contested by Damian Ginobili (3.8 feet, MAN). SHAQUILLE BOOKER MAKES IT! Assist: Pascal Herro
Score: 84-69

[01:29] Team_099 possession (Score: 84-69)
Larry James attempts a Layup. Contested by Paolo Durant (4.0 feet, ZONE). Larry James misses. Rebound secured by Ayo McGrady.

[01:17] Team_012 possession (Score: 84-69)
Ayo McGrady attempts a 3Pt. Contested by Damian Ginobili (3.9 feet, ZONE). Ayo McGrady misses. Rebound secured by Larry Wade.

[01:03] Team_099 possession (Score: 84-69)
Larry Wade attempts a Dunk. BLOCKED BY AYO MCGRADY! Ball is loose! Offensive rebound by Vince Lillard! Vince Lillard kicks it out.

[00:51] Team_099 possession (Score: 84-69)
FOUL! Shooting foul on Paolo Durant. Larry James to the line for 2 free throws. [BONUS: 8 team fouls] (Paolo Durant: 4 personal fouls)   FT 1/2: MISS   FT 2/2: GOOD Larry James makes 1/2 from the line.
Score: 85-69

[00:37] Team_012 possession (Score: 85-69)
RJ Nowitzki attempts a Layup. Contested by Larry James (5.7 feet, MAN). RJ Nowitzki misses. Rebound secured by Larry Wade.

[00:23] Team_099 possession (Score: 85-69)
Damian Ginobili attempts a 3Pt. Contested by Shaquille Booker (4.7 feet, MAN). DAMIAN GINOBILI MAKES IT! Assist: Vince Lillard
Score: 88-69

[00:13] Team_012 possession (Score: 88-69)
Pascal Herro attempts a 3Pt. Contested by Ayo Barrett (4.7 feet, MAN). Pascal Herro misses. Rebound secured by Larry Wade.

================================================================================
                              3RD QUARTER COMPLETE                              
================================================================================

3RD QUARTER SCORE: Team_099 29, Team_012 25

BOX SCORE:
================================================================================

Team_099
--------------------------------------------------------------------------------
Player                MIN  PTS  REB  AST  TO      FG   FG%      3P   3P%
--------------------------------------------------------------------------------
Larry James            36   11    0    1   0   5/7    71.4     0/0   0.0
Damian Ginobili        36    7    2    0   0   3/3   100.0     0/0   0.0
Larry Wade             36    5    8    1   0   2/3    66.7     0/0   0.0
Vince Lillard          36    4    2    4   0   2/5    40.0     0/0   0.0
Ayo Barrett            36    2    0    0   0   1/2    50.0     0/0   0.0

TEAM: FG: 13/20 (65.0%), 3PT: 4/7 (57.1%), REB: 14 (5 off, 9 def), AST: 6, TO: 3
TEAM FOULS: 5 [Team_012 in BONUS]


Team_012
--------------------------------------------------------------------------------
Player                MIN  PTS  REB  AST  TO      FG   FG%      3P   3P%
--------------------------------------------------------------------------------
RJ Nowitzki            36    9    3    1   0   3/5    60.0     0/0   0.0
Paolo Durant           36    6    2    1   0   2/6    33.3     0/0   0.0
Ayo McGrady            36    6    3    0   0   3/6    50.0     0/0   0.0
Shaquille Booker       36    4    0    2   0   2/2   100.0     0/0   0.0
Pascal Herro           36    0    0    1   0   0/1     0.0     0/0   0.0

TEAM: FG: 10/20 (50.0%), 3PT: 3/5 (60.0%), REB: 6 (1 off, 5 def), AST: 5, TO: 3
TEAM FOULS: 8 [Team_099 in BONUS]

================================================================================

================================================================================
                       4TH QUARTER - Team_099 vs Team_012                       
================================================================================

[12:00] Team_099 possession (Score: 88-69)
Ayo Barrett attempts a 3Pt. Contested by RJ Nowitzki (3.9 feet, ZONE). Ayo Barrett misses. Rebound secured by Paolo Durant.

[11:48] Team_012 possession (Score: 88-69)
Ayo McGrady drives and kicks out. RJ Nowitzki attempts a 3Pt. Contested by Ayo Barrett (4.1 feet, ZONE). RJ Nowitzki misses. Rebound secured by Larry Wade.

[11:30] Team_099 possession (Score: 88-69)
Larry Wade makes the Layup and draws the foul on Paolo Durant! And-1! Larry Wade to the line for 1. [Team fouls: 1] (Paolo Durant: 1 personal fouls)   FT 1/1: MISS Larry Wade makes 0/1 from the line. Rebound secured by RJ Nowitzki.
Score: 90-69

[11:17] Team_012 possession (Score: 90-69)
Pascal Herro attempts a Midrange. Contested by Ayo Barrett (4.6 feet, MAN). Pascal Herro misses. Offensive rebound by Paolo Durant! Paolo Durant puts it back in!
Score: 90-71

[11:02] Team_099 possession (Score: 90-71)
Larry Wade attempts a Midrange. Contested by Ayo McGrady (4.9 feet, ZONE). Larry Wade misses. Rebound secured by Paolo Durant.

[10:48] Team_012 possession (Score: 90-71)
Shaquille Booker attempts a 3Pt. Contested by Damian Ginobili (4.0 feet, MAN). Shaquille Booker misses. Rebound secured by Damian Ginobili.

[10:30] Team_099 possession (Score: 90-71)
Damian Ginobili drives, picks up Paolo Durant. Help arrives from RJ Nowitzki! Damian Ginobili attempts a Layup. Contested by RJ Nowitzki (4.2 feet, ZONE). Damian Ginobili misses. Rebound secured by RJ Nowitzki.

[10:18] Team_012 possession (Score: 90-71)
Pascal Herro loses control! Ball rolls out of bounds! TURNOVER! (dead ball)

[10:18] Substitution (Team_099): Ayo Barrett OUT → CJ Cunningham IN (stamina_rule2)

[10:18] Substitution (Team_099): Larry James OUT → Manu Johnson IN (stamina_rule2)

[10:18] Substitution (Team_099): Damian Ginobili OUT → Scottie Quickley IN (stamina_rule2)

[10:18] Substitution (Team_099): Vince Lillard OUT → Donovan Green IN (stamina_rule2)

[10:18] Substitution (Team_099): Larry Wade OUT → Jarrett Fox IN (stamina_rule2)

[10:18] Substitution (Team_012): Pascal Herro OUT → Desmond Irving IN (stamina_rule2)

[10:18] Substitution (Team_012): RJ Nowitzki OUT → Jalen Barnes IN (stamina_rule2)

[10:18] Substitution (Team_012): Shaquille Booker OUT → Domantas Bird IN (stamina_rule2)

[10:18] Substitution (Team_012): Paolo Durant OUT → Jimmy Quickley IN (stamina_rule2)

[10:18] Substitution (Team_012): Ayo McGrady OUT → Karl Young IN (stamina_rule2)

[10:06] Team_099 possession (Score: 90-71)
Scottie Quickley throws a bad pass! Stolen by Domantas Bird! TURNOVER! (live ball)

[09:47] Team_012 possession (Score: 90-71)
Domantas Bird attempts a 3Pt. Contested by Scottie Quickley (4.0 feet, MAN). DOMANTAS BIRD MAKES IT! Assist: Desmond Irving
Score: 90-74

[09:29] Team_099 possession (Score: 90-74)
Donovan Green attempts a 3Pt. Contested by Jimmy Quickley (5.0 feet, MAN). DONOVAN GREEN MAKES IT! Assist: CJ Cunningham
Score: 93-74

[09:12] Team_012 possession (Score: 93-74)
Domantas Bird attempts a 3Pt. Contested by Manu Johnson (4.8 feet, ZONE). Domantas Bird misses. Rebound secured by Jarrett Fox.

[08:58] Team_099 possession (Score: 93-74)
Scottie Quickley attempts a Layup. Contested by Karl Young (4.1 feet, ZONE). SCOTTIE QUICKLEY MAKES IT! Assist: CJ Cunningham
Score: 95-74

[08:45] Team_012 possession (Score: 95-74)
Desmond Irving attempts a Layup. Contested by Jarrett Fox (4.1 feet, ZONE). DESMOND IRVING MAKES IT!
Score: 95-76

[08:34] Team_099 possession (Score: 95-76)
Donovan Green attempts a Midrange. Contested by Jalen Barnes (5.4 feet, ZONE). Donovan Green misses. Offensive rebound by Jarrett Fox! Jarrett Fox's putback is no good. Rebound secured by Jalen Barnes.

[08:24] Team_012 possession (Score: 95-76)
Karl Young attempts a Midrange. Contested by CJ Cunningham (5.9 feet, ZONE). Karl Young misses. Offensive rebound by Karl Young! Karl Young's putback is no good. Rebound secured by Donovan Green.

[08:09] Team_099 possession (Score: 95-76)
FOUL! Reach-in foul on Jimmy Quickley during the drive. [Team fouls: 2] No free throws, side out. (Jimmy Quickley: 1 personal fouls)

[07:50] Team_099 possession (Score: 95-76)
FOUL! Offensive foul on Manu Johnson! Jalen Barnes drew the charge! [Team fouls: 1] (Manu Johnson: 1 personal fouls) TURNOVER! (dead ball)

[07:39] Team_012 possession (Score: 95-76)
Karl Young attempts a Layup. Contested by Jarrett Fox (4.1 feet, MAN). Karl Young misses. Offensive rebound by Jimmy Quickley! Jimmy Quickley kicks it out.

[07:26] Team_012 possession (Score: 95-76)
Karl Young loses control! Ball rolls out of bounds! TURNOVER! (dead ball)

[07:15] Team_099 possession (Score: 95-76)
Jarrett Fox makes the Dunk and draws the foul on Jimmy Quickley! And-1! Jarrett Fox to the line for 1. [Team fouls: 3] (Jimmy Quickley: 2 personal fouls)   FT 1/1: GOOD Jarrett Fox makes 1/1 from the line.
Score: 98-76

[07:05] Team_012 possession (Score: 98-76)
FOUL! Reach-in foul on Scottie Quickley during the drive. [Team fouls: 2] No free throws, side out. (Scottie Quickley: 1 personal fouls)

[06:49] Team_012 possession (Score: 98-76)
Jalen Barnes attempts a 3Pt. Contested by Manu Johnson (4.9 feet, ZONE). JALEN BARNES MAKES IT! Assist: Jimmy Quickley
Score: 98-79

[06:39] Team_099 possession (Score: 98-79)
FOUL! Shooting foul on Jalen Barnes. CJ Cunningham to the line for 2 free throws. [Team fouls: 4] (Jalen Barnes: 1 personal fouls)   FT 1/2: MISS   FT 2/2: MISS CJ Cunningham makes 0/2 from the line. Rebound secured by Jimmy Quickley.

[06:24] Team_012 possession (Score: 98-79)
Domantas Bird attempts a 3Pt. Contested by Scottie Quickley (4.0 feet, MAN). Domantas Bird misses. Rebound secured by Donovan Green.

[06:11] Team_099 possession (Score: 98-79)
Jarrett Fox attempts a Layup. Contested by Jimmy Quickley (5.4 feet, ZONE). Jarrett Fox misses. Rebound secured by Jalen Barnes.

[05:57] Team_012 possession (Score: 98-79)
Jalen Barnes attempts a Layup. Contested by Donovan Green (3.9 feet, ZONE). Jalen Barnes misses. Rebound secured by Scottie Quickley.

[05:46] Team_099 possession (Score: 98-79)
Scottie Quickley attempts a Midrange. Contested by Jalen Barnes (5.6 feet, ZONE). SCOTTIE QUICKLEY MAKES IT! Assist: CJ Cunningham
Score: 100-79

[05:31] Team_012 possession (Score: 100-79)
Jimmy Quickley drives and kicks out. Domantas Bird attempts a 3Pt. Contested by Manu Johnson (4.9 feet, ZONE). DOMANTAS BIRD MAKES IT! Assist: Jimmy Quickley
Score: 100-82

[05:16] Team_099 possession (Score: 100-82)
FOUL! Reach-in foul on Domantas Bird during the drive. [IN THE BONUS! 5 team fouls] Scottie Quickley to the line for 2 free throws. (Domantas Bird: 1 personal fouls)   FT 1/2: GOOD   FT 2/2: GOOD Scottie Quickley makes 2/2 from the line.
Score: 102-82

[05:02] Team_012 possession (Score: 102-82)
Karl Young drives to the basket... Karl Young throws a bad pass! Stolen by Jarrett Fox! TURNOVER! (live ball)

[04:46] Team_099 possession (Score: 102-82)
Jarrett Fox attempts a Layup. Contested by Karl Young (4.3 feet, MAN). Jarrett Fox misses. Rebound secured by Jalen Barnes.

[04:32] Team_012 possession (Score: 102-82)
Desmond Irving attempts a 3Pt. Contested by CJ Cunningham (5.9 feet, MAN). DESMOND IRVING MAKES IT!
Score: 102-85

[04:20] Team_099 possession (Score: 102-85)
Donovan Green throws a bad pass out of bounds! TURNOVER! (dead ball)

[04:07] Team_012 possession (Score: 102-85)
Jimmy Quickley attempts a Midrange. Contested by Donovan Green (4.1 feet, MAN). Jimmy Quickley misses. Rebound secured by Jarrett Fox.

[03:51] Team_099 possession (Score: 102-85)
CJ Cunningham attempts a 3Pt. Contested by Desmond Irving (4.7 feet, ZONE). CJ CUNNINGHAM MAKES IT! Assist: Manu Johnson
Score: 105-85

[03:34] Team_012 possession (Score: 105-85)
Jimmy Quickley attempts a 3Pt. Contested by Donovan Green (4.1 feet, MAN). Jimmy Quickley misses. Rebound secured by Scottie Quickley.

[03:21] Team_099 possession (Score: 105-85)
Donovan Green attempts a Midrange. BLOCKED BY JIMMY QUICKLEY! Ball is loose! Offensive rebound by Donovan Green! Donovan Green kicks it out.

[03:10] Team_099 possession (Score: 105-85)
Manu Johnson attempts a 3Pt. Contested by Domantas Bird (5.3 feet, ZONE). MANU JOHNSON MAKES IT!
Score: 108-85

[02:53] Team_012 possession (Score: 108-85)
Karl Young attempts a Layup. BLOCKED BY JARRETT FOX! Ball goes out off Jarrett Fox. Karl Young's ball!

[02:41] Team_012 possession (Score: 108-85)
Jimmy Quickley attempts a 3Pt. Contested by Manu Johnson (5.2 feet, ZONE). Jimmy Quickley misses. Rebound secured by Donovan Green.

[02:31] Team_099 possession (Score: 108-85)
Scottie Quickley attempts a Midrange. Contested by Domantas Bird (5.5 feet, MAN). Scottie Quickley misses. Rebound secured by Jimmy Quickley.

[02:17] Team_012 possession (Score: 108-85)
Jimmy Quickley attempts a Midrange. Contested by Donovan Green (4.2 feet, MAN). Jimmy Quickley misses. Rebound secured by Scottie Quickley.

[02:05] Team_099 possession (Score: 108-85)
Manu Johnson drives and kicks out. Scottie Quickley attempts a 3Pt. Contested by Domantas Bird (5.3 feet, MAN). Scottie Quickley misses. Rebound secured by Karl Young.

[01:45] Team_012 possession (Score: 108-85)
Jalen Barnes drives, picks up Jarrett Fox. Help arrives from Manu Johnson! Jalen Barnes attempts a Dunk. Contested by Manu Johnson (4.3 feet, ZONE). Jalen Barnes misses. Rebound secured by Donovan Green.

[01:30] Team_099 possession (Score: 108-85)
Manu Johnson attempts a 3Pt. Contested by Desmond Irving (4.8 feet, ZONE). MANU JOHNSON MAKES IT! Assist: Scottie Quickley
Score: 111-85

[01:16] Team_012 possession (Score: 111-85)
Domantas Bird attempts a Layup. Contested by Scottie Quickley (4.2 feet, MAN). Domantas Bird misses. Rebound secured by Donovan Green.

[01:02] Team_099 possession (Score: 111-85)
Scottie Quickley drives, picks up Domantas Bird. Help arrives from Jalen Barnes! Scottie Quickley attempts a Layup. Contested by Jalen Barnes (5.6 feet, MAN). Scottie Quickley misses. Rebound secured by Jimmy Quickley.

[00:46] Team_012 possession (Score: 111-85)
Jimmy Quickley attempts a Layup. Contested by Jarrett Fox (4.6 feet, ZONE). Jimmy Quickley misses. Rebound secured by Jarrett Fox.

[00:29] Team_099 possession (Score: 111-85)
Jarrett Fox attempts a 3Pt. Contested by Desmond Irving (5.2 feet, ZONE). Jarrett Fox misses. Rebound secured by Jimmy Quickley.

[00:13] Team_012 possession (Score: 111-85)
Karl Young attempts a Layup. Contested by Jarrett Fox (4.5 feet, ZONE). Karl Young misses. Rebound secured by Scottie Quickley.

================================================================================
                              4TH QUARTER COMPLETE                              
================================================================================

4TH QUARTER SCORE: Team_099 23, Team_012 16

BOX SCORE:
================================================================================

Team_099
--------------------------------------------------------------------------------
Player                MIN  PTS  REB  AST  TO      FG   FG%      3P   3P%
--------------------------------------------------------------------------------
Scottie Quickley       10    6    4    1   0   3/5    60.0     0/0   0.0
Manu Johnson           10    6    0    1   0   2/3    66.7     0/0   0.0
Donovan Green          10    3    6    0   0   1/2    50.0     0/0   0.0
CJ Cunningham          10    3    0    3   0   1/2    50.0     0/0   0.0
Jarrett Fox            10    3    3    0   0   1/4    25.0     0/0   0.0
Ayo Barrett            38    0    0    0   0   0/1     0.0     0/0   0.0
Larry Wade             38    0    1    0   0   0/2     0.0     0/0   0.0
Damian Ginobili        38    0    1    0   0   0/1     0.0     0/0   0.0

TEAM: FG: 8/20 (40.0%), 3PT: 4/6 (66.7%), REB: 15 (2 off, 13 def), AST: 5, TO: 3
TEAM FOULS: 2


Team_012
--------------------------------------------------------------------------------
Player                MIN  PTS  REB  AST  TO      FG   FG%      3P   3P%
--------------------------------------------------------------------------------
Domantas Bird          10    6    0    0   0   2/5    40.0     0/0   0.0
Desmond Irving         10    5    0    1   0   2/2   100.0     0/0   0.0
Jalen Barnes           10    3    3    0   0   1/3    33.3     0/0   0.0
Paolo Durant           38    2    3    0   0   1/1   100.0     0/0   0.0
Ayo McGrady            38    0    0    0   0   0/1     0.0     0/0   0.0
RJ Nowitzki            38    0    2    0   0   0/0     0.0     0/0   0.0
Shaquille Booker       38    0    0    0   0   0/1     0.0     0/0   0.0
Karl Young             10    0    1    0   0   0/2     0.0     0/0   0.0
Jimmy Quickley         10    0    5    2   0   0/5     0.0     0/0   0.0

TEAM: FG: 6/20 (30.0%), 3PT: 3/8 (37.5%), REB: 14 (3 off, 11 def), AST: 3, TO: 3
TEAM FOULS: 6 [Team_099 in BONUS]

================================================================================

================================================================================
                               FULL GAME COMPLETE                               
================================================================================

FINAL SCORE: Team_099 111, Team_012 85

SCORING BY QUARTER:
--------------------------------------------------------------------------------
Team                     Q1     Q2     Q3     Q4    FINAL
--------------------------------------------------------------------------------
Team_099                 28     31     29     23      111
Team_012                 18     26     25     16       85
--------------------------------------------------------------------------------

FULL GAME BOX SCORE:
================================================================================

Team_099
--------------------------------------------------------------------------------
Player                MIN  PTS  REB  AST  TO      FG   FG%      3P   3P%      FT STL BLK
--------------------------------------------------------------------------------
Ayo Barrett            38   13    0    2   2   6/13   46.2   1/5    20.0   4/4     0   0
Larry James            38   18    0    3   1   7/12   58.3   3/5    60.0   7/8     0   0
Damian Ginobili        38   21    9    1   0   9/14   64.3   3/3   100.0   2/2     1   1
Vince Lillard          38   12   10    8   4   5/8    62.5   1/2    50.0   7/8     1   6
Larry Wade             38   21   19    2   2   9/17   52.9   1/3    33.3   7/9     0   0
CJ Cunningham          10    3    0    3   0   1/2    50.0   1/1   100.0   0/2     0   0
Manu Johnson           10    6    0    1   1   2/3    66.7   2/2   100.0   0/0     0   0
Scottie Quickley       10    6    4    1   1   3/5    60.0   0/0     0.0   2/2     0   0
Donovan Green          10    3    6    0   1   1/2    50.0   1/1   100.0   0/0     0   0
Jarrett Fox            10    3    3    0   0   1/4    25.0   0/1     0.0   1/1     1   1

TEAM: FG: 45/81 (55.6%), 3PT: 13/23 (56.5%), REB: 55 (12 off, 43 def), AST: 21, TO: 12


Team_012
--------------------------------------------------------------------------------
Player                MIN  PTS  REB  AST  TO      FG   FG%      3P   3P%      FT STL BLK
--------------------------------------------------------------------------------
Pascal Herro           38    5    0    3   3   3/9    33.3   1/6    16.7   0/0     2   0
RJ Nowitzki            38   20   11    2   0  10/19   52.6   3/7    42.9   1/1     0   1
Shaquille Booker       38    9    0    4   3   4/9    44.4   1/5    20.0   0/0     0   0
Paolo Durant           38   18   16    2   1   6/13   46.2   1/1   100.0   6/6     2   0
Ayo McGrady            38   18    7    3   0   7/16   43.8   0/1     0.0   5/6     1   1
Desmond Irving         10    5    0    1   0   2/2   100.0   1/1   100.0   0/0     0   0
Jalen Barnes           10    3    3    0   1   1/3    33.3   1/1   100.0   0/0     0   0
Domantas Bird          10    6    0    0   0   1/4    25.0   1/3    33.3   0/0     1   0
Jimmy Quickley         10    0    5    2   0   1/6    16.7   0/2     0.0   0/0     0   1
Karl Young             10    0    1    0   1   0/2     0.0   0/0     0.0   0/0     0   0

TEAM: FG: 35/83 (42.2%), 3PT: 9/27 (33.3%), REB: 39 (10 off, 29 def), AST: 17, TO: 9

================================================================================
