================================================================================
                        FULL GAME - Team_063 vs Team_074                        
================================================================================

================================================================================
                       1ST QUARTER - Team_063 vs Team_074                       
================================================================================

[12:00] Team_063 possession (Score: 0-0)
FOUL! Shooting foul on Chris Carter. Malcolm Quickley to the line for 2 free throws. [Team fouls: 1] (Chris Carter: 1 personal fouls)   FT 1/2: GOOD   FT 2/2: MISS Malcolm Quickley makes 1/2 from the line. Offensive rebound by Dirk Reaves! Dirk Reaves's putback is no good.
Score: 1-0

[11:49] Team_074 possession (Score: 1-0)
Dwyane Quickley attempts a Midrange. Contested by Bradley Davis (5.2 feet, MAN). Dwyane Quickley misses. Rebound secured by Malcolm Quickley.

[11:33] Team_063 possession (Score: 1-0)
Terry Reaves attempts a Midrange. Contested by Shai Green (3.8 feet, MAN). TERRY REAVES MAKES IT! Assist: Bradley Davis
Score: 3-0

[11:21] Team_074 possession (Score: 3-0)
Shai Green attempts a Midrange. Contested by Terry Reaves (5.1 feet, MAN). Shai Green misses. Rebound secured by Malcolm Quickley.

[11:03] Team_063 possession (Score: 3-0)
FOUL! Reach-in foul on Chris Carter during the drive. [Team fouls: 2] No free throws, side out. (Chris Carter: 2 personal fouls)

[10:50] Team_063 possession (Score: 3-0)
Malcolm Quickley drives to the basket... Malcolm Quickley loses the ball! Stripped by Donovan Doncic! TURNOVER! (live ball)

[10:34] Team_074 possession (Score: 3-0)
FOUL! Shooting foul on Terry Reaves. Shai Green to the line for 2 free throws. [Team fouls: 1] (Terry Reaves: 1 personal fouls)   FT 1/2: GOOD   FT 2/2: GOOD Shai Green makes 2/2 from the line.
Score: 3-2

[10:19] Team_063 possession (Score: 3-2)
FOUL! Shooting foul on Donovan Doncic. Bradley Davis to the line for 2 free throws. [Team fouls: 3] (Donovan Doncic: 1 personal fouls)   FT 1/2: MISS   FT 2/2: GOOD Bradley Davis makes 1/2 from the line.
Score: 4-2

[10:01] Team_074 possession (Score: 4-2)
Donovan Doncic makes the Dunk and draws the foul on Dirk Reaves! And-1! Donovan Doncic to the line for 1. [Team fouls: 2] (Dirk Reaves: 1 personal fouls)   FT 1/1: GOOD Donovan Doncic makes 1/1 from the line.
Score: 4-5

[09:45] Team_063 possession (Score: 4-5)
Terry Reaves attempts a 3Pt. Contested by Shai Green (3.8 feet, MAN). Terry Reaves misses. Offensive rebound by Dirk Reaves! Dirk Reaves puts it back in!
Score: 6-5

[09:35] Team_074 possession (Score: 6-5)
Donovan Doncic makes the Layup and draws the foul on Malcolm Quickley! And-1! Donovan Doncic to the line for 1. [Team fouls: 3] (Malcolm Quickley: 1 personal fouls)   FT 1/1: GOOD Donovan Doncic makes 1/1 from the line.
Score: 6-8

[09:23] Team_063 possession (Score: 6-8)
Terry Reaves attempts a 3Pt. Contested by Shai Green (3.8 feet, MAN). Terry Reaves misses. Offensive rebound by Dirk Reaves! Dirk Reaves's putback is no good. Rebound secured by Shai Green.

[09:10] Team_074 possession (Score: 6-8)
Dwyane Quickley attempts a 3Pt. Contested by Malcolm Quickley (3.8 feet, ZONE). Dwyane Quickley misses. Rebound secured by Dirk Reaves.

[08:53] Team_063 possession (Score: 6-8)
Malcolm Quickley attempts a Midrange. Contested by Chris Carter (4.0 feet, MAN). Malcolm Quickley misses. Rebound secured by Donovan Doncic.

[08:35] Team_074 possession (Score: 6-8)
Shai Green attempts a 3Pt. Contested by Terry Reaves (5.1 feet, MAN). Shai Green misses. Rebound secured by Tyler Harris.

[08:20] Team_063 possession (Score: 6-8)
Bradley Davis makes the Midrange and draws the foul on Dwyane Quickley! And-1! Bradley Davis to the line for 1. [Team fouls: 4] (Dwyane Quickley: 1 personal fouls)   FT 1/1: GOOD Bradley Davis makes 1/1 from the line.
Score: 9-8

[08:08] Team_074 possession (Score: 9-8)
Chris Carter makes the Midrange and draws the foul on Tyler Harris! And-1! Chris Carter to the line for 1. [Team fouls: 4] (Tyler Harris: 1 personal fouls)   FT 1/1: GOOD Chris Carter makes 1/1 from the line.
Score: 9-11

[07:56] Team_063 possession (Score: 9-11)
Bradley Davis attempts a Midrange. Contested by Shai Green (3.7 feet, ZONE). Bradley Davis misses. Rebound secured by Shai Green.

[07:41] Team_074 possession (Score: 9-11)
FOUL! Holding foul on Bradley Davis. [IN THE BONUS! 5 team fouls] Dwyane Quickley to the line for 2 free throws. (Bradley Davis: 1 personal fouls)   FT 1/2: MISS   FT 2/2: MISS Dwyane Quickley makes 0/2 from the line. Rebound secured by Dirk Reaves.

[07:23] Team_063 possession (Score: 9-11)
Bradley Davis attempts a 3Pt. Contested by Dwyane Quickley (5.6 feet, ZONE). BRADLEY DAVIS MAKES IT! Assist: Malcolm Quickley
Score: 12-11

[07:07] Team_074 possession (Score: 12-11)
Dwyane Quickley attempts a 3Pt. Contested by Bradley Davis (5.2 feet, MAN). Dwyane Quickley misses. Rebound secured by Tyler Harris.

[06:52] Team_063 possession (Score: 12-11)
Malcolm Quickley attempts a Layup. Contested by Donovan Doncic (3.5 feet, ZONE). MALCOLM QUICKLEY MAKES IT! Assist: Bradley Davis
Score: 14-11

[06:42] Team_074 possession (Score: 14-11)
Chris Carter attempts a 3Pt. Contested by Malcolm Quickley (4.2 feet, ZONE). Chris Carter misses. Rebound secured by Dirk Reaves.

[06:29] Team_063 possession (Score: 14-11)
Tyler Harris attempts a Midrange. Contested by James Turner (3.3 feet, MAN). TYLER HARRIS MAKES IT!
Score: 16-11

[06:14] Team_074 possession (Score: 16-11)
FOUL! Shooting foul on Malcolm Quickley. Chris Carter to the line for 2 free throws. [BONUS: 6 team fouls] (Malcolm Quickley: 2 personal fouls)   FT 1/2: MISS   FT 2/2: GOOD Chris Carter makes 1/2 from the line.
Score: 16-12

[06:00] Team_063 possession (Score: 16-12)
Terry Reaves attempts a Midrange. Contested by Shai Green (3.8 feet, ZONE). TERRY REAVES MAKES IT!
Score: 18-12

[05:47] Team_074 possession (Score: 18-12)
Chris Carter attempts a 3Pt. Contested by Malcolm Quickley (4.2 feet, ZONE). Chris Carter misses. Rebound secured by Tyler Harris.

[05:35] Team_063 possession (Score: 18-12)
Dirk Reaves loses control! Ball rolls out of bounds! TURNOVER! (dead ball)

[05:21] Team_074 possession (Score: 18-12)
Dwyane Quickley makes the Layup and draws the foul on Bradley Davis! And-1! Dwyane Quickley to the line for 1. [BONUS: 7 team fouls] (Bradley Davis: 2 personal fouls)   FT 1/1: MISS Dwyane Quickley makes 0/1 from the line. Offensive rebound by James Turner! James Turner's putback is no good.
Score: 18-14

[05:06] Team_063 possession (Score: 18-14)
Tyler Harris attempts a 3Pt. Contested by Chris Carter (4.2 feet, ZONE). Tyler Harris misses. Rebound secured by Shai Green.

[04:48] Team_074 possession (Score: 18-14)
Dwyane Quickley attempts a Layup. Contested by Bradley Davis (5.2 feet, MAN). Dwyane Quickley misses. Offensive rebound by James Turner! James Turner's putback is no good. Offensive rebound by Donovan Doncic! Donovan Doncic kicks it out.

[04:30] Team_074 possession (Score: 18-14)
Chris Carter attempts a 3Pt. Contested by Malcolm Quickley (4.2 feet, MAN). Chris Carter misses. Rebound secured by Malcolm Quickley.

[04:16] Team_063 possession (Score: 18-14)
Tyler Harris attempts a Layup. Contested by James Turner (3.4 feet, MAN). TYLER HARRIS MAKES IT!
Score: 20-14

[04:00] Team_074 possession (Score: 20-14)
Dwyane Quickley drives to the basket... Dwyane Quickley throws a bad pass out of bounds! TURNOVER! (dead ball)

[03:47] Team_063 possession (Score: 20-14)
Tyler Harris attempts a Layup. Contested by James Turner (3.4 feet, MAN). TYLER HARRIS MAKES IT!
Score: 22-14

[03:33] Team_074 possession (Score: 22-14)
Donovan Doncic makes the Dunk and draws the foul on Malcolm Quickley! And-1! Donovan Doncic to the line for 1. [BONUS: 9 team fouls] (Malcolm Quickley: 4 personal fouls)   FT 1/1: GOOD Donovan Doncic makes 1/1 from the line.
Score: 22-17

[03:18] Team_063 possession (Score: 22-17)
Malcolm Quickley drives and kicks out. Tyler Harris attempts a 3Pt. Contested by Dwyane Quickley (5.6 feet, ZONE). TYLER HARRIS MAKES IT! Assist: Terry Reaves
Score: 25-17

[03:05] Team_074 possession (Score: 25-17)
James Turner drives, Tyler Harris stays with him. James Turner attempts a Dunk. Contested by Tyler Harris (5.3 feet, MAN). JAMES TURNER MAKES IT!
Score: 25-19

[02:46] Team_063 possession (Score: 25-19)
Tyler Harris attempts a Layup. Contested by James Turner (3.5 feet, ZONE). TYLER HARRIS MAKES IT!
Score: 27-19

[02:29] Team_074 possession (Score: 27-19)
Chris Carter attempts a 3Pt. Contested by Malcolm Quickley (4.4 feet, ZONE). Chris Carter misses. Rebound secured by Tyler Harris.

[02:12] Team_063 possession (Score: 27-19)
Bradley Davis drives and kicks out. Bradley Davis attempts a Midrange. Contested by James Turner (3.7 feet, ZONE). Bradley Davis misses. Rebound secured by Shai Green.

[01:59] Team_074 possession (Score: 27-19)
Chris Carter attempts a 3Pt. Contested by Malcolm Quickley (4.4 feet, ZONE). Chris Carter misses. Rebound secured by Dirk Reaves.

[01:46] Team_063 possession (Score: 27-19)
Bradley Davis attempts a Midrange. Contested by Dwyane Quickley (5.9 feet, MAN). Bradley Davis misses. FOUL! Loose ball foul on James Turner during the rebound battle. [IN THE BONUS! 5 team fouls] Dirk Reaves to the line for 2 free throws. (James Turner: 1 personal fouls)   FT 1/2: GOOD   FT 2/2: GOOD Dirk Reaves makes 2/2 from the line.
Score: 29-19

[01:29] Team_074 possession (Score: 29-19)
Donovan Doncic attempts a 3Pt. Contested by Dirk Reaves (4.4 feet, MAN). Donovan Doncic misses. Rebound secured by Malcolm Quickley.

[01:17] Team_063 possession (Score: 29-19)
FOUL! Offensive foul on Tyler Harris! James Turner drew the charge! [Team fouls: 10] (Tyler Harris: 2 personal fouls) TURNOVER! (dead ball)

[01:01] Team_074 possession (Score: 29-19)
James Turner attempts a Midrange. Contested by Malcolm Quickley (4.5 feet, ZONE). JAMES TURNER MAKES IT!
Score: 29-21

[00:46] Team_063 possession (Score: 29-21)
Tyler Harris drives, picks up Donovan Doncic. Help arrives from Chris Carter! Tyler Harris attempts a Dunk. Contested by Chris Carter (3.9 feet, ZONE). TYLER HARRIS MAKES IT! Assist: Terry Reaves
Score: 31-21

[00:30] Team_074 possession (Score: 31-21)
Donovan Doncic drives, Dirk Reaves stays with him. Donovan Doncic attempts a Layup. Contested by Dirk Reaves (4.6 feet, MAN). Donovan Doncic misses. Rebound secured by Malcolm Quickley.

[00:11] Team_063 possession (Score: 31-21)
Dirk Reaves attempts a 3Pt. Contested by Donovan Doncic (4.3 feet, MAN). Dirk Reaves misses. Rebound secured by Donovan Doncic.

================================================================================
                              1ST QUARTER COMPLETE                              
================================================================================

1ST QUARTER SCORE: Team_063 31, Team_074 21

BOX SCORE:
================================================================================

Team_063
--------------------------------------------------------------------------------
Player                MIN  PTS  REB  AST  TO      FG   FG%      3P   3P%
--------------------------------------------------------------------------------
Tyler Harris           12   13    4    0   0   6/7    85.7     0/0   0.0
Bradley Davis          12    7    0    2   0   3/5    60.0     0/0   0.0
Dirk Reaves            12    4    6    0   0   2/3    66.7     0/0   0.0
Terry Reaves           12    4    0    2   0   2/3    66.7     0/0   0.0
Malcolm Quickley       12    2    5    1   0   1/3    33.3     0/0   0.0

TEAM: FG: 14/21 (66.7%), 3PT: 2/5 (40.0%), REB: 16 (2 off, 14 def), AST: 5, TO: 3
TEAM FOULS: 10 [Team_074 in BONUS]


Team_074
--------------------------------------------------------------------------------
Player                MIN  PTS  REB  AST  TO      FG   FG%      3P   3P%
--------------------------------------------------------------------------------
Donovan Doncic         12    9    3    0   0   3/5    60.0     0/0   0.0
Chris Carter           12    4    0    0   0   2/7    28.6     0/0   0.0
James Turner           12    4    1    0   0   2/2   100.0     0/0   0.0
Shai Green             12    2    4    0   0   1/3    33.3     0/0   0.0
Dwyane Quickley        12    0    0    0   0   0/4     0.0     0/0   0.0

TEAM: FG: 8/22 (36.4%), 3PT: 0/9 (0.0%), REB: 7 (1 off, 6 def), AST: 0, TO: 1
TEAM FOULS: 5 [Team_063 in BONUS]

================================================================================

================================================================================
                       2ND QUARTER - Team_063 vs Team_074                       
================================================================================

[12:00] Team_063 possession (Score: 31-21)
Bradley Davis attempts a 3Pt. Contested by Dwyane Quickley (5.8 feet, ZONE). Bradley Davis misses. Rebound secured by Shai Green.

[11:49] Team_074 possession (Score: 31-21)
Shai Green attempts a 3Pt. Contested by Terry Reaves (5.4 feet, MAN). Shai Green misses. FOUL! Loose ball foul on Dirk Reaves during the rebound battle. [Team fouls: 1] No free throws, side out. (Dirk Reaves: 1 personal fouls)

[11:36] Team_074 possession (Score: 31-21)
Dwyane Quickley attempts a 3Pt. Contested by Malcolm Quickley (4.1 feet, ZONE). Dwyane Quickley misses. FOUL! Loose ball foul on Tyler Harris during the rebound battle. [Team fouls: 2] No free throws, side out. (Tyler Harris: 1 personal fouls)

[11:19] Team_074 possession (Score: 31-21)
FOUL! Shooting foul on Dirk Reaves. Dwyane Quickley to the line for 3 free throws. [Team fouls: 3] (Dirk Reaves: 2 personal fouls)   FT 1/3: GOOD   FT 2/3: MISS   FT 3/3: GOOD Dwyane Quickley makes 2/3 from the line.
Score: 31-23

[11:04] Team_063 possession (Score: 31-23)
Bradley Davis attempts a 3Pt. Contested by Dwyane Quickley (5.9 feet, ZONE). Bradley Davis misses. Rebound secured by Donovan Doncic.

[10:53] Team_074 possession (Score: 31-23)
James Turner loses control! Ball rolls out of bounds! TURNOVER! (dead ball)

[10:53] Substitution (Team_063): Bradley Davis OUT → DeMar Banchero IN (stamina_rule2)

[10:53] Substitution (Team_063): Malcolm Quickley OUT → Cole Durant IN (stamina_rule2)

[10:53] Substitution (Team_063): Terry Reaves OUT → Jaren James IN (stamina_rule2)

[10:53] Substitution (Team_063): Dirk Reaves OUT → Lamelo Ball IN (stamina_rule2)

[10:53] Substitution (Team_063): Tyler Harris OUT → Kyle Green IN (stamina_rule2)

[10:53] Substitution (Team_074): Dwyane Quickley OUT → James Barnes IN (stamina_rule2)

[10:53] Substitution (Team_074): Chris Carter OUT → Giannis Westbrook IN (stamina_rule2)

[10:53] Substitution (Team_074): Shai Green OUT → Ayo Smith IN (stamina_rule2)

[10:53] Substitution (Team_074): Donovan Doncic OUT → Yao Randle IN (stamina_rule2)

[10:53] Substitution (Team_074): James Turner OUT → Jaren Rozier IN (stamina_rule2)

[10:36] Team_063 possession (Score: 31-23)
Cole Durant attempts a Layup. Contested by Giannis Westbrook (4.8 feet, MAN). COLE DURANT MAKES IT!
Score: 33-23

[10:24] Team_074 possession (Score: 33-23)
FOUL! Shooting foul on Cole Durant. Ayo Smith to the line for 2 free throws. [Team fouls: 4] (Cole Durant: 1 personal fouls)   FT 1/2: GOOD   FT 2/2: GOOD Ayo Smith makes 2/2 from the line.
Score: 33-25

[10:11] Team_063 possession (Score: 33-25)
Lamelo Ball attempts a 3Pt. Contested by Yao Randle (4.8 feet, MAN). Lamelo Ball misses. Rebound secured by Ayo Smith.

[09:58] Team_074 possession (Score: 33-25)
James Barnes drives and kicks out. Yao Randle attempts a 3Pt. Contested by DeMar Banchero (3.9 feet, ZONE). Yao Randle misses. Rebound secured by Kyle Green.

[09:43] Team_063 possession (Score: 33-25)
Lamelo Ball throws a bad pass out of bounds! TURNOVER! (dead ball)

[09:30] Team_074 possession (Score: 33-25)
FOUL! Shooting foul on Cole Durant. Jaren Rozier to the line for 2 free throws. [BONUS: 5 team fouls] (Cole Durant: 2 personal fouls)   FT 1/2: GOOD   FT 2/2: GOOD Jaren Rozier makes 2/2 from the line.
Score: 33-27

[09:18] Team_063 possession (Score: 33-27)
Lamelo Ball attempts a Midrange. Contested by Yao Randle (4.8 feet, MAN). LAMELO BALL MAKES IT!
Score: 35-27

[09:06] Team_074 possession (Score: 35-27)
FOUL! Holding foul on Kyle Green. [IN THE BONUS! 6 team fouls] Jaren Rozier to the line for 2 free throws. (Kyle Green: 1 personal fouls)   FT 1/2: GOOD   FT 2/2: GOOD Jaren Rozier makes 2/2 from the line.
Score: 35-29

[08:50] Team_063 possession (Score: 35-29)
Jaren James attempts a 3Pt. Contested by James Barnes (4.4 feet, ZONE). Jaren James misses. Rebound secured by Yao Randle.

[08:39] Team_074 possession (Score: 35-29)
Giannis Westbrook drives to the basket... Giannis Westbrook throws a bad pass out of bounds! TURNOVER! (dead ball)

[08:22] Team_063 possession (Score: 35-29)
DeMar Banchero attempts a 3Pt. Contested by James Barnes (4.6 feet, MAN). DeMar Banchero misses. Rebound secured by Jaren Rozier.

[08:06] Team_074 possession (Score: 35-29)
Giannis Westbrook attempts a Layup. Contested by Kyle Green (4.5 feet, ZONE). Giannis Westbrook misses. Rebound secured by Kyle Green.

[07:48] Team_063 possession (Score: 35-29)
Jaren James attempts a 3Pt. Contested by Ayo Smith (4.9 feet, MAN). Jaren James misses. Rebound secured by Jaren Rozier.

[07:32] Team_074 possession (Score: 35-29)
Giannis Westbrook attempts a 3Pt. Contested by DeMar Banchero (4.0 feet, ZONE). GIANNIS WESTBROOK MAKES IT! Assist: James Barnes
Score: 35-32

[07:20] Team_063 possession (Score: 35-32)
Kyle Green drives to the basket... Kyle Green loses control! Ball rolls out of bounds! TURNOVER! (dead ball)

[07:06] Team_074 possession (Score: 35-32)
Giannis Westbrook attempts a 3Pt. Contested by Cole Durant (4.2 feet, MAN). Giannis Westbrook misses. Rebound secured by Cole Durant.

[06:52] Team_063 possession (Score: 35-32)
FOUL! Shooting foul on Ayo Smith. Jaren James to the line for 2 free throws. [Team fouls: 1] (Ayo Smith: 1 personal fouls)   FT 1/2: GOOD   FT 2/2: GOOD Jaren James makes 2/2 from the line.
Score: 37-32

[06:36] Team_074 possession (Score: 37-32)
Ayo Smith attempts a 3Pt. Contested by DeMar Banchero (4.1 feet, ZONE). AYO SMITH MAKES IT! Assist: Giannis Westbrook
Score: 37-35

[06:24] Team_063 possession (Score: 37-35)
FOUL! Reach-in foul on Giannis Westbrook during the drive. [Team fouls: 2] No free throws, side out. (Giannis Westbrook: 1 personal fouls)

[06:14] Team_063 possession (Score: 37-35)
Lamelo Ball makes the Dunk and draws the foul on Yao Randle! And-1! Lamelo Ball to the line for 1. [Team fouls: 3] (Yao Randle: 1 personal fouls)   FT 1/1: GOOD Lamelo Ball makes 1/1 from the line.
Score: 40-35

[06:04] Team_074 possession (Score: 40-35)
Yao Randle attempts a 3Pt. Contested by Cole Durant (4.3 feet, ZONE). YAO RANDLE MAKES IT! Assist: Jaren Rozier
Score: 40-38

[05:47] Team_063 possession (Score: 40-38)
Jaren James drives to the basket... Jaren James loses the ball! Stripped by Yao Randle! TURNOVER! (live ball)

[05:32] Team_074 possession (Score: 40-38)
Jaren Rozier attempts a Layup. BLOCKED BY KYLE GREEN! Ball is loose! Rebound secured by Cole Durant.

[05:15] Team_063 possession (Score: 40-38)
DeMar Banchero attempts a 3Pt. Contested by James Barnes (4.6 feet, MAN). DeMar Banchero misses. Rebound secured by Yao Randle.

[04:59] Team_074 possession (Score: 40-38)
James Barnes drives to the basket... James Barnes throws a bad pass! Stolen by DeMar Banchero! TURNOVER! (live ball)

[04:46] Team_063 possession (Score: 40-38)
Lamelo Ball attempts a Midrange. Contested by Ayo Smith (5.1 feet, ZONE). LAMELO BALL MAKES IT! Assist: Jaren James
Score: 42-38

[04:34] Team_074 possession (Score: 42-38)
Ayo Smith attempts a 3Pt. Contested by DeMar Banchero (4.1 feet, ZONE). Ayo Smith misses. FOUL! Loose ball foul on Cole Durant during the rebound battle. [IN THE BONUS! 7 team fouls] Yao Randle to the line for 2 free throws. (Cole Durant: 3 personal fouls)   FT 1/2: GOOD   FT 2/2: GOOD Yao Randle makes 2/2 from the line.
Score: 42-40

[04:19] Team_063 possession (Score: 42-40)
Cole Durant makes the Dunk and draws the foul on Giannis Westbrook! And-1! Cole Durant to the line for 1. [Team fouls: 4] (Giannis Westbrook: 2 personal fouls)   FT 1/1: GOOD Cole Durant makes 1/1 from the line.
Score: 45-40

[04:06] Team_074 possession (Score: 45-40)
Ayo Smith attempts a 3Pt. Contested by DeMar Banchero (4.1 feet, ZONE). AYO SMITH MAKES IT! Assist: Giannis Westbrook
Score: 45-43

[03:51] Team_063 possession (Score: 45-43)
Cole Durant attempts a 3Pt. Contested by Giannis Westbrook (4.8 feet, MAN). COLE DURANT MAKES IT!
Score: 48-43

[03:41] Team_074 possession (Score: 48-43)
Yao Randle makes the Dunk and draws the foul on Cole Durant! And-1! Yao Randle to the line for 1. [BONUS: 8 team fouls] (Cole Durant: 4 personal fouls)   FT 1/1: GOOD Yao Randle makes 1/1 from the line.
Score: 48-46

[03:24] Team_063 possession (Score: 48-46)
Lamelo Ball attempts a Midrange. Contested by Yao Randle (4.9 feet, ZONE). Lamelo Ball misses. Offensive rebound by Lamelo Ball! Lamelo Ball kicks it out.

[03:09] Team_063 possession (Score: 48-46)
Cole Durant attempts a Midrange. Contested by Yao Randle (4.9 feet, ZONE). Cole Durant misses. Rebound secured by Yao Randle.

[02:53] Team_074 possession (Score: 48-46)
Yao Randle attempts a Midrange. Contested by Cole Durant (4.4 feet, ZONE). Yao Randle misses. Rebound secured by Lamelo Ball.

[02:41] Team_063 possession (Score: 48-46)
Cole Durant drives and kicks out. Cole Durant attempts a 3Pt. Contested by Giannis Westbrook (4.6 feet, MAN). Cole Durant misses. Offensive rebound by Kyle Green! Kyle Green's putback is no good. Offensive rebound by Lamelo Ball! Lamelo Ball kicks it out.

[02:28] Team_063 possession (Score: 48-46)
Jaren James attempts a 3Pt. Contested by James Barnes (4.6 feet, ZONE). Jaren James misses. Rebound secured by Yao Randle.

[02:15] Team_074 possession (Score: 48-46)
FOUL! Shooting foul on Cole Durant. Ayo Smith to the line for 2 free throws. [BONUS: 9 team fouls] (Cole Durant: 5 personal fouls)   FT 1/2: GOOD   FT 2/2: GOOD Ayo Smith makes 2/2 from the line.
Score: 48-48

[02:02] Team_063 possession (Score: 48-48)
Cole Durant makes the Layup and draws the foul on Yao Randle! And-1! Cole Durant to the line for 1. [BONUS: 5 team fouls] (Yao Randle: 2 personal fouls)   FT 1/1: GOOD Cole Durant makes 1/1 from the line.
Score: 51-48

[01:52] Team_074 possession (Score: 51-48)
Ayo Smith drives, Kyle Green stays with him. Ayo Smith attempts a Layup. Contested by Kyle Green (4.8 feet, ZONE). Ayo Smith misses. Rebound secured by Lamelo Ball.

[01:38] Team_063 possession (Score: 51-48)
DeMar Banchero makes the Dunk and draws the foul on James Barnes! And-1! DeMar Banchero to the line for 1. [BONUS: 6 team fouls] (James Barnes: 1 personal fouls)   FT 1/1: GOOD DeMar Banchero makes 1/1 from the line.
Score: 54-48

[01:24] Team_074 possession (Score: 54-48)
Jaren Rozier makes the Dunk and draws the foul on Kyle Green! And-1! Jaren Rozier to the line for 1. [BONUS: 10 team fouls] (Kyle Green: 2 personal fouls)   FT 1/1: GOOD Jaren Rozier makes 1/1 from the line.
Score: 54-51

[01:13] Team_063 possession (Score: 54-51)
DeMar Banchero attempts a 3Pt. Contested by Ayo Smith (5.4 feet, ZONE). DeMar Banchero misses. Rebound secured by Jaren Rozier.

[00:54] Team_074 possession (Score: 54-51)
James Barnes attempts a Layup. Contested by Lamelo Ball (4.9 feet, ZONE). JAMES BARNES MAKES IT!
Score: 54-53

[00:43] Team_063 possession (Score: 54-53)
FOUL! Shooting foul on Yao Randle. Jaren James to the line for 2 free throws. [BONUS: 7 team fouls] (Yao Randle: 3 personal fouls)   FT 1/2: GOOD   FT 2/2: MISS Jaren James makes 1/2 from the line. Offensive rebound by Kyle Green! Kyle Green's putback is no good.
Score: 55-53

[00:26] Team_074 possession (Score: 55-53)
Yao Randle attempts a Layup. Contested by Lamelo Ball (5.1 feet, MAN). YAO RANDLE MAKES IT! Assist: Ayo Smith
Score: 55-55

[00:10] Team_063 possession (Score: 55-55)
Kyle Green attempts a Midrange. Contested by Jaren Rozier (4.9 feet, MAN). KYLE GREEN MAKES IT! Assist: Jaren James
Score: 57-55

================================================================================
                              2ND QUARTER COMPLETE                              
================================================================================

2ND QUARTER SCORE: Team_063 26, Team_074 34

BOX SCORE:
================================================================================

Team_063
--------------------------------------------------------------------------------
Player                MIN  PTS  REB  AST  TO      FG   FG%      3P   3P%
--------------------------------------------------------------------------------
Cole Durant            11   11    2    0   0   4/5    80.0     0/0   0.0
Lamelo Ball            11    7    4    0   0   3/4    75.0     0/0   0.0
DeMar Banchero         11    3    0    0   0   1/4    25.0     0/0   0.0
Kyle Green             11    2    3    0   0   1/1   100.0     0/0   0.0
Jaren James            11    2    0    2   0   1/5    20.0     0/0   0.0
Bradley Davis          14    0    0    0   0   0/2     0.0     0/0   0.0

TEAM: FG: 10/21 (47.6%), 3PT: 1/10 (10.0%), REB: 8 (2 off, 6 def), AST: 2, TO: 3
TEAM FOULS: 10 [Team_074 in BONUS]


Team_074
--------------------------------------------------------------------------------
Player                MIN  PTS  REB  AST  TO      FG   FG%      3P   3P%
--------------------------------------------------------------------------------
Ayo Smith              11   10    1    1   0   4/5    80.0     0/0   0.0
Yao Randle             11   10    4    0   0   4/5    80.0     0/0   0.0
Jaren Rozier           11    7    3    1   0   3/4    75.0     0/0   0.0
Giannis Westbrook      11    3    0    2   0   1/3    33.3     0/0   0.0
Dwyane Quickley        14    2    0    0   0   1/1   100.0     0/0   0.0
James Barnes           11    2    0    1   0   1/2    50.0     0/0   0.0
Shai Green             14    0    1    0   0   0/0     0.0     0/0   0.0
Donovan Doncic         14    0    2    0   0   0/0     0.0     0/0   0.0
James Turner           14    0    1    0   0   0/0     0.0     0/0   0.0

TEAM: FG: 14/20 (70.0%), 3PT: 6/7 (85.7%), REB: 13 (2 off, 11 def), AST: 5, TO: 3
TEAM FOULS: 7 [Team_063 in BONUS]

================================================================================

================================================================================
                       3RD QUARTER - Team_063 vs Team_074                       
================================================================================

[12:00] Team_063 possession (Score: 57-55)
Terry Reaves drives and kicks out. Terry Reaves attempts a 3Pt. Contested by Shai Green (3.5 feet, MAN). TERRY REAVES MAKES IT! Assist: Tyler Harris
Score: 60-55

[11:49] Team_074 possession (Score: 60-55)
Shai Green attempts a 3Pt. Contested by Terry Reaves (5.1 feet, MAN). Shai Green misses. Offensive rebound by Donovan Doncic! Donovan Doncic kicks it out.

[11:30] Team_074 possession (Score: 60-55)
Shai Green attempts a Layup. Contested by Terry Reaves (5.1 feet, MAN). Shai Green misses. Rebound secured by Tyler Harris.

[11:11] Team_063 possession (Score: 60-55)
FOUL! Shooting foul on Donovan Doncic. Terry Reaves to the line for 3 free throws. [Team fouls: 1] (Donovan Doncic: 1 personal fouls)   FT 1/3: GOOD   FT 2/3: MISS   FT 3/3: MISS Terry Reaves makes 1/3 from the line. Rebound secured by Shai Green.
Score: 61-55

[10:57] Team_074 possession (Score: 61-55)
James Turner attempts a 3Pt. Contested by Malcolm Quickley (4.2 feet, ZONE). James Turner misses. Rebound secured by Dirk Reaves.

[10:40] Team_063 possession (Score: 61-55)
Terry Reaves attempts a 3Pt. Contested by Dwyane Quickley (5.7 feet, ZONE). Terry Reaves misses. Rebound secured by Donovan Doncic.

[10:21] Team_074 possession (Score: 61-55)
FOUL! Holding foul on Dirk Reaves. [Team fouls: 1] No free throws, side out. (Dirk Reaves: 1 personal fouls)

[10:11] Team_074 possession (Score: 61-55)
Shai Green attempts a 3Pt. Contested by Terry Reaves (5.1 feet, MAN). Shai Green misses. Rebound secured by Malcolm Quickley.

[10:02] Team_063 possession (Score: 61-55)
FOUL! Shooting foul on Shai Green. Terry Reaves to the line for 2 free throws. [Team fouls: 2] (Shai Green: 1 personal fouls)   FT 1/2: GOOD   FT 2/2: GOOD Terry Reaves makes 2/2 from the line.
Score: 63-55

[09:45] Team_074 possession (Score: 63-55)
Donovan Doncic drives and kicks out. Donovan Doncic attempts a Midrange. Contested by Dirk Reaves (3.7 feet, MAN). DONOVAN DONCIC MAKES IT! Assist: Chris Carter
Score: 63-57

[09:33] Team_063 possession (Score: 63-57)
Bradley Davis drives, Donovan Doncic stays with him. Bradley Davis attempts a Layup. Contested by Donovan Doncic (3.9 feet, ZONE). Bradley Davis misses. Rebound secured by Donovan Doncic.

[09:15] Team_074 possession (Score: 63-57)
James Turner attempts a Layup. BLOCKED BY TYLER HARRIS! Ball is loose! Rebound secured by Dirk Reaves.

[09:03] Team_063 possession (Score: 63-57)
Malcolm Quickley drives to the basket... Malcolm Quickley loses the ball! Stripped by Chris Carter! TURNOVER! (live ball)

[08:50] Team_074 possession (Score: 63-57)
James Turner attempts a Layup. BLOCKED BY TYLER HARRIS! Ball is loose! Offensive rebound by Donovan Doncic! Donovan Doncic kicks it out.

[08:41] Team_074 possession (Score: 63-57)
FOUL! Shooting foul on Malcolm Quickley. Chris Carter to the line for 2 free throws. [Team fouls: 2] (Malcolm Quickley: 1 personal fouls)   FT 1/2: MISS   FT 2/2: GOOD Chris Carter makes 1/2 from the line.
Score: 63-58

[08:27] Team_063 possession (Score: 63-58)
Dirk Reaves attempts a Midrange. Contested by Donovan Doncic (3.9 feet, MAN). Dirk Reaves misses. Rebound secured by Shai Green.

[08:08] Team_074 possession (Score: 63-58)
Chris Carter attempts a 3Pt. Contested by Malcolm Quickley (4.2 feet, ZONE). Chris Carter misses. Offensive rebound by James Turner! James Turner's putback is no good. Offensive rebound by James Turner! James Turner kicks it out.

[07:52] Team_074 possession (Score: 63-58)
James Turner attempts a Midrange. Contested by Terry Reaves (5.3 feet, ZONE). James Turner misses. Rebound secured by Dirk Reaves.

[07:37] Team_063 possession (Score: 63-58)
Bradley Davis attempts a 3Pt. Contested by Dwyane Quickley (5.6 feet, MAN). BRADLEY DAVIS MAKES IT! Assist: Dirk Reaves
Score: 66-58

[07:20] Team_074 possession (Score: 66-58)
James Turner drives and kicks out. Shai Green attempts a Midrange. Contested by Malcolm Quickley (3.5 feet, ZONE). Shai Green misses. Rebound secured by Tyler Harris.

[07:09] Team_063 possession (Score: 66-58)
FOUL! Shooting foul on James Turner. Tyler Harris to the line for 2 free throws. [Team fouls: 3] (James Turner: 1 personal fouls)   FT 1/2: GOOD   FT 2/2: GOOD Tyler Harris makes 2/2 from the line.
Score: 68-58

[06:56] Team_074 possession (Score: 68-58)
Dwyane Quickley attempts a 3Pt. Contested by Bradley Davis (5.2 feet, ZONE). Dwyane Quickley misses. Rebound secured by Malcolm Quickley.

[06:42] Team_063 possession (Score: 68-58)
Terry Reaves attempts a 3Pt. Contested by Shai Green (3.8 feet, MAN). TERRY REAVES MAKES IT! Assist: Bradley Davis
Score: 71-58

[06:27] Team_074 possession (Score: 71-58)
Donovan Doncic attempts a 3Pt. Contested by Malcolm Quickley (3.8 feet, ZONE). Donovan Doncic misses. Rebound secured by Dirk Reaves.

[06:11] Team_063 possession (Score: 71-58)
Tyler Harris makes the Layup and draws the foul on James Turner! And-1! Tyler Harris to the line for 1. [Team fouls: 4] (James Turner: 2 personal fouls)   FT 1/1: GOOD Tyler Harris makes 1/1 from the line.
Score: 74-58

[06:02] Team_074 possession (Score: 74-58)
Chris Carter attempts a 3Pt. Contested by Malcolm Quickley (4.2 feet, ZONE). Chris Carter misses. Offensive rebound by James Turner! James Turner puts it back in!
Score: 74-60

[05:49] Team_063 possession (Score: 74-60)
Terry Reaves loses control! Ball rolls out of bounds! TURNOVER! (dead ball)

[05:33] Team_074 possession (Score: 74-60)
FOUL! Holding foul on Dirk Reaves. [Team fouls: 3] No free throws, side out. (Dirk Reaves: 2 personal fouls)

[05:16] Team_074 possession (Score: 74-60)
Chris Carter drives and kicks out. James Turner attempts a 3Pt. Contested by Tyler Harris (4.4 feet, MAN). James Turner misses. Rebound secured by Dirk Reaves.

[05:01] Team_063 possession (Score: 74-60)
Malcolm Quickley makes the Layup and draws the foul on Donovan Doncic! And-1! Malcolm Quickley to the line for 1. [BONUS: 5 team fouls] (Donovan Doncic: 2 personal fouls)   FT 1/1: GOOD Malcolm Quickley makes 1/1 from the line.
Score: 77-60

[04:46] Team_074 possession (Score: 77-60)
Chris Carter attempts a Layup. BLOCKED BY MALCOLM QUICKLEY! Ball deflects out of bounds off Chris Carter.

[04:35] Team_063 possession (Score: 77-60)
Malcolm Quickley attempts a 3Pt. Contested by Chris Carter (4.1 feet, ZONE). MALCOLM QUICKLEY MAKES IT! Assist: Bradley Davis
Score: 80-60

[04:20] Team_074 possession (Score: 80-60)
Chris Carter attempts a 3Pt. Contested by Malcolm Quickley (4.2 feet, MAN). CHRIS CARTER MAKES IT! Assist: Donovan Doncic
Score: 80-63

[04:08] Team_063 possession (Score: 80-63)
Dirk Reaves makes the Layup and draws the foul on Donovan Doncic! And-1! Dirk Reaves to the line for 1. [BONUS: 6 team fouls] (Donovan Doncic: 3 personal fouls)   FT 1/1: MISS Dirk Reaves makes 0/1 from the line. Rebound secured by Donovan Doncic.
Score: 82-63

[03:54] Team_074 possession (Score: 82-63)
FOUL! Holding foul on Terry Reaves. [Team fouls: 4] No free throws, side out. (Terry Reaves: 1 personal fouls)

[03:43] Team_074 possession (Score: 82-63)
James Turner drives, Tyler Harris stays with him. James Turner attempts a Layup. Contested by Tyler Harris (5.2 feet, MAN). James Turner misses. Rebound secured by Tyler Harris.

[03:26] Team_063 possession (Score: 82-63)
Dirk Reaves drives and kicks out. Bradley Davis attempts a 3Pt. Contested by Dwyane Quickley (5.6 feet, ZONE). BRADLEY DAVIS MAKES IT! Assist: Tyler Harris
Score: 85-63

[03:12] Team_074 possession (Score: 85-63)
Shai Green attempts a 3Pt. Contested by Malcolm Quickley (4.2 feet, ZONE). SHAI GREEN MAKES IT! Assist: Donovan Doncic
Score: 85-66

[02:59] Team_063 possession (Score: 85-66)
Terry Reaves throws a bad pass! Stolen by Shai Green! TURNOVER! (live ball)

[02:40] Team_074 possession (Score: 85-66)
James Turner drives and kicks out. Donovan Doncic attempts a Midrange. Contested by Dirk Reaves (4.0 feet, MAN). Donovan Doncic misses. Rebound secured by Tyler Harris.

[02:27] Team_063 possession (Score: 85-66)
Malcolm Quickley attempts a 3Pt. Contested by Dwyane Quickley (5.4 feet, ZONE). MALCOLM QUICKLEY MAKES IT! Assist: Terry Reaves
Score: 88-66

[02:13] Team_074 possession (Score: 88-66)
Shai Green attempts a Layup. Contested by Tyler Harris (5.2 feet, ZONE). Shai Green misses. Rebound secured by Dirk Reaves.

[01:59] Team_063 possession (Score: 88-66)
Malcolm Quickley drives, Donovan Doncic stays with him. Malcolm Quickley attempts a Dunk. Contested by Donovan Doncic (3.7 feet, ZONE). MALCOLM QUICKLEY MAKES IT! Assist: Bradley Davis
Score: 90-66

[01:47] Team_074 possession (Score: 90-66)
James Turner attempts a Midrange. Contested by Terry Reaves (5.6 feet, ZONE). James Turner misses. Rebound secured by Malcolm Quickley.

[01:32] Team_063 possession (Score: 90-66)
FOUL! Reach-in foul on Donovan Doncic during the drive. [IN THE BONUS! 7 team fouls] Dirk Reaves to the line for 2 free throws. (Donovan Doncic: 4 personal fouls)   FT 1/2: GOOD   FT 2/2: MISS Dirk Reaves makes 1/2 from the line. Rebound secured by James Turner.
Score: 91-66

[01:19] Team_074 possession (Score: 91-66)
Shai Green attempts a 3Pt. Contested by Terry Reaves (5.5 feet, MAN). SHAI GREEN MAKES IT! Assist: Dwyane Quickley
Score: 91-69

[01:00] Team_063 possession (Score: 91-69)
FOUL! Reach-in foul on Donovan Doncic during the drive. [IN THE BONUS! 8 team fouls] Bradley Davis to the line for 2 free throws. (Donovan Doncic: 5 personal fouls)   FT 1/2: GOOD   FT 2/2: GOOD Bradley Davis makes 2/2 from the line.
Score: 93-69

[00:49] Team_074 possession (Score: 93-69)
Shai Green attempts a Midrange. Contested by Terry Reaves (5.5 feet, ZONE). Shai Green misses. Offensive rebound by James Turner! James Turner kicks it out.

[00:37] Team_074 possession (Score: 93-69)
FOUL! Shooting foul on Malcolm Quickley. Donovan Doncic to the line for 3 free throws. [BONUS: 5 team fouls] (Malcolm Quickley: 2 personal fouls)   FT 1/3: GOOD   FT 2/3: GOOD   FT 3/3: GOOD Donovan Doncic makes 3/3 from the line.
Score: 93-72

[00:22] Team_063 possession (Score: 93-72)
Dirk Reaves drives, Donovan Doncic stays with him. Dirk Reaves attempts a Layup. Contested by Donovan Doncic (4.3 feet, MAN). DIRK REAVES MAKES IT! Assist: Malcolm Quickley
Score: 95-72

[00:09] Team_074 possession (Score: 95-72)
Donovan Doncic attempts a 3Pt. Contested by Dirk Reaves (4.7 feet, MAN). DONOVAN DONCIC MAKES IT! Assist: Shai Green
Score: 95-75

================================================================================
                              3RD QUARTER COMPLETE                              
================================================================================

3RD QUARTER SCORE: Team_063 38, Team_074 20

BOX SCORE:
================================================================================

Team_063
--------------------------------------------------------------------------------
Player                MIN  PTS  REB  AST  TO      FG   FG%      3P   3P%
--------------------------------------------------------------------------------
Malcolm Quickley       26   11    3    1   0   4/4   100.0     0/0   0.0
Terry Reaves           26    8    0    1   0   3/5    60.0     0/0   0.0
Bradley Davis          26    8    0    3   0   3/4    75.0     0/0   0.0
Tyler Harris           26    5    4    2   0   2/2   100.0     0/0   0.0
Dirk Reaves            26    2    6    1   0   1/4    25.0     0/0   0.0

TEAM: FG: 13/19 (68.4%), 3PT: 4/6 (66.7%), REB: 13 (0 off, 13 def), AST: 8, TO: 3
TEAM FOULS: 5 [Team_074 in BONUS]


Team_074
--------------------------------------------------------------------------------
Player                MIN  PTS  REB  AST  TO      FG   FG%      3P   3P%
--------------------------------------------------------------------------------
Donovan Doncic         26    8    5    2   0   3/4    75.0     0/0   0.0
Shai Green             26    6    2    1   0   2/5    40.0     0/0   0.0
Chris Carter           26    4    0    1   0   2/4    50.0     0/0   0.0
James Turner           26    2    4    0   0   1/8    12.5     0/0   0.0
Dwyane Quickley        26    0    0    1   0   0/1     0.0     0/0   0.0

TEAM: FG: 8/22 (36.4%), 3PT: 6/10 (60.0%), REB: 11 (5 off, 6 def), AST: 5, TO: 0
TEAM FOULS: 8 [Team_063 in BONUS]

================================================================================

================================================================================
                       4TH QUARTER - Team_063 vs Team_074                       
================================================================================

[12:00] Team_063 possession (Score: 95-75)
Dirk Reaves attempts a Layup. Contested by Donovan Doncic (4.1 feet, MAN). DIRK REAVES MAKES IT! Assist: Bradley Davis
Score: 97-75

[11:46] Team_074 possession (Score: 97-75)
Shai Green attempts a 3Pt. Contested by Malcolm Quickley (4.3 feet, ZONE). Shai Green misses. Offensive rebound by James Turner! James Turner puts it back in!
Score: 97-77

[11:36] Team_063 possession (Score: 97-77)
Tyler Harris drives to the basket... Tyler Harris loses the ball! Stripped by Donovan Doncic! TURNOVER! (live ball)

[11:23] Team_074 possession (Score: 97-77)
Chris Carter makes the Midrange and draws the foul on Malcolm Quickley! And-1! Chris Carter to the line for 1. [Team fouls: 1] (Malcolm Quickley: 1 personal fouls)   FT 1/1: GOOD Chris Carter makes 1/1 from the line.
Score: 97-80

[11:09] Team_063 possession (Score: 97-80)
Dirk Reaves attempts a 3Pt. Contested by Dwyane Quickley (5.9 feet, ZONE). DIRK REAVES MAKES IT! Assist: Tyler Harris
Score: 100-80

[10:54] Team_074 possession (Score: 100-80)
Chris Carter drives, Tyler Harris stays with him. Chris Carter attempts a Dunk. Contested by Tyler Harris (5.5 feet, ZONE). Chris Carter misses. Offensive rebound by Donovan Doncic! Donovan Doncic kicks it out.

[10:42] Team_074 possession (Score: 100-80)
James Turner loses the ball! Stripped by Tyler Harris! TURNOVER! (live ball)

[10:26] Team_063 possession (Score: 100-80)
Bradley Davis commits a violation (traveling/carry)! TURNOVER! (dead ball)

[10:26] Substitution (Team_063): Bradley Davis OUT → DeMar Banchero IN (stamina_rule2)

[10:26] Substitution (Team_063): Malcolm Quickley OUT → Cole Durant IN (stamina_rule2)

[10:26] Substitution (Team_063): Terry Reaves OUT → Jaren James IN (stamina_rule2)

[10:26] Substitution (Team_063): Dirk Reaves OUT → Lamelo Ball IN (stamina_rule2)

[10:26] Substitution (Team_063): Tyler Harris OUT → Kyle Green IN (stamina_rule2)

[10:26] Substitution (Team_074): Dwyane Quickley OUT → James Barnes IN (stamina_rule2)

[10:26] Substitution (Team_074): Chris Carter OUT → Giannis Westbrook IN (stamina_rule2)

[10:26] Substitution (Team_074): Shai Green OUT → Ayo Smith IN (stamina_rule2)

[10:26] Substitution (Team_074): Donovan Doncic OUT → Yao Randle IN (stamina_rule2)

[10:26] Substitution (Team_074): James Turner OUT → Jaren Rozier IN (stamina_rule2)

[10:07] Team_074 possession (Score: 100-80)
Jaren Rozier attempts a Midrange. Contested by DeMar Banchero (3.7 feet, ZONE). Jaren Rozier misses. Offensive rebound by Jaren Rozier! Jaren Rozier kicks it out.

[09:57] Team_074 possession (Score: 100-80)
Jaren Rozier attempts a Midrange. Contested by Lamelo Ball (4.5 feet, ZONE). JAREN ROZIER MAKES IT!
Score: 100-82

[09:45] Team_063 possession (Score: 100-82)
Lamelo Ball attempts a 3Pt. Contested by James Barnes (4.5 feet, ZONE). Lamelo Ball misses. Rebound secured by Yao Randle.

[09:25] Team_074 possession (Score: 100-82)
FOUL! Shooting foul on Kyle Green. Jaren Rozier to the line for 2 free throws. [Team fouls: 2] (Kyle Green: 1 personal fouls)   FT 1/2: MISS   FT 2/2: GOOD Jaren Rozier makes 1/2 from the line.
Score: 100-83

[09:10] Team_063 possession (Score: 100-83)
Lamelo Ball drives and kicks out. Cole Durant attempts a 3Pt. Contested by Giannis Westbrook (4.4 feet, MAN). Cole Durant misses. Rebound secured by Ayo Smith.

[08:55] Team_074 possession (Score: 100-83)
Ayo Smith throws a bad pass! Stolen by Jaren James! TURNOVER! (live ball)

[08:39] Team_063 possession (Score: 100-83)
Jaren James throws a bad pass! Stolen by Ayo Smith! TURNOVER! (live ball)

[08:27] Team_074 possession (Score: 100-83)
Giannis Westbrook attempts a 3Pt. Contested by Lamelo Ball (4.8 feet, ZONE). GIANNIS WESTBROOK MAKES IT! Assist: Jaren Rozier
Score: 100-86

[08:16] Team_063 possession (Score: 100-86)
DeMar Banchero drives, picks up James Barnes. Help arrives from Giannis Westbrook! DeMar Banchero attempts a Dunk. Contested by Giannis Westbrook (4.6 feet, MAN). DEMAR BANCHERO MAKES IT! Assist: Jaren James
Score: 102-86

[08:03] Team_074 possession (Score: 102-86)
James Barnes drives, Kyle Green stays with him. James Barnes attempts a Layup. Contested by Kyle Green (4.3 feet, ZONE). James Barnes misses. Rebound secured by Cole Durant.

[07:54] Team_063 possession (Score: 102-86)
DeMar Banchero drives and kicks out. Jaren James attempts a Midrange. Contested by Ayo Smith (4.8 feet, MAN). Jaren James misses. Offensive rebound by Kyle Green! Kyle Green puts it back in!
Score: 104-86

[07:38] Team_074 possession (Score: 104-86)
Ayo Smith attempts a Midrange. Contested by Lamelo Ball (4.9 feet, ZONE). Ayo Smith misses. Rebound secured by Kyle Green.

[07:24] Team_063 possession (Score: 104-86)
DeMar Banchero attempts a Midrange. Contested by James Barnes (4.6 feet, MAN). DeMar Banchero misses. Rebound secured by Ayo Smith.

[07:12] Team_074 possession (Score: 104-86)
Ayo Smith attempts a Midrange. Contested by Jaren James (4.1 feet, MAN). Ayo Smith misses. Offensive rebound by Yao Randle! Yao Randle kicks it out.

[06:58] Team_074 possession (Score: 104-86)
James Barnes attempts a Midrange. Contested by Cole Durant (4.0 feet, ZONE). James Barnes misses. Rebound secured by Cole Durant.

[06:40] Team_063 possession (Score: 104-86)
FOUL! Holding foul on Giannis Westbrook. [Team fouls: 1] No free throws, side out. (Giannis Westbrook: 1 personal fouls)

[06:28] Team_063 possession (Score: 104-86)
Lamelo Ball attempts a 3Pt. Contested by Yao Randle (4.8 feet, MAN). Lamelo Ball misses. Rebound secured by Yao Randle.

[06:16] Team_074 possession (Score: 104-86)
Yao Randle drives and kicks out. Ayo Smith attempts a Midrange. Contested by Jaren James (3.9 feet, ZONE). AYO SMITH MAKES IT!
Score: 104-88

[06:03] Team_063 possession (Score: 104-88)
DeMar Banchero drives to the basket... DeMar Banchero throws a bad pass out of bounds! TURNOVER! (dead ball)

[05:47] Team_074 possession (Score: 104-88)
Jaren Rozier drives, Kyle Green stays with him. Jaren Rozier attempts a Layup. Contested by Kyle Green (4.2 feet, MAN). Jaren Rozier misses. Rebound secured by Cole Durant.

[05:35] Team_063 possession (Score: 104-88)
Jaren James attempts a 3Pt. Contested by Ayo Smith (4.9 feet, MAN). Jaren James misses. Offensive rebound by Lamelo Ball! Lamelo Ball kicks it out.

[05:20] Team_063 possession (Score: 104-88)
Lamelo Ball attempts a 3Pt. Contested by Yao Randle (4.8 feet, ZONE). LAMELO BALL MAKES IT! Assist: DeMar Banchero
Score: 107-88

[05:02] Team_074 possession (Score: 107-88)
Yao Randle attempts a Midrange. Contested by Lamelo Ball (4.8 feet, ZONE). Yao Randle misses. Rebound secured by Kyle Green.

[04:47] Team_063 possession (Score: 107-88)
DeMar Banchero makes the Midrange and draws the foul on Yao Randle! And-1! DeMar Banchero to the line for 1. [Team fouls: 2] (Yao Randle: 1 personal fouls)   FT 1/1: GOOD DeMar Banchero makes 1/1 from the line.
Score: 110-88

[04:32] Team_074 possession (Score: 110-88)
Jaren Rozier makes the Midrange and draws the foul on Kyle Green! And-1! Jaren Rozier to the line for 1. [Team fouls: 3] (Kyle Green: 2 personal fouls)   FT 1/1: MISS Jaren Rozier makes 0/1 from the line. Rebound secured by Lamelo Ball.
Score: 110-90

[04:17] Team_063 possession (Score: 110-90)
FOUL! Offensive foul on Jaren James! Ayo Smith drew the charge! [Team fouls: 4] (Jaren James: 1 personal fouls) TURNOVER! (dead ball)

[04:05] Team_074 possession (Score: 110-90)
Ayo Smith attempts a Midrange. Contested by Jaren James (4.1 feet, MAN). Ayo Smith misses. Rebound secured by Kyle Green.

[03:54] Team_063 possession (Score: 110-90)
Jaren James attempts a Layup. BLOCKED BY GIANNIS WESTBROOK! Ball goes out off Giannis Westbrook. Jaren James's ball!

[03:39] Team_063 possession (Score: 110-90)
DeMar Banchero drives and kicks out. Cole Durant attempts a Midrange. Contested by Giannis Westbrook (4.5 feet, MAN). COLE DURANT MAKES IT!
Score: 112-90

[03:22] Team_074 possession (Score: 112-90)
FOUL! Shooting foul on Kyle Green. Jaren Rozier to the line for 2 free throws. [BONUS: 5 team fouls] (Kyle Green: 3 personal fouls)   FT 1/2: GOOD   FT 2/2: GOOD Jaren Rozier makes 2/2 from the line.
Score: 112-92

[03:08] Team_063 possession (Score: 112-92)
Cole Durant attempts a 3Pt. Contested by James Barnes (4.7 feet, ZONE). COLE DURANT MAKES IT! Assist: DeMar Banchero
Score: 115-92

[02:54] Team_074 possession (Score: 115-92)
Giannis Westbrook commits a violation (traveling/carry)! TURNOVER! (dead ball)

[02:38] Team_063 possession (Score: 115-92)
DeMar Banchero drives to the basket... DeMar Banchero loses the ball! Stripped by James Barnes! TURNOVER! (live ball)

[02:28] Team_074 possession (Score: 115-92)
Ayo Smith attempts a 3Pt. Contested by Jaren James (4.2 feet, MAN). AYO SMITH MAKES IT! Assist: James Barnes
Score: 115-95

[02:16] Team_063 possession (Score: 115-95)
FOUL! Shooting foul on Yao Randle. Cole Durant to the line for 2 free throws. [Team fouls: 3] (Yao Randle: 2 personal fouls)   FT 1/2: GOOD   FT 2/2: GOOD Cole Durant makes 2/2 from the line.
Score: 117-95

[02:04] Team_074 possession (Score: 117-95)
Giannis Westbrook drives to the basket... FOUL! Offensive foul on Giannis Westbrook! Cole Durant drew the charge! [Team fouls: 4] (Giannis Westbrook: 2 personal fouls) TURNOVER! (dead ball)

[01:45] Team_063 possession (Score: 117-95)
Jaren James attempts a Midrange. Contested by Ayo Smith (5.0 feet, ZONE). Jaren James misses. Rebound secured by Ayo Smith.

[01:31] Team_074 possession (Score: 117-95)
FOUL! Shooting foul on Cole Durant. Yao Randle to the line for 2 free throws. [BONUS: 6 team fouls] (Cole Durant: 1 personal fouls)   FT 1/2: GOOD   FT 2/2: MISS Yao Randle makes 1/2 from the line. Rebound secured by Kyle Green.
Score: 117-96

[01:16] Team_063 possession (Score: 117-96)
Cole Durant attempts a Midrange. Contested by Yao Randle (5.0 feet, ZONE). Cole Durant misses. Rebound secured by Yao Randle.

[01:00] Team_074 possession (Score: 117-96)
FOUL! Holding foul on Lamelo Ball. [IN THE BONUS! 7 team fouls] Yao Randle to the line for 2 free throws. (Lamelo Ball: 1 personal fouls)   FT 1/2: GOOD   FT 2/2: GOOD Yao Randle makes 2/2 from the line.
Score: 117-98

[00:42] Team_063 possession (Score: 117-98)
DeMar Banchero throws a bad pass! Stolen by James Barnes! TURNOVER! (live ball)

[00:28] Team_074 possession (Score: 117-98)
James Barnes attempts a 3Pt. Contested by DeMar Banchero (4.1 feet, MAN). James Barnes misses. FOUL! Loose ball foul on Cole Durant during the rebound battle. [IN THE BONUS! 8 team fouls] Jaren Rozier to the line for 2 free throws. (Cole Durant: 2 personal fouls)   FT 1/2: GOOD   FT 2/2: GOOD Jaren Rozier makes 2/2 from the line.
Score: 117-100

[00:14] Team_063 possession (Score: 117-100)
Cole Durant attempts a Layup. Contested by Yao Randle (5.1 feet, ZONE). Cole Durant misses. Rebound secured by Ayo Smith.

================================================================================
                              4TH QUARTER COMPLETE                              
================================================================================

4TH QUARTER SCORE: Team_063 22, Team_074 25

BOX SCORE:
================================================================================

Team_063
--------------------------------------------------------------------------------
Player                MIN  PTS  REB  AST  TO      FG   FG%      3P   3P%
--------------------------------------------------------------------------------
Cole Durant            21    7    3    0   0   3/5    60.0     0/0   0.0
Dirk Reaves            27    5    0    0   0   2/2   100.0     0/0   0.0
DeMar Banchero         21    5    0    2   0   2/3    66.7     0/0   0.0
Lamelo Ball            21    3    2    0   0   1/4    25.0     0/0   0.0
Kyle Green             21    2    5    0   0   1/1   100.0     0/0   0.0
Bradley Davis          27    0    0    1   0   0/0     0.0     0/0   0.0
Tyler Harris           27    0    0    1   0   0/0     0.0     0/0   0.0
Jaren James            21    0    0    1   0   0/1     0.0     0/0   0.0

TEAM: FG: 9/16 (56.2%), 3PT: 3/5 (60.0%), REB: 10 (2 off, 8 def), AST: 5, TO: 7
TEAM FOULS: 8 [Team_074 in BONUS]


Team_074
--------------------------------------------------------------------------------
Player                MIN  PTS  REB  AST  TO      FG   FG%      3P   3P%
--------------------------------------------------------------------------------
Jaren Rozier           21    7    1    1   0   4/6    66.7     0/0   0.0
Ayo Smith              21    5    4    0   0   2/4    50.0     0/0   0.0
Chris Carter           27    3    0    0   0   1/1   100.0     0/0   0.0
Giannis Westbrook      21    3    0    0   0   1/1   100.0     0/0   0.0
James Turner           27    2    1    0   0   1/1   100.0     0/0   0.0
Yao Randle             21    2    4    0   0   1/3    33.3     0/0   0.0
Donovan Doncic         27    0    1    0   0   0/0     0.0     0/0   0.0
James Barnes           21    0    0    1   0   0/2     0.0     0/0   0.0

TEAM: FG: 10/18 (55.6%), 3PT: 4/4 (100.0%), REB: 11 (4 off, 7 def), AST: 2, TO: 4
TEAM FOULS: 4

================================================================================

================================================================================
                               FULL GAME COMPLETE                               
================================================================================

FINAL SCORE: Team_063 117, Team_074 100

SCORING BY QUARTER:
--------------------------------------------------------------------------------
Team                     Q1     Q2     Q3     Q4    FINAL
--------------------------------------------------------------------------------
Team_063                 31     26     38     22      117
Team_074                 21     34     20     25      100
--------------------------------------------------------------------------------

FULL GAME BOX SCORE:
================================================================================

Team_063
--------------------------------------------------------------------------------
Player                MIN  PTS  REB  AST  TO      FG   FG%      3P   3P%      FT STL BLK
--------------------------------------------------------------------------------
Bradley Davis          27   15    0    6   2   6/11   54.5   2/4    50.0   4/5     0   0
Malcolm Quickley       27   13    8    2   1   6/8    75.0   2/2   100.0   2/3     0   1
Terry Reaves           27   12    0    3   3   6/9    66.7   2/5    40.0   3/5     0   0
Dirk Reaves            27   11   12    1   1   4/8    50.0   1/2    50.0   3/5     0   0
Tyler Harris           27   18    8    3   1   7/8    87.5   0/1     0.0   3/3     1   2
DeMar Banchero         21    8    0    2   1   5/9    55.6   0/3     0.0   2/2     1   0
Cole Durant            21   18    5    0   1   6/9    66.7   2/2   100.0   4/4     0   0
Jaren James            21    2    0    3   2   1/6    16.7   0/3     0.0   3/4     1   0
Lamelo Ball            21   10    6    0   2   4/8    50.0   1/4    25.0   1/1     0   0
Kyle Green             21    4    8    0   2   1/1   100.0   0/0     0.0   0/0     0   1

TEAM: FG: 46/77 (59.7%), 3PT: 10/26 (38.5%), REB: 47 (6 off, 41 def), AST: 20, TO: 16


Team_074
--------------------------------------------------------------------------------
Player                MIN  PTS  REB  AST  TO      FG   FG%      3P   3P%      FT STL BLK
--------------------------------------------------------------------------------
Dwyane Quickley        27    2    0    1   0   1/6    16.7   1/4    25.0   2/6     0   0
Chris Carter           27   11    0    1   1   6/13   46.2   2/7    28.6   4/6     1   0
Shai Green             27    8    7    1   0   4/9    44.4   3/5    60.0   2/2     1   0
Donovan Doncic         27   17   11    2   0   6/9    66.7   2/4    50.0   6/6     2   0
James Turner           27    8    7    0   2   2/9    22.2   0/1     0.0   0/0     0   0
James Barnes           21    2    0    2   1   2/5    40.0   1/1   100.0   0/0     2   0
Giannis Westbrook      21    6    0    2   1   2/4    50.0   2/3    66.7   0/0     0   1
Ayo Smith              21   15    5    1   1   6/9    66.7   4/4   100.0   4/4     1   0
Yao Randle             21   12    8    0   0   4/7    57.1   1/1   100.0   6/7     1   0
Jaren Rozier           21   14    4    2   2   5/8    62.5   0/0     0.0  10/12    0   0

TEAM: FG: 40/82 (48.8%), 3PT: 16/30 (53.3%), REB: 42 (12 off, 30 def), AST: 12, TO: 8

================================================================================
