================================================================================
                        FULL GAME - Team_001 vs Team_002                        
================================================================================

================================================================================
                       1ST QUARTER - Team_001 vs Team_002                       
================================================================================

[12:00] Team_001 possession (Score: 0-0)
Miles Griffin drives to the basket... Miles Griffin throws a bad pass! Stolen by Tyler Porzingis! TURNOVER! (live ball)

[11:42] Team_002 possession (Score: 0-0)
Miles Bane attempts a Midrange. Heavily contested by Klay Harden (1.7 feet, MAN)! Miles Bane misses. Rebound secured by Cole Ball.

[11:28] Team_001 possession (Score: 0-0)
Klay Harden attempts a 3Pt. Contested by Miles Bane (2.9 feet, MAN). KLAY HARDEN MAKES IT! Assist: Cole Ball
Score: 3-0

[11:17] Team_002 possession (Score: 3-0)
CJ Barrett attempts a 3Pt. Wide open! Klay Harden is 7.8 feet away. [ZONE] CJ Barrett misses. Rebound secured by Cole Ball.

[10:59] Team_001 possession (Score: 3-0)
Dirk Young attempts a Layup. Wide open! CJ Barrett is 6.8 feet away. [MAN] Dirk Young misses. Rebound secured by Carmelo Lowry.

[10:45] Team_002 possession (Score: 3-0)
Carmelo Lowry drives, picks up Miles Griffin. Help arrives from Klay Harden! Carmelo Lowry attempts a Dunk. Contested by Klay Harden (5.8 feet, ZONE). CARMELO LOWRY MAKES IT! Assist: Tyler Porzingis
Score: 3-2

[10:30] Team_001 possession (Score: 3-2)
Cole Ball attempts a 3Pt. Contested by Jordan Green (5.8 feet, MAN). Cole Ball misses. Rebound secured by Tyler Porzingis.

[10:16] Team_002 possession (Score: 3-2)
CJ Barrett throws a bad pass! Stolen by Dirk Young! TURNOVER! (live ball)

[10:03] Team_001 possession (Score: 3-2)
Cole Ball attempts a Midrange. BLOCKED BY CARMELO LOWRY! Ball is loose! Rebound secured by Tyler Porzingis.

[09:45] Team_002 possession (Score: 3-2)
Jordan Green attempts a Midrange. Wide open! Cole Ball is 7.9 feet away. [MAN] Jordan Green misses. Offensive rebound by Carmelo Lowry! Carmelo Lowry kicks it out.

[09:33] Team_002 possession (Score: 3-2)
Jordan Green attempts a Midrange. Contested by Cole Ball (3.0 feet, MAN). Jordan Green misses. Rebound secured by Cole Ball.

[09:20] Team_001 possession (Score: 3-2)
Miles Griffin attempts a Midrange. Contested by CJ Barrett (5.1 feet, ZONE). Miles Griffin misses. Offensive rebound by Miles Griffin! Miles Griffin kicks it out.

[09:04] Team_001 possession (Score: 3-2)
Klay Harden drives and kicks out. Miles Griffin attempts a 3Pt. Contested by CJ Barrett (4.6 feet, ZONE). Miles Griffin misses. Rebound secured by Miles Bane.

[08:53] Team_002 possession (Score: 3-2)
FOUL! Holding foul on Klay Harden. [Team fouls: 1] No free throws, side out. (Klay Harden: 1 personal fouls)

[08:41] Team_002 possession (Score: 3-2)
Miles Bane attempts a Midrange. Contested by Cole Ball (2.2 feet, ZONE). Miles Bane misses. Offensive rebound by Carmelo Lowry! Carmelo Lowry kicks it out.

[08:25] Team_002 possession (Score: 3-2)
Jordan Green attempts a 3Pt. Contested by Klay Harden (4.2 feet, ZONE). JORDAN GREEN MAKES IT! Assist: Miles Bane
Score: 3-5

[08:12] Team_001 possession (Score: 3-5)
Cole Ball makes the Layup and draws the foul on CJ Barrett! And-1! Cole Ball to the line for 1. [Team fouls: 1] (CJ Barrett: 1 personal fouls)   FT 1/1: GOOD Cole Ball makes 1/1 from the line.
Score: 6-5

[07:57] Team_002 possession (Score: 6-5)
Jordan Green attempts a 3Pt. Contested by Cole Ball (2.9 feet, MAN). Jordan Green misses. Offensive rebound by Carmelo Lowry! Carmelo Lowry kicks it out.

[07:41] Team_002 possession (Score: 6-5)
CJ Barrett attempts a Layup. BLOCKED BY MILES GRIFFIN! Ball is loose! Offensive rebound by Tyler Porzingis! Tyler Porzingis kicks it out.

[07:27] Team_002 possession (Score: 6-5)
FOUL! Reach-in foul on Miles Griffin during the drive. [Team fouls: 2] No free throws, side out. (Miles Griffin: 1 personal fouls)

[07:13] Team_002 possession (Score: 6-5)
FOUL! Holding foul on Dirk Young. [Team fouls: 3] No free throws, side out. (Dirk Young: 1 personal fouls)

[07:02] Team_002 possession (Score: 6-5)
CJ Barrett makes the Layup and draws the foul on Klay Harden! And-1! CJ Barrett to the line for 1. [Team fouls: 4] (Klay Harden: 2 personal fouls)   FT 1/1: GOOD CJ Barrett makes 1/1 from the line.
Score: 6-8

[06:45] Team_001 possession (Score: 6-8)
Dirk Young attempts a 3Pt. Contested by CJ Barrett (3.9 feet, MAN). DIRK YOUNG MAKES IT! Assist: Miles Griffin
Score: 9-8

[06:33] Team_002 possession (Score: 9-8)
Tyler Porzingis drives and kicks out. Miles Bane attempts a Midrange. Heavily contested by Cole Ball (1.5 feet, ZONE)! Miles Bane misses. Rebound secured by Miles Griffin.

[06:19] Team_001 possession (Score: 9-8)
Klay Harden attempts a 3Pt. Contested by CJ Barrett (5.2 feet, ZONE). Klay Harden misses. Rebound secured by Carmelo Lowry.

[06:05] Team_002 possession (Score: 9-8)
CJ Barrett makes the Midrange and draws the foul on Dirk Young! And-1! CJ Barrett to the line for 1. [BONUS: 5 team fouls] (Dirk Young: 2 personal fouls)   FT 1/1: GOOD CJ Barrett makes 1/1 from the line.
Score: 9-11

[05:51] Team_001 possession (Score: 9-11)
FOUL! Reach-in foul on Tyler Porzingis during the drive. [Team fouls: 2] No free throws, side out. (Tyler Porzingis: 1 personal fouls)

[05:32] Team_001 possession (Score: 9-11)
Miles Griffin attempts a Midrange. Wide open! CJ Barrett is 6.0 feet away. [ZONE] Miles Griffin misses. Rebound secured by Tyler Porzingis.

[05:18] Team_002 possession (Score: 9-11)
Carmelo Lowry attempts a 3Pt. Contested by Dejounte McCollum (4.7 feet, MAN). Carmelo Lowry misses. Rebound secured by Dejounte McCollum.

[05:04] Team_001 possession (Score: 9-11)
Miles Griffin attempts a 3Pt. Heavily contested by Tyler Porzingis (2.0 feet, MAN)! Miles Griffin misses. Offensive rebound by Miles Griffin! Miles Griffin kicks it out.

[04:52] Team_001 possession (Score: 9-11)
Cole Ball attempts a 3Pt. Contested by CJ Barrett (2.7 feet, ZONE). Cole Ball misses. Rebound secured by Tyler Porzingis.

[04:32] Team_002 possession (Score: 9-11)
Carmelo Lowry attempts a 3Pt. Contested by Dejounte McCollum (3.5 feet, MAN). CARMELO LOWRY MAKES IT! Assist: Jordan Green
Score: 9-14

[04:14] Team_001 possession (Score: 9-14)
Klay Harden attempts a Midrange. Contested by Miles Bane (3.9 feet, MAN). Klay Harden misses. Offensive rebound by Cole Ball! Cole Ball kicks it out.

[03:58] Team_001 possession (Score: 9-14)
FOUL! Holding foul on Tyler Porzingis. [Team fouls: 3] No free throws, side out. (Tyler Porzingis: 2 personal fouls)

[03:46] Team_001 possession (Score: 9-14)
Cole Ball attempts a 3Pt. Contested by Jordan Green (4.2 feet, MAN). Cole Ball misses. Rebound secured by Tyler Porzingis.

[03:32] Team_002 possession (Score: 9-14)
Miles Bane attempts a 3Pt. Wide open! Klay Harden is 8.5 feet away. [ZONE] Miles Bane misses. Rebound secured by Cole Ball.

[03:17] Team_001 possession (Score: 9-14)
FOUL! Shooting foul on Tyler Porzingis. Miles Griffin to the line for 2 free throws. [Team fouls: 4] (Tyler Porzingis: 3 personal fouls)   FT 1/2: MISS   FT 2/2: MISS Miles Griffin makes 0/2 from the line. FOUL! Loose ball foul on Carmelo Lowry during the free throw rebound! [IN THE BONUS! 5 team fouls] Cole Ball to the line for 2 free throws. (Carmelo Lowry: 1 personal fouls)   FT 1/2: MISS   FT 2/2: GOOD Cole Ball makes 1/2 from the line.
Score: 10-14

[03:04] Team_002 possession (Score: 10-14)
Carmelo Lowry attempts a Midrange. Contested by Dejounte McCollum (3.8 feet, ZONE). Carmelo Lowry misses. Rebound secured by Miles Griffin.

[02:47] Team_001 possession (Score: 10-14)
Dejounte McCollum attempts a 3Pt. Wide open! CJ Barrett is 6.7 feet away. [ZONE] Dejounte McCollum misses. Rebound secured by Carmelo Lowry.

[02:33] Team_002 possession (Score: 10-14)
CJ Barrett drives to the basket... Shot clock violation! CJ Barrett couldn't get a shot off in time! TURNOVER! (dead ball)

[02:33] Substitution (Team_001): Klay Harden OUT → Ja Dosunmu IN (stamina_rule2)

[02:33] Substitution (Team_001): Miles Griffin OUT → Kristaps Ming IN (stamina_rule2)

[02:33] Substitution (Team_002): Carmelo Lowry OUT → Julius Curry IN (stamina_rule2)

[02:33] Substitution (Team_002): Tyler Porzingis OUT → Lamelo O'Neal IN (stamina_rule2)

[02:19] Team_001 possession (Score: 10-14)
Ja Dosunmu attempts a 3Pt. Contested by Miles Bane (3.0 feet, ZONE). Ja Dosunmu misses. Rebound secured by Miles Bane.

[02:00] Team_002 possession (Score: 10-14)
Lamelo O'Neal attempts a Midrange. Wide open! Kristaps Ming is 6.1 feet away. [MAN] Lamelo O'Neal misses. Rebound secured by Dejounte McCollum.

[01:47] Team_001 possession (Score: 10-14)
FOUL! Reach-in foul on Lamelo O'Neal during the drive. [IN THE BONUS! 6 team fouls] Cole Ball to the line for 2 free throws. (Lamelo O'Neal: 1 personal fouls)   FT 1/2: GOOD   FT 2/2: MISS Cole Ball makes 1/2 from the line. FOUL! Loose ball foul on Miles Bane during the free throw rebound! [IN THE BONUS! 7 team fouls] Cole Ball to the line for 2 free throws. (Miles Bane: 1 personal fouls)   FT 1/2: GOOD   FT 2/2: GOOD Cole Ball makes 2/2 from the line.
Score: 13-14

[01:28] Team_002 possession (Score: 13-14)
CJ Barrett makes the Midrange and draws the foul on Dirk Young! And-1! CJ Barrett to the line for 1. [BONUS: 6 team fouls] (Dirk Young: 3 personal fouls)   FT 1/1: GOOD CJ Barrett makes 1/1 from the line.
Score: 13-17

[01:15] Team_001 possession (Score: 13-17)
Ja Dosunmu drives to the basket... Ja Dosunmu loses the ball! Stripped by Lamelo O'Neal! TURNOVER! (live ball)

[01:00] Team_002 possession (Score: 13-17)
Julius Curry attempts a 3Pt. Wide open! Dejounte McCollum is 10.0 feet away. [MAN] Julius Curry misses. FOUL! Loose ball foul on Dejounte McCollum during the rebound battle. [IN THE BONUS! 7 team fouls] Lamelo O'Neal to the line for 2 free throws. (Dejounte McCollum: 1 personal fouls)   FT 1/2: GOOD   FT 2/2: GOOD Lamelo O'Neal makes 2/2 from the line.
Score: 13-19

[00:46] Team_001 possession (Score: 13-19)
Kristaps Ming attempts a Layup. BLOCKED BY LAMELO O'NEAL! Ball is loose! Rebound secured by CJ Barrett.

[00:33] Team_002 possession (Score: 13-19)
Lamelo O'Neal attempts a Midrange. Contested by Cole Ball (4.7 feet, ZONE). LAMELO O'NEAL MAKES IT!
Score: 13-21

[00:20] Team_001 possession (Score: 13-21)
Cole Ball attempts a 3Pt. Contested by Miles Bane (5.2 feet, ZONE). Cole Ball misses. Rebound secured by Miles Bane.

[00:08] Team_002 possession (Score: 13-21)
CJ Barrett drives to the basket... CJ Barrett loses the ball! Stripped by Dirk Young! TURNOVER! (live ball)

================================================================================
                              1ST QUARTER COMPLETE                              
================================================================================

1ST QUARTER SCORE: Team_001 13, Team_002 21

BOX SCORE:
================================================================================

Team_001
--------------------------------------------------------------------------------
Player                MIN  PTS  REB  AST  TO      FG   FG%      3P   3P%
--------------------------------------------------------------------------------
Cole Ball              12    7    5    1   0   3/8    37.5     0/0   0.0
Klay Harden            10    3    0    0   0   1/2    50.0     0/0   0.0
Dirk Young             12    3    0    0   0   1/2    50.0     0/0   0.0
Miles Griffin          10    0    4    1   0   0/2     0.0     0/0   0.0
Dejounte McCollum      12    0    2    0   0   0/1     0.0     0/0   0.0
Ja Dosunmu              2    0    0    0   0   0/1     0.0     0/0   0.0
Kristaps Ming           2    0    0    0   0   0/1     0.0     0/0   0.0

TEAM: FG: 5/17 (29.4%), 3PT: 2/10 (20.0%), REB: 11 (3 off, 8 def), AST: 2, TO: 2
TEAM FOULS: 7 [Team_002 in BONUS]


Team_002
--------------------------------------------------------------------------------
Player                MIN  PTS  REB  AST  TO      FG   FG%      3P   3P%
--------------------------------------------------------------------------------
CJ Barrett             12    9    1    0   0   3/4    75.0     0/0   0.0
Carmelo Lowry          10    5    6    0   0   2/4    50.0     0/0   0.0
Lamelo O'Neal           2    4    0    0   0   2/3    66.7     0/0   0.0
Jordan Green           12    3    0    1   0   1/2    50.0     0/0   0.0
Miles Bane             12    0    3    1   0   0/3     0.0     0/0   0.0
Tyler Porzingis        10    0    6    1   0   0/0     0.0     0/0   0.0

TEAM: FG: 8/16 (50.0%), 3PT: 3/6 (50.0%), REB: 16 (4 off, 12 def), AST: 3, TO: 3
TEAM FOULS: 7 [Team_001 in BONUS]

================================================================================

================================================================================
                       2ND QUARTER - Team_001 vs Team_002                       
================================================================================

[12:00] Team_001 possession (Score: 13-21)
Dirk Young attempts a 3Pt. Wide open! CJ Barrett is 7.3 feet away. [MAN] DIRK YOUNG MAKES IT! Assist: Kristaps Ming
Score: 16-21

[11:44] Team_002 possession (Score: 16-21)
Miles Bane attempts a 3Pt. Contested by Ja Dosunmu (4.1 feet, MAN). Miles Bane misses. Rebound secured by Cole Ball.

[11:29] Team_001 possession (Score: 16-21)
Dejounte McCollum attempts a Midrange. Contested by CJ Barrett (3.1 feet, ZONE). Dejounte McCollum misses. Rebound secured by CJ Barrett.

[11:15] Team_002 possession (Score: 16-21)
Miles Bane attempts a 3Pt. Wide open! Ja Dosunmu is 6.4 feet away. [ZONE] Miles Bane misses. Rebound secured by Dejounte McCollum.

[11:00] Team_001 possession (Score: 16-21)
Kristaps Ming attempts a Midrange. Wide open! Julius Curry is 8.3 feet away. [ZONE] KRISTAPS MING MAKES IT! Assist: Dirk Young
Score: 18-21

[10:43] Team_002 possession (Score: 18-21)
Lamelo O'Neal attempts a Midrange. Contested by Cole Ball (4.9 feet, ZONE). Lamelo O'Neal misses. Rebound secured by Kristaps Ming.

[10:25] Team_001 possession (Score: 18-21)
Ja Dosunmu attempts a 3Pt. Heavily contested by Miles Bane (0.5 feet, ZONE)! Ja Dosunmu misses. Rebound secured by Miles Bane.

[10:10] Team_002 possession (Score: 18-21)
Miles Bane attempts a 3Pt. Heavily contested by Ja Dosunmu (0.5 feet, ZONE)! MILES BANE MAKES IT! Assist: Lamelo O'Neal
Score: 18-24

[09:55] Team_001 possession (Score: 18-24)
Dirk Young attempts a 3Pt. Contested by Miles Bane (3.8 feet, ZONE). Dirk Young misses. Rebound secured by Miles Bane.

[09:41] Team_002 possession (Score: 18-24)
CJ Barrett drives, Dirk Young stays with him. CJ Barrett attempts a Layup. Contested by Dirk Young (3.8 feet, MAN). CJ Barrett misses. Offensive rebound by Lamelo O'Neal! Lamelo O'Neal puts it back in!
Score: 18-26

[09:25] Team_001 possession (Score: 18-26)
Cole Ball attempts a 3Pt. Contested by Jordan Green (5.2 feet, MAN). Cole Ball misses. Rebound secured by Lamelo O'Neal.

[09:12] Team_002 possession (Score: 18-26)
CJ Barrett attempts a 3Pt. Contested by Ja Dosunmu (4.7 feet, ZONE). CJ Barrett misses. Rebound secured by Cole Ball.

[08:58] Team_001 possession (Score: 18-26)
Ja Dosunmu attempts a 3Pt. Contested by Miles Bane (5.7 feet, ZONE). JA DOSUNMU MAKES IT! Assist: Cole Ball
Score: 21-26

[08:48] Team_002 possession (Score: 21-26)
Julius Curry drives and kicks out. Miles Bane attempts a 3Pt. Contested by Ja Dosunmu (5.2 feet, ZONE). Miles Bane misses. Offensive rebound by Lamelo O'Neal! Lamelo O'Neal's putback is no good. Rebound secured by Cole Ball.

[08:35] Team_001 possession (Score: 21-26)
Dirk Young attempts a 3Pt. Contested by CJ Barrett (4.6 feet, ZONE). Dirk Young misses. Offensive rebound by Cole Ball! Cole Ball kicks it out.

[08:22] Team_001 possession (Score: 21-26)
Dirk Young drives, CJ Barrett stays with him. Dirk Young attempts a Layup. Contested by CJ Barrett (2.7 feet, MAN). DIRK YOUNG MAKES IT! Assist: Kristaps Ming
Score: 23-26

[08:06] Team_002 possession (Score: 23-26)
Julius Curry drives, picks up Dejounte McCollum. Help arrives from Dirk Young! Julius Curry attempts a Dunk. Wide open! Dirk Young is 6.2 feet away. [ZONE] JULIUS CURRY MAKES IT!
Score: 23-28

[07:52] Team_001 possession (Score: 23-28)
Ja Dosunmu attempts a Midrange. Contested by Miles Bane (3.8 feet, MAN). Ja Dosunmu misses. Offensive rebound by Cole Ball! Cole Ball kicks it out.

[07:41] Team_001 possession (Score: 23-28)
Ja Dosunmu drives and kicks out. Kristaps Ming attempts a 3Pt. Contested by Miles Bane (4.9 feet, ZONE). KRISTAPS MING MAKES IT! Assist: Ja Dosunmu
Score: 26-28

[07:30] Team_002 possession (Score: 26-28)
Jordan Green attempts a 3Pt. Contested by Cole Ball (2.3 feet, MAN). Jordan Green misses. Rebound secured by Kristaps Ming.

[07:16] Team_001 possession (Score: 26-28)
Dejounte McCollum attempts a 3Pt. Contested by Julius Curry (5.3 feet, MAN). DEJOUNTE MCCOLLUM MAKES IT! Assist: Cole Ball
Score: 29-28

[07:06] Team_002 possession (Score: 29-28)
Miles Bane attempts a 3Pt. Heavily contested by Ja Dosunmu (1.7 feet, MAN)! Miles Bane misses. Rebound secured by Cole Ball.

[06:51] Team_001 possession (Score: 29-28)
Dejounte McCollum attempts a Midrange. Contested by Julius Curry (4.3 feet, MAN). Dejounte McCollum misses. Offensive rebound by Cole Ball! Cole Ball kicks it out.

[06:38] Team_001 possession (Score: 29-28)
Cole Ball attempts a 3Pt. Contested by Miles Bane (4.5 feet, ZONE). Cole Ball misses. Rebound secured by CJ Barrett.

[06:23] Team_002 possession (Score: 29-28)
FOUL! Shooting foul on Cole Ball. Jordan Green to the line for 2 free throws. [Team fouls: 1] (Cole Ball: 1 personal fouls)   FT 1/2: GOOD   FT 2/2: GOOD Jordan Green makes 2/2 from the line.
Score: 29-30

[06:23] Substitution (Team_001): Dirk Young OUT → Rudy George IN (stamina_rule2)

[06:23] Substitution (Team_001): Cole Ball OUT → Larry Trent IN (stamina_rule2)

[06:23] Substitution (Team_001): Dejounte McCollum OUT → Franz Bryant IN (stamina_rule2)

[06:23] Substitution (Team_002): Miles Bane OUT → John Duncan IN (stamina_rule2)

[06:23] Substitution (Team_002): CJ Barrett OUT → Dirk Middleton IN (stamina_rule2)

[06:23] Substitution (Team_002): Jordan Green OUT → Anfernee Sexton IN (stamina_rule2)

[06:12] Team_002 possession (Score: 29-30)
Lamelo O'Neal makes the Layup and draws the foul on Kristaps Ming! And-1! Lamelo O'Neal to the line for 1. [Team fouls: 2] (Kristaps Ming: 1 personal fouls)   FT 1/1: GOOD Lamelo O'Neal makes 1/1 from the line.
Score: 29-33

[06:00] Team_001 possession (Score: 29-33)
Rudy George attempts a 3Pt. Contested by Dirk Middleton (5.0 feet, MAN). RUDY GEORGE MAKES IT! Assist: Kristaps Ming
Score: 32-33

[05:49] Team_002 possession (Score: 32-33)
John Duncan attempts a 3Pt. Contested by Ja Dosunmu (2.5 feet, ZONE). JOHN DUNCAN MAKES IT! Assist: Julius Curry
Score: 32-36

[05:34] Team_001 possession (Score: 32-36)
FOUL! Reach-in foul on Lamelo O'Neal during the drive. [Team fouls: 1] No free throws, side out. (Lamelo O'Neal: 2 personal fouls)

[05:17] Team_001 possession (Score: 32-36)
Franz Bryant drives to the basket... Franz Bryant loses the ball! Stripped by Lamelo O'Neal! TURNOVER! (live ball)

[05:00] Team_002 possession (Score: 32-36)
Anfernee Sexton loses the ball! Stripped by Larry Trent! TURNOVER! (live ball)

[04:49] Team_001 possession (Score: 32-36)
Kristaps Ming attempts a 3Pt. Contested by Dirk Middleton (3.6 feet, ZONE). Kristaps Ming misses. Rebound secured by Anfernee Sexton.

[04:37] Team_002 possession (Score: 32-36)
Dirk Middleton attempts a 3Pt. Wide open! Ja Dosunmu is 6.4 feet away. [ZONE] DIRK MIDDLETON MAKES IT! Assist: Julius Curry
Score: 32-39

[04:22] Team_001 possession (Score: 32-39)
Ja Dosunmu attempts a Midrange. Wide open! John Duncan is 10.0 feet away. [MAN] Ja Dosunmu misses. Rebound secured by Anfernee Sexton.

[04:06] Team_002 possession (Score: 32-39)
John Duncan attempts a Midrange. Contested by Franz Bryant (4.5 feet, ZONE). John Duncan misses. Rebound secured by Larry Trent.

[03:56] Team_001 possession (Score: 32-39)
Larry Trent attempts a Layup. Contested by Anfernee Sexton (6.0 feet, MAN). LARRY TRENT MAKES IT!
Score: 34-39

[03:43] Team_002 possession (Score: 34-39)
Julius Curry attempts a 3Pt. Contested by Franz Bryant (4.1 feet, MAN). Julius Curry misses. Rebound secured by Larry Trent.

[03:27] Team_001 possession (Score: 34-39)
FOUL! Holding foul on Dirk Middleton. [Team fouls: 2] No free throws, side out. (Dirk Middleton: 1 personal fouls)

[03:27] Substitution (Team_002): Lamelo O'Neal OUT → Tyler Porzingis IN (starter_return_rule1)

[03:13] Team_001 possession (Score: 34-39)
Rudy George makes the Midrange and draws the foul on John Duncan! And-1! Rudy George to the line for 1. [Team fouls: 3] (John Duncan: 1 personal fouls)   FT 1/1: GOOD Rudy George makes 1/1 from the line.
Score: 37-39

[03:00] Team_002 possession (Score: 37-39)
Dirk Middleton attempts a Midrange. Contested by Rudy George (2.6 feet, MAN). Dirk Middleton misses. Rebound secured by Franz Bryant.

[02:46] Team_001 possession (Score: 37-39)
Franz Bryant attempts a 3Pt. Contested by Dirk Middleton (5.0 feet, ZONE). FRANZ BRYANT MAKES IT! Assist: Larry Trent
Score: 40-39

[02:29] Team_002 possession (Score: 40-39)
Tyler Porzingis attempts a 3Pt. Contested by Kristaps Ming (5.0 feet, MAN). TYLER PORZINGIS MAKES IT! Assist: Julius Curry
Score: 40-42

[02:15] Team_001 possession (Score: 40-42)
Larry Trent attempts a Midrange. Contested by Anfernee Sexton (3.4 feet, MAN). Larry Trent misses. Rebound secured by Tyler Porzingis.

[01:59] Team_002 possession (Score: 40-42)
Anfernee Sexton attempts a 3Pt. Contested by Larry Trent (5.5 feet, MAN). Anfernee Sexton misses. Rebound secured by Franz Bryant.

[01:49] Team_001 possession (Score: 40-42)
Kristaps Ming attempts a Midrange. Heavily contested by Tyler Porzingis (0.5 feet, MAN)! Kristaps Ming misses. Rebound secured by Anfernee Sexton.

[01:39] Team_002 possession (Score: 40-42)
Tyler Porzingis attempts a 3Pt. Contested by Ja Dosunmu (2.5 feet, ZONE). Tyler Porzingis misses. Rebound secured by Franz Bryant.

[01:23] Team_001 possession (Score: 40-42)
Kristaps Ming attempts a Midrange. Contested by Tyler Porzingis (2.7 feet, MAN). Kristaps Ming misses. Offensive rebound by Rudy George! Rudy George kicks it out.

[01:11] Team_001 possession (Score: 40-42)
Rudy George attempts a 3Pt. Wide open! Dirk Middleton is 7.8 feet away. [ZONE] Rudy George misses. Rebound secured by Tyler Porzingis.

[00:58] Team_002 possession (Score: 40-42)
Dirk Middleton attempts a 3Pt. Contested by Ja Dosunmu (4.8 feet, ZONE). Dirk Middleton misses. Rebound secured by Rudy George.

[00:47] Team_001 possession (Score: 40-42)
Ja Dosunmu attempts a 3Pt. Wide open! Julius Curry is 6.8 feet away. [ZONE] JA DOSUNMU MAKES IT! Assist: Rudy George
Score: 43-42

[00:34] Team_002 possession (Score: 43-42)
John Duncan attempts a Layup. Wide open! Ja Dosunmu is 7.0 feet away. [MAN] JOHN DUNCAN MAKES IT! Assist: Julius Curry
Score: 43-44

[00:20] Team_001 possession (Score: 43-44)
Larry Trent drives and kicks out. Rudy George attempts a Midrange. Contested by Dirk Middleton (5.4 feet, MAN). Rudy George misses. Rebound secured by Anfernee Sexton.

[00:05] Team_002 possession (Score: 43-44)
Anfernee Sexton attempts a 3Pt. Wide open! Larry Trent is 7.2 feet away. [MAN] Anfernee Sexton misses. Rebound secured by Rudy George.

================================================================================
                              2ND QUARTER COMPLETE                              
================================================================================

2ND QUARTER SCORE: Team_001 30, Team_002 23

BOX SCORE:
================================================================================

Team_001
--------------------------------------------------------------------------------
Player                MIN  PTS  REB  AST  TO      FG   FG%      3P   3P%
--------------------------------------------------------------------------------
Ja Dosunmu             15    6    0    1   0   2/4    50.0     0/0   0.0
Rudy George             6    6    3    1   0   2/4    50.0     0/0   0.0
Dirk Young             18    5    0    1   0   2/3    66.7     0/0   0.0
Kristaps Ming          15    5    2    3   0   2/4    50.0     0/0   0.0
Dejounte McCollum      18    3    1    0   0   1/2    50.0     0/0   0.0
Franz Bryant            6    3    3    0   0   1/1   100.0     0/0   0.0
Larry Trent             6    2    2    1   0   1/2    50.0     0/0   0.0
Cole Ball              18    0    7    2   0   0/2     0.0     0/0   0.0

TEAM: FG: 11/22 (50.0%), 3PT: 7/13 (53.8%), REB: 17 (4 off, 13 def), AST: 9, TO: 1
TEAM FOULS: 2


Team_002
--------------------------------------------------------------------------------
Player                MIN  PTS  REB  AST  TO      FG   FG%      3P   3P%
--------------------------------------------------------------------------------
Lamelo O'Neal          11    5    2    1   0   2/3    66.7     0/0   0.0
John Duncan             6    5    0    0   0   2/3    66.7     0/0   0.0
Miles Bane             18    3    2    0   0   1/5    20.0     0/0   0.0
Dirk Middleton          6    3    0    0   0   1/3    33.3     0/0   0.0
Tyler Porzingis        13    3    2    0   0   1/2    50.0     0/0   0.0
Julius Curry           15    2    0    4   0   1/2    50.0     0/0   0.0
Jordan Green           18    2    0    0   0   0/1     0.0     0/0   0.0
CJ Barrett             18    0    2    0   0   0/1     0.0     0/0   0.0
Anfernee Sexton         6    0    4    0   0   0/2     0.0     0/0   0.0

TEAM: FG: 8/22 (36.4%), 3PT: 4/15 (26.7%), REB: 13 (2 off, 11 def), AST: 5, TO: 1
TEAM FOULS: 3

================================================================================

================================================================================
                       3RD QUARTER - Team_001 vs Team_002                       
================================================================================

[12:00] Team_001 possession (Score: 43-44)
Larry Trent drives, picks up Tyler Porzingis. Help arrives from John Duncan! Larry Trent attempts a Layup. Contested by John Duncan (4.3 feet, ZONE). LARRY TRENT MAKES IT!
Score: 45-44

[11:44] Team_002 possession (Score: 45-44)
John Duncan attempts a 3Pt. BLOCKED BY JA DOSUNMU! Ball is loose! Rebound secured by Larry Trent.

[11:27] Team_001 possession (Score: 45-44)
Kristaps Ming attempts a Midrange. Contested by Tyler Porzingis (2.4 feet, MAN). Kristaps Ming misses. Rebound secured by Julius Curry.

[11:17] Team_002 possession (Score: 45-44)
Dirk Middleton drives and kicks out. Anfernee Sexton attempts a Midrange. Wide open! Larry Trent is 6.1 feet away. [ZONE] Anfernee Sexton misses. Rebound secured by Kristaps Ming.

[11:01] Team_001 possession (Score: 45-44)
Kristaps Ming drives and kicks out. Franz Bryant attempts a Midrange. Contested by Tyler Porzingis (3.1 feet, MAN). FRANZ BRYANT MAKES IT! Assist: Ja Dosunmu
Score: 47-44

[10:48] Team_002 possession (Score: 47-44)
FOUL! Shooting foul on Larry Trent. John Duncan to the line for 2 free throws. [Team fouls: 1] (Larry Trent: 1 personal fouls)   FT 1/2: MISS   FT 2/2: MISS John Duncan makes 0/2 from the line. Rebound secured by Rudy George.

[10:38] Team_001 possession (Score: 47-44)
Larry Trent attempts a Midrange. Wide open! Anfernee Sexton is 6.1 feet away. [MAN] LARRY TRENT MAKES IT!
Score: 49-44

[10:26] Team_002 possession (Score: 49-44)
Dirk Middleton attempts a 3Pt. Wide open! Rudy George is 6.6 feet away. [MAN] Dirk Middleton misses. Rebound secured by Kristaps Ming.

[10:12] Team_001 possession (Score: 49-44)
Ja Dosunmu attempts a 3Pt. Contested by Julius Curry (4.4 feet, ZONE). Ja Dosunmu misses. Rebound secured by Anfernee Sexton.

[10:02] Team_002 possession (Score: 49-44)
Tyler Porzingis makes the Layup and draws the foul on Franz Bryant! And-1! Tyler Porzingis to the line for 1. [Team fouls: 2] (Franz Bryant: 1 personal fouls)   FT 1/1: GOOD Tyler Porzingis makes 1/1 from the line.
Score: 49-47

[09:46] Team_001 possession (Score: 49-47)
Larry Trent attempts a 3Pt. Wide open! Julius Curry is 7.7 feet away. [ZONE] Larry Trent misses. Rebound secured by Tyler Porzingis.

[09:32] Team_002 possession (Score: 49-47)
Anfernee Sexton attempts a 3Pt. Contested by Larry Trent (4.2 feet, MAN). ANFERNEE SEXTON MAKES IT! Assist: John Duncan
Score: 49-50

[09:19] Team_001 possession (Score: 49-50)
FOUL! Offensive foul on Larry Trent! Anfernee Sexton drew the charge! [Team fouls: 3] (Larry Trent: 2 personal fouls) TURNOVER! (dead ball)

[09:03] Team_002 possession (Score: 49-50)
John Duncan attempts a Midrange. Contested by Ja Dosunmu (5.3 feet, MAN). John Duncan misses. Rebound secured by Rudy George.

[08:50] Team_001 possession (Score: 49-50)
Kristaps Ming attempts a 3Pt. Contested by Tyler Porzingis (3.0 feet, MAN). Kristaps Ming misses. Rebound secured by Tyler Porzingis.

[08:35] Team_002 possession (Score: 49-50)
Julius Curry attempts a 3Pt. Contested by Franz Bryant (3.7 feet, MAN). Julius Curry misses. Rebound secured by Rudy George.

[08:18] Team_001 possession (Score: 49-50)
Franz Bryant attempts a 3Pt. Contested by Dirk Middleton (5.4 feet, ZONE). FRANZ BRYANT MAKES IT! Assist: Ja Dosunmu
Score: 52-50

[08:00] Team_002 possession (Score: 52-50)
Dirk Middleton attempts a 3Pt. Contested by Rudy George (2.8 feet, MAN). DIRK MIDDLETON MAKES IT! Assist: John Duncan
Score: 52-53

[07:43] Team_001 possession (Score: 52-53)
FOUL! Reach-in foul on Dirk Middleton during the drive. [Team fouls: 1] No free throws, side out. (Dirk Middleton: 2 personal fouls)

[07:30] Team_001 possession (Score: 52-53)
Franz Bryant attempts a 3Pt. Contested by Julius Curry (6.0 feet, ZONE). Franz Bryant misses. Rebound secured by Anfernee Sexton.

[07:12] Team_002 possession (Score: 52-53)
Dirk Middleton loses the ball! Stripped by Rudy George! TURNOVER! (live ball)

[06:55] Team_001 possession (Score: 52-53)
Rudy George drives and kicks out. Kristaps Ming attempts a 3Pt. Wide open! Julius Curry is 7.0 feet away. [ZONE] Kristaps Ming misses. Rebound secured by Tyler Porzingis.

[06:39] Team_002 possession (Score: 52-53)
Shot clock violation! Julius Curry couldn't get a shot off in time! TURNOVER! (dead ball)

[06:24] Team_001 possession (Score: 52-53)
Rudy George attempts a Midrange. Contested by Dirk Middleton (5.9 feet, MAN). RUDY GEORGE MAKES IT! Assist: Ja Dosunmu
Score: 54-53

[06:12] Team_002 possession (Score: 54-53)
Tyler Porzingis attempts a Midrange. Contested by Rudy George (3.1 feet, ZONE). Tyler Porzingis misses. Rebound secured by Kristaps Ming.

[05:54] Team_001 possession (Score: 54-53)
Larry Trent attempts a 3Pt. Wide open! Anfernee Sexton is 7.4 feet away. [MAN] LARRY TRENT MAKES IT! Assist: Ja Dosunmu
Score: 57-53

[05:42] Team_002 possession (Score: 57-53)
John Duncan attempts a 3Pt. Contested by Franz Bryant (2.4 feet, ZONE). John Duncan misses. Offensive rebound by Anfernee Sexton! Anfernee Sexton kicks it out.

[05:30] Team_002 possession (Score: 57-53)
Anfernee Sexton attempts a 3Pt. Contested by Ja Dosunmu (4.8 feet, ZONE). Anfernee Sexton misses. Rebound secured by Larry Trent.

[05:17] Team_001 possession (Score: 57-53)
Larry Trent attempts a 3Pt. Contested by Anfernee Sexton (2.4 feet, MAN). Larry Trent misses. Rebound secured by Tyler Porzingis.

[05:00] Team_002 possession (Score: 57-53)
Tyler Porzingis drives to the basket... Tyler Porzingis throws a bad pass out of bounds! TURNOVER! (dead ball)

[05:00] Substitution (Team_001): Ja Dosunmu OUT → Klay Harden IN (starter_return_rule1)

[05:00] Substitution (Team_001): Rudy George OUT → Dirk Young IN (starter_return_rule1)

[05:00] Substitution (Team_001): Larry Trent OUT → Cole Ball IN (starter_return_rule1)

[05:00] Substitution (Team_001): Franz Bryant OUT → Dejounte McCollum IN (starter_return_rule1)

[05:00] Substitution (Team_001): Kristaps Ming OUT → Miles Griffin IN (starter_return_rule1)

[05:00] Substitution (Team_002): John Duncan OUT → Miles Bane IN (starter_return_rule1)

[05:00] Substitution (Team_002): Dirk Middleton OUT → CJ Barrett IN (starter_return_rule1)

[05:00] Substitution (Team_002): Anfernee Sexton OUT → Jordan Green IN (starter_return_rule1)

[05:00] Substitution (Team_002): Julius Curry OUT → Carmelo Lowry IN (starter_return_rule1)

[04:50] Team_001 possession (Score: 57-53)
Dejounte McCollum attempts a Midrange. Contested by Jordan Green (5.9 feet, ZONE). DEJOUNTE MCCOLLUM MAKES IT! Assist: Klay Harden
Score: 59-53

[04:37] Team_002 possession (Score: 59-53)
Carmelo Lowry attempts a Midrange. Heavily contested by Dejounte McCollum (1.0 feet, MAN)! CARMELO LOWRY MAKES IT! Assist: Jordan Green
Score: 59-55

[04:27] Team_001 possession (Score: 59-55)
FOUL! Shooting foul on CJ Barrett. Dirk Young to the line for 2 free throws. [Team fouls: 2] (CJ Barrett: 2 personal fouls)   FT 1/2: GOOD   FT 2/2: GOOD Dirk Young makes 2/2 from the line.
Score: 61-55

[04:13] Team_001 possession (Score: 61-55)
Klay Harden attempts a 3Pt. Contested by Miles Bane (4.2 feet, MAN). Klay Harden misses. Offensive rebound by Cole Ball! Cole Ball kicks it out.

[03:57] Team_001 possession (Score: 61-55)
Cole Ball attempts a 3Pt. Heavily contested by Jordan Green (0.5 feet, MAN)! Cole Ball misses. Rebound secured by Miles Bane.

[03:44] Team_002 possession (Score: 61-55)
Jordan Green attempts a 3Pt. Contested by Klay Harden (2.7 feet, ZONE). Jordan Green misses. Rebound secured by Cole Ball.

[03:24] Team_001 possession (Score: 61-55)
Cole Ball drives to the basket... Cole Ball throws a bad pass! Stolen by Jordan Green! TURNOVER! (live ball)

[03:07] Team_002 possession (Score: 61-55)
Tyler Porzingis attempts a Midrange. Wide open! Miles Griffin is 7.9 feet away. [MAN] Tyler Porzingis misses. Rebound secured by Dejounte McCollum.

[02:54] Team_001 possession (Score: 61-55)
Dejounte McCollum attempts a Midrange. Contested by Carmelo Lowry (4.4 feet, MAN). Dejounte McCollum misses. Rebound secured by Carmelo Lowry.

[02:43] Team_002 possession (Score: 61-55)
Miles Bane drives and kicks out. Tyler Porzingis attempts a Midrange. Contested by Miles Griffin (4.0 feet, MAN). TYLER PORZINGIS MAKES IT! Assist: Carmelo Lowry
Score: 61-57

[02:31] Team_001 possession (Score: 61-57)
Klay Harden attempts a Layup. Heavily contested by Miles Bane (1.5 feet, MAN)! Klay Harden misses. Offensive rebound by Cole Ball! Cole Ball kicks it out.

[02:17] Team_001 possession (Score: 61-57)
Cole Ball drives and kicks out. Dirk Young attempts a 3Pt. Contested by CJ Barrett (2.8 feet, ZONE). Dirk Young misses. Rebound secured by Carmelo Lowry.

[02:00] Team_002 possession (Score: 61-57)
Jordan Green attempts a 3Pt. Contested by Klay Harden (5.7 feet, ZONE). Jordan Green misses. Rebound secured by Cole Ball.

[01:48] Team_001 possession (Score: 61-57)
Dirk Young attempts a 3Pt. Contested by CJ Barrett (2.2 feet, MAN). DIRK YOUNG MAKES IT! Assist: Cole Ball
Score: 64-57

[01:33] Team_002 possession (Score: 64-57)
FOUL! Reach-in foul on Dejounte McCollum during the drive. [Team fouls: 4] No free throws, side out. (Dejounte McCollum: 2 personal fouls)

[01:33] Substitution (Team_002): Tyler Porzingis OUT → Lamelo O'Neal IN (stamina_rule2)

[01:22] Team_002 possession (Score: 64-57)
Lamelo O'Neal attempts a 3Pt. Contested by Cole Ball (3.1 feet, ZONE). Lamelo O'Neal misses. Rebound secured by Cole Ball.

[01:06] Team_001 possession (Score: 64-57)
Cole Ball attempts a 3Pt. Wide open! Jordan Green is 6.4 feet away. [MAN] COLE BALL MAKES IT! Assist: Klay Harden
Score: 67-57

[00:51] Team_002 possession (Score: 67-57)
CJ Barrett attempts a Midrange. Contested by Dejounte McCollum (5.3 feet, ZONE). CJ BARRETT MAKES IT! Assist: Jordan Green
Score: 67-59

[00:40] Team_001 possession (Score: 67-59)
Dirk Young loses the ball! Stripped by CJ Barrett! TURNOVER! (live ball)

[00:23] Team_002 possession (Score: 67-59)
Carmelo Lowry attempts a Midrange. Contested by Dirk Young (2.4 feet, ZONE). CARMELO LOWRY MAKES IT!
Score: 67-61

[00:07] Team_001 possession (Score: 67-61)
Dirk Young attempts a Midrange. Contested by CJ Barrett (4.6 feet, MAN). Dirk Young misses. Offensive rebound by Cole Ball! Cole Ball kicks it out.

================================================================================
                              3RD QUARTER COMPLETE                              
================================================================================

3RD QUARTER SCORE: Team_001 24, Team_002 17

BOX SCORE:
================================================================================

Team_001
--------------------------------------------------------------------------------
Player                MIN  PTS  REB  AST  TO      FG   FG%      3P   3P%
--------------------------------------------------------------------------------
Larry Trent            14    7    2    0   0   3/5    60.0     0/0   0.0
Franz Bryant           14    5    0    0   0   2/3    66.7     0/0   0.0
Dirk Young             23    5    0    0   0   1/2    50.0     0/0   0.0
Cole Ball              23    3    6    1   0   1/2    50.0     0/0   0.0
Rudy George            14    2    3    0   0   1/1   100.0     0/0   0.0
Dejounte McCollum      23    2    1    0   0   1/2    50.0     0/0   0.0
Kristaps Ming          22    0    3    0   0   0/3     0.0     0/0   0.0
Ja Dosunmu             22    0    0    4   0   0/1     0.0     0/0   0.0
Klay Harden            15    0    0    2   0   0/0     0.0     0/0   0.0

TEAM: FG: 9/19 (47.4%), 3PT: 4/12 (33.3%), REB: 15 (3 off, 12 def), AST: 7, TO: 3
TEAM FOULS: 4


Team_002
--------------------------------------------------------------------------------
Player                MIN  PTS  REB  AST  TO      FG   FG%      3P   3P%
--------------------------------------------------------------------------------
Tyler Porzingis        24    5    4    0   0   2/4    50.0     0/0   0.0
Carmelo Lowry          15    4    2    1   0   2/2   100.0     0/0   0.0
Anfernee Sexton        14    3    3    0   0   1/3    33.3     0/0   0.0
Dirk Middleton         14    3    0    0   0   1/2    50.0     0/0   0.0
CJ Barrett             23    2    0    0   0   1/1   100.0     0/0   0.0
John Duncan            14    0    0    2   0   0/3     0.0     0/0   0.0
Julius Curry           22    0    1    0   0   0/1     0.0     0/0   0.0
Jordan Green           23    0    0    2   0   0/2     0.0     0/0   0.0
Miles Bane             23    0    1    0   0   0/0     0.0     0/0   0.0
Lamelo O'Neal          13    0    0    0   0   0/1     0.0     0/0   0.0

TEAM: FG: 7/19 (36.8%), 3PT: 2/9 (22.2%), REB: 11 (1 off, 10 def), AST: 5, TO: 3
TEAM FOULS: 2

================================================================================

================================================================================
                       4TH QUARTER - Team_001 vs Team_002                       
================================================================================

[12:00] Team_001 possession (Score: 67-61)
Cole Ball attempts a Midrange. Wide open! Lamelo O'Neal is 7.4 feet away. [ZONE] Cole Ball misses. Offensive rebound by Cole Ball! Cole Ball kicks it out.

[11:46] Team_001 possession (Score: 67-61)
Miles Griffin attempts a 3Pt. Wide open! Lamelo O'Neal is 8.2 feet away. [MAN] Miles Griffin misses. Rebound secured by Carmelo Lowry.

[11:32] Team_002 possession (Score: 67-61)
Carmelo Lowry attempts a 3Pt. Contested by Klay Harden (3.7 feet, ZONE). CARMELO LOWRY MAKES IT! Assist: Jordan Green
Score: 67-64

[11:15] Team_001 possession (Score: 67-64)
Miles Griffin commits a violation (traveling/carry)! TURNOVER! (dead ball)

[11:05] Team_002 possession (Score: 67-64)
Carmelo Lowry drives, Miles Griffin stays with him. Carmelo Lowry attempts a Layup. Heavily contested by Miles Griffin (1.8 feet, ZONE)! Carmelo Lowry misses. Rebound secured by Dejounte McCollum.

[10:50] Team_001 possession (Score: 67-64)
Dirk Young drives and kicks out. Cole Ball attempts a Midrange. Contested by Jordan Green (4.9 feet, ZONE). COLE BALL MAKES IT! Assist: Miles Griffin
Score: 69-64

[10:36] Team_002 possession (Score: 69-64)
Jordan Green attempts a Midrange. Contested by Cole Ball (4.1 feet, ZONE). Jordan Green misses. Rebound secured by Cole Ball.

[10:27] Team_001 possession (Score: 69-64)
Dirk Young attempts a 3Pt. Contested by CJ Barrett (5.4 feet, ZONE). DIRK YOUNG MAKES IT! Assist: Klay Harden
Score: 72-64

[10:12] Team_002 possession (Score: 72-64)
CJ Barrett attempts a Layup. BLOCKED BY DIRK YOUNG! Ball deflects out of bounds off CJ Barrett.

[09:59] Team_001 possession (Score: 72-64)
Miles Griffin drives to the basket... FOUL! Offensive foul on Miles Griffin! Lamelo O'Neal drew the charge! [Team fouls: 1] (Miles Griffin: 2 personal fouls) TURNOVER! (dead ball)

[09:48] Team_002 possession (Score: 72-64)
Jordan Green attempts a 3Pt. Contested by Klay Harden (5.9 feet, ZONE). Jordan Green misses. Rebound secured by Dejounte McCollum.

[09:30] Team_001 possession (Score: 72-64)
Klay Harden attempts a Midrange. Contested by Carmelo Lowry (2.9 feet, ZONE). KLAY HARDEN MAKES IT! Assist: Dejounte McCollum
Score: 74-64

[09:18] Team_002 possession (Score: 74-64)
CJ Barrett attempts a 3Pt. Contested by Klay Harden (5.7 feet, ZONE). CJ BARRETT MAKES IT! Assist: Miles Bane
Score: 74-67

[09:00] Team_001 possession (Score: 74-67)
Klay Harden attempts a 3Pt. Wide open! Miles Bane is 6.1 feet away. [MAN] Klay Harden misses. Offensive rebound by Miles Griffin! Miles Griffin kicks it out.

[08:47] Team_001 possession (Score: 74-67)
Dejounte McCollum attempts a 3Pt. Contested by CJ Barrett (4.7 feet, ZONE). Dejounte McCollum misses. Rebound secured by Miles Bane.

[08:32] Team_002 possession (Score: 74-67)
Jordan Green attempts a Midrange. Wide open! Cole Ball is 6.5 feet away. [MAN] Jordan Green misses. Rebound secured by Cole Ball.

[08:16] Team_001 possession (Score: 74-67)
Klay Harden attempts a 3Pt. Contested by CJ Barrett (4.9 feet, ZONE). Klay Harden misses. Rebound secured by Lamelo O'Neal.

[08:05] Team_002 possession (Score: 74-67)
Carmelo Lowry attempts a 3Pt. Contested by Cole Ball (3.1 feet, ZONE). Carmelo Lowry misses. Rebound secured by Cole Ball.

[07:52] Team_001 possession (Score: 74-67)
Klay Harden attempts a 3Pt. Contested by Miles Bane (3.3 feet, MAN). Klay Harden misses. FOUL! Loose ball foul on Carmelo Lowry during the rebound battle. [Team fouls: 1] No free throws, side out. (Carmelo Lowry: 2 personal fouls)

[07:40] Team_001 possession (Score: 74-67)
Klay Harden drives to the basket... Klay Harden throws a bad pass! Stolen by Lamelo O'Neal! TURNOVER! (live ball)

[07:23] Team_002 possession (Score: 74-67)
FOUL! Holding foul on Dirk Young. [Team fouls: 2] No free throws, side out. (Dirk Young: 4 personal fouls)

[07:23] Substitution (Team_002): Lamelo O'Neal OUT → Tyler Porzingis IN (starter_return_rule1)

[07:08] Team_002 possession (Score: 74-67)
CJ Barrett drives and kicks out. FOUL! Shooting foul on Cole Ball. Jordan Green to the line for 2 free throws. [Team fouls: 3] (Cole Ball: 2 personal fouls)   FT 1/2: GOOD   FT 2/2: MISS Jordan Green makes 1/2 from the line. Rebound secured by Cole Ball.
Score: 74-68

[06:51] Team_001 possession (Score: 74-68)
Cole Ball makes the Dunk and draws the foul on Jordan Green! And-1! Cole Ball to the line for 1. [Team fouls: 2] (Jordan Green: 1 personal fouls)   FT 1/1: GOOD Cole Ball makes 1/1 from the line.
Score: 77-68

[06:39] Team_002 possession (Score: 77-68)
Tyler Porzingis attempts a 3Pt. Contested by Miles Griffin (5.9 feet, MAN). Tyler Porzingis misses. Offensive rebound by Tyler Porzingis! Tyler Porzingis's putback is no good. Rebound secured by Dejounte McCollum.

[06:24] Team_001 possession (Score: 77-68)
Miles Griffin throws a bad pass! Stolen by Tyler Porzingis! TURNOVER! (live ball)

[06:07] Team_002 possession (Score: 77-68)
FOUL! Shooting foul on Klay Harden. CJ Barrett to the line for 3 free throws. [Team fouls: 4] (Klay Harden: 3 personal fouls)   FT 1/3: GOOD   FT 2/3: MISS   FT 3/3: GOOD CJ Barrett makes 2/3 from the line.
Score: 77-70

[05:54] Team_002 possession (Score: 77-70)
Miles Bane attempts a Midrange. BLOCKED BY COLE BALL! Ball is loose! Rebound secured by Cole Ball.

[05:39] Team_001 possession (Score: 77-70)
Cole Ball drives, picks up Tyler Porzingis. Help arrives from CJ Barrett! Cole Ball attempts a Layup. Heavily contested by CJ Barrett (0.5 feet, ZONE)! COLE BALL MAKES IT! Assist: Dejounte McCollum
Score: 79-70

[05:21] Team_002 possession (Score: 79-70)
Carmelo Lowry attempts a 3Pt. Contested by Klay Harden (5.8 feet, ZONE). CARMELO LOWRY MAKES IT! Assist: Tyler Porzingis
Score: 79-73

[05:05] Team_001 possession (Score: 79-73)
Miles Griffin drives to the basket... FOUL! Offensive foul on Miles Griffin! Tyler Porzingis drew the charge! [Team fouls: 5] (Miles Griffin: 3 personal fouls) TURNOVER! (dead ball)

[04:55] Team_002 possession (Score: 79-73)
Miles Bane attempts a 3Pt. Contested by Klay Harden (4.6 feet, ZONE). Miles Bane misses. Offensive rebound by Carmelo Lowry! Carmelo Lowry kicks it out.

[04:41] Team_002 possession (Score: 79-73)
Tyler Porzingis drives, Dejounte McCollum stays with him. Tyler Porzingis attempts a Dunk. Heavily contested by Dejounte McCollum (0.5 feet, ZONE)! TYLER PORZINGIS MAKES IT! Assist: CJ Barrett
Score: 79-75

[04:23] Team_001 possession (Score: 79-75)
Klay Harden attempts a 3Pt. Contested by Miles Bane (4.8 feet, MAN). Klay Harden misses. Rebound secured by Carmelo Lowry.

[04:05] Team_002 possession (Score: 79-75)
Carmelo Lowry drives, Dejounte McCollum stays with him. Carmelo Lowry attempts a Layup. Contested by Dejounte McCollum (3.0 feet, MAN). CARMELO LOWRY MAKES IT!
Score: 79-77

[03:52] Team_001 possession (Score: 79-77)
Miles Griffin attempts a 3Pt. Wide open! Miles Bane is 6.7 feet away. [ZONE] Miles Griffin misses. Rebound secured by Carmelo Lowry.

[03:39] Team_002 possession (Score: 79-77)
CJ Barrett drives, Dejounte McCollum stays with him. CJ Barrett attempts a Layup. Heavily contested by Dejounte McCollum (1.8 feet, ZONE)! CJ Barrett misses. Rebound secured by Cole Ball.

[03:20] Team_001 possession (Score: 79-77)
Cole Ball attempts a 3Pt. Contested by Jordan Green (4.1 feet, MAN). COLE BALL MAKES IT! Assist: Klay Harden
Score: 82-77

[03:06] Team_002 possession (Score: 82-77)
Jordan Green attempts a 3Pt. Wide open! Cole Ball is 7.7 feet away. [MAN] Jordan Green misses. Offensive rebound by Miles Bane! Miles Bane kicks it out.

[02:52] Team_002 possession (Score: 82-77)
Jordan Green attempts a Layup. BLOCKED BY COLE BALL! Ball is loose! Rebound secured by Cole Ball.

[02:37] Team_001 possession (Score: 82-77)
Dirk Young attempts a 3Pt. Contested by Miles Bane (4.5 feet, ZONE). Dirk Young misses. Rebound secured by Miles Bane.

[02:19] Team_002 possession (Score: 82-77)
Tyler Porzingis attempts a Layup. Contested by Miles Griffin (5.0 feet, MAN). TYLER PORZINGIS MAKES IT! Assist: Jordan Green
Score: 82-79

[02:05] Team_001 possession (Score: 82-79)
Miles Griffin attempts a Midrange. Contested by CJ Barrett (2.6 feet, ZONE). Miles Griffin misses. Rebound secured by Miles Bane.

[01:51] Team_002 possession (Score: 82-79)
Jordan Green attempts a 3Pt. Contested by Cole Ball (3.2 feet, ZONE). Jordan Green misses. Rebound secured by Miles Griffin.

[01:37] Team_001 possession (Score: 82-79)
Dirk Young drives, picks up Tyler Porzingis. Help arrives from CJ Barrett! Dirk Young attempts a Layup. Heavily contested by CJ Barrett (1.7 feet, ZONE)! DIRK YOUNG MAKES IT!
Score: 84-79

[01:23] Team_002 possession (Score: 84-79)
Carmelo Lowry drives, picks up Dejounte McCollum. Help arrives from Klay Harden! Carmelo Lowry attempts a Layup. Contested by Klay Harden (4.4 feet, MAN). CARMELO LOWRY MAKES IT! Assist: Miles Bane
Score: 84-81

[01:11] Team_001 possession (Score: 84-81)
Dejounte McCollum attempts a Midrange. Contested by Jordan Green (2.6 feet, ZONE). Dejounte McCollum misses. Rebound secured by CJ Barrett.

[00:59] Team_002 possession (Score: 84-81)
Tyler Porzingis drives, picks up Miles Griffin. Help arrives from Klay Harden! Tyler Porzingis attempts a Dunk. Contested by Klay Harden (3.5 feet, MAN). TYLER PORZINGIS MAKES IT! Assist: Jordan Green
Score: 84-83

[00:45] Team_001 possession (Score: 84-83)
Miles Griffin attempts a Midrange. Wide open! Tyler Porzingis is 6.0 feet away. [MAN] Miles Griffin misses. FOUL! Loose ball foul on CJ Barrett during the rebound battle. [Team fouls: 3] No free throws, side out. (CJ Barrett: 3 personal fouls)

[00:30] Team_001 possession (Score: 84-83)
Klay Harden attempts a Midrange. Contested by Tyler Porzingis (4.4 feet, ZONE). Klay Harden misses. Rebound secured by Miles Bane.

[00:15] Team_002 possession (Score: 84-83)
Tyler Porzingis attempts a Midrange. Contested by Miles Griffin (4.0 feet, MAN). Tyler Porzingis misses. Rebound secured by Cole Ball.

================================================================================
                              4TH QUARTER COMPLETE                              
================================================================================

4TH QUARTER SCORE: Team_001 17, Team_002 22

BOX SCORE:
================================================================================

Team_001
--------------------------------------------------------------------------------
Player                MIN  PTS  REB  AST  TO      FG   FG%      3P   3P%
--------------------------------------------------------------------------------
Cole Ball              35   10    9    0   0   4/4   100.0     0/0   0.0
Dirk Young             35    5    0    0   0   2/3    66.7     0/0   0.0
Klay Harden            27    2    0    2   0   1/4    25.0     0/0   0.0
Miles Griffin          27    0    3    1   0   0/3     0.0     0/0   0.0
Dejounte McCollum      35    0    4    2   0   0/2     0.0     0/0   0.0

TEAM: FG: 7/16 (43.8%), 3PT: 2/8 (25.0%), REB: 15 (4 off, 11 def), AST: 5, TO: 5
TEAM FOULS: 5 [Team_002 in BONUS]


Team_002
--------------------------------------------------------------------------------
Player                MIN  PTS  REB  AST  TO      FG   FG%      3P   3P%
--------------------------------------------------------------------------------
Carmelo Lowry          27   10    4    0   0   4/6    66.7     0/0   0.0
Tyler Porzingis        31    6    0    1   0   3/5    60.0     0/0   0.0
CJ Barrett             35    5    1    1   0   1/3    33.3     0/0   0.0
Jordan Green           35    1    0    3   0   0/6     0.0     0/0   0.0
Miles Bane             35    0    5    2   0   0/1     0.0     0/0   0.0
Lamelo O'Neal          17    0    1    0   0   0/0     0.0     0/0   0.0

TEAM: FG: 8/21 (38.1%), 3PT: 3/7 (42.9%), REB: 12 (3 off, 9 def), AST: 7, TO: 0
TEAM FOULS: 3

================================================================================

================================================================================
                               FULL GAME COMPLETE                               
================================================================================

FINAL SCORE: Team_001 84, Team_002 83

SCORING BY QUARTER:
--------------------------------------------------------------------------------
Team                     Q1     Q2     Q3     Q4    FINAL
--------------------------------------------------------------------------------
Team_001                 13     30     24     17       84
Team_002                 21     23     17     22       83
--------------------------------------------------------------------------------

FULL GAME BOX SCORE:
================================================================================

Team_001
--------------------------------------------------------------------------------
Player                MIN  PTS  REB  AST  TO      FG   FG%      3P   3P%      FT STL BLK
--------------------------------------------------------------------------------
Dirk Young             35   18    0    1   2   6/10   60.0   4/7    57.1   2/2     2   1
Cole Ball              35   21   27    4   1   7/15   46.7   2/9    22.2   3/4     0   2
Dejounte McCollum      35    5    8    2   0   2/7    28.6   1/3    33.3   0/0     0   0
Klay Harden            27    5    0    4   1   2/6    33.3   1/4    25.0   0/0     0   0
Miles Griffin          27    2    7    2   4   1/6    16.7   0/3     0.0   0/2     0   1
Ja Dosunmu             22    6    0    5   0   2/6    33.3   2/5    40.0   0/0     0   1
Kristaps Ming          22    5    5    3   1   2/8    25.0   1/4    25.0   0/0     0   0
Rudy George            14    8    6    1   0   3/5    60.0   1/2    50.0   1/1     1   0
Larry Trent            14    9    4    1   2   4/7    57.1   1/3    33.3   0/0     1   0
Franz Bryant           14    8    3    0   0   3/4    75.0   2/3    66.7   0/0     0   0

TEAM: FG: 32/74 (43.2%), 3PT: 15/43 (34.9%), REB: 58 (14 off, 44 def), AST: 23, TO: 11


Team_002
--------------------------------------------------------------------------------
Player                MIN  PTS  REB  AST  TO      FG   FG%      3P   3P%      FT STL BLK
--------------------------------------------------------------------------------
Miles Bane             35    3   11    3   0   1/9    11.1   1/6    16.7   0/0     0   0
CJ Barrett             35   16    4    1   1   5/10   50.0   1/3    33.3   5/6     1   0
Jordan Green           35    6    0    6   0   1/11    9.1   1/6    16.7   3/4     1   0
Tyler Porzingis        31   14   12    2   1   6/11   54.5   1/3    33.3   1/1     2   0
Carmelo Lowry          27   19   12    1   0   8/12   66.7   3/5    60.0   0/0     0   1
Julius Curry           22    2    1    4   2   2/4    50.0   1/3    33.3   0/0     0   0
Lamelo O'Neal          17    9    3    1   0   3/6    50.0   0/1     0.0   3/3     3   1
John Duncan            14    5    0    2   1   2/6    33.3   1/2    50.0   0/2     0   0
Dirk Middleton         14    6    0    0   1   2/5    40.0   2/4    50.0   0/0     0   0
Anfernee Sexton        14    3    7    0   1   1/5    20.0   1/4    25.0   0/0     0   0

TEAM: FG: 31/78 (39.7%), 3PT: 12/37 (32.4%), REB: 52 (10 off, 42 def), AST: 20, TO: 7

================================================================================
