================================================================================
                        FULL GAME - Team_001 vs Team_002                        
================================================================================

================================================================================
                       1ST QUARTER - Team_001 vs Team_002                       
================================================================================

[12:00] Team_001 possession (Score: 0-0)
Dejounte McCollum drives, picks up Tyler Porzingis. Help arrives from CJ Barrett! Dejounte McCollum attempts a Dunk. Heavily contested by CJ Barrett (1.3 feet, ZONE)! DEJOUNTE MCCOLLUM MAKES IT! Assist: Cole Ball
Score: 2-0

[11:43] Team_002 possession (Score: 2-0)
Miles Bane attempts a 3Pt. Contested by Cole Ball (3.5 feet, ZONE). Miles Bane misses. Rebound secured by Dejounte McCollum.

[11:28] Team_001 possession (Score: 2-0)
Dirk Young attempts a 3Pt. Contested by CJ Barrett (3.2 feet, ZONE). DIRK YOUNG MAKES IT! Assist: Dejounte McCollum
Score: 5-0

[11:16] Team_002 possession (Score: 5-0)
Jordan Green attempts a Midrange. Contested by Klay Harden (3.6 feet, ZONE). JORDAN GREEN MAKES IT!
Score: 5-2

[11:03] Team_001 possession (Score: 5-2)
Dirk Young attempts a 3Pt. Heavily contested by CJ Barrett (0.9 feet, ZONE)! Dirk Young misses. Offensive rebound by Miles Griffin! Miles Griffin kicks it out.

[10:47] Team_001 possession (Score: 5-2)
Cole Ball drives and kicks out. Dejounte McCollum attempts a 3Pt. Contested by CJ Barrett (4.2 feet, ZONE). Dejounte McCollum misses. Rebound secured by Carmelo Lowry.

[10:32] Team_002 possession (Score: 5-2)
Miles Bane attempts a 3Pt. Contested by Klay Harden (4.2 feet, MAN). Miles Bane misses. Rebound secured by Dejounte McCollum.

[10:21] Team_001 possession (Score: 5-2)
Cole Ball attempts a 3Pt. Contested by CJ Barrett (5.3 feet, ZONE). Cole Ball misses. Rebound secured by Carmelo Lowry.

[10:08] Team_002 possession (Score: 5-2)
Miles Bane loses the ball! Stripped by Klay Harden! TURNOVER! (live ball)

[09:58] Team_001 possession (Score: 5-2)
Dejounte McCollum attempts a Dunk. BLOCKED BY CARMELO LOWRY! Ball is loose! Rebound secured by Tyler Porzingis.

[09:43] Team_002 possession (Score: 5-2)
FOUL! Shooting foul on Dirk Young. Miles Bane to the line for 2 free throws. [Team fouls: 1] (Dirk Young: 1 personal fouls)   FT 1/2: MISS   FT 2/2: MISS Miles Bane makes 0/2 from the line. Rebound secured by Miles Griffin.

[09:29] Team_001 possession (Score: 5-2)
Cole Ball attempts a 3Pt. Contested by Carmelo Lowry (5.2 feet, ZONE). Cole Ball misses. Rebound secured by Carmelo Lowry.

[09:11] Team_002 possession (Score: 5-2)
Jordan Green throws a bad pass! Stolen by Cole Ball! TURNOVER! (live ball)

[08:53] Team_001 possession (Score: 5-2)
Cole Ball attempts a 3Pt. Contested by Jordan Green (4.2 feet, MAN). COLE BALL MAKES IT! Assist: Dirk Young
Score: 8-2

[08:35] Team_002 possession (Score: 8-2)
Jordan Green attempts a 3Pt. Wide open! Cole Ball is 7.0 feet away. [MAN] JORDAN GREEN MAKES IT! Assist: CJ Barrett
Score: 8-5

[08:20] Team_001 possession (Score: 8-5)
Cole Ball drives and kicks out. Klay Harden attempts a 3Pt. Wide open! Miles Bane is 6.9 feet away. [MAN] Klay Harden misses. Rebound secured by Miles Bane.

[08:09] Team_002 possession (Score: 8-5)
FOUL! Holding foul on Cole Ball. [Team fouls: 2] No free throws, side out. (Cole Ball: 1 personal fouls)

[07:53] Team_002 possession (Score: 8-5)
Miles Bane attempts a 3Pt. Heavily contested by Dirk Young (0.5 feet, ZONE)! MILES BANE MAKES IT! Assist: Tyler Porzingis
Score: 8-8

[07:36] Team_001 possession (Score: 8-8)
Miles Griffin attempts a Midrange. Contested by CJ Barrett (3.6 feet, ZONE). Miles Griffin misses. Rebound secured by Miles Bane.

[07:22] Team_002 possession (Score: 8-8)
CJ Barrett attempts a 3Pt. Contested by Dirk Young (2.9 feet, MAN). CJ Barrett misses. Rebound secured by Dejounte McCollum.

[07:03] Team_001 possession (Score: 8-8)
Miles Griffin attempts a 3Pt. Contested by Tyler Porzingis (4.0 feet, MAN). Miles Griffin misses. Offensive rebound by Miles Griffin! Miles Griffin kicks it out.

[06:48] Team_001 possession (Score: 8-8)
Klay Harden drives, Tyler Porzingis stays with him. Klay Harden attempts a Dunk. Heavily contested by Tyler Porzingis (1.1 feet, ZONE)! Klay Harden misses. Rebound secured by Carmelo Lowry.

[06:35] Team_002 possession (Score: 8-8)
Carmelo Lowry attempts a 3Pt. BLOCKED BY KLAY HARDEN! Ball is loose! Rebound secured by Dejounte McCollum.

[06:21] Team_001 possession (Score: 8-8)
Dejounte McCollum drives and kicks out. Klay Harden attempts a 3Pt. Wide open! Miles Bane is 7.2 feet away. [MAN] Klay Harden misses. Rebound secured by Carmelo Lowry.

[06:08] Team_002 possession (Score: 8-8)
Jordan Green attempts a 3Pt. Wide open! Dejounte McCollum is 6.2 feet away. [ZONE] Jordan Green misses. Rebound secured by Dejounte McCollum.

[05:54] Team_001 possession (Score: 8-8)
Dirk Young attempts a 3Pt. Contested by CJ Barrett (4.8 feet, MAN). Dirk Young misses. Rebound secured by Tyler Porzingis.

[05:41] Team_002 possession (Score: 8-8)
Miles Bane attempts a 3Pt. Contested by Klay Harden (2.9 feet, ZONE). Miles Bane misses. FOUL! Loose ball foul on Cole Ball during the rebound battle. [Team fouls: 3] No free throws, side out. (Cole Ball: 2 personal fouls)

[05:28] Team_002 possession (Score: 8-8)
Jordan Green attempts a Midrange. Contested by Cole Ball (4.8 feet, MAN). JORDAN GREEN MAKES IT! Assist: Carmelo Lowry
Score: 8-10

[05:16] Team_001 possession (Score: 8-10)
Cole Ball attempts a 3Pt. Contested by CJ Barrett (5.3 feet, ZONE). COLE BALL MAKES IT! Assist: Dejounte McCollum
Score: 11-10

[05:00] Team_002 possession (Score: 11-10)
Tyler Porzingis attempts a Midrange. Contested by Dejounte McCollum (5.8 feet, ZONE). Tyler Porzingis misses. Rebound secured by Dejounte McCollum.

[04:46] Team_001 possession (Score: 11-10)
Dejounte McCollum attempts a 3Pt. Heavily contested by CJ Barrett (0.5 feet, ZONE)! Dejounte McCollum misses. Rebound secured by Tyler Porzingis.

[04:30] Team_002 possession (Score: 11-10)
Carmelo Lowry attempts a 3Pt. Heavily contested by Dejounte McCollum (1.8 feet, MAN)! Carmelo Lowry misses. Rebound secured by Cole Ball.

[04:18] Team_001 possession (Score: 11-10)
Dejounte McCollum attempts a Midrange. Contested by Carmelo Lowry (5.3 feet, MAN). DEJOUNTE MCCOLLUM MAKES IT!
Score: 13-10

[04:03] Team_002 possession (Score: 13-10)
CJ Barrett attempts a 3Pt. Contested by Klay Harden (2.4 feet, ZONE). CJ Barrett misses. Rebound secured by Miles Griffin.

[03:49] Team_001 possession (Score: 13-10)
FOUL! Holding foul on Carmelo Lowry. [Team fouls: 1] No free throws, side out. (Carmelo Lowry: 1 personal fouls)

[03:49] Substitution (Team_002): Carmelo Lowry OUT → Julius Curry IN (stamina_rule2)

[03:36] Team_001 possession (Score: 13-10)
Dirk Young drives and kicks out. Dirk Young attempts a Midrange. Contested by CJ Barrett (5.9 feet, ZONE). Dirk Young misses. Rebound secured by Miles Bane.

[03:23] Team_002 possession (Score: 13-10)
Tyler Porzingis makes the Layup and draws the foul on Miles Griffin! And-1! Tyler Porzingis to the line for 1. [Team fouls: 4] (Miles Griffin: 1 personal fouls)   FT 1/1: GOOD Tyler Porzingis makes 1/1 from the line.
Score: 13-13

[03:07] Team_001 possession (Score: 13-13)
Cole Ball attempts a 3Pt. Contested by Jordan Green (4.6 feet, MAN). Cole Ball misses. Rebound secured by Tyler Porzingis.

[02:52] Team_002 possession (Score: 13-13)
Julius Curry attempts a 3Pt. BLOCKED BY DEJOUNTE MCCOLLUM! Ball is loose! Rebound secured by Miles Griffin.

[02:36] Team_001 possession (Score: 13-13)
Dejounte McCollum drives and kicks out. FOUL! Shooting foul on Tyler Porzingis. Miles Griffin to the line for 2 free throws. [Team fouls: 2] (Tyler Porzingis: 1 personal fouls)   FT 1/2: GOOD   FT 2/2: GOOD Miles Griffin makes 2/2 from the line.
Score: 15-13

[02:36] Substitution (Team_001): Klay Harden OUT → Ja Dosunmu IN (stamina_rule2)

[02:36] Substitution (Team_001): Miles Griffin OUT → Kristaps Ming IN (stamina_rule2)

[02:36] Substitution (Team_002): Tyler Porzingis OUT → Lamelo O'Neal IN (stamina_rule2)

[02:22] Team_001 possession (Score: 15-13)
Ja Dosunmu drives to the basket... Ja Dosunmu loses the ball! Stripped by Lamelo O'Neal! TURNOVER! (live ball)

[02:06] Team_002 possession (Score: 15-13)
Jordan Green attempts a Midrange. Contested by Cole Ball (5.7 feet, MAN). Jordan Green misses. FOUL! Loose ball foul on Kristaps Ming during the rebound battle. [IN THE BONUS! 5 team fouls] Miles Bane to the line for 2 free throws. (Kristaps Ming: 1 personal fouls)   FT 1/2: GOOD   FT 2/2: GOOD Miles Bane makes 2/2 from the line.
Score: 15-15

[01:49] Team_001 possession (Score: 15-15)
Dejounte McCollum loses the ball! Stripped by Lamelo O'Neal! TURNOVER! (live ball)

[01:35] Team_002 possession (Score: 15-15)
Jordan Green attempts a 3Pt. Wide open! Ja Dosunmu is 6.0 feet away. [ZONE] Jordan Green misses. Offensive rebound by Miles Bane! Miles Bane kicks it out.

[01:24] Team_002 possession (Score: 15-15)
Julius Curry attempts a Midrange. Heavily contested by Dejounte McCollum (1.8 feet, MAN)! Julius Curry misses. Offensive rebound by Miles Bane! Miles Bane kicks it out.

[01:11] Team_002 possession (Score: 15-15)
FOUL! Holding foul on Dejounte McCollum. [IN THE BONUS! 6 team fouls] Julius Curry to the line for 2 free throws. (Dejounte McCollum: 1 personal fouls)   FT 1/2: MISS   FT 2/2: GOOD Julius Curry makes 1/2 from the line.
Score: 15-16

[00:54] Team_001 possession (Score: 15-16)
Kristaps Ming drives and kicks out. Ja Dosunmu attempts a Midrange. Contested by Julius Curry (3.5 feet, ZONE). JA DOSUNMU MAKES IT!
Score: 17-16

[00:37] Team_002 possession (Score: 17-16)
Julius Curry attempts a 3Pt. Contested by Dejounte McCollum (5.8 feet, MAN). Julius Curry misses. Rebound secured by Dejounte McCollum.

[00:24] Team_001 possession (Score: 17-16)
FOUL! Reach-in foul on Jordan Green during the drive. [Team fouls: 3] No free throws, side out. (Jordan Green: 1 personal fouls)

[00:24] Substitution (Team_001): Dirk Young OUT → Rudy George IN (stamina_rule2)

[00:24] Substitution (Team_002): Miles Bane OUT → John Duncan IN (stamina_rule2)

[00:24] Substitution (Team_002): CJ Barrett OUT → Dirk Middleton IN (stamina_rule2)

[00:09] Team_001 possession (Score: 17-16)
FOUL! Offensive foul on Kristaps Ming! Lamelo O'Neal drew the charge! [Team fouls: 7] (Kristaps Ming: 2 personal fouls) TURNOVER! (dead ball)

[00:09] Substitution (Team_002): Jordan Green OUT → Anfernee Sexton IN (stamina_rule2)

================================================================================
                              1ST QUARTER COMPLETE                              
================================================================================

1ST QUARTER SCORE: Team_001 17, Team_002 16

BOX SCORE:
================================================================================

Team_001
--------------------------------------------------------------------------------
Player                MIN  PTS  REB  AST  TO      FG   FG%      3P   3P%
--------------------------------------------------------------------------------
Cole Ball              12    6    1    1   0   2/5    40.0     0/0   0.0
Dejounte McCollum      12    4    7    2   0   2/5    40.0     0/0   0.0
Dirk Young             12    3    0    1   0   1/3    33.3     0/0   0.0
Miles Griffin          10    2    5    0   0   0/1     0.0     0/0   0.0
Ja Dosunmu              2    2    0    0   0   1/1   100.0     0/0   0.0
Klay Harden            10    0    0    0   0   0/3     0.0     0/0   0.0

TEAM: FG: 6/18 (33.3%), 3PT: 3/11 (27.3%), REB: 13 (2 off, 11 def), AST: 4, TO: 3
TEAM FOULS: 7 [Team_002 in BONUS]


Team_002
--------------------------------------------------------------------------------
Player                MIN  PTS  REB  AST  TO      FG   FG%      3P   3P%
--------------------------------------------------------------------------------
Jordan Green           12    7    0    0   0   3/4    75.0     0/0   0.0
Miles Bane             12    5    5    0   0   2/5    40.0     0/0   0.0
Tyler Porzingis        10    3    4    1   0   1/2    50.0     0/0   0.0
Julius Curry            4    1    0    0   0   1/3    33.3     0/0   0.0
Carmelo Lowry           8    0    6    1   0   0/2     0.0     0/0   0.0
CJ Barrett             12    0    0    1   0   0/2     0.0     0/0   0.0

TEAM: FG: 7/18 (38.9%), 3PT: 2/11 (18.2%), REB: 15 (3 off, 12 def), AST: 3, TO: 2
TEAM FOULS: 3

================================================================================

================================================================================
                       2ND QUARTER - Team_001 vs Team_002                       
================================================================================

[12:00] Team_001 possession (Score: 17-16)
Ja Dosunmu attempts a 3Pt. Wide open! Dirk Middleton is 6.1 feet away. [ZONE] Ja Dosunmu misses. Rebound secured by Julius Curry.

[11:46] Team_002 possession (Score: 17-16)
Dirk Middleton drives to the basket... Dirk Middleton throws a bad pass! Stolen by Rudy George! TURNOVER! (live ball)

[11:33] Team_001 possession (Score: 17-16)
FOUL! Offensive foul on Dejounte McCollum! Lamelo O'Neal drew the charge! [Team fouls: 1] (Dejounte McCollum: 2 personal fouls) TURNOVER! (dead ball)

[11:17] Team_002 possession (Score: 17-16)
Julius Curry attempts a 3Pt. Heavily contested by Dejounte McCollum (1.9 feet, MAN)! Julius Curry misses. Rebound secured by Dejounte McCollum.

[11:07] Team_001 possession (Score: 17-16)
Rudy George attempts a 3Pt. Wide open! Julius Curry is 6.6 feet away. [ZONE] Rudy George misses. Offensive rebound by Cole Ball! Cole Ball kicks it out.

[10:56] Team_001 possession (Score: 17-16)
Kristaps Ming drives, Lamelo O'Neal stays with him. Kristaps Ming attempts a Dunk. Heavily contested by Lamelo O'Neal (0.5 feet, ZONE)! Kristaps Ming misses. Rebound secured by Anfernee Sexton.

[10:41] Team_002 possession (Score: 17-16)
Anfernee Sexton attempts a Midrange. Wide open! Rudy George is 8.0 feet away. [ZONE] ANFERNEE SEXTON MAKES IT! Assist: John Duncan
Score: 17-18

[10:26] Team_001 possession (Score: 17-18)
Rudy George attempts a 3Pt. Wide open! Dirk Middleton is 9.5 feet away. [MAN] RUDY GEORGE MAKES IT! Assist: Ja Dosunmu
Score: 20-18

[10:12] Team_002 possession (Score: 20-18)
Lamelo O'Neal attempts a Midrange. Contested by Kristaps Ming (4.9 feet, MAN). Lamelo O'Neal misses. Rebound secured by Cole Ball.

[10:00] Team_001 possession (Score: 20-18)
Kristaps Ming attempts a Midrange. Wide open! Julius Curry is 6.4 feet away. [ZONE] KRISTAPS MING MAKES IT! Assist: Ja Dosunmu
Score: 22-18

[09:45] Team_002 possession (Score: 22-18)
John Duncan attempts a 3Pt. Heavily contested by Ja Dosunmu (1.0 feet, ZONE)! John Duncan misses. Rebound secured by Rudy George.

[09:30] Team_001 possession (Score: 22-18)
FOUL! Shooting foul on Lamelo O'Neal. Dejounte McCollum to the line for 2 free throws. [Team fouls: 1] (Lamelo O'Neal: 1 personal fouls)   FT 1/2: GOOD   FT 2/2: GOOD Dejounte McCollum makes 2/2 from the line.
Score: 24-18

[09:10] Team_001 possession (Score: 24-18)
Dejounte McCollum drives, Lamelo O'Neal stays with him. Dejounte McCollum attempts a Layup. Contested by Lamelo O'Neal (2.0 feet, ZONE). DEJOUNTE MCCOLLUM MAKES IT! Assist: Ja Dosunmu
Score: 26-18

[08:52] Team_002 possession (Score: 26-18)
Julius Curry attempts a Midrange. Contested by Dejounte McCollum (2.8 feet, MAN). JULIUS CURRY MAKES IT!
Score: 26-20

[08:35] Team_001 possession (Score: 26-20)
Ja Dosunmu attempts a Midrange. Contested by John Duncan (6.0 feet, MAN). Ja Dosunmu misses. Rebound secured by Julius Curry.

[08:22] Team_002 possession (Score: 26-20)
FOUL! Offensive foul on John Duncan! Ja Dosunmu drew the charge! [Team fouls: 2] (John Duncan: 1 personal fouls) TURNOVER! (dead ball)

[08:22] Substitution (Team_001): Cole Ball OUT → Larry Trent IN (stamina_rule2)

[08:22] Substitution (Team_001): Dejounte McCollum OUT → Franz Bryant IN (stamina_rule2)

[08:07] Team_001 possession (Score: 26-20)
Ja Dosunmu attempts a 3Pt. Wide open! Julius Curry is 6.7 feet away. [ZONE] Ja Dosunmu misses. Rebound secured by Julius Curry.

[07:57] Team_002 possession (Score: 26-20)
John Duncan attempts a 3Pt. Wide open! Ja Dosunmu is 6.3 feet away. [ZONE] John Duncan misses. Rebound secured by Kristaps Ming.

[07:41] Team_001 possession (Score: 26-20)
Ja Dosunmu attempts a Midrange. Wide open! Julius Curry is 7.7 feet away. [ZONE] JA DOSUNMU MAKES IT! Assist: Rudy George
Score: 28-20

[07:23] Team_002 possession (Score: 28-20)
John Duncan attempts a 3Pt. Contested by Ja Dosunmu (2.6 feet, MAN). John Duncan misses. Rebound secured by Rudy George.

[07:09] Team_001 possession (Score: 28-20)
Ja Dosunmu attempts a 3Pt. Wide open! Anfernee Sexton is 8.0 feet away. [ZONE] Ja Dosunmu misses. Offensive rebound by Larry Trent! Larry Trent kicks it out.

[06:57] Team_001 possession (Score: 28-20)
Larry Trent attempts a Midrange. Contested by Julius Curry (2.7 feet, ZONE). Larry Trent misses. Rebound secured by Lamelo O'Neal.

[06:44] Team_002 possession (Score: 28-20)
Lamelo O'Neal drives to the basket... FOUL! Offensive foul on Lamelo O'Neal! Franz Bryant drew the charge! [Team fouls: 3] (Lamelo O'Neal: 2 personal fouls) TURNOVER! (dead ball)

[06:30] Team_001 possession (Score: 28-20)
Ja Dosunmu attempts a 3Pt. Wide open! John Duncan is 7.2 feet away. [MAN] Ja Dosunmu misses. Rebound secured by Lamelo O'Neal.

[06:16] Team_002 possession (Score: 28-20)
Lamelo O'Neal loses the ball! Stripped by Kristaps Ming! TURNOVER! (live ball)

[06:01] Team_001 possession (Score: 28-20)
Ja Dosunmu attempts a 3Pt. Contested by Julius Curry (4.9 feet, ZONE). Ja Dosunmu misses. Offensive rebound by Rudy George! Rudy George kicks it out.

[05:48] Team_001 possession (Score: 28-20)
Ja Dosunmu attempts a Midrange. Contested by John Duncan (5.4 feet, MAN). Ja Dosunmu misses. Rebound secured by Julius Curry.

[05:34] Team_002 possession (Score: 28-20)
Anfernee Sexton attempts a Midrange. Contested by Larry Trent (4.9 feet, MAN). ANFERNEE SEXTON MAKES IT! Assist: Julius Curry
Score: 28-22

[05:20] Team_001 possession (Score: 28-22)
Ja Dosunmu attempts a 3Pt. Wide open! John Duncan is 9.0 feet away. [MAN] JA DOSUNMU MAKES IT! Assist: Larry Trent
Score: 31-22

[05:04] Team_002 possession (Score: 31-22)
Anfernee Sexton makes the Layup and draws the foul on Larry Trent! And-1! Anfernee Sexton to the line for 1. [Team fouls: 2] (Larry Trent: 1 personal fouls)   FT 1/1: GOOD Anfernee Sexton makes 1/1 from the line.
Score: 31-25

[04:50] Team_001 possession (Score: 31-25)
Kristaps Ming attempts a Midrange. Contested by Anfernee Sexton (5.2 feet, ZONE). Kristaps Ming misses. Rebound secured by Julius Curry.

[04:34] Team_002 possession (Score: 31-25)
Dirk Middleton drives and kicks out. John Duncan attempts a 3Pt. Contested by Ja Dosunmu (4.5 feet, MAN). John Duncan misses. Rebound secured by Larry Trent.

[04:22] Team_001 possession (Score: 31-25)
Ja Dosunmu drives, John Duncan stays with him. Ja Dosunmu attempts a Layup. Contested by John Duncan (4.9 feet, MAN). JA DOSUNMU MAKES IT! Assist: Kristaps Ming
Score: 33-25

[04:12] Team_002 possession (Score: 33-25)
Julius Curry attempts a 3Pt. Heavily contested by Ja Dosunmu (1.1 feet, ZONE)! Julius Curry misses. Rebound secured by Franz Bryant.

[04:02] Team_001 possession (Score: 33-25)
FOUL! Reach-in foul on Dirk Middleton during the drive. [Team fouls: 4] No free throws, side out. (Dirk Middleton: 1 personal fouls)

[04:02] Substitution (Team_002): Anfernee Sexton OUT → Carmelo Lowry IN (starter_return_rule1)

[03:47] Team_001 possession (Score: 33-25)
Franz Bryant attempts a Midrange. Contested by Carmelo Lowry (2.5 feet, MAN). Franz Bryant misses. Rebound secured by Carmelo Lowry.

[03:32] Team_002 possession (Score: 33-25)
Dirk Middleton attempts a Midrange. Wide open! Rudy George is 6.0 feet away. [MAN] DIRK MIDDLETON MAKES IT! Assist: Julius Curry
Score: 33-27

[03:12] Team_001 possession (Score: 33-27)
Rudy George drives and kicks out. Ja Dosunmu attempts a 3Pt. Heavily contested by John Duncan (1.5 feet, MAN)! Ja Dosunmu misses. Rebound secured by Julius Curry.

[02:57] Team_002 possession (Score: 33-27)
Julius Curry attempts a Midrange. Wide open! Franz Bryant is 6.6 feet away. [ZONE] Julius Curry misses. Rebound secured by Larry Trent.

[02:45] Team_001 possession (Score: 33-27)
Larry Trent drives, picks up Carmelo Lowry. Help arrives from John Duncan! Larry Trent attempts a Layup. Contested by John Duncan (5.2 feet, MAN). LARRY TRENT MAKES IT!
Score: 35-27

[02:29] Team_002 possession (Score: 35-27)
FOUL! Shooting foul on Ja Dosunmu. Lamelo O'Neal to the line for 2 free throws. [Team fouls: 3] (Ja Dosunmu: 1 personal fouls)   FT 1/2: GOOD   FT 2/2: GOOD Lamelo O'Neal makes 2/2 from the line.
Score: 35-29

[02:29] Substitution (Team_001): Ja Dosunmu OUT → Klay Harden IN (starter_return_rule1)

[02:29] Substitution (Team_001): Kristaps Ming OUT → Miles Griffin IN (starter_return_rule1)

[02:29] Substitution (Team_002): Lamelo O'Neal OUT → Tyler Porzingis IN (starter_return_rule1)

[02:16] Team_002 possession (Score: 35-29)
Carmelo Lowry drives, picks up Franz Bryant. Help arrives from Klay Harden! Carmelo Lowry attempts a Dunk. Wide open! Klay Harden is 9.8 feet away. [MAN] CARMELO LOWRY MAKES IT!
Score: 35-31

[01:59] Team_001 possession (Score: 35-31)
Larry Trent attempts a Midrange. Wide open! Carmelo Lowry is 6.7 feet away. [MAN] Larry Trent misses. Rebound secured by Julius Curry.

[01:43] Team_002 possession (Score: 35-31)
FOUL! Offensive foul on Dirk Middleton! Rudy George drew the charge! [Team fouls: 5] (Dirk Middleton: 2 personal fouls) TURNOVER! (dead ball)

[01:43] Substitution (Team_002): John Duncan OUT → Miles Bane IN (starter_return_rule1)

[01:28] Team_001 possession (Score: 35-31)
Larry Trent attempts a Midrange. Wide open! Carmelo Lowry is 8.5 feet away. [ZONE] Larry Trent misses. Rebound secured by Carmelo Lowry.

[01:13] Team_002 possession (Score: 35-31)
Dirk Middleton attempts a 3Pt. Contested by Klay Harden (4.2 feet, ZONE). Dirk Middleton misses. Rebound secured by Larry Trent.

[00:59] Team_001 possession (Score: 35-31)
Klay Harden attempts a 3Pt. Wide open! Miles Bane is 8.3 feet away. [ZONE] Klay Harden misses. Offensive rebound by Miles Griffin! Miles Griffin kicks it out.

[00:45] Team_001 possession (Score: 35-31)
Rudy George attempts a 3Pt. Heavily contested by Miles Bane (1.2 feet, ZONE)! RUDY GEORGE MAKES IT!
Score: 38-31

[00:30] Team_002 possession (Score: 38-31)
Dirk Middleton throws a bad pass! Stolen by Rudy George! TURNOVER! (live ball)

[00:15] Team_001 possession (Score: 38-31)
Rudy George attempts a Midrange. Contested by Dirk Middleton (5.2 feet, MAN). RUDY GEORGE MAKES IT! Assist: Larry Trent
Score: 40-31

[00:05] Team_002 possession (Score: 40-31)
Tyler Porzingis attempts a Layup. Contested by Miles Griffin (2.7 feet, ZONE). TYLER PORZINGIS MAKES IT!
Score: 40-33

================================================================================
                              2ND QUARTER COMPLETE                              
================================================================================

2ND QUARTER SCORE: Team_001 23, Team_002 17

BOX SCORE:
================================================================================

Team_001
--------------------------------------------------------------------------------
Player                MIN  PTS  REB  AST  TO      FG   FG%      3P   3P%
--------------------------------------------------------------------------------
Rudy George            12    8    3    1   0   3/3   100.0     0/0   0.0
Ja Dosunmu             12    7    0    3   0   3/9    33.3     0/0   0.0
Dejounte McCollum      16    4    1    0   0   1/1   100.0     0/0   0.0
Kristaps Ming          12    2    1    1   0   1/3    33.3     0/0   0.0
Larry Trent             8    2    4    2   0   1/4    25.0     0/0   0.0
Cole Ball              16    0    2    0   0   0/0     0.0     0/0   0.0
Franz Bryant            8    0    1    0   0   0/1     0.0     0/0   0.0
Miles Griffin          12    0    1    0   0   0/0     0.0     0/0   0.0

TEAM: FG: 9/21 (42.9%), 3PT: 3/7 (42.9%), REB: 13 (4 off, 9 def), AST: 7, TO: 1
TEAM FOULS: 3


Team_002
--------------------------------------------------------------------------------
Player                MIN  PTS  REB  AST  TO      FG   FG%      3P   3P%
--------------------------------------------------------------------------------
Anfernee Sexton         8    7    1    0   0   3/3   100.0     0/0   0.0
Julius Curry           16    2    7    2   0   1/4    25.0     0/0   0.0
Lamelo O'Neal          12    2    2    0   0   0/1     0.0     0/0   0.0
Carmelo Lowry          12    2    2    0   0   1/1   100.0     0/0   0.0
Dirk Middleton         12    2    0    0   0   1/2    50.0     0/0   0.0
Tyler Porzingis        12    2    0    0   0   1/1   100.0     0/0   0.0
John Duncan            11    0    0    1   0   0/4     0.0     0/0   0.0

TEAM: FG: 7/16 (43.8%), 3PT: 0/7 (0.0%), REB: 12 (0 off, 12 def), AST: 3, TO: 6
TEAM FOULS: 5 [Team_001 in BONUS]

================================================================================

================================================================================
                       3RD QUARTER - Team_001 vs Team_002                       
================================================================================

[12:00] Team_001 possession (Score: 40-33)
Klay Harden attempts a 3Pt. Wide open! Miles Bane is 7.3 feet away. [MAN] Klay Harden misses. Rebound secured by Miles Bane.

[11:45] Team_002 possession (Score: 40-33)
Carmelo Lowry attempts a Midrange. Heavily contested by Franz Bryant (1.6 feet, MAN)! CARMELO LOWRY MAKES IT! Assist: Tyler Porzingis
Score: 40-35

[11:32] Team_001 possession (Score: 40-35)
Larry Trent attempts a 3Pt. Contested by Carmelo Lowry (3.7 feet, MAN). Larry Trent misses. Rebound secured by Miles Bane.

[11:15] Team_002 possession (Score: 40-35)
Dirk Middleton attempts a 3Pt. Heavily contested by Klay Harden (0.5 feet, ZONE)! Dirk Middleton misses. Rebound secured by Miles Griffin.

[11:02] Team_001 possession (Score: 40-35)
Klay Harden attempts a Midrange. Contested by Miles Bane (3.4 feet, MAN). Klay Harden misses. Rebound secured by Tyler Porzingis.

[10:46] Team_002 possession (Score: 40-35)
Tyler Porzingis attempts a 3Pt. Contested by Franz Bryant (5.9 feet, ZONE). TYLER PORZINGIS MAKES IT! Assist: Carmelo Lowry
Score: 40-38

[10:33] Team_001 possession (Score: 40-38)
Larry Trent attempts a 3Pt. Wide open! Carmelo Lowry is 7.4 feet away. [MAN] Larry Trent misses. Rebound secured by Miles Bane.

[10:18] Team_002 possession (Score: 40-38)
Carmelo Lowry attempts a 3Pt. Contested by Klay Harden (4.5 feet, ZONE). Carmelo Lowry misses. Rebound secured by Klay Harden.

[10:05] Team_001 possession (Score: 40-38)
Franz Bryant drives to the basket... Franz Bryant throws a bad pass out of bounds! TURNOVER! (dead ball)

[09:51] Team_002 possession (Score: 40-38)
Julius Curry drives to the basket... Julius Curry loses the ball! Stripped by Franz Bryant! TURNOVER! (live ball)

[09:33] Team_001 possession (Score: 40-38)
Klay Harden drives and kicks out. Larry Trent attempts a Midrange. Contested by Carmelo Lowry (3.4 feet, MAN). Larry Trent misses. Rebound secured by Tyler Porzingis.

[09:21] Team_002 possession (Score: 40-38)
FOUL! Offensive foul on Miles Bane! Klay Harden drew the charge! [Team fouls: 1] (Miles Bane: 1 personal fouls) TURNOVER! (dead ball)

[09:02] Team_001 possession (Score: 40-38)
Franz Bryant makes the Layup and draws the foul on Tyler Porzingis! And-1! Franz Bryant to the line for 1. [Team fouls: 2] (Tyler Porzingis: 2 personal fouls)   FT 1/1: MISS Franz Bryant makes 0/1 from the line. Offensive rebound by Klay Harden! Klay Harden kicks it out.
Score: 42-38

[08:47] Team_001 possession (Score: 42-38)
FOUL! Holding foul on Carmelo Lowry. [Team fouls: 3] No free throws, side out. (Carmelo Lowry: 2 personal fouls)

[08:37] Team_001 possession (Score: 42-38)
Rudy George attempts a 3Pt. Contested by Dirk Middleton (5.2 feet, MAN). Rudy George misses. Rebound secured by Tyler Porzingis.

[08:27] Team_002 possession (Score: 42-38)
Dirk Middleton attempts a 3Pt. Wide open! Rudy George is 9.1 feet away. [MAN] DIRK MIDDLETON MAKES IT! Assist: Carmelo Lowry
Score: 42-41

[08:11] Team_001 possession (Score: 42-41)
Klay Harden attempts a Midrange. Contested by Miles Bane (4.8 feet, MAN). Klay Harden misses. Rebound secured by Miles Bane.

[07:56] Team_002 possession (Score: 42-41)
Julius Curry attempts a Midrange. Contested by Larry Trent (5.8 feet, ZONE). JULIUS CURRY MAKES IT! Assist: Carmelo Lowry
Score: 42-43

[07:42] Team_001 possession (Score: 42-43)
FOUL! Reach-in foul on Tyler Porzingis during the drive. [Team fouls: 4] No free throws, side out. (Tyler Porzingis: 3 personal fouls)

[07:25] Team_001 possession (Score: 42-43)
Rudy George drives and kicks out. Franz Bryant attempts a Midrange. Wide open! Carmelo Lowry is 6.5 feet away. [MAN] FRANZ BRYANT MAKES IT! Assist: Klay Harden
Score: 44-43

[07:10] Team_002 possession (Score: 44-43)
Julius Curry drives, Miles Griffin stays with him. Julius Curry attempts a Dunk. Heavily contested by Miles Griffin (1.1 feet, ZONE)! Julius Curry misses. Rebound secured by Miles Griffin.

[06:55] Team_001 possession (Score: 44-43)
Larry Trent attempts a Layup. BLOCKED BY CARMELO LOWRY! Ball deflects out of bounds off Larry Trent.

[06:36] Team_002 possession (Score: 44-43)
Miles Bane attempts a 3Pt. Heavily contested by Klay Harden (1.9 feet, MAN)! MILES BANE MAKES IT! Assist: Carmelo Lowry
Score: 44-46

[06:25] Team_001 possession (Score: 44-46)
Franz Bryant loses the ball! Stripped by Carmelo Lowry! TURNOVER! (live ball)

[06:09] Team_002 possession (Score: 44-46)
Tyler Porzingis attempts a 3Pt. Contested by Rudy George (5.0 feet, ZONE). Tyler Porzingis misses. Rebound secured by Larry Trent.

[05:56] Team_001 possession (Score: 44-46)
Miles Griffin throws a bad pass! Stolen by Tyler Porzingis! TURNOVER! (live ball)

[05:41] Team_002 possession (Score: 44-46)
Tyler Porzingis drives and kicks out. Carmelo Lowry attempts a 3Pt. Wide open! Larry Trent is 6.4 feet away. [ZONE] Carmelo Lowry misses. Rebound secured by Larry Trent.

[05:28] Team_001 possession (Score: 44-46)
Rudy George attempts a Layup. Contested by Dirk Middleton (3.0 feet, MAN). Rudy George misses. Offensive rebound by Klay Harden! Klay Harden kicks it out.

[05:10] Team_001 possession (Score: 44-46)
Larry Trent attempts a 3Pt. Wide open! Carmelo Lowry is 6.5 feet away. [MAN] Larry Trent misses. Rebound secured by Tyler Porzingis.

[04:56] Team_002 possession (Score: 44-46)
Tyler Porzingis attempts a Midrange. Contested by Klay Harden (3.7 feet, ZONE). Tyler Porzingis misses. Offensive rebound by Carmelo Lowry! Carmelo Lowry kicks it out.

[04:43] Team_002 possession (Score: 44-46)
Tyler Porzingis makes the Layup and draws the foul on Klay Harden! And-1! Tyler Porzingis to the line for 1. [Team fouls: 1] (Klay Harden: 1 personal fouls)   FT 1/1: GOOD Tyler Porzingis makes 1/1 from the line.
Score: 44-49

[04:28] Team_001 possession (Score: 44-49)
Rudy George attempts a 3Pt. Contested by Carmelo Lowry (5.9 feet, ZONE). Rudy George misses. Rebound secured by Miles Bane.

[04:14] Team_002 possession (Score: 44-49)
Tyler Porzingis drives, Miles Griffin stays with him. Tyler Porzingis attempts a Dunk. Contested by Miles Griffin (2.5 feet, ZONE). TYLER PORZINGIS MAKES IT! Assist: Julius Curry
Score: 44-51

[03:57] Team_001 possession (Score: 44-51)
Klay Harden attempts a 3Pt. Wide open! Miles Bane is 7.7 feet away. [ZONE] Klay Harden misses. Rebound secured by Carmelo Lowry.

[03:39] Team_002 possession (Score: 44-51)
Carmelo Lowry drives and kicks out. Miles Bane attempts a Midrange. Contested by Klay Harden (5.9 feet, MAN). Miles Bane misses. Offensive rebound by Carmelo Lowry! Carmelo Lowry kicks it out.

[03:24] Team_002 possession (Score: 44-51)
Carmelo Lowry attempts a 3Pt. Contested by Klay Harden (5.8 feet, ZONE). Carmelo Lowry misses. Rebound secured by Miles Griffin.

[03:13] Team_001 possession (Score: 44-51)
Klay Harden attempts a 3Pt. Contested by Miles Bane (5.7 feet, ZONE). Klay Harden misses. Rebound secured by Carmelo Lowry.

[02:56] Team_002 possession (Score: 44-51)
Tyler Porzingis attempts a Midrange. Contested by Rudy George (4.6 feet, ZONE). TYLER PORZINGIS MAKES IT! Assist: Miles Bane
Score: 44-53

[02:42] Team_001 possession (Score: 44-53)
Larry Trent attempts a Midrange. Contested by Carmelo Lowry (3.7 feet, MAN). Larry Trent misses. Rebound secured by Tyler Porzingis.

[02:29] Team_002 possession (Score: 44-53)
Dirk Middleton attempts a 3Pt. Contested by Rudy George (3.0 feet, MAN). Dirk Middleton misses. Offensive rebound by Carmelo Lowry! Carmelo Lowry kicks it out.

[02:11] Team_002 possession (Score: 44-53)
Dirk Middleton attempts a 3Pt. Contested by Klay Harden (2.4 feet, ZONE). Dirk Middleton misses. Rebound secured by Miles Griffin.

[01:55] Team_001 possession (Score: 44-53)
Rudy George attempts a 3Pt. Wide open! Dirk Middleton is 8.5 feet away. [MAN] Rudy George misses. Rebound secured by Carmelo Lowry.

[01:42] Team_002 possession (Score: 44-53)
FOUL! Offensive foul on Tyler Porzingis! Miles Griffin drew the charge! [Team fouls: 5] (Tyler Porzingis: 4 personal fouls) TURNOVER! (dead ball)

[01:42] Substitution (Team_001): Klay Harden OUT → Ja Dosunmu IN (stamina_rule2)

[01:42] Substitution (Team_001): Miles Griffin OUT → Kristaps Ming IN (stamina_rule2)

[01:42] Substitution (Team_001): Rudy George OUT → Dirk Young IN (starter_return_rule1)

[01:42] Substitution (Team_001): Larry Trent OUT → Cole Ball IN (starter_return_rule1)

[01:42] Substitution (Team_001): Franz Bryant OUT → Dejounte McCollum IN (starter_return_rule1)

[01:42] Substitution (Team_002): Carmelo Lowry OUT → Jordan Green IN (stamina_rule2)

[01:42] Substitution (Team_002): Tyler Porzingis OUT → Lamelo O'Neal IN (stamina_rule2)

[01:42] Substitution (Team_002): Miles Bane OUT → CJ Barrett IN (starter_return_rule1)

[01:31] Team_001 possession (Score: 44-53)
Cole Ball attempts a 3Pt. Contested by CJ Barrett (3.8 feet, ZONE). Cole Ball misses. Rebound secured by Lamelo O'Neal.

[01:16] Team_002 possession (Score: 44-53)
Julius Curry attempts a Midrange. Contested by Dejounte McCollum (5.2 feet, MAN). JULIUS CURRY MAKES IT!
Score: 44-55

[01:02] Team_001 possession (Score: 44-55)
FOUL! Offensive foul on Ja Dosunmu! CJ Barrett drew the charge! [Team fouls: 2] (Ja Dosunmu: 2 personal fouls) TURNOVER! (dead ball)

[00:46] Team_002 possession (Score: 44-55)
Jordan Green attempts a Midrange. Contested by Cole Ball (4.7 feet, MAN). Jordan Green misses. Rebound secured by Dirk Young.

[00:29] Team_001 possession (Score: 44-55)
Dejounte McCollum attempts a Layup. Wide open! Julius Curry is 6.9 feet away. [ZONE] DEJOUNTE MCCOLLUM MAKES IT!
Score: 46-55

[00:15] Team_002 possession (Score: 46-55)
Lamelo O'Neal attempts a Midrange. Wide open! Kristaps Ming is 6.6 feet away. [MAN] Lamelo O'Neal misses. Offensive rebound by Lamelo O'Neal! Lamelo O'Neal's putback is no good. Offensive rebound by Lamelo O'Neal! Lamelo O'Neal kicks it out.

================================================================================
                              3RD QUARTER COMPLETE                              
================================================================================

3RD QUARTER SCORE: Team_001 6, Team_002 22

BOX SCORE:
================================================================================

Team_001
--------------------------------------------------------------------------------
Player                MIN  PTS  REB  AST  TO      FG   FG%      3P   3P%
--------------------------------------------------------------------------------
Franz Bryant           19    4    0    0   0   2/2   100.0     0/0   0.0
Dejounte McCollum      17    2    0    0   0   1/1   100.0     0/0   0.0
Klay Harden            23    0    3    1   0   0/5     0.0     0/0   0.0
Larry Trent            19    0    2    0   0   0/6     0.0     0/0   0.0
Miles Griffin          23    0    4    0   0   0/0     0.0     0/0   0.0
Rudy George            23    0    0    0   0   0/3     0.0     0/0   0.0
Cole Ball              17    0    0    0   0   0/1     0.0     0/0   0.0
Dirk Young             13    0    1    0   0   0/0     0.0     0/0   0.0

TEAM: FG: 3/18 (16.7%), 3PT: 0/10 (0.0%), REB: 10 (2 off, 8 def), AST: 1, TO: 4
TEAM FOULS: 2


Team_002
--------------------------------------------------------------------------------
Player                MIN  PTS  REB  AST  TO      FG   FG%      3P   3P%
--------------------------------------------------------------------------------
Tyler Porzingis        23   10    5    1   0   4/5    80.0     0/0   0.0
Julius Curry           28    4    0    1   0   2/3    66.7     0/0   0.0
Miles Bane             24    3    5    1   0   1/1   100.0     0/0   0.0
Dirk Middleton         24    3    0    0   0   1/3    33.3     0/0   0.0
Carmelo Lowry          23    2    6    4   0   1/4    25.0     0/0   0.0
Lamelo O'Neal          14    0    2    0   0   0/0     0.0     0/0   0.0
Jordan Green           14    0    0    0   0   0/1     0.0     0/0   0.0

TEAM: FG: 9/17 (52.9%), 3PT: 3/9 (33.3%), REB: 18 (4 off, 14 def), AST: 7, TO: 3
TEAM FOULS: 5 [Team_001 in BONUS]

================================================================================

================================================================================
                       4TH QUARTER - Team_001 vs Team_002                       
================================================================================

[12:00] Team_001 possession (Score: 46-55)
Dirk Young makes the Layup and draws the foul on CJ Barrett! And-1! Dirk Young to the line for 1. [Team fouls: 1] (CJ Barrett: 1 personal fouls)   FT 1/1: GOOD Dirk Young makes 1/1 from the line.
Score: 49-55

[11:45] Team_002 possession (Score: 49-55)
CJ Barrett attempts a 3Pt. Contested by Dirk Young (5.1 feet, MAN). CJ BARRETT MAKES IT! Assist: Julius Curry
Score: 49-58

[11:31] Team_001 possession (Score: 49-58)
Cole Ball attempts a Midrange. Contested by CJ Barrett (5.5 feet, ZONE). Cole Ball misses. Offensive rebound by Cole Ball! Cole Ball kicks it out.

[11:16] Team_001 possession (Score: 49-58)
FOUL! Holding foul on CJ Barrett. [Team fouls: 2] No free throws, side out. (CJ Barrett: 2 personal fouls)

[11:02] Team_001 possession (Score: 49-58)
Ja Dosunmu makes the 3Pt and draws the foul on CJ Barrett! And-1! Ja Dosunmu to the line for 1. [Team fouls: 3] (CJ Barrett: 3 personal fouls)   FT 1/1: GOOD Ja Dosunmu makes 1/1 from the line.
Score: 53-58

[10:48] Team_002 possession (Score: 53-58)
Jordan Green loses the ball! Stripped by Cole Ball! TURNOVER! (live ball)

[10:35] Team_001 possession (Score: 53-58)
Cole Ball drives, picks up Lamelo O'Neal. Help arrives from CJ Barrett! Cole Ball attempts a Dunk. Contested by CJ Barrett (4.8 feet, ZONE). COLE BALL MAKES IT!
Score: 55-58

[10:24] Team_002 possession (Score: 55-58)
Julius Curry drives to the basket... Julius Curry throws a bad pass! Stolen by Dejounte McCollum! TURNOVER! (live ball)

[10:14] Team_001 possession (Score: 55-58)
Ja Dosunmu attempts a 3Pt. Heavily contested by CJ Barrett (1.9 feet, ZONE)! JA DOSUNMU MAKES IT! Assist: Dejounte McCollum
Score: 58-58

[10:00] Team_002 possession (Score: 58-58)
CJ Barrett attempts a Layup. Contested by Dirk Young (2.7 feet, MAN). CJ Barrett misses. Rebound secured by Dirk Young.

[09:45] Team_001 possession (Score: 58-58)
Ja Dosunmu attempts a 3Pt. Wide open! CJ Barrett is 7.1 feet away. [MAN] Ja Dosunmu misses. Rebound secured by Jordan Green.

[09:29] Team_002 possession (Score: 58-58)
Julius Curry attempts a Midrange. BLOCKED BY DIRK YOUNG! Ball is loose! Rebound secured by Dirk Young.

[09:11] Team_001 possession (Score: 58-58)
Cole Ball attempts a 3Pt. Contested by Jordan Green (3.7 feet, MAN). COLE BALL MAKES IT! Assist: Kristaps Ming
Score: 61-58

[08:55] Team_002 possession (Score: 61-58)
Lamelo O'Neal attempts a 3Pt. Contested by Kristaps Ming (5.9 feet, MAN). Lamelo O'Neal misses. Rebound secured by Dirk Young.

[08:42] Team_001 possession (Score: 61-58)
Ja Dosunmu attempts a 3Pt. Contested by CJ Barrett (2.4 feet, ZONE). Ja Dosunmu misses. Offensive rebound by Dejounte McCollum! Dejounte McCollum kicks it out.

[08:27] Team_001 possession (Score: 61-58)
Dirk Young attempts a 3Pt. Contested by CJ Barrett (5.7 feet, MAN). DIRK YOUNG MAKES IT! Assist: Dejounte McCollum
Score: 64-58

[08:12] Team_002 possession (Score: 64-58)
FOUL! Offensive foul on CJ Barrett! Dirk Young drew the charge! [Team fouls: 4] (CJ Barrett: 4 personal fouls) TURNOVER! (dead ball)

[08:12] Substitution (Team_001): Ja Dosunmu OUT → Klay Harden IN (starter_return_rule1)

[08:12] Substitution (Team_001): Kristaps Ming OUT → Miles Griffin IN (starter_return_rule1)

[08:12] Substitution (Team_002): Jordan Green OUT → Carmelo Lowry IN (starter_return_rule1)

[08:12] Substitution (Team_002): Lamelo O'Neal OUT → Tyler Porzingis IN (starter_return_rule1)

[08:00] Team_001 possession (Score: 64-58)
Klay Harden loses the ball! Stripped by CJ Barrett! TURNOVER! (live ball)

[07:40] Team_002 possession (Score: 64-58)
Tyler Porzingis attempts a 3Pt. Contested by Miles Griffin (5.1 feet, MAN). Tyler Porzingis misses. Rebound secured by Dejounte McCollum.

[07:27] Team_001 possession (Score: 64-58)
Cole Ball drives, Tyler Porzingis stays with him. Cole Ball attempts a Layup. Heavily contested by Tyler Porzingis (1.4 feet, ZONE)! Cole Ball misses. Offensive rebound by Cole Ball! Cole Ball kicks it out.

[07:13] Team_001 possession (Score: 64-58)
Dirk Young attempts a Layup. Contested by CJ Barrett (3.0 feet, MAN). Dirk Young misses. Offensive rebound by Cole Ball! Cole Ball kicks it out.

[06:57] Team_001 possession (Score: 64-58)
Miles Griffin drives, Tyler Porzingis stays with him. Miles Griffin attempts a Layup. Heavily contested by Tyler Porzingis (1.6 feet, MAN)! Miles Griffin misses. Rebound secured by CJ Barrett.

[06:40] Team_002 possession (Score: 64-58)
Tyler Porzingis loses the ball! Stripped by Miles Griffin! TURNOVER! (live ball)

[06:27] Team_001 possession (Score: 64-58)
Miles Griffin attempts a 3Pt. Contested by Tyler Porzingis (5.6 feet, MAN). Miles Griffin misses. Offensive rebound by Miles Griffin! Miles Griffin kicks it out.

[06:15] Team_001 possession (Score: 64-58)
Klay Harden drives and kicks out. Dirk Young attempts a 3Pt. Contested by CJ Barrett (4.9 feet, MAN). Dirk Young misses. FOUL! Loose ball foul on CJ Barrett during the rebound battle. [IN THE BONUS! 5 team fouls] Cole Ball to the line for 2 free throws. (CJ Barrett: 5 personal fouls)   FT 1/2: MISS   FT 2/2: GOOD Cole Ball makes 1/2 from the line.
Score: 65-58

[06:00] Team_002 possession (Score: 65-58)
CJ Barrett drives to the basket... CJ Barrett loses the ball! Stripped by Miles Griffin! TURNOVER! (live ball)

[05:49] Team_001 possession (Score: 65-58)
FOUL! Holding foul on CJ Barrett. [IN THE BONUS! 6 team fouls] Dirk Young to the line for 2 free throws. (CJ Barrett: 6 personal fouls) CJ Barrett FOULS OUT!   FT 1/2: GOOD   FT 2/2: MISS Dirk Young makes 1/2 from the line. Rebound secured by Tyler Porzingis.
Score: 66-58

[05:49] Substitution (Team_002): CJ Barrett OUT (stamina: 80) → Miles Bane IN (foul_out)

[05:35] Team_002 possession (Score: 66-58)
Tyler Porzingis attempts a Midrange. Contested by Miles Griffin (2.7 feet, MAN). Tyler Porzingis misses. Rebound secured by Cole Ball.

[05:21] Team_001 possession (Score: 66-58)
Klay Harden attempts a 3Pt. Wide open! Miles Bane is 8.7 feet away. [MAN] Klay Harden misses. Rebound secured by Tyler Porzingis.

[05:11] Team_002 possession (Score: 66-58)
Dirk Middleton attempts a Midrange. BLOCKED BY DIRK YOUNG! Ball is loose! Rebound secured by Miles Griffin.

[04:57] Team_001 possession (Score: 66-58)
Miles Griffin attempts a Midrange. Contested by Tyler Porzingis (3.2 feet, MAN). MILES GRIFFIN MAKES IT!
Score: 68-58

[04:42] Team_002 possession (Score: 68-58)
Carmelo Lowry makes the Layup and draws the foul on Miles Griffin! And-1! Carmelo Lowry to the line for 1. [Team fouls: 1] (Miles Griffin: 2 personal fouls)   FT 1/1: GOOD Carmelo Lowry makes 1/1 from the line.
Score: 68-61

[04:28] Team_001 possession (Score: 68-61)
Dejounte McCollum attempts a 3Pt. Contested by Carmelo Lowry (5.5 feet, MAN). Dejounte McCollum misses. Rebound secured by Carmelo Lowry.

[04:11] Team_002 possession (Score: 68-61)
Dirk Middleton attempts a 3Pt. Contested by Dirk Young (3.5 feet, MAN). Dirk Middleton misses. Rebound secured by Dejounte McCollum.

[03:55] Team_001 possession (Score: 68-61)
Cole Ball attempts a 3Pt. Wide open! Carmelo Lowry is 6.4 feet away. [MAN] Cole Ball misses. Rebound secured by Tyler Porzingis.

[03:40] Team_002 possession (Score: 68-61)
Julius Curry drives to the basket... Julius Curry loses the ball! Stripped by Dejounte McCollum! TURNOVER! (live ball)

[03:27] Team_001 possession (Score: 68-61)
Klay Harden attempts a 3Pt. Wide open! Miles Bane is 7.3 feet away. [MAN] Klay Harden misses. Rebound secured by Tyler Porzingis.

[03:14] Team_002 possession (Score: 68-61)
Carmelo Lowry throws a bad pass! Stolen by Dejounte McCollum! TURNOVER! (live ball)

[03:01] Team_001 possession (Score: 68-61)
Cole Ball attempts a Midrange. Contested by Carmelo Lowry (4.8 feet, MAN). Cole Ball misses. Rebound secured by Carmelo Lowry.

[02:48] Team_002 possession (Score: 68-61)
Julius Curry attempts a Midrange. Contested by Cole Ball (3.4 feet, ZONE). Julius Curry misses. Offensive rebound by Tyler Porzingis! Tyler Porzingis's putback is no good. Rebound secured by Miles Griffin.

[02:34] Team_001 possession (Score: 68-61)
Klay Harden drives, picks up Julius Curry. Help arrives from Miles Bane! Klay Harden attempts a Layup. Contested by Miles Bane (2.9 feet, ZONE). KLAY HARDEN MAKES IT! Assist: Miles Griffin
Score: 70-61

[02:22] Team_002 possession (Score: 70-61)
Dirk Middleton attempts a 3Pt. Contested by Klay Harden (3.6 feet, ZONE). DIRK MIDDLETON MAKES IT! Assist: Carmelo Lowry
Score: 70-64

[02:07] Team_001 possession (Score: 70-64)
Cole Ball attempts a 3Pt. Wide open! Carmelo Lowry is 6.3 feet away. [MAN] COLE BALL MAKES IT! Assist: Dirk Young
Score: 73-64

[01:53] Team_002 possession (Score: 73-64)
Tyler Porzingis drives to the basket... Tyler Porzingis loses the ball! Stripped by Miles Griffin! TURNOVER! (live ball)

[01:38] Team_001 possession (Score: 73-64)
Cole Ball attempts a 3Pt. Wide open! Miles Bane is 6.4 feet away. [ZONE] Cole Ball misses. Offensive rebound by Dejounte McCollum! Dejounte McCollum kicks it out.

[01:20] Team_001 possession (Score: 73-64)
Cole Ball attempts a 3Pt. Wide open! Miles Bane is 6.3 feet away. [ZONE] COLE BALL MAKES IT! Assist: Klay Harden
Score: 76-64

[01:06] Team_002 possession (Score: 76-64)
Tyler Porzingis attempts a 3Pt. Contested by Cole Ball (4.3 feet, ZONE). Tyler Porzingis misses. Rebound secured by Dejounte McCollum.

[00:54] Team_001 possession (Score: 76-64)
Dirk Young attempts a Midrange. Wide open! Dirk Middleton is 9.4 feet away. [MAN] Dirk Young misses. Rebound secured by Tyler Porzingis.

[00:36] Team_002 possession (Score: 76-64)
Miles Bane attempts a 3Pt. Contested by Cole Ball (2.8 feet, ZONE). Miles Bane misses. Rebound secured by Miles Griffin.

[00:26] Team_001 possession (Score: 76-64)
Dirk Young attempts a Midrange. Contested by Carmelo Lowry (2.1 feet, ZONE). Dirk Young misses. Rebound secured by Tyler Porzingis.

[00:15] Team_002 possession (Score: 76-64)
Miles Bane makes the 3Pt and draws the foul on Cole Ball! And-1! Miles Bane to the line for 1. [Team fouls: 2] (Cole Ball: 3 personal fouls)   FT 1/1: MISS Miles Bane makes 0/1 from the line. Rebound secured by Miles Griffin.
Score: 76-67

[00:04] Team_001 possession (Score: 76-67)
Dirk Young attempts a 3Pt. Wide open! Dirk Middleton is 8.3 feet away. [MAN] Dirk Young misses. Rebound secured by Tyler Porzingis.

================================================================================
                              4TH QUARTER COMPLETE                              
================================================================================

4TH QUARTER SCORE: Team_001 30, Team_002 12

BOX SCORE:
================================================================================

Team_001
--------------------------------------------------------------------------------
Player                MIN  PTS  REB  AST  TO      FG   FG%      3P   3P%
--------------------------------------------------------------------------------
Cole Ball              30   12    4    0   0   5/7    71.4     0/0   0.0
Ja Dosunmu             18    7    0    0   0   2/3    66.7     0/0   0.0
Dirk Young             26    6    3    1   0   2/5    40.0     0/0   0.0
Miles Griffin          31    2    5    1   0   1/2    50.0     0/0   0.0
Klay Harden            31    2    0    1   0   1/3    33.3     0/0   0.0
Dejounte McCollum      30    0    5    2   0   0/1     0.0     0/0   0.0
Kristaps Ming          18    0    0    1   0   0/0     0.0     0/0   0.0

TEAM: FG: 11/22 (50.0%), 3PT: 7/13 (53.8%), REB: 16 (6 off, 10 def), AST: 6, TO: 1
TEAM FOULS: 2


Team_002
--------------------------------------------------------------------------------
Player                MIN  PTS  REB  AST  TO      FG   FG%      3P   3P%
--------------------------------------------------------------------------------
CJ Barrett             20    3    1    0   0   1/2    50.0     0/0   0.0
Dirk Middleton         37    3    0    0   0   1/3    33.3     0/0   0.0
Carmelo Lowry          31    3    2    1   0   1/1   100.0     0/0   0.0
Miles Bane             30    3    0    0   0   1/2    50.0     0/0   0.0
Julius Curry           40    0    0    1   0   0/2     0.0     0/0   0.0
Jordan Green           18    0    1    0   0   0/0     0.0     0/0   0.0
Lamelo O'Neal          18    0    0    0   0   0/1     0.0     0/0   0.0
Tyler Porzingis        31    0    7    0   0   0/3     0.0     0/0   0.0

TEAM: FG: 4/14 (28.6%), 3PT: 3/8 (37.5%), REB: 12 (1 off, 11 def), AST: 2, TO: 8
TEAM FOULS: 6 [Team_001 in BONUS]

================================================================================

================================================================================
                               FULL GAME COMPLETE                               
================================================================================

FINAL SCORE: Team_001 76, Team_002 67

SCORING BY QUARTER:
--------------------------------------------------------------------------------
Team                     Q1     Q2     Q3     Q4    FINAL
--------------------------------------------------------------------------------
Team_001                 17     23      6     30       76
Team_002                 16     17     22     12       67
--------------------------------------------------------------------------------

FULL GAME BOX SCORE:
================================================================================

Team_001
--------------------------------------------------------------------------------
Player                MIN  PTS  REB  AST  TO      FG   FG%      3P   3P%      FT STL BLK
--------------------------------------------------------------------------------
Klay Harden            31    2    3    2   1   1/11    9.1   0/7     0.0   0/0     1   1
Miles Griffin          31    4   15    1   1   1/3    33.3   0/0     0.0   2/2     3   0
Cole Ball              30   18    7    1   0   6/12   50.0   5/10   50.0   1/2     2   0
Dejounte McCollum      30   10   13    4   2   4/8    50.0   0/3     0.0   2/2     3   1
Dirk Young             26    9    4    2   0   4/9    44.4   3/5    60.0   2/3     0   2
Rudy George            23    8    3    1   1   3/6    50.0   2/5    40.0   0/0     2   0
Larry Trent            19    2    6    2   0   1/10   10.0   0/3     0.0   0/0     0   0
Franz Bryant           19    4    1    0   1   2/3    66.7   0/0     0.0   0/1     1   0
Ja Dosunmu             18   16    0    3   2   6/13   46.2   3/8    37.5   1/1     0   0
Kristaps Ming          18    2    1    2   1   1/3    33.3   0/0     0.0   0/0     1   0

TEAM: FG: 29/79 (36.7%), 3PT: 13/41 (31.7%), REB: 52 (14 off, 38 def), AST: 18, TO: 9


Team_002
--------------------------------------------------------------------------------
Player                MIN  PTS  REB  AST  TO      FG   FG%      3P   3P%      FT STL BLK
--------------------------------------------------------------------------------
Julius Curry           40    7    7    4   3   3/11   27.3   0/4     0.0   1/2     0   0
Dirk Middleton         37    8    0    0   3   3/8    37.5   2/6    33.3   0/0     0   0
Carmelo Lowry          31    7   16    6   2   3/8    37.5   0/5     0.0   1/1     1   2
Tyler Porzingis        31   15   16    2   3   6/11   54.5   1/4    25.0   2/2     1   0
Miles Bane             30   11   10    1   2   3/7    42.9   3/6    50.0   2/5     0   0
CJ Barrett             20    3    1    1   1   1/4    25.0   1/3    33.3   0/0     1   0
Lamelo O'Neal          18    2    4    0   1   0/2     0.0   0/1     0.0   2/2     2   0
Jordan Green           18    7    1    0   2   4/6    66.7   1/2    50.0   0/0     0   0
John Duncan            11    0    0    1   1   0/4     0.0   0/4     0.0   0/0     0   0
Anfernee Sexton         8    7    1    0   1   3/3   100.0   0/0     0.0   1/1     0   0

TEAM: FG: 27/65 (41.5%), 3PT: 8/35 (22.9%), REB: 57 (8 off, 49 def), AST: 15, TO: 19

================================================================================
