================================================================================
                        FULL GAME - Team_001 vs Team_002                        
================================================================================

================================================================================
                       1ST QUARTER - Team_001 vs Team_002                       
================================================================================

[12:00] Team_001 possession (Score: 0-0)
FOUL! Holding foul on CJ Barrett. [Team fouls: 1] No free throws, side out. (CJ Barrett: 1 personal fouls)

[11:46] Team_001 possession (Score: 0-0)
Dirk Young attempts a 3Pt. Heavily contested by CJ Barrett (0.5 feet, ZONE)! Dirk Young misses. Rebound secured by Miles Bane.

[11:31] Team_002 possession (Score: 0-0)
Jordan Green attempts a 3Pt. Heavily contested by Cole Ball (1.3 feet, MAN)! Jordan Green misses. Rebound secured by Miles Griffin.

[11:21] Team_001 possession (Score: 0-0)
Klay Harden drives and kicks out. Cole Ball attempts a 3Pt. Contested by CJ Barrett (3.9 feet, ZONE). Cole Ball misses. Rebound secured by Tyler Porzingis.

[11:03] Team_002 possession (Score: 0-0)
Jordan Green attempts a 3Pt. Contested by Cole Ball (4.9 feet, MAN). Jordan Green misses. Rebound secured by Cole Ball.

[10:52] Team_001 possession (Score: 0-0)
Miles Griffin drives, Tyler Porzingis stays with him. Miles Griffin attempts a Layup. Heavily contested by Tyler Porzingis (0.5 feet, ZONE)! MILES GRIFFIN MAKES IT! Assist: Dejounte McCollum
Score: 2-0

[10:40] Team_002 possession (Score: 2-0)
Carmelo Lowry attempts a Midrange. Contested by Dejounte McCollum (5.4 feet, MAN). Carmelo Lowry misses. FOUL! Loose ball foul on Miles Griffin during the rebound battle. [Team fouls: 1] No free throws, side out. (Miles Griffin: 1 personal fouls)

[10:29] Team_002 possession (Score: 2-0)
FOUL! Holding foul on Dejounte McCollum. [Team fouls: 2] No free throws, side out. (Dejounte McCollum: 1 personal fouls)

[10:14] Team_002 possession (Score: 2-0)
Miles Bane loses the ball! Stripped by Klay Harden! TURNOVER! (live ball)

[09:56] Team_001 possession (Score: 2-0)
Cole Ball attempts a 3Pt. Contested by Jordan Green (3.4 feet, MAN). Cole Ball misses. FOUL! Loose ball foul on Carmelo Lowry during the rebound battle. [Team fouls: 2] No free throws, side out. (Carmelo Lowry: 1 personal fouls)

[09:44] Team_001 possession (Score: 2-0)
Klay Harden attempts a 3Pt. Heavily contested by Miles Bane (1.1 feet, MAN)! Klay Harden misses. Rebound secured by Tyler Porzingis.

[09:27] Team_002 possession (Score: 2-0)
CJ Barrett attempts a Midrange. Contested by Klay Harden (3.8 feet, ZONE). CJ Barrett misses. Offensive rebound by Tyler Porzingis! Tyler Porzingis's putback is no good. Rebound secured by Miles Griffin.

[09:11] Team_001 possession (Score: 2-0)
Klay Harden makes the Midrange and draws the foul on CJ Barrett! And-1! Klay Harden to the line for 1. [Team fouls: 3] (CJ Barrett: 2 personal fouls)   FT 1/1: GOOD Klay Harden makes 1/1 from the line.
Score: 5-0

[08:57] Team_002 possession (Score: 5-0)
Jordan Green drives, Miles Griffin stays with him. Jordan Green attempts a Dunk. Contested by Miles Griffin (5.8 feet, ZONE). Jordan Green misses. Rebound secured by Miles Griffin.

[08:42] Team_001 possession (Score: 5-0)
Miles Griffin makes the Dunk and draws the foul on CJ Barrett! And-1! Miles Griffin to the line for 1. [Team fouls: 4] (CJ Barrett: 3 personal fouls)   FT 1/1: GOOD Miles Griffin makes 1/1 from the line.
Score: 8-0

[08:26] Team_002 possession (Score: 8-0)
Tyler Porzingis drives to the basket... Tyler Porzingis throws a bad pass! Stolen by Miles Griffin! TURNOVER! (live ball)

[08:15] Team_001 possession (Score: 8-0)
Klay Harden throws a bad pass! Stolen by Miles Bane! TURNOVER! (live ball)

[08:00] Team_002 possession (Score: 8-0)
Jordan Green attempts a 3Pt. Contested by Cole Ball (2.9 feet, MAN). Jordan Green misses. Rebound secured by Cole Ball.

[07:41] Team_001 possession (Score: 8-0)
Klay Harden makes the Layup and draws the foul on Miles Bane! And-1! Klay Harden to the line for 1. [BONUS: 5 team fouls] (Miles Bane: 1 personal fouls)   FT 1/1: MISS Klay Harden makes 0/1 from the line. Offensive rebound by Cole Ball! Cole Ball kicks it out.
Score: 10-0

[07:27] Team_001 possession (Score: 10-0)
Miles Griffin drives, picks up Tyler Porzingis. Help arrives from CJ Barrett! Miles Griffin attempts a Layup. Contested by CJ Barrett (3.5 feet, MAN). MILES GRIFFIN MAKES IT! Assist: Klay Harden
Score: 12-0

[07:15] Team_002 possession (Score: 12-0)
Carmelo Lowry drives to the basket... Carmelo Lowry loses the ball! Stripped by Dejounte McCollum! TURNOVER! (live ball)

[07:04] Team_001 possession (Score: 12-0)
FOUL! Offensive foul on Cole Ball! Jordan Green drew the charge! [Team fouls: 3] (Cole Ball: 1 personal fouls) TURNOVER! (dead ball)

[06:47] Team_002 possession (Score: 12-0)
Miles Bane throws a bad pass! Stolen by Klay Harden! TURNOVER! (live ball)

[06:38] Team_001 possession (Score: 12-0)
Miles Griffin loses the ball! Stripped by Tyler Porzingis! TURNOVER! (live ball)

[06:25] Team_002 possession (Score: 12-0)
Jordan Green attempts a Layup. Heavily contested by Miles Griffin (0.5 feet, ZONE)! JORDAN GREEN MAKES IT! Assist: CJ Barrett
Score: 12-2

[06:12] Team_001 possession (Score: 12-2)
Klay Harden attempts a Midrange. Contested by Jordan Green (2.4 feet, ZONE). KLAY HARDEN MAKES IT! Assist: Dirk Young
Score: 14-2

[05:58] Team_002 possession (Score: 14-2)
Tyler Porzingis drives, Miles Griffin stays with him. Tyler Porzingis attempts a Dunk. Contested by Miles Griffin (3.0 feet, MAN). TYLER PORZINGIS MAKES IT! Assist: Miles Bane
Score: 14-4

[05:42] Team_001 possession (Score: 14-4)
Dejounte McCollum attempts a Midrange. Contested by CJ Barrett (5.5 feet, ZONE). DEJOUNTE MCCOLLUM MAKES IT!
Score: 16-4

[05:22] Team_002 possession (Score: 16-4)
Tyler Porzingis attempts a 3Pt. Contested by Miles Griffin (3.3 feet, MAN). TYLER PORZINGIS MAKES IT! Assist: Jordan Green
Score: 16-7

[05:09] Team_001 possession (Score: 16-7)
Dejounte McCollum attempts a Midrange. Contested by Tyler Porzingis (3.9 feet, ZONE). Dejounte McCollum misses. Rebound secured by Carmelo Lowry.

[04:53] Team_002 possession (Score: 16-7)
Tyler Porzingis attempts a Midrange. Contested by Miles Griffin (4.6 feet, MAN). Tyler Porzingis misses. Offensive rebound by Tyler Porzingis! Tyler Porzingis puts it back in!
Score: 16-9

[04:38] Team_001 possession (Score: 16-9)
Dirk Young makes the Midrange and draws the foul on CJ Barrett! And-1! Dirk Young to the line for 1. [BONUS: 6 team fouls] (CJ Barrett: 4 personal fouls)   FT 1/1: GOOD Dirk Young makes 1/1 from the line.
Score: 19-9

[04:21] Team_002 possession (Score: 19-9)
Miles Bane drives and kicks out. Jordan Green attempts a 3Pt. Contested by Cole Ball (2.2 feet, MAN). Jordan Green misses. Rebound secured by Miles Griffin.

[04:04] Team_001 possession (Score: 19-9)
Dejounte McCollum attempts a Dunk. BLOCKED BY CJ BARRETT! Ball is loose! Offensive rebound by Cole Ball! Cole Ball kicks it out.

[03:47] Team_001 possession (Score: 19-9)
Cole Ball drives to the basket... Cole Ball throws a bad pass! Stolen by Tyler Porzingis! TURNOVER! (live ball)

[03:29] Team_002 possession (Score: 19-9)
CJ Barrett attempts a 3Pt. Contested by Klay Harden (5.6 feet, ZONE). CJ BARRETT MAKES IT! Assist: Miles Bane
Score: 19-12

[03:10] Team_001 possession (Score: 19-12)
Dirk Young attempts a Midrange. Contested by Carmelo Lowry (4.7 feet, ZONE). DIRK YOUNG MAKES IT! Assist: Klay Harden
Score: 21-12

[02:54] Team_002 possession (Score: 21-12)
Carmelo Lowry drives to the basket... Carmelo Lowry throws a bad pass! Stolen by Miles Griffin! TURNOVER! (live ball)

[02:45] Team_001 possession (Score: 21-12)
Cole Ball attempts a 3Pt. Contested by Jordan Green (5.2 feet, MAN). Cole Ball misses. Rebound secured by Carmelo Lowry.

[02:34] Team_002 possession (Score: 21-12)
Tyler Porzingis attempts a Midrange. Contested by Cole Ball (3.4 feet, ZONE). TYLER PORZINGIS MAKES IT! Assist: Miles Bane
Score: 21-14

[02:20] Team_001 possession (Score: 21-14)
Klay Harden throws a bad pass! Stolen by Miles Bane! TURNOVER! (live ball)

[02:11] Team_002 possession (Score: 21-14)
Miles Bane attempts a Midrange. Contested by Klay Harden (2.8 feet, MAN). Miles Bane misses. Rebound secured by Cole Ball.

[01:55] Team_001 possession (Score: 21-14)
Dirk Young attempts a 3Pt. Contested by CJ Barrett (2.9 feet, MAN). Dirk Young misses. Rebound secured by Carmelo Lowry.

[01:45] Team_002 possession (Score: 21-14)
CJ Barrett attempts a 3Pt. Contested by Klay Harden (3.8 feet, ZONE). CJ Barrett misses. Rebound secured by Cole Ball.

[01:29] Team_001 possession (Score: 21-14)
Dejounte McCollum attempts a Midrange. Contested by Jordan Green (4.6 feet, ZONE). Dejounte McCollum misses. Rebound secured by Carmelo Lowry.

[01:19] Team_002 possession (Score: 21-14)
CJ Barrett attempts a 3Pt. Contested by Klay Harden (4.9 feet, ZONE). CJ BARRETT MAKES IT! Assist: Miles Bane
Score: 21-17

[01:07] Team_001 possession (Score: 21-17)
Dirk Young attempts a 3Pt. Contested by Miles Bane (5.2 feet, ZONE). Dirk Young misses. Rebound secured by Carmelo Lowry.

[00:52] Team_002 possession (Score: 21-17)
FOUL! Shooting foul on Klay Harden. Miles Bane to the line for 2 free throws. [Team fouls: 4] (Klay Harden: 1 personal fouls)   FT 1/2: GOOD   FT 2/2: GOOD Miles Bane makes 2/2 from the line.
Score: 21-19

[00:52] Substitution (Team_001): Klay Harden OUT → Ja Dosunmu IN (stamina_rule2)

[00:52] Substitution (Team_001): Dirk Young OUT → Rudy George IN (stamina_rule2)

[00:52] Substitution (Team_001): Miles Griffin OUT → Kristaps Ming IN (stamina_rule2)

[00:52] Substitution (Team_002): CJ Barrett OUT → Dirk Middleton IN (stamina_rule2)

[00:52] Substitution (Team_002): Carmelo Lowry OUT → Julius Curry IN (stamina_rule2)

[00:52] Substitution (Team_002): Tyler Porzingis OUT → Lamelo O'Neal IN (stamina_rule2)

[00:40] Team_002 possession (Score: 21-19)
Jordan Green attempts a 3Pt. Wide open! Ja Dosunmu is 6.9 feet away. [ZONE] JORDAN GREEN MAKES IT! Assist: Miles Bane
Score: 21-22

[00:25] Team_001 possession (Score: 21-22)
Ja Dosunmu drives, picks up Miles Bane. Help arrives from Jordan Green! Ja Dosunmu attempts a Layup. Heavily contested by Jordan Green (1.3 feet, MAN)! JA DOSUNMU MAKES IT! Assist: Rudy George
Score: 23-22

[00:11] Team_002 possession (Score: 23-22)
Miles Bane attempts a 3Pt. Contested by Ja Dosunmu (2.7 feet, MAN). Miles Bane misses. Rebound secured by Dejounte McCollum.

================================================================================
                              1ST QUARTER COMPLETE                              
================================================================================

1ST QUARTER SCORE: Team_001 23, Team_002 22

BOX SCORE:
================================================================================

Team_001
--------------------------------------------------------------------------------
Player                MIN  PTS  REB  AST  TO      FG   FG%      3P   3P%
--------------------------------------------------------------------------------
Miles Griffin          11    7    4    0   0   3/3   100.0     0/0   0.0
Klay Harden            11    7    0    2   0   3/4    75.0     0/0   0.0
Dirk Young             11    5    0    1   0   2/5    40.0     0/0   0.0
Dejounte McCollum      12    2    1    1   0   1/3    33.3     0/0   0.0
Ja Dosunmu              1    2    0    0   0   1/1   100.0     0/0   0.0
Cole Ball              12    0    7    0   0   0/2     0.0     0/0   0.0
Rudy George             1    0    0    1   0   0/0     0.0     0/0   0.0

TEAM: FG: 10/18 (55.6%), 3PT: 0/6 (0.0%), REB: 11 (3 off, 8 def), AST: 5, TO: 5
TEAM FOULS: 4


Team_002
--------------------------------------------------------------------------------
Player                MIN  PTS  REB  AST  TO      FG   FG%      3P   3P%
--------------------------------------------------------------------------------
Tyler Porzingis        11    9    4    0   0   4/4   100.0     0/0   0.0
CJ Barrett             11    6    0    1   0   2/4    50.0     0/0   0.0
Jordan Green           12    5    0    1   0   2/7    28.6     0/0   0.0
Miles Bane             12    2    1    5   0   0/2     0.0     0/0   0.0
Carmelo Lowry          11    0    5    0   0   0/0     0.0     0/0   0.0

TEAM: FG: 8/17 (47.1%), 3PT: 4/10 (40.0%), REB: 11 (3 off, 8 def), AST: 7, TO: 5
TEAM FOULS: 7 [Team_001 in BONUS]

================================================================================

================================================================================
                       2ND QUARTER - Team_001 vs Team_002                       
================================================================================

[12:00] Team_001 possession (Score: 23-22)
Ja Dosunmu attempts a 3Pt. Wide open! Miles Bane is 6.5 feet away. [ZONE] Ja Dosunmu misses. Rebound secured by Julius Curry.

[11:47] Team_002 possession (Score: 23-22)
Julius Curry attempts a 3Pt. Contested by Dejounte McCollum (3.5 feet, MAN). Julius Curry misses. Offensive rebound by Miles Bane! Miles Bane kicks it out.

[11:36] Team_002 possession (Score: 23-22)
Dirk Middleton attempts a Midrange. Wide open! Rudy George is 6.7 feet away. [MAN] DIRK MIDDLETON MAKES IT! Assist: Lamelo O'Neal
Score: 23-24

[11:19] Team_001 possession (Score: 23-24)
Ja Dosunmu attempts a Midrange. Contested by Miles Bane (5.4 feet, MAN). JA DOSUNMU MAKES IT! Assist: Cole Ball
Score: 25-24

[11:01] Team_002 possession (Score: 25-24)
Miles Bane attempts a 3Pt. Wide open! Ja Dosunmu is 6.8 feet away. [ZONE] Miles Bane misses. Rebound secured by Dejounte McCollum.

[10:49] Team_001 possession (Score: 25-24)
FOUL! Offensive foul on Rudy George! Dirk Middleton drew the charge! [Team fouls: 1] (Rudy George: 1 personal fouls) TURNOVER! (dead ball)

[10:38] Team_002 possession (Score: 25-24)
Miles Bane drives and kicks out. Jordan Green attempts a Midrange. Contested by Cole Ball (3.6 feet, ZONE). Jordan Green misses. Rebound secured by Dejounte McCollum.

[10:22] Team_001 possession (Score: 25-24)
Ja Dosunmu attempts a Layup. BLOCKED BY MILES BANE! Ball is loose! Rebound secured by Miles Bane.

[10:12] Team_002 possession (Score: 25-24)
Miles Bane attempts a 3Pt. Contested by Ja Dosunmu (3.7 feet, MAN). Miles Bane misses. Offensive rebound by Miles Bane! Miles Bane kicks it out.

[09:57] Team_002 possession (Score: 25-24)
Jordan Green attempts a 3Pt. Contested by Cole Ball (3.2 feet, MAN). Jordan Green misses. Rebound secured by Cole Ball.

[09:45] Team_001 possession (Score: 25-24)
Dejounte McCollum attempts a 3Pt. Contested by Miles Bane (5.4 feet, ZONE). DEJOUNTE MCCOLLUM MAKES IT! Assist: Ja Dosunmu
Score: 28-24

[09:32] Team_002 possession (Score: 28-24)
FOUL! Shooting foul on Cole Ball. Julius Curry to the line for 2 free throws. [Team fouls: 2] (Cole Ball: 2 personal fouls)   FT 1/2: GOOD   FT 2/2: GOOD Julius Curry makes 2/2 from the line.
Score: 28-26

[09:32] Substitution (Team_002): Miles Bane OUT → John Duncan IN (stamina_rule2)

[09:32] Substitution (Team_002): Jordan Green OUT → Anfernee Sexton IN (stamina_rule2)

[09:15] Team_002 possession (Score: 28-26)
Dirk Middleton attempts a Midrange. Wide open! Rudy George is 7.5 feet away. [MAN] Dirk Middleton misses. Rebound secured by Cole Ball.

[08:57] Team_001 possession (Score: 28-26)
Ja Dosunmu attempts a 3Pt. Contested by Julius Curry (2.9 feet, ZONE). Ja Dosunmu misses. Rebound secured by Anfernee Sexton.

[08:40] Team_002 possession (Score: 28-26)
Lamelo O'Neal drives, picks up Dejounte McCollum. Help arrives from Rudy George! Lamelo O'Neal attempts a Layup. Heavily contested by Rudy George (1.2 feet, ZONE)! LAMELO O'NEAL MAKES IT! Assist: Dirk Middleton
Score: 28-28

[08:24] Team_001 possession (Score: 28-28)
Kristaps Ming loses the ball! Stripped by Lamelo O'Neal! TURNOVER! (live ball)

[08:10] Team_002 possession (Score: 28-28)
FOUL! Reach-in foul on Dejounte McCollum during the drive. [Team fouls: 3] No free throws, side out. (Dejounte McCollum: 2 personal fouls)

[08:10] Substitution (Team_001): Cole Ball OUT → Larry Trent IN (stamina_rule2)

[08:10] Substitution (Team_001): Dejounte McCollum OUT → Franz Bryant IN (stamina_rule2)

[07:53] Team_002 possession (Score: 28-28)
John Duncan attempts a 3Pt. Contested by Rudy George (5.5 feet, ZONE). JOHN DUNCAN MAKES IT! Assist: Dirk Middleton
Score: 28-31

[07:37] Team_001 possession (Score: 28-31)
Ja Dosunmu drives to the basket... Ja Dosunmu throws a bad pass! Stolen by Lamelo O'Neal! TURNOVER! (live ball)

[07:21] Team_002 possession (Score: 28-31)
Dirk Middleton attempts a 3Pt. Heavily contested by Ja Dosunmu (2.0 feet, ZONE)! DIRK MIDDLETON MAKES IT! Assist: Anfernee Sexton
Score: 28-34

[07:09] Team_001 possession (Score: 28-34)
Franz Bryant attempts a Midrange. BLOCKED BY LAMELO O'NEAL! Ball deflects out of bounds off Franz Bryant.

[06:56] Team_002 possession (Score: 28-34)
Julius Curry attempts a 3Pt. Wide open! Ja Dosunmu is 6.5 feet away. [ZONE] JULIUS CURRY MAKES IT! Assist: Anfernee Sexton
Score: 28-37

[06:44] Team_001 possession (Score: 28-37)
FOUL! Holding foul on Lamelo O'Neal. [Team fouls: 1] No free throws, side out. (Lamelo O'Neal: 1 personal fouls)

[06:30] Team_001 possession (Score: 28-37)
Rudy George attempts a 3Pt. Wide open! Dirk Middleton is 6.4 feet away. [MAN] Rudy George misses. Rebound secured by Anfernee Sexton.

[06:15] Team_002 possession (Score: 28-37)
Anfernee Sexton attempts a 3Pt. Wide open! Larry Trent is 9.1 feet away. [MAN] ANFERNEE SEXTON MAKES IT! Assist: Dirk Middleton
Score: 28-40

[06:01] Team_001 possession (Score: 28-40)
Rudy George attempts a 3Pt. Wide open! Dirk Middleton is 6.1 feet away. [MAN] RUDY GEORGE MAKES IT! Assist: Franz Bryant
Score: 31-40

[05:52] Team_002 possession (Score: 31-40)
Anfernee Sexton attempts a 3Pt. Contested by Ja Dosunmu (2.9 feet, ZONE). Anfernee Sexton misses. Rebound secured by Rudy George.

[05:37] Team_001 possession (Score: 31-40)
Rudy George attempts a Midrange. Contested by Dirk Middleton (5.9 feet, MAN). Rudy George misses. Rebound secured by Anfernee Sexton.

[05:24] Team_002 possession (Score: 31-40)
John Duncan attempts a Midrange. Contested by Rudy George (3.9 feet, ZONE). John Duncan misses. FOUL! Loose ball foul on Rudy George during the rebound battle. [Team fouls: 4] No free throws, side out. (Rudy George: 2 personal fouls)

[05:06] Team_002 possession (Score: 31-40)
Dirk Middleton drives, Rudy George stays with him. Dirk Middleton attempts a Layup. Heavily contested by Rudy George (0.9 feet, MAN)! Dirk Middleton misses. Offensive rebound by Anfernee Sexton! Anfernee Sexton kicks it out.

[04:52] Team_002 possession (Score: 31-40)
FOUL! Offensive foul on Lamelo O'Neal! Kristaps Ming drew the charge! [Team fouls: 2] (Lamelo O'Neal: 2 personal fouls) TURNOVER! (dead ball)

[04:38] Team_001 possession (Score: 31-40)
Franz Bryant attempts a Layup. Contested by Julius Curry (5.2 feet, MAN). Franz Bryant misses. Offensive rebound by Larry Trent! Larry Trent kicks it out.

[04:27] Team_001 possession (Score: 31-40)
Larry Trent attempts a 3Pt. Contested by Anfernee Sexton (5.9 feet, MAN). LARRY TRENT MAKES IT! Assist: Franz Bryant
Score: 34-40

[04:12] Team_002 possession (Score: 34-40)
Julius Curry drives to the basket... FOUL! Offensive foul on Julius Curry! Franz Bryant drew the charge! [Team fouls: 3] (Julius Curry: 1 personal fouls) TURNOVER! (dead ball)

[03:57] Team_001 possession (Score: 34-40)
Ja Dosunmu throws a bad pass out of bounds! TURNOVER! (dead ball)

[03:43] Team_002 possession (Score: 34-40)
Dirk Middleton attempts a 3Pt. Contested by Rudy George (3.3 feet, MAN). Dirk Middleton misses. Rebound secured by Larry Trent.

[03:29] Team_001 possession (Score: 34-40)
Larry Trent throws a bad pass! Stolen by Anfernee Sexton! TURNOVER! (live ball)

[03:19] Team_002 possession (Score: 34-40)
John Duncan attempts a Midrange. Contested by Rudy George (2.7 feet, ZONE). JOHN DUNCAN MAKES IT!
Score: 34-42

[03:03] Team_001 possession (Score: 34-42)
Franz Bryant attempts a 3Pt. Wide open! Julius Curry is 8.3 feet away. [ZONE] Franz Bryant misses. Offensive rebound by Larry Trent! Larry Trent kicks it out.

[02:49] Team_001 possession (Score: 34-42)
Ja Dosunmu attempts a 3Pt. Contested by Julius Curry (5.4 feet, ZONE). Ja Dosunmu misses. Rebound secured by Julius Curry.

[02:37] Team_002 possession (Score: 34-42)
John Duncan attempts a 3Pt. Wide open! Ja Dosunmu is 6.2 feet away. [MAN] John Duncan misses. Rebound secured by Franz Bryant.

[02:23] Team_001 possession (Score: 34-42)
Larry Trent attempts a 3Pt. Contested by Anfernee Sexton (5.8 feet, MAN). Larry Trent misses. Rebound secured by Anfernee Sexton.

[02:13] Team_002 possession (Score: 34-42)
Julius Curry attempts a 3Pt. Contested by Ja Dosunmu (3.0 feet, ZONE). Julius Curry misses. Rebound secured by Franz Bryant.

[02:03] Team_001 possession (Score: 34-42)
Ja Dosunmu throws a bad pass! Stolen by John Duncan! TURNOVER! (live ball)

[01:46] Team_002 possession (Score: 34-42)
John Duncan attempts a Midrange. Contested by Larry Trent (5.4 feet, ZONE). John Duncan misses. FOUL! Loose ball foul on Larry Trent during the rebound battle. [IN THE BONUS! 5 team fouls] Lamelo O'Neal to the line for 2 free throws. (Larry Trent: 1 personal fouls)   FT 1/2: MISS   FT 2/2: GOOD Lamelo O'Neal makes 1/2 from the line.
Score: 34-43

[01:30] Team_001 possession (Score: 34-43)
Kristaps Ming throws a bad pass! Stolen by Lamelo O'Neal! TURNOVER! (live ball)

[01:15] Team_002 possession (Score: 34-43)
Anfernee Sexton attempts a 3Pt. Contested by Ja Dosunmu (5.3 feet, ZONE). Anfernee Sexton misses. Rebound secured by Larry Trent.

[00:56] Team_001 possession (Score: 34-43)
Rudy George attempts a 3Pt. Wide open! Julius Curry is 8.0 feet away. [ZONE] RUDY GEORGE MAKES IT! Assist: Larry Trent
Score: 37-43

[00:37] Team_002 possession (Score: 37-43)
Anfernee Sexton attempts a 3Pt. Contested by Ja Dosunmu (5.8 feet, ZONE). Anfernee Sexton misses. FOUL! Loose ball foul on Larry Trent during the rebound battle. [IN THE BONUS! 6 team fouls] Lamelo O'Neal to the line for 2 free throws. (Larry Trent: 2 personal fouls)   FT 1/2: MISS   FT 2/2: GOOD Lamelo O'Neal makes 1/2 from the line.
Score: 37-44

[00:20] Team_001 possession (Score: 37-44)
Franz Bryant attempts a Midrange. Wide open! Dirk Middleton is 6.4 feet away. [ZONE] Franz Bryant misses. Offensive rebound by Franz Bryant! Franz Bryant kicks it out.

[00:01] Team_001 possession (Score: 37-44)
Larry Trent attempts a 3Pt. Wide open! John Duncan is 7.3 feet away. [ZONE] Larry Trent misses. Offensive rebound by Franz Bryant! Franz Bryant kicks it out.

================================================================================
                              2ND QUARTER COMPLETE                              
================================================================================

2ND QUARTER SCORE: Team_001 14, Team_002 22

BOX SCORE:
================================================================================

Team_001
--------------------------------------------------------------------------------
Player                MIN  PTS  REB  AST  TO      FG   FG%      3P   3P%
--------------------------------------------------------------------------------
Rudy George            13    6    1    0   0   2/4    50.0     0/0   0.0
Dejounte McCollum      16    3    2    0   0   1/1   100.0     0/0   0.0
Larry Trent             8    3    4    1   0   1/2    50.0     0/0   0.0
Ja Dosunmu             13    2    0    1   0   1/5    20.0     0/0   0.0
Cole Ball              16    0    2    1   0   0/0     0.0     0/0   0.0
Franz Bryant            8    0    4    2   0   0/1     0.0     0/0   0.0

TEAM: FG: 5/13 (38.5%), 3PT: 4/9 (44.4%), REB: 13 (4 off, 9 def), AST: 5, TO: 7
TEAM FOULS: 6 [Team_002 in BONUS]


Team_002
--------------------------------------------------------------------------------
Player                MIN  PTS  REB  AST  TO      FG   FG%      3P   3P%
--------------------------------------------------------------------------------
Julius Curry           13    5    2    0   0   1/2    50.0     0/0   0.0
Dirk Middleton         13    5    0    3   0   2/4    50.0     0/0   0.0
John Duncan             9    5    0    0   0   2/3    66.7     0/0   0.0
Lamelo O'Neal          13    4    0    1   0   3/3   100.0     0/0   0.0
Anfernee Sexton         9    3    6    2   0   1/3    33.3     0/0   0.0
Miles Bane             15    0    3    0   0   0/1     0.0     0/0   0.0
Jordan Green           15    0    0    0   0   0/2     0.0     0/0   0.0

TEAM: FG: 9/18 (50.0%), 3PT: 5/12 (41.7%), REB: 11 (4 off, 7 def), AST: 6, TO: 2
TEAM FOULS: 3

================================================================================

================================================================================
                       3RD QUARTER - Team_001 vs Team_002                       
================================================================================

[12:00] Team_001 possession (Score: 37-44)
Larry Trent attempts a 3Pt. Contested by Julius Curry (4.0 feet, ZONE). Larry Trent misses. Rebound secured by Lamelo O'Neal.

[11:45] Team_002 possession (Score: 37-44)
Julius Curry attempts a Midrange. Contested by Franz Bryant (3.5 feet, MAN). JULIUS CURRY MAKES IT!
Score: 37-46

[11:33] Team_001 possession (Score: 37-46)
Larry Trent attempts a Layup. Contested by Anfernee Sexton (3.5 feet, MAN). LARRY TRENT MAKES IT! Assist: Ja Dosunmu
Score: 39-46

[11:14] Team_002 possession (Score: 39-46)
Dirk Middleton attempts a 3Pt. Contested by Ja Dosunmu (5.9 feet, ZONE). Dirk Middleton misses. Rebound secured by Rudy George.

[10:59] Team_001 possession (Score: 39-46)
Kristaps Ming attempts a 3Pt. Wide open! Julius Curry is 7.7 feet away. [ZONE] KRISTAPS MING MAKES IT! Assist: Rudy George
Score: 42-46

[10:46] Team_002 possession (Score: 42-46)
Lamelo O'Neal attempts a Midrange. Contested by Kristaps Ming (3.6 feet, MAN). LAMELO O'NEAL MAKES IT!
Score: 42-48

[10:35] Team_001 possession (Score: 42-48)
Kristaps Ming attempts a Midrange. Contested by Lamelo O'Neal (5.1 feet, MAN). Kristaps Ming misses. Rebound secured by Lamelo O'Neal.

[10:24] Team_002 possession (Score: 42-48)
Julius Curry drives, picks up Franz Bryant. Help arrives from Rudy George! Julius Curry attempts a Dunk. Contested by Rudy George (2.9 feet, MAN). Julius Curry misses. Rebound secured by Rudy George.

[10:12] Team_001 possession (Score: 42-48)
Kristaps Ming throws a bad pass! Stolen by Lamelo O'Neal! TURNOVER! (live ball)

[10:02] Team_002 possession (Score: 42-48)
Anfernee Sexton attempts a 3Pt. Contested by Ja Dosunmu (5.2 feet, ZONE). Anfernee Sexton misses. Rebound secured by Kristaps Ming.

[09:44] Team_001 possession (Score: 42-48)
FOUL! Holding foul on Lamelo O'Neal. [Team fouls: 1] No free throws, side out. (Lamelo O'Neal: 3 personal fouls)

[09:28] Team_001 possession (Score: 42-48)
Larry Trent attempts a 3Pt. Contested by Anfernee Sexton (3.1 feet, MAN). Larry Trent misses. Rebound secured by Anfernee Sexton.

[09:13] Team_002 possession (Score: 42-48)
Dirk Middleton attempts a 3Pt. Contested by Rudy George (4.5 feet, MAN). Dirk Middleton misses. Offensive rebound by Lamelo O'Neal! Lamelo O'Neal puts it back in!
Score: 42-50

[09:04] Team_001 possession (Score: 42-50)
FOUL! Shooting foul on Lamelo O'Neal. Franz Bryant to the line for 3 free throws. [Team fouls: 2] (Lamelo O'Neal: 4 personal fouls)   FT 1/3: GOOD   FT 2/3: GOOD   FT 3/3: GOOD Franz Bryant makes 3/3 from the line.
Score: 45-50

[08:52] Team_001 possession (Score: 45-50)
Ja Dosunmu throws a bad pass out of bounds! TURNOVER! (dead ball)

[08:37] Team_002 possession (Score: 45-50)
Anfernee Sexton attempts a 3Pt. Heavily contested by Ja Dosunmu (1.3 feet, ZONE)! Anfernee Sexton misses. Rebound secured by Rudy George.

[08:20] Team_001 possession (Score: 45-50)
Franz Bryant drives, Lamelo O'Neal stays with him. Franz Bryant attempts a Dunk. Contested by Lamelo O'Neal (3.7 feet, ZONE). Franz Bryant misses. Rebound secured by Lamelo O'Neal.

[08:09] Team_002 possession (Score: 45-50)
FOUL! Holding foul on Larry Trent. [Team fouls: 1] No free throws, side out. (Larry Trent: 3 personal fouls)

[07:57] Team_002 possession (Score: 45-50)
Julius Curry attempts a 3Pt. Contested by Ja Dosunmu (2.8 feet, ZONE). Julius Curry misses. Rebound secured by Kristaps Ming.

[07:43] Team_001 possession (Score: 45-50)
FOUL! Reach-in foul on Lamelo O'Neal during the drive. [Team fouls: 3] No free throws, side out. (Lamelo O'Neal: 5 personal fouls)

[07:30] Team_001 possession (Score: 45-50)
Ja Dosunmu attempts a Midrange. Wide open! Dirk Middleton is 8.0 feet away. [ZONE] JA DOSUNMU MAKES IT!
Score: 47-50

[07:14] Team_002 possession (Score: 47-50)
Anfernee Sexton attempts a 3Pt. Contested by Ja Dosunmu (5.8 feet, ZONE). Anfernee Sexton misses. Rebound secured by Larry Trent.

[06:59] Team_001 possession (Score: 47-50)
Kristaps Ming attempts a 3Pt. Contested by Lamelo O'Neal (4.7 feet, MAN). Kristaps Ming misses. Rebound secured by Lamelo O'Neal.

[06:44] Team_002 possession (Score: 47-50)
FOUL! Offensive foul on Julius Curry! Franz Bryant drew the charge! [Team fouls: 4] (Julius Curry: 2 personal fouls) TURNOVER! (dead ball)

[06:31] Team_001 possession (Score: 47-50)
Kristaps Ming attempts a 3Pt. Contested by Lamelo O'Neal (3.6 feet, MAN). Kristaps Ming misses. Rebound secured by Anfernee Sexton.

[06:16] Team_002 possession (Score: 47-50)
Julius Curry drives, picks up Franz Bryant. Help arrives from Rudy George! Julius Curry attempts a Layup. Heavily contested by Rudy George (1.2 feet, MAN)! JULIUS CURRY MAKES IT! Assist: Anfernee Sexton
Score: 47-52

[06:05] Team_001 possession (Score: 47-52)
Ja Dosunmu attempts a 3Pt. Contested by Julius Curry (4.4 feet, ZONE). Ja Dosunmu misses. Rebound secured by Anfernee Sexton.

[05:56] Team_002 possession (Score: 47-52)
Dirk Middleton attempts a 3Pt. Wide open! Rudy George is 8.9 feet away. [MAN] DIRK MIDDLETON MAKES IT! Assist: Lamelo O'Neal
Score: 47-55

[05:37] Team_001 possession (Score: 47-55)
Kristaps Ming attempts a Layup. Heavily contested by Lamelo O'Neal (0.5 feet, ZONE)! Kristaps Ming misses. Rebound secured by Anfernee Sexton.

[05:25] Team_002 possession (Score: 47-55)
Anfernee Sexton attempts a 3Pt. Contested by Ja Dosunmu (3.5 feet, ZONE). Anfernee Sexton misses. Offensive rebound by Anfernee Sexton! Anfernee Sexton kicks it out.

[05:09] Team_002 possession (Score: 47-55)
Dirk Middleton attempts a 3Pt. Contested by Rudy George (3.2 feet, MAN). DIRK MIDDLETON MAKES IT! Assist: Anfernee Sexton
Score: 47-58

[04:56] Team_001 possession (Score: 47-58)
Kristaps Ming throws a bad pass! Stolen by Lamelo O'Neal! TURNOVER! (live ball)

[04:43] Team_002 possession (Score: 47-58)
Anfernee Sexton attempts a 3Pt. Heavily contested by Franz Bryant (0.5 feet, ZONE)! Anfernee Sexton misses. Rebound secured by Larry Trent.

[04:30] Team_001 possession (Score: 47-58)
Franz Bryant loses the ball! Stripped by Julius Curry! TURNOVER! (live ball)

[04:17] Team_002 possession (Score: 47-58)
John Duncan attempts a 3Pt. Contested by Ja Dosunmu (2.5 feet, MAN). John Duncan misses. Rebound secured by Larry Trent.

[04:07] Team_001 possession (Score: 47-58)
Franz Bryant attempts a 3Pt. Wide open! Julius Curry is 7.8 feet away. [ZONE] Franz Bryant misses. Rebound secured by Lamelo O'Neal.

[03:52] Team_002 possession (Score: 47-58)
John Duncan attempts a Midrange. Contested by Ja Dosunmu (4.6 feet, MAN). JOHN DUNCAN MAKES IT!
Score: 47-60

[03:36] Team_001 possession (Score: 47-60)
Larry Trent attempts a 3Pt. Wide open! Anfernee Sexton is 6.4 feet away. [MAN] LARRY TRENT MAKES IT! Assist: Ja Dosunmu
Score: 50-60

[03:22] Team_002 possession (Score: 50-60)
Anfernee Sexton attempts a Layup. BLOCKED BY RUDY GEORGE! Ball goes out off Rudy George. Anfernee Sexton's ball!

[03:10] Team_002 possession (Score: 50-60)
Lamelo O'Neal attempts a Layup. Wide open! Kristaps Ming is 6.0 feet away. [MAN] LAMELO O'NEAL MAKES IT!
Score: 50-62

[02:54] Team_001 possession (Score: 50-62)
Larry Trent makes the 3Pt and draws the foul on Anfernee Sexton! And-1! Larry Trent to the line for 1. [BONUS: 5 team fouls] (Anfernee Sexton: 1 personal fouls)   FT 1/1: GOOD Larry Trent makes 1/1 from the line.
Score: 54-62

[02:36] Team_002 possession (Score: 54-62)
FOUL! Shooting foul on Rudy George. Dirk Middleton to the line for 2 free throws. [Team fouls: 2] (Rudy George: 3 personal fouls)   FT 1/2: GOOD   FT 2/2: GOOD Dirk Middleton makes 2/2 from the line.
Score: 54-64

[02:36] Substitution (Team_001): Ja Dosunmu OUT → Klay Harden IN (starter_return_rule1)

[02:36] Substitution (Team_001): Rudy George OUT → Dirk Young IN (starter_return_rule1)

[02:36] Substitution (Team_001): Larry Trent OUT → Cole Ball IN (starter_return_rule1)

[02:36] Substitution (Team_001): Franz Bryant OUT → Dejounte McCollum IN (starter_return_rule1)

[02:36] Substitution (Team_001): Kristaps Ming OUT → Miles Griffin IN (starter_return_rule1)

[02:36] Substitution (Team_002): John Duncan OUT → Miles Bane IN (starter_return_rule1)

[02:36] Substitution (Team_002): Dirk Middleton OUT → CJ Barrett IN (starter_return_rule1)

[02:36] Substitution (Team_002): Anfernee Sexton OUT → Jordan Green IN (starter_return_rule1)

[02:36] Substitution (Team_002): Julius Curry OUT → Carmelo Lowry IN (starter_return_rule1)

[02:36] Substitution (Team_002): Lamelo O'Neal OUT → Tyler Porzingis IN (starter_return_rule1)

[02:26] Team_002 possession (Score: 54-64)
CJ Barrett throws a bad pass! Stolen by Dirk Young! TURNOVER! (live ball)

[02:08] Team_001 possession (Score: 54-64)
Klay Harden throws a bad pass! Stolen by Miles Bane! TURNOVER! (live ball)

[01:49] Team_002 possession (Score: 54-64)
Tyler Porzingis attempts a Layup. Contested by Miles Griffin (3.5 feet, MAN). TYLER PORZINGIS MAKES IT! Assist: Jordan Green
Score: 54-66

[01:35] Team_001 possession (Score: 54-66)
Dejounte McCollum makes the Layup and draws the foul on Carmelo Lowry! And-1! Dejounte McCollum to the line for 1. [BONUS: 6 team fouls] (Carmelo Lowry: 2 personal fouls)   FT 1/1: GOOD Dejounte McCollum makes 1/1 from the line.
Score: 57-66

[01:24] Team_002 possession (Score: 57-66)
Carmelo Lowry drives, Miles Griffin stays with him. Carmelo Lowry attempts a Layup. Heavily contested by Miles Griffin (1.9 feet, ZONE)! CARMELO LOWRY MAKES IT! Assist: Jordan Green
Score: 57-68

[01:10] Team_001 possession (Score: 57-68)
Dirk Young makes the Midrange and draws the foul on CJ Barrett! And-1! Dirk Young to the line for 1. [BONUS: 7 team fouls] (CJ Barrett: 5 personal fouls)   FT 1/1: MISS Dirk Young makes 0/1 from the line. Offensive rebound by Miles Griffin! Miles Griffin kicks it out.
Score: 59-68

[00:54] Team_001 possession (Score: 59-68)
Klay Harden attempts a 3Pt. Wide open! CJ Barrett is 8.5 feet away. [ZONE] Klay Harden misses. Offensive rebound by Miles Griffin! Miles Griffin kicks it out.

[00:37] Team_001 possession (Score: 59-68)
Dejounte McCollum attempts a 3Pt. Wide open! Carmelo Lowry is 7.8 feet away. [ZONE] Dejounte McCollum misses. Rebound secured by Carmelo Lowry.

[00:26] Team_002 possession (Score: 59-68)
Tyler Porzingis attempts a 3Pt. Contested by Dejounte McCollum (4.2 feet, ZONE). Tyler Porzingis misses. Rebound secured by Cole Ball.

[00:16] Team_001 possession (Score: 59-68)
Miles Griffin attempts a 3Pt. Contested by Tyler Porzingis (5.8 feet, MAN). Miles Griffin misses. Offensive rebound by Miles Griffin! Miles Griffin kicks it out.

================================================================================
                              3RD QUARTER COMPLETE                              
================================================================================

3RD QUARTER SCORE: Team_001 22, Team_002 24

BOX SCORE:
================================================================================

Team_001
--------------------------------------------------------------------------------
Player                MIN  PTS  REB  AST  TO      FG   FG%      3P   3P%
--------------------------------------------------------------------------------
Larry Trent            18    9    3    0   0   3/5    60.0     0/0   0.0
Kristaps Ming          22    3    2    0   0   1/5    20.0     0/0   0.0
Franz Bryant           18    3    0    0   0   0/2     0.0     0/0   0.0
Dejounte McCollum      19    3    0    0   0   1/2    50.0     0/0   0.0
Ja Dosunmu             22    2    0    2   0   1/2    50.0     0/0   0.0
Dirk Young             14    2    0    0   0   1/1   100.0     0/0   0.0
Rudy George            22    0    3    1   0   0/0     0.0     0/0   0.0
Miles Griffin          14    0    3    0   0   0/0     0.0     0/0   0.0
Cole Ball              19    0    1    0   0   0/0     0.0     0/0   0.0

TEAM: FG: 7/17 (41.2%), 3PT: 3/10 (30.0%), REB: 12 (3 off, 9 def), AST: 3, TO: 5
TEAM FOULS: 2


Team_002
--------------------------------------------------------------------------------
Player                MIN  PTS  REB  AST  TO      FG   FG%      3P   3P%
--------------------------------------------------------------------------------
Dirk Middleton         22    8    0    0   0   2/3    66.7     0/0   0.0
Lamelo O'Neal          22    6    6    1   0   3/3   100.0     0/0   0.0
Julius Curry           22    4    0    0   0   2/4    50.0     0/0   0.0
John Duncan            19    2    0    0   0   1/2    50.0     0/0   0.0
Tyler Porzingis        14    2    0    0   0   1/2    50.0     0/0   0.0
Carmelo Lowry          14    2    1    0   0   1/1   100.0     0/0   0.0
Anfernee Sexton        19    0    5    2   0   0/4     0.0     0/0   0.0
Jordan Green           17    0    0    2   0   0/0     0.0     0/0   0.0

TEAM: FG: 10/19 (52.6%), 3PT: 3/11 (27.3%), REB: 12 (2 off, 10 def), AST: 5, TO: 2
TEAM FOULS: 7 [Team_001 in BONUS]

================================================================================

================================================================================
                       4TH QUARTER - Team_001 vs Team_002                       
================================================================================

[12:00] Team_001 possession (Score: 59-68)
Klay Harden attempts a 3Pt. Contested by Miles Bane (3.6 feet, MAN). KLAY HARDEN MAKES IT! Assist: Cole Ball
Score: 62-68

[11:43] Team_002 possession (Score: 62-68)
CJ Barrett drives, picks up Dejounte McCollum. Help arrives from Klay Harden! CJ Barrett attempts a Layup. Contested by Klay Harden (3.0 feet, ZONE). CJ BARRETT MAKES IT! Assist: Tyler Porzingis
Score: 62-70

[11:31] Team_001 possession (Score: 62-70)
Dejounte McCollum attempts a 3Pt. Wide open! Carmelo Lowry is 10.0 feet away. [MAN] DEJOUNTE MCCOLLUM MAKES IT! Assist: Miles Griffin
Score: 65-70

[11:18] Team_002 possession (Score: 65-70)
Miles Bane drives and kicks out. Miles Bane attempts a 3Pt. Contested by Klay Harden (5.1 feet, ZONE). Miles Bane misses. Rebound secured by Dejounte McCollum.

[11:03] Team_001 possession (Score: 65-70)
Dirk Young attempts a 3Pt. Wide open! CJ Barrett is 8.4 feet away. [ZONE] DIRK YOUNG MAKES IT! Assist: Klay Harden
Score: 68-70

[10:50] Team_002 possession (Score: 68-70)
CJ Barrett attempts a 3Pt. Contested by Cole Ball (4.7 feet, ZONE). CJ Barrett misses. Rebound secured by Miles Griffin.

[10:33] Team_001 possession (Score: 68-70)
Cole Ball attempts a 3Pt. Contested by CJ Barrett (5.5 feet, ZONE). Cole Ball misses. Rebound secured by Carmelo Lowry.

[10:18] Team_002 possession (Score: 68-70)
Jordan Green attempts a 3Pt. Contested by Klay Harden (2.1 feet, ZONE). Jordan Green misses. Rebound secured by Cole Ball.

[10:06] Team_001 possession (Score: 68-70)
Klay Harden attempts a 3Pt. Wide open! CJ Barrett is 6.2 feet away. [ZONE] Klay Harden misses. Rebound secured by Tyler Porzingis.

[09:47] Team_002 possession (Score: 68-70)
Carmelo Lowry attempts a 3Pt. Contested by Klay Harden (4.5 feet, ZONE). CARMELO LOWRY MAKES IT! Assist: CJ Barrett
Score: 68-73

[09:29] Team_001 possession (Score: 68-73)
Cole Ball attempts a 3Pt. Contested by Jordan Green (5.1 feet, MAN). Cole Ball misses. Rebound secured by Miles Bane.

[09:19] Team_002 possession (Score: 68-73)
CJ Barrett throws a bad pass! Stolen by Dirk Young! TURNOVER! (live ball)

[09:07] Team_001 possession (Score: 68-73)
Cole Ball drives to the basket... Cole Ball loses control! Ball rolls out of bounds! TURNOVER! (dead ball)

[08:51] Team_002 possession (Score: 68-73)
Jordan Green attempts a Layup. Heavily contested by Cole Ball (0.8 feet, MAN)! Jordan Green misses. Rebound secured by Cole Ball.

[08:32] Team_001 possession (Score: 68-73)
Miles Griffin attempts a Midrange. Contested by Tyler Porzingis (4.4 feet, MAN). Miles Griffin misses. Rebound secured by Miles Bane.

[08:17] Team_002 possession (Score: 68-73)
Miles Bane attempts a 3Pt. Wide open! Klay Harden is 6.2 feet away. [ZONE] MILES BANE MAKES IT!
Score: 68-76

[08:01] Team_001 possession (Score: 68-76)
Dirk Young attempts a 3Pt. Contested by CJ Barrett (3.9 feet, MAN). DIRK YOUNG MAKES IT! Assist: Cole Ball
Score: 71-76

[07:46] Team_002 possession (Score: 71-76)
FOUL! Reach-in foul on Klay Harden during the drive. [Team fouls: 1] No free throws, side out. (Klay Harden: 2 personal fouls)

[07:28] Team_002 possession (Score: 71-76)
CJ Barrett attempts a 3Pt. Contested by Dirk Young (3.2 feet, MAN). CJ Barrett misses. Offensive rebound by Carmelo Lowry! Carmelo Lowry kicks it out.

[07:14] Team_002 possession (Score: 71-76)
Jordan Green attempts a Midrange. Heavily contested by Cole Ball (1.2 feet, MAN)! Jordan Green misses. Rebound secured by Miles Griffin.

[06:56] Team_001 possession (Score: 71-76)
Dirk Young attempts a 3Pt. Contested by CJ Barrett (3.9 feet, MAN). DIRK YOUNG MAKES IT! Assist: Cole Ball
Score: 74-76

[06:44] Team_002 possession (Score: 74-76)
CJ Barrett attempts a 3Pt. Contested by Klay Harden (3.0 feet, ZONE). CJ Barrett misses. Rebound secured by Cole Ball.

[06:31] Team_001 possession (Score: 74-76)
Dejounte McCollum attempts a 3Pt. Wide open! CJ Barrett is 7.4 feet away. [ZONE] Dejounte McCollum misses. FOUL! Loose ball foul on Tyler Porzingis during the rebound battle. [Team fouls: 1] No free throws, side out. (Tyler Porzingis: 2 personal fouls)

[06:21] Team_001 possession (Score: 74-76)
Dirk Young attempts a 3Pt. Wide open! CJ Barrett is 6.5 feet away. [MAN] Dirk Young misses. Rebound secured by Tyler Porzingis.

[06:06] Team_002 possession (Score: 74-76)
CJ Barrett attempts a 3Pt. Contested by Klay Harden (2.6 feet, ZONE). CJ Barrett misses. Rebound secured by Dejounte McCollum.

[05:51] Team_001 possession (Score: 74-76)
Dejounte McCollum drives and kicks out. Dirk Young attempts a Midrange. Wide open! CJ Barrett is 7.1 feet away. [ZONE] Dirk Young misses. Rebound secured by Carmelo Lowry.

[05:35] Team_002 possession (Score: 74-76)
Miles Bane attempts a Layup. Contested by Klay Harden (4.6 feet, MAN). MILES BANE MAKES IT! Assist: Carmelo Lowry
Score: 74-78

[05:24] Team_001 possession (Score: 74-78)
Dejounte McCollum attempts a 3Pt. Heavily contested by Carmelo Lowry (0.9 feet, MAN)! Dejounte McCollum misses. Rebound secured by Miles Bane.

[05:08] Team_002 possession (Score: 74-78)
Miles Bane drives and kicks out. Jordan Green attempts a 3Pt. Heavily contested by Cole Ball (0.5 feet, MAN)! Jordan Green misses. Rebound secured by Cole Ball.

[04:56] Team_001 possession (Score: 74-78)
Dirk Young attempts a Midrange. Contested by CJ Barrett (5.1 feet, MAN). Dirk Young misses. Rebound secured by Miles Bane.

[04:43] Team_002 possession (Score: 74-78)
Tyler Porzingis attempts a Midrange. Wide open! Miles Griffin is 6.2 feet away. [MAN] TYLER PORZINGIS MAKES IT! Assist: Miles Bane
Score: 74-80

[04:24] Team_001 possession (Score: 74-80)
Miles Griffin drives, picks up Tyler Porzingis. Help arrives from CJ Barrett! Miles Griffin attempts a Layup. Heavily contested by CJ Barrett (1.4 feet, ZONE)! Miles Griffin misses. Rebound secured by Miles Bane.

[04:09] Team_002 possession (Score: 74-80)
Tyler Porzingis attempts a Layup. Wide open! Miles Griffin is 6.4 feet away. [MAN] TYLER PORZINGIS MAKES IT! Assist: Jordan Green
Score: 74-82

[03:51] Team_001 possession (Score: 74-82)
Klay Harden throws a bad pass! Stolen by Miles Bane! TURNOVER! (live ball)

[03:37] Team_002 possession (Score: 74-82)
Carmelo Lowry drives, Dejounte McCollum stays with him. Carmelo Lowry attempts a Dunk. Contested by Dejounte McCollum (2.6 feet, MAN). Carmelo Lowry misses. Rebound secured by Cole Ball.

[03:20] Team_001 possession (Score: 74-82)
FOUL! Holding foul on Jordan Green. [Team fouls: 2] No free throws, side out. (Jordan Green: 1 personal fouls)

[03:00] Team_001 possession (Score: 74-82)
FOUL! Holding foul on Tyler Porzingis. [Team fouls: 3] No free throws, side out. (Tyler Porzingis: 3 personal fouls)

[02:47] Team_001 possession (Score: 74-82)
FOUL! Offensive foul on Cole Ball! Jordan Green drew the charge! [Team fouls: 2] (Cole Ball: 3 personal fouls) TURNOVER! (dead ball)

[02:33] Team_002 possession (Score: 74-82)
CJ Barrett attempts a 3Pt. Contested by Dirk Young (4.2 feet, MAN). CJ Barrett misses. Offensive rebound by Carmelo Lowry! Carmelo Lowry kicks it out.

[02:19] Team_002 possession (Score: 74-82)
FOUL! Shooting foul on Cole Ball. Jordan Green to the line for 3 free throws. [Team fouls: 3] (Cole Ball: 4 personal fouls)   FT 1/3: GOOD   FT 2/3: GOOD   FT 3/3: GOOD Jordan Green makes 3/3 from the line.
Score: 74-85

[02:19] Substitution (Team_001): Klay Harden OUT → Rudy George IN (stamina_rule2)

[02:19] Substitution (Team_001): Dirk Young OUT → Ja Dosunmu IN (stamina_rule2)

[02:19] Substitution (Team_001): Miles Griffin OUT → Kristaps Ming IN (stamina_rule2)

[02:19] Substitution (Team_002): CJ Barrett OUT → Dirk Middleton IN (stamina_rule2)

[02:19] Substitution (Team_002): Carmelo Lowry OUT → Julius Curry IN (stamina_rule2)

[02:19] Substitution (Team_002): Tyler Porzingis OUT → Lamelo O'Neal IN (stamina_rule2)

[01:59] Team_002 possession (Score: 74-85)
Miles Bane drives and kicks out. Julius Curry attempts a 3Pt. Contested by Dejounte McCollum (3.1 feet, MAN). Julius Curry misses. Offensive rebound by Lamelo O'Neal! Lamelo O'Neal puts it back in!
Score: 74-87

[01:48] Team_001 possession (Score: 74-87)
Cole Ball attempts a 3Pt. Contested by Jordan Green (5.8 feet, ZONE). COLE BALL MAKES IT! Assist: Rudy George
Score: 77-87

[01:36] Team_002 possession (Score: 77-87)
Dirk Middleton attempts a 3Pt. Contested by Ja Dosunmu (4.3 feet, ZONE). Dirk Middleton misses. Rebound secured by Dejounte McCollum.

[01:16] Team_001 possession (Score: 77-87)
Dejounte McCollum attempts a 3Pt. Contested by Miles Bane (2.0 feet, ZONE). Dejounte McCollum misses. Offensive rebound by Dejounte McCollum! Dejounte McCollum kicks it out.

[00:58] Team_001 possession (Score: 77-87)
Dejounte McCollum attempts a 3Pt. Heavily contested by Miles Bane (1.3 feet, ZONE)! DEJOUNTE MCCOLLUM MAKES IT! Assist: Ja Dosunmu
Score: 80-87

[00:39] Team_002 possession (Score: 80-87)
Lamelo O'Neal attempts a Midrange. Contested by Kristaps Ming (5.7 feet, MAN). Lamelo O'Neal misses. Rebound secured by Dejounte McCollum.

[00:26] Team_001 possession (Score: 80-87)
Ja Dosunmu drives and kicks out. Kristaps Ming attempts a 3Pt. Contested by Lamelo O'Neal (4.2 feet, MAN). KRISTAPS MING MAKES IT! Assist: Rudy George
Score: 83-87

[00:12] Team_002 possession (Score: 83-87)
Ja Dosunmu intentionally fouls Dirk Middleton! [Team fouls: 4] (Ja Dosunmu: 1 personal fouls)

[00:10] Team_002 possession (Score: 83-87)
Kristaps Ming intentionally fouls Dirk Middleton! [BONUS: 5 team fouls] (Kristaps Ming: 1 personal fouls) Dirk Middleton to the line for 2 free throws.   FT 1/2: GOOD   FT 2/2: MISS Dirk Middleton makes 1/2 from the line. Rebound secured by Rudy George.
Score: 83-89

[00:08] Team_001 possession (Score: 83-89)
Cole Ball attempts a 3Pt. BLOCKED BY MILES BANE! Ball is loose! Rebound secured by Julius Curry.

================================================================================
                              4TH QUARTER COMPLETE                              
================================================================================

4TH QUARTER SCORE: Team_001 24, Team_002 21

BOX SCORE:
================================================================================

Team_001
--------------------------------------------------------------------------------
Player                MIN  PTS  REB  AST  TO      FG   FG%      3P   3P%
--------------------------------------------------------------------------------
Dirk Young             24    9    0    0   0   3/6    50.0     0/0   0.0
Dejounte McCollum      31    6    5    0   0   2/3    66.7     0/0   0.0
Klay Harden            24    3    0    1   0   1/2    50.0     0/0   0.0
Cole Ball              31    3    6    3   0   1/4    25.0     0/0   0.0
Kristaps Ming          25    3    0    0   0   1/1   100.0     0/0   0.0
Miles Griffin          24    0    2    1   0   0/2     0.0     0/0   0.0
Rudy George            25    0    1    2   0   0/0     0.0     0/0   0.0
Ja Dosunmu             25    0    0    1   0   0/0     0.0     0/0   0.0

TEAM: FG: 8/18 (44.4%), 3PT: 8/14 (57.1%), REB: 14 (2 off, 12 def), AST: 8, TO: 3
TEAM FOULS: 5 [Team_002 in BONUS]


Team_002
--------------------------------------------------------------------------------
Player                MIN  PTS  REB  AST  TO      FG   FG%      3P   3P%
--------------------------------------------------------------------------------
Miles Bane             29    5    5    1   0   2/3    66.7     0/0   0.0
Tyler Porzingis        24    4    2    1   0   2/2   100.0     0/0   0.0
Carmelo Lowry          24    3    4    1   0   1/2    50.0     0/0   0.0
Jordan Green           29    3    0    1   0   0/4     0.0     0/0   0.0
CJ Barrett             24    2    0    1   0   1/4    25.0     0/0   0.0
Lamelo O'Neal          25    2    1    0   0   1/2    50.0     0/0   0.0
Dirk Middleton         25    0    0    0   0   0/1     0.0     0/0   0.0
Julius Curry           25    0    1    0   0   0/0     0.0     0/0   0.0

TEAM: FG: 7/19 (36.8%), 3PT: 3/10 (30.0%), REB: 13 (3 off, 10 def), AST: 5, TO: 1
TEAM FOULS: 3

================================================================================

================================================================================
                               FULL GAME COMPLETE                               
================================================================================

FINAL SCORE: Team_001 83, Team_002 89

SCORING BY QUARTER:
--------------------------------------------------------------------------------
Team                     Q1     Q2     Q3     Q4    FINAL
--------------------------------------------------------------------------------
Team_001                 23     14     22     24       83
Team_002                 22     22     24     21       89
--------------------------------------------------------------------------------

FULL GAME BOX SCORE:
================================================================================

Team_001
--------------------------------------------------------------------------------
Player                MIN  PTS  REB  AST  TO      FG   FG%      3P   3P%      FT STL BLK
--------------------------------------------------------------------------------
Cole Ball              31    3   16    4   3   1/6    16.7   1/6    16.7   0/0     0   0
Dejounte McCollum      31   14    8    1   1   5/9    55.6   3/5    60.0   1/1     1   0
Ja Dosunmu             25    6    0    4   3   3/8    37.5   0/4     0.0   0/0     0   0
Rudy George            25    6    5    4   2   2/4    50.0   2/3    66.7   0/0     0   1
Kristaps Ming          25    6    2    0   4   2/6    33.3   2/4    50.0   0/0     0   0
Klay Harden            24   10    0    3   4   4/6    66.7   1/3    33.3   1/2     2   0
Dirk Young             24   16    0    1   0   6/12   50.0   3/7    42.9   1/2     2   0
Miles Griffin          24    7    9    1   1   3/5    60.0   0/0     0.0   1/1     2   0
Larry Trent            18   12    7    1   1   4/7    57.1   3/6    50.0   1/1     0   0
Franz Bryant           18    3    4    2   1   0/3     0.0   0/1     0.0   3/3     0   0

TEAM: FG: 30/66 (45.5%), 3PT: 15/39 (38.5%), REB: 50 (12 off, 38 def), AST: 21, TO: 20


Team_002
--------------------------------------------------------------------------------
Player                MIN  PTS  REB  AST  TO      FG   FG%      3P   3P%      FT STL BLK
--------------------------------------------------------------------------------
Miles Bane             29    7    9    6   3   2/6    33.3   1/4    25.0   2/2     4   2
Jordan Green           29    8    0    4   1   2/13   15.4   1/8    12.5   3/3     0   0
Dirk Middleton         25   13    0    3   0   4/9    44.4   3/7    42.9   2/2     0   0
Julius Curry           25    9    3    0   1   3/7    42.9   1/4    25.0   2/2     1   0
Lamelo O'Neal          25   12    7    2   1   5/6    83.3   0/0     0.0   2/4     5   1
CJ Barrett             24    8    0    2   3   3/8    37.5   2/6    33.3   0/0     0   1
Carmelo Lowry          24    5   10    1   0   2/3    66.7   1/1   100.0   0/0     0   0
Tyler Porzingis        24   15    6    1   0   7/9    77.8   1/2    50.0   0/0     2   0
John Duncan            19    7    0    0   1   4/6    66.7   1/3    33.3   0/0     1   0
Anfernee Sexton        19    3   11    4   0   2/8    25.0   2/8    25.0   0/0     1   0

TEAM: FG: 34/73 (46.6%), 3PT: 15/43 (34.9%), REB: 47 (12 off, 35 def), AST: 23, TO: 10

================================================================================
