================================================================================
                        FULL GAME - Team_001 vs Team_050                        
================================================================================

================================================================================
                       1ST QUARTER - Team_001 vs Team_050                       
================================================================================

[12:00] Team_001 possession (Score: 0-0)
Klay Harden attempts a Midrange. Contested by Joel Banchero (4.2 feet, ZONE). Klay Harden misses. Rebound secured by Collin Bane.

[11:46] Team_050 possession (Score: 0-0)
Giannis LaVine throws a bad pass out of bounds! TURNOVER! (dead ball)

[11:30] Team_001 possession (Score: 0-0)
Klay Harden attempts a Midrange. Contested by Giannis LaVine (3.8 feet, MAN). KLAY HARDEN MAKES IT!
Score: 2-0

[11:13] Team_050 possession (Score: 2-0)
Collin Bane attempts a 3Pt. Contested by Klay Harden (4.0 feet, ZONE). COLLIN BANE MAKES IT!
Score: 2-3

[10:56] Team_001 possession (Score: 2-3)
Klay Harden attempts a Layup. Contested by Donovan Trent (4.7 feet, ZONE). Klay Harden misses. Rebound secured by LeBron Bridges.

[10:42] Team_050 possession (Score: 2-3)
LeBron Bridges attempts a 3Pt. Contested by Dejounte McCollum (3.9 feet, MAN). LeBron Bridges misses. Rebound secured by Miles Griffin.

[10:26] Team_001 possession (Score: 2-3)
Miles Griffin attempts a Midrange. Contested by Donovan Trent (5.3 feet, MAN). Miles Griffin misses. Rebound secured by LeBron Bridges.

[10:14] Team_050 possession (Score: 2-3)
Collin Bane attempts a 3Pt. Contested by Cole Ball (3.3 feet, MAN). Collin Bane misses. Rebound secured by Miles Griffin.

[10:00] Team_001 possession (Score: 2-3)
FOUL! Offensive foul on Dejounte McCollum! LeBron Bridges drew the charge! [Team fouls: 1] (Dejounte McCollum: 1 personal fouls) TURNOVER! (dead ball)

[09:45] Team_050 possession (Score: 2-3)
Joel Banchero attempts a Midrange. Contested by Dirk Young (3.4 feet, MAN). JOEL BANCHERO MAKES IT! Assist: Collin Bane
Score: 2-5

[09:33] Team_001 possession (Score: 2-5)
Klay Harden drives to the basket... FOUL! Offensive foul on Klay Harden! Donovan Trent drew the charge! [Team fouls: 2] (Klay Harden: 1 personal fouls) TURNOVER! (dead ball)

[09:16] Team_050 possession (Score: 2-5)
FOUL! Reach-in foul on Miles Griffin during the drive. [Team fouls: 3] No free throws, side out. (Miles Griffin: 1 personal fouls)

[09:05] Team_050 possession (Score: 2-5)
Collin Bane throws a bad pass! Stolen by Cole Ball! TURNOVER! (live ball)

[08:50] Team_001 possession (Score: 2-5)
Cole Ball attempts a Midrange. Contested by Collin Bane (3.9 feet, MAN). Cole Ball misses. Rebound secured by LeBron Bridges.

[08:35] Team_050 possession (Score: 2-5)
Donovan Trent loses the ball! Stripped by Miles Griffin! TURNOVER! (live ball)

[08:18] Team_001 possession (Score: 2-5)
Klay Harden attempts a 3Pt. Contested by Giannis LaVine (3.8 feet, MAN). KLAY HARDEN MAKES IT! Assist: Dirk Young
Score: 5-5

[08:06] Team_050 possession (Score: 5-5)
Donovan Trent attempts a Layup. Contested by Miles Griffin (3.8 feet, MAN). Donovan Trent misses. Offensive rebound by LeBron Bridges! LeBron Bridges kicks it out.

[07:48] Team_050 possession (Score: 5-5)
Joel Banchero attempts a Midrange. Contested by Dirk Young (3.4 feet, MAN). JOEL BANCHERO MAKES IT!
Score: 5-7

[07:34] Team_001 possession (Score: 5-7)
Cole Ball attempts a 3Pt. Contested by Collin Bane (3.9 feet, MAN). Cole Ball misses. Offensive rebound by Cole Ball! Cole Ball kicks it out.

[07:21] Team_001 possession (Score: 5-7)
Dirk Young drives and kicks out. Dejounte McCollum attempts a 3Pt. Contested by LeBron Bridges (4.2 feet, MAN). Dejounte McCollum misses. Rebound secured by LeBron Bridges.

[07:09] Team_050 possession (Score: 5-7)
LeBron Bridges drives to the basket... LeBron Bridges loses control! Ball rolls out of bounds! TURNOVER! (dead ball)

[06:54] Team_001 possession (Score: 5-7)
Cole Ball drives to the basket... Cole Ball throws a bad pass out of bounds! TURNOVER! (dead ball)

[06:43] Team_050 possession (Score: 5-7)
LeBron Bridges attempts a 3Pt. Contested by Dejounte McCollum (3.9 feet, MAN). LEBRON BRIDGES MAKES IT! Assist: Joel Banchero
Score: 5-10

[06:26] Team_001 possession (Score: 5-10)
Cole Ball attempts a 3Pt. Contested by Giannis LaVine (3.6 feet, ZONE). Cole Ball misses. Rebound secured by Joel Banchero.

[06:13] Team_050 possession (Score: 5-10)
Collin Bane attempts a Midrange. Contested by Cole Ball (3.3 feet, ZONE). Collin Bane misses. FOUL! Loose ball foul on Dejounte McCollum during the rebound battle. [Team fouls: 4] No free throws, side out. (Dejounte McCollum: 2 personal fouls)

[05:57] Team_050 possession (Score: 5-10)
LeBron Bridges attempts a 3Pt. Contested by Dejounte McCollum (3.9 feet, MAN). LeBron Bridges misses. Rebound secured by Miles Griffin.

[05:46] Team_001 possession (Score: 5-10)
Dejounte McCollum drives, LeBron Bridges stays with him. Dejounte McCollum attempts a Dunk. Contested by LeBron Bridges (4.1 feet, MAN). Dejounte McCollum misses. Rebound secured by Joel Banchero.

[05:34] Team_050 possession (Score: 5-10)
LeBron Bridges drives and kicks out. Giannis LaVine makes the Midrange and draws the foul on Cole Ball! And-1! Giannis LaVine to the line for 1. [BONUS: 5 team fouls] (Cole Ball: 1 personal fouls)   FT 1/1: GOOD Giannis LaVine makes 1/1 from the line.
Score: 5-13

[05:19] Team_001 possession (Score: 5-13)
FOUL! Holding foul on Collin Bane. [Team fouls: 1] No free throws, side out. (Collin Bane: 1 personal fouls)

[05:07] Team_001 possession (Score: 5-13)
Miles Griffin attempts a Midrange. Contested by Donovan Trent (5.3 feet, ZONE). Miles Griffin misses. Offensive rebound by Miles Griffin! Miles Griffin kicks it out.

[04:52] Team_001 possession (Score: 5-13)
Cole Ball attempts a 3Pt. Contested by Collin Bane (3.9 feet, MAN). Cole Ball misses. Rebound secured by LeBron Bridges.

[04:41] Team_050 possession (Score: 5-13)
Joel Banchero attempts a 3Pt. Contested by Klay Harden (3.8 feet, ZONE). Joel Banchero misses. Rebound secured by Cole Ball.

[04:28] Team_001 possession (Score: 5-13)
Dejounte McCollum attempts a Layup. Contested by LeBron Bridges (4.2 feet, MAN). Dejounte McCollum misses. Offensive rebound by Cole Ball! Cole Ball kicks it out.

[04:15] Team_001 possession (Score: 5-13)
FOUL! Reach-in foul on Donovan Trent during the drive. [Team fouls: 2] No free throws, side out. (Donovan Trent: 1 personal fouls)

[04:01] Team_001 possession (Score: 5-13)
Cole Ball drives, Donovan Trent stays with him. Cole Ball attempts a Layup. Contested by Donovan Trent (4.7 feet, ZONE). COLE BALL MAKES IT! Assist: Miles Griffin
Score: 7-13

[03:47] Team_050 possession (Score: 7-13)
Joel Banchero attempts a Midrange. Contested by Dirk Young (3.5 feet, ZONE). JOEL BANCHERO MAKES IT! Assist: LeBron Bridges
Score: 7-15

[03:32] Team_001 possession (Score: 7-15)
Miles Griffin attempts a 3Pt. Contested by Giannis LaVine (4.5 feet, ZONE). MILES GRIFFIN MAKES IT! Assist: Klay Harden
Score: 10-15

[03:17] Team_050 possession (Score: 10-15)
Donovan Trent attempts a 3Pt. Contested by Dejounte McCollum (3.7 feet, ZONE). DONOVAN TRENT MAKES IT! Assist: LeBron Bridges
Score: 10-18

[03:03] Team_001 possession (Score: 10-18)
Cole Ball drives, Donovan Trent stays with him. Cole Ball attempts a Layup. Contested by Donovan Trent (4.8 feet, ZONE). Cole Ball misses. Rebound secured by Collin Bane.

[02:49] Team_050 possession (Score: 10-18)
LeBron Bridges drives and kicks out. LeBron Bridges makes the Midrange and draws the foul on Dejounte McCollum! And-1! LeBron Bridges to the line for 1. [BONUS: 6 team fouls] (Dejounte McCollum: 3 personal fouls)   FT 1/1: MISS LeBron Bridges makes 0/1 from the line. Offensive rebound by Collin Bane! Collin Bane kicks it out.
Score: 10-20

[02:34] Team_050 possession (Score: 10-20)
LeBron Bridges attempts a Layup. BLOCKED BY DEJOUNTE MCCOLLUM! Ball is loose! Rebound secured by Dejounte McCollum.

[02:16] Team_001 possession (Score: 10-20)
FOUL! Reach-in foul on Donovan Trent during the drive. [Team fouls: 3] No free throws, side out. (Donovan Trent: 2 personal fouls)

[02:04] Team_001 possession (Score: 10-20)
Dirk Young makes the Layup and draws the foul on Joel Banchero! And-1! Dirk Young to the line for 1. [Team fouls: 4] (Joel Banchero: 1 personal fouls)   FT 1/1: MISS Dirk Young makes 0/1 from the line. Rebound secured by Collin Bane.
Score: 12-20

[01:48] Team_050 possession (Score: 12-20)
Donovan Trent drives and kicks out. Joel Banchero attempts a 3Pt. Contested by Klay Harden (4.3 feet, ZONE). Joel Banchero misses. Offensive rebound by LeBron Bridges! LeBron Bridges kicks it out.

[01:36] Team_050 possession (Score: 12-20)
Donovan Trent drives and kicks out. Donovan Trent attempts a Midrange. Contested by Miles Griffin (4.5 feet, MAN). Donovan Trent misses. Rebound secured by Cole Ball.

[01:20] Team_001 possession (Score: 12-20)
Dirk Young attempts a 3Pt. Contested by Giannis LaVine (4.5 feet, ZONE). DIRK YOUNG MAKES IT! Assist: Dejounte McCollum
Score: 15-20

[01:04] Team_050 possession (Score: 15-20)
FOUL! Reach-in foul on Dirk Young during the drive. [IN THE BONUS! 7 team fouls] Joel Banchero to the line for 2 free throws. (Dirk Young: 1 personal fouls)   FT 1/2: GOOD   FT 2/2: GOOD Joel Banchero makes 2/2 from the line.
Score: 15-22

[00:49] Team_001 possession (Score: 15-22)
FOUL! Shooting foul on Donovan Trent. Miles Griffin to the line for 2 free throws. [BONUS: 5 team fouls] (Donovan Trent: 3 personal fouls)   FT 1/2: GOOD   FT 2/2: GOOD Miles Griffin makes 2/2 from the line.
Score: 17-22

[00:33] Team_050 possession (Score: 17-22)
LeBron Bridges attempts a 3Pt. Contested by Dejounte McCollum (4.3 feet, MAN). LeBron Bridges misses. Rebound secured by Dejounte McCollum.

[00:23] Team_001 possession (Score: 17-22)
FOUL! Holding foul on Joel Banchero. [IN THE BONUS! 6 team fouls] Dirk Young to the line for 2 free throws. (Joel Banchero: 2 personal fouls)   FT 1/2: GOOD   FT 2/2: GOOD Dirk Young makes 2/2 from the line.
Score: 19-22

[00:08] Team_050 possession (Score: 19-22)
Donovan Trent attempts a Layup. Contested by Miles Griffin (4.4 feet, MAN). Donovan Trent misses. Rebound secured by Miles Griffin.

================================================================================
                              1ST QUARTER COMPLETE                              
================================================================================

1ST QUARTER SCORE: Team_001 19, Team_050 22

BOX SCORE:
================================================================================

Team_001
--------------------------------------------------------------------------------
Player                MIN  PTS  REB  AST  TO      FG   FG%      3P   3P%
--------------------------------------------------------------------------------
Klay Harden            12    5    0    1   0   2/4    50.0     0/0   0.0
Miles Griffin          12    5    5    1   0   2/3    66.7     0/0   0.0
Dirk Young             12    5    0    1   0   2/4    50.0     0/0   0.0
Cole Ball              12    2    4    0   0   1/5    20.0     0/0   0.0
Dejounte McCollum      12    0    2    1   0   0/1     0.0     0/0   0.0

TEAM: FG: 7/17 (41.2%), 3PT: 3/5 (60.0%), REB: 11 (3 off, 8 def), AST: 4, TO: 3
TEAM FOULS: 7 [Team_050 in BONUS]


Team_050
--------------------------------------------------------------------------------
Player                MIN  PTS  REB  AST  TO      FG   FG%      3P   3P%
--------------------------------------------------------------------------------
Joel Banchero          12    8    2    1   0   4/5    80.0     0/0   0.0
Collin Bane            12    3    4    1   0   1/2    50.0     0/0   0.0
LeBron Bridges         12    3    8    2   0   1/5    20.0     0/0   0.0
Giannis LaVine         12    3    0    0   0   1/1   100.0     0/0   0.0
Donovan Trent          12    3    0    0   0   1/3    33.3     0/0   0.0

TEAM: FG: 8/16 (50.0%), 3PT: 3/8 (37.5%), REB: 14 (4 off, 10 def), AST: 4, TO: 4
TEAM FOULS: 6 [Team_001 in BONUS]

================================================================================

================================================================================
                       2ND QUARTER - Team_001 vs Team_050                       
================================================================================

[12:00] Team_001 possession (Score: 19-22)
Miles Griffin drives, Donovan Trent stays with him. Miles Griffin attempts a Dunk. Contested by Donovan Trent (5.6 feet, MAN). MILES GRIFFIN MAKES IT! Assist: Dirk Young
Score: 21-22

[11:47] Team_050 possession (Score: 21-22)
Donovan Trent attempts a Layup. Contested by Miles Griffin (4.2 feet, ZONE). Donovan Trent misses. Rebound secured by Dejounte McCollum.

[11:28] Team_001 possession (Score: 21-22)
Dejounte McCollum attempts a 3Pt. Contested by LeBron Bridges (4.6 feet, MAN). Dejounte McCollum misses. Rebound secured by Collin Bane.

[11:14] Team_050 possession (Score: 21-22)
Collin Bane attempts a 3Pt. Contested by Klay Harden (4.5 feet, ZONE). Collin Bane misses. Rebound secured by Cole Ball.

[10:57] Team_001 possession (Score: 21-22)
Miles Griffin drives, picks up Donovan Trent. Help arrives from Joel Banchero! Miles Griffin attempts a Dunk. Contested by Joel Banchero (5.7 feet, ZONE). MILES GRIFFIN MAKES IT! Assist: Dirk Young
Score: 23-22

[10:42] Team_050 possession (Score: 23-22)
Joel Banchero attempts a Midrange. Contested by Klay Harden (4.3 feet, ZONE). Joel Banchero misses. Offensive rebound by Collin Bane! Collin Bane kicks it out.

[10:30] Team_050 possession (Score: 23-22)
Collin Bane attempts a Layup. Contested by Cole Ball (3.7 feet, MAN). Collin Bane misses. Rebound secured by Dejounte McCollum.

[10:16] Team_001 possession (Score: 23-22)
Klay Harden drives, picks up Giannis LaVine. Help arrives from Collin Bane! Klay Harden attempts a Layup. Contested by Collin Bane (4.3 feet, MAN). KLAY HARDEN MAKES IT!
Score: 25-22

[10:01] Team_050 possession (Score: 25-22)
LeBron Bridges drives, picks up Miles Griffin. Help arrives from Klay Harden! LeBron Bridges attempts a Layup. Contested by Klay Harden (4.8 feet, ZONE). LeBron Bridges misses. Rebound secured by Dejounte McCollum.

[09:42] Team_001 possession (Score: 25-22)
Miles Griffin drives and kicks out. Klay Harden attempts a Midrange. Contested by Giannis LaVine (4.5 feet, MAN). Klay Harden misses. FOUL! Loose ball foul on Collin Bane during the rebound battle. [Team fouls: 1] No free throws, side out. (Collin Bane: 1 personal fouls)

[09:31] Team_001 possession (Score: 25-22)
Cole Ball makes the Layup and draws the foul on Collin Bane! And-1! Cole Ball to the line for 1. [Team fouls: 2] (Collin Bane: 2 personal fouls)   FT 1/1: GOOD Cole Ball makes 1/1 from the line.
Score: 28-22

[09:18] Team_050 possession (Score: 28-22)
Collin Bane attempts a 3Pt. Contested by Cole Ball (3.8 feet, MAN). Collin Bane misses. Rebound secured by Dejounte McCollum.

[08:59] Team_001 possession (Score: 28-22)
Dejounte McCollum attempts a Midrange. Contested by Collin Bane (4.6 feet, ZONE). Dejounte McCollum misses. Rebound secured by Joel Banchero.

[08:41] Team_050 possession (Score: 28-22)
Giannis LaVine throws a bad pass! Stolen by Klay Harden! TURNOVER! (live ball)

[08:28] Team_001 possession (Score: 28-22)
Miles Griffin drives and kicks out. Dejounte McCollum attempts a 3Pt. Contested by LeBron Bridges (5.2 feet, MAN). Dejounte McCollum misses. Rebound secured by Joel Banchero.

[08:13] Team_050 possession (Score: 28-22)
FOUL! Offensive foul on Donovan Trent! Miles Griffin drew the charge! [Team fouls: 3] (Donovan Trent: 1 personal fouls) TURNOVER! (dead ball)

[08:00] Team_001 possession (Score: 28-22)
Miles Griffin drives, Donovan Trent stays with him. Miles Griffin attempts a Dunk. Wide open! Donovan Trent is 6.0 feet away. [ZONE] MILES GRIFFIN MAKES IT! Assist: Dirk Young
Score: 30-22

[07:42] Team_050 possession (Score: 30-22)
Donovan Trent drives, Miles Griffin stays with him. Donovan Trent attempts a Dunk. Contested by Miles Griffin (4.8 feet, MAN). DONOVAN TRENT MAKES IT! Assist: LeBron Bridges
Score: 30-24

[07:32] Team_001 possession (Score: 30-24)
Miles Griffin drives and kicks out. Dejounte McCollum makes the Midrange and draws the foul on Collin Bane! And-1! Dejounte McCollum to the line for 1. [Team fouls: 4] (Collin Bane: 3 personal fouls)   FT 1/1: GOOD Dejounte McCollum makes 1/1 from the line.
Score: 33-24

[07:19] Team_050 possession (Score: 33-24)
FOUL! Holding foul on Dejounte McCollum. [Team fouls: 1] No free throws, side out. (Dejounte McCollum: 1 personal fouls)

[07:02] Team_050 possession (Score: 33-24)
Giannis LaVine throws a bad pass out of bounds! TURNOVER! (dead ball)

[07:02] Substitution (Team_001): Klay Harden OUT → Ja Dosunmu IN (stamina_rule2)

[07:02] Substitution (Team_001): Dirk Young OUT → Rudy George IN (stamina_rule2)

[07:02] Substitution (Team_001): Cole Ball OUT → Larry Trent IN (stamina_rule2)

[07:02] Substitution (Team_001): Dejounte McCollum OUT → Franz Bryant IN (stamina_rule2)

[07:02] Substitution (Team_001): Miles Griffin OUT → Kristaps Ming IN (stamina_rule2)

[07:02] Substitution (Team_050): Giannis LaVine OUT → Damian O'Neal IN (stamina_rule2)

[07:02] Substitution (Team_050): Joel Banchero OUT → Dwyane Towns IN (stamina_rule2)

[07:02] Substitution (Team_050): Collin Bane OUT → Larry Curry IN (stamina_rule2)

[07:02] Substitution (Team_050): LeBron Bridges OUT → Luka Gasol IN (stamina_rule2)

[07:02] Substitution (Team_050): Donovan Trent OUT → Tyler Smith IN (stamina_rule2)

[06:44] Team_001 possession (Score: 33-24)
Ja Dosunmu drives, picks up Damian O'Neal. Help arrives from Dwyane Towns! Ja Dosunmu attempts a Dunk. Wide open! Dwyane Towns is 6.6 feet away. [MAN] JA DOSUNMU MAKES IT! Assist: Franz Bryant
Score: 35-24

[06:27] Team_050 possession (Score: 35-24)
FOUL! Offensive foul on Luka Gasol! Franz Bryant drew the charge! [Team fouls: 5] (Luka Gasol: 1 personal fouls) TURNOVER! (dead ball)

[06:12] Team_001 possession (Score: 35-24)
Ja Dosunmu attempts a 3Pt. Contested by Luka Gasol (5.2 feet, ZONE). Ja Dosunmu misses. Rebound secured by Larry Curry.

[05:58] Team_050 possession (Score: 35-24)
Tyler Smith makes the Layup and draws the foul on Kristaps Ming! And-1! Tyler Smith to the line for 1. [Team fouls: 2] (Kristaps Ming: 1 personal fouls)   FT 1/1: GOOD Tyler Smith makes 1/1 from the line.
Score: 35-27

[05:47] Team_001 possession (Score: 35-27)
Ja Dosunmu attempts a Layup. Contested by Tyler Smith (5.5 feet, ZONE). JA DOSUNMU MAKES IT!
Score: 37-27

[05:38] Team_050 possession (Score: 37-27)
Luka Gasol drives and kicks out. Damian O'Neal attempts a 3Pt. Contested by Ja Dosunmu (4.0 feet, MAN). Damian O'Neal misses. Rebound secured by Larry Trent.

[05:27] Team_001 possession (Score: 37-27)
Kristaps Ming attempts a Layup. BLOCKED BY TYLER SMITH! Ball is loose! Offensive rebound by Rudy George! Rudy George kicks it out.

[05:11] Team_001 possession (Score: 37-27)
Rudy George attempts a 3Pt. Contested by Luka Gasol (5.0 feet, ZONE). RUDY GEORGE MAKES IT! Assist: Ja Dosunmu
Score: 40-27

[04:58] Team_050 possession (Score: 40-27)
Larry Curry attempts a 3Pt. Contested by Larry Trent (4.3 feet, MAN). Larry Curry misses. Rebound secured by Kristaps Ming.

[04:44] Team_001 possession (Score: 40-27)
Larry Trent attempts a 3Pt. Contested by Luka Gasol (5.4 feet, ZONE). Larry Trent misses. Rebound secured by Dwyane Towns.

[04:27] Team_050 possession (Score: 40-27)
Larry Curry attempts a Midrange. Contested by Larry Trent (4.3 feet, MAN). LARRY CURRY MAKES IT!
Score: 40-29

[04:10] Team_001 possession (Score: 40-29)
Kristaps Ming attempts a Layup. Contested by Tyler Smith (5.3 feet, ZONE). Kristaps Ming misses. Rebound secured by Tyler Smith.

[03:53] Team_050 possession (Score: 40-29)
Damian O'Neal drives, Ja Dosunmu stays with him. Damian O'Neal attempts a Dunk. Contested by Ja Dosunmu (4.1 feet, MAN). DAMIAN O'NEAL MAKES IT!
Score: 40-31

[03:40] Team_001 possession (Score: 40-31)
Franz Bryant attempts a 3Pt. Contested by Luka Gasol (5.1 feet, ZONE). FRANZ BRYANT MAKES IT! Assist: Rudy George
Score: 43-31

[03:29] Team_050 possession (Score: 43-31)
Larry Curry throws a bad pass out of bounds! TURNOVER! (dead ball)

[03:17] Team_001 possession (Score: 43-31)
Larry Trent attempts a Layup. BLOCKED BY TYLER SMITH! Ball is loose! Rebound secured by Dwyane Towns.

[03:01] Team_050 possession (Score: 43-31)
Tyler Smith attempts a Layup. Contested by Kristaps Ming (5.8 feet, MAN). TYLER SMITH MAKES IT!
Score: 43-33

[02:52] Team_001 possession (Score: 43-33)
Larry Trent attempts a 3Pt. Contested by Luka Gasol (5.4 feet, ZONE). Larry Trent misses. FOUL! Loose ball foul on Dwyane Towns during the rebound battle. [IN THE BONUS! 6 team fouls] Rudy George to the line for 2 free throws. (Dwyane Towns: 1 personal fouls)   FT 1/2: GOOD   FT 2/2: GOOD Rudy George makes 2/2 from the line.
Score: 45-33

[02:34] Team_050 possession (Score: 45-33)
Larry Curry attempts a Midrange. Contested by Larry Trent (4.3 feet, MAN). Larry Curry misses. Rebound secured by Rudy George.

[02:18] Team_001 possession (Score: 45-33)
Kristaps Ming drives and kicks out. Rudy George attempts a Midrange. Contested by Dwyane Towns (4.3 feet, ZONE). RUDY GEORGE MAKES IT! Assist: Kristaps Ming
Score: 47-33

[02:04] Team_050 possession (Score: 47-33)
Tyler Smith drives, Franz Bryant stays with him. Tyler Smith attempts a Layup. Contested by Franz Bryant (4.5 feet, ZONE). TYLER SMITH MAKES IT! Assist: Damian O'Neal
Score: 47-35

[01:52] Team_001 possession (Score: 47-35)
Franz Bryant attempts a 3Pt. Contested by Luka Gasol (5.1 feet, MAN). Franz Bryant misses. Offensive rebound by Rudy George! Rudy George kicks it out.

[01:41] Team_001 possession (Score: 47-35)
Rudy George attempts a 3Pt. Contested by Luka Gasol (5.0 feet, ZONE). Rudy George misses. Rebound secured by Tyler Smith.

[01:30] Team_050 possession (Score: 47-35)
Tyler Smith attempts a Midrange. Contested by Kristaps Ming (5.8 feet, MAN). Tyler Smith misses. Offensive rebound by Tyler Smith! Tyler Smith kicks it out.

[01:19] Team_050 possession (Score: 47-35)
Tyler Smith attempts a 3Pt. Contested by Ja Dosunmu (4.4 feet, ZONE). Tyler Smith misses. Rebound secured by Larry Trent.

[01:02] Team_001 possession (Score: 47-35)
Franz Bryant attempts a 3Pt. Contested by Luka Gasol (5.1 feet, MAN). Franz Bryant misses. Rebound secured by Larry Curry.

[00:45] Team_050 possession (Score: 47-35)
FOUL! Holding foul on Rudy George. [Team fouls: 3] No free throws, side out. (Rudy George: 1 personal fouls)

[00:27] Team_050 possession (Score: 47-35)
Damian O'Neal attempts a 3Pt. Contested by Ja Dosunmu (4.1 feet, ZONE). Damian O'Neal misses. Offensive rebound by Larry Curry! Larry Curry kicks it out.

[00:14] Team_050 possession (Score: 47-35)
FOUL! Shooting foul on Larry Trent. Larry Curry to the line for 2 free throws. [Team fouls: 4] (Larry Trent: 1 personal fouls)   FT 1/2: GOOD   FT 2/2: GOOD Larry Curry makes 2/2 from the line.
Score: 47-37

================================================================================
                              2ND QUARTER COMPLETE                              
================================================================================

2ND QUARTER SCORE: Team_001 28, Team_050 15

BOX SCORE:
================================================================================

Team_001
--------------------------------------------------------------------------------
Player                MIN  PTS  REB  AST  TO      FG   FG%      3P   3P%
--------------------------------------------------------------------------------
Rudy George             7    7    3    1   0   3/4    75.0     0/0   0.0
Miles Griffin          17    6    1    0   0   3/4    75.0     0/0   0.0
Ja Dosunmu              7    4    0    1   0   2/3    66.7     0/0   0.0
Dejounte McCollum      17    3    4    0   0   1/3    33.3     0/0   0.0
Cole Ball              17    3    1    0   0   1/1   100.0     0/0   0.0
Franz Bryant            7    3    0    1   0   1/2    50.0     0/0   0.0
Klay Harden            17    2    0    0   0   1/1   100.0     0/0   0.0
Dirk Young             17    0    0    3   0   0/0     0.0     0/0   0.0
Larry Trent             7    0    2    0   0   0/2     0.0     0/0   0.0
Kristaps Ming           7    0    1    1   0   0/1     0.0     0/0   0.0

TEAM: FG: 12/21 (57.1%), 3PT: 3/8 (37.5%), REB: 12 (3 off, 9 def), AST: 7, TO: 0
TEAM FOULS: 4


Team_050
--------------------------------------------------------------------------------
Player                MIN  PTS  REB  AST  TO      FG   FG%      3P   3P%
--------------------------------------------------------------------------------
Tyler Smith             7    7    3    0   0   3/4    75.0     0/0   0.0
Larry Curry             7    4    3    0   0   2/4    50.0     0/0   0.0
Donovan Trent          17    2    0    0   0   1/2    50.0     0/0   0.0
Damian O'Neal           7    2    0    1   0   1/1   100.0     0/0   0.0
Collin Bane            17    0    2    0   0   0/3     0.0     0/0   0.0
LeBron Bridges         17    0    0    1   0   0/1     0.0     0/0   0.0
Joel Banchero          17    0    2    0   0   0/0     0.0     0/0   0.0
Luka Gasol              7    0    0    0   0   0/1     0.0     0/0   0.0
Dwyane Towns            7    0    2    0   0   0/0     0.0     0/0   0.0

TEAM: FG: 7/16 (43.8%), 3PT: 0/4 (0.0%), REB: 12 (3 off, 9 def), AST: 2, TO: 5
TEAM FOULS: 6 [Team_001 in BONUS]

================================================================================

================================================================================
                       3RD QUARTER - Team_001 vs Team_050                       
================================================================================

[12:00] Team_001 possession (Score: 47-37)
Klay Harden drives to the basket... Klay Harden loses the ball! Stripped by Giannis LaVine! TURNOVER! (live ball)

[11:47] Team_050 possession (Score: 47-37)
Collin Bane drives to the basket... FOUL! Offensive foul on Collin Bane! Cole Ball drew the charge! [Team fouls: 1] (Collin Bane: 1 personal fouls) TURNOVER! (dead ball)

[11:30] Team_001 possession (Score: 47-37)
Dejounte McCollum makes the Dunk and draws the foul on LeBron Bridges! And-1! Dejounte McCollum to the line for 1. [Team fouls: 2] (LeBron Bridges: 1 personal fouls)   FT 1/1: GOOD Dejounte McCollum makes 1/1 from the line.
Score: 50-37

[11:19] Team_050 possession (Score: 50-37)
FOUL! Shooting foul on Klay Harden. LeBron Bridges to the line for 2 free throws. [Team fouls: 1] (Klay Harden: 1 personal fouls)   FT 1/2: GOOD   FT 2/2: GOOD LeBron Bridges makes 2/2 from the line.
Score: 50-39

[11:08] Team_001 possession (Score: 50-39)
Klay Harden attempts a 3Pt. Contested by Giannis LaVine (3.8 feet, MAN). Klay Harden misses. Offensive rebound by Cole Ball! Cole Ball kicks it out.

[10:51] Team_001 possession (Score: 50-39)
Klay Harden attempts a 3Pt. Contested by Giannis LaVine (3.8 feet, MAN). Klay Harden misses. Rebound secured by Collin Bane.

[10:38] Team_050 possession (Score: 50-39)
FOUL! Shooting foul on Dejounte McCollum. LeBron Bridges to the line for 2 free throws. [Team fouls: 2] (Dejounte McCollum: 1 personal fouls)   FT 1/2: GOOD   FT 2/2: GOOD LeBron Bridges makes 2/2 from the line.
Score: 50-41

[10:27] Team_001 possession (Score: 50-41)
Klay Harden drives, LeBron Bridges stays with him. Klay Harden attempts a Layup. Contested by LeBron Bridges (4.1 feet, ZONE). Klay Harden misses. Offensive rebound by Miles Griffin! Miles Griffin kicks it out.

[10:16] Team_001 possession (Score: 50-41)
Miles Griffin attempts a Midrange. Contested by Donovan Trent (5.3 feet, MAN). MILES GRIFFIN MAKES IT! Assist: Dirk Young
Score: 52-41

[10:05] Team_050 possession (Score: 52-41)
Donovan Trent drives and kicks out. LeBron Bridges attempts a 3Pt. Contested by Klay Harden (3.9 feet, ZONE). LeBron Bridges misses. Rebound secured by Dejounte McCollum.

[09:51] Team_001 possession (Score: 52-41)
Dejounte McCollum attempts a Layup. Contested by Donovan Trent (4.7 feet, ZONE). Dejounte McCollum misses. Rebound secured by Collin Bane.

[09:33] Team_050 possession (Score: 52-41)
Collin Bane attempts a 3Pt. Contested by Cole Ball (3.3 feet, MAN). COLLIN BANE MAKES IT!
Score: 52-44

[09:18] Team_001 possession (Score: 52-44)
Cole Ball makes the Midrange and draws the foul on Collin Bane! And-1! Cole Ball to the line for 1. [Team fouls: 3] (Collin Bane: 2 personal fouls)   FT 1/1: GOOD Cole Ball makes 1/1 from the line.
Score: 55-44

[09:05] Team_050 possession (Score: 55-44)
Joel Banchero makes the Midrange and draws the foul on Miles Griffin! And-1! Joel Banchero to the line for 1. [Team fouls: 3] (Miles Griffin: 1 personal fouls)   FT 1/1: GOOD Joel Banchero makes 1/1 from the line.
Score: 55-47

[08:51] Team_001 possession (Score: 55-47)
Dejounte McCollum attempts a 3Pt. Contested by Giannis LaVine (3.8 feet, ZONE). DEJOUNTE MCCOLLUM MAKES IT! Assist: Klay Harden
Score: 58-47

[08:37] Team_050 possession (Score: 58-47)
Joel Banchero drives and kicks out. LeBron Bridges attempts a 3Pt. Contested by Dejounte McCollum (3.7 feet, MAN). LeBron Bridges misses. Rebound secured by Cole Ball.

[08:21] Team_001 possession (Score: 58-47)
Klay Harden attempts a 3Pt. Contested by Giannis LaVine (3.8 feet, ZONE). Klay Harden misses. Rebound secured by Joel Banchero.

[08:07] Team_050 possession (Score: 58-47)
Collin Bane attempts a Layup. BLOCKED BY KLAY HARDEN! Ball is loose! Rebound secured by Dejounte McCollum.

[07:56] Team_001 possession (Score: 58-47)
Cole Ball attempts a Midrange. Contested by Collin Bane (3.9 feet, MAN). Cole Ball misses. Rebound secured by LeBron Bridges.

[07:41] Team_050 possession (Score: 58-47)
Joel Banchero throws a bad pass out of bounds! TURNOVER! (dead ball)

[07:27] Team_001 possession (Score: 58-47)
Miles Griffin attempts a Midrange. Contested by Donovan Trent (5.3 feet, MAN). Miles Griffin misses. Offensive rebound by Cole Ball! Cole Ball kicks it out.

[07:11] Team_001 possession (Score: 58-47)
Klay Harden attempts a 3Pt. Contested by Giannis LaVine (3.8 feet, ZONE). KLAY HARDEN MAKES IT! Assist: Miles Griffin
Score: 61-47

[06:57] Team_050 possession (Score: 61-47)
Giannis LaVine attempts a 3Pt. Contested by Klay Harden (4.3 feet, MAN). Giannis LaVine misses. Offensive rebound by LeBron Bridges! LeBron Bridges kicks it out.

[06:44] Team_050 possession (Score: 61-47)
Giannis LaVine drives to the basket... Giannis LaVine throws a bad pass! Stolen by Klay Harden! TURNOVER! (live ball)

[06:31] Team_001 possession (Score: 61-47)
Klay Harden attempts a Layup. Contested by Donovan Trent (4.7 feet, ZONE). KLAY HARDEN MAKES IT! Assist: Dejounte McCollum
Score: 63-47

[06:20] Team_050 possession (Score: 63-47)
Collin Bane attempts a 3Pt. Contested by Cole Ball (3.3 feet, MAN). Collin Bane misses. Rebound secured by Cole Ball.

[06:04] Team_001 possession (Score: 63-47)
Cole Ball attempts a Layup. Contested by Collin Bane (3.9 feet, MAN). COLE BALL MAKES IT!
Score: 65-47

[05:52] Team_050 possession (Score: 65-47)
Donovan Trent drives and kicks out. Giannis LaVine attempts a Midrange. Contested by Dejounte McCollum (3.7 feet, ZONE). Giannis LaVine misses. Rebound secured by Dejounte McCollum.

[05:39] Team_001 possession (Score: 65-47)
Miles Griffin drives to the basket... FOUL! Offensive foul on Miles Griffin! Donovan Trent drew the charge! [Team fouls: 4] (Miles Griffin: 2 personal fouls) TURNOVER! (dead ball)

[05:29] Team_050 possession (Score: 65-47)
Collin Bane attempts a 3Pt. Contested by Klay Harden (4.1 feet, ZONE). Collin Bane misses. Rebound secured by Dejounte McCollum.

[05:15] Team_001 possession (Score: 65-47)
Klay Harden attempts a Layup. Contested by Giannis LaVine (3.8 feet, MAN). KLAY HARDEN MAKES IT!
Score: 67-47

[04:58] Team_050 possession (Score: 67-47)
LeBron Bridges attempts a Midrange. Contested by Dejounte McCollum (3.9 feet, MAN). LeBron Bridges misses. Rebound secured by Cole Ball.

[04:47] Team_001 possession (Score: 67-47)
Cole Ball throws a bad pass! Stolen by Collin Bane! TURNOVER! (live ball)

[04:29] Team_050 possession (Score: 67-47)
Collin Bane attempts a 3Pt. Contested by Cole Ball (3.3 feet, MAN). Collin Bane misses. Offensive rebound by LeBron Bridges! LeBron Bridges kicks it out.

[04:15] Team_050 possession (Score: 67-47)
Giannis LaVine attempts a 3Pt. Contested by Klay Harden (4.5 feet, ZONE). Giannis LaVine misses. Rebound secured by Cole Ball.

[03:56] Team_001 possession (Score: 67-47)
Miles Griffin attempts a Midrange. Contested by Collin Bane (4.6 feet, ZONE). Miles Griffin misses. Rebound secured by LeBron Bridges.

[03:42] Team_050 possession (Score: 67-47)
Collin Bane attempts a Layup. Contested by Cole Ball (3.4 feet, MAN). COLLIN BANE MAKES IT! Assist: LeBron Bridges
Score: 67-49

[03:29] Team_001 possession (Score: 67-49)
Miles Griffin throws a bad pass! Stolen by Donovan Trent! TURNOVER! (live ball)

[03:11] Team_050 possession (Score: 67-49)
LeBron Bridges drives and kicks out. Collin Bane attempts a 3Pt. Contested by Cole Ball (3.3 feet, MAN). Collin Bane misses. Offensive rebound by Collin Bane! Collin Bane kicks it out.

[02:59] Team_050 possession (Score: 67-49)
Donovan Trent attempts a Midrange. Contested by Dirk Young (3.6 feet, ZONE). Donovan Trent misses. Rebound secured by Dejounte McCollum.

[02:43] Team_001 possession (Score: 67-49)
Dejounte McCollum drives, picks up Donovan Trent. Help arrives from Joel Banchero! Dejounte McCollum attempts a Dunk. Contested by Joel Banchero (5.0 feet, ZONE). DEJOUNTE MCCOLLUM MAKES IT!
Score: 69-49

[02:25] Team_050 possession (Score: 69-49)
Giannis LaVine drives, Miles Griffin stays with him. Giannis LaVine attempts a Layup. Contested by Miles Griffin (4.8 feet, ZONE). Giannis LaVine misses. Offensive rebound by LeBron Bridges! LeBron Bridges kicks it out.

[02:11] Team_050 possession (Score: 69-49)
Collin Bane attempts a Midrange. Contested by Cole Ball (3.5 feet, MAN). Collin Bane misses. Rebound secured by Dejounte McCollum.

[01:53] Team_001 possession (Score: 69-49)
FOUL! Holding foul on Joel Banchero. [Team fouls: 4] No free throws, side out. (Joel Banchero: 1 personal fouls)

[01:37] Team_001 possession (Score: 69-49)
Cole Ball attempts a 3Pt. Contested by Giannis LaVine (4.0 feet, ZONE). COLE BALL MAKES IT! Assist: Miles Griffin
Score: 72-49

[01:19] Team_050 possession (Score: 72-49)
Donovan Trent attempts a 3Pt. Contested by Klay Harden (4.1 feet, ZONE). DONOVAN TRENT MAKES IT!
Score: 72-52

[01:08] Team_001 possession (Score: 72-52)
Dirk Young attempts a 3Pt. Contested by Joel Banchero (4.8 feet, MAN). DIRK YOUNG MAKES IT! Assist: Cole Ball
Score: 75-52

[00:53] Team_050 possession (Score: 75-52)
LeBron Bridges loses the ball! Stripped by Dejounte McCollum! TURNOVER! (live ball)

[00:38] Team_001 possession (Score: 75-52)
Cole Ball drives, picks up Collin Bane. Help arrives from Joel Banchero! Cole Ball attempts a Dunk. Contested by Joel Banchero (4.3 feet, MAN). COLE BALL MAKES IT! Assist: Klay Harden
Score: 77-52

[00:23] Team_050 possession (Score: 77-52)
FOUL! Reach-in foul on Miles Griffin during the drive. [IN THE BONUS! 5 team fouls] Giannis LaVine to the line for 2 free throws. (Miles Griffin: 3 personal fouls)   FT 1/2: GOOD   FT 2/2: MISS Giannis LaVine makes 1/2 from the line. Rebound secured by Miles Griffin.
Score: 77-53

[00:08] Team_001 possession (Score: 77-53)
Dejounte McCollum attempts a 3Pt. Contested by Giannis LaVine (4.3 feet, ZONE). Dejounte McCollum misses. Rebound secured by Joel Banchero.

================================================================================
                              3RD QUARTER COMPLETE                              
================================================================================

3RD QUARTER SCORE: Team_001 30, Team_050 16

BOX SCORE:
================================================================================

Team_001
--------------------------------------------------------------------------------
Player                MIN  PTS  REB  AST  TO      FG   FG%      3P   3P%
--------------------------------------------------------------------------------
Cole Ball              30   10    6    1   0   4/5    80.0     0/0   0.0
Dejounte McCollum      30    8    6    1   0   3/5    60.0     0/0   0.0
Klay Harden            30    7    0    2   0   3/5    60.0     0/0   0.0
Dirk Young             30    3    0    1   0   1/1   100.0     0/0   0.0
Miles Griffin          30    2    2    2   0   1/2    50.0     0/0   0.0

TEAM: FG: 12/18 (66.7%), 3PT: 4/7 (57.1%), REB: 14 (3 off, 11 def), AST: 7, TO: 4
TEAM FOULS: 5 [Team_050 in BONUS]


Team_050
--------------------------------------------------------------------------------
Player                MIN  PTS  REB  AST  TO      FG   FG%      3P   3P%
--------------------------------------------------------------------------------
Collin Bane            30    5    3    0   0   2/6    33.3     0/0   0.0
LeBron Bridges         30    4    5    1   0   2/3    66.7     0/0   0.0
Donovan Trent          30    3    0    0   0   1/4    25.0     0/0   0.0
Joel Banchero          30    3    2    0   0   1/2    50.0     0/0   0.0
Giannis LaVine         30    0    0    0   0   0/2     0.0     0/0   0.0

TEAM: FG: 6/17 (35.3%), 3PT: 2/5 (40.0%), REB: 10 (4 off, 6 def), AST: 1, TO: 4
TEAM FOULS: 4

================================================================================

================================================================================
                       4TH QUARTER - Team_001 vs Team_050                       
================================================================================

[12:00] Team_001 possession (Score: 77-53)
FOUL! Holding foul on Donovan Trent. [Team fouls: 1] No free throws, side out. (Donovan Trent: 1 personal fouls)

[11:48] Team_001 possession (Score: 77-53)
Dirk Young drives to the basket... Dirk Young throws a bad pass! Stolen by Donovan Trent! TURNOVER! (live ball)

[11:36] Team_050 possession (Score: 77-53)
Collin Bane attempts a 3Pt. Contested by Cole Ball (3.6 feet, MAN). COLLIN BANE MAKES IT!
Score: 77-56

[11:21] Team_001 possession (Score: 77-56)
Miles Griffin drives, Donovan Trent stays with him. Miles Griffin attempts a Layup. Contested by Donovan Trent (5.7 feet, MAN). Miles Griffin misses. Offensive rebound by Miles Griffin! Miles Griffin kicks it out.

[11:05] Team_001 possession (Score: 77-56)
Dejounte McCollum makes the Layup and draws the foul on Donovan Trent! And-1! Dejounte McCollum to the line for 1. [Team fouls: 2] (Donovan Trent: 2 personal fouls)   FT 1/1: GOOD Dejounte McCollum makes 1/1 from the line.
Score: 80-56

[10:50] Team_050 possession (Score: 80-56)
Giannis LaVine attempts a Layup. Contested by Miles Griffin (4.9 feet, ZONE). GIANNIS LAVINE MAKES IT!
Score: 80-58

[10:39] Team_001 possession (Score: 80-58)
Cole Ball makes the Layup and draws the foul on Donovan Trent! And-1! Cole Ball to the line for 1. [Team fouls: 3] (Donovan Trent: 3 personal fouls)   FT 1/1: GOOD Cole Ball makes 1/1 from the line.
Score: 83-58

[10:19] Team_050 possession (Score: 83-58)
LeBron Bridges drives and kicks out. Joel Banchero attempts a 3Pt. Contested by Klay Harden (4.5 feet, ZONE). Joel Banchero misses. Rebound secured by Cole Ball.

[10:08] Team_001 possession (Score: 83-58)
Klay Harden attempts a Layup. Contested by Giannis LaVine (4.3 feet, MAN). KLAY HARDEN MAKES IT! Assist: Dejounte McCollum
Score: 85-58

[09:51] Team_050 possession (Score: 85-58)
Joel Banchero drives, picks up Miles Griffin. Help arrives from Klay Harden! Joel Banchero attempts a Dunk. Contested by Klay Harden (4.5 feet, ZONE). JOEL BANCHERO MAKES IT! Assist: Collin Bane
Score: 85-60

[09:40] Team_001 possession (Score: 85-60)
Dejounte McCollum attempts a 3Pt. Contested by LeBron Bridges (4.9 feet, MAN). Dejounte McCollum misses. Rebound secured by LeBron Bridges.

[09:24] Team_050 possession (Score: 85-60)
FOUL! Holding foul on Dirk Young. [Team fouls: 1] No free throws, side out. (Dirk Young: 1 personal fouls)

[09:10] Team_050 possession (Score: 85-60)
LeBron Bridges attempts a Midrange. Contested by Dejounte McCollum (4.4 feet, MAN). LeBron Bridges misses. Rebound secured by Cole Ball.

[08:56] Team_001 possession (Score: 85-60)
Dirk Young drives, Joel Banchero stays with him. Dirk Young attempts a Dunk. Contested by Joel Banchero (5.1 feet, MAN). DIRK YOUNG MAKES IT! Assist: Klay Harden
Score: 87-60

[08:40] Team_050 possession (Score: 87-60)
Joel Banchero attempts a 3Pt. Contested by Dirk Young (4.2 feet, MAN). JOEL BANCHERO MAKES IT! Assist: Donovan Trent
Score: 87-63

[08:26] Team_001 possession (Score: 87-63)
Cole Ball loses control! Ball rolls out of bounds! TURNOVER! (dead ball)

[08:26] Substitution (Team_001): Klay Harden OUT → Ja Dosunmu IN (stamina_rule2)

[08:26] Substitution (Team_001): Dirk Young OUT → Rudy George IN (stamina_rule2)

[08:26] Substitution (Team_001): Cole Ball OUT → Larry Trent IN (stamina_rule2)

[08:26] Substitution (Team_001): Dejounte McCollum OUT → Franz Bryant IN (stamina_rule2)

[08:26] Substitution (Team_001): Miles Griffin OUT → Kristaps Ming IN (stamina_rule2)

[08:26] Substitution (Team_050): Giannis LaVine OUT → Damian O'Neal IN (stamina_rule2)

[08:26] Substitution (Team_050): Joel Banchero OUT → Dwyane Towns IN (stamina_rule2)

[08:26] Substitution (Team_050): Collin Bane OUT → Larry Curry IN (stamina_rule2)

[08:26] Substitution (Team_050): LeBron Bridges OUT → Luka Gasol IN (stamina_rule2)

[08:26] Substitution (Team_050): Donovan Trent OUT → Tyler Smith IN (stamina_rule2)

[08:17] Team_050 possession (Score: 87-63)
Luka Gasol attempts a Midrange. Contested by Franz Bryant (4.1 feet, MAN). Luka Gasol misses. Rebound secured by Rudy George.

[08:02] Team_001 possession (Score: 87-63)
Larry Trent attempts a 3Pt. Contested by Larry Curry (5.4 feet, ZONE). Larry Trent misses. Rebound secured by Dwyane Towns.

[07:51] Team_050 possession (Score: 87-63)
Luka Gasol throws a bad pass! Stolen by Franz Bryant! TURNOVER! (live ball)

[07:36] Team_001 possession (Score: 87-63)
Larry Trent attempts a 3Pt. Contested by Luka Gasol (5.4 feet, ZONE). Larry Trent misses. Offensive rebound by Rudy George! Rudy George kicks it out.

[07:21] Team_001 possession (Score: 87-63)
Franz Bryant drives to the basket... Franz Bryant throws a bad pass! Stolen by Luka Gasol! TURNOVER! (live ball)

[07:04] Team_050 possession (Score: 87-63)
Larry Curry attempts a Layup. Contested by Franz Bryant (4.2 feet, ZONE). LARRY CURRY MAKES IT! Assist: Damian O'Neal
Score: 87-65

[06:53] Team_001 possession (Score: 87-65)
Franz Bryant makes the Layup and draws the foul on Luka Gasol! And-1! Franz Bryant to the line for 1. [Team fouls: 4] (Luka Gasol: 1 personal fouls)   FT 1/1: GOOD Franz Bryant makes 1/1 from the line.
Score: 90-65

[06:38] Team_050 possession (Score: 90-65)
FOUL! Shooting foul on Kristaps Ming. Tyler Smith to the line for 2 free throws. [Team fouls: 2] (Kristaps Ming: 1 personal fouls)   FT 1/2: MISS   FT 2/2: MISS Tyler Smith makes 0/2 from the line. Rebound secured by Kristaps Ming.

[06:22] Team_001 possession (Score: 90-65)
Kristaps Ming drives to the basket... FOUL! Offensive foul on Kristaps Ming! Tyler Smith drew the charge! [Team fouls: 3] (Kristaps Ming: 2 personal fouls) TURNOVER! (dead ball)

[06:08] Team_050 possession (Score: 90-65)
Damian O'Neal attempts a 3Pt. Contested by Ja Dosunmu (4.1 feet, ZONE). Damian O'Neal misses. Rebound secured by Rudy George.

[05:52] Team_001 possession (Score: 90-65)
Rudy George drives, picks up Tyler Smith. Help arrives from Dwyane Towns! Rudy George attempts a Layup. Contested by Dwyane Towns (5.3 feet, ZONE). RUDY GEORGE MAKES IT! Assist: Ja Dosunmu
Score: 92-65

[05:37] Team_050 possession (Score: 92-65)
Tyler Smith drives, picks up Franz Bryant. Help arrives from Rudy George! Tyler Smith attempts a Layup. Contested by Rudy George (4.5 feet, ZONE). Tyler Smith misses. FOUL! Loose ball foul on Rudy George during the rebound battle. [Team fouls: 4] No free throws, side out. (Rudy George: 1 personal fouls)

[05:17] Team_050 possession (Score: 92-65)
Damian O'Neal attempts a Midrange. BLOCKED BY JA DOSUNMU! Ball is loose! Rebound secured by Kristaps Ming.

[05:02] Team_001 possession (Score: 92-65)
Larry Trent attempts a Midrange. Contested by Larry Curry (5.4 feet, MAN). Larry Trent misses. FOUL! Loose ball foul on Larry Curry during the rebound battle. [IN THE BONUS! 5 team fouls] Larry Trent to the line for 2 free throws. (Larry Curry: 1 personal fouls)   FT 1/2: GOOD   FT 2/2: GOOD Larry Trent makes 2/2 from the line.
Score: 94-65

[04:48] Team_050 possession (Score: 94-65)
FOUL! Shooting foul on Rudy George. Luka Gasol to the line for 2 free throws. [BONUS: 5 team fouls] (Rudy George: 2 personal fouls)   FT 1/2: GOOD   FT 2/2: GOOD Luka Gasol makes 2/2 from the line.
Score: 94-67

[04:38] Team_001 possession (Score: 94-67)
Rudy George attempts a 3Pt. Contested by Dwyane Towns (4.4 feet, MAN). Rudy George misses. Rebound secured by Dwyane Towns.

[04:26] Team_050 possession (Score: 94-67)
Dwyane Towns attempts a 3Pt. Contested by Rudy George (4.6 feet, ZONE). Dwyane Towns misses. Rebound secured by Kristaps Ming.

[04:11] Team_001 possession (Score: 94-67)
FOUL! Reach-in foul on Tyler Smith during the drive. [IN THE BONUS! 6 team fouls] Kristaps Ming to the line for 2 free throws. (Tyler Smith: 1 personal fouls)   FT 1/2: GOOD   FT 2/2: GOOD Kristaps Ming makes 2/2 from the line.
Score: 96-67

[03:53] Team_050 possession (Score: 96-67)
FOUL! Shooting foul on Kristaps Ming. Tyler Smith to the line for 2 free throws. [BONUS: 6 team fouls] (Kristaps Ming: 3 personal fouls)   FT 1/2: GOOD   FT 2/2: MISS Tyler Smith makes 1/2 from the line. Offensive rebound by Larry Curry! Larry Curry kicks it out.
Score: 96-68

[03:40] Team_050 possession (Score: 96-68)
Damian O'Neal attempts a Layup. Contested by Ja Dosunmu (4.1 feet, MAN). Damian O'Neal misses. Rebound secured by Rudy George.

[03:28] Team_001 possession (Score: 96-68)
FOUL! Reach-in foul on Luka Gasol during the drive. [IN THE BONUS! 7 team fouls] Franz Bryant to the line for 2 free throws. (Luka Gasol: 2 personal fouls)   FT 1/2: GOOD   FT 2/2: GOOD Franz Bryant makes 2/2 from the line.
Score: 98-68

[03:10] Team_050 possession (Score: 98-68)
Dwyane Towns attempts a Midrange. Contested by Franz Bryant (4.3 feet, ZONE). Dwyane Towns misses. Rebound secured by Kristaps Ming.

[02:58] Team_001 possession (Score: 98-68)
Larry Trent attempts a 3Pt. Contested by Larry Curry (5.4 feet, MAN). LARRY TRENT MAKES IT! Assist: Kristaps Ming
Score: 101-68

[02:44] Team_050 possession (Score: 101-68)
Damian O'Neal attempts a Layup. Contested by Ja Dosunmu (4.1 feet, MAN). DAMIAN O'NEAL MAKES IT!
Score: 101-70

[02:31] Team_001 possession (Score: 101-70)
Rudy George drives, Dwyane Towns stays with him. Rudy George attempts a Dunk. Contested by Dwyane Towns (4.4 feet, MAN). RUDY GEORGE MAKES IT! Assist: Larry Trent
Score: 103-70

[02:13] Team_050 possession (Score: 103-70)
Luka Gasol attempts a 3Pt. Contested by Franz Bryant (4.1 feet, MAN). Luka Gasol misses. Rebound secured by Kristaps Ming.

[01:57] Team_001 possession (Score: 103-70)
Kristaps Ming attempts a 3Pt. Contested by Luka Gasol (5.0 feet, ZONE). KRISTAPS MING MAKES IT! Assist: Franz Bryant
Score: 106-70

[01:46] Team_050 possession (Score: 106-70)
Damian O'Neal attempts a 3Pt. Contested by Larry Trent (4.3 feet, ZONE). DAMIAN O'NEAL MAKES IT! Assist: Dwyane Towns
Score: 106-73

[01:34] Team_001 possession (Score: 106-73)
Ja Dosunmu drives and kicks out. Rudy George attempts a 3Pt. Contested by Luka Gasol (5.0 feet, ZONE). RUDY GEORGE MAKES IT! Assist: Ja Dosunmu
Score: 109-73

[01:21] Team_050 possession (Score: 109-73)
FOUL! Reach-in foul on Franz Bryant during the drive. [IN THE BONUS! 7 team fouls] Luka Gasol to the line for 2 free throws. (Franz Bryant: 1 personal fouls)   FT 1/2: GOOD   FT 2/2: GOOD Luka Gasol makes 2/2 from the line.
Score: 109-75

[01:06] Team_001 possession (Score: 109-75)
Kristaps Ming attempts a Midrange. Contested by Tyler Smith (5.3 feet, MAN). Kristaps Ming misses. Rebound secured by Dwyane Towns.

[00:53] Team_050 possession (Score: 109-75)
FOUL! Holding foul on Kristaps Ming. [IN THE BONUS! 8 team fouls] Tyler Smith to the line for 2 free throws. (Kristaps Ming: 4 personal fouls)   FT 1/2: GOOD   FT 2/2: GOOD Tyler Smith makes 2/2 from the line.
Score: 109-77

[00:37] Team_001 possession (Score: 109-77)
Ja Dosunmu drives and kicks out. Kristaps Ming attempts a 3Pt. Contested by Luka Gasol (5.0 feet, ZONE). KRISTAPS MING MAKES IT! Assist: Larry Trent
Score: 112-77

[00:22] Team_050 possession (Score: 112-77)
Larry Curry attempts a Midrange. Contested by Rudy George (4.6 feet, ZONE). Larry Curry misses. Rebound secured by Larry Trent.

[00:05] Team_001 possession (Score: 112-77)
Kristaps Ming attempts a Layup. BLOCKED BY TYLER SMITH! Ball is loose! Rebound secured by Dwyane Towns.

================================================================================
                              4TH QUARTER COMPLETE                              
================================================================================

4TH QUARTER SCORE: Team_001 35, Team_050 24

BOX SCORE:
================================================================================

Team_001
--------------------------------------------------------------------------------
Player                MIN  PTS  REB  AST  TO      FG   FG%      3P   3P%
--------------------------------------------------------------------------------
Kristaps Ming          15    8    5    1   0   3/5    60.0     0/0   0.0
Rudy George            15    7    4    0   0   3/4    75.0     0/0   0.0
Larry Trent            15    5    1    2   0   2/3    66.7     0/0   0.0
Franz Bryant           15    5    0    1   0   2/2   100.0     0/0   0.0
Dejounte McCollum      33    3    0    1   0   1/2    50.0     0/0   0.0
Cole Ball              33    3    2    0   0   1/1   100.0     0/0   0.0
Klay Harden            33    2    0    1   0   1/1   100.0     0/0   0.0
Dirk Young             33    2    0    0   0   1/1   100.0     0/0   0.0
Miles Griffin          33    0    1    0   0   0/0     0.0     0/0   0.0
Ja Dosunmu             15    0    0    2   0   0/0     0.0     0/0   0.0

TEAM: FG: 14/19 (73.7%), 3PT: 2/5 (40.0%), REB: 13 (2 off, 11 def), AST: 8, TO: 4
TEAM FOULS: 8 [Team_050 in BONUS]


Team_050
--------------------------------------------------------------------------------
Player                MIN  PTS  REB  AST  TO      FG   FG%      3P   3P%
--------------------------------------------------------------------------------
Joel Banchero          33    5    0    0   0   2/2   100.0     0/0   0.0
Damian O'Neal          15    5    0    1   0   2/5    40.0     0/0   0.0
Luka Gasol             15    4    0    0   0   2/4    50.0     0/0   0.0
Collin Bane            33    3    0    1   0   1/1   100.0     0/0   0.0
Giannis LaVine         33    2    0    0   0   1/1   100.0     0/0   0.0
Larry Curry            15    2    1    0   0   1/2    50.0     0/0   0.0
Tyler Smith            15    2    1    0   0   1/2    50.0     0/0   0.0
LeBron Bridges         33    0    1    0   0   0/2     0.0     0/0   0.0
Donovan Trent          33    0    0    1   0   0/0     0.0     0/0   0.0
Dwyane Towns           15    0    4    1   0   0/2     0.0     0/0   0.0

TEAM: FG: 10/21 (47.6%), 3PT: 3/6 (50.0%), REB: 7 (2 off, 5 def), AST: 4, TO: 1
TEAM FOULS: 7 [Team_001 in BONUS]

================================================================================

================================================================================
                               FULL GAME COMPLETE                               
================================================================================

FINAL SCORE: Team_001 112, Team_050 77

SCORING BY QUARTER:
--------------------------------------------------------------------------------
Team                     Q1     Q2     Q3     Q4    FINAL
--------------------------------------------------------------------------------
Team_001                 19     28     30     35      112
Team_050                 22     15     16     24       77
--------------------------------------------------------------------------------

FULL GAME BOX SCORE:
================================================================================

Team_001
--------------------------------------------------------------------------------
Player                MIN  PTS  REB  AST  TO      FG   FG%      3P   3P%      FT STL BLK
--------------------------------------------------------------------------------
Klay Harden            33   16    0    4   1   7/11   63.6   2/4    50.0   0/0     2   1
Dirk Young             33   10    0    5   1   3/5    60.0   2/2   100.0   2/3     0   0
Cole Ball              33   18   13    1   4   7/12   58.3   1/3    33.3   3/3     1   0
Dejounte McCollum      33   14   12    3   2   4/10   40.0   1/4    25.0   3/3     1   1
Miles Griffin          33   13    9    3   1   7/10   70.0   1/1   100.0   2/2     1   0
Ja Dosunmu             15    4    0    3   0   4/5    80.0   0/1     0.0   0/0     0   1
Rudy George            15   14    7    1   1   3/5    60.0   1/3    33.3   2/2     0   0
Larry Trent            15    5    3    2   0   3/6    50.0   2/4    50.0   2/2     0   0
Franz Bryant           15    8    0    2   1   3/4    75.0   1/2    50.0   3/3     1   0
Kristaps Ming          15    8    6    2   0   3/6    50.0   1/1   100.0   2/2     0   0

TEAM: FG: 45/75 (60.0%), 3PT: 12/25 (48.0%), REB: 50 (11 off, 39 def), AST: 26, TO: 11


Team_050
--------------------------------------------------------------------------------
Player                MIN  PTS  REB  AST  TO      FG   FG%      3P   3P%      FT STL BLK
--------------------------------------------------------------------------------
Giannis LaVine         33    5    0    0   3   1/3    33.3   0/1     0.0   2/3     1   0
Joel Banchero          33   16    6    1   1   7/9    77.8   1/2    50.0   3/3     0   0
Collin Bane            33   11    9    2   3   4/12   33.3   3/8    37.5   0/0     1   0
LeBron Bridges         33    7   14    4   1   4/12   33.3   1/4    25.0   4/5     0   0
Donovan Trent          33    8    0    1   3   3/9    33.3   2/2   100.0   0/0     2   0
Damian O'Neal          15    7    0    2   0   3/6    50.0   1/2    50.0   0/0     0   0
Dwyane Towns           15    0    6    1   0   0/2     0.0   0/1     0.0   0/0     0   0
Larry Curry            15    6    4    0   1   3/6    50.0   0/1     0.0   2/2     0   0
Luka Gasol             15    4    0    0   2   2/5    40.0   0/1     0.0   4/4     1   0
Tyler Smith            15    9    4    0   0   3/5    60.0   0/1     0.0   4/7     0   3

TEAM: FG: 31/70 (44.3%), 3PT: 8/23 (34.8%), REB: 43 (13 off, 30 def), AST: 11, TO: 14

================================================================================
