GAME 2 - Timeout Validation
================================================================================

Final Score: Warriors 96, Lakers 74

Timeout Summary:
  Home Timeouts Used: 0/7
  Away Timeouts Used: 2/7
  Total Timeouts: 2
  Illegal Timeouts: 0

================================================================================
PLAY-BY-PLAY
================================================================================

================================================================================
                        1ST QUARTER - Warriors vs Lakers                        
================================================================================

[12:00] Warriors possession (Score: 0-0)
Warriors_3_SF loses control of the ball! TURNOVER!

[11:43] Lakers possession (Score: 0-0)
Lakers_3_SF attempts a 3Pt. Contested by Warriors_3_SF (5.2 feet, MAN). LAKERS_3_SF MAKES IT! Assist: Lakers_5_C
Score: 0-3

[11:27] Warriors possession (Score: 0-3)
Warriors_5_C attempts a Midrange. Contested by Lakers_5_C (5.8 feet, MAN). Warriors_5_C misses. Offensive rebound by Warriors_2_SG! Warriors_2_SG kicks it out.

[11:11] Warriors possession (Score: 0-3)
FOUL! Shooting foul on Lakers_3_SF. Warriors_3_SF to the line for 2 free throws. [Team fouls: 1] (Lakers_3_SF: 1 personal fouls)   FT 1/2: GOOD   FT 2/2: GOOD Warriors_3_SF makes 2/2 from the line.
Score: 2-3

[10:51] Lakers possession (Score: 2-3)
Lakers_2_SG attempts a Layup. Contested by Warriors_2_SG (5.4 feet, MAN). Lakers_2_SG misses. Offensive rebound by Lakers_3_SF! Lakers_3_SF kicks it out.

[10:32] Lakers possession (Score: 2-3)
Lakers_2_SG commits an offensive foul! Warriors_2_SG drew the charge! TURNOVER!

[10:11] Warriors possession (Score: 2-3)
Warriors_2_SG attempts a 3Pt. Contested by Lakers_2_SG (4.8 feet, MAN). WARRIORS_2_SG MAKES IT! Assist: Warriors_1_PG
Score: 5-3

[09:53] Lakers possession (Score: 5-3)
Lakers_1_PG attempts a 3Pt. Contested by Warriors_1_PG (5.6 feet, MAN). Lakers_1_PG misses. Offensive rebound by Lakers_3_SF! Lakers_3_SF kicks it out.

[09:38] Lakers possession (Score: 5-3)
Lakers_4_PF attempts a 3Pt. Contested by Warriors_4_PF (5.4 feet, MAN). Lakers_4_PF misses. Offensive rebound by Lakers_3_SF! Lakers_3_SF kicks it out.

[09:18] Lakers possession (Score: 5-3)
Lakers_1_PG attempts a 3Pt. Contested by Warriors_1_PG (5.6 feet, MAN). LAKERS_1_PG MAKES IT! Assist: Lakers_5_C
Score: 5-6

[08:57] Warriors possession (Score: 5-6)
FOUL! Shooting foul on Lakers_1_PG. Warriors_1_PG to the line for 3 free throws. [Team fouls: 2] (Lakers_1_PG: 1 personal fouls)   FT 1/3: GOOD   FT 2/3: GOOD   FT 3/3: GOOD Warriors_1_PG makes 3/3 from the line.
Score: 8-6

[08:41] Lakers possession (Score: 8-6)
Lakers_5_C drives and kicks out. Lakers_3_SF attempts a 3Pt. Contested by Warriors_3_SF (5.6 feet, MAN). Lakers_3_SF misses. Rebound secured by Warriors_3_SF.

[08:23] Warriors possession (Score: 8-6)
Warriors_1_PG attempts a 3Pt. Contested by Lakers_1_PG (4.4 feet, MAN). Warriors_1_PG misses. Offensive rebound by Warriors_4_PF! Warriors_4_PF kicks it out.

[08:03] Warriors possession (Score: 8-6)
Warriors_4_PF drives, Lakers_4_PF stays with him. Warriors_4_PF attempts a Dunk. Contested by Lakers_4_PF (4.9 feet, MAN). Warriors_4_PF misses. Rebound secured by Lakers_3_SF.

[07:47] Lakers possession (Score: 8-6)
FOUL! Shooting foul on Warriors_2_SG. Lakers_2_SG to the line for 2 free throws. [Team fouls: 3] (Warriors_2_SG: 1 personal fouls)   FT 1/2: MISS   FT 2/2: GOOD Lakers_2_SG makes 1/2 from the line.
Score: 8-7

[07:34] Warriors possession (Score: 8-7)
Warriors_8_SF attempts a Layup. Contested by Lakers_3_SF (4.4 feet, MAN). Warriors_8_SF misses. Rebound secured by Lakers_3_SF.

[07:34] Substitution (Warriors): Warriors_3_SF OUT (stamina: 53) → Warriors_9_PF IN (stamina)

[07:34] Substitution (Warriors): Warriors_4_PF OUT (stamina: 56) → Warriors_8_SF IN (stamina)

[07:34] Substitution (Warriors): Warriors_5_C OUT (stamina: 52) → Warriors_10_C IN (stamina)

[07:34] Substitution (Lakers): Lakers_2_SG OUT (stamina: 56) → Lakers_7_SG IN (stamina)

[07:34] Substitution (Lakers): Lakers_5_C OUT (stamina: 50) → Lakers_10_C IN (stamina)

[07:16] Lakers possession (Score: 8-7)
Lakers_1_PG throws a bad pass out of bounds! TURNOVER!

[07:01] Warriors possession (Score: 8-7)
FOUL! Reach-in foul on Lakers_3_SF during the drive. [Team fouls: 4] No free throws, side out. (Lakers_3_SF: 2 personal fouls)

[06:43] Lakers possession (Score: 8-7)
Lakers_1_PG attempts a 3Pt. Contested by Warriors_1_PG (5.9 feet, MAN). Lakers_1_PG misses. Rebound secured by Warriors_8_SF.

[06:25] Warriors possession (Score: 8-7)
Warriors_2_SG makes the 3Pt and draws the foul on Lakers_7_SG! And-1! Warriors_2_SG to the line for 1. [BONUS: 5 team fouls] (Lakers_7_SG: 1 personal fouls)   FT 1/1: GOOD Warriors_2_SG makes 1/1 from the line.
Score: 12-7

[06:10] Lakers possession (Score: 12-7)
FOUL! Shooting foul on Warriors_1_PG. Lakers_1_PG to the line for 3 free throws. [BONUS: 6 team fouls] (Warriors_1_PG: 1 personal fouls)   FT 1/3: MISS   FT 2/3: GOOD   FT 3/3: GOOD Lakers_1_PG makes 2/3 from the line.
Score: 12-9

[05:58] Warriors possession (Score: 12-9)
Warriors_10_C drives and kicks out. Warriors_10_C attempts a 3Pt. Wide open! Lakers_10_C is 6.3 feet away. [MAN] WARRIORS_10_C MAKES IT! Assist: Warriors_2_SG
Score: 15-9

[05:39] Lakers possession (Score: 15-9)
Lakers_4_PF attempts a 3Pt. Contested by Warriors_9_PF (4.2 feet, MAN). Lakers_4_PF misses. Rebound secured by Warriors_9_PF.

[05:25] Warriors possession (Score: 15-9)
Warriors_1_PG attempts a 3Pt. Contested by Lakers_1_PG (4.7 feet, MAN). WARRIORS_1_PG MAKES IT! Assist: Warriors_2_SG
Score: 18-9

[05:11] Lakers possession (Score: 18-9)
Lakers_1_PG attempts a 3Pt. Contested by Warriors_1_PG (5.9 feet, MAN). LAKERS_1_PG MAKES IT! Assist: Lakers_7_SG
Score: 18-12

[05:11] TIMEOUT - Lakers (stop opponent momentum) - 6 timeouts remaining

[04:59] Warriors possession (Score: 18-12)
FOUL! Shooting foul on Lakers_4_PF. Warriors_9_PF to the line for 3 free throws. [BONUS: 7 team fouls] (Lakers_4_PF: 1 personal fouls)   FT 1/3: GOOD   FT 2/3: GOOD   FT 3/3: GOOD Warriors_9_PF makes 3/3 from the line.
Score: 21-12

[04:46] Lakers possession (Score: 21-12)
FOUL! Shooting foul on Warriors_8_SF. Lakers_3_SF to the line for 3 free throws. [BONUS: 8 team fouls] (Warriors_8_SF: 1 personal fouls)   FT 1/3: GOOD   FT 2/3: MISS   FT 3/3: GOOD Lakers_3_SF makes 2/3 from the line.
Score: 21-14

[04:23] Warriors possession (Score: 21-14)
Warriors_1_PG attempts a Layup. Contested by Lakers_1_PG (4.6 feet, MAN). Warriors_1_PG misses. Offensive rebound by Warriors_9_PF! Warriors_9_PF kicks it out.

[04:23] Substitution (Warriors): Warriors_2_SG OUT (stamina: 68) → Warriors_6_PG IN (minutes)

[04:23] Substitution (Lakers): Lakers_3_SF OUT (stamina: 65) → Lakers_8_SF IN (minutes)

[04:23] Substitution (Lakers): Lakers_4_PF OUT (stamina: 68) → Lakers_9_PF IN (minutes)

[04:07] Warriors possession (Score: 21-14)
Warriors_8_SF attempts a 3Pt. Contested by Lakers_8_SF (5.4 feet, MAN). Warriors_8_SF misses. Offensive rebound by Warriors_10_C! Warriors_10_C kicks it out.

[03:56] Warriors possession (Score: 21-14)
Warriors_1_PG drives, Lakers_1_PG stays with him. Warriors_1_PG attempts a Dunk. Contested by Lakers_1_PG (4.7 feet, MAN). WARRIORS_1_PG MAKES IT! Assist: Warriors_8_SF
Score: 23-14

[03:44] Lakers possession (Score: 23-14)
Lakers_1_PG throws a bad pass! Stolen by Warriors_1_PG! TURNOVER!

[03:21] Warriors possession (Score: 23-14)
Warriors_8_SF throws a bad pass out of bounds! TURNOVER!

[03:21] Substitution (Warriors): Warriors_1_PG OUT (stamina: 59) → Warriors_7_SG IN (stamina)

[03:21] Substitution (Lakers): Lakers_1_PG OUT (stamina: 66) → Lakers_6_PG IN (minutes)

[03:03] Lakers possession (Score: 23-14)
FOUL! Shooting foul on Warriors_10_C. Lakers_10_C to the line for 2 free throws. [BONUS: 9 team fouls] (Warriors_10_C: 1 personal fouls)   FT 1/2: GOOD   FT 2/2: GOOD Lakers_10_C makes 2/2 from the line.
Score: 23-16

[02:44] Warriors possession (Score: 23-16)
Warriors_9_PF drives, picks up Lakers_9_PF. Help arrives from Lakers_7_SG! Warriors_9_PF attempts a Dunk. Contested by Lakers_7_SG (4.7 feet, MAN). WARRIORS_9_PF MAKES IT!
Score: 25-16

[02:28] Lakers possession (Score: 25-16)
Lakers_10_C loses control of the ball! TURNOVER!

[02:10] Warriors possession (Score: 25-16)
FOUL! Shooting foul on Lakers_9_PF. Warriors_10_C to the line for 3 free throws. [BONUS: 10 team fouls] (Lakers_9_PF: 1 personal fouls)   FT 1/3: MISS   FT 2/3: GOOD   FT 3/3: GOOD Warriors_10_C makes 2/3 from the line.
Score: 27-16

[01:51] Lakers possession (Score: 27-16)
Lakers_5_C commits an offensive foul! Warriors_5_C drew the charge! TURNOVER!

[01:51] Substitution (Warriors): Warriors_10_C OUT (stamina: 68) → Warriors_5_C IN (minutes)

[01:51] Substitution (Lakers): Lakers_10_C OUT (stamina: 60) → Lakers_5_C IN (minutes)

[01:30] Warriors possession (Score: 27-16)
Warriors_9_PF attempts a Midrange. Contested by Lakers_9_PF (4.7 feet, MAN). WARRIORS_9_PF MAKES IT! Assist: Warriors_6_PG
Score: 29-16

[01:17] Lakers possession (Score: 29-16)
Lakers_6_PG attempts a 3Pt. Contested by Warriors_6_PG (5.4 feet, MAN). Lakers_6_PG misses. Rebound secured by Warriors_7_SG.

[00:54] Warriors possession (Score: 29-16)
Warriors_9_PF loses the ball! Stripped by Lakers_9_PF! TURNOVER!

[00:43] Lakers possession (Score: 29-16)
Lakers_9_PF makes the Layup and draws the foul on Warriors_9_PF! And-1! Lakers_9_PF to the line for 1. [BONUS: 11 team fouls] (Warriors_9_PF: 1 personal fouls)   FT 1/1: GOOD Lakers_9_PF makes 1/1 from the line.
Score: 29-19

[00:28] Warriors possession (Score: 29-19)
Warriors_5_C attempts a Layup. Contested by Lakers_5_C (5.5 feet, MAN). WARRIORS_5_C MAKES IT!
Score: 31-19

[00:11] Lakers possession (Score: 31-19)
Lakers_5_C loses the ball! Stripped by Warriors_5_C! TURNOVER!

================================================================================
                              1ST QUARTER COMPLETE                              
================================================================================

FINAL SCORE: Warriors 31, Lakers 19

BOX SCORE:
================================================================================

Warriors
--------------------------------------------------------------------------------
Player                MIN  PTS  REB  AST  TO      FG   FG%      3P   3P%
--------------------------------------------------------------------------------
Warriors_1_PG           0    5    0    1   0   2/2   100.0     0/0   0.0
Warriors_9_PF           0    4    2    0   0   2/2   100.0     0/0   0.0
Warriors_2_SG           0    3    1    2   0   1/1   100.0     0/0   0.0
Warriors_10_C           0    3    1    0   0   1/1   100.0     0/0   0.0
Warriors_5_C            0    2    0    0   0   1/1   100.0     0/0   0.0
Warriors_3_SF           0    0    1    0   0   0/0     0.0     0/0   0.0
Warriors_4_PF           0    0    1    0   0   0/0     0.0     0/0   0.0
Warriors_8_SF           0    0    1    1   0   0/0     0.0     0/0   0.0
Warriors_6_PG           0    0    0    1   0   0/0     0.0     0/0   0.0
Warriors_7_SG           0    0    1    0   0   0/0     0.0     0/0   0.0

TEAM: FG: 7/9 (77.8%), 3PT: 2/2 (100.0%), REB: 8 (4 off, 4 def), AST: 5, TO: 3
TEAM FOULS: 0


Lakers
--------------------------------------------------------------------------------
Player                MIN  PTS  REB  AST  TO      FG   FG%      3P   3P%
--------------------------------------------------------------------------------
Lakers_1_PG             0    6    0    0   0   2/2   100.0     0/0   0.0
Lakers_3_SF             0    3    5    0   0   1/1   100.0     0/0   0.0
Lakers_5_C              0    0    0    2   0   0/0     0.0     0/0   0.0
Lakers_7_SG             0    0    0    1   0   0/0     0.0     0/0   0.0

TEAM: FG: 3/7 (42.9%), 3PT: 3/6 (50.0%), REB: 5 (3 off, 2 def), AST: 3, TO: 6
TEAM FOULS: 11 [OPPONENT IN BONUS]

================================================================================

================================================================================
                        2ND QUARTER - Warriors vs Lakers                        
================================================================================

[12:00] Warriors possession (Score: 31-19)
FOUL! Shooting foul on Lakers_3_SF. Warriors_3_SF to the line for 2 free throws. [Team fouls: 1] (Lakers_3_SF: 1 personal fouls)   FT 1/2: GOOD   FT 2/2: GOOD Warriors_3_SF makes 2/2 from the line.
Score: 33-19

[11:37] Lakers possession (Score: 33-19)
Lakers_1_PG attempts a 3Pt. Contested by Warriors_1_PG (5.5 feet, MAN). LAKERS_1_PG MAKES IT! Assist: Lakers_3_SF
Score: 33-22

[11:20] Warriors possession (Score: 33-22)
Warriors_1_PG attempts a 3Pt. Contested by Lakers_1_PG (4.4 feet, MAN). Warriors_1_PG misses. Rebound secured by Lakers_1_PG.

[11:05] Lakers possession (Score: 33-22)
Lakers_2_SG makes the Midrange and draws the foul on Warriors_2_SG! And-1! Lakers_2_SG to the line for 1. [Team fouls: 2] (Warriors_2_SG: 1 personal fouls)   FT 1/1: GOOD Lakers_2_SG makes 1/1 from the line.
Score: 33-25

[10:53] Warriors possession (Score: 33-25)
Warriors_1_PG attempts a Midrange. Contested by Lakers_1_PG (4.4 feet, MAN). WARRIORS_1_PG MAKES IT! Assist: Warriors_4_PF
Score: 35-25

[10:34] Lakers possession (Score: 35-25)
Lakers_1_PG drives and kicks out. Lakers_1_PG attempts a Midrange. Contested by Warriors_1_PG (5.6 feet, MAN). Lakers_1_PG misses. Offensive rebound by Lakers_3_SF! Lakers_3_SF kicks it out.

[10:16] Lakers possession (Score: 35-25)
Lakers_4_PF drives, Warriors_4_PF stays with him. Lakers_4_PF attempts a Layup. Contested by Warriors_4_PF (5.4 feet, MAN). Lakers_4_PF misses. Offensive rebound by Lakers_3_SF! Lakers_3_SF kicks it out.

[09:55] Lakers possession (Score: 35-25)
Lakers_2_SG attempts a 3Pt. Contested by Warriors_2_SG (5.4 feet, MAN). LAKERS_2_SG MAKES IT!
Score: 35-28

[09:41] Warriors possession (Score: 35-28)
Warriors_3_SF attempts a 3Pt. Contested by Lakers_3_SF (4.2 feet, MAN). Warriors_3_SF misses. Offensive rebound by Warriors_2_SG! Warriors_2_SG kicks it out.

[09:23] Warriors possession (Score: 35-28)
Warriors_5_C drives, Lakers_5_C stays with him. Warriors_5_C attempts a Dunk. Wide open! Lakers_5_C is 6.0 feet away. [MAN] WARRIORS_5_C MAKES IT!
Score: 37-28

[09:09] Lakers possession (Score: 37-28)
FOUL! Shooting foul on Warriors_3_SF. Lakers_3_SF to the line for 2 free throws. [Team fouls: 3] (Warriors_3_SF: 1 personal fouls)   FT 1/2: MISS   FT 2/2: GOOD Lakers_3_SF makes 1/2 from the line.
Score: 37-29

[08:54] Warriors possession (Score: 37-29)
FOUL! Shooting foul on Lakers_4_PF. Warriors_9_PF to the line for 3 free throws. [Team fouls: 4] (Lakers_4_PF: 1 personal fouls)   FT 1/3: MISS   FT 2/3: MISS   FT 3/3: MISS Warriors_9_PF makes 0/3 from the line. Rebound secured by Lakers_1_PG.

[08:54] Substitution (Warriors): Warriors_3_SF OUT (stamina: 56) → Warriors_9_PF IN (stamina)

[08:54] Substitution (Warriors): Warriors_4_PF OUT (stamina: 59) → Warriors_8_SF IN (stamina)

[08:54] Substitution (Warriors): Warriors_5_C OUT (stamina: 55) → Warriors_10_C IN (stamina)

[08:54] Substitution (Lakers): Lakers_5_C OUT (stamina: 53) → Lakers_10_C IN (stamina)

[08:42] Lakers possession (Score: 37-29)
Lakers_1_PG attempts a 3Pt. Contested by Warriors_1_PG (5.7 feet, MAN). LAKERS_1_PG MAKES IT! Assist: Lakers_4_PF
Score: 37-32

[08:42] Substitution (Lakers): Lakers_2_SG OUT (stamina: 59) → Lakers_7_SG IN (stamina)

[08:26] Warriors possession (Score: 37-32)
Warriors_1_PG drives to the basket... Warriors_1_PG loses the ball! TURNOVER!

[08:13] Lakers possession (Score: 37-32)
Lakers_1_PG attempts a Midrange. Contested by Warriors_1_PG (5.8 feet, MAN). Lakers_1_PG misses. Rebound secured by Warriors_10_C.

[07:53] Warriors possession (Score: 37-32)
Warriors_1_PG attempts a 3Pt. Contested by Lakers_1_PG (4.5 feet, MAN). Warriors_1_PG misses. Rebound secured by Lakers_3_SF.

[07:35] Lakers possession (Score: 37-32)
Lakers_10_C drives to the basket... Lakers_10_C loses the ball! TURNOVER!

[07:19] Warriors possession (Score: 37-32)
Warriors_2_SG attempts a 3Pt. Contested by Lakers_7_SG (4.6 feet, MAN). Warriors_2_SG misses. Offensive rebound by Warriors_9_PF! Warriors_9_PF kicks it out.

[07:02] Warriors possession (Score: 37-32)
Warriors_10_C loses control of the ball! TURNOVER!

[06:41] Lakers possession (Score: 37-32)
Lakers_4_PF attempts a Midrange. Contested by Warriors_9_PF (4.2 feet, MAN). LAKERS_4_PF MAKES IT!
Score: 37-34

[06:25] Warriors possession (Score: 37-34)
Warriors_2_SG makes the 3Pt and draws the foul on Lakers_7_SG! And-1! Warriors_2_SG to the line for 1. [BONUS: 5 team fouls] (Lakers_7_SG: 1 personal fouls)   FT 1/1: GOOD Warriors_2_SG makes 1/1 from the line.
Score: 41-34

[06:04] Lakers possession (Score: 41-34)
Lakers_10_C attempts a 3Pt. Contested by Warriors_10_C (5.1 feet, MAN). Lakers_10_C misses. Offensive rebound by Lakers_1_PG! Lakers_1_PG kicks it out.

[05:53] Lakers possession (Score: 41-34)
Lakers_10_C attempts a Midrange. Contested by Warriors_10_C (5.1 feet, MAN). Lakers_10_C misses. Offensive rebound by Lakers_1_PG! Lakers_1_PG kicks it out.

[05:38] Lakers possession (Score: 41-34)
FOUL! Reach-in foul on Warriors_2_SG during the drive. [IN THE BONUS! 6 team fouls] Lakers_7_SG to the line for 2 free throws. (Warriors_2_SG: 2 personal fouls)   FT 1/2: MISS   FT 2/2: GOOD Lakers_7_SG makes 1/2 from the line.
Score: 41-35

[05:24] Warriors possession (Score: 41-35)
Warriors_8_SF attempts a Midrange. Contested by Lakers_3_SF (4.7 feet, MAN). WARRIORS_8_SF MAKES IT!
Score: 43-35

[05:24] Substitution (Lakers): Lakers_10_C OUT (stamina: 58) → Lakers_5_C IN (stamina)

[05:10] Lakers possession (Score: 43-35)
Lakers_7_SG drives to the basket... Lakers_7_SG loses the ball! TURNOVER!

[04:54] Warriors possession (Score: 43-35)
Warriors_10_C attempts a 3Pt. Contested by Lakers_5_C (5.7 feet, MAN). Warriors_10_C misses. Rebound secured by Lakers_1_PG.

[04:54] Substitution (Warriors): Warriors_1_PG OUT (stamina: 59) → Warriors_6_PG IN (stamina)

[04:54] Substitution (Lakers): Lakers_3_SF OUT (stamina: 60) → Lakers_8_SF IN (minutes)

[04:54] Substitution (Lakers): Lakers_4_PF OUT (stamina: 64) → Lakers_9_PF IN (minutes)

[04:37] Lakers possession (Score: 43-35)
Lakers_7_SG drives, picks up Warriors_2_SG. Help arrives from Warriors_9_PF! Lakers_7_SG attempts a Layup. Contested by Warriors_9_PF (5.8 feet, MAN). Lakers_7_SG misses. Offensive rebound by Lakers_9_PF! Lakers_9_PF kicks it out.

[04:17] Lakers possession (Score: 43-35)
Lakers_9_PF attempts a Midrange. Contested by Warriors_9_PF (4.3 feet, MAN). Lakers_9_PF misses. Offensive rebound by Lakers_7_SG! Lakers_7_SG kicks it out.

[03:58] Lakers possession (Score: 43-35)
Lakers_5_C drives, Warriors_10_C stays with him. Lakers_5_C attempts a Layup. Contested by Warriors_10_C (5.3 feet, MAN). Lakers_5_C misses. Rebound secured by Warriors_9_PF.

[03:42] Warriors possession (Score: 43-35)
Warriors_6_PG attempts a Midrange. Contested by Lakers_1_PG (4.9 feet, MAN). Warriors_6_PG misses. Rebound secured by Lakers_1_PG.

[03:25] Lakers possession (Score: 43-35)
Lakers_1_PG drives to the basket... Lakers_1_PG loses the ball! TURNOVER!

[03:10] Warriors possession (Score: 43-35)
Warriors_6_PG attempts a Midrange. Contested by Lakers_6_PG (4.9 feet, MAN). WARRIORS_6_PG MAKES IT! Assist: Warriors_8_SF
Score: 45-35

[03:10] Substitution (Warriors): Warriors_2_SG OUT (stamina: 59) → Warriors_7_SG IN (stamina)

[03:10] Substitution (Warriors): Warriors_10_C OUT (stamina: 61) → Warriors_5_C IN (minutes)

[03:10] Substitution (Lakers): Lakers_1_PG OUT (stamina: 60) → Lakers_6_PG IN (stamina)

[03:10] Substitution (Lakers): Lakers_5_C OUT (stamina: 58) → Lakers_10_C IN (stamina)

[02:56] Lakers possession (Score: 45-35)
Lakers_6_PG commits a violation (traveling/carry/out of bounds)! TURNOVER!

[02:43] Warriors possession (Score: 45-35)
Warriors_7_SG makes the Layup and draws the foul on Lakers_6_PG! And-1! Warriors_7_SG to the line for 1. [BONUS: 7 team fouls] (Lakers_6_PG: 1 personal fouls)   FT 1/1: GOOD Warriors_7_SG makes 1/1 from the line.
Score: 48-35

[02:24] Lakers possession (Score: 48-35)
Lakers_6_PG drives, Warriors_6_PG stays with him. Lakers_6_PG attempts a Dunk. Contested by Warriors_6_PG (5.4 feet, MAN). LAKERS_6_PG MAKES IT! Assist: Lakers_10_C
Score: 48-37

[02:05] Warriors possession (Score: 48-37)
Warriors_6_PG attempts a Layup. Contested by Lakers_6_PG (4.9 feet, MAN). Warriors_6_PG misses. Rebound secured by Lakers_10_C.

[01:50] Lakers possession (Score: 48-37)
Lakers_6_PG attempts a 3Pt. Contested by Warriors_6_PG (5.4 feet, MAN). Lakers_6_PG misses. Offensive rebound by Lakers_6_PG! Lakers_6_PG kicks it out.

[01:33] Lakers possession (Score: 48-37)
Lakers_7_SG attempts a 3Pt. Contested by Warriors_7_SG (4.9 feet, MAN). Lakers_7_SG misses. Offensive rebound by Lakers_9_PF! Lakers_9_PF kicks it out.

[01:19] Lakers possession (Score: 48-37)
Lakers_6_PG drives, picks up Warriors_6_PG. Help arrives from Warriors_9_PF! Lakers_6_PG attempts a Dunk. Contested by Warriors_9_PF (5.4 feet, MAN). Lakers_6_PG misses. Offensive rebound by Lakers_9_PF! Lakers_9_PF kicks it out.

[01:00] Lakers possession (Score: 48-37)
Lakers_9_PF attempts a 3Pt. Contested by Warriors_9_PF (4.6 feet, MAN). Lakers_9_PF misses. Rebound secured by Warriors_7_SG.

[00:44] Warriors possession (Score: 48-37)
Warriors_5_C attempts a 3Pt. Contested by Lakers_9_PF (4.8 feet, MAN). Warriors_5_C misses. Offensive rebound by Warriors_7_SG! Warriors_7_SG kicks it out.

[00:26] Warriors possession (Score: 48-37)
Warriors_8_SF attempts a 3Pt. Contested by Lakers_8_SF (5.4 feet, MAN). Warriors_8_SF misses. Offensive rebound by Warriors_7_SG! Warriors_7_SG kicks it out.

[00:10] Warriors possession (Score: 48-37)
Warriors_7_SG drives and kicks out. Warriors_6_PG attempts a 3Pt. Contested by Lakers_6_PG (4.9 feet, MAN). Warriors_6_PG misses. Rebound secured by Lakers_9_PF.

================================================================================
                              2ND QUARTER COMPLETE                              
================================================================================

FINAL SCORE: Warriors 17, Lakers 18

BOX SCORE:
================================================================================

Warriors
--------------------------------------------------------------------------------
Player                MIN  PTS  REB  AST  TO      FG   FG%      3P   3P%
--------------------------------------------------------------------------------
Warriors_1_PG           0    2    0    0   0   1/1   100.0     0/0   0.0
Warriors_5_C            0    2    0    0   0   1/1   100.0     0/0   0.0
Warriors_8_SF           0    2    0    1   0   1/1   100.0     0/0   0.0
Warriors_6_PG           0    2    0    0   0   1/1   100.0     0/0   0.0
Warriors_4_PF           0    0    0    1   0   0/0     0.0     0/0   0.0
Warriors_2_SG           0    0    1    0   0   0/0     0.0     0/0   0.0
Warriors_10_C           0    0    1    0   0   0/0     0.0     0/0   0.0
Warriors_9_PF           0    0    2    0   0   0/0     0.0     0/0   0.0
Warriors_7_SG           0    0    3    0   0   0/0     0.0     0/0   0.0

TEAM: FG: 4/11 (36.4%), 3PT: 0/4 (0.0%), REB: 7 (4 off, 3 def), AST: 2, TO: 2
TEAM FOULS: 0


Lakers
--------------------------------------------------------------------------------
Player                MIN  PTS  REB  AST  TO      FG   FG%      3P   3P%
--------------------------------------------------------------------------------
Lakers_1_PG             0    6    6    0   0   2/2   100.0     0/0   0.0
Lakers_2_SG             0    3    0    0   0   1/1   100.0     0/0   0.0
Lakers_4_PF             0    2    0    1   0   1/1   100.0     0/0   0.0
Lakers_6_PG             0    2    1    0   0   1/1   100.0     0/0   0.0
Lakers_3_SF             0    0    3    1   0   0/0     0.0     0/0   0.0
Lakers_9_PF             0    0    4    0   0   0/0     0.0     0/0   0.0
Lakers_7_SG             0    0    1    0   0   0/0     0.0     0/0   0.0
Lakers_10_C             0    0    1    1   0   0/0     0.0     0/0   0.0

TEAM: FG: 5/8 (62.5%), 3PT: 3/4 (75.0%), REB: 16 (9 off, 7 def), AST: 3, TO: 4
TEAM FOULS: 7 [OPPONENT IN BONUS]

================================================================================

================================================================================
                        3RD QUARTER - Warriors vs Lakers                        
================================================================================

[12:00] Warriors possession (Score: 48-37)
Warriors_1_PG attempts a Layup. Contested by Lakers_1_PG (4.4 feet, MAN). Warriors_1_PG misses. Rebound secured by Lakers_1_PG.

[11:41] Lakers possession (Score: 48-37)
Lakers_3_SF attempts a 3Pt. Contested by Warriors_3_SF (5.2 feet, MAN). LAKERS_3_SF MAKES IT! Assist: Lakers_2_SG
Score: 48-40

[11:26] Warriors possession (Score: 48-40)
Warriors_3_SF drives and kicks out. Warriors_1_PG attempts a 3Pt. Contested by Lakers_1_PG (4.4 feet, MAN). WARRIORS_1_PG MAKES IT! Assist: Warriors_2_SG
Score: 51-40

[11:10] Lakers possession (Score: 51-40)
Lakers_4_PF attempts a 3Pt. Contested by Warriors_4_PF (5.3 feet, MAN). Lakers_4_PF misses. Offensive rebound by Lakers_3_SF! Lakers_3_SF kicks it out.

[10:53] Lakers possession (Score: 51-40)
Lakers_1_PG attempts a Layup. Contested by Warriors_1_PG (5.6 feet, MAN). LAKERS_1_PG MAKES IT!
Score: 51-42

[10:38] Warriors possession (Score: 51-42)
Warriors_4_PF makes the Layup and draws the foul on Lakers_4_PF! And-1! Warriors_4_PF to the line for 1. [Team fouls: 1] (Lakers_4_PF: 1 personal fouls)   FT 1/1: GOOD Warriors_4_PF makes 1/1 from the line.
Score: 54-42

[10:20] Lakers possession (Score: 54-42)
Lakers_1_PG drives, picks up Warriors_1_PG. Help arrives from Warriors_2_SG! Lakers_1_PG attempts a Dunk. Contested by Warriors_2_SG (5.6 feet, MAN). Lakers_1_PG misses. Rebound secured by Warriors_2_SG.

[10:05] Warriors possession (Score: 54-42)
Warriors_1_PG drives to the basket... Warriors_1_PG loses the ball! TURNOVER!

[09:48] Lakers possession (Score: 54-42)
Lakers_4_PF attempts a Midrange. Contested by Warriors_9_PF (4.2 feet, MAN). Lakers_4_PF misses. Offensive rebound by Lakers_1_PG! Lakers_1_PG kicks it out.

[09:48] Substitution (Warriors): Warriors_3_SF OUT (stamina: 59) → Warriors_9_PF IN (stamina)

[09:48] Substitution (Warriors): Warriors_5_C OUT (stamina: 58) → Warriors_10_C IN (stamina)

[09:48] Substitution (Lakers): Lakers_5_C OUT (stamina: 56) → Lakers_10_C IN (stamina)

[09:29] Lakers possession (Score: 54-42)
Lakers_2_SG attempts a Midrange. Contested by Warriors_2_SG (5.4 feet, MAN). Lakers_2_SG misses. Offensive rebound by Lakers_3_SF! Lakers_3_SF kicks it out.

[09:14] Lakers possession (Score: 54-42)
FOUL! Shooting foul on Warriors_2_SG. Lakers_2_SG to the line for 3 free throws. [Team fouls: 2] (Warriors_2_SG: 1 personal fouls)   FT 1/3: MISS   FT 2/3: GOOD   FT 3/3: GOOD Lakers_2_SG makes 2/3 from the line.
Score: 54-44

[08:59] Warriors possession (Score: 54-44)
Warriors_9_PF attempts a Midrange. Contested by Lakers_4_PF (4.9 feet, MAN). Warriors_9_PF misses. Offensive rebound by Warriors_8_SF! Warriors_8_SF kicks it out.

[08:59] Substitution (Warriors): Warriors_4_PF OUT (stamina: 59) → Warriors_8_SF IN (stamina)

[08:59] Substitution (Lakers): Lakers_2_SG OUT (stamina: 60) → Lakers_7_SG IN (stamina)

[08:45] Warriors possession (Score: 54-44)
Warriors_1_PG attempts a Midrange. Contested by Lakers_1_PG (4.4 feet, MAN). WARRIORS_1_PG MAKES IT!
Score: 56-44

[08:29] Lakers possession (Score: 56-44)
Lakers_10_C throws a bad pass! Stolen by Warriors_10_C! TURNOVER!

[08:11] Warriors possession (Score: 56-44)
Warriors_8_SF drives and kicks out. Warriors_10_C attempts a Midrange. Wide open! Lakers_10_C is 6.4 feet away. [MAN] WARRIORS_10_C MAKES IT!
Score: 58-44

[07:55] Lakers possession (Score: 58-44)
Lakers_3_SF attempts a Midrange. Contested by Warriors_8_SF (5.5 feet, MAN). Lakers_3_SF misses. Rebound secured by Warriors_9_PF.

[07:39] Warriors possession (Score: 58-44)
Warriors_1_PG throws a bad pass out of bounds! TURNOVER!

[07:23] Lakers possession (Score: 58-44)
Lakers_5_C attempts a 3Pt. Contested by Warriors_10_C (5.1 feet, MAN). Lakers_5_C misses. Rebound secured by Warriors_8_SF.

[07:23] Substitution (Lakers): Lakers_10_C OUT (stamina: 59) → Lakers_5_C IN (stamina)

[07:05] Warriors possession (Score: 58-44)
Warriors_2_SG attempts a 3Pt. Contested by Lakers_7_SG (4.6 feet, MAN). Warriors_2_SG misses. Rebound secured by Lakers_7_SG.

[06:51] Lakers possession (Score: 58-44)
Lakers_4_PF attempts a 3Pt. Contested by Warriors_9_PF (4.2 feet, MAN). Lakers_4_PF misses. Offensive rebound by Lakers_1_PG! Lakers_1_PG kicks it out.

[06:32] Lakers possession (Score: 58-44)
Lakers_1_PG attempts a 3Pt. Contested by Warriors_1_PG (5.9 feet, MAN). LAKERS_1_PG MAKES IT! Assist: Lakers_4_PF
Score: 58-47

[06:18] Warriors possession (Score: 58-47)
Warriors_1_PG attempts a Layup. Contested by Lakers_1_PG (4.6 feet, MAN). WARRIORS_1_PG MAKES IT! Assist: Warriors_8_SF
Score: 60-47

[05:56] Lakers possession (Score: 60-47)
Lakers_7_SG attempts a Midrange. Contested by Warriors_2_SG (5.7 feet, MAN). LAKERS_7_SG MAKES IT! Assist: Lakers_1_PG
Score: 60-49

[05:44] Warriors possession (Score: 60-49)
Warriors_10_C drives to the basket... Warriors_10_C loses the ball! TURNOVER!

[05:29] Lakers possession (Score: 60-49)
Lakers_5_C attempts a Midrange. Contested by Warriors_10_C (5.3 feet, MAN). LAKERS_5_C MAKES IT!
Score: 60-51

[05:11] Warriors possession (Score: 60-51)
Warriors_2_SG attempts a Midrange. Contested by Lakers_7_SG (4.7 feet, MAN). Warriors_2_SG misses. Rebound secured by Lakers_1_PG.

[04:58] Lakers possession (Score: 60-51)
Lakers_1_PG attempts a 3Pt. Wide open! Warriors_1_PG is 6.1 feet away. [MAN] Lakers_1_PG misses. Rebound secured by Warriors_9_PF.

[04:35] Warriors possession (Score: 60-51)
Warriors_1_PG loses the ball! Stripped by Lakers_1_PG! TURNOVER!

[04:13] Lakers possession (Score: 60-51)
Lakers_10_C drives to the basket... Lakers_10_C loses the ball! TURNOVER!

[04:13] Substitution (Warriors): Warriors_1_PG OUT (stamina: 57) → Warriors_6_PG IN (stamina)

[04:13] Substitution (Warriors): Warriors_2_SG OUT (stamina: 62) → Warriors_7_SG IN (minutes)

[04:13] Substitution (Warriors): Warriors_10_C OUT (stamina: 60) → Warriors_5_C IN (stamina)

[04:13] Substitution (Lakers): Lakers_3_SF OUT (stamina: 59) → Lakers_8_SF IN (stamina)

[04:13] Substitution (Lakers): Lakers_4_PF OUT (stamina: 63) → Lakers_9_PF IN (minutes)

[04:13] Substitution (Lakers): Lakers_5_C OUT (stamina: 55) → Lakers_10_C IN (stamina)

[03:55] Warriors possession (Score: 60-51)
Warriors_5_C drives, Lakers_10_C stays with him. Warriors_5_C attempts a Layup. Wide open! Lakers_10_C is 6.3 feet away. [MAN] WARRIORS_5_C MAKES IT! Assist: Warriors_9_PF
Score: 62-51

[03:38] Lakers possession (Score: 62-51)
Lakers_1_PG loses control of the ball! TURNOVER!

[03:26] Warriors possession (Score: 62-51)
Warriors_7_SG makes the 3Pt and draws the foul on Lakers_7_SG! And-1! Warriors_7_SG to the line for 1. [Team fouls: 3] (Lakers_7_SG: 1 personal fouls)   FT 1/1: GOOD Warriors_7_SG makes 1/1 from the line.
Score: 66-51

[03:26] Substitution (Lakers): Lakers_1_PG OUT (stamina: 61) → Lakers_6_PG IN (minutes)

[03:06] Lakers possession (Score: 66-51)
FOUL! Shooting foul on Warriors_7_SG. Lakers_7_SG to the line for 3 free throws. [Team fouls: 4] (Warriors_7_SG: 1 personal fouls)   FT 1/3: GOOD   FT 2/3: GOOD   FT 3/3: GOOD Lakers_7_SG makes 3/3 from the line.
Score: 66-54

[02:50] Warriors possession (Score: 66-54)
Warriors_6_PG drives, Lakers_6_PG stays with him. Warriors_6_PG attempts a Dunk. Contested by Lakers_6_PG (4.9 feet, MAN). Warriors_6_PG misses. Rebound secured by Lakers_10_C.

[02:35] Lakers possession (Score: 66-54)
Lakers_9_PF attempts a Midrange. Contested by Warriors_9_PF (4.6 feet, MAN). Lakers_9_PF misses. Offensive rebound by Lakers_6_PG! Lakers_6_PG kicks it out.

[02:19] Lakers possession (Score: 66-54)
Lakers_10_C drives to the basket... Lakers_10_C loses the ball! TURNOVER!

[02:00] Warriors possession (Score: 66-54)
Warriors_9_PF drives, Lakers_9_PF stays with him. Warriors_9_PF attempts a Layup. Contested by Lakers_9_PF (4.7 feet, MAN). WARRIORS_9_PF MAKES IT! Assist: Warriors_5_C
Score: 68-54

[02:00] Substitution (Warriors): Warriors_8_SF OUT (stamina: 59) → Warriors_3_SF IN (stamina)

[01:45] Lakers possession (Score: 68-54)
Lakers_7_SG throws a bad pass! Stolen by Warriors_7_SG! TURNOVER!

[01:25] Warriors possession (Score: 68-54)
FOUL! Shooting foul on Lakers_9_PF. Warriors_5_C to the line for 3 free throws. [BONUS: 5 team fouls] (Lakers_9_PF: 1 personal fouls)   FT 1/3: MISS   FT 2/3: GOOD   FT 3/3: GOOD Warriors_5_C makes 2/3 from the line.
Score: 70-54

[01:12] Lakers possession (Score: 70-54)
Lakers_6_PG attempts a Midrange. Contested by Warriors_6_PG (5.4 feet, MAN). LAKERS_6_PG MAKES IT! Assist: Lakers_5_C
Score: 70-56

[01:12] Substitution (Lakers): Lakers_10_C OUT (stamina: 60) → Lakers_5_C IN (stamina)

[00:54] Warriors possession (Score: 70-56)
Warriors_7_SG attempts a 3Pt. Contested by Lakers_7_SG (5.0 feet, MAN). WARRIORS_7_SG MAKES IT! Assist: Warriors_6_PG
Score: 73-56

[00:40] Lakers possession (Score: 73-56)
Lakers_8_SF attempts a 3Pt. Contested by Warriors_3_SF (4.9 feet, MAN). Lakers_8_SF misses. Rebound secured by Warriors_7_SG.

[00:40] TIMEOUT - Lakers (stop opponent momentum) - 5 timeouts remaining

[00:28] Warriors possession (Score: 73-56)
Warriors_5_C attempts a Layup. Contested by Lakers_5_C (5.6 feet, MAN). Warriors_5_C misses. Offensive rebound by Warriors_7_SG! Warriors_7_SG kicks it out.

[00:09] Warriors possession (Score: 73-56)
Warriors_5_C commits an offensive foul! Lakers_5_C drew the charge! TURNOVER!

================================================================================
                              3RD QUARTER COMPLETE                              
================================================================================

FINAL SCORE: Warriors 25, Lakers 19

BOX SCORE:
================================================================================

Warriors
--------------------------------------------------------------------------------
Player                MIN  PTS  REB  AST  TO      FG   FG%      3P   3P%
--------------------------------------------------------------------------------
Warriors_1_PG           0    7    0    0   0   3/3   100.0     0/0   0.0
Warriors_7_SG           0    3    2    0   0   1/1   100.0     0/0   0.0
Warriors_10_C           0    2    0    0   0   1/1   100.0     0/0   0.0
Warriors_9_PF           0    2    2    1   0   1/1   100.0     0/0   0.0
Warriors_5_C            0    2    0    1   0   1/1   100.0     0/0   0.0
Warriors_2_SG           0    0    1    1   0   0/0     0.0     0/0   0.0
Warriors_8_SF           0    0    2    1   0   0/0     0.0     0/0   0.0
Warriors_6_PG           0    0    0    1   0   0/0     0.0     0/0   0.0

TEAM: FG: 7/11 (63.6%), 3PT: 1/2 (50.0%), REB: 7 (2 off, 5 def), AST: 5, TO: 5
TEAM FOULS: 0


Lakers
--------------------------------------------------------------------------------
Player                MIN  PTS  REB  AST  TO      FG   FG%      3P   3P%
--------------------------------------------------------------------------------
Lakers_1_PG             0    5    4    1   0   2/2   100.0     0/0   0.0
Lakers_3_SF             0    3    2    0   0   1/1   100.0     0/0   0.0
Lakers_7_SG             0    2    1    0   0   1/1   100.0     0/0   0.0
Lakers_5_C              0    2    0    1   0   1/1   100.0     0/0   0.0
Lakers_6_PG             0    2    1    0   0   1/1   100.0     0/0   0.0
Lakers_2_SG             0    0    0    1   0   0/0     0.0     0/0   0.0
Lakers_4_PF             0    0    0    1   0   0/0     0.0     0/0   0.0
Lakers_10_C             0    0    1    0   0   0/0     0.0     0/0   0.0

TEAM: FG: 6/11 (54.5%), 3PT: 2/5 (40.0%), REB: 9 (5 off, 4 def), AST: 4, TO: 5
TEAM FOULS: 5 [OPPONENT IN BONUS]

================================================================================

================================================================================
                        4TH QUARTER - Warriors vs Lakers                        
================================================================================

[12:00] Warriors possession (Score: 73-56)
Warriors_2_SG drives to the basket... Warriors_2_SG loses the ball! TURNOVER!

[11:47] Lakers possession (Score: 73-56)
Lakers_4_PF drives, Warriors_4_PF stays with him. Lakers_4_PF attempts a Dunk. Contested by Warriors_4_PF (5.2 feet, MAN). Lakers_4_PF misses. Rebound secured by Warriors_4_PF.

[11:34] Warriors possession (Score: 73-56)
Warriors_3_SF attempts a 3Pt. Contested by Lakers_3_SF (4.2 feet, MAN). Warriors_3_SF misses. Rebound secured by Lakers_1_PG.

[11:21] Lakers possession (Score: 73-56)
Lakers_1_PG attempts a 3Pt. Contested by Warriors_1_PG (5.5 feet, MAN). LAKERS_1_PG MAKES IT! Assist: Lakers_4_PF
Score: 73-59

[11:07] Warriors possession (Score: 73-59)
Warriors_2_SG attempts a 3Pt. Contested by Lakers_2_SG (4.8 feet, MAN). Warriors_2_SG misses. Offensive rebound by Warriors_4_PF! Warriors_4_PF kicks it out.

[10:51] Warriors possession (Score: 73-59)
Warriors_4_PF attempts a 3Pt. Contested by Lakers_4_PF (4.8 feet, MAN). WARRIORS_4_PF MAKES IT! Assist: Warriors_1_PG
Score: 76-59

[10:31] Lakers possession (Score: 76-59)
FOUL! Shooting foul on Warriors_4_PF. Lakers_4_PF to the line for 3 free throws. [Team fouls: 1] (Warriors_4_PF: 1 personal fouls)   FT 1/3: GOOD   FT 2/3: MISS   FT 3/3: GOOD Lakers_4_PF makes 2/3 from the line.
Score: 76-61

[10:15] Warriors possession (Score: 76-61)
FOUL! Shooting foul on Lakers_4_PF. Warriors_4_PF to the line for 3 free throws. [Team fouls: 2] (Lakers_4_PF: 1 personal fouls)   FT 1/3: GOOD   FT 2/3: GOOD   FT 3/3: GOOD Warriors_4_PF makes 3/3 from the line.
Score: 79-61

[10:03] Lakers possession (Score: 79-61)
Lakers_1_PG drives, Warriors_1_PG stays with him. Lakers_1_PG attempts a Layup. Contested by Warriors_1_PG (5.6 feet, MAN). LAKERS_1_PG MAKES IT! Assist: Lakers_5_C
Score: 79-63

[09:45] Warriors possession (Score: 79-63)
Warriors_1_PG throws a bad pass! Stolen by Lakers_1_PG! TURNOVER!

[09:31] Lakers possession (Score: 79-63)
Lakers_1_PG attempts a Midrange. Contested by Warriors_1_PG (5.7 feet, MAN). Lakers_1_PG misses. Rebound secured by Warriors_10_C.

[09:31] Substitution (Warriors): Warriors_3_SF OUT (stamina: 57) → Warriors_9_PF IN (stamina)

[09:31] Substitution (Warriors): Warriors_5_C OUT (stamina: 56) → Warriors_10_C IN (stamina)

[09:31] Substitution (Lakers): Lakers_5_C OUT (stamina: 54) → Lakers_10_C IN (stamina)

[09:16] Warriors possession (Score: 79-63)
Warriors_1_PG attempts a 3Pt. Contested by Lakers_1_PG (4.4 feet, MAN). Warriors_1_PG misses. Rebound secured by Lakers_10_C.

[09:01] Lakers possession (Score: 79-63)
Lakers_2_SG attempts a 3Pt. Contested by Warriors_2_SG (5.5 feet, MAN). Lakers_2_SG misses. Rebound secured by Warriors_10_C.

[08:43] Warriors possession (Score: 79-63)
Warriors_10_C attempts a 3Pt. Wide open! Lakers_10_C is 6.3 feet away. [MAN] WARRIORS_10_C MAKES IT! Assist: Warriors_1_PG
Score: 82-63

[08:30] Lakers possession (Score: 82-63)
Lakers_3_SF attempts a 3Pt. Contested by Warriors_9_PF (4.2 feet, MAN). Lakers_3_SF misses. Rebound secured by Warriors_2_SG.

[08:13] Warriors possession (Score: 82-63)
Warriors_9_PF attempts a 3Pt. Contested by Lakers_4_PF (5.0 feet, MAN). Warriors_9_PF misses. Rebound secured by Lakers_1_PG.

[07:52] Lakers possession (Score: 82-63)
Lakers_4_PF drives, Warriors_9_PF stays with him. Lakers_4_PF attempts a Dunk. Contested by Warriors_9_PF (4.2 feet, MAN). Lakers_4_PF misses. Rebound secured by Warriors_9_PF.

[07:30] Warriors possession (Score: 82-63)
Warriors_10_C attempts a 3Pt. Wide open! Lakers_10_C is 6.4 feet away. [MAN] Warriors_10_C misses. Offensive rebound by Warriors_9_PF! Warriors_9_PF kicks it out.

[07:11] Warriors possession (Score: 82-63)
Warriors_10_C attempts a Midrange. Wide open! Lakers_10_C is 6.4 feet away. [MAN] WARRIORS_10_C MAKES IT! Assist: Warriors_2_SG
Score: 84-63

[06:55] Lakers possession (Score: 84-63)
Lakers_3_SF attempts a 3Pt. Contested by Warriors_9_PF (4.2 feet, MAN). Lakers_3_SF misses. Rebound secured by Warriors_10_C.

[06:41] Warriors possession (Score: 84-63)
Warriors_9_PF drives and kicks out. Warriors_10_C attempts a Midrange. Wide open! Lakers_10_C is 6.5 feet away. [MAN] WARRIORS_10_C MAKES IT!
Score: 86-63

[06:22] Lakers possession (Score: 86-63)
FOUL! Shooting foul on Warriors_9_PF. Lakers_4_PF to the line for 2 free throws. [Team fouls: 3] (Warriors_9_PF: 1 personal fouls)   FT 1/2: GOOD   FT 2/2: MISS Lakers_4_PF makes 1/2 from the line. Offensive rebound by Lakers_10_C! Lakers_10_C kicks it out.
Score: 86-64

[06:08] Lakers possession (Score: 86-64)
Lakers_7_SG commits an offensive foul! Warriors_2_SG drew the charge! TURNOVER!

[06:08] Substitution (Warriors): Warriors_4_PF OUT (stamina: 50) → Warriors_8_SF IN (stamina)

[06:08] Substitution (Lakers): Lakers_2_SG OUT (stamina: 50) → Lakers_7_SG IN (stamina)

[06:08] Substitution (Lakers): Lakers_10_C OUT (stamina: 58) → Lakers_5_C IN (stamina)

[05:50] Warriors possession (Score: 86-64)
Warriors_6_PG drives and kicks out. Warriors_6_PG attempts a 3Pt. Contested by Lakers_1_PG (4.7 feet, MAN). Warriors_6_PG misses. Offensive rebound by Warriors_9_PF! Warriors_9_PF kicks it out.

[05:50] Substitution (Warriors): Warriors_1_PG OUT (stamina: 61) → Warriors_6_PG IN (blowout_rest)

[05:50] Substitution (Warriors): Warriors_2_SG OUT (stamina: 66) → Warriors_7_SG IN (blowout_rest)

[05:37] Warriors possession (Score: 86-64)
Warriors_6_PG drives and kicks out. Warriors_8_SF attempts a 3Pt. Contested by Lakers_3_SF (4.7 feet, MAN). Warriors_8_SF misses. Rebound secured by Lakers_7_SG.

[05:21] Lakers possession (Score: 86-64)
Lakers_7_SG throws a bad pass! Stolen by Warriors_7_SG! TURNOVER!

[05:07] Warriors possession (Score: 86-64)
Warriors_6_PG attempts a Layup. Contested by Lakers_1_PG (4.8 feet, MAN). WARRIORS_6_PG MAKES IT! Assist: Warriors_9_PF
Score: 88-64

[04:51] Lakers possession (Score: 88-64)
Lakers_3_SF attempts a Midrange. Contested by Warriors_8_SF (5.4 feet, MAN). LAKERS_3_SF MAKES IT! Assist: Lakers_7_SG
Score: 88-66

[04:33] Warriors possession (Score: 88-66)
Warriors_8_SF drives to the basket... Warriors_8_SF loses the ball! TURNOVER!

[04:16] Lakers possession (Score: 88-66)
Lakers_9_PF commits an offensive foul! Warriors_9_PF drew the charge! TURNOVER!

[04:16] Substitution (Lakers): Lakers_3_SF OUT (stamina: 58) → Lakers_8_SF IN (stamina)

[04:16] Substitution (Lakers): Lakers_4_PF OUT (stamina: 62) → Lakers_9_PF IN (minutes)

[03:55] Warriors possession (Score: 88-66)
Warriors_8_SF attempts a Layup. Contested by Lakers_8_SF (5.4 feet, MAN). Warriors_8_SF misses. Offensive rebound by Warriors_8_SF! Warriors_8_SF kicks it out.

[03:55] Substitution (Lakers): Lakers_5_C OUT (stamina: 59) → Lakers_10_C IN (stamina)

[03:41] Warriors possession (Score: 88-66)
Warriors_6_PG attempts a Layup. Contested by Lakers_1_PG (4.9 feet, MAN). Warriors_6_PG misses. Rebound secured by Lakers_7_SG.

[03:27] Lakers possession (Score: 88-66)
Lakers_1_PG makes the Midrange and draws the foul on Warriors_6_PG! And-1! Lakers_1_PG to the line for 1. [Team fouls: 4] (Warriors_6_PG: 1 personal fouls)   FT 1/1: GOOD Lakers_1_PG makes 1/1 from the line.
Score: 88-69

[03:05] Warriors possession (Score: 88-69)
Warriors_6_PG drives, Lakers_1_PG stays with him. Warriors_6_PG attempts a Layup. Contested by Lakers_1_PG (5.0 feet, MAN). WARRIORS_6_PG MAKES IT!
Score: 90-69

[02:48] Lakers possession (Score: 90-69)
Lakers_7_SG makes the Dunk and draws the foul on Warriors_7_SG! And-1! Lakers_7_SG to the line for 1. [BONUS: 5 team fouls] (Warriors_7_SG: 1 personal fouls)   FT 1/1: GOOD Lakers_7_SG makes 1/1 from the line.
Score: 90-72

[02:36] Warriors possession (Score: 90-72)
Warriors_8_SF attempts a 3Pt. Contested by Lakers_8_SF (5.4 feet, MAN). WARRIORS_8_SF MAKES IT! Assist: Warriors_7_SG
Score: 93-72

[02:19] Lakers possession (Score: 93-72)
Lakers_9_PF attempts a Midrange. Contested by Warriors_9_PF (4.6 feet, MAN). LAKERS_9_PF MAKES IT!
Score: 93-74

[02:01] Warriors possession (Score: 93-74)
Warriors_10_C drives, picks up Lakers_9_PF. Help arrives from Lakers_7_SG! Warriors_10_C attempts a Dunk. Contested by Lakers_7_SG (4.7 feet, MAN). Warriors_10_C misses. Offensive rebound by Warriors_8_SF! Warriors_8_SF kicks it out.

[01:48] Warriors possession (Score: 93-74)
FOUL! Reach-in foul on Lakers_9_PF during the drive. [IN THE BONUS! 6 team fouls] Warriors_9_PF to the line for 2 free throws. (Lakers_9_PF: 1 personal fouls)   FT 1/2: GOOD   FT 2/2: GOOD Warriors_9_PF makes 2/2 from the line.
Score: 95-74

[01:30] Lakers possession (Score: 95-74)
Lakers_7_SG attempts a Midrange. Contested by Warriors_7_SG (5.3 feet, MAN). Lakers_7_SG misses. Offensive rebound by Lakers_9_PF! Lakers_9_PF kicks it out.

[01:18] Lakers possession (Score: 95-74)
Lakers_10_C attempts a Midrange. Contested by Warriors_10_C (5.8 feet, MAN). Lakers_10_C misses. Offensive rebound by Lakers_9_PF! Lakers_9_PF kicks it out.

[01:04] Lakers possession (Score: 95-74)
Lakers_7_SG attempts a 3Pt. Contested by Warriors_7_SG (5.3 feet, MAN). Lakers_7_SG misses. Rebound secured by Warriors_7_SG.

[00:49] Warriors possession (Score: 95-74)
Warriors_7_SG attempts a Midrange. Contested by Lakers_7_SG (4.7 feet, MAN). Warriors_7_SG misses. Rebound secured by Lakers_10_C.

[00:28] Lakers possession (Score: 95-74)
Lakers_10_C attempts a Layup. Contested by Warriors_10_C (5.9 feet, MAN). Lakers_10_C misses. Rebound secured by Warriors_7_SG.

[00:05] Warriors possession (Score: 95-74)
FOUL! Shooting foul on Lakers_7_SG. Warriors_7_SG to the line for 3 free throws. [BONUS: 7 team fouls] (Lakers_7_SG: 1 personal fouls)   FT 1/3: MISS   FT 2/3: MISS   FT 3/3: GOOD Warriors_7_SG makes 1/3 from the line.
Score: 96-74

================================================================================
                              4TH QUARTER COMPLETE                              
================================================================================

FINAL SCORE: Warriors 23, Lakers 18

BOX SCORE:
================================================================================

Warriors
--------------------------------------------------------------------------------
Player                MIN  PTS  REB  AST  TO      FG   FG%      3P   3P%
--------------------------------------------------------------------------------
Warriors_10_C           0    7    3    0   0   3/3   100.0     0/0   0.0
Warriors_6_PG           0    4    0    0   0   2/2   100.0     0/0   0.0
Warriors_4_PF           0    3    2    0   0   1/1   100.0     0/0   0.0
Warriors_8_SF           0    3    2    0   0   1/1   100.0     0/0   0.0
Warriors_1_PG           0    0    0    2   0   0/0     0.0     0/0   0.0
Warriors_2_SG           0    0    1    1   0   0/0     0.0     0/0   0.0
Warriors_9_PF           0    0    3    1   0   0/0     0.0     0/0   0.0
Warriors_7_SG           0    0    2    1   0   0/0     0.0     0/0   0.0

TEAM: FG: 7/13 (53.8%), 3PT: 3/6 (50.0%), REB: 13 (5 off, 8 def), AST: 5, TO: 3
TEAM FOULS: 0


Lakers
--------------------------------------------------------------------------------
Player                MIN  PTS  REB  AST  TO      FG   FG%      3P   3P%
--------------------------------------------------------------------------------
Lakers_1_PG             0    5    2    0   0   2/2   100.0     0/0   0.0
Lakers_3_SF             0    2    0    0   0   1/1   100.0     0/0   0.0
Lakers_9_PF             0    2    2    0   0   1/1   100.0     0/0   0.0
Lakers_4_PF             0    0    0    1   0   0/0     0.0     0/0   0.0
Lakers_5_C              0    0    0    1   0   0/0     0.0     0/0   0.0
Lakers_10_C             0    0    3    0   0   0/0     0.0     0/0   0.0
Lakers_7_SG             0    0    2    1   0   0/0     0.0     0/0   0.0

TEAM: FG: 4/12 (33.3%), 3PT: 1/5 (20.0%), REB: 9 (3 off, 6 def), AST: 3, TO: 3
TEAM FOULS: 7 [OPPONENT IN BONUS]

================================================================================