GAME 1 - Timeout Validation
================================================================================

Final Score: Warriors 78, Lakers 44

Timeout Summary:
  Home Timeouts Used: 1/7
  Away Timeouts Used: 5/7
  Total Timeouts: 6
  Illegal Timeouts: 0

================================================================================
PLAY-BY-PLAY
================================================================================

================================================================================
                        1ST QUARTER - Warriors vs Lakers                        
================================================================================

[12:00] Warriors possession (Score: 0-0)
Warriors_5_C attempts a 3Pt. Contested by Lakers_5_C (5.9 feet, MAN). Warriors_5_C misses. Offensive rebound by Warriors_3_SF! Warriors_3_SF kicks it out.

[11:43] Warriors possession (Score: 0-0)
Warriors_4_PF drives and kicks out. Warriors_1_PG attempts a 3Pt. Contested by Lakers_1_PG (5.6 feet, MAN). Warriors_1_PG misses. Offensive rebound by Warriors_1_PG! Warriors_1_PG kicks it out.

[11:30] Warriors possession (Score: 0-0)
Warriors_3_SF drives, picks up Lakers_3_SF. Help arrives from Lakers_2_SG! Warriors_3_SF attempts a Layup. Contested by Lakers_2_SG (5.5 feet, MAN). WARRIORS_3_SF MAKES IT! Assist: Warriors_5_C
Score: 2-0

[11:15] Lakers possession (Score: 2-0)
Lakers_2_SG drives, Warriors_2_SG stays with him. Lakers_2_SG attempts a Layup. Contested by Warriors_2_SG (5.5 feet, MAN). Lakers_2_SG misses. Rebound secured by Warriors_3_SF.

[10:58] Warriors possession (Score: 2-0)
Warriors_2_SG drives to the basket... Warriors_2_SG loses the ball! TURNOVER!

[10:39] Lakers possession (Score: 2-0)
Lakers_1_PG drives and kicks out. Lakers_2_SG attempts a 3Pt. Contested by Warriors_2_SG (5.5 feet, MAN). Lakers_2_SG misses. Offensive rebound by Lakers_3_SF! Lakers_3_SF kicks it out.

[10:23] Lakers possession (Score: 2-0)
Lakers_1_PG attempts a 3Pt. Contested by Warriors_1_PG (4.2 feet, MAN). Lakers_1_PG misses. Offensive rebound by Lakers_3_SF! Lakers_3_SF kicks it out.

[10:08] Lakers possession (Score: 2-0)
Lakers_1_PG drives and kicks out. Lakers_2_SG attempts a Midrange. Contested by Warriors_2_SG (5.5 feet, MAN). Lakers_2_SG misses. Offensive rebound by Lakers_2_SG! Lakers_2_SG kicks it out.

[09:52] Lakers possession (Score: 2-0)
Lakers_1_PG attempts a Midrange. Contested by Warriors_1_PG (4.3 feet, MAN). Lakers_1_PG misses. Rebound secured by Warriors_3_SF.

[09:37] Warriors possession (Score: 2-0)
Warriors_5_C attempts a Midrange. Wide open! Lakers_5_C is 6.1 feet away. [MAN] Warriors_5_C misses. Rebound secured by Lakers_3_SF.

[09:21] Lakers possession (Score: 2-0)
Lakers_1_PG attempts a 3Pt. Contested by Warriors_1_PG (4.3 feet, MAN). Lakers_1_PG misses. Rebound secured by Warriors_1_PG.

[09:06] Warriors possession (Score: 2-0)
Warriors_5_C attempts a Midrange. Wide open! Lakers_5_C is 6.2 feet away. [MAN] WARRIORS_5_C MAKES IT!
Score: 4-0

[08:52] Lakers possession (Score: 4-0)
Lakers_2_SG attempts a 3Pt. Contested by Warriors_2_SG (5.5 feet, MAN). LAKERS_2_SG MAKES IT! Assist: Lakers_3_SF
Score: 4-3

[08:38] Warriors possession (Score: 4-3)
FOUL! Shooting foul on Lakers_2_SG. Warriors_2_SG to the line for 2 free throws. [Team fouls: 1] (Lakers_2_SG: 1 personal fouls)   FT 1/2: GOOD   FT 2/2: MISS Warriors_2_SG makes 1/2 from the line. Offensive rebound by Warriors_3_SF! Warriors_3_SF kicks it out.
Score: 5-3

[08:22] Warriors possession (Score: 5-3)
Warriors_4_PF attempts a Midrange. Contested by Lakers_9_PF (4.9 feet, MAN). WARRIORS_4_PF MAKES IT! Assist: Warriors_1_PG
Score: 7-3

[08:22] Substitution (Warriors): Warriors_5_C OUT (stamina: 55) → Warriors_10_C IN (stamina)

[08:22] Substitution (Lakers): Lakers_4_PF OUT (stamina: 53) → Lakers_9_PF IN (stamina)

[08:22] Substitution (Lakers): Lakers_5_C OUT (stamina: 56) → Lakers_10_C IN (stamina)

[08:06] Lakers possession (Score: 7-3)
Lakers_1_PG attempts a Midrange. Contested by Warriors_1_PG (4.4 feet, MAN). Lakers_1_PG misses. Rebound secured by Warriors_10_C.

[07:52] Warriors possession (Score: 7-3)
Warriors_1_PG attempts a Layup. Contested by Lakers_1_PG (6.0 feet, MAN). Warriors_1_PG misses. Rebound secured by Lakers_2_SG.

[07:40] Lakers possession (Score: 7-3)
FOUL! Reach-in foul on Warriors_3_SF during the drive. [Team fouls: 2] No free throws, side out. (Warriors_3_SF: 1 personal fouls)

[07:23] Warriors possession (Score: 7-3)
Warriors_1_PG attempts a Midrange. Contested by Lakers_2_SG (4.7 feet, MAN). Warriors_1_PG misses. Rebound secured by Lakers_2_SG.

[07:23] Substitution (Lakers): Lakers_1_PG OUT (stamina: 57) → Lakers_7_SG IN (stamina)

[07:10] Lakers possession (Score: 7-3)
FOUL! Shooting foul on Warriors_10_C. Lakers_10_C to the line for 2 free throws. [Team fouls: 3] (Warriors_10_C: 1 personal fouls)   FT 1/2: MISS   FT 2/2: GOOD Lakers_10_C makes 1/2 from the line.
Score: 7-4

[06:54] Warriors possession (Score: 7-4)
Warriors_1_PG makes the Dunk and draws the foul on Lakers_3_SF! And-1! Warriors_1_PG to the line for 1. [Team fouls: 4] (Lakers_3_SF: 1 personal fouls)   FT 1/1: GOOD Warriors_1_PG makes 1/1 from the line.
Score: 10-4

[06:37] Lakers possession (Score: 10-4)
Lakers_3_SF attempts a Layup. Contested by Warriors_3_SF (4.5 feet, MAN). Lakers_3_SF misses. Rebound secured by Warriors_10_C.

[06:21] Warriors possession (Score: 10-4)
Warriors_1_PG commits an offensive foul! Lakers_2_SG drew the charge! TURNOVER!

[06:00] Lakers possession (Score: 10-4)
Lakers_7_SG drives, picks up Warriors_2_SG. Help arrives from Warriors_1_PG! Lakers_7_SG attempts a Dunk. Contested by Warriors_1_PG (5.8 feet, MAN). Lakers_7_SG misses. Rebound secured by Warriors_1_PG.

[06:00] Substitution (Lakers): Lakers_2_SG OUT (stamina: 59) → Lakers_6_PG IN (stamina)

[05:39] Warriors possession (Score: 10-4)
Warriors_2_SG throws a bad pass out of bounds! TURNOVER!

[05:26] Lakers possession (Score: 10-4)
Lakers_6_PG loses control of the ball! TURNOVER!

[05:26] Substitution (Warriors): Warriors_3_SF OUT (stamina: 59) → Warriors_8_SF IN (stamina)

[05:04] Warriors possession (Score: 10-4)
Warriors_1_PG loses the ball! Stripped by Lakers_6_PG! TURNOVER!

[04:51] Lakers possession (Score: 10-4)
Lakers_8_SF attempts a Midrange. Contested by Warriors_8_SF (5.3 feet, MAN). Lakers_8_SF misses. Offensive rebound by Lakers_8_SF! Lakers_8_SF kicks it out.

[04:51] Substitution (Warriors): Warriors_4_PF OUT (stamina: 59) → Warriors_9_PF IN (stamina)

[04:51] Substitution (Lakers): Lakers_3_SF OUT (stamina: 62) → Lakers_8_SF IN (minutes)

[04:32] Lakers possession (Score: 10-4)
Lakers_8_SF drives, picks up Warriors_8_SF. Help arrives from Warriors_1_PG! Lakers_8_SF attempts a Layup. Contested by Warriors_1_PG (5.3 feet, MAN). LAKERS_8_SF MAKES IT! Assist: Lakers_6_PG
Score: 10-6

[04:15] Warriors possession (Score: 10-6)
FOUL! Shooting foul on Lakers_8_SF. Warriors_8_SF to the line for 2 free throws. [BONUS: 5 team fouls] (Lakers_8_SF: 1 personal fouls)   FT 1/2: GOOD   FT 2/2: GOOD Warriors_8_SF makes 2/2 from the line.
Score: 12-6

[04:03] Lakers possession (Score: 12-6)
Lakers_7_SG drives and kicks out. Lakers_8_SF attempts a Midrange. Contested by Warriors_8_SF (5.3 feet, MAN). LAKERS_8_SF MAKES IT! Assist: Lakers_9_PF
Score: 12-8

[03:49] Warriors possession (Score: 12-8)
FOUL! Shooting foul on Lakers_9_PF. Warriors_9_PF to the line for 3 free throws. [BONUS: 6 team fouls] (Lakers_9_PF: 1 personal fouls)   FT 1/3: GOOD   FT 2/3: GOOD   FT 3/3: GOOD Warriors_9_PF makes 3/3 from the line.
Score: 15-8

[03:33] Lakers possession (Score: 15-8)
Lakers_6_PG commits an offensive foul! Warriors_1_PG drew the charge! TURNOVER!

[03:17] Warriors possession (Score: 15-8)
Warriors_6_PG drives to the basket... Warriors_6_PG loses the ball! TURNOVER!

[03:17] Substitution (Warriors): Warriors_1_PG OUT (stamina: 55) → Warriors_7_SG IN (stamina)

[03:17] Substitution (Warriors): Warriors_2_SG OUT (stamina: 58) → Warriors_6_PG IN (stamina)

[02:57] Lakers possession (Score: 15-8)
Lakers_6_PG attempts a Midrange. Contested by Warriors_6_PG (5.9 feet, MAN). LAKERS_6_PG MAKES IT!
Score: 15-10

[02:41] Warriors possession (Score: 15-10)
Warriors_10_C attempts a 3Pt. Contested by Lakers_10_C (4.1 feet, MAN). Warriors_10_C misses. Rebound secured by Lakers_7_SG.

[02:26] Lakers possession (Score: 15-10)
Lakers_9_PF attempts a 3Pt. Contested by Warriors_9_PF (5.1 feet, MAN). Lakers_9_PF misses. Rebound secured by Warriors_8_SF.

[02:09] Warriors possession (Score: 15-10)
FOUL! Holding foul on Lakers_6_PG. [IN THE BONUS! 7 team fouls] Warriors_6_PG to the line for 2 free throws. (Lakers_6_PG: 1 personal fouls)   FT 1/2: GOOD   FT 2/2: GOOD Warriors_6_PG makes 2/2 from the line.
Score: 17-10

[01:54] Lakers possession (Score: 17-10)
Lakers_8_SF drives to the basket... Lakers_8_SF loses the ball! TURNOVER!

[01:34] Warriors possession (Score: 17-10)
Warriors_7_SG drives, Lakers_7_SG stays with him. Warriors_7_SG attempts a Layup. Wide open! Lakers_7_SG is 6.6 feet away. [MAN] WARRIORS_7_SG MAKES IT! Assist: Warriors_8_SF
Score: 19-10

[01:34] Substitution (Warriors): Warriors_10_C OUT (stamina: 60) → Warriors_5_C IN (stamina)

[01:34] Substitution (Lakers): Lakers_9_PF OUT (stamina: 60) → Lakers_4_PF IN (stamina)

[01:34] Substitution (Lakers): Lakers_10_C OUT (stamina: 68) → Lakers_5_C IN (minutes)

[01:15] Lakers possession (Score: 19-10)
FOUL! Shooting foul on Warriors_8_SF. Lakers_7_SG to the line for 2 free throws. [BONUS: 8 team fouls] (Warriors_8_SF: 1 personal fouls)   FT 1/2: GOOD   FT 2/2: GOOD Lakers_7_SG makes 2/2 from the line.
Score: 19-12

[01:15] TIMEOUT - Lakers (stop opponent momentum) - 6 timeouts remaining

[01:00] Warriors possession (Score: 19-12)
Warriors_9_PF makes the Midrange and draws the foul on Lakers_4_PF! And-1! Warriors_9_PF to the line for 1. [BONUS: 9 team fouls] (Lakers_4_PF: 1 personal fouls)   FT 1/1: GOOD Warriors_9_PF makes 1/1 from the line.
Score: 22-12

[00:46] Lakers possession (Score: 22-12)
Lakers_5_C loses the ball! Stripped by Warriors_5_C! TURNOVER!

[00:30] Warriors possession (Score: 22-12)
Warriors_5_C attempts a 3Pt. Contested by Lakers_5_C (5.7 feet, MAN). WARRIORS_5_C MAKES IT! Assist: Warriors_8_SF
Score: 25-12

[00:17] Lakers possession (Score: 25-12)
Lakers_8_SF commits an offensive foul! Warriors_8_SF drew the charge! TURNOVER!

================================================================================
                              1ST QUARTER COMPLETE                              
================================================================================

FINAL SCORE: Warriors 25, Lakers 12

BOX SCORE:
================================================================================

Warriors
--------------------------------------------------------------------------------
Player                MIN  PTS  REB  AST  TO      FG   FG%      3P   3P%
--------------------------------------------------------------------------------
Warriors_5_C            0    5    0    1   0   2/2   100.0     0/0   0.0
Warriors_3_SF           0    2    4    0   0   1/1   100.0     0/0   0.0
Warriors_4_PF           0    2    0    0   0   1/1   100.0     0/0   0.0
Warriors_7_SG           0    2    0    0   0   1/1   100.0     0/0   0.0
Warriors_1_PG           0    0    3    1   0   0/0     0.0     0/0   0.0
Warriors_10_C           0    0    2    0   0   0/0     0.0     0/0   0.0
Warriors_8_SF           0    0    1    2   0   0/0     0.0     0/0   0.0

TEAM: FG: 5/9 (55.6%), 3PT: 1/2 (50.0%), REB: 10 (3 off, 7 def), AST: 4, TO: 5
TEAM FOULS: 0


Lakers
--------------------------------------------------------------------------------
Player                MIN  PTS  REB  AST  TO      FG   FG%      3P   3P%
--------------------------------------------------------------------------------
Lakers_8_SF             0    4    1    0   0   2/2   100.0     0/0   0.0
Lakers_2_SG             0    3    3    0   0   1/1   100.0     0/0   0.0
Lakers_6_PG             0    2    0    1   0   1/1   100.0     0/0   0.0
Lakers_3_SF             0    0    3    1   0   0/0     0.0     0/0   0.0
Lakers_9_PF             0    0    0    1   0   0/0     0.0     0/0   0.0
Lakers_7_SG             0    0    1    0   0   0/0     0.0     0/0   0.0

TEAM: FG: 4/11 (36.4%), 3PT: 1/3 (33.3%), REB: 8 (4 off, 4 def), AST: 3, TO: 5
TEAM FOULS: 9 [OPPONENT IN BONUS]

================================================================================

================================================================================
                        2ND QUARTER - Warriors vs Lakers                        
================================================================================

[12:00] Warriors possession (Score: 25-12)
Warriors_1_PG attempts a Midrange. Contested by Lakers_1_PG (5.5 feet, MAN). Warriors_1_PG misses. Offensive rebound by Warriors_1_PG! Warriors_1_PG kicks it out.

[11:45] Warriors possession (Score: 25-12)
Warriors_1_PG attempts a Midrange. Contested by Lakers_1_PG (5.6 feet, MAN). Warriors_1_PG misses. Rebound secured by Lakers_5_C.

[11:32] Lakers possession (Score: 25-12)
Lakers_5_C drives to the basket... Lakers_5_C loses the ball! TURNOVER!

[11:20] Warriors possession (Score: 25-12)
Warriors_5_C attempts a 3Pt. Contested by Lakers_5_C (6.0 feet, MAN). Warriors_5_C misses. Rebound secured by Lakers_5_C.

[11:07] Lakers possession (Score: 25-12)
Lakers_3_SF throws a bad pass! Stolen by Warriors_3_SF! TURNOVER!

[10:55] Warriors possession (Score: 25-12)
Warriors_4_PF attempts a 3Pt. Contested by Lakers_4_PF (4.8 feet, MAN). WARRIORS_4_PF MAKES IT! Assist: Warriors_3_SF
Score: 28-12

[10:42] Lakers possession (Score: 28-12)
Lakers_2_SG attempts a Midrange. Contested by Warriors_2_SG (5.5 feet, MAN). Lakers_2_SG misses. Offensive rebound by Lakers_2_SG! Lakers_2_SG kicks it out.

[10:29] Lakers possession (Score: 28-12)
Lakers_4_PF drives, picks up Warriors_4_PF. Help arrives from Warriors_1_PG! Lakers_4_PF attempts a Layup. Contested by Warriors_1_PG (5.1 feet, MAN). LAKERS_4_PF MAKES IT! Assist: Lakers_3_SF
Score: 28-14

[10:12] Warriors possession (Score: 28-14)
Warriors_1_PG attempts a 3Pt. Contested by Lakers_1_PG (5.7 feet, MAN). WARRIORS_1_PG MAKES IT! Assist: Warriors_4_PF
Score: 31-14

[09:50] Lakers possession (Score: 31-14)
Lakers_4_PF attempts a Midrange. Contested by Warriors_4_PF (5.0 feet, MAN). Lakers_4_PF misses. Rebound secured by Warriors_3_SF.

[09:50] TIMEOUT - Lakers (stop opponent momentum) - 5 timeouts remaining

[09:37] Warriors possession (Score: 31-14)
Warriors_1_PG attempts a 3Pt. Contested by Lakers_1_PG (5.6 feet, MAN). Warriors_1_PG misses. Rebound secured by Lakers_2_SG.

[09:24] Lakers possession (Score: 31-14)
Lakers_3_SF drives to the basket... Lakers_3_SF loses the ball! TURNOVER!

[09:06] Warriors possession (Score: 31-14)
Warriors_3_SF attempts a 3Pt. Contested by Lakers_3_SF (5.5 feet, MAN). Warriors_3_SF misses. Rebound secured by Lakers_5_C.

[09:06] Substitution (Lakers): Lakers_4_PF OUT (stamina: 59) → Lakers_9_PF IN (stamina)

[08:48] Lakers possession (Score: 31-14)
Lakers_9_PF attempts a Midrange. Contested by Warriors_4_PF (5.1 feet, MAN). Lakers_9_PF misses. Offensive rebound by Lakers_3_SF! Lakers_3_SF kicks it out.

[08:32] Lakers possession (Score: 31-14)
Lakers_9_PF attempts a Midrange. Contested by Warriors_4_PF (5.1 feet, MAN). LAKERS_9_PF MAKES IT!
Score: 31-16

[08:20] Warriors possession (Score: 31-16)
FOUL! Shooting foul on Lakers_1_PG. Warriors_1_PG to the line for 3 free throws. [Team fouls: 1] (Lakers_1_PG: 1 personal fouls)   FT 1/3: GOOD   FT 2/3: GOOD   FT 3/3: GOOD Warriors_1_PG makes 3/3 from the line.
Score: 34-16

[08:02] Lakers possession (Score: 34-16)
Lakers_1_PG attempts a Midrange. Contested by Warriors_1_PG (4.3 feet, MAN). Lakers_1_PG misses. Offensive rebound by Lakers_2_SG! Lakers_2_SG kicks it out.

[07:51] Lakers possession (Score: 34-16)
Lakers_1_PG attempts a Midrange. Contested by Warriors_1_PG (4.3 feet, MAN). LAKERS_1_PG MAKES IT!
Score: 34-18

[07:34] Warriors possession (Score: 34-18)
Warriors_3_SF throws a bad pass! Stolen by Lakers_3_SF! TURNOVER!

[07:20] Lakers possession (Score: 34-18)
Lakers_10_C attempts a 3Pt. Contested by Warriors_10_C (3.9 feet, MAN). Lakers_10_C misses. Rebound secured by Warriors_3_SF.

[07:20] Substitution (Warriors): Warriors_5_C OUT (stamina: 56) → Warriors_10_C IN (stamina)

[07:20] Substitution (Lakers): Lakers_5_C OUT (stamina: 57) → Lakers_10_C IN (stamina)

[07:04] Warriors possession (Score: 34-18)
Warriors_4_PF drives to the basket... Warriors_4_PF loses the ball! TURNOVER!

[06:47] Lakers possession (Score: 34-18)
Lakers_9_PF attempts a 3Pt. Contested by Warriors_10_C (3.9 feet, MAN). Lakers_9_PF misses. Rebound secured by Warriors_1_PG.

[06:47] Substitution (Lakers): Lakers_1_PG OUT (stamina: 59) → Lakers_7_SG IN (stamina)

[06:29] Warriors possession (Score: 34-18)
Warriors_10_C throws a bad pass out of bounds! TURNOVER!

[06:13] Lakers possession (Score: 34-18)
Lakers_9_PF attempts a 3Pt. Contested by Warriors_10_C (3.9 feet, MAN). Lakers_9_PF misses. Offensive rebound by Lakers_10_C! Lakers_10_C kicks it out.

[05:57] Lakers possession (Score: 34-18)
Lakers_3_SF commits an offensive foul! Warriors_3_SF drew the charge! TURNOVER!

[05:43] Warriors possession (Score: 34-18)
Warriors_10_C attempts a Layup. Contested by Lakers_10_C (3.9 feet, MAN). Warriors_10_C misses. Offensive rebound by Warriors_3_SF! Warriors_3_SF kicks it out.

[05:22] Warriors possession (Score: 34-18)
Warriors_2_SG drives, Lakers_2_SG stays with him. Warriors_2_SG attempts a Dunk. Contested by Lakers_2_SG (4.8 feet, MAN). WARRIORS_2_SG MAKES IT! Assist: Warriors_4_PF
Score: 36-18

[05:08] Lakers possession (Score: 36-18)
Lakers_2_SG attempts a 3Pt. Contested by Warriors_2_SG (5.7 feet, MAN). Lakers_2_SG misses. Rebound secured by Warriors_3_SF.

[04:48] Warriors possession (Score: 36-18)
Warriors_4_PF drives, picks up Lakers_9_PF. Help arrives from Lakers_2_SG! Warriors_4_PF attempts a Layup. Contested by Lakers_2_SG (5.2 feet, MAN). Warriors_4_PF misses. Offensive rebound by Warriors_10_C! Warriors_10_C puts it back in!
Score: 38-18

[04:35] Lakers possession (Score: 38-18)
Lakers_7_SG drives and kicks out. Lakers_10_C attempts a Midrange. Contested by Warriors_10_C (4.0 feet, MAN). Lakers_10_C misses. Rebound secured by Warriors_10_C.

[04:18] Warriors possession (Score: 38-18)
Warriors_1_PG attempts a 3Pt. Contested by Lakers_2_SG (5.0 feet, MAN). Warriors_1_PG misses. Rebound secured by Lakers_2_SG.

[03:59] Lakers possession (Score: 38-18)
Lakers_9_PF attempts a Midrange. Contested by Warriors_10_C (4.0 feet, MAN). Lakers_9_PF misses. Rebound secured by Warriors_1_PG.

[03:42] Warriors possession (Score: 38-18)
Warriors_4_PF attempts a Layup. Contested by Lakers_9_PF (5.3 feet, MAN). Warriors_4_PF misses. Offensive rebound by Warriors_10_C! Warriors_10_C kicks it out.

[03:29] Warriors possession (Score: 38-18)
Warriors_3_SF drives, Lakers_3_SF stays with him. Warriors_3_SF attempts a Layup. Contested by Lakers_3_SF (6.0 feet, MAN). WARRIORS_3_SF MAKES IT! Assist: Warriors_1_PG
Score: 40-18

[03:16] Lakers possession (Score: 40-18)
Lakers_9_PF drives, Warriors_10_C stays with him. Lakers_9_PF attempts a Layup. Contested by Warriors_10_C (4.1 feet, MAN). LAKERS_9_PF MAKES IT! Assist: Lakers_7_SG
Score: 40-20

[02:58] Warriors possession (Score: 40-20)
Warriors_10_C attempts a Midrange. Contested by Lakers_10_C (3.9 feet, MAN). WARRIORS_10_C MAKES IT!
Score: 42-20

[02:44] Lakers possession (Score: 42-20)
Lakers_2_SG attempts a 3Pt. Contested by Warriors_2_SG (6.0 feet, MAN). LAKERS_2_SG MAKES IT! Assist: Lakers_10_C
Score: 42-23

[02:26] Warriors possession (Score: 42-23)
Warriors_1_PG drives and kicks out. Warriors_4_PF attempts a Midrange. Contested by Lakers_9_PF (5.4 feet, MAN). WARRIORS_4_PF MAKES IT!
Score: 44-23

[02:09] Lakers possession (Score: 44-23)
Lakers_7_SG drives, picks up Warriors_2_SG. Help arrives from Warriors_1_PG! Lakers_7_SG attempts a Layup. Wide open! Warriors_1_PG is 6.0 feet away. [MAN] LAKERS_7_SG MAKES IT! Assist: Lakers_9_PF
Score: 44-25

[01:52] Warriors possession (Score: 44-25)
Warriors_10_C attempts a 3Pt. Contested by Lakers_10_C (4.0 feet, MAN). WARRIORS_10_C MAKES IT!
Score: 47-25

[01:37] Lakers possession (Score: 47-25)
Lakers_9_PF attempts a Midrange. Contested by Warriors_10_C (4.3 feet, MAN). Lakers_9_PF misses. Rebound secured by Warriors_3_SF.

[01:15] Warriors possession (Score: 47-25)
Warriors_3_SF attempts a 3Pt. Wide open! Lakers_3_SF is 6.2 feet away. [MAN] WARRIORS_3_SF MAKES IT! Assist: Warriors_2_SG
Score: 50-25

[00:59] Lakers possession (Score: 50-25)
Lakers_9_PF attempts a Midrange. Contested by Warriors_5_C (3.8 feet, MAN). Lakers_9_PF misses. Rebound secured by Warriors_5_C.

[00:59] Substitution (Warriors): Warriors_1_PG OUT (stamina: 57) → Warriors_7_SG IN (stamina)

[00:59] Substitution (Warriors): Warriors_2_SG OUT (stamina: 60) → Warriors_6_PG IN (minutes)

[00:59] Substitution (Warriors): Warriors_3_SF OUT (stamina: 54) → Warriors_8_SF IN (stamina)

[00:59] Substitution (Warriors): Warriors_4_PF OUT (stamina: 57) → Warriors_9_PF IN (stamina)

[00:59] Substitution (Warriors): Warriors_10_C OUT (stamina: 72) → Warriors_5_C IN (minutes)

[00:59] Substitution (Lakers): Lakers_2_SG OUT (stamina: 52) → Lakers_6_PG IN (stamina)

[00:59] Substitution (Lakers): Lakers_3_SF OUT (stamina: 58) → Lakers_8_SF IN (stamina)

[00:59] Substitution (Lakers): Lakers_10_C OUT (stamina: 80) → Lakers_5_C IN (minutes)

[00:59] TIMEOUT - Lakers (stop opponent momentum) - 4 timeouts remaining

[00:43] Warriors possession (Score: 50-25)
Warriors_5_C commits an offensive foul! Lakers_5_C drew the charge! TURNOVER!

[00:23] Lakers possession (Score: 50-25)
Lakers_6_PG drives to the basket... Lakers_6_PG loses the ball! TURNOVER!

[00:08] Warriors possession (Score: 50-25)
Warriors_8_SF attempts a 3Pt. Contested by Lakers_8_SF (4.8 feet, MAN). Warriors_8_SF misses. Rebound secured by Lakers_5_C.

================================================================================
                              2ND QUARTER COMPLETE                              
================================================================================

FINAL SCORE: Warriors 25, Lakers 13

BOX SCORE:
================================================================================

Warriors
--------------------------------------------------------------------------------
Player                MIN  PTS  REB  AST  TO      FG   FG%      3P   3P%
--------------------------------------------------------------------------------
Warriors_10_C           0    7    3    0   0   3/3   100.0     0/0   0.0
Warriors_4_PF           0    5    0    2   0   2/2   100.0     0/0   0.0
Warriors_3_SF           0    5    5    1   0   2/2   100.0     0/0   0.0
Warriors_1_PG           0    3    3    1   0   1/1   100.0     0/0   0.0
Warriors_2_SG           0    2    0    1   0   1/1   100.0     0/0   0.0
Warriors_5_C            0    0    1    0   0   0/0     0.0     0/0   0.0

TEAM: FG: 9/15 (60.0%), 3PT: 4/9 (44.4%), REB: 12 (4 off, 8 def), AST: 5, TO: 4
TEAM FOULS: 0


Lakers
--------------------------------------------------------------------------------
Player                MIN  PTS  REB  AST  TO      FG   FG%      3P   3P%
--------------------------------------------------------------------------------
Lakers_9_PF             0    4    0    1   0   2/2   100.0     0/0   0.0
Lakers_2_SG             0    3    4    0   0   1/1   100.0     0/0   0.0
Lakers_4_PF             0    2    0    0   0   1/1   100.0     0/0   0.0
Lakers_1_PG             0    2    0    0   0   1/1   100.0     0/0   0.0
Lakers_7_SG             0    2    0    1   0   1/1   100.0     0/0   0.0
Lakers_5_C              0    0    4    0   0   0/0     0.0     0/0   0.0
Lakers_3_SF             0    0    1    1   0   0/0     0.0     0/0   0.0
Lakers_10_C             0    0    1    1   0   0/0     0.0     0/0   0.0

TEAM: FG: 6/14 (42.9%), 3PT: 1/4 (25.0%), REB: 10 (4 off, 6 def), AST: 4, TO: 5
TEAM FOULS: 1

================================================================================

================================================================================
                        3RD QUARTER - Warriors vs Lakers                        
================================================================================

[12:00] Warriors possession (Score: 50-25)
Warriors_2_SG attempts a Midrange. Contested by Lakers_2_SG (4.2 feet, MAN). Warriors_2_SG misses. Offensive rebound by Warriors_1_PG! Warriors_1_PG kicks it out.

[11:44] Warriors possession (Score: 50-25)
Warriors_4_PF attempts a Midrange. Contested by Lakers_4_PF (4.7 feet, MAN). Warriors_4_PF misses. Offensive rebound by Warriors_1_PG! Warriors_1_PG kicks it out.

[11:25] Warriors possession (Score: 50-25)
Warriors_5_C attempts a 3Pt. Contested by Lakers_5_C (6.0 feet, MAN). Warriors_5_C misses. Offensive rebound by Warriors_3_SF! Warriors_3_SF kicks it out.

[11:07] Warriors possession (Score: 50-25)
FOUL! Shooting foul on Lakers_1_PG. Warriors_1_PG to the line for 3 free throws. [Team fouls: 1] (Lakers_1_PG: 1 personal fouls)   FT 1/3: GOOD   FT 2/3: GOOD   FT 3/3: GOOD Warriors_1_PG makes 3/3 from the line.
Score: 53-25

[10:55] Lakers possession (Score: 53-25)
Lakers_1_PG attempts a Midrange. Contested by Warriors_1_PG (4.2 feet, MAN). Lakers_1_PG misses. Rebound secured by Warriors_3_SF.

[10:45] Warriors possession (Score: 53-25)
Warriors_4_PF commits a violation (traveling/carry/out of bounds)! TURNOVER!

[10:28] Lakers possession (Score: 53-25)
Lakers_2_SG drives and kicks out. Lakers_2_SG attempts a 3Pt. Contested by Warriors_2_SG (5.5 feet, MAN). Lakers_2_SG misses. Offensive rebound by Lakers_2_SG! Lakers_2_SG kicks it out.

[10:17] Lakers possession (Score: 53-25)
Lakers_4_PF attempts a Layup. Contested by Warriors_4_PF (5.1 feet, MAN). LAKERS_4_PF MAKES IT! Assist: Lakers_1_PG
Score: 53-27

[10:02] Warriors possession (Score: 53-27)
Warriors_2_SG commits a violation (traveling/carry/out of bounds)! TURNOVER!

[09:48] Lakers possession (Score: 53-27)
Lakers_2_SG attempts a 3Pt. Contested by Warriors_2_SG (5.5 feet, MAN). Lakers_2_SG misses. Rebound secured by Warriors_3_SF.

[09:48] Substitution (Warriors): Warriors_5_C OUT (stamina: 59) → Warriors_10_C IN (stamina)

[09:48] Substitution (Lakers): Lakers_4_PF OUT (stamina: 57) → Lakers_9_PF IN (stamina)

[09:48] Substitution (Lakers): Lakers_5_C OUT (stamina: 60) → Lakers_10_C IN (stamina)

[09:34] Warriors possession (Score: 53-27)
Warriors_10_C attempts a 3Pt. Contested by Lakers_10_C (3.9 feet, MAN). Warriors_10_C misses. Offensive rebound by Warriors_1_PG! Warriors_1_PG kicks it out.

[09:20] Warriors possession (Score: 53-27)
Warriors_1_PG attempts a 3Pt. Contested by Lakers_1_PG (5.8 feet, MAN). WARRIORS_1_PG MAKES IT! Assist: Warriors_2_SG
Score: 56-27

[09:05] Lakers possession (Score: 56-27)
Lakers_2_SG drives and kicks out. Lakers_3_SF attempts a 3Pt. Contested by Warriors_3_SF (4.2 feet, MAN). Lakers_3_SF misses. Rebound secured by Warriors_3_SF.

[08:48] Warriors possession (Score: 56-27)
Warriors_4_PF attempts a 3Pt. Contested by Lakers_9_PF (5.0 feet, MAN). WARRIORS_4_PF MAKES IT!
Score: 59-27

[08:33] Lakers possession (Score: 59-27)
Lakers_3_SF attempts a Layup. Contested by Warriors_3_SF (4.2 feet, MAN). Lakers_3_SF misses. Offensive rebound by Lakers_2_SG! Lakers_2_SG kicks it out.

[08:18] Lakers possession (Score: 59-27)
Lakers_3_SF attempts a Layup. Contested by Warriors_3_SF (4.3 feet, MAN). LAKERS_3_SF MAKES IT! Assist: Lakers_2_SG
Score: 59-29

[07:58] Warriors possession (Score: 59-29)
Warriors_2_SG attempts a Midrange. Contested by Lakers_2_SG (4.6 feet, MAN). Warriors_2_SG misses. Rebound secured by Lakers_2_SG.

[07:44] Lakers possession (Score: 59-29)
Lakers_2_SG attempts a 3Pt. Contested by Warriors_2_SG (5.6 feet, MAN). Lakers_2_SG misses. Offensive rebound by Lakers_2_SG! Lakers_2_SG kicks it out.

[07:24] Lakers possession (Score: 59-29)
Lakers_1_PG loses the ball! Stripped by Warriors_1_PG! TURNOVER!

[07:09] Warriors possession (Score: 59-29)
Warriors_4_PF drives, picks up Lakers_9_PF. Help arrives from Lakers_2_SG! Warriors_4_PF attempts a Layup. Contested by Lakers_2_SG (5.2 feet, MAN). WARRIORS_4_PF MAKES IT!
Score: 61-29

[07:09] Substitution (Lakers): Lakers_1_PG OUT (stamina: 56) → Lakers_7_SG IN (stamina)

[06:54] Lakers possession (Score: 61-29)
Lakers_9_PF attempts a 3Pt. Contested by Warriors_4_PF (5.4 feet, MAN). Lakers_9_PF misses. Rebound secured by Warriors_3_SF.

[06:31] Warriors possession (Score: 61-29)
Warriors_1_PG drives, Lakers_2_SG stays with him. Warriors_1_PG attempts a Dunk. Contested by Lakers_2_SG (4.8 feet, MAN). Warriors_1_PG misses. Rebound secured by Lakers_3_SF.

[06:15] Lakers possession (Score: 61-29)
Lakers_7_SG attempts a Midrange. Contested by Warriors_2_SG (5.7 feet, MAN). Lakers_7_SG misses. Rebound secured by Warriors_10_C.

[05:58] Warriors possession (Score: 61-29)
Warriors_4_PF drives, Lakers_9_PF stays with him. Warriors_4_PF attempts a Layup. Contested by Lakers_9_PF (5.3 feet, MAN). Warriors_4_PF misses. Rebound secured by Lakers_10_C.

[05:44] Lakers possession (Score: 61-29)
Lakers_3_SF throws a bad pass out of bounds! TURNOVER!

[05:32] Warriors possession (Score: 61-29)
Warriors_8_SF throws a bad pass out of bounds! TURNOVER!

[05:32] Substitution (Warriors): Warriors_3_SF OUT (stamina: 59) → Warriors_8_SF IN (stamina)

[05:32] Substitution (Lakers): Lakers_2_SG OUT (stamina: 58) → Lakers_6_PG IN (stamina)

[05:15] Lakers possession (Score: 61-29)
Lakers_3_SF loses control of the ball! TURNOVER!

[05:03] Warriors possession (Score: 61-29)
Warriors_1_PG attempts a Layup. Contested by Lakers_6_PG (5.1 feet, MAN). WARRIORS_1_PG MAKES IT!
Score: 63-29

[05:03] Substitution (Warriors): Warriors_4_PF OUT (stamina: 59) → Warriors_9_PF IN (stamina)

[04:42] Lakers possession (Score: 63-29)
Lakers_8_SF throws a bad pass out of bounds! TURNOVER!

[04:42] Substitution (Lakers): Lakers_3_SF OUT (stamina: 66) → Lakers_8_SF IN (minutes)

[04:42] TIMEOUT - Lakers (stop opponent momentum) - 3 timeouts remaining

[04:25] Warriors possession (Score: 63-29)
Warriors_1_PG loses control of the ball! TURNOVER!

[04:05] Lakers possession (Score: 63-29)
Lakers_5_C attempts a 3Pt. Contested by Warriors_5_C (3.8 feet, MAN). Lakers_5_C misses. Offensive rebound by Lakers_5_C! Lakers_5_C kicks it out.

[04:05] Substitution (Warriors): Warriors_2_SG OUT (stamina: 66) → Warriors_7_SG IN (minutes)

[04:05] Substitution (Warriors): Warriors_10_C OUT (stamina: 66) → Warriors_5_C IN (minutes)

[04:05] Substitution (Lakers): Lakers_10_C OUT (stamina: 75) → Lakers_5_C IN (minutes)

[03:49] Lakers possession (Score: 63-29)
Lakers_8_SF attempts a 3Pt. Contested by Warriors_8_SF (5.3 feet, MAN). LAKERS_8_SF MAKES IT!
Score: 63-32

[03:35] Warriors possession (Score: 63-32)
Warriors_9_PF attempts a 3Pt. Contested by Lakers_9_PF (5.4 feet, MAN). Warriors_9_PF misses. Offensive rebound by Warriors_9_PF! Warriors_9_PF kicks it out.

[03:16] Warriors possession (Score: 63-32)
Warriors_1_PG attempts a 3Pt. Contested by Lakers_6_PG (5.1 feet, MAN). Warriors_1_PG misses. Rebound secured by Lakers_5_C.

[03:02] Lakers possession (Score: 63-32)
Lakers_8_SF drives and kicks out. Lakers_7_SG attempts a 3Pt. Contested by Warriors_7_SG (5.0 feet, MAN). Lakers_7_SG misses. Rebound secured by Warriors_9_PF.

[02:45] Warriors possession (Score: 63-32)
Warriors_8_SF attempts a 3Pt. Contested by Lakers_8_SF (4.8 feet, MAN). Warriors_8_SF misses. Rebound secured by Lakers_7_SG.

[02:28] Lakers possession (Score: 63-32)
Lakers_9_PF attempts a 3Pt. Contested by Warriors_5_C (3.9 feet, MAN). Lakers_9_PF misses. Rebound secured by Warriors_9_PF.

[02:11] Warriors possession (Score: 63-32)
Warriors_9_PF attempts a Midrange. Contested by Lakers_9_PF (5.5 feet, MAN). Warriors_9_PF misses. Rebound secured by Lakers_7_SG.

[01:56] Lakers possession (Score: 63-32)
Lakers_7_SG attempts a 3Pt. Contested by Warriors_7_SG (5.0 feet, MAN). Lakers_7_SG misses. Offensive rebound by Lakers_8_SF! Lakers_8_SF kicks it out.

[01:43] Lakers possession (Score: 63-32)
Lakers_8_SF attempts a 3Pt. Contested by Warriors_8_SF (5.3 feet, MAN). Lakers_8_SF misses. Rebound secured by Warriors_8_SF.

[01:28] Warriors possession (Score: 63-32)
Warriors_1_PG attempts a 3Pt. Contested by Lakers_6_PG (5.3 feet, MAN). Warriors_1_PG misses. Offensive rebound by Warriors_9_PF! Warriors_9_PF kicks it out.

[01:15] Warriors possession (Score: 63-32)
Warriors_5_C drives, Lakers_5_C stays with him. Warriors_5_C attempts a Dunk. Contested by Lakers_5_C (5.8 feet, MAN). Warriors_5_C misses. Offensive rebound by Warriors_9_PF! Warriors_9_PF kicks it out.

[00:56] Warriors possession (Score: 63-32)
Warriors_1_PG attempts a 3Pt. Contested by Lakers_6_PG (5.3 feet, MAN). Warriors_1_PG misses. Offensive rebound by Warriors_9_PF! Warriors_9_PF kicks it out.

[00:38] Warriors possession (Score: 63-32)
Warriors_8_SF attempts a 3Pt. Contested by Lakers_8_SF (4.9 feet, MAN). Warriors_8_SF misses. Rebound secured by Lakers_7_SG.

[00:18] Lakers possession (Score: 63-32)
Lakers_7_SG drives, Warriors_7_SG stays with him. Lakers_7_SG attempts a Layup. Contested by Warriors_7_SG (5.1 feet, MAN). Lakers_7_SG misses. Rebound secured by Warriors_5_C.

================================================================================
                              3RD QUARTER COMPLETE                              
================================================================================

FINAL SCORE: Warriors 13, Lakers 7

BOX SCORE:
================================================================================

Warriors
--------------------------------------------------------------------------------
Player                MIN  PTS  REB  AST  TO      FG   FG%      3P   3P%
--------------------------------------------------------------------------------
Warriors_1_PG           0    5    3    0   0   2/2   100.0     0/0   0.0
Warriors_4_PF           0    5    0    0   0   2/2   100.0     0/0   0.0
Warriors_3_SF           0    0    5    0   0   0/0     0.0     0/0   0.0
Warriors_2_SG           0    0    0    1   0   0/0     0.0     0/0   0.0
Warriors_10_C           0    0    1    0   0   0/0     0.0     0/0   0.0
Warriors_9_PF           0    0    6    0   0   0/0     0.0     0/0   0.0
Warriors_8_SF           0    0    1    0   0   0/0     0.0     0/0   0.0
Warriors_5_C            0    0    1    0   0   0/0     0.0     0/0   0.0

TEAM: FG: 4/11 (36.4%), 3PT: 2/5 (40.0%), REB: 17 (8 off, 9 def), AST: 1, TO: 4
TEAM FOULS: 0


Lakers
--------------------------------------------------------------------------------
Player                MIN  PTS  REB  AST  TO      FG   FG%      3P   3P%
--------------------------------------------------------------------------------
Lakers_8_SF             0    3    1    0   0   1/1   100.0     0/0   0.0
Lakers_4_PF             0    2    0    0   0   1/1   100.0     0/0   0.0
Lakers_3_SF             0    2    1    0   0   1/1   100.0     0/0   0.0
Lakers_2_SG             0    0    4    1   0   0/0     0.0     0/0   0.0
Lakers_1_PG             0    0    0    1   0   0/0     0.0     0/0   0.0
Lakers_10_C             0    0    1    0   0   0/0     0.0     0/0   0.0
Lakers_5_C              0    0    2    0   0   0/0     0.0     0/0   0.0
Lakers_7_SG             0    0    3    0   0   0/0     0.0     0/0   0.0

TEAM: FG: 3/12 (25.0%), 3PT: 1/5 (20.0%), REB: 12 (5 off, 7 def), AST: 2, TO: 4
TEAM FOULS: 1

================================================================================

================================================================================
                        4TH QUARTER - Warriors vs Lakers                        
================================================================================

[12:00] Warriors possession (Score: 63-32)
Warriors_4_PF attempts a Midrange. Contested by Lakers_4_PF (4.7 feet, MAN). Warriors_4_PF misses. Offensive rebound by Warriors_1_PG! Warriors_1_PG kicks it out.

[11:47] Warriors possession (Score: 63-32)
Warriors_1_PG drives and kicks out. Warriors_2_SG attempts a 3Pt. Contested by Lakers_2_SG (4.2 feet, MAN). Warriors_2_SG misses. Rebound secured by Lakers_5_C.

[11:27] Lakers possession (Score: 63-32)
Lakers_4_PF attempts a 3Pt. Contested by Warriors_4_PF (5.0 feet, MAN). Lakers_4_PF misses. Rebound secured by Warriors_1_PG.

[11:14] Warriors possession (Score: 63-32)
FOUL! Reach-in foul on Lakers_5_C during the drive. [Team fouls: 1] No free throws, side out. (Lakers_5_C: 1 personal fouls)

[10:59] Lakers possession (Score: 63-32)
Lakers_5_C attempts a Midrange. Contested by Warriors_5_C (4.3 feet, MAN). Lakers_5_C misses. Offensive rebound by Lakers_2_SG! Lakers_2_SG kicks it out.

[10:38] Lakers possession (Score: 63-32)
Lakers_2_SG makes the 3Pt and draws the foul on Warriors_2_SG! And-1! Lakers_2_SG to the line for 1. [Team fouls: 2] (Warriors_2_SG: 1 personal fouls)   FT 1/1: GOOD Lakers_2_SG makes 1/1 from the line.
Score: 63-36

[10:26] Warriors possession (Score: 63-36)
Warriors_2_SG attempts a Layup. Contested by Lakers_2_SG (4.4 feet, MAN). Warriors_2_SG misses. Rebound secured by Lakers_3_SF.

[10:12] Lakers possession (Score: 63-36)
Lakers_4_PF drives, Warriors_4_PF stays with him. Lakers_4_PF attempts a Dunk. Contested by Warriors_4_PF (5.1 feet, MAN). Lakers_4_PF misses. Rebound secured by Warriors_3_SF.

[09:54] Warriors possession (Score: 63-36)
Warriors_3_SF attempts a 3Pt. Contested by Lakers_3_SF (5.5 feet, MAN). Warriors_3_SF misses. Rebound secured by Lakers_5_C.

[09:40] Lakers possession (Score: 63-36)
FOUL! Shooting foul on Warriors_1_PG. Lakers_1_PG to the line for 3 free throws. [Team fouls: 3] (Warriors_1_PG: 1 personal fouls)   FT 1/3: GOOD   FT 2/3: GOOD   FT 3/3: GOOD Lakers_1_PG makes 3/3 from the line.
Score: 63-39

[09:28] Warriors possession (Score: 63-39)
Warriors_3_SF attempts a 3Pt. Contested by Lakers_3_SF (5.5 feet, MAN). Warriors_3_SF misses. Rebound secured by Lakers_2_SG.

[09:28] TIMEOUT - Warriors (stop opponent momentum) - 6 timeouts remaining

[09:13] Lakers possession (Score: 63-39)
Lakers_2_SG attempts a 3Pt. Contested by Warriors_2_SG (5.5 feet, MAN). Lakers_2_SG misses. Rebound secured by Warriors_3_SF.

[08:54] Warriors possession (Score: 63-39)
Warriors_3_SF attempts a 3Pt. Contested by Lakers_3_SF (5.5 feet, MAN). Warriors_3_SF misses. Rebound secured by Lakers_3_SF.

[08:36] Lakers possession (Score: 63-39)
Lakers_4_PF attempts a Layup. Contested by Warriors_4_PF (5.1 feet, MAN). LAKERS_4_PF MAKES IT! Assist: Lakers_2_SG
Score: 63-41

[08:21] Warriors possession (Score: 63-41)
Warriors_5_C attempts a Layup. Wide open! Lakers_5_C is 6.1 feet away. [MAN] WARRIORS_5_C MAKES IT! Assist: Warriors_3_SF
Score: 65-41

[08:07] Lakers possession (Score: 65-41)
FOUL! Shooting foul on Warriors_2_SG. Lakers_2_SG to the line for 2 free throws. [Team fouls: 4] (Warriors_2_SG: 2 personal fouls)   FT 1/2: MISS   FT 2/2: GOOD Lakers_2_SG makes 1/2 from the line.
Score: 65-42

[07:48] Warriors possession (Score: 65-42)
Warriors_1_PG drives, Lakers_1_PG stays with him. Warriors_1_PG attempts a Layup. Contested by Lakers_1_PG (5.8 feet, MAN). Warriors_1_PG misses. Rebound secured by Lakers_2_SG.

[07:48] Substitution (Warriors): Warriors_5_C OUT (stamina: 58) → Warriors_10_C IN (stamina)

[07:48] Substitution (Lakers): Lakers_4_PF OUT (stamina: 56) → Lakers_9_PF IN (stamina)

[07:48] Substitution (Lakers): Lakers_5_C OUT (stamina: 59) → Lakers_10_C IN (stamina)

[07:37] Lakers possession (Score: 65-42)
Lakers_2_SG attempts a 3Pt. Contested by Warriors_2_SG (5.5 feet, MAN). Lakers_2_SG misses. Offensive rebound by Lakers_10_C! Lakers_10_C kicks it out.

[07:20] Lakers possession (Score: 65-42)
Lakers_9_PF attempts a Midrange. Contested by Warriors_10_C (3.9 feet, MAN). LAKERS_9_PF MAKES IT!
Score: 65-44

[07:01] Warriors possession (Score: 65-44)
Warriors_3_SF attempts a Layup. Contested by Lakers_3_SF (5.6 feet, MAN). WARRIORS_3_SF MAKES IT! Assist: Warriors_10_C
Score: 67-44

[06:45] Lakers possession (Score: 67-44)
Lakers_9_PF attempts a 3Pt. Contested by Warriors_10_C (3.9 feet, MAN). Lakers_9_PF misses. Offensive rebound by Lakers_10_C! Lakers_10_C kicks it out.

[06:28] Lakers possession (Score: 67-44)
Lakers_10_C attempts a Layup. Contested by Warriors_10_C (3.9 feet, MAN). Lakers_10_C misses. Offensive rebound by Lakers_2_SG! Lakers_2_SG kicks it out.

[06:17] Lakers possession (Score: 67-44)
Lakers_1_PG drives to the basket... Lakers_1_PG loses the ball! TURNOVER!

[06:01] Warriors possession (Score: 67-44)
Warriors_1_PG drives and kicks out. Warriors_4_PF attempts a 3Pt. Contested by Lakers_9_PF (4.9 feet, MAN). Warriors_4_PF misses. Offensive rebound by Warriors_3_SF! Warriors_3_SF kicks it out.

[06:01] Substitution (Lakers): Lakers_1_PG OUT (stamina: 57) → Lakers_7_SG IN (stamina)

[05:45] Warriors possession (Score: 67-44)
Warriors_3_SF drives and kicks out. FOUL! Shooting foul on Lakers_2_SG. Warriors_7_SG to the line for 3 free throws. [BONUS: 5 team fouls] (Lakers_2_SG: 1 personal fouls)   FT 1/3: GOOD   FT 2/3: GOOD   FT 3/3: GOOD Warriors_7_SG makes 3/3 from the line.
Score: 70-44

[05:45] Substitution (Warriors): Warriors_1_PG OUT (stamina: 69) → Warriors_6_PG IN (blowout_rest)

[05:45] Substitution (Warriors): Warriors_2_SG OUT (stamina: 72) → Warriors_7_SG IN (blowout_rest)

[05:30] Lakers possession (Score: 70-44)
Lakers_7_SG attempts a 3Pt. Contested by Warriors_7_SG (5.0 feet, MAN). Lakers_7_SG misses. Rebound secured by Warriors_3_SF.

[05:14] Warriors possession (Score: 70-44)
Warriors_6_PG attempts a 3Pt. Contested by Lakers_2_SG (4.8 feet, MAN). Warriors_6_PG misses. Rebound secured by Lakers_10_C.

[04:56] Lakers possession (Score: 70-44)
Lakers_3_SF attempts a 3Pt. Contested by Warriors_3_SF (4.5 feet, MAN). Lakers_3_SF misses. Offensive rebound by Lakers_2_SG! Lakers_2_SG kicks it out.

[04:38] Lakers possession (Score: 70-44)
Lakers_7_SG attempts a Layup. Contested by Warriors_7_SG (5.0 feet, MAN). Lakers_7_SG misses. Offensive rebound by Lakers_2_SG! Lakers_2_SG kicks it out.

[04:21] Lakers possession (Score: 70-44)
Lakers_7_SG attempts a Layup. Contested by Warriors_7_SG (5.0 feet, MAN). Lakers_7_SG misses. Offensive rebound by Lakers_10_C! Lakers_10_C kicks it out.

[04:01] Lakers possession (Score: 70-44)
Lakers_2_SG drives and kicks out. Lakers_10_C attempts a Midrange. Contested by Warriors_10_C (4.1 feet, MAN). Lakers_10_C misses. Rebound secured by Warriors_3_SF.

[03:44] Warriors possession (Score: 70-44)
Warriors_6_PG attempts a Midrange. Contested by Lakers_2_SG (5.0 feet, MAN). Warriors_6_PG misses. Rebound secured by Lakers_10_C.

[03:24] Lakers possession (Score: 70-44)
Lakers_10_C attempts a 3Pt. Contested by Warriors_10_C (4.1 feet, MAN). Lakers_10_C misses. Rebound secured by Warriors_3_SF.

[03:06] Warriors possession (Score: 70-44)
Warriors_6_PG drives, picks up Lakers_2_SG. Help arrives from Lakers_3_SF! Warriors_6_PG attempts a Dunk. Contested by Lakers_3_SF (5.1 feet, MAN). WARRIORS_6_PG MAKES IT!
Score: 72-44

[02:52] Lakers possession (Score: 72-44)
Lakers_3_SF attempts a 3Pt. Contested by Warriors_3_SF (4.8 feet, MAN). Lakers_3_SF misses. Rebound secured by Warriors_7_SG.

[02:39] Warriors possession (Score: 72-44)
Warriors_6_PG attempts a Midrange. Contested by Lakers_2_SG (5.2 feet, MAN). WARRIORS_6_PG MAKES IT! Assist: Warriors_10_C
Score: 74-44

[02:23] Lakers possession (Score: 74-44)
Lakers_3_SF attempts a Midrange. Contested by Warriors_3_SF (4.8 feet, MAN). Lakers_3_SF misses. Rebound secured by Warriors_7_SG.

[02:05] Warriors possession (Score: 74-44)
Warriors_6_PG drives to the basket... Warriors_6_PG loses the ball! TURNOVER!

[01:43] Lakers possession (Score: 74-44)
Lakers_5_C drives, Warriors_5_C stays with him. Lakers_5_C attempts a Layup. Contested by Warriors_5_C (3.9 feet, MAN). Lakers_5_C misses. Offensive rebound by Lakers_5_C! Lakers_5_C kicks it out.

[01:43] Substitution (Warriors): Warriors_3_SF OUT (stamina: 53) → Warriors_8_SF IN (stamina)

[01:43] Substitution (Warriors): Warriors_4_PF OUT (stamina: 56) → Warriors_9_PF IN (stamina)

[01:43] Substitution (Warriors): Warriors_10_C OUT (stamina: 68) → Warriors_5_C IN (minutes)

[01:43] Substitution (Lakers): Lakers_2_SG OUT (stamina: 50) → Lakers_6_PG IN (stamina)

[01:43] Substitution (Lakers): Lakers_3_SF OUT (stamina: 56) → Lakers_8_SF IN (stamina)

[01:43] Substitution (Lakers): Lakers_10_C OUT (stamina: 75) → Lakers_5_C IN (minutes)

[01:20] Lakers possession (Score: 74-44)
Lakers_5_C drives, Warriors_5_C stays with him. Lakers_5_C attempts a Dunk. Contested by Warriors_5_C (3.9 feet, MAN). Lakers_5_C misses. Rebound secured by Warriors_9_PF.

[01:05] Warriors possession (Score: 74-44)
Warriors_6_PG makes the 3Pt and draws the foul on Lakers_6_PG! And-1! Warriors_6_PG to the line for 1. [BONUS: 6 team fouls] (Lakers_6_PG: 1 personal fouls)   FT 1/1: GOOD Warriors_6_PG makes 1/1 from the line.
Score: 78-44

[00:54] Lakers possession (Score: 78-44)
Lakers_5_C attempts a 3Pt. Contested by Warriors_5_C (3.8 feet, MAN). Lakers_5_C misses. Offensive rebound by Lakers_5_C! Lakers_5_C kicks it out.

[00:54] TIMEOUT - Lakers (stop opponent momentum) - 2 timeouts remaining

[00:40] Lakers possession (Score: 78-44)
Lakers_8_SF drives to the basket... Lakers_8_SF loses the ball! TURNOVER!

[00:25] Warriors possession (Score: 78-44)
Warriors_9_PF drives and kicks out. Warriors_5_C attempts a 3Pt. Contested by Lakers_5_C (5.7 feet, MAN). Warriors_5_C misses. Offensive rebound by Warriors_5_C! Warriors_5_C kicks it out.

[00:05] Warriors possession (Score: 78-44)
Warriors_8_SF drives, Lakers_8_SF stays with him. Warriors_8_SF attempts a Dunk. Contested by Lakers_8_SF (4.8 feet, MAN). Warriors_8_SF misses. Rebound secured by Lakers_5_C.

================================================================================
                              4TH QUARTER COMPLETE                              
================================================================================

FINAL SCORE: Warriors 15, Lakers 12

BOX SCORE:
================================================================================

Warriors
--------------------------------------------------------------------------------
Player                MIN  PTS  REB  AST  TO      FG   FG%      3P   3P%
--------------------------------------------------------------------------------
Warriors_6_PG           0    4    0    0   0   2/2   100.0     0/0   0.0
Warriors_3_SF           0    2    6    1   0   1/1   100.0     0/0   0.0
Warriors_5_C            0    2    1    0   0   1/1   100.0     0/0   0.0
Warriors_1_PG           0    0    2    0   0   0/0     0.0     0/0   0.0
Warriors_10_C           0    0    0    2   0   0/0     0.0     0/0   0.0
Warriors_7_SG           0    0    2    0   0   0/0     0.0     0/0   0.0
Warriors_9_PF           0    0    1    0   0   0/0     0.0     0/0   0.0

TEAM: FG: 4/13 (30.8%), 3PT: 0/4 (0.0%), REB: 12 (3 off, 9 def), AST: 3, TO: 1
TEAM FOULS: 0


Lakers
--------------------------------------------------------------------------------
Player                MIN  PTS  REB  AST  TO      FG   FG%      3P   3P%
--------------------------------------------------------------------------------
Lakers_4_PF             0    2    0    0   0   1/1   100.0     0/0   0.0
Lakers_9_PF             0    2    0    0   0   1/1   100.0     0/0   0.0
Lakers_5_C              0    0    5    0   0   0/0     0.0     0/0   0.0
Lakers_2_SG             0    0    6    1   0   0/0     0.0     0/0   0.0
Lakers_3_SF             0    0    2    0   0   0/0     0.0     0/0   0.0
Lakers_10_C             0    0    5    0   0   0/0     0.0     0/0   0.0

TEAM: FG: 2/11 (18.2%), 3PT: 0/5 (0.0%), REB: 18 (9 off, 9 def), AST: 1, TO: 2
TEAM FOULS: 6 [OPPONENT IN BONUS]

================================================================================