GAME 3 - Timeout Validation
================================================================================

Final Score: Warriors 77, Lakers 94

Timeout Summary:
  Home Timeouts Used: 3/7
  Away Timeouts Used: 1/7
  Total Timeouts: 4
  Illegal Timeouts: 0

================================================================================
PLAY-BY-PLAY
================================================================================

================================================================================
                        1ST QUARTER - Warriors vs Lakers                        
================================================================================

[12:00] Warriors possession (Score: 0-0)
Warriors_1_PG attempts a 3Pt. Contested by Lakers_1_PG (4.0 feet, MAN). Warriors_1_PG misses. Rebound secured by Lakers_4_PF.

[11:48] Lakers possession (Score: 0-0)
Lakers_3_SF attempts a Midrange. Contested by Warriors_3_SF (5.3 feet, MAN). Lakers_3_SF misses. FOUL! Loose ball foul on Warriors_4_PF during the rebound battle. [Team fouls: 1] No free throws, side out. (Warriors_4_PF: 1 personal fouls)

[11:28] Lakers possession (Score: 0-0)
Lakers_4_PF drives, picks up Warriors_4_PF. Help arrives from Warriors_1_PG! Lakers_4_PF attempts a Dunk. Contested by Warriors_1_PG (5.9 feet, MAN). LAKERS_4_PF MAKES IT!
Score: 0-2

[11:09] Warriors possession (Score: 0-2)
FOUL! Shooting foul on Lakers_1_PG. Warriors_1_PG to the line for 2 free throws. [Team fouls: 2] (Lakers_1_PG: 1 personal fouls)   FT 1/2: GOOD   FT 2/2: GOOD Warriors_1_PG makes 2/2 from the line.
Score: 2-2

[10:51] Lakers possession (Score: 2-2)
Lakers_1_PG attempts a 3Pt. Contested by Warriors_1_PG (5.7 feet, MAN). LAKERS_1_PG MAKES IT! Assist: Lakers_2_SG
Score: 2-5

[10:36] Warriors possession (Score: 2-5)
Warriors_2_SG attempts a Midrange. Contested by Lakers_2_SG (5.1 feet, MAN). Warriors_2_SG misses. Offensive rebound by Warriors_3_SF! Warriors_3_SF kicks it out.

[10:19] Warriors possession (Score: 2-5)
Warriors_2_SG attempts a Midrange. Contested by Lakers_2_SG (5.2 feet, MAN). Warriors_2_SG misses. Offensive rebound by Warriors_4_PF! Warriors_4_PF kicks it out.

[10:06] Warriors possession (Score: 2-5)
Warriors_1_PG drives to the basket... Warriors_1_PG loses the ball! TURNOVER!

[09:50] Lakers possession (Score: 2-5)
Lakers_1_PG throws a bad pass out of bounds! TURNOVER!

[09:50] Substitution (Warriors): Warriors_5_C OUT (stamina: 56) → Warriors_10_C IN (stamina)

[09:34] Warriors possession (Score: 2-5)
Warriors_1_PG attempts a 3Pt. Contested by Lakers_1_PG (4.3 feet, MAN). Warriors_1_PG misses. Rebound secured by Lakers_3_SF.

[09:16] Lakers possession (Score: 2-5)
Lakers_5_C attempts a Midrange. Contested by Warriors_10_C (5.1 feet, MAN). Lakers_5_C misses. Offensive rebound by Lakers_3_SF! Lakers_3_SF kicks it out.

[09:01] Lakers possession (Score: 2-5)
Lakers_3_SF attempts a Layup. Contested by Warriors_3_SF (5.4 feet, MAN). Lakers_3_SF misses. Offensive rebound by Lakers_3_SF! Lakers_3_SF kicks it out.

[08:49] Lakers possession (Score: 2-5)
FOUL! Shooting foul on Warriors_2_SG. Lakers_2_SG to the line for 2 free throws. [Team fouls: 3] (Warriors_2_SG: 1 personal fouls)   FT 1/2: GOOD   FT 2/2: GOOD Lakers_2_SG makes 2/2 from the line.
Score: 2-7

[08:30] Warriors possession (Score: 2-7)
Warriors_2_SG commits an offensive foul! Lakers_2_SG drew the charge! TURNOVER!

[08:17] Lakers possession (Score: 2-7)
Lakers_4_PF throws a bad pass! Stolen by Warriors_4_PF! TURNOVER!

[08:17] Substitution (Lakers): Lakers_2_SG OUT (stamina: 59) → Lakers_6_PG IN (stamina)

[07:57] Warriors possession (Score: 2-7)
Warriors_3_SF attempts a 3Pt. Contested by Lakers_3_SF (5.2 feet, MAN). Warriors_3_SF misses. Rebound secured by Lakers_1_PG.

[07:46] Lakers possession (Score: 2-7)
Lakers_3_SF drives, Warriors_3_SF stays with him. Lakers_3_SF attempts a Dunk. Contested by Warriors_3_SF (5.5 feet, MAN). Lakers_3_SF misses. Offensive rebound by Lakers_4_PF! Lakers_4_PF kicks it out.

[07:25] Lakers possession (Score: 2-7)
Lakers_1_PG drives, Warriors_1_PG stays with him. Lakers_1_PG attempts a Dunk. Contested by Warriors_1_PG (6.0 feet, MAN). LAKERS_1_PG MAKES IT! Assist: Lakers_3_SF
Score: 2-9

[07:12] Warriors possession (Score: 2-9)
Warriors_10_C attempts a Midrange. Contested by Lakers_5_C (4.9 feet, MAN). WARRIORS_10_C MAKES IT! Assist: Warriors_3_SF
Score: 4-9

[06:56] Lakers possession (Score: 4-9)
Lakers_5_C commits a violation (traveling/carry/out of bounds)! TURNOVER!

[06:42] Warriors possession (Score: 4-9)
Warriors_10_C attempts a 3Pt. Contested by Lakers_5_C (4.9 feet, MAN). WARRIORS_10_C MAKES IT! Assist: Warriors_1_PG
Score: 7-9

[06:42] Substitution (Lakers): Lakers_1_PG OUT (stamina: 57) → Lakers_7_SG IN (stamina)

[06:29] Lakers possession (Score: 7-9)
Lakers_7_SG attempts a 3Pt. Contested by Warriors_2_SG (5.5 feet, MAN). Lakers_7_SG misses. Rebound secured by Warriors_1_PG.

[06:12] Warriors possession (Score: 7-9)
Warriors_1_PG attempts a 3Pt. Contested by Lakers_6_PG (4.9 feet, MAN). WARRIORS_1_PG MAKES IT! Assist: Warriors_4_PF
Score: 10-9

[06:00] Lakers possession (Score: 10-9)
FOUL! Reach-in foul on Warriors_1_PG during the drive. [Team fouls: 4] No free throws, side out. (Warriors_1_PG: 1 personal fouls)

[05:45] Warriors possession (Score: 10-9)
Warriors_7_SG attempts a Layup. Contested by Lakers_7_SG (5.0 feet, MAN). WARRIORS_7_SG MAKES IT!
Score: 12-9

[05:45] Substitution (Warriors): Warriors_1_PG OUT (stamina: 57) → Warriors_6_PG IN (stamina)

[05:45] Substitution (Warriors): Warriors_2_SG OUT (stamina: 57) → Warriors_7_SG IN (stamina)

[05:45] Substitution (Warriors): Warriors_10_C OUT (stamina: 57) → Warriors_5_C IN (stamina)

[05:45] Substitution (Lakers): Lakers_3_SF OUT (stamina: 57) → Lakers_8_SF IN (stamina)

[05:30] Lakers possession (Score: 12-9)
Lakers_4_PF attempts a 3Pt. Wide open! Warriors_4_PF is 6.1 feet away. [MAN] Lakers_4_PF misses. Rebound secured by Warriors_6_PG.

[05:07] Warriors possession (Score: 12-9)
FOUL! Reach-in foul on Lakers_4_PF during the drive. [IN THE BONUS! 5 team fouls] Warriors_4_PF to the line for 2 free throws. (Lakers_4_PF: 1 personal fouls)   FT 1/2: GOOD   FT 2/2: MISS Warriors_4_PF makes 1/2 from the line. Rebound secured by Lakers_4_PF.
Score: 13-9

[04:51] Lakers possession (Score: 13-9)
Lakers_6_PG attempts a 3Pt. Contested by Warriors_6_PG (4.1 feet, MAN). Lakers_6_PG misses. Rebound secured by Warriors_9_PF.

[04:51] Substitution (Warriors): Warriors_3_SF OUT (stamina: 61) → Warriors_8_SF IN (minutes)

[04:51] Substitution (Warriors): Warriors_4_PF OUT (stamina: 67) → Warriors_9_PF IN (minutes)

[04:51] Substitution (Lakers): Lakers_4_PF OUT (stamina: 65) → Lakers_9_PF IN (minutes)

[04:51] Substitution (Lakers): Lakers_5_C OUT (stamina: 66) → Lakers_10_C IN (minutes)

[04:34] Warriors possession (Score: 13-9)
Warriors_5_C drives to the basket... Warriors_5_C loses the ball! TURNOVER!

[04:19] Lakers possession (Score: 13-9)
Lakers_10_C attempts a 3Pt. Contested by Warriors_5_C (5.4 feet, MAN). Lakers_10_C misses. Rebound secured by Warriors_7_SG.

[04:01] Warriors possession (Score: 13-9)
Warriors_8_SF attempts a Midrange. Contested by Lakers_8_SF (4.1 feet, MAN). Warriors_8_SF misses. Rebound secured by Lakers_9_PF.

[03:43] Lakers possession (Score: 13-9)
Lakers_8_SF attempts a Layup. Contested by Warriors_8_SF (5.2 feet, MAN). Lakers_8_SF misses. Rebound secured by Warriors_7_SG.

[03:29] Warriors possession (Score: 13-9)
Warriors_6_PG attempts a Layup. Contested by Lakers_6_PG (5.1 feet, MAN). WARRIORS_6_PG MAKES IT! Assist: Warriors_8_SF
Score: 15-9

[03:11] Lakers possession (Score: 15-9)
Lakers_7_SG attempts a 3Pt. Contested by Warriors_7_SG (4.2 feet, MAN). LAKERS_7_SG MAKES IT! Assist: Lakers_8_SF
Score: 15-12

[02:52] Warriors possession (Score: 15-12)
Warriors_6_PG attempts a 3Pt. Contested by Lakers_6_PG (5.2 feet, MAN). WARRIORS_6_PG MAKES IT! Assist: Warriors_9_PF
Score: 18-12

[02:34] Lakers possession (Score: 18-12)
Lakers_7_SG drives to the basket... Lakers_7_SG loses the ball! TURNOVER!

[02:16] Warriors possession (Score: 18-12)
Warriors_10_C attempts a Midrange. Contested by Lakers_10_C (4.5 feet, MAN). Warriors_10_C misses. Rebound secured by Lakers_9_PF.

[02:16] Substitution (Warriors): Warriors_5_C OUT (stamina: 58) → Warriors_10_C IN (stamina)

[02:03] Lakers possession (Score: 18-12)
Lakers_6_PG attempts a Midrange. Contested by Warriors_6_PG (4.1 feet, MAN). Lakers_6_PG misses. Offensive rebound by Lakers_10_C! Lakers_10_C kicks it out.

[01:51] Lakers possession (Score: 18-12)
Lakers_10_C drives, Warriors_10_C stays with him. Lakers_10_C attempts a Layup. Contested by Warriors_10_C (5.2 feet, MAN). LAKERS_10_C MAKES IT!
Score: 18-14

[01:36] Warriors possession (Score: 18-14)
Warriors_10_C throws a bad pass! Stolen by Lakers_10_C! TURNOVER!

[01:22] Lakers possession (Score: 18-14)
Lakers_8_SF drives and kicks out. Lakers_2_SG attempts a 3Pt. Contested by Warriors_7_SG (4.4 feet, MAN). Lakers_2_SG misses. Offensive rebound by Lakers_9_PF! Lakers_9_PF puts it back in!
Score: 18-16

[01:22] Substitution (Lakers): Lakers_7_SG OUT (stamina: 60) → Lakers_2_SG IN (stamina)

[01:04] Warriors possession (Score: 18-16)
Warriors_9_PF attempts a 3Pt. Contested by Lakers_9_PF (4.6 feet, MAN). Warriors_9_PF misses. Rebound secured by Lakers_8_SF.

[00:49] Lakers possession (Score: 18-16)
Lakers_10_C drives to the basket... Lakers_10_C loses the ball! TURNOVER!

[00:34] Warriors possession (Score: 18-16)
Warriors_8_SF attempts a 3Pt. Contested by Lakers_8_SF (4.4 feet, MAN). Warriors_8_SF misses. Rebound secured by Lakers_9_PF.

[00:14] Lakers possession (Score: 18-16)
Lakers_2_SG attempts a 3Pt. Contested by Warriors_7_SG (4.5 feet, MAN). Lakers_2_SG misses. Rebound secured by Warriors_9_PF.

================================================================================
                              1ST QUARTER COMPLETE                              
================================================================================

FINAL SCORE: Warriors 18, Lakers 16

BOX SCORE:
================================================================================

Warriors
--------------------------------------------------------------------------------
Player                MIN  PTS  REB  AST  TO      FG   FG%      3P   3P%
--------------------------------------------------------------------------------
Warriors_10_C           0    5    0    0   0   2/2   100.0     0/0   0.0
Warriors_6_PG           0    5    1    0   0   2/2   100.0     0/0   0.0
Warriors_1_PG           0    3    1    1   0   1/1   100.0     0/0   0.0
Warriors_7_SG           0    2    2    0   0   1/1   100.0     0/0   0.0
Warriors_3_SF           0    0    1    1   0   0/0     0.0     0/0   0.0
Warriors_4_PF           0    0    1    1   0   0/0     0.0     0/0   0.0
Warriors_9_PF           0    0    2    1   0   0/0     0.0     0/0   0.0
Warriors_8_SF           0    0    0    1   0   0/0     0.0     0/0   0.0

TEAM: FG: 6/14 (42.9%), 3PT: 3/8 (37.5%), REB: 8 (2 off, 6 def), AST: 5, TO: 4
TEAM FOULS: 0


Lakers
--------------------------------------------------------------------------------
Player                MIN  PTS  REB  AST  TO      FG   FG%      3P   3P%
--------------------------------------------------------------------------------
Lakers_1_PG             0    5    1    0   0   2/2   100.0     0/0   0.0
Lakers_7_SG             0    3    0    0   0   1/1   100.0     0/0   0.0
Lakers_4_PF             0    2    3    0   0   1/1   100.0     0/0   0.0
Lakers_9_PF             0    2    4    0   0   1/1   100.0     0/0   0.0
Lakers_10_C             0    2    1    0   0   1/1   100.0     0/0   0.0
Lakers_3_SF             0    0    4    1   0   0/0     0.0     0/0   0.0
Lakers_2_SG             0    0    0    1   0   0/0     0.0     0/0   0.0
Lakers_8_SF             0    0    1    1   0   0/0     0.0     0/0   0.0

TEAM: FG: 6/12 (50.0%), 3PT: 2/7 (28.6%), REB: 14 (6 off, 8 def), AST: 3, TO: 5
TEAM FOULS: 5 [OPPONENT IN BONUS]

================================================================================

================================================================================
                        2ND QUARTER - Warriors vs Lakers                        
================================================================================

[12:00] Warriors possession (Score: 18-16)
Warriors_1_PG attempts a 3Pt. Contested by Lakers_1_PG (4.0 feet, MAN). Warriors_1_PG misses. FOUL! Loose ball foul on Lakers_3_SF during the rebound battle. [Team fouls: 1] No free throws, side out. (Lakers_3_SF: 1 personal fouls)

[11:41] Warriors possession (Score: 18-16)
Warriors_2_SG drives to the basket... Warriors_2_SG loses the ball! TURNOVER!

[11:22] Lakers possession (Score: 18-16)
FOUL! Shooting foul on Warriors_1_PG. Lakers_1_PG to the line for 3 free throws. [Team fouls: 2] (Warriors_1_PG: 1 personal fouls)   FT 1/3: GOOD   FT 2/3: GOOD   FT 3/3: GOOD Lakers_1_PG makes 3/3 from the line.
Score: 18-19

[11:10] Warriors possession (Score: 18-19)
Warriors_2_SG makes the Layup and draws the foul on Lakers_2_SG! And-1! Warriors_2_SG to the line for 1. [Team fouls: 3] (Lakers_2_SG: 1 personal fouls)   FT 1/1: MISS Warriors_2_SG makes 0/1 from the line. Rebound secured by Lakers_1_PG.
Score: 20-19

[10:58] Lakers possession (Score: 20-19)
Lakers_2_SG makes the 3Pt and draws the foul on Warriors_2_SG! And-1! Lakers_2_SG to the line for 1. [Team fouls: 4] (Warriors_2_SG: 1 personal fouls)   FT 1/1: GOOD Lakers_2_SG makes 1/1 from the line.
Score: 20-23

[10:39] Warriors possession (Score: 20-23)
Warriors_3_SF attempts a 3Pt. Contested by Lakers_3_SF (4.9 feet, MAN). Warriors_3_SF misses. Rebound secured by Lakers_4_PF.

[10:24] Lakers possession (Score: 20-23)
Lakers_1_PG makes the Layup and draws the foul on Warriors_3_SF! And-1! Lakers_1_PG to the line for 1. [BONUS: 5 team fouls] (Warriors_3_SF: 1 personal fouls)   FT 1/1: GOOD Lakers_1_PG makes 1/1 from the line.
Score: 20-26

[10:11] Warriors possession (Score: 20-26)
Warriors_2_SG attempts a Midrange. Contested by Lakers_2_SG (5.2 feet, MAN). WARRIORS_2_SG MAKES IT! Assist: Warriors_3_SF
Score: 22-26

[09:49] Lakers possession (Score: 22-26)
Lakers_2_SG drives to the basket... Lakers_2_SG loses the ball! TURNOVER!

[09:31] Warriors possession (Score: 22-26)
Warriors_2_SG attempts a Layup. Contested by Lakers_2_SG (5.2 feet, MAN). WARRIORS_2_SG MAKES IT! Assist: Warriors_3_SF
Score: 24-26

[09:31] Substitution (Warriors): Warriors_5_C OUT (stamina: 55) → Warriors_10_C IN (stamina)

[09:14] Lakers possession (Score: 24-26)
Lakers_2_SG attempts a Midrange. Contested by Warriors_2_SG (5.1 feet, MAN). Lakers_2_SG misses. Offensive rebound by Lakers_3_SF! Lakers_3_SF kicks it out.

[08:59] Lakers possession (Score: 24-26)
Lakers_4_PF loses control of the ball! TURNOVER!

[08:46] Warriors possession (Score: 24-26)
Warriors_2_SG attempts a 3Pt. Contested by Lakers_2_SG (5.3 feet, MAN). Warriors_2_SG misses. Rebound secured by Lakers_1_PG.

[08:25] Lakers possession (Score: 24-26)
Lakers_1_PG attempts a Layup. Contested by Warriors_1_PG (5.9 feet, MAN). Lakers_1_PG misses. Offensive rebound by Lakers_4_PF! Lakers_4_PF kicks it out.

[08:03] Lakers possession (Score: 24-26)
Lakers_5_C attempts a 3Pt. Contested by Warriors_10_C (5.2 feet, MAN). Lakers_5_C misses. Offensive rebound by Lakers_4_PF! Lakers_4_PF kicks it out.

[07:48] Lakers possession (Score: 24-26)
Lakers_1_PG attempts a 3Pt. Contested by Warriors_1_PG (5.9 feet, MAN). LAKERS_1_PG MAKES IT! Assist: Lakers_2_SG
Score: 24-29

[07:31] Warriors possession (Score: 24-29)
Warriors_2_SG makes the 3Pt and draws the foul on Lakers_2_SG! And-1! Warriors_2_SG to the line for 1. [BONUS: 6 team fouls] (Lakers_2_SG: 2 personal fouls)   FT 1/1: GOOD Warriors_2_SG makes 1/1 from the line.
Score: 28-29

[07:14] Lakers possession (Score: 28-29)
Lakers_2_SG attempts a Layup. Contested by Warriors_2_SG (5.3 feet, MAN). LAKERS_2_SG MAKES IT!
Score: 28-31

[07:00] Warriors possession (Score: 28-31)
Warriors_1_PG throws a bad pass! Stolen by Lakers_1_PG! TURNOVER!

[06:45] Lakers possession (Score: 28-31)
Lakers_4_PF drives, Warriors_4_PF stays with him. Lakers_4_PF attempts a Layup. Contested by Warriors_4_PF (6.0 feet, MAN). LAKERS_4_PF MAKES IT! Assist: Lakers_6_PG
Score: 28-33

[06:45] Substitution (Lakers): Lakers_1_PG OUT (stamina: 58) → Lakers_6_PG IN (stamina)

[06:45] Substitution (Lakers): Lakers_2_SG OUT (stamina: 55) → Lakers_7_SG IN (stamina)

[06:24] Warriors possession (Score: 28-33)
Warriors_3_SF attempts a 3Pt. Contested by Lakers_3_SF (5.4 feet, MAN). WARRIORS_3_SF MAKES IT! Assist: Warriors_4_PF
Score: 31-33

[06:07] Lakers possession (Score: 31-33)
FOUL! Shooting foul on Warriors_10_C. Lakers_5_C to the line for 2 free throws. [BONUS: 7 team fouls] (Warriors_10_C: 1 personal fouls)   FT 1/2: GOOD   FT 2/2: GOOD Lakers_5_C makes 2/2 from the line.
Score: 31-35

[05:53] Warriors possession (Score: 31-35)
Warriors_2_SG attempts a 3Pt. Contested by Lakers_7_SG (5.0 feet, MAN). Warriors_2_SG misses. Rebound secured by Lakers_4_PF.

[05:31] Lakers possession (Score: 31-35)
Lakers_6_PG attempts a 3Pt. Wide open! Warriors_1_PG is 6.2 feet away. [MAN] LAKERS_6_PG MAKES IT! Assist: Lakers_5_C
Score: 31-38

[05:16] Warriors possession (Score: 31-38)
Warriors_1_PG drives, Lakers_6_PG stays with him. Warriors_1_PG attempts a Dunk. Contested by Lakers_6_PG (4.9 feet, MAN). Warriors_1_PG misses. Offensive rebound by Warriors_3_SF! Warriors_3_SF kicks it out.

[04:59] Warriors possession (Score: 31-38)
Warriors_4_PF drives, picks up Lakers_4_PF. Help arrives from Lakers_6_PG! Warriors_4_PF attempts a Dunk. Contested by Lakers_6_PG (5.4 feet, MAN). WARRIORS_4_PF MAKES IT! Assist: Warriors_3_SF
Score: 33-38

[04:45] Lakers possession (Score: 33-38)
Lakers_7_SG attempts a 3Pt. Contested by Warriors_2_SG (5.7 feet, MAN). LAKERS_7_SG MAKES IT! Assist: Lakers_6_PG
Score: 33-41

[04:30] Warriors possession (Score: 33-41)
Warriors_9_PF drives to the basket... Warriors_9_PF loses the ball! TURNOVER!

[04:30] Substitution (Warriors): Warriors_1_PG OUT (stamina: 59) → Warriors_6_PG IN (stamina)

[04:30] Substitution (Warriors): Warriors_2_SG OUT (stamina: 59) → Warriors_7_SG IN (stamina)

[04:30] Substitution (Warriors): Warriors_3_SF OUT (stamina: 66) → Warriors_8_SF IN (minutes)

[04:30] Substitution (Warriors): Warriors_4_PF OUT (stamina: 72) → Warriors_9_PF IN (minutes)

[04:30] Substitution (Lakers): Lakers_3_SF OUT (stamina: 60) → Lakers_8_SF IN (stamina)

[04:30] Substitution (Lakers): Lakers_4_PF OUT (stamina: 70) → Lakers_9_PF IN (minutes)

[04:30] Substitution (Lakers): Lakers_5_C OUT (stamina: 71) → Lakers_10_C IN (minutes)

[04:30] TIMEOUT - Warriors (stop opponent momentum) - 6 timeouts remaining

[04:09] Lakers possession (Score: 33-41)
FOUL! Shooting foul on Warriors_10_C. Lakers_10_C to the line for 3 free throws. [BONUS: 8 team fouls] (Warriors_10_C: 2 personal fouls)   FT 1/3: GOOD   FT 2/3: GOOD   FT 3/3: GOOD Lakers_10_C makes 3/3 from the line.
Score: 33-44

[03:53] Warriors possession (Score: 33-44)
Warriors_6_PG attempts a Midrange. Contested by Lakers_6_PG (4.9 feet, MAN). WARRIORS_6_PG MAKES IT!
Score: 35-44

[03:36] Lakers possession (Score: 35-44)
Lakers_6_PG drives to the basket... Lakers_6_PG loses the ball! TURNOVER!

[03:22] Warriors possession (Score: 35-44)
Warriors_9_PF drives, Lakers_9_PF stays with him. Warriors_9_PF attempts a Layup. Contested by Lakers_9_PF (4.3 feet, MAN). Warriors_9_PF misses. Rebound secured by Lakers_9_PF.

[03:22] Substitution (Warriors): Warriors_10_C OUT (stamina: 58) → Warriors_5_C IN (stamina)

[03:01] Lakers possession (Score: 35-44)
Lakers_8_SF drives and kicks out. Lakers_6_PG attempts a 3Pt. Contested by Warriors_6_PG (4.1 feet, MAN). LAKERS_6_PG MAKES IT! Assist: Lakers_7_SG
Score: 35-47

[02:46] Warriors possession (Score: 35-47)
Warriors_5_C drives to the basket... Warriors_5_C loses the ball! TURNOVER!

[02:31] Lakers possession (Score: 35-47)
Lakers_6_PG drives and kicks out. Lakers_8_SF attempts a 3Pt. Contested by Warriors_8_SF (5.2 feet, MAN). Lakers_8_SF misses. Rebound secured by Warriors_7_SG.

[02:17] Warriors possession (Score: 35-47)
Warriors_6_PG drives, Lakers_6_PG stays with him. Warriors_6_PG attempts a Layup. Contested by Lakers_6_PG (4.9 feet, MAN). Warriors_6_PG misses. Offensive rebound by Warriors_6_PG! Warriors_6_PG kicks it out.

[02:05] Warriors possession (Score: 35-47)
Warriors_8_SF attempts a Midrange. Contested by Lakers_8_SF (4.1 feet, MAN). Warriors_8_SF misses. Rebound secured by Lakers_8_SF.

[01:51] Lakers possession (Score: 35-47)
Lakers_8_SF drives, picks up Warriors_8_SF. Help arrives from Warriors_7_SG! Lakers_8_SF attempts a Dunk. Contested by Warriors_7_SG (5.2 feet, MAN). Lakers_8_SF misses. Offensive rebound by Lakers_9_PF! Lakers_9_PF's putback is no good. Offensive rebound by Lakers_9_PF! Lakers_9_PF kicks it out.

[01:37] Lakers possession (Score: 35-47)
Lakers_9_PF attempts a Midrange. Contested by Warriors_9_PF (5.0 feet, MAN). Lakers_9_PF misses. Rebound secured by Warriors_7_SG.

[01:21] Warriors possession (Score: 35-47)
Warriors_9_PF drives to the basket... Warriors_9_PF loses the ball! TURNOVER!

[01:04] Lakers possession (Score: 35-47)
Lakers_8_SF attempts a 3Pt. Contested by Warriors_8_SF (5.2 feet, MAN). LAKERS_8_SF MAKES IT! Assist: Lakers_9_PF
Score: 35-50

[00:54] Warriors possession (Score: 35-50)
Warriors_9_PF commits a violation (traveling/carry/out of bounds)! TURNOVER!

[00:41] Lakers possession (Score: 35-50)
Lakers_10_C attempts a Layup. Contested by Warriors_5_C (5.2 feet, MAN). LAKERS_10_C MAKES IT! Assist: Lakers_7_SG
Score: 35-52

[00:30] Warriors possession (Score: 35-52)
Warriors_6_PG throws a bad pass out of bounds! TURNOVER!

[00:30] TIMEOUT - Warriors (stop opponent momentum) - 5 timeouts remaining

[00:18] Lakers possession (Score: 35-52)
Lakers_10_C attempts a Midrange. Contested by Warriors_5_C (5.1 feet, MAN). Lakers_10_C misses. Rebound secured by Warriors_9_PF.

================================================================================
                              2ND QUARTER COMPLETE                              
================================================================================

FINAL SCORE: Warriors 17, Lakers 36

BOX SCORE:
================================================================================

Warriors
--------------------------------------------------------------------------------
Player                MIN  PTS  REB  AST  TO      FG   FG%      3P   3P%
--------------------------------------------------------------------------------
Warriors_2_SG           0    4    0    0   0   2/2   100.0     0/0   0.0
Warriors_3_SF           0    3    2    3   0   1/1   100.0     0/0   0.0
Warriors_4_PF           0    2    0    1   0   1/1   100.0     0/0   0.0
Warriors_6_PG           0    2    1    0   0   1/1   100.0     0/0   0.0
Warriors_7_SG           0    0    2    0   0   0/0     0.0     0/0   0.0
Warriors_9_PF           0    0    1    0   0   0/0     0.0     0/0   0.0

TEAM: FG: 5/11 (45.5%), 3PT: 1/4 (25.0%), REB: 6 (3 off, 3 def), AST: 4, TO: 7
TEAM FOULS: 0


Lakers
--------------------------------------------------------------------------------
Player                MIN  PTS  REB  AST  TO      FG   FG%      3P   3P%
--------------------------------------------------------------------------------
Lakers_6_PG             0    6    0    2   0   2/2   100.0     0/0   0.0
Lakers_1_PG             0    3    2    0   0   1/1   100.0     0/0   0.0
Lakers_7_SG             0    3    0    2   0   1/1   100.0     0/0   0.0
Lakers_8_SF             0    3    1    0   0   1/1   100.0     0/0   0.0
Lakers_4_PF             0    2    4    0   0   1/1   100.0     0/0   0.0
Lakers_2_SG             0    2    0    1   0   1/1   100.0     0/0   0.0
Lakers_10_C             0    2    0    0   0   1/1   100.0     0/0   0.0
Lakers_3_SF             0    0    1    0   0   0/0     0.0     0/0   0.0
Lakers_5_C              0    0    0    1   0   0/0     0.0     0/0   0.0
Lakers_9_PF             0    0    2    1   0   0/0     0.0     0/0   0.0

TEAM: FG: 8/11 (72.7%), 3PT: 4/4 (100.0%), REB: 10 (4 off, 6 def), AST: 7, TO: 3
TEAM FOULS: 8 [OPPONENT IN BONUS]

================================================================================

================================================================================
                        3RD QUARTER - Warriors vs Lakers                        
================================================================================

[12:00] Warriors possession (Score: 35-52)
Warriors_3_SF attempts a Layup. Contested by Lakers_3_SF (4.8 feet, MAN). WARRIORS_3_SF MAKES IT! Assist: Warriors_2_SG
Score: 37-52

[11:44] Lakers possession (Score: 37-52)
FOUL! Holding foul on Warriors_5_C. [Team fouls: 1] No free throws, side out. (Warriors_5_C: 1 personal fouls)

[11:25] Warriors possession (Score: 37-52)
FOUL! Shooting foul on Lakers_2_SG. Warriors_2_SG to the line for 2 free throws. [Team fouls: 2] (Lakers_2_SG: 1 personal fouls)   FT 1/2: MISS   FT 2/2: MISS Warriors_2_SG makes 0/2 from the line. Rebound secured by Lakers_3_SF.

[11:11] Lakers possession (Score: 37-52)
FOUL! Shooting foul on Warriors_1_PG. Lakers_1_PG to the line for 3 free throws. [Team fouls: 3] (Warriors_1_PG: 1 personal fouls)   FT 1/3: GOOD   FT 2/3: GOOD   FT 3/3: MISS Lakers_1_PG makes 2/3 from the line. Offensive rebound by Lakers_3_SF! Lakers_3_SF kicks it out.
Score: 37-54

[11:00] Lakers possession (Score: 37-54)
Lakers_2_SG attempts a 3Pt. Contested by Warriors_2_SG (5.0 feet, MAN). Lakers_2_SG misses. Rebound secured by Warriors_1_PG.

[10:44] Warriors possession (Score: 37-54)
Warriors_5_C drives, Lakers_5_C stays with him. Warriors_5_C attempts a Dunk. Contested by Lakers_5_C (4.8 feet, MAN). Warriors_5_C misses. Rebound secured by Lakers_3_SF.

[10:27] Lakers possession (Score: 37-54)
Lakers_4_PF attempts a 3Pt. Contested by Warriors_4_PF (5.9 feet, MAN). LAKERS_4_PF MAKES IT! Assist: Lakers_1_PG
Score: 37-57

[10:08] Warriors possession (Score: 37-57)
Warriors_4_PF drives, Lakers_4_PF stays with him. Warriors_4_PF attempts a Dunk. Contested by Lakers_4_PF (5.1 feet, MAN). Warriors_4_PF misses. Rebound secured by Lakers_1_PG.

[09:55] Lakers possession (Score: 37-57)
Lakers_1_PG makes the Midrange and draws the foul on Warriors_1_PG! And-1! Lakers_1_PG to the line for 1. [Team fouls: 4] (Warriors_1_PG: 2 personal fouls)   FT 1/1: GOOD Lakers_1_PG makes 1/1 from the line.
Score: 37-60

[09:42] Warriors possession (Score: 37-60)
Warriors_5_C attempts a 3Pt. Contested by Lakers_5_C (4.8 feet, MAN). Warriors_5_C misses. Rebound secured by Lakers_3_SF.

[09:25] Lakers possession (Score: 37-60)
Lakers_5_C throws a bad pass! Stolen by Warriors_5_C! TURNOVER!

[09:14] Warriors possession (Score: 37-60)
Warriors_4_PF attempts a 3Pt. Contested by Lakers_4_PF (5.1 feet, MAN). Warriors_4_PF misses. Rebound secured by Lakers_3_SF.

[09:14] Substitution (Warriors): Warriors_5_C OUT (stamina: 53) → Warriors_10_C IN (stamina)

[08:55] Lakers possession (Score: 37-60)
Lakers_5_C attempts a 3Pt. Contested by Warriors_10_C (5.1 feet, MAN). Lakers_5_C misses. Rebound secured by Warriors_10_C.

[08:40] Warriors possession (Score: 37-60)
Warriors_4_PF throws a bad pass! Stolen by Lakers_4_PF! TURNOVER!

[08:26] Lakers possession (Score: 37-60)
Lakers_1_PG attempts a 3Pt. Contested by Warriors_1_PG (5.9 feet, MAN). LAKERS_1_PG MAKES IT! Assist: Lakers_5_C
Score: 37-63

[08:26] Substitution (Lakers): Lakers_2_SG OUT (stamina: 59) → Lakers_6_PG IN (stamina)

[08:10] Warriors possession (Score: 37-63)
Warriors_10_C drives, Lakers_5_C stays with him. Warriors_10_C attempts a Dunk. Contested by Lakers_5_C (4.8 feet, MAN). Warriors_10_C misses. Rebound secured by Lakers_3_SF.

[08:10] TIMEOUT - Warriors (stop opponent momentum) - 4 timeouts remaining

[07:53] Lakers possession (Score: 37-63)
Lakers_3_SF drives and kicks out. Lakers_4_PF attempts a Midrange. Contested by Warriors_4_PF (5.9 feet, MAN). LAKERS_4_PF MAKES IT! Assist: Lakers_6_PG
Score: 37-65

[07:33] Warriors possession (Score: 37-65)
Warriors_2_SG makes the Layup and draws the foul on Lakers_1_PG! And-1! Warriors_2_SG to the line for 1. [BONUS: 5 team fouls] (Lakers_1_PG: 1 personal fouls)   FT 1/1: MISS Warriors_2_SG makes 0/1 from the line. Offensive rebound by Warriors_4_PF! Warriors_4_PF kicks it out.
Score: 39-65

[07:21] Warriors possession (Score: 39-65)
Warriors_1_PG attempts a 3Pt. Contested by Lakers_1_PG (4.4 feet, MAN). WARRIORS_1_PG MAKES IT! Assist: Warriors_3_SF
Score: 42-65

[07:03] Lakers possession (Score: 42-65)
Lakers_3_SF drives, picks up Warriors_3_SF. Help arrives from Warriors_1_PG! Lakers_3_SF attempts a Layup. Contested by Warriors_1_PG (5.5 feet, MAN). Lakers_3_SF misses. Rebound secured by Warriors_3_SF.

[06:42] Warriors possession (Score: 42-65)
Warriors_4_PF commits an offensive foul! Lakers_4_PF drew the charge! TURNOVER!

[06:24] Lakers possession (Score: 42-65)
Lakers_6_PG attempts a 3Pt. Contested by Warriors_1_PG (6.0 feet, MAN). LAKERS_6_PG MAKES IT! Assist: Lakers_3_SF
Score: 42-68

[06:08] Warriors possession (Score: 42-68)
Warriors_3_SF attempts a 3Pt. Contested by Lakers_3_SF (5.3 feet, MAN). Warriors_3_SF misses. Rebound secured by Lakers_3_SF.

[05:55] Lakers possession (Score: 42-68)
Lakers_6_PG attempts a Midrange. Wide open! Warriors_1_PG is 6.0 feet away. [MAN] LAKERS_6_PG MAKES IT!
Score: 42-70

[05:36] Warriors possession (Score: 42-70)
Warriors_4_PF attempts a 3Pt. Contested by Lakers_4_PF (5.2 feet, MAN). WARRIORS_4_PF MAKES IT! Assist: Warriors_1_PG
Score: 45-70

[05:13] Lakers possession (Score: 45-70)
Lakers_1_PG attempts a 3Pt. Wide open! Warriors_1_PG is 6.1 feet away. [MAN] LAKERS_1_PG MAKES IT! Assist: Lakers_6_PG
Score: 45-73

[04:53] Warriors possession (Score: 45-73)
Warriors_1_PG attempts a Midrange. Contested by Lakers_1_PG (4.7 feet, MAN). WARRIORS_1_PG MAKES IT!
Score: 47-73

[04:38] Lakers possession (Score: 47-73)
Lakers_4_PF attempts a 3Pt. Wide open! Warriors_4_PF is 6.0 feet away. [MAN] Lakers_4_PF misses. Offensive rebound by Lakers_4_PF! Lakers_4_PF kicks it out.

[04:19] Lakers possession (Score: 47-73)
Lakers_3_SF attempts a 3Pt. Contested by Warriors_3_SF (5.7 feet, MAN). Lakers_3_SF misses. Rebound secured by Warriors_10_C.

[04:05] Warriors possession (Score: 47-73)
Warriors_1_PG attempts a 3Pt. Contested by Lakers_6_PG (5.0 feet, MAN). Warriors_1_PG misses. Rebound secured by Lakers_3_SF.

[03:50] Lakers possession (Score: 47-73)
Lakers_4_PF drives and kicks out. Lakers_4_PF attempts a Midrange. Wide open! Warriors_4_PF is 6.1 feet away. [MAN] Lakers_4_PF misses. Offensive rebound by Lakers_4_PF! Lakers_4_PF kicks it out.

[03:33] Lakers possession (Score: 47-73)
Lakers_4_PF attempts a 3Pt. Wide open! Warriors_4_PF is 6.1 feet away. [MAN] Lakers_4_PF misses. Offensive rebound by Lakers_4_PF! Lakers_4_PF kicks it out.

[03:15] Lakers possession (Score: 47-73)
Lakers_1_PG attempts a 3Pt. Wide open! Warriors_1_PG is 6.3 feet away. [MAN] Lakers_1_PG misses. Rebound secured by Warriors_4_PF.

[03:00] Warriors possession (Score: 47-73)
Warriors_2_SG makes the Layup and draws the foul on Lakers_3_SF! And-1! Warriors_2_SG to the line for 1. [BONUS: 6 team fouls] (Lakers_3_SF: 1 personal fouls)   FT 1/1: MISS Warriors_2_SG makes 0/1 from the line. Offensive rebound by Warriors_4_PF! Warriors_4_PF kicks it out.
Score: 49-73

[02:44] Warriors possession (Score: 49-73)
FOUL! Reach-in foul on Lakers_9_PF during the drive. [IN THE BONUS! 7 team fouls] Warriors_9_PF to the line for 2 free throws. (Lakers_9_PF: 1 personal fouls)   FT 1/2: MISS   FT 2/2: GOOD Warriors_9_PF makes 1/2 from the line.
Score: 50-73

[02:44] Substitution (Warriors): Warriors_1_PG OUT (stamina: 53) → Warriors_6_PG IN (stamina)

[02:44] Substitution (Warriors): Warriors_2_SG OUT (stamina: 53) → Warriors_7_SG IN (stamina)

[02:44] Substitution (Warriors): Warriors_3_SF OUT (stamina: 60) → Warriors_8_SF IN (stamina)

[02:44] Substitution (Warriors): Warriors_4_PF OUT (stamina: 67) → Warriors_9_PF IN (minutes)

[02:44] Substitution (Warriors): Warriors_10_C OUT (stamina: 58) → Warriors_5_C IN (stamina)

[02:44] Substitution (Lakers): Lakers_1_PG OUT (stamina: 49) → Lakers_7_SG IN (stamina)

[02:44] Substitution (Lakers): Lakers_3_SF OUT (stamina: 53) → Lakers_8_SF IN (stamina)

[02:44] Substitution (Lakers): Lakers_4_PF OUT (stamina: 65) → Lakers_9_PF IN (minutes)

[02:44] Substitution (Lakers): Lakers_5_C OUT (stamina: 66) → Lakers_10_C IN (minutes)

[02:26] Lakers possession (Score: 50-73)
Lakers_10_C attempts a 3Pt. Contested by Warriors_5_C (5.0 feet, MAN). Lakers_10_C misses. Offensive rebound by Lakers_10_C! Lakers_10_C kicks it out.

[02:08] Lakers possession (Score: 50-73)
Lakers_7_SG drives, Warriors_7_SG stays with him. Lakers_7_SG attempts a Dunk. Contested by Warriors_7_SG (4.1 feet, MAN). LAKERS_7_SG MAKES IT! Assist: Lakers_9_PF
Score: 50-75

[01:55] Warriors possession (Score: 50-75)
Warriors_9_PF attempts a 3Pt. Contested by Lakers_9_PF (4.3 feet, MAN). Warriors_9_PF misses. Offensive rebound by Warriors_7_SG! Warriors_7_SG's putback is no good. Rebound secured by Lakers_9_PF.

[01:38] Lakers possession (Score: 50-75)
Lakers_9_PF drives and kicks out. Lakers_9_PF attempts a Midrange. Contested by Warriors_9_PF (5.0 feet, MAN). Lakers_9_PF misses. Offensive rebound by Lakers_10_C! Lakers_10_C kicks it out.

[01:23] Lakers possession (Score: 50-75)
Lakers_10_C attempts a 3Pt. Contested by Warriors_5_C (5.1 feet, MAN). Lakers_10_C misses. Rebound secured by Warriors_7_SG.

[01:08] Warriors possession (Score: 50-75)
Warriors_9_PF attempts a Midrange. Contested by Lakers_9_PF (4.3 feet, MAN). Warriors_9_PF misses. Offensive rebound by Warriors_7_SG! Warriors_7_SG puts it back in!
Score: 52-75

[00:53] Lakers possession (Score: 52-75)
Lakers_9_PF attempts a 3Pt. Contested by Warriors_9_PF (5.0 feet, MAN). Lakers_9_PF misses. Rebound secured by Warriors_6_PG.

[00:41] Warriors possession (Score: 52-75)
Warriors_6_PG drives, picks up Lakers_6_PG. Help arrives from Lakers_8_SF! Warriors_6_PG attempts a Dunk. Contested by Lakers_8_SF (5.2 feet, MAN). WARRIORS_6_PG MAKES IT! Assist: Warriors_5_C
Score: 54-75

[00:20] Lakers possession (Score: 54-75)
Lakers_7_SG attempts a 3Pt. Contested by Warriors_7_SG (4.1 feet, MAN). Lakers_7_SG misses. Rebound secured by Warriors_6_PG.

================================================================================
                              3RD QUARTER COMPLETE                              
================================================================================

FINAL SCORE: Warriors 19, Lakers 23

BOX SCORE:
================================================================================

Warriors
--------------------------------------------------------------------------------
Player                MIN  PTS  REB  AST  TO      FG   FG%      3P   3P%
--------------------------------------------------------------------------------
Warriors_1_PG           0    5    1    1   0   2/2   100.0     0/0   0.0
Warriors_4_PF           0    3    3    0   0   1/1   100.0     0/0   0.0
Warriors_3_SF           0    2    1    1   0   1/1   100.0     0/0   0.0
Warriors_7_SG           0    2    2    0   0   1/1   100.0     0/0   0.0
Warriors_6_PG           0    2    2    0   0   1/1   100.0     0/0   0.0
Warriors_2_SG           0    0    0    1   0   0/0     0.0     0/0   0.0
Warriors_10_C           0    0    2    0   0   0/0     0.0     0/0   0.0
Lakers_9_PF             0    0    1    1   0   0/0     0.0     0/0   0.0
Warriors_5_C            0    0    0    1   0   0/0     0.0     0/0   0.0

TEAM: FG: 6/15 (40.0%), 3PT: 2/7 (28.6%), REB: 12 (4 off, 8 def), AST: 4, TO: 2
TEAM FOULS: 0


Lakers
--------------------------------------------------------------------------------
Player                MIN  PTS  REB  AST  TO      FG   FG%      3P   3P%
--------------------------------------------------------------------------------
Lakers_1_PG             0    6    1    1   0   2/2   100.0     0/0   0.0
Lakers_4_PF             0    5    3    0   0   2/2   100.0     0/0   0.0
Lakers_6_PG             0    5    0    2   0   2/2   100.0     0/0   0.0
Lakers_7_SG             0    2    0    0   0   1/1   100.0     0/0   0.0
Lakers_3_SF             0    0    8    1   0   0/0     0.0     0/0   0.0
Lakers_5_C              0    0    0    1   0   0/0     0.0     0/0   0.0
Lakers_10_C             0    0    2    0   0   0/0     0.0     0/0   0.0

TEAM: FG: 7/15 (46.7%), 3PT: 4/11 (36.4%), REB: 14 (6 off, 8 def), AST: 6, TO: 1
TEAM FOULS: 7 [OPPONENT IN BONUS]

================================================================================

================================================================================
                        4TH QUARTER - Warriors vs Lakers                        
================================================================================

[12:00] Warriors possession (Score: 54-75)
Warriors_2_SG commits a violation (traveling/carry/out of bounds)! TURNOVER!

[12:00] Substitution (Warriors): Warriors_5_C OUT (stamina: 62) → Warriors_10_C IN (comeback_detected)

[12:00] Substitution (Lakers): Lakers_5_C OUT (stamina: 88) → Lakers_10_C IN (comeback_detected)

[11:43] Lakers possession (Score: 54-75)
Lakers_1_PG attempts a 3Pt. Contested by Warriors_1_PG (5.6 feet, MAN). Lakers_1_PG misses. Rebound secured by Warriors_3_SF.

[11:22] Warriors possession (Score: 54-75)
Warriors_2_SG attempts a Layup. Contested by Lakers_2_SG (5.0 feet, MAN). Warriors_2_SG misses. Offensive rebound by Warriors_4_PF! Warriors_4_PF kicks it out.

[11:06] Warriors possession (Score: 54-75)
Warriors_10_C attempts a 3Pt. Contested by Lakers_10_C (4.6 feet, MAN). WARRIORS_10_C MAKES IT! Assist: Warriors_3_SF
Score: 57-75

[10:48] Lakers possession (Score: 57-75)
Lakers_3_SF drives and kicks out. Lakers_2_SG attempts a Midrange. Contested by Warriors_2_SG (4.9 feet, MAN). Lakers_2_SG misses. Offensive rebound by Lakers_4_PF! Lakers_4_PF kicks it out.

[10:48] TIMEOUT - Lakers (stop opponent momentum) - 6 timeouts remaining

[10:32] Lakers possession (Score: 57-75)
Lakers_2_SG attempts a Layup. Contested by Warriors_2_SG (4.9 feet, MAN). LAKERS_2_SG MAKES IT! Assist: Lakers_10_C
Score: 57-77

[10:16] Warriors possession (Score: 57-77)
FOUL! Shooting foul on Lakers_2_SG. Warriors_2_SG to the line for 3 free throws. [Team fouls: 1] (Lakers_2_SG: 1 personal fouls)   FT 1/3: GOOD   FT 2/3: GOOD   FT 3/3: MISS Warriors_2_SG makes 2/3 from the line. Rebound secured by Lakers_10_C.
Score: 59-77

[10:01] Lakers possession (Score: 59-77)
Lakers_2_SG attempts a Midrange. Contested by Warriors_2_SG (4.9 feet, MAN). LAKERS_2_SG MAKES IT! Assist: Lakers_4_PF
Score: 59-79

[09:47] Warriors possession (Score: 59-79)
FOUL! Shooting foul on Lakers_1_PG. Warriors_10_C to the line for 2 free throws. [Team fouls: 2] (Lakers_1_PG: 1 personal fouls)   FT 1/2: GOOD   FT 2/2: MISS Warriors_10_C makes 1/2 from the line. Rebound secured by Lakers_4_PF.
Score: 60-79

[09:34] Lakers possession (Score: 60-79)
Lakers_4_PF attempts a Midrange. Contested by Warriors_4_PF (5.9 feet, MAN). LAKERS_4_PF MAKES IT! Assist: Lakers_2_SG
Score: 60-81

[09:10] Warriors possession (Score: 60-81)
Warriors_3_SF attempts a Midrange. Contested by Lakers_3_SF (4.9 feet, MAN). Warriors_3_SF misses. Offensive rebound by Warriors_3_SF! Warriors_3_SF kicks it out.

[08:52] Warriors possession (Score: 60-81)
Warriors_3_SF drives to the basket... Warriors_3_SF loses the ball! TURNOVER!

[08:37] Lakers possession (Score: 60-81)
Lakers_1_PG attempts a 3Pt. Contested by Warriors_1_PG (5.7 feet, MAN). Lakers_1_PG misses. Rebound secured by Warriors_3_SF.

[08:37] Substitution (Warriors): Warriors_10_C OUT (stamina: 59) → Warriors_5_C IN (stamina)

[08:21] Warriors possession (Score: 60-81)
Warriors_3_SF attempts a 3Pt. Contested by Lakers_3_SF (5.0 feet, MAN). Warriors_3_SF misses. Rebound secured by Lakers_4_PF.

[07:58] Lakers possession (Score: 60-81)
Lakers_10_C attempts a 3Pt. Contested by Warriors_5_C (5.1 feet, MAN). Lakers_10_C misses. Offensive rebound by Lakers_10_C! Lakers_10_C kicks it out.

[07:43] Lakers possession (Score: 60-81)
Lakers_2_SG loses control of the ball! TURNOVER!

[07:24] Warriors possession (Score: 60-81)
Warriors_4_PF attempts a Midrange. Contested by Lakers_4_PF (5.1 feet, MAN). Warriors_4_PF misses. Offensive rebound by Warriors_3_SF! Warriors_3_SF kicks it out.

[07:02] Warriors possession (Score: 60-81)
FOUL! Shooting foul on Lakers_10_C. Warriors_5_C to the line for 2 free throws. [Team fouls: 3] (Lakers_10_C: 1 personal fouls)   FT 1/2: GOOD   FT 2/2: MISS Warriors_5_C makes 1/2 from the line. Rebound secured by Lakers_3_SF.
Score: 61-81

[06:46] Lakers possession (Score: 61-81)
Lakers_1_PG drives and kicks out. FOUL! Shooting foul on Warriors_3_SF. Lakers_3_SF to the line for 3 free throws. [Team fouls: 4] (Warriors_3_SF: 1 personal fouls)   FT 1/3: GOOD   FT 2/3: GOOD   FT 3/3: GOOD Lakers_3_SF makes 3/3 from the line.
Score: 61-84

[06:26] Warriors possession (Score: 61-84)
Warriors_4_PF attempts a Midrange. Contested by Lakers_4_PF (5.1 feet, MAN). WARRIORS_4_PF MAKES IT! Assist: Warriors_1_PG
Score: 63-84

[06:05] Lakers possession (Score: 63-84)
FOUL! Reach-in foul on Warriors_3_SF during the drive. [IN THE BONUS! 5 team fouls] Lakers_3_SF to the line for 2 free throws. (Warriors_3_SF: 2 personal fouls)   FT 1/2: GOOD   FT 2/2: GOOD Lakers_3_SF makes 2/2 from the line.
Score: 63-86

[05:49] Warriors possession (Score: 63-86)
FOUL! Shooting foul on Lakers_6_PG. Warriors_1_PG to the line for 2 free throws. [BONUS: 6 team fouls] (Lakers_6_PG: 1 personal fouls)   FT 1/2: GOOD   FT 2/2: GOOD Warriors_1_PG makes 2/2 from the line.
Score: 65-86

[05:49] Substitution (Lakers): Lakers_1_PG OUT (stamina: 61) → Lakers_6_PG IN (blowout_rest)

[05:49] Substitution (Lakers): Lakers_2_SG OUT (stamina: 58) → Lakers_7_SG IN (blowout_rest)

[05:33] Lakers possession (Score: 65-86)
Lakers_4_PF makes the Layup and draws the foul on Warriors_4_PF! And-1! Lakers_4_PF to the line for 1. [BONUS: 7 team fouls] (Warriors_4_PF: 1 personal fouls)   FT 1/1: GOOD Lakers_4_PF makes 1/1 from the line.
Score: 65-89

[05:15] Warriors possession (Score: 65-89)
Warriors_5_C drives, Lakers_10_C stays with him. Warriors_5_C attempts a Dunk. Contested by Lakers_10_C (4.9 feet, MAN). Warriors_5_C misses. Offensive rebound by Warriors_3_SF! Warriors_3_SF kicks it out.

[05:01] Warriors possession (Score: 65-89)
FOUL! Shooting foul on Lakers_10_C. Warriors_5_C to the line for 3 free throws. [BONUS: 8 team fouls] (Lakers_10_C: 2 personal fouls)   FT 1/3: GOOD   FT 2/3: GOOD   FT 3/3: MISS Warriors_5_C makes 2/3 from the line. Rebound secured by Lakers_4_PF.
Score: 67-89

[04:44] Lakers possession (Score: 67-89)
Lakers_5_C drives, Warriors_5_C stays with him. Lakers_5_C attempts a Dunk. Contested by Warriors_5_C (5.3 feet, MAN). Lakers_5_C misses. Offensive rebound by Lakers_9_PF! Lakers_9_PF puts it back in!
Score: 67-91

[04:44] Substitution (Warriors): Warriors_3_SF OUT (stamina: 67) → Warriors_8_SF IN (minutes)

[04:44] Substitution (Warriors): Warriors_4_PF OUT (stamina: 74) → Warriors_9_PF IN (minutes)

[04:44] Substitution (Lakers): Lakers_3_SF OUT (stamina: 62) → Lakers_8_SF IN (minutes)

[04:44] Substitution (Lakers): Lakers_4_PF OUT (stamina: 72) → Lakers_9_PF IN (minutes)

[04:44] Substitution (Lakers): Lakers_10_C OUT (stamina: 64) → Lakers_5_C IN (minutes)

[04:25] Warriors possession (Score: 67-91)
Warriors_5_C attempts a Midrange. Contested by Lakers_5_C (4.8 feet, MAN). WARRIORS_5_C MAKES IT! Assist: Warriors_8_SF
Score: 69-91

[04:09] Lakers possession (Score: 69-91)
Lakers_7_SG attempts a 3Pt. Contested by Warriors_2_SG (5.5 feet, MAN). Lakers_7_SG misses. Rebound secured by Warriors_8_SF.

[03:48] Warriors possession (Score: 69-91)
Warriors_1_PG drives and kicks out. FOUL! Shooting foul on Lakers_8_SF. Warriors_3_SF to the line for 3 free throws. [BONUS: 9 team fouls] (Lakers_8_SF: 1 personal fouls)   FT 1/3: GOOD   FT 2/3: MISS   FT 3/3: GOOD Warriors_3_SF makes 2/3 from the line.
Score: 71-91

[03:48] Substitution (Warriors): Warriors_8_SF OUT (stamina: 87) → Warriors_3_SF IN (comeback_detected)

[03:48] Substitution (Lakers): Lakers_6_PG OUT (stamina: 86) → Lakers_1_PG IN (comeback_detected)

[03:35] Lakers possession (Score: 71-91)
Lakers_2_SG attempts a 3Pt. Contested by Warriors_7_SG (4.1 feet, MAN). Lakers_2_SG misses. Offensive rebound by Lakers_8_SF! Lakers_8_SF kicks it out.

[03:35] Substitution (Lakers): Lakers_1_PG OUT (stamina: 66) → Lakers_2_SG IN (blowout_rest)

[03:35] Substitution (Lakers): Lakers_5_C OUT (stamina: 93) → Lakers_3_SF IN (blowout_rest)

[03:35] Substitution (Warriors): Warriors_9_PF OUT (stamina: 79) → Warriors_4_PF IN (comeback_detected)

[03:35] Substitution (Lakers): Lakers_7_SG OUT (stamina: 75) → Lakers_1_PG IN (comeback_detected)

[03:35] Substitution (Warriors): Warriors_1_PG OUT (stamina: 57) → Warriors_6_PG IN (stamina)

[03:35] Substitution (Warriors): Warriors_2_SG OUT (stamina: 57) → Warriors_7_SG IN (stamina)

[03:21] Lakers possession (Score: 71-91)
Lakers_1_PG attempts a 3Pt. Wide open! Warriors_1_PG is 6.2 feet away. [MAN] LAKERS_1_PG MAKES IT! Assist: Lakers_10_C
Score: 71-94

[03:21] Substitution (Lakers): Lakers_1_PG OUT (stamina: 65) → Lakers_4_PF IN (blowout_rest)

[03:21] Substitution (Lakers): Lakers_2_SG OUT (stamina: 64) → Lakers_10_C IN (blowout_rest)

[03:21] Substitution (Warriors): Warriors_6_PG OUT (stamina: 97) → Warriors_1_PG IN (comeback_detected)

[03:21] Substitution (Lakers): Lakers_8_SF OUT (stamina: 86) → Lakers_1_PG IN (comeback_detected)

[03:00] Warriors possession (Score: 71-94)
Warriors_4_PF attempts a 3Pt. Contested by Lakers_9_PF (4.4 feet, MAN). WARRIORS_4_PF MAKES IT! Assist: Warriors_3_SF
Score: 74-94

[03:00] Substitution (Lakers): Lakers_1_PG OUT (stamina: 64) → Lakers_6_PG IN (blowout_rest)

[03:00] Substitution (Lakers): Lakers_4_PF OUT (stamina: 74) → Lakers_5_C IN (blowout_rest)

[03:00] Substitution (Warriors): Warriors_7_SG OUT (stamina: 86) → Warriors_2_SG IN (comeback_detected)

[03:00] Substitution (Lakers): Lakers_6_PG OUT (stamina: 87) → Lakers_1_PG IN (comeback_detected)

[02:41] Lakers possession (Score: 74-94)
Lakers_2_SG attempts a 3Pt. Contested by Warriors_2_SG (5.5 feet, MAN). Lakers_2_SG misses. Rebound secured by Warriors_3_SF.

[02:41] Substitution (Lakers): Lakers_1_PG OUT (stamina: 63) → Lakers_7_SG IN (blowout_rest)

[02:41] Substitution (Lakers): Lakers_3_SF OUT (stamina: 62) → Lakers_2_SG IN (blowout_rest)

[02:41] Substitution (Warriors): Warriors_5_C OUT (stamina: 59) → Warriors_10_C IN (comeback_detected)

[02:41] Substitution (Lakers): Lakers_7_SG OUT (stamina: 76) → Lakers_1_PG IN (comeback_detected)

[02:26] Warriors possession (Score: 74-94)
Warriors_5_C drives and kicks out. Warriors_4_PF attempts a 3Pt. Contested by Lakers_4_PF (5.2 feet, MAN). Warriors_4_PF misses. Offensive rebound by Warriors_3_SF! Warriors_3_SF kicks it out.

[02:26] Substitution (Lakers): Lakers_1_PG OUT (stamina: 62) → Lakers_8_SF IN (blowout_rest)

[02:26] Substitution (Lakers): Lakers_2_SG OUT (stamina: 65) → Lakers_4_PF IN (blowout_rest)

[02:26] Substitution (Warriors): Warriors_10_C OUT (stamina: 74) → Warriors_5_C IN (comeback_detected)

[02:26] Substitution (Lakers): Lakers_8_SF OUT (stamina: 87) → Lakers_1_PG IN (comeback_detected)

[02:11] Warriors possession (Score: 74-94)
Warriors_1_PG attempts a 3Pt. Contested by Lakers_1_PG (4.5 feet, MAN). Warriors_1_PG misses. Rebound secured by Lakers_3_SF.

[02:11] Substitution (Lakers): Lakers_1_PG OUT (stamina: 62) → Lakers_6_PG IN (blowout_rest)

[02:11] Substitution (Lakers): Lakers_4_PF OUT (stamina: 75) → Lakers_3_SF IN (blowout_rest)

[02:11] Substitution (Warriors): Warriors_5_C OUT (stamina: 59) → Warriors_10_C IN (comeback_detected)

[02:11] Substitution (Lakers): Lakers_6_PG OUT (stamina: 87) → Lakers_1_PG IN (comeback_detected)

[01:50] Lakers possession (Score: 74-94)
Lakers_2_SG drives to the basket... Lakers_2_SG loses the ball! TURNOVER!

[01:50] Substitution (Lakers): Lakers_1_PG OUT (stamina: 61) → Lakers_7_SG IN (blowout_rest)

[01:50] Substitution (Lakers): Lakers_3_SF OUT (stamina: 63) → Lakers_2_SG IN (blowout_rest)

[01:50] Substitution (Warriors): Warriors_10_C OUT (stamina: 74) → Warriors_5_C IN (comeback_detected)

[01:50] Substitution (Lakers): Lakers_7_SG OUT (stamina: 78) → Lakers_1_PG IN (comeback_detected)

[01:35] Warriors possession (Score: 74-94)
Warriors_2_SG drives and kicks out. Warriors_1_PG attempts a 3Pt. Contested by Lakers_6_PG (4.9 feet, MAN). Warriors_1_PG misses. Rebound secured by Lakers_10_C.

[01:35] Substitution (Lakers): Lakers_1_PG OUT (stamina: 60) → Lakers_8_SF IN (blowout_rest)

[01:35] Substitution (Lakers): Lakers_2_SG OUT (stamina: 66) → Lakers_4_PF IN (blowout_rest)

[01:35] Substitution (Warriors): Warriors_5_C OUT (stamina: 60) → Warriors_10_C IN (comeback_detected)

[01:35] Substitution (Lakers): Lakers_8_SF OUT (stamina: 88) → Lakers_1_PG IN (comeback_detected)

[01:35] Substitution (Warriors): Warriors_3_SF OUT (stamina: 62) → Warriors_8_SF IN (minutes)

[01:35] Substitution (Lakers): Lakers_1_PG OUT (stamina: 60) → Lakers_6_PG IN (stamina)

[01:17] Lakers possession (Score: 74-94)
Lakers_9_PF commits an offensive foul! Warriors_4_PF drew the charge! TURNOVER!

[01:17] Substitution (Lakers): Lakers_4_PF OUT (stamina: 75) → Lakers_3_SF IN (blowout_rest)

[01:17] Substitution (Lakers): Lakers_5_C OUT (stamina: 89) → Lakers_7_SG IN (blowout_rest)

[01:17] Substitution (Warriors): Warriors_8_SF OUT (stamina: 89) → Warriors_3_SF IN (comeback_detected)

[01:17] Substitution (Lakers): Lakers_7_SG OUT (stamina: 79) → Lakers_1_PG IN (comeback_detected)

[01:01] Warriors possession (Score: 74-94)
Warriors_3_SF attempts a 3Pt. Contested by Lakers_8_SF (4.1 feet, MAN). Warriors_3_SF misses. Offensive rebound by Warriors_6_PG! Warriors_6_PG kicks it out.

[01:01] Substitution (Lakers): Lakers_1_PG OUT (stamina: 60) → Lakers_2_SG IN (blowout_rest)

[01:01] Substitution (Lakers): Lakers_3_SF OUT (stamina: 64) → Lakers_8_SF IN (blowout_rest)

[01:01] Substitution (Warriors): Warriors_10_C OUT (stamina: 73) → Warriors_5_C IN (comeback_detected)

[01:01] Substitution (Lakers): Lakers_6_PG OUT (stamina: 86) → Lakers_1_PG IN (comeback_detected)

[01:01] Substitution (Warriors): Warriors_1_PG OUT (stamina: 50) → Warriors_6_PG IN (stamina)

[01:01] Substitution (Warriors): Warriors_4_PF OUT (stamina: 69) → Warriors_8_SF IN (minutes)

[01:01] Substitution (Lakers): Lakers_10_C OUT (stamina: 61) → Lakers_5_C IN (minutes)

[00:45] Warriors possession (Score: 74-94)
Warriors_8_SF drives to the basket... Warriors_8_SF loses the ball! TURNOVER!

[00:45] Substitution (Lakers): Lakers_1_PG OUT (stamina: 59) → Lakers_4_PF IN (blowout_rest)

[00:45] Substitution (Lakers): Lakers_2_SG OUT (stamina: 66) → Lakers_7_SG IN (blowout_rest)

[00:45] Substitution (Warriors): Warriors_6_PG OUT (stamina: 97) → Warriors_1_PG IN (comeback_detected)

[00:45] Substitution (Lakers): Lakers_7_SG OUT (stamina: 80) → Lakers_1_PG IN (comeback_detected)

[00:24] Lakers possession (Score: 74-94)
Lakers_8_SF attempts a 3Pt. Contested by Warriors_3_SF (5.9 feet, MAN). Lakers_8_SF misses. Rebound secured by Warriors_6_PG.

[00:24] Substitution (Lakers): Lakers_1_PG OUT (stamina: 58) → Lakers_3_SF IN (blowout_rest)

[00:24] Substitution (Lakers): Lakers_4_PF OUT (stamina: 75) → Lakers_6_PG IN (blowout_rest)

[00:24] Substitution (Warriors): Warriors_8_SF OUT (stamina: 87) → Warriors_4_PF IN (comeback_detected)

[00:24] Substitution (Lakers): Lakers_6_PG OUT (stamina: 87) → Lakers_1_PG IN (comeback_detected)

[00:24] Substitution (Warriors): Warriors_2_SG OUT (stamina: 50) → Warriors_6_PG IN (stamina)

[00:24] Substitution (Warriors): Warriors_5_C OUT (stamina: 60) → Warriors_10_C IN (stamina)

[00:10] Warriors possession (Score: 74-94)
Warriors_2_SG makes the 3Pt and draws the foul on Lakers_2_SG! And-1! Warriors_2_SG to the line for 1. [BONUS: 10 team fouls] (Lakers_2_SG: 2 personal fouls)   FT 1/1: MISS Warriors_2_SG makes 0/1 from the line. Rebound secured by Lakers_5_C.
Score: 77-94

[00:10] Substitution (Lakers): Lakers_1_PG OUT (stamina: 57) → Lakers_10_C IN (blowout_rest)

[00:10] Substitution (Lakers): Lakers_3_SF OUT (stamina: 64) → Lakers_2_SG IN (blowout_rest)

[00:10] Substitution (Warriors): Warriors_6_PG OUT (stamina: 96) → Warriors_2_SG IN (comeback_detected)

[00:10] Substitution (Lakers): Lakers_9_PF OUT (stamina: 69) → Lakers_1_PG IN (comeback_detected)

================================================================================
                              4TH QUARTER COMPLETE                              
================================================================================

FINAL SCORE: Warriors 23, Lakers 19

BOX SCORE:
================================================================================

Warriors
--------------------------------------------------------------------------------
Player                MIN  PTS  REB  AST  TO      FG   FG%      3P   3P%
--------------------------------------------------------------------------------
Warriors_4_PF           0    5    1    0   0   2/2   100.0     0/0   0.0
Warriors_10_C           0    3    0    0   0   1/1   100.0     0/0   0.0
Warriors_5_C            0    2    0    0   0   1/1   100.0     0/0   0.0
Warriors_3_SF           0    0    7    2   0   0/0     0.0     0/0   0.0
Warriors_1_PG           0    0    0    1   0   0/0     0.0     0/0   0.0
Warriors_8_SF           0    0    1    1   0   0/0     0.0     0/0   0.0
Warriors_6_PG           0    0    2    0   0   0/0     0.0     0/0   0.0

TEAM: FG: 4/12 (33.3%), 3PT: 2/7 (28.6%), REB: 11 (6 off, 5 def), AST: 4, TO: 3
TEAM FOULS: 0


Lakers
--------------------------------------------------------------------------------
Player                MIN  PTS  REB  AST  TO      FG   FG%      3P   3P%
--------------------------------------------------------------------------------
Lakers_2_SG             0    4    0    1   0   2/2   100.0     0/0   0.0
Lakers_1_PG             0    3    0    0   0   1/1   100.0     0/0   0.0
Lakers_4_PF             0    2    4    1   0   1/1   100.0     0/0   0.0
Lakers_9_PF             0    2    1    0   0   1/1   100.0     0/0   0.0
Lakers_10_C             0    0    3    2   0   0/0     0.0     0/0   0.0
Lakers_3_SF             0    0    2    0   0   0/0     0.0     0/0   0.0
Lakers_8_SF             0    0    1    0   0   0/0     0.0     0/0   0.0
Lakers_5_C              0    0    1    0   0   0/0     0.0     0/0   0.0

TEAM: FG: 5/10 (50.0%), 3PT: 1/6 (16.7%), REB: 12 (4 off, 8 def), AST: 4, TO: 3
TEAM FOULS: 10 [OPPONENT IN BONUS]

================================================================================