================================================================================
                        FULL GAME - Team_001 vs Team_002                        
================================================================================

================================================================================
                       1ST QUARTER - Team_001 vs Team_002                       
================================================================================

[12:00] Team_001 possession (Score: 0-0)
Cole Ball drives, Jordan Green stays with him. Cole Ball attempts a Dunk. Contested by Jordan Green (4.0 feet, MAN). COLE BALL MAKES IT! Assist: Dejounte McCollum
Score: 2-0

[11:46] Team_002 possession (Score: 2-0)
FOUL! Shooting foul on Dejounte McCollum. Miles Bane to the line for 2 free throws. [Team fouls: 1] (Dejounte McCollum: 1 personal fouls)   FT 1/2: GOOD   FT 2/2: GOOD Miles Bane makes 2/2 from the line.
Score: 2-2

[11:32] Team_001 possession (Score: 2-2)
Klay Harden attempts a Midrange. Contested by Miles Bane (4.8 feet, MAN). Klay Harden misses. Offensive rebound by Dejounte McCollum! Dejounte McCollum kicks it out.

[11:15] Team_001 possession (Score: 2-2)
Cole Ball attempts a Midrange. Contested by Jordan Green (4.1 feet, MAN). Cole Ball misses. Rebound secured by Miles Bane.

[11:01] Team_002 possession (Score: 2-2)
Tyler Porzingis attempts a Midrange. Contested by Dejounte McCollum (3.9 feet, ZONE). Tyler Porzingis misses. Rebound secured by Miles Griffin.

[10:45] Team_001 possession (Score: 2-2)
Cole Ball makes the Midrange and draws the foul on Carmelo Lowry! And-1! Cole Ball to the line for 1. [Team fouls: 2] (Carmelo Lowry: 1 personal fouls)   FT 1/1: GOOD Cole Ball makes 1/1 from the line.
Score: 5-2

[10:35] Team_002 possession (Score: 5-2)
Tyler Porzingis attempts a 3Pt. Contested by Miles Griffin (5.2 feet, MAN). Tyler Porzingis misses. Rebound secured by Miles Griffin.

[10:25] Team_001 possession (Score: 5-2)
Dirk Young attempts a Layup. Contested by CJ Barrett (4.4 feet, MAN). DIRK YOUNG MAKES IT!
Score: 7-2

[10:11] Team_002 possession (Score: 7-2)
Miles Bane drives, Dejounte McCollum stays with him. Miles Bane attempts a Layup. Contested by Dejounte McCollum (4.0 feet, ZONE). MILES BANE MAKES IT! Assist: CJ Barrett
Score: 7-4

[09:57] Team_001 possession (Score: 7-4)
Dejounte McCollum attempts a 3Pt. Contested by Carmelo Lowry (6.0 feet, MAN). Dejounte McCollum misses. Rebound secured by CJ Barrett.

[09:44] Team_002 possession (Score: 7-4)
Jordan Green commits a violation (traveling/carry)! TURNOVER! (dead ball)

[09:44] Substitution (Team_001): Klay Harden OUT → Rudy George IN (stamina_rule2)

[09:44] Substitution (Team_001): Dirk Young OUT → Ja Dosunmu IN (stamina_rule2)

[09:44] Substitution (Team_001): Cole Ball OUT → Larry Trent IN (stamina_rule2)

[09:44] Substitution (Team_001): Miles Griffin OUT → Kristaps Ming IN (stamina_rule2)

[09:44] Substitution (Team_002): Miles Bane OUT → John Duncan IN (stamina_rule2)

[09:44] Substitution (Team_002): CJ Barrett OUT → Dirk Middleton IN (stamina_rule2)

[09:44] Substitution (Team_002): Jordan Green OUT → Anfernee Sexton IN (stamina_rule2)

[09:44] Substitution (Team_002): Carmelo Lowry OUT → Julius Curry IN (stamina_rule2)

[09:44] Substitution (Team_002): Tyler Porzingis OUT → Lamelo O'Neal IN (stamina_rule2)

[09:28] Team_001 possession (Score: 7-4)
FOUL! Shooting foul on John Duncan. Ja Dosunmu to the line for 3 free throws. [Team fouls: 3] (John Duncan: 1 personal fouls)   FT 1/3: GOOD   FT 2/3: GOOD   FT 3/3: MISS Ja Dosunmu makes 2/3 from the line. Rebound secured by Anfernee Sexton.
Score: 9-4

[09:15] Team_002 possession (Score: 9-4)
FOUL! Holding foul on Larry Trent. [Team fouls: 4] No free throws, side out. (Larry Trent: 1 personal fouls)

[09:00] Team_001 possession (Score: 9-4)
FOUL! Reach-in foul on Dirk Middleton during the drive. [IN THE BONUS! 5 team fouls] Rudy George to the line for 2 free throws. (Dirk Middleton: 1 personal fouls)   FT 1/2: GOOD   FT 2/2: GOOD Rudy George makes 2/2 from the line.
Score: 11-4

[08:46] Team_002 possession (Score: 11-4)
Dirk Middleton drives, Rudy George stays with him. Dirk Middleton attempts a Layup. Contested by Rudy George (5.2 feet, MAN). DIRK MIDDLETON MAKES IT! Assist: Anfernee Sexton
Score: 11-6

[08:35] Team_001 possession (Score: 11-6)
Ja Dosunmu attempts a Midrange. Contested by John Duncan (5.9 feet, MAN). Ja Dosunmu misses. Rebound secured by Anfernee Sexton.

[08:19] Team_002 possession (Score: 11-6)
Julius Curry attempts a 3Pt. Contested by Ja Dosunmu (4.8 feet, ZONE). Julius Curry misses. Rebound secured by Larry Trent.

[08:03] Team_001 possession (Score: 11-6)
Ja Dosunmu attempts a Midrange. Contested by Julius Curry (5.8 feet, ZONE). Ja Dosunmu misses. Rebound secured by Lamelo O'Neal.

[07:50] Team_002 possession (Score: 11-6)
Dirk Middleton attempts a Layup. Contested by Dejounte McCollum (4.2 feet, ZONE). DIRK MIDDLETON MAKES IT! Assist: Julius Curry
Score: 11-8

[07:39] Team_001 possession (Score: 11-8)
Larry Trent attempts a 3Pt. Contested by Anfernee Sexton (4.9 feet, MAN). Larry Trent misses. Offensive rebound by Dejounte McCollum! Dejounte McCollum kicks it out.

[07:25] Team_001 possession (Score: 11-8)
Ja Dosunmu attempts a 3Pt. Wide open! John Duncan is 6.0 feet away. [MAN] Ja Dosunmu misses. Offensive rebound by Dejounte McCollum! Dejounte McCollum kicks it out.

[07:12] Team_001 possession (Score: 11-8)
Rudy George drives and kicks out. Rudy George attempts a 3Pt. Wide open! Dirk Middleton is 6.5 feet away. [MAN] Rudy George misses. Rebound secured by John Duncan.

[07:02] Team_002 possession (Score: 11-8)
FOUL! Reach-in foul on Rudy George during the drive. [IN THE BONUS! 6 team fouls] Dirk Middleton to the line for 2 free throws. (Rudy George: 1 personal fouls)   FT 1/2: MISS   FT 2/2: MISS Dirk Middleton makes 0/2 from the line. Offensive rebound by Julius Curry! Julius Curry kicks it out.

[06:48] Team_002 possession (Score: 11-8)
Lamelo O'Neal drives and kicks out. Anfernee Sexton attempts a Midrange. Contested by Larry Trent (4.8 feet, ZONE). Anfernee Sexton misses. Offensive rebound by Anfernee Sexton! Anfernee Sexton kicks it out.

[06:32] Team_002 possession (Score: 11-8)
John Duncan attempts a 3Pt. Contested by Ja Dosunmu (5.2 feet, MAN). John Duncan misses. Rebound secured by Rudy George.

[06:18] Team_001 possession (Score: 11-8)
Ja Dosunmu attempts a 3Pt. Wide open! John Duncan is 6.1 feet away. [MAN] Ja Dosunmu misses. Rebound secured by Anfernee Sexton.

[06:06] Team_002 possession (Score: 11-8)
Julius Curry throws a bad pass out of bounds! TURNOVER! (dead ball)

[06:06] Substitution (Team_001): Dejounte McCollum OUT → Cole Ball IN (stamina_rule2)

[05:48] Team_001 possession (Score: 11-8)
Cole Ball attempts a Midrange. Contested by Anfernee Sexton (5.2 feet, MAN). Cole Ball misses. Rebound secured by Anfernee Sexton.

[05:36] Team_002 possession (Score: 11-8)
FOUL! Reach-in foul on Ja Dosunmu during the drive. [IN THE BONUS! 8 team fouls] John Duncan to the line for 2 free throws. (Ja Dosunmu: 1 personal fouls)   FT 1/2: MISS   FT 2/2: GOOD John Duncan makes 1/2 from the line.
Score: 11-9

[05:20] Team_001 possession (Score: 11-9)
Kristaps Ming makes the Layup and draws the foul on Lamelo O'Neal! And-1! Kristaps Ming to the line for 1. [BONUS: 9 team fouls] (Lamelo O'Neal: 1 personal fouls)   FT 1/1: GOOD Kristaps Ming makes 1/1 from the line.
Score: 14-9

[05:07] Team_002 possession (Score: 14-9)
John Duncan drives, picks up Ja Dosunmu. Help arrives from Larry Trent! John Duncan attempts a Layup. Contested by Larry Trent (5.5 feet, MAN). JOHN DUNCAN MAKES IT!
Score: 14-11

[04:50] Team_001 possession (Score: 14-11)
Larry Trent attempts a 3Pt. Contested by Anfernee Sexton (5.3 feet, MAN). Larry Trent misses. Rebound secured by Julius Curry.

[04:39] Team_002 possession (Score: 14-11)
John Duncan attempts a Layup. Wide open! Kristaps Ming is 7.0 feet away. [ZONE] John Duncan misses. Rebound secured by Larry Trent.

[04:26] Team_001 possession (Score: 14-11)
Cole Ball makes the Layup and draws the foul on Anfernee Sexton! And-1! Cole Ball to the line for 1. [BONUS: 10 team fouls] (Anfernee Sexton: 1 personal fouls)   FT 1/1: MISS Cole Ball makes 0/1 from the line. Rebound secured by Anfernee Sexton.
Score: 16-11

[04:12] Team_002 possession (Score: 16-11)
Lamelo O'Neal attempts a 3Pt. Contested by Cole Ball (3.1 feet, ZONE). LAMELO O'NEAL MAKES IT! Assist: Julius Curry
Score: 16-14

[04:01] Team_001 possession (Score: 16-14)
Kristaps Ming drives, picks up Lamelo O'Neal. Help arrives from John Duncan! Kristaps Ming attempts a Dunk. Wide open! John Duncan is 6.6 feet away. [MAN] Kristaps Ming misses. Offensive rebound by Cole Ball! Cole Ball kicks it out.

[03:49] Team_001 possession (Score: 16-14)
Kristaps Ming drives to the basket... Kristaps Ming throws a bad pass! Stolen by Lamelo O'Neal! TURNOVER! (live ball)

[03:36] Team_002 possession (Score: 16-14)
Anfernee Sexton drives, Kristaps Ming stays with him. Anfernee Sexton attempts a Layup. Wide open! Kristaps Ming is 7.2 feet away. [ZONE] ANFERNEE SEXTON MAKES IT!
Score: 16-16

[03:25] Team_001 possession (Score: 16-16)
Larry Trent drives, picks up Anfernee Sexton. Help arrives from John Duncan! Larry Trent attempts a Layup. Contested by John Duncan (5.5 feet, MAN). LARRY TRENT MAKES IT! Assist: Kristaps Ming
Score: 18-16

[03:14] Team_002 possession (Score: 18-16)
John Duncan attempts a 3Pt. Contested by Ja Dosunmu (5.9 feet, MAN). John Duncan misses. Rebound secured by Cole Ball.

[03:03] Team_001 possession (Score: 18-16)
Kristaps Ming makes the Layup and draws the foul on Lamelo O'Neal! And-1! Kristaps Ming to the line for 1. [BONUS: 11 team fouls] (Lamelo O'Neal: 2 personal fouls)   FT 1/1: GOOD Kristaps Ming makes 1/1 from the line.
Score: 21-16

[02:49] Team_002 possession (Score: 21-16)
Anfernee Sexton attempts a Midrange. Contested by Cole Ball (3.3 feet, MAN). Anfernee Sexton misses. Rebound secured by Cole Ball.

[02:30] Team_001 possession (Score: 21-16)
Rudy George attempts a Midrange. Wide open! Dirk Middleton is 7.1 feet away. [MAN] RUDY GEORGE MAKES IT!
Score: 23-16

[02:17] Team_002 possession (Score: 23-16)
Julius Curry drives and kicks out. John Duncan attempts a Midrange. Wide open! Ja Dosunmu is 6.1 feet away. [MAN] JOHN DUNCAN MAKES IT! Assist: Anfernee Sexton
Score: 23-18

[02:02] Team_001 possession (Score: 23-18)
Larry Trent drives, Julius Curry stays with him. Larry Trent attempts a Dunk. Wide open! Julius Curry is 6.7 feet away. [ZONE] LARRY TRENT MAKES IT! Assist: Rudy George
Score: 25-18

[01:48] Team_002 possession (Score: 25-18)
Lamelo O'Neal attempts a Layup. Wide open! Kristaps Ming is 7.5 feet away. [MAN] LAMELO O'NEAL MAKES IT! Assist: Dirk Middleton
Score: 25-20

[01:34] Team_001 possession (Score: 25-20)
Ja Dosunmu attempts a 3Pt. Wide open! John Duncan is 6.8 feet away. [MAN] JA DOSUNMU MAKES IT! Assist: Rudy George
Score: 28-20

[01:21] Team_002 possession (Score: 28-20)
John Duncan drives and kicks out. Anfernee Sexton attempts a Midrange. Wide open! Rudy George is 6.4 feet away. [ZONE] ANFERNEE SEXTON MAKES IT!
Score: 28-22

[01:04] Team_001 possession (Score: 28-22)
Larry Trent makes the Layup and draws the foul on Anfernee Sexton! And-1! Larry Trent to the line for 1. [BONUS: 12 team fouls] (Anfernee Sexton: 2 personal fouls)   FT 1/1: GOOD Larry Trent makes 1/1 from the line.
Score: 31-22

[00:48] Team_002 possession (Score: 31-22)
Lamelo O'Neal attempts a Midrange. Contested by Larry Trent (5.9 feet, ZONE). Lamelo O'Neal misses. Rebound secured by Larry Trent.

[00:32] Team_001 possession (Score: 31-22)
Cole Ball drives and kicks out. Rudy George attempts a 3Pt. Wide open! Dirk Middleton is 7.4 feet away. [MAN] RUDY GEORGE MAKES IT! Assist: Kristaps Ming
Score: 34-22

[00:18] Team_002 possession (Score: 34-22)
Anfernee Sexton drives and kicks out. John Duncan attempts a 3Pt. Wide open! Ja Dosunmu is 6.6 feet away. [MAN] John Duncan misses. Rebound secured by Rudy George.

[00:02] Team_001 possession (Score: 34-22)
Cole Ball attempts a 3Pt. Wide open! Anfernee Sexton is 6.1 feet away. [MAN] Cole Ball misses. Rebound secured by Anfernee Sexton.

================================================================================
                              1ST QUARTER COMPLETE                              
================================================================================

1ST QUARTER SCORE: Team_001 34, Team_002 22

BOX SCORE:
================================================================================

Team_001
--------------------------------------------------------------------------------
Player                MIN  PTS  REB  AST  TO      FG   FG%      3P   3P%
--------------------------------------------------------------------------------
Rudy George            10    7    2    2   0   2/3    66.7     0/0   0.0
Larry Trent            10    7    3    0   0   3/4    75.0     0/0   0.0
Kristaps Ming          10    6    0    2   0   2/2   100.0     0/0   0.0
Cole Ball               8    5    3    0   0   2/6    33.3     0/0   0.0
Ja Dosunmu             10    3    0    0   0   1/5    20.0     0/0   0.0
Dirk Young              3    2    0    0   0   1/1   100.0     0/0   0.0
Dejounte McCollum       6    0    3    1   0   0/1     0.0     0/0   0.0
Miles Griffin           3    0    2    0   0   0/0     0.0     0/0   0.0

TEAM: FG: 11/22 (50.0%), 3PT: 1/6 (16.7%), REB: 13 (4 off, 9 def), AST: 5, TO: 1
TEAM FOULS: 0


Team_002
--------------------------------------------------------------------------------
Player                MIN  PTS  REB  AST  TO      FG   FG%      3P   3P%
--------------------------------------------------------------------------------
Lamelo O'Neal          10    5    1    0   0   2/3    66.7     0/0   0.0
John Duncan            10    5    1    0   0   2/5    40.0     0/0   0.0
Miles Bane              3    4    1    0   0   1/1   100.0     0/0   0.0
Anfernee Sexton        10    4    7    2   0   2/4    50.0     0/0   0.0
Dirk Middleton         10    4    0    1   0   2/2   100.0     0/0   0.0
Tyler Porzingis         3    0    0    0   0   0/2     0.0     0/0   0.0
CJ Barrett              3    0    1    1   0   0/0     0.0     0/0   0.0
Julius Curry           10    0    2    2   0   0/1     0.0     0/0   0.0

TEAM: FG: 9/18 (50.0%), 3PT: 1/5 (20.0%), REB: 13 (2 off, 11 def), AST: 6, TO: 2
TEAM FOULS: 12 [Team_001 in BONUS]

================================================================================

================================================================================
                       2ND QUARTER - Team_001 vs Team_002                       
================================================================================

[12:00] Team_001 possession (Score: 34-22)
Dirk Young attempts a 3Pt. Contested by CJ Barrett (3.8 feet, MAN). DIRK YOUNG MAKES IT! Assist: Cole Ball
Score: 37-22

[11:49] Team_002 possession (Score: 37-22)
Miles Bane attempts a Midrange. Contested by Klay Harden (3.4 feet, MAN). Miles Bane misses. Rebound secured by Miles Griffin.

[11:31] Team_001 possession (Score: 37-22)
Cole Ball attempts a 3Pt. Contested by Jordan Green (3.8 feet, MAN). Cole Ball misses. Rebound secured by Carmelo Lowry.

[11:19] Team_002 possession (Score: 37-22)
Tyler Porzingis attempts a Midrange. Contested by Cole Ball (3.4 feet, ZONE). Tyler Porzingis misses. Rebound secured by Miles Griffin.

[11:06] Team_001 possession (Score: 37-22)
FOUL! Shooting foul on Tyler Porzingis. Miles Griffin to the line for 2 free throws. [Team fouls: 1] (Tyler Porzingis: 1 personal fouls)   FT 1/2: GOOD   FT 2/2: GOOD Miles Griffin makes 2/2 from the line.
Score: 39-22

[10:52] Team_002 possession (Score: 39-22)
Tyler Porzingis drives to the basket... Tyler Porzingis throws a bad pass out of bounds! TURNOVER! (dead ball)

[10:52] Substitution (Team_001): Cole Ball OUT → Franz Bryant IN (stamina_rule2)

[10:52] Substitution (Team_002): Carmelo Lowry OUT → Anfernee Sexton IN (stamina_rule2)

[10:34] Team_001 possession (Score: 39-22)
Dirk Young attempts a Midrange. Contested by CJ Barrett (3.8 feet, MAN). Dirk Young misses. Rebound secured by Tyler Porzingis.

[10:15] Team_002 possession (Score: 39-22)
Miles Bane attempts a 3Pt. Contested by Klay Harden (3.6 feet, ZONE). Miles Bane misses. Rebound secured by Miles Griffin.

[09:59] Team_001 possession (Score: 39-22)
FOUL! Shooting foul on Tyler Porzingis. Franz Bryant to the line for 2 free throws. [Team fouls: 2] (Tyler Porzingis: 2 personal fouls)   FT 1/2: GOOD   FT 2/2: GOOD Franz Bryant makes 2/2 from the line.
Score: 41-22

[09:49] Team_002 possession (Score: 41-22)
Tyler Porzingis attempts a Midrange. Contested by Miles Griffin (4.0 feet, MAN). TYLER PORZINGIS MAKES IT!
Score: 41-24

[09:36] Team_001 possession (Score: 41-24)
FOUL! Reach-in foul on Miles Bane during the drive. [Team fouls: 3] No free throws, side out. (Miles Bane: 1 personal fouls)

[09:25] Team_002 possession (Score: 41-24)
Tyler Porzingis attempts a Layup. Contested by Miles Griffin (4.1 feet, MAN). TYLER PORZINGIS MAKES IT! Assist: CJ Barrett
Score: 41-26

[09:16] Team_001 possession (Score: 41-26)
Klay Harden attempts a 3Pt. Contested by Miles Bane (4.5 feet, MAN). KLAY HARDEN MAKES IT! Assist: Miles Griffin
Score: 44-26

[09:02] Team_002 possession (Score: 44-26)
Anfernee Sexton attempts a Midrange. Contested by Franz Bryant (3.8 feet, ZONE). Anfernee Sexton misses. Rebound secured by Miles Griffin.

[08:46] Team_001 possession (Score: 44-26)
Dirk Young attempts a Midrange. Contested by CJ Barrett (3.9 feet, MAN). Dirk Young misses. Offensive rebound by Dejounte McCollum! Dejounte McCollum kicks it out.

[08:35] Team_001 possession (Score: 44-26)
Dirk Young drives to the basket... Dirk Young commits an offensive foul! TURNOVER! (dead ball)

[08:21] Team_002 possession (Score: 44-26)
Jordan Green drives and kicks out. Miles Bane attempts a 3Pt. Contested by Klay Harden (4.0 feet, MAN). Miles Bane misses. Rebound secured by Klay Harden.

[08:11] Team_001 possession (Score: 44-26)
Dirk Young attempts a Layup. BLOCKED BY MILES BANE! Ball goes out of bounds. Turnover!

[08:11] Substitution (Team_001): Klay Harden OUT → Rudy George IN (stamina_rule2)

[08:11] Substitution (Team_001): Dirk Young OUT → Klay Harden IN (stamina_rule2)

[08:11] Substitution (Team_001): Miles Griffin OUT → Kristaps Ming IN (stamina_rule2)

[08:11] Substitution (Team_002): Tyler Porzingis OUT → Lamelo O'Neal IN (stamina_rule2)

[07:58] Team_002 possession (Score: 44-26)
Anfernee Sexton attempts a 3Pt. Contested by Klay Harden (4.1 feet, ZONE). ANFERNEE SEXTON MAKES IT! Assist: CJ Barrett
Score: 44-29

[07:48] Team_001 possession (Score: 44-29)
Franz Bryant drives, Lamelo O'Neal stays with him. Franz Bryant attempts a Dunk. Contested by Lamelo O'Neal (5.2 feet, MAN). FRANZ BRYANT MAKES IT! Assist: Dejounte McCollum
Score: 46-29

[07:35] Team_002 possession (Score: 46-29)
Miles Bane attempts a 3Pt. Contested by Klay Harden (4.1 feet, MAN). Miles Bane misses. Offensive rebound by CJ Barrett! CJ Barrett kicks it out.

[07:19] Team_002 possession (Score: 46-29)
CJ Barrett drives to the basket... CJ Barrett throws a bad pass out of bounds! TURNOVER! (dead ball)

[07:19] Substitution (Team_001): Klay Harden OUT → Dirk Young IN (stamina_rule2)

[07:19] Substitution (Team_001): Dejounte McCollum OUT → Cole Ball IN (stamina_rule2)

[07:19] Substitution (Team_002): Miles Bane OUT → John Duncan IN (stamina_rule2)

[07:19] Substitution (Team_002): CJ Barrett OUT → Miles Bane IN (stamina_rule2)

[07:04] Team_001 possession (Score: 46-29)
Rudy George attempts a 3Pt. Contested by Miles Bane (4.7 feet, MAN). Rudy George misses. Offensive rebound by Dirk Young! Dirk Young kicks it out.

[06:51] Team_001 possession (Score: 46-29)
FOUL! Holding foul on Lamelo O'Neal. [Team fouls: 4] No free throws, side out. (Lamelo O'Neal: 1 personal fouls)

[06:38] Team_002 possession (Score: 46-29)
Jordan Green attempts a 3Pt. Contested by Dirk Young (4.1 feet, ZONE). Jordan Green misses. Rebound secured by Dirk Young.

[06:26] Team_001 possession (Score: 46-29)
Cole Ball drives, picks up Jordan Green. Help arrives from Miles Bane! Cole Ball attempts a Dunk. Contested by Miles Bane (4.2 feet, MAN). COLE BALL MAKES IT! Assist: Kristaps Ming
Score: 48-29

[06:11] Team_002 possession (Score: 48-29)
Jordan Green drives to the basket... Jordan Green throws a bad pass out of bounds! TURNOVER! (dead ball)

[06:11] Substitution (Team_001): Dirk Young OUT → Klay Harden IN (stamina_rule2)

[06:11] Substitution (Team_001): Cole Ball OUT → Dejounte McCollum IN (stamina_rule2)

[06:11] Substitution (Team_002): Miles Bane OUT → CJ Barrett IN (stamina_rule2)

[06:11] Substitution (Team_002): Jordan Green OUT → Carmelo Lowry IN (stamina_rule2)

[05:57] Team_001 possession (Score: 48-29)
Kristaps Ming attempts a Layup. Contested by Carmelo Lowry (3.6 feet, MAN). Kristaps Ming misses. Offensive rebound by Klay Harden! Klay Harden kicks it out.

[05:41] Team_001 possession (Score: 48-29)
Kristaps Ming attempts a Midrange. Contested by Carmelo Lowry (3.7 feet, MAN). Kristaps Ming misses. FOUL! Loose ball foul on Anfernee Sexton during the rebound battle. [IN THE BONUS! 5 team fouls] Dejounte McCollum to the line for 2 free throws. (Anfernee Sexton: 1 personal fouls)   FT 1/2: GOOD   FT 2/2: GOOD Dejounte McCollum makes 2/2 from the line.
Score: 50-29

[05:25] Team_002 possession (Score: 50-29)
Anfernee Sexton drives to the basket... Anfernee Sexton commits a violation (traveling/carry)! TURNOVER! (dead ball)

[05:25] Substitution (Team_001): Klay Harden OUT → Dirk Young IN (stamina_rule2)

[05:25] Substitution (Team_001): Dejounte McCollum OUT → Cole Ball IN (stamina_rule2)

[05:25] Substitution (Team_002): CJ Barrett OUT → Dirk Middleton IN (stamina_rule2)

[05:09] Team_001 possession (Score: 50-29)
Cole Ball attempts a Midrange. Wide open! Anfernee Sexton is 6.1 feet away. [MAN] COLE BALL MAKES IT!
Score: 52-29

[04:54] Team_002 possession (Score: 52-29)
Carmelo Lowry attempts a 3Pt. Contested by Cole Ball (3.2 feet, ZONE). Carmelo Lowry misses. Rebound secured by Franz Bryant.

[04:42] Team_001 possession (Score: 52-29)
Franz Bryant attempts a Midrange. Contested by Carmelo Lowry (3.8 feet, ZONE). FRANZ BRYANT MAKES IT! Assist: Rudy George
Score: 54-29

[04:26] Team_002 possession (Score: 54-29)
Lamelo O'Neal attempts a Midrange. BLOCKED BY FRANZ BRYANT! Ball goes out of bounds. Turnover!

[04:26] Substitution (Team_001): Dirk Young OUT → Ja Dosunmu IN (stamina_rule2)

[04:26] Substitution (Team_001): Cole Ball OUT → Dejounte McCollum IN (stamina_rule2)

[04:11] Team_001 possession (Score: 54-29)
Kristaps Ming makes the Layup and draws the foul on Carmelo Lowry! And-1! Kristaps Ming to the line for 1. [BONUS: 6 team fouls] (Carmelo Lowry: 1 personal fouls)   FT 1/1: GOOD Kristaps Ming makes 1/1 from the line.
Score: 57-29

[03:56] Team_002 possession (Score: 57-29)
Dirk Middleton drives, picks up Dejounte McCollum. Help arrives from Rudy George! Dirk Middleton attempts a Layup. Contested by Rudy George (4.1 feet, ZONE). DIRK MIDDLETON MAKES IT! Assist: Carmelo Lowry
Score: 57-31

[03:36] Team_001 possession (Score: 57-31)
Kristaps Ming attempts a Midrange. Contested by Carmelo Lowry (3.9 feet, MAN). Kristaps Ming misses. Rebound secured by Carmelo Lowry.

[03:21] Team_002 possession (Score: 57-31)
Carmelo Lowry drives to the basket... Carmelo Lowry loses control! Ball rolls out of bounds! TURNOVER! (dead ball)

[03:21] Substitution (Team_001): Dejounte McCollum OUT → Larry Trent IN (stamina_rule2)

[03:21] Substitution (Team_002): Carmelo Lowry OUT → Julius Curry IN (stamina_rule2)

[03:08] Team_001 possession (Score: 57-31)
Rudy George drives and kicks out. Larry Trent attempts a Midrange. Wide open! Anfernee Sexton is 6.5 feet away. [MAN] LARRY TRENT MAKES IT! Assist: Ja Dosunmu
Score: 59-31

[02:56] Team_002 possession (Score: 59-31)
Lamelo O'Neal attempts a 3Pt. Contested by Ja Dosunmu (4.2 feet, ZONE). Lamelo O'Neal misses. Rebound secured by Franz Bryant.

[02:41] Team_001 possession (Score: 59-31)
Kristaps Ming drives, Lamelo O'Neal stays with him. Kristaps Ming attempts a Layup. Wide open! Lamelo O'Neal is 6.6 feet away. [MAN] KRISTAPS MING MAKES IT!
Score: 61-31

[02:30] Team_002 possession (Score: 61-31)
Julius Curry attempts a Midrange. Contested by Franz Bryant (4.7 feet, MAN). Julius Curry misses. Rebound secured by Ja Dosunmu.

[02:13] Team_001 possession (Score: 61-31)
Larry Trent makes the Dunk and draws the foul on Dirk Middleton! And-1! Larry Trent to the line for 1. [BONUS: 7 team fouls] (Dirk Middleton: 1 personal fouls)   FT 1/1: GOOD Larry Trent makes 1/1 from the line.
Score: 64-31

[02:03] Team_002 possession (Score: 64-31)
Dirk Middleton loses the ball! Stripped by Rudy George! TURNOVER! (live ball)

[01:48] Team_001 possession (Score: 64-31)
Rudy George attempts a 3Pt. Wide open! Dirk Middleton is 6.5 feet away. [MAN] RUDY GEORGE MAKES IT! Assist: Larry Trent
Score: 67-31

[01:34] Team_002 possession (Score: 67-31)
Anfernee Sexton attempts a Midrange. Contested by Larry Trent (4.2 feet, MAN). ANFERNEE SEXTON MAKES IT!
Score: 67-33

[01:21] Team_001 possession (Score: 67-33)
Rudy George drives, Dirk Middleton stays with him. Rudy George attempts a Dunk. Wide open! Dirk Middleton is 6.6 feet away. [MAN] Rudy George misses. Rebound secured by Julius Curry.

[01:07] Team_002 possession (Score: 67-33)
Dirk Middleton attempts a 3Pt. Contested by Ja Dosunmu (4.6 feet, ZONE). Dirk Middleton misses. Rebound secured by Ja Dosunmu.

[00:50] Team_001 possession (Score: 67-33)
Larry Trent attempts a 3Pt. Contested by Julius Curry (5.7 feet, ZONE). Larry Trent misses. FOUL! Loose ball foul on Anfernee Sexton during the rebound battle. [IN THE BONUS! 8 team fouls] Larry Trent to the line for 2 free throws. (Anfernee Sexton: 2 personal fouls)   FT 1/2: MISS   FT 2/2: GOOD Larry Trent makes 1/2 from the line.
Score: 68-33

[00:33] Team_002 possession (Score: 68-33)
Anfernee Sexton attempts a Layup. Contested by Larry Trent (4.4 feet, MAN). Anfernee Sexton misses. Offensive rebound by Anfernee Sexton! Anfernee Sexton kicks it out.

[00:16] Team_002 possession (Score: 68-33)
Julius Curry attempts a Midrange. Contested by Franz Bryant (5.1 feet, MAN). JULIUS CURRY MAKES IT!
Score: 68-35

[00:01] Team_001 possession (Score: 68-35)
Larry Trent attempts a 3Pt. Contested by Julius Curry (5.7 feet, ZONE). Larry Trent misses. Rebound secured by Julius Curry.

================================================================================
                              2ND QUARTER COMPLETE                              
================================================================================

2ND QUARTER SCORE: Team_001 34, Team_002 13

BOX SCORE:
================================================================================

Team_001
--------------------------------------------------------------------------------
Player                MIN  PTS  REB  AST  TO      FG   FG%      3P   3P%
--------------------------------------------------------------------------------
Franz Bryant           11    6    2    0   0   2/2   100.0     0/0   0.0
Larry Trent            13    6    0    1   0   2/3    66.7     0/0   0.0
Kristaps Ming          18    5    0    1   0   2/3    66.7     0/0   0.0
Cole Ball              12    4    0    1   0   2/3    66.7     0/0   0.0
Dirk Young              9    3    2    0   0   1/2    50.0     0/0   0.0
Klay Harden             8    3    2    0   0   1/1   100.0     0/0   0.0
Rudy George            18    3    0    1   0   1/2    50.0     0/0   0.0
Miles Griffin           7    2    4    1   0   0/0     0.0     0/0   0.0
Dejounte McCollum      13    2    1    1   0   0/0     0.0     0/0   0.0
Ja Dosunmu             14    0    2    1   0   0/0     0.0     0/0   0.0

TEAM: FG: 11/16 (68.8%), 3PT: 3/5 (60.0%), REB: 13 (3 off, 10 def), AST: 7, TO: 2
TEAM FOULS: 0


Team_002
--------------------------------------------------------------------------------
Player                MIN  PTS  REB  AST  TO      FG   FG%      3P   3P%
--------------------------------------------------------------------------------
Anfernee Sexton        20    5    1    0   0   2/3    66.7     0/0   0.0
Tyler Porzingis         7    4    1    0   0   2/3    66.7     0/0   0.0
Dirk Middleton         15    2    0    0   0   1/2    50.0     0/0   0.0
Julius Curry           13    2    2    0   0   1/2    50.0     0/0   0.0
Miles Bane              9    0    0    0   0   0/2     0.0     0/0   0.0
Carmelo Lowry           7    0    2    1   0   0/1     0.0     0/0   0.0
CJ Barrett              8    0    1    2   0   0/0     0.0     0/0   0.0
Jordan Green            9    0    0    0   0   0/2     0.0     0/0   0.0
Lamelo O'Neal          18    0    0    0   0   0/1     0.0     0/0   0.0

TEAM: FG: 6/16 (37.5%), 3PT: 1/6 (16.7%), REB: 7 (2 off, 5 def), AST: 3, TO: 7
TEAM FOULS: 8 [Team_001 in BONUS]

================================================================================

================================================================================
                       3RD QUARTER - Team_001 vs Team_002                       
================================================================================

[12:00] Team_001 possession (Score: 68-35)
Klay Harden attempts a 3Pt. Contested by Miles Bane (4.5 feet, MAN). Klay Harden misses. Rebound secured by Tyler Porzingis.

[11:43] Team_002 possession (Score: 68-35)
Jordan Green attempts a 3Pt. Contested by Cole Ball (2.8 feet, MAN). Jordan Green misses. Rebound secured by Dejounte McCollum.

[11:30] Team_001 possession (Score: 68-35)
Dirk Young attempts a Layup. BLOCKED BY CJ BARRETT! Ball goes out of bounds. Turnover!

[11:15] Team_002 possession (Score: 68-35)
Miles Bane attempts a 3Pt. Contested by Klay Harden (3.3 feet, MAN). Miles Bane misses. Rebound secured by Dejounte McCollum.

[10:58] Team_001 possession (Score: 68-35)
Cole Ball attempts a 3Pt. Contested by Jordan Green (3.8 feet, MAN). Cole Ball misses. Offensive rebound by Miles Griffin! Miles Griffin kicks it out.

[10:47] Team_001 possession (Score: 68-35)
Dirk Young attempts a Midrange. Contested by CJ Barrett (3.8 feet, MAN). DIRK YOUNG MAKES IT! Assist: Dejounte McCollum
Score: 70-35

[10:32] Team_002 possession (Score: 70-35)
Jordan Green makes the Midrange and draws the foul on Cole Ball! And-1! Jordan Green to the line for 1. [Team fouls: 1] (Cole Ball: 1 personal fouls)   FT 1/1: GOOD Jordan Green makes 1/1 from the line.
Score: 70-38

[10:19] Team_001 possession (Score: 70-38)
Cole Ball attempts a Layup. Contested by Tyler Porzingis (3.0 feet, ZONE). COLE BALL MAKES IT! Assist: Klay Harden
Score: 72-38

[10:02] Team_002 possession (Score: 72-38)
Carmelo Lowry makes the Dunk and draws the foul on Miles Griffin! And-1! Carmelo Lowry to the line for 1. [Team fouls: 2] (Miles Griffin: 1 personal fouls)   FT 1/1: GOOD Carmelo Lowry makes 1/1 from the line.
Score: 72-41

[09:47] Team_001 possession (Score: 72-41)
Cole Ball commits an offensive foul! Jordan Green drew the charge! TURNOVER! (dead ball)

[09:35] Team_002 possession (Score: 72-41)
Tyler Porzingis attempts a Layup. Contested by Miles Griffin (3.7 feet, MAN). TYLER PORZINGIS MAKES IT! Assist: CJ Barrett
Score: 72-43

[09:18] Team_001 possession (Score: 72-43)
Dirk Young drives, Tyler Porzingis stays with him. Dirk Young attempts a Dunk. Contested by Tyler Porzingis (3.0 feet, ZONE). DIRK YOUNG MAKES IT! Assist: Dejounte McCollum
Score: 74-43

[09:01] Team_002 possession (Score: 74-43)
Tyler Porzingis attempts a Midrange. Contested by Cole Ball (2.8 feet, ZONE). Tyler Porzingis misses. Rebound secured by Dejounte McCollum.

[08:50] Team_001 possession (Score: 74-43)
Klay Harden drives and kicks out. Dejounte McCollum attempts a 3Pt. Contested by Carmelo Lowry (3.6 feet, MAN). DEJOUNTE MCCOLLUM MAKES IT! Assist: Klay Harden
Score: 77-43

[08:39] Team_002 possession (Score: 77-43)
Miles Bane attempts a 3Pt. Contested by Klay Harden (3.3 feet, MAN). Miles Bane misses. Offensive rebound by Carmelo Lowry! Carmelo Lowry kicks it out.

[08:28] Team_002 possession (Score: 77-43)
Miles Bane attempts a 3Pt. Contested by Klay Harden (3.3 feet, MAN). MILES BANE MAKES IT! Assist: Tyler Porzingis
Score: 77-46

[08:15] Team_001 possession (Score: 77-46)
FOUL! Shooting foul on CJ Barrett. Cole Ball to the line for 2 free throws. [Team fouls: 3] (CJ Barrett: 1 personal fouls)   FT 1/2: GOOD   FT 2/2: GOOD Cole Ball makes 2/2 from the line.
Score: 79-46

[08:02] Team_002 possession (Score: 79-46)
Tyler Porzingis attempts a Layup. Contested by Miles Griffin (3.7 feet, MAN). TYLER PORZINGIS MAKES IT! Assist: Jordan Green
Score: 79-48

[07:45] Team_001 possession (Score: 79-48)
Miles Griffin attempts a Layup. Contested by Tyler Porzingis (3.0 feet, MAN). MILES GRIFFIN MAKES IT!
Score: 81-48

[07:28] Team_002 possession (Score: 81-48)
Miles Bane attempts a 3Pt. Contested by Klay Harden (3.3 feet, MAN). MILES BANE MAKES IT! Assist: Carmelo Lowry
Score: 81-51

[07:13] Team_001 possession (Score: 81-51)
Miles Griffin attempts a 3Pt. Contested by CJ Barrett (3.8 feet, ZONE). Miles Griffin misses. Rebound secured by Carmelo Lowry.

[06:57] Team_002 possession (Score: 81-51)
CJ Barrett makes the 3Pt and draws the foul on Dirk Young! And-1! CJ Barrett to the line for 1. [Team fouls: 4] (Dirk Young: 1 personal fouls)   FT 1/1: GOOD CJ Barrett makes 1/1 from the line.
Score: 81-55

[06:42] Team_001 possession (Score: 81-55)
Klay Harden attempts a Layup. BLOCKED BY MILES BANE! Offensive rebound by Cole Ball! Cole Ball kicks it out.

[06:22] Team_001 possession (Score: 81-55)
Dirk Young attempts a 3Pt. Contested by CJ Barrett (3.8 feet, MAN). Dirk Young misses. Rebound secured by Carmelo Lowry.

[06:09] Team_002 possession (Score: 81-55)
Jordan Green drives to the basket... Jordan Green loses the ball! Stripped by Miles Griffin! TURNOVER! (live ball)

[05:56] Team_001 possession (Score: 81-55)
Cole Ball drives, picks up Tyler Porzingis. Help arrives from CJ Barrett! Cole Ball attempts a Layup. Contested by CJ Barrett (3.0 feet, ZONE). COLE BALL MAKES IT! Assist: Miles Griffin
Score: 83-55

[05:40] Team_002 possession (Score: 83-55)
Miles Bane drives and kicks out. CJ Barrett attempts a 3Pt. Contested by Klay Harden (3.4 feet, ZONE). CJ Barrett misses. Rebound secured by Miles Griffin.

[05:26] Team_001 possession (Score: 83-55)
FOUL! Holding foul on Tyler Porzingis. [IN THE BONUS! 5 team fouls] Miles Griffin to the line for 2 free throws. (Tyler Porzingis: 1 personal fouls)   FT 1/2: GOOD   FT 2/2: GOOD Miles Griffin makes 2/2 from the line.
Score: 85-55

[05:14] Team_002 possession (Score: 85-55)
FOUL! Reach-in foul on Miles Griffin during the drive. [IN THE BONUS! 6 team fouls] CJ Barrett to the line for 2 free throws. (Miles Griffin: 2 personal fouls)   FT 1/2: GOOD   FT 2/2: MISS CJ Barrett makes 1/2 from the line. Rebound secured by Miles Griffin.
Score: 85-56

[05:03] Team_001 possession (Score: 85-56)
Dejounte McCollum attempts a Midrange. Contested by Carmelo Lowry (3.6 feet, MAN). DEJOUNTE MCCOLLUM MAKES IT! Assist: Cole Ball
Score: 87-56

[04:46] Team_002 possession (Score: 87-56)
Tyler Porzingis attempts a Layup. Contested by Miles Griffin (3.8 feet, MAN). TYLER PORZINGIS MAKES IT!
Score: 87-58

[04:30] Team_001 possession (Score: 87-58)
Cole Ball attempts a 3Pt. Contested by Jordan Green (3.9 feet, MAN). COLE BALL MAKES IT! Assist: Dejounte McCollum
Score: 90-58

[04:12] Team_002 possession (Score: 90-58)
Tyler Porzingis attempts a 3Pt. Contested by Klay Harden (3.6 feet, ZONE). Tyler Porzingis misses. Rebound secured by Dejounte McCollum.

[03:59] Team_001 possession (Score: 90-58)
Dirk Young attempts a 3Pt. Contested by CJ Barrett (4.0 feet, MAN). Dirk Young misses. Rebound secured by Miles Bane.

[03:39] Team_002 possession (Score: 90-58)
Jordan Green attempts a 3Pt. Contested by Cole Ball (3.0 feet, MAN). Jordan Green misses. Rebound secured by Miles Griffin.

[03:20] Team_001 possession (Score: 90-58)
FOUL! Reach-in foul on Miles Bane during the drive. [IN THE BONUS! 7 team fouls] Klay Harden to the line for 2 free throws. (Miles Bane: 1 personal fouls)   FT 1/2: GOOD   FT 2/2: MISS Klay Harden makes 1/2 from the line. Offensive rebound by Cole Ball! Cole Ball kicks it out.
Score: 91-58

[03:07] Team_001 possession (Score: 91-58)
Cole Ball attempts a Midrange. Contested by Jordan Green (4.0 feet, MAN). COLE BALL MAKES IT!
Score: 93-58

[02:50] Team_002 possession (Score: 93-58)
Carmelo Lowry drives and kicks out. Carmelo Lowry attempts a Midrange. Contested by Dejounte McCollum (3.9 feet, MAN). Carmelo Lowry misses. Rebound secured by Miles Griffin.

[02:35] Team_001 possession (Score: 93-58)
Klay Harden drives and kicks out. Miles Griffin attempts a 3Pt. Contested by Miles Bane (4.7 feet, ZONE). Miles Griffin misses. Rebound secured by Miles Bane.

[02:16] Team_002 possession (Score: 93-58)
Tyler Porzingis throws a bad pass out of bounds! TURNOVER! (dead ball)

[02:16] Substitution (Team_001): Klay Harden OUT → Ja Dosunmu IN (stamina_rule2)

[02:16] Substitution (Team_001): Dirk Young OUT → Rudy George IN (stamina_rule2)

[02:16] Substitution (Team_001): Miles Griffin OUT → Kristaps Ming IN (stamina_rule2)

[02:16] Substitution (Team_002): Miles Bane OUT → John Duncan IN (stamina_rule2)

[02:16] Substitution (Team_002): CJ Barrett OUT → Dirk Middleton IN (stamina_rule2)

[02:16] Substitution (Team_002): Jordan Green OUT → Anfernee Sexton IN (stamina_rule2)

[02:16] Substitution (Team_002): Carmelo Lowry OUT → Julius Curry IN (stamina_rule2)

[02:16] Substitution (Team_002): Tyler Porzingis OUT → Lamelo O'Neal IN (stamina_rule2)

[02:03] Team_001 possession (Score: 93-58)
Cole Ball attempts a Midrange. Contested by Anfernee Sexton (4.4 feet, MAN). Cole Ball misses. Rebound secured by Julius Curry.

[01:51] Team_002 possession (Score: 93-58)
Dirk Middleton drives, Rudy George stays with him. Dirk Middleton attempts a Dunk. Contested by Rudy George (4.7 feet, MAN). DIRK MIDDLETON MAKES IT! Assist: Anfernee Sexton
Score: 93-60

[01:35] Team_001 possession (Score: 93-60)
Cole Ball commits an offensive foul! Anfernee Sexton drew the charge! TURNOVER! (dead ball)

[01:24] Team_002 possession (Score: 93-60)
Dirk Middleton drives to the basket... Dirk Middleton commits an offensive foul! TURNOVER! (dead ball)

[01:09] Team_001 possession (Score: 93-60)
Ja Dosunmu drives, John Duncan stays with him. Ja Dosunmu attempts a Layup. Contested by John Duncan (5.5 feet, MAN). JA DOSUNMU MAKES IT! Assist: Cole Ball
Score: 95-60

[00:58] Team_002 possession (Score: 95-60)
Julius Curry drives, picks up Dejounte McCollum. Help arrives from Rudy George! Julius Curry attempts a Layup. Contested by Rudy George (4.1 feet, MAN). JULIUS CURRY MAKES IT! Assist: Lamelo O'Neal
Score: 95-62

[00:43] Team_001 possession (Score: 95-62)
Dejounte McCollum attempts a Layup. BLOCKED BY LAMELO O'NEAL! Rebound secured by Julius Curry.

[00:27] Team_002 possession (Score: 95-62)
John Duncan drives to the basket... John Duncan loses the ball! Stripped by Ja Dosunmu! TURNOVER! (live ball)

[00:13] Team_001 possession (Score: 95-62)
FOUL! Shooting foul on John Duncan. Ja Dosunmu to the line for 3 free throws. [BONUS: 8 team fouls] (John Duncan: 1 personal fouls)   FT 1/3: GOOD   FT 2/3: GOOD   FT 3/3: GOOD Ja Dosunmu makes 3/3 from the line.
Score: 98-62

================================================================================
                              3RD QUARTER COMPLETE                              
================================================================================

3RD QUARTER SCORE: Team_001 30, Team_002 27

BOX SCORE:
================================================================================

Team_001
--------------------------------------------------------------------------------
Player                MIN  PTS  REB  AST  TO      FG   FG%      3P   3P%
--------------------------------------------------------------------------------
Cole Ball              24   11    2    2   0   4/5    80.0     0/0   0.0
Dejounte McCollum      25    5    4    3   0   2/3    66.7     0/0   0.0
Ja Dosunmu             16    5    0    0   0   1/1   100.0     0/0   0.0
Miles Griffin          17    4    5    1   0   1/2    50.0     0/0   0.0
Dirk Young             19    4    0    0   0   2/4    50.0     0/0   0.0
Klay Harden            18    0    0    2   0   0/2     0.0     0/0   0.0

TEAM: FG: 10/17 (58.8%), 3PT: 1/5 (20.0%), REB: 11 (3 off, 8 def), AST: 8, TO: 3
TEAM FOULS: 0


Team_002
--------------------------------------------------------------------------------
Player                MIN  PTS  REB  AST  TO      FG   FG%      3P   3P%
--------------------------------------------------------------------------------
Tyler Porzingis        17    6    1    1   0   3/5    60.0     0/0   0.0
Miles Bane             19    6    2    0   0   2/4    50.0     0/0   0.0
CJ Barrett             18    4    0    1   0   1/2    50.0     0/0   0.0
Jordan Green           19    3    0    1   0   1/3    33.3     0/0   0.0
Carmelo Lowry          17    3    3    1   0   1/2    50.0     0/0   0.0
Julius Curry           15    2    2    0   0   1/1   100.0     0/0   0.0
Dirk Middleton         17    2    0    0   0   1/1   100.0     0/0   0.0
Anfernee Sexton        23    0    0    1   0   0/0     0.0     0/0   0.0
Lamelo O'Neal          20    0    0    1   0   0/0     0.0     0/0   0.0

TEAM: FG: 10/18 (55.6%), 3PT: 3/7 (42.9%), REB: 8 (1 off, 7 def), AST: 6, TO: 4
TEAM FOULS: 8 [Team_001 in BONUS]

================================================================================

================================================================================
                       4TH QUARTER - Team_001 vs Team_002                       
================================================================================

[12:00] Team_001 possession (Score: 98-62)
Miles Griffin drives and kicks out. Dejounte McCollum attempts a 3Pt. Contested by CJ Barrett (3.8 feet, ZONE). Dejounte McCollum misses. Rebound secured by Tyler Porzingis.

[11:45] Team_002 possession (Score: 98-62)
Miles Bane attempts a 3Pt. Contested by Klay Harden (3.5 feet, MAN). Miles Bane misses. FOUL! Loose ball foul on Dejounte McCollum during the rebound battle. [Team fouls: 1] No free throws, side out. (Dejounte McCollum: 1 personal fouls)

[11:32] Team_002 possession (Score: 98-62)
Carmelo Lowry attempts a 3Pt. Contested by Dejounte McCollum (4.0 feet, MAN). CARMELO LOWRY MAKES IT! Assist: Jordan Green
Score: 98-65

[11:21] Team_001 possession (Score: 98-65)
Dirk Young attempts a 3Pt. Contested by CJ Barrett (3.9 feet, MAN). Dirk Young misses. Rebound secured by Carmelo Lowry.

[11:10] Team_002 possession (Score: 98-65)
Miles Bane attempts a Midrange. Contested by Klay Harden (3.6 feet, MAN). MILES BANE MAKES IT!
Score: 98-67

[10:57] Team_001 possession (Score: 98-67)
Dejounte McCollum attempts a Midrange. Contested by CJ Barrett (3.9 feet, ZONE). Dejounte McCollum misses. Rebound secured by Miles Bane.

[10:40] Team_002 possession (Score: 98-67)
Carmelo Lowry makes the Layup and draws the foul on Miles Griffin! And-1! Carmelo Lowry to the line for 1. [Team fouls: 2] (Miles Griffin: 1 personal fouls)   FT 1/1: GOOD Carmelo Lowry makes 1/1 from the line.
Score: 98-70

[10:25] Team_001 possession (Score: 98-70)
Dejounte McCollum attempts a Midrange. Contested by Carmelo Lowry (3.8 feet, MAN). Dejounte McCollum misses. Rebound secured by Tyler Porzingis.

[10:13] Team_002 possession (Score: 98-70)
Tyler Porzingis attempts a Dunk. BLOCKED BY KLAY HARDEN! Rebound secured by Miles Griffin.

[10:00] Team_001 possession (Score: 98-70)
Miles Griffin loses the ball! Stripped by Tyler Porzingis! TURNOVER! (live ball)

[09:46] Team_002 possession (Score: 98-70)
FOUL! Holding foul on Cole Ball. [Team fouls: 3] No free throws, side out. (Cole Ball: 1 personal fouls)

[09:31] Team_001 possession (Score: 98-70)
Klay Harden attempts a 3Pt. Contested by Miles Bane (4.7 feet, ZONE). Klay Harden misses. Offensive rebound by Cole Ball! Cole Ball kicks it out.

[09:17] Team_001 possession (Score: 98-70)
Klay Harden drives to the basket... Klay Harden throws a bad pass out of bounds! TURNOVER! (dead ball)

[09:17] Substitution (Team_001): Klay Harden OUT → Ja Dosunmu IN (stamina_rule2)

[09:17] Substitution (Team_001): Dirk Young OUT → Rudy George IN (stamina_rule2)

[09:17] Substitution (Team_001): Cole Ball OUT → Larry Trent IN (stamina_rule2)

[09:17] Substitution (Team_001): Dejounte McCollum OUT → Franz Bryant IN (stamina_rule2)

[09:17] Substitution (Team_001): Miles Griffin OUT → Kristaps Ming IN (stamina_rule2)

[09:17] Substitution (Team_002): Miles Bane OUT → John Duncan IN (stamina_rule2)

[09:17] Substitution (Team_002): CJ Barrett OUT → Dirk Middleton IN (stamina_rule2)

[09:17] Substitution (Team_002): Jordan Green OUT → Anfernee Sexton IN (stamina_rule2)

[09:17] Substitution (Team_002): Carmelo Lowry OUT → Julius Curry IN (stamina_rule2)

[09:17] Substitution (Team_002): Tyler Porzingis OUT → Lamelo O'Neal IN (stamina_rule2)

[09:04] Team_002 possession (Score: 98-70)
FOUL! Shooting foul on Franz Bryant. Anfernee Sexton to the line for 2 free throws. [Team fouls: 4] (Franz Bryant: 1 personal fouls)   FT 1/2: GOOD   FT 2/2: GOOD Anfernee Sexton makes 2/2 from the line.
Score: 98-72

[08:51] Team_001 possession (Score: 98-72)
Larry Trent drives, picks up Anfernee Sexton. Help arrives from John Duncan! Larry Trent attempts a Dunk. Contested by John Duncan (4.4 feet, MAN). LARRY TRENT MAKES IT!
Score: 100-72

[08:36] Team_002 possession (Score: 100-72)
Lamelo O'Neal drives and kicks out. John Duncan attempts a Midrange. Contested by Ja Dosunmu (3.5 feet, MAN). John Duncan misses. Rebound secured by Larry Trent.

[08:24] Team_001 possession (Score: 100-72)
Franz Bryant attempts a 3Pt. Contested by Lamelo O'Neal (3.0 feet, MAN). FRANZ BRYANT MAKES IT! Assist: Kristaps Ming
Score: 103-72

[08:05] Team_002 possession (Score: 103-72)
Anfernee Sexton attempts a 3Pt. Contested by Ja Dosunmu (3.5 feet, ZONE). ANFERNEE SEXTON MAKES IT! Assist: Dirk Middleton
Score: 103-75

[07:54] Team_001 possession (Score: 103-75)
Rudy George attempts a 3Pt. Contested by Dirk Middleton (5.9 feet, MAN). RUDY GEORGE MAKES IT! Assist: Larry Trent
Score: 106-75

[07:41] Team_002 possession (Score: 106-75)
Anfernee Sexton attempts a 3Pt. Contested by Larry Trent (3.9 feet, MAN). Anfernee Sexton misses. Rebound secured by Rudy George.

[07:23] Team_001 possession (Score: 106-75)
Kristaps Ming drives, picks up Lamelo O'Neal. Help arrives from John Duncan! Kristaps Ming attempts a Layup. Contested by John Duncan (3.0 feet, MAN). KRISTAPS MING MAKES IT!
Score: 108-75

[07:10] Team_002 possession (Score: 108-75)
Lamelo O'Neal drives and kicks out. John Duncan attempts a Midrange. Contested by Ja Dosunmu (3.5 feet, MAN). John Duncan misses. Rebound secured by Kristaps Ming.

[06:56] Team_001 possession (Score: 108-75)
Ja Dosunmu attempts a 3Pt. Contested by Julius Curry (5.4 feet, ZONE). Ja Dosunmu misses. Rebound secured by Julius Curry.

[06:41] Team_002 possession (Score: 108-75)
Dirk Middleton attempts a Midrange. Contested by Rudy George (4.7 feet, MAN). DIRK MIDDLETON MAKES IT! Assist: John Duncan
Score: 108-77

[06:30] Team_001 possession (Score: 108-77)
Larry Trent attempts a Midrange. Contested by Anfernee Sexton (4.4 feet, MAN). LARRY TRENT MAKES IT!
Score: 110-77

[06:16] Team_002 possession (Score: 110-77)
Lamelo O'Neal drives, Kristaps Ming stays with him. Lamelo O'Neal attempts a Dunk. Contested by Kristaps Ming (5.6 feet, ZONE). Lamelo O'Neal misses. Rebound secured by Rudy George.

[06:02] Team_001 possession (Score: 110-77)
Rudy George drives to the basket... Rudy George loses control! Ball rolls out of bounds! TURNOVER! (dead ball)

[05:44] Team_002 possession (Score: 110-77)
Dirk Middleton drives and kicks out. Lamelo O'Neal attempts a 3Pt. Contested by Kristaps Ming (5.6 feet, MAN). LAMELO O'NEAL MAKES IT! Assist: John Duncan
Score: 110-80

[05:31] Team_001 possession (Score: 110-80)
Ja Dosunmu attempts a Midrange. Contested by John Duncan (5.5 feet, MAN). JA DOSUNMU MAKES IT! Assist: Kristaps Ming
Score: 112-80

[05:18] Team_002 possession (Score: 112-80)
Julius Curry attempts a Midrange. Contested by Franz Bryant (3.8 feet, MAN). Julius Curry misses. Rebound secured by Kristaps Ming.

[05:04] Team_001 possession (Score: 112-80)
Rudy George drives, Dirk Middleton stays with him. Rudy George attempts a Layup. Contested by Dirk Middleton (5.9 feet, MAN). Rudy George misses. Rebound secured by Lamelo O'Neal.

[04:52] Team_002 possession (Score: 112-80)
Dirk Middleton attempts a Midrange. Contested by Rudy George (4.7 feet, MAN). DIRK MIDDLETON MAKES IT! Assist: Lamelo O'Neal
Score: 112-82

[04:38] Team_001 possession (Score: 112-82)
Rudy George drives, Dirk Middleton stays with him. Rudy George attempts a Layup. Contested by Dirk Middleton (5.9 feet, MAN). RUDY GEORGE MAKES IT! Assist: Kristaps Ming
Score: 114-82

[04:21] Team_002 possession (Score: 114-82)
FOUL! Reach-in foul on Franz Bryant during the drive. [IN THE BONUS! 5 team fouls] Anfernee Sexton to the line for 2 free throws. (Franz Bryant: 2 personal fouls)   FT 1/2: GOOD   FT 2/2: GOOD Anfernee Sexton makes 2/2 from the line.
Score: 114-84

[04:07] Team_001 possession (Score: 114-84)
Ja Dosunmu attempts a Midrange. Contested by John Duncan (5.5 feet, MAN). JA DOSUNMU MAKES IT! Assist: Kristaps Ming
Score: 116-84

[03:51] Team_002 possession (Score: 116-84)
FOUL! Shooting foul on Kristaps Ming. Lamelo O'Neal to the line for 2 free throws. [BONUS: 6 team fouls] (Kristaps Ming: 1 personal fouls)   FT 1/2: MISS   FT 2/2: GOOD Lamelo O'Neal makes 1/2 from the line.
Score: 116-85

[03:33] Team_001 possession (Score: 116-85)
Larry Trent drives and kicks out. Rudy George attempts a 3Pt. Contested by Dirk Middleton (6.0 feet, MAN). Rudy George misses. Offensive rebound by Rudy George! Rudy George kicks it out.

[03:16] Team_001 possession (Score: 116-85)
Franz Bryant drives and kicks out. Franz Bryant attempts a 3Pt. Contested by Julius Curry (5.4 feet, MAN). Franz Bryant misses. Rebound secured by Anfernee Sexton.

[03:01] Team_002 possession (Score: 116-85)
John Duncan drives and kicks out. Julius Curry attempts a 3Pt. Contested by Franz Bryant (3.8 feet, MAN). Julius Curry misses. Rebound secured by Kristaps Ming.

[02:52] Team_001 possession (Score: 116-85)
Rudy George attempts a 3Pt. Contested by Julius Curry (5.4 feet, ZONE). Rudy George misses. Rebound secured by Anfernee Sexton.

[02:38] Team_002 possession (Score: 116-85)
Lamelo O'Neal drives and kicks out. Julius Curry attempts a 3Pt. Contested by Ja Dosunmu (3.6 feet, ZONE). Julius Curry misses. Rebound secured by Rudy George.

[02:25] Team_001 possession (Score: 116-85)
Larry Trent attempts a 3Pt. Contested by Anfernee Sexton (4.5 feet, MAN). Larry Trent misses. Rebound secured by Lamelo O'Neal.

[02:09] Team_002 possession (Score: 116-85)
John Duncan drives and kicks out. Anfernee Sexton attempts a 3Pt. Contested by Larry Trent (3.9 feet, MAN). Anfernee Sexton misses. Offensive rebound by Lamelo O'Neal! Lamelo O'Neal puts it back in!
Score: 116-87

[01:57] Team_001 possession (Score: 116-87)
FOUL! Reach-in foul on Lamelo O'Neal during the drive. [IN THE BONUS! 7 team fouls] Kristaps Ming to the line for 2 free throws. (Lamelo O'Neal: 1 personal fouls)   FT 1/2: GOOD   FT 2/2: GOOD Kristaps Ming makes 2/2 from the line.
Score: 118-87

[01:40] Team_002 possession (Score: 118-87)
Dirk Middleton attempts a 3Pt. Contested by Rudy George (4.9 feet, MAN). Dirk Middleton misses. FOUL! Loose ball foul on Kristaps Ming during the rebound battle. [IN THE BONUS! 8 team fouls] Anfernee Sexton to the line for 2 free throws. (Kristaps Ming: 2 personal fouls)   FT 1/2: GOOD   FT 2/2: GOOD Anfernee Sexton makes 2/2 from the line.
Score: 118-89

[01:26] Team_001 possession (Score: 118-89)
Rudy George attempts a 3Pt. Wide open! Dirk Middleton is 6.1 feet away. [MAN] Rudy George misses. Rebound secured by Julius Curry.

[01:14] Team_002 possession (Score: 118-89)
Anfernee Sexton attempts a Midrange. Contested by Larry Trent (4.0 feet, MAN). Anfernee Sexton misses. FOUL! Loose ball foul on Rudy George during the rebound battle. [IN THE BONUS! 9 team fouls] Anfernee Sexton to the line for 2 free throws. (Rudy George: 1 personal fouls)   FT 1/2: GOOD   FT 2/2: GOOD Anfernee Sexton makes 2/2 from the line.
Score: 118-91

[00:59] Team_001 possession (Score: 118-91)
Kristaps Ming drives and kicks out. Franz Bryant attempts a 3Pt. Contested by Julius Curry (5.6 feet, MAN). Franz Bryant misses. Rebound secured by Julius Curry.

[00:43] Team_002 possession (Score: 118-91)
Julius Curry loses control! Ball rolls out of bounds! TURNOVER! (dead ball)

[00:31] Team_001 possession (Score: 118-91)
Kristaps Ming attempts a Midrange. Contested by Lamelo O'Neal (3.7 feet, MAN). Kristaps Ming misses. FOUL! Loose ball foul on Julius Curry during the rebound battle. [IN THE BONUS! 10 team fouls] Larry Trent to the line for 2 free throws. (Julius Curry: 1 personal fouls)   FT 1/2: GOOD   FT 2/2: GOOD Larry Trent makes 2/2 from the line.
Score: 120-91

[00:16] Team_002 possession (Score: 120-91)
Julius Curry commits an offensive foul! Franz Bryant drew the charge! TURNOVER! (dead ball)

[00:02] Team_001 possession (Score: 120-91)
Larry Trent attempts a 3Pt. Contested by Anfernee Sexton (4.7 feet, MAN). Larry Trent misses. Offensive rebound by Larry Trent! Larry Trent kicks it out.

================================================================================
                              4TH QUARTER COMPLETE                              
================================================================================

4TH QUARTER SCORE: Team_001 22, Team_002 29

BOX SCORE:
================================================================================

Team_001
--------------------------------------------------------------------------------
Player                MIN  PTS  REB  AST  TO      FG   FG%      3P   3P%
--------------------------------------------------------------------------------
Larry Trent            22    6    2    1   0   2/3    66.7     0/0   0.0
Rudy George            29    5    4    0   0   2/5    40.0     0/0   0.0
Kristaps Ming          29    4    3    4   0   1/2    50.0     0/0   0.0
Ja Dosunmu             25    4    0    0   0   2/3    66.7     0/0   0.0
Franz Bryant           20    3    0    0   0   1/2    50.0     0/0   0.0
Miles Griffin          19    0    1    0   0   0/1     0.0     0/0   0.0
Dirk Young             22    0    0    0   0   0/1     0.0     0/0   0.0
Dejounte McCollum      28    0    0    0   0   0/2     0.0     0/0   0.0
Cole Ball              27    0    1    0   0   0/0     0.0     0/0   0.0

TEAM: FG: 8/19 (42.1%), 3PT: 2/7 (28.6%), REB: 11 (3 off, 8 def), AST: 5, TO: 3
TEAM FOULS: 0


Team_002
--------------------------------------------------------------------------------
Player                MIN  PTS  REB  AST  TO      FG   FG%      3P   3P%
--------------------------------------------------------------------------------
Anfernee Sexton        32   11    2    0   0   1/2    50.0     0/0   0.0
Carmelo Lowry          20    6    2    0   0   2/2   100.0     0/0   0.0
Lamelo O'Neal          29    6    3    1   0   2/6    33.3     0/0   0.0
Dirk Middleton         26    4    0    1   0   2/2   100.0     0/0   0.0
Miles Bane             21    2    1    0   0   1/1   100.0     0/0   0.0
Tyler Porzingis        19    0    2    0   0   0/1     0.0     0/0   0.0
Jordan Green           21    0    0    1   0   0/0     0.0     0/0   0.0
Julius Curry           24    0    3    0   0   0/1     0.0     0/0   0.0
John Duncan            28    0    0    2   0   0/1     0.0     0/0   0.0

TEAM: FG: 8/16 (50.0%), 3PT: 2/3 (66.7%), REB: 13 (2 off, 11 def), AST: 5, TO: 2
TEAM FOULS: 10 [Team_001 in BONUS]

================================================================================

================================================================================
                               FULL GAME COMPLETE                               
================================================================================

FINAL SCORE: Team_001 120, Team_002 91

SCORING BY QUARTER:
--------------------------------------------------------------------------------
Team                     Q1     Q2     Q3     Q4    FINAL
--------------------------------------------------------------------------------
Team_001                 34     34     30     22      120
Team_002                 22     13     27     29       91
--------------------------------------------------------------------------------

FULL GAME BOX SCORE:
================================================================================

Team_001
--------------------------------------------------------------------------------
Player                MIN  PTS  REB  AST  TO      FG   FG%      3P   3P%      FT STL BLK
--------------------------------------------------------------------------------
Rudy George            29   15    6    3   0   5/10   50.0   2/4    50.0   2/2     1   0
Kristaps Ming          29   15    3    7   2   5/7    71.4   0/0     0.0   5/5     0   0
Dejounte McCollum      28    7    8    5   0   1/5    20.0   0/1     0.0   0/2     0   0
Cole Ball              27   20    6    3   2   9/15   60.0   1/3    33.3   3/3     0   0
Ja Dosunmu             25   12    2    1   0   4/9    44.4   1/4    25.0   3/3     1   0
Larry Trent            22   19    5    2   0   6/9    66.7   0/3     0.0   2/6     0   0
Dirk Young             22    9    2    0   0   4/8    50.0   1/4    25.0   0/0     0   0
Klay Harden            21    3    2    2   4   2/4    50.0   1/2    50.0   0/0     0   1
Franz Bryant           20    9    2    0   0   3/4    75.0   1/1   100.0   2/2     0   1
Miles Griffin          19    6   12    2   1   1/3    33.3   0/1     0.0   4/4     1   0

TEAM: FG: 40/74 (54.1%), 3PT: 7/23 (30.4%), REB: 48 (13 off, 35 def), AST: 25, TO: 9


Team_002
--------------------------------------------------------------------------------
Player                MIN  PTS  REB  AST  TO      FG   FG%      3P   3P%      FT STL BLK
--------------------------------------------------------------------------------
Anfernee Sexton        32   20   10    3   0   4/8    50.0   2/3    66.7   4/8     0   0
Lamelo O'Neal          29   11    4    2   0   2/8    25.0   1/2    50.0   1/2     1   1
John Duncan            28    5    1    2   2   3/7    42.9   0/2     0.0   1/2     0   0
Dirk Middleton         26   12    0    2   2   7/8    87.5   0/1     0.0   0/0     0   0
Julius Curry           24    4    9    2   4   3/6    50.0   0/1     0.0   0/0     0   0
Miles Bane             21   12    4    0   0   4/8    50.0   2/4    50.0   2/2     0   2
Jordan Green           21    3    0    2   4   1/5    20.0   0/3     0.0   1/1     0   0
CJ Barrett             21    4    2    4   0   1/2    50.0   1/1   100.0   1/1     0   1
Carmelo Lowry          20    9    7    2   2   3/5    60.0   1/2    50.0   2/2     0   0
Tyler Porzingis        19   10    4    1   1   5/11   45.5   0/2     0.0   0/0     1   0

TEAM: FG: 33/68 (48.5%), 3PT: 7/21 (33.3%), REB: 41 (7 off, 34 def), AST: 20, TO: 15

================================================================================
