================================================================================
                        FULL GAME - Team_001 vs Team_002                        
================================================================================

================================================================================
                       1ST QUARTER - Team_001 vs Team_002                       
================================================================================

[12:00] Team_001 possession (Score: 0-0)
Klay Harden makes the Dunk and draws the foul on Miles Bane! And-1! Klay Harden to the line for 1. [Team fouls: 1] (Miles Bane: 1 personal fouls)   FT 1/1: GOOD Klay Harden makes 1/1 from the line.
Score: 3-0

[11:49] Team_002 possession (Score: 3-0)
CJ Barrett drives, picks up Dirk Young. Help arrives from Cole Ball! CJ Barrett attempts a Layup. Contested by Cole Ball (4.4 feet, MAN). CJ BARRETT MAKES IT! Assist: Jordan Green
Score: 3-2

[11:39] Team_001 possession (Score: 3-2)
FOUL! Shooting foul on Jordan Green. Cole Ball to the line for 2 free throws. [Team fouls: 2] (Jordan Green: 1 personal fouls)   FT 1/2: GOOD   FT 2/2: GOOD Cole Ball makes 2/2 from the line.
Score: 5-2

[11:21] Team_002 possession (Score: 5-2)
Jordan Green drives, Miles Griffin stays with him. Jordan Green attempts a Layup. Contested by Miles Griffin (5.1 feet, ZONE). JORDAN GREEN MAKES IT!
Score: 5-4

[11:11] Team_001 possession (Score: 5-4)
Klay Harden attempts a 3Pt. Contested by Miles Bane (4.8 feet, MAN). KLAY HARDEN MAKES IT! Assist: Dirk Young
Score: 8-4

[10:56] Team_002 possession (Score: 8-4)
Miles Bane drives and kicks out. Miles Bane attempts a 3Pt. Contested by Klay Harden (4.9 feet, MAN). Miles Bane misses. Rebound secured by Dejounte McCollum.

[10:37] Team_001 possession (Score: 8-4)
FOUL! Shooting foul on CJ Barrett. Klay Harden to the line for 2 free throws. [Team fouls: 3] (CJ Barrett: 1 personal fouls)   FT 1/2: GOOD   FT 2/2: GOOD Klay Harden makes 2/2 from the line.
Score: 10-4

[10:22] Team_002 possession (Score: 10-4)
CJ Barrett attempts a Midrange. Contested by Cole Ball (3.1 feet, ZONE). CJ Barrett misses. Rebound secured by Dejounte McCollum.

[10:09] Team_001 possession (Score: 10-4)
Cole Ball attempts a 3Pt. Contested by Jordan Green (4.3 feet, MAN). Cole Ball misses. Offensive rebound by Cole Ball! Cole Ball kicks it out.

[09:54] Team_001 possession (Score: 10-4)
Dirk Young makes the Layup and draws the foul on CJ Barrett! And-1! Dirk Young to the line for 1. [Team fouls: 4] (CJ Barrett: 2 personal fouls)   FT 1/1: GOOD Dirk Young makes 1/1 from the line.
Score: 13-4

[09:41] Team_002 possession (Score: 13-4)
Jordan Green commits an offensive foul! Cole Ball drew the charge! TURNOVER! (dead ball)

[09:23] Team_001 possession (Score: 13-4)
Dirk Young drives, picks up CJ Barrett. Help arrives from Miles Bane! Dirk Young attempts a Dunk. Contested by Miles Bane (4.5 feet, MAN). DIRK YOUNG MAKES IT!
Score: 15-4

[09:09] Team_002 possession (Score: 15-4)
Miles Bane drives and kicks out. Carmelo Lowry attempts a 3Pt. Contested by Cole Ball (3.3 feet, ZONE). Carmelo Lowry misses. Rebound secured by Miles Griffin.

[08:52] Team_001 possession (Score: 15-4)
Klay Harden attempts a 3Pt. Contested by Miles Bane (5.1 feet, MAN). KLAY HARDEN MAKES IT! Assist: Miles Griffin
Score: 18-4

[08:40] Team_002 possession (Score: 18-4)
FOUL! Shooting foul on Cole Ball. Miles Bane to the line for 2 free throws. [BONUS: 5 team fouls] (Cole Ball: 1 personal fouls)   FT 1/2: MISS   FT 2/2: GOOD Miles Bane makes 1/2 from the line.
Score: 18-5

[08:28] Team_001 possession (Score: 18-5)
Klay Harden attempts a 3Pt. Contested by Miles Bane (5.2 feet, MAN). KLAY HARDEN MAKES IT! Assist: Dirk Young
Score: 21-5

[08:11] Team_002 possession (Score: 21-5)
Jordan Green loses control! Ball rolls out of bounds! TURNOVER! (dead ball)

[08:11] Substitution (Team_001): Klay Harden OUT → Rudy George IN (stamina_rule2)

[08:11] Substitution (Team_001): Dirk Young OUT → Ja Dosunmu IN (stamina_rule2)

[08:11] Substitution (Team_001): Cole Ball OUT → Larry Trent IN (stamina_rule2)

[08:11] Substitution (Team_001): Dejounte McCollum OUT → Cole Ball IN (stamina_rule2)

[08:11] Substitution (Team_001): Miles Griffin OUT → Kristaps Ming IN (stamina_rule2)

[08:11] Substitution (Team_002): Miles Bane OUT → John Duncan IN (stamina_rule2)

[08:11] Substitution (Team_002): CJ Barrett OUT → Dirk Middleton IN (stamina_rule2)

[08:11] Substitution (Team_002): Jordan Green OUT → Anfernee Sexton IN (stamina_rule2)

[08:11] Substitution (Team_002): Carmelo Lowry OUT → Julius Curry IN (stamina_rule2)

[08:11] Substitution (Team_002): Tyler Porzingis OUT → Lamelo O'Neal IN (stamina_rule2)

[07:57] Team_001 possession (Score: 21-5)
Ja Dosunmu commits an offensive foul! John Duncan drew the charge! TURNOVER! (dead ball)

[07:41] Team_002 possession (Score: 21-5)
Julius Curry loses the ball! Stripped by Cole Ball! TURNOVER! (live ball)

[07:22] Team_001 possession (Score: 21-5)
Larry Trent attempts a 3Pt. Contested by Anfernee Sexton (4.6 feet, MAN). Larry Trent misses. Rebound secured by Julius Curry.

[07:04] Team_002 possession (Score: 21-5)
Dirk Middleton attempts a 3Pt. Contested by Rudy George (5.1 feet, MAN). Dirk Middleton misses. Rebound secured by Larry Trent.

[06:48] Team_001 possession (Score: 21-5)
Kristaps Ming attempts a Midrange. Contested by Lamelo O'Neal (4.9 feet, MAN). KRISTAPS MING MAKES IT!
Score: 23-5

[06:29] Team_002 possession (Score: 23-5)
Anfernee Sexton makes the 3Pt and draws the foul on Cole Ball! And-1! Anfernee Sexton to the line for 1. [BONUS: 6 team fouls] (Cole Ball: 2 personal fouls)   FT 1/1: GOOD Anfernee Sexton makes 1/1 from the line.
Score: 23-9

[06:15] Team_001 possession (Score: 23-9)
Cole Ball makes the Dunk and draws the foul on Anfernee Sexton! And-1! Cole Ball to the line for 1. [BONUS: 7 team fouls] (Anfernee Sexton: 1 personal fouls)   FT 1/1: GOOD Cole Ball makes 1/1 from the line.
Score: 26-9

[06:03] Team_002 possession (Score: 26-9)
Julius Curry attempts a 3Pt. Contested by Cole Ball (3.7 feet, MAN). JULIUS CURRY MAKES IT! Assist: Dirk Middleton
Score: 26-12

[05:43] Team_001 possession (Score: 26-12)
Larry Trent attempts a Midrange. Contested by Anfernee Sexton (4.8 feet, MAN). LARRY TRENT MAKES IT! Assist: Ja Dosunmu
Score: 28-12

[05:30] Team_002 possession (Score: 28-12)
Lamelo O'Neal attempts a Layup. Wide open! Kristaps Ming is 6.3 feet away. [MAN] LAMELO O'NEAL MAKES IT! Assist: Julius Curry
Score: 28-14

[05:16] Team_001 possession (Score: 28-14)
Cole Ball drives and kicks out. Kristaps Ming attempts a 3Pt. Contested by Lamelo O'Neal (5.3 feet, MAN). KRISTAPS MING MAKES IT!
Score: 31-14

[04:59] Team_002 possession (Score: 31-14)
Dirk Middleton attempts a 3Pt. Contested by Ja Dosunmu (4.8 feet, ZONE). Dirk Middleton misses. Offensive rebound by Anfernee Sexton! Anfernee Sexton kicks it out.

[04:43] Team_002 possession (Score: 31-14)
John Duncan attempts a 3Pt. Contested by Ja Dosunmu (4.8 feet, MAN). JOHN DUNCAN MAKES IT! Assist: Lamelo O'Neal
Score: 31-17

[04:27] Team_001 possession (Score: 31-17)
Larry Trent attempts a Layup. Contested by Anfernee Sexton (4.9 feet, MAN). Larry Trent misses. Rebound secured by Julius Curry.

[04:10] Team_002 possession (Score: 31-17)
Dirk Middleton attempts a 3Pt. Contested by Rudy George (5.4 feet, MAN). Dirk Middleton misses. Rebound secured by Cole Ball.

[03:57] Team_001 possession (Score: 31-17)
Ja Dosunmu drives, John Duncan stays with him. Ja Dosunmu attempts a Dunk. Wide open! John Duncan is 6.0 feet away. [MAN] JA DOSUNMU MAKES IT! Assist: Larry Trent
Score: 33-17

[03:42] Team_002 possession (Score: 33-17)
Anfernee Sexton attempts a Midrange. Contested by Cole Ball (4.1 feet, MAN). ANFERNEE SEXTON MAKES IT! Assist: Lamelo O'Neal
Score: 33-19

[03:31] Team_001 possession (Score: 33-19)
Rudy George attempts a 3Pt. Wide open! Dirk Middleton is 6.6 feet away. [MAN] Rudy George misses. Rebound secured by Anfernee Sexton.

[03:18] Team_002 possession (Score: 33-19)
Dirk Middleton attempts a 3Pt. Contested by Rudy George (5.5 feet, MAN). DIRK MIDDLETON MAKES IT! Assist: Julius Curry
Score: 33-22

[03:07] Team_001 possession (Score: 33-22)
FOUL! Shooting foul on Lamelo O'Neal. Kristaps Ming to the line for 2 free throws. [BONUS: 8 team fouls] (Lamelo O'Neal: 1 personal fouls)   FT 1/2: GOOD   FT 2/2: GOOD Kristaps Ming makes 2/2 from the line.
Score: 35-22

[02:53] Team_002 possession (Score: 35-22)
Julius Curry attempts a Midrange. Contested by Larry Trent (4.9 feet, ZONE). JULIUS CURRY MAKES IT!
Score: 35-24

[02:37] Team_001 possession (Score: 35-24)
FOUL! Reach-in foul on Lamelo O'Neal during the drive. [IN THE BONUS! 9 team fouls] Kristaps Ming to the line for 2 free throws. (Lamelo O'Neal: 2 personal fouls)   FT 1/2: GOOD   FT 2/2: GOOD Kristaps Ming makes 2/2 from the line.
Score: 37-24

[02:19] Team_002 possession (Score: 37-24)
Anfernee Sexton attempts a 3Pt. Contested by Ja Dosunmu (5.3 feet, ZONE). ANFERNEE SEXTON MAKES IT! Assist: John Duncan
Score: 37-27

[02:05] Team_001 possession (Score: 37-27)
Rudy George drives, picks up Dirk Middleton. Help arrives from Anfernee Sexton! Rudy George attempts a Layup. Wide open! Anfernee Sexton is 6.7 feet away. [MAN] RUDY GEORGE MAKES IT! Assist: Ja Dosunmu
Score: 39-27

[01:52] Team_002 possession (Score: 39-27)
Dirk Middleton drives, Rudy George stays with him. Dirk Middleton attempts a Layup. Contested by Rudy George (5.7 feet, MAN). Dirk Middleton misses. Rebound secured by Cole Ball.

[01:42] Team_001 possession (Score: 39-27)
Larry Trent drives, Lamelo O'Neal stays with him. Larry Trent attempts a Dunk. Wide open! Lamelo O'Neal is 6.2 feet away. [ZONE] Larry Trent misses. Rebound secured by Julius Curry.

[01:31] Team_002 possession (Score: 39-27)
John Duncan attempts a Midrange. Contested by Ja Dosunmu (5.5 feet, MAN). JOHN DUNCAN MAKES IT!
Score: 39-29

[01:17] Team_001 possession (Score: 39-29)
Rudy George attempts a 3Pt. Wide open! Dirk Middleton is 6.9 feet away. [MAN] Rudy George misses. Rebound secured by Julius Curry.

[01:01] Team_002 possession (Score: 39-29)
Dirk Middleton attempts a 3Pt. Contested by Ja Dosunmu (5.6 feet, ZONE). DIRK MIDDLETON MAKES IT! Assist: John Duncan
Score: 39-32

[00:50] Team_001 possession (Score: 39-32)
Cole Ball makes the Dunk and draws the foul on John Duncan! And-1! Cole Ball to the line for 1. [BONUS: 10 team fouls] (John Duncan: 1 personal fouls)   FT 1/1: GOOD Cole Ball makes 1/1 from the line.
Score: 42-32

[00:37] Team_002 possession (Score: 42-32)
Julius Curry drives, Cole Ball stays with him. Julius Curry attempts a Dunk. Contested by Cole Ball (4.7 feet, MAN). Julius Curry misses. Rebound secured by Rudy George.

[00:22] Team_001 possession (Score: 42-32)
Ja Dosunmu attempts a 3Pt. Wide open! John Duncan is 6.5 feet away. [MAN] Ja Dosunmu misses. Rebound secured by Julius Curry.

[00:10] Team_002 possession (Score: 42-32)
John Duncan commits an offensive foul! Ja Dosunmu drew the charge! TURNOVER! (dead ball)

================================================================================
                              1ST QUARTER COMPLETE                              
================================================================================

1ST QUARTER SCORE: Team_001 42, Team_002 32

BOX SCORE:
================================================================================

Team_001
--------------------------------------------------------------------------------
Player                MIN  PTS  REB  AST  TO      FG   FG%      3P   3P%
--------------------------------------------------------------------------------
Klay Harden             4   14    0    0   0   4/4   100.0     0/0   0.0
Kristaps Ming           8    9    0    0   0   2/2   100.0     0/0   0.0
Cole Ball              12    8    3    0   0   2/2   100.0     0/0   0.0
Dirk Young              4    5    0    2   0   2/2   100.0     0/0   0.0
Larry Trent             8    2    1    1   0   1/4    25.0     0/0   0.0
Ja Dosunmu              8    2    0    2   0   1/2    50.0     0/0   0.0
Rudy George             8    2    1    0   0   1/3    33.3     0/0   0.0
Dejounte McCollum       4    0    2    0   0   0/0     0.0     0/0   0.0
Miles Griffin           4    0    1    1   0   0/0     0.0     0/0   0.0

TEAM: FG: 13/19 (68.4%), 3PT: 3/7 (42.9%), REB: 8 (1 off, 7 def), AST: 6, TO: 1
TEAM FOULS: 0


Team_002
--------------------------------------------------------------------------------
Player                MIN  PTS  REB  AST  TO      FG   FG%      3P   3P%
--------------------------------------------------------------------------------
Anfernee Sexton         8    9    2    0   0   3/3   100.0     0/0   0.0
Dirk Middleton          8    6    0    1   0   2/5    40.0     0/0   0.0
Julius Curry            8    5    5    2   0   2/3    66.7     0/0   0.0
John Duncan             8    5    0    2   0   2/2   100.0     0/0   0.0
CJ Barrett              4    2    0    0   0   1/2    50.0     0/0   0.0
Jordan Green            4    2    0    1   0   1/1   100.0     0/0   0.0
Lamelo O'Neal           8    2    0    2   0   1/1   100.0     0/0   0.0
Miles Bane              4    1    0    0   0   0/2     0.0     0/0   0.0

TEAM: FG: 12/19 (63.2%), 3PT: 6/8 (75.0%), REB: 7 (1 off, 6 def), AST: 8, TO: 4
TEAM FOULS: 10 [Team_001 in BONUS]

================================================================================

================================================================================
                       2ND QUARTER - Team_001 vs Team_002                       
================================================================================

[12:00] Team_001 possession (Score: 42-32)
Miles Griffin attempts a Midrange. Contested by Tyler Porzingis (3.2 feet, MAN). MILES GRIFFIN MAKES IT! Assist: Klay Harden
Score: 44-32

[11:48] Team_002 possession (Score: 44-32)
Carmelo Lowry attempts a Layup. Contested by Dejounte McCollum (3.8 feet, MAN). CARMELO LOWRY MAKES IT! Assist: Miles Bane
Score: 44-34

[11:37] Team_001 possession (Score: 44-34)
Klay Harden attempts a 3Pt. Contested by CJ Barrett (3.8 feet, ZONE). Klay Harden misses. Offensive rebound by Miles Griffin! Miles Griffin kicks it out.

[11:17] Team_001 possession (Score: 44-34)
FOUL! Holding foul on Miles Bane. [Team fouls: 1] No free throws, side out. (Miles Bane: 1 personal fouls)

[11:01] Team_002 possession (Score: 44-34)
Tyler Porzingis drives, picks up Miles Griffin. Help arrives from Klay Harden! Tyler Porzingis attempts a Dunk. Contested by Klay Harden (4.0 feet, MAN). TYLER PORZINGIS MAKES IT! Assist: Miles Bane
Score: 44-36

[10:52] Team_001 possession (Score: 44-36)
FOUL! Shooting foul on Jordan Green. Cole Ball to the line for 2 free throws. [Team fouls: 2] (Jordan Green: 1 personal fouls)   FT 1/2: GOOD   FT 2/2: GOOD Cole Ball makes 2/2 from the line.
Score: 46-36

[10:38] Team_002 possession (Score: 46-36)
Carmelo Lowry attempts a Layup. Contested by Dejounte McCollum (3.8 feet, ZONE). CARMELO LOWRY MAKES IT! Assist: Miles Bane
Score: 46-38

[10:22] Team_001 possession (Score: 46-38)
Cole Ball attempts a 3Pt. Contested by CJ Barrett (3.9 feet, ZONE). Cole Ball misses. Offensive rebound by Dejounte McCollum! Dejounte McCollum kicks it out.

[10:04] Team_001 possession (Score: 46-38)
Miles Griffin attempts a Layup. Contested by Tyler Porzingis (3.4 feet, MAN). MILES GRIFFIN MAKES IT! Assist: Dirk Young
Score: 48-38

[09:51] Team_002 possession (Score: 48-38)
FOUL! Shooting foul on Dirk Young. CJ Barrett to the line for 3 free throws. [Team fouls: 3] (Dirk Young: 1 personal fouls)   FT 1/3: GOOD   FT 2/3: GOOD   FT 3/3: GOOD CJ Barrett makes 3/3 from the line.
Score: 48-41

[09:37] Team_001 possession (Score: 48-41)
Dejounte McCollum drives, Carmelo Lowry stays with him. Dejounte McCollum attempts a Dunk. Contested by Carmelo Lowry (4.4 feet, MAN). Dejounte McCollum misses. Rebound secured by Miles Bane.

[09:22] Team_002 possession (Score: 48-41)
Jordan Green makes the Layup and draws the foul on Cole Ball! And-1! Jordan Green to the line for 1. [Team fouls: 4] (Cole Ball: 1 personal fouls)   FT 1/1: GOOD Jordan Green makes 1/1 from the line.
Score: 48-44

[09:06] Team_001 possession (Score: 48-44)
Dejounte McCollum attempts a 3Pt. Contested by Carmelo Lowry (4.5 feet, MAN). Dejounte McCollum misses. Rebound secured by Tyler Porzingis.

[08:54] Team_002 possession (Score: 48-44)
CJ Barrett drives to the basket... CJ Barrett throws a bad pass out of bounds! TURNOVER! (dead ball)

[08:54] Substitution (Team_001): Klay Harden OUT → Rudy George IN (stamina_rule2)

[08:54] Substitution (Team_001): Dirk Young OUT → Klay Harden IN (stamina_rule2)

[08:54] Substitution (Team_001): Cole Ball OUT → Franz Bryant IN (stamina_rule2)

[08:54] Substitution (Team_001): Miles Griffin OUT → Kristaps Ming IN (stamina_rule2)

[08:54] Substitution (Team_002): Carmelo Lowry OUT → Anfernee Sexton IN (stamina_rule2)

[08:54] Substitution (Team_002): Tyler Porzingis OUT → Lamelo O'Neal IN (stamina_rule2)

[08:39] Team_001 possession (Score: 48-44)
Rudy George attempts a 3Pt. Contested by Miles Bane (4.7 feet, ZONE). RUDY GEORGE MAKES IT! Assist: Dejounte McCollum
Score: 51-44

[08:26] Team_002 possession (Score: 51-44)
FOUL! Shooting foul on Klay Harden. CJ Barrett to the line for 3 free throws. [BONUS: 5 team fouls] (Klay Harden: 1 personal fouls)   FT 1/3: MISS   FT 2/3: GOOD   FT 3/3: MISS CJ Barrett makes 1/3 from the line. Offensive rebound by Anfernee Sexton! Anfernee Sexton kicks it out.
Score: 51-45

[08:06] Team_002 possession (Score: 51-45)
Miles Bane attempts a 3Pt. Contested by Klay Harden (4.2 feet, MAN). Miles Bane misses. Rebound secured by Franz Bryant.

[07:50] Team_001 possession (Score: 51-45)
Kristaps Ming attempts a Layup. Contested by Lamelo O'Neal (4.9 feet, MAN). KRISTAPS MING MAKES IT! Assist: Dejounte McCollum
Score: 53-45

[07:40] Team_002 possession (Score: 53-45)
CJ Barrett drives, Rudy George stays with him. CJ Barrett attempts a Layup. Contested by Rudy George (5.2 feet, MAN). CJ Barrett misses. Rebound secured by Klay Harden.

[07:30] Team_001 possession (Score: 53-45)
Kristaps Ming attempts a Layup. BLOCKED BY LAMELO O'NEAL! Offensive rebound by Franz Bryant! Franz Bryant kicks it out.

[07:14] Team_001 possession (Score: 53-45)
Dejounte McCollum attempts a 3Pt. Contested by Lamelo O'Neal (5.1 feet, MAN). DEJOUNTE MCCOLLUM MAKES IT! Assist: Franz Bryant
Score: 56-45

[07:00] Team_002 possession (Score: 56-45)
Anfernee Sexton attempts a Layup. Contested by Dejounte McCollum (4.0 feet, MAN). ANFERNEE SEXTON MAKES IT! Assist: Jordan Green
Score: 56-47

[06:45] Team_001 possession (Score: 56-47)
Klay Harden attempts a Layup. Contested by Miles Bane (4.9 feet, MAN). KLAY HARDEN MAKES IT! Assist: Dejounte McCollum
Score: 58-47

[06:30] Team_002 possession (Score: 58-47)
Anfernee Sexton attempts a Layup. Contested by Franz Bryant (3.8 feet, MAN). ANFERNEE SEXTON MAKES IT!
Score: 58-49

[06:16] Team_001 possession (Score: 58-49)
Dejounte McCollum makes the Layup and draws the foul on Lamelo O'Neal! And-1! Dejounte McCollum to the line for 1. [BONUS: 6 team fouls] (Lamelo O'Neal: 1 personal fouls)   FT 1/1: GOOD Dejounte McCollum makes 1/1 from the line.
Score: 61-49

[05:58] Team_002 possession (Score: 61-49)
Miles Bane attempts a 3Pt. Contested by Klay Harden (4.7 feet, MAN). Miles Bane misses. Rebound secured by Franz Bryant.

[05:40] Team_001 possession (Score: 61-49)
Klay Harden drives to the basket... Klay Harden loses the ball! Stripped by Miles Bane! TURNOVER! (live ball)

[05:25] Team_002 possession (Score: 61-49)
Anfernee Sexton commits an offensive foul! Franz Bryant drew the charge! TURNOVER! (dead ball)

[05:09] Team_001 possession (Score: 61-49)
Dejounte McCollum drives and kicks out. Rudy George attempts a Midrange. Contested by CJ Barrett (4.5 feet, ZONE). Rudy George misses. Rebound secured by Anfernee Sexton.

[04:52] Team_002 possession (Score: 61-49)
Miles Bane attempts a 3Pt. Contested by Klay Harden (4.9 feet, MAN). Miles Bane misses. Offensive rebound by Anfernee Sexton! Anfernee Sexton kicks it out.

[04:33] Team_002 possession (Score: 61-49)
FOUL! Shooting foul on Franz Bryant. Jordan Green to the line for 3 free throws. [BONUS: 7 team fouls] (Franz Bryant: 1 personal fouls)   FT 1/3: GOOD   FT 2/3: MISS   FT 3/3: MISS Jordan Green makes 1/3 from the line. Rebound secured by Dejounte McCollum.
Score: 61-50

[04:19] Team_001 possession (Score: 61-50)
Klay Harden throws a bad pass! Stolen by Miles Bane! TURNOVER! (live ball)

[04:01] Team_002 possession (Score: 61-50)
Jordan Green attempts a 3Pt. Contested by Klay Harden (5.0 feet, ZONE). Jordan Green misses. Rebound secured by Dejounte McCollum.

[03:44] Team_001 possession (Score: 61-50)
Klay Harden makes the Layup and draws the foul on CJ Barrett! And-1! Klay Harden to the line for 1. [BONUS: 8 team fouls] (CJ Barrett: 1 personal fouls)   FT 1/1: GOOD Klay Harden makes 1/1 from the line.
Score: 64-50

[03:27] Team_002 possession (Score: 64-50)
Jordan Green attempts a 3Pt. Contested by Franz Bryant (4.1 feet, MAN). Jordan Green misses. Rebound secured by Rudy George.

[03:10] Team_001 possession (Score: 64-50)
Klay Harden drives and kicks out. Franz Bryant attempts a 3Pt. Wide open! Lamelo O'Neal is 6.0 feet away. [MAN] Franz Bryant misses. Rebound secured by Miles Bane.

[02:53] Team_002 possession (Score: 64-50)
Lamelo O'Neal drives to the basket... Lamelo O'Neal loses control! Ball rolls out of bounds! TURNOVER! (dead ball)

[02:53] Substitution (Team_001): Klay Harden OUT → Dirk Young IN (stamina_rule2)

[02:53] Substitution (Team_001): Dejounte McCollum OUT → Larry Trent IN (stamina_rule2)

[02:53] Substitution (Team_002): Miles Bane OUT → John Duncan IN (stamina_rule2)

[02:53] Substitution (Team_002): CJ Barrett OUT → Dirk Middleton IN (stamina_rule2)

[02:53] Substitution (Team_002): Jordan Green OUT → Julius Curry IN (stamina_rule2)

[02:39] Team_001 possession (Score: 64-50)
Kristaps Ming drives to the basket... Kristaps Ming throws a bad pass out of bounds! TURNOVER! (dead ball)

[02:26] Team_002 possession (Score: 64-50)
Julius Curry attempts a 3Pt. Contested by Franz Bryant (4.2 feet, ZONE). Julius Curry misses. Rebound secured by Franz Bryant.

[02:11] Team_001 possession (Score: 64-50)
Rudy George attempts a 3Pt. Contested by Dirk Middleton (6.0 feet, MAN). Rudy George misses. Offensive rebound by Dirk Young! Dirk Young kicks it out.

[01:56] Team_001 possession (Score: 64-50)
Kristaps Ming loses control! Ball rolls out of bounds! TURNOVER! (dead ball)

[01:42] Team_002 possession (Score: 64-50)
Dirk Middleton attempts a 3Pt. Contested by Dirk Young (3.8 feet, MAN). DIRK MIDDLETON MAKES IT! Assist: John Duncan
Score: 64-53

[01:26] Team_001 possession (Score: 64-53)
Larry Trent drives and kicks out. Kristaps Ming attempts a Midrange. Wide open! Lamelo O'Neal is 6.5 feet away. [MAN] KRISTAPS MING MAKES IT! Assist: Larry Trent
Score: 66-53

[01:13] Team_002 possession (Score: 66-53)
Dirk Middleton attempts a 3Pt. Contested by Dirk Young (3.9 feet, MAN). Dirk Middleton misses. Rebound secured by Larry Trent.

[00:58] Team_001 possession (Score: 66-53)
Kristaps Ming attempts a Layup. Wide open! Lamelo O'Neal is 6.6 feet away. [MAN] KRISTAPS MING MAKES IT! Assist: Larry Trent
Score: 68-53

[00:46] Team_002 possession (Score: 68-53)
FOUL! Holding foul on Franz Bryant. [IN THE BONUS! 9 team fouls] Lamelo O'Neal to the line for 2 free throws. (Franz Bryant: 2 personal fouls)   FT 1/2: GOOD   FT 2/2: GOOD Lamelo O'Neal makes 2/2 from the line.
Score: 68-55

[00:30] Team_001 possession (Score: 68-55)
Larry Trent attempts a Midrange. Wide open! Dirk Middleton is 6.1 feet away. [ZONE] Larry Trent misses. Rebound secured by John Duncan.

[00:20] Team_002 possession (Score: 68-55)
Anfernee Sexton attempts a 3Pt. Contested by Larry Trent (4.1 feet, MAN). Anfernee Sexton misses. Rebound secured by Larry Trent.

[00:06] Team_001 possession (Score: 68-55)
Larry Trent attempts a Midrange. Wide open! Dirk Middleton is 6.1 feet away. [ZONE] LARRY TRENT MAKES IT! Assist: Franz Bryant
Score: 70-55

================================================================================
                              2ND QUARTER COMPLETE                              
================================================================================

2ND QUARTER SCORE: Team_001 28, Team_002 23

BOX SCORE:
================================================================================

Team_001
--------------------------------------------------------------------------------
Player                MIN  PTS  REB  AST  TO      FG   FG%      3P   3P%
--------------------------------------------------------------------------------
Dejounte McCollum      13    6    3    3   0   2/5    40.0     0/0   0.0
Kristaps Ming          17    6    0    0   0   3/3   100.0     0/0   0.0
Klay Harden            13    5    1    1   0   2/3    66.7     0/0   0.0
Miles Griffin           7    4    1    0   0   2/2   100.0     0/0   0.0
Rudy George            17    3    1    0   0   1/1   100.0     0/0   0.0
Cole Ball              15    2    0    0   0   0/0     0.0     0/0   0.0
Larry Trent            11    2    2    2   0   1/2    50.0     0/0   0.0
Dirk Young             10    0    1    1   0   0/0     0.0     0/0   0.0
Franz Bryant            9    0    4    2   0   0/0     0.0     0/0   0.0

TEAM: FG: 11/16 (68.8%), 3PT: 2/3 (66.7%), REB: 13 (4 off, 9 def), AST: 9, TO: 4
TEAM FOULS: 0


Team_002
--------------------------------------------------------------------------------
Player                MIN  PTS  REB  AST  TO      FG   FG%      3P   3P%
--------------------------------------------------------------------------------
Carmelo Lowry           7    4    0    0   0   2/2   100.0     0/0   0.0
Anfernee Sexton        17    4    3    0   0   2/3    66.7     0/0   0.0
CJ Barrett             13    3    0    0   0   0/1     0.0     0/0   0.0
Jordan Green           13    3    0    1   0   1/4    25.0     0/0   0.0
Dirk Middleton         11    3    0    0   0   1/2    50.0     0/0   0.0
Tyler Porzingis         7    2    1    0   0   1/1   100.0     0/0   0.0
Lamelo O'Neal          17    2    0    0   0   0/0     0.0     0/0   0.0
Miles Bane             13    0    2    3   0   0/2     0.0     0/0   0.0
Julius Curry           11    0    0    0   0   0/1     0.0     0/0   0.0
John Duncan            11    0    1    1   0   0/0     0.0     0/0   0.0

TEAM: FG: 7/16 (43.8%), 3PT: 1/9 (11.1%), REB: 7 (2 off, 5 def), AST: 5, TO: 3
TEAM FOULS: 9 [Team_001 in BONUS]

================================================================================

================================================================================
                       3RD QUARTER - Team_001 vs Team_002                       
================================================================================

[12:00] Team_001 possession (Score: 70-55)
Dirk Young drives, Tyler Porzingis stays with him. Dirk Young attempts a Layup. Contested by Tyler Porzingis (3.0 feet, ZONE). DIRK YOUNG MAKES IT! Assist: Klay Harden
Score: 72-55

[11:43] Team_002 possession (Score: 72-55)
Miles Bane attempts a 3Pt. Contested by Klay Harden (3.3 feet, MAN). MILES BANE MAKES IT! Assist: CJ Barrett
Score: 72-58

[11:31] Team_001 possession (Score: 72-58)
Klay Harden makes the Layup and draws the foul on Miles Bane! And-1! Klay Harden to the line for 1. [Team fouls: 1] (Miles Bane: 1 personal fouls)   FT 1/1: MISS Klay Harden makes 0/1 from the line. Rebound secured by Tyler Porzingis.
Score: 74-58

[11:17] Team_002 possession (Score: 74-58)
Carmelo Lowry attempts a Midrange. Contested by Dejounte McCollum (3.8 feet, ZONE). Carmelo Lowry misses. Offensive rebound by Tyler Porzingis! Tyler Porzingis puts it back in!
Score: 74-60

[11:03] Team_001 possession (Score: 74-60)
Dejounte McCollum attempts a Midrange. Contested by CJ Barrett (3.8 feet, ZONE). DEJOUNTE MCCOLLUM MAKES IT! Assist: Klay Harden
Score: 76-60

[10:49] Team_002 possession (Score: 76-60)
Carmelo Lowry attempts a Layup. Contested by Dejounte McCollum (3.8 feet, MAN). CARMELO LOWRY MAKES IT! Assist: Miles Bane
Score: 76-62

[10:32] Team_001 possession (Score: 76-62)
Cole Ball throws a bad pass! Stolen by Jordan Green! TURNOVER! (live ball)

[10:20] Team_002 possession (Score: 76-62)
Carmelo Lowry throws a bad pass! Stolen by Dejounte McCollum! TURNOVER! (live ball)

[10:08] Team_001 possession (Score: 76-62)
Miles Griffin attempts a Layup. Contested by Tyler Porzingis (3.0 feet, ZONE). Miles Griffin misses. Rebound secured by Tyler Porzingis.

[09:53] Team_002 possession (Score: 76-62)
Jordan Green attempts a 3Pt. Contested by Cole Ball (2.8 feet, MAN). Jordan Green misses. Rebound secured by Dejounte McCollum.

[09:38] Team_001 possession (Score: 76-62)
Dirk Young attempts a 3Pt. Contested by CJ Barrett (3.8 feet, ZONE). Dirk Young misses. Rebound secured by Carmelo Lowry.

[09:23] Team_002 possession (Score: 76-62)
Miles Bane attempts a 3Pt. Contested by Klay Harden (3.3 feet, ZONE). Miles Bane misses. Offensive rebound by Tyler Porzingis! Tyler Porzingis puts it back in!
Score: 76-64

[09:10] Team_001 possession (Score: 76-64)
Cole Ball throws a bad pass! Stolen by Jordan Green! TURNOVER! (live ball)

[08:55] Team_002 possession (Score: 76-64)
Jordan Green drives to the basket... Jordan Green throws a bad pass! Stolen by Cole Ball! TURNOVER! (live ball)

[08:38] Team_001 possession (Score: 76-64)
Klay Harden makes the Midrange and draws the foul on Miles Bane! And-1! Klay Harden to the line for 1. [Team fouls: 2] (Miles Bane: 2 personal fouls)   FT 1/1: GOOD Klay Harden makes 1/1 from the line.
Score: 79-64

[08:25] Team_002 possession (Score: 79-64)
Carmelo Lowry attempts a Midrange. Contested by Dirk Young (3.8 feet, ZONE). CARMELO LOWRY MAKES IT!
Score: 79-66

[08:12] Team_001 possession (Score: 79-66)
FOUL! Shooting foul on CJ Barrett. Dejounte McCollum to the line for 3 free throws. [Team fouls: 3] (CJ Barrett: 1 personal fouls)   FT 1/3: GOOD   FT 2/3: GOOD   FT 3/3: GOOD Dejounte McCollum makes 3/3 from the line.
Score: 82-66

[07:56] Team_002 possession (Score: 82-66)
CJ Barrett commits a violation (traveling/carry)! TURNOVER! (dead ball)

[07:43] Team_001 possession (Score: 82-66)
Miles Griffin drives and kicks out. Miles Griffin attempts a Midrange. Contested by Tyler Porzingis (3.0 feet, MAN). Miles Griffin misses. Offensive rebound by Cole Ball! Cole Ball kicks it out.

[07:29] Team_001 possession (Score: 82-66)
Dirk Young drives, CJ Barrett stays with him. Dirk Young attempts a Layup. Contested by CJ Barrett (3.8 feet, MAN). Dirk Young misses. Rebound secured by Miles Bane.

[07:14] Team_002 possession (Score: 82-66)
Miles Bane drives and kicks out. FOUL! Shooting foul on Dirk Young. CJ Barrett to the line for 3 free throws. [Team fouls: 4] (Dirk Young: 1 personal fouls)   FT 1/3: MISS   FT 2/3: GOOD   FT 3/3: GOOD CJ Barrett makes 2/3 from the line.
Score: 82-68

[07:02] Team_001 possession (Score: 82-68)
Klay Harden throws a bad pass out of bounds! TURNOVER! (dead ball)

[06:52] Team_002 possession (Score: 82-68)
FOUL! Reach-in foul on Dejounte McCollum during the drive. [IN THE BONUS! 5 team fouls] Carmelo Lowry to the line for 2 free throws. (Dejounte McCollum: 1 personal fouls)   FT 1/2: GOOD   FT 2/2: MISS Carmelo Lowry makes 1/2 from the line. Rebound secured by Cole Ball.
Score: 82-69

[06:39] Team_001 possession (Score: 82-69)
Dirk Young drives and kicks out. Klay Harden attempts a Midrange. Contested by Carmelo Lowry (3.6 feet, ZONE). Klay Harden misses. Rebound secured by Carmelo Lowry.

[06:27] Team_002 possession (Score: 82-69)
Miles Bane attempts a Midrange. Contested by Dejounte McCollum (3.8 feet, ZONE). MILES BANE MAKES IT! Assist: Tyler Porzingis
Score: 82-71

[06:14] Team_001 possession (Score: 82-71)
Klay Harden attempts a 3Pt. Contested by Miles Bane (4.5 feet, MAN). Klay Harden misses. Rebound secured by Carmelo Lowry.

[05:59] Team_002 possession (Score: 82-71)
Carmelo Lowry attempts a 3Pt. Contested by Dejounte McCollum (3.8 feet, ZONE). Carmelo Lowry misses. Offensive rebound by Carmelo Lowry! Carmelo Lowry kicks it out.

[05:50] Team_002 possession (Score: 82-71)
Tyler Porzingis attempts a Midrange. Contested by Miles Griffin (3.8 feet, MAN). Tyler Porzingis misses. Offensive rebound by Carmelo Lowry! Carmelo Lowry kicks it out.

[05:39] Team_002 possession (Score: 82-71)
Carmelo Lowry attempts a 3Pt. Contested by Klay Harden (3.5 feet, ZONE). Carmelo Lowry misses. Rebound secured by Miles Griffin.

[05:26] Team_001 possession (Score: 82-71)
Cole Ball attempts a 3Pt. Contested by Jordan Green (3.9 feet, MAN). Cole Ball misses. Rebound secured by Tyler Porzingis.

[05:10] Team_002 possession (Score: 82-71)
Jordan Green commits an offensive foul! Cole Ball drew the charge! TURNOVER! (dead ball)

[04:56] Team_001 possession (Score: 82-71)
Klay Harden attempts a 3Pt. Contested by Miles Bane (4.6 feet, MAN). Klay Harden misses. Rebound secured by Tyler Porzingis.

[04:44] Team_002 possession (Score: 82-71)
Miles Bane attempts a Midrange. Contested by Klay Harden (3.6 feet, MAN). Miles Bane misses. Rebound secured by Cole Ball.

[04:33] Team_001 possession (Score: 82-71)
Klay Harden attempts a 3Pt. Contested by CJ Barrett (4.0 feet, ZONE). Klay Harden misses. Rebound secured by Tyler Porzingis.

[04:18] Team_002 possession (Score: 82-71)
Jordan Green drives and kicks out. Miles Bane attempts a 3Pt. Contested by Klay Harden (3.7 feet, MAN). Miles Bane misses. FOUL! Loose ball foul on Dejounte McCollum during the rebound battle. [IN THE BONUS! 6 team fouls] Tyler Porzingis to the line for 2 free throws. (Dejounte McCollum: 2 personal fouls)   FT 1/2: GOOD   FT 2/2: MISS Tyler Porzingis makes 1/2 from the line. Rebound secured by Cole Ball.
Score: 82-72

[04:05] Team_001 possession (Score: 82-72)
Cole Ball attempts a Midrange. Contested by Jordan Green (4.0 feet, MAN). COLE BALL MAKES IT! Assist: Miles Griffin
Score: 84-72

[03:51] Team_002 possession (Score: 84-72)
Carmelo Lowry attempts a Layup. Contested by Dejounte McCollum (3.9 feet, MAN). CARMELO LOWRY MAKES IT! Assist: Tyler Porzingis
Score: 84-74

[03:36] Team_001 possession (Score: 84-74)
FOUL! Holding foul on Carmelo Lowry. [IN THE BONUS! 7 team fouls] Dejounte McCollum to the line for 2 free throws. (Carmelo Lowry: 1 personal fouls)   FT 1/2: MISS   FT 2/2: GOOD Dejounte McCollum makes 1/2 from the line.
Score: 85-74

[03:20] Team_002 possession (Score: 85-74)
CJ Barrett attempts a Midrange. Contested by Dirk Young (4.1 feet, ZONE). CJ Barrett misses. Rebound secured by Dejounte McCollum.

[03:07] Team_001 possession (Score: 85-74)
Klay Harden attempts a 3Pt. Contested by Miles Bane (4.8 feet, MAN). KLAY HARDEN MAKES IT! Assist: Cole Ball
Score: 88-74

[02:57] Team_002 possession (Score: 88-74)
Carmelo Lowry attempts a Layup. Contested by Dejounte McCollum (4.0 feet, MAN). CARMELO LOWRY MAKES IT! Assist: Jordan Green
Score: 88-76

[02:45] Team_001 possession (Score: 88-76)
FOUL! Shooting foul on Jordan Green. Miles Griffin to the line for 2 free throws. [BONUS: 8 team fouls] (Jordan Green: 1 personal fouls)   FT 1/2: GOOD   FT 2/2: GOOD Miles Griffin makes 2/2 from the line.
Score: 90-76

[02:27] Team_002 possession (Score: 90-76)
FOUL! Holding foul on Cole Ball. [IN THE BONUS! 9 team fouls] Jordan Green to the line for 2 free throws. (Cole Ball: 1 personal fouls)   FT 1/2: GOOD   FT 2/2: GOOD Jordan Green makes 2/2 from the line.
Score: 90-78

[02:18] Team_001 possession (Score: 90-78)
FOUL! Holding foul on CJ Barrett. [IN THE BONUS! 10 team fouls] Dirk Young to the line for 2 free throws. (CJ Barrett: 2 personal fouls)   FT 1/2: GOOD   FT 2/2: GOOD Dirk Young makes 2/2 from the line.
Score: 92-78

[02:02] Team_002 possession (Score: 92-78)
Miles Bane attempts a 3Pt. Contested by Klay Harden (4.1 feet, MAN). Miles Bane misses. Rebound secured by Cole Ball.

[01:49] Team_001 possession (Score: 92-78)
Klay Harden attempts a Midrange. Contested by Miles Bane (4.9 feet, MAN). Klay Harden misses. Rebound secured by Miles Bane.

[01:35] Team_002 possession (Score: 92-78)
FOUL! Reach-in foul on Dirk Young during the drive. [IN THE BONUS! 11 team fouls] CJ Barrett to the line for 2 free throws. (Dirk Young: 2 personal fouls)   FT 1/2: GOOD   FT 2/2: GOOD CJ Barrett makes 2/2 from the line.
Score: 92-80

[01:23] Team_001 possession (Score: 92-80)
Dirk Young attempts a 3Pt. Contested by CJ Barrett (4.4 feet, MAN). Dirk Young misses. Rebound secured by Miles Bane.

[01:09] Team_002 possession (Score: 92-80)
FOUL! Shooting foul on Klay Harden. Jordan Green to the line for 3 free throws. [BONUS: 12 team fouls] (Klay Harden: 1 personal fouls)   FT 1/3: GOOD   FT 2/3: GOOD   FT 3/3: GOOD Jordan Green makes 3/3 from the line.
Score: 92-83

[00:58] Team_001 possession (Score: 92-83)
Miles Griffin drives and kicks out. Dejounte McCollum attempts a 3Pt. Contested by Carmelo Lowry (4.3 feet, MAN). Dejounte McCollum misses. Offensive rebound by Cole Ball! Cole Ball kicks it out.

[00:43] Team_001 possession (Score: 92-83)
Dejounte McCollum attempts a Layup. BLOCKED BY CJ BARRETT! Offensive rebound by Dejounte McCollum! Dejounte McCollum kicks it out.

[00:32] Team_001 possession (Score: 92-83)
FOUL! Shooting foul on Jordan Green. Cole Ball to the line for 2 free throws. [BONUS: 13 team fouls] (Jordan Green: 2 personal fouls)   FT 1/2: GOOD   FT 2/2: GOOD Cole Ball makes 2/2 from the line.
Score: 94-83

[00:15] Team_002 possession (Score: 94-83)
CJ Barrett attempts a 3Pt. Contested by Dirk Young (4.6 feet, MAN). CJ BARRETT MAKES IT! Assist: Miles Bane
Score: 94-86

[00:02] Team_001 possession (Score: 94-86)
Dejounte McCollum attempts a 3Pt. Contested by Carmelo Lowry (4.5 feet, MAN). Dejounte McCollum misses. Rebound secured by Miles Bane.

================================================================================
                              3RD QUARTER COMPLETE                              
================================================================================

3RD QUARTER SCORE: Team_001 24, Team_002 31

BOX SCORE:
================================================================================

Team_001
--------------------------------------------------------------------------------
Player                MIN  PTS  REB  AST  TO      FG   FG%      3P   3P%
--------------------------------------------------------------------------------
Klay Harden            26    6    0    2   0   2/7    28.6     0/0   0.0
Dejounte McCollum      26    6    3    0   0   1/2    50.0     0/0   0.0
Dirk Young             22    4    0    0   0   1/5    20.0     0/0   0.0
Cole Ball              28    4    6    1   0   1/2    50.0     0/0   0.0
Miles Griffin          20    2    1    1   0   0/1     0.0     0/0   0.0

TEAM: FG: 5/17 (29.4%), 3PT: 1/8 (12.5%), REB: 9 (3 off, 6 def), AST: 4, TO: 3
TEAM FOULS: 0


Team_002
--------------------------------------------------------------------------------
Player                MIN  PTS  REB  AST  TO      FG   FG%      3P   3P%
--------------------------------------------------------------------------------
Carmelo Lowry          20    8    5    0   0   4/6    66.7     0/0   0.0
CJ Barrett             26    7    0    1   0   1/2    50.0     0/0   0.0
Miles Bane             26    5    4    2   0   2/4    50.0     0/0   0.0
Jordan Green           26    5    0    1   0   0/2     0.0     0/0   0.0
Tyler Porzingis        20    4    7    2   0   2/2   100.0     0/0   0.0

TEAM: FG: 9/16 (56.2%), 3PT: 3/6 (50.0%), REB: 17 (5 off, 12 def), AST: 6, TO: 4
TEAM FOULS: 13 [Team_001 in BONUS]

================================================================================

================================================================================
                       4TH QUARTER - Team_001 vs Team_002                       
================================================================================

[12:00] Team_001 possession (Score: 94-86)
Miles Griffin drives, Tyler Porzingis stays with him. Miles Griffin attempts a Dunk. Contested by Tyler Porzingis (3.6 feet, MAN). Miles Griffin misses. Rebound secured by Miles Bane.

[11:42] Team_002 possession (Score: 94-86)
Tyler Porzingis attempts a Midrange. Contested by Miles Griffin (4.3 feet, ZONE). Tyler Porzingis misses. Rebound secured by Dejounte McCollum.

[11:28] Team_001 possession (Score: 94-86)
Dirk Young attempts a Layup. Contested by CJ Barrett (4.4 feet, MAN). Dirk Young misses. Rebound secured by Tyler Porzingis.

[11:17] Team_002 possession (Score: 94-86)
Miles Bane drives to the basket... Miles Bane loses the ball! Stripped by Klay Harden! TURNOVER! (live ball)

[11:02] Team_001 possession (Score: 94-86)
Cole Ball attempts a Midrange. Contested by CJ Barrett (4.5 feet, ZONE). Cole Ball misses. Offensive rebound by Dejounte McCollum! Dejounte McCollum kicks it out.

[10:51] Team_001 possession (Score: 94-86)
FOUL! Shooting foul on CJ Barrett. Dejounte McCollum to the line for 2 free throws. [Team fouls: 1] (CJ Barrett: 1 personal fouls)   FT 1/2: GOOD   FT 2/2: GOOD Dejounte McCollum makes 2/2 from the line.
Score: 96-86

[10:35] Team_002 possession (Score: 96-86)
Jordan Green makes the Midrange and draws the foul on Cole Ball! And-1! Jordan Green to the line for 1. [Team fouls: 2] (Cole Ball: 1 personal fouls)   FT 1/1: GOOD Jordan Green makes 1/1 from the line.
Score: 96-89

[10:19] Team_001 possession (Score: 96-89)
Klay Harden attempts a 3Pt. Contested by Miles Bane (5.1 feet, MAN). Klay Harden misses. Offensive rebound by Dejounte McCollum! Dejounte McCollum kicks it out.

[10:06] Team_001 possession (Score: 96-89)
Dirk Young drives, Tyler Porzingis stays with him. Dirk Young attempts a Dunk. Contested by Tyler Porzingis (3.9 feet, ZONE). Dirk Young misses. Rebound secured by Carmelo Lowry.

[09:48] Team_002 possession (Score: 96-89)
Miles Bane commits an offensive foul! Klay Harden drew the charge! TURNOVER! (dead ball)

[09:29] Team_001 possession (Score: 96-89)
Dirk Young attempts a 3Pt. Contested by CJ Barrett (4.7 feet, MAN). Dirk Young misses. Rebound secured by Tyler Porzingis.

[09:17] Team_002 possession (Score: 96-89)
CJ Barrett drives, picks up Dirk Young. Help arrives from Cole Ball! CJ Barrett attempts a Layup. Contested by Cole Ball (4.8 feet, MAN). CJ BARRETT MAKES IT!
Score: 96-91

[09:00] Team_001 possession (Score: 96-91)
Miles Griffin attempts a Midrange. Contested by Tyler Porzingis (4.0 feet, MAN). Miles Griffin misses. Rebound secured by Miles Bane.

[08:44] Team_002 possession (Score: 96-91)
Miles Bane attempts a Layup. Contested by Klay Harden (4.7 feet, MAN). Miles Bane misses. Rebound secured by Cole Ball.

[08:28] Team_001 possession (Score: 96-91)
Cole Ball attempts a 3Pt. Contested by Jordan Green (4.8 feet, MAN). COLE BALL MAKES IT! Assist: Klay Harden
Score: 99-91

[08:16] Team_002 possession (Score: 99-91)
Miles Bane attempts a 3Pt. Contested by Klay Harden (4.8 feet, MAN). Miles Bane misses. Offensive rebound by Carmelo Lowry! Carmelo Lowry kicks it out.

[07:59] Team_002 possession (Score: 99-91)
FOUL! Holding foul on Dirk Young. [Team fouls: 3] No free throws, side out. (Dirk Young: 1 personal fouls)

[07:44] Team_001 possession (Score: 99-91)
Klay Harden attempts a 3Pt. Contested by Miles Bane (5.5 feet, ZONE). Klay Harden misses. Rebound secured by Tyler Porzingis.

[07:33] Team_002 possession (Score: 99-91)
Miles Bane makes the Midrange and draws the foul on Dirk Young! And-1! Miles Bane to the line for 1. [Team fouls: 4] (Dirk Young: 2 personal fouls)   FT 1/1: GOOD Miles Bane makes 1/1 from the line.
Score: 99-94

[07:17] Team_001 possession (Score: 99-94)
Miles Griffin drives to the basket... Miles Griffin commits an offensive foul! TURNOVER! (dead ball)

[07:08] Team_002 possession (Score: 99-94)
Carmelo Lowry drives, picks up Dejounte McCollum. Help arrives from Klay Harden! Carmelo Lowry attempts a Layup. Contested by Klay Harden (4.7 feet, ZONE). CARMELO LOWRY MAKES IT!
Score: 99-96

[06:50] Team_001 possession (Score: 99-96)
FOUL! Shooting foul on Carmelo Lowry. Dejounte McCollum to the line for 2 free throws. [BONUS: 5 team fouls] (Carmelo Lowry: 1 personal fouls)   FT 1/2: GOOD   FT 2/2: GOOD Dejounte McCollum makes 2/2 from the line.
Score: 101-96

[06:37] Team_002 possession (Score: 101-96)
Tyler Porzingis drives, Miles Griffin stays with him. Tyler Porzingis attempts a Dunk. Contested by Miles Griffin (5.1 feet, MAN). Tyler Porzingis misses. Offensive rebound by Miles Bane! Miles Bane kicks it out.

[06:26] Team_002 possession (Score: 101-96)
FOUL! Holding foul on Miles Griffin. [IN THE BONUS! 6 team fouls] Tyler Porzingis to the line for 2 free throws. (Miles Griffin: 1 personal fouls)   FT 1/2: GOOD   FT 2/2: MISS Tyler Porzingis makes 1/2 from the line. Offensive rebound by Tyler Porzingis! Tyler Porzingis kicks it out.
Score: 101-97

[06:10] Team_002 possession (Score: 101-97)
Miles Bane makes the 3Pt and draws the foul on Klay Harden! And-1! Miles Bane to the line for 1. [BONUS: 8 team fouls] (Klay Harden: 1 personal fouls)   FT 1/1: GOOD Miles Bane makes 1/1 from the line.
Score: 101-101

[05:57] Team_001 possession (Score: 101-101)
Miles Griffin attempts a 3Pt. Contested by Tyler Porzingis (4.6 feet, MAN). Miles Griffin misses. Rebound secured by Miles Bane.

[05:42] Team_002 possession (Score: 101-101)
CJ Barrett attempts a 3Pt. Contested by Dirk Young (5.4 feet, MAN). CJ Barrett misses. FOUL! Loose ball foul on Cole Ball during the rebound battle. [IN THE BONUS! 9 team fouls] Tyler Porzingis to the line for 2 free throws. (Cole Ball: 2 personal fouls)   FT 1/2: GOOD   FT 2/2: GOOD Tyler Porzingis makes 2/2 from the line.
Score: 101-103

[05:30] Team_001 possession (Score: 101-103)
Dirk Young makes the Layup and draws the foul on CJ Barrett! And-1! Dirk Young to the line for 1. [BONUS: 10 team fouls] (CJ Barrett: 2 personal fouls)   FT 1/1: MISS Dirk Young makes 0/1 from the line. Rebound secured by Tyler Porzingis.
Score: 103-103

[05:17] Team_002 possession (Score: 103-103)
Miles Bane attempts a 3Pt. Contested by Klay Harden (5.5 feet, MAN). Miles Bane misses. Rebound secured by Cole Ball.

[05:01] Team_001 possession (Score: 103-103)
Dejounte McCollum drives, picks up Carmelo Lowry. Help arrives from CJ Barrett! Dejounte McCollum attempts a Dunk. Contested by CJ Barrett (5.5 feet, MAN). DEJOUNTE MCCOLLUM MAKES IT! Assist: Cole Ball
Score: 105-103

[04:47] Team_002 possession (Score: 105-103)
Miles Bane attempts a Midrange. Contested by Dirk Young (5.6 feet, ZONE). MILES BANE MAKES IT! Assist: CJ Barrett
Score: 105-105

[04:32] Team_001 possession (Score: 105-105)
Dejounte McCollum drives, Carmelo Lowry stays with him. Dejounte McCollum attempts a Layup. Contested by Carmelo Lowry (5.6 feet, MAN). DEJOUNTE MCCOLLUM MAKES IT!
Score: 107-105

[04:13] Team_002 possession (Score: 107-105)
CJ Barrett drives and kicks out. Miles Bane attempts a 3Pt. Contested by Klay Harden (5.8 feet, MAN). Miles Bane misses. Offensive rebound by Miles Bane! Miles Bane kicks it out.

[03:55] Team_002 possession (Score: 107-105)
Carmelo Lowry commits an offensive foul! Dejounte McCollum drew the charge! TURNOVER! (dead ball)

[03:38] Team_001 possession (Score: 107-105)
Dirk Young drives to the basket... Dirk Young throws a bad pass out of bounds! TURNOVER! (dead ball)

[03:38] Substitution (Team_001): Klay Harden OUT → Ja Dosunmu IN (stamina_rule2)

[03:38] Substitution (Team_001): Dirk Young OUT → Rudy George IN (stamina_rule2)

[03:38] Substitution (Team_001): Cole Ball OUT → Larry Trent IN (stamina_rule2)

[03:38] Substitution (Team_001): Dejounte McCollum OUT → Franz Bryant IN (stamina_rule2)

[03:38] Substitution (Team_001): Miles Griffin OUT → Kristaps Ming IN (stamina_rule2)

[03:38] Substitution (Team_002): Miles Bane OUT → John Duncan IN (stamina_rule2)

[03:38] Substitution (Team_002): CJ Barrett OUT → Dirk Middleton IN (stamina_rule2)

[03:38] Substitution (Team_002): Jordan Green OUT → Anfernee Sexton IN (stamina_rule2)

[03:38] Substitution (Team_002): Carmelo Lowry OUT → Julius Curry IN (stamina_rule2)

[03:38] Substitution (Team_002): Tyler Porzingis OUT → Lamelo O'Neal IN (stamina_rule2)

[03:25] Team_002 possession (Score: 107-105)
John Duncan makes the Layup and draws the foul on Ja Dosunmu! And-1! John Duncan to the line for 1. [BONUS: 11 team fouls] (Ja Dosunmu: 1 personal fouls)   FT 1/1: GOOD John Duncan makes 1/1 from the line.
Score: 107-108

[03:08] Team_001 possession (Score: 107-108)
Rudy George attempts a Midrange. Contested by Dirk Middleton (5.9 feet, MAN). Rudy George misses. Rebound secured by Julius Curry.

[02:55] Team_002 possession (Score: 107-108)
Lamelo O'Neal attempts a Layup. Contested by Franz Bryant (3.8 feet, ZONE). Lamelo O'Neal misses. Offensive rebound by Anfernee Sexton! Anfernee Sexton kicks it out.

[02:41] Team_002 possession (Score: 107-108)
John Duncan attempts a 3Pt. Contested by Ja Dosunmu (3.5 feet, ZONE). John Duncan misses. Offensive rebound by Lamelo O'Neal! Lamelo O'Neal's putback is no good. Rebound secured by Rudy George.

[02:29] Team_001 possession (Score: 107-108)
Kristaps Ming attempts a Midrange. Contested by John Duncan (5.5 feet, ZONE). Kristaps Ming misses. FOUL! Loose ball foul on Anfernee Sexton during the rebound battle. [IN THE BONUS! 12 team fouls] Rudy George to the line for 2 free throws. (Anfernee Sexton: 1 personal fouls)   FT 1/2: MISS   FT 2/2: GOOD Rudy George makes 1/2 from the line.
Score: 108-108

[02:14] Team_002 possession (Score: 108-108)
Anfernee Sexton attempts a 3Pt. Contested by Ja Dosunmu (3.5 feet, ZONE). Anfernee Sexton misses. Rebound secured by Larry Trent.

[02:00] Team_001 possession (Score: 108-108)
Franz Bryant attempts a Midrange. Contested by Anfernee Sexton (4.4 feet, ZONE). FRANZ BRYANT MAKES IT! Assist: Rudy George
Score: 110-108

[01:45] Team_002 possession (Score: 110-108)
FOUL! Shooting foul on Ja Dosunmu. John Duncan to the line for 3 free throws. [BONUS: 13 team fouls] (Ja Dosunmu: 2 personal fouls)   FT 1/3: GOOD   FT 2/3: GOOD   FT 3/3: GOOD John Duncan makes 3/3 from the line.
Score: 110-111

[01:30] Team_001 possession (Score: 110-111)
Rudy George attempts a 3Pt. Contested by Julius Curry (5.4 feet, ZONE). RUDY GEORGE MAKES IT! Assist: Kristaps Ming
Score: 113-111

[01:17] Team_002 possession (Score: 113-111)
Anfernee Sexton throws a bad pass out of bounds! TURNOVER! (dead ball)

[01:04] Team_001 possession (Score: 113-111)
Rudy George attempts a Midrange. Contested by Dirk Middleton (5.9 feet, MAN). Rudy George misses. Rebound secured by Anfernee Sexton.

[00:50] Team_002 possession (Score: 113-111)
FOUL! Reach-in foul on Larry Trent during the drive. [IN THE BONUS! 14 team fouls] Anfernee Sexton to the line for 2 free throws. (Larry Trent: 1 personal fouls)   FT 1/2: GOOD   FT 2/2: GOOD Anfernee Sexton makes 2/2 from the line.
Score: 113-113

[00:36] Team_001 possession (Score: 113-113)
FOUL! Reach-in foul on Lamelo O'Neal during the drive. [IN THE BONUS! 15 team fouls] Kristaps Ming to the line for 2 free throws. (Lamelo O'Neal: 1 personal fouls)   FT 1/2: GOOD   FT 2/2: GOOD Kristaps Ming makes 2/2 from the line.
Score: 115-113

[00:23] Team_002 possession (Score: 115-113)
Dirk Middleton drives to the basket... Dirk Middleton commits an offensive foul! TURNOVER! (dead ball)

[00:13] Team_001 possession (Score: 115-113)
Franz Bryant attempts a 3Pt. Contested by Lamelo O'Neal (3.0 feet, MAN). Franz Bryant misses. Rebound secured by Anfernee Sexton.

================================================================================
                              4TH QUARTER COMPLETE                              
================================================================================

4TH QUARTER SCORE: Team_001 21, Team_002 27

BOX SCORE:
================================================================================

Team_001
--------------------------------------------------------------------------------
Player                MIN  PTS  REB  AST  TO      FG   FG%      3P   3P%
--------------------------------------------------------------------------------
Dejounte McCollum      34    8    3    0   0   2/2   100.0     0/0   0.0
Rudy George            20    4    1    1   0   1/3    33.3     0/0   0.0
Cole Ball              36    3    2    1   0   1/1   100.0     0/0   0.0
Franz Bryant           12    2    0    0   0   1/2    50.0     0/0   0.0
Kristaps Ming          20    2    0    1   0   0/0     0.0     0/0   0.0
Miles Griffin          28    0    0    0   0   0/3     0.0     0/0   0.0
Dirk Young             31    0    0    0   0   0/4     0.0     0/0   0.0
Klay Harden            34    0    0    1   0   0/1     0.0     0/0   0.0
Larry Trent            14    0    1    0   0   0/0     0.0     0/0   0.0

TEAM: FG: 5/16 (31.2%), 3PT: 2/6 (33.3%), REB: 6 (2 off, 4 def), AST: 4, TO: 2
TEAM FOULS: 0


Team_002
--------------------------------------------------------------------------------
Player                MIN  PTS  REB  AST  TO      FG   FG%      3P   3P%
--------------------------------------------------------------------------------
Miles Bane             34    9    5    0   0   3/5    60.0     0/0   0.0
John Duncan            14    6    0    0   0   1/2    50.0     0/0   0.0
Jordan Green           34    3    0    0   0   1/1   100.0     0/0   0.0
Tyler Porzingis        28    2    5    0   0   0/1     0.0     0/0   0.0
Carmelo Lowry          28    2    2    0   0   1/1   100.0     0/0   0.0
CJ Barrett             34    2    0    1   0   1/1   100.0     0/0   0.0
Anfernee Sexton        20    2    3    0   0   0/1     0.0     0/0   0.0
Julius Curry           14    0    1    0   0   0/0     0.0     0/0   0.0

TEAM: FG: 7/12 (58.3%), 3PT: 1/4 (25.0%), REB: 17 (6 off, 11 def), AST: 1, TO: 5
TEAM FOULS: 15 [Team_001 in BONUS]

================================================================================

================================================================================
                               FULL GAME COMPLETE                               
================================================================================

FINAL SCORE: Team_001 115, Team_002 113

SCORING BY QUARTER:
--------------------------------------------------------------------------------
Team                     Q1     Q2     Q3     Q4    FINAL
--------------------------------------------------------------------------------
Team_001                 42     28     24     21      115
Team_002                 32     23     31     27      113
--------------------------------------------------------------------------------

FULL GAME BOX SCORE:
================================================================================

Team_001
--------------------------------------------------------------------------------
Player                MIN  PTS  REB  AST  TO      FG   FG%      3P   3P%      FT STL BLK
--------------------------------------------------------------------------------
Cole Ball              36   17   11    2   3   5/6    83.3   1/2    50.0   8/8     2   0
Klay Harden            34   25    1    4   2   8/15   53.3   4/8    50.0   5/5     1   0
Dejounte McCollum      34   20   11    3   1   5/9    55.6   1/3    33.3   9/10    1   0
Dirk Young             31    9    1    3   1   3/11   27.3   0/3     0.0   3/3     0   0
Miles Griffin          28    6    3    2   0   2/6    33.3   0/1     0.0   2/2     0   0
Rudy George            20    9    3    1   0   3/7    42.9   2/4    50.0   0/2     0   0
Kristaps Ming          20   17    0    1   1   3/3   100.0   0/0     0.0   6/6     0   0
Larry Trent            14    4    4    3   1   3/7    42.9   0/1     0.0   0/0     0   0
Franz Bryant           12    2    4    2   0   1/2    50.0   0/1     0.0   0/0     0   0
Ja Dosunmu             11    2    0    2   1   1/2    50.0   0/1     0.0   0/0     0   0

TEAM: FG: 34/68 (50.0%), 3PT: 8/24 (33.3%), REB: 36 (10 off, 26 def), AST: 23, TO: 10


Team_002
--------------------------------------------------------------------------------
Player                MIN  PTS  REB  AST  TO      FG   FG%      3P   3P%      FT STL BLK
--------------------------------------------------------------------------------
Miles Bane             34   15   11    5   2   6/14   42.9   3/7    42.9   3/4     2   0
CJ Barrett             34   14    0    2   2   3/6    50.0   1/1   100.0   7/8     0   1
Jordan Green           34   13    0    3   3   3/8    37.5   0/4     0.0   7/7     2   0
Carmelo Lowry          28   14    7    0   3   8/10   80.0   0/1     0.0   0/0     0   0
Tyler Porzingis        28    8   13    2   1   1/2    50.0   0/0     0.0   0/2     0   0
Anfernee Sexton        20   15    8    0   2   5/7    71.4   2/4    50.0   3/3     0   0
Lamelo O'Neal          20    4    0    2   1   1/1   100.0   0/0     0.0   2/2     0   1
John Duncan            14   11    1    3   1   3/4    75.0   1/2    50.0   4/4     0   0
Dirk Middleton         14    9    0    1   0   3/7    42.9   3/6    50.0   0/0     0   0
Julius Curry           14    5    6    2   1   2/4    50.0   1/2    50.0   0/0     0   0

TEAM: FG: 35/63 (55.6%), 3PT: 11/27 (40.7%), REB: 48 (14 off, 34 def), AST: 20, TO: 16

================================================================================
