================================================================================
                        FULL GAME - Team_001 vs Team_002                        
================================================================================

================================================================================
                       1ST QUARTER - Team_001 vs Team_002                       
================================================================================

[12:00] Team_001 possession (Score: 0-0)
Dejounte McCollum attempts a Midrange. Contested by Carmelo Lowry (5.5 feet, MAN). Dejounte McCollum misses. Offensive rebound by Cole Ball! Cole Ball kicks it out.

[11:44] Team_001 possession (Score: 0-0)
Cole Ball attempts a 3Pt. Contested by Miles Bane (4.7 feet, ZONE). COLE BALL MAKES IT! Assist: Dejounte McCollum
Score: 3-0

[11:31] Team_002 possession (Score: 3-0)
Tyler Porzingis drives and kicks out. Miles Bane attempts a Midrange. Contested by Dirk Young (4.5 feet, ZONE). Miles Bane misses. Rebound secured by Cole Ball.

[11:16] Team_001 possession (Score: 3-0)
Dejounte McCollum loses control! Ball rolls out of bounds! TURNOVER! (dead ball)

[11:16] Substitution (Team_001): Klay Harden OUT → Rudy George IN (stamina_rule2)

[11:16] Substitution (Team_001): Dirk Young OUT → Ja Dosunmu IN (stamina_rule2)

[11:16] Substitution (Team_001): Miles Griffin OUT → Kristaps Ming IN (stamina_rule2)

[11:16] Substitution (Team_002): Miles Bane OUT → John Duncan IN (stamina_rule2)

[11:16] Substitution (Team_002): CJ Barrett OUT → Miles Bane IN (stamina_rule2)

[11:16] Substitution (Team_002): Jordan Green OUT → Anfernee Sexton IN (stamina_rule2)

[11:16] Substitution (Team_002): Carmelo Lowry OUT → Jordan Green IN (stamina_rule2)

[11:16] Substitution (Team_002): Tyler Porzingis OUT → Lamelo O'Neal IN (stamina_rule2)

[10:59] Team_002 possession (Score: 3-0)
Lamelo O'Neal drives to the basket... Lamelo O'Neal throws a bad pass out of bounds! TURNOVER! (dead ball)

[10:59] Substitution (Team_002): Miles Bane OUT → CJ Barrett IN (stamina_rule2)

[10:59] Substitution (Team_002): Jordan Green OUT → Julius Curry IN (stamina_rule2)

[10:41] Team_001 possession (Score: 3-0)
Rudy George throws a bad pass out of bounds! TURNOVER! (dead ball)

[10:41] Substitution (Team_002): CJ Barrett OUT → Miles Bane IN (stamina_rule2)

[10:26] Team_002 possession (Score: 3-0)
Miles Bane makes the 3Pt and draws the foul on Ja Dosunmu! And-1! Miles Bane to the line for 1. [Team fouls: 1] (Ja Dosunmu: 1 personal fouls)   FT 1/1: GOOD Miles Bane makes 1/1 from the line.
Score: 3-4

[10:10] Team_001 possession (Score: 3-4)
Kristaps Ming drives, Lamelo O'Neal stays with him. Kristaps Ming attempts a Layup. Contested by Lamelo O'Neal (5.7 feet, ZONE). KRISTAPS MING MAKES IT! Assist: Rudy George
Score: 5-4

[09:56] Team_002 possession (Score: 5-4)
FOUL! Shooting foul on Dejounte McCollum. Julius Curry to the line for 2 free throws. [Team fouls: 2] (Dejounte McCollum: 1 personal fouls)   FT 1/2: GOOD   FT 2/2: GOOD Julius Curry makes 2/2 from the line.
Score: 5-6

[09:42] Team_001 possession (Score: 5-6)
Ja Dosunmu drives, Miles Bane stays with him. Ja Dosunmu attempts a Layup. Contested by Miles Bane (4.9 feet, MAN). Ja Dosunmu misses. Rebound secured by Anfernee Sexton.

[09:27] Team_002 possession (Score: 5-6)
John Duncan makes the Layup and draws the foul on Cole Ball! And-1! John Duncan to the line for 1. [Team fouls: 3] (Cole Ball: 1 personal fouls)   FT 1/1: GOOD John Duncan makes 1/1 from the line.
Score: 5-9

[09:11] Team_001 possession (Score: 5-9)
Rudy George attempts a 3Pt. Contested by Miles Bane (5.0 feet, MAN). Rudy George misses. Rebound secured by Miles Bane.

[09:00] Team_002 possession (Score: 5-9)
Miles Bane attempts a Layup. BLOCKED BY JA DOSUNMU! Ball goes out of bounds. Turnover!

[09:00] Substitution (Team_001): Cole Ball OUT → Larry Trent IN (stamina_rule2)

[09:00] Substitution (Team_002): Miles Bane OUT → CJ Barrett IN (stamina_rule2)

[08:40] Team_001 possession (Score: 5-9)
Kristaps Ming attempts a 3Pt. Contested by CJ Barrett (4.1 feet, ZONE). Kristaps Ming misses. Rebound secured by Anfernee Sexton.

[08:23] Team_002 possession (Score: 5-9)
Julius Curry drives and kicks out. CJ Barrett attempts a 3Pt. Contested by Rudy George (5.6 feet, MAN). CJ Barrett misses. Rebound secured by Larry Trent.

[08:12] Team_001 possession (Score: 5-9)
Dejounte McCollum attempts a Layup. Wide open! Julius Curry is 6.1 feet away. [MAN] DEJOUNTE MCCOLLUM MAKES IT!
Score: 7-9

[07:56] Team_002 possession (Score: 7-9)
Lamelo O'Neal attempts a Midrange. Contested by Dejounte McCollum (4.1 feet, ZONE). Lamelo O'Neal misses. Rebound secured by Larry Trent.

[07:38] Team_001 possession (Score: 7-9)
Rudy George attempts a 3Pt. Contested by CJ Barrett (4.2 feet, MAN). RUDY GEORGE MAKES IT! Assist: Kristaps Ming
Score: 10-9

[07:24] Team_002 possession (Score: 10-9)
Anfernee Sexton attempts a 3Pt. Contested by Larry Trent (4.5 feet, ZONE). Anfernee Sexton misses. Rebound secured by Rudy George.

[07:07] Team_001 possession (Score: 10-9)
Dejounte McCollum attempts a 3Pt. Wide open! Julius Curry is 6.2 feet away. [MAN] DEJOUNTE MCCOLLUM MAKES IT!
Score: 13-9

[06:50] Team_002 possession (Score: 13-9)
Julius Curry drives and kicks out. Julius Curry attempts a 3Pt. Contested by Dejounte McCollum (4.3 feet, MAN). Julius Curry misses. Rebound secured by Dejounte McCollum.

[06:32] Team_001 possession (Score: 13-9)
Dejounte McCollum attempts a 3Pt. Contested by CJ Barrett (4.3 feet, ZONE). DEJOUNTE MCCOLLUM MAKES IT! Assist: Ja Dosunmu
Score: 16-9

[06:22] Team_002 possession (Score: 16-9)
Anfernee Sexton attempts a Layup. Contested by Dejounte McCollum (4.3 feet, ZONE). ANFERNEE SEXTON MAKES IT! Assist: Lamelo O'Neal
Score: 16-11

[06:05] Team_001 possession (Score: 16-11)
Larry Trent loses the ball! Stripped by Anfernee Sexton! TURNOVER! (live ball)

[05:51] Team_002 possession (Score: 16-11)
Anfernee Sexton drives and kicks out. John Duncan attempts a 3Pt. Contested by Larry Trent (4.7 feet, ZONE). John Duncan misses. Rebound secured by Dejounte McCollum.

[05:32] Team_001 possession (Score: 16-11)
Rudy George throws a bad pass! Stolen by CJ Barrett! TURNOVER! (live ball)

[05:17] Team_002 possession (Score: 16-11)
Anfernee Sexton attempts a Layup. Contested by Larry Trent (4.7 feet, MAN). ANFERNEE SEXTON MAKES IT! Assist: CJ Barrett
Score: 16-13

[05:05] Team_001 possession (Score: 16-13)
Larry Trent attempts a Midrange. Contested by Anfernee Sexton (5.6 feet, MAN). LARRY TRENT MAKES IT! Assist: Kristaps Ming
Score: 18-13

[04:47] Team_002 possession (Score: 18-13)
CJ Barrett loses control! Ball rolls out of bounds! TURNOVER! (dead ball)

[04:47] Substitution (Team_001): Dejounte McCollum OUT → Cole Ball IN (stamina_rule2)

[04:47] Substitution (Team_002): CJ Barrett OUT → Dirk Middleton IN (stamina_rule2)

[04:33] Team_001 possession (Score: 18-13)
Cole Ball attempts a Midrange. Contested by Anfernee Sexton (5.7 feet, MAN). COLE BALL MAKES IT! Assist: Rudy George
Score: 20-13

[04:22] Team_002 possession (Score: 20-13)
Julius Curry attempts a Layup. Wide open! Kristaps Ming is 7.4 feet away. [ZONE] JULIUS CURRY MAKES IT!
Score: 20-15

[04:08] Team_001 possession (Score: 20-15)
Rudy George attempts a Midrange. Wide open! Dirk Middleton is 6.0 feet away. [MAN] Rudy George misses. Rebound secured by Julius Curry.

[03:57] Team_002 possession (Score: 20-15)
John Duncan attempts a Midrange. Wide open! Rudy George is 6.3 feet away. [ZONE] JOHN DUNCAN MAKES IT! Assist: Lamelo O'Neal
Score: 20-17

[03:47] Team_001 possession (Score: 20-17)
Larry Trent commits an offensive foul! Anfernee Sexton drew the charge! TURNOVER! (dead ball)

[03:34] Team_002 possession (Score: 20-17)
John Duncan attempts a 3Pt. Contested by Larry Trent (5.0 feet, ZONE). JOHN DUNCAN MAKES IT! Assist: Dirk Middleton
Score: 20-20

[03:20] Team_001 possession (Score: 20-20)
Cole Ball attempts a 3Pt. Contested by Anfernee Sexton (5.9 feet, MAN). COLE BALL MAKES IT! Assist: Ja Dosunmu
Score: 23-20

[03:02] Team_002 possession (Score: 23-20)
Lamelo O'Neal attempts a Midrange. Wide open! Rudy George is 6.5 feet away. [ZONE] Lamelo O'Neal misses. Rebound secured by Rudy George.

[02:48] Team_001 possession (Score: 23-20)
Kristaps Ming attempts a Midrange. Wide open! Lamelo O'Neal is 7.7 feet away. [MAN] KRISTAPS MING MAKES IT! Assist: Rudy George
Score: 25-20

[02:33] Team_002 possession (Score: 25-20)
Lamelo O'Neal drives, Kristaps Ming stays with him. Lamelo O'Neal attempts a Dunk. Wide open! Kristaps Ming is 7.7 feet away. [ZONE] Lamelo O'Neal misses. Rebound secured by Rudy George.

[02:18] Team_001 possession (Score: 25-20)
Larry Trent drives to the basket... Larry Trent loses control! Ball rolls out of bounds! TURNOVER! (dead ball)

[02:18] Substitution (Team_001): Cole Ball OUT → Franz Bryant IN (stamina_rule2)

[02:07] Team_002 possession (Score: 25-20)
Dirk Middleton attempts a 3Pt. Contested by Franz Bryant (3.9 feet, ZONE). Dirk Middleton misses. Rebound secured by Franz Bryant.

[01:55] Team_001 possession (Score: 25-20)
Rudy George attempts a Midrange. Wide open! Dirk Middleton is 6.2 feet away. [MAN] RUDY GEORGE MAKES IT!
Score: 27-20

[01:42] Team_002 possession (Score: 27-20)
Lamelo O'Neal throws a bad pass! Stolen by Franz Bryant! TURNOVER! (live ball)

[01:27] Team_001 possession (Score: 27-20)
Ja Dosunmu attempts a Midrange. Wide open! John Duncan is 7.1 feet away. [MAN] Ja Dosunmu misses. Rebound secured by Julius Curry.

[01:09] Team_002 possession (Score: 27-20)
John Duncan attempts a Midrange. Wide open! Ja Dosunmu is 7.0 feet away. [MAN] JOHN DUNCAN MAKES IT! Assist: Lamelo O'Neal
Score: 27-22

[00:52] Team_001 possession (Score: 27-22)
Franz Bryant attempts a Midrange. Wide open! Julius Curry is 7.1 feet away. [MAN] Franz Bryant misses. Rebound secured by Anfernee Sexton.

[00:37] Team_002 possession (Score: 27-22)
Anfernee Sexton attempts a 3Pt. Contested by Larry Trent (5.5 feet, MAN). Anfernee Sexton misses. FOUL! Loose ball foul on Rudy George during the rebound battle. [Team fouls: 4] No free throws, side out. (Rudy George: 1 personal fouls)

[00:27] Team_002 possession (Score: 27-22)
John Duncan attempts a 3Pt. Wide open! Ja Dosunmu is 7.1 feet away. [MAN] John Duncan misses. Rebound secured by Franz Bryant.

[00:11] Team_001 possession (Score: 27-22)
Larry Trent attempts a Layup. Wide open! Anfernee Sexton is 6.4 feet away. [MAN] LARRY TRENT MAKES IT!
Score: 29-22

================================================================================
                              1ST QUARTER COMPLETE                              
================================================================================

1ST QUARTER SCORE: Team_001 29, Team_002 22

BOX SCORE:
================================================================================

Team_001
--------------------------------------------------------------------------------
Player                MIN  PTS  REB  AST  TO      FG   FG%      3P   3P%
--------------------------------------------------------------------------------
Cole Ball               6    8    2    0   0   3/3   100.0     0/0   0.0
Dejounte McCollum       7    8    2    1   0   3/3   100.0     0/0   0.0
Rudy George            11    5    3    3   0   2/4    50.0     0/0   0.0
Kristaps Ming          11    4    0    2   0   2/3    66.7     0/0   0.0
Larry Trent             9    4    2    0   0   2/2   100.0     0/0   0.0
Ja Dosunmu             11    0    0    2   0   0/2     0.0     0/0   0.0
Franz Bryant            2    0    2    0   0   0/1     0.0     0/0   0.0

TEAM: FG: 12/18 (66.7%), 3PT: 5/7 (71.4%), REB: 11 (1 off, 10 def), AST: 8, TO: 6
TEAM FOULS: 0


Team_002
--------------------------------------------------------------------------------
Player                MIN  PTS  REB  AST  TO      FG   FG%      3P   3P%
--------------------------------------------------------------------------------
John Duncan            11   10    0    0   0   4/5    80.0     0/0   0.0
Miles Bane              3    4    1    0   0   1/1   100.0     0/0   0.0
Julius Curry           11    4    2    0   0   1/3    33.3     0/0   0.0
Anfernee Sexton        11    4    4    0   0   2/4    50.0     0/0   0.0
Tyler Porzingis         1    0    0    0   0   0/1     0.0     0/0   0.0
Lamelo O'Neal          11    0    0    3   0   0/3     0.0     0/0   0.0
CJ Barrett              5    0    0    1   0   0/0     0.0     0/0   0.0
Dirk Middleton          5    0    0    1   0   0/1     0.0     0/0   0.0

TEAM: FG: 8/18 (44.4%), 3PT: 2/5 (40.0%), REB: 7 (1 off, 6 def), AST: 5, TO: 4
TEAM FOULS: 4

================================================================================

================================================================================
                       2ND QUARTER - Team_001 vs Team_002                       
================================================================================

[12:00] Team_001 possession (Score: 29-22)
Klay Harden attempts a 3Pt. Contested by Miles Bane (4.5 feet, MAN). Klay Harden misses. Rebound secured by Carmelo Lowry.

[11:47] Team_002 possession (Score: 29-22)
Jordan Green drives and kicks out. Miles Bane attempts a Midrange. Contested by Klay Harden (3.3 feet, MAN). Miles Bane misses. Rebound secured by Miles Griffin.

[11:30] Team_001 possession (Score: 29-22)
Klay Harden drives, Miles Bane stays with him. Klay Harden attempts a Dunk. Contested by Miles Bane (4.5 feet, MAN). KLAY HARDEN MAKES IT! Assist: Dirk Young
Score: 31-22

[11:21] Team_002 possession (Score: 31-22)
CJ Barrett attempts a Layup. Contested by Dirk Young (3.8 feet, MAN). CJ Barrett misses. Rebound secured by Miles Griffin.

[11:07] Team_001 possession (Score: 31-22)
FOUL! Reach-in foul on Tyler Porzingis during the drive. [Team fouls: 1] No free throws, side out. (Tyler Porzingis: 1 personal fouls)

[10:49] Team_002 possession (Score: 31-22)
CJ Barrett drives and kicks out. CJ Barrett attempts a 3Pt. Contested by Dirk Young (3.8 feet, MAN). CJ Barrett misses. Rebound secured by Dejounte McCollum.

[10:30] Team_001 possession (Score: 31-22)
Klay Harden attempts a 3Pt. Contested by Miles Bane (4.5 feet, MAN). Klay Harden misses. Rebound secured by Carmelo Lowry.

[10:17] Team_002 possession (Score: 31-22)
Carmelo Lowry attempts a Layup. Contested by Dejounte McCollum (3.9 feet, MAN). Carmelo Lowry misses. Rebound secured by Dejounte McCollum.

[10:06] Team_001 possession (Score: 31-22)
Dejounte McCollum makes the Layup and draws the foul on Carmelo Lowry! And-1! Dejounte McCollum to the line for 1. [Team fouls: 2] (Carmelo Lowry: 1 personal fouls)   FT 1/1: GOOD Dejounte McCollum makes 1/1 from the line.
Score: 34-22

[09:48] Team_002 possession (Score: 34-22)
CJ Barrett attempts a Layup. Contested by Dirk Young (3.8 feet, MAN). CJ BARRETT MAKES IT! Assist: Miles Bane
Score: 34-24

[09:34] Team_001 possession (Score: 34-24)
Dirk Young drives and kicks out. Miles Griffin attempts a Midrange. Contested by Tyler Porzingis (3.1 feet, MAN). MILES GRIFFIN MAKES IT! Assist: Dirk Young
Score: 36-24

[09:19] Team_002 possession (Score: 36-24)
Miles Bane attempts a Midrange. Contested by Klay Harden (3.6 feet, MAN). Miles Bane misses. Rebound secured by Miles Griffin.

[09:04] Team_001 possession (Score: 36-24)
Dejounte McCollum drives to the basket... Dejounte McCollum loses control! Ball rolls out of bounds! TURNOVER! (dead ball)

[09:04] Substitution (Team_002): CJ Barrett OUT → Dirk Middleton IN (stamina_rule2)

[09:04] Substitution (Team_002): Carmelo Lowry OUT → Anfernee Sexton IN (stamina_rule2)

[08:46] Team_002 possession (Score: 36-24)
Tyler Porzingis attempts a Midrange. Contested by Miles Griffin (4.0 feet, MAN). TYLER PORZINGIS MAKES IT! Assist: Anfernee Sexton
Score: 36-26

[08:29] Team_001 possession (Score: 36-26)
Dirk Young attempts a Layup. Wide open! Dirk Middleton is 6.0 feet away. [MAN] DIRK YOUNG MAKES IT! Assist: Cole Ball
Score: 38-26

[08:15] Team_002 possession (Score: 38-26)
Miles Bane attempts a Midrange. Contested by Klay Harden (3.7 feet, MAN). Miles Bane misses. Offensive rebound by Miles Bane! Miles Bane kicks it out.

[08:03] Team_002 possession (Score: 38-26)
FOUL! Reach-in foul on Miles Griffin during the drive. [Team fouls: 3] No free throws, side out. (Miles Griffin: 1 personal fouls)

[07:52] Team_001 possession (Score: 38-26)
Klay Harden drives and kicks out. Cole Ball attempts a 3Pt. Contested by Jordan Green (3.9 feet, MAN). COLE BALL MAKES IT! Assist: Miles Griffin
Score: 41-26

[07:40] Team_002 possession (Score: 41-26)
Anfernee Sexton attempts a Midrange. Contested by Cole Ball (3.3 feet, MAN). Anfernee Sexton misses. Rebound secured by Miles Griffin.

[07:29] Team_001 possession (Score: 41-26)
Dirk Young drives and kicks out. Klay Harden attempts a 3Pt. Contested by Jordan Green (3.9 feet, ZONE). Klay Harden misses. Rebound secured by Tyler Porzingis.

[07:14] Team_002 possession (Score: 41-26)
Tyler Porzingis attempts a Midrange. Contested by Miles Griffin (4.2 feet, MAN). Tyler Porzingis misses. Offensive rebound by Tyler Porzingis! Tyler Porzingis puts it back in!
Score: 41-28

[06:59] Team_001 possession (Score: 41-28)
Klay Harden attempts a 3Pt. Contested by Miles Bane (4.8 feet, MAN). Klay Harden misses. Rebound secured by Miles Bane.

[06:41] Team_002 possession (Score: 41-28)
FOUL! Holding foul on Miles Griffin. [Team fouls: 4] No free throws, side out. (Miles Griffin: 2 personal fouls)

[06:27] Team_001 possession (Score: 41-28)
Klay Harden drives, Tyler Porzingis stays with him. Klay Harden attempts a Dunk. Contested by Tyler Porzingis (3.6 feet, ZONE). Klay Harden misses. Rebound secured by Miles Bane.

[06:15] Team_002 possession (Score: 41-28)
Jordan Green attempts a 3Pt. Contested by Cole Ball (3.6 feet, MAN). Jordan Green misses. Offensive rebound by Tyler Porzingis! Tyler Porzingis puts it back in!
Score: 41-30

[05:58] Team_001 possession (Score: 41-30)
Miles Griffin attempts a 3Pt. Contested by Miles Bane (4.9 feet, ZONE). Miles Griffin misses. Rebound secured by Miles Bane.

[05:43] Team_002 possession (Score: 41-30)
Anfernee Sexton drives and kicks out. Tyler Porzingis attempts a 3Pt. Contested by Miles Griffin (4.4 feet, MAN). Tyler Porzingis misses. FOUL! Loose ball foul on Dejounte McCollum during the rebound battle. [IN THE BONUS! 5 team fouls] Miles Bane to the line for 2 free throws. (Dejounte McCollum: 1 personal fouls)   FT 1/2: GOOD   FT 2/2: GOOD Miles Bane makes 2/2 from the line.
Score: 41-32

[05:27] Team_001 possession (Score: 41-32)
Dirk Young attempts a 3Pt. Contested by Miles Bane (4.9 feet, ZONE). DIRK YOUNG MAKES IT! Assist: Miles Griffin
Score: 44-32

[05:13] Team_002 possession (Score: 44-32)
Dirk Middleton attempts a 3Pt. Contested by Dirk Young (4.3 feet, MAN). Dirk Middleton misses. Rebound secured by Cole Ball.

[04:59] Team_001 possession (Score: 44-32)
Cole Ball attempts a 3Pt. Contested by Jordan Green (4.2 feet, MAN). COLE BALL MAKES IT! Assist: Klay Harden
Score: 47-32

[04:45] Team_002 possession (Score: 47-32)
Dirk Middleton attempts a 3Pt. Contested by Klay Harden (4.4 feet, ZONE). Dirk Middleton misses. Rebound secured by Cole Ball.

[04:29] Team_001 possession (Score: 47-32)
Miles Griffin drives, Tyler Porzingis stays with him. Miles Griffin attempts a Layup. Contested by Tyler Porzingis (3.9 feet, MAN). Miles Griffin misses. Offensive rebound by Cole Ball! Cole Ball kicks it out.

[04:16] Team_001 possession (Score: 47-32)
Cole Ball attempts a Midrange. Contested by Jordan Green (4.3 feet, MAN). Cole Ball misses. Rebound secured by Tyler Porzingis.

[04:02] Team_002 possession (Score: 47-32)
Dirk Middleton attempts a 3Pt. Contested by Dirk Young (4.5 feet, MAN). Dirk Middleton misses. Rebound secured by Cole Ball.

[03:45] Team_001 possession (Score: 47-32)
Klay Harden drives to the basket... Klay Harden throws a bad pass out of bounds! TURNOVER! (dead ball)

[03:45] Substitution (Team_001): Klay Harden OUT → Rudy George IN (stamina_rule2)

[03:45] Substitution (Team_001): Dirk Young OUT → Ja Dosunmu IN (stamina_rule2)

[03:45] Substitution (Team_001): Cole Ball OUT → Franz Bryant IN (stamina_rule2)

[03:45] Substitution (Team_001): Dejounte McCollum OUT → Larry Trent IN (stamina_rule2)

[03:45] Substitution (Team_001): Miles Griffin OUT → Kristaps Ming IN (stamina_rule2)

[03:45] Substitution (Team_002): Miles Bane OUT → CJ Barrett IN (stamina_rule2)

[03:45] Substitution (Team_002): Jordan Green OUT → Carmelo Lowry IN (stamina_rule2)

[03:45] Substitution (Team_002): Tyler Porzingis OUT → Lamelo O'Neal IN (stamina_rule2)

[03:31] Team_002 possession (Score: 47-32)
Carmelo Lowry drives to the basket... Carmelo Lowry commits a violation (traveling/carry)! TURNOVER! (dead ball)

[03:13] Team_001 possession (Score: 47-32)
Ja Dosunmu attempts a Midrange. BLOCKED BY CJ BARRETT! Rebound secured by Lamelo O'Neal.

[03:00] Team_002 possession (Score: 47-32)
Anfernee Sexton attempts a Layup. Contested by Larry Trent (4.0 feet, MAN). ANFERNEE SEXTON MAKES IT!
Score: 47-34

[02:46] Team_001 possession (Score: 47-34)
Franz Bryant attempts a 3Pt. Contested by CJ Barrett (3.9 feet, ZONE). Franz Bryant misses. Rebound secured by CJ Barrett.

[02:31] Team_002 possession (Score: 47-34)
CJ Barrett attempts a Midrange. Contested by Rudy George (5.0 feet, MAN). CJ BARRETT MAKES IT! Assist: Anfernee Sexton
Score: 47-36

[02:17] Team_001 possession (Score: 47-36)
Franz Bryant drives and kicks out. Franz Bryant attempts a Midrange. Contested by Carmelo Lowry (3.7 feet, MAN). Franz Bryant misses. Offensive rebound by Rudy George! Rudy George kicks it out.

[02:02] Team_001 possession (Score: 47-36)
Rudy George attempts a 3Pt. Contested by CJ Barrett (3.9 feet, MAN). Rudy George misses. Rebound secured by CJ Barrett.

[01:49] Team_002 possession (Score: 47-36)
Dirk Middleton attempts a 3Pt. Contested by Rudy George (5.1 feet, MAN). Dirk Middleton misses. Offensive rebound by Carmelo Lowry! Carmelo Lowry kicks it out.

[01:36] Team_002 possession (Score: 47-36)
Carmelo Lowry attempts a 3Pt. Contested by Ja Dosunmu (4.5 feet, ZONE). Carmelo Lowry misses. Rebound secured by Franz Bryant.

[01:24] Team_001 possession (Score: 47-36)
FOUL! Shooting foul on CJ Barrett. Ja Dosunmu to the line for 2 free throws. [BONUS: 6 team fouls] (CJ Barrett: 1 personal fouls)   FT 1/2: GOOD   FT 2/2: GOOD Ja Dosunmu makes 2/2 from the line.
Score: 49-36

[01:10] Team_002 possession (Score: 49-36)
CJ Barrett attempts a 3Pt. Contested by Rudy George (5.2 feet, MAN). CJ Barrett misses. Rebound secured by Rudy George.

[00:56] Team_001 possession (Score: 49-36)
Larry Trent drives to the basket... Larry Trent throws a bad pass! Stolen by Anfernee Sexton! TURNOVER! (live ball)

[00:44] Team_002 possession (Score: 49-36)
Dirk Middleton attempts a 3Pt. Contested by Ja Dosunmu (4.6 feet, ZONE). DIRK MIDDLETON MAKES IT! Assist: Carmelo Lowry
Score: 49-39

[00:29] Team_001 possession (Score: 49-39)
Larry Trent attempts a 3Pt. Wide open! Anfernee Sexton is 6.4 feet away. [MAN] LARRY TRENT MAKES IT! Assist: Franz Bryant
Score: 52-39

[00:16] Team_002 possession (Score: 52-39)
Anfernee Sexton loses the ball! Stripped by Larry Trent! TURNOVER! (live ball)

[00:07] Team_001 possession (Score: 52-39)
Kristaps Ming drives, Carmelo Lowry stays with him. Kristaps Ming attempts a Layup. Contested by Carmelo Lowry (4.1 feet, ZONE). Kristaps Ming misses. Rebound secured by CJ Barrett.

================================================================================
                              2ND QUARTER COMPLETE                              
================================================================================

2ND QUARTER SCORE: Team_001 23, Team_002 17

BOX SCORE:
================================================================================

Team_001
--------------------------------------------------------------------------------
Player                MIN  PTS  REB  AST  TO      FG   FG%      3P   3P%
--------------------------------------------------------------------------------
Cole Ball              14    6    4    1   0   2/3    66.7     0/0   0.0
Dirk Young              9    5    0    2   0   2/3    66.7     0/0   0.0
Dejounte McCollum      16    3    2    0   0   1/1   100.0     0/0   0.0
Larry Trent            12    3    0    0   0   1/1   100.0     0/0   0.0
Klay Harden             9    2    0    1   0   1/5    20.0     0/0   0.0
Miles Griffin           9    2    4    2   0   1/2    50.0     0/0   0.0
Ja Dosunmu             15    2    0    0   0   0/1     0.0     0/0   0.0
Franz Bryant            6    0    1    1   0   0/1     0.0     0/0   0.0
Rudy George            15    0    2    0   0   0/1     0.0     0/0   0.0
Kristaps Ming          15    0    0    0   0   0/1     0.0     0/0   0.0

TEAM: FG: 8/19 (42.1%), 3PT: 3/9 (33.3%), REB: 13 (2 off, 11 def), AST: 7, TO: 3
TEAM FOULS: 0


Team_002
--------------------------------------------------------------------------------
Player                MIN  PTS  REB  AST  TO      FG   FG%      3P   3P%
--------------------------------------------------------------------------------
Tyler Porzingis         9    6    4    0   0   3/3   100.0     0/0   0.0
CJ Barrett             12    4    3    0   0   2/5    40.0     0/0   0.0
Dirk Middleton         13    3    0    0   0   1/4    25.0     0/0   0.0
Miles Bane             12    2    4    1   0   0/1     0.0     0/0   0.0
Anfernee Sexton        20    2    0    2   0   1/2    50.0     0/0   0.0
Carmelo Lowry           8    0    3    1   0   0/2     0.0     0/0   0.0
Jordan Green           10    0    0    0   0   0/1     0.0     0/0   0.0
Lamelo O'Neal          15    0    1    0   0   0/0     0.0     0/0   0.0

TEAM: FG: 7/18 (38.9%), 3PT: 2/7 (28.6%), REB: 15 (4 off, 11 def), AST: 4, TO: 2
TEAM FOULS: 6 [Team_001 in BONUS]

================================================================================

================================================================================
                       3RD QUARTER - Team_001 vs Team_002                       
================================================================================

[12:00] Team_001 possession (Score: 52-39)
Dejounte McCollum attempts a 3Pt. Contested by Carmelo Lowry (3.6 feet, MAN). Dejounte McCollum misses. Offensive rebound by Miles Griffin! Miles Griffin kicks it out.

[11:45] Team_001 possession (Score: 52-39)
Dejounte McCollum drives and kicks out. Dirk Young attempts a Midrange. Contested by CJ Barrett (3.8 feet, MAN). Dirk Young misses. Rebound secured by Carmelo Lowry.

[11:29] Team_002 possession (Score: 52-39)
CJ Barrett attempts a Midrange. Contested by Dirk Young (3.8 feet, MAN). CJ Barrett misses. Rebound secured by Dejounte McCollum.

[11:14] Team_001 possession (Score: 52-39)
Dirk Young attempts a 3Pt. Contested by CJ Barrett (3.8 feet, ZONE). DIRK YOUNG MAKES IT!
Score: 55-39

[11:04] Team_002 possession (Score: 55-39)
Miles Bane loses the ball! Stripped by Klay Harden! TURNOVER! (live ball)

[10:52] Team_001 possession (Score: 55-39)
Klay Harden makes the Dunk and draws the foul on Miles Bane! And-1! Klay Harden to the line for 1. [Team fouls: 1] (Miles Bane: 1 personal fouls)   FT 1/1: GOOD Klay Harden makes 1/1 from the line.
Score: 58-39

[10:40] Team_002 possession (Score: 58-39)
Jordan Green attempts a 3Pt. Contested by Cole Ball (2.8 feet, MAN). Jordan Green misses. Rebound secured by Miles Griffin.

[10:26] Team_001 possession (Score: 58-39)
Dirk Young attempts a 3Pt. Contested by CJ Barrett (3.8 feet, MAN). Dirk Young misses. Rebound secured by Carmelo Lowry.

[10:12] Team_002 possession (Score: 58-39)
FOUL! Shooting foul on Klay Harden. Miles Bane to the line for 2 free throws. [Team fouls: 2] (Klay Harden: 1 personal fouls)   FT 1/2: GOOD   FT 2/2: GOOD Miles Bane makes 2/2 from the line.
Score: 58-41

[09:55] Team_001 possession (Score: 58-41)
Cole Ball attempts a 3Pt. Contested by Jordan Green (3.8 feet, MAN). Cole Ball misses. Offensive rebound by Cole Ball! Cole Ball kicks it out.

[09:40] Team_001 possession (Score: 58-41)
FOUL! Holding foul on Jordan Green. [Team fouls: 3] No free throws, side out. (Jordan Green: 1 personal fouls)

[09:28] Team_002 possession (Score: 58-41)
CJ Barrett attempts a 3Pt. Contested by Klay Harden (3.3 feet, ZONE). CJ Barrett misses. Rebound secured by Dejounte McCollum.

[09:12] Team_001 possession (Score: 58-41)
Dirk Young drives to the basket... Dirk Young commits a violation (traveling/carry)! TURNOVER! (dead ball)

[09:02] Team_002 possession (Score: 58-41)
Carmelo Lowry attempts a Layup. Contested by Dejounte McCollum (3.8 feet, MAN). CARMELO LOWRY MAKES IT!
Score: 58-43

[08:51] Team_001 possession (Score: 58-43)
FOUL! Holding foul on Carmelo Lowry. [Team fouls: 4] No free throws, side out. (Carmelo Lowry: 1 personal fouls)

[08:38] Team_002 possession (Score: 58-43)
Tyler Porzingis drives, Miles Griffin stays with him. Tyler Porzingis attempts a Dunk. Contested by Miles Griffin (3.7 feet, MAN). TYLER PORZINGIS MAKES IT!
Score: 58-45

[08:24] Team_001 possession (Score: 58-45)
Dirk Young drives, picks up CJ Barrett. Help arrives from Miles Bane! Dirk Young attempts a Layup. Contested by Miles Bane (3.8 feet, MAN). Dirk Young misses. Rebound secured by Tyler Porzingis.

[08:11] Team_002 possession (Score: 58-45)
Jordan Green attempts a 3Pt. Contested by Cole Ball (2.8 feet, MAN). JORDAN GREEN MAKES IT! Assist: Carmelo Lowry
Score: 58-48

[07:57] Team_001 possession (Score: 58-48)
Miles Griffin drives and kicks out. Klay Harden attempts a Midrange. Contested by Miles Bane (4.5 feet, MAN). KLAY HARDEN MAKES IT!
Score: 60-48

[07:44] Team_002 possession (Score: 60-48)
FOUL! Holding foul on Dirk Young. [IN THE BONUS! 5 team fouls] CJ Barrett to the line for 2 free throws. (Dirk Young: 1 personal fouls)   FT 1/2: GOOD   FT 2/2: GOOD CJ Barrett makes 2/2 from the line.
Score: 60-50

[07:30] Team_001 possession (Score: 60-50)
Cole Ball drives and kicks out. Klay Harden attempts a 3Pt. Contested by Miles Bane (4.5 feet, MAN). Klay Harden misses. Rebound secured by Miles Bane.

[07:18] Team_002 possession (Score: 60-50)
Carmelo Lowry attempts a Midrange. Contested by Dejounte McCollum (3.8 feet, MAN). Carmelo Lowry misses. Rebound secured by Dejounte McCollum.

[07:05] Team_001 possession (Score: 60-50)
Dejounte McCollum attempts a 3Pt. Contested by Carmelo Lowry (3.6 feet, MAN). Dejounte McCollum misses. Offensive rebound by Miles Griffin! Miles Griffin kicks it out.

[06:54] Team_001 possession (Score: 60-50)
Dirk Young drives and kicks out. Dirk Young attempts a Midrange. Contested by CJ Barrett (3.8 feet, MAN). DIRK YOUNG MAKES IT! Assist: Klay Harden
Score: 62-50

[06:39] Team_002 possession (Score: 62-50)
FOUL! Reach-in foul on Miles Griffin during the drive. [IN THE BONUS! 6 team fouls] Tyler Porzingis to the line for 2 free throws. (Miles Griffin: 1 personal fouls)   FT 1/2: GOOD   FT 2/2: MISS Tyler Porzingis makes 1/2 from the line. Rebound secured by Dejounte McCollum.
Score: 62-51

[06:26] Team_001 possession (Score: 62-51)
Miles Griffin makes the Layup and draws the foul on Tyler Porzingis! And-1! Miles Griffin to the line for 1. [BONUS: 7 team fouls] (Tyler Porzingis: 1 personal fouls)   FT 1/1: GOOD Miles Griffin makes 1/1 from the line.
Score: 65-51

[06:14] Team_002 possession (Score: 65-51)
CJ Barrett drives to the basket... CJ Barrett loses the ball! Stripped by Dirk Young! TURNOVER! (live ball)

[06:00] Team_001 possession (Score: 65-51)
Cole Ball attempts a 3Pt. Contested by CJ Barrett (3.8 feet, ZONE). Cole Ball misses. Rebound secured by Tyler Porzingis.

[05:46] Team_002 possession (Score: 65-51)
Miles Bane drives and kicks out. CJ Barrett makes the Midrange and draws the foul on Dirk Young! And-1! CJ Barrett to the line for 1. [BONUS: 8 team fouls] (Dirk Young: 2 personal fouls)   FT 1/1: GOOD CJ Barrett makes 1/1 from the line.
Score: 65-54

[05:32] Team_001 possession (Score: 65-54)
Dejounte McCollum attempts a Midrange. Contested by Carmelo Lowry (3.6 feet, MAN). Dejounte McCollum misses. Offensive rebound by Miles Griffin! Miles Griffin kicks it out.

[05:15] Team_001 possession (Score: 65-54)
Dirk Young drives and kicks out. Dirk Young attempts a 3Pt. Contested by CJ Barrett (3.9 feet, ZONE). DIRK YOUNG MAKES IT! Assist: Miles Griffin
Score: 68-54

[05:03] Team_002 possession (Score: 68-54)
Carmelo Lowry attempts a 3Pt. Contested by Klay Harden (3.6 feet, ZONE). CARMELO LOWRY MAKES IT! Assist: CJ Barrett
Score: 68-57

[04:50] Team_001 possession (Score: 68-57)
Dejounte McCollum attempts a Midrange. Contested by Carmelo Lowry (3.7 feet, ZONE). Dejounte McCollum misses. Rebound secured by Miles Bane.

[04:35] Team_002 possession (Score: 68-57)
FOUL! Holding foul on Cole Ball. [IN THE BONUS! 9 team fouls] Jordan Green to the line for 2 free throws. (Cole Ball: 1 personal fouls)   FT 1/2: MISS   FT 2/2: MISS Jordan Green makes 0/2 from the line. Rebound secured by Dejounte McCollum.

[04:23] Team_001 possession (Score: 68-57)
FOUL! Holding foul on Miles Bane. [IN THE BONUS! 10 team fouls] Klay Harden to the line for 2 free throws. (Miles Bane: 2 personal fouls)   FT 1/2: GOOD   FT 2/2: GOOD Klay Harden makes 2/2 from the line.
Score: 70-57

[04:14] Team_002 possession (Score: 70-57)
Miles Bane drives, Klay Harden stays with him. Miles Bane attempts a Dunk. Contested by Klay Harden (3.7 feet, MAN). MILES BANE MAKES IT!
Score: 70-59

[03:58] Team_001 possession (Score: 70-59)
FOUL! Reach-in foul on Tyler Porzingis during the drive. [IN THE BONUS! 11 team fouls] Dirk Young to the line for 2 free throws. (Tyler Porzingis: 2 personal fouls)   FT 1/2: GOOD   FT 2/2: GOOD Dirk Young makes 2/2 from the line.
Score: 72-59

[03:42] Team_002 possession (Score: 72-59)
Miles Bane attempts a Midrange. Contested by Klay Harden (3.8 feet, MAN). MILES BANE MAKES IT!
Score: 72-61

[03:30] Team_001 possession (Score: 72-61)
Miles Griffin makes the Dunk and draws the foul on Tyler Porzingis! And-1! Miles Griffin to the line for 1. [BONUS: 12 team fouls] (Tyler Porzingis: 3 personal fouls)   FT 1/1: GOOD Miles Griffin makes 1/1 from the line.
Score: 75-61

[03:11] Team_002 possession (Score: 75-61)
Miles Bane attempts a Midrange. Contested by Klay Harden (3.9 feet, MAN). Miles Bane misses. Rebound secured by Miles Griffin.

[02:53] Team_001 possession (Score: 75-61)
Miles Griffin attempts a 3Pt. Contested by Tyler Porzingis (3.4 feet, MAN). Miles Griffin misses. Offensive rebound by Miles Griffin! Miles Griffin kicks it out.

[02:37] Team_001 possession (Score: 75-61)
FOUL! Holding foul on Jordan Green. [IN THE BONUS! 13 team fouls] Cole Ball to the line for 2 free throws. (Jordan Green: 2 personal fouls)   FT 1/2: GOOD   FT 2/2: GOOD Cole Ball makes 2/2 from the line.
Score: 77-61

[02:24] Team_002 possession (Score: 77-61)
Miles Bane attempts a Midrange. Contested by Klay Harden (4.0 feet, MAN). MILES BANE MAKES IT! Assist: Jordan Green
Score: 77-63

[02:09] Team_001 possession (Score: 77-63)
Dirk Young attempts a 3Pt. Contested by Miles Bane (4.9 feet, ZONE). DIRK YOUNG MAKES IT! Assist: Cole Ball
Score: 80-63

[01:56] Team_002 possession (Score: 80-63)
Carmelo Lowry attempts a 3Pt. Contested by Dejounte McCollum (4.1 feet, MAN). Carmelo Lowry misses. Offensive rebound by Carmelo Lowry! Carmelo Lowry kicks it out.

[01:43] Team_002 possession (Score: 80-63)
Carmelo Lowry drives to the basket... Carmelo Lowry commits an offensive foul! TURNOVER! (dead ball)

[01:29] Team_001 possession (Score: 80-63)
Dejounte McCollum drives, Tyler Porzingis stays with him. Dejounte McCollum attempts a Layup. Contested by Tyler Porzingis (3.6 feet, ZONE). DEJOUNTE MCCOLLUM MAKES IT! Assist: Klay Harden
Score: 82-63

[01:15] Team_002 possession (Score: 82-63)
Tyler Porzingis makes the 3Pt and draws the foul on Miles Griffin! And-1! Tyler Porzingis to the line for 1. [BONUS: 14 team fouls] (Miles Griffin: 2 personal fouls)   FT 1/1: GOOD Tyler Porzingis makes 1/1 from the line.
Score: 82-67

[01:05] Team_001 possession (Score: 82-67)
FOUL! Reach-in foul on Tyler Porzingis during the drive. [IN THE BONUS! 15 team fouls] Cole Ball to the line for 2 free throws. (Tyler Porzingis: 4 personal fouls)   FT 1/2: GOOD   FT 2/2: GOOD Cole Ball makes 2/2 from the line.
Score: 84-67

[00:52] Team_002 possession (Score: 84-67)
Carmelo Lowry makes the Dunk and draws the foul on Dejounte McCollum! And-1! Carmelo Lowry to the line for 1. [BONUS: 16 team fouls] (Dejounte McCollum: 1 personal fouls)   FT 1/1: GOOD Carmelo Lowry makes 1/1 from the line.
Score: 84-70

[00:39] Team_001 possession (Score: 84-70)
Dirk Young drives, picks up CJ Barrett. Help arrives from Miles Bane! Dirk Young attempts a Layup. Contested by Miles Bane (4.5 feet, MAN). DIRK YOUNG MAKES IT!
Score: 86-70

[00:22] Team_002 possession (Score: 86-70)
Jordan Green drives and kicks out. Miles Bane attempts a 3Pt. Contested by Klay Harden (4.4 feet, ZONE). Miles Bane misses. Rebound secured by Cole Ball.

[00:08] Team_001 possession (Score: 86-70)
Cole Ball drives to the basket... Cole Ball loses the ball! Stripped by Tyler Porzingis! TURNOVER! (live ball)

================================================================================
                              3RD QUARTER COMPLETE                              
================================================================================

3RD QUARTER SCORE: Team_001 34, Team_002 31

BOX SCORE:
================================================================================

Team_001
--------------------------------------------------------------------------------
Player                MIN  PTS  REB  AST  TO      FG   FG%      3P   3P%
--------------------------------------------------------------------------------
Dirk Young             22   15    0    0   0   5/7    71.4     0/0   0.0
Klay Harden            22    7    0    2   0   2/2   100.0     0/0   0.0
Miles Griffin          22    6    6    1   0   2/2   100.0     0/0   0.0
Cole Ball              26    4    2    1   0   0/2     0.0     0/0   0.0
Dejounte McCollum      28    2    5    0   0   1/3    33.3     0/0   0.0

TEAM: FG: 10/16 (62.5%), 3PT: 2/4 (50.0%), REB: 13 (5 off, 8 def), AST: 4, TO: 2
TEAM FOULS: 0


Team_002
--------------------------------------------------------------------------------
Player                MIN  PTS  REB  AST  TO      FG   FG%      3P   3P%
--------------------------------------------------------------------------------
Carmelo Lowry          20    8    3    1   0   3/4    75.0     0/0   0.0
Miles Bane             24    8    2    0   0   3/4    75.0     0/0   0.0
Tyler Porzingis        22    6    2    0   0   2/3    66.7     0/0   0.0
CJ Barrett             24    5    0    1   0   1/3    33.3     0/0   0.0
Jordan Green           22    3    0    1   0   1/3    33.3     0/0   0.0

TEAM: FG: 10/18 (55.6%), 3PT: 3/5 (60.0%), REB: 7 (1 off, 6 def), AST: 3, TO: 3
TEAM FOULS: 16 [Team_001 in BONUS]

================================================================================

================================================================================
                       4TH QUARTER - Team_001 vs Team_002                       
================================================================================

[12:00] Team_001 possession (Score: 86-70)
Klay Harden drives, picks up Tyler Porzingis. Help arrives from CJ Barrett! Klay Harden attempts a Dunk. Contested by CJ Barrett (3.5 feet, ZONE). KLAY HARDEN MAKES IT!
Score: 88-70

[11:48] Team_002 possession (Score: 88-70)
Jordan Green drives, Cole Ball stays with him. Jordan Green attempts a Dunk. Contested by Cole Ball (3.3 feet, MAN). JORDAN GREEN MAKES IT!
Score: 88-72

[11:30] Team_001 possession (Score: 88-72)
Dirk Young drives, picks up CJ Barrett. Help arrives from Miles Bane! Dirk Young attempts a Layup. Contested by Miles Bane (4.4 feet, MAN). Dirk Young misses. Rebound secured by Tyler Porzingis.

[11:18] Team_002 possession (Score: 88-72)
Carmelo Lowry attempts a Midrange. Contested by Dejounte McCollum (4.1 feet, MAN). Carmelo Lowry misses. Rebound secured by Cole Ball.

[11:03] Team_001 possession (Score: 88-72)
Dejounte McCollum drives to the basket... Dejounte McCollum commits an offensive foul! TURNOVER! (dead ball)

[10:48] Team_002 possession (Score: 88-72)
Tyler Porzingis attempts a Midrange. Contested by Cole Ball (3.4 feet, ZONE). Tyler Porzingis misses. Rebound secured by Miles Griffin.

[10:36] Team_001 possession (Score: 88-72)
Klay Harden attempts a 3Pt. Contested by Miles Bane (5.0 feet, MAN). KLAY HARDEN MAKES IT! Assist: Cole Ball
Score: 91-72

[10:19] Team_002 possession (Score: 91-72)
Miles Bane attempts a Midrange. Contested by Klay Harden (4.4 feet, MAN). MILES BANE MAKES IT! Assist: Jordan Green
Score: 91-74

[10:05] Team_001 possession (Score: 91-74)
Klay Harden drives and kicks out. Dirk Young attempts a Midrange. Contested by CJ Barrett (4.6 feet, MAN). DIRK YOUNG MAKES IT!
Score: 93-74

[09:52] Team_002 possession (Score: 93-74)
CJ Barrett drives, picks up Dirk Young. Help arrives from Cole Ball! CJ Barrett attempts a Dunk. Contested by Cole Ball (4.7 feet, MAN). CJ BARRETT MAKES IT! Assist: Tyler Porzingis
Score: 93-76

[09:38] Team_001 possession (Score: 93-76)
Dirk Young attempts a 3Pt. Contested by Miles Bane (5.2 feet, ZONE). DIRK YOUNG MAKES IT! Assist: Miles Griffin
Score: 96-76

[09:23] Team_002 possession (Score: 96-76)
FOUL! Reach-in foul on Dejounte McCollum during the drive. [Team fouls: 1] No free throws, side out. (Dejounte McCollum: 1 personal fouls)

[09:05] Team_001 possession (Score: 96-76)
Klay Harden drives to the basket... Klay Harden commits a violation (traveling/carry)! TURNOVER! (dead ball)

[09:05] Substitution (Team_001): Klay Harden OUT → Ja Dosunmu IN (stamina_rule2)

[09:05] Substitution (Team_001): Dirk Young OUT → Rudy George IN (stamina_rule2)

[09:05] Substitution (Team_001): Cole Ball OUT → Larry Trent IN (stamina_rule2)

[09:05] Substitution (Team_001): Dejounte McCollum OUT → Franz Bryant IN (stamina_rule2)

[09:05] Substitution (Team_001): Miles Griffin OUT → Kristaps Ming IN (stamina_rule2)

[09:05] Substitution (Team_002): Miles Bane OUT → John Duncan IN (stamina_rule2)

[09:05] Substitution (Team_002): CJ Barrett OUT → Dirk Middleton IN (stamina_rule2)

[09:05] Substitution (Team_002): Jordan Green OUT → Anfernee Sexton IN (stamina_rule2)

[09:05] Substitution (Team_002): Carmelo Lowry OUT → Julius Curry IN (stamina_rule2)

[09:05] Substitution (Team_002): Tyler Porzingis OUT → Lamelo O'Neal IN (stamina_rule2)

[08:49] Team_002 possession (Score: 96-76)
John Duncan drives and kicks out. Julius Curry attempts a Midrange. Contested by Franz Bryant (3.8 feet, MAN). Julius Curry misses. Offensive rebound by Anfernee Sexton! Anfernee Sexton kicks it out.

[08:39] Team_002 possession (Score: 96-76)
Julius Curry commits an offensive foul! Franz Bryant drew the charge! TURNOVER! (dead ball)

[08:25] Team_001 possession (Score: 96-76)
Franz Bryant attempts a Layup. BLOCKED BY JOHN DUNCAN! Rebound secured by Anfernee Sexton.

[08:10] Team_002 possession (Score: 96-76)
Dirk Middleton attempts a Layup. BLOCKED BY RUDY GEORGE! Ball goes out of bounds. Turnover!

[07:56] Team_001 possession (Score: 96-76)
Franz Bryant drives to the basket... Franz Bryant commits an offensive foul! TURNOVER! (dead ball)

[07:41] Team_002 possession (Score: 96-76)
Anfernee Sexton drives and kicks out. Lamelo O'Neal attempts a 3Pt. Contested by Kristaps Ming (5.6 feet, MAN). Lamelo O'Neal misses. Rebound secured by Kristaps Ming.

[07:29] Team_001 possession (Score: 96-76)
Larry Trent attempts a 3Pt. Contested by Anfernee Sexton (4.4 feet, MAN). Larry Trent misses. Rebound secured by Anfernee Sexton.

[07:11] Team_002 possession (Score: 96-76)
Dirk Middleton attempts a 3Pt. Contested by Rudy George (4.7 feet, MAN). Dirk Middleton misses. Offensive rebound by Anfernee Sexton! Anfernee Sexton kicks it out.

[06:54] Team_002 possession (Score: 96-76)
Lamelo O'Neal commits a violation (traveling/carry)! TURNOVER! (dead ball)

[06:40] Team_001 possession (Score: 96-76)
Kristaps Ming drives, picks up Lamelo O'Neal. Help arrives from John Duncan! Kristaps Ming attempts a Dunk. Contested by John Duncan (3.0 feet, MAN). Kristaps Ming misses. Rebound secured by Anfernee Sexton.

[06:27] Team_002 possession (Score: 96-76)
Dirk Middleton attempts a Layup. Contested by Rudy George (4.7 feet, MAN). DIRK MIDDLETON MAKES IT!
Score: 96-78

[06:10] Team_001 possession (Score: 96-78)
Ja Dosunmu attempts a Layup. Contested by John Duncan (5.5 feet, MAN). JA DOSUNMU MAKES IT! Assist: Kristaps Ming
Score: 98-78

[05:59] Team_002 possession (Score: 98-78)
FOUL! Holding foul on Ja Dosunmu. [Team fouls: 2] No free throws, side out. (Ja Dosunmu: 1 personal fouls)

[05:41] Team_001 possession (Score: 98-78)
Franz Bryant attempts a Midrange. Contested by Lamelo O'Neal (3.0 feet, MAN). Franz Bryant misses. Offensive rebound by Rudy George! Rudy George kicks it out.

[05:30] Team_001 possession (Score: 98-78)
Ja Dosunmu attempts a Midrange. Contested by John Duncan (5.5 feet, MAN). JA DOSUNMU MAKES IT! Assist: Larry Trent
Score: 100-78

[05:12] Team_002 possession (Score: 100-78)
Julius Curry attempts a 3Pt. Contested by Franz Bryant (3.8 feet, MAN). Julius Curry misses. Rebound secured by Rudy George.

[05:02] Team_001 possession (Score: 100-78)
Franz Bryant attempts a Midrange. Contested by Lamelo O'Neal (3.0 feet, MAN). FRANZ BRYANT MAKES IT! Assist: Larry Trent
Score: 102-78

[04:48] Team_002 possession (Score: 102-78)
John Duncan drives and kicks out. Anfernee Sexton attempts a 3Pt. Contested by Ja Dosunmu (3.5 feet, ZONE). Anfernee Sexton misses. Rebound secured by Rudy George.

[04:34] Team_001 possession (Score: 102-78)
Franz Bryant drives to the basket... Franz Bryant loses the ball! Stripped by Lamelo O'Neal! TURNOVER! (live ball)

[04:18] Team_002 possession (Score: 102-78)
Julius Curry attempts a Midrange. Contested by Franz Bryant (3.8 feet, MAN). Julius Curry misses. Offensive rebound by Lamelo O'Neal! Lamelo O'Neal puts it back in!
Score: 102-80

[04:06] Team_001 possession (Score: 102-80)
Larry Trent attempts a 3Pt. Contested by Anfernee Sexton (4.4 feet, MAN). Larry Trent misses. Rebound secured by Anfernee Sexton.

[03:52] Team_002 possession (Score: 102-80)
Anfernee Sexton attempts a Midrange. Contested by Larry Trent (3.9 feet, MAN). Anfernee Sexton misses. FOUL! Loose ball foul on Kristaps Ming during the rebound battle. [Team fouls: 3] No free throws, side out. (Kristaps Ming: 1 personal fouls)

[03:39] Team_002 possession (Score: 102-80)
Anfernee Sexton attempts a 3Pt. Contested by Ja Dosunmu (3.5 feet, ZONE). Anfernee Sexton misses. Rebound secured by Rudy George.

[03:28] Team_001 possession (Score: 102-80)
Rudy George drives and kicks out. Kristaps Ming attempts a Midrange. Contested by Lamelo O'Neal (3.0 feet, MAN). KRISTAPS MING MAKES IT! Assist: Ja Dosunmu
Score: 104-80

[03:09] Team_002 possession (Score: 104-80)
John Duncan commits a violation (traveling/carry)! TURNOVER! (dead ball)

[02:57] Team_001 possession (Score: 104-80)
Kristaps Ming attempts a Midrange. Contested by Lamelo O'Neal (3.1 feet, MAN). Kristaps Ming misses. Rebound secured by Julius Curry.

[02:39] Team_002 possession (Score: 104-80)
FOUL! Reach-in foul on Rudy George during the drive. [Team fouls: 4] No free throws, side out. (Rudy George: 1 personal fouls)

[02:24] Team_001 possession (Score: 104-80)
Larry Trent attempts a Midrange. Contested by Anfernee Sexton (4.4 feet, MAN). Larry Trent misses. Rebound secured by Julius Curry.

[02:07] Team_002 possession (Score: 104-80)
Dirk Middleton attempts a Midrange. Contested by Rudy George (4.7 feet, MAN). Dirk Middleton misses. Rebound secured by Kristaps Ming.

[01:54] Team_001 possession (Score: 104-80)
Kristaps Ming drives to the basket... Kristaps Ming loses the ball! Stripped by Lamelo O'Neal! TURNOVER! (live ball)

[01:41] Team_002 possession (Score: 104-80)
Dirk Middleton attempts a 3Pt. Contested by Rudy George (4.7 feet, MAN). Dirk Middleton misses. Offensive rebound by Anfernee Sexton! Anfernee Sexton kicks it out.

[01:29] Team_002 possession (Score: 104-80)
Julius Curry attempts a 3Pt. Contested by Franz Bryant (4.0 feet, MAN). JULIUS CURRY MAKES IT! Assist: John Duncan
Score: 104-83

[01:18] Team_001 possession (Score: 104-83)
Franz Bryant attempts a Midrange. Contested by Julius Curry (5.4 feet, MAN). Franz Bryant misses. Rebound secured by Anfernee Sexton.

[01:06] Team_002 possession (Score: 104-83)
Dirk Middleton loses the ball! Stripped by Rudy George! TURNOVER! (live ball)

[00:52] Team_001 possession (Score: 104-83)
Larry Trent attempts a Layup. Contested by Anfernee Sexton (4.5 feet, MAN). LARRY TRENT MAKES IT! Assist: Franz Bryant
Score: 106-83

[00:33] Team_002 possession (Score: 106-83)
Anfernee Sexton makes the Layup and draws the foul on Franz Bryant! And-1! Anfernee Sexton to the line for 1. [BONUS: 5 team fouls] (Franz Bryant: 1 personal fouls)   FT 1/1: MISS Anfernee Sexton makes 0/1 from the line. Offensive rebound by Lamelo O'Neal! Lamelo O'Neal kicks it out.
Score: 106-85

[00:24] Team_002 possession (Score: 106-85)
Dirk Middleton attempts a 3Pt. Contested by Rudy George (4.9 feet, MAN). Dirk Middleton misses. Rebound secured by Kristaps Ming.

[00:07] Team_001 possession (Score: 106-85)
Franz Bryant commits an offensive foul! Julius Curry drew the charge! TURNOVER! (dead ball)

================================================================================
                              4TH QUARTER COMPLETE                              
================================================================================

4TH QUARTER SCORE: Team_001 20, Team_002 15

BOX SCORE:
================================================================================

Team_001
--------------------------------------------------------------------------------
Player                MIN  PTS  REB  AST  TO      FG   FG%      3P   3P%
--------------------------------------------------------------------------------
Klay Harden            25    5    0    0   0   2/2   100.0     0/0   0.0
Dirk Young             25    5    0    0   0   2/3    66.7     0/0   0.0
Ja Dosunmu             24    4    0    1   0   2/2   100.0     0/0   0.0
Franz Bryant           15    2    0    1   0   1/3    33.3     0/0   0.0
Kristaps Ming          24    2    3    1   0   1/3    33.3     0/0   0.0
Larry Trent            21    2    0    2   0   1/4    25.0     0/0   0.0
Cole Ball              30    0    1    1   0   0/0     0.0     0/0   0.0
Miles Griffin          25    0    1    1   0   0/0     0.0     0/0   0.0
Rudy George            24    0    4    0   0   0/0     0.0     0/0   0.0

TEAM: FG: 9/17 (52.9%), 3PT: 2/4 (50.0%), REB: 9 (1 off, 8 def), AST: 7, TO: 6
TEAM FOULS: 0


Team_002
--------------------------------------------------------------------------------
Player                MIN  PTS  REB  AST  TO      FG   FG%      3P   3P%
--------------------------------------------------------------------------------
Julius Curry           20    3    2    0   0   1/2    50.0     0/0   0.0
Jordan Green           25    2    0    1   0   1/1   100.0     0/0   0.0
Miles Bane             27    2    0    0   0   1/1   100.0     0/0   0.0
CJ Barrett             28    2    0    0   0   1/1   100.0     0/0   0.0
Dirk Middleton         22    2    0    0   0   1/3    33.3     0/0   0.0
Lamelo O'Neal          24    2    2    0   0   1/1   100.0     0/0   0.0
Tyler Porzingis        25    0    1    1   0   0/1     0.0     0/0   0.0
Carmelo Lowry          23    0    0    0   0   0/1     0.0     0/0   0.0
Anfernee Sexton        29    0    9    0   0   0/2     0.0     0/0   0.0
John Duncan            20    0    0    1   0   0/1     0.0     0/0   0.0

TEAM: FG: 6/14 (42.9%), 3PT: 1/4 (25.0%), REB: 14 (6 off, 8 def), AST: 3, TO: 5
TEAM FOULS: 6 [Team_001 in BONUS]

================================================================================

================================================================================
                               FULL GAME COMPLETE                               
================================================================================

FINAL SCORE: Team_001 106, Team_002 85

SCORING BY QUARTER:
--------------------------------------------------------------------------------
Team                     Q1     Q2     Q3     Q4    FINAL
--------------------------------------------------------------------------------
Team_001                 29     23     34     20      106
Team_002                 22     17     31     15       85
--------------------------------------------------------------------------------

FULL GAME BOX SCORE:
================================================================================

Team_001
--------------------------------------------------------------------------------
Player                MIN  PTS  REB  AST  TO      FG   FG%      3P   3P%      FT STL BLK
--------------------------------------------------------------------------------
Dejounte McCollum      31   13    9    1   1   5/7    71.4   2/2   100.0   1/1     0   0
Cole Ball              30   18    9    3   1   4/7    57.1   3/4    75.0   4/4     0   0
Klay Harden            25   14    0    3   2   6/10   60.0   1/4    25.0   3/3     1   0
Dirk Young             25   25    0    2   3   9/13   69.2   4/5    80.0   2/2     1   0
Miles Griffin          25    8   11    4   0   3/4    75.0   0/1     0.0   2/2     0   0
Ja Dosunmu             24    6    0    3   2   2/5    40.0   0/0     0.0   2/2     0   1
Rudy George            24    5    9    3   2   3/6    50.0   1/3    33.3   0/0     1   1
Kristaps Ming          24    6    3    3   1   2/6    33.3   0/1     0.0   0/0     0   0
Larry Trent            21    9    2    2   2   4/7    57.1   1/3    33.3   0/0     1   0
Franz Bryant           15    2    3    2   3   1/5    20.0   0/1     0.0   0/0     1   0

TEAM: FG: 39/70 (55.7%), 3PT: 12/24 (50.0%), REB: 46 (9 off, 37 def), AST: 26, TO: 17


Team_002
--------------------------------------------------------------------------------
Player                MIN  PTS  REB  AST  TO      FG   FG%      3P   3P%      FT STL BLK
--------------------------------------------------------------------------------
Anfernee Sexton        29    6   13    2   3   3/8    37.5   0/2     0.0   0/0     2   0
CJ Barrett             28   11    3    2   1   3/8    37.5   0/2     0.0   3/3     1   1
Miles Bane             27   16    7    1   2   6/8    75.0   1/1   100.0   3/5     0   0
Jordan Green           25    5    0    2   1   3/6    50.0   2/3    66.7   0/0     0   0
Tyler Porzingis        25   12    7    1   0   4/7    57.1   1/1   100.0   1/1     1   0
Lamelo O'Neal          24    2    3    3   3   0/3     0.0   0/0     0.0   0/0     2   0
Carmelo Lowry          23    8    6    2   1   3/7    42.9   1/2    50.0   1/1     0   0
Dirk Middleton         22    5    0    1   1   2/8    25.0   1/6    16.7   0/0     0   0
John Duncan            20   10    0    1   1   4/6    66.7   1/2    50.0   1/1     0   1
Julius Curry           20    7    4    0   1   3/6    50.0   1/2    50.0   2/2     0   0

TEAM: FG: 31/68 (45.6%), 3PT: 8/21 (38.1%), REB: 43 (12 off, 31 def), AST: 15, TO: 14

================================================================================
