================================================================================
                        FULL GAME - Team_001 vs Team_002                        
================================================================================

================================================================================
                       1ST QUARTER - Team_001 vs Team_002                       
================================================================================

[12:00] Team_001 possession (Score: 0-0)
Dirk Young drives and kicks out. Dejounte McCollum attempts a 3Pt. Contested by Carmelo Lowry (5.5 feet, MAN). Dejounte McCollum misses. Rebound secured by CJ Barrett.

[11:44] Team_002 possession (Score: 0-0)
CJ Barrett attempts a Midrange. Contested by Dirk Young (4.4 feet, ZONE). CJ BARRETT MAKES IT! Assist: Tyler Porzingis
Score: 0-2

[11:28] Team_001 possession (Score: 0-2)
Miles Griffin drives to the basket... Miles Griffin throws a bad pass! Stolen by Tyler Porzingis! TURNOVER! (live ball)

[11:15] Team_002 possession (Score: 0-2)
Tyler Porzingis makes the Dunk and draws the foul on Miles Griffin! And-1! Tyler Porzingis to the line for 1. [Team fouls: 1] (Miles Griffin: 1 personal fouls)   FT 1/1: MISS Tyler Porzingis makes 0/1 from the line. Rebound secured by Cole Ball.
Score: 0-4

[10:57] Team_001 possession (Score: 0-4)
Klay Harden attempts a Midrange. Contested by Miles Bane (4.8 feet, MAN). Klay Harden misses. Rebound secured by Tyler Porzingis.

[10:46] Team_002 possession (Score: 0-4)
Jordan Green attempts a Midrange. Contested by Cole Ball (3.0 feet, MAN). Jordan Green misses. Rebound secured by Miles Griffin.

[10:33] Team_001 possession (Score: 0-4)
Dirk Young attempts a 3Pt. Contested by Miles Bane (4.9 feet, ZONE). DIRK YOUNG MAKES IT! Assist: Klay Harden
Score: 3-4

[10:16] Team_002 possession (Score: 3-4)
FOUL! Shooting foul on Dirk Young. CJ Barrett to the line for 3 free throws. [Team fouls: 2] (Dirk Young: 1 personal fouls)   FT 1/3: GOOD   FT 2/3: GOOD   FT 3/3: GOOD CJ Barrett makes 3/3 from the line.
Score: 3-7

[10:00] Team_001 possession (Score: 3-7)
Klay Harden attempts a 3Pt. Contested by Miles Bane (4.9 feet, MAN). KLAY HARDEN MAKES IT! Assist: Dirk Young
Score: 6-7

[09:46] Team_002 possession (Score: 6-7)
Tyler Porzingis attempts a Midrange. Contested by Miles Griffin (5.3 feet, MAN). TYLER PORZINGIS MAKES IT!
Score: 6-9

[09:29] Team_001 possession (Score: 6-9)
Cole Ball attempts a Layup. Contested by Jordan Green (4.3 feet, MAN). Cole Ball misses. Rebound secured by CJ Barrett.

[09:12] Team_002 possession (Score: 6-9)
Jordan Green attempts a 3Pt. Contested by Cole Ball (3.2 feet, MAN). Jordan Green misses. Rebound secured by Dejounte McCollum.

[09:00] Team_001 possession (Score: 6-9)
Klay Harden attempts a 3Pt. Contested by Miles Bane (5.1 feet, ZONE). Klay Harden misses. Rebound secured by Miles Bane.

[08:47] Team_002 possession (Score: 6-9)
FOUL! Shooting foul on Dejounte McCollum. Tyler Porzingis to the line for 2 free throws. [Team fouls: 3] (Dejounte McCollum: 1 personal fouls)   FT 1/2: GOOD   FT 2/2: GOOD Tyler Porzingis makes 2/2 from the line.
Score: 6-11

[08:28] Team_001 possession (Score: 6-11)
FOUL! Shooting foul on CJ Barrett. Klay Harden to the line for 2 free throws. [Team fouls: 4] (CJ Barrett: 1 personal fouls)   FT 1/2: GOOD   FT 2/2: GOOD Klay Harden makes 2/2 from the line.
Score: 8-11

[08:18] Team_002 possession (Score: 8-11)
Carmelo Lowry attempts a Layup. Contested by Dejounte McCollum (4.1 feet, MAN). Carmelo Lowry misses. Rebound secured by Cole Ball.

[08:04] Team_001 possession (Score: 8-11)
FOUL! Reach-in foul on CJ Barrett during the drive. [IN THE BONUS! 5 team fouls] Dirk Young to the line for 2 free throws. (CJ Barrett: 2 personal fouls)   FT 1/2: GOOD   FT 2/2: GOOD Dirk Young makes 2/2 from the line.
Score: 10-11

[07:49] Team_002 possession (Score: 10-11)
Miles Bane attempts a Midrange. Contested by Dejounte McCollum (4.2 feet, ZONE). Miles Bane misses. Rebound secured by Dejounte McCollum.

[07:34] Team_001 possession (Score: 10-11)
Klay Harden makes the Dunk and draws the foul on CJ Barrett! And-1! Klay Harden to the line for 1. [BONUS: 6 team fouls] (CJ Barrett: 3 personal fouls)   FT 1/1: GOOD Klay Harden makes 1/1 from the line.
Score: 13-11

[07:19] Team_002 possession (Score: 13-11)
FOUL! Shooting foul on Dejounte McCollum. Miles Bane to the line for 2 free throws. [BONUS: 7 team fouls] (Dejounte McCollum: 2 personal fouls)   FT 1/2: GOOD   FT 2/2: GOOD Miles Bane makes 2/2 from the line.
Score: 13-13

[07:02] Team_001 possession (Score: 13-13)
Klay Harden drives and kicks out. Miles Griffin attempts a 3Pt. Contested by Miles Bane (5.3 feet, ZONE). Miles Griffin misses. Rebound secured by Tyler Porzingis.

[06:49] Team_002 possession (Score: 13-13)
Carmelo Lowry attempts a 3Pt. Contested by Cole Ball (3.6 feet, ZONE). CARMELO LOWRY MAKES IT! Assist: Miles Bane
Score: 13-16

[06:32] Team_001 possession (Score: 13-16)
Miles Griffin attempts a Midrange. Contested by Tyler Porzingis (5.2 feet, MAN). MILES GRIFFIN MAKES IT!
Score: 15-16

[06:18] Team_002 possession (Score: 15-16)
Jordan Green throws a bad pass out of bounds! TURNOVER! (dead ball)

[06:18] Substitution (Team_001): Klay Harden OUT → Rudy George IN (stamina_rule2)

[06:18] Substitution (Team_001): Dirk Young OUT → Ja Dosunmu IN (stamina_rule2)

[06:18] Substitution (Team_001): Cole Ball OUT → Larry Trent IN (stamina_rule2)

[06:18] Substitution (Team_001): Dejounte McCollum OUT → Franz Bryant IN (stamina_rule2)

[06:18] Substitution (Team_001): Miles Griffin OUT → Kristaps Ming IN (stamina_rule2)

[06:18] Substitution (Team_002): Miles Bane OUT → John Duncan IN (stamina_rule2)

[06:18] Substitution (Team_002): CJ Barrett OUT → Dirk Middleton IN (stamina_rule2)

[06:18] Substitution (Team_002): Jordan Green OUT → Anfernee Sexton IN (stamina_rule2)

[06:18] Substitution (Team_002): Carmelo Lowry OUT → Julius Curry IN (stamina_rule2)

[06:18] Substitution (Team_002): Tyler Porzingis OUT → Lamelo O'Neal IN (stamina_rule2)

[06:07] Team_001 possession (Score: 15-16)
FOUL! Shooting foul on Lamelo O'Neal. Larry Trent to the line for 2 free throws. [BONUS: 8 team fouls] (Lamelo O'Neal: 1 personal fouls)   FT 1/2: GOOD   FT 2/2: GOOD Larry Trent makes 2/2 from the line.
Score: 17-16

[05:51] Team_002 possession (Score: 17-16)
FOUL! Holding foul on Ja Dosunmu. [IN THE BONUS! 9 team fouls] John Duncan to the line for 2 free throws. (Ja Dosunmu: 1 personal fouls)   FT 1/2: GOOD   FT 2/2: MISS John Duncan makes 1/2 from the line. Rebound secured by Kristaps Ming.
Score: 17-17

[05:33] Team_001 possession (Score: 17-17)
Ja Dosunmu drives to the basket... Ja Dosunmu loses the ball! Stripped by John Duncan! TURNOVER! (live ball)

[05:22] Team_002 possession (Score: 17-17)
Julius Curry attempts a Layup. Contested by Franz Bryant (4.4 feet, MAN). Julius Curry misses. Offensive rebound by Lamelo O'Neal! Lamelo O'Neal kicks it out.

[05:08] Team_002 possession (Score: 17-17)
Lamelo O'Neal attempts a Midrange. Wide open! Kristaps Ming is 6.0 feet away. [MAN] LAMELO O'NEAL MAKES IT! Assist: Julius Curry
Score: 17-19

[04:57] Team_001 possession (Score: 17-19)
Kristaps Ming drives, picks up Lamelo O'Neal. Help arrives from John Duncan! Kristaps Ming attempts a Layup. Contested by John Duncan (4.5 feet, MAN). KRISTAPS MING MAKES IT!
Score: 19-19

[04:42] Team_002 possession (Score: 19-19)
Julius Curry attempts a 3Pt. Contested by Franz Bryant (4.5 feet, MAN). Julius Curry misses. Rebound secured by Larry Trent.

[04:28] Team_001 possession (Score: 19-19)
FOUL! Reach-in foul on John Duncan during the drive. [IN THE BONUS! 10 team fouls] Ja Dosunmu to the line for 2 free throws. (John Duncan: 1 personal fouls)   FT 1/2: MISS   FT 2/2: GOOD Ja Dosunmu makes 1/2 from the line.
Score: 20-19

[04:15] Team_002 possession (Score: 20-19)
Julius Curry attempts a Midrange. Wide open! Kristaps Ming is 6.1 feet away. [ZONE] Julius Curry misses. Rebound secured by Kristaps Ming.

[04:01] Team_001 possession (Score: 20-19)
Kristaps Ming attempts a Midrange. Contested by Lamelo O'Neal (4.8 feet, MAN). KRISTAPS MING MAKES IT!
Score: 22-19

[03:46] Team_002 possession (Score: 22-19)
John Duncan attempts a 3Pt. Contested by Ja Dosunmu (4.4 feet, ZONE). JOHN DUNCAN MAKES IT! Assist: Dirk Middleton
Score: 22-22

[03:32] Team_001 possession (Score: 22-22)
Larry Trent drives to the basket... Larry Trent commits a violation (traveling/carry)! TURNOVER! (dead ball)

[03:18] Team_002 possession (Score: 22-22)
Dirk Middleton attempts a Midrange. Contested by Rudy George (5.1 feet, MAN). Dirk Middleton misses. Offensive rebound by Anfernee Sexton! Anfernee Sexton kicks it out.

[03:02] Team_002 possession (Score: 22-22)
Dirk Middleton drives and kicks out. Julius Curry attempts a Midrange. Contested by Franz Bryant (4.8 feet, MAN). Julius Curry misses. Rebound secured by Rudy George.

[02:50] Team_001 possession (Score: 22-22)
Franz Bryant attempts a 3Pt. Contested by Julius Curry (5.8 feet, MAN). Franz Bryant misses. Rebound secured by Anfernee Sexton.

[02:40] Team_002 possession (Score: 22-22)
John Duncan attempts a 3Pt. Contested by Ja Dosunmu (4.7 feet, MAN). JOHN DUNCAN MAKES IT! Assist: Lamelo O'Neal
Score: 22-25

[02:22] Team_001 possession (Score: 22-25)
Franz Bryant attempts a Midrange. Contested by Julius Curry (5.8 feet, MAN). Franz Bryant misses. Offensive rebound by Rudy George! Rudy George kicks it out.

[02:09] Team_001 possession (Score: 22-25)
Ja Dosunmu drives to the basket... Ja Dosunmu throws a bad pass out of bounds! TURNOVER! (dead ball)

[01:54] Team_002 possession (Score: 22-25)
Lamelo O'Neal attempts a Midrange. Wide open! Kristaps Ming is 6.4 feet away. [MAN] Lamelo O'Neal misses. Rebound secured by Rudy George.

[01:39] Team_001 possession (Score: 22-25)
Kristaps Ming drives and kicks out. Rudy George attempts a 3Pt. Contested by Julius Curry (5.9 feet, ZONE). RUDY GEORGE MAKES IT! Assist: Kristaps Ming
Score: 25-25

[01:25] Team_002 possession (Score: 25-25)
Dirk Middleton makes the Layup and draws the foul on Rudy George! And-1! Dirk Middleton to the line for 1. [BONUS: 11 team fouls] (Rudy George: 1 personal fouls)   FT 1/1: MISS Dirk Middleton makes 0/1 from the line. Offensive rebound by Julius Curry! Julius Curry kicks it out.
Score: 25-27

[01:12] Team_002 possession (Score: 25-27)
Anfernee Sexton attempts a Midrange. Contested by Larry Trent (4.7 feet, MAN). Anfernee Sexton misses. Rebound secured by Rudy George.

[00:58] Team_001 possession (Score: 25-27)
FOUL! Shooting foul on Julius Curry. Franz Bryant to the line for 3 free throws. [BONUS: 13 team fouls] (Julius Curry: 1 personal fouls)   FT 1/3: GOOD   FT 2/3: GOOD   FT 3/3: MISS Franz Bryant makes 2/3 from the line. Offensive rebound by Larry Trent! Larry Trent kicks it out.
Score: 27-27

[00:44] Team_001 possession (Score: 27-27)
Ja Dosunmu attempts a Midrange. Wide open! John Duncan is 6.1 feet away. [MAN] JA DOSUNMU MAKES IT!
Score: 29-27

[00:28] Team_002 possession (Score: 29-27)
Julius Curry attempts a Midrange. Contested by Franz Bryant (5.2 feet, MAN). Julius Curry misses. Rebound secured by Kristaps Ming.

[00:11] Team_001 possession (Score: 29-27)
Franz Bryant makes the Layup and draws the foul on Julius Curry! And-1! Franz Bryant to the line for 1. [BONUS: 14 team fouls] (Julius Curry: 2 personal fouls)   FT 1/1: GOOD Franz Bryant makes 1/1 from the line.
Score: 32-27

================================================================================
                              1ST QUARTER COMPLETE                              
================================================================================

1ST QUARTER SCORE: Team_001 32, Team_002 27

BOX SCORE:
================================================================================

Team_001
--------------------------------------------------------------------------------
Player                MIN  PTS  REB  AST  TO      FG   FG%      3P   3P%
--------------------------------------------------------------------------------
Klay Harden             6    8    0    1   0   2/5    40.0     0/0   0.0
Dirk Young              6    5    0    1   0   1/2    50.0     0/0   0.0
Kristaps Ming           6    4    3    1   0   2/2   100.0     0/0   0.0
Ja Dosunmu              6    3    0    0   0   1/1   100.0     0/0   0.0
Rudy George             6    3    4    0   0   1/1   100.0     0/0   0.0
Franz Bryant            6    3    0    0   0   1/2    50.0     0/0   0.0
Miles Griffin           6    2    1    0   0   1/1   100.0     0/0   0.0
Larry Trent             6    2    2    0   0   0/0     0.0     0/0   0.0
Cole Ball               6    0    2    0   0   0/1     0.0     0/0   0.0
Dejounte McCollum       6    0    2    0   0   0/0     0.0     0/0   0.0

TEAM: FG: 9/15 (60.0%), 3PT: 2/4 (50.0%), REB: 14 (2 off, 12 def), AST: 3, TO: 4
TEAM FOULS: 0


Team_002
--------------------------------------------------------------------------------
Player                MIN  PTS  REB  AST  TO      FG   FG%      3P   3P%
--------------------------------------------------------------------------------
John Duncan             6    6    0    0   0   2/2   100.0     0/0   0.0
CJ Barrett              6    5    2    0   0   1/1   100.0     0/0   0.0
Tyler Porzingis         6    4    2    1   0   1/2    50.0     0/0   0.0
Carmelo Lowry           6    3    0    0   0   1/2    50.0     0/0   0.0
Miles Bane              6    2    1    1   0   0/1     0.0     0/0   0.0
Lamelo O'Neal           6    2    1    1   0   1/2    50.0     0/0   0.0
Jordan Green            6    0    0    0   0   0/2     0.0     0/0   0.0
Julius Curry            6    0    1    1   0   0/3     0.0     0/0   0.0
Dirk Middleton          6    0    0    1   0   0/1     0.0     0/0   0.0
Anfernee Sexton         6    0    2    0   0   0/1     0.0     0/0   0.0

TEAM: FG: 6/18 (33.3%), 3PT: 3/5 (60.0%), REB: 9 (3 off, 6 def), AST: 5, TO: 1
TEAM FOULS: 14 [Team_001 in BONUS]

================================================================================

================================================================================
                       2ND QUARTER - Team_001 vs Team_002                       
================================================================================

[12:00] Team_001 possession (Score: 32-27)
Miles Griffin throws a bad pass! Stolen by Tyler Porzingis! TURNOVER! (live ball)

[11:49] Team_002 possession (Score: 32-27)
Jordan Green drives, picks up Cole Ball. Help arrives from Klay Harden! Jordan Green attempts a Layup. Contested by Klay Harden (2.8 feet, MAN). Jordan Green misses. Rebound secured by Dejounte McCollum.

[11:37] Team_001 possession (Score: 32-27)
Dirk Young commits an offensive foul! CJ Barrett drew the charge! TURNOVER! (dead ball)

[11:23] Team_002 possession (Score: 32-27)
CJ Barrett attempts a 3Pt. Contested by Dirk Young (4.1 feet, MAN). CJ Barrett misses. Rebound secured by Miles Griffin.

[11:11] Team_001 possession (Score: 32-27)
Klay Harden attempts a 3Pt. Contested by Miles Bane (4.6 feet, MAN). Klay Harden misses. Rebound secured by Tyler Porzingis.

[10:58] Team_002 possession (Score: 32-27)
FOUL! Shooting foul on Dejounte McCollum. Jordan Green to the line for 2 free throws. [Team fouls: 1] (Dejounte McCollum: 1 personal fouls)   FT 1/2: GOOD   FT 2/2: MISS Jordan Green makes 1/2 from the line. Rebound secured by Cole Ball.
Score: 32-28

[10:44] Team_001 possession (Score: 32-28)
Cole Ball attempts a Midrange. Contested by CJ Barrett (4.0 feet, ZONE). COLE BALL MAKES IT!
Score: 34-28

[10:29] Team_002 possession (Score: 34-28)
Miles Bane throws a bad pass! Stolen by Klay Harden! TURNOVER! (live ball)

[10:13] Team_001 possession (Score: 34-28)
Klay Harden drives and kicks out. FOUL! Shooting foul on Carmelo Lowry. Dejounte McCollum to the line for 3 free throws. [Team fouls: 2] (Carmelo Lowry: 1 personal fouls)   FT 1/3: GOOD   FT 2/3: GOOD   FT 3/3: GOOD Dejounte McCollum makes 3/3 from the line.
Score: 37-28

[10:01] Team_002 possession (Score: 37-28)
Miles Bane drives to the basket... Miles Bane throws a bad pass out of bounds! TURNOVER! (dead ball)

[10:01] Substitution (Team_001): Klay Harden OUT → Rudy George IN (stamina_rule2)

[10:01] Substitution (Team_001): Dirk Young OUT → Ja Dosunmu IN (stamina_rule2)

[10:01] Substitution (Team_001): Miles Griffin OUT → Kristaps Ming IN (stamina_rule2)

[10:01] Substitution (Team_002): CJ Barrett OUT → John Duncan IN (stamina_rule2)

[10:01] Substitution (Team_002): Carmelo Lowry OUT → Anfernee Sexton IN (stamina_rule2)

[10:01] Substitution (Team_002): Tyler Porzingis OUT → Lamelo O'Neal IN (stamina_rule2)

[09:48] Team_001 possession (Score: 37-28)
Kristaps Ming drives to the basket... Kristaps Ming throws a bad pass out of bounds! TURNOVER! (dead ball)

[09:48] Substitution (Team_002): Miles Bane OUT → Dirk Middleton IN (stamina_rule2)

[09:48] Substitution (Team_002): Jordan Green OUT → Julius Curry IN (stamina_rule2)

[09:37] Team_002 possession (Score: 37-28)
Lamelo O'Neal attempts a Midrange. Wide open! Kristaps Ming is 6.1 feet away. [MAN] LAMELO O'NEAL MAKES IT!
Score: 37-30

[09:21] Team_001 possession (Score: 37-30)
Ja Dosunmu attempts a Midrange. Contested by Anfernee Sexton (4.6 feet, ZONE). JA DOSUNMU MAKES IT! Assist: Kristaps Ming
Score: 39-30

[09:10] Team_002 possession (Score: 39-30)
Julius Curry attempts a 3Pt. Contested by Ja Dosunmu (4.3 feet, ZONE). Julius Curry misses. FOUL! Loose ball foul on Dejounte McCollum during the rebound battle. [Team fouls: 3] No free throws, side out. (Dejounte McCollum: 2 personal fouls)

[08:53] Team_002 possession (Score: 39-30)
Julius Curry drives to the basket... Julius Curry throws a bad pass out of bounds! TURNOVER! (dead ball)

[08:43] Team_001 possession (Score: 39-30)
Dejounte McCollum drives to the basket... Dejounte McCollum commits a violation (traveling/carry)! TURNOVER! (dead ball)

[08:43] Substitution (Team_001): Cole Ball OUT → Larry Trent IN (stamina_rule2)

[08:30] Team_002 possession (Score: 39-30)
John Duncan drives and kicks out. Lamelo O'Neal attempts a Midrange. Wide open! Kristaps Ming is 6.2 feet away. [MAN] Lamelo O'Neal misses. Rebound secured by Larry Trent.

[08:13] Team_001 possession (Score: 39-30)
Ja Dosunmu attempts a 3Pt. Contested by John Duncan (5.9 feet, MAN). Ja Dosunmu misses. Rebound secured by Lamelo O'Neal.

[08:00] Team_002 possession (Score: 39-30)
John Duncan attempts a 3Pt. Contested by Ja Dosunmu (4.6 feet, MAN). John Duncan misses. Rebound secured by Rudy George.

[07:45] Team_001 possession (Score: 39-30)
Larry Trent attempts a Midrange. Contested by Anfernee Sexton (4.8 feet, MAN). Larry Trent misses. Rebound secured by Lamelo O'Neal.

[07:33] Team_002 possession (Score: 39-30)
Anfernee Sexton attempts a 3Pt. Contested by Larry Trent (4.2 feet, MAN). Anfernee Sexton misses. FOUL! Loose ball foul on Rudy George during the rebound battle. [Team fouls: 4] No free throws, side out. (Rudy George: 1 personal fouls)

[07:18] Team_002 possession (Score: 39-30)
Lamelo O'Neal drives to the basket... Lamelo O'Neal commits a violation (traveling/carry)! TURNOVER! (dead ball)

[07:18] Substitution (Team_001): Dejounte McCollum OUT → Cole Ball IN (stamina_rule2)

[07:01] Team_001 possession (Score: 39-30)
FOUL! Shooting foul on Anfernee Sexton. Larry Trent to the line for 3 free throws. [BONUS: 5 team fouls] (Anfernee Sexton: 1 personal fouls)   FT 1/3: GOOD   FT 2/3: GOOD   FT 3/3: GOOD Larry Trent makes 3/3 from the line.
Score: 42-30

[06:47] Team_002 possession (Score: 42-30)
FOUL! Holding foul on Cole Ball. [IN THE BONUS! 6 team fouls] Julius Curry to the line for 2 free throws. (Cole Ball: 1 personal fouls)   FT 1/2: GOOD   FT 2/2: MISS Julius Curry makes 1/2 from the line. Rebound secured by Rudy George.
Score: 42-31

[06:32] Team_001 possession (Score: 42-31)
Rudy George attempts a Midrange. Wide open! Dirk Middleton is 6.5 feet away. [MAN] RUDY GEORGE MAKES IT!
Score: 44-31

[06:18] Team_002 possession (Score: 44-31)
Dirk Middleton drives, Rudy George stays with him. Dirk Middleton attempts a Layup. Contested by Rudy George (5.4 feet, MAN). DIRK MIDDLETON MAKES IT! Assist: John Duncan
Score: 44-33

[06:04] Team_001 possession (Score: 44-33)
Rudy George attempts a Midrange. Wide open! Dirk Middleton is 6.5 feet away. [MAN] Rudy George misses. Rebound secured by Julius Curry.

[05:49] Team_002 possession (Score: 44-33)
Dirk Middleton attempts a 3Pt. Contested by Rudy George (5.5 feet, MAN). Dirk Middleton misses. Rebound secured by Rudy George.

[05:35] Team_001 possession (Score: 44-33)
Ja Dosunmu drives, picks up John Duncan. Help arrives from Julius Curry! Ja Dosunmu attempts a Dunk. Wide open! Julius Curry is 6.2 feet away. [MAN] JA DOSUNMU MAKES IT! Assist: Kristaps Ming
Score: 46-33

[05:21] Team_002 possession (Score: 46-33)
Dirk Middleton attempts a 3Pt. Contested by Rudy George (5.6 feet, MAN). DIRK MIDDLETON MAKES IT! Assist: Julius Curry
Score: 46-36

[05:06] Team_001 possession (Score: 46-36)
FOUL! Reach-in foul on John Duncan during the drive. [IN THE BONUS! 7 team fouls] Ja Dosunmu to the line for 2 free throws. (John Duncan: 1 personal fouls)   FT 1/2: GOOD   FT 2/2: GOOD Ja Dosunmu makes 2/2 from the line.
Score: 48-36

[04:51] Team_002 possession (Score: 48-36)
John Duncan attempts a 3Pt. Contested by Ja Dosunmu (5.1 feet, MAN). John Duncan misses. Rebound secured by Cole Ball.

[04:39] Team_001 possession (Score: 48-36)
Larry Trent loses the ball! Stripped by Anfernee Sexton! TURNOVER! (live ball)

[04:28] Team_002 possession (Score: 48-36)
FOUL! Reach-in foul on Kristaps Ming during the drive. [IN THE BONUS! 8 team fouls] Lamelo O'Neal to the line for 2 free throws. (Kristaps Ming: 1 personal fouls)   FT 1/2: GOOD   FT 2/2: GOOD Lamelo O'Neal makes 2/2 from the line.
Score: 48-38

[04:16] Team_001 possession (Score: 48-38)
Larry Trent attempts a Layup. Contested by Lamelo O'Neal (5.9 feet, ZONE). LARRY TRENT MAKES IT! Assist: Kristaps Ming
Score: 50-38

[04:00] Team_002 possession (Score: 50-38)
Julius Curry drives to the basket... Julius Curry loses the ball! Stripped by Cole Ball! TURNOVER! (live ball)

[03:46] Team_001 possession (Score: 50-38)
Cole Ball attempts a Layup. Contested by Anfernee Sexton (5.4 feet, MAN). COLE BALL MAKES IT! Assist: Rudy George
Score: 52-38

[03:33] Team_002 possession (Score: 52-38)
Dirk Middleton makes the Layup and draws the foul on Rudy George! And-1! Dirk Middleton to the line for 1. [BONUS: 9 team fouls] (Rudy George: 2 personal fouls)   FT 1/1: GOOD Dirk Middleton makes 1/1 from the line.
Score: 52-41

[03:16] Team_001 possession (Score: 52-41)
Larry Trent attempts a 3Pt. Contested by Anfernee Sexton (5.5 feet, MAN). LARRY TRENT MAKES IT! Assist: Ja Dosunmu
Score: 55-41

[03:03] Team_002 possession (Score: 55-41)
Anfernee Sexton attempts a 3Pt. Contested by Cole Ball (3.6 feet, MAN). Anfernee Sexton misses. Rebound secured by Larry Trent.

[02:49] Team_001 possession (Score: 55-41)
Larry Trent attempts a 3Pt. Contested by Anfernee Sexton (5.5 feet, MAN). Larry Trent misses. Rebound secured by Julius Curry.

[02:34] Team_002 possession (Score: 55-41)
Lamelo O'Neal drives, picks up Kristaps Ming. Help arrives from Rudy George! Lamelo O'Neal attempts a Layup. Wide open! Rudy George is 7.1 feet away. [ZONE] Lamelo O'Neal misses. Rebound secured by Larry Trent.

[02:17] Team_001 possession (Score: 55-41)
Ja Dosunmu attempts a Layup. Wide open! John Duncan is 6.6 feet away. [MAN] JA DOSUNMU MAKES IT! Assist: Cole Ball
Score: 57-41

[02:03] Team_002 possession (Score: 57-41)
Dirk Middleton attempts a 3Pt. Contested by Cole Ball (3.8 feet, ZONE). Dirk Middleton misses. Offensive rebound by Anfernee Sexton! Anfernee Sexton kicks it out.

[01:49] Team_002 possession (Score: 57-41)
John Duncan attempts a 3Pt. Contested by Ja Dosunmu (5.8 feet, MAN). JOHN DUNCAN MAKES IT! Assist: Dirk Middleton
Score: 57-44

[01:35] Team_001 possession (Score: 57-44)
Larry Trent attempts a 3Pt. Wide open! Julius Curry is 6.6 feet away. [ZONE] Larry Trent misses. Rebound secured by Anfernee Sexton.

[01:24] Team_002 possession (Score: 57-44)
Julius Curry attempts a Layup. BLOCKED BY COLE BALL! Ball goes out of bounds. Turnover!

[01:24] Substitution (Team_001): Cole Ball OUT → Dejounte McCollum IN (stamina_rule2)

[01:12] Team_001 possession (Score: 57-44)
Ja Dosunmu attempts a Layup. Wide open! John Duncan is 6.8 feet away. [MAN] JA DOSUNMU MAKES IT! Assist: Kristaps Ming
Score: 59-44

[01:01] Team_002 possession (Score: 59-44)
Dirk Middleton attempts a Layup. Contested by Dejounte McCollum (3.8 feet, ZONE). Dirk Middleton misses. Rebound secured by Larry Trent.

[00:44] Team_001 possession (Score: 59-44)
Larry Trent attempts a Midrange. Contested by Anfernee Sexton (5.9 feet, MAN). Larry Trent misses. Offensive rebound by Dejounte McCollum! Dejounte McCollum kicks it out.

[00:30] Team_001 possession (Score: 59-44)
Dejounte McCollum attempts a Midrange. Wide open! Julius Curry is 6.7 feet away. [MAN] DEJOUNTE MCCOLLUM MAKES IT!
Score: 61-44

[00:14] Team_002 possession (Score: 61-44)
Dirk Middleton drives, picks up Dejounte McCollum. Help arrives from Rudy George! Dirk Middleton attempts a Layup. Contested by Rudy George (3.8 feet, ZONE). DIRK MIDDLETON MAKES IT! Assist: Anfernee Sexton
Score: 61-46

================================================================================
                              2ND QUARTER COMPLETE                              
================================================================================

2ND QUARTER SCORE: Team_001 29, Team_002 19

BOX SCORE:
================================================================================

Team_001
--------------------------------------------------------------------------------
Player                MIN  PTS  REB  AST  TO      FG   FG%      3P   3P%
--------------------------------------------------------------------------------
Ja Dosunmu             16   10    0    1   0   4/5    80.0     0/0   0.0
Larry Trent            15    8    4    0   0   2/5    40.0     0/0   0.0
Dejounte McCollum      12    5    2    0   0   1/1   100.0     0/0   0.0
Cole Ball              15    4    2    1   0   2/2   100.0     0/0   0.0
Rudy George            16    2    3    1   0   1/2    50.0     0/0   0.0
Miles Griffin           8    0    1    0   0   0/0     0.0     0/0   0.0
Klay Harden             8    0    0    0   0   0/1     0.0     0/0   0.0
Kristaps Ming          16    0    0    4   0   0/0     0.0     0/0   0.0

TEAM: FG: 10/16 (62.5%), 3PT: 1/5 (20.0%), REB: 12 (1 off, 11 def), AST: 7, TO: 5
TEAM FOULS: 0


Team_002
--------------------------------------------------------------------------------
Player                MIN  PTS  REB  AST  TO      FG   FG%      3P   3P%
--------------------------------------------------------------------------------
Dirk Middleton         16   10    0    1   0   4/6    66.7     0/0   0.0
Lamelo O'Neal          16    4    3    0   0   1/2    50.0     0/0   0.0
John Duncan            16    3    0    1   0   1/4    25.0     0/0   0.0
Jordan Green            8    0    0    0   0   0/2     0.0     0/0   0.0
CJ Barrett              8    0    0    0   0   0/1     0.0     0/0   0.0
Tyler Porzingis         8    0    1    0   0   0/0     0.0     0/0   0.0
Julius Curry           16    0    3    1   0   0/0     0.0     0/0   0.0
Anfernee Sexton        16    0    2    1   0   0/1     0.0     0/0   0.0

TEAM: FG: 6/17 (35.3%), 3PT: 2/7 (28.6%), REB: 9 (3 off, 6 def), AST: 4, TO: 6
TEAM FOULS: 9 [Team_001 in BONUS]

================================================================================

================================================================================
                       3RD QUARTER - Team_001 vs Team_002                       
================================================================================

[12:00] Team_001 possession (Score: 61-46)
Dirk Young attempts a 3Pt. Contested by CJ Barrett (3.8 feet, ZONE). DIRK YOUNG MAKES IT! Assist: Miles Griffin
Score: 64-46

[11:49] Team_002 possession (Score: 64-46)
FOUL! Reach-in foul on Cole Ball during the drive. [Team fouls: 1] No free throws, side out. (Cole Ball: 1 personal fouls)

[11:35] Team_001 possession (Score: 64-46)
FOUL! Shooting foul on Carmelo Lowry. Dejounte McCollum to the line for 2 free throws. [Team fouls: 2] (Carmelo Lowry: 1 personal fouls)   FT 1/2: MISS   FT 2/2: GOOD Dejounte McCollum makes 1/2 from the line.
Score: 65-46

[11:25] Team_002 possession (Score: 65-46)
Jordan Green drives, Miles Griffin stays with him. Jordan Green attempts a Dunk. Contested by Miles Griffin (3.7 feet, ZONE). JORDAN GREEN MAKES IT!
Score: 65-48

[11:13] Team_001 possession (Score: 65-48)
Dejounte McCollum drives and kicks out. Dirk Young attempts a 3Pt. Contested by CJ Barrett (3.8 feet, MAN). Dirk Young misses. Rebound secured by Miles Bane.

[11:00] Team_002 possession (Score: 65-48)
Tyler Porzingis drives and kicks out. Carmelo Lowry attempts a Midrange. Contested by Dejounte McCollum (3.8 feet, MAN). CARMELO LOWRY MAKES IT!
Score: 65-50

[10:45] Team_001 possession (Score: 65-50)
Dejounte McCollum commits an offensive foul! Carmelo Lowry drew the charge! TURNOVER! (dead ball)

[10:27] Team_002 possession (Score: 65-50)
FOUL! Shooting foul on Miles Griffin. Tyler Porzingis to the line for 2 free throws. [Team fouls: 3] (Miles Griffin: 1 personal fouls)   FT 1/2: GOOD   FT 2/2: GOOD Tyler Porzingis makes 2/2 from the line.
Score: 65-52

[10:10] Team_001 possession (Score: 65-52)
Dirk Young drives to the basket... Dirk Young loses the ball! Stripped by CJ Barrett! TURNOVER! (live ball)

[09:58] Team_002 possession (Score: 65-52)
Carmelo Lowry attempts a 3Pt. Contested by Dejounte McCollum (3.8 feet, MAN). Carmelo Lowry misses. Rebound secured by Cole Ball.

[09:43] Team_001 possession (Score: 65-52)
Dirk Young attempts a 3Pt. Contested by Miles Bane (4.5 feet, ZONE). DIRK YOUNG MAKES IT! Assist: Miles Griffin
Score: 68-52

[09:28] Team_002 possession (Score: 68-52)
CJ Barrett attempts a Midrange. Contested by Dirk Young (3.8 feet, MAN). CJ Barrett misses. Rebound secured by Miles Griffin.

[09:14] Team_001 possession (Score: 68-52)
Cole Ball loses the ball! Stripped by Jordan Green! TURNOVER! (live ball)

[09:01] Team_002 possession (Score: 68-52)
Carmelo Lowry makes the Layup and draws the foul on Dejounte McCollum! And-1! Carmelo Lowry to the line for 1. [Team fouls: 4] (Dejounte McCollum: 1 personal fouls)   FT 1/1: GOOD Carmelo Lowry makes 1/1 from the line.
Score: 68-55

[08:42] Team_001 possession (Score: 68-55)
Cole Ball throws a bad pass! Stolen by Jordan Green! TURNOVER! (live ball)

[08:26] Team_002 possession (Score: 68-55)
CJ Barrett attempts a 3Pt. Contested by Dirk Young (3.8 feet, MAN). CJ BARRETT MAKES IT! Assist: Miles Bane
Score: 68-58

[08:16] Team_001 possession (Score: 68-58)
Klay Harden drives to the basket... Klay Harden throws a bad pass out of bounds! TURNOVER! (dead ball)

[08:02] Team_002 possession (Score: 68-58)
Miles Bane attempts a 3Pt. Contested by Klay Harden (3.3 feet, MAN). Miles Bane misses. Rebound secured by Cole Ball.

[07:45] Team_001 possession (Score: 68-58)
Cole Ball attempts a 3Pt. Contested by Jordan Green (3.8 feet, MAN). COLE BALL MAKES IT! Assist: Klay Harden
Score: 71-58

[07:30] Team_002 possession (Score: 71-58)
Jordan Green attempts a Midrange. Contested by Cole Ball (2.8 feet, MAN). Jordan Green misses. Rebound secured by Dejounte McCollum.

[07:19] Team_001 possession (Score: 71-58)
Dejounte McCollum attempts a 3Pt. Contested by Carmelo Lowry (3.6 feet, MAN). Dejounte McCollum misses. Rebound secured by Tyler Porzingis.

[07:08] Team_002 possession (Score: 71-58)
Miles Bane throws a bad pass out of bounds! TURNOVER! (dead ball)

[06:51] Team_001 possession (Score: 71-58)
FOUL! Holding foul on Miles Bane. [IN THE BONUS! 5 team fouls] Klay Harden to the line for 2 free throws. (Miles Bane: 1 personal fouls)   FT 1/2: GOOD   FT 2/2: GOOD Klay Harden makes 2/2 from the line.
Score: 73-58

[06:34] Team_002 possession (Score: 73-58)
Jordan Green drives to the basket... Jordan Green commits an offensive foul! TURNOVER! (dead ball)

[06:20] Team_001 possession (Score: 73-58)
Klay Harden commits an offensive foul! Miles Bane drew the charge! TURNOVER! (dead ball)

[06:04] Team_002 possession (Score: 73-58)
CJ Barrett commits a violation (traveling/carry)! TURNOVER! (dead ball)

[05:50] Team_001 possession (Score: 73-58)
Miles Griffin attempts a Midrange. Contested by Carmelo Lowry (3.6 feet, ZONE). Miles Griffin misses. Rebound secured by Miles Bane.

[05:37] Team_002 possession (Score: 73-58)
CJ Barrett drives to the basket... CJ Barrett throws a bad pass out of bounds! TURNOVER! (dead ball)

[05:19] Team_001 possession (Score: 73-58)
Klay Harden attempts a 3Pt. Contested by Miles Bane (4.5 feet, MAN). Klay Harden misses. FOUL! Loose ball foul on Tyler Porzingis during the rebound battle. [IN THE BONUS! 6 team fouls] Cole Ball to the line for 2 free throws. (Tyler Porzingis: 1 personal fouls)   FT 1/2: GOOD   FT 2/2: MISS Cole Ball makes 1/2 from the line. Rebound secured by Tyler Porzingis.
Score: 74-58

[05:03] Team_002 possession (Score: 74-58)
Miles Bane attempts a 3Pt. Contested by Klay Harden (3.5 feet, ZONE). Miles Bane misses. Rebound secured by Cole Ball.

[04:47] Team_001 possession (Score: 74-58)
Miles Griffin attempts a Midrange. Contested by Tyler Porzingis (3.1 feet, MAN). Miles Griffin misses. Rebound secured by Tyler Porzingis.

[04:35] Team_002 possession (Score: 74-58)
FOUL! Shooting foul on Miles Griffin. Tyler Porzingis to the line for 2 free throws. [BONUS: 7 team fouls] (Miles Griffin: 2 personal fouls)   FT 1/2: GOOD   FT 2/2: GOOD Tyler Porzingis makes 2/2 from the line.
Score: 74-60

[04:22] Team_001 possession (Score: 74-60)
FOUL! Holding foul on Jordan Green. [IN THE BONUS! 8 team fouls] Cole Ball to the line for 2 free throws. (Jordan Green: 1 personal fouls)   FT 1/2: GOOD   FT 2/2: GOOD Cole Ball makes 2/2 from the line.
Score: 76-60

[04:04] Team_002 possession (Score: 76-60)
Carmelo Lowry attempts a 3Pt. Contested by Dejounte McCollum (3.9 feet, MAN). Carmelo Lowry misses. Rebound secured by Miles Griffin.

[03:49] Team_001 possession (Score: 76-60)
Cole Ball attempts a 3Pt. Contested by Jordan Green (4.0 feet, MAN). Cole Ball misses. FOUL! Loose ball foul on Carmelo Lowry during the rebound battle. [IN THE BONUS! 9 team fouls] Miles Griffin to the line for 2 free throws. (Carmelo Lowry: 2 personal fouls)   FT 1/2: GOOD   FT 2/2: GOOD Miles Griffin makes 2/2 from the line.
Score: 78-60

[03:34] Team_002 possession (Score: 78-60)
CJ Barrett attempts a 3Pt. Contested by Klay Harden (3.7 feet, ZONE). CJ Barrett misses. Rebound secured by Cole Ball.

[03:20] Team_001 possession (Score: 78-60)
FOUL! Holding foul on Jordan Green. [IN THE BONUS! 10 team fouls] Cole Ball to the line for 2 free throws. (Jordan Green: 2 personal fouls)   FT 1/2: GOOD   FT 2/2: GOOD Cole Ball makes 2/2 from the line.
Score: 80-60

[03:04] Team_002 possession (Score: 80-60)
Tyler Porzingis attempts a Layup. Contested by Miles Griffin (4.0 feet, MAN). TYLER PORZINGIS MAKES IT!
Score: 80-62

[02:53] Team_001 possession (Score: 80-62)
Klay Harden drives, Tyler Porzingis stays with him. Klay Harden attempts a Dunk. Contested by Tyler Porzingis (3.3 feet, ZONE). KLAY HARDEN MAKES IT!
Score: 82-62

[02:38] Team_002 possession (Score: 82-62)
Carmelo Lowry throws a bad pass! Stolen by Dejounte McCollum! TURNOVER! (live ball)

[02:22] Team_001 possession (Score: 82-62)
Klay Harden attempts a Midrange. Contested by Miles Bane (4.8 feet, MAN). Klay Harden misses. Offensive rebound by Cole Ball! Cole Ball kicks it out.

[02:11] Team_001 possession (Score: 82-62)
Dejounte McCollum drives to the basket... Dejounte McCollum throws a bad pass out of bounds! TURNOVER! (dead ball)

[02:11] Substitution (Team_001): Klay Harden OUT → Ja Dosunmu IN (stamina_rule2)

[02:11] Substitution (Team_001): Dirk Young OUT → Rudy George IN (stamina_rule2)

[02:11] Substitution (Team_001): Cole Ball OUT → Larry Trent IN (stamina_rule2)

[02:11] Substitution (Team_001): Miles Griffin OUT → Kristaps Ming IN (stamina_rule2)

[02:11] Substitution (Team_002): Miles Bane OUT → John Duncan IN (stamina_rule2)

[02:11] Substitution (Team_002): CJ Barrett OUT → Dirk Middleton IN (stamina_rule2)

[02:11] Substitution (Team_002): Jordan Green OUT → Anfernee Sexton IN (stamina_rule2)

[02:11] Substitution (Team_002): Carmelo Lowry OUT → Julius Curry IN (stamina_rule2)

[02:11] Substitution (Team_002): Tyler Porzingis OUT → Lamelo O'Neal IN (stamina_rule2)

[01:57] Team_002 possession (Score: 82-62)
Dirk Middleton drives to the basket... Dirk Middleton throws a bad pass! Stolen by Rudy George! TURNOVER! (live ball)

[01:44] Team_001 possession (Score: 82-62)
Rudy George drives to the basket... Rudy George commits an offensive foul! TURNOVER! (dead ball)

[01:31] Team_002 possession (Score: 82-62)
Julius Curry attempts a 3Pt. Contested by Dejounte McCollum (4.1 feet, MAN). Julius Curry misses. Rebound secured by Dejounte McCollum.

[01:21] Team_001 possession (Score: 82-62)
Ja Dosunmu attempts a 3Pt. Contested by John Duncan (5.5 feet, MAN). JA DOSUNMU MAKES IT! Assist: Kristaps Ming
Score: 85-62

[01:05] Team_002 possession (Score: 85-62)
FOUL! Shooting foul on Rudy George. Dirk Middleton to the line for 3 free throws. [BONUS: 11 team fouls] (Rudy George: 1 personal fouls)   FT 1/3: GOOD   FT 2/3: GOOD   FT 3/3: MISS Dirk Middleton makes 2/3 from the line. Rebound secured by Dejounte McCollum.
Score: 85-64

[00:46] Team_001 possession (Score: 85-64)
Dejounte McCollum drives to the basket... Dejounte McCollum loses the ball! Stripped by Lamelo O'Neal! TURNOVER! (live ball)

[00:33] Team_002 possession (Score: 85-64)
Dirk Middleton attempts a Layup. Contested by Rudy George (4.7 feet, MAN). Dirk Middleton misses. Rebound secured by Kristaps Ming.

[00:23] Team_001 possession (Score: 85-64)
Kristaps Ming makes the Layup and draws the foul on Lamelo O'Neal! And-1! Kristaps Ming to the line for 1. [BONUS: 12 team fouls] (Lamelo O'Neal: 1 personal fouls)   FT 1/1: MISS Kristaps Ming makes 0/1 from the line. Rebound secured by Anfernee Sexton.
Score: 87-64

[00:12] Team_002 possession (Score: 87-64)
FOUL! Reach-in foul on Kristaps Ming during the drive. [IN THE BONUS! 13 team fouls] Lamelo O'Neal to the line for 2 free throws. (Kristaps Ming: 1 personal fouls)   FT 1/2: GOOD   FT 2/2: GOOD Lamelo O'Neal makes 2/2 from the line.
Score: 87-66

================================================================================
                              3RD QUARTER COMPLETE                              
================================================================================

3RD QUARTER SCORE: Team_001 26, Team_002 20

BOX SCORE:
================================================================================

Team_001
--------------------------------------------------------------------------------
Player                MIN  PTS  REB  AST  TO      FG   FG%      3P   3P%
--------------------------------------------------------------------------------
Cole Ball              25    7    5    0   0   1/1   100.0     0/0   0.0
Dirk Young             18    6    0    0   0   2/2   100.0     0/0   0.0
Klay Harden            18    4    0    1   0   1/2    50.0     0/0   0.0
Ja Dosunmu             18    3    0    0   0   1/1   100.0     0/0   0.0
Miles Griffin          18    2    2    2   0   0/2     0.0     0/0   0.0
Dejounte McCollum      24    1    3    0   0   0/2     0.0     0/0   0.0
Kristaps Ming          18    0    1    1   0   0/1     0.0     0/0   0.0

TEAM: FG: 5/11 (45.5%), 3PT: 4/6 (66.7%), REB: 12 (2 off, 10 def), AST: 4, TO: 9
TEAM FOULS: 0


Team_002
--------------------------------------------------------------------------------
Player                MIN  PTS  REB  AST  TO      FG   FG%      3P   3P%
--------------------------------------------------------------------------------
Tyler Porzingis        18    6    3    0   0   1/1   100.0     0/0   0.0
Carmelo Lowry          18    5    0    0   0   2/4    50.0     0/0   0.0
CJ Barrett             18    3    0    0   0   1/3    33.3     0/0   0.0
Jordan Green           18    2    0    0   0   1/2    50.0     0/0   0.0
Lamelo O'Neal          18    2    0    0   0   0/0     0.0     0/0   0.0
Miles Bane             18    0    2    1   0   0/2     0.0     0/0   0.0
Julius Curry           18    0    0    0   0   0/1     0.0     0/0   0.0
Dirk Middleton         18    0    0    0   0   0/2     0.0     0/0   0.0
Anfernee Sexton        18    0    1    0   0   0/0     0.0     0/0   0.0

TEAM: FG: 5/15 (33.3%), 3PT: 1/8 (12.5%), REB: 5 (0 off, 5 def), AST: 1, TO: 6
TEAM FOULS: 13 [Team_001 in BONUS]

================================================================================

================================================================================
                       4TH QUARTER - Team_001 vs Team_002                       
================================================================================

[12:00] Team_001 possession (Score: 87-66)
Klay Harden drives and kicks out. Klay Harden attempts a 3Pt. Contested by Miles Bane (4.5 feet, MAN). KLAY HARDEN MAKES IT! Assist: Dejounte McCollum
Score: 90-66

[11:46] Team_002 possession (Score: 90-66)
Miles Bane attempts a Midrange. Contested by Klay Harden (3.5 feet, MAN). MILES BANE MAKES IT! Assist: Carmelo Lowry
Score: 90-68

[11:33] Team_001 possession (Score: 90-68)
Miles Griffin throws a bad pass! Stolen by Tyler Porzingis! TURNOVER! (live ball)

[11:19] Team_002 possession (Score: 90-68)
Miles Bane attempts a 3Pt. Contested by Klay Harden (3.6 feet, MAN). Miles Bane misses. Rebound secured by Dejounte McCollum.

[11:05] Team_001 possession (Score: 90-68)
Dirk Young commits an offensive foul! CJ Barrett drew the charge! TURNOVER! (dead ball)

[10:55] Team_002 possession (Score: 90-68)
Tyler Porzingis attempts a Midrange. Contested by Miles Griffin (3.9 feet, MAN). Tyler Porzingis misses. Offensive rebound by Carmelo Lowry! Carmelo Lowry kicks it out.

[10:42] Team_002 possession (Score: 90-68)
FOUL! Shooting foul on Cole Ball. Jordan Green to the line for 3 free throws. [Team fouls: 1] (Cole Ball: 1 personal fouls)   FT 1/3: GOOD   FT 2/3: MISS   FT 3/3: GOOD Jordan Green makes 2/3 from the line.
Score: 90-70

[10:29] Team_001 possession (Score: 90-70)
Klay Harden drives, Miles Bane stays with him. Klay Harden attempts a Dunk. Contested by Miles Bane (4.7 feet, MAN). KLAY HARDEN MAKES IT! Assist: Dirk Young
Score: 92-70

[10:14] Team_002 possession (Score: 92-70)
Miles Bane makes the Dunk and draws the foul on Klay Harden! And-1! Miles Bane to the line for 1. [Team fouls: 2] (Klay Harden: 1 personal fouls)   FT 1/1: GOOD Miles Bane makes 1/1 from the line.
Score: 92-73

[10:00] Team_001 possession (Score: 92-73)
Klay Harden attempts a 3Pt. Contested by Miles Bane (4.7 feet, MAN). Klay Harden misses. Offensive rebound by Miles Griffin! Miles Griffin kicks it out.

[09:43] Team_001 possession (Score: 92-73)
Klay Harden attempts a Layup. BLOCKED BY MILES BANE! Ball goes out of bounds. Turnover!

[09:43] Substitution (Team_001): Klay Harden OUT → Ja Dosunmu IN (stamina_rule2)

[09:43] Substitution (Team_001): Dirk Young OUT → Rudy George IN (stamina_rule2)

[09:43] Substitution (Team_001): Dejounte McCollum OUT → Franz Bryant IN (stamina_rule2)

[09:43] Substitution (Team_001): Miles Griffin OUT → Kristaps Ming IN (stamina_rule2)

[09:43] Substitution (Team_002): Miles Bane OUT → John Duncan IN (stamina_rule2)

[09:43] Substitution (Team_002): CJ Barrett OUT → Dirk Middleton IN (stamina_rule2)

[09:43] Substitution (Team_002): Jordan Green OUT → Anfernee Sexton IN (stamina_rule2)

[09:43] Substitution (Team_002): Carmelo Lowry OUT → Julius Curry IN (stamina_rule2)

[09:43] Substitution (Team_002): Tyler Porzingis OUT → Lamelo O'Neal IN (stamina_rule2)

[09:29] Team_002 possession (Score: 92-73)
Anfernee Sexton loses the ball! Stripped by Cole Ball! TURNOVER! (live ball)

[09:15] Team_001 possession (Score: 92-73)
Ja Dosunmu attempts a 3Pt. Contested by John Duncan (5.5 feet, MAN). Ja Dosunmu misses. Rebound secured by Lamelo O'Neal.

[09:00] Team_002 possession (Score: 92-73)
Anfernee Sexton attempts a Layup. Contested by Cole Ball (3.2 feet, MAN). Anfernee Sexton misses. Rebound secured by Rudy George.

[08:47] Team_001 possession (Score: 92-73)
Kristaps Ming makes the Layup and draws the foul on Lamelo O'Neal! And-1! Kristaps Ming to the line for 1. [Team fouls: 3] (Lamelo O'Neal: 1 personal fouls)   FT 1/1: GOOD Kristaps Ming makes 1/1 from the line.
Score: 95-73

[08:32] Team_002 possession (Score: 95-73)
Anfernee Sexton drives, picks up Cole Ball. Help arrives from Rudy George! Anfernee Sexton attempts a Dunk. Contested by Rudy George (3.3 feet, MAN). ANFERNEE SEXTON MAKES IT! Assist: Lamelo O'Neal
Score: 95-75

[08:15] Team_001 possession (Score: 95-75)
Franz Bryant attempts a 3Pt. Contested by Julius Curry (5.4 feet, ZONE). Franz Bryant misses. Rebound secured by Lamelo O'Neal.

[07:58] Team_002 possession (Score: 95-75)
John Duncan attempts a 3Pt. Contested by Ja Dosunmu (3.5 feet, MAN). John Duncan misses. Offensive rebound by Anfernee Sexton! Anfernee Sexton kicks it out.

[07:47] Team_002 possession (Score: 95-75)
Dirk Middleton drives and kicks out. Anfernee Sexton attempts a 3Pt. Contested by Cole Ball (3.4 feet, MAN). Anfernee Sexton misses. Offensive rebound by Lamelo O'Neal! Lamelo O'Neal puts it back in!
Score: 95-77

[07:32] Team_001 possession (Score: 95-77)
Rudy George attempts a 3Pt. Contested by Dirk Middleton (5.9 feet, MAN). Rudy George misses. Rebound secured by Anfernee Sexton.

[07:15] Team_002 possession (Score: 95-77)
Anfernee Sexton attempts a Midrange. Contested by Rudy George (4.7 feet, ZONE). Anfernee Sexton misses. Rebound secured by Rudy George.

[07:02] Team_001 possession (Score: 95-77)
FOUL! Reach-in foul on Lamelo O'Neal during the drive. [Team fouls: 4] No free throws, side out. (Lamelo O'Neal: 2 personal fouls)

[06:46] Team_002 possession (Score: 95-77)
Julius Curry attempts a Midrange. Contested by Franz Bryant (3.8 feet, MAN). JULIUS CURRY MAKES IT!
Score: 95-79

[06:29] Team_001 possession (Score: 95-79)
FOUL! Reach-in foul on Lamelo O'Neal during the drive. [IN THE BONUS! 5 team fouls] Kristaps Ming to the line for 2 free throws. (Lamelo O'Neal: 3 personal fouls)   FT 1/2: GOOD   FT 2/2: MISS Kristaps Ming makes 1/2 from the line. Rebound secured by Lamelo O'Neal.
Score: 96-79

[06:10] Team_002 possession (Score: 96-79)
FOUL! Shooting foul on Rudy George. Dirk Middleton to the line for 2 free throws. [BONUS: 6 team fouls] (Rudy George: 1 personal fouls)   FT 1/2: GOOD   FT 2/2: GOOD Dirk Middleton makes 2/2 from the line.
Score: 96-81

[05:56] Team_001 possession (Score: 96-81)
Ja Dosunmu attempts a Midrange. Contested by Anfernee Sexton (4.4 feet, ZONE). Ja Dosunmu misses. Rebound secured by Anfernee Sexton.

[05:47] Team_002 possession (Score: 96-81)
John Duncan attempts a Midrange. Contested by Rudy George (4.7 feet, ZONE). JOHN DUNCAN MAKES IT!
Score: 96-83

[05:31] Team_001 possession (Score: 96-83)
Franz Bryant attempts a Midrange. Contested by Lamelo O'Neal (3.0 feet, MAN). Franz Bryant misses. Offensive rebound by Cole Ball! Cole Ball kicks it out.

[05:15] Team_001 possession (Score: 96-83)
Ja Dosunmu makes the Layup and draws the foul on Lamelo O'Neal! And-1! Ja Dosunmu to the line for 1. [BONUS: 7 team fouls] (Lamelo O'Neal: 4 personal fouls)   FT 1/1: GOOD Ja Dosunmu makes 1/1 from the line.
Score: 99-83

[04:57] Team_002 possession (Score: 99-83)
Lamelo O'Neal attempts a Midrange. Contested by Kristaps Ming (5.6 feet, MAN). Lamelo O'Neal misses. Rebound secured by Kristaps Ming.

[04:39] Team_001 possession (Score: 99-83)
Ja Dosunmu attempts a Midrange. Contested by John Duncan (5.5 feet, MAN). Ja Dosunmu misses. Rebound secured by Julius Curry.

[04:26] Team_002 possession (Score: 99-83)
Lamelo O'Neal drives to the basket... Lamelo O'Neal loses control! Ball rolls out of bounds! TURNOVER! (dead ball)

[04:26] Substitution (Team_001): Cole Ball OUT → Larry Trent IN (stamina_rule2)

[04:14] Team_001 possession (Score: 99-83)
FOUL! Reach-in foul on Lamelo O'Neal during the drive. [IN THE BONUS! 8 team fouls] Kristaps Ming to the line for 2 free throws. (Lamelo O'Neal: 5 personal fouls)   FT 1/2: GOOD   FT 2/2: GOOD Kristaps Ming makes 2/2 from the line.
Score: 101-83

[03:56] Team_002 possession (Score: 101-83)
Lamelo O'Neal attempts a Midrange. Contested by Kristaps Ming (5.6 feet, MAN). LAMELO O'NEAL MAKES IT!
Score: 101-85

[03:41] Team_001 possession (Score: 101-85)
FOUL! Holding foul on John Duncan. [IN THE BONUS! 9 team fouls] Ja Dosunmu to the line for 2 free throws. (John Duncan: 1 personal fouls)   FT 1/2: GOOD   FT 2/2: MISS Ja Dosunmu makes 1/2 from the line. Rebound secured by Lamelo O'Neal.
Score: 102-85

[03:26] Team_002 possession (Score: 102-85)
Lamelo O'Neal attempts a Layup. Contested by Kristaps Ming (5.6 feet, MAN). Lamelo O'Neal misses. Rebound secured by Kristaps Ming.

[03:08] Team_001 possession (Score: 102-85)
Rudy George attempts a Midrange. Contested by Anfernee Sexton (4.4 feet, ZONE). RUDY GEORGE MAKES IT!
Score: 104-85

[02:55] Team_002 possession (Score: 104-85)
FOUL! Shooting foul on Kristaps Ming. Lamelo O'Neal to the line for 2 free throws. [BONUS: 10 team fouls] (Kristaps Ming: 1 personal fouls)   FT 1/2: GOOD   FT 2/2: GOOD Lamelo O'Neal makes 2/2 from the line.
Score: 104-87

[02:44] Team_001 possession (Score: 104-87)
Ja Dosunmu drives to the basket... Ja Dosunmu throws a bad pass out of bounds! TURNOVER! (dead ball)

[02:34] Team_002 possession (Score: 104-87)
John Duncan makes the Layup and draws the foul on Ja Dosunmu! And-1! John Duncan to the line for 1. [BONUS: 11 team fouls] (Ja Dosunmu: 1 personal fouls)   FT 1/1: GOOD John Duncan makes 1/1 from the line.
Score: 104-90

[02:23] Team_001 possession (Score: 104-90)
Franz Bryant drives, picks up Julius Curry. Help arrives from John Duncan! Franz Bryant attempts a Dunk. Contested by John Duncan (5.5 feet, MAN). FRANZ BRYANT MAKES IT!
Score: 106-90

[02:08] Team_002 possession (Score: 106-90)
Julius Curry attempts a 3Pt. Contested by Ja Dosunmu (3.7 feet, ZONE). JULIUS CURRY MAKES IT!
Score: 106-93

[01:57] Team_001 possession (Score: 106-93)
Ja Dosunmu drives and kicks out. Ja Dosunmu attempts a 3Pt. Contested by Julius Curry (5.5 feet, ZONE). Ja Dosunmu misses. Rebound secured by Lamelo O'Neal.

[01:44] Team_002 possession (Score: 106-93)
Dirk Middleton attempts a 3Pt. Contested by Rudy George (4.9 feet, MAN). DIRK MIDDLETON MAKES IT! Assist: Julius Curry
Score: 106-96

[01:31] Team_001 possession (Score: 106-96)
FOUL! Holding foul on Lamelo O'Neal. [IN THE BONUS! 12 team fouls] Kristaps Ming to the line for 2 free throws. (Lamelo O'Neal: 6 personal fouls) Lamelo O'Neal FOULS OUT!   FT 1/2: GOOD   FT 2/2: GOOD Kristaps Ming makes 2/2 from the line.
Score: 108-96

[01:31] Substitution (Team_002): Lamelo O'Neal OUT (stamina: 65) → Miles Bane IN (foul_out)

[01:20] Team_002 possession (Score: 108-96)
Dirk Middleton attempts a 3Pt. Contested by Rudy George (4.9 feet, MAN). Dirk Middleton misses. Rebound secured by Kristaps Ming.

[01:02] Team_001 possession (Score: 108-96)
Kristaps Ming commits an offensive foul! Julius Curry drew the charge! TURNOVER! (dead ball)

[00:44] Team_002 possession (Score: 108-96)
FOUL! Reach-in foul on Franz Bryant during the drive. [IN THE BONUS! 13 team fouls] Julius Curry to the line for 2 free throws. (Franz Bryant: 1 personal fouls)   FT 1/2: GOOD   FT 2/2: GOOD Julius Curry makes 2/2 from the line.
Score: 108-98

[00:27] Team_001 possession (Score: 108-98)
Ja Dosunmu makes the Layup and draws the foul on John Duncan! And-1! Ja Dosunmu to the line for 1. [BONUS: 14 team fouls] (John Duncan: 2 personal fouls)   FT 1/1: MISS Ja Dosunmu makes 0/1 from the line. Rebound secured by Julius Curry.
Score: 110-98

[00:16] Team_002 possession (Score: 110-98)
Dirk Middleton drives, Rudy George stays with him. Dirk Middleton attempts a Dunk. Contested by Rudy George (5.1 feet, MAN). DIRK MIDDLETON MAKES IT!
Score: 110-100

================================================================================
                              4TH QUARTER COMPLETE                              
================================================================================

4TH QUARTER SCORE: Team_001 23, Team_002 34

BOX SCORE:
================================================================================

Team_001
--------------------------------------------------------------------------------
Player                MIN  PTS  REB  AST  TO      FG   FG%      3P   3P%
--------------------------------------------------------------------------------
Kristaps Ming          27    7    3    0   0   1/2    50.0     0/0   0.0
Klay Harden            21    5    0    0   0   2/2   100.0     0/0   0.0
Ja Dosunmu             27    3    0    0   0   1/6    16.7     0/0   0.0
Rudy George            27    2    2    0   0   1/2    50.0     0/0   0.0
Franz Bryant           16    2    0    0   0   1/2    50.0     0/0   0.0
Dejounte McCollum      27    0    1    1   0   0/0     0.0     0/0   0.0
Dirk Young             21    0    0    1   0   0/0     0.0     0/0   0.0
Miles Griffin          21    0    1    0   0   0/0     0.0     0/0   0.0
Cole Ball              33    0    1    0   0   0/0     0.0     0/0   0.0

TEAM: FG: 6/15 (40.0%), 3PT: 0/3 (0.0%), REB: 8 (2 off, 6 def), AST: 2, TO: 5
TEAM FOULS: 0


Team_002
--------------------------------------------------------------------------------
Player                MIN  PTS  REB  AST  TO      FG   FG%      3P   3P%
--------------------------------------------------------------------------------
Julius Curry           27    7    2    1   0   2/2   100.0     0/0   0.0
Dirk Middleton         27    7    0    0   0   2/3    66.7     0/0   0.0
Lamelo O'Neal          26    6    6    1   0   2/4    50.0     0/0   0.0
Miles Bane             22    5    0    0   0   2/3    66.7     0/0   0.0
John Duncan            27    5    0    0   0   2/2   100.0     0/0   0.0
Jordan Green           21    2    0    0   0   0/0     0.0     0/0   0.0
Anfernee Sexton        27    2    3    0   0   1/3    33.3     0/0   0.0
Carmelo Lowry          21    0    1    1   0   0/0     0.0     0/0   0.0

TEAM: FG: 11/17 (64.7%), 3PT: 2/4 (50.0%), REB: 12 (3 off, 9 def), AST: 3, TO: 2
TEAM FOULS: 14 [Team_001 in BONUS]

================================================================================

================================================================================
                               FULL GAME COMPLETE                               
================================================================================

FINAL SCORE: Team_001 110, Team_002 100

SCORING BY QUARTER:
--------------------------------------------------------------------------------
Team                     Q1     Q2     Q3     Q4    FINAL
--------------------------------------------------------------------------------
Team_001                 32     29     26     23      110
Team_002                 27     19     20     34      100
--------------------------------------------------------------------------------

FULL GAME BOX SCORE:
================================================================================

Team_001
--------------------------------------------------------------------------------
Player                MIN  PTS  REB  AST  TO      FG   FG%      3P   3P%      FT STL BLK
--------------------------------------------------------------------------------
Cole Ball              33   11   10    1   4   3/4    75.0   1/1   100.0   4/4     2   1
Ja Dosunmu             27   19    0    1   2   7/13   53.8   1/3    33.3   4/5     0   0
Rudy George            27    7    9    1   2   2/4    50.0   0/1     0.0   0/0     1   0
Kristaps Ming          27   11    7    6   3   4/6    66.7   0/0     0.0   5/5     0   0
Dejounte McCollum      27    6    8    1   2   1/3    33.3   0/1     0.0   4/5     1   0
Larry Trent            21   10    6    0   2   2/5    40.0   1/3    33.3   5/5     0   0
Klay Harden            21   17    0    2   1   5/10   50.0   1/4    25.0   5/5     1   0
Dirk Young             21   11    0    2   3   3/4    75.0   3/3   100.0   2/2     0   0
Miles Griffin          21    4    5    2   3   1/3    33.3   0/0     0.0   0/2     0   0
Franz Bryant           16    5    0    0   1   2/4    50.0   0/2     0.0   1/1     0   0

TEAM: FG: 30/57 (52.6%), 3PT: 7/18 (38.9%), REB: 46 (7 off, 39 def), AST: 16, TO: 23


Team_002
--------------------------------------------------------------------------------
Player                MIN  PTS  REB  AST  TO      FG   FG%      3P   3P%      FT STL BLK
--------------------------------------------------------------------------------
John Duncan            27   14    0    1   1   5/8    62.5   3/5    60.0   1/1     1   0
Anfernee Sexton        27    2    8    1   2   1/5    20.0   0/1     0.0   0/0     1   0
Dirk Middleton         27   17    0    2   0   7/13   53.8   2/5    40.0   3/3     0   0
Julius Curry           27    7    6    3   2   2/6    33.3   1/3    33.3   2/2     0   0
Lamelo O'Neal          26   14   10    2   2   3/7    42.9   0/0     0.0   6/6     1   0
Miles Bane             22    7    3    2   3   2/6    33.3   0/3     0.0   3/3     0   1
Jordan Green           21    4    0    0   2   1/6    16.7   0/1     0.0   2/3     2   0
CJ Barrett             21    8    2    0   1   2/5    40.0   1/3    33.3   3/3     1   0
Carmelo Lowry          21    8    1    1   1   2/5    40.0   1/3    33.3   1/1     0   0
Tyler Porzingis        21   10    6    1   1   3/4    75.0   0/0     0.0   6/6     3   0

TEAM: FG: 28/67 (41.8%), 3PT: 8/24 (33.3%), REB: 35 (9 off, 26 def), AST: 13, TO: 15

================================================================================
