================================================================================
                        FULL GAME - Team_001 vs Team_002                        
================================================================================

================================================================================
                       1ST QUARTER - Team_001 vs Team_002                       
================================================================================

[12:00] Team_001 possession (Score: 0-0)
Dirk Young attempts a 3Pt. Contested by Carmelo Lowry (5.5 feet, ZONE). Dirk Young misses. Rebound secured by CJ Barrett.

[11:45] Team_002 possession (Score: 0-0)
Tyler Porzingis makes the Layup and draws the foul on Dejounte McCollum! And-1! Tyler Porzingis to the line for 1. [Team fouls: 1] (Dejounte McCollum: 1 personal fouls)   FT 1/1: GOOD Tyler Porzingis makes 1/1 from the line.
Score: 0-3

[11:30] Team_001 possession (Score: 0-3)
Dirk Young attempts a 3Pt. Contested by Miles Bane (4.8 feet, ZONE). Dirk Young misses. Rebound secured by Tyler Porzingis.

[11:13] Team_002 possession (Score: 0-3)
Tyler Porzingis attempts a Layup. Contested by Miles Griffin (5.1 feet, MAN). TYLER PORZINGIS MAKES IT! Assist: Carmelo Lowry
Score: 0-5

[10:58] Team_001 possession (Score: 0-5)
Dejounte McCollum attempts a Midrange. Contested by Carmelo Lowry (5.7 feet, MAN). DEJOUNTE MCCOLLUM MAKES IT! Assist: Klay Harden
Score: 2-5

[10:45] Team_002 possession (Score: 2-5)
Miles Bane attempts a 3Pt. Contested by Cole Ball (3.0 feet, ZONE). Miles Bane misses. Offensive rebound by Tyler Porzingis! Tyler Porzingis's putback is no good. Offensive rebound by Tyler Porzingis! Tyler Porzingis kicks it out.

[10:30] Team_002 possession (Score: 2-5)
Jordan Green attempts a 3Pt. Contested by Cole Ball (3.1 feet, ZONE). Jordan Green misses. Rebound secured by Cole Ball.

[10:15] Team_001 possession (Score: 2-5)
Dirk Young throws a bad pass! Stolen by CJ Barrett! TURNOVER! (live ball)

[10:02] Team_002 possession (Score: 2-5)
FOUL! Holding foul on Cole Ball. [Team fouls: 2] No free throws, side out. (Cole Ball: 1 personal fouls)

[09:49] Team_001 possession (Score: 2-5)
Klay Harden attempts a Midrange. Contested by Carmelo Lowry (6.0 feet, ZONE). KLAY HARDEN MAKES IT!
Score: 4-5

[09:36] Team_002 possession (Score: 4-5)
Carmelo Lowry makes the Midrange and draws the foul on Dejounte McCollum! And-1! Carmelo Lowry to the line for 1. [Team fouls: 3] (Dejounte McCollum: 2 personal fouls)   FT 1/1: GOOD Carmelo Lowry makes 1/1 from the line.
Score: 4-8

[09:23] Team_001 possession (Score: 4-8)
Dirk Young attempts a 3Pt. Contested by Miles Bane (5.0 feet, ZONE). Dirk Young misses. Offensive rebound by Dejounte McCollum! Dejounte McCollum kicks it out.

[09:06] Team_001 possession (Score: 4-8)
Cole Ball attempts a 3Pt. Contested by Jordan Green (4.4 feet, MAN). Cole Ball misses. Rebound secured by Miles Bane.

[08:54] Team_002 possession (Score: 4-8)
Miles Bane makes the Midrange and draws the foul on Cole Ball! And-1! Miles Bane to the line for 1. [Team fouls: 4] (Cole Ball: 2 personal fouls)   FT 1/1: GOOD Miles Bane makes 1/1 from the line.
Score: 4-11

[08:37] Team_001 possession (Score: 4-11)
Cole Ball attempts a Midrange. Contested by Jordan Green (4.5 feet, ZONE). Cole Ball misses. Rebound secured by Miles Bane.

[08:23] Team_002 possession (Score: 4-11)
Miles Bane attempts a Midrange. Contested by Klay Harden (5.5 feet, MAN). Miles Bane misses. Rebound secured by Cole Ball.

[08:12] Team_001 possession (Score: 4-11)
Dirk Young attempts a Layup. BLOCKED BY CJ BARRETT! Ball goes out of bounds. Turnover!

[08:12] Substitution (Team_001): Klay Harden OUT → Rudy George IN (stamina_rule2)

[08:12] Substitution (Team_001): Dirk Young OUT → Ja Dosunmu IN (stamina_rule2)

[08:12] Substitution (Team_001): Cole Ball OUT → Larry Trent IN (stamina_rule2)

[08:12] Substitution (Team_001): Dejounte McCollum OUT → Cole Ball IN (stamina_rule2)

[08:12] Substitution (Team_001): Miles Griffin OUT → Kristaps Ming IN (stamina_rule2)

[08:12] Substitution (Team_002): Miles Bane OUT → John Duncan IN (stamina_rule2)

[08:12] Substitution (Team_002): CJ Barrett OUT → Dirk Middleton IN (stamina_rule2)

[08:12] Substitution (Team_002): Jordan Green OUT → Anfernee Sexton IN (stamina_rule2)

[08:12] Substitution (Team_002): Carmelo Lowry OUT → Julius Curry IN (stamina_rule2)

[08:12] Substitution (Team_002): Tyler Porzingis OUT → Lamelo O'Neal IN (stamina_rule2)

[07:58] Team_002 possession (Score: 4-11)
John Duncan drives to the basket... John Duncan throws a bad pass! Stolen by Ja Dosunmu! TURNOVER! (live ball)

[07:46] Team_001 possession (Score: 4-11)
Larry Trent drives to the basket... Larry Trent commits an offensive foul! TURNOVER! (dead ball)

[07:34] Team_002 possession (Score: 4-11)
Anfernee Sexton drives, Cole Ball stays with him. Anfernee Sexton attempts a Layup. Contested by Cole Ball (3.5 feet, MAN). ANFERNEE SEXTON MAKES IT!
Score: 4-13

[07:17] Team_001 possession (Score: 4-13)
Cole Ball attempts a Midrange. Contested by Anfernee Sexton (4.6 feet, MAN). Cole Ball misses. Rebound secured by Lamelo O'Neal.

[07:07] Team_002 possession (Score: 4-13)
Anfernee Sexton attempts a Midrange. Contested by Cole Ball (3.6 feet, ZONE). ANFERNEE SEXTON MAKES IT! Assist: Dirk Middleton
Score: 4-15

[06:53] Team_001 possession (Score: 4-15)
Ja Dosunmu attempts a 3Pt. Contested by John Duncan (5.8 feet, MAN). Ja Dosunmu misses. Rebound secured by Julius Curry.

[06:40] Team_002 possession (Score: 4-15)
Dirk Middleton attempts a 3Pt. Contested by Cole Ball (3.7 feet, ZONE). Dirk Middleton misses. Rebound secured by Cole Ball.

[06:24] Team_001 possession (Score: 4-15)
Kristaps Ming attempts a 3Pt. Contested by Lamelo O'Neal (5.1 feet, MAN). Kristaps Ming misses. Rebound secured by Lamelo O'Neal.

[06:06] Team_002 possession (Score: 4-15)
Julius Curry drives and kicks out. FOUL! Shooting foul on Rudy George. Julius Curry to the line for 2 free throws. [BONUS: 5 team fouls] (Rudy George: 1 personal fouls)   FT 1/2: GOOD   FT 2/2: GOOD Julius Curry makes 2/2 from the line.
Score: 4-17

[05:53] Team_001 possession (Score: 4-17)
Rudy George attempts a Layup. Wide open! Dirk Middleton is 6.4 feet away. [MAN] RUDY GEORGE MAKES IT!
Score: 6-17

[05:41] Team_002 possession (Score: 6-17)
John Duncan attempts a 3Pt. Contested by Ja Dosunmu (4.7 feet, ZONE). JOHN DUNCAN MAKES IT! Assist: Anfernee Sexton
Score: 6-20

[05:22] Team_001 possession (Score: 6-20)
Ja Dosunmu attempts a 3Pt. Contested by John Duncan (5.9 feet, MAN). Ja Dosunmu misses. Rebound secured by Anfernee Sexton.

[05:05] Team_002 possession (Score: 6-20)
Dirk Middleton attempts a 3Pt. Contested by Ja Dosunmu (4.8 feet, ZONE). Dirk Middleton misses. Rebound secured by Cole Ball.

[04:51] Team_001 possession (Score: 6-20)
Kristaps Ming commits an offensive foul! Lamelo O'Neal drew the charge! TURNOVER! (dead ball)

[04:38] Team_002 possession (Score: 6-20)
Dirk Middleton attempts a Layup. Contested by Rudy George (5.4 feet, MAN). Dirk Middleton misses. Rebound secured by Rudy George.

[04:23] Team_001 possession (Score: 6-20)
Rudy George attempts a Midrange. Wide open! Dirk Middleton is 6.5 feet away. [MAN] RUDY GEORGE MAKES IT! Assist: Cole Ball
Score: 8-20

[04:13] Team_002 possession (Score: 8-20)
FOUL! Reach-in foul on Cole Ball during the drive. [IN THE BONUS! 6 team fouls] Anfernee Sexton to the line for 2 free throws. (Cole Ball: 3 personal fouls)   FT 1/2: GOOD   FT 2/2: GOOD Anfernee Sexton makes 2/2 from the line.
Score: 8-22

[04:01] Team_001 possession (Score: 8-22)
Kristaps Ming attempts a Midrange. Contested by Lamelo O'Neal (5.7 feet, MAN). Kristaps Ming misses. Rebound secured by Anfernee Sexton.

[03:48] Team_002 possession (Score: 8-22)
Julius Curry attempts a Midrange. Contested by Cole Ball (4.2 feet, ZONE). Julius Curry misses. Rebound secured by Larry Trent.

[03:35] Team_001 possession (Score: 8-22)
Kristaps Ming attempts a Layup. Contested by Lamelo O'Neal (5.8 feet, MAN). Kristaps Ming misses. Rebound secured by John Duncan.

[03:18] Team_002 possession (Score: 8-22)
John Duncan attempts a 3Pt. Contested by Ja Dosunmu (5.2 feet, ZONE). JOHN DUNCAN MAKES IT! Assist: Lamelo O'Neal
Score: 8-25

[02:58] Team_001 possession (Score: 8-25)
Kristaps Ming attempts a 3Pt. Contested by Lamelo O'Neal (5.9 feet, MAN). Kristaps Ming misses. Rebound secured by Julius Curry.

[02:42] Team_002 possession (Score: 8-25)
Anfernee Sexton drives to the basket... Anfernee Sexton throws a bad pass! Stolen by Cole Ball! TURNOVER! (live ball)

[02:25] Team_001 possession (Score: 8-25)
Kristaps Ming attempts a 3Pt. Wide open! Julius Curry is 6.2 feet away. [ZONE] Kristaps Ming misses. Rebound secured by Anfernee Sexton.

[02:10] Team_002 possession (Score: 8-25)
Anfernee Sexton attempts a 3Pt. Contested by Ja Dosunmu (5.4 feet, ZONE). Anfernee Sexton misses. FOUL! Loose ball foul on Larry Trent during the rebound battle. [IN THE BONUS! 7 team fouls] Julius Curry to the line for 2 free throws. (Larry Trent: 1 personal fouls)   FT 1/2: GOOD   FT 2/2: GOOD Julius Curry makes 2/2 from the line.
Score: 8-27

[01:55] Team_001 possession (Score: 8-27)
Cole Ball attempts a 3Pt. Wide open! Julius Curry is 6.3 feet away. [ZONE] Cole Ball misses. Rebound secured by John Duncan.

[01:38] Team_002 possession (Score: 8-27)
John Duncan drives, Kristaps Ming stays with him. John Duncan attempts a Dunk. Wide open! Kristaps Ming is 6.9 feet away. [ZONE] JOHN DUNCAN MAKES IT! Assist: Lamelo O'Neal
Score: 8-29

[01:21] Team_001 possession (Score: 8-29)
Larry Trent attempts a Midrange. Contested by Anfernee Sexton (5.4 feet, MAN). Larry Trent misses. Rebound secured by Julius Curry.

[01:07] Team_002 possession (Score: 8-29)
Dirk Middleton attempts a 3Pt. Contested by Rudy George (5.9 feet, MAN). DIRK MIDDLETON MAKES IT! Assist: Anfernee Sexton
Score: 8-32

[00:55] Team_001 possession (Score: 8-32)
Larry Trent loses control! Ball rolls out of bounds! TURNOVER! (dead ball)

[00:55] Substitution (Team_001): Cole Ball OUT → Dejounte McCollum IN (stamina_rule2)

[00:42] Team_002 possession (Score: 8-32)
Dirk Middleton attempts a Midrange. Contested by Rudy George (5.9 feet, MAN). Dirk Middleton misses. Rebound secured by Dejounte McCollum.

[00:30] Team_001 possession (Score: 8-32)
Dejounte McCollum attempts a Midrange. Wide open! Julius Curry is 6.4 feet away. [MAN] Dejounte McCollum misses. Rebound secured by Anfernee Sexton.

[00:19] Team_002 possession (Score: 8-32)
John Duncan attempts a 3Pt. Contested by Ja Dosunmu (5.8 feet, MAN). John Duncan misses. Rebound secured by Dejounte McCollum.

[00:03] Team_001 possession (Score: 8-32)
Larry Trent attempts a 3Pt. Contested by Anfernee Sexton (5.6 feet, MAN). LARRY TRENT MAKES IT! Assist: Rudy George
Score: 11-32

================================================================================
                              1ST QUARTER COMPLETE                              
================================================================================

1ST QUARTER SCORE: Team_001 11, Team_002 32

BOX SCORE:
================================================================================

Team_001
--------------------------------------------------------------------------------
Player                MIN  PTS  REB  AST  TO      FG   FG%      3P   3P%
--------------------------------------------------------------------------------
Rudy George             8    4    1    1   0   2/2   100.0     0/0   0.0
Larry Trent             8    3    1    0   0   1/2    50.0     0/0   0.0
Dejounte McCollum       5    2    3    0   0   1/2    50.0     0/0   0.0
Klay Harden             4    2    0    1   0   1/1   100.0     0/0   0.0
Dirk Young              4    0    0    0   0   0/2     0.0     0/0   0.0
Cole Ball              11    0    4    1   0   0/4     0.0     0/0   0.0
Ja Dosunmu              8    0    0    0   0   0/2     0.0     0/0   0.0
Kristaps Ming           8    0    0    0   0   0/5     0.0     0/0   0.0

TEAM: FG: 5/20 (25.0%), 3PT: 1/10 (10.0%), REB: 9 (1 off, 8 def), AST: 3, TO: 5
TEAM FOULS: 0


Team_002
--------------------------------------------------------------------------------
Player                MIN  PTS  REB  AST  TO      FG   FG%      3P   3P%
--------------------------------------------------------------------------------
John Duncan             8    8    2    0   0   3/4    75.0     0/0   0.0
Anfernee Sexton         8    6    4    2   0   2/2   100.0     0/0   0.0
Tyler Porzingis         4    5    2    0   0   2/2   100.0     0/0   0.0
Julius Curry            8    4    3    0   0   0/1     0.0     0/0   0.0
Carmelo Lowry           4    3    0    1   0   1/1   100.0     0/0   0.0
Miles Bane              4    3    2    0   0   1/2    50.0     0/0   0.0
Dirk Middleton          8    3    0    1   0   1/5    20.0     0/0   0.0
CJ Barrett              4    0    1    0   0   0/0     0.0     0/0   0.0
Jordan Green            4    0    0    0   0   0/1     0.0     0/0   0.0
Lamelo O'Neal           8    0    2    2   0   0/0     0.0     0/0   0.0

TEAM: FG: 10/18 (55.6%), 3PT: 3/7 (42.9%), REB: 16 (1 off, 15 def), AST: 6, TO: 2
TEAM FOULS: 7 [Team_001 in BONUS]

================================================================================

================================================================================
                       2ND QUARTER - Team_001 vs Team_002                       
================================================================================

[12:00] Team_001 possession (Score: 11-32)
Cole Ball attempts a Midrange. Contested by Jordan Green (3.8 feet, MAN). Cole Ball misses. Rebound secured by CJ Barrett.

[11:45] Team_002 possession (Score: 11-32)
Jordan Green attempts a Layup. Contested by Cole Ball (3.9 feet, MAN). JORDAN GREEN MAKES IT!
Score: 11-34

[11:30] Team_001 possession (Score: 11-34)
Dirk Young attempts a 3Pt. Contested by CJ Barrett (3.8 feet, MAN). Dirk Young misses. Rebound secured by Tyler Porzingis.

[11:13] Team_002 possession (Score: 11-34)
Jordan Green attempts a 3Pt. Contested by Klay Harden (3.7 feet, ZONE). JORDAN GREEN MAKES IT! Assist: Carmelo Lowry
Score: 11-37

[10:56] Team_001 possession (Score: 11-37)
Dirk Young attempts a 3Pt. Contested by CJ Barrett (3.8 feet, MAN). Dirk Young misses. Rebound secured by Miles Bane.

[10:41] Team_002 possession (Score: 11-37)
Miles Bane attempts a Midrange. Contested by Klay Harden (3.8 feet, MAN). MILES BANE MAKES IT! Assist: Tyler Porzingis
Score: 11-39

[10:29] Team_001 possession (Score: 11-39)
Cole Ball drives, Jordan Green stays with him. Cole Ball attempts a Dunk. Contested by Jordan Green (3.8 feet, MAN). COLE BALL MAKES IT!
Score: 13-39

[10:14] Team_002 possession (Score: 13-39)
Miles Bane attempts a 3Pt. Contested by Klay Harden (3.8 feet, MAN). Miles Bane misses. Rebound secured by Klay Harden.

[09:58] Team_001 possession (Score: 13-39)
Miles Griffin attempts a Midrange. Contested by Jordan Green (3.8 feet, ZONE). MILES GRIFFIN MAKES IT! Assist: Klay Harden
Score: 15-39

[09:42] Team_002 possession (Score: 15-39)
Miles Bane drives, Klay Harden stays with him. Miles Bane attempts a Dunk. Contested by Klay Harden (3.9 feet, MAN). MILES BANE MAKES IT! Assist: Tyler Porzingis
Score: 15-41

[09:26] Team_001 possession (Score: 15-41)
Dirk Young attempts a 3Pt. Contested by Miles Bane (4.6 feet, ZONE). DIRK YOUNG MAKES IT! Assist: Miles Griffin
Score: 18-41

[09:12] Team_002 possession (Score: 18-41)
Tyler Porzingis makes the Layup and draws the foul on Miles Griffin! And-1! Tyler Porzingis to the line for 1. [Team fouls: 1] (Miles Griffin: 1 personal fouls)   FT 1/1: MISS Tyler Porzingis makes 0/1 from the line. Rebound secured by Miles Griffin.
Score: 18-43

[08:59] Team_001 possession (Score: 18-43)
Cole Ball drives and kicks out. Dirk Young attempts a 3Pt. Contested by CJ Barrett (4.0 feet, MAN). DIRK YOUNG MAKES IT! Assist: Dejounte McCollum
Score: 21-43

[08:44] Team_002 possession (Score: 21-43)
Jordan Green attempts a 3Pt. Contested by Klay Harden (4.1 feet, ZONE). Jordan Green misses. Rebound secured by Dejounte McCollum.

[08:26] Team_001 possession (Score: 21-43)
Klay Harden attempts a 3Pt. Contested by CJ Barrett (4.1 feet, ZONE). Klay Harden misses. Rebound secured by Miles Bane.

[08:11] Team_002 possession (Score: 21-43)
CJ Barrett attempts a Midrange. Contested by Dejounte McCollum (3.9 feet, ZONE). CJ Barrett misses. Offensive rebound by Miles Bane! Miles Bane kicks it out.

[07:56] Team_002 possession (Score: 21-43)
Jordan Green drives to the basket... Jordan Green throws a bad pass out of bounds! TURNOVER! (dead ball)

[07:56] Substitution (Team_001): Klay Harden OUT → Rudy George IN (stamina_rule2)

[07:56] Substitution (Team_001): Dirk Young OUT → Ja Dosunmu IN (stamina_rule2)

[07:56] Substitution (Team_001): Cole Ball OUT → Franz Bryant IN (stamina_rule2)

[07:56] Substitution (Team_001): Miles Griffin OUT → Kristaps Ming IN (stamina_rule2)

[07:56] Substitution (Team_002): CJ Barrett OUT → John Duncan IN (stamina_rule2)

[07:56] Substitution (Team_002): Carmelo Lowry OUT → Anfernee Sexton IN (stamina_rule2)

[07:56] Substitution (Team_002): Tyler Porzingis OUT → Lamelo O'Neal IN (stamina_rule2)

[07:45] Team_001 possession (Score: 21-43)
Franz Bryant drives, Lamelo O'Neal stays with him. Franz Bryant attempts a Layup. Contested by Lamelo O'Neal (4.6 feet, MAN). FRANZ BRYANT MAKES IT! Assist: Kristaps Ming
Score: 23-43

[07:30] Team_002 possession (Score: 23-43)
Lamelo O'Neal attempts a Midrange. Wide open! Kristaps Ming is 6.1 feet away. [MAN] Lamelo O'Neal misses. Rebound secured by Rudy George.

[07:15] Team_001 possession (Score: 23-43)
Rudy George attempts a 3Pt. Contested by Miles Bane (4.8 feet, MAN). Rudy George misses. Rebound secured by Miles Bane.

[07:05] Team_002 possession (Score: 23-43)
Anfernee Sexton attempts a 3Pt. Contested by Franz Bryant (3.8 feet, MAN). Anfernee Sexton misses. Rebound secured by Rudy George.

[06:50] Team_001 possession (Score: 23-43)
FOUL! Holding foul on Lamelo O'Neal. [Team fouls: 2] No free throws, side out. (Lamelo O'Neal: 1 personal fouls)

[06:38] Team_002 possession (Score: 23-43)
John Duncan drives and kicks out. Anfernee Sexton attempts a Midrange. Contested by Franz Bryant (3.8 feet, MAN). Anfernee Sexton misses. Rebound secured by Dejounte McCollum.

[06:22] Team_001 possession (Score: 23-43)
FOUL! Shooting foul on Lamelo O'Neal. Dejounte McCollum to the line for 2 free throws. [Team fouls: 3] (Lamelo O'Neal: 2 personal fouls)   FT 1/2: GOOD   FT 2/2: GOOD Dejounte McCollum makes 2/2 from the line.
Score: 25-43

[06:04] Team_002 possession (Score: 25-43)
Miles Bane drives, Franz Bryant stays with him. Miles Bane attempts a Layup. Contested by Franz Bryant (3.8 feet, ZONE). Miles Bane misses. Rebound secured by Rudy George.

[05:50] Team_001 possession (Score: 25-43)
Franz Bryant attempts a Midrange. Contested by Lamelo O'Neal (5.0 feet, MAN). Franz Bryant misses. Rebound secured by Anfernee Sexton.

[05:32] Team_002 possession (Score: 25-43)
John Duncan drives to the basket... John Duncan loses control! Ball rolls out of bounds! TURNOVER! (dead ball)

[05:32] Substitution (Team_001): Dejounte McCollum OUT → Larry Trent IN (stamina_rule2)

[05:32] Substitution (Team_002): Miles Bane OUT → CJ Barrett IN (stamina_rule2)

[05:32] Substitution (Team_002): Jordan Green OUT → Julius Curry IN (stamina_rule2)

[05:13] Team_001 possession (Score: 25-43)
Franz Bryant commits a violation (traveling/carry)! TURNOVER! (dead ball)

[04:55] Team_002 possession (Score: 25-43)
Julius Curry makes the Layup and draws the foul on Franz Bryant! And-1! Julius Curry to the line for 1. [Team fouls: 4] (Franz Bryant: 1 personal fouls)   FT 1/1: GOOD Julius Curry makes 1/1 from the line.
Score: 25-46

[04:38] Team_001 possession (Score: 25-46)
Franz Bryant attempts a 3Pt. Contested by CJ Barrett (4.0 feet, ZONE). Franz Bryant misses. Rebound secured by Julius Curry.

[04:22] Team_002 possession (Score: 25-46)
CJ Barrett attempts a 3Pt. Contested by Ja Dosunmu (4.8 feet, ZONE). CJ Barrett misses. Rebound secured by Rudy George.

[04:09] Team_001 possession (Score: 25-46)
Ja Dosunmu throws a bad pass out of bounds! TURNOVER! (dead ball)

[03:58] Team_002 possession (Score: 25-46)
FOUL! Shooting foul on Larry Trent. Anfernee Sexton to the line for 2 free throws. [BONUS: 5 team fouls] (Larry Trent: 1 personal fouls)   FT 1/2: GOOD   FT 2/2: MISS Anfernee Sexton makes 1/2 from the line. Rebound secured by Larry Trent.
Score: 25-47

[03:48] Team_001 possession (Score: 25-47)
Franz Bryant attempts a Layup. Contested by Lamelo O'Neal (5.5 feet, ZONE). Franz Bryant misses. Rebound secured by CJ Barrett.

[03:35] Team_002 possession (Score: 25-47)
FOUL! Holding foul on Ja Dosunmu. [IN THE BONUS! 6 team fouls] John Duncan to the line for 2 free throws. (Ja Dosunmu: 1 personal fouls)   FT 1/2: GOOD   FT 2/2: GOOD John Duncan makes 2/2 from the line.
Score: 25-49

[03:24] Team_001 possession (Score: 25-49)
FOUL! Shooting foul on Anfernee Sexton. Ja Dosunmu to the line for 2 free throws. [BONUS: 7 team fouls] (Anfernee Sexton: 1 personal fouls)   FT 1/2: GOOD   FT 2/2: GOOD Ja Dosunmu makes 2/2 from the line.
Score: 27-49

[03:11] Team_002 possession (Score: 27-49)
Anfernee Sexton attempts a Midrange. Contested by Rudy George (5.6 feet, ZONE). ANFERNEE SEXTON MAKES IT! Assist: CJ Barrett
Score: 27-51

[02:54] Team_001 possession (Score: 27-51)
Ja Dosunmu attempts a 3Pt. Wide open! John Duncan is 6.3 feet away. [MAN] JA DOSUNMU MAKES IT! Assist: Rudy George
Score: 30-51

[02:35] Team_002 possession (Score: 30-51)
CJ Barrett attempts a 3Pt. Contested by Larry Trent (4.4 feet, ZONE). CJ Barrett misses. Offensive rebound by CJ Barrett! CJ Barrett kicks it out.

[02:19] Team_002 possession (Score: 30-51)
CJ Barrett drives to the basket... CJ Barrett loses control! Ball rolls out of bounds! TURNOVER! (dead ball)

[02:19] Substitution (Team_002): CJ Barrett OUT → Dirk Middleton IN (stamina_rule2)

[02:05] Team_001 possession (Score: 30-51)
Ja Dosunmu drives to the basket... Ja Dosunmu commits an offensive foul! TURNOVER! (dead ball)

[01:50] Team_002 possession (Score: 30-51)
John Duncan attempts a Midrange. Contested by Larry Trent (4.5 feet, ZONE). John Duncan misses. Rebound secured by Rudy George.

[01:37] Team_001 possession (Score: 30-51)
Larry Trent drives, Anfernee Sexton stays with him. Larry Trent attempts a Layup. Contested by Anfernee Sexton (5.4 feet, MAN). LARRY TRENT MAKES IT! Assist: Kristaps Ming
Score: 32-51

[01:24] Team_002 possession (Score: 32-51)
Anfernee Sexton attempts a Midrange. Contested by Larry Trent (4.6 feet, MAN). Anfernee Sexton misses. Rebound secured by Larry Trent.

[01:08] Team_001 possession (Score: 32-51)
Larry Trent attempts a Midrange. Contested by Anfernee Sexton (5.5 feet, MAN). LARRY TRENT MAKES IT! Assist: Franz Bryant
Score: 34-51

[00:50] Team_002 possession (Score: 34-51)
FOUL! Shooting foul on Ja Dosunmu. John Duncan to the line for 2 free throws. [BONUS: 8 team fouls] (Ja Dosunmu: 2 personal fouls)   FT 1/2: MISS   FT 2/2: GOOD John Duncan makes 1/2 from the line.
Score: 34-52

[00:38] Team_001 possession (Score: 34-52)
Franz Bryant drives, picks up Lamelo O'Neal. Help arrives from Dirk Middleton! Franz Bryant attempts a Dunk. Wide open! Dirk Middleton is 6.4 feet away. [ZONE] FRANZ BRYANT MAKES IT! Assist: Rudy George
Score: 36-52

[00:26] Team_002 possession (Score: 36-52)
Julius Curry attempts a Midrange. Contested by Franz Bryant (4.4 feet, MAN). Julius Curry misses. FOUL! Loose ball foul on Larry Trent during the rebound battle. [IN THE BONUS! 9 team fouls] Anfernee Sexton to the line for 2 free throws. (Larry Trent: 2 personal fouls)   FT 1/2: GOOD   FT 2/2: GOOD Anfernee Sexton makes 2/2 from the line.
Score: 36-54

[00:15] Team_001 possession (Score: 36-54)
Kristaps Ming attempts a 3Pt. Wide open! Lamelo O'Neal is 6.5 feet away. [MAN] KRISTAPS MING MAKES IT! Assist: Ja Dosunmu
Score: 39-54

================================================================================
                              2ND QUARTER COMPLETE                              
================================================================================

2ND QUARTER SCORE: Team_001 28, Team_002 22

BOX SCORE:
================================================================================

Team_001
--------------------------------------------------------------------------------
Player                MIN  PTS  REB  AST  TO      FG   FG%      3P   3P%
--------------------------------------------------------------------------------
Dirk Young              8    6    0    0   0   2/4    50.0     0/0   0.0
Ja Dosunmu             16    5    0    1   0   1/1   100.0     0/0   0.0
Franz Bryant            8    4    0    1   0   2/5    40.0     0/0   0.0
Larry Trent            13    4    2    0   0   2/2   100.0     0/0   0.0
Kristaps Ming          16    3    0    2   0   1/1   100.0     0/0   0.0
Cole Ball              16    2    0    0   0   1/2    50.0     0/0   0.0
Miles Griffin           8    2    1    1   0   1/1   100.0     0/0   0.0
Dejounte McCollum      12    2    2    1   0   0/0     0.0     0/0   0.0
Klay Harden             8    0    1    1   0   0/1     0.0     0/0   0.0
Rudy George            16    0    5    2   0   0/1     0.0     0/0   0.0

TEAM: FG: 10/18 (55.6%), 3PT: 3/8 (37.5%), REB: 11 (0 off, 11 def), AST: 9, TO: 3
TEAM FOULS: 0


Team_002
--------------------------------------------------------------------------------
Player                MIN  PTS  REB  AST  TO      FG   FG%      3P   3P%
--------------------------------------------------------------------------------
Jordan Green           11    5    0    0   0   2/3    66.7     0/0   0.0
Miles Bane             11    4    4    0   0   2/4    50.0     0/0   0.0
Anfernee Sexton        16    4    1    0   0   1/4    25.0     0/0   0.0
John Duncan            16    3    0    0   0   0/2     0.0     0/0   0.0
Julius Curry           13    3    1    0   0   1/1   100.0     0/0   0.0
CJ Barrett             11    0    3    1   0   0/1     0.0     0/0   0.0
Tyler Porzingis         8    0    1    2   0   0/1     0.0     0/0   0.0
Carmelo Lowry           8    0    0    1   0   0/0     0.0     0/0   0.0
Lamelo O'Neal          16    0    0    0   0   0/1     0.0     0/0   0.0

TEAM: FG: 6/17 (35.3%), 3PT: 1/5 (20.0%), REB: 10 (2 off, 8 def), AST: 4, TO: 3
TEAM FOULS: 9 [Team_001 in BONUS]

================================================================================

================================================================================
                       3RD QUARTER - Team_001 vs Team_002                       
================================================================================

[12:00] Team_001 possession (Score: 39-54)
Miles Griffin attempts a Layup. Contested by Tyler Porzingis (3.0 feet, ZONE). Miles Griffin misses. Rebound secured by Tyler Porzingis.

[11:43] Team_002 possession (Score: 39-54)
Miles Bane drives to the basket... Miles Bane throws a bad pass out of bounds! TURNOVER! (dead ball)

[11:24] Team_001 possession (Score: 39-54)
Dirk Young drives, CJ Barrett stays with him. Dirk Young attempts a Dunk. Contested by CJ Barrett (3.8 feet, MAN). DIRK YOUNG MAKES IT! Assist: Dejounte McCollum
Score: 41-54

[11:10] Team_002 possession (Score: 41-54)
Miles Bane makes the Layup and draws the foul on Klay Harden! And-1! Miles Bane to the line for 1. [Team fouls: 1] (Klay Harden: 1 personal fouls)   FT 1/1: GOOD Miles Bane makes 1/1 from the line.
Score: 41-57

[11:00] Team_001 possession (Score: 41-57)
Cole Ball attempts a Layup. BLOCKED BY JORDAN GREEN! Rebound secured by Tyler Porzingis.

[10:50] Team_002 possession (Score: 41-57)
Tyler Porzingis makes the Layup and draws the foul on Miles Griffin! And-1! Tyler Porzingis to the line for 1. [Team fouls: 2] (Miles Griffin: 1 personal fouls)   FT 1/1: GOOD Tyler Porzingis makes 1/1 from the line.
Score: 41-60

[10:34] Team_001 possession (Score: 41-60)
Klay Harden throws a bad pass! Stolen by Miles Bane! TURNOVER! (live ball)

[10:19] Team_002 possession (Score: 41-60)
Tyler Porzingis drives to the basket... Tyler Porzingis throws a bad pass! Stolen by Miles Griffin! TURNOVER! (live ball)

[10:03] Team_001 possession (Score: 41-60)
Klay Harden drives, Miles Bane stays with him. Klay Harden attempts a Dunk. Contested by Miles Bane (4.5 feet, MAN). KLAY HARDEN MAKES IT!
Score: 43-60

[09:47] Team_002 possession (Score: 43-60)
Jordan Green attempts a 3Pt. Contested by Cole Ball (2.8 feet, MAN). Jordan Green misses. Rebound secured by Miles Griffin.

[09:31] Team_001 possession (Score: 43-60)
Dejounte McCollum attempts a Midrange. Contested by Carmelo Lowry (3.6 feet, MAN). Dejounte McCollum misses. Rebound secured by Miles Bane.

[09:17] Team_002 possession (Score: 43-60)
CJ Barrett drives, picks up Dirk Young. Help arrives from Cole Ball! CJ Barrett attempts a Dunk. Contested by Cole Ball (3.8 feet, MAN). CJ Barrett misses. Rebound secured by Dejounte McCollum.

[09:04] Team_001 possession (Score: 43-60)
FOUL! Shooting foul on Tyler Porzingis. Miles Griffin to the line for 2 free throws. [Team fouls: 3] (Tyler Porzingis: 1 personal fouls)   FT 1/2: GOOD   FT 2/2: GOOD Miles Griffin makes 2/2 from the line.
Score: 45-60

[08:49] Team_002 possession (Score: 45-60)
Miles Bane throws a bad pass! Stolen by Klay Harden! TURNOVER! (live ball)

[08:35] Team_001 possession (Score: 45-60)
Dirk Young attempts a 3Pt. Contested by CJ Barrett (3.8 feet, ZONE). Dirk Young misses. Rebound secured by Miles Bane.

[08:25] Team_002 possession (Score: 45-60)
CJ Barrett attempts a 3Pt. Contested by Dirk Young (3.8 feet, MAN). CJ Barrett misses. Rebound secured by Dejounte McCollum.

[08:15] Team_001 possession (Score: 45-60)
Cole Ball commits a violation (traveling/carry)! TURNOVER! (dead ball)

[08:02] Team_002 possession (Score: 45-60)
FOUL! Shooting foul on Miles Griffin. Tyler Porzingis to the line for 2 free throws. [Team fouls: 4] (Miles Griffin: 2 personal fouls)   FT 1/2: GOOD   FT 2/2: GOOD Tyler Porzingis makes 2/2 from the line.
Score: 45-62

[07:50] Team_001 possession (Score: 45-62)
Miles Griffin attempts a Layup. Contested by Tyler Porzingis (3.0 feet, MAN). MILES GRIFFIN MAKES IT!
Score: 47-62

[07:39] Team_002 possession (Score: 47-62)
Miles Bane attempts a 3Pt. Contested by Klay Harden (3.3 feet, MAN). Miles Bane misses. Rebound secured by Dejounte McCollum.

[07:24] Team_001 possession (Score: 47-62)
Klay Harden attempts a 3Pt. Contested by Miles Bane (4.5 feet, MAN). Klay Harden misses. Rebound secured by Tyler Porzingis.

[07:08] Team_002 possession (Score: 47-62)
Miles Bane attempts a 3Pt. Contested by Klay Harden (3.3 feet, MAN). Miles Bane misses. Rebound secured by Cole Ball.

[06:57] Team_001 possession (Score: 47-62)
Klay Harden attempts a 3Pt. Contested by Miles Bane (4.5 feet, MAN). Klay Harden misses. Offensive rebound by Cole Ball! Cole Ball kicks it out.

[06:47] Team_001 possession (Score: 47-62)
Klay Harden throws a bad pass out of bounds! TURNOVER! (dead ball)

[06:34] Team_002 possession (Score: 47-62)
FOUL! Reach-in foul on Dirk Young during the drive. [IN THE BONUS! 5 team fouls] CJ Barrett to the line for 2 free throws. (Dirk Young: 1 personal fouls)   FT 1/2: GOOD   FT 2/2: GOOD CJ Barrett makes 2/2 from the line.
Score: 47-64

[06:19] Team_001 possession (Score: 47-64)
Dirk Young attempts a 3Pt. Contested by CJ Barrett (3.8 feet, ZONE). Dirk Young misses. FOUL! Loose ball foul on Carmelo Lowry during the rebound battle. [IN THE BONUS! 6 team fouls] Miles Griffin to the line for 2 free throws. (Carmelo Lowry: 1 personal fouls)   FT 1/2: GOOD   FT 2/2: GOOD Miles Griffin makes 2/2 from the line.
Score: 49-64

[06:02] Team_002 possession (Score: 49-64)
Miles Bane attempts a 3Pt. Contested by Klay Harden (3.4 feet, MAN). Miles Bane misses. Rebound secured by Cole Ball.

[05:50] Team_001 possession (Score: 49-64)
Dirk Young attempts a 3Pt. Contested by CJ Barrett (3.8 feet, ZONE). DIRK YOUNG MAKES IT! Assist: Klay Harden
Score: 52-64

[05:33] Team_002 possession (Score: 52-64)
CJ Barrett drives, picks up Dirk Young. Help arrives from Cole Ball! CJ Barrett attempts a Dunk. Contested by Cole Ball (3.8 feet, MAN). CJ Barrett misses. Offensive rebound by Tyler Porzingis! Tyler Porzingis puts it back in!
Score: 52-66

[05:20] Team_001 possession (Score: 52-66)
FOUL! Reach-in foul on CJ Barrett during the drive. [IN THE BONUS! 7 team fouls] Dirk Young to the line for 2 free throws. (CJ Barrett: 1 personal fouls)   FT 1/2: GOOD   FT 2/2: MISS Dirk Young makes 1/2 from the line. Rebound secured by Tyler Porzingis.
Score: 53-66

[05:09] Team_002 possession (Score: 53-66)
CJ Barrett drives to the basket... CJ Barrett loses the ball! Stripped by Dirk Young! TURNOVER! (live ball)

[04:57] Team_001 possession (Score: 53-66)
Klay Harden drives, picks up Miles Bane. Help arrives from CJ Barrett! Klay Harden attempts a Dunk. Contested by CJ Barrett (4.6 feet, MAN). KLAY HARDEN MAKES IT! Assist: Miles Griffin
Score: 55-66

[04:47] Team_002 possession (Score: 55-66)
Miles Bane attempts a 3Pt. Contested by Klay Harden (3.6 feet, MAN). Miles Bane misses. Rebound secured by Dejounte McCollum.

[04:32] Team_001 possession (Score: 55-66)
Dirk Young attempts a 3Pt. Contested by CJ Barrett (4.0 feet, ZONE). DIRK YOUNG MAKES IT! Assist: Dejounte McCollum
Score: 58-66

[04:19] Team_002 possession (Score: 58-66)
FOUL! Holding foul on Cole Ball. [IN THE BONUS! 8 team fouls] Jordan Green to the line for 2 free throws. (Cole Ball: 1 personal fouls)   FT 1/2: MISS   FT 2/2: GOOD Jordan Green makes 1/2 from the line.
Score: 58-67

[04:06] Team_001 possession (Score: 58-67)
Miles Griffin attempts a Layup. Contested by Tyler Porzingis (3.3 feet, MAN). Miles Griffin misses. Offensive rebound by Cole Ball! Cole Ball kicks it out.

[03:51] Team_001 possession (Score: 58-67)
FOUL! Reach-in foul on Tyler Porzingis during the drive. [IN THE BONUS! 9 team fouls] Miles Griffin to the line for 2 free throws. (Tyler Porzingis: 2 personal fouls)   FT 1/2: GOOD   FT 2/2: GOOD Miles Griffin makes 2/2 from the line.
Score: 60-67

[03:33] Team_002 possession (Score: 60-67)
Miles Bane attempts a Midrange. Contested by Klay Harden (3.8 feet, MAN). MILES BANE MAKES IT!
Score: 60-69

[03:23] Team_001 possession (Score: 60-69)
Dirk Young drives and kicks out. Dirk Young attempts a Midrange. Contested by CJ Barrett (4.1 feet, MAN). DIRK YOUNG MAKES IT!
Score: 62-69

[03:07] Team_002 possession (Score: 62-69)
Jordan Green attempts a 3Pt. Contested by Cole Ball (3.1 feet, MAN). JORDAN GREEN MAKES IT!
Score: 62-72

[02:53] Team_001 possession (Score: 62-72)
Miles Griffin attempts a Layup. Contested by Tyler Porzingis (3.4 feet, MAN). MILES GRIFFIN MAKES IT! Assist: Dirk Young
Score: 64-72

[02:38] Team_002 possession (Score: 64-72)
Carmelo Lowry attempts a 3Pt. Contested by Klay Harden (3.9 feet, ZONE). Carmelo Lowry misses. Rebound secured by Miles Griffin.

[02:28] Team_001 possession (Score: 64-72)
Klay Harden drives, Miles Bane stays with him. Klay Harden attempts a Layup. Contested by Miles Bane (4.8 feet, MAN). Klay Harden misses. Rebound secured by Miles Bane.

[02:15] Team_002 possession (Score: 64-72)
Tyler Porzingis attempts a Midrange. Contested by Miles Griffin (4.2 feet, MAN). Tyler Porzingis misses. Offensive rebound by Carmelo Lowry! Carmelo Lowry kicks it out.

[02:01] Team_002 possession (Score: 64-72)
Tyler Porzingis drives and kicks out. Tyler Porzingis attempts a 3Pt. Contested by Klay Harden (4.1 feet, ZONE). TYLER PORZINGIS MAKES IT! Assist: Carmelo Lowry
Score: 64-75

[01:46] Team_001 possession (Score: 64-75)
Cole Ball attempts a 3Pt. Contested by Jordan Green (4.3 feet, MAN). Cole Ball misses. Rebound secured by Tyler Porzingis.

[01:34] Team_002 possession (Score: 64-75)
Tyler Porzingis attempts a Layup. Contested by Miles Griffin (4.3 feet, MAN). TYLER PORZINGIS MAKES IT! Assist: Miles Bane
Score: 64-77

[01:14] Team_001 possession (Score: 64-77)
Cole Ball makes the Dunk and draws the foul on Jordan Green! And-1! Cole Ball to the line for 1. [BONUS: 10 team fouls] (Jordan Green: 1 personal fouls)   FT 1/1: GOOD Cole Ball makes 1/1 from the line.
Score: 67-77

[00:59] Team_002 possession (Score: 67-77)
FOUL! Shooting foul on Miles Griffin. Miles Bane to the line for 2 free throws. [BONUS: 11 team fouls] (Miles Griffin: 3 personal fouls)   FT 1/2: MISS   FT 2/2: GOOD Miles Bane makes 1/2 from the line.
Score: 67-78

[00:45] Team_001 possession (Score: 67-78)
Cole Ball attempts a 3Pt. Contested by Jordan Green (4.4 feet, ZONE). COLE BALL MAKES IT! Assist: Dirk Young
Score: 70-78

[00:34] Team_002 possession (Score: 70-78)
Carmelo Lowry attempts a 3Pt. Contested by Dejounte McCollum (4.3 feet, MAN). Carmelo Lowry misses. Rebound secured by Dejounte McCollum.

[00:20] Team_001 possession (Score: 70-78)
Dejounte McCollum makes the Layup and draws the foul on Tyler Porzingis! And-1! Dejounte McCollum to the line for 1. [BONUS: 12 team fouls] (Tyler Porzingis: 3 personal fouls)   FT 1/1: GOOD Dejounte McCollum makes 1/1 from the line.
Score: 73-78

[00:03] Team_002 possession (Score: 73-78)
FOUL! Shooting foul on Klay Harden. Miles Bane to the line for 3 free throws. [BONUS: 13 team fouls] (Klay Harden: 2 personal fouls)   FT 1/3: MISS   FT 2/3: MISS   FT 3/3: GOOD Miles Bane makes 1/3 from the line.
Score: 73-79

================================================================================
                              3RD QUARTER COMPLETE                              
================================================================================

3RD QUARTER SCORE: Team_001 34, Team_002 25

BOX SCORE:
================================================================================

Team_001
--------------------------------------------------------------------------------
Player                MIN  PTS  REB  AST  TO      FG   FG%      3P   3P%
--------------------------------------------------------------------------------
Miles Griffin          20   10    2    1   0   2/3    66.7     0/0   0.0
Dirk Young             20   10    0    2   0   4/6    66.7     0/0   0.0
Cole Ball              28    6    4    0   0   2/4    50.0     0/0   0.0
Klay Harden            20    4    0    1   0   2/4    50.0     0/0   0.0
Dejounte McCollum      24    3    5    2   0   1/2    50.0     0/0   0.0

TEAM: FG: 11/19 (57.9%), 3PT: 3/6 (50.0%), REB: 11 (2 off, 9 def), AST: 6, TO: 3
TEAM FOULS: 0


Team_002
--------------------------------------------------------------------------------
Player                MIN  PTS  REB  AST  TO      FG   FG%      3P   3P%
--------------------------------------------------------------------------------
Tyler Porzingis        20   12    6    0   0   4/4   100.0     0/0   0.0
Miles Bane             23    7    3    1   0   2/6    33.3     0/0   0.0
Jordan Green           23    4    0    0   0   1/2    50.0     0/0   0.0
CJ Barrett             24    2    0    0   0   0/2     0.0     0/0   0.0
Carmelo Lowry          20    0    1    1   0   0/2     0.0     0/0   0.0

TEAM: FG: 7/16 (43.8%), 3PT: 1/9 (11.1%), REB: 10 (2 off, 8 def), AST: 2, TO: 4
TEAM FOULS: 13 [Team_001 in BONUS]

================================================================================

================================================================================
                       4TH QUARTER - Team_001 vs Team_002                       
================================================================================

[12:00] Team_001 possession (Score: 73-79)
Miles Griffin attempts a Midrange. Contested by Tyler Porzingis (3.5 feet, MAN). Miles Griffin misses. Rebound secured by Carmelo Lowry.

[11:48] Team_002 possession (Score: 73-79)
Tyler Porzingis attempts a Layup. Contested by Miles Griffin (4.3 feet, ZONE). TYLER PORZINGIS MAKES IT!
Score: 73-81

[11:34] Team_001 possession (Score: 73-81)
Cole Ball attempts a 3Pt. Contested by Jordan Green (4.3 feet, MAN). COLE BALL MAKES IT! Assist: Miles Griffin
Score: 76-81

[11:18] Team_002 possession (Score: 76-81)
Miles Bane attempts a Midrange. Contested by Dejounte McCollum (4.1 feet, ZONE). MILES BANE MAKES IT!
Score: 76-83

[11:03] Team_001 possession (Score: 76-83)
Klay Harden attempts a 3Pt. Contested by Miles Bane (5.0 feet, ZONE). Klay Harden misses. Rebound secured by Miles Bane.

[10:45] Team_002 possession (Score: 76-83)
Carmelo Lowry drives, picks up Dejounte McCollum. Help arrives from Klay Harden! Carmelo Lowry attempts a Layup. Contested by Klay Harden (4.2 feet, MAN). CARMELO LOWRY MAKES IT!
Score: 76-85

[10:34] Team_001 possession (Score: 76-85)
Dirk Young attempts a 3Pt. Contested by Miles Bane (5.1 feet, ZONE). Dirk Young misses. Rebound secured by Carmelo Lowry.

[10:17] Team_002 possession (Score: 76-85)
Miles Bane drives to the basket... Miles Bane loses control! Ball rolls out of bounds! TURNOVER! (dead ball)

[10:17] Substitution (Team_001): Klay Harden OUT → Ja Dosunmu IN (stamina_rule2)

[10:17] Substitution (Team_001): Dirk Young OUT → Rudy George IN (stamina_rule2)

[10:17] Substitution (Team_001): Cole Ball OUT → Larry Trent IN (stamina_rule2)

[10:17] Substitution (Team_001): Dejounte McCollum OUT → Franz Bryant IN (stamina_rule2)

[10:17] Substitution (Team_001): Miles Griffin OUT → Kristaps Ming IN (stamina_rule2)

[10:17] Substitution (Team_002): Miles Bane OUT → John Duncan IN (stamina_rule2)

[10:17] Substitution (Team_002): CJ Barrett OUT → Dirk Middleton IN (stamina_rule2)

[10:17] Substitution (Team_002): Jordan Green OUT → Anfernee Sexton IN (stamina_rule2)

[10:17] Substitution (Team_002): Carmelo Lowry OUT → Julius Curry IN (stamina_rule2)

[10:17] Substitution (Team_002): Tyler Porzingis OUT → Lamelo O'Neal IN (stamina_rule2)

[10:06] Team_001 possession (Score: 76-85)
Kristaps Ming drives and kicks out. Franz Bryant attempts a 3Pt. Contested by Lamelo O'Neal (3.0 feet, MAN). FRANZ BRYANT MAKES IT!
Score: 79-85

[09:54] Team_002 possession (Score: 79-85)
Julius Curry attempts a 3Pt. Contested by Rudy George (4.7 feet, ZONE). Julius Curry misses. Rebound secured by Larry Trent.

[09:36] Team_001 possession (Score: 79-85)
Rudy George attempts a Midrange. Contested by Dirk Middleton (5.9 feet, MAN). Rudy George misses. Rebound secured by Anfernee Sexton.

[09:27] Team_002 possession (Score: 79-85)
Lamelo O'Neal throws a bad pass! Stolen by Kristaps Ming! TURNOVER! (live ball)

[09:12] Team_001 possession (Score: 79-85)
Rudy George attempts a 3Pt. Contested by Julius Curry (5.4 feet, ZONE). Rudy George misses. Rebound secured by Julius Curry.

[09:02] Team_002 possession (Score: 79-85)
Anfernee Sexton attempts a 3Pt. Contested by Larry Trent (3.9 feet, MAN). ANFERNEE SEXTON MAKES IT! Assist: John Duncan
Score: 79-88

[08:49] Team_001 possession (Score: 79-88)
Kristaps Ming commits an offensive foul! Lamelo O'Neal drew the charge! TURNOVER! (dead ball)

[08:36] Team_002 possession (Score: 79-88)
Lamelo O'Neal drives, Kristaps Ming stays with him. Lamelo O'Neal attempts a Dunk. Contested by Kristaps Ming (5.6 feet, MAN). LAMELO O'NEAL MAKES IT! Assist: Julius Curry
Score: 79-90

[08:20] Team_001 possession (Score: 79-90)
Ja Dosunmu attempts a Layup. Contested by John Duncan (5.5 feet, MAN). Ja Dosunmu misses. Offensive rebound by Kristaps Ming! Kristaps Ming kicks it out.

[08:05] Team_001 possession (Score: 79-90)
FOUL! Reach-in foul on Lamelo O'Neal during the drive. [Team fouls: 1] No free throws, side out. (Lamelo O'Neal: 1 personal fouls)

[07:53] Team_002 possession (Score: 79-90)
John Duncan attempts a Layup. BLOCKED BY FRANZ BRYANT! Ball goes out of bounds. Turnover!

[07:39] Team_001 possession (Score: 79-90)
Franz Bryant attempts a Midrange. Contested by Lamelo O'Neal (3.0 feet, MAN). FRANZ BRYANT MAKES IT!
Score: 81-90

[07:23] Team_002 possession (Score: 81-90)
Lamelo O'Neal drives, Franz Bryant stays with him. Lamelo O'Neal attempts a Layup. Contested by Franz Bryant (3.8 feet, ZONE). Lamelo O'Neal misses. Rebound secured by Rudy George.

[07:07] Team_001 possession (Score: 81-90)
Kristaps Ming drives and kicks out. Ja Dosunmu attempts a 3Pt. Contested by John Duncan (5.5 feet, MAN). JA DOSUNMU MAKES IT! Assist: Rudy George
Score: 84-90

[06:57] Team_002 possession (Score: 84-90)
Lamelo O'Neal attempts a 3Pt. Contested by Ja Dosunmu (3.5 feet, ZONE). Lamelo O'Neal misses. Rebound secured by Rudy George.

[06:40] Team_001 possession (Score: 84-90)
Franz Bryant drives to the basket... Franz Bryant throws a bad pass out of bounds! TURNOVER! (dead ball)

[06:24] Team_002 possession (Score: 84-90)
Julius Curry attempts a 3Pt. Contested by Ja Dosunmu (3.5 feet, ZONE). Julius Curry misses. Rebound secured by Kristaps Ming.

[06:14] Team_001 possession (Score: 84-90)
FOUL! Holding foul on Lamelo O'Neal. [Team fouls: 2] No free throws, side out. (Lamelo O'Neal: 2 personal fouls)

[05:58] Team_002 possession (Score: 84-90)
Anfernee Sexton attempts a 3Pt. Contested by Larry Trent (3.9 feet, MAN). Anfernee Sexton misses. Rebound secured by Rudy George.

[05:43] Team_001 possession (Score: 84-90)
Larry Trent attempts a 3Pt. Contested by Anfernee Sexton (4.4 feet, MAN). Larry Trent misses. Offensive rebound by Rudy George! Rudy George kicks it out.

[05:27] Team_001 possession (Score: 84-90)
Rudy George attempts a 3Pt. Contested by Dirk Middleton (5.9 feet, MAN). RUDY GEORGE MAKES IT! Assist: Ja Dosunmu
Score: 87-90

[05:12] Team_002 possession (Score: 87-90)
Dirk Middleton drives and kicks out. Anfernee Sexton attempts a 3Pt. Contested by Larry Trent (3.9 feet, MAN). Anfernee Sexton misses. Rebound secured by Rudy George.

[04:56] Team_001 possession (Score: 87-90)
Larry Trent attempts a Midrange. Contested by Anfernee Sexton (4.4 feet, MAN). Larry Trent misses. Rebound secured by Anfernee Sexton.

[04:45] Team_002 possession (Score: 87-90)
John Duncan attempts a 3Pt. Contested by Ja Dosunmu (3.5 feet, MAN). John Duncan misses. Rebound secured by Larry Trent.

[04:34] Team_001 possession (Score: 87-90)
Rudy George attempts a 3Pt. Contested by Dirk Middleton (5.9 feet, MAN). Rudy George misses. Rebound secured by Julius Curry.

[04:23] Team_002 possession (Score: 87-90)
Lamelo O'Neal commits an offensive foul! Kristaps Ming drew the charge! TURNOVER! (dead ball)

[04:09] Team_001 possession (Score: 87-90)
Ja Dosunmu commits a violation (traveling/carry)! TURNOVER! (dead ball)

[03:54] Team_002 possession (Score: 87-90)
Dirk Middleton drives, picks up Rudy George. Help arrives from Larry Trent! Dirk Middleton attempts a Layup. Contested by Larry Trent (4.7 feet, MAN). DIRK MIDDLETON MAKES IT! Assist: John Duncan
Score: 87-92

[03:37] Team_001 possession (Score: 87-92)
Larry Trent attempts a 3Pt. Contested by Anfernee Sexton (4.4 feet, MAN). LARRY TRENT MAKES IT! Assist: Rudy George
Score: 90-92

[03:19] Team_002 possession (Score: 90-92)
Lamelo O'Neal throws a bad pass! Stolen by Kristaps Ming! TURNOVER! (live ball)

[03:05] Team_001 possession (Score: 90-92)
Larry Trent attempts a 3Pt. Contested by Julius Curry (5.4 feet, ZONE). Larry Trent misses. Rebound secured by Lamelo O'Neal.

[02:50] Team_002 possession (Score: 90-92)
John Duncan attempts a Layup. Contested by Ja Dosunmu (3.6 feet, MAN). JOHN DUNCAN MAKES IT! Assist: Dirk Middleton
Score: 90-94

[02:36] Team_001 possession (Score: 90-94)
Larry Trent attempts a 3Pt. Contested by Julius Curry (5.4 feet, ZONE). LARRY TRENT MAKES IT! Assist: Franz Bryant
Score: 93-94

[02:23] Team_002 possession (Score: 93-94)
Julius Curry makes the Midrange and draws the foul on Franz Bryant! And-1! Julius Curry to the line for 1. [Team fouls: 3] (Franz Bryant: 1 personal fouls)   FT 1/1: GOOD Julius Curry makes 1/1 from the line.
Score: 93-97

[02:10] Team_001 possession (Score: 93-97)
Ja Dosunmu attempts a Midrange. Contested by John Duncan (5.6 feet, MAN). JA DOSUNMU MAKES IT!
Score: 95-97

[01:55] Team_002 possession (Score: 95-97)
Julius Curry makes the Layup and draws the foul on Franz Bryant! And-1! Julius Curry to the line for 1. [Team fouls: 4] (Franz Bryant: 2 personal fouls)   FT 1/1: GOOD Julius Curry makes 1/1 from the line.
Score: 95-100

[01:41] Team_001 possession (Score: 95-100)
Franz Bryant attempts a 3Pt. Contested by Julius Curry (5.5 feet, MAN). Franz Bryant misses. Rebound secured by Anfernee Sexton.

[01:24] Team_002 possession (Score: 95-100)
Lamelo O'Neal drives and kicks out. Anfernee Sexton attempts a 3Pt. Contested by Larry Trent (4.1 feet, MAN). Anfernee Sexton misses. Rebound secured by Kristaps Ming.

[01:11] Team_001 possession (Score: 95-100)
Franz Bryant drives to the basket... Franz Bryant throws a bad pass! Stolen by Lamelo O'Neal! TURNOVER! (live ball)

[00:54] Team_002 possession (Score: 95-100)
John Duncan attempts a 3Pt. Contested by Ja Dosunmu (3.8 feet, MAN). JOHN DUNCAN MAKES IT! Assist: Anfernee Sexton
Score: 95-103

[00:42] Team_001 possession (Score: 95-103)
Rudy George attempts a 3Pt. Wide open! Dirk Middleton is 6.2 feet away. [MAN] RUDY GEORGE MAKES IT! Assist: Franz Bryant
Score: 98-103

[00:24] Team_002 possession (Score: 98-103)
John Duncan makes the Dunk and draws the foul on Ja Dosunmu! And-1! John Duncan to the line for 1. [BONUS: 5 team fouls] (Ja Dosunmu: 1 personal fouls)   FT 1/1: GOOD John Duncan makes 1/1 from the line.
Score: 98-106

[00:04] Team_001 possession (Score: 98-106)
Franz Bryant makes the Layup and draws the foul on Julius Curry! And-1! Franz Bryant to the line for 1. [BONUS: 6 team fouls] (Julius Curry: 1 personal fouls)   FT 1/1: GOOD Franz Bryant makes 1/1 from the line.
Score: 101-106

================================================================================
                              4TH QUARTER COMPLETE                              
================================================================================

4TH QUARTER SCORE: Team_001 28, Team_002 27

BOX SCORE:
================================================================================

Team_001
--------------------------------------------------------------------------------
Player                MIN  PTS  REB  AST  TO      FG   FG%      3P   3P%
--------------------------------------------------------------------------------
Franz Bryant           18    8    0    2   0   3/4    75.0     0/0   0.0
Larry Trent            24    6    2    0   0   2/4    50.0     0/0   0.0
Rudy George            26    6    5    2   0   2/5    40.0     0/0   0.0
Ja Dosunmu             26    5    0    1   0   2/2   100.0     0/0   0.0
Cole Ball              30    3    0    0   0   1/1   100.0     0/0   0.0
Miles Griffin          22    0    0    1   0   0/1     0.0     0/0   0.0
Klay Harden            22    0    0    0   0   0/1     0.0     0/0   0.0
Dirk Young             22    0    0    0   0   0/1     0.0     0/0   0.0
Kristaps Ming          26    0    3    0   0   0/0     0.0     0/0   0.0

TEAM: FG: 10/19 (52.6%), 3PT: 5/11 (45.5%), REB: 10 (2 off, 8 def), AST: 6, TO: 4
TEAM FOULS: 0


Team_002
--------------------------------------------------------------------------------
Player                MIN  PTS  REB  AST  TO      FG   FG%      3P   3P%
--------------------------------------------------------------------------------
John Duncan            26    8    0    2   0   3/4    75.0     0/0   0.0
Julius Curry           24    6    2    1   0   2/4    50.0     0/0   0.0
Anfernee Sexton        26    3    3    1   0   1/2    50.0     0/0   0.0
Carmelo Lowry          22    2    2    0   0   1/1   100.0     0/0   0.0
Tyler Porzingis        22    2    0    0   0   1/1   100.0     0/0   0.0
Miles Bane             25    2    1    0   0   1/1   100.0     0/0   0.0
Lamelo O'Neal          26    2    1    0   0   1/4    25.0     0/0   0.0
Dirk Middleton         20    2    0    1   0   1/2    50.0     0/0   0.0

TEAM: FG: 11/19 (57.9%), 3PT: 2/7 (28.6%), REB: 9 (0 off, 9 def), AST: 5, TO: 5
TEAM FOULS: 6 [Team_001 in BONUS]

================================================================================

================================================================================
                               FULL GAME COMPLETE                               
================================================================================

FINAL SCORE: Team_001 101, Team_002 106

SCORING BY QUARTER:
--------------------------------------------------------------------------------
Team                     Q1     Q2     Q3     Q4    FINAL
--------------------------------------------------------------------------------
Team_001                 11     28     34     28      101
Team_002                 32     22     25     27      106
--------------------------------------------------------------------------------

FULL GAME BOX SCORE:
================================================================================

Team_001
--------------------------------------------------------------------------------
Player                MIN  PTS  REB  AST  TO      FG   FG%      3P   3P%      FT STL BLK
--------------------------------------------------------------------------------
Cole Ball              30   11    8    1   1   5/12   41.7   2/5    40.0   1/1     1   0
Ja Dosunmu             26   10    0    2   2   2/4    50.0   1/3    33.3   2/2     1   0
Rudy George            26   10   11    5   1   4/8    50.0   2/5    40.0   0/0     0   0
Kristaps Ming          26    3    3    2   4   3/8    37.5   1/4    25.0   0/0     2   0
Dejounte McCollum      26    7   10    3   1   2/4    50.0   0/0     0.0   3/3     0   0
Larry Trent            24   13    5    0   2   5/8    62.5   3/4    75.0   0/0     0   0
Klay Harden            22    6    1    3   2   3/7    42.9   0/3     0.0   0/0     1   0
Dirk Young             22   16    0    2   1   5/12   41.7   3/9    33.3   0/0     1   0
Miles Griffin          22   12    3    3   0   3/5    60.0   0/0     0.0   4/6     1   0
Franz Bryant           18   12    0    3   1   4/8    50.0   0/2     0.0   1/1     0   1

TEAM: FG: 36/76 (47.4%), 3PT: 12/35 (34.3%), REB: 41 (5 off, 36 def), AST: 24, TO: 15


Team_002
--------------------------------------------------------------------------------
Player                MIN  PTS  REB  AST  TO      FG   FG%      3P   3P%      FT STL BLK
--------------------------------------------------------------------------------
John Duncan            26   19    2    2   1   6/10   60.0   3/5    60.0   4/5     0   0
Anfernee Sexton        26   13    8    3   1   4/8    50.0   1/3    33.3   2/4     0   0
Lamelo O'Neal          26    2    3    2   5   1/5    20.0   0/1     0.0   0/0     1   0
CJ Barrett             26    2    4    1   1   1/4    25.0   0/2     0.0   2/2     1   1
Miles Bane             25   16   10    1   2   6/13   46.2   0/5     0.0   4/7     1   0
Jordan Green           25    9    0    0   1   3/6    50.0   2/5    40.0   1/2     0   1
Julius Curry           24   13    6    1   0   3/6    50.0   0/2     0.0   5/7     0   0
Carmelo Lowry          22    5    3    3   1   2/4    50.0   0/2     0.0   1/1     0   0
Tyler Porzingis        22   19    9    2   1   6/7    85.7   0/0     0.0   4/4     0   0
Dirk Middleton         20    5    0    2   1   2/7    28.6   1/3    33.3   0/0     0   0

TEAM: FG: 34/70 (48.6%), 3PT: 7/28 (25.0%), REB: 45 (5 off, 40 def), AST: 17, TO: 14

================================================================================
