================================================================================
                        FULL GAME - Team_001 vs Team_002                        
================================================================================

================================================================================
                       1ST QUARTER - Team_001 vs Team_002                       
================================================================================

[12:00] Team_001 possession (Score: 0-0)
Cole Ball attempts a 3Pt. Contested by Jordan Green (4.0 feet, MAN). Cole Ball misses. Offensive rebound by Cole Ball! Cole Ball kicks it out.

[11:50] Team_001 possession (Score: 0-0)
Klay Harden attempts a 3Pt. Contested by Miles Bane (4.7 feet, MAN). Klay Harden misses. Rebound secured by Miles Bane.

[11:31] Team_002 possession (Score: 0-0)
CJ Barrett drives to the basket... CJ Barrett commits an offensive foul! TURNOVER! (dead ball)

[11:17] Team_001 possession (Score: 0-0)
Miles Griffin drives to the basket... Miles Griffin throws a bad pass! Stolen by Tyler Porzingis! TURNOVER! (live ball)

[11:03] Team_002 possession (Score: 0-0)
Tyler Porzingis attempts a 3Pt. BLOCKED BY MILES GRIFFIN! Rebound secured by Cole Ball.

[10:47] Team_001 possession (Score: 0-0)
Klay Harden attempts a 3Pt. Contested by Miles Bane (4.8 feet, MAN). KLAY HARDEN MAKES IT! Assist: Dirk Young
Score: 3-0

[10:35] Team_002 possession (Score: 3-0)
Jordan Green attempts a 3Pt. Contested by Cole Ball (3.1 feet, MAN). JORDAN GREEN MAKES IT! Assist: Carmelo Lowry
Score: 3-3

[10:20] Team_001 possession (Score: 3-3)
Dirk Young attempts a 3Pt. Contested by CJ Barrett (4.4 feet, MAN). Dirk Young misses. Offensive rebound by Dejounte McCollum! Dejounte McCollum kicks it out.

[10:04] Team_001 possession (Score: 3-3)
Dirk Young attempts a 3Pt. Contested by CJ Barrett (4.4 feet, MAN). Dirk Young misses. Rebound secured by Tyler Porzingis.

[09:49] Team_002 possession (Score: 3-3)
Miles Bane makes the Midrange and draws the foul on Dejounte McCollum! And-1! Miles Bane to the line for 1. [Team fouls: 1] (Dejounte McCollum: 1 personal fouls)   FT 1/1: GOOD Miles Bane makes 1/1 from the line.
Score: 3-6

[09:33] Team_001 possession (Score: 3-6)
Klay Harden attempts a Layup. Contested by Tyler Porzingis (4.6 feet, ZONE). Klay Harden misses. Rebound secured by Tyler Porzingis.

[09:20] Team_002 possession (Score: 3-6)
Tyler Porzingis attempts a Midrange. Contested by Miles Griffin (5.4 feet, MAN). Tyler Porzingis misses. Rebound secured by Miles Griffin.

[09:06] Team_001 possession (Score: 3-6)
Dirk Young drives and kicks out. Cole Ball attempts a 3Pt. Contested by Jordan Green (4.4 feet, MAN). COLE BALL MAKES IT! Assist: Dirk Young
Score: 6-6

[08:51] Team_002 possession (Score: 6-6)
Miles Bane drives and kicks out. Jordan Green attempts a 3Pt. Contested by Cole Ball (3.3 feet, MAN). Jordan Green misses. Offensive rebound by CJ Barrett! CJ Barrett kicks it out.

[08:39] Team_002 possession (Score: 6-6)
Tyler Porzingis drives and kicks out. Jordan Green attempts a 3Pt. Contested by Cole Ball (3.3 feet, MAN). JORDAN GREEN MAKES IT! Assist: Miles Bane
Score: 6-9

[08:24] Team_001 possession (Score: 6-9)
FOUL! Reach-in foul on Carmelo Lowry during the drive. [Team fouls: 2] No free throws, side out. (Carmelo Lowry: 1 personal fouls)

[08:13] Team_002 possession (Score: 6-9)
FOUL! Shooting foul on Dirk Young. Carmelo Lowry to the line for 2 free throws. [Team fouls: 3] (Dirk Young: 1 personal fouls)   FT 1/2: GOOD   FT 2/2: GOOD Carmelo Lowry makes 2/2 from the line.
Score: 6-11

[07:57] Team_001 possession (Score: 6-11)
Miles Griffin attempts a 3Pt. Contested by Miles Bane (5.2 feet, ZONE). Miles Griffin misses. Rebound secured by Miles Bane.

[07:43] Team_002 possession (Score: 6-11)
Carmelo Lowry attempts a 3Pt. Contested by Dejounte McCollum (4.2 feet, MAN). Carmelo Lowry misses. Rebound secured by Miles Griffin.

[07:29] Team_001 possession (Score: 6-11)
Dirk Young attempts a Midrange. BLOCKED BY CJ BARRETT! Rebound secured by CJ Barrett.

[07:10] Team_002 possession (Score: 6-11)
Miles Bane drives and kicks out. CJ Barrett attempts a Midrange. Contested by Dirk Young (5.2 feet, MAN). CJ BARRETT MAKES IT! Assist: Carmelo Lowry
Score: 6-13

[06:57] Team_001 possession (Score: 6-13)
Miles Griffin drives and kicks out. Dejounte McCollum attempts a 3Pt. Contested by Miles Bane (5.4 feet, ZONE). Dejounte McCollum misses. Rebound secured by Miles Bane.

[06:41] Team_002 possession (Score: 6-13)
Miles Bane drives and kicks out. CJ Barrett attempts a Midrange. Contested by Dirk Young (5.3 feet, MAN). CJ Barrett misses. Rebound secured by Miles Griffin.

[06:27] Team_001 possession (Score: 6-13)
Cole Ball attempts a 3Pt. Contested by Jordan Green (4.8 feet, MAN). Cole Ball misses. Rebound secured by Miles Bane.

[06:12] Team_002 possession (Score: 6-13)
Miles Bane throws a bad pass out of bounds! TURNOVER! (dead ball)

[06:12] Substitution (Team_001): Klay Harden OUT → Rudy George IN (stamina_rule2)

[06:12] Substitution (Team_001): Dirk Young OUT → Ja Dosunmu IN (stamina_rule2)

[06:12] Substitution (Team_001): Cole Ball OUT → Larry Trent IN (stamina_rule2)

[06:12] Substitution (Team_001): Dejounte McCollum OUT → Franz Bryant IN (stamina_rule2)

[06:12] Substitution (Team_001): Miles Griffin OUT → Kristaps Ming IN (stamina_rule2)

[06:12] Substitution (Team_002): Miles Bane OUT → John Duncan IN (stamina_rule2)

[06:12] Substitution (Team_002): CJ Barrett OUT → Dirk Middleton IN (stamina_rule2)

[06:12] Substitution (Team_002): Jordan Green OUT → Anfernee Sexton IN (stamina_rule2)

[06:12] Substitution (Team_002): Carmelo Lowry OUT → Julius Curry IN (stamina_rule2)

[06:12] Substitution (Team_002): Tyler Porzingis OUT → Lamelo O'Neal IN (stamina_rule2)

[05:58] Team_001 possession (Score: 6-13)
FOUL! Reach-in foul on Lamelo O'Neal during the drive. [Team fouls: 4] No free throws, side out. (Lamelo O'Neal: 1 personal fouls)

[05:41] Team_002 possession (Score: 6-13)
John Duncan attempts a 3Pt. Contested by Ja Dosunmu (4.1 feet, ZONE). John Duncan misses. Rebound secured by Kristaps Ming.

[05:26] Team_001 possession (Score: 6-13)
Rudy George attempts a 3Pt. Wide open! Dirk Middleton is 6.1 feet away. [MAN] Rudy George misses. Rebound secured by Lamelo O'Neal.

[05:11] Team_002 possession (Score: 6-13)
Julius Curry makes the 3Pt and draws the foul on Franz Bryant! And-1! Julius Curry to the line for 1. [BONUS: 5 team fouls] (Franz Bryant: 1 personal fouls)   FT 1/1: GOOD Julius Curry makes 1/1 from the line.
Score: 6-17

[04:59] Team_001 possession (Score: 6-17)
Kristaps Ming makes the Dunk and draws the foul on John Duncan! And-1! Kristaps Ming to the line for 1. [BONUS: 6 team fouls] (John Duncan: 1 personal fouls)   FT 1/1: GOOD Kristaps Ming makes 1/1 from the line.
Score: 9-17

[04:43] Team_002 possession (Score: 9-17)
Julius Curry drives, Franz Bryant stays with him. Julius Curry attempts a Dunk. Contested by Franz Bryant (4.4 feet, MAN). Julius Curry misses. Offensive rebound by Anfernee Sexton! Anfernee Sexton kicks it out.

[04:25] Team_002 possession (Score: 9-17)
Julius Curry attempts a 3Pt. Contested by Franz Bryant (4.5 feet, MAN). JULIUS CURRY MAKES IT! Assist: Dirk Middleton
Score: 9-20

[04:15] Team_001 possession (Score: 9-20)
Ja Dosunmu attempts a 3Pt. Contested by John Duncan (5.7 feet, MAN). Ja Dosunmu misses. Rebound secured by Anfernee Sexton.

[03:56] Team_002 possession (Score: 9-20)
Lamelo O'Neal drives and kicks out. Anfernee Sexton attempts a 3Pt. Contested by Larry Trent (4.3 feet, MAN). Anfernee Sexton misses. Rebound secured by Larry Trent.

[03:43] Team_001 possession (Score: 9-20)
Franz Bryant attempts a Midrange. Contested by Julius Curry (5.6 feet, MAN). Franz Bryant misses. FOUL! Loose ball foul on Lamelo O'Neal during the rebound battle. [IN THE BONUS! 7 team fouls] Rudy George to the line for 2 free throws. (Lamelo O'Neal: 2 personal fouls)   FT 1/2: GOOD   FT 2/2: GOOD Rudy George makes 2/2 from the line.
Score: 11-20

[03:28] Team_002 possession (Score: 11-20)
Anfernee Sexton attempts a 3Pt. Contested by Larry Trent (4.3 feet, MAN). Anfernee Sexton misses. Rebound secured by Rudy George.

[03:16] Team_001 possession (Score: 11-20)
Rudy George attempts a Layup. Wide open! Dirk Middleton is 6.3 feet away. [MAN] RUDY GEORGE MAKES IT!
Score: 13-20

[03:01] Team_002 possession (Score: 13-20)
Julius Curry throws a bad pass! Stolen by Franz Bryant! TURNOVER! (live ball)

[02:49] Team_001 possession (Score: 13-20)
Larry Trent drives, picks up Anfernee Sexton. Help arrives from John Duncan! Larry Trent attempts a Layup. Contested by John Duncan (4.7 feet, MAN). Larry Trent misses. Rebound secured by Anfernee Sexton.

[02:36] Team_002 possession (Score: 13-20)
Julius Curry attempts a Layup. Contested by Franz Bryant (4.8 feet, ZONE). Julius Curry misses. FOUL! Loose ball foul on Larry Trent during the rebound battle. [IN THE BONUS! 8 team fouls] Anfernee Sexton to the line for 2 free throws. (Larry Trent: 1 personal fouls)   FT 1/2: GOOD   FT 2/2: GOOD Anfernee Sexton makes 2/2 from the line.
Score: 13-22

[02:26] Team_001 possession (Score: 13-22)
Rudy George attempts a Layup. Wide open! Dirk Middleton is 6.4 feet away. [MAN] Rudy George misses. Rebound secured by Julius Curry.

[02:09] Team_002 possession (Score: 13-22)
John Duncan attempts a 3Pt. Contested by Ja Dosunmu (4.7 feet, MAN). John Duncan misses. Rebound secured by Kristaps Ming.

[01:51] Team_001 possession (Score: 13-22)
Kristaps Ming attempts a Midrange. Contested by Julius Curry (5.8 feet, ZONE). KRISTAPS MING MAKES IT! Assist: Ja Dosunmu
Score: 15-22

[01:37] Team_002 possession (Score: 15-22)
Julius Curry drives to the basket... Julius Curry loses control! Ball rolls out of bounds! TURNOVER! (dead ball)

[01:24] Team_001 possession (Score: 15-22)
Franz Bryant drives to the basket... Franz Bryant throws a bad pass! Stolen by Julius Curry! TURNOVER! (live ball)

[01:05] Team_002 possession (Score: 15-22)
Anfernee Sexton loses control! Ball rolls out of bounds! TURNOVER! (dead ball)

[00:49] Team_001 possession (Score: 15-22)
Kristaps Ming drives, Lamelo O'Neal stays with him. Kristaps Ming attempts a Layup. Contested by Lamelo O'Neal (5.4 feet, MAN). Kristaps Ming misses. Rebound secured by Lamelo O'Neal.

[00:36] Team_002 possession (Score: 15-22)
John Duncan attempts a 3Pt. Contested by Ja Dosunmu (4.9 feet, ZONE). John Duncan misses. Rebound secured by Rudy George.

[00:21] Team_001 possession (Score: 15-22)
Franz Bryant attempts a 3Pt. Wide open! Julius Curry is 6.0 feet away. [MAN] FRANZ BRYANT MAKES IT! Assist: Ja Dosunmu
Score: 18-22

[00:03] Team_002 possession (Score: 18-22)
Anfernee Sexton makes the Dunk and draws the foul on Franz Bryant! And-1! Anfernee Sexton to the line for 1. [BONUS: 9 team fouls] (Franz Bryant: 2 personal fouls)   FT 1/1: GOOD Anfernee Sexton makes 1/1 from the line.
Score: 18-25

================================================================================
                              1ST QUARTER COMPLETE                              
================================================================================

1ST QUARTER SCORE: Team_001 18, Team_002 25

BOX SCORE:
================================================================================

Team_001
--------------------------------------------------------------------------------
Player                MIN  PTS  REB  AST  TO      FG   FG%      3P   3P%
--------------------------------------------------------------------------------
Kristaps Ming           6    5    2    0   0   2/3    66.7     0/0   0.0
Rudy George             6    4    2    0   0   1/3    33.3     0/0   0.0
Cole Ball               6    3    2    0   0   1/2    50.0     0/0   0.0
Klay Harden             6    3    0    0   0   1/3    33.3     0/0   0.0
Franz Bryant            6    3    0    0   0   1/1   100.0     0/0   0.0
Dirk Young              6    0    0    2   0   0/2     0.0     0/0   0.0
Dejounte McCollum       6    0    1    0   0   0/0     0.0     0/0   0.0
Miles Griffin           6    0    3    0   0   0/2     0.0     0/0   0.0
Ja Dosunmu              6    0    0    2   0   0/1     0.0     0/0   0.0
Larry Trent             6    0    1    0   0   0/1     0.0     0/0   0.0

TEAM: FG: 6/18 (33.3%), 3PT: 2/8 (25.0%), REB: 11 (2 off, 9 def), AST: 4, TO: 2
TEAM FOULS: 0


Team_002
--------------------------------------------------------------------------------
Player                MIN  PTS  REB  AST  TO      FG   FG%      3P   3P%
--------------------------------------------------------------------------------
Julius Curry            6    7    1    0   0   2/2   100.0     0/0   0.0
Jordan Green            6    6    0    0   0   2/2   100.0     0/0   0.0
Anfernee Sexton         6    5    3    0   0   1/2    50.0     0/0   0.0
Miles Bane              6    3    4    1   0   1/2    50.0     0/0   0.0
Carmelo Lowry           6    2    0    2   0   0/1     0.0     0/0   0.0
CJ Barrett              6    2    2    0   0   1/1   100.0     0/0   0.0
Tyler Porzingis         6    0    2    0   0   0/2     0.0     0/0   0.0
John Duncan             6    0    0    0   0   0/3     0.0     0/0   0.0
Lamelo O'Neal           6    0    2    0   0   0/1     0.0     0/0   0.0
Dirk Middleton          6    0    0    1   0   0/0     0.0     0/0   0.0

TEAM: FG: 7/16 (43.8%), 3PT: 3/9 (33.3%), REB: 14 (2 off, 12 def), AST: 4, TO: 5
TEAM FOULS: 9 [Team_001 in BONUS]

================================================================================

================================================================================
                       2ND QUARTER - Team_001 vs Team_002                       
================================================================================

[12:00] Team_001 possession (Score: 18-25)
Dirk Young attempts a Layup. Contested by CJ Barrett (3.9 feet, MAN). DIRK YOUNG MAKES IT!
Score: 20-25

[11:47] Team_002 possession (Score: 20-25)
Miles Bane attempts a Layup. Contested by Klay Harden (4.0 feet, MAN). MILES BANE MAKES IT! Assist: Carmelo Lowry
Score: 20-27

[11:29] Team_001 possession (Score: 20-27)
Dejounte McCollum attempts a Midrange. Contested by Carmelo Lowry (4.5 feet, MAN). Dejounte McCollum misses. Offensive rebound by Cole Ball! Cole Ball kicks it out.

[11:11] Team_001 possession (Score: 20-27)
FOUL! Holding foul on Carmelo Lowry. [Team fouls: 1] No free throws, side out. (Carmelo Lowry: 1 personal fouls)

[10:58] Team_002 possession (Score: 20-27)
Jordan Green attempts a 3Pt. Contested by Cole Ball (2.9 feet, MAN). JORDAN GREEN MAKES IT! Assist: Miles Bane
Score: 20-30

[10:43] Team_001 possession (Score: 20-30)
Dirk Young drives to the basket... Dirk Young throws a bad pass! Stolen by CJ Barrett! TURNOVER! (live ball)

[10:27] Team_002 possession (Score: 20-30)
FOUL! Shooting foul on Dirk Young. CJ Barrett to the line for 3 free throws. [Team fouls: 2] (Dirk Young: 1 personal fouls)   FT 1/3: GOOD   FT 2/3: MISS   FT 3/3: GOOD CJ Barrett makes 2/3 from the line.
Score: 20-32

[10:13] Team_001 possession (Score: 20-32)
Klay Harden attempts a 3Pt. Contested by Miles Bane (4.7 feet, ZONE). Klay Harden misses. Offensive rebound by Cole Ball! Cole Ball kicks it out.

[10:02] Team_001 possession (Score: 20-32)
FOUL! Reach-in foul on Tyler Porzingis during the drive. [Team fouls: 3] No free throws, side out. (Tyler Porzingis: 1 personal fouls)

[09:45] Team_002 possession (Score: 20-32)
Miles Bane attempts a Midrange. Contested by Dirk Young (4.3 feet, ZONE). Miles Bane misses. Offensive rebound by Miles Bane! Miles Bane kicks it out.

[09:28] Team_002 possession (Score: 20-32)
Miles Bane attempts a Midrange. Contested by Klay Harden (4.4 feet, MAN). MILES BANE MAKES IT!
Score: 20-34

[09:11] Team_001 possession (Score: 20-34)
Miles Griffin attempts a Midrange. Contested by Tyler Porzingis (3.9 feet, MAN). Miles Griffin misses. Rebound secured by Tyler Porzingis.

[08:58] Team_002 possession (Score: 20-34)
Tyler Porzingis drives, Miles Griffin stays with him. Tyler Porzingis attempts a Layup. Contested by Miles Griffin (4.7 feet, MAN). Tyler Porzingis misses. Rebound secured by Cole Ball.

[08:40] Team_001 possession (Score: 20-34)
Dirk Young attempts a 3Pt. Contested by Jordan Green (4.2 feet, ZONE). Dirk Young misses. Rebound secured by CJ Barrett.

[08:24] Team_002 possession (Score: 20-34)
Tyler Porzingis attempts a 3Pt. Contested by Miles Griffin (4.8 feet, MAN). Tyler Porzingis misses. Offensive rebound by Tyler Porzingis! Tyler Porzingis puts it back in!
Score: 20-36

[08:13] Team_001 possession (Score: 20-36)
Dirk Young attempts a 3Pt. Contested by CJ Barrett (4.4 feet, MAN). Dirk Young misses. Rebound secured by Tyler Porzingis.

[08:03] Team_002 possession (Score: 20-36)
Miles Bane attempts a Midrange. Contested by Dejounte McCollum (4.0 feet, ZONE). Miles Bane misses. Rebound secured by Cole Ball.

[07:46] Team_001 possession (Score: 20-36)
Klay Harden attempts a Layup. Contested by Tyler Porzingis (4.2 feet, ZONE). KLAY HARDEN MAKES IT! Assist: Miles Griffin
Score: 22-36

[07:32] Team_002 possession (Score: 22-36)
Carmelo Lowry commits an offensive foul! Dejounte McCollum drew the charge! TURNOVER! (dead ball)

[07:15] Team_001 possession (Score: 22-36)
Dirk Young drives to the basket... Dirk Young throws a bad pass! Stolen by CJ Barrett! TURNOVER! (live ball)

[07:03] Team_002 possession (Score: 22-36)
Miles Bane attempts a 3Pt. Contested by Klay Harden (4.9 feet, ZONE). Miles Bane misses. Rebound secured by Dejounte McCollum.

[06:51] Team_001 possession (Score: 22-36)
Dejounte McCollum attempts a Midrange. Contested by Carmelo Lowry (5.4 feet, MAN). Dejounte McCollum misses. Rebound secured by CJ Barrett.

[06:39] Team_002 possession (Score: 22-36)
FOUL! Shooting foul on Dejounte McCollum. Carmelo Lowry to the line for 2 free throws. [Team fouls: 4] (Dejounte McCollum: 1 personal fouls)   FT 1/2: GOOD   FT 2/2: GOOD Carmelo Lowry makes 2/2 from the line.
Score: 22-38

[06:21] Team_001 possession (Score: 22-38)
Dirk Young attempts a 3Pt. Contested by Carmelo Lowry (5.5 feet, ZONE). Dirk Young misses. FOUL! Loose ball foul on CJ Barrett during the rebound battle. [IN THE BONUS! 5 team fouls] Cole Ball to the line for 2 free throws. (CJ Barrett: 1 personal fouls)   FT 1/2: GOOD   FT 2/2: GOOD Cole Ball makes 2/2 from the line.
Score: 24-38

[06:07] Team_002 possession (Score: 24-38)
Carmelo Lowry attempts a Midrange. Contested by Dejounte McCollum (4.2 feet, MAN). Carmelo Lowry misses. Offensive rebound by Miles Bane! Miles Bane kicks it out.

[05:56] Team_002 possession (Score: 24-38)
FOUL! Shooting foul on Cole Ball. Miles Bane to the line for 2 free throws. [BONUS: 6 team fouls] (Cole Ball: 1 personal fouls)   FT 1/2: GOOD   FT 2/2: GOOD Miles Bane makes 2/2 from the line.
Score: 24-40

[05:43] Team_001 possession (Score: 24-40)
Cole Ball attempts a 3Pt. Contested by Jordan Green (4.6 feet, MAN). Cole Ball misses. Offensive rebound by Dejounte McCollum! Dejounte McCollum kicks it out.

[05:26] Team_001 possession (Score: 24-40)
Dejounte McCollum attempts a 3Pt. Contested by Carmelo Lowry (5.7 feet, MAN). Dejounte McCollum misses. Offensive rebound by Dejounte McCollum! Dejounte McCollum kicks it out.

[05:12] Team_001 possession (Score: 24-40)
Klay Harden drives, Tyler Porzingis stays with him. Klay Harden attempts a Layup. Contested by Tyler Porzingis (4.7 feet, ZONE). Klay Harden misses. Rebound secured by Tyler Porzingis.

[04:56] Team_002 possession (Score: 24-40)
FOUL! Shooting foul on Klay Harden. Tyler Porzingis to the line for 2 free throws. [BONUS: 7 team fouls] (Klay Harden: 1 personal fouls)   FT 1/2: GOOD   FT 2/2: GOOD Tyler Porzingis makes 2/2 from the line.
Score: 24-42

[04:39] Team_001 possession (Score: 24-42)
Klay Harden attempts a 3Pt. Contested by Miles Bane (5.4 feet, MAN). Klay Harden misses. Rebound secured by Tyler Porzingis.

[04:22] Team_002 possession (Score: 24-42)
CJ Barrett drives to the basket... CJ Barrett throws a bad pass! Stolen by Dejounte McCollum! TURNOVER! (live ball)

[04:10] Team_001 possession (Score: 24-42)
Dejounte McCollum attempts a Midrange. Contested by Jordan Green (4.9 feet, ZONE). Dejounte McCollum misses. FOUL! Loose ball foul on Tyler Porzingis during the rebound battle. [IN THE BONUS! 8 team fouls] Dejounte McCollum to the line for 2 free throws. (Tyler Porzingis: 2 personal fouls)   FT 1/2: GOOD   FT 2/2: GOOD Dejounte McCollum makes 2/2 from the line.
Score: 26-42

[03:56] Team_002 possession (Score: 26-42)
Miles Bane attempts a 3Pt. Contested by Cole Ball (3.9 feet, ZONE). MILES BANE MAKES IT! Assist: Carmelo Lowry
Score: 26-45

[03:41] Team_001 possession (Score: 26-45)
Cole Ball attempts a 3Pt. Contested by Jordan Green (5.0 feet, MAN). Cole Ball misses. Rebound secured by Tyler Porzingis.

[03:29] Team_002 possession (Score: 26-45)
Carmelo Lowry attempts a 3Pt. Contested by Dejounte McCollum (4.5 feet, MAN). CARMELO LOWRY MAKES IT! Assist: Miles Bane
Score: 26-48

[03:16] Team_001 possession (Score: 26-48)
Klay Harden drives, Miles Bane stays with him. Klay Harden attempts a Layup. Contested by Miles Bane (5.6 feet, MAN). Klay Harden misses. Rebound secured by Miles Bane.

[03:00] Team_002 possession (Score: 26-48)
Tyler Porzingis commits an offensive foul! Miles Griffin drew the charge! TURNOVER! (dead ball)

[02:46] Team_001 possession (Score: 26-48)
FOUL! Reach-in foul on Tyler Porzingis during the drive. [IN THE BONUS! 9 team fouls] Dejounte McCollum to the line for 2 free throws. (Tyler Porzingis: 3 personal fouls)   FT 1/2: MISS   FT 2/2: GOOD Dejounte McCollum makes 1/2 from the line.
Score: 27-48

[02:29] Team_002 possession (Score: 27-48)
FOUL! Shooting foul on Miles Griffin. Tyler Porzingis to the line for 2 free throws. [BONUS: 10 team fouls] (Miles Griffin: 1 personal fouls)   FT 1/2: GOOD   FT 2/2: MISS Tyler Porzingis makes 1/2 from the line. Offensive rebound by Miles Bane! Miles Bane kicks it out.
Score: 27-49

[02:11] Team_002 possession (Score: 27-49)
FOUL! Shooting foul on Dejounte McCollum. Carmelo Lowry to the line for 2 free throws. [BONUS: 11 team fouls] (Dejounte McCollum: 2 personal fouls)   FT 1/2: GOOD   FT 2/2: GOOD Carmelo Lowry makes 2/2 from the line.
Score: 27-51

[01:58] Team_001 possession (Score: 27-51)
Dirk Young attempts a 3Pt. Contested by CJ Barrett (5.4 feet, MAN). Dirk Young misses. FOUL! Loose ball foul on CJ Barrett during the rebound battle. [IN THE BONUS! 12 team fouls] Dejounte McCollum to the line for 2 free throws. (CJ Barrett: 2 personal fouls)   FT 1/2: GOOD   FT 2/2: GOOD Dejounte McCollum makes 2/2 from the line.
Score: 29-51

[01:43] Team_002 possession (Score: 29-51)
Miles Bane attempts a Midrange. Wide open! Klay Harden is 6.1 feet away. [MAN] Miles Bane misses. Rebound secured by Miles Griffin.

[01:28] Team_001 possession (Score: 29-51)
Klay Harden makes the Layup and draws the foul on Tyler Porzingis! And-1! Klay Harden to the line for 1. [BONUS: 13 team fouls] (Tyler Porzingis: 4 personal fouls)   FT 1/1: GOOD Klay Harden makes 1/1 from the line.
Score: 32-51

[01:12] Team_002 possession (Score: 32-51)
Jordan Green attempts a Midrange. Wide open! Miles Griffin is 6.1 feet away. [ZONE] JORDAN GREEN MAKES IT!
Score: 32-53

[01:00] Team_001 possession (Score: 32-53)
FOUL! Shooting foul on Miles Bane. Klay Harden to the line for 3 free throws. [BONUS: 14 team fouls] (Miles Bane: 1 personal fouls)   FT 1/3: GOOD   FT 2/3: GOOD   FT 3/3: GOOD Klay Harden makes 3/3 from the line.
Score: 35-53

[00:43] Team_002 possession (Score: 35-53)
Jordan Green attempts a Midrange. Contested by Cole Ball (4.4 feet, MAN). Jordan Green misses. Rebound secured by Dejounte McCollum.

[00:32] Team_001 possession (Score: 35-53)
Miles Griffin attempts a Midrange. Contested by Tyler Porzingis (5.6 feet, MAN). Miles Griffin misses. Offensive rebound by Cole Ball! Cole Ball kicks it out.

[00:20] Team_001 possession (Score: 35-53)
Dirk Young attempts a Midrange. Wide open! Carmelo Lowry is 6.9 feet away. [ZONE] DIRK YOUNG MAKES IT!
Score: 37-53

[00:07] Team_002 possession (Score: 37-53)
CJ Barrett attempts a Midrange. Wide open! Dirk Young is 6.1 feet away. [ZONE] CJ BARRETT MAKES IT!
Score: 37-55

================================================================================
                              2ND QUARTER COMPLETE                              
================================================================================

2ND QUARTER SCORE: Team_001 19, Team_002 30

BOX SCORE:
================================================================================

Team_001
--------------------------------------------------------------------------------
Player                MIN  PTS  REB  AST  TO      FG   FG%      3P   3P%
--------------------------------------------------------------------------------
Klay Harden            18    8    0    0   0   2/5    40.0     0/0   0.0
Dejounte McCollum      18    5    4    0   0   0/1     0.0     0/0   0.0
Dirk Young             18    4    0    0   0   2/4    50.0     0/0   0.0
Cole Ball              18    2    5    0   0   0/1     0.0     0/0   0.0
Miles Griffin          18    0    1    1   0   0/1     0.0     0/0   0.0

TEAM: FG: 4/12 (33.3%), 3PT: 0/4 (0.0%), REB: 10 (5 off, 5 def), AST: 1, TO: 2
TEAM FOULS: 0


Team_002
--------------------------------------------------------------------------------
Player                MIN  PTS  REB  AST  TO      FG   FG%      3P   3P%
--------------------------------------------------------------------------------
Miles Bane             18    9    4    2   0   3/6    50.0     0/0   0.0
Carmelo Lowry          18    7    0    2   0   1/1   100.0     0/0   0.0
Jordan Green           18    5    0    0   0   2/3    66.7     0/0   0.0
CJ Barrett             18    4    2    0   0   1/1   100.0     0/0   0.0
Tyler Porzingis        18    4    6    0   0   1/2    50.0     0/0   0.0

TEAM: FG: 8/13 (61.5%), 3PT: 4/5 (80.0%), REB: 12 (4 off, 8 def), AST: 4, TO: 3
TEAM FOULS: 14 [Team_001 in BONUS]

================================================================================

================================================================================
                       3RD QUARTER - Team_001 vs Team_002                       
================================================================================

[12:00] Team_001 possession (Score: 37-55)
Dejounte McCollum drives, Carmelo Lowry stays with him. Dejounte McCollum attempts a Layup. Contested by Carmelo Lowry (3.6 feet, MAN). DEJOUNTE MCCOLLUM MAKES IT! Assist: Miles Griffin
Score: 39-55

[11:43] Team_002 possession (Score: 39-55)
Carmelo Lowry attempts a Midrange. Contested by Dejounte McCollum (3.8 feet, MAN). CARMELO LOWRY MAKES IT!
Score: 39-57

[11:24] Team_001 possession (Score: 39-57)
Klay Harden attempts a Layup. BLOCKED BY CJ BARRETT! Ball goes out of bounds. Turnover!

[11:11] Team_002 possession (Score: 39-57)
Miles Bane attempts a 3Pt. Contested by Klay Harden (3.3 feet, ZONE). Miles Bane misses. Offensive rebound by Carmelo Lowry! Carmelo Lowry kicks it out.

[11:00] Team_002 possession (Score: 39-57)
FOUL! Reach-in foul on Klay Harden during the drive. [Team fouls: 1] No free throws, side out. (Klay Harden: 1 personal fouls)

[10:46] Team_001 possession (Score: 39-57)
Dirk Young attempts a 3Pt. Contested by CJ Barrett (3.8 feet, MAN). Dirk Young misses. Rebound secured by Miles Bane.

[10:32] Team_002 possession (Score: 39-57)
CJ Barrett attempts a 3Pt. Contested by Dirk Young (3.8 feet, MAN). CJ Barrett misses. Rebound secured by Miles Griffin.

[10:21] Team_001 possession (Score: 39-57)
Miles Griffin makes the Layup and draws the foul on CJ Barrett! And-1! Miles Griffin to the line for 1. [Team fouls: 2] (CJ Barrett: 1 personal fouls)   FT 1/1: GOOD Miles Griffin makes 1/1 from the line.
Score: 42-57

[10:10] Team_002 possession (Score: 42-57)
Tyler Porzingis throws a bad pass! Stolen by Miles Griffin! TURNOVER! (live ball)

[09:58] Team_001 possession (Score: 42-57)
Dejounte McCollum commits an offensive foul! Carmelo Lowry drew the charge! TURNOVER! (dead ball)

[09:44] Team_002 possession (Score: 42-57)
Miles Bane attempts a 3Pt. Contested by Klay Harden (3.3 feet, MAN). Miles Bane misses. Rebound secured by Dejounte McCollum.

[09:30] Team_001 possession (Score: 42-57)
Klay Harden attempts a 3Pt. Contested by Miles Bane (4.5 feet, MAN). Klay Harden misses. Rebound secured by Miles Bane.

[09:15] Team_002 possession (Score: 42-57)
CJ Barrett attempts a 3Pt. Contested by Dirk Young (3.8 feet, MAN). CJ BARRETT MAKES IT!
Score: 42-60

[09:05] Team_001 possession (Score: 42-60)
Dejounte McCollum attempts a Midrange. Contested by Carmelo Lowry (3.6 feet, ZONE). Dejounte McCollum misses. Offensive rebound by Miles Griffin! Miles Griffin kicks it out.

[08:49] Team_001 possession (Score: 42-60)
Klay Harden attempts a Layup. Contested by Tyler Porzingis (3.0 feet, ZONE). KLAY HARDEN MAKES IT!
Score: 44-60

[08:34] Team_002 possession (Score: 44-60)
Carmelo Lowry attempts a Midrange. Contested by Dejounte McCollum (3.8 feet, MAN). Carmelo Lowry misses. Rebound secured by Cole Ball.

[08:19] Team_001 possession (Score: 44-60)
FOUL! Holding foul on CJ Barrett. [Team fouls: 3] No free throws, side out. (CJ Barrett: 2 personal fouls)

[08:07] Team_002 possession (Score: 44-60)
Miles Bane attempts a Midrange. Contested by Dejounte McCollum (3.8 feet, ZONE). Miles Bane misses. Rebound secured by Miles Griffin.

[07:56] Team_001 possession (Score: 44-60)
Miles Griffin attempts a Midrange. Contested by Tyler Porzingis (3.0 feet, MAN). Miles Griffin misses. Rebound secured by Tyler Porzingis.

[07:47] Team_002 possession (Score: 44-60)
Jordan Green attempts a 3Pt. Contested by Cole Ball (2.8 feet, MAN). Jordan Green misses. Rebound secured by Miles Griffin.

[07:36] Team_001 possession (Score: 44-60)
Dejounte McCollum attempts a 3Pt. Contested by Carmelo Lowry (3.6 feet, MAN). Dejounte McCollum misses. Rebound secured by Miles Bane.

[07:20] Team_002 possession (Score: 44-60)
Tyler Porzingis drives, Miles Griffin stays with him. Tyler Porzingis attempts a Layup. Contested by Miles Griffin (3.7 feet, MAN). TYLER PORZINGIS MAKES IT!
Score: 44-62

[07:09] Team_001 possession (Score: 44-62)
Cole Ball drives to the basket... Cole Ball throws a bad pass! Stolen by Tyler Porzingis! TURNOVER! (live ball)

[06:57] Team_002 possession (Score: 44-62)
Miles Bane attempts a 3Pt. Contested by Klay Harden (3.3 feet, MAN). Miles Bane misses. Rebound secured by Miles Griffin.

[06:43] Team_001 possession (Score: 44-62)
Cole Ball makes the 3Pt and draws the foul on Miles Bane! And-1! Cole Ball to the line for 1. [Team fouls: 4] (Miles Bane: 1 personal fouls)   FT 1/1: GOOD Cole Ball makes 1/1 from the line.
Score: 48-62

[06:27] Team_002 possession (Score: 48-62)
Carmelo Lowry attempts a Midrange. Contested by Cole Ball (2.8 feet, ZONE). Carmelo Lowry misses. Rebound secured by Cole Ball.

[06:17] Team_001 possession (Score: 48-62)
Dirk Young attempts a Layup. Contested by Tyler Porzingis (3.0 feet, ZONE). DIRK YOUNG MAKES IT!
Score: 50-62

[06:04] Team_002 possession (Score: 50-62)
CJ Barrett attempts a Midrange. Contested by Dirk Young (3.8 feet, MAN). CJ Barrett misses. Rebound secured by Miles Griffin.

[05:50] Team_001 possession (Score: 50-62)
Dirk Young attempts a 3Pt. Contested by CJ Barrett (3.9 feet, MAN). Dirk Young misses. Rebound secured by Tyler Porzingis.

[05:35] Team_002 possession (Score: 50-62)
CJ Barrett attempts a Midrange. Contested by Dirk Young (3.9 feet, MAN). CJ BARRETT MAKES IT!
Score: 50-64

[05:21] Team_001 possession (Score: 50-64)
Miles Griffin attempts a 3Pt. Contested by Tyler Porzingis (3.1 feet, MAN). Miles Griffin misses. Rebound secured by Tyler Porzingis.

[05:08] Team_002 possession (Score: 50-64)
CJ Barrett drives to the basket... CJ Barrett throws a bad pass out of bounds! TURNOVER! (dead ball)

[04:54] Team_001 possession (Score: 50-64)
Cole Ball throws a bad pass out of bounds! TURNOVER! (dead ball)

[04:39] Team_002 possession (Score: 50-64)
Tyler Porzingis drives and kicks out. Miles Bane makes the 3Pt and draws the foul on Dejounte McCollum! And-1! Miles Bane to the line for 1. [BONUS: 5 team fouls] (Dejounte McCollum: 1 personal fouls)   FT 1/1: MISS Miles Bane makes 0/1 from the line. Rebound secured by Cole Ball.
Score: 50-67

[04:27] Team_001 possession (Score: 50-67)
Cole Ball drives to the basket... Cole Ball commits a violation (traveling/carry)! TURNOVER! (dead ball)

[04:27] Substitution (Team_001): Klay Harden OUT → Ja Dosunmu IN (stamina_rule2)

[04:11] Team_002 possession (Score: 50-67)
Carmelo Lowry attempts a Midrange. Contested by Dejounte McCollum (3.9 feet, MAN). Carmelo Lowry misses. Offensive rebound by Carmelo Lowry! Carmelo Lowry kicks it out.

[03:55] Team_002 possession (Score: 50-67)
Miles Bane attempts a Layup. Contested by Dejounte McCollum (3.9 feet, ZONE). Miles Bane misses. Rebound secured by Dejounte McCollum.

[03:38] Team_001 possession (Score: 50-67)
Ja Dosunmu attempts a 3Pt. Contested by Miles Bane (4.7 feet, MAN). Ja Dosunmu misses. Offensive rebound by Cole Ball! Cole Ball kicks it out.

[03:22] Team_001 possession (Score: 50-67)
Cole Ball attempts a 3Pt. Contested by Jordan Green (4.1 feet, MAN). COLE BALL MAKES IT! Assist: Dirk Young
Score: 53-67

[03:08] Team_002 possession (Score: 53-67)
Carmelo Lowry attempts a Midrange. Contested by Miles Griffin (4.1 feet, ZONE). Carmelo Lowry misses. Rebound secured by Miles Griffin.

[02:55] Team_001 possession (Score: 53-67)
Miles Griffin drives and kicks out. Dejounte McCollum attempts a 3Pt. Contested by Carmelo Lowry (4.0 feet, MAN). Dejounte McCollum misses. Rebound secured by Tyler Porzingis.

[02:39] Team_002 possession (Score: 53-67)
Miles Bane attempts a 3Pt. Contested by Ja Dosunmu (3.5 feet, ZONE). MILES BANE MAKES IT! Assist: Carmelo Lowry
Score: 53-70

[02:25] Team_001 possession (Score: 53-70)
Cole Ball makes the Midrange and draws the foul on Jordan Green! And-1! Cole Ball to the line for 1. [BONUS: 6 team fouls] (Jordan Green: 1 personal fouls)   FT 1/1: GOOD Cole Ball makes 1/1 from the line.
Score: 56-70

[02:13] Team_002 possession (Score: 56-70)
CJ Barrett makes the Layup and draws the foul on Miles Griffin! And-1! CJ Barrett to the line for 1. [BONUS: 7 team fouls] (Miles Griffin: 1 personal fouls)   FT 1/1: GOOD CJ Barrett makes 1/1 from the line.
Score: 56-73

[02:01] Team_001 possession (Score: 56-73)
Dirk Young drives, picks up CJ Barrett. Help arrives from Miles Bane! Dirk Young attempts a Dunk. Contested by Miles Bane (4.3 feet, MAN). Dirk Young misses. Rebound secured by Carmelo Lowry.

[01:45] Team_002 possession (Score: 56-73)
Miles Bane attempts a Midrange. Contested by Dejounte McCollum (4.1 feet, ZONE). MILES BANE MAKES IT! Assist: Carmelo Lowry
Score: 56-75

[01:30] Team_001 possession (Score: 56-75)
Miles Griffin drives, Tyler Porzingis stays with him. Miles Griffin attempts a Dunk. Contested by Tyler Porzingis (3.6 feet, MAN). Miles Griffin misses. Offensive rebound by Dejounte McCollum! Dejounte McCollum kicks it out.

[01:15] Team_001 possession (Score: 56-75)
Ja Dosunmu attempts a 3Pt. Contested by Miles Bane (5.0 feet, MAN). Ja Dosunmu misses. Rebound secured by Carmelo Lowry.

[01:01] Team_002 possession (Score: 56-75)
CJ Barrett attempts a Midrange. Contested by Dirk Young (4.5 feet, ZONE). CJ Barrett misses. Rebound secured by Dejounte McCollum.

[00:47] Team_001 possession (Score: 56-75)
Dirk Young drives to the basket... Dirk Young commits an offensive foul! TURNOVER! (dead ball)

[00:31] Team_002 possession (Score: 56-75)
Miles Bane drives to the basket... Miles Bane throws a bad pass out of bounds! TURNOVER! (dead ball)

[00:31] Substitution (Team_001): Dirk Young OUT → Rudy George IN (stamina_rule2)

[00:31] Substitution (Team_001): Cole Ball OUT → Larry Trent IN (stamina_rule2)

[00:31] Substitution (Team_001): Dejounte McCollum OUT → Franz Bryant IN (stamina_rule2)

[00:31] Substitution (Team_001): Miles Griffin OUT → Kristaps Ming IN (stamina_rule2)

[00:31] Substitution (Team_002): Miles Bane OUT → John Duncan IN (stamina_rule2)

[00:31] Substitution (Team_002): CJ Barrett OUT → Dirk Middleton IN (stamina_rule2)

[00:31] Substitution (Team_002): Jordan Green OUT → Anfernee Sexton IN (stamina_rule2)

[00:31] Substitution (Team_002): Carmelo Lowry OUT → Julius Curry IN (stamina_rule2)

[00:31] Substitution (Team_002): Tyler Porzingis OUT → Lamelo O'Neal IN (stamina_rule2)

[00:18] Team_001 possession (Score: 56-75)
Larry Trent attempts a 3Pt. Contested by Julius Curry (5.4 feet, ZONE). Larry Trent misses. Rebound secured by Julius Curry.

[00:03] Team_002 possession (Score: 56-75)
FOUL! Reach-in foul on Franz Bryant during the drive. [IN THE BONUS! 8 team fouls] John Duncan to the line for 2 free throws. (Franz Bryant: 1 personal fouls)   FT 1/2: GOOD   FT 2/2: MISS John Duncan makes 1/2 from the line. Rebound secured by Kristaps Ming.
Score: 56-76

================================================================================
                              3RD QUARTER COMPLETE                              
================================================================================

3RD QUARTER SCORE: Team_001 19, Team_002 21

BOX SCORE:
================================================================================

Team_001
--------------------------------------------------------------------------------
Player                MIN  PTS  REB  AST  TO      FG   FG%      3P   3P%
--------------------------------------------------------------------------------
Cole Ball              30   10    4    0   0   3/3   100.0     0/0   0.0
Miles Griffin          30    3    7    1   0   1/4    25.0     0/0   0.0
Dejounte McCollum      30    2    4    0   0   1/2    50.0     0/0   0.0
Dirk Young             30    2    0    1   0   1/4    25.0     0/0   0.0
Klay Harden            26    2    0    0   0   1/2    50.0     0/0   0.0
Ja Dosunmu             10    0    0    0   0   0/1     0.0     0/0   0.0
Larry Trent             7    0    0    0   0   0/1     0.0     0/0   0.0
Kristaps Ming           7    0    1    0   0   0/0     0.0     0/0   0.0

TEAM: FG: 7/17 (41.2%), 3PT: 2/9 (22.2%), REB: 16 (3 off, 13 def), AST: 2, TO: 6
TEAM FOULS: 0


Team_002
--------------------------------------------------------------------------------
Player                MIN  PTS  REB  AST  TO      FG   FG%      3P   3P%
--------------------------------------------------------------------------------
CJ Barrett             30    8    0    0   0   3/6    50.0     0/0   0.0
Miles Bane             30    5    3    0   0   2/6    33.3     0/0   0.0
Carmelo Lowry          30    2    4    2   0   1/4    25.0     0/0   0.0
Tyler Porzingis        30    2    4    0   0   1/2    50.0     0/0   0.0
Jordan Green           30    0    0    0   0   0/1     0.0     0/0   0.0
Julius Curry            7    0    1    0   0   0/0     0.0     0/0   0.0
John Duncan             7    0    0    0   0   0/1     0.0     0/0   0.0

TEAM: FG: 7/20 (35.0%), 3PT: 2/6 (33.3%), REB: 12 (2 off, 10 def), AST: 2, TO: 3
TEAM FOULS: 8 [Team_001 in BONUS]

================================================================================

================================================================================
                       4TH QUARTER - Team_001 vs Team_002                       
================================================================================

[12:00] Substitution (Team_001): Klay Harden OUT (stamina: 82) → Ja Dosunmu IN (comeback_detected)

[12:00] Substitution (Team_002): Miles Bane OUT (stamina: 69) → John Duncan IN (comeback_detected)

[12:00] Team_001 possession (Score: 56-76)
Miles Griffin attempts a Midrange. Contested by Tyler Porzingis (3.4 feet, MAN). Miles Griffin misses. Rebound secured by Tyler Porzingis.

[11:45] Team_002 possession (Score: 56-76)
Carmelo Lowry attempts a 3Pt. Contested by Dejounte McCollum (4.0 feet, MAN). Carmelo Lowry misses. Rebound secured by Dejounte McCollum.

[11:28] Team_001 possession (Score: 56-76)
Dejounte McCollum attempts a Midrange. Contested by Jordan Green (4.2 feet, ZONE). Dejounte McCollum misses. Rebound secured by Tyler Porzingis.

[11:16] Team_002 possession (Score: 56-76)
John Duncan attempts a 3Pt. Contested by Cole Ball (3.2 feet, ZONE). JOHN DUNCAN MAKES IT! Assist: Carmelo Lowry
Score: 56-79

[11:00] Team_001 possession (Score: 56-79)
Cole Ball drives, Tyler Porzingis stays with him. Cole Ball attempts a Layup. Contested by Tyler Porzingis (3.6 feet, ZONE). COLE BALL MAKES IT! Assist: Dejounte McCollum
Score: 58-79

[10:45] Team_002 possession (Score: 58-79)
CJ Barrett attempts a 3Pt. Contested by Dirk Young (4.4 feet, MAN). CJ Barrett misses. Offensive rebound by Tyler Porzingis! Tyler Porzingis puts it back in!
Score: 58-81

[10:31] Team_001 possession (Score: 58-81)
Cole Ball attempts a Layup. Contested by Jordan Green (4.3 feet, MAN). Cole Ball misses. Rebound secured by CJ Barrett.

[10:18] Team_002 possession (Score: 58-81)
Carmelo Lowry attempts a Layup. Contested by Dejounte McCollum (4.2 feet, MAN). CARMELO LOWRY MAKES IT! Assist: CJ Barrett
Score: 58-83

[10:08] Team_001 possession (Score: 58-83)
Dirk Young drives to the basket... Dirk Young throws a bad pass out of bounds! TURNOVER! (dead ball)

[10:08] Substitution (Team_001): Dirk Young OUT → Rudy George IN (stamina_rule2)

[10:08] Substitution (Team_001): Cole Ball OUT → Larry Trent IN (stamina_rule2)

[10:08] Substitution (Team_001): Dejounte McCollum OUT → Franz Bryant IN (stamina_rule2)

[10:08] Substitution (Team_001): Miles Griffin OUT → Kristaps Ming IN (stamina_rule2)

[10:08] Substitution (Team_002): CJ Barrett OUT → Dirk Middleton IN (stamina_rule2)

[10:08] Substitution (Team_002): Jordan Green OUT → Anfernee Sexton IN (stamina_rule2)

[10:08] Substitution (Team_002): Carmelo Lowry OUT → Julius Curry IN (stamina_rule2)

[10:08] Substitution (Team_002): Tyler Porzingis OUT → Lamelo O'Neal IN (stamina_rule2)

[09:53] Team_002 possession (Score: 58-83)
Julius Curry attempts a Midrange. Contested by Franz Bryant (3.8 feet, ZONE). JULIUS CURRY MAKES IT! Assist: Lamelo O'Neal
Score: 58-85

[09:37] Team_001 possession (Score: 58-85)
Larry Trent attempts a Layup. BLOCKED BY ANFERNEE SEXTON! Rebound secured by Anfernee Sexton.

[09:21] Team_002 possession (Score: 58-85)
Julius Curry drives, Franz Bryant stays with him. Julius Curry attempts a Layup. Contested by Franz Bryant (3.8 feet, MAN). Julius Curry misses. Offensive rebound by Lamelo O'Neal! Lamelo O'Neal puts it back in!
Score: 58-87

[09:05] Team_001 possession (Score: 58-87)
Ja Dosunmu attempts a 3Pt. Contested by John Duncan (5.5 feet, MAN). Ja Dosunmu misses. Rebound secured by Anfernee Sexton.

[08:49] Team_002 possession (Score: 58-87)
Lamelo O'Neal drives and kicks out. John Duncan attempts a Midrange. Contested by Ja Dosunmu (3.5 feet, MAN). JOHN DUNCAN MAKES IT! Assist: Julius Curry
Score: 58-89

[08:39] Team_001 possession (Score: 58-89)
Larry Trent attempts a Midrange. Contested by Anfernee Sexton (4.4 feet, MAN). Larry Trent misses. Rebound secured by Julius Curry.

[08:27] Team_002 possession (Score: 58-89)
Dirk Middleton attempts a Midrange. Contested by Larry Trent (3.9 feet, ZONE). DIRK MIDDLETON MAKES IT!
Score: 58-91

[08:13] Team_001 possession (Score: 58-91)
Franz Bryant attempts a 3Pt. Contested by Lamelo O'Neal (3.0 feet, MAN). FRANZ BRYANT MAKES IT! Assist: Ja Dosunmu
Score: 61-91

[07:56] Team_002 possession (Score: 61-91)
Lamelo O'Neal drives, Kristaps Ming stays with him. Lamelo O'Neal attempts a Layup. Contested by Kristaps Ming (5.6 feet, MAN). Lamelo O'Neal misses. Rebound secured by Larry Trent.

[07:38] Team_001 possession (Score: 61-91)
Ja Dosunmu attempts a 3Pt. Contested by John Duncan (5.5 feet, MAN). Ja Dosunmu misses. Rebound secured by Julius Curry.

[07:25] Team_002 possession (Score: 61-91)
FOUL! Reach-in foul on Rudy George during the drive. [Team fouls: 1] No free throws, side out. (Rudy George: 1 personal fouls)

[07:11] Team_001 possession (Score: 61-91)
Kristaps Ming drives, Lamelo O'Neal stays with him. Kristaps Ming attempts a Layup. Contested by Lamelo O'Neal (3.0 feet, MAN). Kristaps Ming misses. Rebound secured by Julius Curry.

[06:57] Team_002 possession (Score: 61-91)
John Duncan drives and kicks out. John Duncan attempts a Midrange. Contested by Ja Dosunmu (3.7 feet, MAN). John Duncan misses. Rebound secured by Kristaps Ming.

[06:41] Team_001 possession (Score: 61-91)
Larry Trent attempts a 3Pt. Contested by Anfernee Sexton (4.4 feet, MAN). Larry Trent misses. Rebound secured by Julius Curry.

[06:23] Team_002 possession (Score: 61-91)
Anfernee Sexton attempts a Midrange. Contested by Larry Trent (3.9 feet, ZONE). ANFERNEE SEXTON MAKES IT! Assist: Julius Curry
Score: 61-93

[06:05] Team_001 possession (Score: 61-93)
Larry Trent drives, Anfernee Sexton stays with him. Larry Trent attempts a Layup. Contested by Anfernee Sexton (4.4 feet, MAN). LARRY TRENT MAKES IT! Assist: Kristaps Ming
Score: 63-93

[05:48] Team_002 possession (Score: 63-93)
John Duncan attempts a 3Pt. Contested by Ja Dosunmu (3.8 feet, MAN). JOHN DUNCAN MAKES IT!
Score: 63-96

[05:31] Team_001 possession (Score: 63-96)
Rudy George drives, Dirk Middleton stays with him. Rudy George attempts a Layup. Contested by Dirk Middleton (5.9 feet, MAN). Rudy George misses. Rebound secured by Anfernee Sexton.

[05:18] Team_002 possession (Score: 63-96)
Dirk Middleton attempts a 3Pt. Contested by Rudy George (4.7 feet, MAN). Dirk Middleton misses. Rebound secured by Rudy George.

[05:03] Team_001 possession (Score: 63-96)
Rudy George attempts a Midrange. Contested by Dirk Middleton (5.9 feet, MAN). Rudy George misses. Rebound secured by Julius Curry.

[04:44] Team_002 possession (Score: 63-96)
Anfernee Sexton attempts a 3Pt. Contested by Larry Trent (3.9 feet, MAN). Anfernee Sexton misses. Rebound secured by Rudy George.

[04:29] Team_001 possession (Score: 63-96)
Ja Dosunmu drives, Lamelo O'Neal stays with him. Ja Dosunmu attempts a Dunk. Contested by Lamelo O'Neal (3.0 feet, ZONE). Ja Dosunmu misses. Rebound secured by Julius Curry.

[04:16] Team_002 possession (Score: 63-96)
Julius Curry attempts a 3Pt. Contested by Franz Bryant (3.8 feet, MAN). Julius Curry misses. Rebound secured by Kristaps Ming.

[03:56] Team_001 possession (Score: 63-96)
Larry Trent attempts a Midrange. Contested by Julius Curry (5.4 feet, ZONE). Larry Trent misses. Offensive rebound by Rudy George! Rudy George kicks it out.

[03:43] Team_001 possession (Score: 63-96)
Larry Trent attempts a 3Pt. Contested by Anfernee Sexton (4.4 feet, MAN). Larry Trent misses. Rebound secured by Lamelo O'Neal.

[03:27] Team_002 possession (Score: 63-96)
Julius Curry attempts a 3Pt. Contested by Ja Dosunmu (4.2 feet, ZONE). Julius Curry misses. Rebound secured by Larry Trent.

[03:16] Team_001 possession (Score: 63-96)
Ja Dosunmu attempts a 3Pt. Contested by John Duncan (5.7 feet, MAN). Ja Dosunmu misses. Rebound secured by Julius Curry.

[03:02] Team_002 possession (Score: 63-96)
Lamelo O'Neal attempts a Midrange. Contested by Kristaps Ming (5.6 feet, MAN). Lamelo O'Neal misses. Rebound secured by Larry Trent.

[02:43] Team_001 possession (Score: 63-96)
Franz Bryant attempts a 3Pt. Contested by Julius Curry (5.4 feet, MAN). FRANZ BRYANT MAKES IT!
Score: 66-96

[02:31] Team_002 possession (Score: 66-96)
Dirk Middleton drives and kicks out. Lamelo O'Neal attempts a Midrange. Contested by Franz Bryant (4.0 feet, ZONE). Lamelo O'Neal misses. Rebound secured by Rudy George.

[02:20] Team_001 possession (Score: 66-96)
Franz Bryant attempts a Midrange. Contested by Julius Curry (5.4 feet, MAN). Franz Bryant misses. FOUL! Loose ball foul on Julius Curry during the rebound battle. [Team fouls: 2] No free throws, side out. (Julius Curry: 1 personal fouls)

[02:03] Team_001 possession (Score: 66-96)
Kristaps Ming attempts a Layup. Contested by Lamelo O'Neal (3.3 feet, MAN). KRISTAPS MING MAKES IT! Assist: Larry Trent
Score: 68-96

[01:49] Team_002 possession (Score: 68-96)
Lamelo O'Neal attempts a Midrange. Contested by Kristaps Ming (5.7 feet, MAN). Lamelo O'Neal misses. Rebound secured by Kristaps Ming.

[01:36] Team_001 possession (Score: 68-96)
Ja Dosunmu attempts a 3Pt. Contested by Julius Curry (5.5 feet, ZONE). JA DOSUNMU MAKES IT! Assist: Kristaps Ming
Score: 71-96

[01:18] Team_002 possession (Score: 71-96)
Julius Curry attempts a Layup. Contested by Franz Bryant (4.1 feet, ZONE). Julius Curry misses. Rebound secured by Larry Trent.

[01:04] Team_001 possession (Score: 71-96)
Kristaps Ming attempts a Layup. Contested by Lamelo O'Neal (3.5 feet, ZONE). KRISTAPS MING MAKES IT!
Score: 73-96

[00:48] Team_002 possession (Score: 73-96)
Anfernee Sexton drives to the basket... Anfernee Sexton loses control! Ball rolls out of bounds! TURNOVER! (dead ball)

[00:48] Substitution (Team_001): Ja Dosunmu OUT → Klay Harden IN (starter_return_rule1)

[00:33] Team_001 possession (Score: 73-96)
FOUL! Shooting foul on Anfernee Sexton. Larry Trent to the line for 2 free throws. [Team fouls: 3] (Anfernee Sexton: 1 personal fouls)   FT 1/2: MISS   FT 2/2: MISS Larry Trent makes 0/2 from the line. Rebound secured by Lamelo O'Neal.

[00:16] Team_002 possession (Score: 73-96)
Dirk Middleton attempts a 3Pt. Contested by Rudy George (4.9 feet, MAN). Dirk Middleton misses. Offensive rebound by Anfernee Sexton! Anfernee Sexton kicks it out.

================================================================================
                              4TH QUARTER COMPLETE                              
================================================================================

4TH QUARTER SCORE: Team_001 17, Team_002 20

BOX SCORE:
================================================================================

Team_001
--------------------------------------------------------------------------------
Player                MIN  PTS  REB  AST  TO      FG   FG%      3P   3P%
--------------------------------------------------------------------------------
Franz Bryant           16    6    0    0   0   2/2   100.0     0/0   0.0
Kristaps Ming          16    4    4    2   0   2/3    66.7     0/0   0.0
Ja Dosunmu             22    3    0    1   0   1/5    20.0     0/0   0.0
Cole Ball              32    2    0    0   0   1/2    50.0     0/0   0.0
Larry Trent            16    2    4    1   0   1/6    16.7     0/0   0.0
Miles Griffin          32    0    0    0   0   0/1     0.0     0/0   0.0
Dejounte McCollum      32    0    1    1   0   0/1     0.0     0/0   0.0
Rudy George            16    0    4    0   0   0/2     0.0     0/0   0.0

TEAM: FG: 7/22 (31.8%), 3PT: 3/8 (37.5%), REB: 13 (2 off, 11 def), AST: 5, TO: 1
TEAM FOULS: 0


Team_002
--------------------------------------------------------------------------------
Player                MIN  PTS  REB  AST  TO      FG   FG%      3P   3P%
--------------------------------------------------------------------------------
John Duncan            19    8    0    0   0   3/4    75.0     0/0   0.0
Tyler Porzingis        32    2    3    0   0   1/1   100.0     0/0   0.0
Carmelo Lowry          32    2    0    1   0   1/2    50.0     0/0   0.0
Julius Curry           16    2    7    2   0   1/4    25.0     0/0   0.0
Lamelo O'Neal          16    2    3    1   0   1/4    25.0     0/0   0.0
Anfernee Sexton        16    2    4    0   0   1/2    50.0     0/0   0.0
Dirk Middleton         16    2    0    0   0   1/3    33.3     0/0   0.0
CJ Barrett             32    0    1    1   0   0/0     0.0     0/0   0.0

TEAM: FG: 9/20 (45.0%), 3PT: 3/8 (37.5%), REB: 18 (3 off, 15 def), AST: 5, TO: 1
TEAM FOULS: 3

================================================================================

================================================================================
                               FULL GAME COMPLETE                               
================================================================================

FINAL SCORE: Team_001 73, Team_002 96

SCORING BY QUARTER:
--------------------------------------------------------------------------------
Team                     Q1     Q2     Q3     Q4    FINAL
--------------------------------------------------------------------------------
Team_001                 18     19     19     17       73
Team_002                 25     30     21     20       96
--------------------------------------------------------------------------------

FULL GAME BOX SCORE:
================================================================================

Team_001
--------------------------------------------------------------------------------
Player                MIN  PTS  REB  AST  TO      FG   FG%      3P   3P%      FT STL BLK
--------------------------------------------------------------------------------
Dirk Young             32    6    0    3   4   4/11   36.4   0/5     0.0   0/0     0   0
Cole Ball              32   17   11    0   4   4/7    57.1   2/4    50.0   2/4     0   0
Dejounte McCollum      32    7   10    1   1   1/4    25.0   0/1     0.0   1/6     1   0
Miles Griffin          32    3   11    2   1   1/8    12.5   0/2     0.0   1/1     1   1
Klay Harden            27   13    0    0   0   4/10   40.0   1/4    25.0   4/4     0   0
Ja Dosunmu             22    3    0    3   0   1/7    14.3   1/6    16.7   0/0     0   0
Rudy George            16    4    6    0   0   1/5    20.0   0/1     0.0   0/2     0   0
Larry Trent            16    2    5    1   0   1/8    12.5   0/3     0.0   0/0     0   0
Franz Bryant           16    9    0    0   1   3/3   100.0   3/3   100.0   0/0     1   0
Kristaps Ming          16    9    7    2   0   4/6    66.7   0/0     0.0   1/1     0   0

TEAM: FG: 24/69 (34.8%), 3PT: 7/29 (24.1%), REB: 50 (12 off, 38 def), AST: 12, TO: 11


Team_002
--------------------------------------------------------------------------------
Player                MIN  PTS  REB  AST  TO      FG   FG%      3P   3P%      FT STL BLK
--------------------------------------------------------------------------------
CJ Barrett             32   14    5    1   1   5/8    62.5   2/3    66.7   3/4     2   2
Jordan Green           32   11    0    0   0   3/5    60.0   2/3    66.7   0/0     0   0
Carmelo Lowry          32   13    4    7   3   3/8    37.5   1/3    33.3   6/6     0   0
Tyler Porzingis        32    8   15    0   2   3/7    42.9   1/2    50.0   2/2     2   0
Miles Bane             30   17   11    3   2   7/15   46.7   2/5    40.0   3/3     0   0
John Duncan            19    8    0    0   1   2/7    28.6   2/5    40.0   0/0     0   0
Dirk Middleton         16    2    0    1   0   1/3    33.3   0/1     0.0   0/0     0   0
Anfernee Sexton        16    7    7    0   2   2/4    50.0   0/2     0.0   1/3     0   1
Julius Curry           16    9    9    2   1   4/7    57.1   2/4    50.0   1/1     1   0
Lamelo O'Neal          16    2    5    1   0   1/5    20.0   0/0     0.0   0/0     0   0

TEAM: FG: 31/69 (44.9%), 3PT: 12/28 (42.9%), REB: 56 (11 off, 45 def), AST: 15, TO: 12

================================================================================
