================================================================================
                        FULL GAME - Team_001 vs Team_002                        
================================================================================

================================================================================
                       1ST QUARTER - Team_001 vs Team_002                       
================================================================================

[12:00] Team_001 possession (Score: 0-0)
Cole Ball attempts a 3Pt. Contested by Jordan Green (4.0 feet, MAN). Cole Ball misses. FOUL! Loose ball foul on CJ Barrett during the rebound battle. [Team fouls: 1] No free throws, side out. (CJ Barrett: 1 personal fouls)

[11:44] Team_001 possession (Score: 0-0)
Cole Ball attempts a 3Pt. Contested by Jordan Green (4.0 feet, MAN). COLE BALL MAKES IT! Assist: Dirk Young
Score: 3-0

[11:28] Team_002 possession (Score: 3-0)
CJ Barrett drives, picks up Dirk Young. Help arrives from Cole Ball! CJ Barrett attempts a Layup. Contested by Cole Ball (4.5 feet, MAN). CJ BARRETT MAKES IT! Assist: Miles Bane
Score: 3-2

[11:18] Team_001 possession (Score: 3-2)
Miles Griffin loses the ball! Stripped by Tyler Porzingis! TURNOVER! (live ball)

[11:04] Team_002 possession (Score: 3-2)
Tyler Porzingis attempts a 3Pt. Contested by Miles Griffin (5.1 feet, MAN). Tyler Porzingis misses. Rebound secured by Cole Ball.

[10:51] Team_001 possession (Score: 3-2)
Dirk Young drives to the basket... Dirk Young throws a bad pass out of bounds! TURNOVER! (dead ball)

[10:51] Substitution (Team_001): Klay Harden OUT → Rudy George IN (stamina_rule2)

[10:51] Substitution (Team_001): Dirk Young OUT → Ja Dosunmu IN (stamina_rule2)

[10:51] Substitution (Team_001): Miles Griffin OUT → Kristaps Ming IN (stamina_rule2)

[10:51] Substitution (Team_002): Miles Bane OUT → John Duncan IN (stamina_rule2)

[10:51] Substitution (Team_002): CJ Barrett OUT → Miles Bane IN (stamina_rule2)

[10:51] Substitution (Team_002): Jordan Green OUT → Anfernee Sexton IN (stamina_rule2)

[10:51] Substitution (Team_002): Carmelo Lowry OUT → Jordan Green IN (stamina_rule2)

[10:51] Substitution (Team_002): Tyler Porzingis OUT → Lamelo O'Neal IN (stamina_rule2)

[10:37] Team_002 possession (Score: 3-2)
FOUL! Reach-in foul on Cole Ball during the drive. [Team fouls: 2] No free throws, side out. (Cole Ball: 1 personal fouls)

[10:24] Team_001 possession (Score: 3-2)
Ja Dosunmu attempts a Layup. Contested by Lamelo O'Neal (5.5 feet, ZONE). JA DOSUNMU MAKES IT! Assist: Rudy George
Score: 5-2

[10:10] Team_002 possession (Score: 5-2)
Anfernee Sexton drives, Cole Ball stays with him. Anfernee Sexton attempts a Dunk. Contested by Cole Ball (3.1 feet, MAN). ANFERNEE SEXTON MAKES IT! Assist: Jordan Green
Score: 5-4

[09:54] Team_001 possession (Score: 5-4)
Rudy George attempts a Midrange. Contested by Anfernee Sexton (4.9 feet, ZONE). Rudy George misses. Rebound secured by Jordan Green.

[09:40] Team_002 possession (Score: 5-4)
Miles Bane attempts a Midrange. Contested by Cole Ball (3.2 feet, ZONE). Miles Bane misses. Rebound secured by Dejounte McCollum.

[09:23] Team_001 possession (Score: 5-4)
Cole Ball commits a violation (traveling/carry)! TURNOVER! (dead ball)

[09:23] Substitution (Team_001): Cole Ball OUT → Larry Trent IN (stamina_rule2)

[09:23] Substitution (Team_002): Miles Bane OUT → CJ Barrett IN (stamina_rule2)

[09:23] Substitution (Team_002): Jordan Green OUT → Julius Curry IN (stamina_rule2)

[09:09] Team_002 possession (Score: 5-4)
John Duncan attempts a 3Pt. Contested by Larry Trent (4.4 feet, ZONE). JOHN DUNCAN MAKES IT! Assist: CJ Barrett
Score: 5-7

[08:52] Team_001 possession (Score: 5-7)
FOUL! Shooting foul on John Duncan. Ja Dosunmu to the line for 2 free throws. [Team fouls: 3] (John Duncan: 1 personal fouls)   FT 1/2: GOOD   FT 2/2: MISS Ja Dosunmu makes 1/2 from the line. Rebound secured by Julius Curry.
Score: 6-7

[08:38] Team_002 possession (Score: 6-7)
CJ Barrett attempts a Layup. Contested by Dejounte McCollum (4.1 feet, ZONE). CJ BARRETT MAKES IT!
Score: 6-9

[08:20] Team_001 possession (Score: 6-9)
Rudy George commits an offensive foul! CJ Barrett drew the charge! TURNOVER! (dead ball)

[08:10] Team_002 possession (Score: 6-9)
Julius Curry attempts a Layup. Contested by Dejounte McCollum (4.1 feet, ZONE). Julius Curry misses. Offensive rebound by Anfernee Sexton! Anfernee Sexton kicks it out.

[07:56] Team_002 possession (Score: 6-9)
John Duncan drives, picks up Ja Dosunmu. Help arrives from Larry Trent! John Duncan attempts a Layup. Contested by Larry Trent (5.4 feet, MAN). John Duncan misses. Rebound secured by Dejounte McCollum.

[07:41] Team_001 possession (Score: 6-9)
Dejounte McCollum attempts a Layup. BLOCKED BY JULIUS CURRY! Rebound secured by Anfernee Sexton.

[07:25] Team_002 possession (Score: 6-9)
FOUL! Shooting foul on Dejounte McCollum. Lamelo O'Neal to the line for 2 free throws. [Team fouls: 4] (Dejounte McCollum: 1 personal fouls)   FT 1/2: GOOD   FT 2/2: GOOD Lamelo O'Neal makes 2/2 from the line.
Score: 6-11

[07:09] Team_001 possession (Score: 6-11)
Rudy George drives, Lamelo O'Neal stays with him. Rudy George attempts a Dunk. Wide open! Lamelo O'Neal is 6.3 feet away. [ZONE] RUDY GEORGE MAKES IT! Assist: Kristaps Ming
Score: 8-11

[06:56] Team_002 possession (Score: 8-11)
John Duncan attempts a Layup. Contested by Ja Dosunmu (5.6 feet, MAN). John Duncan misses. Rebound secured by Rudy George.

[06:44] Team_001 possession (Score: 8-11)
Ja Dosunmu drives and kicks out. Kristaps Ming attempts a 3Pt. Contested by CJ Barrett (4.5 feet, ZONE). Kristaps Ming misses. Rebound secured by Anfernee Sexton.

[06:31] Team_002 possession (Score: 8-11)
Julius Curry attempts a 3Pt. Contested by Larry Trent (4.7 feet, ZONE). Julius Curry misses. Rebound secured by Rudy George.

[06:11] Team_001 possession (Score: 8-11)
Kristaps Ming attempts a Layup. Wide open! Lamelo O'Neal is 6.6 feet away. [MAN] KRISTAPS MING MAKES IT!
Score: 10-11

[05:54] Team_002 possession (Score: 10-11)
Anfernee Sexton attempts a 3Pt. Contested by Larry Trent (4.8 feet, MAN). ANFERNEE SEXTON MAKES IT! Assist: John Duncan
Score: 10-14

[05:37] Team_001 possession (Score: 10-14)
Ja Dosunmu attempts a 3Pt. Wide open! John Duncan is 6.4 feet away. [MAN] Ja Dosunmu misses. Rebound secured by Anfernee Sexton.

[05:21] Team_002 possession (Score: 10-14)
CJ Barrett attempts a 3Pt. Contested by Larry Trent (4.9 feet, ZONE). CJ Barrett misses. Rebound secured by Rudy George.

[05:08] Team_001 possession (Score: 10-14)
Larry Trent drives, picks up Lamelo O'Neal. Help arrives from CJ Barrett! Larry Trent attempts a Layup. Wide open! CJ Barrett is 6.8 feet away. [ZONE] Larry Trent misses. Rebound secured by CJ Barrett.

[04:53] Team_002 possession (Score: 10-14)
John Duncan drives, Ja Dosunmu stays with him. John Duncan attempts a Dunk. Contested by Ja Dosunmu (6.0 feet, MAN). JOHN DUNCAN MAKES IT! Assist: Julius Curry
Score: 10-16

[04:40] Team_001 possession (Score: 10-16)
Rudy George attempts a Midrange. Contested by CJ Barrett (4.8 feet, MAN). Rudy George misses. Rebound secured by Anfernee Sexton.

[04:31] Team_002 possession (Score: 10-16)
John Duncan attempts a Midrange. Wide open! Ja Dosunmu is 6.1 feet away. [MAN] John Duncan misses. Rebound secured by Larry Trent.

[04:16] Team_001 possession (Score: 10-16)
Kristaps Ming drives to the basket... Kristaps Ming throws a bad pass out of bounds! TURNOVER! (dead ball)

[04:16] Substitution (Team_001): Dejounte McCollum OUT → Cole Ball IN (stamina_rule2)

[04:16] Substitution (Team_002): CJ Barrett OUT → Dirk Middleton IN (stamina_rule2)

[04:04] Team_002 possession (Score: 10-16)
John Duncan attempts a 3Pt. Wide open! Ja Dosunmu is 6.2 feet away. [MAN] John Duncan misses. Rebound secured by Larry Trent.

[03:53] Team_001 possession (Score: 10-16)
Larry Trent attempts a 3Pt. Contested by Anfernee Sexton (5.7 feet, MAN). LARRY TRENT MAKES IT! Assist: Rudy George
Score: 13-16

[03:40] Team_002 possession (Score: 13-16)
FOUL! Shooting foul on Kristaps Ming. Lamelo O'Neal to the line for 2 free throws. [BONUS: 5 team fouls] (Kristaps Ming: 1 personal fouls)   FT 1/2: MISS   FT 2/2: GOOD Lamelo O'Neal makes 1/2 from the line.
Score: 13-17

[03:26] Team_001 possession (Score: 13-17)
Larry Trent drives, picks up Anfernee Sexton. Help arrives from Dirk Middleton! Larry Trent attempts a Layup. Contested by Dirk Middleton (5.8 feet, MAN). LARRY TRENT MAKES IT! Assist: Rudy George
Score: 15-17

[03:12] Team_002 possession (Score: 15-17)
FOUL! Shooting foul on Cole Ball. Julius Curry to the line for 2 free throws. [BONUS: 6 team fouls] (Cole Ball: 2 personal fouls)   FT 1/2: MISS   FT 2/2: GOOD Julius Curry makes 1/2 from the line.
Score: 15-18

[02:58] Team_001 possession (Score: 15-18)
Ja Dosunmu drives to the basket... Ja Dosunmu commits an offensive foul! TURNOVER! (dead ball)

[02:42] Team_002 possession (Score: 15-18)
Lamelo O'Neal attempts a Layup. Wide open! Kristaps Ming is 7.6 feet away. [MAN] LAMELO O'NEAL MAKES IT! Assist: John Duncan
Score: 15-20

[02:30] Team_001 possession (Score: 15-20)
FOUL! Holding foul on Lamelo O'Neal. [IN THE BONUS! 7 team fouls] Kristaps Ming to the line for 2 free throws. (Lamelo O'Neal: 1 personal fouls)   FT 1/2: GOOD   FT 2/2: GOOD Kristaps Ming makes 2/2 from the line.
Score: 17-20

[02:13] Team_002 possession (Score: 17-20)
Anfernee Sexton attempts a 3Pt. Contested by Cole Ball (3.0 feet, MAN). Anfernee Sexton misses. Rebound secured by Cole Ball.

[01:59] Team_001 possession (Score: 17-20)
FOUL! Holding foul on Anfernee Sexton. [IN THE BONUS! 8 team fouls] Cole Ball to the line for 2 free throws. (Anfernee Sexton: 1 personal fouls)   FT 1/2: GOOD   FT 2/2: GOOD Cole Ball makes 2/2 from the line.
Score: 19-20

[01:49] Team_002 possession (Score: 19-20)
Dirk Middleton attempts a 3Pt. Contested by Cole Ball (3.1 feet, MAN). Dirk Middleton misses. Offensive rebound by Dirk Middleton! Dirk Middleton kicks it out.

[01:37] Team_002 possession (Score: 19-20)
Lamelo O'Neal attempts a 3Pt. Wide open! Kristaps Ming is 7.8 feet away. [MAN] Lamelo O'Neal misses. Offensive rebound by Anfernee Sexton! Anfernee Sexton kicks it out.

[01:19] Team_002 possession (Score: 19-20)
John Duncan drives, Kristaps Ming stays with him. John Duncan attempts a Dunk. Wide open! Kristaps Ming is 7.9 feet away. [ZONE] John Duncan misses. Offensive rebound by Dirk Middleton! Dirk Middleton kicks it out.

[01:04] Team_002 possession (Score: 19-20)
FOUL! Reach-in foul on Cole Ball during the drive. [IN THE BONUS! 9 team fouls] Anfernee Sexton to the line for 2 free throws. (Cole Ball: 3 personal fouls)   FT 1/2: GOOD   FT 2/2: GOOD Anfernee Sexton makes 2/2 from the line.
Score: 19-22

[00:52] Team_001 possession (Score: 19-22)
Kristaps Ming attempts a Layup. Wide open! Lamelo O'Neal is 8.0 feet away. [MAN] KRISTAPS MING MAKES IT! Assist: Ja Dosunmu
Score: 21-22

[00:37] Team_002 possession (Score: 21-22)
Anfernee Sexton attempts a 3Pt. Contested by Cole Ball (3.2 feet, MAN). Anfernee Sexton misses. FOUL! Loose ball foul on Larry Trent during the rebound battle. [IN THE BONUS! 10 team fouls] Dirk Middleton to the line for 2 free throws. (Larry Trent: 1 personal fouls)   FT 1/2: GOOD   FT 2/2: GOOD Dirk Middleton makes 2/2 from the line.
Score: 21-24

[00:18] Team_001 possession (Score: 21-24)
Kristaps Ming drives, Lamelo O'Neal stays with him. Kristaps Ming attempts a Layup. Wide open! Lamelo O'Neal is 8.0 feet away. [MAN] KRISTAPS MING MAKES IT! Assist: Cole Ball
Score: 23-24

[00:04] Team_002 possession (Score: 23-24)
John Duncan commits an offensive foul! Ja Dosunmu drew the charge! TURNOVER! (dead ball)

================================================================================
                              1ST QUARTER COMPLETE                              
================================================================================

1ST QUARTER SCORE: Team_001 23, Team_002 24

BOX SCORE:
================================================================================

Team_001
--------------------------------------------------------------------------------
Player                MIN  PTS  REB  AST  TO      FG   FG%      3P   3P%
--------------------------------------------------------------------------------
Kristaps Ming          11    8    0    1   0   3/3   100.0     0/0   0.0
Cole Ball               7    5    3    1   0   1/1   100.0     0/0   0.0
Larry Trent             9    5    2    0   0   2/3    66.7     0/0   0.0
Ja Dosunmu             11    2    0    1   0   1/4    25.0     0/0   0.0
Rudy George            11    2    3    3   0   1/3    33.3     0/0   0.0
Dirk Young              1    0    0    1   0   0/0     0.0     0/0   0.0
Dejounte McCollum       8    0    2    0   0   0/1     0.0     0/0   0.0

TEAM: FG: 8/15 (53.3%), 3PT: 2/3 (66.7%), REB: 10 (1 off, 9 def), AST: 7, TO: 6
TEAM FOULS: 0


Team_002
--------------------------------------------------------------------------------
Player                MIN  PTS  REB  AST  TO      FG   FG%      3P   3P%
--------------------------------------------------------------------------------
Anfernee Sexton        11    7    6    0   0   2/3    66.7     0/0   0.0
John Duncan            11    5    0    2   0   2/6    33.3     0/0   0.0
Lamelo O'Neal          11    5    0    0   0   1/1   100.0     0/0   0.0
CJ Barrett              6    4    1    1   0   2/3    66.7     0/0   0.0
Dirk Middleton          4    2    2    0   0   0/0     0.0     0/0   0.0
Julius Curry            9    1    1    1   0   0/1     0.0     0/0   0.0
Miles Bane              3    0    0    1   0   0/1     0.0     0/0   0.0
Tyler Porzingis         1    0    0    0   0   0/1     0.0     0/0   0.0
Jordan Green            3    0    1    1   0   0/0     0.0     0/0   0.0

TEAM: FG: 7/16 (43.8%), 3PT: 2/7 (28.6%), REB: 11 (4 off, 7 def), AST: 6, TO: 1
TEAM FOULS: 10 [Team_001 in BONUS]

================================================================================

================================================================================
                       2ND QUARTER - Team_001 vs Team_002                       
================================================================================

[12:00] Team_001 possession (Score: 23-24)
Klay Harden drives and kicks out. Klay Harden attempts a 3Pt. Contested by Miles Bane (4.5 feet, MAN). Klay Harden misses. Rebound secured by Tyler Porzingis.

[11:43] Team_002 possession (Score: 23-24)
FOUL! Holding foul on Klay Harden. [Team fouls: 1] No free throws, side out. (Klay Harden: 1 personal fouls)

[11:28] Team_001 possession (Score: 23-24)
Klay Harden makes the Layup and draws the foul on Miles Bane! And-1! Klay Harden to the line for 1. [Team fouls: 2] (Miles Bane: 1 personal fouls)   FT 1/1: GOOD Klay Harden makes 1/1 from the line.
Score: 26-24

[11:10] Team_002 possession (Score: 26-24)
CJ Barrett attempts a 3Pt. Contested by Dirk Young (3.8 feet, MAN). CJ Barrett misses. Rebound secured by Dejounte McCollum.

[10:57] Team_001 possession (Score: 26-24)
Miles Griffin drives and kicks out. Cole Ball attempts a Midrange. Contested by Jordan Green (3.8 feet, MAN). Cole Ball misses. Rebound secured by Tyler Porzingis.

[10:40] Team_002 possession (Score: 26-24)
Jordan Green attempts a 3Pt. Contested by Cole Ball (3.2 feet, MAN). JORDAN GREEN MAKES IT! Assist: Tyler Porzingis
Score: 26-27

[10:21] Team_001 possession (Score: 26-27)
Miles Griffin drives, picks up Tyler Porzingis. Help arrives from Miles Bane! Miles Griffin attempts a Layup. Contested by Miles Bane (3.1 feet, MAN). MILES GRIFFIN MAKES IT! Assist: Klay Harden
Score: 28-27

[10:06] Team_002 possession (Score: 28-27)
FOUL! Holding foul on Cole Ball. [Team fouls: 3] No free throws, side out. (Cole Ball: 1 personal fouls)

[09:47] Team_001 possession (Score: 28-27)
Dirk Young attempts a Midrange. Contested by Jordan Green (3.8 feet, ZONE). DIRK YOUNG MAKES IT! Assist: Miles Griffin
Score: 30-27

[09:31] Team_002 possession (Score: 30-27)
Jordan Green attempts a 3Pt. Contested by Cole Ball (3.3 feet, MAN). Jordan Green misses. Rebound secured by Miles Griffin.

[09:17] Team_001 possession (Score: 30-27)
Dirk Young drives, picks up CJ Barrett. Help arrives from Miles Bane! Dirk Young attempts a Dunk. Contested by Miles Bane (4.3 feet, MAN). DIRK YOUNG MAKES IT! Assist: Miles Griffin
Score: 32-27

[09:05] Team_002 possession (Score: 32-27)
CJ Barrett attempts a 3Pt. Contested by Dirk Young (3.8 feet, MAN). CJ Barrett misses. Rebound secured by Cole Ball.

[08:46] Team_001 possession (Score: 32-27)
Dirk Young attempts a 3Pt. Contested by CJ Barrett (4.4 feet, MAN). DIRK YOUNG MAKES IT! Assist: Klay Harden
Score: 35-27

[08:32] Team_002 possession (Score: 35-27)
FOUL! Holding foul on Miles Griffin. [Team fouls: 4] No free throws, side out. (Miles Griffin: 1 personal fouls)

[08:16] Team_001 possession (Score: 35-27)
FOUL! Reach-in foul on Tyler Porzingis during the drive. [IN THE BONUS! 5 team fouls] Miles Griffin to the line for 2 free throws. (Tyler Porzingis: 1 personal fouls)   FT 1/2: GOOD   FT 2/2: GOOD Miles Griffin makes 2/2 from the line.
Score: 37-27

[08:02] Team_002 possession (Score: 37-27)
CJ Barrett attempts a 3Pt. Contested by Klay Harden (3.8 feet, ZONE). CJ BARRETT MAKES IT! Assist: Jordan Green
Score: 37-30

[07:49] Team_001 possession (Score: 37-30)
Cole Ball drives and kicks out. Miles Griffin attempts a Midrange. Contested by Tyler Porzingis (3.3 feet, MAN). Miles Griffin misses. Offensive rebound by Miles Griffin! Miles Griffin kicks it out.

[07:35] Team_001 possession (Score: 37-30)
Miles Griffin drives, Tyler Porzingis stays with him. Miles Griffin attempts a Layup. Contested by Tyler Porzingis (3.4 feet, MAN). MILES GRIFFIN MAKES IT!
Score: 39-30

[07:21] Team_002 possession (Score: 39-30)
Carmelo Lowry attempts a 3Pt. Contested by Dejounte McCollum (4.3 feet, MAN). CARMELO LOWRY MAKES IT! Assist: Jordan Green
Score: 39-33

[07:07] Team_001 possession (Score: 39-33)
Miles Griffin attempts a Midrange. Contested by Tyler Porzingis (3.5 feet, MAN). Miles Griffin misses. FOUL! Loose ball foul on Miles Bane during the rebound battle. [IN THE BONUS! 6 team fouls] Cole Ball to the line for 2 free throws. (Miles Bane: 2 personal fouls)   FT 1/2: GOOD   FT 2/2: MISS Cole Ball makes 1/2 from the line. Rebound secured by Miles Bane.
Score: 40-33

[06:51] Team_002 possession (Score: 40-33)
Miles Bane drives to the basket... Miles Bane loses the ball! Stripped by Klay Harden! TURNOVER! (live ball)

[06:35] Team_001 possession (Score: 40-33)
Klay Harden drives and kicks out. Dirk Young attempts a Midrange. Contested by CJ Barrett (4.7 feet, MAN). Dirk Young misses. Rebound secured by Carmelo Lowry.

[06:21] Team_002 possession (Score: 40-33)
Miles Bane loses control! Ball rolls out of bounds! TURNOVER! (dead ball)

[06:21] Substitution (Team_001): Klay Harden OUT → Rudy George IN (stamina_rule2)

[06:21] Substitution (Team_001): Dirk Young OUT → Klay Harden IN (stamina_rule2)

[06:21] Substitution (Team_001): Cole Ball OUT → Franz Bryant IN (stamina_rule2)

[06:21] Substitution (Team_001): Dejounte McCollum OUT → Larry Trent IN (stamina_rule2)

[06:21] Substitution (Team_001): Miles Griffin OUT → Kristaps Ming IN (stamina_rule2)

[06:21] Substitution (Team_002): Miles Bane OUT → Dirk Middleton IN (stamina_rule2)

[06:21] Substitution (Team_002): CJ Barrett OUT → Miles Bane IN (stamina_rule2)

[06:21] Substitution (Team_002): Jordan Green OUT → Julius Curry IN (stamina_rule2)

[06:21] Substitution (Team_002): Carmelo Lowry OUT → Jordan Green IN (stamina_rule2)

[06:21] Substitution (Team_002): Tyler Porzingis OUT → Lamelo O'Neal IN (stamina_rule2)

[06:06] Team_001 possession (Score: 40-33)
Klay Harden drives and kicks out. Franz Bryant attempts a 3Pt. Contested by Julius Curry (5.6 feet, MAN). FRANZ BRYANT MAKES IT! Assist: Larry Trent
Score: 43-33

[05:54] Team_002 possession (Score: 43-33)
Dirk Middleton attempts a 3Pt. Contested by Rudy George (5.2 feet, MAN). Dirk Middleton misses. Rebound secured by Klay Harden.

[05:40] Team_001 possession (Score: 43-33)
Klay Harden loses control! Ball rolls out of bounds! TURNOVER! (dead ball)

[05:40] Substitution (Team_001): Klay Harden OUT → Dirk Young IN (stamina_rule2)

[05:40] Substitution (Team_002): Miles Bane OUT → John Duncan IN (stamina_rule2)

[05:40] Substitution (Team_002): Jordan Green OUT → Anfernee Sexton IN (stamina_rule2)

[05:25] Team_002 possession (Score: 43-33)
John Duncan makes the Layup and draws the foul on Dirk Young! And-1! John Duncan to the line for 1. [BONUS: 7 team fouls] (Dirk Young: 1 personal fouls)   FT 1/1: GOOD John Duncan makes 1/1 from the line.
Score: 43-36

[05:07] Team_001 possession (Score: 43-36)
Franz Bryant attempts a Layup. BLOCKED BY JOHN DUNCAN! Rebound secured by Julius Curry.

[04:52] Team_002 possession (Score: 43-36)
Lamelo O'Neal attempts a Midrange. Contested by Larry Trent (4.4 feet, ZONE). Lamelo O'Neal misses. Offensive rebound by Anfernee Sexton! Anfernee Sexton kicks it out.

[04:38] Team_002 possession (Score: 43-36)
FOUL! Shooting foul on Franz Bryant. Lamelo O'Neal to the line for 2 free throws. [BONUS: 8 team fouls] (Franz Bryant: 1 personal fouls)   FT 1/2: MISS   FT 2/2: MISS Lamelo O'Neal makes 0/2 from the line. Rebound secured by Rudy George.

[04:28] Team_001 possession (Score: 43-36)
Franz Bryant attempts a Midrange. Contested by Julius Curry (5.8 feet, MAN). FRANZ BRYANT MAKES IT!
Score: 45-36

[04:14] Team_002 possession (Score: 45-36)
Dirk Middleton attempts a Layup. Contested by Franz Bryant (3.8 feet, ZONE). DIRK MIDDLETON MAKES IT! Assist: Julius Curry
Score: 45-38

[03:55] Team_001 possession (Score: 45-38)
Dirk Young attempts a 3Pt. Wide open! Dirk Middleton is 6.0 feet away. [ZONE] DIRK YOUNG MAKES IT! Assist: Kristaps Ming
Score: 48-38

[03:44] Team_002 possession (Score: 48-38)
Dirk Middleton attempts a Midrange. Contested by Dirk Young (4.3 feet, MAN). Dirk Middleton misses. Rebound secured by Dirk Young.

[03:27] Team_001 possession (Score: 48-38)
Rudy George attempts a 3Pt. Wide open! Dirk Middleton is 6.0 feet away. [MAN] Rudy George misses. Rebound secured by Anfernee Sexton.

[03:13] Team_002 possession (Score: 48-38)
Dirk Middleton attempts a Midrange. Contested by Dirk Young (4.4 feet, MAN). Dirk Middleton misses. Rebound secured by Rudy George.

[02:56] Team_001 possession (Score: 48-38)
Kristaps Ming attempts a Midrange. Contested by Lamelo O'Neal (5.5 feet, MAN). KRISTAPS MING MAKES IT! Assist: Rudy George
Score: 50-38

[02:41] Team_002 possession (Score: 50-38)
Anfernee Sexton attempts a 3Pt. Contested by Larry Trent (4.7 feet, MAN). Anfernee Sexton misses. Rebound secured by Franz Bryant.

[02:26] Team_001 possession (Score: 50-38)
Dirk Young attempts a Layup. Contested by Lamelo O'Neal (5.6 feet, ZONE). DIRK YOUNG MAKES IT!
Score: 52-38

[02:15] Team_002 possession (Score: 52-38)
Julius Curry attempts a Midrange. Contested by Franz Bryant (3.9 feet, ZONE). Julius Curry misses. Rebound secured by Rudy George.

[02:02] Team_001 possession (Score: 52-38)
Rudy George attempts a 3Pt. Wide open! Dirk Middleton is 6.2 feet away. [MAN] Rudy George misses. Rebound secured by Julius Curry.

[01:51] Team_002 possession (Score: 52-38)
John Duncan attempts a 3Pt. Contested by Dirk Young (4.6 feet, MAN). John Duncan misses. Rebound secured by Franz Bryant.

[01:36] Team_001 possession (Score: 52-38)
Dirk Young attempts a 3Pt. Wide open! Dirk Middleton is 6.2 feet away. [ZONE] DIRK YOUNG MAKES IT! Assist: Larry Trent
Score: 55-38

[01:18] Team_002 possession (Score: 55-38)
Anfernee Sexton attempts a 3Pt. Contested by Larry Trent (5.0 feet, MAN). Anfernee Sexton misses. Rebound secured by Dirk Young.

[01:03] Team_001 possession (Score: 55-38)
Dirk Young attempts a Midrange. Wide open! Dirk Middleton is 6.3 feet away. [MAN] DIRK YOUNG MAKES IT!
Score: 57-38

[00:51] Team_002 possession (Score: 57-38)
Lamelo O'Neal attempts a Layup. Contested by Franz Bryant (4.1 feet, ZONE). Lamelo O'Neal misses. FOUL! Loose ball foul on Franz Bryant during the rebound battle. [IN THE BONUS! 9 team fouls] Anfernee Sexton to the line for 2 free throws. (Franz Bryant: 2 personal fouls)   FT 1/2: GOOD   FT 2/2: GOOD Anfernee Sexton makes 2/2 from the line.
Score: 57-40

[00:35] Team_001 possession (Score: 57-40)
Franz Bryant attempts a 3Pt. Wide open! Julius Curry is 6.2 feet away. [MAN] Franz Bryant misses. FOUL! Loose ball foul on John Duncan during the rebound battle. [IN THE BONUS! 10 team fouls] Franz Bryant to the line for 2 free throws. (John Duncan: 1 personal fouls)   FT 1/2: GOOD   FT 2/2: GOOD Franz Bryant makes 2/2 from the line.
Score: 59-40

[00:17] Team_002 possession (Score: 59-40)
Julius Curry attempts a Midrange. Contested by Franz Bryant (4.1 feet, MAN). JULIUS CURRY MAKES IT!
Score: 59-42

[00:02] Team_001 possession (Score: 59-42)
FOUL! Holding foul on Dirk Middleton. [IN THE BONUS! 11 team fouls] Rudy George to the line for 2 free throws. (Dirk Middleton: 1 personal fouls)   FT 1/2: GOOD   FT 2/2: GOOD Rudy George makes 2/2 from the line.
Score: 61-42

================================================================================
                              2ND QUARTER COMPLETE                              
================================================================================

2ND QUARTER SCORE: Team_001 38, Team_002 18

BOX SCORE:
================================================================================

Team_001
--------------------------------------------------------------------------------
Player                MIN  PTS  REB  AST  TO      FG   FG%      3P   3P%
--------------------------------------------------------------------------------
Dirk Young             13   17    2    0   0   7/7   100.0     0/0   0.0
Franz Bryant            6    7    2    0   0   2/3    66.7     0/0   0.0
Miles Griffin           7    6    2    2   0   2/4    50.0     0/0   0.0
Klay Harden             8    3    1    2   0   1/3    33.3     0/0   0.0
Rudy George            17    2    3    1   0   0/2     0.0     0/0   0.0
Kristaps Ming          17    2    0    1   0   1/1   100.0     0/0   0.0
Dejounte McCollum      14    0    1    0   0   0/0     0.0     0/0   0.0
Cole Ball              13    0    1    0   0   0/0     0.0     0/0   0.0
Miles Bane              9    0    1    0   0   0/0     0.0     0/0   0.0
Larry Trent            16    0    0    2   0   0/0     0.0     0/0   0.0

TEAM: FG: 13/20 (65.0%), 3PT: 3/5 (60.0%), REB: 13 (2 off, 11 def), AST: 8, TO: 1
TEAM FOULS: 0


Team_002
--------------------------------------------------------------------------------
Player                MIN  PTS  REB  AST  TO      FG   FG%      3P   3P%
--------------------------------------------------------------------------------
CJ Barrett             12    3    0    0   0   1/3    33.3     0/0   0.0
Jordan Green            9    3    0    2   0   1/2    50.0     0/0   0.0
Carmelo Lowry           7    3    1    0   0   1/1   100.0     0/0   0.0
John Duncan            16    3    0    0   0   1/2    50.0     0/0   0.0
Dirk Middleton         11    2    0    0   0   1/4    25.0     0/0   0.0
Julius Curry           16    2    2    1   0   1/2    50.0     0/0   0.0
Anfernee Sexton        16    2    2    0   0   0/2     0.0     0/0   0.0
Tyler Porzingis         7    0    2    1   0   0/0     0.0     0/0   0.0
Lamelo O'Neal          17    0    0    0   0   0/1     0.0     0/0   0.0

TEAM: FG: 6/17 (35.3%), 3PT: 3/10 (30.0%), REB: 7 (1 off, 6 def), AST: 4, TO: 2
TEAM FOULS: 11 [Team_001 in BONUS]

================================================================================

================================================================================
                       3RD QUARTER - Team_001 vs Team_002                       
================================================================================

[12:00] Team_001 possession (Score: 61-42)
FOUL! Shooting foul on Tyler Porzingis. Miles Griffin to the line for 2 free throws. [Team fouls: 1] (Tyler Porzingis: 1 personal fouls)   FT 1/2: GOOD   FT 2/2: GOOD Miles Griffin makes 2/2 from the line.
Score: 63-42

[11:43] Team_002 possession (Score: 63-42)
Miles Bane attempts a 3Pt. Contested by Klay Harden (3.3 feet, MAN). Miles Bane misses. Offensive rebound by Tyler Porzingis! Tyler Porzingis's putback is no good. Rebound secured by Dejounte McCollum.

[11:31] Team_001 possession (Score: 63-42)
Klay Harden drives and kicks out. Klay Harden attempts a Midrange. Contested by Miles Bane (4.5 feet, MAN). Klay Harden misses. Rebound secured by Tyler Porzingis.

[11:13] Team_002 possession (Score: 63-42)
Carmelo Lowry attempts a 3Pt. Contested by Dejounte McCollum (3.8 feet, MAN). CARMELO LOWRY MAKES IT!
Score: 63-45

[11:04] Team_001 possession (Score: 63-45)
Miles Griffin commits an offensive foul! Tyler Porzingis drew the charge! TURNOVER! (dead ball)

[10:46] Team_002 possession (Score: 63-45)
FOUL! Shooting foul on Miles Griffin. Tyler Porzingis to the line for 2 free throws. [Team fouls: 2] (Miles Griffin: 1 personal fouls)   FT 1/2: GOOD   FT 2/2: MISS Tyler Porzingis makes 1/2 from the line. Offensive rebound by Tyler Porzingis! Tyler Porzingis kicks it out.
Score: 63-46

[10:28] Team_002 possession (Score: 63-46)
FOUL! Holding foul on Miles Griffin. [Team fouls: 4] No free throws, side out. (Miles Griffin: 2 personal fouls)

[10:14] Team_001 possession (Score: 63-46)
Dirk Young attempts a Layup. BLOCKED BY CJ BARRETT! Offensive rebound by Miles Griffin! Miles Griffin kicks it out.

[09:56] Team_001 possession (Score: 63-46)
Dirk Young attempts a 3Pt. Contested by CJ Barrett (3.8 feet, MAN). DIRK YOUNG MAKES IT! Assist: Klay Harden
Score: 66-46

[09:40] Team_002 possession (Score: 66-46)
Miles Bane attempts a 3Pt. Contested by Klay Harden (3.3 feet, MAN). Miles Bane misses. Rebound secured by Cole Ball.

[09:27] Team_001 possession (Score: 66-46)
Dejounte McCollum attempts a Layup. Contested by Carmelo Lowry (3.6 feet, MAN). DEJOUNTE MCCOLLUM MAKES IT! Assist: Klay Harden
Score: 68-46

[09:11] Team_002 possession (Score: 68-46)
Carmelo Lowry attempts a 3Pt. Contested by Dejounte McCollum (3.8 feet, MAN). CARMELO LOWRY MAKES IT! Assist: Miles Bane
Score: 68-49

[08:56] Team_001 possession (Score: 68-49)
Dirk Young attempts a Midrange. Contested by CJ Barrett (3.8 feet, MAN). DIRK YOUNG MAKES IT!
Score: 70-49

[08:44] Team_002 possession (Score: 70-49)
Tyler Porzingis attempts a Layup. Contested by Miles Griffin (3.7 feet, MAN). Tyler Porzingis misses. Offensive rebound by Tyler Porzingis! Tyler Porzingis's putback is no good. Offensive rebound by Carmelo Lowry! Carmelo Lowry kicks it out.

[08:29] Team_002 possession (Score: 70-49)
Miles Bane attempts a Layup. BLOCKED BY KLAY HARDEN! Ball goes out of bounds. Turnover!

[08:12] Team_001 possession (Score: 70-49)
FOUL! Shooting foul on Tyler Porzingis. Miles Griffin to the line for 2 free throws. [BONUS: 6 team fouls] (Tyler Porzingis: 3 personal fouls)   FT 1/2: GOOD   FT 2/2: GOOD Miles Griffin makes 2/2 from the line.
Score: 72-49

[08:02] Team_002 possession (Score: 72-49)
Carmelo Lowry attempts a 3Pt. Contested by Klay Harden (3.3 feet, ZONE). Carmelo Lowry misses. Rebound secured by Dejounte McCollum.

[07:50] Team_001 possession (Score: 72-49)
Miles Griffin attempts a Layup. Contested by Tyler Porzingis (3.0 feet, ZONE). Miles Griffin misses. Rebound secured by Miles Bane.

[07:38] Team_002 possession (Score: 72-49)
CJ Barrett attempts a Midrange. Contested by Dirk Young (3.8 feet, MAN). CJ BARRETT MAKES IT!
Score: 72-51

[07:23] Team_001 possession (Score: 72-51)
Miles Griffin attempts a 3Pt. Contested by Tyler Porzingis (3.0 feet, MAN). MILES GRIFFIN MAKES IT! Assist: Klay Harden
Score: 75-51

[07:10] Team_002 possession (Score: 75-51)
Carmelo Lowry attempts a Midrange. Contested by Dejounte McCollum (3.8 feet, MAN). CARMELO LOWRY MAKES IT! Assist: Jordan Green
Score: 75-53

[06:55] Team_001 possession (Score: 75-53)
Dejounte McCollum attempts a 3Pt. Contested by Carmelo Lowry (3.6 feet, MAN). DEJOUNTE MCCOLLUM MAKES IT! Assist: Miles Griffin
Score: 78-53

[06:43] Team_002 possession (Score: 78-53)
Tyler Porzingis attempts a Midrange. Contested by Miles Griffin (3.7 feet, MAN). Tyler Porzingis misses. Offensive rebound by Carmelo Lowry! Carmelo Lowry kicks it out.

[06:30] Team_002 possession (Score: 78-53)
CJ Barrett drives to the basket... CJ Barrett loses the ball! Stripped by Dirk Young! TURNOVER! (live ball)

[06:14] Team_001 possession (Score: 78-53)
FOUL! Reach-in foul on Tyler Porzingis during the drive. [IN THE BONUS! 7 team fouls] Klay Harden to the line for 2 free throws. (Tyler Porzingis: 4 personal fouls)   FT 1/2: GOOD   FT 2/2: GOOD Klay Harden makes 2/2 from the line.
Score: 80-53

[05:56] Team_002 possession (Score: 80-53)
Miles Bane drives and kicks out. CJ Barrett attempts a 3Pt. Contested by Dirk Young (3.8 feet, MAN). CJ Barrett misses. Rebound secured by Dejounte McCollum.

[05:39] Team_001 possession (Score: 80-53)
Klay Harden drives to the basket... Klay Harden loses control! Ball rolls out of bounds! TURNOVER! (dead ball)

[05:28] Team_002 possession (Score: 80-53)
FOUL! Reach-in foul on Dejounte McCollum during the drive. [IN THE BONUS! 8 team fouls] Carmelo Lowry to the line for 2 free throws. (Dejounte McCollum: 2 personal fouls)   FT 1/2: MISS   FT 2/2: MISS Carmelo Lowry makes 0/2 from the line. Offensive rebound by Carmelo Lowry! Carmelo Lowry kicks it out.

[05:18] Team_002 possession (Score: 80-53)
Miles Bane drives to the basket... Miles Bane loses control! Ball rolls out of bounds! TURNOVER! (dead ball)

[05:02] Team_001 possession (Score: 80-53)
Miles Griffin attempts a 3Pt. Contested by Tyler Porzingis (3.1 feet, MAN). Miles Griffin misses. Rebound secured by Tyler Porzingis.

[04:48] Team_002 possession (Score: 80-53)
Jordan Green attempts a Midrange. Contested by Cole Ball (2.9 feet, MAN). Jordan Green misses. Rebound secured by Dejounte McCollum.

[04:35] Team_001 possession (Score: 80-53)
Miles Griffin drives to the basket... Miles Griffin throws a bad pass! Stolen by Tyler Porzingis! TURNOVER! (live ball)

[04:22] Team_002 possession (Score: 80-53)
FOUL! Reach-in foul on Cole Ball during the drive. [IN THE BONUS! 9 team fouls] Jordan Green to the line for 2 free throws. (Cole Ball: 1 personal fouls)   FT 1/2: MISS   FT 2/2: GOOD Jordan Green makes 1/2 from the line.
Score: 80-54

[04:06] Team_001 possession (Score: 80-54)
Miles Griffin attempts a Midrange. Contested by Miles Bane (4.6 feet, ZONE). Miles Griffin misses. Rebound secured by Miles Bane.

[03:49] Team_002 possession (Score: 80-54)
CJ Barrett attempts a 3Pt. Contested by Dirk Young (4.0 feet, MAN). CJ Barrett misses. Offensive rebound by Tyler Porzingis! Tyler Porzingis puts it back in!
Score: 80-56

[03:32] Team_001 possession (Score: 80-56)
Miles Griffin throws a bad pass! Stolen by Tyler Porzingis! TURNOVER! (live ball)

[03:16] Team_002 possession (Score: 80-56)
Miles Bane attempts a 3Pt. Contested by Cole Ball (3.0 feet, ZONE). Miles Bane misses. Rebound secured by Miles Griffin.

[03:02] Team_001 possession (Score: 80-56)
Klay Harden throws a bad pass out of bounds! TURNOVER! (dead ball)

[03:02] Substitution (Team_001): Klay Harden OUT → Ja Dosunmu IN (stamina_rule2)

[03:02] Substitution (Team_001): Dirk Young OUT → Rudy George IN (stamina_rule2)

[03:02] Substitution (Team_001): Miles Griffin OUT → Kristaps Ming IN (stamina_rule2)

[03:02] Substitution (Team_002): CJ Barrett OUT → Dirk Middleton IN (stamina_rule2)

[03:02] Substitution (Team_002): Carmelo Lowry OUT → Julius Curry IN (stamina_rule2)

[02:49] Team_002 possession (Score: 80-56)
FOUL! Shooting foul on Ja Dosunmu. Miles Bane to the line for 3 free throws. [BONUS: 10 team fouls] (Ja Dosunmu: 1 personal fouls)   FT 1/3: GOOD   FT 2/3: GOOD   FT 3/3: GOOD Miles Bane makes 3/3 from the line.
Score: 80-59

[02:33] Team_001 possession (Score: 80-59)
Kristaps Ming drives and kicks out. Rudy George attempts a Midrange. Contested by Dirk Middleton (5.9 feet, MAN). RUDY GEORGE MAKES IT!
Score: 82-59

[02:17] Team_002 possession (Score: 82-59)
Julius Curry attempts a Midrange. Contested by Dejounte McCollum (4.0 feet, MAN). Julius Curry misses. Offensive rebound by Miles Bane! Miles Bane kicks it out.

[02:07] Team_002 possession (Score: 82-59)
Miles Bane attempts a 3Pt. Contested by Ja Dosunmu (3.5 feet, MAN). Miles Bane misses. Rebound secured by Rudy George.

[01:50] Team_001 possession (Score: 82-59)
Cole Ball attempts a Layup. Contested by Jordan Green (4.2 feet, MAN). Cole Ball misses. Rebound secured by Tyler Porzingis.

[01:35] Team_002 possession (Score: 82-59)
FOUL! Shooting foul on Rudy George. Tyler Porzingis to the line for 2 free throws. [BONUS: 11 team fouls] (Rudy George: 1 personal fouls)   FT 1/2: MISS   FT 2/2: GOOD Tyler Porzingis makes 1/2 from the line.
Score: 82-60

[01:19] Team_001 possession (Score: 82-60)
Cole Ball attempts a Layup. Contested by Jordan Green (4.3 feet, MAN). COLE BALL MAKES IT! Assist: Kristaps Ming
Score: 84-60

[01:03] Team_002 possession (Score: 84-60)
Julius Curry attempts a 3Pt. Contested by Ja Dosunmu (3.5 feet, ZONE). Julius Curry misses. Rebound secured by Dejounte McCollum.

[00:46] Team_001 possession (Score: 84-60)
Ja Dosunmu attempts a 3Pt. Contested by Miles Bane (5.0 feet, MAN). Ja Dosunmu misses. Offensive rebound by Cole Ball! Cole Ball kicks it out.

[00:33] Team_001 possession (Score: 84-60)
Ja Dosunmu attempts a 3Pt. Contested by Miles Bane (5.0 feet, MAN). Ja Dosunmu misses. Rebound secured by Miles Bane.

[00:19] Team_002 possession (Score: 84-60)
Jordan Green attempts a 3Pt. Contested by Cole Ball (3.4 feet, MAN). Jordan Green misses. Rebound secured by Rudy George.

[00:04] Team_001 possession (Score: 84-60)
Kristaps Ming drives and kicks out. Kristaps Ming attempts a Midrange. Contested by Tyler Porzingis (3.7 feet, MAN). KRISTAPS MING MAKES IT!
Score: 86-60

================================================================================
                              3RD QUARTER COMPLETE                              
================================================================================

3RD QUARTER SCORE: Team_001 25, Team_002 18

BOX SCORE:
================================================================================

Team_001
--------------------------------------------------------------------------------
Player                MIN  PTS  REB  AST  TO      FG   FG%      3P   3P%
--------------------------------------------------------------------------------
Miles Griffin          16    7    2    1   0   1/4    25.0     0/0   0.0
Dejounte McCollum      26    5    5    0   0   2/2   100.0     0/0   0.0
Dirk Young             22    5    0    0   0   2/2   100.0     0/0   0.0
Klay Harden            17    2    0    3   0   0/1     0.0     0/0   0.0
Cole Ball              25    2    2    0   0   1/2    50.0     0/0   0.0
Rudy George            20    2    2    0   0   1/1   100.0     0/0   0.0
Kristaps Ming          20    2    0    1   0   1/1   100.0     0/0   0.0
Ja Dosunmu             14    0    0    0   0   0/1     0.0     0/0   0.0

TEAM: FG: 8/14 (57.1%), 3PT: 3/5 (60.0%), REB: 10 (2 off, 8 def), AST: 5, TO: 5
TEAM FOULS: 0


Team_002
--------------------------------------------------------------------------------
Player                MIN  PTS  REB  AST  TO      FG   FG%      3P   3P%
--------------------------------------------------------------------------------
Carmelo Lowry          16    8    3    0   0   3/4    75.0     0/0   0.0
Miles Bane             22    3    4    1   0   0/5     0.0     0/0   0.0
Tyler Porzingis        19    3    5    0   0   1/1   100.0     0/0   0.0
CJ Barrett             22    2    0    0   0   1/1   100.0     0/0   0.0
Jordan Green           22    1    0    1   0   0/2     0.0     0/0   0.0
Julius Curry           19    0    0    0   0   0/1     0.0     0/0   0.0

TEAM: FG: 5/14 (35.7%), 3PT: 3/10 (30.0%), REB: 13 (7 off, 6 def), AST: 2, TO: 3
TEAM FOULS: 11 [Team_001 in BONUS]

================================================================================

================================================================================
                       4TH QUARTER - Team_001 vs Team_002                       
================================================================================

[12:00] Team_001 possession (Score: 86-60)
Dirk Young makes the Dunk and draws the foul on Tyler Porzingis! And-1! Dirk Young to the line for 1. [Team fouls: 1] (Tyler Porzingis: 1 personal fouls)   FT 1/1: GOOD Dirk Young makes 1/1 from the line.
Score: 89-60

[11:43] Team_002 possession (Score: 89-60)
Miles Bane attempts a Layup. Contested by Klay Harden (3.4 feet, MAN). MILES BANE MAKES IT! Assist: Carmelo Lowry
Score: 89-62

[11:33] Team_001 possession (Score: 89-62)
Dirk Young drives to the basket... Dirk Young commits an offensive foul! TURNOVER! (dead ball)

[11:21] Team_002 possession (Score: 89-62)
Carmelo Lowry attempts a 3Pt. Contested by Dejounte McCollum (4.1 feet, MAN). Carmelo Lowry misses. Rebound secured by Miles Griffin.

[11:05] Team_001 possession (Score: 89-62)
Dirk Young attempts a Layup. Contested by CJ Barrett (3.8 feet, MAN). DIRK YOUNG MAKES IT! Assist: Klay Harden
Score: 91-62

[10:46] Team_002 possession (Score: 91-62)
Jordan Green attempts a 3Pt. Contested by Cole Ball (3.3 feet, MAN). Jordan Green misses. Rebound secured by Miles Griffin.

[10:34] Team_001 possession (Score: 91-62)
Miles Griffin drives, Tyler Porzingis stays with him. Miles Griffin attempts a Layup. Contested by Tyler Porzingis (3.7 feet, MAN). MILES GRIFFIN MAKES IT! Assist: Klay Harden
Score: 93-62

[10:17] Team_002 possession (Score: 93-62)
FOUL! Reach-in foul on Klay Harden during the drive. [Team fouls: 2] No free throws, side out. (Klay Harden: 1 personal fouls)

[10:04] Team_001 possession (Score: 93-62)
Dejounte McCollum attempts a Midrange. Contested by Carmelo Lowry (3.8 feet, MAN). DEJOUNTE MCCOLLUM MAKES IT!
Score: 95-62

[09:48] Team_002 possession (Score: 95-62)
Miles Bane attempts a 3Pt. Contested by Klay Harden (3.6 feet, MAN). MILES BANE MAKES IT! Assist: Tyler Porzingis
Score: 95-65

[09:35] Team_001 possession (Score: 95-65)
Miles Griffin drives, picks up Carmelo Lowry. Help arrives from CJ Barrett! Miles Griffin attempts a Layup. Contested by CJ Barrett (3.8 feet, ZONE). Miles Griffin misses. Rebound secured by Carmelo Lowry.

[09:22] Team_002 possession (Score: 95-65)
Carmelo Lowry attempts a Layup. Contested by Dejounte McCollum (4.3 feet, MAN). Carmelo Lowry misses. Rebound secured by Cole Ball.

[09:07] Team_001 possession (Score: 95-65)
Klay Harden attempts a Layup. BLOCKED BY MILES BANE! Rebound secured by CJ Barrett.

[08:52] Team_002 possession (Score: 95-65)
Miles Bane drives and kicks out. Miles Bane attempts a 3Pt. Contested by Klay Harden (3.8 feet, MAN). Miles Bane misses. Rebound secured by Dejounte McCollum.

[08:42] Team_001 possession (Score: 95-65)
FOUL! Holding foul on CJ Barrett. [Team fouls: 3] No free throws, side out. (CJ Barrett: 1 personal fouls)

[08:23] Team_002 possession (Score: 95-65)
CJ Barrett drives and kicks out. Carmelo Lowry attempts a 3Pt. Contested by Dejounte McCollum (4.4 feet, MAN). Carmelo Lowry misses. Offensive rebound by Tyler Porzingis! Tyler Porzingis puts it back in!
Score: 95-67

[08:07] Team_001 possession (Score: 95-67)
Klay Harden attempts a Midrange. BLOCKED BY MILES BANE! Rebound secured by Tyler Porzingis.

[07:54] Team_002 possession (Score: 95-67)
Jordan Green attempts a 3Pt. Contested by Cole Ball (3.8 feet, ZONE). Jordan Green misses. Rebound secured by Miles Griffin.

[07:40] Team_001 possession (Score: 95-67)
Dirk Young attempts a Midrange. Contested by Jordan Green (4.8 feet, ZONE). DIRK YOUNG MAKES IT! Assist: Miles Griffin
Score: 97-67

[07:27] Team_002 possession (Score: 97-67)
Miles Bane attempts a 3Pt. Contested by Klay Harden (4.0 feet, MAN). Miles Bane misses. Rebound secured by Miles Griffin.

[07:12] Team_001 possession (Score: 97-67)
Klay Harden attempts a 3Pt. Contested by Miles Bane (5.5 feet, MAN). Klay Harden misses. Rebound secured by Tyler Porzingis.

[06:59] Team_002 possession (Score: 97-67)
Carmelo Lowry drives and kicks out. CJ Barrett attempts a Midrange. Contested by Dirk Young (4.4 feet, MAN). CJ Barrett misses. Rebound secured by Dejounte McCollum.

[06:44] Team_001 possession (Score: 97-67)
Miles Griffin drives to the basket... Miles Griffin throws a bad pass! Stolen by Tyler Porzingis! TURNOVER! (live ball)

[06:28] Team_002 possession (Score: 97-67)
Carmelo Lowry drives and kicks out. Carmelo Lowry attempts a Midrange. Contested by Dejounte McCollum (4.6 feet, MAN). Carmelo Lowry misses. Rebound secured by Miles Griffin.

[06:15] Team_001 possession (Score: 97-67)
Miles Griffin attempts a Midrange. Contested by Tyler Porzingis (4.4 feet, ZONE). Miles Griffin misses. Rebound secured by CJ Barrett.

[05:57] Team_002 possession (Score: 97-67)
Miles Bane attempts a 3Pt. Contested by Klay Harden (4.3 feet, MAN). MILES BANE MAKES IT! Assist: Carmelo Lowry
Score: 97-70

[05:43] Team_001 possession (Score: 97-70)
Klay Harden attempts a 3Pt. Contested by Miles Bane (5.7 feet, MAN). Klay Harden misses. Offensive rebound by Miles Griffin! Miles Griffin kicks it out.

[05:28] Team_001 possession (Score: 97-70)
FOUL! Shooting foul on Carmelo Lowry. Cole Ball to the line for 3 free throws. [Team fouls: 4] (Carmelo Lowry: 1 personal fouls)   FT 1/3: GOOD   FT 2/3: GOOD   FT 3/3: GOOD Cole Ball makes 3/3 from the line.
Score: 100-70

[05:10] Team_002 possession (Score: 100-70)
Miles Bane attempts a 3Pt. Contested by Klay Harden (4.5 feet, ZONE). Miles Bane misses. Rebound secured by Dejounte McCollum.

[04:59] Team_001 possession (Score: 100-70)
Dirk Young makes the Layup and draws the foul on CJ Barrett! And-1! Dirk Young to the line for 1. [BONUS: 5 team fouls] (CJ Barrett: 2 personal fouls)   FT 1/1: GOOD Dirk Young makes 1/1 from the line.
Score: 103-70

[04:43] Team_002 possession (Score: 103-70)
Miles Bane attempts a 3Pt. Contested by Klay Harden (4.6 feet, ZONE). Miles Bane misses. Rebound secured by Miles Griffin.

[04:29] Team_001 possession (Score: 103-70)
Miles Griffin drives, Tyler Porzingis stays with him. Miles Griffin attempts a Layup. Contested by Tyler Porzingis (4.8 feet, MAN). MILES GRIFFIN MAKES IT!
Score: 105-70

[04:18] Team_002 possession (Score: 105-70)
Carmelo Lowry attempts a Layup. Contested by Dejounte McCollum (5.0 feet, MAN). Carmelo Lowry misses. Rebound secured by Dejounte McCollum.

[04:06] Team_001 possession (Score: 105-70)
Klay Harden attempts a Layup. BLOCKED BY CJ BARRETT! Ball goes out of bounds. Turnover!

[04:06] Substitution (Team_001): Klay Harden OUT → Ja Dosunmu IN (stamina_rule2)

[04:06] Substitution (Team_001): Dirk Young OUT → Rudy George IN (stamina_rule2)

[04:06] Substitution (Team_001): Cole Ball OUT → Larry Trent IN (stamina_rule2)

[04:06] Substitution (Team_001): Dejounte McCollum OUT → Franz Bryant IN (stamina_rule2)

[04:06] Substitution (Team_001): Miles Griffin OUT → Kristaps Ming IN (stamina_rule2)

[04:06] Substitution (Team_002): Miles Bane OUT → John Duncan IN (stamina_rule2)

[04:06] Substitution (Team_002): CJ Barrett OUT → Dirk Middleton IN (stamina_rule2)

[04:06] Substitution (Team_002): Jordan Green OUT → Anfernee Sexton IN (stamina_rule2)

[04:06] Substitution (Team_002): Carmelo Lowry OUT → Julius Curry IN (stamina_rule2)

[04:06] Substitution (Team_002): Tyler Porzingis OUT → Lamelo O'Neal IN (stamina_rule2)

[03:52] Team_002 possession (Score: 105-70)
Dirk Middleton attempts a 3Pt. Contested by Rudy George (4.7 feet, ZONE). DIRK MIDDLETON MAKES IT! Assist: John Duncan
Score: 105-73

[03:39] Team_001 possession (Score: 105-73)
FOUL! Reach-in foul on Lamelo O'Neal during the drive. [IN THE BONUS! 6 team fouls] Franz Bryant to the line for 2 free throws. (Lamelo O'Neal: 1 personal fouls)   FT 1/2: GOOD   FT 2/2: GOOD Franz Bryant makes 2/2 from the line.
Score: 107-73

[03:22] Team_002 possession (Score: 107-73)
Dirk Middleton drives and kicks out. John Duncan attempts a Midrange. Contested by Ja Dosunmu (3.5 feet, MAN). JOHN DUNCAN MAKES IT!
Score: 107-75

[03:07] Team_001 possession (Score: 107-75)
Franz Bryant makes the Layup and draws the foul on Lamelo O'Neal! And-1! Franz Bryant to the line for 1. [BONUS: 7 team fouls] (Lamelo O'Neal: 2 personal fouls)   FT 1/1: GOOD Franz Bryant makes 1/1 from the line.
Score: 110-75

[02:52] Team_002 possession (Score: 110-75)
Anfernee Sexton attempts a Midrange. Contested by Larry Trent (3.9 feet, MAN). Anfernee Sexton misses. Offensive rebound by Anfernee Sexton! Anfernee Sexton kicks it out.

[02:39] Team_002 possession (Score: 110-75)
Anfernee Sexton attempts a 3Pt. Contested by Larry Trent (3.9 feet, MAN). Anfernee Sexton misses. Rebound secured by Rudy George.

[02:23] Team_001 possession (Score: 110-75)
Larry Trent attempts a 3Pt. Contested by Anfernee Sexton (4.4 feet, MAN). LARRY TRENT MAKES IT! Assist: Franz Bryant
Score: 113-75

[02:09] Team_002 possession (Score: 113-75)
Julius Curry attempts a Layup. Contested by Franz Bryant (3.8 feet, MAN). Julius Curry misses. Rebound secured by Larry Trent.

[01:55] Team_001 possession (Score: 113-75)
Larry Trent attempts a 3Pt. Contested by Julius Curry (5.4 feet, ZONE). LARRY TRENT MAKES IT!
Score: 116-75

[01:42] Team_002 possession (Score: 116-75)
Dirk Middleton attempts a 3Pt. Contested by Rudy George (4.7 feet, MAN). Dirk Middleton misses. Rebound secured by Kristaps Ming.

[01:30] Team_001 possession (Score: 116-75)
Kristaps Ming drives, picks up Lamelo O'Neal. Help arrives from John Duncan! Kristaps Ming attempts a Dunk. Contested by John Duncan (3.0 feet, MAN). KRISTAPS MING MAKES IT!
Score: 118-75

[01:18] Team_002 possession (Score: 118-75)
FOUL! Shooting foul on Rudy George. Julius Curry to the line for 2 free throws. [BONUS: 8 team fouls] (Rudy George: 1 personal fouls)   FT 1/2: GOOD   FT 2/2: GOOD Julius Curry makes 2/2 from the line.
Score: 118-77

[01:08] Team_001 possession (Score: 118-77)
Larry Trent attempts a 3Pt. Contested by Anfernee Sexton (4.4 feet, MAN). Larry Trent misses. Rebound secured by Anfernee Sexton.

[00:51] Team_002 possession (Score: 118-77)
Julius Curry attempts a Midrange. Contested by Franz Bryant (3.8 feet, ZONE). Julius Curry misses. Offensive rebound by Lamelo O'Neal! Lamelo O'Neal's putback is no good. Offensive rebound by Lamelo O'Neal! Lamelo O'Neal kicks it out.

[00:37] Team_002 possession (Score: 118-77)
Lamelo O'Neal attempts a Midrange. Contested by Kristaps Ming (5.6 feet, MAN). LAMELO O'NEAL MAKES IT! Assist: Julius Curry
Score: 118-79

[00:23] Team_001 possession (Score: 118-79)
FOUL! Shooting foul on Anfernee Sexton. Larry Trent to the line for 2 free throws. [BONUS: 10 team fouls] (Anfernee Sexton: 1 personal fouls)   FT 1/2: MISS   FT 2/2: GOOD Larry Trent makes 1/2 from the line.
Score: 119-79

[00:08] Team_002 possession (Score: 119-79)
FOUL! Shooting foul on Ja Dosunmu. John Duncan to the line for 3 free throws. [BONUS: 11 team fouls] (Ja Dosunmu: 1 personal fouls)   FT 1/3: GOOD   FT 2/3: GOOD   FT 3/3: GOOD John Duncan makes 3/3 from the line.
Score: 119-82

================================================================================
                              4TH QUARTER COMPLETE                              
================================================================================

4TH QUARTER SCORE: Team_001 33, Team_002 22

BOX SCORE:
================================================================================

Team_001
--------------------------------------------------------------------------------
Player                MIN  PTS  REB  AST  TO      FG   FG%      3P   3P%
--------------------------------------------------------------------------------
Dirk Young             30   10    0    0   0   4/4   100.0     0/0   0.0
Larry Trent            20    7    1    0   0   2/3    66.7     0/0   0.0
Franz Bryant           10    5    0    1   0   1/1   100.0     0/0   0.0
Miles Griffin          25    4    7    1   0   2/4    50.0     0/0   0.0
Cole Ball              33    3    1    0   0   0/0     0.0     0/0   0.0
Dejounte McCollum      34    2    4    0   0   1/1   100.0     0/0   0.0
Kristaps Ming          24    2    1    0   0   1/1   100.0     0/0   0.0
Klay Harden            25    0    0    2   0   0/3     0.0     0/0   0.0
Rudy George            24    0    1    0   0   0/0     0.0     0/0   0.0

TEAM: FG: 11/17 (64.7%), 3PT: 2/4 (50.0%), REB: 15 (1 off, 14 def), AST: 4, TO: 3
TEAM FOULS: 0


Team_002
--------------------------------------------------------------------------------
Player                MIN  PTS  REB  AST  TO      FG   FG%      3P   3P%
--------------------------------------------------------------------------------
Miles Bane             30    8    0    0   0   3/7    42.9     0/0   0.0
John Duncan            20    5    0    1   0   1/1   100.0     0/0   0.0
Dirk Middleton         18    3    0    0   0   1/2    50.0     0/0   0.0
Tyler Porzingis        28    2    3    1   0   1/1   100.0     0/0   0.0
Julius Curry           23    2    0    1   0   0/1     0.0     0/0   0.0
Lamelo O'Neal          21    2    1    0   0   1/1   100.0     0/0   0.0
Carmelo Lowry          25    0    1    2   0   0/5     0.0     0/0   0.0
Jordan Green           30    0    0    0   0   0/2     0.0     0/0   0.0
CJ Barrett             30    0    2    0   0   0/0     0.0     0/0   0.0
Anfernee Sexton        20    0    2    0   0   0/1     0.0     0/0   0.0

TEAM: FG: 7/21 (33.3%), 3PT: 3/11 (27.3%), REB: 9 (3 off, 6 def), AST: 5, TO: 0
TEAM FOULS: 11 [Team_001 in BONUS]

================================================================================

================================================================================
                               FULL GAME COMPLETE                               
================================================================================

FINAL SCORE: Team_001 119, Team_002 82

SCORING BY QUARTER:
--------------------------------------------------------------------------------
Team                     Q1     Q2     Q3     Q4    FINAL
--------------------------------------------------------------------------------
Team_001                 23     38     25     33      119
Team_002                 24     18     18     22       82
--------------------------------------------------------------------------------

FULL GAME BOX SCORE:
================================================================================

Team_001
--------------------------------------------------------------------------------
Player                MIN  PTS  REB  AST  TO      FG   FG%      3P   3P%      FT STL BLK
--------------------------------------------------------------------------------
Dejounte McCollum      34    7   12    0   2   3/4    75.0   1/1   100.0   0/0     0   0
Cole Ball              33   10    7    1   2   2/3    66.7   1/1   100.0   5/5     0   0
Dirk Young             30   32    2    1   1  13/13  100.0   4/4   100.0   2/2     1   0
Klay Harden            25    5    1    7   5   2/8    25.0   0/1     0.0   3/3     1   1
Miles Griffin          25   17   11    4   3   5/12   41.7   1/2    50.0   6/6     0   0
Rudy George            24    6    9    4   1   1/5    20.0   0/2     0.0   2/2     0   0
Kristaps Ming          24   14    1    3   0   7/7   100.0   0/0     0.0   2/2     0   0
Larry Trent            20   12    3    2   1   4/6    66.7   3/4    75.0   1/2     0   0
Ja Dosunmu             18    2    0    1   0   1/5    20.0   0/2     0.0   0/0     0   0
Franz Bryant           10   12    2    1   0   2/3    66.7   0/0     0.0   3/5     0   0

TEAM: FG: 40/66 (60.6%), 3PT: 10/17 (58.8%), REB: 48 (6 off, 42 def), AST: 24, TO: 15


Team_002
--------------------------------------------------------------------------------
Player                MIN  PTS  REB  AST  TO      FG   FG%      3P   3P%      FT STL BLK
--------------------------------------------------------------------------------
Miles Bane             30   11    5    2   3   3/13   23.1   2/9    22.2   3/3     0   2
Jordan Green           30    4    1    4   1   1/6    16.7   1/5    20.0   1/2     0   0
CJ Barrett             30    9    3    1   0   6/9    66.7   2/5    40.0   0/0     0   2
Tyler Porzingis        28    5   10    2   0   0/1     0.0   0/1     0.0   1/2     4   0
Carmelo Lowry          25   11    5    2   1   4/10   40.0   3/5    60.0   0/0     0   0
Julius Curry           23    5    3    3   0   1/5    20.0   0/2     0.0   3/4     0   1
Lamelo O'Neal          21    7    1    0   0   2/3    66.7   0/0     0.0   3/4     0   0
John Duncan            20   13    0    3   1   3/8    37.5   1/3    33.3   4/4     0   1
Anfernee Sexton        20    9   10    0   0   2/6    33.3   1/5    20.0   2/4     0   0
Dirk Middleton         18    7    2    0   0   3/7    42.9   1/3    33.3   0/2     0   0

TEAM: FG: 25/68 (36.8%), 3PT: 11/38 (28.9%), REB: 40 (15 off, 25 def), AST: 17, TO: 6

================================================================================
