================================================================================
                        FULL GAME - Team_001 vs Team_002                        
================================================================================

================================================================================
                       1ST QUARTER - Team_001 vs Team_002                       
================================================================================

[12:00] Team_001 possession (Score: 0-0)
Dirk Young drives to the basket... Dirk Young throws a bad pass! Stolen by Tyler Porzingis! TURNOVER! (live ball)

[11:44] Team_002 possession (Score: 0-0)
Tyler Porzingis attempts a 3Pt. Contested by Miles Griffin (5.0 feet, MAN). Tyler Porzingis misses. Rebound secured by Dejounte McCollum.

[11:30] Team_001 possession (Score: 0-0)
Klay Harden attempts a 3Pt. Contested by Miles Bane (4.8 feet, ZONE). Klay Harden misses. Offensive rebound by Dejounte McCollum! Dejounte McCollum kicks it out.

[11:15] Team_001 possession (Score: 0-0)
Dirk Young attempts a Layup. Contested by Tyler Porzingis (4.3 feet, ZONE). Dirk Young misses. Rebound secured by Tyler Porzingis.

[11:04] Team_002 possession (Score: 0-0)
CJ Barrett makes the 3Pt and draws the foul on Dirk Young! And-1! CJ Barrett to the line for 1. [Team fouls: 1] (Dirk Young: 1 personal fouls)   FT 1/1: GOOD CJ Barrett makes 1/1 from the line.
Score: 0-4

[10:49] Team_001 possession (Score: 0-4)
Dirk Young loses control! Ball rolls out of bounds! TURNOVER! (dead ball)

[10:49] Substitution (Team_001): Klay Harden OUT → Rudy George IN (stamina_rule2)

[10:49] Substitution (Team_001): Dirk Young OUT → Ja Dosunmu IN (stamina_rule2)

[10:49] Substitution (Team_001): Miles Griffin OUT → Kristaps Ming IN (stamina_rule2)

[10:49] Substitution (Team_002): Miles Bane OUT → John Duncan IN (stamina_rule2)

[10:49] Substitution (Team_002): CJ Barrett OUT → Miles Bane IN (stamina_rule2)

[10:49] Substitution (Team_002): Jordan Green OUT → Anfernee Sexton IN (stamina_rule2)

[10:49] Substitution (Team_002): Carmelo Lowry OUT → Jordan Green IN (stamina_rule2)

[10:49] Substitution (Team_002): Tyler Porzingis OUT → Lamelo O'Neal IN (stamina_rule2)

[10:38] Team_002 possession (Score: 0-4)
FOUL! Shooting foul on Ja Dosunmu. Miles Bane to the line for 2 free throws. [Team fouls: 2] (Ja Dosunmu: 1 personal fouls)   FT 1/2: GOOD   FT 2/2: GOOD Miles Bane makes 2/2 from the line.
Score: 0-6

[10:22] Team_001 possession (Score: 0-6)
Kristaps Ming makes the Layup and draws the foul on Miles Bane! And-1! Kristaps Ming to the line for 1. [Team fouls: 3] (Miles Bane: 1 personal fouls)   FT 1/1: GOOD Kristaps Ming makes 1/1 from the line.
Score: 3-6

[10:07] Team_002 possession (Score: 3-6)
Lamelo O'Neal attempts a Layup. Wide open! Kristaps Ming is 6.5 feet away. [ZONE] LAMELO O'NEAL MAKES IT!
Score: 3-8

[09:52] Team_001 possession (Score: 3-8)
Rudy George drives, Lamelo O'Neal stays with him. Rudy George attempts a Layup. Contested by Lamelo O'Neal (5.6 feet, ZONE). Rudy George misses. Offensive rebound by Cole Ball! Cole Ball kicks it out.

[09:37] Team_001 possession (Score: 3-8)
FOUL! Shooting foul on Jordan Green. Cole Ball to the line for 2 free throws. [Team fouls: 4] (Jordan Green: 1 personal fouls)   FT 1/2: MISS   FT 2/2: GOOD Cole Ball makes 1/2 from the line.
Score: 4-8

[09:23] Team_002 possession (Score: 4-8)
Lamelo O'Neal attempts a Layup. Contested by Dejounte McCollum (4.0 feet, MAN). Lamelo O'Neal misses. FOUL! Loose ball foul on Dejounte McCollum during the rebound battle. [IN THE BONUS! 5 team fouls] Anfernee Sexton to the line for 2 free throws. (Dejounte McCollum: 1 personal fouls)   FT 1/2: MISS   FT 2/2: MISS Anfernee Sexton makes 0/2 from the line. Rebound secured by Dejounte McCollum.

[09:06] Team_001 possession (Score: 4-8)
FOUL! Reach-in foul on Lamelo O'Neal during the drive. [IN THE BONUS! 6 team fouls] Dejounte McCollum to the line for 2 free throws. (Lamelo O'Neal: 1 personal fouls)   FT 1/2: MISS   FT 2/2: GOOD Dejounte McCollum makes 1/2 from the line.
Score: 5-8

[08:55] Team_002 possession (Score: 5-8)
Jordan Green drives, Cole Ball stays with him. Jordan Green attempts a Dunk. Contested by Cole Ball (3.3 feet, MAN). JORDAN GREEN MAKES IT! Assist: John Duncan
Score: 5-10

[08:39] Team_001 possession (Score: 5-10)
Rudy George attempts a Midrange. Contested by Miles Bane (5.1 feet, MAN). Rudy George misses. Rebound secured by Anfernee Sexton.

[08:23] Team_002 possession (Score: 5-10)
John Duncan drives to the basket... John Duncan throws a bad pass! Stolen by Dejounte McCollum! TURNOVER! (live ball)

[08:08] Team_001 possession (Score: 5-10)
Dejounte McCollum drives and kicks out. Kristaps Ming attempts a 3Pt. Contested by Miles Bane (5.2 feet, ZONE). Kristaps Ming misses. FOUL! Loose ball foul on Jordan Green during the rebound battle. [IN THE BONUS! 7 team fouls] Dejounte McCollum to the line for 2 free throws. (Jordan Green: 2 personal fouls)   FT 1/2: GOOD   FT 2/2: MISS Dejounte McCollum makes 1/2 from the line. Rebound secured by Anfernee Sexton.
Score: 6-10

[07:52] Team_002 possession (Score: 6-10)
John Duncan attempts a 3Pt. Contested by Cole Ball (3.4 feet, ZONE). John Duncan misses. Rebound secured by Rudy George.

[07:40] Team_001 possession (Score: 6-10)
Cole Ball attempts a 3Pt. Contested by Miles Bane (5.3 feet, ZONE). COLE BALL MAKES IT! Assist: Kristaps Ming
Score: 9-10

[07:23] Team_002 possession (Score: 9-10)
Miles Bane drives and kicks out. Lamelo O'Neal attempts a 3Pt. Contested by Dejounte McCollum (4.2 feet, MAN). Lamelo O'Neal misses. Rebound secured by Dejounte McCollum.

[07:09] Team_001 possession (Score: 9-10)
Dejounte McCollum drives, picks up Lamelo O'Neal. Help arrives from Miles Bane! Dejounte McCollum attempts a Layup. Wide open! Miles Bane is 6.3 feet away. [ZONE] DEJOUNTE MCCOLLUM MAKES IT! Assist: Cole Ball
Score: 11-10

[06:53] Team_002 possession (Score: 11-10)
John Duncan drives, Ja Dosunmu stays with him. John Duncan attempts a Dunk. Contested by Ja Dosunmu (5.6 feet, MAN). JOHN DUNCAN MAKES IT! Assist: Miles Bane
Score: 11-12

[06:41] Team_001 possession (Score: 11-12)
Rudy George attempts a 3Pt. Contested by Miles Bane (5.4 feet, MAN). RUDY GEORGE MAKES IT! Assist: Cole Ball
Score: 14-12

[06:30] Team_002 possession (Score: 14-12)
Miles Bane attempts a 3Pt. Contested by Ja Dosunmu (5.7 feet, MAN). Miles Bane misses. Rebound secured by Rudy George.

[06:16] Team_001 possession (Score: 14-12)
Rudy George attempts a 3Pt. Contested by Miles Bane (5.5 feet, ZONE). RUDY GEORGE MAKES IT!
Score: 17-12

[06:01] Team_002 possession (Score: 17-12)
FOUL! Shooting foul on Dejounte McCollum. Anfernee Sexton to the line for 2 free throws. [BONUS: 8 team fouls] (Dejounte McCollum: 2 personal fouls)   FT 1/2: GOOD   FT 2/2: MISS Anfernee Sexton makes 1/2 from the line. Rebound secured by Rudy George.
Score: 17-13

[05:47] Team_001 possession (Score: 17-13)
Dejounte McCollum drives and kicks out. Rudy George attempts a 3Pt. Contested by Miles Bane (5.6 feet, MAN). Rudy George misses. Rebound secured by Miles Bane.

[05:33] Team_002 possession (Score: 17-13)
Miles Bane attempts a 3Pt. Contested by Ja Dosunmu (5.9 feet, MAN). Miles Bane misses. Rebound secured by Dejounte McCollum.

[05:17] Team_001 possession (Score: 17-13)
Kristaps Ming attempts a Layup. Wide open! Lamelo O'Neal is 6.9 feet away. [ZONE] KRISTAPS MING MAKES IT! Assist: Dejounte McCollum
Score: 19-13

[05:03] Team_002 possession (Score: 19-13)
John Duncan attempts a 3Pt. Contested by Ja Dosunmu (6.0 feet, MAN). JOHN DUNCAN MAKES IT! Assist: Jordan Green
Score: 19-16

[04:49] Team_001 possession (Score: 19-16)
Cole Ball attempts a 3Pt. Contested by Miles Bane (5.7 feet, ZONE). Cole Ball misses. Rebound secured by Miles Bane.

[04:34] Team_002 possession (Score: 19-16)
Miles Bane attempts a Layup. Wide open! Ja Dosunmu is 6.1 feet away. [MAN] MILES BANE MAKES IT!
Score: 19-18

[04:21] Team_001 possession (Score: 19-18)
Dejounte McCollum attempts a Midrange. Contested by Jordan Green (5.2 feet, MAN). Dejounte McCollum misses. FOUL! Loose ball foul on Jordan Green during the rebound battle. [IN THE BONUS! 9 team fouls] Cole Ball to the line for 2 free throws. (Jordan Green: 3 personal fouls)   FT 1/2: GOOD   FT 2/2: GOOD Cole Ball makes 2/2 from the line.
Score: 21-18

[04:03] Team_002 possession (Score: 21-18)
Miles Bane attempts a 3Pt. Contested by Cole Ball (4.1 feet, ZONE). MILES BANE MAKES IT! Assist: John Duncan
Score: 21-21

[03:48] Team_001 possession (Score: 21-21)
Kristaps Ming attempts a 3Pt. Contested by Miles Bane (5.9 feet, ZONE). Kristaps Ming misses. Rebound secured by Miles Bane.

[03:36] Team_002 possession (Score: 21-21)
Jordan Green attempts a 3Pt. Contested by Cole Ball (4.2 feet, ZONE). JORDAN GREEN MAKES IT! Assist: John Duncan
Score: 21-24

[03:20] Team_001 possession (Score: 21-24)
Rudy George attempts a Midrange. Contested by Jordan Green (5.4 feet, ZONE). Rudy George misses. Rebound secured by Miles Bane.

[03:08] Team_002 possession (Score: 21-24)
Anfernee Sexton attempts a 3Pt. Contested by Cole Ball (4.3 feet, MAN). Anfernee Sexton misses. Rebound secured by Dejounte McCollum.

[02:52] Team_001 possession (Score: 21-24)
Ja Dosunmu drives and kicks out. Kristaps Ming attempts a 3Pt. Wide open! Miles Bane is 6.0 feet away. [ZONE] Kristaps Ming misses. Offensive rebound by Dejounte McCollum! Dejounte McCollum kicks it out.

[02:35] Team_001 possession (Score: 21-24)
Rudy George drives, picks up Lamelo O'Neal. Help arrives from Miles Bane! Rudy George attempts a Dunk. Wide open! Miles Bane is 7.6 feet away. [ZONE] RUDY GEORGE MAKES IT! Assist: Kristaps Ming
Score: 23-24

[02:19] Team_002 possession (Score: 23-24)
Miles Bane attempts a Layup. Wide open! Ja Dosunmu is 6.5 feet away. [MAN] Miles Bane misses. Rebound secured by Rudy George.

[02:02] Team_001 possession (Score: 23-24)
Kristaps Ming attempts a Midrange. Wide open! Lamelo O'Neal is 7.8 feet away. [MAN] Kristaps Ming misses. Rebound secured by Miles Bane.

[01:50] Team_002 possession (Score: 23-24)
John Duncan attempts a Midrange. Wide open! Ja Dosunmu is 6.7 feet away. [MAN] John Duncan misses. Rebound secured by Dejounte McCollum.

[01:40] Team_001 possession (Score: 23-24)
Rudy George attempts a 3Pt. Wide open! Miles Bane is 6.2 feet away. [MAN] Rudy George misses. Rebound secured by Jordan Green.

[01:22] Team_002 possession (Score: 23-24)
Anfernee Sexton attempts a Midrange. Wide open! Ja Dosunmu is 6.8 feet away. [ZONE] Anfernee Sexton misses. Offensive rebound by Anfernee Sexton! Anfernee Sexton kicks it out.

[01:07] Team_002 possession (Score: 23-24)
Miles Bane attempts a 3Pt. Contested by Cole Ball (4.7 feet, ZONE). Miles Bane misses. Rebound secured by Cole Ball.

[00:49] Team_001 possession (Score: 23-24)
Dejounte McCollum attempts a 3Pt. Contested by Jordan Green (5.8 feet, MAN). Dejounte McCollum misses. Rebound secured by Anfernee Sexton.

[00:36] Team_002 possession (Score: 23-24)
Lamelo O'Neal attempts a 3Pt. Contested by Cole Ball (4.8 feet, ZONE). Lamelo O'Neal misses. Offensive rebound by Miles Bane! Miles Bane kicks it out.

[00:21] Team_002 possession (Score: 23-24)
Miles Bane drives, picks up Ja Dosunmu. Help arrives from Cole Ball! Miles Bane attempts a Layup. Wide open! Cole Ball is 7.0 feet away. [MAN] MILES BANE MAKES IT!
Score: 23-26

[00:08] Team_001 possession (Score: 23-26)
Rudy George attempts a 3Pt. Wide open! Miles Bane is 6.5 feet away. [MAN] RUDY GEORGE MAKES IT! Assist: Kristaps Ming
Score: 26-26

================================================================================
                              1ST QUARTER COMPLETE                              
================================================================================

1ST QUARTER SCORE: Team_001 26, Team_002 26

BOX SCORE:
================================================================================

Team_001
--------------------------------------------------------------------------------
Player                MIN  PTS  REB  AST  TO      FG   FG%      3P   3P%
--------------------------------------------------------------------------------
Rudy George            11   11    4    0   0   4/7    57.1     0/0   0.0
Cole Ball              12    6    2    2   0   1/2    50.0     0/0   0.0
Kristaps Ming          11    5    0    3   0   2/4    50.0     0/0   0.0
Dejounte McCollum      12    3    8    1   0   1/4    25.0     0/0   0.0
Dirk Young              1    0    0    0   0   0/1     0.0     0/0   0.0

TEAM: FG: 8/18 (44.4%), 3PT: 4/8 (50.0%), REB: 14 (4 off, 10 def), AST: 6, TO: 2
TEAM FOULS: 0


Team_002
--------------------------------------------------------------------------------
Player                MIN  PTS  REB  AST  TO      FG   FG%      3P   3P%
--------------------------------------------------------------------------------
Miles Bane             12    9    6    1   0   3/8    37.5     0/0   0.0
Jordan Green           12    5    1    1   0   2/2   100.0     0/0   0.0
John Duncan            11    5    0    3   0   2/4    50.0     0/0   0.0
CJ Barrett              1    4    0    0   0   1/1   100.0     0/0   0.0
Lamelo O'Neal          11    2    0    0   0   1/2    50.0     0/0   0.0
Tyler Porzingis         1    0    1    0   0   0/1     0.0     0/0   0.0
Anfernee Sexton        11    0    4    0   0   0/2     0.0     0/0   0.0

TEAM: FG: 9/20 (45.0%), 3PT: 4/10 (40.0%), REB: 12 (3 off, 9 def), AST: 5, TO: 1
TEAM FOULS: 9 [Team_001 in BONUS]

================================================================================

================================================================================
                       2ND QUARTER - Team_001 vs Team_002                       
================================================================================

[12:00] Team_001 possession (Score: 26-26)
Dejounte McCollum loses the ball! Stripped by Carmelo Lowry! TURNOVER! (live ball)

[11:42] Team_002 possession (Score: 26-26)
Carmelo Lowry attempts a Midrange. Contested by Dejounte McCollum (4.7 feet, MAN). Carmelo Lowry misses. Offensive rebound by Tyler Porzingis! Tyler Porzingis puts it back in!
Score: 26-28

[11:27] Team_001 possession (Score: 26-28)
Klay Harden attempts a 3Pt. Contested by Miles Bane (5.9 feet, MAN). Klay Harden misses. Offensive rebound by Miles Griffin! Miles Griffin kicks it out.

[11:16] Team_001 possession (Score: 26-28)
Cole Ball attempts a Midrange. Contested by Jordan Green (5.4 feet, MAN). Cole Ball misses. Offensive rebound by Klay Harden! Klay Harden kicks it out.

[11:03] Team_001 possession (Score: 26-28)
Klay Harden attempts a 3Pt. Wide open! Miles Bane is 6.0 feet away. [MAN] KLAY HARDEN MAKES IT! Assist: Cole Ball
Score: 29-28

[10:46] Team_002 possession (Score: 29-28)
Jordan Green attempts a 3Pt. Contested by Cole Ball (4.4 feet, MAN). Jordan Green misses. Rebound secured by Miles Griffin.

[10:29] Team_001 possession (Score: 29-28)
Cole Ball attempts a Midrange. Contested by Jordan Green (5.5 feet, MAN). Cole Ball misses. Rebound secured by Tyler Porzingis.

[10:11] Team_002 possession (Score: 29-28)
Jordan Green attempts a Midrange. Contested by Cole Ball (4.5 feet, MAN). JORDAN GREEN MAKES IT!
Score: 29-30

[10:01] Team_001 possession (Score: 29-30)
Miles Griffin makes the Dunk and draws the foul on CJ Barrett! And-1! Miles Griffin to the line for 1. [Team fouls: 1] (CJ Barrett: 1 personal fouls)   FT 1/1: GOOD Miles Griffin makes 1/1 from the line.
Score: 32-30

[09:48] Team_002 possession (Score: 32-30)
Carmelo Lowry drives and kicks out. Tyler Porzingis attempts a Midrange. Contested by Dirk Young (3.8 feet, ZONE). Tyler Porzingis misses. Rebound secured by Dirk Young.

[09:33] Team_001 possession (Score: 32-30)
Dejounte McCollum attempts a 3Pt. Contested by Carmelo Lowry (4.0 feet, MAN). Dejounte McCollum misses. Rebound secured by Tyler Porzingis.

[09:18] Team_002 possession (Score: 32-30)
Miles Bane attempts a 3Pt. Contested by Klay Harden (3.6 feet, MAN). Miles Bane misses. Rebound secured by Klay Harden.

[09:06] Team_001 possession (Score: 32-30)
Miles Griffin attempts a Layup. Contested by Tyler Porzingis (3.2 feet, MAN). MILES GRIFFIN MAKES IT! Assist: Cole Ball
Score: 34-30

[08:53] Team_002 possession (Score: 34-30)
Carmelo Lowry throws a bad pass out of bounds! TURNOVER! (dead ball)

[08:53] Substitution (Team_001): Klay Harden OUT → Rudy George IN (stamina_rule2)

[08:53] Substitution (Team_001): Cole Ball OUT → Larry Trent IN (stamina_rule2)

[08:53] Substitution (Team_001): Dejounte McCollum OUT → Franz Bryant IN (stamina_rule2)

[08:53] Substitution (Team_002): Miles Bane OUT → Dirk Middleton IN (stamina_rule2)

[08:53] Substitution (Team_002): Jordan Green OUT → Julius Curry IN (stamina_rule2)

[08:53] Substitution (Team_002): Carmelo Lowry OUT → Anfernee Sexton IN (stamina_rule2)

[08:41] Team_001 possession (Score: 34-30)
Miles Griffin attempts a Midrange. Contested by Tyler Porzingis (3.3 feet, MAN). MILES GRIFFIN MAKES IT!
Score: 36-30

[08:23] Team_002 possession (Score: 36-30)
Anfernee Sexton attempts a Layup. Contested by Miles Griffin (4.1 feet, ZONE). Anfernee Sexton misses. Offensive rebound by Tyler Porzingis! Tyler Porzingis's putback is no good. Rebound secured by Dirk Young.

[08:09] Team_001 possession (Score: 36-30)
Miles Griffin attempts a Layup. Contested by Tyler Porzingis (3.4 feet, MAN). Miles Griffin misses. Rebound secured by Tyler Porzingis.

[07:54] Team_002 possession (Score: 36-30)
Tyler Porzingis drives, Franz Bryant stays with him. Tyler Porzingis attempts a Layup. Contested by Franz Bryant (3.8 feet, ZONE). TYLER PORZINGIS MAKES IT!
Score: 36-32

[07:38] Team_001 possession (Score: 36-32)
Franz Bryant drives, picks up Julius Curry. Help arrives from CJ Barrett! Franz Bryant attempts a Dunk. Contested by CJ Barrett (5.4 feet, MAN). FRANZ BRYANT MAKES IT! Assist: Dirk Young
Score: 38-32

[07:24] Team_002 possession (Score: 38-32)
Julius Curry attempts a Midrange. Contested by Franz Bryant (3.8 feet, MAN). Julius Curry misses. Rebound secured by Miles Griffin.

[07:09] Team_001 possession (Score: 38-32)
FOUL! Shooting foul on Tyler Porzingis. Miles Griffin to the line for 2 free throws. [Team fouls: 2] (Tyler Porzingis: 1 personal fouls)   FT 1/2: MISS   FT 2/2: MISS Miles Griffin makes 0/2 from the line. Rebound secured by CJ Barrett.

[06:56] Team_002 possession (Score: 38-32)
Dirk Middleton drives to the basket... Dirk Middleton throws a bad pass out of bounds! TURNOVER! (dead ball)

[06:56] Substitution (Team_001): Dirk Young OUT → Klay Harden IN (stamina_rule2)

[06:56] Substitution (Team_001): Miles Griffin OUT → Kristaps Ming IN (stamina_rule2)

[06:56] Substitution (Team_002): Tyler Porzingis OUT → Lamelo O'Neal IN (stamina_rule2)

[06:40] Team_001 possession (Score: 38-32)
FOUL! Reach-in foul on Julius Curry during the drive. [Team fouls: 3] No free throws, side out. (Julius Curry: 1 personal fouls)

[06:26] Team_002 possession (Score: 38-32)
Dirk Middleton attempts a Layup. Contested by Klay Harden (3.6 feet, MAN). Dirk Middleton misses. Offensive rebound by CJ Barrett! CJ Barrett kicks it out.

[06:12] Team_002 possession (Score: 38-32)
Anfernee Sexton attempts a Midrange. Contested by Rudy George (5.9 feet, ZONE). Anfernee Sexton misses. Rebound secured by Franz Bryant.

[05:58] Team_001 possession (Score: 38-32)
Kristaps Ming drives and kicks out. Klay Harden attempts a Midrange. Contested by CJ Barrett (4.2 feet, MAN). Klay Harden misses. Offensive rebound by Klay Harden! Klay Harden kicks it out.

[05:46] Team_001 possession (Score: 38-32)
Klay Harden attempts a Midrange. Contested by CJ Barrett (4.2 feet, MAN). Klay Harden misses. Rebound secured by CJ Barrett.

[05:32] Team_002 possession (Score: 38-32)
CJ Barrett attempts a Midrange. Contested by Franz Bryant (3.9 feet, ZONE). CJ Barrett misses. Offensive rebound by Anfernee Sexton! Anfernee Sexton kicks it out.

[05:15] Team_002 possession (Score: 38-32)
Anfernee Sexton attempts a 3Pt. Contested by Larry Trent (3.9 feet, MAN). ANFERNEE SEXTON MAKES IT! Assist: CJ Barrett
Score: 38-35

[04:58] Team_001 possession (Score: 38-35)
FOUL! Reach-in foul on Anfernee Sexton during the drive. [Team fouls: 4] No free throws, side out. (Anfernee Sexton: 1 personal fouls)

[04:44] Team_002 possession (Score: 38-35)
Lamelo O'Neal drives and kicks out. Anfernee Sexton attempts a 3Pt. Contested by Larry Trent (3.9 feet, MAN). Anfernee Sexton misses. Rebound secured by Franz Bryant.

[04:29] Team_001 possession (Score: 38-35)
Klay Harden drives and kicks out. Franz Bryant attempts a 3Pt. Contested by Julius Curry (5.4 feet, MAN). FRANZ BRYANT MAKES IT! Assist: Klay Harden
Score: 41-35

[04:16] Team_002 possession (Score: 41-35)
Lamelo O'Neal attempts a Midrange. Contested by Franz Bryant (4.0 feet, MAN). Lamelo O'Neal misses. Rebound secured by Klay Harden.

[04:02] Team_001 possession (Score: 41-35)
Franz Bryant makes the Layup and draws the foul on Julius Curry! And-1! Franz Bryant to the line for 1. [BONUS: 5 team fouls] (Julius Curry: 2 personal fouls)   FT 1/1: GOOD Franz Bryant makes 1/1 from the line.
Score: 44-35

[03:47] Team_002 possession (Score: 44-35)
CJ Barrett loses the ball! Stripped by Klay Harden! TURNOVER! (live ball)

[03:38] Team_001 possession (Score: 44-35)
Klay Harden drives to the basket... Klay Harden commits an offensive foul! TURNOVER! (dead ball)

[03:28] Team_002 possession (Score: 44-35)
CJ Barrett attempts a Midrange. Contested by Klay Harden (4.1 feet, MAN). CJ Barrett misses. Rebound secured by Klay Harden.

[03:15] Team_001 possession (Score: 44-35)
Klay Harden drives, picks up Lamelo O'Neal. Help arrives from CJ Barrett! Klay Harden attempts a Dunk. Contested by CJ Barrett (5.8 feet, ZONE). KLAY HARDEN MAKES IT! Assist: Rudy George
Score: 46-35

[03:00] Team_002 possession (Score: 46-35)
Julius Curry drives to the basket... Julius Curry commits a violation (traveling/carry)! TURNOVER! (dead ball)

[03:00] Substitution (Team_001): Klay Harden OUT → Dirk Young IN (stamina_rule2)

[03:00] Substitution (Team_002): CJ Barrett OUT → John Duncan IN (stamina_rule2)

[02:43] Team_001 possession (Score: 46-35)
Larry Trent drives, Anfernee Sexton stays with him. Larry Trent attempts a Layup. Contested by Anfernee Sexton (6.0 feet, MAN). LARRY TRENT MAKES IT! Assist: Kristaps Ming
Score: 48-35

[02:30] Team_002 possession (Score: 48-35)
Dirk Middleton commits a violation (traveling/carry)! TURNOVER! (dead ball)

[02:14] Team_001 possession (Score: 48-35)
Larry Trent attempts a 3Pt. Contested by Julius Curry (5.6 feet, ZONE). Larry Trent misses. Offensive rebound by Dirk Young! Dirk Young kicks it out.

[02:00] Team_001 possession (Score: 48-35)
Dirk Young drives, picks up Lamelo O'Neal. Help arrives from John Duncan! Dirk Young attempts a Dunk. Wide open! John Duncan is 6.1 feet away. [ZONE] DIRK YOUNG MAKES IT!
Score: 50-35

[01:45] Team_002 possession (Score: 50-35)
John Duncan makes the Dunk and draws the foul on Dirk Young! And-1! John Duncan to the line for 1. [BONUS: 6 team fouls] (Dirk Young: 1 personal fouls)   FT 1/1: GOOD John Duncan makes 1/1 from the line.
Score: 50-38

[01:30] Team_001 possession (Score: 50-38)
Rudy George drives, picks up Dirk Middleton. Help arrives from Julius Curry! Rudy George attempts a Layup. Wide open! Julius Curry is 6.2 feet away. [MAN] RUDY GEORGE MAKES IT! Assist: Larry Trent
Score: 52-38

[01:16] Team_002 possession (Score: 52-38)
Dirk Middleton makes the Midrange and draws the foul on Dirk Young! And-1! Dirk Middleton to the line for 1. [BONUS: 7 team fouls] (Dirk Young: 2 personal fouls)   FT 1/1: GOOD Dirk Middleton makes 1/1 from the line.
Score: 52-41

[01:02] Team_001 possession (Score: 52-41)
Dirk Young attempts a 3Pt. Wide open! Dirk Middleton is 6.3 feet away. [MAN] DIRK YOUNG MAKES IT! Assist: Rudy George
Score: 55-41

[00:48] Team_002 possession (Score: 55-41)
John Duncan attempts a 3Pt. Contested by Dirk Young (4.1 feet, MAN). John Duncan misses. Rebound secured by Dirk Young.

[00:39] Team_001 possession (Score: 55-41)
FOUL! Holding foul on Dirk Middleton. [IN THE BONUS! 8 team fouls] Rudy George to the line for 2 free throws. (Dirk Middleton: 1 personal fouls)   FT 1/2: GOOD   FT 2/2: GOOD Rudy George makes 2/2 from the line.
Score: 57-41

[00:26] Team_002 possession (Score: 57-41)
FOUL! Shooting foul on Franz Bryant. Julius Curry to the line for 3 free throws. [BONUS: 9 team fouls] (Franz Bryant: 1 personal fouls)   FT 1/3: MISS   FT 2/3: GOOD   FT 3/3: GOOD Julius Curry makes 2/3 from the line.
Score: 57-43

[00:10] Team_001 possession (Score: 57-43)
Rudy George attempts a Midrange. Wide open! Dirk Middleton is 6.4 feet away. [MAN] Rudy George misses. Rebound secured by Anfernee Sexton.

================================================================================
                              2ND QUARTER COMPLETE                              
================================================================================

2ND QUARTER SCORE: Team_001 31, Team_002 17

BOX SCORE:
================================================================================

Team_001
--------------------------------------------------------------------------------
Player                MIN  PTS  REB  AST  TO      FG   FG%      3P   3P%
--------------------------------------------------------------------------------
Franz Bryant            9    8    2    0   0   3/3   100.0     0/0   0.0
Miles Griffin           7    7    3    0   0   3/5    60.0     0/0   0.0
Klay Harden             9    5    5    1   0   2/3    66.7     0/0   0.0
Dirk Young              9    5    4    1   0   2/2   100.0     0/0   0.0
Rudy George            19    4    0    2   0   1/2    50.0     0/0   0.0
Larry Trent             9    2    0    1   0   1/1   100.0     0/0   0.0
Cole Ball              15    0    0    2   0   0/1     0.0     0/0   0.0
Dejounte McCollum      15    0    0    0   0   0/1     0.0     0/0   0.0
Kristaps Ming          17    0    0    1   0   0/0     0.0     0/0   0.0

TEAM: FG: 12/18 (66.7%), 3PT: 2/3 (66.7%), REB: 13 (4 off, 9 def), AST: 8, TO: 2
TEAM FOULS: 0


Team_002
--------------------------------------------------------------------------------
Player                MIN  PTS  REB  AST  TO      FG   FG%      3P   3P%
--------------------------------------------------------------------------------
Tyler Porzingis         7    4    4    0   0   2/2   100.0     0/0   0.0
Anfernee Sexton        19    3    2    0   0   1/3    33.3     0/0   0.0
John Duncan            13    3    0    0   0   1/2    50.0     0/0   0.0
Dirk Middleton          9    3    0    0   0   1/1   100.0     0/0   0.0
Jordan Green           15    2    0    0   0   1/2    50.0     0/0   0.0
Julius Curry            9    2    0    0   0   0/1     0.0     0/0   0.0
Carmelo Lowry           5    0    0    0   0   0/1     0.0     0/0   0.0
Miles Bane             15    0    0    0   0   0/1     0.0     0/0   0.0
CJ Barrett             11    0    3    1   0   0/1     0.0     0/0   0.0
Lamelo O'Neal          17    0    0    0   0   0/2     0.0     0/0   0.0

TEAM: FG: 6/16 (37.5%), 3PT: 1/4 (25.0%), REB: 10 (4 off, 6 def), AST: 1, TO: 5
TEAM FOULS: 9 [Team_001 in BONUS]

================================================================================

================================================================================
                       3RD QUARTER - Team_001 vs Team_002                       
================================================================================

[12:00] Team_001 possession (Score: 57-43)
Cole Ball attempts a 3Pt. Contested by CJ Barrett (3.8 feet, ZONE). Cole Ball misses. Rebound secured by Miles Bane.

[11:46] Team_002 possession (Score: 57-43)
Jordan Green attempts a 3Pt. Contested by Cole Ball (2.8 feet, MAN). JORDAN GREEN MAKES IT! Assist: CJ Barrett
Score: 57-46

[11:29] Team_001 possession (Score: 57-46)
Dejounte McCollum attempts a 3Pt. Contested by Carmelo Lowry (3.6 feet, MAN). Dejounte McCollum misses. Rebound secured by Tyler Porzingis.

[11:13] Team_002 possession (Score: 57-46)
Jordan Green attempts a Midrange. Contested by Dirk Young (3.8 feet, ZONE). JORDAN GREEN MAKES IT! Assist: Carmelo Lowry
Score: 57-48

[11:03] Team_001 possession (Score: 57-48)
Dirk Young attempts a Midrange. Contested by CJ Barrett (3.8 feet, MAN). DIRK YOUNG MAKES IT!
Score: 59-48

[10:49] Team_002 possession (Score: 59-48)
Tyler Porzingis drives to the basket... Tyler Porzingis throws a bad pass out of bounds! TURNOVER! (dead ball)

[10:35] Team_001 possession (Score: 59-48)
FOUL! Shooting foul on Carmelo Lowry. Miles Griffin to the line for 2 free throws. [Team fouls: 1] (Carmelo Lowry: 1 personal fouls)   FT 1/2: GOOD   FT 2/2: GOOD Miles Griffin makes 2/2 from the line.
Score: 61-48

[10:19] Team_002 possession (Score: 61-48)
Carmelo Lowry attempts a Midrange. Contested by Dejounte McCollum (3.8 feet, MAN). Carmelo Lowry misses. Rebound secured by Cole Ball.

[10:01] Team_001 possession (Score: 61-48)
Miles Griffin drives to the basket... Miles Griffin throws a bad pass! Stolen by Tyler Porzingis! TURNOVER! (live ball)

[09:47] Team_002 possession (Score: 61-48)
Carmelo Lowry attempts a Midrange. Contested by Dejounte McCollum (3.8 feet, MAN). Carmelo Lowry misses. Rebound secured by Miles Griffin.

[09:34] Team_001 possession (Score: 61-48)
FOUL! Shooting foul on Tyler Porzingis. Klay Harden to the line for 2 free throws. [Team fouls: 2] (Tyler Porzingis: 1 personal fouls)   FT 1/2: GOOD   FT 2/2: GOOD Klay Harden makes 2/2 from the line.
Score: 63-48

[09:22] Team_002 possession (Score: 63-48)
FOUL! Shooting foul on Dirk Young. CJ Barrett to the line for 3 free throws. [Team fouls: 3] (Dirk Young: 1 personal fouls)   FT 1/3: MISS   FT 2/3: MISS   FT 3/3: GOOD CJ Barrett makes 1/3 from the line.
Score: 63-49

[09:08] Team_001 possession (Score: 63-49)
Dejounte McCollum drives and kicks out. Dejounte McCollum attempts a Midrange. Contested by Carmelo Lowry (3.6 feet, MAN). Dejounte McCollum misses. Rebound secured by Miles Bane.

[08:55] Team_002 possession (Score: 63-49)
Miles Bane attempts a 3Pt. Contested by Klay Harden (3.3 feet, ZONE). Miles Bane misses. Rebound secured by Miles Griffin.

[08:44] Team_001 possession (Score: 63-49)
Dejounte McCollum attempts a Layup. Contested by Tyler Porzingis (3.0 feet, ZONE). DEJOUNTE MCCOLLUM MAKES IT! Assist: Cole Ball
Score: 65-49

[08:31] Team_002 possession (Score: 65-49)
CJ Barrett attempts a Layup. Contested by Dirk Young (3.8 feet, MAN). CJ BARRETT MAKES IT!
Score: 65-51

[08:20] Team_001 possession (Score: 65-51)
FOUL! Reach-in foul on Carmelo Lowry during the drive. [Team fouls: 4] No free throws, side out. (Carmelo Lowry: 2 personal fouls)

[08:06] Team_002 possession (Score: 65-51)
Miles Bane attempts a 3Pt. Contested by Klay Harden (3.3 feet, MAN). MILES BANE MAKES IT! Assist: Carmelo Lowry
Score: 65-54

[07:47] Team_001 possession (Score: 65-54)
Cole Ball drives to the basket... Cole Ball commits an offensive foul! TURNOVER! (dead ball)

[07:32] Team_002 possession (Score: 65-54)
CJ Barrett loses the ball! Stripped by Dirk Young! TURNOVER! (live ball)

[07:13] Team_001 possession (Score: 65-54)
Dejounte McCollum attempts a 3Pt. Contested by Carmelo Lowry (3.6 feet, MAN). Dejounte McCollum misses. Rebound secured by Tyler Porzingis.

[06:59] Team_002 possession (Score: 65-54)
Tyler Porzingis attempts a Dunk. BLOCKED BY MILES GRIFFIN! Ball goes out of bounds. Turnover!

[06:44] Team_001 possession (Score: 65-54)
Klay Harden attempts a Midrange. Contested by Miles Bane (4.5 feet, MAN). KLAY HARDEN MAKES IT! Assist: Dejounte McCollum
Score: 67-54

[06:29] Team_002 possession (Score: 67-54)
FOUL! Holding foul on Klay Harden. [IN THE BONUS! 5 team fouls] Miles Bane to the line for 2 free throws. (Klay Harden: 1 personal fouls)   FT 1/2: MISS   FT 2/2: GOOD Miles Bane makes 1/2 from the line.
Score: 67-55

[06:17] Team_001 possession (Score: 67-55)
FOUL! Shooting foul on Miles Bane. Klay Harden to the line for 2 free throws. [BONUS: 6 team fouls] (Miles Bane: 1 personal fouls)   FT 1/2: MISS   FT 2/2: MISS Klay Harden makes 0/2 from the line. Offensive rebound by Miles Griffin! Miles Griffin kicks it out.

[06:04] Team_001 possession (Score: 67-55)
Dirk Young attempts a 3Pt. Contested by CJ Barrett (3.8 feet, MAN). Dirk Young misses. Offensive rebound by Miles Griffin! Miles Griffin kicks it out.

[05:47] Team_001 possession (Score: 67-55)
Klay Harden attempts a Layup. BLOCKED BY TYLER PORZINGIS! Offensive rebound by Cole Ball! Cole Ball kicks it out.

[05:29] Team_001 possession (Score: 67-55)
Klay Harden drives to the basket... Klay Harden throws a bad pass out of bounds! TURNOVER! (dead ball)

[05:19] Team_002 possession (Score: 67-55)
Miles Bane attempts a 3Pt. Contested by Dejounte McCollum (3.8 feet, ZONE). Miles Bane misses. Rebound secured by Cole Ball.

[05:10] Team_001 possession (Score: 67-55)
Dejounte McCollum attempts a 3Pt. Contested by Carmelo Lowry (3.6 feet, MAN). Dejounte McCollum misses. Rebound secured by Tyler Porzingis.

[05:00] Team_002 possession (Score: 67-55)
Carmelo Lowry attempts a Midrange. Contested by Dirk Young (3.9 feet, ZONE). Carmelo Lowry misses. Offensive rebound by Carmelo Lowry! Carmelo Lowry kicks it out.

[04:44] Team_002 possession (Score: 67-55)
CJ Barrett makes the Layup and draws the foul on Dirk Young! And-1! CJ Barrett to the line for 1. [BONUS: 8 team fouls] (Dirk Young: 2 personal fouls)   FT 1/1: GOOD CJ Barrett makes 1/1 from the line.
Score: 67-58

[04:31] Team_001 possession (Score: 67-58)
Cole Ball drives to the basket... Cole Ball throws a bad pass out of bounds! TURNOVER! (dead ball)

[04:18] Team_002 possession (Score: 67-58)
Tyler Porzingis attempts a Midrange. Contested by Miles Griffin (3.9 feet, MAN). TYLER PORZINGIS MAKES IT!
Score: 67-60

[04:01] Team_001 possession (Score: 67-60)
Klay Harden attempts a Midrange. Contested by Miles Bane (4.6 feet, MAN). Klay Harden misses. Rebound secured by Tyler Porzingis.

[03:50] Team_002 possession (Score: 67-60)
Jordan Green attempts a 3Pt. Contested by Cole Ball (3.0 feet, MAN). Jordan Green misses. FOUL! Loose ball foul on Dejounte McCollum during the rebound battle. [IN THE BONUS! 9 team fouls] Tyler Porzingis to the line for 2 free throws. (Dejounte McCollum: 1 personal fouls)   FT 1/2: MISS   FT 2/2: GOOD Tyler Porzingis makes 1/2 from the line.
Score: 67-61

[03:32] Team_001 possession (Score: 67-61)
Dirk Young attempts a Midrange. Contested by Miles Bane (4.7 feet, ZONE). DIRK YOUNG MAKES IT! Assist: Cole Ball
Score: 69-61

[03:19] Team_002 possession (Score: 69-61)
Miles Bane attempts a 3Pt. Contested by Klay Harden (3.8 feet, MAN). Miles Bane misses. Rebound secured by Cole Ball.

[03:03] Team_001 possession (Score: 69-61)
FOUL! Shooting foul on Jordan Green. Cole Ball to the line for 3 free throws. [BONUS: 10 team fouls] (Jordan Green: 1 personal fouls)   FT 1/3: GOOD   FT 2/3: GOOD   FT 3/3: GOOD Cole Ball makes 3/3 from the line.
Score: 72-61

[02:51] Team_002 possession (Score: 72-61)
FOUL! Holding foul on Dirk Young. [IN THE BONUS! 11 team fouls] CJ Barrett to the line for 2 free throws. (Dirk Young: 3 personal fouls)   FT 1/2: MISS   FT 2/2: MISS CJ Barrett makes 0/2 from the line. Rebound secured by Dejounte McCollum.

[02:39] Team_001 possession (Score: 72-61)
Klay Harden attempts a 3Pt. Contested by Miles Bane (4.8 feet, ZONE). KLAY HARDEN MAKES IT! Assist: Miles Griffin
Score: 75-61

[02:26] Team_002 possession (Score: 75-61)
Miles Bane attempts a 3Pt. Contested by Klay Harden (3.9 feet, MAN). Miles Bane misses. Rebound secured by Miles Griffin.

[02:13] Team_001 possession (Score: 75-61)
Cole Ball attempts a 3Pt. Contested by Jordan Green (4.2 feet, MAN). Cole Ball misses. Offensive rebound by Miles Griffin! Miles Griffin kicks it out.

[01:57] Team_001 possession (Score: 75-61)
Miles Griffin drives to the basket... Miles Griffin throws a bad pass out of bounds! TURNOVER! (dead ball)

[01:57] Substitution (Team_001): Klay Harden OUT → Ja Dosunmu IN (stamina_rule2)

[01:57] Substitution (Team_001): Dirk Young OUT → Rudy George IN (stamina_rule2)

[01:57] Substitution (Team_001): Cole Ball OUT → Larry Trent IN (stamina_rule2)

[01:57] Substitution (Team_001): Miles Griffin OUT → Kristaps Ming IN (stamina_rule2)

[01:57] Substitution (Team_002): Miles Bane OUT → John Duncan IN (stamina_rule2)

[01:57] Substitution (Team_002): CJ Barrett OUT → Dirk Middleton IN (stamina_rule2)

[01:57] Substitution (Team_002): Jordan Green OUT → Anfernee Sexton IN (stamina_rule2)

[01:57] Substitution (Team_002): Carmelo Lowry OUT → Julius Curry IN (stamina_rule2)

[01:57] Substitution (Team_002): Tyler Porzingis OUT → Lamelo O'Neal IN (stamina_rule2)

[01:44] Team_002 possession (Score: 75-61)
Lamelo O'Neal loses control! Ball rolls out of bounds! TURNOVER! (dead ball)

[01:28] Team_001 possession (Score: 75-61)
Ja Dosunmu attempts a 3Pt. Contested by John Duncan (5.5 feet, MAN). JA DOSUNMU MAKES IT! Assist: Kristaps Ming
Score: 78-61

[01:19] Team_002 possession (Score: 78-61)
Dirk Middleton makes the Layup and draws the foul on Rudy George! And-1! Dirk Middleton to the line for 1. [BONUS: 12 team fouls] (Rudy George: 1 personal fouls)   FT 1/1: GOOD Dirk Middleton makes 1/1 from the line.
Score: 78-64

[01:07] Team_001 possession (Score: 78-64)
Kristaps Ming drives, picks up Lamelo O'Neal. Help arrives from John Duncan! Kristaps Ming attempts a Layup. Contested by John Duncan (3.0 feet, MAN). Kristaps Ming misses. Rebound secured by Lamelo O'Neal.

[00:50] Team_002 possession (Score: 78-64)
Julius Curry attempts a 3Pt. Contested by Dejounte McCollum (4.2 feet, ZONE). Julius Curry misses. Offensive rebound by Lamelo O'Neal! Lamelo O'Neal's putback is no good. Offensive rebound by Anfernee Sexton! Anfernee Sexton kicks it out.

[00:39] Team_002 possession (Score: 78-64)
John Duncan attempts a 3Pt. Contested by Ja Dosunmu (3.5 feet, MAN). JOHN DUNCAN MAKES IT!
Score: 78-67

[00:25] Team_001 possession (Score: 78-67)
Rudy George attempts a 3Pt. Contested by Dirk Middleton (5.9 feet, MAN). Rudy George misses. Offensive rebound by Dejounte McCollum! Dejounte McCollum kicks it out.

[00:06] Team_001 possession (Score: 78-67)
Larry Trent commits an offensive foul! Anfernee Sexton drew the charge! TURNOVER! (dead ball)

================================================================================
                              3RD QUARTER COMPLETE                              
================================================================================

3RD QUARTER SCORE: Team_001 21, Team_002 24

BOX SCORE:
================================================================================

Team_001
--------------------------------------------------------------------------------
Player                MIN  PTS  REB  AST  TO      FG   FG%      3P   3P%
--------------------------------------------------------------------------------
Klay Harden            19    7    0    0   0   2/3    66.7     0/0   0.0
Dirk Young             20    4    0    0   0   2/2   100.0     0/0   0.0
Cole Ball              26    3    4    2   0   0/1     0.0     0/0   0.0
Ja Dosunmu             13    3    0    0   0   1/1   100.0     0/0   0.0
Dejounte McCollum      28    2    2    1   0   1/5    20.0     0/0   0.0
Miles Griffin          17    2    6    1   0   0/0     0.0     0/0   0.0
Kristaps Ming          19    0    0    1   0   0/1     0.0     0/0   0.0

TEAM: FG: 6/13 (46.2%), 3PT: 2/6 (33.3%), REB: 12 (5 off, 7 def), AST: 5, TO: 6
TEAM FOULS: 0


Team_002
--------------------------------------------------------------------------------
Player                MIN  PTS  REB  AST  TO      FG   FG%      3P   3P%
--------------------------------------------------------------------------------
CJ Barrett             21    6    0    1   0   2/2   100.0     0/0   0.0
Jordan Green           26    5    0    0   0   2/2   100.0     0/0   0.0
Miles Bane             26    4    2    0   0   1/5    20.0     0/0   0.0
Tyler Porzingis        17    3    4    0   0   1/1   100.0     0/0   0.0
Dirk Middleton         11    3    0    0   0   1/1   100.0     0/0   0.0
John Duncan            15    3    0    0   0   1/1   100.0     0/0   0.0
Carmelo Lowry          15    0    1    2   0   0/2     0.0     0/0   0.0
Lamelo O'Neal          19    0    1    0   0   0/0     0.0     0/0   0.0
Anfernee Sexton        21    0    1    0   0   0/0     0.0     0/0   0.0

TEAM: FG: 8/15 (53.3%), 3PT: 3/7 (42.9%), REB: 9 (2 off, 7 def), AST: 3, TO: 4
TEAM FOULS: 12 [Team_001 in BONUS]

================================================================================

================================================================================
                       4TH QUARTER - Team_001 vs Team_002                       
================================================================================

[12:00] Team_001 possession (Score: 78-67)
FOUL! Holding foul on Carmelo Lowry. [Team fouls: 1] No free throws, side out. (Carmelo Lowry: 1 personal fouls)

[11:47] Team_002 possession (Score: 78-67)
Jordan Green attempts a Layup. BLOCKED BY COLE BALL! Ball goes out of bounds. Turnover!

[11:29] Team_001 possession (Score: 78-67)
FOUL! Holding foul on CJ Barrett. [Team fouls: 2] No free throws, side out. (CJ Barrett: 1 personal fouls)

[11:13] Team_002 possession (Score: 78-67)
Jordan Green drives and kicks out. CJ Barrett attempts a 3Pt. Contested by Klay Harden (3.7 feet, ZONE). CJ Barrett misses. Rebound secured by Miles Griffin.

[11:01] Team_001 possession (Score: 78-67)
Dirk Young attempts a Layup. Contested by CJ Barrett (4.0 feet, MAN). DIRK YOUNG MAKES IT! Assist: Miles Griffin
Score: 80-67

[10:42] Team_002 possession (Score: 80-67)
Tyler Porzingis attempts a 3Pt. Contested by Cole Ball (3.0 feet, ZONE). TYLER PORZINGIS MAKES IT! Assist: Miles Bane
Score: 80-70

[10:29] Team_001 possession (Score: 80-70)
Klay Harden attempts a 3Pt. Contested by Miles Bane (4.7 feet, MAN). Klay Harden misses. Offensive rebound by Miles Griffin! Miles Griffin kicks it out.

[10:14] Team_001 possession (Score: 80-70)
Dejounte McCollum attempts a Midrange. Contested by Carmelo Lowry (3.9 feet, MAN). DEJOUNTE MCCOLLUM MAKES IT! Assist: Cole Ball
Score: 82-70

[10:00] Team_002 possession (Score: 82-70)
Tyler Porzingis makes the Layup and draws the foul on Miles Griffin! And-1! Tyler Porzingis to the line for 1. [Team fouls: 3] (Miles Griffin: 1 personal fouls)   FT 1/1: GOOD Tyler Porzingis makes 1/1 from the line.
Score: 82-73

[09:48] Team_001 possession (Score: 82-73)
Klay Harden attempts a 3Pt. Contested by Miles Bane (4.7 feet, ZONE). KLAY HARDEN MAKES IT! Assist: Cole Ball
Score: 85-73

[09:35] Team_002 possession (Score: 85-73)
Miles Bane makes the 3Pt and draws the foul on Klay Harden! And-1! Miles Bane to the line for 1. [Team fouls: 4] (Klay Harden: 1 personal fouls)   FT 1/1: MISS Miles Bane makes 0/1 from the line. Rebound secured by Dejounte McCollum.
Score: 85-76

[09:21] Team_001 possession (Score: 85-76)
FOUL! Shooting foul on Tyler Porzingis. Cole Ball to the line for 2 free throws. [BONUS: 5 team fouls] (Tyler Porzingis: 1 personal fouls)   FT 1/2: GOOD   FT 2/2: GOOD Cole Ball makes 2/2 from the line.
Score: 87-76

[09:09] Team_002 possession (Score: 87-76)
Miles Bane attempts a Midrange. Contested by Klay Harden (4.0 feet, MAN). MILES BANE MAKES IT! Assist: Tyler Porzingis
Score: 87-78

[08:53] Team_001 possession (Score: 87-78)
Dirk Young attempts a Midrange. Contested by CJ Barrett (4.3 feet, MAN). Dirk Young misses. FOUL! Loose ball foul on Tyler Porzingis during the rebound battle. [IN THE BONUS! 6 team fouls] Cole Ball to the line for 2 free throws. (Tyler Porzingis: 2 personal fouls)   FT 1/2: GOOD   FT 2/2: GOOD Cole Ball makes 2/2 from the line.
Score: 89-78

[08:38] Team_002 possession (Score: 89-78)
Tyler Porzingis attempts a Midrange. Contested by Miles Griffin (4.3 feet, MAN). Tyler Porzingis misses. Rebound secured by Cole Ball.

[08:27] Team_001 possession (Score: 89-78)
Klay Harden attempts a 3Pt. Contested by Miles Bane (4.9 feet, ZONE). Klay Harden misses. Rebound secured by Carmelo Lowry.

[08:16] Team_002 possession (Score: 89-78)
Tyler Porzingis attempts a 3Pt. Contested by Miles Griffin (4.4 feet, MAN). Tyler Porzingis misses. Rebound secured by Miles Griffin.

[08:01] Team_001 possession (Score: 89-78)
Dejounte McCollum commits an offensive foul! Carmelo Lowry drew the charge! TURNOVER! (dead ball)

[07:42] Team_002 possession (Score: 89-78)
Carmelo Lowry drives to the basket... Carmelo Lowry throws a bad pass! Stolen by Dejounte McCollum! TURNOVER! (live ball)

[07:28] Team_001 possession (Score: 89-78)
Klay Harden drives and kicks out. Dirk Young attempts a 3Pt. Contested by Miles Bane (5.1 feet, ZONE). DIRK YOUNG MAKES IT! Assist: Miles Griffin
Score: 92-78

[07:09] Team_002 possession (Score: 92-78)
Carmelo Lowry attempts a 3Pt. Contested by Dejounte McCollum (4.6 feet, MAN). CARMELO LOWRY MAKES IT!
Score: 92-81

[06:58] Team_001 possession (Score: 92-81)
Miles Griffin attempts a Layup. Contested by Tyler Porzingis (3.9 feet, ZONE). Miles Griffin misses. Rebound secured by Carmelo Lowry.

[06:42] Team_002 possession (Score: 92-81)
Miles Bane attempts a Midrange. BLOCKED BY KLAY HARDEN! Offensive rebound by Carmelo Lowry! Carmelo Lowry kicks it out.

[06:30] Team_002 possession (Score: 92-81)
CJ Barrett attempts a Midrange. Contested by Dirk Young (4.7 feet, MAN). CJ Barrett misses. Offensive rebound by Carmelo Lowry! Carmelo Lowry kicks it out.

[06:20] Team_002 possession (Score: 92-81)
Jordan Green attempts a Layup. BLOCKED BY MILES GRIFFIN! Rebound secured by Miles Griffin.

[06:07] Team_001 possession (Score: 92-81)
Klay Harden makes the Layup and draws the foul on Miles Bane! And-1! Klay Harden to the line for 1. [BONUS: 7 team fouls] (Miles Bane: 1 personal fouls)   FT 1/1: GOOD Klay Harden makes 1/1 from the line.
Score: 95-81

[05:51] Team_002 possession (Score: 95-81)
Miles Bane attempts a 3Pt. Contested by Cole Ball (3.7 feet, ZONE). Miles Bane misses. Rebound secured by Miles Griffin.

[05:36] Team_001 possession (Score: 95-81)
Dejounte McCollum attempts a Midrange. Contested by Jordan Green (4.7 feet, ZONE). DEJOUNTE MCCOLLUM MAKES IT!
Score: 97-81

[05:26] Team_002 possession (Score: 97-81)
Tyler Porzingis drives to the basket... Tyler Porzingis loses the ball! Stripped by Miles Griffin! TURNOVER! (live ball)

[05:11] Team_001 possession (Score: 97-81)
Dejounte McCollum attempts a 3Pt. Contested by Carmelo Lowry (4.9 feet, MAN). Dejounte McCollum misses. Rebound secured by Tyler Porzingis.

[04:56] Team_002 possession (Score: 97-81)
Jordan Green attempts a 3Pt. Contested by Cole Ball (3.9 feet, MAN). Jordan Green misses. Rebound secured by Miles Griffin.

[04:41] Team_001 possession (Score: 97-81)
Miles Griffin throws a bad pass out of bounds! TURNOVER! (dead ball)

[04:41] Substitution (Team_001): Klay Harden OUT → Ja Dosunmu IN (stamina_rule2)

[04:41] Substitution (Team_001): Dirk Young OUT → Rudy George IN (stamina_rule2)

[04:41] Substitution (Team_001): Cole Ball OUT → Larry Trent IN (stamina_rule2)

[04:41] Substitution (Team_001): Dejounte McCollum OUT → Franz Bryant IN (stamina_rule2)

[04:41] Substitution (Team_001): Miles Griffin OUT → Kristaps Ming IN (stamina_rule2)

[04:41] Substitution (Team_002): Miles Bane OUT → John Duncan IN (stamina_rule2)

[04:41] Substitution (Team_002): CJ Barrett OUT → Dirk Middleton IN (stamina_rule2)

[04:41] Substitution (Team_002): Jordan Green OUT → Anfernee Sexton IN (stamina_rule2)

[04:41] Substitution (Team_002): Carmelo Lowry OUT → Julius Curry IN (stamina_rule2)

[04:41] Substitution (Team_002): Tyler Porzingis OUT → Lamelo O'Neal IN (stamina_rule2)

[04:24] Team_002 possession (Score: 97-81)
Julius Curry attempts a 3Pt. Contested by Franz Bryant (3.8 feet, MAN). JULIUS CURRY MAKES IT! Assist: Anfernee Sexton
Score: 97-84

[04:09] Team_001 possession (Score: 97-84)
Larry Trent drives and kicks out. Franz Bryant attempts a 3Pt. Contested by Lamelo O'Neal (3.0 feet, MAN). Franz Bryant misses. Offensive rebound by Rudy George! Rudy George kicks it out.

[03:55] Team_001 possession (Score: 97-84)
FOUL! Shooting foul on Lamelo O'Neal. Kristaps Ming to the line for 2 free throws. [BONUS: 8 team fouls] (Lamelo O'Neal: 1 personal fouls)   FT 1/2: GOOD   FT 2/2: GOOD Kristaps Ming makes 2/2 from the line.
Score: 99-84

[03:39] Team_002 possession (Score: 99-84)
Anfernee Sexton attempts a Layup. Contested by Larry Trent (3.9 feet, MAN). ANFERNEE SEXTON MAKES IT! Assist: Julius Curry
Score: 99-86

[03:26] Team_001 possession (Score: 99-86)
Kristaps Ming attempts a Layup. Contested by Lamelo O'Neal (3.0 feet, MAN). Kristaps Ming misses. Offensive rebound by Kristaps Ming! Kristaps Ming kicks it out.

[03:10] Team_001 possession (Score: 99-86)
Rudy George attempts a 3Pt. Contested by Dirk Middleton (5.9 feet, MAN). Rudy George misses. Rebound secured by Julius Curry.

[02:51] Team_002 possession (Score: 99-86)
Julius Curry attempts a 3Pt. Contested by Ja Dosunmu (3.5 feet, ZONE). Julius Curry misses. Offensive rebound by Lamelo O'Neal! Lamelo O'Neal puts it back in!
Score: 99-88

[02:32] Team_001 possession (Score: 99-88)
Ja Dosunmu commits an offensive foul! John Duncan drew the charge! TURNOVER! (dead ball)

[02:20] Team_002 possession (Score: 99-88)
FOUL! Shooting foul on Franz Bryant. Lamelo O'Neal to the line for 2 free throws. [BONUS: 9 team fouls] (Franz Bryant: 1 personal fouls)   FT 1/2: MISS   FT 2/2: GOOD Lamelo O'Neal makes 1/2 from the line.
Score: 99-89

[02:09] Team_001 possession (Score: 99-89)
Kristaps Ming drives and kicks out. Rudy George attempts a 3Pt. Contested by Dirk Middleton (5.9 feet, MAN). Rudy George misses. Rebound secured by Anfernee Sexton.

[01:56] Team_002 possession (Score: 99-89)
Anfernee Sexton attempts a Midrange. Contested by Larry Trent (3.9 feet, MAN). Anfernee Sexton misses. Rebound secured by Kristaps Ming.

[01:41] Team_001 possession (Score: 99-89)
Ja Dosunmu attempts a Layup. Contested by John Duncan (5.5 feet, MAN). JA DOSUNMU MAKES IT!
Score: 101-89

[01:27] Team_002 possession (Score: 101-89)
FOUL! Holding foul on Rudy George. [IN THE BONUS! 10 team fouls] Dirk Middleton to the line for 2 free throws. (Rudy George: 1 personal fouls)   FT 1/2: GOOD   FT 2/2: GOOD Dirk Middleton makes 2/2 from the line.
Score: 101-91

[01:13] Team_001 possession (Score: 101-91)
Larry Trent attempts a 3Pt. Contested by Anfernee Sexton (4.4 feet, MAN). Larry Trent misses. Offensive rebound by Kristaps Ming! Kristaps Ming kicks it out.

[00:54] Team_001 possession (Score: 101-91)
Ja Dosunmu loses the ball! Stripped by John Duncan! TURNOVER! (live ball)

[00:41] Team_002 possession (Score: 101-91)
Julius Curry attempts a Midrange. Contested by Franz Bryant (3.8 feet, MAN). JULIUS CURRY MAKES IT! Assist: Lamelo O'Neal
Score: 101-93

[00:23] Team_001 possession (Score: 101-93)
Rudy George attempts a Midrange. Contested by Dirk Middleton (5.9 feet, MAN). Rudy George misses. Rebound secured by Julius Curry.

[00:10] Team_002 possession (Score: 101-93)
Julius Curry drives to the basket... Julius Curry loses control! Ball rolls out of bounds! TURNOVER! (dead ball)

================================================================================
                              4TH QUARTER COMPLETE                              
================================================================================

4TH QUARTER SCORE: Team_001 23, Team_002 26

BOX SCORE:
================================================================================

Team_001
--------------------------------------------------------------------------------
Player                MIN  PTS  REB  AST  TO      FG   FG%      3P   3P%
--------------------------------------------------------------------------------
Klay Harden            26    6    0    0   0   2/3    66.7     0/0   0.0
Dirk Young             27    5    0    0   0   2/2   100.0     0/0   0.0
Dejounte McCollum      35    4    1    0   0   2/3    66.7     0/0   0.0
Cole Ball              33    4    1    2   0   0/0     0.0     0/0   0.0
Kristaps Ming          24    2    3    0   0   0/1     0.0     0/0   0.0
Ja Dosunmu             17    2    0    0   0   1/1   100.0     0/0   0.0
Miles Griffin          25    0    6    2   0   0/1     0.0     0/0   0.0
Rudy George            26    0    1    0   0   0/2     0.0     0/0   0.0

TEAM: FG: 7/13 (53.8%), 3PT: 1/4 (25.0%), REB: 12 (4 off, 8 def), AST: 4, TO: 4
TEAM FOULS: 0


Team_002
--------------------------------------------------------------------------------
Player                MIN  PTS  REB  AST  TO      FG   FG%      3P   3P%
--------------------------------------------------------------------------------
Tyler Porzingis        25    6    1    1   0   2/4    50.0     0/0   0.0
Julius Curry           15    5    2    1   0   2/2   100.0     0/0   0.0
Carmelo Lowry          23    3    4    0   0   1/1   100.0     0/0   0.0
Lamelo O'Neal          24    3    1    1   0   1/1   100.0     0/0   0.0
Miles Bane             33    2    0    1   0   1/3    33.3     0/0   0.0
Anfernee Sexton        26    2    1    1   0   1/2    50.0     0/0   0.0
Dirk Middleton         15    2    0    0   0   0/0     0.0     0/0   0.0
Jordan Green           33    0    0    0   0   0/3     0.0     0/0   0.0

TEAM: FG: 8/16 (50.0%), 3PT: 4/8 (50.0%), REB: 9 (3 off, 6 def), AST: 5, TO: 4
TEAM FOULS: 10 [Team_001 in BONUS]

================================================================================

================================================================================
                               FULL GAME COMPLETE                               
================================================================================

FINAL SCORE: Team_001 101, Team_002 93

SCORING BY QUARTER:
--------------------------------------------------------------------------------
Team                     Q1     Q2     Q3     Q4    FINAL
--------------------------------------------------------------------------------
Team_001                 26     31     21     23      101
Team_002                 26     17     24     26       93
--------------------------------------------------------------------------------

FULL GAME BOX SCORE:
================================================================================

Team_001
--------------------------------------------------------------------------------
Player                MIN  PTS  REB  AST  TO      FG   FG%      3P   3P%      FT STL BLK
--------------------------------------------------------------------------------
Dejounte McCollum      35    9   11    2   2   4/13   30.8   0/6     0.0   1/2     2   0
Cole Ball              33   13    7    8   2   1/4    25.0   1/3    33.3   6/11    0   1
Dirk Young             27   14    4    1   2   5/6    83.3   1/1   100.0   0/0     1   0
Klay Harden            26   18    5    1   2   8/11   72.7   3/4    75.0   3/3     1   1
Rudy George            26   15    5    2   1   5/11   45.5   3/5    60.0   2/2     0   0
Miles Griffin          25    9   15    3   2   3/6    50.0   0/0     0.0   3/3     1   2
Kristaps Ming          24    7    3    5   0   2/6    33.3   0/1     0.0   3/3     0   0
Ja Dosunmu             17    5    0    0   2   2/2   100.0   1/1   100.0   0/0     0   0
Larry Trent            15    2    0    1   1   1/1   100.0   0/0     0.0   0/0     0   0
Franz Bryant           13    8    2    0   0   2/2   100.0   0/0     0.0   1/1     0   0

TEAM: FG: 33/62 (53.2%), 3PT: 9/21 (42.9%), REB: 51 (17 off, 34 def), AST: 23, TO: 14


Team_002
--------------------------------------------------------------------------------
Player                MIN  PTS  REB  AST  TO      FG   FG%      3P   3P%      FT STL BLK
--------------------------------------------------------------------------------
Miles Bane             33   15    8    2   2   5/17   29.4   2/12   16.7   3/4     0   0
Jordan Green           33   12    1    1   1   5/9    55.6   2/4    50.0   0/0     0   0
CJ Barrett             29   10    3    2   5   3/4    75.0   1/1   100.0   3/5     0   0
Anfernee Sexton        26    5    8    1   0   2/7    28.6   1/2    50.0   0/0     0   0
Tyler Porzingis        25   13   10    1   0   4/7    57.1   1/3    33.3   1/3     2   1
Lamelo O'Neal          24    5    2    1   1   1/4    25.0   0/0     0.0   1/2     0   0
Carmelo Lowry          23    3    5    2   1   2/5    40.0   1/1   100.0   0/0     1   0
John Duncan            20   11    0    3   2   4/7    57.1   2/4    50.0   1/1     1   0
Dirk Middleton         15    8    0    0   2   2/2   100.0   0/0     0.0   4/4     0   0
Julius Curry           15    7    2    1   0   3/4    75.0   2/2   100.0   2/3     0   0

TEAM: FG: 31/67 (46.3%), 3PT: 12/29 (41.4%), REB: 40 (12 off, 28 def), AST: 14, TO: 14

================================================================================
