================================================================================
                        FULL GAME - Team_001 vs Team_002                        
================================================================================

================================================================================
                       1ST QUARTER - Team_001 vs Team_002                       
================================================================================

[12:00] Team_001 possession (Score: 0-0)
FOUL! Shooting foul on Miles Bane. Miles Griffin to the line for 3 free throws. [Team fouls: 1] (Miles Bane: 1 personal fouls)   FT 1/3: GOOD   FT 2/3: GOOD   FT 3/3: GOOD Miles Griffin makes 3/3 from the line.
Score: 3-0

[11:44] Team_002 possession (Score: 3-0)
Tyler Porzingis attempts a Layup. BLOCKED BY MILES GRIFFIN! Rebound secured by Miles Griffin.

[11:32] Team_001 possession (Score: 3-0)
Klay Harden drives to the basket... Klay Harden throws a bad pass! Stolen by Miles Bane! TURNOVER! (live ball)

[11:19] Team_002 possession (Score: 3-0)
Miles Bane attempts a 3Pt. Contested by Klay Harden (4.8 feet, MAN). Miles Bane misses. Offensive rebound by Miles Bane! Miles Bane kicks it out.

[11:06] Team_002 possession (Score: 3-0)
CJ Barrett attempts a 3Pt. Contested by Dirk Young (4.5 feet, MAN). CJ Barrett misses. Rebound secured by Miles Griffin.

[10:53] Team_001 possession (Score: 3-0)
Cole Ball attempts a 3Pt. Contested by Jordan Green (4.2 feet, MAN). Cole Ball misses. Offensive rebound by Dejounte McCollum! Dejounte McCollum kicks it out.

[10:39] Team_001 possession (Score: 3-0)
Dejounte McCollum attempts a Layup. Contested by Carmelo Lowry (5.8 feet, MAN). DEJOUNTE MCCOLLUM MAKES IT!
Score: 5-0

[10:22] Team_002 possession (Score: 5-0)
Miles Bane attempts a 3Pt. Contested by Cole Ball (3.1 feet, ZONE). MILES BANE MAKES IT! Assist: Jordan Green
Score: 5-3

[10:13] Team_001 possession (Score: 5-3)
Dejounte McCollum attempts a Midrange. Contested by Carmelo Lowry (5.9 feet, MAN). Dejounte McCollum misses. Offensive rebound by Cole Ball! Cole Ball kicks it out.

[09:56] Team_001 possession (Score: 5-3)
Cole Ball attempts a 3Pt. Contested by Miles Bane (5.0 feet, ZONE). Cole Ball misses. Rebound secured by CJ Barrett.

[09:45] Team_002 possession (Score: 5-3)
Jordan Green drives to the basket... Jordan Green throws a bad pass! Stolen by Dejounte McCollum! TURNOVER! (live ball)

[09:31] Team_001 possession (Score: 5-3)
Cole Ball attempts a Layup. BLOCKED BY JORDAN GREEN! Rebound secured by CJ Barrett.

[09:14] Team_002 possession (Score: 5-3)
Jordan Green drives to the basket... Jordan Green throws a bad pass out of bounds! TURNOVER! (dead ball)

[09:14] Substitution (Team_001): Klay Harden OUT → Rudy George IN (stamina_rule2)

[09:14] Substitution (Team_001): Dirk Young OUT → Ja Dosunmu IN (stamina_rule2)

[09:14] Substitution (Team_001): Cole Ball OUT → Larry Trent IN (stamina_rule2)

[09:14] Substitution (Team_001): Miles Griffin OUT → Kristaps Ming IN (stamina_rule2)

[09:14] Substitution (Team_002): Miles Bane OUT → John Duncan IN (stamina_rule2)

[09:14] Substitution (Team_002): CJ Barrett OUT → Dirk Middleton IN (stamina_rule2)

[09:14] Substitution (Team_002): Jordan Green OUT → Anfernee Sexton IN (stamina_rule2)

[09:14] Substitution (Team_002): Carmelo Lowry OUT → Julius Curry IN (stamina_rule2)

[09:14] Substitution (Team_002): Tyler Porzingis OUT → Lamelo O'Neal IN (stamina_rule2)

[09:02] Team_001 possession (Score: 5-3)
Dejounte McCollum makes the Layup and draws the foul on Julius Curry! And-1! Dejounte McCollum to the line for 1. [Team fouls: 2] (Julius Curry: 1 personal fouls)   FT 1/1: MISS Dejounte McCollum makes 0/1 from the line. Offensive rebound by Dejounte McCollum! Dejounte McCollum kicks it out.
Score: 7-3

[08:47] Team_001 possession (Score: 7-3)
Dejounte McCollum attempts a Midrange. Contested by Julius Curry (5.7 feet, MAN). DEJOUNTE MCCOLLUM MAKES IT! Assist: Ja Dosunmu
Score: 9-3

[08:33] Team_002 possession (Score: 9-3)
Lamelo O'Neal attempts a Midrange. Wide open! Kristaps Ming is 6.3 feet away. [MAN] Lamelo O'Neal misses. Offensive rebound by Anfernee Sexton! Anfernee Sexton kicks it out.

[08:16] Team_002 possession (Score: 9-3)
Julius Curry attempts a 3Pt. Contested by Ja Dosunmu (4.6 feet, ZONE). Julius Curry misses. Offensive rebound by Anfernee Sexton! Anfernee Sexton kicks it out.

[08:03] Team_002 possession (Score: 9-3)
John Duncan attempts a 3Pt. Contested by Ja Dosunmu (4.7 feet, MAN). JOHN DUNCAN MAKES IT! Assist: Lamelo O'Neal
Score: 9-6

[07:48] Team_001 possession (Score: 9-6)
Rudy George attempts a Midrange. Wide open! Dirk Middleton is 6.4 feet away. [MAN] RUDY GEORGE MAKES IT!
Score: 11-6

[07:34] Team_002 possession (Score: 11-6)
Dirk Middleton commits an offensive foul! Rudy George drew the charge! TURNOVER! (dead ball)

[07:17] Team_001 possession (Score: 11-6)
Ja Dosunmu attempts a Layup. Contested by John Duncan (5.9 feet, MAN). JA DOSUNMU MAKES IT! Assist: Rudy George
Score: 13-6

[07:03] Team_002 possession (Score: 13-6)
John Duncan attempts a 3Pt. Contested by Ja Dosunmu (4.9 feet, MAN). John Duncan misses. Rebound secured by Dejounte McCollum.

[06:50] Team_001 possession (Score: 13-6)
Larry Trent attempts a Layup. Contested by Lamelo O'Neal (5.5 feet, ZONE). LARRY TRENT MAKES IT!
Score: 15-6

[06:31] Team_002 possession (Score: 15-6)
Anfernee Sexton attempts a Layup. Contested by Dejounte McCollum (4.3 feet, ZONE). ANFERNEE SEXTON MAKES IT! Assist: Lamelo O'Neal
Score: 15-8

[06:12] Team_001 possession (Score: 15-8)
Larry Trent attempts a 3Pt. Contested by Anfernee Sexton (4.9 feet, MAN). LARRY TRENT MAKES IT! Assist: Rudy George
Score: 18-8

[05:58] Team_002 possession (Score: 18-8)
Lamelo O'Neal attempts a Midrange. Wide open! Kristaps Ming is 6.6 feet away. [MAN] Lamelo O'Neal misses. Rebound secured by Dejounte McCollum.

[05:41] Team_001 possession (Score: 18-8)
FOUL! Holding foul on Dirk Middleton. [Team fouls: 3] No free throws, side out. (Dirk Middleton: 1 personal fouls)

[05:27] Team_002 possession (Score: 18-8)
Julius Curry attempts a Midrange. Contested by Dejounte McCollum (4.5 feet, MAN). Julius Curry misses. Rebound secured by Dejounte McCollum.

[05:13] Team_001 possession (Score: 18-8)
Ja Dosunmu attempts a Layup. Wide open! John Duncan is 6.1 feet away. [MAN] JA DOSUNMU MAKES IT! Assist: Larry Trent
Score: 20-8

[04:57] Team_002 possession (Score: 20-8)
Anfernee Sexton attempts a 3Pt. Contested by Larry Trent (4.9 feet, MAN). Anfernee Sexton misses. Rebound secured by Larry Trent.

[04:43] Team_001 possession (Score: 20-8)
Kristaps Ming attempts a Layup. Contested by Lamelo O'Neal (6.0 feet, ZONE). KRISTAPS MING MAKES IT!
Score: 22-8

[04:32] Team_002 possession (Score: 22-8)
John Duncan makes the Midrange and draws the foul on Ja Dosunmu! And-1! John Duncan to the line for 1. [Team fouls: 4] (Ja Dosunmu: 1 personal fouls)   FT 1/1: GOOD John Duncan makes 1/1 from the line.
Score: 22-11

[04:18] Team_001 possession (Score: 22-11)
Larry Trent drives, Anfernee Sexton stays with him. Larry Trent attempts a Dunk. Contested by Anfernee Sexton (5.2 feet, MAN). Larry Trent misses. Offensive rebound by Rudy George! Rudy George kicks it out.

[03:59] Team_001 possession (Score: 22-11)
Rudy George makes the Midrange and draws the foul on Anfernee Sexton! And-1! Rudy George to the line for 1. [BONUS: 5 team fouls] (Anfernee Sexton: 1 personal fouls)   FT 1/1: GOOD Rudy George makes 1/1 from the line.
Score: 25-11

[03:48] Team_002 possession (Score: 25-11)
FOUL! Shooting foul on Ja Dosunmu. John Duncan to the line for 3 free throws. [BONUS: 6 team fouls] (Ja Dosunmu: 2 personal fouls)   FT 1/3: GOOD   FT 2/3: GOOD   FT 3/3: GOOD John Duncan makes 3/3 from the line.
Score: 25-14

[03:36] Team_001 possession (Score: 25-14)
Dejounte McCollum attempts a 3Pt. Wide open! Julius Curry is 6.3 feet away. [MAN] DEJOUNTE MCCOLLUM MAKES IT! Assist: Ja Dosunmu
Score: 28-14

[03:22] Team_002 possession (Score: 28-14)
Dirk Middleton drives to the basket... Dirk Middleton commits an offensive foul! TURNOVER! (dead ball)

[03:05] Team_001 possession (Score: 28-14)
Larry Trent attempts a Layup. Wide open! Lamelo O'Neal is 6.5 feet away. [ZONE] LARRY TRENT MAKES IT! Assist: Rudy George
Score: 30-14

[02:49] Team_002 possession (Score: 30-14)
John Duncan throws a bad pass! Stolen by Ja Dosunmu! TURNOVER! (live ball)

[02:38] Team_001 possession (Score: 30-14)
FOUL! Reach-in foul on John Duncan during the drive. [IN THE BONUS! 7 team fouls] Ja Dosunmu to the line for 2 free throws. (John Duncan: 1 personal fouls)   FT 1/2: GOOD   FT 2/2: GOOD Ja Dosunmu makes 2/2 from the line.
Score: 32-14

[02:28] Team_002 possession (Score: 32-14)
Lamelo O'Neal attempts a Layup. BLOCKED BY DEJOUNTE MCCOLLUM! Rebound secured by Dejounte McCollum.

[02:12] Team_001 possession (Score: 32-14)
Kristaps Ming attempts a Layup. Wide open! Lamelo O'Neal is 6.7 feet away. [MAN] Kristaps Ming misses. FOUL! Loose ball foul on Anfernee Sexton during the rebound battle. [IN THE BONUS! 8 team fouls] Rudy George to the line for 2 free throws. (Anfernee Sexton: 2 personal fouls)   FT 1/2: GOOD   FT 2/2: GOOD Rudy George makes 2/2 from the line.
Score: 34-14

[01:54] Team_002 possession (Score: 34-14)
Lamelo O'Neal drives and kicks out. Julius Curry attempts a 3Pt. Wide open! Rudy George is 6.0 feet away. [ZONE] JULIUS CURRY MAKES IT! Assist: Anfernee Sexton
Score: 34-17

[01:40] Team_001 possession (Score: 34-17)
Dejounte McCollum drives, picks up Julius Curry. Help arrives from John Duncan! Dejounte McCollum attempts a Dunk. Wide open! John Duncan is 6.5 feet away. [MAN] DEJOUNTE MCCOLLUM MAKES IT!
Score: 36-17

[01:23] Team_002 possession (Score: 36-17)
John Duncan drives to the basket... John Duncan loses the ball! Stripped by Ja Dosunmu! TURNOVER! (live ball)

[01:08] Team_001 possession (Score: 36-17)
Larry Trent drives to the basket... Larry Trent throws a bad pass! Stolen by Lamelo O'Neal! TURNOVER! (live ball)

[00:57] Team_002 possession (Score: 36-17)
Dirk Middleton attempts a Midrange. Wide open! Rudy George is 6.2 feet away. [MAN] Dirk Middleton misses. Rebound secured by Rudy George.

[00:43] Team_001 possession (Score: 36-17)
Rudy George drives and kicks out. Ja Dosunmu attempts a 3Pt. Wide open! John Duncan is 6.7 feet away. [MAN] Ja Dosunmu misses. Rebound secured by Julius Curry.

[00:26] Team_002 possession (Score: 36-17)
John Duncan attempts a 3Pt. Wide open! Ja Dosunmu is 6.2 feet away. [MAN] JOHN DUNCAN MAKES IT! Assist: Lamelo O'Neal
Score: 36-20

[00:07] Team_001 possession (Score: 36-20)
Rudy George drives and kicks out. Larry Trent attempts a 3Pt. Contested by Anfernee Sexton (5.8 feet, MAN). Larry Trent misses. Rebound secured by Julius Curry.

================================================================================
                              1ST QUARTER COMPLETE                              
================================================================================

1ST QUARTER SCORE: Team_001 36, Team_002 20

BOX SCORE:
================================================================================

Team_001
--------------------------------------------------------------------------------
Player                MIN  PTS  REB  AST  TO      FG   FG%      3P   3P%
--------------------------------------------------------------------------------
Dejounte McCollum      12    9    6    0   0   4/4   100.0     0/0   0.0
Rudy George             9    7    2    3   0   2/4    50.0     0/0   0.0
Larry Trent             9    7    1    1   0   3/3   100.0     0/0   0.0
Ja Dosunmu              9    6    0    2   0   2/2   100.0     0/0   0.0
Miles Griffin           3    3    2    0   0   0/0     0.0     0/0   0.0
Kristaps Ming           9    2    0    0   0   1/1   100.0     0/0   0.0
Cole Ball               3    0    1    0   0   0/2     0.0     0/0   0.0

TEAM: FG: 12/16 (75.0%), 3PT: 2/3 (66.7%), REB: 12 (4 off, 8 def), AST: 6, TO: 2
TEAM FOULS: 0


Team_002
--------------------------------------------------------------------------------
Player                MIN  PTS  REB  AST  TO      FG   FG%      3P   3P%
--------------------------------------------------------------------------------
John Duncan             9   12    0    0   0   3/4    75.0     0/0   0.0
Miles Bane              3    3    1    0   0   1/1   100.0     0/0   0.0
Julius Curry            9    3    2    0   0   1/2    50.0     0/0   0.0
Anfernee Sexton         9    2    2    1   0   1/2    50.0     0/0   0.0
Tyler Porzingis         3    0    0    0   0   0/1     0.0     0/0   0.0
CJ Barrett              3    0    2    0   0   0/1     0.0     0/0   0.0
Jordan Green            3    0    0    1   0   0/0     0.0     0/0   0.0
Lamelo O'Neal           9    0    0    3   0   0/2     0.0     0/0   0.0
Dirk Middleton          9    0    0    0   0   0/1     0.0     0/0   0.0

TEAM: FG: 6/14 (42.9%), 3PT: 3/6 (50.0%), REB: 7 (3 off, 4 def), AST: 5, TO: 6
TEAM FOULS: 8 [Team_001 in BONUS]

================================================================================

================================================================================
                       2ND QUARTER - Team_001 vs Team_002                       
================================================================================

[12:00] Team_001 possession (Score: 36-20)
Cole Ball attempts a 3Pt. Contested by Jordan Green (3.8 feet, MAN). COLE BALL MAKES IT! Assist: Miles Griffin
Score: 39-20

[11:44] Team_002 possession (Score: 39-20)
Miles Bane attempts a 3Pt. Contested by Klay Harden (3.5 feet, MAN). Miles Bane misses. Offensive rebound by Tyler Porzingis! Tyler Porzingis puts it back in!
Score: 39-22

[11:29] Team_001 possession (Score: 39-22)
Dejounte McCollum makes the Layup and draws the foul on Carmelo Lowry! And-1! Dejounte McCollum to the line for 1. [Team fouls: 1] (Carmelo Lowry: 1 personal fouls)   FT 1/1: GOOD Dejounte McCollum makes 1/1 from the line.
Score: 42-22

[11:16] Team_002 possession (Score: 42-22)
Tyler Porzingis attempts a Midrange. Contested by Cole Ball (2.8 feet, ZONE). Tyler Porzingis misses. Rebound secured by Miles Griffin.

[11:07] Team_001 possession (Score: 42-22)
FOUL! Reach-in foul on Tyler Porzingis during the drive. [Team fouls: 2] No free throws, side out. (Tyler Porzingis: 1 personal fouls)

[10:54] Team_002 possession (Score: 42-22)
Jordan Green attempts a 3Pt. Contested by Cole Ball (2.8 feet, MAN). Jordan Green misses. Rebound secured by Klay Harden.

[10:41] Team_001 possession (Score: 42-22)
Klay Harden drives, Miles Bane stays with him. Klay Harden attempts a Layup. Contested by Miles Bane (4.5 feet, MAN). KLAY HARDEN MAKES IT! Assist: Cole Ball
Score: 44-22

[10:28] Team_002 possession (Score: 44-22)
Tyler Porzingis makes the Layup and draws the foul on Miles Griffin! And-1! Tyler Porzingis to the line for 1. [Team fouls: 3] (Miles Griffin: 1 personal fouls)   FT 1/1: GOOD Tyler Porzingis makes 1/1 from the line.
Score: 44-25

[10:14] Team_001 possession (Score: 44-25)
Miles Griffin drives, picks up Tyler Porzingis. Help arrives from CJ Barrett! Miles Griffin attempts a Layup. Contested by CJ Barrett (3.3 feet, MAN). Miles Griffin misses. Offensive rebound by Cole Ball! Cole Ball kicks it out.

[09:55] Team_001 possession (Score: 44-25)
Klay Harden drives, Miles Bane stays with him. Klay Harden attempts a Dunk. Contested by Miles Bane (4.5 feet, MAN). Klay Harden misses. Rebound secured by CJ Barrett.

[09:39] Team_002 possession (Score: 44-25)
Tyler Porzingis drives to the basket... Tyler Porzingis loses the ball! Stripped by Miles Griffin! TURNOVER! (live ball)

[09:24] Team_001 possession (Score: 44-25)
Klay Harden drives, picks up Miles Bane. Help arrives from CJ Barrett! Klay Harden attempts a Dunk. Contested by CJ Barrett (4.5 feet, MAN). Klay Harden misses. FOUL! Loose ball foul on CJ Barrett during the rebound battle. [Team fouls: 4] No free throws, side out. (CJ Barrett: 1 personal fouls)

[09:07] Team_001 possession (Score: 44-25)
FOUL! Reach-in foul on CJ Barrett during the drive. [IN THE BONUS! 5 team fouls] Dirk Young to the line for 2 free throws. (CJ Barrett: 2 personal fouls)   FT 1/2: GOOD   FT 2/2: GOOD Dirk Young makes 2/2 from the line.
Score: 46-25

[08:53] Team_002 possession (Score: 46-25)
Miles Bane attempts a Midrange. Contested by Klay Harden (3.9 feet, MAN). Miles Bane misses. Rebound secured by Klay Harden.

[08:41] Team_001 possession (Score: 46-25)
FOUL! Shooting foul on Miles Bane. Klay Harden to the line for 2 free throws. [BONUS: 6 team fouls] (Miles Bane: 1 personal fouls)   FT 1/2: GOOD   FT 2/2: GOOD Klay Harden makes 2/2 from the line.
Score: 48-25

[08:27] Team_002 possession (Score: 48-25)
Jordan Green attempts a 3Pt. Contested by Cole Ball (2.9 feet, ZONE). JORDAN GREEN MAKES IT! Assist: Miles Bane
Score: 48-28

[08:15] Team_001 possession (Score: 48-28)
Dejounte McCollum attempts a 3Pt. Contested by Carmelo Lowry (4.5 feet, MAN). Dejounte McCollum misses. Rebound secured by Miles Bane.

[08:01] Team_002 possession (Score: 48-28)
Miles Bane drives, Klay Harden stays with him. Miles Bane attempts a Dunk. Contested by Klay Harden (4.1 feet, MAN). MILES BANE MAKES IT!
Score: 48-30

[07:42] Team_001 possession (Score: 48-30)
FOUL! Holding foul on CJ Barrett. [IN THE BONUS! 7 team fouls] Dirk Young to the line for 2 free throws. (CJ Barrett: 3 personal fouls)   FT 1/2: GOOD   FT 2/2: GOOD Dirk Young makes 2/2 from the line.
Score: 50-30

[07:29] Team_002 possession (Score: 50-30)
Jordan Green attempts a 3Pt. Contested by Cole Ball (3.0 feet, MAN). JORDAN GREEN MAKES IT! Assist: Miles Bane
Score: 50-33

[07:13] Team_001 possession (Score: 50-33)
Cole Ball attempts a 3Pt. Contested by Miles Bane (4.7 feet, ZONE). Cole Ball misses. Rebound secured by Miles Bane.

[06:56] Team_002 possession (Score: 50-33)
Carmelo Lowry drives, Dejounte McCollum stays with him. Carmelo Lowry attempts a Dunk. Contested by Dejounte McCollum (5.4 feet, MAN). Carmelo Lowry misses. Offensive rebound by Tyler Porzingis! Tyler Porzingis's putback is no good. Rebound secured by Klay Harden.

[06:41] Team_001 possession (Score: 50-33)
Dirk Young attempts a Midrange. Contested by CJ Barrett (4.2 feet, MAN). Dirk Young misses. Rebound secured by Tyler Porzingis.

[06:23] Team_002 possession (Score: 50-33)
Jordan Green drives, picks up Cole Ball. Help arrives from Klay Harden! Jordan Green attempts a Dunk. Contested by Klay Harden (3.1 feet, MAN). Jordan Green misses. Rebound secured by Cole Ball.

[06:12] Team_001 possession (Score: 50-33)
Klay Harden attempts a Layup. Contested by Miles Bane (4.8 feet, MAN). KLAY HARDEN MAKES IT! Assist: Cole Ball
Score: 52-33

[06:01] Team_002 possession (Score: 52-33)
Carmelo Lowry attempts a 3Pt. Contested by Dejounte McCollum (5.6 feet, MAN). Carmelo Lowry misses. FOUL! Loose ball foul on Miles Griffin during the rebound battle. [IN THE BONUS! 8 team fouls] Miles Bane to the line for 2 free throws. (Miles Griffin: 2 personal fouls)   FT 1/2: MISS   FT 2/2: MISS Miles Bane makes 0/2 from the line. Rebound secured by Klay Harden.

[05:48] Team_001 possession (Score: 52-33)
Miles Griffin attempts a Layup. Contested by Tyler Porzingis (3.9 feet, MAN). MILES GRIFFIN MAKES IT!
Score: 54-33

[05:29] Team_002 possession (Score: 54-33)
Miles Bane attempts a 3Pt. Contested by Cole Ball (3.2 feet, ZONE). Miles Bane misses. Rebound secured by Klay Harden.

[05:19] Team_001 possession (Score: 54-33)
Klay Harden attempts a Midrange. Contested by Jordan Green (4.3 feet, ZONE). Klay Harden misses. Rebound secured by Miles Bane.

[05:06] Team_002 possession (Score: 54-33)
CJ Barrett attempts a Layup. BLOCKED BY DIRK YOUNG! Rebound secured by Cole Ball.

[04:48] Team_001 possession (Score: 54-33)
Klay Harden attempts a 3Pt. Contested by Miles Bane (5.0 feet, MAN). Klay Harden misses. Rebound secured by Miles Bane.

[04:33] Team_002 possession (Score: 54-33)
Carmelo Lowry attempts a Midrange. Contested by Dejounte McCollum (5.8 feet, MAN). Carmelo Lowry misses. Rebound secured by Klay Harden.

[04:16] Team_001 possession (Score: 54-33)
Klay Harden drives to the basket... Klay Harden commits an offensive foul! TURNOVER! (dead ball)

[04:01] Team_002 possession (Score: 54-33)
Miles Bane attempts a 3Pt. Contested by Klay Harden (4.9 feet, MAN). Miles Bane misses. FOUL! Loose ball foul on Miles Griffin during the rebound battle. [IN THE BONUS! 9 team fouls] Tyler Porzingis to the line for 2 free throws. (Miles Griffin: 3 personal fouls)   FT 1/2: MISS   FT 2/2: GOOD Tyler Porzingis makes 1/2 from the line.
Score: 54-34

[03:42] Team_001 possession (Score: 54-34)
Dejounte McCollum attempts a 3Pt. Contested by Carmelo Lowry (5.3 feet, MAN). Dejounte McCollum misses. FOUL! Loose ball foul on Tyler Porzingis during the rebound battle. [IN THE BONUS! 10 team fouls] Miles Griffin to the line for 2 free throws. (Tyler Porzingis: 2 personal fouls)   FT 1/2: MISS   FT 2/2: GOOD Miles Griffin makes 1/2 from the line.
Score: 55-34

[03:28] Team_002 possession (Score: 55-34)
Carmelo Lowry attempts a 3Pt. Contested by Cole Ball (3.5 feet, ZONE). Carmelo Lowry misses. FOUL! Loose ball foul on Cole Ball during the rebound battle. [IN THE BONUS! 11 team fouls] Miles Bane to the line for 2 free throws. (Cole Ball: 1 personal fouls)   FT 1/2: GOOD   FT 2/2: GOOD Miles Bane makes 2/2 from the line.
Score: 55-36

[03:11] Team_001 possession (Score: 55-36)
Klay Harden attempts a Midrange. Contested by Miles Bane (5.2 feet, MAN). KLAY HARDEN MAKES IT!
Score: 57-36

[02:58] Team_002 possession (Score: 57-36)
Miles Bane attempts a 3Pt. Contested by Klay Harden (5.1 feet, MAN). Miles Bane misses. Rebound secured by Miles Griffin.

[02:43] Team_001 possession (Score: 57-36)
Miles Griffin makes the Layup and draws the foul on Tyler Porzingis! And-1! Miles Griffin to the line for 1. [BONUS: 12 team fouls] (Tyler Porzingis: 3 personal fouls)   FT 1/1: GOOD Miles Griffin makes 1/1 from the line.
Score: 60-36

[02:30] Team_002 possession (Score: 60-36)
Miles Bane attempts a 3Pt. Contested by Klay Harden (5.2 feet, MAN). Miles Bane misses. Rebound secured by Dirk Young.

[02:17] Team_001 possession (Score: 60-36)
Klay Harden drives to the basket... Klay Harden loses control! Ball rolls out of bounds! TURNOVER! (dead ball)

[02:17] Substitution (Team_001): Klay Harden OUT → Rudy George IN (stamina_rule2)

[02:17] Substitution (Team_001): Dirk Young OUT → Ja Dosunmu IN (stamina_rule2)

[02:17] Substitution (Team_001): Cole Ball OUT → Franz Bryant IN (stamina_rule2)

[02:17] Substitution (Team_001): Dejounte McCollum OUT → Larry Trent IN (stamina_rule2)

[02:17] Substitution (Team_001): Miles Griffin OUT → Kristaps Ming IN (stamina_rule2)

[02:17] Substitution (Team_002): Miles Bane OUT → John Duncan IN (stamina_rule2)

[02:17] Substitution (Team_002): CJ Barrett OUT → Dirk Middleton IN (stamina_rule2)

[02:17] Substitution (Team_002): Jordan Green OUT → Anfernee Sexton IN (stamina_rule2)

[02:17] Substitution (Team_002): Carmelo Lowry OUT → Julius Curry IN (stamina_rule2)

[02:17] Substitution (Team_002): Tyler Porzingis OUT → Lamelo O'Neal IN (stamina_rule2)

[02:06] Team_002 possession (Score: 60-36)
Lamelo O'Neal attempts a Midrange. Contested by Kristaps Ming (5.7 feet, MAN). Lamelo O'Neal misses. Rebound secured by Larry Trent.

[01:54] Team_001 possession (Score: 60-36)
Rudy George attempts a Layup. BLOCKED BY LAMELO O'NEAL! Rebound secured by Anfernee Sexton.

[01:40] Team_002 possession (Score: 60-36)
Dirk Middleton attempts a 3Pt. Contested by Rudy George (4.8 feet, MAN). Dirk Middleton misses. Rebound secured by Kristaps Ming.

[01:27] Team_001 possession (Score: 60-36)
Franz Bryant attempts a Midrange. Contested by Julius Curry (5.4 feet, MAN). FRANZ BRYANT MAKES IT!
Score: 62-36

[01:12] Team_002 possession (Score: 62-36)
John Duncan drives, Franz Bryant stays with him. John Duncan attempts a Layup. Contested by Franz Bryant (3.8 feet, ZONE). JOHN DUNCAN MAKES IT!
Score: 62-38

[00:57] Team_001 possession (Score: 62-38)
Kristaps Ming drives and kicks out. Larry Trent attempts a Midrange. Contested by Anfernee Sexton (4.4 feet, MAN). Larry Trent misses. Rebound secured by Lamelo O'Neal.

[00:41] Team_002 possession (Score: 62-38)
Julius Curry attempts a Midrange. Contested by Franz Bryant (3.8 feet, MAN). Julius Curry misses. Rebound secured by Larry Trent.

[00:31] Team_001 possession (Score: 62-38)
Franz Bryant drives to the basket... Franz Bryant throws a bad pass! Stolen by Julius Curry! TURNOVER! (live ball)

[00:18] Team_002 possession (Score: 62-38)
John Duncan attempts a 3Pt. Contested by Ja Dosunmu (4.0 feet, ZONE). John Duncan misses. Rebound secured by Franz Bryant.

[00:02] Team_001 possession (Score: 62-38)
Ja Dosunmu attempts a 3Pt. Contested by Julius Curry (5.5 feet, ZONE). Ja Dosunmu misses. Rebound secured by Julius Curry.

================================================================================
                              2ND QUARTER COMPLETE                              
================================================================================

2ND QUARTER SCORE: Team_001 26, Team_002 18

BOX SCORE:
================================================================================

Team_001
--------------------------------------------------------------------------------
Player                MIN  PTS  REB  AST  TO      FG   FG%      3P   3P%
--------------------------------------------------------------------------------
Klay Harden            13    8    6    0   0   3/6    50.0     0/0   0.0
Miles Griffin          13    6    2    1   0   2/2   100.0     0/0   0.0
Dirk Young             13    4    1    0   0   0/1     0.0     0/0   0.0
Cole Ball              13    3    4    2   0   1/2    50.0     0/0   0.0
Dejounte McCollum      22    3    0    0   0   1/2    50.0     0/0   0.0
Franz Bryant            2    2    1    0   0   1/1   100.0     0/0   0.0
Larry Trent            11    0    2    0   0   0/0     0.0     0/0   0.0
Rudy George            11    0    0    0   0   0/1     0.0     0/0   0.0
Kristaps Ming          11    0    1    0   0   0/1     0.0     0/0   0.0
Ja Dosunmu             11    0    0    0   0   0/1     0.0     0/0   0.0

TEAM: FG: 8/17 (47.1%), 3PT: 1/5 (20.0%), REB: 15 (2 off, 13 def), AST: 3, TO: 3
TEAM FOULS: 0


Team_002
--------------------------------------------------------------------------------
Player                MIN  PTS  REB  AST  TO      FG   FG%      3P   3P%
--------------------------------------------------------------------------------
Tyler Porzingis        13    6    2    0   0   2/3    66.7     0/0   0.0
Jordan Green           13    6    0    0   0   2/4    50.0     0/0   0.0
Miles Bane             13    4    4    2   0   1/5    20.0     0/0   0.0
John Duncan            11    2    0    0   0   1/2    50.0     0/0   0.0
CJ Barrett             13    0    1    0   0   0/1     0.0     0/0   0.0
Carmelo Lowry          13    0    0    0   0   0/3     0.0     0/0   0.0
Lamelo O'Neal          11    0    1    0   0   0/1     0.0     0/0   0.0
Anfernee Sexton        11    0    1    0   0   0/0     0.0     0/0   0.0
Dirk Middleton         11    0    0    0   0   0/1     0.0     0/0   0.0
Julius Curry           11    0    1    0   0   0/1     0.0     0/0   0.0

TEAM: FG: 6/21 (28.6%), 3PT: 3/10 (30.0%), REB: 12 (3 off, 9 def), AST: 2, TO: 1
TEAM FOULS: 12 [Team_001 in BONUS]

================================================================================

================================================================================
                       3RD QUARTER - Team_001 vs Team_002                       
================================================================================

[12:00] Team_001 possession (Score: 62-38)
Klay Harden attempts a 3Pt. Contested by Miles Bane (4.5 feet, MAN). KLAY HARDEN MAKES IT! Assist: Miles Griffin
Score: 65-38

[11:48] Team_002 possession (Score: 65-38)
Carmelo Lowry attempts a Layup. Contested by Miles Griffin (3.7 feet, ZONE). CARMELO LOWRY MAKES IT! Assist: Tyler Porzingis
Score: 65-40

[11:31] Team_001 possession (Score: 65-40)
Miles Griffin drives to the basket... Miles Griffin throws a bad pass! Stolen by Tyler Porzingis! TURNOVER! (live ball)

[11:15] Team_002 possession (Score: 65-40)
Miles Bane drives and kicks out. Miles Bane attempts a Midrange. Contested by Miles Griffin (3.7 feet, ZONE). MILES BANE MAKES IT!
Score: 65-42

[11:01] Team_001 possession (Score: 65-42)
Klay Harden attempts a 3Pt. Contested by Miles Bane (4.5 feet, MAN). KLAY HARDEN MAKES IT!
Score: 68-42

[10:49] Team_002 possession (Score: 68-42)
FOUL! Shooting foul on Miles Griffin. Carmelo Lowry to the line for 2 free throws. [Team fouls: 1] (Miles Griffin: 1 personal fouls)   FT 1/2: GOOD   FT 2/2: MISS Carmelo Lowry makes 1/2 from the line. Rebound secured by Miles Griffin.
Score: 68-43

[10:38] Team_001 possession (Score: 68-43)
Dejounte McCollum attempts a Layup. Contested by Tyler Porzingis (3.0 feet, ZONE). DEJOUNTE MCCOLLUM MAKES IT! Assist: Dirk Young
Score: 70-43

[10:21] Team_002 possession (Score: 70-43)
Miles Bane attempts a 3Pt. Contested by Klay Harden (3.3 feet, MAN). Miles Bane misses. Rebound secured by Miles Griffin.

[10:04] Team_001 possession (Score: 70-43)
Dirk Young drives to the basket... Dirk Young loses the ball! Stripped by CJ Barrett! TURNOVER! (live ball)

[09:45] Team_002 possession (Score: 70-43)
Jordan Green attempts a 3Pt. Contested by Cole Ball (2.8 feet, MAN). Jordan Green misses. Offensive rebound by Carmelo Lowry! Carmelo Lowry kicks it out.

[09:30] Team_002 possession (Score: 70-43)
Jordan Green attempts a Midrange. Contested by Cole Ball (2.8 feet, MAN). Jordan Green misses. Offensive rebound by Tyler Porzingis! Tyler Porzingis's putback is no good. Offensive rebound by Carmelo Lowry! Carmelo Lowry kicks it out.

[09:14] Team_002 possession (Score: 70-43)
Jordan Green throws a bad pass out of bounds! TURNOVER! (dead ball)

[09:01] Team_001 possession (Score: 70-43)
FOUL! Shooting foul on Miles Bane. Klay Harden to the line for 2 free throws. [Team fouls: 2] (Miles Bane: 1 personal fouls)   FT 1/2: GOOD   FT 2/2: MISS Klay Harden makes 1/2 from the line. Rebound secured by Tyler Porzingis.
Score: 71-43

[08:48] Team_002 possession (Score: 71-43)
Tyler Porzingis drives, Miles Griffin stays with him. Tyler Porzingis attempts a Dunk. Contested by Miles Griffin (3.7 feet, MAN). Tyler Porzingis misses. Offensive rebound by Carmelo Lowry! Carmelo Lowry kicks it out.

[08:33] Team_002 possession (Score: 71-43)
Carmelo Lowry throws a bad pass! Stolen by Dejounte McCollum! TURNOVER! (live ball)

[08:15] Team_001 possession (Score: 71-43)
Dirk Young attempts a 3Pt. Contested by CJ Barrett (3.8 feet, ZONE). Dirk Young misses. Offensive rebound by Cole Ball! Cole Ball kicks it out.

[08:01] Team_001 possession (Score: 71-43)
Dejounte McCollum attempts a 3Pt. Contested by CJ Barrett (3.8 feet, ZONE). Dejounte McCollum misses. Rebound secured by Miles Bane.

[07:45] Team_002 possession (Score: 71-43)
Jordan Green attempts a 3Pt. Contested by Cole Ball (2.8 feet, MAN). Jordan Green misses. Offensive rebound by Tyler Porzingis! Tyler Porzingis puts it back in!
Score: 71-45

[07:31] Team_001 possession (Score: 71-45)
Dirk Young attempts a Layup. Contested by Tyler Porzingis (3.0 feet, ZONE). Dirk Young misses. Offensive rebound by Miles Griffin! Miles Griffin kicks it out.

[07:14] Team_001 possession (Score: 71-45)
Klay Harden makes the 3Pt and draws the foul on CJ Barrett! And-1! Klay Harden to the line for 1. [Team fouls: 3] (CJ Barrett: 1 personal fouls)   FT 1/1: GOOD Klay Harden makes 1/1 from the line.
Score: 75-45

[07:00] Team_002 possession (Score: 75-45)
Miles Bane attempts a 3Pt. Contested by Klay Harden (3.3 feet, ZONE). Miles Bane misses. Rebound secured by Dejounte McCollum.

[06:49] Team_001 possession (Score: 75-45)
Miles Griffin attempts a Layup. BLOCKED BY TYLER PORZINGIS! Ball goes out of bounds. Turnover!

[06:34] Team_002 possession (Score: 75-45)
Tyler Porzingis attempts a Layup. Contested by Miles Griffin (3.7 feet, MAN). Tyler Porzingis misses. Offensive rebound by Tyler Porzingis! Tyler Porzingis puts it back in!
Score: 75-47

[06:21] Team_001 possession (Score: 75-47)
Dirk Young drives, Tyler Porzingis stays with him. Dirk Young attempts a Dunk. Contested by Tyler Porzingis (3.0 feet, ZONE). Dirk Young misses. Rebound secured by Miles Bane.

[06:08] Team_002 possession (Score: 75-47)
FOUL! Shooting foul on Klay Harden. Miles Bane to the line for 2 free throws. [Team fouls: 4] (Klay Harden: 1 personal fouls)   FT 1/2: GOOD   FT 2/2: GOOD Miles Bane makes 2/2 from the line.
Score: 75-49

[05:54] Team_001 possession (Score: 75-49)
Klay Harden attempts a 3Pt. Contested by Miles Bane (4.5 feet, MAN). KLAY HARDEN MAKES IT! Assist: Cole Ball
Score: 78-49

[05:39] Team_002 possession (Score: 78-49)
CJ Barrett attempts a 3Pt. Contested by Dirk Young (3.8 feet, MAN). CJ Barrett misses. Rebound secured by Miles Griffin.

[05:21] Team_001 possession (Score: 78-49)
Klay Harden attempts a 3Pt. Contested by Carmelo Lowry (3.6 feet, ZONE). Klay Harden misses. Rebound secured by Miles Bane.

[05:04] Team_002 possession (Score: 78-49)
Carmelo Lowry drives, picks up Miles Griffin. Help arrives from Klay Harden! Carmelo Lowry attempts a Dunk. Contested by Klay Harden (3.8 feet, ZONE). Carmelo Lowry misses. Offensive rebound by Tyler Porzingis! Tyler Porzingis's putback is no good. Rebound secured by Dejounte McCollum.

[04:50] Team_001 possession (Score: 78-49)
Cole Ball attempts a 3Pt. Contested by Jordan Green (3.9 feet, MAN). Cole Ball misses. Rebound secured by Tyler Porzingis.

[04:31] Team_002 possession (Score: 78-49)
Tyler Porzingis drives and kicks out. Jordan Green attempts a 3Pt. Contested by Klay Harden (3.5 feet, ZONE). Jordan Green misses. Rebound secured by Cole Ball.

[04:22] Team_001 possession (Score: 78-49)
Dejounte McCollum attempts a Midrange. BLOCKED BY CARMELO LOWRY! Ball goes out of bounds. Turnover!

[04:05] Team_002 possession (Score: 78-49)
Tyler Porzingis attempts a 3Pt. Contested by Miles Griffin (3.9 feet, MAN). Tyler Porzingis misses. FOUL! Loose ball foul on Cole Ball during the rebound battle. [IN THE BONUS! 5 team fouls] Tyler Porzingis to the line for 2 free throws. (Cole Ball: 1 personal fouls)   FT 1/2: GOOD   FT 2/2: GOOD Tyler Porzingis makes 2/2 from the line.
Score: 78-51

[03:51] Team_001 possession (Score: 78-51)
Dirk Young attempts a 3Pt. Contested by CJ Barrett (4.0 feet, MAN). DIRK YOUNG MAKES IT! Assist: Miles Griffin
Score: 81-51

[03:36] Team_002 possession (Score: 81-51)
Tyler Porzingis drives to the basket... Tyler Porzingis commits an offensive foul! TURNOVER! (dead ball)

[03:17] Team_001 possession (Score: 81-51)
Dejounte McCollum attempts a 3Pt. Contested by Carmelo Lowry (3.8 feet, ZONE). Dejounte McCollum misses. Rebound secured by Carmelo Lowry.

[03:01] Team_002 possession (Score: 81-51)
Tyler Porzingis drives to the basket... Tyler Porzingis loses the ball! Stripped by Miles Griffin! TURNOVER! (live ball)

[02:45] Team_001 possession (Score: 81-51)
FOUL! Shooting foul on Tyler Porzingis. Miles Griffin to the line for 2 free throws. [BONUS: 6 team fouls] (Tyler Porzingis: 1 personal fouls)   FT 1/2: MISS   FT 2/2: GOOD Miles Griffin makes 1/2 from the line.
Score: 82-51

[02:33] Team_002 possession (Score: 82-51)
Jordan Green attempts a 3Pt. Contested by Cole Ball (3.1 feet, MAN). Jordan Green misses. Rebound secured by Miles Griffin.

[02:18] Team_001 possession (Score: 82-51)
Miles Griffin drives to the basket... Miles Griffin loses the ball! Stripped by Tyler Porzingis! TURNOVER! (live ball)

[02:02] Team_002 possession (Score: 82-51)
Miles Bane attempts a Layup. Contested by Klay Harden (3.9 feet, MAN). Miles Bane misses. Rebound secured by Miles Griffin.

[01:48] Team_001 possession (Score: 82-51)
Cole Ball drives and kicks out. Miles Griffin attempts a 3Pt. Contested by Tyler Porzingis (3.4 feet, MAN). Miles Griffin misses. Rebound secured by Tyler Porzingis.

[01:34] Team_002 possession (Score: 82-51)
Tyler Porzingis drives, Miles Griffin stays with him. Tyler Porzingis attempts a Layup. Contested by Miles Griffin (4.2 feet, MAN). TYLER PORZINGIS MAKES IT! Assist: Carmelo Lowry
Score: 82-53

[01:17] Team_001 possession (Score: 82-53)
Cole Ball throws a bad pass out of bounds! TURNOVER! (dead ball)

[01:17] Substitution (Team_001): Klay Harden OUT → Ja Dosunmu IN (stamina_rule2)

[01:17] Substitution (Team_001): Dirk Young OUT → Rudy George IN (stamina_rule2)

[01:17] Substitution (Team_001): Cole Ball OUT → Larry Trent IN (stamina_rule2)

[01:17] Substitution (Team_001): Miles Griffin OUT → Kristaps Ming IN (stamina_rule2)

[01:17] Substitution (Team_002): Miles Bane OUT → John Duncan IN (stamina_rule2)

[01:17] Substitution (Team_002): CJ Barrett OUT → Dirk Middleton IN (stamina_rule2)

[01:17] Substitution (Team_002): Jordan Green OUT → Anfernee Sexton IN (stamina_rule2)

[01:17] Substitution (Team_002): Carmelo Lowry OUT → Julius Curry IN (stamina_rule2)

[01:17] Substitution (Team_002): Tyler Porzingis OUT → Lamelo O'Neal IN (stamina_rule2)

[01:00] Team_002 possession (Score: 82-53)
Lamelo O'Neal makes the Layup and draws the foul on Rudy George! And-1! Lamelo O'Neal to the line for 1. [BONUS: 7 team fouls] (Rudy George: 1 personal fouls)   FT 1/1: GOOD Lamelo O'Neal makes 1/1 from the line.
Score: 82-56

[00:46] Team_001 possession (Score: 82-56)
FOUL! Holding foul on Lamelo O'Neal. [IN THE BONUS! 8 team fouls] Kristaps Ming to the line for 2 free throws. (Lamelo O'Neal: 1 personal fouls)   FT 1/2: GOOD   FT 2/2: GOOD Kristaps Ming makes 2/2 from the line.
Score: 84-56

[00:34] Team_002 possession (Score: 84-56)
John Duncan attempts a 3Pt. Contested by Ja Dosunmu (3.5 feet, ZONE). John Duncan misses. Rebound secured by Dejounte McCollum.

[00:18] Team_001 possession (Score: 84-56)
Kristaps Ming drives to the basket... Kristaps Ming commits an offensive foul! TURNOVER! (dead ball)

[00:02] Team_002 possession (Score: 84-56)
Dirk Middleton attempts a Midrange. Contested by Rudy George (4.7 feet, ZONE). Dirk Middleton misses. Rebound secured by Rudy George.

================================================================================
                              3RD QUARTER COMPLETE                              
================================================================================

3RD QUARTER SCORE: Team_001 22, Team_002 18

BOX SCORE:
================================================================================

Team_001
--------------------------------------------------------------------------------
Player                MIN  PTS  REB  AST  TO      FG   FG%      3P   3P%
--------------------------------------------------------------------------------
Klay Harden            24   13    0    0   0   4/6    66.7     0/0   0.0
Dirk Young             24    3    0    1   0   1/2    50.0     0/0   0.0
Dejounte McCollum      34    2    3    0   0   1/3    33.3     0/0   0.0
Kristaps Ming          13    2    0    0   0   0/0     0.0     0/0   0.0
Miles Griffin          24    1    6    2   0   0/0     0.0     0/0   0.0
Cole Ball              24    0    2    1   0   0/2     0.0     0/0   0.0
Rudy George            13    0    1    0   0   0/0     0.0     0/0   0.0

TEAM: FG: 6/13 (46.2%), 3PT: 5/9 (55.6%), REB: 11 (2 off, 9 def), AST: 4, TO: 7
TEAM FOULS: 0


Team_002
--------------------------------------------------------------------------------
Player                MIN  PTS  REB  AST  TO      FG   FG%      3P   3P%
--------------------------------------------------------------------------------
Tyler Porzingis        24    8    5    1   0   3/4    75.0     0/0   0.0
Miles Bane             24    4    3    0   0   1/4    25.0     0/0   0.0
Lamelo O'Neal          13    3    0    0   0   1/1   100.0     0/0   0.0
Carmelo Lowry          24    2    4    1   0   1/3    33.3     0/0   0.0
CJ Barrett             24    0    0    0   0   0/1     0.0     0/0   0.0
Jordan Green           24    0    0    0   0   0/1     0.0     0/0   0.0
John Duncan            13    0    0    0   0   0/1     0.0     0/0   0.0
Dirk Middleton         13    0    0    0   0   0/1     0.0     0/0   0.0

TEAM: FG: 6/16 (37.5%), 3PT: 1/6 (16.7%), REB: 13 (6 off, 7 def), AST: 2, TO: 4
TEAM FOULS: 8 [Team_001 in BONUS]

================================================================================

================================================================================
                       4TH QUARTER - Team_001 vs Team_002                       
================================================================================

[12:00] Team_001 possession (Score: 84-56)
Dejounte McCollum attempts a Layup. Contested by Carmelo Lowry (3.8 feet, MAN). DEJOUNTE MCCOLLUM MAKES IT! Assist: Miles Griffin
Score: 86-56

[11:47] Team_002 possession (Score: 86-56)
FOUL! Holding foul on Cole Ball. [Team fouls: 1] No free throws, side out. (Cole Ball: 1 personal fouls)

[11:33] Team_001 possession (Score: 86-56)
Klay Harden drives to the basket... Klay Harden throws a bad pass out of bounds! TURNOVER! (dead ball)

[11:33] Substitution (Team_001): Klay Harden OUT → Ja Dosunmu IN (stamina_rule2)

[11:33] Substitution (Team_002): Carmelo Lowry OUT → Julius Curry IN (stamina_rule2)

[11:20] Team_002 possession (Score: 86-56)
Julius Curry attempts a Layup. Contested by Miles Griffin (4.0 feet, ZONE). JULIUS CURRY MAKES IT! Assist: Tyler Porzingis
Score: 86-58

[11:05] Team_001 possession (Score: 86-58)
Dirk Young attempts a 3Pt. Contested by CJ Barrett (4.1 feet, MAN). Dirk Young misses. Rebound secured by Tyler Porzingis.

[10:51] Team_002 possession (Score: 86-58)
Tyler Porzingis attempts a Midrange. Contested by Miles Griffin (4.0 feet, MAN). Tyler Porzingis misses. Offensive rebound by Miles Bane! Miles Bane kicks it out.

[10:39] Team_002 possession (Score: 86-58)
Miles Bane attempts a 3Pt. Contested by Ja Dosunmu (3.5 feet, MAN). Miles Bane misses. Rebound secured by Cole Ball.

[10:25] Team_001 possession (Score: 86-58)
Dirk Young attempts a 3Pt. Contested by CJ Barrett (4.2 feet, MAN). Dirk Young misses. Rebound secured by CJ Barrett.

[10:10] Team_002 possession (Score: 86-58)
Miles Bane attempts a 3Pt. Contested by Ja Dosunmu (3.5 feet, MAN). Miles Bane misses. Rebound secured by Cole Ball.

[09:57] Team_001 possession (Score: 86-58)
Dejounte McCollum attempts a Midrange. BLOCKED BY JULIUS CURRY! Ball goes out of bounds. Turnover!

[09:57] Substitution (Team_001): Dirk Young OUT → Rudy George IN (stamina_rule2)

[09:57] Substitution (Team_001): Cole Ball OUT → Larry Trent IN (stamina_rule2)

[09:57] Substitution (Team_001): Dejounte McCollum OUT → Franz Bryant IN (stamina_rule2)

[09:57] Substitution (Team_001): Miles Griffin OUT → Kristaps Ming IN (stamina_rule2)

[09:57] Substitution (Team_002): Miles Bane OUT → John Duncan IN (stamina_rule2)

[09:57] Substitution (Team_002): CJ Barrett OUT → Dirk Middleton IN (stamina_rule2)

[09:57] Substitution (Team_002): Jordan Green OUT → Anfernee Sexton IN (stamina_rule2)

[09:57] Substitution (Team_002): Tyler Porzingis OUT → Lamelo O'Neal IN (stamina_rule2)

[09:41] Team_002 possession (Score: 86-58)
John Duncan attempts a Layup. Contested by Franz Bryant (3.8 feet, ZONE). JOHN DUNCAN MAKES IT! Assist: Lamelo O'Neal
Score: 86-60

[09:27] Team_001 possession (Score: 86-60)
Franz Bryant attempts a Midrange. Contested by Lamelo O'Neal (3.0 feet, MAN). Franz Bryant misses. Rebound secured by Anfernee Sexton.

[09:11] Team_002 possession (Score: 86-60)
Dirk Middleton drives to the basket... Dirk Middleton throws a bad pass out of bounds! TURNOVER! (dead ball)

[08:54] Team_001 possession (Score: 86-60)
FOUL! Shooting foul on John Duncan. Ja Dosunmu to the line for 3 free throws. [Team fouls: 2] (John Duncan: 1 personal fouls)   FT 1/3: MISS   FT 2/3: GOOD   FT 3/3: MISS Ja Dosunmu makes 1/3 from the line. Rebound secured by Anfernee Sexton.
Score: 87-60

[08:38] Team_002 possession (Score: 87-60)
Anfernee Sexton makes the 3Pt and draws the foul on Larry Trent! And-1! Anfernee Sexton to the line for 1. [Team fouls: 3] (Larry Trent: 1 personal fouls)   FT 1/1: GOOD Anfernee Sexton makes 1/1 from the line.
Score: 87-64

[08:23] Team_001 possession (Score: 87-64)
Rudy George drives and kicks out. Ja Dosunmu attempts a 3Pt. Contested by Julius Curry (5.4 feet, ZONE). Ja Dosunmu misses. Rebound secured by Julius Curry.

[08:06] Team_002 possession (Score: 87-64)
John Duncan attempts a 3Pt. Contested by Ja Dosunmu (3.5 feet, ZONE). John Duncan misses. Rebound secured by Larry Trent.

[07:54] Team_001 possession (Score: 87-64)
Franz Bryant commits an offensive foul! Lamelo O'Neal drew the charge! TURNOVER! (dead ball)

[07:40] Team_002 possession (Score: 87-64)
Julius Curry attempts a 3Pt. Contested by Franz Bryant (3.8 feet, MAN). JULIUS CURRY MAKES IT! Assist: John Duncan
Score: 87-67

[07:22] Team_001 possession (Score: 87-67)
Rudy George attempts a 3Pt. Contested by Julius Curry (5.4 feet, ZONE). Rudy George misses. Rebound secured by Lamelo O'Neal.

[07:08] Team_002 possession (Score: 87-67)
Anfernee Sexton makes the Layup and draws the foul on Larry Trent! And-1! Anfernee Sexton to the line for 1. [Team fouls: 4] (Larry Trent: 2 personal fouls)   FT 1/1: GOOD Anfernee Sexton makes 1/1 from the line.
Score: 87-70

[06:54] Team_001 possession (Score: 87-70)
Ja Dosunmu attempts a Midrange. Contested by John Duncan (5.5 feet, MAN). JA DOSUNMU MAKES IT! Assist: Rudy George
Score: 89-70

[06:42] Team_002 possession (Score: 89-70)
John Duncan makes the 3Pt and draws the foul on Ja Dosunmu! And-1! John Duncan to the line for 1. [BONUS: 5 team fouls] (Ja Dosunmu: 1 personal fouls)   FT 1/1: GOOD John Duncan makes 1/1 from the line.
Score: 89-74

[06:23] Team_001 possession (Score: 89-74)
Franz Bryant attempts a Layup. Contested by Lamelo O'Neal (3.0 feet, MAN). FRANZ BRYANT MAKES IT! Assist: Ja Dosunmu
Score: 91-74

[06:08] Team_002 possession (Score: 91-74)
Dirk Middleton drives, picks up Franz Bryant. Help arrives from Rudy George! Dirk Middleton attempts a Dunk. Contested by Rudy George (3.8 feet, ZONE). DIRK MIDDLETON MAKES IT!
Score: 91-76

[05:54] Team_001 possession (Score: 91-76)
Ja Dosunmu throws a bad pass! Stolen by John Duncan! TURNOVER! (live ball)

[05:36] Team_002 possession (Score: 91-76)
Dirk Middleton drives, Rudy George stays with him. Dirk Middleton attempts a Layup. Contested by Rudy George (4.7 feet, MAN). DIRK MIDDLETON MAKES IT! Assist: Anfernee Sexton
Score: 91-78

[05:24] Team_001 possession (Score: 91-78)
FOUL! Holding foul on Dirk Middleton. [IN THE BONUS! 6 team fouls] Rudy George to the line for 2 free throws. (Dirk Middleton: 1 personal fouls)   FT 1/2: GOOD   FT 2/2: GOOD Rudy George makes 2/2 from the line.
Score: 93-78

[05:06] Team_002 possession (Score: 93-78)
Lamelo O'Neal makes the Layup and draws the foul on Kristaps Ming! And-1! Lamelo O'Neal to the line for 1. [BONUS: 7 team fouls] (Kristaps Ming: 1 personal fouls)   FT 1/1: GOOD Lamelo O'Neal makes 1/1 from the line.
Score: 93-81

[04:53] Team_001 possession (Score: 93-81)
FOUL! Holding foul on John Duncan. [IN THE BONUS! 8 team fouls] Ja Dosunmu to the line for 2 free throws. (John Duncan: 2 personal fouls)   FT 1/2: MISS   FT 2/2: GOOD Ja Dosunmu makes 1/2 from the line.
Score: 94-81

[04:33] Team_002 possession (Score: 94-81)
John Duncan makes the Midrange and draws the foul on Rudy George! And-1! John Duncan to the line for 1. [BONUS: 9 team fouls] (Rudy George: 1 personal fouls)   FT 1/1: GOOD John Duncan makes 1/1 from the line.
Score: 94-84

[04:19] Team_001 possession (Score: 94-84)
FOUL! Reach-in foul on John Duncan during the drive. [IN THE BONUS! 10 team fouls] Ja Dosunmu to the line for 2 free throws. (John Duncan: 3 personal fouls)   FT 1/2: MISS   FT 2/2: GOOD Ja Dosunmu makes 1/2 from the line.
Score: 95-84

[04:03] Team_002 possession (Score: 95-84)
FOUL! Shooting foul on Larry Trent. Anfernee Sexton to the line for 2 free throws. [BONUS: 11 team fouls] (Larry Trent: 3 personal fouls)   FT 1/2: GOOD   FT 2/2: MISS Anfernee Sexton makes 1/2 from the line. Rebound secured by Larry Trent.
Score: 95-85

[03:48] Team_001 possession (Score: 95-85)
Franz Bryant throws a bad pass out of bounds! TURNOVER! (dead ball)

[03:32] Team_002 possession (Score: 95-85)
FOUL! Holding foul on Ja Dosunmu. [IN THE BONUS! 12 team fouls] John Duncan to the line for 2 free throws. (Ja Dosunmu: 2 personal fouls)   FT 1/2: GOOD   FT 2/2: GOOD John Duncan makes 2/2 from the line.
Score: 95-87

[03:19] Team_001 possession (Score: 95-87)
Ja Dosunmu attempts a Midrange. Contested by Dirk Middleton (6.0 feet, ZONE). Ja Dosunmu misses. Rebound secured by Julius Curry.

[03:02] Team_002 possession (Score: 95-87)
Anfernee Sexton attempts a 3Pt. Contested by Larry Trent (3.9 feet, MAN). ANFERNEE SEXTON MAKES IT! Assist: John Duncan
Score: 95-90

[02:51] Team_001 possession (Score: 95-90)
FOUL! Shooting foul on Lamelo O'Neal. Ja Dosunmu to the line for 2 free throws. [BONUS: 13 team fouls] (Lamelo O'Neal: 1 personal fouls)   FT 1/2: GOOD   FT 2/2: GOOD Ja Dosunmu makes 2/2 from the line.
Score: 97-90

[02:36] Team_002 possession (Score: 97-90)
FOUL! Reach-in foul on Larry Trent during the drive. [IN THE BONUS! 14 team fouls] Anfernee Sexton to the line for 2 free throws. (Larry Trent: 4 personal fouls)   FT 1/2: GOOD   FT 2/2: GOOD Anfernee Sexton makes 2/2 from the line.
Score: 97-92

[02:20] Team_001 possession (Score: 97-92)
Kristaps Ming drives and kicks out. Kristaps Ming attempts a 3Pt. Contested by Lamelo O'Neal (3.3 feet, MAN). Kristaps Ming misses. Rebound secured by Julius Curry.

[02:06] Team_002 possession (Score: 97-92)
Anfernee Sexton drives, Franz Bryant stays with him. Anfernee Sexton attempts a Dunk. Contested by Franz Bryant (3.9 feet, ZONE). Anfernee Sexton misses. Rebound secured by Rudy George.

[01:51] Team_001 possession (Score: 97-92)
Larry Trent attempts a 3Pt. Contested by Anfernee Sexton (4.5 feet, MAN). Larry Trent misses. Rebound secured by Lamelo O'Neal.

[01:40] Team_002 possession (Score: 97-92)
Julius Curry attempts a Midrange. Contested by Franz Bryant (4.0 feet, MAN). Julius Curry misses. Offensive rebound by Anfernee Sexton! Anfernee Sexton kicks it out.

[01:28] Team_002 possession (Score: 97-92)
Lamelo O'Neal attempts a Midrange. Contested by Kristaps Ming (5.8 feet, MAN). Lamelo O'Neal misses. Rebound secured by Rudy George.

[01:11] Team_001 possession (Score: 97-92)
Rudy George attempts a Midrange. Wide open! Dirk Middleton is 6.1 feet away. [MAN] Rudy George misses. Offensive rebound by Rudy George! Rudy George kicks it out.

[00:54] Team_001 possession (Score: 97-92)
FOUL! Holding foul on Anfernee Sexton. [IN THE BONUS! 15 team fouls] Larry Trent to the line for 2 free throws. (Anfernee Sexton: 1 personal fouls)   FT 1/2: GOOD   FT 2/2: GOOD Larry Trent makes 2/2 from the line.
Score: 99-92

[00:41] Team_002 possession (Score: 99-92)
Dirk Middleton attempts a 3Pt. Contested by Rudy George (4.9 feet, MAN). DIRK MIDDLETON MAKES IT! Assist: John Duncan
Score: 99-95

[00:23] Team_001 possession (Score: 99-95)
FOUL! Reach-in foul on Lamelo O'Neal during the drive. [IN THE BONUS! 16 team fouls] Kristaps Ming to the line for 2 free throws. (Lamelo O'Neal: 2 personal fouls)   FT 1/2: GOOD   FT 2/2: GOOD Kristaps Ming makes 2/2 from the line.
Score: 101-95

[00:13] Team_002 possession (Score: 101-95)
Dirk Middleton attempts a Midrange. Contested by Rudy George (5.0 feet, MAN). DIRK MIDDLETON MAKES IT!
Score: 101-97

================================================================================
                              4TH QUARTER COMPLETE                              
================================================================================

4TH QUARTER SCORE: Team_001 17, Team_002 41

BOX SCORE:
================================================================================

Team_001
--------------------------------------------------------------------------------
Player                MIN  PTS  REB  AST  TO      FG   FG%      3P   3P%
--------------------------------------------------------------------------------
Ja Dosunmu             24    6    0    1   0   1/3    33.3     0/0   0.0
Dejounte McCollum      36    2    0    0   0   1/1   100.0     0/0   0.0
Franz Bryant           12    2    0    0   0   1/2    50.0     0/0   0.0
Rudy George            22    2    3    1   0   0/2     0.0     0/0   0.0
Larry Trent            22    2    2    0   0   0/1     0.0     0/0   0.0
Kristaps Ming          22    2    0    0   0   0/1     0.0     0/0   0.0
Miles Griffin          26    0    0    1   0   0/0     0.0     0/0   0.0
Dirk Young             26    0    0    0   0   0/2     0.0     0/0   0.0
Cole Ball              26    0    2    0   0   0/0     0.0     0/0   0.0

TEAM: FG: 3/12 (25.0%), 3PT: 0/5 (0.0%), REB: 7 (1 off, 6 def), AST: 3, TO: 5
TEAM FOULS: 0


Team_002
--------------------------------------------------------------------------------
Player                MIN  PTS  REB  AST  TO      FG   FG%      3P   3P%
--------------------------------------------------------------------------------
Anfernee Sexton        22   12    3    1   0   3/5    60.0     0/0   0.0
John Duncan            22   11    0    3   0   3/4    75.0     0/0   0.0
Dirk Middleton         22    9    0    0   0   4/4   100.0     0/0   0.0
Julius Curry           24    5    3    0   0   2/2   100.0     0/0   0.0
Lamelo O'Neal          22    3    2    1   0   1/2    50.0     0/0   0.0
Tyler Porzingis        26    0    1    1   0   0/0     0.0     0/0   0.0
Miles Bane             26    0    1    0   0   0/2     0.0     0/0   0.0
CJ Barrett             26    0    1    0   0   0/0     0.0     0/0   0.0

TEAM: FG: 13/19 (68.4%), 3PT: 5/8 (62.5%), REB: 11 (2 off, 9 def), AST: 6, TO: 1
TEAM FOULS: 16 [Team_001 in BONUS]

================================================================================

================================================================================
                               FULL GAME COMPLETE                               
================================================================================

FINAL SCORE: Team_001 101, Team_002 97

SCORING BY QUARTER:
--------------------------------------------------------------------------------
Team                     Q1     Q2     Q3     Q4    FINAL
--------------------------------------------------------------------------------
Team_001                 36     26     22     17      101
Team_002                 20     18     18     41       97
--------------------------------------------------------------------------------

FULL GAME BOX SCORE:
================================================================================

Team_001
--------------------------------------------------------------------------------
Player                MIN  PTS  REB  AST  TO      FG   FG%      3P   3P%      FT STL BLK
--------------------------------------------------------------------------------
Dejounte McCollum      36   16    9    0   3   7/10   70.0   1/4    25.0   1/1     2   1
Dirk Young             26    7    1    1   2   1/5    20.0   1/3    33.3   4/4     0   1
Cole Ball              26    3    9    3   2   1/6    16.7   1/4    25.0   0/0     0   0
Miles Griffin          26   10   10    4   2   2/2   100.0   0/0     0.0   5/8     2   1
Klay Harden            25   21    6    0   1   7/12   58.3   4/6    66.7   3/3     0   0
Ja Dosunmu             24   12    0    3   2   3/6    50.0   0/2     0.0   6/8     2   0
Rudy George            22    9    6    4   0   2/7    28.6   0/1     0.0   3/5     0   0
Larry Trent            22    9    5    1   1   3/4    75.0   1/2    50.0   2/2     0   0
Kristaps Ming          22    6    1    0   2   1/3    33.3   0/0     0.0   4/4     0   0
Franz Bryant           12    4    1    0   2   2/3    66.7   0/0     0.0   0/0     0   0

TEAM: FG: 29/58 (50.0%), 3PT: 8/22 (36.4%), REB: 45 (9 off, 36 def), AST: 16, TO: 17


Team_002
--------------------------------------------------------------------------------
Player                MIN  PTS  REB  AST  TO      FG   FG%      3P   3P%      FT STL BLK
--------------------------------------------------------------------------------
Miles Bane             26   11    9    2   1   4/13   30.8   2/9    22.2   2/4     1   0
CJ Barrett             26    0    4    0   1   0/3     0.0   0/2     0.0   0/0     1   0
Jordan Green           26    6    0    1   1   3/6    50.0   3/5    60.0   0/0     0   1
Tyler Porzingis        26   14    8    2   2   3/6    50.0   0/0     0.0   1/5     2   1
Carmelo Lowry          25    2    4    1   2   1/6    16.7   0/1     0.0   0/0     0   1
Julius Curry           24    8    6    0   0   2/4    50.0   1/1   100.0   0/0     1   1
John Duncan            22   25    0    3   2   7/11   63.6   3/7    42.9   8/8     1   0
Dirk Middleton         22    9    0    0   2   4/7    57.1   1/2    50.0   0/0     0   0
Anfernee Sexton        22   14    6    2   0   4/7    57.1   2/3    66.7   4/4     0   0
Lamelo O'Neal          22    6    3    4   1   3/7    42.9   0/0     0.0   2/2     1   1

TEAM: FG: 31/70 (44.3%), 3PT: 12/30 (40.0%), REB: 43 (14 off, 29 def), AST: 15, TO: 12

================================================================================
