================================================================================
                        FULL GAME - Team_027 vs Team_033                        
================================================================================

================================================================================
                       1ST QUARTER - Team_027 vs Team_033                       
================================================================================

[12:00] Team_027 possession (Score: 0-0)
Scottie Harden attempts a Layup. Contested by Cade Randle (3.1 feet, MAN). SCOTTIE HARDEN MAKES IT!
Score: 2-0

[11:45] Team_033 possession (Score: 2-0)
Bradley Simmons drives to the basket... Bradley Simmons loses control! Ball rolls out of bounds! TURNOVER! (dead ball)

[11:29] Team_027 possession (Score: 2-0)
John Russell drives and kicks out. Bradley Dosunmu attempts a 3Pt. Contested by Desmond DeRozan (4.8 feet, MAN). Bradley Dosunmu misses. Rebound secured by Cade Randle.

[11:16] Team_033 possession (Score: 2-0)
Joel Green attempts a 3Pt. Contested by Tim Johnson (5.2 feet, ZONE). JOEL GREEN MAKES IT! Assist: Bradley Simmons
Score: 2-3

[11:04] Team_027 possession (Score: 2-3)
Bradley Dosunmu attempts a Midrange. Contested by Desmond DeRozan (4.9 feet, MAN). BRADLEY DOSUNMU MAKES IT! Assist: Tony Doncic
Score: 4-3

[10:50] Team_033 possession (Score: 4-3)
FOUL! Reach-in foul on John Russell during the drive. [Team fouls: 1] No free throws, side out. (John Russell: 1 personal fouls)

[10:32] Team_033 possession (Score: 4-3)
Cade Randle attempts a 3Pt. Contested by Scottie Harden (5.0 feet, MAN). CADE RANDLE MAKES IT! Assist: Chris Anunoby
Score: 4-6

[10:13] Team_027 possession (Score: 4-6)
FOUL! Holding foul on Joel Green. [Team fouls: 1] No free throws, side out. (Joel Green: 1 personal fouls)

[09:59] Team_027 possession (Score: 4-6)
Bradley Dosunmu attempts a Midrange. Contested by Desmond DeRozan (4.9 feet, ZONE). BRADLEY DOSUNMU MAKES IT!
Score: 6-6

[09:49] Team_033 possession (Score: 6-6)
Desmond DeRozan makes the Layup and draws the foul on John Russell! And-1! Desmond DeRozan to the line for 1. [Team fouls: 2] (John Russell: 2 personal fouls)   FT 1/1: GOOD Desmond DeRozan makes 1/1 from the line.
Score: 6-9

[09:33] Team_027 possession (Score: 6-9)
Bradley Dosunmu throws a bad pass out of bounds! TURNOVER! (dead ball)

[09:15] Team_033 possession (Score: 6-9)
FOUL! Shooting foul on John Russell. Bradley Simmons to the line for 2 free throws. [Team fouls: 3] (John Russell: 3 personal fouls)   FT 1/2: GOOD   FT 2/2: MISS Bradley Simmons makes 1/2 from the line. Offensive rebound by Desmond DeRozan! Desmond DeRozan kicks it out.
Score: 6-10

[09:01] Team_033 possession (Score: 6-10)
Joel Green drives, John Russell stays with him. Joel Green attempts a Dunk. Contested by John Russell (4.2 feet, ZONE). JOEL GREEN MAKES IT! Assist: Cade Randle
Score: 6-12

[08:47] Team_027 possession (Score: 6-12)
Tony Doncic drives and kicks out. Tim Johnson attempts a 3Pt. Contested by Joel Green (4.3 feet, ZONE). TIM JOHNSON MAKES IT! Assist: John Russell
Score: 9-12

[08:37] Team_033 possession (Score: 9-12)
Bradley Simmons makes the Layup and draws the foul on John Russell! And-1! Bradley Simmons to the line for 1. [Team fouls: 4] (John Russell: 4 personal fouls)   FT 1/1: GOOD Bradley Simmons makes 1/1 from the line.
Score: 9-15

[08:21] Team_027 possession (Score: 9-15)
Bradley Dosunmu attempts a 3Pt. Contested by Desmond DeRozan (4.9 feet, MAN). Bradley Dosunmu misses. Rebound secured by Desmond DeRozan.

[08:06] Team_033 possession (Score: 9-15)
Desmond DeRozan makes the Layup and draws the foul on Bradley Dosunmu! And-1! Desmond DeRozan to the line for 1. [BONUS: 5 team fouls] (Bradley Dosunmu: 1 personal fouls)   FT 1/1: GOOD Desmond DeRozan makes 1/1 from the line.
Score: 9-18

[07:57] Team_027 possession (Score: 9-18)
Tony Doncic attempts a 3Pt. Contested by Joel Green (4.4 feet, ZONE). Tony Doncic misses. Rebound secured by Bradley Simmons.

[07:43] Team_033 possession (Score: 9-18)
Desmond DeRozan drives to the basket... Desmond DeRozan throws a bad pass out of bounds! TURNOVER! (dead ball)

[07:27] Team_027 possession (Score: 9-18)
Bradley Dosunmu attempts a Midrange. Contested by Desmond DeRozan (4.9 feet, ZONE). Bradley Dosunmu misses. Offensive rebound by Bradley Dosunmu! Bradley Dosunmu kicks it out.

[07:16] Team_027 possession (Score: 9-18)
Tim Johnson attempts a 3Pt. Contested by Joel Green (4.6 feet, MAN). Tim Johnson misses. Rebound secured by Cade Randle.

[07:01] Team_033 possession (Score: 9-18)
Cade Randle attempts a 3Pt. Contested by Tim Johnson (5.4 feet, ZONE). Cade Randle misses. Rebound secured by John Russell.

[06:51] Team_027 possession (Score: 9-18)
Tony Doncic drives, Bradley Simmons stays with him. Tony Doncic attempts a Dunk. Contested by Bradley Simmons (3.2 feet, ZONE). TONY DONCIC MAKES IT! Assist: Scottie Harden
Score: 11-18

[06:38] Team_033 possession (Score: 11-18)
Chris Anunoby attempts a Layup. Contested by John Russell (3.9 feet, ZONE). Chris Anunoby misses. Rebound secured by Tony Doncic.

[06:24] Team_027 possession (Score: 11-18)
FOUL! Reach-in foul on Bradley Simmons during the drive. [Team fouls: 2] No free throws, side out. (Bradley Simmons: 1 personal fouls)

[06:06] Team_027 possession (Score: 11-18)
Scottie Harden drives and kicks out. John Russell attempts a Midrange. Contested by Bradley Simmons (3.0 feet, MAN). JOHN RUSSELL MAKES IT! Assist: Tony Doncic
Score: 13-18

[05:51] Team_033 possession (Score: 13-18)
Bradley Simmons loses the ball! Stripped by John Russell! TURNOVER! (live ball)

[05:37] Team_027 possession (Score: 13-18)
Tim Johnson attempts a 3Pt. Contested by Joel Green (4.6 feet, MAN). Tim Johnson misses. Rebound secured by Desmond DeRozan.

[05:17] Team_033 possession (Score: 13-18)
Desmond DeRozan attempts a Layup. Contested by Bradley Dosunmu (4.4 feet, MAN). DESMOND DEROZAN MAKES IT!
Score: 13-20

[05:07] Team_027 possession (Score: 13-20)
Tony Doncic throws a bad pass out of bounds! TURNOVER! (dead ball)

[04:50] Team_033 possession (Score: 13-20)
Desmond DeRozan throws a bad pass! Stolen by Bradley Dosunmu! TURNOVER! (live ball)

[04:36] Team_027 possession (Score: 13-20)
John Russell drives to the basket... John Russell loses control! Ball rolls out of bounds! TURNOVER! (dead ball)

[04:25] Team_033 possession (Score: 13-20)
Cade Randle loses control! Ball rolls out of bounds! TURNOVER! (dead ball)

[04:11] Team_027 possession (Score: 13-20)
John Russell drives and kicks out. Scottie Harden attempts a Midrange. Contested by Chris Anunoby (4.0 feet, ZONE). Scottie Harden misses. Rebound secured by Desmond DeRozan.

[03:55] Team_033 possession (Score: 13-20)
Joel Green attempts a 3Pt. Contested by Tim Johnson (5.4 feet, MAN). JOEL GREEN MAKES IT!
Score: 13-23

[03:37] Team_027 possession (Score: 13-23)
John Russell attempts a Midrange. Contested by Bradley Simmons (4.0 feet, MAN). JOHN RUSSELL MAKES IT!
Score: 15-23

[03:22] Team_033 possession (Score: 15-23)
Bradley Simmons attempts a 3Pt. Contested by Tim Johnson (5.0 feet, ZONE). Bradley Simmons misses. Rebound secured by John Russell.

[03:08] Team_027 possession (Score: 15-23)
John Russell attempts a Midrange. Contested by Bradley Simmons (4.0 feet, MAN). JOHN RUSSELL MAKES IT! Assist: Scottie Harden
Score: 17-23

[02:54] Team_033 possession (Score: 17-23)
Joel Green attempts a 3Pt. Contested by Tim Johnson (5.4 feet, ZONE). Joel Green misses. FOUL! Loose ball foul on Bradley Dosunmu during the rebound battle. [IN THE BONUS! 6 team fouls] Bradley Simmons to the line for 2 free throws. (Bradley Dosunmu: 2 personal fouls)   FT 1/2: GOOD   FT 2/2: GOOD Bradley Simmons makes 2/2 from the line.
Score: 17-25

[02:40] Team_027 possession (Score: 17-25)
Scottie Harden attempts a Midrange. Contested by Desmond DeRozan (5.1 feet, ZONE). SCOTTIE HARDEN MAKES IT! Assist: Tony Doncic
Score: 19-25

[02:24] Team_033 possession (Score: 19-25)
Chris Anunoby makes the 3Pt and draws the foul on Tim Johnson! And-1! Chris Anunoby to the line for 1. [BONUS: 7 team fouls] (Tim Johnson: 1 personal fouls)   FT 1/1: GOOD Chris Anunoby makes 1/1 from the line.
Score: 19-29

[02:08] Team_027 possession (Score: 19-29)
Tony Doncic makes the Dunk and draws the foul on Chris Anunoby! And-1! Tony Doncic to the line for 1. [Team fouls: 3] (Chris Anunoby: 1 personal fouls)   FT 1/1: GOOD Tony Doncic makes 1/1 from the line.
Score: 22-29

[01:53] Team_033 possession (Score: 22-29)
Desmond DeRozan attempts a Midrange. Contested by Bradley Dosunmu (4.7 feet, ZONE). DESMOND DEROZAN MAKES IT! Assist: Joel Green
Score: 22-31

[01:42] Team_027 possession (Score: 22-31)
Tim Johnson attempts a 3Pt. Contested by Joel Green (4.9 feet, MAN). Tim Johnson misses. Rebound secured by Desmond DeRozan.

[01:32] Team_033 possession (Score: 22-31)
FOUL! Reach-in foul on John Russell during the drive. [IN THE BONUS! 8 team fouls] Desmond DeRozan to the line for 2 free throws. (John Russell: 5 personal fouls)   FT 1/2: GOOD   FT 2/2: GOOD Desmond DeRozan makes 2/2 from the line.
Score: 22-33

[01:13] Team_027 possession (Score: 22-33)
Tim Johnson attempts a 3Pt. Contested by Joel Green (4.9 feet, ZONE). Tim Johnson misses. Offensive rebound by John Russell! John Russell's putback is no good. Rebound secured by Bradley Simmons.

[00:56] Team_033 possession (Score: 22-33)
Cade Randle attempts a 3Pt. Contested by Tim Johnson (5.8 feet, ZONE). Cade Randle misses. Rebound secured by John Russell.

[00:43] Team_027 possession (Score: 22-33)
Scottie Harden attempts a Layup. Contested by Cade Randle (3.5 feet, MAN). SCOTTIE HARDEN MAKES IT! Assist: Bradley Dosunmu
Score: 24-33

[00:30] Team_033 possession (Score: 24-33)
FOUL! Shooting foul on Bradley Dosunmu. Desmond DeRozan to the line for 2 free throws. [BONUS: 9 team fouls] (Bradley Dosunmu: 3 personal fouls)   FT 1/2: GOOD   FT 2/2: GOOD Desmond DeRozan makes 2/2 from the line.
Score: 24-35

[00:12] Team_027 possession (Score: 24-35)
John Russell drives to the basket... FOUL! Offensive foul on John Russell! Bradley Simmons drew the charge! [Team fouls: 10] (John Russell: 6 personal fouls) TURNOVER! (dead ball)

================================================================================
                              1ST QUARTER COMPLETE                              
================================================================================

1ST QUARTER SCORE: Team_027 24, Team_033 35

BOX SCORE:
================================================================================

Team_027
--------------------------------------------------------------------------------
Player                MIN  PTS  REB  AST  TO      FG   FG%      3P   3P%
--------------------------------------------------------------------------------
Scottie Harden         12    6    0    2   0   3/3   100.0     0/0   0.0
John Russell           12    6    3    1   0   3/5    60.0     0/0   0.0
Bradley Simmons        12    5    2    1   0   2/3    66.7     0/0   0.0
Tony Doncic            12    5    1    3   0   2/3    66.7     0/0   0.0
Bradley Dosunmu        12    4    1    1   0   2/3    66.7     0/0   0.0
Tim Johnson            12    3    0    0   0   1/5    20.0     0/0   0.0

TEAM: FG: 11/19 (57.9%), 3PT: 0/6 (0.0%), REB: 6 (2 off, 4 def), AST: 7, TO: 4
TEAM FOULS: 10 [Team_033 in BONUS]


Team_033
--------------------------------------------------------------------------------
Player                MIN  PTS  REB  AST  TO      FG   FG%      3P   3P%
--------------------------------------------------------------------------------
Desmond DeRozan        12   14    5    0   0   6/6   100.0     0/0   0.0
Joel Green             12    8    0    1   0   3/3   100.0     0/0   0.0
Chris Anunoby          12    4    0    1   0   1/2    50.0     0/0   0.0
Cade Randle            12    3    2    1   0   1/3    33.3     0/0   0.0

TEAM: FG: 13/17 (76.5%), 3PT: 5/8 (62.5%), REB: 8 (1 off, 7 def), AST: 4, TO: 5
TEAM FOULS: 3

================================================================================

================================================================================
                       2ND QUARTER - Team_027 vs Team_033                       
================================================================================

[12:00] Team_027 possession (Score: 24-35)
Bradley Dosunmu drives, picks up Desmond DeRozan. Help arrives from Chris Anunoby! Bradley Dosunmu attempts a Dunk. Contested by Chris Anunoby (5.2 feet, MAN). BRADLEY DOSUNMU MAKES IT!
Score: 26-35

[11:47] Team_033 possession (Score: 26-35)
Joel Green attempts a 3Pt. Contested by Tim Johnson (5.5 feet, MAN). JOEL GREEN MAKES IT!
Score: 26-38

[11:32] Team_027 possession (Score: 26-38)
Bradley Dosunmu attempts a Midrange. Contested by Desmond DeRozan (5.3 feet, MAN). BRADLEY DOSUNMU MAKES IT! Assist: Tim Johnson
Score: 28-38

[11:17] Team_033 possession (Score: 28-38)
Chris Anunoby attempts a Layup. Contested by John Russell (4.3 feet, ZONE). CHRIS ANUNOBY MAKES IT! Assist: Joel Green
Score: 28-40

[10:59] Team_027 possession (Score: 28-40)
Bradley Dosunmu attempts a Layup. BLOCKED BY DESMOND DEROZAN! Ball is loose! Rebound secured by Desmond DeRozan.

[10:46] Team_033 possession (Score: 28-40)
Chris Anunoby attempts a Midrange. Contested by John Russell (4.4 feet, ZONE). Chris Anunoby misses. Rebound secured by Tony Doncic.

[10:32] Team_027 possession (Score: 28-40)
Tony Doncic attempts a Midrange. Contested by Chris Anunoby (4.5 feet, MAN). Tony Doncic misses. Rebound secured by Cade Randle.

[10:18] Team_033 possession (Score: 28-40)
Bradley Simmons drives and kicks out. Bradley Simmons attempts a 3Pt. Contested by John Russell (4.5 feet, MAN). Bradley Simmons misses. Offensive rebound by Cade Randle! Cade Randle puts it back in!
Score: 28-42

[10:08] Team_027 possession (Score: 28-42)
Tim Johnson attempts a Midrange. Contested by Cade Randle (3.7 feet, ZONE). Tim Johnson misses. Rebound secured by Desmond DeRozan.

[09:53] Team_033 possession (Score: 28-42)
Desmond DeRozan attempts a 3Pt. Contested by Bradley Dosunmu (4.9 feet, MAN). Desmond DeRozan misses. Rebound secured by John Russell.

[09:41] Team_027 possession (Score: 28-42)
John Russell drives to the basket... FOUL! Offensive foul on John Russell! Bradley Simmons drew the charge! [Team fouls: 1] (John Russell: 1 personal fouls) TURNOVER! (dead ball)

[09:29] Team_033 possession (Score: 28-42)
Bradley Simmons attempts a 3Pt. Contested by John Russell (4.5 feet, MAN). Bradley Simmons misses. Rebound secured by John Russell.

[09:14] Team_027 possession (Score: 28-42)
FOUL! Offensive foul on John Russell! Bradley Simmons drew the charge! [Team fouls: 2] (John Russell: 2 personal fouls) TURNOVER! (dead ball)

[08:59] Team_033 possession (Score: 28-42)
Chris Anunoby drives, picks up John Russell. Help arrives from Tony Doncic! Chris Anunoby attempts a Layup. Contested by Tony Doncic (4.6 feet, ZONE). Chris Anunoby misses. Rebound secured by Tony Doncic.

[08:43] Team_027 possession (Score: 28-42)
Scottie Harden drives and kicks out. Tim Johnson attempts a Midrange. Contested by Joel Green (5.0 feet, MAN). TIM JOHNSON MAKES IT!
Score: 30-42

[08:27] Team_033 possession (Score: 30-42)
Cade Randle attempts a 3Pt. Contested by Bradley Dosunmu (5.5 feet, ZONE). Cade Randle misses. Rebound secured by Bradley Dosunmu.

[08:12] Team_027 possession (Score: 30-42)
Scottie Harden attempts a 3Pt. Contested by Joel Green (5.0 feet, ZONE). SCOTTIE HARDEN MAKES IT! Assist: Bradley Dosunmu
Score: 33-42

[07:57] Team_033 possession (Score: 33-42)
Cade Randle drives, picks up John Russell. Help arrives from Tony Doncic! Cade Randle attempts a Dunk. Contested by Tony Doncic (5.3 feet, ZONE). CADE RANDLE MAKES IT! Assist: Desmond DeRozan
Score: 33-44

[07:42] Team_027 possession (Score: 33-44)
Tim Johnson throws a bad pass out of bounds! TURNOVER! (dead ball)

[07:42] Substitution (Team_027): Tim Johnson OUT → CJ Green IN (stamina_rule2)

[07:42] Substitution (Team_027): Tony Doncic OUT → Dirk Lillard IN (stamina_rule2)

[07:42] Substitution (Team_027): Scottie Harden OUT → Rudy Quickley IN (stamina_rule2)

[07:42] Substitution (Team_027): Bradley Dosunmu OUT → LeBron Russell IN (stamina_rule2)

[07:42] Substitution (Team_027): John Russell OUT → Ben Stewart IN (stamina_rule2)

[07:42] Substitution (Team_033): Joel Green OUT → Ben Anthony IN (stamina_rule2)

[07:42] Substitution (Team_033): Chris Anunoby OUT → Manu Irving IN (stamina_rule2)

[07:42] Substitution (Team_033): Cade Randle OUT → Terry Jokic IN (stamina_rule2)

[07:42] Substitution (Team_033): Desmond DeRozan OUT → Zion Adebayo IN (stamina_rule2)

[07:42] Substitution (Team_033): Bradley Simmons OUT → Tim Griffin IN (stamina_rule2)

[07:32] Team_033 possession (Score: 33-44)
Tim Griffin drives and kicks out. FOUL! Shooting foul on Dirk Lillard. Terry Jokic to the line for 2 free throws. [Team fouls: 3] (Dirk Lillard: 1 personal fouls)   FT 1/2: GOOD   FT 2/2: GOOD Terry Jokic makes 2/2 from the line.
Score: 33-46

[07:16] Team_027 possession (Score: 33-46)
Ben Stewart drives and kicks out. CJ Green attempts a 3Pt. Contested by Ben Anthony (4.8 feet, ZONE). CJ Green misses. Rebound secured by Terry Jokic.

[06:57] Team_033 possession (Score: 33-46)
Ben Anthony attempts a Midrange. Contested by Rudy Quickley (3.8 feet, ZONE). Ben Anthony misses. Rebound secured by Dirk Lillard.

[06:44] Team_027 possession (Score: 33-46)
FOUL! Shooting foul on Manu Irving. Dirk Lillard to the line for 2 free throws. [Team fouls: 1] (Manu Irving: 1 personal fouls)   FT 1/2: GOOD   FT 2/2: GOOD Dirk Lillard makes 2/2 from the line.
Score: 35-46

[06:29] Team_033 possession (Score: 35-46)
Tim Griffin attempts a Layup. BLOCKED BY BEN STEWART! Ball is loose! Rebound secured by Ben Stewart.

[06:12] Team_027 possession (Score: 35-46)
Dirk Lillard attempts a Midrange. BLOCKED BY MANU IRVING! Ball deflects out of bounds off Dirk Lillard.

[05:59] Team_033 possession (Score: 35-46)
Tim Griffin attempts a Midrange. Contested by Dirk Lillard (4.3 feet, ZONE). Tim Griffin misses. Rebound secured by Ben Stewart.

[05:43] Team_027 possession (Score: 35-46)
Rudy Quickley attempts a 3Pt. Contested by Manu Irving (5.1 feet, ZONE). Rudy Quickley misses. Rebound secured by Tim Griffin.

[05:31] Team_033 possession (Score: 35-46)
Terry Jokic attempts a 3Pt. BLOCKED BY RUDY QUICKLEY! Ball deflects out of bounds off Terry Jokic.

[05:17] Team_027 possession (Score: 35-46)
CJ Green attempts a Layup. BLOCKED BY BEN ANTHONY! Ball deflects out of bounds off CJ Green.

[05:05] Team_033 possession (Score: 35-46)
Zion Adebayo attempts a Midrange. Contested by LeBron Russell (5.6 feet, MAN). Zion Adebayo misses. Rebound secured by Dirk Lillard.

[04:55] Team_027 possession (Score: 35-46)
Ben Stewart attempts a Dunk. BLOCKED BY MANU IRVING! Ball is loose! Rebound secured by Tim Griffin.

[04:42] Team_033 possession (Score: 35-46)
Manu Irving attempts a Midrange. Contested by Dirk Lillard (4.3 feet, MAN). Manu Irving misses. Rebound secured by Ben Stewart.

[04:23] Team_027 possession (Score: 35-46)
CJ Green drives to the basket... CJ Green throws a bad pass! Stolen by Tim Griffin! TURNOVER! (live ball)

[04:12] Team_033 possession (Score: 35-46)
Zion Adebayo attempts a 3Pt. Contested by LeBron Russell (5.6 feet, MAN). Zion Adebayo misses. Rebound secured by Ben Stewart.

[04:01] Team_027 possession (Score: 35-46)
Ben Stewart drives, picks up Tim Griffin. Help arrives from Manu Irving! Ben Stewart attempts a Dunk. Contested by Manu Irving (4.8 feet, ZONE). BEN STEWART MAKES IT!
Score: 37-46

[03:46] Team_033 possession (Score: 37-46)
Tim Griffin attempts a Layup. Contested by Ben Stewart (4.8 feet, MAN). TIM GRIFFIN MAKES IT! Assist: Zion Adebayo
Score: 37-48

[03:30] Team_027 possession (Score: 37-48)
Rudy Quickley attempts a Layup. Contested by Terry Jokic (4.3 feet, MAN). RUDY QUICKLEY MAKES IT!
Score: 39-48

[03:20] Team_033 possession (Score: 39-48)
Tim Griffin makes the Dunk and draws the foul on Ben Stewart! And-1! Tim Griffin to the line for 1. [Team fouls: 4] (Ben Stewart: 1 personal fouls)   FT 1/1: GOOD Tim Griffin makes 1/1 from the line.
Score: 39-51

[03:06] Team_027 possession (Score: 39-51)
LeBron Russell drives to the basket... LeBron Russell throws a bad pass out of bounds! TURNOVER! (dead ball)

[02:49] Team_033 possession (Score: 39-51)
Tim Griffin drives, picks up Ben Stewart. Help arrives from Dirk Lillard! Tim Griffin attempts a Layup. Contested by Dirk Lillard (4.8 feet, ZONE). Tim Griffin misses. Rebound secured by Ben Stewart.

[02:37] Team_027 possession (Score: 39-51)
LeBron Russell attempts a Midrange. Contested by Terry Jokic (3.8 feet, ZONE). LEBRON RUSSELL MAKES IT! Assist: Ben Stewart
Score: 41-51

[02:23] Team_033 possession (Score: 41-51)
Ben Anthony drives and kicks out. Ben Anthony attempts a Midrange. Contested by LeBron Russell (5.5 feet, ZONE). BEN ANTHONY MAKES IT!
Score: 41-53

[02:10] Team_027 possession (Score: 41-53)
CJ Green attempts a Midrange. Contested by Terry Jokic (4.0 feet, ZONE). CJ Green misses. Rebound secured by Zion Adebayo.

[01:55] Team_033 possession (Score: 41-53)
Manu Irving attempts a 3Pt. Contested by Dirk Lillard (4.3 feet, MAN). MANU IRVING MAKES IT! Assist: Tim Griffin
Score: 41-56

[01:39] Team_027 possession (Score: 41-56)
CJ Green attempts a Layup. Contested by Tim Griffin (5.0 feet, ZONE). CJ GREEN MAKES IT! Assist: LeBron Russell
Score: 43-56

[01:26] Team_033 possession (Score: 43-56)
Manu Irving attempts a 3Pt. Contested by Rudy Quickley (3.4 feet, ZONE). Manu Irving misses. Rebound secured by Dirk Lillard.

[01:13] Team_027 possession (Score: 43-56)
Dirk Lillard attempts a Midrange. Contested by Zion Adebayo (4.6 feet, ZONE). Dirk Lillard misses. Rebound secured by Terry Jokic.

[01:00] Team_033 possession (Score: 43-56)
FOUL! Reach-in foul on Ben Stewart during the drive. [IN THE BONUS! 5 team fouls] Ben Anthony to the line for 2 free throws. (Ben Stewart: 2 personal fouls)   FT 1/2: GOOD   FT 2/2: MISS Ben Anthony makes 1/2 from the line. Rebound secured by Dirk Lillard.
Score: 43-57

[00:41] Team_027 possession (Score: 43-57)
Dirk Lillard drives and kicks out. Rudy Quickley attempts a Midrange. Contested by Terry Jokic (3.9 feet, MAN). RUDY QUICKLEY MAKES IT! Assist: CJ Green
Score: 45-57

[00:32] Team_033 possession (Score: 45-57)
FOUL! Holding foul on Ben Stewart. [IN THE BONUS! 6 team fouls] Tim Griffin to the line for 2 free throws. (Ben Stewart: 3 personal fouls)   FT 1/2: GOOD   FT 2/2: GOOD Tim Griffin makes 2/2 from the line.
Score: 45-59

[00:17] Team_027 possession (Score: 45-59)
Dirk Lillard attempts a 3Pt. Contested by Manu Irving (4.8 feet, MAN). Dirk Lillard misses. Rebound secured by Terry Jokic.

[00:02] Team_033 possession (Score: 45-59)
Manu Irving drives to the basket... Manu Irving throws a bad pass out of bounds! TURNOVER! (dead ball)

================================================================================
                              2ND QUARTER COMPLETE                              
================================================================================

2ND QUARTER SCORE: Team_027 21, Team_033 24

BOX SCORE:
================================================================================

Team_027
--------------------------------------------------------------------------------
Player                MIN  PTS  REB  AST  TO      FG   FG%      3P   3P%
--------------------------------------------------------------------------------
Bradley Dosunmu        17    4    1    1   0   2/3    66.7     0/0   0.0
Rudy Quickley           8    4    0    0   0   2/3    66.7     0/0   0.0
Scottie Harden         17    3    0    0   0   1/1   100.0     0/0   0.0
Tim Johnson            17    2    0    1   0   1/2    50.0     0/0   0.0
Ben Stewart             8    2    5    1   0   1/3    33.3     0/0   0.0
Dirk Lillard            8    2    4    0   0   1/4    25.0     0/0   0.0
CJ Green                8    2    0    1   0   1/3    33.3     0/0   0.0
LeBron Russell          8    2    0    1   0   1/1   100.0     0/0   0.0
Tony Doncic            17    0    2    0   0   0/1     0.0     0/0   0.0
John Russell           17    0    2    0   0   0/0     0.0     0/0   0.0

TEAM: FG: 10/21 (47.6%), 3PT: 1/3 (33.3%), REB: 14 (0 off, 14 def), AST: 5, TO: 5
TEAM FOULS: 6 [Team_033 in BONUS]


Team_033
--------------------------------------------------------------------------------
Player                MIN  PTS  REB  AST  TO      FG   FG%      3P   3P%
--------------------------------------------------------------------------------
Tim Griffin             8    7    2    1   0   3/6    50.0     0/0   0.0
Cade Randle            17    4    2    0   0   2/3    66.7     0/0   0.0
Joel Green             17    3    0    1   0   1/1   100.0     0/0   0.0
Manu Irving             8    3    0    0   0   1/3    33.3     0/0   0.0
Chris Anunoby          17    2    0    0   0   1/3    33.3     0/0   0.0
Terry Jokic             8    2    3    0   0   1/2    50.0     0/0   0.0
Ben Anthony             8    2    0    0   0   1/3    33.3     0/0   0.0
Desmond DeRozan        17    0    2    1   0   0/1     0.0     0/0   0.0
Bradley Simmons        17    0    0    0   0   0/1     0.0     0/0   0.0
Zion Adebayo            8    0    1    1   0   0/2     0.0     0/0   0.0

TEAM: FG: 10/25 (40.0%), 3PT: 2/8 (25.0%), REB: 10 (1 off, 9 def), AST: 4, TO: 1
TEAM FOULS: 1

================================================================================

================================================================================
                       3RD QUARTER - Team_027 vs Team_033                       
================================================================================

[12:00] Team_027 possession (Score: 45-59)
John Russell attempts a Midrange. Contested by Bradley Simmons (3.8 feet, MAN). John Russell misses. Rebound secured by Cade Randle.

[11:45] Team_033 possession (Score: 45-59)
Desmond DeRozan attempts a Midrange. Contested by Bradley Dosunmu (4.4 feet, MAN). Desmond DeRozan misses. Rebound secured by John Russell.

[11:35] Team_027 possession (Score: 45-59)
FOUL! Reach-in foul on Chris Anunoby during the drive. [Team fouls: 1] No free throws, side out. (Chris Anunoby: 1 personal fouls)

[11:21] Team_027 possession (Score: 45-59)
John Russell drives and kicks out. Tim Johnson attempts a Midrange. Contested by Chris Anunoby (3.8 feet, ZONE). Tim Johnson misses. Rebound secured by Desmond DeRozan.

[11:03] Team_033 possession (Score: 45-59)
Cade Randle attempts a 3Pt. Contested by Scottie Harden (5.0 feet, MAN). Cade Randle misses. Rebound secured by John Russell.

[10:48] Team_027 possession (Score: 45-59)
Tony Doncic attempts a 3Pt. Contested by Joel Green (4.4 feet, ZONE). Tony Doncic misses. Rebound secured by Bradley Simmons.

[10:38] Team_033 possession (Score: 45-59)
Bradley Simmons attempts a Midrange. Contested by John Russell (3.8 feet, MAN). BRADLEY SIMMONS MAKES IT! Assist: Chris Anunoby
Score: 45-61

[10:28] Team_027 possession (Score: 45-61)
FOUL! Holding foul on Chris Anunoby. [Team fouls: 2] No free throws, side out. (Chris Anunoby: 2 personal fouls)

[10:13] Team_027 possession (Score: 45-61)
Tim Johnson attempts a 3Pt. Contested by Joel Green (4.6 feet, ZONE). TIM JOHNSON MAKES IT! Assist: John Russell
Score: 48-61

[10:00] Team_033 possession (Score: 48-61)
Cade Randle throws a bad pass! Stolen by Scottie Harden! TURNOVER! (live ball)

[09:47] Team_027 possession (Score: 48-61)
John Russell makes the Layup and draws the foul on Bradley Simmons! And-1! John Russell to the line for 1. [Team fouls: 3] (Bradley Simmons: 1 personal fouls)   FT 1/1: GOOD John Russell makes 1/1 from the line.
Score: 51-61

[09:33] Team_033 possession (Score: 51-61)
Joel Green attempts a Midrange. Contested by Bradley Dosunmu (4.7 feet, ZONE). Joel Green misses. FOUL! Loose ball foul on John Russell during the rebound battle. [Team fouls: 1] No free throws, side out. (John Russell: 1 personal fouls)

[09:17] Team_033 possession (Score: 51-61)
Joel Green attempts a 3Pt. Contested by Tim Johnson (5.2 feet, MAN). Joel Green misses. Offensive rebound by Bradley Simmons! Bradley Simmons's putback is no good. Offensive rebound by Desmond DeRozan! Desmond DeRozan kicks it out.

[09:00] Team_033 possession (Score: 51-61)
Desmond DeRozan drives, John Russell stays with him. Desmond DeRozan attempts a Dunk. Contested by John Russell (3.9 feet, ZONE). Desmond DeRozan misses. Rebound secured by Bradley Dosunmu.

[08:41] Team_027 possession (Score: 51-61)
Scottie Harden drives, Cade Randle stays with him. Scottie Harden attempts a Dunk. Contested by Cade Randle (3.1 feet, MAN). SCOTTIE HARDEN MAKES IT! Assist: Tony Doncic
Score: 53-61

[08:29] Team_033 possession (Score: 53-61)
Desmond DeRozan attempts a Midrange. Contested by Scottie Harden (4.5 feet, ZONE). DESMOND DEROZAN MAKES IT! Assist: Joel Green
Score: 53-63

[08:14] Team_027 possession (Score: 53-63)
Tony Doncic attempts a 3Pt. Contested by Joel Green (4.4 feet, ZONE). Tony Doncic misses. Rebound secured by Bradley Simmons.

[08:01] Team_033 possession (Score: 53-63)
Chris Anunoby attempts a 3Pt. Contested by Tim Johnson (4.8 feet, ZONE). Chris Anunoby misses. Rebound secured by John Russell.

[07:45] Team_027 possession (Score: 53-63)
Tony Doncic attempts a Layup. BLOCKED BY CHRIS ANUNOBY! Ball is loose! Rebound secured by Desmond DeRozan.

[07:29] Team_033 possession (Score: 53-63)
Desmond DeRozan loses the ball! Stripped by Bradley Dosunmu! TURNOVER! (live ball)

[07:13] Team_027 possession (Score: 53-63)
Tony Doncic drives and kicks out. Scottie Harden attempts a 3Pt. Contested by Cade Randle (3.0 feet, MAN). SCOTTIE HARDEN MAKES IT! Assist: John Russell
Score: 56-63

[06:57] Team_033 possession (Score: 56-63)
FOUL! Reach-in foul on John Russell during the drive. [Team fouls: 2] No free throws, side out. (John Russell: 2 personal fouls)

[06:41] Team_033 possession (Score: 56-63)
Bradley Simmons attempts a Midrange. Contested by Tony Doncic (3.8 feet, ZONE). Bradley Simmons misses. Offensive rebound by Bradley Simmons! Bradley Simmons puts it back in!
Score: 56-65

[06:25] Team_027 possession (Score: 56-65)
Bradley Dosunmu throws a bad pass out of bounds! TURNOVER! (dead ball)

[06:13] Team_033 possession (Score: 56-65)
Joel Green attempts a Midrange. Contested by Tim Johnson (5.2 feet, MAN). JOEL GREEN MAKES IT! Assist: Desmond DeRozan
Score: 56-67

[05:58] Team_027 possession (Score: 56-67)
FOUL! Reach-in foul on Bradley Simmons during the drive. [Team fouls: 4] No free throws, side out. (Bradley Simmons: 2 personal fouls)

[05:43] Team_027 possession (Score: 56-67)
Scottie Harden throws a bad pass! Stolen by Cade Randle! TURNOVER! (live ball)

[05:30] Team_033 possession (Score: 56-67)
Joel Green attempts a 3Pt. Contested by Tim Johnson (5.2 feet, MAN). Joel Green misses. Rebound secured by John Russell.

[05:13] Team_027 possession (Score: 56-67)
Scottie Harden attempts a 3Pt. Contested by Joel Green (4.4 feet, ZONE). Scottie Harden misses. Rebound secured by Bradley Simmons.

[04:55] Team_033 possession (Score: 56-67)
Cade Randle attempts a 3Pt. Contested by Scottie Harden (5.1 feet, MAN). Cade Randle misses. Rebound secured by John Russell.

[04:39] Team_027 possession (Score: 56-67)
Scottie Harden drives and kicks out. Bradley Dosunmu attempts a 3Pt. Contested by Cade Randle (3.0 feet, ZONE). BRADLEY DOSUNMU MAKES IT! Assist: Tony Doncic
Score: 59-67

[04:26] Team_033 possession (Score: 59-67)
Chris Anunoby attempts a Midrange. Contested by Tony Doncic (3.9 feet, MAN). Chris Anunoby misses. Rebound secured by John Russell.

[04:10] Team_027 possession (Score: 59-67)
FOUL! Holding foul on Bradley Simmons. [IN THE BONUS! 5 team fouls] John Russell to the line for 2 free throws. (Bradley Simmons: 3 personal fouls)   FT 1/2: GOOD   FT 2/2: GOOD John Russell makes 2/2 from the line.
Score: 61-67

[03:53] Team_033 possession (Score: 61-67)
Cade Randle attempts a 3Pt. Contested by Tim Johnson (5.5 feet, ZONE). Cade Randle misses. Rebound secured by John Russell.

[03:41] Team_027 possession (Score: 61-67)
Bradley Dosunmu attempts a Layup. Contested by Bradley Simmons (3.3 feet, ZONE). BRADLEY DOSUNMU MAKES IT!
Score: 63-67

[03:30] Team_033 possession (Score: 63-67)
FOUL! Shooting foul on Scottie Harden. Cade Randle to the line for 3 free throws. [Team fouls: 3] (Scottie Harden: 1 personal fouls)   FT 1/3: MISS   FT 2/3: GOOD   FT 3/3: MISS Cade Randle makes 1/3 from the line. Rebound secured by Bradley Dosunmu.
Score: 63-68

[03:17] Team_027 possession (Score: 63-68)
Tim Johnson attempts a 3Pt. Contested by Joel Green (4.7 feet, MAN). TIM JOHNSON MAKES IT! Assist: Scottie Harden
Score: 66-68

[03:02] Team_033 possession (Score: 66-68)
Bradley Simmons loses the ball! Stripped by John Russell! TURNOVER! (live ball)

[02:47] Team_027 possession (Score: 66-68)
John Russell attempts a Midrange. Contested by Bradley Simmons (4.1 feet, MAN). John Russell misses. Rebound secured by Bradley Simmons.

[02:30] Team_033 possession (Score: 66-68)
FOUL! Holding foul on Tim Johnson. [Team fouls: 4] No free throws, side out. (Tim Johnson: 1 personal fouls)

[02:16] Team_033 possession (Score: 66-68)
Bradley Simmons drives, picks up John Russell. Help arrives from Tony Doncic! Bradley Simmons attempts a Layup. Contested by Tony Doncic (4.1 feet, MAN). BRADLEY SIMMONS MAKES IT! Assist: Joel Green
Score: 66-70

[01:59] Team_027 possession (Score: 66-70)
Tim Johnson attempts a 3Pt. Contested by Joel Green (4.8 feet, MAN). Tim Johnson misses. Rebound secured by Desmond DeRozan.

[01:45] Team_033 possession (Score: 66-70)
FOUL! Reach-in foul on John Russell during the drive. [IN THE BONUS! 5 team fouls] Bradley Simmons to the line for 2 free throws. (John Russell: 3 personal fouls)   FT 1/2: GOOD   FT 2/2: GOOD Bradley Simmons makes 2/2 from the line.
Score: 66-72

[01:31] Team_027 possession (Score: 66-72)
Scottie Harden makes the Layup and draws the foul on Bradley Simmons! And-1! Scottie Harden to the line for 1. [BONUS: 6 team fouls] (Bradley Simmons: 4 personal fouls)   FT 1/1: GOOD Scottie Harden makes 1/1 from the line.
Score: 69-72

[01:19] Team_033 possession (Score: 69-72)
Bradley Simmons attempts a Midrange. Contested by Bradley Dosunmu (4.6 feet, ZONE). BRADLEY SIMMONS MAKES IT!
Score: 69-74

[01:09] Team_027 possession (Score: 69-74)
Scottie Harden attempts a 3Pt. Contested by Cade Randle (3.4 feet, MAN). SCOTTIE HARDEN MAKES IT! Assist: Tim Johnson
Score: 72-74

[01:00] Team_033 possession (Score: 72-74)
Joel Green drives, picks up Bradley Dosunmu. Help arrives from Tony Doncic! Joel Green attempts a Layup. Contested by Tony Doncic (5.1 feet, ZONE). JOEL GREEN MAKES IT! Assist: Desmond DeRozan
Score: 72-76

[00:46] Team_027 possession (Score: 72-76)
Tony Doncic drives, Bradley Simmons stays with him. Tony Doncic attempts a Dunk. Contested by Bradley Simmons (3.7 feet, ZONE). TONY DONCIC MAKES IT! Assist: John Russell
Score: 74-76

[00:34] Team_033 possession (Score: 74-76)
Chris Anunoby attempts a Midrange. Contested by Bradley Dosunmu (4.8 feet, ZONE). CHRIS ANUNOBY MAKES IT!
Score: 74-78

[00:19] Team_027 possession (Score: 74-78)
Scottie Harden attempts a 3Pt. Contested by Cade Randle (3.5 feet, MAN). Scottie Harden misses. Rebound secured by Bradley Simmons.

[00:03] Team_033 possession (Score: 74-78)
Bradley Simmons drives to the basket... Bradley Simmons throws a bad pass out of bounds! TURNOVER! (dead ball)

[00:03] Substitution (Team_027): Tim Johnson OUT → CJ Green IN (stamina_rule2)

[00:03] Substitution (Team_027): Tony Doncic OUT → Dirk Lillard IN (stamina_rule2)

[00:03] Substitution (Team_027): Scottie Harden OUT → Rudy Quickley IN (stamina_rule2)

[00:03] Substitution (Team_027): Bradley Dosunmu OUT → LeBron Russell IN (stamina_rule2)

[00:03] Substitution (Team_027): John Russell OUT → Ben Stewart IN (stamina_rule2)

[00:03] Substitution (Team_033): Joel Green OUT → Ben Anthony IN (stamina_rule2)

[00:03] Substitution (Team_033): Chris Anunoby OUT → Manu Irving IN (stamina_rule2)

[00:03] Substitution (Team_033): Cade Randle OUT → Terry Jokic IN (stamina_rule2)

[00:03] Substitution (Team_033): Desmond DeRozan OUT → Zion Adebayo IN (stamina_rule2)

[00:03] Substitution (Team_033): Bradley Simmons OUT → Tim Griffin IN (stamina_rule2)

================================================================================
                              3RD QUARTER COMPLETE                              
================================================================================

3RD QUARTER SCORE: Team_027 29, Team_033 19

BOX SCORE:
================================================================================

Team_027
--------------------------------------------------------------------------------
Player                MIN  PTS  REB  AST  TO      FG   FG%      3P   3P%
--------------------------------------------------------------------------------
Scottie Harden         29   11    0    1   0   4/6    66.7     0/0   0.0
Tim Johnson            29    6    0    1   0   2/3    66.7     0/0   0.0
John Russell           29    5    7    3   0   2/5    40.0     0/0   0.0
Bradley Dosunmu        29    5    2    0   0   2/2   100.0     0/0   0.0
Tony Doncic            29    2    0    2   0   1/4    25.0     0/0   0.0

TEAM: FG: 11/20 (55.0%), 3PT: 3/8 (37.5%), REB: 9 (0 off, 9 def), AST: 7, TO: 2
TEAM FOULS: 5 [Team_033 in BONUS]


Team_033
--------------------------------------------------------------------------------
Player                MIN  PTS  REB  AST  TO      FG   FG%      3P   3P%
--------------------------------------------------------------------------------
Bradley Simmons        29   10    6    0   0   5/5   100.0     0/0   0.0
Joel Green             29    4    0    2   0   2/3    66.7     0/0   0.0
Desmond DeRozan        29    2    5    2   0   1/3    33.3     0/0   0.0
Chris Anunoby          29    2    0    1   0   1/3    33.3     0/0   0.0
Cade Randle            29    0    1    0   0   0/4     0.0     0/0   0.0

TEAM: FG: 9/18 (50.0%), 3PT: 0/6 (0.0%), REB: 12 (3 off, 9 def), AST: 5, TO: 4
TEAM FOULS: 6 [Team_027 in BONUS]

================================================================================

================================================================================
                       4TH QUARTER - Team_027 vs Team_033                       
================================================================================

[12:00] Team_027 possession (Score: 74-78)
John Russell attempts a 3Pt. Contested by Joel Green (5.3 feet, ZONE). John Russell misses. Rebound secured by Bradley Simmons.

[11:43] Team_033 possession (Score: 74-78)
Chris Anunoby attempts a 3Pt. Contested by Tim Johnson (5.2 feet, ZONE). Chris Anunoby misses. Offensive rebound by Cade Randle! Cade Randle puts it back in!
Score: 74-80

[11:23] Team_027 possession (Score: 74-80)
John Russell attempts a Layup. Contested by Bradley Simmons (4.2 feet, ZONE). JOHN RUSSELL MAKES IT! Assist: Tim Johnson
Score: 76-80

[11:09] Team_033 possession (Score: 76-80)
Cade Randle drives to the basket... Cade Randle throws a bad pass out of bounds! TURNOVER! (dead ball)

[11:09] Substitution (Team_027): Tim Johnson OUT → CJ Green IN (stamina_rule2)

[11:09] Substitution (Team_027): Tony Doncic OUT → Dirk Lillard IN (stamina_rule2)

[11:09] Substitution (Team_027): Scottie Harden OUT → Rudy Quickley IN (stamina_rule2)

[11:09] Substitution (Team_027): Bradley Dosunmu OUT → LeBron Russell IN (stamina_rule2)

[11:09] Substitution (Team_027): John Russell OUT → Ben Stewart IN (stamina_rule2)

[11:09] Substitution (Team_033): Joel Green OUT → Ben Anthony IN (stamina_rule2)

[11:09] Substitution (Team_033): Chris Anunoby OUT → Manu Irving IN (stamina_rule2)

[11:09] Substitution (Team_033): Cade Randle OUT → Terry Jokic IN (stamina_rule2)

[11:09] Substitution (Team_033): Desmond DeRozan OUT → Zion Adebayo IN (stamina_rule2)

[11:09] Substitution (Team_033): Bradley Simmons OUT → Tim Griffin IN (stamina_rule2)

[10:55] Team_027 possession (Score: 76-80)
Rudy Quickley attempts a 3Pt. Contested by Ben Anthony (5.2 feet, ZONE). Rudy Quickley misses. Rebound secured by Terry Jokic.

[10:42] Team_033 possession (Score: 76-80)
FOUL! Holding foul on Ben Stewart. [Team fouls: 1] No free throws, side out. (Ben Stewart: 1 personal fouls)

[10:26] Team_033 possession (Score: 76-80)
Ben Anthony drives and kicks out. Tim Griffin attempts a 3Pt. Contested by LeBron Russell (5.5 feet, ZONE). Tim Griffin misses. Offensive rebound by Tim Griffin! Tim Griffin puts it back in!
Score: 76-82

[10:14] Team_027 possession (Score: 76-82)
LeBron Russell attempts a Layup. BLOCKED BY TIM GRIFFIN! Ball deflects out of bounds off LeBron Russell.

[09:55] Team_033 possession (Score: 76-82)
Tim Griffin drives, Ben Stewart stays with him. Tim Griffin attempts a Dunk. Contested by Ben Stewart (4.8 feet, ZONE). Tim Griffin misses. Rebound secured by Dirk Lillard.

[09:42] Team_027 possession (Score: 76-82)
CJ Green attempts a Layup. Contested by Ben Anthony (4.9 feet, MAN). CJ GREEN MAKES IT!
Score: 78-82

[09:28] Team_033 possession (Score: 78-82)
FOUL! Holding foul on Ben Stewart. [Team fouls: 2] No free throws, side out. (Ben Stewart: 2 personal fouls)

[09:18] Team_033 possession (Score: 78-82)
Zion Adebayo attempts a Layup. Contested by Ben Stewart (4.8 feet, ZONE). ZION ADEBAYO MAKES IT!
Score: 78-84

[09:02] Team_027 possession (Score: 78-84)
Ben Stewart attempts a 3Pt. Contested by Ben Anthony (4.7 feet, ZONE). Ben Stewart misses. Rebound secured by Terry Jokic.

[08:46] Team_033 possession (Score: 78-84)
Tim Griffin attempts a Midrange. Contested by Ben Stewart (4.8 feet, MAN). Tim Griffin misses. Rebound secured by Dirk Lillard.

[08:33] Team_027 possession (Score: 78-84)
CJ Green loses control! Ball rolls out of bounds! TURNOVER! (dead ball)

[08:19] Team_033 possession (Score: 78-84)
FOUL! Reach-in foul on Dirk Lillard during the drive. [Team fouls: 3] No free throws, side out. (Dirk Lillard: 1 personal fouls)

[08:05] Team_033 possession (Score: 78-84)
Ben Anthony makes the Layup and draws the foul on Ben Stewart! And-1! Ben Anthony to the line for 1. [Team fouls: 4] (Ben Stewart: 3 personal fouls)   FT 1/1: GOOD Ben Anthony makes 1/1 from the line.
Score: 78-87

[07:49] Team_027 possession (Score: 78-87)
CJ Green drives, Ben Anthony stays with him. CJ Green attempts a Layup. Contested by Ben Anthony (4.9 feet, MAN). CJ Green misses. Rebound secured by Terry Jokic.

[07:31] Team_033 possession (Score: 78-87)
FOUL! Reach-in foul on Ben Stewart during the drive. [IN THE BONUS! 5 team fouls] Tim Griffin to the line for 2 free throws. (Ben Stewart: 4 personal fouls)   FT 1/2: GOOD   FT 2/2: GOOD Tim Griffin makes 2/2 from the line.
Score: 78-89

[07:21] Team_027 possession (Score: 78-89)
LeBron Russell attempts a 3Pt. Contested by Ben Anthony (4.8 feet, ZONE). LEBRON RUSSELL MAKES IT! Assist: Dirk Lillard
Score: 81-89

[07:07] Team_033 possession (Score: 81-89)
Zion Adebayo attempts a Layup. Contested by LeBron Russell (5.6 feet, MAN). Zion Adebayo misses. Rebound secured by LeBron Russell.

[06:47] Team_027 possession (Score: 81-89)
Dirk Lillard drives, Tim Griffin stays with him. Dirk Lillard attempts a Dunk. Contested by Tim Griffin (4.9 feet, ZONE). DIRK LILLARD MAKES IT! Assist: Rudy Quickley
Score: 83-89

[06:31] Team_033 possession (Score: 83-89)
Terry Jokic drives, Rudy Quickley stays with him. Terry Jokic attempts a Layup. Contested by Rudy Quickley (3.8 feet, MAN). Terry Jokic misses. FOUL! Loose ball foul on LeBron Russell during the rebound battle. [IN THE BONUS! 6 team fouls] Tim Griffin to the line for 2 free throws. (LeBron Russell: 1 personal fouls)   FT 1/2: GOOD   FT 2/2: GOOD Tim Griffin makes 2/2 from the line.
Score: 83-91

[06:12] Team_027 possession (Score: 83-91)
Ben Stewart loses control! Ball rolls out of bounds! TURNOVER! (dead ball)

[05:56] Team_033 possession (Score: 83-91)
Ben Anthony attempts a Midrange. Contested by Rudy Quickley (3.8 feet, ZONE). Ben Anthony misses. FOUL! Loose ball foul on LeBron Russell during the rebound battle. [IN THE BONUS! 7 team fouls] Terry Jokic to the line for 2 free throws. (LeBron Russell: 2 personal fouls)   FT 1/2: GOOD   FT 2/2: GOOD Terry Jokic makes 2/2 from the line.
Score: 83-93

[05:38] Team_027 possession (Score: 83-93)
FOUL! Shooting foul on Zion Adebayo. LeBron Russell to the line for 2 free throws. [Team fouls: 1] (Zion Adebayo: 1 personal fouls)   FT 1/2: MISS   FT 2/2: MISS LeBron Russell makes 0/2 from the line. Rebound secured by Terry Jokic.

[05:27] Team_033 possession (Score: 83-93)
Zion Adebayo drives, picks up LeBron Russell. Help arrives from Dirk Lillard! Zion Adebayo attempts a Layup. Contested by Dirk Lillard (5.6 feet, MAN). Zion Adebayo misses. Offensive rebound by Tim Griffin! Tim Griffin's putback is no good. Rebound secured by Ben Stewart.

[05:16] Team_027 possession (Score: 83-93)
FOUL! Offensive foul on LeBron Russell! Zion Adebayo drew the charge! [Team fouls: 8] (LeBron Russell: 3 personal fouls) TURNOVER! (dead ball)

[05:05] Team_033 possession (Score: 83-93)
FOUL! Holding foul on Dirk Lillard. [IN THE BONUS! 9 team fouls] Manu Irving to the line for 2 free throws. (Dirk Lillard: 2 personal fouls)   FT 1/2: GOOD   FT 2/2: GOOD Manu Irving makes 2/2 from the line.
Score: 83-95

[04:51] Team_027 possession (Score: 83-95)
Ben Stewart attempts a 3Pt. Contested by Terry Jokic (3.7 feet, ZONE). Ben Stewart misses. Rebound secured by Zion Adebayo.

[04:39] Team_033 possession (Score: 83-95)
Ben Anthony attempts a Midrange. Contested by CJ Green (5.6 feet, MAN). Ben Anthony misses. Rebound secured by Dirk Lillard.

[04:26] Team_027 possession (Score: 83-95)
LeBron Russell attempts a Layup. Contested by Zion Adebayo (4.5 feet, MAN). LEBRON RUSSELL MAKES IT! Assist: Dirk Lillard
Score: 85-95

[04:11] Team_033 possession (Score: 85-95)
Terry Jokic attempts a 3Pt. Contested by Rudy Quickley (3.8 feet, ZONE). Terry Jokic misses. Offensive rebound by Tim Griffin! Tim Griffin puts it back in!
Score: 85-97

[03:58] Team_027 possession (Score: 85-97)
FOUL! Shooting foul on Zion Adebayo. LeBron Russell to the line for 2 free throws. [Team fouls: 2] (Zion Adebayo: 2 personal fouls)   FT 1/2: GOOD   FT 2/2: GOOD LeBron Russell makes 2/2 from the line.
Score: 87-97

[03:45] Team_033 possession (Score: 87-97)
Terry Jokic attempts a Layup. Contested by Ben Stewart (5.1 feet, ZONE). Terry Jokic misses. Rebound secured by LeBron Russell.

[03:28] Team_027 possession (Score: 87-97)
Ben Stewart drives and kicks out. LeBron Russell attempts a 3Pt. Contested by Zion Adebayo (4.6 feet, MAN). LeBron Russell misses. Rebound secured by Zion Adebayo.

[03:10] Team_033 possession (Score: 87-97)
FOUL! Reach-in foul on Ben Stewart during the drive. [IN THE BONUS! 10 team fouls] Tim Griffin to the line for 2 free throws. (Ben Stewart: 5 personal fouls)   FT 1/2: GOOD   FT 2/2: MISS Tim Griffin makes 1/2 from the line. Offensive rebound by Tim Griffin! Tim Griffin puts it back in!
Score: 87-100

[02:55] Team_027 possession (Score: 87-100)
Ben Stewart drives and kicks out. Rudy Quickley attempts a Midrange. Contested by Manu Irving (4.8 feet, ZONE). RUDY QUICKLEY MAKES IT!
Score: 89-100

[02:39] Team_033 possession (Score: 89-100)
Ben Anthony attempts a Layup. Contested by Ben Stewart (5.3 feet, ZONE). BEN ANTHONY MAKES IT!
Score: 89-102

[02:29] Team_027 possession (Score: 89-102)
CJ Green attempts a Midrange. Contested by Zion Adebayo (4.8 feet, ZONE). CJ GREEN MAKES IT!
Score: 91-102

[02:11] Team_033 possession (Score: 91-102)
Terry Jokic attempts a Layup. BLOCKED BY BEN STEWART! Ball is loose! Rebound secured by Ben Stewart.

[02:02] Team_027 possession (Score: 91-102)
CJ Green attempts a Midrange. Contested by Ben Anthony (5.1 feet, MAN). CJ Green misses. Rebound secured by Zion Adebayo.

[01:48] Team_033 possession (Score: 91-102)
Manu Irving throws a bad pass out of bounds! TURNOVER! (dead ball)

[01:33] Team_027 possession (Score: 91-102)
Dirk Lillard attempts a 3Pt. Contested by Manu Irving (5.0 feet, MAN). Dirk Lillard misses. Rebound secured by Tim Griffin.

[01:18] Team_033 possession (Score: 91-102)
Terry Jokic makes the Dunk and draws the foul on Ben Stewart! And-1! Terry Jokic to the line for 1. [BONUS: 11 team fouls] (Ben Stewart: 6 personal fouls) Ben Stewart FOULS OUT!   FT 1/1: GOOD Terry Jokic makes 1/1 from the line.
Score: 91-105

[01:18] Substitution (Team_027): Ben Stewart OUT (stamina: 70) → Tim Johnson IN (foul_out)

[01:07] Team_027 possession (Score: 91-105)
Tim Johnson drives and kicks out. Dirk Lillard attempts a 3Pt. Contested by Terry Jokic (4.2 feet, ZONE). Dirk Lillard misses. Rebound secured by Zion Adebayo.

[00:55] Team_033 possession (Score: 91-105)
Tim Griffin attempts a Layup. Contested by LeBron Russell (5.9 feet, MAN). Tim Griffin misses. Rebound secured by Dirk Lillard.

[00:41] Team_027 possession (Score: 91-105)
Tim Johnson makes the Layup and draws the foul on Ben Anthony! And-1! Tim Johnson to the line for 1. [Team fouls: 3] (Ben Anthony: 1 personal fouls)   FT 1/1: GOOD Tim Johnson makes 1/1 from the line.
Score: 94-105

[00:29] Team_033 possession (Score: 94-105)
Zion Adebayo throws a bad pass! Stolen by LeBron Russell! TURNOVER! (live ball)

[00:19] Team_027 possession (Score: 94-105)
LeBron Russell attempts a 3Pt. Contested by Zion Adebayo (4.9 feet, MAN). LeBron Russell misses. Rebound secured by Tim Griffin.

================================================================================
                              4TH QUARTER COMPLETE                              
================================================================================

4TH QUARTER SCORE: Team_027 20, Team_033 27

BOX SCORE:
================================================================================

Team_027
--------------------------------------------------------------------------------
Player                MIN  PTS  REB  AST  TO      FG   FG%      3P   3P%
--------------------------------------------------------------------------------
LeBron Russell         19    7    2    0   0   3/6    50.0     0/0   0.0
CJ Green               19    4    0    0   0   2/4    50.0     0/0   0.0
Tim Johnson            31    3    0    1   0   1/2    50.0     0/0   0.0
John Russell           30    2    0    0   0   1/2    50.0     0/0   0.0
Rudy Quickley          19    2    0    1   0   1/2    50.0     0/0   0.0
Dirk Lillard           19    2    4    2   0   1/2    50.0     0/0   0.0
Ben Stewart            18    0    2    0   0   0/3     0.0     0/0   0.0

TEAM: FG: 9/21 (42.9%), 3PT: 1/7 (14.3%), REB: 7 (0 off, 7 def), AST: 4, TO: 3
TEAM FOULS: 11 [Team_033 in BONUS]


Team_033
--------------------------------------------------------------------------------
Player                MIN  PTS  REB  AST  TO      FG   FG%      3P   3P%
--------------------------------------------------------------------------------
Tim Griffin            19   11    4    0   0   5/8    62.5     0/0   0.0
Terry Jokic            19    5    4    0   0   2/4    50.0     0/0   0.0
Ben Anthony            19    5    0    0   0   2/3    66.7     0/0   0.0
Cade Randle            30    2    1    0   0   1/1   100.0     0/0   0.0
Zion Adebayo           19    2    4    0   0   1/3    33.3     0/0   0.0
Manu Irving            19    2    0    0   0   1/1   100.0     0/0   0.0
Bradley Simmons        30    0    1    0   0   0/0     0.0     0/0   0.0

TEAM: FG: 12/20 (60.0%), 3PT: 2/2 (100.0%), REB: 15 (4 off, 11 def), AST: 0, TO: 3
TEAM FOULS: 3

================================================================================

================================================================================
                               FULL GAME COMPLETE                               
================================================================================

FINAL SCORE: Team_027 94, Team_033 105

SCORING BY QUARTER:
--------------------------------------------------------------------------------
Team                     Q1     Q2     Q3     Q4    FINAL
--------------------------------------------------------------------------------
Team_027                 24     21     29     20       94
Team_033                 35     24     19     27      105
--------------------------------------------------------------------------------

FULL GAME BOX SCORE:
================================================================================

Team_027
--------------------------------------------------------------------------------
Player                MIN  PTS  REB  AST  TO      FG   FG%      3P   3P%      FT STL BLK
--------------------------------------------------------------------------------
Tim Johnson            31   14    0    3   2   3/10   30.0   2/7    28.6   1/1     0   0
Tony Doncic            30    7    3    5   2   5/10   50.0   0/3     0.0   1/1     0   0
Scottie Harden         30   20    0    3   1  10/12   83.3   2/4    50.0   1/1     1   0
Bradley Dosunmu        30   13    4    2   2   5/7    71.4   0/1     0.0   0/0     2   0
John Russell           30   13   12    4   2   4/10   40.0   0/1     0.0   3/3     2   0
CJ Green               19    6    0    1   2   3/7    42.9   0/0     0.0   0/0     0   0
Dirk Lillard           19    4    8    2   0   3/7    42.9   0/2     0.0   2/2     0   0
Rudy Quickley          19    6    0    1   0   1/3    33.3   0/2     0.0   0/0     0   1
LeBron Russell         19    9    2    1   2   4/7    57.1   1/2    50.0   2/4     1   0
Ben Stewart            18    2    7    1   1   2/7    28.6   0/2     0.0   0/0     0   2

TEAM: FG: 41/81 (50.6%), 3PT: 5/24 (20.8%), REB: 36 (2 off, 34 def), AST: 23, TO: 14


Team_033
--------------------------------------------------------------------------------
Player                MIN  PTS  REB  AST  TO      FG   FG%      3P   3P%      FT STL BLK
--------------------------------------------------------------------------------
Joel Green             30   15    0    4   1   7/8    87.5   4/5    80.0   0/0     0   0
Chris Anunoby          30    8    0    2   1   4/9    44.4   2/3    66.7   1/1     0   1
Cade Randle            30    9    6    1   3   2/9    22.2   1/8    12.5   1/3     1   0
Desmond DeRozan        30   16   12    3   3   7/10   70.0   0/1     0.0   6/6     0   1
Bradley Simmons        30   15    9    1   2   7/9    77.8   0/2     0.0   6/7     0   0
Ben Anthony            19    7    0    0   1   5/8    62.5   0/0     0.0   2/3     0   1
Manu Irving            19    5    0    0   1   1/3    33.3   1/2    50.0   2/2     0   2
Terry Jokic            19    7    7    0   0   3/6    50.0   1/2    50.0   5/5     0   0
Zion Adebayo           19    2    5    1   1   1/5    20.0   0/1     0.0   0/0     0   0
Tim Griffin            19   18    7    1   0   5/11   45.5   0/0     0.0   8/9     1   1

TEAM: FG: 44/80 (55.0%), 3PT: 9/24 (37.5%), REB: 45 (9 off, 36 def), AST: 13, TO: 13

================================================================================
