================================================================================
                        FULL GAME - Team_064 vs Team_017                        
================================================================================

================================================================================
                       1ST QUARTER - Team_064 vs Team_017                       
================================================================================

[12:00] Team_064 possession (Score: 0-0)
Jordan Mitchell attempts a 3Pt. Contested by Vince Banchero (3.6 feet, MAN). JORDAN MITCHELL MAKES IT! Assist: Kawhi Irving
Score: 3-0

[11:45] Team_017 possession (Score: 3-0)
Desmond Reaves drives and kicks out. Vince Banchero attempts a 3Pt. Contested by Jordan Mitchell (3.8 feet, MAN). Vince Banchero misses. Rebound secured by Kawhi Irving.

[11:32] Team_064 possession (Score: 3-0)
Ja Mitchell throws a bad pass out of bounds! TURNOVER! (dead ball)

[11:19] Team_017 possession (Score: 3-0)
FOUL! Reach-in foul on Russell Simons during the drive. [Team fouls: 1] No free throws, side out. (Russell Simons: 1 personal fouls)

[11:01] Team_017 possession (Score: 3-0)
Desmond Reaves attempts a Layup. Contested by Russell Simons (3.7 feet, ZONE). Desmond Reaves misses. Rebound secured by Kawhi Irving.

[10:48] Team_064 possession (Score: 3-0)
Ja Mitchell attempts a 3Pt. Contested by Desmond Reaves (4.3 feet, MAN). Ja Mitchell misses. Rebound secured by Kyrie Middleton.

[10:32] Team_017 possession (Score: 3-0)
Tony Smith attempts a 3Pt. Contested by Kawhi Irving (4.9 feet, ZONE). Tony Smith misses. Rebound secured by Shai Hyland.

[10:15] Team_064 possession (Score: 3-0)
Jordan Mitchell makes the 3Pt and draws the foul on Desmond Reaves! And-1! Jordan Mitchell to the line for 1. [Team fouls: 1] (Desmond Reaves: 1 personal fouls)   FT 1/1: GOOD Jordan Mitchell makes 1/1 from the line.
Score: 7-0

[10:02] Team_017 possession (Score: 7-0)
Bam Williamson drives, picks up Shai Hyland. Help arrives from Jordan Mitchell! Bam Williamson attempts a Layup. Contested by Jordan Mitchell (5.7 feet, MAN). BAM WILLIAMSON MAKES IT!
Score: 7-2

[09:48] Team_064 possession (Score: 7-2)
Russell Simons makes the Layup and draws the foul on Vince Banchero! And-1! Russell Simons to the line for 1. [Team fouls: 2] (Vince Banchero: 1 personal fouls)   FT 1/1: GOOD Russell Simons makes 1/1 from the line.
Score: 10-2

[09:31] Team_017 possession (Score: 10-2)
Kyrie Middleton attempts a 3Pt. Contested by Russell Simons (3.6 feet, MAN). Kyrie Middleton misses. Rebound secured by Kawhi Irving.

[09:18] Team_064 possession (Score: 10-2)
FOUL! Shooting foul on Bam Williamson. Ja Mitchell to the line for 2 free throws. [Team fouls: 3] (Bam Williamson: 1 personal fouls)   FT 1/2: GOOD   FT 2/2: GOOD Ja Mitchell makes 2/2 from the line.
Score: 12-2

[09:08] Team_017 possession (Score: 12-2)
Vince Banchero drives and kicks out. FOUL! Shooting foul on Russell Simons. Kyrie Middleton to the line for 2 free throws. [Team fouls: 2] (Russell Simons: 2 personal fouls)   FT 1/2: MISS   FT 2/2: GOOD Kyrie Middleton makes 1/2 from the line.
Score: 12-3

[08:53] Team_064 possession (Score: 12-3)
Kawhi Irving makes the Midrange and draws the foul on Tony Smith! And-1! Kawhi Irving to the line for 1. [Team fouls: 4] (Tony Smith: 1 personal fouls)   FT 1/1: GOOD Kawhi Irving makes 1/1 from the line.
Score: 15-3

[08:38] Team_017 possession (Score: 15-3)
Kyrie Middleton attempts a Layup. Contested by Russell Simons (3.6 feet, ZONE). Kyrie Middleton misses. Rebound secured by Russell Simons.

[08:24] Team_064 possession (Score: 15-3)
Ja Mitchell makes the Layup and draws the foul on Bam Williamson! And-1! Ja Mitchell to the line for 1. [BONUS: 5 team fouls] (Bam Williamson: 2 personal fouls)   FT 1/1: GOOD Ja Mitchell makes 1/1 from the line.
Score: 18-3

[08:08] Team_017 possession (Score: 18-3)
Tony Smith drives, Russell Simons stays with him. Tony Smith attempts a Layup. Contested by Russell Simons (3.8 feet, ZONE). TONY SMITH MAKES IT!
Score: 18-5

[07:52] Team_064 possession (Score: 18-5)
Ja Mitchell attempts a Midrange. Contested by Desmond Reaves (4.3 feet, MAN). Ja Mitchell misses. Offensive rebound by Russell Simons! Russell Simons kicks it out.

[07:32] Team_064 possession (Score: 18-5)
Shai Hyland makes the Layup and draws the foul on Bam Williamson! And-1! Shai Hyland to the line for 1. [BONUS: 6 team fouls] (Bam Williamson: 3 personal fouls)   FT 1/1: MISS Shai Hyland makes 0/1 from the line. Rebound secured by Kyrie Middleton.
Score: 20-5

[07:16] Team_017 possession (Score: 20-5)
Bam Williamson attempts a Midrange. Contested by Shai Hyland (5.7 feet, MAN). Bam Williamson misses. Rebound secured by Russell Simons.

[07:01] Team_064 possession (Score: 20-5)
Ja Mitchell makes the Layup and draws the foul on Desmond Reaves! And-1! Ja Mitchell to the line for 1. [BONUS: 7 team fouls] (Desmond Reaves: 2 personal fouls)   FT 1/1: GOOD Ja Mitchell makes 1/1 from the line.
Score: 23-5

[06:49] Team_017 possession (Score: 23-5)
Vince Banchero attempts a Layup. Contested by Russell Simons (3.2 feet, ZONE). VINCE BANCHERO MAKES IT!
Score: 23-7

[06:37] Team_064 possession (Score: 23-7)
Shai Hyland attempts a 3Pt. Contested by Desmond Reaves (4.4 feet, ZONE). Shai Hyland misses. Rebound secured by Tony Smith.

[06:23] Team_017 possession (Score: 23-7)
Bam Williamson attempts a Layup. Contested by Russell Simons (4.0 feet, ZONE). Bam Williamson misses. Rebound secured by Shai Hyland.

[06:08] Team_064 possession (Score: 23-7)
Shai Hyland makes the Midrange and draws the foul on Kyrie Middleton! And-1! Shai Hyland to the line for 1. [BONUS: 8 team fouls] (Kyrie Middleton: 1 personal fouls)   FT 1/1: GOOD Shai Hyland makes 1/1 from the line.
Score: 26-7

[05:51] Team_017 possession (Score: 26-7)
Vince Banchero drives, Russell Simons stays with him. Vince Banchero attempts a Layup. Contested by Russell Simons (3.2 feet, ZONE). Vince Banchero misses. Rebound secured by Shai Hyland.

[05:37] Team_064 possession (Score: 26-7)
Shai Hyland attempts a Layup. Contested by Bam Williamson (4.4 feet, ZONE). SHAI HYLAND MAKES IT! Assist: Jordan Mitchell
Score: 28-7

[05:23] Team_017 possession (Score: 28-7)
Bam Williamson drives to the basket... Bam Williamson loses the ball! Stripped by Shai Hyland! TURNOVER! (live ball)

[05:06] Team_064 possession (Score: 28-7)
Shai Hyland drives, picks up Bam Williamson. Help arrives from Vince Banchero! Shai Hyland attempts a Dunk. Contested by Vince Banchero (4.4 feet, MAN). Shai Hyland misses. Rebound secured by Tony Smith.

[04:53] Team_017 possession (Score: 28-7)
Tony Smith attempts a 3Pt. Contested by Ja Mitchell (5.8 feet, ZONE). Tony Smith misses. Rebound secured by Kawhi Irving.

[04:37] Team_064 possession (Score: 28-7)
Russell Simons attempts a Layup. Contested by Bam Williamson (4.2 feet, ZONE). Russell Simons misses. Rebound secured by Tony Smith.

[04:24] Team_017 possession (Score: 28-7)
Tony Smith attempts a 3Pt. Contested by Ja Mitchell (5.8 feet, ZONE). TONY SMITH MAKES IT! Assist: Kyrie Middleton
Score: 28-10

[04:11] Team_064 possession (Score: 28-10)
Russell Simons throws a bad pass out of bounds! TURNOVER! (dead ball)

[03:54] Team_017 possession (Score: 28-10)
Kyrie Middleton drives, Russell Simons stays with him. Kyrie Middleton attempts a Dunk. Contested by Russell Simons (3.7 feet, ZONE). Kyrie Middleton misses. Offensive rebound by Kyrie Middleton! Kyrie Middleton kicks it out.

[03:41] Team_017 possession (Score: 28-10)
Vince Banchero attempts a Layup. Contested by Jordan Mitchell (4.0 feet, MAN). Vince Banchero misses. Rebound secured by Russell Simons.

[03:23] Team_064 possession (Score: 28-10)
Kawhi Irving loses the ball! Stripped by Tony Smith! TURNOVER! (live ball)

[03:08] Team_017 possession (Score: 28-10)
Tony Smith attempts a Midrange. Contested by Kawhi Irving (5.0 feet, MAN). Tony Smith misses. Offensive rebound by Kyrie Middleton! Kyrie Middleton kicks it out.

[02:54] Team_017 possession (Score: 28-10)
Vince Banchero drives, Russell Simons stays with him. Vince Banchero attempts a Layup. Contested by Russell Simons (3.5 feet, ZONE). VINCE BANCHERO MAKES IT! Assist: Kyrie Middleton
Score: 28-12

[02:36] Team_064 possession (Score: 28-12)
Russell Simons makes the Layup and draws the foul on Kyrie Middleton! And-1! Russell Simons to the line for 1. [BONUS: 9 team fouls] (Kyrie Middleton: 2 personal fouls)   FT 1/1: GOOD Russell Simons makes 1/1 from the line.
Score: 31-12

[02:17] Team_017 possession (Score: 31-12)
Tony Smith drives and kicks out. Desmond Reaves attempts a 3Pt. Contested by Ja Mitchell (5.4 feet, ZONE). Desmond Reaves misses. FOUL! Loose ball foul on Kawhi Irving during the rebound battle. [Team fouls: 3] No free throws, side out. (Kawhi Irving: 1 personal fouls)

[02:07] Team_017 possession (Score: 31-12)
Kyrie Middleton drives to the basket... Kyrie Middleton throws a bad pass out of bounds! TURNOVER! (dead ball)

[02:07] Substitution (Team_064): Ja Mitchell OUT → CJ Haliburton IN (stamina_rule2)

[02:07] Substitution (Team_064): Jordan Mitchell OUT → Ja Simmons IN (stamina_rule2)

[02:07] Substitution (Team_064): Kawhi Irving OUT → Tobias Herro IN (stamina_rule2)

[02:07] Substitution (Team_064): Russell Simons OUT → Austin Smith IN (stamina_rule2)

[02:07] Substitution (Team_064): Shai Hyland OUT → Devin Cunningham IN (stamina_rule2)

[02:07] Substitution (Team_017): Desmond Reaves OUT → Blake Reaves IN (stamina_rule2)

[02:07] Substitution (Team_017): Kyrie Middleton OUT → Ja Stewart IN (stamina_rule2)

[02:07] Substitution (Team_017): Bam Williamson OUT → Klay Holiday IN (stamina_rule2)

[01:54] Team_064 possession (Score: 31-12)
Tobias Herro attempts a Midrange. Contested by Tony Smith (2.6 feet, MAN). Tobias Herro misses. Rebound secured by Klay Holiday.

[01:40] Team_017 possession (Score: 31-12)
Klay Holiday drives to the basket... Klay Holiday loses control! Ball rolls out of bounds! TURNOVER! (dead ball)

[01:40] Substitution (Team_017): Vince Banchero OUT → Tobias Bridges IN (stamina_rule2)

[01:40] Substitution (Team_017): Tony Smith OUT → Shaquille Stewart IN (stamina_rule2)

[01:21] Team_064 possession (Score: 31-12)
Ja Simmons attempts a Midrange. Contested by Tobias Bridges (3.9 feet, MAN). JA SIMMONS MAKES IT!
Score: 33-12

[01:03] Team_017 possession (Score: 33-12)
Klay Holiday drives to the basket... Klay Holiday throws a bad pass! Stolen by Devin Cunningham! TURNOVER! (live ball)

[00:50] Team_064 possession (Score: 33-12)
Devin Cunningham makes the Dunk and draws the foul on Tobias Bridges! And-1! Devin Cunningham to the line for 1. [BONUS: 10 team fouls] (Tobias Bridges: 1 personal fouls)   FT 1/1: GOOD Devin Cunningham makes 1/1 from the line.
Score: 36-12

[00:40] Team_017 possession (Score: 36-12)
Blake Reaves commits a violation (traveling/carry)! TURNOVER! (dead ball)

[00:23] Team_064 possession (Score: 36-12)
Austin Smith attempts a 3Pt. Contested by Tobias Bridges (3.6 feet, ZONE). Austin Smith misses. Rebound secured by Klay Holiday.

[00:09] Team_017 possession (Score: 36-12)
Klay Holiday attempts a Midrange. Contested by Ja Simmons (5.8 feet, ZONE). Klay Holiday misses. Rebound secured by Ja Simmons.

================================================================================
                              1ST QUARTER COMPLETE                              
================================================================================

1ST QUARTER SCORE: Team_064 36, Team_017 12

BOX SCORE:
================================================================================

Team_064
--------------------------------------------------------------------------------
Player                MIN  PTS  REB  AST  TO      FG   FG%      3P   3P%
--------------------------------------------------------------------------------
Ja Mitchell            10    8    0    0   0   3/4    75.0     0/0   0.0
Jordan Mitchell        10    7    0    1   0   2/2   100.0     0/0   0.0
Russell Simons         10    6    4    0   0   2/3    66.7     0/0   0.0
Shai Hyland            10    5    3    0   0   2/5    40.0     0/0   0.0
Kawhi Irving           10    3    4    1   0   1/1   100.0     0/0   0.0
Devin Cunningham        2    3    0    0   0   1/1   100.0     0/0   0.0
Ja Simmons              2    2    1    0   0   1/1   100.0     0/0   0.0
Tobias Herro            2    0    0    0   0   0/1     0.0     0/0   0.0
Austin Smith            2    0    0    0   0   0/1     0.0     0/0   0.0

TEAM: FG: 12/19 (63.2%), 3PT: 2/5 (40.0%), REB: 12 (1 off, 11 def), AST: 2, TO: 3
TEAM FOULS: 3


Team_017
--------------------------------------------------------------------------------
Player                MIN  PTS  REB  AST  TO      FG   FG%      3P   3P%
--------------------------------------------------------------------------------
Tony Smith             11    5    3    0   0   2/4    50.0     0/0   0.0
Vince Banchero         11    4    0    0   0   2/4    50.0     0/0   0.0
Bam Williamson         10    2    0    0   0   1/3    33.3     0/0   0.0
Kyrie Middleton        10    1    5    2   0   1/3    33.3     0/0   0.0
Desmond Reaves         10    0    0    0   0   0/2     0.0     0/0   0.0
Klay Holiday            2    0    2    0   0   0/1     0.0     0/0   0.0

TEAM: FG: 6/17 (35.3%), 3PT: 1/4 (25.0%), REB: 10 (3 off, 7 def), AST: 2, TO: 5
TEAM FOULS: 10 [Team_064 in BONUS]

================================================================================

================================================================================
                       2ND QUARTER - Team_064 vs Team_017                       
================================================================================

[12:00] Team_064 possession (Score: 36-12)
Jordan Mitchell attempts a Layup. Contested by Bam Williamson (3.6 feet, ZONE). JORDAN MITCHELL MAKES IT! Assist: Ja Mitchell
Score: 38-12

[11:42] Team_017 possession (Score: 38-12)
FOUL! Shooting foul on Russell Simons. Vince Banchero to the line for 2 free throws. [Team fouls: 1] (Russell Simons: 1 personal fouls)   FT 1/2: GOOD   FT 2/2: GOOD Vince Banchero makes 2/2 from the line.
Score: 38-14

[11:27] Team_064 possession (Score: 38-14)
Jordan Mitchell commits a violation (traveling/carry)! TURNOVER! (dead ball)

[11:13] Team_017 possession (Score: 38-14)
FOUL! Reach-in foul on Russell Simons during the drive. [Team fouls: 2] No free throws, side out. (Russell Simons: 2 personal fouls)

[10:57] Team_017 possession (Score: 38-14)
Bam Williamson drives, Shai Hyland stays with him. Bam Williamson attempts a Layup. Contested by Shai Hyland (5.9 feet, ZONE). BAM WILLIAMSON MAKES IT!
Score: 38-16

[10:40] Team_064 possession (Score: 38-16)
Jordan Mitchell attempts a 3Pt. Contested by Vince Banchero (3.8 feet, MAN). Jordan Mitchell misses. Rebound secured by Tony Smith.

[10:23] Team_017 possession (Score: 38-16)
Kyrie Middleton drives to the basket... Kyrie Middleton commits a violation (traveling/carry)! TURNOVER! (dead ball)

[10:07] Team_064 possession (Score: 38-16)
Russell Simons drives, Bam Williamson stays with him. Russell Simons attempts a Layup. Contested by Bam Williamson (4.3 feet, ZONE). Russell Simons misses. Offensive rebound by Kawhi Irving! Kawhi Irving kicks it out.

[09:57] Team_064 possession (Score: 38-16)
Jordan Mitchell makes the Layup and draws the foul on Vince Banchero! And-1! Jordan Mitchell to the line for 1. [Team fouls: 1] (Vince Banchero: 1 personal fouls)   FT 1/1: MISS Jordan Mitchell makes 0/1 from the line. Rebound secured by Tony Smith.
Score: 40-16

[09:43] Team_017 possession (Score: 40-16)
Kyrie Middleton drives and kicks out. Desmond Reaves attempts a 3Pt. Contested by Ja Mitchell (5.4 feet, MAN). DESMOND REAVES MAKES IT!
Score: 40-19

[09:27] Team_064 possession (Score: 40-19)
Jordan Mitchell attempts a Midrange. Contested by Vince Banchero (3.9 feet, MAN). Jordan Mitchell misses. Offensive rebound by Kawhi Irving! Kawhi Irving kicks it out.

[09:10] Team_064 possession (Score: 40-19)
Jordan Mitchell makes the Dunk and draws the foul on Vince Banchero! And-1! Jordan Mitchell to the line for 1. [Team fouls: 2] (Vince Banchero: 2 personal fouls)   FT 1/1: GOOD Jordan Mitchell makes 1/1 from the line.
Score: 43-19

[08:54] Team_017 possession (Score: 43-19)
Desmond Reaves attempts a 3Pt. Contested by Ja Mitchell (5.9 feet, ZONE). Desmond Reaves misses. Rebound secured by Russell Simons.

[08:41] Team_064 possession (Score: 43-19)
Kawhi Irving attempts a 3Pt. Contested by Vince Banchero (4.3 feet, ZONE). Kawhi Irving misses. Offensive rebound by Russell Simons! Russell Simons kicks it out.

[08:27] Team_064 possession (Score: 43-19)
Russell Simons attempts a 3Pt. Contested by Kyrie Middleton (5.4 feet, MAN). Russell Simons misses. Rebound secured by Bam Williamson.

[08:16] Team_017 possession (Score: 43-19)
Desmond Reaves attempts a 3Pt. Contested by Ja Mitchell (5.9 feet, ZONE). DESMOND REAVES MAKES IT! Assist: Bam Williamson
Score: 43-22

[08:01] Team_064 possession (Score: 43-22)
Russell Simons attempts a 3Pt. Contested by Desmond Reaves (4.5 feet, ZONE). Russell Simons misses. Offensive rebound by Kawhi Irving! Kawhi Irving kicks it out.

[07:47] Team_064 possession (Score: 43-22)
Kawhi Irving drives, Tony Smith stays with him. Kawhi Irving attempts a Dunk. Contested by Tony Smith (3.2 feet, MAN). KAWHI IRVING MAKES IT! Assist: Ja Mitchell
Score: 45-22

[07:37] Team_017 possession (Score: 45-22)
Tony Smith throws a bad pass! Stolen by Kawhi Irving! TURNOVER! (live ball)

[07:23] Team_064 possession (Score: 45-22)
Jordan Mitchell attempts a Layup. Contested by Vince Banchero (4.1 feet, MAN). Jordan Mitchell misses. Rebound secured by Tony Smith.

[07:05] Team_017 possession (Score: 45-22)
Desmond Reaves attempts a 3Pt. Wide open! Ja Mitchell is 6.0 feet away. [MAN] Desmond Reaves misses. Rebound secured by Kawhi Irving.

[06:47] Team_064 possession (Score: 45-22)
Jordan Mitchell loses the ball! Stripped by Vince Banchero! TURNOVER! (live ball)

[06:35] Team_017 possession (Score: 45-22)
Kyrie Middleton attempts a Midrange. Contested by Russell Simons (4.4 feet, ZONE). KYRIE MIDDLETON MAKES IT! Assist: Bam Williamson
Score: 45-24

[06:22] Team_064 possession (Score: 45-24)
FOUL! Reach-in foul on Bam Williamson during the drive. [Team fouls: 3] No free throws, side out. (Bam Williamson: 1 personal fouls)

[06:09] Team_064 possession (Score: 45-24)
Kawhi Irving attempts a 3Pt. Contested by Tony Smith (3.4 feet, ZONE). Kawhi Irving misses. Offensive rebound by Kawhi Irving! Kawhi Irving kicks it out.

[06:00] Team_064 possession (Score: 45-24)
Shai Hyland attempts a 3Pt. Contested by Bam Williamson (5.0 feet, MAN). SHAI HYLAND MAKES IT! Assist: Russell Simons
Score: 48-24

[05:44] Team_017 possession (Score: 48-24)
Vince Banchero attempts a 3Pt. Contested by Jordan Mitchell (4.5 feet, MAN). Vince Banchero misses. Rebound secured by Jordan Mitchell.

[05:27] Team_064 possession (Score: 48-24)
FOUL! Holding foul on Desmond Reaves. [Team fouls: 4] No free throws, side out. (Desmond Reaves: 1 personal fouls)

[05:13] Team_064 possession (Score: 48-24)
Ja Mitchell attempts a Layup. Contested by Desmond Reaves (5.0 feet, MAN). JA MITCHELL MAKES IT! Assist: Shai Hyland
Score: 50-24

[04:56] Team_017 possession (Score: 50-24)
Desmond Reaves throws a bad pass! Stolen by Ja Mitchell! TURNOVER! (live ball)

[04:43] Team_064 possession (Score: 50-24)
Ja Mitchell throws a bad pass out of bounds! TURNOVER! (dead ball)

[04:43] Substitution (Team_064): Ja Mitchell OUT → CJ Haliburton IN (stamina_rule2)

[04:43] Substitution (Team_064): Jordan Mitchell OUT → Ja Simmons IN (stamina_rule2)

[04:43] Substitution (Team_064): Kawhi Irving OUT → Tobias Herro IN (stamina_rule2)

[04:43] Substitution (Team_064): Russell Simons OUT → Austin Smith IN (stamina_rule2)

[04:43] Substitution (Team_064): Shai Hyland OUT → Devin Cunningham IN (stamina_rule2)

[04:43] Substitution (Team_017): Desmond Reaves OUT → Blake Reaves IN (stamina_rule2)

[04:43] Substitution (Team_017): Vince Banchero OUT → Tobias Bridges IN (stamina_rule2)

[04:43] Substitution (Team_017): Tony Smith OUT → Shaquille Stewart IN (stamina_rule2)

[04:43] Substitution (Team_017): Kyrie Middleton OUT → Ja Stewart IN (stamina_rule2)

[04:43] Substitution (Team_017): Bam Williamson OUT → Klay Holiday IN (stamina_rule2)

[04:24] Team_017 possession (Score: 50-24)
Tobias Bridges attempts a Midrange. Wide open! CJ Haliburton is 6.1 feet away. [ZONE] Tobias Bridges misses. FOUL! Loose ball foul on Austin Smith during the rebound battle. [Team fouls: 3] No free throws, side out. (Austin Smith: 1 personal fouls)

[04:07] Team_017 possession (Score: 50-24)
Shaquille Stewart attempts a Midrange. Wide open! Tobias Herro is 6.4 feet away. [MAN] SHAQUILLE STEWART MAKES IT! Assist: Ja Stewart
Score: 50-26

[03:56] Team_064 possession (Score: 50-26)
Ja Simmons drives and kicks out. Ja Simmons attempts a Midrange. Contested by Tobias Bridges (4.0 feet, MAN). Ja Simmons misses. Rebound secured by Shaquille Stewart.

[03:42] Team_017 possession (Score: 50-26)
Tobias Bridges throws a bad pass! Stolen by Ja Simmons! TURNOVER! (live ball)

[03:26] Team_064 possession (Score: 50-26)
CJ Haliburton attempts a 3Pt. Contested by Blake Reaves (5.5 feet, MAN). CJ Haliburton misses. Rebound secured by Ja Stewart.

[03:14] Team_017 possession (Score: 50-26)
Tobias Bridges attempts a 3Pt. Contested by Austin Smith (4.7 feet, ZONE). Tobias Bridges misses. Offensive rebound by Ja Stewart! Ja Stewart kicks it out.

[03:01] Team_017 possession (Score: 50-26)
Klay Holiday drives and kicks out. Klay Holiday attempts a 3Pt. Contested by Ja Simmons (5.6 feet, ZONE). Klay Holiday misses. Rebound secured by Ja Simmons.

[02:47] Team_064 possession (Score: 50-26)
Tobias Herro drives to the basket... Tobias Herro loses control! Ball rolls out of bounds! TURNOVER! (dead ball)

[02:32] Team_017 possession (Score: 50-26)
Shaquille Stewart attempts a 3Pt. Wide open! Tobias Herro is 6.4 feet away. [MAN] SHAQUILLE STEWART MAKES IT! Assist: Ja Stewart
Score: 50-29

[02:19] Team_064 possession (Score: 50-29)
Devin Cunningham attempts a Midrange. Contested by Ja Stewart (4.6 feet, ZONE). Devin Cunningham misses. FOUL! Loose ball foul on Ja Stewart during the rebound battle. [IN THE BONUS! 5 team fouls] Ja Simmons to the line for 2 free throws. (Ja Stewart: 1 personal fouls)   FT 1/2: GOOD   FT 2/2: GOOD Ja Simmons makes 2/2 from the line.
Score: 52-29

[02:04] Team_017 possession (Score: 52-29)
Klay Holiday attempts a Layup. Contested by Devin Cunningham (5.4 feet, MAN). Klay Holiday misses. Rebound secured by Ja Simmons.

[01:47] Team_064 possession (Score: 52-29)
Devin Cunningham drives to the basket... Devin Cunningham throws a bad pass! Stolen by Ja Stewart! TURNOVER! (live ball)

[01:35] Team_017 possession (Score: 52-29)
Klay Holiday attempts a Layup. Contested by Devin Cunningham (5.4 feet, MAN). Klay Holiday misses. Offensive rebound by Shaquille Stewart! Shaquille Stewart kicks it out.

[01:18] Team_017 possession (Score: 52-29)
Klay Holiday attempts a Midrange. Contested by Devin Cunningham (5.4 feet, MAN). KLAY HOLIDAY MAKES IT! Assist: Shaquille Stewart
Score: 52-31

[01:02] Team_064 possession (Score: 52-31)
Devin Cunningham drives to the basket... FOUL! Offensive foul on Devin Cunningham! Klay Holiday drew the charge! [Team fouls: 4] (Devin Cunningham: 1 personal fouls) TURNOVER! (dead ball)

[00:44] Team_017 possession (Score: 52-31)
Tobias Bridges attempts a 3Pt. Contested by Ja Simmons (5.7 feet, MAN). Tobias Bridges misses. Rebound secured by Ja Simmons.

[00:33] Team_064 possession (Score: 52-31)
Devin Cunningham drives to the basket... Devin Cunningham loses control! Ball rolls out of bounds! TURNOVER! (dead ball)

[00:20] Team_017 possession (Score: 52-31)
Blake Reaves attempts a 3Pt. Contested by Austin Smith (4.5 feet, ZONE). Blake Reaves misses. Rebound secured by Ja Simmons.

[00:05] Team_064 possession (Score: 52-31)
CJ Haliburton drives and kicks out. CJ Haliburton attempts a Midrange. Contested by Blake Reaves (5.2 feet, MAN). CJ Haliburton misses. Rebound secured by Shaquille Stewart.

================================================================================
                              2ND QUARTER COMPLETE                              
================================================================================

2ND QUARTER SCORE: Team_064 16, Team_017 19

BOX SCORE:
================================================================================

Team_064
--------------------------------------------------------------------------------
Player                MIN  PTS  REB  AST  TO      FG   FG%      3P   3P%
--------------------------------------------------------------------------------
Jordan Mitchell        18    5    1    0   0   2/5    40.0     0/0   0.0
Shai Hyland            18    3    0    1   0   1/1   100.0     0/0   0.0
Ja Mitchell            18    2    0    2   0   1/1   100.0     0/0   0.0
Kawhi Irving           18    2    5    0   0   1/1   100.0     0/0   0.0
Ja Simmons              6    2    4    0   0   1/2    50.0     0/0   0.0
Russell Simons         18    0    2    1   0   0/1     0.0     0/0   0.0
CJ Haliburton           6    0    0    0   0   0/2     0.0     0/0   0.0

TEAM: FG: 6/13 (46.2%), 3PT: 1/4 (25.0%), REB: 12 (5 off, 7 def), AST: 4, TO: 7
TEAM FOULS: 4


Team_017
--------------------------------------------------------------------------------
Player                MIN  PTS  REB  AST  TO      FG   FG%      3P   3P%
--------------------------------------------------------------------------------
Desmond Reaves         18    6    0    0   0   2/4    50.0     0/0   0.0
Shaquille Stewart       6    5    3    1   0   2/2   100.0     0/0   0.0
Vince Banchero         18    2    0    0   0   1/2    50.0     0/0   0.0
Bam Williamson         18    2    1    2   0   1/1   100.0     0/0   0.0
Kyrie Middleton        18    2    0    0   0   1/1   100.0     0/0   0.0
Klay Holiday            6    2    0    0   0   1/3    33.3     0/0   0.0
Tony Smith             18    0    3    0   0   0/0     0.0     0/0   0.0
Ja Stewart              6    0    3    2   0   0/0     0.0     0/0   0.0
Tobias Bridges          6    0    0    0   0   0/1     0.0     0/0   0.0
Blake Reaves            6    0    0    0   0   0/1     0.0     0/0   0.0

TEAM: FG: 8/15 (53.3%), 3PT: 2/7 (28.6%), REB: 10 (3 off, 7 def), AST: 5, TO: 4
TEAM FOULS: 5 [Team_064 in BONUS]

================================================================================

================================================================================
                       3RD QUARTER - Team_064 vs Team_017                       
================================================================================

[12:00] Team_064 possession (Score: 52-31)
Ja Mitchell drives and kicks out. Jordan Mitchell attempts a 3Pt. Contested by Vince Banchero (4.0 feet, MAN). JORDAN MITCHELL MAKES IT! Assist: Ja Mitchell
Score: 55-31

[11:45] Team_017 possession (Score: 55-31)
Vince Banchero drives and kicks out. Vince Banchero attempts a Midrange. Contested by Kawhi Irving (4.3 feet, ZONE). Vince Banchero misses. Rebound secured by Russell Simons.

[11:32] Team_064 possession (Score: 55-31)
Shai Hyland attempts a Midrange. Contested by Bam Williamson (4.4 feet, MAN). Shai Hyland misses. Offensive rebound by Kawhi Irving! Kawhi Irving kicks it out.

[11:20] Team_064 possession (Score: 55-31)
Shai Hyland drives, Bam Williamson stays with him. Shai Hyland attempts a Dunk. Contested by Bam Williamson (4.4 feet, ZONE). SHAI HYLAND MAKES IT! Assist: Ja Mitchell
Score: 57-31

[11:04] Team_017 possession (Score: 57-31)
Vince Banchero attempts a 3Pt. Contested by Ja Mitchell (5.1 feet, ZONE). Vince Banchero misses. Rebound secured by Kawhi Irving.

[10:50] Team_064 possession (Score: 57-31)
Shai Hyland makes the Layup and draws the foul on Bam Williamson! And-1! Shai Hyland to the line for 1. [Team fouls: 1] (Bam Williamson: 1 personal fouls)   FT 1/1: GOOD Shai Hyland makes 1/1 from the line.
Score: 60-31

[10:38] Team_017 possession (Score: 60-31)
Vince Banchero drives to the basket... Vince Banchero commits a violation (traveling/carry)! TURNOVER! (dead ball)

[10:25] Team_064 possession (Score: 60-31)
FOUL! Shooting foul on Vince Banchero. Russell Simons to the line for 2 free throws. [Team fouls: 2] (Vince Banchero: 1 personal fouls)   FT 1/2: GOOD   FT 2/2: GOOD Russell Simons makes 2/2 from the line.
Score: 62-31

[10:07] Team_017 possession (Score: 62-31)
Kyrie Middleton loses control! Ball rolls out of bounds! TURNOVER! (dead ball)

[09:54] Team_064 possession (Score: 62-31)
Jordan Mitchell attempts a Midrange. Contested by Vince Banchero (3.6 feet, MAN). Jordan Mitchell misses. Offensive rebound by Russell Simons! Russell Simons kicks it out.

[09:41] Team_064 possession (Score: 62-31)
Shai Hyland makes the Layup and draws the foul on Bam Williamson! And-1! Shai Hyland to the line for 1. [Team fouls: 3] (Bam Williamson: 2 personal fouls)   FT 1/1: GOOD Shai Hyland makes 1/1 from the line.
Score: 65-31

[09:31] Team_017 possession (Score: 65-31)
Tony Smith drives and kicks out. Desmond Reaves attempts a 3Pt. Contested by Ja Mitchell (5.1 feet, MAN). DESMOND REAVES MAKES IT! Assist: Tony Smith
Score: 65-34

[09:19] Team_064 possession (Score: 65-34)
Ja Mitchell drives, picks up Desmond Reaves. Help arrives from Tony Smith! Ja Mitchell attempts a Layup. Contested by Tony Smith (4.3 feet, MAN). JA MITCHELL MAKES IT!
Score: 67-34

[09:01] Team_017 possession (Score: 67-34)
Desmond Reaves attempts a 3Pt. Contested by Ja Mitchell (5.6 feet, MAN). DESMOND REAVES MAKES IT! Assist: Vince Banchero
Score: 67-37

[08:43] Team_064 possession (Score: 67-37)
Kawhi Irving attempts a Midrange. Contested by Tony Smith (2.6 feet, MAN). KAWHI IRVING MAKES IT!
Score: 69-37

[08:32] Team_017 possession (Score: 69-37)
Bam Williamson attempts a Midrange. Contested by Russell Simons (4.0 feet, ZONE). BAM WILLIAMSON MAKES IT! Assist: Tony Smith
Score: 69-39

[08:14] Team_064 possession (Score: 69-39)
Kawhi Irving attempts a Layup. Contested by Bam Williamson (3.9 feet, ZONE). KAWHI IRVING MAKES IT! Assist: Ja Mitchell
Score: 71-39

[07:57] Team_017 possession (Score: 71-39)
Desmond Reaves attempts a 3Pt. Contested by Ja Mitchell (5.6 feet, MAN). DESMOND REAVES MAKES IT! Assist: Kyrie Middleton
Score: 71-42

[07:44] Team_064 possession (Score: 71-42)
Ja Mitchell attempts a Layup. Contested by Bam Williamson (4.3 feet, ZONE). Ja Mitchell misses. Rebound secured by Kyrie Middleton.

[07:34] Team_017 possession (Score: 71-42)
Desmond Reaves drives and kicks out. Desmond Reaves attempts a Midrange. Contested by Ja Mitchell (5.1 feet, MAN). DESMOND REAVES MAKES IT!
Score: 71-44

[07:18] Team_064 possession (Score: 71-44)
Shai Hyland attempts a Midrange. Contested by Tony Smith (3.1 feet, ZONE). Shai Hyland misses. Rebound secured by Kyrie Middleton.

[07:02] Team_017 possession (Score: 71-44)
Tony Smith attempts a 3Pt. Contested by Kawhi Irving (4.9 feet, MAN). Tony Smith misses. Rebound secured by Shai Hyland.

[06:48] Team_064 possession (Score: 71-44)
Jordan Mitchell makes the Layup and draws the foul on Vince Banchero! And-1! Jordan Mitchell to the line for 1. [Team fouls: 4] (Vince Banchero: 2 personal fouls)   FT 1/1: GOOD Jordan Mitchell makes 1/1 from the line.
Score: 74-44

[06:32] Team_017 possession (Score: 74-44)
Tony Smith attempts a 3Pt. Contested by Kawhi Irving (4.9 feet, MAN). Tony Smith misses. Rebound secured by Kawhi Irving.

[06:16] Team_064 possession (Score: 74-44)
Ja Mitchell attempts a 3Pt. Contested by Desmond Reaves (4.3 feet, ZONE). JA MITCHELL MAKES IT! Assist: Jordan Mitchell
Score: 77-44

[06:03] Team_017 possession (Score: 77-44)
Vince Banchero drives, Russell Simons stays with him. Vince Banchero attempts a Dunk. Contested by Russell Simons (3.2 feet, ZONE). Vince Banchero misses. Rebound secured by Kawhi Irving.

[05:50] Team_064 possession (Score: 77-44)
Jordan Mitchell attempts a 3Pt. Contested by Vince Banchero (3.6 feet, MAN). Jordan Mitchell misses. Rebound secured by Bam Williamson.

[05:36] Team_017 possession (Score: 77-44)
Bam Williamson drives to the basket... Bam Williamson commits a violation (traveling/carry)! TURNOVER! (dead ball)

[05:16] Team_064 possession (Score: 77-44)
Ja Mitchell attempts a Midrange. Contested by Desmond Reaves (4.3 feet, MAN). Ja Mitchell misses. Rebound secured by Bam Williamson.

[05:02] Team_017 possession (Score: 77-44)
Bam Williamson drives, Shai Hyland stays with him. Bam Williamson attempts a Dunk. Contested by Shai Hyland (5.8 feet, MAN). BAM WILLIAMSON MAKES IT!
Score: 77-46

[04:49] Team_064 possession (Score: 77-46)
Jordan Mitchell attempts a Layup. Contested by Vince Banchero (3.6 feet, MAN). Jordan Mitchell misses. Offensive rebound by Kawhi Irving! Kawhi Irving kicks it out.

[04:36] Team_064 possession (Score: 77-46)
Kawhi Irving throws a bad pass! Stolen by Tony Smith! TURNOVER! (live ball)

[04:25] Team_017 possession (Score: 77-46)
Tony Smith attempts a Midrange. Contested by Kawhi Irving (5.0 feet, MAN). Tony Smith misses. Offensive rebound by Bam Williamson! Bam Williamson puts it back in!
Score: 77-48

[04:12] Team_064 possession (Score: 77-48)
Kawhi Irving makes the 3Pt and draws the foul on Tony Smith! And-1! Kawhi Irving to the line for 1. [BONUS: 5 team fouls] (Tony Smith: 1 personal fouls)   FT 1/1: GOOD Kawhi Irving makes 1/1 from the line.
Score: 81-48

[03:59] Team_017 possession (Score: 81-48)
Vince Banchero loses the ball! Stripped by Jordan Mitchell! TURNOVER! (live ball)

[03:43] Team_064 possession (Score: 81-48)
Kawhi Irving drives, Tony Smith stays with him. Kawhi Irving attempts a Dunk. Contested by Tony Smith (2.8 feet, MAN). Kawhi Irving misses. Rebound secured by Tony Smith.

[03:25] Team_017 possession (Score: 81-48)
Vince Banchero attempts a Midrange. Contested by Russell Simons (3.5 feet, ZONE). VINCE BANCHERO MAKES IT! Assist: Desmond Reaves
Score: 81-50

[03:11] Team_064 possession (Score: 81-50)
Shai Hyland attempts a Layup. Contested by Bam Williamson (4.6 feet, ZONE). SHAI HYLAND MAKES IT! Assist: Russell Simons
Score: 83-50

[02:56] Team_017 possession (Score: 83-50)
Vince Banchero attempts a Midrange. Contested by Jordan Mitchell (4.1 feet, MAN). Vince Banchero misses. Rebound secured by Shai Hyland.

[02:46] Team_064 possession (Score: 83-50)
FOUL! Reach-in foul on Tony Smith during the drive. [IN THE BONUS! 6 team fouls] Kawhi Irving to the line for 2 free throws. (Tony Smith: 2 personal fouls)   FT 1/2: GOOD   FT 2/2: MISS Kawhi Irving makes 1/2 from the line. Offensive rebound by Kawhi Irving! Kawhi Irving kicks it out.
Score: 84-50

[02:30] Team_064 possession (Score: 84-50)
Jordan Mitchell attempts a Layup. Contested by Vince Banchero (3.8 feet, MAN). JORDAN MITCHELL MAKES IT!
Score: 86-50

[02:16] Team_017 possession (Score: 86-50)
Bam Williamson drives to the basket... Bam Williamson throws a bad pass out of bounds! TURNOVER! (dead ball)

[02:16] Substitution (Team_064): Ja Mitchell OUT → CJ Haliburton IN (stamina_rule2)

[02:16] Substitution (Team_064): Jordan Mitchell OUT → Ja Simmons IN (stamina_rule2)

[02:16] Substitution (Team_064): Kawhi Irving OUT → Tobias Herro IN (stamina_rule2)

[02:16] Substitution (Team_064): Russell Simons OUT → Austin Smith IN (stamina_rule2)

[02:16] Substitution (Team_064): Shai Hyland OUT → Devin Cunningham IN (stamina_rule2)

[02:16] Substitution (Team_017): Desmond Reaves OUT → Blake Reaves IN (stamina_rule2)

[02:16] Substitution (Team_017): Vince Banchero OUT → Tobias Bridges IN (stamina_rule2)

[02:16] Substitution (Team_017): Tony Smith OUT → Shaquille Stewart IN (stamina_rule2)

[02:16] Substitution (Team_017): Kyrie Middleton OUT → Ja Stewart IN (stamina_rule2)

[02:16] Substitution (Team_017): Bam Williamson OUT → Klay Holiday IN (stamina_rule2)

[01:57] Team_064 possession (Score: 86-50)
Austin Smith attempts a 3Pt. Contested by Ja Stewart (4.3 feet, MAN). Austin Smith misses. Rebound secured by Shaquille Stewart.

[01:43] Team_017 possession (Score: 86-50)
FOUL! Holding foul on Austin Smith. [Team fouls: 1] No free throws, side out. (Austin Smith: 1 personal fouls)

[01:25] Team_017 possession (Score: 86-50)
Shaquille Stewart attempts a 3Pt. Wide open! Tobias Herro is 6.4 feet away. [MAN] Shaquille Stewart misses. Rebound secured by Devin Cunningham.

[01:14] Team_064 possession (Score: 86-50)
Ja Simmons throws a bad pass out of bounds! TURNOVER! (dead ball)

[01:01] Team_017 possession (Score: 86-50)
Ja Stewart attempts a 3Pt. Contested by Austin Smith (4.2 feet, ZONE). Ja Stewart misses. Rebound secured by Ja Simmons.

[00:44] Team_064 possession (Score: 86-50)
Tobias Herro attempts a 3Pt. Contested by Tobias Bridges (3.5 feet, ZONE). Tobias Herro misses. Offensive rebound by Austin Smith! Austin Smith kicks it out.

[00:31] Team_064 possession (Score: 86-50)
Tobias Herro drives to the basket... Tobias Herro loses the ball! Stripped by Ja Stewart! TURNOVER! (live ball)

[00:15] Team_017 possession (Score: 86-50)
Blake Reaves throws a bad pass out of bounds! TURNOVER! (dead ball)

[00:02] Team_064 possession (Score: 86-50)
FOUL! Shooting foul on Klay Holiday. CJ Haliburton to the line for 2 free throws. [BONUS: 7 team fouls] (Klay Holiday: 1 personal fouls)   FT 1/2: GOOD   FT 2/2: MISS CJ Haliburton makes 1/2 from the line. FOUL! Loose ball foul on Ja Stewart during the free throw rebound! [IN THE BONUS! 8 team fouls] Austin Smith to the line for 2 free throws. (Ja Stewart: 1 personal fouls)   FT 1/2: GOOD   FT 2/2: GOOD Austin Smith makes 2/2 from the line.
Score: 89-50

================================================================================
                              3RD QUARTER COMPLETE                              
================================================================================

3RD QUARTER SCORE: Team_064 37, Team_017 19

BOX SCORE:
================================================================================

Team_064
--------------------------------------------------------------------------------
Player                MIN  PTS  REB  AST  TO      FG   FG%      3P   3P%
--------------------------------------------------------------------------------
Shai Hyland            28   10    2    0   0   4/5    80.0     0/0   0.0
Jordan Mitchell        28    8    0    1   0   3/4    75.0     0/0   0.0
Kawhi Irving           28    8    6    0   0   3/4    75.0     0/0   0.0
Ja Mitchell            28    5    0    3   0   2/4    50.0     0/0   0.0
Austin Smith            9    3    1    0   0   1/2    50.0     0/0   0.0
Russell Simons         28    2    2    1   0   1/1   100.0     0/0   0.0
Devin Cunningham        9    0    1    0   0   0/0     0.0     0/0   0.0
Ja Simmons              9    0    1    0   0   0/0     0.0     0/0   0.0

TEAM: FG: 14/20 (70.0%), 3PT: 2/4 (50.0%), REB: 13 (5 off, 8 def), AST: 5, TO: 3
TEAM FOULS: 1


Team_017
--------------------------------------------------------------------------------
Player                MIN  PTS  REB  AST  TO      FG   FG%      3P   3P%
--------------------------------------------------------------------------------
Desmond Reaves         28   11    0    1   0   4/4   100.0     0/0   0.0
Bam Williamson         28    6    3    0   0   3/3   100.0     0/0   0.0
Vince Banchero         28    2    0    1   0   1/5    20.0     0/0   0.0
Tony Smith             28    0    1    2   0   0/2     0.0     0/0   0.0
Kyrie Middleton        28    0    2    1   0   0/0     0.0     0/0   0.0
Shaquille Stewart       8    0    1    0   0   0/1     0.0     0/0   0.0
Ja Stewart              9    0    0    0   0   0/1     0.0     0/0   0.0

TEAM: FG: 8/16 (50.0%), 3PT: 2/7 (28.6%), REB: 7 (1 off, 6 def), AST: 5, TO: 6
TEAM FOULS: 8 [Team_064 in BONUS]

================================================================================

================================================================================
                       4TH QUARTER - Team_064 vs Team_017                       
================================================================================

[12:00] Team_064 possession (Score: 89-50)
Russell Simons attempts a Midrange. Contested by Vince Banchero (4.2 feet, ZONE). RUSSELL SIMONS MAKES IT!
Score: 91-50

[11:49] Team_017 possession (Score: 91-50)
Kyrie Middleton attempts a Midrange. Contested by Russell Simons (3.7 feet, ZONE). Kyrie Middleton misses. Rebound secured by Kawhi Irving.

[11:37] Team_064 possession (Score: 91-50)
Shai Hyland makes the Layup and draws the foul on Kyrie Middleton! And-1! Shai Hyland to the line for 1. [Team fouls: 1] (Kyrie Middleton: 1 personal fouls)   FT 1/1: GOOD Shai Hyland makes 1/1 from the line.
Score: 94-50

[11:25] Team_017 possession (Score: 94-50)
Desmond Reaves attempts a 3Pt. Contested by Ja Mitchell (5.7 feet, MAN). Desmond Reaves misses. Rebound secured by Shai Hyland.

[11:08] Team_064 possession (Score: 94-50)
Kawhi Irving attempts a 3Pt. Contested by Kyrie Middleton (5.0 feet, ZONE). KAWHI IRVING MAKES IT! Assist: Ja Mitchell
Score: 97-50

[10:59] Team_017 possession (Score: 97-50)
Desmond Reaves drives and kicks out. Tony Smith attempts a 3Pt. Contested by Kawhi Irving (4.4 feet, MAN). Tony Smith misses. Rebound secured by Russell Simons.

[10:49] Team_064 possession (Score: 97-50)
Jordan Mitchell attempts a 3Pt. Contested by Tony Smith (2.4 feet, ZONE). Jordan Mitchell misses. Rebound secured by Tony Smith.

[10:35] Team_017 possession (Score: 97-50)
Kyrie Middleton attempts a Layup. BLOCKED BY JORDAN MITCHELL! Ball deflects out of bounds off Kyrie Middleton.

[10:19] Team_064 possession (Score: 97-50)
Shai Hyland attempts a Midrange. Contested by Bam Williamson (4.6 feet, MAN). SHAI HYLAND MAKES IT! Assist: Ja Mitchell
Score: 99-50

[10:02] Team_017 possession (Score: 99-50)
Vince Banchero attempts a Layup. Contested by Shai Hyland (5.2 feet, ZONE). VINCE BANCHERO MAKES IT!
Score: 99-52

[09:48] Team_064 possession (Score: 99-52)
FOUL! Shooting foul on Desmond Reaves. Ja Mitchell to the line for 3 free throws. [Team fouls: 2] (Desmond Reaves: 1 personal fouls)   FT 1/3: MISS   FT 2/3: GOOD   FT 3/3: GOOD Ja Mitchell makes 2/3 from the line.
Score: 101-52

[09:34] Team_017 possession (Score: 101-52)
FOUL! Reach-in foul on Russell Simons during the drive. [Team fouls: 1] No free throws, side out. (Russell Simons: 1 personal fouls)

[09:19] Team_017 possession (Score: 101-52)
Vince Banchero throws a bad pass! Stolen by Jordan Mitchell! TURNOVER! (live ball)

[09:03] Team_064 possession (Score: 101-52)
Jordan Mitchell drives, Kyrie Middleton stays with him. Jordan Mitchell attempts a Layup. Contested by Kyrie Middleton (4.8 feet, ZONE). JORDAN MITCHELL MAKES IT! Assist: Russell Simons
Score: 103-52

[08:46] Team_017 possession (Score: 103-52)
FOUL! Reach-in foul on Russell Simons during the drive. [Team fouls: 2] No free throws, side out. (Russell Simons: 2 personal fouls)

[08:27] Team_017 possession (Score: 103-52)
Desmond Reaves attempts a 3Pt. Contested by Ja Mitchell (5.9 feet, ZONE). Desmond Reaves misses. Rebound secured by Kawhi Irving.

[08:13] Team_064 possession (Score: 103-52)
Jordan Mitchell loses control! Ball rolls out of bounds! TURNOVER! (dead ball)

[08:13] Substitution (Team_064): Ja Mitchell OUT → CJ Haliburton IN (stamina_rule2)

[08:13] Substitution (Team_064): Jordan Mitchell OUT → Ja Simmons IN (stamina_rule2)

[08:13] Substitution (Team_064): Kawhi Irving OUT → Tobias Herro IN (stamina_rule2)

[08:13] Substitution (Team_064): Russell Simons OUT → Austin Smith IN (stamina_rule2)

[08:13] Substitution (Team_064): Shai Hyland OUT → Devin Cunningham IN (stamina_rule2)

[08:13] Substitution (Team_017): Desmond Reaves OUT → Blake Reaves IN (stamina_rule2)

[08:13] Substitution (Team_017): Vince Banchero OUT → Tobias Bridges IN (stamina_rule2)

[08:13] Substitution (Team_017): Tony Smith OUT → Shaquille Stewart IN (stamina_rule2)

[08:13] Substitution (Team_017): Kyrie Middleton OUT → Ja Stewart IN (stamina_rule2)

[08:13] Substitution (Team_017): Bam Williamson OUT → Klay Holiday IN (stamina_rule2)

[08:01] Team_017 possession (Score: 103-52)
Tobias Bridges attempts a Midrange. Contested by Ja Simmons (5.7 feet, MAN). Tobias Bridges misses. Rebound secured by Ja Simmons.

[07:51] Team_064 possession (Score: 103-52)
Austin Smith drives and kicks out. CJ Haliburton attempts a 3Pt. Contested by Tobias Bridges (4.0 feet, ZONE). CJ Haliburton misses. Rebound secured by Klay Holiday.

[07:38] Team_017 possession (Score: 103-52)
Blake Reaves attempts a 3Pt. Contested by CJ Haliburton (5.9 feet, MAN). Blake Reaves misses. Rebound secured by Ja Simmons.

[07:22] Team_064 possession (Score: 103-52)
FOUL! Holding foul on Blake Reaves. [Team fouls: 3] No free throws, side out. (Blake Reaves: 1 personal fouls)

[07:04] Team_064 possession (Score: 103-52)
Devin Cunningham makes the Layup and draws the foul on Ja Stewart! And-1! Devin Cunningham to the line for 1. [Team fouls: 4] (Ja Stewart: 1 personal fouls)   FT 1/1: GOOD Devin Cunningham makes 1/1 from the line.
Score: 106-52

[06:50] Team_017 possession (Score: 106-52)
Tobias Bridges drives, picks up Ja Simmons. Help arrives from Tobias Herro! Tobias Bridges attempts a Dunk. Contested by Tobias Herro (5.7 feet, MAN). TOBIAS BRIDGES MAKES IT! Assist: Ja Stewart
Score: 106-54

[06:34] Team_064 possession (Score: 106-54)
CJ Haliburton drives, Ja Stewart stays with him. CJ Haliburton attempts a Dunk. Contested by Ja Stewart (5.0 feet, ZONE). CJ HALIBURTON MAKES IT! Assist: Tobias Herro
Score: 108-54

[06:23] Team_017 possession (Score: 108-54)
Klay Holiday attempts a Layup. Contested by Austin Smith (4.8 feet, ZONE). Klay Holiday misses. Rebound secured by Ja Simmons.

[06:06] Team_064 possession (Score: 108-54)
Devin Cunningham drives to the basket... Devin Cunningham throws a bad pass out of bounds! TURNOVER! (dead ball)

[05:52] Team_017 possession (Score: 108-54)
Tobias Bridges attempts a Layup. BLOCKED BY JA SIMMONS! Ball is loose! Rebound secured by Ja Simmons.

[05:37] Team_064 possession (Score: 108-54)
Tobias Herro attempts a 3Pt. Contested by Tobias Bridges (3.5 feet, ZONE). Tobias Herro misses. Offensive rebound by Ja Simmons! Ja Simmons kicks it out.

[05:18] Team_064 possession (Score: 108-54)
Austin Smith drives, Ja Stewart stays with him. Austin Smith attempts a Dunk. Contested by Ja Stewart (4.3 feet, MAN). AUSTIN SMITH MAKES IT!
Score: 110-54

[04:59] Team_017 possession (Score: 110-54)
Shaquille Stewart attempts a Midrange. Contested by Austin Smith (4.9 feet, ZONE). SHAQUILLE STEWART MAKES IT! Assist: Blake Reaves
Score: 110-56

[04:44] Team_064 possession (Score: 110-56)
Ja Simmons attempts a Layup. BLOCKED BY JA STEWART! Ball goes out off Ja Stewart. Ja Simmons's ball!

[04:31] Team_064 possession (Score: 110-56)
CJ Haliburton attempts a Midrange. Contested by Blake Reaves (5.5 feet, MAN). CJ Haliburton misses. Rebound secured by Klay Holiday.

[04:17] Team_017 possession (Score: 110-56)
Tobias Bridges attempts a Midrange. Wide open! Tobias Herro is 6.1 feet away. [ZONE] Tobias Bridges misses. Rebound secured by Ja Simmons.

[04:02] Team_064 possession (Score: 110-56)
Tobias Herro attempts a Layup. Contested by Shaquille Stewart (3.9 feet, MAN). Tobias Herro misses. Rebound secured by Ja Stewart.

[03:51] Team_017 possession (Score: 110-56)
Shaquille Stewart attempts a 3Pt. Wide open! Tobias Herro is 6.4 feet away. [MAN] SHAQUILLE STEWART MAKES IT! Assist: Tobias Bridges
Score: 110-59

[03:37] Team_064 possession (Score: 110-59)
CJ Haliburton drives to the basket... FOUL! Offensive foul on CJ Haliburton! Blake Reaves drew the charge! [Team fouls: 3] (CJ Haliburton: 1 personal fouls) TURNOVER! (dead ball)

[03:20] Team_017 possession (Score: 110-59)
Blake Reaves drives, Austin Smith stays with him. Blake Reaves attempts a Layup. Contested by Austin Smith (4.5 feet, ZONE). BLAKE REAVES MAKES IT! Assist: Klay Holiday
Score: 110-61

[03:05] Team_064 possession (Score: 110-61)
CJ Haliburton throws a bad pass out of bounds! TURNOVER! (dead ball)

[02:50] Team_017 possession (Score: 110-61)
Shaquille Stewart attempts a Layup. Contested by Austin Smith (4.9 feet, ZONE). SHAQUILLE STEWART MAKES IT! Assist: Tobias Bridges
Score: 110-63

[02:37] Team_064 possession (Score: 110-63)
Devin Cunningham drives, picks up Ja Stewart. Help arrives from Tobias Bridges! Devin Cunningham attempts a Layup. Contested by Tobias Bridges (4.6 feet, ZONE). Devin Cunningham misses. Rebound secured by Ja Stewart.

[02:25] Team_017 possession (Score: 110-63)
Ja Stewart attempts a Midrange. Contested by Austin Smith (4.2 feet, MAN). Ja Stewart misses. Rebound secured by Austin Smith.

[02:08] Team_064 possession (Score: 110-63)
CJ Haliburton throws a bad pass! Stolen by Blake Reaves! TURNOVER! (live ball)

[01:57] Team_017 possession (Score: 110-63)
Klay Holiday drives to the basket... Klay Holiday throws a bad pass! Stolen by Devin Cunningham! TURNOVER! (live ball)

[01:43] Team_064 possession (Score: 110-63)
CJ Haliburton attempts a 3Pt. Contested by Blake Reaves (5.6 feet, MAN). CJ Haliburton misses. Rebound secured by Shaquille Stewart.

[01:32] Team_017 possession (Score: 110-63)
Klay Holiday drives to the basket... Klay Holiday commits a violation (traveling/carry)! TURNOVER! (dead ball)

[01:18] Team_064 possession (Score: 110-63)
Tobias Herro attempts a Layup. Contested by Shaquille Stewart (4.0 feet, MAN). TOBIAS HERRO MAKES IT! Assist: Devin Cunningham
Score: 112-63

[01:04] Team_017 possession (Score: 112-63)
Klay Holiday attempts a Layup. Contested by Austin Smith (4.9 feet, ZONE). KLAY HOLIDAY MAKES IT! Assist: Blake Reaves
Score: 112-65

[00:47] Team_064 possession (Score: 112-65)
CJ Haliburton drives and kicks out. Devin Cunningham attempts a Midrange. Contested by Klay Holiday (5.3 feet, MAN). Devin Cunningham misses. Rebound secured by Ja Stewart.

[00:27] Team_017 possession (Score: 112-65)
Tobias Bridges loses the ball! Stripped by Ja Simmons! TURNOVER! (live ball)

[00:09] Team_064 possession (Score: 112-65)
CJ Haliburton throws a bad pass out of bounds! TURNOVER! (dead ball)

================================================================================
                              4TH QUARTER COMPLETE                              
================================================================================

4TH QUARTER SCORE: Team_064 23, Team_017 15

BOX SCORE:
================================================================================

Team_064
--------------------------------------------------------------------------------
Player                MIN  PTS  REB  AST  TO      FG   FG%      3P   3P%
--------------------------------------------------------------------------------
Shai Hyland            32    5    1    0   0   2/2   100.0     0/0   0.0
Kawhi Irving           32    3    2    0   0   1/1   100.0     0/0   0.0
Devin Cunningham       17    3    0    1   0   1/2    50.0     0/0   0.0
Russell Simons         32    2    1    1   0   1/1   100.0     0/0   0.0
Ja Mitchell            32    2    0    2   0   1/1   100.0     0/0   0.0
Jordan Mitchell        32    2    0    0   0   1/2    50.0     0/0   0.0
Austin Smith           17    2    1    0   0   1/2    50.0     0/0   0.0
CJ Haliburton          17    2    0    0   0   1/4    25.0     0/0   0.0
Tobias Herro           17    2    0    1   0   1/2    50.0     0/0   0.0
Ja Simmons             17    0    6    0   0   0/0     0.0     0/0   0.0

TEAM: FG: 10/17 (58.8%), 3PT: 2/4 (50.0%), REB: 11 (1 off, 10 def), AST: 5, TO: 6
TEAM FOULS: 3


Team_017
--------------------------------------------------------------------------------
Player                MIN  PTS  REB  AST  TO      FG   FG%      3P   3P%
--------------------------------------------------------------------------------
Shaquille Stewart      16    7    1    0   0   3/3   100.0     0/0   0.0
Vince Banchero         32    2    0    0   0   1/1   100.0     0/0   0.0
Tobias Bridges         16    2    0    2   0   1/4    25.0     0/0   0.0
Klay Holiday           17    2    2    1   0   1/2    50.0     0/0   0.0
Blake Reaves           17    2    0    2   0   1/2    50.0     0/0   0.0
Kyrie Middleton        32    0    0    0   0   0/2     0.0     0/0   0.0
Desmond Reaves         32    0    0    0   0   0/3     0.0     0/0   0.0
Tony Smith             32    0    1    0   0   0/0     0.0     0/0   0.0
Ja Stewart             17    0    3    1   0   0/1     0.0     0/0   0.0

TEAM: FG: 7/18 (38.9%), 3PT: 1/4 (25.0%), REB: 7 (0 off, 7 def), AST: 6, TO: 4
TEAM FOULS: 4

================================================================================

================================================================================
                               FULL GAME COMPLETE                               
================================================================================

FINAL SCORE: Team_064 112, Team_017 65

SCORING BY QUARTER:
--------------------------------------------------------------------------------
Team                     Q1     Q2     Q3     Q4    FINAL
--------------------------------------------------------------------------------
Team_064                 36     16     37     23      112
Team_017                 12     19     19     15       65
--------------------------------------------------------------------------------

FULL GAME BOX SCORE:
================================================================================

Team_064
--------------------------------------------------------------------------------
Player                MIN  PTS  REB  AST  TO      FG   FG%      3P   3P%      FT STL BLK
--------------------------------------------------------------------------------
Ja Mitchell            32   17    0    7   2   8/11   72.7   2/3    66.7   6/7     1   0
Jordan Mitchell        32   22    1    2   3   7/12   58.3   2/5    40.0   3/4     2   1
Kawhi Irving           32   16   17    1   2   6/7    85.7   2/2   100.0   3/4     1   0
Russell Simons         32   10    9    3   1   4/6    66.7   0/1     0.0   4/4     0   0
Shai Hyland            32   23    6    1   0   9/13   69.2   1/2    50.0   4/5     1   0
CJ Haliburton          17    2    0    0   5   2/7    28.6   0/2     0.0   1/2     0   0
Ja Simmons             17    4   12    0   1   1/2    50.0   0/0     0.0   2/2     2   1
Tobias Herro           17    2    0    1   3   1/3    33.3   0/0     0.0   0/0     0   0
Austin Smith           17    5    2    0   1   1/4    25.0   0/2     0.0   0/0     0   0
Devin Cunningham       17    6    1    1   1   3/4    75.0   0/0     0.0   2/2     2   0

TEAM: FG: 42/69 (60.9%), 3PT: 7/17 (41.2%), REB: 48 (12 off, 36 def), AST: 16, TO: 19


Team_017
--------------------------------------------------------------------------------
Player                MIN  PTS  REB  AST  TO      FG   FG%      3P   3P%      FT STL BLK
--------------------------------------------------------------------------------
Vince Banchero         32   10    0    1   2   6/13   46.2   0/2     0.0   2/2     1   0
Tony Smith             32    5    8    2   4   4/8    50.0   1/5    20.0   0/0     2   0
Desmond Reaves         32   17    0    1   2   4/11   36.4   3/7    42.9   0/0     0   0
Kyrie Middleton        32    3    7    3   2   2/6    33.3   0/1     0.0   1/2     0   0
Bam Williamson         32   10    4    2   1   4/6    66.7   0/0     0.0   0/0     0   0
Blake Reaves           17    2    0    2   3   1/3    33.3   0/2     0.0   0/0     1   0
Ja Stewart             17    0    6    3   2   0/2     0.0   0/1     0.0   0/0     2   1
Klay Holiday           17    4    4    1   0   2/6    33.3   0/0     0.0   0/0     0   0
Tobias Bridges         16    2    0    2   2   1/5    20.0   0/1     0.0   0/0     0   0
Shaquille Stewart      16   12    5    1   1   5/6    83.3   2/3    66.7   0/0     0   0

TEAM: FG: 29/66 (43.9%), 3PT: 6/22 (27.3%), REB: 34 (7 off, 27 def), AST: 18, TO: 19

================================================================================
