================================================================================
                        FULL GAME - Team_021 vs Team_038                        
================================================================================

================================================================================
                       1ST QUARTER - Team_021 vs Team_038                       
================================================================================

[12:00] Team_021 possession (Score: 0-0)
FOUL! Shooting foul on DeMar Harris. Kyrie Leonard to the line for 3 free throws. [Team fouls: 1] (DeMar Harris: 1 personal fouls)   FT 1/3: GOOD   FT 2/3: GOOD   FT 3/3: MISS Kyrie Leonard makes 2/3 from the line. Rebound secured by DeMar Harris.
Score: 2-0

[11:48] Team_038 possession (Score: 2-0)
Tracy LaVine attempts a 3Pt. Contested by Kyrie Wagner (3.8 feet, MAN). TRACY LAVINE MAKES IT! Assist: Rudy Thompson
Score: 2-3

[11:36] Team_021 possession (Score: 2-3)
Karl Bridges throws a bad pass out of bounds! TURNOVER! (dead ball)

[11:19] Team_038 possession (Score: 2-3)
Tracy LaVine drives to the basket... Tracy LaVine throws a bad pass! Stolen by Kyrie Wagner! TURNOVER! (live ball)

[11:05] Team_021 possession (Score: 2-3)
Zach Carter attempts a 3Pt. Contested by Luka Barnes (4.7 feet, MAN). Zach Carter misses. Rebound secured by Tracy LaVine.

[10:47] Team_038 possession (Score: 2-3)
Malcolm Poole attempts a 3Pt. Contested by Anthony Oladipo (4.5 feet, MAN). Malcolm Poole misses. Offensive rebound by Luka Barnes! Luka Barnes kicks it out.

[10:32] Team_038 possession (Score: 2-3)
Tracy LaVine attempts a Midrange. Contested by Kyrie Wagner (3.8 feet, MAN). Tracy LaVine misses. Rebound secured by Anthony Oladipo.

[10:21] Team_021 possession (Score: 2-3)
Kyrie Wagner makes the Layup and draws the foul on Tracy LaVine! And-1! Kyrie Wagner to the line for 1. [Team fouls: 2] (Tracy LaVine: 1 personal fouls)   FT 1/1: GOOD Kyrie Wagner makes 1/1 from the line.
Score: 5-3

[10:06] Team_038 possession (Score: 5-3)
Malcolm Poole attempts a 3Pt. Contested by Kyrie Leonard (4.5 feet, ZONE). Malcolm Poole misses. Offensive rebound by Luka Barnes! Luka Barnes kicks it out.

[09:48] Team_038 possession (Score: 5-3)
FOUL! Reach-in foul on Karl Bridges during the drive. [Team fouls: 1] No free throws, side out. (Karl Bridges: 1 personal fouls)

[09:34] Team_038 possession (Score: 5-3)
Luka Barnes makes the Midrange and draws the foul on Anthony Oladipo! And-1! Luka Barnes to the line for 1. [Team fouls: 2] (Anthony Oladipo: 1 personal fouls)   FT 1/1: GOOD Luka Barnes makes 1/1 from the line.
Score: 5-6

[09:17] Team_021 possession (Score: 5-6)
Zach Carter attempts a Midrange. Contested by Malcolm Poole (5.3 feet, ZONE). Zach Carter misses. Offensive rebound by Kyrie Leonard! Kyrie Leonard kicks it out.

[09:01] Team_021 possession (Score: 5-6)
Zach Carter drives to the basket... Zach Carter throws a bad pass! Stolen by Tracy LaVine! TURNOVER! (live ball)

[08:46] Team_038 possession (Score: 5-6)
Tracy LaVine attempts a 3Pt. Contested by Kyrie Wagner (3.8 feet, ZONE). Tracy LaVine misses. Offensive rebound by Tracy LaVine! Tracy LaVine puts it back in!
Score: 5-8

[08:31] Team_021 possession (Score: 5-8)
Kyrie Leonard attempts a Midrange. Contested by DeMar Harris (2.9 feet, ZONE). Kyrie Leonard misses. Rebound secured by Tracy LaVine.

[08:17] Team_038 possession (Score: 5-8)
Malcolm Poole attempts a 3Pt. Contested by Kyrie Wagner (3.9 feet, ZONE). Malcolm Poole misses. Rebound secured by Kyrie Leonard.

[08:00] Team_021 possession (Score: 5-8)
Kyrie Leonard drives to the basket... Kyrie Leonard throws a bad pass! Stolen by Rudy Thompson! TURNOVER! (live ball)

[07:41] Team_038 possession (Score: 5-8)
Rudy Thompson attempts a 3Pt. Contested by Kyrie Leonard (5.2 feet, MAN). Rudy Thompson misses. Offensive rebound by Luka Barnes! Luka Barnes kicks it out.

[07:28] Team_038 possession (Score: 5-8)
Tracy LaVine attempts a Layup. Contested by Zach Carter (3.9 feet, ZONE). TRACY LAVINE MAKES IT! Assist: DeMar Harris
Score: 5-10

[07:17] Team_021 possession (Score: 5-10)
Karl Bridges drives, Tracy LaVine stays with him. Karl Bridges attempts a Dunk. Contested by Tracy LaVine (3.7 feet, ZONE). KARL BRIDGES MAKES IT! Assist: Anthony Oladipo
Score: 7-10

[07:07] Team_038 possession (Score: 7-10)
Tracy LaVine drives and kicks out. Luka Barnes attempts a 3Pt. Contested by Zach Carter (4.0 feet, MAN). Luka Barnes misses. Offensive rebound by Luka Barnes! Luka Barnes kicks it out.

[06:54] Team_038 possession (Score: 7-10)
Tracy LaVine attempts a Midrange. Contested by Kyrie Wagner (3.8 feet, ZONE). Tracy LaVine misses. Rebound secured by Anthony Oladipo.

[06:34] Team_021 possession (Score: 7-10)
Kyrie Wagner drives and kicks out. Karl Bridges attempts a 3Pt. Contested by DeMar Harris (3.1 feet, MAN). KARL BRIDGES MAKES IT! Assist: Kyrie Wagner
Score: 10-10

[06:20] Team_038 possession (Score: 10-10)
Rudy Thompson attempts a 3Pt. Contested by Anthony Oladipo (5.2 feet, ZONE). RUDY THOMPSON MAKES IT! Assist: DeMar Harris
Score: 10-13

[06:06] Team_021 possession (Score: 10-13)
Kyrie Leonard drives to the basket... Kyrie Leonard throws a bad pass out of bounds! TURNOVER! (dead ball)

[05:51] Team_038 possession (Score: 10-13)
Rudy Thompson attempts a Midrange. Contested by Kyrie Leonard (5.2 feet, MAN). Rudy Thompson misses. Rebound secured by Zach Carter.

[05:40] Team_021 possession (Score: 10-13)
Kyrie Leonard attempts a Layup. BLOCKED BY TRACY LAVINE! Ball is loose! Rebound secured by Tracy LaVine.

[05:26] Team_038 possession (Score: 10-13)
Malcolm Poole loses control! Ball rolls out of bounds! TURNOVER! (dead ball)

[05:09] Team_021 possession (Score: 10-13)
Kyrie Wagner attempts a Layup. BLOCKED BY MALCOLM POOLE! Ball is loose! Offensive rebound by Kyrie Leonard! Kyrie Leonard kicks it out.

[04:57] Team_021 possession (Score: 10-13)
Karl Bridges attempts a Midrange. Contested by DeMar Harris (3.0 feet, MAN). Karl Bridges misses. Rebound secured by Luka Barnes.

[04:39] Team_038 possession (Score: 10-13)
Tracy LaVine attempts a 3Pt. Contested by Kyrie Wagner (3.9 feet, ZONE). TRACY LAVINE MAKES IT! Assist: DeMar Harris
Score: 10-16

[04:27] Team_021 possession (Score: 10-16)
Karl Bridges attempts a Midrange. Contested by DeMar Harris (3.1 feet, MAN). KARL BRIDGES MAKES IT!
Score: 12-16

[04:14] Team_038 possession (Score: 12-16)
Luka Barnes attempts a Midrange. Contested by Zach Carter (4.4 feet, MAN). LUKA BARNES MAKES IT! Assist: DeMar Harris
Score: 12-18

[04:00] Team_021 possession (Score: 12-18)
Kyrie Wagner drives to the basket... Kyrie Wagner throws a bad pass! Stolen by Tracy LaVine! TURNOVER! (live ball)

[03:47] Team_038 possession (Score: 12-18)
Malcolm Poole attempts a Midrange. Contested by Anthony Oladipo (4.6 feet, MAN). MALCOLM POOLE MAKES IT!
Score: 12-20

[03:35] Team_021 possession (Score: 12-20)
Kyrie Leonard attempts a Midrange. Contested by DeMar Harris (3.1 feet, ZONE). Kyrie Leonard misses. Offensive rebound by Kyrie Leonard! Kyrie Leonard kicks it out.

[03:21] Team_021 possession (Score: 12-20)
FOUL! Offensive foul on Kyrie Leonard! Rudy Thompson drew the charge! [Team fouls: 3] (Kyrie Leonard: 1 personal fouls) TURNOVER! (dead ball)

[03:07] Team_038 possession (Score: 12-20)
Tracy LaVine attempts a Midrange. Contested by Kyrie Wagner (4.0 feet, MAN). Tracy LaVine misses. FOUL! Loose ball foul on Anthony Oladipo during the rebound battle. [Team fouls: 4] No free throws, side out. (Anthony Oladipo: 2 personal fouls)

[02:57] Team_038 possession (Score: 12-20)
Malcolm Poole drives and kicks out. Luka Barnes attempts a 3Pt. Contested by Kyrie Wagner (4.2 feet, ZONE). Luka Barnes misses. Rebound secured by Zach Carter.

[02:44] Team_021 possession (Score: 12-20)
Zach Carter drives to the basket... Zach Carter loses the ball! Stripped by Tracy LaVine! TURNOVER! (live ball)

[02:32] Team_038 possession (Score: 12-20)
DeMar Harris drives, picks up Karl Bridges. Help arrives from Kyrie Leonard! DeMar Harris attempts a Layup. Wide open! Kyrie Leonard is 6.5 feet away. [MAN] DEMAR HARRIS MAKES IT! Assist: Tracy LaVine
Score: 12-22

[02:17] Team_021 possession (Score: 12-22)
FOUL! Shooting foul on Tracy LaVine. Karl Bridges to the line for 2 free throws. [Team fouls: 3] (Tracy LaVine: 2 personal fouls)   FT 1/2: MISS   FT 2/2: GOOD Karl Bridges makes 1/2 from the line.
Score: 13-22

[02:05] Team_038 possession (Score: 13-22)
Luka Barnes drives to the basket... Luka Barnes loses the ball! Stripped by Zach Carter! TURNOVER! (live ball)

[01:52] Team_021 possession (Score: 13-22)
FOUL! Shooting foul on Luka Barnes. Kyrie Wagner to the line for 2 free throws. [Team fouls: 4] (Luka Barnes: 1 personal fouls)   FT 1/2: GOOD   FT 2/2: GOOD Kyrie Wagner makes 2/2 from the line.
Score: 15-22

[01:41] Team_038 possession (Score: 15-22)
Tracy LaVine attempts a 3Pt. Contested by Kyrie Wagner (4.2 feet, MAN). Tracy LaVine misses. FOUL! Loose ball foul on Kyrie Leonard during the rebound battle. [IN THE BONUS! 5 team fouls] Tracy LaVine to the line for 2 free throws. (Kyrie Leonard: 2 personal fouls)   FT 1/2: GOOD   FT 2/2: GOOD Tracy LaVine makes 2/2 from the line.
Score: 15-24

[01:25] Team_021 possession (Score: 15-24)
Zach Carter attempts a Midrange. Contested by Tracy LaVine (4.7 feet, ZONE). Zach Carter misses. Rebound secured by DeMar Harris.

[01:14] Team_038 possession (Score: 15-24)
Rudy Thompson attempts a Layup. Contested by Kyrie Leonard (5.5 feet, MAN). RUDY THOMPSON MAKES IT!
Score: 15-26

[01:02] Team_021 possession (Score: 15-26)
Zach Carter attempts a 3Pt. Contested by DeMar Harris (4.0 feet, ZONE). Zach Carter misses. Rebound secured by Luka Barnes.

[00:46] Team_038 possession (Score: 15-26)
Luka Barnes drives, Zach Carter stays with him. Luka Barnes attempts a Dunk. Contested by Zach Carter (4.8 feet, ZONE). LUKA BARNES MAKES IT!
Score: 15-28

[00:33] Team_021 possession (Score: 15-28)
Kyrie Leonard attempts a 3Pt. Contested by DeMar Harris (3.5 feet, ZONE). Kyrie Leonard misses. Rebound secured by DeMar Harris.

[00:20] Team_038 possession (Score: 15-28)
FOUL! Holding foul on Anthony Oladipo. [IN THE BONUS! 6 team fouls] Malcolm Poole to the line for 2 free throws. (Anthony Oladipo: 3 personal fouls)   FT 1/2: GOOD   FT 2/2: GOOD Malcolm Poole makes 2/2 from the line.
Score: 15-30

[00:09] Team_021 possession (Score: 15-30)
Karl Bridges attempts a 3Pt. Contested by DeMar Harris (3.6 feet, MAN). Karl Bridges misses. Rebound secured by Tracy LaVine.

================================================================================
                              1ST QUARTER COMPLETE                              
================================================================================

1ST QUARTER SCORE: Team_021 15, Team_038 30

BOX SCORE:
================================================================================

Team_021
--------------------------------------------------------------------------------
Player                MIN  PTS  REB  AST  TO      FG   FG%      3P   3P%
--------------------------------------------------------------------------------
Karl Bridges           12    8    0    0   0   4/6    66.7     0/0   0.0
Kyrie Wagner           12    5    0    1   0   2/2   100.0     0/0   0.0
Kyrie Leonard          12    0    4    0   0   0/4     0.0     0/0   0.0
Zach Carter            12    0    2    0   0   0/3     0.0     0/0   0.0
Anthony Oladipo        12    0    2    1   0   0/0     0.0     0/0   0.0

TEAM: FG: 6/15 (40.0%), 3PT: 0/5 (0.0%), REB: 8 (3 off, 5 def), AST: 2, TO: 7
TEAM FOULS: 6 [Team_038 in BONUS]


Team_038
--------------------------------------------------------------------------------
Player                MIN  PTS  REB  AST  TO      FG   FG%      3P   3P%
--------------------------------------------------------------------------------
Tracy LaVine           12   12    6    1   0   5/7    71.4     0/0   0.0
Luka Barnes            12    7    6    0   0   3/3   100.0     0/0   0.0
Rudy Thompson          12    5    0    1   0   2/3    66.7     0/0   0.0
Malcolm Poole          12    4    0    0   0   2/4    50.0     0/0   0.0
DeMar Harris           12    2    3    4   0   1/1   100.0     0/0   0.0

TEAM: FG: 13/18 (72.2%), 3PT: 5/6 (83.3%), REB: 15 (6 off, 9 def), AST: 6, TO: 3
TEAM FOULS: 4

================================================================================

================================================================================
                       2ND QUARTER - Team_021 vs Team_038                       
================================================================================

[12:00] Team_021 possession (Score: 15-30)
Zach Carter drives, Luka Barnes stays with him. Zach Carter attempts a Layup. Contested by Luka Barnes (5.0 feet, MAN). ZACH CARTER MAKES IT! Assist: Kyrie Wagner
Score: 17-30

[11:44] Team_038 possession (Score: 17-30)
Tracy LaVine attempts a 3Pt. Contested by Anthony Oladipo (4.8 feet, ZONE). Tracy LaVine misses. Rebound secured by Zach Carter.

[11:25] Team_021 possession (Score: 17-30)
Zach Carter makes the Layup and draws the foul on Luka Barnes! And-1! Zach Carter to the line for 1. [Team fouls: 1] (Luka Barnes: 1 personal fouls)   FT 1/1: GOOD Zach Carter makes 1/1 from the line.
Score: 20-30

[11:14] Team_038 possession (Score: 20-30)
Rudy Thompson attempts a 3Pt. Contested by Kyrie Leonard (5.5 feet, MAN). RUDY THOMPSON MAKES IT! Assist: Luka Barnes
Score: 20-33

[11:02] Team_021 possession (Score: 20-33)
Karl Bridges drives and kicks out. Karl Bridges attempts a Midrange. Contested by DeMar Harris (3.7 feet, ZONE). KARL BRIDGES MAKES IT!
Score: 22-33

[10:51] Team_038 possession (Score: 22-33)
Luka Barnes attempts a 3Pt. Contested by Kyrie Wagner (4.8 feet, ZONE). LUKA BARNES MAKES IT! Assist: Malcolm Poole
Score: 22-36

[10:40] Team_021 possession (Score: 22-36)
Zach Carter attempts a Midrange. Contested by Luka Barnes (5.1 feet, MAN). Zach Carter misses. Rebound secured by Tracy LaVine.

[10:23] Team_038 possession (Score: 22-36)
DeMar Harris attempts a 3Pt. Wide open! Karl Bridges is 6.7 feet away. [MAN] DeMar Harris misses. Offensive rebound by Luka Barnes! Luka Barnes kicks it out.

[10:07] Team_038 possession (Score: 22-36)
Rudy Thompson attempts a 3Pt. Contested by Kyrie Leonard (5.6 feet, MAN). Rudy Thompson misses. Rebound secured by Kyrie Leonard.

[09:51] Team_021 possession (Score: 22-36)
Zach Carter attempts a 3Pt. Contested by DeMar Harris (4.1 feet, ZONE). ZACH CARTER MAKES IT! Assist: Karl Bridges
Score: 25-36

[09:33] Team_038 possession (Score: 25-36)
Malcolm Poole attempts a Midrange. Contested by Anthony Oladipo (5.1 feet, MAN). MALCOLM POOLE MAKES IT! Assist: Luka Barnes
Score: 25-38

[09:15] Team_021 possession (Score: 25-38)
Anthony Oladipo makes the Layup and draws the foul on Malcolm Poole! And-1! Anthony Oladipo to the line for 1. [Team fouls: 2] (Malcolm Poole: 1 personal fouls)   FT 1/1: GOOD Anthony Oladipo makes 1/1 from the line.
Score: 28-38

[08:58] Team_038 possession (Score: 28-38)
DeMar Harris drives, Karl Bridges stays with him. DeMar Harris attempts a Layup. Wide open! Karl Bridges is 6.8 feet away. [MAN] DeMar Harris misses. Rebound secured by Kyrie Leonard.

[08:46] Team_021 possession (Score: 28-38)
Kyrie Leonard drives and kicks out. Kyrie Wagner attempts a 3Pt. Contested by Tracy LaVine (4.7 feet, MAN). Kyrie Wagner misses. Offensive rebound by Kyrie Leonard! Kyrie Leonard kicks it out.

[08:35] Team_021 possession (Score: 28-38)
Kyrie Wagner drives, picks up Tracy LaVine. Help arrives from Malcolm Poole! Kyrie Wagner attempts a Dunk. Contested by Malcolm Poole (4.7 feet, ZONE). KYRIE WAGNER MAKES IT! Assist: Kyrie Leonard
Score: 30-38

[08:21] Team_038 possession (Score: 30-38)
FOUL! Shooting foul on Zach Carter. Rudy Thompson to the line for 2 free throws. [Team fouls: 1] (Zach Carter: 1 personal fouls)   FT 1/2: GOOD   FT 2/2: GOOD Rudy Thompson makes 2/2 from the line.
Score: 30-40

[08:09] Team_021 possession (Score: 30-40)
FOUL! Reach-in foul on Tracy LaVine during the drive. [Team fouls: 3] No free throws, side out. (Tracy LaVine: 1 personal fouls)

[07:56] Team_021 possession (Score: 30-40)
Kyrie Leonard attempts a 3Pt. Contested by Rudy Thompson (4.6 feet, MAN). KYRIE LEONARD MAKES IT! Assist: Kyrie Wagner
Score: 33-40

[07:45] Team_038 possession (Score: 33-40)
Tracy LaVine attempts a 3Pt. Contested by Kyrie Wagner (4.7 feet, MAN). Tracy LaVine misses. Rebound secured by Kyrie Leonard.

[07:34] Team_021 possession (Score: 33-40)
Kyrie Wagner drives, Tracy LaVine stays with him. Kyrie Wagner attempts a Dunk. Contested by Tracy LaVine (4.9 feet, ZONE). Kyrie Wagner misses. Rebound secured by DeMar Harris.

[07:20] Team_038 possession (Score: 33-40)
Malcolm Poole attempts a 3Pt. Contested by Anthony Oladipo (5.4 feet, MAN). Malcolm Poole misses. Rebound secured by Kyrie Leonard.

[07:03] Team_021 possession (Score: 33-40)
Kyrie Wagner attempts a 3Pt. Contested by Tracy LaVine (5.0 feet, MAN). Kyrie Wagner misses. Rebound secured by Tracy LaVine.

[06:49] Team_038 possession (Score: 33-40)
Rudy Thompson attempts a 3Pt. Contested by Kyrie Leonard (6.0 feet, MAN). Rudy Thompson misses. Rebound secured by Anthony Oladipo.

[06:37] Team_021 possession (Score: 33-40)
Kyrie Wagner attempts a Midrange. Contested by Malcolm Poole (5.7 feet, ZONE). Kyrie Wagner misses. Rebound secured by Luka Barnes.

[06:19] Team_038 possession (Score: 33-40)
Malcolm Poole attempts a 3Pt. Contested by Anthony Oladipo (5.5 feet, MAN). Malcolm Poole misses. Rebound secured by Zach Carter.

[06:06] Team_021 possession (Score: 33-40)
FOUL! Reach-in foul on Tracy LaVine during the drive. [Team fouls: 4] No free throws, side out. (Tracy LaVine: 2 personal fouls)

[05:53] Team_021 possession (Score: 33-40)
Zach Carter drives and kicks out. Kyrie Leonard attempts a 3Pt. Contested by DeMar Harris (4.6 feet, ZONE). Kyrie Leonard misses. Rebound secured by Tracy LaVine.

[05:38] Team_038 possession (Score: 33-40)
Luka Barnes drives to the basket... Luka Barnes loses the ball! Stripped by Zach Carter! TURNOVER! (live ball)

[05:25] Team_021 possession (Score: 33-40)
Karl Bridges drives, Tracy LaVine stays with him. Karl Bridges attempts a Dunk. Contested by Tracy LaVine (5.1 feet, ZONE). KARL BRIDGES MAKES IT! Assist: Anthony Oladipo
Score: 35-40

[05:08] Team_038 possession (Score: 35-40)
DeMar Harris attempts a 3Pt. Wide open! Karl Bridges is 7.1 feet away. [MAN] DeMar Harris misses. Rebound secured by Kyrie Leonard.

[04:56] Team_021 possession (Score: 35-40)
Zach Carter drives, Tracy LaVine stays with him. Zach Carter attempts a Layup. Contested by Tracy LaVine (5.6 feet, ZONE). Zach Carter misses. Offensive rebound by Zach Carter! Zach Carter kicks it out.

[04:45] Team_021 possession (Score: 35-40)
Zach Carter drives, Luka Barnes stays with him. Zach Carter attempts a Layup. Contested by Luka Barnes (5.9 feet, MAN). ZACH CARTER MAKES IT!
Score: 37-40

[04:32] Team_038 possession (Score: 37-40)
Rudy Thompson attempts a 3Pt. Wide open! Kyrie Leonard is 6.3 feet away. [MAN] Rudy Thompson misses. Offensive rebound by Tracy LaVine! Tracy LaVine kicks it out.

[04:15] Team_038 possession (Score: 37-40)
FOUL! Shooting foul on Kyrie Wagner. Tracy LaVine to the line for 2 free throws. [Team fouls: 2] (Kyrie Wagner: 1 personal fouls)   FT 1/2: GOOD   FT 2/2: MISS Tracy LaVine makes 1/2 from the line. Offensive rebound by Tracy LaVine! Tracy LaVine kicks it out.
Score: 37-41

[04:03] Team_038 possession (Score: 37-41)
Rudy Thompson attempts a Midrange. Contested by Kyrie Wagner (5.9 feet, ZONE). Rudy Thompson misses. Rebound secured by Anthony Oladipo.

[03:48] Team_021 possession (Score: 37-41)
Kyrie Leonard attempts a Midrange. Contested by Malcolm Poole (5.9 feet, ZONE). KYRIE LEONARD MAKES IT! Assist: Kyrie Wagner
Score: 39-41

[03:32] Team_038 possession (Score: 39-41)
DeMar Harris attempts a 3Pt. Wide open! Kyrie Wagner is 6.1 feet away. [ZONE] DEMAR HARRIS MAKES IT! Assist: Tracy LaVine
Score: 39-44

[03:18] Team_021 possession (Score: 39-44)
Karl Bridges attempts a 3Pt. Contested by DeMar Harris (4.8 feet, ZONE). Karl Bridges misses. Rebound secured by Luka Barnes.

[03:04] Team_038 possession (Score: 39-44)
Tracy LaVine attempts a Midrange. Contested by Kyrie Wagner (5.5 feet, MAN). Tracy LaVine misses. Rebound secured by Kyrie Leonard.

[02:48] Team_021 possession (Score: 39-44)
Kyrie Wagner throws a bad pass! Stolen by Tracy LaVine! TURNOVER! (live ball)

[02:31] Team_038 possession (Score: 39-44)
Luka Barnes makes the Layup and draws the foul on Kyrie Leonard! And-1! Luka Barnes to the line for 1. [Team fouls: 3] (Kyrie Leonard: 1 personal fouls)   FT 1/1: GOOD Luka Barnes makes 1/1 from the line.
Score: 39-47

[02:14] Team_021 possession (Score: 39-47)
Karl Bridges attempts a Midrange. Contested by Tracy LaVine (5.6 feet, ZONE). Karl Bridges misses. Rebound secured by DeMar Harris.

[01:59] Team_038 possession (Score: 39-47)
FOUL! Shooting foul on Zach Carter. Luka Barnes to the line for 2 free throws. [Team fouls: 4] (Zach Carter: 2 personal fouls)   FT 1/2: GOOD   FT 2/2: GOOD Luka Barnes makes 2/2 from the line.
Score: 39-49

[01:44] Team_021 possession (Score: 39-49)
Zach Carter attempts a Midrange. Wide open! Tracy LaVine is 6.1 feet away. [ZONE] ZACH CARTER MAKES IT!
Score: 41-49

[01:34] Team_038 possession (Score: 41-49)
Luka Barnes attempts a Midrange. Wide open! Zach Carter is 6.0 feet away. [MAN] Luka Barnes misses. Rebound secured by Kyrie Leonard.

[01:20] Team_021 possession (Score: 41-49)
Karl Bridges drives, DeMar Harris stays with him. Karl Bridges attempts a Layup. Contested by DeMar Harris (5.2 feet, MAN). Karl Bridges misses. Rebound secured by DeMar Harris.

[01:09] Team_038 possession (Score: 41-49)
Tracy LaVine drives and kicks out. Rudy Thompson attempts a 3Pt. Wide open! Anthony Oladipo is 6.5 feet away. [ZONE] RUDY THOMPSON MAKES IT!
Score: 41-52

[00:54] Team_021 possession (Score: 41-52)
Karl Bridges drives and kicks out. Karl Bridges attempts a 3Pt. Contested by DeMar Harris (5.6 feet, ZONE). Karl Bridges misses. Rebound secured by Luka Barnes.

[00:34] Team_038 possession (Score: 41-52)
DeMar Harris attempts a 3Pt. Wide open! Karl Bridges is 7.6 feet away. [MAN] DeMar Harris misses. Offensive rebound by Tracy LaVine! Tracy LaVine kicks it out.

[00:23] Team_038 possession (Score: 41-52)
Malcolm Poole attempts a 3Pt. Wide open! Anthony Oladipo is 6.3 feet away. [MAN] Malcolm Poole misses. Offensive rebound by Luka Barnes! Luka Barnes kicks it out.

[00:12] Team_038 possession (Score: 41-52)
Luka Barnes attempts a 3Pt. Wide open! Anthony Oladipo is 6.6 feet away. [ZONE] Luka Barnes misses. Rebound secured by Anthony Oladipo.

================================================================================
                              2ND QUARTER COMPLETE                              
================================================================================

2ND QUARTER SCORE: Team_021 26, Team_038 22

BOX SCORE:
================================================================================

Team_021
--------------------------------------------------------------------------------
Player                MIN  PTS  REB  AST  TO      FG   FG%      3P   3P%
--------------------------------------------------------------------------------
Zach Carter            24   12    3    0   0   5/7    71.4     0/0   0.0
Kyrie Leonard          24    5    8    1   0   2/2   100.0     0/0   0.0
Karl Bridges           24    4    0    1   0   2/6    33.3     0/0   0.0
Anthony Oladipo        24    3    3    1   0   1/1   100.0     0/0   0.0
Kyrie Wagner           24    2    0    3   0   1/4    25.0     0/0   0.0

TEAM: FG: 11/20 (55.0%), 3PT: 2/4 (50.0%), REB: 14 (2 off, 12 def), AST: 6, TO: 1
TEAM FOULS: 4


Team_038
--------------------------------------------------------------------------------
Player                MIN  PTS  REB  AST  TO      FG   FG%      3P   3P%
--------------------------------------------------------------------------------
Rudy Thompson          24    8    0    0   0   3/6    50.0     0/0   0.0
Luka Barnes            24    8    5    2   0   3/5    60.0     0/0   0.0
DeMar Harris           24    3    3    0   0   1/3    33.3     0/0   0.0
Malcolm Poole          24    2    0    1   0   1/3    33.3     0/0   0.0
Tracy LaVine           24    0    6    1   0   0/3     0.0     0/0   0.0

TEAM: FG: 8/20 (40.0%), 3PT: 3/11 (27.3%), REB: 14 (5 off, 9 def), AST: 4, TO: 1
TEAM FOULS: 4

================================================================================

================================================================================
                       3RD QUARTER - Team_021 vs Team_038                       
================================================================================

[12:00] Team_021 possession (Score: 41-52)
Zach Carter attempts a Layup. Contested by Tracy LaVine (4.3 feet, ZONE). ZACH CARTER MAKES IT! Assist: Kyrie Leonard
Score: 43-52

[11:44] Team_038 possession (Score: 43-52)
Malcolm Poole attempts a 3Pt. Contested by Kyrie Wagner (3.9 feet, ZONE). Malcolm Poole misses. Rebound secured by Kyrie Leonard.

[11:29] Team_021 possession (Score: 43-52)
Anthony Oladipo attempts a 3Pt. Contested by DeMar Harris (3.0 feet, ZONE). ANTHONY OLADIPO MAKES IT! Assist: Karl Bridges
Score: 46-52

[11:15] Team_038 possession (Score: 46-52)
DeMar Harris attempts a Midrange. Wide open! Karl Bridges is 6.3 feet away. [ZONE] DEMAR HARRIS MAKES IT! Assist: Malcolm Poole
Score: 46-54

[11:03] Team_021 possession (Score: 46-54)
Anthony Oladipo attempts a 3Pt. Contested by Malcolm Poole (4.8 feet, MAN). ANTHONY OLADIPO MAKES IT! Assist: Kyrie Wagner
Score: 49-54

[10:49] Team_038 possession (Score: 49-54)
Tracy LaVine attempts a 3Pt. Contested by Kyrie Wagner (3.8 feet, MAN). Tracy LaVine misses. Offensive rebound by Tracy LaVine! Tracy LaVine puts it back in!
Score: 49-56

[10:34] Team_021 possession (Score: 49-56)
FOUL! Shooting foul on Rudy Thompson. Kyrie Leonard to the line for 2 free throws. [Team fouls: 1] (Rudy Thompson: 1 personal fouls)   FT 1/2: GOOD   FT 2/2: GOOD Kyrie Leonard makes 2/2 from the line.
Score: 51-56

[10:18] Team_038 possession (Score: 51-56)
Luka Barnes drives to the basket... Luka Barnes loses the ball! Stripped by Zach Carter! TURNOVER! (live ball)

[10:05] Team_021 possession (Score: 51-56)
Anthony Oladipo makes the Dunk and draws the foul on Malcolm Poole! And-1! Anthony Oladipo to the line for 1. [Team fouls: 2] (Malcolm Poole: 1 personal fouls)   FT 1/1: GOOD Anthony Oladipo makes 1/1 from the line.
Score: 54-56

[09:50] Team_038 possession (Score: 54-56)
FOUL! Shooting foul on Zach Carter. Malcolm Poole to the line for 2 free throws. [Team fouls: 1] (Zach Carter: 1 personal fouls)   FT 1/2: GOOD   FT 2/2: GOOD Malcolm Poole makes 2/2 from the line.
Score: 54-58

[09:31] Team_021 possession (Score: 54-58)
Zach Carter attempts a Midrange. Contested by Malcolm Poole (5.3 feet, ZONE). Zach Carter misses. Rebound secured by DeMar Harris.

[09:17] Team_038 possession (Score: 54-58)
DeMar Harris attempts a 3Pt. Contested by Kyrie Wagner (4.8 feet, ZONE). DEMAR HARRIS MAKES IT!
Score: 54-61

[09:06] Team_021 possession (Score: 54-61)
Karl Bridges attempts a 3Pt. Contested by DeMar Harris (3.0 feet, MAN). KARL BRIDGES MAKES IT!
Score: 57-61

[08:53] Team_038 possession (Score: 57-61)
Malcolm Poole attempts a 3Pt. Contested by Anthony Oladipo (4.5 feet, MAN). Malcolm Poole misses. Offensive rebound by Tracy LaVine! Tracy LaVine's putback is no good. Offensive rebound by Luka Barnes! Luka Barnes kicks it out.

[08:36] Team_038 possession (Score: 57-61)
FOUL! Holding foul on Kyrie Leonard. [Team fouls: 3] No free throws, side out. (Kyrie Leonard: 2 personal fouls)

[08:24] Team_038 possession (Score: 57-61)
FOUL! Reach-in foul on Zach Carter during the drive. [Team fouls: 4] No free throws, side out. (Zach Carter: 2 personal fouls)

[08:08] Team_038 possession (Score: 57-61)
Rudy Thompson attempts a 3Pt. Contested by Anthony Oladipo (5.2 feet, ZONE). Rudy Thompson misses. Offensive rebound by Luka Barnes! Luka Barnes kicks it out.

[07:58] Team_038 possession (Score: 57-61)
DeMar Harris attempts a 3Pt. Contested by Kyrie Leonard (5.3 feet, ZONE). DeMar Harris misses. Offensive rebound by Tracy LaVine! Tracy LaVine puts it back in!
Score: 57-63

[07:44] Team_021 possession (Score: 57-63)
Kyrie Leonard attempts a 3Pt. Contested by Rudy Thompson (3.6 feet, MAN). KYRIE LEONARD MAKES IT! Assist: Zach Carter
Score: 60-63

[07:29] Team_038 possession (Score: 60-63)
Luka Barnes attempts a Layup. BLOCKED BY ZACH CARTER! Ball is loose! Rebound secured by Anthony Oladipo.

[07:19] Team_021 possession (Score: 60-63)
Karl Bridges attempts a Midrange. Contested by Malcolm Poole (4.8 feet, ZONE). KARL BRIDGES MAKES IT!
Score: 62-63

[07:07] Team_038 possession (Score: 62-63)
Tracy LaVine drives, Kyrie Wagner stays with him. Tracy LaVine attempts a Layup. Contested by Kyrie Wagner (3.8 feet, ZONE). TRACY LAVINE MAKES IT! Assist: Malcolm Poole
Score: 62-65

[06:52] Team_021 possession (Score: 62-65)
Anthony Oladipo attempts a Midrange. Contested by Rudy Thompson (3.8 feet, ZONE). ANTHONY OLADIPO MAKES IT!
Score: 64-65

[06:38] Team_038 possession (Score: 64-65)
Rudy Thompson drives, Zach Carter stays with him. Rudy Thompson attempts a Dunk. Contested by Zach Carter (4.6 feet, ZONE). Rudy Thompson misses. Rebound secured by Kyrie Leonard.

[06:26] Team_021 possession (Score: 64-65)
FOUL! Shooting foul on Tracy LaVine. Karl Bridges to the line for 2 free throws. [Team fouls: 3] (Tracy LaVine: 1 personal fouls)   FT 1/2: GOOD   FT 2/2: GOOD Karl Bridges makes 2/2 from the line.
Score: 66-65

[06:12] Team_038 possession (Score: 66-65)
Luka Barnes attempts a Layup. Contested by Zach Carter (4.3 feet, MAN). Luka Barnes misses. Rebound secured by Zach Carter.

[05:58] Team_021 possession (Score: 66-65)
Anthony Oladipo drives and kicks out. Kyrie Wagner attempts a 3Pt. Contested by Tracy LaVine (3.8 feet, MAN). Kyrie Wagner misses. Rebound secured by Tracy LaVine.

[05:40] Team_038 possession (Score: 66-65)
Rudy Thompson attempts a Layup. Contested by Zach Carter (4.6 feet, ZONE). RUDY THOMPSON MAKES IT! Assist: Malcolm Poole
Score: 66-67

[05:24] Team_021 possession (Score: 66-67)
FOUL! Shooting foul on DeMar Harris. Karl Bridges to the line for 3 free throws. [Team fouls: 4] (DeMar Harris: 1 personal fouls)   FT 1/3: GOOD   FT 2/3: GOOD   FT 3/3: GOOD Karl Bridges makes 3/3 from the line.
Score: 69-67

[05:05] Team_038 possession (Score: 69-67)
DeMar Harris attempts a 3Pt. Wide open! Karl Bridges is 6.3 feet away. [ZONE] DeMar Harris misses. FOUL! Loose ball foul on Zach Carter during the rebound battle. [IN THE BONUS! 5 team fouls] Tracy LaVine to the line for 2 free throws. (Zach Carter: 3 personal fouls)   FT 1/2: GOOD   FT 2/2: GOOD Tracy LaVine makes 2/2 from the line.
Score: 69-69

[04:52] Team_021 possession (Score: 69-69)
Kyrie Leonard attempts a 3Pt. Contested by DeMar Harris (3.0 feet, ZONE). Kyrie Leonard misses. Rebound secured by Tracy LaVine.

[04:42] Team_038 possession (Score: 69-69)
Luka Barnes attempts a Midrange. Contested by Zach Carter (4.4 feet, MAN). Luka Barnes misses. Rebound secured by Kyrie Leonard.

[04:24] Team_021 possession (Score: 69-69)
Zach Carter attempts a Layup. BLOCKED BY LUKA BARNES! Ball is loose! Rebound secured by Luka Barnes.

[04:10] Team_038 possession (Score: 69-69)
Malcolm Poole throws a bad pass! Stolen by Anthony Oladipo! TURNOVER! (live ball)

[03:56] Team_021 possession (Score: 69-69)
Zach Carter drives, Luka Barnes stays with him. Zach Carter attempts a Layup. Contested by Luka Barnes (4.8 feet, MAN). ZACH CARTER MAKES IT! Assist: Anthony Oladipo
Score: 71-69

[03:42] Team_038 possession (Score: 71-69)
DeMar Harris attempts a 3Pt. Contested by Kyrie Wagner (4.9 feet, ZONE). DEMAR HARRIS MAKES IT! Assist: Malcolm Poole
Score: 71-72

[03:27] Team_021 possession (Score: 71-72)
FOUL! Shooting foul on Malcolm Poole. Anthony Oladipo to the line for 3 free throws. [BONUS: 5 team fouls] (Malcolm Poole: 2 personal fouls)   FT 1/3: GOOD   FT 2/3: MISS   FT 3/3: GOOD Anthony Oladipo makes 2/3 from the line.
Score: 73-72

[03:12] Team_038 possession (Score: 73-72)
FOUL! Shooting foul on Zach Carter. Luka Barnes to the line for 2 free throws. [BONUS: 6 team fouls] (Zach Carter: 4 personal fouls)   FT 1/2: GOOD   FT 2/2: MISS Luka Barnes makes 1/2 from the line. Rebound secured by Anthony Oladipo.
Score: 73-73

[02:56] Team_021 possession (Score: 73-73)
Zach Carter attempts a Layup. Contested by Tracy LaVine (4.5 feet, ZONE). Zach Carter misses. Rebound secured by Tracy LaVine.

[02:44] Team_038 possession (Score: 73-73)
Malcolm Poole commits a violation (traveling/carry)! TURNOVER! (dead ball)

[02:44] Substitution (Team_021): Kyrie Wagner OUT → Vince George IN (stamina_rule2)

[02:44] Substitution (Team_038): Rudy Thompson OUT → Jalen Hyland IN (stamina_rule2)

[02:44] Substitution (Team_038): DeMar Harris OUT → Magic Dosunmu IN (stamina_rule2)

[02:44] Substitution (Team_038): Tracy LaVine OUT → Jabari Carter IN (stamina_rule2)

[02:30] Team_021 possession (Score: 73-73)
Zach Carter attempts a 3Pt. Contested by Jalen Hyland (4.7 feet, ZONE). ZACH CARTER MAKES IT! Assist: Vince George
Score: 76-73

[02:13] Team_038 possession (Score: 76-73)
Jalen Hyland attempts a Midrange. Contested by Anthony Oladipo (5.0 feet, ZONE). JALEN HYLAND MAKES IT!
Score: 76-75

[02:02] Team_021 possession (Score: 76-75)
Kyrie Leonard drives, Jalen Hyland stays with him. Kyrie Leonard attempts a Dunk. Contested by Jalen Hyland (4.1 feet, MAN). KYRIE LEONARD MAKES IT!
Score: 78-75

[01:49] Team_038 possession (Score: 78-75)
FOUL! Holding foul on Karl Bridges. [IN THE BONUS! 7 team fouls] Magic Dosunmu to the line for 2 free throws. (Karl Bridges: 1 personal fouls)   FT 1/2: GOOD   FT 2/2: MISS Magic Dosunmu makes 1/2 from the line. Offensive rebound by Luka Barnes! Luka Barnes kicks it out.
Score: 78-76

[01:31] Team_038 possession (Score: 78-76)
Jalen Hyland attempts a 3Pt. Contested by Kyrie Leonard (5.1 feet, MAN). Jalen Hyland misses. Offensive rebound by Luka Barnes! Luka Barnes kicks it out.

[01:17] Team_038 possession (Score: 78-76)
Jabari Carter throws a bad pass! Stolen by Vince George! TURNOVER! (live ball)

[00:58] Team_021 possession (Score: 78-76)
Kyrie Leonard attempts a Midrange. Contested by Malcolm Poole (5.1 feet, ZONE). Kyrie Leonard misses. FOUL! Loose ball foul on Luka Barnes during the rebound battle. [IN THE BONUS! 6 team fouls] Vince George to the line for 2 free throws. (Luka Barnes: 1 personal fouls)   FT 1/2: GOOD   FT 2/2: GOOD Vince George makes 2/2 from the line.
Score: 80-76

[00:45] Team_038 possession (Score: 80-76)
Jalen Hyland attempts a 3Pt. Contested by Kyrie Leonard (5.2 feet, MAN). Jalen Hyland misses. FOUL! Loose ball foul on Vince George during the rebound battle. [IN THE BONUS! 8 team fouls] Luka Barnes to the line for 2 free throws. (Vince George: 1 personal fouls)   FT 1/2: GOOD   FT 2/2: GOOD Luka Barnes makes 2/2 from the line.
Score: 80-78

[00:33] Team_021 possession (Score: 80-78)
Karl Bridges drives and kicks out. Kyrie Leonard attempts a Midrange. Contested by Jalen Hyland (4.3 feet, MAN). Kyrie Leonard misses. Rebound secured by Luka Barnes.

[00:21] Team_038 possession (Score: 80-78)
Jabari Carter makes the Dunk and draws the foul on Vince George! And-1! Jabari Carter to the line for 1. [BONUS: 9 team fouls] (Vince George: 2 personal fouls)   FT 1/1: GOOD Jabari Carter makes 1/1 from the line.
Score: 80-81

[00:07] Team_021 possession (Score: 80-81)
Anthony Oladipo attempts a Midrange. Contested by Malcolm Poole (5.3 feet, MAN). ANTHONY OLADIPO MAKES IT!
Score: 82-81

================================================================================
                              3RD QUARTER COMPLETE                              
================================================================================

3RD QUARTER SCORE: Team_021 41, Team_038 29

BOX SCORE:
================================================================================

Team_021
--------------------------------------------------------------------------------
Player                MIN  PTS  REB  AST  TO      FG   FG%      3P   3P%
--------------------------------------------------------------------------------
Anthony Oladipo        36   15    2    1   0   6/7    85.7     0/0   0.0
Karl Bridges           36   10    0    1   0   4/5    80.0     0/0   0.0
Zach Carter            36    7    1    1   0   3/6    50.0     0/0   0.0
Kyrie Leonard          36    7    3    1   0   3/4    75.0     0/0   0.0
Vince George            3    2    0    1   0   1/1   100.0     0/0   0.0
Kyrie Wagner           34    0    0    1   0   0/0     0.0     0/0   0.0

TEAM: FG: 17/23 (73.9%), 3PT: 7/8 (87.5%), REB: 6 (0 off, 6 def), AST: 6, TO: 0
TEAM FOULS: 9 [Team_038 in BONUS]


Team_038
--------------------------------------------------------------------------------
Player                MIN  PTS  REB  AST  TO      FG   FG%      3P   3P%
--------------------------------------------------------------------------------
DeMar Harris           34    8    1    0   0   3/3   100.0     0/0   0.0
Tracy LaVine           34    8    5    0   0   4/4   100.0     0/0   0.0
Jabari Carter           3    3    0    0   0   1/1   100.0     0/0   0.0
Malcolm Poole          36    2    0    4   0   1/2    50.0     0/0   0.0
Luka Barnes            36    2    6    0   0   1/5    20.0     0/0   0.0
Rudy Thompson          34    2    0    0   0   1/2    50.0     0/0   0.0
Jalen Hyland            3    2    0    0   0   1/1   100.0     0/0   0.0

TEAM: FG: 12/18 (66.7%), 3PT: 6/7 (85.7%), REB: 12 (6 off, 6 def), AST: 4, TO: 4
TEAM FOULS: 6 [Team_021 in BONUS]

================================================================================

================================================================================
                       4TH QUARTER - Team_021 vs Team_038                       
================================================================================

[12:00] Team_021 possession (Score: 82-81)
FOUL! Shooting foul on Tracy LaVine. Zach Carter to the line for 2 free throws. [Team fouls: 1] (Tracy LaVine: 1 personal fouls)   FT 1/2: GOOD   FT 2/2: GOOD Zach Carter makes 2/2 from the line.
Score: 84-81

[11:46] Team_038 possession (Score: 84-81)
Rudy Thompson attempts a 3Pt. Contested by Kyrie Leonard (5.5 feet, MAN). Rudy Thompson misses. Rebound secured by Anthony Oladipo.

[11:30] Team_021 possession (Score: 84-81)
Anthony Oladipo attempts a Midrange. Contested by Tracy LaVine (3.8 feet, ZONE). ANTHONY OLADIPO MAKES IT!
Score: 86-81

[11:14] Team_038 possession (Score: 86-81)
Luka Barnes attempts a Midrange. Contested by Zach Carter (4.7 feet, MAN). Luka Barnes misses. Offensive rebound by DeMar Harris! DeMar Harris puts it back in!
Score: 86-83

[10:59] Team_021 possession (Score: 86-83)
FOUL! Shooting foul on DeMar Harris. Kyrie Wagner to the line for 3 free throws. [Team fouls: 2] (DeMar Harris: 1 personal fouls)   FT 1/3: MISS   FT 2/3: GOOD   FT 3/3: GOOD Kyrie Wagner makes 2/3 from the line.
Score: 88-83

[10:44] Team_038 possession (Score: 88-83)
Rudy Thompson attempts a Layup. Contested by Kyrie Leonard (5.6 feet, MAN). RUDY THOMPSON MAKES IT! Assist: DeMar Harris
Score: 88-85

[10:34] Team_021 possession (Score: 88-85)
Zach Carter drives, picks up Tracy LaVine. Help arrives from Malcolm Poole! Zach Carter attempts a Dunk. Contested by Malcolm Poole (4.3 feet, MAN). Zach Carter misses. Rebound secured by DeMar Harris.

[10:17] Team_038 possession (Score: 88-85)
Malcolm Poole attempts a Layup. Contested by Kyrie Wagner (4.0 feet, ZONE). MALCOLM POOLE MAKES IT! Assist: DeMar Harris
Score: 88-87

[10:02] Team_021 possession (Score: 88-87)
Zach Carter attempts a Midrange. Contested by Malcolm Poole (5.7 feet, ZONE). ZACH CARTER MAKES IT! Assist: Kyrie Wagner
Score: 90-87

[09:47] Team_038 possession (Score: 90-87)
Malcolm Poole drives, picks up Kyrie Wagner. Help arrives from Kyrie Leonard! Malcolm Poole attempts a Dunk. Contested by Kyrie Leonard (4.0 feet, ZONE). MALCOLM POOLE MAKES IT!
Score: 90-89

[09:34] Team_021 possession (Score: 90-89)
Kyrie Leonard attempts a 3Pt. Contested by Rudy Thompson (3.8 feet, MAN). Kyrie Leonard misses. Rebound secured by DeMar Harris.

[09:21] Team_038 possession (Score: 90-89)
Malcolm Poole drives to the basket... Malcolm Poole loses the ball! Stripped by Anthony Oladipo! TURNOVER! (live ball)

[09:05] Team_021 possession (Score: 90-89)
Karl Bridges attempts a Midrange. Contested by DeMar Harris (3.2 feet, MAN). Karl Bridges misses. Rebound secured by Tracy LaVine.

[08:51] Team_038 possession (Score: 90-89)
Rudy Thompson attempts a 3Pt. Contested by Kyrie Wagner (4.8 feet, ZONE). Rudy Thompson misses. Rebound secured by Kyrie Leonard.

[08:41] Team_021 possession (Score: 90-89)
Zach Carter attempts a Layup. Contested by Tracy LaVine (4.5 feet, MAN). Zach Carter misses. Rebound secured by DeMar Harris.

[08:30] Team_038 possession (Score: 90-89)
Tracy LaVine throws a bad pass out of bounds! TURNOVER! (dead ball)

[08:30] Substitution (Team_021): Kyrie Leonard OUT → Joel LaVine IN (stamina_rule2)

[08:30] Substitution (Team_021): Anthony Oladipo OUT → Victor Mitchell IN (stamina_rule2)

[08:30] Substitution (Team_021): Karl Bridges OUT → Paul Allen IN (stamina_rule2)

[08:30] Substitution (Team_021): Kyrie Wagner OUT → Vince George IN (stamina_rule2)

[08:30] Substitution (Team_021): Zach Carter OUT → Magic Ingram IN (stamina_rule2)

[08:30] Substitution (Team_038): Rudy Thompson OUT → Jalen Hyland IN (stamina_rule2)

[08:30] Substitution (Team_038): Malcolm Poole OUT → Jaren Jokic IN (stamina_rule2)

[08:30] Substitution (Team_038): DeMar Harris OUT → Magic Dosunmu IN (stamina_rule2)

[08:30] Substitution (Team_038): Tracy LaVine OUT → Jabari Carter IN (stamina_rule2)

[08:30] Substitution (Team_038): Luka Barnes OUT → Ja Smith IN (stamina_rule2)

[08:14] Team_021 possession (Score: 90-89)
Victor Mitchell drives, Ja Smith stays with him. Victor Mitchell attempts a Layup. Contested by Ja Smith (3.2 feet, ZONE). Victor Mitchell misses. Rebound secured by Jalen Hyland.

[08:00] Team_038 possession (Score: 90-89)
Jabari Carter drives to the basket... Jabari Carter commits a violation (traveling/carry)! TURNOVER! (dead ball)

[07:45] Team_021 possession (Score: 90-89)
Magic Ingram drives, picks up Ja Smith. Help arrives from Jalen Hyland! Magic Ingram attempts a Layup. Contested by Jalen Hyland (3.4 feet, MAN). MAGIC INGRAM MAKES IT! Assist: Joel LaVine
Score: 92-89

[07:32] Team_038 possession (Score: 92-89)
Ja Smith attempts a Layup. Wide open! Magic Ingram is 6.0 feet away. [MAN] JA SMITH MAKES IT! Assist: Jabari Carter
Score: 92-91

[07:14] Team_021 possession (Score: 92-91)
Vince George drives, Jabari Carter stays with him. Vince George attempts a Dunk. Contested by Jabari Carter (4.0 feet, MAN). Vince George misses. Rebound secured by Ja Smith.

[07:02] Team_038 possession (Score: 92-91)
Jabari Carter makes the Layup and draws the foul on Vince George! And-1! Jabari Carter to the line for 1. [Team fouls: 1] (Vince George: 1 personal fouls)   FT 1/1: GOOD Jabari Carter makes 1/1 from the line.
Score: 92-94

[06:43] Team_021 possession (Score: 92-94)
Paul Allen drives to the basket... Paul Allen throws a bad pass! Stolen by Ja Smith! TURNOVER! (live ball)

[06:31] Team_038 possession (Score: 92-94)
Ja Smith drives, Magic Ingram stays with him. Ja Smith attempts a Layup. Wide open! Magic Ingram is 6.0 feet away. [MAN] JA SMITH MAKES IT! Assist: Jalen Hyland
Score: 92-96

[06:15] Team_021 possession (Score: 92-96)
Victor Mitchell throws a bad pass out of bounds! TURNOVER! (dead ball)

[06:03] Team_038 possession (Score: 92-96)
Magic Dosunmu attempts a Layup. BLOCKED BY VICTOR MITCHELL! Ball is loose! Rebound secured by Magic Ingram.

[05:52] Team_021 possession (Score: 92-96)
Joel LaVine drives, picks up Ja Smith. Help arrives from Jalen Hyland! Joel LaVine attempts a Dunk. Contested by Jalen Hyland (3.1 feet, ZONE). JOEL LAVINE MAKES IT! Assist: Magic Ingram
Score: 94-96

[05:39] Team_038 possession (Score: 94-96)
Jalen Hyland drives to the basket... FOUL! Offensive foul on Jalen Hyland! Magic Ingram drew the charge! [Team fouls: 3] (Jalen Hyland: 1 personal fouls) TURNOVER! (dead ball)

[05:24] Team_021 possession (Score: 94-96)
Victor Mitchell attempts a 3Pt. Contested by Jaren Jokic (5.0 feet, MAN). Victor Mitchell misses. Rebound secured by Jalen Hyland.

[05:10] Team_038 possession (Score: 94-96)
Jalen Hyland attempts a 3Pt. Contested by Victor Mitchell (4.3 feet, ZONE). JALEN HYLAND MAKES IT!
Score: 94-99

[04:54] Team_021 possession (Score: 94-99)
FOUL! Reach-in foul on Ja Smith during the drive. [Team fouls: 4] No free throws, side out. (Ja Smith: 1 personal fouls)

[04:39] Team_021 possession (Score: 94-99)
Victor Mitchell attempts a Midrange. Contested by Jaren Jokic (5.0 feet, MAN). VICTOR MITCHELL MAKES IT! Assist: Vince George
Score: 96-99

[04:24] Team_038 possession (Score: 96-99)
FOUL! Holding foul on Victor Mitchell. [Team fouls: 2] No free throws, side out. (Victor Mitchell: 1 personal fouls)

[04:10] Team_038 possession (Score: 96-99)
Jaren Jokic attempts a Midrange. BLOCKED BY VICTOR MITCHELL! Ball is loose! Rebound secured by Magic Ingram.

[03:54] Team_021 possession (Score: 96-99)
Magic Ingram attempts a Midrange. Contested by Ja Smith (3.4 feet, MAN). Magic Ingram misses. Rebound secured by Jalen Hyland.

[03:41] Team_038 possession (Score: 96-99)
Magic Dosunmu attempts a 3Pt. Contested by Victor Mitchell (4.4 feet, ZONE). MAGIC DOSUNMU MAKES IT! Assist: Jaren Jokic
Score: 96-102

[03:28] Team_021 possession (Score: 96-102)
Magic Ingram attempts a Layup. Contested by Ja Smith (3.4 feet, MAN). MAGIC INGRAM MAKES IT! Assist: Vince George
Score: 98-102

[03:17] Team_038 possession (Score: 98-102)
Jalen Hyland drives and kicks out. Jaren Jokic attempts a Midrange. Contested by Victor Mitchell (4.2 feet, MAN). Jaren Jokic misses. Rebound secured by Magic Ingram.

[03:02] Team_021 possession (Score: 98-102)
Paul Allen makes the Layup and draws the foul on Magic Dosunmu! And-1! Paul Allen to the line for 1. [BONUS: 5 team fouls] (Magic Dosunmu: 1 personal fouls)   FT 1/1: MISS Paul Allen makes 0/1 from the line. Offensive rebound by Magic Ingram! Magic Ingram kicks it out.
Score: 100-102

[02:46] Team_021 possession (Score: 100-102)
Joel LaVine drives and kicks out. Joel LaVine attempts a 3Pt. Contested by Jalen Hyland (4.4 feet, MAN). JOEL LAVINE MAKES IT! Assist: Magic Ingram
Score: 103-102

[02:30] Team_038 possession (Score: 103-102)
Jaren Jokic attempts a 3Pt. Contested by Victor Mitchell (3.9 feet, MAN). Jaren Jokic misses. FOUL! Loose ball foul on Vince George during the rebound battle. [Team fouls: 3] No free throws, side out. (Vince George: 2 personal fouls)

[02:18] Team_038 possession (Score: 103-102)
Jabari Carter attempts a Midrange. Contested by Victor Mitchell (4.7 feet, ZONE). Jabari Carter misses. Offensive rebound by Jabari Carter! Jabari Carter puts it back in!
Score: 103-104

[02:02] Team_021 possession (Score: 103-104)
Magic Ingram attempts a Midrange. Contested by Ja Smith (3.5 feet, MAN). MAGIC INGRAM MAKES IT! Assist: Joel LaVine
Score: 105-104

[01:46] Team_038 possession (Score: 105-104)
Magic Dosunmu drives, Magic Ingram stays with him. Magic Dosunmu attempts a Dunk. Contested by Magic Ingram (5.3 feet, ZONE). MAGIC DOSUNMU MAKES IT! Assist: Jabari Carter
Score: 105-106

[01:30] Team_021 possession (Score: 105-106)
Vince George attempts a Midrange. Contested by Jabari Carter (4.1 feet, MAN). Vince George misses. Offensive rebound by Magic Ingram! Magic Ingram kicks it out.

[01:14] Team_021 possession (Score: 105-106)
Magic Ingram attempts a Layup. Contested by Ja Smith (3.5 feet, MAN). MAGIC INGRAM MAKES IT! Assist: Victor Mitchell
Score: 107-106

[01:04] Team_038 possession (Score: 107-106)
Ja Smith attempts a Layup. Wide open! Magic Ingram is 6.1 feet away. [MAN] JA SMITH MAKES IT! Assist: Jalen Hyland
Score: 107-108

[00:51] Team_021 possession (Score: 107-108)
Vince George attempts a 3Pt. Contested by Jalen Hyland (4.4 feet, ZONE). Vince George misses. Offensive rebound by Magic Ingram! Magic Ingram kicks it out.

[00:39] Team_021 possession (Score: 107-108)
Victor Mitchell attempts a 3Pt. Contested by Jaren Jokic (5.1 feet, MAN). Victor Mitchell misses. Rebound secured by Jabari Carter.

[00:25] Team_038 possession (Score: 107-108)
Jaren Jokic attempts a Layup. Contested by Victor Mitchell (4.0 feet, MAN). JAREN JOKIC MAKES IT! Assist: Jabari Carter
Score: 107-110

[00:13] Team_021 possession (Score: 107-110)
Joel LaVine attempts a 3Pt. Contested by Jalen Hyland (4.5 feet, ZONE). JOEL LAVINE MAKES IT! Assist: Vince George
Score: 110-110

[00:01] Team_038 possession (Score: 110-110)
Jalen Hyland attempts a Midrange. Wide open! Joel LaVine is 6.1 feet away. [MAN] JALEN HYLAND MAKES IT!
Score: 110-112

================================================================================
                              4TH QUARTER COMPLETE                              
================================================================================

4TH QUARTER SCORE: Team_021 28, Team_038 31

BOX SCORE:
================================================================================

Team_021
--------------------------------------------------------------------------------
Player                MIN  PTS  REB  AST  TO      FG   FG%      3P   3P%
--------------------------------------------------------------------------------
Magic Ingram            8    8    6    2   0   4/5    80.0     0/0   0.0
Joel LaVine             8    8    0    2   0   3/3   100.0     0/0   0.0
Zach Carter            40    4    0    0   0   2/4    50.0     0/0   0.0
Anthony Oladipo        40    2    1    0   0   1/1   100.0     0/0   0.0
Kyrie Wagner           37    2    0    1   0   1/1   100.0     0/0   0.0
Victor Mitchell         8    2    0    1   0   1/4    25.0     0/0   0.0
Kyrie Leonard          40    0    1    0   0   0/1     0.0     0/0   0.0
Karl Bridges           40    0    0    0   0   0/1     0.0     0/0   0.0
Vince George           11    0    0    3   0   0/1     0.0     0/0   0.0

TEAM: FG: 12/21 (57.1%), 3PT: 2/5 (40.0%), REB: 8 (3 off, 5 def), AST: 9, TO: 2
TEAM FOULS: 3


Team_038
--------------------------------------------------------------------------------
Player                MIN  PTS  REB  AST  TO      FG   FG%      3P   3P%
--------------------------------------------------------------------------------
Ja Smith                8    6    2    0   0   3/3   100.0     0/0   0.0
Jalen Hyland           11    5    3    2   0   2/3    66.7     0/0   0.0
Jabari Carter          11    5    2    3   0   2/2   100.0     0/0   0.0
Magic Dosunmu          11    5    0    0   0   2/3    66.7     0/0   0.0
Malcolm Poole          40    4    0    0   0   2/2   100.0     0/0   0.0
Rudy Thompson          37    2    0    0   0   1/3    33.3     0/0   0.0
DeMar Harris           37    2    4    2   0   1/1   100.0     0/0   0.0
Jaren Jokic             8    2    0    1   0   1/2    50.0     0/0   0.0
Tracy LaVine           37    0    1    0   0   0/0     0.0     0/0   0.0

TEAM: FG: 14/19 (73.7%), 3PT: 2/4 (50.0%), REB: 12 (3 off, 9 def), AST: 8, TO: 4
TEAM FOULS: 5 [Team_021 in BONUS]

================================================================================

================================================================================
                               FULL GAME COMPLETE                               
================================================================================

FINAL SCORE: Team_021 110, Team_038 112

SCORING BY QUARTER:
--------------------------------------------------------------------------------
Team                     Q1     Q2     Q3     Q4    FINAL
--------------------------------------------------------------------------------
Team_021                 15     26     41     28      110
Team_038                 30     22     29     31      112
--------------------------------------------------------------------------------

FULL GAME BOX SCORE:
================================================================================

Team_021
--------------------------------------------------------------------------------
Player                MIN  PTS  REB  AST  TO      FG   FG%      3P   3P%      FT STL BLK
--------------------------------------------------------------------------------
Kyrie Leonard          40   12   16    2   1   6/12   50.0   2/6    33.3   4/5     0   0
Anthony Oladipo        40   20    8    3   0   8/9    88.9   3/3   100.0   4/5     2   0
Karl Bridges           40   22    0    2   3   9/17   52.9   2/4    50.0   6/7     0   0
Zach Carter            40   23    6    1   0  10/20   50.0   2/4    50.0   3/3     3   1
Kyrie Wagner           37    9    0    6   4   5/8    62.5   1/2    50.0   5/6     1   0
Vince George           11    2    0    4   1   0/1     0.0   0/0     0.0   2/2     1   0
Joel LaVine             8    8    0    2   0   3/3   100.0   1/1   100.0   0/0     0   0
Victor Mitchell         8    2    0    1   1   1/4    25.0   0/2     0.0   0/0     0   2
Paul Allen              8    0    0    0   0   0/0     0.0   0/0     0.0   0/1     0   0
Magic Ingram            8    8    6    2   0   4/5    80.0   0/0     0.0   0/0     0   0

TEAM: FG: 46/79 (58.2%), 3PT: 11/22 (50.0%), REB: 36 (8 off, 28 def), AST: 23, TO: 10


Team_038
--------------------------------------------------------------------------------
Player                MIN  PTS  REB  AST  TO      FG   FG%      3P   3P%      FT STL BLK
--------------------------------------------------------------------------------
Malcolm Poole          40   12    0    5   3   5/10   50.0   0/4     0.0   4/4     0   1
Luka Barnes            40   17   17    2   1   7/13   53.8   1/2    50.0   7/8     0   1
Rudy Thompson          37   17    0    1   1   6/13   46.2   2/6    33.3   2/2     1   0
DeMar Harris           37   15   11    6   2   7/9    77.8   5/6    83.3   0/0     0   0
Tracy LaVine           37   20   18    2   2   8/13   61.5   5/7    71.4   5/6     4   1
Jalen Hyland           11    7    3    2   0   4/5    80.0   2/2   100.0   0/0     0   0
Magic Dosunmu          11    5    0    0   0   2/3    66.7   1/1   100.0   1/2     0   0
Jabari Carter          11    8    2    3   1   3/3   100.0   0/0     0.0   2/2     0   0
Jaren Jokic             8    2    0    1   2   1/2    50.0   0/0     0.0   0/0     0   0
Ja Smith                8    6    2    0   0   3/3   100.0   0/0     0.0   0/0     1   0

TEAM: FG: 47/75 (62.7%), 3PT: 16/28 (57.1%), REB: 53 (20 off, 33 def), AST: 22, TO: 12

================================================================================
