================================================================================
                        FULL GAME - Team_014 vs Team_065                        
================================================================================

================================================================================
                       1ST QUARTER - Team_014 vs Team_065                       
================================================================================

[12:00] Team_014 possession (Score: 0-0)
DeMar Adebayo drives, Russell Wade stays with him. DeMar Adebayo attempts a Dunk. Contested by Russell Wade (3.0 feet, MAN). DEMAR ADEBAYO MAKES IT! Assist: Michael Cunningham
Score: 2-0

[11:41] Team_065 possession (Score: 2-0)
Manu McGrady drives and kicks out. RJ Harden attempts a Midrange. Contested by Michael Cunningham (4.0 feet, MAN). RJ HARDEN MAKES IT!
Score: 2-2

[11:29] Team_014 possession (Score: 2-2)
Ayo Murray attempts a Midrange. Contested by Russell Wade (3.4 feet, MAN). Ayo Murray misses. Rebound secured by Russell Wade.

[11:17] Team_065 possession (Score: 2-2)
FOUL! Reach-in foul on DeMar Adebayo during the drive. [Team fouls: 1] No free throws, side out. (DeMar Adebayo: 1 personal fouls)

[11:00] Team_065 possession (Score: 2-2)
FOUL! Shooting foul on Ayo Murray. Karl Booker to the line for 2 free throws. [Team fouls: 2] (Ayo Murray: 1 personal fouls)   FT 1/2: GOOD   FT 2/2: GOOD Karl Booker makes 2/2 from the line.
Score: 2-4

[10:48] Team_014 possession (Score: 2-4)
Jordan Anunoby attempts a 3Pt. Contested by Paul Williamson (3.7 feet, MAN). Jordan Anunoby misses. Rebound secured by Manu McGrady.

[10:34] Team_065 possession (Score: 2-4)
FOUL! Shooting foul on DeMar Adebayo. Russell Wade to the line for 2 free throws. [Team fouls: 3] (DeMar Adebayo: 2 personal fouls)   FT 1/2: MISS   FT 2/2: GOOD Russell Wade makes 1/2 from the line.
Score: 2-5

[10:19] Team_014 possession (Score: 2-5)
DeMar Adebayo drives, Russell Wade stays with him. DeMar Adebayo attempts a Layup. Contested by Russell Wade (3.0 feet, MAN). DEMAR ADEBAYO MAKES IT! Assist: Ayo Murray
Score: 4-5

[10:07] Team_065 possession (Score: 4-5)
Manu McGrady attempts a Midrange. Contested by Ayo Murray (4.8 feet, ZONE). Manu McGrady misses. Rebound secured by Ayo Murray.

[09:52] Team_014 possession (Score: 4-5)
DeMar Adebayo drives and kicks out. Michael Cunningham attempts a 3Pt. Contested by RJ Harden (3.9 feet, MAN). Michael Cunningham misses. Rebound secured by Manu McGrady.

[09:37] Team_065 possession (Score: 4-5)
Manu McGrady attempts a Layup. Contested by Lamelo Simmons (3.9 feet, MAN). MANU MCGRADY MAKES IT! Assist: Karl Booker
Score: 4-7

[09:19] Team_014 possession (Score: 4-7)
Ayo Murray drives, picks up Karl Booker. Help arrives from Paul Williamson! Ayo Murray attempts a Dunk. Contested by Paul Williamson (5.1 feet, ZONE). AYO MURRAY MAKES IT! Assist: DeMar Adebayo
Score: 6-7

[09:06] Team_065 possession (Score: 6-7)
RJ Harden attempts a 3Pt. Contested by Jordan Anunoby (5.1 feet, ZONE). RJ Harden misses. Offensive rebound by Manu McGrady! Manu McGrady kicks it out.

[08:55] Team_065 possession (Score: 6-7)
Russell Wade attempts a 3Pt. Contested by DeMar Adebayo (3.2 feet, MAN). Russell Wade misses. Rebound secured by Ayo Murray.

[08:41] Team_014 possession (Score: 6-7)
DeMar Adebayo attempts a 3Pt. Contested by RJ Harden (3.8 feet, ZONE). DeMar Adebayo misses. Rebound secured by Russell Wade.

[08:24] Team_065 possession (Score: 6-7)
RJ Harden attempts a Midrange. Contested by Jordan Anunoby (5.1 feet, ZONE). RJ HARDEN MAKES IT!
Score: 6-9

[08:05] Team_014 possession (Score: 6-9)
Ayo Murray drives, Russell Wade stays with him. Ayo Murray attempts a Dunk. Contested by Russell Wade (3.4 feet, MAN). Ayo Murray misses. Rebound secured by Manu McGrady.

[07:52] Team_065 possession (Score: 6-9)
Manu McGrady makes the Dunk and draws the foul on Lamelo Simmons! And-1! Manu McGrady to the line for 1. [Team fouls: 4] (Lamelo Simmons: 1 personal fouls)   FT 1/1: GOOD Manu McGrady makes 1/1 from the line.
Score: 6-12

[07:37] Team_014 possession (Score: 6-12)
Lamelo Simmons drives, Manu McGrady stays with him. Lamelo Simmons attempts a Dunk. Contested by Manu McGrady (5.0 feet, MAN). Lamelo Simmons misses. Rebound secured by Russell Wade.

[07:21] Team_065 possession (Score: 6-12)
Manu McGrady attempts a 3Pt. Contested by Lamelo Simmons (3.9 feet, MAN). MANU MCGRADY MAKES IT! Assist: Russell Wade
Score: 6-15

[07:05] Team_014 possession (Score: 6-15)
DeMar Adebayo attempts a Midrange. Contested by Russell Wade (3.0 feet, MAN). DeMar Adebayo misses. Rebound secured by Manu McGrady.

[06:49] Team_065 possession (Score: 6-15)
Russell Wade attempts a 3Pt. Contested by Jordan Anunoby (4.7 feet, ZONE). Russell Wade misses. Offensive rebound by Russell Wade! Russell Wade's putback is no good. Rebound secured by Ayo Murray.

[06:30] Team_014 possession (Score: 6-15)
Ayo Murray drives, picks up Russell Wade. Help arrives from Paul Williamson! Ayo Murray attempts a Layup. Contested by Paul Williamson (3.4 feet, MAN). Ayo Murray misses. Rebound secured by Russell Wade.

[06:19] Team_065 possession (Score: 6-15)
Karl Booker drives and kicks out. Manu McGrady attempts a Midrange. Contested by Jordan Anunoby (4.7 feet, ZONE). MANU MCGRADY MAKES IT!
Score: 6-17

[06:06] Team_014 possession (Score: 6-17)
Lamelo Simmons attempts a Midrange. Contested by Manu McGrady (5.0 feet, MAN). LAMELO SIMMONS MAKES IT! Assist: DeMar Adebayo
Score: 8-17

[05:51] Team_065 possession (Score: 8-17)
RJ Harden attempts a Midrange. Contested by Michael Cunningham (4.4 feet, MAN). RJ Harden misses. Rebound secured by Ayo Murray.

[05:40] Team_014 possession (Score: 8-17)
Jordan Anunoby commits a violation (traveling/carry)! TURNOVER! (dead ball)

[05:22] Team_065 possession (Score: 8-17)
RJ Harden attempts a 3Pt. Contested by Jordan Anunoby (5.1 feet, ZONE). RJ Harden misses. Offensive rebound by Manu McGrady! Manu McGrady kicks it out.

[05:08] Team_065 possession (Score: 8-17)
Paul Williamson attempts a Midrange. Contested by Jordan Anunoby (4.8 feet, ZONE). Paul Williamson misses. Rebound secured by Michael Cunningham.

[04:57] Team_014 possession (Score: 8-17)
Lamelo Simmons attempts a Layup. BLOCKED BY PAUL WILLIAMSON! Ball is loose! Rebound secured by Russell Wade.

[04:40] Team_065 possession (Score: 8-17)
Manu McGrady makes the 3Pt and draws the foul on Jordan Anunoby! And-1! Manu McGrady to the line for 1. [BONUS: 5 team fouls] (Jordan Anunoby: 1 personal fouls)   FT 1/1: GOOD Manu McGrady makes 1/1 from the line.
Score: 8-21

[04:24] Team_014 possession (Score: 8-21)
Michael Cunningham attempts a 3Pt. Contested by RJ Harden (3.7 feet, ZONE). Michael Cunningham misses. FOUL! Loose ball foul on Manu McGrady during the rebound battle. [Team fouls: 1] No free throws, side out. (Manu McGrady: 1 personal fouls)

[04:11] Team_014 possession (Score: 8-21)
FOUL! Shooting foul on Russell Wade. DeMar Adebayo to the line for 2 free throws. [Team fouls: 2] (Russell Wade: 1 personal fouls)   FT 1/2: MISS   FT 2/2: MISS DeMar Adebayo makes 0/2 from the line. Rebound secured by RJ Harden.

[04:01] Team_065 possession (Score: 8-21)
Russell Wade attempts a Midrange. Contested by DeMar Adebayo (3.3 feet, MAN). RUSSELL WADE MAKES IT! Assist: RJ Harden
Score: 8-23

[03:48] Team_014 possession (Score: 8-23)
Jordan Anunoby attempts a Midrange. Contested by Russell Wade (3.4 feet, ZONE). Jordan Anunoby misses. Rebound secured by Russell Wade.

[03:37] Team_065 possession (Score: 8-23)
FOUL! Reach-in foul on DeMar Adebayo during the drive. [IN THE BONUS! 6 team fouls] RJ Harden to the line for 2 free throws. (DeMar Adebayo: 3 personal fouls)   FT 1/2: GOOD   FT 2/2: GOOD RJ Harden makes 2/2 from the line.
Score: 8-25

[03:21] Team_014 possession (Score: 8-25)
Ayo Murray attempts a Midrange. Contested by Manu McGrady (5.0 feet, ZONE). AYO MURRAY MAKES IT! Assist: Michael Cunningham
Score: 10-25

[03:09] Team_065 possession (Score: 10-25)
RJ Harden attempts a 3Pt. Contested by Jordan Anunoby (5.3 feet, ZONE). RJ Harden misses. FOUL! Loose ball foul on Ayo Murray during the rebound battle. [IN THE BONUS! 7 team fouls] Russell Wade to the line for 2 free throws. (Ayo Murray: 2 personal fouls)   FT 1/2: GOOD   FT 2/2: GOOD Russell Wade makes 2/2 from the line.
Score: 10-27

[02:55] Team_014 possession (Score: 10-27)
FOUL! Reach-in foul on RJ Harden during the drive. [Team fouls: 3] No free throws, side out. (RJ Harden: 1 personal fouls)

[02:41] Team_014 possession (Score: 10-27)
DeMar Adebayo drives, Russell Wade stays with him. DeMar Adebayo attempts a Dunk. Contested by Russell Wade (3.2 feet, MAN). DeMar Adebayo misses. Rebound secured by Manu McGrady.

[02:25] Team_065 possession (Score: 10-27)
Manu McGrady attempts a Midrange. Contested by Lamelo Simmons (4.3 feet, MAN). Manu McGrady misses. FOUL! Loose ball foul on Ayo Murray during the rebound battle. [IN THE BONUS! 8 team fouls] Russell Wade to the line for 2 free throws. (Ayo Murray: 3 personal fouls)   FT 1/2: MISS   FT 2/2: MISS Russell Wade makes 0/2 from the line. Rebound secured by Ayo Murray.

[02:06] Team_014 possession (Score: 10-27)
FOUL! Shooting foul on Russell Wade. Ayo Murray to the line for 2 free throws. [Team fouls: 4] (Russell Wade: 2 personal fouls)   FT 1/2: GOOD   FT 2/2: GOOD Ayo Murray makes 2/2 from the line.
Score: 12-27

[01:50] Team_065 possession (Score: 12-27)
Karl Booker attempts a 3Pt. Contested by Ayo Murray (5.0 feet, MAN). Karl Booker misses. Offensive rebound by Russell Wade! Russell Wade puts it back in!
Score: 12-29

[01:36] Team_014 possession (Score: 12-29)
Ayo Murray makes the Layup and draws the foul on Russell Wade! And-1! Ayo Murray to the line for 1. [BONUS: 5 team fouls] (Russell Wade: 3 personal fouls)   FT 1/1: MISS Ayo Murray makes 0/1 from the line. Offensive rebound by DeMar Adebayo! DeMar Adebayo kicks it out.
Score: 14-29

[01:25] Team_014 possession (Score: 14-29)
FOUL! Reach-in foul on Russell Wade during the drive. [IN THE BONUS! 6 team fouls] Jordan Anunoby to the line for 2 free throws. (Russell Wade: 4 personal fouls)   FT 1/2: GOOD   FT 2/2: GOOD Jordan Anunoby makes 2/2 from the line.
Score: 16-29

[01:09] Team_065 possession (Score: 16-29)
Manu McGrady makes the Layup and draws the foul on Lamelo Simmons! And-1! Manu McGrady to the line for 1. [BONUS: 9 team fouls] (Lamelo Simmons: 2 personal fouls)   FT 1/1: GOOD Manu McGrady makes 1/1 from the line.
Score: 16-32

[00:56] Team_014 possession (Score: 16-32)
Lamelo Simmons attempts a 3Pt. Contested by RJ Harden (4.6 feet, ZONE). LAMELO SIMMONS MAKES IT! Assist: Ayo Murray
Score: 19-32

[00:44] Team_065 possession (Score: 19-32)
Manu McGrady makes the Layup and draws the foul on Lamelo Simmons! And-1! Manu McGrady to the line for 1. [BONUS: 10 team fouls] (Lamelo Simmons: 3 personal fouls)   FT 1/1: GOOD Manu McGrady makes 1/1 from the line.
Score: 19-35

[00:26] Team_014 possession (Score: 19-35)
Michael Cunningham attempts a Midrange. Contested by RJ Harden (4.1 feet, MAN). Michael Cunningham misses. Rebound secured by Russell Wade.

[00:14] Team_065 possession (Score: 19-35)
Russell Wade attempts a Midrange. Contested by Michael Cunningham (4.6 feet, ZONE). Russell Wade misses. Rebound secured by DeMar Adebayo.

================================================================================
                              1ST QUARTER COMPLETE                              
================================================================================

1ST QUARTER SCORE: Team_014 19, Team_065 35

BOX SCORE:
================================================================================

Team_014
--------------------------------------------------------------------------------
Player                MIN  PTS  REB  AST  TO      FG   FG%      3P   3P%
--------------------------------------------------------------------------------
Ayo Murray             12    6    5    2   0   3/6    50.0     0/0   0.0
Lamelo Simmons         12    5    0    0   0   2/4    50.0     0/0   0.0
DeMar Adebayo          12    4    3    2   0   2/7    28.6     0/0   0.0
Jordan Anunoby         12    2    0    0   0   1/3    33.3     0/0   0.0
Michael Cunningham     12    0    1    2   0   0/1     0.0     0/0   0.0

TEAM: FG: 8/21 (38.1%), 3PT: 1/3 (33.3%), REB: 7 (2 off, 5 def), AST: 6, TO: 1
TEAM FOULS: 10 [Team_065 in BONUS]


Team_065
--------------------------------------------------------------------------------
Player                MIN  PTS  REB  AST  TO      FG   FG%      3P   3P%
--------------------------------------------------------------------------------
Manu McGrady           12   20    7    0   0   7/9    77.8     0/0   0.0
Russell Wade           12    7    8    1   0   4/7    57.1     0/0   0.0
RJ Harden              12    6    1    1   0   3/4    75.0     0/0   0.0
Karl Booker            12    2    0    1   0   1/1   100.0     0/0   0.0
Paul Williamson        12    0    0    0   0   0/1     0.0     0/0   0.0

TEAM: FG: 15/22 (68.2%), 3PT: 4/6 (66.7%), REB: 18 (5 off, 13 def), AST: 3, TO: 0
TEAM FOULS: 6 [Team_014 in BONUS]

================================================================================

================================================================================
                       2ND QUARTER - Team_014 vs Team_065                       
================================================================================

[12:00] Team_014 possession (Score: 19-35)
FOUL! Holding foul on Russell Wade. [Team fouls: 1] No free throws, side out. (Russell Wade: 1 personal fouls)

[11:50] Team_014 possession (Score: 19-35)
FOUL! Shooting foul on Manu McGrady. Lamelo Simmons to the line for 2 free throws. [Team fouls: 2] (Manu McGrady: 1 personal fouls)   FT 1/2: GOOD   FT 2/2: GOOD Lamelo Simmons makes 2/2 from the line.
Score: 21-35

[11:32] Team_065 possession (Score: 21-35)
Manu McGrady attempts a 3Pt. Contested by Jordan Anunoby (5.0 feet, ZONE). Manu McGrady misses. Rebound secured by Michael Cunningham.

[11:17] Team_014 possession (Score: 21-35)
FOUL! Shooting foul on Paul Williamson. Lamelo Simmons to the line for 2 free throws. [Team fouls: 3] (Paul Williamson: 1 personal fouls)   FT 1/2: GOOD   FT 2/2: GOOD Lamelo Simmons makes 2/2 from the line.
Score: 23-35

[11:05] Team_065 possession (Score: 23-35)
Paul Williamson drives, Jordan Anunoby stays with him. Paul Williamson attempts a Dunk. Contested by Jordan Anunoby (5.2 feet, MAN). Paul Williamson misses. Rebound secured by Michael Cunningham.

[10:50] Team_014 possession (Score: 23-35)
DeMar Adebayo attempts a 3Pt. Contested by RJ Harden (4.2 feet, ZONE). DeMar Adebayo misses. Rebound secured by RJ Harden.

[10:36] Team_065 possession (Score: 23-35)
Russell Wade attempts a Midrange. Contested by DeMar Adebayo (3.7 feet, MAN). RUSSELL WADE MAKES IT! Assist: Karl Booker
Score: 23-37

[10:20] Team_014 possession (Score: 23-37)
Jordan Anunoby attempts a 3Pt. Contested by Paul Williamson (4.1 feet, MAN). Jordan Anunoby misses. Rebound secured by RJ Harden.

[10:09] Team_065 possession (Score: 23-37)
Karl Booker drives, DeMar Adebayo stays with him. Karl Booker attempts a Layup. Contested by DeMar Adebayo (3.7 feet, ZONE). Karl Booker misses. Offensive rebound by Manu McGrady! Manu McGrady kicks it out.

[09:52] Team_065 possession (Score: 23-37)
Paul Williamson attempts a Layup. Contested by DeMar Adebayo (3.9 feet, ZONE). PAUL WILLIAMSON MAKES IT! Assist: RJ Harden
Score: 23-39

[09:37] Team_014 possession (Score: 23-39)
Jordan Anunoby attempts a Midrange. Contested by Paul Williamson (4.2 feet, MAN). Jordan Anunoby misses. Rebound secured by Russell Wade.

[09:23] Team_065 possession (Score: 23-39)
Karl Booker makes the Dunk and draws the foul on Ayo Murray! And-1! Karl Booker to the line for 1. [Team fouls: 1] (Ayo Murray: 1 personal fouls)   FT 1/1: MISS Karl Booker makes 0/1 from the line. Rebound secured by Ayo Murray.
Score: 23-41

[09:06] Team_014 possession (Score: 23-41)
Michael Cunningham attempts a 3Pt. Contested by RJ Harden (4.3 feet, ZONE). Michael Cunningham misses. Rebound secured by Russell Wade.

[08:51] Team_065 possession (Score: 23-41)
Paul Williamson attempts a Midrange. Contested by Jordan Anunoby (5.4 feet, ZONE). PAUL WILLIAMSON MAKES IT! Assist: Karl Booker
Score: 23-43

[08:40] Team_014 possession (Score: 23-43)
DeMar Adebayo attempts a Layup. BLOCKED BY RUSSELL WADE! Ball deflects out of bounds off DeMar Adebayo.

[08:25] Team_065 possession (Score: 23-43)
Manu McGrady attempts a 3Pt. Contested by Lamelo Simmons (4.9 feet, ZONE). MANU MCGRADY MAKES IT! Assist: Karl Booker
Score: 23-46

[08:09] Team_014 possession (Score: 23-46)
Ayo Murray throws a bad pass! Stolen by Russell Wade! TURNOVER! (live ball)

[07:52] Team_065 possession (Score: 23-46)
Paul Williamson drives, Ayo Murray stays with him. Paul Williamson attempts a Layup. Contested by Ayo Murray (5.6 feet, ZONE). PAUL WILLIAMSON MAKES IT!
Score: 23-48

[07:42] Team_014 possession (Score: 23-48)
DeMar Adebayo attempts a 3Pt. Contested by RJ Harden (4.5 feet, ZONE). DEMAR ADEBAYO MAKES IT! Assist: Michael Cunningham
Score: 26-48

[07:31] Team_065 possession (Score: 26-48)
Russell Wade drives, picks up DeMar Adebayo. Help arrives from Michael Cunningham! Russell Wade attempts a Dunk. Contested by Michael Cunningham (4.2 feet, ZONE). Russell Wade misses. Rebound secured by DeMar Adebayo.

[07:19] Team_014 possession (Score: 26-48)
Ayo Murray loses control! Ball rolls out of bounds! TURNOVER! (dead ball)

[07:19] Substitution (Team_014): Michael Cunningham OUT → Jalen Booker IN (stamina_rule2)

[07:19] Substitution (Team_014): Jordan Anunoby OUT → Bones Quickley IN (stamina_rule2)

[07:19] Substitution (Team_014): Lamelo Simmons OUT → Tracy Westbrook IN (stamina_rule2)

[07:19] Substitution (Team_014): DeMar Adebayo OUT → Nikola James IN (stamina_rule2)

[07:19] Substitution (Team_014): Ayo Murray OUT → Collin Gasol IN (stamina_rule2)

[07:19] Substitution (Team_065): RJ Harden OUT → Paul Curry IN (stamina_rule2)

[07:19] Substitution (Team_065): Paul Williamson OUT → Derrick Poole IN (stamina_rule2)

[07:19] Substitution (Team_065): Manu McGrady OUT → D'Angelo Porzingis IN (stamina_rule2)

[07:19] Substitution (Team_065): Russell Wade OUT → Karl Leonard IN (stamina_rule2)

[07:19] Substitution (Team_065): Karl Booker OUT → Vince Mobley IN (stamina_rule2)

[07:02] Team_065 possession (Score: 26-48)
Karl Leonard attempts a 3Pt. Contested by Bones Quickley (5.9 feet, ZONE). Karl Leonard misses. Rebound secured by Nikola James.

[06:47] Team_014 possession (Score: 26-48)
Jalen Booker attempts a 3Pt. Contested by Paul Curry (4.9 feet, MAN). Jalen Booker misses. Rebound secured by Karl Leonard.

[06:34] Team_065 possession (Score: 26-48)
D'Angelo Porzingis attempts a 3Pt. Contested by Tracy Westbrook (5.4 feet, MAN). D'Angelo Porzingis misses. Rebound secured by Nikola James.

[06:19] Team_014 possession (Score: 26-48)
Nikola James drives, Vince Mobley stays with him. Nikola James attempts a Layup. Contested by Vince Mobley (4.3 feet, ZONE). NIKOLA JAMES MAKES IT! Assist: Tracy Westbrook
Score: 28-48

[06:08] Team_065 possession (Score: 28-48)
Karl Leonard drives, Nikola James stays with him. Karl Leonard attempts a Layup. Contested by Nikola James (5.5 feet, MAN). KARL LEONARD MAKES IT! Assist: Vince Mobley
Score: 28-50

[05:56] Team_014 possession (Score: 28-50)
Jalen Booker drives, picks up Paul Curry. Help arrives from D'Angelo Porzingis! Jalen Booker attempts a Dunk. Contested by D'Angelo Porzingis (4.9 feet, MAN). JALEN BOOKER MAKES IT! Assist: Nikola James
Score: 30-50

[05:43] Team_065 possession (Score: 30-50)
FOUL! Holding foul on Collin Gasol. [Team fouls: 2] No free throws, side out. (Collin Gasol: 1 personal fouls)

[05:28] Team_065 possession (Score: 30-50)
Paul Curry attempts a 3Pt. Contested by Jalen Booker (4.7 feet, ZONE). Paul Curry misses. Offensive rebound by D'Angelo Porzingis! D'Angelo Porzingis kicks it out.

[05:13] Team_065 possession (Score: 30-50)
Vince Mobley attempts a Layup. Contested by Collin Gasol (5.1 feet, ZONE). VINCE MOBLEY MAKES IT! Assist: Karl Leonard
Score: 30-52

[04:59] Team_014 possession (Score: 30-52)
FOUL! Offensive foul on Nikola James! Karl Leonard drew the charge! [Team fouls: 3] (Nikola James: 1 personal fouls) TURNOVER! (dead ball)

[04:50] Team_065 possession (Score: 30-52)
D'Angelo Porzingis attempts a Layup. Contested by Tracy Westbrook (5.4 feet, MAN). D'ANGELO PORZINGIS MAKES IT! Assist: Karl Leonard
Score: 30-54

[04:38] Team_014 possession (Score: 30-54)
Tracy Westbrook attempts a 3Pt. Contested by D'Angelo Porzingis (4.0 feet, MAN). Tracy Westbrook misses. Rebound secured by Karl Leonard.

[04:24] Team_065 possession (Score: 30-54)
Paul Curry drives, Jalen Booker stays with him. Paul Curry attempts a Dunk. Contested by Jalen Booker (4.7 feet, MAN). PAUL CURRY MAKES IT! Assist: Karl Leonard
Score: 30-56

[04:09] Team_014 possession (Score: 30-56)
Tracy Westbrook attempts a Midrange. Contested by D'Angelo Porzingis (4.0 feet, MAN). Tracy Westbrook misses. Rebound secured by Vince Mobley.

[03:57] Team_065 possession (Score: 30-56)
D'Angelo Porzingis drives, picks up Collin Gasol. Help arrives from Jalen Booker! D'Angelo Porzingis attempts a Dunk. Contested by Jalen Booker (5.3 feet, ZONE). D'Angelo Porzingis misses. Rebound secured by Tracy Westbrook.

[03:40] Team_014 possession (Score: 30-56)
Bones Quickley attempts a Layup. Contested by Vince Mobley (4.1 feet, ZONE). BONES QUICKLEY MAKES IT!
Score: 32-56

[03:25] Team_065 possession (Score: 32-56)
D'Angelo Porzingis attempts a Layup. BLOCKED BY TRACY WESTBROOK! Ball deflects out of bounds off D'Angelo Porzingis.

[03:10] Team_014 possession (Score: 32-56)
Jalen Booker attempts a 3Pt. Contested by Paul Curry (4.9 feet, MAN). Jalen Booker misses. Rebound secured by Vince Mobley.

[02:57] Team_065 possession (Score: 32-56)
D'Angelo Porzingis attempts a Midrange. Contested by Tracy Westbrook (5.4 feet, MAN). D'Angelo Porzingis misses. Rebound secured by Nikola James.

[02:45] Team_014 possession (Score: 32-56)
Collin Gasol drives and kicks out. Tracy Westbrook attempts a 3Pt. Contested by Paul Curry (4.9 feet, ZONE). TRACY WESTBROOK MAKES IT! Assist: Jalen Booker
Score: 35-56

[02:35] Team_065 possession (Score: 35-56)
D'Angelo Porzingis attempts a Midrange. Contested by Tracy Westbrook (5.4 feet, MAN). D'ANGELO PORZINGIS MAKES IT!
Score: 35-58

[02:25] Team_014 possession (Score: 35-58)
Nikola James makes the Layup and draws the foul on Karl Leonard! And-1! Nikola James to the line for 1. [Team fouls: 4] (Karl Leonard: 1 personal fouls)   FT 1/1: GOOD Nikola James makes 1/1 from the line.
Score: 38-58

[02:09] Team_065 possession (Score: 38-58)
Karl Leonard drives and kicks out. Vince Mobley attempts a 3Pt. Contested by Jalen Booker (4.3 feet, ZONE). Vince Mobley misses. Rebound secured by Tracy Westbrook.

[02:00] Team_014 possession (Score: 38-58)
Tracy Westbrook attempts a 3Pt. Contested by Paul Curry (4.5 feet, ZONE). Tracy Westbrook misses. Rebound secured by D'Angelo Porzingis.

[01:44] Team_065 possession (Score: 38-58)
D'Angelo Porzingis drives and kicks out. Derrick Poole attempts a 3Pt. Contested by Bones Quickley (5.5 feet, MAN). DERRICK POOLE MAKES IT! Assist: Vince Mobley
Score: 38-61

[01:29] Team_014 possession (Score: 38-61)
Tracy Westbrook attempts a 3Pt. Contested by Paul Curry (4.5 feet, ZONE). TRACY WESTBROOK MAKES IT! Assist: Nikola James
Score: 41-61

[01:16] Team_065 possession (Score: 41-61)
Derrick Poole drives and kicks out. Paul Curry attempts a Midrange. Contested by Bones Quickley (5.5 feet, ZONE). Paul Curry misses. Offensive rebound by Vince Mobley! Vince Mobley puts it back in!
Score: 41-63

[01:03] Team_014 possession (Score: 41-63)
Collin Gasol drives and kicks out. Jalen Booker attempts a Midrange. Contested by Paul Curry (4.9 feet, MAN). Jalen Booker misses. Rebound secured by Vince Mobley.

[00:47] Team_065 possession (Score: 41-63)
Derrick Poole attempts a Layup. Contested by Collin Gasol (5.2 feet, ZONE). DERRICK POOLE MAKES IT!
Score: 41-65

[00:30] Team_014 possession (Score: 41-65)
Tracy Westbrook attempts a 3Pt. Contested by D'Angelo Porzingis (4.0 feet, ZONE). Tracy Westbrook misses. Rebound secured by Vince Mobley.

[00:14] Team_065 possession (Score: 41-65)
Derrick Poole attempts a 3Pt. Contested by Jalen Booker (4.4 feet, ZONE). Derrick Poole misses. Offensive rebound by Vince Mobley! Vince Mobley's putback is no good. Rebound secured by Tracy Westbrook.

================================================================================
                              2ND QUARTER COMPLETE                              
================================================================================

2ND QUARTER SCORE: Team_014 22, Team_065 30

BOX SCORE:
================================================================================

Team_014
--------------------------------------------------------------------------------
Player                MIN  PTS  REB  AST  TO      FG   FG%      3P   3P%
--------------------------------------------------------------------------------
Nikola James            7    5    3    2   0   2/2   100.0     0/0   0.0
Lamelo Simmons         17    4    0    0   0   2/2   100.0     0/0   0.0
DeMar Adebayo          17    3    1    0   0   1/3    33.3     0/0   0.0
Jalen Booker            7    2    0    1   0   1/3    33.3     0/0   0.0
Bones Quickley          7    2    0    0   0   1/1   100.0     0/0   0.0
Michael Cunningham     17    0    2    1   0   0/1     0.0     0/0   0.0
Jordan Anunoby         17    0    0    0   0   0/2     0.0     0/0   0.0
Ayo Murray             17    0    1    0   0   0/0     0.0     0/0   0.0
Collin Gasol            7    0    0    0   0   0/1     0.0     0/0   0.0

TEAM: FG: 9/21 (42.9%), 3PT: 2/10 (20.0%), REB: 9 (0 off, 9 def), AST: 5, TO: 3
TEAM FOULS: 3


Team_065
--------------------------------------------------------------------------------
Player                MIN  PTS  REB  AST  TO      FG   FG%      3P   3P%
--------------------------------------------------------------------------------
Paul Williamson        17    6    0    0   0   3/4    75.0     0/0   0.0
Tracy Westbrook         7    6    3    1   0   2/6    33.3     0/0   0.0
Derrick Poole           7    5    0    0   0   2/3    66.7     0/0   0.0
D'Angelo Porzingis      7    4    2    0   0   2/6    33.3     0/0   0.0
Vince Mobley            7    4    5    2   0   2/2   100.0     0/0   0.0
Manu McGrady           17    3    1    0   0   1/2    50.0     0/0   0.0
Russell Wade           17    2    2    0   0   1/2    50.0     0/0   0.0
Karl Leonard            7    2    2    3   0   1/3    33.3     0/0   0.0
Paul Curry              7    2    0    0   0   1/1   100.0     0/0   0.0
RJ Harden              17    0    2    1   0   0/0     0.0     0/0   0.0
Karl Booker            17    0    0    3   0   0/1     0.0     0/0   0.0

TEAM: FG: 13/24 (54.2%), 3PT: 1/5 (20.0%), REB: 15 (4 off, 11 def), AST: 9, TO: 0
TEAM FOULS: 4

================================================================================

================================================================================
                       3RD QUARTER - Team_014 vs Team_065                       
================================================================================

[12:00] Team_014 possession (Score: 41-65)
DeMar Adebayo makes the Midrange and draws the foul on Manu McGrady! And-1! DeMar Adebayo to the line for 1. [Team fouls: 1] (Manu McGrady: 1 personal fouls)   FT 1/1: GOOD DeMar Adebayo makes 1/1 from the line.
Score: 44-65

[11:47] Team_065 possession (Score: 44-65)
FOUL! Shooting foul on DeMar Adebayo. Karl Booker to the line for 2 free throws. [Team fouls: 1] (DeMar Adebayo: 1 personal fouls)   FT 1/2: GOOD   FT 2/2: GOOD Karl Booker makes 2/2 from the line.
Score: 44-67

[11:32] Team_014 possession (Score: 44-67)
Ayo Murray attempts a Midrange. Contested by Russell Wade (3.4 feet, MAN). AYO MURRAY MAKES IT!
Score: 46-67

[11:20] Team_065 possession (Score: 46-67)
Russell Wade drives and kicks out. Paul Williamson attempts a 3Pt. Contested by Jordan Anunoby (4.7 feet, MAN). PAUL WILLIAMSON MAKES IT! Assist: Manu McGrady
Score: 46-70

[11:07] Team_014 possession (Score: 46-70)
Jordan Anunoby attempts a 3Pt. Contested by RJ Harden (4.2 feet, ZONE). Jordan Anunoby misses. Rebound secured by Manu McGrady.

[10:57] Team_065 possession (Score: 46-70)
Karl Booker attempts a Layup. Contested by DeMar Adebayo (3.1 feet, ZONE). Karl Booker misses. Rebound secured by Ayo Murray.

[10:38] Team_014 possession (Score: 46-70)
DeMar Adebayo drives, Russell Wade stays with him. DeMar Adebayo attempts a Dunk. Contested by Russell Wade (3.0 feet, ZONE). DeMar Adebayo misses. Offensive rebound by Ayo Murray! Ayo Murray kicks it out.

[10:21] Team_014 possession (Score: 46-70)
Jordan Anunoby drives to the basket... FOUL! Offensive foul on Jordan Anunoby! Paul Williamson drew the charge! [Team fouls: 2] (Jordan Anunoby: 1 personal fouls) TURNOVER! (dead ball)

[10:09] Team_065 possession (Score: 46-70)
Russell Wade attempts a Midrange. Contested by DeMar Adebayo (3.2 feet, MAN). Russell Wade misses. Rebound secured by Michael Cunningham.

[09:54] Team_014 possession (Score: 46-70)
Lamelo Simmons attempts a 3Pt. Contested by Manu McGrady (5.0 feet, MAN). Lamelo Simmons misses. Rebound secured by Manu McGrady.

[09:40] Team_065 possession (Score: 46-70)
Paul Williamson attempts a Midrange. Contested by Lamelo Simmons (4.1 feet, ZONE). Paul Williamson misses. Rebound secured by Ayo Murray.

[09:29] Team_014 possession (Score: 46-70)
Lamelo Simmons attempts a 3Pt. Contested by Manu McGrady (5.0 feet, MAN). Lamelo Simmons misses. Offensive rebound by DeMar Adebayo! DeMar Adebayo kicks it out.

[09:14] Team_014 possession (Score: 46-70)
Jordan Anunoby attempts a Midrange. Contested by RJ Harden (4.2 feet, ZONE). Jordan Anunoby misses. Rebound secured by Manu McGrady.

[09:04] Team_065 possession (Score: 46-70)
FOUL! Holding foul on Ayo Murray. [Team fouls: 3] No free throws, side out. (Ayo Murray: 1 personal fouls)

[08:51] Team_065 possession (Score: 46-70)
RJ Harden attempts a 3Pt. Contested by Michael Cunningham (4.4 feet, ZONE). RJ Harden misses. Rebound secured by Michael Cunningham.

[08:37] Team_014 possession (Score: 46-70)
DeMar Adebayo attempts a Layup. Contested by Russell Wade (3.0 feet, ZONE). DEMAR ADEBAYO MAKES IT! Assist: Lamelo Simmons
Score: 48-70

[08:20] Team_065 possession (Score: 48-70)
Russell Wade attempts a 3Pt. Contested by DeMar Adebayo (3.2 feet, MAN). Russell Wade misses. Offensive rebound by Manu McGrady! Manu McGrady kicks it out.

[08:06] Team_065 possession (Score: 48-70)
Manu McGrady attempts a Layup. Contested by Lamelo Simmons (3.9 feet, MAN). Manu McGrady misses. FOUL! Loose ball foul on Michael Cunningham during the rebound battle. [Team fouls: 4] No free throws, side out. (Michael Cunningham: 1 personal fouls)

[07:50] Team_065 possession (Score: 48-70)
Russell Wade makes the Layup and draws the foul on DeMar Adebayo! And-1! Russell Wade to the line for 1. [BONUS: 5 team fouls] (DeMar Adebayo: 2 personal fouls)   FT 1/1: GOOD Russell Wade makes 1/1 from the line.
Score: 48-73

[07:34] Team_014 possession (Score: 48-73)
DeMar Adebayo attempts a 3Pt. Contested by Russell Wade (3.0 feet, MAN). DeMar Adebayo misses. Rebound secured by Russell Wade.

[07:22] Team_065 possession (Score: 48-73)
Paul Williamson attempts a Layup. BLOCKED BY JORDAN ANUNOBY! Ball is loose! Rebound secured by DeMar Adebayo.

[07:08] Team_014 possession (Score: 48-73)
Jordan Anunoby attempts a Layup. Contested by Russell Wade (3.3 feet, ZONE). JORDAN ANUNOBY MAKES IT! Assist: Ayo Murray
Score: 50-73

[06:52] Team_065 possession (Score: 50-73)
Russell Wade attempts a 3Pt. Contested by DeMar Adebayo (3.2 feet, MAN). Russell Wade misses. Offensive rebound by Manu McGrady! Manu McGrady kicks it out.

[06:40] Team_065 possession (Score: 50-73)
Russell Wade loses the ball! Stripped by DeMar Adebayo! TURNOVER! (live ball)

[06:22] Team_014 possession (Score: 50-73)
DeMar Adebayo attempts a Layup. Contested by Russell Wade (3.0 feet, MAN). DEMAR ADEBAYO MAKES IT! Assist: Ayo Murray
Score: 52-73

[06:06] Team_065 possession (Score: 52-73)
Russell Wade attempts a Layup. Contested by DeMar Adebayo (3.2 feet, MAN). RUSSELL WADE MAKES IT! Assist: Karl Booker
Score: 52-75

[05:51] Team_014 possession (Score: 52-75)
Lamelo Simmons attempts a Midrange. Contested by Manu McGrady (5.0 feet, MAN). Lamelo Simmons misses. Rebound secured by Manu McGrady.

[05:38] Team_065 possession (Score: 52-75)
Karl Booker attempts a Midrange. Contested by Jordan Anunoby (4.7 feet, ZONE). KARL BOOKER MAKES IT! Assist: RJ Harden
Score: 52-77

[05:23] Team_014 possession (Score: 52-77)
Michael Cunningham makes the Layup and draws the foul on RJ Harden! And-1! Michael Cunningham to the line for 1. [Team fouls: 2] (RJ Harden: 1 personal fouls)   FT 1/1: GOOD Michael Cunningham makes 1/1 from the line.
Score: 55-77

[05:07] Team_065 possession (Score: 55-77)
Manu McGrady attempts a 3Pt. Contested by Jordan Anunoby (4.7 feet, ZONE). Manu McGrady misses. Rebound secured by Michael Cunningham.

[04:52] Team_014 possession (Score: 55-77)
Lamelo Simmons drives, Manu McGrady stays with him. Lamelo Simmons attempts a Dunk. Contested by Manu McGrady (5.0 feet, MAN). Lamelo Simmons misses. Rebound secured by Russell Wade.

[04:35] Team_065 possession (Score: 55-77)
FOUL! Offensive foul on Karl Booker! Ayo Murray drew the charge! [Team fouls: 3] (Karl Booker: 1 personal fouls) TURNOVER! (dead ball)

[04:21] Team_014 possession (Score: 55-77)
Jordan Anunoby attempts a 3Pt. Contested by Paul Williamson (3.7 feet, MAN). JORDAN ANUNOBY MAKES IT! Assist: DeMar Adebayo
Score: 58-77

[04:11] Team_065 possession (Score: 58-77)
Karl Booker attempts a Layup. Contested by Ayo Murray (4.9 feet, MAN). Karl Booker misses. Rebound secured by Michael Cunningham.

[03:55] Team_014 possession (Score: 58-77)
Jordan Anunoby attempts a 3Pt. Contested by RJ Harden (4.2 feet, ZONE). Jordan Anunoby misses. Rebound secured by RJ Harden.

[03:39] Team_065 possession (Score: 58-77)
Paul Williamson drives and kicks out. Karl Booker attempts a Midrange. Contested by Ayo Murray (4.9 feet, MAN). KARL BOOKER MAKES IT!
Score: 58-79

[03:24] Team_014 possession (Score: 58-79)
Jordan Anunoby attempts a Layup. Contested by Russell Wade (3.5 feet, ZONE). JORDAN ANUNOBY MAKES IT!
Score: 60-79

[03:08] Team_065 possession (Score: 60-79)
Paul Williamson makes the Dunk and draws the foul on Jordan Anunoby! And-1! Paul Williamson to the line for 1. [BONUS: 6 team fouls] (Jordan Anunoby: 2 personal fouls)   FT 1/1: GOOD Paul Williamson makes 1/1 from the line.
Score: 60-82

[02:53] Team_014 possession (Score: 60-82)
DeMar Adebayo drives, Russell Wade stays with him. DeMar Adebayo attempts a Dunk. Contested by Russell Wade (3.1 feet, ZONE). DeMar Adebayo misses. Rebound secured by Russell Wade.

[02:41] Team_065 possession (Score: 60-82)
Paul Williamson attempts a 3Pt. Contested by Jordan Anunoby (5.0 feet, MAN). Paul Williamson misses. Offensive rebound by Manu McGrady! Manu McGrady kicks it out.

[02:27] Team_065 possession (Score: 60-82)
Paul Williamson attempts a 3Pt. Contested by Jordan Anunoby (5.1 feet, MAN). Paul Williamson misses. Rebound secured by DeMar Adebayo.

[02:14] Team_014 possession (Score: 60-82)
DeMar Adebayo attempts a Midrange. Contested by Russell Wade (3.2 feet, MAN). DeMar Adebayo misses. Offensive rebound by Ayo Murray! Ayo Murray kicks it out.

[02:04] Team_014 possession (Score: 60-82)
Michael Cunningham makes the Layup and draws the foul on RJ Harden! And-1! Michael Cunningham to the line for 1. [Team fouls: 4] (RJ Harden: 2 personal fouls)   FT 1/1: MISS Michael Cunningham makes 0/1 from the line. Offensive rebound by Ayo Murray! Ayo Murray kicks it out.
Score: 62-82

[01:53] Team_014 possession (Score: 62-82)
Michael Cunningham drives to the basket... Michael Cunningham throws a bad pass out of bounds! TURNOVER! (dead ball)

[01:53] Substitution (Team_014): Michael Cunningham OUT → Jalen Booker IN (stamina_rule2)

[01:53] Substitution (Team_014): Jordan Anunoby OUT → Bones Quickley IN (stamina_rule2)

[01:53] Substitution (Team_014): Lamelo Simmons OUT → Tracy Westbrook IN (stamina_rule2)

[01:53] Substitution (Team_014): DeMar Adebayo OUT → Nikola James IN (stamina_rule2)

[01:53] Substitution (Team_014): Ayo Murray OUT → Collin Gasol IN (stamina_rule2)

[01:53] Substitution (Team_065): RJ Harden OUT → Paul Curry IN (stamina_rule2)

[01:53] Substitution (Team_065): Paul Williamson OUT → Derrick Poole IN (stamina_rule2)

[01:53] Substitution (Team_065): Manu McGrady OUT → D'Angelo Porzingis IN (stamina_rule2)

[01:53] Substitution (Team_065): Russell Wade OUT → Karl Leonard IN (stamina_rule2)

[01:53] Substitution (Team_065): Karl Booker OUT → Vince Mobley IN (stamina_rule2)

[01:37] Team_065 possession (Score: 62-82)
FOUL! Shooting foul on Bones Quickley. Derrick Poole to the line for 2 free throws. [BONUS: 7 team fouls] (Bones Quickley: 1 personal fouls)   FT 1/2: MISS   FT 2/2: GOOD Derrick Poole makes 1/2 from the line.
Score: 62-83

[01:19] Team_014 possession (Score: 62-83)
Tracy Westbrook drives and kicks out. Bones Quickley attempts a 3Pt. Contested by Derrick Poole (5.0 feet, MAN). Bones Quickley misses. Rebound secured by D'Angelo Porzingis.

[01:06] Team_065 possession (Score: 62-83)
D'Angelo Porzingis drives to the basket... D'Angelo Porzingis throws a bad pass! Stolen by Collin Gasol! TURNOVER! (live ball)

[00:53] Team_014 possession (Score: 62-83)
Collin Gasol drives, picks up Vince Mobley. Help arrives from Derrick Poole! Collin Gasol attempts a Dunk. Contested by Derrick Poole (4.6 feet, MAN). COLLIN GASOL MAKES IT! Assist: Bones Quickley
Score: 64-83

[00:38] Team_065 possession (Score: 64-83)
Paul Curry attempts a 3Pt. Contested by Jalen Booker (4.7 feet, ZONE). Paul Curry misses. Rebound secured by Collin Gasol.

[00:25] Team_014 possession (Score: 64-83)
Tracy Westbrook attempts a 3Pt. Contested by Paul Curry (4.5 feet, ZONE). Tracy Westbrook misses. Rebound secured by Vince Mobley.

[00:13] Team_065 possession (Score: 64-83)
Derrick Poole attempts a Midrange. Contested by Bones Quickley (5.6 feet, MAN). DERRICK POOLE MAKES IT! Assist: Paul Curry
Score: 64-85

[00:02] Team_014 possession (Score: 64-85)
FOUL! Reach-in foul on Vince Mobley during the drive. [IN THE BONUS! 5 team fouls] Collin Gasol to the line for 2 free throws. (Vince Mobley: 1 personal fouls)   FT 1/2: GOOD   FT 2/2: GOOD Collin Gasol makes 2/2 from the line.
Score: 66-85

================================================================================
                              3RD QUARTER COMPLETE                              
================================================================================

3RD QUARTER SCORE: Team_014 25, Team_065 20

BOX SCORE:
================================================================================

Team_014
--------------------------------------------------------------------------------
Player                MIN  PTS  REB  AST  TO      FG   FG%      3P   3P%
--------------------------------------------------------------------------------
DeMar Adebayo          27    7    3    1   0   3/5    60.0     0/0   0.0
Jordan Anunoby         27    7    0    0   0   3/6    50.0     0/0   0.0
Collin Gasol            9    4    1    0   0   2/2   100.0     0/0   0.0
Michael Cunningham     27    3    4    0   0   1/1   100.0     0/0   0.0
Ayo Murray             27    2    5    2   0   1/1   100.0     0/0   0.0
Lamelo Simmons         27    0    0    1   0   0/3     0.0     0/0   0.0
Tracy Westbrook         9    0    0    0   0   0/2     0.0     0/0   0.0
Bones Quickley          9    0    0    1   0   0/0     0.0     0/0   0.0

TEAM: FG: 10/20 (50.0%), 3PT: 1/6 (16.7%), REB: 13 (4 off, 9 def), AST: 5, TO: 2
TEAM FOULS: 7 [Team_065 in BONUS]


Team_065
--------------------------------------------------------------------------------
Player                MIN  PTS  REB  AST  TO      FG   FG%      3P   3P%
--------------------------------------------------------------------------------
Karl Booker            27    6    0    1   0   3/5    60.0     0/0   0.0
Paul Williamson        27    6    0    0   0   2/5    40.0     0/0   0.0
Russell Wade           27    5    3    0   0   2/3    66.7     0/0   0.0
Derrick Poole           9    3    0    0   0   2/2   100.0     0/0   0.0
Manu McGrady           27    0    8    1   0   0/1     0.0     0/0   0.0
RJ Harden              27    0    1    1   0   0/1     0.0     0/0   0.0
D'Angelo Porzingis      9    0    1    0   0   0/0     0.0     0/0   0.0
Paul Curry              9    0    0    1   0   0/1     0.0     0/0   0.0
Vince Mobley            9    0    1    0   0   0/0     0.0     0/0   0.0

TEAM: FG: 9/18 (50.0%), 3PT: 0/4 (0.0%), REB: 14 (4 off, 10 def), AST: 4, TO: 3
TEAM FOULS: 5 [Team_014 in BONUS]

================================================================================

================================================================================
                       4TH QUARTER - Team_014 vs Team_065                       
================================================================================

[12:00] Substitution (Team_014): Michael Cunningham OUT (stamina: 77) → Jalen Booker IN (comeback_detected)

[12:00] Substitution (Team_065): RJ Harden OUT (stamina: 78) → Paul Curry IN (comeback_detected)

[12:00] Team_014 possession (Score: 66-85)
Lamelo Simmons throws a bad pass! Stolen by Manu McGrady! TURNOVER! (live ball)

[11:48] Team_065 possession (Score: 66-85)
Karl Booker attempts a Layup. Contested by Ayo Murray (4.8 feet, MAN). KARL BOOKER MAKES IT! Assist: Russell Wade
Score: 66-87

[11:30] Team_014 possession (Score: 66-87)
Ayo Murray drives, picks up Russell Wade. Help arrives from Paul Williamson! Ayo Murray attempts a Dunk. Contested by Paul Williamson (3.4 feet, MAN). Ayo Murray misses. Rebound secured by Karl Booker.

[11:19] Team_065 possession (Score: 66-87)
Paul Curry attempts a Layup. Contested by Jalen Booker (4.7 feet, MAN). Paul Curry misses. Rebound secured by DeMar Adebayo.

[11:08] Team_014 possession (Score: 66-87)
Jordan Anunoby attempts a Midrange. Contested by Paul Williamson (3.8 feet, ZONE). JORDAN ANUNOBY MAKES IT! Assist: DeMar Adebayo
Score: 68-87

[10:54] Team_065 possession (Score: 68-87)
Paul Curry attempts a 3Pt. Contested by Jalen Booker (4.7 feet, MAN). Paul Curry misses. Rebound secured by DeMar Adebayo.

[10:39] Team_014 possession (Score: 68-87)
Jalen Booker attempts a Midrange. Contested by Paul Curry (4.9 feet, MAN). Jalen Booker misses. Rebound secured by Manu McGrady.

[10:20] Team_065 possession (Score: 68-87)
Russell Wade makes the Layup and draws the foul on Jordan Anunoby! And-1! Russell Wade to the line for 1. [Team fouls: 1] (Jordan Anunoby: 1 personal fouls)   FT 1/1: GOOD Russell Wade makes 1/1 from the line.
Score: 68-90

[10:08] Team_014 possession (Score: 68-90)
Jalen Booker drives, picks up Paul Curry. Help arrives from Manu McGrady! Jalen Booker attempts a Layup. Contested by Manu McGrady (4.9 feet, MAN). JALEN BOOKER MAKES IT! Assist: Lamelo Simmons
Score: 70-90

[09:58] Team_065 possession (Score: 70-90)
Karl Booker attempts a 3Pt. Contested by Ayo Murray (5.0 feet, MAN). Karl Booker misses. Rebound secured by Lamelo Simmons.

[09:40] Team_014 possession (Score: 70-90)
Jalen Booker drives, picks up Karl Booker. Help arrives from Paul Williamson! Jalen Booker attempts a Dunk. Contested by Paul Williamson (5.1 feet, ZONE). JALEN BOOKER MAKES IT! Assist: DeMar Adebayo
Score: 72-90

[09:21] Team_065 possession (Score: 72-90)
Paul Curry loses the ball! Stripped by Jalen Booker! TURNOVER! (live ball)

[09:07] Team_014 possession (Score: 72-90)
Ayo Murray drives and kicks out. Ayo Murray attempts a 3Pt. Contested by Russell Wade (3.4 feet, ZONE). Ayo Murray misses. FOUL! Loose ball foul on Karl Booker during the rebound battle. [Team fouls: 1] No free throws, side out. (Karl Booker: 1 personal fouls)

[08:54] Team_014 possession (Score: 72-90)
Jalen Booker drives, picks up Paul Curry. Help arrives from Manu McGrady! Jalen Booker attempts a Dunk. Contested by Manu McGrady (4.9 feet, MAN). Jalen Booker misses. Rebound secured by Manu McGrady.

[08:42] Team_065 possession (Score: 72-90)
Russell Wade attempts a Layup. Contested by DeMar Adebayo (3.7 feet, ZONE). RUSSELL WADE MAKES IT! Assist: Paul Williamson
Score: 72-92

[08:26] Team_014 possession (Score: 72-92)
DeMar Adebayo drives, Russell Wade stays with him. DeMar Adebayo attempts a Dunk. Contested by Russell Wade (3.3 feet, MAN). DEMAR ADEBAYO MAKES IT! Assist: Ayo Murray
Score: 74-92

[08:14] Team_065 possession (Score: 74-92)
Karl Booker drives to the basket... Karl Booker loses control! Ball rolls out of bounds! TURNOVER! (dead ball)

[08:14] Substitution (Team_014): Jordan Anunoby OUT → Bones Quickley IN (stamina_rule2)

[08:14] Substitution (Team_014): Lamelo Simmons OUT → Tracy Westbrook IN (stamina_rule2)

[08:14] Substitution (Team_014): DeMar Adebayo OUT → Nikola James IN (stamina_rule2)

[08:14] Substitution (Team_014): Ayo Murray OUT → Collin Gasol IN (stamina_rule2)

[08:14] Substitution (Team_065): Paul Williamson OUT → Derrick Poole IN (stamina_rule2)

[08:14] Substitution (Team_065): Manu McGrady OUT → D'Angelo Porzingis IN (stamina_rule2)

[08:14] Substitution (Team_065): Russell Wade OUT → Karl Leonard IN (stamina_rule2)

[08:14] Substitution (Team_065): Karl Booker OUT → Vince Mobley IN (stamina_rule2)

[08:00] Team_014 possession (Score: 74-92)
Collin Gasol drives, picks up Vince Mobley. Help arrives from Derrick Poole! Collin Gasol attempts a Dunk. Contested by Derrick Poole (4.6 feet, MAN). COLLIN GASOL MAKES IT! Assist: Bones Quickley
Score: 76-92

[07:45] Team_065 possession (Score: 76-92)
FOUL! Reach-in foul on Collin Gasol during the drive. [Team fouls: 2] No free throws, side out. (Collin Gasol: 1 personal fouls)

[07:34] Team_065 possession (Score: 76-92)
Paul Curry attempts a 3Pt. Contested by Bones Quickley (6.0 feet, ZONE). Paul Curry misses. Rebound secured by Tracy Westbrook.

[07:20] Team_014 possession (Score: 76-92)
FOUL! Shooting foul on Vince Mobley. Tracy Westbrook to the line for 2 free throws. [Team fouls: 2] (Vince Mobley: 1 personal fouls)   FT 1/2: GOOD   FT 2/2: GOOD Tracy Westbrook makes 2/2 from the line.
Score: 78-92

[07:07] Team_065 possession (Score: 78-92)
Paul Curry throws a bad pass! Stolen by Jalen Booker! TURNOVER! (live ball)

[06:49] Team_014 possession (Score: 78-92)
Nikola James attempts a Midrange. Contested by Karl Leonard (4.6 feet, MAN). Nikola James misses. Offensive rebound by Nikola James! Nikola James kicks it out.

[06:38] Team_014 possession (Score: 78-92)
Nikola James attempts a Midrange. Contested by Karl Leonard (4.6 feet, MAN). NIKOLA JAMES MAKES IT!
Score: 80-92

[06:24] Team_065 possession (Score: 80-92)
D'Angelo Porzingis attempts a 3Pt. Contested by Tracy Westbrook (5.4 feet, MAN). D'Angelo Porzingis misses. FOUL! Loose ball foul on Tracy Westbrook during the rebound battle. [Team fouls: 3] No free throws, side out. (Tracy Westbrook: 1 personal fouls)

[06:08] Team_065 possession (Score: 80-92)
D'Angelo Porzingis attempts a 3Pt. Contested by Tracy Westbrook (5.4 feet, MAN). D'Angelo Porzingis misses. Offensive rebound by Vince Mobley! Vince Mobley's putback is no good. Rebound secured by Collin Gasol.

[05:53] Team_014 possession (Score: 80-92)
Jalen Booker attempts a 3Pt. Contested by Paul Curry (5.0 feet, ZONE). JALEN BOOKER MAKES IT! Assist: Collin Gasol
Score: 83-92

[05:41] Team_065 possession (Score: 83-92)
FOUL! Reach-in foul on Collin Gasol during the drive. [Team fouls: 4] No free throws, side out. (Collin Gasol: 2 personal fouls)

[05:29] Team_065 possession (Score: 83-92)
Karl Leonard drives and kicks out. D'Angelo Porzingis attempts a 3Pt. Contested by Jalen Booker (4.5 feet, ZONE). D'Angelo Porzingis misses. Rebound secured by Nikola James.

[05:19] Team_014 possession (Score: 83-92)
Jalen Booker throws a bad pass! Stolen by Paul Curry! TURNOVER! (live ball)

[05:04] Team_065 possession (Score: 83-92)
Vince Mobley drives and kicks out. Derrick Poole attempts a 3Pt. Contested by Bones Quickley (5.5 feet, MAN). DERRICK POOLE MAKES IT! Assist: Karl Leonard
Score: 83-95

[04:47] Team_014 possession (Score: 83-95)
Tracy Westbrook attempts a 3Pt. Contested by D'Angelo Porzingis (4.0 feet, MAN). Tracy Westbrook misses. Rebound secured by D'Angelo Porzingis.

[04:35] Team_065 possession (Score: 83-95)
Paul Curry drives, picks up Jalen Booker. Help arrives from Tracy Westbrook! Paul Curry attempts a Layup. Contested by Tracy Westbrook (4.9 feet, MAN). PAUL CURRY MAKES IT! Assist: D'Angelo Porzingis
Score: 83-97

[04:25] Team_014 possession (Score: 83-97)
Tracy Westbrook drives to the basket... Tracy Westbrook loses the ball! Stripped by D'Angelo Porzingis! TURNOVER! (live ball)

[04:08] Team_065 possession (Score: 83-97)
Vince Mobley drives, picks up Collin Gasol. Help arrives from Bones Quickley! Vince Mobley attempts a Layup. Contested by Bones Quickley (5.1 feet, MAN). Vince Mobley misses. Offensive rebound by D'Angelo Porzingis! D'Angelo Porzingis kicks it out.

[03:54] Team_065 possession (Score: 83-97)
Derrick Poole attempts a Layup. BLOCKED BY BONES QUICKLEY! Ball goes out off Bones Quickley. Derrick Poole's ball!

[03:41] Team_065 possession (Score: 83-97)
Vince Mobley attempts a Midrange. Contested by Collin Gasol (5.1 feet, MAN). VINCE MOBLEY MAKES IT! Assist: Karl Leonard
Score: 83-99

[03:28] Team_014 possession (Score: 83-99)
FOUL! Reach-in foul on Karl Leonard during the drive. [Team fouls: 3] No free throws, side out. (Karl Leonard: 1 personal fouls)

[03:12] Team_014 possession (Score: 83-99)
Tracy Westbrook attempts a 3Pt. Contested by D'Angelo Porzingis (4.0 feet, ZONE). TRACY WESTBROOK MAKES IT! Assist: Nikola James
Score: 86-99

[02:54] Team_065 possession (Score: 86-99)
Derrick Poole attempts a Midrange. Contested by Bones Quickley (5.6 feet, MAN). Derrick Poole misses. Rebound secured by Nikola James.

[02:41] Team_014 possession (Score: 86-99)
Jalen Booker attempts a 3Pt. Contested by Paul Curry (5.3 feet, MAN). Jalen Booker misses. Rebound secured by D'Angelo Porzingis.

[02:24] Team_065 possession (Score: 86-99)
Paul Curry attempts a 3Pt. Contested by Jalen Booker (5.2 feet, MAN). Paul Curry misses. Offensive rebound by Vince Mobley! Vince Mobley's putback is no good. Rebound secured by Nikola James.

[02:09] Team_014 possession (Score: 86-99)
FOUL! Offensive foul on Tracy Westbrook! D'Angelo Porzingis drew the charge! [Team fouls: 5] (Tracy Westbrook: 2 personal fouls) TURNOVER! (dead ball)

[01:55] Team_065 possession (Score: 86-99)
D'Angelo Porzingis attempts a 3Pt. Contested by Tracy Westbrook (5.5 feet, MAN). D'ANGELO PORZINGIS MAKES IT! Assist: Vince Mobley
Score: 86-102

[01:38] Team_014 possession (Score: 86-102)
Nikola James attempts a 3Pt. Contested by Karl Leonard (4.6 feet, MAN). Nikola James misses. Offensive rebound by Collin Gasol! Collin Gasol puts it back in!
Score: 88-102

[01:24] Team_065 possession (Score: 88-102)
FOUL! Holding foul on Nikola James. [IN THE BONUS! 6 team fouls] Karl Leonard to the line for 2 free throws. (Nikola James: 1 personal fouls)   FT 1/2: GOOD   FT 2/2: GOOD Karl Leonard makes 2/2 from the line.
Score: 88-104

[01:09] Team_014 possession (Score: 88-104)
Collin Gasol attempts a 3Pt. Contested by Vince Mobley (4.8 feet, MAN). Collin Gasol misses. Rebound secured by D'Angelo Porzingis.

[00:55] Team_065 possession (Score: 88-104)
Derrick Poole attempts a 3Pt. Contested by Bones Quickley (5.7 feet, ZONE). DERRICK POOLE MAKES IT! Assist: Paul Curry
Score: 88-107

[00:43] Team_014 possession (Score: 88-107)
FOUL! Holding foul on Derrick Poole. [Team fouls: 4] No free throws, side out. (Derrick Poole: 1 personal fouls)

[00:33] Team_014 possession (Score: 88-107)
Bones Quickley attempts a 3Pt. Contested by D'Angelo Porzingis (4.4 feet, ZONE). Bones Quickley misses. Rebound secured by D'Angelo Porzingis.

[00:21] Team_065 possession (Score: 88-107)
D'Angelo Porzingis attempts a 3Pt. Contested by Bones Quickley (5.8 feet, ZONE). D'Angelo Porzingis misses. Offensive rebound by Vince Mobley! Vince Mobley puts it back in!
Score: 88-109

[00:05] Team_014 possession (Score: 88-109)
Nikola James attempts a 3Pt. Contested by D'Angelo Porzingis (4.6 feet, ZONE). Nikola James misses. Rebound secured by D'Angelo Porzingis.

================================================================================
                              4TH QUARTER COMPLETE                              
================================================================================

4TH QUARTER SCORE: Team_014 22, Team_065 24

BOX SCORE:
================================================================================

Team_014
--------------------------------------------------------------------------------
Player                MIN  PTS  REB  AST  TO      FG   FG%      3P   3P%
--------------------------------------------------------------------------------
Jalen Booker           21    7    0    0   0   3/6    50.0     0/0   0.0
Tracy Westbrook        17    5    1    0   0   2/3    66.7     0/0   0.0
Collin Gasol           17    4    2    1   0   2/3    66.7     0/0   0.0
DeMar Adebayo          31    2    3    2   0   1/1   100.0     0/0   0.0
Jordan Anunoby         31    2    0    0   0   1/1   100.0     0/0   0.0
Nikola James           17    2    4    1   0   1/2    50.0     0/0   0.0
Ayo Murray             31    0    0    1   0   0/1     0.0     0/0   0.0
Lamelo Simmons         31    0    1    1   0   0/0     0.0     0/0   0.0
Bones Quickley         17    0    0    1   0   0/1     0.0     0/0   0.0

TEAM: FG: 10/18 (55.6%), 3PT: 3/8 (37.5%), REB: 9 (3 off, 6 def), AST: 7, TO: 4
TEAM FOULS: 6 [Team_065 in BONUS]


Team_065
--------------------------------------------------------------------------------
Player                MIN  PTS  REB  AST  TO      FG   FG%      3P   3P%
--------------------------------------------------------------------------------
Derrick Poole          17    6    0    0   0   2/3    66.7     0/0   0.0
Russell Wade           31    5    0    1   0   2/2   100.0     0/0   0.0
Vince Mobley           17    4    2    1   0   2/2   100.0     0/0   0.0
D'Angelo Porzingis     17    3    6    1   0   1/2    50.0     0/0   0.0
Karl Booker            31    2    1    0   0   1/2    50.0     0/0   0.0
Paul Curry             21    2    0    1   0   1/5    20.0     0/0   0.0
Karl Leonard           17    2    0    2   0   1/2    50.0     0/0   0.0
Manu McGrady           31    0    2    0   0   0/0     0.0     0/0   0.0
Paul Williamson        31    0    0    1   0   0/0     0.0     0/0   0.0

TEAM: FG: 10/18 (55.6%), 3PT: 3/8 (37.5%), REB: 13 (5 off, 8 def), AST: 7, TO: 3
TEAM FOULS: 4

================================================================================

================================================================================
                               FULL GAME COMPLETE                               
================================================================================

FINAL SCORE: Team_014 88, Team_065 109

SCORING BY QUARTER:
--------------------------------------------------------------------------------
Team                     Q1     Q2     Q3     Q4    FINAL
--------------------------------------------------------------------------------
Team_014                 19     22     25     22       88
Team_065                 35     30     20     24      109
--------------------------------------------------------------------------------

FULL GAME BOX SCORE:
================================================================================

Team_014
--------------------------------------------------------------------------------
Player                MIN  PTS  REB  AST  TO      FG   FG%      3P   3P%      FT STL BLK
--------------------------------------------------------------------------------
Jordan Anunoby         31   11    0    0   1   5/12   41.7   1/5    20.0   2/2     0   1
Lamelo Simmons         31    9    1    2   1   4/9    44.4   1/2    50.0   4/4     0   0
DeMar Adebayo          31   16   10    5   1   7/16   43.8   1/4    25.0   1/3     1   0
Ayo Murray             31    8   11    5   2   4/8    50.0   0/0     0.0   2/3     0   0
Michael Cunningham     27    3    7    3   1   1/3    33.3   0/1     0.0   1/2     0   0
Jalen Booker           21    9    0    1   1   4/9    44.4   1/4    25.0   0/0     2   0
Bones Quickley         17    2    0    2   0   1/2    50.0   0/1     0.0   0/0     0   1
Tracy Westbrook        17   11    4    1   1   3/10   30.0   2/7    28.6   2/2     0   1
Nikola James           17    7    7    3   2   4/5    80.0   1/2    50.0   1/1     0   0
Collin Gasol           17    8    3    1   0   4/6    66.7   0/1     0.0   2/2     1   0

TEAM: FG: 37/80 (46.2%), 3PT: 7/27 (25.9%), REB: 38 (9 off, 29 def), AST: 23, TO: 10


Team_065
--------------------------------------------------------------------------------
Player                MIN  PTS  REB  AST  TO      FG   FG%      3P   3P%      FT STL BLK
--------------------------------------------------------------------------------
Paul Williamson        31   12    0    1   1   5/10   50.0   0/1     0.0   1/1     0   1
Manu McGrady           31   23   18    1   0   8/12   66.7   3/5    60.0   4/4     1   0
Russell Wade           31   19   13    2   1   8/13   61.5   0/2     0.0   5/8     1   1
Karl Booker            31   10    1    5   1   6/10   60.0   1/2    50.0   4/5     0   0
RJ Harden              27    6    4    3   0   3/5    60.0   1/2    50.0   2/2     0   0
Paul Curry             21    4    0    2   2   2/7    28.6   0/4     0.0   0/0     1   0
Derrick Poole          17   14    0    0   0   5/7    71.4   1/2    50.0   1/2     0   0
D'Angelo Porzingis     17    7    9    1   1   5/10   50.0   2/4    50.0   0/0     1   0
Karl Leonard           17    4    2    5   0   1/4    25.0   0/1     0.0   2/2     0   0
Vince Mobley           17    8    8    3   0   3/3   100.0   0/0     0.0   0/0     0   0

TEAM: FG: 47/82 (57.3%), 3PT: 8/23 (34.8%), REB: 60 (18 off, 42 def), AST: 23, TO: 6

================================================================================
