================================================================================
                        FULL GAME - Team_019 vs Team_051                        
================================================================================

================================================================================
                       1ST QUARTER - Team_019 vs Team_051                       
================================================================================

[12:00] Team_019 possession (Score: 0-0)
Rudy Giddey attempts a 3Pt. Contested by Austin Sexton (4.6 feet, ZONE). RUDY GIDDEY MAKES IT! Assist: D'Angelo Randle
Score: 3-0

[11:44] Team_051 possession (Score: 3-0)
Austin Sexton attempts a 3Pt. Contested by Rudy Giddey (5.3 feet, ZONE). Austin Sexton misses. Offensive rebound by Franz Simmons! Franz Simmons kicks it out.

[11:24] Team_051 possession (Score: 3-0)
OG Siakam attempts a 3Pt. Contested by D'Angelo Randle (3.9 feet, ZONE). OG Siakam misses. Rebound secured by Tobias Hyland.

[11:10] Team_019 possession (Score: 3-0)
Brandon James attempts a Layup. Contested by Larry McGrady (4.5 feet, MAN). BRANDON JAMES MAKES IT! Assist: Rudy Giddey
Score: 5-0

[10:55] Team_051 possession (Score: 5-0)
Shaquille Harden throws a bad pass out of bounds! TURNOVER! (dead ball)

[10:36] Team_019 possession (Score: 5-0)
D'Angelo Randle drives, picks up OG Siakam. Help arrives from Larry McGrady! D'Angelo Randle attempts a Layup. Contested by Larry McGrady (4.1 feet, MAN). D'ANGELO RANDLE MAKES IT! Assist: DeMar James
Score: 7-0

[10:23] Team_051 possession (Score: 7-0)
Austin Sexton attempts a Layup. Contested by DeMar James (4.2 feet, ZONE). AUSTIN SEXTON MAKES IT! Assist: OG Siakam
Score: 7-2

[10:12] Team_019 possession (Score: 7-2)
D'Angelo Randle attempts a 3Pt. Contested by Austin Sexton (4.6 feet, ZONE). D'ANGELO RANDLE MAKES IT! Assist: Tobias Hyland
Score: 10-2

[09:58] Team_051 possession (Score: 10-2)
FOUL! Shooting foul on Brandon James. Larry McGrady to the line for 3 free throws. [Team fouls: 1] (Brandon James: 1 personal fouls)   FT 1/3: MISS   FT 2/3: GOOD   FT 3/3: GOOD Larry McGrady makes 2/3 from the line.
Score: 10-4

[09:49] Team_019 possession (Score: 10-4)
DeMar James attempts a Layup. BLOCKED BY LARRY MCGRADY! Ball is loose! Offensive rebound by D'Angelo Randle! D'Angelo Randle kicks it out.

[09:34] Team_019 possession (Score: 10-4)
Tobias Hyland attempts a Midrange. Contested by Larry McGrady (4.5 feet, ZONE). TOBIAS HYLAND MAKES IT!
Score: 12-4

[09:15] Team_051 possession (Score: 12-4)
Austin Sexton attempts a 3Pt. Contested by Rudy Giddey (5.3 feet, MAN). Austin Sexton misses. Rebound secured by Tobias Hyland.

[09:04] Team_019 possession (Score: 12-4)
FOUL! Shooting foul on Shaquille Harden. DeMar James to the line for 2 free throws. [Team fouls: 1] (Shaquille Harden: 1 personal fouls)   FT 1/2: GOOD   FT 2/2: GOOD DeMar James makes 2/2 from the line.
Score: 14-4

[08:53] Team_051 possession (Score: 14-4)
OG Siakam makes the Layup and draws the foul on DeMar James! And-1! OG Siakam to the line for 1. [Team fouls: 2] (DeMar James: 1 personal fouls)   FT 1/1: GOOD OG Siakam makes 1/1 from the line.
Score: 14-7

[08:43] Team_019 possession (Score: 14-7)
Rudy Giddey drives and kicks out. Tobias Hyland attempts a 3Pt. Contested by Franz Simmons (4.2 feet, MAN). Tobias Hyland misses. Offensive rebound by D'Angelo Randle! D'Angelo Randle's putback is no good. Rebound secured by Shaquille Harden.

[08:26] Team_051 possession (Score: 14-7)
Larry McGrady drives, Brandon James stays with him. Larry McGrady attempts a Layup. Contested by Brandon James (5.4 feet, MAN). Larry McGrady misses. Rebound secured by D'Angelo Randle.

[08:14] Team_019 possession (Score: 14-7)
Tobias Hyland attempts a Layup. Contested by Franz Simmons (4.2 feet, MAN). TOBIAS HYLAND MAKES IT! Assist: DeMar James
Score: 16-7

[08:02] Team_051 possession (Score: 16-7)
Shaquille Harden drives to the basket... Shaquille Harden throws a bad pass! Stolen by DeMar James! TURNOVER! (live ball)

[07:49] Team_019 possession (Score: 16-7)
Tobias Hyland attempts a Layup. BLOCKED BY FRANZ SIMMONS! Ball goes out off Franz Simmons. Tobias Hyland's ball!

[07:37] Team_019 possession (Score: 16-7)
FOUL! Reach-in foul on Austin Sexton during the drive. [Team fouls: 2] No free throws, side out. (Austin Sexton: 1 personal fouls)

[07:25] Team_019 possession (Score: 16-7)
Rudy Giddey attempts a Midrange. Contested by Larry McGrady (4.7 feet, ZONE). Rudy Giddey misses. Rebound secured by Shaquille Harden.

[07:13] Team_051 possession (Score: 16-7)
Austin Sexton attempts a Midrange. Contested by Brandon James (5.1 feet, ZONE). Austin Sexton misses. Offensive rebound by Shaquille Harden! Shaquille Harden's putback is no good. Rebound secured by DeMar James.

[06:58] Team_019 possession (Score: 16-7)
DeMar James attempts a Midrange. Contested by Larry McGrady (4.8 feet, ZONE). DEMAR JAMES MAKES IT!
Score: 18-7

[06:41] Team_051 possession (Score: 18-7)
Austin Sexton attempts a 3Pt. Contested by D'Angelo Randle (3.6 feet, ZONE). Austin Sexton misses. Rebound secured by DeMar James.

[06:29] Team_019 possession (Score: 18-7)
Brandon James throws a bad pass out of bounds! TURNOVER! (dead ball)

[06:13] Team_051 possession (Score: 18-7)
Larry McGrady drives, DeMar James stays with him. Larry McGrady attempts a Layup. Contested by DeMar James (4.5 feet, ZONE). LARRY MCGRADY MAKES IT! Assist: Franz Simmons
Score: 18-9

[05:54] Team_019 possession (Score: 18-9)
DeMar James attempts a Midrange. Contested by Shaquille Harden (4.6 feet, ZONE). DeMar James misses. Rebound secured by OG Siakam.

[05:40] Team_051 possession (Score: 18-9)
OG Siakam attempts a Midrange. Contested by D'Angelo Randle (3.9 feet, ZONE). OG SIAKAM MAKES IT! Assist: Shaquille Harden
Score: 18-11

[05:25] Team_019 possession (Score: 18-11)
D'Angelo Randle attempts a 3Pt. Contested by OG Siakam (4.1 feet, MAN). D'Angelo Randle misses. FOUL! Loose ball foul on OG Siakam during the rebound battle. [Team fouls: 3] No free throws, side out. (OG Siakam: 1 personal fouls)

[05:07] Team_019 possession (Score: 18-11)
Tobias Hyland attempts a Layup. Contested by Franz Simmons (4.2 feet, MAN). TOBIAS HYLAND MAKES IT!
Score: 20-11

[04:53] Team_051 possession (Score: 20-11)
FOUL! Reach-in foul on DeMar James during the drive. [Team fouls: 3] No free throws, side out. (DeMar James: 2 personal fouls)

[04:40] Team_051 possession (Score: 20-11)
Larry McGrady makes the Midrange and draws the foul on Brandon James! And-1! Larry McGrady to the line for 1. [Team fouls: 4] (Brandon James: 2 personal fouls)   FT 1/1: GOOD Larry McGrady makes 1/1 from the line.
Score: 20-14

[04:23] Team_019 possession (Score: 20-14)
Brandon James attempts a Layup. BLOCKED BY OG SIAKAM! Ball is loose! Rebound secured by Franz Simmons.

[04:07] Team_051 possession (Score: 20-14)
Franz Simmons attempts a Layup. Contested by DeMar James (4.8 feet, ZONE). FRANZ SIMMONS MAKES IT!
Score: 20-16

[03:48] Team_019 possession (Score: 20-16)
Tobias Hyland attempts a Layup. Contested by Franz Simmons (4.3 feet, ZONE). Tobias Hyland misses. Rebound secured by Franz Simmons.

[03:35] Team_051 possession (Score: 20-16)
OG Siakam drives, picks up D'Angelo Randle. Help arrives from Brandon James! OG Siakam attempts a Dunk. Contested by Brandon James (4.0 feet, MAN). OG Siakam misses. Rebound secured by D'Angelo Randle.

[03:21] Team_019 possession (Score: 20-16)
Rudy Giddey loses control! Ball rolls out of bounds! TURNOVER! (dead ball)

[03:21] Substitution (Team_019): Tobias Hyland OUT → Shai Ingram IN (stamina_rule2)

[03:09] Team_051 possession (Score: 20-16)
Shaquille Harden attempts a Midrange. Contested by Rudy Giddey (5.4 feet, ZONE). Shaquille Harden misses. Rebound secured by D'Angelo Randle.

[02:54] Team_019 possession (Score: 20-16)
Brandon James attempts a Midrange. Contested by Larry McGrady (4.7 feet, MAN). Brandon James misses. Rebound secured by Franz Simmons.

[02:39] Team_051 possession (Score: 20-16)
OG Siakam attempts a 3Pt. Contested by D'Angelo Randle (4.1 feet, MAN). OG Siakam misses. Offensive rebound by Franz Simmons! Franz Simmons kicks it out.

[02:23] Team_051 possession (Score: 20-16)
Shaquille Harden attempts a Midrange. Contested by Brandon James (5.3 feet, ZONE). Shaquille Harden misses. Rebound secured by D'Angelo Randle.

[02:08] Team_019 possession (Score: 20-16)
DeMar James throws a bad pass out of bounds! TURNOVER! (dead ball)

[02:08] Substitution (Team_019): Rudy Giddey OUT → Gary Ginobili IN (stamina_rule2)

[02:08] Substitution (Team_019): Brandon James OUT → Jalen Turner IN (stamina_rule2)

[02:08] Substitution (Team_019): D'Angelo Randle OUT → Blake LaVine IN (stamina_rule2)

[02:08] Substitution (Team_019): DeMar James OUT → Tim Jordan IN (stamina_rule2)

[02:08] Substitution (Team_051): Larry McGrady OUT → Zion Morant IN (stamina_rule2)

[02:08] Substitution (Team_051): OG Siakam OUT → Jrue Carter IN (stamina_rule2)

[02:08] Substitution (Team_051): Franz Simmons OUT → Tobias Jokic IN (stamina_rule2)

[02:08] Substitution (Team_051): Shaquille Harden OUT → Pau Tatum IN (stamina_rule2)

[01:53] Team_051 possession (Score: 20-16)
Austin Sexton attempts a 3Pt. Contested by Blake LaVine (4.7 feet, ZONE). Austin Sexton misses. Rebound secured by Blake LaVine.

[01:38] Team_019 possession (Score: 20-16)
Gary Ginobili drives to the basket... Gary Ginobili throws a bad pass out of bounds! TURNOVER! (dead ball)

[01:38] Substitution (Team_051): Austin Sexton OUT → Myles Harden IN (stamina_rule2)

[01:25] Team_051 possession (Score: 20-16)
Pau Tatum drives, picks up Shai Ingram. Help arrives from Jalen Turner! Pau Tatum attempts a Dunk. Contested by Jalen Turner (4.4 feet, MAN). PAU TATUM MAKES IT!
Score: 20-18

[01:11] Team_019 possession (Score: 20-18)
FOUL! Holding foul on Myles Harden. [Team fouls: 4] No free throws, side out. (Myles Harden: 1 personal fouls)

[01:00] Team_019 possession (Score: 20-18)
Jalen Turner loses the ball! Stripped by Zion Morant! TURNOVER! (live ball)

[00:44] Team_051 possession (Score: 20-18)
Jrue Carter makes the Midrange and draws the foul on Blake LaVine! And-1! Jrue Carter to the line for 1. [BONUS: 5 team fouls] (Blake LaVine: 1 personal fouls)   FT 1/1: GOOD Jrue Carter makes 1/1 from the line.
Score: 20-21

[00:26] Team_019 possession (Score: 20-21)
Shai Ingram attempts a Layup. Contested by Pau Tatum (4.2 feet, ZONE). SHAI INGRAM MAKES IT! Assist: Gary Ginobili
Score: 22-21

[00:10] Team_051 possession (Score: 22-21)
Myles Harden drives and kicks out. Myles Harden attempts a Midrange. Wide open! Tim Jordan is 6.5 feet away. [ZONE] Myles Harden misses. Rebound secured by Tim Jordan.

================================================================================
                              1ST QUARTER COMPLETE                              
================================================================================

1ST QUARTER SCORE: Team_019 22, Team_051 21

BOX SCORE:
================================================================================

Team_019
--------------------------------------------------------------------------------
Player                MIN  PTS  REB  AST  TO      FG   FG%      3P   3P%
--------------------------------------------------------------------------------
Tobias Hyland           9    6    2    1   0   3/4    75.0     0/0   0.0
D'Angelo Randle        10    5    5    1   0   2/2   100.0     0/0   0.0
DeMar James            10    4    3    2   0   2/3    66.7     0/0   0.0
Rudy Giddey            10    3    0    1   0   1/3    33.3     0/0   0.0
Brandon James          10    2    0    0   0   1/3    33.3     0/0   0.0
Shai Ingram             3    2    0    0   0   1/1   100.0     0/0   0.0
Blake LaVine            2    0    1    0   0   0/0     0.0     0/0   0.0
Gary Ginobili           2    0    0    1   0   0/0     0.0     0/0   0.0
Tim Jordan              2    0    1    0   0   0/0     0.0     0/0   0.0

TEAM: FG: 10/16 (62.5%), 3PT: 2/2 (100.0%), REB: 12 (3 off, 9 def), AST: 6, TO: 5
TEAM FOULS: 5 [Team_051 in BONUS]


Team_051
--------------------------------------------------------------------------------
Player                MIN  PTS  REB  AST  TO      FG   FG%      3P   3P%
--------------------------------------------------------------------------------
Larry McGrady          10    7    0    0   0   3/4    75.0     0/0   0.0
OG Siakam              10    5    1    1   0   2/4    50.0     0/0   0.0
Jrue Carter             2    3    0    0   0   1/1   100.0     0/0   0.0
Franz Simmons          10    2    5    1   0   1/1   100.0     0/0   0.0
Austin Sexton          11    2    0    0   0   1/5    20.0     0/0   0.0
Pau Tatum               2    2    0    0   0   1/1   100.0     0/0   0.0
Shaquille Harden       10    0    2    1   0   0/2     0.0     0/0   0.0
Myles Harden            2    0    0    0   0   0/1     0.0     0/0   0.0

TEAM: FG: 9/19 (47.4%), 3PT: 1/5 (20.0%), REB: 8 (3 off, 5 def), AST: 3, TO: 2
TEAM FOULS: 4

================================================================================

================================================================================
                       2ND QUARTER - Team_019 vs Team_051                       
================================================================================

[12:00] Team_019 possession (Score: 22-21)
FOUL! Shooting foul on Franz Simmons. DeMar James to the line for 2 free throws. [Team fouls: 1] (Franz Simmons: 1 personal fouls)   FT 1/2: MISS   FT 2/2: GOOD DeMar James makes 1/2 from the line.
Score: 23-21

[11:46] Team_051 possession (Score: 23-21)
Austin Sexton attempts a 3Pt. Contested by D'Angelo Randle (3.7 feet, ZONE). Austin Sexton misses. Rebound secured by D'Angelo Randle.

[11:30] Team_019 possession (Score: 23-21)
Rudy Giddey attempts a 3Pt. Contested by Austin Sexton (4.7 feet, MAN). Rudy Giddey misses. Offensive rebound by Tobias Hyland! Tobias Hyland kicks it out.

[11:19] Team_019 possession (Score: 23-21)
Brandon James drives, picks up Franz Simmons. Help arrives from Larry McGrady! Brandon James attempts a Dunk. Contested by Larry McGrady (4.2 feet, ZONE). BRANDON JAMES MAKES IT! Assist: DeMar James
Score: 25-21

[11:03] Team_051 possession (Score: 25-21)
Shaquille Harden drives, picks up DeMar James. Help arrives from Brandon James! Shaquille Harden attempts a Dunk. Contested by Brandon James (4.3 feet, MAN). SHAQUILLE HARDEN MAKES IT! Assist: Franz Simmons
Score: 25-23

[10:47] Team_019 possession (Score: 25-23)
FOUL! Shooting foul on Franz Simmons. Brandon James to the line for 2 free throws. [Team fouls: 2] (Franz Simmons: 2 personal fouls)   FT 1/2: GOOD   FT 2/2: MISS Brandon James makes 1/2 from the line. FOUL! Loose ball foul on OG Siakam during the free throw rebound! [Team fouls: 3] No free throws, side out. (OG Siakam: 1 personal fouls)
Score: 26-23

[10:34] Team_019 possession (Score: 26-23)
Brandon James attempts a Layup. Contested by Franz Simmons (4.3 feet, ZONE). BRANDON JAMES MAKES IT! Assist: Tobias Hyland
Score: 28-23

[10:20] Team_051 possession (Score: 28-23)
Franz Simmons attempts a Midrange. Wide open! Tobias Hyland is 6.2 feet away. [MAN] FRANZ SIMMONS MAKES IT! Assist: OG Siakam
Score: 28-25

[10:05] Team_019 possession (Score: 28-25)
Rudy Giddey attempts a 3Pt. Contested by Austin Sexton (4.8 feet, MAN). Rudy Giddey misses. Offensive rebound by Tobias Hyland! Tobias Hyland kicks it out.

[09:56] Team_019 possession (Score: 28-25)
DeMar James drives to the basket... DeMar James loses the ball! Stripped by Shaquille Harden! TURNOVER! (live ball)

[09:37] Team_051 possession (Score: 28-25)
FOUL! Offensive foul on Larry McGrady! Brandon James drew the charge! [Team fouls: 4] (Larry McGrady: 1 personal fouls) TURNOVER! (dead ball)

[09:28] Team_019 possession (Score: 28-25)
D'Angelo Randle attempts a Midrange. Contested by OG Siakam (4.4 feet, MAN). D'Angelo Randle misses. Rebound secured by OG Siakam.

[09:14] Team_051 possession (Score: 28-25)
OG Siakam attempts a Midrange. Contested by Brandon James (5.6 feet, ZONE). OG Siakam misses. Rebound secured by D'Angelo Randle.

[09:02] Team_019 possession (Score: 28-25)
Tobias Hyland attempts a Midrange. Contested by Shaquille Harden (4.5 feet, ZONE). TOBIAS HYLAND MAKES IT!
Score: 30-25

[08:45] Team_051 possession (Score: 30-25)
Franz Simmons throws a bad pass out of bounds! TURNOVER! (dead ball)

[08:45] Substitution (Team_019): Rudy Giddey OUT → Gary Ginobili IN (stamina_rule2)

[08:45] Substitution (Team_019): Brandon James OUT → Jalen Turner IN (stamina_rule2)

[08:45] Substitution (Team_019): D'Angelo Randle OUT → Blake LaVine IN (stamina_rule2)

[08:45] Substitution (Team_019): Tobias Hyland OUT → Shai Ingram IN (stamina_rule2)

[08:45] Substitution (Team_019): DeMar James OUT → Tim Jordan IN (stamina_rule2)

[08:45] Substitution (Team_051): Austin Sexton OUT → Myles Harden IN (stamina_rule2)

[08:45] Substitution (Team_051): Larry McGrady OUT → Zion Morant IN (stamina_rule2)

[08:45] Substitution (Team_051): OG Siakam OUT → Jrue Carter IN (stamina_rule2)

[08:45] Substitution (Team_051): Franz Simmons OUT → Tobias Jokic IN (stamina_rule2)

[08:45] Substitution (Team_051): Shaquille Harden OUT → Pau Tatum IN (stamina_rule2)

[08:29] Team_019 possession (Score: 30-25)
Blake LaVine drives, Jrue Carter stays with him. Blake LaVine attempts a Layup. Contested by Jrue Carter (4.8 feet, MAN). BLAKE LAVINE MAKES IT!
Score: 32-25

[08:14] Team_051 possession (Score: 32-25)
Pau Tatum attempts a Layup. Contested by Shai Ingram (4.4 feet, MAN). PAU TATUM MAKES IT!
Score: 32-27

[07:56] Team_019 possession (Score: 32-27)
Blake LaVine attempts a Layup. Contested by Pau Tatum (4.4 feet, ZONE). Blake LaVine misses. Rebound secured by Tobias Jokic.

[07:45] Team_051 possession (Score: 32-27)
Tobias Jokic throws a bad pass! Stolen by Shai Ingram! TURNOVER! (live ball)

[07:31] Team_019 possession (Score: 32-27)
Jalen Turner loses the ball! Stripped by Zion Morant! TURNOVER! (live ball)

[07:17] Team_051 possession (Score: 32-27)
Myles Harden attempts a Layup. Contested by Gary Ginobili (5.6 feet, MAN). MYLES HARDEN MAKES IT! Assist: Pau Tatum
Score: 32-29

[07:07] Team_019 possession (Score: 32-29)
Jalen Turner attempts a 3Pt. Contested by Jrue Carter (4.9 feet, ZONE). Jalen Turner misses. Rebound secured by Myles Harden.

[06:58] Team_051 possession (Score: 32-29)
Pau Tatum attempts a Midrange. Contested by Shai Ingram (4.4 feet, ZONE). Pau Tatum misses. Rebound secured by Shai Ingram.

[06:43] Team_019 possession (Score: 32-29)
Gary Ginobili drives to the basket... Gary Ginobili commits a violation (traveling/carry)! TURNOVER! (dead ball)

[06:26] Team_051 possession (Score: 32-29)
Jrue Carter attempts a Midrange. Contested by Shai Ingram (4.8 feet, ZONE). Jrue Carter misses. Rebound secured by Shai Ingram.

[06:10] Team_019 possession (Score: 32-29)
Shai Ingram attempts a 3Pt. Contested by Tobias Jokic (5.2 feet, MAN). SHAI INGRAM MAKES IT! Assist: Jalen Turner
Score: 35-29

[05:57] Team_051 possession (Score: 35-29)
Tobias Jokic attempts a Midrange. Contested by Jalen Turner (4.1 feet, ZONE). Tobias Jokic misses. Rebound secured by Tim Jordan.

[05:46] Team_019 possession (Score: 35-29)
Blake LaVine attempts a 3Pt. Contested by Jrue Carter (4.8 feet, MAN). Blake LaVine misses. Rebound secured by Pau Tatum.

[05:35] Team_051 possession (Score: 35-29)
Myles Harden attempts a 3Pt. Contested by Gary Ginobili (5.6 feet, MAN). Myles Harden misses. Rebound secured by Tim Jordan.

[05:17] Team_019 possession (Score: 35-29)
FOUL! Shooting foul on Zion Morant. Gary Ginobili to the line for 2 free throws. [BONUS: 5 team fouls] (Zion Morant: 1 personal fouls)   FT 1/2: GOOD   FT 2/2: GOOD Gary Ginobili makes 2/2 from the line.
Score: 37-29

[05:03] Team_051 possession (Score: 37-29)
Pau Tatum drives and kicks out. FOUL! Shooting foul on Blake LaVine. Jrue Carter to the line for 3 free throws. [Team fouls: 1] (Blake LaVine: 1 personal fouls)   FT 1/3: GOOD   FT 2/3: GOOD   FT 3/3: GOOD Jrue Carter makes 3/3 from the line.
Score: 37-32

[04:53] Team_019 possession (Score: 37-32)
Gary Ginobili attempts a Midrange. Contested by Tobias Jokic (5.7 feet, ZONE). GARY GINOBILI MAKES IT!
Score: 39-32

[04:37] Team_051 possession (Score: 39-32)
Zion Morant attempts a 3Pt. Contested by Blake LaVine (5.0 feet, ZONE). Zion Morant misses. Rebound secured by Blake LaVine.

[04:23] Team_019 possession (Score: 39-32)
Tim Jordan drives, Pau Tatum stays with him. Tim Jordan attempts a Dunk. Contested by Pau Tatum (4.3 feet, ZONE). TIM JORDAN MAKES IT!
Score: 41-32

[04:07] Team_051 possession (Score: 41-32)
Pau Tatum drives, picks up Shai Ingram. Help arrives from Jalen Turner! Pau Tatum attempts a Dunk. Contested by Jalen Turner (4.4 feet, MAN). Pau Tatum misses. Rebound secured by Blake LaVine.

[03:57] Team_019 possession (Score: 41-32)
Blake LaVine drives and kicks out. Tim Jordan attempts a Midrange. Contested by Pau Tatum (4.3 feet, MAN). Tim Jordan misses. Rebound secured by Myles Harden.

[03:41] Team_051 possession (Score: 41-32)
Zion Morant attempts a Midrange. Wide open! Gary Ginobili is 6.1 feet away. [ZONE] Zion Morant misses. Offensive rebound by Pau Tatum! Pau Tatum puts it back in!
Score: 41-34

[03:30] Team_019 possession (Score: 41-34)
Tim Jordan attempts a Layup. BLOCKED BY MYLES HARDEN! Ball deflects out of bounds off Tim Jordan.

[03:14] Team_051 possession (Score: 41-34)
Pau Tatum drives, Shai Ingram stays with him. Pau Tatum attempts a Dunk. Contested by Shai Ingram (4.5 feet, MAN). PAU TATUM MAKES IT! Assist: Myles Harden
Score: 41-36

[02:57] Team_019 possession (Score: 41-36)
Shai Ingram makes the Layup and draws the foul on Tobias Jokic! And-1! Shai Ingram to the line for 1. [BONUS: 6 team fouls] (Tobias Jokic: 1 personal fouls)   FT 1/1: MISS Shai Ingram makes 0/1 from the line. Rebound secured by Tobias Jokic.
Score: 43-36

[02:41] Team_051 possession (Score: 43-36)
Myles Harden drives, picks up Shai Ingram. Help arrives from Jalen Turner! Myles Harden attempts a Dunk. Contested by Jalen Turner (4.5 feet, ZONE). Myles Harden misses. Rebound secured by Blake LaVine.

[02:24] Team_019 possession (Score: 43-36)
Gary Ginobili loses the ball! Stripped by Myles Harden! TURNOVER! (live ball)

[02:10] Team_051 possession (Score: 43-36)
Zion Morant loses control! Ball rolls out of bounds! TURNOVER! (dead ball)

[01:53] Team_019 possession (Score: 43-36)
Shai Ingram drives, picks up Pau Tatum. Help arrives from Myles Harden! Shai Ingram attempts a Layup. Contested by Myles Harden (4.3 feet, ZONE). SHAI INGRAM MAKES IT! Assist: Jalen Turner
Score: 45-36

[01:42] Team_051 possession (Score: 45-36)
Pau Tatum attempts a Layup. Contested by Shai Ingram (4.6 feet, MAN). Pau Tatum misses. Rebound secured by Blake LaVine.

[01:32] Team_019 possession (Score: 45-36)
Tim Jordan attempts a Layup. Contested by Pau Tatum (4.4 feet, MAN). Tim Jordan misses. Rebound secured by Pau Tatum.

[01:18] Team_051 possession (Score: 45-36)
Pau Tatum drives, Shai Ingram stays with him. Pau Tatum attempts a Layup. Contested by Shai Ingram (4.7 feet, MAN). Pau Tatum misses. Rebound secured by Shai Ingram.

[01:03] Team_019 possession (Score: 45-36)
Shai Ingram attempts a Midrange. Contested by Zion Morant (5.7 feet, ZONE). Shai Ingram misses. Rebound secured by Pau Tatum.

[00:51] Team_051 possession (Score: 45-36)
Jrue Carter attempts a Layup. BLOCKED BY SHAI INGRAM! Ball deflects out of bounds off Jrue Carter.

[00:40] Team_019 possession (Score: 45-36)
Blake LaVine attempts a 3Pt. Contested by Jrue Carter (5.0 feet, MAN). BLAKE LAVINE MAKES IT! Assist: Gary Ginobili
Score: 48-36

[00:29] Team_051 possession (Score: 48-36)
Jrue Carter makes the Dunk and draws the foul on Shai Ingram! And-1! Jrue Carter to the line for 1. [Team fouls: 2] (Shai Ingram: 1 personal fouls)   FT 1/1: GOOD Jrue Carter makes 1/1 from the line.
Score: 48-39

[00:16] Team_019 possession (Score: 48-39)
Tim Jordan drives and kicks out. Shai Ingram attempts a Midrange. Contested by Tobias Jokic (5.6 feet, ZONE). Shai Ingram misses. Rebound secured by Tobias Jokic.

[00:05] Team_051 possession (Score: 48-39)
Zion Morant makes the Layup and draws the foul on Shai Ingram! And-1! Zion Morant to the line for 1. [Team fouls: 3] (Shai Ingram: 2 personal fouls)   FT 1/1: GOOD Zion Morant makes 1/1 from the line.
Score: 48-42

================================================================================
                              2ND QUARTER COMPLETE                              
================================================================================

2ND QUARTER SCORE: Team_019 26, Team_051 21

BOX SCORE:
================================================================================

Team_019
--------------------------------------------------------------------------------
Player                MIN  PTS  REB  AST  TO      FG   FG%      3P   3P%
--------------------------------------------------------------------------------
Blake LaVine           11    5    4    0   0   2/5    40.0     0/0   0.0
Shai Ingram            12    5    3    0   0   2/4    50.0     0/0   0.0
Brandon James          14    4    0    0   0   2/2   100.0     0/0   0.0
Gary Ginobili          11    4    0    1   0   2/2   100.0     0/0   0.0
Tobias Hyland          12    2    2    1   0   1/1   100.0     0/0   0.0
Tim Jordan             11    2    2    0   0   1/4    25.0     0/0   0.0
DeMar James            14    1    1    1   0   1/1   100.0     0/0   0.0
D'Angelo Randle        14    0    2    0   0   0/1     0.0     0/0   0.0
Jalen Turner           11    0    0    2   0   0/1     0.0     0/0   0.0

TEAM: FG: 11/21 (52.4%), 3PT: 2/4 (50.0%), REB: 14 (3 off, 11 def), AST: 5, TO: 4
TEAM FOULS: 3


Team_051
--------------------------------------------------------------------------------
Player                MIN  PTS  REB  AST  TO      FG   FG%      3P   3P%
--------------------------------------------------------------------------------
Pau Tatum              11    6    4    1   0   3/7    42.9     0/0   0.0
Jrue Carter            11    6    0    0   0   2/4    50.0     0/0   0.0
Zion Morant            11    3    0    0   0   1/2    50.0     0/0   0.0
Shaquille Harden       14    2    0    0   0   1/1   100.0     0/0   0.0
Franz Simmons          14    2    0    1   0   1/1   100.0     0/0   0.0
Myles Harden           10    2    2    1   0   1/3    33.3     0/0   0.0
Austin Sexton          14    0    0    0   0   0/1     0.0     0/0   0.0
OG Siakam              14    0    1    1   0   0/1     0.0     0/0   0.0
Tobias Jokic           11    0    3    0   0   0/1     0.0     0/0   0.0

TEAM: FG: 9/21 (42.9%), 3PT: 0/3 (0.0%), REB: 10 (1 off, 9 def), AST: 4, TO: 4
TEAM FOULS: 6 [Team_019 in BONUS]

================================================================================

================================================================================
                       3RD QUARTER - Team_019 vs Team_051                       
================================================================================

[12:00] Team_019 possession (Score: 48-42)
DeMar James attempts a 3Pt. Contested by Austin Sexton (4.7 feet, ZONE). DeMar James misses. Offensive rebound by DeMar James! DeMar James puts it back in!
Score: 50-42

[11:42] Team_051 possession (Score: 50-42)
Shaquille Harden drives, picks up DeMar James. Help arrives from Brandon James! Shaquille Harden attempts a Layup. Contested by Brandon James (4.2 feet, MAN). SHAQUILLE HARDEN MAKES IT! Assist: Austin Sexton
Score: 50-44

[11:23] Team_019 possession (Score: 50-44)
Tobias Hyland drives and kicks out. Brandon James attempts a 3Pt. Contested by Austin Sexton (4.4 feet, ZONE). Brandon James misses. Rebound secured by Franz Simmons.

[11:06] Team_051 possession (Score: 50-44)
Franz Simmons drives and kicks out. Shaquille Harden attempts a 3Pt. Contested by DeMar James (4.2 feet, MAN). Shaquille Harden misses. Offensive rebound by Franz Simmons! Franz Simmons kicks it out.

[10:51] Team_051 possession (Score: 50-44)
OG Siakam attempts a 3Pt. Contested by D'Angelo Randle (3.9 feet, ZONE). OG Siakam misses. Offensive rebound by Shaquille Harden! Shaquille Harden puts it back in!
Score: 50-46

[10:37] Team_019 possession (Score: 50-46)
Brandon James makes the Layup and draws the foul on Larry McGrady! And-1! Brandon James to the line for 1. [Team fouls: 1] (Larry McGrady: 1 personal fouls)   FT 1/1: MISS Brandon James makes 0/1 from the line. Rebound secured by Franz Simmons.
Score: 52-46

[10:26] Team_051 possession (Score: 52-46)
Shaquille Harden attempts a Midrange. Contested by DeMar James (4.2 feet, MAN). SHAQUILLE HARDEN MAKES IT! Assist: Franz Simmons
Score: 52-48

[10:11] Team_019 possession (Score: 52-48)
Tobias Hyland attempts a Layup. Contested by Franz Simmons (4.2 feet, MAN). Tobias Hyland misses. Rebound secured by Shaquille Harden.

[10:01] Team_051 possession (Score: 52-48)
Franz Simmons drives, DeMar James stays with him. Franz Simmons attempts a Dunk. Contested by DeMar James (4.7 feet, ZONE). FRANZ SIMMONS MAKES IT! Assist: Shaquille Harden
Score: 52-50

[09:47] Team_019 possession (Score: 52-50)
Tobias Hyland drives, Franz Simmons stays with him. Tobias Hyland attempts a Dunk. Contested by Franz Simmons (4.2 feet, MAN). TOBIAS HYLAND MAKES IT!
Score: 54-50

[09:36] Team_051 possession (Score: 54-50)
Shaquille Harden drives to the basket... Shaquille Harden throws a bad pass! Stolen by DeMar James! TURNOVER! (live ball)

[09:21] Team_019 possession (Score: 54-50)
Brandon James attempts a 3Pt. Contested by Larry McGrady (4.5 feet, MAN). Brandon James misses. Rebound secured by Shaquille Harden.

[09:08] Team_051 possession (Score: 54-50)
Franz Simmons attempts a 3Pt. Wide open! Tobias Hyland is 6.1 feet away. [MAN] Franz Simmons misses. Rebound secured by DeMar James.

[08:57] Team_019 possession (Score: 54-50)
Tobias Hyland attempts a Midrange. Contested by Franz Simmons (4.2 feet, MAN). Tobias Hyland misses. Rebound secured by Franz Simmons.

[08:42] Team_051 possession (Score: 54-50)
FOUL! Holding foul on Brandon James. [Team fouls: 1] No free throws, side out. (Brandon James: 1 personal fouls)

[08:28] Team_051 possession (Score: 54-50)
FOUL! Shooting foul on Tobias Hyland. Larry McGrady to the line for 2 free throws. [Team fouls: 2] (Tobias Hyland: 1 personal fouls)   FT 1/2: GOOD   FT 2/2: GOOD Larry McGrady makes 2/2 from the line.
Score: 54-52

[08:13] Team_019 possession (Score: 54-52)
D'Angelo Randle attempts a 3Pt. Contested by Austin Sexton (4.6 feet, ZONE). D'Angelo Randle misses. Rebound secured by Franz Simmons.

[07:59] Team_051 possession (Score: 54-52)
Shaquille Harden attempts a Layup. Contested by DeMar James (4.2 feet, MAN). Shaquille Harden misses. Offensive rebound by Shaquille Harden! Shaquille Harden puts it back in!
Score: 54-54

[07:42] Team_019 possession (Score: 54-54)
Brandon James attempts a 3Pt. Contested by Larry McGrady (4.5 feet, MAN). Brandon James misses. FOUL! Loose ball foul on Shaquille Harden during the rebound battle. [Team fouls: 2] No free throws, side out. (Shaquille Harden: 1 personal fouls)

[07:29] Team_019 possession (Score: 54-54)
FOUL! Shooting foul on Franz Simmons. Tobias Hyland to the line for 2 free throws. [Team fouls: 3] (Franz Simmons: 1 personal fouls)   FT 1/2: GOOD   FT 2/2: GOOD Tobias Hyland makes 2/2 from the line.
Score: 56-54

[07:18] Team_051 possession (Score: 56-54)
FOUL! Holding foul on Rudy Giddey. [Team fouls: 3] No free throws, side out. (Rudy Giddey: 1 personal fouls)

[07:02] Team_051 possession (Score: 56-54)
OG Siakam attempts a Midrange. Contested by Tobias Hyland (5.9 feet, ZONE). OG SIAKAM MAKES IT! Assist: Franz Simmons
Score: 56-56

[06:47] Team_019 possession (Score: 56-56)
Tobias Hyland makes the Dunk and draws the foul on Larry McGrady! And-1! Tobias Hyland to the line for 1. [Team fouls: 4] (Larry McGrady: 2 personal fouls)   FT 1/1: GOOD Tobias Hyland makes 1/1 from the line.
Score: 59-56

[06:34] Team_051 possession (Score: 59-56)
Shaquille Harden makes the Dunk and draws the foul on DeMar James! And-1! Shaquille Harden to the line for 1. [Team fouls: 4] (DeMar James: 1 personal fouls)   FT 1/1: GOOD Shaquille Harden makes 1/1 from the line.
Score: 59-59

[06:21] Team_019 possession (Score: 59-59)
Rudy Giddey loses the ball! Stripped by Austin Sexton! TURNOVER! (live ball)

[06:05] Team_051 possession (Score: 59-59)
Larry McGrady attempts a Midrange. Contested by Brandon James (5.4 feet, MAN). LARRY MCGRADY MAKES IT!
Score: 59-61

[05:53] Team_019 possession (Score: 59-61)
DeMar James drives, Franz Simmons stays with him. DeMar James attempts a Layup. Contested by Franz Simmons (4.6 feet, ZONE). DEMAR JAMES MAKES IT! Assist: Rudy Giddey
Score: 61-61

[05:38] Team_051 possession (Score: 61-61)
FOUL! Shooting foul on D'Angelo Randle. Austin Sexton to the line for 2 free throws. [BONUS: 5 team fouls] (D'Angelo Randle: 1 personal fouls)   FT 1/2: GOOD   FT 2/2: GOOD Austin Sexton makes 2/2 from the line.
Score: 61-63

[05:22] Team_019 possession (Score: 61-63)
Tobias Hyland drives, Franz Simmons stays with him. Tobias Hyland attempts a Dunk. Contested by Franz Simmons (4.2 feet, MAN). TOBIAS HYLAND MAKES IT! Assist: DeMar James
Score: 63-63

[05:05] Team_051 possession (Score: 63-63)
Austin Sexton drives and kicks out. FOUL! Shooting foul on DeMar James. OG Siakam to the line for 2 free throws. [BONUS: 6 team fouls] (DeMar James: 2 personal fouls)   FT 1/2: GOOD   FT 2/2: MISS OG Siakam makes 1/2 from the line. Rebound secured by D'Angelo Randle.
Score: 63-64

[04:51] Team_019 possession (Score: 63-64)
DeMar James attempts a 3Pt. Contested by Austin Sexton (4.7 feet, ZONE). DEMAR JAMES MAKES IT! Assist: Brandon James
Score: 66-64

[04:33] Team_051 possession (Score: 66-64)
Franz Simmons attempts a 3Pt. Wide open! Tobias Hyland is 6.2 feet away. [MAN] Franz Simmons misses. Rebound secured by Tobias Hyland.

[04:17] Team_019 possession (Score: 66-64)
FOUL! Holding foul on Larry McGrady. [IN THE BONUS! 5 team fouls] Brandon James to the line for 2 free throws. (Larry McGrady: 3 personal fouls)   FT 1/2: GOOD   FT 2/2: MISS Brandon James makes 1/2 from the line. Rebound secured by Shaquille Harden.
Score: 67-64

[04:02] Team_051 possession (Score: 67-64)
OG Siakam attempts a Layup. Contested by DeMar James (4.6 feet, ZONE). OG Siakam misses. Rebound secured by Tobias Hyland.

[03:49] Team_019 possession (Score: 67-64)
Brandon James drives and kicks out. Tobias Hyland attempts a 3Pt. Contested by Austin Sexton (4.5 feet, ZONE). Tobias Hyland misses. Offensive rebound by DeMar James! DeMar James's putback is no good. Rebound secured by Franz Simmons.

[03:34] Team_051 possession (Score: 67-64)
Larry McGrady throws a bad pass! Stolen by Brandon James! TURNOVER! (live ball)

[03:17] Team_019 possession (Score: 67-64)
D'Angelo Randle attempts a 3Pt. Contested by OG Siakam (4.3 feet, MAN). D'Angelo Randle misses. Rebound secured by OG Siakam.

[03:03] Team_051 possession (Score: 67-64)
OG Siakam drives, D'Angelo Randle stays with him. OG Siakam attempts a Dunk. Contested by D'Angelo Randle (4.1 feet, MAN). OG SIAKAM MAKES IT! Assist: Shaquille Harden
Score: 67-66

[02:47] Team_019 possession (Score: 67-66)
Rudy Giddey attempts a Midrange. Contested by Austin Sexton (4.7 feet, MAN). RUDY GIDDEY MAKES IT!
Score: 69-66

[02:36] Team_051 possession (Score: 69-66)
Austin Sexton attempts a Midrange. Contested by Rudy Giddey (5.5 feet, MAN). AUSTIN SEXTON MAKES IT! Assist: Franz Simmons
Score: 69-68

[02:18] Team_019 possession (Score: 69-68)
D'Angelo Randle drives, OG Siakam stays with him. D'Angelo Randle attempts a Dunk. Contested by OG Siakam (4.4 feet, MAN). D'ANGELO RANDLE MAKES IT!
Score: 71-68

[02:03] Team_051 possession (Score: 71-68)
Franz Simmons drives, picks up Tobias Hyland. Help arrives from Brandon James! Franz Simmons attempts a Dunk. Wide open! Brandon James is 6.4 feet away. [MAN] FRANZ SIMMONS MAKES IT! Assist: Shaquille Harden
Score: 71-70

[01:51] Team_019 possession (Score: 71-70)
Tobias Hyland attempts a Midrange. Contested by Franz Simmons (4.5 feet, MAN). TOBIAS HYLAND MAKES IT!
Score: 73-70

[01:36] Team_051 possession (Score: 73-70)
FOUL! Shooting foul on D'Angelo Randle. OG Siakam to the line for 3 free throws. [BONUS: 7 team fouls] (D'Angelo Randle: 2 personal fouls)   FT 1/3: GOOD   FT 2/3: GOOD   FT 3/3: GOOD OG Siakam makes 3/3 from the line.
Score: 73-73

[01:20] Team_019 possession (Score: 73-73)
D'Angelo Randle drives and kicks out. DeMar James attempts a Midrange. Contested by Shaquille Harden (4.6 feet, MAN). DeMar James misses. Rebound secured by Shaquille Harden.

[01:06] Team_051 possession (Score: 73-73)
Shaquille Harden attempts a Midrange. Contested by D'Angelo Randle (4.0 feet, ZONE). Shaquille Harden misses. Rebound secured by D'Angelo Randle.

[00:50] Team_019 possession (Score: 73-73)
Rudy Giddey attempts a Midrange. Contested by Austin Sexton (4.9 feet, MAN). Rudy Giddey misses. Rebound secured by Franz Simmons.

[00:33] Team_051 possession (Score: 73-73)
Shaquille Harden drives, picks up DeMar James. Help arrives from Brandon James! Shaquille Harden attempts a Dunk. Contested by Brandon James (4.7 feet, ZONE). SHAQUILLE HARDEN MAKES IT! Assist: Austin Sexton
Score: 73-75

[00:21] Team_019 possession (Score: 73-75)
FOUL! Holding foul on Shaquille Harden. [IN THE BONUS! 6 team fouls] DeMar James to the line for 2 free throws. (Shaquille Harden: 2 personal fouls)   FT 1/2: GOOD   FT 2/2: GOOD DeMar James makes 2/2 from the line.
Score: 75-75

[00:06] Team_051 possession (Score: 75-75)
Larry McGrady attempts a 3Pt. Contested by Brandon James (5.8 feet, MAN). LARRY MCGRADY MAKES IT! Assist: Franz Simmons
Score: 75-78

================================================================================
                              3RD QUARTER COMPLETE                              
================================================================================

3RD QUARTER SCORE: Team_019 27, Team_051 36

BOX SCORE:
================================================================================

Team_019
--------------------------------------------------------------------------------
Player                MIN  PTS  REB  AST  TO      FG   FG%      3P   3P%
--------------------------------------------------------------------------------
Tobias Hyland          25   11    2    0   0   5/8    62.5     0/0   0.0
DeMar James            26    9    3    1   0   4/4   100.0     0/0   0.0
D'Angelo Randle        26    2    2    0   0   1/4    25.0     0/0   0.0
Rudy Giddey            26    2    0    1   0   1/2    50.0     0/0   0.0
Brandon James          26    0    0    1   0   0/3     0.0     0/0   0.0

TEAM: FG: 11/22 (50.0%), 3PT: 2/5 (40.0%), REB: 8 (3 off, 5 def), AST: 3, TO: 1
TEAM FOULS: 7 [Team_051 in BONUS]


Team_051
--------------------------------------------------------------------------------
Player                MIN  PTS  REB  AST  TO      FG   FG%      3P   3P%
--------------------------------------------------------------------------------
Shaquille Harden       26   13    6    3   0   6/7    85.7     0/0   0.0
Larry McGrady          26    7    0    0   0   3/3   100.0     0/0   0.0
OG Siakam              26    7    1    0   0   3/4    75.0     0/0   0.0
Austin Sexton          26    4    0    2   0   2/3    66.7     0/0   0.0
Franz Simmons          26    4    7    4   0   2/4    50.0     0/0   0.0

TEAM: FG: 16/21 (76.2%), 3PT: 3/5 (60.0%), REB: 13 (3 off, 10 def), AST: 9, TO: 2
TEAM FOULS: 6 [Team_019 in BONUS]

================================================================================

================================================================================
                       4TH QUARTER - Team_019 vs Team_051                       
================================================================================

[12:00] Team_019 possession (Score: 75-78)
Tobias Hyland drives and kicks out. Tobias Hyland attempts a 3Pt. Contested by Austin Sexton (4.6 feet, ZONE). TOBIAS HYLAND MAKES IT! Assist: D'Angelo Randle
Score: 78-78

[11:50] Team_051 possession (Score: 78-78)
FOUL! Shooting foul on D'Angelo Randle. Larry McGrady to the line for 3 free throws. [Team fouls: 1] (D'Angelo Randle: 1 personal fouls)   FT 1/3: MISS   FT 2/3: GOOD   FT 3/3: GOOD Larry McGrady makes 2/3 from the line.
Score: 78-80

[11:36] Team_019 possession (Score: 78-80)
Tobias Hyland attempts a 3Pt. Contested by Austin Sexton (4.6 feet, ZONE). Tobias Hyland misses. Rebound secured by OG Siakam.

[11:20] Team_051 possession (Score: 78-80)
Austin Sexton throws a bad pass! Stolen by Rudy Giddey! TURNOVER! (live ball)

[11:04] Team_019 possession (Score: 78-80)
DeMar James drives and kicks out. Tobias Hyland attempts a Midrange. Contested by Franz Simmons (4.6 feet, MAN). TOBIAS HYLAND MAKES IT!
Score: 80-80

[10:50] Team_051 possession (Score: 80-80)
Austin Sexton attempts a 3Pt. Contested by D'Angelo Randle (4.1 feet, ZONE). Austin Sexton misses. FOUL! Loose ball foul on DeMar James during the rebound battle. [Team fouls: 2] No free throws, side out. (DeMar James: 1 personal fouls)

[10:36] Team_051 possession (Score: 80-80)
Franz Simmons drives, picks up DeMar James. Help arrives from Brandon James! Franz Simmons attempts a Dunk. Contested by Brandon James (5.2 feet, ZONE). FRANZ SIMMONS MAKES IT! Assist: OG Siakam
Score: 80-82

[10:24] Team_019 possession (Score: 80-82)
DeMar James drives, Shaquille Harden stays with him. DeMar James attempts a Layup. Contested by Shaquille Harden (5.0 feet, MAN). DEMAR JAMES MAKES IT! Assist: Tobias Hyland
Score: 82-82

[10:07] Team_051 possession (Score: 82-82)
OG Siakam attempts a 3Pt. Contested by D'Angelo Randle (4.4 feet, MAN). OG Siakam misses. Rebound secured by Tobias Hyland.

[09:52] Team_019 possession (Score: 82-82)
Tobias Hyland attempts a Midrange. Contested by Franz Simmons (4.7 feet, MAN). Tobias Hyland misses. Rebound secured by OG Siakam.

[09:38] Team_051 possession (Score: 82-82)
Shaquille Harden attempts a Midrange. Contested by DeMar James (4.8 feet, MAN). Shaquille Harden misses. Rebound secured by D'Angelo Randle.

[09:26] Team_019 possession (Score: 82-82)
DeMar James drives, Franz Simmons stays with him. DeMar James attempts a Dunk. Contested by Franz Simmons (5.0 feet, ZONE). DeMar James misses. Rebound secured by Franz Simmons.

[09:13] Team_051 possession (Score: 82-82)
FOUL! Shooting foul on D'Angelo Randle. Austin Sexton to the line for 3 free throws. [Team fouls: 3] (D'Angelo Randle: 2 personal fouls)   FT 1/3: GOOD   FT 2/3: GOOD   FT 3/3: GOOD Austin Sexton makes 3/3 from the line.
Score: 82-85

[08:57] Team_019 possession (Score: 82-85)
Rudy Giddey attempts a Midrange. Contested by Franz Simmons (5.0 feet, ZONE). RUDY GIDDEY MAKES IT!
Score: 84-85

[08:46] Team_051 possession (Score: 84-85)
Larry McGrady attempts a 3Pt. Contested by Brandon James (6.0 feet, MAN). Larry McGrady misses. Rebound secured by DeMar James.

[08:33] Team_019 possession (Score: 84-85)
Tobias Hyland drives, picks up Franz Simmons. Help arrives from Austin Sexton! Tobias Hyland attempts a Dunk. Contested by Austin Sexton (4.8 feet, MAN). Tobias Hyland misses. Offensive rebound by D'Angelo Randle! D'Angelo Randle kicks it out.

[08:16] Team_019 possession (Score: 84-85)
Brandon James attempts a Midrange. Contested by Larry McGrady (5.2 feet, ZONE). Brandon James misses. Rebound secured by Shaquille Harden.

[08:04] Team_051 possession (Score: 84-85)
Austin Sexton attempts a 3Pt. Contested by Rudy Giddey (6.0 feet, MAN). AUSTIN SEXTON MAKES IT! Assist: Larry McGrady
Score: 84-88

[07:47] Team_019 possession (Score: 84-88)
D'Angelo Randle attempts a 3Pt. Contested by Austin Sexton (5.2 feet, ZONE). D'ANGELO RANDLE MAKES IT! Assist: Rudy Giddey
Score: 87-88

[07:34] Team_051 possession (Score: 87-88)
Larry McGrady drives and kicks out. Franz Simmons attempts a 3Pt. Wide open! Tobias Hyland is 6.6 feet away. [MAN] Franz Simmons misses. FOUL! Loose ball foul on DeMar James during the rebound battle. [Team fouls: 4] No free throws, side out. (DeMar James: 2 personal fouls)

[07:19] Team_051 possession (Score: 87-88)
Larry McGrady attempts a 3Pt. Contested by D'Angelo Randle (4.9 feet, ZONE). Larry McGrady misses. Rebound secured by Tobias Hyland.

[07:05] Team_019 possession (Score: 87-88)
FOUL! Holding foul on Larry McGrady. [Team fouls: 1] No free throws, side out. (Larry McGrady: 1 personal fouls)

[06:51] Team_019 possession (Score: 87-88)
DeMar James attempts a Midrange. Contested by Franz Simmons (5.3 feet, ZONE). DEMAR JAMES MAKES IT!
Score: 89-88

[06:40] Team_051 possession (Score: 89-88)
Austin Sexton attempts a Layup. Wide open! Rudy Giddey is 6.1 feet away. [MAN] AUSTIN SEXTON MAKES IT!
Score: 89-90

[06:23] Team_019 possession (Score: 89-90)
Rudy Giddey attempts a Midrange. BLOCKED BY OG SIAKAM! Ball deflects out of bounds off Rudy Giddey.

[06:10] Team_051 possession (Score: 89-90)
OG Siakam drives to the basket... OG Siakam throws a bad pass! Stolen by DeMar James! TURNOVER! (live ball)

[05:57] Team_019 possession (Score: 89-90)
Rudy Giddey attempts a 3Pt. Contested by Austin Sexton (5.4 feet, ZONE). RUDY GIDDEY MAKES IT! Assist: D'Angelo Randle
Score: 92-90

[05:42] Team_051 possession (Score: 92-90)
Franz Simmons drives, Tobias Hyland stays with him. Franz Simmons attempts a Dunk. Wide open! Tobias Hyland is 7.1 feet away. [MAN] FRANZ SIMMONS MAKES IT! Assist: Austin Sexton
Score: 92-92

[05:24] Team_019 possession (Score: 92-92)
FOUL! Shooting foul on Larry McGrady. Brandon James to the line for 2 free throws. [Team fouls: 2] (Larry McGrady: 2 personal fouls)   FT 1/2: GOOD   FT 2/2: GOOD Brandon James makes 2/2 from the line.
Score: 94-92

[05:08] Team_051 possession (Score: 94-92)
Shaquille Harden attempts a Layup. Contested by DeMar James (5.5 feet, ZONE). SHAQUILLE HARDEN MAKES IT!
Score: 94-94

[04:51] Team_019 possession (Score: 94-94)
DeMar James makes the Dunk and draws the foul on Austin Sexton! And-1! DeMar James to the line for 1. [Team fouls: 3] (Austin Sexton: 1 personal fouls)   FT 1/1: MISS DeMar James makes 0/1 from the line. Rebound secured by Franz Simmons.
Score: 96-94

[04:40] Team_051 possession (Score: 96-94)
Larry McGrady attempts a Layup. Contested by DeMar James (5.9 feet, ZONE). LARRY MCGRADY MAKES IT! Assist: Austin Sexton
Score: 96-96

[04:29] Team_019 possession (Score: 96-96)
DeMar James attempts a 3Pt. Contested by Austin Sexton (5.7 feet, ZONE). DEMAR JAMES MAKES IT! Assist: Brandon James
Score: 99-96

[04:11] Team_051 possession (Score: 99-96)
Larry McGrady attempts a Midrange. Wide open! Brandon James is 6.5 feet away. [MAN] LARRY MCGRADY MAKES IT! Assist: Austin Sexton
Score: 99-98

[04:02] Team_019 possession (Score: 99-98)
DeMar James throws a bad pass out of bounds! TURNOVER! (dead ball)

[04:02] Substitution (Team_019): Rudy Giddey OUT → Gary Ginobili IN (stamina_rule2)

[04:02] Substitution (Team_019): Brandon James OUT → Jalen Turner IN (stamina_rule2)

[04:02] Substitution (Team_019): D'Angelo Randle OUT → Blake LaVine IN (stamina_rule2)

[04:02] Substitution (Team_019): Tobias Hyland OUT → Shai Ingram IN (stamina_rule2)

[04:02] Substitution (Team_019): DeMar James OUT → Tim Jordan IN (stamina_rule2)

[04:02] Substitution (Team_051): Austin Sexton OUT → Myles Harden IN (stamina_rule2)

[04:02] Substitution (Team_051): Larry McGrady OUT → Zion Morant IN (stamina_rule2)

[04:02] Substitution (Team_051): OG Siakam OUT → Jrue Carter IN (stamina_rule2)

[04:02] Substitution (Team_051): Franz Simmons OUT → Tobias Jokic IN (stamina_rule2)

[04:02] Substitution (Team_051): Shaquille Harden OUT → Pau Tatum IN (stamina_rule2)

[03:43] Team_051 possession (Score: 99-98)
Myles Harden drives, Gary Ginobili stays with him. Myles Harden attempts a Layup. Contested by Gary Ginobili (5.6 feet, MAN). Myles Harden misses. Rebound secured by Blake LaVine.

[03:29] Team_019 possession (Score: 99-98)
Jalen Turner attempts a 3Pt. Contested by Zion Morant (5.8 feet, MAN). Jalen Turner misses. Rebound secured by Pau Tatum.

[03:19] Team_051 possession (Score: 99-98)
Tobias Jokic drives and kicks out. Pau Tatum attempts a Midrange. Contested by Shai Ingram (4.5 feet, MAN). Pau Tatum misses. Rebound secured by Tim Jordan.

[03:06] Team_019 possession (Score: 99-98)
Tim Jordan drives to the basket... Tim Jordan throws a bad pass out of bounds! TURNOVER! (dead ball)

[02:49] Team_051 possession (Score: 99-98)
Pau Tatum drives, Shai Ingram stays with him. Pau Tatum attempts a Dunk. Contested by Shai Ingram (4.4 feet, ZONE). PAU TATUM MAKES IT! Assist: Tobias Jokic
Score: 99-100

[02:33] Team_019 possession (Score: 99-100)
Blake LaVine drives, Jrue Carter stays with him. Blake LaVine attempts a Layup. Contested by Jrue Carter (4.8 feet, MAN). Blake LaVine misses. Rebound secured by Myles Harden.

[02:17] Team_051 possession (Score: 99-100)
Tobias Jokic attempts a 3Pt. Contested by Shai Ingram (4.7 feet, ZONE). Tobias Jokic misses. Rebound secured by Shai Ingram.

[02:02] Team_019 possession (Score: 99-100)
Gary Ginobili makes the Layup and draws the foul on Myles Harden! And-1! Gary Ginobili to the line for 1. [Team fouls: 4] (Myles Harden: 1 personal fouls)   FT 1/1: GOOD Gary Ginobili makes 1/1 from the line.
Score: 102-100

[01:49] Team_051 possession (Score: 102-100)
Myles Harden attempts a 3Pt. Contested by Gary Ginobili (5.6 feet, MAN). Myles Harden misses. Rebound secured by Blake LaVine.

[01:35] Team_019 possession (Score: 102-100)
Blake LaVine attempts a Midrange. Contested by Zion Morant (5.7 feet, ZONE). Blake LaVine misses. Rebound secured by Pau Tatum.

[01:22] Team_051 possession (Score: 102-100)
Tobias Jokic drives and kicks out. Jrue Carter attempts a Midrange. Contested by Blake LaVine (4.7 feet, MAN). Jrue Carter misses. Rebound secured by Blake LaVine.

[01:07] Team_019 possession (Score: 102-100)
Blake LaVine attempts a Midrange. Contested by Jrue Carter (4.8 feet, MAN). Blake LaVine misses. Rebound secured by Myles Harden.

[00:52] Team_051 possession (Score: 102-100)
Pau Tatum attempts a Midrange. Contested by Blake LaVine (4.6 feet, ZONE). PAU TATUM MAKES IT! Assist: Tobias Jokic
Score: 102-102

[00:39] Team_019 possession (Score: 102-102)
Blake LaVine attempts a 3Pt. Contested by Myles Harden (4.7 feet, ZONE). BLAKE LAVINE MAKES IT! Assist: Jalen Turner
Score: 105-102

[00:23] Team_051 possession (Score: 105-102)
Pau Tatum attempts a Midrange. Contested by Blake LaVine (4.6 feet, ZONE). Pau Tatum misses. Offensive rebound by Tobias Jokic! Tobias Jokic kicks it out.

[00:10] Team_051 possession (Score: 105-102)
Pau Tatum drives to the basket... Pau Tatum loses control! Ball rolls out of bounds! TURNOVER! (dead ball)

================================================================================
                              4TH QUARTER COMPLETE                              
================================================================================

4TH QUARTER SCORE: Team_019 30, Team_051 24

BOX SCORE:
================================================================================

Team_019
--------------------------------------------------------------------------------
Player                MIN  PTS  REB  AST  TO      FG   FG%      3P   3P%
--------------------------------------------------------------------------------
DeMar James            34    7    1    0   0   3/5    60.0     0/0   0.0
Tobias Hyland          33    5    2    1   0   2/4    50.0     0/0   0.0
Rudy Giddey            34    5    0    1   0   2/3    66.7     0/0   0.0
D'Angelo Randle        34    3    2    2   0   1/1   100.0     0/0   0.0
Blake LaVine           14    3    3    0   0   1/4    25.0     0/0   0.0
Gary Ginobili          14    3    0    0   0   1/1   100.0     0/0   0.0
Brandon James          34    2    0    1   0   1/2    50.0     0/0   0.0
Jalen Turner           14    0    0    1   0   0/1     0.0     0/0   0.0
Tim Jordan             14    0    1    0   0   0/0     0.0     0/0   0.0
Shai Ingram            16    0    1    0   0   0/0     0.0     0/0   0.0

TEAM: FG: 11/21 (52.4%), 3PT: 4/6 (66.7%), REB: 10 (1 off, 9 def), AST: 6, TO: 2
TEAM FOULS: 4


Team_051
--------------------------------------------------------------------------------
Player                MIN  PTS  REB  AST  TO      FG   FG%      3P   3P%
--------------------------------------------------------------------------------
Austin Sexton          35    8    0    3   0   3/3   100.0     0/0   0.0
Larry McGrady          34    6    0    1   0   3/5    60.0     0/0   0.0
Franz Simmons          34    4    3    0   0   2/2   100.0     0/0   0.0
Pau Tatum              14    4    2    0   0   2/2   100.0     0/0   0.0
Shaquille Harden       34    2    2    0   0   1/2    50.0     0/0   0.0
OG Siakam              34    0    2    1   0   0/1     0.0     0/0   0.0
Myles Harden           14    0    2    0   0   0/2     0.0     0/0   0.0
Tobias Jokic           14    0    1    2   0   0/3     0.0     0/0   0.0

TEAM: FG: 11/20 (55.0%), 3PT: 3/8 (37.5%), REB: 12 (3 off, 9 def), AST: 7, TO: 3
TEAM FOULS: 4

================================================================================

================================================================================
                               FULL GAME COMPLETE                               
================================================================================

FINAL SCORE: Team_019 105, Team_051 102

SCORING BY QUARTER:
--------------------------------------------------------------------------------
Team                     Q1     Q2     Q3     Q4    FINAL
--------------------------------------------------------------------------------
Team_019                 22     26     27     30      105
Team_051                 21     21     36     24      102
--------------------------------------------------------------------------------

FULL GAME BOX SCORE:
================================================================================

Team_019
--------------------------------------------------------------------------------
Player                MIN  PTS  REB  AST  TO      FG   FG%      3P   3P%      FT STL BLK
--------------------------------------------------------------------------------
Rudy Giddey            34   10    0    3   2   4/8    50.0   2/2   100.0   0/0     1   0
Brandon James          34    8    0    2   1   4/10   40.0   0/1     0.0   4/7     1   0
D'Angelo Randle        34   10   11    3   1   4/8    50.0   2/4    50.0   0/0     0   0
DeMar James            34   21    8    4   2  10/13   76.9   3/3   100.0   5/7     3   0
Tobias Hyland          33   24    8    3   0  10/16   62.5   0/1     0.0   3/3     0   0
Shai Ingram            16    7    4    0   1   3/5    60.0   1/1   100.0   0/1     1   1
Gary Ginobili          14    7    0    2   2   3/3   100.0   0/0     0.0   3/3     0   0
Jalen Turner           14    0    0    3   2   0/2     0.0   0/2     0.0   0/0     0   0
Blake LaVine           14    8    8    0   0   3/9    33.3   2/3    66.7   0/0     0   0
Tim Jordan             14    2    4    0   1   1/4    25.0   0/0     0.0   0/0     0   0

TEAM: FG: 43/80 (53.8%), 3PT: 10/17 (58.8%), REB: 44 (10 off, 34 def), AST: 20, TO: 12


Team_051
--------------------------------------------------------------------------------
Player                MIN  PTS  REB  AST  TO      FG   FG%      3P   3P%      FT STL BLK
--------------------------------------------------------------------------------
Austin Sexton          35   14    0    5   1   6/12   50.0   2/6    33.3   5/5     1   0
Larry McGrady          34   20    0    1   2   9/12   75.0   3/5    60.0   7/9     0   1
OG Siakam              34   12    5    3   0   6/11   54.5   2/4    50.0   5/6     0   2
Franz Simmons          34   12   15    6   3   6/8    75.0   0/2     0.0   0/0     0   1
Shaquille Harden       34   17   10    4   2   7/11   63.6   0/0     0.0   1/1     1   0
Zion Morant            14    3    0    0   2   2/3    66.7   0/1     0.0   1/1     2   0
Jrue Carter            14    9    0    0   0   2/4    50.0   0/0     0.0   5/5     0   0
Tobias Jokic           14    0    4    2   1   0/4     0.0   0/1     0.0   0/0     0   0
Pau Tatum              14   12    6    1   0   6/10   60.0   0/0     0.0   0/0     0   0
Myles Harden           14    2    4    1   0   1/6    16.7   0/2     0.0   0/0     1   1

TEAM: FG: 45/81 (55.6%), 3PT: 7/21 (33.3%), REB: 43 (10 off, 33 def), AST: 23, TO: 11

================================================================================
