================================================================================
                        FULL GAME - Team_076 vs Team_001                        
================================================================================

================================================================================
                       1ST QUARTER - Team_076 vs Team_001                       
================================================================================

[12:00] Team_076 possession (Score: 0-0)
Dejounte LaVine drives, Klay Harden stays with him. Dejounte LaVine attempts a Dunk. Contested by Klay Harden (3.8 feet, MAN). DEJOUNTE LAVINE MAKES IT! Assist: Cade Barnes
Score: 2-0

[11:45] Team_001 possession (Score: 2-0)
Klay Harden attempts a 3Pt. Contested by Dejounte LaVine (4.7 feet, MAN). Klay Harden misses. Rebound secured by Tobias Mitchell.

[11:31] Team_076 possession (Score: 2-0)
Paul Leonard attempts a 3Pt. Contested by Klay Harden (4.2 feet, ZONE). Paul Leonard misses. Rebound secured by Cole Ball.

[11:17] Team_001 possession (Score: 2-0)
Cole Ball drives to the basket... Cole Ball throws a bad pass! Stolen by Cade Barnes! TURNOVER! (live ball)

[11:01] Team_076 possession (Score: 2-0)
FOUL! Shooting foul on Miles Griffin. Cade Barnes to the line for 2 free throws. [Team fouls: 1] (Miles Griffin: 1 personal fouls)   FT 1/2: MISS   FT 2/2: GOOD Cade Barnes makes 1/2 from the line.
Score: 3-0

[10:45] Team_001 possession (Score: 3-0)
Miles Griffin drives to the basket... Miles Griffin throws a bad pass! Stolen by Cade Barnes! TURNOVER! (live ball)

[10:31] Team_076 possession (Score: 3-0)
Paul Leonard attempts a 3Pt. Contested by Klay Harden (4.2 feet, ZONE). PAUL LEONARD MAKES IT! Assist: Cade Barnes
Score: 6-0

[10:17] Team_001 possession (Score: 6-0)
Dirk Young drives, Tobias Mitchell stays with him. Dirk Young attempts a Dunk. Contested by Tobias Mitchell (4.3 feet, MAN). DIRK YOUNG MAKES IT!
Score: 6-2

[09:59] Team_076 possession (Score: 6-2)
Dejounte LaVine attempts a 3Pt. Contested by Klay Harden (3.8 feet, ZONE). Dejounte LaVine misses. Rebound secured by Cole Ball.

[09:43] Team_001 possession (Score: 6-2)
Klay Harden attempts a 3Pt. Contested by Cade Barnes (3.4 feet, ZONE). Klay Harden misses. Rebound secured by Cade Barnes.

[09:29] Team_076 possession (Score: 6-2)
Paul Leonard drives and kicks out. FOUL! Shooting foul on Dejounte McCollum. Cade Barnes to the line for 3 free throws. [Team fouls: 2] (Dejounte McCollum: 1 personal fouls)   FT 1/3: GOOD   FT 2/3: GOOD   FT 3/3: GOOD Cade Barnes makes 3/3 from the line.
Score: 9-2

[09:15] Team_001 possession (Score: 9-2)
Klay Harden attempts a Midrange. Contested by Tobias Mitchell (4.0 feet, ZONE). Klay Harden misses. Rebound secured by D'Angelo Tatum.

[09:00] Team_076 possession (Score: 9-2)
Dejounte LaVine throws a bad pass! Stolen by Klay Harden! TURNOVER! (live ball)

[08:46] Team_001 possession (Score: 9-2)
Miles Griffin drives and kicks out. Miles Griffin attempts a Midrange. Contested by D'Angelo Tatum (3.7 feet, MAN). MILES GRIFFIN MAKES IT!
Score: 9-4

[08:33] Team_076 possession (Score: 9-4)
D'Angelo Tatum drives to the basket... D'Angelo Tatum loses control! Ball rolls out of bounds! TURNOVER! (dead ball)

[08:23] Team_001 possession (Score: 9-4)
Miles Griffin attempts a Midrange. Contested by D'Angelo Tatum (4.1 feet, MAN). Miles Griffin misses. Rebound secured by D'Angelo Tatum.

[08:05] Team_076 possession (Score: 9-4)
Dejounte LaVine attempts a 3Pt. Contested by Klay Harden (3.8 feet, ZONE). Dejounte LaVine misses. Offensive rebound by Cade Barnes! Cade Barnes kicks it out.

[07:51] Team_076 possession (Score: 9-4)
D'Angelo Tatum attempts a Midrange. Contested by Miles Griffin (4.3 feet, MAN). D'Angelo Tatum misses. Offensive rebound by Cade Barnes! Cade Barnes kicks it out.

[07:38] Team_076 possession (Score: 9-4)
Paul Leonard attempts a Midrange. Contested by Cole Ball (3.5 feet, MAN). Paul Leonard misses. Rebound secured by Dejounte McCollum.

[07:22] Team_001 possession (Score: 9-4)
Miles Griffin attempts a Layup. Contested by D'Angelo Tatum (4.1 feet, MAN). Miles Griffin misses. Rebound secured by Cade Barnes.

[07:06] Team_076 possession (Score: 9-4)
Tobias Mitchell attempts a 3Pt. Contested by Klay Harden (4.3 feet, ZONE). Tobias Mitchell misses. Rebound secured by Miles Griffin.

[06:49] Team_001 possession (Score: 9-4)
FOUL! Holding foul on Dejounte LaVine. [Team fouls: 1] No free throws, side out. (Dejounte LaVine: 1 personal fouls)

[06:34] Team_001 possession (Score: 9-4)
Dirk Young attempts a 3Pt. Contested by Tobias Mitchell (4.3 feet, MAN). DIRK YOUNG MAKES IT! Assist: Cole Ball
Score: 9-7

[06:19] Team_076 possession (Score: 9-7)
Cade Barnes drives, Miles Griffin stays with him. Cade Barnes attempts a Layup. Contested by Miles Griffin (4.2 feet, ZONE). CADE BARNES MAKES IT! Assist: D'Angelo Tatum
Score: 11-7

[06:01] Team_001 possession (Score: 11-7)
Dirk Young loses the ball! Stripped by Tobias Mitchell! TURNOVER! (live ball)

[05:46] Team_076 possession (Score: 11-7)
Tobias Mitchell drives and kicks out. Paul Leonard attempts a Midrange. Contested by Cole Ball (3.1 feet, MAN). Paul Leonard misses. Rebound secured by Miles Griffin.

[05:34] Team_001 possession (Score: 11-7)
Klay Harden attempts a Midrange. Contested by Dejounte LaVine (4.7 feet, MAN). KLAY HARDEN MAKES IT!
Score: 11-9

[05:20] Team_076 possession (Score: 11-9)
Paul Leonard makes the Layup and draws the foul on Cole Ball! And-1! Paul Leonard to the line for 1. [Team fouls: 3] (Cole Ball: 1 personal fouls)   FT 1/1: GOOD Paul Leonard makes 1/1 from the line.
Score: 14-9

[05:05] Team_001 possession (Score: 14-9)
Klay Harden attempts a Midrange. Contested by Paul Leonard (5.0 feet, ZONE). Klay Harden misses. Offensive rebound by Cole Ball! Cole Ball kicks it out.

[04:56] Team_001 possession (Score: 14-9)
FOUL! Reach-in foul on Tobias Mitchell during the drive. [Team fouls: 2] No free throws, side out. (Tobias Mitchell: 1 personal fouls)

[04:42] Team_001 possession (Score: 14-9)
FOUL! Reach-in foul on Cade Barnes during the drive. [Team fouls: 3] No free throws, side out. (Cade Barnes: 1 personal fouls)

[04:29] Team_001 possession (Score: 14-9)
Dirk Young attempts a Layup. BLOCKED BY TOBIAS MITCHELL! Ball is loose! Rebound secured by D'Angelo Tatum.

[04:15] Team_076 possession (Score: 14-9)
Dejounte LaVine attempts a Layup. Contested by Klay Harden (3.9 feet, MAN). Dejounte LaVine misses. Rebound secured by Miles Griffin.

[04:03] Team_001 possession (Score: 14-9)
Miles Griffin attempts a Midrange. Contested by Cade Barnes (4.0 feet, ZONE). Miles Griffin misses. Rebound secured by D'Angelo Tatum.

[03:54] Team_076 possession (Score: 14-9)
Cade Barnes attempts a Layup. Contested by Dejounte McCollum (4.0 feet, MAN). CADE BARNES MAKES IT!
Score: 16-9

[03:38] Team_001 possession (Score: 16-9)
Dejounte McCollum drives and kicks out. Dirk Young attempts a 3Pt. Contested by Tobias Mitchell (4.2 feet, MAN). DIRK YOUNG MAKES IT! Assist: Cole Ball
Score: 16-12

[03:24] Team_076 possession (Score: 16-12)
Dejounte LaVine attempts a 3Pt. Contested by Klay Harden (4.0 feet, ZONE). Dejounte LaVine misses. Offensive rebound by Cade Barnes! Cade Barnes kicks it out.

[03:11] Team_076 possession (Score: 16-12)
D'Angelo Tatum attempts a Layup. Contested by Miles Griffin (4.5 feet, MAN). D'Angelo Tatum misses. Rebound secured by Miles Griffin.

[02:53] Team_001 possession (Score: 16-12)
Cole Ball drives to the basket... Cole Ball throws a bad pass! Stolen by Paul Leonard! TURNOVER! (live ball)

[02:38] Team_076 possession (Score: 16-12)
Tobias Mitchell drives and kicks out. D'Angelo Tatum attempts a Midrange. Contested by Miles Griffin (4.3 feet, MAN). D'Angelo Tatum misses. Rebound secured by Cole Ball.

[02:21] Team_001 possession (Score: 16-12)
Cole Ball attempts a 3Pt. Contested by Paul Leonard (5.1 feet, MAN). Cole Ball misses. Offensive rebound by Cole Ball! Cole Ball kicks it out.

[02:06] Team_001 possession (Score: 16-12)
Miles Griffin attempts a Midrange. Contested by D'Angelo Tatum (4.4 feet, MAN). MILES GRIFFIN MAKES IT! Assist: Cole Ball
Score: 16-14

[01:50] Team_076 possession (Score: 16-14)
Dejounte LaVine attempts a 3Pt. Contested by Klay Harden (4.2 feet, ZONE). DEJOUNTE LAVINE MAKES IT! Assist: Cade Barnes
Score: 19-14

[01:33] Team_001 possession (Score: 19-14)
Dejounte McCollum attempts a Midrange. Contested by Dejounte LaVine (5.0 feet, ZONE). Dejounte McCollum misses. Rebound secured by Cade Barnes.

[01:19] Team_076 possession (Score: 19-14)
Paul Leonard attempts a 3Pt. Contested by Cole Ball (3.7 feet, MAN). Paul Leonard misses. Offensive rebound by D'Angelo Tatum! D'Angelo Tatum kicks it out.

[01:05] Team_076 possession (Score: 19-14)
D'Angelo Tatum drives, Miles Griffin stays with him. D'Angelo Tatum attempts a Layup. Contested by Miles Griffin (4.7 feet, MAN). D'Angelo Tatum misses. FOUL! Loose ball foul on Cole Ball during the rebound battle. [Team fouls: 4] No free throws, side out. (Cole Ball: 2 personal fouls)

[00:50] Team_076 possession (Score: 19-14)
D'Angelo Tatum drives to the basket... FOUL! Offensive foul on D'Angelo Tatum! Miles Griffin drew the charge! [Team fouls: 4] (D'Angelo Tatum: 1 personal fouls) TURNOVER! (dead ball)

[00:33] Team_001 possession (Score: 19-14)
FOUL! Reach-in foul on Cade Barnes during the drive. [IN THE BONUS! 5 team fouls] Miles Griffin to the line for 2 free throws. (Cade Barnes: 2 personal fouls)   FT 1/2: GOOD   FT 2/2: GOOD Miles Griffin makes 2/2 from the line.
Score: 19-16

[00:20] Team_076 possession (Score: 19-16)
Tobias Mitchell attempts a 3Pt. Contested by Klay Harden (4.8 feet, ZONE). Tobias Mitchell misses. Rebound secured by Cole Ball.

[00:09] Team_001 possession (Score: 19-16)
Dirk Young attempts a 3Pt. Contested by Tobias Mitchell (4.8 feet, MAN). Dirk Young misses. Rebound secured by D'Angelo Tatum.

================================================================================
                              1ST QUARTER COMPLETE                              
================================================================================

1ST QUARTER SCORE: Team_076 19, Team_001 16

BOX SCORE:
================================================================================

Team_076
--------------------------------------------------------------------------------
Player                MIN  PTS  REB  AST  TO      FG   FG%      3P   3P%
--------------------------------------------------------------------------------
Cade Barnes            12    8    7    3   0   4/4   100.0     0/0   0.0
Paul Leonard           12    6    0    0   0   2/4    50.0     0/0   0.0
Dejounte LaVine        12    5    0    0   0   2/4    50.0     0/0   0.0
Tobias Mitchell        12    0    1    0   0   0/4     0.0     0/0   0.0
D'Angelo Tatum         12    0    6    1   0   0/1     0.0     0/0   0.0

TEAM: FG: 8/17 (47.1%), 3PT: 2/6 (33.3%), REB: 14 (5 off, 9 def), AST: 4, TO: 3
TEAM FOULS: 5 [Team_001 in BONUS]


Team_001
--------------------------------------------------------------------------------
Player                MIN  PTS  REB  AST  TO      FG   FG%      3P   3P%
--------------------------------------------------------------------------------
Dirk Young             12    8    0    0   0   3/5    60.0     0/0   0.0
Miles Griffin          12    6    4    0   0   3/6    50.0     0/0   0.0
Klay Harden            12    2    0    0   0   1/4    25.0     0/0   0.0
Cole Ball              12    0    6    3   0   0/0     0.0     0/0   0.0
Dejounte McCollum      12    0    1    0   0   0/1     0.0     0/0   0.0

TEAM: FG: 7/16 (43.8%), 3PT: 1/4 (25.0%), REB: 11 (2 off, 9 def), AST: 3, TO: 4
TEAM FOULS: 4

================================================================================

================================================================================
                       2ND QUARTER - Team_076 vs Team_001                       
================================================================================

[12:00] Team_076 possession (Score: 19-16)
Dejounte LaVine attempts a Layup. Contested by Miles Griffin (4.3 feet, ZONE). DEJOUNTE LAVINE MAKES IT! Assist: D'Angelo Tatum
Score: 21-16

[11:46] Team_001 possession (Score: 21-16)
Klay Harden drives to the basket... Klay Harden throws a bad pass! Stolen by D'Angelo Tatum! TURNOVER! (live ball)

[11:32] Team_076 possession (Score: 21-16)
D'Angelo Tatum attempts a 3Pt. Contested by Dejounte McCollum (4.3 feet, ZONE). D'Angelo Tatum misses. Rebound secured by Cole Ball.

[11:17] Team_001 possession (Score: 21-16)
Dirk Young attempts a 3Pt. Contested by Tobias Mitchell (4.7 feet, MAN). Dirk Young misses. Rebound secured by Cade Barnes.

[11:00] Team_076 possession (Score: 21-16)
Tobias Mitchell attempts a 3Pt. Contested by Klay Harden (4.7 feet, ZONE). Tobias Mitchell misses. Rebound secured by Dejounte McCollum.

[10:47] Team_001 possession (Score: 21-16)
Dejounte McCollum attempts a Midrange. Contested by Cade Barnes (3.8 feet, ZONE). Dejounte McCollum misses. Offensive rebound by Miles Griffin! Miles Griffin kicks it out.

[10:30] Team_001 possession (Score: 21-16)
Cole Ball attempts a 3Pt. Contested by Paul Leonard (5.2 feet, MAN). Cole Ball misses. Rebound secured by Tobias Mitchell.

[10:18] Team_076 possession (Score: 21-16)
FOUL! Reach-in foul on Cole Ball during the drive. [Team fouls: 1] No free throws, side out. (Cole Ball: 1 personal fouls)

[10:04] Team_076 possession (Score: 21-16)
FOUL! Holding foul on Dejounte McCollum. [Team fouls: 2] No free throws, side out. (Dejounte McCollum: 1 personal fouls)

[09:51] Team_076 possession (Score: 21-16)
Tobias Mitchell makes the Layup and draws the foul on Miles Griffin! And-1! Tobias Mitchell to the line for 1. [Team fouls: 3] (Miles Griffin: 1 personal fouls)   FT 1/1: GOOD Tobias Mitchell makes 1/1 from the line.
Score: 24-16

[09:38] Team_001 possession (Score: 24-16)
Dejounte McCollum attempts a Layup. Contested by Cade Barnes (4.0 feet, MAN). Dejounte McCollum misses. Rebound secured by D'Angelo Tatum.

[09:23] Team_076 possession (Score: 24-16)
Paul Leonard throws a bad pass! Stolen by Cole Ball! TURNOVER! (live ball)

[09:13] Team_001 possession (Score: 24-16)
Klay Harden attempts a 3Pt. Contested by Dejounte LaVine (5.3 feet, ZONE). Klay Harden misses. Offensive rebound by Dejounte McCollum! Dejounte McCollum kicks it out.

[09:00] Team_001 possession (Score: 24-16)
Cole Ball drives, picks up Paul Leonard. Help arrives from Tobias Mitchell! Cole Ball attempts a Layup. Contested by Tobias Mitchell (5.4 feet, MAN). COLE BALL MAKES IT! Assist: Dejounte McCollum
Score: 24-18

[08:41] Team_076 possession (Score: 24-18)
Tobias Mitchell loses the ball! Stripped by Dirk Young! TURNOVER! (live ball)

[08:28] Team_001 possession (Score: 24-18)
Miles Griffin drives, picks up D'Angelo Tatum. Help arrives from Tobias Mitchell! Miles Griffin attempts a Layup. Contested by Tobias Mitchell (4.8 feet, MAN). Miles Griffin misses. Rebound secured by Cade Barnes.

[08:14] Team_076 possession (Score: 24-18)
D'Angelo Tatum drives to the basket... FOUL! Offensive foul on D'Angelo Tatum! Miles Griffin drew the charge! [Team fouls: 1] (D'Angelo Tatum: 1 personal fouls) TURNOVER! (dead ball)

[07:57] Team_001 possession (Score: 24-18)
Klay Harden drives and kicks out. Dejounte McCollum attempts a Midrange. Contested by Paul Leonard (5.8 feet, ZONE). Dejounte McCollum misses. Rebound secured by D'Angelo Tatum.

[07:43] Team_076 possession (Score: 24-18)
Tobias Mitchell attempts a 3Pt. Contested by Klay Harden (5.2 feet, ZONE). Tobias Mitchell misses. Rebound secured by Cole Ball.

[07:32] Team_001 possession (Score: 24-18)
Dejounte McCollum makes the 3Pt and draws the foul on Cade Barnes! And-1! Dejounte McCollum to the line for 1. [Team fouls: 2] (Cade Barnes: 1 personal fouls)   FT 1/1: GOOD Dejounte McCollum makes 1/1 from the line.
Score: 24-22

[07:16] Team_076 possession (Score: 24-22)
Dejounte LaVine loses the ball! Stripped by Klay Harden! TURNOVER! (live ball)

[07:05] Team_001 possession (Score: 24-22)
Miles Griffin attempts a Midrange. Contested by D'Angelo Tatum (4.9 feet, MAN). Miles Griffin misses. Rebound secured by Cade Barnes.

[06:51] Team_076 possession (Score: 24-22)
Paul Leonard attempts a Layup. Contested by Cole Ball (4.3 feet, MAN). Paul Leonard misses. Offensive rebound by D'Angelo Tatum! D'Angelo Tatum kicks it out.

[06:35] Team_076 possession (Score: 24-22)
Cade Barnes attempts a Layup. Contested by Dejounte McCollum (4.8 feet, MAN). CADE BARNES MAKES IT!
Score: 26-22

[06:21] Team_001 possession (Score: 26-22)
Dejounte McCollum attempts a Layup. BLOCKED BY CADE BARNES! Ball deflects out of bounds off Dejounte McCollum.

[06:07] Team_076 possession (Score: 26-22)
FOUL! Reach-in foul on Miles Griffin during the drive. [Team fouls: 4] No free throws, side out. (Miles Griffin: 2 personal fouls)

[05:48] Team_076 possession (Score: 26-22)
Paul Leonard attempts a 3Pt. Contested by Klay Harden (5.4 feet, ZONE). Paul Leonard misses. Offensive rebound by D'Angelo Tatum! D'Angelo Tatum kicks it out.

[05:33] Team_076 possession (Score: 26-22)
Tobias Mitchell drives to the basket... Tobias Mitchell throws a bad pass! Stolen by Dejounte McCollum! TURNOVER! (live ball)

[05:20] Team_001 possession (Score: 26-22)
Cole Ball throws a bad pass! Stolen by Paul Leonard! TURNOVER! (live ball)

[05:10] Team_076 possession (Score: 26-22)
Tobias Mitchell attempts a 3Pt. Contested by Dirk Young (5.1 feet, MAN). Tobias Mitchell misses. Rebound secured by Dejounte McCollum.

[04:59] Team_001 possession (Score: 26-22)
Klay Harden drives to the basket... Klay Harden loses control! Ball rolls out of bounds! TURNOVER! (dead ball)

[04:59] Substitution (Team_076): Dejounte LaVine OUT → Pascal Lowry IN (stamina_rule2)

[04:59] Substitution (Team_076): Tobias Mitchell OUT → Jalen Poole IN (stamina_rule2)

[04:59] Substitution (Team_076): Paul Leonard OUT → Vince Lowry IN (stamina_rule2)

[04:59] Substitution (Team_076): Cade Barnes OUT → Kevin Nowitzki IN (stamina_rule2)

[04:59] Substitution (Team_076): D'Angelo Tatum OUT → Jordan Doncic IN (stamina_rule2)

[04:59] Substitution (Team_001): Klay Harden OUT → Ja Dosunmu IN (stamina_rule2)

[04:59] Substitution (Team_001): Dirk Young OUT → Rudy George IN (stamina_rule2)

[04:59] Substitution (Team_001): Cole Ball OUT → Larry Trent IN (stamina_rule2)

[04:59] Substitution (Team_001): Dejounte McCollum OUT → Franz Bryant IN (stamina_rule2)

[04:59] Substitution (Team_001): Miles Griffin OUT → Kristaps Ming IN (stamina_rule2)

[04:47] Team_076 possession (Score: 26-22)
Kevin Nowitzki drives and kicks out. Jalen Poole attempts a 3Pt. Contested by Rudy George (4.3 feet, MAN). Jalen Poole misses. FOUL! Loose ball foul on Rudy George during the rebound battle. [IN THE BONUS! 5 team fouls] Jordan Doncic to the line for 2 free throws. (Rudy George: 1 personal fouls)   FT 1/2: MISS   FT 2/2: GOOD Jordan Doncic makes 1/2 from the line.
Score: 27-22

[04:36] Team_001 possession (Score: 27-22)
FOUL! Offensive foul on Larry Trent! Vince Lowry drew the charge! [Team fouls: 6] (Larry Trent: 1 personal fouls) TURNOVER! (dead ball)

[04:19] Team_076 possession (Score: 27-22)
Pascal Lowry drives, picks up Franz Bryant. Help arrives from Rudy George! Pascal Lowry attempts a Layup. Contested by Rudy George (3.7 feet, ZONE). PASCAL LOWRY MAKES IT! Assist: Jordan Doncic
Score: 29-22

[03:59] Team_001 possession (Score: 29-22)
Franz Bryant attempts a 3Pt. Contested by Kevin Nowitzki (4.4 feet, MAN). Franz Bryant misses. Rebound secured by Kevin Nowitzki.

[03:40] Team_076 possession (Score: 29-22)
Vince Lowry makes the Layup and draws the foul on Franz Bryant! And-1! Vince Lowry to the line for 1. [BONUS: 7 team fouls] (Franz Bryant: 1 personal fouls)   FT 1/1: GOOD Vince Lowry makes 1/1 from the line.
Score: 32-22

[03:26] Team_001 possession (Score: 32-22)
Larry Trent throws a bad pass! Stolen by Vince Lowry! TURNOVER! (live ball)

[03:12] Team_076 possession (Score: 32-22)
Vince Lowry drives and kicks out. Jalen Poole attempts a Midrange. Contested by Franz Bryant (4.1 feet, ZONE). Jalen Poole misses. Rebound secured by Larry Trent.

[03:01] Team_001 possession (Score: 32-22)
Ja Dosunmu attempts a Layup. Contested by Jordan Doncic (3.5 feet, ZONE). JA DOSUNMU MAKES IT!
Score: 32-24

[02:45] Team_076 possession (Score: 32-24)
Jalen Poole makes the Midrange and draws the foul on Ja Dosunmu! And-1! Jalen Poole to the line for 1. [BONUS: 8 team fouls] (Ja Dosunmu: 1 personal fouls)   FT 1/1: GOOD Jalen Poole makes 1/1 from the line.
Score: 35-24

[02:28] Team_001 possession (Score: 35-24)
Rudy George attempts a 3Pt. Contested by Jalen Poole (5.5 feet, MAN). RUDY GEORGE MAKES IT! Assist: Kristaps Ming
Score: 35-27

[02:14] Team_076 possession (Score: 35-27)
Jordan Doncic drives and kicks out. Jalen Poole attempts a Midrange. Contested by Larry Trent (4.2 feet, ZONE). Jalen Poole misses. Rebound secured by Larry Trent.

[01:57] Team_001 possession (Score: 35-27)
Rudy George attempts a 3Pt. Contested by Kevin Nowitzki (4.3 feet, ZONE). RUDY GEORGE MAKES IT! Assist: Kristaps Ming
Score: 35-30

[01:41] Team_076 possession (Score: 35-30)
Kevin Nowitzki drives, Franz Bryant stays with him. Kevin Nowitzki attempts a Layup. Contested by Franz Bryant (4.3 feet, ZONE). KEVIN NOWITZKI MAKES IT! Assist: Pascal Lowry
Score: 37-30

[01:29] Team_001 possession (Score: 37-30)
FOUL! Holding foul on Pascal Lowry. [Team fouls: 3] No free throws, side out. (Pascal Lowry: 1 personal fouls)

[01:17] Team_001 possession (Score: 37-30)
Rudy George attempts a 3Pt. Contested by Vince Lowry (4.3 feet, ZONE). RUDY GEORGE MAKES IT! Assist: Ja Dosunmu
Score: 37-33

[01:04] Team_076 possession (Score: 37-33)
FOUL! Shooting foul on Larry Trent. Jordan Doncic to the line for 2 free throws. [BONUS: 9 team fouls] (Larry Trent: 2 personal fouls)   FT 1/2: GOOD   FT 2/2: GOOD Jordan Doncic makes 2/2 from the line.
Score: 39-33

[00:52] Team_001 possession (Score: 39-33)
Franz Bryant drives and kicks out. Ja Dosunmu attempts a Midrange. Contested by Jalen Poole (5.4 feet, ZONE). JA DOSUNMU MAKES IT! Assist: Larry Trent
Score: 39-35

[00:38] Team_076 possession (Score: 39-35)
Jordan Doncic throws a bad pass! Stolen by Kristaps Ming! TURNOVER! (live ball)

[00:28] Team_001 possession (Score: 39-35)
FOUL! Offensive foul on Ja Dosunmu! Pascal Lowry drew the charge! [Team fouls: 10] (Ja Dosunmu: 2 personal fouls) TURNOVER! (dead ball)

[00:16] Team_076 possession (Score: 39-35)
FOUL! Reach-in foul on Kristaps Ming during the drive. [IN THE BONUS! 11 team fouls] Jordan Doncic to the line for 2 free throws. (Kristaps Ming: 1 personal fouls)   FT 1/2: MISS   FT 2/2: MISS Jordan Doncic makes 0/2 from the line. Rebound secured by Larry Trent.

[00:03] Team_001 possession (Score: 39-35)
Ja Dosunmu drives, picks up Pascal Lowry. Help arrives from Vince Lowry! Ja Dosunmu attempts a Dunk. Wide open! Vince Lowry is 6.5 feet away. [MAN] JA DOSUNMU MAKES IT!
Score: 39-37

================================================================================
                              2ND QUARTER COMPLETE                              
================================================================================

2ND QUARTER SCORE: Team_076 20, Team_001 21

BOX SCORE:
================================================================================

Team_076
--------------------------------------------------------------------------------
Player                MIN  PTS  REB  AST  TO      FG   FG%      3P   3P%
--------------------------------------------------------------------------------
Tobias Mitchell        19    3    1    0   0   1/4    25.0     0/0   0.0
Jordan Doncic           5    3    0    1   0   2/4    50.0     0/0   0.0
Vince Lowry             5    3    0    0   0   1/2    50.0     0/0   0.0
Jalen Poole             5    3    0    0   0   1/1   100.0     0/0   0.0
Dejounte LaVine        19    2    0    0   0   1/1   100.0     0/0   0.0
Cade Barnes            19    2    3    0   0   1/1   100.0     0/0   0.0
Pascal Lowry            5    2    0    1   0   1/1   100.0     0/0   0.0
Kevin Nowitzki          5    2    1    0   0   1/1   100.0     0/0   0.0
D'Angelo Tatum         19    0    4    1   0   0/1     0.0     0/0   0.0

TEAM: FG: 9/16 (56.2%), 3PT: 0/4 (0.0%), REB: 9 (2 off, 7 def), AST: 3, TO: 6
TEAM FOULS: 3


Team_001
--------------------------------------------------------------------------------
Player                MIN  PTS  REB  AST  TO      FG   FG%      3P   3P%
--------------------------------------------------------------------------------
Rudy George             5    9    0    0   0   3/3   100.0     0/0   0.0
Ja Dosunmu              5    6    0    1   0   3/3   100.0     0/0   0.0
Dejounte McCollum      19    4    3    1   0   1/3    33.3     0/0   0.0
Cole Ball              19    2    2    0   0   1/2    50.0     0/0   0.0
Dirk Young             19    0    0    0   0   0/1     0.0     0/0   0.0
Miles Griffin          19    0    1    0   0   0/2     0.0     0/0   0.0
Klay Harden            19    0    0    0   0   0/1     0.0     0/0   0.0
Franz Bryant            5    0    0    0   0   0/1     0.0     0/0   0.0
Larry Trent             5    0    3    1   0   0/0     0.0     0/0   0.0
Kristaps Ming           5    0    0    2   0   0/0     0.0     0/0   0.0

TEAM: FG: 8/16 (50.0%), 3PT: 4/7 (57.1%), REB: 9 (2 off, 7 def), AST: 5, TO: 6
TEAM FOULS: 11 [Team_076 in BONUS]

================================================================================

================================================================================
                       3RD QUARTER - Team_076 vs Team_001                       
================================================================================

[12:00] Team_076 possession (Score: 39-37)
Tobias Mitchell drives to the basket... Tobias Mitchell loses the ball! Stripped by Dejounte McCollum! TURNOVER! (live ball)

[11:40] Team_001 possession (Score: 39-37)
Dirk Young attempts a 3Pt. Contested by Cade Barnes (3.7 feet, ZONE). DIRK YOUNG MAKES IT! Assist: Klay Harden
Score: 39-40

[11:24] Team_076 possession (Score: 39-40)
Dejounte LaVine attempts a Midrange. Contested by Dejounte McCollum (3.7 feet, ZONE). Dejounte LaVine misses. Rebound secured by Miles Griffin.

[11:12] Team_001 possession (Score: 39-40)
Dejounte McCollum drives, picks up Cade Barnes. Help arrives from Tobias Mitchell! Dejounte McCollum attempts a Dunk. Contested by Tobias Mitchell (3.4 feet, MAN). Dejounte McCollum misses. Rebound secured by Cade Barnes.

[10:59] Team_076 possession (Score: 39-40)
Tobias Mitchell drives to the basket... Tobias Mitchell commits a violation (traveling/carry)! TURNOVER! (dead ball)

[10:45] Team_001 possession (Score: 39-40)
Cole Ball attempts a 3Pt. Contested by Paul Leonard (4.8 feet, MAN). Cole Ball misses. FOUL! Loose ball foul on Tobias Mitchell during the rebound battle. [Team fouls: 1] No free throws, side out. (Tobias Mitchell: 1 personal fouls)

[10:33] Team_001 possession (Score: 39-40)
Klay Harden attempts a 3Pt. Contested by Dejounte LaVine (4.7 feet, MAN). Klay Harden misses. Rebound secured by Cade Barnes.

[10:18] Team_076 possession (Score: 39-40)
Tobias Mitchell attempts a 3Pt. Contested by Klay Harden (4.3 feet, ZONE). Tobias Mitchell misses. Offensive rebound by Cade Barnes! Cade Barnes kicks it out.

[10:05] Team_076 possession (Score: 39-40)
Dejounte LaVine attempts a 3Pt. Contested by Klay Harden (3.8 feet, MAN). Dejounte LaVine misses. FOUL! Loose ball foul on Dejounte McCollum during the rebound battle. [Team fouls: 1] No free throws, side out. (Dejounte McCollum: 1 personal fouls)

[09:49] Team_076 possession (Score: 39-40)
FOUL! Reach-in foul on Cole Ball during the drive. [Team fouls: 2] No free throws, side out. (Cole Ball: 1 personal fouls)

[09:40] Team_076 possession (Score: 39-40)
Paul Leonard attempts a 3Pt. Contested by Cole Ball (3.5 feet, MAN). Paul Leonard misses. Rebound secured by Cole Ball.

[09:30] Team_001 possession (Score: 39-40)
Klay Harden attempts a Layup. Contested by Cade Barnes (3.4 feet, ZONE). Klay Harden misses. Rebound secured by Tobias Mitchell.

[09:14] Team_076 possession (Score: 39-40)
Paul Leonard drives and kicks out. Tobias Mitchell attempts a Midrange. Contested by Cole Ball (3.1 feet, ZONE). TOBIAS MITCHELL MAKES IT! Assist: Paul Leonard
Score: 41-40

[08:58] Team_001 possession (Score: 41-40)
Klay Harden attempts a 3Pt. Contested by Dejounte LaVine (4.7 feet, ZONE). KLAY HARDEN MAKES IT! Assist: Cole Ball
Score: 41-43

[08:44] Team_076 possession (Score: 41-43)
D'Angelo Tatum drives, Miles Griffin stays with him. D'Angelo Tatum attempts a Dunk. Contested by Miles Griffin (4.3 feet, MAN). D'ANGELO TATUM MAKES IT! Assist: Dejounte LaVine
Score: 43-43

[08:31] Team_001 possession (Score: 43-43)
Cole Ball drives and kicks out. Klay Harden attempts a 3Pt. Contested by Dejounte LaVine (4.8 feet, ZONE). Klay Harden misses. Rebound secured by D'Angelo Tatum.

[08:12] Team_076 possession (Score: 43-43)
Cade Barnes attempts a 3Pt. Contested by Dejounte McCollum (3.9 feet, MAN). Cade Barnes misses. Offensive rebound by Cade Barnes! Cade Barnes kicks it out.

[07:53] Team_076 possession (Score: 43-43)
Paul Leonard attempts a 3Pt. Contested by Cole Ball (3.5 feet, MAN). PAUL LEONARD MAKES IT! Assist: Dejounte LaVine
Score: 46-43

[07:38] Team_001 possession (Score: 46-43)
Dejounte McCollum drives to the basket... FOUL! Offensive foul on Dejounte McCollum! Cade Barnes drew the charge! [Team fouls: 3] (Dejounte McCollum: 2 personal fouls) TURNOVER! (dead ball)

[07:19] Team_076 possession (Score: 46-43)
Cade Barnes drives, Dejounte McCollum stays with him. Cade Barnes attempts a Dunk. Contested by Dejounte McCollum (3.9 feet, MAN). Cade Barnes misses. Rebound secured by Dejounte McCollum.

[07:05] Team_001 possession (Score: 46-43)
Klay Harden attempts a 3Pt. Contested by Dejounte LaVine (4.7 feet, MAN). Klay Harden misses. Rebound secured by D'Angelo Tatum.

[06:50] Team_076 possession (Score: 46-43)
FOUL! Shooting foul on Dejounte McCollum. Cade Barnes to the line for 2 free throws. [Team fouls: 4] (Dejounte McCollum: 3 personal fouls)   FT 1/2: GOOD   FT 2/2: GOOD Cade Barnes makes 2/2 from the line.
Score: 48-43

[06:36] Team_001 possession (Score: 48-43)
FOUL! Shooting foul on Cade Barnes. Miles Griffin to the line for 2 free throws. [Team fouls: 2] (Cade Barnes: 1 personal fouls)   FT 1/2: GOOD   FT 2/2: GOOD Miles Griffin makes 2/2 from the line.
Score: 48-45

[06:19] Team_076 possession (Score: 48-45)
Cade Barnes attempts a Dunk. BLOCKED BY DEJOUNTE MCCOLLUM! Ball is loose! Offensive rebound by Cade Barnes! Cade Barnes kicks it out.

[06:03] Team_076 possession (Score: 48-45)
Cade Barnes drives to the basket... Cade Barnes loses the ball! Stripped by Miles Griffin! TURNOVER! (live ball)

[05:50] Team_001 possession (Score: 48-45)
FOUL! Offensive foul on Dejounte McCollum! Cade Barnes drew the charge! [Team fouls: 5] (Dejounte McCollum: 4 personal fouls) TURNOVER! (dead ball)

[05:35] Team_076 possession (Score: 48-45)
FOUL! Holding foul on Klay Harden. [IN THE BONUS! 6 team fouls] Dejounte LaVine to the line for 2 free throws. (Klay Harden: 1 personal fouls)   FT 1/2: GOOD   FT 2/2: MISS Dejounte LaVine makes 1/2 from the line. Rebound secured by Miles Griffin.
Score: 49-45

[05:19] Team_001 possession (Score: 49-45)
Dirk Young attempts a Midrange. Contested by Tobias Mitchell (4.3 feet, MAN). Dirk Young misses. Rebound secured by Tobias Mitchell.

[05:03] Team_076 possession (Score: 49-45)
D'Angelo Tatum drives, Miles Griffin stays with him. D'Angelo Tatum attempts a Layup. Contested by Miles Griffin (4.3 feet, MAN). D'Angelo Tatum misses. Rebound secured by Cole Ball.

[04:53] Team_001 possession (Score: 49-45)
FOUL! Shooting foul on Dejounte LaVine. Klay Harden to the line for 3 free throws. [Team fouls: 3] (Dejounte LaVine: 1 personal fouls)   FT 1/3: GOOD   FT 2/3: GOOD   FT 3/3: MISS Klay Harden makes 2/3 from the line. Rebound secured by D'Angelo Tatum.
Score: 49-47

[04:36] Team_076 possession (Score: 49-47)
Dejounte LaVine drives and kicks out. Dejounte LaVine attempts a Midrange. Contested by Klay Harden (3.9 feet, MAN). Dejounte LaVine misses. Rebound secured by Cole Ball.

[04:18] Team_001 possession (Score: 49-47)
Dirk Young attempts a 3Pt. Contested by Cade Barnes (3.8 feet, ZONE). Dirk Young misses. Rebound secured by Cade Barnes.

[04:02] Team_076 possession (Score: 49-47)
D'Angelo Tatum throws a bad pass out of bounds! TURNOVER! (dead ball)

[03:46] Team_001 possession (Score: 49-47)
Dejounte McCollum drives and kicks out. Klay Harden attempts a 3Pt. Contested by Dejounte LaVine (4.9 feet, MAN). Klay Harden misses. Offensive rebound by Miles Griffin! Miles Griffin kicks it out.

[03:35] Team_001 possession (Score: 49-47)
Miles Griffin drives, picks up Cade Barnes. Help arrives from Tobias Mitchell! Miles Griffin attempts a Dunk. Contested by Tobias Mitchell (4.0 feet, ZONE). Miles Griffin misses. Rebound secured by D'Angelo Tatum.

[03:24] Team_076 possession (Score: 49-47)
D'Angelo Tatum makes the Layup and draws the foul on Klay Harden! And-1! D'Angelo Tatum to the line for 1. [BONUS: 7 team fouls] (Klay Harden: 2 personal fouls)   FT 1/1: GOOD D'Angelo Tatum makes 1/1 from the line.
Score: 52-47

[03:12] Team_001 possession (Score: 52-47)
Cole Ball attempts a 3Pt. Contested by Cade Barnes (3.4 feet, ZONE). Cole Ball misses. Rebound secured by Tobias Mitchell.

[02:58] Team_076 possession (Score: 52-47)
Cade Barnes loses the ball! Stripped by Dejounte McCollum! TURNOVER! (live ball)

[02:45] Team_001 possession (Score: 52-47)
Cole Ball makes the Midrange and draws the foul on Paul Leonard! And-1! Cole Ball to the line for 1. [Team fouls: 4] (Paul Leonard: 1 personal fouls)   FT 1/1: GOOD Cole Ball makes 1/1 from the line.
Score: 52-50

[02:33] Team_076 possession (Score: 52-50)
Paul Leonard attempts a 3Pt. Contested by Cole Ball (3.6 feet, MAN). Paul Leonard misses. Rebound secured by Dejounte McCollum.

[02:19] Team_001 possession (Score: 52-50)
Klay Harden attempts a 3Pt. Contested by Cade Barnes (3.7 feet, ZONE). Klay Harden misses. Offensive rebound by Miles Griffin! Miles Griffin kicks it out.

[02:07] Team_001 possession (Score: 52-50)
Dejounte McCollum attempts a 3Pt. Contested by Cade Barnes (3.7 feet, ZONE). Dejounte McCollum misses. Rebound secured by Cade Barnes.

[01:52] Team_076 possession (Score: 52-50)
Tobias Mitchell attempts a 3Pt. Contested by Dirk Young (4.2 feet, MAN). TOBIAS MITCHELL MAKES IT! Assist: Dejounte LaVine
Score: 55-50

[01:41] Team_001 possession (Score: 55-50)
Dirk Young drives and kicks out. Dejounte McCollum attempts a Midrange. Contested by Paul Leonard (5.4 feet, ZONE). Dejounte McCollum misses. Rebound secured by D'Angelo Tatum.

[01:23] Team_076 possession (Score: 55-50)
D'Angelo Tatum drives, picks up Miles Griffin. Help arrives from Klay Harden! D'Angelo Tatum attempts a Layup. Contested by Klay Harden (4.7 feet, MAN). D'Angelo Tatum misses. Rebound secured by Miles Griffin.

[01:10] Team_001 possession (Score: 55-50)
Cole Ball attempts a Layup. Contested by Paul Leonard (5.2 feet, MAN). COLE BALL MAKES IT!
Score: 55-52

[00:53] Team_076 possession (Score: 55-52)
D'Angelo Tatum attempts a Midrange. Contested by Miles Griffin (4.7 feet, MAN). D'Angelo Tatum misses. FOUL! Loose ball foul on Dejounte McCollum during the rebound battle. [IN THE BONUS! 8 team fouls] D'Angelo Tatum to the line for 2 free throws. (Dejounte McCollum: 5 personal fouls)   FT 1/2: GOOD   FT 2/2: MISS D'Angelo Tatum makes 1/2 from the line. Rebound secured by Dejounte McCollum.
Score: 56-52

[00:42] Team_001 possession (Score: 56-52)
Dejounte McCollum attempts a Midrange. Contested by Cade Barnes (3.9 feet, MAN). DEJOUNTE MCCOLLUM MAKES IT!
Score: 56-54

[00:25] Team_076 possession (Score: 56-54)
FOUL! Holding foul on Klay Harden. [IN THE BONUS! 9 team fouls] Dejounte LaVine to the line for 2 free throws. (Klay Harden: 3 personal fouls)   FT 1/2: GOOD   FT 2/2: MISS Dejounte LaVine makes 1/2 from the line. FOUL! Loose ball foul on Cole Ball during the free throw rebound! [IN THE BONUS! 10 team fouls] Cade Barnes to the line for 2 free throws. (Cole Ball: 2 personal fouls)   FT 1/2: GOOD   FT 2/2: GOOD Cade Barnes makes 2/2 from the line.
Score: 59-54

[00:11] Team_001 possession (Score: 59-54)
Cole Ball makes the Dunk and draws the foul on Cade Barnes! And-1! Cole Ball to the line for 1. [BONUS: 5 team fouls] (Cade Barnes: 2 personal fouls)   FT 1/1: GOOD Cole Ball makes 1/1 from the line.
Score: 59-57

================================================================================
                              3RD QUARTER COMPLETE                              
================================================================================

3RD QUARTER SCORE: Team_076 20, Team_001 20

BOX SCORE:
================================================================================

Team_076
--------------------------------------------------------------------------------
Player                MIN  PTS  REB  AST  TO      FG   FG%      3P   3P%
--------------------------------------------------------------------------------
Cade Barnes            31    5    8    0   0   2/3    66.7     0/0   0.0
Tobias Mitchell        31    5    3    0   0   2/2   100.0     0/0   0.0
D'Angelo Tatum         31    5    5    0   0   2/5    40.0     0/0   0.0
Paul Leonard           31    3    0    1   0   1/3    33.3     0/0   0.0
Dejounte LaVine        31    0    0    3   0   0/2     0.0     0/0   0.0

TEAM: FG: 7/16 (43.8%), 3PT: 2/4 (50.0%), REB: 17 (5 off, 12 def), AST: 4, TO: 5
TEAM FOULS: 5 [Team_001 in BONUS]


Team_001
--------------------------------------------------------------------------------
Player                MIN  PTS  REB  AST  TO      FG   FG%      3P   3P%
--------------------------------------------------------------------------------
Cole Ball              31    8    3    1   0   3/5    60.0     0/0   0.0
Dirk Young             31    3    0    0   0   1/4    25.0     0/0   0.0
Klay Harden            31    3    0    1   0   1/5    20.0     0/0   0.0
Miles Griffin          31    2    6    0   0   1/2    50.0     0/0   0.0
Dejounte McCollum      31    2    3    0   0   1/3    33.3     0/0   0.0

TEAM: FG: 7/19 (36.8%), 3PT: 2/8 (25.0%), REB: 11 (3 off, 8 def), AST: 2, TO: 2
TEAM FOULS: 10 [Team_076 in BONUS]

================================================================================

================================================================================
                       4TH QUARTER - Team_076 vs Team_001                       
================================================================================

[12:00] Team_076 possession (Score: 59-57)
Tobias Mitchell attempts a Midrange. Contested by Dirk Young (4.2 feet, MAN). TOBIAS MITCHELL MAKES IT! Assist: Cade Barnes
Score: 61-57

[11:48] Team_001 possession (Score: 61-57)
Klay Harden attempts a 3Pt. Contested by Cade Barnes (3.7 feet, ZONE). Klay Harden misses. FOUL! Loose ball foul on Cade Barnes during the rebound battle. [Team fouls: 1] No free throws, side out. (Cade Barnes: 1 personal fouls)

[11:30] Team_001 possession (Score: 61-57)
Dejounte McCollum makes the Layup and draws the foul on Cade Barnes! And-1! Dejounte McCollum to the line for 1. [Team fouls: 2] (Cade Barnes: 2 personal fouls)   FT 1/1: GOOD Dejounte McCollum makes 1/1 from the line.
Score: 61-60

[11:19] Team_076 possession (Score: 61-60)
FOUL! Holding foul on Klay Harden. [Team fouls: 1] No free throws, side out. (Klay Harden: 1 personal fouls)

[11:03] Team_076 possession (Score: 61-60)
D'Angelo Tatum attempts a 3Pt. Contested by Klay Harden (4.6 feet, ZONE). D'ANGELO TATUM MAKES IT! Assist: Dejounte LaVine
Score: 64-60

[10:47] Team_001 possession (Score: 64-60)
Dejounte McCollum attempts a Midrange. Contested by Paul Leonard (5.3 feet, ZONE). Dejounte McCollum misses. Offensive rebound by Miles Griffin! Miles Griffin kicks it out.

[10:30] Team_001 possession (Score: 64-60)
Dirk Young makes the Midrange and draws the foul on Tobias Mitchell! And-1! Dirk Young to the line for 1. [Team fouls: 3] (Tobias Mitchell: 1 personal fouls)   FT 1/1: GOOD Dirk Young makes 1/1 from the line.
Score: 64-63

[10:16] Team_076 possession (Score: 64-63)
Dejounte LaVine attempts a 3Pt. Contested by Klay Harden (4.4 feet, MAN). DEJOUNTE LAVINE MAKES IT! Assist: Paul Leonard
Score: 67-63

[10:03] Team_001 possession (Score: 67-63)
Miles Griffin makes the Layup and draws the foul on D'Angelo Tatum! And-1! Miles Griffin to the line for 1. [Team fouls: 4] (D'Angelo Tatum: 1 personal fouls)   FT 1/1: GOOD Miles Griffin makes 1/1 from the line.
Score: 67-66

[09:50] Team_076 possession (Score: 67-66)
Dejounte LaVine attempts a 3Pt. Contested by Klay Harden (4.4 feet, MAN). Dejounte LaVine misses. Rebound secured by Cole Ball.

[09:35] Team_001 possession (Score: 67-66)
Cole Ball attempts a 3Pt. Contested by Paul Leonard (5.3 feet, MAN). Cole Ball misses. Offensive rebound by Cole Ball! Cole Ball kicks it out.

[09:23] Team_001 possession (Score: 67-66)
Klay Harden throws a bad pass! Stolen by Dejounte LaVine! TURNOVER! (live ball)

[09:11] Team_076 possession (Score: 67-66)
D'Angelo Tatum makes the Layup and draws the foul on Miles Griffin! And-1! D'Angelo Tatum to the line for 1. [Team fouls: 2] (Miles Griffin: 1 personal fouls)   FT 1/1: GOOD D'Angelo Tatum makes 1/1 from the line.
Score: 70-66

[08:56] Team_001 possession (Score: 70-66)
FOUL! Shooting foul on D'Angelo Tatum. Klay Harden to the line for 2 free throws. [BONUS: 5 team fouls] (D'Angelo Tatum: 2 personal fouls)   FT 1/2: MISS   FT 2/2: GOOD Klay Harden makes 1/2 from the line.
Score: 70-67

[08:41] Team_076 possession (Score: 70-67)
FOUL! Shooting foul on Miles Griffin. Dejounte LaVine to the line for 2 free throws. [Team fouls: 3] (Miles Griffin: 2 personal fouls)   FT 1/2: GOOD   FT 2/2: GOOD Dejounte LaVine makes 2/2 from the line.
Score: 72-67

[08:27] Team_001 possession (Score: 72-67)
Cole Ball attempts a Midrange. Contested by Tobias Mitchell (4.6 feet, ZONE). Cole Ball misses. Rebound secured by D'Angelo Tatum.

[08:13] Team_076 possession (Score: 72-67)
Dejounte LaVine throws a bad pass out of bounds! TURNOVER! (dead ball)

[08:13] Substitution (Team_076): Dejounte LaVine OUT → Pascal Lowry IN (stamina_rule2)

[08:13] Substitution (Team_076): Tobias Mitchell OUT → Jalen Poole IN (stamina_rule2)

[08:13] Substitution (Team_076): Paul Leonard OUT → Vince Lowry IN (stamina_rule2)

[08:13] Substitution (Team_076): Cade Barnes OUT → Kevin Nowitzki IN (stamina_rule2)

[08:13] Substitution (Team_076): D'Angelo Tatum OUT → Jordan Doncic IN (stamina_rule2)

[08:13] Substitution (Team_001): Klay Harden OUT → Ja Dosunmu IN (stamina_rule2)

[08:13] Substitution (Team_001): Dirk Young OUT → Rudy George IN (stamina_rule2)

[08:13] Substitution (Team_001): Cole Ball OUT → Larry Trent IN (stamina_rule2)

[08:13] Substitution (Team_001): Dejounte McCollum OUT → Franz Bryant IN (stamina_rule2)

[08:13] Substitution (Team_001): Miles Griffin OUT → Kristaps Ming IN (stamina_rule2)

[08:02] Team_001 possession (Score: 72-67)
Rudy George attempts a Layup. Contested by Jalen Poole (5.5 feet, MAN). Rudy George misses. Offensive rebound by Larry Trent! Larry Trent kicks it out.

[07:47] Team_001 possession (Score: 72-67)
Kristaps Ming drives and kicks out. Larry Trent attempts a Midrange. Contested by Vince Lowry (4.2 feet, MAN). LARRY TRENT MAKES IT! Assist: Rudy George
Score: 72-69

[07:30] Team_076 possession (Score: 72-69)
Vince Lowry attempts a 3Pt. Contested by Larry Trent (4.1 feet, MAN). Vince Lowry misses. Offensive rebound by Kevin Nowitzki! Kevin Nowitzki kicks it out.

[07:17] Team_076 possession (Score: 72-69)
FOUL! Shooting foul on Rudy George. Jordan Doncic to the line for 2 free throws. [Team fouls: 4] (Rudy George: 1 personal fouls)   FT 1/2: GOOD   FT 2/2: GOOD Jordan Doncic makes 2/2 from the line.
Score: 74-69

[07:02] Team_001 possession (Score: 74-69)
Kristaps Ming attempts a Midrange. Contested by Jordan Doncic (3.3 feet, MAN). Kristaps Ming misses. FOUL! Loose ball foul on Vince Lowry during the rebound battle. [IN THE BONUS! 6 team fouls] Rudy George to the line for 2 free throws. (Vince Lowry: 1 personal fouls)   FT 1/2: GOOD   FT 2/2: MISS Rudy George makes 1/2 from the line. Rebound secured by Vince Lowry.
Score: 74-70

[06:47] Team_076 possession (Score: 74-70)
Jordan Doncic makes the Layup and draws the foul on Franz Bryant! And-1! Jordan Doncic to the line for 1. [BONUS: 5 team fouls] (Franz Bryant: 1 personal fouls)   FT 1/1: GOOD Jordan Doncic makes 1/1 from the line.
Score: 77-70

[06:32] Team_001 possession (Score: 77-70)
Franz Bryant drives to the basket... FOUL! Offensive foul on Franz Bryant! Kevin Nowitzki drew the charge! [Team fouls: 6] (Franz Bryant: 2 personal fouls) TURNOVER! (dead ball)

[06:20] Team_076 possession (Score: 77-70)
Pascal Lowry drives and kicks out. Kevin Nowitzki attempts a 3Pt. Contested by Franz Bryant (4.1 feet, MAN). Kevin Nowitzki misses. Rebound secured by Larry Trent.

[06:08] Team_001 possession (Score: 77-70)
Rudy George loses the ball! Stripped by Jalen Poole! TURNOVER! (live ball)

[05:54] Team_076 possession (Score: 77-70)
Pascal Lowry attempts a 3Pt. Contested by Ja Dosunmu (3.6 feet, ZONE). PASCAL LOWRY MAKES IT! Assist: Kevin Nowitzki
Score: 80-70

[05:37] Team_001 possession (Score: 80-70)
Larry Trent attempts a Layup. Contested by Vince Lowry (4.7 feet, MAN). LARRY TRENT MAKES IT! Assist: Ja Dosunmu
Score: 80-72

[05:22] Team_076 possession (Score: 80-72)
Pascal Lowry attempts a 3Pt. Contested by Ja Dosunmu (3.6 feet, MAN). PASCAL LOWRY MAKES IT! Assist: Jalen Poole
Score: 83-72

[05:06] Team_001 possession (Score: 83-72)
Kristaps Ming drives, Jordan Doncic stays with him. Kristaps Ming attempts a Layup. Contested by Jordan Doncic (3.3 feet, ZONE). KRISTAPS MING MAKES IT!
Score: 83-74

[04:52] Team_076 possession (Score: 83-74)
Pascal Lowry attempts a 3Pt. Contested by Ja Dosunmu (3.6 feet, MAN). Pascal Lowry misses. Rebound secured by Rudy George.

[04:34] Team_001 possession (Score: 83-74)
Larry Trent drives, picks up Vince Lowry. Help arrives from Jalen Poole! Larry Trent attempts a Dunk. Contested by Jalen Poole (4.7 feet, MAN). Larry Trent misses. Rebound secured by Kevin Nowitzki.

[04:19] Team_076 possession (Score: 83-74)
Pascal Lowry attempts a 3Pt. Contested by Ja Dosunmu (3.6 feet, ZONE). Pascal Lowry misses. Rebound secured by Larry Trent.

[04:04] Team_001 possession (Score: 83-74)
Kristaps Ming drives to the basket... Kristaps Ming loses the ball! Stripped by Jordan Doncic! TURNOVER! (live ball)

[03:50] Team_076 possession (Score: 83-74)
Pascal Lowry attempts a 3Pt. Contested by Ja Dosunmu (3.6 feet, ZONE). Pascal Lowry misses. Rebound secured by Larry Trent.

[03:37] Team_001 possession (Score: 83-74)
Ja Dosunmu attempts a Midrange. Contested by Jalen Poole (5.7 feet, ZONE). Ja Dosunmu misses. Rebound secured by Vince Lowry.

[03:26] Team_076 possession (Score: 83-74)
Pascal Lowry drives, Ja Dosunmu stays with him. Pascal Lowry attempts a Dunk. Contested by Ja Dosunmu (3.6 feet, MAN). PASCAL LOWRY MAKES IT! Assist: Kevin Nowitzki
Score: 85-74

[03:11] Team_001 possession (Score: 85-74)
Larry Trent attempts a 3Pt. Contested by Vince Lowry (4.7 feet, MAN). Larry Trent misses. Offensive rebound by Larry Trent! Larry Trent kicks it out.

[02:56] Team_001 possession (Score: 85-74)
Kristaps Ming drives to the basket... Kristaps Ming commits a violation (traveling/carry)! TURNOVER! (dead ball)

[02:42] Team_076 possession (Score: 85-74)
Vince Lowry attempts a 3Pt. Contested by Larry Trent (4.1 feet, ZONE). Vince Lowry misses. Rebound secured by Rudy George.

[02:26] Team_001 possession (Score: 85-74)
Larry Trent attempts a Layup. Contested by Vince Lowry (4.7 feet, MAN). LARRY TRENT MAKES IT!
Score: 85-76

[02:09] Team_076 possession (Score: 85-76)
Pascal Lowry makes the 3Pt and draws the foul on Ja Dosunmu! And-1! Pascal Lowry to the line for 1. [BONUS: 7 team fouls] (Ja Dosunmu: 1 personal fouls)   FT 1/1: GOOD Pascal Lowry makes 1/1 from the line.
Score: 89-76

[01:54] Team_001 possession (Score: 89-76)
Rudy George makes the Layup and draws the foul on Jalen Poole! And-1! Rudy George to the line for 1. [BONUS: 7 team fouls] (Jalen Poole: 1 personal fouls)   FT 1/1: MISS Rudy George makes 0/1 from the line. Rebound secured by Vince Lowry.
Score: 89-78

[01:39] Team_076 possession (Score: 89-78)
Kevin Nowitzki makes the Layup and draws the foul on Franz Bryant! And-1! Kevin Nowitzki to the line for 1. [BONUS: 8 team fouls] (Franz Bryant: 3 personal fouls)   FT 1/1: GOOD Kevin Nowitzki makes 1/1 from the line.
Score: 92-78

[01:23] Team_001 possession (Score: 92-78)
FOUL! Shooting foul on Jordan Doncic. Ja Dosunmu to the line for 2 free throws. [BONUS: 8 team fouls] (Jordan Doncic: 1 personal fouls)   FT 1/2: GOOD   FT 2/2: MISS Ja Dosunmu makes 1/2 from the line. Rebound secured by Kevin Nowitzki.
Score: 92-79

[01:14] Team_076 possession (Score: 92-79)
FOUL! Reach-in foul on Franz Bryant during the drive. [IN THE BONUS! 9 team fouls] Kevin Nowitzki to the line for 2 free throws. (Franz Bryant: 4 personal fouls)   FT 1/2: GOOD   FT 2/2: GOOD Kevin Nowitzki makes 2/2 from the line.
Score: 94-79

[01:00] Team_001 possession (Score: 94-79)
Larry Trent attempts a Midrange. Contested by Kevin Nowitzki (4.8 feet, ZONE). Larry Trent misses. Rebound secured by Kevin Nowitzki.

[00:44] Team_076 possession (Score: 94-79)
Kevin Nowitzki attempts a Midrange. Contested by Larry Trent (4.4 feet, ZONE). Kevin Nowitzki misses. Rebound secured by Rudy George.

[00:29] Team_001 possession (Score: 94-79)
Franz Bryant attempts a Midrange. Contested by Kevin Nowitzki (4.4 feet, MAN). FRANZ BRYANT MAKES IT!
Score: 94-81

[00:15] Team_076 possession (Score: 94-81)
Pascal Lowry attempts a Midrange. Contested by Rudy George (4.0 feet, ZONE). Pascal Lowry misses. Rebound secured by Larry Trent.

[00:01] Team_001 possession (Score: 94-81)
Kristaps Ming attempts a Layup. Contested by Jordan Doncic (3.5 feet, ZONE). KRISTAPS MING MAKES IT! Assist: Rudy George
Score: 94-83

================================================================================
                              4TH QUARTER COMPLETE                              
================================================================================

4TH QUARTER SCORE: Team_076 35, Team_001 26

BOX SCORE:
================================================================================

Team_076
--------------------------------------------------------------------------------
Player                MIN  PTS  REB  AST  TO      FG   FG%      3P   3P%
--------------------------------------------------------------------------------
Pascal Lowry           13   12    0    0   0   4/9    44.4     0/0   0.0
D'Angelo Tatum         35    6    1    0   0   2/2   100.0     0/0   0.0
Dejounte LaVine        35    5    0    1   0   2/3    66.7     0/0   0.0
Kevin Nowitzki         13    5    4    2   0   2/3    66.7     0/0   0.0
Jordan Doncic          13    5    0    0   0   2/2   100.0     0/0   0.0
Tobias Mitchell        35    2    0    0   0   1/1   100.0     0/0   0.0
Cade Barnes            35    0    0    1   0   0/0     0.0     0/0   0.0
Paul Leonard           35    0    0    1   0   0/0     0.0     0/0   0.0
Vince Lowry            13    0    3    0   0   0/1     0.0     0/0   0.0
Jalen Poole            13    0    0    1   0   0/0     0.0     0/0   0.0

TEAM: FG: 13/21 (61.9%), 3PT: 5/10 (50.0%), REB: 7 (1 off, 6 def), AST: 6, TO: 1
TEAM FOULS: 8 [Team_001 in BONUS]


Team_001
--------------------------------------------------------------------------------
Player                MIN  PTS  REB  AST  TO      FG   FG%      3P   3P%
--------------------------------------------------------------------------------
Larry Trent            13    6    6    0   0   3/5    60.0     0/0   0.0
Kristaps Ming          13    4    0    0   0   2/3    66.7     0/0   0.0
Miles Griffin          35    3    2    0   0   1/1   100.0     0/0   0.0
Dejounte McCollum      35    3    0    0   0   1/1   100.0     0/0   0.0
Dirk Young             35    3    0    0   0   1/1   100.0     0/0   0.0
Franz Bryant           13    2    0    0   0   1/1   100.0     0/0   0.0
Klay Harden            35    1    0    0   0   1/1   100.0     0/0   0.0
Cole Ball              35    0    2    0   0   0/1     0.0     0/0   0.0
Rudy George            13    0    3    2   0   0/1     0.0     0/0   0.0
Ja Dosunmu             13    0    0    1   0   0/2     0.0     0/0   0.0

TEAM: FG: 10/17 (58.8%), 3PT: 0/0 (0.0%), REB: 14 (6 off, 8 def), AST: 3, TO: 5
TEAM FOULS: 9 [Team_076 in BONUS]

================================================================================

================================================================================
                               FULL GAME COMPLETE                               
================================================================================

FINAL SCORE: Team_076 94, Team_001 83

SCORING BY QUARTER:
--------------------------------------------------------------------------------
Team                     Q1     Q2     Q3     Q4    FINAL
--------------------------------------------------------------------------------
Team_076                 19     20     20     35       94
Team_001                 16     21     20     26       83
--------------------------------------------------------------------------------

FULL GAME BOX SCORE:
================================================================================

Team_076
--------------------------------------------------------------------------------
Player                MIN  PTS  REB  AST  TO      FG   FG%      3P   3P%      FT STL BLK
--------------------------------------------------------------------------------
Dejounte LaVine        35   12    0    4   5   5/10   50.0   2/4    50.0   4/6     1   0
Tobias Mitchell        35   10    5    0   1   3/10   30.0   1/6    16.7   1/1     1   1
Paul Leonard           35    9    0    2   4   5/9    55.6   2/5    40.0   1/1     2   0
Cade Barnes            35   15   18    4   2   5/6    83.3   0/0     0.0   6/7     2   1
D'Angelo Tatum         35   11   16    2   2   4/9    44.4   1/2    50.0   3/4     1   0
Pascal Lowry           13   14    0    1   0   5/10   50.0   3/6    50.0   1/1     0   0
Jalen Poole            13    3    0    1   0   1/1   100.0   0/0     0.0   1/1     1   0
Vince Lowry            13    3    3    0   0   1/3    33.3   0/1     0.0   1/1     1   0
Kevin Nowitzki         13    7    5    2   0   4/5    80.0   0/0     0.0   3/3     0   0
Jordan Doncic          13    8    0    1   1   3/5    60.0   0/0     0.0   6/9     1   0

TEAM: FG: 37/70 (52.9%), 3PT: 9/24 (37.5%), REB: 47 (13 off, 34 def), AST: 17, TO: 15


Team_001
--------------------------------------------------------------------------------
Player                MIN  PTS  REB  AST  TO      FG   FG%      3P   3P%      FT STL BLK
--------------------------------------------------------------------------------
Klay Harden            35    6    0    1   3   3/11   27.3   1/6    16.7   3/5     2   0
Dirk Young             35   14    0    0   4   4/10   40.0   2/5    40.0   1/1     1   0
Cole Ball              35   10   13    4   1   4/8    50.0   0/2     0.0   2/2     1   0
Dejounte McCollum      35    9    7    1   2   4/9    44.4   1/2    50.0   2/2     3   1
Miles Griffin          35   11   13    0   0   5/11   45.5   0/0     0.0   5/5     1   0
Ja Dosunmu             13    6    0    2   1   2/4    50.0   0/0     0.0   1/2     0   0
Rudy George            13    9    3    2   1   3/4    75.0   3/3   100.0   1/3     0   0
Larry Trent            13    6    9    1   4   2/4    50.0   0/0     0.0   0/0     0   0
Franz Bryant           13    2    0    0   1   2/3    66.7   0/1     0.0   0/0     0   0
Kristaps Ming          13    4    0    2   0   3/4    75.0   0/0     0.0   0/0     1   0

TEAM: FG: 32/68 (47.1%), 3PT: 7/19 (36.8%), REB: 45 (13 off, 32 def), AST: 13, TO: 17

================================================================================
