================================================================================
                        FULL GAME - Team_085 vs Team_091                        
================================================================================

================================================================================
                       1ST QUARTER - Team_085 vs Team_091                       
================================================================================

[12:00] Team_085 possession (Score: 0-0)
Magic Beal attempts a Layup. Contested by Kevin Simons (4.0 feet, ZONE). MAGIC BEAL MAKES IT!
Score: 2-0

[11:42] Team_091 possession (Score: 2-0)
Isaiah Siakam attempts a Layup. Contested by Stephen Bird (3.7 feet, MAN). ISAIAH SIAKAM MAKES IT!
Score: 2-2

[11:29] Team_085 possession (Score: 2-2)
Magic Beal attempts a 3Pt. Contested by Kyrie Rozier (4.5 feet, ZONE). Magic Beal misses. Rebound secured by Kevin Simons.

[11:15] Team_091 possession (Score: 2-2)
FOUL! Shooting foul on Magic Beal. Kyrie Rozier to the line for 3 free throws. [Team fouls: 1] (Magic Beal: 1 personal fouls)   FT 1/3: GOOD   FT 2/3: MISS   FT 3/3: GOOD Kyrie Rozier makes 2/3 from the line.
Score: 2-4

[11:00] Team_085 possession (Score: 2-4)
Collin Mobley makes the Layup and draws the foul on Kevin Simons! And-1! Collin Mobley to the line for 1. [Team fouls: 1] (Kevin Simons: 1 personal fouls)   FT 1/1: GOOD Collin Mobley makes 1/1 from the line.
Score: 5-4

[10:51] Team_091 possession (Score: 5-4)
Isaiah Siakam attempts a 3Pt. Contested by Stephen Bird (3.7 feet, MAN). Isaiah Siakam misses. Rebound secured by Paul Wagner.

[10:42] Team_085 possession (Score: 5-4)
Paul Wagner drives, Kevin Simons stays with him. Paul Wagner attempts a Dunk. Contested by Kevin Simons (3.8 feet, ZONE). Paul Wagner misses. Rebound secured by Kyrie Rozier.

[10:30] Team_091 possession (Score: 5-4)
Kyrie Rozier attempts a Midrange. Contested by Paul Wagner (3.6 feet, ZONE). Kyrie Rozier misses. Rebound secured by Larry Duncan.

[10:18] Team_085 possession (Score: 5-4)
FOUL! Holding foul on Rudy Bridges. [Team fouls: 2] No free throws, side out. (Rudy Bridges: 1 personal fouls)

[10:07] Team_085 possession (Score: 5-4)
Magic Beal makes the Layup and draws the foul on Kyrie Rozier! And-1! Magic Beal to the line for 1. [Team fouls: 3] (Kyrie Rozier: 1 personal fouls)   FT 1/1: GOOD Magic Beal makes 1/1 from the line.
Score: 8-4

[09:53] Team_091 possession (Score: 8-4)
D'Angelo Ingram drives and kicks out. Isaiah Siakam attempts a Midrange. Contested by Stephen Bird (3.4 feet, MAN). Isaiah Siakam misses. Rebound secured by Larry Duncan.

[09:38] Team_085 possession (Score: 8-4)
Larry Duncan attempts a 3Pt. Contested by Kyrie Rozier (4.4 feet, ZONE). Larry Duncan misses. Rebound secured by Kevin Simons.

[09:28] Team_091 possession (Score: 8-4)
D'Angelo Ingram drives and kicks out. Kevin Simons attempts a 3Pt. Contested by Collin Mobley (3.9 feet, MAN). Kevin Simons misses. Rebound secured by Paul Wagner.

[09:11] Team_085 possession (Score: 8-4)
Collin Mobley drives, picks up Kevin Simons. Help arrives from Kyrie Rozier! Collin Mobley attempts a Layup. Contested by Kyrie Rozier (3.5 feet, MAN). COLLIN MOBLEY MAKES IT! Assist: Stephen Bird
Score: 10-4

[08:59] Team_091 possession (Score: 10-4)
FOUL! Shooting foul on Paul Wagner. D'Angelo Ingram to the line for 2 free throws. [Team fouls: 2] (Paul Wagner: 1 personal fouls)   FT 1/2: GOOD   FT 2/2: GOOD D'Angelo Ingram makes 2/2 from the line.
Score: 10-6

[08:50] Team_085 possession (Score: 10-6)
Collin Mobley drives, Kevin Simons stays with him. Collin Mobley attempts a Layup. Contested by Kevin Simons (3.5 feet, ZONE). COLLIN MOBLEY MAKES IT! Assist: Larry Duncan
Score: 12-6

[08:32] Team_091 possession (Score: 12-6)
D'Angelo Ingram attempts a 3Pt. Contested by Paul Wagner (4.5 feet, MAN). D'Angelo Ingram misses. Rebound secured by Collin Mobley.

[08:19] Team_085 possession (Score: 12-6)
Paul Wagner drives and kicks out. Magic Beal attempts a Midrange. Contested by D'Angelo Ingram (4.6 feet, ZONE). Magic Beal misses. Offensive rebound by Larry Duncan! Larry Duncan kicks it out.

[08:06] Team_085 possession (Score: 12-6)
Magic Beal makes the Dunk and draws the foul on Rudy Bridges! And-1! Magic Beal to the line for 1. [Team fouls: 4] (Rudy Bridges: 2 personal fouls)   FT 1/1: GOOD Magic Beal makes 1/1 from the line.
Score: 15-6

[07:56] Team_091 possession (Score: 15-6)
Isaiah Siakam attempts a Midrange. Contested by Stephen Bird (3.7 feet, MAN). ISAIAH SIAKAM MAKES IT! Assist: D'Angelo Ingram
Score: 15-8

[07:37] Team_085 possession (Score: 15-8)
Stephen Bird drives, Isaiah Siakam stays with him. Stephen Bird attempts a Dunk. Contested by Isaiah Siakam (5.9 feet, MAN). STEPHEN BIRD MAKES IT!
Score: 17-8

[07:24] Team_091 possession (Score: 17-8)
Rudy Bridges makes the Layup and draws the foul on Larry Duncan! And-1! Rudy Bridges to the line for 1. [Team fouls: 3] (Larry Duncan: 1 personal fouls)   FT 1/1: GOOD Rudy Bridges makes 1/1 from the line.
Score: 17-11

[07:08] Team_085 possession (Score: 17-11)
Paul Wagner commits a violation (traveling/carry)! TURNOVER! (dead ball)

[06:56] Team_091 possession (Score: 17-11)
Kevin Simons makes the Dunk and draws the foul on Collin Mobley! And-1! Kevin Simons to the line for 1. [Team fouls: 4] (Collin Mobley: 1 personal fouls)   FT 1/1: GOOD Kevin Simons makes 1/1 from the line.
Score: 17-14

[06:40] Team_085 possession (Score: 17-14)
Stephen Bird attempts a Layup. Contested by Isaiah Siakam (5.9 feet, MAN). Stephen Bird misses. Rebound secured by Kyrie Rozier.

[06:22] Team_091 possession (Score: 17-14)
FOUL! Holding foul on Paul Wagner. [IN THE BONUS! 5 team fouls] D'Angelo Ingram to the line for 2 free throws. (Paul Wagner: 2 personal fouls)   FT 1/2: GOOD   FT 2/2: GOOD D'Angelo Ingram makes 2/2 from the line.
Score: 17-16

[06:05] Team_085 possession (Score: 17-16)
Larry Duncan loses control! Ball rolls out of bounds! TURNOVER! (dead ball)

[05:46] Team_091 possession (Score: 17-16)
D'Angelo Ingram makes the Layup and draws the foul on Paul Wagner! And-1! D'Angelo Ingram to the line for 1. [BONUS: 6 team fouls] (Paul Wagner: 3 personal fouls)   FT 1/1: GOOD D'Angelo Ingram makes 1/1 from the line.
Score: 17-19

[05:31] Team_085 possession (Score: 17-19)
Paul Wagner loses control! Ball rolls out of bounds! TURNOVER! (dead ball)

[05:15] Team_091 possession (Score: 17-19)
Rudy Bridges drives, Larry Duncan stays with him. Rudy Bridges attempts a Layup. Contested by Larry Duncan (3.1 feet, MAN). Rudy Bridges misses. Rebound secured by Larry Duncan.

[05:03] Team_085 possession (Score: 17-19)
Larry Duncan drives, Kevin Simons stays with him. Larry Duncan attempts a Layup. Contested by Kevin Simons (4.0 feet, ZONE). LARRY DUNCAN MAKES IT! Assist: Collin Mobley
Score: 19-19

[04:47] Team_091 possession (Score: 19-19)
Kyrie Rozier attempts a 3Pt. Contested by Magic Beal (4.2 feet, ZONE). Kyrie Rozier misses. Rebound secured by Collin Mobley.

[04:34] Team_085 possession (Score: 19-19)
Stephen Bird attempts a Midrange. Contested by Isaiah Siakam (6.0 feet, ZONE). STEPHEN BIRD MAKES IT! Assist: Magic Beal
Score: 21-19

[04:20] Team_091 possession (Score: 21-19)
Kevin Simons attempts a Midrange. Contested by Collin Mobley (4.4 feet, MAN). Kevin Simons misses. FOUL! Loose ball foul on Larry Duncan during the rebound battle. [IN THE BONUS! 7 team fouls] Kevin Simons to the line for 2 free throws. (Larry Duncan: 2 personal fouls)   FT 1/2: MISS   FT 2/2: GOOD Kevin Simons makes 1/2 from the line.
Score: 21-20

[04:00] Team_085 possession (Score: 21-20)
Stephen Bird drives and kicks out. Paul Wagner attempts a 3Pt. Contested by D'Angelo Ingram (4.8 feet, MAN). Paul Wagner misses. FOUL! Loose ball foul on Kyrie Rozier during the rebound battle. [IN THE BONUS! 5 team fouls] Paul Wagner to the line for 2 free throws. (Kyrie Rozier: 2 personal fouls)   FT 1/2: GOOD   FT 2/2: GOOD Paul Wagner makes 2/2 from the line.
Score: 23-20

[03:43] Team_091 possession (Score: 23-20)
Isaiah Siakam makes the Layup and draws the foul on Stephen Bird! And-1! Isaiah Siakam to the line for 1. [BONUS: 8 team fouls] (Stephen Bird: 1 personal fouls)   FT 1/1: MISS Isaiah Siakam makes 0/1 from the line. Rebound secured by Collin Mobley.
Score: 23-22

[03:29] Team_085 possession (Score: 23-22)
Collin Mobley attempts a Midrange. Contested by Rudy Bridges (4.4 feet, ZONE). Collin Mobley misses. Offensive rebound by Larry Duncan! Larry Duncan kicks it out.

[03:12] Team_085 possession (Score: 23-22)
FOUL! Holding foul on Rudy Bridges. [IN THE BONUS! 6 team fouls] Larry Duncan to the line for 2 free throws. (Rudy Bridges: 3 personal fouls)   FT 1/2: GOOD   FT 2/2: GOOD Larry Duncan makes 2/2 from the line.
Score: 25-22

[03:00] Team_091 possession (Score: 25-22)
Rudy Bridges makes the Layup and draws the foul on Paul Wagner! And-1! Rudy Bridges to the line for 1. [BONUS: 9 team fouls] (Paul Wagner: 4 personal fouls)   FT 1/1: GOOD Rudy Bridges makes 1/1 from the line.
Score: 25-25

[02:45] Team_085 possession (Score: 25-25)
Stephen Bird drives, Isaiah Siakam stays with him. Stephen Bird attempts a Dunk. Wide open! Isaiah Siakam is 6.1 feet away. [MAN] Stephen Bird misses. Offensive rebound by Larry Duncan! Larry Duncan kicks it out.

[02:27] Team_085 possession (Score: 25-25)
Larry Duncan attempts a 3Pt. Contested by Kyrie Rozier (4.6 feet, ZONE). Larry Duncan misses. Rebound secured by Rudy Bridges.

[02:16] Team_091 possession (Score: 25-25)
Kevin Simons drives to the basket... Kevin Simons loses control! Ball rolls out of bounds! TURNOVER! (dead ball)

[02:16] Substitution (Team_085): Magic Beal OUT → Khris Brogdon IN (stamina_rule2)

[02:16] Substitution (Team_085): Stephen Bird OUT → Jordan Morant IN (stamina_rule2)

[02:16] Substitution (Team_085): Larry Duncan OUT → Giannis Johnson IN (stamina_rule2)

[02:16] Substitution (Team_085): Collin Mobley OUT → Malcolm Beal IN (stamina_rule2)

[02:16] Substitution (Team_091): Isaiah Siakam OUT → Julius Barnes IN (stamina_rule2)

[02:16] Substitution (Team_091): D'Angelo Ingram OUT → Zion Mitchell IN (stamina_rule2)

[02:16] Substitution (Team_091): Kevin Simons OUT → Ja George IN (stamina_rule2)

[02:03] Team_085 possession (Score: 25-25)
Malcolm Beal drives, picks up Ja George. Help arrives from Kyrie Rozier! Malcolm Beal attempts a Dunk. Contested by Kyrie Rozier (4.2 feet, MAN). MALCOLM BEAL MAKES IT!
Score: 27-25

[01:48] Team_091 possession (Score: 27-25)
Ja George attempts a Midrange. Contested by Giannis Johnson (5.9 feet, ZONE). Ja George misses. Rebound secured by Malcolm Beal.

[01:37] Team_085 possession (Score: 27-25)
Paul Wagner attempts a 3Pt. Contested by Kyrie Rozier (4.6 feet, ZONE). PAUL WAGNER MAKES IT! Assist: Khris Brogdon
Score: 30-25

[01:19] Team_091 possession (Score: 30-25)
Ja George drives and kicks out. Rudy Bridges attempts a 3Pt. Contested by Paul Wagner (3.9 feet, ZONE). Rudy Bridges misses. Rebound secured by Paul Wagner.

[01:03] Team_085 possession (Score: 30-25)
Giannis Johnson throws a bad pass! Stolen by Rudy Bridges! TURNOVER! (live ball)

[00:48] Team_091 possession (Score: 30-25)
Zion Mitchell makes the Layup and draws the foul on Paul Wagner! And-1! Zion Mitchell to the line for 1. [BONUS: 10 team fouls] (Paul Wagner: 5 personal fouls)   FT 1/1: GOOD Zion Mitchell makes 1/1 from the line.
Score: 30-28

[00:29] Team_085 possession (Score: 30-28)
Malcolm Beal drives and kicks out. Malcolm Beal attempts a 3Pt. Contested by Kyrie Rozier (4.5 feet, ZONE). Malcolm Beal misses. Rebound secured by Rudy Bridges.

[00:09] Team_091 possession (Score: 30-28)
Rudy Bridges attempts a Layup. Contested by Giannis Johnson (5.9 feet, MAN). Rudy Bridges misses. Rebound secured by Paul Wagner.

================================================================================
                              1ST QUARTER COMPLETE                              
================================================================================

1ST QUARTER SCORE: Team_085 30, Team_091 28

BOX SCORE:
================================================================================

Team_085
--------------------------------------------------------------------------------
Player                MIN  PTS  REB  AST  TO      FG   FG%      3P   3P%
--------------------------------------------------------------------------------
Magic Beal             10    8    0    1   0   3/4    75.0     0/0   0.0
Collin Mobley          10    7    3    1   0   3/3   100.0     0/0   0.0
Paul Wagner            12    5    4    0   0   2/3    66.7     0/0   0.0
Larry Duncan           10    4    6    1   0   2/4    50.0     0/0   0.0
Stephen Bird           10    4    0    1   0   2/3    66.7     0/0   0.0
Malcolm Beal            2    2    1    0   0   1/2    50.0     0/0   0.0
Khris Brogdon           2    0    0    1   0   0/0     0.0     0/0   0.0

TEAM: FG: 13/19 (68.4%), 3PT: 1/4 (25.0%), REB: 14 (3 off, 11 def), AST: 5, TO: 4
TEAM FOULS: 10 [Team_091 in BONUS]


Team_091
--------------------------------------------------------------------------------
Player                MIN  PTS  REB  AST  TO      FG   FG%      3P   3P%
--------------------------------------------------------------------------------
D'Angelo Ingram        10    7    0    1   0   3/6    50.0     0/0   0.0
Rudy Bridges           12    6    2    0   0   2/4    50.0     0/0   0.0
Isaiah Siakam          10    4    0    0   0   2/4    50.0     0/0   0.0
Kevin Simons           10    4    2    0   0   2/2   100.0     0/0   0.0
Zion Mitchell           2    3    0    0   0   1/1   100.0     0/0   0.0
Kyrie Rozier           12    2    2    0   0   1/3    33.3     0/0   0.0
Ja George               2    0    0    0   0   0/2     0.0     0/0   0.0

TEAM: FG: 11/22 (50.0%), 3PT: 1/4 (25.0%), REB: 6 (0 off, 6 def), AST: 1, TO: 1
TEAM FOULS: 6 [Team_085 in BONUS]

================================================================================

================================================================================
                       2ND QUARTER - Team_085 vs Team_091                       
================================================================================

[12:00] Team_085 possession (Score: 30-28)
Larry Duncan attempts a 3Pt. Contested by Rudy Bridges (5.0 feet, MAN). Larry Duncan misses. Rebound secured by Rudy Bridges.

[11:48] Team_091 possession (Score: 30-28)
Isaiah Siakam drives and kicks out. FOUL! Shooting foul on Magic Beal. Kyrie Rozier to the line for 3 free throws. [Team fouls: 1] (Magic Beal: 1 personal fouls)   FT 1/3: GOOD   FT 2/3: GOOD   FT 3/3: GOOD Kyrie Rozier makes 3/3 from the line.
Score: 30-31

[11:35] Team_085 possession (Score: 30-31)
Larry Duncan attempts a Midrange. Contested by Rudy Bridges (5.0 feet, MAN). Larry Duncan misses. Rebound secured by Kyrie Rozier.

[11:18] Team_091 possession (Score: 30-31)
Kevin Simons drives and kicks out. Kevin Simons attempts a 3Pt. Contested by Collin Mobley (4.0 feet, MAN). KEVIN SIMONS MAKES IT! Assist: Rudy Bridges
Score: 30-34

[11:04] Team_085 possession (Score: 30-34)
Magic Beal attempts a 3Pt. Contested by Kyrie Rozier (4.8 feet, MAN). MAGIC BEAL MAKES IT! Assist: Collin Mobley
Score: 33-34

[10:50] Team_091 possession (Score: 33-34)
Rudy Bridges drives and kicks out. Kyrie Rozier attempts a 3Pt. Contested by Magic Beal (4.1 feet, ZONE). KYRIE ROZIER MAKES IT! Assist: Kevin Simons
Score: 33-37

[10:35] Team_085 possession (Score: 33-37)
Stephen Bird attempts a 3Pt. Contested by Kyrie Rozier (4.7 feet, ZONE). Stephen Bird misses. Offensive rebound by Paul Wagner! Paul Wagner kicks it out.

[10:21] Team_085 possession (Score: 33-37)
Paul Wagner makes the Layup and draws the foul on Kyrie Rozier! And-1! Paul Wagner to the line for 1. [Team fouls: 1] (Kyrie Rozier: 1 personal fouls)   FT 1/1: GOOD Paul Wagner makes 1/1 from the line.
Score: 36-37

[10:08] Team_091 possession (Score: 36-37)
Kyrie Rozier attempts a 3Pt. Contested by Magic Beal (4.3 feet, ZONE). Kyrie Rozier misses. Offensive rebound by Kevin Simons! Kevin Simons's putback is no good. Rebound secured by Collin Mobley.

[09:56] Team_085 possession (Score: 36-37)
FOUL! Reach-in foul on Kyrie Rozier during the drive. [Team fouls: 2] No free throws, side out. (Kyrie Rozier: 2 personal fouls)

[09:42] Team_085 possession (Score: 36-37)
Larry Duncan attempts a Midrange. Contested by Rudy Bridges (5.2 feet, MAN). LARRY DUNCAN MAKES IT! Assist: Magic Beal
Score: 38-37

[09:31] Team_091 possession (Score: 38-37)
D'Angelo Ingram loses the ball! Stripped by Paul Wagner! TURNOVER! (live ball)

[09:16] Team_085 possession (Score: 38-37)
Larry Duncan attempts a 3Pt. Contested by Rudy Bridges (5.2 feet, MAN). Larry Duncan misses. Rebound secured by Kevin Simons.

[08:59] Team_091 possession (Score: 38-37)
FOUL! Shooting foul on Magic Beal. Kyrie Rozier to the line for 3 free throws. [Team fouls: 2] (Magic Beal: 2 personal fouls)   FT 1/3: GOOD   FT 2/3: GOOD   FT 3/3: GOOD Kyrie Rozier makes 3/3 from the line.
Score: 38-40

[08:40] Team_085 possession (Score: 38-40)
Magic Beal throws a bad pass! Stolen by Kyrie Rozier! TURNOVER! (live ball)

[08:24] Team_091 possession (Score: 38-40)
D'Angelo Ingram loses the ball! Stripped by Paul Wagner! TURNOVER! (live ball)

[08:07] Team_085 possession (Score: 38-40)
FOUL! Offensive foul on Collin Mobley! Kevin Simons drew the charge! [Team fouls: 3] (Collin Mobley: 1 personal fouls) TURNOVER! (dead ball)

[07:55] Team_091 possession (Score: 38-40)
D'Angelo Ingram attempts a 3Pt. Contested by Paul Wagner (5.1 feet, MAN). D'Angelo Ingram misses. Rebound secured by Paul Wagner.

[07:45] Team_085 possession (Score: 38-40)
Stephen Bird drives to the basket... Stephen Bird throws a bad pass! Stolen by Isaiah Siakam! TURNOVER! (live ball)

[07:32] Team_091 possession (Score: 38-40)
D'Angelo Ingram drives, Paul Wagner stays with him. D'Angelo Ingram attempts a Dunk. Contested by Paul Wagner (5.2 feet, ZONE). D'ANGELO INGRAM MAKES IT! Assist: Kevin Simons
Score: 38-42

[07:16] Team_085 possession (Score: 38-42)
Paul Wagner attempts a Midrange. Contested by D'Angelo Ingram (5.3 feet, MAN). Paul Wagner misses. Offensive rebound by Larry Duncan! Larry Duncan kicks it out.

[06:58] Team_085 possession (Score: 38-42)
Collin Mobley attempts a 3Pt. Contested by Kyrie Rozier (4.8 feet, ZONE). COLLIN MOBLEY MAKES IT! Assist: Larry Duncan
Score: 41-42

[06:45] Team_091 possession (Score: 41-42)
Rudy Bridges attempts a 3Pt. Contested by Larry Duncan (3.6 feet, MAN). RUDY BRIDGES MAKES IT! Assist: Kevin Simons
Score: 41-45

[06:32] Team_085 possession (Score: 41-45)
Magic Beal attempts a Midrange. Contested by Rudy Bridges (5.6 feet, ZONE). Magic Beal misses. Offensive rebound by Larry Duncan! Larry Duncan kicks it out.

[06:18] Team_085 possession (Score: 41-45)
Larry Duncan attempts a 3Pt. Contested by Rudy Bridges (5.6 feet, MAN). Larry Duncan misses. Rebound secured by Rudy Bridges.

[06:01] Team_091 possession (Score: 41-45)
Kyrie Rozier attempts a 3Pt. Contested by Magic Beal (4.7 feet, MAN). Kyrie Rozier misses. Rebound secured by Paul Wagner.

[05:43] Team_085 possession (Score: 41-45)
Stephen Bird attempts a Layup. Wide open! Isaiah Siakam is 6.5 feet away. [MAN] STEPHEN BIRD MAKES IT!
Score: 43-45

[05:27] Team_091 possession (Score: 43-45)
Kevin Simons makes the Layup and draws the foul on Collin Mobley! And-1! Kevin Simons to the line for 1. [Team fouls: 4] (Collin Mobley: 2 personal fouls)   FT 1/1: GOOD Kevin Simons makes 1/1 from the line.
Score: 43-48

[05:14] Team_085 possession (Score: 43-48)
FOUL! Holding foul on Kyrie Rozier. [Team fouls: 3] No free throws, side out. (Kyrie Rozier: 3 personal fouls)

[04:58] Team_085 possession (Score: 43-48)
Larry Duncan attempts a Midrange. Contested by D'Angelo Ingram (5.7 feet, ZONE). LARRY DUNCAN MAKES IT! Assist: Collin Mobley
Score: 45-48

[04:43] Team_091 possession (Score: 45-48)
Isaiah Siakam drives, Paul Wagner stays with him. Isaiah Siakam attempts a Dunk. Contested by Paul Wagner (4.9 feet, ZONE). ISAIAH SIAKAM MAKES IT!
Score: 45-50

[04:30] Team_085 possession (Score: 45-50)
FOUL! Shooting foul on Kevin Simons. Magic Beal to the line for 2 free throws. [Team fouls: 4] (Kevin Simons: 1 personal fouls)   FT 1/2: GOOD   FT 2/2: MISS Magic Beal makes 1/2 from the line. Rebound secured by Kevin Simons.
Score: 46-50

[04:12] Team_091 possession (Score: 46-50)
Kyrie Rozier attempts a 3Pt. Contested by Magic Beal (4.9 feet, ZONE). Kyrie Rozier misses. Rebound secured by Larry Duncan.

[03:55] Team_085 possession (Score: 46-50)
Magic Beal attempts a 3Pt. Contested by Kyrie Rozier (5.6 feet, ZONE). Magic Beal misses. Offensive rebound by Larry Duncan! Larry Duncan kicks it out.

[03:41] Team_085 possession (Score: 46-50)
Magic Beal attempts a 3Pt. Contested by Rudy Bridges (5.9 feet, ZONE). Magic Beal misses. Offensive rebound by Paul Wagner! Paul Wagner kicks it out.

[03:24] Team_085 possession (Score: 46-50)
FOUL! Holding foul on Kevin Simons. [IN THE BONUS! 5 team fouls] Collin Mobley to the line for 2 free throws. (Kevin Simons: 2 personal fouls)   FT 1/2: GOOD   FT 2/2: GOOD Collin Mobley makes 2/2 from the line.
Score: 48-50

[03:10] Team_091 possession (Score: 48-50)
FOUL! Shooting foul on Magic Beal. Kyrie Rozier to the line for 2 free throws. [BONUS: 5 team fouls] (Magic Beal: 3 personal fouls)   FT 1/2: GOOD   FT 2/2: GOOD Kyrie Rozier makes 2/2 from the line.
Score: 48-52

[02:55] Team_085 possession (Score: 48-52)
Stephen Bird makes the Dunk and draws the foul on Isaiah Siakam! And-1! Stephen Bird to the line for 1. [BONUS: 6 team fouls] (Isaiah Siakam: 1 personal fouls)   FT 1/1: GOOD Stephen Bird makes 1/1 from the line.
Score: 51-52

[02:41] Team_091 possession (Score: 51-52)
D'Angelo Ingram drives to the basket... FOUL! Offensive foul on D'Angelo Ingram! Paul Wagner drew the charge! [Team fouls: 7] (D'Angelo Ingram: 1 personal fouls) TURNOVER! (dead ball)

[02:25] Team_085 possession (Score: 51-52)
Collin Mobley drives to the basket... Collin Mobley throws a bad pass out of bounds! TURNOVER! (dead ball)

[02:25] Substitution (Team_085): Magic Beal OUT → Khris Brogdon IN (stamina_rule2)

[02:25] Substitution (Team_085): Stephen Bird OUT → Jordan Morant IN (stamina_rule2)

[02:25] Substitution (Team_085): Larry Duncan OUT → Giannis Johnson IN (stamina_rule2)

[02:25] Substitution (Team_085): Paul Wagner OUT → Jalen Leonard IN (stamina_rule2)

[02:25] Substitution (Team_085): Collin Mobley OUT → Malcolm Beal IN (stamina_rule2)

[02:25] Substitution (Team_091): Kyrie Rozier OUT → Karl Morant IN (stamina_rule2)

[02:25] Substitution (Team_091): Isaiah Siakam OUT → Julius Barnes IN (stamina_rule2)

[02:25] Substitution (Team_091): Rudy Bridges OUT → Tim Antetokounmpo IN (stamina_rule2)

[02:25] Substitution (Team_091): D'Angelo Ingram OUT → Zion Mitchell IN (stamina_rule2)

[02:25] Substitution (Team_091): Kevin Simons OUT → Ja George IN (stamina_rule2)

[02:12] Team_091 possession (Score: 51-52)
Julius Barnes loses control! Ball rolls out of bounds! TURNOVER! (dead ball)

[02:02] Team_085 possession (Score: 51-52)
Khris Brogdon drives to the basket... Khris Brogdon throws a bad pass out of bounds! TURNOVER! (dead ball)

[01:50] Team_091 possession (Score: 51-52)
Tim Antetokounmpo drives and kicks out. Julius Barnes attempts a Midrange. Contested by Jalen Leonard (4.1 feet, ZONE). Julius Barnes misses. Offensive rebound by Ja George! Ja George kicks it out.

[01:30] Team_091 possession (Score: 51-52)
Tim Antetokounmpo attempts a Midrange. Contested by Giannis Johnson (6.0 feet, MAN). TIM ANTETOKOUNMPO MAKES IT!
Score: 51-54

[01:21] Team_085 possession (Score: 51-54)
Malcolm Beal drives, Ja George stays with him. Malcolm Beal attempts a Layup. Contested by Ja George (4.2 feet, MAN). Malcolm Beal misses. Rebound secured by Zion Mitchell.

[01:10] Team_091 possession (Score: 51-54)
Zion Mitchell attempts a Midrange. Wide open! Giannis Johnson is 6.0 feet away. [ZONE] Zion Mitchell misses. Rebound secured by Jalen Leonard.

[00:57] Team_085 possession (Score: 51-54)
Jordan Morant makes the Midrange and draws the foul on Julius Barnes! And-1! Jordan Morant to the line for 1. [BONUS: 8 team fouls] (Julius Barnes: 1 personal fouls)   FT 1/1: GOOD Jordan Morant makes 1/1 from the line.
Score: 54-54

[00:39] Team_091 possession (Score: 54-54)
Tim Antetokounmpo attempts a 3Pt. Contested by Jordan Morant (3.6 feet, ZONE). Tim Antetokounmpo misses. Offensive rebound by Zion Mitchell! Zion Mitchell kicks it out.

[00:24] Team_091 possession (Score: 54-54)
Karl Morant drives, Khris Brogdon stays with him. Karl Morant attempts a Dunk. Contested by Khris Brogdon (5.8 feet, MAN). KARL MORANT MAKES IT! Assist: Zion Mitchell
Score: 54-56

[00:08] Team_085 possession (Score: 54-56)
Malcolm Beal attempts a Layup. BLOCKED BY JA GEORGE! Ball is loose! Rebound secured by Zion Mitchell.

================================================================================
                              2ND QUARTER COMPLETE                              
================================================================================

2ND QUARTER SCORE: Team_085 24, Team_091 28

BOX SCORE:
================================================================================

Team_085
--------------------------------------------------------------------------------
Player                MIN  PTS  REB  AST  TO      FG   FG%      3P   3P%
--------------------------------------------------------------------------------
Collin Mobley          20    5    1    2   0   2/2   100.0     0/0   0.0
Stephen Bird           20    5    0    0   0   2/2   100.0     0/0   0.0
Larry Duncan           20    4    4    1   0   2/6    33.3     0/0   0.0
Magic Beal             20    3    0    1   0   1/2    50.0     0/0   0.0
Paul Wagner            22    3    4    0   0   1/1   100.0     0/0   0.0
Jordan Morant           4    3    0    0   0   1/1   100.0     0/0   0.0
Malcolm Beal            4    0    0    0   0   0/2     0.0     0/0   0.0
Jalen Leonard           2    0    1    0   0   0/0     0.0     0/0   0.0

TEAM: FG: 9/16 (56.2%), 3PT: 2/5 (40.0%), REB: 9 (5 off, 4 def), AST: 4, TO: 5
TEAM FOULS: 5 [Team_091 in BONUS]


Team_091
--------------------------------------------------------------------------------
Player                MIN  PTS  REB  AST  TO      FG   FG%      3P   3P%
--------------------------------------------------------------------------------
Kyrie Rozier           22   11    1    0   0   4/7    57.1     0/0   0.0
Kevin Simons           20    6    2    3   0   2/2   100.0     0/0   0.0
Rudy Bridges           22    3    2    1   0   1/1   100.0     0/0   0.0
D'Angelo Ingram        20    2    0    0   0   1/2    50.0     0/0   0.0
Isaiah Siakam          20    2    0    0   0   1/1   100.0     0/0   0.0
Tim Antetokounmpo       2    2    0    0   0   1/1   100.0     0/0   0.0
Karl Morant             2    2    0    0   0   1/1   100.0     0/0   0.0
Ja George               4    0    1    0   0   0/0     0.0     0/0   0.0
Zion Mitchell           4    0    3    1   0   0/1     0.0     0/0   0.0

TEAM: FG: 11/16 (68.8%), 3PT: 2/6 (33.3%), REB: 10 (3 off, 7 def), AST: 5, TO: 4
TEAM FOULS: 8 [Team_085 in BONUS]

================================================================================

================================================================================
                       3RD QUARTER - Team_085 vs Team_091                       
================================================================================

[12:00] Team_085 possession (Score: 54-56)
Paul Wagner drives to the basket... Paul Wagner throws a bad pass! Stolen by D'Angelo Ingram! TURNOVER! (live ball)

[11:45] Team_091 possession (Score: 54-56)
Kyrie Rozier throws a bad pass! Stolen by Magic Beal! TURNOVER! (live ball)

[11:36] Team_085 possession (Score: 54-56)
Paul Wagner drives to the basket... Paul Wagner loses control! Ball rolls out of bounds! TURNOVER! (dead ball)

[11:19] Team_091 possession (Score: 54-56)
Kyrie Rozier attempts a 3Pt. Contested by Magic Beal (4.1 feet, ZONE). Kyrie Rozier misses. Rebound secured by Larry Duncan.

[11:07] Team_085 possession (Score: 54-56)
Stephen Bird attempts a 3Pt. Contested by Kyrie Rozier (4.3 feet, ZONE). Stephen Bird misses. Rebound secured by Rudy Bridges.

[10:54] Team_091 possession (Score: 54-56)
Kyrie Rozier attempts a 3Pt. Contested by Magic Beal (4.1 feet, MAN). Kyrie Rozier misses. Rebound secured by Paul Wagner.

[10:40] Team_085 possession (Score: 54-56)
Paul Wagner drives and kicks out. Larry Duncan attempts a 3Pt. Contested by Rudy Bridges (4.3 feet, MAN). LARRY DUNCAN MAKES IT! Assist: Collin Mobley
Score: 57-56

[10:27] Team_091 possession (Score: 57-56)
D'Angelo Ingram attempts a 3Pt. Contested by Magic Beal (4.9 feet, ZONE). D'ANGELO INGRAM MAKES IT! Assist: Kevin Simons
Score: 57-59

[10:11] Team_085 possession (Score: 57-59)
Stephen Bird attempts a Midrange. Contested by D'Angelo Ingram (4.9 feet, ZONE). STEPHEN BIRD MAKES IT! Assist: Magic Beal
Score: 59-59

[09:57] Team_091 possession (Score: 59-59)
Rudy Bridges attempts a 3Pt. Contested by Magic Beal (4.1 feet, ZONE). RUDY BRIDGES MAKES IT! Assist: D'Angelo Ingram
Score: 59-62

[09:46] Team_085 possession (Score: 59-62)
Larry Duncan makes the Layup and draws the foul on Kevin Simons! And-1! Larry Duncan to the line for 1. [Team fouls: 1] (Kevin Simons: 1 personal fouls)   FT 1/1: GOOD Larry Duncan makes 1/1 from the line.
Score: 62-62

[09:30] Team_091 possession (Score: 62-62)
Isaiah Siakam drives, Paul Wagner stays with him. Isaiah Siakam attempts a Dunk. Contested by Paul Wagner (3.8 feet, ZONE). ISAIAH SIAKAM MAKES IT! Assist: Rudy Bridges
Score: 62-64

[09:18] Team_085 possession (Score: 62-64)
FOUL! Reach-in foul on Kevin Simons during the drive. [Team fouls: 2] No free throws, side out. (Kevin Simons: 2 personal fouls)

[09:00] Team_085 possession (Score: 62-64)
Magic Beal makes the Layup and draws the foul on Kyrie Rozier! And-1! Magic Beal to the line for 1. [Team fouls: 3] (Kyrie Rozier: 1 personal fouls)   FT 1/1: GOOD Magic Beal makes 1/1 from the line.
Score: 65-64

[08:42] Team_091 possession (Score: 65-64)
Rudy Bridges drives, Larry Duncan stays with him. Rudy Bridges attempts a Dunk. Contested by Larry Duncan (3.1 feet, MAN). RUDY BRIDGES MAKES IT!
Score: 65-66

[08:24] Team_085 possession (Score: 65-66)
Magic Beal attempts a Midrange. Contested by Kyrie Rozier (4.5 feet, MAN). Magic Beal misses. Offensive rebound by Larry Duncan! Larry Duncan kicks it out.

[08:09] Team_085 possession (Score: 65-66)
FOUL! Reach-in foul on Kevin Simons during the drive. [Team fouls: 4] No free throws, side out. (Kevin Simons: 3 personal fouls)

[07:56] Team_085 possession (Score: 65-66)
Paul Wagner attempts a Midrange. Contested by D'Angelo Ingram (4.9 feet, MAN). Paul Wagner misses. Rebound secured by Kevin Simons.

[07:46] Team_091 possession (Score: 65-66)
D'Angelo Ingram drives, picks up Paul Wagner. Help arrives from Magic Beal! D'Angelo Ingram attempts a Layup. Contested by Magic Beal (4.5 feet, MAN). D'ANGELO INGRAM MAKES IT!
Score: 65-68

[07:37] Team_085 possession (Score: 65-68)
Collin Mobley drives to the basket... Collin Mobley throws a bad pass out of bounds! TURNOVER! (dead ball)

[07:22] Team_091 possession (Score: 65-68)
Kevin Simons attempts a Midrange. Contested by Paul Wagner (3.9 feet, ZONE). Kevin Simons misses. Rebound secured by Larry Duncan.

[07:07] Team_085 possession (Score: 65-68)
Stephen Bird attempts a Midrange. Contested by Kevin Simons (3.8 feet, ZONE). Stephen Bird misses. FOUL! Loose ball foul on Rudy Bridges during the rebound battle. [IN THE BONUS! 5 team fouls] Paul Wagner to the line for 2 free throws. (Rudy Bridges: 1 personal fouls)   FT 1/2: MISS   FT 2/2: GOOD Paul Wagner makes 1/2 from the line.
Score: 66-68

[06:54] Team_091 possession (Score: 66-68)
Kyrie Rozier loses the ball! Stripped by Magic Beal! TURNOVER! (live ball)

[06:36] Team_085 possession (Score: 66-68)
Stephen Bird attempts a 3Pt. Contested by Kyrie Rozier (4.3 feet, ZONE). Stephen Bird misses. Rebound secured by Kyrie Rozier.

[06:24] Team_091 possession (Score: 66-68)
Kevin Simons drives and kicks out. FOUL! Shooting foul on Paul Wagner. D'Angelo Ingram to the line for 3 free throws. [Team fouls: 1] (Paul Wagner: 1 personal fouls)   FT 1/3: GOOD   FT 2/3: MISS   FT 3/3: GOOD D'Angelo Ingram makes 2/3 from the line.
Score: 66-70

[06:13] Team_085 possession (Score: 66-70)
Paul Wagner attempts a Midrange. Contested by D'Angelo Ingram (4.9 feet, MAN). PAUL WAGNER MAKES IT!
Score: 68-70

[06:00] Team_091 possession (Score: 68-70)
D'Angelo Ingram drives to the basket... D'Angelo Ingram throws a bad pass out of bounds! TURNOVER! (dead ball)

[05:43] Team_085 possession (Score: 68-70)
Paul Wagner attempts a Midrange. Contested by D'Angelo Ingram (4.9 feet, MAN). PAUL WAGNER MAKES IT!
Score: 70-70

[05:29] Team_091 possession (Score: 70-70)
Isaiah Siakam drives to the basket... Isaiah Siakam loses control! Ball rolls out of bounds! TURNOVER! (dead ball)

[05:16] Team_085 possession (Score: 70-70)
Magic Beal throws a bad pass out of bounds! TURNOVER! (dead ball)

[05:02] Team_091 possession (Score: 70-70)
Rudy Bridges attempts a Layup. Contested by Paul Wagner (3.6 feet, ZONE). Rudy Bridges misses. Rebound secured by Paul Wagner.

[04:48] Team_085 possession (Score: 70-70)
Paul Wagner drives to the basket... Paul Wagner loses control! Ball rolls out of bounds! TURNOVER! (dead ball)

[04:34] Team_091 possession (Score: 70-70)
Kyrie Rozier attempts a Layup. Contested by Paul Wagner (3.7 feet, ZONE). Kyrie Rozier misses. Rebound secured by Larry Duncan.

[04:19] Team_085 possession (Score: 70-70)
Magic Beal attempts a Midrange. BLOCKED BY KYRIE ROZIER! Ball is loose! Offensive rebound by Larry Duncan! Larry Duncan kicks it out.

[04:01] Team_085 possession (Score: 70-70)
Paul Wagner attempts a Layup. Contested by D'Angelo Ingram (5.1 feet, MAN). PAUL WAGNER MAKES IT!
Score: 72-70

[03:44] Team_091 possession (Score: 72-70)
Kevin Simons attempts a 3Pt. Contested by Paul Wagner (4.0 feet, ZONE). Kevin Simons misses. Rebound secured by Paul Wagner.

[03:30] Team_085 possession (Score: 72-70)
Paul Wagner drives, D'Angelo Ingram stays with him. Paul Wagner attempts a Layup. Contested by D'Angelo Ingram (5.1 feet, MAN). PAUL WAGNER MAKES IT! Assist: Stephen Bird
Score: 74-70

[03:18] Team_091 possession (Score: 74-70)
Isaiah Siakam drives and kicks out. Isaiah Siakam attempts a Midrange. Contested by Larry Duncan (3.2 feet, ZONE). Isaiah Siakam misses. Rebound secured by Collin Mobley.

[03:08] Team_085 possession (Score: 74-70)
Collin Mobley attempts a Layup. Contested by Kevin Simons (3.7 feet, ZONE). Collin Mobley misses. Rebound secured by Rudy Bridges.

[02:54] Team_091 possession (Score: 74-70)
Kevin Simons attempts a Midrange. Contested by Magic Beal (4.6 feet, ZONE). KEVIN SIMONS MAKES IT!
Score: 74-72

[02:38] Team_085 possession (Score: 74-72)
Magic Beal attempts a Midrange. Contested by Kyrie Rozier (4.7 feet, MAN). Magic Beal misses. Rebound secured by Kevin Simons.

[02:24] Team_091 possession (Score: 74-72)
FOUL! Offensive foul on Kevin Simons! Collin Mobley drew the charge! [Team fouls: 6] (Kevin Simons: 4 personal fouls) TURNOVER! (dead ball)

[02:13] Team_085 possession (Score: 74-72)
Collin Mobley makes the Dunk and draws the foul on Kevin Simons! And-1! Collin Mobley to the line for 1. [BONUS: 7 team fouls] (Kevin Simons: 5 personal fouls)   FT 1/1: GOOD Collin Mobley makes 1/1 from the line.
Score: 77-72

[02:01] Team_091 possession (Score: 77-72)
Isaiah Siakam makes the Layup and draws the foul on Larry Duncan! And-1! Isaiah Siakam to the line for 1. [Team fouls: 2] (Larry Duncan: 1 personal fouls)   FT 1/1: GOOD Isaiah Siakam makes 1/1 from the line.
Score: 77-75

[01:50] Team_085 possession (Score: 77-75)
Collin Mobley attempts a Midrange. Contested by Kevin Simons (3.9 feet, MAN). Collin Mobley misses. Rebound secured by Kevin Simons.

[01:34] Team_091 possession (Score: 77-75)
Isaiah Siakam attempts a Midrange. Contested by Stephen Bird (4.2 feet, MAN). ISAIAH SIAKAM MAKES IT! Assist: D'Angelo Ingram
Score: 77-77

[01:16] Team_085 possession (Score: 77-77)
Stephen Bird attempts a Midrange. Contested by Kyrie Rozier (4.6 feet, ZONE). Stephen Bird misses. Rebound secured by Rudy Bridges.

[01:01] Team_091 possession (Score: 77-77)
D'Angelo Ingram attempts a Midrange. Contested by Paul Wagner (4.8 feet, ZONE). D'Angelo Ingram misses. Offensive rebound by Kevin Simons! Kevin Simons puts it back in!
Score: 77-79

[00:46] Team_085 possession (Score: 77-79)
FOUL! Shooting foul on Kyrie Rozier. Collin Mobley to the line for 2 free throws. [BONUS: 8 team fouls] (Kyrie Rozier: 2 personal fouls)   FT 1/2: GOOD   FT 2/2: GOOD Collin Mobley makes 2/2 from the line.
Score: 79-79

[00:33] Team_091 possession (Score: 79-79)
Rudy Bridges attempts a 3Pt. Contested by Magic Beal (4.6 feet, ZONE). Rudy Bridges misses. Rebound secured by Larry Duncan.

[00:18] Team_085 possession (Score: 79-79)
Collin Mobley attempts a Layup. Contested by Kevin Simons (4.1 feet, MAN). COLLIN MOBLEY MAKES IT!
Score: 81-79

[00:07] Team_091 possession (Score: 81-79)
Rudy Bridges drives to the basket... Rudy Bridges commits a violation (traveling/carry)! TURNOVER! (dead ball)

[00:07] Substitution (Team_085): Magic Beal OUT → Khris Brogdon IN (stamina_rule2)

[00:07] Substitution (Team_085): Stephen Bird OUT → Jordan Morant IN (stamina_rule2)

[00:07] Substitution (Team_085): Larry Duncan OUT → Giannis Johnson IN (stamina_rule2)

[00:07] Substitution (Team_085): Paul Wagner OUT → Jalen Leonard IN (stamina_rule2)

[00:07] Substitution (Team_085): Collin Mobley OUT → Malcolm Beal IN (stamina_rule2)

[00:07] Substitution (Team_091): Kyrie Rozier OUT → Karl Morant IN (stamina_rule2)

[00:07] Substitution (Team_091): Isaiah Siakam OUT → Julius Barnes IN (stamina_rule2)

[00:07] Substitution (Team_091): Rudy Bridges OUT → Tim Antetokounmpo IN (stamina_rule2)

[00:07] Substitution (Team_091): D'Angelo Ingram OUT → Zion Mitchell IN (stamina_rule2)

[00:07] Substitution (Team_091): Kevin Simons OUT → Ja George IN (stamina_rule2)

================================================================================
                              3RD QUARTER COMPLETE                              
================================================================================

3RD QUARTER SCORE: Team_085 27, Team_091 23

BOX SCORE:
================================================================================

Team_085
--------------------------------------------------------------------------------
Player                MIN  PTS  REB  AST  TO      FG   FG%      3P   3P%
--------------------------------------------------------------------------------
Paul Wagner            34    9    3    0   0   5/6    83.3     0/0   0.0
Collin Mobley          32    7    1    1   0   3/5    60.0     0/0   0.0
Larry Duncan           32    6    6    0   0   2/2   100.0     0/0   0.0
Magic Beal             32    3    0    1   0   1/2    50.0     0/0   0.0
Stephen Bird           32    2    0    1   0   1/4    25.0     0/0   0.0

TEAM: FG: 12/19 (63.2%), 3PT: 0/2 (0.0%), REB: 10 (2 off, 8 def), AST: 3, TO: 5
TEAM FOULS: 2


Team_091
--------------------------------------------------------------------------------
Player                MIN  PTS  REB  AST  TO      FG   FG%      3P   3P%
--------------------------------------------------------------------------------
D'Angelo Ingram        32    7    0    2   0   3/3   100.0     0/0   0.0
Isaiah Siakam          32    7    0    0   0   3/4    75.0     0/0   0.0
Rudy Bridges           34    5    3    1   0   2/4    50.0     0/0   0.0
Kevin Simons           32    4    4    1   0   2/4    50.0     0/0   0.0
Kyrie Rozier           34    0    1    0   0   0/3     0.0     0/0   0.0

TEAM: FG: 10/18 (55.6%), 3PT: 2/6 (33.3%), REB: 8 (1 off, 7 def), AST: 4, TO: 6
TEAM FOULS: 8 [Team_085 in BONUS]

================================================================================

================================================================================
                       4TH QUARTER - Team_085 vs Team_091                       
================================================================================

[12:00] Team_085 possession (Score: 81-79)
Collin Mobley drives, Kevin Simons stays with him. Collin Mobley attempts a Dunk. Contested by Kevin Simons (3.9 feet, ZONE). COLLIN MOBLEY MAKES IT! Assist: Paul Wagner
Score: 83-79

[11:43] Team_091 possession (Score: 83-79)
Kyrie Rozier makes the Midrange and draws the foul on Stephen Bird! And-1! Kyrie Rozier to the line for 1. [Team fouls: 1] (Stephen Bird: 1 personal fouls)   FT 1/1: GOOD Kyrie Rozier makes 1/1 from the line.
Score: 83-82

[11:27] Team_085 possession (Score: 83-82)
Collin Mobley attempts a Layup. BLOCKED BY KEVIN SIMONS! Ball is loose! Rebound secured by Rudy Bridges.

[11:14] Team_091 possession (Score: 83-82)
FOUL! Shooting foul on Magic Beal. Rudy Bridges to the line for 2 free throws. [Team fouls: 2] (Magic Beal: 1 personal fouls)   FT 1/2: GOOD   FT 2/2: GOOD Rudy Bridges makes 2/2 from the line.
Score: 83-84

[11:02] Team_085 possession (Score: 83-84)
Stephen Bird attempts a 3Pt. Wide open! Isaiah Siakam is 6.3 feet away. [MAN] Stephen Bird misses. Rebound secured by Rudy Bridges.

[10:53] Team_091 possession (Score: 83-84)
D'Angelo Ingram drives and kicks out. Kyrie Rozier attempts a 3Pt. Contested by Magic Beal (4.5 feet, MAN). Kyrie Rozier misses. Rebound secured by Collin Mobley.

[10:38] Team_085 possession (Score: 83-84)
FOUL! Reach-in foul on Kevin Simons during the drive. [Team fouls: 1] No free throws, side out. (Kevin Simons: 1 personal fouls)

[10:26] Team_085 possession (Score: 83-84)
Collin Mobley attempts a Midrange. Wide open! Isaiah Siakam is 6.0 feet away. [ZONE] COLLIN MOBLEY MAKES IT! Assist: Stephen Bird
Score: 85-84

[10:10] Team_091 possession (Score: 85-84)
D'Angelo Ingram attempts a Layup. BLOCKED BY PAUL WAGNER! Ball is loose! Rebound secured by Collin Mobley.

[09:55] Team_085 possession (Score: 85-84)
Larry Duncan attempts a 3Pt. Contested by Kyrie Rozier (4.9 feet, ZONE). LARRY DUNCAN MAKES IT! Assist: Paul Wagner
Score: 88-84

[09:38] Team_091 possession (Score: 88-84)
Rudy Bridges makes the Midrange and draws the foul on Stephen Bird! And-1! Rudy Bridges to the line for 1. [Team fouls: 3] (Stephen Bird: 2 personal fouls)   FT 1/1: GOOD Rudy Bridges makes 1/1 from the line.
Score: 88-87

[09:27] Team_085 possession (Score: 88-87)
FOUL! Shooting foul on Kevin Simons. Collin Mobley to the line for 2 free throws. [Team fouls: 2] (Kevin Simons: 2 personal fouls)   FT 1/2: GOOD   FT 2/2: MISS Collin Mobley makes 1/2 from the line. Rebound secured by Rudy Bridges.
Score: 89-87

[09:18] Team_091 possession (Score: 89-87)
Isaiah Siakam throws a bad pass out of bounds! TURNOVER! (dead ball)

[09:18] Substitution (Team_085): Magic Beal OUT → Khris Brogdon IN (stamina_rule2)

[09:18] Substitution (Team_085): Stephen Bird OUT → Jordan Morant IN (stamina_rule2)

[09:18] Substitution (Team_085): Larry Duncan OUT → Giannis Johnson IN (stamina_rule2)

[09:18] Substitution (Team_085): Paul Wagner OUT → Jalen Leonard IN (stamina_rule2)

[09:18] Substitution (Team_085): Collin Mobley OUT → Malcolm Beal IN (stamina_rule2)

[09:18] Substitution (Team_091): Kyrie Rozier OUT → Karl Morant IN (stamina_rule2)

[09:18] Substitution (Team_091): Isaiah Siakam OUT → Julius Barnes IN (stamina_rule2)

[09:18] Substitution (Team_091): Rudy Bridges OUT → Tim Antetokounmpo IN (stamina_rule2)

[09:18] Substitution (Team_091): D'Angelo Ingram OUT → Zion Mitchell IN (stamina_rule2)

[09:18] Substitution (Team_091): Kevin Simons OUT → Ja George IN (stamina_rule2)

[09:03] Team_085 possession (Score: 89-87)
Khris Brogdon attempts a Midrange. Contested by Karl Morant (4.7 feet, MAN). Khris Brogdon misses. Rebound secured by Tim Antetokounmpo.

[08:49] Team_091 possession (Score: 89-87)
Julius Barnes attempts a 3Pt. Contested by Jordan Morant (3.5 feet, MAN). Julius Barnes misses. Rebound secured by Jalen Leonard.

[08:33] Team_085 possession (Score: 89-87)
Khris Brogdon drives and kicks out. Jordan Morant attempts a Midrange. Contested by Julius Barnes (4.9 feet, MAN). Jordan Morant misses. Rebound secured by Tim Antetokounmpo.

[08:19] Team_091 possession (Score: 89-87)
Zion Mitchell attempts a 3Pt. Contested by Jordan Morant (3.7 feet, ZONE). ZION MITCHELL MAKES IT! Assist: Karl Morant
Score: 89-90

[08:05] Team_085 possession (Score: 89-90)
Khris Brogdon drives to the basket... Khris Brogdon loses the ball! Stripped by Zion Mitchell! TURNOVER! (live ball)

[07:55] Team_091 possession (Score: 89-90)
Karl Morant drives and kicks out. Tim Antetokounmpo attempts a 3Pt. Contested by Giannis Johnson (5.8 feet, MAN). Tim Antetokounmpo misses. Rebound secured by Malcolm Beal.

[07:35] Team_085 possession (Score: 89-90)
Jordan Morant drives, picks up Julius Barnes. Help arrives from Tim Antetokounmpo! Jordan Morant attempts a Dunk. Contested by Tim Antetokounmpo (5.1 feet, MAN). JORDAN MORANT MAKES IT! Assist: Giannis Johnson
Score: 91-90

[07:22] Team_091 possession (Score: 91-90)
Tim Antetokounmpo drives, Malcolm Beal stays with him. Tim Antetokounmpo attempts a Layup. Contested by Malcolm Beal (4.5 feet, ZONE). TIM ANTETOKOUNMPO MAKES IT! Assist: Zion Mitchell
Score: 91-92

[07:05] Team_085 possession (Score: 91-92)
Jalen Leonard drives and kicks out. Khris Brogdon attempts a 3Pt. Contested by Karl Morant (4.9 feet, MAN). Khris Brogdon misses. Rebound secured by Tim Antetokounmpo.

[06:51] Team_091 possession (Score: 91-92)
Zion Mitchell drives, Malcolm Beal stays with him. Zion Mitchell attempts a Layup. Contested by Malcolm Beal (4.5 feet, ZONE). ZION MITCHELL MAKES IT! Assist: Tim Antetokounmpo
Score: 91-94

[06:38] Team_085 possession (Score: 91-94)
Malcolm Beal drives and kicks out. Khris Brogdon attempts a 3Pt. Contested by Karl Morant (4.9 feet, ZONE). KHRIS BROGDON MAKES IT! Assist: Giannis Johnson
Score: 94-94

[06:21] Team_091 possession (Score: 94-94)
Ja George attempts a Layup. Contested by Malcolm Beal (4.4 feet, MAN). JA GEORGE MAKES IT! Assist: Tim Antetokounmpo
Score: 94-96

[06:08] Team_085 possession (Score: 94-96)
Khris Brogdon attempts a 3Pt. Contested by Karl Morant (4.7 feet, MAN). Khris Brogdon misses. Rebound secured by Ja George.

[05:55] Team_091 possession (Score: 94-96)
Julius Barnes attempts a Midrange. Contested by Jalen Leonard (4.1 feet, ZONE). JULIUS BARNES MAKES IT!
Score: 94-98

[05:45] Team_085 possession (Score: 94-98)
Giannis Johnson attempts a Midrange. Contested by Tim Antetokounmpo (5.4 feet, MAN). Giannis Johnson misses. Offensive rebound by Jalen Leonard! Jalen Leonard kicks it out.

[05:28] Team_085 possession (Score: 94-98)
Khris Brogdon attempts a Midrange. Contested by Tim Antetokounmpo (5.3 feet, ZONE). KHRIS BROGDON MAKES IT! Assist: Jalen Leonard
Score: 96-98

[05:14] Team_091 possession (Score: 96-98)
Tim Antetokounmpo attempts a 3Pt. Contested by Jordan Morant (3.6 feet, ZONE). Tim Antetokounmpo misses. Rebound secured by Malcolm Beal.

[04:58] Team_085 possession (Score: 96-98)
FOUL! Reach-in foul on Zion Mitchell during the drive. [Team fouls: 3] No free throws, side out. (Zion Mitchell: 1 personal fouls)

[04:39] Team_085 possession (Score: 96-98)
Jordan Morant attempts a 3Pt. Contested by Julius Barnes (5.1 feet, MAN). Jordan Morant misses. Rebound secured by Tim Antetokounmpo.

[04:24] Team_091 possession (Score: 96-98)
Julius Barnes attempts a 3Pt. Contested by Jordan Morant (3.5 feet, ZONE). Julius Barnes misses. Offensive rebound by Zion Mitchell! Zion Mitchell kicks it out.

[04:08] Team_091 possession (Score: 96-98)
Tim Antetokounmpo drives and kicks out. Karl Morant attempts a 3Pt. Contested by Khris Brogdon (5.5 feet, MAN). Karl Morant misses. Rebound secured by Malcolm Beal.

[03:48] Team_085 possession (Score: 96-98)
Jordan Morant attempts a Layup. BLOCKED BY JULIUS BARNES! Ball is loose! Rebound secured by Ja George.

[03:33] Team_091 possession (Score: 96-98)
Zion Mitchell attempts a 3Pt. Contested by Jalen Leonard (4.3 feet, MAN). Zion Mitchell misses. Rebound secured by Giannis Johnson.

[03:19] Team_085 possession (Score: 96-98)
Jalen Leonard attempts a 3Pt. Contested by Zion Mitchell (5.2 feet, MAN). JALEN LEONARD MAKES IT! Assist: Malcolm Beal
Score: 99-98

[03:01] Team_091 possession (Score: 99-98)
Tim Antetokounmpo attempts a Midrange. Contested by Giannis Johnson (6.0 feet, MAN). Tim Antetokounmpo misses. Offensive rebound by Zion Mitchell! Zion Mitchell kicks it out.

[02:48] Team_091 possession (Score: 99-98)
FOUL! Shooting foul on Jalen Leonard. Karl Morant to the line for 2 free throws. [Team fouls: 4] (Jalen Leonard: 1 personal fouls)   FT 1/2: GOOD   FT 2/2: MISS Karl Morant makes 1/2 from the line. Rebound secured by Giannis Johnson.
Score: 99-99

[02:33] Team_085 possession (Score: 99-99)
Jordan Morant attempts a 3Pt. Contested by Karl Morant (5.0 feet, ZONE). JORDAN MORANT MAKES IT!
Score: 102-99

[02:21] Team_091 possession (Score: 102-99)
Julius Barnes attempts a 3Pt. Contested by Jordan Morant (3.5 feet, MAN). JULIUS BARNES MAKES IT! Assist: Karl Morant
Score: 102-102

[02:05] Team_085 possession (Score: 102-102)
Giannis Johnson attempts a 3Pt. Contested by Karl Morant (4.9 feet, ZONE). Giannis Johnson misses. Offensive rebound by Malcolm Beal! Malcolm Beal kicks it out.

[01:52] Team_085 possession (Score: 102-102)
Jalen Leonard drives and kicks out. Jordan Morant attempts a 3Pt. Contested by Karl Morant (4.9 feet, ZONE). Jordan Morant misses. Rebound secured by Zion Mitchell.

[01:40] Team_091 possession (Score: 102-102)
Ja George attempts a Midrange. Contested by Malcolm Beal (4.5 feet, MAN). JA GEORGE MAKES IT! Assist: Tim Antetokounmpo
Score: 102-104

[01:23] Team_085 possession (Score: 102-104)
Jordan Morant attempts a 3Pt. Contested by Karl Morant (5.1 feet, ZONE). Jordan Morant misses. Rebound secured by Tim Antetokounmpo.

[01:06] Team_091 possession (Score: 102-104)
FOUL! Shooting foul on Jalen Leonard. Julius Barnes to the line for 2 free throws. [BONUS: 5 team fouls] (Jalen Leonard: 2 personal fouls)   FT 1/2: GOOD   FT 2/2: MISS Julius Barnes makes 1/2 from the line. Rebound secured by Malcolm Beal.
Score: 102-105

[00:48] Team_085 possession (Score: 102-105)
Giannis Johnson attempts a 3Pt. Contested by Karl Morant (5.0 feet, ZONE). Giannis Johnson misses. Rebound secured by Zion Mitchell.

[00:33] Team_091 possession (Score: 102-105)
Tim Antetokounmpo attempts a 3Pt. Contested by Jordan Morant (3.8 feet, ZONE). Tim Antetokounmpo misses. Rebound secured by Jalen Leonard.

[00:21] Team_085 possession (Score: 102-105)
Giannis Johnson attempts a 3Pt. Contested by Tim Antetokounmpo (5.6 feet, MAN). GIANNIS JOHNSON MAKES IT! Assist: Jordan Morant
Score: 105-105

[00:04] Team_091 possession (Score: 105-105)
Ja George drives, Malcolm Beal stays with him. Ja George attempts a Dunk. Contested by Malcolm Beal (4.6 feet, ZONE). Ja George misses. Rebound secured by Malcolm Beal.

================================================================================
                              4TH QUARTER COMPLETE                              
================================================================================

4TH QUARTER SCORE: Team_085 24, Team_091 26

BOX SCORE:
================================================================================

Team_085
--------------------------------------------------------------------------------
Player                MIN  PTS  REB  AST  TO      FG   FG%      3P   3P%
--------------------------------------------------------------------------------
Khris Brogdon          14    5    0    0   0   2/5    40.0     0/0   0.0
Jordan Morant          14    5    0    1   0   2/5    40.0     0/0   0.0
Collin Mobley          35    4    2    0   0   2/4    50.0     0/0   0.0
Larry Duncan           35    3    0    0   0   1/1   100.0     0/0   0.0
Jalen Leonard          12    3    3    1   0   1/3    33.3     0/0   0.0
Giannis Johnson        14    3    2    2   0   1/2    50.0     0/0   0.0
Paul Wagner            37    0    0    2   0   0/0     0.0     0/0   0.0
Stephen Bird           35    0    0    1   0   0/1     0.0     0/0   0.0
Malcolm Beal           14    0    6    1   0   0/0     0.0     0/0   0.0

TEAM: FG: 9/21 (42.9%), 3PT: 4/9 (44.4%), REB: 13 (2 off, 11 def), AST: 8, TO: 1
TEAM FOULS: 5 [Team_091 in BONUS]


Team_091
--------------------------------------------------------------------------------
Player                MIN  PTS  REB  AST  TO      FG   FG%      3P   3P%
--------------------------------------------------------------------------------
Rudy Bridges           37    5    3    0   0   2/2   100.0     0/0   0.0
Julius Barnes          14    5    0    0   0   2/4    50.0     0/0   0.0
Zion Mitchell          14    5    4    1   0   2/3    66.7     0/0   0.0
Ja George              14    4    2    0   0   2/3    66.7     0/0   0.0
Kyrie Rozier           37    3    0    0   0   1/1   100.0     0/0   0.0
Tim Antetokounmpo      12    2    5    3   0   1/4    25.0     0/0   0.0
D'Angelo Ingram        35    0    0    0   0   0/2     0.0     0/0   0.0
Karl Morant            12    0    0    2   0   0/2     0.0     0/0   0.0

TEAM: FG: 10/21 (47.6%), 3PT: 2/6 (33.3%), REB: 14 (2 off, 12 def), AST: 6, TO: 1
TEAM FOULS: 3

================================================================================

================================================================================
                               FULL GAME COMPLETE                               
================================================================================

FINAL SCORE: Team_085 105, Team_091 105

SCORING BY QUARTER:
--------------------------------------------------------------------------------
Team                     Q1     Q2     Q3     Q4    FINAL
--------------------------------------------------------------------------------
Team_085                 30     24     27     24      105
Team_091                 28     28     23     26      105
--------------------------------------------------------------------------------

FULL GAME BOX SCORE:
================================================================================

Team_085
--------------------------------------------------------------------------------
Player                MIN  PTS  REB  AST  TO      FG   FG%      3P   3P%      FT STL BLK
--------------------------------------------------------------------------------
Paul Wagner            37   17   11    2   4   7/9    77.8   1/1   100.0   4/5     2   1
Magic Beal             35   14    0    3   3   5/8    62.5   1/2    50.0   4/5     2   0
Stephen Bird           35   11    0    3   1   7/12   58.3   0/3     0.0   1/1     0   0
Larry Duncan           35   17   16    2   2   5/11   45.5   1/6    16.7   3/3     0   0
Collin Mobley          35   23    7    4   2   9/13   69.2   1/1   100.0   7/8     0   0
Khris Brogdon          14    5    0    1   0   1/4    25.0   0/1     0.0   0/0     0   0
Jordan Morant          14    8    0    1   1   3/6    50.0   1/3    33.3   1/1     0   0
Giannis Johnson        14    3    2    2   1   1/2    50.0   1/2    50.0   0/0     0   0
Malcolm Beal           14    2    7    1   1   2/5    40.0   0/0     0.0   0/0     0   0
Jalen Leonard          12    3    4    1   0   1/3    33.3   1/1   100.0   0/0     0   0

TEAM: FG: 43/75 (57.3%), 3PT: 7/20 (35.0%), REB: 46 (12 off, 34 def), AST: 20, TO: 15


Team_091
--------------------------------------------------------------------------------
Player                MIN  PTS  REB  AST  TO      FG   FG%      3P   3P%      FT STL BLK
--------------------------------------------------------------------------------
Kyrie Rozier           37   16    4    0   3   4/12   33.3   2/8    25.0  11/12    1   1
Rudy Bridges           37   19   10    2   1   8/12   66.7   2/3    66.7   5/5     1   0
Isaiah Siakam          35   13    0    0   2   7/10   70.0   0/1     0.0   1/2     1   0
D'Angelo Ingram        35   16    0    3   2   6/12   50.0   1/3    33.3   7/8     1   0
Kevin Simons           35   14    8    4   3   6/8    75.0   0/1     0.0   3/4     0   1
Julius Barnes          14    5    0    0   1   2/4    50.0   1/2    50.0   1/2     0   1
Zion Mitchell          14    8    7    2   0   3/5    60.0   1/2    50.0   1/1     1   0
Ja George              14    4    3    0   0   2/5    40.0   0/0     0.0   0/0     0   1
Karl Morant            12    2    0    2   0   1/3    33.3   0/0     0.0   1/2     0   0
Tim Antetokounmpo      12    4    5    3   0   2/5    40.0   0/2     0.0   0/0     0   0

TEAM: FG: 42/77 (54.5%), 3PT: 7/22 (31.8%), REB: 38 (6 off, 32 def), AST: 16, TO: 12

================================================================================
