================================================================================
                        FULL GAME - Team_023 vs Team_014                        
================================================================================

================================================================================
                       1ST QUARTER - Team_023 vs Team_014                       
================================================================================

[12:00] Team_023 possession (Score: 0-0)
Tim Bane drives, Ayo Murray stays with him. Tim Bane attempts a Dunk. Contested by Ayo Murray (5.2 feet, MAN). TIM BANE MAKES IT! Assist: Trae Ingram
Score: 2-0

[11:48] Team_014 possession (Score: 2-0)
DeMar Adebayo attempts a 3Pt. Contested by Kyle Paul (2.7 feet, ZONE). DEMAR ADEBAYO MAKES IT! Assist: Jordan Anunoby
Score: 2-3

[11:30] Team_023 possession (Score: 2-3)
Josh Morant attempts a Midrange. Contested by DeMar Adebayo (3.3 feet, MAN). JOSH MORANT MAKES IT! Assist: Kyle Paul
Score: 4-3

[11:13] Team_014 possession (Score: 4-3)
Lamelo Simmons attempts a Midrange. Contested by Kyle Paul (3.2 feet, MAN). Lamelo Simmons misses. Offensive rebound by DeMar Adebayo! DeMar Adebayo kicks it out.

[10:56] Team_014 possession (Score: 4-3)
Michael Cunningham attempts a 3Pt. Contested by Kyle Paul (2.6 feet, ZONE). MICHAEL CUNNINGHAM MAKES IT! Assist: Jordan Anunoby
Score: 4-6

[10:43] Team_023 possession (Score: 4-6)
Josh Morant attempts a 3Pt. Contested by DeMar Adebayo (3.3 feet, MAN). Josh Morant misses. FOUL! Loose ball foul on Ayo Murray during the rebound battle. [Team fouls: 1] No free throws, side out. (Ayo Murray: 1 personal fouls)

[10:30] Team_023 possession (Score: 4-6)
Trae Ingram makes the Layup and draws the foul on DeMar Adebayo! And-1! Trae Ingram to the line for 1. [Team fouls: 2] (DeMar Adebayo: 1 personal fouls)   FT 1/1: GOOD Trae Ingram makes 1/1 from the line.
Score: 7-6

[10:18] Team_014 possession (Score: 7-6)
Lamelo Simmons attempts a Midrange. Contested by Kyle Paul (3.2 feet, MAN). Lamelo Simmons misses. Rebound secured by Tim Bane.

[10:03] Team_023 possession (Score: 7-6)
Collin Ginobili attempts a 3Pt. Contested by Jordan Anunoby (5.2 feet, MAN). Collin Ginobili misses. Rebound secured by DeMar Adebayo.

[09:49] Team_014 possession (Score: 7-6)
Michael Cunningham makes the Layup and draws the foul on Tim Bane! And-1! Michael Cunningham to the line for 1. [Team fouls: 1] (Tim Bane: 1 personal fouls)   FT 1/1: GOOD Michael Cunningham makes 1/1 from the line.
Score: 7-9

[09:40] Team_023 possession (Score: 7-9)
Collin Ginobili attempts a 3Pt. Contested by Jordan Anunoby (5.2 feet, MAN). Collin Ginobili misses. Rebound secured by Ayo Murray.

[09:25] Team_014 possession (Score: 7-9)
Michael Cunningham attempts a 3Pt. Contested by Kyle Paul (2.6 feet, ZONE). Michael Cunningham misses. Rebound secured by Josh Morant.

[09:11] Team_023 possession (Score: 7-9)
Collin Ginobili attempts a 3Pt. Contested by Jordan Anunoby (5.2 feet, ZONE). Collin Ginobili misses. Offensive rebound by Josh Morant! Josh Morant kicks it out.

[08:56] Team_023 possession (Score: 7-9)
Collin Ginobili drives and kicks out. Tim Bane makes the 3Pt and draws the foul on Jordan Anunoby! And-1! Tim Bane to the line for 1. [Team fouls: 3] (Jordan Anunoby: 1 personal fouls)   FT 1/1: GOOD Tim Bane makes 1/1 from the line.
Score: 11-9

[08:46] Team_014 possession (Score: 11-9)
Lamelo Simmons loses the ball! Stripped by Kyle Paul! TURNOVER! (live ball)

[08:34] Team_023 possession (Score: 11-9)
FOUL! Reach-in foul on DeMar Adebayo during the drive. [Team fouls: 4] No free throws, side out. (DeMar Adebayo: 2 personal fouls)

[08:24] Team_023 possession (Score: 11-9)
FOUL! Reach-in foul on Michael Cunningham during the drive. [IN THE BONUS! 5 team fouls] Trae Ingram to the line for 2 free throws. (Michael Cunningham: 1 personal fouls)   FT 1/2: GOOD   FT 2/2: GOOD Trae Ingram makes 2/2 from the line.
Score: 13-9

[08:10] Team_014 possession (Score: 13-9)
DeMar Adebayo drives to the basket... DeMar Adebayo throws a bad pass out of bounds! TURNOVER! (dead ball)

[07:58] Team_023 possession (Score: 13-9)
Josh Morant attempts a Midrange. Contested by DeMar Adebayo (3.3 feet, MAN). Josh Morant misses. Rebound secured by DeMar Adebayo.

[07:45] Team_014 possession (Score: 13-9)
Ayo Murray attempts a Layup. Contested by Tim Bane (4.2 feet, ZONE). AYO MURRAY MAKES IT!
Score: 13-11

[07:31] Team_023 possession (Score: 13-11)
Collin Ginobili attempts a 3Pt. Contested by Jordan Anunoby (5.2 feet, MAN). Collin Ginobili misses. Offensive rebound by Josh Morant! Josh Morant kicks it out.

[07:17] Team_023 possession (Score: 13-11)
Kyle Paul attempts a 3Pt. Contested by Jordan Anunoby (5.0 feet, ZONE). Kyle Paul misses. Offensive rebound by Tim Bane! Tim Bane puts it back in!
Score: 15-11

[07:03] Team_014 possession (Score: 15-11)
Michael Cunningham attempts a 3Pt. Contested by Trae Ingram (3.2 feet, MAN). Michael Cunningham misses. Rebound secured by Josh Morant.

[06:49] Team_023 possession (Score: 15-11)
Trae Ingram throws a bad pass out of bounds! TURNOVER! (dead ball)

[06:37] Team_014 possession (Score: 15-11)
FOUL! Shooting foul on Tim Bane. Ayo Murray to the line for 2 free throws. [Team fouls: 2] (Tim Bane: 2 personal fouls)   FT 1/2: GOOD   FT 2/2: MISS Ayo Murray makes 1/2 from the line. FOUL! Loose ball foul on Tim Bane during the free throw rebound! [Team fouls: 3] No free throws, side out. (Tim Bane: 3 personal fouls)
Score: 15-12

[06:22] Team_014 possession (Score: 15-12)
Jordan Anunoby attempts a Layup. Contested by Tim Bane (4.1 feet, ZONE). JORDAN ANUNOBY MAKES IT! Assist: Ayo Murray
Score: 15-14

[06:08] Team_023 possession (Score: 15-14)
Tim Bane attempts a Midrange. Contested by Lamelo Simmons (4.4 feet, ZONE). Tim Bane misses. Rebound secured by DeMar Adebayo.

[05:54] Team_014 possession (Score: 15-14)
DeMar Adebayo attempts a 3Pt. Contested by Kyle Paul (2.8 feet, ZONE). DeMar Adebayo misses. Rebound secured by Tim Bane.

[05:39] Team_023 possession (Score: 15-14)
FOUL! Reach-in foul on Michael Cunningham during the drive. [IN THE BONUS! 6 team fouls] Trae Ingram to the line for 2 free throws. (Michael Cunningham: 2 personal fouls)   FT 1/2: MISS   FT 2/2: GOOD Trae Ingram makes 1/2 from the line.
Score: 16-14

[05:23] Team_014 possession (Score: 16-14)
Lamelo Simmons drives, Kyle Paul stays with him. Lamelo Simmons attempts a Layup. Contested by Kyle Paul (3.3 feet, MAN). LAMELO SIMMONS MAKES IT! Assist: Michael Cunningham
Score: 16-16

[05:07] Team_023 possession (Score: 16-16)
Collin Ginobili drives to the basket... Collin Ginobili commits a violation (traveling/carry)! TURNOVER! (dead ball)

[04:50] Team_014 possession (Score: 16-16)
Jordan Anunoby drives to the basket... Jordan Anunoby throws a bad pass! Stolen by Tim Bane! TURNOVER! (live ball)

[04:32] Team_023 possession (Score: 16-16)
Trae Ingram attempts a 3Pt. Contested by Michael Cunningham (4.0 feet, MAN). TRAE INGRAM MAKES IT! Assist: Tim Bane
Score: 19-16

[04:19] Team_014 possession (Score: 19-16)
Jordan Anunoby attempts a 3Pt. Contested by Kyle Paul (3.2 feet, ZONE). Jordan Anunoby misses. Rebound secured by Josh Morant.

[04:02] Team_023 possession (Score: 19-16)
Trae Ingram throws a bad pass! Stolen by Michael Cunningham! TURNOVER! (live ball)

[03:52] Team_014 possession (Score: 19-16)
Michael Cunningham attempts a 3Pt. Contested by Kyle Paul (2.8 feet, ZONE). Michael Cunningham misses. Rebound secured by Josh Morant.

[03:41] Team_023 possession (Score: 19-16)
FOUL! Reach-in foul on Ayo Murray during the drive. [IN THE BONUS! 7 team fouls] Tim Bane to the line for 2 free throws. (Ayo Murray: 2 personal fouls)   FT 1/2: MISS   FT 2/2: GOOD Tim Bane makes 1/2 from the line.
Score: 20-16

[03:23] Team_014 possession (Score: 20-16)
DeMar Adebayo drives to the basket... FOUL! Offensive foul on DeMar Adebayo! Tim Bane drew the charge! [Team fouls: 8] (DeMar Adebayo: 3 personal fouls) TURNOVER! (dead ball)

[03:06] Team_023 possession (Score: 20-16)
Kyle Paul attempts a 3Pt. Contested by Jordan Anunoby (5.2 feet, ZONE). Kyle Paul misses. Rebound secured by DeMar Adebayo.

[02:52] Team_014 possession (Score: 20-16)
Lamelo Simmons attempts a Layup. Contested by Kyle Paul (3.5 feet, MAN). Lamelo Simmons misses. Rebound secured by Tim Bane.

[02:41] Team_023 possession (Score: 20-16)
FOUL! Shooting foul on DeMar Adebayo. Tim Bane to the line for 2 free throws. [BONUS: 9 team fouls] (DeMar Adebayo: 4 personal fouls)   FT 1/2: GOOD   FT 2/2: GOOD Tim Bane makes 2/2 from the line.
Score: 22-16

[02:29] Team_014 possession (Score: 22-16)
Ayo Murray attempts a Layup. BLOCKED BY TIM BANE! Ball deflects out of bounds off Ayo Murray.

[02:14] Team_023 possession (Score: 22-16)
Josh Morant drives and kicks out. Josh Morant attempts a 3Pt. Contested by Jordan Anunoby (5.0 feet, ZONE). Josh Morant misses. Rebound secured by Michael Cunningham.

[02:03] Team_014 possession (Score: 22-16)
Lamelo Simmons drives, Tim Bane stays with him. Lamelo Simmons attempts a Dunk. Contested by Tim Bane (4.6 feet, ZONE). LAMELO SIMMONS MAKES IT! Assist: Ayo Murray
Score: 22-18

[01:50] Team_023 possession (Score: 22-18)
Josh Morant attempts a 3Pt. Contested by DeMar Adebayo (3.7 feet, MAN). Josh Morant misses. Rebound secured by Michael Cunningham.

[01:36] Team_014 possession (Score: 22-18)
Lamelo Simmons drives, Kyle Paul stays with him. Lamelo Simmons attempts a Dunk. Contested by Kyle Paul (3.7 feet, MAN). Lamelo Simmons misses. Offensive rebound by DeMar Adebayo! DeMar Adebayo kicks it out.

[01:22] Team_014 possession (Score: 22-18)
Ayo Murray attempts a 3Pt. Contested by Kyle Paul (3.7 feet, ZONE). Ayo Murray misses. Rebound secured by Tim Bane.

[01:05] Team_023 possession (Score: 22-18)
FOUL! Shooting foul on Jordan Anunoby. Tim Bane to the line for 3 free throws. [BONUS: 10 team fouls] (Jordan Anunoby: 2 personal fouls)   FT 1/3: MISS   FT 2/3: GOOD   FT 3/3: GOOD Tim Bane makes 2/3 from the line.
Score: 24-18

[00:56] Team_014 possession (Score: 24-18)
Michael Cunningham attempts a 3Pt. Contested by Trae Ingram (3.7 feet, MAN). MICHAEL CUNNINGHAM MAKES IT! Assist: Jordan Anunoby
Score: 24-21

[00:38] Team_023 possession (Score: 24-21)
Trae Ingram drives to the basket... Trae Ingram throws a bad pass! Stolen by Michael Cunningham! TURNOVER! (live ball)

[00:24] Team_014 possession (Score: 24-21)
Lamelo Simmons attempts a Layup. Contested by Tim Bane (4.8 feet, ZONE). Lamelo Simmons misses. Rebound secured by Tim Bane.

[00:12] Team_023 possession (Score: 24-21)
FOUL! Shooting foul on Michael Cunningham. Trae Ingram to the line for 2 free throws. [BONUS: 11 team fouls] (Michael Cunningham: 3 personal fouls)   FT 1/2: GOOD   FT 2/2: GOOD Trae Ingram makes 2/2 from the line.
Score: 26-21

================================================================================
                              1ST QUARTER COMPLETE                              
================================================================================

1ST QUARTER SCORE: Team_023 26, Team_014 21

BOX SCORE:
================================================================================

Team_023
--------------------------------------------------------------------------------
Player                MIN  PTS  REB  AST  TO      FG   FG%      3P   3P%
--------------------------------------------------------------------------------
Tim Bane               12   13    7    1   0   6/7    85.7     0/0   0.0
Trae Ingram            12   11    0    1   0   5/5   100.0     0/0   0.0
Josh Morant            12    2    6    0   0   1/4    25.0     0/0   0.0
Kyle Paul              12    0    0    1   0   0/1     0.0     0/0   0.0
Collin Ginobili        12    0    0    0   0   0/2     0.0     0/0   0.0

TEAM: FG: 12/19 (63.2%), 3PT: 3/7 (42.9%), REB: 13 (4 off, 9 def), AST: 3, TO: 4
TEAM FOULS: 3


Team_014
--------------------------------------------------------------------------------
Player                MIN  PTS  REB  AST  TO      FG   FG%      3P   3P%
--------------------------------------------------------------------------------
Michael Cunningham     12    9    2    1   0   3/6    50.0     0/0   0.0
Lamelo Simmons         12    4    0    0   0   2/5    40.0     0/0   0.0
DeMar Adebayo          12    3    6    0   0   1/2    50.0     0/0   0.0
Jordan Anunoby         12    2    0    3   0   1/2    50.0     0/0   0.0
Ayo Murray             12    2    2    2   0   1/3    33.3     0/0   0.0

TEAM: FG: 8/18 (44.4%), 3PT: 3/9 (33.3%), REB: 10 (3 off, 7 def), AST: 6, TO: 4
TEAM FOULS: 11 [Team_023 in BONUS]

================================================================================

================================================================================
                       2ND QUARTER - Team_023 vs Team_014                       
================================================================================

[12:00] Team_023 possession (Score: 26-21)
Collin Ginobili attempts a Midrange. Contested by Jordan Anunoby (5.5 feet, ZONE). Collin Ginobili misses. Rebound secured by Michael Cunningham.

[11:46] Team_014 possession (Score: 26-21)
DeMar Adebayo makes the Layup and draws the foul on Josh Morant! And-1! DeMar Adebayo to the line for 1. [Team fouls: 1] (Josh Morant: 1 personal fouls)   FT 1/1: GOOD DeMar Adebayo makes 1/1 from the line.
Score: 26-24

[11:30] Team_023 possession (Score: 26-24)
Kyle Paul attempts a Midrange. Contested by Lamelo Simmons (4.9 feet, MAN). Kyle Paul misses. Rebound secured by DeMar Adebayo.

[11:15] Team_014 possession (Score: 26-24)
Lamelo Simmons attempts a 3Pt. Contested by Kyle Paul (3.7 feet, MAN). Lamelo Simmons misses. Offensive rebound by Ayo Murray! Ayo Murray kicks it out.

[10:59] Team_014 possession (Score: 26-24)
Lamelo Simmons attempts a 3Pt. Contested by Trae Ingram (4.2 feet, ZONE). Lamelo Simmons misses. Rebound secured by Tim Bane.

[10:47] Team_023 possession (Score: 26-24)
Collin Ginobili attempts a 3Pt. Contested by Jordan Anunoby (5.6 feet, MAN). Collin Ginobili misses. Offensive rebound by Josh Morant! Josh Morant kicks it out.

[10:33] Team_023 possession (Score: 26-24)
Tim Bane drives, DeMar Adebayo stays with him. Tim Bane attempts a Layup. Contested by DeMar Adebayo (4.1 feet, ZONE). TIM BANE MAKES IT! Assist: Josh Morant
Score: 28-24

[10:14] Team_014 possession (Score: 28-24)
Lamelo Simmons drives to the basket... Lamelo Simmons loses control! Ball rolls out of bounds! TURNOVER! (dead ball)

[10:14] Substitution (Team_023): Trae Ingram OUT → Tracy Anthony IN (stamina_rule2)

[10:14] Substitution (Team_023): Collin Ginobili OUT → Magic Booker IN (stamina_rule2)

[10:14] Substitution (Team_023): Kyle Paul OUT → Gary Westbrook IN (stamina_rule2)

[10:14] Substitution (Team_023): Josh Morant OUT → Evan Parker IN (stamina_rule2)

[10:14] Substitution (Team_023): Tim Bane OUT → Vince Gasol IN (stamina_rule2)

[10:14] Substitution (Team_014): Michael Cunningham OUT → Jalen Booker IN (stamina_rule2)

[10:14] Substitution (Team_014): Jordan Anunoby OUT → Bones Quickley IN (stamina_rule2)

[10:14] Substitution (Team_014): Lamelo Simmons OUT → Tracy Westbrook IN (stamina_rule2)

[10:14] Substitution (Team_014): DeMar Adebayo OUT → Nikola James IN (stamina_rule2)

[10:14] Substitution (Team_014): Ayo Murray OUT → Collin Gasol IN (stamina_rule2)

[10:01] Team_023 possession (Score: 28-24)
Vince Gasol attempts a Layup. Contested by Collin Gasol (5.2 feet, ZONE). VINCE GASOL MAKES IT! Assist: Magic Booker
Score: 30-24

[09:47] Team_014 possession (Score: 30-24)
Jalen Booker attempts a 3Pt. Contested by Tracy Anthony (3.7 feet, MAN). Jalen Booker misses. Rebound secured by Vince Gasol.

[09:33] Team_023 possession (Score: 30-24)
Tracy Anthony attempts a 3Pt. Contested by Jalen Booker (4.3 feet, MAN). Tracy Anthony misses. Rebound secured by Collin Gasol.

[09:19] Team_014 possession (Score: 30-24)
Nikola James attempts a Midrange. Contested by Evan Parker (3.1 feet, MAN). Nikola James misses. Rebound secured by Evan Parker.

[09:04] Team_023 possession (Score: 30-24)
Vince Gasol attempts a 3Pt. Contested by Jalen Booker (4.4 feet, ZONE). VINCE GASOL MAKES IT! Assist: Gary Westbrook
Score: 33-24

[08:53] Team_014 possession (Score: 33-24)
Bones Quickley drives, Magic Booker stays with him. Bones Quickley attempts a Layup. Contested by Magic Booker (4.2 feet, MAN). BONES QUICKLEY MAKES IT!
Score: 33-26

[08:36] Team_023 possession (Score: 33-26)
Vince Gasol attempts a Layup. Contested by Collin Gasol (5.2 feet, ZONE). Vince Gasol misses. Rebound secured by Tracy Westbrook.

[08:23] Team_014 possession (Score: 33-26)
Nikola James drives, Evan Parker stays with him. Nikola James attempts a Dunk. Contested by Evan Parker (3.1 feet, MAN). NIKOLA JAMES MAKES IT! Assist: Bones Quickley
Score: 33-28

[08:07] Team_023 possession (Score: 33-28)
Tracy Anthony makes the Layup and draws the foul on Jalen Booker! And-1! Tracy Anthony to the line for 1. [Team fouls: 1] (Jalen Booker: 1 personal fouls)   FT 1/1: GOOD Tracy Anthony makes 1/1 from the line.
Score: 36-28

[07:53] Team_014 possession (Score: 36-28)
Bones Quickley attempts a 3Pt. Contested by Tracy Anthony (3.5 feet, ZONE). Bones Quickley misses. Rebound secured by Evan Parker.

[07:37] Team_023 possession (Score: 36-28)
Magic Booker attempts a 3Pt. Contested by Tracy Westbrook (5.0 feet, ZONE). MAGIC BOOKER MAKES IT! Assist: Evan Parker
Score: 39-28

[07:20] Team_014 possession (Score: 39-28)
Tracy Westbrook drives, Vince Gasol stays with him. Tracy Westbrook attempts a Dunk. Contested by Vince Gasol (3.3 feet, ZONE). TRACY WESTBROOK MAKES IT! Assist: Bones Quickley
Score: 39-30

[07:08] Team_023 possession (Score: 39-30)
Evan Parker drives, Nikola James stays with him. Evan Parker attempts a Dunk. Contested by Nikola James (5.3 feet, MAN). EVAN PARKER MAKES IT! Assist: Vince Gasol
Score: 41-30

[06:53] Team_014 possession (Score: 41-30)
FOUL! Offensive foul on Collin Gasol! Vince Gasol drew the charge! [Team fouls: 2] (Collin Gasol: 1 personal fouls) TURNOVER! (dead ball)

[06:35] Team_023 possession (Score: 41-30)
FOUL! Offensive foul on Tracy Anthony! Jalen Booker drew the charge! [Team fouls: 2] (Tracy Anthony: 1 personal fouls) TURNOVER! (dead ball)

[06:18] Team_014 possession (Score: 41-30)
Jalen Booker attempts a 3Pt. Contested by Tracy Anthony (3.7 feet, MAN). JALEN BOOKER MAKES IT! Assist: Tracy Westbrook
Score: 41-33

[06:05] Team_023 possession (Score: 41-33)
Magic Booker attempts a Layup. Contested by Collin Gasol (4.9 feet, ZONE). MAGIC BOOKER MAKES IT!
Score: 43-33

[05:49] Team_014 possession (Score: 43-33)
Jalen Booker drives and kicks out. Collin Gasol attempts a Midrange. Contested by Vince Gasol (3.6 feet, MAN). Collin Gasol misses. Rebound secured by Evan Parker.

[05:32] Team_023 possession (Score: 43-33)
Evan Parker drives, picks up Nikola James. Help arrives from Jalen Booker! Evan Parker attempts a Dunk. Contested by Jalen Booker (5.3 feet, MAN). EVAN PARKER MAKES IT! Assist: Gary Westbrook
Score: 45-33

[05:16] Team_014 possession (Score: 45-33)
Nikola James attempts a Midrange. Contested by Evan Parker (3.1 feet, MAN). NIKOLA JAMES MAKES IT!
Score: 45-35

[05:04] Team_023 possession (Score: 45-35)
Gary Westbrook attempts a Layup. Contested by Tracy Westbrook (5.6 feet, MAN). GARY WESTBROOK MAKES IT! Assist: Magic Booker
Score: 47-35

[04:52] Team_014 possession (Score: 47-35)
Jalen Booker drives and kicks out. FOUL! Shooting foul on Evan Parker. Jalen Booker to the line for 2 free throws. [Team fouls: 3] (Evan Parker: 1 personal fouls)   FT 1/2: GOOD   FT 2/2: GOOD Jalen Booker makes 2/2 from the line.
Score: 47-37

[04:35] Team_023 possession (Score: 47-37)
Tracy Anthony attempts a 3Pt. Contested by Jalen Booker (4.3 feet, MAN). Tracy Anthony misses. Rebound secured by Nikola James.

[04:21] Team_014 possession (Score: 47-37)
Tracy Westbrook drives, picks up Gary Westbrook. Help arrives from Magic Booker! Tracy Westbrook attempts a Dunk. Contested by Magic Booker (3.6 feet, MAN). TRACY WESTBROOK MAKES IT! Assist: Jalen Booker
Score: 47-39

[04:09] Team_023 possession (Score: 47-39)
Magic Booker attempts a 3Pt. Contested by Jalen Booker (4.0 feet, ZONE). Magic Booker misses. Rebound secured by Tracy Westbrook.

[03:57] Team_014 possession (Score: 47-39)
Tracy Westbrook attempts a 3Pt. Contested by Tracy Anthony (3.3 feet, ZONE). TRACY WESTBROOK MAKES IT! Assist: Jalen Booker
Score: 47-42

[03:44] Team_023 possession (Score: 47-42)
Gary Westbrook attempts a Midrange. Contested by Tracy Westbrook (5.6 feet, MAN). Gary Westbrook misses. Rebound secured by Collin Gasol.

[03:32] Team_014 possession (Score: 47-42)
Nikola James drives to the basket... Nikola James throws a bad pass! Stolen by Vince Gasol! TURNOVER! (live ball)

[03:17] Team_023 possession (Score: 47-42)
FOUL! Shooting foul on Collin Gasol. Gary Westbrook to the line for 2 free throws. [Team fouls: 3] (Collin Gasol: 2 personal fouls)   FT 1/2: GOOD   FT 2/2: GOOD Gary Westbrook makes 2/2 from the line.
Score: 49-42

[03:03] Team_014 possession (Score: 49-42)
Bones Quickley attempts a 3Pt. Contested by Magic Booker (4.2 feet, MAN). Bones Quickley misses. Rebound secured by Evan Parker.

[02:48] Team_023 possession (Score: 49-42)
Evan Parker attempts a Midrange. Contested by Nikola James (5.3 feet, MAN). Evan Parker misses. Rebound secured by Tracy Westbrook.

[02:38] Team_014 possession (Score: 49-42)
Collin Gasol attempts a Midrange. Contested by Magic Booker (4.8 feet, ZONE). COLLIN GASOL MAKES IT! Assist: Jalen Booker
Score: 49-44

[02:25] Team_023 possession (Score: 49-44)
Tracy Anthony attempts a Midrange. Contested by Jalen Booker (4.4 feet, MAN). TRACY ANTHONY MAKES IT! Assist: Evan Parker
Score: 51-44

[02:15] Team_014 possession (Score: 51-44)
Bones Quickley attempts a Midrange. Contested by Magic Booker (4.3 feet, ZONE). BONES QUICKLEY MAKES IT!
Score: 51-46

[01:59] Team_023 possession (Score: 51-46)
Vince Gasol attempts a 3Pt. Contested by Jalen Booker (4.5 feet, ZONE). Vince Gasol misses. Rebound secured by Nikola James.

[01:42] Team_014 possession (Score: 51-46)
Bones Quickley drives, picks up Vince Gasol. Help arrives from Magic Booker! Bones Quickley attempts a Layup. Contested by Magic Booker (3.7 feet, ZONE). BONES QUICKLEY MAKES IT! Assist: Nikola James
Score: 51-48

[01:31] Team_023 possession (Score: 51-48)
Tracy Anthony attempts a 3Pt. Contested by Jalen Booker (4.5 feet, ZONE). Tracy Anthony misses. Rebound secured by Collin Gasol.

[01:17] Team_014 possession (Score: 51-48)
Tracy Westbrook attempts a Layup. Contested by Gary Westbrook (3.8 feet, MAN). TRACY WESTBROOK MAKES IT!
Score: 51-50

[01:01] Team_023 possession (Score: 51-50)
Gary Westbrook attempts a 3Pt. Contested by Jalen Booker (4.8 feet, ZONE). GARY WESTBROOK MAKES IT! Assist: Tracy Anthony
Score: 54-50

[00:46] Team_014 possession (Score: 54-50)
Collin Gasol drives and kicks out. Collin Gasol attempts a Midrange. Contested by Vince Gasol (3.9 feet, MAN). COLLIN GASOL MAKES IT! Assist: Tracy Westbrook
Score: 54-52

[00:31] Team_023 possession (Score: 54-52)
Gary Westbrook drives to the basket... Gary Westbrook throws a bad pass! Stolen by Collin Gasol! TURNOVER! (live ball)

[00:18] Team_014 possession (Score: 54-52)
Tracy Westbrook drives, picks up Vince Gasol. Help arrives from Magic Booker! Tracy Westbrook attempts a Layup. Contested by Magic Booker (3.6 feet, ZONE). TRACY WESTBROOK MAKES IT! Assist: Nikola James
Score: 54-54

[00:03] Team_023 possession (Score: 54-54)
Evan Parker drives, Nikola James stays with him. Evan Parker attempts a Dunk. Contested by Nikola James (5.5 feet, MAN). EVAN PARKER MAKES IT! Assist: Tracy Anthony
Score: 56-54

================================================================================
                              2ND QUARTER COMPLETE                              
================================================================================

2ND QUARTER SCORE: Team_023 30, Team_014 33

BOX SCORE:
================================================================================

Team_023
--------------------------------------------------------------------------------
Player                MIN  PTS  REB  AST  TO      FG   FG%      3P   3P%
--------------------------------------------------------------------------------
Gary Westbrook         10    7    0    2   0   3/4    75.0     0/0   0.0
Evan Parker            10    6    4    2   0   3/4    75.0     0/0   0.0
Vince Gasol            10    5    1    1   0   2/4    50.0     0/0   0.0
Magic Booker           10    5    0    2   0   2/3    66.7     0/0   0.0
Tracy Anthony          10    5    0    2   0   2/5    40.0     0/0   0.0
Tim Bane               14    2    1    0   0   1/1   100.0     0/0   0.0
Collin Ginobili        14    0    0    0   0   0/1     0.0     0/0   0.0
Kyle Paul              14    0    0    0   0   0/1     0.0     0/0   0.0
Josh Morant            14    0    1    1   0   0/0     0.0     0/0   0.0

TEAM: FG: 13/23 (56.5%), 3PT: 3/8 (37.5%), REB: 7 (1 off, 6 def), AST: 10, TO: 2
TEAM FOULS: 3


Team_014
--------------------------------------------------------------------------------
Player                MIN  PTS  REB  AST  TO      FG   FG%      3P   3P%
--------------------------------------------------------------------------------
Tracy Westbrook        10   11    3    2   0   5/5   100.0     0/0   0.0
Bones Quickley         10    6    0    2   0   3/5    60.0     0/0   0.0
Jalen Booker           10    5    0    3   0   2/4    50.0     0/0   0.0
Collin Gasol           10    4    3    0   0   2/2   100.0     0/0   0.0
Nikola James           10    4    2    2   0   2/3    66.7     0/0   0.0
DeMar Adebayo          14    3    1    0   0   1/1   100.0     0/0   0.0
Michael Cunningham     14    0    1    0   0   0/0     0.0     0/0   0.0
Ayo Murray             14    0    1    0   0   0/0     0.0     0/0   0.0
Lamelo Simmons         14    0    0    0   0   0/1     0.0     0/0   0.0

TEAM: FG: 15/21 (71.4%), 3PT: 2/6 (33.3%), REB: 11 (1 off, 10 def), AST: 9, TO: 3
TEAM FOULS: 3

================================================================================

================================================================================
                       3RD QUARTER - Team_023 vs Team_014                       
================================================================================

[12:00] Team_023 possession (Score: 56-54)
Tim Bane throws a bad pass! Stolen by Ayo Murray! TURNOVER! (live ball)

[11:46] Team_014 possession (Score: 56-54)
Lamelo Simmons attempts a 3Pt. Contested by Kyle Paul (3.2 feet, MAN). Lamelo Simmons misses. Rebound secured by Tim Bane.

[11:36] Team_023 possession (Score: 56-54)
Kyle Paul drives to the basket... Kyle Paul throws a bad pass! Stolen by Lamelo Simmons! TURNOVER! (live ball)

[11:22] Team_014 possession (Score: 56-54)
FOUL! Offensive foul on Lamelo Simmons! Kyle Paul drew the charge! [Team fouls: 1] (Lamelo Simmons: 1 personal fouls) TURNOVER! (dead ball)

[11:06] Team_023 possession (Score: 56-54)
FOUL! Holding foul on Ayo Murray. [Team fouls: 2] No free throws, side out. (Ayo Murray: 1 personal fouls)

[10:51] Team_023 possession (Score: 56-54)
Trae Ingram attempts a Layup. Contested by Michael Cunningham (3.9 feet, MAN). TRAE INGRAM MAKES IT! Assist: Tim Bane
Score: 58-54

[10:37] Team_014 possession (Score: 58-54)
Ayo Murray drives, Tim Bane stays with him. Ayo Murray attempts a Layup. Contested by Tim Bane (4.2 feet, MAN). Ayo Murray misses. Rebound secured by Tim Bane.

[10:23] Team_023 possession (Score: 58-54)
FOUL! Shooting foul on Michael Cunningham. Trae Ingram to the line for 2 free throws. [Team fouls: 3] (Michael Cunningham: 1 personal fouls)   FT 1/2: GOOD   FT 2/2: GOOD Trae Ingram makes 2/2 from the line.
Score: 60-54

[10:09] Team_014 possession (Score: 60-54)
Michael Cunningham attempts a 3Pt. Contested by Trae Ingram (3.2 feet, MAN). MICHAEL CUNNINGHAM MAKES IT! Assist: Jordan Anunoby
Score: 60-57

[09:55] Team_023 possession (Score: 60-57)
Josh Morant attempts a 3Pt. Contested by DeMar Adebayo (3.3 feet, MAN). JOSH MORANT MAKES IT!
Score: 63-57

[09:42] Team_014 possession (Score: 63-57)
FOUL! Holding foul on Kyle Paul. [Team fouls: 1] No free throws, side out. (Kyle Paul: 1 personal fouls)

[09:29] Team_014 possession (Score: 63-57)
Michael Cunningham attempts a 3Pt. Contested by Kyle Paul (2.6 feet, ZONE). Michael Cunningham misses. FOUL! Loose ball foul on Kyle Paul during the rebound battle. [Team fouls: 2] No free throws, side out. (Kyle Paul: 2 personal fouls)

[09:19] Team_014 possession (Score: 63-57)
Jordan Anunoby attempts a 3Pt. Contested by Collin Ginobili (5.2 feet, MAN). Jordan Anunoby misses. Rebound secured by Kyle Paul.

[09:03] Team_023 possession (Score: 63-57)
Kyle Paul drives to the basket... FOUL! Offensive foul on Kyle Paul! DeMar Adebayo drew the charge! [Team fouls: 3] (Kyle Paul: 3 personal fouls) TURNOVER! (dead ball)

[08:46] Team_014 possession (Score: 63-57)
Ayo Murray attempts a Layup. Contested by Tim Bane (4.2 feet, MAN). Ayo Murray misses. Rebound secured by Tim Bane.

[08:29] Team_023 possession (Score: 63-57)
Kyle Paul attempts a 3Pt. Contested by Jordan Anunoby (5.0 feet, ZONE). Kyle Paul misses. Rebound secured by Ayo Murray.

[08:12] Team_014 possession (Score: 63-57)
DeMar Adebayo attempts a 3Pt. Contested by Trae Ingram (3.3 feet, ZONE). DeMar Adebayo misses. Rebound secured by Josh Morant.

[07:58] Team_023 possession (Score: 63-57)
FOUL! Shooting foul on Jordan Anunoby. Collin Ginobili to the line for 2 free throws. [Team fouls: 4] (Jordan Anunoby: 1 personal fouls)   FT 1/2: MISS   FT 2/2: MISS Collin Ginobili makes 0/2 from the line. Offensive rebound by Tim Bane! Tim Bane's putback is no good.

[07:46] Team_014 possession (Score: 63-57)
Lamelo Simmons attempts a 3Pt. Contested by Kyle Paul (3.2 feet, ZONE). LAMELO SIMMONS MAKES IT! Assist: Jordan Anunoby
Score: 63-60

[07:28] Team_023 possession (Score: 63-60)
Josh Morant attempts a Midrange. Contested by DeMar Adebayo (3.3 feet, MAN). Josh Morant misses. Offensive rebound by Tim Bane! Tim Bane puts it back in!
Score: 65-60

[07:14] Team_014 possession (Score: 65-60)
Lamelo Simmons throws a bad pass out of bounds! TURNOVER! (dead ball)

[07:01] Team_023 possession (Score: 65-60)
Trae Ingram drives, DeMar Adebayo stays with him. Trae Ingram attempts a Dunk. Contested by DeMar Adebayo (3.1 feet, ZONE). TRAE INGRAM MAKES IT!
Score: 67-60

[06:50] Team_014 possession (Score: 67-60)
Michael Cunningham attempts a 3Pt. Contested by Trae Ingram (3.2 feet, MAN). Michael Cunningham misses. Offensive rebound by DeMar Adebayo! DeMar Adebayo kicks it out.

[06:36] Team_014 possession (Score: 67-60)
Lamelo Simmons attempts a 3Pt. Contested by Kyle Paul (3.2 feet, ZONE). Lamelo Simmons misses. Rebound secured by Josh Morant.

[06:22] Team_023 possession (Score: 67-60)
Trae Ingram attempts a Midrange. Contested by DeMar Adebayo (3.1 feet, ZONE). Trae Ingram misses. FOUL! Loose ball foul on Michael Cunningham during the rebound battle. [IN THE BONUS! 5 team fouls] Josh Morant to the line for 2 free throws. (Michael Cunningham: 2 personal fouls)   FT 1/2: GOOD   FT 2/2: GOOD Josh Morant makes 2/2 from the line.
Score: 69-60

[06:05] Team_014 possession (Score: 69-60)
Jordan Anunoby attempts a Midrange. Contested by Collin Ginobili (5.2 feet, MAN). Jordan Anunoby misses. Offensive rebound by Ayo Murray! Ayo Murray kicks it out.

[05:49] Team_014 possession (Score: 69-60)
FOUL! Holding foul on Collin Ginobili. [Team fouls: 4] No free throws, side out. (Collin Ginobili: 1 personal fouls)

[05:39] Team_014 possession (Score: 69-60)
DeMar Adebayo attempts a 3Pt. Contested by Josh Morant (4.0 feet, MAN). DeMar Adebayo misses. Offensive rebound by DeMar Adebayo! DeMar Adebayo kicks it out.

[05:19] Team_014 possession (Score: 69-60)
Jordan Anunoby attempts a 3Pt. Contested by Kyle Paul (3.1 feet, ZONE). JORDAN ANUNOBY MAKES IT! Assist: Michael Cunningham
Score: 69-63

[05:07] Team_023 possession (Score: 69-63)
Kyle Paul attempts a 3Pt. Contested by Jordan Anunoby (5.1 feet, ZONE). Kyle Paul misses. Rebound secured by Michael Cunningham.

[04:54] Team_014 possession (Score: 69-63)
FOUL! Shooting foul on Kyle Paul. Michael Cunningham to the line for 3 free throws. [BONUS: 5 team fouls] (Kyle Paul: 4 personal fouls)   FT 1/3: GOOD   FT 2/3: GOOD   FT 3/3: GOOD Michael Cunningham makes 3/3 from the line.
Score: 69-66

[04:38] Team_023 possession (Score: 69-66)
Josh Morant attempts a Layup. Contested by DeMar Adebayo (3.4 feet, MAN). JOSH MORANT MAKES IT! Assist: Trae Ingram
Score: 71-66

[04:26] Team_014 possession (Score: 71-66)
Jordan Anunoby attempts a Midrange. Contested by Collin Ginobili (5.2 feet, MAN). JORDAN ANUNOBY MAKES IT! Assist: Ayo Murray
Score: 71-68

[04:11] Team_023 possession (Score: 71-68)
Kyle Paul drives, DeMar Adebayo stays with him. Kyle Paul attempts a Dunk. Contested by DeMar Adebayo (3.6 feet, ZONE). Kyle Paul misses. Rebound secured by Ayo Murray.

[03:55] Team_014 possession (Score: 71-68)
FOUL! Holding foul on Trae Ingram. [IN THE BONUS! 6 team fouls] Michael Cunningham to the line for 2 free throws. (Trae Ingram: 1 personal fouls)   FT 1/2: GOOD   FT 2/2: GOOD Michael Cunningham makes 2/2 from the line.
Score: 71-70

[03:37] Team_023 possession (Score: 71-70)
Collin Ginobili attempts a 3Pt. Contested by Jordan Anunoby (5.3 feet, ZONE). Collin Ginobili misses. Rebound secured by Ayo Murray.

[03:22] Team_014 possession (Score: 71-70)
Michael Cunningham makes the Dunk and draws the foul on Kyle Paul! And-1! Michael Cunningham to the line for 1. [BONUS: 7 team fouls] (Kyle Paul: 5 personal fouls)   FT 1/1: GOOD Michael Cunningham makes 1/1 from the line.
Score: 71-73

[03:03] Team_023 possession (Score: 71-73)
Kyle Paul attempts a Midrange. Contested by DeMar Adebayo (3.7 feet, ZONE). Kyle Paul misses. Rebound secured by DeMar Adebayo.

[02:53] Team_014 possession (Score: 71-73)
Michael Cunningham attempts a 3Pt. Contested by Kyle Paul (2.9 feet, ZONE). MICHAEL CUNNINGHAM MAKES IT! Assist: Lamelo Simmons
Score: 71-76

[02:41] Team_023 possession (Score: 71-76)
Kyle Paul attempts a 3Pt. Contested by Lamelo Simmons (4.7 feet, MAN). Kyle Paul misses. Rebound secured by Ayo Murray.

[02:28] Team_014 possession (Score: 71-76)
Lamelo Simmons attempts a 3Pt. Contested by Kyle Paul (3.5 feet, MAN). LAMELO SIMMONS MAKES IT! Assist: Michael Cunningham
Score: 71-79

[02:14] Team_023 possession (Score: 71-79)
Collin Ginobili attempts a 3Pt. Contested by Jordan Anunoby (5.4 feet, ZONE). Collin Ginobili misses. Rebound secured by Michael Cunningham.

[02:00] Team_014 possession (Score: 71-79)
FOUL! Shooting foul on Josh Morant. Jordan Anunoby to the line for 3 free throws. [BONUS: 8 team fouls] (Josh Morant: 1 personal fouls)   FT 1/3: GOOD   FT 2/3: GOOD   FT 3/3: GOOD Jordan Anunoby makes 3/3 from the line.
Score: 71-82

[01:45] Team_023 possession (Score: 71-82)
Collin Ginobili attempts a Midrange. Contested by Jordan Anunoby (5.5 feet, MAN). COLLIN GINOBILI MAKES IT!
Score: 73-82

[01:30] Team_014 possession (Score: 73-82)
Lamelo Simmons makes the Layup and draws the foul on Kyle Paul! And-1! Lamelo Simmons to the line for 1. [BONUS: 9 team fouls] (Kyle Paul: 6 personal fouls) Kyle Paul FOULS OUT!   FT 1/1: GOOD Lamelo Simmons makes 1/1 from the line.
Score: 73-85

[01:30] Substitution (Team_023): Kyle Paul OUT (stamina: 66) → Tracy Anthony IN (foul_out)

[01:15] Team_023 possession (Score: 73-85)
Collin Ginobili drives, Ayo Murray stays with him. Collin Ginobili attempts a Dunk. Contested by Ayo Murray (5.6 feet, ZONE). COLLIN GINOBILI MAKES IT!
Score: 75-85

[01:01] Team_014 possession (Score: 75-85)
Jordan Anunoby attempts a 3Pt. Contested by Collin Ginobili (5.5 feet, MAN). Jordan Anunoby misses. Rebound secured by Tim Bane.

[00:47] Team_023 possession (Score: 75-85)
Collin Ginobili attempts a 3Pt. Contested by Jordan Anunoby (5.6 feet, MAN). Collin Ginobili misses. Rebound secured by Ayo Murray.

[00:32] Team_014 possession (Score: 75-85)
DeMar Adebayo makes the Layup and draws the foul on Josh Morant! And-1! DeMar Adebayo to the line for 1. [BONUS: 10 team fouls] (Josh Morant: 2 personal fouls)   FT 1/1: GOOD DeMar Adebayo makes 1/1 from the line.
Score: 75-88

[00:20] Team_023 possession (Score: 75-88)
Tracy Anthony drives, picks up DeMar Adebayo. Help arrives from Michael Cunningham! Tracy Anthony attempts a Dunk. Contested by Michael Cunningham (3.9 feet, ZONE). Tracy Anthony misses. Rebound secured by Michael Cunningham.

[00:04] Team_014 possession (Score: 75-88)
DeMar Adebayo drives and kicks out. Lamelo Simmons attempts a 3Pt. Contested by Tracy Anthony (3.6 feet, ZONE). Lamelo Simmons misses. Offensive rebound by Ayo Murray! Ayo Murray kicks it out.

================================================================================
                              3RD QUARTER COMPLETE                              
================================================================================

3RD QUARTER SCORE: Team_023 19, Team_014 34

BOX SCORE:
================================================================================

Team_023
--------------------------------------------------------------------------------
Player                MIN  PTS  REB  AST  TO      FG   FG%      3P   3P%
--------------------------------------------------------------------------------
Josh Morant            26    7    2    0   0   3/3   100.0     0/0   0.0
Trae Ingram            26    6    0    1   0   3/3   100.0     0/0   0.0
Collin Ginobili        26    4    0    0   0   2/6    33.3     0/0   0.0
Tim Bane               26    2    6    1   0   1/1   100.0     0/0   0.0
Kyle Paul              25    0    1    0   0   0/5     0.0     0/0   0.0
Tracy Anthony          12    0    0    0   0   0/1     0.0     0/0   0.0

TEAM: FG: 9/19 (47.4%), 3PT: 1/7 (14.3%), REB: 8 (1 off, 7 def), AST: 2, TO: 3
TEAM FOULS: 10 [Team_014 in BONUS]


Team_014
--------------------------------------------------------------------------------
Player                MIN  PTS  REB  AST  TO      FG   FG%      3P   3P%
--------------------------------------------------------------------------------
Michael Cunningham     26   14    3    2   0   5/5   100.0     0/0   0.0
Lamelo Simmons         26    9    0    1   0   3/5    60.0     0/0   0.0
Jordan Anunoby         26    8    0    2   0   3/5    60.0     0/0   0.0
DeMar Adebayo          26    3    3    0   0   1/2    50.0     0/0   0.0
Ayo Murray             26    0    8    1   0   0/2     0.0     0/0   0.0

TEAM: FG: 12/19 (63.2%), 3PT: 7/12 (58.3%), REB: 15 (5 off, 10 def), AST: 6, TO: 2
TEAM FOULS: 5 [Team_023 in BONUS]

================================================================================

================================================================================
                       4TH QUARTER - Team_023 vs Team_014                       
================================================================================

[12:00] Substitution (Team_023): Trae Ingram OUT (stamina: 69) → Tracy Anthony IN (comeback_detected)

[12:00] Substitution (Team_014): Michael Cunningham OUT (stamina: 69) → Jalen Booker IN (comeback_detected)

[12:00] Team_023 possession (Score: 75-88)
Tracy Anthony attempts a 3Pt. Contested by DeMar Adebayo (3.6 feet, ZONE). TRACY ANTHONY MAKES IT!
Score: 78-88

[11:44] Team_014 possession (Score: 78-88)
Jalen Booker makes the Layup and draws the foul on Tracy Anthony! And-1! Jalen Booker to the line for 1. [Team fouls: 1] (Tracy Anthony: 1 personal fouls)   FT 1/1: GOOD Jalen Booker makes 1/1 from the line.
Score: 78-91

[11:32] Team_023 possession (Score: 78-91)
Josh Morant drives, DeMar Adebayo stays with him. Josh Morant attempts a Dunk. Contested by DeMar Adebayo (3.7 feet, MAN). JOSH MORANT MAKES IT! Assist: Tim Bane
Score: 80-91

[11:21] Team_014 possession (Score: 80-91)
Jordan Anunoby attempts a 3Pt. Contested by Tracy Anthony (3.8 feet, ZONE). Jordan Anunoby misses. Offensive rebound by Ayo Murray! Ayo Murray kicks it out.

[11:07] Team_014 possession (Score: 80-91)
Jalen Booker attempts a 3Pt. Contested by Tracy Anthony (3.7 feet, ZONE). JALEN BOOKER MAKES IT! Assist: Lamelo Simmons
Score: 80-94

[10:53] Team_023 possession (Score: 80-94)
FOUL! Reach-in foul on DeMar Adebayo during the drive. [Team fouls: 1] No free throws, side out. (DeMar Adebayo: 1 personal fouls)

[10:39] Team_023 possession (Score: 80-94)
Tracy Anthony drives, DeMar Adebayo stays with him. Tracy Anthony attempts a Dunk. Contested by DeMar Adebayo (3.8 feet, ZONE). Tracy Anthony misses. Rebound secured by Lamelo Simmons.

[10:24] Team_014 possession (Score: 80-94)
Jordan Anunoby drives and kicks out. Jordan Anunoby attempts a 3Pt. Contested by Collin Ginobili (5.4 feet, MAN). JORDAN ANUNOBY MAKES IT! Assist: Ayo Murray
Score: 80-97

[10:10] Team_023 possession (Score: 80-97)
Collin Ginobili attempts a 3Pt. Contested by Lamelo Simmons (5.2 feet, ZONE). Collin Ginobili misses. Rebound secured by Ayo Murray.

[09:51] Team_014 possession (Score: 80-97)
FOUL! Reach-in foul on Tim Bane during the drive. [Team fouls: 2] No free throws, side out. (Tim Bane: 1 personal fouls)

[09:38] Team_014 possession (Score: 80-97)
FOUL! Holding foul on Tim Bane. [Team fouls: 3] No free throws, side out. (Tim Bane: 2 personal fouls)

[09:20] Team_014 possession (Score: 80-97)
Ayo Murray drives and kicks out. Jalen Booker attempts a Midrange. Contested by Collin Ginobili (5.5 feet, ZONE). Jalen Booker misses. Offensive rebound by Ayo Murray! Ayo Murray kicks it out.

[09:08] Team_014 possession (Score: 80-97)
Lamelo Simmons attempts a 3Pt. Contested by Kyle Paul (3.6 feet, MAN). Lamelo Simmons misses. Rebound secured by Tim Bane.

[08:55] Team_023 possession (Score: 80-97)
Kyle Paul attempts a 3Pt. Contested by Jordan Anunoby (5.7 feet, ZONE). Kyle Paul misses. Rebound secured by Ayo Murray.

[08:40] Team_014 possession (Score: 80-97)
Jalen Booker attempts a 3Pt. Contested by Tracy Anthony (3.7 feet, ZONE). Jalen Booker misses. Offensive rebound by DeMar Adebayo! DeMar Adebayo kicks it out.

[08:28] Team_014 possession (Score: 80-97)
FOUL! Reach-in foul on Josh Morant during the drive. [Team fouls: 4] No free throws, side out. (Josh Morant: 1 personal fouls)

[08:10] Team_014 possession (Score: 80-97)
Lamelo Simmons attempts a Layup. Contested by Kyle Paul (3.7 feet, MAN). LAMELO SIMMONS MAKES IT! Assist: Ayo Murray
Score: 80-99

[07:53] Team_023 possession (Score: 80-99)
FOUL! Reach-in foul on Ayo Murray during the drive. [Team fouls: 2] No free throws, side out. (Ayo Murray: 1 personal fouls)

[07:39] Team_023 possession (Score: 80-99)
Tim Bane drives to the basket... Tim Bane throws a bad pass out of bounds! TURNOVER! (dead ball)

[07:39] Substitution (Team_023): Collin Ginobili OUT → Magic Booker IN (stamina_rule2)

[07:39] Substitution (Team_023): Kyle Paul OUT → Gary Westbrook IN (stamina_rule2)

[07:39] Substitution (Team_023): Josh Morant OUT → Evan Parker IN (stamina_rule2)

[07:39] Substitution (Team_023): Tim Bane OUT → Vince Gasol IN (stamina_rule2)

[07:39] Substitution (Team_014): Jordan Anunoby OUT → Bones Quickley IN (stamina_rule2)

[07:39] Substitution (Team_014): Lamelo Simmons OUT → Tracy Westbrook IN (stamina_rule2)

[07:39] Substitution (Team_014): DeMar Adebayo OUT → Nikola James IN (stamina_rule2)

[07:39] Substitution (Team_014): Ayo Murray OUT → Collin Gasol IN (stamina_rule2)

[07:27] Team_014 possession (Score: 80-99)
Bones Quickley attempts a Midrange. Contested by Evan Parker (2.9 feet, ZONE). Bones Quickley misses. Rebound secured by Gary Westbrook.

[07:12] Team_023 possession (Score: 80-99)
Gary Westbrook attempts a Midrange. Contested by Tracy Westbrook (5.6 feet, MAN). Gary Westbrook misses. Rebound secured by Collin Gasol.

[06:56] Team_014 possession (Score: 80-99)
Jalen Booker attempts a 3Pt. Contested by Tracy Anthony (3.7 feet, ZONE). Jalen Booker misses. Rebound secured by Vince Gasol.

[06:46] Team_023 possession (Score: 80-99)
Vince Gasol throws a bad pass! Stolen by Collin Gasol! TURNOVER! (live ball)

[06:35] Team_014 possession (Score: 80-99)
Nikola James drives and kicks out. Collin Gasol attempts a Midrange. Contested by Gary Westbrook (3.9 feet, ZONE). COLLIN GASOL MAKES IT! Assist: Jalen Booker
Score: 80-101

[06:18] Team_023 possession (Score: 80-101)
Magic Booker drives and kicks out. Gary Westbrook attempts a Midrange. Contested by Tracy Westbrook (5.2 feet, MAN). Gary Westbrook misses. Offensive rebound by Vince Gasol! Vince Gasol puts it back in!
Score: 82-101

[06:04] Team_014 possession (Score: 82-101)
Bones Quickley attempts a 3Pt. Contested by Magic Booker (4.2 feet, ZONE). Bones Quickley misses. Rebound secured by Gary Westbrook.

[05:49] Team_023 possession (Score: 82-101)
Vince Gasol attempts a 3Pt. Contested by Jalen Booker (4.4 feet, ZONE). Vince Gasol misses. Rebound secured by Tracy Westbrook.

[05:38] Team_014 possession (Score: 82-101)
Collin Gasol attempts a Layup. Contested by Vince Gasol (4.0 feet, MAN). Collin Gasol misses. Rebound secured by Evan Parker.

[05:25] Team_023 possession (Score: 82-101)
FOUL! Reach-in foul on Collin Gasol during the drive. [Team fouls: 3] No free throws, side out. (Collin Gasol: 1 personal fouls)

[05:09] Team_023 possession (Score: 82-101)
Magic Booker attempts a 3Pt. Contested by Bones Quickley (5.3 feet, MAN). MAGIC BOOKER MAKES IT! Assist: Evan Parker
Score: 85-101

[04:55] Team_014 possession (Score: 85-101)
Nikola James drives, Evan Parker stays with him. Nikola James attempts a Dunk. Contested by Evan Parker (3.1 feet, MAN). Nikola James misses. Rebound secured by Gary Westbrook.

[04:39] Team_023 possession (Score: 85-101)
Gary Westbrook drives and kicks out. Vince Gasol attempts a 3Pt. Contested by Collin Gasol (5.1 feet, MAN). Vince Gasol misses. Rebound secured by Nikola James.

[04:24] Team_014 possession (Score: 85-101)
Collin Gasol attempts a Layup. Contested by Vince Gasol (4.0 feet, ZONE). Collin Gasol misses. Rebound secured by Evan Parker.

[04:10] Team_023 possession (Score: 85-101)
Vince Gasol attempts a 3Pt. Contested by Jalen Booker (4.5 feet, ZONE). Vince Gasol misses. Rebound secured by Nikola James.

[03:52] Team_014 possession (Score: 85-101)
Bones Quickley attempts a Midrange. Contested by Magic Booker (4.2 feet, MAN). Bones Quickley misses. Offensive rebound by Collin Gasol! Collin Gasol puts it back in!
Score: 85-103

[03:34] Team_023 possession (Score: 85-103)
FOUL! Shooting foul on Bones Quickley. Vince Gasol to the line for 2 free throws. [Team fouls: 4] (Bones Quickley: 1 personal fouls)   FT 1/2: GOOD   FT 2/2: GOOD Vince Gasol makes 2/2 from the line.
Score: 87-103

[03:16] Team_014 possession (Score: 87-103)
Tracy Westbrook attempts a 3Pt. Contested by Magic Booker (4.0 feet, ZONE). Tracy Westbrook misses. Rebound secured by Gary Westbrook.

[02:58] Team_023 possession (Score: 87-103)
Magic Booker attempts a Midrange. Contested by Bones Quickley (5.3 feet, MAN). MAGIC BOOKER MAKES IT! Assist: Vince Gasol
Score: 89-103

[02:45] Team_014 possession (Score: 89-103)
Nikola James drives, Evan Parker stays with him. Nikola James attempts a Dunk. Contested by Evan Parker (3.1 feet, ZONE). Nikola James misses. Offensive rebound by Nikola James! Nikola James kicks it out.

[02:28] Team_014 possession (Score: 89-103)
Bones Quickley attempts a Midrange. Contested by Magic Booker (4.2 feet, MAN). Bones Quickley misses. FOUL! Loose ball foul on Gary Westbrook during the rebound battle. [IN THE BONUS! 5 team fouls] Nikola James to the line for 2 free throws. (Gary Westbrook: 1 personal fouls)   FT 1/2: GOOD   FT 2/2: MISS Nikola James makes 1/2 from the line. Rebound secured by Evan Parker.
Score: 89-104

[02:10] Team_023 possession (Score: 89-104)
FOUL! Reach-in foul on Jalen Booker during the drive. [IN THE BONUS! 5 team fouls] Tracy Anthony to the line for 2 free throws. (Jalen Booker: 1 personal fouls)   FT 1/2: GOOD   FT 2/2: GOOD Tracy Anthony makes 2/2 from the line.
Score: 91-104

[01:58] Team_014 possession (Score: 91-104)
Tracy Westbrook attempts a Midrange. Contested by Vince Gasol (3.3 feet, ZONE). TRACY WESTBROOK MAKES IT! Assist: Jalen Booker
Score: 91-106

[01:41] Team_023 possession (Score: 91-106)
Evan Parker makes the Layup and draws the foul on Collin Gasol! And-1! Evan Parker to the line for 1. [BONUS: 6 team fouls] (Collin Gasol: 2 personal fouls)   FT 1/1: GOOD Evan Parker makes 1/1 from the line.
Score: 94-106

[01:26] Team_014 possession (Score: 94-106)
Bones Quickley drives to the basket... Bones Quickley throws a bad pass! Stolen by Vince Gasol! TURNOVER! (live ball)

[01:12] Team_023 possession (Score: 94-106)
Gary Westbrook drives to the basket... FOUL! Offensive foul on Gary Westbrook! Tracy Westbrook drew the charge! [Team fouls: 6] (Gary Westbrook: 2 personal fouls) TURNOVER! (dead ball)

[00:56] Team_014 possession (Score: 94-106)
FOUL! Reach-in foul on Vince Gasol during the drive. [IN THE BONUS! 7 team fouls] Collin Gasol to the line for 2 free throws. (Vince Gasol: 1 personal fouls)   FT 1/2: GOOD   FT 2/2: GOOD Collin Gasol makes 2/2 from the line.
Score: 94-108

[00:39] Team_023 possession (Score: 94-108)
Magic Booker attempts a 3Pt. Contested by Bones Quickley (5.3 feet, ZONE). MAGIC BOOKER MAKES IT! Assist: Vince Gasol
Score: 97-108

[00:23] Team_014 possession (Score: 97-108)
Nikola James drives, Evan Parker stays with him. Nikola James attempts a Dunk. Contested by Evan Parker (3.1 feet, MAN). Nikola James misses. Offensive rebound by Collin Gasol! Collin Gasol puts it back in!
Score: 97-110

[00:08] Team_023 possession (Score: 97-110)
Vince Gasol drives, Collin Gasol stays with him. Vince Gasol attempts a Dunk. Contested by Collin Gasol (5.3 feet, MAN). Vince Gasol misses. Rebound secured by Collin Gasol.

================================================================================
                              4TH QUARTER COMPLETE                              
================================================================================

4TH QUARTER SCORE: Team_023 22, Team_014 22

BOX SCORE:
================================================================================

Team_023
--------------------------------------------------------------------------------
Player                MIN  PTS  REB  AST  TO      FG   FG%      3P   3P%
--------------------------------------------------------------------------------
Magic Booker           18    8    0    0   0   3/3   100.0     0/0   0.0
Tracy Anthony          24    5    0    0   0   2/3    66.7     0/0   0.0
Vince Gasol            18    4    2    2   0   2/5    40.0     0/0   0.0
Evan Parker            18    3    3    1   0   1/1   100.0     0/0   0.0
Josh Morant            31    2    0    0   0   1/1   100.0     0/0   0.0
Tim Bane               31    0    1    1   0   0/0     0.0     0/0   0.0
Collin Ginobili        31    0    0    0   0   0/1     0.0     0/0   0.0
Kyle Paul              29    0    0    0   0   0/1     0.0     0/0   0.0
Gary Westbrook         18    0    4    0   0   0/2     0.0     0/0   0.0

TEAM: FG: 9/17 (52.9%), 3PT: 3/7 (42.9%), REB: 9 (1 off, 8 def), AST: 4, TO: 3
TEAM FOULS: 7 [Team_014 in BONUS]


Team_014
--------------------------------------------------------------------------------
Player                MIN  PTS  REB  AST  TO      FG   FG%      3P   3P%
--------------------------------------------------------------------------------
Collin Gasol           18    8    4    0   0   4/6    66.7     0/0   0.0
Jalen Booker           22    6    0    2   0   2/3    66.7     0/0   0.0
Jordan Anunoby         31    3    0    0   0   1/1   100.0     0/0   0.0
Lamelo Simmons         31    2    1    1   0   1/2    50.0     0/0   0.0
Tracy Westbrook        18    2    1    0   0   1/2    50.0     0/0   0.0
Ayo Murray             31    0    4    2   0   0/0     0.0     0/0   0.0
DeMar Adebayo          31    0    1    0   0   0/0     0.0     0/0   0.0
Bones Quickley         18    0    0    0   0   0/3     0.0     0/0   0.0
Nikola James           18    0    3    0   0   0/1     0.0     0/0   0.0

TEAM: FG: 9/18 (50.0%), 3PT: 1/5 (20.0%), REB: 15 (7 off, 8 def), AST: 5, TO: 1
TEAM FOULS: 6 [Team_023 in BONUS]

================================================================================

================================================================================
                               FULL GAME COMPLETE                               
================================================================================

FINAL SCORE: Team_023 97, Team_014 110

SCORING BY QUARTER:
--------------------------------------------------------------------------------
Team                     Q1     Q2     Q3     Q4    FINAL
--------------------------------------------------------------------------------
Team_023                 26     30     19     22       97
Team_014                 21     33     34     22      110
--------------------------------------------------------------------------------

FULL GAME BOX SCORE:
================================================================================

Team_023
--------------------------------------------------------------------------------
Player                MIN  PTS  REB  AST  TO      FG   FG%      3P   3P%      FT STL BLK
--------------------------------------------------------------------------------
Collin Ginobili        31    4    0    0   0   3/11   27.3   0/6     0.0   0/2     0   0
Josh Morant            31   11    9    1   0   5/8    62.5   1/2    50.0   2/2     0   0
Tim Bane               31   17   15    3   4   5/6    83.3   1/1   100.0   6/8     1   1
Kyle Paul              29    0    1    1   1   1/9    11.1   1/6    16.7   0/0     1   0
Trae Ingram            26   17    0    2   2   9/9   100.0   1/1   100.0   8/9     0   0
Tracy Anthony          24   10    0    2   2   4/9    44.4   1/4    25.0   3/3     0   0
Magic Booker           18   13    0    2   0   6/7    85.7   3/4    75.0   0/0     0   0
Gary Westbrook         18    7    4    2   0   3/6    50.0   1/1   100.0   2/2     0   0
Evan Parker            18    9    7    3   1   4/5    80.0   0/0     0.0   1/1     0   0
Vince Gasol            18    9    3    3   2   3/8    37.5   1/4    25.0   2/2     2   0

TEAM: FG: 43/78 (55.1%), 3PT: 10/29 (34.5%), REB: 37 (7 off, 30 def), AST: 19, TO: 12


Team_014
--------------------------------------------------------------------------------
Player                MIN  PTS  REB  AST  TO      FG   FG%      3P   3P%      FT STL BLK
--------------------------------------------------------------------------------
Jordan Anunoby         31   13    0    5   0   5/8    62.5   2/5    40.0   3/3     0   0
Lamelo Simmons         31   15    1    2   3   6/13   46.2   2/6    33.3   1/1     1   0
DeMar Adebayo          31    9   11    0   1   3/5    60.0   1/3    33.3   2/2     0   0
Ayo Murray             31    2   15    5   1   1/5    20.0   0/1     0.0   1/2     1   0
Michael Cunningham     26   23    6    3   2   7/10   70.0   5/8    62.5   7/7     2   0
Jalen Booker           22   11    0    5   1   4/7    57.1   2/4    50.0   3/3     0   0
Bones Quickley         18    6    0    2   0   4/9    44.4   0/3     0.0   0/0     0   0
Tracy Westbrook        18   13    4    2   1   6/7    85.7   1/2    50.0   0/0     0   0
Nikola James           18    4    5    2   0   4/6    66.7   0/0     0.0   1/2     0   0
Collin Gasol           18   12    7    0   1   3/5    60.0   0/0     0.0   2/2     2   0

TEAM: FG: 44/76 (57.9%), 3PT: 13/32 (40.6%), REB: 51 (16 off, 35 def), AST: 26, TO: 10

================================================================================
