================================================================================
                        FULL GAME - Team_093 vs Team_056                        
================================================================================

================================================================================
                       1ST QUARTER - Team_093 vs Team_056                       
================================================================================

[12:00] Team_093 possession (Score: 0-0)
FOUL! Reach-in foul on Yao Poole during the drive. [Team fouls: 1] No free throws, side out. (Yao Poole: 1 personal fouls)

[11:44] Team_093 possession (Score: 0-0)
Carmelo Wagner attempts a 3Pt. Contested by Tony Carter (3.8 feet, MAN). Carmelo Wagner misses. Rebound secured by Jrue Lillard.

[11:29] Team_056 possession (Score: 0-0)
Yao Poole drives and kicks out. Yao Poole attempts a Midrange. Contested by Ben Cunningham (4.9 feet, ZONE). YAO POOLE MAKES IT! Assist: Jrue Lillard
Score: 0-2

[11:13] Team_093 possession (Score: 0-2)
FOUL! Shooting foul on Giannis Jokic. Damian Williamson to the line for 2 free throws. [Team fouls: 2] (Giannis Jokic: 1 personal fouls)   FT 1/2: GOOD   FT 2/2: MISS Damian Williamson makes 1/2 from the line. Rebound secured by Tony Carter.
Score: 1-2

[11:03] Team_056 possession (Score: 1-2)
FOUL! Reach-in foul on Carmelo Wagner during the drive. [Team fouls: 1] No free throws, side out. (Carmelo Wagner: 1 personal fouls)

[10:53] Team_056 possession (Score: 1-2)
Magic Russell makes the Layup and draws the foul on Trae Westbrook! And-1! Magic Russell to the line for 1. [Team fouls: 2] (Trae Westbrook: 1 personal fouls)   FT 1/1: GOOD Magic Russell makes 1/1 from the line.
Score: 1-5

[10:39] Team_093 possession (Score: 1-5)
Vince Barnes drives and kicks out. FOUL! Shooting foul on Jrue Lillard. Vince Barnes to the line for 2 free throws. [Team fouls: 3] (Jrue Lillard: 1 personal fouls)   FT 1/2: MISS   FT 2/2: GOOD Vince Barnes makes 1/2 from the line.
Score: 2-5

[10:28] Team_056 possession (Score: 2-5)
Giannis Jokic attempts a 3Pt. Contested by Damian Williamson (5.2 feet, MAN). Giannis Jokic misses. Rebound secured by Carmelo Wagner.

[10:16] Team_093 possession (Score: 2-5)
Trae Westbrook attempts a 3Pt. Contested by Giannis Jokic (4.1 feet, ZONE). TRAE WESTBROOK MAKES IT! Assist: Damian Williamson
Score: 5-5

[10:02] Team_056 possession (Score: 5-5)
Tony Carter drives to the basket... Tony Carter loses the ball! Stripped by Carmelo Wagner! TURNOVER! (live ball)

[09:45] Team_093 possession (Score: 5-5)
Vince Barnes drives, picks up Jrue Lillard. Help arrives from Giannis Jokic! Vince Barnes attempts a Layup. Contested by Giannis Jokic (4.0 feet, MAN). VINCE BARNES MAKES IT!
Score: 7-5

[09:31] Team_056 possession (Score: 7-5)
Magic Russell attempts a 3Pt. Contested by Trae Westbrook (5.8 feet, MAN). Magic Russell misses. Rebound secured by Ben Cunningham.

[09:13] Team_093 possession (Score: 7-5)
Vince Barnes attempts a Layup. Contested by Jrue Lillard (4.0 feet, MAN). VINCE BARNES MAKES IT! Assist: Carmelo Wagner
Score: 9-5

[09:00] Team_056 possession (Score: 9-5)
Tony Carter attempts a Midrange. Contested by Carmelo Wagner (4.0 feet, MAN). TONY CARTER MAKES IT!
Score: 9-7

[08:43] Team_093 possession (Score: 9-7)
Trae Westbrook attempts a 3Pt. Contested by Magic Russell (5.3 feet, MAN). Trae Westbrook misses. Rebound secured by Tony Carter.

[08:29] Team_056 possession (Score: 9-7)
Yao Poole attempts a Layup. Contested by Ben Cunningham (4.7 feet, MAN). Yao Poole misses. Rebound secured by Ben Cunningham.

[08:10] Team_093 possession (Score: 9-7)
Vince Barnes attempts a 3Pt. Contested by Giannis Jokic (4.5 feet, ZONE). Vince Barnes misses. Rebound secured by Tony Carter.

[07:59] Team_056 possession (Score: 9-7)
Magic Russell attempts a 3Pt. Contested by Carmelo Wagner (3.7 feet, ZONE). Magic Russell misses. Rebound secured by Vince Barnes.

[07:43] Team_093 possession (Score: 9-7)
FOUL! Reach-in foul on Jrue Lillard during the drive. [Team fouls: 4] No free throws, side out. (Jrue Lillard: 2 personal fouls)

[07:29] Team_093 possession (Score: 9-7)
FOUL! Holding foul on Magic Russell. [IN THE BONUS! 5 team fouls] Trae Westbrook to the line for 2 free throws. (Magic Russell: 1 personal fouls)   FT 1/2: GOOD   FT 2/2: GOOD Trae Westbrook makes 2/2 from the line.
Score: 11-7

[07:19] Team_056 possession (Score: 11-7)
FOUL! Offensive foul on Magic Russell! Trae Westbrook drew the charge! [Team fouls: 6] (Magic Russell: 2 personal fouls) TURNOVER! (dead ball)

[07:04] Team_093 possession (Score: 11-7)
FOUL! Shooting foul on Giannis Jokic. Damian Williamson to the line for 2 free throws. [BONUS: 7 team fouls] (Giannis Jokic: 2 personal fouls)   FT 1/2: MISS   FT 2/2: GOOD Damian Williamson makes 1/2 from the line.
Score: 12-7

[06:51] Team_056 possession (Score: 12-7)
FOUL! Reach-in foul on Ben Cunningham during the drive. [Team fouls: 3] No free throws, side out. (Ben Cunningham: 1 personal fouls)

[06:33] Team_056 possession (Score: 12-7)
Jrue Lillard attempts a 3Pt. Contested by Carmelo Wagner (4.0 feet, ZONE). JRUE LILLARD MAKES IT! Assist: Magic Russell
Score: 12-10

[06:18] Team_093 possession (Score: 12-10)
Ben Cunningham attempts a Midrange. Contested by Tony Carter (4.7 feet, ZONE). Ben Cunningham misses. Rebound secured by Yao Poole.

[06:03] Team_056 possession (Score: 12-10)
Magic Russell attempts a 3Pt. Contested by Trae Westbrook (5.8 feet, MAN). MAGIC RUSSELL MAKES IT! Assist: Giannis Jokic
Score: 12-13

[05:46] Team_093 possession (Score: 12-13)
Damian Williamson attempts a 3Pt. Contested by Jrue Lillard (3.8 feet, ZONE). Damian Williamson misses. Rebound secured by Yao Poole.

[05:31] Team_056 possession (Score: 12-13)
Jrue Lillard attempts a 3Pt. Contested by Vince Barnes (4.7 feet, ZONE). Jrue Lillard misses. Rebound secured by Vince Barnes.

[05:19] Team_093 possession (Score: 12-13)
FOUL! Reach-in foul on Tony Carter during the drive. [IN THE BONUS! 8 team fouls] Carmelo Wagner to the line for 2 free throws. (Tony Carter: 1 personal fouls)   FT 1/2: GOOD   FT 2/2: GOOD Carmelo Wagner makes 2/2 from the line.
Score: 14-13

[05:02] Team_056 possession (Score: 14-13)
Jrue Lillard attempts a 3Pt. Contested by Vince Barnes (4.7 feet, MAN). JRUE LILLARD MAKES IT! Assist: Magic Russell
Score: 14-16

[04:49] Team_093 possession (Score: 14-16)
Trae Westbrook attempts a Layup. Contested by Jrue Lillard (3.7 feet, ZONE). TRAE WESTBROOK MAKES IT!
Score: 16-16

[04:34] Team_056 possession (Score: 16-16)
FOUL! Shooting foul on Ben Cunningham. Yao Poole to the line for 2 free throws. [Team fouls: 4] (Ben Cunningham: 2 personal fouls)   FT 1/2: MISS   FT 2/2: MISS Yao Poole makes 0/2 from the line. Rebound secured by Ben Cunningham.

[04:17] Team_093 possession (Score: 16-16)
Damian Williamson makes the Dunk and draws the foul on Jrue Lillard! And-1! Damian Williamson to the line for 1. [BONUS: 9 team fouls] (Jrue Lillard: 3 personal fouls)   FT 1/1: GOOD Damian Williamson makes 1/1 from the line.
Score: 19-16

[04:03] Team_056 possession (Score: 19-16)
Tony Carter attempts a 3Pt. Contested by Carmelo Wagner (4.2 feet, MAN). Tony Carter misses. Rebound secured by Carmelo Wagner.

[03:48] Team_093 possession (Score: 19-16)
Ben Cunningham drives to the basket... Ben Cunningham throws a bad pass out of bounds! TURNOVER! (dead ball)

[03:35] Team_056 possession (Score: 19-16)
Giannis Jokic attempts a 3Pt. Contested by Carmelo Wagner (3.9 feet, ZONE). Giannis Jokic misses. Rebound secured by Vince Barnes.

[03:18] Team_093 possession (Score: 19-16)
FOUL! Offensive foul on Ben Cunningham! Yao Poole drew the charge! [Team fouls: 5] (Ben Cunningham: 3 personal fouls) TURNOVER! (dead ball)

[02:59] Team_056 possession (Score: 19-16)
FOUL! Shooting foul on Trae Westbrook. Magic Russell to the line for 2 free throws. [BONUS: 6 team fouls] (Trae Westbrook: 2 personal fouls)   FT 1/2: GOOD   FT 2/2: GOOD Magic Russell makes 2/2 from the line.
Score: 19-18

[02:48] Team_093 possession (Score: 19-18)
Vince Barnes attempts a Layup. BLOCKED BY JRUE LILLARD! Ball is loose! Offensive rebound by Ben Cunningham! Ben Cunningham kicks it out.

[02:29] Team_093 possession (Score: 19-18)
Ben Cunningham attempts a Layup. BLOCKED BY YAO POOLE! Ball is loose! Offensive rebound by Carmelo Wagner! Carmelo Wagner kicks it out.

[02:11] Team_093 possession (Score: 19-18)
FOUL! Shooting foul on Yao Poole. Vince Barnes to the line for 2 free throws. [BONUS: 10 team fouls] (Yao Poole: 2 personal fouls)   FT 1/2: GOOD   FT 2/2: GOOD Vince Barnes makes 2/2 from the line.
Score: 21-18

[02:00] Team_056 possession (Score: 21-18)
Tony Carter attempts a 3Pt. Contested by Carmelo Wagner (4.4 feet, ZONE). Tony Carter misses. Rebound secured by Carmelo Wagner.

[01:43] Team_093 possession (Score: 21-18)
Ben Cunningham drives and kicks out. Vince Barnes attempts a Midrange. Contested by Jrue Lillard (4.2 feet, MAN). Vince Barnes misses. Rebound secured by Yao Poole.

[01:25] Team_056 possession (Score: 21-18)
Yao Poole attempts a Layup. BLOCKED BY BEN CUNNINGHAM! Ball is loose! Rebound secured by Vince Barnes.

[01:05] Team_093 possession (Score: 21-18)
Vince Barnes drives and kicks out. Carmelo Wagner attempts a 3Pt. Contested by Tony Carter (4.5 feet, MAN). Carmelo Wagner misses. Rebound secured by Yao Poole.

[00:52] Team_056 possession (Score: 21-18)
Giannis Jokic attempts a Midrange. Contested by Damian Williamson (5.6 feet, MAN). Giannis Jokic misses. Rebound secured by Carmelo Wagner.

[00:37] Team_093 possession (Score: 21-18)
Carmelo Wagner attempts a Layup. BLOCKED BY JRUE LILLARD! Ball is loose! Offensive rebound by Ben Cunningham! Ben Cunningham kicks it out.

[00:22] Team_093 possession (Score: 21-18)
Ben Cunningham attempts a 3Pt. Contested by Giannis Jokic (5.2 feet, ZONE). Ben Cunningham misses. Rebound secured by Jrue Lillard.

[00:12] Team_056 possession (Score: 21-18)
FOUL! Shooting foul on Trae Westbrook. Magic Russell to the line for 2 free throws. [BONUS: 7 team fouls] (Trae Westbrook: 3 personal fouls)   FT 1/2: GOOD   FT 2/2: GOOD Magic Russell makes 2/2 from the line.
Score: 21-20

[00:01] Team_093 possession (Score: 21-20)
Damian Williamson attempts a 3Pt. Contested by Giannis Jokic (4.8 feet, ZONE). Damian Williamson misses. Rebound secured by Jrue Lillard.

================================================================================
                              1ST QUARTER COMPLETE                              
================================================================================

1ST QUARTER SCORE: Team_093 21, Team_056 20

BOX SCORE:
================================================================================

Team_093
--------------------------------------------------------------------------------
Player                MIN  PTS  REB  AST  TO      FG   FG%      3P   3P%
--------------------------------------------------------------------------------
Vince Barnes           12    7    4    0   0   4/6    66.7     0/0   0.0
Trae Westbrook         12    7    0    0   0   3/4    75.0     0/0   0.0
Damian Williamson      12    4    0    1   0   2/5    40.0     0/0   0.0
Carmelo Wagner         12    2    5    1   0   1/2    50.0     0/0   0.0
Ben Cunningham         12    0    5    0   0   0/3     0.0     0/0   0.0

TEAM: FG: 10/20 (50.0%), 3PT: 1/7 (14.3%), REB: 14 (3 off, 11 def), AST: 2, TO: 2
TEAM FOULS: 7 [Team_056 in BONUS]


Team_056
--------------------------------------------------------------------------------
Player                MIN  PTS  REB  AST  TO      FG   FG%      3P   3P%
--------------------------------------------------------------------------------
Magic Russell          12   10    0    2   0   4/6    66.7     0/0   0.0
Jrue Lillard           12    6    3    1   0   2/3    66.7     0/0   0.0
Yao Poole              12    2    4    0   0   1/4    25.0     0/0   0.0
Tony Carter            12    2    3    0   0   1/3    33.3     0/0   0.0
Giannis Jokic          12    0    0    1   0   0/3     0.0     0/0   0.0

TEAM: FG: 8/19 (42.1%), 3PT: 3/10 (30.0%), REB: 10 (0 off, 10 def), AST: 4, TO: 2
TEAM FOULS: 10 [Team_093 in BONUS]

================================================================================

================================================================================
                       2ND QUARTER - Team_093 vs Team_056                       
================================================================================

[12:00] Team_093 possession (Score: 21-20)
FOUL! Shooting foul on Giannis Jokic. Trae Westbrook to the line for 3 free throws. [Team fouls: 1] (Giannis Jokic: 1 personal fouls)   FT 1/3: MISS   FT 2/3: GOOD   FT 3/3: GOOD Trae Westbrook makes 2/3 from the line.
Score: 23-20

[11:44] Team_056 possession (Score: 23-20)
Magic Russell attempts a 3Pt. Wide open! Trae Westbrook is 6.0 feet away. [MAN] Magic Russell misses. Offensive rebound by Yao Poole! Yao Poole kicks it out.

[11:27] Team_056 possession (Score: 23-20)
FOUL! Shooting foul on Ben Cunningham. Magic Russell to the line for 2 free throws. [Team fouls: 1] (Ben Cunningham: 1 personal fouls)   FT 1/2: GOOD   FT 2/2: GOOD Magic Russell makes 2/2 from the line.
Score: 23-22

[11:11] Team_093 possession (Score: 23-22)
FOUL! Shooting foul on Magic Russell. Trae Westbrook to the line for 2 free throws. [Team fouls: 2] (Magic Russell: 1 personal fouls)   FT 1/2: GOOD   FT 2/2: GOOD Trae Westbrook makes 2/2 from the line.
Score: 25-22

[11:01] Team_056 possession (Score: 25-22)
Yao Poole attempts a Midrange. Contested by Ben Cunningham (5.1 feet, MAN). Yao Poole misses. Offensive rebound by Jrue Lillard! Jrue Lillard's putback is no good. Rebound secured by Ben Cunningham.

[10:47] Team_093 possession (Score: 25-22)
Trae Westbrook drives and kicks out. Carmelo Wagner attempts a 3Pt. Contested by Giannis Jokic (4.8 feet, ZONE). CARMELO WAGNER MAKES IT! Assist: Vince Barnes
Score: 28-22

[10:36] Team_056 possession (Score: 28-22)
Magic Russell attempts a 3Pt. Wide open! Trae Westbrook is 6.1 feet away. [MAN] MAGIC RUSSELL MAKES IT! Assist: Tony Carter
Score: 28-25

[10:21] Team_093 possession (Score: 28-25)
Damian Williamson attempts a Layup. BLOCKED BY JRUE LILLARD! Ball is loose! Rebound secured by Tony Carter.

[10:07] Team_056 possession (Score: 28-25)
Tony Carter drives and kicks out. Yao Poole attempts a 3Pt. Contested by Ben Cunningham (5.6 feet, MAN). Yao Poole misses. Rebound secured by Vince Barnes.

[09:56] Team_093 possession (Score: 28-25)
Ben Cunningham drives, Yao Poole stays with him. Ben Cunningham attempts a Layup. Contested by Yao Poole (5.2 feet, MAN). Ben Cunningham misses. Rebound secured by Tony Carter.

[09:38] Team_056 possession (Score: 28-25)
Jrue Lillard attempts a Midrange. Contested by Vince Barnes (5.2 feet, MAN). Jrue Lillard misses. Rebound secured by Vince Barnes.

[09:25] Team_093 possession (Score: 28-25)
Carmelo Wagner attempts a Midrange. Contested by Tony Carter (4.4 feet, MAN). Carmelo Wagner misses. Rebound secured by Jrue Lillard.

[09:11] Team_056 possession (Score: 28-25)
Jrue Lillard throws a bad pass! Stolen by Vince Barnes! TURNOVER! (live ball)

[09:00] Team_093 possession (Score: 28-25)
Vince Barnes drives and kicks out. Vince Barnes attempts a Midrange. Contested by Giannis Jokic (5.1 feet, ZONE). VINCE BARNES MAKES IT! Assist: Carmelo Wagner
Score: 30-25

[08:47] Team_056 possession (Score: 30-25)
FOUL! Offensive foul on Giannis Jokic! Damian Williamson drew the charge! [Team fouls: 3] (Giannis Jokic: 2 personal fouls) TURNOVER! (dead ball)

[08:28] Team_093 possession (Score: 30-25)
Trae Westbrook drives to the basket... Trae Westbrook loses the ball! Stripped by Magic Russell! TURNOVER! (live ball)

[08:11] Team_056 possession (Score: 30-25)
Magic Russell attempts a 3Pt. Wide open! Trae Westbrook is 6.3 feet away. [MAN] Magic Russell misses. Rebound secured by Carmelo Wagner.

[07:57] Team_093 possession (Score: 30-25)
Trae Westbrook attempts a 3Pt. Contested by Giannis Jokic (4.9 feet, ZONE). TRAE WESTBROOK MAKES IT! Assist: Vince Barnes
Score: 33-25

[07:43] Team_056 possession (Score: 33-25)
Tony Carter attempts a Midrange. Contested by Carmelo Wagner (5.0 feet, MAN). Tony Carter misses. Rebound secured by Ben Cunningham.

[07:28] Team_093 possession (Score: 33-25)
Vince Barnes attempts a Midrange. Wide open! Magic Russell is 6.4 feet away. [ZONE] Vince Barnes misses. Offensive rebound by Carmelo Wagner! Carmelo Wagner kicks it out.

[07:13] Team_093 possession (Score: 33-25)
Trae Westbrook attempts a Midrange. Wide open! Magic Russell is 6.1 feet away. [ZONE] Trae Westbrook misses. Offensive rebound by Carmelo Wagner! Carmelo Wagner kicks it out.

[07:00] Team_093 possession (Score: 33-25)
Carmelo Wagner attempts a Layup. Contested by Tony Carter (4.7 feet, MAN). Carmelo Wagner misses. Rebound secured by Jrue Lillard.

[06:45] Team_056 possession (Score: 33-25)
Giannis Jokic attempts a 3Pt. Contested by Carmelo Wagner (4.9 feet, ZONE). Giannis Jokic misses. Rebound secured by Carmelo Wagner.

[06:32] Team_093 possession (Score: 33-25)
Damian Williamson attempts a Midrange. Wide open! Magic Russell is 6.3 feet away. [ZONE] DAMIAN WILLIAMSON MAKES IT!
Score: 35-25

[06:18] Team_056 possession (Score: 35-25)
Jrue Lillard attempts a Layup. Wide open! Ben Cunningham is 6.6 feet away. [ZONE] JRUE LILLARD MAKES IT! Assist: Giannis Jokic
Score: 35-27

[06:08] Team_093 possession (Score: 35-27)
Ben Cunningham attempts a Layup. Contested by Yao Poole (5.8 feet, MAN). BEN CUNNINGHAM MAKES IT!
Score: 37-27

[05:51] Team_056 possession (Score: 37-27)
Tony Carter attempts a 3Pt. Contested by Carmelo Wagner (5.3 feet, MAN). Tony Carter misses. Offensive rebound by Jrue Lillard! Jrue Lillard kicks it out.

[05:36] Team_056 possession (Score: 37-27)
FOUL! Reach-in foul on Vince Barnes during the drive. [Team fouls: 2] No free throws, side out. (Vince Barnes: 1 personal fouls)

[05:21] Team_056 possession (Score: 37-27)
Tony Carter attempts a Layup. Wide open! Ben Cunningham is 6.8 feet away. [ZONE] TONY CARTER MAKES IT! Assist: Jrue Lillard
Score: 37-29

[05:03] Team_093 possession (Score: 37-29)
Trae Westbrook drives, Magic Russell stays with him. Trae Westbrook attempts a Layup. Wide open! Magic Russell is 6.4 feet away. [MAN] TRAE WESTBROOK MAKES IT!
Score: 39-29

[04:49] Team_056 possession (Score: 39-29)
Yao Poole attempts a Layup. Wide open! Ben Cunningham is 6.0 feet away. [ZONE] Yao Poole misses. Rebound secured by Ben Cunningham.

[04:31] Team_093 possession (Score: 39-29)
Ben Cunningham makes the Dunk and draws the foul on Jrue Lillard! And-1! Ben Cunningham to the line for 1. [Team fouls: 4] (Jrue Lillard: 1 personal fouls)   FT 1/1: GOOD Ben Cunningham makes 1/1 from the line.
Score: 42-29

[04:13] Team_056 possession (Score: 42-29)
Tony Carter makes the Layup and draws the foul on Trae Westbrook! And-1! Tony Carter to the line for 1. [Team fouls: 3] (Trae Westbrook: 1 personal fouls)   FT 1/1: GOOD Tony Carter makes 1/1 from the line.
Score: 42-32

[03:58] Team_093 possession (Score: 42-32)
FOUL! Shooting foul on Tony Carter. Trae Westbrook to the line for 3 free throws. [BONUS: 5 team fouls] (Tony Carter: 1 personal fouls)   FT 1/3: MISS   FT 2/3: GOOD   FT 3/3: GOOD Trae Westbrook makes 2/3 from the line.
Score: 44-32

[03:39] Team_056 possession (Score: 44-32)
Magic Russell attempts a 3Pt. Wide open! Trae Westbrook is 6.8 feet away. [MAN] Magic Russell misses. Offensive rebound by Yao Poole! Yao Poole kicks it out.

[03:26] Team_056 possession (Score: 44-32)
FOUL! Shooting foul on Vince Barnes. Jrue Lillard to the line for 2 free throws. [Team fouls: 4] (Vince Barnes: 2 personal fouls)   FT 1/2: GOOD   FT 2/2: MISS Jrue Lillard makes 1/2 from the line. Offensive rebound by Jrue Lillard! Jrue Lillard kicks it out.
Score: 44-33

[03:08] Team_056 possession (Score: 44-33)
Giannis Jokic attempts a 3Pt. Wide open! Damian Williamson is 6.7 feet away. [MAN] GIANNIS JOKIC MAKES IT! Assist: Jrue Lillard
Score: 44-36

[02:54] Team_093 possession (Score: 44-36)
Trae Westbrook attempts a 3Pt. Wide open! Magic Russell is 6.7 feet away. [MAN] TRAE WESTBROOK MAKES IT! Assist: Ben Cunningham
Score: 47-36

[02:37] Team_056 possession (Score: 47-36)
Tony Carter attempts a 3Pt. Contested by Carmelo Wagner (5.8 feet, ZONE). TONY CARTER MAKES IT! Assist: Yao Poole
Score: 47-39

[02:28] Team_093 possession (Score: 47-39)
Ben Cunningham attempts a Midrange. Contested by Jrue Lillard (5.8 feet, ZONE). Ben Cunningham misses. Rebound secured by Yao Poole.

[02:16] Team_056 possession (Score: 47-39)
Yao Poole attempts a Midrange. Contested by Carmelo Wagner (5.1 feet, ZONE). Yao Poole misses. Rebound secured by Carmelo Wagner.

[02:03] Team_093 possession (Score: 47-39)
Vince Barnes attempts a 3Pt. Contested by Jrue Lillard (5.7 feet, MAN). Vince Barnes misses. Rebound secured by Yao Poole.

[01:54] Team_056 possession (Score: 47-39)
Jrue Lillard drives to the basket... Jrue Lillard throws a bad pass out of bounds! TURNOVER! (dead ball)

[01:54] Substitution (Team_093): Damian Williamson OUT → Shaquille George IN (stamina_rule2)

[01:54] Substitution (Team_093): Trae Westbrook OUT → Immanuel Cunningham IN (stamina_rule2)

[01:54] Substitution (Team_093): Carmelo Wagner OUT → Lauri Parker IN (stamina_rule2)

[01:54] Substitution (Team_093): Vince Barnes OUT → Kobe Murray IN (stamina_rule2)

[01:54] Substitution (Team_093): Ben Cunningham OUT → Cade O'Neal IN (stamina_rule2)

[01:54] Substitution (Team_056): Giannis Jokic OUT → De'Aaron Murray IN (stamina_rule2)

[01:54] Substitution (Team_056): Magic Russell OUT → Damian Barrett IN (stamina_rule2)

[01:54] Substitution (Team_056): Tony Carter OUT → CJ Anthony IN (stamina_rule2)

[01:54] Substitution (Team_056): Jrue Lillard OUT → RJ Johnson IN (stamina_rule2)

[01:54] Substitution (Team_056): Yao Poole OUT → Derrick Bane IN (stamina_rule2)

[01:41] Team_093 possession (Score: 47-39)
Kobe Murray attempts a Midrange. Contested by RJ Johnson (4.4 feet, ZONE). Kobe Murray misses. Rebound secured by RJ Johnson.

[01:23] Team_056 possession (Score: 47-39)
Damian Barrett makes the Dunk and draws the foul on Immanuel Cunningham! And-1! Damian Barrett to the line for 1. [BONUS: 5 team fouls] (Immanuel Cunningham: 1 personal fouls)   FT 1/1: GOOD Damian Barrett makes 1/1 from the line.
Score: 47-42

[01:12] Team_093 possession (Score: 47-42)
Lauri Parker drives, RJ Johnson stays with him. Lauri Parker attempts a Layup. Contested by RJ Johnson (4.5 feet, ZONE). LAURI PARKER MAKES IT!
Score: 49-42

[00:56] Team_056 possession (Score: 49-42)
FOUL! Shooting foul on Shaquille George. CJ Anthony to the line for 2 free throws. [BONUS: 6 team fouls] (Shaquille George: 1 personal fouls)   FT 1/2: GOOD   FT 2/2: GOOD CJ Anthony makes 2/2 from the line.
Score: 49-44

[00:40] Team_093 possession (Score: 49-44)
Cade O'Neal attempts a Midrange. Contested by Derrick Bane (5.5 feet, MAN). Cade O'Neal misses. Rebound secured by CJ Anthony.

[00:24] Team_056 possession (Score: 49-44)
FOUL! Holding foul on Kobe Murray. [IN THE BONUS! 7 team fouls] Derrick Bane to the line for 2 free throws. (Kobe Murray: 1 personal fouls)   FT 1/2: GOOD   FT 2/2: GOOD Derrick Bane makes 2/2 from the line.
Score: 49-46

[00:08] Team_093 possession (Score: 49-46)
FOUL! Holding foul on RJ Johnson. [IN THE BONUS! 6 team fouls] Kobe Murray to the line for 2 free throws. (RJ Johnson: 1 personal fouls)   FT 1/2: GOOD   FT 2/2: GOOD Kobe Murray makes 2/2 from the line.
Score: 51-46

================================================================================
                              2ND QUARTER COMPLETE                              
================================================================================

2ND QUARTER SCORE: Team_093 30, Team_056 26

BOX SCORE:
================================================================================

Team_093
--------------------------------------------------------------------------------
Player                MIN  PTS  REB  AST  TO      FG   FG%      3P   3P%
--------------------------------------------------------------------------------
Trae Westbrook         23   14    0    0   0   6/6   100.0     0/0   0.0
Ben Cunningham         23    5    3    1   0   2/4    50.0     0/0   0.0
Carmelo Wagner         23    3    5    1   0   1/3    33.3     0/0   0.0
Vince Barnes           23    2    2    2   0   1/2    50.0     0/0   0.0
Damian Williamson      23    2    0    0   0   1/2    50.0     0/0   0.0
Kobe Murray             2    2    0    0   0   1/2    50.0     0/0   0.0
Lauri Parker            2    2    0    0   0   1/1   100.0     0/0   0.0
Cade O'Neal             2    0    0    0   0   0/1     0.0     0/0   0.0

TEAM: FG: 13/21 (61.9%), 3PT: 4/5 (80.0%), REB: 9 (2 off, 7 def), AST: 4, TO: 1
TEAM FOULS: 7 [Team_056 in BONUS]


Team_056
--------------------------------------------------------------------------------
Player                MIN  PTS  REB  AST  TO      FG   FG%      3P   3P%
--------------------------------------------------------------------------------
Tony Carter            23    8    2    1   0   3/5    60.0     0/0   0.0
Magic Russell          23    5    0    0   0   2/3    66.7     0/0   0.0
Giannis Jokic          23    3    0    1   0   1/2    50.0     0/0   0.0
Damian Barrett          2    3    0    0   0   1/1   100.0     0/0   0.0
Jrue Lillard           23    2    4    2   0   1/2    50.0     0/0   0.0
CJ Anthony              2    2    1    0   0   1/1   100.0     0/0   0.0
Derrick Bane            2    2    0    0   0   1/1   100.0     0/0   0.0
Yao Poole              23    0    4    1   0   0/3     0.0     0/0   0.0
RJ Johnson              2    0    1    0   0   0/0     0.0     0/0   0.0

TEAM: FG: 10/18 (55.6%), 3PT: 3/5 (60.0%), REB: 13 (5 off, 8 def), AST: 5, TO: 3
TEAM FOULS: 6 [Team_093 in BONUS]

================================================================================

================================================================================
                       3RD QUARTER - Team_093 vs Team_056                       
================================================================================

[12:00] Team_093 possession (Score: 51-46)
Damian Williamson drives and kicks out. Ben Cunningham attempts a 3Pt. Contested by Giannis Jokic (4.3 feet, ZONE). Ben Cunningham misses. Rebound secured by Jrue Lillard.

[11:45] Team_056 possession (Score: 51-46)
Yao Poole drives, Ben Cunningham stays with him. Yao Poole attempts a Layup. Contested by Ben Cunningham (4.7 feet, MAN). Yao Poole misses. FOUL! Loose ball foul on Ben Cunningham during the rebound battle. [Team fouls: 1] No free throws, side out. (Ben Cunningham: 1 personal fouls)

[11:28] Team_056 possession (Score: 51-46)
Tony Carter attempts a 3Pt. Contested by Carmelo Wagner (4.0 feet, ZONE). Tony Carter misses. Offensive rebound by Jrue Lillard! Jrue Lillard puts it back in!
Score: 51-48

[11:14] Team_093 possession (Score: 51-48)
FOUL! Shooting foul on Tony Carter. Carmelo Wagner to the line for 2 free throws. [Team fouls: 1] (Tony Carter: 1 personal fouls)   FT 1/2: GOOD   FT 2/2: GOOD Carmelo Wagner makes 2/2 from the line.
Score: 53-48

[11:00] Team_056 possession (Score: 53-48)
Magic Russell attempts a Midrange. Contested by Vince Barnes (4.5 feet, ZONE). Magic Russell misses. Rebound secured by Ben Cunningham.

[10:47] Team_093 possession (Score: 53-48)
Damian Williamson throws a bad pass! Stolen by Giannis Jokic! TURNOVER! (live ball)

[10:34] Team_056 possession (Score: 53-48)
Tony Carter attempts a 3Pt. Contested by Damian Williamson (5.5 feet, ZONE). Tony Carter misses. Rebound secured by Ben Cunningham.

[10:18] Team_093 possession (Score: 53-48)
Carmelo Wagner drives and kicks out. Trae Westbrook attempts a 3Pt. Contested by Giannis Jokic (4.3 feet, ZONE). TRAE WESTBROOK MAKES IT! Assist: Vince Barnes
Score: 56-48

[10:04] Team_056 possession (Score: 56-48)
FOUL! Reach-in foul on Vince Barnes during the drive. [Team fouls: 2] No free throws, side out. (Vince Barnes: 1 personal fouls)

[09:47] Team_056 possession (Score: 56-48)
Yao Poole attempts a Midrange. Contested by Ben Cunningham (4.7 feet, MAN). Yao Poole misses. Rebound secured by Ben Cunningham.

[09:29] Team_093 possession (Score: 56-48)
Damian Williamson drives and kicks out. Damian Williamson attempts a 3Pt. Contested by Giannis Jokic (4.3 feet, MAN). Damian Williamson misses. Rebound secured by Jrue Lillard.

[09:14] Team_056 possession (Score: 56-48)
Tony Carter attempts a 3Pt. Contested by Carmelo Wagner (4.0 feet, ZONE). Tony Carter misses. Rebound secured by Vince Barnes.

[08:58] Team_093 possession (Score: 56-48)
Damian Williamson drives and kicks out. Damian Williamson attempts a 3Pt. Contested by Giannis Jokic (4.3 feet, ZONE). Damian Williamson misses. Rebound secured by Jrue Lillard.

[08:46] Team_056 possession (Score: 56-48)
Yao Poole drives to the basket... Yao Poole loses control! Ball rolls out of bounds! TURNOVER! (dead ball)

[08:32] Team_093 possession (Score: 56-48)
Vince Barnes attempts a 3Pt. Contested by Giannis Jokic (4.5 feet, ZONE). Vince Barnes misses. Rebound secured by Yao Poole.

[08:20] Team_056 possession (Score: 56-48)
Giannis Jokic attempts a 3Pt. Contested by Damian Williamson (5.2 feet, MAN). Giannis Jokic misses. Rebound secured by Carmelo Wagner.

[08:04] Team_093 possession (Score: 56-48)
Ben Cunningham attempts a Midrange. Contested by Jrue Lillard (4.3 feet, ZONE). Ben Cunningham misses. Offensive rebound by Carmelo Wagner! Carmelo Wagner kicks it out.

[07:45] Team_093 possession (Score: 56-48)
Damian Williamson drives to the basket... FOUL! Offensive foul on Damian Williamson! Jrue Lillard drew the charge! [Team fouls: 3] (Damian Williamson: 1 personal fouls) TURNOVER! (dead ball)

[07:29] Team_056 possession (Score: 56-48)
FOUL! Shooting foul on Ben Cunningham. Magic Russell to the line for 2 free throws. [Team fouls: 4] (Ben Cunningham: 2 personal fouls)   FT 1/2: GOOD   FT 2/2: GOOD Magic Russell makes 2/2 from the line.
Score: 56-50

[07:15] Team_093 possession (Score: 56-50)
Carmelo Wagner throws a bad pass out of bounds! TURNOVER! (dead ball)

[07:03] Team_056 possession (Score: 56-50)
Tony Carter attempts a 3Pt. Contested by Carmelo Wagner (4.0 feet, ZONE). Tony Carter misses. Rebound secured by Vince Barnes.

[06:49] Team_093 possession (Score: 56-50)
Damian Williamson drives and kicks out. Trae Westbrook attempts a 3Pt. Contested by Magic Russell (5.5 feet, MAN). Trae Westbrook misses. Rebound secured by Yao Poole.

[06:37] Team_056 possession (Score: 56-50)
Yao Poole drives and kicks out. Magic Russell attempts a Midrange. Contested by Trae Westbrook (5.4 feet, MAN). Magic Russell misses. Offensive rebound by Yao Poole! Yao Poole kicks it out.

[06:24] Team_056 possession (Score: 56-50)
Jrue Lillard attempts a 3Pt. Contested by Vince Barnes (4.7 feet, MAN). Jrue Lillard misses. Rebound secured by Carmelo Wagner.

[06:06] Team_093 possession (Score: 56-50)
Damian Williamson attempts a 3Pt. Contested by Giannis Jokic (4.3 feet, MAN). Damian Williamson misses. Offensive rebound by Carmelo Wagner! Carmelo Wagner kicks it out.

[05:55] Team_093 possession (Score: 56-50)
Carmelo Wagner attempts a 3Pt. Contested by Tony Carter (3.8 feet, MAN). Carmelo Wagner misses. Rebound secured by Yao Poole.

[05:42] Team_056 possession (Score: 56-50)
Tony Carter attempts a 3Pt. Contested by Carmelo Wagner (4.1 feet, ZONE). Tony Carter misses. Rebound secured by Vince Barnes.

[05:25] Team_093 possession (Score: 56-50)
Ben Cunningham attempts a 3Pt. Contested by Giannis Jokic (4.8 feet, ZONE). Ben Cunningham misses. Offensive rebound by Carmelo Wagner! Carmelo Wagner kicks it out.

[05:14] Team_093 possession (Score: 56-50)
Ben Cunningham attempts a 3Pt. Contested by Yao Poole (4.6 feet, MAN). Ben Cunningham misses. Rebound secured by Jrue Lillard.

[04:57] Team_056 possession (Score: 56-50)
Tony Carter attempts a Layup. Contested by Carmelo Wagner (4.1 feet, MAN). Tony Carter misses. Rebound secured by Carmelo Wagner.

[04:46] Team_093 possession (Score: 56-50)
Ben Cunningham attempts a Midrange. Wide open! Magic Russell is 6.1 feet away. [ZONE] Ben Cunningham misses. Rebound secured by Tony Carter.

[04:30] Team_056 possession (Score: 56-50)
Magic Russell attempts a 3Pt. Contested by Trae Westbrook (5.8 feet, MAN). MAGIC RUSSELL MAKES IT! Assist: Yao Poole
Score: 56-53

[04:15] Team_093 possession (Score: 56-53)
Carmelo Wagner attempts a Midrange. Contested by Magic Russell (5.3 feet, ZONE). Carmelo Wagner misses. Rebound secured by Jrue Lillard.

[04:00] Team_056 possession (Score: 56-53)
FOUL! Offensive foul on Jrue Lillard! Vince Barnes drew the charge! [Team fouls: 2] (Jrue Lillard: 1 personal fouls) TURNOVER! (dead ball)

[03:45] Team_093 possession (Score: 56-53)
Damian Williamson attempts a Midrange. Contested by Jrue Lillard (3.9 feet, ZONE). Damian Williamson misses. Rebound secured by Jrue Lillard.

[03:31] Team_056 possession (Score: 56-53)
FOUL! Reach-in foul on Ben Cunningham during the drive. [IN THE BONUS! 5 team fouls] Tony Carter to the line for 2 free throws. (Ben Cunningham: 3 personal fouls)   FT 1/2: GOOD   FT 2/2: GOOD Tony Carter makes 2/2 from the line.
Score: 56-55

[03:17] Team_093 possession (Score: 56-55)
Ben Cunningham makes the Dunk and draws the foul on Jrue Lillard! And-1! Ben Cunningham to the line for 1. [Team fouls: 3] (Jrue Lillard: 2 personal fouls)   FT 1/1: GOOD Ben Cunningham makes 1/1 from the line.
Score: 59-55

[03:04] Team_056 possession (Score: 59-55)
Giannis Jokic attempts a 3Pt. Contested by Carmelo Wagner (4.0 feet, ZONE). Giannis Jokic misses. Rebound secured by Vince Barnes.

[02:51] Team_093 possession (Score: 59-55)
Ben Cunningham attempts a Layup. Contested by Jrue Lillard (4.5 feet, ZONE). BEN CUNNINGHAM MAKES IT!
Score: 61-55

[02:35] Team_056 possession (Score: 61-55)
Jrue Lillard makes the Layup and draws the foul on Ben Cunningham! And-1! Jrue Lillard to the line for 1. [BONUS: 6 team fouls] (Ben Cunningham: 4 personal fouls)   FT 1/1: GOOD Jrue Lillard makes 1/1 from the line.
Score: 61-58

[02:20] Team_093 possession (Score: 61-58)
Vince Barnes drives to the basket... Vince Barnes loses control! Ball rolls out of bounds! TURNOVER! (dead ball)

[02:20] Substitution (Team_093): Damian Williamson OUT → Shaquille George IN (stamina_rule2)

[02:20] Substitution (Team_093): Trae Westbrook OUT → Immanuel Cunningham IN (stamina_rule2)

[02:20] Substitution (Team_093): Carmelo Wagner OUT → Lauri Parker IN (stamina_rule2)

[02:20] Substitution (Team_093): Vince Barnes OUT → Kobe Murray IN (stamina_rule2)

[02:20] Substitution (Team_093): Ben Cunningham OUT → Cade O'Neal IN (stamina_rule2)

[02:20] Substitution (Team_056): Giannis Jokic OUT → De'Aaron Murray IN (stamina_rule2)

[02:20] Substitution (Team_056): Magic Russell OUT → Damian Barrett IN (stamina_rule2)

[02:20] Substitution (Team_056): Tony Carter OUT → CJ Anthony IN (stamina_rule2)

[02:20] Substitution (Team_056): Jrue Lillard OUT → RJ Johnson IN (stamina_rule2)

[02:20] Substitution (Team_056): Yao Poole OUT → Derrick Bane IN (stamina_rule2)

[02:03] Team_056 possession (Score: 61-58)
CJ Anthony attempts a Midrange. Contested by Lauri Parker (4.5 feet, MAN). CJ Anthony misses. Rebound secured by Lauri Parker.

[01:53] Team_093 possession (Score: 61-58)
Lauri Parker attempts a 3Pt. Contested by CJ Anthony (4.3 feet, MAN). Lauri Parker misses. Rebound secured by CJ Anthony.

[01:37] Team_056 possession (Score: 61-58)
De'Aaron Murray drives, Kobe Murray stays with him. De'Aaron Murray attempts a Dunk. Contested by Kobe Murray (4.2 feet, ZONE). DE'AARON MURRAY MAKES IT! Assist: CJ Anthony
Score: 61-60

[01:22] Team_093 possession (Score: 61-60)
Lauri Parker drives and kicks out. Lauri Parker attempts a 3Pt. Contested by CJ Anthony (4.2 feet, MAN). Lauri Parker misses. FOUL! Loose ball foul on Derrick Bane during the rebound battle. [Team fouls: 4] No free throws, side out. (Derrick Bane: 1 personal fouls)

[01:04] Team_093 possession (Score: 61-60)
Immanuel Cunningham makes the Midrange and draws the foul on Damian Barrett! And-1! Immanuel Cunningham to the line for 1. [BONUS: 5 team fouls] (Damian Barrett: 1 personal fouls)   FT 1/1: GOOD Immanuel Cunningham makes 1/1 from the line.
Score: 64-60

[00:50] Team_056 possession (Score: 64-60)
CJ Anthony makes the Layup and draws the foul on Kobe Murray! And-1! CJ Anthony to the line for 1. [BONUS: 7 team fouls] (Kobe Murray: 1 personal fouls)   FT 1/1: GOOD CJ Anthony makes 1/1 from the line.
Score: 64-63

[00:33] Team_093 possession (Score: 64-63)
Shaquille George attempts a 3Pt. Wide open! De'Aaron Murray is 6.2 feet away. [MAN] Shaquille George misses. Rebound secured by CJ Anthony.

[00:20] Team_056 possession (Score: 64-63)
RJ Johnson drives and kicks out. FOUL! Shooting foul on Lauri Parker. CJ Anthony to the line for 3 free throws. [BONUS: 8 team fouls] (Lauri Parker: 1 personal fouls)   FT 1/3: GOOD   FT 2/3: MISS   FT 3/3: MISS CJ Anthony makes 1/3 from the line. Rebound secured by Kobe Murray.
Score: 64-64

[00:06] Team_093 possession (Score: 64-64)
Kobe Murray attempts a 3Pt. Contested by RJ Johnson (4.4 feet, MAN). KOBE MURRAY MAKES IT! Assist: Shaquille George
Score: 67-64

================================================================================
                              3RD QUARTER COMPLETE                              
================================================================================

3RD QUARTER SCORE: Team_093 16, Team_056 18

BOX SCORE:
================================================================================

Team_093
--------------------------------------------------------------------------------
Player                MIN  PTS  REB  AST  TO      FG   FG%      3P   3P%
--------------------------------------------------------------------------------
Ben Cunningham         32    5    3    0   0   2/4    50.0     0/0   0.0
Trae Westbrook         32    3    0    0   0   1/1   100.0     0/0   0.0
Immanuel Cunningham     4    3    0    0   0   1/1   100.0     0/0   0.0
Kobe Murray             4    3    1    0   0   1/1   100.0     0/0   0.0
Carmelo Wagner         32    2    6    0   0   1/3    33.3     0/0   0.0
Damian Williamson      32    0    0    0   0   0/5     0.0     0/0   0.0
Vince Barnes           32    0    4    1   0   0/1     0.0     0/0   0.0
Lauri Parker            4    0    1    0   0   0/1     0.0     0/0   0.0
Cade O'Neal             4    0    1    0   0   0/0     0.0     0/0   0.0
Shaquille George        4    0    0    1   0   0/1     0.0     0/0   0.0

TEAM: FG: 6/18 (33.3%), 3PT: 1/6 (16.7%), REB: 16 (4 off, 12 def), AST: 2, TO: 4
TEAM FOULS: 8 [Team_056 in BONUS]


Team_056
--------------------------------------------------------------------------------
Player                MIN  PTS  REB  AST  TO      FG   FG%      3P   3P%
--------------------------------------------------------------------------------
Jrue Lillard           32    5    7    0   0   2/3    66.7     0/0   0.0
Magic Russell          32    5    0    0   0   2/3    66.7     0/0   0.0
CJ Anthony              4    3    2    1   0   1/2    50.0     0/0   0.0
Tony Carter            32    2    1    0   0   1/6    16.7     0/0   0.0
De'Aaron Murray         4    2    0    0   0   1/1   100.0     0/0   0.0
Yao Poole              32    0    5    1   0   0/1     0.0     0/0   0.0
Giannis Jokic          32    0    0    0   0   0/2     0.0     0/0   0.0
RJ Johnson              4    0    0    0   0   0/1     0.0     0/0   0.0

TEAM: FG: 7/19 (36.8%), 3PT: 2/9 (22.2%), REB: 15 (3 off, 12 def), AST: 2, TO: 2
TEAM FOULS: 5 [Team_093 in BONUS]

================================================================================

================================================================================
                       4TH QUARTER - Team_093 vs Team_056                       
================================================================================

[12:00] Team_093 possession (Score: 67-64)
FOUL! Reach-in foul on Jrue Lillard during the drive. [Team fouls: 1] No free throws, side out. (Jrue Lillard: 1 personal fouls)

[11:49] Team_093 possession (Score: 67-64)
Ben Cunningham attempts a Midrange. Contested by Tony Carter (4.7 feet, ZONE). Ben Cunningham misses. Rebound secured by Jrue Lillard.

[11:36] Team_056 possession (Score: 67-64)
Yao Poole drives, picks up Vince Barnes. Help arrives from Trae Westbrook! Yao Poole attempts a Layup. Contested by Trae Westbrook (3.8 feet, ZONE). YAO POOLE MAKES IT!
Score: 67-66

[11:19] Team_093 possession (Score: 67-66)
Damian Williamson attempts a Midrange. Contested by Giannis Jokic (4.3 feet, MAN). Damian Williamson misses. Rebound secured by Jrue Lillard.

[11:03] Team_056 possession (Score: 67-66)
Jrue Lillard attempts a Midrange. Contested by Vince Barnes (4.8 feet, MAN). JRUE LILLARD MAKES IT! Assist: Giannis Jokic
Score: 67-68

[10:51] Team_093 possession (Score: 67-68)
Damian Williamson makes the Dunk and draws the foul on Giannis Jokic! And-1! Damian Williamson to the line for 1. [Team fouls: 2] (Giannis Jokic: 1 personal fouls)   FT 1/1: GOOD Damian Williamson makes 1/1 from the line.
Score: 70-68

[10:36] Team_056 possession (Score: 70-68)
Yao Poole drives and kicks out. Magic Russell attempts a 3Pt. Contested by Carmelo Wagner (3.6 feet, ZONE). MAGIC RUSSELL MAKES IT! Assist: Giannis Jokic
Score: 70-71

[10:22] Team_093 possession (Score: 70-71)
Carmelo Wagner attempts a 3Pt. BLOCKED BY GIANNIS JOKIC! Ball is loose! Rebound secured by Tony Carter.

[10:08] Team_056 possession (Score: 70-71)
Jrue Lillard attempts a Midrange. Contested by Damian Williamson (5.7 feet, ZONE). Jrue Lillard misses. Offensive rebound by Jrue Lillard! Jrue Lillard puts it back in!
Score: 70-73

[09:55] Team_093 possession (Score: 70-73)
Carmelo Wagner drives and kicks out. Trae Westbrook attempts a 3Pt. Contested by Magic Russell (5.7 feet, MAN). TRAE WESTBROOK MAKES IT! Assist: Ben Cunningham
Score: 73-73

[09:43] Team_056 possession (Score: 73-73)
Giannis Jokic attempts a 3Pt. Contested by Damian Williamson (5.5 feet, MAN). GIANNIS JOKIC MAKES IT! Assist: Yao Poole
Score: 73-76

[09:26] Team_093 possession (Score: 73-76)
Ben Cunningham attempts a 3Pt. Contested by Yao Poole (4.9 feet, MAN). Ben Cunningham misses. Rebound secured by Tony Carter.

[09:12] Team_056 possession (Score: 73-76)
Magic Russell attempts a Layup. Contested by Ben Cunningham (5.6 feet, ZONE). Magic Russell misses. Rebound secured by Ben Cunningham.

[09:01] Team_093 possession (Score: 73-76)
Vince Barnes attempts a Midrange. Contested by Magic Russell (6.0 feet, ZONE). VINCE BARNES MAKES IT!
Score: 75-76

[08:47] Team_056 possession (Score: 75-76)
Magic Russell attempts a 3Pt. Contested by Carmelo Wagner (4.1 feet, ZONE). Magic Russell misses. Rebound secured by Carmelo Wagner.

[08:32] Team_093 possession (Score: 75-76)
FOUL! Holding foul on Yao Poole. [Team fouls: 3] No free throws, side out. (Yao Poole: 1 personal fouls)

[08:19] Team_093 possession (Score: 75-76)
FOUL! Shooting foul on Giannis Jokic. Vince Barnes to the line for 3 free throws. [Team fouls: 4] (Giannis Jokic: 2 personal fouls)   FT 1/3: GOOD   FT 2/3: GOOD   FT 3/3: GOOD Vince Barnes makes 3/3 from the line.
Score: 78-76

[08:08] Team_056 possession (Score: 78-76)
Jrue Lillard drives to the basket... FOUL! Offensive foul on Jrue Lillard! Ben Cunningham drew the charge! [Team fouls: 5] (Jrue Lillard: 2 personal fouls) TURNOVER! (dead ball)

[07:56] Team_093 possession (Score: 78-76)
FOUL! Reach-in foul on Magic Russell during the drive. [IN THE BONUS! 6 team fouls] Trae Westbrook to the line for 2 free throws. (Magic Russell: 1 personal fouls)   FT 1/2: GOOD   FT 2/2: GOOD Trae Westbrook makes 2/2 from the line.
Score: 80-76

[07:43] Team_056 possession (Score: 80-76)
Jrue Lillard attempts a Midrange. Contested by Vince Barnes (5.1 feet, MAN). Jrue Lillard misses. Rebound secured by Ben Cunningham.

[07:27] Team_093 possession (Score: 80-76)
Carmelo Wagner attempts a 3Pt. Contested by Giannis Jokic (4.5 feet, ZONE). Carmelo Wagner misses. Rebound secured by Jrue Lillard.

[07:11] Team_056 possession (Score: 80-76)
FOUL! Shooting foul on Carmelo Wagner. Tony Carter to the line for 2 free throws. [Team fouls: 1] (Carmelo Wagner: 1 personal fouls)   FT 1/2: GOOD   FT 2/2: GOOD Tony Carter makes 2/2 from the line.
Score: 80-78

[06:57] Team_093 possession (Score: 80-78)
Damian Williamson attempts a 3Pt. Contested by Giannis Jokic (4.8 feet, ZONE). DAMIAN WILLIAMSON MAKES IT! Assist: Carmelo Wagner
Score: 83-78

[06:43] Team_056 possession (Score: 83-78)
Magic Russell drives, Trae Westbrook stays with him. Magic Russell attempts a Dunk. Wide open! Trae Westbrook is 6.2 feet away. [MAN] MAGIC RUSSELL MAKES IT! Assist: Yao Poole
Score: 83-80

[06:31] Team_093 possession (Score: 83-80)
Trae Westbrook drives and kicks out. Vince Barnes attempts a 3Pt. Contested by Giannis Jokic (5.0 feet, ZONE). Vince Barnes misses. Offensive rebound by Ben Cunningham! Ben Cunningham kicks it out.

[06:17] Team_093 possession (Score: 83-80)
Trae Westbrook attempts a Midrange. Contested by Jrue Lillard (4.3 feet, ZONE). Trae Westbrook misses. Offensive rebound by Carmelo Wagner! Carmelo Wagner kicks it out.

[06:02] Team_093 possession (Score: 83-80)
Ben Cunningham attempts a 3Pt. Contested by Giannis Jokic (5.4 feet, ZONE). BEN CUNNINGHAM MAKES IT! Assist: Damian Williamson
Score: 86-80

[05:47] Team_056 possession (Score: 86-80)
Tony Carter attempts a 3Pt. Contested by Carmelo Wagner (4.9 feet, ZONE). Tony Carter misses. Offensive rebound by Jrue Lillard! Jrue Lillard's putback is no good. Rebound secured by Ben Cunningham.

[05:30] Team_093 possession (Score: 86-80)
Carmelo Wagner attempts a 3Pt. Contested by Giannis Jokic (4.8 feet, ZONE). CARMELO WAGNER MAKES IT! Assist: Vince Barnes
Score: 89-80

[05:16] Team_056 possession (Score: 89-80)
Tony Carter attempts a 3Pt. Wide open! Trae Westbrook is 6.6 feet away. [ZONE] Tony Carter misses. Rebound secured by Vince Barnes.

[05:01] Team_093 possession (Score: 89-80)
Trae Westbrook attempts a Layup. Wide open! Magic Russell is 6.1 feet away. [MAN] TRAE WESTBROOK MAKES IT! Assist: Ben Cunningham
Score: 91-80

[04:47] Team_056 possession (Score: 91-80)
Giannis Jokic attempts a 3Pt. Wide open! Damian Williamson is 6.1 feet away. [MAN] GIANNIS JOKIC MAKES IT! Assist: Magic Russell
Score: 91-83

[04:32] Team_093 possession (Score: 91-83)
Carmelo Wagner makes the Midrange and draws the foul on Jrue Lillard! And-1! Carmelo Wagner to the line for 1. [BONUS: 7 team fouls] (Jrue Lillard: 3 personal fouls)   FT 1/1: GOOD Carmelo Wagner makes 1/1 from the line.
Score: 94-83

[04:18] Team_056 possession (Score: 94-83)
Magic Russell attempts a 3Pt. Wide open! Trae Westbrook is 6.4 feet away. [MAN] MAGIC RUSSELL MAKES IT! Assist: Giannis Jokic
Score: 94-86

[04:01] Team_093 possession (Score: 94-86)
Carmelo Wagner attempts a 3Pt. Contested by Tony Carter (4.7 feet, MAN). Carmelo Wagner misses. Rebound secured by Yao Poole.

[03:43] Team_056 possession (Score: 94-86)
Giannis Jokic loses the ball! Stripped by Damian Williamson! TURNOVER! (live ball)

[03:29] Team_093 possession (Score: 94-86)
Ben Cunningham attempts a 3Pt. Contested by Jrue Lillard (5.3 feet, ZONE). Ben Cunningham misses. Offensive rebound by Carmelo Wagner! Carmelo Wagner kicks it out.

[03:16] Team_093 possession (Score: 94-86)
Ben Cunningham drives to the basket... Ben Cunningham commits a violation (traveling/carry)! TURNOVER! (dead ball)

[03:16] Substitution (Team_093): Damian Williamson OUT → Shaquille George IN (stamina_rule2)

[03:16] Substitution (Team_093): Trae Westbrook OUT → Immanuel Cunningham IN (stamina_rule2)

[03:16] Substitution (Team_093): Carmelo Wagner OUT → Lauri Parker IN (stamina_rule2)

[03:16] Substitution (Team_093): Vince Barnes OUT → Kobe Murray IN (stamina_rule2)

[03:16] Substitution (Team_093): Ben Cunningham OUT → Cade O'Neal IN (stamina_rule2)

[03:16] Substitution (Team_056): Giannis Jokic OUT → De'Aaron Murray IN (stamina_rule2)

[03:16] Substitution (Team_056): Magic Russell OUT → Damian Barrett IN (stamina_rule2)

[03:16] Substitution (Team_056): Tony Carter OUT → CJ Anthony IN (stamina_rule2)

[03:16] Substitution (Team_056): Jrue Lillard OUT → RJ Johnson IN (stamina_rule2)

[03:16] Substitution (Team_056): Yao Poole OUT → Derrick Bane IN (stamina_rule2)

[03:01] Team_056 possession (Score: 94-86)
CJ Anthony attempts a 3Pt. Contested by Lauri Parker (4.5 feet, MAN). CJ ANTHONY MAKES IT! Assist: De'Aaron Murray
Score: 94-89

[02:46] Team_093 possession (Score: 94-89)
Lauri Parker attempts a 3Pt. Contested by CJ Anthony (4.3 feet, MAN). LAURI PARKER MAKES IT! Assist: Shaquille George
Score: 97-89

[02:32] Team_056 possession (Score: 97-89)
De'Aaron Murray throws a bad pass out of bounds! TURNOVER! (dead ball)

[02:22] Team_093 possession (Score: 97-89)
Lauri Parker attempts a Midrange. Contested by Damian Barrett (5.6 feet, ZONE). Lauri Parker misses. Rebound secured by Derrick Bane.

[02:07] Team_056 possession (Score: 97-89)
RJ Johnson drives and kicks out. RJ Johnson attempts a 3Pt. Contested by Kobe Murray (4.1 feet, MAN). RJ Johnson misses. Rebound secured by Kobe Murray.

[01:53] Team_093 possession (Score: 97-89)
Immanuel Cunningham attempts a 3Pt. Wide open! De'Aaron Murray is 6.1 feet away. [ZONE] Immanuel Cunningham misses. FOUL! Loose ball foul on RJ Johnson during the rebound battle. [IN THE BONUS! 8 team fouls] Cade O'Neal to the line for 2 free throws. (RJ Johnson: 1 personal fouls)   FT 1/2: GOOD   FT 2/2: GOOD Cade O'Neal makes 2/2 from the line.
Score: 99-89

[01:38] Team_056 possession (Score: 99-89)
CJ Anthony attempts a 3Pt. Contested by Shaquille George (4.3 feet, ZONE). CJ Anthony misses. Rebound secured by Cade O'Neal.

[01:21] Team_093 possession (Score: 99-89)
Cade O'Neal attempts a Midrange. Contested by CJ Anthony (4.3 feet, ZONE). Cade O'Neal misses. Offensive rebound by Kobe Murray! Kobe Murray puts it back in!
Score: 101-89

[01:10] Team_056 possession (Score: 101-89)
Derrick Bane makes the 3Pt and draws the foul on Shaquille George! And-1! Derrick Bane to the line for 1. [Team fouls: 2] (Shaquille George: 1 personal fouls)   FT 1/1: GOOD Derrick Bane makes 1/1 from the line.
Score: 101-93

[00:58] Team_093 possession (Score: 101-93)
Cade O'Neal attempts a Midrange. Contested by CJ Anthony (4.3 feet, ZONE). Cade O'Neal misses. Rebound secured by CJ Anthony.

[00:45] Team_056 possession (Score: 101-93)
Damian Barrett attempts a 3Pt. Contested by Immanuel Cunningham (5.8 feet, MAN). DAMIAN BARRETT MAKES IT!
Score: 101-96

[00:36] Team_093 possession (Score: 101-96)
Lauri Parker commits a violation (traveling/carry)! TURNOVER! (dead ball)

[00:22] Team_056 possession (Score: 101-96)
Derrick Bane drives, Kobe Murray stays with him. Derrick Bane attempts a Dunk. Contested by Kobe Murray (4.4 feet, ZONE). DERRICK BANE MAKES IT!
Score: 101-98

[00:12] Team_093 possession (Score: 101-98)
FOUL! Offensive foul on Immanuel Cunningham! Damian Barrett drew the charge! [Team fouls: 3] (Immanuel Cunningham: 1 personal fouls) TURNOVER! (dead ball)

[00:01] Team_056 possession (Score: 101-98)
RJ Johnson makes the Layup and draws the foul on Kobe Murray! And-1! RJ Johnson to the line for 1. [Team fouls: 4] (Kobe Murray: 1 personal fouls)   FT 1/1: GOOD RJ Johnson makes 1/1 from the line.
Score: 101-101

================================================================================
                              4TH QUARTER COMPLETE                              
================================================================================

4TH QUARTER SCORE: Team_093 34, Team_056 37

BOX SCORE:
================================================================================

Team_093
--------------------------------------------------------------------------------
Player                MIN  PTS  REB  AST  TO      FG   FG%      3P   3P%
--------------------------------------------------------------------------------
Trae Westbrook         41    7    0    0   0   3/3   100.0     0/0   0.0
Damian Williamson      41    6    0    1   0   2/3    66.7     0/0   0.0
Carmelo Wagner         41    6    3    1   0   2/5    40.0     0/0   0.0
Vince Barnes           41    5    1    1   0   2/2   100.0     0/0   0.0
Ben Cunningham         41    3    4    2   0   1/3    33.3     0/0   0.0
Lauri Parker            7    3    0    0   0   1/2    50.0     0/0   0.0
Kobe Murray             7    2    2    0   0   1/1   100.0     0/0   0.0
Cade O'Neal             7    2    1    0   0   1/2    50.0     0/0   0.0
Shaquille George        7    0    0    1   0   0/0     0.0     0/0   0.0

TEAM: FG: 13/21 (61.9%), 3PT: 6/10 (60.0%), REB: 10 (4 off, 6 def), AST: 6, TO: 3
TEAM FOULS: 4


Team_056
--------------------------------------------------------------------------------
Player                MIN  PTS  REB  AST  TO      FG   FG%      3P   3P%
--------------------------------------------------------------------------------
Magic Russell          41    8    0    1   0   3/5    60.0     0/0   0.0
Giannis Jokic          41    6    0    3   0   2/2   100.0     0/0   0.0
Derrick Bane            7    6    1    0   0   2/2   100.0     0/0   0.0
Jrue Lillard           41    4    4    0   0   2/3    66.7     0/0   0.0
CJ Anthony              7    3    1    0   0   1/2    50.0     0/0   0.0
RJ Johnson              7    3    0    0   0   1/2    50.0     0/0   0.0
Damian Barrett          7    3    0    0   0   1/1   100.0     0/0   0.0
Yao Poole              41    2    1    2   0   1/1   100.0     0/0   0.0
Tony Carter            41    2    2    0   0   1/3    33.3     0/0   0.0
De'Aaron Murray         7    0    0    1   0   0/0     0.0     0/0   0.0

TEAM: FG: 14/21 (66.7%), 3PT: 6/10 (60.0%), REB: 10 (2 off, 8 def), AST: 7, TO: 3
TEAM FOULS: 8 [Team_093 in BONUS]

================================================================================

================================================================================
                               FULL GAME COMPLETE                               
================================================================================

FINAL SCORE: Team_093 101, Team_056 101

SCORING BY QUARTER:
--------------------------------------------------------------------------------
Team                     Q1     Q2     Q3     Q4    FINAL
--------------------------------------------------------------------------------
Team_093                 21     30     16     34      101
Team_056                 20     26     18     37      101
--------------------------------------------------------------------------------

FULL GAME BOX SCORE:
================================================================================

Team_093
--------------------------------------------------------------------------------
Player                MIN  PTS  REB  AST  TO      FG   FG%      3P   3P%      FT STL BLK
--------------------------------------------------------------------------------
Damian Williamson      41   12    0    2   1   5/15   33.3   1/3    33.3   4/6     1   0
Trae Westbrook         41   31    0    0   0  11/12   91.7   5/6    83.3  10/12    0   0
Carmelo Wagner         41   13   19    3   3   6/14   42.9   1/6    16.7   5/5     1   0
Vince Barnes           41   14   11    4   3   7/11   63.6   1/4    25.0   6/7     1   0
Ben Cunningham         41   13   15    3   1   5/14   35.7   1/4    25.0   2/2     0   1
Shaquille George        7    0    0    2   0   0/1     0.0   0/1     0.0   0/0     0   0
Immanuel Cunningham     7    3    0    0   1   2/2   100.0   1/1   100.0   1/1     0   0
Lauri Parker            7    5    1    0   1   2/4    50.0   1/2    50.0   0/0     0   0
Kobe Murray             7    7    3    0   0   1/2    50.0   1/1   100.0   2/2     0   0
Cade O'Neal             7    2    2    0   0   1/3    33.3   0/0     0.0   2/2     0   0

TEAM: FG: 42/80 (52.5%), 3PT: 12/28 (42.9%), REB: 49 (13 off, 36 def), AST: 14, TO: 10


Team_056
--------------------------------------------------------------------------------
Player                MIN  PTS  REB  AST  TO      FG   FG%      3P   3P%      FT STL BLK
--------------------------------------------------------------------------------
Giannis Jokic          41    9    0    5   3   3/9    33.3   3/8    37.5   0/0     1   1
Magic Russell          41   28    0    3   1  10/16   62.5   4/8    50.0   9/9     1   0
Tony Carter            41   14    8    1   2   7/18   38.9   2/10   20.0   5/5     0   0
Jrue Lillard           41   17   18    3   2   6/10   60.0   2/4    50.0   2/3     0   3
Yao Poole              41    4   14    4   1   3/10   30.0   0/0     0.0   0/2     0   1
De'Aaron Murray         7    2    0    1   1   1/1   100.0   0/0     0.0   0/0     0   0
Damian Barrett          7    6    0    0   0   2/2   100.0   1/1   100.0   1/1     0   0
CJ Anthony              7    8    4    1   0   3/5    60.0   1/2    50.0   4/6     0   0
RJ Johnson              7    3    1    0   0   1/3    33.3   0/0     0.0   1/1     0   0
Derrick Bane            7    8    1    0   0   2/2   100.0   1/1   100.0   3/3     0   0

TEAM: FG: 39/77 (50.6%), 3PT: 14/34 (41.2%), REB: 48 (10 off, 38 def), AST: 18, TO: 10

================================================================================
