================================================================================
                        FULL GAME - Team_078 vs Team_098                        
================================================================================

================================================================================
                       1ST QUARTER - Team_078 vs Team_098                       
================================================================================

[12:00] Team_078 possession (Score: 0-0)
FOUL! Shooting foul on Nikola Rose. Jabari Barrett to the line for 2 free throws. [Team fouls: 1] (Nikola Rose: 1 personal fouls)   FT 1/2: MISS   FT 2/2: MISS Jabari Barrett makes 0/2 from the line. Rebound secured by Nikola Rose.

[11:48] Team_098 possession (Score: 0-0)
Malcolm Tatum attempts a Midrange. Contested by Jabari Barnes (4.1 feet, MAN). MALCOLM TATUM MAKES IT!
Score: 0-2

[11:30] Team_078 possession (Score: 0-2)
Jabari Barrett attempts a Midrange. Contested by Nikola Rose (3.2 feet, ZONE). JABARI BARRETT MAKES IT! Assist: Jabari Barnes
Score: 2-2

[11:16] Team_098 possession (Score: 2-2)
Malcolm Tatum attempts a 3Pt. Contested by Isaiah Simmons (3.3 feet, ZONE). Malcolm Tatum misses. Rebound secured by Isaiah Simmons.

[10:59] Team_078 possession (Score: 2-2)
Kyrie Carter attempts a Layup. Contested by Pascal Lillard (3.9 feet, ZONE). Kyrie Carter misses. Rebound secured by Pascal Lillard.

[10:42] Team_098 possession (Score: 2-2)
Nikola Rose drives, Jabari Barrett stays with him. Nikola Rose attempts a Dunk. Contested by Jabari Barrett (5.0 feet, ZONE). NIKOLA ROSE MAKES IT!
Score: 2-4

[10:25] Team_078 possession (Score: 2-4)
Jabari Barnes attempts a Layup. BLOCKED BY PASCAL LILLARD! Ball is loose! Rebound secured by Nikola Rose.

[10:14] Team_098 possession (Score: 2-4)
Blake Murray attempts a Midrange. Contested by Kyrie Carter (4.0 feet, ZONE). Blake Murray misses. Rebound secured by Ben Ginobili.

[10:00] Team_078 possession (Score: 2-4)
Kyrie Carter drives, picks up Pascal Lillard. Help arrives from Nikola Rose! Kyrie Carter attempts a Layup. Contested by Nikola Rose (3.9 feet, ZONE). Kyrie Carter misses. Rebound secured by Nikola Rose.

[09:47] Team_098 possession (Score: 2-4)
Pascal Lillard attempts a Layup. Contested by Jabari Barrett (5.2 feet, ZONE). Pascal Lillard misses. Offensive rebound by Derrick Durant! Derrick Durant puts it back in!
Score: 2-6

[09:32] Team_078 possession (Score: 2-6)
Jabari Barrett drives to the basket... Jabari Barrett throws a bad pass! Stolen by Derrick Durant! TURNOVER! (live ball)

[09:15] Team_098 possession (Score: 2-6)
FOUL! Shooting foul on Ben Ginobili. Nikola Rose to the line for 2 free throws. [Team fouls: 1] (Ben Ginobili: 1 personal fouls)   FT 1/2: GOOD   FT 2/2: GOOD Nikola Rose makes 2/2 from the line.
Score: 2-8

[08:59] Team_078 possession (Score: 2-8)
Jabari Barrett attempts a Midrange. Contested by Derrick Durant (4.3 feet, MAN). Jabari Barrett misses. Rebound secured by Derrick Durant.

[08:46] Team_098 possession (Score: 2-8)
Blake Murray drives, picks up Jabari Barrett. Help arrives from Kyrie Carter! Blake Murray attempts a Layup. Contested by Kyrie Carter (4.9 feet, ZONE). Blake Murray misses. Rebound secured by Isaiah Simmons.

[08:34] Team_078 possession (Score: 2-8)
Kyrie Carter attempts a Midrange. Contested by Nikola Rose (3.1 feet, MAN). Kyrie Carter misses. Rebound secured by Nikola Rose.

[08:22] Team_098 possession (Score: 2-8)
Derrick Durant attempts a 3Pt. Contested by Isaiah Simmons (3.3 feet, ZONE). DERRICK DURANT MAKES IT! Assist: Nikola Rose
Score: 2-11

[08:07] Team_078 possession (Score: 2-11)
Ben Ginobili attempts a Midrange. Contested by Pascal Lillard (4.4 feet, ZONE). Ben Ginobili misses. Rebound secured by Derrick Durant.

[07:56] Team_098 possession (Score: 2-11)
Nikola Rose attempts a Midrange. Contested by Kyrie Carter (4.1 feet, MAN). Nikola Rose misses. Rebound secured by Ben Ginobili.

[07:42] Team_078 possession (Score: 2-11)
Ben Ginobili drives and kicks out. Isaiah Simmons attempts a Midrange. Contested by Blake Murray (4.4 feet, MAN). Isaiah Simmons misses. Rebound secured by Pascal Lillard.

[07:27] Team_098 possession (Score: 2-11)
Blake Murray attempts a 3Pt. Contested by Isaiah Simmons (3.2 feet, ZONE). Blake Murray misses. Rebound secured by Jabari Barrett.

[07:09] Team_078 possession (Score: 2-11)
Ben Ginobili attempts a Midrange. Contested by Pascal Lillard (4.4 feet, MAN). BEN GINOBILI MAKES IT!
Score: 4-11

[06:55] Team_098 possession (Score: 4-11)
FOUL! Holding foul on Jabari Barnes. [Team fouls: 2] No free throws, side out. (Jabari Barnes: 1 personal fouls)

[06:44] Team_098 possession (Score: 4-11)
Malcolm Tatum drives to the basket... Malcolm Tatum throws a bad pass out of bounds! TURNOVER! (dead ball)

[06:25] Team_078 possession (Score: 4-11)
Isaiah Simmons attempts a Midrange. Contested by Nikola Rose (3.4 feet, ZONE). ISAIAH SIMMONS MAKES IT!
Score: 6-11

[06:10] Team_098 possession (Score: 6-11)
Nikola Rose attempts a 3Pt. Contested by Kyrie Carter (4.1 feet, MAN). NIKOLA ROSE MAKES IT! Assist: Malcolm Tatum
Score: 6-14

[05:51] Team_078 possession (Score: 6-14)
Jabari Barrett loses control! Ball rolls out of bounds! TURNOVER! (dead ball)

[05:31] Team_098 possession (Score: 6-14)
Pascal Lillard attempts a Layup. Contested by Jabari Barrett (5.2 feet, ZONE). PASCAL LILLARD MAKES IT!
Score: 6-16

[05:14] Team_078 possession (Score: 6-16)
Jabari Barnes attempts a 3Pt. Contested by Malcolm Tatum (4.4 feet, MAN). JABARI BARNES MAKES IT! Assist: Kyrie Carter
Score: 9-16

[05:00] Team_098 possession (Score: 9-16)
Derrick Durant attempts a Midrange. Contested by Kyrie Carter (4.0 feet, ZONE). Derrick Durant misses. Rebound secured by Ben Ginobili.

[04:46] Team_078 possession (Score: 9-16)
Jabari Barnes attempts a Layup. Contested by Malcolm Tatum (4.4 feet, MAN). JABARI BARNES MAKES IT!
Score: 11-16

[04:29] Team_098 possession (Score: 11-16)
Derrick Durant drives, picks up Jabari Barrett. Help arrives from Kyrie Carter! Derrick Durant attempts a Layup. Contested by Kyrie Carter (4.9 feet, MAN). Derrick Durant misses. Offensive rebound by Pascal Lillard! Pascal Lillard kicks it out.

[04:17] Team_098 possession (Score: 11-16)
Derrick Durant attempts a Layup. Contested by Jabari Barrett (4.9 feet, MAN). DERRICK DURANT MAKES IT! Assist: Malcolm Tatum
Score: 11-18

[04:00] Team_078 possession (Score: 11-18)
FOUL! Reach-in foul on Nikola Rose during the drive. [Team fouls: 2] No free throws, side out. (Nikola Rose: 2 personal fouls)

[03:45] Team_078 possession (Score: 11-18)
Jabari Barnes attempts a 3Pt. Contested by Blake Murray (5.0 feet, ZONE). Jabari Barnes misses. Rebound secured by Pascal Lillard.

[03:26] Team_098 possession (Score: 11-18)
Derrick Durant drives to the basket... Derrick Durant loses control! Ball rolls out of bounds! TURNOVER! (dead ball)

[03:11] Team_078 possession (Score: 11-18)
Isaiah Simmons attempts a 3Pt. Contested by Nikola Rose (3.5 feet, ZONE). Isaiah Simmons misses. Offensive rebound by Isaiah Simmons! Isaiah Simmons's putback is no good. Offensive rebound by Jabari Barrett! Jabari Barrett kicks it out.

[02:52] Team_078 possession (Score: 11-18)
Isaiah Simmons attempts a 3Pt. Contested by Blake Murray (4.8 feet, MAN). Isaiah Simmons misses. Offensive rebound by Isaiah Simmons! Isaiah Simmons puts it back in!
Score: 13-18

[02:38] Team_098 possession (Score: 13-18)
Nikola Rose drives and kicks out. Derrick Durant attempts a Midrange. Contested by Kyrie Carter (4.0 feet, ZONE). Derrick Durant misses. Rebound secured by Isaiah Simmons.

[02:25] Team_078 possession (Score: 13-18)
Isaiah Simmons attempts a 3Pt. Contested by Blake Murray (4.9 feet, MAN). ISAIAH SIMMONS MAKES IT! Assist: Kyrie Carter
Score: 16-18

[02:15] Team_098 possession (Score: 16-18)
Pascal Lillard attempts a Midrange. Contested by Isaiah Simmons (3.9 feet, ZONE). PASCAL LILLARD MAKES IT!
Score: 16-20

[01:58] Team_078 possession (Score: 16-20)
Jabari Barnes attempts a 3Pt. Contested by Pascal Lillard (4.7 feet, ZONE). Jabari Barnes misses. Rebound secured by Derrick Durant.

[01:46] Team_098 possession (Score: 16-20)
Nikola Rose makes the Layup and draws the foul on Isaiah Simmons! And-1! Nikola Rose to the line for 1. [Team fouls: 3] (Isaiah Simmons: 1 personal fouls)   FT 1/1: GOOD Nikola Rose makes 1/1 from the line.
Score: 16-23

[01:32] Team_078 possession (Score: 16-23)
Ben Ginobili attempts a 3Pt. Contested by Nikola Rose (3.7 feet, ZONE). Ben Ginobili misses. Rebound secured by Pascal Lillard.

[01:18] Team_098 possession (Score: 16-23)
Derrick Durant attempts a Midrange. Contested by Jabari Barrett (5.2 feet, MAN). Derrick Durant misses. FOUL! Loose ball foul on Ben Ginobili during the rebound battle. [Team fouls: 4] No free throws, side out. (Ben Ginobili: 2 personal fouls)

[01:00] Team_098 possession (Score: 16-23)
Blake Murray attempts a 3Pt. Contested by Isaiah Simmons (3.6 feet, MAN). Blake Murray misses. Rebound secured by Isaiah Simmons.

[00:45] Team_078 possession (Score: 16-23)
Jabari Barrett attempts a Layup. Contested by Pascal Lillard (4.4 feet, ZONE). Jabari Barrett misses. Rebound secured by Pascal Lillard.

[00:31] Team_098 possession (Score: 16-23)
Derrick Durant attempts a Layup. Contested by Jabari Barrett (5.3 feet, ZONE). DERRICK DURANT MAKES IT!
Score: 16-25

[00:13] Team_078 possession (Score: 16-25)
Jabari Barnes attempts a 3Pt. Contested by Nikola Rose (4.0 feet, ZONE). Jabari Barnes misses. Rebound secured by Pascal Lillard.

[00:03] Team_098 possession (Score: 16-25)
FOUL! Shooting foul on Isaiah Simmons. Derrick Durant to the line for 3 free throws. [BONUS: 5 team fouls] (Isaiah Simmons: 2 personal fouls)   FT 1/3: MISS   FT 2/3: GOOD   FT 3/3: GOOD Derrick Durant makes 2/3 from the line.
Score: 16-27

================================================================================
                              1ST QUARTER COMPLETE                              
================================================================================

1ST QUARTER SCORE: Team_078 16, Team_098 27

BOX SCORE:
================================================================================

Team_078
--------------------------------------------------------------------------------
Player                MIN  PTS  REB  AST  TO      FG   FG%      3P   3P%
--------------------------------------------------------------------------------
Isaiah Simmons         12    7    5    0   0   3/3   100.0     0/0   0.0
Jabari Barnes          12    5    0    1   0   2/6    33.3     0/0   0.0
Jabari Barrett         12    2    2    0   0   1/4    25.0     0/0   0.0
Ben Ginobili           12    2    3    0   0   1/4    25.0     0/0   0.0
Kyrie Carter           12    0    0    2   0   0/3     0.0     0/0   0.0

TEAM: FG: 7/20 (35.0%), 3PT: 3/7 (42.9%), REB: 10 (2 off, 8 def), AST: 3, TO: 2
TEAM FOULS: 5 [Team_098 in BONUS]


Team_098
--------------------------------------------------------------------------------
Player                MIN  PTS  REB  AST  TO      FG   FG%      3P   3P%
--------------------------------------------------------------------------------
Derrick Durant         12   11    5    0   0   5/6    83.3     0/0   0.0
Nikola Rose            12   10    4    1   0   4/6    66.7     0/0   0.0
Pascal Lillard         12    4    7    0   0   2/2   100.0     0/0   0.0
Malcolm Tatum          12    2    0    2   0   1/2    50.0     0/0   0.0
Blake Murray           12    0    0    0   0   0/4     0.0     0/0   0.0

TEAM: FG: 12/20 (60.0%), 3PT: 3/6 (50.0%), REB: 16 (3 off, 13 def), AST: 3, TO: 2
TEAM FOULS: 2

================================================================================

================================================================================
                       2ND QUARTER - Team_078 vs Team_098                       
================================================================================

[12:00] Team_078 possession (Score: 16-27)
FOUL! Reach-in foul on Nikola Rose during the drive. [Team fouls: 1] No free throws, side out. (Nikola Rose: 1 personal fouls)

[11:45] Team_078 possession (Score: 16-27)
FOUL! Reach-in foul on Blake Murray during the drive. [Team fouls: 2] No free throws, side out. (Blake Murray: 1 personal fouls)

[11:33] Team_078 possession (Score: 16-27)
Isaiah Simmons attempts a 3Pt. Contested by Nikola Rose (3.6 feet, ZONE). Isaiah Simmons misses. Rebound secured by Pascal Lillard.

[11:14] Team_098 possession (Score: 16-27)
FOUL! Shooting foul on Kyrie Carter. Nikola Rose to the line for 2 free throws. [Team fouls: 1] (Kyrie Carter: 1 personal fouls)   FT 1/2: GOOD   FT 2/2: GOOD Nikola Rose makes 2/2 from the line.
Score: 16-29

[11:01] Team_078 possession (Score: 16-29)
Isaiah Simmons drives to the basket... Isaiah Simmons loses the ball! Stripped by Pascal Lillard! TURNOVER! (live ball)

[10:47] Team_098 possession (Score: 16-29)
Blake Murray attempts a 3Pt. Contested by Isaiah Simmons (3.7 feet, ZONE). Blake Murray misses. Rebound secured by Jabari Barrett.

[10:30] Team_078 possession (Score: 16-29)
Isaiah Simmons attempts a 3Pt. Contested by Blake Murray (5.1 feet, MAN). Isaiah Simmons misses. Rebound secured by Pascal Lillard.

[10:19] Team_098 possession (Score: 16-29)
Blake Murray attempts a Layup. Contested by Isaiah Simmons (3.7 feet, MAN). Blake Murray misses. Rebound secured by Ben Ginobili.

[10:03] Team_078 possession (Score: 16-29)
Isaiah Simmons attempts a Midrange. Contested by Blake Murray (5.2 feet, MAN). ISAIAH SIMMONS MAKES IT! Assist: Jabari Barnes
Score: 18-29

[09:51] Team_098 possession (Score: 18-29)
Nikola Rose attempts a 3Pt. Contested by Isaiah Simmons (3.9 feet, ZONE). Nikola Rose misses. Rebound secured by Ben Ginobili.

[09:39] Team_078 possession (Score: 18-29)
Isaiah Simmons attempts a Layup. Contested by Pascal Lillard (4.7 feet, ZONE). ISAIAH SIMMONS MAKES IT!
Score: 20-29

[09:27] Team_098 possession (Score: 20-29)
Blake Murray attempts a Layup. Contested by Isaiah Simmons (3.8 feet, MAN). Blake Murray misses. Rebound secured by Jabari Barrett.

[09:10] Team_078 possession (Score: 20-29)
Jabari Barnes attempts a 3Pt. Contested by Malcolm Tatum (4.9 feet, MAN). Jabari Barnes misses. Rebound secured by Nikola Rose.

[08:55] Team_098 possession (Score: 20-29)
Malcolm Tatum drives and kicks out. FOUL! Shooting foul on Isaiah Simmons. Blake Murray to the line for 3 free throws. [Team fouls: 2] (Isaiah Simmons: 1 personal fouls)   FT 1/3: GOOD   FT 2/3: GOOD   FT 3/3: MISS Blake Murray makes 2/3 from the line. Rebound secured by Jabari Barrett.
Score: 20-31

[08:37] Team_078 possession (Score: 20-31)
Jabari Barrett attempts a 3Pt. Contested by Derrick Durant (5.1 feet, MAN). JABARI BARRETT MAKES IT! Assist: Kyrie Carter
Score: 23-31

[08:19] Team_098 possession (Score: 23-31)
Malcolm Tatum drives and kicks out. Blake Murray attempts a Midrange. Contested by Isaiah Simmons (3.9 feet, MAN). BLAKE MURRAY MAKES IT! Assist: Derrick Durant
Score: 23-33

[08:09] Team_078 possession (Score: 23-33)
Ben Ginobili throws a bad pass out of bounds! TURNOVER! (dead ball)

[08:09] Substitution (Team_078): Jabari Barnes OUT → Magic Barrett IN (stamina_rule2)

[08:09] Substitution (Team_078): Kyrie Carter OUT → Damian Allen IN (stamina_rule2)

[08:09] Substitution (Team_078): Isaiah Simmons OUT → Malcolm Randle IN (stamina_rule2)

[08:09] Substitution (Team_078): Ben Ginobili OUT → Paul Ming IN (stamina_rule2)

[08:09] Substitution (Team_078): Jabari Barrett OUT → Draymond Irving IN (stamina_rule2)

[08:09] Substitution (Team_098): Malcolm Tatum OUT → Tracy Rose IN (stamina_rule2)

[08:09] Substitution (Team_098): Nikola Rose OUT → Dirk McCollum IN (stamina_rule2)

[08:09] Substitution (Team_098): Blake Murray OUT → Kristaps Iverson IN (stamina_rule2)

[08:09] Substitution (Team_098): Pascal Lillard OUT → Manu Jordan IN (stamina_rule2)

[08:09] Substitution (Team_098): Derrick Durant OUT → Russell McGrady IN (stamina_rule2)

[07:54] Team_098 possession (Score: 23-33)
Kristaps Iverson drives, picks up Malcolm Randle. Help arrives from Damian Allen! Kristaps Iverson attempts a Layup. Contested by Damian Allen (4.3 feet, MAN). KRISTAPS IVERSON MAKES IT! Assist: Dirk McCollum
Score: 23-35

[07:40] Team_078 possession (Score: 23-35)
Malcolm Randle attempts a Midrange. Contested by Kristaps Iverson (4.1 feet, MAN). Malcolm Randle misses. Offensive rebound by Paul Ming! Paul Ming kicks it out.

[07:23] Team_078 possession (Score: 23-35)
Draymond Irving drives, Russell McGrady stays with him. Draymond Irving attempts a Dunk. Contested by Russell McGrady (4.2 feet, MAN). DRAYMOND IRVING MAKES IT! Assist: Malcolm Randle
Score: 25-35

[07:11] Team_098 possession (Score: 25-35)
Russell McGrady attempts a Layup. Contested by Paul Ming (4.2 feet, ZONE). Russell McGrady misses. Offensive rebound by Kristaps Iverson! Kristaps Iverson kicks it out.

[06:59] Team_098 possession (Score: 25-35)
Kristaps Iverson drives and kicks out. Russell McGrady attempts a 3Pt. Contested by Damian Allen (4.9 feet, ZONE). Russell McGrady misses. Offensive rebound by Kristaps Iverson! Kristaps Iverson kicks it out.

[06:45] Team_098 possession (Score: 25-35)
FOUL! Reach-in foul on Paul Ming during the drive. [Team fouls: 3] No free throws, side out. (Paul Ming: 1 personal fouls)

[06:30] Team_098 possession (Score: 25-35)
FOUL! Offensive foul on Kristaps Iverson! Malcolm Randle drew the charge! [Team fouls: 3] (Kristaps Iverson: 1 personal fouls) TURNOVER! (dead ball)

[06:16] Team_078 possession (Score: 25-35)
FOUL! Reach-in foul on Russell McGrady during the drive. [Team fouls: 4] No free throws, side out. (Russell McGrady: 1 personal fouls)

[06:03] Team_078 possession (Score: 25-35)
Malcolm Randle drives, picks up Russell McGrady. Help arrives from Dirk McCollum! Malcolm Randle attempts a Layup. Contested by Dirk McCollum (4.0 feet, ZONE). MALCOLM RANDLE MAKES IT! Assist: Magic Barrett
Score: 27-35

[05:45] Team_098 possession (Score: 27-35)
Dirk McCollum attempts a Midrange. Contested by Damian Allen (5.0 feet, ZONE). Dirk McCollum misses. Rebound secured by Malcolm Randle.

[05:30] Team_078 possession (Score: 27-35)
Damian Allen attempts a 3Pt. Contested by Dirk McCollum (4.3 feet, MAN). Damian Allen misses. Rebound secured by Russell McGrady.

[05:16] Team_098 possession (Score: 27-35)
Tracy Rose attempts a Layup. Contested by Paul Ming (4.4 feet, ZONE). Tracy Rose misses. Offensive rebound by Russell McGrady! Russell McGrady puts it back in!
Score: 27-37

[04:59] Team_078 possession (Score: 27-37)
FOUL! Offensive foul on Magic Barrett! Tracy Rose drew the charge! [Team fouls: 4] (Magic Barrett: 1 personal fouls) TURNOVER! (dead ball)

[04:42] Team_098 possession (Score: 27-37)
Dirk McCollum drives to the basket... FOUL! Offensive foul on Dirk McCollum! Paul Ming drew the charge! [Team fouls: 5] (Dirk McCollum: 1 personal fouls) TURNOVER! (dead ball)

[04:26] Team_078 possession (Score: 27-37)
FOUL! Shooting foul on Russell McGrady. Draymond Irving to the line for 3 free throws. [BONUS: 6 team fouls] (Russell McGrady: 2 personal fouls)   FT 1/3: GOOD   FT 2/3: MISS   FT 3/3: GOOD Draymond Irving makes 2/3 from the line.
Score: 29-37

[04:10] Team_098 possession (Score: 29-37)
Dirk McCollum attempts a 3Pt. Contested by Damian Allen (5.0 feet, ZONE). Dirk McCollum misses. Offensive rebound by Kristaps Iverson! Kristaps Iverson kicks it out.

[03:54] Team_098 possession (Score: 29-37)
Kristaps Iverson attempts a 3Pt. Contested by Malcolm Randle (4.3 feet, MAN). KRISTAPS IVERSON MAKES IT! Assist: Russell McGrady
Score: 29-40

[03:42] Team_078 possession (Score: 29-40)
Malcolm Randle attempts a 3Pt. Contested by Kristaps Iverson (4.1 feet, MAN). Malcolm Randle misses. Rebound secured by Russell McGrady.

[03:29] Team_098 possession (Score: 29-40)
Manu Jordan attempts a Midrange. Contested by Paul Ming (4.5 feet, MAN). MANU JORDAN MAKES IT! Assist: Russell McGrady
Score: 29-42

[03:16] Team_078 possession (Score: 29-42)
Malcolm Randle drives, Kristaps Iverson stays with him. Malcolm Randle attempts a Layup. Contested by Kristaps Iverson (4.1 feet, MAN). Malcolm Randle misses. Rebound secured by Russell McGrady.

[03:00] Team_098 possession (Score: 29-42)
Kristaps Iverson drives, Paul Ming stays with him. Kristaps Iverson attempts a Dunk. Contested by Paul Ming (4.4 feet, ZONE). KRISTAPS IVERSON MAKES IT! Assist: Manu Jordan
Score: 29-44

[02:46] Team_078 possession (Score: 29-44)
Magic Barrett attempts a 3Pt. Contested by Tracy Rose (3.7 feet, MAN). Magic Barrett misses. Rebound secured by Kristaps Iverson.

[02:30] Team_098 possession (Score: 29-44)
Kristaps Iverson attempts a Layup. Contested by Paul Ming (4.4 feet, ZONE). KRISTAPS IVERSON MAKES IT!
Score: 29-46

[02:18] Team_078 possession (Score: 29-46)
FOUL! Holding foul on Russell McGrady. [IN THE BONUS! 7 team fouls] Draymond Irving to the line for 2 free throws. (Russell McGrady: 3 personal fouls)   FT 1/2: GOOD   FT 2/2: GOOD Draymond Irving makes 2/2 from the line.
Score: 31-46

[02:02] Team_098 possession (Score: 31-46)
Kristaps Iverson attempts a 3Pt. Contested by Damian Allen (5.0 feet, ZONE). KRISTAPS IVERSON MAKES IT! Assist: Manu Jordan
Score: 31-49

[01:46] Team_078 possession (Score: 31-49)
Draymond Irving drives and kicks out. Magic Barrett attempts a 3Pt. Contested by Dirk McCollum (4.2 feet, ZONE). Magic Barrett misses. Rebound secured by Russell McGrady.

[01:31] Team_098 possession (Score: 31-49)
Tracy Rose attempts a 3Pt. Contested by Damian Allen (5.0 feet, ZONE). Tracy Rose misses. Rebound secured by Malcolm Randle.

[01:19] Team_078 possession (Score: 31-49)
FOUL! Shooting foul on Kristaps Iverson. Damian Allen to the line for 2 free throws. [BONUS: 8 team fouls] (Kristaps Iverson: 2 personal fouls)   FT 1/2: GOOD   FT 2/2: GOOD Damian Allen makes 2/2 from the line.
Score: 33-49

[01:08] Team_098 possession (Score: 33-49)
Russell McGrady makes the Layup and draws the foul on Draymond Irving! And-1! Russell McGrady to the line for 1. [BONUS: 5 team fouls] (Draymond Irving: 1 personal fouls)   FT 1/1: GOOD Russell McGrady makes 1/1 from the line.
Score: 33-52

[00:51] Team_078 possession (Score: 33-52)
Magic Barrett drives, Manu Jordan stays with him. Magic Barrett attempts a Dunk. Contested by Manu Jordan (5.2 feet, ZONE). Magic Barrett misses. Offensive rebound by Paul Ming! Paul Ming kicks it out.

[00:35] Team_078 possession (Score: 33-52)
Paul Ming attempts a Midrange. Contested by Manu Jordan (4.7 feet, ZONE). Paul Ming misses. Rebound secured by Russell McGrady.

[00:22] Team_098 possession (Score: 33-52)
Russell McGrady drives and kicks out. Manu Jordan attempts a 3Pt. BLOCKED BY PAUL MING! Ball deflects out of bounds off Manu Jordan.

[00:04] Team_078 possession (Score: 33-52)
Damian Allen drives, Russell McGrady stays with him. Damian Allen attempts a Dunk. Contested by Russell McGrady (4.0 feet, ZONE). Damian Allen misses. Rebound secured by Kristaps Iverson.

================================================================================
                              2ND QUARTER COMPLETE                              
================================================================================

2ND QUARTER SCORE: Team_078 17, Team_098 25

BOX SCORE:
================================================================================

Team_078
--------------------------------------------------------------------------------
Player                MIN  PTS  REB  AST  TO      FG   FG%      3P   3P%
--------------------------------------------------------------------------------
Draymond Irving         8    6    0    0   0   3/4    75.0     0/0   0.0
Isaiah Simmons         16    4    0    0   0   2/4    50.0     0/0   0.0
Jabari Barrett         16    3    3    0   0   1/1   100.0     0/0   0.0
Malcolm Randle          8    2    2    1   0   1/3    33.3     0/0   0.0
Damian Allen            8    2    0    0   0   1/3    33.3     0/0   0.0
Ben Ginobili           16    0    2    0   0   0/0     0.0     0/0   0.0
Jabari Barnes          16    0    0    1   0   0/1     0.0     0/0   0.0
Kyrie Carter           16    0    0    1   0   0/0     0.0     0/0   0.0
Paul Ming               8    0    2    0   0   0/1     0.0     0/0   0.0
Magic Barrett           8    0    0    1   0   0/1     0.0     0/0   0.0

TEAM: FG: 8/18 (44.4%), 3PT: 2/8 (25.0%), REB: 9 (2 off, 7 def), AST: 4, TO: 3
TEAM FOULS: 5 [Team_098 in BONUS]


Team_098
--------------------------------------------------------------------------------
Player                MIN  PTS  REB  AST  TO      FG   FG%      3P   3P%
--------------------------------------------------------------------------------
Kristaps Iverson        8   12    5    0   0   5/5   100.0     0/0   0.0
Russell McGrady         8    5    6    2   0   2/3    66.7     0/0   0.0
Nikola Rose            16    2    1    0   0   1/2    50.0     0/0   0.0
Blake Murray           16    2    0    0   0   1/4    25.0     0/0   0.0
Manu Jordan             8    2    0    2   0   1/1   100.0     0/0   0.0
Pascal Lillard         16    0    2    0   0   0/0     0.0     0/0   0.0
Malcolm Tatum          16    0    0    0   0   0/1     0.0     0/0   0.0
Derrick Durant         16    0    0    1   0   0/0     0.0     0/0   0.0
Dirk McCollum           8    0    0    1   0   0/1     0.0     0/0   0.0
Tracy Rose              8    0    0    0   0   0/1     0.0     0/0   0.0

TEAM: FG: 10/18 (55.6%), 3PT: 2/5 (40.0%), REB: 14 (4 off, 10 def), AST: 6, TO: 2
TEAM FOULS: 8 [Team_078 in BONUS]

================================================================================

================================================================================
                       3RD QUARTER - Team_078 vs Team_098                       
================================================================================

[12:00] Team_078 possession (Score: 33-52)
Ben Ginobili attempts a Midrange. Contested by Nikola Rose (3.5 feet, ZONE). Ben Ginobili misses. Offensive rebound by Jabari Barrett! Jabari Barrett kicks it out.

[11:47] Team_078 possession (Score: 33-52)
Kyrie Carter attempts a 3Pt. Contested by Malcolm Tatum (3.8 feet, ZONE). Kyrie Carter misses. Rebound secured by Pascal Lillard.

[11:31] Team_098 possession (Score: 33-52)
Nikola Rose attempts a Midrange. Contested by Kyrie Carter (4.1 feet, ZONE). Nikola Rose misses. Rebound secured by Ben Ginobili.

[11:19] Team_078 possession (Score: 33-52)
Jabari Barrett attempts a Layup. BLOCKED BY DERRICK DURANT! Ball is loose! Offensive rebound by Jabari Barrett! Jabari Barrett kicks it out.

[11:03] Team_078 possession (Score: 33-52)
Kyrie Carter attempts a 3Pt. Contested by Nikola Rose (3.1 feet, MAN). Kyrie Carter misses. Rebound secured by Nikola Rose.

[10:49] Team_098 possession (Score: 33-52)
FOUL! Shooting foul on Jabari Barnes. Malcolm Tatum to the line for 2 free throws. [Team fouls: 1] (Jabari Barnes: 1 personal fouls)   FT 1/2: GOOD   FT 2/2: GOOD Malcolm Tatum makes 2/2 from the line.
Score: 33-54

[10:31] Team_078 possession (Score: 33-54)
Jabari Barrett drives and kicks out. Jabari Barrett attempts a 3Pt. Contested by Derrick Durant (4.3 feet, MAN). Jabari Barrett misses. Rebound secured by Nikola Rose.

[10:16] Team_098 possession (Score: 33-54)
FOUL! Offensive foul on Blake Murray! Isaiah Simmons drew the charge! [Team fouls: 1] (Blake Murray: 1 personal fouls) TURNOVER! (dead ball)

[09:59] Team_078 possession (Score: 33-54)
Kyrie Carter drives, Pascal Lillard stays with him. Kyrie Carter attempts a Layup. Contested by Pascal Lillard (3.9 feet, ZONE). KYRIE CARTER MAKES IT! Assist: Jabari Barrett
Score: 35-54

[09:42] Team_098 possession (Score: 35-54)
Pascal Lillard attempts a 3Pt. Contested by Ben Ginobili (5.2 feet, MAN). PASCAL LILLARD MAKES IT!
Score: 35-57

[09:28] Team_078 possession (Score: 35-57)
Kyrie Carter attempts a 3Pt. Contested by Nikola Rose (3.1 feet, MAN). Kyrie Carter misses. Offensive rebound by Jabari Barrett! Jabari Barrett kicks it out.

[09:13] Team_078 possession (Score: 35-57)
Jabari Barnes attempts a 3Pt. Contested by Malcolm Tatum (4.4 feet, MAN). Jabari Barnes misses. FOUL! Loose ball foul on Nikola Rose during the rebound battle. [Team fouls: 2] No free throws, side out. (Nikola Rose: 1 personal fouls)

[08:59] Team_078 possession (Score: 35-57)
Isaiah Simmons attempts a Dunk. BLOCKED BY BLAKE MURRAY! Ball is loose! Offensive rebound by Jabari Barrett! Jabari Barrett kicks it out.

[08:47] Team_078 possession (Score: 35-57)
Ben Ginobili attempts a Midrange. Contested by Pascal Lillard (4.4 feet, MAN). Ben Ginobili misses. Rebound secured by Derrick Durant.

[08:35] Team_098 possession (Score: 35-57)
Pascal Lillard drives and kicks out. Derrick Durant attempts a 3Pt. Contested by Isaiah Simmons (3.0 feet, ZONE). Derrick Durant misses. Rebound secured by Isaiah Simmons.

[08:17] Team_078 possession (Score: 35-57)
FOUL! Offensive foul on Jabari Barrett! Derrick Durant drew the charge! [Team fouls: 2] (Jabari Barrett: 1 personal fouls) TURNOVER! (dead ball)

[08:04] Team_098 possession (Score: 35-57)
Nikola Rose attempts a 3Pt. Contested by Isaiah Simmons (3.4 feet, ZONE). Nikola Rose misses. Rebound secured by Isaiah Simmons.

[07:50] Team_078 possession (Score: 35-57)
Isaiah Simmons attempts a Midrange. Contested by Pascal Lillard (4.2 feet, ZONE). Isaiah Simmons misses. Rebound secured by Derrick Durant.

[07:37] Team_098 possession (Score: 35-57)
Derrick Durant drives and kicks out. Derrick Durant attempts a 3Pt. Contested by Isaiah Simmons (3.0 feet, ZONE). Derrick Durant misses. Rebound secured by Jabari Barrett.

[07:21] Team_078 possession (Score: 35-57)
Isaiah Simmons attempts a Dunk. BLOCKED BY BLAKE MURRAY! Ball is loose! Rebound secured by Pascal Lillard.

[07:07] Team_098 possession (Score: 35-57)
Pascal Lillard attempts a 3Pt. Contested by Isaiah Simmons (3.6 feet, ZONE). Pascal Lillard misses. Rebound secured by Jabari Barrett.

[06:57] Team_078 possession (Score: 35-57)
FOUL! Holding foul on Pascal Lillard. [Team fouls: 4] No free throws, side out. (Pascal Lillard: 1 personal fouls)

[06:42] Team_078 possession (Score: 35-57)
Isaiah Simmons attempts a 3Pt. Contested by Blake Murray (4.6 feet, MAN). ISAIAH SIMMONS MAKES IT! Assist: Kyrie Carter
Score: 38-57

[06:27] Team_098 possession (Score: 38-57)
Blake Murray attempts a Midrange. Contested by Isaiah Simmons (3.2 feet, MAN). Blake Murray misses. Rebound secured by Isaiah Simmons.

[06:11] Team_078 possession (Score: 38-57)
Ben Ginobili attempts a Midrange. Contested by Pascal Lillard (4.4 feet, MAN). Ben Ginobili misses. Rebound secured by Pascal Lillard.

[05:58] Team_098 possession (Score: 38-57)
Derrick Durant attempts a Midrange. Contested by Jabari Barrett (4.9 feet, MAN). Derrick Durant misses. Rebound secured by Ben Ginobili.

[05:42] Team_078 possession (Score: 38-57)
Jabari Barrett drives, Derrick Durant stays with him. Jabari Barrett attempts a Dunk. Contested by Derrick Durant (4.3 feet, MAN). JABARI BARRETT MAKES IT! Assist: Kyrie Carter
Score: 40-57

[05:30] Team_098 possession (Score: 40-57)
Derrick Durant drives and kicks out. Nikola Rose attempts a 3Pt. Contested by Kyrie Carter (3.8 feet, MAN). NIKOLA ROSE MAKES IT! Assist: Malcolm Tatum
Score: 40-60

[05:14] Team_078 possession (Score: 40-60)
Kyrie Carter attempts a 3Pt. Contested by Nikola Rose (3.1 feet, MAN). Kyrie Carter misses. Offensive rebound by Jabari Barrett! Jabari Barrett kicks it out.

[04:57] Team_078 possession (Score: 40-60)
Jabari Barrett attempts a Midrange. Contested by Nikola Rose (3.2 feet, ZONE). Jabari Barrett misses. Offensive rebound by Isaiah Simmons! Isaiah Simmons puts it back in!
Score: 42-60

[04:45] Team_098 possession (Score: 42-60)
Derrick Durant attempts a 3Pt. Contested by Isaiah Simmons (3.3 feet, ZONE). Derrick Durant misses. Rebound secured by Jabari Barrett.

[04:31] Team_078 possession (Score: 42-60)
Jabari Barrett attempts a Layup. Contested by Pascal Lillard (4.1 feet, ZONE). JABARI BARRETT MAKES IT!
Score: 44-60

[04:20] Team_098 possession (Score: 44-60)
Derrick Durant drives to the basket... FOUL! Offensive foul on Derrick Durant! Jabari Barrett drew the charge! [Team fouls: 5] (Derrick Durant: 1 personal fouls) TURNOVER! (dead ball)

[04:01] Team_078 possession (Score: 44-60)
Ben Ginobili attempts a Layup. Contested by Pascal Lillard (4.4 feet, ZONE). Ben Ginobili misses. Offensive rebound by Jabari Barrett! Jabari Barrett kicks it out.

[03:45] Team_078 possession (Score: 44-60)
Jabari Barrett drives and kicks out. Isaiah Simmons attempts a 3Pt. Contested by Blake Murray (4.6 feet, MAN). Isaiah Simmons misses. Offensive rebound by Isaiah Simmons! Isaiah Simmons's putback is no good. Offensive rebound by Jabari Barrett! Jabari Barrett kicks it out.

[03:32] Team_078 possession (Score: 44-60)
Jabari Barnes attempts a Midrange. Contested by Malcolm Tatum (4.5 feet, MAN). Jabari Barnes misses. Rebound secured by Pascal Lillard.

[03:15] Team_098 possession (Score: 44-60)
Pascal Lillard attempts a 3Pt. Contested by Ben Ginobili (5.4 feet, MAN). PASCAL LILLARD MAKES IT! Assist: Derrick Durant
Score: 44-63

[03:00] Team_078 possession (Score: 44-63)
FOUL! Holding foul on Pascal Lillard. [IN THE BONUS! 6 team fouls] Ben Ginobili to the line for 2 free throws. (Pascal Lillard: 2 personal fouls)   FT 1/2: GOOD   FT 2/2: GOOD Ben Ginobili makes 2/2 from the line.
Score: 46-63

[02:42] Team_098 possession (Score: 46-63)
FOUL! Holding foul on Jabari Barrett. [Team fouls: 3] No free throws, side out. (Jabari Barrett: 2 personal fouls)

[02:23] Team_098 possession (Score: 46-63)
Nikola Rose attempts a Midrange. Contested by Isaiah Simmons (3.6 feet, ZONE). NIKOLA ROSE MAKES IT! Assist: Pascal Lillard
Score: 46-65

[02:07] Team_078 possession (Score: 46-65)
Isaiah Simmons makes the Layup and draws the foul on Pascal Lillard! And-1! Isaiah Simmons to the line for 1. [BONUS: 7 team fouls] (Pascal Lillard: 3 personal fouls)   FT 1/1: GOOD Isaiah Simmons makes 1/1 from the line.
Score: 49-65

[01:55] Team_098 possession (Score: 49-65)
FOUL! Shooting foul on Isaiah Simmons. Pascal Lillard to the line for 2 free throws. [Team fouls: 4] (Isaiah Simmons: 1 personal fouls)   FT 1/2: GOOD   FT 2/2: MISS Pascal Lillard makes 1/2 from the line. Rebound secured by Isaiah Simmons.
Score: 49-66

[01:39] Team_078 possession (Score: 49-66)
Kyrie Carter drives to the basket... Kyrie Carter throws a bad pass! Stolen by Nikola Rose! TURNOVER! (live ball)

[01:27] Team_098 possession (Score: 49-66)
Malcolm Tatum attempts a Midrange. Contested by Kyrie Carter (4.4 feet, ZONE). MALCOLM TATUM MAKES IT!
Score: 49-68

[01:16] Team_078 possession (Score: 49-68)
Isaiah Simmons attempts a 3Pt. Contested by Nikola Rose (3.7 feet, ZONE). Isaiah Simmons misses. Rebound secured by Nikola Rose.

[01:04] Team_098 possession (Score: 49-68)
Malcolm Tatum drives and kicks out. Blake Murray attempts a Midrange. Contested by Isaiah Simmons (3.5 feet, MAN). Blake Murray misses. Rebound secured by Jabari Barrett.

[00:49] Team_078 possession (Score: 49-68)
Ben Ginobili attempts a Midrange. Contested by Nikola Rose (3.9 feet, ZONE). BEN GINOBILI MAKES IT! Assist: Kyrie Carter
Score: 51-68

[00:34] Team_098 possession (Score: 51-68)
Blake Murray drives to the basket... Blake Murray loses control! Ball rolls out of bounds! TURNOVER! (dead ball)

[00:34] Substitution (Team_078): Jabari Barnes OUT → Magic Barrett IN (stamina_rule2)

[00:34] Substitution (Team_078): Kyrie Carter OUT → Damian Allen IN (stamina_rule2)

[00:34] Substitution (Team_078): Isaiah Simmons OUT → Malcolm Randle IN (stamina_rule2)

[00:34] Substitution (Team_078): Ben Ginobili OUT → Paul Ming IN (stamina_rule2)

[00:34] Substitution (Team_078): Jabari Barrett OUT → Draymond Irving IN (stamina_rule2)

[00:34] Substitution (Team_098): Malcolm Tatum OUT → Tracy Rose IN (stamina_rule2)

[00:34] Substitution (Team_098): Nikola Rose OUT → Dirk McCollum IN (stamina_rule2)

[00:34] Substitution (Team_098): Blake Murray OUT → Kristaps Iverson IN (stamina_rule2)

[00:34] Substitution (Team_098): Pascal Lillard OUT → Manu Jordan IN (stamina_rule2)

[00:34] Substitution (Team_098): Derrick Durant OUT → Russell McGrady IN (stamina_rule2)

[00:19] Team_078 possession (Score: 51-68)
Damian Allen loses the ball! Stripped by Dirk McCollum! TURNOVER! (live ball)

[00:09] Team_098 possession (Score: 51-68)
Tracy Rose attempts a 3Pt. Contested by Magic Barrett (5.0 feet, MAN). Tracy Rose misses. Offensive rebound by Kristaps Iverson! Kristaps Iverson kicks it out.

================================================================================
                              3RD QUARTER COMPLETE                              
================================================================================

3RD QUARTER SCORE: Team_078 18, Team_098 16

BOX SCORE:
================================================================================

Team_078
--------------------------------------------------------------------------------
Player                MIN  PTS  REB  AST  TO      FG   FG%      3P   3P%
--------------------------------------------------------------------------------
Isaiah Simmons         28    8    6    0   0   3/6    50.0     0/0   0.0
Jabari Barrett         28    4   11    1   0   2/3    66.7     0/0   0.0
Ben Ginobili           28    4    2    0   0   2/4    50.0     0/0   0.0
Kyrie Carter           28    2    0    3   0   1/3    33.3     0/0   0.0
Jabari Barnes          28    0    0    0   0   0/1     0.0     0/0   0.0

TEAM: FG: 8/17 (47.1%), 3PT: 1/4 (25.0%), REB: 19 (9 off, 10 def), AST: 4, TO: 3
TEAM FOULS: 4


Team_098
--------------------------------------------------------------------------------
Player                MIN  PTS  REB  AST  TO      FG   FG%      3P   3P%
--------------------------------------------------------------------------------
Pascal Lillard         28    6    4    1   0   2/5    40.0     0/0   0.0
Nikola Rose            28    5    3    0   0   2/4    50.0     0/0   0.0
Malcolm Tatum          28    4    0    1   0   2/3    66.7     0/0   0.0
Derrick Durant         28    0    2    1   0   0/3     0.0     0/0   0.0
Blake Murray           28    0    0    0   0   0/1     0.0     0/0   0.0
Kristaps Iverson        8    0    1    0   0   0/0     0.0     0/0   0.0

TEAM: FG: 6/16 (37.5%), 3PT: 2/5 (40.0%), REB: 10 (1 off, 9 def), AST: 3, TO: 3
TEAM FOULS: 7 [Team_078 in BONUS]

================================================================================

================================================================================
                       4TH QUARTER - Team_078 vs Team_098                       
================================================================================

[12:00] Substitution (Team_078): Jabari Barnes OUT (stamina: 69) → Magic Barrett IN (comeback_detected)

[12:00] Substitution (Team_098): Malcolm Tatum OUT (stamina: 72) → Tracy Rose IN (comeback_detected)

[12:00] Team_078 possession (Score: 51-68)
Jabari Barrett attempts a Midrange. Contested by Derrick Durant (4.6 feet, MAN). JABARI BARRETT MAKES IT! Assist: Kyrie Carter
Score: 53-68

[11:47] Team_098 possession (Score: 53-68)
Blake Murray drives to the basket... Blake Murray throws a bad pass! Stolen by Jabari Barrett! TURNOVER! (live ball)

[11:33] Team_078 possession (Score: 53-68)
Magic Barrett attempts a 3Pt. Contested by Tracy Rose (3.7 feet, MAN). MAGIC BARRETT MAKES IT! Assist: Jabari Barrett
Score: 56-68

[11:18] Team_098 possession (Score: 56-68)
Pascal Lillard drives, Jabari Barrett stays with him. Pascal Lillard attempts a Dunk. Contested by Jabari Barrett (5.5 feet, ZONE). Pascal Lillard misses. Offensive rebound by Derrick Durant! Derrick Durant puts it back in!
Score: 56-70

[11:01] Team_078 possession (Score: 56-70)
Jabari Barrett attempts a Layup. BLOCKED BY PASCAL LILLARD! Ball deflects out of bounds off Jabari Barrett.

[10:50] Team_098 possession (Score: 56-70)
Tracy Rose attempts a 3Pt. Contested by Kyrie Carter (4.3 feet, ZONE). Tracy Rose misses. Rebound secured by Jabari Barrett.

[10:36] Team_078 possession (Score: 56-70)
Ben Ginobili drives to the basket... Ben Ginobili throws a bad pass! Stolen by Pascal Lillard! TURNOVER! (live ball)

[10:24] Team_098 possession (Score: 56-70)
Blake Murray attempts a 3Pt. Contested by Ben Ginobili (5.2 feet, ZONE). Blake Murray misses. Rebound secured by Jabari Barrett.

[10:10] Team_078 possession (Score: 56-70)
Jabari Barrett attempts a Layup. Contested by Derrick Durant (4.8 feet, MAN). JABARI BARRETT MAKES IT! Assist: Ben Ginobili
Score: 58-70

[09:57] Team_098 possession (Score: 58-70)
Pascal Lillard attempts a Midrange. Contested by Ben Ginobili (5.6 feet, MAN). PASCAL LILLARD MAKES IT! Assist: Tracy Rose
Score: 58-72

[09:41] Team_078 possession (Score: 58-72)
Isaiah Simmons attempts a Midrange. Contested by Pascal Lillard (4.7 feet, ZONE). Isaiah Simmons misses. Rebound secured by Pascal Lillard.

[09:27] Team_098 possession (Score: 58-72)
Derrick Durant attempts a Midrange. Contested by Ben Ginobili (5.3 feet, ZONE). DERRICK DURANT MAKES IT!
Score: 58-74

[09:09] Team_078 possession (Score: 58-74)
Isaiah Simmons attempts a 3Pt. Contested by Blake Murray (5.2 feet, MAN). Isaiah Simmons misses. Rebound secured by Nikola Rose.

[08:58] Team_098 possession (Score: 58-74)
Pascal Lillard attempts a 3Pt. Contested by Isaiah Simmons (4.2 feet, ZONE). PASCAL LILLARD MAKES IT! Assist: Derrick Durant
Score: 58-77

[08:44] Team_078 possession (Score: 58-77)
Jabari Barrett attempts a 3Pt. Contested by Tracy Rose (3.1 feet, ZONE). JABARI BARRETT MAKES IT! Assist: Ben Ginobili
Score: 61-77

[08:31] Team_098 possession (Score: 61-77)
FOUL! Offensive foul on Tracy Rose! Magic Barrett drew the charge! [Team fouls: 1] (Tracy Rose: 1 personal fouls) TURNOVER! (dead ball)

[08:12] Team_078 possession (Score: 61-77)
Jabari Barrett attempts a Midrange. Contested by Derrick Durant (5.1 feet, MAN). Jabari Barrett misses. Offensive rebound by Jabari Barrett! Jabari Barrett kicks it out.

[07:53] Team_078 possession (Score: 61-77)
Ben Ginobili drives, Pascal Lillard stays with him. Ben Ginobili attempts a Dunk. Contested by Pascal Lillard (4.9 feet, ZONE). BEN GINOBILI MAKES IT!
Score: 63-77

[07:38] Team_098 possession (Score: 63-77)
Pascal Lillard attempts a 3Pt. Contested by Ben Ginobili (5.9 feet, MAN). PASCAL LILLARD MAKES IT! Assist: Blake Murray
Score: 63-80

[07:18] Team_078 possession (Score: 63-80)
Jabari Barrett drives to the basket... Jabari Barrett commits a violation (traveling/carry)! TURNOVER! (dead ball)

[07:18] Substitution (Team_078): Kyrie Carter OUT → Damian Allen IN (stamina_rule2)

[07:18] Substitution (Team_078): Isaiah Simmons OUT → Malcolm Randle IN (stamina_rule2)

[07:18] Substitution (Team_078): Ben Ginobili OUT → Paul Ming IN (stamina_rule2)

[07:18] Substitution (Team_078): Jabari Barrett OUT → Draymond Irving IN (stamina_rule2)

[07:18] Substitution (Team_098): Nikola Rose OUT → Dirk McCollum IN (stamina_rule2)

[07:18] Substitution (Team_098): Blake Murray OUT → Kristaps Iverson IN (stamina_rule2)

[07:18] Substitution (Team_098): Pascal Lillard OUT → Manu Jordan IN (stamina_rule2)

[07:18] Substitution (Team_098): Derrick Durant OUT → Russell McGrady IN (stamina_rule2)

[07:03] Team_098 possession (Score: 63-80)
Kristaps Iverson commits a violation (traveling/carry)! TURNOVER! (dead ball)

[06:48] Team_078 possession (Score: 63-80)
Magic Barrett attempts a Layup. Contested by Tracy Rose (3.7 feet, MAN). MAGIC BARRETT MAKES IT! Assist: Malcolm Randle
Score: 65-80

[06:34] Team_098 possession (Score: 65-80)
Tracy Rose attempts a Layup. Contested by Paul Ming (4.4 feet, ZONE). TRACY ROSE MAKES IT!
Score: 65-82

[06:19] Team_078 possession (Score: 65-82)
Malcolm Randle attempts a 3Pt. Contested by Dirk McCollum (4.4 feet, ZONE). MALCOLM RANDLE MAKES IT! Assist: Damian Allen
Score: 68-82

[06:02] Team_098 possession (Score: 68-82)
Russell McGrady attempts a Midrange. Contested by Draymond Irving (5.3 feet, MAN). Russell McGrady misses. Offensive rebound by Russell McGrady! Russell McGrady puts it back in!
Score: 68-84

[05:45] Team_078 possession (Score: 68-84)
Draymond Irving attempts a 3Pt. Contested by Dirk McCollum (4.5 feet, ZONE). Draymond Irving misses. Rebound secured by Kristaps Iverson.

[05:29] Team_098 possession (Score: 68-84)
Russell McGrady drives, Paul Ming stays with him. Russell McGrady attempts a Dunk. Contested by Paul Ming (4.2 feet, ZONE). Russell McGrady misses. Offensive rebound by Russell McGrady! Russell McGrady puts it back in!
Score: 68-86

[05:16] Team_078 possession (Score: 68-86)
Damian Allen attempts a 3Pt. Contested by Dirk McCollum (4.3 feet, MAN). Damian Allen misses. Rebound secured by Manu Jordan.

[05:01] Team_098 possession (Score: 68-86)
Manu Jordan attempts a 3Pt. BLOCKED BY DAMIAN ALLEN! Ball is loose! Rebound secured by Draymond Irving.

[04:48] Team_078 possession (Score: 68-86)
Paul Ming loses control! Ball rolls out of bounds! TURNOVER! (dead ball)

[04:37] Team_098 possession (Score: 68-86)
Tracy Rose attempts a 3Pt. Contested by Damian Allen (5.0 feet, ZONE). Tracy Rose misses. Rebound secured by Draymond Irving.

[04:26] Team_078 possession (Score: 68-86)
Paul Ming attempts a Layup. Contested by Russell McGrady (3.8 feet, ZONE). PAUL MING MAKES IT! Assist: Magic Barrett
Score: 70-86

[04:15] Team_098 possession (Score: 70-86)
Russell McGrady drives to the basket... Russell McGrady loses the ball! Stripped by Draymond Irving! TURNOVER! (live ball)

[04:06] Team_078 possession (Score: 70-86)
Draymond Irving attempts a Layup. Contested by Russell McGrady (4.2 feet, MAN). DRAYMOND IRVING MAKES IT!
Score: 72-86

[03:52] Team_098 possession (Score: 72-86)
Tracy Rose attempts a 3Pt. Contested by Damian Allen (5.0 feet, ZONE). Tracy Rose misses. Rebound secured by Malcolm Randle.

[03:40] Team_078 possession (Score: 72-86)
Malcolm Randle attempts a 3Pt. Contested by Dirk McCollum (4.4 feet, ZONE). Malcolm Randle misses. Rebound secured by Kristaps Iverson.

[03:27] Team_098 possession (Score: 72-86)
Tracy Rose makes the Dunk and draws the foul on Paul Ming! And-1! Tracy Rose to the line for 1. [Team fouls: 1] (Paul Ming: 1 personal fouls)   FT 1/1: GOOD Tracy Rose makes 1/1 from the line.
Score: 72-89

[03:10] Team_078 possession (Score: 72-89)
Malcolm Randle drives, picks up Russell McGrady. Help arrives from Dirk McCollum! Malcolm Randle attempts a Layup. Contested by Dirk McCollum (4.0 feet, ZONE). MALCOLM RANDLE MAKES IT!
Score: 74-89

[02:55] Team_098 possession (Score: 74-89)
Manu Jordan attempts a 3Pt. Contested by Damian Allen (5.1 feet, ZONE). Manu Jordan misses. Rebound secured by Paul Ming.

[02:40] Team_078 possession (Score: 74-89)
Magic Barrett makes the Layup and draws the foul on Kristaps Iverson! And-1! Magic Barrett to the line for 1. [Team fouls: 2] (Kristaps Iverson: 1 personal fouls)   FT 1/1: GOOD Magic Barrett makes 1/1 from the line.
Score: 77-89

[02:26] Team_098 possession (Score: 77-89)
Kristaps Iverson attempts a 3Pt. Contested by Magic Barrett (5.4 feet, ZONE). KRISTAPS IVERSON MAKES IT! Assist: Dirk McCollum
Score: 77-92

[02:09] Team_078 possession (Score: 77-92)
Damian Allen attempts a 3Pt. Contested by Dirk McCollum (4.3 feet, ZONE). Damian Allen misses. Offensive rebound by Draymond Irving! Draymond Irving kicks it out.

[01:57] Team_078 possession (Score: 77-92)
Malcolm Randle makes the Dunk and draws the foul on Manu Jordan! And-1! Malcolm Randle to the line for 1. [Team fouls: 3] (Manu Jordan: 1 personal fouls)   FT 1/1: GOOD Malcolm Randle makes 1/1 from the line.
Score: 80-92

[01:41] Team_098 possession (Score: 80-92)
Manu Jordan attempts a Midrange. Contested by Paul Ming (4.5 feet, ZONE). MANU JORDAN MAKES IT!
Score: 80-94

[01:30] Team_078 possession (Score: 80-94)
Draymond Irving makes the Layup and draws the foul on Russell McGrady! And-1! Draymond Irving to the line for 1. [Team fouls: 4] (Russell McGrady: 1 personal fouls)   FT 1/1: GOOD Draymond Irving makes 1/1 from the line.
Score: 83-94

[01:17] Team_098 possession (Score: 83-94)
FOUL! Shooting foul on Paul Ming. Kristaps Iverson to the line for 2 free throws. [Team fouls: 2] (Paul Ming: 2 personal fouls)   FT 1/2: GOOD   FT 2/2: GOOD Kristaps Iverson makes 2/2 from the line.
Score: 83-96

[00:59] Team_078 possession (Score: 83-96)
Malcolm Randle attempts a 3Pt. Contested by Dirk McCollum (4.4 feet, ZONE). MALCOLM RANDLE MAKES IT! Assist: Damian Allen
Score: 86-96

[00:45] Team_098 possession (Score: 86-96)
Dirk McCollum attempts a 3Pt. Contested by Damian Allen (5.0 feet, MAN). Dirk McCollum misses. Rebound secured by Draymond Irving.

[00:32] Team_078 possession (Score: 86-96)
Paul Ming attempts a Layup. Contested by Manu Jordan (4.7 feet, MAN). PAUL MING MAKES IT! Assist: Draymond Irving
Score: 88-96

[00:18] Team_098 possession (Score: 88-96)
Tracy Rose attempts a Midrange. Contested by Magic Barrett (5.5 feet, MAN). Tracy Rose misses. Rebound secured by Malcolm Randle.

[00:01] Team_078 possession (Score: 88-96)
Malcolm Randle drives, picks up Russell McGrady. Help arrives from Dirk McCollum! Malcolm Randle attempts a Dunk. Contested by Dirk McCollum (4.1 feet, ZONE). Malcolm Randle misses. Offensive rebound by Draymond Irving! Draymond Irving kicks it out.

================================================================================
                              4TH QUARTER COMPLETE                              
================================================================================

4TH QUARTER SCORE: Team_078 37, Team_098 28

BOX SCORE:
================================================================================

Team_078
--------------------------------------------------------------------------------
Player                MIN  PTS  REB  AST  TO      FG   FG%      3P   3P%
--------------------------------------------------------------------------------
Malcolm Randle         16   11    2    1   0   4/5    80.0     0/0   0.0
Magic Barrett          21    8    0    1   0   3/3   100.0     0/0   0.0
Jabari Barrett         33    7    3    1   0   3/4    75.0     0/0   0.0
Draymond Irving        16    5    5    1   0   2/3    66.7     0/0   0.0
Paul Ming              16    4    1    0   0   2/2   100.0     0/0   0.0
Ben Ginobili           33    2    0    2   0   1/1   100.0     0/0   0.0
Kyrie Carter           33    0    0    1   0   0/0     0.0     0/0   0.0
Isaiah Simmons         33    0    0    0   0   0/2     0.0     0/0   0.0
Damian Allen           16    0    0    2   0   0/1     0.0     0/0   0.0

TEAM: FG: 15/21 (71.4%), 3PT: 4/8 (50.0%), REB: 11 (3 off, 8 def), AST: 9, TO: 3
TEAM FOULS: 2


Team_098
--------------------------------------------------------------------------------
Player                MIN  PTS  REB  AST  TO      FG   FG%      3P   3P%
--------------------------------------------------------------------------------
Pascal Lillard         33    8    1    0   0   3/3   100.0     0/0   0.0
Tracy Rose             21    5    0    1   0   2/6    33.3     0/0   0.0
Kristaps Iverson       16    5    2    0   0   2/2   100.0     0/0   0.0
Derrick Durant         33    4    1    1   0   2/2   100.0     0/0   0.0
Russell McGrady        16    4    2    0   0   2/2   100.0     0/0   0.0
Manu Jordan            16    2    1    0   0   1/3    33.3     0/0   0.0
Blake Murray           33    0    0    1   0   0/1     0.0     0/0   0.0
Nikola Rose            33    0    1    0   0   0/0     0.0     0/0   0.0
Dirk McCollum          16    0    0    1   0   0/1     0.0     0/0   0.0

TEAM: FG: 12/20 (60.0%), 3PT: 3/10 (30.0%), REB: 8 (3 off, 5 def), AST: 4, TO: 4
TEAM FOULS: 4

================================================================================

================================================================================
                               FULL GAME COMPLETE                               
================================================================================

FINAL SCORE: Team_078 88, Team_098 96

SCORING BY QUARTER:
--------------------------------------------------------------------------------
Team                     Q1     Q2     Q3     Q4    FINAL
--------------------------------------------------------------------------------
Team_078                 16     17     18     37       88
Team_098                 27     25     16     28       96
--------------------------------------------------------------------------------

FULL GAME BOX SCORE:
================================================================================

Team_078
--------------------------------------------------------------------------------
Player                MIN  PTS  REB  AST  TO      FG   FG%      3P   3P%      FT STL BLK
--------------------------------------------------------------------------------
Kyrie Carter           33    2    0    7   1   1/6    16.7   0/2     0.0   0/0     0   0
Isaiah Simmons         33   19   11    0   0   7/14   50.0   3/7    42.9   1/1     0   0
Ben Ginobili           33    8    7    2   2   3/8    37.5   0/1     0.0   2/2     0   0
Jabari Barrett         33   16   19    2   5   8/13   61.5   2/2   100.0   0/2     1   0
Jabari Barnes          28    5    0    2   0   2/8    25.0   1/5    20.0   0/0     0   0
Magic Barrett          21    8    0    2   1   3/4    75.0   1/2    50.0   1/1     0   0
Damian Allen           16    2    0    2   1   1/4    25.0   0/2     0.0   2/2     0   1
Malcolm Randle         16   13    4    2   0   5/8    62.5   2/4    50.0   1/1     0   0
Paul Ming              16    4    3    0   1   2/3    66.7   0/0     0.0   0/0     0   1
Draymond Irving        16   11    5    1   0   4/6    66.7   1/2    50.0   5/6     1   0

TEAM: FG: 38/76 (50.0%), 3PT: 10/27 (37.0%), REB: 49 (16 off, 33 def), AST: 20, TO: 11


Team_098
--------------------------------------------------------------------------------
Player                MIN  PTS  REB  AST  TO      FG   FG%      3P   3P%      FT STL BLK
--------------------------------------------------------------------------------
Nikola Rose            33   17    9    1   1   6/11   54.5   1/3    33.3   5/5     1   0
Blake Murray           33    2    0    1   1   0/9     0.0   0/4     0.0   2/3     0   2
Pascal Lillard         33   18   14    1   1   9/12   75.0   4/5    80.0   1/2     2   2
Derrick Durant         33   15    8    3   2   6/10   60.0   2/3    66.7   2/3     1   1
Malcolm Tatum          28    6    0    3   1   4/7    57.1   0/1     0.0   2/2     0   0
Tracy Rose             21    5    0    1   1   3/8    37.5   0/4     0.0   1/1     0   0
Dirk McCollum          16    0    0    2   1   0/2     0.0   0/1     0.0   0/0     1   0
Kristaps Iverson       16   17    8    0   2   7/7   100.0   3/3   100.0   2/2     0   0
Manu Jordan            16    4    1    2   0   2/4    50.0   0/2     0.0   0/0     0   0
Russell McGrady        16    9    8    2   1   3/4    75.0   0/0     0.0   1/1     0   0

TEAM: FG: 40/74 (54.1%), 3PT: 10/26 (38.5%), REB: 48 (11 off, 37 def), AST: 16, TO: 11

================================================================================
