================================================================================
                        FULL GAME - Team_028 vs Team_094                        
================================================================================

================================================================================
                       1ST QUARTER - Team_028 vs Team_094                       
================================================================================

[12:00] Team_028 possession (Score: 0-0)
Carmelo Carter makes the Dunk and draws the foul on Tim Russell! And-1! Carmelo Carter to the line for 1. [Team fouls: 1] (Tim Russell: 1 personal fouls)   FT 1/1: GOOD Carmelo Carter makes 1/1 from the line.
Score: 3-0

[11:48] Team_094 possession (Score: 3-0)
Kobe Bryant attempts a Layup. BLOCKED BY JIMMY BROGDON! Ball is loose! Offensive rebound by Tim Russell! Tim Russell kicks it out.

[11:37] Team_094 possession (Score: 3-0)
Tim Russell attempts a Layup. Contested by Kawhi Ball (4.4 feet, MAN). TIM RUSSELL MAKES IT! Assist: Kobe Bryant
Score: 3-2

[11:27] Team_028 possession (Score: 3-2)
Jimmy Brogdon attempts a 3Pt. Contested by Kobe Bryant (5.5 feet, MAN). Jimmy Brogdon misses. FOUL! Loose ball foul on Kobe Wagner during the rebound battle. [Team fouls: 2] No free throws, side out. (Kobe Wagner: 1 personal fouls)

[11:11] Team_028 possession (Score: 3-2)
Austin Russell drives to the basket... Austin Russell throws a bad pass! Stolen by Terry Ingram! TURNOVER! (live ball)

[10:55] Team_094 possession (Score: 3-2)
Tim Russell attempts a 3Pt. Contested by Austin Russell (4.6 feet, ZONE). Tim Russell misses. Rebound secured by Carmelo Carter.

[10:40] Team_028 possession (Score: 3-2)
FOUL! Shooting foul on Kobe Bryant. Carmelo Carter to the line for 2 free throws. [Team fouls: 3] (Kobe Bryant: 1 personal fouls)   FT 1/2: MISS   FT 2/2: GOOD Carmelo Carter makes 1/2 from the line.
Score: 4-2

[10:21] Team_094 possession (Score: 4-2)
Kobe Wagner drives, Kawhi Ball stays with him. Kobe Wagner attempts a Layup. Contested by Kawhi Ball (4.7 feet, ZONE). KOBE WAGNER MAKES IT! Assist: Lauri Thompson
Score: 4-4

[10:02] Team_028 possession (Score: 4-4)
Austin Russell attempts a Midrange. Contested by Terry Ingram (4.6 feet, MAN). Austin Russell misses. Rebound secured by Kobe Bryant.

[09:49] Team_094 possession (Score: 4-4)
Kobe Wagner attempts a 3Pt. Contested by Myles Haliburton (4.1 feet, MAN). Kobe Wagner misses. FOUL! Loose ball foul on Carmelo Carter during the rebound battle. [Team fouls: 1] No free throws, side out. (Carmelo Carter: 1 personal fouls)

[09:40] Team_094 possession (Score: 4-4)
Tim Russell makes the Layup and draws the foul on Carmelo Carter! And-1! Tim Russell to the line for 1. [Team fouls: 2] (Carmelo Carter: 2 personal fouls)   FT 1/1: GOOD Tim Russell makes 1/1 from the line.
Score: 4-7

[09:27] Team_028 possession (Score: 4-7)
Myles Haliburton attempts a 3Pt. Contested by Kobe Wagner (4.2 feet, MAN). Myles Haliburton misses. Rebound secured by Kobe Bryant.

[09:11] Team_094 possession (Score: 4-7)
FOUL! Reach-in foul on Kawhi Ball during the drive. [Team fouls: 3] No free throws, side out. (Kawhi Ball: 1 personal fouls)

[08:54] Team_094 possession (Score: 4-7)
Lauri Thompson attempts a Layup. Contested by Kawhi Ball (4.6 feet, ZONE). LAURI THOMPSON MAKES IT! Assist: Terry Ingram
Score: 4-9

[08:44] Team_028 possession (Score: 4-9)
Austin Russell commits a violation (traveling/carry)! TURNOVER! (dead ball)

[08:32] Team_094 possession (Score: 4-9)
Terry Ingram makes the Dunk and draws the foul on Austin Russell! And-1! Terry Ingram to the line for 1. [Team fouls: 4] (Austin Russell: 1 personal fouls)   FT 1/1: GOOD Terry Ingram makes 1/1 from the line.
Score: 4-12

[08:18] Team_028 possession (Score: 4-12)
Kawhi Ball attempts a Midrange. Contested by Tim Russell (5.0 feet, MAN). KAWHI BALL MAKES IT! Assist: Myles Haliburton
Score: 6-12

[08:05] Team_094 possession (Score: 6-12)
Kobe Bryant drives, Jimmy Brogdon stays with him. Kobe Bryant attempts a Dunk. Contested by Jimmy Brogdon (4.5 feet, MAN). Kobe Bryant misses. Rebound secured by Kawhi Ball.

[07:45] Team_028 possession (Score: 6-12)
Kawhi Ball drives, Tim Russell stays with him. Kawhi Ball attempts a Dunk. Contested by Tim Russell (5.0 feet, MAN). KAWHI BALL MAKES IT!
Score: 8-12

[07:34] Team_094 possession (Score: 8-12)
Lauri Thompson throws a bad pass out of bounds! TURNOVER! (dead ball)

[07:16] Team_028 possession (Score: 8-12)
Myles Haliburton drives, Kobe Wagner stays with him. Myles Haliburton attempts a Layup. Contested by Kobe Wagner (4.2 feet, MAN). Myles Haliburton misses. Rebound secured by Kobe Wagner.

[07:00] Team_094 possession (Score: 8-12)
Terry Ingram attempts a 3Pt. Contested by Austin Russell (4.8 feet, MAN). Terry Ingram misses. Rebound secured by Carmelo Carter.

[06:44] Team_028 possession (Score: 8-12)
FOUL! Shooting foul on Kobe Wagner. Myles Haliburton to the line for 2 free throws. [Team fouls: 4] (Kobe Wagner: 2 personal fouls)   FT 1/2: MISS   FT 2/2: GOOD Myles Haliburton makes 1/2 from the line.
Score: 9-12

[06:28] Team_094 possession (Score: 9-12)
FOUL! Reach-in foul on Kawhi Ball during the drive. [IN THE BONUS! 5 team fouls] Kobe Bryant to the line for 2 free throws. (Kawhi Ball: 2 personal fouls)   FT 1/2: GOOD   FT 2/2: GOOD Kobe Bryant makes 2/2 from the line.
Score: 9-14

[06:13] Team_028 possession (Score: 9-14)
Austin Russell attempts a 3Pt. Contested by Kobe Wagner (4.0 feet, ZONE). Austin Russell misses. Rebound secured by Kobe Bryant.

[05:54] Team_094 possession (Score: 9-14)
Kobe Wagner drives, Myles Haliburton stays with him. Kobe Wagner attempts a Layup. Contested by Myles Haliburton (4.1 feet, MAN). KOBE WAGNER MAKES IT! Assist: Lauri Thompson
Score: 9-16

[05:43] Team_028 possession (Score: 9-16)
Jimmy Brogdon drives, Kobe Bryant stays with him. Jimmy Brogdon attempts a Layup. Contested by Kobe Bryant (5.5 feet, MAN). Jimmy Brogdon misses. Rebound secured by Kobe Bryant.

[05:28] Team_094 possession (Score: 9-16)
Kobe Wagner attempts a 3Pt. Contested by Myles Haliburton (4.1 feet, MAN). KOBE WAGNER MAKES IT!
Score: 9-19

[05:17] Team_028 possession (Score: 9-19)
FOUL! Offensive foul on Austin Russell! Terry Ingram drew the charge! [Team fouls: 6] (Austin Russell: 2 personal fouls) TURNOVER! (dead ball)

[05:07] Team_094 possession (Score: 9-19)
Lauri Thompson attempts a 3Pt. Contested by Austin Russell (4.8 feet, ZONE). Lauri Thompson misses. Rebound secured by Carmelo Carter.

[04:55] Team_028 possession (Score: 9-19)
Carmelo Carter loses the ball! Stripped by Lauri Thompson! TURNOVER! (live ball)

[04:36] Team_094 possession (Score: 9-19)
FOUL! Shooting foul on Carmelo Carter. Kobe Wagner to the line for 2 free throws. [BONUS: 7 team fouls] (Carmelo Carter: 3 personal fouls)   FT 1/2: GOOD   FT 2/2: MISS Kobe Wagner makes 1/2 from the line. Rebound secured by Kawhi Ball.
Score: 9-20

[04:22] Team_028 possession (Score: 9-20)
Myles Haliburton attempts a Midrange. Contested by Kobe Wagner (4.3 feet, MAN). MYLES HALIBURTON MAKES IT!
Score: 11-20

[04:06] Team_094 possession (Score: 11-20)
Tim Russell makes the Midrange and draws the foul on Kawhi Ball! And-1! Tim Russell to the line for 1. [BONUS: 8 team fouls] (Kawhi Ball: 3 personal fouls)   FT 1/1: GOOD Tim Russell makes 1/1 from the line.
Score: 11-23

[03:49] Team_028 possession (Score: 11-23)
Austin Russell drives, Terry Ingram stays with him. Austin Russell attempts a Layup. Contested by Terry Ingram (4.7 feet, MAN). Austin Russell misses. Rebound secured by Kobe Bryant.

[03:36] Team_094 possession (Score: 11-23)
Kobe Wagner attempts a 3Pt. Contested by Austin Russell (5.0 feet, ZONE). Kobe Wagner misses. Rebound secured by Carmelo Carter.

[03:26] Team_028 possession (Score: 11-23)
Kawhi Ball attempts a Midrange. Contested by Lauri Thompson (5.1 feet, ZONE). KAWHI BALL MAKES IT!
Score: 13-23

[03:14] Team_094 possession (Score: 13-23)
Kobe Bryant drives and kicks out. Kobe Wagner attempts a 3Pt. Contested by Austin Russell (4.6 feet, ZONE). Kobe Wagner misses. Offensive rebound by Kobe Bryant! Kobe Bryant's putback is no good. Offensive rebound by Tim Russell! Tim Russell kicks it out.

[02:56] Team_094 possession (Score: 13-23)
FOUL! Holding foul on Kawhi Ball. [IN THE BONUS! 9 team fouls] Tim Russell to the line for 2 free throws. (Kawhi Ball: 4 personal fouls)   FT 1/2: GOOD   FT 2/2: MISS Tim Russell makes 1/2 from the line. Rebound secured by Kawhi Ball.
Score: 13-24

[02:40] Team_028 possession (Score: 13-24)
Myles Haliburton drives to the basket... Myles Haliburton loses the ball! Stripped by Kobe Wagner! TURNOVER! (live ball)

[02:26] Team_094 possession (Score: 13-24)
Lauri Thompson attempts a Layup. Contested by Kawhi Ball (4.9 feet, ZONE). LAURI THOMPSON MAKES IT! Assist: Terry Ingram
Score: 13-26

[02:11] Team_028 possession (Score: 13-26)
Austin Russell attempts a 3Pt. Contested by Kobe Wagner (4.3 feet, ZONE). AUSTIN RUSSELL MAKES IT! Assist: Kawhi Ball
Score: 16-26

[01:53] Team_094 possession (Score: 16-26)
Terry Ingram attempts a Midrange. Contested by Myles Haliburton (4.2 feet, ZONE). TERRY INGRAM MAKES IT!
Score: 16-28

[01:41] Team_028 possession (Score: 16-28)
Austin Russell attempts a Midrange. Contested by Terry Ingram (5.0 feet, MAN). Austin Russell misses. Rebound secured by Kobe Bryant.

[01:27] Team_094 possession (Score: 16-28)
Kobe Wagner makes the Dunk and draws the foul on Myles Haliburton! And-1! Kobe Wagner to the line for 1. [BONUS: 10 team fouls] (Myles Haliburton: 1 personal fouls)   FT 1/1: GOOD Kobe Wagner makes 1/1 from the line.
Score: 16-31

[01:07] Team_028 possession (Score: 16-31)
Austin Russell attempts a 3Pt. Contested by Terry Ingram (5.0 feet, MAN). Austin Russell misses. Offensive rebound by Jimmy Brogdon! Jimmy Brogdon kicks it out.

[00:51] Team_028 possession (Score: 16-31)
Carmelo Carter attempts a Midrange. Contested by Tim Russell (5.5 feet, ZONE). CARMELO CARTER MAKES IT! Assist: Austin Russell
Score: 18-31

[00:32] Team_094 possession (Score: 18-31)
Terry Ingram drives, Kawhi Ball stays with him. Terry Ingram attempts a Layup. Contested by Kawhi Ball (5.1 feet, ZONE). TERRY INGRAM MAKES IT! Assist: Kobe Bryant
Score: 18-33

[00:13] Team_028 possession (Score: 18-33)
Myles Haliburton attempts a 3Pt. Contested by Lauri Thompson (5.3 feet, ZONE). MYLES HALIBURTON MAKES IT! Assist: Kawhi Ball
Score: 21-33

================================================================================
                              1ST QUARTER COMPLETE                              
================================================================================

1ST QUARTER SCORE: Team_028 21, Team_094 33

BOX SCORE:
================================================================================

Team_028
--------------------------------------------------------------------------------
Player                MIN  PTS  REB  AST  TO      FG   FG%      3P   3P%
--------------------------------------------------------------------------------
Carmelo Carter         12    6    4    0   0   3/3   100.0     0/0   0.0
Myles Haliburton       12    6    0    1   0   3/5    60.0     0/0   0.0
Kawhi Ball             12    6    3    2   0   3/3   100.0     0/0   0.0
Austin Russell         12    3    0    1   0   1/5    20.0     0/0   0.0
Jimmy Brogdon          12    0    2    0   0   0/1     0.0     0/0   0.0

TEAM: FG: 10/17 (58.8%), 3PT: 2/4 (50.0%), REB: 9 (2 off, 7 def), AST: 4, TO: 5
TEAM FOULS: 10 [Team_094 in BONUS]


Team_094
--------------------------------------------------------------------------------
Player                MIN  PTS  REB  AST  TO      FG   FG%      3P   3P%
--------------------------------------------------------------------------------
Kobe Wagner            12   10    1    0   0   4/6    66.7     0/0   0.0
Tim Russell            12    8    2    0   0   3/4    75.0     0/0   0.0
Terry Ingram           12    7    0    2   0   3/4    75.0     0/0   0.0
Lauri Thompson         12    4    0    2   0   2/3    66.7     0/0   0.0
Kobe Bryant            12    2    7    2   0   1/2    50.0     0/0   0.0

TEAM: FG: 13/20 (65.0%), 3PT: 1/5 (20.0%), REB: 10 (3 off, 7 def), AST: 6, TO: 1
TEAM FOULS: 4

================================================================================

================================================================================
                       2ND QUARTER - Team_028 vs Team_094                       
================================================================================

[12:00] Team_028 possession (Score: 21-33)
Austin Russell attempts a 3Pt. Contested by Terry Ingram (4.9 feet, MAN). AUSTIN RUSSELL MAKES IT! Assist: Kawhi Ball
Score: 24-33

[11:43] Team_094 possession (Score: 24-33)
Kobe Wagner attempts a Midrange. Contested by Kawhi Ball (5.0 feet, ZONE). KOBE WAGNER MAKES IT! Assist: Tim Russell
Score: 24-35

[11:30] Team_028 possession (Score: 24-35)
Jimmy Brogdon attempts a Midrange. Contested by Tim Russell (5.5 feet, ZONE). Jimmy Brogdon misses. Rebound secured by Kobe Bryant.

[11:14] Team_094 possession (Score: 24-35)
Kobe Bryant attempts a Midrange. BLOCKED BY CARMELO CARTER! Ball deflects out of bounds off Kobe Bryant.

[11:01] Team_028 possession (Score: 24-35)
Carmelo Carter attempts a Midrange. Contested by Tim Russell (5.4 feet, ZONE). Carmelo Carter misses. Offensive rebound by Jimmy Brogdon! Jimmy Brogdon kicks it out.

[10:50] Team_028 possession (Score: 24-35)
Jimmy Brogdon drives and kicks out. Myles Haliburton attempts a Midrange. Contested by Kobe Wagner (4.5 feet, MAN). MYLES HALIBURTON MAKES IT!
Score: 26-35

[10:36] Team_094 possession (Score: 26-35)
Tim Russell attempts a Midrange. Contested by Kawhi Ball (4.9 feet, MAN). TIM RUSSELL MAKES IT!
Score: 26-37

[10:19] Team_028 possession (Score: 26-37)
Kawhi Ball attempts a Layup. Contested by Tim Russell (5.3 feet, MAN). KAWHI BALL MAKES IT! Assist: Carmelo Carter
Score: 28-37

[10:02] Team_094 possession (Score: 28-37)
Lauri Thompson attempts a 3Pt. Contested by Austin Russell (5.2 feet, ZONE). Lauri Thompson misses. Offensive rebound by Tim Russell! Tim Russell kicks it out.

[09:49] Team_094 possession (Score: 28-37)
Kobe Wagner drives, Myles Haliburton stays with him. Kobe Wagner attempts a Layup. Contested by Myles Haliburton (4.5 feet, MAN). Kobe Wagner misses. Rebound secured by Carmelo Carter.

[09:35] Team_028 possession (Score: 28-37)
Austin Russell drives and kicks out. Austin Russell attempts a Midrange. Contested by Terry Ingram (5.4 feet, MAN). Austin Russell misses. Rebound secured by Tim Russell.

[09:23] Team_094 possession (Score: 28-37)
Terry Ingram attempts a 3Pt. Contested by Austin Russell (5.2 feet, ZONE). TERRY INGRAM MAKES IT! Assist: Lauri Thompson
Score: 28-40

[09:09] Team_028 possession (Score: 28-40)
Jimmy Brogdon attempts a Layup. Contested by Tim Russell (5.8 feet, ZONE). Jimmy Brogdon misses. Rebound secured by Kobe Wagner.

[08:55] Team_094 possession (Score: 28-40)
Kobe Wagner drives to the basket... Kobe Wagner throws a bad pass! Stolen by Jimmy Brogdon! TURNOVER! (live ball)

[08:43] Team_028 possession (Score: 28-40)
Myles Haliburton drives, Tim Russell stays with him. Myles Haliburton attempts a Dunk. Contested by Tim Russell (5.5 feet, ZONE). MYLES HALIBURTON MAKES IT! Assist: Carmelo Carter
Score: 30-40

[08:31] Team_094 possession (Score: 30-40)
Lauri Thompson attempts a Layup. Contested by Kawhi Ball (5.4 feet, ZONE). Lauri Thompson misses. Rebound secured by Carmelo Carter.

[08:11] Team_028 possession (Score: 30-40)
Jimmy Brogdon attempts a Midrange. Contested by Tim Russell (5.8 feet, ZONE). Jimmy Brogdon misses. Rebound secured by Kobe Bryant.

[07:56] Team_094 possession (Score: 30-40)
Kobe Bryant attempts a Midrange. Contested by Jimmy Brogdon (5.4 feet, MAN). Kobe Bryant misses. Rebound secured by Carmelo Carter.

[07:42] Team_028 possession (Score: 30-40)
Myles Haliburton attempts a 3Pt. Contested by Kobe Wagner (5.0 feet, MAN). Myles Haliburton misses. Rebound secured by Kobe Wagner.

[07:30] Team_094 possession (Score: 30-40)
Terry Ingram drives to the basket... FOUL! Offensive foul on Terry Ingram! Kawhi Ball drew the charge! [Team fouls: 1] (Terry Ingram: 1 personal fouls) TURNOVER! (dead ball)

[07:11] Team_028 possession (Score: 30-40)
Jimmy Brogdon attempts a Midrange. Wide open! Kobe Bryant is 6.1 feet away. [ZONE] JIMMY BROGDON MAKES IT!
Score: 32-40

[06:56] Team_094 possession (Score: 32-40)
Tim Russell attempts a Midrange. Contested by Kawhi Ball (5.4 feet, MAN). Tim Russell misses. Rebound secured by Jimmy Brogdon.

[06:40] Team_028 possession (Score: 32-40)
FOUL! Reach-in foul on Kobe Bryant during the drive. [Team fouls: 2] No free throws, side out. (Kobe Bryant: 1 personal fouls)

[06:28] Team_028 possession (Score: 32-40)
Myles Haliburton drives to the basket... Myles Haliburton loses the ball! Stripped by Tim Russell! TURNOVER! (live ball)

[06:16] Team_094 possession (Score: 32-40)
Terry Ingram drives to the basket... Terry Ingram loses control! Ball rolls out of bounds! TURNOVER! (dead ball)

[06:16] Substitution (Team_028): Austin Russell OUT → Scottie Ingram IN (stamina_rule2)

[06:16] Substitution (Team_028): Carmelo Carter OUT → Tyrese Quickley IN (stamina_rule2)

[06:16] Substitution (Team_028): Myles Haliburton OUT → Miles Booker IN (stamina_rule2)

[06:16] Substitution (Team_028): Kawhi Ball OUT → Bam Towns IN (stamina_rule2)

[06:16] Substitution (Team_028): Jimmy Brogdon OUT → Collin Bridges IN (stamina_rule2)

[06:16] Substitution (Team_094): Terry Ingram OUT → Shaquille Bryant IN (stamina_rule2)

[06:16] Substitution (Team_094): Lauri Thompson OUT → Kevin Rozier IN (stamina_rule2)

[06:16] Substitution (Team_094): Kobe Wagner OUT → Ayo Gasol IN (stamina_rule2)

[06:16] Substitution (Team_094): Tim Russell OUT → Domantas Haliburton IN (stamina_rule2)

[06:16] Substitution (Team_094): Kobe Bryant OUT → Isaiah Quickley IN (stamina_rule2)

[06:01] Team_028 possession (Score: 32-40)
Scottie Ingram attempts a Layup. Contested by Shaquille Bryant (5.3 feet, MAN). SCOTTIE INGRAM MAKES IT!
Score: 34-40

[05:49] Team_094 possession (Score: 34-40)
Isaiah Quickley attempts a 3Pt. Contested by Collin Bridges (4.1 feet, MAN). Isaiah Quickley misses. Rebound secured by Bam Towns.

[05:32] Team_028 possession (Score: 34-40)
Collin Bridges attempts a Layup. Wide open! Domantas Haliburton is 6.0 feet away. [ZONE] COLLIN BRIDGES MAKES IT!
Score: 36-40

[05:23] Team_094 possession (Score: 36-40)
Ayo Gasol attempts a 3Pt. Wide open! Miles Booker is 6.2 feet away. [MAN] Ayo Gasol misses. Offensive rebound by Domantas Haliburton! Domantas Haliburton kicks it out.

[05:07] Team_094 possession (Score: 36-40)
Isaiah Quickley makes the Dunk and draws the foul on Collin Bridges! And-1! Isaiah Quickley to the line for 1. [Team fouls: 1] (Collin Bridges: 1 personal fouls)   FT 1/1: GOOD Isaiah Quickley makes 1/1 from the line.
Score: 36-43

[04:51] Team_028 possession (Score: 36-43)
Miles Booker attempts a 3Pt. Contested by Ayo Gasol (4.9 feet, MAN). MILES BOOKER MAKES IT! Assist: Scottie Ingram
Score: 39-43

[04:37] Team_094 possession (Score: 39-43)
Isaiah Quickley attempts a Layup. Contested by Collin Bridges (4.1 feet, ZONE). ISAIAH QUICKLEY MAKES IT! Assist: Shaquille Bryant
Score: 39-45

[04:24] Team_028 possession (Score: 39-45)
Tyrese Quickley throws a bad pass out of bounds! TURNOVER! (dead ball)

[04:09] Team_094 possession (Score: 39-45)
Ayo Gasol drives, Collin Bridges stays with him. Ayo Gasol attempts a Layup. Contested by Collin Bridges (4.1 feet, ZONE). AYO GASOL MAKES IT!
Score: 39-47

[03:57] Team_028 possession (Score: 39-47)
Bam Towns attempts a Layup. Contested by Domantas Haliburton (5.9 feet, MAN). BAM TOWNS MAKES IT! Assist: Collin Bridges
Score: 41-47

[03:43] Team_094 possession (Score: 41-47)
Kevin Rozier attempts a 3Pt. Contested by Tyrese Quickley (4.9 feet, MAN). Kevin Rozier misses. Rebound secured by Tyrese Quickley.

[03:26] Team_028 possession (Score: 41-47)
Scottie Ingram attempts a 3Pt. Contested by Shaquille Bryant (5.3 feet, MAN). SCOTTIE INGRAM MAKES IT!
Score: 44-47

[03:07] Team_094 possession (Score: 44-47)
Domantas Haliburton drives to the basket... Domantas Haliburton loses the ball! Stripped by Collin Bridges! TURNOVER! (live ball)

[02:49] Team_028 possession (Score: 44-47)
Scottie Ingram attempts a Midrange. Contested by Shaquille Bryant (5.3 feet, MAN). Scottie Ingram misses. Rebound secured by Domantas Haliburton.

[02:38] Team_094 possession (Score: 44-47)
Ayo Gasol drives, Miles Booker stays with him. Ayo Gasol attempts a Dunk. Wide open! Miles Booker is 6.2 feet away. [MAN] AYO GASOL MAKES IT!
Score: 44-49

[02:26] Team_028 possession (Score: 44-49)
Miles Booker attempts a Layup. Wide open! Isaiah Quickley is 6.0 feet away. [ZONE] Miles Booker misses. Rebound secured by Ayo Gasol.

[02:15] Team_094 possession (Score: 44-49)
Shaquille Bryant drives and kicks out. Domantas Haliburton attempts a 3Pt. Contested by Collin Bridges (3.8 feet, MAN). Domantas Haliburton misses. Rebound secured by Tyrese Quickley.

[02:01] Team_028 possession (Score: 44-49)
Miles Booker attempts a 3Pt. Contested by Domantas Haliburton (5.8 feet, ZONE). Miles Booker misses. Rebound secured by Isaiah Quickley.

[01:43] Team_094 possession (Score: 44-49)
Isaiah Quickley attempts a Midrange. Contested by Bam Towns (5.4 feet, ZONE). ISAIAH QUICKLEY MAKES IT!
Score: 44-51

[01:29] Team_028 possession (Score: 44-51)
Miles Booker attempts a Midrange. Contested by Ayo Gasol (4.9 feet, ZONE). MILES BOOKER MAKES IT!
Score: 46-51

[01:17] Team_094 possession (Score: 46-51)
FOUL! Reach-in foul on Collin Bridges during the drive. [Team fouls: 2] No free throws, side out. (Collin Bridges: 2 personal fouls)

[01:06] Team_094 possession (Score: 46-51)
Domantas Haliburton drives, picks up Collin Bridges. Help arrives from Tyrese Quickley! Domantas Haliburton attempts a Dunk. Contested by Tyrese Quickley (3.9 feet, ZONE). DOMANTAS HALIBURTON MAKES IT! Assist: Shaquille Bryant
Score: 46-53

[00:49] Team_028 possession (Score: 46-53)
FOUL! Holding foul on Shaquille Bryant. [Team fouls: 3] No free throws, side out. (Shaquille Bryant: 1 personal fouls)

[00:30] Team_028 possession (Score: 46-53)
Tyrese Quickley attempts a Midrange. Contested by Kevin Rozier (5.2 feet, ZONE). Tyrese Quickley misses. Rebound secured by Domantas Haliburton.

[00:13] Team_094 possession (Score: 46-53)
FOUL! Shooting foul on Collin Bridges. Domantas Haliburton to the line for 2 free throws. [Team fouls: 3] (Collin Bridges: 3 personal fouls)   FT 1/2: GOOD   FT 2/2: GOOD Domantas Haliburton makes 2/2 from the line.
Score: 46-55

================================================================================
                              2ND QUARTER COMPLETE                              
================================================================================

2ND QUARTER SCORE: Team_028 25, Team_094 22

BOX SCORE:
================================================================================

Team_028
--------------------------------------------------------------------------------
Player                MIN  PTS  REB  AST  TO      FG   FG%      3P   3P%
--------------------------------------------------------------------------------
Scottie Ingram          6    5    0    1   0   2/3    66.7     0/0   0.0
Miles Booker            6    5    0    0   0   2/4    50.0     0/0   0.0
Myles Haliburton       18    4    0    0   0   2/3    66.7     0/0   0.0
Austin Russell         18    3    0    0   0   1/2    50.0     0/0   0.0
Kawhi Ball             18    2    0    1   0   1/1   100.0     0/0   0.0
Jimmy Brogdon          18    2    2    0   0   1/4    25.0     0/0   0.0
Bam Towns               6    2    1    0   0   1/1   100.0     0/0   0.0
Collin Bridges          6    2    0    1   0   1/1   100.0     0/0   0.0
Carmelo Carter         18    0    3    2   0   0/0     0.0     0/0   0.0
Tyrese Quickley         6    0    2    0   0   0/1     0.0     0/0   0.0

TEAM: FG: 11/20 (55.0%), 3PT: 3/5 (60.0%), REB: 8 (1 off, 7 def), AST: 5, TO: 2
TEAM FOULS: 3


Team_094
--------------------------------------------------------------------------------
Player                MIN  PTS  REB  AST  TO      FG   FG%      3P   3P%
--------------------------------------------------------------------------------
Isaiah Quickley         6    7    1    0   0   3/4    75.0     0/0   0.0
Domantas Haliburton     6    4    3    0   0   2/2   100.0     0/0   0.0
Ayo Gasol               6    4    1    0   0   2/2   100.0     0/0   0.0
Terry Ingram           18    3    0    0   0   1/1   100.0     0/0   0.0
Kobe Wagner            18    2    2    0   0   1/2    50.0     0/0   0.0
Tim Russell            18    2    2    1   0   1/2    50.0     0/0   0.0
Kobe Bryant            18    0    2    0   0   0/2     0.0     0/0   0.0
Lauri Thompson         18    0    0    1   0   0/1     0.0     0/0   0.0
Shaquille Bryant        6    0    0    2   0   0/1     0.0     0/0   0.0
Kevin Rozier            6    0    0    0   0   0/1     0.0     0/0   0.0

TEAM: FG: 10/18 (55.6%), 3PT: 1/3 (33.3%), REB: 11 (2 off, 9 def), AST: 4, TO: 4
TEAM FOULS: 3

================================================================================

================================================================================
                       3RD QUARTER - Team_028 vs Team_094                       
================================================================================

[12:00] Team_028 possession (Score: 46-55)
FOUL! Shooting foul on Lauri Thompson. Carmelo Carter to the line for 2 free throws. [Team fouls: 1] (Lauri Thompson: 1 personal fouls)   FT 1/2: GOOD   FT 2/2: GOOD Carmelo Carter makes 2/2 from the line.
Score: 48-55

[11:44] Team_094 possession (Score: 48-55)
Terry Ingram drives, Kawhi Ball stays with him. Terry Ingram attempts a Layup. Contested by Kawhi Ball (4.6 feet, ZONE). Terry Ingram misses. Rebound secured by Carmelo Carter.

[11:34] Team_028 possession (Score: 48-55)
Carmelo Carter attempts a Layup. Contested by Tim Russell (5.1 feet, ZONE). CARMELO CARTER MAKES IT! Assist: Austin Russell
Score: 50-55

[11:20] Team_094 possession (Score: 50-55)
Lauri Thompson attempts a 3Pt. Contested by Austin Russell (4.8 feet, ZONE). Lauri Thompson misses. Rebound secured by Jimmy Brogdon.

[11:08] Team_028 possession (Score: 50-55)
FOUL! Reach-in foul on Kobe Wagner during the drive. [Team fouls: 2] No free throws, side out. (Kobe Wagner: 1 personal fouls)

[10:55] Team_028 possession (Score: 50-55)
Jimmy Brogdon attempts a 3Pt. Contested by Kobe Wagner (4.6 feet, ZONE). Jimmy Brogdon misses. Rebound secured by Kobe Wagner.

[10:41] Team_094 possession (Score: 50-55)
Kobe Wagner loses the ball! Stripped by Myles Haliburton! TURNOVER! (live ball)

[10:28] Team_028 possession (Score: 50-55)
Austin Russell attempts a Midrange. Contested by Terry Ingram (4.6 feet, MAN). Austin Russell misses. FOUL! Loose ball foul on Kobe Bryant during the rebound battle. [Team fouls: 3] No free throws, side out. (Kobe Bryant: 1 personal fouls)

[10:17] Team_028 possession (Score: 50-55)
FOUL! Shooting foul on Kobe Wagner. Myles Haliburton to the line for 2 free throws. [Team fouls: 4] (Kobe Wagner: 2 personal fouls)   FT 1/2: GOOD   FT 2/2: GOOD Myles Haliburton makes 2/2 from the line.
Score: 52-55

[10:01] Team_094 possession (Score: 52-55)
Lauri Thompson attempts a 3Pt. Contested by Austin Russell (4.8 feet, ZONE). Lauri Thompson misses. Rebound secured by Jimmy Brogdon.

[09:42] Team_028 possession (Score: 52-55)
Kawhi Ball loses the ball! Stripped by Tim Russell! TURNOVER! (live ball)

[09:26] Team_094 possession (Score: 52-55)
Terry Ingram attempts a Midrange. Contested by Austin Russell (4.8 feet, MAN). Terry Ingram misses. Rebound secured by Carmelo Carter.

[09:10] Team_028 possession (Score: 52-55)
Austin Russell attempts a 3Pt. Contested by Kobe Wagner (4.0 feet, ZONE). Austin Russell misses. Rebound secured by Tim Russell.

[08:55] Team_094 possession (Score: 52-55)
Kobe Bryant throws a bad pass out of bounds! TURNOVER! (dead ball)

[08:42] Team_028 possession (Score: 52-55)
Myles Haliburton attempts a 3Pt. Contested by Kobe Wagner (4.2 feet, MAN). Myles Haliburton misses. Rebound secured by Tim Russell.

[08:28] Team_094 possession (Score: 52-55)
Kobe Wagner drives to the basket... Kobe Wagner throws a bad pass out of bounds! TURNOVER! (dead ball)

[08:16] Team_028 possession (Score: 52-55)
Carmelo Carter drives and kicks out. Jimmy Brogdon attempts a Midrange. Contested by Lauri Thompson (4.8 feet, ZONE). Jimmy Brogdon misses. Rebound secured by Kobe Wagner.

[08:01] Team_094 possession (Score: 52-55)
Lauri Thompson makes the Dunk and draws the foul on Carmelo Carter! And-1! Lauri Thompson to the line for 1. [Team fouls: 1] (Carmelo Carter: 1 personal fouls)   FT 1/1: GOOD Lauri Thompson makes 1/1 from the line.
Score: 52-58

[07:43] Team_028 possession (Score: 52-58)
Austin Russell loses the ball! Stripped by Terry Ingram! TURNOVER! (live ball)

[07:27] Team_094 possession (Score: 52-58)
Tim Russell attempts a Midrange. Contested by Kawhi Ball (4.4 feet, MAN). Tim Russell misses. Offensive rebound by Kobe Bryant! Kobe Bryant's putback is no good. Rebound secured by Kawhi Ball.

[07:08] Team_028 possession (Score: 52-58)
Carmelo Carter attempts a 3Pt. Contested by Lauri Thompson (5.1 feet, MAN). CARMELO CARTER MAKES IT! Assist: Jimmy Brogdon
Score: 55-58

[06:55] Team_094 possession (Score: 55-58)
Terry Ingram attempts a Midrange. Contested by Carmelo Carter (4.8 feet, ZONE). TERRY INGRAM MAKES IT! Assist: Lauri Thompson
Score: 55-60

[06:41] Team_028 possession (Score: 55-60)
Carmelo Carter attempts a Layup. Contested by Lauri Thompson (5.1 feet, MAN). Carmelo Carter misses. Rebound secured by Kobe Bryant.

[06:27] Team_094 possession (Score: 55-60)
Tim Russell attempts a Midrange. Contested by Carmelo Carter (4.6 feet, ZONE). TIM RUSSELL MAKES IT!
Score: 55-62

[06:11] Team_028 possession (Score: 55-62)
Austin Russell attempts a 3Pt. Contested by Terry Ingram (4.6 feet, MAN). Austin Russell misses. Rebound secured by Tim Russell.

[05:57] Team_094 possession (Score: 55-62)
Kobe Bryant attempts a Layup. Contested by Jimmy Brogdon (4.5 feet, MAN). Kobe Bryant misses. Rebound secured by Jimmy Brogdon.

[05:42] Team_028 possession (Score: 55-62)
Jimmy Brogdon makes the Layup and draws the foul on Kobe Bryant! And-1! Jimmy Brogdon to the line for 1. [BONUS: 5 team fouls] (Kobe Bryant: 2 personal fouls)   FT 1/1: MISS Jimmy Brogdon makes 0/1 from the line. Rebound secured by Tim Russell.
Score: 57-62

[05:27] Team_094 possession (Score: 57-62)
Lauri Thompson attempts a 3Pt. Contested by Carmelo Carter (4.8 feet, MAN). Lauri Thompson misses. Offensive rebound by Kobe Bryant! Kobe Bryant puts it back in!
Score: 57-64

[05:15] Team_028 possession (Score: 57-64)
Myles Haliburton attempts a 3Pt. Contested by Kobe Wagner (4.2 feet, MAN). Myles Haliburton misses. Rebound secured by Kobe Bryant.

[04:59] Team_094 possession (Score: 57-64)
Tim Russell attempts a Layup. Contested by Kawhi Ball (4.5 feet, MAN). Tim Russell misses. Rebound secured by Carmelo Carter.

[04:42] Team_028 possession (Score: 57-64)
Jimmy Brogdon loses control! Ball rolls out of bounds! TURNOVER! (dead ball)

[04:31] Team_094 possession (Score: 57-64)
Tim Russell attempts a 3Pt. Contested by Kawhi Ball (4.5 feet, MAN). Tim Russell misses. Rebound secured by Carmelo Carter.

[04:16] Team_028 possession (Score: 57-64)
Austin Russell attempts a Midrange. Contested by Terry Ingram (4.7 feet, MAN). AUSTIN RUSSELL MAKES IT!
Score: 59-64

[04:01] Team_094 possession (Score: 59-64)
Lauri Thompson attempts a 3Pt. Contested by Carmelo Carter (4.9 feet, ZONE). Lauri Thompson misses. Rebound secured by Jimmy Brogdon.

[03:46] Team_028 possession (Score: 59-64)
Myles Haliburton attempts a Layup. Contested by Tim Russell (5.0 feet, ZONE). Myles Haliburton misses. FOUL! Loose ball foul on Kobe Bryant during the rebound battle. [IN THE BONUS! 6 team fouls] Kawhi Ball to the line for 2 free throws. (Kobe Bryant: 3 personal fouls)   FT 1/2: GOOD   FT 2/2: MISS Kawhi Ball makes 1/2 from the line. Rebound secured by Tim Russell.
Score: 60-64

[03:32] Team_094 possession (Score: 60-64)
Tim Russell attempts a 3Pt. Contested by Kawhi Ball (4.6 feet, MAN). TIM RUSSELL MAKES IT! Assist: Kobe Wagner
Score: 60-67

[03:19] Team_028 possession (Score: 60-67)
FOUL! Shooting foul on Kobe Wagner. Jimmy Brogdon to the line for 2 free throws. [BONUS: 7 team fouls] (Kobe Wagner: 3 personal fouls)   FT 1/2: GOOD   FT 2/2: GOOD Jimmy Brogdon makes 2/2 from the line.
Score: 62-67

[03:08] Team_094 possession (Score: 62-67)
Kobe Bryant drives, picks up Kawhi Ball. Help arrives from Carmelo Carter! Kobe Bryant attempts a Dunk. Contested by Carmelo Carter (4.7 feet, ZONE). KOBE BRYANT MAKES IT!
Score: 62-69

[02:54] Team_028 possession (Score: 62-69)
Jimmy Brogdon attempts a Midrange. Contested by Kobe Bryant (5.6 feet, MAN). JIMMY BROGDON MAKES IT!
Score: 64-69

[02:42] Team_094 possession (Score: 64-69)
Lauri Thompson makes the Dunk and draws the foul on Carmelo Carter! And-1! Lauri Thompson to the line for 1. [Team fouls: 2] (Carmelo Carter: 2 personal fouls)   FT 1/1: GOOD Lauri Thompson makes 1/1 from the line.
Score: 64-72

[02:24] Team_028 possession (Score: 64-72)
Jimmy Brogdon attempts a Midrange. Contested by Terry Ingram (5.5 feet, ZONE). Jimmy Brogdon misses. Rebound secured by Kobe Bryant.

[02:10] Team_094 possession (Score: 64-72)
Kobe Bryant commits a violation (traveling/carry)! TURNOVER! (dead ball)

[02:10] Substitution (Team_028): Austin Russell OUT → Scottie Ingram IN (stamina_rule2)

[02:10] Substitution (Team_028): Carmelo Carter OUT → Tyrese Quickley IN (stamina_rule2)

[02:10] Substitution (Team_028): Myles Haliburton OUT → Miles Booker IN (stamina_rule2)

[02:10] Substitution (Team_028): Kawhi Ball OUT → Bam Towns IN (stamina_rule2)

[02:10] Substitution (Team_028): Jimmy Brogdon OUT → Collin Bridges IN (stamina_rule2)

[02:10] Substitution (Team_094): Terry Ingram OUT → Shaquille Bryant IN (stamina_rule2)

[02:10] Substitution (Team_094): Lauri Thompson OUT → Kevin Rozier IN (stamina_rule2)

[02:10] Substitution (Team_094): Kobe Wagner OUT → Ayo Gasol IN (stamina_rule2)

[02:10] Substitution (Team_094): Tim Russell OUT → Domantas Haliburton IN (stamina_rule2)

[02:10] Substitution (Team_094): Kobe Bryant OUT → Isaiah Quickley IN (stamina_rule2)

[01:53] Team_028 possession (Score: 64-72)
Scottie Ingram drives to the basket... Scottie Ingram throws a bad pass out of bounds! TURNOVER! (dead ball)

[01:38] Team_094 possession (Score: 64-72)
Isaiah Quickley drives and kicks out. Ayo Gasol attempts a Midrange. Contested by Tyrese Quickley (4.4 feet, ZONE). Ayo Gasol misses. Offensive rebound by Domantas Haliburton! Domantas Haliburton kicks it out.

[01:23] Team_094 possession (Score: 64-72)
Isaiah Quickley drives and kicks out. Domantas Haliburton attempts a 3Pt. Contested by Tyrese Quickley (4.4 feet, ZONE). Domantas Haliburton misses. Rebound secured by Bam Towns.

[01:07] Team_028 possession (Score: 64-72)
Collin Bridges drives, Isaiah Quickley stays with him. Collin Bridges attempts a Dunk. Wide open! Isaiah Quickley is 6.3 feet away. [MAN] COLLIN BRIDGES MAKES IT!
Score: 66-72

[00:49] Team_094 possession (Score: 66-72)
Domantas Haliburton drives and kicks out. Isaiah Quickley attempts a 3Pt. Contested by Collin Bridges (3.8 feet, MAN). ISAIAH QUICKLEY MAKES IT! Assist: Kevin Rozier
Score: 66-75

[00:35] Team_028 possession (Score: 66-75)
FOUL! Holding foul on Ayo Gasol. [IN THE BONUS! 8 team fouls] Miles Booker to the line for 2 free throws. (Ayo Gasol: 1 personal fouls)   FT 1/2: GOOD   FT 2/2: GOOD Miles Booker makes 2/2 from the line.
Score: 68-75

[00:18] Team_094 possession (Score: 68-75)
Shaquille Bryant makes the Layup and draws the foul on Scottie Ingram! And-1! Shaquille Bryant to the line for 1. [Team fouls: 3] (Scottie Ingram: 1 personal fouls)   FT 1/1: GOOD Shaquille Bryant makes 1/1 from the line.
Score: 68-78

[00:03] Team_028 possession (Score: 68-78)
FOUL! Reach-in foul on Isaiah Quickley during the drive. [IN THE BONUS! 9 team fouls] Collin Bridges to the line for 2 free throws. (Isaiah Quickley: 1 personal fouls)   FT 1/2: GOOD   FT 2/2: GOOD Collin Bridges makes 2/2 from the line.
Score: 70-78

================================================================================
                              3RD QUARTER COMPLETE                              
================================================================================

3RD QUARTER SCORE: Team_028 24, Team_094 23

BOX SCORE:
================================================================================

Team_028
--------------------------------------------------------------------------------
Player                MIN  PTS  REB  AST  TO      FG   FG%      3P   3P%
--------------------------------------------------------------------------------
Carmelo Carter         28    7    4    0   0   3/5    60.0     0/0   0.0
Jimmy Brogdon          28    4    5    1   0   2/5    40.0     0/0   0.0
Collin Bridges          8    4    0    0   0   2/2   100.0     0/0   0.0
Austin Russell         28    2    0    1   0   1/3    33.3     0/0   0.0
Myles Haliburton       28    2    0    0   0   1/4    25.0     0/0   0.0
Miles Booker            8    2    0    0   0   1/1   100.0     0/0   0.0
Bam Towns               8    0    1    0   0   0/0     0.0     0/0   0.0

TEAM: FG: 10/20 (50.0%), 3PT: 1/6 (16.7%), REB: 11 (2 off, 9 def), AST: 2, TO: 4
TEAM FOULS: 3


Team_094
--------------------------------------------------------------------------------
Player                MIN  PTS  REB  AST  TO      FG   FG%      3P   3P%
--------------------------------------------------------------------------------
Lauri Thompson         28    6    0    1   0   2/5    40.0     0/0   0.0
Tim Russell            28    5    5    0   0   2/5    40.0     0/0   0.0
Kobe Bryant            28    4    4    0   0   2/3    66.7     0/0   0.0
Isaiah Quickley         8    3    0    0   0   1/2    50.0     0/0   0.0
Shaquille Bryant        8    3    0    0   0   1/1   100.0     0/0   0.0
Terry Ingram           28    2    0    0   0   1/3    33.3     0/0   0.0
Kobe Wagner            28    0    2    1   0   0/0     0.0     0/0   0.0
Kawhi Ball             28    0    1    0   0   0/0     0.0     0/0   0.0
Domantas Haliburton     8    0    1    0   0   0/0     0.0     0/0   0.0
Kevin Rozier            8    0    0    1   0   0/0     0.0     0/0   0.0

TEAM: FG: 9/19 (47.4%), 3PT: 2/6 (33.3%), REB: 12 (3 off, 9 def), AST: 3, TO: 4
TEAM FOULS: 9 [Team_028 in BONUS]

================================================================================

================================================================================
                       4TH QUARTER - Team_028 vs Team_094                       
================================================================================

[12:00] Team_028 possession (Score: 70-78)
Kawhi Ball attempts a 3Pt. Contested by Kobe Wagner (4.3 feet, ZONE). KAWHI BALL MAKES IT! Assist: Austin Russell
Score: 73-78

[11:47] Team_094 possession (Score: 73-78)
Terry Ingram attempts a Layup. BLOCKED BY CARMELO CARTER! Ball is loose! Rebound secured by Kawhi Ball.

[11:29] Team_028 possession (Score: 73-78)
Jimmy Brogdon attempts a 3Pt. Contested by Kobe Bryant (5.5 feet, MAN). JIMMY BROGDON MAKES IT! Assist: Myles Haliburton
Score: 76-78

[11:16] Team_094 possession (Score: 76-78)
Kobe Bryant makes the Layup and draws the foul on Kawhi Ball! And-1! Kobe Bryant to the line for 1. [Team fouls: 1] (Kawhi Ball: 1 personal fouls)   FT 1/1: GOOD Kobe Bryant makes 1/1 from the line.
Score: 76-81

[11:05] Team_028 possession (Score: 76-81)
Austin Russell attempts a 3Pt. Contested by Kobe Wagner (4.1 feet, ZONE). Austin Russell misses. Rebound secured by Kobe Wagner.

[10:48] Team_094 possession (Score: 76-81)
Terry Ingram attempts a 3Pt. Contested by Austin Russell (4.9 feet, MAN). TERRY INGRAM MAKES IT! Assist: Tim Russell
Score: 76-84

[10:35] Team_028 possession (Score: 76-84)
Austin Russell drives and kicks out. Kawhi Ball attempts a 3Pt. Contested by Tim Russell (4.9 feet, MAN). Kawhi Ball misses. Rebound secured by Tim Russell.

[10:20] Team_094 possession (Score: 76-84)
Tim Russell attempts a Midrange. Contested by Kawhi Ball (4.6 feet, MAN). Tim Russell misses. Rebound secured by Carmelo Carter.

[10:06] Team_028 possession (Score: 76-84)
Carmelo Carter attempts a 3Pt. Contested by Lauri Thompson (5.3 feet, MAN). CARMELO CARTER MAKES IT! Assist: Jimmy Brogdon
Score: 79-84

[09:54] Team_094 possession (Score: 79-84)
Kobe Bryant drives and kicks out. Tim Russell attempts a Midrange. Contested by Carmelo Carter (4.7 feet, ZONE). Tim Russell misses. Offensive rebound by Tim Russell! Tim Russell kicks it out.

[09:39] Team_094 possession (Score: 79-84)
FOUL! Shooting foul on Austin Russell. Terry Ingram to the line for 3 free throws. [Team fouls: 2] (Austin Russell: 1 personal fouls)   FT 1/3: GOOD   FT 2/3: GOOD   FT 3/3: GOOD Terry Ingram makes 3/3 from the line.
Score: 79-87

[09:24] Team_028 possession (Score: 79-87)
Jimmy Brogdon attempts a 3Pt. Contested by Kobe Bryant (5.7 feet, MAN). Jimmy Brogdon misses. Rebound secured by Tim Russell.

[09:09] Team_094 possession (Score: 79-87)
Terry Ingram drives, Austin Russell stays with him. Terry Ingram attempts a Layup. Contested by Austin Russell (5.0 feet, MAN). TERRY INGRAM MAKES IT! Assist: Kobe Bryant
Score: 79-89

[08:56] Team_028 possession (Score: 79-89)
Kawhi Ball loses the ball! Stripped by Tim Russell! TURNOVER! (live ball)

[08:41] Team_094 possession (Score: 79-89)
FOUL! Shooting foul on Carmelo Carter. Terry Ingram to the line for 2 free throws. [Team fouls: 3] (Carmelo Carter: 1 personal fouls)   FT 1/2: GOOD   FT 2/2: GOOD Terry Ingram makes 2/2 from the line.
Score: 79-91

[08:22] Team_028 possession (Score: 79-91)
FOUL! Shooting foul on Tim Russell. Austin Russell to the line for 2 free throws. [Team fouls: 1] (Tim Russell: 1 personal fouls)   FT 1/2: GOOD   FT 2/2: GOOD Austin Russell makes 2/2 from the line.
Score: 81-91

[08:05] Team_094 possession (Score: 81-91)
Terry Ingram attempts a 3Pt. Contested by Austin Russell (5.1 feet, ZONE). Terry Ingram misses. Rebound secured by Kawhi Ball.

[07:50] Team_028 possession (Score: 81-91)
Jimmy Brogdon attempts a Layup. Contested by Kobe Bryant (5.8 feet, MAN). Jimmy Brogdon misses. Offensive rebound by Kawhi Ball! Kawhi Ball kicks it out.

[07:36] Team_028 possession (Score: 81-91)
Carmelo Carter attempts a 3Pt. Contested by Kobe Wagner (4.8 feet, ZONE). Carmelo Carter misses. Offensive rebound by Jimmy Brogdon! Jimmy Brogdon kicks it out.

[07:21] Team_028 possession (Score: 81-91)
Jimmy Brogdon attempts a Midrange. Contested by Lauri Thompson (5.7 feet, ZONE). JIMMY BROGDON MAKES IT!
Score: 83-91

[07:06] Team_094 possession (Score: 83-91)
Terry Ingram drives and kicks out. Kobe Wagner attempts a Midrange. Contested by Carmelo Carter (5.0 feet, ZONE). Kobe Wagner misses. Rebound secured by Kawhi Ball.

[06:50] Team_028 possession (Score: 83-91)
Austin Russell drives and kicks out. Kawhi Ball attempts a 3Pt. Contested by Tim Russell (5.3 feet, MAN). Kawhi Ball misses. Offensive rebound by Kawhi Ball! Kawhi Ball kicks it out.

[06:36] Team_028 possession (Score: 83-91)
Kawhi Ball drives to the basket... Kawhi Ball throws a bad pass out of bounds! TURNOVER! (dead ball)

[06:36] Substitution (Team_028): Austin Russell OUT → Scottie Ingram IN (stamina_rule2)

[06:36] Substitution (Team_028): Carmelo Carter OUT → Tyrese Quickley IN (stamina_rule2)

[06:36] Substitution (Team_028): Myles Haliburton OUT → Miles Booker IN (stamina_rule2)

[06:36] Substitution (Team_028): Kawhi Ball OUT → Bam Towns IN (stamina_rule2)

[06:36] Substitution (Team_028): Jimmy Brogdon OUT → Collin Bridges IN (stamina_rule2)

[06:36] Substitution (Team_094): Terry Ingram OUT → Shaquille Bryant IN (stamina_rule2)

[06:36] Substitution (Team_094): Lauri Thompson OUT → Kevin Rozier IN (stamina_rule2)

[06:36] Substitution (Team_094): Kobe Wagner OUT → Ayo Gasol IN (stamina_rule2)

[06:36] Substitution (Team_094): Tim Russell OUT → Domantas Haliburton IN (stamina_rule2)

[06:36] Substitution (Team_094): Kobe Bryant OUT → Isaiah Quickley IN (stamina_rule2)

[06:21] Team_094 possession (Score: 83-91)
Shaquille Bryant loses the ball! Stripped by Scottie Ingram! TURNOVER! (live ball)

[06:03] Team_028 possession (Score: 83-91)
Collin Bridges drives, Isaiah Quickley stays with him. Collin Bridges attempts a Layup. Wide open! Isaiah Quickley is 6.3 feet away. [MAN] COLLIN BRIDGES MAKES IT!
Score: 85-91

[05:47] Team_094 possession (Score: 85-91)
Domantas Haliburton attempts a Midrange. Contested by Collin Bridges (3.9 feet, MAN). DOMANTAS HALIBURTON MAKES IT! Assist: Shaquille Bryant
Score: 85-93

[05:35] Team_028 possession (Score: 85-93)
Tyrese Quickley drives, picks up Isaiah Quickley. Help arrives from Kevin Rozier! Tyrese Quickley attempts a Layup. Wide open! Kevin Rozier is 6.3 feet away. [ZONE] Tyrese Quickley misses. Rebound secured by Domantas Haliburton.

[05:22] Team_094 possession (Score: 85-93)
FOUL! Shooting foul on Collin Bridges. Ayo Gasol to the line for 2 free throws. [Team fouls: 4] (Collin Bridges: 1 personal fouls)   FT 1/2: GOOD   FT 2/2: GOOD Ayo Gasol makes 2/2 from the line.
Score: 85-95

[05:09] Team_028 possession (Score: 85-95)
Bam Towns loses control! Ball rolls out of bounds! TURNOVER! (dead ball)

[04:50] Team_094 possession (Score: 85-95)
Ayo Gasol attempts a Midrange. Wide open! Miles Booker is 6.2 feet away. [ZONE] AYO GASOL MAKES IT!
Score: 85-97

[04:32] Team_028 possession (Score: 85-97)
Collin Bridges attempts a Midrange. Contested by Ayo Gasol (5.1 feet, ZONE). Collin Bridges misses. Rebound secured by Isaiah Quickley.

[04:18] Team_094 possession (Score: 85-97)
Isaiah Quickley drives to the basket... Isaiah Quickley throws a bad pass! Stolen by Collin Bridges! TURNOVER! (live ball)

[04:06] Team_028 possession (Score: 85-97)
Tyrese Quickley attempts a 3Pt. Wide open! Domantas Haliburton is 6.0 feet away. [ZONE] Tyrese Quickley misses. Rebound secured by Ayo Gasol.

[03:52] Team_094 possession (Score: 85-97)
FOUL! Reach-in foul on Collin Bridges during the drive. [IN THE BONUS! 5 team fouls] Ayo Gasol to the line for 2 free throws. (Collin Bridges: 2 personal fouls)   FT 1/2: GOOD   FT 2/2: MISS Ayo Gasol makes 1/2 from the line. Rebound secured by Collin Bridges.
Score: 85-98

[03:40] Team_028 possession (Score: 85-98)
Miles Booker attempts a 3Pt. Contested by Domantas Haliburton (5.8 feet, ZONE). Miles Booker misses. Rebound secured by Isaiah Quickley.

[03:22] Team_094 possession (Score: 85-98)
Isaiah Quickley attempts a Midrange. Contested by Collin Bridges (4.1 feet, MAN). ISAIAH QUICKLEY MAKES IT! Assist: Shaquille Bryant
Score: 85-100

[03:10] Team_028 possession (Score: 85-100)
Miles Booker attempts a 3Pt. Contested by Shaquille Bryant (5.3 feet, ZONE). Miles Booker misses. Rebound secured by Domantas Haliburton.

[02:51] Team_094 possession (Score: 85-100)
Domantas Haliburton attempts a 3Pt. Contested by Collin Bridges (3.9 feet, MAN). Domantas Haliburton misses. Rebound secured by Collin Bridges.

[02:36] Team_028 possession (Score: 85-100)
FOUL! Offensive foul on Tyrese Quickley! Kevin Rozier drew the charge! [Team fouls: 6] (Tyrese Quickley: 1 personal fouls) TURNOVER! (dead ball)

[02:22] Team_094 possession (Score: 85-100)
Shaquille Bryant attempts a 3Pt. Contested by Scottie Ingram (5.2 feet, MAN). Shaquille Bryant misses. Rebound secured by Tyrese Quickley.

[02:06] Team_028 possession (Score: 85-100)
Miles Booker makes the Dunk and draws the foul on Isaiah Quickley! And-1! Miles Booker to the line for 1. [Team fouls: 2] (Isaiah Quickley: 1 personal fouls)   FT 1/1: GOOD Miles Booker makes 1/1 from the line.
Score: 88-100

[01:48] Team_094 possession (Score: 88-100)
Kevin Rozier attempts a Layup. Contested by Collin Bridges (4.3 feet, ZONE). KEVIN ROZIER MAKES IT! Assist: Shaquille Bryant
Score: 88-102

[01:34] Team_028 possession (Score: 88-102)
Collin Bridges drives, picks up Isaiah Quickley. Help arrives from Kevin Rozier! Collin Bridges attempts a Dunk. Wide open! Kevin Rozier is 6.3 feet away. [ZONE] Collin Bridges misses. Offensive rebound by Bam Towns! Bam Towns kicks it out.

[01:20] Team_028 possession (Score: 88-102)
FOUL! Offensive foul on Tyrese Quickley! Kevin Rozier drew the charge! [Team fouls: 7] (Tyrese Quickley: 2 personal fouls) TURNOVER! (dead ball)

[01:07] Team_094 possession (Score: 88-102)
FOUL! Reach-in foul on Collin Bridges during the drive. [IN THE BONUS! 8 team fouls] Isaiah Quickley to the line for 2 free throws. (Collin Bridges: 3 personal fouls)   FT 1/2: GOOD   FT 2/2: GOOD Isaiah Quickley makes 2/2 from the line.
Score: 88-104

[00:54] Team_028 possession (Score: 88-104)
Bam Towns attempts a Midrange. Contested by Domantas Haliburton (5.9 feet, MAN). Bam Towns misses. Rebound secured by Ayo Gasol.

[00:43] Team_094 possession (Score: 88-104)
Isaiah Quickley attempts a Midrange. Contested by Collin Bridges (4.1 feet, MAN). Isaiah Quickley misses. Rebound secured by Tyrese Quickley.

[00:28] Team_028 possession (Score: 88-104)
Miles Booker loses the ball! Stripped by Ayo Gasol! TURNOVER! (live ball)

[00:13] Team_094 possession (Score: 88-104)
Domantas Haliburton drives and kicks out. Ayo Gasol attempts a 3Pt. Contested by Scottie Ingram (5.6 feet, ZONE). Ayo Gasol misses. Rebound secured by Bam Towns.

================================================================================
                              4TH QUARTER COMPLETE                              
================================================================================

4TH QUARTER SCORE: Team_028 18, Team_094 26

BOX SCORE:
================================================================================

Team_028
--------------------------------------------------------------------------------
Player                MIN  PTS  REB  AST  TO      FG   FG%      3P   3P%
--------------------------------------------------------------------------------
Jimmy Brogdon          34    5    1    1   0   2/3    66.7     0/0   0.0
Kawhi Ball             34    3    5    0   0   1/1   100.0     0/0   0.0
Carmelo Carter         34    3    1    0   0   1/1   100.0     0/0   0.0
Miles Booker           14    3    0    0   0   1/3    33.3     0/0   0.0
Austin Russell         34    2    0    1   0   1/3    33.3     0/0   0.0
Collin Bridges         14    2    2    0   0   1/2    50.0     0/0   0.0
Myles Haliburton       34    0    0    1   0   0/0     0.0     0/0   0.0
Tyrese Quickley        14    0    2    0   0   0/2     0.0     0/0   0.0
Bam Towns              14    0    2    0   0   0/1     0.0     0/0   0.0

TEAM: FG: 7/16 (43.8%), 3PT: 3/8 (37.5%), REB: 13 (4 off, 9 def), AST: 3, TO: 6
TEAM FOULS: 8 [Team_094 in BONUS]


Team_094
--------------------------------------------------------------------------------
Player                MIN  PTS  REB  AST  TO      FG   FG%      3P   3P%
--------------------------------------------------------------------------------
Terry Ingram           34   10    0    0   0   4/7    57.1     0/0   0.0
Ayo Gasol              14    4    2    0   0   2/3    66.7     0/0   0.0
Isaiah Quickley        14    4    2    0   0   2/3    66.7     0/0   0.0
Kobe Bryant            34    3    0    1   0   1/1   100.0     0/0   0.0
Domantas Haliburton    14    2    2    0   0   1/3    33.3     0/0   0.0
Kevin Rozier           14    2    0    0   0   1/1   100.0     0/0   0.0
Kobe Wagner            34    0    1    0   0   0/0     0.0     0/0   0.0
Tim Russell            34    0    3    1   0   0/1     0.0     0/0   0.0
Shaquille Bryant       14    0    0    3   0   0/1     0.0     0/0   0.0

TEAM: FG: 11/20 (55.0%), 3PT: 2/5 (40.0%), REB: 10 (1 off, 9 def), AST: 5, TO: 2
TEAM FOULS: 2

================================================================================

================================================================================
                               FULL GAME COMPLETE                               
================================================================================

FINAL SCORE: Team_028 88, Team_094 104

SCORING BY QUARTER:
--------------------------------------------------------------------------------
Team                     Q1     Q2     Q3     Q4    FINAL
--------------------------------------------------------------------------------
Team_028                 21     25     24     18       88
Team_094                 33     22     23     26      104
--------------------------------------------------------------------------------

FULL GAME BOX SCORE:
================================================================================

Team_028
--------------------------------------------------------------------------------
Player                MIN  PTS  REB  AST  TO      FG   FG%      3P   3P%      FT STL BLK
--------------------------------------------------------------------------------
Austin Russell         34   10    0    3   3   4/13   30.8   2/6    33.3   2/2     0   0
Carmelo Carter         34   16   12    2   1   7/9    77.8   2/2   100.0   4/5     0   2
Myles Haliburton       34   12    0    2   2   5/11   45.5   1/5    20.0   3/4     1   0
Kawhi Ball             34   11    9    3   2   5/5   100.0   1/1   100.0   1/2     0   0
Jimmy Brogdon          34   11   10    2   3   6/14   42.9   1/3    33.3   2/3     1   1
Scottie Ingram         14    5    0    1   0   2/3    66.7   1/1   100.0   0/0     1   0
Tyrese Quickley        14    0    4    0   4   0/3     0.0   0/1     0.0   0/0     0   0
Miles Booker           14   10    0    0   1   3/7    42.9   1/4    25.0   3/3     0   0
Bam Towns              14    2    4    0   1   1/2    50.0   0/0     0.0   0/0     0   0
Collin Bridges         14    8    2    1   0   4/5    80.0   0/0     0.0   2/2     2   0

TEAM: FG: 38/73 (52.1%), 3PT: 9/23 (39.1%), REB: 41 (9 off, 32 def), AST: 14, TO: 17


Team_094
--------------------------------------------------------------------------------
Player                MIN  PTS  REB  AST  TO      FG   FG%      3P   3P%      FT STL BLK
--------------------------------------------------------------------------------
Terry Ingram           34   22    0    2   0   9/15   60.0   3/5    60.0   6/6     2   0
Lauri Thompson         34   10    0    4   3   5/10   50.0   1/5    20.0   2/2     1   0
Kobe Wagner            34   12    6    1   1   5/8    62.5   1/2    50.0   2/3     1   0
Tim Russell            34   15   12    2   1   6/12   50.0   1/3    33.3   3/4     3   0
Kobe Bryant            34    9   13    3   3   3/7    42.9   0/0     0.0   3/3     0   0
Shaquille Bryant       14    3    0    5   2   1/3    33.3   0/1     0.0   1/1     0   0
Kevin Rozier           14    2    0    1   0   1/2    50.0   0/1     0.0   0/0     0   0
Ayo Gasol              14    8    3    0   0   4/5    80.0   0/0     0.0   3/4     1   0
Domantas Haliburton    14    6    6    0   0   4/6    66.7   0/1     0.0   2/2     0   0
Isaiah Quickley        14   14    3    0   1   5/8    62.5   0/1     0.0   3/3     0   0

TEAM: FG: 43/77 (55.8%), 3PT: 6/19 (31.6%), REB: 43 (9 off, 34 def), AST: 18, TO: 11

================================================================================
