================================================================================
                        FULL GAME - Team_048 vs Team_060                        
================================================================================

================================================================================
                       1ST QUARTER - Team_048 vs Team_060                       
================================================================================

[12:00] Team_048 possession (Score: 0-0)
Paolo Rozier attempts a 3Pt. Contested by Julius Green (3.9 feet, ZONE). Paolo Rozier misses. Offensive rebound by Damian Mobley! Damian Mobley's putback is no good. Rebound secured by Immanuel Ming.

[11:47] Team_060 possession (Score: 0-0)
FOUL! Offensive foul on Larry Westbrook! Kevin Fox drew the charge! [Team fouls: 1] (Larry Westbrook: 1 personal fouls) TURNOVER! (dead ball)

[11:35] Team_048 possession (Score: 0-0)
Dejounte Sexton drives and kicks out. Karl Johnson attempts a Midrange. Contested by Julius Green (3.8 feet, MAN). Karl Johnson misses. Offensive rebound by Damian Mobley! Damian Mobley puts it back in!
Score: 2-0

[11:24] Team_060 possession (Score: 2-0)
Immanuel Ming drives to the basket... Immanuel Ming commits a violation (traveling/carry)! TURNOVER! (dead ball)

[11:07] Team_048 possession (Score: 2-0)
Kevin Fox attempts a Layup. Wide open! Jaren George is 6.1 feet away. [ZONE] KEVIN FOX MAKES IT! Assist: Paolo Rozier
Score: 4-0

[10:55] Team_060 possession (Score: 4-0)
Jaren George attempts a Midrange. Contested by Karl Johnson (4.5 feet, ZONE). JAREN GEORGE MAKES IT!
Score: 4-2

[10:44] Team_048 possession (Score: 4-2)
Kevin Fox drives to the basket... Kevin Fox loses the ball! Stripped by Jaren George! TURNOVER! (live ball)

[10:32] Team_060 possession (Score: 4-2)
Julius Green attempts a 3Pt. Contested by Dejounte Sexton (2.8 feet, ZONE). Julius Green misses. Rebound secured by Dejounte Sexton.

[10:20] Team_048 possession (Score: 4-2)
Karl Johnson attempts a Midrange. Contested by Julius Green (4.3 feet, MAN). Karl Johnson misses. FOUL! Loose ball foul on Larry Westbrook during the rebound battle. [Team fouls: 2] No free throws, side out. (Larry Westbrook: 2 personal fouls)

[10:05] Team_048 possession (Score: 4-2)
Karl Johnson attempts a 3Pt. Contested by Julius Green (4.3 feet, ZONE). KARL JOHNSON MAKES IT! Assist: Kevin Fox
Score: 7-2

[09:52] Team_060 possession (Score: 7-2)
Immanuel Ming throws a bad pass! Stolen by Dejounte Sexton! TURNOVER! (live ball)

[09:38] Team_048 possession (Score: 7-2)
Paolo Rozier attempts a Layup. Contested by Joel Morant (5.4 feet, MAN). Paolo Rozier misses. Rebound secured by Larry Westbrook.

[09:24] Team_060 possession (Score: 7-2)
Larry Westbrook drives and kicks out. Immanuel Ming attempts a Midrange. Contested by Dejounte Sexton (3.0 feet, ZONE). Immanuel Ming misses. Rebound secured by Damian Mobley.

[09:10] Team_048 possession (Score: 7-2)
Paolo Rozier attempts a 3Pt. Contested by Julius Green (3.9 feet, ZONE). Paolo Rozier misses. Rebound secured by Larry Westbrook.

[08:54] Team_060 possession (Score: 7-2)
Julius Green attempts a 3Pt. Contested by Dejounte Sexton (2.8 feet, ZONE). Julius Green misses. Rebound secured by Damian Mobley.

[08:40] Team_048 possession (Score: 7-2)
Karl Johnson attempts a 3Pt. Contested by Julius Green (4.3 feet, ZONE). Karl Johnson misses. Rebound secured by Larry Westbrook.

[08:23] Team_060 possession (Score: 7-2)
Jaren George attempts a Midrange. Contested by Kevin Fox (3.6 feet, MAN). Jaren George misses. Rebound secured by Dejounte Sexton.

[08:10] Team_048 possession (Score: 7-2)
Paolo Rozier drives to the basket... Paolo Rozier throws a bad pass! Stolen by Jaren George! TURNOVER! (live ball)

[08:00] Team_060 possession (Score: 7-2)
Larry Westbrook attempts a Midrange. Contested by Kevin Fox (3.9 feet, ZONE). Larry Westbrook misses. Rebound secured by Kevin Fox.

[07:49] Team_048 possession (Score: 7-2)
Karl Johnson drives and kicks out. Karl Johnson attempts a Midrange. Contested by Larry Westbrook (4.6 feet, ZONE). Karl Johnson misses. Offensive rebound by Damian Mobley! Damian Mobley puts it back in!
Score: 9-2

[07:33] Team_060 possession (Score: 9-2)
Larry Westbrook drives, picks up Kevin Fox. Help arrives from Karl Johnson! Larry Westbrook attempts a Dunk. Contested by Karl Johnson (3.9 feet, MAN). Larry Westbrook misses. Rebound secured by Kevin Fox.

[07:19] Team_048 possession (Score: 9-2)
Dejounte Sexton makes the Midrange and draws the foul on Larry Westbrook! And-1! Dejounte Sexton to the line for 1. [Team fouls: 3] (Larry Westbrook: 3 personal fouls)   FT 1/1: MISS Dejounte Sexton makes 0/1 from the line. Offensive rebound by Kevin Fox! Kevin Fox kicks it out.
Score: 11-2

[07:04] Team_048 possession (Score: 11-2)
Dejounte Sexton drives and kicks out. Damian Mobley attempts a 3Pt. Contested by Jaren George (5.2 feet, MAN). Damian Mobley misses. Offensive rebound by Kevin Fox! Kevin Fox kicks it out.

[06:49] Team_048 possession (Score: 11-2)
Karl Johnson drives to the basket... Karl Johnson throws a bad pass! Stolen by Julius Green! TURNOVER! (live ball)

[06:37] Team_060 possession (Score: 11-2)
Julius Green attempts a 3Pt. Contested by Karl Johnson (4.2 feet, MAN). Julius Green misses. Rebound secured by Kevin Fox.

[06:23] Team_048 possession (Score: 11-2)
Damian Mobley makes the Layup and draws the foul on Jaren George! And-1! Damian Mobley to the line for 1. [Team fouls: 4] (Jaren George: 1 personal fouls)   FT 1/1: GOOD Damian Mobley makes 1/1 from the line.
Score: 14-2

[06:13] Team_060 possession (Score: 14-2)
Jaren George attempts a Layup. Contested by Kevin Fox (3.6 feet, MAN). Jaren George misses. Rebound secured by Kevin Fox.

[05:57] Team_048 possession (Score: 14-2)
Karl Johnson makes the Midrange and draws the foul on Jaren George! And-1! Karl Johnson to the line for 1. [BONUS: 5 team fouls] (Jaren George: 2 personal fouls)   FT 1/1: GOOD Karl Johnson makes 1/1 from the line.
Score: 17-2

[05:44] Team_060 possession (Score: 17-2)
Larry Westbrook drives, picks up Kevin Fox. Help arrives from Karl Johnson! Larry Westbrook attempts a Layup. Contested by Karl Johnson (3.9 feet, ZONE). LARRY WESTBROOK MAKES IT!
Score: 17-4

[05:34] Team_048 possession (Score: 17-4)
Damian Mobley attempts a Midrange. Contested by Larry Westbrook (5.3 feet, ZONE). Damian Mobley misses. Rebound secured by Larry Westbrook.

[05:18] Team_060 possession (Score: 17-4)
Immanuel Ming drives and kicks out. Larry Westbrook attempts a 3Pt. Contested by Kevin Fox (3.5 feet, ZONE). Larry Westbrook misses. Rebound secured by Kevin Fox.

[05:07] Team_048 possession (Score: 17-4)
Damian Mobley drives, Jaren George stays with him. Damian Mobley attempts a Layup. Contested by Jaren George (6.0 feet, MAN). Damian Mobley misses. Rebound secured by Jaren George.

[04:50] Team_060 possession (Score: 17-4)
Larry Westbrook makes the Layup and draws the foul on Kevin Fox! And-1! Larry Westbrook to the line for 1. [Team fouls: 1] (Kevin Fox: 1 personal fouls)   FT 1/1: GOOD Larry Westbrook makes 1/1 from the line.
Score: 17-7

[04:31] Team_048 possession (Score: 17-7)
FOUL! Reach-in foul on Jaren George during the drive. [IN THE BONUS! 6 team fouls] Karl Johnson to the line for 2 free throws. (Jaren George: 3 personal fouls)   FT 1/2: GOOD   FT 2/2: GOOD Karl Johnson makes 2/2 from the line.
Score: 19-7

[04:15] Team_060 possession (Score: 19-7)
Jaren George attempts a 3Pt. Contested by Kevin Fox (3.7 feet, MAN). Jaren George misses. Rebound secured by Damian Mobley.

[04:01] Team_048 possession (Score: 19-7)
Karl Johnson drives and kicks out. Paolo Rozier attempts a Midrange. Contested by Joel Morant (5.4 feet, MAN). Paolo Rozier misses. Rebound secured by Larry Westbrook.

[03:42] Team_060 possession (Score: 19-7)
Jaren George drives and kicks out. Joel Morant attempts a 3Pt. Contested by Paolo Rozier (5.3 feet, MAN). Joel Morant misses. Rebound secured by Dejounte Sexton.

[03:28] Team_048 possession (Score: 19-7)
Damian Mobley attempts a Midrange. Contested by Julius Green (4.6 feet, ZONE). Damian Mobley misses. Rebound secured by Immanuel Ming.

[03:15] Team_060 possession (Score: 19-7)
Larry Westbrook drives, picks up Kevin Fox. Help arrives from Karl Johnson! Larry Westbrook attempts a Dunk. Contested by Karl Johnson (4.1 feet, ZONE). LARRY WESTBROOK MAKES IT!
Score: 19-9

[03:01] Team_048 possession (Score: 19-9)
Damian Mobley drives, Jaren George stays with him. Damian Mobley attempts a Layup. Wide open! Jaren George is 6.1 feet away. [ZONE] DAMIAN MOBLEY MAKES IT! Assist: Paolo Rozier
Score: 21-9

[02:41] Team_060 possession (Score: 21-9)
Julius Green attempts a 3Pt. Contested by Karl Johnson (4.5 feet, MAN). JULIUS GREEN MAKES IT! Assist: Larry Westbrook
Score: 21-12

[02:28] Team_048 possession (Score: 21-12)
Paolo Rozier attempts a 3Pt. Contested by Joel Morant (5.7 feet, MAN). Paolo Rozier misses. Rebound secured by Immanuel Ming.

[02:13] Team_060 possession (Score: 21-12)
Jaren George attempts a Midrange. Contested by Karl Johnson (4.9 feet, ZONE). JAREN GEORGE MAKES IT! Assist: Immanuel Ming
Score: 21-14

[01:55] Team_048 possession (Score: 21-14)
Paolo Rozier attempts a 3Pt. Contested by Julius Green (4.2 feet, ZONE). Paolo Rozier misses. Rebound secured by Immanuel Ming.

[01:41] Team_060 possession (Score: 21-14)
Jaren George attempts a 3Pt. Contested by Kevin Fox (4.0 feet, MAN). Jaren George misses. Rebound secured by Kevin Fox.

[01:25] Team_048 possession (Score: 21-14)
Kevin Fox drives, picks up Jaren George. Help arrives from Julius Green! Kevin Fox attempts a Dunk. Wide open! Julius Green is 6.5 feet away. [ZONE] KEVIN FOX MAKES IT! Assist: Dejounte Sexton
Score: 23-14

[01:07] Team_060 possession (Score: 23-14)
Immanuel Ming attempts a Midrange. Contested by Dejounte Sexton (3.4 feet, MAN). IMMANUEL MING MAKES IT!
Score: 23-16

[00:51] Team_048 possession (Score: 23-16)
Paolo Rozier attempts a 3Pt. Contested by Julius Green (4.3 feet, ZONE). Paolo Rozier misses. Offensive rebound by Kevin Fox! Kevin Fox kicks it out.

[00:32] Team_048 possession (Score: 23-16)
Paolo Rozier attempts a Midrange. Contested by Jaren George (5.8 feet, ZONE). PAOLO ROZIER MAKES IT! Assist: Damian Mobley
Score: 25-16

[00:21] Team_060 possession (Score: 25-16)
Joel Morant attempts a Midrange. Contested by Paolo Rozier (5.3 feet, MAN). JOEL MORANT MAKES IT!
Score: 25-18

[00:05] Team_048 possession (Score: 25-18)
Kevin Fox drives, Jaren George stays with him. Kevin Fox attempts a Layup. Wide open! Jaren George is 6.6 feet away. [ZONE] KEVIN FOX MAKES IT!
Score: 27-18

================================================================================
                              1ST QUARTER COMPLETE                              
================================================================================

1ST QUARTER SCORE: Team_048 27, Team_060 18

BOX SCORE:
================================================================================

Team_048
--------------------------------------------------------------------------------
Player                MIN  PTS  REB  AST  TO      FG   FG%      3P   3P%
--------------------------------------------------------------------------------
Damian Mobley          12    9    6    1   0   4/7    57.1     0/0   0.0
Karl Johnson           12    8    0    0   0   3/5    60.0     0/0   0.0
Kevin Fox              12    6    9    1   0   3/3   100.0     0/0   0.0
Paolo Rozier           12    2    0    2   0   1/6    16.7     0/0   0.0
Dejounte Sexton        12    0    3    1   0   0/0     0.0     0/0   0.0

TEAM: FG: 11/21 (52.4%), 3PT: 1/6 (16.7%), REB: 19 (7 off, 12 def), AST: 5, TO: 3
TEAM FOULS: 1


Team_060
--------------------------------------------------------------------------------
Player                MIN  PTS  REB  AST  TO      FG   FG%      3P   3P%
--------------------------------------------------------------------------------
Larry Westbrook        12    7    5    1   0   3/6    50.0     0/0   0.0
Jaren George           12    4    1    0   0   2/7    28.6     0/0   0.0
Julius Green           12    3    0    0   0   1/4    25.0     0/0   0.0
Immanuel Ming          12    2    4    1   0   1/2    50.0     0/0   0.0
Joel Morant            12    2    0    0   0   1/1   100.0     0/0   0.0

TEAM: FG: 8/20 (40.0%), 3PT: 1/6 (16.7%), REB: 9 (0 off, 9 def), AST: 2, TO: 3
TEAM FOULS: 6 [Team_048 in BONUS]

================================================================================

================================================================================
                       2ND QUARTER - Team_048 vs Team_060                       
================================================================================

[12:00] Team_048 possession (Score: 27-18)
Dejounte Sexton attempts a Layup. Contested by Immanuel Ming (4.6 feet, MAN). DEJOUNTE SEXTON MAKES IT! Assist: Karl Johnson
Score: 29-18

[11:47] Team_060 possession (Score: 29-18)
Jaren George drives, picks up Kevin Fox. Help arrives from Karl Johnson! Jaren George attempts a Dunk. Contested by Karl Johnson (3.9 feet, MAN). JAREN GEORGE MAKES IT!
Score: 29-20

[11:36] Team_048 possession (Score: 29-20)
FOUL! Offensive foul on Paolo Rozier! Joel Morant drew the charge! [Team fouls: 1] (Paolo Rozier: 1 personal fouls) TURNOVER! (dead ball)

[11:20] Team_060 possession (Score: 29-20)
Joel Morant commits a violation (traveling/carry)! TURNOVER! (dead ball)

[11:20] Substitution (Team_048): Paolo Rozier OUT → Lauri Curry IN (stamina_rule2)

[11:20] Substitution (Team_048): Karl Johnson OUT → Yao Booker IN (stamina_rule2)

[11:20] Substitution (Team_048): Dejounte Sexton OUT → Kyle Irving IN (stamina_rule2)

[11:20] Substitution (Team_048): Kevin Fox OUT → DeMar Hyland IN (stamina_rule2)

[11:20] Substitution (Team_048): Damian Mobley OUT → Gary Giddey IN (stamina_rule2)

[11:20] Substitution (Team_060): Joel Morant OUT → Domantas Barnes IN (stamina_rule2)

[11:20] Substitution (Team_060): Julius Green OUT → Rudy Ginobili IN (stamina_rule2)

[11:20] Substitution (Team_060): Immanuel Ming OUT → Jarrett Wagner IN (stamina_rule2)

[11:20] Substitution (Team_060): Larry Westbrook OUT → Yao Tatum IN (stamina_rule2)

[11:20] Substitution (Team_060): Jaren George OUT → Klay Haliburton IN (stamina_rule2)

[11:06] Team_048 possession (Score: 29-20)
DeMar Hyland drives to the basket... DeMar Hyland loses the ball! Stripped by Yao Tatum! TURNOVER! (live ball)

[10:49] Team_060 possession (Score: 29-20)
Jarrett Wagner makes the Layup and draws the foul on Lauri Curry! And-1! Jarrett Wagner to the line for 1. [Team fouls: 2] (Lauri Curry: 1 personal fouls)   FT 1/1: MISS Jarrett Wagner makes 0/1 from the line. Rebound secured by DeMar Hyland.
Score: 29-22

[10:35] Team_048 possession (Score: 29-22)
Kyle Irving attempts a 3Pt. Contested by Domantas Barnes (4.6 feet, ZONE). Kyle Irving misses. Rebound secured by Domantas Barnes.

[10:23] Team_060 possession (Score: 29-22)
Klay Haliburton attempts a Layup. BLOCKED BY LAURI CURRY! Ball goes out off Lauri Curry. Klay Haliburton's ball!

[10:11] Team_060 possession (Score: 29-22)
Rudy Ginobili attempts a Midrange. Contested by Kyle Irving (4.8 feet, ZONE). Rudy Ginobili misses. Offensive rebound by Klay Haliburton! Klay Haliburton's putback is no good. Offensive rebound by Domantas Barnes! Domantas Barnes kicks it out.

[09:58] Team_060 possession (Score: 29-22)
Yao Tatum attempts a 3Pt. Contested by DeMar Hyland (3.5 feet, MAN). Yao Tatum misses. Rebound secured by DeMar Hyland.

[09:44] Team_048 possession (Score: 29-22)
Lauri Curry throws a bad pass! Stolen by Domantas Barnes! TURNOVER! (live ball)

[09:34] Team_060 possession (Score: 29-22)
Domantas Barnes attempts a Layup. Contested by DeMar Hyland (3.4 feet, ZONE). Domantas Barnes misses. Rebound secured by DeMar Hyland.

[09:20] Team_048 possession (Score: 29-22)
FOUL! Reach-in foul on Klay Haliburton during the drive. [Team fouls: 1] No free throws, side out. (Klay Haliburton: 1 personal fouls)

[09:05] Team_048 possession (Score: 29-22)
DeMar Hyland attempts a Midrange. Contested by Yao Tatum (5.4 feet, MAN). DEMAR HYLAND MAKES IT! Assist: Lauri Curry
Score: 31-22

[08:50] Team_060 possession (Score: 31-22)
Klay Haliburton drives and kicks out. Klay Haliburton attempts a 3Pt. Contested by DeMar Hyland (3.4 feet, MAN). Klay Haliburton misses. Rebound secured by Gary Giddey.

[08:38] Team_048 possession (Score: 31-22)
DeMar Hyland makes the Layup and draws the foul on Yao Tatum! And-1! DeMar Hyland to the line for 1. [Team fouls: 2] (Yao Tatum: 1 personal fouls)   FT 1/1: GOOD DeMar Hyland makes 1/1 from the line.
Score: 34-22

[08:27] Team_060 possession (Score: 34-22)
Jarrett Wagner attempts a 3Pt. Contested by DeMar Hyland (3.6 feet, ZONE). Jarrett Wagner misses. Rebound secured by Gary Giddey.

[08:17] Team_048 possession (Score: 34-22)
FOUL! Shooting foul on Klay Haliburton. Lauri Curry to the line for 2 free throws. [Team fouls: 3] (Klay Haliburton: 2 personal fouls)   FT 1/2: GOOD   FT 2/2: GOOD Lauri Curry makes 2/2 from the line.
Score: 36-22

[07:59] Team_060 possession (Score: 36-22)
Rudy Ginobili commits a violation (traveling/carry)! TURNOVER! (dead ball)

[07:44] Team_048 possession (Score: 36-22)
FOUL! Reach-in foul on Klay Haliburton during the drive. [Team fouls: 4] No free throws, side out. (Klay Haliburton: 3 personal fouls)

[07:32] Team_048 possession (Score: 36-22)
Lauri Curry attempts a Layup. Contested by Klay Haliburton (4.4 feet, ZONE). Lauri Curry misses. Rebound secured by Klay Haliburton.

[07:17] Team_060 possession (Score: 36-22)
Yao Tatum attempts a 3Pt. Contested by Lauri Curry (4.6 feet, ZONE). Yao Tatum misses. Rebound secured by DeMar Hyland.

[07:00] Team_048 possession (Score: 36-22)
Gary Giddey throws a bad pass! Stolen by Klay Haliburton! TURNOVER! (live ball)

[06:49] Team_060 possession (Score: 36-22)
Yao Tatum drives and kicks out. Yao Tatum attempts a 3Pt. Contested by DeMar Hyland (3.4 feet, MAN). Yao Tatum misses. Rebound secured by Gary Giddey.

[06:39] Team_048 possession (Score: 36-22)
FOUL! Holding foul on Rudy Ginobili. [IN THE BONUS! 5 team fouls] Yao Booker to the line for 2 free throws. (Rudy Ginobili: 1 personal fouls)   FT 1/2: GOOD   FT 2/2: MISS Yao Booker makes 1/2 from the line. Rebound secured by Klay Haliburton.
Score: 37-22

[06:21] Team_060 possession (Score: 37-22)
FOUL! Shooting foul on Lauri Curry. Yao Tatum to the line for 2 free throws. [Team fouls: 3] (Lauri Curry: 2 personal fouls)   FT 1/2: GOOD   FT 2/2: GOOD Yao Tatum makes 2/2 from the line.
Score: 37-24

[06:08] Team_048 possession (Score: 37-24)
DeMar Hyland attempts a 3Pt. Contested by Domantas Barnes (4.8 feet, ZONE). DeMar Hyland misses. Rebound secured by Klay Haliburton.

[05:49] Team_060 possession (Score: 37-24)
Klay Haliburton throws a bad pass! Stolen by DeMar Hyland! TURNOVER! (live ball)

[05:34] Team_048 possession (Score: 37-24)
DeMar Hyland attempts a 3Pt. Contested by Domantas Barnes (4.8 feet, ZONE). DeMar Hyland misses. Rebound secured by Klay Haliburton.

[05:20] Team_060 possession (Score: 37-24)
Jarrett Wagner attempts a 3Pt. Contested by DeMar Hyland (3.6 feet, ZONE). Jarrett Wagner misses. Rebound secured by DeMar Hyland.

[05:09] Team_048 possession (Score: 37-24)
Yao Booker drives and kicks out. Lauri Curry attempts a 3Pt. Contested by Domantas Barnes (4.6 feet, ZONE). Lauri Curry misses. Rebound secured by Domantas Barnes.

[04:54] Team_060 possession (Score: 37-24)
Domantas Barnes attempts a 3Pt. Contested by Lauri Curry (4.5 feet, MAN). Domantas Barnes misses. Rebound secured by DeMar Hyland.

[04:41] Team_048 possession (Score: 37-24)
DeMar Hyland attempts a 3Pt. Contested by Yao Tatum (5.4 feet, MAN). DeMar Hyland misses. Offensive rebound by DeMar Hyland! DeMar Hyland kicks it out.

[04:28] Team_048 possession (Score: 37-24)
Lauri Curry attempts a 3Pt. Contested by Domantas Barnes (4.7 feet, MAN). Lauri Curry misses. Rebound secured by Domantas Barnes.

[04:14] Team_060 possession (Score: 37-24)
Domantas Barnes attempts a 3Pt. Contested by DeMar Hyland (3.5 feet, ZONE). Domantas Barnes misses. Rebound secured by DeMar Hyland.

[04:00] Team_048 possession (Score: 37-24)
Gary Giddey drives and kicks out. Yao Booker attempts a 3Pt. Contested by Rudy Ginobili (4.4 feet, MAN). Yao Booker misses. FOUL! Loose ball foul on Rudy Ginobili during the rebound battle. [IN THE BONUS! 6 team fouls] DeMar Hyland to the line for 2 free throws. (Rudy Ginobili: 2 personal fouls)   FT 1/2: GOOD   FT 2/2: GOOD DeMar Hyland makes 2/2 from the line.
Score: 39-24

[03:45] Team_060 possession (Score: 39-24)
Klay Haliburton throws a bad pass! Stolen by DeMar Hyland! TURNOVER! (live ball)

[03:29] Team_048 possession (Score: 39-24)
Gary Giddey attempts a Layup. BLOCKED BY DOMANTAS BARNES! Ball is loose! Rebound secured by Rudy Ginobili.

[03:12] Team_060 possession (Score: 39-24)
Klay Haliburton attempts a Midrange. Contested by DeMar Hyland (3.9 feet, ZONE). KLAY HALIBURTON MAKES IT! Assist: Domantas Barnes
Score: 39-26

[02:59] Team_048 possession (Score: 39-26)
Yao Booker drives and kicks out. Lauri Curry attempts a 3Pt. Contested by Domantas Barnes (4.7 feet, ZONE). LAURI CURRY MAKES IT! Assist: Yao Booker
Score: 42-26

[02:50] Team_060 possession (Score: 42-26)
Yao Tatum attempts a 3Pt. Contested by Yao Booker (4.9 feet, ZONE). Yao Tatum misses. Rebound secured by DeMar Hyland.

[02:37] Team_048 possession (Score: 42-26)
Gary Giddey drives, picks up Klay Haliburton. Help arrives from Domantas Barnes! Gary Giddey attempts a Layup. Contested by Domantas Barnes (4.6 feet, MAN). GARY GIDDEY MAKES IT! Assist: Kyle Irving
Score: 44-26

[02:18] Team_060 possession (Score: 44-26)
Klay Haliburton attempts a 3Pt. Contested by DeMar Hyland (4.0 feet, MAN). KLAY HALIBURTON MAKES IT!
Score: 44-29

[02:06] Team_048 possession (Score: 44-29)
DeMar Hyland attempts a 3Pt. Contested by Yao Tatum (5.6 feet, MAN). DEMAR HYLAND MAKES IT!
Score: 47-29

[01:53] Team_060 possession (Score: 47-29)
Yao Tatum attempts a Layup. Contested by DeMar Hyland (3.8 feet, ZONE). Yao Tatum misses. Rebound secured by Gary Giddey.

[01:38] Team_048 possession (Score: 47-29)
Kyle Irving attempts a 3Pt. Contested by Jarrett Wagner (5.1 feet, MAN). Kyle Irving misses. Rebound secured by Domantas Barnes.

[01:22] Team_060 possession (Score: 47-29)
Domantas Barnes attempts a 3Pt. Contested by DeMar Hyland (3.8 feet, ZONE). Domantas Barnes misses. Rebound secured by Kyle Irving.

[01:07] Team_048 possession (Score: 47-29)
Lauri Curry makes the Dunk and draws the foul on Klay Haliburton! And-1! Lauri Curry to the line for 1. [BONUS: 7 team fouls] (Klay Haliburton: 4 personal fouls)   FT 1/1: GOOD Lauri Curry makes 1/1 from the line.
Score: 50-29

[00:53] Team_060 possession (Score: 50-29)
Yao Tatum attempts a Midrange. Contested by Yao Booker (5.0 feet, ZONE). Yao Tatum misses. Rebound secured by DeMar Hyland.

[00:39] Team_048 possession (Score: 50-29)
Kyle Irving attempts a 3Pt. Contested by Jarrett Wagner (5.2 feet, MAN). Kyle Irving misses. Rebound secured by Klay Haliburton.

[00:23] Team_060 possession (Score: 50-29)
Rudy Ginobili attempts a 3Pt. Contested by DeMar Hyland (4.2 feet, ZONE). Rudy Ginobili misses. Rebound secured by Kyle Irving.

[00:13] Team_048 possession (Score: 50-29)
DeMar Hyland attempts a 3Pt. Contested by Yao Tatum (5.8 feet, MAN). DeMar Hyland misses. FOUL! Loose ball foul on Klay Haliburton during the rebound battle. [IN THE BONUS! 8 team fouls] Kyle Irving to the line for 2 free throws. (Klay Haliburton: 5 personal fouls)   FT 1/2: GOOD   FT 2/2: GOOD Kyle Irving makes 2/2 from the line.
Score: 52-29

================================================================================
                              2ND QUARTER COMPLETE                              
================================================================================

2ND QUARTER SCORE: Team_048 25, Team_060 11

BOX SCORE:
================================================================================

Team_048
--------------------------------------------------------------------------------
Player                MIN  PTS  REB  AST  TO      FG   FG%      3P   3P%
--------------------------------------------------------------------------------
DeMar Hyland           11   10   10    0   0   4/6    66.7     0/0   0.0
Lauri Curry            11    8    0    1   0   3/5    60.0     0/0   0.0
Dejounte Sexton        13    2    0    0   0   1/1   100.0     0/0   0.0
Kyle Irving            11    2    2    1   0   1/4    25.0     0/0   0.0
Gary Giddey            11    2    4    0   0   1/2    50.0     0/0   0.0
Karl Johnson           13    0    0    1   0   0/0     0.0     0/0   0.0
Yao Booker             11    0    0    1   0   0/1     0.0     0/0   0.0

TEAM: FG: 10/20 (50.0%), 3PT: 2/8 (25.0%), REB: 16 (1 off, 15 def), AST: 4, TO: 4
TEAM FOULS: 3


Team_060
--------------------------------------------------------------------------------
Player                MIN  PTS  REB  AST  TO      FG   FG%      3P   3P%
--------------------------------------------------------------------------------
Klay Haliburton        11    5    5    0   0   2/3    66.7     0/0   0.0
Jaren George           13    2    0    0   0   1/1   100.0     0/0   0.0
Yao Tatum              11    2    0    0   0   1/7    14.3     0/0   0.0
Jarrett Wagner         11    0    0    0   0   0/3     0.0     0/0   0.0
Domantas Barnes        11    0    5    1   0   0/4     0.0     0/0   0.0
Rudy Ginobili          11    0    1    0   0   0/1     0.0     0/0   0.0

TEAM: FG: 4/19 (21.1%), 3PT: 1/10 (10.0%), REB: 11 (1 off, 10 def), AST: 1, TO: 4
TEAM FOULS: 8 [Team_048 in BONUS]

================================================================================

================================================================================
                       3RD QUARTER - Team_048 vs Team_060                       
================================================================================

[12:00] Team_048 possession (Score: 52-29)
Kevin Fox attempts a 3Pt. Contested by Larry Westbrook (5.5 feet, MAN). Kevin Fox misses. Rebound secured by Immanuel Ming.

[11:46] Team_060 possession (Score: 52-29)
Immanuel Ming attempts a 3Pt. Contested by Dejounte Sexton (3.0 feet, ZONE). Immanuel Ming misses. Rebound secured by Kevin Fox.

[11:29] Team_048 possession (Score: 52-29)
Dejounte Sexton attempts a 3Pt. Contested by Julius Green (4.5 feet, ZONE). DEJOUNTE SEXTON MAKES IT! Assist: Damian Mobley
Score: 55-29

[11:10] Team_060 possession (Score: 55-29)
Julius Green drives to the basket... Julius Green loses control! Ball rolls out of bounds! TURNOVER! (dead ball)

[10:54] Team_048 possession (Score: 55-29)
Dejounte Sexton attempts a 3Pt. Contested by Julius Green (4.5 feet, ZONE). Dejounte Sexton misses. Rebound secured by Immanuel Ming.

[10:37] Team_060 possession (Score: 55-29)
Immanuel Ming attempts a 3Pt. Contested by Dejounte Sexton (3.0 feet, MAN). IMMANUEL MING MAKES IT! Assist: Larry Westbrook
Score: 55-32

[10:24] Team_048 possession (Score: 55-32)
Paolo Rozier attempts a Midrange. Contested by Julius Green (3.9 feet, ZONE). Paolo Rozier misses. Rebound secured by Jaren George.

[10:06] Team_060 possession (Score: 55-32)
Jaren George drives, Kevin Fox stays with him. Jaren George attempts a Layup. Contested by Kevin Fox (3.6 feet, ZONE). Jaren George misses. Rebound secured by Damian Mobley.

[09:48] Team_048 possession (Score: 55-32)
Karl Johnson attempts a Layup. BLOCKED BY JULIUS GREEN! Ball is loose! Rebound secured by Jaren George.

[09:32] Team_060 possession (Score: 55-32)
Joel Morant drives and kicks out. Immanuel Ming attempts a Midrange. Contested by Dejounte Sexton (3.0 feet, MAN). Immanuel Ming misses. Offensive rebound by Immanuel Ming! Immanuel Ming kicks it out.

[09:15] Team_060 possession (Score: 55-32)
Julius Green attempts a Midrange. Contested by Karl Johnson (4.2 feet, MAN). Julius Green misses. Rebound secured by Dejounte Sexton.

[09:00] Team_048 possession (Score: 55-32)
Karl Johnson attempts a 3Pt. Contested by Julius Green (4.3 feet, ZONE). KARL JOHNSON MAKES IT! Assist: Damian Mobley
Score: 58-32

[08:46] Team_060 possession (Score: 58-32)
Larry Westbrook attempts a 3Pt. Contested by Kevin Fox (3.9 feet, MAN). Larry Westbrook misses. Rebound secured by Dejounte Sexton.

[08:31] Team_048 possession (Score: 58-32)
Kevin Fox drives and kicks out. Damian Mobley attempts a 3Pt. Contested by Julius Green (3.8 feet, ZONE). Damian Mobley misses. Rebound secured by Larry Westbrook.

[08:13] Team_060 possession (Score: 58-32)
FOUL! Shooting foul on Karl Johnson. Jaren George to the line for 2 free throws. [Team fouls: 1] (Karl Johnson: 1 personal fouls)   FT 1/2: GOOD   FT 2/2: MISS Jaren George makes 1/2 from the line. Rebound secured by Damian Mobley.
Score: 58-33

[08:02] Team_048 possession (Score: 58-33)
Kevin Fox attempts a 3Pt. Contested by Larry Westbrook (5.5 feet, MAN). Kevin Fox misses. Offensive rebound by Kevin Fox! Kevin Fox kicks it out.

[07:46] Team_048 possession (Score: 58-33)
Dejounte Sexton attempts a 3Pt. Contested by Immanuel Ming (4.4 feet, MAN). Dejounte Sexton misses. Rebound secured by Jaren George.

[07:28] Team_060 possession (Score: 58-33)
Julius Green attempts a Layup. Contested by Kevin Fox (3.2 feet, ZONE). Julius Green misses. Rebound secured by Kevin Fox.

[07:14] Team_048 possession (Score: 58-33)
Kevin Fox attempts a Midrange. Contested by Larry Westbrook (5.5 feet, MAN). Kevin Fox misses. Rebound secured by Immanuel Ming.

[07:03] Team_060 possession (Score: 58-33)
Julius Green drives, picks up Karl Johnson. Help arrives from Dejounte Sexton! Julius Green attempts a Layup. Contested by Dejounte Sexton (4.2 feet, MAN). Julius Green misses. Rebound secured by Dejounte Sexton.

[06:50] Team_048 possession (Score: 58-33)
Paolo Rozier drives to the basket... Paolo Rozier throws a bad pass out of bounds! TURNOVER! (dead ball)

[06:41] Team_060 possession (Score: 58-33)
Jaren George drives and kicks out. Julius Green attempts a Midrange. Contested by Dejounte Sexton (3.0 feet, ZONE). Julius Green misses. Rebound secured by Dejounte Sexton.

[06:27] Team_048 possession (Score: 58-33)
FOUL! Holding foul on Immanuel Ming. [Team fouls: 1] No free throws, side out. (Immanuel Ming: 1 personal fouls)

[06:13] Team_048 possession (Score: 58-33)
FOUL! Holding foul on Larry Westbrook. [Team fouls: 2] No free throws, side out. (Larry Westbrook: 1 personal fouls)

[05:56] Team_048 possession (Score: 58-33)
Karl Johnson drives and kicks out. Damian Mobley attempts a 3Pt. Contested by Jaren George (5.2 feet, MAN). DAMIAN MOBLEY MAKES IT! Assist: Karl Johnson
Score: 61-33

[05:44] Team_060 possession (Score: 61-33)
Immanuel Ming attempts a Layup. Contested by Dejounte Sexton (3.0 feet, MAN). IMMANUEL MING MAKES IT! Assist: Julius Green
Score: 61-35

[05:27] Team_048 possession (Score: 61-35)
Karl Johnson attempts a 3Pt. Contested by Julius Green (4.3 feet, MAN). KARL JOHNSON MAKES IT! Assist: Paolo Rozier
Score: 64-35

[05:13] Team_060 possession (Score: 64-35)
Joel Morant attempts a Midrange. Contested by Paolo Rozier (4.8 feet, MAN). Joel Morant misses. Offensive rebound by Jaren George! Jaren George's putback is no good. Rebound secured by Damian Mobley.

[05:01] Team_048 possession (Score: 64-35)
Paolo Rozier attempts a Midrange. Contested by Larry Westbrook (4.8 feet, ZONE). Paolo Rozier misses. Rebound secured by Immanuel Ming.

[04:50] Team_060 possession (Score: 64-35)
FOUL! Offensive foul on Immanuel Ming! Dejounte Sexton drew the charge! [Team fouls: 3] (Immanuel Ming: 2 personal fouls) TURNOVER! (dead ball)

[04:35] Team_048 possession (Score: 64-35)
FOUL! Offensive foul on Karl Johnson! Julius Green drew the charge! [Team fouls: 2] (Karl Johnson: 2 personal fouls) TURNOVER! (dead ball)

[04:21] Team_060 possession (Score: 64-35)
Jaren George throws a bad pass out of bounds! TURNOVER! (dead ball)

[04:06] Team_048 possession (Score: 64-35)
Damian Mobley loses the ball! Stripped by Jaren George! TURNOVER! (live ball)

[03:55] Team_060 possession (Score: 64-35)
Julius Green attempts a Layup. Contested by Kevin Fox (3.4 feet, ZONE). Julius Green misses. Offensive rebound by Immanuel Ming! Immanuel Ming kicks it out.

[03:41] Team_060 possession (Score: 64-35)
FOUL! Shooting foul on Dejounte Sexton. Immanuel Ming to the line for 2 free throws. [Team fouls: 3] (Dejounte Sexton: 1 personal fouls)   FT 1/2: GOOD   FT 2/2: GOOD Immanuel Ming makes 2/2 from the line.
Score: 64-37

[03:26] Team_048 possession (Score: 64-37)
Karl Johnson attempts a Midrange. Contested by Joel Morant (6.0 feet, ZONE). KARL JOHNSON MAKES IT! Assist: Paolo Rozier
Score: 66-37

[03:13] Team_060 possession (Score: 66-37)
Larry Westbrook drives and kicks out. Julius Green attempts a Midrange. Contested by Karl Johnson (4.6 feet, MAN). Julius Green misses. Rebound secured by Damian Mobley.

[03:00] Team_048 possession (Score: 66-37)
Damian Mobley drives, Jaren George stays with him. Damian Mobley attempts a Dunk. Wide open! Jaren George is 6.1 feet away. [MAN] DAMIAN MOBLEY MAKES IT! Assist: Kevin Fox
Score: 68-37

[02:45] Team_060 possession (Score: 68-37)
Larry Westbrook attempts a Midrange. Contested by Kevin Fox (4.1 feet, MAN). LARRY WESTBROOK MAKES IT!
Score: 68-39

[02:34] Team_048 possession (Score: 68-39)
Paolo Rozier attempts a 3Pt. Contested by Joel Morant (5.7 feet, MAN). Paolo Rozier misses. Offensive rebound by Damian Mobley! Damian Mobley's putback is no good. Rebound secured by Jaren George.

[02:18] Team_060 possession (Score: 68-39)
FOUL! Holding foul on Karl Johnson. [Team fouls: 4] No free throws, side out. (Karl Johnson: 3 personal fouls)

[02:03] Team_060 possession (Score: 68-39)
Jaren George attempts a Layup. Contested by Kevin Fox (3.9 feet, MAN). Jaren George misses. Rebound secured by Damian Mobley.

[01:44] Team_048 possession (Score: 68-39)
Paolo Rozier attempts a 3Pt. Contested by Joel Morant (5.7 feet, MAN). Paolo Rozier misses. Rebound secured by Larry Westbrook.

[01:27] Team_060 possession (Score: 68-39)
Julius Green drives, picks up Kevin Fox. Help arrives from Karl Johnson! Julius Green attempts a Dunk. Contested by Karl Johnson (3.6 feet, ZONE). Julius Green misses. Rebound secured by Damian Mobley.

[01:10] Team_048 possession (Score: 68-39)
Karl Johnson drives, picks up Jaren George. Help arrives from Julius Green! Karl Johnson attempts a Dunk. Wide open! Julius Green is 6.1 feet away. [ZONE] Karl Johnson misses. Offensive rebound by Damian Mobley! Damian Mobley puts it back in!
Score: 70-39

[00:54] Team_060 possession (Score: 70-39)
Joel Morant attempts a Midrange. Contested by Kevin Fox (3.6 feet, ZONE). Joel Morant misses. Rebound secured by Damian Mobley.

[00:39] Team_048 possession (Score: 70-39)
Karl Johnson attempts a Midrange. Contested by Julius Green (4.7 feet, MAN). Karl Johnson misses. Rebound secured by Immanuel Ming.

[00:21] Team_060 possession (Score: 70-39)
Larry Westbrook drives, Kevin Fox stays with him. Larry Westbrook attempts a Layup. Contested by Kevin Fox (4.4 feet, MAN). LARRY WESTBROOK MAKES IT! Assist: Jaren George
Score: 70-41

[00:09] Team_048 possession (Score: 70-41)
Kevin Fox attempts a Midrange. Wide open! Larry Westbrook is 6.0 feet away. [MAN] Kevin Fox misses. Offensive rebound by Damian Mobley! Damian Mobley puts it back in!
Score: 72-41

================================================================================
                              3RD QUARTER COMPLETE                              
================================================================================

3RD QUARTER SCORE: Team_048 20, Team_060 12

BOX SCORE:
================================================================================

Team_048
--------------------------------------------------------------------------------
Player                MIN  PTS  REB  AST  TO      FG   FG%      3P   3P%
--------------------------------------------------------------------------------
Damian Mobley          25    9    9    2   0   4/4   100.0     0/0   0.0
Karl Johnson           25    8    0    1   0   3/5    60.0     0/0   0.0
Dejounte Sexton        25    3    4    0   0   1/3    33.3     0/0   0.0
Kevin Fox              25    0    3    1   0   0/3     0.0     0/0   0.0
Paolo Rozier           25    0    0    2   0   0/4     0.0     0/0   0.0

TEAM: FG: 8/19 (42.1%), 3PT: 3/8 (37.5%), REB: 16 (4 off, 12 def), AST: 6, TO: 3
TEAM FOULS: 4


Team_060
--------------------------------------------------------------------------------
Player                MIN  PTS  REB  AST  TO      FG   FG%      3P   3P%
--------------------------------------------------------------------------------
Immanuel Ming          25    7    7    0   0   3/4    75.0     0/0   0.0
Larry Westbrook        25    4    2    1   0   2/4    50.0     0/0   0.0
Jaren George           25    0    4    1   0   0/4     0.0     0/0   0.0
Julius Green           25    0    0    1   0   0/4     0.0     0/0   0.0
Joel Morant            25    0    0    0   0   0/2     0.0     0/0   0.0

TEAM: FG: 5/18 (27.8%), 3PT: 1/3 (33.3%), REB: 13 (3 off, 10 def), AST: 3, TO: 3
TEAM FOULS: 3

================================================================================

================================================================================
                       4TH QUARTER - Team_048 vs Team_060                       
================================================================================

[12:00] Team_048 possession (Score: 72-41)
Karl Johnson attempts a Layup. Contested by Julius Green (4.5 feet, MAN). KARL JOHNSON MAKES IT! Assist: Kevin Fox
Score: 74-41

[11:47] Team_060 possession (Score: 74-41)
Joel Morant attempts a 3Pt. Contested by Paolo Rozier (5.1 feet, MAN). Joel Morant misses. Rebound secured by Dejounte Sexton.

[11:32] Team_048 possession (Score: 74-41)
Damian Mobley attempts a Midrange. Wide open! Jaren George is 6.2 feet away. [MAN] DAMIAN MOBLEY MAKES IT! Assist: Kevin Fox
Score: 76-41

[11:15] Team_060 possession (Score: 76-41)
Immanuel Ming attempts a Layup. Contested by Kevin Fox (3.8 feet, ZONE). Immanuel Ming misses. Offensive rebound by Immanuel Ming! Immanuel Ming kicks it out.

[10:59] Team_060 possession (Score: 76-41)
Joel Morant drives to the basket... Joel Morant commits a violation (traveling/carry)! TURNOVER! (dead ball)

[10:59] Substitution (Team_048): Paolo Rozier OUT → Lauri Curry IN (stamina_rule2)

[10:59] Substitution (Team_048): Karl Johnson OUT → Yao Booker IN (stamina_rule2)

[10:59] Substitution (Team_048): Dejounte Sexton OUT → Kyle Irving IN (stamina_rule2)

[10:59] Substitution (Team_048): Kevin Fox OUT → DeMar Hyland IN (stamina_rule2)

[10:59] Substitution (Team_048): Damian Mobley OUT → Gary Giddey IN (stamina_rule2)

[10:59] Substitution (Team_060): Joel Morant OUT → Domantas Barnes IN (stamina_rule2)

[10:59] Substitution (Team_060): Julius Green OUT → Rudy Ginobili IN (stamina_rule2)

[10:59] Substitution (Team_060): Immanuel Ming OUT → Jarrett Wagner IN (stamina_rule2)

[10:59] Substitution (Team_060): Larry Westbrook OUT → Yao Tatum IN (stamina_rule2)

[10:59] Substitution (Team_060): Jaren George OUT → Klay Haliburton IN (stamina_rule2)

[10:44] Team_048 possession (Score: 76-41)
FOUL! Offensive foul on Kyle Irving! Jarrett Wagner drew the charge! [Team fouls: 1] (Kyle Irving: 1 personal fouls) TURNOVER! (dead ball)

[10:30] Team_060 possession (Score: 76-41)
Rudy Ginobili attempts a 3Pt. Contested by DeMar Hyland (3.7 feet, ZONE). Rudy Ginobili misses. Rebound secured by Gary Giddey.

[10:14] Team_048 possession (Score: 76-41)
Yao Booker attempts a 3Pt. Contested by Rudy Ginobili (4.4 feet, MAN). Yao Booker misses. Rebound secured by Klay Haliburton.

[09:58] Team_060 possession (Score: 76-41)
Yao Tatum drives, picks up Gary Giddey. Help arrives from Lauri Curry! Yao Tatum attempts a Layup. Contested by Lauri Curry (4.6 feet, ZONE). YAO TATUM MAKES IT! Assist: Domantas Barnes
Score: 76-43

[09:48] Team_048 possession (Score: 76-43)
Lauri Curry attempts a 3Pt. Contested by Domantas Barnes (4.7 feet, MAN). Lauri Curry misses. Rebound secured by Klay Haliburton.

[09:35] Team_060 possession (Score: 76-43)
Klay Haliburton commits a violation (traveling/carry)! TURNOVER! (dead ball)

[09:19] Team_048 possession (Score: 76-43)
Lauri Curry attempts a 3Pt. Contested by Domantas Barnes (4.7 feet, MAN). Lauri Curry misses. Rebound secured by Rudy Ginobili.

[09:08] Team_060 possession (Score: 76-43)
Domantas Barnes drives to the basket... Domantas Barnes commits a violation (traveling/carry)! TURNOVER! (dead ball)

[08:54] Team_048 possession (Score: 76-43)
Kyle Irving attempts a 3Pt. Contested by Domantas Barnes (4.6 feet, ZONE). Kyle Irving misses. Rebound secured by Klay Haliburton.

[08:39] Team_060 possession (Score: 76-43)
Jarrett Wagner drives to the basket... Jarrett Wagner throws a bad pass out of bounds! TURNOVER! (dead ball)

[08:25] Team_048 possession (Score: 76-43)
FOUL! Shooting foul on Klay Haliburton. Gary Giddey to the line for 2 free throws. [Team fouls: 1] (Klay Haliburton: 1 personal fouls)   FT 1/2: GOOD   FT 2/2: GOOD Gary Giddey makes 2/2 from the line.
Score: 78-43

[08:09] Team_060 possession (Score: 78-43)
Rudy Ginobili attempts a Midrange. Contested by Yao Booker (5.0 feet, MAN). Rudy Ginobili misses. Rebound secured by DeMar Hyland.

[07:53] Team_048 possession (Score: 78-43)
Gary Giddey attempts a Layup. Contested by Klay Haliburton (4.5 feet, MAN). Gary Giddey misses. FOUL! Loose ball foul on Rudy Ginobili during the rebound battle. [Team fouls: 2] No free throws, side out. (Rudy Ginobili: 1 personal fouls)

[07:40] Team_048 possession (Score: 78-43)
DeMar Hyland drives and kicks out. Kyle Irving attempts a Midrange. Contested by Jarrett Wagner (4.8 feet, MAN). Kyle Irving misses. Rebound secured by Klay Haliburton.

[07:24] Team_060 possession (Score: 78-43)
Rudy Ginobili attempts a Midrange. Contested by Yao Booker (5.0 feet, MAN). Rudy Ginobili misses. Offensive rebound by Domantas Barnes! Domantas Barnes kicks it out.

[07:08] Team_060 possession (Score: 78-43)
Klay Haliburton attempts a Layup. BLOCKED BY DEMAR HYLAND! Ball deflects out of bounds off Klay Haliburton.

[06:54] Team_048 possession (Score: 78-43)
Yao Booker attempts a Midrange. Contested by Rudy Ginobili (4.4 feet, MAN). Yao Booker misses. Rebound secured by Domantas Barnes.

[06:38] Team_060 possession (Score: 78-43)
Jarrett Wagner attempts a 3Pt. Contested by Kyle Irving (4.7 feet, MAN). Jarrett Wagner misses. Offensive rebound by Domantas Barnes! Domantas Barnes kicks it out.

[06:22] Team_060 possession (Score: 78-43)
Jarrett Wagner attempts a Midrange. Contested by Kyle Irving (4.7 feet, MAN). Jarrett Wagner misses. Rebound secured by DeMar Hyland.

[06:08] Team_048 possession (Score: 78-43)
FOUL! Shooting foul on Klay Haliburton. DeMar Hyland to the line for 2 free throws. [Team fouls: 3] (Klay Haliburton: 2 personal fouls)   FT 1/2: GOOD   FT 2/2: GOOD DeMar Hyland makes 2/2 from the line.
Score: 80-43

[05:51] Team_060 possession (Score: 80-43)
Yao Tatum attempts a Midrange. Contested by DeMar Hyland (3.5 feet, MAN). YAO TATUM MAKES IT!
Score: 80-45

[05:35] Team_048 possession (Score: 80-45)
DeMar Hyland attempts a Midrange. Contested by Yao Tatum (5.4 feet, MAN). DeMar Hyland misses. Rebound secured by Klay Haliburton.

[05:21] Team_060 possession (Score: 80-45)
Yao Tatum drives, DeMar Hyland stays with him. Yao Tatum attempts a Dunk. Contested by DeMar Hyland (3.5 feet, ZONE). Yao Tatum misses. Rebound secured by DeMar Hyland.

[05:06] Team_048 possession (Score: 80-45)
Gary Giddey attempts a 3Pt. Contested by Klay Haliburton (4.5 feet, MAN). Gary Giddey misses. Offensive rebound by DeMar Hyland! DeMar Hyland kicks it out.

[04:50] Team_048 possession (Score: 80-45)
Yao Booker attempts a 3Pt. Contested by Domantas Barnes (4.6 feet, ZONE). Yao Booker misses. Rebound secured by Klay Haliburton.

[04:36] Team_060 possession (Score: 80-45)
Klay Haliburton drives, DeMar Hyland stays with him. Klay Haliburton attempts a Layup. Contested by DeMar Hyland (3.7 feet, MAN). Klay Haliburton misses. Rebound secured by DeMar Hyland.

[04:22] Team_048 possession (Score: 80-45)
Yao Booker attempts a Layup. Contested by Rudy Ginobili (4.4 feet, MAN). Yao Booker misses. Offensive rebound by DeMar Hyland! DeMar Hyland kicks it out.

[04:07] Team_048 possession (Score: 80-45)
Yao Booker attempts a Layup. Contested by Rudy Ginobili (4.4 feet, MAN). Yao Booker misses. Rebound secured by Klay Haliburton.

[03:52] Team_060 possession (Score: 80-45)
Domantas Barnes drives and kicks out. Domantas Barnes attempts a 3Pt. Contested by Lauri Curry (4.6 feet, MAN). Domantas Barnes misses. Rebound secured by Kyle Irving.

[03:40] Team_048 possession (Score: 80-45)
DeMar Hyland makes the Layup and draws the foul on Domantas Barnes! And-1! DeMar Hyland to the line for 1. [Team fouls: 4] (Domantas Barnes: 1 personal fouls)   FT 1/1: GOOD DeMar Hyland makes 1/1 from the line.
Score: 83-45

[03:26] Team_060 possession (Score: 83-45)
Yao Tatum attempts a Layup. Contested by Gary Giddey (4.7 feet, ZONE). Yao Tatum misses. Offensive rebound by Domantas Barnes! Domantas Barnes kicks it out.

[03:12] Team_060 possession (Score: 83-45)
Klay Haliburton makes the Dunk and draws the foul on DeMar Hyland! And-1! Klay Haliburton to the line for 1. [Team fouls: 2] (DeMar Hyland: 1 personal fouls)   FT 1/1: GOOD Klay Haliburton makes 1/1 from the line.
Score: 83-48

[02:58] Team_048 possession (Score: 83-48)
Gary Giddey drives, picks up Klay Haliburton. Help arrives from Domantas Barnes! Gary Giddey attempts a Dunk. Contested by Domantas Barnes (4.5 feet, ZONE). Gary Giddey misses. Rebound secured by Klay Haliburton.

[02:43] Team_060 possession (Score: 83-48)
Rudy Ginobili attempts a 3Pt. Contested by DeMar Hyland (3.9 feet, ZONE). Rudy Ginobili misses. Rebound secured by DeMar Hyland.

[02:31] Team_048 possession (Score: 83-48)
Yao Booker attempts a Layup. Contested by Klay Haliburton (4.4 feet, ZONE). Yao Booker misses. Rebound secured by Domantas Barnes.

[02:17] Team_060 possession (Score: 83-48)
Domantas Barnes drives to the basket... Domantas Barnes commits a violation (traveling/carry)! TURNOVER! (dead ball)

[02:04] Team_048 possession (Score: 83-48)
Kyle Irving drives and kicks out. DeMar Hyland attempts a 3Pt. Contested by Yao Tatum (5.4 feet, MAN). DeMar Hyland misses. Rebound secured by Klay Haliburton.

[01:49] Team_060 possession (Score: 83-48)
Rudy Ginobili attempts a 3Pt. Contested by Yao Booker (5.1 feet, MAN). Rudy Ginobili misses. Rebound secured by Gary Giddey.

[01:33] Team_048 possession (Score: 83-48)
FOUL! Reach-in foul on Klay Haliburton during the drive. [IN THE BONUS! 5 team fouls] DeMar Hyland to the line for 2 free throws. (Klay Haliburton: 3 personal fouls)   FT 1/2: GOOD   FT 2/2: GOOD DeMar Hyland makes 2/2 from the line.
Score: 85-48

[01:13] Team_060 possession (Score: 85-48)
Jarrett Wagner attempts a 3Pt. Contested by Kyle Irving (4.8 feet, MAN). Jarrett Wagner misses. Rebound secured by DeMar Hyland.

[00:59] Team_048 possession (Score: 85-48)
FOUL! Holding foul on Domantas Barnes. [IN THE BONUS! 6 team fouls] Lauri Curry to the line for 2 free throws. (Domantas Barnes: 2 personal fouls)   FT 1/2: GOOD   FT 2/2: GOOD Lauri Curry makes 2/2 from the line.
Score: 87-48

[00:44] Team_060 possession (Score: 87-48)
Yao Tatum attempts a 3Pt. Contested by DeMar Hyland (3.8 feet, ZONE). Yao Tatum misses. Offensive rebound by Domantas Barnes! Domantas Barnes kicks it out.

[00:28] Team_060 possession (Score: 87-48)
Rudy Ginobili attempts a 3Pt. Contested by Yao Booker (5.2 feet, ZONE). RUDY GINOBILI MAKES IT! Assist: Klay Haliburton
Score: 87-51

[00:11] Team_048 possession (Score: 87-51)
FOUL! Shooting foul on Rudy Ginobili. Yao Booker to the line for 2 free throws. [BONUS: 7 team fouls] (Rudy Ginobili: 2 personal fouls)   FT 1/2: MISS   FT 2/2: GOOD Yao Booker makes 1/2 from the line.
Score: 88-51

================================================================================
                              4TH QUARTER COMPLETE                              
================================================================================

4TH QUARTER SCORE: Team_048 16, Team_060 10

BOX SCORE:
================================================================================

Team_048
--------------------------------------------------------------------------------
Player                MIN  PTS  REB  AST  TO      FG   FG%      3P   3P%
--------------------------------------------------------------------------------
DeMar Hyland           22    7    9    0   0   3/5    60.0     0/0   0.0
Karl Johnson           26    2    0    0   0   1/1   100.0     0/0   0.0
Damian Mobley          26    2    0    0   0   1/1   100.0     0/0   0.0
Gary Giddey            22    2    2    0   0   1/2    50.0     0/0   0.0
Lauri Curry            22    2    0    0   0   1/3    33.3     0/0   0.0
Yao Booker             22    1    0    0   0   1/6    16.7     0/0   0.0
Kevin Fox              26    0    0    2   0   0/0     0.0     0/0   0.0
Dejounte Sexton        26    0    1    0   0   0/0     0.0     0/0   0.0
Kyle Irving            22    0    1    0   0   0/2     0.0     0/0   0.0

TEAM: FG: 8/20 (40.0%), 3PT: 0/5 (0.0%), REB: 13 (3 off, 10 def), AST: 2, TO: 1
TEAM FOULS: 2


Team_060
--------------------------------------------------------------------------------
Player                MIN  PTS  REB  AST  TO      FG   FG%      3P   3P%
--------------------------------------------------------------------------------
Yao Tatum              22    4    0    0   0   2/3    66.7     0/0   0.0
Rudy Ginobili          22    3    1    0   0   1/5    20.0     0/0   0.0
Klay Haliburton        22    3    9    1   0   1/3    33.3     0/0   0.0
Joel Morant            26    0    0    0   0   0/1     0.0     0/0   0.0
Immanuel Ming          26    0    1    0   0   0/0     0.0     0/0   0.0
Domantas Barnes        22    0    6    1   0   0/1     0.0     0/0   0.0
Jarrett Wagner         22    0    0    0   0   0/2     0.0     0/0   0.0

TEAM: FG: 4/15 (26.7%), 3PT: 1/6 (16.7%), REB: 17 (5 off, 12 def), AST: 2, TO: 5
TEAM FOULS: 7 [Team_048 in BONUS]

================================================================================

================================================================================
                               FULL GAME COMPLETE                               
================================================================================

FINAL SCORE: Team_048 88, Team_060 51

SCORING BY QUARTER:
--------------------------------------------------------------------------------
Team                     Q1     Q2     Q3     Q4    FINAL
--------------------------------------------------------------------------------
Team_048                 27     25     20     16       88
Team_060                 18     11     12     10       51
--------------------------------------------------------------------------------

FULL GAME BOX SCORE:
================================================================================

Team_048
--------------------------------------------------------------------------------
Player                MIN  PTS  REB  AST  TO      FG   FG%      3P   3P%      FT STL BLK
--------------------------------------------------------------------------------
Paolo Rozier           26    2    0    4   1   1/10   10.0   0/6     0.0   0/0     0   0
Karl Johnson           26   18    0    2   1  10/14   71.4   3/4    75.0   3/3     0   0
Dejounte Sexton        26    5    8    1   1   3/5    60.0   1/3    33.3   0/1     1   0
Kevin Fox              26    6   12    4   1   4/7    57.1   0/1     0.0   0/0     0   0
Damian Mobley          26   20   15    3   3   4/7    57.1   0/0     0.0   1/1     0   0
Lauri Curry            22   10    0    1   1   2/6    33.3   0/3     0.0   5/5     0   1
Yao Booker             22    1    0    1   0   2/8    25.0   0/2     0.0   2/4     0   0
Kyle Irving            22    2    3    1   1   0/5     0.0   0/4     0.0   2/2     0   0
DeMar Hyland           22   17   19    0   1   7/11   63.6   2/4    50.0   8/8     2   1
Gary Giddey            22    4    6    0   1   3/5    60.0   0/0     0.0   2/2     0   0

TEAM: FG: 37/80 (46.2%), 3PT: 6/27 (22.2%), REB: 64 (15 off, 49 def), AST: 17, TO: 11


Team_060
--------------------------------------------------------------------------------
Player                MIN  PTS  REB  AST  TO      FG   FG%      3P   3P%      FT STL BLK
--------------------------------------------------------------------------------
Joel Morant            26    2    0    0   1   1/4    25.0   0/1     0.0   0/0     0   0
Julius Green           26    3    0    1   0   1/8    12.5   1/4    25.0   0/0     1   1
Immanuel Ming          26    9   12    1   4   4/6    66.7   1/2    50.0   2/2     0   0
Larry Westbrook        26   11    7    2   2   5/10   50.0   0/1     0.0   1/1     0   0
Jaren George           26    6    5    1   1   3/12   25.0   0/2     0.0   1/2     3   0
Domantas Barnes        22    0   11    2   1   0/5     0.0   0/3     0.0   0/0     1   1
Rudy Ginobili          22    3    2    0   1   1/6    16.7   1/5    20.0   0/0     0   0
Jarrett Wagner         22    0    0    0   0   0/5     0.0   0/3     0.0   0/1     0   0
Yao Tatum              22    6    0    0   0   3/10   30.0   0/3     0.0   2/2     1   0
Klay Haliburton        22    8   14    1   5   3/6    50.0   1/1   100.0   1/1     1   0

TEAM: FG: 21/72 (29.2%), 3PT: 4/25 (16.0%), REB: 50 (9 off, 41 def), AST: 8, TO: 15

================================================================================
