================================================================================
                        FULL GAME - Team_098 vs Team_052                        
================================================================================

================================================================================
                       1ST QUARTER - Team_098 vs Team_052                       
================================================================================

[12:00] Team_098 possession (Score: 0-0)
Malcolm Tatum attempts a 3Pt. Contested by Gary Gasol (4.0 feet, MAN). Malcolm Tatum misses. Rebound secured by James Paul.

[11:43] Team_052 possession (Score: 0-0)
Gary Gasol attempts a 3Pt. Contested by Nikola Rose (3.6 feet, ZONE). Gary Gasol misses. Rebound secured by Nikola Rose.

[11:27] Team_098 possession (Score: 0-0)
Nikola Rose drives and kicks out. Nikola Rose makes the 3Pt and draws the foul on Bones Morant! And-1! Nikola Rose to the line for 1. [Team fouls: 1] (Bones Morant: 1 personal fouls)   FT 1/1: MISS Nikola Rose makes 0/1 from the line. Rebound secured by James Paul.
Score: 3-0

[11:16] Team_052 possession (Score: 3-0)
Josh Durant drives to the basket... Josh Durant loses control! Ball rolls out of bounds! TURNOVER! (dead ball)

[10:59] Team_098 possession (Score: 3-0)
FOUL! Shooting foul on Gary Gasol. Malcolm Tatum to the line for 3 free throws. [Team fouls: 2] (Gary Gasol: 1 personal fouls)   FT 1/3: GOOD   FT 2/3: MISS   FT 3/3: GOOD Malcolm Tatum makes 2/3 from the line.
Score: 5-0

[10:44] Team_052 possession (Score: 5-0)
FOUL! Holding foul on Blake Murray. [Team fouls: 1] No free throws, side out. (Blake Murray: 1 personal fouls)

[10:25] Team_052 possession (Score: 5-0)
FOUL! Holding foul on Pascal Lillard. [Team fouls: 2] No free throws, side out. (Pascal Lillard: 1 personal fouls)

[10:11] Team_052 possession (Score: 5-0)
Gary Gasol attempts a 3Pt. Contested by Nikola Rose (3.6 feet, ZONE). Gary Gasol misses. Offensive rebound by James Paul! James Paul puts it back in!
Score: 5-2

[09:59] Team_098 possession (Score: 5-2)
Pascal Lillard drives and kicks out. Blake Murray attempts a 3Pt. Contested by Gary Gasol (3.8 feet, ZONE). Blake Murray misses. Rebound secured by James Paul.

[09:43] Team_052 possession (Score: 5-2)
Gary Gasol attempts a 3Pt. Contested by Malcolm Tatum (4.4 feet, ZONE). Gary Gasol misses. Rebound secured by Derrick Durant.

[09:27] Team_098 possession (Score: 5-2)
Pascal Lillard drives, picks up James Paul. Help arrives from Josh Durant! Pascal Lillard attempts a Layup. Contested by Josh Durant (4.0 feet, ZONE). PASCAL LILLARD MAKES IT! Assist: Nikola Rose
Score: 7-2

[09:09] Team_052 possession (Score: 7-2)
Gary Gasol attempts a Midrange. Contested by Derrick Durant (4.8 feet, ZONE). Gary Gasol misses. Offensive rebound by Bones Morant! Bones Morant kicks it out.

[08:58] Team_052 possession (Score: 7-2)
Gary Gasol attempts a Layup. Contested by Pascal Lillard (4.5 feet, ZONE). GARY GASOL MAKES IT! Assist: Bones Morant
Score: 7-4

[08:44] Team_098 possession (Score: 7-4)
Malcolm Tatum attempts a 3Pt. Contested by Gary Gasol (4.0 feet, MAN). MALCOLM TATUM MAKES IT! Assist: Derrick Durant
Score: 10-4

[08:30] Team_052 possession (Score: 10-4)
FOUL! Shooting foul on Derrick Durant. Carmelo Middleton to the line for 2 free throws. [Team fouls: 3] (Derrick Durant: 1 personal fouls)   FT 1/2: MISS   FT 2/2: GOOD Carmelo Middleton makes 1/2 from the line.
Score: 10-5

[08:13] Team_098 possession (Score: 10-5)
Nikola Rose drives, James Paul stays with him. Nikola Rose attempts a Layup. Contested by James Paul (3.7 feet, ZONE). NIKOLA ROSE MAKES IT! Assist: Malcolm Tatum
Score: 12-5

[07:57] Team_052 possession (Score: 12-5)
Gary Gasol throws a bad pass! Stolen by Malcolm Tatum! TURNOVER! (live ball)

[07:38] Team_098 possession (Score: 12-5)
Derrick Durant attempts a Dunk. BLOCKED BY JAMES PAUL! Ball is loose! Rebound secured by Carmelo Middleton.

[07:23] Team_052 possession (Score: 12-5)
FOUL! Reach-in foul on Pascal Lillard during the drive. [Team fouls: 4] No free throws, side out. (Pascal Lillard: 2 personal fouls)

[07:05] Team_052 possession (Score: 12-5)
Josh Durant attempts a 3Pt. Contested by Nikola Rose (3.0 feet, ZONE). Josh Durant misses. Rebound secured by Nikola Rose.

[06:50] Team_098 possession (Score: 12-5)
Malcolm Tatum makes the Layup and draws the foul on James Paul! And-1! Malcolm Tatum to the line for 1. [Team fouls: 3] (James Paul: 1 personal fouls)   FT 1/1: GOOD Malcolm Tatum makes 1/1 from the line.
Score: 15-5

[06:38] Team_052 possession (Score: 15-5)
James Paul attempts a Layup. Contested by Pascal Lillard (4.4 feet, MAN). JAMES PAUL MAKES IT!
Score: 15-7

[06:24] Team_098 possession (Score: 15-7)
Nikola Rose drives and kicks out. Pascal Lillard attempts a Midrange. Contested by Josh Durant (3.3 feet, ZONE). PASCAL LILLARD MAKES IT!
Score: 17-7

[06:10] Team_052 possession (Score: 17-7)
Josh Durant attempts a Midrange. Contested by Nikola Rose (3.0 feet, MAN). Josh Durant misses. Rebound secured by Nikola Rose.

[05:58] Team_098 possession (Score: 17-7)
Nikola Rose makes the Layup and draws the foul on Bones Morant! And-1! Nikola Rose to the line for 1. [Team fouls: 4] (Bones Morant: 2 personal fouls)   FT 1/1: GOOD Nikola Rose makes 1/1 from the line.
Score: 20-7

[05:46] Team_052 possession (Score: 20-7)
Josh Durant attempts a 3Pt. Contested by Nikola Rose (3.0 feet, MAN). Josh Durant misses. Offensive rebound by James Paul! James Paul puts it back in!
Score: 20-9

[05:30] Team_098 possession (Score: 20-9)
Nikola Rose attempts a 3Pt. Contested by Bones Morant (3.9 feet, ZONE). Nikola Rose misses. Offensive rebound by Pascal Lillard! Pascal Lillard kicks it out.

[05:16] Team_098 possession (Score: 20-9)
Nikola Rose attempts a 3Pt. Contested by James Paul (3.7 feet, ZONE). Nikola Rose misses. Rebound secured by Carmelo Middleton.

[05:01] Team_052 possession (Score: 20-9)
Josh Durant attempts a Midrange. Contested by Nikola Rose (3.0 feet, ZONE). Josh Durant misses. Rebound secured by Nikola Rose.

[04:42] Team_098 possession (Score: 20-9)
Malcolm Tatum attempts a 3Pt. Contested by Bones Morant (3.8 feet, ZONE). Malcolm Tatum misses. Rebound secured by Carmelo Middleton.

[04:29] Team_052 possession (Score: 20-9)
Carmelo Middleton drives to the basket... Carmelo Middleton throws a bad pass! Stolen by Derrick Durant! TURNOVER! (live ball)

[04:17] Team_098 possession (Score: 20-9)
Derrick Durant attempts a 3Pt. Contested by Bones Morant (3.8 feet, ZONE). Derrick Durant misses. Rebound secured by Bones Morant.

[03:59] Team_052 possession (Score: 20-9)
James Paul attempts a Midrange. Contested by Pascal Lillard (4.5 feet, MAN). JAMES PAUL MAKES IT! Assist: Carmelo Middleton
Score: 20-11

[03:42] Team_098 possession (Score: 20-11)
Nikola Rose makes the Layup and draws the foul on Josh Durant! And-1! Nikola Rose to the line for 1. [BONUS: 5 team fouls] (Josh Durant: 1 personal fouls)   FT 1/1: GOOD Nikola Rose makes 1/1 from the line.
Score: 23-11

[03:27] Team_052 possession (Score: 23-11)
Gary Gasol drives to the basket... Gary Gasol commits a violation (traveling/carry)! TURNOVER! (dead ball)

[03:16] Team_098 possession (Score: 23-11)
Pascal Lillard attempts a Midrange. Contested by James Paul (4.1 feet, MAN). Pascal Lillard misses. Rebound secured by Carmelo Middleton.

[03:05] Team_052 possession (Score: 23-11)
Bones Morant attempts a 3Pt. Contested by Blake Murray (5.1 feet, MAN). Bones Morant misses. Rebound secured by Derrick Durant.

[02:53] Team_098 possession (Score: 23-11)
FOUL! Reach-in foul on James Paul during the drive. [IN THE BONUS! 6 team fouls] Malcolm Tatum to the line for 2 free throws. (James Paul: 2 personal fouls)   FT 1/2: GOOD   FT 2/2: GOOD Malcolm Tatum makes 2/2 from the line.
Score: 25-11

[02:39] Team_052 possession (Score: 25-11)
Josh Durant drives to the basket... Josh Durant throws a bad pass! Stolen by Pascal Lillard! TURNOVER! (live ball)

[02:21] Team_098 possession (Score: 25-11)
Derrick Durant attempts a Layup. Contested by James Paul (3.8 feet, ZONE). DERRICK DURANT MAKES IT!
Score: 27-11

[02:08] Team_052 possession (Score: 27-11)
Carmelo Middleton attempts a Layup. BLOCKED BY PASCAL LILLARD! Ball is loose! Rebound secured by Derrick Durant.

[01:55] Team_098 possession (Score: 27-11)
Derrick Durant drives to the basket... Derrick Durant throws a bad pass out of bounds! TURNOVER! (dead ball)

[01:55] Substitution (Team_098): Malcolm Tatum OUT → Tracy Rose IN (stamina_rule2)

[01:55] Substitution (Team_098): Nikola Rose OUT → Dirk McCollum IN (stamina_rule2)

[01:55] Substitution (Team_098): Blake Murray OUT → Kristaps Iverson IN (stamina_rule2)

[01:55] Substitution (Team_098): Pascal Lillard OUT → Manu Jordan IN (stamina_rule2)

[01:55] Substitution (Team_098): Derrick Durant OUT → Russell McGrady IN (stamina_rule2)

[01:55] Substitution (Team_052): Gary Gasol OUT → Jimmy Doncic IN (stamina_rule2)

[01:55] Substitution (Team_052): Josh Durant OUT → Carmelo Giddey IN (stamina_rule2)

[01:55] Substitution (Team_052): Bones Morant OUT → Donovan Stewart IN (stamina_rule2)

[01:55] Substitution (Team_052): James Paul OUT → Jalen Haliburton IN (stamina_rule2)

[01:55] Substitution (Team_052): Carmelo Middleton OUT → Carmelo Beal IN (stamina_rule2)

[01:39] Team_052 possession (Score: 27-11)
Carmelo Giddey attempts a 3Pt. Contested by Dirk McCollum (4.8 feet, MAN). Carmelo Giddey misses. Rebound secured by Russell McGrady.

[01:21] Team_098 possession (Score: 27-11)
Tracy Rose attempts a Midrange. Contested by Jimmy Doncic (4.8 feet, MAN). Tracy Rose misses. Rebound secured by Carmelo Beal.

[01:05] Team_052 possession (Score: 27-11)
Jimmy Doncic attempts a Layup. Contested by Tracy Rose (3.1 feet, MAN). JIMMY DONCIC MAKES IT! Assist: Carmelo Beal
Score: 27-13

[00:52] Team_098 possession (Score: 27-13)
FOUL! Shooting foul on Jalen Haliburton. Manu Jordan to the line for 2 free throws. [BONUS: 7 team fouls] (Jalen Haliburton: 1 personal fouls)   FT 1/2: GOOD   FT 2/2: MISS Manu Jordan makes 1/2 from the line. Rebound secured by Donovan Stewart.
Score: 28-13

[00:41] Team_052 possession (Score: 28-13)
Carmelo Giddey attempts a 3Pt. Contested by Dirk McCollum (4.8 feet, MAN). CARMELO GIDDEY MAKES IT! Assist: Jimmy Doncic
Score: 28-16

[00:23] Team_098 possession (Score: 28-16)
Dirk McCollum drives, Carmelo Beal stays with him. Dirk McCollum attempts a Layup. Contested by Carmelo Beal (3.6 feet, ZONE). Dirk McCollum misses. Offensive rebound by Russell McGrady! Russell McGrady's putback is no good. Rebound secured by Jalen Haliburton.

[00:09] Team_052 possession (Score: 28-16)
Jimmy Doncic attempts a Midrange. Contested by Tracy Rose (3.1 feet, MAN). Jimmy Doncic misses. Rebound secured by Kristaps Iverson.

================================================================================
                              1ST QUARTER COMPLETE                              
================================================================================

1ST QUARTER SCORE: Team_098 28, Team_052 16

BOX SCORE:
================================================================================

Team_098
--------------------------------------------------------------------------------
Player                MIN  PTS  REB  AST  TO      FG   FG%      3P   3P%
--------------------------------------------------------------------------------
Malcolm Tatum          10   10    0    1   0   4/6    66.7     0/0   0.0
Nikola Rose            10    8    4    1   0   3/5    60.0     0/0   0.0
Pascal Lillard         10    4    1    0   0   2/4    50.0     0/0   0.0
Derrick Durant         10    2    3    1   0   1/3    33.3     0/0   0.0
Russell McGrady         2    0    1    0   0   0/0     0.0     0/0   0.0
Tracy Rose              2    0    0    0   0   0/1     0.0     0/0   0.0
Manu Jordan             2    0    0    0   0   0/1     0.0     0/0   0.0
Dirk McCollum           2    0    0    0   0   0/1     0.0     0/0   0.0
Jalen Haliburton        2    0    1    0   0   0/0     0.0     0/0   0.0
Kristaps Iverson        2    0    1    0   0   0/0     0.0     0/0   0.0

TEAM: FG: 10/21 (47.6%), 3PT: 2/6 (33.3%), REB: 11 (2 off, 9 def), AST: 3, TO: 1
TEAM FOULS: 4


Team_052
--------------------------------------------------------------------------------
Player                MIN  PTS  REB  AST  TO      FG   FG%      3P   3P%
--------------------------------------------------------------------------------
James Paul             10    8    5    0   0   4/4   100.0     0/0   0.0
Carmelo Giddey          2    3    0    0   0   1/2    50.0     0/0   0.0
Gary Gasol             10    2    0    0   0   1/3    33.3     0/0   0.0
Jimmy Doncic            2    2    0    1   0   1/2    50.0     0/0   0.0
Carmelo Middleton      10    1    4    1   0   1/2    50.0     0/0   0.0
Bones Morant           10    0    2    1   0   0/1     0.0     0/0   0.0
Josh Durant            10    0    0    0   0   0/3     0.0     0/0   0.0
Carmelo Beal            2    0    1    1   0   0/0     0.0     0/0   0.0
Donovan Stewart         2    0    1    0   0   0/0     0.0     0/0   0.0

TEAM: FG: 8/17 (47.1%), 3PT: 3/8 (37.5%), REB: 13 (3 off, 10 def), AST: 4, TO: 5
TEAM FOULS: 7 [Team_098 in BONUS]

================================================================================

================================================================================
                       2ND QUARTER - Team_098 vs Team_052                       
================================================================================

[12:00] Team_098 possession (Score: 28-16)
Nikola Rose attempts a 3Pt. Contested by Josh Durant (3.6 feet, MAN). Nikola Rose misses. Rebound secured by Bones Morant.

[11:46] Team_052 possession (Score: 28-16)
Josh Durant attempts a 3Pt. Contested by Pascal Lillard (3.9 feet, ZONE). JOSH DURANT MAKES IT! Assist: James Paul
Score: 28-19

[11:34] Team_098 possession (Score: 28-19)
Blake Murray attempts a 3Pt. Contested by Bones Morant (3.8 feet, ZONE). Blake Murray misses. Offensive rebound by Pascal Lillard! Pascal Lillard kicks it out.

[11:18] Team_098 possession (Score: 28-19)
Nikola Rose drives to the basket... Nikola Rose throws a bad pass out of bounds! TURNOVER! (dead ball)

[11:01] Team_052 possession (Score: 28-19)
Carmelo Middleton attempts a Midrange. Contested by Blake Murray (5.0 feet, ZONE). Carmelo Middleton misses. Offensive rebound by James Paul! James Paul puts it back in!
Score: 28-21

[10:47] Team_098 possession (Score: 28-21)
Malcolm Tatum attempts a 3Pt. Contested by Gary Gasol (4.1 feet, MAN). Malcolm Tatum misses. Offensive rebound by Pascal Lillard! Pascal Lillard kicks it out.

[10:31] Team_098 possession (Score: 28-21)
Pascal Lillard drives, James Paul stays with him. Pascal Lillard attempts a Layup. Contested by James Paul (4.1 feet, ZONE). PASCAL LILLARD MAKES IT!
Score: 30-21

[10:15] Team_052 possession (Score: 30-21)
James Paul makes the Layup and draws the foul on Pascal Lillard! And-1! James Paul to the line for 1. [Team fouls: 1] (Pascal Lillard: 1 personal fouls)   FT 1/1: GOOD James Paul makes 1/1 from the line.
Score: 30-24

[09:59] Team_098 possession (Score: 30-24)
Derrick Durant attempts a Dunk. BLOCKED BY JOSH DURANT! Ball is loose! Rebound secured by Carmelo Middleton.

[09:45] Team_052 possession (Score: 30-24)
James Paul attempts a Layup. Contested by Pascal Lillard (4.6 feet, ZONE). JAMES PAUL MAKES IT! Assist: Carmelo Middleton
Score: 30-26

[09:28] Team_098 possession (Score: 30-26)
Malcolm Tatum attempts a Midrange. Contested by Gary Gasol (4.2 feet, MAN). Malcolm Tatum misses. Rebound secured by James Paul.

[09:16] Team_052 possession (Score: 30-26)
James Paul attempts a Layup. Contested by Pascal Lillard (4.7 feet, ZONE). James Paul misses. Rebound secured by Nikola Rose.

[09:01] Team_098 possession (Score: 30-26)
Nikola Rose attempts a 3Pt. Contested by Bones Morant (4.2 feet, ZONE). Nikola Rose misses. Offensive rebound by Pascal Lillard! Pascal Lillard kicks it out.

[08:50] Team_098 possession (Score: 30-26)
Pascal Lillard attempts a Midrange. Contested by James Paul (4.3 feet, MAN). PASCAL LILLARD MAKES IT! Assist: Blake Murray
Score: 32-26

[08:36] Team_052 possession (Score: 32-26)
Gary Gasol drives, Pascal Lillard stays with him. Gary Gasol attempts a Layup. Contested by Pascal Lillard (4.8 feet, ZONE). GARY GASOL MAKES IT! Assist: Josh Durant
Score: 32-28

[08:23] Team_098 possession (Score: 32-28)
Malcolm Tatum drives, James Paul stays with him. Malcolm Tatum attempts a Layup. Contested by James Paul (4.0 feet, ZONE). MALCOLM TATUM MAKES IT! Assist: Pascal Lillard
Score: 34-28

[08:03] Team_052 possession (Score: 34-28)
Gary Gasol attempts a Layup. Contested by Pascal Lillard (4.9 feet, ZONE). GARY GASOL MAKES IT!
Score: 34-30

[07:50] Team_098 possession (Score: 34-30)
FOUL! Reach-in foul on Bones Morant during the drive. [Team fouls: 1] No free throws, side out. (Bones Morant: 1 personal fouls)

[07:39] Team_098 possession (Score: 34-30)
Blake Murray attempts a Midrange. Contested by Bones Morant (4.2 feet, MAN). Blake Murray misses. Offensive rebound by Derrick Durant! Derrick Durant's putback is no good. Rebound secured by Carmelo Middleton.

[07:27] Team_052 possession (Score: 34-30)
Josh Durant attempts a 3Pt. Contested by Nikola Rose (3.5 feet, ZONE). JOSH DURANT MAKES IT! Assist: Carmelo Middleton
Score: 34-33

[07:15] Team_098 possession (Score: 34-33)
Malcolm Tatum attempts a Layup. Contested by Gary Gasol (4.5 feet, MAN). Malcolm Tatum misses. Rebound secured by Carmelo Middleton.

[07:00] Team_052 possession (Score: 34-33)
James Paul attempts a Layup. Contested by Pascal Lillard (4.9 feet, MAN). JAMES PAUL MAKES IT! Assist: Carmelo Middleton
Score: 34-35

[06:44] Team_098 possession (Score: 34-35)
Nikola Rose drives and kicks out. Nikola Rose attempts a 3Pt. Contested by Bones Morant (4.2 feet, ZONE). Nikola Rose misses. Rebound secured by Carmelo Middleton.

[06:31] Team_052 possession (Score: 34-35)
Carmelo Middleton makes the Dunk and draws the foul on Derrick Durant! And-1! Carmelo Middleton to the line for 1. [Team fouls: 2] (Derrick Durant: 1 personal fouls)   FT 1/1: GOOD Carmelo Middleton makes 1/1 from the line.
Score: 34-38

[06:17] Team_098 possession (Score: 34-38)
Pascal Lillard attempts a 3Pt. Contested by Bones Morant (4.7 feet, ZONE). Pascal Lillard misses. FOUL! Loose ball foul on James Paul during the rebound battle. [Team fouls: 2] No free throws, side out. (James Paul: 1 personal fouls)

[06:00] Team_098 possession (Score: 34-38)
Pascal Lillard attempts a Layup. Contested by James Paul (4.6 feet, ZONE). Pascal Lillard misses. Offensive rebound by Derrick Durant! Derrick Durant's putback is no good. Rebound secured by Bones Morant.

[05:49] Team_052 possession (Score: 34-38)
Gary Gasol drives, Malcolm Tatum stays with him. Gary Gasol attempts a Layup. Contested by Malcolm Tatum (5.1 feet, MAN). GARY GASOL MAKES IT! Assist: Josh Durant
Score: 34-40

[05:36] Team_098 possession (Score: 34-40)
FOUL! Shooting foul on James Paul. Nikola Rose to the line for 2 free throws. [Team fouls: 3] (James Paul: 2 personal fouls)   FT 1/2: GOOD   FT 2/2: MISS Nikola Rose makes 1/2 from the line. Rebound secured by James Paul.
Score: 35-40

[05:20] Team_052 possession (Score: 35-40)
Gary Gasol attempts a 3Pt. Contested by Malcolm Tatum (5.2 feet, MAN). Gary Gasol misses. Rebound secured by Derrick Durant.

[05:07] Team_098 possession (Score: 35-40)
Nikola Rose makes the Dunk and draws the foul on James Paul! And-1! Nikola Rose to the line for 1. [Team fouls: 4] (James Paul: 3 personal fouls)   FT 1/1: GOOD Nikola Rose makes 1/1 from the line.
Score: 38-40

[04:50] Team_052 possession (Score: 38-40)
Bones Morant attempts a 3Pt. Contested by Nikola Rose (4.4 feet, ZONE). BONES MORANT MAKES IT! Assist: Gary Gasol
Score: 38-43

[04:34] Team_098 possession (Score: 38-43)
Blake Murray attempts a 3Pt. Contested by Bones Morant (4.6 feet, MAN). Blake Murray misses. FOUL! Loose ball foul on Bones Morant during the rebound battle. [IN THE BONUS! 5 team fouls] Pascal Lillard to the line for 2 free throws. (Bones Morant: 2 personal fouls)   FT 1/2: GOOD   FT 2/2: GOOD Pascal Lillard makes 2/2 from the line.
Score: 40-43

[04:19] Team_052 possession (Score: 40-43)
James Paul attempts a Midrange. Contested by Pascal Lillard (5.2 feet, MAN). JAMES PAUL MAKES IT!
Score: 40-45

[04:04] Team_098 possession (Score: 40-45)
Nikola Rose makes the Layup and draws the foul on Carmelo Middleton! And-1! Nikola Rose to the line for 1. [BONUS: 6 team fouls] (Carmelo Middleton: 1 personal fouls)   FT 1/1: GOOD Nikola Rose makes 1/1 from the line.
Score: 43-45

[03:49] Team_052 possession (Score: 43-45)
FOUL! Shooting foul on Malcolm Tatum. Gary Gasol to the line for 2 free throws. [Team fouls: 3] (Malcolm Tatum: 1 personal fouls)   FT 1/2: GOOD   FT 2/2: GOOD Gary Gasol makes 2/2 from the line.
Score: 43-47

[03:39] Team_098 possession (Score: 43-47)
Pascal Lillard attempts a Layup. Contested by James Paul (4.9 feet, MAN). PASCAL LILLARD MAKES IT!
Score: 45-47

[03:28] Team_052 possession (Score: 45-47)
Josh Durant attempts a 3Pt. Contested by Nikola Rose (4.1 feet, ZONE). Josh Durant misses. Rebound secured by Pascal Lillard.

[03:13] Team_098 possession (Score: 45-47)
Nikola Rose attempts a Midrange. Contested by Josh Durant (4.6 feet, ZONE). Nikola Rose misses. Rebound secured by James Paul.

[03:02] Team_052 possession (Score: 45-47)
Carmelo Middleton attempts a Layup. Contested by Derrick Durant (5.9 feet, MAN). Carmelo Middleton misses. Rebound secured by Pascal Lillard.

[02:51] Team_098 possession (Score: 45-47)
Pascal Lillard drives, Carmelo Middleton stays with him. Pascal Lillard attempts a Layup. Contested by Carmelo Middleton (6.0 feet, ZONE). Pascal Lillard misses. Rebound secured by Carmelo Middleton.

[02:34] Team_052 possession (Score: 45-47)
James Paul attempts a Midrange. Contested by Pascal Lillard (5.5 feet, ZONE). JAMES PAUL MAKES IT!
Score: 45-49

[02:22] Team_098 possession (Score: 45-49)
Nikola Rose attempts a Layup. Contested by James Paul (4.9 feet, ZONE). NIKOLA ROSE MAKES IT! Assist: Pascal Lillard
Score: 47-49

[02:13] Team_052 possession (Score: 47-49)
Gary Gasol attempts a Midrange. Contested by Malcolm Tatum (5.6 feet, MAN). Gary Gasol misses. Rebound secured by Derrick Durant.

[01:53] Team_098 possession (Score: 47-49)
Nikola Rose drives, picks up Josh Durant. Help arrives from Bones Morant! Nikola Rose attempts a Dunk. Contested by Bones Morant (4.8 feet, MAN). NIKOLA ROSE MAKES IT!
Score: 49-49

[01:39] Team_052 possession (Score: 49-49)
James Paul attempts a Midrange. Contested by Pascal Lillard (5.6 feet, MAN). James Paul misses. Rebound secured by Derrick Durant.

[01:27] Team_098 possession (Score: 49-49)
Nikola Rose drives, picks up James Paul. Help arrives from Josh Durant! Nikola Rose attempts a Layup. Contested by Josh Durant (5.1 feet, ZONE). NIKOLA ROSE MAKES IT! Assist: Blake Murray
Score: 51-49

[01:15] Team_052 possession (Score: 51-49)
James Paul attempts a 3Pt. Contested by Pascal Lillard (5.7 feet, MAN). James Paul misses. Offensive rebound by James Paul! James Paul kicks it out.

[01:01] Team_052 possession (Score: 51-49)
Josh Durant attempts a Midrange. Contested by Nikola Rose (4.5 feet, ZONE). Josh Durant misses. Rebound secured by Derrick Durant.

[00:45] Team_098 possession (Score: 51-49)
Derrick Durant attempts a Midrange. Contested by Carmelo Middleton (5.9 feet, MAN). Derrick Durant misses. Rebound secured by Carmelo Middleton.

[00:26] Team_052 possession (Score: 51-49)
James Paul attempts a Midrange. Contested by Malcolm Tatum (5.8 feet, ZONE). JAMES PAUL MAKES IT!
Score: 51-51

[00:14] Team_098 possession (Score: 51-51)
Blake Murray drives and kicks out. Pascal Lillard attempts a Midrange. Contested by James Paul (5.2 feet, MAN). Pascal Lillard misses. Rebound secured by James Paul.

[00:01] Team_052 possession (Score: 51-51)
Gary Gasol drives and kicks out. Bones Morant attempts a Midrange. Wide open! Blake Murray is 6.4 feet away. [MAN] Bones Morant misses. Rebound secured by Pascal Lillard.

================================================================================
                              2ND QUARTER COMPLETE                              
================================================================================

2ND QUARTER SCORE: Team_098 23, Team_052 35

BOX SCORE:
================================================================================

Team_098
--------------------------------------------------------------------------------
Player                MIN  PTS  REB  AST  TO      FG   FG%      3P   3P%
--------------------------------------------------------------------------------
Nikola Rose            23   12    1    0   0   5/9    55.6     0/0   0.0
Pascal Lillard         23    8    7    2   0   4/6    66.7     0/0   0.0
Malcolm Tatum          23    2    0    0   0   1/3    33.3     0/0   0.0
Derrick Durant         23    0    4    0   0   0/2     0.0     0/0   0.0
Blake Murray           23    0    0    2   0   0/2     0.0     0/0   0.0

TEAM: FG: 10/22 (45.5%), 3PT: 1/2 (50.0%), REB: 14 (6 off, 8 def), AST: 4, TO: 1
TEAM FOULS: 3


Team_052
--------------------------------------------------------------------------------
Player                MIN  PTS  REB  AST  TO      FG   FG%      3P   3P%
--------------------------------------------------------------------------------
James Paul             23   15    6    1   0   7/9    77.8     0/0   0.0
Gary Gasol             23    8    0    1   0   4/7    57.1     0/0   0.0
Josh Durant            23    6    0    2   0   2/4    50.0     0/0   0.0
Bones Morant           23    3    2    0   0   1/1   100.0     0/0   0.0
Carmelo Middleton      23    3    6    3   0   1/2    50.0     0/0   0.0

TEAM: FG: 15/23 (65.2%), 3PT: 3/5 (60.0%), REB: 12 (2 off, 10 def), AST: 7, TO: 0
TEAM FOULS: 6 [Team_098 in BONUS]

================================================================================

================================================================================
                       3RD QUARTER - Team_098 vs Team_052                       
================================================================================

[12:00] Team_098 possession (Score: 51-51)
Derrick Durant attempts a Midrange. Contested by Carmelo Middleton (4.5 feet, MAN). DERRICK DURANT MAKES IT!
Score: 53-51

[11:47] Team_052 possession (Score: 53-51)
Bones Morant attempts a 3Pt. Contested by Malcolm Tatum (4.4 feet, ZONE). BONES MORANT MAKES IT! Assist: James Paul
Score: 53-54

[11:31] Team_098 possession (Score: 53-54)
Pascal Lillard attempts a 3Pt. Contested by James Paul (4.0 feet, MAN). Pascal Lillard misses. Rebound secured by Carmelo Middleton.

[11:14] Team_052 possession (Score: 53-54)
Carmelo Middleton attempts a 3Pt. Contested by Nikola Rose (3.5 feet, ZONE). Carmelo Middleton misses. Rebound secured by Derrick Durant.

[10:59] Team_098 possession (Score: 53-54)
Blake Murray attempts a 3Pt. Contested by Bones Morant (3.8 feet, MAN). Blake Murray misses. Offensive rebound by Derrick Durant! Derrick Durant puts it back in!
Score: 55-54

[10:48] Team_052 possession (Score: 55-54)
James Paul drives to the basket... James Paul throws a bad pass out of bounds! TURNOVER! (dead ball)

[10:31] Team_098 possession (Score: 55-54)
Malcolm Tatum attempts a 3Pt. Contested by Gary Gasol (4.0 feet, MAN). MALCOLM TATUM MAKES IT! Assist: Nikola Rose
Score: 58-54

[10:17] Team_052 possession (Score: 58-54)
Bones Morant attempts a Layup. Contested by Pascal Lillard (4.5 feet, ZONE). BONES MORANT MAKES IT! Assist: Carmelo Middleton
Score: 58-56

[10:07] Team_098 possession (Score: 58-56)
Nikola Rose attempts a 3Pt. Contested by Josh Durant (3.6 feet, MAN). NIKOLA ROSE MAKES IT! Assist: Derrick Durant
Score: 61-56

[09:54] Team_052 possession (Score: 61-56)
Gary Gasol drives to the basket... Gary Gasol loses control! Ball rolls out of bounds! TURNOVER! (dead ball)

[09:44] Team_098 possession (Score: 61-56)
Nikola Rose attempts a 3Pt. Contested by Josh Durant (3.6 feet, MAN). NIKOLA ROSE MAKES IT! Assist: Derrick Durant
Score: 64-56

[09:30] Team_052 possession (Score: 64-56)
James Paul attempts a Midrange. Contested by Blake Murray (4.8 feet, ZONE). James Paul misses. Rebound secured by Derrick Durant.

[09:20] Team_098 possession (Score: 64-56)
Nikola Rose attempts a Midrange. Contested by Josh Durant (3.6 feet, MAN). NIKOLA ROSE MAKES IT!
Score: 66-56

[09:07] Team_052 possession (Score: 66-56)
Josh Durant attempts a 3Pt. Contested by Malcolm Tatum (3.8 feet, ZONE). JOSH DURANT MAKES IT!
Score: 66-59

[08:55] Team_098 possession (Score: 66-59)
FOUL! Holding foul on Bones Morant. [Team fouls: 1] No free throws, side out. (Bones Morant: 1 personal fouls)

[08:40] Team_098 possession (Score: 66-59)
Pascal Lillard attempts a 3Pt. Contested by Bones Morant (4.2 feet, ZONE). Pascal Lillard misses. Offensive rebound by Derrick Durant! Derrick Durant's putback is no good. Rebound secured by Bones Morant.

[08:25] Team_052 possession (Score: 66-59)
Bones Morant attempts a 3Pt. Contested by Nikola Rose (3.6 feet, ZONE). BONES MORANT MAKES IT! Assist: Josh Durant
Score: 66-62

[08:13] Team_098 possession (Score: 66-62)
Nikola Rose attempts a 3Pt. Contested by Bones Morant (3.9 feet, ZONE). Nikola Rose misses. Rebound secured by James Paul.

[07:58] Team_052 possession (Score: 66-62)
FOUL! Holding foul on Malcolm Tatum. [Team fouls: 1] No free throws, side out. (Malcolm Tatum: 1 personal fouls)

[07:44] Team_052 possession (Score: 66-62)
Carmelo Middleton attempts a Midrange. Contested by Derrick Durant (4.7 feet, MAN). Carmelo Middleton misses. Rebound secured by Pascal Lillard.

[07:27] Team_098 possession (Score: 66-62)
Blake Murray throws a bad pass out of bounds! TURNOVER! (dead ball)

[07:11] Team_052 possession (Score: 66-62)
Bones Morant drives and kicks out. Gary Gasol attempts a 3Pt. Contested by Nikola Rose (3.2 feet, ZONE). GARY GASOL MAKES IT! Assist: Carmelo Middleton
Score: 66-65

[06:59] Team_098 possession (Score: 66-65)
Nikola Rose drives to the basket... Nikola Rose throws a bad pass! Stolen by Josh Durant! TURNOVER! (live ball)

[06:43] Team_052 possession (Score: 66-65)
FOUL! Offensive foul on Josh Durant! Nikola Rose drew the charge! [Team fouls: 2] (Josh Durant: 1 personal fouls) TURNOVER! (dead ball)

[06:29] Team_098 possession (Score: 66-65)
Nikola Rose attempts a Layup. Contested by Josh Durant (3.6 feet, MAN). NIKOLA ROSE MAKES IT! Assist: Pascal Lillard
Score: 68-65

[06:11] Team_052 possession (Score: 68-65)
Josh Durant drives and kicks out. Carmelo Middleton attempts a 3Pt. Contested by Pascal Lillard (4.0 feet, ZONE). Carmelo Middleton misses. Rebound secured by Pascal Lillard.

[05:56] Team_098 possession (Score: 68-65)
Nikola Rose attempts a Midrange. Contested by Josh Durant (3.6 feet, MAN). NIKOLA ROSE MAKES IT!
Score: 70-65

[05:43] Team_052 possession (Score: 70-65)
James Paul attempts a 3Pt. Contested by Pascal Lillard (4.4 feet, MAN). James Paul misses. Rebound secured by Nikola Rose.

[05:33] Team_098 possession (Score: 70-65)
Blake Murray loses the ball! Stripped by Bones Morant! TURNOVER! (live ball)

[05:23] Team_052 possession (Score: 70-65)
James Paul drives, Pascal Lillard stays with him. James Paul attempts a Dunk. Contested by Pascal Lillard (4.4 feet, MAN). JAMES PAUL MAKES IT! Assist: Carmelo Middleton
Score: 70-67

[05:11] Team_098 possession (Score: 70-67)
Malcolm Tatum attempts a 3Pt. Contested by Bones Morant (3.8 feet, ZONE). Malcolm Tatum misses. Rebound secured by Carmelo Middleton.

[04:56] Team_052 possession (Score: 70-67)
FOUL! Offensive foul on Gary Gasol! Malcolm Tatum drew the charge! [Team fouls: 3] (Gary Gasol: 1 personal fouls) TURNOVER! (dead ball)

[04:40] Team_098 possession (Score: 70-67)
Pascal Lillard attempts a Midrange. Contested by Gary Gasol (4.4 feet, ZONE). Pascal Lillard misses. Rebound secured by Bones Morant.

[04:24] Team_052 possession (Score: 70-67)
James Paul attempts a Layup. Contested by Pascal Lillard (4.5 feet, MAN). JAMES PAUL MAKES IT! Assist: Gary Gasol
Score: 70-69

[04:11] Team_098 possession (Score: 70-69)
Derrick Durant attempts a Layup. Contested by James Paul (3.7 feet, ZONE). DERRICK DURANT MAKES IT! Assist: Malcolm Tatum
Score: 72-69

[03:57] Team_052 possession (Score: 72-69)
Josh Durant drives, Nikola Rose stays with him. Josh Durant attempts a Layup. Contested by Nikola Rose (3.1 feet, MAN). Josh Durant misses. FOUL! Loose ball foul on Derrick Durant during the rebound battle. [Team fouls: 2] No free throws, side out. (Derrick Durant: 1 personal fouls)

[03:43] Team_052 possession (Score: 72-69)
Josh Durant attempts a Midrange. Contested by Nikola Rose (3.1 feet, MAN). JOSH DURANT MAKES IT! Assist: James Paul
Score: 72-71

[03:28] Team_098 possession (Score: 72-71)
Derrick Durant attempts a Midrange. Contested by Carmelo Middleton (4.7 feet, MAN). DERRICK DURANT MAKES IT! Assist: Blake Murray
Score: 74-71

[03:10] Team_052 possession (Score: 74-71)
Josh Durant attempts a 3Pt. Contested by Nikola Rose (3.2 feet, MAN). Josh Durant misses. Rebound secured by Pascal Lillard.

[02:55] Team_098 possession (Score: 74-71)
Derrick Durant attempts a Midrange. Contested by James Paul (3.8 feet, ZONE). Derrick Durant misses. Rebound secured by Carmelo Middleton.

[02:43] Team_052 possession (Score: 74-71)
Josh Durant attempts a Midrange. Contested by Nikola Rose (3.2 feet, MAN). Josh Durant misses. Rebound secured by Derrick Durant.

[02:27] Team_098 possession (Score: 74-71)
FOUL! Holding foul on Bones Morant. [Team fouls: 4] No free throws, side out. (Bones Morant: 2 personal fouls)

[02:12] Team_098 possession (Score: 74-71)
Blake Murray attempts a 3Pt. Contested by Bones Morant (4.1 feet, MAN). BLAKE MURRAY MAKES IT! Assist: Derrick Durant
Score: 77-71

[02:00] Team_052 possession (Score: 77-71)
Bones Morant drives to the basket... Bones Morant throws a bad pass! Stolen by Blake Murray! TURNOVER! (live ball)

[01:44] Team_098 possession (Score: 77-71)
Blake Murray attempts a Midrange. Contested by Josh Durant (3.8 feet, ZONE). Blake Murray misses. Rebound secured by Bones Morant.

[01:29] Team_052 possession (Score: 77-71)
Josh Durant makes the 3Pt and draws the foul on Nikola Rose! And-1! Josh Durant to the line for 1. [Team fouls: 3] (Nikola Rose: 1 personal fouls)   FT 1/1: GOOD Josh Durant makes 1/1 from the line.
Score: 77-75

[01:18] Team_098 possession (Score: 77-75)
Pascal Lillard attempts a Midrange. Contested by Gary Gasol (4.7 feet, ZONE). PASCAL LILLARD MAKES IT! Assist: Derrick Durant
Score: 79-75

[01:01] Team_052 possession (Score: 79-75)
Carmelo Middleton makes the Layup and draws the foul on Derrick Durant! And-1! Carmelo Middleton to the line for 1. [Team fouls: 4] (Derrick Durant: 2 personal fouls)   FT 1/1: GOOD Carmelo Middleton makes 1/1 from the line.
Score: 79-78

[00:48] Team_098 possession (Score: 79-78)
Blake Murray makes the Layup and draws the foul on Josh Durant! And-1! Blake Murray to the line for 1. [BONUS: 5 team fouls] (Josh Durant: 2 personal fouls)   FT 1/1: GOOD Blake Murray makes 1/1 from the line.
Score: 82-78

[00:34] Team_052 possession (Score: 82-78)
Carmelo Middleton attempts a 3Pt. Contested by Derrick Durant (5.3 feet, MAN). Carmelo Middleton misses. Rebound secured by Derrick Durant.

[00:20] Team_098 possession (Score: 82-78)
Malcolm Tatum loses the ball! Stripped by Gary Gasol! TURNOVER! (live ball)

[00:09] Team_052 possession (Score: 82-78)
FOUL! Holding foul on Derrick Durant. [IN THE BONUS! 5 team fouls] Carmelo Middleton to the line for 2 free throws. (Derrick Durant: 3 personal fouls)   FT 1/2: MISS   FT 2/2: GOOD Carmelo Middleton makes 1/2 from the line.
Score: 82-79

================================================================================
                              3RD QUARTER COMPLETE                              
================================================================================

3RD QUARTER SCORE: Team_098 31, Team_052 28

BOX SCORE:
================================================================================

Team_098
--------------------------------------------------------------------------------
Player                MIN  PTS  REB  AST  TO      FG   FG%      3P   3P%
--------------------------------------------------------------------------------
Nikola Rose            35   12    1    1   0   5/6    83.3     0/0   0.0
Derrick Durant         35    8    5    4   0   4/5    80.0     0/0   0.0
Blake Murray           35    6    0    1   0   2/3    66.7     0/0   0.0
Malcolm Tatum          35    3    0    1   0   1/2    50.0     0/0   0.0
Pascal Lillard         35    2    3    1   0   1/4    25.0     0/0   0.0

TEAM: FG: 13/20 (65.0%), 3PT: 5/9 (55.6%), REB: 10 (2 off, 8 def), AST: 8, TO: 4
TEAM FOULS: 5 [Team_052 in BONUS]


Team_052
--------------------------------------------------------------------------------
Player                MIN  PTS  REB  AST  TO      FG   FG%      3P   3P%
--------------------------------------------------------------------------------
Josh Durant            35    9    0    1   0   3/6    50.0     0/0   0.0
Bones Morant           35    8    4    0   0   3/3   100.0     0/0   0.0
James Paul             35    4    1    2   0   2/4    50.0     0/0   0.0
Carmelo Middleton      35    4    3    3   0   2/5    40.0     0/0   0.0
Gary Gasol             35    3    0    1   0   1/1   100.0     0/0   0.0

TEAM: FG: 11/19 (57.9%), 3PT: 4/8 (50.0%), REB: 7 (1 off, 6 def), AST: 7, TO: 5
TEAM FOULS: 5 [Team_098 in BONUS]

================================================================================

================================================================================
                       4TH QUARTER - Team_098 vs Team_052                       
================================================================================

[12:00] Team_098 possession (Score: 82-79)
Derrick Durant drives, picks up Carmelo Middleton. Help arrives from Josh Durant! Derrick Durant attempts a Layup. Contested by Josh Durant (4.8 feet, MAN). DERRICK DURANT MAKES IT! Assist: Nikola Rose
Score: 84-79

[11:48] Team_052 possession (Score: 84-79)
James Paul attempts a 3Pt. Contested by Pascal Lillard (4.7 feet, MAN). JAMES PAUL MAKES IT! Assist: Carmelo Middleton
Score: 84-82

[11:33] Team_098 possession (Score: 84-82)
Pascal Lillard attempts a Midrange. Contested by Josh Durant (4.2 feet, ZONE). Pascal Lillard misses. Offensive rebound by Pascal Lillard! Pascal Lillard kicks it out.

[11:20] Team_098 possession (Score: 84-82)
Nikola Rose attempts a 3Pt. Contested by Josh Durant (4.0 feet, MAN). Nikola Rose misses. Rebound secured by Bones Morant.

[11:06] Team_052 possession (Score: 84-82)
James Paul attempts a Midrange. Contested by Pascal Lillard (4.8 feet, MAN). JAMES PAUL MAKES IT!
Score: 84-84

[10:50] Team_098 possession (Score: 84-84)
Malcolm Tatum attempts a Midrange. Contested by Gary Gasol (4.4 feet, MAN). Malcolm Tatum misses. Offensive rebound by Pascal Lillard! Pascal Lillard kicks it out.

[10:36] Team_098 possession (Score: 84-84)
FOUL! Shooting foul on James Paul. Nikola Rose to the line for 2 free throws. [Team fouls: 1] (James Paul: 1 personal fouls)   FT 1/2: GOOD   FT 2/2: MISS Nikola Rose makes 1/2 from the line. Offensive rebound by Pascal Lillard! Pascal Lillard kicks it out.
Score: 85-84

[10:22] Team_098 possession (Score: 85-84)
Malcolm Tatum attempts a Midrange. Contested by Gary Gasol (4.5 feet, MAN). Malcolm Tatum misses. Rebound secured by Bones Morant.

[10:06] Team_052 possession (Score: 85-84)
James Paul attempts a 3Pt. Contested by Pascal Lillard (4.9 feet, MAN). James Paul misses. Rebound secured by Nikola Rose.

[09:54] Team_098 possession (Score: 85-84)
Blake Murray drives and kicks out. Blake Murray attempts a 3Pt. Contested by Bones Morant (4.2 feet, ZONE). Blake Murray misses. FOUL! Loose ball foul on James Paul during the rebound battle. [Team fouls: 2] No free throws, side out. (James Paul: 2 personal fouls)

[09:38] Team_098 possession (Score: 85-84)
FOUL! Shooting foul on James Paul. Pascal Lillard to the line for 2 free throws. [Team fouls: 3] (James Paul: 3 personal fouls)   FT 1/2: MISS   FT 2/2: GOOD Pascal Lillard makes 1/2 from the line.
Score: 86-84

[09:20] Team_052 possession (Score: 86-84)
James Paul drives to the basket... FOUL! Offensive foul on James Paul! Pascal Lillard drew the charge! [Team fouls: 4] (James Paul: 4 personal fouls) TURNOVER! (dead ball)

[09:09] Team_098 possession (Score: 86-84)
Nikola Rose makes the Dunk and draws the foul on Josh Durant! And-1! Nikola Rose to the line for 1. [BONUS: 5 team fouls] (Josh Durant: 1 personal fouls)   FT 1/1: GOOD Nikola Rose makes 1/1 from the line.
Score: 89-84

[08:51] Team_052 possession (Score: 89-84)
Gary Gasol drives and kicks out. Josh Durant attempts a 3Pt. Contested by Nikola Rose (4.0 feet, MAN). Josh Durant misses. Offensive rebound by Bones Morant! Bones Morant kicks it out.

[08:39] Team_052 possession (Score: 89-84)
Gary Gasol attempts a Layup. Contested by Pascal Lillard (5.2 feet, ZONE). Gary Gasol misses. Rebound secured by Derrick Durant.

[08:20] Team_098 possession (Score: 89-84)
Malcolm Tatum attempts a 3Pt. Contested by Gary Gasol (4.7 feet, ZONE). Malcolm Tatum misses. Rebound secured by James Paul.

[08:07] Team_052 possession (Score: 89-84)
Gary Gasol drives, Malcolm Tatum stays with him. Gary Gasol attempts a Dunk. Contested by Malcolm Tatum (5.2 feet, MAN). GARY GASOL MAKES IT! Assist: Carmelo Middleton
Score: 89-86

[07:52] Team_098 possession (Score: 89-86)
Derrick Durant commits a violation (traveling/carry)! TURNOVER! (dead ball)

[07:52] Substitution (Team_098): Malcolm Tatum OUT → Tracy Rose IN (stamina_rule2)

[07:52] Substitution (Team_098): Nikola Rose OUT → Dirk McCollum IN (stamina_rule2)

[07:52] Substitution (Team_098): Blake Murray OUT → Kristaps Iverson IN (stamina_rule2)

[07:52] Substitution (Team_098): Pascal Lillard OUT → Manu Jordan IN (stamina_rule2)

[07:52] Substitution (Team_098): Derrick Durant OUT → Russell McGrady IN (stamina_rule2)

[07:52] Substitution (Team_052): Gary Gasol OUT → Jimmy Doncic IN (stamina_rule2)

[07:52] Substitution (Team_052): Josh Durant OUT → Carmelo Giddey IN (stamina_rule2)

[07:52] Substitution (Team_052): Bones Morant OUT → Donovan Stewart IN (stamina_rule2)

[07:52] Substitution (Team_052): James Paul OUT → Jalen Haliburton IN (stamina_rule2)

[07:52] Substitution (Team_052): Carmelo Middleton OUT → Carmelo Beal IN (stamina_rule2)

[07:36] Team_052 possession (Score: 89-86)
Carmelo Beal attempts a 3Pt. Contested by Russell McGrady (3.6 feet, MAN). Carmelo Beal misses. Offensive rebound by Carmelo Beal! Carmelo Beal kicks it out.

[07:24] Team_052 possession (Score: 89-86)
Carmelo Beal attempts a 3Pt. Contested by Dirk McCollum (4.0 feet, ZONE). Carmelo Beal misses. Rebound secured by Kristaps Iverson.

[07:13] Team_098 possession (Score: 89-86)
Dirk McCollum attempts a 3Pt. Contested by Jalen Haliburton (4.6 feet, ZONE). Dirk McCollum misses. Offensive rebound by Russell McGrady! Russell McGrady puts it back in!
Score: 91-86

[06:57] Team_052 possession (Score: 91-86)
FOUL! Shooting foul on Russell McGrady. Carmelo Beal to the line for 2 free throws. [Team fouls: 1] (Russell McGrady: 1 personal fouls)   FT 1/2: GOOD   FT 2/2: GOOD Carmelo Beal makes 2/2 from the line.
Score: 91-88

[06:40] Team_098 possession (Score: 91-88)
FOUL! Reach-in foul on Carmelo Beal during the drive. [IN THE BONUS! 6 team fouls] Russell McGrady to the line for 2 free throws. (Carmelo Beal: 1 personal fouls)   FT 1/2: GOOD   FT 2/2: GOOD Russell McGrady makes 2/2 from the line.
Score: 93-88

[06:23] Team_052 possession (Score: 93-88)
Carmelo Giddey drives and kicks out. Donovan Stewart attempts a Midrange. Contested by Manu Jordan (4.7 feet, ZONE). Donovan Stewart misses. Rebound secured by Kristaps Iverson.

[06:10] Team_098 possession (Score: 93-88)
Manu Jordan loses the ball! Stripped by Jalen Haliburton! TURNOVER! (live ball)

[05:54] Team_052 possession (Score: 93-88)
Donovan Stewart throws a bad pass! Stolen by Kristaps Iverson! TURNOVER! (live ball)

[05:38] Team_098 possession (Score: 93-88)
Kristaps Iverson attempts a 3Pt. Contested by Donovan Stewart (4.9 feet, MAN). KRISTAPS IVERSON MAKES IT! Assist: Tracy Rose
Score: 96-88

[05:22] Team_052 possession (Score: 96-88)
FOUL! Holding foul on Tracy Rose. [Team fouls: 2] No free throws, side out. (Tracy Rose: 1 personal fouls)

[05:06] Team_052 possession (Score: 96-88)
Jalen Haliburton drives, picks up Manu Jordan. Help arrives from Dirk McCollum! Jalen Haliburton attempts a Layup. Contested by Dirk McCollum (4.9 feet, MAN). Jalen Haliburton misses. Rebound secured by Russell McGrady.

[04:56] Team_098 possession (Score: 96-88)
Kristaps Iverson attempts a 3Pt. Contested by Donovan Stewart (4.9 feet, MAN). KRISTAPS IVERSON MAKES IT! Assist: Tracy Rose
Score: 99-88

[04:40] Team_052 possession (Score: 99-88)
Carmelo Beal attempts a Midrange. Contested by Manu Jordan (4.5 feet, ZONE). Carmelo Beal misses. Offensive rebound by Jalen Haliburton! Jalen Haliburton kicks it out.

[04:26] Team_052 possession (Score: 99-88)
Carmelo Beal drives and kicks out. Jalen Haliburton attempts a 3Pt. Contested by Manu Jordan (4.7 feet, MAN). JALEN HALIBURTON MAKES IT! Assist: Donovan Stewart
Score: 99-91

[04:12] Team_098 possession (Score: 99-91)
Tracy Rose attempts a Layup. Contested by Jalen Haliburton (4.6 feet, ZONE). TRACY ROSE MAKES IT!
Score: 101-91

[03:59] Team_052 possession (Score: 101-91)
FOUL! Shooting foul on Kristaps Iverson. Donovan Stewart to the line for 2 free throws. [Team fouls: 3] (Kristaps Iverson: 1 personal fouls)   FT 1/2: GOOD   FT 2/2: GOOD Donovan Stewart makes 2/2 from the line.
Score: 101-93

[03:41] Team_098 possession (Score: 101-93)
Manu Jordan drives, Jalen Haliburton stays with him. Manu Jordan attempts a Layup. Contested by Jalen Haliburton (4.8 feet, MAN). MANU JORDAN MAKES IT! Assist: Russell McGrady
Score: 103-93

[03:25] Team_052 possession (Score: 103-93)
Carmelo Giddey drives to the basket... Carmelo Giddey loses control! Ball rolls out of bounds! TURNOVER! (dead ball)

[03:14] Team_098 possession (Score: 103-93)
FOUL! Holding foul on Donovan Stewart. [IN THE BONUS! 7 team fouls] Kristaps Iverson to the line for 2 free throws. (Donovan Stewart: 1 personal fouls)   FT 1/2: GOOD   FT 2/2: GOOD Kristaps Iverson makes 2/2 from the line.
Score: 105-93

[02:57] Team_052 possession (Score: 105-93)
Jimmy Doncic attempts a Layup. BLOCKED BY TRACY ROSE! Ball is loose! Rebound secured by Russell McGrady.

[02:40] Team_098 possession (Score: 105-93)
FOUL! Shooting foul on Donovan Stewart. Kristaps Iverson to the line for 2 free throws. [BONUS: 8 team fouls] (Donovan Stewart: 2 personal fouls)   FT 1/2: MISS   FT 2/2: GOOD Kristaps Iverson makes 1/2 from the line.
Score: 106-93

[02:23] Team_052 possession (Score: 106-93)
Carmelo Giddey attempts a 3Pt. Contested by Dirk McCollum (4.8 feet, MAN). Carmelo Giddey misses. Rebound secured by Russell McGrady.

[02:08] Team_098 possession (Score: 106-93)
Manu Jordan drives, Jalen Haliburton stays with him. Manu Jordan attempts a Layup. Contested by Jalen Haliburton (4.8 feet, MAN). Manu Jordan misses. Rebound secured by Jalen Haliburton.

[01:58] Team_052 possession (Score: 106-93)
Carmelo Giddey attempts a Layup. Contested by Dirk McCollum (4.8 feet, MAN). CARMELO GIDDEY MAKES IT! Assist: Jimmy Doncic
Score: 106-95

[01:40] Team_098 possession (Score: 106-95)
Russell McGrady attempts a 3Pt. Contested by Carmelo Beal (3.4 feet, MAN). Russell McGrady misses. Rebound secured by Jalen Haliburton.

[01:29] Team_052 possession (Score: 106-95)
Jalen Haliburton drives and kicks out. Jimmy Doncic attempts a 3Pt. Contested by Dirk McCollum (4.2 feet, ZONE). JIMMY DONCIC MAKES IT! Assist: Donovan Stewart
Score: 106-98

[01:16] Team_098 possession (Score: 106-98)
Tracy Rose attempts a 3Pt. Contested by Jimmy Doncic (4.8 feet, MAN). Tracy Rose misses. Rebound secured by Jalen Haliburton.

[01:01] Team_052 possession (Score: 106-98)
Jimmy Doncic attempts a 3Pt. Contested by Dirk McCollum (4.0 feet, ZONE). JIMMY DONCIC MAKES IT! Assist: Carmelo Beal
Score: 106-101

[00:50] Team_098 possession (Score: 106-101)
Manu Jordan attempts a Layup. Contested by Carmelo Beal (3.8 feet, ZONE). MANU JORDAN MAKES IT!
Score: 108-101

[00:37] Team_052 possession (Score: 108-101)
FOUL! Holding foul on Tracy Rose. [Team fouls: 4] No free throws, side out. (Tracy Rose: 2 personal fouls)

[00:25] Team_052 possession (Score: 108-101)
FOUL! Reach-in foul on Dirk McCollum during the drive. [IN THE BONUS! 5 team fouls] Carmelo Giddey to the line for 2 free throws. (Dirk McCollum: 1 personal fouls)   FT 1/2: GOOD   FT 2/2: GOOD Carmelo Giddey makes 2/2 from the line.
Score: 108-103

[00:11] Team_098 possession (Score: 108-103)
Tracy Rose attempts a Layup. Contested by Jimmy Doncic (4.8 feet, MAN). TRACY ROSE MAKES IT! Assist: Dirk McCollum
Score: 110-103

================================================================================
                              4TH QUARTER COMPLETE                              
================================================================================

4TH QUARTER SCORE: Team_098 28, Team_052 24

BOX SCORE:
================================================================================

Team_098
--------------------------------------------------------------------------------
Player                MIN  PTS  REB  AST  TO      FG   FG%      3P   3P%
--------------------------------------------------------------------------------
Kristaps Iverson        9    9    2    0   0   4/4   100.0     0/0   0.0
Russell McGrady         9    4    4    1   0   2/3    66.7     0/0   0.0
Tracy Rose              9    4    0    2   0   2/3    66.7     0/0   0.0
Manu Jordan             9    4    0    0   0   2/3    66.7     0/0   0.0
Nikola Rose            39    3    1    1   0   1/2    50.0     0/0   0.0
Derrick Durant         39    2    2    0   0   1/1   100.0     0/0   0.0
Pascal Lillard         39    1    3    0   0   1/1   100.0     0/0   0.0
Malcolm Tatum          39    0    0    0   0   0/2     0.0     0/0   0.0
Dirk McCollum           9    0    0    1   0   0/0     0.0     0/0   0.0

TEAM: FG: 13/19 (68.4%), 3PT: 3/7 (42.9%), REB: 12 (5 off, 7 def), AST: 5, TO: 2
TEAM FOULS: 5 [Team_052 in BONUS]


Team_052
--------------------------------------------------------------------------------
Player                MIN  PTS  REB  AST  TO      FG   FG%      3P   3P%
--------------------------------------------------------------------------------
Jimmy Doncic            9    6    0    1   0   2/3    66.7     0/0   0.0
James Paul             39    5    1    0   0   2/3    66.7     0/0   0.0
Carmelo Giddey          9    4    0    0   0   2/4    50.0     0/0   0.0
Jalen Haliburton        9    3    4    0   0   1/2    50.0     0/0   0.0
Gary Gasol             39    2    0    0   0   1/2    50.0     0/0   0.0
Carmelo Beal            9    2    1    1   0   1/2    50.0     0/0   0.0
Donovan Stewart         9    2    0    2   0   1/1   100.0     0/0   0.0
Carmelo Middleton      39    0    0    2   0   0/0     0.0     0/0   0.0
Bones Morant           39    0    3    0   0   0/0     0.0     0/0   0.0

TEAM: FG: 10/17 (58.8%), 3PT: 2/5 (40.0%), REB: 9 (3 off, 6 def), AST: 6, TO: 3
TEAM FOULS: 8 [Team_098 in BONUS]

================================================================================

================================================================================
                               FULL GAME COMPLETE                               
================================================================================

FINAL SCORE: Team_098 110, Team_052 103

SCORING BY QUARTER:
--------------------------------------------------------------------------------
Team                     Q1     Q2     Q3     Q4    FINAL
--------------------------------------------------------------------------------
Team_098                 28     23     31     28      110
Team_052                 16     35     28     24      103
--------------------------------------------------------------------------------

FULL GAME BOX SCORE:
================================================================================

Team_098
--------------------------------------------------------------------------------
Player                MIN  PTS  REB  AST  TO      FG   FG%      3P   3P%      FT STL BLK
--------------------------------------------------------------------------------
Malcolm Tatum          39   15    0    2   1   6/13   46.2   3/7    42.9   5/6     1   0
Nikola Rose            39   35    7    3   1  15/23   65.2   2/6    33.3   7/10    0   0
Blake Murray           39    6    0    3   3   4/7    57.1   3/3   100.0   1/1     1   0
Pascal Lillard         39   15   14    3   0   6/13   46.2   0/2     0.0   3/4     1   1
Derrick Durant         39   12   14    5   2   5/10   50.0   0/1     0.0   0/0     1   0
Tracy Rose              9    4    0    2   0   2/4    50.0   0/1     0.0   0/0     0   1
Dirk McCollum           9    0    0    1   0   1/2    50.0   1/1   100.0   0/0     0   0
Kristaps Iverson        9    9    3    0   0   3/3   100.0   2/2   100.0   3/4     1   0
Manu Jordan             9    4    0    0   1   2/4    50.0   0/0     0.0   1/2     0   0
Russell McGrady         9    4    5    1   0   1/2    50.0   0/1     0.0   2/2     0   0

TEAM: FG: 46/82 (56.1%), 3PT: 11/24 (45.8%), REB: 47 (15 off, 32 def), AST: 20, TO: 8


Team_052
--------------------------------------------------------------------------------
Player                MIN  PTS  REB  AST  TO      FG   FG%      3P   3P%      FT STL BLK
--------------------------------------------------------------------------------
Gary Gasol             39   15    0    2   4   7/13   53.8   1/4    25.0   2/2     1   0
Josh Durant            39   15    0    3   1   6/14   42.9   5/8    62.5   1/1     1   1
Bones Morant           39   11   11    1   0   5/6    83.3   3/4    75.0   0/0     1   0
James Paul             39   32   13    3   5  12/17   70.6   1/3    33.3   1/1     0   1
Carmelo Middleton      39    8   13    9   1   4/9    44.4   0/2     0.0   4/6     0   0
Jimmy Doncic            9    8    0    2   0   2/4    50.0   1/1   100.0   0/0     0   0
Carmelo Giddey          9    7    0    0   0   3/6    50.0   1/3    33.3   2/2     0   0
Donovan Stewart         9    2    1    2   1   1/1   100.0   0/0     0.0   2/2     0   0
Jalen Haliburton        9    3    5    0   0   1/2    50.0   0/0     0.0   0/0     1   0
Carmelo Beal            9    2    2    2   1   2/3    66.7   0/1     0.0   2/2     0   0

TEAM: FG: 44/76 (57.9%), 3PT: 12/26 (46.2%), REB: 41 (9 off, 32 def), AST: 24, TO: 13

================================================================================
