================================================================================
                        FULL GAME - Team_010 vs Team_005                        
================================================================================

================================================================================
                       1ST QUARTER - Team_010 vs Team_005                       
================================================================================

[12:00] Team_010 possession (Score: 0-0)
Michael Turner attempts a 3Pt. Contested by Derrick Allen (4.5 feet, ZONE). Michael Turner misses. Rebound secured by Cade Markkanen.

[11:45] Team_005 possession (Score: 0-0)
Brandon George attempts a Midrange. Contested by RJ Young (4.9 feet, ZONE). Brandon George misses. Rebound secured by Desmond Antetokounmpo.

[11:30] Team_010 possession (Score: 0-0)
RJ Young attempts a Midrange. Contested by Anthony Rozier (4.4 feet, ZONE). RJ YOUNG MAKES IT! Assist: Michael Turner
Score: 2-0

[11:14] Team_005 possession (Score: 2-0)
Brandon George drives, picks up Anthony Durant. Help arrives from Cade Morant! Brandon George attempts a Dunk. Contested by Cade Morant (3.7 feet, ZONE). BRANDON GEORGE MAKES IT! Assist: Jalen Rozier
Score: 2-2

[10:58] Team_010 possession (Score: 2-2)
Desmond Antetokounmpo attempts a 3Pt. Contested by Cade Markkanen (3.4 feet, MAN). Desmond Antetokounmpo misses. Rebound secured by Jalen Rozier.

[10:38] Team_005 possession (Score: 2-2)
Cade Markkanen attempts a Dunk. BLOCKED BY ANTHONY DURANT! Ball deflects out of bounds off Cade Markkanen.

[10:22] Team_010 possession (Score: 2-2)
Anthony Durant attempts a Layup. Contested by Cade Markkanen (3.6 feet, ZONE). ANTHONY DURANT MAKES IT! Assist: Michael Turner
Score: 4-2

[10:12] Team_005 possession (Score: 4-2)
Derrick Allen attempts a 3Pt. Contested by Cade Morant (4.3 feet, ZONE). Derrick Allen misses. FOUL! Loose ball foul on Anthony Durant during the rebound battle. [Team fouls: 1] No free throws, side out. (Anthony Durant: 1 personal fouls)

[09:58] Team_005 possession (Score: 4-2)
Cade Markkanen loses the ball! Stripped by Anthony Durant! TURNOVER! (live ball)

[09:45] Team_010 possession (Score: 4-2)
Desmond Antetokounmpo attempts a 3Pt. Contested by Cade Markkanen (3.4 feet, MAN). Desmond Antetokounmpo misses. Rebound secured by Cade Markkanen.

[09:30] Team_005 possession (Score: 4-2)
Brandon George attempts a 3Pt. Contested by Cade Morant (4.1 feet, MAN). Brandon George misses. Offensive rebound by Jalen Rozier! Jalen Rozier kicks it out.

[09:12] Team_005 possession (Score: 4-2)
Jalen Rozier drives to the basket... Jalen Rozier throws a bad pass out of bounds! TURNOVER! (dead ball)

[08:59] Team_010 possession (Score: 4-2)
RJ Young attempts a Layup. Contested by Derrick Allen (4.1 feet, MAN). RJ YOUNG MAKES IT! Assist: Michael Turner
Score: 6-2

[08:40] Team_005 possession (Score: 6-2)
Anthony Rozier attempts a Midrange. Contested by Desmond Antetokounmpo (4.3 feet, ZONE). Anthony Rozier misses. Rebound secured by Anthony Durant.

[08:30] Team_010 possession (Score: 6-2)
FOUL! Offensive foul on Anthony Durant! Cade Markkanen drew the charge! [Team fouls: 2] (Anthony Durant: 2 personal fouls) TURNOVER! (dead ball)

[08:15] Team_005 possession (Score: 6-2)
Brandon George attempts a 3Pt. Contested by Cade Morant (4.1 feet, MAN). Brandon George misses. Rebound secured by Desmond Antetokounmpo.

[08:00] Team_010 possession (Score: 6-2)
FOUL! Reach-in foul on Cade Markkanen during the drive. [Team fouls: 1] No free throws, side out. (Cade Markkanen: 1 personal fouls)

[07:42] Team_010 possession (Score: 6-2)
Cade Morant attempts a 3Pt. Contested by Brandon George (5.7 feet, MAN). Cade Morant misses. Offensive rebound by Anthony Durant! Anthony Durant kicks it out.

[07:25] Team_010 possession (Score: 6-2)
Desmond Antetokounmpo attempts a 3Pt. Contested by Derrick Allen (4.4 feet, ZONE). DESMOND ANTETOKOUNMPO MAKES IT! Assist: Cade Morant
Score: 9-2

[07:10] Team_005 possession (Score: 9-2)
Brandon George attempts a 3Pt. Contested by Cade Morant (4.1 feet, ZONE). Brandon George misses. Rebound secured by Anthony Durant.

[06:54] Team_010 possession (Score: 9-2)
Anthony Durant attempts a Layup. Contested by Cade Markkanen (3.6 feet, MAN). ANTHONY DURANT MAKES IT! Assist: Cade Morant
Score: 11-2

[06:36] Team_005 possession (Score: 11-2)
Cade Markkanen drives, picks up Desmond Antetokounmpo. Help arrives from Cade Morant! Cade Markkanen attempts a Dunk. Contested by Cade Morant (4.1 feet, ZONE). CADE MARKKANEN MAKES IT!
Score: 11-4

[06:23] Team_010 possession (Score: 11-4)
Michael Turner attempts a 3Pt. Contested by Derrick Allen (4.5 feet, ZONE). MICHAEL TURNER MAKES IT!
Score: 14-4

[06:09] Team_005 possession (Score: 14-4)
FOUL! Holding foul on Desmond Antetokounmpo. [Team fouls: 3] No free throws, side out. (Desmond Antetokounmpo: 1 personal fouls)

[05:57] Team_005 possession (Score: 14-4)
Jalen Rozier commits a violation (traveling/carry)! TURNOVER! (dead ball)

[05:41] Team_010 possession (Score: 14-4)
FOUL! Reach-in foul on Cade Markkanen during the drive. [Team fouls: 2] No free throws, side out. (Cade Markkanen: 2 personal fouls)

[05:25] Team_010 possession (Score: 14-4)
FOUL! Shooting foul on Cade Markkanen. Cade Morant to the line for 2 free throws. [Team fouls: 3] (Cade Markkanen: 3 personal fouls)   FT 1/2: GOOD   FT 2/2: GOOD Cade Morant makes 2/2 from the line.
Score: 16-4

[05:13] Team_005 possession (Score: 16-4)
Derrick Allen attempts a 3Pt. Contested by Cade Morant (4.3 feet, ZONE). Derrick Allen misses. Offensive rebound by Jalen Rozier! Jalen Rozier kicks it out.

[04:58] Team_005 possession (Score: 16-4)
FOUL! Reach-in foul on Anthony Durant during the drive. [Team fouls: 4] No free throws, side out. (Anthony Durant: 3 personal fouls)

[04:47] Team_005 possession (Score: 16-4)
Anthony Rozier attempts a Layup. BLOCKED BY MICHAEL TURNER! Ball is loose! Rebound secured by Michael Turner.

[04:33] Team_010 possession (Score: 16-4)
Cade Morant drives, Brandon George stays with him. Cade Morant attempts a Layup. Contested by Brandon George (5.7 feet, MAN). CADE MORANT MAKES IT! Assist: Michael Turner
Score: 18-4

[04:21] Team_005 possession (Score: 18-4)
Cade Markkanen attempts a Midrange. Contested by Michael Turner (3.9 feet, ZONE). Cade Markkanen misses. Rebound secured by Cade Morant.

[04:04] Team_010 possession (Score: 18-4)
Cade Morant drives and kicks out. Anthony Durant attempts a Midrange. Contested by Cade Markkanen (3.4 feet, MAN). ANTHONY DURANT MAKES IT!
Score: 20-4

[03:47] Team_005 possession (Score: 20-4)
Cade Markkanen makes the Dunk and draws the foul on Anthony Durant! And-1! Cade Markkanen to the line for 1. [BONUS: 5 team fouls] (Anthony Durant: 4 personal fouls)   FT 1/1: GOOD Cade Markkanen makes 1/1 from the line.
Score: 20-7

[03:32] Team_010 possession (Score: 20-7)
Desmond Antetokounmpo attempts a Midrange. Contested by Jalen Rozier (5.2 feet, ZONE). Desmond Antetokounmpo misses. Rebound secured by Derrick Allen.

[03:17] Team_005 possession (Score: 20-7)
Cade Markkanen makes the Layup and draws the foul on Anthony Durant! And-1! Cade Markkanen to the line for 1. [BONUS: 6 team fouls] (Anthony Durant: 5 personal fouls)   FT 1/1: GOOD Cade Markkanen makes 1/1 from the line.
Score: 20-10

[03:02] Team_010 possession (Score: 20-10)
Michael Turner attempts a 3Pt. Contested by Anthony Rozier (5.1 feet, MAN). Michael Turner misses. Rebound secured by Jalen Rozier.

[02:51] Team_005 possession (Score: 20-10)
Jalen Rozier drives to the basket... Jalen Rozier throws a bad pass! Stolen by Anthony Durant! TURNOVER! (live ball)

[02:36] Team_010 possession (Score: 20-10)
Desmond Antetokounmpo drives, Jalen Rozier stays with him. Desmond Antetokounmpo attempts a Layup. Contested by Jalen Rozier (5.3 feet, MAN). DESMOND ANTETOKOUNMPO MAKES IT!
Score: 22-10

[02:26] Team_005 possession (Score: 22-10)
Brandon George drives, Cade Morant stays with him. Brandon George attempts a Layup. Contested by Cade Morant (4.3 feet, MAN). BRANDON GEORGE MAKES IT!
Score: 22-12

[02:10] Team_010 possession (Score: 22-12)
Desmond Antetokounmpo drives, Jalen Rozier stays with him. Desmond Antetokounmpo attempts a Dunk. Contested by Jalen Rozier (5.3 feet, MAN). Desmond Antetokounmpo misses. Rebound secured by Cade Markkanen.

[01:56] Team_005 possession (Score: 22-12)
Derrick Allen attempts a 3Pt. Contested by RJ Young (5.4 feet, MAN). DERRICK ALLEN MAKES IT! Assist: Cade Markkanen
Score: 22-15

[01:39] Team_010 possession (Score: 22-15)
Desmond Antetokounmpo attempts a 3Pt. Contested by Derrick Allen (4.7 feet, ZONE). DESMOND ANTETOKOUNMPO MAKES IT! Assist: Michael Turner
Score: 25-15

[01:24] Team_005 possession (Score: 25-15)
FOUL! Holding foul on Anthony Durant. [IN THE BONUS! 7 team fouls] Cade Markkanen to the line for 2 free throws. (Anthony Durant: 6 personal fouls) Anthony Durant FOULS OUT!   FT 1/2: MISS   FT 2/2: GOOD Cade Markkanen makes 1/2 from the line.
Score: 25-16

[01:24] Substitution (Team_010): Anthony Durant OUT (stamina: 67) → Draymond Leonard IN (foul_out)

[01:06] Team_010 possession (Score: 25-16)
Draymond Leonard attempts a 3Pt. Contested by Brandon George (6.0 feet, MAN). Draymond Leonard misses. FOUL! Loose ball foul on Derrick Allen during the rebound battle. [Team fouls: 4] No free throws, side out. (Derrick Allen: 1 personal fouls)

[00:51] Team_010 possession (Score: 25-16)
FOUL! Shooting foul on Anthony Rozier. Michael Turner to the line for 2 free throws. [BONUS: 5 team fouls] (Anthony Rozier: 1 personal fouls)   FT 1/2: GOOD   FT 2/2: GOOD Michael Turner makes 2/2 from the line.
Score: 27-16

[00:36] Team_005 possession (Score: 27-16)
Jalen Rozier attempts a Layup. Contested by Desmond Antetokounmpo (5.0 feet, MAN). JALEN ROZIER MAKES IT! Assist: Anthony Rozier
Score: 27-18

[00:26] Team_010 possession (Score: 27-18)
Michael Turner attempts a Midrange. Contested by Anthony Rozier (5.4 feet, MAN). Michael Turner misses. Offensive rebound by Cade Morant! Cade Morant kicks it out.

[00:13] Team_010 possession (Score: 27-18)
RJ Young drives, Derrick Allen stays with him. RJ Young attempts a Layup. Contested by Derrick Allen (4.5 feet, MAN). RJ Young misses. Rebound secured by Derrick Allen.

================================================================================
                              1ST QUARTER COMPLETE                              
================================================================================

1ST QUARTER SCORE: Team_010 27, Team_005 18

BOX SCORE:
================================================================================

Team_010
--------------------------------------------------------------------------------
Player                MIN  PTS  REB  AST  TO      FG   FG%      3P   3P%
--------------------------------------------------------------------------------
Desmond Antetokounmpo   12    8    2    0   0   3/7    42.9     0/0   0.0
Anthony Durant         11    6    3    0   0   3/3   100.0     0/0   0.0
Michael Turner         12    5    1    5   0   2/4    50.0     0/0   0.0
RJ Young               12    4    0    0   0   2/3    66.7     0/0   0.0
Cade Morant            12    4    3    2   0   2/2   100.0     0/0   0.0

TEAM: FG: 12/19 (63.2%), 3PT: 3/7 (42.9%), REB: 9 (3 off, 6 def), AST: 7, TO: 1
TEAM FOULS: 7 [Team_005 in BONUS]


Team_005
--------------------------------------------------------------------------------
Player                MIN  PTS  REB  AST  TO      FG   FG%      3P   3P%
--------------------------------------------------------------------------------
Cade Markkanen         12    9    4    1   0   4/6    66.7     0/0   0.0
Brandon George         12    4    0    0   0   2/5    40.0     0/0   0.0
Derrick Allen          12    3    2    0   0   1/1   100.0     0/0   0.0
Jalen Rozier           12    2    4    1   0   1/1   100.0     0/0   0.0
Anthony Rozier         12    0    0    1   0   0/2     0.0     0/0   0.0

TEAM: FG: 8/15 (53.3%), 3PT: 1/3 (33.3%), REB: 10 (3 off, 7 def), AST: 3, TO: 4
TEAM FOULS: 5 [Team_010 in BONUS]

================================================================================

================================================================================
                       2ND QUARTER - Team_010 vs Team_005                       
================================================================================

[12:00] Team_010 possession (Score: 27-18)
Cade Morant attempts a 3Pt. Contested by Brandon George (6.0 feet, MAN). CADE MORANT MAKES IT! Assist: Michael Turner
Score: 30-18

[11:45] Team_005 possession (Score: 30-18)
Jalen Rozier attempts a 3Pt. Contested by Anthony Durant (3.9 feet, MAN). JALEN ROZIER MAKES IT! Assist: Cade Markkanen
Score: 30-21

[11:32] Team_010 possession (Score: 30-21)
Desmond Antetokounmpo attempts a Layup. Contested by Cade Markkanen (3.9 feet, ZONE). DESMOND ANTETOKOUNMPO MAKES IT! Assist: Anthony Durant
Score: 32-21

[11:23] Team_005 possession (Score: 32-21)
Derrick Allen attempts a 3Pt. Contested by Cade Morant (4.7 feet, ZONE). Derrick Allen misses. Rebound secured by Michael Turner.

[11:08] Team_010 possession (Score: 32-21)
Michael Turner attempts a 3Pt. Contested by Derrick Allen (4.8 feet, ZONE). MICHAEL TURNER MAKES IT! Assist: Cade Morant
Score: 35-21

[10:52] Team_005 possession (Score: 35-21)
Derrick Allen attempts a 3Pt. Contested by RJ Young (5.5 feet, ZONE). Derrick Allen misses. Rebound secured by Cade Morant.

[10:40] Team_010 possession (Score: 35-21)
Cade Morant attempts a 3Pt. Wide open! Brandon George is 6.1 feet away. [MAN] Cade Morant misses. Rebound secured by Derrick Allen.

[10:26] Team_005 possession (Score: 35-21)
Derrick Allen attempts a 3Pt. Contested by RJ Young (5.5 feet, MAN). DERRICK ALLEN MAKES IT! Assist: Brandon George
Score: 35-24

[10:07] Team_010 possession (Score: 35-24)
Michael Turner attempts a Layup. Contested by Anthony Rozier (5.4 feet, MAN). Michael Turner misses. Rebound secured by Jalen Rozier.

[09:54] Team_005 possession (Score: 35-24)
Brandon George attempts a 3Pt. Contested by Cade Morant (4.6 feet, MAN). BRANDON GEORGE MAKES IT! Assist: Derrick Allen
Score: 35-27

[09:40] Team_010 possession (Score: 35-27)
Desmond Antetokounmpo attempts a 3Pt. Contested by Jalen Rozier (5.6 feet, MAN). Desmond Antetokounmpo misses. Rebound secured by Derrick Allen.

[09:25] Team_005 possession (Score: 35-27)
Anthony Rozier makes the Dunk and draws the foul on Michael Turner! And-1! Anthony Rozier to the line for 1. [Team fouls: 1] (Michael Turner: 1 personal fouls)   FT 1/1: MISS Anthony Rozier makes 0/1 from the line. Rebound secured by Anthony Durant.
Score: 35-29

[09:10] Team_010 possession (Score: 35-29)
Desmond Antetokounmpo drives, picks up Cade Markkanen. Help arrives from Anthony Rozier! Desmond Antetokounmpo attempts a Dunk. Contested by Anthony Rozier (4.3 feet, ZONE). DESMOND ANTETOKOUNMPO MAKES IT!
Score: 37-29

[08:55] Team_005 possession (Score: 37-29)
Anthony Rozier drives, picks up Michael Turner. Help arrives from Cade Morant! Anthony Rozier attempts a Layup. Contested by Cade Morant (4.6 feet, MAN). Anthony Rozier misses. Rebound secured by Anthony Durant.

[08:44] Team_010 possession (Score: 37-29)
Anthony Durant attempts a Midrange. Contested by Cade Markkanen (4.6 feet, MAN). ANTHONY DURANT MAKES IT! Assist: RJ Young
Score: 39-29

[08:27] Team_005 possession (Score: 39-29)
Brandon George drives to the basket... Brandon George loses control! Ball rolls out of bounds! TURNOVER! (dead ball)

[08:27] Substitution (Team_010): Cade Morant OUT → Draymond Leonard IN (stamina_rule2)

[08:27] Substitution (Team_010): Michael Turner OUT → Blake Harden IN (stamina_rule2)

[08:27] Substitution (Team_010): RJ Young OUT → Ben Gilgeous-Alexander IN (stamina_rule2)

[08:27] Substitution (Team_010): Desmond Antetokounmpo OUT → Vince Ingram IN (stamina_rule2)

[08:27] Substitution (Team_010): Anthony Durant OUT → Paolo Wade IN (stamina_rule2)

[08:27] Substitution (Team_005): Brandon George OUT → Blake O'Neal IN (stamina_rule2)

[08:27] Substitution (Team_005): Anthony Rozier OUT → Draymond Smith IN (stamina_rule2)

[08:27] Substitution (Team_005): Derrick Allen OUT → Lauri Wade IN (stamina_rule2)

[08:27] Substitution (Team_005): Jalen Rozier OUT → Isaiah Durant IN (stamina_rule2)

[08:27] Substitution (Team_005): Cade Markkanen OUT → Zion Parker IN (stamina_rule2)

[08:09] Team_010 possession (Score: 39-29)
Ben Gilgeous-Alexander attempts a 3Pt. Contested by Blake O'Neal (4.3 feet, ZONE). Ben Gilgeous-Alexander misses. Rebound secured by Lauri Wade.

[07:55] Team_005 possession (Score: 39-29)
Draymond Smith throws a bad pass out of bounds! TURNOVER! (dead ball)

[07:38] Team_010 possession (Score: 39-29)
Blake Harden throws a bad pass out of bounds! TURNOVER! (dead ball)

[07:27] Team_005 possession (Score: 39-29)
Draymond Smith drives and kicks out. Lauri Wade attempts a 3Pt. Contested by Draymond Leonard (4.4 feet, ZONE). Lauri Wade misses. Rebound secured by Blake Harden.

[07:13] Team_010 possession (Score: 39-29)
Blake Harden attempts a 3Pt. Contested by Draymond Smith (4.0 feet, ZONE). BLAKE HARDEN MAKES IT! Assist: Ben Gilgeous-Alexander
Score: 42-29

[07:00] Team_005 possession (Score: 42-29)
Lauri Wade drives and kicks out. Blake O'Neal attempts a 3Pt. Contested by Ben Gilgeous-Alexander (4.6 feet, ZONE). Blake O'Neal misses. Rebound secured by Paolo Wade.

[06:45] Team_010 possession (Score: 42-29)
Draymond Leonard attempts a 3Pt. Contested by Blake O'Neal (4.5 feet, ZONE). Draymond Leonard misses. Offensive rebound by Blake Harden! Blake Harden kicks it out.

[06:31] Team_010 possession (Score: 42-29)
Draymond Leonard attempts a 3Pt. Contested by Blake O'Neal (4.5 feet, MAN). DRAYMOND LEONARD MAKES IT! Assist: Ben Gilgeous-Alexander
Score: 45-29

[06:12] Team_005 possession (Score: 45-29)
Lauri Wade attempts a 3Pt. Contested by Ben Gilgeous-Alexander (4.6 feet, MAN). Lauri Wade misses. Rebound secured by Blake Harden.

[05:58] Team_010 possession (Score: 45-29)
Vince Ingram throws a bad pass! Stolen by Isaiah Durant! TURNOVER! (live ball)

[05:40] Team_005 possession (Score: 45-29)
Blake O'Neal attempts a 3Pt. Contested by Draymond Leonard (4.8 feet, ZONE). BLAKE O'NEAL MAKES IT! Assist: Zion Parker
Score: 45-32

[05:23] Team_010 possession (Score: 45-32)
Draymond Leonard attempts a 3Pt. Contested by Blake O'Neal (4.5 feet, MAN). Draymond Leonard misses. Rebound secured by Draymond Smith.

[05:07] Team_005 possession (Score: 45-32)
Zion Parker drives to the basket... Zion Parker throws a bad pass! Stolen by Paolo Wade! TURNOVER! (live ball)

[04:52] Team_010 possession (Score: 45-32)
Draymond Leonard attempts a Midrange. Contested by Blake O'Neal (4.5 feet, MAN). DRAYMOND LEONARD MAKES IT!
Score: 47-32

[04:39] Team_005 possession (Score: 47-32)
Blake O'Neal attempts a 3Pt. Contested by Draymond Leonard (4.8 feet, MAN). Blake O'Neal misses. Rebound secured by Ben Gilgeous-Alexander.

[04:28] Team_010 possession (Score: 47-32)
Ben Gilgeous-Alexander drives to the basket... FOUL! Offensive foul on Ben Gilgeous-Alexander! Lauri Wade drew the charge! [Team fouls: 2] (Ben Gilgeous-Alexander: 1 personal fouls) TURNOVER! (dead ball)

[04:14] Team_005 possession (Score: 47-32)
Draymond Smith attempts a 3Pt. Contested by Blake Harden (4.4 feet, MAN). Draymond Smith misses. Offensive rebound by Draymond Smith! Draymond Smith kicks it out.

[04:00] Team_005 possession (Score: 47-32)
Draymond Smith attempts a Midrange. Contested by Ben Gilgeous-Alexander (4.3 feet, ZONE). DRAYMOND SMITH MAKES IT!
Score: 47-34

[03:47] Team_010 possession (Score: 47-34)
Draymond Leonard attempts a Midrange. Contested by Lauri Wade (5.4 feet, ZONE). DRAYMOND LEONARD MAKES IT!
Score: 49-34

[03:33] Team_005 possession (Score: 49-34)
Zion Parker drives and kicks out. Zion Parker attempts a 3Pt. Contested by Draymond Leonard (4.4 feet, ZONE). Zion Parker misses. Rebound secured by Paolo Wade.

[03:20] Team_010 possession (Score: 49-34)
Draymond Leonard attempts a 3Pt. Contested by Blake O'Neal (4.5 feet, ZONE). Draymond Leonard misses. Rebound secured by Draymond Smith.

[03:02] Team_005 possession (Score: 49-34)
Isaiah Durant attempts a 3Pt. Contested by Draymond Leonard (4.6 feet, ZONE). Isaiah Durant misses. Rebound secured by Blake Harden.

[02:48] Team_010 possession (Score: 49-34)
Paolo Wade throws a bad pass! Stolen by Zion Parker! TURNOVER! (live ball)

[02:34] Team_005 possession (Score: 49-34)
FOUL! Shooting foul on Vince Ingram. Isaiah Durant to the line for 2 free throws. [Team fouls: 3] (Vince Ingram: 1 personal fouls)   FT 1/2: GOOD   FT 2/2: GOOD Isaiah Durant makes 2/2 from the line.
Score: 49-36

[02:20] Team_010 possession (Score: 49-36)
Paolo Wade drives, picks up Zion Parker. Help arrives from Blake O'Neal! Paolo Wade attempts a Layup. Contested by Blake O'Neal (4.2 feet, MAN). PAOLO WADE MAKES IT! Assist: Blake Harden
Score: 51-36

[02:07] Team_005 possession (Score: 51-36)
FOUL! Holding foul on Draymond Leonard. [Team fouls: 4] No free throws, side out. (Draymond Leonard: 1 personal fouls)

[01:51] Team_005 possession (Score: 51-36)
Lauri Wade drives to the basket... Lauri Wade loses control! Ball rolls out of bounds! TURNOVER! (dead ball)

[01:35] Team_010 possession (Score: 51-36)
Draymond Leonard attempts a Midrange. Contested by Isaiah Durant (4.8 feet, ZONE). DRAYMOND LEONARD MAKES IT! Assist: Blake Harden
Score: 53-36

[01:22] Team_005 possession (Score: 53-36)
Zion Parker drives, Paolo Wade stays with him. Zion Parker attempts a Layup. Contested by Paolo Wade (5.2 feet, MAN). ZION PARKER MAKES IT! Assist: Lauri Wade
Score: 53-38

[01:07] Team_010 possession (Score: 53-38)
Vince Ingram throws a bad pass! Stolen by Isaiah Durant! TURNOVER! (live ball)

[00:51] Team_005 possession (Score: 53-38)
Blake O'Neal attempts a 3Pt. Contested by Draymond Leonard (4.9 feet, MAN). BLAKE O'NEAL MAKES IT! Assist: Isaiah Durant
Score: 53-41

[00:38] Team_010 possession (Score: 53-41)
Vince Ingram attempts a Layup. Contested by Isaiah Durant (5.2 feet, MAN). VINCE INGRAM MAKES IT! Assist: Blake Harden
Score: 55-41

[00:22] Team_005 possession (Score: 55-41)
Zion Parker attempts a Layup. Contested by Paolo Wade (5.2 feet, ZONE). Zion Parker misses. Offensive rebound by Zion Parker! Zion Parker puts it back in!
Score: 55-43

[00:07] Team_010 possession (Score: 55-43)
Draymond Leonard attempts a Midrange. Contested by Blake O'Neal (4.6 feet, MAN). DRAYMOND LEONARD MAKES IT!
Score: 57-43

================================================================================
                              2ND QUARTER COMPLETE                              
================================================================================

2ND QUARTER SCORE: Team_010 30, Team_005 25

BOX SCORE:
================================================================================

Team_010
--------------------------------------------------------------------------------
Player                MIN  PTS  REB  AST  TO      FG   FG%      3P   3P%
--------------------------------------------------------------------------------
Draymond Leonard        9   11    0    0   0   5/7    71.4     0/0   0.0
Desmond Antetokounmpo   16    4    0    0   0   2/3    66.7     0/0   0.0
Cade Morant            16    3    1    1   0   1/2    50.0     0/0   0.0
Michael Turner         16    3    1    1   0   1/2    50.0     0/0   0.0
Blake Harden            8    3    4    3   0   1/1   100.0     0/0   0.0
Anthony Durant         15    2    2    1   0   1/1   100.0     0/0   0.0
Paolo Wade              8    2    2    0   0   1/1   100.0     0/0   0.0
Vince Ingram            8    2    0    0   0   1/1   100.0     0/0   0.0
RJ Young               16    0    0    1   0   0/0     0.0     0/0   0.0
Ben Gilgeous-Alexander    8    0    1    2   0   0/1     0.0     0/0   0.0

TEAM: FG: 13/19 (68.4%), 3PT: 4/9 (44.4%), REB: 11 (1 off, 10 def), AST: 9, TO: 5
TEAM FOULS: 4


Team_005
--------------------------------------------------------------------------------
Player                MIN  PTS  REB  AST  TO      FG   FG%      3P   3P%
--------------------------------------------------------------------------------
Blake O'Neal            8    6    0    0   0   2/3    66.7     0/0   0.0
Zion Parker             8    4    1    1   0   2/3    66.7     0/0   0.0
Jalen Rozier           16    3    1    0   0   1/1   100.0     0/0   0.0
Derrick Allen          16    3    2    1   0   1/3    33.3     0/0   0.0
Brandon George         16    3    0    1   0   1/1   100.0     0/0   0.0
Draymond Smith          8    2    3    0   0   1/2    50.0     0/0   0.0
Isaiah Durant           8    2    0    1   0   1/2    50.0     0/0   0.0
Cade Markkanen         16    0    0    1   0   0/0     0.0     0/0   0.0
Anthony Rozier         16    0    0    0   0   0/2     0.0     0/0   0.0
Lauri Wade              8    0    1    1   0   0/2     0.0     0/0   0.0

TEAM: FG: 9/19 (47.4%), 3PT: 5/10 (50.0%), REB: 8 (2 off, 6 def), AST: 6, TO: 4
TEAM FOULS: 0

================================================================================

================================================================================
                       3RD QUARTER - Team_010 vs Team_005                       
================================================================================

[12:00] Team_010 possession (Score: 57-43)
Desmond Antetokounmpo attempts a 3Pt. Contested by Cade Markkanen (3.4 feet, MAN). Desmond Antetokounmpo misses. Rebound secured by Derrick Allen.

[11:44] Team_005 possession (Score: 57-43)
FOUL! Offensive foul on Derrick Allen! RJ Young drew the charge! [Team fouls: 1] (Derrick Allen: 1 personal fouls) TURNOVER! (dead ball)

[11:28] Team_010 possession (Score: 57-43)
Anthony Durant drives and kicks out. Anthony Durant attempts a 3Pt. Contested by Brandon George (5.1 feet, ZONE). Anthony Durant misses. Rebound secured by Cade Markkanen.

[11:12] Team_005 possession (Score: 57-43)
Cade Markkanen drives to the basket... Cade Markkanen loses the ball! Stripped by Anthony Durant! TURNOVER! (live ball)

[11:00] Team_010 possession (Score: 57-43)
FOUL! Reach-in foul on Cade Markkanen during the drive. [Team fouls: 2] No free throws, side out. (Cade Markkanen: 1 personal fouls)

[10:46] Team_010 possession (Score: 57-43)
RJ Young drives, Cade Markkanen stays with him. RJ Young attempts a Dunk. Contested by Cade Markkanen (3.1 feet, ZONE). RJ Young misses. Rebound secured by Cade Markkanen.

[10:33] Team_005 possession (Score: 57-43)
Cade Markkanen attempts a Layup. Contested by Anthony Durant (3.3 feet, MAN). CADE MARKKANEN MAKES IT!
Score: 57-45

[10:20] Team_010 possession (Score: 57-45)
Desmond Antetokounmpo attempts a Midrange. Contested by Cade Markkanen (3.4 feet, MAN). DESMOND ANTETOKOUNMPO MAKES IT!
Score: 59-45

[10:03] Team_005 possession (Score: 59-45)
Brandon George attempts a Midrange. Contested by RJ Young (4.9 feet, ZONE). Brandon George misses. Rebound secured by Anthony Durant.

[09:48] Team_010 possession (Score: 59-45)
Michael Turner drives and kicks out. FOUL! Shooting foul on Anthony Rozier. Michael Turner to the line for 2 free throws. [Team fouls: 3] (Anthony Rozier: 1 personal fouls)   FT 1/2: GOOD   FT 2/2: GOOD Michael Turner makes 2/2 from the line.
Score: 61-45

[09:39] Team_005 possession (Score: 61-45)
Cade Markkanen drives to the basket... Cade Markkanen throws a bad pass! Stolen by Anthony Durant! TURNOVER! (live ball)

[09:24] Team_010 possession (Score: 61-45)
RJ Young attempts a 3Pt. Contested by Derrick Allen (4.1 feet, MAN). RJ Young misses. Rebound secured by Derrick Allen.

[09:14] Team_005 possession (Score: 61-45)
Jalen Rozier throws a bad pass out of bounds! TURNOVER! (dead ball)

[09:01] Team_010 possession (Score: 61-45)
RJ Young drives, Derrick Allen stays with him. RJ Young attempts a Dunk. Contested by Derrick Allen (4.1 feet, MAN). RJ YOUNG MAKES IT! Assist: Michael Turner
Score: 63-45

[08:44] Team_005 possession (Score: 63-45)
Brandon George attempts a 3Pt. Contested by Cade Morant (4.1 feet, MAN). Brandon George misses. Rebound secured by Desmond Antetokounmpo.

[08:31] Team_010 possession (Score: 63-45)
Cade Morant makes the Layup and draws the foul on Brandon George! And-1! Cade Morant to the line for 1. [Team fouls: 4] (Brandon George: 1 personal fouls)   FT 1/1: GOOD Cade Morant makes 1/1 from the line.
Score: 66-45

[08:18] Team_005 possession (Score: 66-45)
Brandon George throws a bad pass! Stolen by Cade Morant! TURNOVER! (live ball)

[08:07] Team_010 possession (Score: 66-45)
Cade Morant drives, Brandon George stays with him. Cade Morant attempts a Layup. Contested by Brandon George (5.7 feet, MAN). CADE MORANT MAKES IT! Assist: Michael Turner
Score: 68-45

[07:55] Team_005 possession (Score: 68-45)
Brandon George attempts a 3Pt. Contested by Cade Morant (4.1 feet, ZONE). Brandon George misses. Rebound secured by Anthony Durant.

[07:41] Team_010 possession (Score: 68-45)
FOUL! Shooting foul on Jalen Rozier. Cade Morant to the line for 2 free throws. [BONUS: 5 team fouls] (Jalen Rozier: 1 personal fouls)   FT 1/2: GOOD   FT 2/2: GOOD Cade Morant makes 2/2 from the line.
Score: 70-45

[07:28] Team_005 possession (Score: 70-45)
Brandon George attempts a 3Pt. Contested by Cade Morant (4.1 feet, MAN). Brandon George misses. Offensive rebound by Cade Markkanen! Cade Markkanen's putback is no good. Rebound secured by Cade Morant.

[07:14] Team_010 possession (Score: 70-45)
Cade Morant attempts a Midrange. Contested by Brandon George (5.7 feet, MAN). Cade Morant misses. Rebound secured by Derrick Allen.

[07:01] Team_005 possession (Score: 70-45)
FOUL! Reach-in foul on Anthony Durant during the drive. [Team fouls: 1] No free throws, side out. (Anthony Durant: 1 personal fouls)

[06:48] Team_005 possession (Score: 70-45)
Jalen Rozier makes the Midrange and draws the foul on RJ Young! And-1! Jalen Rozier to the line for 1. [Team fouls: 2] (RJ Young: 1 personal fouls)   FT 1/1: GOOD Jalen Rozier makes 1/1 from the line.
Score: 70-48

[06:35] Team_010 possession (Score: 70-48)
Michael Turner attempts a 3Pt. Contested by Derrick Allen (4.5 feet, ZONE). Michael Turner misses. Rebound secured by Jalen Rozier.

[06:21] Team_005 possession (Score: 70-48)
Anthony Rozier attempts a 3Pt. Contested by Michael Turner (4.1 feet, MAN). Anthony Rozier misses. Rebound secured by Cade Morant.

[06:10] Team_010 possession (Score: 70-48)
FOUL! Reach-in foul on Cade Markkanen during the drive. [IN THE BONUS! 6 team fouls] RJ Young to the line for 2 free throws. (Cade Markkanen: 2 personal fouls)   FT 1/2: GOOD   FT 2/2: GOOD RJ Young makes 2/2 from the line.
Score: 72-48

[05:53] Team_005 possession (Score: 72-48)
Cade Markkanen attempts a Midrange. Contested by Michael Turner (3.8 feet, ZONE). Cade Markkanen misses. Rebound secured by Anthony Durant.

[05:41] Team_010 possession (Score: 72-48)
Desmond Antetokounmpo drives to the basket... Desmond Antetokounmpo throws a bad pass! Stolen by Cade Markkanen! TURNOVER! (live ball)

[05:32] Team_005 possession (Score: 72-48)
Jalen Rozier drives, picks up Desmond Antetokounmpo. Help arrives from Cade Morant! Jalen Rozier attempts a Layup. Contested by Cade Morant (4.6 feet, MAN). JALEN ROZIER MAKES IT! Assist: Cade Markkanen
Score: 72-50

[05:18] Team_010 possession (Score: 72-50)
FOUL! Offensive foul on Desmond Antetokounmpo! Cade Markkanen drew the charge! [Team fouls: 3] (Desmond Antetokounmpo: 1 personal fouls) TURNOVER! (dead ball)

[04:59] Team_005 possession (Score: 72-50)
Jalen Rozier attempts a 3Pt. Contested by Desmond Antetokounmpo (4.6 feet, MAN). JALEN ROZIER MAKES IT! Assist: Brandon George
Score: 72-53

[04:44] Team_010 possession (Score: 72-53)
FOUL! Shooting foul on Derrick Allen. RJ Young to the line for 2 free throws. [BONUS: 7 team fouls] (Derrick Allen: 2 personal fouls)   FT 1/2: MISS   FT 2/2: GOOD RJ Young makes 1/2 from the line.
Score: 73-53

[04:32] Team_005 possession (Score: 73-53)
Anthony Rozier attempts a 3Pt. Contested by Cade Morant (4.1 feet, ZONE). Anthony Rozier misses. Rebound secured by Anthony Durant.

[04:23] Team_010 possession (Score: 73-53)
FOUL! Reach-in foul on Cade Markkanen during the drive. [IN THE BONUS! 8 team fouls] Cade Morant to the line for 2 free throws. (Cade Markkanen: 3 personal fouls)   FT 1/2: GOOD   FT 2/2: GOOD Cade Morant makes 2/2 from the line.
Score: 75-53

[04:08] Team_005 possession (Score: 75-53)
Cade Markkanen drives to the basket... Cade Markkanen loses the ball! Stripped by Anthony Durant! TURNOVER! (live ball)

[03:56] Team_010 possession (Score: 75-53)
Michael Turner attempts a 3Pt. Contested by Anthony Rozier (5.1 feet, MAN). MICHAEL TURNER MAKES IT! Assist: Cade Morant
Score: 78-53

[03:38] Team_005 possession (Score: 78-53)
Anthony Rozier drives to the basket... Anthony Rozier throws a bad pass! Stolen by Michael Turner! TURNOVER! (live ball)

[03:26] Team_010 possession (Score: 78-53)
RJ Young attempts a 3Pt. Contested by Derrick Allen (4.2 feet, ZONE). RJ Young misses. Rebound secured by Cade Markkanen.

[03:13] Team_005 possession (Score: 78-53)
Derrick Allen drives and kicks out. Cade Markkanen attempts a Midrange. Contested by RJ Young (5.0 feet, ZONE). Cade Markkanen misses. Rebound secured by Cade Morant.

[02:56] Team_010 possession (Score: 78-53)
RJ Young attempts a Midrange. Contested by Anthony Rozier (4.7 feet, ZONE). RJ Young misses. Offensive rebound by Cade Morant! Cade Morant kicks it out.

[02:38] Team_010 possession (Score: 78-53)
RJ Young drives, picks up Cade Markkanen. Help arrives from Anthony Rozier! RJ Young attempts a Dunk. Contested by Anthony Rozier (3.5 feet, ZONE). RJ YOUNG MAKES IT!
Score: 80-53

[02:25] Team_005 possession (Score: 80-53)
Anthony Rozier attempts a 3Pt. Contested by Michael Turner (4.3 feet, MAN). Anthony Rozier misses. Rebound secured by Michael Turner.

[02:12] Team_010 possession (Score: 80-53)
RJ Young loses control! Ball rolls out of bounds! TURNOVER! (dead ball)

[02:12] Substitution (Team_010): Cade Morant OUT → Draymond Leonard IN (stamina_rule2)

[02:12] Substitution (Team_010): Michael Turner OUT → Blake Harden IN (stamina_rule2)

[02:12] Substitution (Team_010): RJ Young OUT → Ben Gilgeous-Alexander IN (stamina_rule2)

[02:12] Substitution (Team_010): Desmond Antetokounmpo OUT → Vince Ingram IN (stamina_rule2)

[02:12] Substitution (Team_010): Anthony Durant OUT → Paolo Wade IN (stamina_rule2)

[02:12] Substitution (Team_005): Brandon George OUT → Blake O'Neal IN (stamina_rule2)

[02:12] Substitution (Team_005): Anthony Rozier OUT → Draymond Smith IN (stamina_rule2)

[02:12] Substitution (Team_005): Derrick Allen OUT → Lauri Wade IN (stamina_rule2)

[02:12] Substitution (Team_005): Jalen Rozier OUT → Isaiah Durant IN (stamina_rule2)

[02:12] Substitution (Team_005): Cade Markkanen OUT → Zion Parker IN (stamina_rule2)

[01:59] Team_005 possession (Score: 80-53)
Isaiah Durant attempts a 3Pt. Contested by Draymond Leonard (4.6 feet, ZONE). Isaiah Durant misses. Rebound secured by Ben Gilgeous-Alexander.

[01:45] Team_010 possession (Score: 80-53)
Draymond Leonard attempts a 3Pt. Contested by Blake O'Neal (4.5 feet, MAN). DRAYMOND LEONARD MAKES IT! Assist: Paolo Wade
Score: 83-53

[01:30] Team_005 possession (Score: 83-53)
Draymond Smith throws a bad pass! Stolen by Blake Harden! TURNOVER! (live ball)

[01:14] Team_010 possession (Score: 83-53)
Draymond Leonard drives and kicks out. FOUL! Shooting foul on Draymond Smith. Blake Harden to the line for 2 free throws. [BONUS: 9 team fouls] (Draymond Smith: 1 personal fouls)   FT 1/2: GOOD   FT 2/2: GOOD Blake Harden makes 2/2 from the line.
Score: 85-53

[01:00] Team_005 possession (Score: 85-53)
Draymond Smith makes the Midrange and draws the foul on Blake Harden! And-1! Draymond Smith to the line for 1. [Team fouls: 4] (Blake Harden: 1 personal fouls)   FT 1/1: GOOD Draymond Smith makes 1/1 from the line.
Score: 85-56

[00:45] Team_010 possession (Score: 85-56)
Draymond Leonard makes the Layup and draws the foul on Zion Parker! And-1! Draymond Leonard to the line for 1. [BONUS: 10 team fouls] (Zion Parker: 1 personal fouls)   FT 1/1: GOOD Draymond Leonard makes 1/1 from the line.
Score: 88-56

[00:30] Team_005 possession (Score: 88-56)
Lauri Wade drives to the basket... Lauri Wade commits a violation (traveling/carry)! TURNOVER! (dead ball)

[00:18] Team_010 possession (Score: 88-56)
Paolo Wade attempts a Midrange. Contested by Isaiah Durant (4.6 feet, ZONE). PAOLO WADE MAKES IT! Assist: Vince Ingram
Score: 90-56

[00:01] Team_005 possession (Score: 90-56)
Draymond Smith attempts a 3Pt. Contested by Draymond Leonard (4.2 feet, ZONE). Draymond Smith misses. Rebound secured by Ben Gilgeous-Alexander.

================================================================================
                              3RD QUARTER COMPLETE                              
================================================================================

3RD QUARTER SCORE: Team_010 33, Team_005 13

BOX SCORE:
================================================================================

Team_010
--------------------------------------------------------------------------------
Player                MIN  PTS  REB  AST  TO      FG   FG%      3P   3P%
--------------------------------------------------------------------------------
Cade Morant            26    9    4    1   0   4/5    80.0     0/0   0.0
RJ Young               26    7    0    0   0   4/7    57.1     0/0   0.0
Draymond Leonard       12    6    0    0   0   2/2   100.0     0/0   0.0
Michael Turner         26    5    1    2   0   2/3    66.7     0/0   0.0
Desmond Antetokounmpo   26    2    1    0   0   1/2    50.0     0/0   0.0
Paolo Wade             10    2    0    1   0   1/1   100.0     0/0   0.0
Blake Harden           10    2    0    0   0   1/1   100.0     0/0   0.0
Anthony Durant         25    0    4    0   0   0/1     0.0     0/0   0.0
Ben Gilgeous-Alexander   10    0    2    0   0   0/0     0.0     0/0   0.0
Vince Ingram           10    0    0    1   0   0/0     0.0     0/0   0.0

TEAM: FG: 15/22 (68.2%), 3PT: 2/6 (33.3%), REB: 11 (1 off, 10 def), AST: 5, TO: 3
TEAM FOULS: 4


Team_005
--------------------------------------------------------------------------------
Player                MIN  PTS  REB  AST  TO      FG   FG%      3P   3P%
--------------------------------------------------------------------------------
Jalen Rozier           26    8    1    0   0   3/3   100.0     0/0   0.0
Draymond Smith         10    3    0    0   0   1/2    50.0     0/0   0.0
Cade Markkanen         26    2    3    1   0   1/2    50.0     0/0   0.0
Derrick Allen          26    0    3    0   0   0/1     0.0     0/0   0.0
Brandon George         26    0    0    1   0   0/4     0.0     0/0   0.0
Anthony Rozier         26    0    0    0   0   0/3     0.0     0/0   0.0
Isaiah Durant          10    0    0    0   0   0/1     0.0     0/0   0.0

TEAM: FG: 5/16 (31.2%), 3PT: 1/9 (11.1%), REB: 8 (1 off, 7 def), AST: 2, TO: 9
TEAM FOULS: 10 [Team_010 in BONUS]

================================================================================

================================================================================
                       4TH QUARTER - Team_010 vs Team_005                       
================================================================================

[12:00] Team_010 possession (Score: 90-56)
Cade Morant attempts a Layup. Contested by Cade Markkanen (3.9 feet, ZONE). CADE MORANT MAKES IT!
Score: 92-56

[11:47] Team_005 possession (Score: 92-56)
Cade Markkanen drives, Anthony Durant stays with him. Cade Markkanen attempts a Layup. Contested by Anthony Durant (3.4 feet, MAN). CADE MARKKANEN MAKES IT! Assist: Derrick Allen
Score: 92-58

[11:33] Team_010 possession (Score: 92-58)
Desmond Antetokounmpo throws a bad pass! Stolen by Jalen Rozier! TURNOVER! (live ball)

[11:19] Team_005 possession (Score: 92-58)
Jalen Rozier drives, picks up Anthony Durant. Help arrives from Cade Morant! Jalen Rozier attempts a Dunk. Contested by Cade Morant (3.9 feet, ZONE). Jalen Rozier misses. Rebound secured by Anthony Durant.

[11:00] Team_010 possession (Score: 92-58)
RJ Young throws a bad pass out of bounds! TURNOVER! (dead ball)

[10:46] Team_005 possession (Score: 92-58)
FOUL! Holding foul on Anthony Durant. [Team fouls: 1] No free throws, side out. (Anthony Durant: 1 personal fouls)

[10:28] Team_005 possession (Score: 92-58)
Brandon George loses the ball! Stripped by Cade Morant! TURNOVER! (live ball)

[10:12] Team_010 possession (Score: 92-58)
RJ Young drives, Jalen Rozier stays with him. RJ Young attempts a Dunk. Contested by Jalen Rozier (4.9 feet, ZONE). RJ YOUNG MAKES IT! Assist: Cade Morant
Score: 94-58

[09:56] Team_005 possession (Score: 94-58)
Derrick Allen attempts a Midrange. Contested by Cade Morant (4.5 feet, ZONE). DERRICK ALLEN MAKES IT!
Score: 94-60

[09:38] Team_010 possession (Score: 94-60)
FOUL! Shooting foul on Brandon George. Cade Morant to the line for 2 free throws. [Team fouls: 1] (Brandon George: 1 personal fouls)   FT 1/2: GOOD   FT 2/2: MISS Cade Morant makes 1/2 from the line. Offensive rebound by Anthony Durant! Anthony Durant kicks it out.
Score: 95-60

[09:23] Team_010 possession (Score: 95-60)
Anthony Durant attempts a Midrange. Contested by Anthony Rozier (5.2 feet, ZONE). ANTHONY DURANT MAKES IT!
Score: 97-60

[09:10] Team_005 possession (Score: 97-60)
Anthony Rozier drives and kicks out. Brandon George attempts a 3Pt. Contested by Cade Morant (4.3 feet, ZONE). BRANDON GEORGE MAKES IT!
Score: 97-63

[08:54] Team_010 possession (Score: 97-63)
Michael Turner attempts a 3Pt. Contested by Jalen Rozier (5.5 feet, ZONE). Michael Turner misses. Rebound secured by Derrick Allen.

[08:40] Team_005 possession (Score: 97-63)
Derrick Allen attempts a 3Pt. Contested by Cade Morant (4.7 feet, ZONE). Derrick Allen misses. Rebound secured by Cade Morant.

[08:29] Team_010 possession (Score: 97-63)
Anthony Durant attempts a Layup. BLOCKED BY CADE MARKKANEN! Ball is loose! Offensive rebound by Anthony Durant! Anthony Durant kicks it out.

[08:17] Team_010 possession (Score: 97-63)
FOUL! Shooting foul on Cade Markkanen. Anthony Durant to the line for 2 free throws. [Team fouls: 2] (Cade Markkanen: 1 personal fouls)   FT 1/2: GOOD   FT 2/2: GOOD Anthony Durant makes 2/2 from the line.
Score: 99-63

[08:03] Team_005 possession (Score: 99-63)
Cade Markkanen drives to the basket... Cade Markkanen throws a bad pass! Stolen by Anthony Durant! TURNOVER! (live ball)

[07:49] Team_010 possession (Score: 99-63)
Anthony Durant loses the ball! Stripped by Cade Markkanen! TURNOVER! (live ball)

[07:35] Team_005 possession (Score: 99-63)
Brandon George attempts a 3Pt. Contested by Cade Morant (4.6 feet, MAN). Brandon George misses. Offensive rebound by Cade Markkanen! Cade Markkanen kicks it out.

[07:21] Team_005 possession (Score: 99-63)
Jalen Rozier makes the Midrange and draws the foul on Desmond Antetokounmpo! And-1! Jalen Rozier to the line for 1. [Team fouls: 2] (Desmond Antetokounmpo: 1 personal fouls)   FT 1/1: MISS Jalen Rozier makes 0/1 from the line. Rebound secured by Michael Turner.
Score: 99-65

[07:08] Team_010 possession (Score: 99-65)
Desmond Antetokounmpo attempts a Midrange. Contested by Anthony Rozier (5.4 feet, ZONE). Desmond Antetokounmpo misses. Offensive rebound by Anthony Durant! Anthony Durant kicks it out.

[06:55] Team_010 possession (Score: 99-65)
Cade Morant drives and kicks out. Michael Turner attempts a 3Pt. Contested by Anthony Rozier (5.4 feet, MAN). Michael Turner misses. Rebound secured by Jalen Rozier.

[06:44] Team_005 possession (Score: 99-65)
Derrick Allen attempts a 3Pt. Contested by Cade Morant (4.9 feet, ZONE). Derrick Allen misses. Rebound secured by Cade Morant.

[06:29] Team_010 possession (Score: 99-65)
Michael Turner attempts a 3Pt. Contested by Derrick Allen (5.0 feet, ZONE). Michael Turner misses. Rebound secured by Cade Markkanen.

[06:12] Team_005 possession (Score: 99-65)
Brandon George drives to the basket... Brandon George throws a bad pass! Stolen by Anthony Durant! TURNOVER! (live ball)

[06:01] Team_010 possession (Score: 99-65)
Anthony Durant attempts a 3Pt. Contested by Derrick Allen (5.1 feet, ZONE). ANTHONY DURANT MAKES IT! Assist: Cade Morant
Score: 102-65

[05:50] Team_005 possession (Score: 102-65)
Derrick Allen drives, RJ Young stays with him. Derrick Allen attempts a Layup. Contested by RJ Young (5.7 feet, MAN). Derrick Allen misses. Rebound secured by Anthony Durant.

[05:35] Team_010 possession (Score: 102-65)
Cade Morant attempts a 3Pt. Wide open! Brandon George is 6.4 feet away. [MAN] Cade Morant misses. Rebound secured by Cade Markkanen.

[05:20] Team_005 possession (Score: 102-65)
Derrick Allen attempts a 3Pt. Contested by Cade Morant (5.1 feet, ZONE). Derrick Allen misses. Rebound secured by Anthony Durant.

[05:05] Team_010 possession (Score: 102-65)
FOUL! Shooting foul on Derrick Allen. RJ Young to the line for 2 free throws. [Team fouls: 3] (Derrick Allen: 1 personal fouls)   FT 1/2: GOOD   FT 2/2: GOOD RJ Young makes 2/2 from the line.
Score: 104-65

[04:49] Team_005 possession (Score: 104-65)
Derrick Allen throws a bad pass out of bounds! TURNOVER! (dead ball)

[04:49] Substitution (Team_010): Cade Morant OUT → Draymond Leonard IN (stamina_rule2)

[04:49] Substitution (Team_010): Michael Turner OUT → Blake Harden IN (stamina_rule2)

[04:49] Substitution (Team_010): RJ Young OUT → Ben Gilgeous-Alexander IN (stamina_rule2)

[04:49] Substitution (Team_010): Desmond Antetokounmpo OUT → Vince Ingram IN (stamina_rule2)

[04:49] Substitution (Team_010): Anthony Durant OUT → Paolo Wade IN (stamina_rule2)

[04:49] Substitution (Team_005): Brandon George OUT → Blake O'Neal IN (stamina_rule2)

[04:49] Substitution (Team_005): Anthony Rozier OUT → Draymond Smith IN (stamina_rule2)

[04:49] Substitution (Team_005): Derrick Allen OUT → Lauri Wade IN (stamina_rule2)

[04:49] Substitution (Team_005): Jalen Rozier OUT → Isaiah Durant IN (stamina_rule2)

[04:49] Substitution (Team_005): Cade Markkanen OUT → Zion Parker IN (stamina_rule2)

[04:37] Team_010 possession (Score: 104-65)
Draymond Leonard attempts a Midrange. Contested by Isaiah Durant (4.8 feet, ZONE). Draymond Leonard misses. Rebound secured by Lauri Wade.

[04:24] Team_005 possession (Score: 104-65)
Draymond Smith attempts a Layup. Contested by Blake Harden (4.4 feet, MAN). Draymond Smith misses. Rebound secured by Paolo Wade.

[04:15] Team_010 possession (Score: 104-65)
Blake Harden makes the Dunk and draws the foul on Zion Parker! And-1! Blake Harden to the line for 1. [Team fouls: 4] (Zion Parker: 1 personal fouls)   FT 1/1: GOOD Blake Harden makes 1/1 from the line.
Score: 107-65

[04:02] Team_005 possession (Score: 107-65)
FOUL! Offensive foul on Blake O'Neal! Draymond Leonard drew the charge! [Team fouls: 5] (Blake O'Neal: 1 personal fouls) TURNOVER! (dead ball)

[03:52] Team_010 possession (Score: 107-65)
Vince Ingram attempts a Layup. Contested by Isaiah Durant (5.1 feet, MAN). VINCE INGRAM MAKES IT! Assist: Blake Harden
Score: 109-65

[03:39] Team_005 possession (Score: 109-65)
FOUL! Holding foul on Draymond Leonard. [Team fouls: 3] No free throws, side out. (Draymond Leonard: 1 personal fouls)

[03:28] Team_005 possession (Score: 109-65)
Lauri Wade attempts a Layup. Contested by Ben Gilgeous-Alexander (4.6 feet, MAN). LAURI WADE MAKES IT! Assist: Isaiah Durant
Score: 109-67

[03:11] Team_010 possession (Score: 109-67)
Draymond Leonard attempts a 3Pt. Contested by Blake O'Neal (4.5 feet, MAN). Draymond Leonard misses. FOUL! Loose ball foul on Lauri Wade during the rebound battle. [IN THE BONUS! 6 team fouls] Paolo Wade to the line for 2 free throws. (Lauri Wade: 1 personal fouls)   FT 1/2: GOOD   FT 2/2: GOOD Paolo Wade makes 2/2 from the line.
Score: 111-67

[03:01] Team_005 possession (Score: 111-67)
FOUL! Reach-in foul on Paolo Wade during the drive. [Team fouls: 4] No free throws, side out. (Paolo Wade: 1 personal fouls)

[02:50] Team_005 possession (Score: 111-67)
Draymond Smith drives and kicks out. Blake O'Neal attempts a 3Pt. Contested by Draymond Leonard (4.4 feet, ZONE). Blake O'Neal misses. Rebound secured by Blake Harden.

[02:36] Team_010 possession (Score: 111-67)
Blake Harden attempts a Midrange. Contested by Isaiah Durant (4.1 feet, ZONE). BLAKE HARDEN MAKES IT! Assist: Draymond Leonard
Score: 113-67

[02:21] Team_005 possession (Score: 113-67)
Draymond Smith attempts a 3Pt. Contested by Draymond Leonard (4.2 feet, ZONE). Draymond Smith misses. Rebound secured by Paolo Wade.

[02:07] Team_010 possession (Score: 113-67)
Paolo Wade drives, picks up Zion Parker. Help arrives from Blake O'Neal! Paolo Wade attempts a Dunk. Contested by Blake O'Neal (4.2 feet, MAN). PAOLO WADE MAKES IT!
Score: 115-67

[01:49] Team_005 possession (Score: 115-67)
Zion Parker attempts a Layup. Contested by Paolo Wade (5.1 feet, ZONE). Zion Parker misses. Rebound secured by Paolo Wade.

[01:35] Team_010 possession (Score: 115-67)
Paolo Wade attempts a Midrange. Contested by Lauri Wade (5.3 feet, ZONE). Paolo Wade misses. Rebound secured by Zion Parker.

[01:17] Team_005 possession (Score: 115-67)
Isaiah Durant attempts a Midrange. Contested by Ben Gilgeous-Alexander (4.8 feet, ZONE). ISAIAH DURANT MAKES IT! Assist: Draymond Smith
Score: 115-69

[01:00] Team_010 possession (Score: 115-69)
Ben Gilgeous-Alexander attempts a Midrange. Contested by Lauri Wade (5.3 feet, MAN). BEN GILGEOUS-ALEXANDER MAKES IT! Assist: Paolo Wade
Score: 117-69

[00:45] Team_005 possession (Score: 117-69)
FOUL! Shooting foul on Paolo Wade. Draymond Smith to the line for 2 free throws. [BONUS: 5 team fouls] (Paolo Wade: 2 personal fouls)   FT 1/2: GOOD   FT 2/2: MISS Draymond Smith makes 1/2 from the line. Rebound secured by Blake Harden.
Score: 117-70

[00:31] Team_010 possession (Score: 117-70)
Paolo Wade attempts a Layup. Contested by Zion Parker (4.2 feet, ZONE). Paolo Wade misses. Rebound secured by Lauri Wade.

[00:18] Team_005 possession (Score: 117-70)
Blake O'Neal attempts a Midrange. Contested by Blake Harden (5.0 feet, ZONE). Blake O'Neal misses. Offensive rebound by Draymond Smith! Draymond Smith kicks it out.

[00:05] Team_005 possession (Score: 117-70)
Lauri Wade attempts a Layup. Contested by Ben Gilgeous-Alexander (4.6 feet, MAN). Lauri Wade misses. Offensive rebound by Draymond Smith! Draymond Smith kicks it out.

================================================================================
                              4TH QUARTER COMPLETE                              
================================================================================

4TH QUARTER SCORE: Team_010 27, Team_005 14

BOX SCORE:
================================================================================

Team_010
--------------------------------------------------------------------------------
Player                MIN  PTS  REB  AST  TO      FG   FG%      3P   3P%
--------------------------------------------------------------------------------
Anthony Durant         32    7    6    0   0   3/3   100.0     0/0   0.0
Blake Harden           15    5    2    1   0   2/2   100.0     0/0   0.0
RJ Young               33    4    0    0   0   2/2   100.0     0/0   0.0
Paolo Wade             15    4    3    1   0   2/4    50.0     0/0   0.0
Cade Morant            33    2    2    2   0   1/3    33.3     0/0   0.0
Vince Ingram           15    2    0    0   0   1/1   100.0     0/0   0.0
Ben Gilgeous-Alexander   15    2    0    0   0   1/1   100.0     0/0   0.0
Michael Turner         33    0    1    0   0   0/2     0.0     0/0   0.0
Draymond Leonard       16    0    0    1   0   0/1     0.0     0/0   0.0

TEAM: FG: 12/19 (63.2%), 3PT: 2/5 (40.0%), REB: 14 (3 off, 11 def), AST: 5, TO: 3
TEAM FOULS: 5 [Team_005 in BONUS]


Team_005
--------------------------------------------------------------------------------
Player                MIN  PTS  REB  AST  TO      FG   FG%      3P   3P%
--------------------------------------------------------------------------------
Brandon George         33    3    0    0   0   1/1   100.0     0/0   0.0
Cade Markkanen         33    2    3    0   0   1/1   100.0     0/0   0.0
Derrick Allen          33    2    1    1   0   1/5    20.0     0/0   0.0
Lauri Wade             15    2    2    0   0   1/1   100.0     0/0   0.0
Isaiah Durant          15    2    0    1   0   1/1   100.0     0/0   0.0
Jalen Rozier           33    0    1    0   0   0/2     0.0     0/0   0.0
Draymond Smith         15    0    2    1   0   0/4     0.0     0/0   0.0
Zion Parker            15    0    1    0   0   0/1     0.0     0/0   0.0

TEAM: FG: 5/16 (31.2%), 3PT: 0/4 (0.0%), REB: 10 (3 off, 7 def), AST: 3, TO: 5
TEAM FOULS: 6 [Team_010 in BONUS]

================================================================================

================================================================================
                               FULL GAME COMPLETE                               
================================================================================

FINAL SCORE: Team_010 117, Team_005 70

SCORING BY QUARTER:
--------------------------------------------------------------------------------
Team                     Q1     Q2     Q3     Q4    FINAL
--------------------------------------------------------------------------------
Team_010                 27     30     33     27      117
Team_005                 18     25     13     14       70
--------------------------------------------------------------------------------

FULL GAME BOX SCORE:
================================================================================

Team_010
--------------------------------------------------------------------------------
Player                MIN  PTS  REB  AST  TO      FG   FG%      3P   3P%      FT STL BLK
--------------------------------------------------------------------------------
Cade Morant            33   18   10    6   1   9/13   69.2   1/3    33.3   8/9     2   0
Michael Turner         33   13    4    8   0   5/11   45.5   3/8    37.5   4/4     1   1
RJ Young               33   15    0    1   2   8/12   66.7   0/2     0.0   5/6     0   0
Desmond Antetokounmpo   33   14    3    0   2   6/12   50.0   2/6    33.3   0/0     0   0
Anthony Durant         32   15   15    1   2   6/7    85.7   1/1   100.0   2/2     7   1
Draymond Leonard       16   17    0    1   0   9/12   75.0   3/5    60.0   1/1     0   0
Blake Harden           15   10    6    4   1   3/3   100.0   1/1   100.0   3/3     1   0
Ben Gilgeous-Alexander   15    2    3    2   1   1/2    50.0   0/1     0.0   0/0     0   0
Vince Ingram           15    4    0    1   2   2/2   100.0   0/0     0.0   0/0     0   0
Paolo Wade             15    8    5    2   1   3/5    60.0   0/0     0.0   2/2     1   0

TEAM: FG: 52/79 (65.8%), 3PT: 11/27 (40.7%), REB: 45 (8 off, 37 def), AST: 26, TO: 12


Team_005
--------------------------------------------------------------------------------
Player                MIN  PTS  REB  AST  TO      FG   FG%      3P   3P%      FT STL BLK
--------------------------------------------------------------------------------
Brandon George         33   10    0    2   4   3/10   30.0   1/6    16.7   0/0     0   0
Anthony Rozier         33    0    0    1   1   1/8    12.5   0/3     0.0   0/1     0   0
Derrick Allen          33    8    8    2   4   3/10   30.0   2/7    28.6   0/0     0   0
Jalen Rozier           33   13    7    1   4   5/7    71.4   2/2   100.0   1/2     1   0
Cade Markkanen         33   13   10    3   3   5/8    62.5   0/0     0.0   3/4     2   1
Blake O'Neal           15    6    0    0   2   2/3    66.7   2/3    66.7   0/0     0   0
Draymond Smith         15    5    5    1   2   2/8    25.0   0/2     0.0   2/3     0   0
Lauri Wade             15    2    3    1   0   1/3    33.3   0/1     0.0   0/0     0   0
Isaiah Durant          15    4    0    2   0   2/4    50.0   0/2     0.0   2/2     2   0
Zion Parker            15    4    2    1   2   2/4    50.0   0/0     0.0   0/0     1   0

TEAM: FG: 27/66 (40.9%), 3PT: 7/26 (26.9%), REB: 36 (9 off, 27 def), AST: 14, TO: 22

================================================================================
