================================================================================
                        FULL GAME - Team_096 vs Team_068                        
================================================================================

================================================================================
                       1ST QUARTER - Team_096 vs Team_068                       
================================================================================

[12:00] Team_096 possession (Score: 0-0)
Kyrie Adebayo drives to the basket... Kyrie Adebayo loses control! Ball rolls out of bounds! TURNOVER! (dead ball)

[11:43] Team_068 possession (Score: 0-0)
Malcolm Herro attempts a Midrange. Contested by Scottie Herro (5.0 feet, ZONE). Malcolm Herro misses. Rebound secured by Scottie Herro.

[11:31] Team_096 possession (Score: 0-0)
FOUL! Shooting foul on Gary Simons. Lamelo Quickley to the line for 2 free throws. [Team fouls: 1] (Gary Simons: 1 personal fouls)   FT 1/2: GOOD   FT 2/2: GOOD Lamelo Quickley makes 2/2 from the line.
Score: 2-0

[11:13] Team_068 possession (Score: 2-0)
Nikola Ginobili loses the ball! Stripped by Kyrie Adebayo! TURNOVER! (live ball)

[10:58] Team_096 possession (Score: 2-0)
Terry Mobley loses control! Ball rolls out of bounds! TURNOVER! (dead ball)

[10:40] Team_068 possession (Score: 2-0)
Malcolm Herro drives and kicks out. Malcolm Herro attempts a Midrange. Contested by Lamelo Quickley (3.9 feet, MAN). Malcolm Herro misses. Rebound secured by Scottie Herro.

[10:25] Team_096 possession (Score: 2-0)
FOUL! Offensive foul on Cole Griffin! Jaren Johnson drew the charge! [Team fouls: 1] (Cole Griffin: 1 personal fouls) TURNOVER! (dead ball)

[10:13] Team_068 possession (Score: 2-0)
Zion Anunoby drives to the basket... FOUL! Offensive foul on Zion Anunoby! Terry Mobley drew the charge! [Team fouls: 2] (Zion Anunoby: 1 personal fouls) TURNOVER! (dead ball)

[10:00] Team_096 possession (Score: 2-0)
Lamelo Quickley drives, Gary Simons stays with him. Lamelo Quickley attempts a Layup. Contested by Gary Simons (2.7 feet, ZONE). LAMELO QUICKLEY MAKES IT! Assist: Cole Griffin
Score: 4-0

[09:44] Team_068 possession (Score: 4-0)
Nikola Ginobili drives and kicks out. Nikola Ginobili attempts a 3Pt. Contested by Kyrie Adebayo (4.0 feet, MAN). NIKOLA GINOBILI MAKES IT! Assist: Malcolm Herro
Score: 4-3

[09:29] Team_096 possession (Score: 4-3)
Lamelo Quickley attempts a 3Pt. Contested by Malcolm Herro (3.7 feet, MAN). Lamelo Quickley misses. Rebound secured by Gary Simons.

[09:14] Team_068 possession (Score: 4-3)
Malcolm Herro makes the Layup and draws the foul on Scottie Herro! And-1! Malcolm Herro to the line for 1. [Team fouls: 2] (Scottie Herro: 1 personal fouls)   FT 1/1: GOOD Malcolm Herro makes 1/1 from the line.
Score: 4-6

[09:01] Team_096 possession (Score: 4-6)
Cole Griffin attempts a Midrange. Contested by Malcolm Herro (4.5 feet, ZONE). Cole Griffin misses. Offensive rebound by Kyrie Adebayo! Kyrie Adebayo puts it back in!
Score: 6-6

[08:44] Team_068 possession (Score: 6-6)
Nikola Ginobili makes the Layup and draws the foul on Lamelo Quickley! And-1! Nikola Ginobili to the line for 1. [Team fouls: 3] (Lamelo Quickley: 1 personal fouls)   FT 1/1: GOOD Nikola Ginobili makes 1/1 from the line.
Score: 6-9

[08:28] Team_096 possession (Score: 6-9)
FOUL! Reach-in foul on Nikola Ginobili during the drive. [Team fouls: 3] No free throws, side out. (Nikola Ginobili: 1 personal fouls)

[08:19] Team_096 possession (Score: 6-9)
Terry Mobley attempts a Midrange. Contested by Malcolm Herro (4.3 feet, ZONE). Terry Mobley misses. Rebound secured by Gary Simons.

[08:05] Team_068 possession (Score: 6-9)
Jaren Johnson drives, picks up Kyrie Adebayo. Help arrives from Lamelo Quickley! Jaren Johnson attempts a Dunk. Contested by Lamelo Quickley (4.4 feet, ZONE). Jaren Johnson misses. Rebound secured by Scottie Herro.

[07:50] Team_096 possession (Score: 6-9)
Terry Mobley attempts a Midrange. Contested by Malcolm Herro (4.3 feet, ZONE). Terry Mobley misses. Rebound secured by Jaren Johnson.

[07:36] Team_068 possession (Score: 6-9)
Malcolm Herro attempts a 3Pt. Contested by Cole Griffin (3.3 feet, ZONE). MALCOLM HERRO MAKES IT! Assist: Nikola Ginobili
Score: 6-12

[07:17] Team_096 possession (Score: 6-12)
Terry Mobley attempts a 3Pt. Contested by Zion Anunoby (4.5 feet, MAN). TERRY MOBLEY MAKES IT! Assist: Scottie Herro
Score: 9-12

[07:04] Team_068 possession (Score: 9-12)
Nikola Ginobili makes the Dunk and draws the foul on Kyrie Adebayo! And-1! Nikola Ginobili to the line for 1. [Team fouls: 4] (Kyrie Adebayo: 1 personal fouls)   FT 1/1: GOOD Nikola Ginobili makes 1/1 from the line.
Score: 9-15

[06:50] Team_096 possession (Score: 9-15)
Scottie Herro drives, Gary Simons stays with him. Scottie Herro attempts a Layup. Contested by Gary Simons (3.3 feet, MAN). Scottie Herro misses. Rebound secured by Jaren Johnson.

[06:34] Team_068 possession (Score: 9-15)
Gary Simons attempts a Midrange. Contested by Scottie Herro (5.8 feet, MAN). Gary Simons misses. Rebound secured by Scottie Herro.

[06:20] Team_096 possession (Score: 9-15)
Lamelo Quickley attempts a 3Pt. Contested by Zion Anunoby (3.9 feet, ZONE). Lamelo Quickley misses. Rebound secured by Jaren Johnson.

[06:09] Team_068 possession (Score: 9-15)
Zion Anunoby attempts a 3Pt. Contested by Cole Griffin (3.7 feet, ZONE). Zion Anunoby misses. Rebound secured by Scottie Herro.

[05:53] Team_096 possession (Score: 9-15)
Terry Mobley attempts a 3Pt. Contested by Zion Anunoby (4.5 feet, MAN). TERRY MOBLEY MAKES IT! Assist: Scottie Herro
Score: 12-15

[05:34] Team_068 possession (Score: 12-15)
Jaren Johnson attempts a 3Pt. Contested by Cole Griffin (3.8 feet, MAN). Jaren Johnson misses. Offensive rebound by Jaren Johnson! Jaren Johnson kicks it out.

[05:21] Team_068 possession (Score: 12-15)
Jaren Johnson attempts a 3Pt. Contested by Cole Griffin (3.8 feet, MAN). Jaren Johnson misses. Offensive rebound by Nikola Ginobili! Nikola Ginobili's putback is no good. Rebound secured by Kyrie Adebayo.

[05:11] Team_096 possession (Score: 12-15)
Kyrie Adebayo drives and kicks out. Terry Mobley attempts a 3Pt. Contested by Zion Anunoby (4.4 feet, ZONE). TERRY MOBLEY MAKES IT! Assist: Kyrie Adebayo
Score: 15-15

[04:54] Team_068 possession (Score: 15-15)
Zion Anunoby attempts a 3Pt. Contested by Cole Griffin (3.7 feet, ZONE). Zion Anunoby misses. Rebound secured by Kyrie Adebayo.

[04:37] Team_096 possession (Score: 15-15)
Kyrie Adebayo drives, picks up Nikola Ginobili. Help arrives from Malcolm Herro! Kyrie Adebayo attempts a Dunk. Contested by Malcolm Herro (4.8 feet, MAN). KYRIE ADEBAYO MAKES IT! Assist: Terry Mobley
Score: 17-15

[04:19] Team_068 possession (Score: 17-15)
Malcolm Herro drives and kicks out. Gary Simons attempts a 3Pt. Contested by Lamelo Quickley (4.0 feet, ZONE). Gary Simons misses. Rebound secured by Scottie Herro.

[04:04] Team_096 possession (Score: 17-15)
Cole Griffin attempts a Layup. Contested by Jaren Johnson (4.0 feet, MAN). Cole Griffin misses. Rebound secured by Gary Simons.

[03:47] Team_068 possession (Score: 17-15)
Malcolm Herro attempts a 3Pt. Contested by Lamelo Quickley (4.0 feet, MAN). Malcolm Herro misses. Rebound secured by Kyrie Adebayo.

[03:31] Team_096 possession (Score: 17-15)
Kyrie Adebayo attempts a Layup. Contested by Nikola Ginobili (4.9 feet, MAN). KYRIE ADEBAYO MAKES IT!
Score: 19-15

[03:19] Team_068 possession (Score: 19-15)
Nikola Ginobili makes the Layup and draws the foul on Kyrie Adebayo! And-1! Nikola Ginobili to the line for 1. [BONUS: 5 team fouls] (Kyrie Adebayo: 2 personal fouls)   FT 1/1: GOOD Nikola Ginobili makes 1/1 from the line.
Score: 19-18

[03:06] Team_096 possession (Score: 19-18)
Kyrie Adebayo makes the Layup and draws the foul on Nikola Ginobili! And-1! Kyrie Adebayo to the line for 1. [Team fouls: 4] (Nikola Ginobili: 2 personal fouls)   FT 1/1: GOOD Kyrie Adebayo makes 1/1 from the line.
Score: 22-18

[02:54] Team_068 possession (Score: 22-18)
Jaren Johnson attempts a Midrange. Contested by Cole Griffin (3.9 feet, MAN). Jaren Johnson misses. Rebound secured by Cole Griffin.

[02:40] Team_096 possession (Score: 22-18)
Scottie Herro drives to the basket... Scottie Herro throws a bad pass! Stolen by Gary Simons! TURNOVER! (live ball)

[02:21] Team_068 possession (Score: 22-18)
Jaren Johnson attempts a 3Pt. Contested by Cole Griffin (4.0 feet, ZONE). Jaren Johnson misses. Offensive rebound by Jaren Johnson! Jaren Johnson kicks it out.

[02:05] Team_068 possession (Score: 22-18)
Gary Simons attempts a Midrange. Contested by Scottie Herro (6.0 feet, ZONE). Gary Simons misses. Rebound secured by Cole Griffin.

[01:51] Team_096 possession (Score: 22-18)
Terry Mobley makes the Layup and draws the foul on Gary Simons! And-1! Terry Mobley to the line for 1. [BONUS: 5 team fouls] (Gary Simons: 2 personal fouls)   FT 1/1: MISS Terry Mobley makes 0/1 from the line. Rebound secured by Jaren Johnson.
Score: 24-18

[01:35] Team_068 possession (Score: 24-18)
Zion Anunoby attempts a 3Pt. Contested by Terry Mobley (5.2 feet, ZONE). Zion Anunoby misses. Offensive rebound by Nikola Ginobili! Nikola Ginobili's putback is no good. Rebound secured by Kyrie Adebayo.

[01:19] Team_096 possession (Score: 24-18)
Lamelo Quickley attempts a Layup. Contested by Gary Simons (3.2 feet, ZONE). Lamelo Quickley misses. Rebound secured by Gary Simons.

[01:00] Team_068 possession (Score: 24-18)
Jaren Johnson attempts a 3Pt. Contested by Cole Griffin (4.1 feet, MAN). Jaren Johnson misses. Offensive rebound by Nikola Ginobili! Nikola Ginobili puts it back in!
Score: 24-20

[00:45] Team_096 possession (Score: 24-20)
Lamelo Quickley attempts a 3Pt. Contested by Malcolm Herro (4.1 feet, MAN). Lamelo Quickley misses. Rebound secured by Jaren Johnson.

[00:33] Team_068 possession (Score: 24-20)
Zion Anunoby attempts a 3Pt. Contested by Cole Griffin (4.1 feet, ZONE). Zion Anunoby misses. Offensive rebound by Jaren Johnson! Jaren Johnson kicks it out.

[00:19] Team_068 possession (Score: 24-20)
Malcolm Herro attempts a 3Pt. Contested by Lamelo Quickley (4.4 feet, MAN). Malcolm Herro misses. Offensive rebound by Nikola Ginobili! Nikola Ginobili puts it back in!
Score: 24-22

[00:04] Team_096 possession (Score: 24-22)
Terry Mobley attempts a Layup. Contested by Zion Anunoby (4.9 feet, MAN). Terry Mobley misses. Rebound secured by Nikola Ginobili.

================================================================================
                              1ST QUARTER COMPLETE                              
================================================================================

1ST QUARTER SCORE: Team_096 24, Team_068 22

BOX SCORE:
================================================================================

Team_096
--------------------------------------------------------------------------------
Player                MIN  PTS  REB  AST  TO      FG   FG%      3P   3P%
--------------------------------------------------------------------------------
Terry Mobley           12    9    0    1   0   3/7    42.9     0/0   0.0
Lamelo Quickley        12    4    0    0   0   2/6    33.3     0/0   0.0
Scottie Herro          12    0    6    2   0   0/1     0.0     0/0   0.0
Cole Griffin           12    0    2    1   0   0/1     0.0     0/0   0.0

TEAM: FG: 9/19 (47.4%), 3PT: 2/5 (40.0%), REB: 11 (1 off, 10 def), AST: 5, TO: 4
TEAM FOULS: 5 [Team_068 in BONUS]


Team_068
--------------------------------------------------------------------------------
Player                MIN  PTS  REB  AST  TO      FG   FG%      3P   3P%
--------------------------------------------------------------------------------
Nikola Ginobili        12   16    3    1   0   6/6   100.0     0/0   0.0
Kyrie Adebayo          12    9    5    1   0   4/4   100.0     0/0   0.0
Malcolm Herro          12    6    0    1   0   2/6    33.3     0/0   0.0
Gary Simons            12    0    4    0   0   0/2     0.0     0/0   0.0
Jaren Johnson          12    0    8    0   0   0/3     0.0     0/0   0.0
Zion Anunoby           12    0    0    0   0   0/3     0.0     0/0   0.0

TEAM: FG: 8/20 (40.0%), 3PT: 3/8 (37.5%), REB: 17 (7 off, 10 def), AST: 2, TO: 2
TEAM FOULS: 5 [Team_096 in BONUS]

================================================================================

================================================================================
                       2ND QUARTER - Team_096 vs Team_068                       
================================================================================

[12:00] Team_096 possession (Score: 24-22)
Lamelo Quickley attempts a 3Pt. Contested by Zion Anunoby (4.1 feet, ZONE). Lamelo Quickley misses. Rebound secured by Gary Simons.

[11:49] Team_068 possession (Score: 24-22)
Zion Anunoby makes the Dunk and draws the foul on Kyrie Adebayo! And-1! Zion Anunoby to the line for 1. [Team fouls: 1] (Kyrie Adebayo: 1 personal fouls)   FT 1/1: GOOD Zion Anunoby makes 1/1 from the line.
Score: 24-25

[11:32] Team_096 possession (Score: 24-25)
Lamelo Quickley drives to the basket... Lamelo Quickley loses control! Ball rolls out of bounds! TURNOVER! (dead ball)

[11:32] Substitution (Team_096): Terry Mobley OUT → Cade Jokic IN (stamina_rule2)

[11:32] Substitution (Team_096): Lamelo Quickley OUT → Jarrett Markkanen IN (stamina_rule2)

[11:32] Substitution (Team_096): Cole Griffin OUT → Cole Holiday IN (stamina_rule2)

[11:32] Substitution (Team_096): Scottie Herro OUT → Tyler Haliburton IN (stamina_rule2)

[11:32] Substitution (Team_068): Zion Anunoby OUT → Cole Anthony IN (stamina_rule2)

[11:32] Substitution (Team_068): Malcolm Herro OUT → Ja Banchero IN (stamina_rule2)

[11:32] Substitution (Team_068): Jaren Johnson OUT → Miles Murray IN (stamina_rule2)

[11:32] Substitution (Team_068): Gary Simons OUT → Jarrett Oladipo IN (stamina_rule2)

[11:32] Substitution (Team_068): Nikola Ginobili OUT → Franz Curry IN (stamina_rule2)

[11:16] Team_068 possession (Score: 24-25)
Ja Banchero attempts a 3Pt. Contested by Cade Jokic (5.5 feet, ZONE). Ja Banchero misses. Offensive rebound by Franz Curry! Franz Curry's putback is no good. Rebound secured by Jarrett Markkanen.

[11:00] Team_096 possession (Score: 24-25)
Cole Holiday attempts a 3Pt. Contested by Cole Anthony (5.0 feet, ZONE). Cole Holiday misses. Rebound secured by Jarrett Oladipo.

[10:45] Team_068 possession (Score: 24-25)
Cole Anthony attempts a Midrange. Contested by Cade Jokic (5.2 feet, MAN). Cole Anthony misses. Rebound secured by Kyrie Adebayo.

[10:30] Team_096 possession (Score: 24-25)
Kyrie Adebayo drives, picks up Franz Curry. Help arrives from Ja Banchero! Kyrie Adebayo attempts a Layup. Contested by Ja Banchero (4.9 feet, MAN). Kyrie Adebayo misses. Rebound secured by Franz Curry.

[10:17] Team_068 possession (Score: 24-25)
Miles Murray attempts a Midrange. Contested by Tyler Haliburton (5.2 feet, ZONE). MILES MURRAY MAKES IT!
Score: 24-27

[10:02] Team_096 possession (Score: 24-27)
Cade Jokic throws a bad pass out of bounds! TURNOVER! (dead ball)

[10:02] Substitution (Team_096): Kyrie Adebayo OUT → Devin Griffin IN (stamina_rule2)

[09:49] Team_068 possession (Score: 24-27)
Ja Banchero attempts a 3Pt. Contested by Cade Jokic (5.5 feet, ZONE). Ja Banchero misses. Rebound secured by Devin Griffin.

[09:38] Team_096 possession (Score: 24-27)
Devin Griffin drives to the basket... FOUL! Offensive foul on Devin Griffin! Franz Curry drew the charge! [Team fouls: 2] (Devin Griffin: 1 personal fouls) TURNOVER! (dead ball)

[09:25] Team_068 possession (Score: 24-27)
Franz Curry attempts a Layup. Contested by Devin Griffin (5.1 feet, ZONE). FRANZ CURRY MAKES IT!
Score: 24-29

[09:06] Team_096 possession (Score: 24-29)
Cade Jokic attempts a Layup. Contested by Franz Curry (4.4 feet, ZONE). CADE JOKIC MAKES IT!
Score: 26-29

[08:55] Team_068 possession (Score: 26-29)
FOUL! Offensive foul on Ja Banchero! Jarrett Markkanen drew the charge! [Team fouls: 1] (Ja Banchero: 1 personal fouls) TURNOVER! (dead ball)

[08:39] Team_096 possession (Score: 26-29)
Cole Holiday attempts a Midrange. Contested by Miles Murray (4.2 feet, MAN). Cole Holiday misses. Offensive rebound by Devin Griffin! Devin Griffin kicks it out.

[08:23] Team_096 possession (Score: 26-29)
Cade Jokic makes the Dunk and draws the foul on Franz Curry! And-1! Cade Jokic to the line for 1. [Team fouls: 2] (Franz Curry: 1 personal fouls)   FT 1/1: GOOD Cade Jokic makes 1/1 from the line.
Score: 29-29

[08:06] Team_068 possession (Score: 29-29)
Miles Murray drives to the basket... Miles Murray loses the ball! Stripped by Cole Holiday! TURNOVER! (live ball)

[07:54] Team_096 possession (Score: 29-29)
Devin Griffin attempts a 3Pt. Contested by Franz Curry (4.4 feet, MAN). Devin Griffin misses. Offensive rebound by Devin Griffin! Devin Griffin kicks it out.

[07:40] Team_096 possession (Score: 29-29)
Cade Jokic drives to the basket... Cade Jokic throws a bad pass out of bounds! TURNOVER! (dead ball)

[07:28] Team_068 possession (Score: 29-29)
Miles Murray attempts a Midrange. Contested by Devin Griffin (4.8 feet, ZONE). MILES MURRAY MAKES IT!
Score: 29-31

[07:15] Team_096 possession (Score: 29-31)
Tyler Haliburton attempts a Layup. Contested by Jarrett Oladipo (3.8 feet, MAN). TYLER HALIBURTON MAKES IT!
Score: 31-31

[06:59] Team_068 possession (Score: 31-31)
Franz Curry makes the Dunk and draws the foul on Devin Griffin! And-1! Franz Curry to the line for 1. [Team fouls: 3] (Devin Griffin: 2 personal fouls)   FT 1/1: GOOD Franz Curry makes 1/1 from the line.
Score: 31-34

[06:48] Team_096 possession (Score: 31-34)
FOUL! Offensive foul on Jarrett Markkanen! Ja Banchero drew the charge! [Team fouls: 4] (Jarrett Markkanen: 1 personal fouls) TURNOVER! (dead ball)

[06:33] Team_068 possession (Score: 31-34)
Jarrett Oladipo attempts a Midrange. Contested by Tyler Haliburton (5.4 feet, MAN). Jarrett Oladipo misses. Rebound secured by Devin Griffin.

[06:20] Team_096 possession (Score: 31-34)
Devin Griffin drives to the basket... Devin Griffin loses control! Ball rolls out of bounds! TURNOVER! (dead ball)

[06:05] Team_068 possession (Score: 31-34)
FOUL! Reach-in foul on Jarrett Markkanen during the drive. [IN THE BONUS! 5 team fouls] Ja Banchero to the line for 2 free throws. (Jarrett Markkanen: 2 personal fouls)   FT 1/2: GOOD   FT 2/2: GOOD Ja Banchero makes 2/2 from the line.
Score: 31-36

[05:53] Team_096 possession (Score: 31-36)
Cole Holiday makes the Dunk and draws the foul on Franz Curry! And-1! Cole Holiday to the line for 1. [Team fouls: 3] (Franz Curry: 2 personal fouls)   FT 1/1: GOOD Cole Holiday makes 1/1 from the line.
Score: 34-36

[05:43] Team_068 possession (Score: 34-36)
Miles Murray attempts a 3Pt. Contested by Cade Jokic (5.5 feet, ZONE). Miles Murray misses. Rebound secured by Tyler Haliburton.

[05:30] Team_096 possession (Score: 34-36)
Jarrett Markkanen attempts a 3Pt. Contested by Ja Banchero (4.8 feet, MAN). JARRETT MARKKANEN MAKES IT! Assist: Cade Jokic
Score: 37-36

[05:17] Team_068 possession (Score: 37-36)
Cole Anthony drives and kicks out. Franz Curry attempts a 3Pt. Contested by Devin Griffin (4.7 feet, MAN). Franz Curry misses. Rebound secured by Tyler Haliburton.

[05:00] Team_096 possession (Score: 37-36)
Jarrett Markkanen attempts a Layup. BLOCKED BY MILES MURRAY! Ball is loose! Offensive rebound by Tyler Haliburton! Tyler Haliburton kicks it out.

[04:47] Team_096 possession (Score: 37-36)
Tyler Haliburton makes the Dunk and draws the foul on Jarrett Oladipo! And-1! Tyler Haliburton to the line for 1. [Team fouls: 4] (Jarrett Oladipo: 1 personal fouls)   FT 1/1: GOOD Tyler Haliburton makes 1/1 from the line.
Score: 40-36

[04:37] Team_068 possession (Score: 40-36)
FOUL! Shooting foul on Devin Griffin. Jarrett Oladipo to the line for 2 free throws. [BONUS: 6 team fouls] (Devin Griffin: 3 personal fouls)   FT 1/2: MISS   FT 2/2: GOOD Jarrett Oladipo makes 1/2 from the line.
Score: 40-37

[04:26] Team_096 possession (Score: 40-37)
FOUL! Shooting foul on Franz Curry. Devin Griffin to the line for 2 free throws. [BONUS: 5 team fouls] (Franz Curry: 3 personal fouls)   FT 1/2: MISS   FT 2/2: MISS Devin Griffin makes 0/2 from the line. Rebound secured by Jarrett Oladipo.

[04:14] Team_068 possession (Score: 40-37)
FOUL! Reach-in foul on Devin Griffin during the drive. [IN THE BONUS! 7 team fouls] Cole Anthony to the line for 2 free throws. (Devin Griffin: 4 personal fouls)   FT 1/2: GOOD   FT 2/2: GOOD Cole Anthony makes 2/2 from the line.
Score: 40-39

[04:00] Team_096 possession (Score: 40-39)
Tyler Haliburton attempts a 3Pt. Contested by Jarrett Oladipo (3.9 feet, MAN). TYLER HALIBURTON MAKES IT! Assist: Cole Holiday
Score: 43-39

[03:47] Team_068 possession (Score: 43-39)
Miles Murray drives and kicks out. Miles Murray attempts a Midrange. Contested by Cole Holiday (4.7 feet, MAN). Miles Murray misses. Offensive rebound by Jarrett Oladipo! Jarrett Oladipo kicks it out.

[03:32] Team_068 possession (Score: 43-39)
Jarrett Oladipo attempts a 3Pt. Contested by Tyler Haliburton (5.5 feet, MAN). Jarrett Oladipo misses. Rebound secured by Tyler Haliburton.

[03:17] Team_096 possession (Score: 43-39)
FOUL! Shooting foul on Franz Curry. Cade Jokic to the line for 2 free throws. [BONUS: 6 team fouls] (Franz Curry: 4 personal fouls)   FT 1/2: GOOD   FT 2/2: GOOD Cade Jokic makes 2/2 from the line.
Score: 45-39

[03:04] Team_068 possession (Score: 45-39)
Miles Murray attempts a 3Pt. Contested by Cade Jokic (5.6 feet, ZONE). Miles Murray misses. Rebound secured by Tyler Haliburton.

[02:48] Team_096 possession (Score: 45-39)
Tyler Haliburton loses control! Ball rolls out of bounds! TURNOVER! (dead ball)

[02:30] Team_068 possession (Score: 45-39)
Cole Anthony attempts a Layup. Contested by Devin Griffin (4.7 feet, ZONE). Cole Anthony misses. Rebound secured by Tyler Haliburton.

[02:15] Team_096 possession (Score: 45-39)
Jarrett Markkanen drives, Franz Curry stays with him. Jarrett Markkanen attempts a Dunk. Contested by Franz Curry (4.2 feet, ZONE). Jarrett Markkanen misses. Rebound secured by Jarrett Oladipo.

[02:00] Team_068 possession (Score: 45-39)
Ja Banchero attempts a Midrange. Contested by Tyler Haliburton (5.4 feet, ZONE). Ja Banchero misses. Rebound secured by Devin Griffin.

[01:44] Team_096 possession (Score: 45-39)
Tyler Haliburton attempts a Midrange. Contested by Jarrett Oladipo (4.1 feet, MAN). Tyler Haliburton misses. Rebound secured by Ja Banchero.

[01:32] Team_068 possession (Score: 45-39)
Franz Curry drives to the basket... Franz Curry loses control! Ball rolls out of bounds! TURNOVER! (dead ball)

[01:18] Team_096 possession (Score: 45-39)
Devin Griffin drives, Franz Curry stays with him. Devin Griffin attempts a Layup. Contested by Franz Curry (4.7 feet, MAN). DEVIN GRIFFIN MAKES IT!
Score: 47-39

[01:04] Team_068 possession (Score: 47-39)
Miles Murray attempts a Midrange. Contested by Tyler Haliburton (5.5 feet, ZONE). Miles Murray misses. Rebound secured by Jarrett Markkanen.

[00:47] Team_096 possession (Score: 47-39)
Jarrett Markkanen attempts a Layup. Contested by Ja Banchero (5.1 feet, MAN). JARRETT MARKKANEN MAKES IT!
Score: 49-39

[00:33] Team_068 possession (Score: 49-39)
Ja Banchero attempts a 3Pt. Contested by Cade Jokic (5.8 feet, ZONE). Ja Banchero misses. Rebound secured by Jarrett Markkanen.

[00:19] Team_096 possession (Score: 49-39)
Cade Jokic attempts a 3Pt. Contested by Cole Anthony (5.1 feet, ZONE). Cade Jokic misses. Rebound secured by Ja Banchero.

[00:07] Team_068 possession (Score: 49-39)
Miles Murray attempts a 3Pt. Contested by Cole Holiday (5.2 feet, MAN). Miles Murray misses. Rebound secured by Devin Griffin.

================================================================================
                              2ND QUARTER COMPLETE                              
================================================================================

2ND QUARTER SCORE: Team_096 25, Team_068 17

BOX SCORE:
================================================================================

Team_096
--------------------------------------------------------------------------------
Player                MIN  PTS  REB  AST  TO      FG   FG%      3P   3P%
--------------------------------------------------------------------------------
Tyler Haliburton       11    8    6    0   0   3/4    75.0     0/0   0.0
Cade Jokic             11    7    0    1   0   3/4    75.0     0/0   0.0
Jarrett Markkanen      11    5    3    0   0   2/3    66.7     0/0   0.0
Cole Holiday           11    3    0    1   0   1/2    50.0     0/0   0.0
Devin Griffin          10    2    6    0   0   1/2    50.0     0/0   0.0
Lamelo Quickley        13    0    0    0   0   0/1     0.0     0/0   0.0
Kyrie Adebayo          14    0    1    0   0   0/1     0.0     0/0   0.0

TEAM: FG: 10/17 (58.8%), 3PT: 2/5 (40.0%), REB: 15 (3 off, 12 def), AST: 2, TO: 7
TEAM FOULS: 7 [Team_068 in BONUS]


Team_068
--------------------------------------------------------------------------------
Player                MIN  PTS  REB  AST  TO      FG   FG%      3P   3P%
--------------------------------------------------------------------------------
Franz Curry            11    5    1    0   0   2/2   100.0     0/0   0.0
Miles Murray           11    4    0    0   0   2/6    33.3     0/0   0.0
Zion Anunoby           13    3    0    0   0   1/1   100.0     0/0   0.0
Ja Banchero            11    2    2    0   0   1/5    20.0     0/0   0.0
Cole Anthony           11    2    0    0   0   1/4    25.0     0/0   0.0
Jarrett Oladipo        11    1    4    0   0   1/3    33.3     0/0   0.0
Gary Simons            13    0    1    0   0   0/0     0.0     0/0   0.0

TEAM: FG: 8/21 (38.1%), 3PT: 0/7 (0.0%), REB: 9 (2 off, 7 def), AST: 0, TO: 3
TEAM FOULS: 6 [Team_096 in BONUS]

================================================================================

================================================================================
                       3RD QUARTER - Team_096 vs Team_068                       
================================================================================

[12:00] Team_096 possession (Score: 49-39)
Lamelo Quickley attempts a Midrange. Contested by Malcolm Herro (3.7 feet, ZONE). Lamelo Quickley misses. Rebound secured by Gary Simons.

[11:46] Team_068 possession (Score: 49-39)
Malcolm Herro attempts a Layup. BLOCKED BY KYRIE ADEBAYO! Ball deflects out of bounds off Malcolm Herro.

[11:32] Team_096 possession (Score: 49-39)
Cole Griffin attempts a 3Pt. Contested by Jaren Johnson (3.9 feet, MAN). Cole Griffin misses. Rebound secured by Nikola Ginobili.

[11:15] Team_068 possession (Score: 49-39)
Nikola Ginobili drives and kicks out. Zion Anunoby makes the 3Pt and draws the foul on Cole Griffin! And-1! Zion Anunoby to the line for 1. [Team fouls: 1] (Cole Griffin: 1 personal fouls)   FT 1/1: GOOD Zion Anunoby makes 1/1 from the line.
Score: 49-43

[11:04] Team_096 possession (Score: 49-43)
Kyrie Adebayo drives to the basket... Kyrie Adebayo commits a violation (traveling/carry)! TURNOVER! (dead ball)

[10:50] Team_068 possession (Score: 49-43)
Malcolm Herro attempts a Midrange. Contested by Kyrie Adebayo (4.0 feet, ZONE). Malcolm Herro misses. Rebound secured by Scottie Herro.

[10:35] Team_096 possession (Score: 49-43)
Kyrie Adebayo attempts a 3Pt. Contested by Zion Anunoby (5.0 feet, ZONE). Kyrie Adebayo misses. Rebound secured by Gary Simons.

[10:17] Team_068 possession (Score: 49-43)
FOUL! Shooting foul on Lamelo Quickley. Nikola Ginobili to the line for 2 free throws. [Team fouls: 2] (Lamelo Quickley: 1 personal fouls)   FT 1/2: GOOD   FT 2/2: GOOD Nikola Ginobili makes 2/2 from the line.
Score: 49-45

[10:01] Team_096 possession (Score: 49-45)
Kyrie Adebayo attempts a Midrange. Contested by Jaren Johnson (4.2 feet, ZONE). KYRIE ADEBAYO MAKES IT! Assist: Scottie Herro
Score: 51-45

[09:44] Team_068 possession (Score: 51-45)
Nikola Ginobili makes the Dunk and draws the foul on Kyrie Adebayo! And-1! Nikola Ginobili to the line for 1. [Team fouls: 3] (Kyrie Adebayo: 1 personal fouls)   FT 1/1: MISS Nikola Ginobili makes 0/1 from the line. Rebound secured by Cole Griffin.
Score: 51-47

[09:33] Team_096 possession (Score: 51-47)
Scottie Herro drives and kicks out. Lamelo Quickley attempts a Midrange. Contested by Malcolm Herro (4.2 feet, MAN). Lamelo Quickley misses. Rebound secured by Jaren Johnson.

[09:15] Team_068 possession (Score: 51-47)
FOUL! Holding foul on Scottie Herro. [Team fouls: 4] No free throws, side out. (Scottie Herro: 1 personal fouls)

[08:57] Team_068 possession (Score: 51-47)
Malcolm Herro attempts a 3Pt. Contested by Cole Griffin (3.3 feet, ZONE). Malcolm Herro misses. Rebound secured by Kyrie Adebayo.

[08:42] Team_096 possession (Score: 51-47)
Terry Mobley drives to the basket... Terry Mobley loses the ball! Stripped by Gary Simons! TURNOVER! (live ball)

[08:28] Team_068 possession (Score: 51-47)
Jaren Johnson attempts a 3Pt. Contested by Cole Griffin (3.8 feet, MAN). Jaren Johnson misses. Rebound secured by Scottie Herro.

[08:18] Team_096 possession (Score: 51-47)
Kyrie Adebayo attempts a Layup. Contested by Gary Simons (3.8 feet, ZONE). Kyrie Adebayo misses. Offensive rebound by Scottie Herro! Scottie Herro kicks it out.

[08:05] Team_096 possession (Score: 51-47)
Kyrie Adebayo attempts a 3Pt. Contested by Nikola Ginobili (4.7 feet, MAN). Kyrie Adebayo misses. Offensive rebound by Scottie Herro! Scottie Herro kicks it out.

[07:47] Team_096 possession (Score: 51-47)
Kyrie Adebayo attempts a Midrange. Contested by Nikola Ginobili (4.7 feet, MAN). Kyrie Adebayo misses. Rebound secured by Gary Simons.

[07:36] Team_068 possession (Score: 51-47)
Gary Simons drives, picks up Kyrie Adebayo. Help arrives from Lamelo Quickley! Gary Simons attempts a Layup. Contested by Lamelo Quickley (4.8 feet, ZONE). GARY SIMONS MAKES IT! Assist: Jaren Johnson
Score: 51-49

[07:19] Team_096 possession (Score: 51-49)
Scottie Herro attempts a 3Pt. Contested by Zion Anunoby (4.5 feet, ZONE). Scottie Herro misses. Rebound secured by Nikola Ginobili.

[07:02] Team_068 possession (Score: 51-49)
Gary Simons attempts a 3Pt. Contested by Cole Griffin (4.1 feet, ZONE). Gary Simons misses. Rebound secured by Scottie Herro.

[06:48] Team_096 possession (Score: 51-49)
Cole Griffin attempts a 3Pt. Contested by Zion Anunoby (4.7 feet, ZONE). Cole Griffin misses. Rebound secured by Nikola Ginobili.

[06:30] Team_068 possession (Score: 51-49)
FOUL! Holding foul on Cole Griffin. [IN THE BONUS! 5 team fouls] Jaren Johnson to the line for 2 free throws. (Cole Griffin: 2 personal fouls)   FT 1/2: GOOD   FT 2/2: GOOD Jaren Johnson makes 2/2 from the line.
Score: 51-51

[06:17] Team_096 possession (Score: 51-51)
Lamelo Quickley drives, Gary Simons stays with him. Lamelo Quickley attempts a Layup. Contested by Gary Simons (2.7 feet, ZONE). LAMELO QUICKLEY MAKES IT!
Score: 53-51

[06:03] Team_068 possession (Score: 53-51)
Gary Simons attempts a 3Pt. Contested by Cole Griffin (4.1 feet, ZONE). GARY SIMONS MAKES IT! Assist: Nikola Ginobili
Score: 53-54

[05:50] Team_096 possession (Score: 53-54)
Cole Griffin drives to the basket... Cole Griffin loses control! Ball rolls out of bounds! TURNOVER! (dead ball)

[05:35] Team_068 possession (Score: 53-54)
Jaren Johnson drives to the basket... Jaren Johnson loses the ball! Stripped by Cole Griffin! TURNOVER! (live ball)

[05:24] Team_096 possession (Score: 53-54)
Scottie Herro attempts a Midrange. Contested by Gary Simons (3.3 feet, ZONE). Scottie Herro misses. Offensive rebound by Scottie Herro! Scottie Herro kicks it out.

[05:10] Team_096 possession (Score: 53-54)
Lamelo Quickley attempts a 3Pt. Contested by Gary Simons (2.7 feet, ZONE). Lamelo Quickley misses. Rebound secured by Nikola Ginobili.

[04:54] Team_068 possession (Score: 53-54)
Jaren Johnson attempts a 3Pt. Contested by Cole Griffin (3.8 feet, MAN). Jaren Johnson misses. Offensive rebound by Jaren Johnson! Jaren Johnson kicks it out.

[04:41] Team_068 possession (Score: 53-54)
Nikola Ginobili drives, Kyrie Adebayo stays with him. Nikola Ginobili attempts a Dunk. Contested by Kyrie Adebayo (4.0 feet, MAN). NIKOLA GINOBILI MAKES IT! Assist: Zion Anunoby
Score: 53-56

[04:27] Team_096 possession (Score: 53-56)
Cole Griffin attempts a 3Pt. BLOCKED BY JAREN JOHNSON! Ball deflects out of bounds off Cole Griffin.

[04:08] Team_068 possession (Score: 53-56)
Gary Simons attempts a 3Pt. Contested by Cole Griffin (4.2 feet, ZONE). GARY SIMONS MAKES IT! Assist: Zion Anunoby
Score: 53-59

[03:50] Team_096 possession (Score: 53-59)
Lamelo Quickley drives and kicks out. Cole Griffin attempts a 3Pt. Contested by Jaren Johnson (3.7 feet, ZONE). COLE GRIFFIN MAKES IT! Assist: Scottie Herro
Score: 56-59

[03:34] Team_068 possession (Score: 56-59)
Nikola Ginobili attempts a 3Pt. Contested by Kyrie Adebayo (4.1 feet, MAN). NIKOLA GINOBILI MAKES IT! Assist: Malcolm Herro
Score: 56-62

[03:21] Team_096 possession (Score: 56-62)
Scottie Herro attempts a Midrange. Contested by Gary Simons (3.5 feet, MAN). Scottie Herro misses. Rebound secured by Jaren Johnson.

[03:08] Team_068 possession (Score: 56-62)
Nikola Ginobili drives, picks up Kyrie Adebayo. Help arrives from Lamelo Quickley! Nikola Ginobili attempts a Layup. Contested by Lamelo Quickley (4.1 feet, MAN). Nikola Ginobili misses. Rebound secured by Kyrie Adebayo.

[02:55] Team_096 possession (Score: 56-62)
Cole Griffin drives, Jaren Johnson stays with him. Cole Griffin attempts a Layup. Contested by Jaren Johnson (4.1 feet, MAN). Cole Griffin misses. Rebound secured by Jaren Johnson.

[02:45] Team_068 possession (Score: 56-62)
Zion Anunoby attempts a 3Pt. Contested by Terry Mobley (5.1 feet, MAN). Zion Anunoby misses. Rebound secured by Scottie Herro.

[02:32] Team_096 possession (Score: 56-62)
Cole Griffin drives to the basket... Cole Griffin loses the ball! Stripped by Jaren Johnson! TURNOVER! (live ball)

[02:15] Team_068 possession (Score: 56-62)
FOUL! Shooting foul on Cole Griffin. Jaren Johnson to the line for 2 free throws. [BONUS: 6 team fouls] (Cole Griffin: 3 personal fouls)   FT 1/2: GOOD   FT 2/2: GOOD Jaren Johnson makes 2/2 from the line.
Score: 56-64

[01:58] Team_096 possession (Score: 56-64)
Terry Mobley attempts a 3Pt. Contested by Zion Anunoby (4.7 feet, ZONE). Terry Mobley misses. Rebound secured by Nikola Ginobili.

[01:42] Team_068 possession (Score: 56-64)
Jaren Johnson attempts a Midrange. Contested by Cole Griffin (4.0 feet, MAN). JAREN JOHNSON MAKES IT!
Score: 56-66

[01:30] Team_096 possession (Score: 56-66)
Cole Griffin drives, Gary Simons stays with him. Cole Griffin attempts a Layup. Contested by Gary Simons (3.9 feet, ZONE). Cole Griffin misses. Rebound secured by Nikola Ginobili.

[01:18] Team_068 possession (Score: 56-66)
Malcolm Herro attempts a 3Pt. Contested by Lamelo Quickley (4.3 feet, MAN). MALCOLM HERRO MAKES IT! Assist: Nikola Ginobili
Score: 56-69

[01:08] Team_096 possession (Score: 56-69)
Scottie Herro makes the Dunk and draws the foul on Gary Simons! And-1! Scottie Herro to the line for 1. [Team fouls: 1] (Gary Simons: 1 personal fouls)   FT 1/1: GOOD Scottie Herro makes 1/1 from the line.
Score: 59-69

[00:57] Team_068 possession (Score: 59-69)
Gary Simons attempts a Layup. Wide open! Scottie Herro is 6.1 feet away. [MAN] GARY SIMONS MAKES IT!
Score: 59-71

[00:43] Team_096 possession (Score: 59-71)
Terry Mobley commits a violation (traveling/carry)! TURNOVER! (dead ball)

[00:43] Substitution (Team_096): Terry Mobley OUT → Cade Jokic IN (stamina_rule2)

[00:43] Substitution (Team_096): Lamelo Quickley OUT → Jarrett Markkanen IN (stamina_rule2)

[00:43] Substitution (Team_096): Cole Griffin OUT → Cole Holiday IN (stamina_rule2)

[00:43] Substitution (Team_096): Scottie Herro OUT → Tyler Haliburton IN (stamina_rule2)

[00:43] Substitution (Team_096): Kyrie Adebayo OUT → Devin Griffin IN (stamina_rule2)

[00:43] Substitution (Team_068): Zion Anunoby OUT → Cole Anthony IN (stamina_rule2)

[00:43] Substitution (Team_068): Malcolm Herro OUT → Ja Banchero IN (stamina_rule2)

[00:43] Substitution (Team_068): Jaren Johnson OUT → Miles Murray IN (stamina_rule2)

[00:43] Substitution (Team_068): Gary Simons OUT → Jarrett Oladipo IN (stamina_rule2)

[00:43] Substitution (Team_068): Nikola Ginobili OUT → Franz Curry IN (stamina_rule2)

[00:25] Team_068 possession (Score: 59-71)
Franz Curry attempts a Midrange. Contested by Cade Jokic (5.8 feet, ZONE). Franz Curry misses. Offensive rebound by Franz Curry! Franz Curry's putback is no good. Rebound secured by Jarrett Markkanen.

[00:12] Team_096 possession (Score: 59-71)
Cade Jokic attempts a 3Pt. Contested by Cole Anthony (4.8 feet, MAN). CADE JOKIC MAKES IT! Assist: Devin Griffin
Score: 62-71

================================================================================
                              3RD QUARTER COMPLETE                              
================================================================================

3RD QUARTER SCORE: Team_096 13, Team_068 32

BOX SCORE:
================================================================================

Team_096
--------------------------------------------------------------------------------
Player                MIN  PTS  REB  AST  TO      FG   FG%      3P   3P%
--------------------------------------------------------------------------------
Cole Griffin           25    3    1    0   0   1/6    16.7     0/0   0.0
Scottie Herro          25    3    7    2   0   1/4    25.0     0/0   0.0
Cade Jokic             12    3    0    0   0   1/1   100.0     0/0   0.0
Lamelo Quickley        25    2    0    0   0   1/3    33.3     0/0   0.0
Kyrie Adebayo          26    2    2    0   0   1/3    33.3     0/0   0.0
Terry Mobley           25    0    0    0   0   0/1     0.0     0/0   0.0
Devin Griffin          10    0    0    1   0   0/0     0.0     0/0   0.0

TEAM: FG: 5/18 (27.8%), 3PT: 1/8 (12.5%), REB: 10 (3 off, 7 def), AST: 3, TO: 5
TEAM FOULS: 6 [Team_068 in BONUS]


Team_068
--------------------------------------------------------------------------------
Player                MIN  PTS  REB  AST  TO      FG   FG%      3P   3P%
--------------------------------------------------------------------------------
Gary Simons            25   10    3    0   0   4/5    80.0     0/0   0.0
Nikola Ginobili        25    7    6    2   0   3/5    60.0     0/0   0.0
Jaren Johnson          25    6    4    1   0   3/4    75.0     0/0   0.0
Zion Anunoby           25    4    0    2   0   1/2    50.0     0/0   0.0
Malcolm Herro          25    3    0    1   0   1/4    25.0     0/0   0.0
Franz Curry            12    0    0    0   0   0/1     0.0     0/0   0.0
Jarrett Markkanen      12    0    1    0   0   0/0     0.0     0/0   0.0

TEAM: FG: 12/21 (57.1%), 3PT: 4/8 (50.0%), REB: 14 (2 off, 12 def), AST: 6, TO: 1
TEAM FOULS: 1

================================================================================

================================================================================
                       4TH QUARTER - Team_096 vs Team_068                       
================================================================================

[12:00] Team_096 possession (Score: 62-71)
Terry Mobley drives and kicks out. Lamelo Quickley attempts a 3Pt. Contested by Zion Anunoby (4.6 feet, ZONE). Lamelo Quickley misses. Rebound secured by Jaren Johnson.

[11:46] Team_068 possession (Score: 62-71)
Jaren Johnson attempts a Layup. Contested by Cole Griffin (4.0 feet, MAN). Jaren Johnson misses. Rebound secured by Kyrie Adebayo.

[11:34] Team_096 possession (Score: 62-71)
Terry Mobley drives to the basket... Terry Mobley loses control! Ball rolls out of bounds! TURNOVER! (dead ball)

[11:34] Substitution (Team_096): Terry Mobley OUT → Cade Jokic IN (stamina_rule2)

[11:34] Substitution (Team_096): Lamelo Quickley OUT → Jarrett Markkanen IN (stamina_rule2)

[11:34] Substitution (Team_096): Scottie Herro OUT → Tyler Haliburton IN (stamina_rule2)

[11:34] Substitution (Team_068): Malcolm Herro OUT → Ja Banchero IN (stamina_rule2)

[11:34] Substitution (Team_068): Jaren Johnson OUT → Miles Murray IN (stamina_rule2)

[11:34] Substitution (Team_068): Gary Simons OUT → Jarrett Oladipo IN (stamina_rule2)

[11:34] Substitution (Team_068): Nikola Ginobili OUT → Franz Curry IN (stamina_rule2)

[11:21] Team_068 possession (Score: 62-71)
Jarrett Oladipo drives and kicks out. Miles Murray attempts a 3Pt. Contested by Cole Griffin (3.6 feet, ZONE). Miles Murray misses. Rebound secured by Kyrie Adebayo.

[11:07] Team_096 possession (Score: 62-71)
Jarrett Markkanen attempts a Midrange. Contested by Ja Banchero (4.8 feet, MAN). JARRETT MARKKANEN MAKES IT! Assist: Tyler Haliburton
Score: 64-71

[10:55] Team_068 possession (Score: 64-71)
Franz Curry makes the Layup and draws the foul on Kyrie Adebayo! And-1! Franz Curry to the line for 1. [Team fouls: 1] (Kyrie Adebayo: 1 personal fouls)   FT 1/1: GOOD Franz Curry makes 1/1 from the line.
Score: 64-74

[10:42] Team_096 possession (Score: 64-74)
Cole Griffin attempts a 3Pt. Contested by Miles Murray (4.2 feet, MAN). COLE GRIFFIN MAKES IT! Assist: Tyler Haliburton
Score: 67-74

[10:31] Team_068 possession (Score: 67-74)
Franz Curry drives, Kyrie Adebayo stays with him. Franz Curry attempts a Dunk. Contested by Kyrie Adebayo (4.8 feet, ZONE). FRANZ CURRY MAKES IT! Assist: Jarrett Oladipo
Score: 67-76

[10:14] Team_096 possession (Score: 67-76)
Cade Jokic drives to the basket... Cade Jokic throws a bad pass out of bounds! TURNOVER! (dead ball)

[10:14] Substitution (Team_096): Cole Griffin OUT → Cole Holiday IN (stamina_rule2)

[10:14] Substitution (Team_096): Kyrie Adebayo OUT → Devin Griffin IN (stamina_rule2)

[10:14] Substitution (Team_068): Zion Anunoby OUT → Cole Anthony IN (stamina_rule2)

[10:02] Team_068 possession (Score: 67-76)
Miles Murray drives, picks up Devin Griffin. Help arrives from Jarrett Markkanen! Miles Murray attempts a Dunk. Contested by Jarrett Markkanen (4.8 feet, ZONE). MILES MURRAY MAKES IT! Assist: Cole Anthony
Score: 67-78

[09:47] Team_096 possession (Score: 67-78)
Tyler Haliburton attempts a Midrange. Contested by Jarrett Oladipo (3.8 feet, MAN). Tyler Haliburton misses. Rebound secured by Ja Banchero.

[09:36] Team_068 possession (Score: 67-78)
Ja Banchero attempts a 3Pt. Contested by Jarrett Markkanen (4.4 feet, MAN). JA BANCHERO MAKES IT! Assist: Miles Murray
Score: 67-81

[09:23] Team_096 possession (Score: 67-81)
Devin Griffin attempts a Midrange. Contested by Miles Murray (4.0 feet, ZONE). Devin Griffin misses. Rebound secured by Jarrett Oladipo.

[09:09] Team_068 possession (Score: 67-81)
Jarrett Oladipo attempts a Layup. Contested by Tyler Haliburton (5.4 feet, MAN). JARRETT OLADIPO MAKES IT! Assist: Miles Murray
Score: 67-83

[08:56] Team_096 possession (Score: 67-83)
Cade Jokic attempts a Layup. Contested by Cole Anthony (4.8 feet, MAN). CADE JOKIC MAKES IT!
Score: 69-83

[08:41] Team_068 possession (Score: 69-83)
Jarrett Oladipo attempts a Layup. Contested by Tyler Haliburton (5.4 feet, MAN). Jarrett Oladipo misses. Rebound secured by Tyler Haliburton.

[08:23] Team_096 possession (Score: 69-83)
FOUL! Holding foul on Miles Murray. [Team fouls: 1] No free throws, side out. (Miles Murray: 1 personal fouls)

[08:08] Team_096 possession (Score: 69-83)
Cole Holiday attempts a 3Pt. Contested by Ja Banchero (5.4 feet, ZONE). Cole Holiday misses. Rebound secured by Jarrett Oladipo.

[07:53] Team_068 possession (Score: 69-83)
Ja Banchero attempts a Midrange. Contested by Cole Holiday (4.7 feet, ZONE). Ja Banchero misses. Offensive rebound by Jarrett Oladipo! Jarrett Oladipo kicks it out.

[07:36] Team_068 possession (Score: 69-83)
Cole Anthony attempts a Midrange. Contested by Jarrett Markkanen (4.1 feet, ZONE). Cole Anthony misses. Rebound secured by Devin Griffin.

[07:23] Team_096 possession (Score: 69-83)
Tyler Haliburton attempts a Layup. BLOCKED BY JARRETT OLADIPO! Ball is loose! Offensive rebound by Devin Griffin! Devin Griffin kicks it out.

[07:05] Team_096 possession (Score: 69-83)
Jarrett Markkanen attempts a 3Pt. Contested by Ja Banchero (4.8 feet, ZONE). Jarrett Markkanen misses. Rebound secured by Franz Curry.

[06:49] Team_068 possession (Score: 69-83)
Franz Curry attempts a Layup. Contested by Devin Griffin (5.1 feet, ZONE). FRANZ CURRY MAKES IT! Assist: Jarrett Oladipo
Score: 69-85

[06:32] Team_096 possession (Score: 69-85)
Jarrett Markkanen attempts a Layup. Contested by Jarrett Oladipo (3.5 feet, ZONE). Jarrett Markkanen misses. Rebound secured by Ja Banchero.

[06:18] Team_068 possession (Score: 69-85)
Ja Banchero attempts a 3Pt. Contested by Jarrett Markkanen (4.4 feet, MAN). Ja Banchero misses. Rebound secured by Jarrett Markkanen.

[06:07] Team_096 possession (Score: 69-85)
Tyler Haliburton attempts a Layup. Contested by Jarrett Oladipo (3.8 feet, MAN). TYLER HALIBURTON MAKES IT!
Score: 71-85

[05:50] Team_068 possession (Score: 71-85)
Franz Curry drives, picks up Devin Griffin. Help arrives from Jarrett Markkanen! Franz Curry attempts a Layup. Contested by Jarrett Markkanen (5.1 feet, MAN). FRANZ CURRY MAKES IT!
Score: 71-87

[05:36] Team_096 possession (Score: 71-87)
Cole Holiday attempts a Midrange. Contested by Franz Curry (4.6 feet, ZONE). COLE HOLIDAY MAKES IT! Assist: Tyler Haliburton
Score: 73-87

[05:26] Team_068 possession (Score: 73-87)
Jarrett Oladipo attempts a 3Pt. Contested by Tyler Haliburton (5.4 feet, MAN). Jarrett Oladipo misses. Rebound secured by Jarrett Markkanen.

[05:13] Team_096 possession (Score: 73-87)
Cole Holiday drives and kicks out. Cade Jokic attempts a Midrange. Contested by Cole Anthony (4.7 feet, MAN). CADE JOKIC MAKES IT!
Score: 75-87

[04:57] Team_068 possession (Score: 75-87)
Franz Curry attempts a Midrange. Contested by Devin Griffin (5.1 feet, MAN). FRANZ CURRY MAKES IT!
Score: 75-89

[04:40] Team_096 possession (Score: 75-89)
Devin Griffin attempts a Midrange. Contested by Miles Murray (4.0 feet, ZONE). Devin Griffin misses. Rebound secured by Jarrett Oladipo.

[04:27] Team_068 possession (Score: 75-89)
Jarrett Oladipo attempts a Midrange. Contested by Tyler Haliburton (5.5 feet, MAN). JARRETT OLADIPO MAKES IT!
Score: 75-91

[04:18] Team_096 possession (Score: 75-91)
Tyler Haliburton attempts a Layup. BLOCKED BY JARRETT OLADIPO! Ball is loose! Offensive rebound by Tyler Haliburton! Tyler Haliburton kicks it out.

[04:05] Team_096 possession (Score: 75-91)
Tyler Haliburton drives to the basket... FOUL! Offensive foul on Tyler Haliburton! Franz Curry drew the charge! [Team fouls: 2] (Tyler Haliburton: 1 personal fouls) TURNOVER! (dead ball)

[03:47] Team_068 possession (Score: 75-91)
Franz Curry attempts a Midrange. Contested by Devin Griffin (5.1 feet, MAN). Franz Curry misses. Rebound secured by Tyler Haliburton.

[03:32] Team_096 possession (Score: 75-91)
FOUL! Reach-in foul on Jarrett Oladipo during the drive. [Team fouls: 4] No free throws, side out. (Jarrett Oladipo: 1 personal fouls)

[03:15] Team_096 possession (Score: 75-91)
FOUL! Shooting foul on Miles Murray. Cade Jokic to the line for 3 free throws. [BONUS: 5 team fouls] (Miles Murray: 2 personal fouls)   FT 1/3: GOOD   FT 2/3: GOOD   FT 3/3: GOOD Cade Jokic makes 3/3 from the line.
Score: 78-91

[03:02] Team_068 possession (Score: 78-91)
FOUL! Offensive foul on Miles Murray! Cole Holiday drew the charge! [Team fouls: 6] (Miles Murray: 3 personal fouls) TURNOVER! (dead ball)

[02:43] Team_096 possession (Score: 78-91)
Tyler Haliburton attempts a 3Pt. Contested by Jarrett Oladipo (4.0 feet, MAN). Tyler Haliburton misses. Rebound secured by Ja Banchero.

[02:26] Team_068 possession (Score: 78-91)
Jarrett Oladipo attempts a Midrange. Contested by Jarrett Markkanen (4.8 feet, ZONE). JARRETT OLADIPO MAKES IT! Assist: Cole Anthony
Score: 78-93

[02:09] Team_096 possession (Score: 78-93)
Tyler Haliburton attempts a Midrange. Contested by Jarrett Oladipo (4.1 feet, MAN). TYLER HALIBURTON MAKES IT!
Score: 80-93

[01:57] Team_068 possession (Score: 80-93)
Jarrett Oladipo attempts a Layup. Contested by Tyler Haliburton (5.7 feet, MAN). Jarrett Oladipo misses. Rebound secured by Tyler Haliburton.

[01:46] Team_096 possession (Score: 80-93)
Cole Holiday attempts a 3Pt. Contested by Ja Banchero (5.7 feet, ZONE). Cole Holiday misses. Rebound secured by Franz Curry.

[01:32] Team_068 possession (Score: 80-93)
Jarrett Oladipo attempts a Layup. Contested by Tyler Haliburton (5.7 feet, MAN). JARRETT OLADIPO MAKES IT!
Score: 80-95

[01:19] Team_096 possession (Score: 80-95)
FOUL! Holding foul on Cole Anthony. [IN THE BONUS! 7 team fouls] Cade Jokic to the line for 2 free throws. (Cole Anthony: 1 personal fouls)   FT 1/2: GOOD   FT 2/2: MISS Cade Jokic makes 1/2 from the line. Offensive rebound by Cole Holiday! Cole Holiday kicks it out.
Score: 81-95

[01:03] Team_096 possession (Score: 81-95)
Cade Jokic makes the Layup and draws the foul on Franz Curry! And-1! Cade Jokic to the line for 1. [BONUS: 8 team fouls] (Franz Curry: 2 personal fouls)   FT 1/1: GOOD Cade Jokic makes 1/1 from the line.
Score: 84-95

[00:51] Team_068 possession (Score: 84-95)
Franz Curry drives to the basket... Franz Curry loses the ball! Stripped by Devin Griffin! TURNOVER! (live ball)

[00:35] Team_096 possession (Score: 84-95)
Cade Jokic attempts a 3Pt. Contested by Cole Anthony (4.9 feet, MAN). Cade Jokic misses. Rebound secured by Ja Banchero.

[00:22] Team_068 possession (Score: 84-95)
Ja Banchero attempts a 3Pt. Contested by Cade Jokic (5.8 feet, ZONE). Ja Banchero misses. Rebound secured by Cole Holiday.

[00:09] Team_096 possession (Score: 84-95)
Jarrett Markkanen attempts a Midrange. Contested by Jarrett Oladipo (4.1 feet, ZONE). Jarrett Markkanen misses. Rebound secured by Franz Curry.

================================================================================
                              4TH QUARTER COMPLETE                              
================================================================================

4TH QUARTER SCORE: Team_096 22, Team_068 24

BOX SCORE:
================================================================================

Team_096
--------------------------------------------------------------------------------
Player                MIN  PTS  REB  AST  TO      FG   FG%      3P   3P%
--------------------------------------------------------------------------------
Cade Jokic             23   10    0    0   0   4/5    80.0     0/0   0.0
Tyler Haliburton       23    4    4    3   0   2/4    50.0     0/0   0.0
Cole Griffin           27    3    0    0   0   1/1   100.0     0/0   0.0
Jarrett Markkanen      23    2    2    0   0   1/4    25.0     0/0   0.0
Cole Holiday           22    2    2    0   0   1/3    33.3     0/0   0.0
Terry Mobley           25    0    0    0   0   0/1     0.0     0/0   0.0
Kyrie Adebayo          28    0    2    0   0   0/0     0.0     0/0   0.0
Devin Griffin          21    0    2    0   0   0/2     0.0     0/0   0.0

TEAM: FG: 9/20 (45.0%), 3PT: 2/7 (28.6%), REB: 12 (3 off, 9 def), AST: 3, TO: 3
TEAM FOULS: 2


Team_068
--------------------------------------------------------------------------------
Player                MIN  PTS  REB  AST  TO      FG   FG%      3P   3P%
--------------------------------------------------------------------------------
Franz Curry            23   11    3    0   0   5/6    83.3     0/0   0.0
Jarrett Oladipo        23    8    4    2   0   4/8    50.0     0/0   0.0
Ja Banchero            23    3    4    0   0   1/3    33.3     0/0   0.0
Miles Murray           23    2    0    2   0   1/1   100.0     0/0   0.0
Jaren Johnson          25    0    1    0   0   0/1     0.0     0/0   0.0
Cole Anthony           22    0    0    2   0   0/1     0.0     0/0   0.0

TEAM: FG: 11/20 (55.0%), 3PT: 1/4 (25.0%), REB: 12 (1 off, 11 def), AST: 6, TO: 2
TEAM FOULS: 8 [Team_096 in BONUS]

================================================================================

================================================================================
                               FULL GAME COMPLETE                               
================================================================================

FINAL SCORE: Team_096 84, Team_068 95

SCORING BY QUARTER:
--------------------------------------------------------------------------------
Team                     Q1     Q2     Q3     Q4    FINAL
--------------------------------------------------------------------------------
Team_096                 24     25     13     22       84
Team_068                 22     17     32     24       95
--------------------------------------------------------------------------------

FULL GAME BOX SCORE:
================================================================================

Team_096
--------------------------------------------------------------------------------
Player                MIN  PTS  REB  AST  TO      FG   FG%      3P   3P%      FT STL BLK
--------------------------------------------------------------------------------
Kyrie Adebayo          28   11   10    1   1   5/8    62.5   0/1     0.0   1/1     1   1
Cole Griffin           27    6    3    1   2   2/8    25.0   1/4    25.0   0/0     1   0
Terry Mobley           25    9    0    1   4   2/8    25.0   2/3    66.7   0/1     0   0
Lamelo Quickley        25    6    0    0   2   4/11   36.4   0/5     0.0   2/2     0   0
Scottie Herro          25    3   13    4   2   1/5    20.0   0/1     0.0   1/1     0   0
Cade Jokic             23   20    0    1   2   7/9    77.8   2/4    50.0   8/9     0   0
Jarrett Markkanen      23    7    6    0   2   3/7    42.9   1/2    50.0   0/0     0   0
Tyler Haliburton       23   12   10    3   1   5/8    62.5   1/2    50.0   1/1     0   0
Cole Holiday           22    5    2    1   2   3/6    50.0   0/3     0.0   1/1     1   0
Devin Griffin          21    2    8    1   1   1/4    25.0   0/0     0.0   0/2     1   0

TEAM: FG: 33/74 (44.6%), 3PT: 7/25 (28.0%), REB: 48 (10 off, 38 def), AST: 13, TO: 19


Team_068
--------------------------------------------------------------------------------
Player                MIN  PTS  REB  AST  TO      FG   FG%      3P   3P%      FT STL BLK
--------------------------------------------------------------------------------
Zion Anunoby           27    7    0    2   1   1/5    20.0   0/4     0.0   2/2     0   0
Malcolm Herro          25    9    0    2   0   4/11   36.4   3/5    60.0   1/1     0   0
Jaren Johnson          25    6   13    1   1   3/8    37.5   1/3    33.3   4/4     1   1
Gary Simons            25   10    8    0   0   4/7    57.1   2/3    66.7   0/0     2   0
Nikola Ginobili        25   23    9    3   1   8/10   80.0   1/1   100.0   5/6     0   0
Ja Banchero            23    5    6    0   1   2/8    25.0   1/6    16.7   2/2     0   0
Miles Murray           23    6    0    2   1   3/7    42.9   0/3     0.0   0/0     0   1
Jarrett Oladipo        23    9    8    2   1   5/11   45.5   0/2     0.0   1/2     0   2
Franz Curry            23   16    4    0   0   7/9    77.8   0/0     0.0   2/2     0   0
Cole Anthony           22    2    0    2   2   1/5    20.0   0/0     0.0   2/2     0   0

TEAM: FG: 39/82 (47.6%), 3PT: 8/27 (29.6%), REB: 52 (12 off, 40 def), AST: 14, TO: 8

================================================================================
