================================================================================
                        FULL GAME - Team_077 vs Team_027                        
================================================================================

================================================================================
                       1ST QUARTER - Team_077 vs Team_027                       
================================================================================

[12:00] Team_077 possession (Score: 0-0)
Russell Harden drives and kicks out. Russell Harden attempts a 3Pt. Contested by Bradley Dosunmu (4.4 feet, MAN). Russell Harden misses. Offensive rebound by Russell Harden! Russell Harden kicks it out.

[11:48] Team_077 possession (Score: 0-0)
FOUL! Holding foul on Scottie Harden. [Team fouls: 1] No free throws, side out. (Scottie Harden: 1 personal fouls)

[11:35] Team_077 possession (Score: 0-0)
Russell Harden attempts a Layup. Contested by Bradley Dosunmu (5.0 feet, MAN). Russell Harden misses. Rebound secured by Bradley Dosunmu.

[11:20] Team_027 possession (Score: 0-0)
Scottie Harden attempts a Layup. Contested by Chris Ginobili (3.8 feet, MAN). Scottie Harden misses. Rebound secured by Draymond Dosunmu.

[11:05] Team_077 possession (Score: 0-0)
Russell Harden attempts a Midrange. Contested by Bradley Dosunmu (5.0 feet, MAN). RUSSELL HARDEN MAKES IT!
Score: 2-0

[10:51] Team_027 possession (Score: 2-0)
Tony Doncic attempts a 3Pt. Contested by Dejounte Allen (3.9 feet, ZONE). TONY DONCIC MAKES IT! Assist: Tim Johnson
Score: 2-3

[10:39] Team_077 possession (Score: 2-3)
Draymond Dosunmu drives to the basket... FOUL! Offensive foul on Draymond Dosunmu! John Russell drew the charge! [Team fouls: 1] (Draymond Dosunmu: 1 personal fouls) TURNOVER! (dead ball)

[10:24] Team_027 possession (Score: 2-3)
Scottie Harden loses control! Ball rolls out of bounds! TURNOVER! (dead ball)

[10:07] Team_077 possession (Score: 2-3)
Russell Harden attempts a 3Pt. Contested by Tim Johnson (5.5 feet, ZONE). Russell Harden misses. Rebound secured by Tony Doncic.

[09:55] Team_027 possession (Score: 2-3)
Scottie Harden attempts a 3Pt. Contested by Dejounte Allen (3.8 feet, ZONE). Scottie Harden misses. Rebound secured by Draymond Dosunmu.

[09:44] Team_077 possession (Score: 2-3)
Draymond Dosunmu drives, John Russell stays with him. Draymond Dosunmu attempts a Layup. Contested by John Russell (3.6 feet, ZONE). DRAYMOND DOSUNMU MAKES IT! Assist: Chris Ginobili
Score: 4-3

[09:25] Team_027 possession (Score: 4-3)
Scottie Harden loses control! Ball rolls out of bounds! TURNOVER! (dead ball)

[09:08] Team_077 possession (Score: 4-3)
Chris Ginobili attempts a Midrange. Contested by Scottie Harden (5.1 feet, MAN). Chris Ginobili misses. Rebound secured by Bradley Dosunmu.

[08:53] Team_027 possession (Score: 4-3)
Scottie Harden drives to the basket... Scottie Harden loses control! Ball rolls out of bounds! TURNOVER! (dead ball)

[08:40] Team_077 possession (Score: 4-3)
Draymond Dosunmu attempts a Layup. BLOCKED BY JOHN RUSSELL! Ball is loose! Offensive rebound by Draymond Dosunmu! Draymond Dosunmu kicks it out.

[08:28] Team_077 possession (Score: 4-3)
Russell Harden attempts a Layup. Contested by Bradley Dosunmu (5.0 feet, MAN). RUSSELL HARDEN MAKES IT! Assist: Dejounte Allen
Score: 6-3

[08:13] Team_027 possession (Score: 6-3)
Bradley Dosunmu makes the Dunk and draws the foul on Russell Harden! And-1! Bradley Dosunmu to the line for 1. [Team fouls: 2] (Russell Harden: 1 personal fouls)   FT 1/1: GOOD Bradley Dosunmu makes 1/1 from the line.
Score: 6-6

[07:56] Team_077 possession (Score: 6-6)
Dejounte Allen attempts a 3Pt. Contested by Tony Doncic (4.4 feet, MAN). Dejounte Allen misses. Rebound secured by John Russell.

[07:41] Team_027 possession (Score: 6-6)
Bradley Dosunmu attempts a Layup. Contested by Russell Harden (4.5 feet, MAN). BRADLEY DOSUNMU MAKES IT!
Score: 6-8

[07:31] Team_077 possession (Score: 6-8)
FOUL! Shooting foul on Tony Doncic. Draymond Dosunmu to the line for 2 free throws. [Team fouls: 3] (Tony Doncic: 1 personal fouls)   FT 1/2: GOOD   FT 2/2: GOOD Draymond Dosunmu makes 2/2 from the line.
Score: 8-8

[07:12] Team_027 possession (Score: 8-8)
Bradley Dosunmu attempts a Midrange. Contested by Russell Harden (4.5 feet, MAN). Bradley Dosunmu misses. FOUL! Loose ball foul on Draymond Dosunmu during the rebound battle. [Team fouls: 3] No free throws, side out. (Draymond Dosunmu: 2 personal fouls)

[07:01] Team_027 possession (Score: 8-8)
Tony Doncic attempts a Midrange. Contested by Dejounte Allen (3.9 feet, ZONE). Tony Doncic misses. Rebound secured by Russell Harden.

[06:47] Team_077 possession (Score: 8-8)
Ja Ball drives to the basket... FOUL! Offensive foul on Ja Ball! Tim Johnson drew the charge! [Team fouls: 4] (Ja Ball: 1 personal fouls) TURNOVER! (dead ball)

[06:28] Team_027 possession (Score: 8-8)
Scottie Harden makes the Dunk and draws the foul on Chris Ginobili! And-1! Scottie Harden to the line for 1. [BONUS: 5 team fouls] (Chris Ginobili: 1 personal fouls)   FT 1/1: GOOD Scottie Harden makes 1/1 from the line.
Score: 8-11

[06:15] Team_077 possession (Score: 8-11)
FOUL! Shooting foul on John Russell. Russell Harden to the line for 2 free throws. [Team fouls: 4] (John Russell: 1 personal fouls)   FT 1/2: GOOD   FT 2/2: GOOD Russell Harden makes 2/2 from the line.
Score: 10-11

[06:03] Team_027 possession (Score: 10-11)
Bradley Dosunmu drives, picks up Draymond Dosunmu. Help arrives from Ja Ball! Bradley Dosunmu attempts a Dunk. Contested by Ja Ball (4.4 feet, ZONE). Bradley Dosunmu misses. Rebound secured by Russell Harden.

[05:46] Team_077 possession (Score: 10-11)
Dejounte Allen attempts a Midrange. Contested by Scottie Harden (5.0 feet, ZONE). DEJOUNTE ALLEN MAKES IT!
Score: 12-11

[05:31] Team_027 possession (Score: 12-11)
John Russell drives and kicks out. Bradley Dosunmu makes the 3Pt and draws the foul on Russell Harden! And-1! Bradley Dosunmu to the line for 1. [BONUS: 6 team fouls] (Russell Harden: 2 personal fouls)   FT 1/1: GOOD Bradley Dosunmu makes 1/1 from the line.
Score: 12-15

[05:19] Team_077 possession (Score: 12-15)
FOUL! Reach-in foul on John Russell during the drive. [IN THE BONUS! 5 team fouls] Draymond Dosunmu to the line for 2 free throws. (John Russell: 2 personal fouls)   FT 1/2: GOOD   FT 2/2: GOOD Draymond Dosunmu makes 2/2 from the line.
Score: 14-15

[05:00] Team_027 possession (Score: 14-15)
John Russell drives, Draymond Dosunmu stays with him. John Russell attempts a Layup. Contested by Draymond Dosunmu (5.1 feet, ZONE). JOHN RUSSELL MAKES IT! Assist: Scottie Harden
Score: 14-17

[04:51] Team_077 possession (Score: 14-17)
FOUL! Reach-in foul on Scottie Harden during the drive. [IN THE BONUS! 6 team fouls] Chris Ginobili to the line for 2 free throws. (Scottie Harden: 2 personal fouls)   FT 1/2: GOOD   FT 2/2: GOOD Chris Ginobili makes 2/2 from the line.
Score: 16-17

[04:36] Team_027 possession (Score: 16-17)
Tim Johnson makes the Layup and draws the foul on Ja Ball! And-1! Tim Johnson to the line for 1. [BONUS: 7 team fouls] (Ja Ball: 2 personal fouls)   FT 1/1: GOOD Tim Johnson makes 1/1 from the line.
Score: 16-20

[04:18] Team_077 possession (Score: 16-20)
Chris Ginobili attempts a 3Pt. Contested by Scottie Harden (5.2 feet, MAN). Chris Ginobili misses. Rebound secured by John Russell.

[04:02] Team_027 possession (Score: 16-20)
Tony Doncic attempts a Midrange. Contested by Dejounte Allen (3.9 feet, ZONE). Tony Doncic misses. Offensive rebound by John Russell! John Russell puts it back in!
Score: 16-22

[03:46] Team_077 possession (Score: 16-22)
Dejounte Allen drives and kicks out. Russell Harden attempts a 3Pt. Contested by Tim Johnson (5.0 feet, ZONE). Russell Harden misses. Offensive rebound by Russell Harden! Russell Harden kicks it out.

[03:31] Team_077 possession (Score: 16-22)
FOUL! Reach-in foul on John Russell during the drive. [IN THE BONUS! 7 team fouls] Russell Harden to the line for 2 free throws. (John Russell: 3 personal fouls)   FT 1/2: GOOD   FT 2/2: GOOD Russell Harden makes 2/2 from the line.
Score: 18-22

[03:13] Team_027 possession (Score: 18-22)
Scottie Harden attempts a 3Pt. Contested by Dejounte Allen (3.9 feet, ZONE). Scottie Harden misses. Rebound secured by Draymond Dosunmu.

[02:56] Team_077 possession (Score: 18-22)
Russell Harden attempts a 3Pt. Contested by Tim Johnson (5.6 feet, ZONE). Russell Harden misses. Rebound secured by Tony Doncic.

[02:41] Team_027 possession (Score: 18-22)
Tim Johnson attempts a 3Pt. Contested by Ja Ball (4.5 feet, MAN). Tim Johnson misses. Rebound secured by Chris Ginobili.

[02:25] Team_077 possession (Score: 18-22)
Dejounte Allen attempts a 3Pt. Contested by Tim Johnson (5.6 feet, ZONE). DEJOUNTE ALLEN MAKES IT! Assist: Draymond Dosunmu
Score: 21-22

[02:12] Team_027 possession (Score: 21-22)
Tim Johnson attempts a 3Pt. Contested by Ja Ball (4.5 feet, MAN). TIM JOHNSON MAKES IT! Assist: Tony Doncic
Score: 21-25

[01:59] Team_077 possession (Score: 21-25)
Ja Ball attempts a 3Pt. Contested by Tim Johnson (5.6 feet, ZONE). Ja Ball misses. Rebound secured by Bradley Dosunmu.

[01:44] Team_027 possession (Score: 21-25)
FOUL! Holding foul on Ja Ball. [IN THE BONUS! 8 team fouls] Tim Johnson to the line for 2 free throws. (Ja Ball: 3 personal fouls)   FT 1/2: GOOD   FT 2/2: GOOD Tim Johnson makes 2/2 from the line.
Score: 21-27

[01:29] Team_077 possession (Score: 21-27)
FOUL! Offensive foul on Draymond Dosunmu! John Russell drew the charge! [Team fouls: 9] (Draymond Dosunmu: 3 personal fouls) TURNOVER! (dead ball)

[01:13] Team_027 possession (Score: 21-27)
John Russell drives, Russell Harden stays with him. John Russell attempts a Layup. Contested by Russell Harden (5.5 feet, ZONE). JOHN RUSSELL MAKES IT! Assist: Scottie Harden
Score: 21-29

[00:56] Team_077 possession (Score: 21-29)
Ja Ball attempts a 3Pt. Contested by Tim Johnson (5.7 feet, MAN). Ja Ball misses. Rebound secured by Tony Doncic.

[00:42] Team_027 possession (Score: 21-29)
Tim Johnson attempts a 3Pt. Contested by Ja Ball (4.7 feet, MAN). Tim Johnson misses. Rebound secured by Russell Harden.

[00:31] Team_077 possession (Score: 21-29)
Dejounte Allen attempts a 3Pt. Contested by Tim Johnson (5.8 feet, ZONE). Dejounte Allen misses. Rebound secured by John Russell.

[00:17] Team_027 possession (Score: 21-29)
Tony Doncic attempts a 3Pt. Contested by Dejounte Allen (4.3 feet, ZONE). Tony Doncic misses. Rebound secured by Chris Ginobili.

================================================================================
                              1ST QUARTER COMPLETE                              
================================================================================

1ST QUARTER SCORE: Team_077 21, Team_027 29

BOX SCORE:
================================================================================

Team_077
--------------------------------------------------------------------------------
Player                MIN  PTS  REB  AST  TO      FG   FG%      3P   3P%
--------------------------------------------------------------------------------
Russell Harden         12    8    5    0   0   4/7    57.1     0/0   0.0
Draymond Dosunmu       12    6    4    1   0   3/3   100.0     0/0   0.0
Dejounte Allen         12    5    0    1   0   2/4    50.0     0/0   0.0
Chris Ginobili         12    2    2    1   0   1/3    33.3     0/0   0.0
Ja Ball                12    0    0    0   0   0/2     0.0     0/0   0.0

TEAM: FG: 10/19 (52.6%), 3PT: 1/8 (12.5%), REB: 11 (3 off, 8 def), AST: 3, TO: 3
TEAM FOULS: 9 [Team_027 in BONUS]


Team_027
--------------------------------------------------------------------------------
Player                MIN  PTS  REB  AST  TO      FG   FG%      3P   3P%
--------------------------------------------------------------------------------
Bradley Dosunmu        12    9    4    0   0   3/4    75.0     0/0   0.0
Tim Johnson            12    8    0    1   0   3/5    60.0     0/0   0.0
John Russell           12    6    4    0   0   3/3   100.0     0/0   0.0
Scottie Harden         12    3    0    2   0   1/4    25.0     0/0   0.0
Tony Doncic            12    3    3    1   0   1/3    33.3     0/0   0.0

TEAM: FG: 11/19 (57.9%), 3PT: 2/7 (28.6%), REB: 11 (2 off, 9 def), AST: 4, TO: 3
TEAM FOULS: 7 [Team_077 in BONUS]

================================================================================

================================================================================
                       2ND QUARTER - Team_077 vs Team_027                       
================================================================================

[12:00] Team_077 possession (Score: 21-29)
Dejounte Allen makes the Dunk and draws the foul on Scottie Harden! And-1! Dejounte Allen to the line for 1. [Team fouls: 1] (Scottie Harden: 1 personal fouls)   FT 1/1: MISS Dejounte Allen makes 0/1 from the line. Offensive rebound by Russell Harden! Russell Harden kicks it out.
Score: 23-29

[11:49] Team_077 possession (Score: 23-29)
Russell Harden attempts a Layup. Contested by John Russell (4.8 feet, ZONE). RUSSELL HARDEN MAKES IT!
Score: 25-29

[11:34] Team_027 possession (Score: 25-29)
Tim Johnson attempts a Midrange. Contested by Ja Ball (4.6 feet, MAN). Tim Johnson misses. FOUL! Loose ball foul on Draymond Dosunmu during the rebound battle. [Team fouls: 1] No free throws, side out. (Draymond Dosunmu: 1 personal fouls)

[11:17] Team_027 possession (Score: 25-29)
John Russell drives, Draymond Dosunmu stays with him. John Russell attempts a Layup. Contested by Draymond Dosunmu (5.4 feet, MAN). JOHN RUSSELL MAKES IT!
Score: 25-31

[11:03] Team_077 possession (Score: 25-31)
FOUL! Reach-in foul on John Russell during the drive. [Team fouls: 2] No free throws, side out. (John Russell: 1 personal fouls)

[10:48] Team_077 possession (Score: 25-31)
Chris Ginobili attempts a 3Pt. Contested by Tim Johnson (5.8 feet, ZONE). CHRIS GINOBILI MAKES IT! Assist: Russell Harden
Score: 28-31

[10:36] Team_027 possession (Score: 28-31)
Tim Johnson attempts a 3Pt. Contested by Dejounte Allen (4.4 feet, ZONE). Tim Johnson misses. FOUL! Loose ball foul on Russell Harden during the rebound battle. [Team fouls: 2] No free throws, side out. (Russell Harden: 1 personal fouls)

[10:23] Team_027 possession (Score: 28-31)
FOUL! Holding foul on Chris Ginobili. [Team fouls: 3] No free throws, side out. (Chris Ginobili: 1 personal fouls)

[10:11] Team_027 possession (Score: 28-31)
Tony Doncic attempts a 3Pt. Contested by Dejounte Allen (4.3 feet, ZONE). Tony Doncic misses. Rebound secured by Draymond Dosunmu.

[09:57] Team_077 possession (Score: 28-31)
Ja Ball attempts a 3Pt. Contested by Tim Johnson (5.8 feet, ZONE). Ja Ball misses. Rebound secured by Tony Doncic.

[09:40] Team_027 possession (Score: 28-31)
John Russell attempts a Midrange. Contested by Draymond Dosunmu (5.5 feet, MAN). John Russell misses. Rebound secured by Russell Harden.

[09:27] Team_077 possession (Score: 28-31)
Ja Ball loses control! Ball rolls out of bounds! TURNOVER! (dead ball)

[09:27] Substitution (Team_077): Ja Ball OUT → Bam Bryant IN (stamina_rule2)

[09:27] Substitution (Team_077): Dejounte Allen OUT → Dejounte Quickley IN (stamina_rule2)

[09:27] Substitution (Team_077): Chris Ginobili OUT → Tyler Poole IN (stamina_rule2)

[09:27] Substitution (Team_077): Russell Harden OUT → Jordan Simmons IN (stamina_rule2)

[09:27] Substitution (Team_077): Draymond Dosunmu OUT → Ayo Griffin IN (stamina_rule2)

[09:27] Substitution (Team_027): Tim Johnson OUT → CJ Green IN (stamina_rule2)

[09:27] Substitution (Team_027): Tony Doncic OUT → Dirk Lillard IN (stamina_rule2)

[09:27] Substitution (Team_027): Scottie Harden OUT → Rudy Quickley IN (stamina_rule2)

[09:27] Substitution (Team_027): Bradley Dosunmu OUT → LeBron Russell IN (stamina_rule2)

[09:27] Substitution (Team_027): John Russell OUT → Ben Stewart IN (stamina_rule2)

[09:09] Team_027 possession (Score: 28-31)
Rudy Quickley attempts a 3Pt. Contested by Tyler Poole (4.6 feet, MAN). Rudy Quickley misses. Offensive rebound by Dirk Lillard! Dirk Lillard kicks it out.

[08:56] Team_027 possession (Score: 28-31)
Rudy Quickley throws a bad pass out of bounds! TURNOVER! (dead ball)

[08:41] Team_077 possession (Score: 28-31)
Ayo Griffin drives, Ben Stewart stays with him. Ayo Griffin attempts a Dunk. Contested by Ben Stewart (4.5 feet, MAN). Ayo Griffin misses. Rebound secured by LeBron Russell.

[08:25] Team_027 possession (Score: 28-31)
CJ Green attempts a Midrange. Wide open! Bam Bryant is 6.2 feet away. [MAN] CJ Green misses. FOUL! Loose ball foul on Tyler Poole during the rebound battle. [Team fouls: 4] No free throws, side out. (Tyler Poole: 1 personal fouls)

[08:15] Team_027 possession (Score: 28-31)
Dirk Lillard attempts a Layup. Contested by Jordan Simmons (4.0 feet, ZONE). DIRK LILLARD MAKES IT! Assist: Rudy Quickley
Score: 28-33

[08:01] Team_077 possession (Score: 28-33)
Jordan Simmons drives and kicks out. Tyler Poole attempts a 3Pt. Contested by Rudy Quickley (3.3 feet, ZONE). Tyler Poole misses. Rebound secured by Ben Stewart.

[07:45] Team_027 possession (Score: 28-33)
LeBron Russell drives, Ayo Griffin stays with him. LeBron Russell attempts a Dunk. Contested by Ayo Griffin (4.8 feet, ZONE). LEBRON RUSSELL MAKES IT!
Score: 28-35

[07:31] Team_077 possession (Score: 28-35)
Ayo Griffin throws a bad pass! Stolen by Ben Stewart! TURNOVER! (live ball)

[07:20] Team_027 possession (Score: 28-35)
Dirk Lillard attempts a 3Pt. Contested by Dejounte Quickley (4.3 feet, ZONE). DIRK LILLARD MAKES IT! Assist: CJ Green
Score: 28-38

[07:07] Team_077 possession (Score: 28-38)
Tyler Poole attempts a Midrange. Contested by Rudy Quickley (3.7 feet, MAN). Tyler Poole misses. Offensive rebound by Jordan Simmons! Jordan Simmons kicks it out.

[06:51] Team_077 possession (Score: 28-38)
Dejounte Quickley attempts a Layup. Contested by Ben Stewart (4.8 feet, ZONE). DEJOUNTE QUICKLEY MAKES IT! Assist: Jordan Simmons
Score: 30-38

[06:37] Team_027 possession (Score: 30-38)
FOUL! Holding foul on Dejounte Quickley. [IN THE BONUS! 5 team fouls] Dirk Lillard to the line for 2 free throws. (Dejounte Quickley: 1 personal fouls)   FT 1/2: GOOD   FT 2/2: GOOD Dirk Lillard makes 2/2 from the line.
Score: 30-40

[06:22] Team_077 possession (Score: 30-40)
Ayo Griffin drives to the basket... FOUL! Offensive foul on Ayo Griffin! LeBron Russell drew the charge! [Team fouls: 6] (Ayo Griffin: 1 personal fouls) TURNOVER! (dead ball)

[06:09] Team_027 possession (Score: 30-40)
Dirk Lillard attempts a Midrange. Contested by Dejounte Quickley (4.3 feet, MAN). Dirk Lillard misses. Rebound secured by Tyler Poole.

[05:55] Team_077 possession (Score: 30-40)
Bam Bryant attempts a 3Pt. Contested by Rudy Quickley (3.5 feet, ZONE). Bam Bryant misses. FOUL! Loose ball foul on Dirk Lillard during the rebound battle. [Team fouls: 3] No free throws, side out. (Dirk Lillard: 1 personal fouls)

[05:42] Team_077 possession (Score: 30-40)
Jordan Simmons attempts a Midrange. Contested by LeBron Russell (5.9 feet, MAN). Jordan Simmons misses. Rebound secured by LeBron Russell.

[05:28] Team_027 possession (Score: 30-40)
CJ Green attempts a 3Pt. Wide open! Bam Bryant is 6.2 feet away. [MAN] CJ GREEN MAKES IT! Assist: Rudy Quickley
Score: 30-43

[05:15] Team_077 possession (Score: 30-43)
Ayo Griffin throws a bad pass! Stolen by Ben Stewart! TURNOVER! (live ball)

[04:59] Team_027 possession (Score: 30-43)
FOUL! Holding foul on Jordan Simmons. [IN THE BONUS! 7 team fouls] LeBron Russell to the line for 2 free throws. (Jordan Simmons: 1 personal fouls)   FT 1/2: GOOD   FT 2/2: GOOD LeBron Russell makes 2/2 from the line.
Score: 30-45

[04:45] Team_077 possession (Score: 30-45)
Dejounte Quickley attempts a 3Pt. Contested by Rudy Quickley (3.4 feet, ZONE). Dejounte Quickley misses. Rebound secured by LeBron Russell.

[04:25] Team_027 possession (Score: 30-45)
LeBron Russell makes the Dunk and draws the foul on Dejounte Quickley! And-1! LeBron Russell to the line for 1. [BONUS: 8 team fouls] (Dejounte Quickley: 2 personal fouls)   FT 1/1: GOOD LeBron Russell makes 1/1 from the line.
Score: 30-48

[04:15] Team_077 possession (Score: 30-48)
Dejounte Quickley attempts a Layup. Contested by Ben Stewart (4.8 feet, ZONE). DEJOUNTE QUICKLEY MAKES IT! Assist: Bam Bryant
Score: 32-48

[03:59] Team_027 possession (Score: 32-48)
Ben Stewart drives to the basket... FOUL! Offensive foul on Ben Stewart! Ayo Griffin drew the charge! [Team fouls: 4] (Ben Stewart: 1 personal fouls) TURNOVER! (dead ball)

[03:49] Team_077 possession (Score: 32-48)
Dejounte Quickley attempts a 3Pt. Contested by Dirk Lillard (4.3 feet, MAN). Dejounte Quickley misses. Offensive rebound by Jordan Simmons! Jordan Simmons kicks it out.

[03:35] Team_077 possession (Score: 32-48)
Jordan Simmons drives and kicks out. Tyler Poole attempts a Midrange. Contested by Rudy Quickley (3.3 feet, MAN). TYLER POOLE MAKES IT!
Score: 34-48

[03:21] Team_027 possession (Score: 34-48)
LeBron Russell makes the Layup and draws the foul on Jordan Simmons! And-1! LeBron Russell to the line for 1. [BONUS: 9 team fouls] (Jordan Simmons: 2 personal fouls)   FT 1/1: MISS LeBron Russell makes 0/1 from the line. Rebound secured by Ayo Griffin.
Score: 34-50

[03:04] Team_077 possession (Score: 34-50)
Bam Bryant makes the Layup and draws the foul on Dirk Lillard! And-1! Bam Bryant to the line for 1. [BONUS: 5 team fouls] (Dirk Lillard: 2 personal fouls)   FT 1/1: GOOD Bam Bryant makes 1/1 from the line.
Score: 37-50

[02:50] Team_027 possession (Score: 37-50)
Dirk Lillard attempts a 3Pt. BLOCKED BY DEJOUNTE QUICKLEY! Ball is loose! Rebound secured by Jordan Simmons.

[02:33] Team_077 possession (Score: 37-50)
Bam Bryant attempts a 3Pt. Contested by CJ Green (5.2 feet, MAN). Bam Bryant misses. FOUL! Loose ball foul on Ben Stewart during the rebound battle. [IN THE BONUS! 6 team fouls] Ayo Griffin to the line for 2 free throws. (Ben Stewart: 2 personal fouls)   FT 1/2: MISS   FT 2/2: GOOD Ayo Griffin makes 1/2 from the line.
Score: 38-50

[02:15] Team_027 possession (Score: 38-50)
Dirk Lillard attempts a 3Pt. Contested by Dejounte Quickley (4.3 feet, ZONE). Dirk Lillard misses. Rebound secured by Tyler Poole.

[02:01] Team_077 possession (Score: 38-50)
Tyler Poole drives and kicks out. Jordan Simmons attempts a 3Pt. Contested by Rudy Quickley (3.4 feet, ZONE). Jordan Simmons misses. Rebound secured by Dirk Lillard.

[01:45] Team_027 possession (Score: 38-50)
LeBron Russell attempts a 3Pt. Contested by Jordan Simmons (4.0 feet, MAN). LeBron Russell misses. Rebound secured by Ayo Griffin.

[01:30] Team_077 possession (Score: 38-50)
Ayo Griffin drives to the basket... Ayo Griffin throws a bad pass! Stolen by Ben Stewart! TURNOVER! (live ball)

[01:18] Team_027 possession (Score: 38-50)
FOUL! Holding foul on Jordan Simmons. [IN THE BONUS! 10 team fouls] LeBron Russell to the line for 2 free throws. (Jordan Simmons: 3 personal fouls)   FT 1/2: MISS   FT 2/2: MISS LeBron Russell makes 0/2 from the line. Rebound secured by Tyler Poole.

[01:03] Team_077 possession (Score: 38-50)
Dejounte Quickley attempts a Midrange. Contested by Dirk Lillard (4.4 feet, MAN). DEJOUNTE QUICKLEY MAKES IT! Assist: Tyler Poole
Score: 40-50

[00:50] Team_027 possession (Score: 40-50)
Rudy Quickley attempts a 3Pt. Contested by Tyler Poole (4.8 feet, MAN). Rudy Quickley misses. Offensive rebound by Dirk Lillard! Dirk Lillard kicks it out.

[00:34] Team_027 possession (Score: 40-50)
Rudy Quickley makes the Layup and draws the foul on Jordan Simmons! And-1! Rudy Quickley to the line for 1. [BONUS: 11 team fouls] (Jordan Simmons: 4 personal fouls)   FT 1/1: GOOD Rudy Quickley makes 1/1 from the line.
Score: 40-53

[00:20] Team_077 possession (Score: 40-53)
Dejounte Quickley drives, Dirk Lillard stays with him. Dejounte Quickley attempts a Layup. Contested by Dirk Lillard (4.4 feet, MAN). DEJOUNTE QUICKLEY MAKES IT!
Score: 42-53

[00:05] Team_027 possession (Score: 42-53)
Dirk Lillard attempts a 3Pt. Contested by Dejounte Quickley (4.5 feet, MAN). Dirk Lillard misses. Offensive rebound by Ben Stewart! Ben Stewart puts it back in!
Score: 42-55

================================================================================
                              2ND QUARTER COMPLETE                              
================================================================================

2ND QUARTER SCORE: Team_077 21, Team_027 26

BOX SCORE:
================================================================================

Team_077
--------------------------------------------------------------------------------
Player                MIN  PTS  REB  AST  TO      FG   FG%      3P   3P%
--------------------------------------------------------------------------------
Dejounte Quickley       9    8    0    0   0   4/5    80.0     0/0   0.0
Chris Ginobili         15    3    0    0   0   1/1   100.0     0/0   0.0
Bam Bryant              9    3    0    1   0   1/1   100.0     0/0   0.0
Russell Harden         15    2    2    1   0   1/1   100.0     0/0   0.0
Tyler Poole             9    2    3    1   0   1/2    50.0     0/0   0.0
Ayo Griffin             9    1    3    0   0   1/2    50.0     0/0   0.0
Draymond Dosunmu       15    0    1    0   0   0/0     0.0     0/0   0.0
Ja Ball                15    0    0    0   0   0/1     0.0     0/0   0.0
Jordan Simmons          9    0    3    1   0   0/2     0.0     0/0   0.0

TEAM: FG: 9/15 (60.0%), 3PT: 2/4 (50.0%), REB: 12 (4 off, 8 def), AST: 4, TO: 5
TEAM FOULS: 11 [Team_027 in BONUS]


Team_027
--------------------------------------------------------------------------------
Player                MIN  PTS  REB  AST  TO      FG   FG%      3P   3P%
--------------------------------------------------------------------------------
Dirk Lillard            9    7    3    0   0   3/6    50.0     0/0   0.0
LeBron Russell          9    7    3    0   0   3/5    60.0     0/0   0.0
Rudy Quickley           9    3    0    2   0   1/1   100.0     0/0   0.0
CJ Green                9    3    0    1   0   1/1   100.0     0/0   0.0
John Russell           15    2    1    0   0   1/2    50.0     0/0   0.0
Ben Stewart             9    2    3    0   0   1/1   100.0     0/0   0.0
Bradley Dosunmu        15    0    1    0   0   0/0     0.0     0/0   0.0
Tony Doncic            15    0    1    0   0   0/1     0.0     0/0   0.0

TEAM: FG: 10/18 (55.6%), 3PT: 3/7 (42.9%), REB: 12 (6 off, 6 def), AST: 3, TO: 2
TEAM FOULS: 6 [Team_077 in BONUS]

================================================================================

================================================================================
                       3RD QUARTER - Team_077 vs Team_027                       
================================================================================

[12:00] Team_077 possession (Score: 42-55)
Russell Harden attempts a 3Pt. Contested by Bradley Dosunmu (5.0 feet, MAN). Russell Harden misses. Rebound secured by Tony Doncic.

[11:45] Team_027 possession (Score: 42-55)
FOUL! Offensive foul on John Russell! Draymond Dosunmu drew the charge! [Team fouls: 1] (John Russell: 1 personal fouls) TURNOVER! (dead ball)

[11:30] Team_077 possession (Score: 42-55)
Dejounte Allen makes the Layup and draws the foul on Scottie Harden! And-1! Dejounte Allen to the line for 1. [Team fouls: 2] (Scottie Harden: 1 personal fouls)   FT 1/1: GOOD Dejounte Allen makes 1/1 from the line.
Score: 45-55

[11:17] Team_027 possession (Score: 45-55)
Tony Doncic makes the Layup and draws the foul on Draymond Dosunmu! And-1! Tony Doncic to the line for 1. [Team fouls: 1] (Draymond Dosunmu: 1 personal fouls)   FT 1/1: GOOD Tony Doncic makes 1/1 from the line.
Score: 45-58

[11:02] Team_077 possession (Score: 45-58)
FOUL! Reach-in foul on Scottie Harden during the drive. [Team fouls: 3] No free throws, side out. (Scottie Harden: 2 personal fouls)

[10:47] Team_077 possession (Score: 45-58)
Ja Ball attempts a 3Pt. Contested by Tim Johnson (5.3 feet, ZONE). Ja Ball misses. Rebound secured by Tony Doncic.

[10:33] Team_027 possession (Score: 45-58)
John Russell drives, Draymond Dosunmu stays with him. John Russell attempts a Layup. Contested by Draymond Dosunmu (5.1 feet, MAN). JOHN RUSSELL MAKES IT! Assist: Tim Johnson
Score: 45-60

[10:18] Team_077 possession (Score: 45-60)
FOUL! Shooting foul on Bradley Dosunmu. Russell Harden to the line for 3 free throws. [Team fouls: 4] (Bradley Dosunmu: 1 personal fouls)   FT 1/3: GOOD   FT 2/3: GOOD   FT 3/3: GOOD Russell Harden makes 3/3 from the line.
Score: 48-60

[10:05] Team_027 possession (Score: 48-60)
Scottie Harden attempts a 3Pt. Contested by Dejounte Allen (3.8 feet, ZONE). SCOTTIE HARDEN MAKES IT! Assist: John Russell
Score: 48-63

[09:49] Team_077 possession (Score: 48-63)
Ja Ball attempts a 3Pt. Contested by Tim Johnson (5.3 feet, MAN). JA BALL MAKES IT! Assist: Dejounte Allen
Score: 51-63

[09:34] Team_027 possession (Score: 51-63)
Bradley Dosunmu makes the Layup and draws the foul on Draymond Dosunmu! And-1! Bradley Dosunmu to the line for 1. [Team fouls: 2] (Draymond Dosunmu: 2 personal fouls)   FT 1/1: MISS Bradley Dosunmu makes 0/1 from the line. Rebound secured by Chris Ginobili.
Score: 51-65

[09:22] Team_077 possession (Score: 51-65)
Chris Ginobili attempts a Layup. Contested by Bradley Dosunmu (5.0 feet, ZONE). CHRIS GINOBILI MAKES IT! Assist: Ja Ball
Score: 53-65

[09:11] Team_027 possession (Score: 53-65)
John Russell attempts a Layup. Contested by Draymond Dosunmu (5.1 feet, MAN). John Russell misses. Offensive rebound by John Russell! John Russell puts it back in!
Score: 53-67

[08:56] Team_077 possession (Score: 53-67)
FOUL! Shooting foul on Scottie Harden. Draymond Dosunmu to the line for 2 free throws. [BONUS: 5 team fouls] (Scottie Harden: 3 personal fouls)   FT 1/2: MISS   FT 2/2: GOOD Draymond Dosunmu makes 1/2 from the line.
Score: 54-67

[08:43] Team_027 possession (Score: 54-67)
Tim Johnson attempts a Midrange. Contested by Draymond Dosunmu (4.6 feet, ZONE). Tim Johnson misses. Rebound secured by Chris Ginobili.

[08:30] Team_077 possession (Score: 54-67)
FOUL! Shooting foul on Scottie Harden. Chris Ginobili to the line for 2 free throws. [BONUS: 6 team fouls] (Scottie Harden: 4 personal fouls)   FT 1/2: GOOD   FT 2/2: GOOD Chris Ginobili makes 2/2 from the line.
Score: 56-67

[08:14] Team_027 possession (Score: 56-67)
Scottie Harden attempts a 3Pt. Contested by Chris Ginobili (3.8 feet, MAN). Scottie Harden misses. Rebound secured by Chris Ginobili.

[07:59] Team_077 possession (Score: 56-67)
Russell Harden drives and kicks out. Dejounte Allen attempts a 3Pt. Contested by Tim Johnson (4.9 feet, ZONE). Dejounte Allen misses. Rebound secured by Tony Doncic.

[07:44] Team_027 possession (Score: 56-67)
Tony Doncic attempts a 3Pt. Contested by Dejounte Allen (3.9 feet, MAN). Tony Doncic misses. Offensive rebound by Bradley Dosunmu! Bradley Dosunmu kicks it out.

[07:31] Team_027 possession (Score: 56-67)
FOUL! Offensive foul on John Russell! Draymond Dosunmu drew the charge! [Team fouls: 7] (John Russell: 2 personal fouls) TURNOVER! (dead ball)

[07:16] Team_077 possession (Score: 56-67)
Ja Ball drives, John Russell stays with him. Ja Ball attempts a Layup. Contested by John Russell (4.3 feet, ZONE). Ja Ball misses. Rebound secured by Bradley Dosunmu.

[07:00] Team_027 possession (Score: 56-67)
Tony Doncic attempts a 3Pt. Contested by Dejounte Allen (3.9 feet, MAN). Tony Doncic misses. Rebound secured by Chris Ginobili.

[06:45] Team_077 possession (Score: 56-67)
Draymond Dosunmu attempts a Midrange. Contested by John Russell (3.6 feet, MAN). DRAYMOND DOSUNMU MAKES IT! Assist: Dejounte Allen
Score: 58-67

[06:30] Team_027 possession (Score: 58-67)
Bradley Dosunmu attempts a Layup. Contested by Russell Harden (4.5 feet, MAN). Bradley Dosunmu misses. Rebound secured by Chris Ginobili.

[06:16] Team_077 possession (Score: 58-67)
FOUL! Reach-in foul on Tony Doncic during the drive. [IN THE BONUS! 8 team fouls] Dejounte Allen to the line for 2 free throws. (Tony Doncic: 1 personal fouls)   FT 1/2: GOOD   FT 2/2: GOOD Dejounte Allen makes 2/2 from the line.
Score: 60-67

[06:04] Team_027 possession (Score: 60-67)
Tony Doncic drives to the basket... Tony Doncic throws a bad pass! Stolen by Dejounte Allen! TURNOVER! (live ball)

[05:52] Team_077 possession (Score: 60-67)
Russell Harden attempts a 3Pt. Contested by Bradley Dosunmu (5.0 feet, MAN). Russell Harden misses. Rebound secured by John Russell.

[05:40] Team_027 possession (Score: 60-67)
FOUL! Shooting foul on Dejounte Allen. Tony Doncic to the line for 2 free throws. [Team fouls: 3] (Dejounte Allen: 1 personal fouls)   FT 1/2: GOOD   FT 2/2: GOOD Tony Doncic makes 2/2 from the line.
Score: 60-69

[05:28] Team_077 possession (Score: 60-69)
Ja Ball attempts a Midrange. BLOCKED BY TONY DONCIC! Ball is loose! Rebound secured by John Russell.

[05:17] Team_027 possession (Score: 60-69)
Tim Johnson attempts a Layup. Contested by Ja Ball (4.4 feet, MAN). Tim Johnson misses. Offensive rebound by Bradley Dosunmu! Bradley Dosunmu kicks it out.

[05:06] Team_027 possession (Score: 60-69)
Tony Doncic attempts a 3Pt. Contested by Dejounte Allen (3.9 feet, ZONE). TONY DONCIC MAKES IT! Assist: Scottie Harden
Score: 60-72

[04:52] Team_077 possession (Score: 60-72)
Ja Ball attempts a 3Pt. Contested by Tim Johnson (5.4 feet, MAN). JA BALL MAKES IT!
Score: 63-72

[04:37] Team_027 possession (Score: 63-72)
Tony Doncic attempts a Midrange. Contested by Russell Harden (4.6 feet, ZONE). Tony Doncic misses. Offensive rebound by Bradley Dosunmu! Bradley Dosunmu kicks it out.

[04:20] Team_027 possession (Score: 63-72)
Bradley Dosunmu attempts a 3Pt. Contested by Russell Harden (4.6 feet, MAN). Bradley Dosunmu misses. Rebound secured by Russell Harden.

[04:07] Team_077 possession (Score: 63-72)
Dejounte Allen attempts a Layup. BLOCKED BY JOHN RUSSELL! Ball is loose! Rebound secured by John Russell.

[03:55] Team_027 possession (Score: 63-72)
Bradley Dosunmu attempts a Layup. BLOCKED BY DRAYMOND DOSUNMU! Ball is loose! Rebound secured by Chris Ginobili.

[03:43] Team_077 possession (Score: 63-72)
Ja Ball drives, picks up John Russell. Help arrives from Tony Doncic! Ja Ball attempts a Dunk. Contested by Tony Doncic (4.5 feet, ZONE). Ja Ball misses. Rebound secured by Bradley Dosunmu.

[03:29] Team_027 possession (Score: 63-72)
Bradley Dosunmu attempts a 3Pt. Contested by Dejounte Allen (4.0 feet, ZONE). Bradley Dosunmu misses. Offensive rebound by John Russell! John Russell puts it back in!
Score: 63-74

[03:11] Team_077 possession (Score: 63-74)
Draymond Dosunmu drives to the basket... Draymond Dosunmu loses the ball! Stripped by John Russell! TURNOVER! (live ball)

[03:00] Team_027 possession (Score: 63-74)
Tony Doncic makes the Dunk and draws the foul on Draymond Dosunmu! And-1! Tony Doncic to the line for 1. [Team fouls: 4] (Draymond Dosunmu: 3 personal fouls)   FT 1/1: MISS Tony Doncic makes 0/1 from the line. Rebound secured by Russell Harden.
Score: 63-76

[02:45] Team_077 possession (Score: 63-76)
Draymond Dosunmu drives, John Russell stays with him. Draymond Dosunmu attempts a Dunk. Contested by John Russell (3.9 feet, MAN). Draymond Dosunmu misses. Offensive rebound by Russell Harden! Russell Harden kicks it out.

[02:32] Team_077 possession (Score: 63-76)
Russell Harden makes the Layup and draws the foul on John Russell! And-1! Russell Harden to the line for 1. [BONUS: 9 team fouls] (John Russell: 3 personal fouls)   FT 1/1: GOOD Russell Harden makes 1/1 from the line.
Score: 66-76

[02:18] Team_027 possession (Score: 66-76)
Bradley Dosunmu drives to the basket... Bradley Dosunmu throws a bad pass out of bounds! TURNOVER! (dead ball)

[02:18] Substitution (Team_077): Dejounte Allen OUT → Dejounte Quickley IN (stamina_rule2)

[02:18] Substitution (Team_077): Chris Ginobili OUT → Tyler Poole IN (stamina_rule2)

[02:18] Substitution (Team_077): Russell Harden OUT → Jordan Simmons IN (stamina_rule2)

[02:18] Substitution (Team_077): Draymond Dosunmu OUT → Ayo Griffin IN (stamina_rule2)

[02:18] Substitution (Team_027): Tim Johnson OUT → CJ Green IN (stamina_rule2)

[02:18] Substitution (Team_027): Tony Doncic OUT → Dirk Lillard IN (stamina_rule2)

[02:18] Substitution (Team_027): Scottie Harden OUT → Rudy Quickley IN (stamina_rule2)

[02:18] Substitution (Team_027): Bradley Dosunmu OUT → LeBron Russell IN (stamina_rule2)

[02:18] Substitution (Team_027): John Russell OUT → Ben Stewart IN (stamina_rule2)

[02:07] Team_077 possession (Score: 66-76)
Ayo Griffin attempts a 3Pt. Contested by Ben Stewart (4.5 feet, MAN). Ayo Griffin misses. Rebound secured by LeBron Russell.

[01:49] Team_027 possession (Score: 66-76)
Rudy Quickley attempts a 3Pt. Contested by Tyler Poole (4.6 feet, MAN). RUDY QUICKLEY MAKES IT! Assist: CJ Green
Score: 66-79

[01:29] Team_077 possession (Score: 66-79)
Dejounte Quickley attempts a 3Pt. Contested by Rudy Quickley (3.4 feet, ZONE). Dejounte Quickley misses. FOUL! Loose ball foul on Ben Stewart during the rebound battle. [IN THE BONUS! 10 team fouls] Ayo Griffin to the line for 2 free throws. (Ben Stewart: 1 personal fouls)   FT 1/2: GOOD   FT 2/2: GOOD Ayo Griffin makes 2/2 from the line.
Score: 68-79

[01:17] Team_027 possession (Score: 68-79)
LeBron Russell attempts a Layup. BLOCKED BY JORDAN SIMMONS! Ball is loose! Rebound secured by Ayo Griffin.

[01:05] Team_077 possession (Score: 68-79)
Ayo Griffin drives, picks up Ben Stewart. Help arrives from Dirk Lillard! Ayo Griffin attempts a Dunk. Contested by Dirk Lillard (4.5 feet, MAN). Ayo Griffin misses. Rebound secured by Ben Stewart.

[00:49] Team_027 possession (Score: 68-79)
CJ Green attempts a Midrange. Contested by Ja Ball (4.7 feet, MAN). CJ GREEN MAKES IT! Assist: LeBron Russell
Score: 68-81

[00:36] Team_077 possession (Score: 68-81)
Dejounte Quickley makes the Dunk and draws the foul on Ben Stewart! And-1! Dejounte Quickley to the line for 1. [BONUS: 11 team fouls] (Ben Stewart: 2 personal fouls)   FT 1/1: GOOD Dejounte Quickley makes 1/1 from the line.
Score: 71-81

[00:22] Team_027 possession (Score: 71-81)
CJ Green attempts a Layup. Contested by Ja Ball (4.7 feet, MAN). CJ GREEN MAKES IT!
Score: 71-83

[00:07] Team_077 possession (Score: 71-83)
Ja Ball attempts a 3Pt. Contested by Rudy Quickley (3.7 feet, ZONE). JA BALL MAKES IT! Assist: Dejounte Quickley
Score: 74-83

================================================================================
                              3RD QUARTER COMPLETE                              
================================================================================

3RD QUARTER SCORE: Team_077 32, Team_027 28

BOX SCORE:
================================================================================

Team_077
--------------------------------------------------------------------------------
Player                MIN  PTS  REB  AST  TO      FG   FG%      3P   3P%
--------------------------------------------------------------------------------
Ja Ball                27    9    0    1   0   3/7    42.9     0/0   0.0
Russell Harden         25    6    3    0   0   2/5    40.0     0/0   0.0
Dejounte Allen         25    5    0    2   0   2/3    66.7     0/0   0.0
Chris Ginobili         25    4    6    0   0   2/2   100.0     0/0   0.0
Draymond Dosunmu       25    3    0    0   0   2/2   100.0     0/0   0.0
Dejounte Quickley      12    3    0    1   0   1/1   100.0     0/0   0.0
Ayo Griffin            12    2    1    0   0   1/3    33.3     0/0   0.0

TEAM: FG: 13/23 (56.5%), 3PT: 5/9 (55.6%), REB: 10 (1 off, 9 def), AST: 4, TO: 1
TEAM FOULS: 4


Team_027
--------------------------------------------------------------------------------
Player                MIN  PTS  REB  AST  TO      FG   FG%      3P   3P%
--------------------------------------------------------------------------------
Tony Doncic            25    8    3    0   0   3/5    60.0     0/0   0.0
John Russell           25    6    5    1   0   3/3   100.0     0/0   0.0
CJ Green               12    4    0    1   0   2/2   100.0     0/0   0.0
Scottie Harden         25    3    0    1   0   1/2    50.0     0/0   0.0
Rudy Quickley          12    3    0    0   0   1/1   100.0     0/0   0.0
Tim Johnson            25    0    0    1   0   0/1     0.0     0/0   0.0
Bradley Dosunmu        25    0    5    0   0   0/4     0.0     0/0   0.0
LeBron Russell         12    0    1    1   0   0/1     0.0     0/0   0.0
Ben Stewart            12    0    1    0   0   0/0     0.0     0/0   0.0

TEAM: FG: 10/19 (52.6%), 3PT: 4/7 (57.1%), REB: 15 (5 off, 10 def), AST: 5, TO: 4
TEAM FOULS: 11 [Team_077 in BONUS]

================================================================================

================================================================================
                       4TH QUARTER - Team_077 vs Team_027                       
================================================================================

[12:00] Team_077 possession (Score: 74-83)
Draymond Dosunmu attempts a Layup. Contested by John Russell (3.6 feet, MAN). Draymond Dosunmu misses. Rebound secured by Bradley Dosunmu.

[11:49] Team_027 possession (Score: 74-83)
Scottie Harden attempts a 3Pt. Contested by Chris Ginobili (3.9 feet, MAN). Scottie Harden misses. Rebound secured by Chris Ginobili.

[11:39] Team_077 possession (Score: 74-83)
Chris Ginobili drives to the basket... Chris Ginobili throws a bad pass out of bounds! TURNOVER! (dead ball)

[11:39] Substitution (Team_077): Ja Ball OUT → Bam Bryant IN (stamina_rule2)

[11:25] Team_027 possession (Score: 74-83)
Tony Doncic makes the 3Pt and draws the foul on Dejounte Allen! And-1! Tony Doncic to the line for 1. [Team fouls: 1] (Dejounte Allen: 1 personal fouls)   FT 1/1: GOOD Tony Doncic makes 1/1 from the line.
Score: 74-87

[11:11] Team_077 possession (Score: 74-87)
Chris Ginobili loses control! Ball rolls out of bounds! TURNOVER! (dead ball)

[10:54] Team_027 possession (Score: 74-87)
FOUL! Holding foul on Russell Harden. [Team fouls: 2] No free throws, side out. (Russell Harden: 1 personal fouls)

[10:41] Team_027 possession (Score: 74-87)
John Russell drives and kicks out. Bradley Dosunmu attempts a 3Pt. Contested by Russell Harden (4.6 feet, MAN). Bradley Dosunmu misses. Rebound secured by Draymond Dosunmu.

[10:29] Team_077 possession (Score: 74-87)
Dejounte Allen attempts a 3Pt. Contested by Tony Doncic (4.5 feet, MAN). Dejounte Allen misses. Offensive rebound by Draymond Dosunmu! Draymond Dosunmu kicks it out.

[10:17] Team_077 possession (Score: 74-87)
Bam Bryant attempts a Midrange. Contested by Tim Johnson (5.3 feet, MAN). BAM BRYANT MAKES IT!
Score: 76-87

[10:05] Team_027 possession (Score: 76-87)
Bradley Dosunmu attempts a Midrange. Contested by Russell Harden (4.7 feet, MAN). Bradley Dosunmu misses. Rebound secured by Draymond Dosunmu.

[09:51] Team_077 possession (Score: 76-87)
Draymond Dosunmu attempts a 3Pt. Contested by Tim Johnson (4.8 feet, ZONE). Draymond Dosunmu misses. Offensive rebound by Draymond Dosunmu! Draymond Dosunmu kicks it out.

[09:36] Team_077 possession (Score: 76-87)
Russell Harden attempts a 3Pt. Contested by Tim Johnson (5.7 feet, ZONE). Russell Harden misses. Rebound secured by John Russell.

[09:21] Team_027 possession (Score: 76-87)
Scottie Harden attempts a 3Pt. Contested by Chris Ginobili (4.1 feet, MAN). Scottie Harden misses. Offensive rebound by John Russell! John Russell's putback is no good. Rebound secured by Draymond Dosunmu.

[09:04] Team_077 possession (Score: 76-87)
Dejounte Allen drives, picks up Tony Doncic. Help arrives from Scottie Harden! Dejounte Allen attempts a Layup. Contested by Scottie Harden (4.6 feet, MAN). DEJOUNTE ALLEN MAKES IT! Assist: Draymond Dosunmu
Score: 78-87

[08:52] Team_027 possession (Score: 78-87)
Scottie Harden drives and kicks out. Tim Johnson attempts a 3Pt. Wide open! Bam Bryant is 6.0 feet away. [MAN] Tim Johnson misses. Rebound secured by Draymond Dosunmu.

[08:37] Team_077 possession (Score: 78-87)
Dejounte Allen attempts a Midrange. Contested by Tony Doncic (4.7 feet, MAN). DEJOUNTE ALLEN MAKES IT!
Score: 80-87

[08:27] Team_027 possession (Score: 80-87)
Tony Doncic attempts a Midrange. Contested by Dejounte Allen (4.2 feet, MAN). Tony Doncic misses. Rebound secured by Russell Harden.

[08:17] Team_077 possession (Score: 80-87)
Chris Ginobili attempts a 3Pt. Contested by Scottie Harden (5.5 feet, MAN). Chris Ginobili misses. Rebound secured by John Russell.

[08:07] Team_027 possession (Score: 80-87)
Bradley Dosunmu attempts a Midrange. Contested by Russell Harden (5.0 feet, MAN). Bradley Dosunmu misses. Rebound secured by Russell Harden.

[07:54] Team_077 possession (Score: 80-87)
Chris Ginobili commits a violation (traveling/carry)! TURNOVER! (dead ball)

[07:54] Substitution (Team_077): Dejounte Allen OUT → Dejounte Quickley IN (stamina_rule2)

[07:54] Substitution (Team_077): Chris Ginobili OUT → Tyler Poole IN (stamina_rule2)

[07:54] Substitution (Team_077): Russell Harden OUT → Jordan Simmons IN (stamina_rule2)

[07:54] Substitution (Team_077): Draymond Dosunmu OUT → Ayo Griffin IN (stamina_rule2)

[07:54] Substitution (Team_027): Tim Johnson OUT → CJ Green IN (stamina_rule2)

[07:54] Substitution (Team_027): Tony Doncic OUT → Dirk Lillard IN (stamina_rule2)

[07:54] Substitution (Team_027): Scottie Harden OUT → Rudy Quickley IN (stamina_rule2)

[07:54] Substitution (Team_027): Bradley Dosunmu OUT → LeBron Russell IN (stamina_rule2)

[07:54] Substitution (Team_027): John Russell OUT → Ben Stewart IN (stamina_rule2)

[07:38] Team_027 possession (Score: 80-87)
FOUL! Reach-in foul on Ayo Griffin during the drive. [Team fouls: 3] No free throws, side out. (Ayo Griffin: 1 personal fouls)

[07:27] Team_027 possession (Score: 80-87)
FOUL! Shooting foul on Jordan Simmons. Dirk Lillard to the line for 2 free throws. [Team fouls: 4] (Jordan Simmons: 1 personal fouls)   FT 1/2: GOOD   FT 2/2: GOOD Dirk Lillard makes 2/2 from the line.
Score: 80-89

[07:12] Team_077 possession (Score: 80-89)
Jordan Simmons drives and kicks out. Bam Bryant attempts a Midrange. Contested by CJ Green (5.1 feet, MAN). BAM BRYANT MAKES IT! Assist: Tyler Poole
Score: 82-89

[07:01] Team_027 possession (Score: 82-89)
LeBron Russell makes the Layup and draws the foul on Jordan Simmons! And-1! LeBron Russell to the line for 1. [BONUS: 5 team fouls] (Jordan Simmons: 2 personal fouls)   FT 1/1: GOOD LeBron Russell makes 1/1 from the line.
Score: 82-92

[06:45] Team_077 possession (Score: 82-92)
Ayo Griffin drives, Ben Stewart stays with him. Ayo Griffin attempts a Layup. Contested by Ben Stewart (4.5 feet, MAN). Ayo Griffin misses. Rebound secured by Dirk Lillard.

[06:29] Team_027 possession (Score: 82-92)
LeBron Russell makes the Layup and draws the foul on Dejounte Quickley! And-1! LeBron Russell to the line for 1. [BONUS: 6 team fouls] (Dejounte Quickley: 1 personal fouls)   FT 1/1: GOOD LeBron Russell makes 1/1 from the line.
Score: 82-95

[06:14] Team_077 possession (Score: 82-95)
Jordan Simmons attempts a 3Pt. Contested by Rudy Quickley (3.8 feet, ZONE). Jordan Simmons misses. Rebound secured by LeBron Russell.

[05:54] Team_027 possession (Score: 82-95)
Ben Stewart drives to the basket... Ben Stewart throws a bad pass! Stolen by Ayo Griffin! TURNOVER! (live ball)

[05:41] Team_077 possession (Score: 82-95)
Jordan Simmons attempts a Midrange. Contested by CJ Green (5.5 feet, ZONE). JORDAN SIMMONS MAKES IT! Assist: Bam Bryant
Score: 84-95

[05:27] Team_027 possession (Score: 84-95)
CJ Green attempts a 3Pt. Wide open! Bam Bryant is 6.2 feet away. [MAN] CJ GREEN MAKES IT! Assist: Dirk Lillard
Score: 84-98

[05:16] Team_077 possession (Score: 84-98)
FOUL! Shooting foul on LeBron Russell. Jordan Simmons to the line for 3 free throws. [Team fouls: 1] (LeBron Russell: 1 personal fouls)   FT 1/3: GOOD   FT 2/3: GOOD   FT 3/3: GOOD Jordan Simmons makes 3/3 from the line.
Score: 87-98

[05:03] Team_027 possession (Score: 87-98)
Ben Stewart attempts a Layup. Contested by Jordan Simmons (3.9 feet, ZONE). BEN STEWART MAKES IT! Assist: Rudy Quickley
Score: 87-100

[04:48] Team_077 possession (Score: 87-100)
Jordan Simmons attempts a 3Pt. Contested by Rudy Quickley (3.8 feet, ZONE). Jordan Simmons misses. Rebound secured by Dirk Lillard.

[04:38] Team_027 possession (Score: 87-100)
FOUL! Shooting foul on Jordan Simmons. LeBron Russell to the line for 2 free throws. [BONUS: 7 team fouls] (Jordan Simmons: 3 personal fouls)   FT 1/2: GOOD   FT 2/2: GOOD LeBron Russell makes 2/2 from the line.
Score: 87-102

[04:24] Team_077 possession (Score: 87-102)
Ayo Griffin drives and kicks out. Tyler Poole attempts a Midrange. Contested by Rudy Quickley (3.3 feet, ZONE). Tyler Poole misses. Rebound secured by LeBron Russell.

[04:10] Team_027 possession (Score: 87-102)
Ben Stewart makes the Layup and draws the foul on Ayo Griffin! And-1! Ben Stewart to the line for 1. [BONUS: 8 team fouls] (Ayo Griffin: 2 personal fouls)   FT 1/1: GOOD Ben Stewart makes 1/1 from the line.
Score: 87-105

[03:56] Team_077 possession (Score: 87-105)
Ayo Griffin loses the ball! Stripped by Ben Stewart! TURNOVER! (live ball)

[03:41] Team_027 possession (Score: 87-105)
FOUL! Holding foul on Bam Bryant. [IN THE BONUS! 9 team fouls] CJ Green to the line for 2 free throws. (Bam Bryant: 1 personal fouls)   FT 1/2: MISS   FT 2/2: GOOD CJ Green makes 1/2 from the line.
Score: 87-106

[03:24] Team_077 possession (Score: 87-106)
Tyler Poole attempts a Midrange. Contested by CJ Green (5.5 feet, ZONE). Tyler Poole misses. Rebound secured by Ben Stewart.

[03:14] Team_027 possession (Score: 87-106)
CJ Green attempts a 3Pt. Contested by Dejounte Quickley (4.4 feet, ZONE). CJ Green misses. Rebound secured by Jordan Simmons.

[03:01] Team_077 possession (Score: 87-106)
Bam Bryant attempts a 3Pt. Contested by CJ Green (5.2 feet, MAN). Bam Bryant misses. Offensive rebound by Ayo Griffin! Ayo Griffin puts it back in!
Score: 89-106

[02:49] Team_027 possession (Score: 89-106)
CJ Green drives and kicks out. LeBron Russell attempts a 3Pt. Contested by Dejounte Quickley (4.3 feet, ZONE). LEBRON RUSSELL MAKES IT! Assist: CJ Green
Score: 89-109

[02:31] Team_077 possession (Score: 89-109)
Ayo Griffin drives and kicks out. Tyler Poole attempts a 3Pt. Contested by Rudy Quickley (3.3 feet, MAN). TYLER POOLE MAKES IT! Assist: Ayo Griffin
Score: 92-109

[02:16] Team_027 possession (Score: 92-109)
CJ Green attempts a 3Pt. Wide open! Bam Bryant is 6.4 feet away. [MAN] CJ GREEN MAKES IT! Assist: Ben Stewart
Score: 92-112

[02:02] Team_077 possession (Score: 92-112)
Tyler Poole drives to the basket... FOUL! Offensive foul on Tyler Poole! Rudy Quickley drew the charge! [Team fouls: 10] (Tyler Poole: 1 personal fouls) TURNOVER! (dead ball)

[01:48] Team_027 possession (Score: 92-112)
FOUL! Shooting foul on Jordan Simmons. LeBron Russell to the line for 2 free throws. [BONUS: 11 team fouls] (Jordan Simmons: 4 personal fouls)   FT 1/2: GOOD   FT 2/2: GOOD LeBron Russell makes 2/2 from the line.
Score: 92-114

[01:36] Team_077 possession (Score: 92-114)
FOUL! Shooting foul on Dirk Lillard. Ayo Griffin to the line for 2 free throws. [Team fouls: 2] (Dirk Lillard: 1 personal fouls)   FT 1/2: GOOD   FT 2/2: MISS Ayo Griffin makes 1/2 from the line. Offensive rebound by Jordan Simmons! Jordan Simmons kicks it out.
Score: 93-114

[01:23] Team_077 possession (Score: 93-114)
Jordan Simmons attempts a Layup. Contested by LeBron Russell (6.0 feet, MAN). JORDAN SIMMONS MAKES IT! Assist: Bam Bryant
Score: 95-114

[01:09] Team_027 possession (Score: 95-114)
Dirk Lillard attempts a 3Pt. Contested by Dejounte Quickley (4.4 feet, MAN). Dirk Lillard misses. Rebound secured by Ayo Griffin.

[00:54] Team_077 possession (Score: 95-114)
Bam Bryant attempts a 3Pt. Contested by CJ Green (5.3 feet, MAN). BAM BRYANT MAKES IT! Assist: Tyler Poole
Score: 98-114

[00:40] Team_027 possession (Score: 98-114)
LeBron Russell attempts a 3Pt. BLOCKED BY DEJOUNTE QUICKLEY! Ball is loose! Rebound secured by Ayo Griffin.

[00:27] Team_077 possession (Score: 98-114)
FOUL! Shooting foul on Rudy Quickley. Jordan Simmons to the line for 3 free throws. [Team fouls: 3] (Rudy Quickley: 1 personal fouls)   FT 1/3: GOOD   FT 2/3: MISS   FT 3/3: MISS Jordan Simmons makes 1/3 from the line. Rebound secured by LeBron Russell.
Score: 99-114

[00:11] Team_027 possession (Score: 99-114)
LeBron Russell drives, Jordan Simmons stays with him. LeBron Russell attempts a Layup. Contested by Jordan Simmons (4.2 feet, MAN). LEBRON RUSSELL MAKES IT! Assist: Dirk Lillard
Score: 99-116

================================================================================
                              4TH QUARTER COMPLETE                              
================================================================================

4TH QUARTER SCORE: Team_077 25, Team_027 33

BOX SCORE:
================================================================================

Team_077
--------------------------------------------------------------------------------
Player                MIN  PTS  REB  AST  TO      FG   FG%      3P   3P%
--------------------------------------------------------------------------------
Bam Bryant             21    7    0    2   0   3/3   100.0     0/0   0.0
Jordan Simmons         19    7    2    0   0   3/6    50.0     0/0   0.0
Dejounte Allen         29    4    0    0   0   2/2   100.0     0/0   0.0
Tyler Poole            19    3    0    2   0   1/2    50.0     0/0   0.0
Ayo Griffin            19    2    3    1   0   1/3    33.3     0/0   0.0
Draymond Dosunmu       29    0    6    1   0   0/1     0.0     0/0   0.0
Chris Ginobili         29    0    1    0   0   0/1     0.0     0/0   0.0
Russell Harden         29    0    2    0   0   0/1     0.0     0/0   0.0

TEAM: FG: 10/19 (52.6%), 3PT: 3/8 (37.5%), REB: 13 (4 off, 9 def), AST: 6, TO: 5
TEAM FOULS: 11 [Team_027 in BONUS]


Team_027
--------------------------------------------------------------------------------
Player                MIN  PTS  REB  AST  TO      FG   FG%      3P   3P%
--------------------------------------------------------------------------------
LeBron Russell         19   15    3    0   0   6/7    85.7     0/0   0.0
CJ Green               19    7    0    1   0   3/4    75.0     0/0   0.0
Ben Stewart            19    5    1    1   0   2/2   100.0     0/0   0.0
Tony Doncic            29    4    0    0   0   1/2    50.0     0/0   0.0
Dirk Lillard           19    2    2    2   0   1/2    50.0     0/0   0.0
Bradley Dosunmu        29    0    1    0   0   0/2     0.0     0/0   0.0
Scottie Harden         29    0    0    0   0   0/3     0.0     0/0   0.0
John Russell           29    0    2    0   0   0/1     0.0     0/0   0.0
Rudy Quickley          19    0    0    1   0   0/0     0.0     0/0   0.0

TEAM: FG: 13/23 (56.5%), 3PT: 3/8 (37.5%), REB: 10 (1 off, 9 def), AST: 5, TO: 1
TEAM FOULS: 3

================================================================================

================================================================================
                               FULL GAME COMPLETE                               
================================================================================

FINAL SCORE: Team_077 99, Team_027 116

SCORING BY QUARTER:
--------------------------------------------------------------------------------
Team                     Q1     Q2     Q3     Q4    FINAL
--------------------------------------------------------------------------------
Team_077                 21     21     32     25       99
Team_027                 29     26     28     33      116
--------------------------------------------------------------------------------

FULL GAME BOX SCORE:
================================================================================

Team_077
--------------------------------------------------------------------------------
Player                MIN  PTS  REB  AST  TO      FG   FG%      3P   3P%      FT STL BLK
--------------------------------------------------------------------------------
Dejounte Allen         29   14    0    3   1   6/9    66.7   1/3    33.3   3/4     1   0
Chris Ginobili         29    9    9    1   3   4/7    57.1   1/3    33.3   4/4     0   0
Russell Harden         29   16   12    1   1   7/14   50.0   1/6    16.7   8/8     0   0
Draymond Dosunmu       29    9   11    2   2   5/6    83.3   0/0     0.0   5/6     0   1
Ja Ball                28    9    0    1   1   3/10   30.0   3/7    42.9   0/0     0   0
Bam Bryant             21   10    0    3   2   5/5   100.0   3/3   100.0   1/1     0   0
Dejounte Quickley      19   11    0    1   0   6/7    85.7   1/2    50.0   1/1     0   2
Tyler Poole            19    5    3    3   0   0/2     0.0   0/0     0.0   0/0     0   0
Jordan Simmons         19    7    5    1   1   5/10   50.0   1/4    25.0   4/6     0   1
Ayo Griffin            19    5    7    1   3   1/6    16.7   0/1     0.0   4/6     1   0

TEAM: FG: 42/76 (55.3%), 3PT: 11/29 (37.9%), REB: 46 (12 off, 34 def), AST: 17, TO: 14


Team_027
--------------------------------------------------------------------------------
Player                MIN  PTS  REB  AST  TO      FG   FG%      3P   3P%      FT STL BLK
--------------------------------------------------------------------------------
Tim Johnson            29    8    0    2   0   2/5    40.0   1/3    33.3   3/3     0   0
Tony Doncic            29   15    7    1   3   6/12   50.0   3/6    50.0   4/5     0   1
Scottie Harden         29    6    0    3   2   2/9    22.2   1/6    16.7   1/1     0   0
Bradley Dosunmu        29    9   11    0   0   3/10   30.0   1/2    50.0   2/3     0   0
John Russell           29   14   12    1   2   6/8    75.0   0/0     0.0   0/0     1   2
CJ Green               19   14    0    3   0   6/7    85.7   3/4    75.0   1/2     0   0
Dirk Lillard           19    9    5    2   1   4/8    50.0   2/5    40.0   4/4     0   0
Rudy Quickley          19    6    0    3   2   2/2   100.0   1/1   100.0   1/1     0   0
LeBron Russell         19   22    7    1   0   7/11   63.6   0/2     0.0   9/12    0   0
Ben Stewart            19    7    5    1   0   2/2   100.0   0/0     0.0   1/1     4   0

TEAM: FG: 44/79 (55.7%), 3PT: 12/29 (41.4%), REB: 48 (14 off, 34 def), AST: 17, TO: 10

================================================================================
